[I 2025-08-31 00:28:12,964] Trial 215 finished with values: [-1000000000.0, 1000000000.0] and parameters: {'p_sma': 49, 'p_std': 39, 'p_atr': 13, 'p_adx': 29, 'rsi_period': 40, 'ema1': 26, 'ema2': 17, 'slip_atr_k': 0.16569270750434306, 'slip_spread_k': 0.20248955786244216, 'spread_hl_frac': 0.005572032932615695, 'bb_std_mult': 3.176101494722469, 'rsi_os': 25, 'rsi_ob': 74, 'vol_spike': 0.05629437304368248, 'adx_thresh': 12.200527304281898, 'atr_min_pct': 0.0005813041328233904, 'atr_max_pct': 0.06386504082943975, 'tp_mult': 1.6403700614486978, 'tsl_mult': 0.54668060276256, 'strategy': 'breakout', 'time_stop': 44, 'use_sma': True, 'use_atr': True, 'use_adx': False, 'use_ema': False, 'use_spike': False, 'rsi_required': True, 'edge_k': 0.6772069729141436, 'edge_cap': 0.9506033026499077, 'bull_strategy': 'breakout', 'bull_bb_std_mult': 2.4138678152251045, 'bull_rsi_os': 35, 'bull_rsi_ob': 66, 'bull_adx_thresh': 14.977422225314022, 'bull_atr_min_pct': 0.0005423781465805743, 'bull_atr_max_pct': 0.05009237963893334, 'bull_tp_mult': 2.9606945591274583, 'bull_tsl_mult': 0.6153036605935978, 'bull_time_stop': 154, 'bull_use_sma': False, 'bull_use_ema': True, 'bull_use_atr': True, 'bull_use_adx': True, 'bull_use_spike': False, 'bull_rsi_required': False, 'bear_strategy': 'mean_reversion', 'bear_bb_std_mult': 0.6356541895008485, 'bear_rsi_os': 18, 'bear_rsi_ob': 62, 'bear_adx_thresh': 24.47027122603094, 'bear_atr_min_pct': 0.009680231180788815, 'bear_atr_max_pct': 0.14293742061132234, 'bear_tp_mult': 1.921265095455147, 'bear_tsl_mult': 0.1933667140406324, 'bear_time_stop': 63, 'bear_use_sma': True, 'bear_use_ema': False, 'bear_use_atr': True, 'bear_use_adx': True, 'bear_use_spike': False, 'bear_rsi_required': False, 'sideways_strategy': 'mean_reversion', 'sideways_bb_std_mult': 1.1437926681368495, 'sideways_rsi_os': 44, 'sideways_rsi_ob': 66, 'sideways_adx_thresh': 11.149788542348455, 'sideways_atr_min_pct': 0.009468733803834197, 'sideways_atr_max_pct': 0.1388432576974341, 'sideways_tp_mult': 1.672067796917966, 'sideways_tsl_mult': 0.21946006057455084, 'sideways_time_stop': 104, 'sideways_use_sma': False, 'sideways_use_ema': False, 'sideways_use_atr': False, 'sideways_use_adx': False, 'sideways_use_spike': True, 'sideways_rsi_required': False}.
[I 2025-08-31 00:28:13,326] Trial 216 finished with values: [-0.0207107286308319, 0.020636128169269262] and parameters: {'p_sma': 23, 'p_std': 37, 'p_atr': 13, 'p_adx': 8, 'rsi_period': 41, 'ema1': 10, 'ema2': 23, 'slip_atr_k': 0.12187124875976188, 'slip_spread_k': 0.9732157424747617, 'spread_hl_frac': 0.031036479209452374, 'bb_std_mult': 3.4885937556205393, 'rsi_os': 48, 'rsi_ob': 76, 'vol_spike': 0.02705753598109219, 'adx_thresh': 29.267839630229382, 'atr_min_pct': 0.0005950106497900603, 'atr_max_pct': 0.06586346557110928, 'tp_mult': 2.603217137227347, 'tsl_mult': 0.7618634587538559, 'strategy': 'mean_reversion', 'time_stop': 32, 'use_sma': True, 'use_atr': True, 'use_adx': True, 'use_ema': False, 'use_spike': False, 'rsi_required': True, 'edge_k': 0.6789224232059394, 'edge_cap': 0.9405173852571951, 'bull_strategy': 'breakout', 'bull_bb_std_mult': 2.629873468142994, 'bull_rsi_os': 38, 'bull_rsi_ob': 46, 'bull_adx_thresh': 14.94276652051115, 'bull_atr_min_pct': 9.115687421430864e-05, 'bull_atr_max_pct': 0.05064095296180844, 'bull_tp_mult': 2.9533063686103826, 'bull_tsl_mult': 0.6531362081709476, 'bull_time_stop': 154, 'bull_use_sma': False, 'bull_use_ema': True, 'bull_use_atr': True, 'bull_use_adx': True, 'bull_use_spike': False, 'bull_rsi_required': False, 'bear_strategy': 'breakout', 'bear_bb_std_mult': 0.5032590294812282, 'bear_rsi_os': 18, 'bear_rsi_ob': 62, 'bear_adx_thresh': 24.441813011496457, 'bear_atr_min_pct': 0.022018582716499098, 'bear_atr_max_pct': 0.14015198731359554, 'bear_tp_mult': 2.994536913756881, 'bear_tsl_mult': 0.19980536727115394, 'bear_time_stop': 64, 'bear_use_sma': False, 'bear_use_ema': False, 'bear_use_atr': True, 'bear_use_adx': True, 'bear_use_spike': False, 'bear_rsi_required': False, 'sideways_strategy': 'breakout', 'sideways_bb_std_mult': 1.155158740999155, 'sideways_rsi_os': 44, 'sideways_rsi_ob': 54, 'sideways_adx_thresh': 11.873894332058418, 'sideways_atr_min_pct': 0.027900481638723006, 'sideways_atr_max_pct': 0.1391545807517313, 'sideways_tp_mult': 1.1909474642341586, 'sideways_tsl_mult': 0.2173254362526768, 'sideways_time_stop': 186, 'sideways_use_sma': False, 'sideways_use_ema': False, 'sideways_use_atr': True, 'sideways_use_adx': False, 'sideways_use_spike': True, 'sideways_rsi_required': False}.
[I 2025-08-31 00:28:13,505] Trial 218 finished with values: [-1000000000.0, 1000000000.0] and parameters: {'p_sma': 23, 'p_std': 39, 'p_atr': 13, 'p_adx': 8, 'rsi_period': 19, 'ema1': 26, 'ema2': 23, 'slip_atr_k': 0.16671302824578157, 'slip_spread_k': 0.2233312668432703, 'spread_hl_frac': 0.00704954658924262, 'bb_std_mult': 3.1537558465682287, 'rsi_os': 25, 'rsi_ob': 83, 'vol_spike': 0.03047973469192495, 'adx_thresh': 13.021259426933685, 'atr_min_pct': 0.0005043356726496975, 'atr_max_pct': 0.11757101471273185, 'tp_mult': 2.603787782029814, 'tsl_mult': 0.3255635182819026, 'strategy': 'mean_reversion', 'time_stop': 32, 'use_sma': True, 'use_atr': True, 'use_adx': True, 'use_ema': False, 'use_spike': False, 'rsi_required': True, 'edge_k': 0.6792915020979691, 'edge_cap': 0.8907752737768371, 'bull_strategy': 'breakout', 'bull_bb_std_mult': 2.082130780828467, 'bull_rsi_os': 38, 'bull_rsi_ob': 66, 'bull_adx_thresh': 15.038847225824762, 'bull_atr_min_pct': 0.0005233334162667237, 'bull_atr_max_pct': 0.06376901662952136, 'bull_tp_mult': 2.9484066048494415, 'bull_tsl_mult': 0.6122584314018807, 'bull_time_stop': 119, 'bull_use_sma': False, 'bull_use_ema': True, 'bull_use_atr': True, 'bull_use_adx': True, 'bull_use_spike': False, 'bull_rsi_required': False, 'bear_strategy': 'breakout', 'bear_bb_std_mult': 2.907163896648504, 'bear_rsi_os': 18, 'bear_rsi_ob': 78, 'bear_adx_thresh': 24.87325766986499, 'bear_atr_min_pct': 0.008817387209896596, 'bear_atr_max_pct': 0.143636317168903, 'bear_tp_mult': 1.8578981929052165, 'bear_tsl_mult': 0.9854393801989472, 'bear_time_stop': 63, 'bear_use_sma': False, 'bear_use_ema': False, 'bear_use_atr': True, 'bear_use_adx': True, 'bear_use_spike': False, 'bear_rsi_required': False, 'sideways_strategy': 'breakout', 'sideways_bb_std_mult': 1.1436150532790783, 'sideways_rsi_os': 26, 'sideways_rsi_ob': 67, 'sideways_adx_thresh': 23.265829927230342, 'sideways_atr_min_pct': 0.013014086824467249, 'sideways_atr_max_pct': 0.1393495639882215, 'sideways_tp_mult': 1.0291041657047137, 'sideways_tsl_mult': 0.34608794627735817, 'sideways_time_stop': 104, 'sideways_use_sma': False, 'sideways_use_ema': False, 'sideways_use_atr': True, 'sideways_use_adx': False, 'sideways_use_spike': True, 'sideways_rsi_required': False}.
[I 2025-08-31 00:28:14,207] Trial 219 finished with values: [-1000000000.0, 1000000000.0] and parameters: {'p_sma': 49, 'p_std': 39, 'p_atr': 12, 'p_adx': 24, 'rsi_period': 20, 'ema1': 26, 'ema2': 20, 'slip_atr_k': 0.040644480303855764, 'slip_spread_k': 0.19930064345212556, 'spread_hl_frac': 0.005565411333673985, 'bb_std_mult': 3.1480235943969452, 'rsi_os': 54, 'rsi_ob': 76, 'vol_spike': 0.2720489873937662, 'adx_thresh': 12.949443411741122, 'atr_min_pct': 0.013754844972953883, 'atr_max_pct': 0.05856460460196744, 'tp_mult': 2.601475153700945, 'tsl_mult': 0.3267054122708062, 'strategy': 'breakout', 'time_stop': 78, 'use_sma': True, 'use_atr': True, 'use_adx': False, 'use_ema': False, 'use_spike': False, 'rsi_required': True, 'edge_k': 0.8219221878718969, 'edge_cap': 0.9039923997156405, 'bull_strategy': 'breakout', 'bull_bb_std_mult': 2.1439750039065784, 'bull_rsi_os': 38, 'bull_rsi_ob': 66, 'bull_adx_thresh': 14.941042792409355, 'bull_atr_min_pct': 2.0625028377621474e-05, 'bull_atr_max_pct': 0.04717983396289676, 'bull_tp_mult': 2.8513229095451336, 'bull_tsl_mult': 0.6162132169406832, 'bull_time_stop': 152, 'bull_use_sma': False, 'bull_use_ema': True, 'bull_use_atr': True, 'bull_use_adx': False, 'bull_use_spike': False, 'bull_rsi_required': False, 'bear_strategy': 'breakout', 'bear_bb_std_mult': 2.9243186267392964, 'bear_rsi_os': 24, 'bear_rsi_ob': 76, 'bear_adx_thresh': 33.44765735846112, 'bear_atr_min_pct': 0.008760617033379858, 'bear_atr_max_pct': 0.06626161881845768, 'bear_tp_mult': 2.0820420423011488, 'bear_tsl_mult': 0.19691974705140877, 'bear_time_stop': 48, 'bear_use_sma': False, 'bear_use_ema': False, 'bear_use_atr': True, 'bear_use_adx': False, 'bear_use_spike': False, 'bear_rsi_required': False, 'sideways_strategy': 'mean_reversion', 'sideways_bb_std_mult': 1.1561990243236897, 'sideways_rsi_os': 17, 'sideways_rsi_ob': 54, 'sideways_adx_thresh': 10.16795173864237, 'sideways_atr_min_pct': 0.027053371455086055, 'sideways_atr_max_pct': 0.1403914593506138, 'sideways_tp_mult': 2.6099931399595775, 'sideways_tsl_mult': 0.34854963505400033, 'sideways_time_stop': 104, 'sideways_use_sma': False, 'sideways_use_ema': False, 'sideways_use_atr': False, 'sideways_use_adx': False, 'sideways_use_spike': False, 'sideways_rsi_required': False}.
[I 2025-08-31 00:28:14,637] Trial 221 finished with values: [-1000000000.0, 1000000000.0] and parameters: {'p_sma': 21, 'p_std': 35, 'p_atr': 12, 'p_adx': 23, 'rsi_period': 19, 'ema1': 28, 'ema2': 23, 'slip_atr_k': 0.19018830076888288, 'slip_spread_k': 0.5240318269418844, 'spread_hl_frac': 0.007197689062552259, 'bb_std_mult': 2.334055970425996, 'rsi_os': 54, 'rsi_ob': 64, 'vol_spike': 0.1547867840148191, 'adx_thresh': 18.978420630477434, 'atr_min_pct': 2.778001469502358e-05, 'atr_max_pct': 0.06667647645464425, 'tp_mult': 2.615207615013323, 'tsl_mult': 0.32588871175036066, 'strategy': 'mean_reversion', 'time_stop': 79, 'use_sma': False, 'use_atr': False, 'use_adx': False, 'use_ema': False, 'use_spike': True, 'rsi_required': True, 'edge_k': 0.8394316962252859, 'edge_cap': 0.7431290432974542, 'bull_strategy': 'breakout', 'bull_bb_std_mult': 1.434583366215711, 'bull_rsi_os': 47, 'bull_rsi_ob': 95, 'bull_adx_thresh': 13.53440525431269, 'bull_atr_min_pct': 0.016701559518930882, 'bull_atr_max_pct': 0.0715179455987772, 'bull_tp_mult': 2.6539945945275254, 'bull_tsl_mult': 0.5356733959138557, 'bull_time_stop': 150, 'bull_use_sma': False, 'bull_use_ema': True, 'bull_use_atr': False, 'bull_use_adx': False, 'bull_use_spike': True, 'bull_rsi_required': True, 'bear_strategy': 'breakout', 'bear_bb_std_mult': 0.6875955280952835, 'bear_rsi_os': 14, 'bear_rsi_ob': 56, 'bear_adx_thresh': 10.9046222387552, 'bear_atr_min_pct': 0.00842134033018983, 'bear_atr_max_pct': 0.09145133683256841, 'bear_tp_mult': 2.003084027699444, 'bear_tsl_mult': 0.30784461235170624, 'bear_time_stop': 53, 'bear_use_sma': False, 'bear_use_ema': True, 'bear_use_atr': True, 'bear_use_adx': False, 'bear_use_spike': False, 'bear_rsi_required': False, 'sideways_strategy': 'breakout', 'sideways_bb_std_mult': 1.3428813303753913, 'sideways_rsi_os': 17, 'sideways_rsi_ob': 66, 'sideways_adx_thresh': 23.364785145740736, 'sideways_atr_min_pct': 0.0024012159705536027, 'sideways_atr_max_pct': 0.1404705380055879, 'sideways_tp_mult': 2.6201385339525007, 'sideways_tsl_mult': 0.3473056432110967, 'sideways_time_stop': 94, 'sideways_use_sma': False, 'sideways_use_ema': True, 'sideways_use_atr': True, 'sideways_use_adx': True, 'sideways_use_spike': False, 'sideways_rsi_required': False}.
[I 2025-08-31 00:28:14,662] Trial 223 finished with values: [-1000000000.0, 1000000000.0] and parameters: {'p_sma': 57, 'p_std': 36, 'p_atr': 27, 'p_adx': 8, 'rsi_period': 46, 'ema1': 11, 'ema2': 45, 'slip_atr_k': 0.18355496770369276, 'slip_spread_k': 0.04159945691958633, 'spread_hl_frac': 0.011909203690863275, 'bb_std_mult': 2.4779437864003073, 'rsi_os': 39, 'rsi_ob': 64, 'vol_spike': 0.010546414807561168, 'adx_thresh': 22.084012723631904, 'atr_min_pct': 0.024990831366159955, 'atr_max_pct': 0.015339667551794015, 'tp_mult': 2.5396912579250466, 'tsl_mult': 0.4663390482507729, 'strategy': 'breakout', 'time_stop': 241, 'use_sma': False, 'use_atr': False, 'use_adx': False, 'use_ema': False, 'use_spike': True, 'rsi_required': True, 'edge_k': 0.8838772024528453, 'edge_cap': 0.9166268239876623, 'bull_strategy': 'breakout', 'bull_bb_std_mult': 3.5260795992988934, 'bull_rsi_os': 45, 'bull_rsi_ob': 67, 'bull_adx_thresh': 13.546867541373878, 'bull_atr_min_pct': 0.028837662824444887, 'bull_atr_max_pct': 0.02753835551655215, 'bull_tp_mult': 1.4451268376805242, 'bull_tsl_mult': 0.2593960011404681, 'bull_time_stop': 93, 'bull_use_sma': False, 'bull_use_ema': True, 'bull_use_atr': False, 'bull_use_adx': False, 'bull_use_spike': True, 'bull_rsi_required': True, 'bear_strategy': 'breakout', 'bear_bb_std_mult': 0.7192408870150238, 'bear_rsi_os': 20, 'bear_rsi_ob': 56, 'bear_adx_thresh': 10.925473974503088, 'bear_atr_min_pct': 0.007974471100912994, 'bear_atr_max_pct': 0.13322677092280127, 'bear_tp_mult': 1.0121272893768491, 'bear_tsl_mult': 0.7967188969961211, 'bear_time_stop': 55, 'bear_use_sma': False, 'bear_use_ema': True, 'bear_use_atr': True, 'bear_use_adx': False, 'bear_use_spike': False, 'bear_rsi_required': True, 'sideways_strategy': 'mean_reversion', 'sideways_bb_std_mult': 1.3476965131600789, 'sideways_rsi_os': 47, 'sideways_rsi_ob': 66, 'sideways_adx_thresh': 21.772019729186447, 'sideways_atr_min_pct': 0.006676197612789366, 'sideways_atr_max_pct': 0.1424942588747348, 'sideways_tp_mult': 1.1669394362656709, 'sideways_tsl_mult': 0.5357895322711131, 'sideways_time_stop': 92, 'sideways_use_sma': True, 'sideways_use_ema': True, 'sideways_use_atr': False, 'sideways_use_adx': True, 'sideways_use_spike': False, 'sideways_rsi_required': True}.
[I 2025-08-31 00:28:42,833] Trial 222 finished with values: [-1000000000.0, 1000000000.0] and parameters: {'p_sma': 36, 'p_std': 26, 'p_atr': 8, 'p_adx': 27, 'rsi_period': 53, 'ema1': 9, 'ema2': 20, 'slip_atr_k': 0.24407247800080878, 'slip_spread_k': 0.047915252141820686, 'spread_hl_frac': 0.03094143908558036, 'bb_std_mult': 3.255449096762016, 'rsi_os': 46, 'rsi_ob': 76, 'vol_spike': 0.25890994450835403, 'adx_thresh': 12.999370271635748, 'atr_min_pct': 0.023173820278547544, 'atr_max_pct': 0.05854834152277991, 'tp_mult': 2.691699311745156, 'tsl_mult': 0.11629507556733007, 'strategy': 'breakout', 'time_stop': 241, 'use_sma': False, 'use_atr': False, 'use_adx': False, 'use_ema': False, 'use_spike': True, 'rsi_required': True, 'edge_k': 1.0258342719691629, 'edge_cap': 0.9089528411829214, 'bull_strategy': 'breakout', 'bull_bb_std_mult': 2.1283912131799756, 'bull_rsi_os': 53, 'bull_rsi_ob': 67, 'bull_adx_thresh': 13.522390379603912, 'bull_atr_min_pct': 0.020620937083044313, 'bull_atr_max_pct': 0.07122460988689838, 'bull_tp_mult': 2.86850084011628, 'bull_tsl_mult': 0.2560964550164725, 'bull_time_stop': 152, 'bull_use_sma': False, 'bull_use_ema': True, 'bull_use_atr': False, 'bull_use_adx': False, 'bull_use_spike': True, 'bull_rsi_required': True, 'bear_strategy': 'breakout', 'bear_bb_std_mult': 0.714406619371325, 'bear_rsi_os': 34, 'bear_rsi_ob': 76, 'bear_adx_thresh': 32.2992610083989, 'bear_atr_min_pct': 0.011766990714317974, 'bear_atr_max_pct': 0.06505932595412171, 'bear_tp_mult': 2.0103112065389555, 'bear_tsl_mult': 0.11666276779678192, 'bear_time_stop': 53, 'bear_use_sma': False, 'bear_use_ema': True, 'bear_use_atr': True, 'bear_use_adx': False, 'bear_use_spike': False, 'bear_rsi_required': True, 'sideways_strategy': 'mean_reversion', 'sideways_bb_std_mult': 3.3135206508502977, 'sideways_rsi_os': 45, 'sideways_rsi_ob': 94, 'sideways_adx_thresh': 10.093884711516285, 'sideways_atr_min_pct': 0.023427846925677065, 'sideways_atr_max_pct': 0.14148786461673546, 'sideways_tp_mult': 1.1760632526969794, 'sideways_tsl_mult': 0.3989464222399721, 'sideways_time_stop': 93, 'sideways_use_sma': False, 'sideways_use_ema': True, 'sideways_use_atr': False, 'sideways_use_adx': True, 'sideways_use_spike': False, 'sideways_rsi_required': False}.
[I 2025-08-31 00:28:43,502] Trial 220 finished with values: [-1000000000.0, 1000000000.0] and parameters: {'p_sma': 23, 'p_std': 40, 'p_atr': 12, 'p_adx': 23, 'rsi_period': 46, 'ema1': 27, 'ema2': 23, 'slip_atr_k': 0.1936270734212837, 'slip_spread_k': 0.1887796413022207, 'spread_hl_frac': 0.006699208040553083, 'bb_std_mult': 3.1400478762227686, 'rsi_os': 54, 'rsi_ob': 76, 'vol_spike': 0.0005146287963266639, 'adx_thresh': 29.63804707035672, 'atr_min_pct': 7.117695055331135e-05, 'atr_max_pct': 0.015663781239279487, 'tp_mult': 2.6042266176624285, 'tsl_mult': 0.20768621109560143, 'strategy': 'breakout', 'time_stop': 244, 'use_sma': False, 'use_atr': False, 'use_adx': True, 'use_ema': False, 'use_spike': True, 'rsi_required': True, 'edge_k': 0.8200229574366388, 'edge_cap': 0.8995531834558578, 'bull_strategy': 'breakout', 'bull_bb_std_mult': 1.0248929692085322, 'bull_rsi_os': 38, 'bull_rsi_ob': 65, 'bull_adx_thresh': 13.396711037582332, 'bull_atr_min_pct': 3.26481985468964e-05, 'bull_atr_max_pct': 0.09993091670337652, 'bull_tp_mult': 2.661023271588964, 'bull_tsl_mult': 0.2910934135052472, 'bull_time_stop': 158, 'bull_use_sma': False, 'bull_use_ema': True, 'bull_use_atr': False, 'bull_use_adx': False, 'bull_use_spike': True, 'bull_rsi_required': True, 'bear_strategy': 'breakout', 'bear_bb_std_mult': 2.9621537413739056, 'bear_rsi_os': 20, 'bear_rsi_ob': 76, 'bear_adx_thresh': 30.346464638751105, 'bear_atr_min_pct': 0.008860028199952867, 'bear_atr_max_pct': 0.010803322534855914, 'bear_tp_mult': 2.7431766551804744, 'bear_tsl_mult': 0.11650445543050617, 'bear_time_stop': 53, 'bear_use_sma': False, 'bear_use_ema': True, 'bear_use_atr': True, 'bear_use_adx': False, 'bear_use_spike': False, 'bear_rsi_required': False, 'sideways_strategy': 'mean_reversion', 'sideways_bb_std_mult': 1.172185339135936, 'sideways_rsi_os': 8, 'sideways_rsi_ob': 67, 'sideways_adx_thresh': 23.207486478327347, 'sideways_atr_min_pct': 0.022530756792546285, 'sideways_atr_max_pct': 0.14054302320771253, 'sideways_tp_mult': 1.195663109454148, 'sideways_tsl_mult': 0.34282583578130954, 'sideways_time_stop': 81, 'sideways_use_sma': False, 'sideways_use_ema': True, 'sideways_use_atr': True, 'sideways_use_adx': True, 'sideways_use_spike': False, 'sideways_rsi_required': False}.
[I 2025-08-31 00:28:45,127] Trial 225 finished with values: [-1000000000.0, 1000000000.0] and parameters: {'p_sma': 7, 'p_std': 29, 'p_atr': 8, 'p_adx': 7, 'rsi_period': 43, 'ema1': 23, 'ema2': 20, 'slip_atr_k': 0.21898646086817292, 'slip_spread_k': 0.15776755505906082, 'spread_hl_frac': 0.016574223641956126, 'bb_std_mult': 0.5024310757085824, 'rsi_os': 46, 'rsi_ob': 56, 'vol_spike': 0.0012948145702126601, 'adx_thresh': 16.248189459289627, 'atr_min_pct': 0.01808157230119282, 'atr_max_pct': 0.09647155882677905, 'tp_mult': 2.6989110848937856, 'tsl_mult': 0.114317223506047, 'strategy': 'breakout', 'time_stop': 247, 'use_sma': True, 'use_atr': False, 'use_adx': True, 'use_ema': False, 'use_spike': False, 'rsi_required': True, 'edge_k': 0.808989899592556, 'edge_cap': 0.6886918421183703, 'bull_strategy': 'breakout', 'bull_bb_std_mult': 2.2498068109648055, 'bull_rsi_os': 37, 'bull_rsi_ob': 93, 'bull_adx_thresh': 14.270097791863062, 'bull_atr_min_pct': 0.018944967705125784, 'bull_atr_max_pct': 0.0946748742329852, 'bull_tp_mult': 2.3748994341884355, 'bull_tsl_mult': 0.28245885943328164, 'bull_time_stop': 159, 'bull_use_sma': False, 'bull_use_ema': False, 'bull_use_atr': False, 'bull_use_adx': True, 'bull_use_spike': False, 'bull_rsi_required': False, 'bear_strategy': 'breakout', 'bear_bb_std_mult': 0.6035352875595058, 'bear_rsi_os': 34, 'bear_rsi_ob': 76, 'bear_adx_thresh': 19.992362420273796, 'bear_atr_min_pct': 0.0021954327188939, 'bear_atr_max_pct': 0.012109829923765927, 'bear_tp_mult': 1.9534968118014444, 'bear_tsl_mult': 0.6332658252696832, 'bear_time_stop': 48, 'bear_use_sma': False, 'bear_use_ema': False, 'bear_use_atr': False, 'bear_use_adx': True, 'bear_use_spike': False, 'bear_rsi_required': False, 'sideways_strategy': 'mean_reversion', 'sideways_bb_std_mult': 1.1844381996163764, 'sideways_rsi_os': 45, 'sideways_rsi_ob': 69, 'sideways_adx_thresh': 12.975936878507275, 'sideways_atr_min_pct': 0.02252375165712704, 'sideways_atr_max_pct': 0.13597223285728804, 'sideways_tp_mult': 1.12413618430584, 'sideways_tsl_mult': 0.4079543994937983, 'sideways_time_stop': 111, 'sideways_use_sma': False, 'sideways_use_ema': False, 'sideways_use_atr': False, 'sideways_use_adx': False, 'sideways_use_spike': True, 'sideways_rsi_required': False}.
