[I 2025-08-31 02:32:42,285] Trial 550 finished with values: [-1000000000.0, 1000000000.0] and parameters: {'p_sma': 52, 'p_std': 50, 'p_atr': 29, 'p_adx': 16, 'rsi_period': 68, 'ema1': 5, 'ema2': 28, 'slip_atr_k': 0.10821203620483898, 'slip_spread_k': 0.16579264295706359, 'spread_hl_frac': 0.002079924251431969, 'bb_std_mult': 1.65839577100524, 'rsi_os': 35, 'rsi_ob': 67, 'vol_spike': 0.1916182019833074, 'adx_thresh': 20.79427568269267, 'atr_min_pct': 0.008973711979809553, 'atr_max_pct': 0.11451039577921049, 'tp_mult': 1.7966934956607394, 'tsl_mult': 0.28277530632956505, 'strategy': 'mean_reversion', 'time_stop': 103, 'use_sma': False, 'use_atr': True, 'use_adx': True, 'use_ema': False, 'use_spike': True, 'rsi_required': True, 'edge_k': 0.621355153958105, 'edge_cap': 0.17193344239124939, 'bull_strategy': 'breakout', 'bull_bb_std_mult': 2.1139443843376013, 'bull_rsi_os': 12, 'bull_rsi_ob': 58, 'bull_adx_thresh': 7.419858372094956, 'bull_atr_min_pct': 0.015825167944966363, 'bull_atr_max_pct': 0.13394233425559948, 'bull_tp_mult': 2.3011878965424746, 'bull_tsl_mult': 0.289272726569976, 'bull_time_stop': 143, 'bull_use_sma': True, 'bull_use_ema': False, 'bull_use_atr': False, 'bull_use_adx': True, 'bull_use_spike': True, 'bull_rsi_required': True, 'bear_strategy': 'mean_reversion', 'bear_bb_std_mult': 1.2790826021278145, 'bear_rsi_os': 18, 'bear_rsi_ob': 47, 'bear_adx_thresh': 5.56344908357372, 'bear_atr_min_pct': 0.006930324083031135, 'bear_atr_max_pct': 0.010157711076154596, 'bear_tp_mult': 2.2106349168711796, 'bear_tsl_mult': 0.5453453083029836, 'bear_time_stop': 9, 'bear_use_sma': False, 'bear_use_ema': True, 'bear_use_atr': False, 'bear_use_adx': False, 'bear_use_spike': False, 'bear_rsi_required': True, 'sideways_strategy': 'breakout', 'sideways_bb_std_mult': 0.6517289343150435, 'sideways_rsi_os': 37, 'sideways_rsi_ob': 95, 'sideways_adx_thresh': 6.911847356589812, 'sideways_atr_min_pct': 0.028321965207841006, 'sideways_atr_max_pct': 0.05648056841105249, 'sideways_tp_mult': 1.6712454605942841, 'sideways_tsl_mult': 0.6420772866060364, 'sideways_time_stop': 203, 'sideways_use_sma': False, 'sideways_use_ema': False, 'sideways_use_atr': False, 'sideways_use_adx': True, 'sideways_use_spike': True, 'sideways_rsi_required': True}.
[I 2025-08-31 02:32:42,430] Trial 551 finished with values: [-1000000000.0, 1000000000.0] and parameters: {'p_sma': 52, 'p_std': 50, 'p_atr': 29, 'p_adx': 16, 'rsi_period': 71, 'ema1': 5, 'ema2': 26, 'slip_atr_k': 0.06875717458438173, 'slip_spread_k': 0.16344815218228037, 'spread_hl_frac': 0.0022388302494764853, 'bb_std_mult': 1.6606801658258223, 'rsi_os': 35, 'rsi_ob': 67, 'vol_spike': 0.18151425459810028, 'adx_thresh': 20.57930306164493, 'atr_min_pct': 0.008962061304004523, 'atr_max_pct': 0.11445080187331058, 'tp_mult': 2.008651156124113, 'tsl_mult': 0.275188603235172, 'strategy': 'mean_reversion', 'time_stop': 103, 'use_sma': False, 'use_atr': True, 'use_adx': True, 'use_ema': False, 'use_spike': True, 'rsi_required': True, 'edge_k': 0.6178363674315597, 'edge_cap': 0.10316281986728523, 'bull_strategy': 'breakout', 'bull_bb_std_mult': 2.1098330749781975, 'bull_rsi_os': 20, 'bull_rsi_ob': 54, 'bull_adx_thresh': 7.779937587099451, 'bull_atr_min_pct': 0.005404211233906321, 'bull_atr_max_pct': 0.13283318552391146, 'bull_tp_mult': 2.3094659966371647, 'bull_tsl_mult': 0.8978033638911349, 'bull_time_stop': 142, 'bull_use_sma': True, 'bull_use_ema': False, 'bull_use_atr': False, 'bull_use_adx': True, 'bull_use_spike': True, 'bull_rsi_required': True, 'bear_strategy': 'mean_reversion', 'bear_bb_std_mult': 1.2500475267671094, 'bear_rsi_os': 18, 'bear_rsi_ob': 47, 'bear_adx_thresh': 6.1485485583270725, 'bear_atr_min_pct': 0.0050397690361748924, 'bear_atr_max_pct': 0.012520276124666519, 'bear_tp_mult': 2.0597982352783935, 'bear_tsl_mult': 0.5560884869736047, 'bear_time_stop': 10, 'bear_use_sma': False, 'bear_use_ema': True, 'bear_use_atr': False, 'bear_use_adx': False, 'bear_use_spike': False, 'bear_rsi_required': True, 'sideways_strategy': 'breakout', 'sideways_bb_std_mult': 0.5025260498891041, 'sideways_rsi_os': 37, 'sideways_rsi_ob': 95, 'sideways_adx_thresh': 9.427564354895413, 'sideways_atr_min_pct': 0.028473484448504865, 'sideways_atr_max_pct': 0.055978627622212375, 'sideways_tp_mult': 1.6812596025513156, 'sideways_tsl_mult': 0.6433189246736979, 'sideways_time_stop': 200, 'sideways_use_sma': False, 'sideways_use_ema': False, 'sideways_use_atr': False, 'sideways_use_adx': True, 'sideways_use_spike': True, 'sideways_rsi_required': True}.
[I 2025-08-31 02:32:42,547] Trial 549 finished with values: [-1000000000.0, 1000000000.0] and parameters: {'p_sma': 52, 'p_std': 51, 'p_atr': 28, 'p_adx': 28, 'rsi_period': 74, 'ema1': 5, 'ema2': 41, 'slip_atr_k': 0.06233445518526114, 'slip_spread_k': 0.18389941281820357, 'spread_hl_frac': 0.002550146879769917, 'bb_std_mult': 1.6534013290892045, 'rsi_os': 37, 'rsi_ob': 68, 'vol_spike': 0.18170525751314662, 'adx_thresh': 20.752882204725715, 'atr_min_pct': 0.008849993610067728, 'atr_max_pct': 0.12403891504186344, 'tp_mult': 1.9780385033095937, 'tsl_mult': 0.22801110293001658, 'strategy': 'mean_reversion', 'time_stop': 114, 'use_sma': False, 'use_atr': False, 'use_adx': False, 'use_ema': False, 'use_spike': False, 'rsi_required': True, 'edge_k': 0.620549823018094, 'edge_cap': 0.10210325156637205, 'bull_strategy': 'mean_reversion', 'bull_bb_std_mult': 2.298245344232748, 'bull_rsi_os': 27, 'bull_rsi_ob': 58, 'bull_adx_thresh': 5.663376617386011, 'bull_atr_min_pct': 0.02000094740170964, 'bull_atr_max_pct': 0.13175075859543192, 'bull_tp_mult': 2.143219865623447, 'bull_tsl_mult': 0.24924661564171444, 'bull_time_stop': 130, 'bull_use_sma': True, 'bull_use_ema': True, 'bull_use_atr': False, 'bull_use_adx': True, 'bull_use_spike': True, 'bull_rsi_required': True, 'bear_strategy': 'mean_reversion', 'bear_bb_std_mult': 1.5399556808156203, 'bear_rsi_os': 18, 'bear_rsi_ob': 47, 'bear_adx_thresh': 5.085569066861515, 'bear_atr_min_pct': 0.005147097864390269, 'bear_atr_max_pct': 0.012680947074517116, 'bear_tp_mult': 2.0318981469523725, 'bear_tsl_mult': 0.5549455399968695, 'bear_time_stop': 12, 'bear_use_sma': False, 'bear_use_ema': False, 'bear_use_atr': False, 'bear_use_adx': False, 'bear_use_spike': False, 'bear_rsi_required': True, 'sideways_strategy': 'breakout', 'sideways_bb_std_mult': 0.6541562578544862, 'sideways_rsi_os': 37, 'sideways_rsi_ob': 95, 'sideways_adx_thresh': 9.339186622651434, 'sideways_atr_min_pct': 0.02727943643600143, 'sideways_atr_max_pct': 0.06228443298329481, 'sideways_tp_mult': 1.7101556102945097, 'sideways_tsl_mult': 0.5880366346797786, 'sideways_time_stop': 200, 'sideways_use_sma': True, 'sideways_use_ema': False, 'sideways_use_atr': True, 'sideways_use_adx': True, 'sideways_use_spike': True, 'sideways_rsi_required': True}.
[I 2025-08-31 02:33:16,388] Trial 553 finished with values: [-1000000000.0, 1000000000.0] and parameters: {'p_sma': 55, 'p_std': 50, 'p_atr': 27, 'p_adx': 19, 'rsi_period': 70, 'ema1': 6, 'ema2': 26, 'slip_atr_k': 0.0694178997564156, 'slip_spread_k': 0.11903853397669104, 'spread_hl_frac': 0.003238478423046733, 'bb_std_mult': 1.6123030024655252, 'rsi_os': 37, 'rsi_ob': 69, 'vol_spike': 0.18150938881226644, 'adx_thresh': 19.92825093889431, 'atr_min_pct': 0.009049813438307932, 'atr_max_pct': 0.12188978434200383, 'tp_mult': 2.0415205300824537, 'tsl_mult': 0.24991904770752232, 'strategy': 'mean_reversion', 'time_stop': 103, 'use_sma': True, 'use_atr': True, 'use_adx': True, 'use_ema': False, 'use_spike': False, 'rsi_required': True, 'edge_k': 0.6167444391595389, 'edge_cap': 0.106578354174882, 'bull_strategy': 'breakout', 'bull_bb_std_mult': 1.6471509780904567, 'bull_rsi_os': 20, 'bull_rsi_ob': 56, 'bull_adx_thresh': 6.5524832219363836, 'bull_atr_min_pct': 0.0199364965654776, 'bull_atr_max_pct': 0.1423151745197854, 'bull_tp_mult': 2.289186896634983, 'bull_tsl_mult': 0.2577471472783245, 'bull_time_stop': 141, 'bull_use_sma': True, 'bull_use_ema': False, 'bull_use_atr': False, 'bull_use_adx': True, 'bull_use_spike': True, 'bull_rsi_required': True, 'bear_strategy': 'breakout', 'bear_bb_std_mult': 1.4353247223361136, 'bear_rsi_os': 16, 'bear_rsi_ob': 46, 'bear_adx_thresh': 5.5545859216970115, 'bear_atr_min_pct': 0.006181222962987469, 'bear_atr_max_pct': 0.010224312553917784, 'bear_tp_mult': 2.1451355980508082, 'bear_tsl_mult': 0.5649353708838747, 'bear_time_stop': 171, 'bear_use_sma': False, 'bear_use_ema': False, 'bear_use_atr': False, 'bear_use_adx': False, 'bear_use_spike': False, 'bear_rsi_required': True, 'sideways_strategy': 'breakout', 'sideways_bb_std_mult': 0.6465726239377104, 'sideways_rsi_os': 42, 'sideways_rsi_ob': 95, 'sideways_adx_thresh': 8.42533854239841, 'sideways_atr_min_pct': 0.027704882084485048, 'sideways_atr_max_pct': 0.055262371983119674, 'sideways_tp_mult': 1.685391830271023, 'sideways_tsl_mult': 0.6762737068503873, 'sideways_time_stop': 198, 'sideways_use_sma': False, 'sideways_use_ema': True, 'sideways_use_atr': False, 'sideways_use_adx': True, 'sideways_use_spike': True, 'sideways_rsi_required': False}.
[I 2025-08-31 02:33:16,916] Trial 555 finished with values: [-1000000000.0, 1000000000.0] and parameters: {'p_sma': 56, 'p_std': 54, 'p_atr': 27, 'p_adx': 20, 'rsi_period': 70, 'ema1': 6, 'ema2': 32, 'slip_atr_k': 0.14764040420112046, 'slip_spread_k': 0.12127207494732524, 'spread_hl_frac': 0.0037511681267821837, 'bb_std_mult': 1.5585008715151378, 'rsi_os': 38, 'rsi_ob': 69, 'vol_spike': 0.1904765304567301, 'adx_thresh': 19.953698150420532, 'atr_min_pct': 0.0077893927329105266, 'atr_max_pct': 0.12168131680889925, 'tp_mult': 1.9253013927184741, 'tsl_mult': 0.3806883151611914, 'strategy': 'mean_reversion', 'time_stop': 102, 'use_sma': True, 'use_atr': False, 'use_adx': False, 'use_ema': False, 'use_spike': False, 'rsi_required': True, 'edge_k': 0.4835691189435801, 'edge_cap': 0.14875639006869434, 'bull_strategy': 'breakout', 'bull_bb_std_mult': 1.718958278271109, 'bull_rsi_os': 25, 'bull_rsi_ob': 65, 'bull_adx_thresh': 5.003302504173042, 'bull_atr_min_pct': 0.009976120522744238, 'bull_atr_max_pct': 0.14181490929296794, 'bull_tp_mult': 2.280348442740805, 'bull_tsl_mult': 0.5264665547390942, 'bull_time_stop': 133, 'bull_use_sma': True, 'bull_use_ema': False, 'bull_use_atr': False, 'bull_use_adx': True, 'bull_use_spike': True, 'bull_rsi_required': True, 'bear_strategy': 'breakout', 'bear_bb_std_mult': 1.3804803087694046, 'bear_rsi_os': 16, 'bear_rsi_ob': 46, 'bear_adx_thresh': 5.8769250731430205, 'bear_atr_min_pct': 0.00591653772094608, 'bear_atr_max_pct': 0.012424599112496878, 'bear_tp_mult': 2.1434598395928903, 'bear_tsl_mult': 0.511678581774041, 'bear_time_stop': 16, 'bear_use_sma': False, 'bear_use_ema': False, 'bear_use_atr': False, 'bear_use_adx': True, 'bear_use_spike': True, 'bear_rsi_required': True, 'sideways_strategy': 'breakout', 'sideways_bb_std_mult': 0.5079227364252877, 'sideways_rsi_os': 42, 'sideways_rsi_ob': 94, 'sideways_adx_thresh': 8.428485083432918, 'sideways_atr_min_pct': 0.026140154547277, 'sideways_atr_max_pct': 0.05664607178887593, 'sideways_tp_mult': 1.7423666685918746, 'sideways_tsl_mult': 0.679715020124989, 'sideways_time_stop': 212, 'sideways_use_sma': True, 'sideways_use_ema': True, 'sideways_use_atr': False, 'sideways_use_adx': False, 'sideways_use_spike': True, 'sideways_rsi_required': False}.
[I 2025-08-31 02:33:17,215] Trial 554 finished with values: [-1000000000.0, 1000000000.0] and parameters: {'p_sma': 55, 'p_std': 54, 'p_atr': 28, 'p_adx': 19, 'rsi_period': 70, 'ema1': 6, 'ema2': 30, 'slip_atr_k': 0.14716797705021092, 'slip_spread_k': 0.1218229854982838, 'spread_hl_frac': 0.0035801677085012915, 'bb_std_mult': 1.5556802537126304, 'rsi_os': 37, 'rsi_ob': 69, 'vol_spike': 0.09701764346648617, 'adx_thresh': 19.950123157263658, 'atr_min_pct': 0.007982590733917331, 'atr_max_pct': 0.13015445601980535, 'tp_mult': 1.9325996251054667, 'tsl_mult': 0.3816232795899865, 'strategy': 'mean_reversion', 'time_stop': 110, 'use_sma': True, 'use_atr': False, 'use_adx': False, 'use_ema': False, 'use_spike': False, 'rsi_required': True, 'edge_k': 0.4546307068486947, 'edge_cap': 0.12246213563380456, 'bull_strategy': 'breakout', 'bull_bb_std_mult': 1.737379701246355, 'bull_rsi_os': 27, 'bull_rsi_ob': 65, 'bull_adx_thresh': 6.446614357349645, 'bull_atr_min_pct': 0.019865367553288903, 'bull_atr_max_pct': 0.14072585101000168, 'bull_tp_mult': 2.2860155092739385, 'bull_tsl_mult': 0.2589661178840361, 'bull_time_stop': 134, 'bull_use_sma': True, 'bull_use_ema': False, 'bull_use_atr': False, 'bull_use_adx': True, 'bull_use_spike': True, 'bull_rsi_required': True, 'bear_strategy': 'breakout', 'bear_bb_std_mult': 1.5392540713594502, 'bear_rsi_os': 16, 'bear_rsi_ob': 46, 'bear_adx_thresh': 6.058207870698054, 'bear_atr_min_pct': 0.005765270427564248, 'bear_atr_max_pct': 0.08927742191303284, 'bear_tp_mult': 2.1600842454212246, 'bear_tsl_mult': 0.5118767712172317, 'bear_time_stop': 16, 'bear_use_sma': False, 'bear_use_ema': False, 'bear_use_atr': False, 'bear_use_adx': True, 'bear_use_spike': False, 'bear_rsi_required': True, 'sideways_strategy': 'breakout', 'sideways_bb_std_mult': 0.6477687667070735, 'sideways_rsi_os': 42, 'sideways_rsi_ob': 94, 'sideways_adx_thresh': 8.343396418269124, 'sideways_atr_min_pct': 0.02615385487553831, 'sideways_atr_max_pct': 0.05935690932598425, 'sideways_tp_mult': 1.740145725115303, 'sideways_tsl_mult': 0.629856755550532, 'sideways_time_stop': 209, 'sideways_use_sma': True, 'sideways_use_ema': True, 'sideways_use_atr': False, 'sideways_use_adx': False, 'sideways_use_spike': True, 'sideways_rsi_required': False}.
[I 2025-08-31 02:33:17,454] Trial 552 finished with values: [-1000000000.0, 1000000000.0] and parameters: {'p_sma': 52, 'p_std': 54, 'p_atr': 27, 'p_adx': 22, 'rsi_period': 71, 'ema1': 6, 'ema2': 26, 'slip_atr_k': 0.07088205541521024, 'slip_spread_k': 0.12455301510864311, 'spread_hl_frac': 0.0018236668151501159, 'bb_std_mult': 1.5789627708015816, 'rsi_os': 37, 'rsi_ob': 69, 'vol_spike': 0.07819268906865974, 'adx_thresh': 19.92998115603964, 'atr_min_pct': 0.025110511354366583, 'atr_max_pct': 0.13119884193228398, 'tp_mult': 1.1952692440191222, 'tsl_mult': 0.3787807724472856, 'strategy': 'mean_reversion', 'time_stop': 103, 'use_sma': True, 'use_atr': True, 'use_adx': True, 'use_ema': False, 'use_spike': False, 'rsi_required': True, 'edge_k': 0.4729418874487872, 'edge_cap': 0.11719606285372668, 'bull_strategy': 'breakout', 'bull_bb_std_mult': 2.3469832822422987, 'bull_rsi_os': 25, 'bull_rsi_ob': 58, 'bull_adx_thresh': 7.93982402607519, 'bull_atr_min_pct': 0.003576549096017928, 'bull_atr_max_pct': 0.142121273092014, 'bull_tp_mult': 2.298376692143759, 'bull_tsl_mult': 0.25995822685217645, 'bull_time_stop': 132, 'bull_use_sma': True, 'bull_use_ema': False, 'bull_use_atr': False, 'bull_use_adx': True, 'bull_use_spike': True, 'bull_rsi_required': True, 'bear_strategy': 'breakout', 'bear_bb_std_mult': 1.3936167947760727, 'bear_rsi_os': 16, 'bear_rsi_ob': 46, 'bear_adx_thresh': 5.8315080946295765, 'bear_atr_min_pct': 0.005872039194352449, 'bear_atr_max_pct': 0.08878172541564883, 'bear_tp_mult': 2.148187229453288, 'bear_tsl_mult': 0.566511173202494, 'bear_time_stop': 15, 'bear_use_sma': False, 'bear_use_ema': False, 'bear_use_atr': False, 'bear_use_adx': False, 'bear_use_spike': False, 'bear_rsi_required': True, 'sideways_strategy': 'breakout', 'sideways_bb_std_mult': 0.5064140092491385, 'sideways_rsi_os': 41, 'sideways_rsi_ob': 95, 'sideways_adx_thresh': 8.380335647879429, 'sideways_atr_min_pct': 0.02763964435219895, 'sideways_atr_max_pct': 0.054736316855249385, 'sideways_tp_mult': 1.6671652875377239, 'sideways_tsl_mult': 0.6746765018520434, 'sideways_time_stop': 211, 'sideways_use_sma': False, 'sideways_use_ema': True, 'sideways_use_atr': False, 'sideways_use_adx': True, 'sideways_use_spike': True, 'sideways_rsi_required': False}.
[I 2025-08-31 02:33:51,211] Trial 558 finished with values: [-1000000000.0, 1000000000.0] and parameters: {'p_sma': 52, 'p_std': 48, 'p_atr': 29, 'p_adx': 17, 'rsi_period': 68, 'ema1': 28, 'ema2': 13, 'slip_atr_k': 0.08596164421417801, 'slip_spread_k': 0.14094501220178693, 'spread_hl_frac': 0.0012224690386946867, 'bb_std_mult': 1.5983515046068448, 'rsi_os': 40, 'rsi_ob': 65, 'vol_spike': 0.08296565119900522, 'adx_thresh': 21.143330416783016, 'atr_min_pct': 0.021960110789940687, 'atr_max_pct': 0.11959560945192962, 'tp_mult': 1.592470451405409, 'tsl_mult': 0.30694347082648726, 'strategy': 'mean_reversion', 'time_stop': 121, 'use_sma': True, 'use_atr': False, 'use_adx': False, 'use_ema': False, 'use_spike': True, 'rsi_required': True, 'edge_k': 0.5600195287538398, 'edge_cap': 0.06447347746878297, 'bull_strategy': 'breakout', 'bull_bb_std_mult': 2.364616070896967, 'bull_rsi_os': 43, 'bull_rsi_ob': 56, 'bull_adx_thresh': 5.478394638349033, 'bull_atr_min_pct': 0.008107750026072471, 'bull_atr_max_pct': 0.14452605539184202, 'bull_tp_mult': 2.3552001827032725, 'bull_tsl_mult': 0.2951143811321982, 'bull_time_stop': 139, 'bull_use_sma': True, 'bull_use_ema': False, 'bull_use_atr': False, 'bull_use_adx': False, 'bull_use_spike': True, 'bull_rsi_required': True, 'bear_strategy': 'mean_reversion', 'bear_bb_std_mult': 1.2567052515504566, 'bear_rsi_os': 17, 'bear_rsi_ob': 45, 'bear_adx_thresh': 6.046855089309816, 'bear_atr_min_pct': 0.006774970711863608, 'bear_atr_max_pct': 0.010027767151814831, 'bear_tp_mult': 2.0678732430397657, 'bear_tsl_mult': 0.4899222951062797, 'bear_time_stop': 6, 'bear_use_sma': False, 'bear_use_ema': True, 'bear_use_atr': False, 'bear_use_adx': True, 'bear_use_spike': False, 'bear_rsi_required': True, 'sideways_strategy': 'breakout', 'sideways_bb_std_mult': 0.5490961380330365, 'sideways_rsi_os': 41, 'sideways_rsi_ob': 94, 'sideways_adx_thresh': 7.301671937689807, 'sideways_atr_min_pct': 0.02901681862927006, 'sideways_atr_max_pct': 0.04777272378231397, 'sideways_tp_mult': 1.6093501677483752, 'sideways_tsl_mult': 0.6505589647114283, 'sideways_time_stop': 225, 'sideways_use_sma': True, 'sideways_use_ema': False, 'sideways_use_atr': False, 'sideways_use_adx': False, 'sideways_use_spike': True, 'sideways_rsi_required': False}.
[I 2025-08-31 02:33:51,242] Trial 559 finished with values: [-1000000000.0, 1000000000.0] and parameters: {'p_sma': 53, 'p_std': 48, 'p_atr': 29, 'p_adx': 22, 'rsi_period': 73, 'ema1': 5, 'ema2': 12, 'slip_atr_k': 0.09492122050966618, 'slip_spread_k': 0.15196065553974564, 'spread_hl_frac': 0.0008908632692179227, 'bb_std_mult': 0.6308228773025979, 'rsi_os': 39, 'rsi_ob': 66, 'vol_spike': 0.0465057026506574, 'adx_thresh': 22.229820207383877, 'atr_min_pct': 0.026657998764502998, 'atr_max_pct': 0.11982787696144881, 'tp_mult': 1.6934126731286505, 'tsl_mult': 0.42920167946098653, 'strategy': 'mean_reversion', 'time_stop': 115, 'use_sma': True, 'use_atr': False, 'use_adx': False, 'use_ema': False, 'use_spike': True, 'rsi_required': True, 'edge_k': 0.5679128873150532, 'edge_cap': 0.08263183666588159, 'bull_strategy': 'breakout', 'bull_bb_std_mult': 2.194247822397897, 'bull_rsi_os': 30, 'bull_rsi_ob': 48, 'bull_adx_thresh': 5.541948183962297, 'bull_atr_min_pct': 0.007922730183487861, 'bull_atr_max_pct': 0.13695126421746381, 'bull_tp_mult': 2.3404906979255027, 'bull_tsl_mult': 0.2888159069723572, 'bull_time_stop': 143, 'bull_use_sma': True, 'bull_use_ema': False, 'bull_use_atr': False, 'bull_use_adx': False, 'bull_use_spike': True, 'bull_rsi_required': True, 'bear_strategy': 'mean_reversion', 'bear_bb_std_mult': 1.2990350738201581, 'bear_rsi_os': 17, 'bear_rsi_ob': 45, 'bear_adx_thresh': 5.025675805667266, 'bear_atr_min_pct': 0.006596421379881072, 'bear_atr_max_pct': 0.08430322636124278, 'bear_tp_mult': 2.082487032433011, 'bear_tsl_mult': 0.4832848674338248, 'bear_time_stop': 5, 'bear_use_sma': False, 'bear_use_ema': True, 'bear_use_atr': False, 'bear_use_adx': True, 'bear_use_spike': True, 'bear_rsi_required': True, 'sideways_strategy': 'breakout', 'sideways_bb_std_mult': 0.5659888482055998, 'sideways_rsi_os': 40, 'sideways_rsi_ob': 93, 'sideways_adx_thresh': 8.804101861613146, 'sideways_atr_min_pct': 0.029002404457265013, 'sideways_atr_max_pct': 0.048304473214800525, 'sideways_tp_mult': 1.797747643666196, 'sideways_tsl_mult': 0.6240021640999387, 'sideways_time_stop': 227, 'sideways_use_sma': True, 'sideways_use_ema': False, 'sideways_use_atr': False, 'sideways_use_adx': False, 'sideways_use_spike': True, 'sideways_rsi_required': False}.
