[I 2025-08-31 02:49:34,720] Trial 675 finished with values: [-1000000000.0, 1000000000.0] and parameters: {'p_sma': 51, 'p_std': 51, 'p_atr': 7, 'p_adx': 29, 'rsi_period': 68, 'ema1': 6, 'ema2': 24, 'slip_atr_k': 0.2132835616399253, 'slip_spread_k': 0.5628517321747221, 'spread_hl_frac': 0.002916457342800702, 'bb_std_mult': 2.871168806920907, 'rsi_os': 35, 'rsi_ob': 70, 'vol_spike': 0.19051087970572106, 'adx_thresh': 16.24900800624521, 'atr_min_pct': 0.008371029619305685, 'atr_max_pct': 0.03155352551151766, 'tp_mult': 1.7155806872742185, 'tsl_mult': 0.41157856858015285, 'strategy': 'mean_reversion', 'time_stop': 169, 'use_sma': False, 'use_atr': False, 'use_adx': False, 'use_ema': False, 'use_spike': False, 'rsi_required': True, 'edge_k': 0.253002603698642, 'edge_cap': 0.6700083222203023, 'bull_strategy': 'mean_reversion', 'bull_bb_std_mult': 2.0578820848086354, 'bull_rsi_os': 28, 'bull_rsi_ob': 54, 'bull_adx_thresh': 24.034207169793056, 'bull_atr_min_pct': 0.027799591166725635, 'bull_atr_max_pct': 0.05463284743624666, 'bull_tp_mult': 2.2961865035117337, 'bull_tsl_mult': 0.217007498136029, 'bull_time_stop': 137, 'bull_use_sma': True, 'bull_use_ema': True, 'bull_use_atr': False, 'bull_use_adx': True, 'bull_use_spike': True, 'bull_rsi_required': True, 'bear_strategy': 'breakout', 'bear_bb_std_mult': 2.4091344113788384, 'bear_rsi_os': 17, 'bear_rsi_ob': 47, 'bear_adx_thresh': 15.677854283340984, 'bear_atr_min_pct': 0.0067600842535838765, 'bear_atr_max_pct': 0.012420942429997382, 'bear_tp_mult': 2.4664734765074083, 'bear_tsl_mult': 0.546253542659583, 'bear_time_stop': 5, 'bear_use_sma': False, 'bear_use_ema': False, 'bear_use_atr': False, 'bear_use_adx': True, 'bear_use_spike': False, 'bear_rsi_required': True, 'sideways_strategy': 'breakout', 'sideways_bb_std_mult': 0.5607811354768633, 'sideways_rsi_os': 41, 'sideways_rsi_ob': 51, 'sideways_adx_thresh': 8.482595762744852, 'sideways_atr_min_pct': 0.018010312773615474, 'sideways_atr_max_pct': 0.0765394325879403, 'sideways_tp_mult': 2.9258222637084, 'sideways_tsl_mult': 0.5736318518709662, 'sideways_time_stop': 18, 'sideways_use_sma': True, 'sideways_use_ema': False, 'sideways_use_atr': False, 'sideways_use_adx': False, 'sideways_use_spike': True, 'sideways_rsi_required': False}.
[I 2025-08-31 02:50:05,961] Trial 676 finished with values: [-1000000000.0, 1000000000.0] and parameters: {'p_sma': 51, 'p_std': 51, 'p_atr': 28, 'p_adx': 16, 'rsi_period': 75, 'ema1': 20, 'ema2': 24, 'slip_atr_k': 0.06542833779938573, 'slip_spread_k': 0.37990466769046716, 'spread_hl_frac': 0.04725114555967327, 'bb_std_mult': 1.7431233566911195, 'rsi_os': 24, 'rsi_ob': 70, 'vol_spike': 0.1927458393042249, 'adx_thresh': 5.798089854840137, 'atr_min_pct': 0.008188395412542612, 'atr_max_pct': 0.029654387637061352, 'tp_mult': 1.726837601166602, 'tsl_mult': 0.26919921113300155, 'strategy': 'mean_reversion', 'time_stop': 168, 'use_sma': False, 'use_atr': False, 'use_adx': True, 'use_ema': False, 'use_spike': False, 'rsi_required': True, 'edge_k': 1.5451258076966656, 'edge_cap': 0.12337452741197304, 'bull_strategy': 'mean_reversion', 'bull_bb_std_mult': 2.038257420586494, 'bull_rsi_os': 48, 'bull_rsi_ob': 54, 'bull_adx_thresh': 5.970485441914781, 'bull_atr_min_pct': 0.005092036699783208, 'bull_atr_max_pct': 0.13948953419492993, 'bull_tp_mult': 2.2923372768622925, 'bull_tsl_mult': 0.08542398681436475, 'bull_time_stop': 128, 'bull_use_sma': True, 'bull_use_ema': True, 'bull_use_atr': False, 'bull_use_adx': True, 'bull_use_spike': True, 'bull_rsi_required': True, 'bear_strategy': 'breakout', 'bear_bb_std_mult': 3.402946805836021, 'bear_rsi_os': 17, 'bear_rsi_ob': 47, 'bear_adx_thresh': 5.018776384952195, 'bear_atr_min_pct': 0.005637952528642591, 'bear_atr_max_pct': 0.015121882030268072, 'bear_tp_mult': 1.255422809694133, 'bear_tsl_mult': 0.5447720729012243, 'bear_time_stop': 10, 'bear_use_sma': False, 'bear_use_ema': False, 'bear_use_atr': False, 'bear_use_adx': False, 'bear_use_spike': False, 'bear_rsi_required': True, 'sideways_strategy': 'breakout', 'sideways_bb_std_mult': 1.669506567342246, 'sideways_rsi_os': 41, 'sideways_rsi_ob': 70, 'sideways_adx_thresh': 8.539267297001293, 'sideways_atr_min_pct': 0.026732681804380806, 'sideways_atr_max_pct': 0.12395254849868353, 'sideways_tp_mult': 1.6995029704908329, 'sideways_tsl_mult': 0.5765894446567836, 'sideways_time_stop': 67, 'sideways_use_sma': True, 'sideways_use_ema': False, 'sideways_use_atr': False, 'sideways_use_adx': True, 'sideways_use_spike': True, 'sideways_rsi_required': False}.
[I 2025-08-31 02:50:10,501] Trial 677 finished with values: [-1000000000.0, 1000000000.0] and parameters: {'p_sma': 53, 'p_std': 48, 'p_atr': 27, 'p_adx': 16, 'rsi_period': 46, 'ema1': 17, 'ema2': 38, 'slip_atr_k': 0.018027649603314835, 'slip_spread_k': 0.15391279689181975, 'spread_hl_frac': 0.047698894882898336, 'bb_std_mult': 1.7442264941924512, 'rsi_os': 41, 'rsi_ob': 69, 'vol_spike': 0.2053294501157661, 'adx_thresh': 5.769694702195753, 'atr_min_pct': 0.008228868834065747, 'atr_max_pct': 0.03159589124681138, 'tp_mult': 1.9009116590537352, 'tsl_mult': 0.41461838271783646, 'strategy': 'mean_reversion', 'time_stop': 228, 'use_sma': False, 'use_atr': False, 'use_adx': True, 'use_ema': False, 'use_spike': True, 'rsi_required': True, 'edge_k': 0.2283556260609797, 'edge_cap': 0.09329552383934651, 'bull_strategy': 'breakout', 'bull_bb_std_mult': 2.372204506195371, 'bull_rsi_os': 46, 'bull_rsi_ob': 50, 'bull_adx_thresh': 26.765355416970074, 'bull_atr_min_pct': 0.004919550937272855, 'bull_atr_max_pct': 0.14032984402115312, 'bull_tp_mult': 2.3399258482539884, 'bull_tsl_mult': 0.2640277639540728, 'bull_time_stop': 137, 'bull_use_sma': True, 'bull_use_ema': False, 'bull_use_atr': False, 'bull_use_adx': False, 'bull_use_spike': True, 'bull_rsi_required': True, 'bear_strategy': 'breakout', 'bear_bb_std_mult': 2.4182273834579098, 'bear_rsi_os': 16, 'bear_rsi_ob': 64, 'bear_adx_thresh': 6.0050337080253815, 'bear_atr_min_pct': 0.024548979847759535, 'bear_atr_max_pct': 0.012784803378911986, 'bear_tp_mult': 1.0476468234366252, 'bear_tsl_mult': 0.5467557736855926, 'bear_time_stop': 10, 'bear_use_sma': False, 'bear_use_ema': True, 'bear_use_atr': False, 'bear_use_adx': False, 'bear_use_spike': True, 'bear_rsi_required': True, 'sideways_strategy': 'breakout', 'sideways_bb_std_mult': 0.5568338434102118, 'sideways_rsi_os': 40, 'sideways_rsi_ob': 78, 'sideways_adx_thresh': 27.73563384002166, 'sideways_atr_min_pct': 0.026674088576365086, 'sideways_atr_max_pct': 0.07647056491328727, 'sideways_tp_mult': 1.7878701563281612, 'sideways_tsl_mult': 0.6936405689558895, 'sideways_time_stop': 198, 'sideways_use_sma': True, 'sideways_use_ema': False, 'sideways_use_atr': False, 'sideways_use_adx': True, 'sideways_use_spike': True, 'sideways_rsi_required': False}.
[I 2025-08-31 02:50:10,784] Trial 678 finished with values: [-1000000000.0, 1000000000.0] and parameters: {'p_sma': 23, 'p_std': 48, 'p_atr': 27, 'p_adx': 16, 'rsi_period': 7, 'ema1': 6, 'ema2': 26, 'slip_atr_k': 0.20536459890343595, 'slip_spread_k': 0.594954315379876, 'spread_hl_frac': 0.002278072581023232, 'bb_std_mult': 2.878804938746667, 'rsi_os': 35, 'rsi_ob': 69, 'vol_spike': 0.11870627967607772, 'adx_thresh': 20.861197139911123, 'atr_min_pct': 0.0083235586327434, 'atr_max_pct': 0.02870487190245047, 'tp_mult': 1.7170457590320267, 'tsl_mult': 0.4152783380781294, 'strategy': 'mean_reversion', 'time_stop': 112, 'use_sma': False, 'use_atr': False, 'use_adx': True, 'use_ema': False, 'use_spike': True, 'rsi_required': True, 'edge_k': 0.2553196617160073, 'edge_cap': 0.10480095579165946, 'bull_strategy': 'breakout', 'bull_bb_std_mult': 1.1697230983996783, 'bull_rsi_os': 24, 'bull_rsi_ob': 54, 'bull_adx_thresh': 30.93579324585324, 'bull_atr_min_pct': 0.023863926602409213, 'bull_atr_max_pct': 0.13939346022387536, 'bull_tp_mult': 1.6974158047133423, 'bull_tsl_mult': 0.5482309229782827, 'bull_time_stop': 128, 'bull_use_sma': True, 'bull_use_ema': False, 'bull_use_atr': False, 'bull_use_adx': False, 'bull_use_spike': True, 'bull_rsi_required': True, 'bear_strategy': 'breakout', 'bear_bb_std_mult': 3.4176685814152092, 'bear_rsi_os': 17, 'bear_rsi_ob': 64, 'bear_adx_thresh': 6.610881883166664, 'bear_atr_min_pct': 0.028106059721115944, 'bear_atr_max_pct': 0.0122272772439205, 'bear_tp_mult': 1.0508234152289797, 'bear_tsl_mult': 0.8682804199908546, 'bear_time_stop': 162, 'bear_use_sma': False, 'bear_use_ema': True, 'bear_use_atr': False, 'bear_use_adx': False, 'bear_use_spike': True, 'bear_rsi_required': True, 'sideways_strategy': 'breakout', 'sideways_bb_std_mult': 0.5640723141584525, 'sideways_rsi_os': 40, 'sideways_rsi_ob': 71, 'sideways_adx_thresh': 9.0457122638732, 'sideways_atr_min_pct': 0.026782581127368962, 'sideways_atr_max_pct': 0.12390436652946021, 'sideways_tp_mult': 1.7912623790772035, 'sideways_tsl_mult': 0.6940026590371632, 'sideways_time_stop': 198, 'sideways_use_sma': True, 'sideways_use_ema': False, 'sideways_use_atr': False, 'sideways_use_adx': True, 'sideways_use_spike': True, 'sideways_rsi_required': False}.
[I 2025-08-31 02:50:11,144] Trial 679 finished with values: [-1000000000.0, 1000000000.0] and parameters: {'p_sma': 53, 'p_std': 9, 'p_atr': 26, 'p_adx': 16, 'rsi_period': 7, 'ema1': 21, 'ema2': 38, 'slip_atr_k': 0.02009241436648959, 'slip_spread_k': 0.6117590970762226, 'spread_hl_frac': 0.04720826751931299, 'bb_std_mult': 1.7370155791722592, 'rsi_os': 41, 'rsi_ob': 69, 'vol_spike': 0.2051743194558419, 'adx_thresh': 20.994597002646262, 'atr_min_pct': 0.02116188312479693, 'atr_max_pct': 0.11519945112466862, 'tp_mult': 1.9000611360544832, 'tsl_mult': 0.21130030436633615, 'strategy': 'mean_reversion', 'time_stop': 112, 'use_sma': False, 'use_atr': False, 'use_adx': True, 'use_ema': False, 'use_spike': True, 'rsi_required': True, 'edge_k': 1.0878103366124077, 'edge_cap': 0.10202092202448254, 'bull_strategy': 'breakout', 'bull_bb_std_mult': 2.36342796395201, 'bull_rsi_os': 16, 'bull_rsi_ob': 93, 'bull_adx_thresh': 22.037190463025205, 'bull_atr_min_pct': 0.005257922308946826, 'bull_atr_max_pct': 0.1499620718210843, 'bull_tp_mult': 2.362762826253555, 'bull_tsl_mult': 0.2534987972189461, 'bull_time_stop': 129, 'bull_use_sma': True, 'bull_use_ema': False, 'bull_use_atr': False, 'bull_use_adx': False, 'bull_use_spike': True, 'bull_rsi_required': True, 'bear_strategy': 'breakout', 'bear_bb_std_mult': 2.0601189282554953, 'bear_rsi_os': 19, 'bear_rsi_ob': 46, 'bear_adx_thresh': 6.498087055149565, 'bear_atr_min_pct': 0.00610431974249334, 'bear_atr_max_pct': 0.018591040458012062, 'bear_tp_mult': 1.260562247991629, 'bear_tsl_mult': 0.8273187042962733, 'bear_time_stop': 11, 'bear_use_sma': False, 'bear_use_ema': True, 'bear_use_atr': True, 'bear_use_adx': False, 'bear_use_spike': True, 'bear_rsi_required': True, 'sideways_strategy': 'breakout', 'sideways_bb_std_mult': 3.5295776248013526, 'sideways_rsi_os': 43, 'sideways_rsi_ob': 93, 'sideways_adx_thresh': 29.66370570063488, 'sideways_atr_min_pct': 0.026767320032670426, 'sideways_atr_max_pct': 0.06304649876302089, 'sideways_tp_mult': 1.790710703989788, 'sideways_tsl_mult': 0.6917822998639075, 'sideways_time_stop': 200, 'sideways_use_sma': True, 'sideways_use_ema': True, 'sideways_use_atr': False, 'sideways_use_adx': True, 'sideways_use_spike': False, 'sideways_rsi_required': False}.
[I 2025-08-31 02:50:44,234] Trial 682 finished with values: [-1000000000.0, 1000000000.0] and parameters: {'p_sma': 60, 'p_std': 9, 'p_atr': 30, 'p_adx': 23, 'rsi_period': 73, 'ema1': 5, 'ema2': 32, 'slip_atr_k': 0.16132823364366478, 'slip_spread_k': 0.17667967841150908, 'spread_hl_frac': 0.02089046869473015, 'bb_std_mult': 1.5184017908755216, 'rsi_os': 5, 'rsi_ob': 66, 'vol_spike': 0.1862015012418072, 'adx_thresh': 25.173782367560406, 'atr_min_pct': 0.02777567024567284, 'atr_max_pct': 0.08867025659771936, 'tp_mult': 1.1052317061839871, 'tsl_mult': 0.6768566537951484, 'strategy': 'mean_reversion', 'time_stop': 95, 'use_sma': True, 'use_atr': False, 'use_adx': False, 'use_ema': False, 'use_spike': False, 'rsi_required': True, 'edge_k': 1.872032425112066, 'edge_cap': 0.6044372503230866, 'bull_strategy': 'breakout', 'bull_bb_std_mult': 2.5194459199218304, 'bull_rsi_os': 22, 'bull_rsi_ob': 57, 'bull_adx_thresh': 7.290660278771417, 'bull_atr_min_pct': 0.01705290392658085, 'bull_atr_max_pct': 0.043293713410975564, 'bull_tp_mult': 2.375906397152571, 'bull_tsl_mult': 0.25111584914616614, 'bull_time_stop': 247, 'bull_use_sma': True, 'bull_use_ema': False, 'bull_use_atr': False, 'bull_use_adx': True, 'bull_use_spike': True, 'bull_rsi_required': True, 'bear_strategy': 'mean_reversion', 'bear_bb_std_mult': 1.1900966106085282, 'bear_rsi_os': 19, 'bear_rsi_ob': 56, 'bear_adx_thresh': 28.095617532215662, 'bear_atr_min_pct': 0.013582709132260755, 'bear_atr_max_pct': 0.09757848778946751, 'bear_tp_mult': 2.9786489800186438, 'bear_tsl_mult': 0.2779483943389107, 'bear_time_stop': 201, 'bear_use_sma': False, 'bear_use_ema': False, 'bear_use_atr': True, 'bear_use_adx': True, 'bear_use_spike': False, 'bear_rsi_required': True, 'sideways_strategy': 'breakout', 'sideways_bb_std_mult': 3.535531689670704, 'sideways_rsi_os': 38, 'sideways_rsi_ob': 54, 'sideways_adx_thresh': 9.286360613642987, 'sideways_atr_min_pct': 0.0240946439966847, 'sideways_atr_max_pct': 0.031772757188938246, 'sideways_tp_mult': 2.719724217199204, 'sideways_tsl_mult': 0.6752082661481554, 'sideways_time_stop': 203, 'sideways_use_sma': True, 'sideways_use_ema': True, 'sideways_use_atr': False, 'sideways_use_adx': False, 'sideways_use_spike': False, 'sideways_rsi_required': False}.
[I 2025-08-31 02:50:44,560] Trial 680 finished with values: [-1000000000.0, 1000000000.0] and parameters: {'p_sma': 53, 'p_std': 48, 'p_atr': 27, 'p_adx': 25, 'rsi_period': 73, 'ema1': 17, 'ema2': 38, 'slip_atr_k': 0.2053016117276997, 'slip_spread_k': 0.6199394906003703, 'spread_hl_frac': 0.0021189242304498848, 'bb_std_mult': 1.5081177647158972, 'rsi_os': 20, 'rsi_ob': 69, 'vol_spike': 0.18243312060110736, 'adx_thresh': 25.12435647781495, 'atr_min_pct': 0.0278810242631327, 'atr_max_pct': 0.11409877282748587, 'tp_mult': 1.9085389929439303, 'tsl_mult': 0.6793525401375166, 'strategy': 'mean_reversion', 'time_stop': 128, 'use_sma': True, 'use_atr': False, 'use_adx': True, 'use_ema': False, 'use_spike': True, 'rsi_required': True, 'edge_k': 0.6439351220068715, 'edge_cap': 0.10427662298263798, 'bull_strategy': 'breakout', 'bull_bb_std_mult': 2.600519301367037, 'bull_rsi_os': 8, 'bull_rsi_ob': 57, 'bull_adx_thresh': 33.16173496747349, 'bull_atr_min_pct': 0.021924352416712402, 'bull_atr_max_pct': 0.14738268902797844, 'bull_tp_mult': 2.345099836776071, 'bull_tsl_mult': 0.25962403790711813, 'bull_time_stop': 273, 'bull_use_sma': True, 'bull_use_ema': False, 'bull_use_atr': False, 'bull_use_adx': False, 'bull_use_spike': True, 'bull_rsi_required': True, 'bear_strategy': 'mean_reversion', 'bear_bb_std_mult': 1.2026110524942162, 'bear_rsi_os': 42, 'bear_rsi_ob': 64, 'bear_adx_thresh': 6.055464016150082, 'bear_atr_min_pct': 0.01369328045347909, 'bear_atr_max_pct': 0.012453936189557376, 'bear_tp_mult': 1.5288422498083012, 'bear_tsl_mult': 0.5195804188057052, 'bear_time_stop': 15, 'bear_use_sma': False, 'bear_use_ema': True, 'bear_use_atr': True, 'bear_use_adx': False, 'bear_use_spike': True, 'bear_rsi_required': True, 'sideways_strategy': 'breakout', 'sideways_bb_std_mult': 0.6653122454602476, 'sideways_rsi_os': 43, 'sideways_rsi_ob': 65, 'sideways_adx_thresh': 9.38453255529692, 'sideways_atr_min_pct': 0.02443988591426692, 'sideways_atr_max_pct': 0.05655797308329354, 'sideways_tp_mult': 1.7924974295908471, 'sideways_tsl_mult': 0.6966123285373417, 'sideways_time_stop': 5, 'sideways_use_sma': True, 'sideways_use_ema': True, 'sideways_use_atr': False, 'sideways_use_adx': True, 'sideways_use_spike': False, 'sideways_rsi_required': False}.
[I 2025-08-31 02:50:45,142] Trial 681 finished with values: [-1000000000.0, 1000000000.0] and parameters: {'p_sma': 19, 'p_std': 19, 'p_atr': 11, 'p_adx': 12, 'rsi_period': 8, 'ema1': 5, 'ema2': 44, 'slip_atr_k': 0.20554829635800886, 'slip_spread_k': 0.17770057312567117, 'spread_hl_frac': 0.0019632832403249324, 'bb_std_mult': 1.5308526537114402, 'rsi_os': 36, 'rsi_ob': 69, 'vol_spike': 0.11783620112957133, 'adx_thresh': 6.828463913749937, 'atr_min_pct': 0.008882698801291571, 'atr_max_pct': 0.11414097695152209, 'tp_mult': 1.464382754397831, 'tsl_mult': 0.761172915088276, 'strategy': 'mean_reversion', 'time_stop': 112, 'use_sma': True, 'use_atr': False, 'use_adx': False, 'use_ema': False, 'use_spike': True, 'rsi_required': True, 'edge_k': 0.6490846677396181, 'edge_cap': 0.526378274477658, 'bull_strategy': 'breakout', 'bull_bb_std_mult': 1.1509918418269527, 'bull_rsi_os': 53, 'bull_rsi_ob': 61, 'bull_adx_thresh': 7.317251652206247, 'bull_atr_min_pct': 0.02207836587968932, 'bull_atr_max_pct': 0.14823480858379334, 'bull_tp_mult': 2.3473839270567574, 'bull_tsl_mult': 0.24667290058229874, 'bull_time_stop': 131, 'bull_use_sma': True, 'bull_use_ema': False, 'bull_use_atr': False, 'bull_use_adx': False, 'bull_use_spike': True, 'bull_rsi_required': True, 'bear_strategy': 'mean_reversion', 'bear_bb_std_mult': 2.094712086882011, 'bear_rsi_os': 19, 'bear_rsi_ob': 59, 'bear_adx_thresh': 29.597511935769788, 'bear_atr_min_pct': 0.01346316381854428, 'bear_atr_max_pct': 0.09734337588369568, 'bear_tp_mult': 2.9631739946451976, 'bear_tsl_mult': 0.8297942578031937, 'bear_time_stop': 15, 'bear_use_sma': False, 'bear_use_ema': True, 'bear_use_atr': True, 'bear_use_adx': True, 'bear_use_spike': False, 'bear_rsi_required': True, 'sideways_strategy': 'breakout', 'sideways_bb_std_mult': 0.6661183574120395, 'sideways_rsi_os': 33, 'sideways_rsi_ob': 58, 'sideways_adx_thresh': 29.759358737096655, 'sideways_atr_min_pct': 0.02720811488708145, 'sideways_atr_max_pct': 0.06320249686504294, 'sideways_tp_mult': 2.710392404609419, 'sideways_tsl_mult': 0.33815830876581243, 'sideways_time_stop': 190, 'sideways_use_sma': True, 'sideways_use_ema': True, 'sideways_use_atr': False, 'sideways_use_adx': False, 'sideways_use_spike': False, 'sideways_rsi_required': False}.
[I 2025-08-31 02:50:45,354] Trial 683 finished with values: [-1000000000.0, 1000000000.0] and parameters: {'p_sma': 55, 'p_std': 53, 'p_atr': 30, 'p_adx': 25, 'rsi_period': 73, 'ema1': 24, 'ema2': 28, 'slip_atr_k': 0.16160239022186446, 'slip_spread_k': 0.17023853455410473, 'spread_hl_frac': 0.03622642741563303, 'bb_std_mult': 1.5380037520944971, 'rsi_os': 38, 'rsi_ob': 67, 'vol_spike': 0.18437721264621335, 'adx_thresh': 25.15602150245659, 'atr_min_pct': 0.018131466273588838, 'atr_max_pct': 0.11972581756379404, 'tp_mult': 1.8477266308003824, 'tsl_mult': 0.6726600586741911, 'strategy': 'mean_reversion', 'time_stop': 275, 'use_sma': True, 'use_atr': False, 'use_adx': False, 'use_ema': False, 'use_spike': False, 'rsi_required': True, 'edge_k': 0.46739359985531037, 'edge_cap': 0.6095472256951802, 'bull_strategy': 'breakout', 'bull_bb_std_mult': 0.5867813776761646, 'bull_rsi_os': 12, 'bull_rsi_ob': 62, 'bull_adx_thresh': 8.826572742020232, 'bull_atr_min_pct': 0.0077783940796575975, 'bull_atr_max_pct': 0.02960382226740474, 'bull_tp_mult': 2.2553014702520544, 'bull_tsl_mult': 0.23788630813493936, 'bull_time_stop': 249, 'bull_use_sma': True, 'bull_use_ema': False, 'bull_use_atr': False, 'bull_use_adx': True, 'bull_use_spike': True, 'bull_rsi_required': True, 'bear_strategy': 'mean_reversion', 'bear_bb_std_mult': 1.2142656152461242, 'bear_rsi_os': 19, 'bear_rsi_ob': 49, 'bear_adx_thresh': 19.343227811181332, 'bear_atr_min_pct': 0.007211099239627621, 'bear_atr_max_pct': 0.12500999395526835, 'bear_tp_mult': 2.1228618260946215, 'bear_tsl_mult': 0.5228121685984343, 'bear_time_stop': 233, 'bear_use_sma': False, 'bear_use_ema': False, 'bear_use_atr': True, 'bear_use_adx': True, 'bear_use_spike': False, 'bear_rsi_required': True, 'sideways_strategy': 'breakout', 'sideways_bb_std_mult': 0.6412157123989566, 'sideways_rsi_os': 37, 'sideways_rsi_ob': 60, 'sideways_adx_thresh': 9.305962424113888, 'sideways_atr_min_pct': 0.02592856252171795, 'sideways_atr_max_pct': 0.05061668718221372, 'sideways_tp_mult': 1.9764819551665365, 'sideways_tsl_mult': 0.667893355461809, 'sideways_time_stop': 190, 'sideways_use_sma': True, 'sideways_use_ema': True, 'sideways_use_atr': True, 'sideways_use_adx': False, 'sideways_use_spike': False, 'sideways_rsi_required': True}.
