[I 2025-08-31 00:40:35,113] Trial 335 finished with values: [-1000000000.0, 1000000000.0] and parameters: {'p_sma': 48, 'p_std': 37, 'p_atr': 23, 'p_adx': 8, 'rsi_period': 59, 'ema1': 7, 'ema2': 41, 'slip_atr_k': 0.18881587005437084, 'slip_spread_k': 0.24432575697463896, 'spread_hl_frac': 0.005761051845596768, 'bb_std_mult': 1.850259230105593, 'rsi_os': 52, 'rsi_ob': 78, 'vol_spike': 0.1836194588414424, 'adx_thresh': 11.827275281761084, 'atr_min_pct': 0.006553015150576838, 'atr_max_pct': 0.03575152074301127, 'tp_mult': 1.3045761410460912, 'tsl_mult': 0.4056424554246253, 'strategy': 'breakout', 'time_stop': 234, 'use_sma': True, 'use_atr': True, 'use_adx': False, 'use_ema': True, 'use_spike': False, 'rsi_required': False, 'edge_k': 1.4188187634813074, 'edge_cap': 0.6944801534530128, 'bull_strategy': 'breakout', 'bull_bb_std_mult': 2.685349740916688, 'bull_rsi_os': 45, 'bull_rsi_ob': 77, 'bull_adx_thresh': 34.53219782810394, 'bull_atr_min_pct': 0.023388844207739994, 'bull_atr_max_pct': 0.0759348585603909, 'bull_tp_mult': 2.234789197494881, 'bull_tsl_mult': 0.3204341172180245, 'bull_time_stop': 50, 'bull_use_sma': False, 'bull_use_ema': False, 'bull_use_atr': True, 'bull_use_adx': True, 'bull_use_spike': False, 'bull_rsi_required': False, 'bear_strategy': 'mean_reversion', 'bear_bb_std_mult': 0.9970861514065102, 'bear_rsi_os': 20, 'bear_rsi_ob': 78, 'bear_adx_thresh': 8.186176783303884, 'bear_atr_min_pct': 0.007020317080600188, 'bear_atr_max_pct': 0.03488996615351227, 'bear_tp_mult': 1.9258462626028061, 'bear_tsl_mult': 0.6774295727573892, 'bear_time_stop': 28, 'bear_use_sma': True, 'bear_use_ema': False, 'bear_use_atr': False, 'bear_use_adx': True, 'bear_use_spike': False, 'bear_rsi_required': False, 'sideways_strategy': 'mean_reversion', 'sideways_bb_std_mult': 1.078688507725062, 'sideways_rsi_os': 27, 'sideways_rsi_ob': 90, 'sideways_adx_thresh': 11.824205044067297, 'sideways_atr_min_pct': 0.02060845058929288, 'sideways_atr_max_pct': 0.11182474163814951, 'sideways_tp_mult': 1.0683042675955274, 'sideways_tsl_mult': 0.5179060812126928, 'sideways_time_stop': 200, 'sideways_use_sma': True, 'sideways_use_ema': False, 'sideways_use_atr': False, 'sideways_use_adx': False, 'sideways_use_spike': True, 'sideways_rsi_required': False}.
[I 2025-08-31 00:40:35,131] Trial 334 finished with values: [-0.016466784762160236, 0.016466427238923137] and parameters: {'p_sma': 48, 'p_std': 38, 'p_atr': 8, 'p_adx': 8, 'rsi_period': 74, 'ema1': 6, 'ema2': 52, 'slip_atr_k': 0.0404760990465545, 'slip_spread_k': 0.2256509768200312, 'spread_hl_frac': 0.020309498318971254, 'bb_std_mult': 1.8669328440781963, 'rsi_os': 23, 'rsi_ob': 50, 'vol_spike': 0.2037473588366855, 'adx_thresh': 11.993222356880047, 'atr_min_pct': 0.006442261397440592, 'atr_max_pct': 0.03590182806246918, 'tp_mult': 2.1957395645744726, 'tsl_mult': 0.8120048101938953, 'strategy': 'breakout', 'time_stop': 235, 'use_sma': True, 'use_atr': True, 'use_adx': False, 'use_ema': True, 'use_spike': False, 'rsi_required': False, 'edge_k': 0.20657300001901802, 'edge_cap': 0.7770030011009482, 'bull_strategy': 'breakout', 'bull_bb_std_mult': 2.8857132955136287, 'bull_rsi_os': 21, 'bull_rsi_ob': 91, 'bull_adx_thresh': 17.96885810828991, 'bull_atr_min_pct': 0.0011005909937757785, 'bull_atr_max_pct': 0.1154433949825045, 'bull_tp_mult': 2.4128737298664316, 'bull_tsl_mult': 0.44653247707027804, 'bull_time_stop': 5, 'bull_use_sma': False, 'bull_use_ema': False, 'bull_use_atr': True, 'bull_use_adx': False, 'bull_use_spike': False, 'bull_rsi_required': False, 'bear_strategy': 'mean_reversion', 'bear_bb_std_mult': 1.1615616819946977, 'bear_rsi_os': 21, 'bear_rsi_ob': 65, 'bear_adx_thresh': 8.229109744898128, 'bear_atr_min_pct': 0.004465851665564345, 'bear_atr_max_pct': 0.01002891849619609, 'bear_tp_mult': 2.0497488781874775, 'bear_tsl_mult': 0.6684779778496336, 'bear_time_stop': 285, 'bear_use_sma': True, 'bear_use_ema': False, 'bear_use_atr': False, 'bear_use_adx': True, 'bear_use_spike': False, 'bear_rsi_required': False, 'sideways_strategy': 'mean_reversion', 'sideways_bb_std_mult': 1.0760412303889635, 'sideways_rsi_os': 48, 'sideways_rsi_ob': 90, 'sideways_adx_thresh': 25.753246483718808, 'sideways_atr_min_pct': 0.015956255281194306, 'sideways_atr_max_pct': 0.07498225311740865, 'sideways_tp_mult': 1.077183609081953, 'sideways_tsl_mult': 0.9745999253456545, 'sideways_time_stop': 204, 'sideways_use_sma': True, 'sideways_use_ema': False, 'sideways_use_atr': False, 'sideways_use_adx': False, 'sideways_use_spike': True, 'sideways_rsi_required': True}.
[I 2025-08-31 00:40:35,323] Trial 333 finished with values: [-1000000000.0, 1000000000.0] and parameters: {'p_sma': 47, 'p_std': 38, 'p_atr': 8, 'p_adx': 8, 'rsi_period': 65, 'ema1': 29, 'ema2': 53, 'slip_atr_k': 0.1871406310698363, 'slip_spread_k': 0.23692890149902351, 'spread_hl_frac': 0.006689268433886814, 'bb_std_mult': 1.8694415533564552, 'rsi_os': 55, 'rsi_ob': 73, 'vol_spike': 0.18372102542466553, 'adx_thresh': 11.950020026652696, 'atr_min_pct': 0.022266331317218144, 'atr_max_pct': 0.04406666248034917, 'tp_mult': 1.6675355353584649, 'tsl_mult': 0.9086129640675431, 'strategy': 'breakout', 'time_stop': 85, 'use_sma': True, 'use_atr': True, 'use_adx': False, 'use_ema': True, 'use_spike': False, 'rsi_required': False, 'edge_k': 0.20946035892929138, 'edge_cap': 0.7033669519755921, 'bull_strategy': 'breakout', 'bull_bb_std_mult': 2.839876886592461, 'bull_rsi_os': 38, 'bull_rsi_ob': 79, 'bull_adx_thresh': 13.55037784757961, 'bull_atr_min_pct': 0.0014763408697314317, 'bull_atr_max_pct': 0.11585402861811717, 'bull_tp_mult': 2.4226095746345693, 'bull_tsl_mult': 0.3610729093162115, 'bull_time_stop': 232, 'bull_use_sma': False, 'bull_use_ema': False, 'bull_use_atr': True, 'bull_use_adx': False, 'bull_use_spike': False, 'bull_rsi_required': False, 'bear_strategy': 'mean_reversion', 'bear_bb_std_mult': 0.9916554450456764, 'bear_rsi_os': 15, 'bear_rsi_ob': 77, 'bear_adx_thresh': 6.884081074229133, 'bear_atr_min_pct': 0.027111739544796273, 'bear_atr_max_pct': 0.0326685533584961, 'bear_tp_mult': 2.0420467581316095, 'bear_tsl_mult': 0.6859028855175937, 'bear_time_stop': 28, 'bear_use_sma': True, 'bear_use_ema': False, 'bear_use_atr': False, 'bear_use_adx': True, 'bear_use_spike': False, 'bear_rsi_required': False, 'sideways_strategy': 'mean_reversion', 'sideways_bb_std_mult': 1.0337039340421204, 'sideways_rsi_os': 48, 'sideways_rsi_ob': 90, 'sideways_adx_thresh': 13.924211775173053, 'sideways_atr_min_pct': 0.002058499870947946, 'sideways_atr_max_pct': 0.023453553079741486, 'sideways_tp_mult': 2.427675357296204, 'sideways_tsl_mult': 0.517390397550206, 'sideways_time_stop': 191, 'sideways_use_sma': True, 'sideways_use_ema': False, 'sideways_use_atr': False, 'sideways_use_adx': False, 'sideways_use_spike': True, 'sideways_rsi_required': True}.
[I 2025-08-31 00:41:04,780] Trial 336 finished with values: [-1000000000.0, 1000000000.0] and parameters: {'p_sma': 48, 'p_std': 40, 'p_atr': 9, 'p_adx': 28, 'rsi_period': 64, 'ema1': 23, 'ema2': 32, 'slip_atr_k': 0.03891012306644896, 'slip_spread_k': 0.2633801914183554, 'spread_hl_frac': 0.006340304795052958, 'bb_std_mult': 1.8112339817702874, 'rsi_os': 23, 'rsi_ob': 50, 'vol_spike': 0.1818886947402002, 'adx_thresh': 12.135185769413797, 'atr_min_pct': 0.011001853338527302, 'atr_max_pct': 0.03636406901083938, 'tp_mult': 2.1846402298993755, 'tsl_mult': 0.08118022444681111, 'strategy': 'breakout', 'time_stop': 233, 'use_sma': False, 'use_atr': True, 'use_adx': False, 'use_ema': True, 'use_spike': False, 'rsi_required': False, 'edge_k': 0.9116986602885466, 'edge_cap': 0.7563465551757367, 'bull_strategy': 'breakout', 'bull_bb_std_mult': 2.8872767993960826, 'bull_rsi_os': 17, 'bull_rsi_ob': 68, 'bull_adx_thresh': 14.63821047205265, 'bull_atr_min_pct': 0.002197229298377816, 'bull_atr_max_pct': 0.07802617822760101, 'bull_tp_mult': 2.505945910429907, 'bull_tsl_mult': 0.6316652509349836, 'bull_time_stop': 258, 'bull_use_sma': False, 'bull_use_ema': False, 'bull_use_atr': True, 'bull_use_adx': False, 'bull_use_spike': True, 'bull_rsi_required': False, 'bear_strategy': 'mean_reversion', 'bear_bb_std_mult': 1.0135794761411852, 'bear_rsi_os': 20, 'bear_rsi_ob': 78, 'bear_adx_thresh': 8.029646542352978, 'bear_atr_min_pct': 0.027084635595772982, 'bear_atr_max_pct': 0.029685275650871704, 'bear_tp_mult': 2.02549864554458, 'bear_tsl_mult': 0.7129241027169264, 'bear_time_stop': 151, 'bear_use_sma': True, 'bear_use_ema': False, 'bear_use_atr': False, 'bear_use_adx': True, 'bear_use_spike': False, 'bear_rsi_required': False, 'sideways_strategy': 'mean_reversion', 'sideways_bb_std_mult': 1.1002533593664447, 'sideways_rsi_os': 27, 'sideways_rsi_ob': 90, 'sideways_adx_thresh': 13.757084480490377, 'sideways_atr_min_pct': 0.01944035020272355, 'sideways_atr_max_pct': 0.11214622430383536, 'sideways_tp_mult': 1.067321981158657, 'sideways_tsl_mult': 0.5396888839155025, 'sideways_time_stop': 148, 'sideways_use_sma': True, 'sideways_use_ema': False, 'sideways_use_atr': False, 'sideways_use_adx': True, 'sideways_use_spike': False, 'sideways_rsi_required': False}.
[I 2025-08-31 00:41:05,263] Trial 338 finished with values: [-1000000000.0, 1000000000.0] and parameters: {'p_sma': 46, 'p_std': 49, 'p_atr': 21, 'p_adx': 8, 'rsi_period': 75, 'ema1': 20, 'ema2': 33, 'slip_atr_k': 0.03741593494794182, 'slip_spread_k': 0.26754195362640043, 'spread_hl_frac': 0.006444401666382136, 'bb_std_mult': 0.5686849309430049, 'rsi_os': 14, 'rsi_ob': 89, 'vol_spike': 0.2075151609973659, 'adx_thresh': 31.663470255939025, 'atr_min_pct': 0.012153607589685783, 'atr_max_pct': 0.06908819917558785, 'tp_mult': 2.6060026724035366, 'tsl_mult': 0.07944786705493875, 'strategy': 'breakout', 'time_stop': 63, 'use_sma': False, 'use_atr': True, 'use_adx': False, 'use_ema': True, 'use_spike': False, 'rsi_required': False, 'edge_k': 0.9040377219737266, 'edge_cap': 0.7778521517996788, 'bull_strategy': 'breakout', 'bull_bb_std_mult': 2.808107125375212, 'bull_rsi_os': 38, 'bull_rsi_ob': 68, 'bull_adx_thresh': 14.403394145563361, 'bull_atr_min_pct': 0.025393863728066825, 'bull_atr_max_pct': 0.12326688485411455, 'bull_tp_mult': 2.504152210318546, 'bull_tsl_mult': 0.4106634480033541, 'bull_time_stop': 289, 'bull_use_sma': False, 'bull_use_ema': False, 'bull_use_atr': True, 'bull_use_adx': False, 'bull_use_spike': True, 'bull_rsi_required': False, 'bear_strategy': 'mean_reversion', 'bear_bb_std_mult': 2.156120229199959, 'bear_rsi_os': 15, 'bear_rsi_ob': 77, 'bear_adx_thresh': 7.072653031318016, 'bear_atr_min_pct': 0.010535120531582202, 'bear_atr_max_pct': 0.04185487167148254, 'bear_tp_mult': 2.0501625069551053, 'bear_tsl_mult': 0.9146389090025415, 'bear_time_stop': 12, 'bear_use_sma': True, 'bear_use_ema': False, 'bear_use_atr': False, 'bear_use_adx': True, 'bear_use_spike': True, 'bear_rsi_required': False, 'sideways_strategy': 'mean_reversion', 'sideways_bb_std_mult': 1.204467983640539, 'sideways_rsi_os': 43, 'sideways_rsi_ob': 89, 'sideways_adx_thresh': 31.792854406802988, 'sideways_atr_min_pct': 0.002158673384900372, 'sideways_atr_max_pct': 0.14134850466152857, 'sideways_tp_mult': 1.9189682733607751, 'sideways_tsl_mult': 0.5399461903071902, 'sideways_time_stop': 145, 'sideways_use_sma': True, 'sideways_use_ema': False, 'sideways_use_atr': False, 'sideways_use_adx': True, 'sideways_use_spike': False, 'sideways_rsi_required': False}.
[I 2025-08-31 00:41:05,349] Trial 339 finished with values: [-1000000000.0, 1000000000.0] and parameters: {'p_sma': 51, 'p_std': 46, 'p_atr': 21, 'p_adx': 9, 'rsi_period': 59, 'ema1': 19, 'ema2': 46, 'slip_atr_k': 0.037260962922071685, 'slip_spread_k': 0.1811504302620534, 'spread_hl_frac': 0.02069278208459638, 'bb_std_mult': 1.4956695632254862, 'rsi_os': 54, 'rsi_ob': 77, 'vol_spike': 0.20665962538405938, 'adx_thresh': 12.651485398545649, 'atr_min_pct': 0.0026203983470808687, 'atr_max_pct': 0.06901745769419702, 'tp_mult': 2.5786702501878267, 'tsl_mult': 0.08595505232414069, 'strategy': 'breakout', 'time_stop': 96, 'use_sma': False, 'use_atr': False, 'use_adx': False, 'use_ema': True, 'use_spike': False, 'rsi_required': False, 'edge_k': 0.9074346258036042, 'edge_cap': 0.7771684086290935, 'bull_strategy': 'breakout', 'bull_bb_std_mult': 2.7347126651668643, 'bull_rsi_os': 50, 'bull_rsi_ob': 68, 'bull_adx_thresh': 14.671650958178175, 'bull_atr_min_pct': 0.0021074574896636587, 'bull_atr_max_pct': 0.07907631918189267, 'bull_tp_mult': 1.509648073244974, 'bull_tsl_mult': 0.04363663972419507, 'bull_time_stop': 156, 'bull_use_sma': False, 'bull_use_ema': False, 'bull_use_atr': True, 'bull_use_adx': True, 'bull_use_spike': True, 'bull_rsi_required': False, 'bear_strategy': 'mean_reversion', 'bear_bb_std_mult': 1.6286801608216517, 'bear_rsi_os': 40, 'bear_rsi_ob': 79, 'bear_adx_thresh': 7.78764133659012, 'bear_atr_min_pct': 0.010994875360240589, 'bear_atr_max_pct': 0.0394070304823735, 'bear_tp_mult': 1.7866185930962413, 'bear_tsl_mult': 0.7768174795556075, 'bear_time_stop': 152, 'bear_use_sma': True, 'bear_use_ema': False, 'bear_use_atr': False, 'bear_use_adx': True, 'bear_use_spike': True, 'bear_rsi_required': False, 'sideways_strategy': 'mean_reversion', 'sideways_bb_std_mult': 2.985393817975385, 'sideways_rsi_os': 43, 'sideways_rsi_ob': 88, 'sideways_adx_thresh': 15.056312046550516, 'sideways_atr_min_pct': 0.01972443857824058, 'sideways_atr_max_pct': 0.14000796461679896, 'sideways_tp_mult': 2.370296376880061, 'sideways_tsl_mult': 0.9623531708917867, 'sideways_time_stop': 132, 'sideways_use_sma': True, 'sideways_use_ema': False, 'sideways_use_atr': False, 'sideways_use_adx': True, 'sideways_use_spike': False, 'sideways_rsi_required': False}.
[I 2025-08-31 00:41:05,423] Trial 337 finished with values: [-1000000000.0, 1000000000.0] and parameters: {'p_sma': 58, 'p_std': 11, 'p_atr': 9, 'p_adx': 8, 'rsi_period': 64, 'ema1': 30, 'ema2': 46, 'slip_atr_k': 0.03997048939379105, 'slip_spread_k': 0.2996205071249385, 'spread_hl_frac': 0.019916504458152687, 'bb_std_mult': 1.8041347800616985, 'rsi_os': 14, 'rsi_ob': 63, 'vol_spike': 0.1808217311438127, 'adx_thresh': 14.90636227347515, 'atr_min_pct': 0.027814363428879926, 'atr_max_pct': 0.06801920936539602, 'tp_mult': 2.586159050941173, 'tsl_mult': 0.03083755961150414, 'strategy': 'breakout', 'time_stop': 95, 'use_sma': False, 'use_atr': True, 'use_adx': False, 'use_ema': True, 'use_spike': False, 'rsi_required': False, 'edge_k': 0.764327639465075, 'edge_cap': 0.1497867675020736, 'bull_strategy': 'breakout', 'bull_bb_std_mult': 2.856081949223412, 'bull_rsi_os': 38, 'bull_rsi_ob': 91, 'bull_adx_thresh': 14.651475383123804, 'bull_atr_min_pct': 0.0020833624102064774, 'bull_atr_max_pct': 0.07791845328199867, 'bull_tp_mult': 2.405778472842674, 'bull_tsl_mult': 0.6967600076477374, 'bull_time_stop': 142, 'bull_use_sma': False, 'bull_use_ema': False, 'bull_use_atr': True, 'bull_use_adx': False, 'bull_use_spike': True, 'bull_rsi_required': False, 'bear_strategy': 'mean_reversion', 'bear_bb_std_mult': 2.159287546727884, 'bear_rsi_os': 24, 'bear_rsi_ob': 75, 'bear_adx_thresh': 8.025308918511309, 'bear_atr_min_pct': 0.02734500211319524, 'bear_atr_max_pct': 0.029429196291481267, 'bear_tp_mult': 1.9208782486790767, 'bear_tsl_mult': 0.9138439154619473, 'bear_time_stop': 152, 'bear_use_sma': True, 'bear_use_ema': False, 'bear_use_atr': False, 'bear_use_adx': True, 'bear_use_spike': False, 'bear_rsi_required': False, 'sideways_strategy': 'mean_reversion', 'sideways_bb_std_mult': 1.237490887738831, 'sideways_rsi_os': 18, 'sideways_rsi_ob': 89, 'sideways_adx_thresh': 13.666370060590545, 'sideways_atr_min_pct': 0.019101881978492486, 'sideways_atr_max_pct': 0.14114509078329396, 'sideways_tp_mult': 2.4470121141217462, 'sideways_tsl_mult': 0.5691838960967242, 'sideways_time_stop': 144, 'sideways_use_sma': True, 'sideways_use_ema': False, 'sideways_use_atr': False, 'sideways_use_adx': True, 'sideways_use_spike': False, 'sideways_rsi_required': False}.
[I 2025-08-31 00:41:36,594] Trial 340 finished with values: [-0.01591712252226385, 0.01592437415122786] and parameters: {'p_sma': 50, 'p_std': 39, 'p_atr': 21, 'p_adx': 9, 'rsi_period': 58, 'ema1': 7, 'ema2': 20, 'slip_atr_k': 0.03548035604669505, 'slip_spread_k': 0.27452787561966113, 'spread_hl_frac': 0.009344728030332474, 'bb_std_mult': 0.5476900235072846, 'rsi_os': 54, 'rsi_ob': 63, 'vol_spike': 0.20773595142112106, 'adx_thresh': 18.540572660266363, 'atr_min_pct': 0.0028396681055610573, 'atr_max_pct': 0.0700100842463523, 'tp_mult': 2.571187576012812, 'tsl_mult': 0.13253016820430025, 'strategy': 'breakout', 'time_stop': 202, 'use_sma': False, 'use_atr': False, 'use_adx': False, 'use_ema': True, 'use_spike': True, 'rsi_required': False, 'edge_k': 1.7359554154315782, 'edge_cap': 0.8504027328869019, 'bull_strategy': 'breakout', 'bull_bb_std_mult': 2.7944688449926893, 'bull_rsi_os': 39, 'bull_rsi_ob': 91, 'bull_adx_thresh': 14.094047392207052, 'bull_atr_min_pct': 0.00019140449077085315, 'bull_atr_max_pct': 0.07008123868158465, 'bull_tp_mult': 1.4047349902874269, 'bull_tsl_mult': 0.05217781451305764, 'bull_time_stop': 289, 'bull_use_sma': False, 'bull_use_ema': False, 'bull_use_atr': True, 'bull_use_adx': True, 'bull_use_spike': True, 'bull_rsi_required': True, 'bear_strategy': 'mean_reversion', 'bear_bb_std_mult': 1.2973889858531362, 'bear_rsi_os': 24, 'bear_rsi_ob': 76, 'bear_adx_thresh': 7.362811702298006, 'bear_atr_min_pct': 0.01082642886389774, 'bear_atr_max_pct': 0.028056669679260734, 'bear_tp_mult': 2.9314369353321896, 'bear_tsl_mult': 0.7705305274631575, 'bear_time_stop': 116, 'bear_use_sma': True, 'bear_use_ema': True, 'bear_use_atr': False, 'bear_use_adx': True, 'bear_use_spike': True, 'bear_rsi_required': False, 'sideways_strategy': 'mean_reversion', 'sideways_bb_std_mult': 3.4554134417246485, 'sideways_rsi_os': 44, 'sideways_rsi_ob': 53, 'sideways_adx_thresh': 14.73249358845198, 'sideways_atr_min_pct': 0.02202935911807262, 'sideways_atr_max_pct': 0.1402541459672416, 'sideways_tp_mult': 1.0958068314355827, 'sideways_tsl_mult': 0.8826735009464668, 'sideways_time_stop': 209, 'sideways_use_sma': True, 'sideways_use_ema': True, 'sideways_use_atr': True, 'sideways_use_adx': True, 'sideways_use_spike': False, 'sideways_rsi_required': False}.
[I 2025-08-31 00:41:36,993] Trial 342 finished with values: [-0.02748278036841878, 0.027379385924798078] and parameters: {'p_sma': 11, 'p_std': 11, 'p_atr': 20, 'p_adx': 8, 'rsi_period': 57, 'ema1': 7, 'ema2': 19, 'slip_atr_k': 0.181156223165366, 'slip_spread_k': 0.32175744791885064, 'spread_hl_frac': 0.009331211868953887, 'bb_std_mult': 2.885420231145817, 'rsi_os': 36, 'rsi_ob': 63, 'vol_spike': 0.21202210488676868, 'adx_thresh': 15.006978630088106, 'atr_min_pct': 0.009252545284864477, 'atr_max_pct': 0.08919905178469244, 'tp_mult': 2.6421234845831965, 'tsl_mult': 0.03487190494013587, 'strategy': 'breakout', 'time_stop': 75, 'use_sma': True, 'use_atr': False, 'use_adx': False, 'use_ema': True, 'use_spike': True, 'rsi_required': False, 'edge_k': 0.758367282147738, 'edge_cap': 0.16303264718524912, 'bull_strategy': 'breakout', 'bull_bb_std_mult': 2.711995589148264, 'bull_rsi_os': 39, 'bull_rsi_ob': 91, 'bull_adx_thresh': 13.955535153202293, 'bull_atr_min_pct': 7.975613675000818e-05, 'bull_atr_max_pct': 0.13601745967227957, 'bull_tp_mult': 2.4693826157655905, 'bull_tsl_mult': 0.370861321983445, 'bull_time_stop': 245, 'bull_use_sma': True, 'bull_use_ema': False, 'bull_use_atr': True, 'bull_use_adx': True, 'bull_use_spike': False, 'bull_rsi_required': True, 'bear_strategy': 'mean_reversion', 'bear_bb_std_mult': 1.3057180634897114, 'bear_rsi_os': 10, 'bear_rsi_ob': 76, 'bear_adx_thresh': 7.401012661556969, 'bear_atr_min_pct': 0.008876208113648499, 'bear_atr_max_pct': 0.03841801391351936, 'bear_tp_mult': 1.9313920663340731, 'bear_tsl_mult': 0.666527154399879, 'bear_time_stop': 172, 'bear_use_sma': True, 'bear_use_ema': True, 'bear_use_atr': False, 'bear_use_adx': True, 'bear_use_spike': False, 'bear_rsi_required': False, 'sideways_strategy': 'mean_reversion', 'sideways_bb_std_mult': 2.094616937226917, 'sideways_rsi_os': 13, 'sideways_rsi_ob': 58, 'sideways_adx_thresh': 20.952252167879188, 'sideways_atr_min_pct': 0.022046403867843185, 'sideways_atr_max_pct': 0.14703250465613424, 'sideways_tp_mult': 1.787026745624192, 'sideways_tsl_mult': 0.8211711987815091, 'sideways_time_stop': 202, 'sideways_use_sma': True, 'sideways_use_ema': True, 'sideways_use_atr': True, 'sideways_use_adx': False, 'sideways_use_spike': True, 'sideways_rsi_required': False}.
