[I 2025-08-31 03:12:09,916] Trial 827 finished with values: [-1000000000.0, 1000000000.0] and parameters: {'p_sma': 37, 'p_std': 50, 'p_atr': 29, 'p_adx': 14, 'rsi_period': 68, 'ema1': 19, 'ema2': 60, 'slip_atr_k': 0.04925064318920444, 'slip_spread_k': 0.9980070792491038, 'spread_hl_frac': 0.03405774379269495, 'bb_std_mult': 2.0595156713614524, 'rsi_os': 8, 'rsi_ob': 69, 'vol_spike': 0.19371697104943894, 'adx_thresh': 20.595333118402984, 'atr_min_pct': 0.008032308784692386, 'atr_max_pct': 0.1266835104697844, 'tp_mult': 2.238407692738507, 'tsl_mult': 0.4433635687826398, 'strategy': 'mean_reversion', 'time_stop': 98, 'use_sma': False, 'use_atr': False, 'use_adx': False, 'use_ema': False, 'use_spike': False, 'rsi_required': False, 'edge_k': 0.5722217264713338, 'edge_cap': 0.15150343513955955, 'bull_strategy': 'mean_reversion', 'bull_bb_std_mult': 0.6474863891772356, 'bull_rsi_os': 27, 'bull_rsi_ob': 66, 'bull_adx_thresh': 33.650246408499, 'bull_atr_min_pct': 0.003049670137529702, 'bull_atr_max_pct': 0.13583396114707758, 'bull_tp_mult': 2.368173088814614, 'bull_tsl_mult': 0.7601988803164422, 'bull_time_stop': 187, 'bull_use_sma': True, 'bull_use_ema': False, 'bull_use_atr': False, 'bull_use_adx': True, 'bull_use_spike': True, 'bull_rsi_required': True, 'bear_strategy': 'breakout', 'bear_bb_std_mult': 1.846187634208607, 'bear_rsi_os': 31, 'bear_rsi_ob': 58, 'bear_adx_thresh': 32.322358085046616, 'bear_atr_min_pct': 0.0267043905258698, 'bear_atr_max_pct': 0.08161285593405976, 'bear_tp_mult': 1.1237017688596564, 'bear_tsl_mult': 0.5927194444079611, 'bear_time_stop': 11, 'bear_use_sma': False, 'bear_use_ema': False, 'bear_use_atr': True, 'bear_use_adx': True, 'bear_use_spike': False, 'bear_rsi_required': True, 'sideways_strategy': 'breakout', 'sideways_bb_std_mult': 0.5671436127359779, 'sideways_rsi_os': 43, 'sideways_rsi_ob': 55, 'sideways_adx_thresh': 8.118142805924988, 'sideways_atr_min_pct': 0.026313927912294324, 'sideways_atr_max_pct': 0.055296478137054066, 'sideways_tp_mult': 1.4083707473728766, 'sideways_tsl_mult': 0.5606081219853121, 'sideways_time_stop': 121, 'sideways_use_sma': True, 'sideways_use_ema': False, 'sideways_use_atr': False, 'sideways_use_adx': False, 'sideways_use_spike': False, 'sideways_rsi_required': False}.
[I 2025-08-31 03:12:10,599] Trial 830 finished with values: [-1000000000.0, 1000000000.0] and parameters: {'p_sma': 60, 'p_std': 50, 'p_atr': 30, 'p_adx': 15, 'rsi_period': 76, 'ema1': 6, 'ema2': 43, 'slip_atr_k': 0.2400370293593135, 'slip_spread_k': 0.10075839779166418, 'spread_hl_frac': 0.016104227059567794, 'bb_std_mult': 0.5010844807789288, 'rsi_os': 37, 'rsi_ob': 68, 'vol_spike': 0.19295458349641853, 'adx_thresh': 20.551239234246392, 'atr_min_pct': 0.027546368003453742, 'atr_max_pct': 0.12481562640975714, 'tp_mult': 2.117382959065493, 'tsl_mult': 0.5219437354099477, 'strategy': 'breakout', 'time_stop': 125, 'use_sma': True, 'use_atr': False, 'use_adx': False, 'use_ema': False, 'use_spike': False, 'rsi_required': False, 'edge_k': 0.6326076463359912, 'edge_cap': 0.30179848721738933, 'bull_strategy': 'mean_reversion', 'bull_bb_std_mult': 1.0543377818384083, 'bull_rsi_os': 42, 'bull_rsi_ob': 62, 'bull_adx_thresh': 30.587219484141034, 'bull_atr_min_pct': 0.01912148429539033, 'bull_atr_max_pct': 0.04442863501367267, 'bull_tp_mult': 2.3632348708762354, 'bull_tsl_mult': 0.8273146646031752, 'bull_time_stop': 147, 'bull_use_sma': True, 'bull_use_ema': False, 'bull_use_atr': False, 'bull_use_adx': True, 'bull_use_spike': True, 'bull_rsi_required': True, 'bear_strategy': 'mean_reversion', 'bear_bb_std_mult': 1.1962003935993897, 'bear_rsi_os': 17, 'bear_rsi_ob': 51, 'bear_adx_thresh': 6.102989413861718, 'bear_atr_min_pct': 0.02792303358634938, 'bear_atr_max_pct': 0.010120978211904462, 'bear_tp_mult': 1.9660673785659195, 'bear_tsl_mult': 0.5465006942007345, 'bear_time_stop': 294, 'bear_use_sma': False, 'bear_use_ema': False, 'bear_use_atr': False, 'bear_use_adx': True, 'bear_use_spike': False, 'bear_rsi_required': True, 'sideways_strategy': 'breakout', 'sideways_bb_std_mult': 0.5025758148795749, 'sideways_rsi_os': 26, 'sideways_rsi_ob': 55, 'sideways_adx_thresh': 8.242933180675843, 'sideways_atr_min_pct': 0.02780544658426333, 'sideways_atr_max_pct': 0.05497591762505499, 'sideways_tp_mult': 2.3834748793077782, 'sideways_tsl_mult': 0.6633554248914295, 'sideways_time_stop': 37, 'sideways_use_sma': True, 'sideways_use_ema': False, 'sideways_use_atr': False, 'sideways_use_adx': False, 'sideways_use_spike': True, 'sideways_rsi_required': False}.
[I 2025-08-31 03:12:10,995] Trial 829 finished with values: [-1000000000.0, 1000000000.0] and parameters: {'p_sma': 28, 'p_std': 50, 'p_atr': 30, 'p_adx': 20, 'rsi_period': 46, 'ema1': 6, 'ema2': 33, 'slip_atr_k': 0.06361969016505233, 'slip_spread_k': 0.17547338112131072, 'spread_hl_frac': 0.044108479593018564, 'bb_std_mult': 1.74431644298298, 'rsi_os': 12, 'rsi_ob': 64, 'vol_spike': 0.19390020178862236, 'adx_thresh': 20.543490367754284, 'atr_min_pct': 0.015025512777861112, 'atr_max_pct': 0.1270566906748395, 'tp_mult': 1.056886271043425, 'tsl_mult': 0.4149972670826169, 'strategy': 'breakout', 'time_stop': 44, 'use_sma': True, 'use_atr': False, 'use_adx': False, 'use_ema': False, 'use_spike': False, 'rsi_required': False, 'edge_k': 0.6314660076360656, 'edge_cap': 0.18207367920252512, 'bull_strategy': 'mean_reversion', 'bull_bb_std_mult': 2.159753658535589, 'bull_rsi_os': 32, 'bull_rsi_ob': 65, 'bull_adx_thresh': 7.0495348256630885, 'bull_atr_min_pct': 0.0024333691505545206, 'bull_atr_max_pct': 0.1367019288052259, 'bull_tp_mult': 2.3652138233797313, 'bull_tsl_mult': 0.24254486929257246, 'bull_time_stop': 147, 'bull_use_sma': True, 'bull_use_ema': False, 'bull_use_atr': False, 'bull_use_adx': True, 'bull_use_spike': True, 'bull_rsi_required': True, 'bear_strategy': 'mean_reversion', 'bear_bb_std_mult': 1.21917805715598, 'bear_rsi_os': 17, 'bear_rsi_ob': 61, 'bear_adx_thresh': 5.026346848406266, 'bear_atr_min_pct': 0.02508062386577197, 'bear_atr_max_pct': 0.015454032321671168, 'bear_tp_mult': 1.9764881567442218, 'bear_tsl_mult': 0.5867930759899878, 'bear_time_stop': 27, 'bear_use_sma': False, 'bear_use_ema': False, 'bear_use_atr': False, 'bear_use_adx': True, 'bear_use_spike': False, 'bear_rsi_required': True, 'sideways_strategy': 'breakout', 'sideways_bb_std_mult': 0.5005550983495817, 'sideways_rsi_os': 43, 'sideways_rsi_ob': 80, 'sideways_adx_thresh': 24.44330951917369, 'sideways_atr_min_pct': 0.027757614157935262, 'sideways_atr_max_pct': 0.09334963151535397, 'sideways_tp_mult': 1.3963731800020556, 'sideways_tsl_mult': 0.5662577599683724, 'sideways_time_stop': 8, 'sideways_use_sma': True, 'sideways_use_ema': False, 'sideways_use_atr': False, 'sideways_use_adx': False, 'sideways_use_spike': True, 'sideways_rsi_required': False}.
[I 2025-08-31 03:12:44,147] Trial 831 finished with values: [-1000000000.0, 1000000000.0] and parameters: {'p_sma': 14, 'p_std': 49, 'p_atr': 7, 'p_adx': 20, 'rsi_period': 72, 'ema1': 21, 'ema2': 25, 'slip_atr_k': 0.12048404400519017, 'slip_spread_k': 0.8330675999081301, 'spread_hl_frac': 0.04280330297150385, 'bb_std_mult': 0.8505477571130791, 'rsi_os': 37, 'rsi_ob': 69, 'vol_spike': 0.027370491902302257, 'adx_thresh': 20.510069931876156, 'atr_min_pct': 0.008062019323535683, 'atr_max_pct': 0.09927273643171067, 'tp_mult': 2.4875404192903794, 'tsl_mult': 0.42160109991099526, 'strategy': 'breakout', 'time_stop': 105, 'use_sma': True, 'use_atr': False, 'use_adx': False, 'use_ema': False, 'use_spike': False, 'rsi_required': False, 'edge_k': 1.28302993719406, 'edge_cap': 0.45139263123979045, 'bull_strategy': 'breakout', 'bull_bb_std_mult': 3.5988278613178544, 'bull_rsi_os': 20, 'bull_rsi_ob': 65, 'bull_adx_thresh': 32.78635011264523, 'bull_atr_min_pct': 0.02754407427814342, 'bull_atr_max_pct': 0.14405201420116662, 'bull_tp_mult': 2.3539083111314403, 'bull_tsl_mult': 0.7643837482707223, 'bull_time_stop': 115, 'bull_use_sma': True, 'bull_use_ema': False, 'bull_use_atr': False, 'bull_use_adx': True, 'bull_use_spike': True, 'bull_rsi_required': True, 'bear_strategy': 'mean_reversion', 'bear_bb_std_mult': 1.271863789611633, 'bear_rsi_os': 17, 'bear_rsi_ob': 45, 'bear_adx_thresh': 6.096319626424556, 'bear_atr_min_pct': 0.00631415606371983, 'bear_atr_max_pct': 0.059669044436812105, 'bear_tp_mult': 1.2710676335462994, 'bear_tsl_mult': 0.5383230834402701, 'bear_time_stop': 10, 'bear_use_sma': False, 'bear_use_ema': False, 'bear_use_atr': False, 'bear_use_adx': True, 'bear_use_spike': False, 'bear_rsi_required': True, 'sideways_strategy': 'breakout', 'sideways_bb_std_mult': 3.455308860087004, 'sideways_rsi_os': 41, 'sideways_rsi_ob': 93, 'sideways_adx_thresh': 23.077864590535274, 'sideways_atr_min_pct': 0.01767842801514297, 'sideways_atr_max_pct': 0.08378262954447156, 'sideways_tp_mult': 2.784709989836384, 'sideways_tsl_mult': 0.6685932933967889, 'sideways_time_stop': 205, 'sideways_use_sma': True, 'sideways_use_ema': False, 'sideways_use_atr': False, 'sideways_use_adx': False, 'sideways_use_spike': True, 'sideways_rsi_required': False}.
[I 2025-08-31 03:12:45,265] Trial 834 finished with values: [-1000000000.0, 1000000000.0] and parameters: {'p_sma': 22, 'p_std': 52, 'p_atr': 9, 'p_adx': 28, 'rsi_period': 72, 'ema1': 18, 'ema2': 25, 'slip_atr_k': 0.07018657342495326, 'slip_spread_k': 0.47001506948171534, 'spread_hl_frac': 0.0011209563105887622, 'bb_std_mult': 2.8279521704609247, 'rsi_os': 10, 'rsi_ob': 51, 'vol_spike': 0.2729756014037338, 'adx_thresh': 21.280988451542335, 'atr_min_pct': 0.008662431978062352, 'atr_max_pct': 0.11683957180650803, 'tp_mult': 2.4877835943706046, 'tsl_mult': 0.18055347134249305, 'strategy': 'mean_reversion', 'time_stop': 108, 'use_sma': True, 'use_atr': False, 'use_adx': False, 'use_ema': False, 'use_spike': False, 'rsi_required': True, 'edge_k': 0.36694835675025095, 'edge_cap': 0.1092114164385653, 'bull_strategy': 'breakout', 'bull_bb_std_mult': 2.22935606350787, 'bull_rsi_os': 30, 'bull_rsi_ob': 74, 'bull_adx_thresh': 5.067117942714882, 'bull_atr_min_pct': 0.013139636899577279, 'bull_atr_max_pct': 0.021415592833551593, 'bull_tp_mult': 2.3214270022611525, 'bull_tsl_mult': 0.43216091722593364, 'bull_time_stop': 117, 'bull_use_sma': True, 'bull_use_ema': True, 'bull_use_atr': False, 'bull_use_adx': True, 'bull_use_spike': True, 'bull_rsi_required': True, 'bear_strategy': 'mean_reversion', 'bear_bb_std_mult': 1.2876429970014598, 'bear_rsi_os': 16, 'bear_rsi_ob': 45, 'bear_adx_thresh': 5.018714758629807, 'bear_atr_min_pct': 0.0063881003174231675, 'bear_atr_max_pct': 0.058039082380085864, 'bear_tp_mult': 1.5058018444891876, 'bear_tsl_mult': 0.793902406616473, 'bear_time_stop': 11, 'bear_use_sma': True, 'bear_use_ema': False, 'bear_use_atr': False, 'bear_use_adx': False, 'bear_use_spike': False, 'bear_rsi_required': False, 'sideways_strategy': 'breakout', 'sideways_bb_std_mult': 3.4376049261105397, 'sideways_rsi_os': 41, 'sideways_rsi_ob': 93, 'sideways_adx_thresh': 34.87691726645853, 'sideways_atr_min_pct': 0.0289958851117647, 'sideways_atr_max_pct': 0.05941913172303316, 'sideways_tp_mult': 1.7697759124334826, 'sideways_tsl_mult': 0.6695506925353505, 'sideways_time_stop': 202, 'sideways_use_sma': True, 'sideways_use_ema': True, 'sideways_use_atr': True, 'sideways_use_adx': True, 'sideways_use_spike': True, 'sideways_rsi_required': True}.
[I 2025-08-31 03:12:45,265] Trial 833 finished with values: [-1000000000.0, 1000000000.0] and parameters: {'p_sma': 22, 'p_std': 52, 'p_atr': 7, 'p_adx': 18, 'rsi_period': 47, 'ema1': 5, 'ema2': 51, 'slip_atr_k': 0.09288484730814846, 'slip_spread_k': 0.06627290710616314, 'spread_hl_frac': 0.0034872034281282797, 'bb_std_mult': 1.7301822872764316, 'rsi_os': 6, 'rsi_ob': 70, 'vol_spike': 0.17995458758273597, 'adx_thresh': 21.411603486437592, 'atr_min_pct': 0.02415530435450392, 'atr_max_pct': 0.13928160922867844, 'tp_mult': 1.1181179873894256, 'tsl_mult': 0.18273604196852844, 'strategy': 'breakout', 'time_stop': 108, 'use_sma': True, 'use_atr': False, 'use_adx': False, 'use_ema': False, 'use_spike': False, 'rsi_required': True, 'edge_k': 0.3746872228320195, 'edge_cap': 0.9637397139100263, 'bull_strategy': 'breakout', 'bull_bb_std_mult': 1.6868446223226101, 'bull_rsi_os': 30, 'bull_rsi_ob': 48, 'bull_adx_thresh': 5.0027246233986045, 'bull_atr_min_pct': 0.012793910274317822, 'bull_atr_max_pct': 0.14463098312154957, 'bull_tp_mult': 2.2692153641865502, 'bull_tsl_mult': 0.13461020443963007, 'bull_time_stop': 227, 'bull_use_sma': True, 'bull_use_ema': True, 'bull_use_atr': False, 'bull_use_adx': True, 'bull_use_spike': True, 'bull_rsi_required': True, 'bear_strategy': 'mean_reversion', 'bear_bb_std_mult': 1.3033493904502393, 'bear_rsi_os': 16, 'bear_rsi_ob': 83, 'bear_adx_thresh': 5.507835525503576, 'bear_atr_min_pct': 0.006362974076369422, 'bear_atr_max_pct': 0.010247973396085982, 'bear_tp_mult': 2.086249119801367, 'bear_tsl_mult': 0.528009755235683, 'bear_time_stop': 279, 'bear_use_sma': True, 'bear_use_ema': False, 'bear_use_atr': False, 'bear_use_adx': False, 'bear_use_spike': False, 'bear_rsi_required': False, 'sideways_strategy': 'breakout', 'sideways_bb_std_mult': 3.440902335927686, 'sideways_rsi_os': 41, 'sideways_rsi_ob': 52, 'sideways_adx_thresh': 8.969922468571399, 'sideways_atr_min_pct': 0.028928644057557608, 'sideways_atr_max_pct': 0.0602129790766816, 'sideways_tp_mult': 1.7966647086074565, 'sideways_tsl_mult': 0.6742617046644216, 'sideways_time_stop': 300, 'sideways_use_sma': True, 'sideways_use_ema': True, 'sideways_use_atr': True, 'sideways_use_adx': True, 'sideways_use_spike': True, 'sideways_rsi_required': True}.
[I 2025-08-31 03:12:45,410] Trial 832 finished with values: [-1000000000.0, 1000000000.0] and parameters: {'p_sma': 54, 'p_std': 52, 'p_atr': 30, 'p_adx': 20, 'rsi_period': 76, 'ema1': 18, 'ema2': 21, 'slip_atr_k': 0.06214122459412688, 'slip_spread_k': 0.1807063312082117, 'spread_hl_frac': 0.0009332120536424059, 'bb_std_mult': 0.6151259888620864, 'rsi_os': 37, 'rsi_ob': 68, 'vol_spike': 0.18268323522122287, 'adx_thresh': 21.235004767462218, 'atr_min_pct': 0.008644369962754361, 'atr_max_pct': 0.03354758871528947, 'tp_mult': 1.1101004445491713, 'tsl_mult': 0.4127851353407258, 'strategy': 'breakout', 'time_stop': 125, 'use_sma': True, 'use_atr': False, 'use_adx': False, 'use_ema': False, 'use_spike': False, 'rsi_required': True, 'edge_k': 0.6348598139743435, 'edge_cap': 0.9639075624782046, 'bull_strategy': 'breakout', 'bull_bb_std_mult': 2.056617551912635, 'bull_rsi_os': 42, 'bull_rsi_ob': 55, 'bull_adx_thresh': 6.958355711741867, 'bull_atr_min_pct': 0.013145933214965388, 'bull_atr_max_pct': 0.10434595264329802, 'bull_tp_mult': 2.34401227174891, 'bull_tsl_mult': 0.3023707301355657, 'bull_time_stop': 146, 'bull_use_sma': True, 'bull_use_ema': True, 'bull_use_atr': False, 'bull_use_adx': True, 'bull_use_spike': True, 'bull_rsi_required': True, 'bear_strategy': 'mean_reversion', 'bear_bb_std_mult': 3.5985006761912777, 'bear_rsi_os': 16, 'bear_rsi_ob': 60, 'bear_adx_thresh': 17.55527766839302, 'bear_atr_min_pct': 0.0063766129916977545, 'bear_atr_max_pct': 0.059534733551278085, 'bear_tp_mult': 1.9696027612473108, 'bear_tsl_mult': 0.5362393681140734, 'bear_time_stop': 93, 'bear_use_sma': True, 'bear_use_ema': False, 'bear_use_atr': False, 'bear_use_adx': True, 'bear_use_spike': False, 'bear_rsi_required': False, 'sideways_strategy': 'breakout', 'sideways_bb_std_mult': 2.881938060712346, 'sideways_rsi_os': 8, 'sideways_rsi_ob': 93, 'sideways_adx_thresh': 8.88044263080931, 'sideways_atr_min_pct': 0.018271198385764024, 'sideways_atr_max_pct': 0.0826527202801737, 'sideways_tp_mult': 1.7827308193035316, 'sideways_tsl_mult': 0.3461586321278852, 'sideways_time_stop': 192, 'sideways_use_sma': True, 'sideways_use_ema': True, 'sideways_use_atr': True, 'sideways_use_adx': False, 'sideways_use_spike': True, 'sideways_rsi_required': True}.
[I 2025-08-31 03:12:46,483] Trial 835 finished with values: [-1000000000.0, 1000000000.0] and parameters: {'p_sma': 53, 'p_std': 52, 'p_atr': 9, 'p_adx': 28, 'rsi_period': 70, 'ema1': 5, 'ema2': 51, 'slip_atr_k': 0.09169385716937986, 'slip_spread_k': 0.13829874359694494, 'spread_hl_frac': 0.000847544827143871, 'bb_std_mult': 1.5956883520430865, 'rsi_os': 39, 'rsi_ob': 46, 'vol_spike': 0.09734006088760916, 'adx_thresh': 5.695864572053328, 'atr_min_pct': 0.004489853337590926, 'atr_max_pct': 0.11817645582998464, 'tp_mult': 1.86952364398197, 'tsl_mult': 0.21425017045001343, 'strategy': 'mean_reversion', 'time_stop': 227, 'use_sma': True, 'use_atr': False, 'use_adx': False, 'use_ema': True, 'use_spike': False, 'rsi_required': True, 'edge_k': 0.2814129239495541, 'edge_cap': 0.104977278996086, 'bull_strategy': 'breakout', 'bull_bb_std_mult': 2.6548304327787013, 'bull_rsi_os': 44, 'bull_rsi_ob': 81, 'bull_adx_thresh': 19.493274394043098, 'bull_atr_min_pct': 0.0058840455825662896, 'bull_atr_max_pct': 0.10457056726020826, 'bull_tp_mult': 2.273193016191693, 'bull_tsl_mult': 0.4192003264924366, 'bull_time_stop': 196, 'bull_use_sma': True, 'bull_use_ema': True, 'bull_use_atr': True, 'bull_use_adx': True, 'bull_use_spike': True, 'bull_rsi_required': True, 'bear_strategy': 'mean_reversion', 'bear_bb_std_mult': 3.46031577644593, 'bear_rsi_os': 16, 'bear_rsi_ob': 46, 'bear_adx_thresh': 18.500075903549657, 'bear_atr_min_pct': 0.013234673652896123, 'bear_atr_max_pct': 0.010145000504787898, 'bear_tp_mult': 2.087173637115614, 'bear_tsl_mult': 0.2666319652451352, 'bear_time_stop': 238, 'bear_use_sma': True, 'bear_use_ema': False, 'bear_use_atr': False, 'bear_use_adx': False, 'bear_use_spike': True, 'bear_rsi_required': False, 'sideways_strategy': 'breakout', 'sideways_bb_std_mult': 3.53410452345316, 'sideways_rsi_os': 38, 'sideways_rsi_ob': 93, 'sideways_adx_thresh': 34.568028641299996, 'sideways_atr_min_pct': 0.0014394717985534416, 'sideways_atr_max_pct': 0.051515895002085074, 'sideways_tp_mult': 1.7654964253508472, 'sideways_tsl_mult': 0.691031948978463, 'sideways_time_stop': 192, 'sideways_use_sma': True, 'sideways_use_ema': True, 'sideways_use_atr': True, 'sideways_use_adx': True, 'sideways_use_spike': True, 'sideways_rsi_required': True}.
[I 2025-08-31 03:12:46,500] Trial 836 finished with values: [-1000000000.0, 1000000000.0] and parameters: {'p_sma': 54, 'p_std': 51, 'p_atr': 13, 'p_adx': 27, 'rsi_period': 70, 'ema1': 5, 'ema2': 21, 'slip_atr_k': 0.11049494685582431, 'slip_spread_k': 0.7700639235673112, 'spread_hl_frac': 0.03558261150394847, 'bb_std_mult': 2.4693747237875434, 'rsi_os': 34, 'rsi_ob': 46, 'vol_spike': 0.11644687733784939, 'adx_thresh': 18.624561436227786, 'atr_min_pct': 0.009710199283743384, 'atr_max_pct': 0.05886535762349242, 'tp_mult': 1.466365676424537, 'tsl_mult': 0.6324803125031957, 'strategy': 'mean_reversion', 'time_stop': 113, 'use_sma': True, 'use_atr': False, 'use_adx': False, 'use_ema': True, 'use_spike': False, 'rsi_required': True, 'edge_k': 0.5081819959860544, 'edge_cap': 0.13233192329917315, 'bull_strategy': 'breakout', 'bull_bb_std_mult': 2.624082220261253, 'bull_rsi_os': 48, 'bull_rsi_ob': 55, 'bull_adx_thresh': 6.6026563964408425, 'bull_atr_min_pct': 0.005606473740965013, 'bull_atr_max_pct': 0.1398229340445048, 'bull_tp_mult': 2.8102300800890694, 'bull_tsl_mult': 0.20510071134813057, 'bull_time_stop': 137, 'bull_use_sma': True, 'bull_use_ema': False, 'bull_use_atr': True, 'bull_use_adx': False, 'bull_use_spike': True, 'bull_rsi_required': True, 'bear_strategy': 'mean_reversion', 'bear_bb_std_mult': 3.447646726887514, 'bear_rsi_os': 18, 'bear_rsi_ob': 46, 'bear_adx_thresh': 17.395177594226762, 'bear_atr_min_pct': 0.005167464219075263, 'bear_atr_max_pct': 0.010163077542873586, 'bear_tp_mult': 2.0151104127295816, 'bear_tsl_mult': 0.11144501105219795, 'bear_time_stop': 15, 'bear_use_sma': False, 'bear_use_ema': False, 'bear_use_atr': False, 'bear_use_adx': True, 'bear_use_spike': True, 'bear_rsi_required': True, 'sideways_strategy': 'breakout', 'sideways_bb_std_mult': 0.6714072651430075, 'sideways_rsi_os': 10, 'sideways_rsi_ob': 84, 'sideways_adx_thresh': 10.688640866259421, 'sideways_atr_min_pct': 0.015968866713918235, 'sideways_atr_max_pct': 0.05118951137102716, 'sideways_tp_mult': 1.7331427627179576, 'sideways_tsl_mult': 0.6977334689294545, 'sideways_time_stop': 193, 'sideways_use_sma': True, 'sideways_use_ema': False, 'sideways_use_atr': False, 'sideways_use_adx': False, 'sideways_use_spike': True, 'sideways_rsi_required': False}.
