[I 2025-08-31 02:58:37,380] Trial 729 finished with values: [-1000000000.0, 1000000000.0] and parameters: {'p_sma': 39, 'p_std': 53, 'p_atr': 18, 'p_adx': 15, 'rsi_period': 9, 'ema1': 5, 'ema2': 25, 'slip_atr_k': 0.06821484286193913, 'slip_spread_k': 0.5693648467281929, 'spread_hl_frac': 0.04852553510888541, 'bb_std_mult': 2.556862480136835, 'rsi_os': 31, 'rsi_ob': 67, 'vol_spike': 0.2011291958702251, 'adx_thresh': 20.63620588882623, 'atr_min_pct': 0.009314208774609504, 'atr_max_pct': 0.05605382722676064, 'tp_mult': 1.1451586270852503, 'tsl_mult': 0.47221119531452677, 'strategy': 'mean_reversion', 'time_stop': 105, 'use_sma': True, 'use_atr': False, 'use_adx': False, 'use_ema': False, 'use_spike': False, 'rsi_required': True, 'edge_k': 0.5384218570865172, 'edge_cap': 0.09156271535771401, 'bull_strategy': 'breakout', 'bull_bb_std_mult': 2.481797123877362, 'bull_rsi_os': 16, 'bull_rsi_ob': 67, 'bull_adx_thresh': 5.02942563849987, 'bull_atr_min_pct': 0.02508166851922334, 'bull_atr_max_pct': 0.018174863145756788, 'bull_tp_mult': 1.527004484483033, 'bull_tsl_mult': 0.3015608113923384, 'bull_time_stop': 147, 'bull_use_sma': True, 'bull_use_ema': False, 'bull_use_atr': False, 'bull_use_adx': False, 'bull_use_spike': True, 'bull_rsi_required': True, 'bear_strategy': 'mean_reversion', 'bear_bb_std_mult': 1.3768224325583118, 'bear_rsi_os': 13, 'bear_rsi_ob': 45, 'bear_adx_thresh': 5.582673787042551, 'bear_atr_min_pct': 0.007004313398771395, 'bear_atr_max_pct': 0.019099312856057628, 'bear_tp_mult': 2.911869170108619, 'bear_tsl_mult': 0.58766729765069, 'bear_time_stop': 5, 'bear_use_sma': False, 'bear_use_ema': False, 'bear_use_atr': False, 'bear_use_adx': True, 'bear_use_spike': False, 'bear_rsi_required': True, 'sideways_strategy': 'breakout', 'sideways_bb_std_mult': 0.7246857640709823, 'sideways_rsi_os': 40, 'sideways_rsi_ob': 65, 'sideways_adx_thresh': 10.511219402896472, 'sideways_atr_min_pct': 0.02617956929355664, 'sideways_atr_max_pct': 0.04897542428745308, 'sideways_tp_mult': 1.7920164724407481, 'sideways_tsl_mult': 0.6726273619668581, 'sideways_time_stop': 187, 'sideways_use_sma': True, 'sideways_use_ema': False, 'sideways_use_atr': False, 'sideways_use_adx': True, 'sideways_use_spike': True, 'sideways_rsi_required': False}.
[I 2025-08-31 02:58:37,995] Trial 730 finished with values: [-1000000000.0, 1000000000.0] and parameters: {'p_sma': 52, 'p_std': 53, 'p_atr': 14, 'p_adx': 15, 'rsi_period': 70, 'ema1': 6, 'ema2': 13, 'slip_atr_k': 0.06659938797906358, 'slip_spread_k': 0.5782509454836395, 'spread_hl_frac': 0.01821490059614393, 'bb_std_mult': 1.760118355476732, 'rsi_os': 15, 'rsi_ob': 67, 'vol_spike': 0.10500953855568929, 'adx_thresh': 20.533838824787107, 'atr_min_pct': 0.02464524453750326, 'atr_max_pct': 0.1162720662854889, 'tp_mult': 1.448137068120979, 'tsl_mult': 0.9597894362351753, 'strategy': 'mean_reversion', 'time_stop': 119, 'use_sma': True, 'use_atr': False, 'use_adx': False, 'use_ema': False, 'use_spike': False, 'rsi_required': True, 'edge_k': 1.5986982378071672, 'edge_cap': 0.7381084966377579, 'bull_strategy': 'breakout', 'bull_bb_std_mult': 3.3069216668807666, 'bull_rsi_os': 53, 'bull_rsi_ob': 61, 'bull_adx_thresh': 5.0552701865390475, 'bull_atr_min_pct': 0.019642532709802887, 'bull_atr_max_pct': 0.1443599855650138, 'bull_tp_mult': 2.287975506002153, 'bull_tsl_mult': 0.3013504473666781, 'bull_time_stop': 73, 'bull_use_sma': True, 'bull_use_ema': False, 'bull_use_atr': False, 'bull_use_adx': True, 'bull_use_spike': True, 'bull_rsi_required': True, 'bear_strategy': 'mean_reversion', 'bear_bb_std_mult': 3.218416193284448, 'bear_rsi_os': 38, 'bear_rsi_ob': 45, 'bear_adx_thresh': 5.529262687837443, 'bear_atr_min_pct': 0.006487598165963645, 'bear_atr_max_pct': 0.019216870915112386, 'bear_tp_mult': 1.3205510418409743, 'bear_tsl_mult': 0.8573849235763611, 'bear_time_stop': 244, 'bear_use_sma': False, 'bear_use_ema': False, 'bear_use_atr': False, 'bear_use_adx': True, 'bear_use_spike': True, 'bear_rsi_required': True, 'sideways_strategy': 'breakout', 'sideways_bb_std_mult': 0.5018290313412433, 'sideways_rsi_os': 13, 'sideways_rsi_ob': 95, 'sideways_adx_thresh': 10.535073887164348, 'sideways_atr_min_pct': 0.026355629132766775, 'sideways_atr_max_pct': 0.05165990773222714, 'sideways_tp_mult': 1.7676857703460451, 'sideways_tsl_mult': 0.6636699487184335, 'sideways_time_stop': 235, 'sideways_use_sma': True, 'sideways_use_ema': False, 'sideways_use_atr': False, 'sideways_use_adx': False, 'sideways_use_spike': True, 'sideways_rsi_required': False}.
[I 2025-08-31 02:58:38,490] Trial 731 finished with values: [-1000000000.0, 1000000000.0] and parameters: {'p_sma': 54, 'p_std': 25, 'p_atr': 14, 'p_adx': 27, 'rsi_period': 67, 'ema1': 6, 'ema2': 25, 'slip_atr_k': 0.23236433914688098, 'slip_spread_k': 0.15503618918381423, 'spread_hl_frac': 2.190782351624461e-05, 'bb_std_mult': 2.5217465232008864, 'rsi_os': 9, 'rsi_ob': 67, 'vol_spike': 0.19856885313064748, 'adx_thresh': 27.733162628608422, 'atr_min_pct': 0.009065686255559912, 'atr_max_pct': 0.12049600691704733, 'tp_mult': 1.433390952801024, 'tsl_mult': 0.3355913083878542, 'strategy': 'mean_reversion', 'time_stop': 176, 'use_sma': True, 'use_atr': False, 'use_adx': False, 'use_ema': False, 'use_spike': False, 'rsi_required': True, 'edge_k': 1.588628812611995, 'edge_cap': 0.15306326506699502, 'bull_strategy': 'mean_reversion', 'bull_bb_std_mult': 2.5011357333542286, 'bull_rsi_os': 16, 'bull_rsi_ob': 46, 'bull_adx_thresh': 5.03894245738706, 'bull_atr_min_pct': 0.019564174396914148, 'bull_atr_max_pct': 0.1442927618081266, 'bull_tp_mult': 2.2886531507512875, 'bull_tsl_mult': 0.30113115646628846, 'bull_time_stop': 145, 'bull_use_sma': True, 'bull_use_ema': False, 'bull_use_atr': False, 'bull_use_adx': True, 'bull_use_spike': True, 'bull_rsi_required': True, 'bear_strategy': 'breakout', 'bear_bb_std_mult': 3.588780905606899, 'bear_rsi_os': 13, 'bear_rsi_ob': 45, 'bear_adx_thresh': 25.71994805985429, 'bear_atr_min_pct': 0.00544439700650838, 'bear_atr_max_pct': 0.06828564174797856, 'bear_tp_mult': 1.318004490223081, 'bear_tsl_mult': 0.5940857942784259, 'bear_time_stop': 18, 'bear_use_sma': False, 'bear_use_ema': False, 'bear_use_atr': True, 'bear_use_adx': True, 'bear_use_spike': True, 'bear_rsi_required': True, 'sideways_strategy': 'breakout', 'sideways_bb_std_mult': 2.1225327742330706, 'sideways_rsi_os': 40, 'sideways_rsi_ob': 95, 'sideways_adx_thresh': 10.444759681602235, 'sideways_atr_min_pct': 0.026242146183513823, 'sideways_atr_max_pct': 0.07987599049368929, 'sideways_tp_mult': 2.1928231292571074, 'sideways_tsl_mult': 0.6689970907666085, 'sideways_time_stop': 114, 'sideways_use_sma': True, 'sideways_use_ema': True, 'sideways_use_atr': False, 'sideways_use_adx': False, 'sideways_use_spike': False, 'sideways_rsi_required': False}.
[I 2025-08-31 02:58:38,719] Trial 732 finished with values: [-1000000000.0, 1000000000.0] and parameters: {'p_sma': 54, 'p_std': 53, 'p_atr': 28, 'p_adx': 20, 'rsi_period': 67, 'ema1': 28, 'ema2': 35, 'slip_atr_k': 0.07825866648173961, 'slip_spread_k': 0.19095932193338763, 'spread_hl_frac': 0.02447883754480981, 'bb_std_mult': 2.281377911428741, 'rsi_os': 43, 'rsi_ob': 67, 'vol_spike': 0.2020884839618945, 'adx_thresh': 27.717415330129835, 'atr_min_pct': 0.024380132978788473, 'atr_max_pct': 0.04494433596809141, 'tp_mult': 1.4135088324386944, 'tsl_mult': 0.3354869436487775, 'strategy': 'mean_reversion', 'time_stop': 96, 'use_sma': True, 'use_atr': True, 'use_adx': True, 'use_ema': False, 'use_spike': False, 'rsi_required': True, 'edge_k': 0.5400677344237304, 'edge_cap': 0.7368267634037471, 'bull_strategy': 'mean_reversion', 'bull_bb_std_mult': 2.496805514501441, 'bull_rsi_os': 16, 'bull_rsi_ob': 67, 'bull_adx_thresh': 5.507160628805119, 'bull_atr_min_pct': 0.02089134663215876, 'bull_atr_max_pct': 0.08737175320031972, 'bull_tp_mult': 1.040496196146551, 'bull_tsl_mult': 0.310357111486322, 'bull_time_stop': 132, 'bull_use_sma': True, 'bull_use_ema': False, 'bull_use_atr': False, 'bull_use_adx': True, 'bull_use_spike': True, 'bull_rsi_required': True, 'bear_strategy': 'breakout', 'bear_bb_std_mult': 1.4007668180599984, 'bear_rsi_os': 15, 'bear_rsi_ob': 45, 'bear_adx_thresh': 6.097020415630184, 'bear_atr_min_pct': 0.006727064426177343, 'bear_atr_max_pct': 0.06072842146798541, 'bear_tp_mult': 2.483820649478691, 'bear_tsl_mult': 0.5865899872151987, 'bear_time_stop': 20, 'bear_use_sma': False, 'bear_use_ema': False, 'bear_use_atr': True, 'bear_use_adx': True, 'bear_use_spike': True, 'bear_rsi_required': True, 'sideways_strategy': 'breakout', 'sideways_bb_std_mult': 0.5043844611207503, 'sideways_rsi_os': 42, 'sideways_rsi_ob': 61, 'sideways_adx_thresh': 27.933966661387522, 'sideways_atr_min_pct': 0.026191899809038913, 'sideways_atr_max_pct': 0.08018836025285386, 'sideways_tp_mult': 1.7606358111237983, 'sideways_tsl_mult': 0.13787166543109347, 'sideways_time_stop': 197, 'sideways_use_sma': False, 'sideways_use_ema': True, 'sideways_use_atr': True, 'sideways_use_adx': False, 'sideways_use_spike': False, 'sideways_rsi_required': False}.
[I 2025-08-31 02:59:16,554] Trial 735 finished with values: [-1000000000.0, 1000000000.0] and parameters: {'p_sma': 54, 'p_std': 50, 'p_atr': 28, 'p_adx': 17, 'rsi_period': 16, 'ema1': 28, 'ema2': 10, 'slip_atr_k': 0.13213872351592224, 'slip_spread_k': 0.4549892692764661, 'spread_hl_frac': 0.044774102272856275, 'bb_std_mult': 1.305325225760283, 'rsi_os': 20, 'rsi_ob': 69, 'vol_spike': 0.25836944495618425, 'adx_thresh': 17.55352748374884, 'atr_min_pct': 0.007893888847800401, 'atr_max_pct': 0.04390470893124235, 'tp_mult': 1.662479307030448, 'tsl_mult': 0.395737417291294, 'strategy': 'mean_reversion', 'time_stop': 101, 'use_sma': False, 'use_atr': True, 'use_adx': True, 'use_ema': False, 'use_spike': True, 'rsi_required': True, 'edge_k': 0.587092244717208, 'edge_cap': 0.08736990004675507, 'bull_strategy': 'mean_reversion', 'bull_bb_std_mult': 1.2963448509069, 'bull_rsi_os': 41, 'bull_rsi_ob': 75, 'bull_adx_thresh': 25.284775032835977, 'bull_atr_min_pct': 0.010206095505276465, 'bull_atr_max_pct': 0.04208887270669629, 'bull_tp_mult': 2.2478148060623893, 'bull_tsl_mult': 0.056512206436454104, 'bull_time_stop': 126, 'bull_use_sma': True, 'bull_use_ema': False, 'bull_use_atr': False, 'bull_use_adx': True, 'bull_use_spike': True, 'bull_rsi_required': True, 'bear_strategy': 'breakout', 'bear_bb_std_mult': 2.7778856230671356, 'bear_rsi_os': 15, 'bear_rsi_ob': 73, 'bear_adx_thresh': 5.019802710565674, 'bear_atr_min_pct': 0.004108361416838126, 'bear_atr_max_pct': 0.1098139598928213, 'bear_tp_mult': 1.9864866311205396, 'bear_tsl_mult': 0.9507353792461906, 'bear_time_stop': 99, 'bear_use_sma': False, 'bear_use_ema': True, 'bear_use_atr': True, 'bear_use_adx': True, 'bear_use_spike': False, 'bear_rsi_required': True, 'sideways_strategy': 'breakout', 'sideways_bb_std_mult': 3.311782186121185, 'sideways_rsi_os': 42, 'sideways_rsi_ob': 93, 'sideways_adx_thresh': 8.774654658146016, 'sideways_atr_min_pct': 0.0280730444485783, 'sideways_atr_max_pct': 0.05550777220225925, 'sideways_tp_mult': 1.7438620205928184, 'sideways_tsl_mult': 0.13758152086715003, 'sideways_time_stop': 200, 'sideways_use_sma': False, 'sideways_use_ema': True, 'sideways_use_atr': True, 'sideways_use_adx': False, 'sideways_use_spike': False, 'sideways_rsi_required': True}.
[I 2025-08-31 02:59:17,348] Trial 733 finished with values: [-1000000000.0, 1000000000.0] and parameters: {'p_sma': 21, 'p_std': 52, 'p_atr': 28, 'p_adx': 26, 'rsi_period': 67, 'ema1': 6, 'ema2': 34, 'slip_atr_k': 0.0057343662228756115, 'slip_spread_k': 0.19001459030228868, 'spread_hl_frac': 0.0008352428924105026, 'bb_std_mult': 1.7777911959227137, 'rsi_os': 37, 'rsi_ob': 92, 'vol_spike': 0.1958650602976015, 'adx_thresh': 27.52122548066139, 'atr_min_pct': 0.016802002201886067, 'atr_max_pct': 0.09051830221568569, 'tp_mult': 1.843168407650019, 'tsl_mult': 0.41611609290764084, 'strategy': 'mean_reversion', 'time_stop': 102, 'use_sma': True, 'use_atr': True, 'use_adx': True, 'use_ema': False, 'use_spike': True, 'rsi_required': True, 'edge_k': 0.5977537498594445, 'edge_cap': 0.5411330783780793, 'bull_strategy': 'mean_reversion', 'bull_bb_std_mult': 1.295623468986559, 'bull_rsi_os': 14, 'bull_rsi_ob': 60, 'bull_adx_thresh': 33.61365011769439, 'bull_atr_min_pct': 0.006791289515302471, 'bull_atr_max_pct': 0.14468317101984846, 'bull_tp_mult': 2.2768694838688104, 'bull_tsl_mult': 0.3323761429944494, 'bull_time_stop': 127, 'bull_use_sma': True, 'bull_use_ema': False, 'bull_use_atr': False, 'bull_use_adx': True, 'bull_use_spike': True, 'bull_rsi_required': True, 'bear_strategy': 'breakout', 'bear_bb_std_mult': 1.3193415931205104, 'bear_rsi_os': 15, 'bear_rsi_ob': 45, 'bear_adx_thresh': 13.583127635998071, 'bear_atr_min_pct': 0.004094894054759383, 'bear_atr_max_pct': 0.013746488543914205, 'bear_tp_mult': 1.5926341700564361, 'bear_tsl_mult': 0.8494167767543517, 'bear_time_stop': 98, 'bear_use_sma': False, 'bear_use_ema': True, 'bear_use_atr': True, 'bear_use_adx': True, 'bear_use_spike': True, 'bear_rsi_required': True, 'sideways_strategy': 'breakout', 'sideways_bb_std_mult': 2.4253819519300386, 'sideways_rsi_os': 19, 'sideways_rsi_ob': 93, 'sideways_adx_thresh': 8.89552668113884, 'sideways_atr_min_pct': 0.02674257298242788, 'sideways_atr_max_pct': 0.05233711438535171, 'sideways_tp_mult': 1.7371102798176932, 'sideways_tsl_mult': 0.6539582583238027, 'sideways_time_stop': 224, 'sideways_use_sma': False, 'sideways_use_ema': True, 'sideways_use_atr': True, 'sideways_use_adx': False, 'sideways_use_spike': False, 'sideways_rsi_required': False}.
[I 2025-08-31 02:59:17,600] Trial 736 finished with values: [-1000000000.0, 1000000000.0] and parameters: {'p_sma': 25, 'p_std': 50, 'p_atr': 29, 'p_adx': 11, 'rsi_period': 71, 'ema1': 6, 'ema2': 34, 'slip_atr_k': 0.008005131646125006, 'slip_spread_k': 0.4530479252559128, 'spread_hl_frac': 0.00504683647962543, 'bb_std_mult': 0.6743949742829978, 'rsi_os': 37, 'rsi_ob': 80, 'vol_spike': 0.19006060208107176, 'adx_thresh': 21.62475271728815, 'atr_min_pct': 0.007741329233975859, 'atr_max_pct': 0.09067699247719156, 'tp_mult': 2.2166582093920453, 'tsl_mult': 0.3719371850365616, 'strategy': 'mean_reversion', 'time_stop': 103, 'use_sma': False, 'use_atr': True, 'use_adx': True, 'use_ema': False, 'use_spike': True, 'rsi_required': True, 'edge_k': 0.4816508031558736, 'edge_cap': 0.08421026897195302, 'bull_strategy': 'breakout', 'bull_bb_std_mult': 2.266543611316492, 'bull_rsi_os': 22, 'bull_rsi_ob': 60, 'bull_adx_thresh': 21.649451239309464, 'bull_atr_min_pct': 0.006818437961637509, 'bull_atr_max_pct': 0.025386549580244014, 'bull_tp_mult': 2.7847795177433263, 'bull_tsl_mult': 0.27238681652180874, 'bull_time_stop': 124, 'bull_use_sma': True, 'bull_use_ema': False, 'bull_use_atr': False, 'bull_use_adx': True, 'bull_use_spike': True, 'bull_rsi_required': True, 'bear_strategy': 'mean_reversion', 'bear_bb_std_mult': 1.3081044408497187, 'bear_rsi_os': 17, 'bear_rsi_ob': 46, 'bear_adx_thresh': 21.358603573461913, 'bear_atr_min_pct': 0.02806751341636795, 'bear_atr_max_pct': 0.013011596353834504, 'bear_tp_mult': 1.1539715776865667, 'bear_tsl_mult': 0.43325507467154195, 'bear_time_stop': 61, 'bear_use_sma': False, 'bear_use_ema': True, 'bear_use_atr': False, 'bear_use_adx': True, 'bear_use_spike': False, 'bear_rsi_required': True, 'sideways_strategy': 'breakout', 'sideways_bb_std_mult': 3.1869099147411366, 'sideways_rsi_os': 6, 'sideways_rsi_ob': 93, 'sideways_adx_thresh': 8.579657525851848, 'sideways_atr_min_pct': 0.007756783108988249, 'sideways_atr_max_pct': 0.05567659724311298, 'sideways_tp_mult': 1.4041895323211282, 'sideways_tsl_mult': 0.03755177080694011, 'sideways_time_stop': 225, 'sideways_use_sma': False, 'sideways_use_ema': False, 'sideways_use_atr': True, 'sideways_use_adx': False, 'sideways_use_spike': True, 'sideways_rsi_required': True}.
[I 2025-08-31 02:59:17,726] Trial 734 finished with values: [-1000000000.0, 1000000000.0] and parameters: {'p_sma': 21, 'p_std': 50, 'p_atr': 28, 'p_adx': 17, 'rsi_period': 67, 'ema1': 6, 'ema2': 34, 'slip_atr_k': 0.07879173552078987, 'slip_spread_k': 0.6388990891528853, 'spread_hl_frac': 0.04255955317676478, 'bb_std_mult': 1.7077472689075985, 'rsi_os': 37, 'rsi_ob': 69, 'vol_spike': 0.19327712587884058, 'adx_thresh': 28.19582104653446, 'atr_min_pct': 0.00915152924577415, 'atr_max_pct': 0.12131122218579593, 'tp_mult': 2.0917786111848384, 'tsl_mult': 0.33783613456583683, 'strategy': 'mean_reversion', 'time_stop': 29, 'use_sma': True, 'use_atr': True, 'use_adx': True, 'use_ema': False, 'use_spike': True, 'rsi_required': True, 'edge_k': 0.4730344434667425, 'edge_cap': 0.580254525359966, 'bull_strategy': 'mean_reversion', 'bull_bb_std_mult': 2.518932143238459, 'bull_rsi_os': 44, 'bull_rsi_ob': 67, 'bull_adx_thresh': 18.83269136499743, 'bull_atr_min_pct': 0.010231644762123248, 'bull_atr_max_pct': 0.025797107055313295, 'bull_tp_mult': 1.7719737075457611, 'bull_tsl_mult': 0.057879677830733445, 'bull_time_stop': 292, 'bull_use_sma': True, 'bull_use_ema': False, 'bull_use_atr': False, 'bull_use_adx': True, 'bull_use_spike': True, 'bull_rsi_required': True, 'bear_strategy': 'breakout', 'bear_bb_std_mult': 1.4416628923315693, 'bear_rsi_os': 15, 'bear_rsi_ob': 46, 'bear_adx_thresh': 13.948913399564692, 'bear_atr_min_pct': 0.005649625318624053, 'bear_atr_max_pct': 0.10997760535126999, 'bear_tp_mult': 2.150260008383376, 'bear_tsl_mult': 0.537939193413818, 'bear_time_stop': 17, 'bear_use_sma': False, 'bear_use_ema': True, 'bear_use_atr': True, 'bear_use_adx': True, 'bear_use_spike': True, 'bear_rsi_required': True, 'sideways_strategy': 'breakout', 'sideways_bb_std_mult': 0.6145805807599327, 'sideways_rsi_os': 42, 'sideways_rsi_ob': 93, 'sideways_adx_thresh': 27.388883655931686, 'sideways_atr_min_pct': 0.026810154903391364, 'sideways_atr_max_pct': 0.08082978737140806, 'sideways_tp_mult': 2.2027510547279014, 'sideways_tsl_mult': 0.6477895187980535, 'sideways_time_stop': 197, 'sideways_use_sma': False, 'sideways_use_ema': True, 'sideways_use_atr': True, 'sideways_use_adx': False, 'sideways_use_spike': False, 'sideways_rsi_required': False}.
[I 2025-08-31 02:59:55,043] Trial 739 finished with values: [-1000000000.0, 1000000000.0] and parameters: {'p_sma': 32, 'p_std': 12, 'p_atr': 7, 'p_adx': 29, 'rsi_period': 71, 'ema1': 5, 'ema2': 28, 'slip_atr_k': 0.18788493154043256, 'slip_spread_k': 0.11860549182065336, 'spread_hl_frac': 0.0024604138110465423, 'bb_std_mult': 1.6844882940152628, 'rsi_os': 27, 'rsi_ob': 57, 'vol_spike': 0.18544441829825015, 'adx_thresh': 21.496844775546982, 'atr_min_pct': 0.018748238210755917, 'atr_max_pct': 0.03788272093709251, 'tp_mult': 2.4029117827633213, 'tsl_mult': 0.5485910658409908, 'strategy': 'mean_reversion', 'time_stop': 59, 'use_sma': True, 'use_atr': False, 'use_adx': False, 'use_ema': False, 'use_spike': False, 'rsi_required': True, 'edge_k': 1.4717890415931971, 'edge_cap': 0.11376935843406771, 'bull_strategy': 'breakout', 'bull_bb_std_mult': 2.5893376343711223, 'bull_rsi_os': 44, 'bull_rsi_ob': 65, 'bull_adx_thresh': 6.324860417758365, 'bull_atr_min_pct': 0.011676127255127008, 'bull_atr_max_pct': 0.035398414881364935, 'bull_tp_mult': 2.1506985609762985, 'bull_tsl_mult': 0.21469718961190054, 'bull_time_stop': 116, 'bull_use_sma': True, 'bull_use_ema': False, 'bull_use_atr': False, 'bull_use_adx': True, 'bull_use_spike': True, 'bull_rsi_required': True, 'bear_strategy': 'mean_reversion', 'bear_bb_std_mult': 1.4697637368599439, 'bear_rsi_os': 43, 'bear_rsi_ob': 57, 'bear_adx_thresh': 26.776047922961894, 'bear_atr_min_pct': 0.01266972967810203, 'bear_atr_max_pct': 0.012542117647649658, 'bear_tp_mult': 2.1476352545760786, 'bear_tsl_mult': 0.536507670899167, 'bear_time_stop': 10, 'bear_use_sma': False, 'bear_use_ema': False, 'bear_use_atr': False, 'bear_use_adx': True, 'bear_use_spike': False, 'bear_rsi_required': True, 'sideways_strategy': 'breakout', 'sideways_bb_std_mult': 2.2295061294991885, 'sideways_rsi_os': 41, 'sideways_rsi_ob': 75, 'sideways_adx_thresh': 9.537611305530598, 'sideways_atr_min_pct': 0.026973936705420924, 'sideways_atr_max_pct': 0.03549500099721132, 'sideways_tp_mult': 1.8577325807093445, 'sideways_tsl_mult': 0.6284292502734573, 'sideways_time_stop': 207, 'sideways_use_sma': True, 'sideways_use_ema': False, 'sideways_use_atr': False, 'sideways_use_adx': False, 'sideways_use_spike': True, 'sideways_rsi_required': False}.
