[I 2025-08-31 00:42:44,310] Trial 349 finished with values: [-0.016179491495069698, 0.016158644293456686] and parameters: {'p_sma': 45, 'p_std': 38, 'p_atr': 24, 'p_adx': 8, 'rsi_period': 57, 'ema1': 6, 'ema2': 17, 'slip_atr_k': 0.01027525474442989, 'slip_spread_k': 0.24333917154138737, 'spread_hl_frac': 0.010730853536216889, 'bb_std_mult': 2.341714310490994, 'rsi_os': 53, 'rsi_ob': 85, 'vol_spike': 0.20263163042017923, 'adx_thresh': 16.02440888027064, 'atr_min_pct': 0.007552024174946869, 'atr_max_pct': 0.06280382095412038, 'tp_mult': 2.672194159963027, 'tsl_mult': 0.1049932953746612, 'strategy': 'breakout', 'time_stop': 100, 'use_sma': True, 'use_atr': False, 'use_adx': False, 'use_ema': True, 'use_spike': False, 'rsi_required': False, 'edge_k': 0.6516292822178202, 'edge_cap': 0.8095192598416806, 'bull_strategy': 'breakout', 'bull_bb_std_mult': 2.6738281361913505, 'bull_rsi_os': 36, 'bull_rsi_ob': 84, 'bull_adx_thresh': 12.684443249294363, 'bull_atr_min_pct': 0.0004906612018515367, 'bull_atr_max_pct': 0.07453428308415642, 'bull_tp_mult': 1.789154588012475, 'bull_tsl_mult': 0.005352909558052066, 'bull_time_stop': 168, 'bull_use_sma': False, 'bull_use_ema': False, 'bull_use_atr': True, 'bull_use_adx': True, 'bull_use_spike': False, 'bull_rsi_required': False, 'bear_strategy': 'mean_reversion', 'bear_bb_std_mult': 1.134246425604572, 'bear_rsi_os': 23, 'bear_rsi_ob': 69, 'bear_adx_thresh': 7.241487157324228, 'bear_atr_min_pct': 0.008425427180899031, 'bear_atr_max_pct': 0.03106406755516025, 'bear_tp_mult': 2.533488580029636, 'bear_tsl_mult': 0.6592223665437962, 'bear_time_stop': 15, 'bear_use_sma': True, 'bear_use_ema': False, 'bear_use_atr': False, 'bear_use_adx': False, 'bear_use_spike': False, 'bear_rsi_required': False, 'sideways_strategy': 'mean_reversion', 'sideways_bb_std_mult': 1.2862688458612943, 'sideways_rsi_os': 46, 'sideways_rsi_ob': 89, 'sideways_adx_thresh': 27.26877353640138, 'sideways_atr_min_pct': 0.02262144148001357, 'sideways_atr_max_pct': 0.08823144592926202, 'sideways_tp_mult': 1.050135349944619, 'sideways_tsl_mult': 0.8415828078239802, 'sideways_time_stop': 142, 'sideways_use_sma': True, 'sideways_use_ema': False, 'sideways_use_atr': False, 'sideways_use_adx': False, 'sideways_use_spike': True, 'sideways_rsi_required': False}.
[I 2025-08-31 00:42:45,629] Trial 352 finished with values: [-1000000000.0, 1000000000.0] and parameters: {'p_sma': 38, 'p_std': 28, 'p_atr': 25, 'p_adx': 8, 'rsi_period': 58, 'ema1': 8, 'ema2': 21, 'slip_atr_k': 0.025256685768659297, 'slip_spread_k': 0.25231107943352604, 'spread_hl_frac': 0.031267486111748476, 'bb_std_mult': 0.7836946497370612, 'rsi_os': 16, 'rsi_ob': 81, 'vol_spike': 0.20203793714608273, 'adx_thresh': 12.289098661994132, 'atr_min_pct': 0.018639716617165826, 'atr_max_pct': 0.07226700779668091, 'tp_mult': 2.5391205407962705, 'tsl_mult': 0.10949166274726259, 'strategy': 'breakout', 'time_stop': 80, 'use_sma': True, 'use_atr': True, 'use_adx': False, 'use_ema': True, 'use_spike': False, 'rsi_required': False, 'edge_k': 1.9245651704790614, 'edge_cap': 0.806469504811276, 'bull_strategy': 'breakout', 'bull_bb_std_mult': 2.6851211752859725, 'bull_rsi_os': 34, 'bull_rsi_ob': 62, 'bull_adx_thresh': 26.377849583192724, 'bull_atr_min_pct': 0.003056168342603004, 'bull_atr_max_pct': 0.0755539155559913, 'bull_tp_mult': 1.6801585994531494, 'bull_tsl_mult': 0.2996212225279948, 'bull_time_stop': 213, 'bull_use_sma': False, 'bull_use_ema': False, 'bull_use_atr': True, 'bull_use_adx': False, 'bull_use_spike': True, 'bull_rsi_required': False, 'bear_strategy': 'mean_reversion', 'bear_bb_std_mult': 1.053481682522117, 'bear_rsi_os': 21, 'bear_rsi_ob': 89, 'bear_adx_thresh': 7.049706074510072, 'bear_atr_min_pct': 0.0072643472459251075, 'bear_atr_max_pct': 0.031257977781715206, 'bear_tp_mult': 2.381076835150054, 'bear_tsl_mult': 0.7272114776500777, 'bear_time_stop': 16, 'bear_use_sma': True, 'bear_use_ema': False, 'bear_use_atr': False, 'bear_use_adx': True, 'bear_use_spike': False, 'bear_rsi_required': False, 'sideways_strategy': 'mean_reversion', 'sideways_bb_std_mult': 2.5493898464038747, 'sideways_rsi_os': 39, 'sideways_rsi_ob': 78, 'sideways_adx_thresh': 8.098391232967938, 'sideways_atr_min_pct': 0.021223823563735224, 'sideways_atr_max_pct': 0.14273224497328066, 'sideways_tp_mult': 1.0477159956058837, 'sideways_tsl_mult': 0.9208900807639312, 'sideways_time_stop': 300, 'sideways_use_sma': True, 'sideways_use_ema': False, 'sideways_use_atr': False, 'sideways_use_adx': False, 'sideways_use_spike': True, 'sideways_rsi_required': False}.
[I 2025-08-31 00:43:24,837] Trial 353 finished with values: [-1000000000.0, 1000000000.0] and parameters: {'p_sma': 45, 'p_std': 39, 'p_atr': 29, 'p_adx': 8, 'rsi_period': 77, 'ema1': 15, 'ema2': 44, 'slip_atr_k': 0.008487521425063677, 'slip_spread_k': 0.25644449813916037, 'spread_hl_frac': 0.010992546280054987, 'bb_std_mult': 2.1022745786036148, 'rsi_os': 18, 'rsi_ob': 72, 'vol_spike': 0.17212540297969567, 'adx_thresh': 11.578822543702124, 'atr_min_pct': 0.0057923228540257225, 'atr_max_pct': 0.0536184886977875, 'tp_mult': 2.9972014455210987, 'tsl_mult': 0.10945868001754669, 'strategy': 'breakout', 'time_stop': 140, 'use_sma': False, 'use_atr': True, 'use_adx': False, 'use_ema': True, 'use_spike': False, 'rsi_required': False, 'edge_k': 0.8303211740240468, 'edge_cap': 0.8346882148694371, 'bull_strategy': 'breakout', 'bull_bb_std_mult': 2.8625542345621917, 'bull_rsi_os': 27, 'bull_rsi_ob': 57, 'bull_adx_thresh': 20.798077696760906, 'bull_atr_min_pct': 0.0014759990154953363, 'bull_atr_max_pct': 0.1065049863962826, 'bull_tp_mult': 2.628861921336623, 'bull_tsl_mult': 0.49547784568236514, 'bull_time_stop': 162, 'bull_use_sma': False, 'bull_use_ema': False, 'bull_use_atr': True, 'bull_use_adx': False, 'bull_use_spike': True, 'bull_rsi_required': False, 'bear_strategy': 'mean_reversion', 'bear_bb_std_mult': 1.1848194800651544, 'bear_rsi_os': 37, 'bear_rsi_ob': 79, 'bear_adx_thresh': 9.016224901596503, 'bear_atr_min_pct': 0.0018269366394472273, 'bear_atr_max_pct': 0.031110412432932593, 'bear_tp_mult': 2.525548247957313, 'bear_tsl_mult': 0.7260421316468139, 'bear_time_stop': 39, 'bear_use_sma': True, 'bear_use_ema': False, 'bear_use_atr': False, 'bear_use_adx': True, 'bear_use_spike': True, 'bear_rsi_required': False, 'sideways_strategy': 'mean_reversion', 'sideways_bb_std_mult': 1.1109877602739449, 'sideways_rsi_os': 46, 'sideways_rsi_ob': 53, 'sideways_adx_thresh': 27.759297092348234, 'sideways_atr_min_pct': 0.021550798971115386, 'sideways_atr_max_pct': 0.14252393896167662, 'sideways_tp_mult': 1.0595943149292109, 'sideways_tsl_mult': 0.9128770189385458, 'sideways_time_stop': 300, 'sideways_use_sma': True, 'sideways_use_ema': False, 'sideways_use_atr': False, 'sideways_use_adx': True, 'sideways_use_spike': False, 'sideways_rsi_required': False}.
[I 2025-08-31 00:43:25,022] Trial 354 finished with values: [-1000000000.0, 1000000000.0] and parameters: {'p_sma': 47, 'p_std': 39, 'p_atr': 22, 'p_adx': 9, 'rsi_period': 77, 'ema1': 7, 'ema2': 44, 'slip_atr_k': 0.20373299156413788, 'slip_spread_k': 0.27742282163192716, 'spread_hl_frac': 0.01105631054700045, 'bb_std_mult': 2.4002125208611798, 'rsi_os': 54, 'rsi_ob': 75, 'vol_spike': 0.21327866947130764, 'adx_thresh': 25.3848861773441, 'atr_min_pct': 0.007754247547155309, 'atr_max_pct': 0.029591996925767278, 'tp_mult': 2.9813326842712553, 'tsl_mult': 0.11011126826630366, 'strategy': 'breakout', 'time_stop': 81, 'use_sma': False, 'use_atr': True, 'use_adx': False, 'use_ema': True, 'use_spike': False, 'rsi_required': False, 'edge_k': 0.8314544403004553, 'edge_cap': 0.8236846543200707, 'bull_strategy': 'breakout', 'bull_bb_std_mult': 2.6995430080440945, 'bull_rsi_os': 54, 'bull_rsi_ob': 69, 'bull_adx_thresh': 14.05690103425083, 'bull_atr_min_pct': 0.003055005938640623, 'bull_atr_max_pct': 0.07338309524069767, 'bull_tp_mult': 2.4439673949562923, 'bull_tsl_mult': 0.49690415607674854, 'bull_time_stop': 21, 'bull_use_sma': False, 'bull_use_ema': False, 'bull_use_atr': True, 'bull_use_adx': False, 'bull_use_spike': True, 'bull_rsi_required': False, 'bear_strategy': 'mean_reversion', 'bear_bb_std_mult': 1.0772620694329547, 'bear_rsi_os': 20, 'bear_rsi_ob': 79, 'bear_adx_thresh': 7.968046898588599, 'bear_atr_min_pct': 0.011981717589728196, 'bear_atr_max_pct': 0.1220567165385372, 'bear_tp_mult': 2.540919184411549, 'bear_tsl_mult': 0.738487240720886, 'bear_time_stop': 40, 'bear_use_sma': True, 'bear_use_ema': False, 'bear_use_atr': False, 'bear_use_adx': True, 'bear_use_spike': True, 'bear_rsi_required': False, 'sideways_strategy': 'mean_reversion', 'sideways_bb_std_mult': 0.5076793290013408, 'sideways_rsi_os': 46, 'sideways_rsi_ob': 53, 'sideways_adx_thresh': 14.74682919442304, 'sideways_atr_min_pct': 0.021207147682545988, 'sideways_atr_max_pct': 0.14254883574500887, 'sideways_tp_mult': 1.065834694392324, 'sideways_tsl_mult': 0.9104262179209519, 'sideways_time_stop': 232, 'sideways_use_sma': True, 'sideways_use_ema': False, 'sideways_use_atr': False, 'sideways_use_adx': True, 'sideways_use_spike': False, 'sideways_rsi_required': False}.
[I 2025-08-31 00:43:25,292] Trial 356 finished with values: [-1000000000.0, 1000000000.0] and parameters: {'p_sma': 45, 'p_std': 39, 'p_atr': 21, 'p_adx': 9, 'rsi_period': 57, 'ema1': 9, 'ema2': 18, 'slip_atr_k': 0.010751436437369352, 'slip_spread_k': 0.2816264534864493, 'spread_hl_frac': 0.010799670647636636, 'bb_std_mult': 2.1016438545636595, 'rsi_os': 5, 'rsi_ob': 72, 'vol_spike': 0.17175562360103605, 'adx_thresh': 15.96484835875597, 'atr_min_pct': 0.0074011456731171215, 'atr_max_pct': 0.07870615465990408, 'tp_mult': 2.4962730933966193, 'tsl_mult': 0.10637721775864944, 'strategy': 'mean_reversion', 'time_stop': 283, 'use_sma': False, 'use_atr': False, 'use_adx': False, 'use_ema': True, 'use_spike': False, 'rsi_required': False, 'edge_k': 0.8393909076779974, 'edge_cap': 0.8362842352861264, 'bull_strategy': 'breakout', 'bull_bb_std_mult': 2.8590704366629516, 'bull_rsi_os': 39, 'bull_rsi_ob': 73, 'bull_adx_thresh': 13.783307469123109, 'bull_atr_min_pct': 0.001453153153079182, 'bull_atr_max_pct': 0.013145270442765103, 'bull_tp_mult': 2.58242331374424, 'bull_tsl_mult': 0.4993432886379059, 'bull_time_stop': 164, 'bull_use_sma': False, 'bull_use_ema': False, 'bull_use_atr': True, 'bull_use_adx': True, 'bull_use_spike': False, 'bull_rsi_required': False, 'bear_strategy': 'mean_reversion', 'bear_bb_std_mult': 1.1877357900926668, 'bear_rsi_os': 23, 'bear_rsi_ob': 55, 'bear_adx_thresh': 8.05018808052317, 'bear_atr_min_pct': 0.028289494615698824, 'bear_atr_max_pct': 0.08200780955864628, 'bear_tp_mult': 1.9782887136584844, 'bear_tsl_mult': 0.9988071764670661, 'bear_time_stop': 5, 'bear_use_sma': True, 'bear_use_ema': False, 'bear_use_atr': False, 'bear_use_adx': True, 'bear_use_spike': False, 'bear_rsi_required': True, 'sideways_strategy': 'mean_reversion', 'sideways_bb_std_mult': 0.5861020192249145, 'sideways_rsi_os': 46, 'sideways_rsi_ob': 90, 'sideways_adx_thresh': 14.846625615087026, 'sideways_atr_min_pct': 0.021435259905555105, 'sideways_atr_max_pct': 0.13870190627162404, 'sideways_tp_mult': 2.692435876303226, 'sideways_tsl_mult': 0.6085709569160279, 'sideways_time_stop': 189, 'sideways_use_sma': True, 'sideways_use_ema': False, 'sideways_use_atr': False, 'sideways_use_adx': True, 'sideways_use_spike': False, 'sideways_rsi_required': False}.
[I 2025-08-31 00:43:25,496] Trial 355 finished with values: [-0.05402361885000517, 0.053821657301244684] and parameters: {'p_sma': 46, 'p_std': 39, 'p_atr': 22, 'p_adx': 9, 'rsi_period': 58, 'ema1': 8, 'ema2': 26, 'slip_atr_k': 0.024911993019511865, 'slip_spread_k': 0.27912583947745745, 'spread_hl_frac': 0.03479109970695051, 'bb_std_mult': 2.4214180316150458, 'rsi_os': 55, 'rsi_ob': 81, 'vol_spike': 0.1703731835135391, 'adx_thresh': 19.9114118991958, 'atr_min_pct': 0.007861462241438109, 'atr_max_pct': 0.05171369585344024, 'tp_mult': 2.9916796917979678, 'tsl_mult': 0.1070213697906046, 'strategy': 'breakout', 'time_stop': 80, 'use_sma': True, 'use_atr': True, 'use_adx': False, 'use_ema': True, 'use_spike': False, 'rsi_required': False, 'edge_k': 0.8312002744184782, 'edge_cap': 0.8741045369842567, 'bull_strategy': 'breakout', 'bull_bb_std_mult': 2.707430250465011, 'bull_rsi_os': 24, 'bull_rsi_ob': 94, 'bull_adx_thresh': 14.015303180420977, 'bull_atr_min_pct': 0.005547620914672261, 'bull_atr_max_pct': 0.10629433135745042, 'bull_tp_mult': 2.0175584114739578, 'bull_tsl_mult': 0.5085743528891356, 'bull_time_stop': 20, 'bull_use_sma': False, 'bull_use_ema': False, 'bull_use_atr': True, 'bull_use_adx': False, 'bull_use_spike': True, 'bull_rsi_required': False, 'bear_strategy': 'mean_reversion', 'bear_bb_std_mult': 1.4398003889253947, 'bear_rsi_os': 21, 'bear_rsi_ob': 45, 'bear_adx_thresh': 7.971168726882155, 'bear_atr_min_pct': 0.0011014650537210114, 'bear_atr_max_pct': 0.028513027503822848, 'bear_tp_mult': 1.984665048556448, 'bear_tsl_mult': 0.7257267850127336, 'bear_time_stop': 6, 'bear_use_sma': True, 'bear_use_ema': False, 'bear_use_atr': False, 'bear_use_adx': True, 'bear_use_spike': False, 'bear_rsi_required': False, 'sideways_strategy': 'mean_reversion', 'sideways_bb_std_mult': 0.5813952676303733, 'sideways_rsi_os': 46, 'sideways_rsi_ob': 53, 'sideways_adx_thresh': 7.9542375599510295, 'sideways_atr_min_pct': 0.021459042674851676, 'sideways_atr_max_pct': 0.14292146443937698, 'sideways_tp_mult': 2.594453425046713, 'sideways_tsl_mult': 0.6246201698153689, 'sideways_time_stop': 249, 'sideways_use_sma': True, 'sideways_use_ema': False, 'sideways_use_atr': False, 'sideways_use_adx': False, 'sideways_use_spike': True, 'sideways_rsi_required': False}.
[I 2025-08-31 00:43:26,177] Trial 357 finished with values: [-1000000000.0, 1000000000.0] and parameters: {'p_sma': 47, 'p_std': 39, 'p_atr': 21, 'p_adx': 9, 'rsi_period': 58, 'ema1': 7, 'ema2': 42, 'slip_atr_k': 0.000872426683529548, 'slip_spread_k': 0.23638327436492765, 'spread_hl_frac': 0.04836351754003704, 'bb_std_mult': 1.5477594443259703, 'rsi_os': 54, 'rsi_ob': 79, 'vol_spike': 0.20113839676184825, 'adx_thresh': 13.57197341266614, 'atr_min_pct': 0.010596295234843931, 'atr_max_pct': 0.14985900711166733, 'tp_mult': 2.6136263472296277, 'tsl_mult': 0.08994132287394338, 'strategy': 'mean_reversion', 'time_stop': 88, 'use_sma': True, 'use_atr': False, 'use_adx': False, 'use_ema': True, 'use_spike': False, 'rsi_required': False, 'edge_k': 0.6659286483198481, 'edge_cap': 0.8791653809661095, 'bull_strategy': 'breakout', 'bull_bb_std_mult': 2.7180963499458253, 'bull_rsi_os': 39, 'bull_rsi_ob': 46, 'bull_adx_thresh': 13.978778710807111, 'bull_atr_min_pct': 0.0011837271006790249, 'bull_atr_max_pct': 0.07376502738784775, 'bull_tp_mult': 1.247915775116867, 'bull_tsl_mult': 0.3544117480640314, 'bull_time_stop': 18, 'bull_use_sma': False, 'bull_use_ema': False, 'bull_use_atr': True, 'bull_use_adx': True, 'bull_use_spike': False, 'bull_rsi_required': False, 'bear_strategy': 'mean_reversion', 'bear_bb_std_mult': 2.9889604509671295, 'bear_rsi_os': 35, 'bear_rsi_ob': 94, 'bear_adx_thresh': 7.9579569782475525, 'bear_atr_min_pct': 0.00894785938148492, 'bear_atr_max_pct': 0.12235581391917458, 'bear_tp_mult': 1.9791381832576747, 'bear_tsl_mult': 0.6749573125988848, 'bear_time_stop': 11, 'bear_use_sma': True, 'bear_use_ema': False, 'bear_use_atr': False, 'bear_use_adx': True, 'bear_use_spike': False, 'bear_rsi_required': True, 'sideways_strategy': 'mean_reversion', 'sideways_bb_std_mult': 1.3024039261559899, 'sideways_rsi_os': 48, 'sideways_rsi_ob': 90, 'sideways_adx_thresh': 10.360941700585714, 'sideways_atr_min_pct': 0.02058096630098856, 'sideways_atr_max_pct': 0.13818202004493585, 'sideways_tp_mult': 2.6115319897552944, 'sideways_tsl_mult': 0.6034801840191406, 'sideways_time_stop': 40, 'sideways_use_sma': True, 'sideways_use_ema': False, 'sideways_use_atr': False, 'sideways_use_adx': False, 'sideways_use_spike': True, 'sideways_rsi_required': False}.
[I 2025-08-31 00:43:26,217] Trial 359 finished with values: [-1000000000.0, 1000000000.0] and parameters: {'p_sma': 53, 'p_std': 13, 'p_atr': 22, 'p_adx': 10, 'rsi_period': 58, 'ema1': 8, 'ema2': 20, 'slip_atr_k': 0.10846584869117629, 'slip_spread_k': 0.23739396246268488, 'spread_hl_frac': 0.025714554441729657, 'bb_std_mult': 1.6669052167515583, 'rsi_os': 55, 'rsi_ob': 85, 'vol_spike': 0.2224634632440891, 'adx_thresh': 27.68820672924211, 'atr_min_pct': 0.010471269651160148, 'atr_max_pct': 0.1485988236472025, 'tp_mult': 2.6135442107470337, 'tsl_mult': 0.6642358414333879, 'strategy': 'mean_reversion', 'time_stop': 87, 'use_sma': True, 'use_atr': False, 'use_adx': False, 'use_ema': True, 'use_spike': False, 'rsi_required': False, 'edge_k': 1.1270345525217167, 'edge_cap': 0.8747682571403571, 'bull_strategy': 'breakout', 'bull_bb_std_mult': 2.7976100474974306, 'bull_rsi_os': 38, 'bull_rsi_ob': 53, 'bull_adx_thresh': 17.43758407398613, 'bull_atr_min_pct': 0.0004600310009156135, 'bull_atr_max_pct': 0.13174731790832278, 'bull_tp_mult': 2.3889630677280222, 'bull_tsl_mult': 0.7282106823374292, 'bull_time_stop': 123, 'bull_use_sma': False, 'bull_use_ema': False, 'bull_use_atr': True, 'bull_use_adx': True, 'bull_use_spike': False, 'bull_rsi_required': False, 'bear_strategy': 'mean_reversion', 'bear_bb_std_mult': 3.5205643970286404, 'bear_rsi_os': 14, 'bear_rsi_ob': 76, 'bear_adx_thresh': 6.4531375962862505, 'bear_atr_min_pct': 0.008682203642258088, 'bear_atr_max_pct': 0.014715816010950677, 'bear_tp_mult': 1.7921326765415682, 'bear_tsl_mult': 0.6668315830752666, 'bear_time_stop': 11, 'bear_use_sma': True, 'bear_use_ema': False, 'bear_use_atr': False, 'bear_use_adx': True, 'bear_use_spike': False, 'bear_rsi_required': True, 'sideways_strategy': 'breakout', 'sideways_bb_std_mult': 3.2798176186899264, 'sideways_rsi_os': 48, 'sideways_rsi_ob': 90, 'sideways_adx_thresh': 10.196140101486309, 'sideways_atr_min_pct': 0.01994462807607755, 'sideways_atr_max_pct': 0.10738715441153054, 'sideways_tp_mult': 1.0101029961735932, 'sideways_tsl_mult': 0.6209196656773984, 'sideways_time_stop': 199, 'sideways_use_sma': True, 'sideways_use_ema': False, 'sideways_use_atr': False, 'sideways_use_adx': False, 'sideways_use_spike': True, 'sideways_rsi_required': False}.
[I 2025-08-31 00:43:26,237] Trial 358 finished with values: [-1000000000.0, 1000000000.0] and parameters: {'p_sma': 46, 'p_std': 13, 'p_atr': 22, 'p_adx': 10, 'rsi_period': 57, 'ema1': 9, 'ema2': 20, 'slip_atr_k': 0.23223681879586106, 'slip_spread_k': 0.23920909726135436, 'spread_hl_frac': 0.025823971803425997, 'bb_std_mult': 1.545611361147723, 'rsi_os': 55, 'rsi_ob': 77, 'vol_spike': 0.19963100226742517, 'adx_thresh': 9.627199937366768, 'atr_min_pct': 0.011330731312667092, 'atr_max_pct': 0.07479861044211651, 'tp_mult': 1.5113777012060983, 'tsl_mult': 0.43744692874149893, 'strategy': 'mean_reversion', 'time_stop': 88, 'use_sma': True, 'use_atr': False, 'use_adx': False, 'use_ema': True, 'use_spike': False, 'rsi_required': False, 'edge_k': 0.7837703590325913, 'edge_cap': 0.5063082473659656, 'bull_strategy': 'breakout', 'bull_bb_std_mult': 2.8244553532210066, 'bull_rsi_os': 39, 'bull_rsi_ob': 85, 'bull_adx_thresh': 13.816818489788632, 'bull_atr_min_pct': 0.001236313558505593, 'bull_atr_max_pct': 0.1426879752787199, 'bull_tp_mult': 2.3960711460639326, 'bull_tsl_mult': 0.4210306052030802, 'bull_time_stop': 123, 'bull_use_sma': False, 'bull_use_ema': False, 'bull_use_atr': True, 'bull_use_adx': True, 'bull_use_spike': False, 'bull_rsi_required': False, 'bear_strategy': 'mean_reversion', 'bear_bb_std_mult': 0.9710305314860549, 'bear_rsi_os': 7, 'bear_rsi_ob': 75, 'bear_adx_thresh': 6.647552920997359, 'bear_atr_min_pct': 0.018006009995954936, 'bear_atr_max_pct': 0.08132072998272898, 'bear_tp_mult': 1.72354507211106, 'bear_tsl_mult': 0.30409322339655365, 'bear_time_stop': 264, 'bear_use_sma': True, 'bear_use_ema': False, 'bear_use_atr': False, 'bear_use_adx': True, 'bear_use_spike': False, 'bear_rsi_required': True, 'sideways_strategy': 'breakout', 'sideways_bb_std_mult': 3.140073267014781, 'sideways_rsi_os': 48, 'sideways_rsi_ob': 90, 'sideways_adx_thresh': 10.355155527784806, 'sideways_atr_min_pct': 0.020425219642347767, 'sideways_atr_max_pct': 0.13755387959085125, 'sideways_tp_mult': 2.753535962371461, 'sideways_tsl_mult': 0.6928511435750653, 'sideways_time_stop': 190, 'sideways_use_sma': True, 'sideways_use_ema': False, 'sideways_use_atr': False, 'sideways_use_adx': False, 'sideways_use_spike': True, 'sideways_rsi_required': False}.
