[I 2025-08-31 03:01:10,831] Trial 748 finished with values: [-1000000000.0, 1000000000.0] and parameters: {'p_sma': 54, 'p_std': 48, 'p_atr': 27, 'p_adx': 22, 'rsi_period': 38, 'ema1': 23, 'ema2': 30, 'slip_atr_k': 0.1488105783482659, 'slip_spread_k': 0.2088437806324787, 'spread_hl_frac': 0.014403780477734536, 'bb_std_mult': 1.7934209813863415, 'rsi_os': 38, 'rsi_ob': 72, 'vol_spike': 0.18098819940460165, 'adx_thresh': 21.00817444525043, 'atr_min_pct': 0.025329115330304415, 'atr_max_pct': 0.11888258576703374, 'tp_mult': 1.1092671844026212, 'tsl_mult': 0.44527445616238065, 'strategy': 'mean_reversion', 'time_stop': 114, 'use_sma': False, 'use_atr': False, 'use_adx': False, 'use_ema': False, 'use_spike': False, 'rsi_required': True, 'edge_k': 0.6227399444732147, 'edge_cap': 0.11456207506373889, 'bull_strategy': 'breakout', 'bull_bb_std_mult': 2.4297457618131855, 'bull_rsi_os': 11, 'bull_rsi_ob': 93, 'bull_adx_thresh': 5.930874849671553, 'bull_atr_min_pct': 0.00791921943297426, 'bull_atr_max_pct': 0.1417067386994794, 'bull_tp_mult': 2.0005802499689844, 'bull_tsl_mult': 0.982371564370814, 'bull_time_stop': 138, 'bull_use_sma': True, 'bull_use_ema': False, 'bull_use_atr': False, 'bull_use_adx': True, 'bull_use_spike': True, 'bull_rsi_required': True, 'bear_strategy': 'mean_reversion', 'bear_bb_std_mult': 1.3743258972323904, 'bear_rsi_os': 31, 'bear_rsi_ob': 45, 'bear_adx_thresh': 6.159000429875149, 'bear_atr_min_pct': 0.006003764790796807, 'bear_atr_max_pct': 0.10413686287260815, 'bear_tp_mult': 2.0779257899124217, 'bear_tsl_mult': 0.2799868087296935, 'bear_time_stop': 110, 'bear_use_sma': False, 'bear_use_ema': False, 'bear_use_atr': False, 'bear_use_adx': True, 'bear_use_spike': False, 'bear_rsi_required': True, 'sideways_strategy': 'breakout', 'sideways_bb_std_mult': 0.5035497818708162, 'sideways_rsi_os': 25, 'sideways_rsi_ob': 79, 'sideways_adx_thresh': 10.11210453112794, 'sideways_atr_min_pct': 0.0254988994420999, 'sideways_atr_max_pct': 0.06791476793159734, 'sideways_tp_mult': 1.663021457536169, 'sideways_tsl_mult': 0.6547174337212855, 'sideways_time_stop': 203, 'sideways_use_sma': True, 'sideways_use_ema': False, 'sideways_use_atr': False, 'sideways_use_adx': False, 'sideways_use_spike': True, 'sideways_rsi_required': False}.
[I 2025-08-31 03:01:11,142] Trial 746 finished with values: [-1000000000.0, 1000000000.0] and parameters: {'p_sma': 13, 'p_std': 59, 'p_atr': 28, 'p_adx': 22, 'rsi_period': 38, 'ema1': 5, 'ema2': 44, 'slip_atr_k': 0.08388203423421718, 'slip_spread_k': 0.14539021409624883, 'spread_hl_frac': 0.02755276310066744, 'bb_std_mult': 1.8355998299739191, 'rsi_os': 38, 'rsi_ob': 70, 'vol_spike': 0.18140296982722587, 'adx_thresh': 20.961271258861405, 'atr_min_pct': 0.017772435432856334, 'atr_max_pct': 0.11845226048294188, 'tp_mult': 2.0151043578572607, 'tsl_mult': 0.2631624890378876, 'strategy': 'mean_reversion', 'time_stop': 94, 'use_sma': False, 'use_atr': False, 'use_adx': False, 'use_ema': False, 'use_spike': False, 'rsi_required': True, 'edge_k': 0.5377717467420728, 'edge_cap': 0.5197959584764779, 'bull_strategy': 'breakout', 'bull_bb_std_mult': 3.1929248320011405, 'bull_rsi_os': 46, 'bull_rsi_ob': 85, 'bull_adx_thresh': 5.818339366087281, 'bull_atr_min_pct': 0.01742578983003475, 'bull_atr_max_pct': 0.14102372245106598, 'bull_tp_mult': 2.351834580911914, 'bull_tsl_mult': 0.2817568813585718, 'bull_time_stop': 11, 'bull_use_sma': True, 'bull_use_ema': True, 'bull_use_atr': False, 'bull_use_adx': True, 'bull_use_spike': True, 'bull_rsi_required': True, 'bear_strategy': 'mean_reversion', 'bear_bb_std_mult': 1.3668704014327484, 'bear_rsi_os': 39, 'bear_rsi_ob': 48, 'bear_adx_thresh': 5.005167055359563, 'bear_atr_min_pct': 0.005852733067084765, 'bear_atr_max_pct': 0.012394772374080487, 'bear_tp_mult': 2.0243007000891824, 'bear_tsl_mult': 0.5183280010643061, 'bear_time_stop': 11, 'bear_use_sma': False, 'bear_use_ema': False, 'bear_use_atr': False, 'bear_use_adx': True, 'bear_use_spike': False, 'bear_rsi_required': True, 'sideways_strategy': 'breakout', 'sideways_bb_std_mult': 0.5661110553607225, 'sideways_rsi_os': 25, 'sideways_rsi_ob': 95, 'sideways_adx_thresh': 15.537704486053377, 'sideways_atr_min_pct': 0.028057069532792127, 'sideways_atr_max_pct': 0.11875112375211816, 'sideways_tp_mult': 1.8223322231528325, 'sideways_tsl_mult': 0.6963315914037713, 'sideways_time_stop': 204, 'sideways_use_sma': True, 'sideways_use_ema': False, 'sideways_use_atr': False, 'sideways_use_adx': False, 'sideways_use_spike': True, 'sideways_rsi_required': True}.
[I 2025-08-31 03:01:12,145] Trial 750 finished with values: [-1000000000.0, 1000000000.0] and parameters: {'p_sma': 5, 'p_std': 51, 'p_atr': 30, 'p_adx': 24, 'rsi_period': 69, 'ema1': 5, 'ema2': 55, 'slip_atr_k': 0.12167757223070245, 'slip_spread_k': 0.17374613018356386, 'spread_hl_frac': 0.003607933230002219, 'bb_std_mult': 1.8921815335844316, 'rsi_os': 25, 'rsi_ob': 46, 'vol_spike': 0.16624341504114426, 'adx_thresh': 22.045457222871967, 'atr_min_pct': 0.007441436279709911, 'atr_max_pct': 0.11901264356266406, 'tp_mult': 2.8043145901676416, 'tsl_mult': 0.47183425541980945, 'strategy': 'mean_reversion', 'time_stop': 247, 'use_sma': True, 'use_atr': True, 'use_adx': True, 'use_ema': False, 'use_spike': False, 'rsi_required': True, 'edge_k': 0.32969460705925957, 'edge_cap': 0.49442478127008604, 'bull_strategy': 'mean_reversion', 'bull_bb_std_mult': 1.4541206727604656, 'bull_rsi_os': 49, 'bull_rsi_ob': 59, 'bull_adx_thresh': 6.831073838485763, 'bull_atr_min_pct': 0.010934965168468008, 'bull_atr_max_pct': 0.1275367910231766, 'bull_tp_mult': 2.2535311511404106, 'bull_tsl_mult': 0.5549068903839884, 'bull_time_stop': 120, 'bull_use_sma': True, 'bull_use_ema': False, 'bull_use_atr': False, 'bull_use_adx': True, 'bull_use_spike': True, 'bull_rsi_required': True, 'bear_strategy': 'breakout', 'bear_bb_std_mult': 1.2914294389504835, 'bear_rsi_os': 16, 'bear_rsi_ob': 45, 'bear_adx_thresh': 17.782433120488722, 'bear_atr_min_pct': 0.026043406270769613, 'bear_atr_max_pct': 0.010283730477733432, 'bear_tp_mult': 2.077406717653021, 'bear_tsl_mult': 0.5684829986330295, 'bear_time_stop': 21, 'bear_use_sma': False, 'bear_use_ema': False, 'bear_use_atr': True, 'bear_use_adx': True, 'bear_use_spike': True, 'bear_rsi_required': True, 'sideways_strategy': 'breakout', 'sideways_bb_std_mult': 0.614362970634844, 'sideways_rsi_os': 40, 'sideways_rsi_ob': 57, 'sideways_adx_thresh': 24.165583588073616, 'sideways_atr_min_pct': 0.01083426083290795, 'sideways_atr_max_pct': 0.06374378323108557, 'sideways_tp_mult': 1.7235229889227894, 'sideways_tsl_mult': 0.4051519423205442, 'sideways_time_stop': 273, 'sideways_use_sma': False, 'sideways_use_ema': True, 'sideways_use_atr': True, 'sideways_use_adx': False, 'sideways_use_spike': False, 'sideways_rsi_required': False}.
[I 2025-08-31 03:01:44,411] Trial 751 finished with values: [-1000000000.0, 1000000000.0] and parameters: {'p_sma': 56, 'p_std': 51, 'p_atr': 28, 'p_adx': 24, 'rsi_period': 69, 'ema1': 25, 'ema2': 37, 'slip_atr_k': 0.21190135067378635, 'slip_spread_k': 0.6795305997628492, 'spread_hl_frac': 0.03895616728641815, 'bb_std_mult': 1.535642735360015, 'rsi_os': 49, 'rsi_ob': 69, 'vol_spike': 0.20744719226883243, 'adx_thresh': 32.522588815421116, 'atr_min_pct': 0.007601786642263004, 'atr_max_pct': 0.11956265997039893, 'tp_mult': 2.8320263949707676, 'tsl_mult': 0.5964433247744934, 'strategy': 'mean_reversion', 'time_stop': 136, 'use_sma': True, 'use_atr': True, 'use_adx': True, 'use_ema': False, 'use_spike': False, 'rsi_required': True, 'edge_k': 1.7776047165696964, 'edge_cap': 0.16680767478760333, 'bull_strategy': 'mean_reversion', 'bull_bb_std_mult': 0.5019222269317836, 'bull_rsi_os': 45, 'bull_rsi_ob': 58, 'bull_adx_thresh': 29.84831820147991, 'bull_atr_min_pct': 0.012287813790189426, 'bull_atr_max_pct': 0.12785776852376318, 'bull_tp_mult': 1.0868350003030183, 'bull_tsl_mult': 0.2329824542632107, 'bull_time_stop': 200, 'bull_use_sma': True, 'bull_use_ema': False, 'bull_use_atr': False, 'bull_use_adx': True, 'bull_use_spike': True, 'bull_rsi_required': True, 'bear_strategy': 'breakout', 'bear_bb_std_mult': 1.2741240832179568, 'bear_rsi_os': 42, 'bear_rsi_ob': 45, 'bear_adx_thresh': 29.298251272604347, 'bear_atr_min_pct': 0.023018899345053988, 'bear_atr_max_pct': 0.01232744143439829, 'bear_tp_mult': 2.293409066461427, 'bear_tsl_mult': 0.5645728260446179, 'bear_time_stop': 206, 'bear_use_sma': False, 'bear_use_ema': False, 'bear_use_atr': True, 'bear_use_adx': True, 'bear_use_spike': True, 'bear_rsi_required': True, 'sideways_strategy': 'breakout', 'sideways_bb_std_mult': 0.6046169122967135, 'sideways_rsi_os': 39, 'sideways_rsi_ob': 86, 'sideways_adx_thresh': 6.087211240721015, 'sideways_atr_min_pct': 0.02798766086623265, 'sideways_atr_max_pct': 0.05132274396793585, 'sideways_tp_mult': 1.7157784898569066, 'sideways_tsl_mult': 0.6840099432226752, 'sideways_time_stop': 194, 'sideways_use_sma': False, 'sideways_use_ema': True, 'sideways_use_atr': True, 'sideways_use_adx': False, 'sideways_use_spike': False, 'sideways_rsi_required': False}.
[I 2025-08-31 03:01:44,895] Trial 749 finished with values: [-1000000000.0, 1000000000.0] and parameters: {'p_sma': 36, 'p_std': 6, 'p_atr': 30, 'p_adx': 24, 'rsi_period': 69, 'ema1': 25, 'ema2': 37, 'slip_atr_k': 0.020976760235898895, 'slip_spread_k': 0.17589152388505166, 'spread_hl_frac': 0.03063354003864309, 'bb_std_mult': 1.5568906764679926, 'rsi_os': 49, 'rsi_ob': 58, 'vol_spike': 0.16678748353797015, 'adx_thresh': 31.09670347184799, 'atr_min_pct': 0.0075681563844970925, 'atr_max_pct': 0.11964488689674119, 'tp_mult': 2.804542653024134, 'tsl_mult': 0.5732742287406422, 'strategy': 'mean_reversion', 'time_stop': 246, 'use_sma': True, 'use_atr': True, 'use_adx': True, 'use_ema': False, 'use_spike': False, 'rsi_required': True, 'edge_k': 0.5148055772589399, 'edge_cap': 0.13185982321153147, 'bull_strategy': 'mean_reversion', 'bull_bb_std_mult': 1.6414678886787393, 'bull_rsi_os': 45, 'bull_rsi_ob': 59, 'bull_adx_thresh': 22.947792409512008, 'bull_atr_min_pct': 0.021425592768739378, 'bull_atr_max_pct': 0.03967905052696053, 'bull_tp_mult': 1.0951031740546167, 'bull_tsl_mult': 0.7596636949809534, 'bull_time_stop': 12, 'bull_use_sma': True, 'bull_use_ema': False, 'bull_use_atr': False, 'bull_use_adx': True, 'bull_use_spike': True, 'bull_rsi_required': True, 'bear_strategy': 'breakout', 'bear_bb_std_mult': 1.2612474779062717, 'bear_rsi_os': 8, 'bear_rsi_ob': 45, 'bear_adx_thresh': 5.5406191920146775, 'bear_atr_min_pct': 0.001058516736614402, 'bear_atr_max_pct': 0.01210960609773291, 'bear_tp_mult': 1.973591188615814, 'bear_tsl_mult': 0.5477255985548585, 'bear_time_stop': 16, 'bear_use_sma': False, 'bear_use_ema': False, 'bear_use_atr': True, 'bear_use_adx': True, 'bear_use_spike': True, 'bear_rsi_required': True, 'sideways_strategy': 'breakout', 'sideways_bb_std_mult': 0.6155133443858781, 'sideways_rsi_os': 39, 'sideways_rsi_ob': 86, 'sideways_adx_thresh': 30.401990452926952, 'sideways_atr_min_pct': 0.028635297419348633, 'sideways_atr_max_pct': 0.06313930375576447, 'sideways_tp_mult': 1.7174167613619526, 'sideways_tsl_mult': 0.27616807664629284, 'sideways_time_stop': 194, 'sideways_use_sma': False, 'sideways_use_ema': True, 'sideways_use_atr': True, 'sideways_use_adx': False, 'sideways_use_spike': False, 'sideways_rsi_required': False}.
[I 2025-08-31 03:01:45,088] Trial 752 finished with values: [-1000000000.0, 1000000000.0] and parameters: {'p_sma': 55, 'p_std': 51, 'p_atr': 29, 'p_adx': 24, 'rsi_period': 43, 'ema1': 25, 'ema2': 46, 'slip_atr_k': 0.1227979889632391, 'slip_spread_k': 0.6693995700041095, 'spread_hl_frac': 0.0033972373955952883, 'bb_std_mult': 1.562882276322552, 'rsi_os': 19, 'rsi_ob': 69, 'vol_spike': 0.20881852498092265, 'adx_thresh': 32.69903637944604, 'atr_min_pct': 0.027150777832516876, 'atr_max_pct': 0.13277673217891062, 'tp_mult': 1.2924456548287198, 'tsl_mult': 0.47631673728847834, 'strategy': 'mean_reversion', 'time_stop': 241, 'use_sma': True, 'use_atr': True, 'use_adx': True, 'use_ema': False, 'use_spike': True, 'rsi_required': True, 'edge_k': 0.5130491026513816, 'edge_cap': 0.16641816725745717, 'bull_strategy': 'mean_reversion', 'bull_bb_std_mult': 1.4591302174001075, 'bull_rsi_os': 49, 'bull_rsi_ob': 91, 'bull_adx_thresh': 6.872067301265139, 'bull_atr_min_pct': 0.012757879422314067, 'bull_atr_max_pct': 0.13014505375074326, 'bull_tp_mult': 2.2482168151576674, 'bull_tsl_mult': 0.7839321526167768, 'bull_time_stop': 143, 'bull_use_sma': True, 'bull_use_ema': False, 'bull_use_atr': False, 'bull_use_adx': True, 'bull_use_spike': True, 'bull_rsi_required': True, 'bear_strategy': 'breakout', 'bear_bb_std_mult': 1.274535345097739, 'bear_rsi_os': 42, 'bear_rsi_ob': 59, 'bear_adx_thresh': 5.011980762154109, 'bear_atr_min_pct': 0.026313383622651385, 'bear_atr_max_pct': 0.010287201474025206, 'bear_tp_mult': 1.977799071306517, 'bear_tsl_mult': 0.5693519439793582, 'bear_time_stop': 282, 'bear_use_sma': False, 'bear_use_ema': True, 'bear_use_atr': True, 'bear_use_adx': True, 'bear_use_spike': True, 'bear_rsi_required': True, 'sideways_strategy': 'breakout', 'sideways_bb_std_mult': 0.6370015657328186, 'sideways_rsi_os': 15, 'sideways_rsi_ob': 92, 'sideways_adx_thresh': 34.55211463225123, 'sideways_atr_min_pct': 0.028328042702539483, 'sideways_atr_max_pct': 0.05078906145171381, 'sideways_tp_mult': 1.7133102713092043, 'sideways_tsl_mult': 0.40747235374506297, 'sideways_time_stop': 195, 'sideways_use_sma': False, 'sideways_use_ema': True, 'sideways_use_atr': True, 'sideways_use_adx': False, 'sideways_use_spike': False, 'sideways_rsi_required': False}.
[I 2025-08-31 03:01:45,270] Trial 753 finished with values: [-1000000000.0, 1000000000.0] and parameters: {'p_sma': 29, 'p_std': 51, 'p_atr': 29, 'p_adx': 28, 'rsi_period': 70, 'ema1': 17, 'ema2': 46, 'slip_atr_k': 0.19612007618351637, 'slip_spread_k': 0.17679405739701146, 'spread_hl_frac': 0.02000728192489933, 'bb_std_mult': 1.5491138819221262, 'rsi_os': 39, 'rsi_ob': 72, 'vol_spike': 0.2095402221368341, 'adx_thresh': 22.173272195193967, 'atr_min_pct': 0.020457362498104127, 'atr_max_pct': 0.13229445466226955, 'tp_mult': 2.4652933090164675, 'tsl_mult': 0.35560918728808383, 'strategy': 'mean_reversion', 'time_stop': 240, 'use_sma': True, 'use_atr': False, 'use_adx': False, 'use_ema': False, 'use_spike': True, 'rsi_required': True, 'edge_k': 0.6216570690744395, 'edge_cap': 0.1667847763083418, 'bull_strategy': 'breakout', 'bull_bb_std_mult': 0.5853860483055506, 'bull_rsi_os': 53, 'bull_rsi_ob': 47, 'bull_adx_thresh': 23.04021849090181, 'bull_atr_min_pct': 0.012257379277361058, 'bull_atr_max_pct': 0.044805053765674466, 'bull_tp_mult': 1.0742350404051715, 'bull_tsl_mult': 0.7852163738485564, 'bull_time_stop': 131, 'bull_use_sma': True, 'bull_use_ema': False, 'bull_use_atr': False, 'bull_use_adx': True, 'bull_use_spike': True, 'bull_rsi_required': True, 'bear_strategy': 'breakout', 'bear_bb_std_mult': 1.257127671552678, 'bear_rsi_os': 16, 'bear_rsi_ob': 67, 'bear_adx_thresh': 30.69703797270454, 'bear_atr_min_pct': 0.00733065669889954, 'bear_atr_max_pct': 0.12136326598522967, 'bear_tp_mult': 2.5254270657923836, 'bear_tsl_mult': 0.8791593978343615, 'bear_time_stop': 202, 'bear_use_sma': False, 'bear_use_ema': True, 'bear_use_atr': True, 'bear_use_adx': True, 'bear_use_spike': True, 'bear_rsi_required': True, 'sideways_strategy': 'breakout', 'sideways_bb_std_mult': 1.4473001525811622, 'sideways_rsi_os': 43, 'sideways_rsi_ob': 86, 'sideways_adx_thresh': 8.530385267129237, 'sideways_atr_min_pct': 0.02834533531397064, 'sideways_atr_max_pct': 0.05104284826977538, 'sideways_tp_mult': 1.7102750841234542, 'sideways_tsl_mult': 0.8071224100348693, 'sideways_time_stop': 195, 'sideways_use_sma': True, 'sideways_use_ema': False, 'sideways_use_atr': False, 'sideways_use_adx': False, 'sideways_use_spike': False, 'sideways_rsi_required': False}.
[I 2025-08-31 03:01:46,399] Trial 756 finished with values: [-1000000000.0, 1000000000.0] and parameters: {'p_sma': 10, 'p_std': 53, 'p_atr': 29, 'p_adx': 21, 'rsi_period': 74, 'ema1': 6, 'ema2': 27, 'slip_atr_k': 0.010758828045670174, 'slip_spread_k': 0.15525029026237808, 'spread_hl_frac': 6.450378026716993e-06, 'bb_std_mult': 2.3373862776530547, 'rsi_os': 35, 'rsi_ob': 48, 'vol_spike': 0.09275989082531634, 'adx_thresh': 22.28337970625541, 'atr_min_pct': 0.008804803093932776, 'atr_max_pct': 0.12410402531614767, 'tp_mult': 1.5233611538405498, 'tsl_mult': 0.36019546425746923, 'strategy': 'mean_reversion', 'time_stop': 230, 'use_sma': True, 'use_atr': False, 'use_adx': False, 'use_ema': False, 'use_spike': True, 'rsi_required': True, 'edge_k': 0.6204358757416759, 'edge_cap': 0.07477892894160043, 'bull_strategy': 'breakout', 'bull_bb_std_mult': 3.502888527449481, 'bull_rsi_os': 9, 'bull_rsi_ob': 47, 'bull_adx_thresh': 5.425355196669518, 'bull_atr_min_pct': 0.014299290584957183, 'bull_atr_max_pct': 0.13430750979002845, 'bull_tp_mult': 2.230583708142701, 'bull_tsl_mult': 0.25457202062092676, 'bull_time_stop': 38, 'bull_use_sma': True, 'bull_use_ema': False, 'bull_use_atr': False, 'bull_use_adx': False, 'bull_use_spike': True, 'bull_rsi_required': True, 'bear_strategy': 'mean_reversion', 'bear_bb_std_mult': 1.7113513602856216, 'bear_rsi_os': 16, 'bear_rsi_ob': 51, 'bear_adx_thresh': 30.396005182625778, 'bear_atr_min_pct': 0.00676558240965483, 'bear_atr_max_pct': 0.04093547726343121, 'bear_tp_mult': 1.6360170765953823, 'bear_tsl_mult': 0.3209754322142703, 'bear_time_stop': 5, 'bear_use_sma': False, 'bear_use_ema': True, 'bear_use_atr': False, 'bear_use_adx': False, 'bear_use_spike': False, 'bear_rsi_required': True, 'sideways_strategy': 'breakout', 'sideways_bb_std_mult': 2.9052892002256088, 'sideways_rsi_os': 29, 'sideways_rsi_ob': 94, 'sideways_adx_thresh': 9.138069727907602, 'sideways_atr_min_pct': 0.02720808794103682, 'sideways_atr_max_pct': 0.057658894151542975, 'sideways_tp_mult': 1.6536801130218366, 'sideways_tsl_mult': 0.8076040503038355, 'sideways_time_stop': 51, 'sideways_use_sma': True, 'sideways_use_ema': False, 'sideways_use_atr': False, 'sideways_use_adx': True, 'sideways_use_spike': True, 'sideways_rsi_required': False}.
[I 2025-08-31 03:02:20,259] Trial 757 finished with values: [-1000000000.0, 1000000000.0] and parameters: {'p_sma': 51, 'p_std': 52, 'p_atr': 27, 'p_adx': 12, 'rsi_period': 76, 'ema1': 6, 'ema2': 26, 'slip_atr_k': 0.11545172322735811, 'slip_spread_k': 0.15167610164894546, 'spread_hl_frac': 0.00210322241057578, 'bb_std_mult': 1.658816569859037, 'rsi_os': 46, 'rsi_ob': 68, 'vol_spike': 0.26693040483710606, 'adx_thresh': 23.67931401434575, 'atr_min_pct': 0.00825245435409562, 'atr_max_pct': 0.016375231137980006, 'tp_mult': 1.0569113980855898, 'tsl_mult': 0.5241052898448031, 'strategy': 'mean_reversion', 'time_stop': 124, 'use_sma': False, 'use_atr': False, 'use_adx': False, 'use_ema': False, 'use_spike': False, 'rsi_required': True, 'edge_k': 0.5654219567671972, 'edge_cap': 0.701916539144265, 'bull_strategy': 'breakout', 'bull_bb_std_mult': 2.036453488402134, 'bull_rsi_os': 42, 'bull_rsi_ob': 57, 'bull_adx_thresh': 5.439620916867994, 'bull_atr_min_pct': 0.00425931526453796, 'bull_atr_max_pct': 0.06052149740363537, 'bull_tp_mult': 1.7129126582164789, 'bull_tsl_mult': 0.24240337701698822, 'bull_time_stop': 135, 'bull_use_sma': True, 'bull_use_ema': False, 'bull_use_atr': False, 'bull_use_adx': False, 'bull_use_spike': True, 'bull_rsi_required': True, 'bear_strategy': 'mean_reversion', 'bear_bb_std_mult': 2.6065299131594966, 'bear_rsi_os': 19, 'bear_rsi_ob': 47, 'bear_adx_thresh': 20.255202498162184, 'bear_atr_min_pct': 0.006736594452522187, 'bear_atr_max_pct': 0.016448967892634964, 'bear_tp_mult': 2.62302551177192, 'bear_tsl_mult': 0.6219250372920476, 'bear_time_stop': 23, 'bear_use_sma': False, 'bear_use_ema': False, 'bear_use_atr': False, 'bear_use_adx': False, 'bear_use_spike': False, 'bear_rsi_required': True, 'sideways_strategy': 'breakout', 'sideways_bb_std_mult': 0.5614612788851082, 'sideways_rsi_os': 42, 'sideways_rsi_ob': 94, 'sideways_adx_thresh': 9.160946004400842, 'sideways_atr_min_pct': 0.025825678582916036, 'sideways_atr_max_pct': 0.05665010099174854, 'sideways_tp_mult': 1.6557957923678368, 'sideways_tsl_mult': 0.1786572448423916, 'sideways_time_stop': 185, 'sideways_use_sma': True, 'sideways_use_ema': False, 'sideways_use_atr': False, 'sideways_use_adx': True, 'sideways_use_spike': True, 'sideways_rsi_required': True}.
