[I 2025-08-31 03:11:01,070] Trial 821 finished with values: [-1000000000.0, 1000000000.0] and parameters: {'p_sma': 51, 'p_std': 48, 'p_atr': 27, 'p_adx': 18, 'rsi_period': 24, 'ema1': 6, 'ema2': 36, 'slip_atr_k': 0.2494230920541125, 'slip_spread_k': 0.21311192556273223, 'spread_hl_frac': 0.027953361106524823, 'bb_std_mult': 1.6528436161922364, 'rsi_os': 38, 'rsi_ob': 71, 'vol_spike': 0.12942165423029134, 'adx_thresh': 24.527581797897803, 'atr_min_pct': 0.018763828067925228, 'atr_max_pct': 0.13056532823583922, 'tp_mult': 1.6896823828864345, 'tsl_mult': 0.297237144395379, 'strategy': 'mean_reversion', 'time_stop': 117, 'use_sma': True, 'use_atr': False, 'use_adx': False, 'use_ema': True, 'use_spike': False, 'rsi_required': True, 'edge_k': 0.5001600127258321, 'edge_cap': 0.10920116801737513, 'bull_strategy': 'breakout', 'bull_bb_std_mult': 0.8690025271724549, 'bull_rsi_os': 7, 'bull_rsi_ob': 59, 'bull_adx_thresh': 28.33913149962774, 'bull_atr_min_pct': 0.008936999441166337, 'bull_atr_max_pct': 0.1429899923060435, 'bull_tp_mult': 2.3061526473794296, 'bull_tsl_mult': 0.6559026173945152, 'bull_time_stop': 82, 'bull_use_sma': True, 'bull_use_ema': False, 'bull_use_atr': True, 'bull_use_adx': False, 'bull_use_spike': True, 'bull_rsi_required': True, 'bear_strategy': 'mean_reversion', 'bear_bb_std_mult': 2.0882713473118613, 'bear_rsi_os': 15, 'bear_rsi_ob': 91, 'bear_adx_thresh': 6.749892017033406, 'bear_atr_min_pct': 0.024393217623023624, 'bear_atr_max_pct': 0.01999875936614228, 'bear_tp_mult': 2.11193963063868, 'bear_tsl_mult': 0.811037266394387, 'bear_time_stop': 5, 'bear_use_sma': True, 'bear_use_ema': False, 'bear_use_atr': False, 'bear_use_adx': False, 'bear_use_spike': True, 'bear_rsi_required': False, 'sideways_strategy': 'breakout', 'sideways_bb_std_mult': 0.6740085092102782, 'sideways_rsi_os': 28, 'sideways_rsi_ob': 95, 'sideways_adx_thresh': 9.802293124450273, 'sideways_atr_min_pct': 0.025723548730444874, 'sideways_atr_max_pct': 0.05027874697378901, 'sideways_tp_mult': 1.6424922073011412, 'sideways_tsl_mult': 0.12112540743958072, 'sideways_time_stop': 208, 'sideways_use_sma': True, 'sideways_use_ema': True, 'sideways_use_atr': True, 'sideways_use_adx': False, 'sideways_use_spike': True, 'sideways_rsi_required': False}.
[I 2025-08-31 03:11:01,456] Trial 819 finished with values: [-1000000000.0, 1000000000.0] and parameters: {'p_sma': 51, 'p_std': 10, 'p_atr': 27, 'p_adx': 11, 'rsi_period': 71, 'ema1': 16, 'ema2': 28, 'slip_atr_k': 0.0777840317096526, 'slip_spread_k': 0.2023480560908097, 'spread_hl_frac': 0.04536532372992018, 'bb_std_mult': 1.6633629543789457, 'rsi_os': 19, 'rsi_ob': 71, 'vol_spike': 0.20420348419391857, 'adx_thresh': 24.430628196373643, 'atr_min_pct': 0.007465845033000453, 'atr_max_pct': 0.12156259684512066, 'tp_mult': 1.9240653541063268, 'tsl_mult': 0.3038397272492007, 'strategy': 'mean_reversion', 'time_stop': 131, 'use_sma': True, 'use_atr': False, 'use_adx': False, 'use_ema': True, 'use_spike': False, 'rsi_required': True, 'edge_k': 0.48628043975359136, 'edge_cap': 0.12103844234913891, 'bull_strategy': 'breakout', 'bull_bb_std_mult': 2.357396050934496, 'bull_rsi_os': 5, 'bull_rsi_ob': 57, 'bull_adx_thresh': 5.910730106951312, 'bull_atr_min_pct': 0.01582715499871975, 'bull_atr_max_pct': 0.14212899305215404, 'bull_tp_mult': 2.296227326025567, 'bull_tsl_mult': 0.45259336953230694, 'bull_time_stop': 133, 'bull_use_sma': True, 'bull_use_ema': False, 'bull_use_atr': False, 'bull_use_adx': False, 'bull_use_spike': True, 'bull_rsi_required': True, 'bear_strategy': 'mean_reversion', 'bear_bb_std_mult': 2.965569051851255, 'bear_rsi_os': 15, 'bear_rsi_ob': 65, 'bear_adx_thresh': 6.870652826735342, 'bear_atr_min_pct': 0.019731962141088168, 'bear_atr_max_pct': 0.10775453689054039, 'bear_tp_mult': 2.13314890696142, 'bear_tsl_mult': 0.36682264303283146, 'bear_time_stop': 199, 'bear_use_sma': False, 'bear_use_ema': False, 'bear_use_atr': False, 'bear_use_adx': True, 'bear_use_spike': True, 'bear_rsi_required': True, 'sideways_strategy': 'breakout', 'sideways_bb_std_mult': 1.5721948159134693, 'sideways_rsi_os': 40, 'sideways_rsi_ob': 49, 'sideways_adx_thresh': 9.75863232563922, 'sideways_atr_min_pct': 0.02822167496818996, 'sideways_atr_max_pct': 0.08860254374103876, 'sideways_tp_mult': 1.645679322140461, 'sideways_tsl_mult': 0.05146898242338699, 'sideways_time_stop': 214, 'sideways_use_sma': True, 'sideways_use_ema': False, 'sideways_use_atr': False, 'sideways_use_adx': False, 'sideways_use_spike': True, 'sideways_rsi_required': False}.
[I 2025-08-31 03:11:01,800] Trial 820 finished with values: [-1000000000.0, 1000000000.0] and parameters: {'p_sma': 51, 'p_std': 53, 'p_atr': 27, 'p_adx': 12, 'rsi_period': 10, 'ema1': 17, 'ema2': 36, 'slip_atr_k': 0.24953236659297634, 'slip_spread_k': 0.2062572369020346, 'spread_hl_frac': 0.0009307519705358243, 'bb_std_mult': 1.6708510904405447, 'rsi_os': 38, 'rsi_ob': 71, 'vol_spike': 0.20507611779098445, 'adx_thresh': 26.261480329520296, 'atr_min_pct': 0.007500219993062271, 'atr_max_pct': 0.12084483316326096, 'tp_mult': 2.9137890068335075, 'tsl_mult': 0.27066916985994116, 'strategy': 'mean_reversion', 'time_stop': 116, 'use_sma': True, 'use_atr': False, 'use_adx': False, 'use_ema': True, 'use_spike': False, 'rsi_required': True, 'edge_k': 0.0125350791018215, 'edge_cap': 0.11444874193673593, 'bull_strategy': 'breakout', 'bull_bb_std_mult': 2.338899257495709, 'bull_rsi_os': 47, 'bull_rsi_ob': 85, 'bull_adx_thresh': 6.02504345130803, 'bull_atr_min_pct': 0.004916750395023505, 'bull_atr_max_pct': 0.1415410825018703, 'bull_tp_mult': 2.2977342675918693, 'bull_tsl_mult': 0.2749726357172869, 'bull_time_stop': 133, 'bull_use_sma': True, 'bull_use_ema': False, 'bull_use_atr': True, 'bull_use_adx': False, 'bull_use_spike': True, 'bull_rsi_required': True, 'bear_strategy': 'mean_reversion', 'bear_bb_std_mult': 2.9734207841527818, 'bear_rsi_os': 15, 'bear_rsi_ob': 65, 'bear_adx_thresh': 24.998011697930348, 'bear_atr_min_pct': 0.015547916342936357, 'bear_atr_max_pct': 0.020278781022934435, 'bear_tp_mult': 2.0308987919968, 'bear_tsl_mult': 0.36679105314744265, 'bear_time_stop': 161, 'bear_use_sma': True, 'bear_use_ema': False, 'bear_use_atr': False, 'bear_use_adx': False, 'bear_use_spike': True, 'bear_rsi_required': False, 'sideways_strategy': 'breakout', 'sideways_bb_std_mult': 0.6125297471861525, 'sideways_rsi_os': 40, 'sideways_rsi_ob': 95, 'sideways_adx_thresh': 9.643347593706931, 'sideways_atr_min_pct': 0.02809111494614286, 'sideways_atr_max_pct': 0.10143302841783, 'sideways_tp_mult': 1.6304945078778041, 'sideways_tsl_mult': 0.06046663451168249, 'sideways_time_stop': 94, 'sideways_use_sma': True, 'sideways_use_ema': True, 'sideways_use_atr': True, 'sideways_use_adx': False, 'sideways_use_spike': True, 'sideways_rsi_required': False}.
[I 2025-08-31 03:11:02,520] Trial 822 finished with values: [-1000000000.0, 1000000000.0] and parameters: {'p_sma': 8, 'p_std': 48, 'p_atr': 11, 'p_adx': 16, 'rsi_period': 72, 'ema1': 24, 'ema2': 27, 'slip_atr_k': 0.010370538859587358, 'slip_spread_k': 0.6419674573008394, 'spread_hl_frac': 0.04545660379558969, 'bb_std_mult': 1.6442664528075068, 'rsi_os': 38, 'rsi_ob': 70, 'vol_spike': 0.20444134766390656, 'adx_thresh': 22.023077781271294, 'atr_min_pct': 0.01740152769643924, 'atr_max_pct': 0.12060539778965502, 'tp_mult': 2.4291222994824606, 'tsl_mult': 0.23078746953754248, 'strategy': 'mean_reversion', 'time_stop': 109, 'use_sma': True, 'use_atr': True, 'use_adx': True, 'use_ema': True, 'use_spike': False, 'rsi_required': True, 'edge_k': 0.5483487215420955, 'edge_cap': 0.5962799173780576, 'bull_strategy': 'breakout', 'bull_bb_std_mult': 0.5630227062896624, 'bull_rsi_os': 15, 'bull_rsi_ob': 88, 'bull_adx_thresh': 28.2604518945315, 'bull_atr_min_pct': 0.007185137632504959, 'bull_atr_max_pct': 0.13053181437561331, 'bull_tp_mult': 2.8771261870132556, 'bull_tsl_mult': 0.27521224587809806, 'bull_time_stop': 292, 'bull_use_sma': True, 'bull_use_ema': False, 'bull_use_atr': True, 'bull_use_adx': False, 'bull_use_spike': False, 'bull_rsi_required': False, 'bear_strategy': 'mean_reversion', 'bear_bb_std_mult': 3.167066153224657, 'bear_rsi_os': 18, 'bear_rsi_ob': 90, 'bear_adx_thresh': 24.91575934682361, 'bear_atr_min_pct': 0.006961447150309717, 'bear_atr_max_pct': 0.012630160972082506, 'bear_tp_mult': 2.123949628025958, 'bear_tsl_mult': 0.32697557577687064, 'bear_time_stop': 264, 'bear_use_sma': True, 'bear_use_ema': False, 'bear_use_atr': False, 'bear_use_adx': False, 'bear_use_spike': True, 'bear_rsi_required': False, 'sideways_strategy': 'breakout', 'sideways_bb_std_mult': 0.6112091189091232, 'sideways_rsi_os': 52, 'sideways_rsi_ob': 95, 'sideways_adx_thresh': 9.983511600297335, 'sideways_atr_min_pct': 0.010547586660326833, 'sideways_atr_max_pct': 0.04979150704142727, 'sideways_tp_mult': 1.6459489878309483, 'sideways_tsl_mult': 0.2841359635983149, 'sideways_time_stop': 211, 'sideways_use_sma': False, 'sideways_use_ema': True, 'sideways_use_atr': True, 'sideways_use_adx': False, 'sideways_use_spike': True, 'sideways_rsi_required': False}.
[I 2025-08-31 03:11:35,192] Trial 824 finished with values: [-1000000000.0, 1000000000.0] and parameters: {'p_sma': 34, 'p_std': 53, 'p_atr': 11, 'p_adx': 24, 'rsi_period': 68, 'ema1': 14, 'ema2': 16, 'slip_atr_k': 0.16486848947041324, 'slip_spread_k': 0.1519641241188921, 'spread_hl_frac': 0.030997320934993626, 'bb_std_mult': 1.7838528473242221, 'rsi_os': 40, 'rsi_ob': 82, 'vol_spike': 0.186928420548742, 'adx_thresh': 31.92819594815961, 'atr_min_pct': 0.009239573075705457, 'atr_max_pct': 0.12241813268286084, 'tp_mult': 1.010336631098853, 'tsl_mult': 0.24513984913882544, 'strategy': 'mean_reversion', 'time_stop': 173, 'use_sma': False, 'use_atr': True, 'use_adx': True, 'use_ema': False, 'use_spike': True, 'rsi_required': True, 'edge_k': 0.5294055987656759, 'edge_cap': 0.1416836604733316, 'bull_strategy': 'breakout', 'bull_bb_std_mult': 0.9595325676825284, 'bull_rsi_os': 52, 'bull_rsi_ob': 84, 'bull_adx_thresh': 6.128514158326328, 'bull_atr_min_pct': 0.004218780286019965, 'bull_atr_max_pct': 0.13064492207412656, 'bull_tp_mult': 2.2104731020592046, 'bull_tsl_mult': 0.27826962506081776, 'bull_time_stop': 36, 'bull_use_sma': True, 'bull_use_ema': False, 'bull_use_atr': True, 'bull_use_adx': True, 'bull_use_spike': False, 'bull_rsi_required': False, 'bear_strategy': 'breakout', 'bear_bb_std_mult': 3.064493018124803, 'bear_rsi_os': 27, 'bear_rsi_ob': 46, 'bear_adx_thresh': 5.010179363002984, 'bear_atr_min_pct': 0.002819543790283296, 'bear_atr_max_pct': 0.013076772956051724, 'bear_tp_mult': 2.0595451934350693, 'bear_tsl_mult': 0.3398862020212109, 'bear_time_stop': 209, 'bear_use_sma': False, 'bear_use_ema': True, 'bear_use_atr': True, 'bear_use_adx': True, 'bear_use_spike': False, 'bear_rsi_required': True, 'sideways_strategy': 'breakout', 'sideways_bb_std_mult': 1.8185696662244752, 'sideways_rsi_os': 39, 'sideways_rsi_ob': 94, 'sideways_adx_thresh': 9.035055973901255, 'sideways_atr_min_pct': 0.02712177501103712, 'sideways_atr_max_pct': 0.07767887074073304, 'sideways_tp_mult': 1.6920982026423643, 'sideways_tsl_mult': 0.5061984599594622, 'sideways_time_stop': 184, 'sideways_use_sma': False, 'sideways_use_ema': False, 'sideways_use_atr': False, 'sideways_use_adx': False, 'sideways_use_spike': False, 'sideways_rsi_required': False}.
[I 2025-08-31 03:11:35,479] Trial 823 finished with values: [-1000000000.0, 1000000000.0] and parameters: {'p_sma': 43, 'p_std': 53, 'p_atr': 11, 'p_adx': 26, 'rsi_period': 71, 'ema1': 10, 'ema2': 32, 'slip_atr_k': 0.011129198538160287, 'slip_spread_k': 0.7220028703090918, 'spread_hl_frac': 2.902356266410496e-05, 'bb_std_mult': 1.9271519214716, 'rsi_os': 40, 'rsi_ob': 67, 'vol_spike': 0.18756750790113277, 'adx_thresh': 6.436109462827725, 'atr_min_pct': 0.0022780152065316334, 'atr_max_pct': 0.12062682509100922, 'tp_mult': 1.319569514879414, 'tsl_mult': 0.7450068815017218, 'strategy': 'mean_reversion', 'time_stop': 52, 'use_sma': True, 'use_atr': True, 'use_adx': True, 'use_ema': False, 'use_spike': True, 'rsi_required': True, 'edge_k': 1.5715303210648832, 'edge_cap': 0.5345825470337308, 'bull_strategy': 'breakout', 'bull_bb_std_mult': 2.336075406095862, 'bull_rsi_os': 15, 'bull_rsi_ob': 47, 'bull_adx_thresh': 6.131615441749965, 'bull_atr_min_pct': 0.0041262200208991365, 'bull_atr_max_pct': 0.12930687731097887, 'bull_tp_mult': 2.2120872284133486, 'bull_tsl_mult': 0.2795635043201435, 'bull_time_stop': 271, 'bull_use_sma': True, 'bull_use_ema': False, 'bull_use_atr': False, 'bull_use_adx': False, 'bull_use_spike': False, 'bull_rsi_required': False, 'bear_strategy': 'mean_reversion', 'bear_bb_std_mult': 2.961944682337922, 'bear_rsi_os': 18, 'bear_rsi_ob': 53, 'bear_adx_thresh': 5.543693664917441, 'bear_atr_min_pct': 0.02140866922496973, 'bear_atr_max_pct': 0.01273950282308841, 'bear_tp_mult': 2.719193999328017, 'bear_tsl_mult': 0.9843105292752199, 'bear_time_stop': 197, 'bear_use_sma': False, 'bear_use_ema': True, 'bear_use_atr': False, 'bear_use_adx': True, 'bear_use_spike': False, 'bear_rsi_required': True, 'sideways_strategy': 'breakout', 'sideways_bb_std_mult': 1.5643164297002383, 'sideways_rsi_os': 39, 'sideways_rsi_ob': 94, 'sideways_adx_thresh': 9.260473293816705, 'sideways_atr_min_pct': 0.010228637036134872, 'sideways_atr_max_pct': 0.06337347574052629, 'sideways_tp_mult': 1.7026195119158152, 'sideways_tsl_mult': 0.08152273903033536, 'sideways_time_stop': 217, 'sideways_use_sma': False, 'sideways_use_ema': False, 'sideways_use_atr': False, 'sideways_use_adx': False, 'sideways_use_spike': True, 'sideways_rsi_required': False}.
[I 2025-08-31 03:11:35,623] Trial 825 finished with values: [-1000000000.0, 1000000000.0] and parameters: {'p_sma': 37, 'p_std': 25, 'p_atr': 11, 'p_adx': 14, 'rsi_period': 68, 'ema1': 24, 'ema2': 54, 'slip_atr_k': 0.15329900197256227, 'slip_spread_k': 0.15806549714890933, 'spread_hl_frac': 0.025005268971944775, 'bb_std_mult': 2.9398084820913866, 'rsi_os': 29, 'rsi_ob': 92, 'vol_spike': 0.18858490234405648, 'adx_thresh': 22.00090375767356, 'atr_min_pct': 0.017703524173546002, 'atr_max_pct': 0.09545708968902608, 'tp_mult': 2.4169829760043138, 'tsl_mult': 0.23755197385450544, 'strategy': 'mean_reversion', 'time_stop': 101, 'use_sma': False, 'use_atr': True, 'use_adx': True, 'use_ema': False, 'use_spike': True, 'rsi_required': True, 'edge_k': 0.558141261521202, 'edge_cap': 0.05032686861165843, 'bull_strategy': 'breakout', 'bull_bb_std_mult': 0.6164625113083291, 'bull_rsi_os': 34, 'bull_rsi_ob': 67, 'bull_adx_thresh': 5.42604148265074, 'bull_atr_min_pct': 0.003833609966884966, 'bull_atr_max_pct': 0.03998522473879564, 'bull_tp_mult': 2.231818475739977, 'bull_tsl_mult': 0.9591865602846004, 'bull_time_stop': 54, 'bull_use_sma': True, 'bull_use_ema': False, 'bull_use_atr': False, 'bull_use_adx': True, 'bull_use_spike': False, 'bull_rsi_required': False, 'bear_strategy': 'breakout', 'bear_bb_std_mult': 1.435312311977677, 'bear_rsi_os': 30, 'bear_rsi_ob': 88, 'bear_adx_thresh': 5.639029726517568, 'bear_atr_min_pct': 0.007092985583535631, 'bear_atr_max_pct': 0.013734609103355694, 'bear_tp_mult': 2.721028797007463, 'bear_tsl_mult': 0.5603141666814788, 'bear_time_stop': 266, 'bear_use_sma': False, 'bear_use_ema': True, 'bear_use_atr': True, 'bear_use_adx': True, 'bear_use_spike': False, 'bear_rsi_required': True, 'sideways_strategy': 'breakout', 'sideways_bb_std_mult': 3.164194584976054, 'sideways_rsi_os': 39, 'sideways_rsi_ob': 94, 'sideways_adx_thresh': 15.345118537165632, 'sideways_atr_min_pct': 0.013501118724662435, 'sideways_atr_max_pct': 0.07635449109326281, 'sideways_tp_mult': 2.022010171993045, 'sideways_tsl_mult': 0.6384372466757318, 'sideways_time_stop': 184, 'sideways_use_sma': False, 'sideways_use_ema': False, 'sideways_use_atr': False, 'sideways_use_adx': False, 'sideways_use_spike': False, 'sideways_rsi_required': False}.
[I 2025-08-31 03:11:35,716] Trial 826 finished with values: [-1000000000.0, 1000000000.0] and parameters: {'p_sma': 53, 'p_std': 24, 'p_atr': 29, 'p_adx': 26, 'rsi_period': 68, 'ema1': 14, 'ema2': 47, 'slip_atr_k': 0.02375685616852711, 'slip_spread_k': 0.15279108572638084, 'spread_hl_frac': 0.004219230524947496, 'bb_std_mult': 2.9560130571215018, 'rsi_os': 40, 'rsi_ob': 62, 'vol_spike': 0.18548523573282966, 'adx_thresh': 29.604430745505418, 'atr_min_pct': 0.009376271467958799, 'atr_max_pct': 0.01860497659659912, 'tp_mult': 1.328578206527297, 'tsl_mult': 0.4359125350232113, 'strategy': 'mean_reversion', 'time_stop': 100, 'use_sma': False, 'use_atr': True, 'use_adx': True, 'use_ema': False, 'use_spike': True, 'rsi_required': True, 'edge_k': 1.5492476985677726, 'edge_cap': 0.14250162426721572, 'bull_strategy': 'breakout', 'bull_bb_std_mult': 0.6805887823190837, 'bull_rsi_os': 12, 'bull_rsi_ob': 67, 'bull_adx_thresh': 5.378315960027708, 'bull_atr_min_pct': 0.004327321376741988, 'bull_atr_max_pct': 0.13619598837867763, 'bull_tp_mult': 2.224120285630951, 'bull_tsl_mult': 0.24237663833779433, 'bull_time_stop': 271, 'bull_use_sma': True, 'bull_use_ema': False, 'bull_use_atr': False, 'bull_use_adx': True, 'bull_use_spike': False, 'bull_rsi_required': False, 'bear_strategy': 'breakout', 'bear_bb_std_mult': 1.428465352355528, 'bear_rsi_os': 19, 'bear_rsi_ob': 47, 'bear_adx_thresh': 13.05974509002483, 'bear_atr_min_pct': 0.007670714013582404, 'bear_atr_max_pct': 0.014763388162967832, 'bear_tp_mult': 2.7265440481391194, 'bear_tsl_mult': 0.5947634247791259, 'bear_time_stop': 26, 'bear_use_sma': False, 'bear_use_ema': True, 'bear_use_atr': True, 'bear_use_adx': True, 'bear_use_spike': False, 'bear_rsi_required': True, 'sideways_strategy': 'breakout', 'sideways_bb_std_mult': 0.8879121264474672, 'sideways_rsi_os': 39, 'sideways_rsi_ob': 94, 'sideways_adx_thresh': 24.216094928407227, 'sideways_atr_min_pct': 0.027191072923430065, 'sideways_atr_max_pct': 0.07694597454567513, 'sideways_tp_mult': 1.6937427391645283, 'sideways_tsl_mult': 0.30996512899290096, 'sideways_time_stop': 183, 'sideways_use_sma': False, 'sideways_use_ema': False, 'sideways_use_atr': False, 'sideways_use_adx': False, 'sideways_use_spike': False, 'sideways_rsi_required': False}.
[I 2025-08-31 03:12:09,328] Trial 828 finished with values: [-1000000000.0, 1000000000.0] and parameters: {'p_sma': 37, 'p_std': 25, 'p_atr': 29, 'p_adx': 14, 'rsi_period': 30, 'ema1': 22, 'ema2': 47, 'slip_atr_k': 0.02339325587037934, 'slip_spread_k': 0.1700353465871074, 'spread_hl_frac': 0.004281023006321633, 'bb_std_mult': 2.052583229176607, 'rsi_os': 39, 'rsi_ob': 64, 'vol_spike': 0.1763769896454012, 'adx_thresh': 15.090090768517344, 'atr_min_pct': 0.008154086073318509, 'atr_max_pct': 0.12627692338521163, 'tp_mult': 2.1178961696841654, 'tsl_mult': 0.43563058540891086, 'strategy': 'mean_reversion', 'time_stop': 98, 'use_sma': False, 'use_atr': False, 'use_adx': False, 'use_ema': False, 'use_spike': False, 'rsi_required': False, 'edge_k': 1.3772232156342352, 'edge_cap': 0.14541702781654264, 'bull_strategy': 'mean_reversion', 'bull_bb_std_mult': 2.145888072755323, 'bull_rsi_os': 32, 'bull_rsi_ob': 66, 'bull_adx_thresh': 5.653232725700997, 'bull_atr_min_pct': 0.018928461536194468, 'bull_atr_max_pct': 0.1370296637726725, 'bull_tp_mult': 2.3683123975707323, 'bull_tsl_mult': 0.03945641350869655, 'bull_time_stop': 139, 'bull_use_sma': True, 'bull_use_ema': False, 'bull_use_atr': False, 'bull_use_adx': True, 'bull_use_spike': True, 'bull_rsi_required': True, 'bear_strategy': 'breakout', 'bear_bb_std_mult': 1.4475891933477276, 'bear_rsi_os': 31, 'bear_rsi_ob': 47, 'bear_adx_thresh': 23.208843972969603, 'bear_atr_min_pct': 0.007648742271513218, 'bear_atr_max_pct': 0.01567035281846444, 'bear_tp_mult': 1.1178138898867584, 'bear_tsl_mult': 0.552878800877795, 'bear_time_stop': 23, 'bear_use_sma': False, 'bear_use_ema': False, 'bear_use_atr': True, 'bear_use_adx': True, 'bear_use_spike': False, 'bear_rsi_required': True, 'sideways_strategy': 'breakout', 'sideways_bb_std_mult': 0.5470324886923446, 'sideways_rsi_os': 26, 'sideways_rsi_ob': 63, 'sideways_adx_thresh': 8.399448305703508, 'sideways_atr_min_pct': 0.014083958363349724, 'sideways_atr_max_pct': 0.05465371473355551, 'sideways_tp_mult': 1.7367725277422288, 'sideways_tsl_mult': 0.6248280435162477, 'sideways_time_stop': 243, 'sideways_use_sma': True, 'sideways_use_ema': False, 'sideways_use_atr': False, 'sideways_use_adx': False, 'sideways_use_spike': False, 'sideways_rsi_required': False}.
