[I 2025-08-31 02:59:56,089] Trial 740 finished with values: [-1000000000.0, 1000000000.0] and parameters: {'p_sma': 60, 'p_std': 51, 'p_atr': 29, 'p_adx': 19, 'rsi_period': 65, 'ema1': 11, 'ema2': 41, 'slip_atr_k': 0.10378898534707169, 'slip_spread_k': 0.11996154886236515, 'spread_hl_frac': 0.0021971203573143525, 'bb_std_mult': 1.6433351156471436, 'rsi_os': 36, 'rsi_ob': 63, 'vol_spike': 0.12389522167489488, 'adx_thresh': 30.39094677633198, 'atr_min_pct': 0.008515390697683234, 'atr_max_pct': 0.03810039032298366, 'tp_mult': 1.6474767744002472, 'tsl_mult': 0.18751546894615573, 'strategy': 'mean_reversion', 'time_stop': 95, 'use_sma': True, 'use_atr': False, 'use_adx': False, 'use_ema': False, 'use_spike': False, 'rsi_required': True, 'edge_k': 1.4688943022797485, 'edge_cap': 0.633018275828142, 'bull_strategy': 'breakout', 'bull_bb_std_mult': 2.370082004553333, 'bull_rsi_os': 30, 'bull_rsi_ob': 74, 'bull_adx_thresh': 6.33901677736859, 'bull_atr_min_pct': 0.008812654664306098, 'bull_atr_max_pct': 0.14999547588972406, 'bull_tp_mult': 2.159628559455786, 'bull_tsl_mult': 0.845321160363035, 'bull_time_stop': 114, 'bull_use_sma': True, 'bull_use_ema': False, 'bull_use_atr': False, 'bull_use_adx': True, 'bull_use_spike': True, 'bull_rsi_required': True, 'bear_strategy': 'mean_reversion', 'bear_bb_std_mult': 1.2028110399535457, 'bear_rsi_os': 17, 'bear_rsi_ob': 46, 'bear_adx_thresh': 26.76454594203336, 'bear_atr_min_pct': 0.006322542306520379, 'bear_atr_max_pct': 0.012461711663358334, 'bear_tp_mult': 2.100205033556509, 'bear_tsl_mult': 0.4536221592223605, 'bear_time_stop': 132, 'bear_use_sma': False, 'bear_use_ema': False, 'bear_use_atr': False, 'bear_use_adx': True, 'bear_use_spike': False, 'bear_rsi_required': True, 'sideways_strategy': 'breakout', 'sideways_bb_std_mult': 3.2549353353249453, 'sideways_rsi_os': 41, 'sideways_rsi_ob': 69, 'sideways_adx_thresh': 17.837739357004548, 'sideways_atr_min_pct': 0.015503096897739441, 'sideways_atr_max_pct': 0.029830074590680357, 'sideways_tp_mult': 2.4509733629464736, 'sideways_tsl_mult': 0.6257388681865675, 'sideways_time_stop': 80, 'sideways_use_sma': True, 'sideways_use_ema': False, 'sideways_use_atr': False, 'sideways_use_adx': False, 'sideways_use_spike': True, 'sideways_rsi_required': False}.
[I 2025-08-31 02:59:56,105] Trial 737 finished with values: [-1000000000.0, 1000000000.0] and parameters: {'p_sma': 25, 'p_std': 32, 'p_atr': 29, 'p_adx': 26, 'rsi_period': 31, 'ema1': 21, 'ema2': 34, 'slip_atr_k': 0.18552578216024795, 'slip_spread_k': 0.7371113410495977, 'spread_hl_frac': 0.00526118094872551, 'bb_std_mult': 1.7218514516716052, 'rsi_os': 36, 'rsi_ob': 82, 'vol_spike': 0.19089042149788227, 'adx_thresh': 21.501552905666994, 'atr_min_pct': 0.00933685000594546, 'atr_max_pct': 0.10629299244965965, 'tp_mult': 2.221901397741994, 'tsl_mult': 0.1865456367180399, 'strategy': 'mean_reversion', 'time_stop': 106, 'use_sma': True, 'use_atr': False, 'use_adx': False, 'use_ema': False, 'use_spike': True, 'rsi_required': True, 'edge_k': 0.4771711302177117, 'edge_cap': 0.6306391533870123, 'bull_strategy': 'breakout', 'bull_bb_std_mult': 2.591892599865164, 'bull_rsi_os': 43, 'bull_rsi_ob': 62, 'bull_adx_thresh': 6.25490049173537, 'bull_atr_min_pct': 0.00886248099983912, 'bull_atr_max_pct': 0.11794775615868507, 'bull_tp_mult': 2.157149178379829, 'bull_tsl_mult': 0.21507929176410498, 'bull_time_stop': 273, 'bull_use_sma': True, 'bull_use_ema': False, 'bull_use_atr': False, 'bull_use_adx': True, 'bull_use_spike': True, 'bull_rsi_required': True, 'bear_strategy': 'mean_reversion', 'bear_bb_std_mult': 1.3063290007365997, 'bear_rsi_os': 17, 'bear_rsi_ob': 46, 'bear_adx_thresh': 13.96049360411075, 'bear_atr_min_pct': 0.014581114923184488, 'bear_atr_max_pct': 0.010015252949582647, 'bear_tp_mult': 2.107456826639118, 'bear_tsl_mult': 0.7968824559587335, 'bear_time_stop': 61, 'bear_use_sma': False, 'bear_use_ema': True, 'bear_use_atr': False, 'bear_use_adx': True, 'bear_use_spike': False, 'bear_rsi_required': True, 'sideways_strategy': 'breakout', 'sideways_bb_std_mult': 0.615621220317724, 'sideways_rsi_os': 41, 'sideways_rsi_ob': 93, 'sideways_adx_thresh': 25.097120496178537, 'sideways_atr_min_pct': 0.026886178799917244, 'sideways_atr_max_pct': 0.05372257490171481, 'sideways_tp_mult': 2.505698039566993, 'sideways_tsl_mult': 0.6285566046594588, 'sideways_time_stop': 225, 'sideways_use_sma': True, 'sideways_use_ema': False, 'sideways_use_atr': False, 'sideways_use_adx': False, 'sideways_use_spike': True, 'sideways_rsi_required': False}.
[I 2025-08-31 02:59:56,106] Trial 738 finished with values: [-1000000000.0, 1000000000.0] and parameters: {'p_sma': 53, 'p_std': 8, 'p_atr': 7, 'p_adx': 19, 'rsi_period': 28, 'ema1': 18, 'ema2': 28, 'slip_atr_k': 0.1196694579713937, 'slip_spread_k': 0.7108749764397339, 'spread_hl_frac': 0.032175454815401225, 'bb_std_mult': 1.69799154113464, 'rsi_os': 38, 'rsi_ob': 70, 'vol_spike': 0.18387401085487867, 'adx_thresh': 9.767384319205412, 'atr_min_pct': 0.021121005720488233, 'atr_max_pct': 0.12310033223464707, 'tp_mult': 2.1894132865505904, 'tsl_mult': 0.8768210003743718, 'strategy': 'mean_reversion', 'time_stop': 29, 'use_sma': False, 'use_atr': False, 'use_adx': False, 'use_ema': False, 'use_spike': False, 'rsi_required': True, 'edge_k': 0.4818010874783518, 'edge_cap': 0.5872586853763887, 'bull_strategy': 'breakout', 'bull_bb_std_mult': 2.5825751961097723, 'bull_rsi_os': 23, 'bull_rsi_ob': 57, 'bull_adx_thresh': 6.285767077514867, 'bull_atr_min_pct': 0.011489263227747659, 'bull_atr_max_pct': 0.03465062632424318, 'bull_tp_mult': 1.7678004979175708, 'bull_tsl_mult': 0.9292413454012127, 'bull_time_stop': 133, 'bull_use_sma': True, 'bull_use_ema': False, 'bull_use_atr': False, 'bull_use_adx': True, 'bull_use_spike': True, 'bull_rsi_required': True, 'bear_strategy': 'mean_reversion', 'bear_bb_std_mult': 1.448668216300583, 'bear_rsi_os': 17, 'bear_rsi_ob': 46, 'bear_adx_thresh': 6.646315206623364, 'bear_atr_min_pct': 0.012766579302992213, 'bear_atr_max_pct': 0.12860492450977287, 'bear_tp_mult': 2.121655648917586, 'bear_tsl_mult': 0.08268437512376903, 'bear_time_stop': 62, 'bear_use_sma': False, 'bear_use_ema': False, 'bear_use_atr': False, 'bear_use_adx': True, 'bear_use_spike': False, 'bear_rsi_required': True, 'sideways_strategy': 'breakout', 'sideways_bb_std_mult': 3.2296092335909563, 'sideways_rsi_os': 52, 'sideways_rsi_ob': 93, 'sideways_adx_thresh': 9.582519696314506, 'sideways_atr_min_pct': 0.02538552157571493, 'sideways_atr_max_pct': 0.035323026369827655, 'sideways_tp_mult': 1.8805693613015626, 'sideways_tsl_mult': 0.3264632871119333, 'sideways_time_stop': 70, 'sideways_use_sma': True, 'sideways_use_ema': False, 'sideways_use_atr': False, 'sideways_use_adx': False, 'sideways_use_spike': True, 'sideways_rsi_required': False}.
[I 2025-08-31 03:00:33,157] Trial 742 finished with values: [-1000000000.0, 1000000000.0] and parameters: {'p_sma': 42, 'p_std': 52, 'p_atr': 10, 'p_adx': 14, 'rsi_period': 79, 'ema1': 15, 'ema2': 23, 'slip_atr_k': 0.22333636260592088, 'slip_spread_k': 0.09024121479227126, 'spread_hl_frac': 0.0008188217743064861, 'bb_std_mult': 1.6278643337934924, 'rsi_os': 40, 'rsi_ob': 68, 'vol_spike': 0.07162754888619698, 'adx_thresh': 20.0241384596239, 'atr_min_pct': 0.01580983371113205, 'atr_max_pct': 0.12611359734869365, 'tp_mult': 1.694061521773494, 'tsl_mult': 0.6411576370777919, 'strategy': 'mean_reversion', 'time_stop': 278, 'use_sma': True, 'use_atr': False, 'use_adx': False, 'use_ema': False, 'use_spike': False, 'rsi_required': True, 'edge_k': 1.2684980589757535, 'edge_cap': 0.15320120018442202, 'bull_strategy': 'breakout', 'bull_bb_std_mult': 1.9106025385498753, 'bull_rsi_os': 27, 'bull_rsi_ob': 65, 'bull_adx_thresh': 7.060565053257612, 'bull_atr_min_pct': 0.016015614230062186, 'bull_atr_max_pct': 0.1371213869246725, 'bull_tp_mult': 2.3969685179143996, 'bull_tsl_mult': 0.25794959476166085, 'bull_time_stop': 150, 'bull_use_sma': True, 'bull_use_ema': True, 'bull_use_atr': False, 'bull_use_adx': False, 'bull_use_spike': True, 'bull_rsi_required': True, 'bear_strategy': 'mean_reversion', 'bear_bb_std_mult': 3.0728659208692006, 'bear_rsi_os': 28, 'bear_rsi_ob': 47, 'bear_adx_thresh': 5.0047595201794906, 'bear_atr_min_pct': 0.004735109739528594, 'bear_atr_max_pct': 0.016149282998325864, 'bear_tp_mult': 2.023763262782242, 'bear_tsl_mult': 0.499833148248861, 'bear_time_stop': 154, 'bear_use_sma': False, 'bear_use_ema': False, 'bear_use_atr': False, 'bear_use_adx': False, 'bear_use_spike': False, 'bear_rsi_required': True, 'sideways_strategy': 'breakout', 'sideways_bb_std_mult': 0.7543979355979824, 'sideways_rsi_os': 38, 'sideways_rsi_ob': 94, 'sideways_adx_thresh': 7.446354552755267, 'sideways_atr_min_pct': 0.028693233518376934, 'sideways_atr_max_pct': 0.10748796868000962, 'sideways_tp_mult': 1.6045995996113018, 'sideways_tsl_mult': 0.8639520559731517, 'sideways_time_stop': 215, 'sideways_use_sma': True, 'sideways_use_ema': False, 'sideways_use_atr': False, 'sideways_use_adx': True, 'sideways_use_spike': True, 'sideways_rsi_required': True}.
[I 2025-08-31 03:00:33,323] Trial 741 finished with values: [-0.036149204062224216, 0.03603423011462483] and parameters: {'p_sma': 41, 'p_std': 34, 'p_atr': 19, 'p_adx': 13, 'rsi_period': 28, 'ema1': 11, 'ema2': 15, 'slip_atr_k': 0.10287151846761633, 'slip_spread_k': 0.08645069315166508, 'spread_hl_frac': 0.0016593669291275542, 'bb_std_mult': 1.6063104475104706, 'rsi_os': 13, 'rsi_ob': 63, 'vol_spike': 0.12531183447713315, 'adx_thresh': 19.984321661539127, 'atr_min_pct': 0.01426871205250942, 'atr_max_pct': 0.12251993301320795, 'tp_mult': 2.1834855905559114, 'tsl_mult': 0.76930151234994, 'strategy': 'mean_reversion', 'time_stop': 109, 'use_sma': True, 'use_atr': False, 'use_adx': False, 'use_ema': False, 'use_spike': False, 'rsi_required': True, 'edge_k': 1.9918773342074882, 'edge_cap': 0.6179129508956884, 'bull_strategy': 'breakout', 'bull_bb_std_mult': 2.3445072254950676, 'bull_rsi_os': 23, 'bull_rsi_ob': 49, 'bull_adx_thresh': 32.022440591351824, 'bull_atr_min_pct': 0.016187688999709588, 'bull_atr_max_pct': 0.13656971407721702, 'bull_tp_mult': 2.3852668787715157, 'bull_tsl_mult': 0.2541288871718241, 'bull_time_stop': 133, 'bull_use_sma': True, 'bull_use_ema': False, 'bull_use_atr': False, 'bull_use_adx': True, 'bull_use_spike': True, 'bull_rsi_required': True, 'bear_strategy': 'mean_reversion', 'bear_bb_std_mult': 1.17950554015849, 'bear_rsi_os': 18, 'bear_rsi_ob': 46, 'bear_adx_thresh': 16.186096266982368, 'bear_atr_min_pct': 0.004607770351919175, 'bear_atr_max_pct': 0.015499949259090394, 'bear_tp_mult': 2.0977332236448967, 'bear_tsl_mult': 0.46225207501868587, 'bear_time_stop': 291, 'bear_use_sma': False, 'bear_use_ema': False, 'bear_use_atr': False, 'bear_use_adx': True, 'bear_use_spike': False, 'bear_rsi_required': True, 'sideways_strategy': 'breakout', 'sideways_bb_std_mult': 0.709680377110214, 'sideways_rsi_os': 40, 'sideways_rsi_ob': 77, 'sideways_adx_thresh': 17.34273674210926, 'sideways_atr_min_pct': 0.0021012867627705593, 'sideways_atr_max_pct': 0.06004731364055815, 'sideways_tp_mult': 1.688841997620317, 'sideways_tsl_mult': 0.3314095488031352, 'sideways_time_stop': 211, 'sideways_use_sma': True, 'sideways_use_ema': False, 'sideways_use_atr': False, 'sideways_use_adx': False, 'sideways_use_spike': True, 'sideways_rsi_required': False}.
[I 2025-08-31 03:00:33,547] Trial 743 finished with values: [-1000000000.0, 1000000000.0] and parameters: {'p_sma': 52, 'p_std': 59, 'p_atr': 19, 'p_adx': 30, 'rsi_period': 72, 'ema1': 15, 'ema2': 16, 'slip_atr_k': 0.10078038474270411, 'slip_spread_k': 0.06017294117361632, 'spread_hl_frac': 0.000979975354017285, 'bb_std_mult': 1.3945326917135814, 'rsi_os': 11, 'rsi_ob': 68, 'vol_spike': 0.23162175222380044, 'adx_thresh': 25.734093312801846, 'atr_min_pct': 0.014696564303815041, 'atr_max_pct': 0.12648937115658326, 'tp_mult': 1.5839725328304528, 'tsl_mult': 0.2613551812402196, 'strategy': 'mean_reversion', 'time_stop': 280, 'use_sma': True, 'use_atr': False, 'use_adx': False, 'use_ema': False, 'use_spike': False, 'rsi_required': True, 'edge_k': 1.1067808937802177, 'edge_cap': 0.14903013707237375, 'bull_strategy': 'breakout', 'bull_bb_std_mult': 1.8602706435837173, 'bull_rsi_os': 47, 'bull_rsi_ob': 85, 'bull_adx_thresh': 31.956330878237292, 'bull_atr_min_pct': 0.017499713697033313, 'bull_atr_max_pct': 0.137259033393371, 'bull_tp_mult': 2.387020933508949, 'bull_tsl_mult': 0.28146596633101617, 'bull_time_stop': 150, 'bull_use_sma': True, 'bull_use_ema': True, 'bull_use_atr': False, 'bull_use_adx': False, 'bull_use_spike': True, 'bull_rsi_required': True, 'bear_strategy': 'mean_reversion', 'bear_bb_std_mult': 2.145886468210405, 'bear_rsi_os': 28, 'bear_rsi_ob': 48, 'bear_adx_thresh': 16.12308012356263, 'bear_atr_min_pct': 0.004530249920136661, 'bear_atr_max_pct': 0.09182438959786096, 'bear_tp_mult': 2.027327656187016, 'bear_tsl_mult': 0.5039701561899902, 'bear_time_stop': 11, 'bear_use_sma': False, 'bear_use_ema': False, 'bear_use_atr': False, 'bear_use_adx': False, 'bear_use_spike': False, 'bear_rsi_required': True, 'sideways_strategy': 'breakout', 'sideways_bb_std_mult': 0.7428283626327088, 'sideways_rsi_os': 38, 'sideways_rsi_ob': 94, 'sideways_adx_thresh': 6.921997668052448, 'sideways_atr_min_pct': 0.009111245927369165, 'sideways_atr_max_pct': 0.11193491848779535, 'sideways_tp_mult': 1.61075287358821, 'sideways_tsl_mult': 0.6983540370689971, 'sideways_time_stop': 212, 'sideways_use_sma': True, 'sideways_use_ema': False, 'sideways_use_atr': False, 'sideways_use_adx': True, 'sideways_use_spike': True, 'sideways_rsi_required': True}.
[I 2025-08-31 03:00:33,926] Trial 744 finished with values: [-1000000000.0, 1000000000.0] and parameters: {'p_sma': 52, 'p_std': 52, 'p_atr': 11, 'p_adx': 30, 'rsi_period': 72, 'ema1': 5, 'ema2': 16, 'slip_atr_k': 0.08828778705863063, 'slip_spread_k': 0.08263742064670845, 'spread_hl_frac': 0.0011872747808864275, 'bb_std_mult': 1.0074906398861279, 'rsi_os': 40, 'rsi_ob': 68, 'vol_spike': 0.2319250483912516, 'adx_thresh': 20.12043188577548, 'atr_min_pct': 0.026192663522649234, 'atr_max_pct': 0.11325752822487306, 'tp_mult': 1.2264465444066288, 'tsl_mult': 0.9227946675030054, 'strategy': 'mean_reversion', 'time_stop': 260, 'use_sma': True, 'use_atr': False, 'use_adx': False, 'use_ema': False, 'use_spike': False, 'rsi_required': True, 'edge_k': 0.5682449728098714, 'edge_cap': 0.474725475252412, 'bull_strategy': 'breakout', 'bull_bb_std_mult': 3.194075658131757, 'bull_rsi_os': 7, 'bull_rsi_ob': 77, 'bull_adx_thresh': 30.869445609057802, 'bull_atr_min_pct': 0.02251440942997402, 'bull_atr_max_pct': 0.1369822897713796, 'bull_tp_mult': 2.345046972882504, 'bull_tsl_mult': 0.5348648232837628, 'bull_time_stop': 98, 'bull_use_sma': True, 'bull_use_ema': True, 'bull_use_atr': False, 'bull_use_adx': False, 'bull_use_spike': True, 'bull_rsi_required': True, 'bear_strategy': 'mean_reversion', 'bear_bb_std_mult': 2.2162592270071744, 'bear_rsi_os': 28, 'bear_rsi_ob': 48, 'bear_adx_thresh': 24.998890625025346, 'bear_atr_min_pct': 0.0045420424461207285, 'bear_atr_max_pct': 0.08269380647192988, 'bear_tp_mult': 2.024647309675973, 'bear_tsl_mult': 0.3524928695156009, 'bear_time_stop': 153, 'bear_use_sma': False, 'bear_use_ema': False, 'bear_use_atr': False, 'bear_use_adx': False, 'bear_use_spike': False, 'bear_rsi_required': True, 'sideways_strategy': 'breakout', 'sideways_bb_std_mult': 0.7170342912702892, 'sideways_rsi_os': 38, 'sideways_rsi_ob': 47, 'sideways_adx_thresh': 7.649336743899479, 'sideways_atr_min_pct': 0.0019259721071506926, 'sideways_atr_max_pct': 0.016271962605484844, 'sideways_tp_mult': 1.6127248620998895, 'sideways_tsl_mult': 0.6978752910887417, 'sideways_time_stop': 216, 'sideways_use_sma': True, 'sideways_use_ema': False, 'sideways_use_atr': False, 'sideways_use_adx': True, 'sideways_use_spike': True, 'sideways_rsi_required': True}.
[I 2025-08-31 03:01:10,414] Trial 745 finished with values: [-1000000000.0, 1000000000.0] and parameters: {'p_sma': 13, 'p_std': 48, 'p_atr': 19, 'p_adx': 22, 'rsi_period': 73, 'ema1': 5, 'ema2': 16, 'slip_atr_k': 0.08918537040466556, 'slip_spread_k': 0.20770363538737047, 'spread_hl_frac': 0.0015207918992816557, 'bb_std_mult': 3.180420220711814, 'rsi_os': 7, 'rsi_ob': 70, 'vol_spike': 0.17924782065877856, 'adx_thresh': 21.01068732435914, 'atr_min_pct': 0.006850445637413754, 'atr_max_pct': 0.09912258843629157, 'tp_mult': 2.0129563842152924, 'tsl_mult': 0.2628181445011225, 'strategy': 'mean_reversion', 'time_stop': 110, 'use_sma': True, 'use_atr': False, 'use_adx': False, 'use_ema': False, 'use_spike': False, 'rsi_required': True, 'edge_k': 0.5747628794318757, 'edge_cap': 0.21167743430844232, 'bull_strategy': 'breakout', 'bull_bb_std_mult': 2.424425259193678, 'bull_rsi_os': 31, 'bull_rsi_ob': 81, 'bull_adx_thresh': 32.247961069455144, 'bull_atr_min_pct': 0.026278264973098608, 'bull_atr_max_pct': 0.1423788011399007, 'bull_tp_mult': 2.354200082982777, 'bull_tsl_mult': 0.2807671219545736, 'bull_time_stop': 140, 'bull_use_sma': True, 'bull_use_ema': False, 'bull_use_atr': False, 'bull_use_adx': True, 'bull_use_spike': True, 'bull_rsi_required': True, 'bear_strategy': 'mean_reversion', 'bear_bb_std_mult': 3.4734728432915425, 'bear_rsi_os': 18, 'bear_rsi_ob': 84, 'bear_adx_thresh': 5.983949191128207, 'bear_atr_min_pct': 0.019195322885616494, 'bear_atr_max_pct': 0.09254008559386802, 'bear_tp_mult': 2.03568550747341, 'bear_tsl_mult': 0.5134972677804649, 'bear_time_stop': 233, 'bear_use_sma': False, 'bear_use_ema': False, 'bear_use_atr': False, 'bear_use_adx': True, 'bear_use_spike': False, 'bear_rsi_required': True, 'sideways_strategy': 'breakout', 'sideways_bb_std_mult': 0.6995563409168437, 'sideways_rsi_os': 40, 'sideways_rsi_ob': 47, 'sideways_adx_thresh': 6.915894013489698, 'sideways_atr_min_pct': 0.02767115239152486, 'sideways_atr_max_pct': 0.1289072975390282, 'sideways_tp_mult': 1.6906319415945767, 'sideways_tsl_mult': 0.07148911478953174, 'sideways_time_stop': 204, 'sideways_use_sma': True, 'sideways_use_ema': False, 'sideways_use_atr': False, 'sideways_use_adx': False, 'sideways_use_spike': True, 'sideways_rsi_required': False}.
[I 2025-08-31 03:01:10,815] Trial 747 finished with values: [-1000000000.0, 1000000000.0] and parameters: {'p_sma': 13, 'p_std': 48, 'p_atr': 26, 'p_adx': 22, 'rsi_period': 23, 'ema1': 13, 'ema2': 39, 'slip_atr_k': 0.056857084144901426, 'slip_spread_k': 0.14674285118227076, 'spread_hl_frac': 0.0020340443845871287, 'bb_std_mult': 1.8006181975789581, 'rsi_os': 22, 'rsi_ob': 70, 'vol_spike': 0.18037826905221596, 'adx_thresh': 33.57067612253872, 'atr_min_pct': 0.0020171696777060676, 'atr_max_pct': 0.08614620228962051, 'tp_mult': 1.2261713715945342, 'tsl_mult': 0.9265577534344371, 'strategy': 'mean_reversion', 'time_stop': 116, 'use_sma': False, 'use_atr': False, 'use_adx': False, 'use_ema': False, 'use_spike': False, 'rsi_required': True, 'edge_k': 0.1232346044595346, 'edge_cap': 0.11467196751946629, 'bull_strategy': 'breakout', 'bull_bb_std_mult': 2.2296078807729223, 'bull_rsi_os': 11, 'bull_rsi_ob': 77, 'bull_adx_thresh': 5.70682647820813, 'bull_atr_min_pct': 0.023945773265868685, 'bull_atr_max_pct': 0.14100033945069854, 'bull_tp_mult': 2.0154347726145074, 'bull_tsl_mult': 0.972555674079791, 'bull_time_stop': 99, 'bull_use_sma': True, 'bull_use_ema': False, 'bull_use_atr': False, 'bull_use_adx': True, 'bull_use_spike': True, 'bull_rsi_required': True, 'bear_strategy': 'mean_reversion', 'bear_bb_std_mult': 1.3774590783702658, 'bear_rsi_os': 40, 'bear_rsi_ob': 53, 'bear_adx_thresh': 6.0709335935360444, 'bear_atr_min_pct': 0.006063615435665719, 'bear_atr_max_pct': 0.012570203078254084, 'bear_tp_mult': 1.9784835697244465, 'bear_tsl_mult': 0.5219317744992733, 'bear_time_stop': 179, 'bear_use_sma': False, 'bear_use_ema': False, 'bear_use_atr': False, 'bear_use_adx': True, 'bear_use_spike': False, 'bear_rsi_required': True, 'sideways_strategy': 'breakout', 'sideways_bb_std_mult': 0.5459550125101752, 'sideways_rsi_os': 35, 'sideways_rsi_ob': 95, 'sideways_adx_thresh': 29.057736933181133, 'sideways_atr_min_pct': 0.027657080306572355, 'sideways_atr_max_pct': 0.0163202031207164, 'sideways_tp_mult': 1.8209166787746935, 'sideways_tsl_mult': 0.495940545853031, 'sideways_time_stop': 203, 'sideways_use_sma': True, 'sideways_use_ema': False, 'sideways_use_atr': False, 'sideways_use_adx': False, 'sideways_use_spike': True, 'sideways_rsi_required': False}.
