[I 2025-08-31 02:40:12,674] Trial 604 finished with values: [-1000000000.0, 1000000000.0] and parameters: {'p_sma': 54, 'p_std': 50, 'p_atr': 27, 'p_adx': 24, 'rsi_period': 78, 'ema1': 16, 'ema2': 25, 'slip_atr_k': 0.22537843429876758, 'slip_spread_k': 0.16708438090185945, 'spread_hl_frac': 0.043816755725163595, 'bb_std_mult': 1.6187628411018429, 'rsi_os': 37, 'rsi_ob': 70, 'vol_spike': 0.17239105589679019, 'adx_thresh': 30.61661988452866, 'atr_min_pct': 0.008473949917874006, 'atr_max_pct': 0.12160567024622977, 'tp_mult': 2.2846860160990996, 'tsl_mult': 0.4243292895815771, 'strategy': 'mean_reversion', 'time_stop': 244, 'use_sma': True, 'use_atr': False, 'use_adx': False, 'use_ema': False, 'use_spike': True, 'rsi_required': True, 'edge_k': 0.593722145682273, 'edge_cap': 0.17322553612857527, 'bull_strategy': 'mean_reversion', 'bull_bb_std_mult': 2.350092203186181, 'bull_rsi_os': 15, 'bull_rsi_ob': 66, 'bull_adx_thresh': 30.38075919629099, 'bull_atr_min_pct': 0.012515409761882153, 'bull_atr_max_pct': 0.11230276760939761, 'bull_tp_mult': 2.080202093406886, 'bull_tsl_mult': 0.3078736581995694, 'bull_time_stop': 121, 'bull_use_sma': True, 'bull_use_ema': False, 'bull_use_atr': False, 'bull_use_adx': True, 'bull_use_spike': True, 'bull_rsi_required': True, 'bear_strategy': 'mean_reversion', 'bear_bb_std_mult': 2.2057950141703184, 'bear_rsi_os': 47, 'bear_rsi_ob': 45, 'bear_adx_thresh': 26.37864090583831, 'bear_atr_min_pct': 0.026699603255488303, 'bear_atr_max_pct': 0.05383346611064192, 'bear_tp_mult': 2.1413007809948192, 'bear_tsl_mult': 0.4792584929982796, 'bear_time_stop': 166, 'bear_use_sma': False, 'bear_use_ema': True, 'bear_use_atr': False, 'bear_use_adx': True, 'bear_use_spike': False, 'bear_rsi_required': True, 'sideways_strategy': 'breakout', 'sideways_bb_std_mult': 0.7325037456910515, 'sideways_rsi_os': 40, 'sideways_rsi_ob': 63, 'sideways_adx_thresh': 6.934466769974877, 'sideways_atr_min_pct': 0.02810585858422347, 'sideways_atr_max_pct': 0.05270005835565448, 'sideways_tp_mult': 1.7232354145586992, 'sideways_tsl_mult': 0.6684166201771585, 'sideways_time_stop': 199, 'sideways_use_sma': True, 'sideways_use_ema': False, 'sideways_use_atr': False, 'sideways_use_adx': False, 'sideways_use_spike': True, 'sideways_rsi_required': False}.
[I 2025-08-31 02:40:12,764] Trial 603 finished with values: [-1000000000.0, 1000000000.0] and parameters: {'p_sma': 54, 'p_std': 50, 'p_atr': 11, 'p_adx': 28, 'rsi_period': 21, 'ema1': 6, 'ema2': 28, 'slip_atr_k': 0.09718052539719481, 'slip_spread_k': 0.1723629030650452, 'spread_hl_frac': 0.04060371327542949, 'bb_std_mult': 1.607640567273939, 'rsi_os': 37, 'rsi_ob': 61, 'vol_spike': 0.292738931321821, 'adx_thresh': 25.551721392709172, 'atr_min_pct': 0.008530712862662179, 'atr_max_pct': 0.12159807015981378, 'tp_mult': 1.4939617829584835, 'tsl_mult': 0.49033642167522834, 'strategy': 'mean_reversion', 'time_stop': 152, 'use_sma': True, 'use_atr': False, 'use_adx': False, 'use_ema': False, 'use_spike': True, 'rsi_required': True, 'edge_k': 0.6014814814520866, 'edge_cap': 0.1812507674815762, 'bull_strategy': 'mean_reversion', 'bull_bb_std_mult': 2.3518301910530446, 'bull_rsi_os': 30, 'bull_rsi_ob': 54, 'bull_adx_thresh': 30.33622901312122, 'bull_atr_min_pct': 0.010811525383756786, 'bull_atr_max_pct': 0.14693251465828197, 'bull_tp_mult': 2.3031340626411607, 'bull_tsl_mult': 0.31221806036908134, 'bull_time_stop': 119, 'bull_use_sma': True, 'bull_use_ema': False, 'bull_use_atr': False, 'bull_use_adx': True, 'bull_use_spike': True, 'bull_rsi_required': True, 'bear_strategy': 'mean_reversion', 'bear_bb_std_mult': 3.0186653753500803, 'bear_rsi_os': 17, 'bear_rsi_ob': 45, 'bear_adx_thresh': 31.363407589459015, 'bear_atr_min_pct': 0.026479693814446342, 'bear_atr_max_pct': 0.014633019342252848, 'bear_tp_mult': 2.5573548005008178, 'bear_tsl_mult': 0.4773824885659481, 'bear_time_stop': 262, 'bear_use_sma': False, 'bear_use_ema': True, 'bear_use_atr': False, 'bear_use_adx': True, 'bear_use_spike': False, 'bear_rsi_required': True, 'sideways_strategy': 'breakout', 'sideways_bb_std_mult': 0.7282908146955396, 'sideways_rsi_os': 41, 'sideways_rsi_ob': 45, 'sideways_adx_thresh': 29.868144963164696, 'sideways_atr_min_pct': 0.029441585159216063, 'sideways_atr_max_pct': 0.05321937378559397, 'sideways_tp_mult': 1.3249207337350926, 'sideways_tsl_mult': 0.6624593449178926, 'sideways_time_stop': 220, 'sideways_use_sma': True, 'sideways_use_ema': False, 'sideways_use_atr': False, 'sideways_use_adx': False, 'sideways_use_spike': True, 'sideways_rsi_required': False}.
[I 2025-08-31 02:40:45,286] Trial 608 finished with values: [-1000000000.0, 1000000000.0] and parameters: {'p_sma': 52, 'p_std': 51, 'p_atr': 28, 'p_adx': 14, 'rsi_period': 72, 'ema1': 5, 'ema2': 12, 'slip_atr_k': 0.14578701688454934, 'slip_spread_k': 0.12796588066922163, 'spread_hl_frac': 0.0006811896336306894, 'bb_std_mult': 1.7529060258334044, 'rsi_os': 36, 'rsi_ob': 84, 'vol_spike': 0.1868192715415954, 'adx_thresh': 21.551523470575194, 'atr_min_pct': 0.01787604804342227, 'atr_max_pct': 0.11189887438226581, 'tp_mult': 2.3845733265184546, 'tsl_mult': 0.45953042606241157, 'strategy': 'mean_reversion', 'time_stop': 286, 'use_sma': False, 'use_atr': True, 'use_adx': True, 'use_ema': False, 'use_spike': False, 'rsi_required': True, 'edge_k': 0.5450361588168465, 'edge_cap': 0.49575292276536104, 'bull_strategy': 'breakout', 'bull_bb_std_mult': 2.0247324795064667, 'bull_rsi_os': 19, 'bull_rsi_ob': 60, 'bull_adx_thresh': 6.379247996769912, 'bull_atr_min_pct': 0.0245477747424859, 'bull_atr_max_pct': 0.13535654106317616, 'bull_tp_mult': 1.3316466720975852, 'bull_tsl_mult': 0.2626097535198753, 'bull_time_stop': 145, 'bull_use_sma': True, 'bull_use_ema': True, 'bull_use_atr': False, 'bull_use_adx': False, 'bull_use_spike': True, 'bull_rsi_required': True, 'bear_strategy': 'breakout', 'bear_bb_std_mult': 1.3955756676814939, 'bear_rsi_os': 5, 'bear_rsi_ob': 48, 'bear_adx_thresh': 5.738553746084796, 'bear_atr_min_pct': 0.015706710514357736, 'bear_atr_max_pct': 0.07714897355606155, 'bear_tp_mult': 1.1479162988729144, 'bear_tsl_mult': 0.5299446469590441, 'bear_time_stop': 19, 'bear_use_sma': False, 'bear_use_ema': False, 'bear_use_atr': True, 'bear_use_adx': False, 'bear_use_spike': False, 'bear_rsi_required': True, 'sideways_strategy': 'breakout', 'sideways_bb_std_mult': 0.6354256574332587, 'sideways_rsi_os': 21, 'sideways_rsi_ob': 93, 'sideways_adx_thresh': 21.65461469618105, 'sideways_atr_min_pct': 0.0016912482535137614, 'sideways_atr_max_pct': 0.07073609152010389, 'sideways_tp_mult': 1.7763949863944222, 'sideways_tsl_mult': 0.6121794422204111, 'sideways_time_stop': 204, 'sideways_use_sma': False, 'sideways_use_ema': False, 'sideways_use_atr': True, 'sideways_use_adx': True, 'sideways_use_spike': False, 'sideways_rsi_required': True}.
[I 2025-08-31 02:40:45,463] Trial 607 finished with values: [-1000000000.0, 1000000000.0] and parameters: {'p_sma': 52, 'p_std': 51, 'p_atr': 28, 'p_adx': 11, 'rsi_period': 72, 'ema1': 5, 'ema2': 10, 'slip_atr_k': 0.20026274566265456, 'slip_spread_k': 0.12752216346216555, 'spread_hl_frac': 0.0007646582684899051, 'bb_std_mult': 1.7625136426429018, 'rsi_os': 21, 'rsi_ob': 69, 'vol_spike': 0.04976458664714735, 'adx_thresh': 21.5443619304037, 'atr_min_pct': 0.009684932805130017, 'atr_max_pct': 0.11215601080347479, 'tp_mult': 1.408546228279922, 'tsl_mult': 0.46672808799834503, 'strategy': 'mean_reversion', 'time_stop': 231, 'use_sma': False, 'use_atr': True, 'use_adx': True, 'use_ema': False, 'use_spike': False, 'rsi_required': True, 'edge_k': 0.5536615178075461, 'edge_cap': 0.14128556036860926, 'bull_strategy': 'breakout', 'bull_bb_std_mult': 2.031567743631493, 'bull_rsi_os': 19, 'bull_rsi_ob': 47, 'bull_adx_thresh': 6.271785978185597, 'bull_atr_min_pct': 0.024273346924014845, 'bull_atr_max_pct': 0.13604358163286157, 'bull_tp_mult': 2.2059729488669473, 'bull_tsl_mult': 0.26980894548491535, 'bull_time_stop': 269, 'bull_use_sma': True, 'bull_use_ema': True, 'bull_use_atr': False, 'bull_use_adx': False, 'bull_use_spike': True, 'bull_rsi_required': True, 'bear_strategy': 'breakout', 'bear_bb_std_mult': 1.3975803950178096, 'bear_rsi_os': 45, 'bear_rsi_ob': 48, 'bear_adx_thresh': 5.016756118335995, 'bear_atr_min_pct': 0.00724191170075865, 'bear_atr_max_pct': 0.017584092348288533, 'bear_tp_mult': 1.4710360803403595, 'bear_tsl_mult': 0.530680966417728, 'bear_time_stop': 19, 'bear_use_sma': False, 'bear_use_ema': False, 'bear_use_atr': True, 'bear_use_adx': False, 'bear_use_spike': False, 'bear_rsi_required': True, 'sideways_strategy': 'breakout', 'sideways_bb_std_mult': 0.6729185721194855, 'sideways_rsi_os': 5, 'sideways_rsi_ob': 94, 'sideways_adx_thresh': 8.768355524624097, 'sideways_atr_min_pct': 0.0016024680690968091, 'sideways_atr_max_pct': 0.0811069794148334, 'sideways_tp_mult': 1.7684622873990428, 'sideways_tsl_mult': 0.627355792539738, 'sideways_time_stop': 204, 'sideways_use_sma': False, 'sideways_use_ema': False, 'sideways_use_atr': True, 'sideways_use_adx': True, 'sideways_use_spike': False, 'sideways_rsi_required': True}.
[I 2025-08-31 02:40:45,997] Trial 606 finished with values: [-1000000000.0, 1000000000.0] and parameters: {'p_sma': 20, 'p_std': 50, 'p_atr': 27, 'p_adx': 20, 'rsi_period': 72, 'ema1': 29, 'ema2': 12, 'slip_atr_k': 0.20070947793744776, 'slip_spread_k': 0.15232460948989338, 'spread_hl_frac': 0.0009289891543577504, 'bb_std_mult': 1.779620124798349, 'rsi_os': 36, 'rsi_ob': 70, 'vol_spike': 0.04096190657361286, 'adx_thresh': 5.014903914977072, 'atr_min_pct': 0.008500153067161358, 'atr_max_pct': 0.029513208681674202, 'tp_mult': 1.3902215551077075, 'tsl_mult': 0.43323443762455743, 'strategy': 'mean_reversion', 'time_stop': 289, 'use_sma': True, 'use_atr': True, 'use_adx': True, 'use_ema': False, 'use_spike': True, 'rsi_required': True, 'edge_k': 0.2576570760211394, 'edge_cap': 0.5222039272066513, 'bull_strategy': 'breakout', 'bull_bb_std_mult': 1.9773081140366313, 'bull_rsi_os': 53, 'bull_rsi_ob': 93, 'bull_adx_thresh': 6.288168907171945, 'bull_atr_min_pct': 0.02421308613177004, 'bull_atr_max_pct': 0.11055787814046843, 'bull_tp_mult': 1.3421971696621364, 'bull_tsl_mult': 0.5886999805408191, 'bull_time_stop': 266, 'bull_use_sma': True, 'bull_use_ema': False, 'bull_use_atr': False, 'bull_use_adx': False, 'bull_use_spike': True, 'bull_rsi_required': True, 'bear_strategy': 'mean_reversion', 'bear_bb_std_mult': 2.5378626642374313, 'bear_rsi_os': 39, 'bear_rsi_ob': 48, 'bear_adx_thresh': 14.078799796708932, 'bear_atr_min_pct': 0.015484004597912571, 'bear_atr_max_pct': 0.01438846118148157, 'bear_tp_mult': 2.337437753888916, 'bear_tsl_mult': 0.5673357151990436, 'bear_time_stop': 19, 'bear_use_sma': False, 'bear_use_ema': True, 'bear_use_atr': False, 'bear_use_adx': False, 'bear_use_spike': False, 'bear_rsi_required': True, 'sideways_strategy': 'breakout', 'sideways_bb_std_mult': 0.7257781120485021, 'sideways_rsi_os': 40, 'sideways_rsi_ob': 52, 'sideways_adx_thresh': 21.736379506056945, 'sideways_atr_min_pct': 0.028635332501322854, 'sideways_atr_max_pct': 0.018823728530541248, 'sideways_tp_mult': 1.7380076595405727, 'sideways_tsl_mult': 0.9775208988578218, 'sideways_time_stop': 203, 'sideways_use_sma': False, 'sideways_use_ema': False, 'sideways_use_atr': False, 'sideways_use_adx': True, 'sideways_use_spike': True, 'sideways_rsi_required': False}.
[I 2025-08-31 02:40:46,115] Trial 605 finished with values: [-1000000000.0, 1000000000.0] and parameters: {'p_sma': 53, 'p_std': 50, 'p_atr': 27, 'p_adx': 28, 'rsi_period': 67, 'ema1': 5, 'ema2': 28, 'slip_atr_k': 0.21881297361045668, 'slip_spread_k': 0.9242336290590214, 'spread_hl_frac': 0.04079669755378905, 'bb_std_mult': 1.7666366750384215, 'rsi_os': 36, 'rsi_ob': 82, 'vol_spike': 0.17156254102042612, 'adx_thresh': 19.567682816839326, 'atr_min_pct': 0.00846195228658995, 'atr_max_pct': 0.14442907713932357, 'tp_mult': 1.4951191003715532, 'tsl_mult': 0.4668096680858303, 'strategy': 'mean_reversion', 'time_stop': 245, 'use_sma': True, 'use_atr': False, 'use_adx': True, 'use_ema': False, 'use_spike': True, 'rsi_required': True, 'edge_k': 0.5477014887384746, 'edge_cap': 0.17841955426750736, 'bull_strategy': 'mean_reversion', 'bull_bb_std_mult': 1.9970134133417212, 'bull_rsi_os': 34, 'bull_rsi_ob': 48, 'bull_adx_thresh': 26.20215850799055, 'bull_atr_min_pct': 0.022920396533649287, 'bull_atr_max_pct': 0.14605279346499758, 'bull_tp_mult': 1.6599131679143035, 'bull_tsl_mult': 0.31782612890323775, 'bull_time_stop': 121, 'bull_use_sma': True, 'bull_use_ema': False, 'bull_use_atr': False, 'bull_use_adx': True, 'bull_use_spike': True, 'bull_rsi_required': True, 'bear_strategy': 'mean_reversion', 'bear_bb_std_mult': 2.427314528849226, 'bear_rsi_os': 17, 'bear_rsi_ob': 47, 'bear_adx_thresh': 5.675732322346185, 'bear_atr_min_pct': 0.020440185507250252, 'bear_atr_max_pct': 0.07693044420099918, 'bear_tp_mult': 1.449596082947144, 'bear_tsl_mult': 0.4532940922770106, 'bear_time_stop': 109, 'bear_use_sma': False, 'bear_use_ema': True, 'bear_use_atr': False, 'bear_use_adx': False, 'bear_use_spike': False, 'bear_rsi_required': True, 'sideways_strategy': 'breakout', 'sideways_bb_std_mult': 0.6658382782432322, 'sideways_rsi_os': 41, 'sideways_rsi_ob': 52, 'sideways_adx_thresh': 20.595352033794075, 'sideways_atr_min_pct': 0.029478394434679003, 'sideways_atr_max_pct': 0.0533736788828872, 'sideways_tp_mult': 1.7386219134013183, 'sideways_tsl_mult': 0.5265685043323268, 'sideways_time_stop': 202, 'sideways_use_sma': True, 'sideways_use_ema': False, 'sideways_use_atr': False, 'sideways_use_adx': True, 'sideways_use_spike': True, 'sideways_rsi_required': False}.
[I 2025-08-31 02:41:20,504] Trial 609 finished with values: [-1000000000.0, 1000000000.0] and parameters: {'p_sma': 20, 'p_std': 55, 'p_atr': 27, 'p_adx': 11, 'rsi_period': 67, 'ema1': 5, 'ema2': 33, 'slip_atr_k': 0.08996579420987891, 'slip_spread_k': 0.4971085729489259, 'spread_hl_frac': 0.02336406237433026, 'bb_std_mult': 1.8033662310009984, 'rsi_os': 21, 'rsi_ob': 70, 'vol_spike': 0.18569170735006515, 'adx_thresh': 5.097044517275833, 'atr_min_pct': 0.00760299850320348, 'atr_max_pct': 0.01738925242586685, 'tp_mult': 1.4290653954912937, 'tsl_mult': 0.3729210057161216, 'strategy': 'mean_reversion', 'time_stop': 98, 'use_sma': True, 'use_atr': True, 'use_adx': True, 'use_ema': False, 'use_spike': False, 'rsi_required': True, 'edge_k': 0.5421750595040584, 'edge_cap': 0.1357004632211005, 'bull_strategy': 'breakout', 'bull_bb_std_mult': 2.5478084088838058, 'bull_rsi_os': 45, 'bull_rsi_ob': 88, 'bull_adx_thresh': 23.210136042668143, 'bull_atr_min_pct': 0.014958690817763982, 'bull_atr_max_pct': 0.14365736196782286, 'bull_tp_mult': 2.192548439884575, 'bull_tsl_mult': 0.5915190357423002, 'bull_time_stop': 141, 'bull_use_sma': True, 'bull_use_ema': False, 'bull_use_atr': False, 'bull_use_adx': True, 'bull_use_spike': True, 'bull_rsi_required': True, 'bear_strategy': 'mean_reversion', 'bear_bb_std_mult': 3.5854453040411634, 'bear_rsi_os': 16, 'bear_rsi_ob': 47, 'bear_adx_thresh': 16.91362957408906, 'bear_atr_min_pct': 0.007298612597941045, 'bear_atr_max_pct': 0.12997841438144886, 'bear_tp_mult': 2.646642230704134, 'bear_tsl_mult': 0.5273432346318275, 'bear_time_stop': 77, 'bear_use_sma': False, 'bear_use_ema': False, 'bear_use_atr': False, 'bear_use_adx': False, 'bear_use_spike': False, 'bear_rsi_required': True, 'sideways_strategy': 'breakout', 'sideways_bb_std_mult': 0.6370498965640914, 'sideways_rsi_os': 5, 'sideways_rsi_ob': 94, 'sideways_adx_thresh': 20.73049255016773, 'sideways_atr_min_pct': 0.02752178685175717, 'sideways_atr_max_pct': 0.018714827137216, 'sideways_tp_mult': 1.6714910008533046, 'sideways_tsl_mult': 0.5218092507042345, 'sideways_time_stop': 196, 'sideways_use_sma': False, 'sideways_use_ema': True, 'sideways_use_atr': False, 'sideways_use_adx': True, 'sideways_use_spike': True, 'sideways_rsi_required': False}.
[I 2025-08-31 02:41:20,528] Trial 612 finished with values: [-1000000000.0, 1000000000.0] and parameters: {'p_sma': 51, 'p_std': 52, 'p_atr': 15, 'p_adx': 27, 'rsi_period': 8, 'ema1': 5, 'ema2': 33, 'slip_atr_k': 0.13322470206011827, 'slip_spread_k': 0.19738907262648836, 'spread_hl_frac': 0.003688611591232984, 'bb_std_mult': 2.645793226042704, 'rsi_os': 44, 'rsi_ob': 95, 'vol_spike': 0.19539862890438497, 'adx_thresh': 26.98924801416981, 'atr_min_pct': 0.007483998762954161, 'atr_max_pct': 0.12461456660628524, 'tp_mult': 1.598655498128657, 'tsl_mult': 0.40034779109902136, 'strategy': 'mean_reversion', 'time_stop': 98, 'use_sma': True, 'use_atr': False, 'use_adx': False, 'use_ema': False, 'use_spike': False, 'rsi_required': True, 'edge_k': 0.3981473494715676, 'edge_cap': 0.21770876883809087, 'bull_strategy': 'breakout', 'bull_bb_std_mult': 1.6118867619001411, 'bull_rsi_os': 25, 'bull_rsi_ob': 52, 'bull_adx_thresh': 6.7950946275255015, 'bull_atr_min_pct': 0.02058934393836651, 'bull_atr_max_pct': 0.05198598884557443, 'bull_tp_mult': 2.2494135101902413, 'bull_tsl_mult': 0.19687565168065682, 'bull_time_stop': 142, 'bull_use_sma': True, 'bull_use_ema': False, 'bull_use_atr': False, 'bull_use_adx': True, 'bull_use_spike': True, 'bull_rsi_required': True, 'bear_strategy': 'mean_reversion', 'bear_bb_std_mult': 2.0161537614853335, 'bear_rsi_os': 16, 'bear_rsi_ob': 45, 'bear_adx_thresh': 6.2900419833265095, 'bear_atr_min_pct': 0.006433100438695075, 'bear_atr_max_pct': 0.012354875705487978, 'bear_tp_mult': 2.450509676968992, 'bear_tsl_mult': 0.5657473684344759, 'bear_time_stop': 77, 'bear_use_sma': False, 'bear_use_ema': False, 'bear_use_atr': False, 'bear_use_adx': True, 'bear_use_spike': True, 'bear_rsi_required': True, 'sideways_strategy': 'breakout', 'sideways_bb_std_mult': 0.5478628686359414, 'sideways_rsi_os': 52, 'sideways_rsi_ob': 93, 'sideways_adx_thresh': 9.998138234147026, 'sideways_atr_min_pct': 0.02743464047892713, 'sideways_atr_max_pct': 0.06246688405256841, 'sideways_tp_mult': 2.044620411208389, 'sideways_tsl_mult': 0.6877545039360209, 'sideways_time_stop': 193, 'sideways_use_sma': True, 'sideways_use_ema': True, 'sideways_use_atr': False, 'sideways_use_adx': False, 'sideways_use_spike': True, 'sideways_rsi_required': False}.
[I 2025-08-31 02:41:20,841] Trial 611 finished with values: [-1000000000.0, 1000000000.0] and parameters: {'p_sma': 33, 'p_std': 52, 'p_atr': 29, 'p_adx': 27, 'rsi_period': 14, 'ema1': 5, 'ema2': 53, 'slip_atr_k': 0.21791016454579498, 'slip_spread_k': 0.07168166107713646, 'spread_hl_frac': 0.0042939785239505465, 'bb_std_mult': 3.005075028817445, 'rsi_os': 40, 'rsi_ob': 95, 'vol_spike': 0.1984937952464898, 'adx_thresh': 19.710017606270025, 'atr_min_pct': 0.007770378732743475, 'atr_max_pct': 0.1465097027123934, 'tp_mult': 1.8585254925224415, 'tsl_mult': 0.37964809004320643, 'strategy': 'mean_reversion', 'time_stop': 99, 'use_sma': True, 'use_atr': False, 'use_adx': False, 'use_ema': False, 'use_spike': False, 'rsi_required': True, 'edge_k': 0.6443106887751229, 'edge_cap': 0.12350544638670463, 'bull_strategy': 'breakout', 'bull_bb_std_mult': 2.553567970633194, 'bull_rsi_os': 24, 'bull_rsi_ob': 52, 'bull_adx_thresh': 23.386211104615303, 'bull_atr_min_pct': 0.019492024630896738, 'bull_atr_max_pct': 0.14406205890480908, 'bull_tp_mult': 2.2531283653413325, 'bull_tsl_mult': 0.8648647556928484, 'bull_time_stop': 213, 'bull_use_sma': True, 'bull_use_ema': False, 'bull_use_atr': False, 'bull_use_adx': True, 'bull_use_spike': True, 'bull_rsi_required': True, 'bear_strategy': 'mean_reversion', 'bear_bb_std_mult': 1.9716663571649502, 'bear_rsi_os': 13, 'bear_rsi_ob': 47, 'bear_adx_thresh': 5.019419327563754, 'bear_atr_min_pct': 0.006266221709306752, 'bear_atr_max_pct': 0.01210729128923423, 'bear_tp_mult': 2.838398249012526, 'bear_tsl_mult': 0.5567314381944484, 'bear_time_stop': 5, 'bear_use_sma': False, 'bear_use_ema': False, 'bear_use_atr': False, 'bear_use_adx': True, 'bear_use_spike': True, 'bear_rsi_required': True, 'sideways_strategy': 'breakout', 'sideways_bb_std_mult': 0.6115096548570114, 'sideways_rsi_os': 42, 'sideways_rsi_ob': 93, 'sideways_adx_thresh': 20.394697889220684, 'sideways_atr_min_pct': 0.02755496414043042, 'sideways_atr_max_pct': 0.05442928938812443, 'sideways_tp_mult': 1.6927229168245848, 'sideways_tsl_mult': 0.638555801791795, 'sideways_time_stop': 232, 'sideways_use_sma': True, 'sideways_use_ema': True, 'sideways_use_atr': False, 'sideways_use_adx': False, 'sideways_use_spike': True, 'sideways_rsi_required': False}.
