[I 2025-08-31 00:26:11,030] Trial 197 finished with values: [-1000000000.0, 1000000000.0] and parameters: {'p_sma': 50, 'p_std': 39, 'p_atr': 13, 'p_adx': 21, 'rsi_period': 23, 'ema1': 26, 'ema2': 21, 'slip_atr_k': 0.04723916614193631, 'slip_spread_k': 0.26381151215745186, 'spread_hl_frac': 0.008138918436578333, 'bb_std_mult': 3.4009874601437735, 'rsi_os': 23, 'rsi_ob': 77, 'vol_spike': 0.010885051029585719, 'adx_thresh': 10.846885610817663, 'atr_min_pct': 0.006248192418073789, 'atr_max_pct': 0.06543306581824887, 'tp_mult': 2.5727250486113866, 'tsl_mult': 0.43107585062909626, 'strategy': 'breakout', 'time_stop': 298, 'use_sma': True, 'use_atr': False, 'use_adx': False, 'use_ema': False, 'use_spike': False, 'rsi_required': True, 'edge_k': 0.7832083779644502, 'edge_cap': 0.9672451415432533, 'bull_strategy': 'breakout', 'bull_bb_std_mult': 1.820955170066843, 'bull_rsi_os': 36, 'bull_rsi_ob': 67, 'bull_adx_thresh': 27.198219301281302, 'bull_atr_min_pct': 0.0005269555226366661, 'bull_atr_max_pct': 0.09558042035720529, 'bull_tp_mult': 2.999680027584393, 'bull_tsl_mult': 0.22957478160759498, 'bull_time_stop': 38, 'bull_use_sma': False, 'bull_use_ema': True, 'bull_use_atr': False, 'bull_use_adx': True, 'bull_use_spike': False, 'bull_rsi_required': False, 'bear_strategy': 'breakout', 'bear_bb_std_mult': 3.1422916115799966, 'bear_rsi_os': 46, 'bear_rsi_ob': 75, 'bear_adx_thresh': 9.599915862678097, 'bear_atr_min_pct': 0.009636554189337681, 'bear_atr_max_pct': 0.034622671938163666, 'bear_tp_mult': 2.816417218680723, 'bear_tsl_mult': 0.8972219583858669, 'bear_time_stop': 255, 'bear_use_sma': False, 'bear_use_ema': False, 'bear_use_atr': True, 'bear_use_adx': True, 'bear_use_spike': False, 'bear_rsi_required': False, 'sideways_strategy': 'mean_reversion', 'sideways_bb_std_mult': 2.0973423425778175, 'sideways_rsi_os': 47, 'sideways_rsi_ob': 68, 'sideways_adx_thresh': 19.178804325445977, 'sideways_atr_min_pct': 0.020855456747651626, 'sideways_atr_max_pct': 0.04923455819597586, 'sideways_tp_mult': 1.1582875387289373, 'sideways_tsl_mult': 0.17621962241745143, 'sideways_time_stop': 98, 'sideways_use_sma': False, 'sideways_use_ema': False, 'sideways_use_atr': False, 'sideways_use_adx': False, 'sideways_use_spike': True, 'sideways_rsi_required': False}.
[I 2025-08-31 00:26:11,490] Trial 202 finished with values: [-1000000000.0, 1000000000.0] and parameters: {'p_sma': 35, 'p_std': 34, 'p_atr': 15, 'p_adx': 22, 'rsi_period': 50, 'ema1': 27, 'ema2': 52, 'slip_atr_k': 0.044266101687207786, 'slip_spread_k': 0.17044869765638498, 'spread_hl_frac': 0.015758494360934024, 'bb_std_mult': 2.181734725716736, 'rsi_os': 52, 'rsi_ob': 73, 'vol_spike': 0.02245227421863732, 'adx_thresh': 11.864225690406885, 'atr_min_pct': 0.0005857903395922973, 'atr_max_pct': 0.0713450687105107, 'tp_mult': 1.8915738969247013, 'tsl_mult': 0.08388186657810487, 'strategy': 'mean_reversion', 'time_stop': 38, 'use_sma': False, 'use_atr': True, 'use_adx': True, 'use_ema': True, 'use_spike': True, 'rsi_required': True, 'edge_k': 0.00026061249300179945, 'edge_cap': 0.933062575443636, 'bull_strategy': 'mean_reversion', 'bull_bb_std_mult': 3.0956940764765135, 'bull_rsi_os': 20, 'bull_rsi_ob': 66, 'bull_adx_thresh': 11.98026537568058, 'bull_atr_min_pct': 0.01724263223529165, 'bull_atr_max_pct': 0.1019387223280745, 'bull_tp_mult': 2.9419113722999595, 'bull_tsl_mult': 0.34546488701539185, 'bull_time_stop': 170, 'bull_use_sma': True, 'bull_use_ema': False, 'bull_use_atr': False, 'bull_use_adx': False, 'bull_use_spike': True, 'bull_rsi_required': True, 'bear_strategy': 'mean_reversion', 'bear_bb_std_mult': 1.6954044026233248, 'bear_rsi_os': 19, 'bear_rsi_ob': 70, 'bear_adx_thresh': 15.797276035974788, 'bear_atr_min_pct': 0.009400729418051397, 'bear_atr_max_pct': 0.129552170184275, 'bear_tp_mult': 1.9285264618994338, 'bear_tsl_mult': 0.18335629786873292, 'bear_time_stop': 56, 'bear_use_sma': True, 'bear_use_ema': True, 'bear_use_atr': False, 'bear_use_adx': False, 'bear_use_spike': True, 'bear_rsi_required': False, 'sideways_strategy': 'breakout', 'sideways_bb_std_mult': 2.34157418512659, 'sideways_rsi_os': 20, 'sideways_rsi_ob': 71, 'sideways_adx_thresh': 11.387266886337935, 'sideways_atr_min_pct': 0.005476921424177069, 'sideways_atr_max_pct': 0.11709121643272549, 'sideways_tp_mult': 1.0549410250829174, 'sideways_tsl_mult': 0.13294982023036983, 'sideways_time_stop': 220, 'sideways_use_sma': False, 'sideways_use_ema': True, 'sideways_use_atr': True, 'sideways_use_adx': True, 'sideways_use_spike': False, 'sideways_rsi_required': False}.
[I 2025-08-31 00:26:40,874] Trial 199 finished with values: [-1000000000.0, 1000000000.0] and parameters: {'p_sma': 50, 'p_std': 23, 'p_atr': 15, 'p_adx': 21, 'rsi_period': 25, 'ema1': 17, 'ema2': 51, 'slip_atr_k': 0.0437113873821231, 'slip_spread_k': 0.29905821475171723, 'spread_hl_frac': 0.04891983149674596, 'bb_std_mult': 3.3750037360155325, 'rsi_os': 55, 'rsi_ob': 77, 'vol_spike': 0.006053221867179944, 'adx_thresh': 10.653546086106603, 'atr_min_pct': 0.015178912540292713, 'atr_max_pct': 0.06536325381565727, 'tp_mult': 2.55304960110353, 'tsl_mult': 0.11029571300002097, 'strategy': 'breakout', 'time_stop': 297, 'use_sma': True, 'use_atr': False, 'use_adx': True, 'use_ema': False, 'use_spike': False, 'rsi_required': True, 'edge_k': 1.6600549985584847, 'edge_cap': 0.969601368282849, 'bull_strategy': 'breakout', 'bull_bb_std_mult': 2.5131417346161773, 'bull_rsi_os': 7, 'bull_rsi_ob': 67, 'bull_adx_thresh': 32.56035129994643, 'bull_atr_min_pct': 0.006116380508484459, 'bull_atr_max_pct': 0.015768193164483496, 'bull_tp_mult': 1.6421609166502633, 'bull_tsl_mult': 0.23784009633454445, 'bull_time_stop': 149, 'bull_use_sma': False, 'bull_use_ema': True, 'bull_use_atr': False, 'bull_use_adx': True, 'bull_use_spike': False, 'bull_rsi_required': False, 'bear_strategy': 'breakout', 'bear_bb_std_mult': 3.099970468000012, 'bear_rsi_os': 19, 'bear_rsi_ob': 47, 'bear_adx_thresh': 9.486093680219465, 'bear_atr_min_pct': 0.00444785738768916, 'bear_atr_max_pct': 0.14008486893709407, 'bear_tp_mult': 2.689127730597475, 'bear_tsl_mult': 0.15427315429077543, 'bear_time_stop': 258, 'bear_use_sma': False, 'bear_use_ema': False, 'bear_use_atr': True, 'bear_use_adx': False, 'bear_use_spike': False, 'bear_rsi_required': False, 'sideways_strategy': 'mean_reversion', 'sideways_bb_std_mult': 1.0908278837507297, 'sideways_rsi_os': 32, 'sideways_rsi_ob': 68, 'sideways_adx_thresh': 32.406890094441465, 'sideways_atr_min_pct': 0.020191673205168285, 'sideways_atr_max_pct': 0.14501498335612253, 'sideways_tp_mult': 1.0591789849748086, 'sideways_tsl_mult': 0.3945866453260724, 'sideways_time_stop': 164, 'sideways_use_sma': False, 'sideways_use_ema': False, 'sideways_use_atr': False, 'sideways_use_adx': True, 'sideways_use_spike': True, 'sideways_rsi_required': False}.
[I 2025-08-31 00:26:41,724] Trial 201 finished with values: [-1000000000.0, 1000000000.0] and parameters: {'p_sma': 28, 'p_std': 23, 'p_atr': 9, 'p_adx': 17, 'rsi_period': 22, 'ema1': 27, 'ema2': 21, 'slip_atr_k': 0.048520170899150825, 'slip_spread_k': 0.2692686554864122, 'spread_hl_frac': 0.0011671891673551964, 'bb_std_mult': 3.401272761939225, 'rsi_os': 52, 'rsi_ob': 72, 'vol_spike': 0.14555581720591576, 'adx_thresh': 10.895877609992889, 'atr_min_pct': 0.027641172741584678, 'atr_max_pct': 0.06739610583811821, 'tp_mult': 2.356699606259444, 'tsl_mult': 0.0856142650568047, 'strategy': 'breakout', 'time_stop': 295, 'use_sma': False, 'use_atr': True, 'use_adx': True, 'use_ema': True, 'use_spike': False, 'rsi_required': True, 'edge_k': 0.7948332307516643, 'edge_cap': 0.6554141115513543, 'bull_strategy': 'mean_reversion', 'bull_bb_std_mult': 2.5393173581859996, 'bull_rsi_os': 29, 'bull_rsi_ob': 91, 'bull_adx_thresh': 11.76928244161345, 'bull_atr_min_pct': 2.696624570354617e-05, 'bull_atr_max_pct': 0.08818990711449583, 'bull_tp_mult': 2.9978498209888182, 'bull_tsl_mult': 0.3132701233642929, 'bull_time_stop': 170, 'bull_use_sma': True, 'bull_use_ema': True, 'bull_use_atr': False, 'bull_use_adx': False, 'bull_use_spike': True, 'bull_rsi_required': True, 'bear_strategy': 'mean_reversion', 'bear_bb_std_mult': 0.5008510540478196, 'bear_rsi_os': 19, 'bear_rsi_ob': 79, 'bear_adx_thresh': 15.988272698249734, 'bear_atr_min_pct': 0.009241131640748539, 'bear_atr_max_pct': 0.13050856303517389, 'bear_tp_mult': 2.00854103420394, 'bear_tsl_mult': 0.5288858456441824, 'bear_time_stop': 41, 'bear_use_sma': True, 'bear_use_ema': True, 'bear_use_atr': False, 'bear_use_adx': False, 'bear_use_spike': True, 'bear_rsi_required': False, 'sideways_strategy': 'mean_reversion', 'sideways_bb_std_mult': 1.0922409846445988, 'sideways_rsi_os': 20, 'sideways_rsi_ob': 68, 'sideways_adx_thresh': 32.195424605894736, 'sideways_atr_min_pct': 0.021675592119862856, 'sideways_atr_max_pct': 0.0476083315513603, 'sideways_tp_mult': 2.266901470417998, 'sideways_tsl_mult': 0.5695051552343837, 'sideways_time_stop': 115, 'sideways_use_sma': False, 'sideways_use_ema': True, 'sideways_use_atr': True, 'sideways_use_adx': True, 'sideways_use_spike': False, 'sideways_rsi_required': False}.
[I 2025-08-31 00:26:41,813] Trial 200 finished with values: [-1000000000.0, 1000000000.0] and parameters: {'p_sma': 50, 'p_std': 34, 'p_atr': 12, 'p_adx': 27, 'rsi_period': 51, 'ema1': 27, 'ema2': 21, 'slip_atr_k': 0.04603687997792836, 'slip_spread_k': 0.26890546820336353, 'spread_hl_frac': 0.0018685823206400706, 'bb_std_mult': 3.370211694762766, 'rsi_os': 7, 'rsi_ob': 72, 'vol_spike': 0.1467682259724083, 'adx_thresh': 10.65372287285201, 'atr_min_pct': 0.015268524464642105, 'atr_max_pct': 0.06726329897459596, 'tp_mult': 2.565103953598951, 'tsl_mult': 0.0898513437149745, 'strategy': 'breakout', 'time_stop': 38, 'use_sma': False, 'use_atr': True, 'use_adx': True, 'use_ema': False, 'use_spike': True, 'rsi_required': True, 'edge_k': 0.7823739071509963, 'edge_cap': 0.6531271631054031, 'bull_strategy': 'breakout', 'bull_bb_std_mult': 2.5311505719493876, 'bull_rsi_os': 52, 'bull_rsi_ob': 88, 'bull_adx_thresh': 32.395777857947124, 'bull_atr_min_pct': 0.005817696955164793, 'bull_atr_max_pct': 0.10518737719680571, 'bull_tp_mult': 2.998843753230103, 'bull_tsl_mult': 0.24255327720122294, 'bull_time_stop': 203, 'bull_use_sma': False, 'bull_use_ema': True, 'bull_use_atr': False, 'bull_use_adx': False, 'bull_use_spike': True, 'bull_rsi_required': True, 'bear_strategy': 'mean_reversion', 'bear_bb_std_mult': 1.5048876582458903, 'bear_rsi_os': 27, 'bear_rsi_ob': 54, 'bear_adx_thresh': 15.969554580336753, 'bear_atr_min_pct': 0.003198702210241695, 'bear_atr_max_pct': 0.02603142379950299, 'bear_tp_mult': 2.8280066213751347, 'bear_tsl_mult': 0.2823444762067457, 'bear_time_stop': 59, 'bear_use_sma': True, 'bear_use_ema': True, 'bear_use_atr': True, 'bear_use_adx': False, 'bear_use_spike': False, 'bear_rsi_required': False, 'sideways_strategy': 'mean_reversion', 'sideways_bb_std_mult': 1.117709625643076, 'sideways_rsi_os': 19, 'sideways_rsi_ob': 68, 'sideways_adx_thresh': 19.417622995905955, 'sideways_atr_min_pct': 0.020308515126763065, 'sideways_atr_max_pct': 0.14287628084155662, 'sideways_tp_mult': 1.2448209189459198, 'sideways_tsl_mult': 0.24570975423695313, 'sideways_time_stop': 102, 'sideways_use_sma': False, 'sideways_use_ema': True, 'sideways_use_atr': True, 'sideways_use_adx': True, 'sideways_use_spike': False, 'sideways_rsi_required': False}.
[I 2025-08-31 00:26:42,506] Trial 203 finished with values: [-1000000000.0, 1000000000.0] and parameters: {'p_sma': 48, 'p_std': 10, 'p_atr': 21, 'p_adx': 17, 'rsi_period': 41, 'ema1': 17, 'ema2': 47, 'slip_atr_k': 0.05407778205264108, 'slip_spread_k': 0.2762367265655917, 'spread_hl_frac': 0.03761496195552888, 'bb_std_mult': 3.5150240276859597, 'rsi_os': 55, 'rsi_ob': 62, 'vol_spike': 0.002398466214881625, 'adx_thresh': 25.415886617346736, 'atr_min_pct': 0.015177037128251424, 'atr_max_pct': 0.06880892898276854, 'tp_mult': 2.3317424407603706, 'tsl_mult': 0.8066604820803276, 'strategy': 'breakout', 'time_stop': 181, 'use_sma': False, 'use_atr': False, 'use_adx': True, 'use_ema': False, 'use_spike': True, 'rsi_required': True, 'edge_k': 1.1968210801126755, 'edge_cap': 0.9962564185051034, 'bull_strategy': 'breakout', 'bull_bb_std_mult': 3.416562104622514, 'bull_rsi_os': 40, 'bull_rsi_ob': 88, 'bull_adx_thresh': 29.37323982311545, 'bull_atr_min_pct': 0.0013791480978056986, 'bull_atr_max_pct': 0.09272777612414693, 'bull_tp_mult': 2.920492048772434, 'bull_tsl_mult': 0.2580694821575375, 'bull_time_stop': 110, 'bull_use_sma': False, 'bull_use_ema': True, 'bull_use_atr': False, 'bull_use_adx': True, 'bull_use_spike': True, 'bull_rsi_required': True, 'bear_strategy': 'breakout', 'bear_bb_std_mult': 2.7408450214015625, 'bear_rsi_os': 26, 'bear_rsi_ob': 73, 'bear_adx_thresh': 12.078791204013708, 'bear_atr_min_pct': 0.01800315128511123, 'bear_atr_max_pct': 0.1451048535090146, 'bear_tp_mult': 2.4440869954996556, 'bear_tsl_mult': 0.2766678497904644, 'bear_time_stop': 215, 'bear_use_sma': False, 'bear_use_ema': True, 'bear_use_atr': True, 'bear_use_adx': False, 'bear_use_spike': False, 'bear_rsi_required': True, 'sideways_strategy': 'mean_reversion', 'sideways_bb_std_mult': 1.0933125716535264, 'sideways_rsi_os': 43, 'sideways_rsi_ob': 66, 'sideways_adx_thresh': 12.395797173342283, 'sideways_atr_min_pct': 0.02176139624962569, 'sideways_atr_max_pct': 0.14217523712691502, 'sideways_tp_mult': 2.241392415810516, 'sideways_tsl_mult': 0.24816468720131846, 'sideways_time_stop': 22, 'sideways_use_sma': True, 'sideways_use_ema': True, 'sideways_use_atr': False, 'sideways_use_adx': True, 'sideways_use_spike': False, 'sideways_rsi_required': True}.
[I 2025-08-31 00:26:42,916] Trial 205 finished with values: [-1000000000.0, 1000000000.0] and parameters: {'p_sma': 47, 'p_std': 20, 'p_atr': 24, 'p_adx': 8, 'rsi_period': 34, 'ema1': 25, 'ema2': 47, 'slip_atr_k': 0.02781697766581454, 'slip_spread_k': 0.755316572781638, 'spread_hl_frac': 0.00959292438849677, 'bb_std_mult': 0.9287199396835524, 'rsi_os': 55, 'rsi_ob': 76, 'vol_spike': 0.13192902793014097, 'adx_thresh': 21.261219291442586, 'atr_min_pct': 0.015877672278778426, 'atr_max_pct': 0.07013386498631537, 'tp_mult': 2.648271254918894, 'tsl_mult': 0.9784680333537019, 'strategy': 'mean_reversion', 'time_stop': 36, 'use_sma': True, 'use_atr': False, 'use_adx': False, 'use_ema': False, 'use_spike': True, 'rsi_required': True, 'edge_k': 0.7246712750186851, 'edge_cap': 0.6311991305378979, 'bull_strategy': 'breakout', 'bull_bb_std_mult': 2.9032646034378864, 'bull_rsi_os': 37, 'bull_rsi_ob': 48, 'bull_adx_thresh': 21.274218665160852, 'bull_atr_min_pct': 0.027169719030433206, 'bull_atr_max_pct': 0.09375994488850864, 'bull_tp_mult': 2.927113797409831, 'bull_tsl_mult': 0.2727401781007581, 'bull_time_stop': 102, 'bull_use_sma': False, 'bull_use_ema': True, 'bull_use_atr': False, 'bull_use_adx': True, 'bull_use_spike': False, 'bull_rsi_required': False, 'bear_strategy': 'breakout', 'bear_bb_std_mult': 2.73200260371187, 'bear_rsi_os': 22, 'bear_rsi_ob': 73, 'bear_adx_thresh': 8.432752239881987, 'bear_atr_min_pct': 0.008809699535891828, 'bear_atr_max_pct': 0.14503402269437707, 'bear_tp_mult': 2.523836103833143, 'bear_tsl_mult': 0.24773830332287156, 'bear_time_stop': 214, 'bear_use_sma': False, 'bear_use_ema': False, 'bear_use_atr': True, 'bear_use_adx': True, 'bear_use_spike': False, 'bear_rsi_required': True, 'sideways_strategy': 'breakout', 'sideways_bb_std_mult': 1.2387110190377693, 'sideways_rsi_os': 37, 'sideways_rsi_ob': 79, 'sideways_adx_thresh': 12.573292319672365, 'sideways_atr_min_pct': 0.01113721730880645, 'sideways_atr_max_pct': 0.10193077049060428, 'sideways_tp_mult': 1.2395795537549694, 'sideways_tsl_mult': 0.4989286703484451, 'sideways_time_stop': 56, 'sideways_use_sma': True, 'sideways_use_ema': False, 'sideways_use_atr': False, 'sideways_use_adx': False, 'sideways_use_spike': True, 'sideways_rsi_required': True}.
[I 2025-08-31 00:26:42,929] Trial 206 finished with values: [-1000000000.0, 1000000000.0] and parameters: {'p_sma': 15, 'p_std': 8, 'p_atr': 24, 'p_adx': 8, 'rsi_period': 15, 'ema1': 25, 'ema2': 47, 'slip_atr_k': 0.02843199339394931, 'slip_spread_k': 0.5764368907544587, 'spread_hl_frac': 0.011869057912143847, 'bb_std_mult': 3.5324772165542795, 'rsi_os': 55, 'rsi_ob': 75, 'vol_spike': 0.12982549120506942, 'adx_thresh': 12.829545633520466, 'atr_min_pct': 8.162541507991341e-06, 'atr_max_pct': 0.07050101739347209, 'tp_mult': 2.6434852355097824, 'tsl_mult': 0.04643271922760078, 'strategy': 'mean_reversion', 'time_stop': 43, 'use_sma': True, 'use_atr': False, 'use_adx': False, 'use_ema': False, 'use_spike': False, 'rsi_required': True, 'edge_k': 0.743114858872435, 'edge_cap': 0.7154439197802401, 'bull_strategy': 'breakout', 'bull_bb_std_mult': 3.5983180586690446, 'bull_rsi_os': 37, 'bull_rsi_ob': 65, 'bull_adx_thresh': 29.058354446074176, 'bull_atr_min_pct': 0.02718799644656739, 'bull_atr_max_pct': 0.11271142076832981, 'bull_tp_mult': 2.9131019260873434, 'bull_tsl_mult': 0.2629321406655095, 'bull_time_stop': 219, 'bull_use_sma': False, 'bull_use_ema': True, 'bull_use_atr': True, 'bull_use_adx': True, 'bull_use_spike': False, 'bull_rsi_required': False, 'bear_strategy': 'breakout', 'bear_bb_std_mult': 0.6035517587898026, 'bear_rsi_os': 22, 'bear_rsi_ob': 77, 'bear_adx_thresh': 30.61044482047505, 'bear_atr_min_pct': 0.025051514447155764, 'bear_atr_max_pct': 0.08083769889019614, 'bear_tp_mult': 1.9702661119316507, 'bear_tsl_mult': 0.2443211901647358, 'bear_time_stop': 166, 'bear_use_sma': False, 'bear_use_ema': False, 'bear_use_atr': True, 'bear_use_adx': True, 'bear_use_spike': False, 'bear_rsi_required': True, 'sideways_strategy': 'breakout', 'sideways_bb_std_mult': 0.7361191076725124, 'sideways_rsi_os': 43, 'sideways_rsi_ob': 78, 'sideways_adx_thresh': 12.39726383219445, 'sideways_atr_min_pct': 0.022059648715225096, 'sideways_atr_max_pct': 0.13531935255169414, 'sideways_tp_mult': 1.5503052849993935, 'sideways_tsl_mult': 0.4210691449047599, 'sideways_time_stop': 119, 'sideways_use_sma': True, 'sideways_use_ema': False, 'sideways_use_atr': False, 'sideways_use_adx': False, 'sideways_use_spike': True, 'sideways_rsi_required': True}.
[I 2025-08-31 00:26:42,989] Trial 207 finished with values: [-1000000000.0, 1000000000.0] and parameters: {'p_sma': 47, 'p_std': 20, 'p_atr': 24, 'p_adx': 12, 'rsi_period': 34, 'ema1': 25, 'ema2': 42, 'slip_atr_k': 0.02795121803901193, 'slip_spread_k': 0.4128284991385166, 'spread_hl_frac': 0.018310942230354083, 'bb_std_mult': 3.5986520969684466, 'rsi_os': 53, 'rsi_ob': 68, 'vol_spike': 0.12941812341106815, 'adx_thresh': 22.833272138329452, 'atr_min_pct': 0.02988089881711429, 'atr_max_pct': 0.07113688201022046, 'tp_mult': 2.6429397869029225, 'tsl_mult': 0.1743877580086661, 'strategy': 'mean_reversion', 'time_stop': 103, 'use_sma': True, 'use_atr': False, 'use_adx': False, 'use_ema': False, 'use_spike': False, 'rsi_required': True, 'edge_k': 0.7076671058736211, 'edge_cap': 0.6276694732059576, 'bull_strategy': 'breakout', 'bull_bb_std_mult': 2.921771606318474, 'bull_rsi_os': 37, 'bull_rsi_ob': 80, 'bull_adx_thresh': 28.25808887075118, 'bull_atr_min_pct': 0.025798876992011846, 'bull_atr_max_pct': 0.09315444377598524, 'bull_tp_mult': 1.3090352427314191, 'bull_tsl_mult': 0.8052429669772299, 'bull_time_stop': 156, 'bull_use_sma': False, 'bull_use_ema': False, 'bull_use_atr': True, 'bull_use_adx': True, 'bull_use_spike': False, 'bull_rsi_required': False, 'bear_strategy': 'breakout', 'bear_bb_std_mult': 2.001217450297316, 'bear_rsi_os': 29, 'bear_rsi_ob': 77, 'bear_adx_thresh': 18.591033591364894, 'bear_atr_min_pct': 0.00848845030000884, 'bear_atr_max_pct': 0.13659893017477365, 'bear_tp_mult': 1.3214987975057684, 'bear_tsl_mult': 0.8365817339516628, 'bear_time_stop': 168, 'bear_use_sma': False, 'bear_use_ema': False, 'bear_use_atr': False, 'bear_use_adx': True, 'bear_use_spike': False, 'bear_rsi_required': True, 'sideways_strategy': 'breakout', 'sideways_bb_std_mult': 1.2510791029708808, 'sideways_rsi_os': 46, 'sideways_rsi_ob': 79, 'sideways_adx_thresh': 30.19724235848652, 'sideways_atr_min_pct': 0.017373198275753517, 'sideways_atr_max_pct': 0.09822274563464706, 'sideways_tp_mult': 2.457418673487141, 'sideways_tsl_mult': 0.023968739916825132, 'sideways_time_stop': 253, 'sideways_use_sma': True, 'sideways_use_ema': False, 'sideways_use_atr': False, 'sideways_use_adx': False, 'sideways_use_spike': True, 'sideways_rsi_required': True}.
