[I 2025-08-31 00:29:46,238] Trial 235 finished with values: [-0.0253757527834092, 0.025313176893908235] and parameters: {'p_sma': 49, 'p_std': 12, 'p_atr': 14, 'p_adx': 7, 'rsi_period': 41, 'ema1': 26, 'ema2': 49, 'slip_atr_k': 0.04188549058731866, 'slip_spread_k': 0.9704783521847251, 'spread_hl_frac': 0.01136973120806924, 'bb_std_mult': 1.9417666974116605, 'rsi_os': 15, 'rsi_ob': 75, 'vol_spike': 0.21934041851539732, 'adx_thresh': 12.49972076928463, 'atr_min_pct': 0.000595069769747811, 'atr_max_pct': 0.02319260023787311, 'tp_mult': 2.5665744267869752, 'tsl_mult': 0.7471732624995922, 'strategy': 'breakout', 'time_stop': 154, 'use_sma': True, 'use_atr': False, 'use_adx': False, 'use_ema': False, 'use_spike': False, 'rsi_required': True, 'edge_k': 0.7187583493023817, 'edge_cap': 0.5518628402981778, 'bull_strategy': 'breakout', 'bull_bb_std_mult': 1.948093588492731, 'bull_rsi_os': 6, 'bull_rsi_ob': 70, 'bull_adx_thresh': 22.345108026236016, 'bull_atr_min_pct': 0.0005055044678602479, 'bull_atr_max_pct': 0.04122040881146044, 'bull_tp_mult': 1.8778793234999762, 'bull_tsl_mult': 0.21559202625595986, 'bull_time_stop': 173, 'bull_use_sma': False, 'bull_use_ema': True, 'bull_use_atr': False, 'bull_use_adx': True, 'bull_use_spike': False, 'bull_rsi_required': False, 'bear_strategy': 'breakout', 'bear_bb_std_mult': 0.5569260844105757, 'bear_rsi_os': 39, 'bear_rsi_ob': 88, 'bear_adx_thresh': 26.972341189618238, 'bear_atr_min_pct': 0.00601843562736586, 'bear_atr_max_pct': 0.14260071943343808, 'bear_tp_mult': 1.9989762050184474, 'bear_tsl_mult': 0.4010192028374111, 'bear_time_stop': 198, 'bear_use_sma': False, 'bear_use_ema': False, 'bear_use_atr': True, 'bear_use_adx': True, 'bear_use_spike': False, 'bear_rsi_required': True, 'sideways_strategy': 'mean_reversion', 'sideways_bb_std_mult': 1.0758952488499574, 'sideways_rsi_os': 44, 'sideways_rsi_ob': 67, 'sideways_adx_thresh': 13.149587518201123, 'sideways_atr_min_pct': 0.003402421153782335, 'sideways_atr_max_pct': 0.1435249072815129, 'sideways_tp_mult': 1.1058443506004338, 'sideways_tsl_mult': 0.679783392579381, 'sideways_time_stop': 87, 'sideways_use_sma': False, 'sideways_use_ema': False, 'sideways_use_atr': True, 'sideways_use_adx': False, 'sideways_use_spike': True, 'sideways_rsi_required': False}.
[I 2025-08-31 00:29:46,377] Trial 234 finished with values: [-1000000000.0, 1000000000.0] and parameters: {'p_sma': 49, 'p_std': 36, 'p_atr': 14, 'p_adx': 7, 'rsi_period': 23, 'ema1': 26, 'ema2': 49, 'slip_atr_k': 0.04970217559185813, 'slip_spread_k': 0.438546759163485, 'spread_hl_frac': 0.0028675270961706686, 'bb_std_mult': 3.412857045182907, 'rsi_os': 9, 'rsi_ob': 75, 'vol_spike': 0.012022097965822258, 'adx_thresh': 8.530043964626012, 'atr_min_pct': 0.00048124758559977426, 'atr_max_pct': 0.024359173937168153, 'tp_mult': 2.5749769827691904, 'tsl_mult': 0.12567111223023866, 'strategy': 'mean_reversion', 'time_stop': 48, 'use_sma': True, 'use_atr': True, 'use_adx': False, 'use_ema': False, 'use_spike': False, 'rsi_required': True, 'edge_k': 0.7217051583282272, 'edge_cap': 0.9394227107799484, 'bull_strategy': 'breakout', 'bull_bb_std_mult': 0.8956414885452477, 'bull_rsi_os': 15, 'bull_rsi_ob': 56, 'bull_adx_thresh': 6.640536005030967, 'bull_atr_min_pct': 0.0004875493953999195, 'bull_atr_max_pct': 0.08499274574541751, 'bull_tp_mult': 2.996018479825467, 'bull_tsl_mult': 0.42103642048961476, 'bull_time_stop': 173, 'bull_use_sma': False, 'bull_use_ema': True, 'bull_use_atr': False, 'bull_use_adx': True, 'bull_use_spike': False, 'bull_rsi_required': False, 'bear_strategy': 'breakout', 'bear_bb_std_mult': 2.4041865904432624, 'bear_rsi_os': 41, 'bear_rsi_ob': 79, 'bear_adx_thresh': 25.735996616656408, 'bear_atr_min_pct': 0.023726084792772002, 'bear_atr_max_pct': 0.028466782810755487, 'bear_tp_mult': 1.1102201111476568, 'bear_tsl_mult': 0.16850388298365382, 'bear_time_stop': 296, 'bear_use_sma': False, 'bear_use_ema': False, 'bear_use_atr': True, 'bear_use_adx': True, 'bear_use_spike': True, 'bear_rsi_required': True, 'sideways_strategy': 'mean_reversion', 'sideways_bb_std_mult': 1.1826869133166091, 'sideways_rsi_os': 22, 'sideways_rsi_ob': 67, 'sideways_adx_thresh': 12.950923594705834, 'sideways_atr_min_pct': 0.02055513411144194, 'sideways_atr_max_pct': 0.14350249419285976, 'sideways_tp_mult': 1.1154214540309186, 'sideways_tsl_mult': 0.5795740177052074, 'sideways_time_stop': 229, 'sideways_use_sma': False, 'sideways_use_ema': False, 'sideways_use_atr': True, 'sideways_use_adx': False, 'sideways_use_spike': True, 'sideways_rsi_required': False}.
[I 2025-08-31 00:30:16,505] Trial 236 finished with values: [-1000000000.0, 1000000000.0] and parameters: {'p_sma': 46, 'p_std': 40, 'p_atr': 14, 'p_adx': 7, 'rsi_period': 48, 'ema1': 26, 'ema2': 21, 'slip_atr_k': 0.2340136838007802, 'slip_spread_k': 0.31509521486106823, 'spread_hl_frac': 0.02934745526294246, 'bb_std_mult': 3.056335611526337, 'rsi_os': 14, 'rsi_ob': 77, 'vol_spike': 0.22016570920986583, 'adx_thresh': 13.361114756507973, 'atr_min_pct': 1.2734108819256724e-05, 'atr_max_pct': 0.11247298671013008, 'tp_mult': 2.9645027976568588, 'tsl_mult': 0.09834921181091491, 'strategy': 'breakout', 'time_stop': 266, 'use_sma': True, 'use_atr': True, 'use_adx': False, 'use_ema': False, 'use_spike': True, 'rsi_required': True, 'edge_k': 1.7556518414380915, 'edge_cap': 0.9567370318189219, 'bull_strategy': 'breakout', 'bull_bb_std_mult': 1.8496729055512493, 'bull_rsi_os': 37, 'bull_rsi_ob': 56, 'bull_adx_thresh': 22.330735598202136, 'bull_atr_min_pct': 0.0005377483982908881, 'bull_atr_max_pct': 0.09064446353169885, 'bull_tp_mult': 1.6837488177327768, 'bull_tsl_mult': 0.004650625225232796, 'bull_time_stop': 173, 'bull_use_sma': False, 'bull_use_ema': True, 'bull_use_atr': False, 'bull_use_adx': True, 'bull_use_spike': False, 'bull_rsi_required': False, 'bear_strategy': 'breakout', 'bear_bb_std_mult': 2.799637472510921, 'bear_rsi_os': 41, 'bear_rsi_ob': 65, 'bear_adx_thresh': 27.222848125799846, 'bear_atr_min_pct': 0.010073395389850682, 'bear_atr_max_pct': 0.02802372680578124, 'bear_tp_mult': 1.987638129820127, 'bear_tsl_mult': 0.18290664184442101, 'bear_time_stop': 204, 'bear_use_sma': False, 'bear_use_ema': True, 'bear_use_atr': True, 'bear_use_adx': True, 'bear_use_spike': False, 'bear_rsi_required': True, 'sideways_strategy': 'mean_reversion', 'sideways_bb_std_mult': 1.075252035814451, 'sideways_rsi_os': 45, 'sideways_rsi_ob': 67, 'sideways_adx_thresh': 28.876278683980104, 'sideways_atr_min_pct': 0.020709435154388642, 'sideways_atr_max_pct': 0.13796774045185747, 'sideways_tp_mult': 1.368044014896498, 'sideways_tsl_mult': 0.14235846598305257, 'sideways_time_stop': 96, 'sideways_use_sma': False, 'sideways_use_ema': False, 'sideways_use_atr': True, 'sideways_use_adx': False, 'sideways_use_spike': True, 'sideways_rsi_required': False}.
[I 2025-08-31 00:30:17,266] Trial 237 finished with values: [-1000000000.0, 1000000000.0] and parameters: {'p_sma': 9, 'p_std': 12, 'p_atr': 14, 'p_adx': 7, 'rsi_period': 41, 'ema1': 26, 'ema2': 22, 'slip_atr_k': 0.04226451979278525, 'slip_spread_k': 0.5404293393907885, 'spread_hl_frac': 0.004461953595433669, 'bb_std_mult': 1.4285129150438673, 'rsi_os': 21, 'rsi_ob': 77, 'vol_spike': 0.22199887886951916, 'adx_thresh': 23.819782275404144, 'atr_min_pct': 0.021614372862388678, 'atr_max_pct': 0.06539530066539945, 'tp_mult': 1.5524696159382212, 'tsl_mult': 0.395085291257539, 'strategy': 'breakout', 'time_stop': 148, 'use_sma': False, 'use_atr': False, 'use_adx': True, 'use_ema': False, 'use_spike': True, 'rsi_required': True, 'edge_k': 1.7465456179514454, 'edge_cap': 0.18873274547979463, 'bull_strategy': 'breakout', 'bull_bb_std_mult': 2.36349140178442, 'bull_rsi_os': 14, 'bull_rsi_ob': 64, 'bull_adx_thresh': 9.834307633223535, 'bull_atr_min_pct': 0.004987255069273154, 'bull_atr_max_pct': 0.09164237694125144, 'bull_tp_mult': 2.925473436807639, 'bull_tsl_mult': 0.5667940977968768, 'bull_time_stop': 168, 'bull_use_sma': False, 'bull_use_ema': True, 'bull_use_atr': False, 'bull_use_adx': True, 'bull_use_spike': True, 'bull_rsi_required': True, 'bear_strategy': 'breakout', 'bear_bb_std_mult': 0.6449658151231396, 'bear_rsi_os': 27, 'bear_rsi_ob': 77, 'bear_adx_thresh': 26.973885431527684, 'bear_atr_min_pct': 0.029719821471819542, 'bear_atr_max_pct': 0.04608792936332555, 'bear_tp_mult': 1.992322937879315, 'bear_tsl_mult': 0.1682465305874387, 'bear_time_stop': 201, 'bear_use_sma': False, 'bear_use_ema': True, 'bear_use_atr': True, 'bear_use_adx': True, 'bear_use_spike': False, 'bear_rsi_required': True, 'sideways_strategy': 'mean_reversion', 'sideways_bb_std_mult': 3.088624750816656, 'sideways_rsi_os': 44, 'sideways_rsi_ob': 54, 'sideways_adx_thresh': 29.019995418868902, 'sideways_atr_min_pct': 0.020425332483560755, 'sideways_atr_max_pct': 0.13954067981531107, 'sideways_tp_mult': 1.1185418784214611, 'sideways_tsl_mult': 0.30348541795480805, 'sideways_time_stop': 288, 'sideways_use_sma': False, 'sideways_use_ema': True, 'sideways_use_atr': True, 'sideways_use_adx': True, 'sideways_use_spike': True, 'sideways_rsi_required': False}.
[I 2025-08-31 00:30:17,618] Trial 238 finished with values: [-1000000000.0, 1000000000.0] and parameters: {'p_sma': 46, 'p_std': 40, 'p_atr': 20, 'p_adx': 7, 'rsi_period': 33, 'ema1': 26, 'ema2': 39, 'slip_atr_k': 0.04106206543592495, 'slip_spread_k': 0.632783769002531, 'spread_hl_frac': 0.011323649758347236, 'bb_std_mult': 3.3378073763755007, 'rsi_os': 48, 'rsi_ob': 77, 'vol_spike': 0.013965919336050625, 'adx_thresh': 13.13175593735117, 'atr_min_pct': 0.0005950219347934151, 'atr_max_pct': 0.07045564802485953, 'tp_mult': 2.5683443349204658, 'tsl_mult': 0.12587056540957928, 'strategy': 'breakout', 'time_stop': 32, 'use_sma': False, 'use_atr': False, 'use_adx': True, 'use_ema': False, 'use_spike': True, 'rsi_required': True, 'edge_k': 0.708290971341907, 'edge_cap': 0.3988808271959537, 'bull_strategy': 'breakout', 'bull_bb_std_mult': 2.376544714492899, 'bull_rsi_os': 13, 'bull_rsi_ob': 64, 'bull_adx_thresh': 24.6866398658005, 'bull_atr_min_pct': 8.034291857382905e-06, 'bull_atr_max_pct': 0.09155143257190057, 'bull_tp_mult': 1.3898754827666684, 'bull_tsl_mult': 0.5707227453619911, 'bull_time_stop': 81, 'bull_use_sma': False, 'bull_use_ema': True, 'bull_use_atr': False, 'bull_use_adx': True, 'bull_use_spike': True, 'bull_rsi_required': True, 'bear_strategy': 'breakout', 'bear_bb_std_mult': 0.653945643818996, 'bear_rsi_os': 32, 'bear_rsi_ob': 77, 'bear_adx_thresh': 28.636911086975996, 'bear_atr_min_pct': 0.01592824670232596, 'bear_atr_max_pct': 0.04578919104611144, 'bear_tp_mult': 1.9966398687165827, 'bear_tsl_mult': 0.4028036791240977, 'bear_time_stop': 229, 'bear_use_sma': False, 'bear_use_ema': True, 'bear_use_atr': True, 'bear_use_adx': True, 'bear_use_spike': False, 'bear_rsi_required': True, 'sideways_strategy': 'mean_reversion', 'sideways_bb_std_mult': 1.8803237064159286, 'sideways_rsi_os': 22, 'sideways_rsi_ob': 54, 'sideways_adx_thresh': 16.930662054852235, 'sideways_atr_min_pct': 0.008481588125223104, 'sideways_atr_max_pct': 0.1380354482058305, 'sideways_tp_mult': 1.1241249401505717, 'sideways_tsl_mult': 0.2079486133667226, 'sideways_time_stop': 253, 'sideways_use_sma': False, 'sideways_use_ema': True, 'sideways_use_atr': True, 'sideways_use_adx': True, 'sideways_use_spike': True, 'sideways_rsi_required': False}.
[I 2025-08-31 00:30:17,889] Trial 239 finished with values: [-1000000000.0, 1000000000.0] and parameters: {'p_sma': 46, 'p_std': 40, 'p_atr': 12, 'p_adx': 7, 'rsi_period': 33, 'ema1': 26, 'ema2': 20, 'slip_atr_k': 0.04284372551954235, 'slip_spread_k': 0.7105666195224999, 'spread_hl_frac': 0.01118301062150673, 'bb_std_mult': 2.1198235772571543, 'rsi_os': 15, 'rsi_ob': 76, 'vol_spike': 0.219463226086209, 'adx_thresh': 13.255912793800107, 'atr_min_pct': 0.021579846046083345, 'atr_max_pct': 0.06397439739527463, 'tp_mult': 2.237077825349367, 'tsl_mult': 0.09463381898454673, 'strategy': 'breakout', 'time_stop': 262, 'use_sma': False, 'use_atr': False, 'use_adx': True, 'use_ema': False, 'use_spike': True, 'rsi_required': True, 'edge_k': 0.8496352924367214, 'edge_cap': 0.2194678307186269, 'bull_strategy': 'breakout', 'bull_bb_std_mult': 1.8450752087298228, 'bull_rsi_os': 37, 'bull_rsi_ob': 47, 'bull_adx_thresh': 13.881378302390788, 'bull_atr_min_pct': 2.3175642153352256e-05, 'bull_atr_max_pct': 0.0910206840199125, 'bull_tp_mult': 2.9231565978653347, 'bull_tsl_mult': 0.19769550594927465, 'bull_time_stop': 146, 'bull_use_sma': False, 'bull_use_ema': True, 'bull_use_atr': False, 'bull_use_adx': True, 'bull_use_spike': True, 'bull_rsi_required': True, 'bear_strategy': 'breakout', 'bear_bb_std_mult': 2.843034402748815, 'bear_rsi_os': 38, 'bear_rsi_ob': 89, 'bear_adx_thresh': 28.845509807528483, 'bear_atr_min_pct': 0.01574051193002282, 'bear_atr_max_pct': 0.14210741274952307, 'bear_tp_mult': 1.995767879694925, 'bear_tsl_mult': 0.4012694224044164, 'bear_time_stop': 227, 'bear_use_sma': False, 'bear_use_ema': True, 'bear_use_atr': True, 'bear_use_adx': True, 'bear_use_spike': False, 'bear_rsi_required': True, 'sideways_strategy': 'mean_reversion', 'sideways_bb_std_mult': 1.3283606854374228, 'sideways_rsi_os': 30, 'sideways_rsi_ob': 55, 'sideways_adx_thresh': 11.603173357744017, 'sideways_atr_min_pct': 0.021599019075655354, 'sideways_atr_max_pct': 0.13790739003062202, 'sideways_tp_mult': 1.59779085945733, 'sideways_tsl_mult': 0.20212618168221078, 'sideways_time_stop': 87, 'sideways_use_sma': False, 'sideways_use_ema': True, 'sideways_use_atr': False, 'sideways_use_adx': True, 'sideways_use_spike': True, 'sideways_rsi_required': False}.
[I 2025-08-31 00:30:46,957] Trial 243 finished with values: [-1000000000.0, 1000000000.0] and parameters: {'p_sma': 27, 'p_std': 48, 'p_atr': 11, 'p_adx': 26, 'rsi_period': 31, 'ema1': 27, 'ema2': 26, 'slip_atr_k': 0.03986129028392076, 'slip_spread_k': 0.09135805992819113, 'spread_hl_frac': 0.011944512326826832, 'bb_std_mult': 3.561833312951152, 'rsi_os': 55, 'rsi_ob': 73, 'vol_spike': 0.026639679245276167, 'adx_thresh': 28.97153988446366, 'atr_min_pct': 0.0037041328642683155, 'atr_max_pct': 0.07014452892316549, 'tp_mult': 2.5163038021139554, 'tsl_mult': 0.5189270994077948, 'strategy': 'breakout', 'time_stop': 34, 'use_sma': True, 'use_atr': False, 'use_adx': False, 'use_ema': False, 'use_spike': False, 'rsi_required': False, 'edge_k': 0.7579064709285601, 'edge_cap': 0.8765257220913635, 'bull_strategy': 'mean_reversion', 'bull_bb_std_mult': 1.6173015512027864, 'bull_rsi_os': 35, 'bull_rsi_ob': 52, 'bull_adx_thresh': 13.07958295021217, 'bull_atr_min_pct': 0.015298564582502106, 'bull_atr_max_pct': 0.040105413210943, 'bull_tp_mult': 2.050473323581343, 'bull_tsl_mult': 0.7040859265267059, 'bull_time_stop': 249, 'bull_use_sma': False, 'bull_use_ema': True, 'bull_use_atr': False, 'bull_use_adx': False, 'bull_use_spike': False, 'bull_rsi_required': False, 'bear_strategy': 'breakout', 'bear_bb_std_mult': 3.2321384085201705, 'bear_rsi_os': 17, 'bear_rsi_ob': 93, 'bear_adx_thresh': 29.952037603155684, 'bear_atr_min_pct': 0.020331934121482553, 'bear_atr_max_pct': 0.1462164440463118, 'bear_tp_mult': 1.886922452239003, 'bear_tsl_mult': 0.8795999769070174, 'bear_time_stop': 60, 'bear_use_sma': False, 'bear_use_ema': False, 'bear_use_atr': True, 'bear_use_adx': False, 'bear_use_spike': False, 'bear_rsi_required': False, 'sideways_strategy': 'mean_reversion', 'sideways_bb_std_mult': 2.488910138469831, 'sideways_rsi_os': 15, 'sideways_rsi_ob': 76, 'sideways_adx_thresh': 20.307086185072173, 'sideways_atr_min_pct': 0.02185273990691104, 'sideways_atr_max_pct': 0.13379457165712585, 'sideways_tp_mult': 2.7384222599337273, 'sideways_tsl_mult': 0.7852176282018718, 'sideways_time_stop': 241, 'sideways_use_sma': False, 'sideways_use_ema': False, 'sideways_use_atr': False, 'sideways_use_adx': False, 'sideways_use_spike': False, 'sideways_rsi_required': True}.
[I 2025-08-31 00:30:47,219] Trial 242 finished with values: [-1000000000.0, 1000000000.0] and parameters: {'p_sma': 13, 'p_std': 48, 'p_atr': 9, 'p_adx': 25, 'rsi_period': 32, 'ema1': 27, 'ema2': 20, 'slip_atr_k': 0.04435921547536353, 'slip_spread_k': 0.3869581814379124, 'spread_hl_frac': 0.011516319993434783, 'bb_std_mult': 3.5496345126274083, 'rsi_os': 30, 'rsi_ob': 61, 'vol_spike': 0.21016734055840103, 'adx_thresh': 20.262114411334846, 'atr_min_pct': 0.0016522709547964138, 'atr_max_pct': 0.06456611579313727, 'tp_mult': 2.2122118007599174, 'tsl_mult': 0.15771405235697525, 'strategy': 'breakout', 'time_stop': 34, 'use_sma': True, 'use_atr': False, 'use_adx': False, 'use_ema': False, 'use_spike': False, 'rsi_required': True, 'edge_k': 0.8608366896363823, 'edge_cap': 0.23763257350639705, 'bull_strategy': 'breakout', 'bull_bb_std_mult': 3.35818331686499, 'bull_rsi_os': 35, 'bull_rsi_ob': 67, 'bull_adx_thresh': 18.337493826596617, 'bull_atr_min_pct': 2.266731372054118e-05, 'bull_atr_max_pct': 0.12593267812156603, 'bull_tp_mult': 1.8822272347908144, 'bull_tsl_mult': 0.26281326950257233, 'bull_time_stop': 277, 'bull_use_sma': False, 'bull_use_ema': True, 'bull_use_atr': False, 'bull_use_adx': False, 'bull_use_spike': False, 'bull_rsi_required': False, 'bear_strategy': 'breakout', 'bear_bb_std_mult': 0.5588562622663626, 'bear_rsi_os': 38, 'bear_rsi_ob': 59, 'bear_adx_thresh': 29.755496355505525, 'bear_atr_min_pct': 0.019285929371870195, 'bear_atr_max_pct': 0.14686432772351277, 'bear_tp_mult': 1.8687051135289645, 'bear_tsl_mult': 0.8905922717448661, 'bear_time_stop': 60, 'bear_use_sma': False, 'bear_use_ema': False, 'bear_use_atr': True, 'bear_use_adx': False, 'bear_use_spike': False, 'bear_rsi_required': False, 'sideways_strategy': 'mean_reversion', 'sideways_bb_std_mult': 0.6553990901276865, 'sideways_rsi_os': 30, 'sideways_rsi_ob': 60, 'sideways_adx_thresh': 20.01499455044481, 'sideways_atr_min_pct': 0.00479551234406235, 'sideways_atr_max_pct': 0.01722212454949837, 'sideways_tp_mult': 1.870441611103678, 'sideways_tsl_mult': 0.1677288293118743, 'sideways_time_stop': 126, 'sideways_use_sma': False, 'sideways_use_ema': False, 'sideways_use_atr': False, 'sideways_use_adx': False, 'sideways_use_spike': False, 'sideways_rsi_required': True}.
[I 2025-08-31 00:30:47,670] Trial 240 finished with values: [-1000000000.0, 1000000000.0] and parameters: {'p_sma': 50, 'p_std': 16, 'p_atr': 20, 'p_adx': 26, 'rsi_period': 32, 'ema1': 27, 'ema2': 22, 'slip_atr_k': 0.04261030061340448, 'slip_spread_k': 0.3866453100990204, 'spread_hl_frac': 0.011097894484670787, 'bb_std_mult': 3.3359584499064576, 'rsi_os': 17, 'rsi_ob': 88, 'vol_spike': 0.21127802426404824, 'adx_thresh': 7.308720896027884, 'atr_min_pct': 0.0007775024173919257, 'atr_max_pct': 0.06540739687592215, 'tp_mult': 2.515065498124935, 'tsl_mult': 0.9640457037002543, 'strategy': 'breakout', 'time_stop': 133, 'use_sma': False, 'use_atr': False, 'use_adx': True, 'use_ema': False, 'use_spike': False, 'rsi_required': True, 'edge_k': 0.08917393821196118, 'edge_cap': 0.877426446457945, 'bull_strategy': 'breakout', 'bull_bb_std_mult': 1.6096308909873485, 'bull_rsi_os': 23, 'bull_rsi_ob': 67, 'bull_adx_thresh': 24.426551871991613, 'bull_atr_min_pct': 0.004440840120775129, 'bull_atr_max_pct': 0.05562744146065263, 'bull_tp_mult': 2.925663900216651, 'bull_tsl_mult': 0.5825235672415536, 'bull_time_stop': 246, 'bull_use_sma': False, 'bull_use_ema': True, 'bull_use_atr': False, 'bull_use_adx': False, 'bull_use_spike': True, 'bull_rsi_required': True, 'bear_strategy': 'breakout', 'bear_bb_std_mult': 0.55098925139975, 'bear_rsi_os': 27, 'bear_rsi_ob': 88, 'bear_adx_thresh': 28.697732856460004, 'bear_atr_min_pct': 0.01543779277879896, 'bear_atr_max_pct': 0.14650252163756244, 'bear_tp_mult': 2.027372468177128, 'bear_tsl_mult': 0.20731243481044057, 'bear_time_stop': 181, 'bear_use_sma': False, 'bear_use_ema': False, 'bear_use_atr': True, 'bear_use_adx': False, 'bear_use_spike': False, 'bear_rsi_required': False, 'sideways_strategy': 'mean_reversion', 'sideways_bb_std_mult': 2.488753233714962, 'sideways_rsi_os': 44, 'sideways_rsi_ob': 72, 'sideways_adx_thresh': 11.643719084529236, 'sideways_atr_min_pct': 0.021604488823566186, 'sideways_atr_max_pct': 0.056564975999640416, 'sideways_tp_mult': 2.719030153496255, 'sideways_tsl_mult': 0.20661454088567854, 'sideways_time_stop': 289, 'sideways_use_sma': False, 'sideways_use_ema': True, 'sideways_use_atr': False, 'sideways_use_adx': True, 'sideways_use_spike': False, 'sideways_rsi_required': True}.
