[I 2025-08-31 00:33:51,945] Trial 268 finished with values: [-1000000000.0, 1000000000.0] and parameters: {'p_sma': 20, 'p_std': 43, 'p_atr': 24, 'p_adx': 10, 'rsi_period': 57, 'ema1': 6, 'ema2': 16, 'slip_atr_k': 0.034159187817988906, 'slip_spread_k': 0.1511844294311192, 'spread_hl_frac': 0.009491017717663966, 'bb_std_mult': 1.9093034752674702, 'rsi_os': 50, 'rsi_ob': 90, 'vol_spike': 0.2044239894381646, 'adx_thresh': 12.461759695525949, 'atr_min_pct': 0.004380135213083972, 'atr_max_pct': 0.12043377420862628, 'tp_mult': 1.0115182635644917, 'tsl_mult': 0.41803627472831945, 'strategy': 'breakout', 'time_stop': 101, 'use_sma': True, 'use_atr': True, 'use_adx': False, 'use_ema': True, 'use_spike': False, 'rsi_required': False, 'edge_k': 1.4599368180038952, 'edge_cap': 0.8154495930248461, 'bull_strategy': 'mean_reversion', 'bull_bb_std_mult': 3.2159752219390083, 'bull_rsi_os': 55, 'bull_rsi_ob': 70, 'bull_adx_thresh': 5.563091911948733, 'bull_atr_min_pct': 0.0011787316200671592, 'bull_atr_max_pct': 0.07588671771602107, 'bull_tp_mult': 2.60168641635049, 'bull_tsl_mult': 0.44792688924479523, 'bull_time_stop': 161, 'bull_use_sma': True, 'bull_use_ema': False, 'bull_use_atr': True, 'bull_use_adx': True, 'bull_use_spike': False, 'bull_rsi_required': False, 'bear_strategy': 'mean_reversion', 'bear_bb_std_mult': 1.102454944810564, 'bear_rsi_os': 24, 'bear_rsi_ob': 79, 'bear_adx_thresh': 12.642455941990734, 'bear_atr_min_pct': 0.027864064640150198, 'bear_atr_max_pct': 0.022902902213133784, 'bear_tp_mult': 1.2105661173119127, 'bear_tsl_mult': 0.7366414310439129, 'bear_time_stop': 24, 'bear_use_sma': True, 'bear_use_ema': False, 'bear_use_atr': False, 'bear_use_adx': True, 'bear_use_spike': True, 'bear_rsi_required': False, 'sideways_strategy': 'breakout', 'sideways_bb_std_mult': 2.138635057986141, 'sideways_rsi_os': 7, 'sideways_rsi_ob': 89, 'sideways_adx_thresh': 13.356146371636946, 'sideways_atr_min_pct': 0.006306594879609852, 'sideways_atr_max_pct': 0.1454851868685755, 'sideways_tp_mult': 1.7523126624171406, 'sideways_tsl_mult': 0.6646048065852119, 'sideways_time_stop': 165, 'sideways_use_sma': True, 'sideways_use_ema': False, 'sideways_use_atr': False, 'sideways_use_adx': False, 'sideways_use_spike': False, 'sideways_rsi_required': False}.
[I 2025-08-31 00:33:52,018] Trial 269 finished with values: [-1000000000.0, 1000000000.0] and parameters: {'p_sma': 6, 'p_std': 38, 'p_atr': 24, 'p_adx': 10, 'rsi_period': 57, 'ema1': 6, 'ema2': 52, 'slip_atr_k': 0.03976086835600551, 'slip_spread_k': 0.84879177206847, 'spread_hl_frac': 0.047204268760935544, 'bb_std_mult': 1.7085007364162295, 'rsi_os': 7, 'rsi_ob': 83, 'vol_spike': 0.19128394141536867, 'adx_thresh': 25.914420596156045, 'atr_min_pct': 0.004279579929612255, 'atr_max_pct': 0.06928454403412414, 'tp_mult': 2.6377588455639756, 'tsl_mult': 0.1884507325641534, 'strategy': 'breakout', 'time_stop': 99, 'use_sma': True, 'use_atr': False, 'use_adx': False, 'use_ema': True, 'use_spike': False, 'rsi_required': False, 'edge_k': 1.828842655775182, 'edge_cap': 0.8049655721610784, 'bull_strategy': 'breakout', 'bull_bb_std_mult': 3.313476335219132, 'bull_rsi_os': 25, 'bull_rsi_ob': 71, 'bull_adx_thresh': 13.034598063408328, 'bull_atr_min_pct': 0.01942522252490338, 'bull_atr_max_pct': 0.07405557128306461, 'bull_tp_mult': 2.6028251318309112, 'bull_tsl_mult': 0.49841035346034696, 'bull_time_stop': 161, 'bull_use_sma': False, 'bull_use_ema': False, 'bull_use_atr': True, 'bull_use_adx': True, 'bull_use_spike': False, 'bull_rsi_required': False, 'bear_strategy': 'mean_reversion', 'bear_bb_std_mult': 1.1003586122699023, 'bear_rsi_os': 22, 'bear_rsi_ob': 78, 'bear_adx_thresh': 6.918748474928833, 'bear_atr_min_pct': 0.027571302111165964, 'bear_atr_max_pct': 0.02039722760971826, 'bear_tp_mult': 2.4779834841729516, 'bear_tsl_mult': 0.5239944136158861, 'bear_time_stop': 24, 'bear_use_sma': True, 'bear_use_ema': False, 'bear_use_atr': False, 'bear_use_adx': True, 'bear_use_spike': True, 'bear_rsi_required': False, 'sideways_strategy': 'mean_reversion', 'sideways_bb_std_mult': 1.071709022383773, 'sideways_rsi_os': 46, 'sideways_rsi_ob': 82, 'sideways_adx_thresh': 13.370574123241962, 'sideways_atr_min_pct': 0.025909373364737892, 'sideways_atr_max_pct': 0.14449109825964265, 'sideways_tp_mult': 2.9579583309357265, 'sideways_tsl_mult': 0.7127388150141877, 'sideways_time_stop': 165, 'sideways_use_sma': True, 'sideways_use_ema': False, 'sideways_use_atr': True, 'sideways_use_adx': False, 'sideways_use_spike': False, 'sideways_rsi_required': False}.
[I 2025-08-31 00:34:20,665] Trial 272 finished with values: [-1000000000.0, 1000000000.0] and parameters: {'p_sma': 46, 'p_std': 38, 'p_atr': 22, 'p_adx': 11, 'rsi_period': 58, 'ema1': 8, 'ema2': 34, 'slip_atr_k': 0.118553311310799, 'slip_spread_k': 0.8532322994637664, 'spread_hl_frac': 0.037406194338050765, 'bb_std_mult': 1.6673270543881609, 'rsi_os': 12, 'rsi_ob': 53, 'vol_spike': 0.2158289965070213, 'adx_thresh': 28.009322149035242, 'atr_min_pct': 0.008581482786567136, 'atr_max_pct': 0.07451703550124963, 'tp_mult': 2.5974736052331777, 'tsl_mult': 0.18729592111123194, 'strategy': 'breakout', 'time_stop': 84, 'use_sma': True, 'use_atr': False, 'use_adx': False, 'use_ema': True, 'use_spike': True, 'rsi_required': False, 'edge_k': 0.7503528480167697, 'edge_cap': 0.8147461852585686, 'bull_strategy': 'mean_reversion', 'bull_bb_std_mult': 3.284138102865595, 'bull_rsi_os': 25, 'bull_rsi_ob': 71, 'bull_adx_thresh': 13.180941463641606, 'bull_atr_min_pct': 0.003161034224649943, 'bull_atr_max_pct': 0.07374311160693447, 'bull_tp_mult': 2.448166720300726, 'bull_tsl_mult': 0.17295413307203866, 'bull_time_stop': 215, 'bull_use_sma': False, 'bull_use_ema': False, 'bull_use_atr': True, 'bull_use_adx': True, 'bull_use_spike': False, 'bull_rsi_required': False, 'bear_strategy': 'mean_reversion', 'bear_bb_std_mult': 1.2558630079522923, 'bear_rsi_os': 22, 'bear_rsi_ob': 78, 'bear_adx_thresh': 8.198180004367009, 'bear_atr_min_pct': 0.008857433135262629, 'bear_atr_max_pct': 0.022576143896578523, 'bear_tp_mult': 1.8196775487081875, 'bear_tsl_mult': 0.7342721902340703, 'bear_time_stop': 25, 'bear_use_sma': True, 'bear_use_ema': True, 'bear_use_atr': False, 'bear_use_adx': False, 'bear_use_spike': False, 'bear_rsi_required': False, 'sideways_strategy': 'mean_reversion', 'sideways_bb_std_mult': 3.513892740782552, 'sideways_rsi_os': 45, 'sideways_rsi_ob': 91, 'sideways_adx_thresh': 13.383860806404554, 'sideways_atr_min_pct': 0.0060280963431054765, 'sideways_atr_max_pct': 0.019420279183204707, 'sideways_tp_mult': 2.976460347113912, 'sideways_tsl_mult': 0.6963960794384814, 'sideways_time_stop': 174, 'sideways_use_sma': True, 'sideways_use_ema': False, 'sideways_use_atr': True, 'sideways_use_adx': False, 'sideways_use_spike': False, 'sideways_rsi_required': False}.
[I 2025-08-31 00:34:21,924] Trial 274 finished with values: [-1000000000.0, 1000000000.0] and parameters: {'p_sma': 24, 'p_std': 39, 'p_atr': 26, 'p_adx': 18, 'rsi_period': 61, 'ema1': 8, 'ema2': 30, 'slip_atr_k': 0.1229449671141477, 'slip_spread_k': 0.855796614984357, 'spread_hl_frac': 0.007939300047846303, 'bb_std_mult': 1.696793941747715, 'rsi_os': 5, 'rsi_ob': 84, 'vol_spike': 0.21477493205440717, 'adx_thresh': 14.391026046105438, 'atr_min_pct': 0.007772669839909587, 'atr_max_pct': 0.14583163038189462, 'tp_mult': 2.5919584830175295, 'tsl_mult': 0.19380412739952863, 'strategy': 'breakout', 'time_stop': 80, 'use_sma': True, 'use_atr': False, 'use_adx': False, 'use_ema': True, 'use_spike': True, 'rsi_required': False, 'edge_k': 0.7510554752210533, 'edge_cap': 0.8557446066638713, 'bull_strategy': 'breakout', 'bull_bb_std_mult': 3.2799282116769226, 'bull_rsi_os': 38, 'bull_rsi_ob': 71, 'bull_adx_thresh': 19.662310886800338, 'bull_atr_min_pct': 0.019373522561095032, 'bull_atr_max_pct': 0.07367914132930664, 'bull_tp_mult': 2.437043527219387, 'bull_tsl_mult': 0.30949860091319653, 'bull_time_stop': 255, 'bull_use_sma': False, 'bull_use_ema': False, 'bull_use_atr': True, 'bull_use_adx': False, 'bull_use_spike': False, 'bull_rsi_required': False, 'bear_strategy': 'mean_reversion', 'bear_bb_std_mult': 0.8873302232052399, 'bear_rsi_os': 22, 'bear_rsi_ob': 78, 'bear_adx_thresh': 9.295701484775009, 'bear_atr_min_pct': 0.01868104882172427, 'bear_atr_max_pct': 0.027183248749239133, 'bear_tp_mult': 1.819215338782565, 'bear_tsl_mult': 0.6563992340133011, 'bear_time_stop': 16, 'bear_use_sma': True, 'bear_use_ema': True, 'bear_use_atr': False, 'bear_use_adx': True, 'bear_use_spike': False, 'bear_rsi_required': True, 'sideways_strategy': 'mean_reversion', 'sideways_bb_std_mult': 3.198567987383642, 'sideways_rsi_os': 50, 'sideways_rsi_ob': 93, 'sideways_adx_thresh': 33.735404788685706, 'sideways_atr_min_pct': 0.021347496762677814, 'sideways_atr_max_pct': 0.01897600222988033, 'sideways_tp_mult': 2.570288723778517, 'sideways_tsl_mult': 0.7138755902841256, 'sideways_time_stop': 173, 'sideways_use_sma': True, 'sideways_use_ema': False, 'sideways_use_atr': False, 'sideways_use_adx': False, 'sideways_use_spike': True, 'sideways_rsi_required': False}.
[I 2025-08-31 00:34:21,934] Trial 275 finished with values: [-1000000000.0, 1000000000.0] and parameters: {'p_sma': 15, 'p_std': 13, 'p_atr': 19, 'p_adx': 18, 'rsi_period': 61, 'ema1': 8, 'ema2': 19, 'slip_atr_k': 0.0258126640431869, 'slip_spread_k': 0.4271061786513666, 'spread_hl_frac': 0.0082021948929151, 'bb_std_mult': 1.1906072154912395, 'rsi_os': 12, 'rsi_ob': 53, 'vol_spike': 0.21720201661020824, 'adx_thresh': 14.354057661944381, 'atr_min_pct': 0.0074396341729304144, 'atr_max_pct': 0.07437743089626012, 'tp_mult': 2.60197416988066, 'tsl_mult': 0.13633241389412065, 'strategy': 'breakout', 'time_stop': 81, 'use_sma': False, 'use_atr': False, 'use_adx': False, 'use_ema': True, 'use_spike': True, 'rsi_required': False, 'edge_k': 0.7550006863697929, 'edge_cap': 0.8512087117125774, 'bull_strategy': 'breakout', 'bull_bb_std_mult': 2.7502492696725964, 'bull_rsi_os': 38, 'bull_rsi_ob': 71, 'bull_adx_thresh': 14.256962720635919, 'bull_atr_min_pct': 0.003302564136499676, 'bull_atr_max_pct': 0.06504543304573748, 'bull_tp_mult': 2.4542713648682097, 'bull_tsl_mult': 0.9137760554747321, 'bull_time_stop': 172, 'bull_use_sma': False, 'bull_use_ema': False, 'bull_use_atr': True, 'bull_use_adx': False, 'bull_use_spike': True, 'bull_rsi_required': False, 'bear_strategy': 'mean_reversion', 'bear_bb_std_mult': 1.03557361207646, 'bear_rsi_os': 23, 'bear_rsi_ob': 91, 'bear_adx_thresh': 9.578274219696898, 'bear_atr_min_pct': 0.01872849970562822, 'bear_atr_max_pct': 0.027764160164853245, 'bear_tp_mult': 2.9069501645505325, 'bear_tsl_mult': 0.6625266834380242, 'bear_time_stop': 14, 'bear_use_sma': True, 'bear_use_ema': True, 'bear_use_atr': False, 'bear_use_adx': False, 'bear_use_spike': False, 'bear_rsi_required': True, 'sideways_strategy': 'mean_reversion', 'sideways_bb_std_mult': 1.1710165421406291, 'sideways_rsi_os': 50, 'sideways_rsi_ob': 94, 'sideways_adx_thresh': 33.86647801153596, 'sideways_atr_min_pct': 0.02055731620561888, 'sideways_atr_max_pct': 0.08488295802095933, 'sideways_tp_mult': 2.1190979738142426, 'sideways_tsl_mult': 0.8644914692006936, 'sideways_time_stop': 174, 'sideways_use_sma': True, 'sideways_use_ema': False, 'sideways_use_atr': False, 'sideways_use_adx': True, 'sideways_use_spike': True, 'sideways_rsi_required': False}.
[I 2025-08-31 00:34:22,109] Trial 273 finished with values: [-1000000000.0, 1000000000.0] and parameters: {'p_sma': 25, 'p_std': 18, 'p_atr': 22, 'p_adx': 18, 'rsi_period': 57, 'ema1': 8, 'ema2': 34, 'slip_atr_k': 0.039479579079933054, 'slip_spread_k': 0.42683596406501234, 'spread_hl_frac': 0.009653911521295265, 'bb_std_mult': 1.703642711036546, 'rsi_os': 12, 'rsi_ob': 84, 'vol_spike': 0.21539540930955087, 'adx_thresh': 24.786528384253188, 'atr_min_pct': 0.016191018893077627, 'atr_max_pct': 0.14684310289376945, 'tp_mult': 1.0126345564241463, 'tsl_mult': 0.1813951761464962, 'strategy': 'breakout', 'time_stop': 83, 'use_sma': True, 'use_atr': False, 'use_adx': False, 'use_ema': True, 'use_spike': True, 'rsi_required': False, 'edge_k': 0.29021910161354514, 'edge_cap': 0.8140294363851386, 'bull_strategy': 'breakout', 'bull_bb_std_mult': 2.862884550889028, 'bull_rsi_os': 20, 'bull_rsi_ob': 71, 'bull_adx_thresh': 7.666172126874162, 'bull_atr_min_pct': 0.022210259301751897, 'bull_atr_max_pct': 0.07458987752255263, 'bull_tp_mult': 2.568649251770087, 'bull_tsl_mult': 0.913520909695639, 'bull_time_stop': 173, 'bull_use_sma': False, 'bull_use_ema': False, 'bull_use_atr': True, 'bull_use_adx': True, 'bull_use_spike': False, 'bull_rsi_required': False, 'bear_strategy': 'mean_reversion', 'bear_bb_std_mult': 1.055584533914691, 'bear_rsi_os': 22, 'bear_rsi_ob': 79, 'bear_adx_thresh': 13.195157541387093, 'bear_atr_min_pct': 0.009759520210725786, 'bear_atr_max_pct': 0.027421237080668424, 'bear_tp_mult': 2.1906472371872536, 'bear_tsl_mult': 0.7359572274723303, 'bear_time_stop': 17, 'bear_use_sma': True, 'bear_use_ema': True, 'bear_use_atr': False, 'bear_use_adx': True, 'bear_use_spike': False, 'bear_rsi_required': False, 'sideways_strategy': 'mean_reversion', 'sideways_bb_std_mult': 3.2232306987048345, 'sideways_rsi_os': 45, 'sideways_rsi_ob': 89, 'sideways_adx_thresh': 12.232481318759726, 'sideways_atr_min_pct': 0.016306328006187403, 'sideways_atr_max_pct': 0.09149431720451337, 'sideways_tp_mult': 2.216306744901987, 'sideways_tsl_mult': 0.7136204365776874, 'sideways_time_stop': 174, 'sideways_use_sma': True, 'sideways_use_ema': False, 'sideways_use_atr': False, 'sideways_use_adx': False, 'sideways_use_spike': True, 'sideways_rsi_required': False}.
[I 2025-08-31 00:34:52,812] Trial 277 finished with values: [-1000000000.0, 1000000000.0] and parameters: {'p_sma': 57, 'p_std': 40, 'p_atr': 20, 'p_adx': 13, 'rsi_period': 50, 'ema1': 7, 'ema2': 12, 'slip_atr_k': 0.04539277282836878, 'slip_spread_k': 0.9124181716973794, 'spread_hl_frac': 0.033771656155497064, 'bb_std_mult': 1.4359577295974324, 'rsi_os': 53, 'rsi_ob': 66, 'vol_spike': 0.17579748226420747, 'adx_thresh': 12.982819814969814, 'atr_min_pct': 0.016869722017665352, 'atr_max_pct': 0.1378476070165783, 'tp_mult': 2.7466943367003447, 'tsl_mult': 0.9993565667210191, 'strategy': 'breakout', 'time_stop': 72, 'use_sma': True, 'use_atr': False, 'use_adx': True, 'use_ema': True, 'use_spike': False, 'rsi_required': False, 'edge_k': 0.17109054678966318, 'edge_cap': 0.8378455370659681, 'bull_strategy': 'breakout', 'bull_bb_std_mult': 2.6366227614829336, 'bull_rsi_os': 51, 'bull_rsi_ob': 69, 'bull_adx_thresh': 15.383759552690307, 'bull_atr_min_pct': 0.005430914221840978, 'bull_atr_max_pct': 0.06031568801521418, 'bull_tp_mult': 2.353517366073588, 'bull_tsl_mult': 0.5187914819688002, 'bull_time_stop': 269, 'bull_use_sma': False, 'bull_use_ema': False, 'bull_use_atr': True, 'bull_use_adx': True, 'bull_use_spike': False, 'bull_rsi_required': True, 'bear_strategy': 'mean_reversion', 'bear_bb_std_mult': 1.1659271913653604, 'bear_rsi_os': 51, 'bear_rsi_ob': 57, 'bear_adx_thresh': 19.203976801625238, 'bear_atr_min_pct': 0.017257113258019617, 'bear_atr_max_pct': 0.014019279328957898, 'bear_tp_mult': 1.9348045304169912, 'bear_tsl_mult': 0.49736760492412346, 'bear_time_stop': 29, 'bear_use_sma': True, 'bear_use_ema': False, 'bear_use_atr': False, 'bear_use_adx': True, 'bear_use_spike': False, 'bear_rsi_required': False, 'sideways_strategy': 'mean_reversion', 'sideways_bb_std_mult': 2.6286833573422346, 'sideways_rsi_os': 28, 'sideways_rsi_ob': 90, 'sideways_adx_thresh': 8.819749669724951, 'sideways_atr_min_pct': 0.02317745898884905, 'sideways_atr_max_pct': 0.14875640336474935, 'sideways_tp_mult': 1.0554019027357815, 'sideways_tsl_mult': 0.6008368686855328, 'sideways_time_stop': 154, 'sideways_use_sma': True, 'sideways_use_ema': True, 'sideways_use_atr': False, 'sideways_use_adx': False, 'sideways_use_spike': True, 'sideways_rsi_required': True}.
[I 2025-08-31 00:34:53,731] Trial 276 finished with values: [-0.023495474449766185, 0.02341246812689568] and parameters: {'p_sma': 33, 'p_std': 13, 'p_atr': 19, 'p_adx': 18, 'rsi_period': 61, 'ema1': 7, 'ema2': 19, 'slip_atr_k': 0.02484542593649775, 'slip_spread_k': 0.12621126843701197, 'spread_hl_frac': 0.02388982107353761, 'bb_std_mult': 2.2890523576793798, 'rsi_os': 53, 'rsi_ob': 70, 'vol_spike': 0.1366303601539624, 'adx_thresh': 24.485198592985714, 'atr_min_pct': 0.007416354949451295, 'atr_max_pct': 0.04048261862095621, 'tp_mult': 2.576203800355789, 'tsl_mult': 0.13213797968033683, 'strategy': 'breakout', 'time_stop': 81, 'use_sma': False, 'use_atr': False, 'use_adx': True, 'use_ema': True, 'use_spike': True, 'rsi_required': False, 'edge_k': 0.2718145475807323, 'edge_cap': 0.8509957871337452, 'bull_strategy': 'breakout', 'bull_bb_std_mult': 2.744767731337224, 'bull_rsi_os': 51, 'bull_rsi_ob': 69, 'bull_adx_thresh': 14.42704358894644, 'bull_atr_min_pct': 0.0009658483872911165, 'bull_atr_max_pct': 0.06462608156252192, 'bull_tp_mult': 2.452326049921651, 'bull_tsl_mult': 0.9032795884623441, 'bull_time_stop': 255, 'bull_use_sma': False, 'bull_use_ema': False, 'bull_use_atr': True, 'bull_use_adx': False, 'bull_use_spike': True, 'bull_rsi_required': True, 'bear_strategy': 'mean_reversion', 'bear_bb_std_mult': 0.9205310950846395, 'bear_rsi_os': 20, 'bear_rsi_ob': 57, 'bear_adx_thresh': 13.308944796500253, 'bear_atr_min_pct': 0.018570751216557237, 'bear_atr_max_pct': 0.026765803652696152, 'bear_tp_mult': 1.320514907794931, 'bear_tsl_mult': 0.6506945420647344, 'bear_time_stop': 34, 'bear_use_sma': True, 'bear_use_ema': True, 'bear_use_atr': False, 'bear_use_adx': True, 'bear_use_spike': False, 'bear_rsi_required': True, 'sideways_strategy': 'mean_reversion', 'sideways_bb_std_mult': 3.1925978404451927, 'sideways_rsi_os': 28, 'sideways_rsi_ob': 93, 'sideways_adx_thresh': 18.208266496963518, 'sideways_atr_min_pct': 0.010127228246572759, 'sideways_atr_max_pct': 0.14903098224434091, 'sideways_tp_mult': 2.2279849094365836, 'sideways_tsl_mult': 0.8637410981640969, 'sideways_time_stop': 194, 'sideways_use_sma': True, 'sideways_use_ema': True, 'sideways_use_atr': False, 'sideways_use_adx': True, 'sideways_use_spike': True, 'sideways_rsi_required': False}.
[I 2025-08-31 00:34:53,743] Trial 279 finished with values: [-1000000000.0, 1000000000.0] and parameters: {'p_sma': 49, 'p_std': 52, 'p_atr': 28, 'p_adx': 13, 'rsi_period': 50, 'ema1': 7, 'ema2': 19, 'slip_atr_k': 0.046308219226941144, 'slip_spread_k': 0.911456492941511, 'spread_hl_frac': 0.010544515132328347, 'bb_std_mult': 2.220318984605623, 'rsi_os': 53, 'rsi_ob': 70, 'vol_spike': 0.17674203461238527, 'adx_thresh': 11.316768512541298, 'atr_min_pct': 0.010576214243184268, 'atr_max_pct': 0.13542183073642627, 'tp_mult': 2.649002881964785, 'tsl_mult': 0.5935947865520618, 'strategy': 'breakout', 'time_stop': 74, 'use_sma': False, 'use_atr': False, 'use_adx': True, 'use_ema': True, 'use_spike': False, 'rsi_required': False, 'edge_k': 0.7917399653690297, 'edge_cap': 0.8314741967394603, 'bull_strategy': 'breakout', 'bull_bb_std_mult': 3.0451078573745, 'bull_rsi_os': 51, 'bull_rsi_ob': 69, 'bull_adx_thresh': 15.170856060522391, 'bull_atr_min_pct': 0.010215952260755525, 'bull_atr_max_pct': 0.0815564156881556, 'bull_tp_mult': 2.367093461974215, 'bull_tsl_mult': 0.3261186985022802, 'bull_time_stop': 267, 'bull_use_sma': False, 'bull_use_ema': False, 'bull_use_atr': True, 'bull_use_adx': True, 'bull_use_spike': True, 'bull_rsi_required': True, 'bear_strategy': 'mean_reversion', 'bear_bb_std_mult': 0.9391647921099693, 'bear_rsi_os': 20, 'bear_rsi_ob': 81, 'bear_adx_thresh': 11.150336714038112, 'bear_atr_min_pct': 0.00813159916550329, 'bear_atr_max_pct': 0.012978680733298446, 'bear_tp_mult': 2.360963752778191, 'bear_tsl_mult': 0.5913628798857975, 'bear_time_stop': 33, 'bear_use_sma': True, 'bear_use_ema': False, 'bear_use_atr': False, 'bear_use_adx': True, 'bear_use_spike': False, 'bear_rsi_required': False, 'sideways_strategy': 'mean_reversion', 'sideways_bb_std_mult': 1.6266360283359456, 'sideways_rsi_os': 48, 'sideways_rsi_ob': 87, 'sideways_adx_thresh': 6.488578417877603, 'sideways_atr_min_pct': 0.022931285094932977, 'sideways_atr_max_pct': 0.1497005490518006, 'sideways_tp_mult': 2.823399109719774, 'sideways_tsl_mult': 0.6160055838425502, 'sideways_time_stop': 147, 'sideways_use_sma': True, 'sideways_use_ema': True, 'sideways_use_atr': False, 'sideways_use_adx': True, 'sideways_use_spike': True, 'sideways_rsi_required': True}.
