[I 2025-08-31 00:34:53,845] Trial 278 finished with values: [-1000000000.0, 1000000000.0] and parameters: {'p_sma': 59, 'p_std': 40, 'p_atr': 20, 'p_adx': 13, 'rsi_period': 55, 'ema1': 12, 'ema2': 49, 'slip_atr_k': 0.04350223623693072, 'slip_spread_k': 0.5831915272721824, 'spread_hl_frac': 0.03396164754008283, 'bb_std_mult': 2.2914092315172034, 'rsi_os': 53, 'rsi_ob': 70, 'vol_spike': 0.17641358935105797, 'adx_thresh': 19.558759623534495, 'atr_min_pct': 0.016026491550711584, 'atr_max_pct': 0.0398914150498074, 'tp_mult': 2.560483725904035, 'tsl_mult': 0.6990590851165854, 'strategy': 'breakout', 'time_stop': 74, 'use_sma': True, 'use_atr': False, 'use_adx': True, 'use_ema': True, 'use_spike': False, 'rsi_required': False, 'edge_k': 1.4018666968698592, 'edge_cap': 0.8287854024733292, 'bull_strategy': 'breakout', 'bull_bb_std_mult': 2.8471122787888246, 'bull_rsi_os': 46, 'bull_rsi_ob': 69, 'bull_adx_thresh': 15.295626331956568, 'bull_atr_min_pct': 0.008370705431443935, 'bull_atr_max_pct': 0.06109506917155243, 'bull_tp_mult': 2.3690361799660677, 'bull_tsl_mult': 0.5201062468902846, 'bull_time_stop': 269, 'bull_use_sma': False, 'bull_use_ema': False, 'bull_use_atr': True, 'bull_use_adx': True, 'bull_use_spike': False, 'bull_rsi_required': True, 'bear_strategy': 'mean_reversion', 'bear_bb_std_mult': 0.9404943380411839, 'bear_rsi_os': 20, 'bear_rsi_ob': 81, 'bear_adx_thresh': 13.233985075868254, 'bear_atr_min_pct': 0.00969605703301203, 'bear_atr_max_pct': 0.015070178219058573, 'bear_tp_mult': 1.6696869194571895, 'bear_tsl_mult': 0.8604372958551147, 'bear_time_stop': 33, 'bear_use_sma': True, 'bear_use_ema': False, 'bear_use_atr': False, 'bear_use_adx': True, 'bear_use_spike': False, 'bear_rsi_required': False, 'sideways_strategy': 'mean_reversion', 'sideways_bb_std_mult': 2.3248943189310305, 'sideways_rsi_os': 48, 'sideways_rsi_ob': 87, 'sideways_adx_thresh': 9.004820195012666, 'sideways_atr_min_pct': 0.02307309008801487, 'sideways_atr_max_pct': 0.09042945883164186, 'sideways_tp_mult': 2.299568801317837, 'sideways_tsl_mult': 0.9037226099083501, 'sideways_time_stop': 195, 'sideways_use_sma': True, 'sideways_use_ema': True, 'sideways_use_atr': False, 'sideways_use_adx': False, 'sideways_use_spike': True, 'sideways_rsi_required': True}.
[I 2025-08-31 00:34:54,398] Trial 282 finished with values: [-1000000000.0, 1000000000.0] and parameters: {'p_sma': 47, 'p_std': 40, 'p_atr': 23, 'p_adx': 9, 'rsi_period': 59, 'ema1': 7, 'ema2': 19, 'slip_atr_k': 0.23780737775931082, 'slip_spread_k': 0.5603842667746963, 'spread_hl_frac': 0.023525462462323392, 'bb_std_mult': 2.1635566665099324, 'rsi_os': 54, 'rsi_ob': 63, 'vol_spike': 0.13956662341678128, 'adx_thresh': 21.537069794541292, 'atr_min_pct': 0.00984379040223839, 'atr_max_pct': 0.08752998829770177, 'tp_mult': 2.056466765378279, 'tsl_mult': 0.07437706191221213, 'strategy': 'mean_reversion', 'time_stop': 88, 'use_sma': True, 'use_atr': False, 'use_adx': False, 'use_ema': True, 'use_spike': False, 'rsi_required': False, 'edge_k': 1.3132710061260524, 'edge_cap': 0.7873575176565709, 'bull_strategy': 'mean_reversion', 'bull_bb_std_mult': 3.1572770010381737, 'bull_rsi_os': 37, 'bull_rsi_ob': 72, 'bull_adx_thresh': 14.516588023202218, 'bull_atr_min_pct': 0.0009490121779377307, 'bull_atr_max_pct': 0.0778937071519583, 'bull_tp_mult': 2.488191225433994, 'bull_tsl_mult': 0.8540601641965899, 'bull_time_stop': 105, 'bull_use_sma': False, 'bull_use_ema': False, 'bull_use_atr': True, 'bull_use_adx': False, 'bull_use_spike': False, 'bull_rsi_required': False, 'bear_strategy': 'mean_reversion', 'bear_bb_std_mult': 1.0022465373880551, 'bear_rsi_os': 23, 'bear_rsi_ob': 45, 'bear_adx_thresh': 6.359748980044493, 'bear_atr_min_pct': 0.000854431576353034, 'bear_atr_max_pct': 0.021719154990897847, 'bear_tp_mult': 1.900392543025945, 'bear_tsl_mult': 0.6926398391345877, 'bear_time_stop': 35, 'bear_use_sma': True, 'bear_use_ema': False, 'bear_use_atr': False, 'bear_use_adx': False, 'bear_use_spike': False, 'bear_rsi_required': False, 'sideways_strategy': 'breakout', 'sideways_bb_std_mult': 1.1928794198205999, 'sideways_rsi_os': 54, 'sideways_rsi_ob': 83, 'sideways_adx_thresh': 9.289061426355204, 'sideways_atr_min_pct': 0.02167754051653517, 'sideways_atr_max_pct': 0.061704640856832096, 'sideways_tp_mult': 1.0562376361896415, 'sideways_tsl_mult': 0.9694819393703803, 'sideways_time_stop': 179, 'sideways_use_sma': True, 'sideways_use_ema': False, 'sideways_use_atr': False, 'sideways_use_adx': False, 'sideways_use_spike': True, 'sideways_rsi_required': False}.
[I 2025-08-31 00:34:54,398] Trial 281 finished with values: [-1000000000.0, 1000000000.0] and parameters: {'p_sma': 40, 'p_std': 40, 'p_atr': 23, 'p_adx': 9, 'rsi_period': 59, 'ema1': 7, 'ema2': 19, 'slip_atr_k': 0.23887392334336174, 'slip_spread_k': 0.5596638256303876, 'spread_hl_frac': 0.006743433149612864, 'bb_std_mult': 2.54043573078405, 'rsi_os': 54, 'rsi_ob': 51, 'vol_spike': 0.24515763273994476, 'adx_thresh': 21.522506815047702, 'atr_min_pct': 0.010265604220429278, 'atr_max_pct': 0.04098357651293478, 'tp_mult': 1.84745640284262, 'tsl_mult': 0.9318593006196519, 'strategy': 'mean_reversion', 'time_stop': 89, 'use_sma': True, 'use_atr': False, 'use_adx': False, 'use_ema': True, 'use_spike': False, 'rsi_required': False, 'edge_k': 1.8776095812837263, 'edge_cap': 0.7973839239534042, 'bull_strategy': 'mean_reversion', 'bull_bb_std_mult': 2.7004032451179323, 'bull_rsi_os': 37, 'bull_rsi_ob': 72, 'bull_adx_thresh': 14.369820536722779, 'bull_atr_min_pct': 0.0010278719400956787, 'bull_atr_max_pct': 0.07755991212982613, 'bull_tp_mult': 2.5036564490782323, 'bull_tsl_mult': 0.8576101122106264, 'bull_time_stop': 236, 'bull_use_sma': False, 'bull_use_ema': False, 'bull_use_atr': True, 'bull_use_adx': False, 'bull_use_spike': False, 'bull_rsi_required': False, 'bear_strategy': 'mean_reversion', 'bear_bb_std_mult': 1.028680953658587, 'bear_rsi_os': 23, 'bear_rsi_ob': 77, 'bear_adx_thresh': 7.714274315677467, 'bear_atr_min_pct': 0.023011746173671972, 'bear_atr_max_pct': 0.022037230515699335, 'bear_tp_mult': 1.8975656469644397, 'bear_tsl_mult': 0.6928774145269652, 'bear_time_stop': 33, 'bear_use_sma': True, 'bear_use_ema': False, 'bear_use_atr': False, 'bear_use_adx': False, 'bear_use_spike': False, 'bear_rsi_required': False, 'sideways_strategy': 'breakout', 'sideways_bb_std_mult': 1.2136073873848925, 'sideways_rsi_os': 54, 'sideways_rsi_ob': 83, 'sideways_adx_thresh': 16.162824415281925, 'sideways_atr_min_pct': 0.021452054935870442, 'sideways_atr_max_pct': 0.13996265668076588, 'sideways_tp_mult': 2.2816788366388807, 'sideways_tsl_mult': 0.8957595481828908, 'sideways_time_stop': 194, 'sideways_use_sma': True, 'sideways_use_ema': False, 'sideways_use_atr': False, 'sideways_use_adx': False, 'sideways_use_spike': True, 'sideways_rsi_required': False}.
[I 2025-08-31 00:34:54,404] Trial 283 finished with values: [-1000000000.0, 1000000000.0] and parameters: {'p_sma': 40, 'p_std': 39, 'p_atr': 23, 'p_adx': 9, 'rsi_period': 56, 'ema1': 7, 'ema2': 45, 'slip_atr_k': 0.03274296340716905, 'slip_spread_k': 0.07286289328736606, 'spread_hl_frac': 0.009636236583082448, 'bb_std_mult': 2.423370369946684, 'rsi_os': 54, 'rsi_ob': 73, 'vol_spike': 0.24279131449249708, 'adx_thresh': 21.56322108087743, 'atr_min_pct': 0.010281076117318794, 'atr_max_pct': 0.06783089050967558, 'tp_mult': 2.6925502615986177, 'tsl_mult': 0.07854603148331432, 'strategy': 'mean_reversion', 'time_stop': 89, 'use_sma': False, 'use_atr': True, 'use_adx': False, 'use_ema': True, 'use_spike': False, 'rsi_required': False, 'edge_k': 0.8075208530809045, 'edge_cap': 0.7886884967020518, 'bull_strategy': 'mean_reversion', 'bull_bb_std_mult': 2.7175343594026584, 'bull_rsi_os': 19, 'bull_rsi_ob': 80, 'bull_adx_thresh': 27.958666013784413, 'bull_atr_min_pct': 0.0010892726639139822, 'bull_atr_max_pct': 0.07789169176653522, 'bull_tp_mult': 2.478807600405534, 'bull_tsl_mult': 0.09179395206058905, 'bull_time_stop': 112, 'bull_use_sma': True, 'bull_use_ema': False, 'bull_use_atr': True, 'bull_use_adx': False, 'bull_use_spike': True, 'bull_rsi_required': False, 'bear_strategy': 'mean_reversion', 'bear_bb_std_mult': 1.021257437249966, 'bear_rsi_os': 23, 'bear_rsi_ob': 86, 'bear_adx_thresh': 8.844177515300498, 'bear_atr_min_pct': 0.0016775534357434847, 'bear_atr_max_pct': 0.022165131935859228, 'bear_tp_mult': 1.9379844832048374, 'bear_tsl_mult': 0.7007874691393683, 'bear_time_stop': 36, 'bear_use_sma': True, 'bear_use_ema': False, 'bear_use_atr': False, 'bear_use_adx': False, 'bear_use_spike': False, 'bear_rsi_required': False, 'sideways_strategy': 'breakout', 'sideways_bb_std_mult': 2.390637649727526, 'sideways_rsi_os': 54, 'sideways_rsi_ob': 83, 'sideways_adx_thresh': 16.323819986704567, 'sideways_atr_min_pct': 0.021886471679943405, 'sideways_atr_max_pct': 0.1393033783738499, 'sideways_tp_mult': 1.012653202751721, 'sideways_tsl_mult': 0.8455804370522298, 'sideways_time_stop': 181, 'sideways_use_sma': True, 'sideways_use_ema': False, 'sideways_use_atr': False, 'sideways_use_adx': True, 'sideways_use_spike': True, 'sideways_rsi_required': False}.
[I 2025-08-31 00:35:19,056] Trial 280 finished with values: [-1000000000.0, 1000000000.0] and parameters: {'p_sma': 33, 'p_std': 25, 'p_atr': 23, 'p_adx': 21, 'rsi_period': 55, 'ema1': 12, 'ema2': 19, 'slip_atr_k': 0.0315430747165777, 'slip_spread_k': 0.08178965649759501, 'spread_hl_frac': 0.01075324047367449, 'bb_std_mult': 2.2310458837371883, 'rsi_os': 43, 'rsi_ob': 70, 'vol_spike': 0.13821626861044503, 'adx_thresh': 21.540534314372398, 'atr_min_pct': 0.01061172325373512, 'atr_max_pct': 0.07736449348645849, 'tp_mult': 1.8680731988842925, 'tsl_mult': 0.9280423254530324, 'strategy': 'breakout', 'time_stop': 87, 'use_sma': False, 'use_atr': False, 'use_adx': True, 'use_ema': True, 'use_spike': False, 'rsi_required': False, 'edge_k': 0.7909318617809058, 'edge_cap': 0.7868178170891145, 'bull_strategy': 'breakout', 'bull_bb_std_mult': 2.670844473334099, 'bull_rsi_os': 37, 'bull_rsi_ob': 69, 'bull_adx_thresh': 14.633798346517217, 'bull_atr_min_pct': 0.01026703148883535, 'bull_atr_max_pct': 0.08107538537368637, 'bull_tp_mult': 2.4952711450899048, 'bull_tsl_mult': 0.08944878269420914, 'bull_time_stop': 208, 'bull_use_sma': False, 'bull_use_ema': False, 'bull_use_atr': True, 'bull_use_adx': True, 'bull_use_spike': True, 'bull_rsi_required': True, 'bear_strategy': 'mean_reversion', 'bear_bb_std_mult': 0.9447934395724145, 'bear_rsi_os': 20, 'bear_rsi_ob': 81, 'bear_adx_thresh': 10.939559450502234, 'bear_atr_min_pct': 0.022942175733583186, 'bear_atr_max_pct': 0.022130975525389625, 'bear_tp_mult': 1.6674673460411578, 'bear_tsl_mult': 0.639402032500239, 'bear_time_stop': 35, 'bear_use_sma': True, 'bear_use_ema': False, 'bear_use_atr': False, 'bear_use_adx': True, 'bear_use_spike': False, 'bear_rsi_required': False, 'sideways_strategy': 'mean_reversion', 'sideways_bb_std_mult': 1.18349656790486, 'sideways_rsi_os': 48, 'sideways_rsi_ob': 88, 'sideways_adx_thresh': 20.915677568339028, 'sideways_atr_min_pct': 0.021855201370113164, 'sideways_atr_max_pct': 0.14173471008632538, 'sideways_tp_mult': 2.833852649735739, 'sideways_tsl_mult': 0.8969117739438761, 'sideways_time_stop': 148, 'sideways_use_sma': True, 'sideways_use_ema': True, 'sideways_use_atr': False, 'sideways_use_adx': True, 'sideways_use_spike': True, 'sideways_rsi_required': False}.
[I 2025-08-31 00:35:24,532] Trial 286 finished with values: [-1000000000.0, 1000000000.0] and parameters: {'p_sma': 48, 'p_std': 25, 'p_atr': 19, 'p_adx': 9, 'rsi_period': 60, 'ema1': 7, 'ema2': 14, 'slip_atr_k': 0.026917089791496984, 'slip_spread_k': 0.09228326010028357, 'spread_hl_frac': 0.008447330850867686, 'bb_std_mult': 1.7925036580853437, 'rsi_os': 21, 'rsi_ob': 78, 'vol_spike': 0.2368764733503924, 'adx_thresh': 15.644563069257028, 'atr_min_pct': 0.005317894951313758, 'atr_max_pct': 0.08149723287705814, 'tp_mult': 1.6597490622853737, 'tsl_mult': 0.8233881939635657, 'strategy': 'breakout', 'time_stop': 95, 'use_sma': True, 'use_atr': True, 'use_adx': False, 'use_ema': True, 'use_spike': False, 'rsi_required': False, 'edge_k': 1.2055668842948402, 'edge_cap': 0.8601869972444304, 'bull_strategy': 'breakout', 'bull_bb_std_mult': 3.541431559782623, 'bull_rsi_os': 28, 'bull_rsi_ob': 45, 'bull_adx_thresh': 13.883468984513692, 'bull_atr_min_pct': 0.00699100465643461, 'bull_atr_max_pct': 0.07233063250127243, 'bull_tp_mult': 2.4596029015665937, 'bull_tsl_mult': 0.8232821752738302, 'bull_time_stop': 58, 'bull_use_sma': False, 'bull_use_ema': False, 'bull_use_atr': True, 'bull_use_adx': True, 'bull_use_spike': False, 'bull_rsi_required': False, 'bear_strategy': 'mean_reversion', 'bear_bb_std_mult': 1.2088404354768079, 'bear_rsi_os': 48, 'bear_rsi_ob': 79, 'bear_adx_thresh': 11.939928985942702, 'bear_atr_min_pct': 0.008392111624362762, 'bear_atr_max_pct': 0.010156914733552153, 'bear_tp_mult': 1.3085857289190466, 'bear_tsl_mult': 0.6706745839381818, 'bear_time_stop': 21, 'bear_use_sma': True, 'bear_use_ema': False, 'bear_use_atr': False, 'bear_use_adx': True, 'bear_use_spike': True, 'bear_rsi_required': True, 'sideways_strategy': 'mean_reversion', 'sideways_bb_std_mult': 2.5629631267846187, 'sideways_rsi_os': 47, 'sideways_rsi_ob': 93, 'sideways_adx_thresh': 14.962423479464702, 'sideways_atr_min_pct': 0.0208608025620136, 'sideways_atr_max_pct': 0.02696315634798671, 'sideways_tp_mult': 1.1032279968047467, 'sideways_tsl_mult': 0.7653556479080654, 'sideways_time_stop': 169, 'sideways_use_sma': True, 'sideways_use_ema': False, 'sideways_use_atr': False, 'sideways_use_adx': False, 'sideways_use_spike': False, 'sideways_rsi_required': False}.
[I 2025-08-31 00:35:24,810] Trial 285 finished with values: [-1000000000.0, 1000000000.0] and parameters: {'p_sma': 9, 'p_std': 22, 'p_atr': 25, 'p_adx': 9, 'rsi_period': 56, 'ema1': 7, 'ema2': 27, 'slip_atr_k': 0.033727659319734656, 'slip_spread_k': 0.0730694200927478, 'spread_hl_frac': 0.046323095637513904, 'bb_std_mult': 1.8115674954110506, 'rsi_os': 22, 'rsi_ob': 73, 'vol_spike': 0.2280676674814005, 'adx_thresh': 15.17303981307992, 'atr_min_pct': 0.00561761012014194, 'atr_max_pct': 0.10857203958281283, 'tp_mult': 1.4000452158738683, 'tsl_mult': 0.10943767283454031, 'strategy': 'breakout', 'time_stop': 66, 'use_sma': False, 'use_atr': True, 'use_adx': False, 'use_ema': True, 'use_spike': False, 'rsi_required': False, 'edge_k': 0.7845840692866953, 'edge_cap': 0.8619167190043002, 'bull_strategy': 'breakout', 'bull_bb_std_mult': 2.9952794764409125, 'bull_rsi_os': 41, 'bull_rsi_ob': 74, 'bull_adx_thresh': 13.842320427918747, 'bull_atr_min_pct': 0.009098916550177081, 'bull_atr_max_pct': 0.07189044484972526, 'bull_tp_mult': 2.4506376220662958, 'bull_tsl_mult': 0.304932859553718, 'bull_time_stop': 125, 'bull_use_sma': True, 'bull_use_ema': False, 'bull_use_atr': True, 'bull_use_adx': True, 'bull_use_spike': True, 'bull_rsi_required': False, 'bear_strategy': 'mean_reversion', 'bear_bb_std_mult': 1.2229246553961952, 'bear_rsi_os': 48, 'bear_rsi_ob': 79, 'bear_adx_thresh': 11.974928801199157, 'bear_atr_min_pct': 0.008364030973857375, 'bear_atr_max_pct': 0.01866865449469882, 'bear_tp_mult': 1.3168339975252805, 'bear_tsl_mult': 0.6742932175841971, 'bear_time_stop': 20, 'bear_use_sma': True, 'bear_use_ema': False, 'bear_use_atr': False, 'bear_use_adx': True, 'bear_use_spike': True, 'bear_rsi_required': True, 'sideways_strategy': 'mean_reversion', 'sideways_bb_std_mult': 2.414806132525288, 'sideways_rsi_os': 47, 'sideways_rsi_ob': 80, 'sideways_adx_thresh': 15.273674044531559, 'sideways_atr_min_pct': 0.028971573342716585, 'sideways_atr_max_pct': 0.025239480376242684, 'sideways_tp_mult': 2.0231455141766053, 'sideways_tsl_mult': 0.7674019451607416, 'sideways_time_stop': 168, 'sideways_use_sma': True, 'sideways_use_ema': False, 'sideways_use_atr': False, 'sideways_use_adx': True, 'sideways_use_spike': True, 'sideways_rsi_required': False}.
[I 2025-08-31 00:35:25,034] Trial 284 finished with values: [-1000000000.0, 1000000000.0] and parameters: {'p_sma': 36, 'p_std': 25, 'p_atr': 25, 'p_adx': 9, 'rsi_period': 60, 'ema1': 7, 'ema2': 45, 'slip_atr_k': 0.20096275759125387, 'slip_spread_k': 0.7401913454192579, 'spread_hl_frac': 0.01246719326040044, 'bb_std_mult': 2.4246183945962465, 'rsi_os': 43, 'rsi_ob': 73, 'vol_spike': 0.23224576066647346, 'adx_thresh': 11.598441242615676, 'atr_min_pct': 0.011808355395889595, 'atr_max_pct': 0.08177467326144358, 'tp_mult': 1.730888838809612, 'tsl_mult': 0.6215948548353889, 'strategy': 'breakout', 'time_stop': 94, 'use_sma': False, 'use_atr': True, 'use_adx': False, 'use_ema': True, 'use_spike': False, 'rsi_required': False, 'edge_k': 0.6614949869711315, 'edge_cap': 0.8539476083011907, 'bull_strategy': 'breakout', 'bull_bb_std_mult': 1.3303741224945247, 'bull_rsi_os': 18, 'bull_rsi_ob': 89, 'bull_adx_thresh': 10.356844647832158, 'bull_atr_min_pct': 0.009156679290541977, 'bull_atr_max_pct': 0.07202429134804618, 'bull_tp_mult': 2.46295556837575, 'bull_tsl_mult': 0.7748877980944868, 'bull_time_stop': 227, 'bull_use_sma': True, 'bull_use_ema': False, 'bull_use_atr': True, 'bull_use_adx': True, 'bull_use_spike': True, 'bull_rsi_required': False, 'bear_strategy': 'mean_reversion', 'bear_bb_std_mult': 1.1547639808211385, 'bear_rsi_os': 21, 'bear_rsi_ob': 70, 'bear_adx_thresh': 9.164611758314267, 'bear_atr_min_pct': 0.008394201369992164, 'bear_atr_max_pct': 0.01722216128561777, 'bear_tp_mult': 1.9413094442349532, 'bear_tsl_mult': 0.6803584522127228, 'bear_time_stop': 23, 'bear_use_sma': True, 'bear_use_ema': False, 'bear_use_atr': False, 'bear_use_adx': True, 'bear_use_spike': True, 'bear_rsi_required': True, 'sideways_strategy': 'mean_reversion', 'sideways_bb_std_mult': 2.407365329013392, 'sideways_rsi_os': 46, 'sideways_rsi_ob': 80, 'sideways_adx_thresh': 15.055679639486051, 'sideways_atr_min_pct': 0.020629322460315454, 'sideways_atr_max_pct': 0.13787275986214992, 'sideways_tp_mult': 1.0110533903187688, 'sideways_tsl_mult': 0.7632684537394098, 'sideways_time_stop': 182, 'sideways_use_sma': True, 'sideways_use_ema': False, 'sideways_use_atr': False, 'sideways_use_adx': True, 'sideways_use_spike': True, 'sideways_rsi_required': False}.
[I 2025-08-31 00:35:52,950] Trial 287 finished with values: [-1000000000.0, 1000000000.0] and parameters: {'p_sma': 37, 'p_std': 42, 'p_atr': 19, 'p_adx': 9, 'rsi_period': 60, 'ema1': 7, 'ema2': 40, 'slip_atr_k': 0.2498313825268469, 'slip_spread_k': 0.3352514494615639, 'spread_hl_frac': 0.008422795496740701, 'bb_std_mult': 1.7949637310482818, 'rsi_os': 50, 'rsi_ob': 95, 'vol_spike': 0.22794164764611433, 'adx_thresh': 11.677407168165766, 'atr_min_pct': 0.006169588674569326, 'atr_max_pct': 0.10899471593979358, 'tp_mult': 1.725175100786911, 'tsl_mult': 0.627220701330239, 'strategy': 'breakout', 'time_stop': 94, 'use_sma': True, 'use_atr': True, 'use_adx': False, 'use_ema': True, 'use_spike': True, 'rsi_required': False, 'edge_k': 1.2222891090210635, 'edge_cap': 0.8346651073112843, 'bull_strategy': 'breakout', 'bull_bb_std_mult': 0.5508184967492638, 'bull_rsi_os': 28, 'bull_rsi_ob': 89, 'bull_adx_thresh': 13.889207963706465, 'bull_atr_min_pct': 0.009224573665069064, 'bull_atr_max_pct': 0.07200816571022896, 'bull_tp_mult': 2.439710209334206, 'bull_tsl_mult': 0.7672977668645005, 'bull_time_stop': 155, 'bull_use_sma': True, 'bull_use_ema': False, 'bull_use_atr': True, 'bull_use_adx': True, 'bull_use_spike': False, 'bull_rsi_required': False, 'bear_strategy': 'mean_reversion', 'bear_bb_std_mult': 1.3350414116582754, 'bear_rsi_os': 48, 'bear_rsi_ob': 70, 'bear_adx_thresh': 11.919881400220813, 'bear_atr_min_pct': 0.01455831988009605, 'bear_atr_max_pct': 0.030881024337513004, 'bear_tp_mult': 1.3291045103820018, 'bear_tsl_mult': 0.6815406024607717, 'bear_time_stop': 20, 'bear_use_sma': True, 'bear_use_ema': True, 'bear_use_atr': False, 'bear_use_adx': True, 'bear_use_spike': True, 'bear_rsi_required': True, 'sideways_strategy': 'mean_reversion', 'sideways_bb_std_mult': 1.0152847611955291, 'sideways_rsi_os': 19, 'sideways_rsi_ob': 86, 'sideways_adx_thresh': 15.090389440951514, 'sideways_atr_min_pct': 0.020754251827889356, 'sideways_atr_max_pct': 0.012817553033663692, 'sideways_tp_mult': 2.3971899885282055, 'sideways_tsl_mult': 0.734286918199285, 'sideways_time_stop': 171, 'sideways_use_sma': True, 'sideways_use_ema': False, 'sideways_use_atr': True, 'sideways_use_adx': False, 'sideways_use_spike': False, 'sideways_rsi_required': False}.
