[I 2025-08-31 02:56:39,552] Trial 723 finished with values: [-1000000000.0, 1000000000.0] and parameters: {'p_sma': 55, 'p_std': 22, 'p_atr': 28, 'p_adx': 25, 'rsi_period': 66, 'ema1': 5, 'ema2': 45, 'slip_atr_k': 0.13746954329563127, 'slip_spread_k': 0.180048716563487, 'spread_hl_frac': 0.002778911864335307, 'bb_std_mult': 1.727046055327962, 'rsi_os': 39, 'rsi_ob': 49, 'vol_spike': 0.19028658083814437, 'adx_thresh': 21.97025690697064, 'atr_min_pct': 0.02200615625080345, 'atr_max_pct': 0.12023361746989145, 'tp_mult': 1.868078396535776, 'tsl_mult': 0.4573825685923302, 'strategy': 'mean_reversion', 'time_stop': 207, 'use_sma': True, 'use_atr': False, 'use_adx': False, 'use_ema': False, 'use_spike': False, 'rsi_required': True, 'edge_k': 0.554667682843573, 'edge_cap': 0.10794135259064513, 'bull_strategy': 'breakout', 'bull_bb_std_mult': 2.295166860809239, 'bull_rsi_os': 50, 'bull_rsi_ob': 95, 'bull_adx_thresh': 9.953340891259755, 'bull_atr_min_pct': 0.005764931539256717, 'bull_atr_max_pct': 0.1426175363609051, 'bull_tp_mult': 2.3217168318751766, 'bull_tsl_mult': 0.8019022626913019, 'bull_time_stop': 148, 'bull_use_sma': True, 'bull_use_ema': False, 'bull_use_atr': False, 'bull_use_adx': True, 'bull_use_spike': True, 'bull_rsi_required': True, 'bear_strategy': 'mean_reversion', 'bear_bb_std_mult': 1.3275962880027918, 'bear_rsi_os': 47, 'bear_rsi_ob': 46, 'bear_adx_thresh': 34.578278741667354, 'bear_atr_min_pct': 0.0031872146186295294, 'bear_atr_max_pct': 0.013739038411540352, 'bear_tp_mult': 2.1613473242549546, 'bear_tsl_mult': 0.5239529915348964, 'bear_time_stop': 166, 'bear_use_sma': False, 'bear_use_ema': False, 'bear_use_atr': False, 'bear_use_adx': True, 'bear_use_spike': False, 'bear_rsi_required': True, 'sideways_strategy': 'breakout', 'sideways_bb_std_mult': 0.5010134193802127, 'sideways_rsi_os': 9, 'sideways_rsi_ob': 72, 'sideways_adx_thresh': 8.895485391354566, 'sideways_atr_min_pct': 0.016974934744585838, 'sideways_atr_max_pct': 0.05428162048047016, 'sideways_tp_mult': 1.3378551376658778, 'sideways_tsl_mult': 0.2337562005599234, 'sideways_time_stop': 212, 'sideways_use_sma': True, 'sideways_use_ema': False, 'sideways_use_atr': False, 'sideways_use_adx': False, 'sideways_use_spike': True, 'sideways_rsi_required': False}.
[I 2025-08-31 02:57:16,501] Trial 721 finished with values: [-1000000000.0, 1000000000.0] and parameters: {'p_sma': 55, 'p_std': 56, 'p_atr': 28, 'p_adx': 23, 'rsi_period': 73, 'ema1': 5, 'ema2': 50, 'slip_atr_k': 0.11184868915694522, 'slip_spread_k': 0.9742227304958765, 'spread_hl_frac': 0.03472267083728489, 'bb_std_mult': 2.688883671643177, 'rsi_os': 39, 'rsi_ob': 84, 'vol_spike': 0.024762034066760363, 'adx_thresh': 6.519544544960645, 'atr_min_pct': 0.005843265040402404, 'atr_max_pct': 0.14587175198885988, 'tp_mult': 1.6102033052085516, 'tsl_mult': 0.0010354244935711354, 'strategy': 'mean_reversion', 'time_stop': 221, 'use_sma': True, 'use_atr': False, 'use_adx': False, 'use_ema': False, 'use_spike': False, 'rsi_required': True, 'edge_k': 0.5713608838185297, 'edge_cap': 0.10792457941079525, 'bull_strategy': 'breakout', 'bull_bb_std_mult': 2.122379253089719, 'bull_rsi_os': 52, 'bull_rsi_ob': 89, 'bull_adx_thresh': 10.932970265936271, 'bull_atr_min_pct': 0.008361413078300399, 'bull_atr_max_pct': 0.05790376922496255, 'bull_tp_mult': 2.3207056761666305, 'bull_tsl_mult': 0.5790637571221263, 'bull_time_stop': 120, 'bull_use_sma': True, 'bull_use_ema': False, 'bull_use_atr': False, 'bull_use_adx': True, 'bull_use_spike': True, 'bull_rsi_required': True, 'bear_strategy': 'mean_reversion', 'bear_bb_std_mult': 1.3183422221674865, 'bear_rsi_os': 29, 'bear_rsi_ob': 50, 'bear_adx_thresh': 23.5175298750049, 'bear_atr_min_pct': 0.007513117398204509, 'bear_atr_max_pct': 0.014995121003182944, 'bear_tp_mult': 1.6568634464929957, 'bear_tsl_mult': 0.021331871839201932, 'bear_time_stop': 224, 'bear_use_sma': False, 'bear_use_ema': False, 'bear_use_atr': False, 'bear_use_adx': True, 'bear_use_spike': False, 'bear_rsi_required': True, 'sideways_strategy': 'breakout', 'sideways_bb_std_mult': 0.5654293398453021, 'sideways_rsi_os': 37, 'sideways_rsi_ob': 49, 'sideways_adx_thresh': 16.320598918635742, 'sideways_atr_min_pct': 0.02575049927992825, 'sideways_atr_max_pct': 0.025582810959071688, 'sideways_tp_mult': 1.5098233086392283, 'sideways_tsl_mult': 0.22588023028738097, 'sideways_time_stop': 60, 'sideways_use_sma': True, 'sideways_use_ema': False, 'sideways_use_atr': False, 'sideways_use_adx': False, 'sideways_use_spike': True, 'sideways_rsi_required': False}.
[I 2025-08-31 02:57:17,106] Trial 722 finished with values: [-1000000000.0, 1000000000.0] and parameters: {'p_sma': 55, 'p_std': 55, 'p_atr': 28, 'p_adx': 25, 'rsi_period': 73, 'ema1': 30, 'ema2': 31, 'slip_atr_k': 0.20036944134785697, 'slip_spread_k': 0.027653331253319147, 'spread_hl_frac': 0.021483254682460703, 'bb_std_mult': 1.8521069117209388, 'rsi_os': 39, 'rsi_ob': 68, 'vol_spike': 0.2097203661576003, 'adx_thresh': 8.764884320352389, 'atr_min_pct': 0.007309746226535584, 'atr_max_pct': 0.12352297658682676, 'tp_mult': 1.1198731869466072, 'tsl_mult': 0.3860920490197124, 'strategy': 'mean_reversion', 'time_stop': 114, 'use_sma': True, 'use_atr': False, 'use_adx': False, 'use_ema': False, 'use_spike': False, 'rsi_required': True, 'edge_k': 0.9512698602673182, 'edge_cap': 0.10842024730662146, 'bull_strategy': 'breakout', 'bull_bb_std_mult': 2.0963004106562706, 'bull_rsi_os': 50, 'bull_rsi_ob': 89, 'bull_adx_thresh': 6.326813961597809, 'bull_atr_min_pct': 0.005709512802420188, 'bull_atr_max_pct': 0.14299263986739955, 'bull_tp_mult': 2.328496590163367, 'bull_tsl_mult': 0.4893358090919274, 'bull_time_stop': 195, 'bull_use_sma': True, 'bull_use_ema': False, 'bull_use_atr': False, 'bull_use_adx': True, 'bull_use_spike': True, 'bull_rsi_required': True, 'bear_strategy': 'mean_reversion', 'bear_bb_std_mult': 1.6279324290215853, 'bear_rsi_os': 19, 'bear_rsi_ob': 69, 'bear_adx_thresh': 33.83140246379119, 'bear_atr_min_pct': 0.007565124108645854, 'bear_atr_max_pct': 0.01521123134940511, 'bear_tp_mult': 2.3701422554323157, 'bear_tsl_mult': 0.561098618878449, 'bear_time_stop': 164, 'bear_use_sma': False, 'bear_use_ema': False, 'bear_use_atr': False, 'bear_use_adx': True, 'bear_use_spike': False, 'bear_rsi_required': True, 'sideways_strategy': 'breakout', 'sideways_bb_std_mult': 0.579319882182691, 'sideways_rsi_os': 37, 'sideways_rsi_ob': 72, 'sideways_adx_thresh': 26.139751723158742, 'sideways_atr_min_pct': 0.011305504852502679, 'sideways_atr_max_pct': 0.05575517258631221, 'sideways_tp_mult': 1.5073976844035668, 'sideways_tsl_mult': 0.2914838163324378, 'sideways_time_stop': 210, 'sideways_use_sma': True, 'sideways_use_ema': False, 'sideways_use_atr': False, 'sideways_use_adx': False, 'sideways_use_spike': True, 'sideways_rsi_required': False}.
[I 2025-08-31 02:57:17,907] Trial 720 finished with values: [-1000000000.0, 1000000000.0] and parameters: {'p_sma': 30, 'p_std': 19, 'p_atr': 29, 'p_adx': 25, 'rsi_period': 69, 'ema1': 24, 'ema2': 49, 'slip_atr_k': 0.1412322079804502, 'slip_spread_k': 0.1804323243349032, 'spread_hl_frac': 0.0017370772242126138, 'bb_std_mult': 1.451181693427522, 'rsi_os': 48, 'rsi_ob': 71, 'vol_spike': 0.19296023401665158, 'adx_thresh': 8.896853271928661, 'atr_min_pct': 0.005987753317219036, 'atr_max_pct': 0.1396558345212028, 'tp_mult': 1.329501650180576, 'tsl_mult': 0.21868208005008555, 'strategy': 'mean_reversion', 'time_stop': 221, 'use_sma': True, 'use_atr': True, 'use_adx': True, 'use_ema': False, 'use_spike': False, 'rsi_required': True, 'edge_k': 0.6102732299082235, 'edge_cap': 0.35053221178985755, 'bull_strategy': 'breakout', 'bull_bb_std_mult': 3.369847974182187, 'bull_rsi_os': 52, 'bull_rsi_ob': 95, 'bull_adx_thresh': 6.562127895287076, 'bull_atr_min_pct': 0.0027639851304632965, 'bull_atr_max_pct': 0.13594906823721037, 'bull_tp_mult': 2.329589401499698, 'bull_tsl_mult': 0.2399999069420362, 'bull_time_stop': 118, 'bull_use_sma': True, 'bull_use_ema': False, 'bull_use_atr': False, 'bull_use_adx': True, 'bull_use_spike': True, 'bull_rsi_required': True, 'bear_strategy': 'mean_reversion', 'bear_bb_std_mult': 1.6135571106252076, 'bear_rsi_os': 19, 'bear_rsi_ob': 47, 'bear_adx_thresh': 34.90095869345879, 'bear_atr_min_pct': 0.0028400426701488263, 'bear_atr_max_pct': 0.08795933810748105, 'bear_tp_mult': 1.0916241182708357, 'bear_tsl_mult': 0.5576725591194021, 'bear_time_stop': 223, 'bear_use_sma': False, 'bear_use_ema': False, 'bear_use_atr': False, 'bear_use_adx': True, 'bear_use_spike': False, 'bear_rsi_required': True, 'sideways_strategy': 'breakout', 'sideways_bb_std_mult': 0.5576003510052981, 'sideways_rsi_os': 36, 'sideways_rsi_ob': 94, 'sideways_adx_thresh': 26.113584400761717, 'sideways_atr_min_pct': 0.004758456960957589, 'sideways_atr_max_pct': 0.061173153232402536, 'sideways_tp_mult': 1.5723751977191864, 'sideways_tsl_mult': 0.2276882317239055, 'sideways_time_stop': 191, 'sideways_use_sma': False, 'sideways_use_ema': True, 'sideways_use_atr': True, 'sideways_use_adx': False, 'sideways_use_spike': True, 'sideways_rsi_required': False}.
[I 2025-08-31 02:57:18,573] Trial 724 finished with values: [-1000000000.0, 1000000000.0] and parameters: {'p_sma': 9, 'p_std': 20, 'p_atr': 27, 'p_adx': 23, 'rsi_period': 74, 'ema1': 30, 'ema2': 42, 'slip_atr_k': 0.10943324394103628, 'slip_spread_k': 0.15210761230287173, 'spread_hl_frac': 0.035225779526009124, 'bb_std_mult': 2.664504389268199, 'rsi_os': 41, 'rsi_ob': 86, 'vol_spike': 0.07944131617855413, 'adx_thresh': 8.948548179993614, 'atr_min_pct': 0.007195723591627165, 'atr_max_pct': 0.1476351886611478, 'tp_mult': 1.9735807249248811, 'tsl_mult': 0.25696634956210845, 'strategy': 'mean_reversion', 'time_stop': 111, 'use_sma': True, 'use_atr': False, 'use_adx': False, 'use_ema': False, 'use_spike': False, 'rsi_required': True, 'edge_k': 0.661367134780435, 'edge_cap': 0.13723259476120103, 'bull_strategy': 'breakout', 'bull_bb_std_mult': 2.137168677084855, 'bull_rsi_os': 25, 'bull_rsi_ob': 64, 'bull_adx_thresh': 7.617923140961223, 'bull_atr_min_pct': 0.02693919113253838, 'bull_atr_max_pct': 0.1389769467758451, 'bull_tp_mult': 2.3367207924410054, 'bull_tsl_mult': 0.4915390466351187, 'bull_time_stop': 209, 'bull_use_sma': True, 'bull_use_ema': True, 'bull_use_atr': False, 'bull_use_adx': True, 'bull_use_spike': True, 'bull_rsi_required': True, 'bear_strategy': 'mean_reversion', 'bear_bb_std_mult': 1.5062536606840602, 'bear_rsi_os': 52, 'bear_rsi_ob': 47, 'bear_adx_thresh': 20.557491552100135, 'bear_atr_min_pct': 0.007522855210705733, 'bear_atr_max_pct': 0.053116446162787656, 'bear_tp_mult': 1.6841841372365653, 'bear_tsl_mult': 0.023456938663345694, 'bear_time_stop': 143, 'bear_use_sma': False, 'bear_use_ema': False, 'bear_use_atr': False, 'bear_use_adx': False, 'bear_use_spike': False, 'bear_rsi_required': True, 'sideways_strategy': 'breakout', 'sideways_bb_std_mult': 0.5658665143634034, 'sideways_rsi_os': 32, 'sideways_rsi_ob': 50, 'sideways_adx_thresh': 6.5714156964788835, 'sideways_atr_min_pct': 0.02872587716076689, 'sideways_atr_max_pct': 0.047439633898980836, 'sideways_tp_mult': 1.5673589741281297, 'sideways_tsl_mult': 0.5894426955373818, 'sideways_time_stop': 38, 'sideways_use_sma': True, 'sideways_use_ema': False, 'sideways_use_atr': False, 'sideways_use_adx': False, 'sideways_use_spike': True, 'sideways_rsi_required': False}.
[I 2025-08-31 02:57:58,329] Trial 728 finished with values: [-1000000000.0, 1000000000.0] and parameters: {'p_sma': 52, 'p_std': 49, 'p_atr': 12, 'p_adx': 30, 'rsi_period': 26, 'ema1': 5, 'ema2': 39, 'slip_atr_k': 0.2155239484261312, 'slip_spread_k': 0.33832990036663657, 'spread_hl_frac': 0.0033280418958212122, 'bb_std_mult': 0.9571504129953805, 'rsi_os': 45, 'rsi_ob': 70, 'vol_spike': 0.17882885628553638, 'adx_thresh': 19.36742704652789, 'atr_min_pct': 0.008388948434345194, 'atr_max_pct': 0.12959658283763917, 'tp_mult': 1.2466477062313976, 'tsl_mult': 0.790702828643845, 'strategy': 'mean_reversion', 'time_stop': 200, 'use_sma': False, 'use_atr': False, 'use_adx': False, 'use_ema': False, 'use_spike': False, 'rsi_required': True, 'edge_k': 1.0586339776453757, 'edge_cap': 0.13610946839574561, 'bull_strategy': 'mean_reversion', 'bull_bb_std_mult': 0.8978588973760677, 'bull_rsi_os': 35, 'bull_rsi_ob': 56, 'bull_adx_thresh': 26.58355747519432, 'bull_atr_min_pct': 0.0035707507276660673, 'bull_atr_max_pct': 0.1408261244749655, 'bull_tp_mult': 2.219243486801286, 'bull_tsl_mult': 0.8984342782998929, 'bull_time_stop': 137, 'bull_use_sma': True, 'bull_use_ema': True, 'bull_use_atr': False, 'bull_use_adx': False, 'bull_use_spike': True, 'bull_rsi_required': True, 'bear_strategy': 'mean_reversion', 'bear_bb_std_mult': 1.2390811253225273, 'bear_rsi_os': 17, 'bear_rsi_ob': 61, 'bear_adx_thresh': 32.580068420216115, 'bear_atr_min_pct': 0.005345917290243615, 'bear_atr_max_pct': 0.01238698615671699, 'bear_tp_mult': 2.0644384222292254, 'bear_tsl_mult': 0.5148304152500394, 'bear_time_stop': 196, 'bear_use_sma': False, 'bear_use_ema': False, 'bear_use_atr': False, 'bear_use_adx': False, 'bear_use_spike': False, 'bear_rsi_required': True, 'sideways_strategy': 'breakout', 'sideways_bb_std_mult': 2.3446081551143476, 'sideways_rsi_os': 39, 'sideways_rsi_ob': 94, 'sideways_adx_thresh': 7.476731452065399, 'sideways_atr_min_pct': 0.02725375520119899, 'sideways_atr_max_pct': 0.05437044796299911, 'sideways_tp_mult': 1.6555938774905232, 'sideways_tsl_mult': 0.6020276550550197, 'sideways_time_stop': 206, 'sideways_use_sma': True, 'sideways_use_ema': False, 'sideways_use_atr': False, 'sideways_use_adx': True, 'sideways_use_spike': True, 'sideways_rsi_required': True}.
[I 2025-08-31 02:57:58,649] Trial 725 finished with values: [-1000000000.0, 1000000000.0] and parameters: {'p_sma': 56, 'p_std': 49, 'p_atr': 27, 'p_adx': 25, 'rsi_period': 69, 'ema1': 5, 'ema2': 27, 'slip_atr_k': 0.0172411264049357, 'slip_spread_k': 0.8201972950743779, 'spread_hl_frac': 0.0032173052015979555, 'bb_std_mult': 1.8340630924154917, 'rsi_os': 41, 'rsi_ob': 86, 'vol_spike': 0.18025540788366157, 'adx_thresh': 19.176471310408168, 'atr_min_pct': 0.006699637520812818, 'atr_max_pct': 0.12954527935507892, 'tp_mult': 1.0587288849827208, 'tsl_mult': 0.6511913716755255, 'strategy': 'mean_reversion', 'time_stop': 112, 'use_sma': True, 'use_atr': False, 'use_adx': False, 'use_ema': False, 'use_spike': False, 'rsi_required': True, 'edge_k': 0.6574211969940225, 'edge_cap': 0.13218246252326715, 'bull_strategy': 'breakout', 'bull_bb_std_mult': 1.7161661619509014, 'bull_rsi_os': 55, 'bull_rsi_ob': 56, 'bull_adx_thresh': 7.662229237962819, 'bull_atr_min_pct': 0.025219047453031822, 'bull_atr_max_pct': 0.10289696230849926, 'bull_tp_mult': 1.4937695948107375, 'bull_tsl_mult': 0.2432419919562217, 'bull_time_stop': 137, 'bull_use_sma': True, 'bull_use_ema': True, 'bull_use_atr': False, 'bull_use_adx': False, 'bull_use_spike': True, 'bull_rsi_required': True, 'bear_strategy': 'mean_reversion', 'bear_bb_std_mult': 1.2395683670968964, 'bear_rsi_os': 19, 'bear_rsi_ob': 69, 'bear_adx_thresh': 5.503961077540436, 'bear_atr_min_pct': 0.015857935450294895, 'bear_atr_max_pct': 0.01012216589330239, 'bear_tp_mult': 2.0607380495878878, 'bear_tsl_mult': 0.4121792134045085, 'bear_time_stop': 10, 'bear_use_sma': False, 'bear_use_ema': False, 'bear_use_atr': False, 'bear_use_adx': False, 'bear_use_spike': False, 'bear_rsi_required': True, 'sideways_strategy': 'breakout', 'sideways_bb_std_mult': 0.5817072310205597, 'sideways_rsi_os': 16, 'sideways_rsi_ob': 63, 'sideways_adx_thresh': 26.132296241022374, 'sideways_atr_min_pct': 0.027512920895455345, 'sideways_atr_max_pct': 0.04786237282949325, 'sideways_tp_mult': 1.5635762493210934, 'sideways_tsl_mult': 0.6077035613217288, 'sideways_time_stop': 189, 'sideways_use_sma': True, 'sideways_use_ema': False, 'sideways_use_atr': False, 'sideways_use_adx': True, 'sideways_use_spike': True, 'sideways_rsi_required': False}.
[I 2025-08-31 02:57:59,512] Trial 727 finished with values: [-1000000000.0, 1000000000.0] and parameters: {'p_sma': 52, 'p_std': 49, 'p_atr': 27, 'p_adx': 23, 'rsi_period': 70, 'ema1': 5, 'ema2': 32, 'slip_atr_k': 0.014554056438955035, 'slip_spread_k': 0.8234976987049681, 'spread_hl_frac': 0.003049368702774181, 'bb_std_mult': 0.5797069944322188, 'rsi_os': 15, 'rsi_ob': 65, 'vol_spike': 0.10044870597583302, 'adx_thresh': 19.29062494475123, 'atr_min_pct': 0.008215500046338744, 'atr_max_pct': 0.117069542571443, 'tp_mult': 1.9382350080827297, 'tsl_mult': 0.31834413191908817, 'strategy': 'mean_reversion', 'time_stop': 122, 'use_sma': False, 'use_atr': False, 'use_adx': False, 'use_ema': False, 'use_spike': False, 'rsi_required': True, 'edge_k': 0.18982277922753177, 'edge_cap': 0.1329329329263867, 'bull_strategy': 'breakout', 'bull_bb_std_mult': 2.2207728319705553, 'bull_rsi_os': 34, 'bull_rsi_ob': 63, 'bull_adx_thresh': 28.719678320769788, 'bull_atr_min_pct': 0.015333980312140064, 'bull_atr_max_pct': 0.1398198867815326, 'bull_tp_mult': 2.201501889602578, 'bull_tsl_mult': 0.29389360292976086, 'bull_time_stop': 73, 'bull_use_sma': True, 'bull_use_ema': True, 'bull_use_atr': False, 'bull_use_adx': False, 'bull_use_spike': True, 'bull_rsi_required': True, 'bear_strategy': 'mean_reversion', 'bear_bb_std_mult': 3.227556435597143, 'bear_rsi_os': 17, 'bear_rsi_ob': 62, 'bear_adx_thresh': 5.489331491362289, 'bear_atr_min_pct': 0.006767937397941903, 'bear_atr_max_pct': 0.018990840777429317, 'bear_tp_mult': 2.070457452700587, 'bear_tsl_mult': 0.1275175811197728, 'bear_time_stop': 10, 'bear_use_sma': False, 'bear_use_ema': False, 'bear_use_atr': False, 'bear_use_adx': False, 'bear_use_spike': False, 'bear_rsi_required': True, 'sideways_strategy': 'breakout', 'sideways_bb_std_mult': 3.599065503330504, 'sideways_rsi_os': 39, 'sideways_rsi_ob': 84, 'sideways_adx_thresh': 9.61317396208749, 'sideways_atr_min_pct': 0.027433559097767984, 'sideways_atr_max_pct': 0.04784370407704941, 'sideways_tp_mult': 1.6782858727914403, 'sideways_tsl_mult': 0.6085772593700085, 'sideways_time_stop': 261, 'sideways_use_sma': True, 'sideways_use_ema': False, 'sideways_use_atr': False, 'sideways_use_adx': True, 'sideways_use_spike': True, 'sideways_rsi_required': True}.
[I 2025-08-31 02:57:59,608] Trial 726 finished with values: [-1000000000.0, 1000000000.0] and parameters: {'p_sma': 43, 'p_std': 47, 'p_atr': 27, 'p_adx': 22, 'rsi_period': 69, 'ema1': 5, 'ema2': 32, 'slip_atr_k': 0.06758959236109326, 'slip_spread_k': 0.15994337886914978, 'spread_hl_frac': 0.003365189169333891, 'bb_std_mult': 2.539931401110475, 'rsi_os': 30, 'rsi_ob': 65, 'vol_spike': 0.07925113396608534, 'adx_thresh': 20.46356822589487, 'atr_min_pct': 0.008233209013913856, 'atr_max_pct': 0.11627926400249661, 'tp_mult': 1.9574600117638727, 'tsl_mult': 0.6082503541819011, 'strategy': 'mean_reversion', 'time_stop': 120, 'use_sma': True, 'use_atr': False, 'use_adx': False, 'use_ema': False, 'use_spike': False, 'rsi_required': True, 'edge_k': 0.6603929517392344, 'edge_cap': 0.383610642498476, 'bull_strategy': 'breakout', 'bull_bb_std_mult': 3.2962443327213444, 'bull_rsi_os': 18, 'bull_rsi_ob': 63, 'bull_adx_thresh': 23.64720563952036, 'bull_atr_min_pct': 0.007769674216931722, 'bull_atr_max_pct': 0.1395335931565902, 'bull_tp_mult': 2.210064168904686, 'bull_tsl_mult': 0.24175215740996345, 'bull_time_stop': 138, 'bull_use_sma': True, 'bull_use_ema': True, 'bull_use_atr': False, 'bull_use_adx': False, 'bull_use_spike': True, 'bull_rsi_required': True, 'bear_strategy': 'mean_reversion', 'bear_bb_std_mult': 1.2406167714479157, 'bear_rsi_os': 13, 'bear_rsi_ob': 47, 'bear_adx_thresh': 5.03258302764343, 'bear_atr_min_pct': 0.005503873430462443, 'bear_atr_max_pct': 0.053604941235585214, 'bear_tp_mult': 1.3162386775759667, 'bear_tsl_mult': 0.40639832921245306, 'bear_time_stop': 5, 'bear_use_sma': False, 'bear_use_ema': False, 'bear_use_atr': False, 'bear_use_adx': False, 'bear_use_spike': False, 'bear_rsi_required': True, 'sideways_strategy': 'breakout', 'sideways_bb_std_mult': 1.706908944030557, 'sideways_rsi_os': 39, 'sideways_rsi_ob': 95, 'sideways_adx_thresh': 31.028038159536145, 'sideways_atr_min_pct': 0.013593548239538842, 'sideways_atr_max_pct': 0.04702859321267688, 'sideways_tp_mult': 2.9611902305839464, 'sideways_tsl_mult': 0.6035896847640311, 'sideways_time_stop': 189, 'sideways_use_sma': True, 'sideways_use_ema': False, 'sideways_use_atr': False, 'sideways_use_adx': True, 'sideways_use_spike': True, 'sideways_rsi_required': False}.
