[I 2025-08-31 00:48:08,329] Trial 385 finished with values: [-1000000000.0, 1000000000.0] and parameters: {'p_sma': 21, 'p_std': 50, 'p_atr': 21, 'p_adx': 7, 'rsi_period': 57, 'ema1': 7, 'ema2': 19, 'slip_atr_k': 0.036300411427279994, 'slip_spread_k': 0.6931806305293503, 'spread_hl_frac': 0.024118580936726208, 'bb_std_mult': 2.2449461483643294, 'rsi_os': 53, 'rsi_ob': 80, 'vol_spike': 0.2263067333926209, 'adx_thresh': 34.10605524693933, 'atr_min_pct': 0.007446493246160998, 'atr_max_pct': 0.12053656796244847, 'tp_mult': 2.7406806738462133, 'tsl_mult': 0.47133874480528903, 'strategy': 'breakout', 'time_stop': 87, 'use_sma': True, 'use_atr': False, 'use_adx': False, 'use_ema': True, 'use_spike': True, 'rsi_required': False, 'edge_k': 0.7436097415408931, 'edge_cap': 0.7934267878381417, 'bull_strategy': 'mean_reversion', 'bull_bb_std_mult': 0.8220843765476424, 'bull_rsi_os': 37, 'bull_rsi_ob': 70, 'bull_adx_thresh': 14.255851854090801, 'bull_atr_min_pct': 0.024631717523864574, 'bull_atr_max_pct': 0.0805782811371728, 'bull_tp_mult': 2.4326346848917035, 'bull_tsl_mult': 0.05324842677348596, 'bull_time_stop': 70, 'bull_use_sma': False, 'bull_use_ema': False, 'bull_use_atr': True, 'bull_use_adx': True, 'bull_use_spike': False, 'bull_rsi_required': False, 'bear_strategy': 'mean_reversion', 'bear_bb_std_mult': 3.2375941680156473, 'bear_rsi_os': 20, 'bear_rsi_ob': 80, 'bear_adx_thresh': 9.408532496404721, 'bear_atr_min_pct': 0.00857468908466096, 'bear_atr_max_pct': 0.1251890848215358, 'bear_tp_mult': 1.0106250241140482, 'bear_tsl_mult': 0.7194676595308154, 'bear_time_stop': 204, 'bear_use_sma': True, 'bear_use_ema': True, 'bear_use_atr': False, 'bear_use_adx': True, 'bear_use_spike': False, 'bear_rsi_required': False, 'sideways_strategy': 'mean_reversion', 'sideways_bb_std_mult': 1.5659710172517067, 'sideways_rsi_os': 33, 'sideways_rsi_ob': 88, 'sideways_adx_thresh': 12.3288443255933, 'sideways_atr_min_pct': 0.026435552570513575, 'sideways_atr_max_pct': 0.13617847658070092, 'sideways_tp_mult': 1.0857876334914482, 'sideways_tsl_mult': 0.5580188620146296, 'sideways_time_stop': 136, 'sideways_use_sma': True, 'sideways_use_ema': False, 'sideways_use_atr': False, 'sideways_use_adx': False, 'sideways_use_spike': True, 'sideways_rsi_required': False}.
[I 2025-08-31 00:48:08,466] Trial 387 finished with values: [-1000000000.0, 1000000000.0] and parameters: {'p_sma': 49, 'p_std': 50, 'p_atr': 19, 'p_adx': 24, 'rsi_period': 56, 'ema1': 16, 'ema2': 19, 'slip_atr_k': 0.05390164040099389, 'slip_spread_k': 0.19002973598850498, 'spread_hl_frac': 0.01108127373205983, 'bb_std_mult': 2.265202786483724, 'rsi_os': 53, 'rsi_ob': 56, 'vol_spike': 0.09042020879344338, 'adx_thresh': 34.07740716124992, 'atr_min_pct': 0.007383473970154927, 'atr_max_pct': 0.07722859147707888, 'tp_mult': 2.779425675879137, 'tsl_mult': 0.2653150630313057, 'strategy': 'breakout', 'time_stop': 90, 'use_sma': True, 'use_atr': False, 'use_adx': False, 'use_ema': True, 'use_spike': False, 'rsi_required': False, 'edge_k': 0.001098154652296901, 'edge_cap': 0.8626708763856046, 'bull_strategy': 'breakout', 'bull_bb_std_mult': 2.9023525944851953, 'bull_rsi_os': 42, 'bull_rsi_ob': 92, 'bull_adx_thresh': 14.240634578301282, 'bull_atr_min_pct': 0.0027486747880447783, 'bull_atr_max_pct': 0.11689184044666096, 'bull_tp_mult': 2.428070984233623, 'bull_tsl_mult': 0.22017986509732412, 'bull_time_stop': 219, 'bull_use_sma': False, 'bull_use_ema': False, 'bull_use_atr': True, 'bull_use_adx': False, 'bull_use_spike': True, 'bull_rsi_required': False, 'bear_strategy': 'mean_reversion', 'bear_bb_std_mult': 3.2243703187972548, 'bear_rsi_os': 22, 'bear_rsi_ob': 82, 'bear_adx_thresh': 5.964135264165261, 'bear_atr_min_pct': 0.005670362218875074, 'bear_atr_max_pct': 0.015906080138507597, 'bear_tp_mult': 1.3650045327726448, 'bear_tsl_mult': 0.7175521319613809, 'bear_time_stop': 31, 'bear_use_sma': True, 'bear_use_ema': False, 'bear_use_atr': False, 'bear_use_adx': True, 'bear_use_spike': False, 'bear_rsi_required': False, 'sideways_strategy': 'mean_reversion', 'sideways_bb_std_mult': 0.9584116058644483, 'sideways_rsi_os': 17, 'sideways_rsi_ob': 81, 'sideways_adx_thresh': 12.31986589754905, 'sideways_atr_min_pct': 0.021619750854799284, 'sideways_atr_max_pct': 0.06264921064557452, 'sideways_tp_mult': 1.0911526338144613, 'sideways_tsl_mult': 0.6558222530654978, 'sideways_time_stop': 262, 'sideways_use_sma': True, 'sideways_use_ema': False, 'sideways_use_atr': False, 'sideways_use_adx': False, 'sideways_use_spike': True, 'sideways_rsi_required': False}.
[I 2025-08-31 00:48:09,219] Trial 390 finished with values: [-1000000000.0, 1000000000.0] and parameters: {'p_sma': 47, 'p_std': 47, 'p_atr': 19, 'p_adx': 9, 'rsi_period': 62, 'ema1': 9, 'ema2': 11, 'slip_atr_k': 0.05588704713744937, 'slip_spread_k': 0.18562103822171527, 'spread_hl_frac': 0.03314008475789948, 'bb_std_mult': 1.567959480108855, 'rsi_os': 55, 'rsi_ob': 56, 'vol_spike': 0.28456910592989193, 'adx_thresh': 13.302949881540103, 'atr_min_pct': 0.027268719832050252, 'atr_max_pct': 0.06810789527350011, 'tp_mult': 2.6821414228855502, 'tsl_mult': 0.2645370737501239, 'strategy': 'mean_reversion', 'time_stop': 90, 'use_sma': True, 'use_atr': True, 'use_adx': False, 'use_ema': True, 'use_spike': False, 'rsi_required': False, 'edge_k': 1.6752254778870261, 'edge_cap': 0.8249392794537972, 'bull_strategy': 'breakout', 'bull_bb_std_mult': 2.695146461433559, 'bull_rsi_os': 47, 'bull_rsi_ob': 50, 'bull_adx_thresh': 9.04395961589078, 'bull_atr_min_pct': 0.0005204904514088393, 'bull_atr_max_pct': 0.06923421029316339, 'bull_tp_mult': 1.983203232927996, 'bull_tsl_mult': 0.866912086167371, 'bull_time_stop': 46, 'bull_use_sma': False, 'bull_use_ema': False, 'bull_use_atr': True, 'bull_use_adx': True, 'bull_use_spike': False, 'bull_rsi_required': True, 'bear_strategy': 'mean_reversion', 'bear_bb_std_mult': 1.164502929253984, 'bear_rsi_os': 11, 'bear_rsi_ob': 59, 'bear_adx_thresh': 5.937985719507948, 'bear_atr_min_pct': 0.009178350028666312, 'bear_atr_max_pct': 0.01245123626548139, 'bear_tp_mult': 2.1660872132771964, 'bear_tsl_mult': 0.6627922251968734, 'bear_time_stop': 30, 'bear_use_sma': True, 'bear_use_ema': False, 'bear_use_atr': False, 'bear_use_adx': False, 'bear_use_spike': False, 'bear_rsi_required': True, 'sideways_strategy': 'breakout', 'sideways_bb_std_mult': 0.9979725287442858, 'sideways_rsi_os': 44, 'sideways_rsi_ob': 81, 'sideways_adx_thresh': 12.989422833814348, 'sideways_atr_min_pct': 0.01999235333205656, 'sideways_atr_max_pct': 0.036033108217965834, 'sideways_tp_mult': 1.0109541160034377, 'sideways_tsl_mult': 0.6830243829521877, 'sideways_time_stop': 164, 'sideways_use_sma': True, 'sideways_use_ema': False, 'sideways_use_atr': False, 'sideways_use_adx': True, 'sideways_use_spike': False, 'sideways_rsi_required': False}.
[I 2025-08-31 00:48:09,225] Trial 392 finished with values: [-1000000000.0, 1000000000.0] and parameters: {'p_sma': 49, 'p_std': 24, 'p_atr': 19, 'p_adx': 9, 'rsi_period': 62, 'ema1': 9, 'ema2': 51, 'slip_atr_k': 0.19738208255036133, 'slip_spread_k': 0.2228345164693154, 'spread_hl_frac': 0.03007387603387525, 'bb_std_mult': 1.5626222236420442, 'rsi_os': 55, 'rsi_ob': 70, 'vol_spike': 0.2011767828729467, 'adx_thresh': 22.75969200048672, 'atr_min_pct': 0.015801488805910223, 'atr_max_pct': 0.09354987200686128, 'tp_mult': 2.856035100551763, 'tsl_mult': 0.1891590729785402, 'strategy': 'mean_reversion', 'time_stop': 61, 'use_sma': True, 'use_atr': True, 'use_adx': False, 'use_ema': True, 'use_spike': False, 'rsi_required': False, 'edge_k': 0.7921882852686155, 'edge_cap': 0.8254126491735366, 'bull_strategy': 'breakout', 'bull_bb_std_mult': 2.835148680519147, 'bull_rsi_os': 7, 'bull_rsi_ob': 50, 'bull_adx_thresh': 7.269073818838335, 'bull_atr_min_pct': 0.011611237321367443, 'bull_atr_max_pct': 0.1462948796047936, 'bull_tp_mult': 1.298182759204716, 'bull_tsl_mult': 0.3043007591415772, 'bull_time_stop': 274, 'bull_use_sma': False, 'bull_use_ema': False, 'bull_use_atr': True, 'bull_use_adx': True, 'bull_use_spike': False, 'bull_rsi_required': True, 'bear_strategy': 'mean_reversion', 'bear_bb_std_mult': 2.8645284244681077, 'bear_rsi_os': 33, 'bear_rsi_ob': 76, 'bear_adx_thresh': 22.19331454759804, 'bear_atr_min_pct': 0.020630344946725707, 'bear_atr_max_pct': 0.030682705273452904, 'bear_tp_mult': 1.1080701163690376, 'bear_tsl_mult': 0.8779655307404322, 'bear_time_stop': 36, 'bear_use_sma': True, 'bear_use_ema': False, 'bear_use_atr': False, 'bear_use_adx': False, 'bear_use_spike': False, 'bear_rsi_required': True, 'sideways_strategy': 'breakout', 'sideways_bb_std_mult': 1.1107641832598227, 'sideways_rsi_os': 44, 'sideways_rsi_ob': 89, 'sideways_adx_thresh': 13.139783322605602, 'sideways_atr_min_pct': 0.02332531279644507, 'sideways_atr_max_pct': 0.1413956914341405, 'sideways_tp_mult': 1.1340970293528025, 'sideways_tsl_mult': 0.843795474769493, 'sideways_time_stop': 179, 'sideways_use_sma': True, 'sideways_use_ema': False, 'sideways_use_atr': False, 'sideways_use_adx': True, 'sideways_use_spike': False, 'sideways_rsi_required': False}.
[I 2025-08-31 00:48:44,414] Trial 391 finished with values: [-1000000000.0, 1000000000.0] and parameters: {'p_sma': 26, 'p_std': 24, 'p_atr': 10, 'p_adx': 23, 'rsi_period': 66, 'ema1': 9, 'ema2': 48, 'slip_atr_k': 0.053200669257571095, 'slip_spread_k': 0.20350889477186312, 'spread_hl_frac': 0.007423736552459649, 'bb_std_mult': 2.472623555645384, 'rsi_os': 43, 'rsi_ob': 86, 'vol_spike': 0.061558221409902025, 'adx_thresh': 11.44863354019488, 'atr_min_pct': 0.010809954519222637, 'atr_max_pct': 0.1444706701728674, 'tp_mult': 2.692822145701311, 'tsl_mult': 0.18917444605131167, 'strategy': 'mean_reversion', 'time_stop': 112, 'use_sma': True, 'use_atr': True, 'use_adx': False, 'use_ema': True, 'use_spike': False, 'rsi_required': False, 'edge_k': 0.801419962591076, 'edge_cap': 0.8243741939578308, 'bull_strategy': 'breakout', 'bull_bb_std_mult': 2.829799214712552, 'bull_rsi_os': 47, 'bull_rsi_ob': 50, 'bull_adx_thresh': 9.464318952081255, 'bull_atr_min_pct': 0.011778676186455925, 'bull_atr_max_pct': 0.024896266509714743, 'bull_tp_mult': 1.9768027752841928, 'bull_tsl_mult': 0.8646118576968599, 'bull_time_stop': 90, 'bull_use_sma': False, 'bull_use_ema': False, 'bull_use_atr': True, 'bull_use_adx': True, 'bull_use_spike': False, 'bull_rsi_required': True, 'bear_strategy': 'mean_reversion', 'bear_bb_std_mult': 1.1564892186954463, 'bear_rsi_os': 22, 'bear_rsi_ob': 59, 'bear_adx_thresh': 5.877599268144838, 'bear_atr_min_pct': 0.0056932690088520935, 'bear_atr_max_pct': 0.10022012967632374, 'bear_tp_mult': 1.998189127801961, 'bear_tsl_mult': 0.7069763212195438, 'bear_time_stop': 260, 'bear_use_sma': True, 'bear_use_ema': False, 'bear_use_atr': False, 'bear_use_adx': False, 'bear_use_spike': False, 'bear_rsi_required': True, 'sideways_strategy': 'breakout', 'sideways_bb_std_mult': 1.0078760795555686, 'sideways_rsi_os': 44, 'sideways_rsi_ob': 81, 'sideways_adx_thresh': 24.714890986747186, 'sideways_atr_min_pct': 0.005701672443219546, 'sideways_atr_max_pct': 0.1406812088261208, 'sideways_tp_mult': 2.301541401255995, 'sideways_tsl_mult': 0.05468609240176642, 'sideways_time_stop': 261, 'sideways_use_sma': True, 'sideways_use_ema': False, 'sideways_use_atr': False, 'sideways_use_adx': True, 'sideways_use_spike': False, 'sideways_rsi_required': False}.
[I 2025-08-31 00:48:45,190] Trial 389 finished with values: [-1000000000.0, 1000000000.0] and parameters: {'p_sma': 27, 'p_std': 23, 'p_atr': 22, 'p_adx': 9, 'rsi_period': 21, 'ema1': 9, 'ema2': 19, 'slip_atr_k': 0.056010754876591726, 'slip_spread_k': 0.23282777290621176, 'spread_hl_frac': 0.038410120295365766, 'bb_std_mult': 2.4661877588671897, 'rsi_os': 21, 'rsi_ob': 80, 'vol_spike': 0.22654049097000994, 'adx_thresh': 24.625390065400623, 'atr_min_pct': 0.00761466020751557, 'atr_max_pct': 0.06820778576683462, 'tp_mult': 2.706490522719577, 'tsl_mult': 0.7236985525564109, 'strategy': 'mean_reversion', 'time_stop': 59, 'use_sma': True, 'use_atr': True, 'use_adx': False, 'use_ema': True, 'use_spike': False, 'rsi_required': False, 'edge_k': 1.6621866446612499, 'edge_cap': 0.8258259339591806, 'bull_strategy': 'breakout', 'bull_bb_std_mult': 2.6983583244789773, 'bull_rsi_os': 37, 'bull_rsi_ob': 70, 'bull_adx_thresh': 28.843053342196676, 'bull_atr_min_pct': 0.021746211238483363, 'bull_atr_max_pct': 0.06992959407215284, 'bull_tp_mult': 1.5809736683812856, 'bull_tsl_mult': 0.19451559217814446, 'bull_time_stop': 251, 'bull_use_sma': False, 'bull_use_ema': False, 'bull_use_atr': True, 'bull_use_adx': True, 'bull_use_spike': False, 'bull_rsi_required': False, 'bear_strategy': 'mean_reversion', 'bear_bb_std_mult': 1.1601515609583772, 'bear_rsi_os': 22, 'bear_rsi_ob': 62, 'bear_adx_thresh': 7.310150995463996, 'bear_atr_min_pct': 0.023412947530934043, 'bear_atr_max_pct': 0.07832536802771221, 'bear_tp_mult': 2.0033026774771137, 'bear_tsl_mult': 0.7164476260721336, 'bear_time_stop': 31, 'bear_use_sma': True, 'bear_use_ema': False, 'bear_use_atr': False, 'bear_use_adx': True, 'bear_use_spike': False, 'bear_rsi_required': True, 'sideways_strategy': 'mean_reversion', 'sideways_bb_std_mult': 0.9976447159911626, 'sideways_rsi_os': 17, 'sideways_rsi_ob': 89, 'sideways_adx_thresh': 12.441196593840871, 'sideways_atr_min_pct': 0.023190573049429383, 'sideways_atr_max_pct': 0.03575332351082097, 'sideways_tp_mult': 1.0106180250270702, 'sideways_tsl_mult': 0.855525259293415, 'sideways_time_stop': 135, 'sideways_use_sma': True, 'sideways_use_ema': False, 'sideways_use_atr': False, 'sideways_use_adx': False, 'sideways_use_spike': True, 'sideways_rsi_required': False}.
[I 2025-08-31 00:48:47,590] Trial 393 finished with values: [-0.01582921639387691, 0.01575163989534524] and parameters: {'p_sma': 49, 'p_std': 16, 'p_atr': 22, 'p_adx': 8, 'rsi_period': 45, 'ema1': 6, 'ema2': 23, 'slip_atr_k': 0.027588357322208712, 'slip_spread_k': 0.8697911817750581, 'spread_hl_frac': 0.03810923764178814, 'bb_std_mult': 2.145828753078688, 'rsi_os': 43, 'rsi_ob': 70, 'vol_spike': 0.26354494441267484, 'adx_thresh': 29.81516735618925, 'atr_min_pct': 0.008754979162352993, 'atr_max_pct': 0.10643524506050363, 'tp_mult': 2.6294059430141132, 'tsl_mult': 0.3892614491193995, 'strategy': 'mean_reversion', 'time_stop': 59, 'use_sma': True, 'use_atr': True, 'use_adx': False, 'use_ema': True, 'use_spike': False, 'rsi_required': False, 'edge_k': 0.7919139630318575, 'edge_cap': 0.8252375722207885, 'bull_strategy': 'breakout', 'bull_bb_std_mult': 2.8251433250722657, 'bull_rsi_os': 23, 'bull_rsi_ob': 59, 'bull_adx_thresh': 15.173049043203052, 'bull_atr_min_pct': 0.0016370500615524675, 'bull_atr_max_pct': 0.07436412480227163, 'bull_tp_mult': 2.2415717551726804, 'bull_tsl_mult': 0.4053608505604124, 'bull_time_stop': 176, 'bull_use_sma': True, 'bull_use_ema': False, 'bull_use_atr': True, 'bull_use_adx': True, 'bull_use_spike': False, 'bull_rsi_required': False, 'bear_strategy': 'mean_reversion', 'bear_bb_std_mult': 3.4606809657336273, 'bear_rsi_os': 33, 'bear_rsi_ob': 76, 'bear_adx_thresh': 7.630653569562996, 'bear_atr_min_pct': 0.023502545952538645, 'bear_atr_max_pct': 0.02965041526245083, 'bear_tp_mult': 1.1013029389197828, 'bear_tsl_mult': 0.7082032006859238, 'bear_time_stop': 36, 'bear_use_sma': True, 'bear_use_ema': False, 'bear_use_atr': False, 'bear_use_adx': True, 'bear_use_spike': False, 'bear_rsi_required': True, 'sideways_strategy': 'mean_reversion', 'sideways_bb_std_mult': 1.0935847562183851, 'sideways_rsi_os': 36, 'sideways_rsi_ob': 76, 'sideways_adx_thresh': 13.501409076755944, 'sideways_atr_min_pct': 0.009822515370589507, 'sideways_atr_max_pct': 0.03075918055134602, 'sideways_tp_mult': 1.5487126078839504, 'sideways_tsl_mult': 0.7376490195121999, 'sideways_time_stop': 173, 'sideways_use_sma': True, 'sideways_use_ema': False, 'sideways_use_atr': False, 'sideways_use_adx': True, 'sideways_use_spike': False, 'sideways_rsi_required': False}.
[I 2025-08-31 00:48:47,866] Trial 394 finished with values: [-1000000000.0, 1000000000.0] and parameters: {'p_sma': 31, 'p_std': 53, 'p_atr': 10, 'p_adx': 14, 'rsi_period': 73, 'ema1': 6, 'ema2': 15, 'slip_atr_k': 0.24143827322303643, 'slip_spread_k': 0.288659743600687, 'spread_hl_frac': 0.003112335883353176, 'bb_std_mult': 1.4828861299310134, 'rsi_os': 30, 'rsi_ob': 48, 'vol_spike': 0.1658447426889066, 'adx_thresh': 11.299568117401506, 'atr_min_pct': 0.002893092380089366, 'atr_max_pct': 0.10250341578572977, 'tp_mult': 2.619896446754822, 'tsl_mult': 0.5767966473692205, 'strategy': 'breakout', 'time_stop': 112, 'use_sma': True, 'use_atr': False, 'use_adx': False, 'use_ema': True, 'use_spike': False, 'rsi_required': False, 'edge_k': 0.8144024815318252, 'edge_cap': 0.3264846358396809, 'bull_strategy': 'breakout', 'bull_bb_std_mult': 2.770972858484959, 'bull_rsi_os': 23, 'bull_rsi_ob': 73, 'bull_adx_thresh': 13.623534875923662, 'bull_atr_min_pct': 0.021751069700510228, 'bull_atr_max_pct': 0.07538907861618419, 'bull_tp_mult': 1.4327558355243335, 'bull_tsl_mult': 0.28822179805446424, 'bull_time_stop': 162, 'bull_use_sma': True, 'bull_use_ema': False, 'bull_use_atr': True, 'bull_use_adx': True, 'bull_use_spike': False, 'bull_rsi_required': False, 'bear_strategy': 'mean_reversion', 'bear_bb_std_mult': 1.5614768981353415, 'bear_rsi_os': 22, 'bear_rsi_ob': 56, 'bear_adx_thresh': 23.431429462364495, 'bear_atr_min_pct': 0.023321140237434923, 'bear_atr_max_pct': 0.10054023107252434, 'bear_tp_mult': 2.0156595033268516, 'bear_tsl_mult': 0.6854212984204693, 'bear_time_stop': 14, 'bear_use_sma': True, 'bear_use_ema': False, 'bear_use_atr': False, 'bear_use_adx': True, 'bear_use_spike': False, 'bear_rsi_required': False, 'sideways_strategy': 'mean_reversion', 'sideways_bb_std_mult': 2.3473986453911033, 'sideways_rsi_os': 46, 'sideways_rsi_ob': 76, 'sideways_adx_thresh': 5.9032945291875265, 'sideways_atr_min_pct': 0.021117077482158603, 'sideways_atr_max_pct': 0.1397331521655502, 'sideways_tp_mult': 1.011205836227339, 'sideways_tsl_mult': 0.16170674881239633, 'sideways_time_stop': 171, 'sideways_use_sma': True, 'sideways_use_ema': False, 'sideways_use_atr': False, 'sideways_use_adx': False, 'sideways_use_spike': True, 'sideways_rsi_required': False}.
[I 2025-08-31 00:49:24,526] Trial 395 finished with values: [-1000000000.0, 1000000000.0] and parameters: {'p_sma': 43, 'p_std': 42, 'p_atr': 22, 'p_adx': 19, 'rsi_period': 22, 'ema1': 6, 'ema2': 16, 'slip_atr_k': 0.023427254488930564, 'slip_spread_k': 0.27464743877026637, 'spread_hl_frac': 0.004749825981976423, 'bb_std_mult': 1.8968374750664878, 'rsi_os': 51, 'rsi_ob': 83, 'vol_spike': 0.19667705463340826, 'adx_thresh': 13.050407202209835, 'atr_min_pct': 0.002930877878521367, 'atr_max_pct': 0.063853485351242, 'tp_mult': 2.6367233563766974, 'tsl_mult': 0.11685609248634037, 'strategy': 'breakout', 'time_stop': 239, 'use_sma': True, 'use_atr': False, 'use_adx': False, 'use_ema': True, 'use_spike': False, 'rsi_required': False, 'edge_k': 0.6874823825065668, 'edge_cap': 0.07224901442146525, 'bull_strategy': 'breakout', 'bull_bb_std_mult': 3.5922264823598438, 'bull_rsi_os': 27, 'bull_rsi_ob': 55, 'bull_adx_thresh': 15.17679508987337, 'bull_atr_min_pct': 0.001713220104768983, 'bull_atr_max_pct': 0.07484464442058185, 'bull_tp_mult': 2.6423402398964306, 'bull_tsl_mult': 0.1371565029458034, 'bull_time_stop': 240, 'bull_use_sma': True, 'bull_use_ema': False, 'bull_use_atr': True, 'bull_use_adx': True, 'bull_use_spike': False, 'bull_rsi_required': False, 'bear_strategy': 'mean_reversion', 'bear_bb_std_mult': 3.1143626314086936, 'bear_rsi_os': 23, 'bear_rsi_ob': 64, 'bear_adx_thresh': 7.3656719439616465, 'bear_atr_min_pct': 0.023534183137527656, 'bear_atr_max_pct': 0.08695282447296851, 'bear_tp_mult': 1.9391728914410378, 'bear_tsl_mult': 0.6779789525515505, 'bear_time_stop': 157, 'bear_use_sma': True, 'bear_use_ema': False, 'bear_use_atr': False, 'bear_use_adx': True, 'bear_use_spike': False, 'bear_rsi_required': False, 'sideways_strategy': 'mean_reversion', 'sideways_bb_std_mult': 1.2284110657145415, 'sideways_rsi_os': 40, 'sideways_rsi_ob': 90, 'sideways_adx_thresh': 13.955757270018452, 'sideways_atr_min_pct': 0.02090377746432095, 'sideways_atr_max_pct': 0.144278983019102, 'sideways_tp_mult': 2.4805272160510916, 'sideways_tsl_mult': 0.7856879825109816, 'sideways_time_stop': 171, 'sideways_use_sma': True, 'sideways_use_ema': False, 'sideways_use_atr': False, 'sideways_use_adx': False, 'sideways_use_spike': True, 'sideways_rsi_required': False}.
