[I 2025-08-31 03:12:46,518] Trial 838 finished with values: [-1000000000.0, 1000000000.0] and parameters: {'p_sma': 53, 'p_std': 15, 'p_atr': 28, 'p_adx': 13, 'rsi_period': 70, 'ema1': 5, 'ema2': 22, 'slip_atr_k': 0.22161574349131086, 'slip_spread_k': 0.1331964140512153, 'spread_hl_frac': 0.018777341308387537, 'bb_std_mult': 2.5883339458311023, 'rsi_os': 39, 'rsi_ob': 46, 'vol_spike': 0.10235637677507353, 'adx_thresh': 22.797439904620617, 'atr_min_pct': 0.009533789042825612, 'atr_max_pct': 0.14769616566445345, 'tp_mult': 1.458309466697397, 'tsl_mult': 0.560992900330511, 'strategy': 'mean_reversion', 'time_stop': 194, 'use_sma': True, 'use_atr': False, 'use_adx': False, 'use_ema': True, 'use_spike': True, 'rsi_required': True, 'edge_k': 0.5740474962931106, 'edge_cap': 0.12533674990095364, 'bull_strategy': 'breakout', 'bull_bb_std_mult': 2.6338450178402035, 'bull_rsi_os': 9, 'bull_rsi_ob': 60, 'bull_adx_thresh': 8.277129732157558, 'bull_atr_min_pct': 0.005604974909618737, 'bull_atr_max_pct': 0.10705725846420866, 'bull_tp_mult': 2.1417536023293633, 'bull_tsl_mult': 0.21836137476089518, 'bull_time_stop': 260, 'bull_use_sma': True, 'bull_use_ema': False, 'bull_use_atr': True, 'bull_use_adx': False, 'bull_use_spike': True, 'bull_rsi_required': True, 'bear_strategy': 'mean_reversion', 'bear_bb_std_mult': 1.3736612062365507, 'bear_rsi_os': 41, 'bear_rsi_ob': 46, 'bear_adx_thresh': 11.573232320841353, 'bear_atr_min_pct': 0.005107306921084864, 'bear_atr_max_pct': 0.012427971358458051, 'bear_tp_mult': 2.065243386768386, 'bear_tsl_mult': 0.5070295931779318, 'bear_time_stop': 19, 'bear_use_sma': False, 'bear_use_ema': True, 'bear_use_atr': False, 'bear_use_adx': True, 'bear_use_spike': True, 'bear_rsi_required': True, 'sideways_strategy': 'breakout', 'sideways_bb_std_mult': 0.6782080058268694, 'sideways_rsi_os': 55, 'sideways_rsi_ob': 69, 'sideways_adx_thresh': 10.530530816983541, 'sideways_atr_min_pct': 0.02567291660466626, 'sideways_atr_max_pct': 0.03298117109882619, 'sideways_tp_mult': 1.5837722239512688, 'sideways_tsl_mult': 0.6911415690918631, 'sideways_time_stop': 222, 'sideways_use_sma': True, 'sideways_use_ema': False, 'sideways_use_atr': False, 'sideways_use_adx': False, 'sideways_use_spike': True, 'sideways_rsi_required': False}.
[I 2025-08-31 03:13:00,761] Trial 837 finished with values: [-1000000000.0, 1000000000.0] and parameters: {'p_sma': 54, 'p_std': 51, 'p_atr': 13, 'p_adx': 29, 'rsi_period': 22, 'ema1': 5, 'ema2': 22, 'slip_atr_k': 0.21928350886363918, 'slip_spread_k': 0.9444363088331825, 'spread_hl_frac': 0.035437483346410614, 'bb_std_mult': 1.4100840897364473, 'rsi_os': 39, 'rsi_ob': 88, 'vol_spike': 0.22726073256286433, 'adx_thresh': 19.514001488644457, 'atr_min_pct': 0.00950030832764926, 'atr_max_pct': 0.11867565478387249, 'tp_mult': 1.3780175812702706, 'tsl_mult': 0.5656833212775402, 'strategy': 'mean_reversion', 'time_stop': 159, 'use_sma': True, 'use_atr': False, 'use_adx': False, 'use_ema': True, 'use_spike': False, 'rsi_required': True, 'edge_k': 0.5097602101664219, 'edge_cap': 0.12153715985493113, 'bull_strategy': 'breakout', 'bull_bb_std_mult': 2.6639426201049874, 'bull_rsi_os': 48, 'bull_rsi_ob': 60, 'bull_adx_thresh': 8.201396441144801, 'bull_atr_min_pct': 0.008866350629372521, 'bull_atr_max_pct': 0.13950826163064792, 'bull_tp_mult': 2.1434160785105525, 'bull_tsl_mult': 0.30418931711791586, 'bull_time_stop': 137, 'bull_use_sma': True, 'bull_use_ema': False, 'bull_use_atr': True, 'bull_use_adx': False, 'bull_use_spike': True, 'bull_rsi_required': True, 'bear_strategy': 'mean_reversion', 'bear_bb_std_mult': 3.386172112947609, 'bear_rsi_os': 12, 'bear_rsi_ob': 46, 'bear_adx_thresh': 27.898396221943116, 'bear_atr_min_pct': 0.005046485062292196, 'bear_atr_max_pct': 0.13850006647008456, 'bear_tp_mult': 2.0196454108346806, 'bear_tsl_mult': 0.8672127984000524, 'bear_time_stop': 156, 'bear_use_sma': False, 'bear_use_ema': False, 'bear_use_atr': False, 'bear_use_adx': True, 'bear_use_spike': True, 'bear_rsi_required': True, 'sideways_strategy': 'breakout', 'sideways_bb_std_mult': 2.4487451861210623, 'sideways_rsi_os': 38, 'sideways_rsi_ob': 84, 'sideways_adx_thresh': 10.56418112655902, 'sideways_atr_min_pct': 0.007343983960432398, 'sideways_atr_max_pct': 0.10598872200541003, 'sideways_tp_mult': 1.7303390311784843, 'sideways_tsl_mult': 0.6357263799867692, 'sideways_time_stop': 263, 'sideways_use_sma': True, 'sideways_use_ema': False, 'sideways_use_atr': False, 'sideways_use_adx': False, 'sideways_use_spike': True, 'sideways_rsi_required': False}.
[I 2025-08-31 03:13:18,498] Trial 841 finished with values: [-1000000000.0, 1000000000.0] and parameters: {'p_sma': 50, 'p_std': 46, 'p_atr': 28, 'p_adx': 23, 'rsi_period': 65, 'ema1': 6, 'ema2': 10, 'slip_atr_k': 0.1349894876614866, 'slip_spread_k': 0.3518964738806229, 'spread_hl_frac': 0.04094070780122783, 'bb_std_mult': 1.7855973456857923, 'rsi_os': 20, 'rsi_ob': 79, 'vol_spike': 0.22826118306479382, 'adx_thresh': 19.94289415680676, 'atr_min_pct': 0.003205547017790883, 'atr_max_pct': 0.1347197672210058, 'tp_mult': 1.5813965625002342, 'tsl_mult': 0.2730516213455852, 'strategy': 'mean_reversion', 'time_stop': 93, 'use_sma': True, 'use_atr': True, 'use_adx': True, 'use_ema': False, 'use_spike': True, 'rsi_required': True, 'edge_k': 0.4458471702122244, 'edge_cap': 0.3395010216166354, 'bull_strategy': 'breakout', 'bull_bb_std_mult': 1.90496560273063, 'bull_rsi_os': 51, 'bull_rsi_ob': 68, 'bull_adx_thresh': 6.181692505582494, 'bull_atr_min_pct': 0.01114152391971732, 'bull_atr_max_pct': 0.1384302220711382, 'bull_tp_mult': 1.1768231407138996, 'bull_tsl_mult': 0.2558335663525528, 'bull_time_stop': 63, 'bull_use_sma': True, 'bull_use_ema': False, 'bull_use_atr': False, 'bull_use_adx': True, 'bull_use_spike': False, 'bull_rsi_required': False, 'bear_strategy': 'mean_reversion', 'bear_bb_std_mult': 1.5724239905172128, 'bear_rsi_os': 51, 'bear_rsi_ob': 86, 'bear_adx_thresh': 5.935736707183851, 'bear_atr_min_pct': 0.005805858888051414, 'bear_atr_max_pct': 0.1166495901390925, 'bear_tp_mult': 2.1478163326372064, 'bear_tsl_mult': 0.5696977175047879, 'bear_time_stop': 5, 'bear_use_sma': False, 'bear_use_ema': True, 'bear_use_atr': False, 'bear_use_adx': True, 'bear_use_spike': False, 'bear_rsi_required': True, 'sideways_strategy': 'breakout', 'sideways_bb_std_mult': 0.5997629880847678, 'sideways_rsi_os': 37, 'sideways_rsi_ob': 95, 'sideways_adx_thresh': 16.99301037229309, 'sideways_atr_min_pct': 0.02703640156556686, 'sideways_atr_max_pct': 0.028550346507632024, 'sideways_tp_mult': 1.875525414339469, 'sideways_tsl_mult': 0.47554159097363397, 'sideways_time_stop': 18, 'sideways_use_sma': False, 'sideways_use_ema': False, 'sideways_use_atr': False, 'sideways_use_adx': False, 'sideways_use_spike': True, 'sideways_rsi_required': False}.
[I 2025-08-31 03:13:19,216] Trial 840 finished with values: [-1000000000.0, 1000000000.0] and parameters: {'p_sma': 35, 'p_std': 23, 'p_atr': 28, 'p_adx': 21, 'rsi_period': 66, 'ema1': 6, 'ema2': 15, 'slip_atr_k': 0.1365217005923471, 'slip_spread_k': 0.3370536242096913, 'spread_hl_frac': 0.018551567444210465, 'bb_std_mult': 3.597786977463465, 'rsi_os': 41, 'rsi_ob': 79, 'vol_spike': 0.14323110136368317, 'adx_thresh': 22.723737741575135, 'atr_min_pct': 0.006798349255393287, 'atr_max_pct': 0.13422049546832693, 'tp_mult': 1.3785719539958712, 'tsl_mult': 0.2717401822600673, 'strategy': 'mean_reversion', 'time_stop': 90, 'use_sma': True, 'use_atr': True, 'use_adx': True, 'use_ema': False, 'use_spike': True, 'rsi_required': True, 'edge_k': 1.0574336360403058, 'edge_cap': 0.36504395005253265, 'bull_strategy': 'breakout', 'bull_bb_std_mult': 2.4607966104493477, 'bull_rsi_os': 51, 'bull_rsi_ob': 52, 'bull_adx_thresh': 7.899033983116803, 'bull_atr_min_pct': 0.011288577561630583, 'bull_atr_max_pct': 0.13985426857806474, 'bull_tp_mult': 1.7536923944540133, 'bull_tsl_mult': 0.2589105372784552, 'bull_time_stop': 130, 'bull_use_sma': True, 'bull_use_ema': False, 'bull_use_atr': False, 'bull_use_adx': True, 'bull_use_spike': True, 'bull_rsi_required': False, 'bear_strategy': 'mean_reversion', 'bear_bb_std_mult': 1.3623631502191285, 'bear_rsi_os': 43, 'bear_rsi_ob': 67, 'bear_adx_thresh': 27.91241047117932, 'bear_atr_min_pct': 0.02230289405649098, 'bear_atr_max_pct': 0.13747407313036789, 'bear_tp_mult': 2.0611152906451635, 'bear_tsl_mult': 0.9518753342996717, 'bear_time_stop': 18, 'bear_use_sma': False, 'bear_use_ema': True, 'bear_use_atr': False, 'bear_use_adx': True, 'bear_use_spike': False, 'bear_rsi_required': True, 'sideways_strategy': 'breakout', 'sideways_bb_std_mult': 2.0976739699648412, 'sideways_rsi_os': 38, 'sideways_rsi_ob': 53, 'sideways_adx_thresh': 17.40556563516009, 'sideways_atr_min_pct': 0.025444243436716727, 'sideways_atr_max_pct': 0.033030414259269454, 'sideways_tp_mult': 1.582943820685688, 'sideways_tsl_mult': 0.6288285405615094, 'sideways_time_stop': 262, 'sideways_use_sma': False, 'sideways_use_ema': False, 'sideways_use_atr': False, 'sideways_use_adx': False, 'sideways_use_spike': True, 'sideways_rsi_required': False}.
[I 2025-08-31 03:13:19,298] Trial 839 finished with values: [-1000000000.0, 1000000000.0] and parameters: {'p_sma': 20, 'p_std': 51, 'p_atr': 28, 'p_adx': 13, 'rsi_period': 66, 'ema1': 5, 'ema2': 14, 'slip_atr_k': 0.13594381659011162, 'slip_spread_k': 0.7677377866311748, 'spread_hl_frac': 0.040975772678279794, 'bb_std_mult': 1.4219815574002221, 'rsi_os': 41, 'rsi_ob': 60, 'vol_spike': 0.227754560545953, 'adx_thresh': 19.718334067036764, 'atr_min_pct': 0.006961475140075186, 'atr_max_pct': 0.11014226373672843, 'tp_mult': 1.4459390602552038, 'tsl_mult': 0.6406072384529975, 'strategy': 'mean_reversion', 'time_stop': 93, 'use_sma': True, 'use_atr': False, 'use_adx': False, 'use_ema': True, 'use_spike': True, 'rsi_required': True, 'edge_k': 0.5179507216205224, 'edge_cap': 0.06992782734237848, 'bull_strategy': 'breakout', 'bull_bb_std_mult': 3.41039943809867, 'bull_rsi_os': 19, 'bull_rsi_ob': 68, 'bull_adx_thresh': 6.649609039922828, 'bull_atr_min_pct': 0.021430682671171826, 'bull_atr_max_pct': 0.04943487688649803, 'bull_tp_mult': 1.8308414623502318, 'bull_tsl_mult': 0.2545588444735599, 'bull_time_stop': 70, 'bull_use_sma': True, 'bull_use_ema': False, 'bull_use_atr': True, 'bull_use_adx': False, 'bull_use_spike': True, 'bull_rsi_required': True, 'bear_strategy': 'mean_reversion', 'bear_bb_std_mult': 1.5352039650562235, 'bear_rsi_os': 13, 'bear_rsi_ob': 73, 'bear_adx_thresh': 30.060770502770204, 'bear_atr_min_pct': 0.00493679569544128, 'bear_atr_max_pct': 0.11582603892752377, 'bear_tp_mult': 2.003077420601252, 'bear_tsl_mult': 0.5676149270562184, 'bear_time_stop': 15, 'bear_use_sma': False, 'bear_use_ema': True, 'bear_use_atr': False, 'bear_use_adx': True, 'bear_use_spike': True, 'bear_rsi_required': True, 'sideways_strategy': 'breakout', 'sideways_bb_std_mult': 2.4330586921983746, 'sideways_rsi_os': 20, 'sideways_rsi_ob': 69, 'sideways_adx_thresh': 10.865905585119414, 'sideways_atr_min_pct': 0.025210114643868284, 'sideways_atr_max_pct': 0.011015210387482363, 'sideways_tp_mult': 2.73238250892605, 'sideways_tsl_mult': 0.4599441715293703, 'sideways_time_stop': 230, 'sideways_use_sma': True, 'sideways_use_ema': False, 'sideways_use_atr': False, 'sideways_use_adx': False, 'sideways_use_spike': True, 'sideways_rsi_required': False}.
[I 2025-08-31 03:13:43,822] Trial 842 finished with values: [-1000000000.0, 1000000000.0] and parameters: {'p_sma': 56, 'p_std': 54, 'p_atr': 28, 'p_adx': 23, 'rsi_period': 67, 'ema1': 6, 'ema2': 15, 'slip_atr_k': 0.1355905139877105, 'slip_spread_k': 0.3432536820843508, 'spread_hl_frac': 0.02686758948928891, 'bb_std_mult': 1.7869097242482577, 'rsi_os': 36, 'rsi_ob': 66, 'vol_spike': 0.08638277611699767, 'adx_thresh': 19.998687212770662, 'atr_min_pct': 0.02495807579975529, 'atr_max_pct': 0.11174745429451292, 'tp_mult': 1.7884853891949009, 'tsl_mult': 0.3491392366733129, 'strategy': 'mean_reversion', 'time_stop': 95, 'use_sma': True, 'use_atr': True, 'use_adx': True, 'use_ema': False, 'use_spike': True, 'rsi_required': True, 'edge_k': 1.7897519239551278, 'edge_cap': 0.3384479388150693, 'bull_strategy': 'breakout', 'bull_bb_std_mult': 2.4781496784739336, 'bull_rsi_os': 19, 'bull_rsi_ob': 68, 'bull_adx_thresh': 21.532753322763345, 'bull_atr_min_pct': 0.021483264849142036, 'bull_atr_max_pct': 0.09545695316863397, 'bull_tp_mult': 1.7232895748170123, 'bull_tsl_mult': 0.2609427722549667, 'bull_time_stop': 69, 'bull_use_sma': True, 'bull_use_ema': False, 'bull_use_atr': False, 'bull_use_adx': True, 'bull_use_spike': False, 'bull_rsi_required': False, 'bear_strategy': 'mean_reversion', 'bear_bb_std_mult': 1.529729600853452, 'bear_rsi_os': 43, 'bear_rsi_ob': 45, 'bear_adx_thresh': 6.0654406410134145, 'bear_atr_min_pct': 0.0057259181284611375, 'bear_atr_max_pct': 0.13028096707317693, 'bear_tp_mult': 2.1195542767939504, 'bear_tsl_mult': 0.5686805968705261, 'bear_time_stop': 135, 'bear_use_sma': False, 'bear_use_ema': True, 'bear_use_atr': False, 'bear_use_adx': True, 'bear_use_spike': False, 'bear_rsi_required': True, 'sideways_strategy': 'breakout', 'sideways_bb_std_mult': 3.028324650639398, 'sideways_rsi_os': 40, 'sideways_rsi_ob': 57, 'sideways_adx_thresh': 32.15635489721027, 'sideways_atr_min_pct': 0.027146682621525215, 'sideways_atr_max_pct': 0.06553504039510064, 'sideways_tp_mult': 1.9269157550028695, 'sideways_tsl_mult': 0.6446091936837874, 'sideways_time_stop': 201, 'sideways_use_sma': False, 'sideways_use_ema': False, 'sideways_use_atr': False, 'sideways_use_adx': False, 'sideways_use_spike': True, 'sideways_rsi_required': False}.
[I 2025-08-31 03:13:51,057] Trial 843 finished with values: [-1000000000.0, 1000000000.0] and parameters: {'p_sma': 35, 'p_std': 55, 'p_atr': 28, 'p_adx': 16, 'rsi_period': 84, 'ema1': 6, 'ema2': 40, 'slip_atr_k': 0.07566456588888079, 'slip_spread_k': 0.15872792814881717, 'spread_hl_frac': 0.0023662257153118545, 'bb_std_mult': 1.5141601201880872, 'rsi_os': 38, 'rsi_ob': 66, 'vol_spike': 0.14148932428864053, 'adx_thresh': 34.24525741802619, 'atr_min_pct': 0.007067984033326285, 'atr_max_pct': 0.11166009326656555, 'tp_mult': 1.2754802012813269, 'tsl_mult': 0.35573787637588083, 'strategy': 'mean_reversion', 'time_stop': 104, 'use_sma': False, 'use_atr': False, 'use_adx': False, 'use_ema': False, 'use_spike': False, 'rsi_required': True, 'edge_k': 1.0731603939379537, 'edge_cap': 0.07117134314469196, 'bull_strategy': 'mean_reversion', 'bull_bb_std_mult': 2.463496618795719, 'bull_rsi_os': 55, 'bull_rsi_ob': 63, 'bull_adx_thresh': 17.417564866034564, 'bull_atr_min_pct': 0.010315573702873181, 'bull_atr_max_pct': 0.13295958116100431, 'bull_tp_mult': 2.317242340589759, 'bull_tsl_mult': 0.26282507538077166, 'bull_time_stop': 129, 'bull_use_sma': True, 'bull_use_ema': False, 'bull_use_atr': False, 'bull_use_adx': True, 'bull_use_spike': True, 'bull_rsi_required': True, 'bear_strategy': 'breakout', 'bear_bb_std_mult': 1.1870652824238639, 'bear_rsi_os': 43, 'bear_rsi_ob': 73, 'bear_adx_thresh': 22.374251428179456, 'bear_atr_min_pct': 0.006982949074166082, 'bear_atr_max_pct': 0.017586180187913178, 'bear_tp_mult': 2.11422687663565, 'bear_tsl_mult': 0.9524189074856011, 'bear_time_stop': 17, 'bear_use_sma': False, 'bear_use_ema': False, 'bear_use_atr': True, 'bear_use_adx': True, 'bear_use_spike': False, 'bear_rsi_required': True, 'sideways_strategy': 'breakout', 'sideways_bb_std_mult': 2.137577522407228, 'sideways_rsi_os': 21, 'sideways_rsi_ob': 61, 'sideways_adx_thresh': 9.40396553489905, 'sideways_atr_min_pct': 0.02642326851193376, 'sideways_atr_max_pct': 0.04819700821499051, 'sideways_tp_mult': 1.694363199631995, 'sideways_tsl_mult': 0.25057633531984125, 'sideways_time_stop': 79, 'sideways_use_sma': True, 'sideways_use_ema': False, 'sideways_use_atr': False, 'sideways_use_adx': False, 'sideways_use_spike': False, 'sideways_rsi_required': False}.
[I 2025-08-31 03:13:51,988] Trial 845 finished with values: [-1000000000.0, 1000000000.0] and parameters: {'p_sma': 56, 'p_std': 54, 'p_atr': 26, 'p_adx': 19, 'rsi_period': 73, 'ema1': 12, 'ema2': 37, 'slip_atr_k': 0.10389194321558953, 'slip_spread_k': 0.16022537018387564, 'spread_hl_frac': 0.022091809411982223, 'bb_std_mult': 2.3033343437285567, 'rsi_os': 31, 'rsi_ob': 90, 'vol_spike': 0.19807225422822144, 'adx_thresh': 21.79832570541379, 'atr_min_pct': 0.024876010622951736, 'atr_max_pct': 0.054908532757258946, 'tp_mult': 2.7763222695606893, 'tsl_mult': 0.35879438096341243, 'strategy': 'mean_reversion', 'time_stop': 218, 'use_sma': False, 'use_atr': False, 'use_adx': False, 'use_ema': False, 'use_spike': False, 'rsi_required': True, 'edge_k': 0.6003056761492161, 'edge_cap': 0.18604515982104203, 'bull_strategy': 'mean_reversion', 'bull_bb_std_mult': 1.1368677035822505, 'bull_rsi_os': 34, 'bull_rsi_ob': 59, 'bull_adx_thresh': 5.656098688942463, 'bull_atr_min_pct': 0.010171141478769345, 'bull_atr_max_pct': 0.13412256388850188, 'bull_tp_mult': 1.5995810223710327, 'bull_tsl_mult': 0.6718697308159107, 'bull_time_stop': 103, 'bull_use_sma': True, 'bull_use_ema': False, 'bull_use_atr': False, 'bull_use_adx': True, 'bull_use_spike': False, 'bull_rsi_required': True, 'bear_strategy': 'breakout', 'bear_bb_std_mult': 1.182737766589444, 'bear_rsi_os': 49, 'bear_rsi_ob': 45, 'bear_adx_thresh': 20.39419706477888, 'bear_atr_min_pct': 0.029920802781208983, 'bear_atr_max_pct': 0.018450099845001827, 'bear_tp_mult': 2.2850240595265525, 'bear_tsl_mult': 0.5136081466906183, 'bear_time_stop': 49, 'bear_use_sma': False, 'bear_use_ema': False, 'bear_use_atr': True, 'bear_use_adx': False, 'bear_use_spike': False, 'bear_rsi_required': True, 'sideways_strategy': 'breakout', 'sideways_bb_std_mult': 1.4168427461294857, 'sideways_rsi_os': 40, 'sideways_rsi_ob': 92, 'sideways_adx_thresh': 27.130189996686223, 'sideways_atr_min_pct': 0.026360593828145394, 'sideways_atr_max_pct': 0.06537071850031617, 'sideways_tp_mult': 1.9224845255993588, 'sideways_tsl_mult': 0.5960076259294258, 'sideways_time_stop': 202, 'sideways_use_sma': True, 'sideways_use_ema': False, 'sideways_use_atr': False, 'sideways_use_adx': True, 'sideways_use_spike': False, 'sideways_rsi_required': False}.
[I 2025-08-31 03:13:52,367] Trial 844 finished with values: [-1000000000.0, 1000000000.0] and parameters: {'p_sma': 55, 'p_std': 12, 'p_atr': 26, 'p_adx': 10, 'rsi_period': 72, 'ema1': 12, 'ema2': 40, 'slip_atr_k': 0.18909418660862, 'slip_spread_k': 0.16219953003556037, 'spread_hl_frac': 0.002713636469667738, 'bb_std_mult': 1.5609167094816119, 'rsi_os': 31, 'rsi_ob': 66, 'vol_spike': 0.1742418299472456, 'adx_thresh': 21.78362557083048, 'atr_min_pct': 0.02263818534977871, 'atr_max_pct': 0.123364707796819, 'tp_mult': 1.6764275269851876, 'tsl_mult': 0.3677587202992066, 'strategy': 'mean_reversion', 'time_stop': 252, 'use_sma': False, 'use_atr': False, 'use_adx': False, 'use_ema': False, 'use_spike': False, 'rsi_required': True, 'edge_k': 0.5862564408953268, 'edge_cap': 0.18210506163466625, 'bull_strategy': 'mean_reversion', 'bull_bb_std_mult': 1.2143550264521765, 'bull_rsi_os': 55, 'bull_rsi_ob': 59, 'bull_adx_thresh': 17.431763478336805, 'bull_atr_min_pct': 0.007089218707532995, 'bull_atr_max_pct': 0.1334688831522016, 'bull_tp_mult': 2.2628933612229374, 'bull_tsl_mult': 0.2271106846243971, 'bull_time_stop': 130, 'bull_use_sma': True, 'bull_use_ema': False, 'bull_use_atr': False, 'bull_use_adx': True, 'bull_use_spike': False, 'bull_rsi_required': True, 'bear_strategy': 'breakout', 'bear_bb_std_mult': 1.193913488346652, 'bear_rsi_os': 19, 'bear_rsi_ob': 45, 'bear_adx_thresh': 6.658906668688252, 'bear_atr_min_pct': 0.007120242801623633, 'bear_atr_max_pct': 0.018312881798830744, 'bear_tp_mult': 2.437853817639185, 'bear_tsl_mult': 0.49048765742623707, 'bear_time_stop': 114, 'bear_use_sma': False, 'bear_use_ema': False, 'bear_use_atr': True, 'bear_use_adx': False, 'bear_use_spike': False, 'bear_rsi_required': True, 'sideways_strategy': 'breakout', 'sideways_bb_std_mult': 0.5924602216284115, 'sideways_rsi_os': 40, 'sideways_rsi_ob': 92, 'sideways_adx_thresh': 9.41690994215331, 'sideways_atr_min_pct': 0.026969730280373472, 'sideways_atr_max_pct': 0.04558305931024513, 'sideways_tp_mult': 1.7018344845106104, 'sideways_tsl_mult': 0.6516447916525784, 'sideways_time_stop': 201, 'sideways_use_sma': True, 'sideways_use_ema': False, 'sideways_use_atr': False, 'sideways_use_adx': True, 'sideways_use_spike': False, 'sideways_rsi_required': False}.
