[I 2025-08-31 00:19:05,226] Trial 135 finished with values: [-1000000000.0, 1000000000.0] and parameters: {'p_sma': 13, 'p_std': 36, 'p_atr': 14, 'p_adx': 15, 'rsi_period': 28, 'ema1': 25, 'ema2': 18, 'slip_atr_k': 0.2351975292310249, 'slip_spread_k': 0.6229692993594591, 'spread_hl_frac': 0.019415972536625307, 'bb_std_mult': 3.3904669651552894, 'rsi_os': 52, 'rsi_ob': 75, 'vol_spike': 0.1403848294554578, 'adx_thresh': 11.731290222431438, 'atr_min_pct': 0.004243777235628184, 'atr_max_pct': 0.05682176958089399, 'tp_mult': 2.5101732225551543, 'tsl_mult': 0.16506267026343885, 'strategy': 'breakout', 'time_stop': 51, 'use_sma': True, 'use_atr': False, 'use_adx': False, 'use_ema': False, 'use_spike': False, 'rsi_required': True, 'edge_k': 0.6548805788426587, 'edge_cap': 0.9802857958946465, 'bull_strategy': 'breakout', 'bull_bb_std_mult': 1.5378946953861572, 'bull_rsi_os': 5, 'bull_rsi_ob': 83, 'bull_adx_thresh': 32.04567499270852, 'bull_atr_min_pct': 0.026699446593962804, 'bull_atr_max_pct': 0.11866517603350361, 'bull_tp_mult': 2.995738957997482, 'bull_tsl_mult': 0.35864673494720817, 'bull_time_stop': 240, 'bull_use_sma': False, 'bull_use_ema': True, 'bull_use_atr': False, 'bull_use_adx': True, 'bull_use_spike': False, 'bull_rsi_required': False, 'bear_strategy': 'breakout', 'bear_bb_std_mult': 3.182712450559488, 'bear_rsi_os': 44, 'bear_rsi_ob': 52, 'bear_adx_thresh': 25.053702852890016, 'bear_atr_min_pct': 0.028022312689772264, 'bear_atr_max_pct': 0.13159726068340327, 'bear_tp_mult': 1.9584139724912177, 'bear_tsl_mult': 0.23695461323190928, 'bear_time_stop': 146, 'bear_use_sma': False, 'bear_use_ema': False, 'bear_use_atr': True, 'bear_use_adx': True, 'bear_use_spike': True, 'bear_rsi_required': False, 'sideways_strategy': 'mean_reversion', 'sideways_bb_std_mult': 3.172921232631996, 'sideways_rsi_os': 18, 'sideways_rsi_ob': 69, 'sideways_adx_thresh': 28.171367297342982, 'sideways_atr_min_pct': 0.0010292877777081204, 'sideways_atr_max_pct': 0.14865199025888076, 'sideways_tp_mult': 2.6376825975800715, 'sideways_tsl_mult': 0.19767208996673136, 'sideways_time_stop': 96, 'sideways_use_sma': False, 'sideways_use_ema': False, 'sideways_use_atr': False, 'sideways_use_adx': False, 'sideways_use_spike': True, 'sideways_rsi_required': False}.
[I 2025-08-31 00:19:05,347] Trial 134 finished with values: [-1000000000.0, 1000000000.0] and parameters: {'p_sma': 48, 'p_std': 35, 'p_atr': 26, 'p_adx': 9, 'rsi_period': 28, 'ema1': 25, 'ema2': 24, 'slip_atr_k': 0.07956975004778273, 'slip_spread_k': 0.2568324200566705, 'spread_hl_frac': 0.006442884249458734, 'bb_std_mult': 3.42802782529005, 'rsi_os': 52, 'rsi_ob': 73, 'vol_spike': 0.1691077805998378, 'adx_thresh': 11.443986429299343, 'atr_min_pct': 0.022626196148475768, 'atr_max_pct': 0.05765975518098977, 'tp_mult': 2.503236165063359, 'tsl_mult': 0.17035854796708555, 'strategy': 'breakout', 'time_stop': 51, 'use_sma': True, 'use_atr': False, 'use_adx': False, 'use_ema': False, 'use_spike': False, 'rsi_required': True, 'edge_k': 0.7803118165991348, 'edge_cap': 0.43851266316332405, 'bull_strategy': 'breakout', 'bull_bb_std_mult': 1.514147078671171, 'bull_rsi_os': 37, 'bull_rsi_ob': 84, 'bull_adx_thresh': 13.771709597235658, 'bull_atr_min_pct': 0.0016354626607622412, 'bull_atr_max_pct': 0.09099582659511415, 'bull_tp_mult': 2.998688021591603, 'bull_tsl_mult': 0.2518275594139669, 'bull_time_stop': 144, 'bull_use_sma': False, 'bull_use_ema': True, 'bull_use_atr': False, 'bull_use_adx': True, 'bull_use_spike': False, 'bull_rsi_required': False, 'bear_strategy': 'mean_reversion', 'bear_bb_std_mult': 1.4098378396832054, 'bear_rsi_os': 23, 'bear_rsi_ob': 78, 'bear_adx_thresh': 11.638322628458255, 'bear_atr_min_pct': 0.0034337886647810185, 'bear_atr_max_pct': 0.13219428938565753, 'bear_tp_mult': 1.4183027647528705, 'bear_tsl_mult': 0.10821133268331906, 'bear_time_stop': 73, 'bear_use_sma': False, 'bear_use_ema': False, 'bear_use_atr': True, 'bear_use_adx': True, 'bear_use_spike': False, 'bear_rsi_required': False, 'sideways_strategy': 'mean_reversion', 'sideways_bb_std_mult': 1.415768045614242, 'sideways_rsi_os': 49, 'sideways_rsi_ob': 66, 'sideways_adx_thresh': 28.539191445599442, 'sideways_atr_min_pct': 0.003029164517476094, 'sideways_atr_max_pct': 0.044629901197337535, 'sideways_tp_mult': 2.484508339649134, 'sideways_tsl_mult': 0.2833958648303034, 'sideways_time_stop': 100, 'sideways_use_sma': True, 'sideways_use_ema': True, 'sideways_use_atr': True, 'sideways_use_adx': True, 'sideways_use_spike': True, 'sideways_rsi_required': False}.
[I 2025-08-31 00:19:36,203] Trial 140 finished with values: [-1000000000.0, 1000000000.0] and parameters: {'p_sma': 46, 'p_std': 58, 'p_atr': 15, 'p_adx': 13, 'rsi_period': 40, 'ema1': 10, 'ema2': 20, 'slip_atr_k': 0.17402605769738896, 'slip_spread_k': 0.5589991983166354, 'spread_hl_frac': 0.013553300084169502, 'bb_std_mult': 0.8844763839342955, 'rsi_os': 32, 'rsi_ob': 77, 'vol_spike': 0.185535525387707, 'adx_thresh': 13.839924104916246, 'atr_min_pct': 2.0361672171897126e-06, 'atr_max_pct': 0.0659538184707697, 'tp_mult': 2.1423303908851383, 'tsl_mult': 0.10950834436146546, 'strategy': 'breakout', 'time_stop': 41, 'use_sma': True, 'use_atr': False, 'use_adx': False, 'use_ema': True, 'use_spike': False, 'rsi_required': True, 'edge_k': 0.8347763818024823, 'edge_cap': 0.9389021012721277, 'bull_strategy': 'breakout', 'bull_bb_std_mult': 3.2048340573568543, 'bull_rsi_os': 39, 'bull_rsi_ob': 74, 'bull_adx_thresh': 18.731319546150022, 'bull_atr_min_pct': 0.008899534470880559, 'bull_atr_max_pct': 0.14627806967336926, 'bull_tp_mult': 2.4714103883671097, 'bull_tsl_mult': 0.148605708063896, 'bull_time_stop': 28, 'bull_use_sma': False, 'bull_use_ema': True, 'bull_use_atr': False, 'bull_use_adx': True, 'bull_use_spike': False, 'bull_rsi_required': True, 'bear_strategy': 'breakout', 'bear_bb_std_mult': 0.5851141232275276, 'bear_rsi_os': 48, 'bear_rsi_ob': 90, 'bear_adx_thresh': 27.906738086839074, 'bear_atr_min_pct': 0.015227031952410009, 'bear_atr_max_pct': 0.14032820498988413, 'bear_tp_mult': 2.1325868398463, 'bear_tsl_mult': 0.17351417146336157, 'bear_time_stop': 158, 'bear_use_sma': True, 'bear_use_ema': False, 'bear_use_atr': True, 'bear_use_adx': True, 'bear_use_spike': False, 'bear_rsi_required': False, 'sideways_strategy': 'mean_reversion', 'sideways_bb_std_mult': 1.259681836615073, 'sideways_rsi_os': 21, 'sideways_rsi_ob': 92, 'sideways_adx_thresh': 9.452234032988628, 'sideways_atr_min_pct': 0.01090688267874838, 'sideways_atr_max_pct': 0.12861475657724128, 'sideways_tp_mult': 1.0359710243063036, 'sideways_tsl_mult': 0.5924321715012318, 'sideways_time_stop': 114, 'sideways_use_sma': True, 'sideways_use_ema': True, 'sideways_use_atr': True, 'sideways_use_adx': True, 'sideways_use_spike': True, 'sideways_rsi_required': False}.
[I 2025-08-31 00:19:36,411] Trial 138 finished with values: [-1000000000.0, 1000000000.0] and parameters: {'p_sma': 17, 'p_std': 35, 'p_atr': 22, 'p_adx': 7, 'rsi_period': 28, 'ema1': 25, 'ema2': 19, 'slip_atr_k': 0.016645146812668404, 'slip_spread_k': 0.2822543363471586, 'spread_hl_frac': 0.01355621712510481, 'bb_std_mult': 2.941136695698148, 'rsi_os': 55, 'rsi_ob': 78, 'vol_spike': 0.18672057793476976, 'adx_thresh': 13.831445080899053, 'atr_min_pct': 0.00014517865879463938, 'atr_max_pct': 0.06553034242857567, 'tp_mult': 2.6057533360603435, 'tsl_mult': 0.11431003432965935, 'strategy': 'breakout', 'time_stop': 38, 'use_sma': True, 'use_atr': False, 'use_adx': False, 'use_ema': True, 'use_spike': False, 'rsi_required': True, 'edge_k': 0.843171185136838, 'edge_cap': 0.9796923728001289, 'bull_strategy': 'breakout', 'bull_bb_std_mult': 1.5397544599036854, 'bull_rsi_os': 37, 'bull_rsi_ob': 83, 'bull_adx_thresh': 19.535932450879322, 'bull_atr_min_pct': 0.00031783737188780295, 'bull_atr_max_pct': 0.08612637582821538, 'bull_tp_mult': 1.6516199496866837, 'bull_tsl_mult': 0.15465716883698905, 'bull_time_stop': 162, 'bull_use_sma': False, 'bull_use_ema': True, 'bull_use_atr': False, 'bull_use_adx': True, 'bull_use_spike': False, 'bull_rsi_required': False, 'bear_strategy': 'breakout', 'bear_bb_std_mult': 0.5888191297340347, 'bear_rsi_os': 8, 'bear_rsi_ob': 72, 'bear_adx_thresh': 27.994154650263127, 'bear_atr_min_pct': 0.02773392220113815, 'bear_atr_max_pct': 0.06759933144037399, 'bear_tp_mult': 2.0376381856403114, 'bear_tsl_mult': 0.24999119611213927, 'bear_time_stop': 34, 'bear_use_sma': True, 'bear_use_ema': False, 'bear_use_atr': True, 'bear_use_adx': True, 'bear_use_spike': False, 'bear_rsi_required': False, 'sideways_strategy': 'mean_reversion', 'sideways_bb_std_mult': 0.8050324796337187, 'sideways_rsi_os': 45, 'sideways_rsi_ob': 67, 'sideways_adx_thresh': 34.3336447881314, 'sideways_atr_min_pct': 0.02027846786133468, 'sideways_atr_max_pct': 0.14280777178418835, 'sideways_tp_mult': 1.0473251141124251, 'sideways_tsl_mult': 0.8270132511274295, 'sideways_time_stop': 103, 'sideways_use_sma': True, 'sideways_use_ema': True, 'sideways_use_atr': True, 'sideways_use_adx': True, 'sideways_use_spike': True, 'sideways_rsi_required': False}.
[I 2025-08-31 00:19:36,523] Trial 139 finished with values: [-1000000000.0, 1000000000.0] and parameters: {'p_sma': 46, 'p_std': 58, 'p_atr': 24, 'p_adx': 7, 'rsi_period': 39, 'ema1': 17, 'ema2': 53, 'slip_atr_k': 0.17673110323878238, 'slip_spread_k': 0.5562109455757198, 'spread_hl_frac': 0.006401751940561436, 'bb_std_mult': 2.675014744158169, 'rsi_os': 31, 'rsi_ob': 70, 'vol_spike': 0.032522501801988485, 'adx_thresh': 31.227167774277326, 'atr_min_pct': 0.006892306387099726, 'atr_max_pct': 0.0627568399453252, 'tp_mult': 2.607483968208867, 'tsl_mult': 0.10648630380949967, 'strategy': 'breakout', 'time_stop': 41, 'use_sma': True, 'use_atr': False, 'use_adx': False, 'use_ema': True, 'use_spike': False, 'rsi_required': True, 'edge_k': 0.8107246500512033, 'edge_cap': 0.9488260037697543, 'bull_strategy': 'breakout', 'bull_bb_std_mult': 1.7044115142541871, 'bull_rsi_os': 39, 'bull_rsi_ob': 72, 'bull_adx_thresh': 13.776707411030616, 'bull_atr_min_pct': 0.011911256202142081, 'bull_atr_max_pct': 0.08441668360499628, 'bull_tp_mult': 2.7463796191276897, 'bull_tsl_mult': 0.7918245281881542, 'bull_time_stop': 25, 'bull_use_sma': False, 'bull_use_ema': True, 'bull_use_atr': False, 'bull_use_adx': True, 'bull_use_spike': False, 'bull_rsi_required': False, 'bear_strategy': 'breakout', 'bear_bb_std_mult': 0.5746944818038688, 'bear_rsi_os': 7, 'bear_rsi_ob': 63, 'bear_adx_thresh': 28.781927353296624, 'bear_atr_min_pct': 0.00864632083801459, 'bear_atr_max_pct': 0.14052839824802785, 'bear_tp_mult': 1.391448141179576, 'bear_tsl_mult': 0.19443218068120188, 'bear_time_stop': 158, 'bear_use_sma': True, 'bear_use_ema': False, 'bear_use_atr': True, 'bear_use_adx': True, 'bear_use_spike': False, 'bear_rsi_required': False, 'sideways_strategy': 'mean_reversion', 'sideways_bb_std_mult': 1.2536752103686069, 'sideways_rsi_os': 45, 'sideways_rsi_ob': 66, 'sideways_adx_thresh': 6.184206187921166, 'sideways_atr_min_pct': 0.0048719377302193275, 'sideways_atr_max_pct': 0.04613647666503867, 'sideways_tp_mult': 1.046801227205751, 'sideways_tsl_mult': 0.3433697195038662, 'sideways_time_stop': 137, 'sideways_use_sma': True, 'sideways_use_ema': True, 'sideways_use_atr': True, 'sideways_use_adx': True, 'sideways_use_spike': True, 'sideways_rsi_required': False}.
[I 2025-08-31 00:19:36,680] Trial 137 finished with values: [-1000000000.0, 1000000000.0] and parameters: {'p_sma': 48, 'p_std': 58, 'p_atr': 22, 'p_adx': 7, 'rsi_period': 28, 'ema1': 25, 'ema2': 53, 'slip_atr_k': 0.1193183529415487, 'slip_spread_k': 0.2573154500935282, 'spread_hl_frac': 0.013183429783472594, 'bb_std_mult': 3.4143110280863187, 'rsi_os': 55, 'rsi_ob': 70, 'vol_spike': 0.18254978924489254, 'adx_thresh': 13.703293727746894, 'atr_min_pct': 2.9138344507087698e-05, 'atr_max_pct': 0.062306896687428955, 'tp_mult': 2.7578939271845018, 'tsl_mult': 0.200457126819156, 'strategy': 'breakout', 'time_stop': 37, 'use_sma': True, 'use_atr': False, 'use_adx': False, 'use_ema': False, 'use_spike': False, 'rsi_required': True, 'edge_k': 0.6452303849183043, 'edge_cap': 0.9779919892501228, 'bull_strategy': 'breakout', 'bull_bb_std_mult': 2.1042516362062966, 'bull_rsi_os': 37, 'bull_rsi_ob': 84, 'bull_adx_thresh': 29.137603865672297, 'bull_atr_min_pct': 4.876371090165689e-05, 'bull_atr_max_pct': 0.01405643250885294, 'bull_tp_mult': 2.8241814124522016, 'bull_tsl_mult': 0.9774449991612533, 'bull_time_stop': 28, 'bull_use_sma': False, 'bull_use_ema': True, 'bull_use_atr': False, 'bull_use_adx': True, 'bull_use_spike': False, 'bull_rsi_required': False, 'bear_strategy': 'breakout', 'bear_bb_std_mult': 2.992934506364141, 'bear_rsi_os': 24, 'bear_rsi_ob': 67, 'bear_adx_thresh': 27.80245295095125, 'bear_atr_min_pct': 0.01345151524567172, 'bear_atr_max_pct': 0.1400708473979325, 'bear_tp_mult': 1.3938959051955693, 'bear_tsl_mult': 0.23799264220961264, 'bear_time_stop': 85, 'bear_use_sma': False, 'bear_use_ema': False, 'bear_use_atr': True, 'bear_use_adx': True, 'bear_use_spike': False, 'bear_rsi_required': False, 'sideways_strategy': 'mean_reversion', 'sideways_bb_std_mult': 0.812410836346236, 'sideways_rsi_os': 18, 'sideways_rsi_ob': 66, 'sideways_adx_thresh': 6.030172687612865, 'sideways_atr_min_pct': 0.01702777769109301, 'sideways_atr_max_pct': 0.04310284046445477, 'sideways_tp_mult': 2.639460101085319, 'sideways_tsl_mult': 0.33739613533664986, 'sideways_time_stop': 100, 'sideways_use_sma': True, 'sideways_use_ema': True, 'sideways_use_atr': True, 'sideways_use_adx': True, 'sideways_use_spike': True, 'sideways_rsi_required': False}.
[I 2025-08-31 00:20:05,426] Trial 144 finished with values: [-1000000000.0, 1000000000.0] and parameters: {'p_sma': 50, 'p_std': 21, 'p_atr': 12, 'p_adx': 8, 'rsi_period': 35, 'ema1': 24, 'ema2': 21, 'slip_atr_k': 0.004133870331454695, 'slip_spread_k': 0.2213870417665042, 'spread_hl_frac': 0.009639268879573955, 'bb_std_mult': 1.528930191892433, 'rsi_os': 54, 'rsi_ob': 47, 'vol_spike': 0.00569550863776311, 'adx_thresh': 34.00996071328577, 'atr_min_pct': 0.0014205608556009212, 'atr_max_pct': 0.07319039155903265, 'tp_mult': 2.820126340159757, 'tsl_mult': 0.3396258326396083, 'strategy': 'breakout', 'time_stop': 93, 'use_sma': False, 'use_atr': False, 'use_adx': True, 'use_ema': False, 'use_spike': False, 'rsi_required': True, 'edge_k': 0.6917545812514536, 'edge_cap': 0.9136373685028671, 'bull_strategy': 'mean_reversion', 'bull_bb_std_mult': 3.3992157758308466, 'bull_rsi_os': 31, 'bull_rsi_ob': 56, 'bull_adx_thresh': 14.76338054347875, 'bull_atr_min_pct': 0.01739515480747072, 'bull_atr_max_pct': 0.1314087222070128, 'bull_tp_mult': 2.9224624662285383, 'bull_tsl_mult': 0.2749397531098081, 'bull_time_stop': 159, 'bull_use_sma': False, 'bull_use_ema': False, 'bull_use_atr': True, 'bull_use_adx': True, 'bull_use_spike': False, 'bull_rsi_required': True, 'bear_strategy': 'mean_reversion', 'bear_bb_std_mult': 0.6352248175138842, 'bear_rsi_os': 28, 'bear_rsi_ob': 77, 'bear_adx_thresh': 26.265556338041566, 'bear_atr_min_pct': 0.00812636101726551, 'bear_atr_max_pct': 0.14402100872268467, 'bear_tp_mult': 2.27663617119908, 'bear_tsl_mult': 0.20628416893362747, 'bear_time_stop': 102, 'bear_use_sma': False, 'bear_use_ema': False, 'bear_use_atr': True, 'bear_use_adx': False, 'bear_use_spike': False, 'bear_rsi_required': False, 'sideways_strategy': 'mean_reversion', 'sideways_bb_std_mult': 1.113263922844844, 'sideways_rsi_os': 34, 'sideways_rsi_ob': 70, 'sideways_adx_thresh': 29.613858073440518, 'sideways_atr_min_pct': 0.022110206752626222, 'sideways_atr_max_pct': 0.1371541823321566, 'sideways_tp_mult': 2.2496200901666326, 'sideways_tsl_mult': 0.23320501918422842, 'sideways_time_stop': 109, 'sideways_use_sma': False, 'sideways_use_ema': False, 'sideways_use_atr': False, 'sideways_use_adx': False, 'sideways_use_spike': False, 'sideways_rsi_required': False}.
[I 2025-08-31 00:20:05,784] Trial 143 finished with values: [-0.023891757805377334, 0.02379801643933456] and parameters: {'p_sma': 49, 'p_std': 32, 'p_atr': 12, 'p_adx': 8, 'rsi_period': 34, 'ema1': 24, 'ema2': 14, 'slip_atr_k': 0.0706490583309825, 'slip_spread_k': 0.2197620459932216, 'spread_hl_frac': 0.009166396881567472, 'bb_std_mult': 3.483260603752315, 'rsi_os': 20, 'rsi_ob': 66, 'vol_spike': 0.01475908771303447, 'adx_thresh': 34.35534994916088, 'atr_min_pct': 0.001766160074626432, 'atr_max_pct': 0.060977273977449606, 'tp_mult': 2.825450304403088, 'tsl_mult': 0.1404287317124791, 'strategy': 'breakout', 'time_stop': 34, 'use_sma': True, 'use_atr': False, 'use_adx': True, 'use_ema': False, 'use_spike': False, 'rsi_required': True, 'edge_k': 1.478557590256997, 'edge_cap': 0.5874215064520294, 'bull_strategy': 'mean_reversion', 'bull_bb_std_mult': 1.8866609434232988, 'bull_rsi_os': 31, 'bull_rsi_ob': 61, 'bull_adx_thresh': 23.72188781370249, 'bull_atr_min_pct': 0.000751679702493849, 'bull_atr_max_pct': 0.05383228893548606, 'bull_tp_mult': 2.911729984060848, 'bull_tsl_mult': 0.0004585254594959842, 'bull_time_stop': 157, 'bull_use_sma': False, 'bull_use_ema': False, 'bull_use_atr': True, 'bull_use_adx': True, 'bull_use_spike': False, 'bull_rsi_required': True, 'bear_strategy': 'breakout', 'bear_bb_std_mult': 0.664298851642485, 'bear_rsi_os': 18, 'bear_rsi_ob': 76, 'bear_adx_thresh': 32.89171343664072, 'bear_atr_min_pct': 0.00801975445063437, 'bear_atr_max_pct': 0.10136629250626733, 'bear_tp_mult': 1.8557683758263246, 'bear_tsl_mult': 0.205774782542002, 'bear_time_stop': 290, 'bear_use_sma': False, 'bear_use_ema': False, 'bear_use_atr': True, 'bear_use_adx': False, 'bear_use_spike': False, 'bear_rsi_required': False, 'sideways_strategy': 'mean_reversion', 'sideways_bb_std_mult': 1.107570235225217, 'sideways_rsi_os': 30, 'sideways_rsi_ob': 56, 'sideways_adx_thresh': 19.640686970913947, 'sideways_atr_min_pct': 0.02206634226351054, 'sideways_atr_max_pct': 0.10524022398651564, 'sideways_tp_mult': 1.2845533006821996, 'sideways_tsl_mult': 0.5550416309818883, 'sideways_time_stop': 79, 'sideways_use_sma': False, 'sideways_use_ema': False, 'sideways_use_atr': False, 'sideways_use_adx': False, 'sideways_use_spike': True, 'sideways_rsi_required': False}.
[I 2025-08-31 00:20:05,970] Trial 141 finished with values: [-1000000000.0, 1000000000.0] and parameters: {'p_sma': 16, 'p_std': 40, 'p_atr': 12, 'p_adx': 7, 'rsi_period': 38, 'ema1': 24, 'ema2': 19, 'slip_atr_k': 0.042701584953518015, 'slip_spread_k': 0.9634154561834329, 'spread_hl_frac': 0.009670874280259806, 'bb_std_mult': 0.7301358537349221, 'rsi_os': 55, 'rsi_ob': 70, 'vol_spike': 0.21440538151580008, 'adx_thresh': 28.614754534002063, 'atr_min_pct': 0.006990448430238518, 'atr_max_pct': 0.06255714328562295, 'tp_mult': 2.415328384170798, 'tsl_mult': 0.14229288399162196, 'strategy': 'breakout', 'time_stop': 275, 'use_sma': True, 'use_atr': False, 'use_adx': True, 'use_ema': False, 'use_spike': False, 'rsi_required': True, 'edge_k': 0.6997316672464668, 'edge_cap': 0.9622145846432014, 'bull_strategy': 'mean_reversion', 'bull_bb_std_mult': 2.241088359786308, 'bull_rsi_os': 35, 'bull_rsi_ob': 58, 'bull_adx_thresh': 24.218473737794515, 'bull_atr_min_pct': 0.00046131950248945116, 'bull_atr_max_pct': 0.09303760971105236, 'bull_tp_mult': 2.754099452355551, 'bull_tsl_mult': 0.7826929219509002, 'bull_time_stop': 190, 'bull_use_sma': False, 'bull_use_ema': True, 'bull_use_atr': False, 'bull_use_adx': True, 'bull_use_spike': False, 'bull_rsi_required': False, 'bear_strategy': 'breakout', 'bear_bb_std_mult': 0.6345098990968027, 'bear_rsi_os': 25, 'bear_rsi_ob': 72, 'bear_adx_thresh': 22.288178602499386, 'bear_atr_min_pct': 0.009084627794760243, 'bear_atr_max_pct': 0.06865495089198421, 'bear_tp_mult': 1.8641086700318164, 'bear_tsl_mult': 0.1936672555092668, 'bear_time_stop': 291, 'bear_use_sma': False, 'bear_use_ema': False, 'bear_use_atr': True, 'bear_use_adx': True, 'bear_use_spike': False, 'bear_rsi_required': False, 'sideways_strategy': 'mean_reversion', 'sideways_bb_std_mult': 3.3606006836536126, 'sideways_rsi_os': 45, 'sideways_rsi_ob': 59, 'sideways_adx_thresh': 29.4847452694955, 'sideways_atr_min_pct': 0.022169996467953073, 'sideways_atr_max_pct': 0.13624585674856793, 'sideways_tp_mult': 1.2009943348070102, 'sideways_tsl_mult': 0.34801523051900696, 'sideways_time_stop': 106, 'sideways_use_sma': False, 'sideways_use_ema': False, 'sideways_use_atr': False, 'sideways_use_adx': False, 'sideways_use_spike': True, 'sideways_rsi_required': False}.
