[I 2025-08-31 00:43:26,242] Trial 360 finished with values: [-1000000000.0, 1000000000.0] and parameters: {'p_sma': 41, 'p_std': 38, 'p_atr': 21, 'p_adx': 10, 'rsi_period': 56, 'ema1': 21, 'ema2': 35, 'slip_atr_k': 0.160434135946997, 'slip_spread_k': 0.23515622910412215, 'spread_hl_frac': 0.04238444203987579, 'bb_std_mult': 1.6617994467806814, 'rsi_os': 53, 'rsi_ob': 78, 'vol_spike': 0.189925860044819, 'adx_thresh': 13.771606260983043, 'atr_min_pct': 0.008971143682142026, 'atr_max_pct': 0.14963812130665638, 'tp_mult': 2.626564788288843, 'tsl_mult': 0.5952407390748256, 'strategy': 'mean_reversion', 'time_stop': 89, 'use_sma': True, 'use_atr': False, 'use_adx': True, 'use_ema': True, 'use_spike': False, 'rsi_required': False, 'edge_k': 0.7675127806541037, 'edge_cap': 0.7920138671351937, 'bull_strategy': 'breakout', 'bull_bb_std_mult': 2.8065056992949904, 'bull_rsi_os': 36, 'bull_rsi_ob': 71, 'bull_adx_thresh': 16.205849482096067, 'bull_atr_min_pct': 3.2764024628390703e-06, 'bull_atr_max_pct': 0.08111557929705229, 'bull_tp_mult': 2.390614331333478, 'bull_tsl_mult': 0.4293976690059929, 'bull_time_stop': 295, 'bull_use_sma': False, 'bull_use_ema': False, 'bull_use_atr': True, 'bull_use_adx': True, 'bull_use_spike': False, 'bull_rsi_required': False, 'bear_strategy': 'mean_reversion', 'bear_bb_std_mult': 0.9841504677086418, 'bear_rsi_os': 22, 'bear_rsi_ob': 92, 'bear_adx_thresh': 6.37640063070895, 'bear_atr_min_pct': 0.018286665274055914, 'bear_atr_max_pct': 0.028196026788235774, 'bear_tp_mult': 1.7950014494459097, 'bear_tsl_mult': 0.320489441181101, 'bear_time_stop': 126, 'bear_use_sma': True, 'bear_use_ema': False, 'bear_use_atr': False, 'bear_use_adx': True, 'bear_use_spike': False, 'bear_rsi_required': True, 'sideways_strategy': 'breakout', 'sideways_bb_std_mult': 0.9528564413134031, 'sideways_rsi_os': 48, 'sideways_rsi_ob': 89, 'sideways_adx_thresh': 10.123851349252156, 'sideways_atr_min_pct': 0.028429021422333608, 'sideways_atr_max_pct': 0.10732154224415062, 'sideways_tp_mult': 2.9009893439707324, 'sideways_tsl_mult': 0.5797079346793996, 'sideways_time_stop': 131, 'sideways_use_sma': True, 'sideways_use_ema': True, 'sideways_use_atr': True, 'sideways_use_adx': False, 'sideways_use_spike': True, 'sideways_rsi_required': True}.
[I 2025-08-31 00:44:07,040] Trial 362 finished with values: [-1000000000.0, 1000000000.0] and parameters: {'p_sma': 24, 'p_std': 18, 'p_atr': 21, 'p_adx': 8, 'rsi_period': 61, 'ema1': 21, 'ema2': 18, 'slip_atr_k': 0.23232236799751418, 'slip_spread_k': 0.21985904909274723, 'spread_hl_frac': 0.009485100218123233, 'bb_std_mult': 2.320724646319673, 'rsi_os': 28, 'rsi_ob': 92, 'vol_spike': 0.19176852460966512, 'adx_thresh': 28.314098132526105, 'atr_min_pct': 0.011989726886124916, 'atr_max_pct': 0.07390870361467261, 'tp_mult': 2.707626130935602, 'tsl_mult': 0.6059969673417227, 'strategy': 'breakout', 'time_stop': 74, 'use_sma': True, 'use_atr': False, 'use_adx': True, 'use_ema': True, 'use_spike': False, 'rsi_required': False, 'edge_k': 0.7738761591665066, 'edge_cap': 0.7844157465311918, 'bull_strategy': 'breakout', 'bull_bb_std_mult': 2.7746806136404483, 'bull_rsi_os': 36, 'bull_rsi_ob': 82, 'bull_adx_thresh': 16.241535344792382, 'bull_atr_min_pct': 0.017666149514825705, 'bull_atr_max_pct': 0.08256310990772839, 'bull_tp_mult': 2.4772769502962437, 'bull_tsl_mult': 0.42801702595208774, 'bull_time_stop': 300, 'bull_use_sma': False, 'bull_use_ema': False, 'bull_use_atr': True, 'bull_use_adx': True, 'bull_use_spike': False, 'bull_rsi_required': True, 'bear_strategy': 'mean_reversion', 'bear_bb_std_mult': 2.009951577361344, 'bear_rsi_os': 19, 'bear_rsi_ob': 69, 'bear_adx_thresh': 7.275636522724, 'bear_atr_min_pct': 0.017169738218301537, 'bear_atr_max_pct': 0.027259535574857417, 'bear_tp_mult': 1.7232355454468555, 'bear_tsl_mult': 0.7534932370352978, 'bear_time_stop': 22, 'bear_use_sma': True, 'bear_use_ema': False, 'bear_use_atr': False, 'bear_use_adx': False, 'bear_use_spike': False, 'bear_rsi_required': False, 'sideways_strategy': 'breakout', 'sideways_bb_std_mult': 2.9135380410530263, 'sideways_rsi_os': 49, 'sideways_rsi_ob': 47, 'sideways_adx_thresh': 16.596482372703036, 'sideways_atr_min_pct': 0.020283945358424437, 'sideways_atr_max_pct': 0.14596760132093964, 'sideways_tp_mult': 1.518686781302844, 'sideways_tsl_mult': 0.09053232025060926, 'sideways_time_stop': 237, 'sideways_use_sma': True, 'sideways_use_ema': True, 'sideways_use_atr': True, 'sideways_use_adx': False, 'sideways_use_spike': True, 'sideways_rsi_required': True}.
[I 2025-08-31 00:44:07,200] Trial 363 finished with values: [-0.025341086465414775, 0.025241021536455494] and parameters: {'p_sma': 41, 'p_std': 37, 'p_atr': 21, 'p_adx': 8, 'rsi_period': 15, 'ema1': 6, 'ema2': 31, 'slip_atr_k': 0.1374233944505834, 'slip_spread_k': 0.22117127610497841, 'spread_hl_frac': 0.02733680982954696, 'bb_std_mult': 3.0479855951453643, 'rsi_os': 32, 'rsi_ob': 90, 'vol_spike': 0.18997306755258145, 'adx_thresh': 11.168168458335897, 'atr_min_pct': 0.008709269193344398, 'atr_max_pct': 0.09757354354860884, 'tp_mult': 2.015225580715413, 'tsl_mult': 0.36918020730986123, 'strategy': 'breakout', 'time_stop': 74, 'use_sma': True, 'use_atr': False, 'use_adx': True, 'use_ema': True, 'use_spike': True, 'rsi_required': False, 'edge_k': 0.5920617636858279, 'edge_cap': 0.24024594707276165, 'bull_strategy': 'mean_reversion', 'bull_bb_std_mult': 2.89691088076056, 'bull_rsi_os': 37, 'bull_rsi_ob': 71, 'bull_adx_thresh': 12.857393565984632, 'bull_atr_min_pct': 2.949669152833151e-05, 'bull_atr_max_pct': 0.07921055440816009, 'bull_tp_mult': 1.9217252901251787, 'bull_tsl_mult': 0.38517317849291155, 'bull_time_stop': 170, 'bull_use_sma': True, 'bull_use_ema': False, 'bull_use_atr': True, 'bull_use_adx': True, 'bull_use_spike': False, 'bull_rsi_required': True, 'bear_strategy': 'mean_reversion', 'bear_bb_std_mult': 1.118886129139667, 'bear_rsi_os': 22, 'bear_rsi_ob': 60, 'bear_adx_thresh': 7.216801240526635, 'bear_atr_min_pct': 0.010557178994889541, 'bear_atr_max_pct': 0.027398690917629098, 'bear_tp_mult': 1.9022599227132175, 'bear_tsl_mult': 0.7560101835037336, 'bear_time_stop': 126, 'bear_use_sma': True, 'bear_use_ema': True, 'bear_use_atr': False, 'bear_use_adx': False, 'bear_use_spike': False, 'bear_rsi_required': False, 'sideways_strategy': 'mean_reversion', 'sideways_bb_std_mult': 1.001192678878934, 'sideways_rsi_os': 50, 'sideways_rsi_ob': 47, 'sideways_adx_thresh': 27.173184307912774, 'sideways_atr_min_pct': 0.028638262102480057, 'sideways_atr_max_pct': 0.08786106642628648, 'sideways_tp_mult': 2.997640341201379, 'sideways_tsl_mult': 0.8064966396947336, 'sideways_time_stop': 183, 'sideways_use_sma': True, 'sideways_use_ema': True, 'sideways_use_atr': True, 'sideways_use_adx': False, 'sideways_use_spike': True, 'sideways_rsi_required': True}.
[I 2025-08-31 00:44:07,281] Trial 361 finished with values: [-1000000000.0, 1000000000.0] and parameters: {'p_sma': 53, 'p_std': 37, 'p_atr': 20, 'p_adx': 10, 'rsi_period': 61, 'ema1': 16, 'ema2': 21, 'slip_atr_k': 0.017159529198045403, 'slip_spread_k': 0.23960476769072234, 'spread_hl_frac': 0.040392971009758624, 'bb_std_mult': 1.674150818227686, 'rsi_os': 11, 'rsi_ob': 71, 'vol_spike': 0.1896605970455638, 'adx_thresh': 27.65072018447548, 'atr_min_pct': 0.011364353697217387, 'atr_max_pct': 0.07468355669266297, 'tp_mult': 2.0148333351138903, 'tsl_mult': 0.503515682953014, 'strategy': 'breakout', 'time_stop': 73, 'use_sma': True, 'use_atr': False, 'use_adx': True, 'use_ema': True, 'use_spike': False, 'rsi_required': False, 'edge_k': 1.10704588426891, 'edge_cap': 0.7245881369125525, 'bull_strategy': 'breakout', 'bull_bb_std_mult': 2.8229825640954362, 'bull_rsi_os': 46, 'bull_rsi_ob': 53, 'bull_adx_thresh': 22.661187969553655, 'bull_atr_min_pct': 0.01783345274420748, 'bull_atr_max_pct': 0.14232740661376353, 'bull_tp_mult': 1.9252652596638733, 'bull_tsl_mult': 0.6704910460967846, 'bull_time_stop': 115, 'bull_use_sma': False, 'bull_use_ema': False, 'bull_use_atr': True, 'bull_use_adx': True, 'bull_use_spike': False, 'bull_rsi_required': False, 'bear_strategy': 'mean_reversion', 'bear_bb_std_mult': 2.0183391186498483, 'bear_rsi_os': 22, 'bear_rsi_ob': 75, 'bear_adx_thresh': 6.618526310827004, 'bear_atr_min_pct': 0.025942044723017546, 'bear_atr_max_pct': 0.06965826067006842, 'bear_tp_mult': 1.2483251702475424, 'bear_tsl_mult': 0.6596860271528981, 'bear_time_stop': 272, 'bear_use_sma': True, 'bear_use_ema': False, 'bear_use_atr': False, 'bear_use_adx': False, 'bear_use_spike': False, 'bear_rsi_required': False, 'sideways_strategy': 'breakout', 'sideways_bb_std_mult': 2.9149079250038157, 'sideways_rsi_os': 55, 'sideways_rsi_ob': 89, 'sideways_adx_thresh': 8.975628423825844, 'sideways_atr_min_pct': 0.028534212153279552, 'sideways_atr_max_pct': 0.14611139539629436, 'sideways_tp_mult': 2.902671788669177, 'sideways_tsl_mult': 0.5706994417202239, 'sideways_time_stop': 183, 'sideways_use_sma': True, 'sideways_use_ema': True, 'sideways_use_atr': True, 'sideways_use_adx': False, 'sideways_use_spike': True, 'sideways_rsi_required': True}.
[I 2025-08-31 00:44:07,386] Trial 364 finished with values: [-1000000000.0, 1000000000.0] and parameters: {'p_sma': 48, 'p_std': 37, 'p_atr': 20, 'p_adx': 19, 'rsi_period': 61, 'ema1': 7, 'ema2': 38, 'slip_atr_k': 0.09250582643733765, 'slip_spread_k': 0.889173116658192, 'spread_hl_frac': 0.04000740489076709, 'bb_std_mult': 2.3326281333788925, 'rsi_os': 52, 'rsi_ob': 58, 'vol_spike': 0.16107133954978828, 'adx_thresh': 12.767618255496878, 'atr_min_pct': 0.011841693836997264, 'atr_max_pct': 0.09873339074814905, 'tp_mult': 2.7171047273122237, 'tsl_mult': 0.8699472435549049, 'strategy': 'breakout', 'time_stop': 96, 'use_sma': True, 'use_atr': False, 'use_adx': True, 'use_ema': True, 'use_spike': True, 'rsi_required': False, 'edge_k': 0.7158763963606054, 'edge_cap': 0.24237814778491562, 'bull_strategy': 'mean_reversion', 'bull_bb_std_mult': 2.9216071750560517, 'bull_rsi_os': 37, 'bull_rsi_ob': 70, 'bull_adx_thresh': 22.786101675912658, 'bull_atr_min_pct': 0.009841160532209455, 'bull_atr_max_pct': 0.07861740783769496, 'bull_tp_mult': 2.4606699157406178, 'bull_tsl_mult': 0.38363066450384, 'bull_time_stop': 171, 'bull_use_sma': True, 'bull_use_ema': False, 'bull_use_atr': True, 'bull_use_adx': True, 'bull_use_spike': False, 'bull_rsi_required': True, 'bear_strategy': 'mean_reversion', 'bear_bb_std_mult': 1.130187285465099, 'bear_rsi_os': 19, 'bear_rsi_ob': 51, 'bear_adx_thresh': 8.793392376157929, 'bear_atr_min_pct': 0.0035981901470595982, 'bear_atr_max_pct': 0.02723493419511603, 'bear_tp_mult': 1.9032853187104437, 'bear_tsl_mult': 0.7071348281973449, 'bear_time_stop': 280, 'bear_use_sma': True, 'bear_use_ema': True, 'bear_use_atr': False, 'bear_use_adx': False, 'bear_use_spike': True, 'bear_rsi_required': False, 'sideways_strategy': 'mean_reversion', 'sideways_bb_std_mult': 1.2523700609258237, 'sideways_rsi_os': 45, 'sideways_rsi_ob': 92, 'sideways_adx_thresh': 8.93976178543473, 'sideways_atr_min_pct': 0.010841656750909492, 'sideways_atr_max_pct': 0.08730558602220234, 'sideways_tp_mult': 1.3867999492946042, 'sideways_tsl_mult': 0.4963998349184286, 'sideways_time_stop': 151, 'sideways_use_sma': True, 'sideways_use_ema': True, 'sideways_use_atr': True, 'sideways_use_adx': False, 'sideways_use_spike': True, 'sideways_rsi_required': True}.
[I 2025-08-31 00:44:46,339] Trial 368 finished with values: [-1000000000.0, 1000000000.0] and parameters: {'p_sma': 48, 'p_std': 35, 'p_atr': 24, 'p_adx': 7, 'rsi_period': 55, 'ema1': 7, 'ema2': 24, 'slip_atr_k': 0.04586684553048545, 'slip_spread_k': 0.8016426674586354, 'spread_hl_frac': 0.012544916366503643, 'bb_std_mult': 1.284324484015214, 'rsi_os': 53, 'rsi_ob': 94, 'vol_spike': 0.20660641852457878, 'adx_thresh': 12.923099424215383, 'atr_min_pct': 0.009217549553187382, 'atr_max_pct': 0.0659601360348177, 'tp_mult': 2.9253643602829165, 'tsl_mult': 0.15285311316902028, 'strategy': 'breakout', 'time_stop': 94, 'use_sma': False, 'use_atr': False, 'use_adx': False, 'use_ema': True, 'use_spike': False, 'rsi_required': False, 'edge_k': 0.6797313403020195, 'edge_cap': 0.806323413862049, 'bull_strategy': 'breakout', 'bull_bb_std_mult': 2.653558982796037, 'bull_rsi_os': 38, 'bull_rsi_ob': 69, 'bull_adx_thresh': 11.710585208848384, 'bull_atr_min_pct': 0.013196859198881028, 'bull_atr_max_pct': 0.07497977922359414, 'bull_tp_mult': 2.5272267577003356, 'bull_tsl_mult': 0.32590360497853416, 'bull_time_stop': 161, 'bull_use_sma': False, 'bull_use_ema': False, 'bull_use_atr': True, 'bull_use_adx': True, 'bull_use_spike': False, 'bull_rsi_required': False, 'bear_strategy': 'mean_reversion', 'bear_bb_std_mult': 1.0404924644289852, 'bear_rsi_os': 24, 'bear_rsi_ob': 77, 'bear_adx_thresh': 8.734229621590536, 'bear_atr_min_pct': 0.015277578855069005, 'bear_atr_max_pct': 0.014482199225892207, 'bear_tp_mult': 2.6241573827176716, 'bear_tsl_mult': 0.5473383306799487, 'bear_time_stop': 163, 'bear_use_sma': True, 'bear_use_ema': False, 'bear_use_atr': False, 'bear_use_adx': True, 'bear_use_spike': True, 'bear_rsi_required': False, 'sideways_strategy': 'mean_reversion', 'sideways_bb_std_mult': 1.8584673900473792, 'sideways_rsi_os': 45, 'sideways_rsi_ob': 91, 'sideways_adx_thresh': 23.90313876531177, 'sideways_atr_min_pct': 0.022589918012572853, 'sideways_atr_max_pct': 0.09520183801727496, 'sideways_tp_mult': 1.0983007246823688, 'sideways_tsl_mult': 0.4752403925257363, 'sideways_time_stop': 219, 'sideways_use_sma': True, 'sideways_use_ema': False, 'sideways_use_atr': False, 'sideways_use_adx': True, 'sideways_use_spike': False, 'sideways_rsi_required': False}.
[I 2025-08-31 00:44:46,689] Trial 366 finished with values: [-1000000000.0, 1000000000.0] and parameters: {'p_sma': 48, 'p_std': 35, 'p_atr': 24, 'p_adx': 9, 'rsi_period': 59, 'ema1': 7, 'ema2': 17, 'slip_atr_k': 0.04702147951703589, 'slip_spread_k': 0.7614898208051366, 'spread_hl_frac': 0.01284754175273668, 'bb_std_mult': 1.02691492260369, 'rsi_os': 52, 'rsi_ob': 94, 'vol_spike': 0.15936927672423237, 'adx_thresh': 12.645448076215958, 'atr_min_pct': 0.02359035310273653, 'atr_max_pct': 0.06682254582720845, 'tp_mult': 2.287020574663397, 'tsl_mult': 0.8915675391697226, 'strategy': 'breakout', 'time_stop': 93, 'use_sma': True, 'use_atr': False, 'use_adx': False, 'use_ema': True, 'use_spike': True, 'rsi_required': False, 'edge_k': 0.7122356383171133, 'edge_cap': 0.8116832107078142, 'bull_strategy': 'mean_reversion', 'bull_bb_std_mult': 2.652756269943022, 'bull_rsi_os': 19, 'bull_rsi_ob': 87, 'bull_adx_thresh': 8.078460138257824, 'bull_atr_min_pct': 0.00803777417270093, 'bull_atr_max_pct': 0.06705661500494821, 'bull_tp_mult': 2.521200776345398, 'bull_tsl_mult': 0.7881027933386584, 'bull_time_stop': 108, 'bull_use_sma': True, 'bull_use_ema': False, 'bull_use_atr': True, 'bull_use_adx': True, 'bull_use_spike': False, 'bull_rsi_required': False, 'bear_strategy': 'mean_reversion', 'bear_bb_std_mult': 1.035304851216863, 'bear_rsi_os': 24, 'bear_rsi_ob': 51, 'bear_adx_thresh': 8.881867096905314, 'bear_atr_min_pct': 0.009328525272795993, 'bear_atr_max_pct': 0.013449933063913832, 'bear_tp_mult': 2.0088016455058844, 'bear_tsl_mult': 0.5466792919878847, 'bear_time_stop': 31, 'bear_use_sma': True, 'bear_use_ema': True, 'bear_use_atr': False, 'bear_use_adx': True, 'bear_use_spike': True, 'bear_rsi_required': False, 'sideways_strategy': 'mean_reversion', 'sideways_bb_std_mult': 1.7510197719541343, 'sideways_rsi_os': 45, 'sideways_rsi_ob': 92, 'sideways_adx_thresh': 14.166630492730345, 'sideways_atr_min_pct': 0.011186951802746122, 'sideways_atr_max_pct': 0.04695952232846294, 'sideways_tp_mult': 1.998779247589106, 'sideways_tsl_mult': 0.47417324440100134, 'sideways_time_stop': 258, 'sideways_use_sma': True, 'sideways_use_ema': False, 'sideways_use_atr': False, 'sideways_use_adx': True, 'sideways_use_spike': False, 'sideways_rsi_required': False}.
[I 2025-08-31 00:44:46,694] Trial 367 finished with values: [-1000000000.0, 1000000000.0] and parameters: {'p_sma': 17, 'p_std': 35, 'p_atr': 24, 'p_adx': 9, 'rsi_period': 55, 'ema1': 7, 'ema2': 17, 'slip_atr_k': 0.04956756507405936, 'slip_spread_k': 0.9414258124669181, 'spread_hl_frac': 0.023088200595626444, 'bb_std_mult': 1.9411353416241008, 'rsi_os': 52, 'rsi_ob': 75, 'vol_spike': 0.23096550602348112, 'adx_thresh': 12.737005250594017, 'atr_min_pct': 0.009339493585387002, 'atr_max_pct': 0.06635457581064376, 'tp_mult': 1.386473550823641, 'tsl_mult': 0.9486318993801054, 'strategy': 'breakout', 'time_stop': 93, 'use_sma': True, 'use_atr': False, 'use_adx': False, 'use_ema': True, 'use_spike': True, 'rsi_required': False, 'edge_k': 0.701061208241097, 'edge_cap': 0.8145847045787449, 'bull_strategy': 'mean_reversion', 'bull_bb_std_mult': 2.6559788205635986, 'bull_rsi_os': 52, 'bull_rsi_ob': 69, 'bull_adx_thresh': 30.319264252987573, 'bull_atr_min_pct': 0.013511814309912294, 'bull_atr_max_pct': 0.06639718404373084, 'bull_tp_mult': 2.444192868485033, 'bull_tsl_mult': 0.1031341722235658, 'bull_time_stop': 175, 'bull_use_sma': True, 'bull_use_ema': False, 'bull_use_atr': True, 'bull_use_adx': True, 'bull_use_spike': False, 'bull_rsi_required': False, 'bear_strategy': 'mean_reversion', 'bear_bb_std_mult': 1.034176635527917, 'bear_rsi_os': 32, 'bear_rsi_ob': 48, 'bear_adx_thresh': 8.802748151317337, 'bear_atr_min_pct': 0.009402864640626485, 'bear_atr_max_pct': 0.10344100735586391, 'bear_tp_mult': 2.0221736698818424, 'bear_tsl_mult': 0.7083984446292039, 'bear_time_stop': 30, 'bear_use_sma': True, 'bear_use_ema': True, 'bear_use_atr': False, 'bear_use_adx': True, 'bear_use_spike': True, 'bear_rsi_required': False, 'sideways_strategy': 'mean_reversion', 'sideways_bb_std_mult': 2.648389100173333, 'sideways_rsi_os': 45, 'sideways_rsi_ob': 92, 'sideways_adx_thresh': 14.296713055157023, 'sideways_atr_min_pct': 0.01098378113128246, 'sideways_atr_max_pct': 0.09462122764395747, 'sideways_tp_mult': 1.1125514776609808, 'sideways_tsl_mult': 0.4689884623442907, 'sideways_time_stop': 151, 'sideways_use_sma': True, 'sideways_use_ema': False, 'sideways_use_atr': False, 'sideways_use_adx': True, 'sideways_use_spike': False, 'sideways_rsi_required': False}.
[I 2025-08-31 00:44:47,048] Trial 365 finished with values: [-1000000000.0, 1000000000.0] and parameters: {'p_sma': 48, 'p_std': 60, 'p_atr': 23, 'p_adx': 9, 'rsi_period': 60, 'ema1': 7, 'ema2': 38, 'slip_atr_k': 0.01754281399771933, 'slip_spread_k': 0.7971170578623813, 'spread_hl_frac': 0.01254731773447846, 'bb_std_mult': 2.195492865722542, 'rsi_os': 37, 'rsi_ob': 75, 'vol_spike': 0.1499729541565192, 'adx_thresh': 12.761213143130599, 'atr_min_pct': 0.011391760284102551, 'atr_max_pct': 0.06604369624298968, 'tp_mult': 1.3730838808447878, 'tsl_mult': 0.24254356441830177, 'strategy': 'breakout', 'time_stop': 66, 'use_sma': True, 'use_atr': False, 'use_adx': False, 'use_ema': True, 'use_spike': True, 'rsi_required': False, 'edge_k': 0.7017065844790977, 'edge_cap': 0.730853471860944, 'bull_strategy': 'mean_reversion', 'bull_bb_std_mult': 2.655161269447028, 'bull_rsi_os': 33, 'bull_rsi_ob': 69, 'bull_adx_thresh': 32.587193195376415, 'bull_atr_min_pct': 0.013090708166117097, 'bull_atr_max_pct': 0.030066051370532497, 'bull_tp_mult': 2.5301303327062246, 'bull_tsl_mult': 0.3298952300593194, 'bull_time_stop': 175, 'bull_use_sma': False, 'bull_use_ema': False, 'bull_use_atr': True, 'bull_use_adx': True, 'bull_use_spike': False, 'bull_rsi_required': False, 'bear_strategy': 'mean_reversion', 'bear_bb_std_mult': 1.7618077676014328, 'bear_rsi_os': 24, 'bear_rsi_ob': 91, 'bear_adx_thresh': 8.986026086871055, 'bear_atr_min_pct': 0.00955044062327802, 'bear_atr_max_pct': 0.05088150351778568, 'bear_tp_mult': 1.9432191009974042, 'bear_tsl_mult': 0.7011746698594856, 'bear_time_stop': 31, 'bear_use_sma': True, 'bear_use_ema': True, 'bear_use_atr': False, 'bear_use_adx': True, 'bear_use_spike': True, 'bear_rsi_required': False, 'sideways_strategy': 'mean_reversion', 'sideways_bb_std_mult': 1.2381418091191303, 'sideways_rsi_os': 45, 'sideways_rsi_ob': 92, 'sideways_adx_thresh': 34.412395592474745, 'sideways_atr_min_pct': 0.017832022032001685, 'sideways_atr_max_pct': 0.1481337819116491, 'sideways_tp_mult': 1.0927305888459764, 'sideways_tsl_mult': 0.5054412170263368, 'sideways_time_stop': 151, 'sideways_use_sma': True, 'sideways_use_ema': False, 'sideways_use_atr': False, 'sideways_use_adx': False, 'sideways_use_spike': True, 'sideways_rsi_required': False}.
