[I 2025-08-31 02:27:31,601] Trial 512 finished with values: [-0.0151419733872592, 0.015072489459121895] and parameters: {'p_sma': 54, 'p_std': 45, 'p_atr': 28, 'p_adx': 27, 'rsi_period': 65, 'ema1': 5, 'ema2': 23, 'slip_atr_k': 0.012023156607790544, 'slip_spread_k': 0.16243752270023232, 'spread_hl_frac': 0.003837932152164725, 'bb_std_mult': 1.6428079312892403, 'rsi_os': 37, 'rsi_ob': 71, 'vol_spike': 0.17714544835494295, 'adx_thresh': 19.641035263336736, 'atr_min_pct': 0.0074583896464641515, 'atr_max_pct': 0.1221956910197316, 'tp_mult': 1.0132534352994318, 'tsl_mult': 0.04598974008490053, 'strategy': 'mean_reversion', 'time_stop': 117, 'use_sma': True, 'use_atr': True, 'use_adx': True, 'use_ema': False, 'use_spike': False, 'rsi_required': True, 'edge_k': 0.5004274170358274, 'edge_cap': 0.1443513221203368, 'bull_strategy': 'breakout', 'bull_bb_std_mult': 2.4835274865599564, 'bull_rsi_os': 50, 'bull_rsi_ob': 60, 'bull_adx_thresh': 6.372748671020414, 'bull_atr_min_pct': 6.0207011894632524e-05, 'bull_atr_max_pct': 0.14684312024297963, 'bull_tp_mult': 2.264331709446415, 'bull_tsl_mult': 0.2892067912714149, 'bull_time_stop': 141, 'bull_use_sma': False, 'bull_use_ema': True, 'bull_use_atr': False, 'bull_use_adx': True, 'bull_use_spike': True, 'bull_rsi_required': True, 'bear_strategy': 'mean_reversion', 'bear_bb_std_mult': 1.3701558049941174, 'bear_rsi_os': 18, 'bear_rsi_ob': 46, 'bear_adx_thresh': 5.005919494385574, 'bear_atr_min_pct': 0.006102570002083847, 'bear_atr_max_pct': 0.012627582072624743, 'bear_tp_mult': 2.073306185042337, 'bear_tsl_mult': 0.7553420584032137, 'bear_time_stop': 6, 'bear_use_sma': False, 'bear_use_ema': False, 'bear_use_atr': False, 'bear_use_adx': False, 'bear_use_spike': False, 'bear_rsi_required': True, 'sideways_strategy': 'mean_reversion', 'sideways_bb_std_mult': 0.5688437236810429, 'sideways_rsi_os': 39, 'sideways_rsi_ob': 95, 'sideways_adx_thresh': 10.311464797272034, 'sideways_atr_min_pct': 0.02646964349683071, 'sideways_atr_max_pct': 0.04878759171672163, 'sideways_tp_mult': 1.9035167719134907, 'sideways_tsl_mult': 0.6457472895103202, 'sideways_time_stop': 195, 'sideways_use_sma': True, 'sideways_use_ema': False, 'sideways_use_atr': False, 'sideways_use_adx': False, 'sideways_use_spike': True, 'sideways_rsi_required': True}.
[I 2025-08-31 02:27:31,859] Trial 515 finished with values: [-1000000000.0, 1000000000.0] and parameters: {'p_sma': 54, 'p_std': 44, 'p_atr': 29, 'p_adx': 27, 'rsi_period': 65, 'ema1': 5, 'ema2': 23, 'slip_atr_k': 0.011578049677769774, 'slip_spread_k': 0.17269956199506684, 'spread_hl_frac': 0.0034985369532938592, 'bb_std_mult': 1.7203343963182511, 'rsi_os': 40, 'rsi_ob': 71, 'vol_spike': 0.18901138767705447, 'adx_thresh': 19.58239147922357, 'atr_min_pct': 0.007385844261423477, 'atr_max_pct': 0.11570454046291259, 'tp_mult': 1.0978435989641269, 'tsl_mult': 0.04669591141064043, 'strategy': 'mean_reversion', 'time_stop': 119, 'use_sma': False, 'use_atr': False, 'use_adx': True, 'use_ema': False, 'use_spike': False, 'rsi_required': True, 'edge_k': 0.556653746484895, 'edge_cap': 0.15696154398242976, 'bull_strategy': 'breakout', 'bull_bb_std_mult': 2.492524323892844, 'bull_rsi_os': 48, 'bull_rsi_ob': 62, 'bull_adx_thresh': 5.246130023181138, 'bull_atr_min_pct': 0.008504775503841558, 'bull_atr_max_pct': 0.1434863797742977, 'bull_tp_mult': 2.2636834765540534, 'bull_tsl_mult': 0.25143119130000446, 'bull_time_stop': 131, 'bull_use_sma': False, 'bull_use_ema': True, 'bull_use_atr': False, 'bull_use_adx': True, 'bull_use_spike': True, 'bull_rsi_required': True, 'bear_strategy': 'mean_reversion', 'bear_bb_std_mult': 1.4743156763660743, 'bear_rsi_os': 18, 'bear_rsi_ob': 46, 'bear_adx_thresh': 5.495404857666732, 'bear_atr_min_pct': 0.00639687389902293, 'bear_atr_max_pct': 0.012774285953780051, 'bear_tp_mult': 2.064612769548849, 'bear_tsl_mult': 0.7462681325926818, 'bear_time_stop': 12, 'bear_use_sma': False, 'bear_use_ema': False, 'bear_use_atr': True, 'bear_use_adx': False, 'bear_use_spike': True, 'bear_rsi_required': True, 'sideways_strategy': 'breakout', 'sideways_bb_std_mult': 0.7275122826716078, 'sideways_rsi_os': 39, 'sideways_rsi_ob': 94, 'sideways_adx_thresh': 10.583140142200415, 'sideways_atr_min_pct': 0.027837885690718874, 'sideways_atr_max_pct': 0.04796606557236563, 'sideways_tp_mult': 1.7668838509919795, 'sideways_tsl_mult': 0.6521515129532219, 'sideways_time_stop': 198, 'sideways_use_sma': True, 'sideways_use_ema': False, 'sideways_use_atr': True, 'sideways_use_adx': False, 'sideways_use_spike': True, 'sideways_rsi_required': True}.
[I 2025-08-31 02:27:32,106] Trial 514 finished with values: [-0.014905117122395284, 0.014836062403879946] and parameters: {'p_sma': 54, 'p_std': 46, 'p_atr': 29, 'p_adx': 27, 'rsi_period': 69, 'ema1': 5, 'ema2': 23, 'slip_atr_k': 0.01377620411771235, 'slip_spread_k': 0.16859736517387414, 'spread_hl_frac': 0.002658402246794445, 'bb_std_mult': 1.6938041005370816, 'rsi_os': 37, 'rsi_ob': 71, 'vol_spike': 0.18748650563912322, 'adx_thresh': 19.422020209464485, 'atr_min_pct': 0.007469124665227749, 'atr_max_pct': 0.115685971043992, 'tp_mult': 1.011193719448142, 'tsl_mult': 0.013153535341618984, 'strategy': 'mean_reversion', 'time_stop': 106, 'use_sma': False, 'use_atr': False, 'use_adx': True, 'use_ema': False, 'use_spike': False, 'rsi_required': True, 'edge_k': 0.5677826213964238, 'edge_cap': 0.1574941806879425, 'bull_strategy': 'breakout', 'bull_bb_std_mult': 2.5217048995817812, 'bull_rsi_os': 50, 'bull_rsi_ob': 62, 'bull_adx_thresh': 5.598200283633331, 'bull_atr_min_pct': 0.0005438766045574956, 'bull_atr_max_pct': 0.142946375005768, 'bull_tp_mult': 2.2777427736865437, 'bull_tsl_mult': 0.2985103757588241, 'bull_time_stop': 141, 'bull_use_sma': False, 'bull_use_ema': False, 'bull_use_atr': False, 'bull_use_adx': True, 'bull_use_spike': True, 'bull_rsi_required': True, 'bear_strategy': 'mean_reversion', 'bear_bb_std_mult': 1.5013671207964734, 'bear_rsi_os': 18, 'bear_rsi_ob': 46, 'bear_adx_thresh': 5.5097574904163515, 'bear_atr_min_pct': 0.006166576503386269, 'bear_atr_max_pct': 0.01278257078424836, 'bear_tp_mult': 2.1710297289785014, 'bear_tsl_mult': 0.7535033478236248, 'bear_time_stop': 10, 'bear_use_sma': False, 'bear_use_ema': False, 'bear_use_atr': False, 'bear_use_adx': False, 'bear_use_spike': True, 'bear_rsi_required': True, 'sideways_strategy': 'breakout', 'sideways_bb_std_mult': 0.720155087876186, 'sideways_rsi_os': 41, 'sideways_rsi_ob': 94, 'sideways_adx_thresh': 10.318693309670193, 'sideways_atr_min_pct': 0.025978423099581868, 'sideways_atr_max_pct': 0.04425321203908515, 'sideways_tp_mult': 1.733202280841231, 'sideways_tsl_mult': 0.6514349715523867, 'sideways_time_stop': 186, 'sideways_use_sma': True, 'sideways_use_ema': False, 'sideways_use_atr': False, 'sideways_use_adx': False, 'sideways_use_spike': True, 'sideways_rsi_required': True}.
[I 2025-08-31 02:28:04,976] Trial 519 finished with values: [-1000000000.0, 1000000000.0] and parameters: {'p_sma': 55, 'p_std': 53, 'p_atr': 27, 'p_adx': 26, 'rsi_period': 68, 'ema1': 5, 'ema2': 22, 'slip_atr_k': 0.00221182711711875, 'slip_spread_k': 0.109139209222535, 'spread_hl_frac': 0.005312778793636875, 'bb_std_mult': 1.7194624803565324, 'rsi_os': 40, 'rsi_ob': 68, 'vol_spike': 0.1765288010090239, 'adx_thresh': 21.476116185479963, 'atr_min_pct': 0.0068950355217016765, 'atr_max_pct': 0.11242470444557168, 'tp_mult': 1.0882823674798443, 'tsl_mult': 0.2815929219309526, 'strategy': 'mean_reversion', 'time_stop': 104, 'use_sma': False, 'use_atr': False, 'use_adx': False, 'use_ema': False, 'use_spike': True, 'rsi_required': True, 'edge_k': 0.46971362370516306, 'edge_cap': 0.16071200309950648, 'bull_strategy': 'mean_reversion', 'bull_bb_std_mult': 2.5174066073936556, 'bull_rsi_os': 49, 'bull_rsi_ob': 62, 'bull_adx_thresh': 7.629627916937496, 'bull_atr_min_pct': 0.02222682203160918, 'bull_atr_max_pct': 0.14994972125727923, 'bull_tp_mult': 2.2331301776005597, 'bull_tsl_mult': 0.24401043348635482, 'bull_time_stop': 127, 'bull_use_sma': False, 'bull_use_ema': False, 'bull_use_atr': False, 'bull_use_adx': False, 'bull_use_spike': True, 'bull_rsi_required': True, 'bear_strategy': 'breakout', 'bear_bb_std_mult': 1.4485615572141028, 'bear_rsi_os': 16, 'bear_rsi_ob': 47, 'bear_adx_thresh': 5.703123328347911, 'bear_atr_min_pct': 0.006708148293843382, 'bear_atr_max_pct': 0.013641660679735938, 'bear_tp_mult': 2.1725023242764254, 'bear_tsl_mult': 0.8941693785539034, 'bear_time_stop': 10, 'bear_use_sma': False, 'bear_use_ema': True, 'bear_use_atr': True, 'bear_use_adx': True, 'bear_use_spike': True, 'bear_rsi_required': True, 'sideways_strategy': 'mean_reversion', 'sideways_bb_std_mult': 0.6974530065398103, 'sideways_rsi_os': 41, 'sideways_rsi_ob': 95, 'sideways_adx_thresh': 9.23176418824697, 'sideways_atr_min_pct': 0.025904125591458247, 'sideways_atr_max_pct': 0.044045079497782115, 'sideways_tp_mult': 1.8039689849361435, 'sideways_tsl_mult': 0.6075692942564782, 'sideways_time_stop': 185, 'sideways_use_sma': True, 'sideways_use_ema': True, 'sideways_use_atr': True, 'sideways_use_adx': True, 'sideways_use_spike': False, 'sideways_rsi_required': False}.
[I 2025-08-31 02:28:05,405] Trial 518 finished with values: [-1000000000.0, 1000000000.0] and parameters: {'p_sma': 54, 'p_std': 49, 'p_atr': 27, 'p_adx': 27, 'rsi_period': 65, 'ema1': 5, 'ema2': 22, 'slip_atr_k': 0.0023649413381874925, 'slip_spread_k': 0.15890764860260476, 'spread_hl_frac': 0.005518534724237445, 'bb_std_mult': 1.6090469033092167, 'rsi_os': 40, 'rsi_ob': 71, 'vol_spike': 0.1767502344264447, 'adx_thresh': 21.41510816511459, 'atr_min_pct': 0.008375151852388612, 'atr_max_pct': 0.1240188080300678, 'tp_mult': 1.1015573553404934, 'tsl_mult': 0.2680943096477134, 'strategy': 'mean_reversion', 'time_stop': 110, 'use_sma': False, 'use_atr': True, 'use_adx': False, 'use_ema': False, 'use_spike': True, 'rsi_required': True, 'edge_k': 0.47236378615378855, 'edge_cap': 0.15201271736413066, 'bull_strategy': 'mean_reversion', 'bull_bb_std_mult': 2.5201747323672583, 'bull_rsi_os': 50, 'bull_rsi_ob': 63, 'bull_adx_thresh': 6.236414969067661, 'bull_atr_min_pct': 0.022381923488127543, 'bull_atr_max_pct': 0.14657770942017948, 'bull_tp_mult': 2.20835037472708, 'bull_tsl_mult': 0.2491150612254634, 'bull_time_stop': 143, 'bull_use_sma': False, 'bull_use_ema': False, 'bull_use_atr': False, 'bull_use_adx': False, 'bull_use_spike': True, 'bull_rsi_required': True, 'bear_strategy': 'breakout', 'bear_bb_std_mult': 1.4858572108091879, 'bear_rsi_os': 16, 'bear_rsi_ob': 47, 'bear_adx_thresh': 5.698722678904787, 'bear_atr_min_pct': 0.006393714620412407, 'bear_atr_max_pct': 0.013107052435253416, 'bear_tp_mult': 2.175764050822046, 'bear_tsl_mult': 0.9119506860912752, 'bear_time_stop': 12, 'bear_use_sma': False, 'bear_use_ema': True, 'bear_use_atr': False, 'bear_use_adx': True, 'bear_use_spike': True, 'bear_rsi_required': True, 'sideways_strategy': 'mean_reversion', 'sideways_bb_std_mult': 0.6860626438560241, 'sideways_rsi_os': 41, 'sideways_rsi_ob': 95, 'sideways_adx_thresh': 10.350156940741005, 'sideways_atr_min_pct': 0.026099390187660464, 'sideways_atr_max_pct': 0.04468762525488977, 'sideways_tp_mult': 1.8918362408346032, 'sideways_tsl_mult': 0.6090420773246679, 'sideways_time_stop': 193, 'sideways_use_sma': True, 'sideways_use_ema': True, 'sideways_use_atr': False, 'sideways_use_adx': True, 'sideways_use_spike': False, 'sideways_rsi_required': True}.
[I 2025-08-31 02:28:06,490] Trial 517 finished with values: [-1000000000.0, 1000000000.0] and parameters: {'p_sma': 54, 'p_std': 52, 'p_atr': 29, 'p_adx': 27, 'rsi_period': 65, 'ema1': 5, 'ema2': 23, 'slip_atr_k': 0.01373887369633948, 'slip_spread_k': 0.16486661690053667, 'spread_hl_frac': 0.003446608840430656, 'bb_std_mult': 1.7222224751426194, 'rsi_os': 40, 'rsi_ob': 68, 'vol_spike': 0.17663397991702978, 'adx_thresh': 19.494099888528908, 'atr_min_pct': 0.007094423417201563, 'atr_max_pct': 0.11390357682999695, 'tp_mult': 1.0784565576307668, 'tsl_mult': 0.34829699812099196, 'strategy': 'mean_reversion', 'time_stop': 105, 'use_sma': False, 'use_atr': True, 'use_adx': True, 'use_ema': False, 'use_spike': True, 'rsi_required': True, 'edge_k': 0.4788601671368631, 'edge_cap': 0.15298598757424173, 'bull_strategy': 'breakout', 'bull_bb_std_mult': 2.534653519941753, 'bull_rsi_os': 48, 'bull_rsi_ob': 62, 'bull_adx_thresh': 5.370304018151357, 'bull_atr_min_pct': 0.023804146262721586, 'bull_atr_max_pct': 0.14429652493283635, 'bull_tp_mult': 2.193449064322387, 'bull_tsl_mult': 0.2536225634282896, 'bull_time_stop': 142, 'bull_use_sma': False, 'bull_use_ema': True, 'bull_use_atr': False, 'bull_use_adx': False, 'bull_use_spike': True, 'bull_rsi_required': True, 'bear_strategy': 'mean_reversion', 'bear_bb_std_mult': 1.4546895071733803, 'bear_rsi_os': 18, 'bear_rsi_ob': 47, 'bear_adx_thresh': 5.0331286160911715, 'bear_atr_min_pct': 0.0063610924396466815, 'bear_atr_max_pct': 0.014004057350185692, 'bear_tp_mult': 2.1689081387236597, 'bear_tsl_mult': 0.8762866741180525, 'bear_time_stop': 10, 'bear_use_sma': False, 'bear_use_ema': True, 'bear_use_atr': True, 'bear_use_adx': False, 'bear_use_spike': True, 'bear_rsi_required': True, 'sideways_strategy': 'breakout', 'sideways_bb_std_mult': 0.6853116917556644, 'sideways_rsi_os': 39, 'sideways_rsi_ob': 95, 'sideways_adx_thresh': 10.485937473137712, 'sideways_atr_min_pct': 0.027762550754236778, 'sideways_atr_max_pct': 0.045114039807271245, 'sideways_tp_mult': 1.750915536842039, 'sideways_tsl_mult': 0.6124577272304836, 'sideways_time_stop': 199, 'sideways_use_sma': True, 'sideways_use_ema': True, 'sideways_use_atr': True, 'sideways_use_adx': True, 'sideways_use_spike': True, 'sideways_rsi_required': True}.
[I 2025-08-31 02:28:06,865] Trial 516 finished with values: [-1000000000.0, 1000000000.0] and parameters: {'p_sma': 54, 'p_std': 53, 'p_atr': 29, 'p_adx': 27, 'rsi_period': 64, 'ema1': 5, 'ema2': 22, 'slip_atr_k': 0.002843123473189421, 'slip_spread_k': 0.16477624018960466, 'spread_hl_frac': 0.0028616491063098697, 'bb_std_mult': 1.6941328259304276, 'rsi_os': 40, 'rsi_ob': 71, 'vol_spike': 0.1770641685187835, 'adx_thresh': 19.691569300256287, 'atr_min_pct': 0.008494250594465834, 'atr_max_pct': 0.1222056738809583, 'tp_mult': 1.0907648262839023, 'tsl_mult': 0.23617879260228153, 'strategy': 'mean_reversion', 'time_stop': 106, 'use_sma': False, 'use_atr': True, 'use_adx': True, 'use_ema': False, 'use_spike': True, 'rsi_required': True, 'edge_k': 0.499241856078117, 'edge_cap': 0.15169503026358633, 'bull_strategy': 'breakout', 'bull_bb_std_mult': 2.5087128724488936, 'bull_rsi_os': 48, 'bull_rsi_ob': 63, 'bull_adx_thresh': 6.024514734947397, 'bull_atr_min_pct': 0.006535311438785893, 'bull_atr_max_pct': 0.14358624263923947, 'bull_tp_mult': 2.2007038253236297, 'bull_tsl_mult': 0.2553857864741154, 'bull_time_stop': 128, 'bull_use_sma': False, 'bull_use_ema': True, 'bull_use_atr': False, 'bull_use_adx': False, 'bull_use_spike': True, 'bull_rsi_required': True, 'bear_strategy': 'mean_reversion', 'bear_bb_std_mult': 1.4677948629339863, 'bear_rsi_os': 18, 'bear_rsi_ob': 47, 'bear_adx_thresh': 5.623137583624855, 'bear_atr_min_pct': 0.0061151146046197315, 'bear_atr_max_pct': 0.013060730422109482, 'bear_tp_mult': 2.1676620906995168, 'bear_tsl_mult': 0.5403594957862123, 'bear_time_stop': 11, 'bear_use_sma': False, 'bear_use_ema': True, 'bear_use_atr': True, 'bear_use_adx': False, 'bear_use_spike': True, 'bear_rsi_required': True, 'sideways_strategy': 'breakout', 'sideways_bb_std_mult': 0.7017420213703623, 'sideways_rsi_os': 39, 'sideways_rsi_ob': 95, 'sideways_adx_thresh': 10.342524157243803, 'sideways_atr_min_pct': 0.025979737866097433, 'sideways_atr_max_pct': 0.05469535863768548, 'sideways_tp_mult': 1.7494464542547794, 'sideways_tsl_mult': 0.6164603947010038, 'sideways_time_stop': 198, 'sideways_use_sma': True, 'sideways_use_ema': True, 'sideways_use_atr': True, 'sideways_use_adx': True, 'sideways_use_spike': True, 'sideways_rsi_required': True}.
[I 2025-08-31 02:28:41,109] Trial 522 finished with values: [-0.013432706161571883, 0.013363281933140864] and parameters: {'p_sma': 56, 'p_std': 50, 'p_atr': 28, 'p_adx': 25, 'rsi_period': 67, 'ema1': 5, 'ema2': 22, 'slip_atr_k': 0.009019620873379612, 'slip_spread_k': 0.14746237174015234, 'spread_hl_frac': 0.0043355016558681665, 'bb_std_mult': 1.7139544465335432, 'rsi_os': 38, 'rsi_ob': 70, 'vol_spike': 0.18401521418535832, 'adx_thresh': 20.774329529999406, 'atr_min_pct': 0.00859160663472847, 'atr_max_pct': 0.12006402457328312, 'tp_mult': 1.0535103390677825, 'tsl_mult': 0.25125108281642705, 'strategy': 'mean_reversion', 'time_stop': 106, 'use_sma': True, 'use_atr': False, 'use_adx': False, 'use_ema': False, 'use_spike': False, 'rsi_required': True, 'edge_k': 0.5752683719860023, 'edge_cap': 0.1255360242901778, 'bull_strategy': 'breakout', 'bull_bb_std_mult': 2.3675544954409213, 'bull_rsi_os': 48, 'bull_rsi_ob': 61, 'bull_adx_thresh': 5.862542315667355, 'bull_atr_min_pct': 0.0006760378124490249, 'bull_atr_max_pct': 0.14371686983445528, 'bull_tp_mult': 2.2971658556377057, 'bull_tsl_mult': 0.27001160865858076, 'bull_time_stop': 134, 'bull_use_sma': True, 'bull_use_ema': False, 'bull_use_atr': False, 'bull_use_adx': True, 'bull_use_spike': True, 'bull_rsi_required': True, 'bear_strategy': 'mean_reversion', 'bear_bb_std_mult': 1.5359369392061384, 'bear_rsi_os': 17, 'bear_rsi_ob': 45, 'bear_adx_thresh': 5.734906826440154, 'bear_atr_min_pct': 0.005783560361074049, 'bear_atr_max_pct': 0.012038855241992916, 'bear_tp_mult': 2.0901090971554246, 'bear_tsl_mult': 0.5454006476844875, 'bear_time_stop': 10, 'bear_use_sma': False, 'bear_use_ema': False, 'bear_use_atr': False, 'bear_use_adx': True, 'bear_use_spike': False, 'bear_rsi_required': True, 'sideways_strategy': 'mean_reversion', 'sideways_bb_std_mult': 0.5625360910243091, 'sideways_rsi_os': 41, 'sideways_rsi_ob': 94, 'sideways_adx_thresh': 9.005558370480166, 'sideways_atr_min_pct': 0.027016458357440286, 'sideways_atr_max_pct': 0.05415632030410087, 'sideways_tp_mult': 1.8556448281535436, 'sideways_tsl_mult': 0.6557823742040773, 'sideways_time_stop': 185, 'sideways_use_sma': True, 'sideways_use_ema': False, 'sideways_use_atr': False, 'sideways_use_adx': False, 'sideways_use_spike': True, 'sideways_rsi_required': False}.
[I 2025-08-31 02:28:42,052] Trial 523 finished with values: [-1000000000.0, 1000000000.0] and parameters: {'p_sma': 56, 'p_std': 51, 'p_atr': 28, 'p_adx': 25, 'rsi_period': 67, 'ema1': 5, 'ema2': 22, 'slip_atr_k': 0.016913044160541645, 'slip_spread_k': 0.14714927153695948, 'spread_hl_frac': 0.004688473839134642, 'bb_std_mult': 1.6029983064979074, 'rsi_os': 38, 'rsi_ob': 69, 'vol_spike': 0.18950525448789762, 'adx_thresh': 20.553596465773275, 'atr_min_pct': 0.008649159473832775, 'atr_max_pct': 0.11903900673632233, 'tp_mult': 1.0108322292434402, 'tsl_mult': 0.29756241851456355, 'strategy': 'mean_reversion', 'time_stop': 103, 'use_sma': True, 'use_atr': False, 'use_adx': False, 'use_ema': False, 'use_spike': False, 'rsi_required': True, 'edge_k': 0.5861101203780442, 'edge_cap': 0.1257879530924586, 'bull_strategy': 'breakout', 'bull_bb_std_mult': 2.3970910799262177, 'bull_rsi_os': 51, 'bull_rsi_ob': 61, 'bull_adx_thresh': 7.249184109860816, 'bull_atr_min_pct': 0.000757009034152601, 'bull_atr_max_pct': 0.14023865698790036, 'bull_tp_mult': 2.3025273820034755, 'bull_tsl_mult': 0.31083627275821746, 'bull_time_stop': 138, 'bull_use_sma': True, 'bull_use_ema': False, 'bull_use_atr': False, 'bull_use_adx': True, 'bull_use_spike': True, 'bull_rsi_required': True, 'bear_strategy': 'mean_reversion', 'bear_bb_std_mult': 1.3479806121344444, 'bear_rsi_os': 17, 'bear_rsi_ob': 45, 'bear_adx_thresh': 5.932875439993352, 'bear_atr_min_pct': 0.006919905002150997, 'bear_atr_max_pct': 0.010721856401057326, 'bear_tp_mult': 2.080267664712809, 'bear_tsl_mult': 0.8416607713910357, 'bear_time_stop': 5, 'bear_use_sma': False, 'bear_use_ema': False, 'bear_use_atr': False, 'bear_use_adx': True, 'bear_use_spike': False, 'bear_rsi_required': True, 'sideways_strategy': 'mean_reversion', 'sideways_bb_std_mult': 0.7741043744298348, 'sideways_rsi_os': 41, 'sideways_rsi_ob': 94, 'sideways_adx_thresh': 9.501675752737455, 'sideways_atr_min_pct': 0.026996130117131242, 'sideways_atr_max_pct': 0.051393974205514094, 'sideways_tp_mult': 1.8555628280039773, 'sideways_tsl_mult': 0.6540171503747708, 'sideways_time_stop': 203, 'sideways_use_sma': True, 'sideways_use_ema': False, 'sideways_use_atr': False, 'sideways_use_adx': False, 'sideways_use_spike': True, 'sideways_rsi_required': False}.
