[I 2025-08-31 02:29:53,413] Trial 530 finished with values: [-1000000000.0, 1000000000.0] and parameters: {'p_sma': 53, 'p_std': 52, 'p_atr': 28, 'p_adx': 21, 'rsi_period': 72, 'ema1': 5, 'ema2': 34, 'slip_atr_k': 0.10241190591806429, 'slip_spread_k': 0.17690327111363643, 'spread_hl_frac': 0.00016916547868711445, 'bb_std_mult': 1.5378970069188544, 'rsi_os': 38, 'rsi_ob': 66, 'vol_spike': 0.19421413625544875, 'adx_thresh': 21.243071688788856, 'atr_min_pct': 0.008987407026678258, 'atr_max_pct': 0.12435422064805526, 'tp_mult': 1.3537287430439637, 'tsl_mult': 0.4453617629267006, 'strategy': 'mean_reversion', 'time_stop': 118, 'use_sma': True, 'use_atr': False, 'use_adx': False, 'use_ema': False, 'use_spike': False, 'rsi_required': True, 'edge_k': 0.4434641302931539, 'edge_cap': 0.12546714071158824, 'bull_strategy': 'breakout', 'bull_bb_std_mult': 2.171214106837862, 'bull_rsi_os': 52, 'bull_rsi_ob': 55, 'bull_adx_thresh': 5.592003595295596, 'bull_atr_min_pct': 0.009415710327940826, 'bull_atr_max_pct': 0.135278227788198, 'bull_tp_mult': 2.320193705462352, 'bull_tsl_mult': 0.2407318734787655, 'bull_time_stop': 129, 'bull_use_sma': True, 'bull_use_ema': True, 'bull_use_atr': False, 'bull_use_adx': True, 'bull_use_spike': True, 'bull_rsi_required': True, 'bear_strategy': 'mean_reversion', 'bear_bb_std_mult': 1.2938369469628814, 'bear_rsi_os': 15, 'bear_rsi_ob': 48, 'bear_adx_thresh': 5.0246542361734035, 'bear_atr_min_pct': 0.005517071057431455, 'bear_atr_max_pct': 0.014435378897740974, 'bear_tp_mult': 2.061529067242697, 'bear_tsl_mult': 0.5599750578215034, 'bear_time_stop': 13, 'bear_use_sma': False, 'bear_use_ema': False, 'bear_use_atr': True, 'bear_use_adx': True, 'bear_use_spike': False, 'bear_rsi_required': True, 'sideways_strategy': 'breakout', 'sideways_bb_std_mult': 0.5644378219839112, 'sideways_rsi_os': 38, 'sideways_rsi_ob': 93, 'sideways_adx_thresh': 8.431184544018732, 'sideways_atr_min_pct': 0.02715123832405681, 'sideways_atr_max_pct': 0.05972393943010888, 'sideways_tp_mult': 1.6909732940112745, 'sideways_tsl_mult': 0.6567685304017724, 'sideways_time_stop': 212, 'sideways_use_sma': True, 'sideways_use_ema': False, 'sideways_use_atr': True, 'sideways_use_adx': False, 'sideways_use_spike': True, 'sideways_rsi_required': False}.
[I 2025-08-31 02:30:25,927] Trial 533 finished with values: [-1000000000.0, 1000000000.0] and parameters: {'p_sma': 52, 'p_std': 50, 'p_atr': 29, 'p_adx': 23, 'rsi_period': 70, 'ema1': 5, 'ema2': 27, 'slip_atr_k': 0.1180813269107979, 'slip_spread_k': 0.18108311096765572, 'spread_hl_frac': 0.0019406743930875194, 'bb_std_mult': 1.6782792152240589, 'rsi_os': 37, 'rsi_ob': 67, 'vol_spike': 0.1948947243509431, 'adx_thresh': 20.787079736060456, 'atr_min_pct': 0.008498676048023296, 'atr_max_pct': 0.1206509000960547, 'tp_mult': 1.8043270424109774, 'tsl_mult': 0.35666577368756003, 'strategy': 'mean_reversion', 'time_stop': 116, 'use_sma': True, 'use_atr': False, 'use_adx': False, 'use_ema': False, 'use_spike': True, 'rsi_required': True, 'edge_k': 0.5509619345613419, 'edge_cap': 0.09881210554173879, 'bull_strategy': 'mean_reversion', 'bull_bb_std_mult': 1.9853761625332196, 'bull_rsi_os': 52, 'bull_rsi_ob': 58, 'bull_adx_thresh': 6.036639045387785, 'bull_atr_min_pct': 0.009401772343081993, 'bull_atr_max_pct': 0.13744389381598812, 'bull_tp_mult': 2.252494162926251, 'bull_tsl_mult': 0.254744104630475, 'bull_time_stop': 129, 'bull_use_sma': True, 'bull_use_ema': False, 'bull_use_atr': False, 'bull_use_adx': True, 'bull_use_spike': True, 'bull_rsi_required': True, 'bear_strategy': 'mean_reversion', 'bear_bb_std_mult': 1.332738472927456, 'bear_rsi_os': 15, 'bear_rsi_ob': 48, 'bear_adx_thresh': 5.015630545209485, 'bear_atr_min_pct': 0.005667300781925554, 'bear_atr_max_pct': 0.01438343821955523, 'bear_tp_mult': 2.0390812582806728, 'bear_tsl_mult': 0.5396618704952614, 'bear_time_stop': 13, 'bear_use_sma': False, 'bear_use_ema': True, 'bear_use_atr': True, 'bear_use_adx': True, 'bear_use_spike': False, 'bear_rsi_required': True, 'sideways_strategy': 'breakout', 'sideways_bb_std_mult': 0.5894173399470927, 'sideways_rsi_os': 40, 'sideways_rsi_ob': 94, 'sideways_adx_thresh': 8.936537834399816, 'sideways_atr_min_pct': 0.028619392683572584, 'sideways_atr_max_pct': 0.05874626265875506, 'sideways_tp_mult': 1.7083788982554984, 'sideways_tsl_mult': 0.6585551535079077, 'sideways_time_stop': 204, 'sideways_use_sma': True, 'sideways_use_ema': False, 'sideways_use_atr': False, 'sideways_use_adx': False, 'sideways_use_spike': False, 'sideways_rsi_required': False}.
[I 2025-08-31 02:30:26,867] Trial 535 finished with values: [-1000000000.0, 1000000000.0] and parameters: {'p_sma': 52, 'p_std': 50, 'p_atr': 29, 'p_adx': 23, 'rsi_period': 70, 'ema1': 5, 'ema2': 31, 'slip_atr_k': 0.07178807808307472, 'slip_spread_k': 0.16609321221673462, 'spread_hl_frac': 0.0018999971799605125, 'bb_std_mult': 1.6623809098016964, 'rsi_os': 37, 'rsi_ob': 67, 'vol_spike': 0.1863710426115481, 'adx_thresh': 22.539516350861703, 'atr_min_pct': 0.008464856941653462, 'atr_max_pct': 0.11985873373965004, 'tp_mult': 1.1941092342517368, 'tsl_mult': 0.3975520365915054, 'strategy': 'mean_reversion', 'time_stop': 109, 'use_sma': True, 'use_atr': True, 'use_adx': True, 'use_ema': False, 'use_spike': True, 'rsi_required': True, 'edge_k': 0.5166959530027074, 'edge_cap': 0.09553745421869873, 'bull_strategy': 'mean_reversion', 'bull_bb_std_mult': 2.039680448800734, 'bull_rsi_os': 53, 'bull_rsi_ob': 53, 'bull_adx_thresh': 6.234747889015263, 'bull_atr_min_pct': 0.010173529473193579, 'bull_atr_max_pct': 0.1415336735836479, 'bull_tp_mult': 2.2616366312070353, 'bull_tsl_mult': 0.2579050918298561, 'bull_time_stop': 131, 'bull_use_sma': True, 'bull_use_ema': False, 'bull_use_atr': False, 'bull_use_adx': False, 'bull_use_spike': True, 'bull_rsi_required': True, 'bear_strategy': 'mean_reversion', 'bear_bb_std_mult': 1.3365153711442066, 'bear_rsi_os': 17, 'bear_rsi_ob': 46, 'bear_adx_thresh': 5.122230988432676, 'bear_atr_min_pct': 0.004621118438039176, 'bear_atr_max_pct': 0.013663746989499632, 'bear_tp_mult': 2.0420716079169754, 'bear_tsl_mult': 0.5150179615046463, 'bear_time_stop': 5, 'bear_use_sma': False, 'bear_use_ema': True, 'bear_use_atr': False, 'bear_use_adx': False, 'bear_use_spike': False, 'bear_rsi_required': True, 'sideways_strategy': 'breakout', 'sideways_bb_std_mult': 0.6044413938581978, 'sideways_rsi_os': 40, 'sideways_rsi_ob': 93, 'sideways_adx_thresh': 9.003506293702563, 'sideways_atr_min_pct': 0.025597014500565937, 'sideways_atr_max_pct': 0.052138064492445485, 'sideways_tp_mult': 1.6610047104097603, 'sideways_tsl_mult': 0.6354867366287278, 'sideways_time_stop': 205, 'sideways_use_sma': True, 'sideways_use_ema': True, 'sideways_use_atr': False, 'sideways_use_adx': True, 'sideways_use_spike': False, 'sideways_rsi_required': False}.
[I 2025-08-31 02:30:26,995] Trial 532 finished with values: [-1000000000.0, 1000000000.0] and parameters: {'p_sma': 53, 'p_std': 52, 'p_atr': 28, 'p_adx': 21, 'rsi_period': 72, 'ema1': 5, 'ema2': 27, 'slip_atr_k': 0.09934364548918717, 'slip_spread_k': 0.18017979547486085, 'spread_hl_frac': 0.0006454279848340113, 'bb_std_mult': 1.6501940296834339, 'rsi_os': 37, 'rsi_ob': 67, 'vol_spike': 0.19376433423830708, 'adx_thresh': 21.223103620797577, 'atr_min_pct': 0.008590019736828993, 'atr_max_pct': 0.12111784273576374, 'tp_mult': 1.2713296901969007, 'tsl_mult': 0.34899328250921663, 'strategy': 'mean_reversion', 'time_stop': 120, 'use_sma': True, 'use_atr': False, 'use_adx': False, 'use_ema': False, 'use_spike': True, 'rsi_required': True, 'edge_k': 0.44027455869271337, 'edge_cap': 0.08309849974224615, 'bull_strategy': 'breakout', 'bull_bb_std_mult': 2.160606980627781, 'bull_rsi_os': 53, 'bull_rsi_ob': 64, 'bull_adx_thresh': 5.734082098881711, 'bull_atr_min_pct': 0.005744500684755733, 'bull_atr_max_pct': 0.13649313217070388, 'bull_tp_mult': 2.251987395450302, 'bull_tsl_mult': 0.27078570956719805, 'bull_time_stop': 129, 'bull_use_sma': True, 'bull_use_ema': True, 'bull_use_atr': False, 'bull_use_adx': True, 'bull_use_spike': True, 'bull_rsi_required': True, 'bear_strategy': 'mean_reversion', 'bear_bb_std_mult': 1.2987349004364626, 'bear_rsi_os': 16, 'bear_rsi_ob': 48, 'bear_adx_thresh': 5.012924974368743, 'bear_atr_min_pct': 0.005404130810766775, 'bear_atr_max_pct': 0.013053354470184462, 'bear_tp_mult': 2.0608361023204895, 'bear_tsl_mult': 0.5484587690027766, 'bear_time_stop': 14, 'bear_use_sma': False, 'bear_use_ema': True, 'bear_use_atr': True, 'bear_use_adx': True, 'bear_use_spike': False, 'bear_rsi_required': True, 'sideways_strategy': 'breakout', 'sideways_bb_std_mult': 0.548313088828725, 'sideways_rsi_os': 37, 'sideways_rsi_ob': 94, 'sideways_adx_thresh': 7.652141779816731, 'sideways_atr_min_pct': 0.02549884165811621, 'sideways_atr_max_pct': 0.058066587176029444, 'sideways_tp_mult': 1.6828580902142574, 'sideways_tsl_mult': 0.6391809519590632, 'sideways_time_stop': 213, 'sideways_use_sma': True, 'sideways_use_ema': False, 'sideways_use_atr': True, 'sideways_use_adx': False, 'sideways_use_spike': True, 'sideways_rsi_required': False}.
[I 2025-08-31 02:30:27,189] Trial 534 finished with values: [-1000000000.0, 1000000000.0] and parameters: {'p_sma': 52, 'p_std': 50, 'p_atr': 29, 'p_adx': 23, 'rsi_period': 70, 'ema1': 5, 'ema2': 31, 'slip_atr_k': 0.0747070252274212, 'slip_spread_k': 0.15764019322368897, 'spread_hl_frac': 0.0021514577149413417, 'bb_std_mult': 1.6409033977784304, 'rsi_os': 36, 'rsi_ob': 67, 'vol_spike': 0.18555324607262474, 'adx_thresh': 22.5054202340807, 'atr_min_pct': 0.008547223817002077, 'atr_max_pct': 0.1208622533878893, 'tp_mult': 1.2338757781469423, 'tsl_mult': 0.34235423489971295, 'strategy': 'mean_reversion', 'time_stop': 108, 'use_sma': True, 'use_atr': True, 'use_adx': True, 'use_ema': False, 'use_spike': True, 'rsi_required': True, 'edge_k': 0.5156763330499724, 'edge_cap': 0.08769354338718854, 'bull_strategy': 'mean_reversion', 'bull_bb_std_mult': 2.048011283901003, 'bull_rsi_os': 53, 'bull_rsi_ob': 64, 'bull_adx_thresh': 5.955119444674955, 'bull_atr_min_pct': 0.008465862173715167, 'bull_atr_max_pct': 0.14156856777005875, 'bull_tp_mult': 2.2633013921242946, 'bull_tsl_mult': 0.26692934892752174, 'bull_time_stop': 132, 'bull_use_sma': True, 'bull_use_ema': False, 'bull_use_atr': False, 'bull_use_adx': False, 'bull_use_spike': True, 'bull_rsi_required': True, 'bear_strategy': 'mean_reversion', 'bear_bb_std_mult': 1.3629915816493439, 'bear_rsi_os': 17, 'bear_rsi_ob': 46, 'bear_adx_thresh': 5.0267930070779, 'bear_atr_min_pct': 0.0043210265594475, 'bear_atr_max_pct': 0.013652158067580798, 'bear_tp_mult': 2.0324773279438633, 'bear_tsl_mult': 0.5201769542829716, 'bear_time_stop': 5, 'bear_use_sma': False, 'bear_use_ema': True, 'bear_use_atr': False, 'bear_use_adx': False, 'bear_use_spike': False, 'bear_rsi_required': True, 'sideways_strategy': 'breakout', 'sideways_bb_std_mult': 0.500790657588815, 'sideways_rsi_os': 40, 'sideways_rsi_ob': 94, 'sideways_adx_thresh': 9.009454679504277, 'sideways_atr_min_pct': 0.025374896456126037, 'sideways_atr_max_pct': 0.058596027555746784, 'sideways_tp_mult': 1.6469630304095704, 'sideways_tsl_mult': 0.6345231062431662, 'sideways_time_stop': 206, 'sideways_use_sma': True, 'sideways_use_ema': True, 'sideways_use_atr': False, 'sideways_use_adx': True, 'sideways_use_spike': False, 'sideways_rsi_required': False}.
[I 2025-08-31 02:31:00,468] Trial 539 finished with values: [-1000000000.0, 1000000000.0] and parameters: {'p_sma': 55, 'p_std': 53, 'p_atr': 27, 'p_adx': 29, 'rsi_period': 73, 'ema1': 5, 'ema2': 38, 'slip_atr_k': 0.12160314178612693, 'slip_spread_k': 0.13221571952123898, 'spread_hl_frac': 0.001217017018380806, 'bb_std_mult': 1.7599329174196465, 'rsi_os': 39, 'rsi_ob': 68, 'vol_spike': 0.18495199608555812, 'adx_thresh': 20.574803770653762, 'atr_min_pct': 0.009583798600683629, 'atr_max_pct': 0.121826614360311, 'tp_mult': 1.8431635641323914, 'tsl_mult': 0.2545108733231597, 'strategy': 'mean_reversion', 'time_stop': 105, 'use_sma': False, 'use_atr': False, 'use_adx': False, 'use_ema': False, 'use_spike': False, 'rsi_required': True, 'edge_k': 0.6035183521110759, 'edge_cap': 0.13123160989269636, 'bull_strategy': 'breakout', 'bull_bb_std_mult': 2.2471493182971285, 'bull_rsi_os': 26, 'bull_rsi_ob': 65, 'bull_adx_thresh': 6.860830331146562, 'bull_atr_min_pct': 0.0066415395620978935, 'bull_atr_max_pct': 0.1398582108933062, 'bull_tp_mult': 2.2938909233230484, 'bull_tsl_mult': 0.2623714472837551, 'bull_time_stop': 118, 'bull_use_sma': True, 'bull_use_ema': False, 'bull_use_atr': False, 'bull_use_adx': True, 'bull_use_spike': True, 'bull_rsi_required': True, 'bear_strategy': 'breakout', 'bear_bb_std_mult': 1.276626698924726, 'bear_rsi_os': 17, 'bear_rsi_ob': 47, 'bear_adx_thresh': 6.120794647078329, 'bear_atr_min_pct': 0.005950843476957054, 'bear_atr_max_pct': 0.010127374146465595, 'bear_tp_mult': 2.1326433461437837, 'bear_tsl_mult': 0.5010425719401775, 'bear_time_stop': 12, 'bear_use_sma': False, 'bear_use_ema': False, 'bear_use_atr': False, 'bear_use_adx': True, 'bear_use_spike': True, 'bear_rsi_required': True, 'sideways_strategy': 'breakout', 'sideways_bb_std_mult': 0.6029920979350974, 'sideways_rsi_os': 39, 'sideways_rsi_ob': 93, 'sideways_adx_thresh': 7.790979594972537, 'sideways_atr_min_pct': 0.028023857912204776, 'sideways_atr_max_pct': 0.05329925657287065, 'sideways_tp_mult': 1.7314928387451112, 'sideways_tsl_mult': 0.6756962583203079, 'sideways_time_stop': 202, 'sideways_use_sma': True, 'sideways_use_ema': False, 'sideways_use_atr': False, 'sideways_use_adx': False, 'sideways_use_spike': True, 'sideways_rsi_required': True}.
[I 2025-08-31 02:31:00,759] Trial 537 finished with values: [-1000000000.0, 1000000000.0] and parameters: {'p_sma': 55, 'p_std': 53, 'p_atr': 29, 'p_adx': 24, 'rsi_period': 69, 'ema1': 5, 'ema2': 29, 'slip_atr_k': 0.12823898802792488, 'slip_spread_k': 0.16915077330389636, 'spread_hl_frac': 0.0012306673312120681, 'bb_std_mult': 1.6396437148027192, 'rsi_os': 36, 'rsi_ob': 68, 'vol_spike': 0.18521431480849568, 'adx_thresh': 20.960180574867756, 'atr_min_pct': 0.00855401167507502, 'atr_max_pct': 0.12225126378868328, 'tp_mult': 1.2439073922629174, 'tsl_mult': 0.34286923837206706, 'strategy': 'mean_reversion', 'time_stop': 109, 'use_sma': False, 'use_atr': False, 'use_adx': False, 'use_ema': False, 'use_spike': False, 'rsi_required': True, 'edge_k': 0.5038561976411716, 'edge_cap': 0.07654458883315572, 'bull_strategy': 'breakout', 'bull_bb_std_mult': 2.2241562634313685, 'bull_rsi_os': 32, 'bull_rsi_ob': 64, 'bull_adx_thresh': 6.904894986487159, 'bull_atr_min_pct': 0.008553196796185141, 'bull_atr_max_pct': 0.14119351226726026, 'bull_tp_mult': 2.281287724564721, 'bull_tsl_mult': 0.2693090354627673, 'bull_time_stop': 135, 'bull_use_sma': True, 'bull_use_ema': True, 'bull_use_atr': False, 'bull_use_adx': True, 'bull_use_spike': True, 'bull_rsi_required': True, 'bear_strategy': 'breakout', 'bear_bb_std_mult': 1.379541863895485, 'bear_rsi_os': 17, 'bear_rsi_ob': 47, 'bear_adx_thresh': 5.94643847704287, 'bear_atr_min_pct': 0.004231721413449685, 'bear_atr_max_pct': 0.010111939558238473, 'bear_tp_mult': 2.102469031980422, 'bear_tsl_mult': 0.5013584903495645, 'bear_time_stop': 5, 'bear_use_sma': False, 'bear_use_ema': False, 'bear_use_atr': False, 'bear_use_adx': True, 'bear_use_spike': True, 'bear_rsi_required': True, 'sideways_strategy': 'breakout', 'sideways_bb_std_mult': 0.5034845115059633, 'sideways_rsi_os': 40, 'sideways_rsi_ob': 94, 'sideways_adx_thresh': 7.7958324933077225, 'sideways_atr_min_pct': 0.02640293365070041, 'sideways_atr_max_pct': 0.05823073940504872, 'sideways_tp_mult': 1.7295439244145, 'sideways_tsl_mult': 0.6389038812269433, 'sideways_time_stop': 205, 'sideways_use_sma': True, 'sideways_use_ema': False, 'sideways_use_atr': True, 'sideways_use_adx': False, 'sideways_use_spike': True, 'sideways_rsi_required': True}.
[I 2025-08-31 02:31:01,644] Trial 538 finished with values: [-1000000000.0, 1000000000.0] and parameters: {'p_sma': 55, 'p_std': 53, 'p_atr': 27, 'p_adx': 29, 'rsi_period': 69, 'ema1': 5, 'ema2': 26, 'slip_atr_k': 0.12422319841033687, 'slip_spread_k': 0.1544563389008266, 'spread_hl_frac': 0.0011914742973639467, 'bb_std_mult': 1.7332551226688244, 'rsi_os': 39, 'rsi_ob': 68, 'vol_spike': 0.18289020292904412, 'adx_thresh': 20.826704968893125, 'atr_min_pct': 0.008371764886226015, 'atr_max_pct': 0.12809829098437583, 'tp_mult': 1.470758827914739, 'tsl_mult': 0.4735120589648853, 'strategy': 'mean_reversion', 'time_stop': 108, 'use_sma': False, 'use_atr': True, 'use_adx': True, 'use_ema': False, 'use_spike': False, 'rsi_required': True, 'edge_k': 0.5043548541112208, 'edge_cap': 0.1302566730659681, 'bull_strategy': 'breakout', 'bull_bb_std_mult': 2.2469765317927686, 'bull_rsi_os': 46, 'bull_rsi_ob': 64, 'bull_adx_thresh': 6.7097113864913025, 'bull_atr_min_pct': 0.012004811123107723, 'bull_atr_max_pct': 0.14093970926755145, 'bull_tp_mult': 2.2825296566808237, 'bull_tsl_mult': 0.25598851220690283, 'bull_time_stop': 136, 'bull_use_sma': True, 'bull_use_ema': False, 'bull_use_atr': False, 'bull_use_adx': True, 'bull_use_spike': True, 'bull_rsi_required': True, 'bear_strategy': 'breakout', 'bear_bb_std_mult': 1.4010171419074426, 'bear_rsi_os': 17, 'bear_rsi_ob': 46, 'bear_adx_thresh': 5.720547693586869, 'bear_atr_min_pct': 0.0060502811269125155, 'bear_atr_max_pct': 0.010044818905518968, 'bear_tp_mult': 2.116557544147576, 'bear_tsl_mult': 0.4991931006571943, 'bear_time_stop': 11, 'bear_use_sma': False, 'bear_use_ema': False, 'bear_use_atr': False, 'bear_use_adx': False, 'bear_use_spike': True, 'bear_rsi_required': True, 'sideways_strategy': 'breakout', 'sideways_bb_std_mult': 0.5060907192814265, 'sideways_rsi_os': 40, 'sideways_rsi_ob': 94, 'sideways_adx_thresh': 8.014587388415361, 'sideways_atr_min_pct': 0.02631824149516316, 'sideways_atr_max_pct': 0.053329851862308264, 'sideways_tp_mult': 1.7294955074797522, 'sideways_tsl_mult': 0.6650158932668125, 'sideways_time_stop': 204, 'sideways_use_sma': True, 'sideways_use_ema': True, 'sideways_use_atr': False, 'sideways_use_adx': True, 'sideways_use_spike': True, 'sideways_rsi_required': True}.
[I 2025-08-31 02:31:01,739] Trial 536 finished with values: [-1000000000.0, 1000000000.0] and parameters: {'p_sma': 52, 'p_std': 53, 'p_atr': 29, 'p_adx': 29, 'rsi_period': 69, 'ema1': 5, 'ema2': 31, 'slip_atr_k': 0.08609509859892475, 'slip_spread_k': 0.17008407148933177, 'spread_hl_frac': 0.0014648468213719406, 'bb_std_mult': 1.6787192566832805, 'rsi_os': 36, 'rsi_ob': 68, 'vol_spike': 0.1863192084096426, 'adx_thresh': 22.660023211918503, 'atr_min_pct': 0.00857289160601112, 'atr_max_pct': 0.1219526626940986, 'tp_mult': 1.4523431772158006, 'tsl_mult': 0.5091333375213918, 'strategy': 'mean_reversion', 'time_stop': 109, 'use_sma': True, 'use_atr': True, 'use_adx': True, 'use_ema': False, 'use_spike': True, 'rsi_required': True, 'edge_k': 0.49597801617989973, 'edge_cap': 0.07336473627620904, 'bull_strategy': 'breakout', 'bull_bb_std_mult': 2.0535838087518137, 'bull_rsi_os': 32, 'bull_rsi_ob': 64, 'bull_adx_thresh': 6.8200668601043875, 'bull_atr_min_pct': 0.011734543826868981, 'bull_atr_max_pct': 0.13980242600199944, 'bull_tp_mult': 2.255733987852447, 'bull_tsl_mult': 0.24931576757253288, 'bull_time_stop': 135, 'bull_use_sma': True, 'bull_use_ema': False, 'bull_use_atr': False, 'bull_use_adx': False, 'bull_use_spike': True, 'bull_rsi_required': True, 'bear_strategy': 'mean_reversion', 'bear_bb_std_mult': 1.270114439273293, 'bear_rsi_os': 17, 'bear_rsi_ob': 46, 'bear_adx_thresh': 5.844407667674895, 'bear_atr_min_pct': 0.0038645943455241603, 'bear_atr_max_pct': 0.012928080586217434, 'bear_tp_mult': 2.11844762565771, 'bear_tsl_mult': 0.5073040405772131, 'bear_time_stop': 6, 'bear_use_sma': False, 'bear_use_ema': True, 'bear_use_atr': False, 'bear_use_adx': False, 'bear_use_spike': True, 'bear_rsi_required': True, 'sideways_strategy': 'breakout', 'sideways_bb_std_mult': 0.5067130018356308, 'sideways_rsi_os': 40, 'sideways_rsi_ob': 94, 'sideways_adx_thresh': 8.15906911616607, 'sideways_atr_min_pct': 0.0256267465012608, 'sideways_atr_max_pct': 0.05324413968840707, 'sideways_tp_mult': 1.6415159434672035, 'sideways_tsl_mult': 0.6413113399262658, 'sideways_time_stop': 206, 'sideways_use_sma': True, 'sideways_use_ema': True, 'sideways_use_atr': False, 'sideways_use_adx': True, 'sideways_use_spike': True, 'sideways_rsi_required': False}.
