[I 2025-08-31 00:52:31,189] Trial 422 finished with values: [-1000000000.0, 1000000000.0] and parameters: {'p_sma': 36, 'p_std': 41, 'p_atr': 7, 'p_adx': 8, 'rsi_period': 80, 'ema1': 19, 'ema2': 33, 'slip_atr_k': 0.04980580157706263, 'slip_spread_k': 0.27508296811036276, 'spread_hl_frac': 0.007346466689670272, 'bb_std_mult': 1.340321193475929, 'rsi_os': 15, 'rsi_ob': 75, 'vol_spike': 0.1994812098076951, 'adx_thresh': 32.38547531525826, 'atr_min_pct': 0.025755306163268776, 'atr_max_pct': 0.11053150255279323, 'tp_mult': 1.823951381841669, 'tsl_mult': 0.6914167961421892, 'strategy': 'breakout', 'time_stop': 181, 'use_sma': True, 'use_atr': False, 'use_adx': False, 'use_ema': True, 'use_spike': True, 'rsi_required': False, 'edge_k': 0.8745725330339207, 'edge_cap': 0.820677458591542, 'bull_strategy': 'breakout', 'bull_bb_std_mult': 2.6681575726925066, 'bull_rsi_os': 42, 'bull_rsi_ob': 69, 'bull_adx_thresh': 14.911780384274282, 'bull_atr_min_pct': 0.0014650769932689975, 'bull_atr_max_pct': 0.01965038390421147, 'bull_tp_mult': 2.448728425329925, 'bull_tsl_mult': 0.31025605806333806, 'bull_time_stop': 180, 'bull_use_sma': False, 'bull_use_ema': False, 'bull_use_atr': True, 'bull_use_adx': False, 'bull_use_spike': True, 'bull_rsi_required': True, 'bear_strategy': 'mean_reversion', 'bear_bb_std_mult': 1.1076644969990417, 'bear_rsi_os': 22, 'bear_rsi_ob': 76, 'bear_adx_thresh': 24.027326514020416, 'bear_atr_min_pct': 0.008236246186047434, 'bear_atr_max_pct': 0.02533817835434384, 'bear_tp_mult': 1.9655481731308495, 'bear_tsl_mult': 0.8957492250959105, 'bear_time_stop': 105, 'bear_use_sma': True, 'bear_use_ema': True, 'bear_use_atr': False, 'bear_use_adx': False, 'bear_use_spike': False, 'bear_rsi_required': False, 'sideways_strategy': 'mean_reversion', 'sideways_bb_std_mult': 3.0941765992648573, 'sideways_rsi_os': 44, 'sideways_rsi_ob': 90, 'sideways_adx_thresh': 11.694909177327972, 'sideways_atr_min_pct': 0.01692728114830311, 'sideways_atr_max_pct': 0.14599317565125755, 'sideways_tp_mult': 1.0437844903813134, 'sideways_tsl_mult': 0.7558474863112422, 'sideways_time_stop': 200, 'sideways_use_sma': True, 'sideways_use_ema': False, 'sideways_use_atr': False, 'sideways_use_adx': False, 'sideways_use_spike': True, 'sideways_rsi_required': False}.
[I 2025-08-31 00:52:32,943] Trial 423 finished with values: [-1000000000.0, 1000000000.0] and parameters: {'p_sma': 48, 'p_std': 41, 'p_atr': 23, 'p_adx': 17, 'rsi_period': 58, 'ema1': 14, 'ema2': 20, 'slip_atr_k': 0.03656605478744866, 'slip_spread_k': 0.99585560696222, 'spread_hl_frac': 0.00794613569233359, 'bb_std_mult': 0.523222990095251, 'rsi_os': 51, 'rsi_ob': 73, 'vol_spike': 0.13222233468114114, 'adx_thresh': 22.04194754835443, 'atr_min_pct': 0.027856570525504075, 'atr_max_pct': 0.06993770645931077, 'tp_mult': 2.175427690032104, 'tsl_mult': 0.3340357270946181, 'strategy': 'breakout', 'time_stop': 88, 'use_sma': True, 'use_atr': False, 'use_adx': False, 'use_ema': True, 'use_spike': True, 'rsi_required': False, 'edge_k': 0.12295056404899907, 'edge_cap': 0.39570023021835277, 'bull_strategy': 'breakout', 'bull_bb_std_mult': 1.5598593649536534, 'bull_rsi_os': 8, 'bull_rsi_ob': 54, 'bull_adx_thresh': 20.025452219397028, 'bull_atr_min_pct': 0.0005437827431698032, 'bull_atr_max_pct': 0.07826696462339677, 'bull_tp_mult': 2.4715094284195773, 'bull_tsl_mult': 0.8138489816857226, 'bull_time_stop': 11, 'bull_use_sma': False, 'bull_use_ema': False, 'bull_use_atr': False, 'bull_use_adx': False, 'bull_use_spike': True, 'bull_rsi_required': True, 'bear_strategy': 'mean_reversion', 'bear_bb_std_mult': 0.9875515040564116, 'bear_rsi_os': 22, 'bear_rsi_ob': 76, 'bear_adx_thresh': 23.810179676776425, 'bear_atr_min_pct': 0.008237803364533823, 'bear_atr_max_pct': 0.02556842695580938, 'bear_tp_mult': 2.728809436617728, 'bear_tsl_mult': 0.6885327361492954, 'bear_time_stop': 37, 'bear_use_sma': True, 'bear_use_ema': True, 'bear_use_atr': False, 'bear_use_adx': False, 'bear_use_spike': False, 'bear_rsi_required': True, 'sideways_strategy': 'breakout', 'sideways_bb_std_mult': 2.5318540018595126, 'sideways_rsi_os': 35, 'sideways_rsi_ob': 91, 'sideways_adx_thresh': 11.50903576553977, 'sideways_atr_min_pct': 0.014154637332784796, 'sideways_atr_max_pct': 0.14673994875848076, 'sideways_tp_mult': 1.05720086347459, 'sideways_tsl_mult': 0.7167450127740742, 'sideways_time_stop': 76, 'sideways_use_sma': True, 'sideways_use_ema': False, 'sideways_use_atr': False, 'sideways_use_adx': False, 'sideways_use_spike': True, 'sideways_rsi_required': False}.
[I 2025-08-31 00:52:35,370] Trial 424 finished with values: [-1000000000.0, 1000000000.0] and parameters: {'p_sma': 36, 'p_std': 54, 'p_atr': 23, 'p_adx': 30, 'rsi_period': 58, 'ema1': 19, 'ema2': 20, 'slip_atr_k': 0.19425783011179676, 'slip_spread_k': 0.2275996231146184, 'spread_hl_frac': 0.007556726490867483, 'bb_std_mult': 1.393367829058606, 'rsi_os': 16, 'rsi_ob': 75, 'vol_spike': 0.1334227248122652, 'adx_thresh': 15.513469023926085, 'atr_min_pct': 0.015272034062819143, 'atr_max_pct': 0.07180350720287153, 'tp_mult': 1.6174719367014827, 'tsl_mult': 0.12495715815871845, 'strategy': 'mean_reversion', 'time_stop': 78, 'use_sma': True, 'use_atr': False, 'use_adx': False, 'use_ema': True, 'use_spike': True, 'rsi_required': False, 'edge_k': 0.6842635906742464, 'edge_cap': 0.8181335901194865, 'bull_strategy': 'breakout', 'bull_bb_std_mult': 1.666153314087979, 'bull_rsi_os': 33, 'bull_rsi_ob': 68, 'bull_adx_thresh': 15.918866894644639, 'bull_atr_min_pct': 0.019703622571632853, 'bull_atr_max_pct': 0.05989239103669445, 'bull_tp_mult': 2.454539781280793, 'bull_tsl_mult': 0.19457855076395658, 'bull_time_stop': 140, 'bull_use_sma': False, 'bull_use_ema': False, 'bull_use_atr': False, 'bull_use_adx': True, 'bull_use_spike': False, 'bull_rsi_required': True, 'bear_strategy': 'mean_reversion', 'bear_bb_std_mult': 0.968495944694079, 'bear_rsi_os': 22, 'bear_rsi_ob': 77, 'bear_adx_thresh': 6.254233805583737, 'bear_atr_min_pct': 0.00825375111026647, 'bear_atr_max_pct': 0.025491626471001946, 'bear_tp_mult': 1.9887821079631052, 'bear_tsl_mult': 0.6909146258155014, 'bear_time_stop': 37, 'bear_use_sma': True, 'bear_use_ema': True, 'bear_use_atr': False, 'bear_use_adx': False, 'bear_use_spike': False, 'bear_rsi_required': True, 'sideways_strategy': 'breakout', 'sideways_bb_std_mult': 1.7903542862364508, 'sideways_rsi_os': 43, 'sideways_rsi_ob': 89, 'sideways_adx_thresh': 11.579181939731217, 'sideways_atr_min_pct': 0.02038419157510067, 'sideways_atr_max_pct': 0.13929415163031367, 'sideways_tp_mult': 2.4077547572183433, 'sideways_tsl_mult': 0.7376848560271022, 'sideways_time_stop': 293, 'sideways_use_sma': True, 'sideways_use_ema': False, 'sideways_use_atr': False, 'sideways_use_adx': False, 'sideways_use_spike': True, 'sideways_rsi_required': False}.
[I 2025-08-31 00:52:39,376] Trial 426 finished with values: [-1000000000.0, 1000000000.0] and parameters: {'p_sma': 28, 'p_std': 33, 'p_atr': 23, 'p_adx': 16, 'rsi_period': 58, 'ema1': 14, 'ema2': 20, 'slip_atr_k': 0.039584130902259346, 'slip_spread_k': 0.24323123124223867, 'spread_hl_frac': 0.010571174281730586, 'bb_std_mult': 1.9489171227580804, 'rsi_os': 47, 'rsi_ob': 75, 'vol_spike': 0.24681750969502758, 'adx_thresh': 12.461101590113282, 'atr_min_pct': 0.009586828264991982, 'atr_max_pct': 0.06285591815947969, 'tp_mult': 2.690083503964771, 'tsl_mult': 0.6969357256246514, 'strategy': 'breakout', 'time_stop': 77, 'use_sma': True, 'use_atr': False, 'use_adx': False, 'use_ema': True, 'use_spike': True, 'rsi_required': False, 'edge_k': 1.2244796710148833, 'edge_cap': 0.47981246788055093, 'bull_strategy': 'breakout', 'bull_bb_std_mult': 2.792836066260864, 'bull_rsi_os': 33, 'bull_rsi_ob': 71, 'bull_adx_thresh': 21.345302128012552, 'bull_atr_min_pct': 0.0017127453196085773, 'bull_atr_max_pct': 0.07106724681099306, 'bull_tp_mult': 2.4322026762725693, 'bull_tsl_mult': 0.1866744281567615, 'bull_time_stop': 178, 'bull_use_sma': False, 'bull_use_ema': False, 'bull_use_atr': False, 'bull_use_adx': True, 'bull_use_spike': False, 'bull_rsi_required': True, 'bear_strategy': 'mean_reversion', 'bear_bb_std_mult': 0.9568463945806682, 'bear_rsi_os': 24, 'bear_rsi_ob': 81, 'bear_adx_thresh': 6.286066158396022, 'bear_atr_min_pct': 0.009678682021618352, 'bear_atr_max_pct': 0.015228590731152597, 'bear_tp_mult': 1.9806114022126589, 'bear_tsl_mult': 0.6967584451145366, 'bear_time_stop': 235, 'bear_use_sma': True, 'bear_use_ema': True, 'bear_use_atr': True, 'bear_use_adx': False, 'bear_use_spike': False, 'bear_rsi_required': False, 'sideways_strategy': 'breakout', 'sideways_bb_std_mult': 2.5694842591539055, 'sideways_rsi_os': 44, 'sideways_rsi_ob': 46, 'sideways_adx_thresh': 22.8924449723561, 'sideways_atr_min_pct': 0.02053936505339171, 'sideways_atr_max_pct': 0.13568678128643782, 'sideways_tp_mult': 1.0427619294419035, 'sideways_tsl_mult': 0.7302131682701802, 'sideways_time_stop': 187, 'sideways_use_sma': True, 'sideways_use_ema': False, 'sideways_use_atr': False, 'sideways_use_adx': False, 'sideways_use_spike': True, 'sideways_rsi_required': False}.
[I 2025-08-31 02:14:57,783] Trial 427 finished with values: [-1000000000.0, 1000000000.0] and parameters: {'p_sma': 51, 'p_std': 58, 'p_atr': 15, 'p_adx': 29, 'rsi_period': 58, 'ema1': 14, 'ema2': 20, 'slip_atr_k': 0.09503500462712969, 'slip_spread_k': 0.003325448738947301, 'spread_hl_frac': 0.010564145638083037, 'bb_std_mult': 2.380048439491325, 'rsi_os': 9, 'rsi_ob': 75, 'vol_spike': 0.044862645618273855, 'adx_thresh': 16.663031559657984, 'atr_min_pct': 0.009715119824846253, 'atr_max_pct': 0.06309458017619807, 'tp_mult': 1.6926920007081763, 'tsl_mult': 0.9177930466216908, 'strategy': 'breakout', 'time_stop': 284, 'use_sma': False, 'use_atr': False, 'use_adx': True, 'use_ema': True, 'use_spike': False, 'rsi_required': False, 'edge_k': 0.7640093434959978, 'edge_cap': 0.7833139296409863, 'bull_strategy': 'mean_reversion', 'bull_bb_std_mult': 1.8021069228534123, 'bull_rsi_os': 28, 'bull_rsi_ob': 63, 'bull_adx_thresh': 15.61609900402211, 'bull_atr_min_pct': 3.0274656392069877e-05, 'bull_atr_max_pct': 0.10423078476719014, 'bull_tp_mult': 2.368707962331276, 'bull_tsl_mult': 0.2778378228041536, 'bull_time_stop': 156, 'bull_use_sma': False, 'bull_use_ema': False, 'bull_use_atr': False, 'bull_use_adx': True, 'bull_use_spike': False, 'bull_rsi_required': False, 'bear_strategy': 'breakout', 'bear_bb_std_mult': 1.0063869981195774, 'bear_rsi_os': 24, 'bear_rsi_ob': 77, 'bear_adx_thresh': 6.441466961504133, 'bear_atr_min_pct': 0.009491093728391678, 'bear_atr_max_pct': 0.01600444688763278, 'bear_tp_mult': 1.9881536611419042, 'bear_tsl_mult': 0.8537507250177162, 'bear_time_stop': 33, 'bear_use_sma': True, 'bear_use_ema': False, 'bear_use_atr': True, 'bear_use_adx': True, 'bear_use_spike': False, 'bear_rsi_required': True, 'sideways_strategy': 'breakout', 'sideways_bb_std_mult': 1.145717416450893, 'sideways_rsi_os': 37, 'sideways_rsi_ob': 46, 'sideways_adx_thresh': 22.82602289521826, 'sideways_atr_min_pct': 0.02027598191565328, 'sideways_atr_max_pct': 0.10382323282572695, 'sideways_tp_mult': 1.1357391395433127, 'sideways_tsl_mult': 0.7315864063223062, 'sideways_time_stop': 249, 'sideways_use_sma': False, 'sideways_use_ema': False, 'sideways_use_atr': False, 'sideways_use_adx': True, 'sideways_use_spike': True, 'sideways_rsi_required': False}.
[I 2025-08-31 02:14:58,913] Trial 428 finished with values: [-1000000000.0, 1000000000.0] and parameters: {'p_sma': 46, 'p_std': 34, 'p_atr': 23, 'p_adx': 29, 'rsi_period': 61, 'ema1': 17, 'ema2': 57, 'slip_atr_k': 0.028505032769032043, 'slip_spread_k': 0.23447800892869453, 'spread_hl_frac': 0.015519349286972225, 'bb_std_mult': 0.7843751845981504, 'rsi_os': 9, 'rsi_ob': 75, 'vol_spike': 0.0848559332061949, 'adx_thresh': 12.383398460697759, 'atr_min_pct': 0.009572011289076091, 'atr_max_pct': 0.06288077955718072, 'tp_mult': 1.6982735309942134, 'tsl_mult': 0.7385279558151598, 'strategy': 'mean_reversion', 'time_stop': 78, 'use_sma': False, 'use_atr': True, 'use_adx': True, 'use_ema': True, 'use_spike': False, 'rsi_required': False, 'edge_k': 0.7698354762197379, 'edge_cap': 0.5559772275036559, 'bull_strategy': 'mean_reversion', 'bull_bb_std_mult': 1.0105367982754765, 'bull_rsi_os': 52, 'bull_rsi_ob': 63, 'bull_adx_thresh': 25.37508282188161, 'bull_atr_min_pct': 0.024236581649396734, 'bull_atr_max_pct': 0.0607793233464966, 'bull_tp_mult': 2.3772071086493805, 'bull_tsl_mult': 0.15466874485663346, 'bull_time_stop': 139, 'bull_use_sma': False, 'bull_use_ema': True, 'bull_use_atr': True, 'bull_use_adx': True, 'bull_use_spike': False, 'bull_rsi_required': False, 'bear_strategy': 'breakout', 'bear_bb_std_mult': 3.046603320934862, 'bear_rsi_os': 23, 'bear_rsi_ob': 81, 'bear_adx_thresh': 33.1621502593396, 'bear_atr_min_pct': 0.009956552720550654, 'bear_atr_max_pct': 0.0146226392909962, 'bear_tp_mult': 1.9977757608856672, 'bear_tsl_mult': 0.28930836386965453, 'bear_time_stop': 31, 'bear_use_sma': True, 'bear_use_ema': False, 'bear_use_atr': True, 'bear_use_adx': True, 'bear_use_spike': False, 'bear_rsi_required': False, 'sideways_strategy': 'mean_reversion', 'sideways_bb_std_mult': 3.4837266156499074, 'sideways_rsi_os': 22, 'sideways_rsi_ob': 88, 'sideways_adx_thresh': 12.535968227996513, 'sideways_atr_min_pct': 0.020430905984401875, 'sideways_atr_max_pct': 0.1347743824865361, 'sideways_tp_mult': 1.1392409212288435, 'sideways_tsl_mult': 0.7210869121750275, 'sideways_time_stop': 147, 'sideways_use_sma': False, 'sideways_use_ema': True, 'sideways_use_atr': False, 'sideways_use_adx': True, 'sideways_use_spike': False, 'sideways_rsi_required': True}.
[I 2025-08-31 02:14:59,833] Trial 429 finished with values: [-1000000000.0, 1000000000.0] and parameters: {'p_sma': 25, 'p_std': 38, 'p_atr': 22, 'p_adx': 7, 'rsi_period': 68, 'ema1': 10, 'ema2': 56, 'slip_atr_k': 0.02546902250302003, 'slip_spread_k': 0.8370801218481193, 'spread_hl_frac': 0.010628314798128825, 'bb_std_mult': 1.8467101648221609, 'rsi_os': 53, 'rsi_ob': 75, 'vol_spike': 0.14916372487491958, 'adx_thresh': 12.626310262122448, 'atr_min_pct': 0.017113353358046403, 'atr_max_pct': 0.023604415728184322, 'tp_mult': 2.316092979277996, 'tsl_mult': 0.7578506470294215, 'strategy': 'breakout', 'time_stop': 71, 'use_sma': False, 'use_atr': True, 'use_adx': True, 'use_ema': True, 'use_spike': False, 'rsi_required': False, 'edge_k': 0.7475151392877989, 'edge_cap': 0.47758001946156087, 'bull_strategy': 'mean_reversion', 'bull_bb_std_mult': 2.8212008981111394, 'bull_rsi_os': 38, 'bull_rsi_ob': 71, 'bull_adx_thresh': 21.22736709705506, 'bull_atr_min_pct': 0.025978026467099517, 'bull_atr_max_pct': 0.07052689233340963, 'bull_tp_mult': 2.318786887708423, 'bull_tsl_mult': 0.2704552281159122, 'bull_time_stop': 152, 'bull_use_sma': False, 'bull_use_ema': True, 'bull_use_atr': True, 'bull_use_adx': True, 'bull_use_spike': False, 'bull_rsi_required': False, 'bear_strategy': 'breakout', 'bear_bb_std_mult': 1.126045417171227, 'bear_rsi_os': 43, 'bear_rsi_ob': 50, 'bear_adx_thresh': 8.395305372399081, 'bear_atr_min_pct': 0.009732570304793934, 'bear_atr_max_pct': 0.015802059107639065, 'bear_tp_mult': 2.4150464582320272, 'bear_tsl_mult': 0.07393367407321033, 'bear_time_stop': 283, 'bear_use_sma': True, 'bear_use_ema': False, 'bear_use_atr': True, 'bear_use_adx': True, 'bear_use_spike': False, 'bear_rsi_required': False, 'sideways_strategy': 'mean_reversion', 'sideways_bb_std_mult': 1.1285358384278008, 'sideways_rsi_os': 15, 'sideways_rsi_ob': 88, 'sideways_adx_thresh': 12.661786208037327, 'sideways_atr_min_pct': 0.02203286366476864, 'sideways_atr_max_pct': 0.13595005928438197, 'sideways_tp_mult': 1.1341550049460893, 'sideways_tsl_mult': 0.731073446516012, 'sideways_time_stop': 191, 'sideways_use_sma': False, 'sideways_use_ema': True, 'sideways_use_atr': False, 'sideways_use_adx': True, 'sideways_use_spike': False, 'sideways_rsi_required': True}.
[I 2025-08-31 02:15:01,575] Trial 430 finished with values: [-1000000000.0, 1000000000.0] and parameters: {'p_sma': 51, 'p_std': 38, 'p_atr': 15, 'p_adx': 7, 'rsi_period': 68, 'ema1': 17, 'ema2': 17, 'slip_atr_k': 0.02719072932209767, 'slip_spread_k': 0.2944187295683718, 'spread_hl_frac': 0.009554989142647302, 'bb_std_mult': 1.80625249124001, 'rsi_os': 26, 'rsi_ob': 73, 'vol_spike': 0.17657655879142017, 'adx_thresh': 16.54891286180967, 'atr_min_pct': 0.014082965048730066, 'atr_max_pct': 0.023950601927403184, 'tp_mult': 2.2603072048239277, 'tsl_mult': 0.9207145533440961, 'strategy': 'breakout', 'time_stop': 281, 'use_sma': False, 'use_atr': True, 'use_adx': True, 'use_ema': False, 'use_spike': False, 'rsi_required': False, 'edge_k': 0.7652300664592958, 'edge_cap': 0.7393943718288517, 'bull_strategy': 'mean_reversion', 'bull_bb_std_mult': 0.5146841840584149, 'bull_rsi_os': 16, 'bull_rsi_ob': 70, 'bull_adx_thresh': 30.951479607134775, 'bull_atr_min_pct': 0.026158697478711745, 'bull_atr_max_pct': 0.07539396199469853, 'bull_tp_mult': 2.378460462963986, 'bull_tsl_mult': 0.27401690561820036, 'bull_time_stop': 208, 'bull_use_sma': False, 'bull_use_ema': True, 'bull_use_atr': True, 'bull_use_adx': True, 'bull_use_spike': False, 'bull_rsi_required': False, 'bear_strategy': 'breakout', 'bear_bb_std_mult': 1.0534571642598258, 'bear_rsi_os': 44, 'bear_rsi_ob': 46, 'bear_adx_thresh': 33.125852572601005, 'bear_atr_min_pct': 0.017444001782063383, 'bear_atr_max_pct': 0.01610002143659678, 'bear_tp_mult': 1.0570924605427523, 'bear_tsl_mult': 0.8534999575864053, 'bear_time_stop': 30, 'bear_use_sma': False, 'bear_use_ema': False, 'bear_use_atr': True, 'bear_use_adx': True, 'bear_use_spike': False, 'bear_rsi_required': False, 'sideways_strategy': 'mean_reversion', 'sideways_bb_std_mult': 1.3727150990282524, 'sideways_rsi_os': 27, 'sideways_rsi_ob': 87, 'sideways_adx_thresh': 12.6266372257469, 'sideways_atr_min_pct': 0.025222879293240727, 'sideways_atr_max_pct': 0.0466206498734417, 'sideways_tp_mult': 1.1401500901825652, 'sideways_tsl_mult': 0.7146563902596947, 'sideways_time_stop': 149, 'sideways_use_sma': False, 'sideways_use_ema': True, 'sideways_use_atr': False, 'sideways_use_adx': True, 'sideways_use_spike': False, 'sideways_rsi_required': True}.
[I 2025-08-31 02:15:57,556] Trial 434 finished with values: [-1000000000.0, 1000000000.0] and parameters: {'p_sma': 48, 'p_std': 40, 'p_atr': 16, 'p_adx': 8, 'rsi_period': 75, 'ema1': 11, 'ema2': 19, 'slip_atr_k': 0.2264201196115521, 'slip_spread_k': 0.5676274697998062, 'spread_hl_frac': 0.017773985227591146, 'bb_std_mult': 2.0342441762961974, 'rsi_os': 54, 'rsi_ob': 73, 'vol_spike': 0.19312869359057303, 'adx_thresh': 13.84572011238048, 'atr_min_pct': 0.005346462244958936, 'atr_max_pct': 0.04649214586339772, 'tp_mult': 2.6001217130568066, 'tsl_mult': 0.5213394983819991, 'strategy': 'breakout', 'time_stop': 100, 'use_sma': True, 'use_atr': False, 'use_adx': False, 'use_ema': False, 'use_spike': False, 'rsi_required': True, 'edge_k': 0.7159706745115859, 'edge_cap': 0.8617599112810077, 'bull_strategy': 'breakout', 'bull_bb_std_mult': 1.4177195688756128, 'bull_rsi_os': 50, 'bull_rsi_ob': 52, 'bull_adx_thresh': 27.79554863081231, 'bull_atr_min_pct': 0.0171909181764095, 'bull_atr_max_pct': 0.10919519806085219, 'bull_tp_mult': 1.7740405818608405, 'bull_tsl_mult': 0.8448838686829714, 'bull_time_stop': 171, 'bull_use_sma': True, 'bull_use_ema': False, 'bull_use_atr': True, 'bull_use_adx': True, 'bull_use_spike': False, 'bull_rsi_required': False, 'bear_strategy': 'mean_reversion', 'bear_bb_std_mult': 1.4392869768373697, 'bear_rsi_os': 21, 'bear_rsi_ob': 78, 'bear_adx_thresh': 7.027909179221853, 'bear_atr_min_pct': 0.009157792298533734, 'bear_atr_max_pct': 0.022121888113028645, 'bear_tp_mult': 1.869919463038249, 'bear_tsl_mult': 0.6699171959910816, 'bear_time_stop': 15, 'bear_use_sma': False, 'bear_use_ema': False, 'bear_use_atr': False, 'bear_use_adx': True, 'bear_use_spike': True, 'bear_rsi_required': False, 'sideways_strategy': 'mean_reversion', 'sideways_bb_std_mult': 1.8687062459771242, 'sideways_rsi_os': 48, 'sideways_rsi_ob': 90, 'sideways_adx_thresh': 28.44258829687358, 'sideways_atr_min_pct': 0.01929322991797118, 'sideways_atr_max_pct': 0.13939440409621348, 'sideways_tp_mult': 1.0118892278345901, 'sideways_tsl_mult': 0.7584515171851932, 'sideways_time_stop': 172, 'sideways_use_sma': True, 'sideways_use_ema': False, 'sideways_use_atr': True, 'sideways_use_adx': False, 'sideways_use_spike': True, 'sideways_rsi_required': False}.
