[I 2025-08-31 02:19:05,138] Trial 452 finished with values: [-1000000000.0, 1000000000.0] and parameters: {'p_sma': 18, 'p_std': 39, 'p_atr': 22, 'p_adx': 19, 'rsi_period': 47, 'ema1': 5, 'ema2': 17, 'slip_atr_k': 0.23678832579795775, 'slip_spread_k': 0.3172551212669573, 'spread_hl_frac': 0.026615541126640087, 'bb_std_mult': 1.8852614601603532, 'rsi_os': 49, 'rsi_ob': 85, 'vol_spike': 0.1613781119002525, 'adx_thresh': 9.387979284286201, 'atr_min_pct': 0.010544588680172657, 'atr_max_pct': 0.07596044919325057, 'tp_mult': 2.9160401732011274, 'tsl_mult': 0.13646452648764162, 'strategy': 'breakout', 'time_stop': 77, 'use_sma': False, 'use_atr': True, 'use_adx': True, 'use_ema': False, 'use_spike': False, 'rsi_required': True, 'edge_k': 0.7190054212016723, 'edge_cap': 0.30738616743404545, 'bull_strategy': 'breakout', 'bull_bb_std_mult': 3.4941059562516124, 'bull_rsi_os': 40, 'bull_rsi_ob': 68, 'bull_adx_thresh': 14.621278777129184, 'bull_atr_min_pct': 0.001524234739104007, 'bull_atr_max_pct': 0.07574639415865365, 'bull_tp_mult': 2.0342357560564586, 'bull_tsl_mult': 0.6212582079207871, 'bull_time_stop': 241, 'bull_use_sma': False, 'bull_use_ema': False, 'bull_use_atr': True, 'bull_use_adx': True, 'bull_use_spike': False, 'bull_rsi_required': False, 'bear_strategy': 'breakout', 'bear_bb_std_mult': 3.3120756486326988, 'bear_rsi_os': 16, 'bear_rsi_ob': 75, 'bear_adx_thresh': 7.377552617191365, 'bear_atr_min_pct': 0.007723014185746085, 'bear_atr_max_pct': 0.03382911808183805, 'bear_tp_mult': 1.949111165975271, 'bear_tsl_mult': 0.7010244038977568, 'bear_time_stop': 31, 'bear_use_sma': False, 'bear_use_ema': False, 'bear_use_atr': False, 'bear_use_adx': True, 'bear_use_spike': True, 'bear_rsi_required': False, 'sideways_strategy': 'mean_reversion', 'sideways_bb_std_mult': 1.0158232007401742, 'sideways_rsi_os': 49, 'sideways_rsi_ob': 94, 'sideways_adx_thresh': 27.016394179087076, 'sideways_atr_min_pct': 0.02247417978453084, 'sideways_atr_max_pct': 0.1473309136299275, 'sideways_tp_mult': 1.1966439486069107, 'sideways_tsl_mult': 0.7255783318545151, 'sideways_time_stop': 238, 'sideways_use_sma': True, 'sideways_use_ema': True, 'sideways_use_atr': True, 'sideways_use_adx': True, 'sideways_use_spike': False, 'sideways_rsi_required': True}.
[I 2025-08-31 02:19:05,902] Trial 449 finished with values: [-1000000000.0, 1000000000.0] and parameters: {'p_sma': 18, 'p_std': 43, 'p_atr': 22, 'p_adx': 14, 'rsi_period': 63, 'ema1': 7, 'ema2': 10, 'slip_atr_k': 0.034469267398803294, 'slip_spread_k': 0.28040239092851516, 'spread_hl_frac': 0.011333611201859864, 'bb_std_mult': 1.9407545160355815, 'rsi_os': 52, 'rsi_ob': 76, 'vol_spike': 0.2108041431271289, 'adx_thresh': 10.294674995178612, 'atr_min_pct': 0.013302517036609321, 'atr_max_pct': 0.07645996664679584, 'tp_mult': 2.6143290707829174, 'tsl_mult': 0.23846291037930567, 'strategy': 'breakout', 'time_stop': 90, 'use_sma': False, 'use_atr': True, 'use_adx': True, 'use_ema': True, 'use_spike': False, 'rsi_required': True, 'edge_k': 0.6764144868903692, 'edge_cap': 0.5914648405946388, 'bull_strategy': 'breakout', 'bull_bb_std_mult': 1.748380112852573, 'bull_rsi_os': 39, 'bull_rsi_ob': 69, 'bull_adx_thresh': 14.696522488860333, 'bull_atr_min_pct': 0.002976076257366441, 'bull_atr_max_pct': 0.07361187905473583, 'bull_tp_mult': 2.436753849492265, 'bull_tsl_mult': 0.690556561690004, 'bull_time_stop': 244, 'bull_use_sma': False, 'bull_use_ema': True, 'bull_use_atr': True, 'bull_use_adx': True, 'bull_use_spike': False, 'bull_rsi_required': False, 'bear_strategy': 'breakout', 'bear_bb_std_mult': 2.6994618028717436, 'bear_rsi_os': 11, 'bear_rsi_ob': 77, 'bear_adx_thresh': 22.00335625970777, 'bear_atr_min_pct': 0.00772482964172167, 'bear_atr_max_pct': 0.01284796911666947, 'bear_tp_mult': 1.92789663064992, 'bear_tsl_mult': 0.6878787825215336, 'bear_time_stop': 28, 'bear_use_sma': True, 'bear_use_ema': False, 'bear_use_atr': True, 'bear_use_adx': True, 'bear_use_spike': True, 'bear_rsi_required': False, 'sideways_strategy': 'mean_reversion', 'sideways_bb_std_mult': 1.003503316738344, 'sideways_rsi_os': 10, 'sideways_rsi_ob': 89, 'sideways_adx_thresh': 27.330598371414133, 'sideways_atr_min_pct': 0.022072501977073226, 'sideways_atr_max_pct': 0.1497298600917741, 'sideways_tp_mult': 1.1877640877862508, 'sideways_tsl_mult': 0.7257668623805054, 'sideways_time_stop': 177, 'sideways_use_sma': False, 'sideways_use_ema': True, 'sideways_use_atr': True, 'sideways_use_adx': True, 'sideways_use_spike': False, 'sideways_rsi_required': True}.
[I 2025-08-31 02:19:06,019] Trial 450 finished with values: [-1000000000.0, 1000000000.0] and parameters: {'p_sma': 18, 'p_std': 45, 'p_atr': 24, 'p_adx': 10, 'rsi_period': 65, 'ema1': 5, 'ema2': 37, 'slip_atr_k': 0.03333540699924766, 'slip_spread_k': 0.2790440833215532, 'spread_hl_frac': 0.009479199907982907, 'bb_std_mult': 1.9157593218391937, 'rsi_os': 27, 'rsi_ob': 74, 'vol_spike': 0.15987015057395765, 'adx_thresh': 7.636155088076656, 'atr_min_pct': 0.023915088511260726, 'atr_max_pct': 0.12327770029040089, 'tp_mult': 2.481094934287836, 'tsl_mult': 0.9744723006401175, 'strategy': 'mean_reversion', 'time_stop': 97, 'use_sma': False, 'use_atr': True, 'use_adx': True, 'use_ema': False, 'use_spike': False, 'rsi_required': True, 'edge_k': 1.8416629922541246, 'edge_cap': 0.8116795391235391, 'bull_strategy': 'breakout', 'bull_bb_std_mult': 2.8567452315844477, 'bull_rsi_os': 39, 'bull_rsi_ob': 69, 'bull_adx_thresh': 14.636889996488376, 'bull_atr_min_pct': 0.0011095522798315847, 'bull_atr_max_pct': 0.07674461680092226, 'bull_tp_mult': 1.713660972032943, 'bull_tsl_mult': 0.3240577148079969, 'bull_time_stop': 243, 'bull_use_sma': False, 'bull_use_ema': False, 'bull_use_atr': True, 'bull_use_adx': True, 'bull_use_spike': False, 'bull_rsi_required': False, 'bear_strategy': 'breakout', 'bear_bb_std_mult': 3.568189525977286, 'bear_rsi_os': 16, 'bear_rsi_ob': 63, 'bear_adx_thresh': 15.802509731937901, 'bear_atr_min_pct': 0.028527332487652053, 'bear_atr_max_pct': 0.031641845065522416, 'bear_tp_mult': 1.9315619219536, 'bear_tsl_mult': 0.7023547426397609, 'bear_time_stop': 28, 'bear_use_sma': False, 'bear_use_ema': False, 'bear_use_atr': False, 'bear_use_adx': True, 'bear_use_spike': True, 'bear_rsi_required': False, 'sideways_strategy': 'mean_reversion', 'sideways_bb_std_mult': 1.255919262334913, 'sideways_rsi_os': 26, 'sideways_rsi_ob': 90, 'sideways_adx_thresh': 18.958849681342016, 'sideways_atr_min_pct': 0.022516008298121823, 'sideways_atr_max_pct': 0.14111312812161828, 'sideways_tp_mult': 1.2191121866712495, 'sideways_tsl_mult': 0.7230385120455791, 'sideways_time_stop': 176, 'sideways_use_sma': False, 'sideways_use_ema': True, 'sideways_use_atr': True, 'sideways_use_adx': True, 'sideways_use_spike': False, 'sideways_rsi_required': True}.
[I 2025-08-31 02:19:06,695] Trial 453 finished with values: [-1000000000.0, 1000000000.0] and parameters: {'p_sma': 57, 'p_std': 39, 'p_atr': 22, 'p_adx': 19, 'rsi_period': 78, 'ema1': 5, 'ema2': 17, 'slip_atr_k': 0.0332054765590422, 'slip_spread_k': 0.20628469165284402, 'spread_hl_frac': 0.011331513210794808, 'bb_std_mult': 1.890352815248547, 'rsi_os': 46, 'rsi_ob': 74, 'vol_spike': 0.24330634682645175, 'adx_thresh': 7.618349037441252, 'atr_min_pct': 0.010584090709072085, 'atr_max_pct': 0.05917297483903562, 'tp_mult': 2.6359820838474137, 'tsl_mult': 0.7772764401688774, 'strategy': 'breakout', 'time_stop': 75, 'use_sma': False, 'use_atr': True, 'use_adx': True, 'use_ema': True, 'use_spike': False, 'rsi_required': True, 'edge_k': 1.3281209365790667, 'edge_cap': 0.8848349702203595, 'bull_strategy': 'breakout', 'bull_bb_std_mult': 2.845741823353957, 'bull_rsi_os': 41, 'bull_rsi_ob': 89, 'bull_adx_thresh': 14.939311460969208, 'bull_atr_min_pct': 0.0029144041250037927, 'bull_atr_max_pct': 0.07130662569397116, 'bull_tp_mult': 2.4225457333466034, 'bull_tsl_mult': 0.7522045855573205, 'bull_time_stop': 171, 'bull_use_sma': True, 'bull_use_ema': False, 'bull_use_atr': True, 'bull_use_adx': True, 'bull_use_spike': False, 'bull_rsi_required': False, 'bear_strategy': 'breakout', 'bear_bb_std_mult': 1.1427605237623768, 'bear_rsi_os': 21, 'bear_rsi_ob': 75, 'bear_adx_thresh': 8.17397146952332, 'bear_atr_min_pct': 0.015112270972054411, 'bear_atr_max_pct': 0.030973676056865955, 'bear_tp_mult': 1.4955613559951306, 'bear_tsl_mult': 0.6988816850683841, 'bear_time_stop': 29, 'bear_use_sma': True, 'bear_use_ema': False, 'bear_use_atr': False, 'bear_use_adx': True, 'bear_use_spike': True, 'bear_rsi_required': False, 'sideways_strategy': 'mean_reversion', 'sideways_bb_std_mult': 1.254431174544544, 'sideways_rsi_os': 49, 'sideways_rsi_ob': 90, 'sideways_adx_thresh': 13.417206087054636, 'sideways_atr_min_pct': 0.022270237785330542, 'sideways_atr_max_pct': 0.14662630945088798, 'sideways_tp_mult': 1.3877973461529898, 'sideways_tsl_mult': 0.7647840692781537, 'sideways_time_stop': 235, 'sideways_use_sma': True, 'sideways_use_ema': True, 'sideways_use_atr': True, 'sideways_use_adx': True, 'sideways_use_spike': True, 'sideways_rsi_required': False}.
[I 2025-08-31 02:19:39,180] Trial 457 finished with values: [-1000000000.0, 1000000000.0] and parameters: {'p_sma': 47, 'p_std': 42, 'p_atr': 22, 'p_adx': 7, 'rsi_period': 57, 'ema1': 12, 'ema2': 40, 'slip_atr_k': 0.07534129943131646, 'slip_spread_k': 0.2551197652171216, 'spread_hl_frac': 0.008336203097658949, 'bb_std_mult': 1.8446933519189503, 'rsi_os': 55, 'rsi_ob': 74, 'vol_spike': 0.06808539144279865, 'adx_thresh': 12.88917737005773, 'atr_min_pct': 0.016083796985010387, 'atr_max_pct': 0.054337499145824544, 'tp_mult': 2.6776238782606954, 'tsl_mult': 0.36508399060987345, 'strategy': 'breakout', 'time_stop': 5, 'use_sma': True, 'use_atr': False, 'use_adx': False, 'use_ema': True, 'use_spike': False, 'rsi_required': False, 'edge_k': 0.828667372215392, 'edge_cap': 0.997070853835973, 'bull_strategy': 'mean_reversion', 'bull_bb_std_mult': 2.763127958889471, 'bull_rsi_os': 36, 'bull_rsi_ob': 72, 'bull_adx_thresh': 12.336547913754726, 'bull_atr_min_pct': 0.007879501783535754, 'bull_atr_max_pct': 0.14545404382933158, 'bull_tp_mult': 2.681856103489672, 'bull_tsl_mult': 0.3784047555291743, 'bull_time_stop': 178, 'bull_use_sma': True, 'bull_use_ema': False, 'bull_use_atr': True, 'bull_use_adx': False, 'bull_use_spike': True, 'bull_rsi_required': True, 'bear_strategy': 'mean_reversion', 'bear_bb_std_mult': 2.1274868210433806, 'bear_rsi_os': 54, 'bear_rsi_ob': 55, 'bear_adx_thresh': 5.585418565434024, 'bear_atr_min_pct': 0.009492742807973758, 'bear_atr_max_pct': 0.010154744553445269, 'bear_tp_mult': 1.8780945601129821, 'bear_tsl_mult': 0.5718041565072735, 'bear_time_stop': 34, 'bear_use_sma': True, 'bear_use_ema': False, 'bear_use_atr': False, 'bear_use_adx': True, 'bear_use_spike': False, 'bear_rsi_required': False, 'sideways_strategy': 'mean_reversion', 'sideways_bb_std_mult': 1.0892712022460067, 'sideways_rsi_os': 53, 'sideways_rsi_ob': 93, 'sideways_adx_thresh': 33.32144413254707, 'sideways_atr_min_pct': 0.021307193012991513, 'sideways_atr_max_pct': 0.1374068728981962, 'sideways_tp_mult': 1.6530821530679796, 'sideways_tsl_mult': 0.6896687223888923, 'sideways_time_stop': 168, 'sideways_use_sma': True, 'sideways_use_ema': False, 'sideways_use_atr': False, 'sideways_use_adx': False, 'sideways_use_spike': True, 'sideways_rsi_required': False}.
[I 2025-08-31 02:19:39,192] Trial 455 finished with values: [-0.016260793904102733, 0.016166533228191] and parameters: {'p_sma': 31, 'p_std': 42, 'p_atr': 22, 'p_adx': 8, 'rsi_period': 54, 'ema1': 8, 'ema2': 37, 'slip_atr_k': 0.04276666353678846, 'slip_spread_k': 0.058736543338893776, 'spread_hl_frac': 0.00891523001484828, 'bb_std_mult': 1.826756997440116, 'rsi_os': 55, 'rsi_ob': 47, 'vol_spike': 0.28911035014180286, 'adx_thresh': 13.015415965458518, 'atr_min_pct': 0.006882385760303164, 'atr_max_pct': 0.07204957512243575, 'tp_mult': 2.4036202467316037, 'tsl_mult': 0.7894637265702986, 'strategy': 'breakout', 'time_stop': 99, 'use_sma': True, 'use_atr': False, 'use_adx': False, 'use_ema': True, 'use_spike': False, 'rsi_required': False, 'edge_k': 0.7843788512263175, 'edge_cap': 0.8849985901802642, 'bull_strategy': 'mean_reversion', 'bull_bb_std_mult': 2.835918351052005, 'bull_rsi_os': 55, 'bull_rsi_ob': 71, 'bull_adx_thresh': 12.339381735846993, 'bull_atr_min_pct': 0.0004674328265312271, 'bull_atr_max_pct': 0.14491948589776113, 'bull_tp_mult': 2.507684957564309, 'bull_tsl_mult': 0.7421846827997558, 'bull_time_stop': 180, 'bull_use_sma': True, 'bull_use_ema': False, 'bull_use_atr': True, 'bull_use_adx': False, 'bull_use_spike': True, 'bull_rsi_required': False, 'bear_strategy': 'mean_reversion', 'bear_bb_std_mult': 2.814263933653851, 'bear_rsi_os': 22, 'bear_rsi_ob': 83, 'bear_adx_thresh': 15.86392327959005, 'bear_atr_min_pct': 0.009158729391389434, 'bear_atr_max_pct': 0.03154350594447703, 'bear_tp_mult': 1.8713288496930898, 'bear_tsl_mult': 0.5794738539458124, 'bear_time_stop': 33, 'bear_use_sma': True, 'bear_use_ema': False, 'bear_use_atr': False, 'bear_use_adx': True, 'bear_use_spike': False, 'bear_rsi_required': False, 'sideways_strategy': 'mean_reversion', 'sideways_bb_std_mult': 1.5313743360583278, 'sideways_rsi_os': 50, 'sideways_rsi_ob': 90, 'sideways_adx_thresh': 33.2768613754602, 'sideways_atr_min_pct': 0.021598079365337603, 'sideways_atr_max_pct': 0.14281962753435717, 'sideways_tp_mult': 1.0455271891525035, 'sideways_tsl_mult': 0.6937630390111453, 'sideways_time_stop': 194, 'sideways_use_sma': True, 'sideways_use_ema': False, 'sideways_use_atr': False, 'sideways_use_adx': False, 'sideways_use_spike': True, 'sideways_rsi_required': False}.
[I 2025-08-31 02:19:39,338] Trial 456 finished with values: [-1000000000.0, 1000000000.0] and parameters: {'p_sma': 6, 'p_std': 40, 'p_atr': 22, 'p_adx': 7, 'rsi_period': 57, 'ema1': 12, 'ema2': 26, 'slip_atr_k': 0.16997546418058782, 'slip_spread_k': 0.21427144288661695, 'spread_hl_frac': 0.03255968709759826, 'bb_std_mult': 1.8185900810118236, 'rsi_os': 55, 'rsi_ob': 74, 'vol_spike': 0.036989275570320335, 'adx_thresh': 13.472707788406197, 'atr_min_pct': 0.00889140479048444, 'atr_max_pct': 0.05823776888697594, 'tp_mult': 1.1052921299702776, 'tsl_mult': 0.888042370683384, 'strategy': 'breakout', 'time_stop': 147, 'use_sma': True, 'use_atr': False, 'use_adx': False, 'use_ema': True, 'use_spike': False, 'rsi_required': False, 'edge_k': 0.7915705942384705, 'edge_cap': 0.8872332777960225, 'bull_strategy': 'mean_reversion', 'bull_bb_std_mult': 2.9389742046329346, 'bull_rsi_os': 43, 'bull_rsi_ob': 71, 'bull_adx_thresh': 20.477904159112498, 'bull_atr_min_pct': 0.022926153753596697, 'bull_atr_max_pct': 0.07154072819968275, 'bull_tp_mult': 2.4056519050810516, 'bull_tsl_mult': 0.3657531484927836, 'bull_time_stop': 178, 'bull_use_sma': True, 'bull_use_ema': False, 'bull_use_atr': True, 'bull_use_adx': False, 'bull_use_spike': True, 'bull_rsi_required': False, 'bear_strategy': 'mean_reversion', 'bear_bb_std_mult': 1.3213767909538296, 'bear_rsi_os': 25, 'bear_rsi_ob': 86, 'bear_adx_thresh': 8.191542975092807, 'bear_atr_min_pct': 0.02423484090806019, 'bear_atr_max_pct': 0.029302216205573658, 'bear_tp_mult': 1.5086172186080693, 'bear_tsl_mult': 0.679963129593581, 'bear_time_stop': 36, 'bear_use_sma': True, 'bear_use_ema': False, 'bear_use_atr': False, 'bear_use_adx': True, 'bear_use_spike': False, 'bear_rsi_required': False, 'sideways_strategy': 'mean_reversion', 'sideways_bb_std_mult': 1.0797023469084588, 'sideways_rsi_os': 45, 'sideways_rsi_ob': 86, 'sideways_adx_thresh': 13.534420977416495, 'sideways_atr_min_pct': 0.021340063391302958, 'sideways_atr_max_pct': 0.14125685274225983, 'sideways_tp_mult': 1.6613284817166585, 'sideways_tsl_mult': 0.7605047198843696, 'sideways_time_stop': 170, 'sideways_use_sma': True, 'sideways_use_ema': False, 'sideways_use_atr': False, 'sideways_use_adx': False, 'sideways_use_spike': True, 'sideways_rsi_required': False}.
[I 2025-08-31 02:19:39,463] Trial 454 finished with values: [-1000000000.0, 1000000000.0] and parameters: {'p_sma': 47, 'p_std': 40, 'p_atr': 22, 'p_adx': 8, 'rsi_period': 57, 'ema1': 8, 'ema2': 16, 'slip_atr_k': 0.1473544959277795, 'slip_spread_k': 0.5158679512133749, 'spread_hl_frac': 0.011473697891754937, 'bb_std_mult': 2.001987506597937, 'rsi_os': 45, 'rsi_ob': 74, 'vol_spike': 0.2121897262218749, 'adx_thresh': 12.891312749092567, 'atr_min_pct': 0.008836963603489742, 'atr_max_pct': 0.0725887794916857, 'tp_mult': 2.4854372041510877, 'tsl_mult': 0.11334028159608979, 'strategy': 'breakout', 'time_stop': 99, 'use_sma': True, 'use_atr': False, 'use_adx': False, 'use_ema': True, 'use_spike': False, 'rsi_required': False, 'edge_k': 0.8280606934562317, 'edge_cap': 0.06146462949502968, 'bull_strategy': 'mean_reversion', 'bull_bb_std_mult': 2.80004700924528, 'bull_rsi_os': 39, 'bull_rsi_ob': 88, 'bull_adx_thresh': 20.393626565881082, 'bull_atr_min_pct': 0.009773459484196608, 'bull_atr_max_pct': 0.07065594093418898, 'bull_tp_mult': 1.722112491338552, 'bull_tsl_mult': 0.12128522318017701, 'bull_time_stop': 68, 'bull_use_sma': True, 'bull_use_ema': True, 'bull_use_atr': True, 'bull_use_adx': False, 'bull_use_spike': True, 'bull_rsi_required': False, 'bear_strategy': 'mean_reversion', 'bear_bb_std_mult': 1.1198934851650928, 'bear_rsi_os': 12, 'bear_rsi_ob': 82, 'bear_adx_thresh': 21.811089529485816, 'bear_atr_min_pct': 0.021173589603960482, 'bear_atr_max_pct': 0.030443956756958546, 'bear_tp_mult': 1.8834963594859964, 'bear_tsl_mult': 0.6827120330849693, 'bear_time_stop': 26, 'bear_use_sma': True, 'bear_use_ema': False, 'bear_use_atr': False, 'bear_use_adx': True, 'bear_use_spike': False, 'bear_rsi_required': False, 'sideways_strategy': 'mean_reversion', 'sideways_bb_std_mult': 1.0947875858527858, 'sideways_rsi_os': 9, 'sideways_rsi_ob': 90, 'sideways_adx_thresh': 32.532136010609925, 'sideways_atr_min_pct': 0.006189197161380177, 'sideways_atr_max_pct': 0.14008605927785375, 'sideways_tp_mult': 2.257286718976375, 'sideways_tsl_mult': 0.07344312912946765, 'sideways_time_stop': 176, 'sideways_use_sma': True, 'sideways_use_ema': False, 'sideways_use_atr': False, 'sideways_use_adx': False, 'sideways_use_spike': True, 'sideways_rsi_required': False}.
[I 2025-08-31 02:20:11,576] Trial 459 finished with values: [-1000000000.0, 1000000000.0] and parameters: {'p_sma': 50, 'p_std': 40, 'p_atr': 21, 'p_adx': 18, 'rsi_period': 42, 'ema1': 8, 'ema2': 52, 'slip_atr_k': 0.0414486257028176, 'slip_spread_k': 0.23864357820701623, 'spread_hl_frac': 0.0038268196478663703, 'bb_std_mult': 1.8289952160256713, 'rsi_os': 35, 'rsi_ob': 79, 'vol_spike': 0.03772097471334447, 'adx_thresh': 12.19219019819132, 'atr_min_pct': 0.00882869121313461, 'atr_max_pct': 0.13422281326535726, 'tp_mult': 1.5607872179797067, 'tsl_mult': 0.495014219905527, 'strategy': 'breakout', 'time_stop': 82, 'use_sma': True, 'use_atr': False, 'use_adx': False, 'use_ema': True, 'use_spike': False, 'rsi_required': False, 'edge_k': 0.7927205935443441, 'edge_cap': 0.05180975751950395, 'bull_strategy': 'mean_reversion', 'bull_bb_std_mult': 2.9518299418138585, 'bull_rsi_os': 11, 'bull_rsi_ob': 71, 'bull_adx_thresh': 20.547608840923385, 'bull_atr_min_pct': 0.027123824206694486, 'bull_atr_max_pct': 0.04398001534968416, 'bull_tp_mult': 1.5451180353871514, 'bull_tsl_mult': 0.12089058015266424, 'bull_time_stop': 131, 'bull_use_sma': False, 'bull_use_ema': False, 'bull_use_atr': True, 'bull_use_adx': False, 'bull_use_spike': True, 'bull_rsi_required': False, 'bear_strategy': 'mean_reversion', 'bear_bb_std_mult': 1.3297784044657583, 'bear_rsi_os': 26, 'bear_rsi_ob': 82, 'bear_adx_thresh': 8.972410433647001, 'bear_atr_min_pct': 0.029961960650507824, 'bear_atr_max_pct': 0.028513682240359918, 'bear_tp_mult': 1.844508890436372, 'bear_tsl_mult': 0.361527648951671, 'bear_time_stop': 273, 'bear_use_sma': True, 'bear_use_ema': False, 'bear_use_atr': False, 'bear_use_adx': True, 'bear_use_spike': False, 'bear_rsi_required': False, 'sideways_strategy': 'mean_reversion', 'sideways_bb_std_mult': 1.1211608110256248, 'sideways_rsi_os': 44, 'sideways_rsi_ob': 63, 'sideways_adx_thresh': 11.009455087769904, 'sideways_atr_min_pct': 0.005904795352754472, 'sideways_atr_max_pct': 0.13217356825850748, 'sideways_tp_mult': 1.0589127719983833, 'sideways_tsl_mult': 0.7499465392677513, 'sideways_time_stop': 197, 'sideways_use_sma': True, 'sideways_use_ema': False, 'sideways_use_atr': False, 'sideways_use_adx': False, 'sideways_use_spike': True, 'sideways_rsi_required': False}.
