[I 2025-08-31 02:45:30,156] Trial 640 finished with values: [-1000000000.0, 1000000000.0] and parameters: {'p_sma': 53, 'p_std': 50, 'p_atr': 28, 'p_adx': 14, 'rsi_period': 71, 'ema1': 14, 'ema2': 48, 'slip_atr_k': 0.0535777986061399, 'slip_spread_k': 0.40772645733507634, 'spread_hl_frac': 0.027434081340175352, 'bb_std_mult': 1.4253781943637533, 'rsi_os': 38, 'rsi_ob': 67, 'vol_spike': 0.20467185909483263, 'adx_thresh': 32.024065282172636, 'atr_min_pct': 0.028668542334909793, 'atr_max_pct': 0.11854003743614137, 'tp_mult': 2.3063403867057284, 'tsl_mult': 0.432753542185134, 'strategy': 'mean_reversion', 'time_stop': 224, 'use_sma': True, 'use_atr': True, 'use_adx': False, 'use_ema': False, 'use_spike': True, 'rsi_required': True, 'edge_k': 1.754583147776414, 'edge_cap': 0.2826927702380643, 'bull_strategy': 'mean_reversion', 'bull_bb_std_mult': 2.551632433438127, 'bull_rsi_os': 7, 'bull_rsi_ob': 59, 'bull_adx_thresh': 27.09491554905862, 'bull_atr_min_pct': 0.01768108838074497, 'bull_atr_max_pct': 0.14254527230874245, 'bull_tp_mult': 2.3659392636298238, 'bull_tsl_mult': 0.4853029181777696, 'bull_time_stop': 91, 'bull_use_sma': True, 'bull_use_ema': False, 'bull_use_atr': False, 'bull_use_adx': False, 'bull_use_spike': True, 'bull_rsi_required': True, 'bear_strategy': 'mean_reversion', 'bear_bb_std_mult': 1.905467669879251, 'bear_rsi_os': 15, 'bear_rsi_ob': 68, 'bear_adx_thresh': 22.495330468452632, 'bear_atr_min_pct': 0.006667819065110124, 'bear_atr_max_pct': 0.1131007373079328, 'bear_tp_mult': 1.2883859616900875, 'bear_tsl_mult': 0.10627478250067296, 'bear_time_stop': 287, 'bear_use_sma': False, 'bear_use_ema': True, 'bear_use_atr': False, 'bear_use_adx': True, 'bear_use_spike': False, 'bear_rsi_required': True, 'sideways_strategy': 'breakout', 'sideways_bb_std_mult': 0.601527812009742, 'sideways_rsi_os': 41, 'sideways_rsi_ob': 95, 'sideways_adx_thresh': 34.98297198851838, 'sideways_atr_min_pct': 0.008149619825120946, 'sideways_atr_max_pct': 0.06055108240970699, 'sideways_tp_mult': 1.6092259935504036, 'sideways_tsl_mult': 0.9528344242881224, 'sideways_time_stop': 253, 'sideways_use_sma': False, 'sideways_use_ema': False, 'sideways_use_atr': False, 'sideways_use_adx': False, 'sideways_use_spike': True, 'sideways_rsi_required': False}.
[I 2025-08-31 02:45:30,157] Trial 638 finished with values: [-1000000000.0, 1000000000.0] and parameters: {'p_sma': 56, 'p_std': 26, 'p_atr': 27, 'p_adx': 16, 'rsi_period': 71, 'ema1': 6, 'ema2': 35, 'slip_atr_k': 0.21158712292563991, 'slip_spread_k': 0.7601204455888755, 'spread_hl_frac': 0.0033912581943893573, 'bb_std_mult': 1.6582598129769321, 'rsi_os': 37, 'rsi_ob': 60, 'vol_spike': 0.20589872350080968, 'adx_thresh': 20.851522306187356, 'atr_min_pct': 0.009389460157353, 'atr_max_pct': 0.11732497021465853, 'tp_mult': 2.3193283885644442, 'tsl_mult': 0.4308725863042309, 'strategy': 'mean_reversion', 'time_stop': 136, 'use_sma': True, 'use_atr': False, 'use_adx': False, 'use_ema': False, 'use_spike': False, 'rsi_required': True, 'edge_k': 0.515020599090934, 'edge_cap': 0.30775486711003786, 'bull_strategy': 'mean_reversion', 'bull_bb_std_mult': 0.6390299750984698, 'bull_rsi_os': 26, 'bull_rsi_ob': 65, 'bull_adx_thresh': 25.899840687393947, 'bull_atr_min_pct': 0.01691696210608604, 'bull_atr_max_pct': 0.1413539533885914, 'bull_tp_mult': 2.2709368892996538, 'bull_tsl_mult': 0.7560268395650324, 'bull_time_stop': 84, 'bull_use_sma': True, 'bull_use_ema': False, 'bull_use_atr': False, 'bull_use_adx': True, 'bull_use_spike': True, 'bull_rsi_required': True, 'bear_strategy': 'mean_reversion', 'bear_bb_std_mult': 1.3509686061907298, 'bear_rsi_os': 15, 'bear_rsi_ob': 49, 'bear_adx_thresh': 6.047688361221351, 'bear_atr_min_pct': 0.004908104827852897, 'bear_atr_max_pct': 0.11367648409671086, 'bear_tp_mult': 2.089281959172873, 'bear_tsl_mult': 0.5061239417829044, 'bear_time_stop': 290, 'bear_use_sma': False, 'bear_use_ema': False, 'bear_use_atr': False, 'bear_use_adx': True, 'bear_use_spike': True, 'bear_rsi_required': True, 'sideways_strategy': 'breakout', 'sideways_bb_std_mult': 2.4913424308289986, 'sideways_rsi_os': 41, 'sideways_rsi_ob': 93, 'sideways_adx_thresh': 30.60041997564796, 'sideways_atr_min_pct': 0.02776904442415552, 'sideways_atr_max_pct': 0.010228243486236716, 'sideways_tp_mult': 1.6610177923835971, 'sideways_tsl_mult': 0.17206907403423166, 'sideways_time_stop': 210, 'sideways_use_sma': True, 'sideways_use_ema': False, 'sideways_use_atr': False, 'sideways_use_adx': False, 'sideways_use_spike': True, 'sideways_rsi_required': False}.
[I 2025-08-31 02:45:30,269] Trial 639 finished with values: [-1000000000.0, 1000000000.0] and parameters: {'p_sma': 55, 'p_std': 27, 'p_atr': 9, 'p_adx': 23, 'rsi_period': 71, 'ema1': 28, 'ema2': 35, 'slip_atr_k': 0.10772061928766019, 'slip_spread_k': 0.16037915830072594, 'spread_hl_frac': 0.029805056449966044, 'bb_std_mult': 0.9086452501765727, 'rsi_os': 38, 'rsi_ob': 65, 'vol_spike': 0.2828573339727784, 'adx_thresh': 20.714907780282232, 'atr_min_pct': 0.009210288244596777, 'atr_max_pct': 0.11739601717934921, 'tp_mult': 1.6826607131510674, 'tsl_mult': 0.5528330343291354, 'strategy': 'mean_reversion', 'time_stop': 133, 'use_sma': True, 'use_atr': True, 'use_adx': False, 'use_ema': False, 'use_spike': False, 'rsi_required': True, 'edge_k': 1.7548197515942623, 'edge_cap': 0.30657191711271886, 'bull_strategy': 'mean_reversion', 'bull_bb_std_mult': 2.557530126913763, 'bull_rsi_os': 11, 'bull_rsi_ob': 89, 'bull_adx_thresh': 24.872661424947264, 'bull_atr_min_pct': 0.017976816849017325, 'bull_atr_max_pct': 0.14088944510099602, 'bull_tp_mult': 2.050253707981711, 'bull_tsl_mult': 0.26743285555617413, 'bull_time_stop': 134, 'bull_use_sma': True, 'bull_use_ema': False, 'bull_use_atr': False, 'bull_use_adx': True, 'bull_use_spike': True, 'bull_rsi_required': True, 'bear_strategy': 'mean_reversion', 'bear_bb_std_mult': 1.6685742336133969, 'bear_rsi_os': 18, 'bear_rsi_ob': 68, 'bear_adx_thresh': 27.25502940724229, 'bear_atr_min_pct': 0.0067458623867850094, 'bear_atr_max_pct': 0.11174076573022207, 'bear_tp_mult': 2.108427728973881, 'bear_tsl_mult': 0.5165909139770295, 'bear_time_stop': 10, 'bear_use_sma': False, 'bear_use_ema': False, 'bear_use_atr': False, 'bear_use_adx': True, 'bear_use_spike': False, 'bear_rsi_required': True, 'sideways_strategy': 'breakout', 'sideways_bb_std_mult': 2.491422244699323, 'sideways_rsi_os': 53, 'sideways_rsi_ob': 55, 'sideways_adx_thresh': 8.752104685727442, 'sideways_atr_min_pct': 0.027872011784264683, 'sideways_atr_max_pct': 0.04199927638884552, 'sideways_tp_mult': 1.622224038872928, 'sideways_tsl_mult': 0.44438592613041494, 'sideways_time_stop': 43, 'sideways_use_sma': False, 'sideways_use_ema': False, 'sideways_use_atr': False, 'sideways_use_adx': False, 'sideways_use_spike': True, 'sideways_rsi_required': False}.
[I 2025-08-31 02:46:04,159] Trial 643 finished with values: [-1000000000.0, 1000000000.0] and parameters: {'p_sma': 52, 'p_std': 55, 'p_atr': 26, 'p_adx': 21, 'rsi_period': 77, 'ema1': 18, 'ema2': 41, 'slip_atr_k': 0.13120427241692445, 'slip_spread_k': 0.18750173005022436, 'spread_hl_frac': 0.002098119737849357, 'bb_std_mult': 1.6111836893538705, 'rsi_os': 16, 'rsi_ob': 69, 'vol_spike': 0.2682469225392275, 'adx_thresh': 18.73856637704596, 'atr_min_pct': 0.0063012922040242905, 'atr_max_pct': 0.11351103280952697, 'tp_mult': 1.9729430197234263, 'tsl_mult': 0.35057433270439026, 'strategy': 'mean_reversion', 'time_stop': 118, 'use_sma': False, 'use_atr': False, 'use_adx': True, 'use_ema': False, 'use_spike': False, 'rsi_required': True, 'edge_k': 1.1476199829688498, 'edge_cap': 0.11287424139652175, 'bull_strategy': 'breakout', 'bull_bb_std_mult': 2.0526763211592196, 'bull_rsi_os': 50, 'bull_rsi_ob': 51, 'bull_adx_thresh': 29.098639581706106, 'bull_atr_min_pct': 0.005816439806682918, 'bull_atr_max_pct': 0.10132410265796447, 'bull_tp_mult': 1.5805803863278287, 'bull_tsl_mult': 0.23236765668458495, 'bull_time_stop': 280, 'bull_use_sma': True, 'bull_use_ema': False, 'bull_use_atr': False, 'bull_use_adx': True, 'bull_use_spike': True, 'bull_rsi_required': True, 'bear_strategy': 'breakout', 'bear_bb_std_mult': 3.20906064929294, 'bear_rsi_os': 16, 'bear_rsi_ob': 47, 'bear_adx_thresh': 6.325599444371607, 'bear_atr_min_pct': 0.01964259863190875, 'bear_atr_max_pct': 0.01425463805934804, 'bear_tp_mult': 2.794948659506657, 'bear_tsl_mult': 0.5528344640088837, 'bear_time_stop': 128, 'bear_use_sma': False, 'bear_use_ema': False, 'bear_use_atr': True, 'bear_use_adx': False, 'bear_use_spike': False, 'bear_rsi_required': True, 'sideways_strategy': 'breakout', 'sideways_bb_std_mult': 0.5039191891921477, 'sideways_rsi_os': 37, 'sideways_rsi_ob': 94, 'sideways_adx_thresh': 9.592919492797831, 'sideways_atr_min_pct': 0.026445562875519784, 'sideways_atr_max_pct': 0.10420247015584287, 'sideways_tp_mult': 1.7260797244285435, 'sideways_tsl_mult': 0.6426596794488231, 'sideways_time_stop': 205, 'sideways_use_sma': True, 'sideways_use_ema': True, 'sideways_use_atr': False, 'sideways_use_adx': True, 'sideways_use_spike': False, 'sideways_rsi_required': False}.
[I 2025-08-31 02:46:04,583] Trial 644 finished with values: [-1000000000.0, 1000000000.0] and parameters: {'p_sma': 17, 'p_std': 31, 'p_atr': 28, 'p_adx': 28, 'rsi_period': 73, 'ema1': 18, 'ema2': 25, 'slip_atr_k': 0.2276165462003314, 'slip_spread_k': 0.515539216564886, 'spread_hl_frac': 0.005163324270155142, 'bb_std_mult': 1.6687613296578727, 'rsi_os': 16, 'rsi_ob': 69, 'vol_spike': 0.1812607212319463, 'adx_thresh': 18.692331600986964, 'atr_min_pct': 0.008393231925976638, 'atr_max_pct': 0.11312864085623076, 'tp_mult': 1.9536723237281977, 'tsl_mult': 0.86674162692738, 'strategy': 'mean_reversion', 'time_stop': 97, 'use_sma': False, 'use_atr': False, 'use_adx': True, 'use_ema': False, 'use_spike': False, 'rsi_required': True, 'edge_k': 1.142949893066621, 'edge_cap': 0.11088765972283007, 'bull_strategy': 'breakout', 'bull_bb_std_mult': 1.5410082442560333, 'bull_rsi_os': 23, 'bull_rsi_ob': 87, 'bull_adx_thresh': 31.445048336776242, 'bull_atr_min_pct': 0.025931035370283472, 'bull_atr_max_pct': 0.14543746562531704, 'bull_tp_mult': 1.5888652954037352, 'bull_tsl_mult': 0.23558026179170916, 'bull_time_stop': 104, 'bull_use_sma': True, 'bull_use_ema': False, 'bull_use_atr': False, 'bull_use_adx': True, 'bull_use_spike': True, 'bull_rsi_required': True, 'bear_strategy': 'breakout', 'bear_bb_std_mult': 2.7461847093158194, 'bear_rsi_os': 19, 'bear_rsi_ob': 46, 'bear_adx_thresh': 5.053764054405567, 'bear_atr_min_pct': 0.00569414810150785, 'bear_atr_max_pct': 0.01424852166195312, 'bear_tp_mult': 2.0270807559333788, 'bear_tsl_mult': 0.5559257653634836, 'bear_time_stop': 11, 'bear_use_sma': False, 'bear_use_ema': False, 'bear_use_atr': True, 'bear_use_adx': False, 'bear_use_spike': False, 'bear_rsi_required': True, 'sideways_strategy': 'breakout', 'sideways_bb_std_mult': 0.6782101968231292, 'sideways_rsi_os': 25, 'sideways_rsi_ob': 62, 'sideways_adx_thresh': 9.338979115132512, 'sideways_atr_min_pct': 0.006722371295090748, 'sideways_atr_max_pct': 0.04920858466402663, 'sideways_tp_mult': 1.7144444207625904, 'sideways_tsl_mult': 0.6479651991024603, 'sideways_time_stop': 203, 'sideways_use_sma': True, 'sideways_use_ema': True, 'sideways_use_atr': False, 'sideways_use_adx': True, 'sideways_use_spike': False, 'sideways_rsi_required': False}.
[I 2025-08-31 02:46:04,610] Trial 642 finished with values: [-1000000000.0, 1000000000.0] and parameters: {'p_sma': 52, 'p_std': 53, 'p_atr': 9, 'p_adx': 21, 'rsi_period': 77, 'ema1': 28, 'ema2': 25, 'slip_atr_k': 0.2300658286635487, 'slip_spread_k': 0.1809762289231725, 'spread_hl_frac': 0.004887707066019234, 'bb_std_mult': 1.597789443591813, 'rsi_os': 16, 'rsi_ob': 65, 'vol_spike': 0.19513916209902646, 'adx_thresh': 19.640136567889687, 'atr_min_pct': 0.008177297001995812, 'atr_max_pct': 0.11367854816917422, 'tp_mult': 1.529739886729215, 'tsl_mult': 0.2622004696470853, 'strategy': 'mean_reversion', 'time_stop': 98, 'use_sma': True, 'use_atr': False, 'use_adx': True, 'use_ema': False, 'use_spike': False, 'rsi_required': True, 'edge_k': 1.1504611750861542, 'edge_cap': 0.09654484392664157, 'bull_strategy': 'breakout', 'bull_bb_std_mult': 2.077255422202215, 'bull_rsi_os': 50, 'bull_rsi_ob': 51, 'bull_adx_thresh': 31.585549743077173, 'bull_atr_min_pct': 0.006322180158761166, 'bull_atr_max_pct': 0.14487611577496837, 'bull_tp_mult': 1.8084675376379264, 'bull_tsl_mult': 0.04257276734427612, 'bull_time_stop': 281, 'bull_use_sma': True, 'bull_use_ema': False, 'bull_use_atr': False, 'bull_use_adx': True, 'bull_use_spike': True, 'bull_rsi_required': True, 'bear_strategy': 'mean_reversion', 'bear_bb_std_mult': 1.5335430811604216, 'bear_rsi_os': 44, 'bear_rsi_ob': 47, 'bear_adx_thresh': 34.429647423374206, 'bear_atr_min_pct': 0.007415652476661928, 'bear_atr_max_pct': 0.014786893594568922, 'bear_tp_mult': 2.037074505284907, 'bear_tsl_mult': 0.5516078228232353, 'bear_time_stop': 104, 'bear_use_sma': False, 'bear_use_ema': False, 'bear_use_atr': True, 'bear_use_adx': False, 'bear_use_spike': False, 'bear_rsi_required': True, 'sideways_strategy': 'breakout', 'sideways_bb_std_mult': 0.6805377737082056, 'sideways_rsi_os': 53, 'sideways_rsi_ob': 94, 'sideways_adx_thresh': 9.61800810289921, 'sideways_atr_min_pct': 0.026602409246660463, 'sideways_atr_max_pct': 0.03476175613097341, 'sideways_tp_mult': 1.6688775505241387, 'sideways_tsl_mult': 0.44165308888109345, 'sideways_time_stop': 44, 'sideways_use_sma': True, 'sideways_use_ema': True, 'sideways_use_atr': False, 'sideways_use_adx': True, 'sideways_use_spike': False, 'sideways_rsi_required': False}.
[I 2025-08-31 02:46:04,964] Trial 645 finished with values: [-0.024533381107826657, 0.02447922804093254] and parameters: {'p_sma': 52, 'p_std': 17, 'p_atr': 26, 'p_adx': 16, 'rsi_period': 77, 'ema1': 15, 'ema2': 25, 'slip_atr_k': 0.13250159201967446, 'slip_spread_k': 0.1878449783775994, 'spread_hl_frac': 0.03315761087811512, 'bb_std_mult': 1.6090796981533726, 'rsi_os': 10, 'rsi_ob': 57, 'vol_spike': 0.1932519006794769, 'adx_thresh': 19.113891708693114, 'atr_min_pct': 0.008386401115042196, 'atr_max_pct': 0.1256926461860399, 'tp_mult': 1.7435638518952494, 'tsl_mult': 0.48566172197531954, 'strategy': 'mean_reversion', 'time_stop': 101, 'use_sma': False, 'use_atr': False, 'use_adx': True, 'use_ema': False, 'use_spike': False, 'rsi_required': True, 'edge_k': 0.5767450800693081, 'edge_cap': 0.11877428454579114, 'bull_strategy': 'breakout', 'bull_bb_std_mult': 2.2292273800037554, 'bull_rsi_os': 42, 'bull_rsi_ob': 60, 'bull_adx_thresh': 5.932367147526663, 'bull_atr_min_pct': 0.005965268873124346, 'bull_atr_max_pct': 0.11900546802451809, 'bull_tp_mult': 1.584704744704398, 'bull_tsl_mult': 0.28334125937550403, 'bull_time_stop': 62, 'bull_use_sma': True, 'bull_use_ema': False, 'bull_use_atr': False, 'bull_use_adx': True, 'bull_use_spike': True, 'bull_rsi_required': True, 'bear_strategy': 'breakout', 'bear_bb_std_mult': 1.283402825004703, 'bear_rsi_os': 47, 'bear_rsi_ob': 47, 'bear_adx_thresh': 6.1102815300679145, 'bear_atr_min_pct': 0.005728373626405819, 'bear_atr_max_pct': 0.0136146906163096, 'bear_tp_mult': 2.0272489950024677, 'bear_tsl_mult': 0.5573262656645142, 'bear_time_stop': 129, 'bear_use_sma': False, 'bear_use_ema': False, 'bear_use_atr': True, 'bear_use_adx': False, 'bear_use_spike': False, 'bear_rsi_required': True, 'sideways_strategy': 'breakout', 'sideways_bb_std_mult': 2.0738836145065327, 'sideways_rsi_os': 38, 'sideways_rsi_ob': 62, 'sideways_adx_thresh': 9.361682501788803, 'sideways_atr_min_pct': 0.0005636222882295806, 'sideways_atr_max_pct': 0.07888197983897564, 'sideways_tp_mult': 2.988737903533435, 'sideways_tsl_mult': 0.6385174984996144, 'sideways_time_stop': 204, 'sideways_use_sma': True, 'sideways_use_ema': True, 'sideways_use_atr': False, 'sideways_use_adx': True, 'sideways_use_spike': False, 'sideways_rsi_required': False}.
[I 2025-08-31 02:46:39,439] Trial 648 finished with values: [-1000000000.0, 1000000000.0] and parameters: {'p_sma': 54, 'p_std': 17, 'p_atr': 28, 'p_adx': 19, 'rsi_period': 11, 'ema1': 21, 'ema2': 28, 'slip_atr_k': 0.01825352459370271, 'slip_spread_k': 0.12211418582782052, 'spread_hl_frac': 0.03318914831256232, 'bb_std_mult': 0.6501978166393874, 'rsi_os': 40, 'rsi_ob': 67, 'vol_spike': 0.18774153015426848, 'adx_thresh': 19.35051301238358, 'atr_min_pct': 0.007464891757327088, 'atr_max_pct': 0.136939439178151, 'tp_mult': 2.4201898810293865, 'tsl_mult': 0.31825421479266686, 'strategy': 'mean_reversion', 'time_stop': 51, 'use_sma': True, 'use_atr': False, 'use_adx': False, 'use_ema': False, 'use_spike': True, 'rsi_required': True, 'edge_k': 0.6453285693581705, 'edge_cap': 0.1264780424164162, 'bull_strategy': 'breakout', 'bull_bb_std_mult': 1.0995732625700656, 'bull_rsi_os': 42, 'bull_rsi_ob': 47, 'bull_adx_thresh': 6.117856899668482, 'bull_atr_min_pct': 0.021199624675730593, 'bull_atr_max_pct': 0.11951871117710258, 'bull_tp_mult': 2.1763950707315103, 'bull_tsl_mult': 0.2820836625867358, 'bull_time_stop': 124, 'bull_use_sma': True, 'bull_use_ema': False, 'bull_use_atr': False, 'bull_use_adx': False, 'bull_use_spike': True, 'bull_rsi_required': True, 'bear_strategy': 'mean_reversion', 'bear_bb_std_mult': 1.2916148121657587, 'bear_rsi_os': 18, 'bear_rsi_ob': 45, 'bear_adx_thresh': 5.602608026091415, 'bear_atr_min_pct': 0.006145286248328252, 'bear_atr_max_pct': 0.012620378521751381, 'bear_tp_mult': 2.5141629446850926, 'bear_tsl_mult': 0.5742626877476914, 'bear_time_stop': 10, 'bear_use_sma': False, 'bear_use_ema': True, 'bear_use_atr': False, 'bear_use_adx': True, 'bear_use_spike': True, 'bear_rsi_required': True, 'sideways_strategy': 'breakout', 'sideways_bb_std_mult': 0.5627490976588455, 'sideways_rsi_os': 39, 'sideways_rsi_ob': 70, 'sideways_adx_thresh': 31.774495097607296, 'sideways_atr_min_pct': 0.017195614568005703, 'sideways_atr_max_pct': 0.05125755805395453, 'sideways_tp_mult': 2.338038315537334, 'sideways_tsl_mult': 0.9903802854112027, 'sideways_time_stop': 192, 'sideways_use_sma': True, 'sideways_use_ema': False, 'sideways_use_atr': True, 'sideways_use_adx': False, 'sideways_use_spike': True, 'sideways_rsi_required': False}.
[I 2025-08-31 02:46:39,878] Trial 647 finished with values: [-1000000000.0, 1000000000.0] and parameters: {'p_sma': 21, 'p_std': 18, 'p_atr': 7, 'p_adx': 19, 'rsi_period': 20, 'ema1': 6, 'ema2': 13, 'slip_atr_k': 0.10059565437525492, 'slip_spread_k': 0.6563332424273739, 'spread_hl_frac': 0.044633777882956624, 'bb_std_mult': 0.7897438702227424, 'rsi_os': 40, 'rsi_ob': 67, 'vol_spike': 0.24438178895539636, 'adx_thresh': 19.849976022558298, 'atr_min_pct': 0.007638279682809615, 'atr_max_pct': 0.12261564626129394, 'tp_mult': 1.8049049774959072, 'tsl_mult': 0.5005320890168359, 'strategy': 'mean_reversion', 'time_stop': 125, 'use_sma': True, 'use_atr': False, 'use_adx': False, 'use_ema': False, 'use_spike': True, 'rsi_required': True, 'edge_k': 0.6423575777939702, 'edge_cap': 0.1296992274959139, 'bull_strategy': 'breakout', 'bull_bb_std_mult': 2.218633742103483, 'bull_rsi_os': 43, 'bull_rsi_ob': 60, 'bull_adx_thresh': 6.166625498291893, 'bull_atr_min_pct': 0.011798078538291248, 'bull_atr_max_pct': 0.13886299877014796, 'bull_tp_mult': 2.3232302250410664, 'bull_tsl_mult': 0.8245991657832634, 'bull_time_stop': 126, 'bull_use_sma': True, 'bull_use_ema': False, 'bull_use_atr': False, 'bull_use_adx': False, 'bull_use_spike': True, 'bull_rsi_required': True, 'bear_strategy': 'mean_reversion', 'bear_bb_std_mult': 1.8325616972701273, 'bear_rsi_os': 18, 'bear_rsi_ob': 45, 'bear_adx_thresh': 5.013268800343774, 'bear_atr_min_pct': 0.014896378812420112, 'bear_atr_max_pct': 0.12046566059100988, 'bear_tp_mult': 2.1173598467595323, 'bear_tsl_mult': 0.5723460812832292, 'bear_time_stop': 5, 'bear_use_sma': False, 'bear_use_ema': True, 'bear_use_atr': False, 'bear_use_adx': True, 'bear_use_spike': True, 'bear_rsi_required': True, 'sideways_strategy': 'breakout', 'sideways_bb_std_mult': 0.5002019079510296, 'sideways_rsi_os': 55, 'sideways_rsi_ob': 46, 'sideways_adx_thresh': 19.73515967666202, 'sideways_atr_min_pct': 0.02687039953502606, 'sideways_atr_max_pct': 0.05183657695813411, 'sideways_tp_mult': 1.4297579434007013, 'sideways_tsl_mult': 0.059919831538691015, 'sideways_time_stop': 117, 'sideways_use_sma': True, 'sideways_use_ema': False, 'sideways_use_atr': True, 'sideways_use_adx': False, 'sideways_use_spike': True, 'sideways_rsi_required': False}.
