[I 2025-08-31 02:43:05,808] Trial 621 finished with values: [-1000000000.0, 1000000000.0] and parameters: {'p_sma': 12, 'p_std': 51, 'p_atr': 30, 'p_adx': 13, 'rsi_period': 71, 'ema1': 23, 'ema2': 58, 'slip_atr_k': 0.11887754358991949, 'slip_spread_k': 0.11307386603205619, 'spread_hl_frac': 0.04987660024335825, 'bb_std_mult': 3.2505795435662903, 'rsi_os': 12, 'rsi_ob': 67, 'vol_spike': 0.18779869913389016, 'adx_thresh': 18.948078945777088, 'atr_min_pct': 0.0087366085196162, 'atr_max_pct': 0.09092110164928974, 'tp_mult': 2.8453911891993746, 'tsl_mult': 0.6571190228834589, 'strategy': 'mean_reversion', 'time_stop': 279, 'use_sma': True, 'use_atr': True, 'use_adx': False, 'use_ema': False, 'use_spike': True, 'rsi_required': True, 'edge_k': 0.6317061250306594, 'edge_cap': 0.08006336223931909, 'bull_strategy': 'mean_reversion', 'bull_bb_std_mult': 2.274132368732721, 'bull_rsi_os': 44, 'bull_rsi_ob': 65, 'bull_adx_thresh': 7.340399129530829, 'bull_atr_min_pct': 0.026612801669929916, 'bull_atr_max_pct': 0.13729257996278083, 'bull_tp_mult': 2.2987457414038284, 'bull_tsl_mult': 0.28033718418208625, 'bull_time_stop': 257, 'bull_use_sma': True, 'bull_use_ema': False, 'bull_use_atr': False, 'bull_use_adx': True, 'bull_use_spike': True, 'bull_rsi_required': True, 'bear_strategy': 'mean_reversion', 'bear_bb_std_mult': 2.259832294280177, 'bear_rsi_os': 32, 'bear_rsi_ob': 71, 'bear_adx_thresh': 5.671312924887401, 'bear_atr_min_pct': 0.006845423456450286, 'bear_atr_max_pct': 0.010207960131322835, 'bear_tp_mult': 1.1945223035545358, 'bear_tsl_mult': 0.3868012629107794, 'bear_time_stop': 150, 'bear_use_sma': False, 'bear_use_ema': True, 'bear_use_atr': False, 'bear_use_adx': True, 'bear_use_spike': True, 'bear_rsi_required': True, 'sideways_strategy': 'breakout', 'sideways_bb_std_mult': 1.7310834571046072, 'sideways_rsi_os': 30, 'sideways_rsi_ob': 47, 'sideways_adx_thresh': 7.802700906774307, 'sideways_atr_min_pct': 0.028666884438183535, 'sideways_atr_max_pct': 0.04750850397017384, 'sideways_tp_mult': 2.279374943479245, 'sideways_tsl_mult': 0.15293833992393668, 'sideways_time_stop': 261, 'sideways_use_sma': False, 'sideways_use_ema': False, 'sideways_use_atr': False, 'sideways_use_adx': False, 'sideways_use_spike': True, 'sideways_rsi_required': False}.
[I 2025-08-31 02:43:06,612] Trial 622 finished with values: [-1000000000.0, 1000000000.0] and parameters: {'p_sma': 53, 'p_std': 47, 'p_atr': 26, 'p_adx': 13, 'rsi_period': 73, 'ema1': 19, 'ema2': 30, 'slip_atr_k': 0.11423072763698291, 'slip_spread_k': 0.19625016675263549, 'spread_hl_frac': 0.0017799596773777062, 'bb_std_mult': 0.7267329089802981, 'rsi_os': 12, 'rsi_ob': 68, 'vol_spike': 0.1771310199161694, 'adx_thresh': 32.63911819527042, 'atr_min_pct': 0.008007750245834252, 'atr_max_pct': 0.12360986630924005, 'tp_mult': 1.9940825302776508, 'tsl_mult': 0.3578915481717504, 'strategy': 'mean_reversion', 'time_stop': 259, 'use_sma': True, 'use_atr': True, 'use_adx': False, 'use_ema': False, 'use_spike': True, 'rsi_required': True, 'edge_k': 0.6291245218408732, 'edge_cap': 0.09547977928081539, 'bull_strategy': 'mean_reversion', 'bull_bb_std_mult': 1.6769211828915611, 'bull_rsi_os': 49, 'bull_rsi_ob': 62, 'bull_adx_thresh': 33.88926763900254, 'bull_atr_min_pct': 0.00832769084024279, 'bull_atr_max_pct': 0.1371773838998583, 'bull_tp_mult': 1.9327283256924066, 'bull_tsl_mult': 0.5084830463236817, 'bull_time_stop': 50, 'bull_use_sma': True, 'bull_use_ema': False, 'bull_use_atr': False, 'bull_use_adx': True, 'bull_use_spike': True, 'bull_rsi_required': True, 'bear_strategy': 'mean_reversion', 'bear_bb_std_mult': 2.261533305219784, 'bear_rsi_os': 16, 'bear_rsi_ob': 71, 'bear_adx_thresh': 5.7338625358476865, 'bear_atr_min_pct': 0.02425342587969315, 'bear_atr_max_pct': 0.010025969636941544, 'bear_tp_mult': 1.185240680339374, 'bear_tsl_mult': 0.02156960684537379, 'bear_time_stop': 148, 'bear_use_sma': False, 'bear_use_ema': True, 'bear_use_atr': False, 'bear_use_adx': True, 'bear_use_spike': True, 'bear_rsi_required': True, 'sideways_strategy': 'breakout', 'sideways_bb_std_mult': 1.8273254112042914, 'sideways_rsi_os': 30, 'sideways_rsi_ob': 94, 'sideways_adx_thresh': 7.998970343878982, 'sideways_atr_min_pct': 0.02850392039440538, 'sideways_atr_max_pct': 0.1180536330675192, 'sideways_tp_mult': 1.7197920344081394, 'sideways_tsl_mult': 0.6614799163070806, 'sideways_time_stop': 207, 'sideways_use_sma': False, 'sideways_use_ema': False, 'sideways_use_atr': False, 'sideways_use_adx': False, 'sideways_use_spike': True, 'sideways_rsi_required': False}.
[I 2025-08-31 02:43:06,953] Trial 623 finished with values: [-1000000000.0, 1000000000.0] and parameters: {'p_sma': 53, 'p_std': 51, 'p_atr': 28, 'p_adx': 26, 'rsi_period': 71, 'ema1': 6, 'ema2': 30, 'slip_atr_k': 0.17712699495120515, 'slip_spread_k': 0.586291959307973, 'spread_hl_frac': 0.0016372256054152877, 'bb_std_mult': 1.5539081792909053, 'rsi_os': 18, 'rsi_ob': 56, 'vol_spike': 0.17785581581008986, 'adx_thresh': 28.449069459200622, 'atr_min_pct': 0.007959862819564904, 'atr_max_pct': 0.11505513930123647, 'tp_mult': 1.328203133581135, 'tsl_mult': 0.8398407002392267, 'strategy': 'mean_reversion', 'time_stop': 121, 'use_sma': False, 'use_atr': True, 'use_adx': False, 'use_ema': False, 'use_spike': True, 'rsi_required': True, 'edge_k': 0.5794837939149359, 'edge_cap': 0.4299945543943923, 'bull_strategy': 'mean_reversion', 'bull_bb_std_mult': 3.14314148196742, 'bull_rsi_os': 44, 'bull_rsi_ob': 62, 'bull_adx_thresh': 22.455738095553627, 'bull_atr_min_pct': 0.013162004852801034, 'bull_atr_max_pct': 0.027395276462360424, 'bull_tp_mult': 2.3656618348862435, 'bull_tsl_mult': 0.27657685713327246, 'bull_time_stop': 258, 'bull_use_sma': True, 'bull_use_ema': False, 'bull_use_atr': False, 'bull_use_adx': True, 'bull_use_spike': True, 'bull_rsi_required': True, 'bear_strategy': 'breakout', 'bear_bb_std_mult': 1.3722400324847857, 'bear_rsi_os': 43, 'bear_rsi_ob': 66, 'bear_adx_thresh': 24.553283255397496, 'bear_atr_min_pct': 0.0039993009783122506, 'bear_atr_max_pct': 0.010078146335327704, 'bear_tp_mult': 2.09747026982665, 'bear_tsl_mult': 0.5311227107643983, 'bear_time_stop': 94, 'bear_use_sma': False, 'bear_use_ema': True, 'bear_use_atr': True, 'bear_use_adx': True, 'bear_use_spike': True, 'bear_rsi_required': True, 'sideways_strategy': 'breakout', 'sideways_bb_std_mult': 0.6053827404005075, 'sideways_rsi_os': 30, 'sideways_rsi_ob': 94, 'sideways_adx_thresh': 8.641895840006793, 'sideways_atr_min_pct': 0.028256774108218193, 'sideways_atr_max_pct': 0.0456925774962828, 'sideways_tp_mult': 2.68962313502923, 'sideways_tsl_mult': 0.6831533872317801, 'sideways_time_stop': 62, 'sideways_use_sma': False, 'sideways_use_ema': True, 'sideways_use_atr': False, 'sideways_use_adx': False, 'sideways_use_spike': False, 'sideways_rsi_required': False}.
[I 2025-08-31 02:43:07,157] Trial 624 finished with values: [-1000000000.0, 1000000000.0] and parameters: {'p_sma': 53, 'p_std': 7, 'p_atr': 28, 'p_adx': 19, 'rsi_period': 73, 'ema1': 23, 'ema2': 50, 'slip_atr_k': 0.1127531670197158, 'slip_spread_k': 0.6843204724229801, 'spread_hl_frac': 0.0016198184807907426, 'bb_std_mult': 1.5856067845637922, 'rsi_os': 42, 'rsi_ob': 89, 'vol_spike': 0.18549504746928624, 'adx_thresh': 27.97740021378664, 'atr_min_pct': 0.008827466925869746, 'atr_max_pct': 0.12436990775622796, 'tp_mult': 2.21020535556315, 'tsl_mult': 0.941817455305444, 'strategy': 'mean_reversion', 'time_stop': 300, 'use_sma': False, 'use_atr': True, 'use_adx': True, 'use_ema': False, 'use_spike': True, 'rsi_required': True, 'edge_k': 0.5872369446034604, 'edge_cap': 0.43597569267121367, 'bull_strategy': 'breakout', 'bull_bb_std_mult': 2.412320699446878, 'bull_rsi_os': 6, 'bull_rsi_ob': 55, 'bull_adx_thresh': 22.599833724403698, 'bull_atr_min_pct': 0.013148989947249204, 'bull_atr_max_pct': 0.022714910246383335, 'bull_tp_mult': 1.7608547299437414, 'bull_tsl_mult': 0.686420929668617, 'bull_time_stop': 256, 'bull_use_sma': True, 'bull_use_ema': False, 'bull_use_atr': False, 'bull_use_adx': True, 'bull_use_spike': True, 'bull_rsi_required': True, 'bear_strategy': 'breakout', 'bear_bb_std_mult': 1.2957051919022085, 'bear_rsi_os': 16, 'bear_rsi_ob': 71, 'bear_adx_thresh': 5.720430838201607, 'bear_atr_min_pct': 0.003955651431386929, 'bear_atr_max_pct': 0.010054982509392121, 'bear_tp_mult': 1.2220516199061535, 'bear_tsl_mult': 0.5351967086627246, 'bear_time_stop': 16, 'bear_use_sma': False, 'bear_use_ema': True, 'bear_use_atr': True, 'bear_use_adx': False, 'bear_use_spike': False, 'bear_rsi_required': True, 'sideways_strategy': 'breakout', 'sideways_bb_std_mult': 0.6040603265218354, 'sideways_rsi_os': 28, 'sideways_rsi_ob': 94, 'sideways_adx_thresh': 8.607046334906313, 'sideways_atr_min_pct': 0.028471336423317152, 'sideways_atr_max_pct': 0.10706730940962184, 'sideways_tp_mult': 2.286411605754837, 'sideways_tsl_mult': 0.08595989425982392, 'sideways_time_stop': 11, 'sideways_use_sma': False, 'sideways_use_ema': True, 'sideways_use_atr': False, 'sideways_use_adx': True, 'sideways_use_spike': False, 'sideways_rsi_required': False}.
[I 2025-08-31 02:43:08,247] Trial 626 finished with values: [-1000000000.0, 1000000000.0] and parameters: {'p_sma': 52, 'p_std': 7, 'p_atr': 28, 'p_adx': 26, 'rsi_period': 68, 'ema1': 15, 'ema2': 47, 'slip_atr_k': 0.18028111015544862, 'slip_spread_k': 0.684873041087465, 'spread_hl_frac': 0.035589848170201624, 'bb_std_mult': 1.5598090246862437, 'rsi_os': 33, 'rsi_ob': 48, 'vol_spike': 0.0314041400291625, 'adx_thresh': 19.976565698590502, 'atr_min_pct': 0.007032700313064059, 'atr_max_pct': 0.11899363081781802, 'tp_mult': 1.320148658607407, 'tsl_mult': 0.4160542079971092, 'strategy': 'mean_reversion', 'time_stop': 122, 'use_sma': False, 'use_atr': False, 'use_adx': True, 'use_ema': False, 'use_spike': False, 'rsi_required': True, 'edge_k': 0.578691631422206, 'edge_cap': 0.687596304582889, 'bull_strategy': 'breakout', 'bull_bb_std_mult': 2.4731265791673107, 'bull_rsi_os': 17, 'bull_rsi_ob': 57, 'bull_adx_thresh': 6.363039943355954, 'bull_atr_min_pct': 0.013121989931774885, 'bull_atr_max_pct': 0.016213922099274983, 'bull_tp_mult': 2.370727211540646, 'bull_tsl_mult': 0.1386656451040328, 'bull_time_stop': 100, 'bull_use_sma': True, 'bull_use_ema': False, 'bull_use_atr': False, 'bull_use_adx': True, 'bull_use_spike': True, 'bull_rsi_required': True, 'bear_strategy': 'breakout', 'bear_bb_std_mult': 1.292747937011185, 'bear_rsi_os': 30, 'bear_rsi_ob': 46, 'bear_adx_thresh': 5.652215124767812, 'bear_atr_min_pct': 0.004145843223103823, 'bear_atr_max_pct': 0.08414181114050924, 'bear_tp_mult': 2.592618834062173, 'bear_tsl_mult': 0.5374103467312936, 'bear_time_stop': 19, 'bear_use_sma': False, 'bear_use_ema': False, 'bear_use_atr': True, 'bear_use_adx': False, 'bear_use_spike': False, 'bear_rsi_required': True, 'sideways_strategy': 'breakout', 'sideways_bb_std_mult': 0.6320250006838137, 'sideways_rsi_os': 24, 'sideways_rsi_ob': 64, 'sideways_adx_thresh': 23.819644351581637, 'sideways_atr_min_pct': 0.015380232636676424, 'sideways_atr_max_pct': 0.12132011860446257, 'sideways_tp_mult': 2.0019890162562017, 'sideways_tsl_mult': 0.5737887658181179, 'sideways_time_stop': 73, 'sideways_use_sma': True, 'sideways_use_ema': True, 'sideways_use_atr': False, 'sideways_use_adx': True, 'sideways_use_spike': False, 'sideways_rsi_required': False}.
[I 2025-08-31 02:43:40,928] Trial 628 finished with values: [-1000000000.0, 1000000000.0] and parameters: {'p_sma': 57, 'p_std': 12, 'p_atr': 17, 'p_adx': 12, 'rsi_period': 68, 'ema1': 29, 'ema2': 55, 'slip_atr_k': 0.1251200257014303, 'slip_spread_k': 0.17232012032572605, 'spread_hl_frac': 0.003696122014013289, 'bb_std_mult': 1.713448064449577, 'rsi_os': 37, 'rsi_ob': 66, 'vol_spike': 0.19334439284185, 'adx_thresh': 20.28449167504605, 'atr_min_pct': 0.006945650661165794, 'atr_max_pct': 0.09394309331122411, 'tp_mult': 1.5601762919946285, 'tsl_mult': 0.34604685489266107, 'strategy': 'mean_reversion', 'time_stop': 102, 'use_sma': True, 'use_atr': False, 'use_adx': True, 'use_ema': False, 'use_spike': False, 'rsi_required': True, 'edge_k': 1.814315933963966, 'edge_cap': 0.2632805072622953, 'bull_strategy': 'breakout', 'bull_bb_std_mult': 2.487800744673242, 'bull_rsi_os': 14, 'bull_rsi_ob': 75, 'bull_adx_thresh': 9.649698313950282, 'bull_atr_min_pct': 0.023472078836701514, 'bull_atr_max_pct': 0.1432652561208941, 'bull_tp_mult': 1.4642819642623015, 'bull_tsl_mult': 0.2954638948977711, 'bull_time_stop': 132, 'bull_use_sma': True, 'bull_use_ema': False, 'bull_use_atr': False, 'bull_use_adx': True, 'bull_use_spike': True, 'bull_rsi_required': True, 'bear_strategy': 'mean_reversion', 'bear_bb_std_mult': 3.4230658012337822, 'bear_rsi_os': 8, 'bear_rsi_ob': 51, 'bear_adx_thresh': 6.360002202336721, 'bear_atr_min_pct': 0.02909148783553153, 'bear_atr_max_pct': 0.10203559354706015, 'bear_tp_mult': 2.139298559903913, 'bear_tsl_mult': 0.060070803435779196, 'bear_time_stop': 21, 'bear_use_sma': False, 'bear_use_ema': False, 'bear_use_atr': False, 'bear_use_adx': False, 'bear_use_spike': False, 'bear_rsi_required': True, 'sideways_strategy': 'breakout', 'sideways_bb_std_mult': 0.5041455527252792, 'sideways_rsi_os': 40, 'sideways_rsi_ob': 93, 'sideways_adx_thresh': 23.6590230526847, 'sideways_atr_min_pct': 0.026946577651759136, 'sideways_atr_max_pct': 0.05008488758438484, 'sideways_tp_mult': 2.125978329720502, 'sideways_tsl_mult': 0.6659764364715436, 'sideways_time_stop': 270, 'sideways_use_sma': True, 'sideways_use_ema': False, 'sideways_use_atr': False, 'sideways_use_adx': True, 'sideways_use_spike': True, 'sideways_rsi_required': False}.
[I 2025-08-31 02:43:41,871] Trial 625 finished with values: [-1000000000.0, 1000000000.0] and parameters: {'p_sma': 53, 'p_std': 47, 'p_atr': 26, 'p_adx': 26, 'rsi_period': 68, 'ema1': 6, 'ema2': 46, 'slip_atr_k': 0.06475058448122677, 'slip_spread_k': 0.1961531238010337, 'spread_hl_frac': 0.0017686805049093519, 'bb_std_mult': 1.5502348430001969, 'rsi_os': 39, 'rsi_ob': 68, 'vol_spike': 0.1771093331863065, 'adx_thresh': 19.87773770416257, 'atr_min_pct': 0.021455173675496497, 'atr_max_pct': 0.12461104932349851, 'tp_mult': 2.185610133003872, 'tsl_mult': 0.22437189787982045, 'strategy': 'mean_reversion', 'time_stop': 143, 'use_sma': False, 'use_atr': True, 'use_adx': True, 'use_ema': False, 'use_spike': True, 'rsi_required': True, 'edge_k': 1.8117967510701392, 'edge_cap': 0.6336929788821637, 'bull_strategy': 'breakout', 'bull_bb_std_mult': 1.4163436936018456, 'bull_rsi_os': 17, 'bull_rsi_ob': 62, 'bull_adx_thresh': 6.40210094683324, 'bull_atr_min_pct': 0.021963855713045835, 'bull_atr_max_pct': 0.027223248466877112, 'bull_tp_mult': 1.7419246724156632, 'bull_tsl_mult': 0.297381771035342, 'bull_time_stop': 147, 'bull_use_sma': True, 'bull_use_ema': False, 'bull_use_atr': False, 'bull_use_adx': True, 'bull_use_spike': True, 'bull_rsi_required': True, 'bear_strategy': 'breakout', 'bear_bb_std_mult': 1.3788607321910737, 'bear_rsi_os': 35, 'bear_rsi_ob': 46, 'bear_adx_thresh': 24.578676593038608, 'bear_atr_min_pct': 0.004232608433486095, 'bear_atr_max_pct': 0.08332571522032167, 'bear_tp_mult': 2.9452836380009044, 'bear_tsl_mult': 0.5293717301779682, 'bear_time_stop': 19, 'bear_use_sma': False, 'bear_use_ema': True, 'bear_use_atr': True, 'bear_use_adx': False, 'bear_use_spike': False, 'bear_rsi_required': True, 'sideways_strategy': 'breakout', 'sideways_bb_std_mult': 3.010843616699562, 'sideways_rsi_os': 38, 'sideways_rsi_ob': 94, 'sideways_adx_thresh': 23.7722364037746, 'sideways_atr_min_pct': 0.02543233367594624, 'sideways_atr_max_pct': 0.08367626044147819, 'sideways_tp_mult': 1.7670704879813164, 'sideways_tsl_mult': 0.6642452016440988, 'sideways_time_stop': 207, 'sideways_use_sma': False, 'sideways_use_ema': True, 'sideways_use_atr': False, 'sideways_use_adx': True, 'sideways_use_spike': False, 'sideways_rsi_required': False}.
[I 2025-08-31 02:43:42,284] Trial 627 finished with values: [-1000000000.0, 1000000000.0] and parameters: {'p_sma': 51, 'p_std': 59, 'p_atr': 28, 'p_adx': 18, 'rsi_period': 68, 'ema1': 17, 'ema2': 51, 'slip_atr_k': 0.12384063710346113, 'slip_spread_k': 0.17645423061930776, 'spread_hl_frac': 0.015533802945206366, 'bb_std_mult': 1.7072353418230495, 'rsi_os': 39, 'rsi_ob': 89, 'vol_spike': 0.2998122611387941, 'adx_thresh': 33.767973866542334, 'atr_min_pct': 0.016449008072548676, 'atr_max_pct': 0.025907375905169193, 'tp_mult': 2.198765501370306, 'tsl_mult': 0.4949906459112498, 'strategy': 'mean_reversion', 'time_stop': 101, 'use_sma': False, 'use_atr': False, 'use_adx': True, 'use_ema': False, 'use_spike': False, 'rsi_required': True, 'edge_k': 1.3004481799844556, 'edge_cap': 0.5404230976523612, 'bull_strategy': 'breakout', 'bull_bb_std_mult': 2.497058468546427, 'bull_rsi_os': 54, 'bull_rsi_ob': 75, 'bull_adx_thresh': 9.301787117591314, 'bull_atr_min_pct': 0.01131106851319752, 'bull_atr_max_pct': 0.1430071345469397, 'bull_tp_mult': 1.4765432143049866, 'bull_tsl_mult': 0.30567078583401647, 'bull_time_stop': 16, 'bull_use_sma': True, 'bull_use_ema': False, 'bull_use_atr': False, 'bull_use_adx': True, 'bull_use_spike': True, 'bull_rsi_required': True, 'bear_strategy': 'breakout', 'bear_bb_std_mult': 1.2741463055909839, 'bear_rsi_os': 8, 'bear_rsi_ob': 46, 'bear_adx_thresh': 5.542098139919209, 'bear_atr_min_pct': 0.02257804949653658, 'bear_atr_max_pct': 0.10248768370701852, 'bear_tp_mult': 2.132457382230843, 'bear_tsl_mult': 0.544525390781492, 'bear_time_stop': 19, 'bear_use_sma': False, 'bear_use_ema': False, 'bear_use_atr': True, 'bear_use_adx': False, 'bear_use_spike': False, 'bear_rsi_required': True, 'sideways_strategy': 'breakout', 'sideways_bb_std_mult': 2.5875273334520115, 'sideways_rsi_os': 32, 'sideways_rsi_ob': 64, 'sideways_adx_thresh': 32.40507457092749, 'sideways_atr_min_pct': 0.014652220712940143, 'sideways_atr_max_pct': 0.08374043273581892, 'sideways_tp_mult': 2.5835346627449254, 'sideways_tsl_mult': 0.09088310002874156, 'sideways_time_stop': 199, 'sideways_use_sma': True, 'sideways_use_ema': True, 'sideways_use_atr': False, 'sideways_use_adx': True, 'sideways_use_spike': False, 'sideways_rsi_required': False}.
[I 2025-08-31 02:43:43,004] Trial 629 finished with values: [-1000000000.0, 1000000000.0] and parameters: {'p_sma': 14, 'p_std': 54, 'p_atr': 17, 'p_adx': 12, 'rsi_period': 37, 'ema1': 13, 'ema2': 26, 'slip_atr_k': 0.07267742640592448, 'slip_spread_k': 0.17793639887148727, 'spread_hl_frac': 0.022294021123383474, 'bb_std_mult': 1.7327826117182177, 'rsi_os': 39, 'rsi_ob': 70, 'vol_spike': 0.19093168710167951, 'adx_thresh': 21.638000686134543, 'atr_min_pct': 0.008799196685604848, 'atr_max_pct': 0.08542306916198784, 'tp_mult': 1.1832116562710853, 'tsl_mult': 0.2260896465771677, 'strategy': 'mean_reversion', 'time_stop': 166, 'use_sma': True, 'use_atr': False, 'use_adx': False, 'use_ema': False, 'use_spike': False, 'rsi_required': True, 'edge_k': 0.47457326826425444, 'edge_cap': 0.37419435082754393, 'bull_strategy': 'breakout', 'bull_bb_std_mult': 1.779514867973691, 'bull_rsi_os': 9, 'bull_rsi_ob': 92, 'bull_adx_thresh': 6.9716967181146, 'bull_atr_min_pct': 0.012278398614388142, 'bull_atr_max_pct': 0.14952521172039468, 'bull_tp_mult': 1.3788791743091522, 'bull_tsl_mult': 0.2992635354753768, 'bull_time_stop': 146, 'bull_use_sma': True, 'bull_use_ema': False, 'bull_use_atr': False, 'bull_use_adx': True, 'bull_use_spike': True, 'bull_rsi_required': True, 'bear_strategy': 'mean_reversion', 'bear_bb_std_mult': 2.952024875343317, 'bear_rsi_os': 7, 'bear_rsi_ob': 51, 'bear_adx_thresh': 19.850573653129942, 'bear_atr_min_pct': 0.0006038729929427507, 'bear_atr_max_pct': 0.08114858817558325, 'bear_tp_mult': 2.0669514143179706, 'bear_tsl_mult': 0.6004763077390113, 'bear_time_stop': 12, 'bear_use_sma': False, 'bear_use_ema': False, 'bear_use_atr': False, 'bear_use_adx': True, 'bear_use_spike': False, 'bear_rsi_required': True, 'sideways_strategy': 'breakout', 'sideways_bb_std_mult': 2.7987062429339247, 'sideways_rsi_os': 9, 'sideways_rsi_ob': 60, 'sideways_adx_thresh': 32.56722682508455, 'sideways_atr_min_pct': 0.02562836097655362, 'sideways_atr_max_pct': 0.05035231449764743, 'sideways_tp_mult': 2.429364790534201, 'sideways_tsl_mult': 0.6603585847261015, 'sideways_time_stop': 202, 'sideways_use_sma': True, 'sideways_use_ema': False, 'sideways_use_atr': False, 'sideways_use_adx': False, 'sideways_use_spike': True, 'sideways_rsi_required': False}.
