[I 2025-08-31 00:32:50,206] Trial 259 finished with values: [-1000000000.0, 1000000000.0] and parameters: {'p_sma': 45, 'p_std': 39, 'p_atr': 21, 'p_adx': 16, 'rsi_period': 54, 'ema1': 9, 'ema2': 18, 'slip_atr_k': 0.03656563399783041, 'slip_spread_k': 0.5092227430550321, 'spread_hl_frac': 0.009727635393453424, 'bb_std_mult': 2.0658625862022317, 'rsi_os': 37, 'rsi_ob': 72, 'vol_spike': 0.16406579223826478, 'adx_thresh': 13.674448442301822, 'atr_min_pct': 0.014341158333888344, 'atr_max_pct': 0.07123438486553048, 'tp_mult': 2.673944849808212, 'tsl_mult': 0.45280039856256127, 'strategy': 'breakout', 'time_stop': 77, 'use_sma': False, 'use_atr': False, 'use_adx': True, 'use_ema': True, 'use_spike': False, 'rsi_required': False, 'edge_k': 0.6876018695118638, 'edge_cap': 0.8394835250312623, 'bull_strategy': 'breakout', 'bull_bb_std_mult': 2.9585351901116788, 'bull_rsi_os': 44, 'bull_rsi_ob': 73, 'bull_adx_thresh': 16.546383082500654, 'bull_atr_min_pct': 0.0016792804724208373, 'bull_atr_max_pct': 0.07924282998910975, 'bull_tp_mult': 2.4121202051558206, 'bull_tsl_mult': 0.3429617645781248, 'bull_time_stop': 167, 'bull_use_sma': False, 'bull_use_ema': False, 'bull_use_atr': True, 'bull_use_adx': True, 'bull_use_spike': True, 'bull_rsi_required': True, 'bear_strategy': 'mean_reversion', 'bear_bb_std_mult': 1.163559277499174, 'bear_rsi_os': 21, 'bear_rsi_ob': 52, 'bear_adx_thresh': 16.870164414533253, 'bear_atr_min_pct': 0.006766542483268922, 'bear_atr_max_pct': 0.02536731282239242, 'bear_tp_mult': 1.7645793256896019, 'bear_tsl_mult': 0.6546886197007524, 'bear_time_stop': 12, 'bear_use_sma': True, 'bear_use_ema': False, 'bear_use_atr': False, 'bear_use_adx': True, 'bear_use_spike': False, 'bear_rsi_required': True, 'sideways_strategy': 'mean_reversion', 'sideways_bb_std_mult': 1.128354028787185, 'sideways_rsi_os': 37, 'sideways_rsi_ob': 92, 'sideways_adx_thresh': 12.617457180991082, 'sideways_atr_min_pct': 0.012389650851600877, 'sideways_atr_max_pct': 0.07792683304527513, 'sideways_tp_mult': 1.0769732636718763, 'sideways_tsl_mult': 0.7970855752942945, 'sideways_time_stop': 158, 'sideways_use_sma': True, 'sideways_use_ema': True, 'sideways_use_atr': False, 'sideways_use_adx': True, 'sideways_use_spike': True, 'sideways_rsi_required': True}.
[I 2025-08-31 00:32:50,212] Trial 262 finished with values: [-1000000000.0, 1000000000.0] and parameters: {'p_sma': 42, 'p_std': 24, 'p_atr': 18, 'p_adx': 12, 'rsi_period': 61, 'ema1': 5, 'ema2': 19, 'slip_atr_k': 0.15609780850049385, 'slip_spread_k': 0.9962281252629144, 'spread_hl_frac': 0.007545510040452239, 'bb_std_mult': 1.5452811581263157, 'rsi_os': 38, 'rsi_ob': 79, 'vol_spike': 0.15371911507253022, 'adx_thresh': 34.30863485048326, 'atr_min_pct': 0.014134819806426384, 'atr_max_pct': 0.0709246243634438, 'tp_mult': 1.91555755554479, 'tsl_mult': 0.482545635825775, 'strategy': 'mean_reversion', 'time_stop': 91, 'use_sma': True, 'use_atr': False, 'use_adx': False, 'use_ema': True, 'use_spike': False, 'rsi_required': False, 'edge_k': 0.5698269209973235, 'edge_cap': 0.8364954815958596, 'bull_strategy': 'breakout', 'bull_bb_std_mult': 2.9208494690434397, 'bull_rsi_os': 6, 'bull_rsi_ob': 70, 'bull_adx_thresh': 13.785255039771927, 'bull_atr_min_pct': 0.018003210772839548, 'bull_atr_max_pct': 0.07850671091098611, 'bull_tp_mult': 2.319458967709573, 'bull_tsl_mult': 0.34633929102632977, 'bull_time_stop': 171, 'bull_use_sma': False, 'bull_use_ema': False, 'bull_use_atr': True, 'bull_use_adx': False, 'bull_use_spike': False, 'bull_rsi_required': False, 'bear_strategy': 'mean_reversion', 'bear_bb_std_mult': 1.0040909466859789, 'bear_rsi_os': 21, 'bear_rsi_ob': 79, 'bear_adx_thresh': 16.822025976533972, 'bear_atr_min_pct': 0.008774757829545284, 'bear_atr_max_pct': 0.014600434166563456, 'bear_tp_mult': 2.402274203329315, 'bear_tsl_mult': 0.7931970991602973, 'bear_time_stop': 28, 'bear_use_sma': True, 'bear_use_ema': False, 'bear_use_atr': False, 'bear_use_adx': True, 'bear_use_spike': False, 'bear_rsi_required': False, 'sideways_strategy': 'mean_reversion', 'sideways_bb_std_mult': 1.119022876508285, 'sideways_rsi_os': 37, 'sideways_rsi_ob': 85, 'sideways_adx_thresh': 24.532412698484187, 'sideways_atr_min_pct': 0.019695414858532413, 'sideways_atr_max_pct': 0.14085169939167497, 'sideways_tp_mult': 1.076577261211276, 'sideways_tsl_mult': 0.8216422787609884, 'sideways_time_stop': 173, 'sideways_use_sma': True, 'sideways_use_ema': False, 'sideways_use_atr': False, 'sideways_use_adx': False, 'sideways_use_spike': True, 'sideways_rsi_required': True}.
[I 2025-08-31 00:32:51,176] Trial 263 finished with values: [-0.05331131194134975, 0.05309700721033546] and parameters: {'p_sma': 48, 'p_std': 59, 'p_atr': 18, 'p_adx': 12, 'rsi_period': 63, 'ema1': 11, 'ema2': 57, 'slip_atr_k': 0.10305065147340653, 'slip_spread_k': 0.18734847554078754, 'spread_hl_frac': 0.008793349477260019, 'bb_std_mult': 1.519580055800838, 'rsi_os': 31, 'rsi_ob': 68, 'vol_spike': 0.1566894313734785, 'adx_thresh': 11.227915979659779, 'atr_min_pct': 0.012690990807313937, 'atr_max_pct': 0.07045780807248549, 'tp_mult': 1.614554850445601, 'tsl_mult': 0.4541943115514341, 'strategy': 'mean_reversion', 'time_stop': 90, 'use_sma': True, 'use_atr': False, 'use_adx': False, 'use_ema': True, 'use_spike': False, 'rsi_required': False, 'edge_k': 1.0821890610447442, 'edge_cap': 0.8079051215558302, 'bull_strategy': 'breakout', 'bull_bb_std_mult': 2.925868117876916, 'bull_rsi_os': 43, 'bull_rsi_ob': 70, 'bull_adx_thresh': 13.727388484693055, 'bull_atr_min_pct': 0.021487693731545854, 'bull_atr_max_pct': 0.08032306278338083, 'bull_tp_mult': 2.522892476480574, 'bull_tsl_mult': 0.12639105591174293, 'bull_time_stop': 11, 'bull_use_sma': False, 'bull_use_ema': False, 'bull_use_atr': True, 'bull_use_adx': False, 'bull_use_spike': False, 'bull_rsi_required': False, 'bear_strategy': 'mean_reversion', 'bear_bb_std_mult': 1.011822030104311, 'bear_rsi_os': 20, 'bear_rsi_ob': 47, 'bear_adx_thresh': 10.109947319543721, 'bear_atr_min_pct': 6.339234033598748e-05, 'bear_atr_max_pct': 0.01805587714470753, 'bear_tp_mult': 2.576611092927087, 'bear_tsl_mult': 0.7989471027476509, 'bear_time_stop': 18, 'bear_use_sma': True, 'bear_use_ema': False, 'bear_use_atr': False, 'bear_use_adx': False, 'bear_use_spike': False, 'bear_rsi_required': True, 'sideways_strategy': 'mean_reversion', 'sideways_bb_std_mult': 1.7669087935319894, 'sideways_rsi_os': 46, 'sideways_rsi_ob': 85, 'sideways_adx_thresh': 5.471893289070774, 'sideways_atr_min_pct': 0.020876425371573835, 'sideways_atr_max_pct': 0.1406639802349031, 'sideways_tp_mult': 1.073618171068953, 'sideways_tsl_mult': 0.826894208723933, 'sideways_time_stop': 168, 'sideways_use_sma': True, 'sideways_use_ema': False, 'sideways_use_atr': False, 'sideways_use_adx': False, 'sideways_use_spike': True, 'sideways_rsi_required': True}.
[I 2025-08-31 00:33:21,314] Trial 264 finished with values: [-1000000000.0, 1000000000.0] and parameters: {'p_sma': 48, 'p_std': 7, 'p_atr': 18, 'p_adx': 17, 'rsi_period': 52, 'ema1': 10, 'ema2': 19, 'slip_atr_k': 0.10552179797811365, 'slip_spread_k': 0.35998875731757296, 'spread_hl_frac': 0.041402192389650774, 'bb_std_mult': 1.5268686815450088, 'rsi_os': 38, 'rsi_ob': 72, 'vol_spike': 0.15288330283756135, 'adx_thresh': 26.709089089452217, 'atr_min_pct': 0.013088014191512478, 'atr_max_pct': 0.0699770685108505, 'tp_mult': 1.3002179108925573, 'tsl_mult': 0.7574680030138958, 'strategy': 'mean_reversion', 'time_stop': 90, 'use_sma': True, 'use_atr': True, 'use_adx': False, 'use_ema': True, 'use_spike': False, 'rsi_required': False, 'edge_k': 1.091673801429216, 'edge_cap': 0.7675194045697812, 'bull_strategy': 'breakout', 'bull_bb_std_mult': 3.4374689765019024, 'bull_rsi_os': 43, 'bull_rsi_ob': 70, 'bull_adx_thresh': 13.730365981888317, 'bull_atr_min_pct': 0.02135256093722371, 'bull_atr_max_pct': 0.06947830742721645, 'bull_tp_mult': 2.530404618631871, 'bull_tsl_mult': 0.1512196268772749, 'bull_time_stop': 196, 'bull_use_sma': True, 'bull_use_ema': False, 'bull_use_atr': True, 'bull_use_adx': True, 'bull_use_spike': False, 'bull_rsi_required': False, 'bear_strategy': 'mean_reversion', 'bear_bb_std_mult': 1.003682816523653, 'bear_rsi_os': 20, 'bear_rsi_ob': 84, 'bear_adx_thresh': 10.254971320181715, 'bear_atr_min_pct': 0.0003114294742472875, 'bear_atr_max_pct': 0.017992148705728087, 'bear_tp_mult': 1.9101698330407597, 'bear_tsl_mult': 0.8068872153186222, 'bear_time_stop': 31, 'bear_use_sma': True, 'bear_use_ema': False, 'bear_use_atr': False, 'bear_use_adx': True, 'bear_use_spike': False, 'bear_rsi_required': False, 'sideways_strategy': 'mean_reversion', 'sideways_bb_std_mult': 1.1506263656557616, 'sideways_rsi_os': 51, 'sideways_rsi_ob': 84, 'sideways_adx_thresh': 24.28156374640028, 'sideways_atr_min_pct': 0.007614456694921089, 'sideways_atr_max_pct': 0.03249119933628912, 'sideways_tp_mult': 2.085315844939658, 'sideways_tsl_mult': 0.6293652553781076, 'sideways_time_stop': 187, 'sideways_use_sma': True, 'sideways_use_ema': False, 'sideways_use_atr': False, 'sideways_use_adx': False, 'sideways_use_spike': True, 'sideways_rsi_required': False}.
[I 2025-08-31 00:33:21,492] Trial 267 finished with values: [-0.03306369495300221, 0.032970828099910005] and parameters: {'p_sma': 48, 'p_std': 27, 'p_atr': 27, 'p_adx': 14, 'rsi_period': 52, 'ema1': 10, 'ema2': 43, 'slip_atr_k': 0.03473060435418697, 'slip_spread_k': 0.1542872028691829, 'spread_hl_frac': 0.04127137312463108, 'bb_std_mult': 1.924664229510577, 'rsi_os': 26, 'rsi_ob': 66, 'vol_spike': 0.20599809957033827, 'adx_thresh': 12.033887332660237, 'atr_min_pct': 0.01182920295426381, 'atr_max_pct': 0.12911022446637133, 'tp_mult': 2.8498761644350386, 'tsl_mult': 0.15094564435993818, 'strategy': 'breakout', 'time_stop': 105, 'use_sma': True, 'use_atr': True, 'use_adx': False, 'use_ema': True, 'use_spike': False, 'rsi_required': False, 'edge_k': 1.4692585888459346, 'edge_cap': 0.7600784529306789, 'bull_strategy': 'mean_reversion', 'bull_bb_std_mult': 2.8169722999722837, 'bull_rsi_os': 38, 'bull_rsi_ob': 70, 'bull_adx_thresh': 5.25033566393552, 'bull_atr_min_pct': 0.0011469031111104237, 'bull_atr_max_pct': 0.07077340761684396, 'bull_tp_mult': 2.53825929725227, 'bull_tsl_mult': 0.14934454432330818, 'bull_time_stop': 34, 'bull_use_sma': True, 'bull_use_ema': False, 'bull_use_atr': True, 'bull_use_adx': True, 'bull_use_spike': False, 'bull_rsi_required': False, 'bear_strategy': 'mean_reversion', 'bear_bb_std_mult': 1.1083487914906793, 'bear_rsi_os': 24, 'bear_rsi_ob': 67, 'bear_adx_thresh': 14.837114782196746, 'bear_atr_min_pct': 0.008631163336654233, 'bear_atr_max_pct': 0.018393009320311196, 'bear_tp_mult': 1.9140025295892515, 'bear_tsl_mult': 0.7522976781977369, 'bear_time_stop': 33, 'bear_use_sma': True, 'bear_use_ema': False, 'bear_use_atr': False, 'bear_use_adx': True, 'bear_use_spike': True, 'bear_rsi_required': False, 'sideways_strategy': 'breakout', 'sideways_bb_std_mult': 2.77307191336402, 'sideways_rsi_os': 48, 'sideways_rsi_ob': 87, 'sideways_adx_thresh': 14.023102333608753, 'sideways_atr_min_pct': 0.015567026887900024, 'sideways_atr_max_pct': 0.03417657994076986, 'sideways_tp_mult': 2.6737426573079786, 'sideways_tsl_mult': 0.7759102468848793, 'sideways_time_stop': 186, 'sideways_use_sma': True, 'sideways_use_ema': False, 'sideways_use_atr': False, 'sideways_use_adx': False, 'sideways_use_spike': True, 'sideways_rsi_required': False}.
[I 2025-08-31 00:33:21,685] Trial 265 finished with values: [-1000000000.0, 1000000000.0] and parameters: {'p_sma': 48, 'p_std': 10, 'p_atr': 20, 'p_adx': 17, 'rsi_period': 64, 'ema1': 11, 'ema2': 55, 'slip_atr_k': 0.10167322327510929, 'slip_spread_k': 0.36593977023042806, 'spread_hl_frac': 0.008995759318505924, 'bb_std_mult': 1.9294304743409731, 'rsi_os': 44, 'rsi_ob': 73, 'vol_spike': 0.22687693975841183, 'adx_thresh': 25.98203682146926, 'atr_min_pct': 0.01260010267564365, 'atr_max_pct': 0.07103137503616387, 'tp_mult': 2.886807654398635, 'tsl_mult': 0.748735818622275, 'strategy': 'mean_reversion', 'time_stop': 104, 'use_sma': True, 'use_atr': True, 'use_adx': False, 'use_ema': True, 'use_spike': False, 'rsi_required': False, 'edge_k': 1.5818077111651738, 'edge_cap': 0.7730117366592479, 'bull_strategy': 'breakout', 'bull_bb_std_mult': 3.2205684379044124, 'bull_rsi_os': 55, 'bull_rsi_ob': 70, 'bull_adx_thresh': 5.383518432824852, 'bull_atr_min_pct': 0.026046885588331358, 'bull_atr_max_pct': 0.07086569188180881, 'bull_tp_mult': 2.5295337520579504, 'bull_tsl_mult': 0.32262958684781146, 'bull_time_stop': 22, 'bull_use_sma': True, 'bull_use_ema': False, 'bull_use_atr': True, 'bull_use_adx': True, 'bull_use_spike': False, 'bull_rsi_required': False, 'bear_strategy': 'mean_reversion', 'bear_bb_std_mult': 1.1043627377405538, 'bear_rsi_os': 24, 'bear_rsi_ob': 49, 'bear_adx_thresh': 12.657596614409218, 'bear_atr_min_pct': 0.007171158535521036, 'bear_atr_max_pct': 0.018681255575425722, 'bear_tp_mult': 1.2193772143134702, 'bear_tsl_mult': 0.5218936241569468, 'bear_time_stop': 21, 'bear_use_sma': True, 'bear_use_ema': False, 'bear_use_atr': False, 'bear_use_adx': True, 'bear_use_spike': True, 'bear_rsi_required': False, 'sideways_strategy': 'breakout', 'sideways_bb_std_mult': 0.8803190141115267, 'sideways_rsi_os': 7, 'sideways_rsi_ob': 89, 'sideways_adx_thresh': 13.308076550153944, 'sideways_atr_min_pct': 0.01797274945894379, 'sideways_atr_max_pct': 0.03379669429260809, 'sideways_tp_mult': 1.4935102566150757, 'sideways_tsl_mult': 0.7754408417526156, 'sideways_time_stop': 188, 'sideways_use_sma': True, 'sideways_use_ema': False, 'sideways_use_atr': False, 'sideways_use_adx': False, 'sideways_use_spike': True, 'sideways_rsi_required': False}.
[I 2025-08-31 00:33:21,916] Trial 266 finished with values: [-1000000000.0, 1000000000.0] and parameters: {'p_sma': 30, 'p_std': 42, 'p_atr': 20, 'p_adx': 14, 'rsi_period': 67, 'ema1': 6, 'ema2': 43, 'slip_atr_k': 0.10415783323681235, 'slip_spread_k': 0.18240015905501533, 'spread_hl_frac': 0.044948731993051626, 'bb_std_mult': 2.13308913912475, 'rsi_os': 48, 'rsi_ob': 68, 'vol_spike': 0.20510762621296452, 'adx_thresh': 12.204563782951812, 'atr_min_pct': 0.013359067836496707, 'atr_max_pct': 0.026096235393043565, 'tp_mult': 2.625830090375257, 'tsl_mult': 0.15793700963585428, 'strategy': 'mean_reversion', 'time_stop': 103, 'use_sma': True, 'use_atr': True, 'use_adx': False, 'use_ema': True, 'use_spike': False, 'rsi_required': False, 'edge_k': 1.8062224064773238, 'edge_cap': 0.7739303770606237, 'bull_strategy': 'breakout', 'bull_bb_std_mult': 3.375849762461085, 'bull_rsi_os': 43, 'bull_rsi_ob': 70, 'bull_adx_thresh': 17.35115505123084, 'bull_atr_min_pct': 0.029488721783321417, 'bull_atr_max_pct': 0.06953293834301931, 'bull_tp_mult': 2.5347067895342157, 'bull_tsl_mult': 0.1581532310014707, 'bull_time_stop': 14, 'bull_use_sma': True, 'bull_use_ema': False, 'bull_use_atr': True, 'bull_use_adx': True, 'bull_use_spike': False, 'bull_rsi_required': False, 'bear_strategy': 'mean_reversion', 'bear_bb_std_mult': 1.0983085815481297, 'bear_rsi_os': 24, 'bear_rsi_ob': 49, 'bear_adx_thresh': 10.208994228507102, 'bear_atr_min_pct': 0.025773310665919195, 'bear_atr_max_pct': 0.017909257702993578, 'bear_tp_mult': 2.5538761865028587, 'bear_tsl_mult': 0.8122864386502162, 'bear_time_stop': 32, 'bear_use_sma': True, 'bear_use_ema': False, 'bear_use_atr': False, 'bear_use_adx': True, 'bear_use_spike': True, 'bear_rsi_required': False, 'sideways_strategy': 'breakout', 'sideways_bb_std_mult': 2.1527306008120437, 'sideways_rsi_os': 46, 'sideways_rsi_ob': 84, 'sideways_adx_thresh': 13.651605510233974, 'sideways_atr_min_pct': 0.026110988742592267, 'sideways_atr_max_pct': 0.14515686890698365, 'sideways_tp_mult': 2.6548681451819514, 'sideways_tsl_mult': 0.662131397203818, 'sideways_time_stop': 165, 'sideways_use_sma': True, 'sideways_use_ema': False, 'sideways_use_atr': False, 'sideways_use_adx': False, 'sideways_use_spike': True, 'sideways_rsi_required': False}.
[I 2025-08-31 00:33:51,321] Trial 270 finished with values: [-1000000000.0, 1000000000.0] and parameters: {'p_sma': 20, 'p_std': 46, 'p_atr': 24, 'p_adx': 9, 'rsi_period': 67, 'ema1': 6, 'ema2': 29, 'slip_atr_k': 0.22856597257956174, 'slip_spread_k': 0.31444084684097606, 'spread_hl_frac': 0.010546117666602824, 'bb_std_mult': 1.7726362667970423, 'rsi_os': 28, 'rsi_ob': 58, 'vol_spike': 0.19039231269217916, 'adx_thresh': 5.631376931562247, 'atr_min_pct': 0.0044649896449784395, 'atr_max_pct': 0.11998166772847009, 'tp_mult': 2.6306397180305643, 'tsl_mult': 0.548927578309615, 'strategy': 'breakout', 'time_stop': 95, 'use_sma': True, 'use_atr': False, 'use_adx': False, 'use_ema': True, 'use_spike': False, 'rsi_required': False, 'edge_k': 1.8148368656837048, 'edge_cap': 0.816289804341011, 'bull_strategy': 'breakout', 'bull_bb_std_mult': 3.474289890789052, 'bull_rsi_os': 38, 'bull_rsi_ob': 69, 'bull_adx_thresh': 21.12787062061551, 'bull_atr_min_pct': 0.014023121963192489, 'bull_atr_max_pct': 0.07674844175257381, 'bull_tp_mult': 2.338180450187914, 'bull_tsl_mult': 0.3796309971170622, 'bull_time_stop': 160, 'bull_use_sma': False, 'bull_use_ema': False, 'bull_use_atr': True, 'bull_use_adx': True, 'bull_use_spike': False, 'bull_rsi_required': False, 'bear_strategy': 'mean_reversion', 'bear_bb_std_mult': 0.9500890134290758, 'bear_rsi_os': 22, 'bear_rsi_ob': 63, 'bear_adx_thresh': 7.574200625934555, 'bear_atr_min_pct': 0.009109743702058446, 'bear_atr_max_pct': 0.023360937123826104, 'bear_tp_mult': 2.489681991611425, 'bear_tsl_mult': 0.5705798504975359, 'bear_time_stop': 25, 'bear_use_sma': True, 'bear_use_ema': False, 'bear_use_atr': False, 'bear_use_adx': True, 'bear_use_spike': False, 'bear_rsi_required': False, 'sideways_strategy': 'mean_reversion', 'sideways_bb_std_mult': 1.0886106339158022, 'sideways_rsi_os': 46, 'sideways_rsi_ob': 82, 'sideways_adx_thresh': 27.95912215892055, 'sideways_atr_min_pct': 0.0009139592220550018, 'sideways_atr_max_pct': 0.14507638805325213, 'sideways_tp_mult': 1.1013425076695573, 'sideways_tsl_mult': 0.6575238689278068, 'sideways_time_stop': 164, 'sideways_use_sma': True, 'sideways_use_ema': False, 'sideways_use_atr': True, 'sideways_use_adx': False, 'sideways_use_spike': False, 'sideways_rsi_required': False}.
[I 2025-08-31 00:33:51,733] Trial 271 finished with values: [-1000000000.0, 1000000000.0] and parameters: {'p_sma': 46, 'p_std': 38, 'p_atr': 24, 'p_adx': 11, 'rsi_period': 58, 'ema1': 12, 'ema2': 16, 'slip_atr_k': 0.2277105580070744, 'slip_spread_k': 0.3005286043238231, 'spread_hl_frac': 0.04785451447420537, 'bb_std_mult': 1.3846006180765336, 'rsi_os': 40, 'rsi_ob': 81, 'vol_spike': 0.1860600940092556, 'adx_thresh': 18.78119179322929, 'atr_min_pct': 0.008471506502653525, 'atr_max_pct': 0.06849037585239594, 'tp_mult': 1.4767768309363292, 'tsl_mult': 0.11872600012220683, 'strategy': 'breakout', 'time_stop': 69, 'use_sma': True, 'use_atr': False, 'use_adx': False, 'use_ema': True, 'use_spike': False, 'rsi_required': False, 'edge_k': 0.42108878948173756, 'edge_cap': 0.8168791756895102, 'bull_strategy': 'mean_reversion', 'bull_bb_std_mult': 3.450598925557208, 'bull_rsi_os': 31, 'bull_rsi_ob': 72, 'bull_adx_thresh': 12.989016820601464, 'bull_atr_min_pct': 0.024840220458050573, 'bull_atr_max_pct': 0.07613130862030887, 'bull_tp_mult': 2.613667827404084, 'bull_tsl_mult': 0.4793177590591935, 'bull_time_stop': 159, 'bull_use_sma': False, 'bull_use_ema': False, 'bull_use_atr': True, 'bull_use_adx': True, 'bull_use_spike': False, 'bull_rsi_required': False, 'bear_strategy': 'mean_reversion', 'bear_bb_std_mult': 1.2554149625900703, 'bear_rsi_os': 22, 'bear_rsi_ob': 78, 'bear_adx_thresh': 6.772510179050533, 'bear_atr_min_pct': 0.008919860097569147, 'bear_atr_max_pct': 0.023012886858067662, 'bear_tp_mult': 2.754727079287541, 'bear_tsl_mult': 0.5659676133722041, 'bear_time_stop': 26, 'bear_use_sma': True, 'bear_use_ema': False, 'bear_use_atr': False, 'bear_use_adx': False, 'bear_use_spike': False, 'bear_rsi_required': False, 'sideways_strategy': 'mean_reversion', 'sideways_bb_std_mult': 3.498345473246335, 'sideways_rsi_os': 26, 'sideways_rsi_ob': 91, 'sideways_adx_thresh': 31.21467311221454, 'sideways_atr_min_pct': 0.02545372384330776, 'sideways_atr_max_pct': 0.1447972788643304, 'sideways_tp_mult': 1.0895741250586601, 'sideways_tsl_mult': 0.6423248120199304, 'sideways_time_stop': 177, 'sideways_use_sma': True, 'sideways_use_ema': False, 'sideways_use_atr': True, 'sideways_use_adx': False, 'sideways_use_spike': False, 'sideways_rsi_required': False}.
