[I 2025-08-31 02:20:12,568] Trial 458 finished with values: [-1000000000.0, 1000000000.0] and parameters: {'p_sma': 52, 'p_std': 40, 'p_atr': 21, 'p_adx': 18, 'rsi_period': 42, 'ema1': 8, 'ema2': 12, 'slip_atr_k': 0.043791071833248034, 'slip_spread_k': 0.2337478808621501, 'spread_hl_frac': 0.002110382706864762, 'bb_std_mult': 1.8096554132104112, 'rsi_os': 54, 'rsi_ob': 79, 'vol_spike': 0.11271864844811416, 'adx_thresh': 12.217308876959533, 'atr_min_pct': 0.01816027172030301, 'atr_max_pct': 0.07258342143375181, 'tp_mult': 2.398708104922803, 'tsl_mult': 0.890970766690607, 'strategy': 'breakout', 'time_stop': 254, 'use_sma': True, 'use_atr': False, 'use_adx': False, 'use_ema': True, 'use_spike': False, 'rsi_required': False, 'edge_k': 0.7784201786654443, 'edge_cap': 0.8535922616307815, 'bull_strategy': 'mean_reversion', 'bull_bb_std_mult': 2.797464746003171, 'bull_rsi_os': 36, 'bull_rsi_ob': 95, 'bull_adx_thresh': 34.24631624685503, 'bull_atr_min_pct': 0.014224243938768054, 'bull_atr_max_pct': 0.042337759987436524, 'bull_tp_mult': 1.5666053379924438, 'bull_tsl_mult': 0.36053515904809785, 'bull_time_stop': 157, 'bull_use_sma': False, 'bull_use_ema': False, 'bull_use_atr': True, 'bull_use_adx': False, 'bull_use_spike': True, 'bull_rsi_required': False, 'bear_strategy': 'mean_reversion', 'bear_bb_std_mult': 1.822732329097025, 'bear_rsi_os': 9, 'bear_rsi_ob': 80, 'bear_adx_thresh': 6.760111929957956, 'bear_atr_min_pct': 0.004630911937768066, 'bear_atr_max_pct': 0.06519539025971344, 'bear_tp_mult': 1.8438526803422701, 'bear_tsl_mult': 0.4722101062413213, 'bear_time_stop': 24, 'bear_use_sma': True, 'bear_use_ema': False, 'bear_use_atr': False, 'bear_use_adx': True, 'bear_use_spike': False, 'bear_rsi_required': False, 'sideways_strategy': 'mean_reversion', 'sideways_bb_std_mult': 0.7591860102238939, 'sideways_rsi_os': 12, 'sideways_rsi_ob': 89, 'sideways_adx_thresh': 13.94731526330083, 'sideways_atr_min_pct': 0.020663053217934577, 'sideways_atr_max_pct': 0.1413945627733481, 'sideways_tp_mult': 1.045657069721809, 'sideways_tsl_mult': 0.07826389341085133, 'sideways_time_stop': 194, 'sideways_use_sma': True, 'sideways_use_ema': False, 'sideways_use_atr': False, 'sideways_use_adx': False, 'sideways_use_spike': True, 'sideways_rsi_required': False}.
[I 2025-08-31 02:20:12,803] Trial 461 finished with values: [-1000000000.0, 1000000000.0] and parameters: {'p_sma': 52, 'p_std': 37, 'p_atr': 21, 'p_adx': 8, 'rsi_period': 54, 'ema1': 6, 'ema2': 19, 'slip_atr_k': 0.20917199891237262, 'slip_spread_k': 0.16350629813793244, 'spread_hl_frac': 0.00419009241456858, 'bb_std_mult': 1.8407954848518921, 'rsi_os': 35, 'rsi_ob': 58, 'vol_spike': 0.1942054851071226, 'adx_thresh': 12.009315707253657, 'atr_min_pct': 0.006939879286911234, 'atr_max_pct': 0.073012683492736, 'tp_mult': 1.9512420276075249, 'tsl_mult': 0.13894696143872515, 'strategy': 'breakout', 'time_stop': 159, 'use_sma': True, 'use_atr': False, 'use_adx': False, 'use_ema': True, 'use_spike': False, 'rsi_required': False, 'edge_k': 0.7758345069054107, 'edge_cap': 0.762711687851299, 'bull_strategy': 'breakout', 'bull_bb_std_mult': 2.6978916046064247, 'bull_rsi_os': 37, 'bull_rsi_ob': 67, 'bull_adx_thresh': 32.07681554046043, 'bull_atr_min_pct': 0.000504379558239471, 'bull_atr_max_pct': 0.0804730832199334, 'bull_tp_mult': 2.50314025634302, 'bull_tsl_mult': 0.2949854291135628, 'bull_time_stop': 86, 'bull_use_sma': False, 'bull_use_ema': False, 'bull_use_atr': True, 'bull_use_adx': True, 'bull_use_spike': False, 'bull_rsi_required': True, 'bear_strategy': 'mean_reversion', 'bear_bb_std_mult': 0.9935797194020692, 'bear_rsi_os': 22, 'bear_rsi_ob': 78, 'bear_adx_thresh': 6.4479341958887435, 'bear_atr_min_pct': 0.008341517502095361, 'bear_atr_max_pct': 0.07383831534293328, 'bear_tp_mult': 1.8636322001381789, 'bear_tsl_mult': 0.04033782620402959, 'bear_time_stop': 240, 'bear_use_sma': True, 'bear_use_ema': False, 'bear_use_atr': True, 'bear_use_adx': True, 'bear_use_spike': False, 'bear_rsi_required': True, 'sideways_strategy': 'mean_reversion', 'sideways_bb_std_mult': 1.5457156165373478, 'sideways_rsi_os': 44, 'sideways_rsi_ob': 92, 'sideways_adx_thresh': 11.039533822366467, 'sideways_atr_min_pct': 0.020632406057193853, 'sideways_atr_max_pct': 0.13203831380341977, 'sideways_tp_mult': 1.0400028117189606, 'sideways_tsl_mult': 0.7402462522284791, 'sideways_time_stop': 38, 'sideways_use_sma': True, 'sideways_use_ema': False, 'sideways_use_atr': False, 'sideways_use_adx': False, 'sideways_use_spike': True, 'sideways_rsi_required': False}.
[I 2025-08-31 02:20:12,913] Trial 460 finished with values: [-1000000000.0, 1000000000.0] and parameters: {'p_sma': 9, 'p_std': 21, 'p_atr': 8, 'p_adx': 8, 'rsi_period': 54, 'ema1': 8, 'ema2': 60, 'slip_atr_k': 0.044960650964452224, 'slip_spread_k': 0.47009594946498057, 'spread_hl_frac': 0.030284338100561775, 'bb_std_mult': 1.8282266764902035, 'rsi_os': 34, 'rsi_ob': 70, 'vol_spike': 0.103841470402507, 'adx_thresh': 12.439333040073823, 'atr_min_pct': 0.028998502104972214, 'atr_max_pct': 0.07217188127191376, 'tp_mult': 1.5512442720243338, 'tsl_mult': 0.11819533918033642, 'strategy': 'breakout', 'time_stop': 254, 'use_sma': True, 'use_atr': False, 'use_adx': False, 'use_ema': True, 'use_spike': False, 'rsi_required': False, 'edge_k': 1.5558906873083407, 'edge_cap': 0.7550397313069352, 'bull_strategy': 'breakout', 'bull_bb_std_mult': 2.7931726144051647, 'bull_rsi_os': 18, 'bull_rsi_ob': 95, 'bull_adx_thresh': 13.993692255948854, 'bull_atr_min_pct': 0.014261890413784645, 'bull_atr_max_pct': 0.08097038490590974, 'bull_tp_mult': 2.5079461735310105, 'bull_tsl_mult': 0.9265127965504142, 'bull_time_stop': 67, 'bull_use_sma': False, 'bull_use_ema': True, 'bull_use_atr': True, 'bull_use_adx': True, 'bull_use_spike': False, 'bull_rsi_required': False, 'bear_strategy': 'mean_reversion', 'bear_bb_std_mult': 2.27157828672236, 'bear_rsi_os': 22, 'bear_rsi_ob': 82, 'bear_adx_thresh': 6.516103674766146, 'bear_atr_min_pct': 0.010929815186941961, 'bear_atr_max_pct': 0.05142751925909261, 'bear_tp_mult': 1.148625596880307, 'bear_tsl_mult': 0.7701295041145735, 'bear_time_stop': 73, 'bear_use_sma': True, 'bear_use_ema': False, 'bear_use_atr': False, 'bear_use_adx': True, 'bear_use_spike': False, 'bear_rsi_required': False, 'sideways_strategy': 'mean_reversion', 'sideways_bb_std_mult': 1.1359960652884162, 'sideways_rsi_os': 18, 'sideways_rsi_ob': 90, 'sideways_adx_thresh': 11.023403733126385, 'sideways_atr_min_pct': 0.006010626190749959, 'sideways_atr_max_pct': 0.13284822945258962, 'sideways_tp_mult': 1.0375452991637533, 'sideways_tsl_mult': 0.23167567583363646, 'sideways_time_stop': 194, 'sideways_use_sma': True, 'sideways_use_ema': False, 'sideways_use_atr': False, 'sideways_use_adx': False, 'sideways_use_spike': True, 'sideways_rsi_required': False}.
[I 2025-08-31 02:20:13,489] Trial 462 finished with values: [-1000000000.0, 1000000000.0] and parameters: {'p_sma': 34, 'p_std': 21, 'p_atr': 17, 'p_adx': 8, 'rsi_period': 55, 'ema1': 6, 'ema2': 14, 'slip_atr_k': 0.1571676723192948, 'slip_spread_k': 0.47118883758628, 'spread_hl_frac': 0.0380238619209968, 'bb_std_mult': 1.8758004573067872, 'rsi_os': 51, 'rsi_ob': 47, 'vol_spike': 0.2876926619396195, 'adx_thresh': 12.123979032764693, 'atr_min_pct': 0.007018570686969285, 'atr_max_pct': 0.07249632584823652, 'tp_mult': 2.5372874795327367, 'tsl_mult': 0.060040313895246555, 'strategy': 'mean_reversion', 'time_stop': 158, 'use_sma': True, 'use_atr': False, 'use_adx': False, 'use_ema': True, 'use_spike': True, 'rsi_required': False, 'edge_k': 1.561619757397243, 'edge_cap': 0.7629323744002803, 'bull_strategy': 'breakout', 'bull_bb_std_mult': 2.68857090360872, 'bull_rsi_os': 36, 'bull_rsi_ob': 67, 'bull_adx_thresh': 14.081376061663528, 'bull_atr_min_pct': 0.018327528166312307, 'bull_atr_max_pct': 0.08043552865567748, 'bull_tp_mult': 1.6319659408773783, 'bull_tsl_mult': 0.3166892866878096, 'bull_time_stop': 165, 'bull_use_sma': False, 'bull_use_ema': False, 'bull_use_atr': True, 'bull_use_adx': True, 'bull_use_spike': False, 'bull_rsi_required': True, 'bear_strategy': 'mean_reversion', 'bear_bb_std_mult': 1.4891937800711852, 'bear_rsi_os': 37, 'bear_rsi_ob': 78, 'bear_adx_thresh': 6.393106788448642, 'bear_atr_min_pct': 0.01085869395416798, 'bear_atr_max_pct': 0.043480672144569424, 'bear_tp_mult': 2.0299784084121804, 'bear_tsl_mult': 0.7233928817735428, 'bear_time_stop': 24, 'bear_use_sma': True, 'bear_use_ema': True, 'bear_use_atr': True, 'bear_use_adx': False, 'bear_use_spike': False, 'bear_rsi_required': True, 'sideways_strategy': 'mean_reversion', 'sideways_bb_std_mult': 1.6108278203876718, 'sideways_rsi_os': 47, 'sideways_rsi_ob': 78, 'sideways_adx_thresh': 13.064418766574132, 'sideways_atr_min_pct': 0.008632851561602628, 'sideways_atr_max_pct': 0.14449651667655855, 'sideways_tp_mult': 1.1095484882099558, 'sideways_tsl_mult': 0.703454299100326, 'sideways_time_stop': 37, 'sideways_use_sma': True, 'sideways_use_ema': False, 'sideways_use_atr': False, 'sideways_use_adx': False, 'sideways_use_spike': True, 'sideways_rsi_required': False}.
[I 2025-08-31 02:20:13,997] Trial 466 finished with values: [-1000000000.0, 1000000000.0] and parameters: {'p_sma': 22, 'p_std': 38, 'p_atr': 23, 'p_adx': 24, 'rsi_period': 29, 'ema1': 7, 'ema2': 20, 'slip_atr_k': 0.061014175115252714, 'slip_spread_k': 0.26440246701619724, 'spread_hl_frac': 0.009010932248123502, 'bb_std_mult': 1.9095041407627524, 'rsi_os': 52, 'rsi_ob': 77, 'vol_spike': 0.14130099571056542, 'adx_thresh': 10.88060649630137, 'atr_min_pct': 0.01243355769057115, 'atr_max_pct': 0.06472932396053202, 'tp_mult': 2.6244405549615966, 'tsl_mult': 0.647838734049135, 'strategy': 'mean_reversion', 'time_stop': 87, 'use_sma': True, 'use_atr': False, 'use_adx': False, 'use_ema': False, 'use_spike': True, 'rsi_required': False, 'edge_k': 0.6806126242688175, 'edge_cap': 0.7835722514019262, 'bull_strategy': 'breakout', 'bull_bb_std_mult': 1.3469940683341888, 'bull_rsi_os': 40, 'bull_rsi_ob': 48, 'bull_adx_thresh': 16.535858735493445, 'bull_atr_min_pct': 0.005366888763022524, 'bull_atr_max_pct': 0.025536498650203326, 'bull_tp_mult': 2.312193579375072, 'bull_tsl_mult': 0.5686234571674862, 'bull_time_stop': 46, 'bull_use_sma': False, 'bull_use_ema': False, 'bull_use_atr': False, 'bull_use_adx': True, 'bull_use_spike': False, 'bull_rsi_required': False, 'bear_strategy': 'mean_reversion', 'bear_bb_std_mult': 2.5632278227895355, 'bear_rsi_os': 21, 'bear_rsi_ob': 53, 'bear_adx_thresh': 7.883177569693725, 'bear_atr_min_pct': 0.027879867499502265, 'bear_atr_max_pct': 0.04219451674376758, 'bear_tp_mult': 1.2218806873719799, 'bear_tsl_mult': 0.13754351751652588, 'bear_time_stop': 88, 'bear_use_sma': False, 'bear_use_ema': True, 'bear_use_atr': False, 'bear_use_adx': False, 'bear_use_spike': False, 'bear_rsi_required': False, 'sideways_strategy': 'breakout', 'sideways_bb_std_mult': 2.9767738203166205, 'sideways_rsi_os': 48, 'sideways_rsi_ob': 75, 'sideways_adx_thresh': 12.447675117703962, 'sideways_atr_min_pct': 0.021698945950898316, 'sideways_atr_max_pct': 0.0924039964315827, 'sideways_tp_mult': 1.1045840122020227, 'sideways_tsl_mult': 0.6974627783400342, 'sideways_time_stop': 150, 'sideways_use_sma': False, 'sideways_use_ema': False, 'sideways_use_atr': False, 'sideways_use_adx': False, 'sideways_use_spike': True, 'sideways_rsi_required': True}.
[I 2025-08-31 02:20:43,721] Trial 465 finished with values: [-1000000000.0, 1000000000.0] and parameters: {'p_sma': 48, 'p_std': 38, 'p_atr': 7, 'p_adx': 24, 'rsi_period': 29, 'ema1': 6, 'ema2': 18, 'slip_atr_k': 0.20255439532861852, 'slip_spread_k': 0.8701592794561723, 'spread_hl_frac': 0.03813014741299554, 'bb_std_mult': 1.8762739899408019, 'rsi_os': 32, 'rsi_ob': 77, 'vol_spike': 0.22197457590804665, 'adx_thresh': 19.026008806040824, 'atr_min_pct': 0.012323496131397545, 'atr_max_pct': 0.06531025230033594, 'tp_mult': 2.622130293872092, 'tsl_mult': 0.8558116650005769, 'strategy': 'mean_reversion', 'time_stop': 66, 'use_sma': True, 'use_atr': False, 'use_adx': False, 'use_ema': False, 'use_spike': True, 'rsi_required': False, 'edge_k': 0.7176655207888245, 'edge_cap': 0.793057518144864, 'bull_strategy': 'breakout', 'bull_bb_std_mult': 1.3545228805914986, 'bull_rsi_os': 40, 'bull_rsi_ob': 85, 'bull_adx_thresh': 10.010830183338763, 'bull_atr_min_pct': 0.018266284587833363, 'bull_atr_max_pct': 0.11904921673599622, 'bull_tp_mult': 2.4573826050845478, 'bull_tsl_mult': 0.8827690056214823, 'bull_time_stop': 167, 'bull_use_sma': False, 'bull_use_ema': False, 'bull_use_atr': False, 'bull_use_adx': True, 'bull_use_spike': False, 'bull_rsi_required': True, 'bear_strategy': 'mean_reversion', 'bear_bb_std_mult': 1.4699086462024202, 'bear_rsi_os': 19, 'bear_rsi_ob': 67, 'bear_adx_thresh': 20.27921998961818, 'bear_atr_min_pct': 0.00010433904912853821, 'bear_atr_max_pct': 0.060123974074508924, 'bear_tp_mult': 2.0337293809881496, 'bear_tsl_mult': 0.33673964655953426, 'bear_time_stop': 95, 'bear_use_sma': False, 'bear_use_ema': True, 'bear_use_atr': True, 'bear_use_adx': False, 'bear_use_spike': False, 'bear_rsi_required': True, 'sideways_strategy': 'breakout', 'sideways_bb_std_mult': 3.5939759467410455, 'sideways_rsi_os': 47, 'sideways_rsi_ob': 55, 'sideways_adx_thresh': 24.00909177391776, 'sideways_atr_min_pct': 0.02587256573041749, 'sideways_atr_max_pct': 0.12357622874555446, 'sideways_tp_mult': 2.768395901853869, 'sideways_tsl_mult': 0.6987839695690248, 'sideways_time_stop': 133, 'sideways_use_sma': True, 'sideways_use_ema': False, 'sideways_use_atr': False, 'sideways_use_adx': False, 'sideways_use_spike': True, 'sideways_rsi_required': True}.
[I 2025-08-31 02:20:43,953] Trial 463 finished with values: [-1000000000.0, 1000000000.0] and parameters: {'p_sma': 47, 'p_std': 21, 'p_atr': 8, 'p_adx': 8, 'rsi_period': 54, 'ema1': 30, 'ema2': 42, 'slip_atr_k': 0.15376005076645863, 'slip_spread_k': 0.03257783146312537, 'spread_hl_frac': 0.04795876902757514, 'bb_std_mult': 1.8868296889724854, 'rsi_os': 31, 'rsi_ob': 77, 'vol_spike': 0.22450907451531432, 'adx_thresh': 18.910149254319574, 'atr_min_pct': 0.012155067113634477, 'atr_max_pct': 0.10154024840130081, 'tp_mult': 2.6277546658493205, 'tsl_mult': 0.13947000245928803, 'strategy': 'mean_reversion', 'time_stop': 213, 'use_sma': True, 'use_atr': False, 'use_adx': False, 'use_ema': True, 'use_spike': True, 'rsi_required': False, 'edge_k': 0.7276774289311077, 'edge_cap': 0.7607482639172397, 'bull_strategy': 'breakout', 'bull_bb_std_mult': 1.3574612682517269, 'bull_rsi_os': 25, 'bull_rsi_ob': 67, 'bull_adx_thresh': 31.868722484719363, 'bull_atr_min_pct': 0.018354434918324877, 'bull_atr_max_pct': 0.08141236666357675, 'bull_tp_mult': 2.5068172317213633, 'bull_tsl_mult': 0.5669540325251705, 'bull_time_stop': 93, 'bull_use_sma': False, 'bull_use_ema': False, 'bull_use_atr': True, 'bull_use_adx': True, 'bull_use_spike': False, 'bull_rsi_required': True, 'bear_strategy': 'mean_reversion', 'bear_bb_std_mult': 0.9964596160894443, 'bear_rsi_os': 7, 'bear_rsi_ob': 85, 'bear_adx_thresh': 7.669789812658778, 'bear_atr_min_pct': 0.006933862192517834, 'bear_atr_max_pct': 0.0746277712543292, 'bear_tp_mult': 2.373543336019801, 'bear_tsl_mult': 0.7707483059302737, 'bear_time_stop': 22, 'bear_use_sma': True, 'bear_use_ema': True, 'bear_use_atr': True, 'bear_use_adx': False, 'bear_use_spike': False, 'bear_rsi_required': True, 'sideways_strategy': 'breakout', 'sideways_bb_std_mult': 1.157179814699683, 'sideways_rsi_os': 18, 'sideways_rsi_ob': 78, 'sideways_adx_thresh': 25.466801400118293, 'sideways_atr_min_pct': 0.02073611879670825, 'sideways_atr_max_pct': 0.02678072635938937, 'sideways_tp_mult': 1.1127500506153305, 'sideways_tsl_mult': 0.22841056491774925, 'sideways_time_stop': 139, 'sideways_use_sma': True, 'sideways_use_ema': False, 'sideways_use_atr': False, 'sideways_use_adx': False, 'sideways_use_spike': True, 'sideways_rsi_required': False}.
[I 2025-08-31 02:20:44,129] Trial 464 finished with values: [-1000000000.0, 1000000000.0] and parameters: {'p_sma': 22, 'p_std': 21, 'p_atr': 8, 'p_adx': 23, 'rsi_period': 59, 'ema1': 30, 'ema2': 14, 'slip_atr_k': 0.15565616514284694, 'slip_spread_k': 0.48195526462740934, 'spread_hl_frac': 0.006381921253323319, 'bb_std_mult': 1.883428643705206, 'rsi_os': 18, 'rsi_ob': 77, 'vol_spike': 0.17317744650915295, 'adx_thresh': 13.848837621898463, 'atr_min_pct': 0.02009325980899275, 'atr_max_pct': 0.09610056042693974, 'tp_mult': 2.534860599852706, 'tsl_mult': 0.1793173905109047, 'strategy': 'mean_reversion', 'time_stop': 212, 'use_sma': True, 'use_atr': False, 'use_adx': False, 'use_ema': True, 'use_spike': True, 'rsi_required': False, 'edge_k': 0.7092145615870884, 'edge_cap': 0.6673686825942008, 'bull_strategy': 'breakout', 'bull_bb_std_mult': 2.661646074270281, 'bull_rsi_os': 41, 'bull_rsi_ob': 76, 'bull_adx_thresh': 13.655421912873484, 'bull_atr_min_pct': 0.001343858818775887, 'bull_atr_max_pct': 0.013422460519015397, 'bull_tp_mult': 2.5368729643698, 'bull_tsl_mult': 0.2654151371037582, 'bull_time_stop': 166, 'bull_use_sma': False, 'bull_use_ema': True, 'bull_use_atr': True, 'bull_use_adx': True, 'bull_use_spike': False, 'bull_rsi_required': False, 'bear_strategy': 'mean_reversion', 'bear_bb_std_mult': 1.4880801317707975, 'bear_rsi_os': 23, 'bear_rsi_ob': 53, 'bear_adx_thresh': 7.6891152416547595, 'bear_atr_min_pct': 0.0093371449937865, 'bear_atr_max_pct': 0.043193384115857554, 'bear_tp_mult': 2.03074285995775, 'bear_tsl_mult': 0.7210813569386904, 'bear_time_stop': 72, 'bear_use_sma': True, 'bear_use_ema': True, 'bear_use_atr': True, 'bear_use_adx': False, 'bear_use_spike': False, 'bear_rsi_required': False, 'sideways_strategy': 'breakout', 'sideways_bb_std_mult': 1.2022154864669081, 'sideways_rsi_os': 29, 'sideways_rsi_ob': 60, 'sideways_adx_thresh': 25.476642746760053, 'sideways_atr_min_pct': 0.00732252364226548, 'sideways_atr_max_pct': 0.14360825967642846, 'sideways_tp_mult': 2.761162881719327, 'sideways_tsl_mult': 0.7033638581402557, 'sideways_time_stop': 138, 'sideways_use_sma': True, 'sideways_use_ema': False, 'sideways_use_atr': False, 'sideways_use_adx': False, 'sideways_use_spike': True, 'sideways_rsi_required': False}.
[I 2025-08-31 02:20:46,361] Trial 467 finished with values: [-0.017980347478417924, 0.017901443817200574] and parameters: {'p_sma': 48, 'p_std': 14, 'p_atr': 7, 'p_adx': 22, 'rsi_period': 59, 'ema1': 7, 'ema2': 47, 'slip_atr_k': 0.023852493932150796, 'slip_spread_k': 0.20001521842716494, 'spread_hl_frac': 0.009876835825299107, 'bb_std_mult': 1.7823005220086803, 'rsi_os': 31, 'rsi_ob': 69, 'vol_spike': 0.2195151838732204, 'adx_thresh': 13.842823748059788, 'atr_min_pct': 0.020056513102752648, 'atr_max_pct': 0.06957880216851219, 'tp_mult': 2.144830321309969, 'tsl_mult': 0.16503116322856612, 'strategy': 'breakout', 'time_stop': 209, 'use_sma': False, 'use_atr': False, 'use_adx': True, 'use_ema': True, 'use_spike': False, 'rsi_required': False, 'edge_k': 0.7292668032088058, 'edge_cap': 0.799378289391395, 'bull_strategy': 'breakout', 'bull_bb_std_mult': 2.637559237168528, 'bull_rsi_os': 41, 'bull_rsi_ob': 70, 'bull_adx_thresh': 24.016886477023334, 'bull_atr_min_pct': 5.08513832509713e-05, 'bull_atr_max_pct': 0.07362541618133098, 'bull_tp_mult': 2.470250522850447, 'bull_tsl_mult': 0.2574739324890109, 'bull_time_stop': 169, 'bull_use_sma': False, 'bull_use_ema': True, 'bull_use_atr': True, 'bull_use_adx': True, 'bull_use_spike': False, 'bull_rsi_required': False, 'bear_strategy': 'mean_reversion', 'bear_bb_std_mult': 1.5687774780986823, 'bear_rsi_os': 19, 'bear_rsi_ob': 49, 'bear_adx_thresh': 20.25937300971869, 'bear_atr_min_pct': 0.009470134631180762, 'bear_atr_max_pct': 0.07039624353629972, 'bear_tp_mult': 2.1388109535974755, 'bear_tsl_mult': 0.6480748291029603, 'bear_time_stop': 131, 'bear_use_sma': True, 'bear_use_ema': False, 'bear_use_atr': False, 'bear_use_adx': True, 'bear_use_spike': False, 'bear_rsi_required': False, 'sideways_strategy': 'breakout', 'sideways_bb_std_mult': 1.188837821947146, 'sideways_rsi_os': 20, 'sideways_rsi_ob': 88, 'sideways_adx_thresh': 25.639402335952514, 'sideways_atr_min_pct': 0.00726538560955713, 'sideways_atr_max_pct': 0.13719730424122256, 'sideways_tp_mult': 1.1102454497485155, 'sideways_tsl_mult': 0.12729230557254212, 'sideways_time_stop': 132, 'sideways_use_sma': True, 'sideways_use_ema': True, 'sideways_use_atr': False, 'sideways_use_adx': True, 'sideways_use_spike': True, 'sideways_rsi_required': False}.
