[I 2025-08-31 00:13:05,070] Trial 87 finished with values: [-1000000000.0, 1000000000.0] and parameters: {'p_sma': 16, 'p_std': 34, 'p_atr': 12, 'p_adx': 16, 'rsi_period': 78, 'ema1': 26, 'ema2': 55, 'slip_atr_k': 0.041288188480743254, 'slip_spread_k': 0.4666957978186918, 'spread_hl_frac': 0.0027093101578588735, 'bb_std_mult': 3.422886896357867, 'rsi_os': 15, 'rsi_ob': 84, 'vol_spike': 0.16013895230148018, 'adx_thresh': 22.283851638329246, 'atr_min_pct': 0.007957189990080403, 'atr_max_pct': 0.11427084077400484, 'tp_mult': 2.4184555449122516, 'tsl_mult': 0.11669014004314526, 'strategy': 'mean_reversion', 'time_stop': 152, 'use_sma': True, 'use_atr': False, 'use_adx': False, 'use_ema': False, 'use_spike': False, 'rsi_required': True, 'edge_k': 1.7759256972738713, 'edge_cap': 0.8270593985079718, 'bull_strategy': 'breakout', 'bull_bb_std_mult': 1.982240494966832, 'bull_rsi_os': 16, 'bull_rsi_ob': 70, 'bull_adx_thresh': 9.329411762349304, 'bull_atr_min_pct': 0.012713262909476483, 'bull_atr_max_pct': 0.08886559372691345, 'bull_tp_mult': 1.9514279798881273, 'bull_tsl_mult': 0.4967814853319962, 'bull_time_stop': 124, 'bull_use_sma': False, 'bull_use_ema': True, 'bull_use_atr': False, 'bull_use_adx': True, 'bull_use_spike': False, 'bull_rsi_required': False, 'bear_strategy': 'breakout', 'bear_bb_std_mult': 0.559623336501888, 'bear_rsi_os': 24, 'bear_rsi_ob': 93, 'bear_adx_thresh': 31.150970707284277, 'bear_atr_min_pct': 0.011873432404718609, 'bear_atr_max_pct': 0.13772537441331134, 'bear_tp_mult': 2.610365776278139, 'bear_tsl_mult': 0.15879020014812872, 'bear_time_stop': 182, 'bear_use_sma': False, 'bear_use_ema': False, 'bear_use_atr': False, 'bear_use_adx': True, 'bear_use_spike': False, 'bear_rsi_required': False, 'sideways_strategy': 'breakout', 'sideways_bb_std_mult': 1.0462528221850445, 'sideways_rsi_os': 25, 'sideways_rsi_ob': 67, 'sideways_adx_thresh': 27.123002226322864, 'sideways_atr_min_pct': 0.013337913141676844, 'sideways_atr_max_pct': 0.06754123143684121, 'sideways_tp_mult': 1.7021724905742632, 'sideways_tsl_mult': 0.11240274455308696, 'sideways_time_stop': 100, 'sideways_use_sma': False, 'sideways_use_ema': False, 'sideways_use_atr': False, 'sideways_use_adx': False, 'sideways_use_spike': True, 'sideways_rsi_required': True}.
[I 2025-08-31 00:13:39,892] Trial 92 finished with values: [-1000000000.0, 1000000000.0] and parameters: {'p_sma': 41, 'p_std': 35, 'p_atr': 13, 'p_adx': 9, 'rsi_period': 67, 'ema1': 24, 'ema2': 20, 'slip_atr_k': 0.06571240187410739, 'slip_spread_k': 0.23300485672910975, 'spread_hl_frac': 0.014421628594748024, 'bb_std_mult': 3.488510295897704, 'rsi_os': 51, 'rsi_ob': 75, 'vol_spike': 0.014752651105451514, 'adx_thresh': 20.330843998770668, 'atr_min_pct': 6.052363421778683e-05, 'atr_max_pct': 0.09159278158068161, 'tp_mult': 2.605681080923037, 'tsl_mult': 0.16859050682537635, 'strategy': 'breakout', 'time_stop': 144, 'use_sma': True, 'use_atr': False, 'use_adx': True, 'use_ema': True, 'use_spike': True, 'rsi_required': False, 'edge_k': 0.804152567906447, 'edge_cap': 0.8326623494431599, 'bull_strategy': 'breakout', 'bull_bb_std_mult': 1.968851932165932, 'bull_rsi_os': 39, 'bull_rsi_ob': 71, 'bull_adx_thresh': 18.219849339824876, 'bull_atr_min_pct': 0.0016264677470133103, 'bull_atr_max_pct': 0.10448686089295897, 'bull_tp_mult': 2.890068436627367, 'bull_tsl_mult': 0.3112843918606785, 'bull_time_stop': 156, 'bull_use_sma': False, 'bull_use_ema': True, 'bull_use_atr': False, 'bull_use_adx': True, 'bull_use_spike': False, 'bull_rsi_required': False, 'bear_strategy': 'breakout', 'bear_bb_std_mult': 0.8806038735441494, 'bear_rsi_os': 34, 'bear_rsi_ob': 82, 'bear_adx_thresh': 20.331597667760608, 'bear_atr_min_pct': 0.009309666020663425, 'bear_atr_max_pct': 0.13176407197154677, 'bear_tp_mult': 2.0006739407418186, 'bear_tsl_mult': 0.014648278890764338, 'bear_time_stop': 205, 'bear_use_sma': False, 'bear_use_ema': True, 'bear_use_atr': True, 'bear_use_adx': True, 'bear_use_spike': False, 'bear_rsi_required': True, 'sideways_strategy': 'mean_reversion', 'sideways_bb_std_mult': 1.254702643780882, 'sideways_rsi_os': 38, 'sideways_rsi_ob': 50, 'sideways_adx_thresh': 13.011981951491075, 'sideways_atr_min_pct': 0.021501488469252702, 'sideways_atr_max_pct': 0.1375732362849132, 'sideways_tp_mult': 1.3380191415306943, 'sideways_tsl_mult': 0.21081085012171485, 'sideways_time_stop': 98, 'sideways_use_sma': False, 'sideways_use_ema': False, 'sideways_use_atr': False, 'sideways_use_adx': False, 'sideways_use_spike': True, 'sideways_rsi_required': False}.
[I 2025-08-31 00:13:40,244] Trial 94 finished with values: [-1000000000.0, 1000000000.0] and parameters: {'p_sma': 51, 'p_std': 44, 'p_atr': 29, 'p_adx': 7, 'rsi_period': 52, 'ema1': 24, 'ema2': 20, 'slip_atr_k': 0.0298119211079238, 'slip_spread_k': 0.03143546144408374, 'spread_hl_frac': 0.021030256237035302, 'bb_std_mult': 3.5004059937108036, 'rsi_os': 51, 'rsi_ob': 75, 'vol_spike': 0.009652250519742861, 'adx_thresh': 9.812431662732752, 'atr_min_pct': 0.00010561110288937426, 'atr_max_pct': 0.0704460907742711, 'tp_mult': 2.5081087723934283, 'tsl_mult': 0.1644559915086762, 'strategy': 'breakout', 'time_stop': 42, 'use_sma': True, 'use_atr': False, 'use_adx': True, 'use_ema': True, 'use_spike': True, 'rsi_required': True, 'edge_k': 0.4931457979981581, 'edge_cap': 0.9240324951426628, 'bull_strategy': 'breakout', 'bull_bb_std_mult': 2.1291629627270914, 'bull_rsi_os': 31, 'bull_rsi_ob': 58, 'bull_adx_thresh': 14.070871722093722, 'bull_atr_min_pct': 0.02254588012421924, 'bull_atr_max_pct': 0.09918232939278886, 'bull_tp_mult': 2.8845780715066995, 'bull_tsl_mult': 0.13129010800109187, 'bull_time_stop': 209, 'bull_use_sma': False, 'bull_use_ema': True, 'bull_use_atr': False, 'bull_use_adx': True, 'bull_use_spike': False, 'bull_rsi_required': False, 'bear_strategy': 'breakout', 'bear_bb_std_mult': 0.640646776268153, 'bear_rsi_os': 25, 'bear_rsi_ob': 78, 'bear_adx_thresh': 23.953557181364346, 'bear_atr_min_pct': 0.009275424525685149, 'bear_atr_max_pct': 0.12983312651410692, 'bear_tp_mult': 1.9826608668507193, 'bear_tsl_mult': 0.051851039277122396, 'bear_time_stop': 10, 'bear_use_sma': True, 'bear_use_ema': True, 'bear_use_atr': True, 'bear_use_adx': True, 'bear_use_spike': True, 'bear_rsi_required': False, 'sideways_strategy': 'mean_reversion', 'sideways_bb_std_mult': 1.2734462935628916, 'sideways_rsi_os': 44, 'sideways_rsi_ob': 66, 'sideways_adx_thresh': 13.240781654870043, 'sideways_atr_min_pct': 0.022306745971509626, 'sideways_atr_max_pct': 0.13837242450436824, 'sideways_tp_mult': 1.3358436110863887, 'sideways_tsl_mult': 0.4099100771430829, 'sideways_time_stop': 99, 'sideways_use_sma': False, 'sideways_use_ema': False, 'sideways_use_atr': False, 'sideways_use_adx': False, 'sideways_use_spike': True, 'sideways_rsi_required': False}.
[I 2025-08-31 00:13:40,245] Trial 93 finished with values: [-1000000000.0, 1000000000.0] and parameters: {'p_sma': 50, 'p_std': 47, 'p_atr': 13, 'p_adx': 9, 'rsi_period': 34, 'ema1': 24, 'ema2': 20, 'slip_atr_k': 0.03984870115814068, 'slip_spread_k': 0.2371709295315383, 'spread_hl_frac': 0.014152524899887064, 'bb_std_mult': 3.476470386593417, 'rsi_os': 51, 'rsi_ob': 84, 'vol_spike': 0.006620265065195308, 'adx_thresh': 10.196850749462353, 'atr_min_pct': 1.5830964427532399e-06, 'atr_max_pct': 0.06968345649943572, 'tp_mult': 2.67809531830602, 'tsl_mult': 0.17956280213257492, 'strategy': 'breakout', 'time_stop': 34, 'use_sma': True, 'use_atr': False, 'use_adx': True, 'use_ema': True, 'use_spike': True, 'rsi_required': True, 'edge_k': 0.2033002376440901, 'edge_cap': 0.9841316471695434, 'bull_strategy': 'breakout', 'bull_bb_std_mult': 2.4128276350278353, 'bull_rsi_os': 32, 'bull_rsi_ob': 66, 'bull_adx_thresh': 15.641845740829872, 'bull_atr_min_pct': 0.01573089178878659, 'bull_atr_max_pct': 0.10590552818324563, 'bull_tp_mult': 2.924836244443654, 'bull_tsl_mult': 0.12556670312580578, 'bull_time_stop': 172, 'bull_use_sma': False, 'bull_use_ema': True, 'bull_use_atr': False, 'bull_use_adx': True, 'bull_use_spike': False, 'bull_rsi_required': False, 'bear_strategy': 'breakout', 'bear_bb_std_mult': 0.5722960468515711, 'bear_rsi_os': 25, 'bear_rsi_ob': 78, 'bear_adx_thresh': 15.045805177347283, 'bear_atr_min_pct': 0.009307339530065812, 'bear_atr_max_pct': 0.13369944853412516, 'bear_tp_mult': 1.9256763432197097, 'bear_tsl_mult': 0.057550830045843965, 'bear_time_stop': 15, 'bear_use_sma': True, 'bear_use_ema': True, 'bear_use_atr': True, 'bear_use_adx': True, 'bear_use_spike': True, 'bear_rsi_required': False, 'sideways_strategy': 'mean_reversion', 'sideways_bb_std_mult': 1.262560042290882, 'sideways_rsi_os': 44, 'sideways_rsi_ob': 66, 'sideways_adx_thresh': 12.746623859036832, 'sideways_atr_min_pct': 0.01865696307800418, 'sideways_atr_max_pct': 0.13656662977871667, 'sideways_tp_mult': 1.3282372118133126, 'sideways_tsl_mult': 0.41748052492980575, 'sideways_time_stop': 59, 'sideways_use_sma': False, 'sideways_use_ema': False, 'sideways_use_atr': False, 'sideways_use_adx': False, 'sideways_use_spike': True, 'sideways_rsi_required': False}.
[I 2025-08-31 00:13:40,368] Trial 91 finished with values: [-1000000000.0, 1000000000.0] and parameters: {'p_sma': 41, 'p_std': 35, 'p_atr': 13, 'p_adx': 9, 'rsi_period': 68, 'ema1': 24, 'ema2': 20, 'slip_atr_k': 0.06697416309674033, 'slip_spread_k': 0.22668493637922443, 'spread_hl_frac': 0.014271058444044454, 'bb_std_mult': 3.470039454586902, 'rsi_os': 42, 'rsi_ob': 49, 'vol_spike': 0.011302631062443955, 'adx_thresh': 6.2501635338515875, 'atr_min_pct': 6.398511304185297e-05, 'atr_max_pct': 0.07114963594699178, 'tp_mult': 2.3929358845762816, 'tsl_mult': 0.9525662476167199, 'strategy': 'breakout', 'time_stop': 144, 'use_sma': True, 'use_atr': False, 'use_adx': True, 'use_ema': True, 'use_spike': True, 'rsi_required': False, 'edge_k': 0.8270922082062552, 'edge_cap': 0.8419026516560955, 'bull_strategy': 'breakout', 'bull_bb_std_mult': 2.1273849664373667, 'bull_rsi_os': 39, 'bull_rsi_ob': 71, 'bull_adx_thresh': 14.178206502489344, 'bull_atr_min_pct': 0.023308084344356758, 'bull_atr_max_pct': 0.10222249221556286, 'bull_tp_mult': 2.9033168843434654, 'bull_tsl_mult': 0.3882518999630299, 'bull_time_stop': 156, 'bull_use_sma': False, 'bull_use_ema': True, 'bull_use_atr': False, 'bull_use_adx': True, 'bull_use_spike': False, 'bull_rsi_required': False, 'bear_strategy': 'breakout', 'bear_bb_std_mult': 0.9187415786011153, 'bear_rsi_os': 24, 'bear_rsi_ob': 82, 'bear_adx_thresh': 21.317020608288914, 'bear_atr_min_pct': 0.009269379906175063, 'bear_atr_max_pct': 0.13007204371684583, 'bear_tp_mult': 1.999425185049585, 'bear_tsl_mult': 0.054481390954535414, 'bear_time_stop': 206, 'bear_use_sma': False, 'bear_use_ema': True, 'bear_use_atr': True, 'bear_use_adx': True, 'bear_use_spike': False, 'bear_rsi_required': True, 'sideways_strategy': 'mean_reversion', 'sideways_bb_std_mult': 1.2933298712675803, 'sideways_rsi_os': 37, 'sideways_rsi_ob': 95, 'sideways_adx_thresh': 13.364813409643466, 'sideways_atr_min_pct': 0.02237955802249518, 'sideways_atr_max_pct': 0.13732578923869804, 'sideways_tp_mult': 1.3285388654672736, 'sideways_tsl_mult': 0.2119191077803621, 'sideways_time_stop': 95, 'sideways_use_sma': False, 'sideways_use_ema': False, 'sideways_use_atr': False, 'sideways_use_adx': False, 'sideways_use_spike': True, 'sideways_rsi_required': False}.
[I 2025-08-31 00:14:11,812] Trial 96 finished with values: [-1000000000.0, 1000000000.0] and parameters: {'p_sma': 53, 'p_std': 38, 'p_atr': 21, 'p_adx': 9, 'rsi_period': 49, 'ema1': 25, 'ema2': 23, 'slip_atr_k': 0.02715499098962861, 'slip_spread_k': 0.12626349403184717, 'spread_hl_frac': 0.022577405863467473, 'bb_std_mult': 3.334604661984884, 'rsi_os': 53, 'rsi_ob': 71, 'vol_spike': 0.02639762822745376, 'adx_thresh': 11.675610825275935, 'atr_min_pct': 0.0017360760885044338, 'atr_max_pct': 0.04797281495073373, 'tp_mult': 1.155610148056191, 'tsl_mult': 0.9404965635261496, 'strategy': 'breakout', 'time_stop': 67, 'use_sma': True, 'use_atr': False, 'use_adx': False, 'use_ema': False, 'use_spike': False, 'rsi_required': True, 'edge_k': 0.8645633335975645, 'edge_cap': 0.9645961599191168, 'bull_strategy': 'breakout', 'bull_bb_std_mult': 2.4485706753020335, 'bull_rsi_os': 37, 'bull_rsi_ob': 50, 'bull_adx_thresh': 17.12523317849877, 'bull_atr_min_pct': 0.0006354720106952864, 'bull_atr_max_pct': 0.08561862472846854, 'bull_tp_mult': 2.794295118665351, 'bull_tsl_mult': 0.0848228644274539, 'bull_time_stop': 183, 'bull_use_sma': False, 'bull_use_ema': True, 'bull_use_atr': False, 'bull_use_adx': True, 'bull_use_spike': True, 'bull_rsi_required': False, 'bear_strategy': 'breakout', 'bear_bb_std_mult': 0.7071821438724051, 'bear_rsi_os': 19, 'bear_rsi_ob': 74, 'bear_adx_thresh': 21.4145264035623, 'bear_atr_min_pct': 0.007799805811505718, 'bear_atr_max_pct': 0.14237599379714552, 'bear_tp_mult': 1.913421962928907, 'bear_tsl_mult': 0.20874206950444749, 'bear_time_stop': 51, 'bear_use_sma': False, 'bear_use_ema': False, 'bear_use_atr': True, 'bear_use_adx': True, 'bear_use_spike': False, 'bear_rsi_required': False, 'sideways_strategy': 'mean_reversion', 'sideways_bb_std_mult': 0.9459256396168358, 'sideways_rsi_os': 47, 'sideways_rsi_ob': 68, 'sideways_adx_thresh': 11.003093421878525, 'sideways_atr_min_pct': 0.02023299154447677, 'sideways_atr_max_pct': 0.13097251103069515, 'sideways_tp_mult': 1.1377236486951816, 'sideways_tsl_mult': 0.5401238556318344, 'sideways_time_stop': 93, 'sideways_use_sma': False, 'sideways_use_ema': False, 'sideways_use_atr': False, 'sideways_use_adx': False, 'sideways_use_spike': True, 'sideways_rsi_required': False}.
[I 2025-08-31 00:14:12,704] Trial 98 finished with values: [-1000000000.0, 1000000000.0] and parameters: {'p_sma': 46, 'p_std': 41, 'p_atr': 15, 'p_adx': 7, 'rsi_period': 44, 'ema1': 25, 'ema2': 23, 'slip_atr_k': 0.02616750565834755, 'slip_spread_k': 0.13786528013428426, 'spread_hl_frac': 0.030765775039699367, 'bb_std_mult': 3.1672694150109884, 'rsi_os': 53, 'rsi_ob': 55, 'vol_spike': 0.024280920130818916, 'adx_thresh': 11.609426186528243, 'atr_min_pct': 0.0014974342286717365, 'atr_max_pct': 0.06688777728141727, 'tp_mult': 2.7179550076249037, 'tsl_mult': 0.23893519751371428, 'strategy': 'breakout', 'time_stop': 5, 'use_sma': False, 'use_atr': False, 'use_adx': False, 'use_ema': False, 'use_spike': False, 'rsi_required': True, 'edge_k': 0.32767111073348953, 'edge_cap': 0.9744521871531875, 'bull_strategy': 'breakout', 'bull_bb_std_mult': 2.337182596075118, 'bull_rsi_os': 27, 'bull_rsi_ob': 57, 'bull_adx_thresh': 16.80615399685651, 'bull_atr_min_pct': 0.000784536323213593, 'bull_atr_max_pct': 0.01664310012820215, 'bull_tp_mult': 2.767172996356412, 'bull_tsl_mult': 0.07969893137401701, 'bull_time_stop': 182, 'bull_use_sma': False, 'bull_use_ema': True, 'bull_use_atr': False, 'bull_use_adx': True, 'bull_use_spike': True, 'bull_rsi_required': False, 'bear_strategy': 'breakout', 'bear_bb_std_mult': 0.7041128238018703, 'bear_rsi_os': 19, 'bear_rsi_ob': 74, 'bear_adx_thresh': 27.855886511988, 'bear_atr_min_pct': 0.007759321196890164, 'bear_atr_max_pct': 0.14213979204838248, 'bear_tp_mult': 1.9026428701207727, 'bear_tsl_mult': 0.4243128126350791, 'bear_time_stop': 52, 'bear_use_sma': False, 'bear_use_ema': False, 'bear_use_atr': True, 'bear_use_adx': True, 'bear_use_spike': False, 'bear_rsi_required': False, 'sideways_strategy': 'mean_reversion', 'sideways_bb_std_mult': 0.8517634828338538, 'sideways_rsi_os': 45, 'sideways_rsi_ob': 69, 'sideways_adx_thresh': 9.70148048886224, 'sideways_atr_min_pct': 0.01992955155464453, 'sideways_atr_max_pct': 0.12674079156674062, 'sideways_tp_mult': 1.1357931020219816, 'sideways_tsl_mult': 0.4997059793164608, 'sideways_time_stop': 22, 'sideways_use_sma': False, 'sideways_use_ema': False, 'sideways_use_atr': False, 'sideways_use_adx': False, 'sideways_use_spike': True, 'sideways_rsi_required': False}.
[I 2025-08-31 00:14:12,743] Trial 97 finished with values: [-1000000000.0, 1000000000.0] and parameters: {'p_sma': 53, 'p_std': 41, 'p_atr': 26, 'p_adx': 9, 'rsi_period': 24, 'ema1': 25, 'ema2': 23, 'slip_atr_k': 0.025842915117680623, 'slip_spread_k': 0.15170625226001375, 'spread_hl_frac': 0.030429029004558353, 'bb_std_mult': 3.3327277017412134, 'rsi_os': 53, 'rsi_ob': 68, 'vol_spike': 0.02833064569585285, 'adx_thresh': 11.635484137132977, 'atr_min_pct': 0.0017559819834003824, 'atr_max_pct': 0.0474294366631031, 'tp_mult': 2.7160372214622632, 'tsl_mult': 0.9533622139720539, 'strategy': 'breakout', 'time_stop': 56, 'use_sma': True, 'use_atr': False, 'use_adx': False, 'use_ema': False, 'use_spike': False, 'rsi_required': True, 'edge_k': 0.3404042164108508, 'edge_cap': 0.9720628291393762, 'bull_strategy': 'breakout', 'bull_bb_std_mult': 2.3146808075592538, 'bull_rsi_os': 27, 'bull_rsi_ob': 57, 'bull_adx_thresh': 16.91119717350472, 'bull_atr_min_pct': 0.0007177183973804517, 'bull_atr_max_pct': 0.09724269050746044, 'bull_tp_mult': 2.7800445520220856, 'bull_tsl_mult': 0.07280368674003576, 'bull_time_stop': 184, 'bull_use_sma': False, 'bull_use_ema': True, 'bull_use_atr': False, 'bull_use_adx': True, 'bull_use_spike': True, 'bull_rsi_required': False, 'bear_strategy': 'breakout', 'bear_bb_std_mult': 0.720495484692679, 'bear_rsi_os': 20, 'bear_rsi_ob': 74, 'bear_adx_thresh': 21.66299064734578, 'bear_atr_min_pct': 0.00810665530978896, 'bear_atr_max_pct': 0.14466438262895365, 'bear_tp_mult': 1.8939620864358933, 'bear_tsl_mult': 0.21600749493881372, 'bear_time_stop': 50, 'bear_use_sma': False, 'bear_use_ema': False, 'bear_use_atr': True, 'bear_use_adx': True, 'bear_use_spike': False, 'bear_rsi_required': False, 'sideways_strategy': 'mean_reversion', 'sideways_bb_std_mult': 0.8743321318700188, 'sideways_rsi_os': 45, 'sideways_rsi_ob': 71, 'sideways_adx_thresh': 10.801435079180024, 'sideways_atr_min_pct': 0.020770211672326608, 'sideways_atr_max_pct': 0.1280697883222601, 'sideways_tp_mult': 1.1315614340382725, 'sideways_tsl_mult': 0.5251728070009563, 'sideways_time_stop': 10, 'sideways_use_sma': False, 'sideways_use_ema': False, 'sideways_use_atr': False, 'sideways_use_adx': False, 'sideways_use_spike': True, 'sideways_rsi_required': False}.
[I 2025-08-31 00:14:12,906] Trial 95 finished with values: [-1000000000.0, 1000000000.0] and parameters: {'p_sma': 50, 'p_std': 44, 'p_atr': 29, 'p_adx': 7, 'rsi_period': 34, 'ema1': 25, 'ema2': 23, 'slip_atr_k': 0.02964152873780608, 'slip_spread_k': 0.04488031264114378, 'spread_hl_frac': 0.02191817602586567, 'bb_std_mult': 3.5147102757767876, 'rsi_os': 52, 'rsi_ob': 68, 'vol_spike': 0.027486168737199404, 'adx_thresh': 9.96052592804836, 'atr_min_pct': 0.0005831729420594511, 'atr_max_pct': 0.06615314868433039, 'tp_mult': 2.6831852998323824, 'tsl_mult': 0.22640797165154336, 'strategy': 'breakout', 'time_stop': 40, 'use_sma': True, 'use_atr': False, 'use_adx': False, 'use_ema': False, 'use_spike': False, 'rsi_required': True, 'edge_k': 0.1865130604626808, 'edge_cap': 0.9199793951261988, 'bull_strategy': 'breakout', 'bull_bb_std_mult': 2.4152086010719147, 'bull_rsi_os': 32, 'bull_rsi_ob': 57, 'bull_adx_thresh': 14.394766460641716, 'bull_atr_min_pct': 0.022976943281318173, 'bull_atr_max_pct': 0.12483881286632417, 'bull_tp_mult': 2.922070670908913, 'bull_tsl_mult': 0.10948571358808157, 'bull_time_stop': 173, 'bull_use_sma': False, 'bull_use_ema': True, 'bull_use_atr': False, 'bull_use_adx': True, 'bull_use_spike': False, 'bull_rsi_required': False, 'bear_strategy': 'breakout', 'bear_bb_std_mult': 0.6127355058216057, 'bear_rsi_os': 19, 'bear_rsi_ob': 78, 'bear_adx_thresh': 21.92129732207839, 'bear_atr_min_pct': 0.00622191470840148, 'bear_atr_max_pct': 0.12912127692906034, 'bear_tp_mult': 1.8959444258957865, 'bear_tsl_mult': 0.20966896525741222, 'bear_time_stop': 17, 'bear_use_sma': True, 'bear_use_ema': False, 'bear_use_atr': True, 'bear_use_adx': True, 'bear_use_spike': True, 'bear_rsi_required': False, 'sideways_strategy': 'mean_reversion', 'sideways_bb_std_mult': 0.8885063774558958, 'sideways_rsi_os': 44, 'sideways_rsi_ob': 66, 'sideways_adx_thresh': 10.74260992086284, 'sideways_atr_min_pct': 0.020245125062551876, 'sideways_atr_max_pct': 0.12898252530152354, 'sideways_tp_mult': 1.1725464195557382, 'sideways_tsl_mult': 0.4195425934092998, 'sideways_time_stop': 286, 'sideways_use_sma': False, 'sideways_use_ema': False, 'sideways_use_atr': False, 'sideways_use_adx': False, 'sideways_use_spike': True, 'sideways_rsi_required': False}.
