[I 2025-08-31 03:14:22,793] Trial 846 finished with values: [-1000000000.0, 1000000000.0] and parameters: {'p_sma': 52, 'p_std': 49, 'p_atr': 26, 'p_adx': 21, 'rsi_period': 72, 'ema1': 23, 'ema2': 26, 'slip_atr_k': 0.10531304020178758, 'slip_spread_k': 0.16111377560834025, 'spread_hl_frac': 0.0022828704400125813, 'bb_std_mult': 2.3220995488113196, 'rsi_os': 44, 'rsi_ob': 70, 'vol_spike': 0.15630618355889325, 'adx_thresh': 8.084403036528892, 'atr_min_pct': 0.007597040548821674, 'atr_max_pct': 0.12386916402175771, 'tp_mult': 1.272175382454837, 'tsl_mult': 0.3711153677227639, 'strategy': 'mean_reversion', 'time_stop': 217, 'use_sma': False, 'use_atr': False, 'use_adx': False, 'use_ema': False, 'use_spike': False, 'rsi_required': False, 'edge_k': 0.2314526733054686, 'edge_cap': 0.4121449575440288, 'bull_strategy': 'mean_reversion', 'bull_bb_std_mult': 3.137122144240159, 'bull_rsi_os': 41, 'bull_rsi_ob': 76, 'bull_adx_thresh': 5.69275262634723, 'bull_atr_min_pct': 0.006710232185466286, 'bull_atr_max_pct': 0.1332237938656579, 'bull_tp_mult': 2.3206496764822515, 'bull_tsl_mult': 0.286164035942674, 'bull_time_stop': 248, 'bull_use_sma': True, 'bull_use_ema': False, 'bull_use_atr': False, 'bull_use_adx': True, 'bull_use_spike': True, 'bull_rsi_required': True, 'bear_strategy': 'breakout', 'bear_bb_std_mult': 1.2382267159877711, 'bear_rsi_os': 49, 'bear_rsi_ob': 50, 'bear_adx_thresh': 6.820109377287745, 'bear_atr_min_pct': 0.006993227486597914, 'bear_atr_max_pct': 0.01802722970016064, 'bear_tp_mult': 2.667191007357777, 'bear_tsl_mult': 0.5134362193891296, 'bear_time_stop': 112, 'bear_use_sma': False, 'bear_use_ema': False, 'bear_use_atr': True, 'bear_use_adx': False, 'bear_use_spike': False, 'bear_rsi_required': True, 'sideways_strategy': 'breakout', 'sideways_bb_std_mult': 1.380386433274615, 'sideways_rsi_os': 17, 'sideways_rsi_ob': 92, 'sideways_adx_thresh': 22.089794472120637, 'sideways_atr_min_pct': 0.026662338916909535, 'sideways_atr_max_pct': 0.048532469637521364, 'sideways_tp_mult': 1.4597031567974192, 'sideways_tsl_mult': 0.5958617431443564, 'sideways_time_stop': 138, 'sideways_use_sma': True, 'sideways_use_ema': False, 'sideways_use_atr': False, 'sideways_use_adx': True, 'sideways_use_spike': False, 'sideways_rsi_required': False}.
[I 2025-08-31 03:14:25,452] Trial 847 finished with values: [-1000000000.0, 1000000000.0] and parameters: {'p_sma': 39, 'p_std': 49, 'p_atr': 26, 'p_adx': 19, 'rsi_period': 74, 'ema1': 29, 'ema2': 28, 'slip_atr_k': 0.08691274609051769, 'slip_spread_k': 0.1752234998600877, 'spread_hl_frac': 0.003179774880344243, 'bb_std_mult': 1.5784517527035498, 'rsi_os': 38, 'rsi_ob': 52, 'vol_spike': 0.19893483168891613, 'adx_thresh': 21.830131777554346, 'atr_min_pct': 0.010351468712097842, 'atr_max_pct': 0.12474560828195846, 'tp_mult': 1.66720862608804, 'tsl_mult': 0.32119192686642817, 'strategy': 'breakout', 'time_stop': 217, 'use_sma': False, 'use_atr': False, 'use_adx': False, 'use_ema': False, 'use_spike': False, 'rsi_required': False, 'edge_k': 0.1289749188470578, 'edge_cap': 0.3977804922948904, 'bull_strategy': 'mean_reversion', 'bull_bb_std_mult': 1.2602023012149492, 'bull_rsi_os': 21, 'bull_rsi_ob': 76, 'bull_adx_thresh': 5.67750920944828, 'bull_atr_min_pct': 0.01627157608299983, 'bull_atr_max_pct': 0.1455993373524373, 'bull_tp_mult': 1.9562235160574253, 'bull_tsl_mult': 0.22770415925837598, 'bull_time_stop': 23, 'bull_use_sma': True, 'bull_use_ema': True, 'bull_use_atr': False, 'bull_use_adx': True, 'bull_use_spike': True, 'bull_rsi_required': True, 'bear_strategy': 'breakout', 'bear_bb_std_mult': 1.9414536208938444, 'bear_rsi_os': 19, 'bear_rsi_ob': 47, 'bear_adx_thresh': 5.519906027919546, 'bear_atr_min_pct': 0.016838692236323387, 'bear_atr_max_pct': 0.014575350018165255, 'bear_tp_mult': 2.6600832100002645, 'bear_tsl_mult': 0.6167237945765321, 'bear_time_stop': 5, 'bear_use_sma': True, 'bear_use_ema': False, 'bear_use_atr': True, 'bear_use_adx': False, 'bear_use_spike': False, 'bear_rsi_required': False, 'sideways_strategy': 'breakout', 'sideways_bb_std_mult': 0.5589016171906126, 'sideways_rsi_os': 18, 'sideways_rsi_ob': 65, 'sideways_adx_thresh': 28.851242940086113, 'sideways_atr_min_pct': 0.02390567662932086, 'sideways_atr_max_pct': 0.052030165433252604, 'sideways_tp_mult': 2.5733280137871692, 'sideways_tsl_mult': 0.424305818542272, 'sideways_time_stop': 212, 'sideways_use_sma': True, 'sideways_use_ema': True, 'sideways_use_atr': True, 'sideways_use_adx': True, 'sideways_use_spike': False, 'sideways_rsi_required': True}.
[I 2025-08-31 03:14:25,967] Trial 848 finished with values: [-1000000000.0, 1000000000.0] and parameters: {'p_sma': 11, 'p_std': 19, 'p_atr': 16, 'p_adx': 17, 'rsi_period': 74, 'ema1': 17, 'ema2': 12, 'slip_atr_k': 0.14638934582590327, 'slip_spread_k': 0.10589357788764414, 'spread_hl_frac': 0.003136095282759648, 'bb_std_mult': 1.7008633173023764, 'rsi_os': 38, 'rsi_ob': 70, 'vol_spike': 0.17709352771402798, 'adx_thresh': 10.211462874072467, 'atr_min_pct': 0.008860773389152253, 'atr_max_pct': 0.12334582960095579, 'tp_mult': 1.6631536919498235, 'tsl_mult': 0.32751352469830086, 'strategy': 'breakout', 'time_stop': 251, 'use_sma': True, 'use_atr': False, 'use_adx': False, 'use_ema': False, 'use_spike': False, 'rsi_required': False, 'edge_k': 1.5015163564895722, 'edge_cap': 0.4150750031695224, 'bull_strategy': 'breakout', 'bull_bb_std_mult': 2.276454935325912, 'bull_rsi_os': 41, 'bull_rsi_ob': 64, 'bull_adx_thresh': 6.381971989959043, 'bull_atr_min_pct': 0.029292680339792484, 'bull_atr_max_pct': 0.14484901381840254, 'bull_tp_mult': 2.2617751573001237, 'bull_tsl_mult': 0.2227814149600814, 'bull_time_stop': 25, 'bull_use_sma': True, 'bull_use_ema': True, 'bull_use_atr': False, 'bull_use_adx': True, 'bull_use_spike': True, 'bull_rsi_required': True, 'bear_strategy': 'mean_reversion', 'bear_bb_std_mult': 1.2818887512817887, 'bear_rsi_os': 19, 'bear_rsi_ob': 47, 'bear_adx_thresh': 5.4894847124031365, 'bear_atr_min_pct': 0.003584524627192453, 'bear_atr_max_pct': 0.013045016611428583, 'bear_tp_mult': 2.8408461806838528, 'bear_tsl_mult': 0.6237922694134667, 'bear_time_stop': 112, 'bear_use_sma': True, 'bear_use_ema': False, 'bear_use_atr': False, 'bear_use_adx': False, 'bear_use_spike': False, 'bear_rsi_required': False, 'sideways_strategy': 'breakout', 'sideways_bb_std_mult': 2.691046887234792, 'sideways_rsi_os': 41, 'sideways_rsi_ob': 95, 'sideways_adx_thresh': 18.573169410117053, 'sideways_atr_min_pct': 0.0283032190413285, 'sideways_atr_max_pct': 0.018768251024286094, 'sideways_tp_mult': 1.4826555860212478, 'sideways_tsl_mult': 0.8261357124608841, 'sideways_time_stop': 213, 'sideways_use_sma': True, 'sideways_use_ema': True, 'sideways_use_atr': True, 'sideways_use_adx': True, 'sideways_use_spike': True, 'sideways_rsi_required': True}.
[I 2025-08-31 03:14:26,219] Trial 849 finished with values: [-1000000000.0, 1000000000.0] and parameters: {'p_sma': 52, 'p_std': 19, 'p_atr': 16, 'p_adx': 17, 'rsi_period': 18, 'ema1': 29, 'ema2': 44, 'slip_atr_k': 0.0861946411664363, 'slip_spread_k': 0.19542364555857694, 'spread_hl_frac': 0.0017620431286378463, 'bb_std_mult': 1.6936212053753585, 'rsi_os': 38, 'rsi_ob': 70, 'vol_spike': 0.15638089725572507, 'adx_thresh': 21.007200310055143, 'atr_min_pct': 0.008864779994309081, 'atr_max_pct': 0.08844086225489667, 'tp_mult': 2.8492828468059486, 'tsl_mult': 0.38907834809377684, 'strategy': 'breakout', 'time_stop': 113, 'use_sma': True, 'use_atr': False, 'use_adx': False, 'use_ema': False, 'use_spike': False, 'rsi_required': False, 'edge_k': 0.9236294139127252, 'edge_cap': 0.10167230262130371, 'bull_strategy': 'breakout', 'bull_bb_std_mult': 1.3493338898023102, 'bull_rsi_os': 21, 'bull_rsi_ob': 86, 'bull_adx_thresh': 6.0637271521185925, 'bull_atr_min_pct': 0.01579151606469737, 'bull_atr_max_pct': 0.14589116502295216, 'bull_tp_mult': 2.7481293996306704, 'bull_tsl_mult': 0.285029349753596, 'bull_time_stop': 23, 'bull_use_sma': True, 'bull_use_ema': True, 'bull_use_atr': False, 'bull_use_adx': True, 'bull_use_spike': True, 'bull_rsi_required': True, 'bear_strategy': 'mean_reversion', 'bear_bb_std_mult': 1.2770013161327443, 'bear_rsi_os': 14, 'bear_rsi_ob': 47, 'bear_adx_thresh': 16.455714257679034, 'bear_atr_min_pct': 0.011357720725138572, 'bear_atr_max_pct': 0.010006305320542221, 'bear_tp_mult': 2.8433266355545914, 'bear_tsl_mult': 0.16651128439893836, 'bear_time_stop': 186, 'bear_use_sma': True, 'bear_use_ema': False, 'bear_use_atr': False, 'bear_use_adx': True, 'bear_use_spike': False, 'bear_rsi_required': False, 'sideways_strategy': 'breakout', 'sideways_bb_std_mult': 0.5538162378400946, 'sideways_rsi_os': 42, 'sideways_rsi_ob': 82, 'sideways_adx_thresh': 7.850142069965905, 'sideways_atr_min_pct': 0.0239741792092541, 'sideways_atr_max_pct': 0.01837812059416196, 'sideways_tp_mult': 1.46905579988342, 'sideways_tsl_mult': 0.828841388874829, 'sideways_time_stop': 67, 'sideways_use_sma': True, 'sideways_use_ema': True, 'sideways_use_atr': True, 'sideways_use_adx': False, 'sideways_use_spike': True, 'sideways_rsi_required': True}.
[I 2025-08-31 03:15:00,915] Trial 853 finished with values: [-1000000000.0, 1000000000.0] and parameters: {'p_sma': 26, 'p_std': 50, 'p_atr': 15, 'p_adx': 22, 'rsi_period': 69, 'ema1': 5, 'ema2': 28, 'slip_atr_k': 0.05103656119542965, 'slip_spread_k': 0.13949477131516358, 'spread_hl_frac': 0.004877834978286983, 'bb_std_mult': 1.8622456638950045, 'rsi_os': 24, 'rsi_ob': 72, 'vol_spike': 0.18346931961645443, 'adx_thresh': 18.646306918975338, 'atr_min_pct': 0.011826396585265776, 'atr_max_pct': 0.11672918153260614, 'tp_mult': 1.982287279811353, 'tsl_mult': 0.48950806486935927, 'strategy': 'mean_reversion', 'time_stop': 142, 'use_sma': True, 'use_atr': True, 'use_adx': True, 'use_ema': True, 'use_spike': False, 'rsi_required': True, 'edge_k': 1.7198550572738593, 'edge_cap': 0.5092638994864632, 'bull_strategy': 'breakout', 'bull_bb_std_mult': 1.8021042335112063, 'bull_rsi_os': 49, 'bull_rsi_ob': 83, 'bull_adx_thresh': 5.010896345477853, 'bull_atr_min_pct': 0.014794501459805537, 'bull_atr_max_pct': 0.14279675983126153, 'bull_tp_mult': 2.1759675732415293, 'bull_tsl_mult': 0.48375512087666267, 'bull_time_stop': 152, 'bull_use_sma': True, 'bull_use_ema': False, 'bull_use_atr': False, 'bull_use_adx': False, 'bull_use_spike': True, 'bull_rsi_required': False, 'bear_strategy': 'mean_reversion', 'bear_bb_std_mult': 1.3905962302325148, 'bear_rsi_os': 55, 'bear_rsi_ob': 45, 'bear_adx_thresh': 5.044386787608708, 'bear_atr_min_pct': 0.005749517247976619, 'bear_atr_max_pct': 0.012670782003428938, 'bear_tp_mult': 2.3824657105407154, 'bear_tsl_mult': 0.8400452985443089, 'bear_time_stop': 171, 'bear_use_sma': False, 'bear_use_ema': False, 'bear_use_atr': False, 'bear_use_adx': True, 'bear_use_spike': True, 'bear_rsi_required': True, 'sideways_strategy': 'breakout', 'sideways_bb_std_mult': 0.8326725055764614, 'sideways_rsi_os': 42, 'sideways_rsi_ob': 94, 'sideways_adx_thresh': 20.24314658811571, 'sideways_atr_min_pct': 0.027661793772908897, 'sideways_atr_max_pct': 0.05504375899243023, 'sideways_tp_mult': 2.666333094734128, 'sideways_tsl_mult': 0.024217342912594975, 'sideways_time_stop': 276, 'sideways_use_sma': False, 'sideways_use_ema': False, 'sideways_use_atr': False, 'sideways_use_adx': False, 'sideways_use_spike': True, 'sideways_rsi_required': False}.
[I 2025-08-31 03:15:01,313] Trial 852 finished with values: [-1000000000.0, 1000000000.0] and parameters: {'p_sma': 53, 'p_std': 48, 'p_atr': 29, 'p_adx': 24, 'rsi_period': 69, 'ema1': 27, 'ema2': 59, 'slip_atr_k': 0.04708777367153852, 'slip_spread_k': 0.8638506600322866, 'spread_hl_frac': 0.0048788675294354905, 'bb_std_mult': 1.8613150225289488, 'rsi_os': 36, 'rsi_ob': 68, 'vol_spike': 0.18306945073410638, 'adx_thresh': 21.028935777884836, 'atr_min_pct': 0.02120729446686848, 'atr_max_pct': 0.09284016571287233, 'tp_mult': 1.9707864410802083, 'tsl_mult': 0.4970799541218823, 'strategy': 'mean_reversion', 'time_stop': 111, 'use_sma': True, 'use_atr': True, 'use_adx': True, 'use_ema': False, 'use_spike': False, 'rsi_required': True, 'edge_k': 0.675508186920047, 'edge_cap': 0.09536369360404279, 'bull_strategy': 'breakout', 'bull_bb_std_mult': 3.529449252000492, 'bull_rsi_os': 49, 'bull_rsi_ob': 50, 'bull_adx_thresh': 24.58104228323806, 'bull_atr_min_pct': 0.014898218618559065, 'bull_atr_max_pct': 0.03322587373209842, 'bull_tp_mult': 1.4076202331450318, 'bull_tsl_mult': 0.5012177344269344, 'bull_time_stop': 151, 'bull_use_sma': True, 'bull_use_ema': False, 'bull_use_atr': False, 'bull_use_adx': False, 'bull_use_spike': True, 'bull_rsi_required': False, 'bear_strategy': 'mean_reversion', 'bear_bb_std_mult': 1.3761660537310818, 'bear_rsi_os': 17, 'bear_rsi_ob': 46, 'bear_adx_thresh': 5.488891785392672, 'bear_atr_min_pct': 0.028731512657827623, 'bear_atr_max_pct': 0.08891925282179257, 'bear_tp_mult': 1.3947024923100004, 'bear_tsl_mult': 0.1234089077413516, 'bear_time_stop': 101, 'bear_use_sma': False, 'bear_use_ema': False, 'bear_use_atr': False, 'bear_use_adx': True, 'bear_use_spike': False, 'bear_rsi_required': True, 'sideways_strategy': 'breakout', 'sideways_bb_std_mult': 2.5899244228928935, 'sideways_rsi_os': 29, 'sideways_rsi_ob': 48, 'sideways_adx_thresh': 8.708122150016584, 'sideways_atr_min_pct': 0.027559115179484957, 'sideways_atr_max_pct': 0.05409397601138428, 'sideways_tp_mult': 1.8152682814209087, 'sideways_tsl_mult': 0.19057702529800763, 'sideways_time_stop': 65, 'sideways_use_sma': False, 'sideways_use_ema': False, 'sideways_use_atr': False, 'sideways_use_adx': False, 'sideways_use_spike': True, 'sideways_rsi_required': False}.
[I 2025-08-31 03:15:02,021] Trial 850 finished with values: [-1000000000.0, 1000000000.0] and parameters: {'p_sma': 17, 'p_std': 48, 'p_atr': 29, 'p_adx': 17, 'rsi_period': 9, 'ema1': 21, 'ema2': 24, 'slip_atr_k': 0.19598531009833112, 'slip_spread_k': 0.18673836201063246, 'spread_hl_frac': 0.003462456772107423, 'bb_std_mult': 1.6968697676184044, 'rsi_os': 24, 'rsi_ob': 68, 'vol_spike': 0.18275172871700587, 'adx_thresh': 20.87595676692817, 'atr_min_pct': 0.008883235624793326, 'atr_max_pct': 0.11727171110750954, 'tp_mult': 2.8635752913420953, 'tsl_mult': 0.7882270330412938, 'strategy': 'breakout', 'time_stop': 187, 'use_sma': True, 'use_atr': False, 'use_adx': False, 'use_ema': False, 'use_spike': False, 'rsi_required': False, 'edge_k': 0.13022429644638978, 'edge_cap': 0.5152021498107582, 'bull_strategy': 'breakout', 'bull_bb_std_mult': 2.273522053950988, 'bull_rsi_os': 25, 'bull_rsi_ob': 62, 'bull_adx_thresh': 6.350723304742716, 'bull_atr_min_pct': 0.014435935395046565, 'bull_atr_max_pct': 0.1450210575915716, 'bull_tp_mult': 1.9071493629431606, 'bull_tsl_mult': 0.6355561926429629, 'bull_time_stop': 26, 'bull_use_sma': True, 'bull_use_ema': True, 'bull_use_atr': False, 'bull_use_adx': True, 'bull_use_spike': True, 'bull_rsi_required': True, 'bear_strategy': 'mean_reversion', 'bear_bb_std_mult': 1.9281628673369688, 'bear_rsi_os': 20, 'bear_rsi_ob': 47, 'bear_adx_thresh': 28.486104621713963, 'bear_atr_min_pct': 0.028534844247428685, 'bear_atr_max_pct': 0.09022006150673369, 'bear_tp_mult': 2.867707276829286, 'bear_tsl_mult': 0.05460706853365882, 'bear_time_stop': 103, 'bear_use_sma': True, 'bear_use_ema': False, 'bear_use_atr': False, 'bear_use_adx': True, 'bear_use_spike': False, 'bear_rsi_required': False, 'sideways_strategy': 'breakout', 'sideways_bb_std_mult': 0.7908770101344529, 'sideways_rsi_os': 42, 'sideways_rsi_ob': 48, 'sideways_adx_thresh': 8.700893220046504, 'sideways_atr_min_pct': 0.02820197338072799, 'sideways_atr_max_pct': 0.05263751092843655, 'sideways_tp_mult': 1.8079540407697376, 'sideways_tsl_mult': 0.8257380607038604, 'sideways_time_stop': 210, 'sideways_use_sma': True, 'sideways_use_ema': True, 'sideways_use_atr': True, 'sideways_use_adx': False, 'sideways_use_spike': True, 'sideways_rsi_required': True}.
[I 2025-08-31 03:15:02,148] Trial 851 finished with values: [-1000000000.0, 1000000000.0] and parameters: {'p_sma': 26, 'p_std': 18, 'p_atr': 29, 'p_adx': 17, 'rsi_period': 69, 'ema1': 21, 'ema2': 24, 'slip_atr_k': 0.048224153434291664, 'slip_spread_k': 0.09389652067825342, 'spread_hl_frac': 0.04993537694685229, 'bb_std_mult': 1.696081279437585, 'rsi_os': 36, 'rsi_ob': 72, 'vol_spike': 0.1832238527410407, 'adx_thresh': 20.942725069847782, 'atr_min_pct': 0.008727214165942847, 'atr_max_pct': 0.09199625619469659, 'tp_mult': 2.298017729313241, 'tsl_mult': 0.7816914150697727, 'strategy': 'breakout', 'time_stop': 204, 'use_sma': True, 'use_atr': False, 'use_adx': True, 'use_ema': False, 'use_spike': False, 'rsi_required': True, 'edge_k': 1.4912622446400692, 'edge_cap': 0.09774042213482567, 'bull_strategy': 'breakout', 'bull_bb_std_mult': 1.3594100274458674, 'bull_rsi_os': 25, 'bull_rsi_ob': 51, 'bull_adx_thresh': 5.0134400404760004, 'bull_atr_min_pct': 0.029164430613737396, 'bull_atr_max_pct': 0.1431398044029806, 'bull_tp_mult': 2.4044939089242923, 'bull_tsl_mult': 0.9998825119575789, 'bull_time_stop': 140, 'bull_use_sma': True, 'bull_use_ema': True, 'bull_use_atr': False, 'bull_use_adx': True, 'bull_use_spike': True, 'bull_rsi_required': False, 'bear_strategy': 'mean_reversion', 'bear_bb_std_mult': 2.6660402523946587, 'bear_rsi_os': 20, 'bear_rsi_ob': 54, 'bear_adx_thresh': 15.518651228707185, 'bear_atr_min_pct': 0.002005634727794676, 'bear_atr_max_pct': 0.012273190458847755, 'bear_tp_mult': 2.046962367912115, 'bear_tsl_mult': 0.006260564262993928, 'bear_time_stop': 243, 'bear_use_sma': True, 'bear_use_ema': False, 'bear_use_atr': False, 'bear_use_adx': True, 'bear_use_spike': False, 'bear_rsi_required': False, 'sideways_strategy': 'breakout', 'sideways_bb_std_mult': 2.6317708907324207, 'sideways_rsi_os': 42, 'sideways_rsi_ob': 48, 'sideways_adx_thresh': 7.686407618251845, 'sideways_atr_min_pct': 0.02831803935336633, 'sideways_atr_max_pct': 0.025287702644639094, 'sideways_tp_mult': 1.852817603181502, 'sideways_tsl_mult': 0.19522833836316605, 'sideways_time_stop': 238, 'sideways_use_sma': True, 'sideways_use_ema': True, 'sideways_use_atr': True, 'sideways_use_adx': False, 'sideways_use_spike': True, 'sideways_rsi_required': True}.
[I 2025-08-31 03:15:37,449] Trial 855 finished with values: [-1000000000.0, 1000000000.0] and parameters: {'p_sma': 54, 'p_std': 22, 'p_atr': 27, 'p_adx': 26, 'rsi_period': 52, 'ema1': 5, 'ema2': 31, 'slip_atr_k': 0.11340007145313512, 'slip_spread_k': 0.6672745137417568, 'spread_hl_frac': 2.1171274614861183e-05, 'bb_std_mult': 1.633331192719289, 'rsi_os': 37, 'rsi_ob': 67, 'vol_spike': 0.19019983893985176, 'adx_thresh': 20.637451920147495, 'atr_min_pct': 0.008151197191003315, 'atr_max_pct': 0.12016608757642148, 'tp_mult': 1.551205509994924, 'tsl_mult': 0.8277585188126231, 'strategy': 'mean_reversion', 'time_stop': 203, 'use_sma': True, 'use_atr': False, 'use_adx': False, 'use_ema': False, 'use_spike': False, 'rsi_required': True, 'edge_k': 1.999933215212028, 'edge_cap': 0.15498035330392362, 'bull_strategy': 'breakout', 'bull_bb_std_mult': 2.0751015077244346, 'bull_rsi_os': 13, 'bull_rsi_ob': 62, 'bull_adx_thresh': 6.989657052738609, 'bull_atr_min_pct': 0.007847987608915691, 'bull_atr_max_pct': 0.14190366018758038, 'bull_tp_mult': 1.555446435802096, 'bull_tsl_mult': 0.3210478714819298, 'bull_time_stop': 211, 'bull_use_sma': False, 'bull_use_ema': False, 'bull_use_atr': True, 'bull_use_adx': True, 'bull_use_spike': True, 'bull_rsi_required': True, 'bear_strategy': 'mean_reversion', 'bear_bb_std_mult': 2.7797403468420327, 'bear_rsi_os': 48, 'bear_rsi_ob': 45, 'bear_adx_thresh': 30.964383193366498, 'bear_atr_min_pct': 0.02094290394010145, 'bear_atr_max_pct': 0.068906467858703, 'bear_tp_mult': 1.644122627776985, 'bear_tsl_mult': 0.5422381599635739, 'bear_time_stop': 11, 'bear_use_sma': False, 'bear_use_ema': False, 'bear_use_atr': False, 'bear_use_adx': True, 'bear_use_spike': False, 'bear_rsi_required': True, 'sideways_strategy': 'breakout', 'sideways_bb_std_mult': 0.5025070313044672, 'sideways_rsi_os': 51, 'sideways_rsi_ob': 94, 'sideways_adx_thresh': 10.019519479396791, 'sideways_atr_min_pct': 0.026179271252367024, 'sideways_atr_max_pct': 0.058359685748362616, 'sideways_tp_mult': 2.218341262245643, 'sideways_tsl_mult': 0.6172305582314662, 'sideways_time_stop': 208, 'sideways_use_sma': True, 'sideways_use_ema': False, 'sideways_use_atr': False, 'sideways_use_adx': False, 'sideways_use_spike': True, 'sideways_rsi_required': False}.
