[I 2025-08-31 00:46:45,608] Trial 377 finished with values: [-0.10359633530652246, 0.10351560957347287] and parameters: {'p_sma': 49, 'p_std': 40, 'p_atr': 20, 'p_adx': 28, 'rsi_period': 69, 'ema1': 6, 'ema2': 28, 'slip_atr_k': 0.028438096316318835, 'slip_spread_k': 0.2878094589986609, 'spread_hl_frac': 0.00979510967162637, 'bb_std_mult': 1.1038922750702864, 'rsi_os': 24, 'rsi_ob': 77, 'vol_spike': 0.18397799949114527, 'adx_thresh': 13.586457537882218, 'atr_min_pct': 0.013699019379378636, 'atr_max_pct': 0.13839396786611657, 'tp_mult': 1.2318405390827754, 'tsl_mult': 0.08852294388874933, 'strategy': 'breakout', 'time_stop': 105, 'use_sma': True, 'use_atr': False, 'use_adx': False, 'use_ema': True, 'use_spike': False, 'rsi_required': False, 'edge_k': 1.2914771932797044, 'edge_cap': 0.2752530478115609, 'bull_strategy': 'breakout', 'bull_bb_std_mult': 2.876285342501096, 'bull_rsi_os': 14, 'bull_rsi_ob': 68, 'bull_adx_thresh': 31.320792244304897, 'bull_atr_min_pct': 0.0007807182106210995, 'bull_atr_max_pct': 0.07649403136016993, 'bull_tp_mult': 2.483755808625255, 'bull_tsl_mult': 0.3061915844749801, 'bull_time_stop': 159, 'bull_use_sma': False, 'bull_use_ema': False, 'bull_use_atr': True, 'bull_use_adx': True, 'bull_use_spike': False, 'bull_rsi_required': True, 'bear_strategy': 'mean_reversion', 'bear_bb_std_mult': 1.11802152348331, 'bear_rsi_os': 23, 'bear_rsi_ob': 77, 'bear_adx_thresh': 7.99899695909089, 'bear_atr_min_pct': 0.007591796867542006, 'bear_atr_max_pct': 0.03915343556959075, 'bear_tp_mult': 1.1953520766494232, 'bear_tsl_mult': 0.6794343346397689, 'bear_time_stop': 41, 'bear_use_sma': True, 'bear_use_ema': False, 'bear_use_atr': False, 'bear_use_adx': False, 'bear_use_spike': False, 'bear_rsi_required': False, 'sideways_strategy': 'breakout', 'sideways_bb_std_mult': 1.071455252652197, 'sideways_rsi_os': 51, 'sideways_rsi_ob': 89, 'sideways_adx_thresh': 12.985658296398535, 'sideways_atr_min_pct': 0.0009177102104891699, 'sideways_atr_max_pct': 0.08470334186127065, 'sideways_tp_mult': 1.046869650974424, 'sideways_tsl_mult': 0.8804070319744131, 'sideways_time_stop': 195, 'sideways_use_sma': True, 'sideways_use_ema': False, 'sideways_use_atr': False, 'sideways_use_adx': False, 'sideways_use_spike': True, 'sideways_rsi_required': False}.
[I 2025-08-31 00:46:45,608] Trial 379 finished with values: [-1000000000.0, 1000000000.0] and parameters: {'p_sma': 47, 'p_std': 38, 'p_atr': 20, 'p_adx': 27, 'rsi_period': 51, 'ema1': 7, 'ema2': 18, 'slip_atr_k': 0.08190488686764447, 'slip_spread_k': 0.6212322624145725, 'spread_hl_frac': 0.009119181509403352, 'bb_std_mult': 2.00487455321477, 'rsi_os': 25, 'rsi_ob': 77, 'vol_spike': 0.18260213884204662, 'adx_thresh': 12.13926621454402, 'atr_min_pct': 0.005789959851584181, 'atr_max_pct': 0.07619662748169587, 'tp_mult': 2.2218208968060424, 'tsl_mult': 0.9815930282478564, 'strategy': 'breakout', 'time_stop': 101, 'use_sma': True, 'use_atr': False, 'use_adx': True, 'use_ema': True, 'use_spike': False, 'rsi_required': False, 'edge_k': 1.2744628896924435, 'edge_cap': 0.5352137107436358, 'bull_strategy': 'breakout', 'bull_bb_std_mult': 2.7932644884697306, 'bull_rsi_os': 35, 'bull_rsi_ob': 80, 'bull_adx_thresh': 12.76119525712653, 'bull_atr_min_pct': 0.01907585490038696, 'bull_atr_max_pct': 0.07394440876767806, 'bull_tp_mult': 2.493022197767875, 'bull_tsl_mult': 0.24495912298453698, 'bull_time_stop': 167, 'bull_use_sma': True, 'bull_use_ema': False, 'bull_use_atr': True, 'bull_use_adx': True, 'bull_use_spike': False, 'bull_rsi_required': False, 'bear_strategy': 'mean_reversion', 'bear_bb_std_mult': 1.0854150053805653, 'bear_rsi_os': 47, 'bear_rsi_ob': 77, 'bear_adx_thresh': 8.096335473495133, 'bear_atr_min_pct': 0.007440802699296284, 'bear_atr_max_pct': 0.06301913605064524, 'bear_tp_mult': 2.859177956357027, 'bear_tsl_mult': 0.8268707655604723, 'bear_time_stop': 25, 'bear_use_sma': True, 'bear_use_ema': False, 'bear_use_atr': False, 'bear_use_adx': True, 'bear_use_spike': False, 'bear_rsi_required': False, 'sideways_strategy': 'mean_reversion', 'sideways_bb_std_mult': 2.211908146596137, 'sideways_rsi_os': 6, 'sideways_rsi_ob': 49, 'sideways_adx_thresh': 33.062586891875206, 'sideways_atr_min_pct': 0.004130264077896555, 'sideways_atr_max_pct': 0.14008815430476768, 'sideways_tp_mult': 1.168327334359159, 'sideways_tsl_mult': 0.8286054565191103, 'sideways_time_stop': 185, 'sideways_use_sma': True, 'sideways_use_ema': True, 'sideways_use_atr': True, 'sideways_use_adx': True, 'sideways_use_spike': False, 'sideways_rsi_required': True}.
[I 2025-08-31 00:46:45,876] Trial 380 finished with values: [-0.0720226372390449, 0.07192988780593979] and parameters: {'p_sma': 52, 'p_std': 38, 'p_atr': 20, 'p_adx': 8, 'rsi_period': 57, 'ema1': 7, 'ema2': 18, 'slip_atr_k': 0.06018471762135037, 'slip_spread_k': 0.5364119833947905, 'spread_hl_frac': 0.013944772493466236, 'bb_std_mult': 1.4463626152559308, 'rsi_os': 24, 'rsi_ob': 76, 'vol_spike': 0.18349451340975279, 'adx_thresh': 12.242107878352611, 'atr_min_pct': 0.013666043418709639, 'atr_max_pct': 0.0724396102729674, 'tp_mult': 1.8745988061350438, 'tsl_mult': 0.12366607046960026, 'strategy': 'breakout', 'time_stop': 192, 'use_sma': True, 'use_atr': False, 'use_adx': True, 'use_ema': True, 'use_spike': False, 'rsi_required': False, 'edge_k': 0.87195192841924, 'edge_cap': 0.8396764621829206, 'bull_strategy': 'breakout', 'bull_bb_std_mult': 2.8035936942152846, 'bull_rsi_os': 49, 'bull_rsi_ob': 68, 'bull_adx_thresh': 12.842040212648802, 'bull_atr_min_pct': 0.026646050021149337, 'bull_atr_max_pct': 0.06334987216441014, 'bull_tp_mult': 2.4864668780467634, 'bull_tsl_mult': 0.24180073040554287, 'bull_time_stop': 184, 'bull_use_sma': True, 'bull_use_ema': False, 'bull_use_atr': True, 'bull_use_adx': True, 'bull_use_spike': False, 'bull_rsi_required': False, 'bear_strategy': 'mean_reversion', 'bear_bb_std_mult': 0.8984975663251634, 'bear_rsi_os': 41, 'bear_rsi_ob': 76, 'bear_adx_thresh': 8.208951590620007, 'bear_atr_min_pct': 0.007405653697263311, 'bear_atr_max_pct': 0.09232728972068821, 'bear_tp_mult': 1.900432620185709, 'bear_tsl_mult': 0.6418421003592102, 'bear_time_stop': 23, 'bear_use_sma': True, 'bear_use_ema': False, 'bear_use_atr': False, 'bear_use_adx': False, 'bear_use_spike': False, 'bear_rsi_required': False, 'sideways_strategy': 'breakout', 'sideways_bb_std_mult': 2.1988568487015665, 'sideways_rsi_os': 53, 'sideways_rsi_ob': 89, 'sideways_adx_thresh': 29.28172374156585, 'sideways_atr_min_pct': 0.0013168947798142885, 'sideways_atr_max_pct': 0.07193814109928344, 'sideways_tp_mult': 1.1549308369462183, 'sideways_tsl_mult': 0.6993991507596196, 'sideways_time_stop': 68, 'sideways_use_sma': True, 'sideways_use_ema': True, 'sideways_use_atr': True, 'sideways_use_adx': True, 'sideways_use_spike': False, 'sideways_rsi_required': True}.
[I 2025-08-31 00:47:27,615] Trial 384 finished with values: [-0.023994480984260602, 0.023975387879733488] and parameters: {'p_sma': 15, 'p_std': 6, 'p_atr': 24, 'p_adx': 8, 'rsi_period': 63, 'ema1': 14, 'ema2': 21, 'slip_atr_k': 0.09922460264424253, 'slip_spread_k': 0.2183829675317873, 'spread_hl_frac': 0.006940542990403587, 'bb_std_mult': 2.9561995918040336, 'rsi_os': 55, 'rsi_ob': 74, 'vol_spike': 0.05226789348274685, 'adx_thresh': 31.190451842558243, 'atr_min_pct': 0.008316065368932125, 'atr_max_pct': 0.06397411949492036, 'tp_mult': 2.595181320407504, 'tsl_mult': 0.1422385199441565, 'strategy': 'breakout', 'time_stop': 78, 'use_sma': False, 'use_atr': False, 'use_adx': False, 'use_ema': True, 'use_spike': True, 'rsi_required': False, 'edge_k': 0.6416240158589963, 'edge_cap': 0.7570720754754612, 'bull_strategy': 'mean_reversion', 'bull_bb_std_mult': 2.694925546211953, 'bull_rsi_os': 39, 'bull_rsi_ob': 45, 'bull_adx_thresh': 19.294205761393666, 'bull_atr_min_pct': 0.0016117377508451706, 'bull_atr_max_pct': 0.07217760696725811, 'bull_tp_mult': 2.57322454130004, 'bull_tsl_mult': 0.5911166543013736, 'bull_time_stop': 137, 'bull_use_sma': False, 'bull_use_ema': False, 'bull_use_atr': True, 'bull_use_adx': True, 'bull_use_spike': False, 'bull_rsi_required': False, 'bear_strategy': 'mean_reversion', 'bear_bb_std_mult': 1.3663366699957031, 'bear_rsi_os': 43, 'bear_rsi_ob': 79, 'bear_adx_thresh': 21.311155253186342, 'bear_atr_min_pct': 0.022528787553757583, 'bear_atr_max_pct': 0.023854556800775174, 'bear_tp_mult': 1.4418002349807821, 'bear_tsl_mult': 0.7833574175554012, 'bear_time_stop': 88, 'bear_use_sma': True, 'bear_use_ema': True, 'bear_use_atr': False, 'bear_use_adx': True, 'bear_use_spike': True, 'bear_rsi_required': False, 'sideways_strategy': 'mean_reversion', 'sideways_bb_std_mult': 1.1922267983090333, 'sideways_rsi_os': 14, 'sideways_rsi_ob': 91, 'sideways_adx_thresh': 34.97280234347916, 'sideways_atr_min_pct': 0.00498062427540266, 'sideways_atr_max_pct': 0.10146421982240258, 'sideways_tp_mult': 2.0734386377731386, 'sideways_tsl_mult': 0.8032565214523407, 'sideways_time_stop': 44, 'sideways_use_sma': True, 'sideways_use_ema': False, 'sideways_use_atr': False, 'sideways_use_adx': False, 'sideways_use_spike': True, 'sideways_rsi_required': False}.
[I 2025-08-31 00:47:27,800] Trial 381 finished with values: [-0.026871822402212975, 0.026898219319865614] and parameters: {'p_sma': 30, 'p_std': 38, 'p_atr': 21, 'p_adx': 15, 'rsi_period': 48, 'ema1': 20, 'ema2': 28, 'slip_atr_k': 0.15402038866485684, 'slip_spread_k': 0.21355764897947496, 'spread_hl_frac': 0.008887546921074239, 'bb_std_mult': 1.1189497920716236, 'rsi_os': 6, 'rsi_ob': 76, 'vol_spike': 0.24007585943090967, 'adx_thresh': 31.010104474430563, 'atr_min_pct': 0.014537217837023742, 'atr_max_pct': 0.11291968172982125, 'tp_mult': 2.376885984052342, 'tsl_mult': 0.12492842164528503, 'strategy': 'breakout', 'time_stop': 161, 'use_sma': True, 'use_atr': False, 'use_adx': True, 'use_ema': True, 'use_spike': True, 'rsi_required': False, 'edge_k': 0.7475482222414144, 'edge_cap': 0.7926717554472938, 'bull_strategy': 'mean_reversion', 'bull_bb_std_mult': 2.7937160137442865, 'bull_rsi_os': 17, 'bull_rsi_ob': 74, 'bull_adx_thresh': 24.226288425428216, 'bull_atr_min_pct': 0.018989908857075466, 'bull_atr_max_pct': 0.072675474118621, 'bull_tp_mult': 2.5008185568289365, 'bull_tsl_mult': 0.756325812138505, 'bull_time_stop': 154, 'bull_use_sma': True, 'bull_use_ema': False, 'bull_use_atr': True, 'bull_use_adx': True, 'bull_use_spike': False, 'bull_rsi_required': False, 'bear_strategy': 'mean_reversion', 'bear_bb_std_mult': 3.3552767082011883, 'bear_rsi_os': 26, 'bear_rsi_ob': 77, 'bear_adx_thresh': 8.38980934391827, 'bear_atr_min_pct': 0.007270090037385313, 'bear_atr_max_pct': 0.024246644343446963, 'bear_tp_mult': 1.4609129945395667, 'bear_tsl_mult': 0.058262793412048486, 'bear_time_stop': 36, 'bear_use_sma': True, 'bear_use_ema': True, 'bear_use_atr': False, 'bear_use_adx': True, 'bear_use_spike': False, 'bear_rsi_required': False, 'sideways_strategy': 'mean_reversion', 'sideways_bb_std_mult': 2.2201541554214743, 'sideways_rsi_os': 6, 'sideways_rsi_ob': 49, 'sideways_adx_thresh': 6.90194481616475, 'sideways_atr_min_pct': 0.0007624663212573435, 'sideways_atr_max_pct': 0.0828947624014832, 'sideways_tp_mult': 1.19833649091029, 'sideways_tsl_mult': 0.8201871405510175, 'sideways_time_stop': 182, 'sideways_use_sma': True, 'sideways_use_ema': True, 'sideways_use_atr': True, 'sideways_use_adx': False, 'sideways_use_spike': True, 'sideways_rsi_required': True}.
[I 2025-08-31 00:47:28,319] Trial 382 finished with values: [-1000000000.0, 1000000000.0] and parameters: {'p_sma': 52, 'p_std': 38, 'p_atr': 21, 'p_adx': 16, 'rsi_period': 48, 'ema1': 19, 'ema2': 21, 'slip_atr_k': 0.22041622559355206, 'slip_spread_k': 0.5285519524067701, 'spread_hl_frac': 0.0140170643396508, 'bb_std_mult': 1.7733949058066019, 'rsi_os': 6, 'rsi_ob': 75, 'vol_spike': 0.05125041694224593, 'adx_thresh': 26.543082632851934, 'atr_min_pct': 0.008208236590413021, 'atr_max_pct': 0.07234662922567091, 'tp_mult': 2.598077496422932, 'tsl_mult': 0.478066610633843, 'strategy': 'breakout', 'time_stop': 78, 'use_sma': False, 'use_atr': False, 'use_adx': True, 'use_ema': True, 'use_spike': True, 'rsi_required': False, 'edge_k': 0.8662761345884539, 'edge_cap': 0.7579075225836016, 'bull_strategy': 'mean_reversion', 'bull_bb_std_mult': 0.8139240204794684, 'bull_rsi_os': 39, 'bull_rsi_ob': 70, 'bull_adx_thresh': 10.362854177413453, 'bull_atr_min_pct': 0.01425271977774862, 'bull_atr_max_pct': 0.07172814682723544, 'bull_tp_mult': 2.5845111923959814, 'bull_tsl_mult': 0.35559435493752434, 'bull_time_stop': 183, 'bull_use_sma': False, 'bull_use_ema': False, 'bull_use_atr': True, 'bull_use_adx': True, 'bull_use_spike': False, 'bull_rsi_required': False, 'bear_strategy': 'mean_reversion', 'bear_bb_std_mult': 2.4965050694713216, 'bear_rsi_os': 49, 'bear_rsi_ob': 79, 'bear_adx_thresh': 9.731899872074852, 'bear_atr_min_pct': 0.00863559119460735, 'bear_atr_max_pct': 0.024752351945901155, 'bear_tp_mult': 1.8939720721828337, 'bear_tsl_mult': 0.6350167418137418, 'bear_time_stop': 193, 'bear_use_sma': True, 'bear_use_ema': True, 'bear_use_atr': False, 'bear_use_adx': True, 'bear_use_spike': True, 'bear_rsi_required': False, 'sideways_strategy': 'mean_reversion', 'sideways_bb_std_mult': 1.207709286321096, 'sideways_rsi_os': 29, 'sideways_rsi_ob': 90, 'sideways_adx_thresh': 32.04359928991196, 'sideways_atr_min_pct': 0.006529479605981273, 'sideways_atr_max_pct': 0.14091634859081179, 'sideways_tp_mult': 2.091182192349867, 'sideways_tsl_mult': 0.7066056801390688, 'sideways_time_stop': 70, 'sideways_use_sma': True, 'sideways_use_ema': True, 'sideways_use_atr': True, 'sideways_use_adx': False, 'sideways_use_spike': True, 'sideways_rsi_required': True}.
[I 2025-08-31 00:47:28,319] Trial 383 finished with values: [-1000000000.0, 1000000000.0] and parameters: {'p_sma': 19, 'p_std': 6, 'p_atr': 21, 'p_adx': 8, 'rsi_period': 57, 'ema1': 29, 'ema2': 21, 'slip_atr_k': 0.22223254623403454, 'slip_spread_k': 0.9801994019821929, 'spread_hl_frac': 0.031749849247950566, 'bb_std_mult': 1.4246750629862972, 'rsi_os': 34, 'rsi_ob': 74, 'vol_spike': 0.23632015523185032, 'adx_thresh': 10.442193392808477, 'atr_min_pct': 0.014763645826337607, 'atr_max_pct': 0.0717427620926347, 'tp_mult': 1.062346264570229, 'tsl_mult': 0.13788910063869309, 'strategy': 'breakout', 'time_stop': 85, 'use_sma': False, 'use_atr': False, 'use_adx': True, 'use_ema': True, 'use_spike': True, 'rsi_required': False, 'edge_k': 0.7420155985465411, 'edge_cap': 0.7712672424406283, 'bull_strategy': 'mean_reversion', 'bull_bb_std_mult': 0.7877844260419204, 'bull_rsi_os': 39, 'bull_rsi_ob': 75, 'bull_adx_thresh': 13.427645165292539, 'bull_atr_min_pct': 0.02671196778955172, 'bull_atr_max_pct': 0.06375118484750186, 'bull_tp_mult': 2.0657509323545615, 'bull_tsl_mult': 0.5981649172907725, 'bull_time_stop': 131, 'bull_use_sma': False, 'bull_use_ema': False, 'bull_use_atr': True, 'bull_use_adx': True, 'bull_use_spike': False, 'bull_rsi_required': False, 'bear_strategy': 'mean_reversion', 'bear_bb_std_mult': 2.4948407716071945, 'bear_rsi_os': 20, 'bear_rsi_ob': 79, 'bear_adx_thresh': 21.044497387707292, 'bear_atr_min_pct': 0.009930698770770973, 'bear_atr_max_pct': 0.020276360038473835, 'bear_tp_mult': 1.8929125193888618, 'bear_tsl_mult': 0.6411881951687963, 'bear_time_stop': 17, 'bear_use_sma': True, 'bear_use_ema': True, 'bear_use_atr': False, 'bear_use_adx': True, 'bear_use_spike': True, 'bear_rsi_required': False, 'sideways_strategy': 'mean_reversion', 'sideways_bb_std_mult': 3.5655736252195904, 'sideways_rsi_os': 33, 'sideways_rsi_ob': 91, 'sideways_adx_thresh': 29.27063253293092, 'sideways_atr_min_pct': 0.018617405696657086, 'sideways_atr_max_pct': 0.1368363910965751, 'sideways_tp_mult': 2.084723094852321, 'sideways_tsl_mult': 0.5507891157900133, 'sideways_time_stop': 144, 'sideways_use_sma': True, 'sideways_use_ema': True, 'sideways_use_atr': True, 'sideways_use_adx': False, 'sideways_use_spike': True, 'sideways_rsi_required': True}.
[I 2025-08-31 00:48:08,115] Trial 388 finished with values: [-1000000000.0, 1000000000.0] and parameters: {'p_sma': 46, 'p_std': 41, 'p_atr': 25, 'p_adx': 7, 'rsi_period': 56, 'ema1': 16, 'ema2': 13, 'slip_atr_k': 0.03388416069354482, 'slip_spread_k': 0.2484917788712763, 'spread_hl_frac': 0.011220118290488012, 'bb_std_mult': 2.071512936471397, 'rsi_os': 19, 'rsi_ob': 72, 'vol_spike': 0.09377835857518665, 'adx_thresh': 14.086338820195653, 'atr_min_pct': 0.0065114794823443985, 'atr_max_pct': 0.07746175941072754, 'tp_mult': 2.4879500819924765, 'tsl_mult': 0.6386436392810351, 'strategy': 'breakout', 'time_stop': 130, 'use_sma': True, 'use_atr': False, 'use_adx': False, 'use_ema': True, 'use_spike': False, 'rsi_required': False, 'edge_k': 0.40137266827350315, 'edge_cap': 0.8589557969905145, 'bull_strategy': 'breakout', 'bull_bb_std_mult': 2.6001050388257343, 'bull_rsi_os': 29, 'bull_rsi_ob': 90, 'bull_adx_thresh': 14.253063118921292, 'bull_atr_min_pct': 0.02774243884051992, 'bull_atr_max_pct': 0.08108704174472336, 'bull_tp_mult': 2.4116255329430447, 'bull_tsl_mult': 0.4521518471375665, 'bull_time_stop': 81, 'bull_use_sma': False, 'bull_use_ema': False, 'bull_use_atr': True, 'bull_use_adx': False, 'bull_use_spike': True, 'bull_rsi_required': False, 'bear_strategy': 'mean_reversion', 'bear_bb_std_mult': 0.9498437688192479, 'bear_rsi_os': 13, 'bear_rsi_ob': 80, 'bear_adx_thresh': 6.793062830327064, 'bear_atr_min_pct': 0.0027169988966853804, 'bear_atr_max_pct': 0.06725589681936864, 'bear_tp_mult': 2.211747348095889, 'bear_tsl_mult': 0.7411400276750265, 'bear_time_stop': 98, 'bear_use_sma': True, 'bear_use_ema': False, 'bear_use_atr': False, 'bear_use_adx': True, 'bear_use_spike': False, 'bear_rsi_required': False, 'sideways_strategy': 'mean_reversion', 'sideways_bb_std_mult': 0.9263745126745097, 'sideways_rsi_os': 46, 'sideways_rsi_ob': 88, 'sideways_adx_thresh': 20.469249742699237, 'sideways_atr_min_pct': 0.021636241340507668, 'sideways_atr_max_pct': 0.0620151108073055, 'sideways_tp_mult': 1.086170047016851, 'sideways_tsl_mult': 0.6485394674301265, 'sideways_time_stop': 162, 'sideways_use_sma': True, 'sideways_use_ema': False, 'sideways_use_atr': False, 'sideways_use_adx': False, 'sideways_use_spike': True, 'sideways_rsi_required': False}.
[I 2025-08-31 00:48:08,323] Trial 386 finished with values: [-1000000000.0, 1000000000.0] and parameters: {'p_sma': 46, 'p_std': 21, 'p_atr': 22, 'p_adx': 24, 'rsi_period': 57, 'ema1': 16, 'ema2': 19, 'slip_atr_k': 0.036005292624638856, 'slip_spread_k': 0.2413266326899621, 'spread_hl_frac': 0.011276142426292924, 'bb_std_mult': 1.7734044241950404, 'rsi_os': 19, 'rsi_ob': 72, 'vol_spike': 0.10052216161445297, 'adx_thresh': 26.559299805581286, 'atr_min_pct': 0.007172501800768158, 'atr_max_pct': 0.11988128466386366, 'tp_mult': 1.5737584358338992, 'tsl_mult': 0.4671546568732707, 'strategy': 'breakout', 'time_stop': 257, 'use_sma': False, 'use_atr': False, 'use_adx': False, 'use_ema': True, 'use_spike': False, 'rsi_required': False, 'edge_k': 0.2814219579096561, 'edge_cap': 0.8539566020680603, 'bull_strategy': 'breakout', 'bull_bb_std_mult': 2.961947955911305, 'bull_rsi_os': 37, 'bull_rsi_ob': 70, 'bull_adx_thresh': 28.69192351674339, 'bull_atr_min_pct': 0.0026367717194699086, 'bull_atr_max_pct': 0.07916287533889776, 'bull_tp_mult': 2.431660837124094, 'bull_tsl_mult': 0.35367994090300126, 'bull_time_stop': 155, 'bull_use_sma': False, 'bull_use_ema': False, 'bull_use_atr': True, 'bull_use_adx': True, 'bull_use_spike': False, 'bull_rsi_required': False, 'bear_strategy': 'mean_reversion', 'bear_bb_std_mult': 2.458937071348901, 'bear_rsi_os': 13, 'bear_rsi_ob': 81, 'bear_adx_thresh': 9.355693230095948, 'bear_atr_min_pct': 0.010046706442270254, 'bear_atr_max_pct': 0.015786234972272828, 'bear_tp_mult': 1.8973264336251203, 'bear_tsl_mult': 0.43144787835939075, 'bear_time_stop': 18, 'bear_use_sma': True, 'bear_use_ema': False, 'bear_use_atr': False, 'bear_use_adx': True, 'bear_use_spike': True, 'bear_rsi_required': False, 'sideways_strategy': 'mean_reversion', 'sideways_bb_std_mult': 1.2894039880105823, 'sideways_rsi_os': 17, 'sideways_rsi_ob': 88, 'sideways_adx_thresh': 12.040160937097875, 'sideways_atr_min_pct': 0.026510459787876306, 'sideways_atr_max_pct': 0.1365363585760414, 'sideways_tp_mult': 1.093749684631828, 'sideways_tsl_mult': 0.5479293483140528, 'sideways_time_stop': 146, 'sideways_use_sma': True, 'sideways_use_ema': False, 'sideways_use_atr': False, 'sideways_use_adx': False, 'sideways_use_spike': True, 'sideways_rsi_required': False}.
