[I 2025-08-31 00:37:28,687] Trial 306 finished with values: [-1000000000.0, 1000000000.0] and parameters: {'p_sma': 49, 'p_std': 20, 'p_atr': 10, 'p_adx': 8, 'rsi_period': 79, 'ema1': 6, 'ema2': 30, 'slip_atr_k': 0.22177029980994356, 'slip_spread_k': 0.45600795457656046, 'spread_hl_frac': 0.024380201218369996, 'bb_std_mult': 2.0670020596339578, 'rsi_os': 54, 'rsi_ob': 78, 'vol_spike': 0.09903631425011211, 'adx_thresh': 11.112288194980325, 'atr_min_pct': 0.013680339170565478, 'atr_max_pct': 0.03221770411857962, 'tp_mult': 2.7330915557764106, 'tsl_mult': 0.0815369721754691, 'strategy': 'breakout', 'time_stop': 65, 'use_sma': True, 'use_atr': False, 'use_adx': False, 'use_ema': True, 'use_spike': False, 'rsi_required': False, 'edge_k': 1.685413895174655, 'edge_cap': 0.09271764607215705, 'bull_strategy': 'breakout', 'bull_bb_std_mult': 1.13640761243166, 'bull_rsi_os': 40, 'bull_rsi_ob': 73, 'bull_adx_thresh': 16.2204555459028, 'bull_atr_min_pct': 0.028423152171839272, 'bull_atr_max_pct': 0.07417775065975014, 'bull_tp_mult': 2.3890323198028924, 'bull_tsl_mult': 0.2984029410034481, 'bull_time_stop': 32, 'bull_use_sma': False, 'bull_use_ema': False, 'bull_use_atr': True, 'bull_use_adx': True, 'bull_use_spike': False, 'bull_rsi_required': False, 'bear_strategy': 'mean_reversion', 'bear_bb_std_mult': 1.000110374806299, 'bear_rsi_os': 21, 'bear_rsi_ob': 76, 'bear_adx_thresh': 16.2446460394262, 'bear_atr_min_pct': 0.026471488822254155, 'bear_atr_max_pct': 0.06276271268050596, 'bear_tp_mult': 1.821556226756335, 'bear_tsl_mult': 0.03952607325145541, 'bear_time_stop': 221, 'bear_use_sma': True, 'bear_use_ema': False, 'bear_use_atr': False, 'bear_use_adx': True, 'bear_use_spike': False, 'bear_rsi_required': False, 'sideways_strategy': 'mean_reversion', 'sideways_bb_std_mult': 1.9735276348678648, 'sideways_rsi_os': 33, 'sideways_rsi_ob': 47, 'sideways_adx_thresh': 26.333268813640572, 'sideways_atr_min_pct': 0.021083609787486152, 'sideways_atr_max_pct': 0.1468542420730698, 'sideways_tp_mult': 1.0956818305155493, 'sideways_tsl_mult': 0.9450081938064825, 'sideways_time_stop': 154, 'sideways_use_sma': True, 'sideways_use_ema': False, 'sideways_use_atr': False, 'sideways_use_adx': False, 'sideways_use_spike': True, 'sideways_rsi_required': False}.
[I 2025-08-31 00:37:28,911] Trial 307 finished with values: [-1000000000.0, 1000000000.0] and parameters: {'p_sma': 22, 'p_std': 44, 'p_atr': 18, 'p_adx': 8, 'rsi_period': 59, 'ema1': 6, 'ema2': 55, 'slip_atr_k': 0.030703194144844223, 'slip_spread_k': 0.3029843537035342, 'spread_hl_frac': 0.012133516815543529, 'bb_std_mult': 1.882359350087829, 'rsi_os': 32, 'rsi_ob': 93, 'vol_spike': 0.10941198116135684, 'adx_thresh': 12.520186298887463, 'atr_min_pct': 0.019216662569148203, 'atr_max_pct': 0.07342696516911217, 'tp_mult': 2.6749950208517914, 'tsl_mult': 0.849148957342126, 'strategy': 'breakout', 'time_stop': 86, 'use_sma': True, 'use_atr': False, 'use_adx': False, 'use_ema': True, 'use_spike': False, 'rsi_required': False, 'edge_k': 0.2549592444677804, 'edge_cap': 0.09614801057453054, 'bull_strategy': 'breakout', 'bull_bb_std_mult': 2.8240509393561535, 'bull_rsi_os': 38, 'bull_rsi_ob': 72, 'bull_adx_thresh': 30.658590162347785, 'bull_atr_min_pct': 0.0007552625910313246, 'bull_atr_max_pct': 0.1402117169309835, 'bull_tp_mult': 1.045065678289908, 'bull_tsl_mult': 0.31831356473608224, 'bull_time_stop': 155, 'bull_use_sma': False, 'bull_use_ema': False, 'bull_use_atr': True, 'bull_use_adx': True, 'bull_use_spike': False, 'bull_rsi_required': False, 'bear_strategy': 'mean_reversion', 'bear_bb_std_mult': 0.9935024409195169, 'bear_rsi_os': 42, 'bear_rsi_ob': 61, 'bear_adx_thresh': 22.929947463003778, 'bear_atr_min_pct': 0.0068172347397642465, 'bear_atr_max_pct': 0.08879081350890095, 'bear_tp_mult': 2.8732149827430478, 'bear_tsl_mult': 0.9453966249462029, 'bear_time_stop': 39, 'bear_use_sma': True, 'bear_use_ema': False, 'bear_use_atr': False, 'bear_use_adx': True, 'bear_use_spike': False, 'bear_rsi_required': True, 'sideways_strategy': 'mean_reversion', 'sideways_bb_std_mult': 1.9454872774377099, 'sideways_rsi_os': 47, 'sideways_rsi_ob': 90, 'sideways_adx_thresh': 22.47350263734503, 'sideways_atr_min_pct': 0.021081844242715836, 'sideways_atr_max_pct': 0.14330087312723375, 'sideways_tp_mult': 1.104122034417641, 'sideways_tsl_mult': 0.6104294137302279, 'sideways_time_stop': 139, 'sideways_use_sma': True, 'sideways_use_ema': False, 'sideways_use_atr': False, 'sideways_use_adx': False, 'sideways_use_spike': True, 'sideways_rsi_required': False}.
[I 2025-08-31 00:37:58,967] Trial 308 finished with values: [-1000000000.0, 1000000000.0] and parameters: {'p_sma': 22, 'p_std': 20, 'p_atr': 18, 'p_adx': 8, 'rsi_period': 59, 'ema1': 20, 'ema2': 18, 'slip_atr_k': 0.0453917711418145, 'slip_spread_k': 0.30793755832500164, 'spread_hl_frac': 0.00793688325654169, 'bb_std_mult': 2.617331511502358, 'rsi_os': 31, 'rsi_ob': 74, 'vol_spike': 0.23796670814291537, 'adx_thresh': 33.35800360320658, 'atr_min_pct': 0.01218893971659521, 'atr_max_pct': 0.0735072823888172, 'tp_mult': 2.682846153934535, 'tsl_mult': 0.0874344333936738, 'strategy': 'breakout', 'time_stop': 211, 'use_sma': True, 'use_atr': False, 'use_adx': False, 'use_ema': True, 'use_spike': False, 'rsi_required': False, 'edge_k': 1.3582554331168624, 'edge_cap': 0.601001415433454, 'bull_strategy': 'breakout', 'bull_bb_std_mult': 1.096952570186026, 'bull_rsi_os': 48, 'bull_rsi_ob': 72, 'bull_adx_thresh': 29.683477881990243, 'bull_atr_min_pct': 0.028308388630205704, 'bull_atr_max_pct': 0.07452431079796619, 'bull_tp_mult': 1.7434077357358175, 'bull_tsl_mult': 0.30538081542595197, 'bull_time_stop': 78, 'bull_use_sma': False, 'bull_use_ema': False, 'bull_use_atr': True, 'bull_use_adx': True, 'bull_use_spike': False, 'bull_rsi_required': False, 'bear_strategy': 'mean_reversion', 'bear_bb_std_mult': 1.5116520360192771, 'bear_rsi_os': 43, 'bear_rsi_ob': 60, 'bear_adx_thresh': 10.532207973518444, 'bear_atr_min_pct': 0.00528467521929254, 'bear_atr_max_pct': 0.07293799810323821, 'bear_tp_mult': 1.434224700167388, 'bear_tsl_mult': 0.6611685787604535, 'bear_time_stop': 248, 'bear_use_sma': True, 'bear_use_ema': False, 'bear_use_atr': False, 'bear_use_adx': True, 'bear_use_spike': False, 'bear_rsi_required': False, 'sideways_strategy': 'mean_reversion', 'sideways_bb_std_mult': 1.9222712212203992, 'sideways_rsi_os': 23, 'sideways_rsi_ob': 95, 'sideways_adx_thresh': 26.644260739480547, 'sideways_atr_min_pct': 0.021092454807848927, 'sideways_atr_max_pct': 0.14708651937740266, 'sideways_tp_mult': 1.1054662811070466, 'sideways_tsl_mult': 0.9342786210310361, 'sideways_time_stop': 190, 'sideways_use_sma': True, 'sideways_use_ema': False, 'sideways_use_atr': False, 'sideways_use_adx': False, 'sideways_use_spike': True, 'sideways_rsi_required': False}.
[I 2025-08-31 00:37:59,493] Trial 309 finished with values: [-0.02090347169742368, 0.020910859831738737] and parameters: {'p_sma': 49, 'p_std': 20, 'p_atr': 18, 'p_adx': 8, 'rsi_period': 56, 'ema1': 8, 'ema2': 30, 'slip_atr_k': 0.045519490345273875, 'slip_spread_k': 0.3009318131854851, 'spread_hl_frac': 0.029023622580719846, 'bb_std_mult': 1.884840737928869, 'rsi_os': 55, 'rsi_ob': 69, 'vol_spike': 0.16206246372482108, 'adx_thresh': 33.25326040268723, 'atr_min_pct': 0.014953071940594047, 'atr_max_pct': 0.03245468606342492, 'tp_mult': 2.7577685059243597, 'tsl_mult': 0.0864173880200659, 'strategy': 'breakout', 'time_stop': 74, 'use_sma': True, 'use_atr': False, 'use_adx': False, 'use_ema': True, 'use_spike': False, 'rsi_required': False, 'edge_k': 0.028098920401969374, 'edge_cap': 0.6009328547801556, 'bull_strategy': 'breakout', 'bull_bb_std_mult': 1.4991706011049537, 'bull_rsi_os': 38, 'bull_rsi_ob': 72, 'bull_adx_thresh': 27.11596506531136, 'bull_atr_min_pct': 0.0007792936456264554, 'bull_atr_max_pct': 0.06909594899811411, 'bull_tp_mult': 2.38407636581242, 'bull_tsl_mult': 0.04423520251473245, 'bull_time_stop': 158, 'bull_use_sma': False, 'bull_use_ema': False, 'bull_use_atr': True, 'bull_use_adx': True, 'bull_use_spike': False, 'bull_rsi_required': True, 'bear_strategy': 'mean_reversion', 'bear_bb_std_mult': 0.9758170400773583, 'bear_rsi_os': 50, 'bear_rsi_ob': 47, 'bear_adx_thresh': 16.251655765737954, 'bear_atr_min_pct': 0.006981182095851416, 'bear_atr_max_pct': 0.11472289262693583, 'bear_tp_mult': 1.9221286712521266, 'bear_tsl_mult': 0.6673677334086723, 'bear_time_stop': 38, 'bear_use_sma': True, 'bear_use_ema': False, 'bear_use_atr': False, 'bear_use_adx': False, 'bear_use_spike': False, 'bear_rsi_required': False, 'sideways_strategy': 'mean_reversion', 'sideways_bb_std_mult': 3.079218852000178, 'sideways_rsi_os': 15, 'sideways_rsi_ob': 88, 'sideways_adx_thresh': 22.439042905209682, 'sideways_atr_min_pct': 0.021222743423977095, 'sideways_atr_max_pct': 0.14633179847895966, 'sideways_tp_mult': 1.0407951988218886, 'sideways_tsl_mult': 0.7023082574195701, 'sideways_time_stop': 189, 'sideways_use_sma': True, 'sideways_use_ema': True, 'sideways_use_atr': False, 'sideways_use_adx': False, 'sideways_use_spike': True, 'sideways_rsi_required': False}.
[I 2025-08-31 00:37:59,921] Trial 310 finished with values: [-0.02852239828801828, 0.028428407713719038] and parameters: {'p_sma': 32, 'p_std': 6, 'p_atr': 18, 'p_adx': 8, 'rsi_period': 56, 'ema1': 8, 'ema2': 18, 'slip_atr_k': 0.04587439025632006, 'slip_spread_k': 0.23528978323125888, 'spread_hl_frac': 0.028749009582672645, 'bb_std_mult': 2.5745926431665804, 'rsi_os': 53, 'rsi_ob': 93, 'vol_spike': 0.15844788094676027, 'adx_thresh': 12.672668563247388, 'atr_min_pct': 0.027009453447649892, 'atr_max_pct': 0.07335577518773104, 'tp_mult': 2.6151813695099735, 'tsl_mult': 0.8528599791021877, 'strategy': 'breakout', 'time_stop': 71, 'use_sma': True, 'use_atr': False, 'use_adx': True, 'use_ema': True, 'use_spike': False, 'rsi_required': False, 'edge_k': 0.6217024688333977, 'edge_cap': 0.6042966312765357, 'bull_strategy': 'breakout', 'bull_bb_std_mult': 2.8814161354802073, 'bull_rsi_os': 48, 'bull_rsi_ob': 71, 'bull_adx_thresh': 10.739060491985557, 'bull_atr_min_pct': 0.0006249593271886226, 'bull_atr_max_pct': 0.13985948413508908, 'bull_tp_mult': 1.0453033394304923, 'bull_tsl_mult': 0.311249618945499, 'bull_time_stop': 157, 'bull_use_sma': False, 'bull_use_ema': False, 'bull_use_atr': True, 'bull_use_adx': True, 'bull_use_spike': False, 'bull_rsi_required': True, 'bear_strategy': 'mean_reversion', 'bear_bb_std_mult': 1.512783839687506, 'bear_rsi_os': 23, 'bear_rsi_ob': 79, 'bear_adx_thresh': 11.395209116128203, 'bear_atr_min_pct': 0.02891724690941158, 'bear_atr_max_pct': 0.07206744113687334, 'bear_tp_mult': 2.150874147410781, 'bear_tsl_mult': 0.6661093529848598, 'bear_time_stop': 39, 'bear_use_sma': True, 'bear_use_ema': False, 'bear_use_atr': False, 'bear_use_adx': False, 'bear_use_spike': False, 'bear_rsi_required': False, 'sideways_strategy': 'mean_reversion', 'sideways_bb_std_mult': 3.0869371710920745, 'sideways_rsi_os': 23, 'sideways_rsi_ob': 90, 'sideways_adx_thresh': 22.50052177427953, 'sideways_atr_min_pct': 0.020228584811352632, 'sideways_atr_max_pct': 0.1442934104069471, 'sideways_tp_mult': 1.4154525390756656, 'sideways_tsl_mult': 0.9974698881303276, 'sideways_time_stop': 174, 'sideways_use_sma': True, 'sideways_use_ema': True, 'sideways_use_atr': False, 'sideways_use_adx': False, 'sideways_use_spike': True, 'sideways_rsi_required': False}.
[I 2025-08-31 00:38:00,383] Trial 311 finished with values: [-1000000000.0, 1000000000.0] and parameters: {'p_sma': 48, 'p_std': 17, 'p_atr': 25, 'p_adx': 25, 'rsi_period': 56, 'ema1': 8, 'ema2': 18, 'slip_atr_k': 0.04510163106168494, 'slip_spread_k': 0.2352611858743667, 'spread_hl_frac': 0.028965706391527374, 'bb_std_mult': 2.604164785780414, 'rsi_os': 26, 'rsi_ob': 69, 'vol_spike': 0.18479700468763968, 'adx_thresh': 12.092084225889433, 'atr_min_pct': 0.015023720322867895, 'atr_max_pct': 0.027228805508638862, 'tp_mult': 2.8221405446627528, 'tsl_mult': 0.053781947648871176, 'strategy': 'breakout', 'time_stop': 227, 'use_sma': True, 'use_atr': False, 'use_adx': True, 'use_ema': True, 'use_spike': False, 'rsi_required': False, 'edge_k': 0.7783049747481692, 'edge_cap': 0.3755130940476479, 'bull_strategy': 'breakout', 'bull_bb_std_mult': 2.665349759828368, 'bull_rsi_os': 48, 'bull_rsi_ob': 71, 'bull_adx_thresh': 11.435086978368117, 'bull_atr_min_pct': 0.027432651351497337, 'bull_atr_max_pct': 0.023822527893455722, 'bull_tp_mult': 1.7468414642807994, 'bull_tsl_mult': 0.43503625140802593, 'bull_time_stop': 62, 'bull_use_sma': False, 'bull_use_ema': False, 'bull_use_atr': True, 'bull_use_adx': True, 'bull_use_spike': False, 'bull_rsi_required': True, 'bear_strategy': 'mean_reversion', 'bear_bb_std_mult': 1.203441652883974, 'bear_rsi_os': 23, 'bear_rsi_ob': 79, 'bear_adx_thresh': 11.26303657155073, 'bear_atr_min_pct': 0.029158810456771378, 'bear_atr_max_pct': 0.1082090098938911, 'bear_tp_mult': 2.7965938149143046, 'bear_tsl_mult': 0.342821310380233, 'bear_time_stop': 26, 'bear_use_sma': True, 'bear_use_ema': False, 'bear_use_atr': False, 'bear_use_adx': False, 'bear_use_spike': False, 'bear_rsi_required': False, 'sideways_strategy': 'mean_reversion', 'sideways_bb_std_mult': 2.699454702759475, 'sideways_rsi_os': 49, 'sideways_rsi_ob': 88, 'sideways_adx_thresh': 9.366819174478488, 'sideways_atr_min_pct': 0.027317950698072132, 'sideways_atr_max_pct': 0.13883329595153107, 'sideways_tp_mult': 1.047400141909393, 'sideways_tsl_mult': 0.7021033754911251, 'sideways_time_stop': 63, 'sideways_use_sma': True, 'sideways_use_ema': True, 'sideways_use_atr': False, 'sideways_use_adx': False, 'sideways_use_spike': True, 'sideways_rsi_required': False}.
[I 2025-08-31 00:38:00,931] Trial 315 finished with values: [-1000000000.0, 1000000000.0] and parameters: {'p_sma': 50, 'p_std': 37, 'p_atr': 16, 'p_adx': 9, 'rsi_period': 63, 'ema1': 18, 'ema2': 58, 'slip_atr_k': 0.03920469087770085, 'slip_spread_k': 0.2484574752242966, 'spread_hl_frac': 0.03266609318011794, 'bb_std_mult': 2.990824941168981, 'rsi_os': 55, 'rsi_ob': 67, 'vol_spike': 0.06376242735028767, 'adx_thresh': 16.877548114355, 'atr_min_pct': 0.004969139380772336, 'atr_max_pct': 0.06681834018912602, 'tp_mult': 2.614276676974878, 'tsl_mult': 0.10600496047332007, 'strategy': 'mean_reversion', 'time_stop': 97, 'use_sma': True, 'use_atr': False, 'use_adx': False, 'use_ema': True, 'use_spike': True, 'rsi_required': False, 'edge_k': 0.04260241598960557, 'edge_cap': 0.8544160084099297, 'bull_strategy': 'mean_reversion', 'bull_bb_std_mult': 3.364597514314001, 'bull_rsi_os': 38, 'bull_rsi_ob': 69, 'bull_adx_thresh': 6.461323795686006, 'bull_atr_min_pct': 0.024172277738039122, 'bull_atr_max_pct': 0.10940165468367576, 'bull_tp_mult': 2.7030518862899835, 'bull_tsl_mult': 0.8073497316128244, 'bull_time_stop': 171, 'bull_use_sma': False, 'bull_use_ema': False, 'bull_use_atr': True, 'bull_use_adx': False, 'bull_use_spike': False, 'bull_rsi_required': False, 'bear_strategy': 'mean_reversion', 'bear_bb_std_mult': 1.1421449950391094, 'bear_rsi_os': 21, 'bear_rsi_ob': 77, 'bear_adx_thresh': 34.917769903521325, 'bear_atr_min_pct': 0.00929606963245751, 'bear_atr_max_pct': 0.0224248526134182, 'bear_tp_mult': 1.9236487424925817, 'bear_tsl_mult': 0.7805151971487272, 'bear_time_stop': 31, 'bear_use_sma': True, 'bear_use_ema': True, 'bear_use_atr': False, 'bear_use_adx': True, 'bear_use_spike': True, 'bear_rsi_required': False, 'sideways_strategy': 'breakout', 'sideways_bb_std_mult': 1.2101947371367707, 'sideways_rsi_os': 13, 'sideways_rsi_ob': 92, 'sideways_adx_thresh': 15.946692491204054, 'sideways_atr_min_pct': 0.02178824657816472, 'sideways_atr_max_pct': 0.10365993242332007, 'sideways_tp_mult': 1.5768948145720463, 'sideways_tsl_mult': 0.7320555337302874, 'sideways_time_stop': 52, 'sideways_use_sma': True, 'sideways_use_ema': False, 'sideways_use_atr': True, 'sideways_use_adx': False, 'sideways_use_spike': True, 'sideways_rsi_required': True}.
[I 2025-08-31 00:38:30,700] Trial 312 finished with values: [-1000000000.0, 1000000000.0] and parameters: {'p_sma': 32, 'p_std': 17, 'p_atr': 25, 'p_adx': 29, 'rsi_period': 56, 'ema1': 8, 'ema2': 13, 'slip_atr_k': 0.03934522414347079, 'slip_spread_k': 0.2793913191948275, 'spread_hl_frac': 0.04327974016985081, 'bb_std_mult': 2.4986084550236725, 'rsi_os': 53, 'rsi_ob': 67, 'vol_spike': 0.1590926526352553, 'adx_thresh': 24.278518350073277, 'atr_min_pct': 0.014929561131919948, 'atr_max_pct': 0.06706603144082071, 'tp_mult': 2.608936951390278, 'tsl_mult': 0.5293725519537836, 'strategy': 'breakout', 'time_stop': 71, 'use_sma': True, 'use_atr': False, 'use_adx': True, 'use_ema': True, 'use_spike': False, 'rsi_required': False, 'edge_k': 0.0418649723692438, 'edge_cap': 0.4199025458142688, 'bull_strategy': 'mean_reversion', 'bull_bb_std_mult': 1.5020561313072482, 'bull_rsi_os': 38, 'bull_rsi_ob': 69, 'bull_adx_thresh': 11.263368417466447, 'bull_atr_min_pct': 0.006417241715672661, 'bull_atr_max_pct': 0.06830518769913067, 'bull_tp_mult': 2.6977350120765125, 'bull_tsl_mult': 0.06685509672739415, 'bull_time_stop': 169, 'bull_use_sma': False, 'bull_use_ema': False, 'bull_use_atr': True, 'bull_use_adx': False, 'bull_use_spike': False, 'bull_rsi_required': True, 'bear_strategy': 'mean_reversion', 'bear_bb_std_mult': 1.2234863260562665, 'bear_rsi_os': 23, 'bear_rsi_ob': 78, 'bear_adx_thresh': 12.457383012941705, 'bear_atr_min_pct': 0.019810097250020156, 'bear_atr_max_pct': 0.10764783018124136, 'bear_tp_mult': 2.7840945197930105, 'bear_tsl_mult': 0.6843749699163221, 'bear_time_stop': 162, 'bear_use_sma': True, 'bear_use_ema': False, 'bear_use_atr': False, 'bear_use_adx': False, 'bear_use_spike': False, 'bear_rsi_required': False, 'sideways_strategy': 'mean_reversion', 'sideways_bb_std_mult': 0.9878917754791715, 'sideways_rsi_os': 38, 'sideways_rsi_ob': 77, 'sideways_adx_thresh': 9.48055702409647, 'sideways_atr_min_pct': 0.010162241296861184, 'sideways_atr_max_pct': 0.010046614606127852, 'sideways_tp_mult': 1.043382106740863, 'sideways_tsl_mult': 0.7232082260308075, 'sideways_time_stop': 64, 'sideways_use_sma': True, 'sideways_use_ema': True, 'sideways_use_atr': False, 'sideways_use_adx': False, 'sideways_use_spike': True, 'sideways_rsi_required': True}.
[I 2025-08-31 00:38:30,991] Trial 314 finished with values: [-1000000000.0, 1000000000.0] and parameters: {'p_sma': 44, 'p_std': 38, 'p_atr': 19, 'p_adx': 29, 'rsi_period': 9, 'ema1': 7, 'ema2': 19, 'slip_atr_k': 0.014540083586666905, 'slip_spread_k': 0.24642097591568665, 'spread_hl_frac': 0.038777073126843864, 'bb_std_mult': 0.695331365742129, 'rsi_os': 55, 'rsi_ob': 46, 'vol_spike': 0.08815687092602303, 'adx_thresh': 17.14361984890067, 'atr_min_pct': 0.015675443039157196, 'atr_max_pct': 0.06798278373950797, 'tp_mult': 1.4591803354773396, 'tsl_mult': 0.06164657100475451, 'strategy': 'breakout', 'time_stop': 100, 'use_sma': True, 'use_atr': False, 'use_adx': False, 'use_ema': True, 'use_spike': True, 'rsi_required': False, 'edge_k': 0.7677447156199196, 'edge_cap': 0.8467981508579739, 'bull_strategy': 'mean_reversion', 'bull_bb_std_mult': 3.3700882604317037, 'bull_rsi_os': 32, 'bull_rsi_ob': 69, 'bull_adx_thresh': 6.2222662186477145, 'bull_atr_min_pct': 0.0037881815532436434, 'bull_atr_max_pct': 0.06878625858903754, 'bull_tp_mult': 2.5578843073425994, 'bull_tsl_mult': 0.46910675260229595, 'bull_time_stop': 170, 'bull_use_sma': False, 'bull_use_ema': False, 'bull_use_atr': True, 'bull_use_adx': False, 'bull_use_spike': False, 'bull_rsi_required': True, 'bear_strategy': 'mean_reversion', 'bear_bb_std_mult': 1.2198692659834733, 'bear_rsi_os': 23, 'bear_rsi_ob': 85, 'bear_adx_thresh': 34.97142545554726, 'bear_atr_min_pct': 0.009528154360589375, 'bear_atr_max_pct': 0.02177115656570526, 'bear_tp_mult': 2.796085171358869, 'bear_tsl_mult': 0.3565056877706989, 'bear_time_stop': 209, 'bear_use_sma': True, 'bear_use_ema': True, 'bear_use_atr': False, 'bear_use_adx': False, 'bear_use_spike': False, 'bear_rsi_required': False, 'sideways_strategy': 'mean_reversion', 'sideways_bb_std_mult': 1.2046775019815608, 'sideways_rsi_os': 49, 'sideways_rsi_ob': 92, 'sideways_adx_thresh': 9.526548913957926, 'sideways_atr_min_pct': 0.027475276471556412, 'sideways_atr_max_pct': 0.13930867619911558, 'sideways_tp_mult': 1.9669579258463086, 'sideways_tsl_mult': 0.7229282892704676, 'sideways_time_stop': 60, 'sideways_use_sma': True, 'sideways_use_ema': True, 'sideways_use_atr': True, 'sideways_use_adx': False, 'sideways_use_spike': True, 'sideways_rsi_required': True}.
