[I 2025-08-31 02:31:35,912] Trial 542 finished with values: [-1000000000.0, 1000000000.0] and parameters: {'p_sma': 53, 'p_std': 49, 'p_atr': 28, 'p_adx': 22, 'rsi_period': 69, 'ema1': 5, 'ema2': 29, 'slip_atr_k': 0.14157378232902987, 'slip_spread_k': 0.1253600704868362, 'spread_hl_frac': 0.0026386207633045007, 'bb_std_mult': 1.7217988060260654, 'rsi_os': 39, 'rsi_ob': 69, 'vol_spike': 0.1876273109871796, 'adx_thresh': 20.14989855895301, 'atr_min_pct': 0.009303801466126617, 'atr_max_pct': 0.11760678612098915, 'tp_mult': 1.440919608876245, 'tsl_mult': 0.5308549954703152, 'strategy': 'mean_reversion', 'time_stop': 127, 'use_sma': True, 'use_atr': False, 'use_adx': False, 'use_ema': False, 'use_spike': False, 'rsi_required': True, 'edge_k': 0.5800083049595074, 'edge_cap': 0.11357981388980612, 'bull_strategy': 'breakout', 'bull_bb_std_mult': 2.363896628469867, 'bull_rsi_os': 43, 'bull_rsi_ob': 49, 'bull_adx_thresh': 6.104814944854885, 'bull_atr_min_pct': 0.013745165835011511, 'bull_atr_max_pct': 0.143341788865335, 'bull_tp_mult': 2.343322808104282, 'bull_tsl_mult': 0.21878154856705545, 'bull_time_stop': 136, 'bull_use_sma': True, 'bull_use_ema': False, 'bull_use_atr': False, 'bull_use_adx': True, 'bull_use_spike': True, 'bull_rsi_required': True, 'bear_strategy': 'mean_reversion', 'bear_bb_std_mult': 1.271493221997751, 'bear_rsi_os': 14, 'bear_rsi_ob': 45, 'bear_adx_thresh': 5.620957516286419, 'bear_atr_min_pct': 0.006803591413586399, 'bear_atr_max_pct': 0.01578462309506183, 'bear_tp_mult': 2.0986900710040244, 'bear_tsl_mult': 0.5805501496459079, 'bear_time_stop': 17, 'bear_use_sma': False, 'bear_use_ema': False, 'bear_use_atr': False, 'bear_use_adx': True, 'bear_use_spike': False, 'bear_rsi_required': True, 'sideways_strategy': 'breakout', 'sideways_bb_std_mult': 0.6048764165375707, 'sideways_rsi_os': 39, 'sideways_rsi_ob': 95, 'sideways_adx_thresh': 8.81055846150823, 'sideways_atr_min_pct': 0.02788813415665997, 'sideways_atr_max_pct': 0.05529108924871172, 'sideways_tp_mult': 1.6430453810929964, 'sideways_tsl_mult': 0.6648304369741899, 'sideways_time_stop': 208, 'sideways_use_sma': False, 'sideways_use_ema': False, 'sideways_use_atr': False, 'sideways_use_adx': False, 'sideways_use_spike': True, 'sideways_rsi_required': False}.
[I 2025-08-31 02:31:36,171] Trial 543 finished with values: [-1000000000.0, 1000000000.0] and parameters: {'p_sma': 53, 'p_std': 49, 'p_atr': 28, 'p_adx': 30, 'rsi_period': 71, 'ema1': 5, 'ema2': 29, 'slip_atr_k': 0.13747201547205695, 'slip_spread_k': 0.11987458948810004, 'spread_hl_frac': 9.386970966114225e-05, 'bb_std_mult': 1.5774113126544618, 'rsi_os': 38, 'rsi_ob': 69, 'vol_spike': 0.1982975162250136, 'adx_thresh': 20.24901482843202, 'atr_min_pct': 0.009499882110986405, 'atr_max_pct': 0.11753605527725176, 'tp_mult': 1.6103944935464694, 'tsl_mult': 0.4924970167660563, 'strategy': 'mean_reversion', 'time_stop': 124, 'use_sma': True, 'use_atr': False, 'use_adx': False, 'use_ema': False, 'use_spike': False, 'rsi_required': True, 'edge_k': 0.5589887181261671, 'edge_cap': 0.12083214558153375, 'bull_strategy': 'breakout', 'bull_bb_std_mult': 2.336020839036098, 'bull_rsi_os': 29, 'bull_rsi_ob': 57, 'bull_adx_thresh': 5.155055462915843, 'bull_atr_min_pct': 0.003964262248535126, 'bull_atr_max_pct': 0.13735991656823443, 'bull_tp_mult': 2.3345289745494258, 'bull_tsl_mult': 0.2722915013656885, 'bull_time_stop': 119, 'bull_use_sma': True, 'bull_use_ema': False, 'bull_use_atr': False, 'bull_use_adx': True, 'bull_use_spike': True, 'bull_rsi_required': True, 'bear_strategy': 'mean_reversion', 'bear_bb_std_mult': 1.4039435653156689, 'bear_rsi_os': 14, 'bear_rsi_ob': 45, 'bear_adx_thresh': 5.61541204393795, 'bear_atr_min_pct': 0.0067392087056432765, 'bear_atr_max_pct': 0.015260732250957454, 'bear_tp_mult': 2.0891030167111415, 'bear_tsl_mult': 0.5862605417877715, 'bear_time_stop': 15, 'bear_use_sma': False, 'bear_use_ema': False, 'bear_use_atr': False, 'bear_use_adx': True, 'bear_use_spike': False, 'bear_rsi_required': True, 'sideways_strategy': 'breakout', 'sideways_bb_std_mult': 0.6072928488756568, 'sideways_rsi_os': 39, 'sideways_rsi_ob': 93, 'sideways_adx_thresh': 9.051182619023823, 'sideways_atr_min_pct': 0.027721140386426837, 'sideways_atr_max_pct': 0.0561826094438739, 'sideways_tp_mult': 1.7638819399777101, 'sideways_tsl_mult': 0.6711008376508754, 'sideways_time_stop': 209, 'sideways_use_sma': False, 'sideways_use_ema': False, 'sideways_use_atr': False, 'sideways_use_adx': False, 'sideways_use_spike': True, 'sideways_rsi_required': False}.
[I 2025-08-31 02:31:36,635] Trial 541 finished with values: [-1000000000.0, 1000000000.0] and parameters: {'p_sma': 53, 'p_std': 49, 'p_atr': 30, 'p_adx': 30, 'rsi_period': 69, 'ema1': 5, 'ema2': 13, 'slip_atr_k': 0.14122584761572515, 'slip_spread_k': 0.15170143750809176, 'spread_hl_frac': 0.00018384960925983337, 'bb_std_mult': 1.7106766395635251, 'rsi_os': 39, 'rsi_ob': 69, 'vol_spike': 0.19753624442782564, 'adx_thresh': 20.20341682229239, 'atr_min_pct': 0.009398941833272025, 'atr_max_pct': 0.12691720537493525, 'tp_mult': 1.4806888424741032, 'tsl_mult': 0.532379445419213, 'strategy': 'mean_reversion', 'time_stop': 125, 'use_sma': True, 'use_atr': False, 'use_adx': False, 'use_ema': False, 'use_spike': False, 'rsi_required': True, 'edge_k': 0.5774161398597952, 'edge_cap': 0.12195623550286895, 'bull_strategy': 'breakout', 'bull_bb_std_mult': 2.0884282696600156, 'bull_rsi_os': 29, 'bull_rsi_ob': 51, 'bull_adx_thresh': 5.095144370785382, 'bull_atr_min_pct': 0.013644742199450818, 'bull_atr_max_pct': 0.14359837363936306, 'bull_tp_mult': 2.331817163312175, 'bull_tsl_mult': 0.22114995513270014, 'bull_time_stop': 137, 'bull_use_sma': True, 'bull_use_ema': False, 'bull_use_atr': False, 'bull_use_adx': True, 'bull_use_spike': True, 'bull_rsi_required': True, 'bear_strategy': 'mean_reversion', 'bear_bb_std_mult': 1.4215337088600908, 'bear_rsi_os': 14, 'bear_rsi_ob': 46, 'bear_adx_thresh': 5.62218966548955, 'bear_atr_min_pct': 0.006288895345977922, 'bear_atr_max_pct': 0.01486265601846071, 'bear_tp_mult': 2.1076679727121705, 'bear_tsl_mult': 0.5817514422939319, 'bear_time_stop': 10, 'bear_use_sma': False, 'bear_use_ema': False, 'bear_use_atr': False, 'bear_use_adx': True, 'bear_use_spike': False, 'bear_rsi_required': True, 'sideways_strategy': 'breakout', 'sideways_bb_std_mult': 0.5981096198858439, 'sideways_rsi_os': 40, 'sideways_rsi_ob': 94, 'sideways_adx_thresh': 9.007645989014296, 'sideways_atr_min_pct': 0.029069085892747183, 'sideways_atr_max_pct': 0.05217016318389695, 'sideways_tp_mult': 1.628872390854727, 'sideways_tsl_mult': 0.662138761237627, 'sideways_time_stop': 222, 'sideways_use_sma': True, 'sideways_use_ema': True, 'sideways_use_atr': False, 'sideways_use_adx': False, 'sideways_use_spike': True, 'sideways_rsi_required': False}.
[I 2025-08-31 02:31:36,715] Trial 540 finished with values: [-1000000000.0, 1000000000.0] and parameters: {'p_sma': 55, 'p_std': 49, 'p_atr': 27, 'p_adx': 30, 'rsi_period': 69, 'ema1': 5, 'ema2': 35, 'slip_atr_k': 0.09353949250518315, 'slip_spread_k': 0.1445654933492897, 'spread_hl_frac': 0.001124554823465861, 'bb_std_mult': 1.7223961786760793, 'rsi_os': 36, 'rsi_ob': 69, 'vol_spike': 0.18748826759231907, 'adx_thresh': 21.090648684257523, 'atr_min_pct': 0.009427037946217154, 'atr_max_pct': 0.1275838823416762, 'tp_mult': 1.4359676326319941, 'tsl_mult': 0.5036185986366772, 'strategy': 'mean_reversion', 'time_stop': 108, 'use_sma': True, 'use_atr': False, 'use_adx': False, 'use_ema': False, 'use_spike': False, 'rsi_required': True, 'edge_k': 0.5527756154604737, 'edge_cap': 0.1310331412660836, 'bull_strategy': 'breakout', 'bull_bb_std_mult': 1.9422622764695947, 'bull_rsi_os': 46, 'bull_rsi_ob': 57, 'bull_adx_thresh': 6.797147686788576, 'bull_atr_min_pct': 0.012007427314465764, 'bull_atr_max_pct': 0.13847533385068153, 'bull_tp_mult': 2.230847017488171, 'bull_tsl_mult': 0.2773122288069249, 'bull_time_stop': 136, 'bull_use_sma': True, 'bull_use_ema': False, 'bull_use_atr': False, 'bull_use_adx': True, 'bull_use_spike': True, 'bull_rsi_required': True, 'bear_strategy': 'breakout', 'bear_bb_std_mult': 1.3553930659975884, 'bear_rsi_os': 17, 'bear_rsi_ob': 46, 'bear_adx_thresh': 5.859761627108205, 'bear_atr_min_pct': 0.006579296496943398, 'bear_atr_max_pct': 0.0152601888172019, 'bear_tp_mult': 2.099780979779007, 'bear_tsl_mult': 0.5816786698180202, 'bear_time_stop': 5, 'bear_use_sma': False, 'bear_use_ema': False, 'bear_use_atr': False, 'bear_use_adx': True, 'bear_use_spike': True, 'bear_rsi_required': True, 'sideways_strategy': 'breakout', 'sideways_bb_std_mult': 0.5989399334409791, 'sideways_rsi_os': 40, 'sideways_rsi_ob': 95, 'sideways_adx_thresh': 7.996668879544396, 'sideways_atr_min_pct': 0.026347352764257013, 'sideways_atr_max_pct': 0.0527426293866399, 'sideways_tp_mult': 1.7629796264905642, 'sideways_tsl_mult': 0.6600737967372585, 'sideways_time_stop': 205, 'sideways_use_sma': True, 'sideways_use_ema': False, 'sideways_use_atr': False, 'sideways_use_adx': False, 'sideways_use_spike': True, 'sideways_rsi_required': False}.
[I 2025-08-31 02:32:09,205] Trial 544 finished with values: [-1000000000.0, 1000000000.0] and parameters: {'p_sma': 54, 'p_std': 51, 'p_atr': 30, 'p_adx': 30, 'rsi_period': 74, 'ema1': 5, 'ema2': 34, 'slip_atr_k': 0.17640973163800083, 'slip_spread_k': 0.14341167675550773, 'spread_hl_frac': 0.0002049619756346135, 'bb_std_mult': 1.7505819051758744, 'rsi_os': 38, 'rsi_ob': 69, 'vol_spike': 0.1985726953451555, 'adx_thresh': 21.528543405258283, 'atr_min_pct': 0.008244058246611313, 'atr_max_pct': 0.1168630442657882, 'tp_mult': 1.891059522359617, 'tsl_mult': 0.4620264579003075, 'strategy': 'mean_reversion', 'time_stop': 104, 'use_sma': True, 'use_atr': False, 'use_adx': False, 'use_ema': False, 'use_spike': False, 'rsi_required': True, 'edge_k': 0.5484428202275551, 'edge_cap': 0.13220972004745557, 'bull_strategy': 'breakout', 'bull_bb_std_mult': 1.9521847917297421, 'bull_rsi_os': 55, 'bull_rsi_ob': 56, 'bull_adx_thresh': 5.143320030188214, 'bull_atr_min_pct': 0.004006138191434821, 'bull_atr_max_pct': 0.14415983137905317, 'bull_tp_mult': 2.3307950424545343, 'bull_tsl_mult': 0.27550298639599097, 'bull_time_stop': 124, 'bull_use_sma': True, 'bull_use_ema': False, 'bull_use_atr': False, 'bull_use_adx': True, 'bull_use_spike': True, 'bull_rsi_required': True, 'bear_strategy': 'mean_reversion', 'bear_bb_std_mult': 1.4183152487757769, 'bear_rsi_os': 15, 'bear_rsi_ob': 45, 'bear_adx_thresh': 6.088323650148938, 'bear_atr_min_pct': 0.006383019824404392, 'bear_atr_max_pct': 0.01628232655400349, 'bear_tp_mult': 2.0151943559161976, 'bear_tsl_mult': 0.5338017783112362, 'bear_time_stop': 15, 'bear_use_sma': False, 'bear_use_ema': False, 'bear_use_atr': True, 'bear_use_adx': True, 'bear_use_spike': False, 'bear_rsi_required': True, 'sideways_strategy': 'breakout', 'sideways_bb_std_mult': 0.5772315762103596, 'sideways_rsi_os': 39, 'sideways_rsi_ob': 93, 'sideways_adx_thresh': 9.21637287468052, 'sideways_atr_min_pct': 0.026807696882775102, 'sideways_atr_max_pct': 0.051688753164026616, 'sideways_tp_mult': 1.7658328684371853, 'sideways_tsl_mult': 0.6194436147491961, 'sideways_time_stop': 218, 'sideways_use_sma': True, 'sideways_use_ema': False, 'sideways_use_atr': False, 'sideways_use_adx': False, 'sideways_use_spike': False, 'sideways_rsi_required': False}.
[I 2025-08-31 02:32:09,905] Trial 546 finished with values: [-1000000000.0, 1000000000.0] and parameters: {'p_sma': 56, 'p_std': 52, 'p_atr': 30, 'p_adx': 24, 'rsi_period': 72, 'ema1': 5, 'ema2': 39, 'slip_atr_k': 0.08007171333235691, 'slip_spread_k': 0.1804960299251007, 'spread_hl_frac': 0.0024549229261452386, 'bb_std_mult': 1.7362819038258244, 'rsi_os': 41, 'rsi_ob': 67, 'vol_spike': 0.19654127183030723, 'adx_thresh': 21.47406771270355, 'atr_min_pct': 0.008140055600919929, 'atr_max_pct': 0.11922508106033501, 'tp_mult': 1.7379446864156924, 'tsl_mult': 0.4562926195111099, 'strategy': 'mean_reversion', 'time_stop': 114, 'use_sma': True, 'use_atr': False, 'use_adx': False, 'use_ema': False, 'use_spike': False, 'rsi_required': True, 'edge_k': 0.532407554589927, 'edge_cap': 0.1384614429661174, 'bull_strategy': 'mean_reversion', 'bull_bb_std_mult': 1.8179358141163928, 'bull_rsi_os': 46, 'bull_rsi_ob': 52, 'bull_adx_thresh': 6.043317476138024, 'bull_atr_min_pct': 0.01535374895234655, 'bull_atr_max_pct': 0.13818059143928182, 'bull_tp_mult': 2.219726500029756, 'bull_tsl_mult': 0.23528140000910636, 'bull_time_stop': 127, 'bull_use_sma': True, 'bull_use_ema': True, 'bull_use_atr': False, 'bull_use_adx': False, 'bull_use_spike': True, 'bull_rsi_required': True, 'bear_strategy': 'mean_reversion', 'bear_bb_std_mult': 1.3455475965555286, 'bear_rsi_os': 15, 'bear_rsi_ob': 45, 'bear_adx_thresh': 5.026567883680859, 'bear_atr_min_pct': 0.005735706873141486, 'bear_atr_max_pct': 0.016035585034349223, 'bear_tp_mult': 2.0318771740255657, 'bear_tsl_mult': 0.5307803157998664, 'bear_time_stop': 16, 'bear_use_sma': False, 'bear_use_ema': False, 'bear_use_atr': True, 'bear_use_adx': True, 'bear_use_spike': False, 'bear_rsi_required': True, 'sideways_strategy': 'breakout', 'sideways_bb_std_mult': 0.5743240391177844, 'sideways_rsi_os': 38, 'sideways_rsi_ob': 93, 'sideways_adx_thresh': 7.240775020293544, 'sideways_atr_min_pct': 0.0266701368572962, 'sideways_atr_max_pct': 0.05125585376373163, 'sideways_tp_mult': 1.774967299211827, 'sideways_tsl_mult': 0.6124960435924897, 'sideways_time_stop': 218, 'sideways_use_sma': True, 'sideways_use_ema': False, 'sideways_use_atr': True, 'sideways_use_adx': False, 'sideways_use_spike': False, 'sideways_rsi_required': False}.
[I 2025-08-31 02:32:10,108] Trial 545 finished with values: [-1000000000.0, 1000000000.0] and parameters: {'p_sma': 54, 'p_std': 52, 'p_atr': 27, 'p_adx': 24, 'rsi_period': 74, 'ema1': 5, 'ema2': 35, 'slip_atr_k': 0.06328566527809214, 'slip_spread_k': 0.18312109122968134, 'spread_hl_frac': 0.0024669268225098314, 'bb_std_mult': 1.7347405339580084, 'rsi_os': 39, 'rsi_ob': 69, 'vol_spike': 0.19829633949359834, 'adx_thresh': 21.44489631498964, 'atr_min_pct': 0.008112417587662164, 'atr_max_pct': 0.12665519987071056, 'tp_mult': 1.8830263431620915, 'tsl_mult': 0.31789610695762577, 'strategy': 'mean_reversion', 'time_stop': 115, 'use_sma': True, 'use_atr': False, 'use_adx': False, 'use_ema': False, 'use_spike': False, 'rsi_required': True, 'edge_k': 0.6209400837946865, 'edge_cap': 0.13759274601862656, 'bull_strategy': 'mean_reversion', 'bull_bb_std_mult': 1.965317255743221, 'bull_rsi_os': 46, 'bull_rsi_ob': 53, 'bull_adx_thresh': 5.919739741413952, 'bull_atr_min_pct': 0.01259563478188489, 'bull_atr_max_pct': 0.13800333186676852, 'bull_tp_mult': 2.2298801381669597, 'bull_tsl_mult': 0.9549758184436716, 'bull_time_stop': 126, 'bull_use_sma': True, 'bull_use_ema': True, 'bull_use_atr': False, 'bull_use_adx': True, 'bull_use_spike': True, 'bull_rsi_required': True, 'bear_strategy': 'mean_reversion', 'bear_bb_std_mult': 1.3434241462186112, 'bear_rsi_os': 15, 'bear_rsi_ob': 45, 'bear_adx_thresh': 5.004508960575554, 'bear_atr_min_pct': 0.004957180822959498, 'bear_atr_max_pct': 0.012859766530455237, 'bear_tp_mult': 2.0285690794657705, 'bear_tsl_mult': 0.5275813368179189, 'bear_time_stop': 9, 'bear_use_sma': False, 'bear_use_ema': False, 'bear_use_atr': True, 'bear_use_adx': True, 'bear_use_spike': False, 'bear_rsi_required': True, 'sideways_strategy': 'breakout', 'sideways_bb_std_mult': 0.5715695148376474, 'sideways_rsi_os': 39, 'sideways_rsi_ob': 93, 'sideways_adx_thresh': 9.223462631404452, 'sideways_atr_min_pct': 0.026750820963316276, 'sideways_atr_max_pct': 0.050822042433712016, 'sideways_tp_mult': 1.7198637084390132, 'sideways_tsl_mult': 0.5916993514373666, 'sideways_time_stop': 202, 'sideways_use_sma': True, 'sideways_use_ema': False, 'sideways_use_atr': True, 'sideways_use_adx': False, 'sideways_use_spike': False, 'sideways_rsi_required': False}.
[I 2025-08-31 02:32:10,108] Trial 547 finished with values: [-1000000000.0, 1000000000.0] and parameters: {'p_sma': 54, 'p_std': 52, 'p_atr': 28, 'p_adx': 24, 'rsi_period': 74, 'ema1': 5, 'ema2': 11, 'slip_atr_k': 0.07859868601060918, 'slip_spread_k': 0.18576904069017788, 'spread_hl_frac': 0.002714766137790892, 'bb_std_mult': 1.5279465817406332, 'rsi_os': 41, 'rsi_ob': 68, 'vol_spike': 0.1969629195201516, 'adx_thresh': 21.778759792357572, 'atr_min_pct': 0.008354939979988358, 'atr_max_pct': 0.11866142493072328, 'tp_mult': 1.6603377434179825, 'tsl_mult': 0.22671821112322516, 'strategy': 'mean_reversion', 'time_stop': 102, 'use_sma': True, 'use_atr': False, 'use_adx': False, 'use_ema': False, 'use_spike': False, 'rsi_required': True, 'edge_k': 0.5328675257636377, 'edge_cap': 0.10350532867407954, 'bull_strategy': 'mean_reversion', 'bull_bb_std_mult': 2.275363990218319, 'bull_rsi_os': 54, 'bull_rsi_ob': 53, 'bull_adx_thresh': 5.862852325432855, 'bull_atr_min_pct': 0.011286060364596158, 'bull_atr_max_pct': 0.1437963810779378, 'bull_tp_mult': 2.3465928426627456, 'bull_tsl_mult': 0.24120803261948465, 'bull_time_stop': 127, 'bull_use_sma': True, 'bull_use_ema': True, 'bull_use_atr': False, 'bull_use_adx': False, 'bull_use_spike': True, 'bull_rsi_required': True, 'bear_strategy': 'mean_reversion', 'bear_bb_std_mult': 1.2740088714293627, 'bear_rsi_os': 16, 'bear_rsi_ob': 45, 'bear_adx_thresh': 5.014478906820612, 'bear_atr_min_pct': 0.005802407736408582, 'bear_atr_max_pct': 0.012383732029201186, 'bear_tp_mult': 2.034824936223768, 'bear_tsl_mult': 0.5287339456213135, 'bear_time_stop': 14, 'bear_use_sma': False, 'bear_use_ema': False, 'bear_use_atr': True, 'bear_use_adx': True, 'bear_use_spike': False, 'bear_rsi_required': True, 'sideways_strategy': 'breakout', 'sideways_bb_std_mult': 0.5610878639899128, 'sideways_rsi_os': 38, 'sideways_rsi_ob': 93, 'sideways_adx_thresh': 9.020310850514779, 'sideways_atr_min_pct': 0.02694115692729345, 'sideways_atr_max_pct': 0.06213501139099554, 'sideways_tp_mult': 1.7107932023915862, 'sideways_tsl_mult': 0.5888721649434306, 'sideways_time_stop': 216, 'sideways_use_sma': True, 'sideways_use_ema': False, 'sideways_use_atr': True, 'sideways_use_adx': False, 'sideways_use_spike': False, 'sideways_rsi_required': False}.
[I 2025-08-31 02:32:42,145] Trial 548 finished with values: [-1000000000.0, 1000000000.0] and parameters: {'p_sma': 52, 'p_std': 52, 'p_atr': 28, 'p_adx': 24, 'rsi_period': 71, 'ema1': 5, 'ema2': 41, 'slip_atr_k': 0.10580150865189003, 'slip_spread_k': 0.18450621885621463, 'spread_hl_frac': 0.0024336547091476893, 'bb_std_mult': 1.6523317939476736, 'rsi_os': 37, 'rsi_ob': 67, 'vol_spike': 0.1940804940732044, 'adx_thresh': 20.723006072955595, 'atr_min_pct': 0.00823754607619122, 'atr_max_pct': 0.11788430720187348, 'tp_mult': 1.9925467568389803, 'tsl_mult': 0.2254568912840821, 'strategy': 'mean_reversion', 'time_stop': 112, 'use_sma': False, 'use_atr': False, 'use_adx': False, 'use_ema': False, 'use_spike': False, 'rsi_required': True, 'edge_k': 0.6017665438620757, 'edge_cap': 0.0980412924509176, 'bull_strategy': 'mean_reversion', 'bull_bb_std_mult': 2.2645311181099355, 'bull_rsi_os': 54, 'bull_rsi_ob': 51, 'bull_adx_thresh': 6.048038144785168, 'bull_atr_min_pct': 0.015377496236509601, 'bull_atr_max_pct': 0.1341429482714398, 'bull_tp_mult': 2.1738517169869116, 'bull_tsl_mult': 0.23928875070749794, 'bull_time_stop': 127, 'bull_use_sma': True, 'bull_use_ema': True, 'bull_use_atr': False, 'bull_use_adx': False, 'bull_use_spike': True, 'bull_rsi_required': True, 'bear_strategy': 'mean_reversion', 'bear_bb_std_mult': 1.3148942748786872, 'bear_rsi_os': 18, 'bear_rsi_ob': 47, 'bear_adx_thresh': 5.028931855243701, 'bear_atr_min_pct': 0.0049039943129292, 'bear_atr_max_pct': 0.012631194099816228, 'bear_tp_mult': 2.025114810233691, 'bear_tsl_mult': 0.5526956403746706, 'bear_time_stop': 10, 'bear_use_sma': False, 'bear_use_ema': False, 'bear_use_atr': True, 'bear_use_adx': True, 'bear_use_spike': False, 'bear_rsi_required': True, 'sideways_strategy': 'breakout', 'sideways_bb_std_mult': 0.629983009039945, 'sideways_rsi_os': 37, 'sideways_rsi_ob': 93, 'sideways_adx_thresh': 9.444916926614637, 'sideways_atr_min_pct': 0.027472063774266267, 'sideways_atr_max_pct': 0.06204116841062267, 'sideways_tp_mult': 1.7106298976256364, 'sideways_tsl_mult': 0.5914077877482969, 'sideways_time_stop': 201, 'sideways_use_sma': True, 'sideways_use_ema': False, 'sideways_use_atr': True, 'sideways_use_adx': False, 'sideways_use_spike': False, 'sideways_rsi_required': True}.
