[I 2025-08-31 02:35:01,146] Trial 566 finished with values: [-1000000000.0, 1000000000.0] and parameters: {'p_sma': 54, 'p_std': 52, 'p_atr': 27, 'p_adx': 18, 'rsi_period': 72, 'ema1': 21, 'ema2': 40, 'slip_atr_k': 0.17768706502413775, 'slip_spread_k': 0.19256632902080292, 'spread_hl_frac': 0.002290384239980904, 'bb_std_mult': 1.7441792537971517, 'rsi_os': 36, 'rsi_ob': 70, 'vol_spike': 0.182181148744104, 'adx_thresh': 20.6789548273431, 'atr_min_pct': 0.02821699412826112, 'atr_max_pct': 0.11614684399963043, 'tp_mult': 2.352252658468506, 'tsl_mult': 0.6034553618600973, 'strategy': 'mean_reversion', 'time_stop': 101, 'use_sma': True, 'use_atr': True, 'use_adx': True, 'use_ema': False, 'use_spike': True, 'rsi_required': True, 'edge_k': 0.5890536278725178, 'edge_cap': 0.08706507764744902, 'bull_strategy': 'breakout', 'bull_bb_std_mult': 2.3976849667551363, 'bull_rsi_os': 47, 'bull_rsi_ob': 49, 'bull_adx_thresh': 5.68646861561826, 'bull_atr_min_pct': 0.0046062754707214895, 'bull_atr_max_pct': 0.14492412873318306, 'bull_tp_mult': 1.2834008885582078, 'bull_tsl_mult': 0.632740181148721, 'bull_time_stop': 145, 'bull_use_sma': True, 'bull_use_ema': True, 'bull_use_atr': False, 'bull_use_adx': True, 'bull_use_spike': True, 'bull_rsi_required': True, 'bear_strategy': 'mean_reversion', 'bear_bb_std_mult': 1.2709580764991868, 'bear_rsi_os': 15, 'bear_rsi_ob': 47, 'bear_adx_thresh': 5.507742635081114, 'bear_atr_min_pct': 0.006494358875988926, 'bear_atr_max_pct': 0.12345774133557355, 'bear_tp_mult': 2.0962234921576037, 'bear_tsl_mult': 0.5184810235046311, 'bear_time_stop': 11, 'bear_use_sma': False, 'bear_use_ema': True, 'bear_use_atr': False, 'bear_use_adx': True, 'bear_use_spike': True, 'bear_rsi_required': True, 'sideways_strategy': 'breakout', 'sideways_bb_std_mult': 0.6385073393400862, 'sideways_rsi_os': 39, 'sideways_rsi_ob': 93, 'sideways_adx_thresh': 9.636407306622582, 'sideways_atr_min_pct': 0.028248645832427675, 'sideways_atr_max_pct': 0.05389525247641396, 'sideways_tp_mult': 1.650715051169458, 'sideways_tsl_mult': 0.44769377154054574, 'sideways_time_stop': 205, 'sideways_use_sma': False, 'sideways_use_ema': False, 'sideways_use_atr': True, 'sideways_use_adx': False, 'sideways_use_spike': True, 'sideways_rsi_required': False}.
[I 2025-08-31 02:35:34,941] Trial 568 finished with values: [-1000000000.0, 1000000000.0] and parameters: {'p_sma': 53, 'p_std': 52, 'p_atr': 26, 'p_adx': 29, 'rsi_period': 70, 'ema1': 6, 'ema2': 27, 'slip_atr_k': 0.12450465175317532, 'slip_spread_k': 0.19093594281653348, 'spread_hl_frac': 0.0012109679022810017, 'bb_std_mult': 2.836945599230612, 'rsi_os': 36, 'rsi_ob': 69, 'vol_spike': 0.0735537038131394, 'adx_thresh': 21.159729745655476, 'atr_min_pct': 0.009150569286020802, 'atr_max_pct': 0.11279096248773927, 'tp_mult': 1.7159745005951, 'tsl_mult': 0.4808131760126379, 'strategy': 'mean_reversion', 'time_stop': 102, 'use_sma': False, 'use_atr': True, 'use_adx': True, 'use_ema': False, 'use_spike': True, 'rsi_required': True, 'edge_k': 0.5739779828203709, 'edge_cap': 0.17056937296865265, 'bull_strategy': 'mean_reversion', 'bull_bb_std_mult': 1.9860035708696187, 'bull_rsi_os': 47, 'bull_rsi_ob': 51, 'bull_adx_thresh': 5.796767998908269, 'bull_atr_min_pct': 0.0128627478420623, 'bull_atr_max_pct': 0.14157224675159608, 'bull_tp_mult': 1.2712674542884728, 'bull_tsl_mult': 0.8222216708252389, 'bull_time_stop': 130, 'bull_use_sma': True, 'bull_use_ema': True, 'bull_use_atr': False, 'bull_use_adx': True, 'bull_use_spike': True, 'bull_rsi_required': True, 'bear_strategy': 'mean_reversion', 'bear_bb_std_mult': 3.095955033592873, 'bear_rsi_os': 13, 'bear_rsi_ob': 46, 'bear_adx_thresh': 5.003326836888609, 'bear_atr_min_pct': 0.007029324923691638, 'bear_atr_max_pct': 0.01001049246497405, 'bear_tp_mult': 2.1210407161371414, 'bear_tsl_mult': 0.556942258348779, 'bear_time_stop': 5, 'bear_use_sma': False, 'bear_use_ema': True, 'bear_use_atr': True, 'bear_use_adx': False, 'bear_use_spike': True, 'bear_rsi_required': True, 'sideways_strategy': 'breakout', 'sideways_bb_std_mult': 0.6689163225521764, 'sideways_rsi_os': 40, 'sideways_rsi_ob': 82, 'sideways_adx_thresh': 9.701588636394428, 'sideways_atr_min_pct': 0.028273002684251675, 'sideways_atr_max_pct': 0.057235834057211575, 'sideways_tp_mult': 1.700096613022719, 'sideways_tsl_mult': 0.286364937760392, 'sideways_time_stop': 206, 'sideways_use_sma': False, 'sideways_use_ema': False, 'sideways_use_atr': True, 'sideways_use_adx': True, 'sideways_use_spike': False, 'sideways_rsi_required': True}.
[I 2025-08-31 02:35:35,116] Trial 569 finished with values: [-1000000000.0, 1000000000.0] and parameters: {'p_sma': 56, 'p_std': 52, 'p_atr': 30, 'p_adx': 19, 'rsi_period': 70, 'ema1': 24, 'ema2': 30, 'slip_atr_k': 0.1316746537569209, 'slip_spread_k': 0.14735833297804607, 'spread_hl_frac': 0.0020281139764323905, 'bb_std_mult': 1.691360212843815, 'rsi_os': 36, 'rsi_ob': 69, 'vol_spike': 0.07179208266405789, 'adx_thresh': 20.444626978358592, 'atr_min_pct': 0.021443436252258464, 'atr_max_pct': 0.12057129871266219, 'tp_mult': 2.34370178335559, 'tsl_mult': 0.2557754383630253, 'strategy': 'mean_reversion', 'time_stop': 118, 'use_sma': True, 'use_atr': False, 'use_adx': False, 'use_ema': False, 'use_spike': True, 'rsi_required': True, 'edge_k': 0.5792280894033337, 'edge_cap': 0.17002393469677157, 'bull_strategy': 'breakout', 'bull_bb_std_mult': 2.2462433832053477, 'bull_rsi_os': 24, 'bull_rsi_ob': 52, 'bull_adx_thresh': 5.637434591861192, 'bull_atr_min_pct': 0.00459397145687187, 'bull_atr_max_pct': 0.14196200388723632, 'bull_tp_mult': 2.823321583214797, 'bull_tsl_mult': 0.23577107386393562, 'bull_time_stop': 144, 'bull_use_sma': True, 'bull_use_ema': False, 'bull_use_atr': False, 'bull_use_adx': False, 'bull_use_spike': True, 'bull_rsi_required': True, 'bear_strategy': 'mean_reversion', 'bear_bb_std_mult': 3.10558841616111, 'bear_rsi_os': 17, 'bear_rsi_ob': 46, 'bear_adx_thresh': 5.078136902433897, 'bear_atr_min_pct': 0.005226977227077553, 'bear_atr_max_pct': 0.12225960169469707, 'bear_tp_mult': 2.024080054891039, 'bear_tsl_mult': 0.5681452341778658, 'bear_time_stop': 10, 'bear_use_sma': False, 'bear_use_ema': True, 'bear_use_atr': False, 'bear_use_adx': False, 'bear_use_spike': False, 'bear_rsi_required': True, 'sideways_strategy': 'breakout', 'sideways_bb_std_mult': 0.6828650114881449, 'sideways_rsi_os': 42, 'sideways_rsi_ob': 93, 'sideways_adx_thresh': 9.710608899097249, 'sideways_atr_min_pct': 0.026532569348208922, 'sideways_atr_max_pct': 0.057041486776433684, 'sideways_tp_mult': 1.6987773268976802, 'sideways_tsl_mult': 0.6739935615518544, 'sideways_time_stop': 214, 'sideways_use_sma': True, 'sideways_use_ema': False, 'sideways_use_atr': False, 'sideways_use_adx': True, 'sideways_use_spike': True, 'sideways_rsi_required': False}.
[I 2025-08-31 02:35:35,479] Trial 570 finished with values: [-1000000000.0, 1000000000.0] and parameters: {'p_sma': 52, 'p_std': 52, 'p_atr': 29, 'p_adx': 23, 'rsi_period': 71, 'ema1': 24, 'ema2': 36, 'slip_atr_k': 0.1942822517856437, 'slip_spread_k': 0.13977800872755453, 'spread_hl_frac': 0.003901896167799873, 'bb_std_mult': 1.694966765868358, 'rsi_os': 36, 'rsi_ob': 66, 'vol_spike': 0.175720329179758, 'adx_thresh': 20.403094015309648, 'atr_min_pct': 0.009189651229656797, 'atr_max_pct': 0.12144013389595056, 'tp_mult': 1.7768899300861163, 'tsl_mult': 0.44878572216384616, 'strategy': 'mean_reversion', 'time_stop': 121, 'use_sma': False, 'use_atr': False, 'use_adx': False, 'use_ema': False, 'use_spike': True, 'rsi_required': True, 'edge_k': 0.552525739835412, 'edge_cap': 0.11830898282811456, 'bull_strategy': 'breakout', 'bull_bb_std_mult': 1.9202798285558682, 'bull_rsi_os': 51, 'bull_rsi_ob': 77, 'bull_adx_thresh': 6.684004959094317, 'bull_atr_min_pct': 0.004705414964880223, 'bull_atr_max_pct': 0.1404988137330769, 'bull_tp_mult': 1.2769707900711826, 'bull_tsl_mult': 0.08857684802439486, 'bull_time_stop': 130, 'bull_use_sma': True, 'bull_use_ema': False, 'bull_use_atr': False, 'bull_use_adx': False, 'bull_use_spike': True, 'bull_rsi_required': True, 'bear_strategy': 'breakout', 'bear_bb_std_mult': 2.8847131536903645, 'bear_rsi_os': 17, 'bear_rsi_ob': 46, 'bear_adx_thresh': 5.517860883071802, 'bear_atr_min_pct': 0.0035994929971512133, 'bear_atr_max_pct': 0.012403264424174987, 'bear_tp_mult': 1.3495609837835818, 'bear_tsl_mult': 0.5721296183031304, 'bear_time_stop': 276, 'bear_use_sma': False, 'bear_use_ema': True, 'bear_use_atr': False, 'bear_use_adx': False, 'bear_use_spike': True, 'bear_rsi_required': True, 'sideways_strategy': 'breakout', 'sideways_bb_std_mult': 0.6821246900044243, 'sideways_rsi_os': 41, 'sideways_rsi_ob': 93, 'sideways_adx_thresh': 8.511791061561427, 'sideways_atr_min_pct': 0.02742424913841972, 'sideways_atr_max_pct': 0.0568021917072572, 'sideways_tp_mult': 1.7090440277788117, 'sideways_tsl_mult': 0.10551808759052578, 'sideways_time_stop': 214, 'sideways_use_sma': True, 'sideways_use_ema': False, 'sideways_use_atr': False, 'sideways_use_adx': True, 'sideways_use_spike': True, 'sideways_rsi_required': False}.
[I 2025-08-31 02:35:35,578] Trial 571 finished with values: [-1000000000.0, 1000000000.0] and parameters: {'p_sma': 52, 'p_std': 52, 'p_atr': 29, 'p_adx': 29, 'rsi_period': 70, 'ema1': 5, 'ema2': 36, 'slip_atr_k': 0.1516007657421366, 'slip_spread_k': 0.1377386423127975, 'spread_hl_frac': 0.0035793357330115494, 'bb_std_mult': 1.6764232437473303, 'rsi_os': 40, 'rsi_ob': 66, 'vol_spike': 0.19098171727710309, 'adx_thresh': 20.24786397967739, 'atr_min_pct': 0.007892833513931925, 'atr_max_pct': 0.12036959035565245, 'tp_mult': 2.8704113646971794, 'tsl_mult': 0.4824128556885533, 'strategy': 'mean_reversion', 'time_stop': 121, 'use_sma': False, 'use_atr': False, 'use_adx': False, 'use_ema': False, 'use_spike': False, 'rsi_required': True, 'edge_k': 0.5351755814028665, 'edge_cap': 0.11816988210584246, 'bull_strategy': 'mean_reversion', 'bull_bb_std_mult': 2.2683602957485807, 'bull_rsi_os': 23, 'bull_rsi_ob': 45, 'bull_adx_thresh': 6.571670374219444, 'bull_atr_min_pct': 0.006122311149246077, 'bull_atr_max_pct': 0.1404162075220652, 'bull_tp_mult': 1.211305459789505, 'bull_tsl_mult': 0.2267177924019121, 'bull_time_stop': 131, 'bull_use_sma': True, 'bull_use_ema': False, 'bull_use_atr': False, 'bull_use_adx': False, 'bull_use_spike': True, 'bull_rsi_required': True, 'bear_strategy': 'breakout', 'bear_bb_std_mult': 1.238153672925986, 'bear_rsi_os': 17, 'bear_rsi_ob': 46, 'bear_adx_thresh': 5.0344021575721705, 'bear_atr_min_pct': 0.0032545997892189406, 'bear_atr_max_pct': 0.010021731508249776, 'bear_tp_mult': 2.183029462662956, 'bear_tsl_mult': 0.5678916594737551, 'bear_time_stop': 5, 'bear_use_sma': False, 'bear_use_ema': False, 'bear_use_atr': True, 'bear_use_adx': False, 'bear_use_spike': False, 'bear_rsi_required': True, 'sideways_strategy': 'breakout', 'sideways_bb_std_mult': 0.5015277283557323, 'sideways_rsi_os': 41, 'sideways_rsi_ob': 93, 'sideways_adx_thresh': 8.665491050777005, 'sideways_atr_min_pct': 0.026540517734320816, 'sideways_atr_max_pct': 0.05772617644090136, 'sideways_tp_mult': 1.7094374409352233, 'sideways_tsl_mult': 0.674911434492057, 'sideways_time_stop': 207, 'sideways_use_sma': True, 'sideways_use_ema': True, 'sideways_use_atr': False, 'sideways_use_adx': True, 'sideways_use_spike': False, 'sideways_rsi_required': True}.
[I 2025-08-31 02:36:09,893] Trial 573 finished with values: [-1000000000.0, 1000000000.0] and parameters: {'p_sma': 52, 'p_std': 48, 'p_atr': 29, 'p_adx': 15, 'rsi_period': 68, 'ema1': 13, 'ema2': 11, 'slip_atr_k': 0.20652538921297156, 'slip_spread_k': 0.13879572818277994, 'spread_hl_frac': 0.004013704111437701, 'bb_std_mult': 1.6513369494930792, 'rsi_os': 40, 'rsi_ob': 66, 'vol_spike': 0.17522120858215812, 'adx_thresh': 19.191402808273132, 'atr_min_pct': 0.027233378457825946, 'atr_max_pct': 0.12272455702046708, 'tp_mult': 1.8382688326764725, 'tsl_mult': 0.4443950129730972, 'strategy': 'mean_reversion', 'time_stop': 141, 'use_sma': True, 'use_atr': False, 'use_adx': False, 'use_ema': False, 'use_spike': False, 'rsi_required': True, 'edge_k': 0.5271154901934575, 'edge_cap': 0.1086424495941939, 'bull_strategy': 'breakout', 'bull_bb_std_mult': 2.424041467819107, 'bull_rsi_os': 51, 'bull_rsi_ob': 54, 'bull_adx_thresh': 6.73137442547535, 'bull_atr_min_pct': 0.0060866888695644055, 'bull_atr_max_pct': 0.13366040691318284, 'bull_tp_mult': 2.357559408439824, 'bull_tsl_mult': 0.3055978367786308, 'bull_time_stop': 133, 'bull_use_sma': True, 'bull_use_ema': False, 'bull_use_atr': False, 'bull_use_adx': False, 'bull_use_spike': True, 'bull_rsi_required': True, 'bear_strategy': 'breakout', 'bear_bb_std_mult': 2.8858513595005384, 'bear_rsi_os': 19, 'bear_rsi_ob': 46, 'bear_adx_thresh': 5.564804875100816, 'bear_atr_min_pct': 0.0034304326966436427, 'bear_atr_max_pct': 0.010112366814689713, 'bear_tp_mult': 1.3423017083273252, 'bear_tsl_mult': 0.6035423261949914, 'bear_time_stop': 16, 'bear_use_sma': False, 'bear_use_ema': False, 'bear_use_atr': False, 'bear_use_adx': True, 'bear_use_spike': False, 'bear_rsi_required': True, 'sideways_strategy': 'breakout', 'sideways_bb_std_mult': 0.5736827285129478, 'sideways_rsi_os': 41, 'sideways_rsi_ob': 94, 'sideways_adx_thresh': 8.722046120151889, 'sideways_atr_min_pct': 0.027551344256085325, 'sideways_atr_max_pct': 0.0650561457375227, 'sideways_tp_mult': 1.7277294413129356, 'sideways_tsl_mult': 0.10722514472884992, 'sideways_time_stop': 214, 'sideways_use_sma': True, 'sideways_use_ema': True, 'sideways_use_atr': False, 'sideways_use_adx': False, 'sideways_use_spike': True, 'sideways_rsi_required': False}.
[I 2025-08-31 02:36:10,135] Trial 574 finished with values: [-1000000000.0, 1000000000.0] and parameters: {'p_sma': 51, 'p_std': 48, 'p_atr': 28, 'p_adx': 14, 'rsi_period': 67, 'ema1': 13, 'ema2': 11, 'slip_atr_k': 0.22971652169008738, 'slip_spread_k': 0.17136310230040716, 'spread_hl_frac': 0.002972764835171657, 'bb_std_mult': 1.6409104575847064, 'rsi_os': 40, 'rsi_ob': 67, 'vol_spike': 0.11507431324496417, 'adx_thresh': 19.728055640293576, 'atr_min_pct': 0.02728707235366261, 'atr_max_pct': 0.11878352286140734, 'tp_mult': 1.4993764772240854, 'tsl_mult': 0.2831539732244645, 'strategy': 'mean_reversion', 'time_stop': 110, 'use_sma': True, 'use_atr': False, 'use_adx': False, 'use_ema': False, 'use_spike': False, 'rsi_required': True, 'edge_k': 0.4912766388627745, 'edge_cap': 0.06719094397108832, 'bull_strategy': 'breakout', 'bull_bb_std_mult': 2.2804180680026547, 'bull_rsi_os': 52, 'bull_rsi_ob': 60, 'bull_adx_thresh': 5.041183570108267, 'bull_atr_min_pct': 0.02071933135039017, 'bull_atr_max_pct': 0.13459976520250708, 'bull_tp_mult': 2.266376566797333, 'bull_tsl_mult': 0.2022264792060016, 'bull_time_stop': 135, 'bull_use_sma': True, 'bull_use_ema': False, 'bull_use_atr': False, 'bull_use_adx': True, 'bull_use_spike': True, 'bull_rsi_required': True, 'bear_strategy': 'breakout', 'bear_bb_std_mult': 1.88997381033362, 'bear_rsi_os': 16, 'bear_rsi_ob': 45, 'bear_adx_thresh': 6.323368059208275, 'bear_atr_min_pct': 0.007075032713238224, 'bear_atr_max_pct': 0.010107353355525968, 'bear_tp_mult': 2.180467231979972, 'bear_tsl_mult': 0.5494890177980511, 'bear_time_stop': 5, 'bear_use_sma': False, 'bear_use_ema': False, 'bear_use_atr': True, 'bear_use_adx': True, 'bear_use_spike': False, 'bear_rsi_required': True, 'sideways_strategy': 'breakout', 'sideways_bb_std_mult': 0.503789253462312, 'sideways_rsi_os': 42, 'sideways_rsi_ob': 84, 'sideways_adx_thresh': 8.8068419955533, 'sideways_atr_min_pct': 0.02558918631032841, 'sideways_atr_max_pct': 0.0464549404698202, 'sideways_tp_mult': 1.7323817311905816, 'sideways_tsl_mult': 0.666800649018276, 'sideways_time_stop': 195, 'sideways_use_sma': True, 'sideways_use_ema': True, 'sideways_use_atr': False, 'sideways_use_adx': False, 'sideways_use_spike': False, 'sideways_rsi_required': True}.
[I 2025-08-31 02:36:10,259] Trial 575 finished with values: [-1000000000.0, 1000000000.0] and parameters: {'p_sma': 51, 'p_std': 50, 'p_atr': 28, 'p_adx': 15, 'rsi_period': 67, 'ema1': 5, 'ema2': 32, 'slip_atr_k': 0.09764677455555427, 'slip_spread_k': 0.1662173247162551, 'spread_hl_frac': 2.3080063210268592e-05, 'bb_std_mult': 1.4954578713545177, 'rsi_os': 41, 'rsi_ob': 68, 'vol_spike': 0.17271999375756225, 'adx_thresh': 19.232958462479655, 'atr_min_pct': 0.008511523755589317, 'atr_max_pct': 0.12581656696972612, 'tp_mult': 1.2616065856477734, 'tsl_mult': 0.33764891302767036, 'strategy': 'mean_reversion', 'time_stop': 110, 'use_sma': True, 'use_atr': False, 'use_adx': False, 'use_ema': False, 'use_spike': False, 'rsi_required': True, 'edge_k': 0.4806245673747845, 'edge_cap': 0.06795216137342037, 'bull_strategy': 'breakout', 'bull_bb_std_mult': 1.096624831806796, 'bull_rsi_os': 52, 'bull_rsi_ob': 54, 'bull_adx_thresh': 7.373886145658476, 'bull_atr_min_pct': 0.0233335800389594, 'bull_atr_max_pct': 0.13520887412885005, 'bull_tp_mult': 2.3080675399637833, 'bull_tsl_mult': 0.305098325512325, 'bull_time_stop': 124, 'bull_use_sma': True, 'bull_use_ema': False, 'bull_use_atr': False, 'bull_use_adx': True, 'bull_use_spike': True, 'bull_rsi_required': True, 'bear_strategy': 'mean_reversion', 'bear_bb_std_mult': 2.362654162910127, 'bear_rsi_os': 19, 'bear_rsi_ob': 45, 'bear_adx_thresh': 6.3244867928776305, 'bear_atr_min_pct': 0.005429234984872909, 'bear_atr_max_pct': 0.04837478479013916, 'bear_tp_mult': 2.0440009950187026, 'bear_tsl_mult': 0.5990367586403436, 'bear_time_stop': 121, 'bear_use_sma': False, 'bear_use_ema': False, 'bear_use_atr': False, 'bear_use_adx': True, 'bear_use_spike': False, 'bear_rsi_required': True, 'sideways_strategy': 'breakout', 'sideways_bb_std_mult': 0.5585630980419106, 'sideways_rsi_os': 36, 'sideways_rsi_ob': 84, 'sideways_adx_thresh': 8.942340794348949, 'sideways_atr_min_pct': 0.027471524918825346, 'sideways_atr_max_pct': 0.06397624856049286, 'sideways_tp_mult': 1.8066652107928136, 'sideways_tsl_mult': 0.6287708947975913, 'sideways_time_stop': 194, 'sideways_use_sma': True, 'sideways_use_ema': True, 'sideways_use_atr': False, 'sideways_use_adx': False, 'sideways_use_spike': True, 'sideways_rsi_required': False}.
[I 2025-08-31 02:36:10,437] Trial 572 finished with values: [-1000000000.0, 1000000000.0] and parameters: {'p_sma': 52, 'p_std': 53, 'p_atr': 29, 'p_adx': 15, 'rsi_period': 70, 'ema1': 18, 'ema2': 25, 'slip_atr_k': 0.07543042480788756, 'slip_spread_k': 0.14584981258047586, 'spread_hl_frac': 0.004058759816393857, 'bb_std_mult': 1.4993004083690986, 'rsi_os': 41, 'rsi_ob': 68, 'vol_spike': 0.17418007886166514, 'adx_thresh': 20.387527740488807, 'atr_min_pct': 0.007617295998030222, 'atr_max_pct': 0.11885068845419702, 'tp_mult': 1.2862082587427688, 'tsl_mult': 0.4447840006513273, 'strategy': 'mean_reversion', 'time_stop': 122, 'use_sma': True, 'use_atr': False, 'use_adx': False, 'use_ema': False, 'use_spike': False, 'rsi_required': True, 'edge_k': 0.5277038823779161, 'edge_cap': 0.11274415586109796, 'bull_strategy': 'breakout', 'bull_bb_std_mult': 2.312987096841225, 'bull_rsi_os': 16, 'bull_rsi_ob': 45, 'bull_adx_thresh': 6.911502248462703, 'bull_atr_min_pct': 0.027591265516224314, 'bull_atr_max_pct': 0.14065049053716977, 'bull_tp_mult': 2.2748015844469696, 'bull_tsl_mult': 0.23950992533264315, 'bull_time_stop': 134, 'bull_use_sma': True, 'bull_use_ema': False, 'bull_use_atr': False, 'bull_use_adx': False, 'bull_use_spike': True, 'bull_rsi_required': True, 'bear_strategy': 'breakout', 'bear_bb_std_mult': 1.5078540380372347, 'bear_rsi_os': 17, 'bear_rsi_ob': 46, 'bear_adx_thresh': 6.252796027442605, 'bear_atr_min_pct': 0.0035736946963014476, 'bear_atr_max_pct': 0.057261961537186844, 'bear_tp_mult': 2.046574347205023, 'bear_tsl_mult': 0.5994687775346164, 'bear_time_stop': 124, 'bear_use_sma': False, 'bear_use_ema': False, 'bear_use_atr': False, 'bear_use_adx': False, 'bear_use_spike': False, 'bear_rsi_required': True, 'sideways_strategy': 'breakout', 'sideways_bb_std_mult': 0.5011345362637138, 'sideways_rsi_os': 36, 'sideways_rsi_ob': 93, 'sideways_adx_thresh': 8.396281471148429, 'sideways_atr_min_pct': 0.026509407546168432, 'sideways_atr_max_pct': 0.06427076167742932, 'sideways_tp_mult': 1.7176570225367163, 'sideways_tsl_mult': 0.6719536000322572, 'sideways_time_stop': 214, 'sideways_use_sma': True, 'sideways_use_ema': True, 'sideways_use_atr': False, 'sideways_use_adx': True, 'sideways_use_spike': True, 'sideways_rsi_required': False}.
