[I 2025-08-31 02:23:33,954] Trial 485 finished with values: [-0.013891883087489787, 0.01382249293768717] and parameters: {'p_sma': 54, 'p_std': 45, 'p_atr': 27, 'p_adx': 26, 'rsi_period': 70, 'ema1': 5, 'ema2': 24, 'slip_atr_k': 0.011959092581230558, 'slip_spread_k': 0.18003881960861978, 'spread_hl_frac': 0.004912498567765456, 'bb_std_mult': 1.7472883564485673, 'rsi_os': 37, 'rsi_ob': 70, 'vol_spike': 0.1813006951318693, 'adx_thresh': 20.12780654373857, 'atr_min_pct': 0.007185991403515678, 'atr_max_pct': 0.1117599039821036, 'tp_mult': 1.0616088183321326, 'tsl_mult': 0.0259338993739238, 'strategy': 'mean_reversion', 'time_stop': 113, 'use_sma': True, 'use_atr': False, 'use_adx': False, 'use_ema': False, 'use_spike': False, 'rsi_required': True, 'edge_k': 0.5558398461606905, 'edge_cap': 0.10071418249740965, 'bull_strategy': 'breakout', 'bull_bb_std_mult': 2.4993639853508833, 'bull_rsi_os': 12, 'bull_rsi_ob': 61, 'bull_adx_thresh': 7.845537032427574, 'bull_atr_min_pct': 6.647697724124988e-05, 'bull_atr_max_pct': 0.14206585980937783, 'bull_tp_mult': 2.279253096344712, 'bull_tsl_mult': 0.2819144244746492, 'bull_time_stop': 137, 'bull_use_sma': False, 'bull_use_ema': False, 'bull_use_atr': False, 'bull_use_adx': True, 'bull_use_spike': True, 'bull_rsi_required': True, 'bear_strategy': 'mean_reversion', 'bear_bb_std_mult': 1.405792665153644, 'bear_rsi_os': 18, 'bear_rsi_ob': 45, 'bear_adx_thresh': 5.3910665716286665, 'bear_atr_min_pct': 0.007065554464910152, 'bear_atr_max_pct': 0.010837727483872963, 'bear_tp_mult': 2.11390799156245, 'bear_tsl_mult': 0.7867512593766111, 'bear_time_stop': 5, 'bear_use_sma': False, 'bear_use_ema': False, 'bear_use_atr': False, 'bear_use_adx': True, 'bear_use_spike': False, 'bear_rsi_required': True, 'sideways_strategy': 'mean_reversion', 'sideways_bb_std_mult': 0.6373214631775906, 'sideways_rsi_os': 41, 'sideways_rsi_ob': 95, 'sideways_adx_thresh': 10.094499864200415, 'sideways_atr_min_pct': 0.023241291760748524, 'sideways_atr_max_pct': 0.05061183392422106, 'sideways_tp_mult': 1.8258170779289185, 'sideways_tsl_mult': 0.582719113328773, 'sideways_time_stop': 190, 'sideways_use_sma': True, 'sideways_use_ema': False, 'sideways_use_atr': False, 'sideways_use_adx': False, 'sideways_use_spike': True, 'sideways_rsi_required': False}.
[I 2025-08-31 02:23:34,072] Trial 487 finished with values: [-0.015079901167154963, 0.015010630284325675] and parameters: {'p_sma': 54, 'p_std': 45, 'p_atr': 28, 'p_adx': 26, 'rsi_period': 71, 'ema1': 5, 'ema2': 23, 'slip_atr_k': 0.008375345651859895, 'slip_spread_k': 0.1482116268092564, 'spread_hl_frac': 0.004690392904197582, 'bb_std_mult': 1.7012818792233242, 'rsi_os': 39, 'rsi_ob': 70, 'vol_spike': 0.18087118378821113, 'adx_thresh': 20.306905356899097, 'atr_min_pct': 0.007658230659985029, 'atr_max_pct': 0.11878085854007156, 'tp_mult': 1.041377981934433, 'tsl_mult': 0.04032281541535125, 'strategy': 'mean_reversion', 'time_stop': 112, 'use_sma': True, 'use_atr': False, 'use_adx': False, 'use_ema': False, 'use_spike': False, 'rsi_required': True, 'edge_k': 0.5312885880483138, 'edge_cap': 0.1403655743748323, 'bull_strategy': 'breakout', 'bull_bb_std_mult': 2.440747310820375, 'bull_rsi_os': 49, 'bull_rsi_ob': 61, 'bull_adx_thresh': 6.47447861690302, 'bull_atr_min_pct': 0.00014742488475953279, 'bull_atr_max_pct': 0.14725621940134676, 'bull_tp_mult': 2.2626769727374536, 'bull_tsl_mult': 0.2762253197777229, 'bull_time_stop': 135, 'bull_use_sma': True, 'bull_use_ema': False, 'bull_use_atr': False, 'bull_use_adx': True, 'bull_use_spike': True, 'bull_rsi_required': True, 'bear_strategy': 'mean_reversion', 'bear_bb_std_mult': 1.3923192611013877, 'bear_rsi_os': 16, 'bear_rsi_ob': 45, 'bear_adx_thresh': 5.079913312235102, 'bear_atr_min_pct': 0.005843092914628693, 'bear_atr_max_pct': 0.01089718869527945, 'bear_tp_mult': 2.108599661192065, 'bear_tsl_mult': 0.7609842245376797, 'bear_time_stop': 8, 'bear_use_sma': False, 'bear_use_ema': False, 'bear_use_atr': False, 'bear_use_adx': True, 'bear_use_spike': False, 'bear_rsi_required': True, 'sideways_strategy': 'mean_reversion', 'sideways_bb_std_mult': 0.6232715468891742, 'sideways_rsi_os': 38, 'sideways_rsi_ob': 95, 'sideways_adx_thresh': 9.552118867661108, 'sideways_atr_min_pct': 0.026686026893384597, 'sideways_atr_max_pct': 0.04961177846066641, 'sideways_tp_mult': 1.8298408724396298, 'sideways_tsl_mult': 0.6451406452176061, 'sideways_time_stop': 199, 'sideways_use_sma': True, 'sideways_use_ema': False, 'sideways_use_atr': False, 'sideways_use_adx': False, 'sideways_use_spike': True, 'sideways_rsi_required': False}.
[I 2025-08-31 02:24:06,698] Trial 488 finished with values: [-0.014148586439746591, 0.014079290959415212] and parameters: {'p_sma': 55, 'p_std': 45, 'p_atr': 28, 'p_adx': 26, 'rsi_period': 66, 'ema1': 5, 'ema2': 24, 'slip_atr_k': 0.007684286697199033, 'slip_spread_k': 0.15413934816763347, 'spread_hl_frac': 0.00476266120158448, 'bb_std_mult': 1.686123849594771, 'rsi_os': 39, 'rsi_ob': 70, 'vol_spike': 0.1803162863767158, 'adx_thresh': 20.030664159029605, 'atr_min_pct': 0.007495411496120754, 'atr_max_pct': 0.11895911533781599, 'tp_mult': 1.0334873276654244, 'tsl_mult': 0.032386562936214405, 'strategy': 'mean_reversion', 'time_stop': 111, 'use_sma': True, 'use_atr': False, 'use_adx': False, 'use_ema': False, 'use_spike': False, 'rsi_required': True, 'edge_k': 0.4525206861591533, 'edge_cap': 0.13908920671193095, 'bull_strategy': 'breakout', 'bull_bb_std_mult': 2.4814024422755527, 'bull_rsi_os': 49, 'bull_rsi_ob': 61, 'bull_adx_thresh': 6.535912227780484, 'bull_atr_min_pct': 0.00024217902069627052, 'bull_atr_max_pct': 0.1471667522577993, 'bull_tp_mult': 2.2569575886130124, 'bull_tsl_mult': 0.2803608402746659, 'bull_time_stop': 135, 'bull_use_sma': True, 'bull_use_ema': False, 'bull_use_atr': False, 'bull_use_adx': True, 'bull_use_spike': True, 'bull_rsi_required': True, 'bear_strategy': 'mean_reversion', 'bear_bb_std_mult': 1.394480228250703, 'bear_rsi_os': 13, 'bear_rsi_ob': 45, 'bear_adx_thresh': 5.37183156123695, 'bear_atr_min_pct': 0.006115833486070788, 'bear_atr_max_pct': 0.01055583338510876, 'bear_tp_mult': 2.1069494953648915, 'bear_tsl_mult': 0.7764882345170225, 'bear_time_stop': 5, 'bear_use_sma': False, 'bear_use_ema': False, 'bear_use_atr': False, 'bear_use_adx': True, 'bear_use_spike': False, 'bear_rsi_required': True, 'sideways_strategy': 'mean_reversion', 'sideways_bb_std_mult': 0.6369575311719489, 'sideways_rsi_os': 41, 'sideways_rsi_ob': 95, 'sideways_adx_thresh': 9.672393466928483, 'sideways_atr_min_pct': 0.02723974058927744, 'sideways_atr_max_pct': 0.04926496404290415, 'sideways_tp_mult': 1.862613653779808, 'sideways_tsl_mult': 0.6436902761679383, 'sideways_time_stop': 199, 'sideways_use_sma': True, 'sideways_use_ema': False, 'sideways_use_atr': False, 'sideways_use_adx': False, 'sideways_use_spike': True, 'sideways_rsi_required': False}.
[I 2025-08-31 02:24:06,911] Trial 489 finished with values: [-0.014412786543646305, 0.014343524929704695] and parameters: {'p_sma': 54, 'p_std': 45, 'p_atr': 28, 'p_adx': 26, 'rsi_period': 66, 'ema1': 5, 'ema2': 24, 'slip_atr_k': 0.007434490772797919, 'slip_spread_k': 0.15014011734984323, 'spread_hl_frac': 0.004767026560659418, 'bb_std_mult': 1.7023920362824516, 'rsi_os': 39, 'rsi_ob': 70, 'vol_spike': 0.18812221821543584, 'adx_thresh': 20.21358257472087, 'atr_min_pct': 0.007625392407053508, 'atr_max_pct': 0.11920181413239347, 'tp_mult': 1.035681750988773, 'tsl_mult': 0.022823756601818894, 'strategy': 'mean_reversion', 'time_stop': 113, 'use_sma': True, 'use_atr': False, 'use_adx': False, 'use_ema': False, 'use_spike': False, 'rsi_required': True, 'edge_k': 0.5337603039129368, 'edge_cap': 0.13813123383119866, 'bull_strategy': 'breakout', 'bull_bb_std_mult': 2.467826602243158, 'bull_rsi_os': 49, 'bull_rsi_ob': 61, 'bull_adx_thresh': 6.434139595069969, 'bull_atr_min_pct': 7.190092520042776e-05, 'bull_atr_max_pct': 0.14723901135147335, 'bull_tp_mult': 2.2683535500646625, 'bull_tsl_mult': 0.27831191496412466, 'bull_time_stop': 136, 'bull_use_sma': True, 'bull_use_ema': False, 'bull_use_atr': False, 'bull_use_adx': False, 'bull_use_spike': True, 'bull_rsi_required': True, 'bear_strategy': 'mean_reversion', 'bear_bb_std_mult': 1.4087630816723682, 'bear_rsi_os': 17, 'bear_rsi_ob': 45, 'bear_adx_thresh': 5.018640058824694, 'bear_atr_min_pct': 0.005737269751802233, 'bear_atr_max_pct': 0.010271940102707003, 'bear_tp_mult': 2.1073632533676423, 'bear_tsl_mult': 0.7807413323984763, 'bear_time_stop': 5, 'bear_use_sma': False, 'bear_use_ema': False, 'bear_use_atr': False, 'bear_use_adx': True, 'bear_use_spike': False, 'bear_rsi_required': True, 'sideways_strategy': 'mean_reversion', 'sideways_bb_std_mult': 0.6467393355515272, 'sideways_rsi_os': 41, 'sideways_rsi_ob': 95, 'sideways_adx_thresh': 9.84055316956228, 'sideways_atr_min_pct': 0.02697151548296343, 'sideways_atr_max_pct': 0.04946993046333675, 'sideways_tp_mult': 1.8240636691226761, 'sideways_tsl_mult': 0.64859333315207, 'sideways_time_stop': 199, 'sideways_use_sma': True, 'sideways_use_ema': False, 'sideways_use_atr': False, 'sideways_use_adx': False, 'sideways_use_spike': True, 'sideways_rsi_required': False}.
[I 2025-08-31 02:24:07,213] Trial 490 finished with values: [-0.014786617514276124, 0.014717348471317698] and parameters: {'p_sma': 54, 'p_std': 45, 'p_atr': 28, 'p_adx': 26, 'rsi_period': 66, 'ema1': 5, 'ema2': 24, 'slip_atr_k': 0.00798955986191438, 'slip_spread_k': 0.14843273998953804, 'spread_hl_frac': 0.004988049465155858, 'bb_std_mult': 1.6884454191054765, 'rsi_os': 39, 'rsi_ob': 70, 'vol_spike': 0.18327244919858163, 'adx_thresh': 20.13527213027631, 'atr_min_pct': 0.007680217389378816, 'atr_max_pct': 0.11895842899209892, 'tp_mult': 1.0404408969779038, 'tsl_mult': 0.029620794993394463, 'strategy': 'mean_reversion', 'time_stop': 113, 'use_sma': True, 'use_atr': False, 'use_adx': False, 'use_ema': False, 'use_spike': False, 'rsi_required': True, 'edge_k': 0.5468260199461162, 'edge_cap': 0.1370182426991688, 'bull_strategy': 'breakout', 'bull_bb_std_mult': 2.470757182001755, 'bull_rsi_os': 50, 'bull_rsi_ob': 61, 'bull_adx_thresh': 6.395339961874634, 'bull_atr_min_pct': 0.0001366413683499912, 'bull_atr_max_pct': 0.1499192582854225, 'bull_tp_mult': 2.2659800709468954, 'bull_tsl_mult': 0.2708054153673307, 'bull_time_stop': 138, 'bull_use_sma': True, 'bull_use_ema': False, 'bull_use_atr': False, 'bull_use_adx': False, 'bull_use_spike': True, 'bull_rsi_required': True, 'bear_strategy': 'mean_reversion', 'bear_bb_std_mult': 1.41153988441481, 'bear_rsi_os': 15, 'bear_rsi_ob': 45, 'bear_adx_thresh': 5.3929566998796625, 'bear_atr_min_pct': 0.006090226082617383, 'bear_atr_max_pct': 0.010042656454351645, 'bear_tp_mult': 2.104293027979057, 'bear_tsl_mult': 0.7602137462646003, 'bear_time_stop': 7, 'bear_use_sma': False, 'bear_use_ema': False, 'bear_use_atr': False, 'bear_use_adx': True, 'bear_use_spike': False, 'bear_rsi_required': True, 'sideways_strategy': 'mean_reversion', 'sideways_bb_std_mult': 0.649259490186731, 'sideways_rsi_os': 41, 'sideways_rsi_ob': 95, 'sideways_adx_thresh': 10.150735573971744, 'sideways_atr_min_pct': 0.026950731936306163, 'sideways_atr_max_pct': 0.049803627363891545, 'sideways_tp_mult': 1.828042926951793, 'sideways_tsl_mult': 0.6340840284656571, 'sideways_time_stop': 190, 'sideways_use_sma': True, 'sideways_use_ema': False, 'sideways_use_atr': False, 'sideways_use_adx': False, 'sideways_use_spike': True, 'sideways_rsi_required': False}.
[I 2025-08-31 02:24:07,316] Trial 491 finished with values: [-0.014146094784105334, 0.014076661743322044] and parameters: {'p_sma': 55, 'p_std': 45, 'p_atr': 28, 'p_adx': 26, 'rsi_period': 66, 'ema1': 5, 'ema2': 23, 'slip_atr_k': 0.009992999231048637, 'slip_spread_k': 0.1461634606027939, 'spread_hl_frac': 0.004552401558494096, 'bb_std_mult': 1.694668120748045, 'rsi_os': 39, 'rsi_ob': 68, 'vol_spike': 0.18465246161213694, 'adx_thresh': 20.109031008395526, 'atr_min_pct': 0.0078558070053481, 'atr_max_pct': 0.1186863161349192, 'tp_mult': 1.0297320320840289, 'tsl_mult': 0.023181150193070064, 'strategy': 'mean_reversion', 'time_stop': 111, 'use_sma': True, 'use_atr': False, 'use_adx': False, 'use_ema': False, 'use_spike': False, 'rsi_required': True, 'edge_k': 0.5317336206448499, 'edge_cap': 0.137712430959489, 'bull_strategy': 'breakout', 'bull_bb_std_mult': 2.480325823647523, 'bull_rsi_os': 49, 'bull_rsi_ob': 61, 'bull_adx_thresh': 6.46600131097577, 'bull_atr_min_pct': 0.00013250474094399968, 'bull_atr_max_pct': 0.14699053483446, 'bull_tp_mult': 2.282208751994836, 'bull_tsl_mult': 0.27684514365650265, 'bull_time_stop': 134, 'bull_use_sma': True, 'bull_use_ema': False, 'bull_use_atr': False, 'bull_use_adx': False, 'bull_use_spike': True, 'bull_rsi_required': True, 'bear_strategy': 'mean_reversion', 'bear_bb_std_mult': 1.4012988723488964, 'bear_rsi_os': 17, 'bear_rsi_ob': 45, 'bear_adx_thresh': 5.256255865725755, 'bear_atr_min_pct': 0.0061888954921700875, 'bear_atr_max_pct': 0.010831663727315269, 'bear_tp_mult': 2.1028429236319495, 'bear_tsl_mult': 0.7849163067572338, 'bear_time_stop': 9, 'bear_use_sma': False, 'bear_use_ema': False, 'bear_use_atr': False, 'bear_use_adx': True, 'bear_use_spike': False, 'bear_rsi_required': True, 'sideways_strategy': 'mean_reversion', 'sideways_bb_std_mult': 0.6486130622759982, 'sideways_rsi_os': 40, 'sideways_rsi_ob': 95, 'sideways_adx_thresh': 9.994885115691188, 'sideways_atr_min_pct': 0.026890981313624922, 'sideways_atr_max_pct': 0.04874981673937173, 'sideways_tp_mult': 1.8300489013871275, 'sideways_tsl_mult': 0.634885926395933, 'sideways_time_stop': 192, 'sideways_use_sma': True, 'sideways_use_ema': False, 'sideways_use_atr': False, 'sideways_use_adx': False, 'sideways_use_spike': True, 'sideways_rsi_required': False}.
[I 2025-08-31 02:24:40,455] Trial 495 finished with values: [-0.014214036341669067, 0.014144787298889735] and parameters: {'p_sma': 55, 'p_std': 45, 'p_atr': 28, 'p_adx': 26, 'rsi_period': 67, 'ema1': 5, 'ema2': 24, 'slip_atr_k': 0.007006887309610826, 'slip_spread_k': 0.14618250539433147, 'spread_hl_frac': 0.004656987790147308, 'bb_std_mult': 1.6865273911322793, 'rsi_os': 38, 'rsi_ob': 70, 'vol_spike': 0.18014264397927773, 'adx_thresh': 19.91929279018794, 'atr_min_pct': 0.00818684535902667, 'atr_max_pct': 0.11940879508535998, 'tp_mult': 1.046717862083332, 'tsl_mult': 0.03809448103364031, 'strategy': 'mean_reversion', 'time_stop': 110, 'use_sma': True, 'use_atr': False, 'use_adx': False, 'use_ema': False, 'use_spike': True, 'rsi_required': True, 'edge_k': 0.5414170358298984, 'edge_cap': 0.11406692208125499, 'bull_strategy': 'breakout', 'bull_bb_std_mult': 2.462264625037363, 'bull_rsi_os': 49, 'bull_rsi_ob': 61, 'bull_adx_thresh': 5.822833346014376, 'bull_atr_min_pct': 4.104873152971922e-05, 'bull_atr_max_pct': 0.1476042844241712, 'bull_tp_mult': 2.2600204335236187, 'bull_tsl_mult': 0.26870126659461147, 'bull_time_stop': 136, 'bull_use_sma': True, 'bull_use_ema': False, 'bull_use_atr': False, 'bull_use_adx': False, 'bull_use_spike': True, 'bull_rsi_required': True, 'bear_strategy': 'mean_reversion', 'bear_bb_std_mult': 1.4072651554077613, 'bear_rsi_os': 16, 'bear_rsi_ob': 46, 'bear_adx_thresh': 5.211332666458253, 'bear_atr_min_pct': 0.006070133543590191, 'bear_atr_max_pct': 0.01009920238455412, 'bear_tp_mult': 2.0984162271411755, 'bear_tsl_mult': 0.767953088534669, 'bear_time_stop': 5, 'bear_use_sma': False, 'bear_use_ema': True, 'bear_use_atr': False, 'bear_use_adx': False, 'bear_use_spike': False, 'bear_rsi_required': True, 'sideways_strategy': 'mean_reversion', 'sideways_bb_std_mult': 0.7124414867975104, 'sideways_rsi_os': 40, 'sideways_rsi_ob': 95, 'sideways_adx_thresh': 9.747779918769707, 'sideways_atr_min_pct': 0.026881661908994325, 'sideways_atr_max_pct': 0.05006464493370672, 'sideways_tp_mult': 1.7657263925711384, 'sideways_tsl_mult': 0.634556186048759, 'sideways_time_stop': 198, 'sideways_use_sma': True, 'sideways_use_ema': False, 'sideways_use_atr': False, 'sideways_use_adx': False, 'sideways_use_spike': True, 'sideways_rsi_required': False}.
[I 2025-08-31 02:24:40,679] Trial 494 finished with values: [-1000000000.0, 1000000000.0] and parameters: {'p_sma': 54, 'p_std': 46, 'p_atr': 28, 'p_adx': 26, 'rsi_period': 67, 'ema1': 5, 'ema2': 23, 'slip_atr_k': 0.007050461790683817, 'slip_spread_k': 0.15253467929837353, 'spread_hl_frac': 0.004840958074781786, 'bb_std_mult': 1.682949456139347, 'rsi_os': 38, 'rsi_ob': 67, 'vol_spike': 0.1800997458394964, 'adx_thresh': 20.143937427573935, 'atr_min_pct': 0.00817000629239368, 'atr_max_pct': 0.12102854246259896, 'tp_mult': 1.0443668170286367, 'tsl_mult': 0.02772219453413846, 'strategy': 'mean_reversion', 'time_stop': 113, 'use_sma': True, 'use_atr': False, 'use_adx': False, 'use_ema': False, 'use_spike': True, 'rsi_required': True, 'edge_k': 0.5216136126494, 'edge_cap': 0.13277879590557917, 'bull_strategy': 'breakout', 'bull_bb_std_mult': 2.449888052273972, 'bull_rsi_os': 49, 'bull_rsi_ob': 61, 'bull_adx_thresh': 6.055903304469541, 'bull_atr_min_pct': 9.213654633160771e-07, 'bull_atr_max_pct': 0.14577176509575165, 'bull_tp_mult': 2.2498228855369176, 'bull_tsl_mult': 0.2702101159633932, 'bull_time_stop': 135, 'bull_use_sma': True, 'bull_use_ema': False, 'bull_use_atr': False, 'bull_use_adx': False, 'bull_use_spike': True, 'bull_rsi_required': True, 'bear_strategy': 'mean_reversion', 'bear_bb_std_mult': 1.4019536952854614, 'bear_rsi_os': 17, 'bear_rsi_ob': 46, 'bear_adx_thresh': 5.024179133073586, 'bear_atr_min_pct': 0.005888918464322371, 'bear_atr_max_pct': 0.010170563741189033, 'bear_tp_mult': 2.112677327439276, 'bear_tsl_mult': 0.7680668776575736, 'bear_time_stop': 6, 'bear_use_sma': False, 'bear_use_ema': True, 'bear_use_atr': False, 'bear_use_adx': False, 'bear_use_spike': False, 'bear_rsi_required': True, 'sideways_strategy': 'mean_reversion', 'sideways_bb_std_mult': 0.6208041509072764, 'sideways_rsi_os': 41, 'sideways_rsi_ob': 95, 'sideways_adx_thresh': 9.454758589708312, 'sideways_atr_min_pct': 0.027081409721801526, 'sideways_atr_max_pct': 0.04977816835946247, 'sideways_tp_mult': 1.7720371742774899, 'sideways_tsl_mult': 0.6300939611234501, 'sideways_time_stop': 199, 'sideways_use_sma': True, 'sideways_use_ema': False, 'sideways_use_atr': False, 'sideways_use_adx': False, 'sideways_use_spike': True, 'sideways_rsi_required': False}.
[I 2025-08-31 02:24:41,123] Trial 492 finished with values: [-0.01447131326708695, 0.014402154088831387] and parameters: {'p_sma': 55, 'p_std': 46, 'p_atr': 28, 'p_adx': 26, 'rsi_period': 67, 'ema1': 5, 'ema2': 23, 'slip_atr_k': 0.005794516276717328, 'slip_spread_k': 0.14927897397126688, 'spread_hl_frac': 0.004867020906789496, 'bb_std_mult': 1.6660070173083652, 'rsi_os': 39, 'rsi_ob': 68, 'vol_spike': 0.1808942308942472, 'adx_thresh': 20.079896450453177, 'atr_min_pct': 0.007969866752304875, 'atr_max_pct': 0.11856592677055232, 'tp_mult': 1.0323161471671431, 'tsl_mult': 0.038407412264897606, 'strategy': 'mean_reversion', 'time_stop': 114, 'use_sma': True, 'use_atr': False, 'use_adx': False, 'use_ema': False, 'use_spike': True, 'rsi_required': True, 'edge_k': 0.517720842386374, 'edge_cap': 0.13663105231526843, 'bull_strategy': 'breakout', 'bull_bb_std_mult': 2.4876180344258825, 'bull_rsi_os': 50, 'bull_rsi_ob': 61, 'bull_adx_thresh': 6.113234114159283, 'bull_atr_min_pct': 5.1178210643686715e-05, 'bull_atr_max_pct': 0.1461807616702896, 'bull_tp_mult': 2.280986053591543, 'bull_tsl_mult': 0.26577894785705425, 'bull_time_stop': 138, 'bull_use_sma': True, 'bull_use_ema': False, 'bull_use_atr': False, 'bull_use_adx': False, 'bull_use_spike': True, 'bull_rsi_required': True, 'bear_strategy': 'mean_reversion', 'bear_bb_std_mult': 1.3770915443246385, 'bear_rsi_os': 18, 'bear_rsi_ob': 46, 'bear_adx_thresh': 5.106270555591769, 'bear_atr_min_pct': 0.0055008611373727955, 'bear_atr_max_pct': 0.010052033595211517, 'bear_tp_mult': 2.1086446725383907, 'bear_tsl_mult': 0.7645997655681476, 'bear_time_stop': 5, 'bear_use_sma': False, 'bear_use_ema': True, 'bear_use_atr': False, 'bear_use_adx': False, 'bear_use_spike': False, 'bear_rsi_required': True, 'sideways_strategy': 'mean_reversion', 'sideways_bb_std_mult': 0.6252841722678284, 'sideways_rsi_os': 41, 'sideways_rsi_ob': 95, 'sideways_adx_thresh': 9.822939617478132, 'sideways_atr_min_pct': 0.02709302169353749, 'sideways_atr_max_pct': 0.04864389401918123, 'sideways_tp_mult': 1.8186371420596605, 'sideways_tsl_mult': 0.6324525552602568, 'sideways_time_stop': 197, 'sideways_use_sma': True, 'sideways_use_ema': False, 'sideways_use_atr': False, 'sideways_use_adx': False, 'sideways_use_spike': True, 'sideways_rsi_required': False}.
