[I 2025-08-31 03:09:49,826] Trial 809 finished with values: [-1000000000.0, 1000000000.0] and parameters: {'p_sma': 42, 'p_std': 7, 'p_atr': 10, 'p_adx': 25, 'rsi_period': 70, 'ema1': 28, 'ema2': 14, 'slip_atr_k': 0.10823712648753872, 'slip_spread_k': 0.7486739538174394, 'spread_hl_frac': 0.002884784400584022, 'bb_std_mult': 1.851810280515949, 'rsi_os': 37, 'rsi_ob': 70, 'vol_spike': 0.19797528654715352, 'adx_thresh': 9.740265674517449, 'atr_min_pct': 0.00706933644822821, 'atr_max_pct': 0.04684900059697908, 'tp_mult': 1.5306644392999011, 'tsl_mult': 0.3229147127527331, 'strategy': 'mean_reversion', 'time_stop': 61, 'use_sma': False, 'use_atr': False, 'use_adx': False, 'use_ema': False, 'use_spike': False, 'rsi_required': True, 'edge_k': 0.08117987385138248, 'edge_cap': 0.14479112463909877, 'bull_strategy': 'breakout', 'bull_bb_std_mult': 2.440105065506059, 'bull_rsi_os': 20, 'bull_rsi_ob': 80, 'bull_adx_thresh': 6.6725930437353655, 'bull_atr_min_pct': 0.022325443130920775, 'bull_atr_max_pct': 0.14929826122820342, 'bull_tp_mult': 1.479527275937945, 'bull_tsl_mult': 0.3404625337583788, 'bull_time_stop': 143, 'bull_use_sma': True, 'bull_use_ema': False, 'bull_use_atr': False, 'bull_use_adx': True, 'bull_use_spike': True, 'bull_rsi_required': True, 'bear_strategy': 'breakout', 'bear_bb_std_mult': 1.4876152843165675, 'bear_rsi_os': 17, 'bear_rsi_ob': 46, 'bear_adx_thresh': 6.757374208744945, 'bear_atr_min_pct': 0.014377582408904929, 'bear_atr_max_pct': 0.0161262538519509, 'bear_tp_mult': 2.078863021413276, 'bear_tsl_mult': 0.43816712622544246, 'bear_time_stop': 24, 'bear_use_sma': False, 'bear_use_ema': False, 'bear_use_atr': True, 'bear_use_adx': True, 'bear_use_spike': False, 'bear_rsi_required': True, 'sideways_strategy': 'breakout', 'sideways_bb_std_mult': 0.7347953757626078, 'sideways_rsi_os': 32, 'sideways_rsi_ob': 66, 'sideways_adx_thresh': 9.14423776944646, 'sideways_atr_min_pct': 0.02533775813131116, 'sideways_atr_max_pct': 0.06192430750780238, 'sideways_tp_mult': 2.509686136659133, 'sideways_tsl_mult': 0.9801502122730563, 'sideways_time_stop': 207, 'sideways_use_sma': True, 'sideways_use_ema': False, 'sideways_use_atr': False, 'sideways_use_adx': False, 'sideways_use_spike': False, 'sideways_rsi_required': False}.
[I 2025-08-31 03:09:50,169] Trial 811 finished with values: [-1000000000.0, 1000000000.0] and parameters: {'p_sma': 54, 'p_std': 49, 'p_atr': 12, 'p_adx': 24, 'rsi_period': 14, 'ema1': 5, 'ema2': 23, 'slip_atr_k': 0.17432933068337592, 'slip_spread_k': 0.17405369101614265, 'spread_hl_frac': 0.002860933206537872, 'bb_std_mult': 1.8046299488423048, 'rsi_os': 47, 'rsi_ob': 58, 'vol_spike': 0.1957005838539626, 'adx_thresh': 21.206278627325517, 'atr_min_pct': 0.006649483175505247, 'atr_max_pct': 0.04985402673119338, 'tp_mult': 2.176631964306732, 'tsl_mult': 0.7051172672280978, 'strategy': 'mean_reversion', 'time_stop': 103, 'use_sma': False, 'use_atr': False, 'use_adx': False, 'use_ema': False, 'use_spike': False, 'rsi_required': True, 'edge_k': 1.1728956760049036, 'edge_cap': 0.1268380904636213, 'bull_strategy': 'mean_reversion', 'bull_bb_std_mult': 3.0553216158504926, 'bull_rsi_os': 50, 'bull_rsi_ob': 64, 'bull_adx_thresh': 5.595529097257864, 'bull_atr_min_pct': 0.012051450864340141, 'bull_atr_max_pct': 0.1404009595811459, 'bull_tp_mult': 2.251724263026347, 'bull_tsl_mult': 0.1864065041082552, 'bull_time_stop': 137, 'bull_use_sma': True, 'bull_use_ema': False, 'bull_use_atr': False, 'bull_use_adx': True, 'bull_use_spike': True, 'bull_rsi_required': True, 'bear_strategy': 'breakout', 'bear_bb_std_mult': 1.333140874887485, 'bear_rsi_os': 16, 'bear_rsi_ob': 45, 'bear_adx_thresh': 21.33255305779076, 'bear_atr_min_pct': 0.014373928851419734, 'bear_atr_max_pct': 0.10305634314602989, 'bear_tp_mult': 2.935683253643871, 'bear_tsl_mult': 0.43860551740376486, 'bear_time_stop': 176, 'bear_use_sma': False, 'bear_use_ema': False, 'bear_use_atr': True, 'bear_use_adx': True, 'bear_use_spike': False, 'bear_rsi_required': True, 'sideways_strategy': 'breakout', 'sideways_bb_std_mult': 0.5634388524066337, 'sideways_rsi_os': 53, 'sideways_rsi_ob': 95, 'sideways_adx_thresh': 8.546820513927175, 'sideways_atr_min_pct': 0.011246547628647062, 'sideways_atr_max_pct': 0.12759910949619557, 'sideways_tp_mult': 1.894935340129929, 'sideways_tsl_mult': 0.7034477441714382, 'sideways_time_stop': 206, 'sideways_use_sma': True, 'sideways_use_ema': False, 'sideways_use_atr': False, 'sideways_use_adx': False, 'sideways_use_spike': False, 'sideways_rsi_required': False}.
[I 2025-08-31 03:09:50,490] Trial 810 finished with values: [-1000000000.0, 1000000000.0] and parameters: {'p_sma': 55, 'p_std': 8, 'p_atr': 26, 'p_adx': 25, 'rsi_period': 70, 'ema1': 5, 'ema2': 30, 'slip_atr_k': 0.17321158981024623, 'slip_spread_k': 0.12746269579972092, 'spread_hl_frac': 0.002629056513985712, 'bb_std_mult': 3.234429401838156, 'rsi_os': 14, 'rsi_ob': 69, 'vol_spike': 0.19718125388801555, 'adx_thresh': 30.510785100286476, 'atr_min_pct': 0.009039143816762045, 'atr_max_pct': 0.0483616544989956, 'tp_mult': 2.004380046020307, 'tsl_mult': 0.8737138984529726, 'strategy': 'mean_reversion', 'time_stop': 103, 'use_sma': False, 'use_atr': False, 'use_adx': False, 'use_ema': False, 'use_spike': False, 'rsi_required': True, 'edge_k': 1.6408230827927697, 'edge_cap': 0.15086165979372052, 'bull_strategy': 'mean_reversion', 'bull_bb_std_mult': 2.4825764702331092, 'bull_rsi_os': 24, 'bull_rsi_ob': 64, 'bull_adx_thresh': 6.337895756369434, 'bull_atr_min_pct': 0.022431428073205972, 'bull_atr_max_pct': 0.14789649975409436, 'bull_tp_mult': 1.473490847917601, 'bull_tsl_mult': 0.5246701586928373, 'bull_time_stop': 135, 'bull_use_sma': True, 'bull_use_ema': False, 'bull_use_atr': False, 'bull_use_adx': True, 'bull_use_spike': True, 'bull_rsi_required': True, 'bear_strategy': 'breakout', 'bear_bb_std_mult': 1.4786977154917809, 'bear_rsi_os': 17, 'bear_rsi_ob': 45, 'bear_adx_thresh': 6.1738238976713715, 'bear_atr_min_pct': 0.004435165615251221, 'bear_atr_max_pct': 0.10190472188279472, 'bear_tp_mult': 1.592925762074442, 'bear_tsl_mult': 0.4362436570946935, 'bear_time_stop': 10, 'bear_use_sma': False, 'bear_use_ema': False, 'bear_use_atr': True, 'bear_use_adx': True, 'bear_use_spike': False, 'bear_rsi_required': True, 'sideways_strategy': 'breakout', 'sideways_bb_std_mult': 0.5596130787339955, 'sideways_rsi_os': 32, 'sideways_rsi_ob': 93, 'sideways_adx_thresh': 18.03782044664655, 'sideways_atr_min_pct': 0.011340051082201525, 'sideways_atr_max_pct': 0.10814352096558252, 'sideways_tp_mult': 1.5349470631770488, 'sideways_tsl_mult': 0.7130207711104193, 'sideways_time_stop': 196, 'sideways_use_sma': True, 'sideways_use_ema': False, 'sideways_use_atr': False, 'sideways_use_adx': False, 'sideways_use_spike': False, 'sideways_rsi_required': False}.
[I 2025-08-31 03:09:51,482] Trial 813 finished with values: [-1000000000.0, 1000000000.0] and parameters: {'p_sma': 10, 'p_std': 50, 'p_atr': 28, 'p_adx': 20, 'rsi_period': 74, 'ema1': 5, 'ema2': 30, 'slip_atr_k': 0.1449023957991541, 'slip_spread_k': 0.12592961215991483, 'spread_hl_frac': 0.03898323133869847, 'bb_std_mult': 2.379127502027298, 'rsi_os': 35, 'rsi_ob': 45, 'vol_spike': 0.17819411186843598, 'adx_thresh': 21.262441377689022, 'atr_min_pct': 0.00898953828411643, 'atr_max_pct': 0.11586525241288645, 'tp_mult': 1.6088473975574988, 'tsl_mult': 0.7024184811357691, 'strategy': 'mean_reversion', 'time_stop': 150, 'use_sma': True, 'use_atr': False, 'use_adx': False, 'use_ema': False, 'use_spike': False, 'rsi_required': True, 'edge_k': 0.4520109661553958, 'edge_cap': 0.12618384138854247, 'bull_strategy': 'mean_reversion', 'bull_bb_std_mult': 3.2358054200712507, 'bull_rsi_os': 17, 'bull_rsi_ob': 94, 'bull_adx_thresh': 5.579933305280801, 'bull_atr_min_pct': 0.010404851181489651, 'bull_atr_max_pct': 0.13958560070636544, 'bull_tp_mult': 1.3515708621754932, 'bull_tsl_mult': 0.18431012596619506, 'bull_time_stop': 126, 'bull_use_sma': True, 'bull_use_ema': True, 'bull_use_atr': False, 'bull_use_adx': True, 'bull_use_spike': True, 'bull_rsi_required': True, 'bear_strategy': 'mean_reversion', 'bear_bb_std_mult': 1.7541477794754212, 'bear_rsi_os': 20, 'bear_rsi_ob': 50, 'bear_adx_thresh': 5.024262289407457, 'bear_atr_min_pct': 0.0043308523277294595, 'bear_atr_max_pct': 0.04291172107182293, 'bear_tp_mult': 2.245415336257065, 'bear_tsl_mult': 0.4626240551534749, 'bear_time_stop': 10, 'bear_use_sma': False, 'bear_use_ema': False, 'bear_use_atr': False, 'bear_use_adx': True, 'bear_use_spike': False, 'bear_rsi_required': True, 'sideways_strategy': 'breakout', 'sideways_bb_std_mult': 0.5600434829396244, 'sideways_rsi_os': 38, 'sideways_rsi_ob': 82, 'sideways_adx_thresh': 6.022445420967234, 'sideways_atr_min_pct': 0.029893667554269903, 'sideways_atr_max_pct': 0.11782452504809114, 'sideways_tp_mult': 2.9586104640103534, 'sideways_tsl_mult': 0.8661873069117764, 'sideways_time_stop': 200, 'sideways_use_sma': True, 'sideways_use_ema': False, 'sideways_use_atr': False, 'sideways_use_adx': True, 'sideways_use_spike': True, 'sideways_rsi_required': True}.
[I 2025-08-31 03:09:52,320] Trial 817 finished with values: [-1000000000.0, 1000000000.0] and parameters: {'p_sma': 32, 'p_std': 29, 'p_atr': 14, 'p_adx': 30, 'rsi_period': 69, 'ema1': 11, 'ema2': 26, 'slip_atr_k': 0.116909290684078, 'slip_spread_k': 0.42891209904043964, 'spread_hl_frac': 0.0205297880680458, 'bb_std_mult': 1.5421660294925712, 'rsi_os': 36, 'rsi_ob': 48, 'vol_spike': 0.1875677209056532, 'adx_thresh': 20.10255115585488, 'atr_min_pct': 0.016055463916026975, 'atr_max_pct': 0.10822163733207246, 'tp_mult': 2.070182081099376, 'tsl_mult': 0.48729558369373904, 'strategy': 'mean_reversion', 'time_stop': 274, 'use_sma': True, 'use_atr': False, 'use_adx': False, 'use_ema': False, 'use_spike': False, 'rsi_required': True, 'edge_k': 0.5771468016384382, 'edge_cap': 0.09134198553020395, 'bull_strategy': 'breakout', 'bull_bb_std_mult': 2.5663327714067576, 'bull_rsi_os': 54, 'bull_rsi_ob': 53, 'bull_adx_thresh': 16.43907161595982, 'bull_atr_min_pct': 0.026282824705992525, 'bull_atr_max_pct': 0.01655053286903986, 'bull_tp_mult': 2.334630734030719, 'bull_tsl_mult': 0.32109852928261945, 'bull_time_stop': 150, 'bull_use_sma': True, 'bull_use_ema': True, 'bull_use_atr': False, 'bull_use_adx': True, 'bull_use_spike': True, 'bull_rsi_required': True, 'bear_strategy': 'mean_reversion', 'bear_bb_std_mult': 1.334974655479345, 'bear_rsi_os': 18, 'bear_rsi_ob': 95, 'bear_adx_thresh': 5.960889529132496, 'bear_atr_min_pct': 0.005626196448979618, 'bear_atr_max_pct': 0.07676545437939972, 'bear_tp_mult': 1.7041037590267452, 'bear_tsl_mult': 0.5652597558539473, 'bear_time_stop': 14, 'bear_use_sma': False, 'bear_use_ema': False, 'bear_use_atr': False, 'bear_use_adx': True, 'bear_use_spike': False, 'bear_rsi_required': True, 'sideways_strategy': 'breakout', 'sideways_bb_std_mult': 2.26449338267523, 'sideways_rsi_os': 16, 'sideways_rsi_ob': 91, 'sideways_adx_thresh': 29.470512391153797, 'sideways_atr_min_pct': 0.026742860177505916, 'sideways_atr_max_pct': 0.04939850656093533, 'sideways_tp_mult': 2.1360098655176216, 'sideways_tsl_mult': 0.6275435152993125, 'sideways_time_stop': 130, 'sideways_use_sma': True, 'sideways_use_ema': False, 'sideways_use_atr': False, 'sideways_use_adx': False, 'sideways_use_spike': True, 'sideways_rsi_required': True}.
[I 2025-08-31 03:10:21,637] Trial 815 finished with values: [-1000000000.0, 1000000000.0] and parameters: {'p_sma': 52, 'p_std': 51, 'p_atr': 28, 'p_adx': 22, 'rsi_period': 69, 'ema1': 15, 'ema2': 30, 'slip_atr_k': 0.14015667841964244, 'slip_spread_k': 0.12227896414686998, 'spread_hl_frac': 0.020237105082152387, 'bb_std_mult': 1.042711829584267, 'rsi_os': 36, 'rsi_ob': 68, 'vol_spike': 0.26285493662300713, 'adx_thresh': 20.11263066416189, 'atr_min_pct': 0.015637723566369267, 'atr_max_pct': 0.11450061966998498, 'tp_mult': 1.8253776915480884, 'tsl_mult': 0.4629223943476646, 'strategy': 'mean_reversion', 'time_stop': 112, 'use_sma': True, 'use_atr': False, 'use_adx': False, 'use_ema': False, 'use_spike': False, 'rsi_required': True, 'edge_k': 0.6085799923376094, 'edge_cap': 0.09103420216437087, 'bull_strategy': 'breakout', 'bull_bb_std_mult': 2.949593181540422, 'bull_rsi_os': 17, 'bull_rsi_ob': 46, 'bull_adx_thresh': 31.2199459705043, 'bull_atr_min_pct': 0.02615759344110567, 'bull_atr_max_pct': 0.05717572425765103, 'bull_tp_mult': 2.0527139021501175, 'bull_tsl_mult': 0.8518569292184313, 'bull_time_stop': 127, 'bull_use_sma': True, 'bull_use_ema': True, 'bull_use_atr': False, 'bull_use_adx': True, 'bull_use_spike': True, 'bull_rsi_required': True, 'bear_strategy': 'mean_reversion', 'bear_bb_std_mult': 1.7577368419264783, 'bear_rsi_os': 20, 'bear_rsi_ob': 57, 'bear_adx_thresh': 6.253978222823249, 'bear_atr_min_pct': 0.004450517229726347, 'bear_atr_max_pct': 0.04264026592795374, 'bear_tp_mult': 2.028888929586274, 'bear_tsl_mult': 0.4656907942446721, 'bear_time_stop': 16, 'bear_use_sma': False, 'bear_use_ema': False, 'bear_use_atr': False, 'bear_use_adx': True, 'bear_use_spike': False, 'bear_rsi_required': True, 'sideways_strategy': 'breakout', 'sideways_bb_std_mult': 0.5009631648769198, 'sideways_rsi_os': 16, 'sideways_rsi_ob': 91, 'sideways_adx_thresh': 10.724753825145559, 'sideways_atr_min_pct': 0.02644931376504217, 'sideways_atr_max_pct': 0.058081616450029704, 'sideways_tp_mult': 1.7844832254807346, 'sideways_tsl_mult': 0.864655768107133, 'sideways_time_stop': 198, 'sideways_use_sma': True, 'sideways_use_ema': False, 'sideways_use_atr': False, 'sideways_use_adx': True, 'sideways_use_spike': True, 'sideways_rsi_required': True}.
[I 2025-08-31 03:10:21,644] Trial 816 finished with values: [-1000000000.0, 1000000000.0] and parameters: {'p_sma': 52, 'p_std': 51, 'p_atr': 14, 'p_adx': 30, 'rsi_period': 74, 'ema1': 5, 'ema2': 13, 'slip_atr_k': 0.15683659473733216, 'slip_spread_k': 0.43977279131398467, 'spread_hl_frac': 0.013979948269834461, 'bb_std_mult': 0.9852880676374753, 'rsi_os': 34, 'rsi_ob': 68, 'vol_spike': 0.17950312327684864, 'adx_thresh': 23.16295075218045, 'atr_min_pct': 0.009840890926451807, 'atr_max_pct': 0.11440747220320878, 'tp_mult': 1.441264427007485, 'tsl_mult': 0.46461443699228444, 'strategy': 'mean_reversion', 'time_stop': 169, 'use_sma': True, 'use_atr': False, 'use_adx': False, 'use_ema': False, 'use_spike': False, 'rsi_required': True, 'edge_k': 0.5977041708940729, 'edge_cap': 0.08485936120941778, 'bull_strategy': 'breakout', 'bull_bb_std_mult': 2.5600004832862853, 'bull_rsi_os': 54, 'bull_rsi_ob': 53, 'bull_adx_thresh': 7.532078082543939, 'bull_atr_min_pct': 0.02607074621949958, 'bull_atr_max_pct': 0.13725542121782958, 'bull_tp_mult': 2.3528959856873035, 'bull_tsl_mult': 0.3155508721927636, 'bull_time_stop': 126, 'bull_use_sma': True, 'bull_use_ema': True, 'bull_use_atr': False, 'bull_use_adx': True, 'bull_use_spike': True, 'bull_rsi_required': True, 'bear_strategy': 'mean_reversion', 'bear_bb_std_mult': 1.3515573572808677, 'bear_rsi_os': 44, 'bear_rsi_ob': 46, 'bear_adx_thresh': 29.673781527560607, 'bear_atr_min_pct': 0.005713332492820471, 'bear_atr_max_pct': 0.044157035972859957, 'bear_tp_mult': 1.7063938738957034, 'bear_tsl_mult': 0.4650646611856636, 'bear_time_stop': 13, 'bear_use_sma': False, 'bear_use_ema': False, 'bear_use_atr': False, 'bear_use_adx': True, 'bear_use_spike': False, 'bear_rsi_required': True, 'sideways_strategy': 'breakout', 'sideways_bb_std_mult': 0.6523619849854452, 'sideways_rsi_os': 9, 'sideways_rsi_ob': 92, 'sideways_adx_thresh': 32.88626930865921, 'sideways_atr_min_pct': 0.0006289443293185128, 'sideways_atr_max_pct': 0.05776329364809289, 'sideways_tp_mult': 2.4414805492233693, 'sideways_tsl_mult': 0.8687163043533644, 'sideways_time_stop': 199, 'sideways_use_sma': True, 'sideways_use_ema': False, 'sideways_use_atr': False, 'sideways_use_adx': True, 'sideways_use_spike': True, 'sideways_rsi_required': True}.
[I 2025-08-31 03:10:21,825] Trial 814 finished with values: [-1000000000.0, 1000000000.0] and parameters: {'p_sma': 32, 'p_std': 10, 'p_atr': 28, 'p_adx': 22, 'rsi_period': 14, 'ema1': 5, 'ema2': 35, 'slip_atr_k': 0.12671896503538518, 'slip_spread_k': 0.18557142672016813, 'spread_hl_frac': 0.02033330129675967, 'bb_std_mult': 1.5546646487487632, 'rsi_os': 22, 'rsi_ob': 54, 'vol_spike': 0.06856928341911077, 'adx_thresh': 30.59753366221409, 'atr_min_pct': 0.005934852600068193, 'atr_max_pct': 0.1139288550926966, 'tp_mult': 1.805374221667357, 'tsl_mult': 0.4612762587479304, 'strategy': 'mean_reversion', 'time_stop': 132, 'use_sma': True, 'use_atr': False, 'use_adx': False, 'use_ema': False, 'use_spike': False, 'rsi_required': True, 'edge_k': 0.46354808562279637, 'edge_cap': 0.12539030365100373, 'bull_strategy': 'mean_reversion', 'bull_bb_std_mult': 2.572547391384177, 'bull_rsi_os': 46, 'bull_rsi_ob': 55, 'bull_adx_thresh': 16.362600979533752, 'bull_atr_min_pct': 0.02623615995797726, 'bull_atr_max_pct': 0.14042488517524124, 'bull_tp_mult': 2.2578644178547203, 'bull_tsl_mult': 0.10323074300629281, 'bull_time_stop': 125, 'bull_use_sma': True, 'bull_use_ema': True, 'bull_use_atr': False, 'bull_use_adx': True, 'bull_use_spike': True, 'bull_rsi_required': True, 'bear_strategy': 'mean_reversion', 'bear_bb_std_mult': 1.337410476759862, 'bear_rsi_os': 35, 'bear_rsi_ob': 45, 'bear_adx_thresh': 21.05409945018397, 'bear_atr_min_pct': 0.019744412688825878, 'bear_atr_max_pct': 0.14975746784012225, 'bear_tp_mult': 1.57922663172563, 'bear_tsl_mult': 0.5276497711228211, 'bear_time_stop': 176, 'bear_use_sma': False, 'bear_use_ema': False, 'bear_use_atr': False, 'bear_use_adx': True, 'bear_use_spike': False, 'bear_rsi_required': True, 'sideways_strategy': 'breakout', 'sideways_bb_std_mult': 3.310134332028066, 'sideways_rsi_os': 35, 'sideways_rsi_ob': 91, 'sideways_adx_thresh': 6.179826272401311, 'sideways_atr_min_pct': 0.029888144318141997, 'sideways_atr_max_pct': 0.05614831435070178, 'sideways_tp_mult': 1.3159766010294933, 'sideways_tsl_mult': 0.706424990333616, 'sideways_time_stop': 46, 'sideways_use_sma': True, 'sideways_use_ema': False, 'sideways_use_atr': False, 'sideways_use_adx': True, 'sideways_use_spike': True, 'sideways_rsi_required': True}.
[I 2025-08-31 03:10:26,502] Trial 818 finished with values: [-1000000000.0, 1000000000.0] and parameters: {'p_sma': 52, 'p_std': 51, 'p_atr': 27, 'p_adx': 11, 'rsi_period': 33, 'ema1': 5, 'ema2': 35, 'slip_atr_k': 0.1271351487692471, 'slip_spread_k': 0.19569681207682788, 'spread_hl_frac': 0.013960193356344741, 'bb_std_mult': 1.6663795359687794, 'rsi_os': 18, 'rsi_ob': 71, 'vol_spike': 0.07255493042736912, 'adx_thresh': 26.088266630108073, 'atr_min_pct': 0.010301174562406888, 'atr_max_pct': 0.11353025175029191, 'tp_mult': 1.9242242855584208, 'tsl_mult': 0.3031839569436917, 'strategy': 'mean_reversion', 'time_stop': 116, 'use_sma': True, 'use_atr': False, 'use_adx': False, 'use_ema': False, 'use_spike': False, 'rsi_required': True, 'edge_k': 0.6158753801905144, 'edge_cap': 0.08726622673761424, 'bull_strategy': 'breakout', 'bull_bb_std_mult': 0.8572907075503997, 'bull_rsi_os': 46, 'bull_rsi_ob': 57, 'bull_adx_thresh': 7.5367260007095105, 'bull_atr_min_pct': 0.00502110384156621, 'bull_atr_max_pct': 0.1434526841639867, 'bull_tp_mult': 2.29753849233621, 'bull_tsl_mult': 0.26336621730156595, 'bull_time_stop': 123, 'bull_use_sma': True, 'bull_use_ema': False, 'bull_use_atr': False, 'bull_use_adx': True, 'bull_use_spike': True, 'bull_rsi_required': True, 'bear_strategy': 'mean_reversion', 'bear_bb_std_mult': 2.147111384338132, 'bear_rsi_os': 15, 'bear_rsi_ob': 57, 'bear_adx_thresh': 5.565128555791277, 'bear_atr_min_pct': 0.00565575439381118, 'bear_atr_max_pct': 0.02036526306572862, 'bear_tp_mult': 2.026062753452325, 'bear_tsl_mult': 0.5223123782740854, 'bear_time_stop': 5, 'bear_use_sma': False, 'bear_use_ema': False, 'bear_use_atr': False, 'bear_use_adx': True, 'bear_use_spike': False, 'bear_rsi_required': True, 'sideways_strategy': 'breakout', 'sideways_bb_std_mult': 1.6995382894569742, 'sideways_rsi_os': 24, 'sideways_rsi_ob': 92, 'sideways_adx_thresh': 32.931231488439366, 'sideways_atr_min_pct': 0.02643647335254107, 'sideways_atr_max_pct': 0.056379178897071204, 'sideways_tp_mult': 1.622069458145754, 'sideways_tsl_mult': 0.051528790041940276, 'sideways_time_stop': 48, 'sideways_use_sma': True, 'sideways_use_ema': False, 'sideways_use_atr': False, 'sideways_use_adx': True, 'sideways_use_spike': True, 'sideways_rsi_required': False}.
