[I 2025-08-31 00:23:08,401] Trial 169 finished with values: [-1000000000.0, 1000000000.0] and parameters: {'p_sma': 11, 'p_std': 35, 'p_atr': 26, 'p_adx': 18, 'rsi_period': 29, 'ema1': 25, 'ema2': 49, 'slip_atr_k': 0.0573543548928422, 'slip_spread_k': 0.8312419504711153, 'spread_hl_frac': 0.012369067612334188, 'bb_std_mult': 0.6493015802277, 'rsi_os': 5, 'rsi_ob': 76, 'vol_spike': 0.26288387764308496, 'adx_thresh': 14.374871763890159, 'atr_min_pct': 0.0007333010709156084, 'atr_max_pct': 0.018090376931113317, 'tp_mult': 2.5550163183195567, 'tsl_mult': 0.2864005559266661, 'strategy': 'breakout', 'time_stop': 46, 'use_sma': False, 'use_atr': True, 'use_adx': False, 'use_ema': False, 'use_spike': True, 'rsi_required': True, 'edge_k': 0.14138769119559635, 'edge_cap': 0.9583672674827132, 'bull_strategy': 'mean_reversion', 'bull_bb_std_mult': 3.2661167068940964, 'bull_rsi_os': 12, 'bull_rsi_ob': 75, 'bull_adx_thresh': 12.575660797793219, 'bull_atr_min_pct': 0.028047359590181287, 'bull_atr_max_pct': 0.09267732066751118, 'bull_tp_mult': 2.295391303622196, 'bull_tsl_mult': 0.2471353713524378, 'bull_time_stop': 141, 'bull_use_sma': True, 'bull_use_ema': True, 'bull_use_atr': True, 'bull_use_adx': False, 'bull_use_spike': True, 'bull_rsi_required': True, 'bear_strategy': 'mean_reversion', 'bear_bb_std_mult': 0.5047465381868332, 'bear_rsi_os': 31, 'bear_rsi_ob': 74, 'bear_adx_thresh': 29.370740912558063, 'bear_atr_min_pct': 0.01258749596545865, 'bear_atr_max_pct': 0.1383166570143756, 'bear_tp_mult': 1.9782200426650907, 'bear_tsl_mult': 0.630778982316357, 'bear_time_stop': 44, 'bear_use_sma': False, 'bear_use_ema': True, 'bear_use_atr': False, 'bear_use_adx': False, 'bear_use_spike': True, 'bear_rsi_required': False, 'sideways_strategy': 'mean_reversion', 'sideways_bb_std_mult': 2.5972888371058804, 'sideways_rsi_os': 48, 'sideways_rsi_ob': 86, 'sideways_adx_thresh': 33.2082557559546, 'sideways_atr_min_pct': 0.020708174792131828, 'sideways_atr_max_pct': 0.0760728264269705, 'sideways_tp_mult': 1.196568375653309, 'sideways_tsl_mult': 0.026254004615309745, 'sideways_time_stop': 276, 'sideways_use_sma': True, 'sideways_use_ema': True, 'sideways_use_atr': True, 'sideways_use_adx': True, 'sideways_use_spike': False, 'sideways_rsi_required': False}.
[I 2025-08-31 00:23:37,700] Trial 174 finished with values: [-0.017367008777039006, 0.01736932684628504] and parameters: {'p_sma': 53, 'p_std': 18, 'p_atr': 28, 'p_adx': 20, 'rsi_period': 80, 'ema1': 18, 'ema2': 21, 'slip_atr_k': 0.07803831952013657, 'slip_spread_k': 0.3797812309367529, 'spread_hl_frac': 0.016508873784309756, 'bb_std_mult': 1.0431235112906811, 'rsi_os': 36, 'rsi_ob': 88, 'vol_spike': 0.23238228708906394, 'adx_thresh': 8.445221084585144, 'atr_min_pct': 0.02769163104316963, 'atr_max_pct': 0.12567657063983428, 'tp_mult': 1.5795948059238198, 'tsl_mult': 0.4337613870487404, 'strategy': 'mean_reversion', 'time_stop': 37, 'use_sma': True, 'use_atr': False, 'use_adx': False, 'use_ema': False, 'use_spike': False, 'rsi_required': False, 'edge_k': 1.231185130025047, 'edge_cap': 0.8984040460892775, 'bull_strategy': 'breakout', 'bull_bb_std_mult': 2.0228036842625947, 'bull_rsi_os': 14, 'bull_rsi_ob': 66, 'bull_adx_thresh': 21.916785259269403, 'bull_atr_min_pct': 5.666734325056477e-05, 'bull_atr_max_pct': 0.06839627243084523, 'bull_tp_mult': 2.3758142573140653, 'bull_tsl_mult': 0.8396194314751435, 'bull_time_stop': 231, 'bull_use_sma': False, 'bull_use_ema': True, 'bull_use_atr': False, 'bull_use_adx': True, 'bull_use_spike': False, 'bull_rsi_required': False, 'bear_strategy': 'breakout', 'bear_bb_std_mult': 0.7194299833034208, 'bear_rsi_os': 53, 'bear_rsi_ob': 58, 'bear_adx_thresh': 26.26953441089864, 'bear_atr_min_pct': 0.019423730623028043, 'bear_atr_max_pct': 0.03920393606970301, 'bear_tp_mult': 2.046966703850567, 'bear_tsl_mult': 0.2392767796920055, 'bear_time_stop': 39, 'bear_use_sma': False, 'bear_use_ema': False, 'bear_use_atr': True, 'bear_use_adx': True, 'bear_use_spike': False, 'bear_rsi_required': True, 'sideways_strategy': 'breakout', 'sideways_bb_std_mult': 1.1481123348967373, 'sideways_rsi_os': 46, 'sideways_rsi_ob': 68, 'sideways_adx_thresh': 10.973957987752433, 'sideways_atr_min_pct': 0.021334718223085664, 'sideways_atr_max_pct': 0.09319569528849617, 'sideways_tp_mult': 2.159425966024851, 'sideways_tsl_mult': 0.09478096738250841, 'sideways_time_stop': 96, 'sideways_use_sma': False, 'sideways_use_ema': False, 'sideways_use_atr': False, 'sideways_use_adx': False, 'sideways_use_spike': True, 'sideways_rsi_required': False}.
[I 2025-08-31 00:23:37,863] Trial 173 finished with values: [-1000000000.0, 1000000000.0] and parameters: {'p_sma': 52, 'p_std': 36, 'p_atr': 16, 'p_adx': 20, 'rsi_period': 37, 'ema1': 20, 'ema2': 46, 'slip_atr_k': 0.04453088393532365, 'slip_spread_k': 0.18560680493313697, 'spread_hl_frac': 0.027916286650404607, 'bb_std_mult': 3.225473670513908, 'rsi_os': 6, 'rsi_ob': 74, 'vol_spike': 0.13819779322252923, 'adx_thresh': 13.414601419729324, 'atr_min_pct': 5.5569510019441715e-05, 'atr_max_pct': 0.13736116740032928, 'tp_mult': 2.248990954345878, 'tsl_mult': 0.2516073775200963, 'strategy': 'mean_reversion', 'time_stop': 37, 'use_sma': True, 'use_atr': False, 'use_adx': False, 'use_ema': False, 'use_spike': False, 'rsi_required': True, 'edge_k': 0.8790490579004524, 'edge_cap': 0.9070053423893996, 'bull_strategy': 'breakout', 'bull_bb_std_mult': 3.310329049724313, 'bull_rsi_os': 39, 'bull_rsi_ob': 54, 'bull_adx_thresh': 12.057231198516249, 'bull_atr_min_pct': 0.012989858071696196, 'bull_atr_max_pct': 0.06867173058947243, 'bull_tp_mult': 2.9182747321100373, 'bull_tsl_mult': 0.838954000347993, 'bull_time_stop': 184, 'bull_use_sma': False, 'bull_use_ema': True, 'bull_use_atr': False, 'bull_use_adx': True, 'bull_use_spike': False, 'bull_rsi_required': False, 'bear_strategy': 'breakout', 'bear_bb_std_mult': 2.6255158014791693, 'bear_rsi_os': 16, 'bear_rsi_ob': 75, 'bear_adx_thresh': 15.37386654279861, 'bear_atr_min_pct': 0.00789198852274584, 'bear_atr_max_pct': 0.06000913702166323, 'bear_tp_mult': 1.967237004907511, 'bear_tsl_mult': 0.7080880801875014, 'bear_time_stop': 37, 'bear_use_sma': False, 'bear_use_ema': False, 'bear_use_atr': True, 'bear_use_adx': False, 'bear_use_spike': False, 'bear_rsi_required': True, 'sideways_strategy': 'breakout', 'sideways_bb_std_mult': 1.1332733224049725, 'sideways_rsi_os': 48, 'sideways_rsi_ob': 68, 'sideways_adx_thresh': 33.10007613255225, 'sideways_atr_min_pct': 0.020445380228482718, 'sideways_atr_max_pct': 0.07121619997576395, 'sideways_tp_mult': 2.563728982771731, 'sideways_tsl_mult': 0.23011246689425235, 'sideways_time_stop': 97, 'sideways_use_sma': True, 'sideways_use_ema': False, 'sideways_use_atr': False, 'sideways_use_adx': False, 'sideways_use_spike': False, 'sideways_rsi_required': False}.
[I 2025-08-31 00:23:38,402] Trial 175 finished with values: [-1000000000.0, 1000000000.0] and parameters: {'p_sma': 52, 'p_std': 18, 'p_atr': 13, 'p_adx': 20, 'rsi_period': 72, 'ema1': 18, 'ema2': 21, 'slip_atr_k': 0.1110818274348678, 'slip_spread_k': 0.44252686741195113, 'spread_hl_frac': 0.027970109429561168, 'bb_std_mult': 3.3825423452180674, 'rsi_os': 44, 'rsi_ob': 88, 'vol_spike': 0.03666145328686411, 'adx_thresh': 13.066725571378441, 'atr_min_pct': 4.981837084296375e-05, 'atr_max_pct': 0.13941779287367498, 'tp_mult': 2.4774704154715574, 'tsl_mult': 0.15040046485796627, 'strategy': 'mean_reversion', 'time_stop': 36, 'use_sma': True, 'use_atr': False, 'use_adx': False, 'use_ema': False, 'use_spike': False, 'rsi_required': False, 'edge_k': 0.7235801794630028, 'edge_cap': 0.9080011040557749, 'bull_strategy': 'breakout', 'bull_bb_std_mult': 2.0115730012516866, 'bull_rsi_os': 39, 'bull_rsi_ob': 94, 'bull_adx_thresh': 21.956757361532546, 'bull_atr_min_pct': 0.01345597437593784, 'bull_atr_max_pct': 0.0941808346390999, 'bull_tp_mult': 2.9380239447909897, 'bull_tsl_mult': 0.29708158480711344, 'bull_time_stop': 5, 'bull_use_sma': False, 'bull_use_ema': True, 'bull_use_atr': False, 'bull_use_adx': True, 'bull_use_spike': False, 'bull_rsi_required': False, 'bear_strategy': 'breakout', 'bear_bb_std_mult': 0.723426964715682, 'bear_rsi_os': 53, 'bear_rsi_ob': 58, 'bear_adx_thresh': 28.562381320596923, 'bear_atr_min_pct': 0.009200369048778011, 'bear_atr_max_pct': 0.13194607025219232, 'bear_tp_mult': 1.186201503228772, 'bear_tsl_mult': 0.7256806235690184, 'bear_time_stop': 39, 'bear_use_sma': False, 'bear_use_ema': False, 'bear_use_atr': True, 'bear_use_adx': True, 'bear_use_spike': False, 'bear_rsi_required': True, 'sideways_strategy': 'breakout', 'sideways_bb_std_mult': 1.1064017131439325, 'sideways_rsi_os': 7, 'sideways_rsi_ob': 67, 'sideways_adx_thresh': 10.9278900575049, 'sideways_atr_min_pct': 0.021323857540371628, 'sideways_atr_max_pct': 0.13466087302194002, 'sideways_tp_mult': 1.0124750555854285, 'sideways_tsl_mult': 0.4488967235057182, 'sideways_time_stop': 228, 'sideways_use_sma': False, 'sideways_use_ema': False, 'sideways_use_atr': False, 'sideways_use_adx': False, 'sideways_use_spike': True, 'sideways_rsi_required': False}.
[I 2025-08-31 00:23:38,403] Trial 172 finished with values: [-1000000000.0, 1000000000.0] and parameters: {'p_sma': 52, 'p_std': 36, 'p_atr': 16, 'p_adx': 7, 'rsi_period': 80, 'ema1': 25, 'ema2': 19, 'slip_atr_k': 0.05689362269515323, 'slip_spread_k': 0.840921329498626, 'spread_hl_frac': 0.0072711868564988985, 'bb_std_mult': 3.3088880456436236, 'rsi_os': 13, 'rsi_ob': 59, 'vol_spike': 0.012448148339564329, 'adx_thresh': 14.913715643159026, 'atr_min_pct': 0.027617511322370444, 'atr_max_pct': 0.07554135598331216, 'tp_mult': 2.712096912358927, 'tsl_mult': 0.2854754580970548, 'strategy': 'mean_reversion', 'time_stop': 28, 'use_sma': False, 'use_atr': False, 'use_adx': False, 'use_ema': False, 'use_spike': False, 'rsi_required': True, 'edge_k': 0.15338100745829586, 'edge_cap': 0.11549089740604462, 'bull_strategy': 'breakout', 'bull_bb_std_mult': 2.013969262537722, 'bull_rsi_os': 12, 'bull_rsi_ob': 71, 'bull_adx_thresh': 30.781389629813887, 'bull_atr_min_pct': 0.028100416840274443, 'bull_atr_max_pct': 0.14242917542322459, 'bull_tp_mult': 2.999006719097819, 'bull_tsl_mult': 0.26516236751687944, 'bull_time_stop': 144, 'bull_use_sma': True, 'bull_use_ema': True, 'bull_use_atr': True, 'bull_use_adx': True, 'bull_use_spike': False, 'bull_rsi_required': True, 'bear_strategy': 'mean_reversion', 'bear_bb_std_mult': 0.7305936697628644, 'bear_rsi_os': 39, 'bear_rsi_ob': 58, 'bear_adx_thresh': 29.62567390993327, 'bear_atr_min_pct': 0.007586888580805607, 'bear_atr_max_pct': 0.02031057522081102, 'bear_tp_mult': 2.0613637498848663, 'bear_tsl_mult': 0.20912756439713473, 'bear_time_stop': 37, 'bear_use_sma': False, 'bear_use_ema': False, 'bear_use_atr': False, 'bear_use_adx': False, 'bear_use_spike': True, 'bear_rsi_required': False, 'sideways_strategy': 'mean_reversion', 'sideways_bb_std_mult': 2.2133000519604322, 'sideways_rsi_os': 48, 'sideways_rsi_ob': 84, 'sideways_adx_thresh': 7.764750233066605, 'sideways_atr_min_pct': 0.007999743962986403, 'sideways_atr_max_pct': 0.13015423630380396, 'sideways_tp_mult': 1.0546270903937265, 'sideways_tsl_mult': 0.09688927925873697, 'sideways_time_stop': 98, 'sideways_use_sma': True, 'sideways_use_ema': True, 'sideways_use_atr': True, 'sideways_use_adx': True, 'sideways_use_spike': False, 'sideways_rsi_required': False}.
[I 2025-08-31 00:23:38,781] Trial 177 finished with values: [-1000000000.0, 1000000000.0] and parameters: {'p_sma': 53, 'p_std': 37, 'p_atr': 21, 'p_adx': 7, 'rsi_period': 70, 'ema1': 27, 'ema2': 21, 'slip_atr_k': 0.22493958514464346, 'slip_spread_k': 0.2860215963758449, 'spread_hl_frac': 0.016728075146173714, 'bb_std_mult': 1.0130538772596749, 'rsi_os': 55, 'rsi_ob': 89, 'vol_spike': 0.23416448446702978, 'adx_thresh': 13.092205023531765, 'atr_min_pct': 1.4038851854882847e-05, 'atr_max_pct': 0.046046746419899504, 'tp_mult': 2.5992228231833483, 'tsl_mult': 0.15651140656183685, 'strategy': 'mean_reversion', 'time_stop': 30, 'use_sma': True, 'use_atr': False, 'use_adx': False, 'use_ema': False, 'use_spike': False, 'rsi_required': False, 'edge_k': 0.7160452716489771, 'edge_cap': 0.9114011996354191, 'bull_strategy': 'breakout', 'bull_bb_std_mult': 2.434321815627039, 'bull_rsi_os': 37, 'bull_rsi_ob': 66, 'bull_adx_thresh': 13.155655392409336, 'bull_atr_min_pct': 0.019771472576223175, 'bull_atr_max_pct': 0.02205061357447833, 'bull_tp_mult': 2.9576056478599853, 'bull_tsl_mult': 0.22006090807391054, 'bull_time_stop': 151, 'bull_use_sma': False, 'bull_use_ema': False, 'bull_use_atr': False, 'bull_use_adx': True, 'bull_use_spike': False, 'bull_rsi_required': False, 'bear_strategy': 'breakout', 'bear_bb_std_mult': 1.5998012605183807, 'bear_rsi_os': 24, 'bear_rsi_ob': 79, 'bear_adx_thresh': 28.567434869370256, 'bear_atr_min_pct': 0.000496296695620067, 'bear_atr_max_pct': 0.0475386031689438, 'bear_tp_mult': 1.1511357313000583, 'bear_tsl_mult': 0.4914694333973929, 'bear_time_stop': 60, 'bear_use_sma': False, 'bear_use_ema': False, 'bear_use_atr': True, 'bear_use_adx': True, 'bear_use_spike': False, 'bear_rsi_required': False, 'sideways_strategy': 'breakout', 'sideways_bb_std_mult': 2.237848904460291, 'sideways_rsi_os': 44, 'sideways_rsi_ob': 59, 'sideways_adx_thresh': 9.896499172679398, 'sideways_atr_min_pct': 0.021312304686124845, 'sideways_atr_max_pct': 0.1296630352648803, 'sideways_tp_mult': 1.1053375769975515, 'sideways_tsl_mult': 0.08175067320556184, 'sideways_time_stop': 298, 'sideways_use_sma': False, 'sideways_use_ema': False, 'sideways_use_atr': False, 'sideways_use_adx': False, 'sideways_use_spike': True, 'sideways_rsi_required': False}.
[I 2025-08-31 00:24:08,294] Trial 179 finished with values: [-1000000000.0, 1000000000.0] and parameters: {'p_sma': 49, 'p_std': 38, 'p_atr': 28, 'p_adx': 8, 'rsi_period': 36, 'ema1': 26, 'ema2': 40, 'slip_atr_k': 0.017378317113069836, 'slip_spread_k': 0.2848720555230663, 'spread_hl_frac': 0.010446297264041036, 'bb_std_mult': 1.6745019803330479, 'rsi_os': 55, 'rsi_ob': 74, 'vol_spike': 0.006786409021393894, 'adx_thresh': 11.861914086798949, 'atr_min_pct': 0.001173539595148215, 'atr_max_pct': 0.13281548772562796, 'tp_mult': 2.60314145506868, 'tsl_mult': 0.10114101212137978, 'strategy': 'breakout', 'time_stop': 118, 'use_sma': True, 'use_atr': False, 'use_adx': True, 'use_ema': False, 'use_spike': False, 'rsi_required': False, 'edge_k': 1.2567943130615875, 'edge_cap': 0.16082069002821786, 'bull_strategy': 'breakout', 'bull_bb_std_mult': 1.9110920372481113, 'bull_rsi_os': 37, 'bull_rsi_ob': 66, 'bull_adx_thresh': 13.13266674531271, 'bull_atr_min_pct': 0.0237795015449169, 'bull_atr_max_pct': 0.082738698617431, 'bull_tp_mult': 2.971600198014411, 'bull_tsl_mult': 0.22494226353533944, 'bull_time_stop': 20, 'bull_use_sma': False, 'bull_use_ema': False, 'bull_use_atr': False, 'bull_use_adx': True, 'bull_use_spike': False, 'bull_rsi_required': False, 'bear_strategy': 'breakout', 'bear_bb_std_mult': 3.3799699907251037, 'bear_rsi_os': 25, 'bear_rsi_ob': 64, 'bear_adx_thresh': 5.073810027001919, 'bear_atr_min_pct': 0.014802424152808788, 'bear_atr_max_pct': 0.03761232198042508, 'bear_tp_mult': 1.0790403071133592, 'bear_tsl_mult': 0.22942322209128144, 'bear_time_stop': 59, 'bear_use_sma': True, 'bear_use_ema': False, 'bear_use_atr': True, 'bear_use_adx': True, 'bear_use_spike': False, 'bear_rsi_required': False, 'sideways_strategy': 'mean_reversion', 'sideways_bb_std_mult': 1.1760567876197974, 'sideways_rsi_os': 46, 'sideways_rsi_ob': 57, 'sideways_adx_thresh': 9.418611164099747, 'sideways_atr_min_pct': 0.019591682991430312, 'sideways_atr_max_pct': 0.09375748468486021, 'sideways_tp_mult': 2.4210592660456864, 'sideways_tsl_mult': 0.8143285325930477, 'sideways_time_stop': 297, 'sideways_use_sma': False, 'sideways_use_ema': False, 'sideways_use_atr': False, 'sideways_use_adx': False, 'sideways_use_spike': True, 'sideways_rsi_required': True}.
[I 2025-08-31 00:24:08,324] Trial 176 finished with values: [-1000000000.0, 1000000000.0] and parameters: {'p_sma': 52, 'p_std': 17, 'p_atr': 17, 'p_adx': 7, 'rsi_period': 38, 'ema1': 26, 'ema2': 21, 'slip_atr_k': 0.07768588918779087, 'slip_spread_k': 0.18346679745179312, 'spread_hl_frac': 0.01626324359837832, 'bb_std_mult': 3.2840001055337855, 'rsi_os': 44, 'rsi_ob': 74, 'vol_spike': 0.011133666489016408, 'adx_thresh': 13.40622748344549, 'atr_min_pct': 4.268058993090144e-05, 'atr_max_pct': 0.08494171196680673, 'tp_mult': 2.614458999182877, 'tsl_mult': 0.15225436158708922, 'strategy': 'mean_reversion', 'time_stop': 28, 'use_sma': True, 'use_atr': False, 'use_adx': False, 'use_ema': False, 'use_spike': False, 'rsi_required': False, 'edge_k': 1.2445078598638009, 'edge_cap': 0.11731792871255825, 'bull_strategy': 'breakout', 'bull_bb_std_mult': 2.0163203402264758, 'bull_rsi_os': 39, 'bull_rsi_ob': 66, 'bull_adx_thresh': 31.016202863015284, 'bull_atr_min_pct': 0.013012340581823663, 'bull_atr_max_pct': 0.09328686840812678, 'bull_tp_mult': 2.9315054582296525, 'bull_tsl_mult': 0.8316877585735285, 'bull_time_stop': 230, 'bull_use_sma': False, 'bull_use_ema': True, 'bull_use_atr': False, 'bull_use_adx': True, 'bull_use_spike': False, 'bull_rsi_required': False, 'bear_strategy': 'breakout', 'bear_bb_std_mult': 1.57630248456545, 'bear_rsi_os': 54, 'bear_rsi_ob': 79, 'bear_adx_thresh': 28.413882647622835, 'bear_atr_min_pct': 0.01477600644766624, 'bear_atr_max_pct': 0.059737642784259214, 'bear_tp_mult': 1.1673806462881224, 'bear_tsl_mult': 0.2228978373303524, 'bear_time_stop': 38, 'bear_use_sma': False, 'bear_use_ema': False, 'bear_use_atr': True, 'bear_use_adx': True, 'bear_use_spike': False, 'bear_rsi_required': True, 'sideways_strategy': 'breakout', 'sideways_bb_std_mult': 2.025139841229449, 'sideways_rsi_os': 46, 'sideways_rsi_ob': 73, 'sideways_adx_thresh': 17.477716251350973, 'sideways_atr_min_pct': 0.026342000951387744, 'sideways_atr_max_pct': 0.09301504175849497, 'sideways_tp_mult': 1.012408697276502, 'sideways_tsl_mult': 0.21969298737743398, 'sideways_time_stop': 96, 'sideways_use_sma': False, 'sideways_use_ema': False, 'sideways_use_atr': False, 'sideways_use_adx': False, 'sideways_use_spike': True, 'sideways_rsi_required': False}.
[I 2025-08-31 00:24:08,583] Trial 178 finished with values: [-1000000000.0, 1000000000.0] and parameters: {'p_sma': 49, 'p_std': 38, 'p_atr': 11, 'p_adx': 24, 'rsi_period': 69, 'ema1': 27, 'ema2': 19, 'slip_atr_k': 0.07799594628505369, 'slip_spread_k': 0.24197702206548027, 'spread_hl_frac': 0.007274048408647673, 'bb_std_mult': 1.0033408982803529, 'rsi_os': 55, 'rsi_ob': 57, 'vol_spike': 0.23163324905803656, 'adx_thresh': 12.024139736381125, 'atr_min_pct': 0.0085511085537902, 'atr_max_pct': 0.12546348956991923, 'tp_mult': 2.600484462082044, 'tsl_mult': 0.06728064918633014, 'strategy': 'breakout', 'time_stop': 30, 'use_sma': True, 'use_atr': False, 'use_adx': True, 'use_ema': False, 'use_spike': False, 'rsi_required': False, 'edge_k': 0.772896805692587, 'edge_cap': 0.8593320209290335, 'bull_strategy': 'breakout', 'bull_bb_std_mult': 2.108674470600082, 'bull_rsi_os': 55, 'bull_rsi_ob': 66, 'bull_adx_thresh': 13.331327187400756, 'bull_atr_min_pct': 0.015311371306984175, 'bull_atr_max_pct': 0.021086035968482054, 'bull_tp_mult': 2.995877107722148, 'bull_tsl_mult': 0.27190661346771877, 'bull_time_stop': 263, 'bull_use_sma': False, 'bull_use_ema': False, 'bull_use_atr': False, 'bull_use_adx': True, 'bull_use_spike': False, 'bull_rsi_required': False, 'bear_strategy': 'breakout', 'bear_bb_std_mult': 1.0494541805055808, 'bear_rsi_os': 24, 'bear_rsi_ob': 76, 'bear_adx_thresh': 31.433519005143637, 'bear_atr_min_pct': 0.00690430404935021, 'bear_atr_max_pct': 0.07468371867723114, 'bear_tp_mult': 2.9282765884769058, 'bear_tsl_mult': 0.23361995929867244, 'bear_time_stop': 59, 'bear_use_sma': False, 'bear_use_ema': False, 'bear_use_atr': True, 'bear_use_adx': True, 'bear_use_spike': False, 'bear_rsi_required': False, 'sideways_strategy': 'mean_reversion', 'sideways_bb_std_mult': 2.2095460839407712, 'sideways_rsi_os': 46, 'sideways_rsi_ob': 58, 'sideways_adx_thresh': 27.551759066556194, 'sideways_atr_min_pct': 0.02174878031169765, 'sideways_atr_max_pct': 0.1096653397660026, 'sideways_tp_mult': 1.070609622105147, 'sideways_tsl_mult': 0.5207932433066945, 'sideways_time_stop': 265, 'sideways_use_sma': False, 'sideways_use_ema': False, 'sideways_use_atr': False, 'sideways_use_adx': False, 'sideways_use_spike': True, 'sideways_rsi_required': False}.
