[I 2025-08-31 02:21:19,631] Trial 470 finished with values: [-1000000000.0, 1000000000.0] and parameters: {'p_sma': 30, 'p_std': 26, 'p_atr': 23, 'p_adx': 9, 'rsi_period': 17, 'ema1': 7, 'ema2': 18, 'slip_atr_k': 0.0004630240122874274, 'slip_spread_k': 0.6683660580158144, 'spread_hl_frac': 0.009862142543641782, 'bb_std_mult': 1.9448133667639684, 'rsi_os': 54, 'rsi_ob': 69, 'vol_spike': 0.18882040631436664, 'adx_thresh': 26.0643786818409, 'atr_min_pct': 0.014598321516507189, 'atr_max_pct': 0.0691142126146069, 'tp_mult': 2.6991584532481445, 'tsl_mult': 0.5717744606834918, 'strategy': 'breakout', 'time_stop': 194, 'use_sma': False, 'use_atr': True, 'use_adx': True, 'use_ema': True, 'use_spike': False, 'rsi_required': True, 'edge_k': 0.5617265493411909, 'edge_cap': 0.620821277915494, 'bull_strategy': 'breakout', 'bull_bb_std_mult': 2.8671786956117034, 'bull_rsi_os': 35, 'bull_rsi_ob': 70, 'bull_adx_thresh': 24.593146571473206, 'bull_atr_min_pct': 0.010949328134846862, 'bull_atr_max_pct': 0.07355625905563692, 'bull_tp_mult': 2.347166987106235, 'bull_tsl_mult': 0.2065999994899118, 'bull_time_stop': 148, 'bull_use_sma': True, 'bull_use_ema': False, 'bull_use_atr': True, 'bull_use_adx': True, 'bull_use_spike': False, 'bull_rsi_required': False, 'bear_strategy': 'breakout', 'bear_bb_std_mult': 3.4901331156099693, 'bear_rsi_os': 33, 'bear_rsi_ob': 77, 'bear_adx_thresh': 8.969445602231568, 'bear_atr_min_pct': 0.011971038247329768, 'bear_atr_max_pct': 0.012619750819709124, 'bear_tp_mult': 1.7585226385430957, 'bear_tsl_mult': 0.6360627526042556, 'bear_time_stop': 40, 'bear_use_sma': True, 'bear_use_ema': False, 'bear_use_atr': False, 'bear_use_adx': True, 'bear_use_spike': True, 'bear_rsi_required': False, 'sideways_strategy': 'mean_reversion', 'sideways_bb_std_mult': 1.4556520678478653, 'sideways_rsi_os': 42, 'sideways_rsi_ob': 89, 'sideways_adx_thresh': 12.943236413581461, 'sideways_atr_min_pct': 0.018315152170939313, 'sideways_atr_max_pct': 0.13718744959217472, 'sideways_tp_mult': 1.0717901230128326, 'sideways_tsl_mult': 0.18920271916094794, 'sideways_time_stop': 163, 'sideways_use_sma': False, 'sideways_use_ema': True, 'sideways_use_atr': True, 'sideways_use_adx': True, 'sideways_use_spike': False, 'sideways_rsi_required': False}.
[I 2025-08-31 02:21:20,050] Trial 471 finished with values: [-1000000000.0, 1000000000.0] and parameters: {'p_sma': 15, 'p_std': 49, 'p_atr': 20, 'p_adx': 30, 'rsi_period': 61, 'ema1': 7, 'ema2': 18, 'slip_atr_k': 0.21657801735722296, 'slip_spread_k': 0.19441239783136388, 'spread_hl_frac': 0.046496977706817814, 'bb_std_mult': 1.7602872760973822, 'rsi_os': 53, 'rsi_ob': 69, 'vol_spike': 0.2174910983958775, 'adx_thresh': 31.660559043771286, 'atr_min_pct': 0.005741969307946744, 'atr_max_pct': 0.10725710026377039, 'tp_mult': 2.692690948273728, 'tsl_mult': 0.5779322355276835, 'strategy': 'breakout', 'time_stop': 229, 'use_sma': False, 'use_atr': True, 'use_adx': True, 'use_ema': True, 'use_spike': False, 'rsi_required': True, 'edge_k': 0.89428677821142, 'edge_cap': 0.8325646757098009, 'bull_strategy': 'breakout', 'bull_bb_std_mult': 2.8840901421321137, 'bull_rsi_os': 55, 'bull_rsi_ob': 58, 'bull_adx_thresh': 19.16623830283597, 'bull_atr_min_pct': 0.020709542465250592, 'bull_atr_max_pct': 0.073400102645473, 'bull_tp_mult': 2.350075517243844, 'bull_tsl_mult': 0.20620251890426441, 'bull_time_stop': 108, 'bull_use_sma': True, 'bull_use_ema': True, 'bull_use_atr': True, 'bull_use_adx': True, 'bull_use_spike': False, 'bull_rsi_required': False, 'bear_strategy': 'breakout', 'bear_bb_std_mult': 0.9054617368048328, 'bear_rsi_os': 55, 'bear_rsi_ob': 88, 'bear_adx_thresh': 9.629047161546305, 'bear_atr_min_pct': 0.012232501304732527, 'bear_atr_max_pct': 0.06912537670635485, 'bear_tp_mult': 1.6915387370993389, 'bear_tsl_mult': 0.2665198627619685, 'bear_time_stop': 40, 'bear_use_sma': True, 'bear_use_ema': False, 'bear_use_atr': False, 'bear_use_adx': True, 'bear_use_spike': True, 'bear_rsi_required': False, 'sideways_strategy': 'mean_reversion', 'sideways_bb_std_mult': 1.2761082581982457, 'sideways_rsi_os': 42, 'sideways_rsi_ob': 61, 'sideways_adx_thresh': 6.282116407448216, 'sideways_atr_min_pct': 0.013109991971765763, 'sideways_atr_max_pct': 0.136802028815412, 'sideways_tp_mult': 1.0602110390822026, 'sideways_tsl_mult': 0.7392346128808426, 'sideways_time_stop': 162, 'sideways_use_sma': False, 'sideways_use_ema': True, 'sideways_use_atr': True, 'sideways_use_adx': True, 'sideways_use_spike': False, 'sideways_rsi_required': False}.
[I 2025-08-31 02:21:20,193] Trial 469 finished with values: [-1000000000.0, 1000000000.0] and parameters: {'p_sma': 49, 'p_std': 42, 'p_atr': 23, 'p_adx': 27, 'rsi_period': 59, 'ema1': 7, 'ema2': 47, 'slip_atr_k': 0.012934028765715963, 'slip_spread_k': 0.056358175129660015, 'spread_hl_frac': 0.006718642351180335, 'bb_std_mult': 1.9490677342695497, 'rsi_os': 53, 'rsi_ob': 69, 'vol_spike': 0.1712562337710683, 'adx_thresh': 13.84396213247036, 'atr_min_pct': 0.019304448257103396, 'atr_max_pct': 0.0424747981860746, 'tp_mult': 1.2022247268363948, 'tsl_mult': 0.16305618812457764, 'strategy': 'breakout', 'time_stop': 85, 'use_sma': False, 'use_atr': True, 'use_adx': True, 'use_ema': True, 'use_spike': False, 'rsi_required': True, 'edge_k': 1.703332676017482, 'edge_cap': 0.6519622055061649, 'bull_strategy': 'breakout', 'bull_bb_std_mult': 1.8810736791782743, 'bull_rsi_os': 34, 'bull_rsi_ob': 70, 'bull_adx_thresh': 12.755743484280565, 'bull_atr_min_pct': 0.028422769563621386, 'bull_atr_max_pct': 0.06572510809801001, 'bull_tp_mult': 2.347327217031419, 'bull_tsl_mult': 0.4009737364857201, 'bull_time_stop': 58, 'bull_use_sma': True, 'bull_use_ema': True, 'bull_use_atr': True, 'bull_use_adx': True, 'bull_use_spike': False, 'bull_rsi_required': False, 'bear_strategy': 'mean_reversion', 'bear_bb_std_mult': 1.5899020989623391, 'bear_rsi_os': 23, 'bear_rsi_ob': 77, 'bear_adx_thresh': 8.965592049825332, 'bear_atr_min_pct': 0.009449861674186858, 'bear_atr_max_pct': 0.02741682730037739, 'bear_tp_mult': 2.1445355600418674, 'bear_tsl_mult': 0.6330858446361171, 'bear_time_stop': 34, 'bear_use_sma': True, 'bear_use_ema': False, 'bear_use_atr': False, 'bear_use_adx': True, 'bear_use_spike': True, 'bear_rsi_required': False, 'sideways_strategy': 'mean_reversion', 'sideways_bb_std_mult': 2.3499419079649084, 'sideways_rsi_os': 45, 'sideways_rsi_ob': 88, 'sideways_adx_thresh': 12.74436779931422, 'sideways_atr_min_pct': 0.007399837180265763, 'sideways_atr_max_pct': 0.14451195362690486, 'sideways_tp_mult': 1.0118907341142411, 'sideways_tsl_mult': 0.6699710209124967, 'sideways_time_stop': 163, 'sideways_use_sma': True, 'sideways_use_ema': True, 'sideways_use_atr': True, 'sideways_use_adx': True, 'sideways_use_spike': False, 'sideways_rsi_required': False}.
[I 2025-08-31 02:21:20,273] Trial 468 finished with values: [-1000000000.0, 1000000000.0] and parameters: {'p_sma': 49, 'p_std': 14, 'p_atr': 29, 'p_adx': 9, 'rsi_period': 59, 'ema1': 29, 'ema2': 18, 'slip_atr_k': 0.08338003613402051, 'slip_spread_k': 0.2560535956257134, 'spread_hl_frac': 0.024786616026904868, 'bb_std_mult': 1.7830074745835225, 'rsi_os': 41, 'rsi_ob': 69, 'vol_spike': 0.1731171124061804, 'adx_thresh': 13.620441672788571, 'atr_min_pct': 0.020116086913562266, 'atr_max_pct': 0.10755709429496987, 'tp_mult': 2.6939801286674263, 'tsl_mult': 0.6198456397645248, 'strategy': 'breakout', 'time_stop': 197, 'use_sma': False, 'use_atr': True, 'use_adx': True, 'use_ema': True, 'use_spike': False, 'rsi_required': False, 'edge_k': 1.0674044956271687, 'edge_cap': 0.8321790743706362, 'bull_strategy': 'breakout', 'bull_bb_std_mult': 1.888626810821791, 'bull_rsi_os': 54, 'bull_rsi_ob': 76, 'bull_adx_thresh': 19.41342833851159, 'bull_atr_min_pct': 0.0282631199044501, 'bull_atr_max_pct': 0.07333049693556092, 'bull_tp_mult': 1.1313073198551398, 'bull_tsl_mult': 0.2577839449345271, 'bull_time_stop': 172, 'bull_use_sma': False, 'bull_use_ema': True, 'bull_use_atr': True, 'bull_use_adx': True, 'bull_use_spike': False, 'bull_rsi_required': False, 'bear_strategy': 'mean_reversion', 'bear_bb_std_mult': 2.799273274595186, 'bear_rsi_os': 55, 'bear_rsi_ob': 85, 'bear_adx_thresh': 7.556313951821566, 'bear_atr_min_pct': 0.009544010982238735, 'bear_atr_max_pct': 0.03638177930784314, 'bear_tp_mult': 2.14255092557099, 'bear_tsl_mult': 0.6479691323330966, 'bear_time_stop': 47, 'bear_use_sma': True, 'bear_use_ema': False, 'bear_use_atr': False, 'bear_use_adx': True, 'bear_use_spike': True, 'bear_rsi_required': False, 'sideways_strategy': 'mean_reversion', 'sideways_bb_std_mult': 1.1954988201380627, 'sideways_rsi_os': 39, 'sideways_rsi_ob': 88, 'sideways_adx_thresh': 12.779012486065849, 'sideways_atr_min_pct': 0.002618658543503313, 'sideways_atr_max_pct': 0.13669447296167256, 'sideways_tp_mult': 1.0116015512852528, 'sideways_tsl_mult': 0.7346528449141124, 'sideways_time_stop': 164, 'sideways_use_sma': True, 'sideways_use_ema': True, 'sideways_use_atr': True, 'sideways_use_adx': True, 'sideways_use_spike': False, 'sideways_rsi_required': False}.
[I 2025-08-31 02:21:51,916] Trial 473 finished with values: [-1000000000.0, 1000000000.0] and parameters: {'p_sma': 49, 'p_std': 37, 'p_atr': 26, 'p_adx': 17, 'rsi_period': 59, 'ema1': 7, 'ema2': 24, 'slip_atr_k': 0.039050662536851743, 'slip_spread_k': 0.24999577391607686, 'spread_hl_frac': 0.01313453222321824, 'bb_std_mult': 1.776570233463458, 'rsi_os': 41, 'rsi_ob': 83, 'vol_spike': 0.15513046315092469, 'adx_thresh': 13.048388955477165, 'atr_min_pct': 0.0024950966782182823, 'atr_max_pct': 0.042863172268709254, 'tp_mult': 2.7496196205158894, 'tsl_mult': 0.10894137832194328, 'strategy': 'breakout', 'time_stop': 86, 'use_sma': True, 'use_atr': False, 'use_adx': False, 'use_ema': False, 'use_spike': False, 'rsi_required': False, 'edge_k': 1.7113990764519134, 'edge_cap': 0.8596499526085152, 'bull_strategy': 'breakout', 'bull_bb_std_mult': 2.7665759781657293, 'bull_rsi_os': 46, 'bull_rsi_ob': 71, 'bull_adx_thresh': 13.016809789461881, 'bull_atr_min_pct': 0.014900038382468991, 'bull_atr_max_pct': 0.07720183792094522, 'bull_tp_mult': 2.458595017145302, 'bull_tsl_mult': 0.402739055019993, 'bull_time_stop': 284, 'bull_use_sma': False, 'bull_use_ema': False, 'bull_use_atr': False, 'bull_use_adx': False, 'bull_use_spike': False, 'bull_rsi_required': False, 'bear_strategy': 'mean_reversion', 'bear_bb_std_mult': 2.816217932214182, 'bear_rsi_os': 29, 'bear_rsi_ob': 79, 'bear_adx_thresh': 26.0079714355658, 'bear_atr_min_pct': 0.009909996763617855, 'bear_atr_max_pct': 0.09273458731231149, 'bear_tp_mult': 2.1924148557696985, 'bear_tsl_mult': 0.6627997992741014, 'bear_time_stop': 229, 'bear_use_sma': False, 'bear_use_ema': False, 'bear_use_atr': False, 'bear_use_adx': True, 'bear_use_spike': False, 'bear_rsi_required': False, 'sideways_strategy': 'mean_reversion', 'sideways_bb_std_mult': 1.0413289217318638, 'sideways_rsi_os': 45, 'sideways_rsi_ob': 88, 'sideways_adx_thresh': 12.572897789406962, 'sideways_atr_min_pct': 0.02317707402392853, 'sideways_atr_max_pct': 0.014264101525267872, 'sideways_tp_mult': 2.3839997859134523, 'sideways_tsl_mult': 0.1357622893876464, 'sideways_time_stop': 24, 'sideways_use_sma': True, 'sideways_use_ema': False, 'sideways_use_atr': False, 'sideways_use_adx': False, 'sideways_use_spike': True, 'sideways_rsi_required': True}.
[I 2025-08-31 02:21:52,430] Trial 472 finished with values: [-1000000000.0, 1000000000.0] and parameters: {'p_sma': 13, 'p_std': 41, 'p_atr': 18, 'p_adx': 7, 'rsi_period': 61, 'ema1': 7, 'ema2': 35, 'slip_atr_k': 0.02196675969104145, 'slip_spread_k': 0.4439895502990569, 'spread_hl_frac': 0.04621377084416061, 'bb_std_mult': 1.7689714916077217, 'rsi_os': 53, 'rsi_ob': 71, 'vol_spike': 0.15415894724060097, 'adx_thresh': 12.998291121282405, 'atr_min_pct': 0.004649344086745835, 'atr_max_pct': 0.06204536693357259, 'tp_mult': 2.2019673879775112, 'tsl_mult': 0.11184084330819069, 'strategy': 'breakout', 'time_stop': 87, 'use_sma': True, 'use_atr': True, 'use_adx': False, 'use_ema': True, 'use_spike': False, 'rsi_required': False, 'edge_k': 0.8884179418302557, 'edge_cap': 0.8268094791484027, 'bull_strategy': 'breakout', 'bull_bb_std_mult': 2.7612026112448524, 'bull_rsi_os': 38, 'bull_rsi_ob': 70, 'bull_adx_thresh': 15.49497929519484, 'bull_atr_min_pct': 3.102003279819047e-05, 'bull_atr_max_pct': 0.07646828775926881, 'bull_tp_mult': 2.0770945628498363, 'bull_tsl_mult': 0.24660045951468762, 'bull_time_stop': 107, 'bull_use_sma': True, 'bull_use_ema': True, 'bull_use_atr': True, 'bull_use_adx': True, 'bull_use_spike': False, 'bull_rsi_required': False, 'bear_strategy': 'mean_reversion', 'bear_bb_std_mult': 0.9228549401729087, 'bear_rsi_os': 23, 'bear_rsi_ob': 49, 'bear_adx_thresh': 7.176960126772226, 'bear_atr_min_pct': 0.009673464508827933, 'bear_atr_max_pct': 0.054655459880769794, 'bear_tp_mult': 1.9701063137063832, 'bear_tsl_mult': 0.26409476600251924, 'bear_time_stop': 160, 'bear_use_sma': True, 'bear_use_ema': False, 'bear_use_atr': False, 'bear_use_adx': True, 'bear_use_spike': True, 'bear_rsi_required': False, 'sideways_strategy': 'mean_reversion', 'sideways_bb_std_mult': 1.998480379503853, 'sideways_rsi_os': 45, 'sideways_rsi_ob': 88, 'sideways_adx_thresh': 12.711860899768245, 'sideways_atr_min_pct': 0.005220506464612499, 'sideways_atr_max_pct': 0.14597698159139888, 'sideways_tp_mult': 1.1583574168353716, 'sideways_tsl_mult': 0.6824173489745582, 'sideways_time_stop': 180, 'sideways_use_sma': True, 'sideways_use_ema': False, 'sideways_use_atr': True, 'sideways_use_adx': False, 'sideways_use_spike': False, 'sideways_rsi_required': False}.
[I 2025-08-31 02:21:53,388] Trial 474 finished with values: [-1000000000.0, 1000000000.0] and parameters: {'p_sma': 24, 'p_std': 57, 'p_atr': 25, 'p_adx': 22, 'rsi_period': 62, 'ema1': 15, 'ema2': 20, 'slip_atr_k': 0.023023372171159004, 'slip_spread_k': 0.6118690474546452, 'spread_hl_frac': 0.013076877559461193, 'bb_std_mult': 1.7689550629596902, 'rsi_os': 29, 'rsi_ob': 71, 'vol_spike': 0.2981749798806105, 'adx_thresh': 13.05646742025806, 'atr_min_pct': 0.010301545639753657, 'atr_max_pct': 0.06127354219003673, 'tp_mult': 2.752663751255009, 'tsl_mult': 0.9950513163808437, 'strategy': 'breakout', 'time_stop': 171, 'use_sma': True, 'use_atr': False, 'use_adx': False, 'use_ema': False, 'use_spike': False, 'rsi_required': False, 'edge_k': 0.3692076021898766, 'edge_cap': 0.8594746659660604, 'bull_strategy': 'breakout', 'bull_bb_std_mult': 2.765406303919773, 'bull_rsi_os': 38, 'bull_rsi_ob': 46, 'bull_adx_thresh': 6.919780857202149, 'bull_atr_min_pct': 5.789841541857174e-05, 'bull_atr_max_pct': 0.12456575432745412, 'bull_tp_mult': 2.4535998074501824, 'bull_tsl_mult': 0.17701693360260762, 'bull_time_stop': 228, 'bull_use_sma': False, 'bull_use_ema': False, 'bull_use_atr': False, 'bull_use_adx': False, 'bull_use_spike': True, 'bull_rsi_required': False, 'bear_strategy': 'mean_reversion', 'bear_bb_std_mult': 1.2258628462901746, 'bear_rsi_os': 29, 'bear_rsi_ob': 45, 'bear_adx_thresh': 7.077266166128195, 'bear_atr_min_pct': 0.008545313103465044, 'bear_atr_max_pct': 0.0796651729605301, 'bear_tp_mult': 2.2252071953375605, 'bear_tsl_mult': 0.8075799627578867, 'bear_time_stop': 17, 'bear_use_sma': False, 'bear_use_ema': False, 'bear_use_atr': False, 'bear_use_adx': True, 'bear_use_spike': False, 'bear_rsi_required': False, 'sideways_strategy': 'mean_reversion', 'sideways_bb_std_mult': 1.028574247978303, 'sideways_rsi_os': 46, 'sideways_rsi_ob': 91, 'sideways_adx_thresh': 5.009568672912506, 'sideways_atr_min_pct': 0.029839995662716324, 'sideways_atr_max_pct': 0.14654513973640548, 'sideways_tp_mult': 1.158211553647664, 'sideways_tsl_mult': 0.6831174876006486, 'sideways_time_stop': 182, 'sideways_use_sma': True, 'sideways_use_ema': False, 'sideways_use_atr': False, 'sideways_use_adx': False, 'sideways_use_spike': True, 'sideways_rsi_required': True}.
[I 2025-08-31 02:21:53,500] Trial 475 finished with values: [-1000000000.0, 1000000000.0] and parameters: {'p_sma': 11, 'p_std': 41, 'p_atr': 25, 'p_adx': 13, 'rsi_period': 38, 'ema1': 15, 'ema2': 20, 'slip_atr_k': 0.024773383667632192, 'slip_spread_k': 0.6031176462287096, 'spread_hl_frac': 0.01282234689624248, 'bb_std_mult': 1.7474513017908302, 'rsi_os': 29, 'rsi_ob': 71, 'vol_spike': 0.1999398342280985, 'adx_thresh': 12.507053861341795, 'atr_min_pct': 0.007741028451283619, 'atr_max_pct': 0.11610207986530366, 'tp_mult': 2.7573561035956087, 'tsl_mult': 0.10799181986063609, 'strategy': 'breakout', 'time_stop': 93, 'use_sma': True, 'use_atr': False, 'use_adx': False, 'use_ema': False, 'use_spike': False, 'rsi_required': False, 'edge_k': 0.38440154224068523, 'edge_cap': 0.8684475718337406, 'bull_strategy': 'breakout', 'bull_bb_std_mult': 2.017168367979363, 'bull_rsi_os': 38, 'bull_rsi_ob': 68, 'bull_adx_thresh': 7.482189524824083, 'bull_atr_min_pct': 0.0025042188432924635, 'bull_atr_max_pct': 0.13011844539720147, 'bull_tp_mult': 2.4038944581499746, 'bull_tsl_mult': 0.2877396102515679, 'bull_time_stop': 33, 'bull_use_sma': False, 'bull_use_ema': False, 'bull_use_atr': False, 'bull_use_adx': False, 'bull_use_spike': True, 'bull_rsi_required': False, 'bear_strategy': 'mean_reversion', 'bear_bb_std_mult': 1.2127578337857616, 'bear_rsi_os': 21, 'bear_rsi_ob': 80, 'bear_adx_thresh': 6.855445849731095, 'bear_atr_min_pct': 0.008491021434071204, 'bear_atr_max_pct': 0.07903599270733619, 'bear_tp_mult': 2.3114172900173124, 'bear_tsl_mult': 0.8054782156751621, 'bear_time_stop': 33, 'bear_use_sma': False, 'bear_use_ema': False, 'bear_use_atr': False, 'bear_use_adx': True, 'bear_use_spike': False, 'bear_rsi_required': False, 'sideways_strategy': 'mean_reversion', 'sideways_bb_std_mult': 3.1589815882258514, 'sideways_rsi_os': 46, 'sideways_rsi_ob': 58, 'sideways_adx_thresh': 13.985201706336484, 'sideways_atr_min_pct': 0.021450817458878575, 'sideways_atr_max_pct': 0.08962991108291528, 'sideways_tp_mult': 1.124452764489408, 'sideways_tsl_mult': 0.7766432953019491, 'sideways_time_stop': 26, 'sideways_use_sma': True, 'sideways_use_ema': False, 'sideways_use_atr': False, 'sideways_use_adx': False, 'sideways_use_spike': True, 'sideways_rsi_required': True}.
[I 2025-08-31 02:22:26,057] Trial 476 finished with values: [-0.015196614467564595, 0.015174455756693128] and parameters: {'p_sma': 51, 'p_std': 41, 'p_atr': 25, 'p_adx': 26, 'rsi_period': 62, 'ema1': 6, 'ema2': 20, 'slip_atr_k': 0.022583952237515123, 'slip_spread_k': 0.22617807949852844, 'spread_hl_frac': 0.008368164675198336, 'bb_std_mult': 1.8358345427616372, 'rsi_os': 37, 'rsi_ob': 71, 'vol_spike': 0.18564010564396155, 'adx_thresh': 20.92343012072011, 'atr_min_pct': 0.007725762384982745, 'atr_max_pct': 0.11627217589339274, 'tp_mult': 1.0329579349360802, 'tsl_mult': 0.1102332709270696, 'strategy': 'breakout', 'time_stop': 92, 'use_sma': True, 'use_atr': False, 'use_adx': False, 'use_ema': False, 'use_spike': False, 'rsi_required': False, 'edge_k': 0.6219665160339866, 'edge_cap': 0.10219111094871758, 'bull_strategy': 'breakout', 'bull_bb_std_mult': 2.7478534965503973, 'bull_rsi_os': 38, 'bull_rsi_ob': 70, 'bull_adx_thresh': 6.647706553526387, 'bull_atr_min_pct': 0.0004293153705126296, 'bull_atr_max_pct': 0.13903341099560879, 'bull_tp_mult': 2.404665146398257, 'bull_tsl_mult': 0.28488437760837804, 'bull_time_stop': 161, 'bull_use_sma': False, 'bull_use_ema': False, 'bull_use_atr': False, 'bull_use_adx': True, 'bull_use_spike': True, 'bull_rsi_required': True, 'bear_strategy': 'mean_reversion', 'bear_bb_std_mult': 1.2628042019648644, 'bear_rsi_os': 21, 'bear_rsi_ob': 45, 'bear_adx_thresh': 7.078224739661346, 'bear_atr_min_pct': 0.008156927060034654, 'bear_atr_max_pct': 0.0101721789174707, 'bear_tp_mult': 1.961769397420339, 'bear_tsl_mult': 0.7029854738583476, 'bear_time_stop': 20, 'bear_use_sma': False, 'bear_use_ema': False, 'bear_use_atr': False, 'bear_use_adx': True, 'bear_use_spike': False, 'bear_rsi_required': True, 'sideways_strategy': 'mean_reversion', 'sideways_bb_std_mult': 0.6134192735968433, 'sideways_rsi_os': 43, 'sideways_rsi_ob': 92, 'sideways_adx_thresh': 11.483467422053032, 'sideways_atr_min_pct': 0.021382143839570517, 'sideways_atr_max_pct': 0.04966984662369929, 'sideways_tp_mult': 1.8443454859117998, 'sideways_tsl_mult': 0.6786081014308164, 'sideways_time_stop': 180, 'sideways_use_sma': True, 'sideways_use_ema': False, 'sideways_use_atr': False, 'sideways_use_adx': False, 'sideways_use_spike': True, 'sideways_rsi_required': False}.
