[I 2025-08-31 03:16:46,093] Trial 863 finished with values: [-1000000000.0, 1000000000.0] and parameters: {'p_sma': 51, 'p_std': 53, 'p_atr': 28, 'p_adx': 29, 'rsi_period': 16, 'ema1': 6, 'ema2': 16, 'slip_atr_k': 0.018936074388713767, 'slip_spread_k': 0.9805136062146316, 'spread_hl_frac': 0.0010647671206456245, 'bb_std_mult': 1.6202985567729165, 'rsi_os': 16, 'rsi_ob': 54, 'vol_spike': 0.05396578378832352, 'adx_thresh': 19.76796101356494, 'atr_min_pct': 0.007594954513511126, 'atr_max_pct': 0.04170989779199499, 'tp_mult': 1.3391703817628768, 'tsl_mult': 0.40633150255251843, 'strategy': 'mean_reversion', 'time_stop': 99, 'use_sma': False, 'use_atr': False, 'use_adx': True, 'use_ema': False, 'use_spike': False, 'rsi_required': True, 'edge_k': 0.4703712715111473, 'edge_cap': 0.5760080354037901, 'bull_strategy': 'mean_reversion', 'bull_bb_std_mult': 1.4864779531144705, 'bull_rsi_os': 45, 'bull_rsi_ob': 77, 'bull_adx_thresh': 25.456202793039395, 'bull_atr_min_pct': 0.020490668047729255, 'bull_atr_max_pct': 0.11303894042113886, 'bull_tp_mult': 2.0754195514721117, 'bull_tsl_mult': 0.00123220764501486, 'bull_time_stop': 121, 'bull_use_sma': True, 'bull_use_ema': False, 'bull_use_atr': False, 'bull_use_adx': False, 'bull_use_spike': True, 'bull_rsi_required': False, 'bear_strategy': 'mean_reversion', 'bear_bb_std_mult': 3.104524655985419, 'bear_rsi_os': 47, 'bear_rsi_ob': 46, 'bear_adx_thresh': 26.1727760033209, 'bear_atr_min_pct': 0.006528427022505846, 'bear_atr_max_pct': 0.010174416210753713, 'bear_tp_mult': 1.2317381668281309, 'bear_tsl_mult': 0.4898211902811714, 'bear_time_stop': 224, 'bear_use_sma': False, 'bear_use_ema': False, 'bear_use_atr': False, 'bear_use_adx': False, 'bear_use_spike': False, 'bear_rsi_required': True, 'sideways_strategy': 'breakout', 'sideways_bb_std_mult': 0.6090799308448821, 'sideways_rsi_os': 39, 'sideways_rsi_ob': 51, 'sideways_adx_thresh': 9.26494782573413, 'sideways_atr_min_pct': 0.02706158230289873, 'sideways_atr_max_pct': 0.014371814472736374, 'sideways_tp_mult': 1.6717097016864655, 'sideways_tsl_mult': 0.6438834135508684, 'sideways_time_stop': 188, 'sideways_use_sma': True, 'sideways_use_ema': False, 'sideways_use_atr': False, 'sideways_use_adx': True, 'sideways_use_spike': True, 'sideways_rsi_required': False}.
[I 2025-08-31 03:16:46,170] Trial 864 finished with values: [-1000000000.0, 1000000000.0] and parameters: {'p_sma': 52, 'p_std': 50, 'p_atr': 28, 'p_adx': 18, 'rsi_period': 39, 'ema1': 6, 'ema2': 56, 'slip_atr_k': 0.2380146006243872, 'slip_spread_k': 0.13672847950055295, 'spread_hl_frac': 0.0023012231183900857, 'bb_std_mult': 1.6092431809270105, 'rsi_os': 39, 'rsi_ob': 70, 'vol_spike': 0.05462335150534951, 'adx_thresh': 19.030832344300286, 'atr_min_pct': 0.010108294270441359, 'atr_max_pct': 0.08249809370871596, 'tp_mult': 2.9488613805659645, 'tsl_mult': 0.0022441737929915218, 'strategy': 'mean_reversion', 'time_stop': 261, 'use_sma': False, 'use_atr': False, 'use_adx': True, 'use_ema': False, 'use_spike': False, 'rsi_required': False, 'edge_k': 0.6147552666499279, 'edge_cap': 0.7228467378879203, 'bull_strategy': 'mean_reversion', 'bull_bb_std_mult': 3.0807571682976205, 'bull_rsi_os': 47, 'bull_rsi_ob': 95, 'bull_adx_thresh': 7.270895411131589, 'bull_atr_min_pct': 0.013939922609780178, 'bull_atr_max_pct': 0.1121667592380428, 'bull_tp_mult': 2.105830969299529, 'bull_tsl_mult': 0.6013909468242402, 'bull_time_stop': 124, 'bull_use_sma': True, 'bull_use_ema': False, 'bull_use_atr': False, 'bull_use_adx': True, 'bull_use_spike': True, 'bull_rsi_required': False, 'bear_strategy': 'mean_reversion', 'bear_bb_std_mult': 1.2549475276697546, 'bear_rsi_os': 16, 'bear_rsi_ob': 59, 'bear_adx_thresh': 5.5649991202315645, 'bear_atr_min_pct': 0.007848764363028251, 'bear_atr_max_pct': 0.010016077084325975, 'bear_tp_mult': 2.0408246367954397, 'bear_tsl_mult': 0.48414907928019235, 'bear_time_stop': 225, 'bear_use_sma': False, 'bear_use_ema': False, 'bear_use_atr': False, 'bear_use_adx': False, 'bear_use_spike': False, 'bear_rsi_required': True, 'sideways_strategy': 'breakout', 'sideways_bb_std_mult': 1.7528624890325817, 'sideways_rsi_os': 39, 'sideways_rsi_ob': 51, 'sideways_adx_thresh': 8.366429487649055, 'sideways_atr_min_pct': 0.02717161990068758, 'sideways_atr_max_pct': 0.06130428889302188, 'sideways_tp_mult': 1.7570557062078498, 'sideways_tsl_mult': 0.38296019820355565, 'sideways_time_stop': 205, 'sideways_use_sma': True, 'sideways_use_ema': False, 'sideways_use_atr': False, 'sideways_use_adx': True, 'sideways_use_spike': True, 'sideways_rsi_required': False}.
[I 2025-08-31 03:16:47,098] Trial 868 finished with values: [-1000000000.0, 1000000000.0] and parameters: {'p_sma': 24, 'p_std': 56, 'p_atr': 29, 'p_adx': 15, 'rsi_period': 64, 'ema1': 13, 'ema2': 23, 'slip_atr_k': 0.12282867782980457, 'slip_spread_k': 0.1883986306951891, 'spread_hl_frac': 0.0022997168302848568, 'bb_std_mult': 1.62975759638527, 'rsi_os': 23, 'rsi_ob': 86, 'vol_spike': 0.19953976826246728, 'adx_thresh': 18.940356168630068, 'atr_min_pct': 0.02871278419735736, 'atr_max_pct': 0.01697269679765774, 'tp_mult': 1.1454615988187729, 'tsl_mult': 0.8647343279381184, 'strategy': 'breakout', 'time_stop': 152, 'use_sma': True, 'use_atr': False, 'use_adx': False, 'use_ema': False, 'use_spike': False, 'rsi_required': False, 'edge_k': 0.6631852445908727, 'edge_cap': 0.7171615035898173, 'bull_strategy': 'breakout', 'bull_bb_std_mult': 0.7706501659298668, 'bull_rsi_os': 50, 'bull_rsi_ob': 49, 'bull_adx_thresh': 5.551367821172779, 'bull_atr_min_pct': 0.009121129136867582, 'bull_atr_max_pct': 0.1384848861506935, 'bull_tp_mult': 2.414400995005039, 'bull_tsl_mult': 0.07159584012549042, 'bull_time_stop': 131, 'bull_use_sma': True, 'bull_use_ema': True, 'bull_use_atr': False, 'bull_use_adx': True, 'bull_use_spike': True, 'bull_rsi_required': True, 'bear_strategy': 'mean_reversion', 'bear_bb_std_mult': 1.2353043183444818, 'bear_rsi_os': 29, 'bear_rsi_ob': 69, 'bear_adx_thresh': 12.387972551830934, 'bear_atr_min_pct': 0.005280901152380083, 'bear_atr_max_pct': 0.07944026476485697, 'bear_tp_mult': 2.0024289570310354, 'bear_tsl_mult': 0.8845557811159483, 'bear_time_stop': 5, 'bear_use_sma': True, 'bear_use_ema': False, 'bear_use_atr': False, 'bear_use_adx': True, 'bear_use_spike': False, 'bear_rsi_required': False, 'sideways_strategy': 'breakout', 'sideways_bb_std_mult': 2.7467437017711167, 'sideways_rsi_os': 39, 'sideways_rsi_ob': 95, 'sideways_adx_thresh': 8.64974087951669, 'sideways_atr_min_pct': 0.012174404110015063, 'sideways_atr_max_pct': 0.049489540087347524, 'sideways_tp_mult': 2.0982914625096845, 'sideways_tsl_mult': 0.6747923654074401, 'sideways_time_stop': 220, 'sideways_use_sma': True, 'sideways_use_ema': True, 'sideways_use_atr': True, 'sideways_use_adx': False, 'sideways_use_spike': True, 'sideways_rsi_required': True}.
[I 2025-08-31 03:17:18,219] Trial 869 finished with values: [-0.06149201016616057, 0.061426250035733945] and parameters: {'p_sma': 57, 'p_std': 26, 'p_atr': 10, 'p_adx': 28, 'rsi_period': 82, 'ema1': 6, 'ema2': 11, 'slip_atr_k': 0.15253015974101472, 'slip_spread_k': 0.8091588063657549, 'spread_hl_frac': 0.003891828472714722, 'bb_std_mult': 2.874523059561791, 'rsi_os': 37, 'rsi_ob': 71, 'vol_spike': 0.19804648550336001, 'adx_thresh': 21.575734745378565, 'atr_min_pct': 0.009106609585113985, 'atr_max_pct': 0.05312260481929815, 'tp_mult': 2.231685167485695, 'tsl_mult': 0.7500240898282606, 'strategy': 'breakout', 'time_stop': 294, 'use_sma': True, 'use_atr': False, 'use_adx': False, 'use_ema': False, 'use_spike': False, 'rsi_required': True, 'edge_k': 1.6772942453818749, 'edge_cap': 0.08316627770843542, 'bull_strategy': 'breakout', 'bull_bb_std_mult': 2.1998769745831197, 'bull_rsi_os': 26, 'bull_rsi_ob': 57, 'bull_adx_thresh': 5.551436619674621, 'bull_atr_min_pct': 0.025438873074486747, 'bull_atr_max_pct': 0.13864099597562773, 'bull_tp_mult': 1.330403447678823, 'bull_tsl_mult': 0.557493800817758, 'bull_time_stop': 133, 'bull_use_sma': True, 'bull_use_ema': True, 'bull_use_atr': False, 'bull_use_adx': True, 'bull_use_spike': True, 'bull_rsi_required': True, 'bear_strategy': 'breakout', 'bear_bb_std_mult': 1.150663338483973, 'bear_rsi_os': 15, 'bear_rsi_ob': 48, 'bear_adx_thresh': 12.315319167845926, 'bear_atr_min_pct': 0.016222794249492082, 'bear_atr_max_pct': 0.051748911096424904, 'bear_tp_mult': 2.540981912823785, 'bear_tsl_mult': 0.5744443130341194, 'bear_time_stop': 147, 'bear_use_sma': True, 'bear_use_ema': False, 'bear_use_atr': True, 'bear_use_adx': True, 'bear_use_spike': False, 'bear_rsi_required': False, 'sideways_strategy': 'breakout', 'sideways_bb_std_mult': 2.338150809399353, 'sideways_rsi_os': 43, 'sideways_rsi_ob': 71, 'sideways_adx_thresh': 23.648805890015314, 'sideways_atr_min_pct': 1.6336638425703404e-06, 'sideways_atr_max_pct': 0.048556514917686845, 'sideways_tp_mult': 1.2947434440763161, 'sideways_tsl_mult': 0.6842923859912875, 'sideways_time_stop': 219, 'sideways_use_sma': True, 'sideways_use_ema': True, 'sideways_use_atr': True, 'sideways_use_adx': False, 'sideways_use_spike': False, 'sideways_rsi_required': True}.
[I 2025-08-31 03:17:18,456] Trial 866 finished with values: [-1000000000.0, 1000000000.0] and parameters: {'p_sma': 55, 'p_std': 56, 'p_atr': 18, 'p_adx': 22, 'rsi_period': 78, 'ema1': 6, 'ema2': 56, 'slip_atr_k': 0.12358170943226895, 'slip_spread_k': 0.18767184968016945, 'spread_hl_frac': 0.03770081397223226, 'bb_std_mult': 1.9177212211410963, 'rsi_os': 39, 'rsi_ob': 67, 'vol_spike': 0.2418338758506844, 'adx_thresh': 27.10912220702457, 'atr_min_pct': 0.007550324953028102, 'atr_max_pct': 0.04370573621243572, 'tp_mult': 1.85456155574245, 'tsl_mult': 0.47884290280212055, 'strategy': 'breakout', 'time_stop': 262, 'use_sma': False, 'use_atr': False, 'use_adx': True, 'use_ema': False, 'use_spike': False, 'rsi_required': True, 'edge_k': 0.48807220207506374, 'edge_cap': 0.6155078376721009, 'bull_strategy': 'mean_reversion', 'bull_bb_std_mult': 2.5404179485551124, 'bull_rsi_os': 45, 'bull_rsi_ob': 61, 'bull_adx_thresh': 5.542267087580521, 'bull_atr_min_pct': 0.022785475161850016, 'bull_atr_max_pct': 0.1376469363306566, 'bull_tp_mult': 2.398942529760983, 'bull_tsl_mult': 0.5550645196978437, 'bull_time_stop': 132, 'bull_use_sma': True, 'bull_use_ema': True, 'bull_use_atr': False, 'bull_use_adx': True, 'bull_use_spike': True, 'bull_rsi_required': False, 'bear_strategy': 'mean_reversion', 'bear_bb_std_mult': 0.7475394927586563, 'bear_rsi_os': 47, 'bear_rsi_ob': 69, 'bear_adx_thresh': 10.01063949281323, 'bear_atr_min_pct': 0.0053778207455017265, 'bear_atr_max_pct': 0.012428233713754192, 'bear_tp_mult': 2.041973701914046, 'bear_tsl_mult': 0.4158602766826206, 'bear_time_stop': 224, 'bear_use_sma': True, 'bear_use_ema': False, 'bear_use_atr': False, 'bear_use_adx': False, 'bear_use_spike': False, 'bear_rsi_required': False, 'sideways_strategy': 'breakout', 'sideways_bb_std_mult': 0.6198554866183882, 'sideways_rsi_os': 39, 'sideways_rsi_ob': 93, 'sideways_adx_thresh': 30.105018253323653, 'sideways_atr_min_pct': 0.027364141556618274, 'sideways_atr_max_pct': 0.04897016093481087, 'sideways_tp_mult': 1.7537865538046056, 'sideways_tsl_mult': 0.789841172305114, 'sideways_time_stop': 253, 'sideways_use_sma': True, 'sideways_use_ema': True, 'sideways_use_atr': True, 'sideways_use_adx': True, 'sideways_use_spike': True, 'sideways_rsi_required': True}.
[I 2025-08-31 03:17:18,949] Trial 867 finished with values: [-0.14447849838707683, 0.14441869774158692] and parameters: {'p_sma': 55, 'p_std': 50, 'p_atr': 28, 'p_adx': 15, 'rsi_period': 24, 'ema1': 6, 'ema2': 23, 'slip_atr_k': 0.12359581559440068, 'slip_spread_k': 0.9253767531137174, 'spread_hl_frac': 0.03758903157037721, 'bb_std_mult': 3.3775760073318177, 'rsi_os': 17, 'rsi_ob': 67, 'vol_spike': 0.01906921153531621, 'adx_thresh': 21.635038202190703, 'atr_min_pct': 0.010700716264193978, 'atr_max_pct': 0.10802511133119673, 'tp_mult': 1.0932085484830267, 'tsl_mult': 0.2947968146680046, 'strategy': 'breakout', 'time_stop': 111, 'use_sma': True, 'use_atr': False, 'use_adx': True, 'use_ema': False, 'use_spike': False, 'rsi_required': True, 'edge_k': 1.6690837513045018, 'edge_cap': 0.720251951768035, 'bull_strategy': 'breakout', 'bull_bb_std_mult': 1.4768436435258776, 'bull_rsi_os': 45, 'bull_rsi_ob': 88, 'bull_adx_thresh': 5.70772277653975, 'bull_atr_min_pct': 0.013895712605581409, 'bull_atr_max_pct': 0.03730888869919044, 'bull_tp_mult': 1.7948958194631022, 'bull_tsl_mult': 0.5483506178518239, 'bull_time_stop': 77, 'bull_use_sma': True, 'bull_use_ema': True, 'bull_use_atr': False, 'bull_use_adx': False, 'bull_use_spike': True, 'bull_rsi_required': True, 'bear_strategy': 'mean_reversion', 'bear_bb_std_mult': 1.2490771041007502, 'bear_rsi_os': 47, 'bear_rsi_ob': 87, 'bear_adx_thresh': 34.99532033776512, 'bear_atr_min_pct': 0.001480903431252123, 'bear_atr_max_pct': 0.05015058562027268, 'bear_tp_mult': 2.026326543450596, 'bear_tsl_mult': 0.5767606400642366, 'bear_time_stop': 66, 'bear_use_sma': True, 'bear_use_ema': False, 'bear_use_atr': False, 'bear_use_adx': True, 'bear_use_spike': False, 'bear_rsi_required': False, 'sideways_strategy': 'breakout', 'sideways_bb_std_mult': 2.33426319377457, 'sideways_rsi_os': 39, 'sideways_rsi_ob': 95, 'sideways_adx_thresh': 8.390559473347379, 'sideways_atr_min_pct': 0.00010848783611814607, 'sideways_atr_max_pct': 0.04837631319467853, 'sideways_tp_mult': 1.7581479637476105, 'sideways_tsl_mult': 0.3882255039047676, 'sideways_time_stop': 143, 'sideways_use_sma': True, 'sideways_use_ema': True, 'sideways_use_atr': True, 'sideways_use_adx': True, 'sideways_use_spike': True, 'sideways_rsi_required': True}.
[I 2025-08-31 03:17:20,135] Trial 870 finished with values: [-1000000000.0, 1000000000.0] and parameters: {'p_sma': 57, 'p_std': 52, 'p_atr': 25, 'p_adx': 22, 'rsi_period': 25, 'ema1': 26, 'ema2': 50, 'slip_atr_k': 0.07290216521649001, 'slip_spread_k': 0.9208907684713865, 'spread_hl_frac': 0.00614537297807944, 'bb_std_mult': 0.9248130898763889, 'rsi_os': 26, 'rsi_ob': 67, 'vol_spike': 0.16553473746913988, 'adx_thresh': 7.6759815201158546, 'atr_min_pct': 0.009095808646503343, 'atr_max_pct': 0.05213787113715084, 'tp_mult': 1.8470059154660312, 'tsl_mult': 0.29764656554163804, 'strategy': 'breakout', 'time_stop': 112, 'use_sma': True, 'use_atr': True, 'use_adx': False, 'use_ema': False, 'use_spike': False, 'rsi_required': True, 'edge_k': 1.6655311043543504, 'edge_cap': 0.4797937554274328, 'bull_strategy': 'breakout', 'bull_bb_std_mult': 2.1714032054789705, 'bull_rsi_os': 43, 'bull_rsi_ob': 61, 'bull_adx_thresh': 22.47215817445791, 'bull_atr_min_pct': 0.023075426938952377, 'bull_atr_max_pct': 0.01849711394627121, 'bull_tp_mult': 1.2639992497461008, 'bull_tsl_mult': 0.5455895381502776, 'bull_time_stop': 5, 'bull_use_sma': False, 'bull_use_ema': True, 'bull_use_atr': False, 'bull_use_adx': True, 'bull_use_spike': True, 'bull_rsi_required': True, 'bear_strategy': 'breakout', 'bear_bb_std_mult': 3.2431186345467355, 'bear_rsi_os': 26, 'bear_rsi_ob': 47, 'bear_adx_thresh': 6.707353675013737, 'bear_atr_min_pct': 0.02334503964442422, 'bear_atr_max_pct': 0.050426075429297536, 'bear_tp_mult': 2.0635527886037743, 'bear_tsl_mult': 0.5820192476661795, 'bear_time_stop': 147, 'bear_use_sma': True, 'bear_use_ema': False, 'bear_use_atr': True, 'bear_use_adx': True, 'bear_use_spike': False, 'bear_rsi_required': False, 'sideways_strategy': 'mean_reversion', 'sideways_bb_std_mult': 2.3337235191359755, 'sideways_rsi_os': 43, 'sideways_rsi_ob': 91, 'sideways_adx_thresh': 30.186777376089445, 'sideways_atr_min_pct': 0.027733986784199822, 'sideways_atr_max_pct': 0.1293632519097514, 'sideways_tp_mult': 1.7302332324378045, 'sideways_tsl_mult': 0.6400506913721346, 'sideways_time_stop': 13, 'sideways_use_sma': False, 'sideways_use_ema': True, 'sideways_use_atr': True, 'sideways_use_adx': False, 'sideways_use_spike': False, 'sideways_rsi_required': True}.
[I 2025-08-31 03:17:20,981] Trial 872 finished with values: [-1000000000.0, 1000000000.0] and parameters: {'p_sma': 55, 'p_std': 52, 'p_atr': 25, 'p_adx': 30, 'rsi_period': 25, 'ema1': 10, 'ema2': 49, 'slip_atr_k': 0.00423352834693479, 'slip_spread_k': 0.1748804760770074, 'spread_hl_frac': 0.0029947925299974175, 'bb_std_mult': 1.2217408410201243, 'rsi_os': 38, 'rsi_ob': 49, 'vol_spike': 0.25424592980403465, 'adx_thresh': 22.31191751227062, 'atr_min_pct': 0.008407679939589413, 'atr_max_pct': 0.11548343131514255, 'tp_mult': 1.7902327279369623, 'tsl_mult': 0.29383232137443716, 'strategy': 'mean_reversion', 'time_stop': 56, 'use_sma': True, 'use_atr': True, 'use_adx': False, 'use_ema': False, 'use_spike': False, 'rsi_required': True, 'edge_k': 0.5930635592264857, 'edge_cap': 0.10595043335346811, 'bull_strategy': 'breakout', 'bull_bb_std_mult': 2.3026185747804124, 'bull_rsi_os': 34, 'bull_rsi_ob': 74, 'bull_adx_thresh': 23.119754756862847, 'bull_atr_min_pct': 0.02702234197504036, 'bull_atr_max_pct': 0.0361882199335649, 'bull_tp_mult': 2.3322617410709214, 'bull_tsl_mult': 0.1716956433890009, 'bull_time_stop': 109, 'bull_use_sma': False, 'bull_use_ema': False, 'bull_use_atr': True, 'bull_use_adx': False, 'bull_use_spike': True, 'bull_rsi_required': True, 'bear_strategy': 'breakout', 'bear_bb_std_mult': 1.4026453706252255, 'bear_rsi_os': 17, 'bear_rsi_ob': 47, 'bear_adx_thresh': 6.707874012610404, 'bear_atr_min_pct': 0.02598007570706836, 'bear_atr_max_pct': 0.07531384483064732, 'bear_tp_mult': 2.165984825699614, 'bear_tsl_mult': 0.29578455869787174, 'bear_time_stop': 11, 'bear_use_sma': False, 'bear_use_ema': False, 'bear_use_atr': False, 'bear_use_adx': True, 'bear_use_spike': False, 'bear_rsi_required': True, 'sideways_strategy': 'mean_reversion', 'sideways_bb_std_mult': 0.5459320003688723, 'sideways_rsi_os': 41, 'sideways_rsi_ob': 95, 'sideways_adx_thresh': 31.08811181283768, 'sideways_atr_min_pct': 0.02674748372641292, 'sideways_atr_max_pct': 0.05449766780510737, 'sideways_tp_mult': 2.334489325278704, 'sideways_tsl_mult': 0.6463118872565397, 'sideways_time_stop': 97, 'sideways_use_sma': False, 'sideways_use_ema': False, 'sideways_use_atr': False, 'sideways_use_adx': False, 'sideways_use_spike': True, 'sideways_rsi_required': False}.
[I 2025-08-31 03:17:50,931] Trial 873 finished with values: [-1000000000.0, 1000000000.0] and parameters: {'p_sma': 53, 'p_std': 21, 'p_atr': 25, 'p_adx': 30, 'rsi_period': 71, 'ema1': 10, 'ema2': 13, 'slip_atr_k': 0.07220561258639296, 'slip_spread_k': 0.17018201617243717, 'spread_hl_frac': 0.03639480159392985, 'bb_std_mult': 1.5122341574133455, 'rsi_os': 38, 'rsi_ob': 93, 'vol_spike': 0.20853590328552607, 'adx_thresh': 5.105257213215472, 'atr_min_pct': 0.008448234715210919, 'atr_max_pct': 0.11577120735138884, 'tp_mult': 2.160506412357673, 'tsl_mult': 0.6156474394507851, 'strategy': 'mean_reversion', 'time_stop': 107, 'use_sma': True, 'use_atr': True, 'use_adx': False, 'use_ema': False, 'use_spike': False, 'rsi_required': True, 'edge_k': 0.3998057881884438, 'edge_cap': 0.10211644719925962, 'bull_strategy': 'breakout', 'bull_bb_std_mult': 2.0213019774802556, 'bull_rsi_os': 35, 'bull_rsi_ob': 63, 'bull_adx_thresh': 23.39950530310663, 'bull_atr_min_pct': 0.011654847782381607, 'bull_atr_max_pct': 0.028531022353804524, 'bull_tp_mult': 1.508920999178303, 'bull_tsl_mult': 0.27609974281167754, 'bull_time_stop': 300, 'bull_use_sma': False, 'bull_use_ema': False, 'bull_use_atr': True, 'bull_use_adx': True, 'bull_use_spike': True, 'bull_rsi_required': True, 'bear_strategy': 'breakout', 'bear_bb_std_mult': 1.3923883915119373, 'bear_rsi_os': 17, 'bear_rsi_ob': 68, 'bear_adx_thresh': 6.628555784129976, 'bear_atr_min_pct': 0.02356685688630243, 'bear_atr_max_pct': 0.13325415356065026, 'bear_tp_mult': 2.120131034367343, 'bear_tsl_mult': 0.5558363901644916, 'bear_time_stop': 14, 'bear_use_sma': False, 'bear_use_ema': False, 'bear_use_atr': True, 'bear_use_adx': True, 'bear_use_spike': False, 'bear_rsi_required': True, 'sideways_strategy': 'mean_reversion', 'sideways_bb_std_mult': 0.7462498061694627, 'sideways_rsi_os': 41, 'sideways_rsi_ob': 91, 'sideways_adx_thresh': 10.194523055252215, 'sideways_atr_min_pct': 0.005250163602452484, 'sideways_atr_max_pct': 0.12499289932151, 'sideways_tp_mult': 2.0621720451666006, 'sideways_tsl_mult': 0.6418258395345883, 'sideways_time_stop': 272, 'sideways_use_sma': False, 'sideways_use_ema': False, 'sideways_use_atr': False, 'sideways_use_adx': False, 'sideways_use_spike': False, 'sideways_rsi_required': False}.
