[I 2025-08-31 03:05:49,073] Trial 780 finished with values: [-1000000000.0, 1000000000.0] and parameters: {'p_sma': 52, 'p_std': 52, 'p_atr': 8, 'p_adx': 13, 'rsi_period': 64, 'ema1': 13, 'ema2': 35, 'slip_atr_k': 0.0747936095627475, 'slip_spread_k': 0.015420958350348679, 'spread_hl_frac': 0.046301344382371164, 'bb_std_mult': 1.7959847599691576, 'rsi_os': 27, 'rsi_ob': 69, 'vol_spike': 0.18436288567737144, 'adx_thresh': 15.811457243437507, 'atr_min_pct': 0.007252144729081981, 'atr_max_pct': 0.12073866770936115, 'tp_mult': 1.4760268990047294, 'tsl_mult': 0.6101993369082656, 'strategy': 'mean_reversion', 'time_stop': 209, 'use_sma': False, 'use_atr': False, 'use_adx': False, 'use_ema': False, 'use_spike': False, 'rsi_required': True, 'edge_k': 1.2359448425676305, 'edge_cap': 0.08027502596861624, 'bull_strategy': 'breakout', 'bull_bb_std_mult': 2.6190798685941754, 'bull_rsi_os': 47, 'bull_rsi_ob': 60, 'bull_adx_thresh': 29.175633209276953, 'bull_atr_min_pct': 0.02699590531780292, 'bull_atr_max_pct': 0.14161422013915906, 'bull_tp_mult': 2.1964793487173506, 'bull_tsl_mult': 0.2856860716871481, 'bull_time_stop': 111, 'bull_use_sma': True, 'bull_use_ema': True, 'bull_use_atr': False, 'bull_use_adx': True, 'bull_use_spike': True, 'bull_rsi_required': True, 'bear_strategy': 'breakout', 'bear_bb_std_mult': 1.3843682989308779, 'bear_rsi_os': 36, 'bear_rsi_ob': 56, 'bear_adx_thresh': 32.967775934016814, 'bear_atr_min_pct': 0.0035720091773595204, 'bear_atr_max_pct': 0.14505611376209998, 'bear_tp_mult': 2.051456226469247, 'bear_tsl_mult': 0.5211949555590472, 'bear_time_stop': 258, 'bear_use_sma': False, 'bear_use_ema': False, 'bear_use_atr': True, 'bear_use_adx': False, 'bear_use_spike': False, 'bear_rsi_required': True, 'sideways_strategy': 'breakout', 'sideways_bb_std_mult': 1.929821691664124, 'sideways_rsi_os': 42, 'sideways_rsi_ob': 78, 'sideways_adx_thresh': 8.67495725053624, 'sideways_atr_min_pct': 0.029112367837954574, 'sideways_atr_max_pct': 0.09814899998354767, 'sideways_tp_mult': 1.7351703610680387, 'sideways_tsl_mult': 0.7068996244572893, 'sideways_time_stop': 42, 'sideways_use_sma': True, 'sideways_use_ema': False, 'sideways_use_atr': False, 'sideways_use_adx': False, 'sideways_use_spike': False, 'sideways_rsi_required': True}.
[I 2025-08-31 03:06:24,133] Trial 787 finished with values: [-1000000000.0, 1000000000.0] and parameters: {'p_sma': 56, 'p_std': 49, 'p_atr': 28, 'p_adx': 12, 'rsi_period': 74, 'ema1': 27, 'ema2': 44, 'slip_atr_k': 0.19905861472017683, 'slip_spread_k': 0.5500405621036587, 'spread_hl_frac': 0.0007994312101774568, 'bb_std_mult': 0.5653775466539879, 'rsi_os': 40, 'rsi_ob': 68, 'vol_spike': 0.1745727057398192, 'adx_thresh': 20.10417653205978, 'atr_min_pct': 0.019609393866650275, 'atr_max_pct': 0.08717573237909024, 'tp_mult': 1.4063535121685329, 'tsl_mult': 0.4890434595658266, 'strategy': 'mean_reversion', 'time_stop': 300, 'use_sma': True, 'use_atr': True, 'use_adx': True, 'use_ema': False, 'use_spike': False, 'rsi_required': True, 'edge_k': 1.3070361671245496, 'edge_cap': 0.15629683057648616, 'bull_strategy': 'mean_reversion', 'bull_bb_std_mult': 2.1067146690589493, 'bull_rsi_os': 8, 'bull_rsi_ob': 67, 'bull_adx_thresh': 5.499402432083013, 'bull_atr_min_pct': 0.01416250154728182, 'bull_atr_max_pct': 0.13464569670712845, 'bull_tp_mult': 2.3549028103539826, 'bull_tsl_mult': 0.939646071820802, 'bull_time_stop': 253, 'bull_use_sma': True, 'bull_use_ema': False, 'bull_use_atr': False, 'bull_use_adx': False, 'bull_use_spike': True, 'bull_rsi_required': True, 'bear_strategy': 'mean_reversion', 'bear_bb_std_mult': 1.3070413052938914, 'bear_rsi_os': 16, 'bear_rsi_ob': 60, 'bear_adx_thresh': 6.113009466706031, 'bear_atr_min_pct': 0.016104260897850088, 'bear_atr_max_pct': 0.010153675596395637, 'bear_tp_mult': 2.1065291092616345, 'bear_tsl_mult': 0.545314509161184, 'bear_time_stop': 107, 'bear_use_sma': False, 'bear_use_ema': False, 'bear_use_atr': False, 'bear_use_adx': True, 'bear_use_spike': True, 'bear_rsi_required': True, 'sideways_strategy': 'breakout', 'sideways_bb_std_mult': 0.567595010909535, 'sideways_rsi_os': 40, 'sideways_rsi_ob': 54, 'sideways_adx_thresh': 9.720841407640926, 'sideways_atr_min_pct': 0.01864721120516607, 'sideways_atr_max_pct': 0.056126819162627954, 'sideways_tp_mult': 2.6784755505144062, 'sideways_tsl_mult': 0.6657323118815907, 'sideways_time_stop': 203, 'sideways_use_sma': False, 'sideways_use_ema': True, 'sideways_use_atr': True, 'sideways_use_adx': False, 'sideways_use_spike': True, 'sideways_rsi_required': False}.
[I 2025-08-31 03:06:24,525] Trial 784 finished with values: [-1000000000.0, 1000000000.0] and parameters: {'p_sma': 54, 'p_std': 49, 'p_atr': 9, 'p_adx': 10, 'rsi_period': 64, 'ema1': 27, 'ema2': 22, 'slip_atr_k': 0.20953499726248231, 'slip_spread_k': 0.21005101612224966, 'spread_hl_frac': 0.03785743456262616, 'bb_std_mult': 0.7762079650198996, 'rsi_os': 21, 'rsi_ob': 69, 'vol_spike': 0.1778345202958421, 'adx_thresh': 19.99857933898139, 'atr_min_pct': 0.009170141641558117, 'atr_max_pct': 0.11144297312477769, 'tp_mult': 1.4065543137699614, 'tsl_mult': 0.2839196301317296, 'strategy': 'mean_reversion', 'time_stop': 253, 'use_sma': False, 'use_atr': False, 'use_adx': True, 'use_ema': False, 'use_spike': False, 'rsi_required': True, 'edge_k': 0.9223760059521174, 'edge_cap': 0.669047243283044, 'bull_strategy': 'mean_reversion', 'bull_bb_std_mult': 2.1155694858347687, 'bull_rsi_os': 10, 'bull_rsi_ob': 56, 'bull_adx_thresh': 26.191534090928748, 'bull_atr_min_pct': 0.0208779985733491, 'bull_atr_max_pct': 0.13583804637981362, 'bull_tp_mult': 2.359634115121595, 'bull_tsl_mult': 0.31165692348664303, 'bull_time_stop': 130, 'bull_use_sma': True, 'bull_use_ema': False, 'bull_use_atr': False, 'bull_use_adx': True, 'bull_use_spike': True, 'bull_rsi_required': True, 'bear_strategy': 'breakout', 'bear_bb_std_mult': 1.3275366386740592, 'bear_rsi_os': 9, 'bear_rsi_ob': 47, 'bear_adx_thresh': 31.319276483587625, 'bear_atr_min_pct': 0.018956446449451575, 'bear_atr_max_pct': 0.03748396713953987, 'bear_tp_mult': 1.4630211372251265, 'bear_tsl_mult': 0.5138320860969969, 'bear_time_stop': 5, 'bear_use_sma': False, 'bear_use_ema': False, 'bear_use_atr': False, 'bear_use_adx': False, 'bear_use_spike': True, 'bear_rsi_required': True, 'sideways_strategy': 'breakout', 'sideways_bb_std_mult': 0.6647092597706911, 'sideways_rsi_os': 40, 'sideways_rsi_ob': 78, 'sideways_adx_thresh': 26.900180994843062, 'sideways_atr_min_pct': 0.027701747822496, 'sideways_atr_max_pct': 0.05567246589636166, 'sideways_tp_mult': 1.8488443808689277, 'sideways_tsl_mult': 0.6793386152062413, 'sideways_time_stop': 203, 'sideways_use_sma': True, 'sideways_use_ema': True, 'sideways_use_atr': True, 'sideways_use_adx': True, 'sideways_use_spike': True, 'sideways_rsi_required': False}.
[I 2025-08-31 03:06:24,529] Trial 785 finished with values: [-1000000000.0, 1000000000.0] and parameters: {'p_sma': 56, 'p_std': 57, 'p_atr': 28, 'p_adx': 27, 'rsi_period': 73, 'ema1': 6, 'ema2': 36, 'slip_atr_k': 0.08317194477934939, 'slip_spread_k': 0.022124611179028197, 'spread_hl_frac': 0.0005278548147451441, 'bb_std_mult': 2.635559136422515, 'rsi_os': 35, 'rsi_ob': 68, 'vol_spike': 0.17781974125668348, 'adx_thresh': 20.20671462604529, 'atr_min_pct': 0.01972719627220021, 'atr_max_pct': 0.12407097351614008, 'tp_mult': 2.881531390886357, 'tsl_mult': 0.8011712720438241, 'strategy': 'mean_reversion', 'time_stop': 110, 'use_sma': True, 'use_atr': True, 'use_adx': True, 'use_ema': False, 'use_spike': False, 'rsi_required': True, 'edge_k': 0.6677708680876869, 'edge_cap': 0.7188253176566892, 'bull_strategy': 'mean_reversion', 'bull_bb_std_mult': 2.1160341661577817, 'bull_rsi_os': 28, 'bull_rsi_ob': 90, 'bull_adx_thresh': 5.483326684401357, 'bull_atr_min_pct': 0.02063831500840252, 'bull_atr_max_pct': 0.13411952663266405, 'bull_tp_mult': 2.1847868597004276, 'bull_tsl_mult': 0.2797723711271441, 'bull_time_stop': 132, 'bull_use_sma': True, 'bull_use_ema': False, 'bull_use_atr': False, 'bull_use_adx': False, 'bull_use_spike': True, 'bull_rsi_required': True, 'bear_strategy': 'mean_reversion', 'bear_bb_std_mult': 1.3048260027592276, 'bear_rsi_os': 16, 'bear_rsi_ob': 45, 'bear_adx_thresh': 5.916818465729143, 'bear_atr_min_pct': 0.005612096115196684, 'bear_atr_max_pct': 0.014055667223728877, 'bear_tp_mult': 2.1037837618325272, 'bear_tsl_mult': 0.5398137881931152, 'bear_time_stop': 10, 'bear_use_sma': False, 'bear_use_ema': False, 'bear_use_atr': False, 'bear_use_adx': True, 'bear_use_spike': True, 'bear_rsi_required': True, 'sideways_strategy': 'breakout', 'sideways_bb_std_mult': 0.5388637136286518, 'sideways_rsi_os': 40, 'sideways_rsi_ob': 52, 'sideways_adx_thresh': 9.70794349095271, 'sideways_atr_min_pct': 0.026036041710116913, 'sideways_atr_max_pct': 0.09781663169110805, 'sideways_tp_mult': 1.8282976334718801, 'sideways_tsl_mult': 0.678030946152521, 'sideways_time_stop': 203, 'sideways_use_sma': False, 'sideways_use_ema': True, 'sideways_use_atr': True, 'sideways_use_adx': False, 'sideways_use_spike': True, 'sideways_rsi_required': False}.
[I 2025-08-31 03:06:24,680] Trial 786 finished with values: [-1000000000.0, 1000000000.0] and parameters: {'p_sma': 56, 'p_std': 47, 'p_atr': 11, 'p_adx': 10, 'rsi_period': 73, 'ema1': 6, 'ema2': 12, 'slip_atr_k': 0.08194973370563244, 'slip_spread_k': 0.022360594564314384, 'spread_hl_frac': 0.00057484329065254, 'bb_std_mult': 0.7775966901323819, 'rsi_os': 9, 'rsi_ob': 68, 'vol_spike': 0.2767286872478574, 'adx_thresh': 16.00724339309468, 'atr_min_pct': 0.008991739464268872, 'atr_max_pct': 0.11240760324175421, 'tp_mult': 1.9475040712463079, 'tsl_mult': 0.8186884019636265, 'strategy': 'mean_reversion', 'time_stop': 263, 'use_sma': True, 'use_atr': True, 'use_adx': True, 'use_ema': False, 'use_spike': False, 'rsi_required': True, 'edge_k': 0.36908487799712464, 'edge_cap': 0.5541483133449783, 'bull_strategy': 'mean_reversion', 'bull_bb_std_mult': 2.347667469557641, 'bull_rsi_os': 41, 'bull_rsi_ob': 90, 'bull_adx_thresh': 5.01019749789753, 'bull_atr_min_pct': 0.01412306144884818, 'bull_atr_max_pct': 0.13488112723334011, 'bull_tp_mult': 2.1951498583312508, 'bull_tsl_mult': 0.2773960062499781, 'bull_time_stop': 111, 'bull_use_sma': True, 'bull_use_ema': False, 'bull_use_atr': False, 'bull_use_adx': False, 'bull_use_spike': True, 'bull_rsi_required': True, 'bear_strategy': 'mean_reversion', 'bear_bb_std_mult': 1.3039043117799038, 'bear_rsi_os': 51, 'bear_rsi_ob': 94, 'bear_adx_thresh': 6.124806459350711, 'bear_atr_min_pct': 0.005636239196784717, 'bear_atr_max_pct': 0.0375424550617329, 'bear_tp_mult': 2.107203868523436, 'bear_tsl_mult': 0.546379028722812, 'bear_time_stop': 10, 'bear_use_sma': False, 'bear_use_ema': False, 'bear_use_atr': False, 'bear_use_adx': True, 'bear_use_spike': True, 'bear_rsi_required': True, 'sideways_strategy': 'breakout', 'sideways_bb_std_mult': 2.384733858866137, 'sideways_rsi_os': 40, 'sideways_rsi_ob': 76, 'sideways_adx_thresh': 9.530459688181868, 'sideways_atr_min_pct': 0.025911112827372563, 'sideways_atr_max_pct': 0.054843027416171565, 'sideways_tp_mult': 1.8322440272260887, 'sideways_tsl_mult': 0.8355088819810649, 'sideways_time_stop': 202, 'sideways_use_sma': False, 'sideways_use_ema': True, 'sideways_use_atr': True, 'sideways_use_adx': False, 'sideways_use_spike': True, 'sideways_rsi_required': False}.
[I 2025-08-31 03:06:57,245] Trial 791 finished with values: [-1000000000.0, 1000000000.0] and parameters: {'p_sma': 50, 'p_std': 51, 'p_atr': 29, 'p_adx': 23, 'rsi_period': 21, 'ema1': 29, 'ema2': 39, 'slip_atr_k': 0.1830310355507728, 'slip_spread_k': 0.1638850074352371, 'spread_hl_frac': 0.003630587487365203, 'bb_std_mult': 2.232186019344987, 'rsi_os': 11, 'rsi_ob': 71, 'vol_spike': 0.11270042701938415, 'adx_thresh': 17.248871979884917, 'atr_min_pct': 0.008015473023326765, 'atr_max_pct': 0.11821665012189547, 'tp_mult': 1.0936655260880395, 'tsl_mult': 0.40487255877718037, 'strategy': 'mean_reversion', 'time_stop': 139, 'use_sma': True, 'use_atr': False, 'use_adx': False, 'use_ema': False, 'use_spike': True, 'rsi_required': True, 'edge_k': 1.7328074196439502, 'edge_cap': 0.9982909006945392, 'bull_strategy': 'breakout', 'bull_bb_std_mult': 2.244362638578996, 'bull_rsi_os': 33, 'bull_rsi_ob': 63, 'bull_adx_thresh': 7.212622921360719, 'bull_atr_min_pct': 0.005507525803573275, 'bull_atr_max_pct': 0.13845930151404215, 'bull_tp_mult': 2.269267975354982, 'bull_tsl_mult': 0.4684242866178406, 'bull_time_stop': 120, 'bull_use_sma': True, 'bull_use_ema': False, 'bull_use_atr': False, 'bull_use_adx': True, 'bull_use_spike': True, 'bull_rsi_required': True, 'bear_strategy': 'mean_reversion', 'bear_bb_std_mult': 1.5024493670203376, 'bear_rsi_os': 40, 'bear_rsi_ob': 62, 'bear_adx_thresh': 24.278651341070788, 'bear_atr_min_pct': 0.006787196254957535, 'bear_atr_max_pct': 0.012937352765256295, 'bear_tp_mult': 1.3632550967775598, 'bear_tsl_mult': 0.4840647459349694, 'bear_time_stop': 230, 'bear_use_sma': False, 'bear_use_ema': True, 'bear_use_atr': False, 'bear_use_adx': True, 'bear_use_spike': False, 'bear_rsi_required': True, 'sideways_strategy': 'breakout', 'sideways_bb_std_mult': 0.5022960448857559, 'sideways_rsi_os': 54, 'sideways_rsi_ob': 73, 'sideways_adx_thresh': 7.900371040664815, 'sideways_atr_min_pct': 0.027279789462345952, 'sideways_atr_max_pct': 0.031884512102426946, 'sideways_tp_mult': 1.701691160158723, 'sideways_tsl_mult': 0.8973195147390242, 'sideways_time_stop': 110, 'sideways_use_sma': True, 'sideways_use_ema': False, 'sideways_use_atr': False, 'sideways_use_adx': False, 'sideways_use_spike': True, 'sideways_rsi_required': False}.
[I 2025-08-31 03:06:57,835] Trial 790 finished with values: [-1000000000.0, 1000000000.0] and parameters: {'p_sma': 50, 'p_std': 47, 'p_atr': 29, 'p_adx': 23, 'rsi_period': 26, 'ema1': 5, 'ema2': 38, 'slip_atr_k': 0.14959765843422865, 'slip_spread_k': 0.16660801436882233, 'spread_hl_frac': 0.002043699636456548, 'bb_std_mult': 1.1733555183649622, 'rsi_os': 38, 'rsi_ob': 65, 'vol_spike': 0.25511893761123006, 'adx_thresh': 16.868301065634135, 'atr_min_pct': 0.023005987653133678, 'atr_max_pct': 0.08221151654751618, 'tp_mult': 2.9996294101212038, 'tsl_mult': 0.9998185059499058, 'strategy': 'mean_reversion', 'time_stop': 198, 'use_sma': True, 'use_atr': False, 'use_adx': False, 'use_ema': False, 'use_spike': True, 'rsi_required': True, 'edge_k': 0.49554452557090806, 'edge_cap': 0.3654947853569397, 'bull_strategy': 'breakout', 'bull_bb_std_mult': 0.7456645628206613, 'bull_rsi_os': 33, 'bull_rsi_ob': 92, 'bull_adx_thresh': 7.281112195760736, 'bull_atr_min_pct': 0.02552166187776532, 'bull_atr_max_pct': 0.010109463244011907, 'bull_tp_mult': 2.2753333337702655, 'bull_tsl_mult': 0.20782656645079942, 'bull_time_stop': 119, 'bull_use_sma': True, 'bull_use_ema': False, 'bull_use_atr': False, 'bull_use_adx': True, 'bull_use_spike': True, 'bull_rsi_required': True, 'bear_strategy': 'mean_reversion', 'bear_bb_std_mult': 2.732239281883751, 'bear_rsi_os': 49, 'bear_rsi_ob': 62, 'bear_adx_thresh': 23.914405231782773, 'bear_atr_min_pct': 0.006667584899280711, 'bear_atr_max_pct': 0.1229928326922124, 'bear_tp_mult': 2.9965201099995187, 'bear_tsl_mult': 0.602151801138799, 'bear_time_stop': 24, 'bear_use_sma': False, 'bear_use_ema': True, 'bear_use_atr': False, 'bear_use_adx': True, 'bear_use_spike': False, 'bear_rsi_required': True, 'sideways_strategy': 'breakout', 'sideways_bb_std_mult': 2.0778705109604383, 'sideways_rsi_os': 12, 'sideways_rsi_ob': 73, 'sideways_adx_thresh': 7.9062030532684915, 'sideways_atr_min_pct': 0.004077384170543739, 'sideways_atr_max_pct': 0.05336342299625449, 'sideways_tp_mult': 1.6873612284029302, 'sideways_tsl_mult': 0.6598661797359702, 'sideways_time_stop': 73, 'sideways_use_sma': True, 'sideways_use_ema': False, 'sideways_use_atr': False, 'sideways_use_adx': False, 'sideways_use_spike': True, 'sideways_rsi_required': False}.
[I 2025-08-31 03:06:57,848] Trial 788 finished with values: [-1000000000.0, 1000000000.0] and parameters: {'p_sma': 18, 'p_std': 51, 'p_atr': 25, 'p_adx': 23, 'rsi_period': 26, 'ema1': 6, 'ema2': 11, 'slip_atr_k': 0.18432010108687658, 'slip_spread_k': 0.16251207228770595, 'spread_hl_frac': 0.0036804383375412413, 'bb_std_mult': 1.8779896750192855, 'rsi_os': 35, 'rsi_ob': 80, 'vol_spike': 0.022150752875286284, 'adx_thresh': 17.806397231719796, 'atr_min_pct': 0.02169485767580171, 'atr_max_pct': 0.12457213323716855, 'tp_mult': 1.7714598213998076, 'tsl_mult': 0.40008379914258635, 'strategy': 'mean_reversion', 'time_stop': 15, 'use_sma': True, 'use_atr': True, 'use_adx': False, 'use_ema': False, 'use_spike': True, 'rsi_required': True, 'edge_k': 0.5061306485788051, 'edge_cap': 0.5572335000344264, 'bull_strategy': 'breakout', 'bull_bb_std_mult': 1.0170440950989483, 'bull_rsi_os': 28, 'bull_rsi_ob': 91, 'bull_adx_thresh': 22.071975708344432, 'bull_atr_min_pct': 0.021735870591309013, 'bull_atr_max_pct': 0.1387993482435739, 'bull_tp_mult': 2.7496998096266276, 'bull_tsl_mult': 0.2647725146539622, 'bull_time_stop': 205, 'bull_use_sma': True, 'bull_use_ema': False, 'bull_use_atr': False, 'bull_use_adx': False, 'bull_use_spike': True, 'bull_rsi_required': True, 'bear_strategy': 'mean_reversion', 'bear_bb_std_mult': 1.22922320690102, 'bear_rsi_os': 19, 'bear_rsi_ob': 45, 'bear_adx_thresh': 17.020474484547883, 'bear_atr_min_pct': 0.0068298057398923865, 'bear_atr_max_pct': 0.13381682270713502, 'bear_tp_mult': 2.091272341672155, 'bear_tsl_mult': 0.4846920790992018, 'bear_time_stop': 10, 'bear_use_sma': False, 'bear_use_ema': True, 'bear_use_atr': False, 'bear_use_adx': True, 'bear_use_spike': False, 'bear_rsi_required': True, 'sideways_strategy': 'breakout', 'sideways_bb_std_mult': 0.7803344086259434, 'sideways_rsi_os': 41, 'sideways_rsi_ob': 75, 'sideways_adx_thresh': 7.867815249360984, 'sideways_atr_min_pct': 0.02595520803276459, 'sideways_atr_max_pct': 0.05162546827559634, 'sideways_tp_mult': 2.623377440888654, 'sideways_tsl_mult': 0.5889110159703016, 'sideways_time_stop': 197, 'sideways_use_sma': False, 'sideways_use_ema': False, 'sideways_use_atr': False, 'sideways_use_adx': False, 'sideways_use_spike': True, 'sideways_rsi_required': False}.
[I 2025-08-31 03:06:57,946] Trial 789 finished with values: [-1000000000.0, 1000000000.0] and parameters: {'p_sma': 50, 'p_std': 47, 'p_atr': 29, 'p_adx': 23, 'rsi_period': 68, 'ema1': 5, 'ema2': 39, 'slip_atr_k': 0.003977395586811509, 'slip_spread_k': 0.16379645821233724, 'spread_hl_frac': 0.0035655894118839402, 'bb_std_mult': 2.2354413257854504, 'rsi_os': 38, 'rsi_ob': 93, 'vol_spike': 0.2000924847306225, 'adx_thresh': 21.154816512811486, 'atr_min_pct': 0.02354902215991804, 'atr_max_pct': 0.027272193958642242, 'tp_mult': 2.2666969566901507, 'tsl_mult': 0.5463922619022086, 'strategy': 'mean_reversion', 'time_stop': 119, 'use_sma': True, 'use_atr': False, 'use_adx': False, 'use_ema': False, 'use_spike': True, 'rsi_required': True, 'edge_k': 0.6079917211601694, 'edge_cap': 0.5037870738128878, 'bull_strategy': 'breakout', 'bull_bb_std_mult': 1.572217048568462, 'bull_rsi_os': 41, 'bull_rsi_ob': 63, 'bull_adx_thresh': 11.350621106738597, 'bull_atr_min_pct': 0.008144135027360389, 'bull_atr_max_pct': 0.13877131607002885, 'bull_tp_mult': 2.283685573506182, 'bull_tsl_mult': 0.2654336317769813, 'bull_time_stop': 122, 'bull_use_sma': True, 'bull_use_ema': False, 'bull_use_atr': False, 'bull_use_adx': True, 'bull_use_spike': True, 'bull_rsi_required': True, 'bear_strategy': 'mean_reversion', 'bear_bb_std_mult': 1.2303122447214465, 'bear_rsi_os': 19, 'bear_rsi_ob': 47, 'bear_adx_thresh': 5.528932566247463, 'bear_atr_min_pct': 0.006778216988294638, 'bear_atr_max_pct': 0.010172653220292616, 'bear_tp_mult': 2.9926972090418436, 'bear_tsl_mult': 0.48821036955161967, 'bear_time_stop': 14, 'bear_use_sma': False, 'bear_use_ema': True, 'bear_use_atr': False, 'bear_use_adx': True, 'bear_use_spike': False, 'bear_rsi_required': True, 'sideways_strategy': 'breakout', 'sideways_bb_std_mult': 2.3025621856779837, 'sideways_rsi_os': 13, 'sideways_rsi_ob': 93, 'sideways_adx_thresh': 33.74964423670526, 'sideways_atr_min_pct': 0.026080538294589374, 'sideways_atr_max_pct': 0.05117412994935175, 'sideways_tp_mult': 2.0870649794440244, 'sideways_tsl_mult': 0.4847125559909648, 'sideways_time_stop': 195, 'sideways_use_sma': True, 'sideways_use_ema': False, 'sideways_use_atr': False, 'sideways_use_adx': False, 'sideways_use_spike': True, 'sideways_rsi_required': False}.
