[I 2025-08-31 02:22:26,369] Trial 479 finished with values: [-1000000000.0, 1000000000.0] and parameters: {'p_sma': 45, 'p_std': 51, 'p_atr': 26, 'p_adx': 8, 'rsi_period': 56, 'ema1': 9, 'ema2': 48, 'slip_atr_k': 0.18759486260667452, 'slip_spread_k': 0.22605532852130927, 'spread_hl_frac': 0.00997669263970076, 'bb_std_mult': 1.8439470990692302, 'rsi_os': 50, 'rsi_ob': 63, 'vol_spike': 0.23587592000858734, 'adx_thresh': 20.926484822921466, 'atr_min_pct': 0.0093825342539832, 'atr_max_pct': 0.07636216374941746, 'tp_mult': 2.1449856326849064, 'tsl_mult': 0.07324517653793974, 'strategy': 'breakout', 'time_stop': 245, 'use_sma': True, 'use_atr': False, 'use_adx': False, 'use_ema': True, 'use_spike': False, 'rsi_required': False, 'edge_k': 0.7503787172498507, 'edge_cap': 0.8044695415414993, 'bull_strategy': 'mean_reversion', 'bull_bb_std_mult': 2.846694104329395, 'bull_rsi_os': 37, 'bull_rsi_ob': 72, 'bull_adx_thresh': 11.97520107870719, 'bull_atr_min_pct': 0.0013137353576304534, 'bull_atr_max_pct': 0.04791435032805465, 'bull_tp_mult': 2.563756378714473, 'bull_tsl_mult': 0.3073549048518731, 'bull_time_stop': 183, 'bull_use_sma': False, 'bull_use_ema': False, 'bull_use_atr': True, 'bull_use_adx': True, 'bull_use_spike': False, 'bull_rsi_required': True, 'bear_strategy': 'breakout', 'bear_bb_std_mult': 2.9917515201946383, 'bear_rsi_os': 22, 'bear_rsi_ob': 78, 'bear_adx_thresh': 8.054330628527863, 'bear_atr_min_pct': 0.007858705907489116, 'bear_atr_max_pct': 0.012049958030449674, 'bear_tp_mult': 2.0848088702724854, 'bear_tsl_mult': 0.7118455187228985, 'bear_time_stop': 21, 'bear_use_sma': True, 'bear_use_ema': False, 'bear_use_atr': False, 'bear_use_adx': True, 'bear_use_spike': False, 'bear_rsi_required': True, 'sideways_strategy': 'breakout', 'sideways_bb_std_mult': 0.9646144375104124, 'sideways_rsi_os': 23, 'sideways_rsi_ob': 50, 'sideways_adx_thresh': 21.164259914514762, 'sideways_atr_min_pct': 0.00013878977996408318, 'sideways_atr_max_pct': 0.10099699730623818, 'sideways_tp_mult': 1.584351632608794, 'sideways_tsl_mult': 0.02290182046675382, 'sideways_time_stop': 292, 'sideways_use_sma': False, 'sideways_use_ema': False, 'sideways_use_atr': False, 'sideways_use_adx': False, 'sideways_use_spike': True, 'sideways_rsi_required': False}.
[I 2025-08-31 02:22:26,493] Trial 478 finished with values: [-0.032228380610809126, 0.03218038527450685] and parameters: {'p_sma': 51, 'p_std': 8, 'p_atr': 25, 'p_adx': 8, 'rsi_period': 56, 'ema1': 6, 'ema2': 20, 'slip_atr_k': 0.19040889846235298, 'slip_spread_k': 0.2242058747957529, 'spread_hl_frac': 0.008035668295538055, 'bb_std_mult': 1.8439437817158553, 'rsi_os': 55, 'rsi_ob': 78, 'vol_spike': 0.2759042892544214, 'adx_thresh': 11.175420015081416, 'atr_min_pct': 0.009885581351820792, 'atr_max_pct': 0.11560773201738231, 'tp_mult': 2.5867642555333, 'tsl_mult': 0.7182613434754334, 'strategy': 'breakout', 'time_stop': 95, 'use_sma': True, 'use_atr': False, 'use_adx': False, 'use_ema': True, 'use_spike': False, 'rsi_required': False, 'edge_k': 1.6313527336650453, 'edge_cap': 0.1755508252041701, 'bull_strategy': 'mean_reversion', 'bull_bb_std_mult': 2.6252357110723734, 'bull_rsi_os': 9, 'bull_rsi_ob': 68, 'bull_adx_thresh': 8.459884070744456, 'bull_atr_min_pct': 0.0015073913813907834, 'bull_atr_max_pct': 0.05647846275477961, 'bull_tp_mult': 2.4156931682154217, 'bull_tsl_mult': 0.7282987647815506, 'bull_time_stop': 275, 'bull_use_sma': False, 'bull_use_ema': False, 'bull_use_atr': True, 'bull_use_adx': True, 'bull_use_spike': True, 'bull_rsi_required': True, 'bear_strategy': 'breakout', 'bear_bb_std_mult': 1.091319028696764, 'bear_rsi_os': 35, 'bear_rsi_ob': 76, 'bear_adx_thresh': 10.118868369207737, 'bear_atr_min_pct': 0.00819880579805697, 'bear_atr_max_pct': 0.0101122234971313, 'bear_tp_mult': 1.8936804987794333, 'bear_tsl_mult': 0.7071887594850098, 'bear_time_stop': 34, 'bear_use_sma': True, 'bear_use_ema': False, 'bear_use_atr': False, 'bear_use_adx': True, 'bear_use_spike': False, 'bear_rsi_required': True, 'sideways_strategy': 'breakout', 'sideways_bb_std_mult': 1.9165344053413174, 'sideways_rsi_os': 43, 'sideways_rsi_ob': 50, 'sideways_adx_thresh': 31.496914537671017, 'sideways_atr_min_pct': 0.010293243310742106, 'sideways_atr_max_pct': 0.05997575403490281, 'sideways_tp_mult': 1.1198123890719593, 'sideways_tsl_mult': 0.7191237533361394, 'sideways_time_stop': 171, 'sideways_use_sma': False, 'sideways_use_ema': False, 'sideways_use_atr': False, 'sideways_use_adx': False, 'sideways_use_spike': True, 'sideways_rsi_required': False}.
[I 2025-08-31 02:22:26,576] Trial 477 finished with values: [-0.016332585274424494, 0.016209086583186566] and parameters: {'p_sma': 45, 'p_std': 39, 'p_atr': 25, 'p_adx': 26, 'rsi_period': 74, 'ema1': 20, 'ema2': 20, 'slip_atr_k': 0.06678612506851113, 'slip_spread_k': 0.21785935730463019, 'spread_hl_frac': 0.010587561321767712, 'bb_std_mult': 1.8478886561563492, 'rsi_os': 55, 'rsi_ob': 81, 'vol_spike': 0.20031011223040107, 'adx_thresh': 11.356288703497912, 'atr_min_pct': 0.010156868429423404, 'atr_max_pct': 0.07996159066534522, 'tp_mult': 2.57932656842559, 'tsl_mult': 0.06776975354306547, 'strategy': 'breakout', 'time_stop': 94, 'use_sma': True, 'use_atr': False, 'use_adx': False, 'use_ema': False, 'use_spike': False, 'rsi_required': False, 'edge_k': 1.6199076008448503, 'edge_cap': 0.13364206897664382, 'bull_strategy': 'breakout', 'bull_bb_std_mult': 2.8277519353567047, 'bull_rsi_os': 14, 'bull_rsi_ob': 68, 'bull_adx_thresh': 12.009973359967871, 'bull_atr_min_pct': 0.0005741351245254254, 'bull_atr_max_pct': 0.129744152155044, 'bull_tp_mult': 2.4007308578338336, 'bull_tsl_mult': 0.7296455393867198, 'bull_time_stop': 157, 'bull_use_sma': False, 'bull_use_ema': False, 'bull_use_atr': False, 'bull_use_adx': False, 'bull_use_spike': True, 'bull_rsi_required': True, 'bear_strategy': 'mean_reversion', 'bear_bb_std_mult': 1.221149282563498, 'bear_rsi_os': 20, 'bear_rsi_ob': 80, 'bear_adx_thresh': 7.019183066564356, 'bear_atr_min_pct': 0.008328510215046103, 'bear_atr_max_pct': 0.01311735961791552, 'bear_tp_mult': 1.9034310037593902, 'bear_tsl_mult': 0.43982969831679897, 'bear_time_stop': 267, 'bear_use_sma': False, 'bear_use_ema': False, 'bear_use_atr': False, 'bear_use_adx': True, 'bear_use_spike': False, 'bear_rsi_required': True, 'sideways_strategy': 'mean_reversion', 'sideways_bb_std_mult': 0.9371764970774319, 'sideways_rsi_os': 50, 'sideways_rsi_ob': 92, 'sideways_adx_thresh': 13.885428982967406, 'sideways_atr_min_pct': 0.021584433853397984, 'sideways_atr_max_pct': 0.024976929567001954, 'sideways_tp_mult': 2.6268643791420954, 'sideways_tsl_mult': 0.7178976612231583, 'sideways_time_stop': 121, 'sideways_use_sma': False, 'sideways_use_ema': False, 'sideways_use_atr': False, 'sideways_use_adx': False, 'sideways_use_spike': True, 'sideways_rsi_required': True}.
[I 2025-08-31 02:22:58,920] Trial 483 finished with values: [-0.01394975021064404, 0.013927633676793323] and parameters: {'p_sma': 53, 'p_std': 44, 'p_atr': 27, 'p_adx': 26, 'rsi_period': 65, 'ema1': 5, 'ema2': 22, 'slip_atr_k': 0.01412992902794057, 'slip_spread_k': 0.1836612075458215, 'spread_hl_frac': 0.006016910637538404, 'bb_std_mult': 1.8090660983558016, 'rsi_os': 37, 'rsi_ob': 70, 'vol_spike': 0.18229899547704592, 'adx_thresh': 20.224712465011446, 'atr_min_pct': 0.007603238536787776, 'atr_max_pct': 0.11392489676196767, 'tp_mult': 1.0563541319475214, 'tsl_mult': 0.03322865949541541, 'strategy': 'mean_reversion', 'time_stop': 103, 'use_sma': True, 'use_atr': False, 'use_adx': False, 'use_ema': False, 'use_spike': False, 'rsi_required': True, 'edge_k': 0.6001116460262818, 'edge_cap': 0.1025010331555609, 'bull_strategy': 'breakout', 'bull_bb_std_mult': 2.5830441548809464, 'bull_rsi_os': 13, 'bull_rsi_ob': 61, 'bull_adx_thresh': 9.094981859366976, 'bull_atr_min_pct': 0.0005215826233630059, 'bull_atr_max_pct': 0.14115256937079024, 'bull_tp_mult': 2.318299118853125, 'bull_tsl_mult': 0.28160952510469267, 'bull_time_stop': 144, 'bull_use_sma': False, 'bull_use_ema': False, 'bull_use_atr': False, 'bull_use_adx': True, 'bull_use_spike': True, 'bull_rsi_required': True, 'bear_strategy': 'mean_reversion', 'bear_bb_std_mult': 1.3551713363010005, 'bear_rsi_os': 19, 'bear_rsi_ob': 45, 'bear_adx_thresh': 6.024391123323037, 'bear_atr_min_pct': 0.007740171116841079, 'bear_atr_max_pct': 0.010227133567249374, 'bear_tp_mult': 2.0599736900139938, 'bear_tsl_mult': 0.745595226979983, 'bear_time_stop': 8, 'bear_use_sma': False, 'bear_use_ema': False, 'bear_use_atr': False, 'bear_use_adx': True, 'bear_use_spike': False, 'bear_rsi_required': True, 'sideways_strategy': 'mean_reversion', 'sideways_bb_std_mult': 0.6323303781040106, 'sideways_rsi_os': 41, 'sideways_rsi_ob': 94, 'sideways_adx_thresh': 10.604840989867645, 'sideways_atr_min_pct': 0.02184230389233795, 'sideways_atr_max_pct': 0.047898863085188446, 'sideways_tp_mult': 1.8307438120007753, 'sideways_tsl_mult': 0.6505817296980283, 'sideways_time_stop': 183, 'sideways_use_sma': True, 'sideways_use_ema': False, 'sideways_use_atr': False, 'sideways_use_adx': False, 'sideways_use_spike': True, 'sideways_rsi_required': False}.
[I 2025-08-31 02:22:59,971] Trial 481 finished with values: [-0.01820422769329122, 0.018111642441934365] and parameters: {'p_sma': 53, 'p_std': 44, 'p_atr': 27, 'p_adx': 26, 'rsi_period': 64, 'ema1': 5, 'ema2': 21, 'slip_atr_k': 0.01492275480810659, 'slip_spread_k': 0.16731336327479143, 'spread_hl_frac': 0.006234871038316572, 'bb_std_mult': 1.7041097781930818, 'rsi_os': 39, 'rsi_ob': 70, 'vol_spike': 0.18343872732993954, 'adx_thresh': 20.23479189908486, 'atr_min_pct': 0.007716503579466808, 'atr_max_pct': 0.11352418169128346, 'tp_mult': 1.0228470916083936, 'tsl_mult': 0.05253289324053514, 'strategy': 'mean_reversion', 'time_stop': 101, 'use_sma': True, 'use_atr': False, 'use_adx': False, 'use_ema': False, 'use_spike': False, 'rsi_required': True, 'edge_k': 0.5763063936317574, 'edge_cap': 0.1682101013656902, 'bull_strategy': 'mean_reversion', 'bull_bb_std_mult': 2.5893025819256255, 'bull_rsi_os': 17, 'bull_rsi_ob': 80, 'bull_adx_thresh': 6.613001545905088, 'bull_atr_min_pct': 0.00010795399771588559, 'bull_atr_max_pct': 0.14197983712550083, 'bull_tp_mult': 2.2959619918014496, 'bull_tsl_mult': 0.2846745872706057, 'bull_time_stop': 153, 'bull_use_sma': False, 'bull_use_ema': False, 'bull_use_atr': False, 'bull_use_adx': True, 'bull_use_spike': True, 'bull_rsi_required': True, 'bear_strategy': 'breakout', 'bear_bb_std_mult': 1.3943941874778987, 'bear_rsi_os': 18, 'bear_rsi_ob': 45, 'bear_adx_thresh': 5.385948758978568, 'bear_atr_min_pct': 0.007447911314146707, 'bear_atr_max_pct': 0.011970910072076044, 'bear_tp_mult': 2.070737745100669, 'bear_tsl_mult': 0.7382491381676575, 'bear_time_stop': 9, 'bear_use_sma': False, 'bear_use_ema': False, 'bear_use_atr': False, 'bear_use_adx': True, 'bear_use_spike': False, 'bear_rsi_required': True, 'sideways_strategy': 'mean_reversion', 'sideways_bb_std_mult': 0.660154100465163, 'sideways_rsi_os': 41, 'sideways_rsi_ob': 94, 'sideways_adx_thresh': 10.658237529682404, 'sideways_atr_min_pct': 0.01744865151120367, 'sideways_atr_max_pct': 0.046518161321104735, 'sideways_tp_mult': 1.8242643670398144, 'sideways_tsl_mult': 0.6523943892689696, 'sideways_time_stop': 183, 'sideways_use_sma': False, 'sideways_use_ema': False, 'sideways_use_atr': False, 'sideways_use_adx': False, 'sideways_use_spike': True, 'sideways_rsi_required': False}.
[I 2025-08-31 02:23:00,141] Trial 482 finished with values: [-0.01348775777491995, 0.013465505154073564] and parameters: {'p_sma': 54, 'p_std': 44, 'p_atr': 28, 'p_adx': 26, 'rsi_period': 65, 'ema1': 5, 'ema2': 22, 'slip_atr_k': 0.011664034489992522, 'slip_spread_k': 0.16210479275218942, 'spread_hl_frac': 0.005137497332166117, 'bb_std_mult': 1.7127263762546376, 'rsi_os': 39, 'rsi_ob': 71, 'vol_spike': 0.18339094479886425, 'adx_thresh': 20.322437401139286, 'atr_min_pct': 0.007800672539019239, 'atr_max_pct': 0.11779474643847654, 'tp_mult': 1.01158868823434, 'tsl_mult': 0.06828706812928984, 'strategy': 'mean_reversion', 'time_stop': 101, 'use_sma': True, 'use_atr': False, 'use_adx': False, 'use_ema': False, 'use_spike': False, 'rsi_required': True, 'edge_k': 0.5619141541277448, 'edge_cap': 0.14545333741677208, 'bull_strategy': 'breakout', 'bull_bb_std_mult': 2.511976233922546, 'bull_rsi_os': 49, 'bull_rsi_ob': 61, 'bull_adx_thresh': 6.3072611016293605, 'bull_atr_min_pct': 0.0002435125155799266, 'bull_atr_max_pct': 0.14712542098216577, 'bull_tp_mult': 2.2810988228684614, 'bull_tsl_mult': 0.2799209988474687, 'bull_time_stop': 143, 'bull_use_sma': False, 'bull_use_ema': False, 'bull_use_atr': False, 'bull_use_adx': True, 'bull_use_spike': True, 'bull_rsi_required': True, 'bear_strategy': 'mean_reversion', 'bear_bb_std_mult': 1.3779020055914957, 'bear_rsi_os': 18, 'bear_rsi_ob': 45, 'bear_adx_thresh': 5.243839342854692, 'bear_atr_min_pct': 0.006880520238252491, 'bear_atr_max_pct': 0.01032743963767455, 'bear_tp_mult': 2.0620419728221715, 'bear_tsl_mult': 0.7235350176189025, 'bear_time_stop': 7, 'bear_use_sma': False, 'bear_use_ema': False, 'bear_use_atr': False, 'bear_use_adx': True, 'bear_use_spike': False, 'bear_rsi_required': True, 'sideways_strategy': 'mean_reversion', 'sideways_bb_std_mult': 0.6501452522543475, 'sideways_rsi_os': 41, 'sideways_rsi_ob': 95, 'sideways_adx_thresh': 10.544733139324624, 'sideways_atr_min_pct': 0.027031999030012736, 'sideways_atr_max_pct': 0.049381298835227065, 'sideways_tp_mult': 1.8261759252571323, 'sideways_tsl_mult': 0.6506897144966062, 'sideways_time_stop': 187, 'sideways_use_sma': True, 'sideways_use_ema': False, 'sideways_use_atr': False, 'sideways_use_adx': False, 'sideways_use_spike': True, 'sideways_rsi_required': False}.
[I 2025-08-31 02:23:00,414] Trial 480 finished with values: [-0.018853475046113677, 0.018761005933983596] and parameters: {'p_sma': 52, 'p_std': 43, 'p_atr': 27, 'p_adx': 26, 'rsi_period': 65, 'ema1': 5, 'ema2': 23, 'slip_atr_k': 0.014111881060660143, 'slip_spread_k': 0.17881403223923403, 'spread_hl_frac': 0.00600395340772932, 'bb_std_mult': 1.833650531066825, 'rsi_os': 39, 'rsi_ob': 70, 'vol_spike': 0.1878033456967662, 'adx_thresh': 20.815354233336627, 'atr_min_pct': 0.007578901592428562, 'atr_max_pct': 0.11427044723953089, 'tp_mult': 1.065341189408385, 'tsl_mult': 0.057821096712598385, 'strategy': 'mean_reversion', 'time_stop': 98, 'use_sma': True, 'use_atr': False, 'use_adx': False, 'use_ema': False, 'use_spike': False, 'rsi_required': True, 'edge_k': 0.5922628495767528, 'edge_cap': 0.089722331054913, 'bull_strategy': 'mean_reversion', 'bull_bb_std_mult': 2.5968544574345884, 'bull_rsi_os': 37, 'bull_rsi_ob': 69, 'bull_adx_thresh': 6.603360689795024, 'bull_atr_min_pct': 0.0001496588112502066, 'bull_atr_max_pct': 0.13761777145774118, 'bull_tp_mult': 2.324948723440439, 'bull_tsl_mult': 0.28443445507964477, 'bull_time_stop': 150, 'bull_use_sma': False, 'bull_use_ema': False, 'bull_use_atr': False, 'bull_use_adx': True, 'bull_use_spike': True, 'bull_rsi_required': True, 'bear_strategy': 'breakout', 'bear_bb_std_mult': 1.3563929692893524, 'bear_rsi_os': 18, 'bear_rsi_ob': 45, 'bear_adx_thresh': 5.811237467412333, 'bear_atr_min_pct': 0.006937651032829078, 'bear_atr_max_pct': 0.01056993852370516, 'bear_tp_mult': 2.0918275221731877, 'bear_tsl_mult': 0.7395915341677309, 'bear_time_stop': 9, 'bear_use_sma': False, 'bear_use_ema': False, 'bear_use_atr': False, 'bear_use_adx': True, 'bear_use_spike': False, 'bear_rsi_required': True, 'sideways_strategy': 'mean_reversion', 'sideways_bb_std_mult': 0.5029443456100819, 'sideways_rsi_os': 42, 'sideways_rsi_ob': 94, 'sideways_adx_thresh': 10.295084780581307, 'sideways_atr_min_pct': 0.021956492674344796, 'sideways_atr_max_pct': 0.04556556136837549, 'sideways_tp_mult': 1.8325424370655863, 'sideways_tsl_mult': 0.6495061063029629, 'sideways_time_stop': 187, 'sideways_use_sma': False, 'sideways_use_ema': False, 'sideways_use_atr': False, 'sideways_use_adx': False, 'sideways_use_spike': True, 'sideways_rsi_required': False}.
[I 2025-08-31 02:23:33,077] Trial 484 finished with values: [-0.01410637180868124, 0.01403722157460236] and parameters: {'p_sma': 54, 'p_std': 45, 'p_atr': 27, 'p_adx': 26, 'rsi_period': 70, 'ema1': 5, 'ema2': 24, 'slip_atr_k': 0.008186661310797903, 'slip_spread_k': 0.16100609884928602, 'spread_hl_frac': 0.004834568763666546, 'bb_std_mult': 1.6901960817288588, 'rsi_os': 37, 'rsi_ob': 68, 'vol_spike': 0.18346970056738676, 'adx_thresh': 20.161632880067856, 'atr_min_pct': 0.00760487440165569, 'atr_max_pct': 0.11286579923598476, 'tp_mult': 1.0340833628748776, 'tsl_mult': 0.015846765370018112, 'strategy': 'mean_reversion', 'time_stop': 115, 'use_sma': True, 'use_atr': False, 'use_adx': False, 'use_ema': False, 'use_spike': False, 'rsi_required': True, 'edge_k': 0.5648128321774294, 'edge_cap': 0.10594397062851084, 'bull_strategy': 'breakout', 'bull_bb_std_mult': 2.494436415052506, 'bull_rsi_os': 14, 'bull_rsi_ob': 61, 'bull_adx_thresh': 9.391662935204126, 'bull_atr_min_pct': 6.419758194656586e-05, 'bull_atr_max_pct': 0.14052031621313368, 'bull_tp_mult': 2.2716293673178543, 'bull_tsl_mult': 0.27999847468275635, 'bull_time_stop': 135, 'bull_use_sma': False, 'bull_use_ema': False, 'bull_use_atr': False, 'bull_use_adx': True, 'bull_use_spike': True, 'bull_rsi_required': True, 'bear_strategy': 'mean_reversion', 'bear_bb_std_mult': 1.3945424743707486, 'bear_rsi_os': 18, 'bear_rsi_ob': 45, 'bear_adx_thresh': 5.500708625655321, 'bear_atr_min_pct': 0.006321452362016202, 'bear_atr_max_pct': 0.011313515851746225, 'bear_tp_mult': 2.107616182762648, 'bear_tsl_mult': 0.7798581636289249, 'bear_time_stop': 6, 'bear_use_sma': False, 'bear_use_ema': False, 'bear_use_atr': False, 'bear_use_adx': True, 'bear_use_spike': False, 'bear_rsi_required': True, 'sideways_strategy': 'mean_reversion', 'sideways_bb_std_mult': 0.609480814096942, 'sideways_rsi_os': 37, 'sideways_rsi_ob': 95, 'sideways_adx_thresh': 9.88796386646473, 'sideways_atr_min_pct': 0.02275630008376514, 'sideways_atr_max_pct': 0.049172808733381194, 'sideways_tp_mult': 1.8374184453626845, 'sideways_tsl_mult': 0.58295783820956, 'sideways_time_stop': 188, 'sideways_use_sma': True, 'sideways_use_ema': False, 'sideways_use_atr': False, 'sideways_use_adx': False, 'sideways_use_spike': True, 'sideways_rsi_required': False}.
[I 2025-08-31 02:23:33,953] Trial 486 finished with values: [-0.01557166778209318, 0.01550241745559622] and parameters: {'p_sma': 55, 'p_std': 46, 'p_atr': 28, 'p_adx': 26, 'rsi_period': 66, 'ema1': 5, 'ema2': 24, 'slip_atr_k': 0.008622643145421079, 'slip_spread_k': 0.14931740763903456, 'spread_hl_frac': 0.004534936185822623, 'bb_std_mult': 1.6571665644135776, 'rsi_os': 39, 'rsi_ob': 70, 'vol_spike': 0.1828943881450672, 'adx_thresh': 20.24955265177901, 'atr_min_pct': 0.007745751686919966, 'atr_max_pct': 0.11860260663980368, 'tp_mult': 1.0397551925011546, 'tsl_mult': 0.02660100268528963, 'strategy': 'mean_reversion', 'time_stop': 114, 'use_sma': True, 'use_atr': False, 'use_adx': False, 'use_ema': False, 'use_spike': False, 'rsi_required': True, 'edge_k': 0.5166107007953036, 'edge_cap': 0.13991554194895664, 'bull_strategy': 'breakout', 'bull_bb_std_mult': 2.432374045016975, 'bull_rsi_os': 49, 'bull_rsi_ob': 61, 'bull_adx_thresh': 6.420391787282841, 'bull_atr_min_pct': 0.00015984333456958399, 'bull_atr_max_pct': 0.14714464279403372, 'bull_tp_mult': 2.2709997911578585, 'bull_tsl_mult': 0.2796814273355921, 'bull_time_stop': 136, 'bull_use_sma': False, 'bull_use_ema': False, 'bull_use_atr': False, 'bull_use_adx': True, 'bull_use_spike': True, 'bull_rsi_required': True, 'bear_strategy': 'mean_reversion', 'bear_bb_std_mult': 1.3967020400657786, 'bear_rsi_os': 14, 'bear_rsi_ob': 45, 'bear_adx_thresh': 5.170733800080031, 'bear_atr_min_pct': 0.00533364181440573, 'bear_atr_max_pct': 0.010320509532310772, 'bear_tp_mult': 2.118372703320255, 'bear_tsl_mult': 0.7697187657073675, 'bear_time_stop': 5, 'bear_use_sma': False, 'bear_use_ema': False, 'bear_use_atr': False, 'bear_use_adx': True, 'bear_use_spike': False, 'bear_rsi_required': True, 'sideways_strategy': 'mean_reversion', 'sideways_bb_std_mult': 0.6306340881296303, 'sideways_rsi_os': 38, 'sideways_rsi_ob': 95, 'sideways_adx_thresh': 9.721542452240612, 'sideways_atr_min_pct': 0.026855594173516333, 'sideways_atr_max_pct': 0.05012482782933493, 'sideways_tp_mult': 1.8488957001794133, 'sideways_tsl_mult': 0.6332169793557443, 'sideways_time_stop': 190, 'sideways_use_sma': True, 'sideways_use_ema': False, 'sideways_use_atr': False, 'sideways_use_adx': False, 'sideways_use_spike': True, 'sideways_rsi_required': False}.
