[I 2025-08-31 02:33:51,467] Trial 557 finished with values: [-1000000000.0, 1000000000.0] and parameters: {'p_sma': 53, 'p_std': 54, 'p_atr': 28, 'p_adx': 22, 'rsi_period': 72, 'ema1': 6, 'ema2': 33, 'slip_atr_k': 0.11562714937757503, 'slip_spread_k': 0.1402721864466628, 'spread_hl_frac': 0.0017040015709870683, 'bb_std_mult': 3.1217893447808027, 'rsi_os': 39, 'rsi_ob': 68, 'vol_spike': 0.09448721207523386, 'adx_thresh': 23.241246277500892, 'atr_min_pct': 0.009634560956044171, 'atr_max_pct': 0.13209707581937233, 'tp_mult': 1.1776263931357729, 'tsl_mult': 0.3123069900995126, 'strategy': 'mean_reversion', 'time_stop': 110, 'use_sma': True, 'use_atr': False, 'use_adx': False, 'use_ema': False, 'use_spike': False, 'rsi_required': True, 'edge_k': 0.4223746250435797, 'edge_cap': 0.1240318051108103, 'bull_strategy': 'breakout', 'bull_bb_std_mult': 2.367097680566924, 'bull_rsi_os': 43, 'bull_rsi_ob': 65, 'bull_adx_thresh': 6.277605119538045, 'bull_atr_min_pct': 0.007863906901701294, 'bull_atr_max_pct': 0.13954130845806528, 'bull_tp_mult': 2.352268020685556, 'bull_tsl_mult': 0.28974967472256774, 'bull_time_stop': 115, 'bull_use_sma': True, 'bull_use_ema': False, 'bull_use_atr': False, 'bull_use_adx': False, 'bull_use_spike': True, 'bull_rsi_required': True, 'bear_strategy': 'mean_reversion', 'bear_bb_std_mult': 1.2758049850455084, 'bear_rsi_os': 17, 'bear_rsi_ob': 45, 'bear_adx_thresh': 6.207293407675419, 'bear_atr_min_pct': 0.005624160034435984, 'bear_atr_max_pct': 0.08990134786653221, 'bear_tp_mult': 2.0684568307893625, 'bear_tsl_mult': 0.48725403789550953, 'bear_time_stop': 16, 'bear_use_sma': False, 'bear_use_ema': False, 'bear_use_atr': False, 'bear_use_adx': True, 'bear_use_spike': False, 'bear_rsi_required': True, 'sideways_strategy': 'breakout', 'sideways_bb_std_mult': 0.5648792932568932, 'sideways_rsi_os': 41, 'sideways_rsi_ob': 94, 'sideways_adx_thresh': 8.684395162759659, 'sideways_atr_min_pct': 0.02895877917620384, 'sideways_atr_max_pct': 0.05964894610909974, 'sideways_tp_mult': 1.610025917017889, 'sideways_tsl_mult': 0.6240837187390101, 'sideways_time_stop': 227, 'sideways_use_sma': True, 'sideways_use_ema': False, 'sideways_use_atr': False, 'sideways_use_adx': False, 'sideways_use_spike': True, 'sideways_rsi_required': False}.
[I 2025-08-31 02:33:51,748] Trial 556 finished with values: [-1000000000.0, 1000000000.0] and parameters: {'p_sma': 53, 'p_std': 54, 'p_atr': 28, 'p_adx': 17, 'rsi_period': 68, 'ema1': 6, 'ema2': 33, 'slip_atr_k': 0.08789226761431457, 'slip_spread_k': 0.15374422245655844, 'spread_hl_frac': 0.003614918476842651, 'bb_std_mult': 1.5916022056751424, 'rsi_os': 39, 'rsi_ob': 65, 'vol_spike': 0.19106136586417988, 'adx_thresh': 22.038245974623784, 'atr_min_pct': 0.025085228052031283, 'atr_max_pct': 0.13054893009705928, 'tp_mult': 1.1767122588661687, 'tsl_mult': 0.38887584046706225, 'strategy': 'mean_reversion', 'time_stop': 111, 'use_sma': True, 'use_atr': False, 'use_adx': False, 'use_ema': False, 'use_spike': False, 'rsi_required': True, 'edge_k': 0.42264307291305114, 'edge_cap': 0.14316153380130675, 'bull_strategy': 'breakout', 'bull_bb_std_mult': 1.7764761334964356, 'bull_rsi_os': 43, 'bull_rsi_ob': 65, 'bull_adx_thresh': 5.046455422892776, 'bull_atr_min_pct': 0.008920544101894837, 'bull_atr_max_pct': 0.13832310684945523, 'bull_tp_mult': 2.3521195273403332, 'bull_tsl_mult': 0.5277802729717954, 'bull_time_stop': 119, 'bull_use_sma': True, 'bull_use_ema': False, 'bull_use_atr': False, 'bull_use_adx': True, 'bull_use_spike': True, 'bull_rsi_required': True, 'bear_strategy': 'breakout', 'bear_bb_std_mult': 1.3544646370176328, 'bear_rsi_os': 16, 'bear_rsi_ob': 45, 'bear_adx_thresh': 6.145123449904035, 'bear_atr_min_pct': 0.005732877117464969, 'bear_atr_max_pct': 0.010131159093820183, 'bear_tp_mult': 2.062541588493746, 'bear_tsl_mult': 0.4849339685820033, 'bear_time_stop': 15, 'bear_use_sma': False, 'bear_use_ema': False, 'bear_use_atr': False, 'bear_use_adx': True, 'bear_use_spike': True, 'bear_rsi_required': True, 'sideways_strategy': 'breakout', 'sideways_bb_std_mult': 0.5047007716306209, 'sideways_rsi_os': 41, 'sideways_rsi_ob': 94, 'sideways_adx_thresh': 7.239180383475052, 'sideways_atr_min_pct': 0.02605153267065526, 'sideways_atr_max_pct': 0.05906945528966756, 'sideways_tp_mult': 1.7441698528795142, 'sideways_tsl_mult': 0.048273685860369064, 'sideways_time_stop': 224, 'sideways_use_sma': True, 'sideways_use_ema': True, 'sideways_use_atr': False, 'sideways_use_adx': False, 'sideways_use_spike': True, 'sideways_rsi_required': False}.
[I 2025-08-31 02:34:25,952] Trial 563 finished with values: [-1000000000.0, 1000000000.0] and parameters: {'p_sma': 55, 'p_std': 51, 'p_atr': 28, 'p_adx': 21, 'rsi_period': 68, 'ema1': 5, 'ema2': 38, 'slip_atr_k': 0.19901965698077828, 'slip_spread_k': 0.08802763341164613, 'spread_hl_frac': 1.3525923741758341e-05, 'bb_std_mult': 0.8321353686318702, 'rsi_os': 42, 'rsi_ob': 89, 'vol_spike': 0.1251123239410876, 'adx_thresh': 18.99658919685949, 'atr_min_pct': 0.007907112398186603, 'atr_max_pct': 0.1232862784784465, 'tp_mult': 2.2516814118162123, 'tsl_mult': 0.5504201324164767, 'strategy': 'mean_reversion', 'time_stop': 132, 'use_sma': False, 'use_atr': False, 'use_adx': False, 'use_ema': False, 'use_spike': False, 'rsi_required': True, 'edge_k': 0.5454135558703412, 'edge_cap': 0.17482533401580516, 'bull_strategy': 'mean_reversion', 'bull_bb_std_mult': 1.852025224974825, 'bull_rsi_os': 18, 'bull_rsi_ob': 59, 'bull_adx_thresh': 7.194824958673199, 'bull_atr_min_pct': 0.006766966476145617, 'bull_atr_max_pct': 0.14499341589127915, 'bull_tp_mult': 2.2390085838305054, 'bull_tsl_mult': 0.2143923126652011, 'bull_time_stop': 133, 'bull_use_sma': True, 'bull_use_ema': False, 'bull_use_atr': False, 'bull_use_adx': True, 'bull_use_spike': True, 'bull_rsi_required': True, 'bear_strategy': 'mean_reversion', 'bear_bb_std_mult': 1.4472325634220453, 'bear_rsi_os': 18, 'bear_rsi_ob': 47, 'bear_adx_thresh': 5.3832031019286, 'bear_atr_min_pct': 0.007029039516679379, 'bear_atr_max_pct': 0.016285945200224833, 'bear_tp_mult': 2.215288358770532, 'bear_tsl_mult': 0.5347131927429221, 'bear_time_stop': 5, 'bear_use_sma': False, 'bear_use_ema': False, 'bear_use_atr': True, 'bear_use_adx': True, 'bear_use_spike': False, 'bear_rsi_required': True, 'sideways_strategy': 'breakout', 'sideways_bb_std_mult': 0.6446697345333072, 'sideways_rsi_os': 40, 'sideways_rsi_ob': 93, 'sideways_adx_thresh': 9.312669083799534, 'sideways_atr_min_pct': 0.025126992239285925, 'sideways_atr_max_pct': 0.05121696102135347, 'sideways_tp_mult': 1.7768824168451276, 'sideways_tsl_mult': 0.2500791131943565, 'sideways_time_stop': 195, 'sideways_use_sma': True, 'sideways_use_ema': False, 'sideways_use_atr': False, 'sideways_use_adx': False, 'sideways_use_spike': False, 'sideways_rsi_required': True}.
[I 2025-08-31 02:34:25,953] Trial 560 finished with values: [-1000000000.0, 1000000000.0] and parameters: {'p_sma': 54, 'p_std': 51, 'p_atr': 28, 'p_adx': 23, 'rsi_period': 68, 'ema1': 5, 'ema2': 37, 'slip_atr_k': 0.16073021621471392, 'slip_spread_k': 0.16620572061889827, 'spread_hl_frac': 0.00320249107307925, 'bb_std_mult': 0.8501886950854673, 'rsi_os': 38, 'rsi_ob': 68, 'vol_spike': 0.18877187703490003, 'adx_thresh': 22.11731386198469, 'atr_min_pct': 0.00953243328942437, 'atr_max_pct': 0.1156381328988733, 'tp_mult': 1.5303573734506173, 'tsl_mult': 0.4035138802277021, 'strategy': 'mean_reversion', 'time_stop': 133, 'use_sma': True, 'use_atr': False, 'use_adx': False, 'use_ema': False, 'use_spike': False, 'rsi_required': True, 'edge_k': 0.41942079619473505, 'edge_cap': 0.14532610941261453, 'bull_strategy': 'breakout', 'bull_bb_std_mult': 2.199974312626103, 'bull_rsi_os': 33, 'bull_rsi_ob': 59, 'bull_adx_thresh': 6.359753168873551, 'bull_atr_min_pct': 0.019036193721627584, 'bull_atr_max_pct': 0.13917120881734868, 'bull_tp_mult': 2.2355361673548164, 'bull_tsl_mult': 0.7732634627576449, 'bull_time_stop': 118, 'bull_use_sma': True, 'bull_use_ema': False, 'bull_use_atr': False, 'bull_use_adx': True, 'bull_use_spike': True, 'bull_rsi_required': True, 'bear_strategy': 'mean_reversion', 'bear_bb_std_mult': 1.3475413168019248, 'bear_rsi_os': 18, 'bear_rsi_ob': 45, 'bear_adx_thresh': 5.542680698625493, 'bear_atr_min_pct': 0.0044882585095664, 'bear_atr_max_pct': 0.016702679836899773, 'bear_tp_mult': 2.0595640517463276, 'bear_tsl_mult': 0.5394281092928669, 'bear_time_stop': 218, 'bear_use_sma': False, 'bear_use_ema': False, 'bear_use_atr': False, 'bear_use_adx': True, 'bear_use_spike': False, 'bear_rsi_required': True, 'sideways_strategy': 'breakout', 'sideways_bb_std_mult': 0.5684760162342126, 'sideways_rsi_os': 39, 'sideways_rsi_ob': 94, 'sideways_adx_thresh': 9.688847481330605, 'sideways_atr_min_pct': 0.02713911680871051, 'sideways_atr_max_pct': 0.05141816792144495, 'sideways_tp_mult': 1.7539721992435529, 'sideways_tsl_mult': 0.16177044729215084, 'sideways_time_stop': 197, 'sideways_use_sma': True, 'sideways_use_ema': False, 'sideways_use_atr': False, 'sideways_use_adx': False, 'sideways_use_spike': True, 'sideways_rsi_required': False}.
[I 2025-08-31 02:34:26,522] Trial 561 finished with values: [-1000000000.0, 1000000000.0] and parameters: {'p_sma': 54, 'p_std': 51, 'p_atr': 28, 'p_adx': 28, 'rsi_period': 76, 'ema1': 5, 'ema2': 37, 'slip_atr_k': 0.11488513712512306, 'slip_spread_k': 0.1703640624616848, 'spread_hl_frac': 0.0017141197297809452, 'bb_std_mult': 2.9434091409821987, 'rsi_os': 38, 'rsi_ob': 68, 'vol_spike': 0.05603982944567516, 'adx_thresh': 22.951782080222255, 'atr_min_pct': 0.009826417191454731, 'atr_max_pct': 0.12492254480168756, 'tp_mult': 1.659865927845306, 'tsl_mult': 0.39993541970409824, 'strategy': 'mean_reversion', 'time_stop': 111, 'use_sma': True, 'use_atr': False, 'use_adx': False, 'use_ema': False, 'use_spike': False, 'rsi_required': True, 'edge_k': 0.43887553930657264, 'edge_cap': 0.14414928145285805, 'bull_strategy': 'breakout', 'bull_bb_std_mult': 1.8363174262536963, 'bull_rsi_os': 55, 'bull_rsi_ob': 63, 'bull_adx_thresh': 6.466158226280681, 'bull_atr_min_pct': 0.01667650346621445, 'bull_atr_max_pct': 0.1380799771237517, 'bull_tp_mult': 2.228357911210626, 'bull_tsl_mult': 0.7793720316379658, 'bull_time_stop': 121, 'bull_use_sma': True, 'bull_use_ema': False, 'bull_use_atr': False, 'bull_use_adx': True, 'bull_use_spike': True, 'bull_rsi_required': True, 'bear_strategy': 'mean_reversion', 'bear_bb_std_mult': 1.339688426871816, 'bear_rsi_os': 18, 'bear_rsi_ob': 45, 'bear_adx_thresh': 5.494633269495028, 'bear_atr_min_pct': 0.004640854391289729, 'bear_atr_max_pct': 0.015513112495326468, 'bear_tp_mult': 2.0685166277493083, 'bear_tsl_mult': 0.5324147038325346, 'bear_time_stop': 18, 'bear_use_sma': False, 'bear_use_ema': False, 'bear_use_atr': False, 'bear_use_adx': True, 'bear_use_spike': False, 'bear_rsi_required': True, 'sideways_strategy': 'breakout', 'sideways_bb_std_mult': 0.5630606488034203, 'sideways_rsi_os': 40, 'sideways_rsi_ob': 94, 'sideways_adx_thresh': 8.89726091836354, 'sideways_atr_min_pct': 0.026868671874104466, 'sideways_atr_max_pct': 0.050803116283715165, 'sideways_tp_mult': 1.7870304914733324, 'sideways_tsl_mult': 0.6581827441123388, 'sideways_time_stop': 196, 'sideways_use_sma': True, 'sideways_use_ema': False, 'sideways_use_atr': False, 'sideways_use_adx': False, 'sideways_use_spike': True, 'sideways_rsi_required': False}.
[I 2025-08-31 02:34:26,642] Trial 562 finished with values: [-1000000000.0, 1000000000.0] and parameters: {'p_sma': 54, 'p_std': 51, 'p_atr': 28, 'p_adx': 20, 'rsi_period': 76, 'ema1': 5, 'ema2': 45, 'slip_atr_k': 0.08994126584168233, 'slip_spread_k': 0.16001973827471086, 'spread_hl_frac': 0.003153323076103085, 'bb_std_mult': 0.8524162266241566, 'rsi_os': 38, 'rsi_ob': 70, 'vol_spike': 0.28207234981949714, 'adx_thresh': 21.927404183397588, 'atr_min_pct': 0.00786754227966239, 'atr_max_pct': 0.11591758414901748, 'tp_mult': 1.3953188406835033, 'tsl_mult': 0.5598035829784167, 'strategy': 'mean_reversion', 'time_stop': 114, 'use_sma': True, 'use_atr': False, 'use_adx': False, 'use_ema': False, 'use_spike': False, 'rsi_required': True, 'edge_k': 0.528131321509385, 'edge_cap': 0.1443126196993927, 'bull_strategy': 'breakout', 'bull_bb_std_mult': 1.8179675193519025, 'bull_rsi_os': 18, 'bull_rsi_ob': 63, 'bull_adx_thresh': 7.2887588437845325, 'bull_atr_min_pct': 0.018965442591638234, 'bull_atr_max_pct': 0.14588805334291788, 'bull_tp_mult': 2.232957154472466, 'bull_tsl_mult': 0.7745085548461732, 'bull_time_stop': 120, 'bull_use_sma': True, 'bull_use_ema': False, 'bull_use_atr': False, 'bull_use_adx': True, 'bull_use_spike': True, 'bull_rsi_required': True, 'bear_strategy': 'mean_reversion', 'bear_bb_std_mult': 1.3335803828691661, 'bear_rsi_os': 19, 'bear_rsi_ob': 45, 'bear_adx_thresh': 5.489218515859592, 'bear_atr_min_pct': 0.004580169428137642, 'bear_atr_max_pct': 0.1027594342921264, 'bear_tp_mult': 2.084472412985079, 'bear_tsl_mult': 0.5202877748533795, 'bear_time_stop': 10, 'bear_use_sma': False, 'bear_use_ema': False, 'bear_use_atr': False, 'bear_use_adx': True, 'bear_use_spike': False, 'bear_rsi_required': True, 'sideways_strategy': 'breakout', 'sideways_bb_std_mult': 0.6265930299267367, 'sideways_rsi_os': 39, 'sideways_rsi_ob': 93, 'sideways_adx_thresh': 9.744827345982026, 'sideways_atr_min_pct': 0.027110168882438765, 'sideways_atr_max_pct': 0.0501221148218769, 'sideways_tp_mult': 1.758146689266333, 'sideways_tsl_mult': 0.04578500384365336, 'sideways_time_stop': 198, 'sideways_use_sma': True, 'sideways_use_ema': False, 'sideways_use_atr': False, 'sideways_use_adx': False, 'sideways_use_spike': True, 'sideways_rsi_required': False}.
[I 2025-08-31 02:35:00,280] Trial 564 finished with values: [-1000000000.0, 1000000000.0] and parameters: {'p_sma': 57, 'p_std': 50, 'p_atr': 27, 'p_adx': 28, 'rsi_period': 72, 'ema1': 5, 'ema2': 14, 'slip_atr_k': 0.1830240644363184, 'slip_spread_k': 0.18459029822388806, 'spread_hl_frac': 0.002673877409733946, 'bb_std_mult': 1.7699665859602207, 'rsi_os': 38, 'rsi_ob': 70, 'vol_spike': 0.1860135636296824, 'adx_thresh': 20.88031013668677, 'atr_min_pct': 0.008561361497877121, 'atr_max_pct': 0.12468404465104045, 'tp_mult': 2.29092261124027, 'tsl_mult': 0.3641217991753208, 'strategy': 'mean_reversion', 'time_stop': 106, 'use_sma': True, 'use_atr': True, 'use_adx': True, 'use_ema': False, 'use_spike': False, 'rsi_required': True, 'edge_k': 0.5986462682368238, 'edge_cap': 0.09422963067814069, 'bull_strategy': 'breakout', 'bull_bb_std_mult': 2.4044763345283275, 'bull_rsi_os': 45, 'bull_rsi_ob': 63, 'bull_adx_thresh': 5.653223707086284, 'bull_atr_min_pct': 0.014556494140482566, 'bull_atr_max_pct': 0.1362089800658347, 'bull_tp_mult': 2.2031013418286176, 'bull_tsl_mult': 0.8030196786857254, 'bull_time_stop': 139, 'bull_use_sma': True, 'bull_use_ema': True, 'bull_use_atr': False, 'bull_use_adx': True, 'bull_use_spike': True, 'bull_rsi_required': True, 'bear_strategy': 'mean_reversion', 'bear_bb_std_mult': 1.3112238502813127, 'bear_rsi_os': 18, 'bear_rsi_ob': 48, 'bear_adx_thresh': 5.494069616973087, 'bear_atr_min_pct': 0.006209259150927728, 'bear_atr_max_pct': 0.013568225967619136, 'bear_tp_mult': 2.0116818504493392, 'bear_tsl_mult': 0.5260007366137286, 'bear_time_stop': 18, 'bear_use_sma': False, 'bear_use_ema': False, 'bear_use_atr': False, 'bear_use_adx': True, 'bear_use_spike': False, 'bear_rsi_required': True, 'sideways_strategy': 'breakout', 'sideways_bb_std_mult': 0.614677325476447, 'sideways_rsi_os': 39, 'sideways_rsi_ob': 95, 'sideways_adx_thresh': 7.855708487289999, 'sideways_atr_min_pct': 0.027980124578317625, 'sideways_atr_max_pct': 0.05496309623614344, 'sideways_tp_mult': 1.6603712290220345, 'sideways_tsl_mult': 0.6484391513500515, 'sideways_time_stop': 201, 'sideways_use_sma': False, 'sideways_use_ema': False, 'sideways_use_atr': True, 'sideways_use_adx': False, 'sideways_use_spike': True, 'sideways_rsi_required': False}.
[I 2025-08-31 02:35:00,720] Trial 567 finished with values: [-1000000000.0, 1000000000.0] and parameters: {'p_sma': 53, 'p_std': 49, 'p_atr': 27, 'p_adx': 29, 'rsi_period': 73, 'ema1': 6, 'ema2': 40, 'slip_atr_k': 0.12824238666148716, 'slip_spread_k': 0.1875976127844045, 'spread_hl_frac': 0.0011325598058584511, 'bb_std_mult': 1.7304473916632002, 'rsi_os': 35, 'rsi_ob': 70, 'vol_spike': 0.18470952105937705, 'adx_thresh': 21.09893663582972, 'atr_min_pct': 0.028302186516061263, 'atr_max_pct': 0.11197260916590686, 'tp_mult': 1.3113959574945262, 'tsl_mult': 0.2067959937117107, 'strategy': 'mean_reversion', 'time_stop': 102, 'use_sma': False, 'use_atr': True, 'use_adx': True, 'use_ema': False, 'use_spike': True, 'rsi_required': True, 'edge_k': 0.5062900438556331, 'edge_cap': 0.08664106311350131, 'bull_strategy': 'mean_reversion', 'bull_bb_std_mult': 2.1493812507454324, 'bull_rsi_os': 45, 'bull_rsi_ob': 49, 'bull_adx_thresh': 6.03724221146816, 'bull_atr_min_pct': 0.01476815992138177, 'bull_atr_max_pct': 0.14173000025615373, 'bull_tp_mult': 2.3219646814442085, 'bull_tsl_mult': 0.2784940918576458, 'bull_time_stop': 139, 'bull_use_sma': True, 'bull_use_ema': True, 'bull_use_atr': False, 'bull_use_adx': True, 'bull_use_spike': True, 'bull_rsi_required': True, 'bear_strategy': 'mean_reversion', 'bear_bb_std_mult': 1.4333419088250108, 'bear_rsi_os': 15, 'bear_rsi_ob': 49, 'bear_adx_thresh': 6.122881762483294, 'bear_atr_min_pct': 0.006359820031328704, 'bear_atr_max_pct': 0.012790599222737249, 'bear_tp_mult': 2.1275284684545315, 'bear_tsl_mult': 0.5552902466746957, 'bear_time_stop': 10, 'bear_use_sma': False, 'bear_use_ema': True, 'bear_use_atr': True, 'bear_use_adx': True, 'bear_use_spike': True, 'bear_rsi_required': True, 'sideways_strategy': 'breakout', 'sideways_bb_std_mult': 0.6334914284782426, 'sideways_rsi_os': 38, 'sideways_rsi_ob': 95, 'sideways_adx_thresh': 7.872117271772355, 'sideways_atr_min_pct': 0.028184501390270664, 'sideways_atr_max_pct': 0.05355159934655182, 'sideways_tp_mult': 1.6588130910852688, 'sideways_tsl_mult': 0.296871863691223, 'sideways_time_stop': 206, 'sideways_use_sma': False, 'sideways_use_ema': False, 'sideways_use_atr': True, 'sideways_use_adx': False, 'sideways_use_spike': False, 'sideways_rsi_required': True}.
[I 2025-08-31 02:35:00,954] Trial 565 finished with values: [-1000000000.0, 1000000000.0] and parameters: {'p_sma': 54, 'p_std': 50, 'p_atr': 27, 'p_adx': 28, 'rsi_period': 76, 'ema1': 21, 'ema2': 28, 'slip_atr_k': 0.1291985188225355, 'slip_spread_k': 0.18635926184191418, 'spread_hl_frac': 0.0014593280875040615, 'bb_std_mult': 2.8478971605592025, 'rsi_os': 38, 'rsi_ob': 70, 'vol_spike': 0.1845929569709948, 'adx_thresh': 21.438138932546973, 'atr_min_pct': 0.008730712244892655, 'atr_max_pct': 0.11200316489254174, 'tp_mult': 2.088377338466147, 'tsl_mult': 0.3236362959488857, 'strategy': 'mean_reversion', 'time_stop': 105, 'use_sma': True, 'use_atr': True, 'use_adx': True, 'use_ema': False, 'use_spike': False, 'rsi_required': True, 'edge_k': 0.5825884086052248, 'edge_cap': 0.1628013850080613, 'bull_strategy': 'breakout', 'bull_bb_std_mult': 2.01615421395319, 'bull_rsi_os': 31, 'bull_rsi_ob': 49, 'bull_adx_thresh': 5.567830899019247, 'bull_atr_min_pct': 0.011047159243872017, 'bull_atr_max_pct': 0.13638964627048084, 'bull_tp_mult': 2.197878443330394, 'bull_tsl_mult': 0.799482309819965, 'bull_time_stop': 144, 'bull_use_sma': True, 'bull_use_ema': True, 'bull_use_atr': False, 'bull_use_adx': True, 'bull_use_spike': True, 'bull_rsi_required': True, 'bear_strategy': 'mean_reversion', 'bear_bb_std_mult': 1.3141963915308714, 'bear_rsi_os': 15, 'bear_rsi_ob': 48, 'bear_adx_thresh': 5.017026722537845, 'bear_atr_min_pct': 0.00631843441207275, 'bear_atr_max_pct': 0.01286819547577549, 'bear_tp_mult': 2.019471133433179, 'bear_tsl_mult': 0.519657161131151, 'bear_time_stop': 17, 'bear_use_sma': False, 'bear_use_ema': False, 'bear_use_atr': False, 'bear_use_adx': True, 'bear_use_spike': False, 'bear_rsi_required': True, 'sideways_strategy': 'breakout', 'sideways_bb_std_mult': 0.6240044173332148, 'sideways_rsi_os': 39, 'sideways_rsi_ob': 95, 'sideways_adx_thresh': 9.587664820653332, 'sideways_atr_min_pct': 0.028163769868287506, 'sideways_atr_max_pct': 0.053924461052869535, 'sideways_tp_mult': 1.6607196583837092, 'sideways_tsl_mult': 0.6532761057163917, 'sideways_time_stop': 205, 'sideways_use_sma': False, 'sideways_use_ema': False, 'sideways_use_atr': True, 'sideways_use_adx': False, 'sideways_use_spike': True, 'sideways_rsi_required': False}.
