[I 2025-08-31 00:09:52,666] Trial 63 finished with values: [-1000000000.0, 1000000000.0] and parameters: {'p_sma': 56, 'p_std': 10, 'p_atr': 28, 'p_adx': 25, 'rsi_period': 59, 'ema1': 18, 'ema2': 11, 'slip_atr_k': 0.007618731535420958, 'slip_spread_k': 0.07672739613401924, 'spread_hl_frac': 0.000100659891163625, 'bb_std_mult': 2.576287505421362, 'rsi_os': 37, 'rsi_ob': 90, 'vol_spike': 0.027977356402072474, 'adx_thresh': 28.547800622090797, 'atr_min_pct': 0.017734256271095268, 'atr_max_pct': 0.14146440610479044, 'tp_mult': 1.2134253847161034, 'tsl_mult': 0.10414026020177058, 'strategy': 'mean_reversion', 'time_stop': 215, 'use_sma': True, 'use_atr': True, 'use_adx': False, 'use_ema': False, 'use_spike': False, 'rsi_required': False, 'edge_k': 1.2175653348680888, 'edge_cap': 0.8154593162940258, 'bull_strategy': 'mean_reversion', 'bull_bb_std_mult': 0.5508447463789712, 'bull_rsi_os': 48, 'bull_rsi_ob': 75, 'bull_adx_thresh': 6.519875224650061, 'bull_atr_min_pct': 0.01837243595134073, 'bull_atr_max_pct': 0.10011009386455004, 'bull_tp_mult': 2.118733354447103, 'bull_tsl_mult': 0.19198733743604635, 'bull_time_stop': 129, 'bull_use_sma': True, 'bull_use_ema': True, 'bull_use_atr': True, 'bull_use_adx': False, 'bull_use_spike': False, 'bull_rsi_required': True, 'bear_strategy': 'mean_reversion', 'bear_bb_std_mult': 2.704523406575352, 'bear_rsi_os': 37, 'bear_rsi_ob': 80, 'bear_adx_thresh': 28.549437239717285, 'bear_atr_min_pct': 0.029832079642227224, 'bear_atr_max_pct': 0.061463629807857134, 'bear_tp_mult': 2.466245691850989, 'bear_tsl_mult': 0.4627885860051958, 'bear_time_stop': 237, 'bear_use_sma': False, 'bear_use_ema': False, 'bear_use_atr': False, 'bear_use_adx': False, 'bear_use_spike': False, 'bear_rsi_required': True, 'sideways_strategy': 'breakout', 'sideways_bb_std_mult': 1.9313922324139476, 'sideways_rsi_os': 29, 'sideways_rsi_ob': 69, 'sideways_adx_thresh': 24.984237309128723, 'sideways_atr_min_pct': 0.01774301973373986, 'sideways_atr_max_pct': 0.0824761088078761, 'sideways_tp_mult': 1.9589103147825189, 'sideways_tsl_mult': 0.09923925064292333, 'sideways_time_stop': 105, 'sideways_use_sma': False, 'sideways_use_ema': False, 'sideways_use_atr': True, 'sideways_use_adx': False, 'sideways_use_spike': True, 'sideways_rsi_required': True}.
[I 2025-08-31 00:09:52,974] Trial 64 finished with values: [-1000000000.0, 1000000000.0] and parameters: {'p_sma': 57, 'p_std': 30, 'p_atr': 7, 'p_adx': 25, 'rsi_period': 79, 'ema1': 30, 'ema2': 11, 'slip_atr_k': 0.2400415711733495, 'slip_spread_k': 0.07986336293079521, 'spread_hl_frac': 0.000289861641486068, 'bb_std_mult': 2.555644303735289, 'rsi_os': 36, 'rsi_ob': 90, 'vol_spike': 0.03428140257468351, 'adx_thresh': 8.297680353768552, 'atr_min_pct': 0.0177322298478624, 'atr_max_pct': 0.11177394634943644, 'tp_mult': 2.471884957854226, 'tsl_mult': 0.22494166389581582, 'strategy': 'mean_reversion', 'time_stop': 254, 'use_sma': True, 'use_atr': True, 'use_adx': False, 'use_ema': False, 'use_spike': False, 'rsi_required': False, 'edge_k': 1.1757151221396813, 'edge_cap': 0.8474274242981189, 'bull_strategy': 'mean_reversion', 'bull_bb_std_mult': 0.5005242414875389, 'bull_rsi_os': 48, 'bull_rsi_ob': 74, 'bull_adx_thresh': 6.341709510377254, 'bull_atr_min_pct': 0.01828949417916798, 'bull_atr_max_pct': 0.08980416595986496, 'bull_tp_mult': 2.0937868416067, 'bull_tsl_mult': 0.19937595014340542, 'bull_time_stop': 129, 'bull_use_sma': True, 'bull_use_ema': True, 'bull_use_atr': True, 'bull_use_adx': False, 'bull_use_spike': False, 'bull_rsi_required': True, 'bear_strategy': 'mean_reversion', 'bear_bb_std_mult': 2.6746292036508974, 'bear_rsi_os': 38, 'bear_rsi_ob': 49, 'bear_adx_thresh': 34.96651923891895, 'bear_atr_min_pct': 0.0034845935424535216, 'bear_atr_max_pct': 0.061745022594719735, 'bear_tp_mult': 2.47888406320018, 'bear_tsl_mult': 0.7495073286262482, 'bear_time_stop': 243, 'bear_use_sma': False, 'bear_use_ema': False, 'bear_use_atr': False, 'bear_use_adx': False, 'bear_use_spike': False, 'bear_rsi_required': True, 'sideways_strategy': 'breakout', 'sideways_bb_std_mult': 1.947734618108301, 'sideways_rsi_os': 29, 'sideways_rsi_ob': 70, 'sideways_adx_thresh': 30.04296026655205, 'sideways_atr_min_pct': 0.017911216506511618, 'sideways_atr_max_pct': 0.08318303343223338, 'sideways_tp_mult': 1.9660135109433494, 'sideways_tsl_mult': 0.11793657539632452, 'sideways_time_stop': 190, 'sideways_use_sma': False, 'sideways_use_ema': False, 'sideways_use_atr': True, 'sideways_use_adx': False, 'sideways_use_spike': True, 'sideways_rsi_required': True}.
[I 2025-08-31 00:09:53,219] Trial 65 finished with values: [-0.022896374558572852, 0.022818870255878077] and parameters: {'p_sma': 31, 'p_std': 27, 'p_atr': 17, 'p_adx': 21, 'rsi_period': 84, 'ema1': 18, 'ema2': 33, 'slip_atr_k': 0.2477266539504148, 'slip_spread_k': 0.48834899273480264, 'spread_hl_frac': 0.0002854781427013807, 'bb_std_mult': 2.2943717275155087, 'rsi_os': 9, 'rsi_ob': 77, 'vol_spike': 0.08382227747790472, 'adx_thresh': 23.1682023959651, 'atr_min_pct': 0.0034335137528349047, 'atr_max_pct': 0.1116138545142133, 'tp_mult': 2.0780272711151953, 'tsl_mult': 0.06675268050678493, 'strategy': 'breakout', 'time_stop': 174, 'use_sma': True, 'use_atr': True, 'use_adx': False, 'use_ema': False, 'use_spike': False, 'rsi_required': False, 'edge_k': 1.1796568670651815, 'edge_cap': 0.8109104413179935, 'bull_strategy': 'breakout', 'bull_bb_std_mult': 0.5239440764344081, 'bull_rsi_os': 48, 'bull_rsi_ob': 79, 'bull_adx_thresh': 10.896120771300648, 'bull_atr_min_pct': 0.00029891970522505747, 'bull_atr_max_pct': 0.07525004481067551, 'bull_tp_mult': 2.091427078113567, 'bull_tsl_mult': 0.5217198798192769, 'bull_time_stop': 129, 'bull_use_sma': True, 'bull_use_ema': True, 'bull_use_atr': False, 'bull_use_adx': False, 'bull_use_spike': False, 'bull_rsi_required': False, 'bear_strategy': 'breakout', 'bear_bb_std_mult': 0.990147295087392, 'bear_rsi_os': 21, 'bear_rsi_ob': 79, 'bear_adx_thresh': 34.69290419217398, 'bear_atr_min_pct': 0.014504807404252055, 'bear_atr_max_pct': 0.08999979824618587, 'bear_tp_mult': 2.4861288985012293, 'bear_tsl_mult': 0.7459152803938328, 'bear_time_stop': 168, 'bear_use_sma': False, 'bear_use_ema': False, 'bear_use_atr': False, 'bear_use_adx': True, 'bear_use_spike': False, 'bear_rsi_required': True, 'sideways_strategy': 'breakout', 'sideways_bb_std_mult': 2.45673054057273, 'sideways_rsi_os': 52, 'sideways_rsi_ob': 70, 'sideways_adx_thresh': 22.555351297509034, 'sideways_atr_min_pct': 0.016921462521504962, 'sideways_atr_max_pct': 0.11179859156470257, 'sideways_tp_mult': 1.991538547672046, 'sideways_tsl_mult': 0.11799037159580583, 'sideways_time_stop': 102, 'sideways_use_sma': False, 'sideways_use_ema': False, 'sideways_use_atr': False, 'sideways_use_adx': False, 'sideways_use_spike': True, 'sideways_rsi_required': True}.
[I 2025-08-31 00:09:53,456] Trial 66 finished with values: [-1000000000.0, 1000000000.0] and parameters: {'p_sma': 32, 'p_std': 27, 'p_atr': 14, 'p_adx': 21, 'rsi_period': 81, 'ema1': 18, 'ema2': 33, 'slip_atr_k': 0.1006751147351071, 'slip_spread_k': 0.5040841504305434, 'spread_hl_frac': 8.674530871855685e-05, 'bb_std_mult': 2.306216166646129, 'rsi_os': 8, 'rsi_ob': 77, 'vol_spike': 0.11500771162570754, 'adx_thresh': 22.546281865508128, 'atr_min_pct': 0.003879253029848151, 'atr_max_pct': 0.10730156965578687, 'tp_mult': 2.0942812755662654, 'tsl_mult': 0.06399075078642147, 'strategy': 'breakout', 'time_stop': 178, 'use_sma': True, 'use_atr': True, 'use_adx': False, 'use_ema': False, 'use_spike': False, 'rsi_required': False, 'edge_k': 1.1806699102834959, 'edge_cap': 0.9095823626252817, 'bull_strategy': 'breakout', 'bull_bb_std_mult': 0.5138904713310007, 'bull_rsi_os': 48, 'bull_rsi_ob': 79, 'bull_adx_thresh': 10.73003734607689, 'bull_atr_min_pct': 0.002167268994675531, 'bull_atr_max_pct': 0.07590662406001032, 'bull_tp_mult': 2.1028579643212737, 'bull_tsl_mult': 0.49647166944343063, 'bull_time_stop': 77, 'bull_use_sma': True, 'bull_use_ema': True, 'bull_use_atr': False, 'bull_use_adx': False, 'bull_use_spike': False, 'bull_rsi_required': False, 'bear_strategy': 'breakout', 'bear_bb_std_mult': 1.0019363943833552, 'bear_rsi_os': 21, 'bear_rsi_ob': 80, 'bear_adx_thresh': 34.78534342463865, 'bear_atr_min_pct': 0.016117564955726006, 'bear_atr_max_pct': 0.10591925212700834, 'bear_tp_mult': 2.554748081991848, 'bear_tsl_mult': 0.7467333338248929, 'bear_time_stop': 198, 'bear_use_sma': False, 'bear_use_ema': False, 'bear_use_atr': False, 'bear_use_adx': True, 'bear_use_spike': False, 'bear_rsi_required': True, 'sideways_strategy': 'breakout', 'sideways_bb_std_mult': 3.128787781535954, 'sideways_rsi_os': 53, 'sideways_rsi_ob': 70, 'sideways_adx_thresh': 22.63019832763578, 'sideways_atr_min_pct': 0.01747150441552815, 'sideways_atr_max_pct': 0.11279931370480484, 'sideways_tp_mult': 1.981761889671612, 'sideways_tsl_mult': 0.13023284958020176, 'sideways_time_stop': 168, 'sideways_use_sma': False, 'sideways_use_ema': False, 'sideways_use_atr': False, 'sideways_use_adx': False, 'sideways_use_spike': True, 'sideways_rsi_required': True}.
[I 2025-08-31 00:10:23,572] Trial 69 finished with values: [-1000000000.0, 1000000000.0] and parameters: {'p_sma': 32, 'p_std': 26, 'p_atr': 16, 'p_adx': 22, 'rsi_period': 71, 'ema1': 21, 'ema2': 33, 'slip_atr_k': 0.12192880684433104, 'slip_spread_k': 0.502161613181013, 'spread_hl_frac': 0.0014785929024064737, 'bb_std_mult': 2.2804058399459413, 'rsi_os': 8, 'rsi_ob': 76, 'vol_spike': 0.11409934536486141, 'adx_thresh': 23.366103407149357, 'atr_min_pct': 0.0033815333333865414, 'atr_max_pct': 0.013614655928603156, 'tp_mult': 2.092923778861406, 'tsl_mult': 0.017572467197319495, 'strategy': 'breakout', 'time_stop': 161, 'use_sma': False, 'use_atr': False, 'use_adx': False, 'use_ema': False, 'use_spike': False, 'rsi_required': True, 'edge_k': 0.9834642290669846, 'edge_cap': 0.9497052939557848, 'bull_strategy': 'breakout', 'bull_bb_std_mult': 3.1591521584254165, 'bull_rsi_os': 45, 'bull_rsi_ob': 81, 'bull_adx_thresh': 10.373700013688927, 'bull_atr_min_pct': 0.0021540736021785946, 'bull_atr_max_pct': 0.10196585154091319, 'bull_tp_mult': 1.9059206181777546, 'bull_tsl_mult': 0.5231470752380664, 'bull_time_stop': 76, 'bull_use_sma': True, 'bull_use_ema': True, 'bull_use_atr': False, 'bull_use_adx': False, 'bull_use_spike': False, 'bull_rsi_required': False, 'bear_strategy': 'breakout', 'bear_bb_std_mult': 0.9845228863945296, 'bear_rsi_os': 21, 'bear_rsi_ob': 74, 'bear_adx_thresh': 6.237576808799346, 'bear_atr_min_pct': 0.01665263036175008, 'bear_atr_max_pct': 0.10630281552406606, 'bear_tp_mult': 2.572054261884984, 'bear_tsl_mult': 0.7370010397183799, 'bear_time_stop': 167, 'bear_use_sma': False, 'bear_use_ema': False, 'bear_use_atr': True, 'bear_use_adx': True, 'bear_use_spike': False, 'bear_rsi_required': False, 'sideways_strategy': 'mean_reversion', 'sideways_bb_std_mult': 2.81114952844411, 'sideways_rsi_os': 53, 'sideways_rsi_ob': 62, 'sideways_adx_thresh': 22.655939605615654, 'sideways_atr_min_pct': 0.01640778645201107, 'sideways_atr_max_pct': 0.1140881191649292, 'sideways_tp_mult': 2.0955992479531207, 'sideways_tsl_mult': 0.16939525954133505, 'sideways_time_stop': 137, 'sideways_use_sma': False, 'sideways_use_ema': False, 'sideways_use_atr': False, 'sideways_use_adx': False, 'sideways_use_spike': False, 'sideways_rsi_required': True}.
[I 2025-08-31 00:10:24,047] Trial 70 finished with values: [-1000000000.0, 1000000000.0] and parameters: {'p_sma': 29, 'p_std': 32, 'p_atr': 16, 'p_adx': 21, 'rsi_period': 71, 'ema1': 21, 'ema2': 25, 'slip_atr_k': 0.22368560548391003, 'slip_spread_k': 0.35433955880118984, 'spread_hl_frac': 0.0020387722994222894, 'bb_std_mult': 2.084472217647886, 'rsi_os': 12, 'rsi_ob': 82, 'vol_spike': 0.13025368399792525, 'adx_thresh': 24.023901770020665, 'atr_min_pct': 0.002607046408115557, 'atr_max_pct': 0.011121124608030095, 'tp_mult': 2.3816748286563225, 'tsl_mult': 0.004071247633181403, 'strategy': 'breakout', 'time_stop': 158, 'use_sma': False, 'use_atr': False, 'use_adx': False, 'use_ema': False, 'use_spike': False, 'rsi_required': True, 'edge_k': 1.0101131020967438, 'edge_cap': 0.7236175717700999, 'bull_strategy': 'breakout', 'bull_bb_std_mult': 3.1318886667013888, 'bull_rsi_os': 45, 'bull_rsi_ob': 85, 'bull_adx_thresh': 21.193586457618665, 'bull_atr_min_pct': 0.0008388697200321055, 'bull_atr_max_pct': 0.12793853401354138, 'bull_tp_mult': 2.2719705122333202, 'bull_tsl_mult': 0.35176801624667514, 'bull_time_stop': 177, 'bull_use_sma': False, 'bull_use_ema': True, 'bull_use_atr': False, 'bull_use_adx': False, 'bull_use_spike': False, 'bull_rsi_required': False, 'bear_strategy': 'breakout', 'bear_bb_std_mult': 0.6633575185200837, 'bear_rsi_os': 23, 'bear_rsi_ob': 75, 'bear_adx_thresh': 10.870731934309914, 'bear_atr_min_pct': 0.0197971618571411, 'bear_atr_max_pct': 0.08733617669601389, 'bear_tp_mult': 1.8542332297799575, 'bear_tsl_mult': 0.8252157635440358, 'bear_time_stop': 137, 'bear_use_sma': False, 'bear_use_ema': False, 'bear_use_atr': True, 'bear_use_adx': True, 'bear_use_spike': False, 'bear_rsi_required': False, 'sideways_strategy': 'mean_reversion', 'sideways_bb_std_mult': 2.7816815482775943, 'sideways_rsi_os': 55, 'sideways_rsi_ob': 54, 'sideways_adx_thresh': 22.98907969110277, 'sideways_atr_min_pct': 0.019431864513960104, 'sideways_atr_max_pct': 0.017267105665223673, 'sideways_tp_mult': 2.1076956822449158, 'sideways_tsl_mult': 0.17149290178485194, 'sideways_time_stop': 133, 'sideways_use_sma': False, 'sideways_use_ema': False, 'sideways_use_atr': False, 'sideways_use_adx': False, 'sideways_use_spike': False, 'sideways_rsi_required': True}.
[I 2025-08-31 00:10:24,244] Trial 68 finished with values: [-1000000000.0, 1000000000.0] and parameters: {'p_sma': 32, 'p_std': 27, 'p_atr': 14, 'p_adx': 21, 'rsi_period': 71, 'ema1': 21, 'ema2': 32, 'slip_atr_k': 0.097277811169285, 'slip_spread_k': 0.4946083357028013, 'spread_hl_frac': 0.0016167796396955548, 'bb_std_mult': 2.2437519202408858, 'rsi_os': 46, 'rsi_ob': 77, 'vol_spike': 0.11265514759965012, 'adx_thresh': 23.339672751194804, 'atr_min_pct': 0.0009600271077601214, 'atr_max_pct': 0.07983242223541363, 'tp_mult': 2.092351956365561, 'tsl_mult': 0.003630861330249535, 'strategy': 'breakout', 'time_stop': 176, 'use_sma': True, 'use_atr': False, 'use_adx': False, 'use_ema': False, 'use_spike': False, 'rsi_required': False, 'edge_k': 0.9918597369492248, 'edge_cap': 0.9023374974809166, 'bull_strategy': 'breakout', 'bull_bb_std_mult': 0.6094656993392658, 'bull_rsi_os': 46, 'bull_rsi_ob': 79, 'bull_adx_thresh': 10.426405944060429, 'bull_atr_min_pct': 0.0022901255085228363, 'bull_atr_max_pct': 0.07506049327597615, 'bull_tp_mult': 1.8779486117076114, 'bull_tsl_mult': 0.5168894525776206, 'bull_time_stop': 70, 'bull_use_sma': True, 'bull_use_ema': True, 'bull_use_atr': False, 'bull_use_adx': False, 'bull_use_spike': False, 'bull_rsi_required': False, 'bear_strategy': 'breakout', 'bear_bb_std_mult': 0.9940297285806124, 'bear_rsi_os': 21, 'bear_rsi_ob': 79, 'bear_adx_thresh': 34.01924016194159, 'bear_atr_min_pct': 0.01916238321545866, 'bear_atr_max_pct': 0.10471928306913068, 'bear_tp_mult': 2.6483624853681498, 'bear_tsl_mult': 0.8129658734721832, 'bear_time_stop': 166, 'bear_use_sma': False, 'bear_use_ema': False, 'bear_use_atr': True, 'bear_use_adx': True, 'bear_use_spike': False, 'bear_rsi_required': True, 'sideways_strategy': 'mean_reversion', 'sideways_bb_std_mult': 2.7615571965059864, 'sideways_rsi_os': 53, 'sideways_rsi_ob': 61, 'sideways_adx_thresh': 23.344861911060573, 'sideways_atr_min_pct': 0.016638392892453686, 'sideways_atr_max_pct': 0.07419583232853988, 'sideways_tp_mult': 2.091411770667187, 'sideways_tsl_mult': 0.1751703586349142, 'sideways_time_stop': 171, 'sideways_use_sma': False, 'sideways_use_ema': False, 'sideways_use_atr': False, 'sideways_use_adx': False, 'sideways_use_spike': True, 'sideways_rsi_required': True}.
[I 2025-08-31 00:10:24,317] Trial 67 finished with values: [-1000000000.0, 1000000000.0] and parameters: {'p_sma': 30, 'p_std': 42, 'p_atr': 16, 'p_adx': 17, 'rsi_period': 82, 'ema1': 21, 'ema2': 33, 'slip_atr_k': 0.09825397840604118, 'slip_spread_k': 0.4813304442026721, 'spread_hl_frac': 6.906577162327178e-05, 'bb_std_mult': 2.2728944178188493, 'rsi_os': 8, 'rsi_ob': 77, 'vol_spike': 0.11258863803400568, 'adx_thresh': 23.373158566371984, 'atr_min_pct': 0.0034974277438014206, 'atr_max_pct': 0.08076450287131062, 'tp_mult': 2.120170128700834, 'tsl_mult': 5.439829514222033e-05, 'strategy': 'breakout', 'time_stop': 177, 'use_sma': True, 'use_atr': True, 'use_adx': False, 'use_ema': False, 'use_spike': False, 'rsi_required': False, 'edge_k': 0.9894573192363282, 'edge_cap': 0.8962182437347219, 'bull_strategy': 'breakout', 'bull_bb_std_mult': 0.5021140709994288, 'bull_rsi_os': 47, 'bull_rsi_ob': 82, 'bull_adx_thresh': 10.841763349446946, 'bull_atr_min_pct': 0.0023452874019291884, 'bull_atr_max_pct': 0.08917121357785272, 'bull_tp_mult': 2.247166217806366, 'bull_tsl_mult': 0.5130069005532522, 'bull_time_stop': 95, 'bull_use_sma': True, 'bull_use_ema': True, 'bull_use_atr': False, 'bull_use_adx': False, 'bull_use_spike': False, 'bull_rsi_required': False, 'bear_strategy': 'breakout', 'bear_bb_std_mult': 0.6344993192583912, 'bear_rsi_os': 21, 'bear_rsi_ob': 79, 'bear_adx_thresh': 34.70382799576921, 'bear_atr_min_pct': 0.015819904220290112, 'bear_atr_max_pct': 0.10502513158238849, 'bear_tp_mult': 1.8727474724529936, 'bear_tsl_mult': 0.7491121409370078, 'bear_time_stop': 137, 'bear_use_sma': False, 'bear_use_ema': False, 'bear_use_atr': False, 'bear_use_adx': True, 'bear_use_spike': False, 'bear_rsi_required': True, 'sideways_strategy': 'breakout', 'sideways_bb_std_mult': 2.756501905771881, 'sideways_rsi_os': 53, 'sideways_rsi_ob': 60, 'sideways_adx_thresh': 22.482436418796805, 'sideways_atr_min_pct': 0.016629683481838776, 'sideways_atr_max_pct': 0.022436816651873234, 'sideways_tp_mult': 2.112278237749495, 'sideways_tsl_mult': 0.16651490459489204, 'sideways_time_stop': 166, 'sideways_use_sma': False, 'sideways_use_ema': False, 'sideways_use_atr': False, 'sideways_use_adx': False, 'sideways_use_spike': True, 'sideways_rsi_required': True}.
[I 2025-08-31 00:10:55,457] Trial 71 finished with values: [-1000000000.0, 1000000000.0] and parameters: {'p_sma': 17, 'p_std': 34, 'p_atr': 16, 'p_adx': 21, 'rsi_period': 60, 'ema1': 23, 'ema2': 24, 'slip_atr_k': 0.22805937201577658, 'slip_spread_k': 0.3686204555516458, 'spread_hl_frac': 0.03351304131424489, 'bb_std_mult': 1.696120518224285, 'rsi_os': 11, 'rsi_ob': 81, 'vol_spike': 0.133913738448624, 'adx_thresh': 23.533166798549072, 'atr_min_pct': 0.0013270605920143147, 'atr_max_pct': 0.12039933119817045, 'tp_mult': 2.337670237688881, 'tsl_mult': 0.04869361660544761, 'strategy': 'mean_reversion', 'time_stop': 137, 'use_sma': True, 'use_atr': True, 'use_adx': True, 'use_ema': False, 'use_spike': False, 'rsi_required': False, 'edge_k': 1.0493515311221862, 'edge_cap': 0.8959902489276054, 'bull_strategy': 'breakout', 'bull_bb_std_mult': 0.6269678343406626, 'bull_rsi_os': 50, 'bull_rsi_ob': 85, 'bull_adx_thresh': 8.035412773777354, 'bull_atr_min_pct': 0.00012437308007666827, 'bull_atr_max_pct': 0.10853079520271564, 'bull_tp_mult': 2.2635335800361442, 'bull_tsl_mult': 0.33403648765790495, 'bull_time_stop': 179, 'bull_use_sma': False, 'bull_use_ema': True, 'bull_use_atr': False, 'bull_use_adx': False, 'bull_use_spike': False, 'bull_rsi_required': False, 'bear_strategy': 'breakout', 'bear_bb_std_mult': 0.6789278208867802, 'bear_rsi_os': 17, 'bear_rsi_ob': 85, 'bear_adx_thresh': 33.94704701707287, 'bear_atr_min_pct': 0.01162045592919929, 'bear_atr_max_pct': 0.08850055425524836, 'bear_tp_mult': 2.348229621249626, 'bear_tsl_mult': 0.8236636862811717, 'bear_time_stop': 143, 'bear_use_sma': True, 'bear_use_ema': False, 'bear_use_atr': False, 'bear_use_adx': True, 'bear_use_spike': False, 'bear_rsi_required': True, 'sideways_strategy': 'breakout', 'sideways_bb_std_mult': 2.465271584765881, 'sideways_rsi_os': 55, 'sideways_rsi_ob': 55, 'sideways_adx_thresh': 22.232345957914756, 'sideways_atr_min_pct': 0.01909436557512049, 'sideways_atr_max_pct': 0.026783865414824068, 'sideways_tp_mult': 2.5901803786138204, 'sideways_tsl_mult': 0.03679191966123667, 'sideways_time_stop': 115, 'sideways_use_sma': False, 'sideways_use_ema': False, 'sideways_use_atr': False, 'sideways_use_adx': False, 'sideways_use_spike': True, 'sideways_rsi_required': True}.
