[I 2025-08-31 02:55:20,109] Trial 709 finished with values: [-1000000000.0, 1000000000.0] and parameters: {'p_sma': 51, 'p_std': 54, 'p_atr': 28, 'p_adx': 18, 'rsi_period': 11, 'ema1': 12, 'ema2': 24, 'slip_atr_k': 0.24896895899958735, 'slip_spread_k': 0.527152474252651, 'spread_hl_frac': 0.016146009474433246, 'bb_std_mult': 1.5647044114439128, 'rsi_os': 37, 'rsi_ob': 51, 'vol_spike': 0.0627155436809504, 'adx_thresh': 21.185448443647193, 'atr_min_pct': 0.008870788868410296, 'atr_max_pct': 0.12180399947909937, 'tp_mult': 2.0536440853385667, 'tsl_mult': 0.24210816123419682, 'strategy': 'mean_reversion', 'time_stop': 6, 'use_sma': False, 'use_atr': False, 'use_adx': False, 'use_ema': False, 'use_spike': False, 'rsi_required': True, 'edge_k': 0.5096695264793046, 'edge_cap': 0.09324726185029719, 'bull_strategy': 'breakout', 'bull_bb_std_mult': 1.394651940705292, 'bull_rsi_os': 42, 'bull_rsi_ob': 78, 'bull_adx_thresh': 6.047493005906797, 'bull_atr_min_pct': 0.011822983951243066, 'bull_atr_max_pct': 0.1470803873124646, 'bull_tp_mult': 2.3668450595904638, 'bull_tsl_mult': 0.19293341697529937, 'bull_time_stop': 125, 'bull_use_sma': True, 'bull_use_ema': True, 'bull_use_atr': False, 'bull_use_adx': True, 'bull_use_spike': True, 'bull_rsi_required': True, 'bear_strategy': 'mean_reversion', 'bear_bb_std_mult': 1.7858539409988232, 'bear_rsi_os': 14, 'bear_rsi_ob': 93, 'bear_adx_thresh': 6.373074596828166, 'bear_atr_min_pct': 0.021983940686395052, 'bear_atr_max_pct': 0.14740193730361117, 'bear_tp_mult': 2.1196642431015973, 'bear_tsl_mult': 0.24919495038873124, 'bear_time_stop': 84, 'bear_use_sma': False, 'bear_use_ema': False, 'bear_use_atr': False, 'bear_use_adx': True, 'bear_use_spike': False, 'bear_rsi_required': True, 'sideways_strategy': 'breakout', 'sideways_bb_std_mult': 0.6728525385544964, 'sideways_rsi_os': 21, 'sideways_rsi_ob': 92, 'sideways_adx_thresh': 8.127022453320098, 'sideways_atr_min_pct': 0.014851000510638573, 'sideways_atr_max_pct': 0.04627304606835268, 'sideways_tp_mult': 1.714251151851537, 'sideways_tsl_mult': 0.6306754281060732, 'sideways_time_stop': 201, 'sideways_use_sma': True, 'sideways_use_ema': False, 'sideways_use_atr': False, 'sideways_use_adx': False, 'sideways_use_spike': True, 'sideways_rsi_required': False}.
[I 2025-08-31 02:55:57,578] Trial 713 finished with values: [-1000000000.0, 1000000000.0] and parameters: {'p_sma': 51, 'p_std': 54, 'p_atr': 30, 'p_adx': 27, 'rsi_period': 84, 'ema1': 6, 'ema2': 29, 'slip_atr_k': 0.10327167420885952, 'slip_spread_k': 0.16751622600375615, 'spread_hl_frac': 0.004127931039095873, 'bb_std_mult': 1.651456769535724, 'rsi_os': 35, 'rsi_ob': 69, 'vol_spike': 0.29327302159430446, 'adx_thresh': 26.87672619554939, 'atr_min_pct': 0.007195144242049677, 'atr_max_pct': 0.11559450486017257, 'tp_mult': 1.1889931597843957, 'tsl_mult': 0.437780340060846, 'strategy': 'mean_reversion', 'time_stop': 151, 'use_sma': False, 'use_atr': False, 'use_adx': False, 'use_ema': False, 'use_spike': False, 'rsi_required': True, 'edge_k': 1.5022738797628774, 'edge_cap': 0.1390505528311808, 'bull_strategy': 'mean_reversion', 'bull_bb_std_mult': 1.9063942237254374, 'bull_rsi_os': 31, 'bull_rsi_ob': 53, 'bull_adx_thresh': 6.883020128349974, 'bull_atr_min_pct': 0.029404667072371583, 'bull_atr_max_pct': 0.14147649762158462, 'bull_tp_mult': 2.264538890736682, 'bull_tsl_mult': 0.25341388225483247, 'bull_time_stop': 42, 'bull_use_sma': True, 'bull_use_ema': False, 'bull_use_atr': False, 'bull_use_adx': True, 'bull_use_spike': True, 'bull_rsi_required': True, 'bear_strategy': 'breakout', 'bear_bb_std_mult': 1.192414097496932, 'bear_rsi_os': 18, 'bear_rsi_ob': 45, 'bear_adx_thresh': 5.985490787937087, 'bear_atr_min_pct': 0.0049648134070610335, 'bear_atr_max_pct': 0.012478475416425513, 'bear_tp_mult': 2.263306333044298, 'bear_tsl_mult': 0.4945219215171815, 'bear_time_stop': 83, 'bear_use_sma': False, 'bear_use_ema': False, 'bear_use_atr': True, 'bear_use_adx': False, 'bear_use_spike': True, 'bear_rsi_required': True, 'sideways_strategy': 'breakout', 'sideways_bb_std_mult': 0.5028264977815944, 'sideways_rsi_os': 24, 'sideways_rsi_ob': 81, 'sideways_adx_thresh': 8.92283077398447, 'sideways_atr_min_pct': 0.024926023172599093, 'sideways_atr_max_pct': 0.10466757447008607, 'sideways_tp_mult': 1.815269374380284, 'sideways_tsl_mult': 0.6575940722551188, 'sideways_time_stop': 255, 'sideways_use_sma': True, 'sideways_use_ema': False, 'sideways_use_atr': False, 'sideways_use_adx': True, 'sideways_use_spike': False, 'sideways_rsi_required': True}.
[I 2025-08-31 02:55:58,051] Trial 714 finished with values: [-1000000000.0, 1000000000.0] and parameters: {'p_sma': 51, 'p_std': 47, 'p_atr': 30, 'p_adx': 17, 'rsi_period': 13, 'ema1': 5, 'ema2': 24, 'slip_atr_k': 0.19098050529234747, 'slip_spread_k': 0.7554361095021924, 'spread_hl_frac': 0.019224148617111098, 'bb_std_mult': 1.6584321011642442, 'rsi_os': 34, 'rsi_ob': 69, 'vol_spike': 0.06379691729907859, 'adx_thresh': 22.621077558940243, 'atr_min_pct': 0.02864500124785167, 'atr_max_pct': 0.11646466544972756, 'tp_mult': 1.4851317865205762, 'tsl_mult': 0.8143978616606775, 'strategy': 'mean_reversion', 'time_stop': 183, 'use_sma': True, 'use_atr': False, 'use_adx': False, 'use_ema': False, 'use_spike': False, 'rsi_required': True, 'edge_k': 1.008648322227467, 'edge_cap': 0.18153679958016364, 'bull_strategy': 'mean_reversion', 'bull_bb_std_mult': 1.063512700417259, 'bull_rsi_os': 33, 'bull_rsi_ob': 78, 'bull_adx_thresh': 20.128109735406273, 'bull_atr_min_pct': 0.029042092999381125, 'bull_atr_max_pct': 0.14204019618976646, 'bull_tp_mult': 1.161997573492437, 'bull_tsl_mult': 0.19626444153911887, 'bull_time_stop': 217, 'bull_use_sma': True, 'bull_use_ema': False, 'bull_use_atr': False, 'bull_use_adx': False, 'bull_use_spike': True, 'bull_rsi_required': True, 'bear_strategy': 'breakout', 'bear_bb_std_mult': 1.190596991063894, 'bear_rsi_os': 5, 'bear_rsi_ob': 89, 'bear_adx_thresh': 5.6096427098669315, 'bear_atr_min_pct': 0.01977889262318031, 'bear_atr_max_pct': 0.10717684549123535, 'bear_tp_mult': 2.220109190127406, 'bear_tsl_mult': 0.4820619180672023, 'bear_time_stop': 87, 'bear_use_sma': False, 'bear_use_ema': False, 'bear_use_atr': True, 'bear_use_adx': False, 'bear_use_spike': True, 'bear_rsi_required': True, 'sideways_strategy': 'breakout', 'sideways_bb_std_mult': 0.6872652955724852, 'sideways_rsi_os': 43, 'sideways_rsi_ob': 93, 'sideways_adx_thresh': 10.761073693388056, 'sideways_atr_min_pct': 0.006645432643309621, 'sideways_atr_max_pct': 0.020822262882742373, 'sideways_tp_mult': 2.8583500111329236, 'sideways_tsl_mult': 0.6553318927577222, 'sideways_time_stop': 300, 'sideways_use_sma': True, 'sideways_use_ema': False, 'sideways_use_atr': False, 'sideways_use_adx': True, 'sideways_use_spike': False, 'sideways_rsi_required': True}.
[I 2025-08-31 02:55:58,376] Trial 712 finished with values: [-0.0535379628441206, 0.05340387307370149] and parameters: {'p_sma': 27, 'p_std': 54, 'p_atr': 27, 'p_adx': 19, 'rsi_period': 13, 'ema1': 6, 'ema2': 16, 'slip_atr_k': 0.24635336427678245, 'slip_spread_k': 0.5268479778019203, 'spread_hl_frac': 0.004186315233099404, 'bb_std_mult': 1.6591777788452282, 'rsi_os': 26, 'rsi_ob': 61, 'vol_spike': 0.2931944286216377, 'adx_thresh': 20.834210913966174, 'atr_min_pct': 0.008767880852248338, 'atr_max_pct': 0.12828263011302457, 'tp_mult': 2.3381664347172064, 'tsl_mult': 0.4339761651162753, 'strategy': 'mean_reversion', 'time_stop': 102, 'use_sma': False, 'use_atr': False, 'use_adx': False, 'use_ema': False, 'use_spike': False, 'rsi_required': True, 'edge_k': 0.41316454590852325, 'edge_cap': 0.18319669578618394, 'bull_strategy': 'breakout', 'bull_bb_std_mult': 2.379078300929637, 'bull_rsi_os': 42, 'bull_rsi_ob': 55, 'bull_adx_thresh': 20.0748514080511, 'bull_atr_min_pct': 0.0045538264702844325, 'bull_atr_max_pct': 0.13277289771985812, 'bull_tp_mult': 1.3802424581947146, 'bull_tsl_mult': 0.19369056943662127, 'bull_time_stop': 126, 'bull_use_sma': True, 'bull_use_ema': False, 'bull_use_atr': False, 'bull_use_adx': True, 'bull_use_spike': True, 'bull_rsi_required': True, 'bear_strategy': 'breakout', 'bear_bb_std_mult': 1.895977808736118, 'bear_rsi_os': 34, 'bear_rsi_ob': 89, 'bear_adx_thresh': 6.595708355194267, 'bear_atr_min_pct': 0.001773268322175215, 'bear_atr_max_pct': 0.08015715099731804, 'bear_tp_mult': 2.2301699394789787, 'bear_tsl_mult': 0.5321405342544335, 'bear_time_stop': 70, 'bear_use_sma': False, 'bear_use_ema': False, 'bear_use_atr': True, 'bear_use_adx': True, 'bear_use_spike': True, 'bear_rsi_required': True, 'sideways_strategy': 'breakout', 'sideways_bb_std_mult': 0.648198439796017, 'sideways_rsi_os': 43, 'sideways_rsi_ob': 92, 'sideways_adx_thresh': 7.858681223292793, 'sideways_atr_min_pct': 0.006717449681618625, 'sideways_atr_max_pct': 0.08593640583854001, 'sideways_tp_mult': 1.7079676782419262, 'sideways_tsl_mult': 0.6588063686998706, 'sideways_time_stop': 201, 'sideways_use_sma': True, 'sideways_use_ema': False, 'sideways_use_atr': False, 'sideways_use_adx': False, 'sideways_use_spike': False, 'sideways_rsi_required': False}.
[I 2025-08-31 02:55:58,376] Trial 715 finished with values: [-1000000000.0, 1000000000.0] and parameters: {'p_sma': 17, 'p_std': 51, 'p_atr': 9, 'p_adx': 27, 'rsi_period': 68, 'ema1': 15, 'ema2': 34, 'slip_atr_k': 0.15454239949299128, 'slip_spread_k': 0.13028849143933482, 'spread_hl_frac': 0.004106363367297326, 'bb_std_mult': 2.8072463489547794, 'rsi_os': 38, 'rsi_ob': 61, 'vol_spike': 0.13534110311543776, 'adx_thresh': 19.088288985297726, 'atr_min_pct': 0.023108613018969125, 'atr_max_pct': 0.09337417597169541, 'tp_mult': 1.187454875128743, 'tsl_mult': 0.5723191223303882, 'strategy': 'mean_reversion', 'time_stop': 101, 'use_sma': True, 'use_atr': False, 'use_adx': False, 'use_ema': False, 'use_spike': True, 'rsi_required': True, 'edge_k': 1.4002264632592645, 'edge_cap': 0.2580560636363586, 'bull_strategy': 'mean_reversion', 'bull_bb_std_mult': 2.3757803128184896, 'bull_rsi_os': 33, 'bull_rsi_ob': 53, 'bull_adx_thresh': 19.953164427043443, 'bull_atr_min_pct': 0.01279080863208686, 'bull_atr_max_pct': 0.13207530035613052, 'bull_tp_mult': 2.234624902566255, 'bull_tsl_mult': 0.2669799353752923, 'bull_time_stop': 129, 'bull_use_sma': True, 'bull_use_ema': False, 'bull_use_atr': False, 'bull_use_adx': False, 'bull_use_spike': True, 'bull_rsi_required': True, 'bear_strategy': 'breakout', 'bear_bb_std_mult': 1.9135346937221853, 'bear_rsi_os': 27, 'bear_rsi_ob': 45, 'bear_adx_thresh': 5.604458986468922, 'bear_atr_min_pct': 0.0048988068064631, 'bear_atr_max_pct': 0.012634938159606184, 'bear_tp_mult': 2.8052315686773066, 'bear_tsl_mult': 0.4948585743721214, 'bear_time_stop': 15, 'bear_use_sma': False, 'bear_use_ema': True, 'bear_use_atr': True, 'bear_use_adx': False, 'bear_use_spike': True, 'bear_rsi_required': True, 'sideways_strategy': 'breakout', 'sideways_bb_std_mult': 0.6608506515962065, 'sideways_rsi_os': 54, 'sideways_rsi_ob': 83, 'sideways_adx_thresh': 22.545257330741684, 'sideways_atr_min_pct': 0.02497408539002134, 'sideways_atr_max_pct': 0.10964131013014419, 'sideways_tp_mult': 1.8356143228719701, 'sideways_tsl_mult': 0.9988041906562446, 'sideways_time_stop': 202, 'sideways_use_sma': True, 'sideways_use_ema': False, 'sideways_use_atr': False, 'sideways_use_adx': True, 'sideways_use_spike': False, 'sideways_rsi_required': True}.
[I 2025-08-31 02:56:36,283] Trial 716 finished with values: [-1000000000.0, 1000000000.0] and parameters: {'p_sma': 53, 'p_std': 30, 'p_atr': 9, 'p_adx': 12, 'rsi_period': 71, 'ema1': 29, 'ema2': 33, 'slip_atr_k': 0.052928807293741525, 'slip_spread_k': 0.13255287120759776, 'spread_hl_frac': 0.001376703863843838, 'bb_std_mult': 2.7971641319784935, 'rsi_os': 34, 'rsi_ob': 60, 'vol_spike': 0.1700801578834015, 'adx_thresh': 22.48486683872811, 'atr_min_pct': 0.009873406887754493, 'atr_max_pct': 0.04112403707004056, 'tp_mult': 1.4879298195479742, 'tsl_mult': 0.30756179337359246, 'strategy': 'mean_reversion', 'time_stop': 130, 'use_sma': True, 'use_atr': False, 'use_adx': False, 'use_ema': False, 'use_spike': True, 'rsi_required': True, 'edge_k': 0.39410269752842064, 'edge_cap': 0.17158913941745413, 'bull_strategy': 'mean_reversion', 'bull_bb_std_mult': 0.6525588308808621, 'bull_rsi_os': 28, 'bull_rsi_ob': 87, 'bull_adx_thresh': 5.4293857396513685, 'bull_atr_min_pct': 0.004633460983952066, 'bull_atr_max_pct': 0.13244556098311644, 'bull_tp_mult': 2.280345051205381, 'bull_tsl_mult': 0.2726733407497983, 'bull_time_stop': 87, 'bull_use_sma': True, 'bull_use_ema': False, 'bull_use_atr': False, 'bull_use_adx': False, 'bull_use_spike': True, 'bull_rsi_required': True, 'bear_strategy': 'breakout', 'bear_bb_std_mult': 1.403757906105826, 'bear_rsi_os': 16, 'bear_rsi_ob': 58, 'bear_adx_thresh': 18.81211926546171, 'bear_atr_min_pct': 0.02499080808980078, 'bear_atr_max_pct': 0.010087273468055748, 'bear_tp_mult': 2.21904018409382, 'bear_tsl_mult': 0.9992307355627446, 'bear_time_stop': 16, 'bear_use_sma': False, 'bear_use_ema': True, 'bear_use_atr': True, 'bear_use_adx': True, 'bear_use_spike': True, 'bear_rsi_required': True, 'sideways_strategy': 'breakout', 'sideways_bb_std_mult': 0.639581503456468, 'sideways_rsi_os': 17, 'sideways_rsi_ob': 93, 'sideways_adx_thresh': 22.58274491438541, 'sideways_atr_min_pct': 0.006627930910455835, 'sideways_atr_max_pct': 0.051061010157023495, 'sideways_tp_mult': 2.0134195732277447, 'sideways_tsl_mult': 0.9087932688347562, 'sideways_time_stop': 202, 'sideways_use_sma': True, 'sideways_use_ema': False, 'sideways_use_atr': False, 'sideways_use_adx': False, 'sideways_use_spike': False, 'sideways_rsi_required': True}.
[I 2025-08-31 02:56:37,888] Trial 717 finished with values: [-1000000000.0, 1000000000.0] and parameters: {'p_sma': 53, 'p_std': 29, 'p_atr': 29, 'p_adx': 13, 'rsi_period': 68, 'ema1': 16, 'ema2': 53, 'slip_atr_k': 0.15412543069118284, 'slip_spread_k': 0.13589114054066753, 'spread_hl_frac': 0.001277385554148702, 'bb_std_mult': 1.4607488654724738, 'rsi_os': 38, 'rsi_ob': 67, 'vol_spike': 0.17210239304890745, 'adx_thresh': 20.124874633369206, 'atr_min_pct': 0.010054980805274076, 'atr_max_pct': 0.01392178928022346, 'tp_mult': 1.3801180238152702, 'tsl_mult': 0.19554285703355276, 'strategy': 'mean_reversion', 'time_stop': 54, 'use_sma': True, 'use_atr': True, 'use_adx': True, 'use_ema': False, 'use_spike': True, 'rsi_required': True, 'edge_k': 0.4166286631306807, 'edge_cap': 0.06337484315824016, 'bull_strategy': 'breakout', 'bull_bb_std_mult': 0.7002984804807395, 'bull_rsi_os': 28, 'bull_rsi_ob': 55, 'bull_adx_thresh': 27.62188343767902, 'bull_atr_min_pct': 0.009453296750449546, 'bull_atr_max_pct': 0.05018532857996393, 'bull_tp_mult': 2.278718836823561, 'bull_tsl_mult': 0.2665419830140174, 'bull_time_stop': 131, 'bull_use_sma': True, 'bull_use_ema': False, 'bull_use_atr': False, 'bull_use_adx': True, 'bull_use_spike': True, 'bull_rsi_required': True, 'bear_strategy': 'mean_reversion', 'bear_bb_std_mult': 1.392562283382639, 'bear_rsi_os': 46, 'bear_rsi_ob': 55, 'bear_adx_thresh': 14.440344620081735, 'bear_atr_min_pct': 0.006046354270288452, 'bear_atr_max_pct': 0.07511064190615048, 'bear_tp_mult': 1.9885577870026288, 'bear_tsl_mult': 0.5535305615165395, 'bear_time_stop': 69, 'bear_use_sma': False, 'bear_use_ema': True, 'bear_use_atr': False, 'bear_use_adx': True, 'bear_use_spike': False, 'bear_rsi_required': True, 'sideways_strategy': 'breakout', 'sideways_bb_std_mult': 0.6211807425727559, 'sideways_rsi_os': 27, 'sideways_rsi_ob': 45, 'sideways_adx_thresh': 22.303416646295176, 'sideways_atr_min_pct': 0.0047015638560676375, 'sideways_atr_max_pct': 0.05209966911088266, 'sideways_tp_mult': 1.7609357611883019, 'sideways_tsl_mult': 0.6986788712863378, 'sideways_time_stop': 193, 'sideways_use_sma': False, 'sideways_use_ema': True, 'sideways_use_atr': True, 'sideways_use_adx': False, 'sideways_use_spike': True, 'sideways_rsi_required': False}.
[I 2025-08-31 02:56:37,894] Trial 719 finished with values: [-1000000000.0, 1000000000.0] and parameters: {'p_sma': 53, 'p_std': 51, 'p_atr': 16, 'p_adx': 24, 'rsi_period': 71, 'ema1': 24, 'ema2': 27, 'slip_atr_k': 0.23902327808525087, 'slip_spread_k': 0.8960330131250462, 'spread_hl_frac': 0.0014790422160717573, 'bb_std_mult': 1.7684303536444752, 'rsi_os': 36, 'rsi_ob': 71, 'vol_spike': 0.1729877989907778, 'adx_thresh': 16.847096781973885, 'atr_min_pct': 0.015267692164664533, 'atr_max_pct': 0.11477807120898395, 'tp_mult': 1.3278608397759426, 'tsl_mult': 0.2193319583376148, 'strategy': 'mean_reversion', 'time_stop': 95, 'use_sma': True, 'use_atr': True, 'use_adx': True, 'use_ema': False, 'use_spike': True, 'rsi_required': True, 'edge_k': 0.6132107670007338, 'edge_cap': 0.3477060999135653, 'bull_strategy': 'breakout', 'bull_bb_std_mult': 1.5262768610897472, 'bull_rsi_os': 54, 'bull_rsi_ob': 87, 'bull_adx_thresh': 24.462040070050527, 'bull_atr_min_pct': 0.002874444620829428, 'bull_atr_max_pct': 0.1357352185286881, 'bull_tp_mult': 1.2218049755410965, 'bull_tsl_mult': 0.32218838424809126, 'bull_time_stop': 132, 'bull_use_sma': True, 'bull_use_ema': False, 'bull_use_atr': False, 'bull_use_adx': True, 'bull_use_spike': True, 'bull_rsi_required': True, 'bear_strategy': 'mean_reversion', 'bear_bb_std_mult': 1.485061891899698, 'bear_rsi_os': 16, 'bear_rsi_ob': 83, 'bear_adx_thresh': 5.626950249108093, 'bear_atr_min_pct': 0.005934268075255229, 'bear_atr_max_pct': 0.017231696830238022, 'bear_tp_mult': 1.093824770626627, 'bear_tsl_mult': 0.05709294295060213, 'bear_time_stop': 15, 'bear_use_sma': False, 'bear_use_ema': True, 'bear_use_atr': False, 'bear_use_adx': True, 'bear_use_spike': False, 'bear_rsi_required': True, 'sideways_strategy': 'breakout', 'sideways_bb_std_mult': 2.0486114006919256, 'sideways_rsi_os': 26, 'sideways_rsi_ob': 94, 'sideways_adx_thresh': 33.11298728250611, 'sideways_atr_min_pct': 0.0011691325644869657, 'sideways_atr_max_pct': 0.050423536215222386, 'sideways_tp_mult': 2.610243439406834, 'sideways_tsl_mult': 0.7001916760674765, 'sideways_time_stop': 194, 'sideways_use_sma': False, 'sideways_use_ema': True, 'sideways_use_atr': True, 'sideways_use_adx': False, 'sideways_use_spike': True, 'sideways_rsi_required': False}.
[I 2025-08-31 02:56:38,139] Trial 718 finished with values: [-1000000000.0, 1000000000.0] and parameters: {'p_sma': 53, 'p_std': 51, 'p_atr': 29, 'p_adx': 24, 'rsi_period': 72, 'ema1': 10, 'ema2': 31, 'slip_atr_k': 0.05187927451604732, 'slip_spread_k': 0.8876280316136114, 'spread_hl_frac': 0.02190493640252718, 'bb_std_mult': 3.0707917361163712, 'rsi_os': 48, 'rsi_ob': 71, 'vol_spike': 0.17322493488852375, 'adx_thresh': 20.125447919318542, 'atr_min_pct': 0.010084940604360632, 'atr_max_pct': 0.010096202330850124, 'tp_mult': 1.5896940609522567, 'tsl_mult': 0.3071844924989352, 'strategy': 'mean_reversion', 'time_stop': 130, 'use_sma': True, 'use_atr': True, 'use_adx': True, 'use_ema': False, 'use_spike': True, 'rsi_required': True, 'edge_k': 1.910862460155641, 'edge_cap': 0.05124674250669907, 'bull_strategy': 'breakout', 'bull_bb_std_mult': 3.388360894005628, 'bull_rsi_os': 52, 'bull_rsi_ob': 87, 'bull_adx_thresh': 5.418492099166988, 'bull_atr_min_pct': 0.016687529414109833, 'bull_atr_max_pct': 0.13608334186440385, 'bull_tp_mult': 1.200838356185669, 'bull_tsl_mult': 0.2690264209365641, 'bull_time_stop': 88, 'bull_use_sma': True, 'bull_use_ema': False, 'bull_use_atr': False, 'bull_use_adx': True, 'bull_use_spike': True, 'bull_rsi_required': True, 'bear_strategy': 'mean_reversion', 'bear_bb_std_mult': 1.6550559503155946, 'bear_rsi_os': 11, 'bear_rsi_ob': 47, 'bear_adx_thresh': 5.822643521303822, 'bear_atr_min_pct': 0.006085343689263827, 'bear_atr_max_pct': 0.016418915427599476, 'bear_tp_mult': 1.4823556643311655, 'bear_tsl_mult': 0.5519386313412858, 'bear_time_stop': 15, 'bear_use_sma': False, 'bear_use_ema': True, 'bear_use_atr': False, 'bear_use_adx': True, 'bear_use_spike': False, 'bear_rsi_required': True, 'sideways_strategy': 'breakout', 'sideways_bb_std_mult': 2.6390632431006904, 'sideways_rsi_os': 37, 'sideways_rsi_ob': 94, 'sideways_adx_thresh': 9.298947173084217, 'sideways_atr_min_pct': 0.0036565708873599403, 'sideways_atr_max_pct': 0.06119430065694856, 'sideways_tp_mult': 1.7686339142196001, 'sideways_tsl_mult': 0.6946973380898424, 'sideways_time_stop': 270, 'sideways_use_sma': False, 'sideways_use_ema': True, 'sideways_use_atr': True, 'sideways_use_adx': False, 'sideways_use_spike': True, 'sideways_rsi_required': False}.
