[I 2025-08-31 03:04:39,722] Trial 771 finished with values: [-1000000000.0, 1000000000.0] and parameters: {'p_sma': 57, 'p_std': 49, 'p_atr': 16, 'p_adx': 20, 'rsi_period': 70, 'ema1': 6, 'ema2': 31, 'slip_atr_k': 0.23380109876194413, 'slip_spread_k': 0.1403996339307205, 'spread_hl_frac': 0.03638680799563476, 'bb_std_mult': 1.4890241811113327, 'rsi_os': 42, 'rsi_ob': 64, 'vol_spike': 0.1857937904820296, 'adx_thresh': 21.70598101178741, 'atr_min_pct': 0.009378829825647273, 'atr_max_pct': 0.12861086889001458, 'tp_mult': 1.1588579845549654, 'tsl_mult': 0.32073704388295293, 'strategy': 'mean_reversion', 'time_stop': 48, 'use_sma': True, 'use_atr': False, 'use_adx': False, 'use_ema': False, 'use_spike': True, 'rsi_required': True, 'edge_k': 1.8310170738258926, 'edge_cap': 0.4354722726529946, 'bull_strategy': 'breakout', 'bull_bb_std_mult': 2.403342728025831, 'bull_rsi_os': 54, 'bull_rsi_ob': 51, 'bull_adx_thresh': 6.127875875928327, 'bull_atr_min_pct': 0.013416519072837479, 'bull_atr_max_pct': 0.10055952462051508, 'bull_tp_mult': 2.6811043686161318, 'bull_tsl_mult': 0.267241628855473, 'bull_time_stop': 141, 'bull_use_sma': True, 'bull_use_ema': False, 'bull_use_atr': False, 'bull_use_adx': True, 'bull_use_spike': True, 'bull_rsi_required': True, 'bear_strategy': 'mean_reversion', 'bear_bb_std_mult': 0.8051994811354382, 'bear_rsi_os': 11, 'bear_rsi_ob': 45, 'bear_adx_thresh': 5.592344561816709, 'bear_atr_min_pct': 0.006270145704926584, 'bear_atr_max_pct': 0.05661032140458043, 'bear_tp_mult': 2.4471323736948736, 'bear_tsl_mult': 0.551229698021171, 'bear_time_stop': 76, 'bear_use_sma': False, 'bear_use_ema': True, 'bear_use_atr': False, 'bear_use_adx': True, 'bear_use_spike': True, 'bear_rsi_required': True, 'sideways_strategy': 'breakout', 'sideways_bb_std_mult': 0.5933414341296129, 'sideways_rsi_os': 39, 'sideways_rsi_ob': 93, 'sideways_adx_thresh': 10.17869616563188, 'sideways_atr_min_pct': 0.00594888611074995, 'sideways_atr_max_pct': 0.05990660336708599, 'sideways_tp_mult': 1.6870489858279027, 'sideways_tsl_mult': 0.6700730475247051, 'sideways_time_stop': 63, 'sideways_use_sma': True, 'sideways_use_ema': False, 'sideways_use_atr': False, 'sideways_use_adx': False, 'sideways_use_spike': True, 'sideways_rsi_required': False}.
[I 2025-08-31 03:04:41,131] Trial 775 finished with values: [-1000000000.0, 1000000000.0] and parameters: {'p_sma': 52, 'p_std': 53, 'p_atr': 29, 'p_adx': 19, 'rsi_period': 45, 'ema1': 5, 'ema2': 53, 'slip_atr_k': 0.014943342068564791, 'slip_spread_k': 0.18731933457226196, 'spread_hl_frac': 0.026091491937461728, 'bb_std_mult': 1.6845742207709635, 'rsi_os': 39, 'rsi_ob': 49, 'vol_spike': 0.1507594763771435, 'adx_thresh': 20.72687947716209, 'atr_min_pct': 0.007914728875259482, 'atr_max_pct': 0.1152007548403971, 'tp_mult': 1.50946657942193, 'tsl_mult': 0.5087790475975927, 'strategy': 'mean_reversion', 'time_stop': 93, 'use_sma': True, 'use_atr': False, 'use_adx': False, 'use_ema': False, 'use_spike': True, 'rsi_required': True, 'edge_k': 0.9694331703838192, 'edge_cap': 0.1846836655673263, 'bull_strategy': 'breakout', 'bull_bb_std_mult': 2.3962976815104957, 'bull_rsi_os': 35, 'bull_rsi_ob': 57, 'bull_adx_thresh': 18.499386939341665, 'bull_atr_min_pct': 0.002647999935302736, 'bull_atr_max_pct': 0.05301187534740197, 'bull_tp_mult': 2.2172928704703865, 'bull_tsl_mult': 0.2995926398587797, 'bull_time_stop': 139, 'bull_use_sma': True, 'bull_use_ema': False, 'bull_use_atr': False, 'bull_use_adx': True, 'bull_use_spike': True, 'bull_rsi_required': True, 'bear_strategy': 'mean_reversion', 'bear_bb_std_mult': 2.8278246863962218, 'bear_rsi_os': 11, 'bear_rsi_ob': 83, 'bear_adx_thresh': 6.589667668719741, 'bear_atr_min_pct': 0.015139367762322987, 'bear_atr_max_pct': 0.055806284405655195, 'bear_tp_mult': 2.6885936414178753, 'bear_tsl_mult': 0.5768450632876471, 'bear_time_stop': 22, 'bear_use_sma': False, 'bear_use_ema': True, 'bear_use_atr': False, 'bear_use_adx': True, 'bear_use_spike': False, 'bear_rsi_required': True, 'sideways_strategy': 'breakout', 'sideways_bb_std_mult': 2.77583815470784, 'sideways_rsi_os': 36, 'sideways_rsi_ob': 92, 'sideways_adx_thresh': 21.020942411366807, 'sideways_atr_min_pct': 0.02533123544776096, 'sideways_atr_max_pct': 0.06004857773470726, 'sideways_tp_mult': 1.9773076341788403, 'sideways_tsl_mult': 0.6443374506229731, 'sideways_time_stop': 219, 'sideways_use_sma': True, 'sideways_use_ema': False, 'sideways_use_atr': False, 'sideways_use_adx': False, 'sideways_use_spike': True, 'sideways_rsi_required': False}.
[I 2025-08-31 03:05:14,057] Trial 777 finished with values: [-1000000000.0, 1000000000.0] and parameters: {'p_sma': 38, 'p_std': 22, 'p_atr': 18, 'p_adx': 28, 'rsi_period': 44, 'ema1': 18, 'ema2': 40, 'slip_atr_k': 0.01499274028268585, 'slip_spread_k': 0.9640391227449343, 'spread_hl_frac': 0.0020081860677879384, 'bb_std_mult': 1.6805506919976447, 'rsi_os': 39, 'rsi_ob': 67, 'vol_spike': 0.1504530906592024, 'adx_thresh': 18.84930499396979, 'atr_min_pct': 0.005041497271878111, 'atr_max_pct': 0.11604373000253972, 'tp_mult': 1.8948550588701871, 'tsl_mult': 0.20700808932051223, 'strategy': 'mean_reversion', 'time_stop': 93, 'use_sma': True, 'use_atr': False, 'use_adx': False, 'use_ema': False, 'use_spike': False, 'rsi_required': True, 'edge_k': 0.9708569632578121, 'edge_cap': 0.3888300108663288, 'bull_strategy': 'breakout', 'bull_bb_std_mult': 2.472364669911487, 'bull_rsi_os': 26, 'bull_rsi_ob': 58, 'bull_adx_thresh': 18.28146142375847, 'bull_atr_min_pct': 0.019005516805589717, 'bull_atr_max_pct': 0.1471191276714762, 'bull_tp_mult': 2.390215217836782, 'bull_tsl_mult': 0.24884547680238, 'bull_time_stop': 29, 'bull_use_sma': True, 'bull_use_ema': True, 'bull_use_atr': False, 'bull_use_adx': True, 'bull_use_spike': True, 'bull_rsi_required': True, 'bear_strategy': 'mean_reversion', 'bear_bb_std_mult': 1.1976707089769734, 'bear_rsi_os': 17, 'bear_rsi_ob': 45, 'bear_adx_thresh': 5.579424707710153, 'bear_atr_min_pct': 0.007335628232520021, 'bear_atr_max_pct': 0.011946464297295017, 'bear_tp_mult': 2.337971236251284, 'bear_tsl_mult': 0.5853080368115798, 'bear_time_stop': 240, 'bear_use_sma': False, 'bear_use_ema': False, 'bear_use_atr': False, 'bear_use_adx': True, 'bear_use_spike': False, 'bear_rsi_required': True, 'sideways_strategy': 'breakout', 'sideways_bb_std_mult': 2.1714595991225316, 'sideways_rsi_os': 36, 'sideways_rsi_ob': 61, 'sideways_adx_thresh': 31.892451091141265, 'sideways_atr_min_pct': 0.02689329053644012, 'sideways_atr_max_pct': 0.02208962005102088, 'sideways_tp_mult': 2.1632826448957783, 'sideways_tsl_mult': 0.6364939982371733, 'sideways_time_stop': 210, 'sideways_use_sma': True, 'sideways_use_ema': False, 'sideways_use_atr': False, 'sideways_use_adx': False, 'sideways_use_spike': True, 'sideways_rsi_required': True}.
[I 2025-08-31 03:05:14,413] Trial 778 finished with values: [-1000000000.0, 1000000000.0] and parameters: {'p_sma': 52, 'p_std': 52, 'p_atr': 18, 'p_adx': 28, 'rsi_period': 67, 'ema1': 21, 'ema2': 25, 'slip_atr_k': 0.16479319730735714, 'slip_spread_k': 0.18764751836733726, 'spread_hl_frac': 0.04011791351829377, 'bb_std_mult': 1.6805064483026917, 'rsi_os': 39, 'rsi_ob': 68, 'vol_spike': 0.18340956017116183, 'adx_thresh': 19.024524246677842, 'atr_min_pct': 0.005284993837516553, 'atr_max_pct': 0.11681929087400812, 'tp_mult': 1.4815952152953722, 'tsl_mult': 0.5103565544243918, 'strategy': 'mean_reversion', 'time_stop': 213, 'use_sma': True, 'use_atr': False, 'use_adx': False, 'use_ema': False, 'use_spike': False, 'rsi_required': True, 'edge_k': 0.9778102598931083, 'edge_cap': 0.08225358337280847, 'bull_strategy': 'breakout', 'bull_bb_std_mult': 1.801336697494919, 'bull_rsi_os': 24, 'bull_rsi_ob': 54, 'bull_adx_thresh': 24.693804628927417, 'bull_atr_min_pct': 0.01676972486375175, 'bull_atr_max_pct': 0.053501153859906614, 'bull_tp_mult': 2.3875199732739105, 'bull_tsl_mult': 0.24667002093557755, 'bull_time_stop': 231, 'bull_use_sma': True, 'bull_use_ema': True, 'bull_use_atr': False, 'bull_use_adx': True, 'bull_use_spike': True, 'bull_rsi_required': True, 'bear_strategy': 'mean_reversion', 'bear_bb_std_mult': 1.2565344523545687, 'bear_rsi_os': 18, 'bear_rsi_ob': 47, 'bear_adx_thresh': 6.157478360842122, 'bear_atr_min_pct': 0.021606505337416804, 'bear_atr_max_pct': 0.012478948331137558, 'bear_tp_mult': 2.3427027805052765, 'bear_tsl_mult': 0.5790647911553638, 'bear_time_stop': 18, 'bear_use_sma': False, 'bear_use_ema': False, 'bear_use_atr': False, 'bear_use_adx': True, 'bear_use_spike': False, 'bear_rsi_required': True, 'sideways_strategy': 'breakout', 'sideways_bb_std_mult': 1.766088776283477, 'sideways_rsi_os': 31, 'sideways_rsi_ob': 94, 'sideways_adx_thresh': 21.407710221761487, 'sideways_atr_min_pct': 0.0009913283179797238, 'sideways_atr_max_pct': 0.011907634663885586, 'sideways_tp_mult': 1.7449848411680968, 'sideways_tsl_mult': 0.633448137313821, 'sideways_time_stop': 207, 'sideways_use_sma': True, 'sideways_use_ema': False, 'sideways_use_atr': False, 'sideways_use_adx': False, 'sideways_use_spike': True, 'sideways_rsi_required': True}.
[I 2025-08-31 03:05:14,771] Trial 776 finished with values: [-1000000000.0, 1000000000.0] and parameters: {'p_sma': 52, 'p_std': 31, 'p_atr': 29, 'p_adx': 28, 'rsi_period': 17, 'ema1': 5, 'ema2': 25, 'slip_atr_k': 0.015398430352619806, 'slip_spread_k': 0.18724311651555664, 'spread_hl_frac': 0.025940913209800184, 'bb_std_mult': 1.683315605930336, 'rsi_os': 5, 'rsi_ob': 69, 'vol_spike': 0.13241013675411561, 'adx_thresh': 20.814908514889606, 'atr_min_pct': 0.007831472198751082, 'atr_max_pct': 0.11652825730879232, 'tp_mult': 1.8758267611705275, 'tsl_mult': 0.19990810130844627, 'strategy': 'mean_reversion', 'time_stop': 93, 'use_sma': True, 'use_atr': False, 'use_adx': False, 'use_ema': False, 'use_spike': False, 'rsi_required': True, 'edge_k': 1.824343241601563, 'edge_cap': 0.2497372512768356, 'bull_strategy': 'breakout', 'bull_bb_std_mult': 2.4441830129608975, 'bull_rsi_os': 35, 'bull_rsi_ob': 53, 'bull_adx_thresh': 18.323953708350263, 'bull_atr_min_pct': 0.01665476995110431, 'bull_atr_max_pct': 0.013842909783032306, 'bull_tp_mult': 2.2382874561091715, 'bull_tsl_mult': 0.2940484413522844, 'bull_time_stop': 134, 'bull_use_sma': True, 'bull_use_ema': True, 'bull_use_atr': False, 'bull_use_adx': True, 'bull_use_spike': True, 'bull_rsi_required': True, 'bear_strategy': 'mean_reversion', 'bear_bb_std_mult': 2.538635915642967, 'bear_rsi_os': 17, 'bear_rsi_ob': 45, 'bear_adx_thresh': 5.569508580005806, 'bear_atr_min_pct': 0.007329391615339376, 'bear_atr_max_pct': 0.048057492578908345, 'bear_tp_mult': 2.0024188206314992, 'bear_tsl_mult': 0.5784722461652242, 'bear_time_stop': 259, 'bear_use_sma': False, 'bear_use_ema': False, 'bear_use_atr': False, 'bear_use_adx': True, 'bear_use_spike': False, 'bear_rsi_required': True, 'sideways_strategy': 'breakout', 'sideways_bb_std_mult': 0.6666208398949898, 'sideways_rsi_os': 38, 'sideways_rsi_ob': 93, 'sideways_adx_thresh': 21.15835027403315, 'sideways_atr_min_pct': 0.02696480361729498, 'sideways_atr_max_pct': 0.06034054166145613, 'sideways_tp_mult': 1.7564898298235525, 'sideways_tsl_mult': 0.6448600523362675, 'sideways_time_stop': 266, 'sideways_use_sma': True, 'sideways_use_ema': False, 'sideways_use_atr': False, 'sideways_use_adx': False, 'sideways_use_spike': True, 'sideways_rsi_required': True}.
[I 2025-08-31 03:05:15,460] Trial 779 finished with values: [-1000000000.0, 1000000000.0] and parameters: {'p_sma': 38, 'p_std': 31, 'p_atr': 15, 'p_adx': 28, 'rsi_period': 81, 'ema1': 5, 'ema2': 26, 'slip_atr_k': 0.13916288755743098, 'slip_spread_k': 0.48272103602270955, 'spread_hl_frac': 0.002441097531966754, 'bb_std_mult': 1.7844865299176618, 'rsi_os': 37, 'rsi_ob': 67, 'vol_spike': 0.1841254342568034, 'adx_thresh': 24.638763220970425, 'atr_min_pct': 0.0027916435521632334, 'atr_max_pct': 0.1013724127501889, 'tp_mult': 1.6359331394670755, 'tsl_mult': 0.2083277586528348, 'strategy': 'mean_reversion', 'time_stop': 23, 'use_sma': True, 'use_atr': False, 'use_adx': False, 'use_ema': False, 'use_spike': False, 'rsi_required': True, 'edge_k': 1.0362341173152196, 'edge_cap': 0.24943506788476888, 'bull_strategy': 'breakout', 'bull_bb_std_mult': 2.5138874324266287, 'bull_rsi_os': 50, 'bull_rsi_ob': 54, 'bull_adx_thresh': 29.077974012009122, 'bull_atr_min_pct': 0.016828512703481294, 'bull_atr_max_pct': 0.14703587590162087, 'bull_tp_mult': 1.414282167972049, 'bull_tsl_mult': 0.24810344397301257, 'bull_time_stop': 263, 'bull_use_sma': True, 'bull_use_ema': True, 'bull_use_atr': False, 'bull_use_adx': True, 'bull_use_spike': True, 'bull_rsi_required': True, 'bear_strategy': 'mean_reversion', 'bear_bb_std_mult': 1.1986178454532552, 'bear_rsi_os': 46, 'bear_rsi_ob': 46, 'bear_adx_thresh': 33.30633378519131, 'bear_atr_min_pct': 0.023883552129307428, 'bear_atr_max_pct': 0.010158205243355993, 'bear_tp_mult': 2.049420382125574, 'bear_tsl_mult': 0.044594444151213886, 'bear_time_stop': 16, 'bear_use_sma': False, 'bear_use_ema': False, 'bear_use_atr': True, 'bear_use_adx': True, 'bear_use_spike': False, 'bear_rsi_required': True, 'sideways_strategy': 'breakout', 'sideways_bb_std_mult': 1.9470938923990921, 'sideways_rsi_os': 42, 'sideways_rsi_ob': 83, 'sideways_adx_thresh': 20.306608146023173, 'sideways_atr_min_pct': 0.026745767630516226, 'sideways_atr_max_pct': 0.021182472000128863, 'sideways_tp_mult': 1.7457444775261137, 'sideways_tsl_mult': 0.6316437662432761, 'sideways_time_stop': 209, 'sideways_use_sma': True, 'sideways_use_ema': False, 'sideways_use_atr': False, 'sideways_use_adx': False, 'sideways_use_spike': False, 'sideways_rsi_required': True}.
[I 2025-08-31 03:05:48,390] Trial 782 finished with values: [-1000000000.0, 1000000000.0] and parameters: {'p_sma': 33, 'p_std': 33, 'p_atr': 28, 'p_adx': 30, 'rsi_period': 66, 'ema1': 13, 'ema2': 48, 'slip_atr_k': 0.21662111895666292, 'slip_spread_k': 0.324332026706873, 'spread_hl_frac': 0.005817738615896854, 'bb_std_mult': 1.8010547684452731, 'rsi_os': 37, 'rsi_ob': 70, 'vol_spike': 0.20278621939430963, 'adx_thresh': 22.68746178810603, 'atr_min_pct': 0.007257446216702018, 'atr_max_pct': 0.1207809007994831, 'tp_mult': 2.1055171311619554, 'tsl_mult': 0.6196168794045419, 'strategy': 'mean_reversion', 'time_stop': 101, 'use_sma': False, 'use_atr': False, 'use_adx': False, 'use_ema': False, 'use_spike': False, 'rsi_required': True, 'edge_k': 0.5744142028817714, 'edge_cap': 0.12141287919443722, 'bull_strategy': 'breakout', 'bull_bb_std_mult': 2.5265740760040423, 'bull_rsi_os': 43, 'bull_rsi_ob': 60, 'bull_adx_thresh': 7.144843653037007, 'bull_atr_min_pct': 0.02450902140783602, 'bull_atr_max_pct': 0.14155266743171338, 'bull_tp_mult': 2.3043290974407027, 'bull_tsl_mult': 0.08477013065765177, 'bull_time_stop': 65, 'bull_use_sma': True, 'bull_use_ema': False, 'bull_use_atr': False, 'bull_use_adx': True, 'bull_use_spike': True, 'bull_rsi_required': True, 'bear_strategy': 'breakout', 'bear_bb_std_mult': 1.3790790401542399, 'bear_rsi_os': 20, 'bear_rsi_ob': 46, 'bear_adx_thresh': 5.002856190322462, 'bear_atr_min_pct': 0.025322683377627955, 'bear_atr_max_pct': 0.14466420935392243, 'bear_tp_mult': 2.0484461175658937, 'bear_tsl_mult': 0.5259956261392672, 'bear_time_stop': 192, 'bear_use_sma': False, 'bear_use_ema': False, 'bear_use_atr': True, 'bear_use_adx': False, 'bear_use_spike': False, 'bear_rsi_required': True, 'sideways_strategy': 'breakout', 'sideways_bb_std_mult': 2.6282556617663295, 'sideways_rsi_os': 42, 'sideways_rsi_ob': 94, 'sideways_adx_thresh': 8.780315011508097, 'sideways_atr_min_pct': 0.02935605875862846, 'sideways_atr_max_pct': 0.02677314931627918, 'sideways_tp_mult': 1.631779677253672, 'sideways_tsl_mult': 0.6896349584693945, 'sideways_time_stop': 191, 'sideways_use_sma': True, 'sideways_use_ema': False, 'sideways_use_atr': False, 'sideways_use_adx': True, 'sideways_use_spike': False, 'sideways_rsi_required': False}.
[I 2025-08-31 03:05:48,713] Trial 781 finished with values: [-1000000000.0, 1000000000.0] and parameters: {'p_sma': 54, 'p_std': 31, 'p_atr': 8, 'p_adx': 16, 'rsi_period': 80, 'ema1': 23, 'ema2': 22, 'slip_atr_k': 0.2092026313003917, 'slip_spread_k': 0.2077437847669294, 'spread_hl_frac': 0.04187857431433099, 'bb_std_mult': 1.5956232362964524, 'rsi_os': 37, 'rsi_ob': 70, 'vol_spike': 0.1867593108238091, 'adx_thresh': 22.820861476102422, 'atr_min_pct': 0.007128648394734557, 'atr_max_pct': 0.12024548786438473, 'tp_mult': 1.640651686726644, 'tsl_mult': 0.5631403069001533, 'strategy': 'mean_reversion', 'time_stop': 98, 'use_sma': False, 'use_atr': False, 'use_adx': False, 'use_ema': False, 'use_spike': False, 'rsi_required': True, 'edge_k': 1.2137871923060328, 'edge_cap': 0.667210651865942, 'bull_strategy': 'breakout', 'bull_bb_std_mult': 2.615121682600438, 'bull_rsi_os': 46, 'bull_rsi_ob': 63, 'bull_adx_thresh': 20.82545202183651, 'bull_atr_min_pct': 0.010808493499480161, 'bull_atr_max_pct': 0.14174940915270542, 'bull_tp_mult': 2.236227355398755, 'bull_tsl_mult': 0.7220221809353501, 'bull_time_stop': 279, 'bull_use_sma': True, 'bull_use_ema': False, 'bull_use_atr': False, 'bull_use_adx': True, 'bull_use_spike': True, 'bull_rsi_required': True, 'bear_strategy': 'breakout', 'bear_bb_std_mult': 1.4068005424978867, 'bear_rsi_os': 9, 'bear_rsi_ob': 46, 'bear_adx_thresh': 5.5203106803616695, 'bear_atr_min_pct': 0.018658470880430347, 'bear_atr_max_pct': 0.0194526630250893, 'bear_tp_mult': 2.0388850593053363, 'bear_tsl_mult': 0.11226887540489955, 'bear_time_stop': 90, 'bear_use_sma': False, 'bear_use_ema': False, 'bear_use_atr': True, 'bear_use_adx': False, 'bear_use_spike': False, 'bear_rsi_required': True, 'sideways_strategy': 'breakout', 'sideways_bb_std_mult': 0.6692924726801615, 'sideways_rsi_os': 42, 'sideways_rsi_ob': 71, 'sideways_adx_thresh': 8.763322552787173, 'sideways_atr_min_pct': 0.023826604220332177, 'sideways_atr_max_pct': 0.055304955607992215, 'sideways_tp_mult': 2.843925057580793, 'sideways_tsl_mult': 0.021166560456733596, 'sideways_time_stop': 256, 'sideways_use_sma': True, 'sideways_use_ema': False, 'sideways_use_atr': False, 'sideways_use_adx': True, 'sideways_use_spike': False, 'sideways_rsi_required': False}.
[I 2025-08-31 03:05:48,815] Trial 783 finished with values: [-1000000000.0, 1000000000.0] and parameters: {'p_sma': 54, 'p_std': 11, 'p_atr': 26, 'p_adx': 15, 'rsi_period': 30, 'ema1': 22, 'ema2': 48, 'slip_atr_k': 0.11440062172305634, 'slip_spread_k': 0.0005885142375012808, 'spread_hl_frac': 0.0017981566128517082, 'bb_std_mult': 1.3725289943193995, 'rsi_os': 40, 'rsi_ob': 70, 'vol_spike': 0.10975609782937343, 'adx_thresh': 19.819188259364747, 'atr_min_pct': 0.009227964919913699, 'atr_max_pct': 0.12063547669325156, 'tp_mult': 1.6959206653089307, 'tsl_mult': 0.2894432600837863, 'strategy': 'mean_reversion', 'time_stop': 100, 'use_sma': False, 'use_atr': False, 'use_adx': False, 'use_ema': False, 'use_spike': False, 'rsi_required': True, 'edge_k': 0.545326559984652, 'edge_cap': 0.1170595772851388, 'bull_strategy': 'breakout', 'bull_bb_std_mult': 2.6248692195795282, 'bull_rsi_os': 18, 'bull_rsi_ob': 60, 'bull_adx_thresh': 26.25273829128224, 'bull_atr_min_pct': 0.024523601657248068, 'bull_atr_max_pct': 0.1410275889655556, 'bull_tp_mult': 2.822757700224126, 'bull_tsl_mult': 0.3161376806442563, 'bull_time_stop': 278, 'bull_use_sma': True, 'bull_use_ema': False, 'bull_use_atr': False, 'bull_use_adx': True, 'bull_use_spike': True, 'bull_rsi_required': True, 'bear_strategy': 'breakout', 'bear_bb_std_mult': 1.3366801744711514, 'bear_rsi_os': 36, 'bear_rsi_ob': 88, 'bear_adx_thresh': 5.007426825151479, 'bear_atr_min_pct': 0.00542676252236259, 'bear_atr_max_pct': 0.01878403473743353, 'bear_tp_mult': 1.4512560809582573, 'bear_tsl_mult': 0.521938128796023, 'bear_time_stop': 137, 'bear_use_sma': False, 'bear_use_ema': False, 'bear_use_atr': True, 'bear_use_adx': False, 'bear_use_spike': True, 'bear_rsi_required': True, 'sideways_strategy': 'breakout', 'sideways_bb_std_mult': 0.6720703357585679, 'sideways_rsi_os': 40, 'sideways_rsi_ob': 94, 'sideways_adx_thresh': 8.959904369533557, 'sideways_atr_min_pct': 0.02773275687718707, 'sideways_atr_max_pct': 0.04475314600295694, 'sideways_tp_mult': 1.6451250474954155, 'sideways_tsl_mult': 0.7062135919323048, 'sideways_time_stop': 193, 'sideways_use_sma': True, 'sideways_use_ema': False, 'sideways_use_atr': False, 'sideways_use_adx': True, 'sideways_use_spike': False, 'sideways_rsi_required': False}.
