[I 2025-08-31 00:16:54,999] Trial 119 finished with values: [-1000000000.0, 1000000000.0] and parameters: {'p_sma': 45, 'p_std': 36, 'p_atr': 13, 'p_adx': 8, 'rsi_period': 35, 'ema1': 22, 'ema2': 22, 'slip_atr_k': 0.13986985847452327, 'slip_spread_k': 0.9265131189508888, 'spread_hl_frac': 0.012166660676889804, 'bb_std_mult': 1.3639105517469088, 'rsi_os': 54, 'rsi_ob': 92, 'vol_spike': 0.2356749628346258, 'adx_thresh': 14.296057204377098, 'atr_min_pct': 0.002991924708318114, 'atr_max_pct': 0.0827535281388086, 'tp_mult': 2.476214731673497, 'tsl_mult': 0.7728418013733688, 'strategy': 'breakout', 'time_stop': 60, 'use_sma': False, 'use_atr': False, 'use_adx': False, 'use_ema': False, 'use_spike': False, 'rsi_required': True, 'edge_k': 0.7051086680760351, 'edge_cap': 0.898247041202096, 'bull_strategy': 'mean_reversion', 'bull_bb_std_mult': 1.0019179048164277, 'bull_rsi_os': 19, 'bull_rsi_ob': 94, 'bull_adx_thresh': 29.094877618586374, 'bull_atr_min_pct': 0.0016933560096817598, 'bull_atr_max_pct': 0.11065110787435842, 'bull_tp_mult': 1.1612048084583098, 'bull_tsl_mult': 0.22450269103367188, 'bull_time_stop': 142, 'bull_use_sma': False, 'bull_use_ema': False, 'bull_use_atr': True, 'bull_use_adx': True, 'bull_use_spike': False, 'bull_rsi_required': True, 'bear_strategy': 'mean_reversion', 'bear_bb_std_mult': 3.5048801614253238, 'bear_rsi_os': 15, 'bear_rsi_ob': 77, 'bear_adx_thresh': 27.345195845000347, 'bear_atr_min_pct': 0.007337890028122168, 'bear_atr_max_pct': 0.1331853725057363, 'bear_tp_mult': 1.2788536091343063, 'bear_tsl_mult': 0.35927754967046177, 'bear_time_stop': 24, 'bear_use_sma': False, 'bear_use_ema': False, 'bear_use_atr': True, 'bear_use_adx': False, 'bear_use_spike': False, 'bear_rsi_required': False, 'sideways_strategy': 'mean_reversion', 'sideways_bb_std_mult': 1.3209035153856037, 'sideways_rsi_os': 11, 'sideways_rsi_ob': 53, 'sideways_adx_thresh': 9.06363056788309, 'sideways_atr_min_pct': 0.02261139593813899, 'sideways_atr_max_pct': 0.12497494096741235, 'sideways_tp_mult': 1.226969842589158, 'sideways_tsl_mult': 0.24048317814931985, 'sideways_time_stop': 71, 'sideways_use_sma': True, 'sideways_use_ema': True, 'sideways_use_atr': True, 'sideways_use_adx': True, 'sideways_use_spike': False, 'sideways_rsi_required': False}.
[I 2025-08-31 00:16:55,285] Trial 120 finished with values: [-0.023992658816858192, 0.023893933588868134] and parameters: {'p_sma': 50, 'p_std': 34, 'p_atr': 13, 'p_adx': 17, 'rsi_period': 75, 'ema1': 27, 'ema2': 22, 'slip_atr_k': 0.14470940549229794, 'slip_spread_k': 0.12040000142793289, 'spread_hl_frac': 0.04457567964294212, 'bb_std_mult': 1.4664035308906456, 'rsi_os': 54, 'rsi_ob': 60, 'vol_spike': 0.0067708721892095584, 'adx_thresh': 14.443895923485755, 'atr_min_pct': 0.0013504321920823476, 'atr_max_pct': 0.08192598162376165, 'tp_mult': 1.7210125147018864, 'tsl_mult': 0.7698778654955416, 'strategy': 'breakout', 'time_stop': 66, 'use_sma': False, 'use_atr': False, 'use_adx': False, 'use_ema': False, 'use_spike': False, 'rsi_required': True, 'edge_k': 0.7132327022310313, 'edge_cap': 0.9084875334068435, 'bull_strategy': 'mean_reversion', 'bull_bb_std_mult': 2.5702323934322293, 'bull_rsi_os': 44, 'bull_rsi_ob': 76, 'bull_adx_thresh': 12.81213881954249, 'bull_atr_min_pct': 0.0013887387343788846, 'bull_atr_max_pct': 0.019598506069539896, 'bull_tp_mult': 1.4642051757867853, 'bull_tsl_mult': 0.22254681285841232, 'bull_time_stop': 133, 'bull_use_sma': False, 'bull_use_ema': False, 'bull_use_atr': True, 'bull_use_adx': True, 'bull_use_spike': False, 'bull_rsi_required': True, 'bear_strategy': 'mean_reversion', 'bear_bb_std_mult': 3.2842560422200986, 'bear_rsi_os': 17, 'bear_rsi_ob': 77, 'bear_adx_thresh': 30.537649733374607, 'bear_atr_min_pct': 0.007095371011882549, 'bear_atr_max_pct': 0.025180311312169364, 'bear_tp_mult': 2.1861091421900936, 'bear_tsl_mult': 0.3483821954683338, 'bear_time_stop': 94, 'bear_use_sma': False, 'bear_use_ema': False, 'bear_use_atr': True, 'bear_use_adx': False, 'bear_use_spike': False, 'bear_rsi_required': False, 'sideways_strategy': 'mean_reversion', 'sideways_bb_std_mult': 1.4626830035956273, 'sideways_rsi_os': 46, 'sideways_rsi_ob': 70, 'sideways_adx_thresh': 11.173741777202636, 'sideways_atr_min_pct': 0.029004149967675148, 'sideways_atr_max_pct': 0.033754836970434056, 'sideways_tp_mult': 2.347270612721859, 'sideways_tsl_mult': 0.9637067713181133, 'sideways_time_stop': 253, 'sideways_use_sma': True, 'sideways_use_ema': True, 'sideways_use_atr': True, 'sideways_use_adx': True, 'sideways_use_spike': False, 'sideways_rsi_required': False}.
[I 2025-08-31 00:16:55,681] Trial 118 finished with values: [-1000000000.0, 1000000000.0] and parameters: {'p_sma': 45, 'p_std': 43, 'p_atr': 14, 'p_adx': 8, 'rsi_period': 76, 'ema1': 27, 'ema2': 22, 'slip_atr_k': 0.14457383262389684, 'slip_spread_k': 0.6437333057510326, 'spread_hl_frac': 0.04522212508914051, 'bb_std_mult': 1.1373235039061562, 'rsi_os': 54, 'rsi_ob': 92, 'vol_spike': 0.00846785963552794, 'adx_thresh': 14.43965739880308, 'atr_min_pct': 0.019468299874534675, 'atr_max_pct': 0.03642806262905212, 'tp_mult': 2.4829198703940873, 'tsl_mult': 0.1468716521277884, 'strategy': 'breakout', 'time_stop': 70, 'use_sma': True, 'use_atr': False, 'use_adx': False, 'use_ema': False, 'use_spike': False, 'rsi_required': True, 'edge_k': 0.7086353467379319, 'edge_cap': 0.9078126982647156, 'bull_strategy': 'mean_reversion', 'bull_bb_std_mult': 1.6656615113736644, 'bull_rsi_os': 19, 'bull_rsi_ob': 76, 'bull_adx_thresh': 13.123860198360795, 'bull_atr_min_pct': 0.025679040186073202, 'bull_atr_max_pct': 0.13908576705363446, 'bull_tp_mult': 1.3714726711040202, 'bull_tsl_mult': 0.2392727397195575, 'bull_time_stop': 135, 'bull_use_sma': False, 'bull_use_ema': False, 'bull_use_atr': True, 'bull_use_adx': True, 'bull_use_spike': False, 'bull_rsi_required': True, 'bear_strategy': 'mean_reversion', 'bear_bb_std_mult': 3.270082534404241, 'bear_rsi_os': 16, 'bear_rsi_ob': 77, 'bear_adx_thresh': 5.667190990385079, 'bear_atr_min_pct': 0.007174174041121955, 'bear_atr_max_pct': 0.043570304331988594, 'bear_tp_mult': 2.205587289822107, 'bear_tsl_mult': 0.5104502862952152, 'bear_time_stop': 90, 'bear_use_sma': True, 'bear_use_ema': False, 'bear_use_atr': True, 'bear_use_adx': False, 'bear_use_spike': True, 'bear_rsi_required': False, 'sideways_strategy': 'mean_reversion', 'sideways_bb_std_mult': 1.325855697300601, 'sideways_rsi_os': 21, 'sideways_rsi_ob': 70, 'sideways_adx_thresh': 11.318560326029626, 'sideways_atr_min_pct': 0.02087302803794849, 'sideways_atr_max_pct': 0.1250332211047327, 'sideways_tp_mult': 2.919827029279567, 'sideways_tsl_mult': 0.337410411232877, 'sideways_time_stop': 35, 'sideways_use_sma': False, 'sideways_use_ema': True, 'sideways_use_atr': False, 'sideways_use_adx': True, 'sideways_use_spike': True, 'sideways_rsi_required': False}.
[I 2025-08-31 00:16:55,682] Trial 117 finished with values: [-0.03160022791381545, 0.031555805074081456] and parameters: {'p_sma': 43, 'p_std': 5, 'p_atr': 14, 'p_adx': 8, 'rsi_period': 31, 'ema1': 26, 'ema2': 21, 'slip_atr_k': 0.1417137719932039, 'slip_spread_k': 0.10115243873736457, 'spread_hl_frac': 0.007813515908644677, 'bb_std_mult': 1.0990141903999238, 'rsi_os': 54, 'rsi_ob': 79, 'vol_spike': 0.2538141725137629, 'adx_thresh': 17.929384216020562, 'atr_min_pct': 0.002051539451611746, 'atr_max_pct': 0.03925757964798736, 'tp_mult': 2.633026469599663, 'tsl_mult': 0.48915074888002774, 'strategy': 'breakout', 'time_stop': 69, 'use_sma': True, 'use_atr': False, 'use_adx': False, 'use_ema': False, 'use_spike': False, 'rsi_required': True, 'edge_k': 0.5329558415224489, 'edge_cap': 0.9007300805246075, 'bull_strategy': 'mean_reversion', 'bull_bb_std_mult': 2.265350097919787, 'bull_rsi_os': 44, 'bull_rsi_ob': 76, 'bull_adx_thresh': 13.380219371339571, 'bull_atr_min_pct': 0.0013374729183172301, 'bull_atr_max_pct': 0.13870027876372645, 'bull_tp_mult': 1.3747319816920869, 'bull_tsl_mult': 0.4331748490220523, 'bull_time_stop': 154, 'bull_use_sma': False, 'bull_use_ema': False, 'bull_use_atr': True, 'bull_use_adx': True, 'bull_use_spike': False, 'bull_rsi_required': False, 'bear_strategy': 'mean_reversion', 'bear_bb_std_mult': 2.2876382439427596, 'bear_rsi_os': 17, 'bear_rsi_ob': 77, 'bear_adx_thresh': 23.416479091696417, 'bear_atr_min_pct': 0.007319535018002592, 'bear_atr_max_pct': 0.029323758772262745, 'bear_tp_mult': 1.2870498694959978, 'bear_tsl_mult': 0.35846363928538916, 'bear_time_stop': 132, 'bear_use_sma': True, 'bear_use_ema': False, 'bear_use_atr': True, 'bear_use_adx': True, 'bear_use_spike': False, 'bear_rsi_required': False, 'sideways_strategy': 'mean_reversion', 'sideways_bb_std_mult': 1.2073382737610077, 'sideways_rsi_os': 46, 'sideways_rsi_ob': 93, 'sideways_adx_thresh': 11.51845908255068, 'sideways_atr_min_pct': 0.02070116344138701, 'sideways_atr_max_pct': 0.11822033340488299, 'sideways_tp_mult': 2.793245960698965, 'sideways_tsl_mult': 0.8833556390327035, 'sideways_time_stop': 103, 'sideways_use_sma': False, 'sideways_use_ema': True, 'sideways_use_atr': False, 'sideways_use_adx': True, 'sideways_use_spike': True, 'sideways_rsi_required': False}.
[I 2025-08-31 00:17:27,928] Trial 122 finished with values: [-1000000000.0, 1000000000.0] and parameters: {'p_sma': 47, 'p_std': 40, 'p_atr': 12, 'p_adx': 8, 'rsi_period': 54, 'ema1': 23, 'ema2': 58, 'slip_atr_k': 0.09082994693269208, 'slip_spread_k': 0.7860945716898459, 'spread_hl_frac': 0.008387315432805225, 'bb_std_mult': 3.53279498347781, 'rsi_os': 45, 'rsi_ob': 53, 'vol_spike': 0.19874054095391824, 'adx_thresh': 12.055657723101739, 'atr_min_pct': 0.0020463767819722625, 'atr_max_pct': 0.03446192630712888, 'tp_mult': 2.6381363450704174, 'tsl_mult': 0.4781122479553459, 'strategy': 'breakout', 'time_stop': 71, 'use_sma': True, 'use_atr': False, 'use_adx': False, 'use_ema': False, 'use_spike': False, 'rsi_required': True, 'edge_k': 0.7724252523201861, 'edge_cap': 0.3204385324649318, 'bull_strategy': 'breakout', 'bull_bb_std_mult': 2.0575941115189527, 'bull_rsi_os': 34, 'bull_rsi_ob': 63, 'bull_adx_thresh': 21.721848164614517, 'bull_atr_min_pct': 0.007606855769316228, 'bull_atr_max_pct': 0.13900611102811247, 'bull_tp_mult': 1.3684003048968187, 'bull_tsl_mult': 0.3358769012145957, 'bull_time_stop': 170, 'bull_use_sma': False, 'bull_use_ema': True, 'bull_use_atr': False, 'bull_use_adx': True, 'bull_use_spike': False, 'bull_rsi_required': False, 'bear_strategy': 'breakout', 'bear_bb_std_mult': 0.6628009872695193, 'bear_rsi_os': 28, 'bear_rsi_ob': 79, 'bear_adx_thresh': 5.818341023421835, 'bear_atr_min_pct': 0.010829403113408543, 'bear_atr_max_pct': 0.12281394899990383, 'bear_tp_mult': 2.034809973484523, 'bear_tsl_mult': 0.26272829064237657, 'bear_time_stop': 46, 'bear_use_sma': True, 'bear_use_ema': False, 'bear_use_atr': True, 'bear_use_adx': True, 'bear_use_spike': True, 'bear_rsi_required': False, 'sideways_strategy': 'mean_reversion', 'sideways_bb_std_mult': 3.4276388395445636, 'sideways_rsi_os': 14, 'sideways_rsi_ob': 89, 'sideways_adx_thresh': 13.85476341694261, 'sideways_atr_min_pct': 0.019722204823499356, 'sideways_atr_max_pct': 0.10906045989228265, 'sideways_tp_mult': 1.1707903248445517, 'sideways_tsl_mult': 0.32092518265563946, 'sideways_time_stop': 159, 'sideways_use_sma': False, 'sideways_use_ema': False, 'sideways_use_atr': False, 'sideways_use_adx': False, 'sideways_use_spike': True, 'sideways_rsi_required': False}.
[I 2025-08-31 00:17:28,376] Trial 124 finished with values: [-1000000000.0, 1000000000.0] and parameters: {'p_sma': 49, 'p_std': 34, 'p_atr': 12, 'p_adx': 9, 'rsi_period': 18, 'ema1': 27, 'ema2': 18, 'slip_atr_k': 0.06298487274752226, 'slip_spread_k': 0.8424843769352617, 'spread_hl_frac': 0.04162802807796087, 'bb_std_mult': 1.6455642197921176, 'rsi_os': 55, 'rsi_ob': 63, 'vol_spike': 0.20225035939933944, 'adx_thresh': 12.760974709326538, 'atr_min_pct': 0.0013733239986689263, 'atr_max_pct': 0.07585510953042209, 'tp_mult': 1.7689646008280895, 'tsl_mult': 0.41639352772482036, 'strategy': 'breakout', 'time_stop': 17, 'use_sma': True, 'use_atr': False, 'use_adx': False, 'use_ema': False, 'use_spike': False, 'rsi_required': True, 'edge_k': 0.8757715893862347, 'edge_cap': 0.05049890575552801, 'bull_strategy': 'breakout', 'bull_bb_std_mult': 3.513034290169683, 'bull_rsi_os': 34, 'bull_rsi_ob': 90, 'bull_adx_thresh': 12.518257486688846, 'bull_atr_min_pct': 0.00796086608054293, 'bull_atr_max_pct': 0.038449759335344134, 'bull_tp_mult': 2.9309098076336286, 'bull_tsl_mult': 0.32735716072170223, 'bull_time_stop': 160, 'bull_use_sma': False, 'bull_use_ema': True, 'bull_use_atr': False, 'bull_use_adx': True, 'bull_use_spike': False, 'bull_rsi_required': False, 'bear_strategy': 'breakout', 'bear_bb_std_mult': 0.6914102440806534, 'bear_rsi_os': 40, 'bear_rsi_ob': 79, 'bear_adx_thresh': 19.386300552256614, 'bear_atr_min_pct': 0.010675150619082219, 'bear_atr_max_pct': 0.11076684819586954, 'bear_tp_mult': 2.9411752188133327, 'bear_tsl_mult': 0.3228240916290074, 'bear_time_stop': 74, 'bear_use_sma': False, 'bear_use_ema': False, 'bear_use_atr': True, 'bear_use_adx': True, 'bear_use_spike': False, 'bear_rsi_required': False, 'sideways_strategy': 'mean_reversion', 'sideways_bb_std_mult': 3.4350019359205417, 'sideways_rsi_os': 45, 'sideways_rsi_ob': 69, 'sideways_adx_thresh': 13.908023118583493, 'sideways_atr_min_pct': 0.01956549498438785, 'sideways_atr_max_pct': 0.037057012420583305, 'sideways_tp_mult': 1.1675109811822337, 'sideways_tsl_mult': 0.4686458426263581, 'sideways_time_stop': 191, 'sideways_use_sma': True, 'sideways_use_ema': False, 'sideways_use_atr': True, 'sideways_use_adx': False, 'sideways_use_spike': True, 'sideways_rsi_required': False}.
[I 2025-08-31 00:17:28,533] Trial 123 finished with values: [-1000000000.0, 1000000000.0] and parameters: {'p_sma': 50, 'p_std': 34, 'p_atr': 12, 'p_adx': 14, 'rsi_period': 10, 'ema1': 27, 'ema2': 19, 'slip_atr_k': 0.10746489371441686, 'slip_spread_k': 0.1147416441464543, 'spread_hl_frac': 0.015839906764122176, 'bb_std_mult': 3.533251537069567, 'rsi_os': 55, 'rsi_ob': 60, 'vol_spike': 0.2028737034239607, 'adx_thresh': 12.122040001735582, 'atr_min_pct': 0.0012736061162648483, 'atr_max_pct': 0.034574742151024664, 'tp_mult': 1.7449452740603943, 'tsl_mult': 0.838389014289098, 'strategy': 'breakout', 'time_stop': 17, 'use_sma': True, 'use_atr': False, 'use_adx': False, 'use_ema': False, 'use_spike': False, 'rsi_required': True, 'edge_k': 0.7828553357615112, 'edge_cap': 0.08459885117974386, 'bull_strategy': 'breakout', 'bull_bb_std_mult': 3.502965597842658, 'bull_rsi_os': 16, 'bull_rsi_ob': 90, 'bull_adx_thresh': 12.556085112346722, 'bull_atr_min_pct': 0.0025136842347241225, 'bull_atr_max_pct': 0.020511937391411814, 'bull_tp_mult': 2.9936462735348757, 'bull_tsl_mult': 0.33689084236780303, 'bull_time_stop': 47, 'bull_use_sma': False, 'bull_use_ema': True, 'bull_use_atr': False, 'bull_use_adx': True, 'bull_use_spike': False, 'bull_rsi_required': False, 'bear_strategy': 'breakout', 'bear_bb_std_mult': 0.6601867938701252, 'bear_rsi_os': 32, 'bear_rsi_ob': 79, 'bear_adx_thresh': 19.58846436496777, 'bear_atr_min_pct': 0.010938362067011036, 'bear_atr_max_pct': 0.1274319784492438, 'bear_tp_mult': 1.7792875486962765, 'bear_tsl_mult': 0.3320318498583786, 'bear_time_stop': 45, 'bear_use_sma': False, 'bear_use_ema': False, 'bear_use_atr': True, 'bear_use_adx': True, 'bear_use_spike': False, 'bear_rsi_required': False, 'sideways_strategy': 'mean_reversion', 'sideways_bb_std_mult': 1.6249929509411558, 'sideways_rsi_os': 43, 'sideways_rsi_ob': 72, 'sideways_adx_thresh': 13.469449221725625, 'sideways_atr_min_pct': 0.029554541969337513, 'sideways_atr_max_pct': 0.030282701017227992, 'sideways_tp_mult': 1.1569518143973492, 'sideways_tsl_mult': 0.4004031848208503, 'sideways_time_stop': 158, 'sideways_use_sma': True, 'sideways_use_ema': False, 'sideways_use_atr': True, 'sideways_use_adx': False, 'sideways_use_spike': True, 'sideways_rsi_required': False}.
[I 2025-08-31 00:17:28,646] Trial 121 finished with values: [-1000000000.0, 1000000000.0] and parameters: {'p_sma': 49, 'p_std': 41, 'p_atr': 12, 'p_adx': 8, 'rsi_period': 75, 'ema1': 20, 'ema2': 22, 'slip_atr_k': 0.022832629865185763, 'slip_spread_k': 0.7778224477001521, 'spread_hl_frac': 0.04094662594115683, 'bb_std_mult': 3.5417067631352968, 'rsi_os': 54, 'rsi_ob': 60, 'vol_spike': 0.009176177735174785, 'adx_thresh': 12.77077209096094, 'atr_min_pct': 0.019574491492757067, 'atr_max_pct': 0.0349479443815885, 'tp_mult': 2.629849208669699, 'tsl_mult': 0.906318515652127, 'strategy': 'breakout', 'time_stop': 72, 'use_sma': True, 'use_atr': False, 'use_adx': False, 'use_ema': False, 'use_spike': False, 'rsi_required': True, 'edge_k': 0.8720472078451353, 'edge_cap': 0.5204542309310046, 'bull_strategy': 'breakout', 'bull_bb_std_mult': 2.3824865566360156, 'bull_rsi_os': 33, 'bull_rsi_ob': 86, 'bull_adx_thresh': 12.728121566563154, 'bull_atr_min_pct': 0.025405702257563008, 'bull_atr_max_pct': 0.04853379449729507, 'bull_tp_mult': 2.9452237685987823, 'bull_tsl_mult': 0.24175985608929107, 'bull_time_stop': 154, 'bull_use_sma': False, 'bull_use_ema': True, 'bull_use_atr': True, 'bull_use_adx': True, 'bull_use_spike': False, 'bull_rsi_required': True, 'bear_strategy': 'mean_reversion', 'bear_bb_std_mult': 3.3327189940933373, 'bear_rsi_os': 40, 'bear_rsi_ob': 79, 'bear_adx_thresh': 19.380525496409046, 'bear_atr_min_pct': 0.024450947439122378, 'bear_atr_max_pct': 0.12317606782750751, 'bear_tp_mult': 2.196251210475446, 'bear_tsl_mult': 0.1827591959546403, 'bear_time_stop': 87, 'bear_use_sma': True, 'bear_use_ema': False, 'bear_use_atr': True, 'bear_use_adx': False, 'bear_use_spike': False, 'bear_rsi_required': False, 'sideways_strategy': 'mean_reversion', 'sideways_bb_std_mult': 1.4628039919442395, 'sideways_rsi_os': 25, 'sideways_rsi_ob': 89, 'sideways_adx_thresh': 11.37420838092163, 'sideways_atr_min_pct': 0.019599426590488536, 'sideways_atr_max_pct': 0.037253226127830656, 'sideways_tp_mult': 1.1684069438625557, 'sideways_tsl_mult': 0.4658896128118659, 'sideways_time_stop': 35, 'sideways_use_sma': False, 'sideways_use_ema': True, 'sideways_use_atr': False, 'sideways_use_adx': True, 'sideways_use_spike': True, 'sideways_rsi_required': False}.
[I 2025-08-31 00:17:59,394] Trial 126 finished with values: [-1000000000.0, 1000000000.0] and parameters: {'p_sma': 50, 'p_std': 41, 'p_atr': 13, 'p_adx': 17, 'rsi_period': 37, 'ema1': 27, 'ema2': 16, 'slip_atr_k': 0.02205522238059362, 'slip_spread_k': 0.11615504816579766, 'spread_hl_frac': 0.01535666346505434, 'bb_std_mult': 1.8188794740627665, 'rsi_os': 53, 'rsi_ob': 74, 'vol_spike': 0.013200642377540003, 'adx_thresh': 10.447773145200607, 'atr_min_pct': 0.015406523781959343, 'atr_max_pct': 0.09053021540599587, 'tp_mult': 2.575593756197059, 'tsl_mult': 0.6716239960781429, 'strategy': 'breakout', 'time_stop': 28, 'use_sma': False, 'use_atr': False, 'use_adx': False, 'use_ema': True, 'use_spike': False, 'rsi_required': True, 'edge_k': 0.8577206107606439, 'edge_cap': 0.38693763008406806, 'bull_strategy': 'breakout', 'bull_bb_std_mult': 2.3586336252150804, 'bull_rsi_os': 15, 'bull_rsi_ob': 87, 'bull_adx_thresh': 14.660285553048649, 'bull_atr_min_pct': 0.0024197884791817732, 'bull_atr_max_pct': 0.0487415239827342, 'bull_tp_mult': 2.9240774092986994, 'bull_tsl_mult': 0.626583485045905, 'bull_time_stop': 271, 'bull_use_sma': False, 'bull_use_ema': True, 'bull_use_atr': False, 'bull_use_adx': True, 'bull_use_spike': False, 'bull_rsi_required': True, 'bear_strategy': 'breakout', 'bear_bb_std_mult': 0.850750648924095, 'bear_rsi_os': 30, 'bear_rsi_ob': 83, 'bear_adx_thresh': 17.686943568909232, 'bear_atr_min_pct': 0.02226727609254809, 'bear_atr_max_pct': 0.14281598020069694, 'bear_tp_mult': 2.4339189013785494, 'bear_tsl_mult': 0.2896234831847518, 'bear_time_stop': 300, 'bear_use_sma': False, 'bear_use_ema': False, 'bear_use_atr': True, 'bear_use_adx': False, 'bear_use_spike': False, 'bear_rsi_required': False, 'sideways_strategy': 'mean_reversion', 'sideways_bb_std_mult': 1.4823647324671105, 'sideways_rsi_os': 43, 'sideways_rsi_ob': 72, 'sideways_adx_thresh': 9.884947718168606, 'sideways_atr_min_pct': 0.02257977822325395, 'sideways_atr_max_pct': 0.1002182642670709, 'sideways_tp_mult': 2.359808267687098, 'sideways_tsl_mult': 0.9949628888265422, 'sideways_time_stop': 259, 'sideways_use_sma': False, 'sideways_use_ema': False, 'sideways_use_atr': True, 'sideways_use_adx': False, 'sideways_use_spike': False, 'sideways_rsi_required': False}.
