[I 2025-08-31 03:17:51,392] Trial 874 finished with values: [-1000000000.0, 1000000000.0] and parameters: {'p_sma': 43, 'p_std': 7, 'p_atr': 29, 'p_adx': 30, 'rsi_period': 71, 'ema1': 9, 'ema2': 28, 'slip_atr_k': 0.0034929722288363357, 'slip_spread_k': 0.15736641632237872, 'spread_hl_frac': 0.0027106829608356518, 'bb_std_mult': 1.0756467764672246, 'rsi_os': 7, 'rsi_ob': 65, 'vol_spike': 0.17514197905659154, 'adx_thresh': 20.330067052409483, 'atr_min_pct': 0.008351143236777908, 'atr_max_pct': 0.11659626923898735, 'tp_mult': 1.8055158313076536, 'tsl_mult': 0.6161261354565541, 'strategy': 'mean_reversion', 'time_stop': 38, 'use_sma': True, 'use_atr': True, 'use_adx': False, 'use_ema': False, 'use_spike': False, 'rsi_required': True, 'edge_k': 0.5915119907493859, 'edge_cap': 0.11283688103603946, 'bull_strategy': 'breakout', 'bull_bb_std_mult': 1.723165151392917, 'bull_rsi_os': 7, 'bull_rsi_ob': 74, 'bull_adx_thresh': 6.580974067750432, 'bull_atr_min_pct': 0.018573912378286813, 'bull_atr_max_pct': 0.027087365589005902, 'bull_tp_mult': 2.3357451971101275, 'bull_tsl_mult': 0.8678816539754772, 'bull_time_stop': 139, 'bull_use_sma': False, 'bull_use_ema': False, 'bull_use_atr': True, 'bull_use_adx': True, 'bull_use_spike': False, 'bull_rsi_required': True, 'bear_strategy': 'mean_reversion', 'bear_bb_std_mult': 1.3942617535671382, 'bear_rsi_os': 17, 'bear_rsi_ob': 52, 'bear_adx_thresh': 6.403610991263599, 'bear_atr_min_pct': 0.013898113073815551, 'bear_atr_max_pct': 0.04003213162883031, 'bear_tp_mult': 2.1474488608163873, 'bear_tsl_mult': 0.5434854460727963, 'bear_time_stop': 55, 'bear_use_sma': False, 'bear_use_ema': False, 'bear_use_atr': False, 'bear_use_adx': True, 'bear_use_spike': False, 'bear_rsi_required': True, 'sideways_strategy': 'mean_reversion', 'sideways_bb_std_mult': 0.5653777980505412, 'sideways_rsi_os': 15, 'sideways_rsi_ob': 94, 'sideways_adx_thresh': 15.990222935221073, 'sideways_atr_min_pct': 0.026667557420777626, 'sideways_atr_max_pct': 0.05550372179557731, 'sideways_tp_mult': 2.0441832255787653, 'sideways_tsl_mult': 0.8877128937951188, 'sideways_time_stop': 205, 'sideways_use_sma': False, 'sideways_use_ema': False, 'sideways_use_atr': False, 'sideways_use_adx': False, 'sideways_use_spike': True, 'sideways_rsi_required': False}.
[I 2025-08-31 03:17:51,689] Trial 871 finished with values: [-1000000000.0, 1000000000.0] and parameters: {'p_sma': 55, 'p_std': 50, 'p_atr': 29, 'p_adx': 22, 'rsi_period': 71, 'ema1': 5, 'ema2': 28, 'slip_atr_k': 0.0703376922877191, 'slip_spread_k': 0.17408488136810982, 'spread_hl_frac': 0.0063369243469806255, 'bb_std_mult': 1.2022736783011014, 'rsi_os': 8, 'rsi_ob': 92, 'vol_spike': 0.24208316414315906, 'adx_thresh': 26.990761625141914, 'atr_min_pct': 0.010979694049046885, 'atr_max_pct': 0.11491172696339422, 'tp_mult': 1.7721255126039603, 'tsl_mult': 0.4725962675900348, 'strategy': 'mean_reversion', 'time_stop': 110, 'use_sma': True, 'use_atr': True, 'use_adx': False, 'use_ema': False, 'use_spike': False, 'rsi_required': True, 'edge_k': 1.6087416203687166, 'edge_cap': 0.10812392725898899, 'bull_strategy': 'breakout', 'bull_bb_std_mult': 2.555963415414242, 'bull_rsi_os': 34, 'bull_rsi_ob': 73, 'bull_adx_thresh': 6.525308159739584, 'bull_atr_min_pct': 0.023004583378626656, 'bull_atr_max_pct': 0.02367442928662341, 'bull_tp_mult': 2.343160377658936, 'bull_tsl_mult': 0.2738271768910458, 'bull_time_stop': 253, 'bull_use_sma': False, 'bull_use_ema': False, 'bull_use_atr': False, 'bull_use_adx': False, 'bull_use_spike': True, 'bull_rsi_required': True, 'bear_strategy': 'mean_reversion', 'bear_bb_std_mult': 1.4065468221988329, 'bear_rsi_os': 18, 'bear_rsi_ob': 47, 'bear_adx_thresh': 6.720480015545623, 'bear_atr_min_pct': 0.007129016293800153, 'bear_atr_max_pct': 0.1194540652048918, 'bear_tp_mult': 2.141931648711027, 'bear_tsl_mult': 0.41673009328895594, 'bear_time_stop': 130, 'bear_use_sma': False, 'bear_use_ema': False, 'bear_use_atr': False, 'bear_use_adx': True, 'bear_use_spike': False, 'bear_rsi_required': True, 'sideways_strategy': 'mean_reversion', 'sideways_bb_std_mult': 0.7343409205852459, 'sideways_rsi_os': 34, 'sideways_rsi_ob': 93, 'sideways_adx_thresh': 15.692617242721479, 'sideways_atr_min_pct': 0.027716246835373323, 'sideways_atr_max_pct': 0.12492068005607732, 'sideways_tp_mult': 2.355984590060201, 'sideways_tsl_mult': 0.635925912592822, 'sideways_time_stop': 250, 'sideways_use_sma': False, 'sideways_use_ema': False, 'sideways_use_atr': False, 'sideways_use_adx': False, 'sideways_use_spike': True, 'sideways_rsi_required': False}.
[I 2025-08-31 03:17:53,517] Trial 875 finished with values: [-1000000000.0, 1000000000.0] and parameters: {'p_sma': 41, 'p_std': 58, 'p_atr': 29, 'p_adx': 16, 'rsi_period': 28, 'ema1': 5, 'ema2': 13, 'slip_atr_k': 0.20354113953858258, 'slip_spread_k': 0.16979772796063725, 'spread_hl_frac': 0.028484930033361704, 'bb_std_mult': 1.5109718710626623, 'rsi_os': 49, 'rsi_ob': 72, 'vol_spike': 0.173498347071616, 'adx_thresh': 20.38059009006668, 'atr_min_pct': 0.016752726441867833, 'atr_max_pct': 0.11739664236516366, 'tp_mult': 1.234861513037593, 'tsl_mult': 0.8961710109979095, 'strategy': 'mean_reversion', 'time_stop': 38, 'use_sma': True, 'use_atr': False, 'use_adx': False, 'use_ema': False, 'use_spike': True, 'rsi_required': False, 'edge_k': 1.1194704186958413, 'edge_cap': 0.11361647146492392, 'bull_strategy': 'breakout', 'bull_bb_std_mult': 1.996549238457687, 'bull_rsi_os': 31, 'bull_rsi_ob': 73, 'bull_adx_thresh': 6.570440598601021, 'bull_atr_min_pct': 0.008555965632300344, 'bull_atr_max_pct': 0.026894894986840404, 'bull_tp_mult': 2.2690297773503003, 'bull_tsl_mult': 0.27462858201076296, 'bull_time_stop': 136, 'bull_use_sma': True, 'bull_use_ema': False, 'bull_use_atr': False, 'bull_use_adx': True, 'bull_use_spike': False, 'bull_rsi_required': True, 'bear_strategy': 'mean_reversion', 'bear_bb_std_mult': 1.354682437320539, 'bear_rsi_os': 15, 'bear_rsi_ob': 94, 'bear_adx_thresh': 21.926457271855593, 'bear_atr_min_pct': 0.007188618756768127, 'bear_atr_max_pct': 0.010007400933776053, 'bear_tp_mult': 1.9721873958990304, 'bear_tsl_mult': 0.5456783215621679, 'bear_time_stop': 124, 'bear_use_sma': False, 'bear_use_ema': True, 'bear_use_atr': False, 'bear_use_adx': True, 'bear_use_spike': False, 'bear_rsi_required': True, 'sideways_strategy': 'breakout', 'sideways_bb_std_mult': 0.7509993316450511, 'sideways_rsi_os': 41, 'sideways_rsi_ob': 92, 'sideways_adx_thresh': 25.017338049530373, 'sideways_atr_min_pct': 0.01519735650287253, 'sideways_atr_max_pct': 0.055722813960641215, 'sideways_tp_mult': 2.047156688700609, 'sideways_tsl_mult': 0.6646734390370095, 'sideways_time_stop': 204, 'sideways_use_sma': True, 'sideways_use_ema': False, 'sideways_use_atr': False, 'sideways_use_adx': False, 'sideways_use_spike': True, 'sideways_rsi_required': False}.
[I 2025-08-31 03:18:25,691] Trial 876 finished with values: [-1000000000.0, 1000000000.0] and parameters: {'p_sma': 54, 'p_std': 49, 'p_atr': 29, 'p_adx': 23, 'rsi_period': 68, 'ema1': 5, 'ema2': 27, 'slip_atr_k': 0.0275508286199733, 'slip_spread_k': 0.7333572067888866, 'spread_hl_frac': 0.046534962651305495, 'bb_std_mult': 1.7704029555158516, 'rsi_os': 7, 'rsi_ob': 71, 'vol_spike': 0.17396625412500272, 'adx_thresh': 20.173414613207726, 'atr_min_pct': 0.016623699543309087, 'atr_max_pct': 0.10201170009962857, 'tp_mult': 1.234966539929463, 'tsl_mult': 0.2062781336788304, 'strategy': 'mean_reversion', 'time_stop': 27, 'use_sma': True, 'use_atr': False, 'use_adx': False, 'use_ema': True, 'use_spike': True, 'rsi_required': False, 'edge_k': 0.3171946953020621, 'edge_cap': 0.28178102148101924, 'bull_strategy': 'breakout', 'bull_bb_std_mult': 1.969634893828591, 'bull_rsi_os': 40, 'bull_rsi_ob': 66, 'bull_adx_thresh': 6.673981079057166, 'bull_atr_min_pct': 0.010704739582903524, 'bull_atr_max_pct': 0.12362930060760055, 'bull_tp_mult': 2.190298655680726, 'bull_tsl_mult': 0.8630027532803384, 'bull_time_stop': 141, 'bull_use_sma': True, 'bull_use_ema': False, 'bull_use_atr': False, 'bull_use_adx': True, 'bull_use_spike': False, 'bull_rsi_required': True, 'bear_strategy': 'mean_reversion', 'bear_bb_std_mult': 1.3144259241249916, 'bear_rsi_os': 19, 'bear_rsi_ob': 71, 'bear_adx_thresh': 5.030205986954937, 'bear_atr_min_pct': 0.012170687112508252, 'bear_atr_max_pct': 0.0936076604531777, 'bear_tp_mult': 2.7732823476543564, 'bear_tsl_mult': 0.5143254692853487, 'bear_time_stop': 129, 'bear_use_sma': False, 'bear_use_ema': True, 'bear_use_atr': False, 'bear_use_adx': True, 'bear_use_spike': True, 'bear_rsi_required': True, 'sideways_strategy': 'breakout', 'sideways_bb_std_mult': 0.5499876479873459, 'sideways_rsi_os': 22, 'sideways_rsi_ob': 94, 'sideways_adx_thresh': 7.87502873827809, 'sideways_atr_min_pct': 0.026715364275808815, 'sideways_atr_max_pct': 0.042523411726423696, 'sideways_tp_mult': 1.3473613789752514, 'sideways_tsl_mult': 0.6922851074496184, 'sideways_time_stop': 205, 'sideways_use_sma': True, 'sideways_use_ema': False, 'sideways_use_atr': False, 'sideways_use_adx': False, 'sideways_use_spike': True, 'sideways_rsi_required': False}.
[I 2025-08-31 03:18:25,987] Trial 878 finished with values: [-1000000000.0, 1000000000.0] and parameters: {'p_sma': 28, 'p_std': 9, 'p_atr': 28, 'p_adx': 21, 'rsi_period': 67, 'ema1': 5, 'ema2': 45, 'slip_atr_k': 0.026924824199332953, 'slip_spread_k': 0.11479859773446091, 'spread_hl_frac': 0.0007436842655061567, 'bb_std_mult': 1.7350909692521783, 'rsi_os': 30, 'rsi_ob': 70, 'vol_spike': 0.12180109194733528, 'adx_thresh': 31.662775195721103, 'atr_min_pct': 0.009549669729203233, 'atr_max_pct': 0.0318259712610139, 'tp_mult': 1.239250190107561, 'tsl_mult': 0.21344695823687013, 'strategy': 'mean_reversion', 'time_stop': 97, 'use_sma': True, 'use_atr': False, 'use_adx': False, 'use_ema': True, 'use_spike': True, 'rsi_required': False, 'edge_k': 0.5242694188297448, 'edge_cap': 0.6808816153212338, 'bull_strategy': 'breakout', 'bull_bb_std_mult': 1.95701499701185, 'bull_rsi_os': 18, 'bull_rsi_ob': 65, 'bull_adx_thresh': 6.189106486715293, 'bull_atr_min_pct': 0.007095703175382389, 'bull_atr_max_pct': 0.04787759697813445, 'bull_tp_mult': 2.2044919902158986, 'bull_tsl_mult': 0.29992545580900803, 'bull_time_stop': 146, 'bull_use_sma': True, 'bull_use_ema': False, 'bull_use_atr': False, 'bull_use_adx': True, 'bull_use_spike': False, 'bull_rsi_required': True, 'bear_strategy': 'mean_reversion', 'bear_bb_std_mult': 1.3111408668330886, 'bear_rsi_os': 39, 'bear_rsi_ob': 45, 'bear_adx_thresh': 5.499374980610848, 'bear_atr_min_pct': 0.0047116661517400665, 'bear_atr_max_pct': 0.08303982902271731, 'bear_tp_mult': 1.9778941469135112, 'bear_tsl_mult': 0.21565899483729667, 'bear_time_stop': 10, 'bear_use_sma': False, 'bear_use_ema': True, 'bear_use_atr': False, 'bear_use_adx': True, 'bear_use_spike': True, 'bear_rsi_required': True, 'sideways_strategy': 'breakout', 'sideways_bb_std_mult': 0.5677326425822804, 'sideways_rsi_os': 38, 'sideways_rsi_ob': 92, 'sideways_adx_thresh': 8.002498496478738, 'sideways_atr_min_pct': 0.025790357864080744, 'sideways_atr_max_pct': 0.04284260597435507, 'sideways_tp_mult': 1.5997762331054675, 'sideways_tsl_mult': 0.6638702079755614, 'sideways_time_stop': 189, 'sideways_use_sma': True, 'sideways_use_ema': False, 'sideways_use_atr': False, 'sideways_use_adx': False, 'sideways_use_spike': True, 'sideways_rsi_required': False}.
[I 2025-08-31 03:18:26,314] Trial 879 finished with values: [-1000000000.0, 1000000000.0] and parameters: {'p_sma': 28, 'p_std': 9, 'p_atr': 28, 'p_adx': 24, 'rsi_period': 49, 'ema1': 25, 'ema2': 34, 'slip_atr_k': 0.1620330580833763, 'slip_spread_k': 0.11337831275665379, 'spread_hl_frac': 0.0301179622629926, 'bb_std_mult': 1.7479459308503604, 'rsi_os': 12, 'rsi_ob': 80, 'vol_spike': 0.2788417394584437, 'adx_thresh': 31.496268721275868, 'atr_min_pct': 0.018535409789213076, 'atr_max_pct': 0.12593429486566543, 'tp_mult': 2.047328560237901, 'tsl_mult': 0.39240567571389884, 'strategy': 'mean_reversion', 'time_stop': 98, 'use_sma': True, 'use_atr': False, 'use_adx': False, 'use_ema': True, 'use_spike': True, 'rsi_required': False, 'edge_k': 0.31141484697207866, 'edge_cap': 0.744939113193954, 'bull_strategy': 'breakout', 'bull_bb_std_mult': 1.9248027602164075, 'bull_rsi_os': 28, 'bull_rsi_ob': 79, 'bull_adx_thresh': 9.939149911387005, 'bull_atr_min_pct': 0.012424873206753312, 'bull_atr_max_pct': 0.14763429600865516, 'bull_tp_mult': 2.2100144247293407, 'bull_tsl_mult': 0.2965086616206114, 'bull_time_stop': 266, 'bull_use_sma': True, 'bull_use_ema': False, 'bull_use_atr': False, 'bull_use_adx': True, 'bull_use_spike': True, 'bull_rsi_required': True, 'bear_strategy': 'mean_reversion', 'bear_bb_std_mult': 1.3087328887573222, 'bear_rsi_os': 6, 'bear_rsi_ob': 71, 'bear_adx_thresh': 5.006677099750649, 'bear_atr_min_pct': 0.004316281684546696, 'bear_atr_max_pct': 0.013177899391344372, 'bear_tp_mult': 2.097381698548037, 'bear_tsl_mult': 0.24975391073494646, 'bear_time_stop': 5, 'bear_use_sma': False, 'bear_use_ema': True, 'bear_use_atr': False, 'bear_use_adx': True, 'bear_use_spike': True, 'bear_rsi_required': True, 'sideways_strategy': 'breakout', 'sideways_bb_std_mult': 0.5572878458648115, 'sideways_rsi_os': 38, 'sideways_rsi_ob': 94, 'sideways_adx_thresh': 7.909935319319054, 'sideways_atr_min_pct': 0.0254990559383758, 'sideways_atr_max_pct': 0.041815694589401015, 'sideways_tp_mult': 1.6203033282369272, 'sideways_tsl_mult': 0.6942893943133651, 'sideways_time_stop': 190, 'sideways_use_sma': True, 'sideways_use_ema': False, 'sideways_use_atr': False, 'sideways_use_adx': False, 'sideways_use_spike': True, 'sideways_rsi_required': False}.
[I 2025-08-31 03:18:26,388] Trial 877 finished with values: [-1000000000.0, 1000000000.0] and parameters: {'p_sma': 12, 'p_std': 49, 'p_atr': 28, 'p_adx': 10, 'rsi_period': 67, 'ema1': 5, 'ema2': 29, 'slip_atr_k': 0.06048498370164751, 'slip_spread_k': 0.10778377132738404, 'spread_hl_frac': 0.0012604519544559371, 'bb_std_mult': 1.7479019992602605, 'rsi_os': 41, 'rsi_ob': 80, 'vol_spike': 0.28013902670410146, 'adx_thresh': 20.25464885083771, 'atr_min_pct': 0.0015500942526277608, 'atr_max_pct': 0.031485899820403146, 'tp_mult': 1.4074285691101307, 'tsl_mult': 0.20370281602114945, 'strategy': 'mean_reversion', 'time_stop': 96, 'use_sma': True, 'use_atr': False, 'use_adx': False, 'use_ema': True, 'use_spike': True, 'rsi_required': False, 'edge_k': 0.5027550325198018, 'edge_cap': 0.6862546975990614, 'bull_strategy': 'breakout', 'bull_bb_std_mult': 1.9158943026665138, 'bull_rsi_os': 31, 'bull_rsi_ob': 65, 'bull_adx_thresh': 5.014914128164452, 'bull_atr_min_pct': 0.004828897028003458, 'bull_atr_max_pct': 0.12162896538809967, 'bull_tp_mult': 2.2250351482953254, 'bull_tsl_mult': 0.3008113498412204, 'bull_time_stop': 145, 'bull_use_sma': True, 'bull_use_ema': False, 'bull_use_atr': False, 'bull_use_adx': True, 'bull_use_spike': True, 'bull_rsi_required': True, 'bear_strategy': 'mean_reversion', 'bear_bb_std_mult': 1.3041465001149324, 'bear_rsi_os': 14, 'bear_rsi_ob': 45, 'bear_adx_thresh': 5.01352364491237, 'bear_atr_min_pct': 0.007272026675034875, 'bear_atr_max_pct': 0.012101553087828168, 'bear_tp_mult': 2.7758346773842266, 'bear_tsl_mult': 0.5154008311683336, 'bear_time_stop': 9, 'bear_use_sma': False, 'bear_use_ema': True, 'bear_use_atr': False, 'bear_use_adx': True, 'bear_use_spike': True, 'bear_rsi_required': True, 'sideways_strategy': 'breakout', 'sideways_bb_std_mult': 0.6857579870347833, 'sideways_rsi_os': 54, 'sideways_rsi_ob': 93, 'sideways_adx_thresh': 27.588405457945353, 'sideways_atr_min_pct': 0.015266894384978864, 'sideways_atr_max_pct': 0.04295806905974205, 'sideways_tp_mult': 2.459951654116631, 'sideways_tsl_mult': 0.6887784501091401, 'sideways_time_stop': 190, 'sideways_use_sma': True, 'sideways_use_ema': False, 'sideways_use_atr': False, 'sideways_use_adx': False, 'sideways_use_spike': True, 'sideways_rsi_required': False}.
