[I 2025-08-31 02:46:40,112] Trial 646 finished with values: [-1000000000.0, 1000000000.0] and parameters: {'p_sma': 52, 'p_std': 32, 'p_atr': 28, 'p_adx': 29, 'rsi_period': 20, 'ema1': 6, 'ema2': 27, 'slip_atr_k': 0.23402096742413947, 'slip_spread_k': 0.6570533860028959, 'spread_hl_frac': 0.004790416542144985, 'bb_std_mult': 0.6218565065821817, 'rsi_os': 41, 'rsi_ob': 71, 'vol_spike': 0.19344911106667398, 'adx_thresh': 19.675770069721523, 'atr_min_pct': 0.008458768242342223, 'atr_max_pct': 0.12203976274096173, 'tp_mult': 1.9249975187156256, 'tsl_mult': 0.3163631744788006, 'strategy': 'mean_reversion', 'time_stop': 98, 'use_sma': True, 'use_atr': False, 'use_adx': True, 'use_ema': False, 'use_spike': False, 'rsi_required': True, 'edge_k': 1.0229655395708497, 'edge_cap': 0.10032145416526267, 'bull_strategy': 'breakout', 'bull_bb_std_mult': 2.2501745547321916, 'bull_rsi_os': 23, 'bull_rsi_ob': 80, 'bull_adx_thresh': 6.0777562715911895, 'bull_atr_min_pct': 0.004122965399414843, 'bull_atr_max_pct': 0.1438553528149782, 'bull_tp_mult': 1.798276798294451, 'bull_tsl_mult': 0.2063168609639889, 'bull_time_stop': 142, 'bull_use_sma': True, 'bull_use_ema': False, 'bull_use_atr': False, 'bull_use_adx': True, 'bull_use_spike': True, 'bull_rsi_required': True, 'bear_strategy': 'mean_reversion', 'bear_bb_std_mult': 1.532482148701955, 'bear_rsi_os': 19, 'bear_rsi_ob': 47, 'bear_adx_thresh': 32.80063614194272, 'bear_atr_min_pct': 0.014977524359247228, 'bear_atr_max_pct': 0.010010950845899095, 'bear_tp_mult': 2.0422783412641263, 'bear_tsl_mult': 0.9943583038262844, 'bear_time_stop': 103, 'bear_use_sma': False, 'bear_use_ema': False, 'bear_use_atr': True, 'bear_use_adx': False, 'bear_use_spike': False, 'bear_rsi_required': True, 'sideways_strategy': 'breakout', 'sideways_bb_std_mult': 0.6852832380629639, 'sideways_rsi_os': 55, 'sideways_rsi_ob': 62, 'sideways_adx_thresh': 31.59767837728542, 'sideways_atr_min_pct': 0.026909310671418423, 'sideways_atr_max_pct': 0.048695645952543234, 'sideways_tp_mult': 2.3707020019498737, 'sideways_tsl_mult': 0.4060037493825474, 'sideways_time_stop': 191, 'sideways_use_sma': True, 'sideways_use_ema': True, 'sideways_use_atr': True, 'sideways_use_adx': True, 'sideways_use_spike': False, 'sideways_rsi_required': False}.
[I 2025-08-31 02:46:40,278] Trial 649 finished with values: [-1000000000.0, 1000000000.0] and parameters: {'p_sma': 36, 'p_std': 11, 'p_atr': 28, 'p_adx': 19, 'rsi_period': 20, 'ema1': 16, 'ema2': 27, 'slip_atr_k': 0.08782129578144905, 'slip_spread_k': 0.1256998368678671, 'spread_hl_frac': 0.0023498634499362825, 'bb_std_mult': 0.7937084929093834, 'rsi_os': 35, 'rsi_ob': 67, 'vol_spike': 0.18999418718870392, 'adx_thresh': 21.053919298603983, 'atr_min_pct': 0.007669778262951079, 'atr_max_pct': 0.13682164426922544, 'tp_mult': 1.3684206747349463, 'tsl_mult': 0.3230311706354201, 'strategy': 'mean_reversion', 'time_stop': 56, 'use_sma': True, 'use_atr': False, 'use_adx': False, 'use_ema': False, 'use_spike': True, 'rsi_required': True, 'edge_k': 0.6406954328074637, 'edge_cap': 0.12567491271911885, 'bull_strategy': 'breakout', 'bull_bb_std_mult': 1.952355088053995, 'bull_rsi_os': 20, 'bull_rsi_ob': 57, 'bull_adx_thresh': 6.772339837558097, 'bull_atr_min_pct': 0.02115134499244198, 'bull_atr_max_pct': 0.13842598362995714, 'bull_tp_mult': 2.327359525037446, 'bull_tsl_mult': 0.830290366648304, 'bull_time_stop': 123, 'bull_use_sma': True, 'bull_use_ema': True, 'bull_use_atr': False, 'bull_use_adx': False, 'bull_use_spike': True, 'bull_rsi_required': True, 'bear_strategy': 'mean_reversion', 'bear_bb_std_mult': 1.3647800081297996, 'bear_rsi_os': 28, 'bear_rsi_ob': 45, 'bear_adx_thresh': 30.82287835157282, 'bear_atr_min_pct': 0.002596073129581102, 'bear_atr_max_pct': 0.049603730435244534, 'bear_tp_mult': 2.1594259316100346, 'bear_tsl_mult': 0.5692642757879848, 'bear_time_stop': 5, 'bear_use_sma': False, 'bear_use_ema': True, 'bear_use_atr': False, 'bear_use_adx': True, 'bear_use_spike': True, 'bear_rsi_required': True, 'sideways_strategy': 'breakout', 'sideways_bb_std_mult': 1.5992924850062948, 'sideways_rsi_os': 39, 'sideways_rsi_ob': 93, 'sideways_adx_thresh': 8.183440854684639, 'sideways_atr_min_pct': 0.026067720397055995, 'sideways_atr_max_pct': 0.051557066347420834, 'sideways_tp_mult': 2.326404589493853, 'sideways_tsl_mult': 0.06106944993772512, 'sideways_time_stop': 197, 'sideways_use_sma': True, 'sideways_use_ema': False, 'sideways_use_atr': True, 'sideways_use_adx': False, 'sideways_use_spike': True, 'sideways_rsi_required': True}.
[I 2025-08-31 02:46:41,317] Trial 651 finished with values: [-1000000000.0, 1000000000.0] and parameters: {'p_sma': 9, 'p_std': 11, 'p_atr': 30, 'p_adx': 20, 'rsi_period': 16, 'ema1': 5, 'ema2': 29, 'slip_atr_k': 0.09254553367820988, 'slip_spread_k': 0.1641378271765049, 'spread_hl_frac': 0.01711293742172195, 'bb_std_mult': 1.4846295815590664, 'rsi_os': 36, 'rsi_ob': 45, 'vol_spike': 0.0452384983636851, 'adx_thresh': 34.88909320300232, 'atr_min_pct': 0.026648883286724167, 'atr_max_pct': 0.12321274258833105, 'tp_mult': 1.3596185623911594, 'tsl_mult': 0.9628502966276618, 'strategy': 'mean_reversion', 'time_stop': 174, 'use_sma': True, 'use_atr': False, 'use_adx': False, 'use_ema': False, 'use_spike': False, 'rsi_required': True, 'edge_k': 0.5783021778273761, 'edge_cap': 0.726906648839541, 'bull_strategy': 'breakout', 'bull_bb_std_mult': 3.2062586995521882, 'bull_rsi_os': 48, 'bull_rsi_ob': 63, 'bull_adx_thresh': 6.9253868549310535, 'bull_atr_min_pct': 0.014572623953085992, 'bull_atr_max_pct': 0.12450760211206596, 'bull_tp_mult': 2.3288674164858665, 'bull_tsl_mult': 0.32232533297898847, 'bull_time_stop': 142, 'bull_use_sma': True, 'bull_use_ema': True, 'bull_use_atr': False, 'bull_use_adx': True, 'bull_use_spike': True, 'bull_rsi_required': True, 'bear_strategy': 'mean_reversion', 'bear_bb_std_mult': 1.37238896236658, 'bear_rsi_os': 16, 'bear_rsi_ob': 73, 'bear_adx_thresh': 31.926748429393623, 'bear_atr_min_pct': 0.006356517539440478, 'bear_atr_max_pct': 0.017717264489536068, 'bear_tp_mult': 2.158622150926195, 'bear_tsl_mult': 0.5296419918464531, 'bear_time_stop': 268, 'bear_use_sma': False, 'bear_use_ema': False, 'bear_use_atr': False, 'bear_use_adx': True, 'bear_use_spike': False, 'bear_rsi_required': True, 'sideways_strategy': 'breakout', 'sideways_bb_std_mult': 0.6147800296174736, 'sideways_rsi_os': 14, 'sideways_rsi_ob': 93, 'sideways_adx_thresh': 8.452134398543361, 'sideways_atr_min_pct': 0.02998782112429179, 'sideways_atr_max_pct': 0.038482679657083775, 'sideways_tp_mult': 2.8784327242343184, 'sideways_tsl_mult': 0.2106668511180152, 'sideways_time_stop': 196, 'sideways_use_sma': False, 'sideways_use_ema': False, 'sideways_use_atr': False, 'sideways_use_adx': False, 'sideways_use_spike': True, 'sideways_rsi_required': True}.
[I 2025-08-31 02:46:41,318] Trial 652 finished with values: [-1000000000.0, 1000000000.0] and parameters: {'p_sma': 42, 'p_std': 51, 'p_atr': 29, 'p_adx': 24, 'rsi_period': 69, 'ema1': 5, 'ema2': 44, 'slip_atr_k': 0.09130126560423997, 'slip_spread_k': 0.0007929444686679554, 'spread_hl_frac': 0.01728653448528035, 'bb_std_mult': 1.242255031597316, 'rsi_os': 36, 'rsi_ob': 45, 'vol_spike': 0.06729196187147769, 'adx_thresh': 21.183766741529233, 'atr_min_pct': 0.02676396378307551, 'atr_max_pct': 0.03981607441928572, 'tp_mult': 1.5944740346454322, 'tsl_mult': 0.5921787873631483, 'strategy': 'mean_reversion', 'time_stop': 155, 'use_sma': True, 'use_atr': True, 'use_adx': False, 'use_ema': False, 'use_spike': False, 'rsi_required': True, 'edge_k': 1.3823540124035771, 'edge_cap': 0.07875149184416641, 'bull_strategy': 'breakout', 'bull_bb_std_mult': 3.3352059096570006, 'bull_rsi_os': 55, 'bull_rsi_ob': 63, 'bull_adx_thresh': 5.463288542350114, 'bull_atr_min_pct': 0.027131526868661764, 'bull_atr_max_pct': 0.032246481134985065, 'bull_tp_mult': 2.8001870971557192, 'bull_tsl_mult': 0.32422088158651685, 'bull_time_stop': 131, 'bull_use_sma': True, 'bull_use_ema': True, 'bull_use_atr': False, 'bull_use_adx': True, 'bull_use_spike': True, 'bull_rsi_required': True, 'bear_strategy': 'mean_reversion', 'bear_bb_std_mult': 3.511258280855502, 'bear_rsi_os': 16, 'bear_rsi_ob': 46, 'bear_adx_thresh': 16.980975878651304, 'bear_atr_min_pct': 0.0023839510235205783, 'bear_atr_max_pct': 0.017888130367453813, 'bear_tp_mult': 1.3884659119063834, 'bear_tsl_mult': 0.5306073537756494, 'bear_time_stop': 300, 'bear_use_sma': False, 'bear_use_ema': False, 'bear_use_atr': False, 'bear_use_adx': True, 'bear_use_spike': False, 'bear_rsi_required': True, 'sideways_strategy': 'breakout', 'sideways_bb_std_mult': 2.923740154222093, 'sideways_rsi_os': 41, 'sideways_rsi_ob': 93, 'sideways_adx_thresh': 8.314545875657663, 'sideways_atr_min_pct': 0.02602473272979334, 'sideways_atr_max_pct': 0.05683558658200538, 'sideways_tp_mult': 1.6971836745548279, 'sideways_tsl_mult': 0.49656020081439173, 'sideways_time_stop': 197, 'sideways_use_sma': False, 'sideways_use_ema': False, 'sideways_use_atr': False, 'sideways_use_adx': False, 'sideways_use_spike': True, 'sideways_rsi_required': True}.
[I 2025-08-31 02:47:07,138] Trial 653 finished with values: [-1000000000.0, 1000000000.0] and parameters: {'p_sma': 31, 'p_std': 51, 'p_atr': 29, 'p_adx': 15, 'rsi_period': 73, 'ema1': 5, 'ema2': 45, 'slip_atr_k': 0.0006028382618347688, 'slip_spread_k': 0.16285988531752452, 'spread_hl_frac': 0.01685914468351176, 'bb_std_mult': 1.4916499352972703, 'rsi_os': 22, 'rsi_ob': 59, 'vol_spike': 0.2530950312370291, 'adx_thresh': 27.362667922333195, 'atr_min_pct': 0.008788503063766178, 'atr_max_pct': 0.129564195785146, 'tp_mult': 1.287057165279034, 'tsl_mult': 0.40249783968950786, 'strategy': 'mean_reversion', 'time_stop': 239, 'use_sma': True, 'use_atr': True, 'use_adx': False, 'use_ema': False, 'use_spike': False, 'rsi_required': True, 'edge_k': 0.44681839460284817, 'edge_cap': 0.1876369383030347, 'bull_strategy': 'mean_reversion', 'bull_bb_std_mult': 3.2525479290296904, 'bull_rsi_os': 5, 'bull_rsi_ob': 64, 'bull_adx_thresh': 5.3216816429727904, 'bull_atr_min_pct': 0.029981365203078765, 'bull_atr_max_pct': 0.1365745750551911, 'bull_tp_mult': 2.3791304896008367, 'bull_tsl_mult': 0.5706904565997467, 'bull_time_stop': 130, 'bull_use_sma': True, 'bull_use_ema': True, 'bull_use_atr': False, 'bull_use_adx': True, 'bull_use_spike': True, 'bull_rsi_required': True, 'bear_strategy': 'mean_reversion', 'bear_bb_std_mult': 1.4116878975108724, 'bear_rsi_os': 16, 'bear_rsi_ob': 95, 'bear_adx_thresh': 5.6355990010945, 'bear_atr_min_pct': 0.006514142963989236, 'bear_atr_max_pct': 0.017402806212479506, 'bear_tp_mult': 1.9957975954402065, 'bear_tsl_mult': 0.3704518911519241, 'bear_time_stop': 300, 'bear_use_sma': False, 'bear_use_ema': False, 'bear_use_atr': False, 'bear_use_adx': True, 'bear_use_spike': False, 'bear_rsi_required': True, 'sideways_strategy': 'breakout', 'sideways_bb_std_mult': 0.6115954758687134, 'sideways_rsi_os': 42, 'sideways_rsi_ob': 79, 'sideways_adx_thresh': 22.157274610410127, 'sideways_atr_min_pct': 0.013130100117040237, 'sideways_atr_max_pct': 0.03829721946934701, 'sideways_tp_mult': 1.6887652485217066, 'sideways_tsl_mult': 0.20367730876135737, 'sideways_time_stop': 295, 'sideways_use_sma': False, 'sideways_use_ema': False, 'sideways_use_atr': False, 'sideways_use_adx': False, 'sideways_use_spike': True, 'sideways_rsi_required': True}.
[I 2025-08-31 02:47:07,891] Trial 650 finished with values: [-1000000000.0, 1000000000.0] and parameters: {'p_sma': 35, 'p_std': 49, 'p_atr': 29, 'p_adx': 29, 'rsi_period': 69, 'ema1': 11, 'ema2': 31, 'slip_atr_k': 0.1955549276497653, 'slip_spread_k': 0.7875225311905201, 'spread_hl_frac': 0.01900951053660307, 'bb_std_mult': 1.7950013513345844, 'rsi_os': 47, 'rsi_ob': 71, 'vol_spike': 0.24388662504062464, 'adx_thresh': 21.113459721900753, 'atr_min_pct': 0.024555476091284903, 'atr_max_pct': 0.12304483509604014, 'tp_mult': 1.368310920547639, 'tsl_mult': 0.40108746383473726, 'strategy': 'mean_reversion', 'time_stop': 105, 'use_sma': True, 'use_atr': True, 'use_adx': False, 'use_ema': False, 'use_spike': False, 'rsi_required': True, 'edge_k': 0.9775499349421026, 'edge_cap': 0.34460102417893845, 'bull_strategy': 'breakout', 'bull_bb_std_mult': 1.947613935234868, 'bull_rsi_os': 45, 'bull_rsi_ob': 63, 'bull_adx_thresh': 6.749781124400888, 'bull_atr_min_pct': 0.004193432295968384, 'bull_atr_max_pct': 0.1388343460945717, 'bull_tp_mult': 2.332556374742014, 'bull_tsl_mult': 0.20912289312434926, 'bull_time_stop': 142, 'bull_use_sma': True, 'bull_use_ema': True, 'bull_use_atr': False, 'bull_use_adx': True, 'bull_use_spike': True, 'bull_rsi_required': True, 'bear_strategy': 'mean_reversion', 'bear_bb_std_mult': 1.373737189235995, 'bear_rsi_os': 19, 'bear_rsi_ob': 88, 'bear_adx_thresh': 31.985249951431477, 'bear_atr_min_pct': 0.019010679771927295, 'bear_atr_max_pct': 0.049369926838579076, 'bear_tp_mult': 2.136872526946483, 'bear_tsl_mult': 0.5308646226665737, 'bear_time_stop': 16, 'bear_use_sma': False, 'bear_use_ema': False, 'bear_use_atr': False, 'bear_use_adx': True, 'bear_use_spike': False, 'bear_rsi_required': True, 'sideways_strategy': 'breakout', 'sideways_bb_std_mult': 1.6066295911308273, 'sideways_rsi_os': 14, 'sideways_rsi_ob': 93, 'sideways_adx_thresh': 28.461213950965938, 'sideways_atr_min_pct': 0.027182312891669388, 'sideways_atr_max_pct': 0.038513572421943316, 'sideways_tp_mult': 1.698554892942994, 'sideways_tsl_mult': 0.20941959496223006, 'sideways_time_stop': 198, 'sideways_use_sma': False, 'sideways_use_ema': False, 'sideways_use_atr': True, 'sideways_use_adx': False, 'sideways_use_spike': True, 'sideways_rsi_required': True}.
[I 2025-08-31 02:47:14,327] Trial 654 finished with values: [-1000000000.0, 1000000000.0] and parameters: {'p_sma': 38, 'p_std': 49, 'p_atr': 15, 'p_adx': 30, 'rsi_period': 23, 'ema1': 19, 'ema2': 60, 'slip_atr_k': 0.14314667197097553, 'slip_spread_k': 0.7860958236258174, 'spread_hl_frac': 0.0015636223535132397, 'bb_std_mult': 1.023373490759871, 'rsi_os': 28, 'rsi_ob': 69, 'vol_spike': 0.18102996108701025, 'adx_thresh': 30.78249398348892, 'atr_min_pct': 0.01723111440052934, 'atr_max_pct': 0.12934592055871819, 'tp_mult': 2.914412266746342, 'tsl_mult': 0.8035806563968636, 'strategy': 'mean_reversion', 'time_stop': 105, 'use_sma': True, 'use_atr': True, 'use_adx': False, 'use_ema': False, 'use_spike': False, 'rsi_required': True, 'edge_k': 0.4547220384311817, 'edge_cap': 0.20356486687794473, 'bull_strategy': 'mean_reversion', 'bull_bb_std_mult': 2.1247233198170887, 'bull_rsi_os': 45, 'bull_rsi_ob': 58, 'bull_adx_thresh': 8.386992207922814, 'bull_atr_min_pct': 0.005155242122383765, 'bull_atr_max_pct': 0.13336531060447498, 'bull_tp_mult': 2.3773991776795302, 'bull_tsl_mult': 0.7175472365926223, 'bull_time_stop': 139, 'bull_use_sma': True, 'bull_use_ema': False, 'bull_use_atr': False, 'bull_use_adx': True, 'bull_use_spike': True, 'bull_rsi_required': True, 'bear_strategy': 'mean_reversion', 'bear_bb_std_mult': 1.4107404478362142, 'bear_rsi_os': 37, 'bear_rsi_ob': 60, 'bear_adx_thresh': 11.897729194545695, 'bear_atr_min_pct': 0.01754232935046478, 'bear_atr_max_pct': 0.010136419234456946, 'bear_tp_mult': 2.2678895325220143, 'bear_tsl_mult': 0.3628630555586114, 'bear_time_stop': 15, 'bear_use_sma': False, 'bear_use_ema': False, 'bear_use_atr': False, 'bear_use_adx': True, 'bear_use_spike': False, 'bear_rsi_required': True, 'sideways_strategy': 'breakout', 'sideways_bb_std_mult': 0.5602174358444058, 'sideways_rsi_os': 7, 'sideways_rsi_ob': 76, 'sideways_adx_thresh': 9.239305734481304, 'sideways_atr_min_pct': 0.00923677440935064, 'sideways_atr_max_pct': 0.028537615104086207, 'sideways_tp_mult': 2.6503660771820416, 'sideways_tsl_mult': 0.6843129095550659, 'sideways_time_stop': 294, 'sideways_use_sma': True, 'sideways_use_ema': False, 'sideways_use_atr': False, 'sideways_use_adx': False, 'sideways_use_spike': True, 'sideways_rsi_required': False}.
[I 2025-08-31 02:47:14,800] Trial 655 finished with values: [-1000000000.0, 1000000000.0] and parameters: {'p_sma': 35, 'p_std': 58, 'p_atr': 27, 'p_adx': 27, 'rsi_period': 74, 'ema1': 11, 'ema2': 31, 'slip_atr_k': 1.5675212826237253e-05, 'slip_spread_k': 0.7931175339476572, 'spread_hl_frac': 0.0015843841798597437, 'bb_std_mult': 1.0548404991583227, 'rsi_os': 28, 'rsi_ob': 59, 'vol_spike': 0.1981034754565793, 'adx_thresh': 22.026754405613907, 'atr_min_pct': 0.008708013915306274, 'atr_max_pct': 0.11729517050289251, 'tp_mult': 1.2973980327215224, 'tsl_mult': 0.19707502940742372, 'strategy': 'mean_reversion', 'time_stop': 107, 'use_sma': True, 'use_atr': True, 'use_adx': False, 'use_ema': False, 'use_spike': False, 'rsi_required': True, 'edge_k': 1.653344554071344, 'edge_cap': 0.1932182109855257, 'bull_strategy': 'mean_reversion', 'bull_bb_std_mult': 2.4697400705830543, 'bull_rsi_os': 11, 'bull_rsi_ob': 55, 'bull_adx_thresh': 28.08443615091574, 'bull_atr_min_pct': 0.009680600551464793, 'bull_atr_max_pct': 0.13426653249773615, 'bull_tp_mult': 2.3669742915362573, 'bull_tsl_mult': 0.6226844998345686, 'bull_time_stop': 116, 'bull_use_sma': True, 'bull_use_ema': False, 'bull_use_atr': False, 'bull_use_adx': True, 'bull_use_spike': True, 'bull_rsi_required': True, 'bear_strategy': 'mean_reversion', 'bear_bb_std_mult': 1.4137325649697816, 'bear_rsi_os': 37, 'bear_rsi_ob': 95, 'bear_adx_thresh': 5.044222752036715, 'bear_atr_min_pct': 0.01747585950621402, 'bear_atr_max_pct': 0.012462113183825308, 'bear_tp_mult': 2.7088081788495186, 'bear_tsl_mult': 0.49376089427341757, 'bear_time_stop': 13, 'bear_use_sma': False, 'bear_use_ema': False, 'bear_use_atr': False, 'bear_use_adx': True, 'bear_use_spike': False, 'bear_rsi_required': True, 'sideways_strategy': 'breakout', 'sideways_bb_std_mult': 1.9687292928176945, 'sideways_rsi_os': 7, 'sideways_rsi_ob': 95, 'sideways_adx_thresh': 26.751304061264307, 'sideways_atr_min_pct': 0.02743975160493478, 'sideways_atr_max_pct': 0.05478259501685273, 'sideways_tp_mult': 1.7368894422537389, 'sideways_tsl_mult': 0.6885394988182183, 'sideways_time_stop': 294, 'sideways_use_sma': True, 'sideways_use_ema': False, 'sideways_use_atr': False, 'sideways_use_adx': False, 'sideways_use_spike': True, 'sideways_rsi_required': False}.
[I 2025-08-31 02:47:46,141] Trial 657 finished with values: [-1000000000.0, 1000000000.0] and parameters: {'p_sma': 59, 'p_std': 53, 'p_atr': 15, 'p_adx': 17, 'rsi_period': 75, 'ema1': 5, 'ema2': 60, 'slip_atr_k': 0.0626690843449125, 'slip_spread_k': 0.9392809375899922, 'spread_hl_frac': 0.0372273529521193, 'bb_std_mult': 1.6718233000562008, 'rsi_os': 38, 'rsi_ob': 68, 'vol_spike': 0.18107167243285388, 'adx_thresh': 22.105443936781526, 'atr_min_pct': 0.015751684742206534, 'atr_max_pct': 0.11709838985104781, 'tp_mult': 2.261569115779343, 'tsl_mult': 0.5151720564389991, 'strategy': 'mean_reversion', 'time_stop': 250, 'use_sma': False, 'use_atr': False, 'use_adx': False, 'use_ema': False, 'use_spike': False, 'rsi_required': True, 'edge_k': 1.6491014277949774, 'edge_cap': 0.2018165154109417, 'bull_strategy': 'mean_reversion', 'bull_bb_std_mult': 2.4488793099440964, 'bull_rsi_os': 53, 'bull_rsi_ob': 66, 'bull_adx_thresh': 7.90816746963262, 'bull_atr_min_pct': 0.018620338131909536, 'bull_atr_max_pct': 0.13422773413322273, 'bull_tp_mult': 2.1313249954897135, 'bull_tsl_mult': 0.6155619127980732, 'bull_time_stop': 117, 'bull_use_sma': True, 'bull_use_ema': False, 'bull_use_atr': False, 'bull_use_adx': True, 'bull_use_spike': True, 'bull_rsi_required': True, 'bear_strategy': 'breakout', 'bear_bb_std_mult': 2.4998425003228864, 'bear_rsi_os': 14, 'bear_rsi_ob': 91, 'bear_adx_thresh': 21.692160299239255, 'bear_atr_min_pct': 0.017016444775948217, 'bear_atr_max_pct': 0.09941152993995603, 'bear_tp_mult': 1.1254474364191878, 'bear_tsl_mult': 0.49978166186419437, 'bear_time_stop': 14, 'bear_use_sma': False, 'bear_use_ema': False, 'bear_use_atr': False, 'bear_use_adx': True, 'bear_use_spike': False, 'bear_rsi_required': True, 'sideways_strategy': 'breakout', 'sideways_bb_std_mult': 0.5675483533781767, 'sideways_rsi_os': 22, 'sideways_rsi_ob': 95, 'sideways_adx_thresh': 10.423511602691374, 'sideways_atr_min_pct': 0.012724865874412041, 'sideways_atr_max_pct': 0.060637052196835815, 'sideways_tp_mult': 2.6555438634103417, 'sideways_tsl_mult': 0.6830941311474653, 'sideways_time_stop': 212, 'sideways_use_sma': True, 'sideways_use_ema': False, 'sideways_use_atr': False, 'sideways_use_adx': False, 'sideways_use_spike': True, 'sideways_rsi_required': False}.
