[I 2025-08-31 00:50:06,628] Trial 406 finished with values: [-1000000000.0, 1000000000.0] and parameters: {'p_sma': 10, 'p_std': 40, 'p_atr': 22, 'p_adx': 12, 'rsi_period': 55, 'ema1': 6, 'ema2': 29, 'slip_atr_k': 0.03751665056530902, 'slip_spread_k': 0.8206334458947067, 'spread_hl_frac': 0.04333254458893586, 'bb_std_mult': 0.5806610480185284, 'rsi_os': 55, 'rsi_ob': 76, 'vol_spike': 0.07747732950629126, 'adx_thresh': 29.98556512694716, 'atr_min_pct': 0.012444756255201384, 'atr_max_pct': 0.0748383506154913, 'tp_mult': 2.519751214312793, 'tsl_mult': 0.07779363839851428, 'strategy': 'mean_reversion', 'time_stop': 94, 'use_sma': True, 'use_atr': True, 'use_adx': False, 'use_ema': True, 'use_spike': True, 'rsi_required': False, 'edge_k': 1.7869467775001875, 'edge_cap': 0.5158376908190365, 'bull_strategy': 'breakout', 'bull_bb_std_mult': 2.820407126835607, 'bull_rsi_os': 36, 'bull_rsi_ob': 68, 'bull_adx_thresh': 11.554966123001659, 'bull_atr_min_pct': 0.004971983273430836, 'bull_atr_max_pct': 0.05375094111074022, 'bull_tp_mult': 2.716671903672683, 'bull_tsl_mult': 0.024333768419755597, 'bull_time_stop': 62, 'bull_use_sma': False, 'bull_use_ema': False, 'bull_use_atr': True, 'bull_use_adx': False, 'bull_use_spike': True, 'bull_rsi_required': True, 'bear_strategy': 'mean_reversion', 'bear_bb_std_mult': 1.0947781642357426, 'bear_rsi_os': 40, 'bear_rsi_ob': 87, 'bear_adx_thresh': 8.564196180968356, 'bear_atr_min_pct': 0.019312659474858416, 'bear_atr_max_pct': 0.010274184812874346, 'bear_tp_mult': 1.5483199308731646, 'bear_tsl_mult': 0.7166201001466864, 'bear_time_stop': 44, 'bear_use_sma': True, 'bear_use_ema': True, 'bear_use_atr': False, 'bear_use_adx': False, 'bear_use_spike': False, 'bear_rsi_required': False, 'sideways_strategy': 'breakout', 'sideways_bb_std_mult': 1.3046944215042657, 'sideways_rsi_os': 47, 'sideways_rsi_ob': 61, 'sideways_adx_thresh': 12.239522369237058, 'sideways_atr_min_pct': 0.020493826224961383, 'sideways_atr_max_pct': 0.09119160478767994, 'sideways_tp_mult': 1.548350581552945, 'sideways_tsl_mult': 0.7018331487303934, 'sideways_time_stop': 57, 'sideways_use_sma': True, 'sideways_use_ema': False, 'sideways_use_atr': False, 'sideways_use_adx': True, 'sideways_use_spike': True, 'sideways_rsi_required': False}.
[I 2025-08-31 00:50:37,476] Trial 405 finished with values: [-1000000000.0, 1000000000.0] and parameters: {'p_sma': 49, 'p_std': 19, 'p_atr': 22, 'p_adx': 8, 'rsi_period': 58, 'ema1': 7, 'ema2': 59, 'slip_atr_k': 0.03958970750288955, 'slip_spread_k': 0.6568141600771698, 'spread_hl_frac': 0.03661068755524053, 'bb_std_mult': 1.2886531251504902, 'rsi_os': 22, 'rsi_ob': 75, 'vol_spike': 0.20719211857449718, 'adx_thresh': 30.04755684730972, 'atr_min_pct': 0.012378605119562278, 'atr_max_pct': 0.07997921743099362, 'tp_mult': 2.506159885054134, 'tsl_mult': 0.07199339341206669, 'strategy': 'mean_reversion', 'time_stop': 84, 'use_sma': True, 'use_atr': True, 'use_adx': False, 'use_ema': True, 'use_spike': True, 'rsi_required': False, 'edge_k': 0.7160005157147303, 'edge_cap': 0.8387681190401832, 'bull_strategy': 'breakout', 'bull_bb_std_mult': 2.833143321787055, 'bull_rsi_os': 38, 'bull_rsi_ob': 84, 'bull_adx_thresh': 33.41789389514718, 'bull_atr_min_pct': 0.00861619311155652, 'bull_atr_max_pct': 0.05438712142698729, 'bull_tp_mult': 2.7301480573748016, 'bull_tsl_mult': 0.9731275649191375, 'bull_time_stop': 167, 'bull_use_sma': False, 'bull_use_ema': False, 'bull_use_atr': True, 'bull_use_adx': True, 'bull_use_spike': False, 'bull_rsi_required': False, 'bear_strategy': 'mean_reversion', 'bear_bb_std_mult': 2.3239061876186455, 'bear_rsi_os': 31, 'bear_rsi_ob': 71, 'bear_adx_thresh': 20.550573610901992, 'bear_atr_min_pct': 0.011445669893022859, 'bear_atr_max_pct': 0.02907597951907067, 'bear_tp_mult': 1.8629751372613796, 'bear_tsl_mult': 0.9664361495464038, 'bear_time_stop': 181, 'bear_use_sma': True, 'bear_use_ema': True, 'bear_use_atr': False, 'bear_use_adx': True, 'bear_use_spike': False, 'bear_rsi_required': False, 'sideways_strategy': 'breakout', 'sideways_bb_std_mult': 2.0655363748557996, 'sideways_rsi_os': 47, 'sideways_rsi_ob': 92, 'sideways_adx_thresh': 12.90630447809848, 'sideways_atr_min_pct': 0.02185886018167019, 'sideways_atr_max_pct': 0.13857878988264363, 'sideways_tp_mult': 1.0663294195072743, 'sideways_tsl_mult': 0.711929511466543, 'sideways_time_stop': 188, 'sideways_use_sma': True, 'sideways_use_ema': False, 'sideways_use_atr': False, 'sideways_use_adx': True, 'sideways_use_spike': True, 'sideways_rsi_required': False}.
[I 2025-08-31 00:50:44,068] Trial 407 finished with values: [-1000000000.0, 1000000000.0] and parameters: {'p_sma': 7, 'p_std': 19, 'p_atr': 22, 'p_adx': 15, 'rsi_period': 55, 'ema1': 18, 'ema2': 29, 'slip_atr_k': 0.2084565254682529, 'slip_spread_k': 0.950829315331368, 'spread_hl_frac': 0.02810216163799351, 'bb_std_mult': 1.2600892963725396, 'rsi_os': 55, 'rsi_ob': 67, 'vol_spike': 0.1948087550475951, 'adx_thresh': 30.075970392526386, 'atr_min_pct': 0.008734248468964315, 'atr_max_pct': 0.06048756678969645, 'tp_mult': 2.5878938683961596, 'tsl_mult': 0.004566294439520668, 'strategy': 'breakout', 'time_stop': 97, 'use_sma': True, 'use_atr': False, 'use_adx': False, 'use_ema': True, 'use_spike': True, 'rsi_required': False, 'edge_k': 0.4900022310176174, 'edge_cap': 0.8772742049649291, 'bull_strategy': 'breakout', 'bull_bb_std_mult': 2.77182226797019, 'bull_rsi_os': 36, 'bull_rsi_ob': 62, 'bull_adx_thresh': 33.18135119949983, 'bull_atr_min_pct': 0.02978728331790754, 'bull_atr_max_pct': 0.07226681198376203, 'bull_tp_mult': 2.4638640394163533, 'bull_tsl_mult': 0.22393777919484398, 'bull_time_stop': 101, 'bull_use_sma': False, 'bull_use_ema': False, 'bull_use_atr': False, 'bull_use_adx': True, 'bull_use_spike': False, 'bull_rsi_required': True, 'bear_strategy': 'mean_reversion', 'bear_bb_std_mult': 2.0795562382567296, 'bear_rsi_os': 21, 'bear_rsi_ob': 87, 'bear_adx_thresh': 8.563028802698998, 'bear_atr_min_pct': 0.00915261121747961, 'bear_atr_max_pct': 0.014034768743676394, 'bear_tp_mult': 1.631602054678028, 'bear_tsl_mult': 0.7272754760102532, 'bear_time_stop': 44, 'bear_use_sma': True, 'bear_use_ema': True, 'bear_use_atr': False, 'bear_use_adx': False, 'bear_use_spike': False, 'bear_rsi_required': True, 'sideways_strategy': 'breakout', 'sideways_bb_std_mult': 1.311144299637294, 'sideways_rsi_os': 5, 'sideways_rsi_ob': 93, 'sideways_adx_thresh': 12.080448849726807, 'sideways_atr_min_pct': 0.011918895485913891, 'sideways_atr_max_pct': 0.13357905852537322, 'sideways_tp_mult': 1.544266257305597, 'sideways_tsl_mult': 0.7399375358390343, 'sideways_time_stop': 243, 'sideways_use_sma': True, 'sideways_use_ema': False, 'sideways_use_atr': False, 'sideways_use_adx': False, 'sideways_use_spike': True, 'sideways_rsi_required': False}.
[I 2025-08-31 00:50:44,676] Trial 408 finished with values: [-1000000000.0, 1000000000.0] and parameters: {'p_sma': 45, 'p_std': 37, 'p_atr': 23, 'p_adx': 8, 'rsi_period': 59, 'ema1': 22, 'ema2': 30, 'slip_atr_k': 0.13090264608899718, 'slip_spread_k': 0.5842538246418398, 'spread_hl_frac': 0.01055789766562104, 'bb_std_mult': 2.1548840473568744, 'rsi_os': 55, 'rsi_ob': 67, 'vol_spike': 0.29537342735759686, 'adx_thresh': 29.725797827291515, 'atr_min_pct': 0.02997558056201346, 'atr_max_pct': 0.06756855049376932, 'tp_mult': 2.5236173191117657, 'tsl_mult': 0.07169728574742792, 'strategy': 'breakout', 'time_stop': 94, 'use_sma': True, 'use_atr': False, 'use_adx': False, 'use_ema': True, 'use_spike': False, 'rsi_required': False, 'edge_k': 1.4469797271809763, 'edge_cap': 0.1243611780843682, 'bull_strategy': 'breakout', 'bull_bb_std_mult': 2.7108438088055844, 'bull_rsi_os': 15, 'bull_rsi_ob': 68, 'bull_adx_thresh': 29.525338427642875, 'bull_atr_min_pct': 0.02992219940318796, 'bull_atr_max_pct': 0.12112607078915674, 'bull_tp_mult': 2.781963245223917, 'bull_tsl_mult': 0.2151108318451852, 'bull_time_stop': 153, 'bull_use_sma': False, 'bull_use_ema': False, 'bull_use_atr': False, 'bull_use_adx': True, 'bull_use_spike': False, 'bull_rsi_required': True, 'bear_strategy': 'mean_reversion', 'bear_bb_std_mult': 1.0419417399107607, 'bear_rsi_os': 19, 'bear_rsi_ob': 90, 'bear_adx_thresh': 8.387431232001848, 'bear_atr_min_pct': 0.016077466262524112, 'bear_atr_max_pct': 0.11756039917649047, 'bear_tp_mult': 1.8215525635462306, 'bear_tsl_mult': 0.0037085015295639234, 'bear_time_stop': 144, 'bear_use_sma': True, 'bear_use_ema': False, 'bear_use_atr': False, 'bear_use_adx': False, 'bear_use_spike': False, 'bear_rsi_required': True, 'sideways_strategy': 'mean_reversion', 'sideways_bb_std_mult': 1.3059309525022833, 'sideways_rsi_os': 43, 'sideways_rsi_ob': 71, 'sideways_adx_thresh': 11.86349472147374, 'sideways_atr_min_pct': 0.021807531316320704, 'sideways_atr_max_pct': 0.1386358036039801, 'sideways_tp_mult': 1.5375323038069244, 'sideways_tsl_mult': 0.7409641783000868, 'sideways_time_stop': 55, 'sideways_use_sma': False, 'sideways_use_ema': False, 'sideways_use_atr': False, 'sideways_use_adx': False, 'sideways_use_spike': True, 'sideways_rsi_required': False}.
[I 2025-08-31 00:50:44,971] Trial 409 finished with values: [-0.02231170087391543, 0.022233708296826964] and parameters: {'p_sma': 45, 'p_std': 16, 'p_atr': 23, 'p_adx': 15, 'rsi_period': 59, 'ema1': 7, 'ema2': 31, 'slip_atr_k': 0.029361785716323897, 'slip_spread_k': 0.5746768254897928, 'spread_hl_frac': 0.010453048890119505, 'bb_std_mult': 1.335526021625844, 'rsi_os': 13, 'rsi_ob': 73, 'vol_spike': 0.2635356456068032, 'adx_thresh': 11.838900319919576, 'atr_min_pct': 0.0063033456787839025, 'atr_max_pct': 0.0676679486605105, 'tp_mult': 2.5671229423220607, 'tsl_mult': 0.09618556643309156, 'strategy': 'breakout', 'time_stop': 92, 'use_sma': True, 'use_atr': False, 'use_adx': False, 'use_ema': True, 'use_spike': False, 'rsi_required': False, 'edge_k': 0.4819502780732138, 'edge_cap': 0.8429870021407492, 'bull_strategy': 'breakout', 'bull_bb_std_mult': 2.7226752427044376, 'bull_rsi_os': 30, 'bull_rsi_ob': 70, 'bull_adx_thresh': 13.358358474813494, 'bull_atr_min_pct': 3.583788008697719e-06, 'bull_atr_max_pct': 0.06816879403842441, 'bull_tp_mult': 2.232396853919148, 'bull_tsl_mult': 0.22416982413817127, 'bull_time_stop': 162, 'bull_use_sma': False, 'bull_use_ema': True, 'bull_use_atr': False, 'bull_use_adx': True, 'bull_use_spike': False, 'bull_rsi_required': True, 'bear_strategy': 'mean_reversion', 'bear_bb_std_mult': 1.7201546826094474, 'bear_rsi_os': 20, 'bear_rsi_ob': 80, 'bear_adx_thresh': 7.754414787529613, 'bear_atr_min_pct': 0.010331426251302067, 'bear_atr_max_pct': 0.013543881518159329, 'bear_tp_mult': 2.4955378111714266, 'bear_tsl_mult': 0.7332551845615815, 'bear_time_stop': 103, 'bear_use_sma': True, 'bear_use_ema': False, 'bear_use_atr': False, 'bear_use_adx': True, 'bear_use_spike': False, 'bear_rsi_required': True, 'sideways_strategy': 'mean_reversion', 'sideways_bb_std_mult': 1.3627956092216784, 'sideways_rsi_os': 45, 'sideways_rsi_ob': 92, 'sideways_adx_thresh': 11.68726208242407, 'sideways_atr_min_pct': 0.021805093578857373, 'sideways_atr_max_pct': 0.1388086136781313, 'sideways_tp_mult': 1.4798209356735708, 'sideways_tsl_mult': 0.733276677150935, 'sideways_time_stop': 187, 'sideways_use_sma': False, 'sideways_use_ema': False, 'sideways_use_atr': False, 'sideways_use_adx': False, 'sideways_use_spike': False, 'sideways_rsi_required': False}.
[I 2025-08-31 00:51:20,647] Trial 410 finished with values: [-1000000000.0, 1000000000.0] and parameters: {'p_sma': 45, 'p_std': 8, 'p_atr': 23, 'p_adx': 9, 'rsi_period': 60, 'ema1': 7, 'ema2': 15, 'slip_atr_k': 0.12251410748136542, 'slip_spread_k': 0.20928763650125276, 'spread_hl_frac': 0.010509294083361423, 'bb_std_mult': 1.7191761330510273, 'rsi_os': 52, 'rsi_ob': 92, 'vol_spike': 0.12253035363906792, 'adx_thresh': 11.751221239983153, 'atr_min_pct': 0.010943348890680799, 'atr_max_pct': 0.13085073023208135, 'tp_mult': 2.5886360056717304, 'tsl_mult': 0.10259557592636664, 'strategy': 'breakout', 'time_stop': 96, 'use_sma': True, 'use_atr': False, 'use_adx': False, 'use_ema': True, 'use_spike': False, 'rsi_required': False, 'edge_k': 0.48426724094394324, 'edge_cap': 0.873271627585242, 'bull_strategy': 'breakout', 'bull_bb_std_mult': 2.713735811525728, 'bull_rsi_os': 45, 'bull_rsi_ob': 79, 'bull_adx_thresh': 29.582611636598322, 'bull_atr_min_pct': 0.00622534645474951, 'bull_atr_max_pct': 0.06889990818973579, 'bull_tp_mult': 1.6964159597175776, 'bull_tsl_mult': 0.22922832913708235, 'bull_time_stop': 158, 'bull_use_sma': False, 'bull_use_ema': True, 'bull_use_atr': False, 'bull_use_adx': True, 'bull_use_spike': False, 'bull_rsi_required': True, 'bear_strategy': 'mean_reversion', 'bear_bb_std_mult': 1.7261903983415947, 'bear_rsi_os': 19, 'bear_rsi_ob': 54, 'bear_adx_thresh': 7.718254517422611, 'bear_atr_min_pct': 0.010318530404816253, 'bear_atr_max_pct': 0.10564636258282684, 'bear_tp_mult': 2.0860600969924294, 'bear_tsl_mult': 0.7423399420071453, 'bear_time_stop': 247, 'bear_use_sma': True, 'bear_use_ema': False, 'bear_use_atr': True, 'bear_use_adx': False, 'bear_use_spike': False, 'bear_rsi_required': True, 'sideways_strategy': 'mean_reversion', 'sideways_bb_std_mult': 1.1802144895983526, 'sideways_rsi_os': 36, 'sideways_rsi_ob': 93, 'sideways_adx_thresh': 13.536623479186295, 'sideways_atr_min_pct': 0.011799816919946684, 'sideways_atr_max_pct': 0.1193585664243613, 'sideways_tp_mult': 1.2010807042462892, 'sideways_tsl_mult': 0.7455382543093718, 'sideways_time_stop': 157, 'sideways_use_sma': False, 'sideways_use_ema': False, 'sideways_use_atr': False, 'sideways_use_adx': False, 'sideways_use_spike': False, 'sideways_rsi_required': False}.
[I 2025-08-31 00:51:24,143] Trial 413 finished with values: [-1000000000.0, 1000000000.0] and parameters: {'p_sma': 12, 'p_std': 26, 'p_atr': 21, 'p_adx': 8, 'rsi_period': 14, 'ema1': 7, 'ema2': 18, 'slip_atr_k': 0.04565656145946853, 'slip_spread_k': 0.20632836232097096, 'spread_hl_frac': 0.009531360764210418, 'bb_std_mult': 1.6316942108259698, 'rsi_os': 38, 'rsi_ob': 74, 'vol_spike': 0.2334689069236877, 'adx_thresh': 33.29080428197345, 'atr_min_pct': 0.010726473994695, 'atr_max_pct': 0.12812794383627424, 'tp_mult': 2.6757611519916193, 'tsl_mult': 0.1013446849358638, 'strategy': 'breakout', 'time_stop': 274, 'use_sma': False, 'use_atr': False, 'use_adx': True, 'use_ema': True, 'use_spike': False, 'rsi_required': False, 'edge_k': 0.5895901390701267, 'edge_cap': 0.7758861276926127, 'bull_strategy': 'mean_reversion', 'bull_bb_std_mult': 2.8979937287631308, 'bull_rsi_os': 40, 'bull_rsi_ob': 70, 'bull_adx_thresh': 17.711776269186274, 'bull_atr_min_pct': 0.025386340469725852, 'bull_atr_max_pct': 0.035075575042530824, 'bull_tp_mult': 1.0125571846714525, 'bull_tsl_mult': 0.2521840484311322, 'bull_time_stop': 159, 'bull_use_sma': True, 'bull_use_ema': True, 'bull_use_atr': True, 'bull_use_adx': True, 'bull_use_spike': False, 'bull_rsi_required': False, 'bear_strategy': 'breakout', 'bear_bb_std_mult': 0.8001167596737511, 'bear_rsi_os': 23, 'bear_rsi_ob': 80, 'bear_adx_thresh': 7.716264592060346, 'bear_atr_min_pct': 0.010256778299995892, 'bear_atr_max_pct': 0.018945249038511913, 'bear_tp_mult': 1.9690912287170361, 'bear_tsl_mult': 0.7136818901454395, 'bear_time_stop': 19, 'bear_use_sma': True, 'bear_use_ema': False, 'bear_use_atr': True, 'bear_use_adx': True, 'bear_use_spike': False, 'bear_rsi_required': False, 'sideways_strategy': 'mean_reversion', 'sideways_bb_std_mult': 1.7022189891028823, 'sideways_rsi_os': 45, 'sideways_rsi_ob': 89, 'sideways_adx_thresh': 13.38271747326528, 'sideways_atr_min_pct': 0.022692247544205, 'sideways_atr_max_pct': 0.05679120403093982, 'sideways_tp_mult': 1.6061937435149802, 'sideways_tsl_mult': 0.7268301585004543, 'sideways_time_stop': 181, 'sideways_use_sma': False, 'sideways_use_ema': True, 'sideways_use_atr': False, 'sideways_use_adx': False, 'sideways_use_spike': False, 'sideways_rsi_required': False}.
[I 2025-08-31 00:51:24,332] Trial 411 finished with values: [-1000000000.0, 1000000000.0] and parameters: {'p_sma': 58, 'p_std': 16, 'p_atr': 23, 'p_adx': 9, 'rsi_period': 60, 'ema1': 7, 'ema2': 30, 'slip_atr_k': 0.04597057973291037, 'slip_spread_k': 0.22243382664510652, 'spread_hl_frac': 0.010433916489595114, 'bb_std_mult': 2.051878634412909, 'rsi_os': 52, 'rsi_ob': 73, 'vol_spike': 0.26446382235369353, 'adx_thresh': 11.760585242286478, 'atr_min_pct': 0.006255098213926207, 'atr_max_pct': 0.06734665373757932, 'tp_mult': 1.330878766971571, 'tsl_mult': 0.10175805269410461, 'strategy': 'breakout', 'time_stop': 137, 'use_sma': False, 'use_atr': False, 'use_adx': False, 'use_ema': True, 'use_spike': False, 'rsi_required': False, 'edge_k': 1.426546942005861, 'edge_cap': 0.8483450164686821, 'bull_strategy': 'mean_reversion', 'bull_bb_std_mult': 1.1616170270755455, 'bull_rsi_os': 41, 'bull_rsi_ob': 70, 'bull_adx_thresh': 26.684886798751798, 'bull_atr_min_pct': 0.0010283336936427467, 'bull_atr_max_pct': 0.12189541302965894, 'bull_tp_mult': 2.781497734176012, 'bull_tsl_mult': 0.25128902871968023, 'bull_time_stop': 152, 'bull_use_sma': False, 'bull_use_ema': True, 'bull_use_atr': False, 'bull_use_adx': True, 'bull_use_spike': False, 'bull_rsi_required': False, 'bear_strategy': 'breakout', 'bear_bb_std_mult': 1.0339211470354925, 'bear_rsi_os': 20, 'bear_rsi_ob': 80, 'bear_adx_thresh': 7.607138132727116, 'bear_atr_min_pct': 0.016059912076143042, 'bear_atr_max_pct': 0.10521859984560153, 'bear_tp_mult': 2.496504423799502, 'bear_tsl_mult': 0.7337787469276948, 'bear_time_stop': 246, 'bear_use_sma': True, 'bear_use_ema': False, 'bear_use_atr': True, 'bear_use_adx': True, 'bear_use_spike': False, 'bear_rsi_required': True, 'sideways_strategy': 'mean_reversion', 'sideways_bb_std_mult': 1.1758770785347745, 'sideways_rsi_os': 45, 'sideways_rsi_ob': 55, 'sideways_adx_thresh': 11.690824774129087, 'sideways_atr_min_pct': 0.009583203740776739, 'sideways_atr_max_pct': 0.057024449079511236, 'sideways_tp_mult': 1.6276906537354838, 'sideways_tsl_mult': 0.7309544935320424, 'sideways_time_stop': 178, 'sideways_use_sma': False, 'sideways_use_ema': True, 'sideways_use_atr': False, 'sideways_use_adx': False, 'sideways_use_spike': False, 'sideways_rsi_required': False}.
[I 2025-08-31 00:51:24,536] Trial 412 finished with values: [-0.04079329046959135, 0.040746298683879904] and parameters: {'p_sma': 39, 'p_std': 39, 'p_atr': 21, 'p_adx': 9, 'rsi_period': 60, 'ema1': 7, 'ema2': 27, 'slip_atr_k': 0.04509620604302869, 'slip_spread_k': 0.21097876482830652, 'spread_hl_frac': 0.01190464997994607, 'bb_std_mult': 1.7136078460288486, 'rsi_os': 44, 'rsi_ob': 64, 'vol_spike': 0.11889459690927741, 'adx_thresh': 11.826301244067235, 'atr_min_pct': 0.0062696229347163415, 'atr_max_pct': 0.06699255873951776, 'tp_mult': 1.1515041375117503, 'tsl_mult': 0.10166319376300252, 'strategy': 'breakout', 'time_stop': 137, 'use_sma': False, 'use_atr': False, 'use_adx': True, 'use_ema': True, 'use_spike': False, 'rsi_required': False, 'edge_k': 1.3913617279961317, 'edge_cap': 0.4127796135249921, 'bull_strategy': 'mean_reversion', 'bull_bb_std_mult': 2.7167732854410707, 'bull_rsi_os': 20, 'bull_rsi_ob': 82, 'bull_adx_thresh': 13.274851732473678, 'bull_atr_min_pct': 0.006101164095413083, 'bull_atr_max_pct': 0.06736383092543825, 'bull_tp_mult': 1.6623632034781786, 'bull_tsl_mult': 0.6602109779583616, 'bull_time_stop': 161, 'bull_use_sma': True, 'bull_use_ema': True, 'bull_use_atr': True, 'bull_use_adx': True, 'bull_use_spike': False, 'bull_rsi_required': False, 'bear_strategy': 'breakout', 'bear_bb_std_mult': 1.0127029419863838, 'bear_rsi_os': 42, 'bear_rsi_ob': 79, 'bear_adx_thresh': 7.739822627563359, 'bear_atr_min_pct': 0.0006673019243125036, 'bear_atr_max_pct': 0.017563091546510024, 'bear_tp_mult': 2.055179341431141, 'bear_tsl_mult': 0.7312780704878717, 'bear_time_stop': 294, 'bear_use_sma': True, 'bear_use_ema': False, 'bear_use_atr': True, 'bear_use_adx': True, 'bear_use_spike': False, 'bear_rsi_required': False, 'sideways_strategy': 'mean_reversion', 'sideways_bb_std_mult': 1.6736619886686104, 'sideways_rsi_os': 45, 'sideways_rsi_ob': 87, 'sideways_adx_thresh': 13.09529822514921, 'sideways_atr_min_pct': 0.022658111106111066, 'sideways_atr_max_pct': 0.057553144898596836, 'sideways_tp_mult': 1.4844415421987303, 'sideways_tsl_mult': 0.6835693813857973, 'sideways_time_stop': 127, 'sideways_use_sma': False, 'sideways_use_ema': True, 'sideways_use_atr': False, 'sideways_use_adx': False, 'sideways_use_spike': False, 'sideways_rsi_required': False}.
