[I 2025-08-31 00:03:54,794] Trial 19 finished with values: [-1000000000.0, 1000000000.0] and parameters: {'p_sma': 46, 'p_std': 26, 'p_atr': 15, 'p_adx': 30, 'rsi_period': 36, 'ema1': 24, 'ema2': 10, 'slip_atr_k': 0.05254002260836674, 'slip_spread_k': 0.00505701138942527, 'spread_hl_frac': 0.03535558787924126, 'bb_std_mult': 2.194083860591268, 'rsi_os': 53, 'rsi_ob': 62, 'vol_spike': 0.09871209153438062, 'adx_thresh': 5.438331798073818, 'atr_min_pct': 0.008192024852082657, 'atr_max_pct': 0.14293591567019215, 'tp_mult': 2.2857946446170168, 'tsl_mult': 0.4613690602623595, 'strategy': 'mean_reversion', 'time_stop': 238, 'use_sma': True, 'use_atr': True, 'use_adx': False, 'use_ema': True, 'use_spike': False, 'rsi_required': False, 'edge_k': 0.9119566814788633, 'edge_cap': 0.334622164849857, 'bull_strategy': 'mean_reversion', 'bull_bb_std_mult': 2.884229298553506, 'bull_rsi_os': 39, 'bull_rsi_ob': 68, 'bull_adx_thresh': 5.132900514731609, 'bull_atr_min_pct': 0.002622553585321892, 'bull_atr_max_pct': 0.05180045636602355, 'bull_tp_mult': 2.201094278188959, 'bull_tsl_mult': 0.05828342409640003, 'bull_time_stop': 89, 'bull_use_sma': True, 'bull_use_ema': False, 'bull_use_atr': True, 'bull_use_adx': False, 'bull_use_spike': False, 'bull_rsi_required': True, 'bear_strategy': 'mean_reversion', 'bear_bb_std_mult': 2.5969109214318693, 'bear_rsi_os': 28, 'bear_rsi_ob': 77, 'bear_adx_thresh': 29.108742252310233, 'bear_atr_min_pct': 0.017696376648605346, 'bear_atr_max_pct': 0.0875842572538052, 'bear_tp_mult': 1.8267221467322992, 'bear_tsl_mult': 0.05502893181116908, 'bear_time_stop': 88, 'bear_use_sma': False, 'bear_use_ema': False, 'bear_use_atr': True, 'bear_use_adx': False, 'bear_use_spike': True, 'bear_rsi_required': True, 'sideways_strategy': 'breakout', 'sideways_bb_std_mult': 1.1330270077442637, 'sideways_rsi_os': 17, 'sideways_rsi_ob': 86, 'sideways_adx_thresh': 28.88605873246266, 'sideways_atr_min_pct': 0.028980974546215125, 'sideways_atr_max_pct': 0.07175207999436743, 'sideways_tp_mult': 2.0632412266762685, 'sideways_tsl_mult': 0.8193719111727917, 'sideways_time_stop': 113, 'sideways_use_sma': False, 'sideways_use_ema': True, 'sideways_use_atr': True, 'sideways_use_adx': True, 'sideways_use_spike': True, 'sideways_rsi_required': True}.
[I 2025-08-31 00:03:54,910] Trial 20 finished with values: [-1000000000.0, 1000000000.0] and parameters: {'p_sma': 49, 'p_std': 28, 'p_atr': 15, 'p_adx': 30, 'rsi_period': 36, 'ema1': 24, 'ema2': 10, 'slip_atr_k': 0.0600796012927402, 'slip_spread_k': 0.9942534871229559, 'spread_hl_frac': 0.03184864413412295, 'bb_std_mult': 2.1556738924852636, 'rsi_os': 55, 'rsi_ob': 61, 'vol_spike': 0.08383939745775035, 'adx_thresh': 6.629198861065394, 'atr_min_pct': 0.009092892826602542, 'atr_max_pct': 0.14959642681211366, 'tp_mult': 2.306827286454811, 'tsl_mult': 0.44127583573893925, 'strategy': 'mean_reversion', 'time_stop': 218, 'use_sma': True, 'use_atr': True, 'use_adx': False, 'use_ema': False, 'use_spike': False, 'rsi_required': False, 'edge_k': 0.8952617976996083, 'edge_cap': 0.685045309236817, 'bull_strategy': 'mean_reversion', 'bull_bb_std_mult': 2.7818168237102934, 'bull_rsi_os': 39, 'bull_rsi_ob': 67, 'bull_adx_thresh': 5.413041644096823, 'bull_atr_min_pct': 0.003186537020066378, 'bull_atr_max_pct': 0.04523042333777187, 'bull_tp_mult': 2.2105973134320234, 'bull_tsl_mult': 0.016273073578370933, 'bull_time_stop': 83, 'bull_use_sma': True, 'bull_use_ema': False, 'bull_use_atr': True, 'bull_use_adx': False, 'bull_use_spike': False, 'bull_rsi_required': True, 'bear_strategy': 'mean_reversion', 'bear_bb_std_mult': 2.5915872749903226, 'bear_rsi_os': 28, 'bear_rsi_ob': 77, 'bear_adx_thresh': 28.883581623053583, 'bear_atr_min_pct': 0.01818450476473898, 'bear_atr_max_pct': 0.0886666150775571, 'bear_tp_mult': 1.7978410410647574, 'bear_tsl_mult': 0.09845822145673921, 'bear_time_stop': 196, 'bear_use_sma': False, 'bear_use_ema': False, 'bear_use_atr': False, 'bear_use_adx': False, 'bear_use_spike': True, 'bear_rsi_required': True, 'sideways_strategy': 'breakout', 'sideways_bb_std_mult': 1.1376111570921668, 'sideways_rsi_os': 17, 'sideways_rsi_ob': 73, 'sideways_adx_thresh': 29.520972015795884, 'sideways_atr_min_pct': 0.028970362573918648, 'sideways_atr_max_pct': 0.06988775898280307, 'sideways_tp_mult': 2.1351645871303657, 'sideways_tsl_mult': 0.9842265618778971, 'sideways_time_stop': 100, 'sideways_use_sma': False, 'sideways_use_ema': True, 'sideways_use_atr': True, 'sideways_use_adx': True, 'sideways_use_spike': True, 'sideways_rsi_required': True}.
[I 2025-08-31 00:04:23,099] Trial 17 finished with values: [-1000000000.0, 1000000000.0] and parameters: {'p_sma': 42, 'p_std': 27, 'p_atr': 7, 'p_adx': 24, 'rsi_period': 37, 'ema1': 30, 'ema2': 10, 'slip_atr_k': 0.16131846606541517, 'slip_spread_k': 0.7963494255735319, 'spread_hl_frac': 0.0013151701714135856, 'bb_std_mult': 2.7145164847898404, 'rsi_os': 32, 'rsi_ob': 63, 'vol_spike': 0.11953255863258036, 'adx_thresh': 29.324623948847155, 'atr_min_pct': 0.008466788027545358, 'atr_max_pct': 0.013434812905847512, 'tp_mult': 2.9929479051983634, 'tsl_mult': 0.5605975823148902, 'strategy': 'mean_reversion', 'time_stop': 229, 'use_sma': False, 'use_atr': False, 'use_adx': False, 'use_ema': True, 'use_spike': False, 'rsi_required': False, 'edge_k': 0.3721647447113337, 'edge_cap': 0.23040726267471276, 'bull_strategy': 'mean_reversion', 'bull_bb_std_mult': 2.9267662140134605, 'bull_rsi_os': 40, 'bull_rsi_ob': 73, 'bull_adx_thresh': 5.055207945542229, 'bull_atr_min_pct': 0.0037347392150795596, 'bull_atr_max_pct': 0.04981374065728908, 'bull_tp_mult': 2.1727218262020087, 'bull_tsl_mult': 0.05316955998953643, 'bull_time_stop': 89, 'bull_use_sma': True, 'bull_use_ema': False, 'bull_use_atr': True, 'bull_use_adx': False, 'bull_use_spike': False, 'bull_rsi_required': True, 'bear_strategy': 'mean_reversion', 'bear_bb_std_mult': 2.462646192040118, 'bear_rsi_os': 42, 'bear_rsi_ob': 48, 'bear_adx_thresh': 34.64886711337119, 'bear_atr_min_pct': 0.017762335997211214, 'bear_atr_max_pct': 0.06516809549795885, 'bear_tp_mult': 2.5249282056981466, 'bear_tsl_mult': 0.3950089430862025, 'bear_time_stop': 174, 'bear_use_sma': False, 'bear_use_ema': False, 'bear_use_atr': True, 'bear_use_adx': False, 'bear_use_spike': False, 'bear_rsi_required': False, 'sideways_strategy': 'breakout', 'sideways_bb_std_mult': 3.5358483500095375, 'sideways_rsi_os': 16, 'sideways_rsi_ob': 87, 'sideways_adx_thresh': 5.948862800610886, 'sideways_atr_min_pct': 0.0173493604982669, 'sideways_atr_max_pct': 0.08524755680310456, 'sideways_tp_mult': 2.02687704693215, 'sideways_tsl_mult': 0.651626677740925, 'sideways_time_stop': 110, 'sideways_use_sma': False, 'sideways_use_ema': True, 'sideways_use_atr': True, 'sideways_use_adx': True, 'sideways_use_spike': False, 'sideways_rsi_required': True}.
[I 2025-08-31 00:04:26,286] Trial 22 finished with values: [-0.08313567125234289, 0.08307274060351375] and parameters: {'p_sma': 51, 'p_std': 52, 'p_atr': 11, 'p_adx': 26, 'rsi_period': 25, 'ema1': 14, 'ema2': 19, 'slip_atr_k': 0.09145726327073248, 'slip_spread_k': 0.9933523426333948, 'spread_hl_frac': 0.008436735999380999, 'bb_std_mult': 2.923636042453132, 'rsi_os': 25, 'rsi_ob': 77, 'vol_spike': 0.07153215063780832, 'adx_thresh': 29.57310772601144, 'atr_min_pct': 0.021930078586660396, 'atr_max_pct': 0.12393110306907297, 'tp_mult': 2.742712248845844, 'tsl_mult': 0.13425749819393135, 'strategy': 'mean_reversion', 'time_stop': 199, 'use_sma': True, 'use_atr': True, 'use_adx': False, 'use_ema': False, 'use_spike': False, 'rsi_required': False, 'edge_k': 1.6323633045467831, 'edge_cap': 0.10216338850246692, 'bull_strategy': 'mean_reversion', 'bull_bb_std_mult': 1.6266946224036132, 'bull_rsi_os': 46, 'bull_rsi_ob': 85, 'bull_adx_thresh': 18.215139802267966, 'bull_atr_min_pct': 0.019702004029671264, 'bull_atr_max_pct': 0.036227462695626156, 'bull_tp_mult': 2.550771486079907, 'bull_tsl_mult': 0.7555941361404976, 'bull_time_stop': 248, 'bull_use_sma': True, 'bull_use_ema': True, 'bull_use_atr': True, 'bull_use_adx': False, 'bull_use_spike': True, 'bull_rsi_required': True, 'bear_strategy': 'mean_reversion', 'bear_bb_std_mult': 1.6303919555733601, 'bear_rsi_os': 33, 'bear_rsi_ob': 55, 'bear_adx_thresh': 29.559036527510465, 'bear_atr_min_pct': 0.008717052035650177, 'bear_atr_max_pct': 0.010249927242938044, 'bear_tp_mult': 2.283437033821096, 'bear_tsl_mult': 0.7892217346446849, 'bear_time_stop': 210, 'bear_use_sma': False, 'bear_use_ema': False, 'bear_use_atr': False, 'bear_use_adx': False, 'bear_use_spike': False, 'bear_rsi_required': True, 'sideways_strategy': 'breakout', 'sideways_bb_std_mult': 2.9253439880760688, 'sideways_rsi_os': 39, 'sideways_rsi_ob': 72, 'sideways_adx_thresh': 29.184631646431455, 'sideways_atr_min_pct': 0.00030681897653110635, 'sideways_atr_max_pct': 0.10472218059160508, 'sideways_tp_mult': 1.3807259600116246, 'sideways_tsl_mult': 0.7615525786766284, 'sideways_time_stop': 44, 'sideways_use_sma': True, 'sideways_use_ema': False, 'sideways_use_atr': False, 'sideways_use_adx': False, 'sideways_use_spike': True, 'sideways_rsi_required': True}.
[I 2025-08-31 00:04:26,687] Trial 21 finished with values: [-1000000000.0, 1000000000.0] and parameters: {'p_sma': 49, 'p_std': 24, 'p_atr': 11, 'p_adx': 30, 'rsi_period': 36, 'ema1': 13, 'ema2': 16, 'slip_atr_k': 0.044623037334132545, 'slip_spread_k': 0.6258393292271482, 'spread_hl_frac': 0.006559664865421489, 'bb_std_mult': 2.282243623927025, 'rsi_os': 26, 'rsi_ob': 79, 'vol_spike': 0.08294275167662586, 'adx_thresh': 28.542441340568885, 'atr_min_pct': 0.022532628126505822, 'atr_max_pct': 0.1261633775974117, 'tp_mult': 2.7098060310503773, 'tsl_mult': 0.18362718581607979, 'strategy': 'mean_reversion', 'time_stop': 217, 'use_sma': True, 'use_atr': True, 'use_adx': False, 'use_ema': False, 'use_spike': False, 'rsi_required': False, 'edge_k': 0.8988323835298536, 'edge_cap': 0.06363995804771416, 'bull_strategy': 'mean_reversion', 'bull_bb_std_mult': 2.553317047371308, 'bull_rsi_os': 44, 'bull_rsi_ob': 68, 'bull_adx_thresh': 28.477844459555772, 'bull_atr_min_pct': 0.019726096666664337, 'bull_atr_max_pct': 0.03901474862272977, 'bull_tp_mult': 2.535310500508499, 'bull_tsl_mult': 0.015183095520902412, 'bull_time_stop': 258, 'bull_use_sma': True, 'bull_use_ema': True, 'bull_use_atr': True, 'bull_use_adx': False, 'bull_use_spike': True, 'bull_rsi_required': True, 'bear_strategy': 'mean_reversion', 'bear_bb_std_mult': 1.6867957260169781, 'bear_rsi_os': 46, 'bear_rsi_ob': 56, 'bear_adx_thresh': 31.060637990784826, 'bear_atr_min_pct': 0.008715389861629905, 'bear_atr_max_pct': 0.011251932206771814, 'bear_tp_mult': 2.283399613780173, 'bear_tsl_mult': 0.1257770741352462, 'bear_time_stop': 90, 'bear_use_sma': False, 'bear_use_ema': False, 'bear_use_atr': False, 'bear_use_adx': False, 'bear_use_spike': True, 'bear_rsi_required': True, 'sideways_strategy': 'breakout', 'sideways_bb_std_mult': 2.8866465650406132, 'sideways_rsi_os': 19, 'sideways_rsi_ob': 73, 'sideways_adx_thresh': 28.82117013641492, 'sideways_atr_min_pct': 0.00044409584873359234, 'sideways_atr_max_pct': 0.06845300859153532, 'sideways_tp_mult': 2.195368833116389, 'sideways_tsl_mult': 0.7890309668899429, 'sideways_time_stop': 51, 'sideways_use_sma': True, 'sideways_use_ema': False, 'sideways_use_atr': False, 'sideways_use_adx': False, 'sideways_use_spike': True, 'sideways_rsi_required': True}.
[I 2025-08-31 00:04:26,835] Trial 23 finished with values: [-1000000000.0, 1000000000.0] and parameters: {'p_sma': 34, 'p_std': 55, 'p_atr': 10, 'p_adx': 27, 'rsi_period': 23, 'ema1': 13, 'ema2': 19, 'slip_atr_k': 0.23999395109985233, 'slip_spread_k': 0.6706272002898644, 'spread_hl_frac': 0.00715787702346027, 'bb_std_mult': 3.021922230264477, 'rsi_os': 26, 'rsi_ob': 79, 'vol_spike': 0.18001441307115662, 'adx_thresh': 29.626450923240675, 'atr_min_pct': 0.022902125394604442, 'atr_max_pct': 0.12038039745878602, 'tp_mult': 2.6448428163564794, 'tsl_mult': 0.15183639503065577, 'strategy': 'mean_reversion', 'time_stop': 107, 'use_sma': True, 'use_atr': True, 'use_adx': False, 'use_ema': False, 'use_spike': False, 'rsi_required': False, 'edge_k': 0.006576850243876886, 'edge_cap': 0.09939657302336047, 'bull_strategy': 'mean_reversion', 'bull_bb_std_mult': 1.5551557544455732, 'bull_rsi_os': 46, 'bull_rsi_ob': 81, 'bull_adx_thresh': 11.497270400677014, 'bull_atr_min_pct': 0.017512587358144746, 'bull_atr_max_pct': 0.07080648711011386, 'bull_tp_mult': 2.5601397791149534, 'bull_tsl_mult': 0.8215416380722619, 'bull_time_stop': 267, 'bull_use_sma': True, 'bull_use_ema': True, 'bull_use_atr': True, 'bull_use_adx': False, 'bull_use_spike': True, 'bull_rsi_required': True, 'bear_strategy': 'mean_reversion', 'bear_bb_std_mult': 1.8553897744220045, 'bear_rsi_os': 5, 'bear_rsi_ob': 54, 'bear_adx_thresh': 27.002441475054354, 'bear_atr_min_pct': 0.008525136109520007, 'bear_atr_max_pct': 0.01341371996414116, 'bear_tp_mult': 2.725439938643003, 'bear_tsl_mult': 0.7738645332795797, 'bear_time_stop': 137, 'bear_use_sma': False, 'bear_use_ema': False, 'bear_use_atr': False, 'bear_use_adx': False, 'bear_use_spike': False, 'bear_rsi_required': True, 'sideways_strategy': 'breakout', 'sideways_bb_std_mult': 1.8327150495943128, 'sideways_rsi_os': 40, 'sideways_rsi_ob': 78, 'sideways_adx_thresh': 23.586876918049786, 'sideways_atr_min_pct': 0.012594684370552809, 'sideways_atr_max_pct': 0.10980915381578836, 'sideways_tp_mult': 2.673502718510233, 'sideways_tsl_mult': 0.7616227517395279, 'sideways_time_stop': 46, 'sideways_use_sma': True, 'sideways_use_ema': False, 'sideways_use_atr': False, 'sideways_use_adx': False, 'sideways_use_spike': True, 'sideways_rsi_required': True}.
[I 2025-08-31 00:04:53,153] Trial 24 finished with values: [-0.028030154818152964, 0.027915311632326096] and parameters: {'p_sma': 33, 'p_std': 49, 'p_atr': 18, 'p_adx': 16, 'rsi_period': 20, 'ema1': 27, 'ema2': 18, 'slip_atr_k': 0.10138014992076753, 'slip_spread_k': 0.6945437290855772, 'spread_hl_frac': 0.008910653986251123, 'bb_std_mult': 2.977592002035261, 'rsi_os': 26, 'rsi_ob': 77, 'vol_spike': 0.19442170242908272, 'adx_thresh': 28.03924083098887, 'atr_min_pct': 0.01458956034476512, 'atr_max_pct': 0.10869319127788464, 'tp_mult': 2.6695021642804972, 'tsl_mult': 0.6984878424345333, 'strategy': 'breakout', 'time_stop': 185, 'use_sma': True, 'use_atr': True, 'use_adx': False, 'use_ema': False, 'use_spike': False, 'rsi_required': False, 'edge_k': 1.4917015724222615, 'edge_cap': 0.9875950887919824, 'bull_strategy': 'breakout', 'bull_bb_std_mult': 2.5103260431790417, 'bull_rsi_os': 6, 'bull_rsi_ob': 83, 'bull_adx_thresh': 11.118638690997646, 'bull_atr_min_pct': 0.019237034249271395, 'bull_atr_max_pct': 0.14906195731641442, 'bull_tp_mult': 2.499032441297302, 'bull_tsl_mult': 0.8037286424411616, 'bull_time_stop': 188, 'bull_use_sma': False, 'bull_use_ema': True, 'bull_use_atr': True, 'bull_use_adx': False, 'bull_use_spike': True, 'bull_rsi_required': True, 'bear_strategy': 'mean_reversion', 'bear_bb_std_mult': 1.6690722092383286, 'bear_rsi_os': 5, 'bear_rsi_ob': 64, 'bear_adx_thresh': 26.34459252875721, 'bear_atr_min_pct': 0.009079437177056948, 'bear_atr_max_pct': 0.01694492478773084, 'bear_tp_mult': 2.982603993770956, 'bear_tsl_mult': 0.7891072571951733, 'bear_time_stop': 270, 'bear_use_sma': True, 'bear_use_ema': False, 'bear_use_atr': False, 'bear_use_adx': False, 'bear_use_spike': False, 'bear_rsi_required': True, 'sideways_strategy': 'breakout', 'sideways_bb_std_mult': 1.6543773897688154, 'sideways_rsi_os': 38, 'sideways_rsi_ob': 77, 'sideways_adx_thresh': 23.335161248463873, 'sideways_atr_min_pct': 0.0021311298019725143, 'sideways_atr_max_pct': 0.11040611172435855, 'sideways_tp_mult': 1.0124905909935962, 'sideways_tsl_mult': 0.77894120374531, 'sideways_time_stop': 65, 'sideways_use_sma': True, 'sideways_use_ema': False, 'sideways_use_atr': False, 'sideways_use_adx': False, 'sideways_use_spike': True, 'sideways_rsi_required': False}.
[I 2025-08-31 00:04:57,326] Trial 25 finished with values: [-0.049970953339227187, 0.04987168325329144] and parameters: {'p_sma': 35, 'p_std': 55, 'p_atr': 10, 'p_adx': 26, 'rsi_period': 19, 'ema1': 12, 'ema2': 18, 'slip_atr_k': 0.09334104710795814, 'slip_spread_k': 0.6222341458131875, 'spread_hl_frac': 0.006844560311663668, 'bb_std_mult': 3.018958724711998, 'rsi_os': 27, 'rsi_ob': 78, 'vol_spike': 0.19089425275177901, 'adx_thresh': 30.19584766984058, 'atr_min_pct': 0.019360888047021234, 'atr_max_pct': 0.1259905488687632, 'tp_mult': 2.674985297356899, 'tsl_mult': 0.22880529471252203, 'strategy': 'mean_reversion', 'time_stop': 176, 'use_sma': True, 'use_atr': True, 'use_adx': False, 'use_ema': False, 'use_spike': False, 'rsi_required': False, 'edge_k': 1.5902057048208316, 'edge_cap': 0.0694755308622571, 'bull_strategy': 'mean_reversion', 'bull_bb_std_mult': 0.9460381783997949, 'bull_rsi_os': 46, 'bull_rsi_ob': 83, 'bull_adx_thresh': 11.319882280809985, 'bull_atr_min_pct': 0.019310075372437646, 'bull_atr_max_pct': 0.07292338063338352, 'bull_tp_mult': 2.5499720583248724, 'bull_tsl_mult': 0.842460765043765, 'bull_time_stop': 163, 'bull_use_sma': True, 'bull_use_ema': True, 'bull_use_atr': True, 'bull_use_adx': False, 'bull_use_spike': True, 'bull_rsi_required': True, 'bear_strategy': 'mean_reversion', 'bear_bb_std_mult': 1.475576181643566, 'bear_rsi_os': 5, 'bear_rsi_ob': 54, 'bear_adx_thresh': 31.1554707797656, 'bear_atr_min_pct': 0.008484949872843721, 'bear_atr_max_pct': 0.012055664411680989, 'bear_tp_mult': 2.799255078801605, 'bear_tsl_mult': 0.8095715219472894, 'bear_time_stop': 269, 'bear_use_sma': False, 'bear_use_ema': False, 'bear_use_atr': False, 'bear_use_adx': False, 'bear_use_spike': False, 'bear_rsi_required': True, 'sideways_strategy': 'breakout', 'sideways_bb_std_mult': 1.7219831835144648, 'sideways_rsi_os': 40, 'sideways_rsi_ob': 75, 'sideways_adx_thresh': 25.20980501423829, 'sideways_atr_min_pct': 0.0014542493368007777, 'sideways_atr_max_pct': 0.10754412477257075, 'sideways_tp_mult': 1.5307255271397446, 'sideways_tsl_mult': 0.7398567089438146, 'sideways_time_stop': 43, 'sideways_use_sma': True, 'sideways_use_ema': False, 'sideways_use_atr': False, 'sideways_use_adx': False, 'sideways_use_spike': True, 'sideways_rsi_required': True}.
[I 2025-08-31 00:04:58,452] Trial 26 finished with values: [-1000000000.0, 1000000000.0] and parameters: {'p_sma': 35, 'p_std': 53, 'p_atr': 10, 'p_adx': 26, 'rsi_period': 19, 'ema1': 20, 'ema2': 19, 'slip_atr_k': 0.0912011187868906, 'slip_spread_k': 0.6890571253103321, 'spread_hl_frac': 0.010953150031457193, 'bb_std_mult': 3.060378681319316, 'rsi_os': 22, 'rsi_ob': 74, 'vol_spike': 0.18697621324799568, 'adx_thresh': 30.68914492458538, 'atr_min_pct': 0.01851101420110673, 'atr_max_pct': 0.1116909601882603, 'tp_mult': 2.6380685324222095, 'tsl_mult': 0.7157959790158834, 'strategy': 'breakout', 'time_stop': 184, 'use_sma': True, 'use_atr': True, 'use_adx': False, 'use_ema': False, 'use_spike': False, 'rsi_required': True, 'edge_k': 1.711480548290118, 'edge_cap': 0.7513599303979018, 'bull_strategy': 'breakout', 'bull_bb_std_mult': 0.9536293108662103, 'bull_rsi_os': 46, 'bull_rsi_ob': 82, 'bull_adx_thresh': 11.153313469995847, 'bull_atr_min_pct': 0.019306804369486383, 'bull_atr_max_pct': 0.07027929977837162, 'bull_tp_mult': 2.6531710236466277, 'bull_tsl_mult': 0.8439675336944681, 'bull_time_stop': 150, 'bull_use_sma': False, 'bull_use_ema': True, 'bull_use_atr': True, 'bull_use_adx': True, 'bull_use_spike': True, 'bull_rsi_required': True, 'bear_strategy': 'mean_reversion', 'bear_bb_std_mult': 3.3552927916801565, 'bear_rsi_os': 7, 'bear_rsi_ob': 62, 'bear_adx_thresh': 26.176933122603746, 'bear_atr_min_pct': 0.008603611375980853, 'bear_atr_max_pct': 0.050489925871405335, 'bear_tp_mult': 2.7429847347144225, 'bear_tsl_mult': 0.7886161878094279, 'bear_time_stop': 270, 'bear_use_sma': True, 'bear_use_ema': False, 'bear_use_atr': False, 'bear_use_adx': False, 'bear_use_spike': False, 'bear_rsi_required': True, 'sideways_strategy': 'breakout', 'sideways_bb_std_mult': 1.647176692034992, 'sideways_rsi_os': 38, 'sideways_rsi_ob': 79, 'sideways_adx_thresh': 24.07763215215793, 'sideways_atr_min_pct': 0.010772336388713812, 'sideways_atr_max_pct': 0.10793242835308103, 'sideways_tp_mult': 2.684907121074033, 'sideways_tsl_mult': 0.7497192660728287, 'sideways_time_stop': 208, 'sideways_use_sma': True, 'sideways_use_ema': False, 'sideways_use_atr': False, 'sideways_use_adx': False, 'sideways_use_spike': True, 'sideways_rsi_required': False}.
