[I 2025-08-31 02:17:37,255] Trial 441 finished with values: [-1000000000.0, 1000000000.0] and parameters: {'p_sma': 46, 'p_std': 48, 'p_atr': 23, 'p_adx': 8, 'rsi_period': 60, 'ema1': 7, 'ema2': 18, 'slip_atr_k': 0.05043055766038913, 'slip_spread_k': 0.9070642915266631, 'spread_hl_frac': 0.008639087225745964, 'bb_std_mult': 2.6097387516432065, 'rsi_os': 53, 'rsi_ob': 72, 'vol_spike': 0.060218584900662106, 'adx_thresh': 11.433522609975482, 'atr_min_pct': 0.011585873369641553, 'atr_max_pct': 0.0913883192350661, 'tp_mult': 1.418504364966553, 'tsl_mult': 0.08869440346058836, 'strategy': 'breakout', 'time_stop': 127, 'use_sma': True, 'use_atr': False, 'use_adx': False, 'use_ema': True, 'use_spike': True, 'rsi_required': False, 'edge_k': 0.6082540207575078, 'edge_cap': 0.7699711715298725, 'bull_strategy': 'breakout', 'bull_bb_std_mult': 1.06300096765071, 'bull_rsi_os': 37, 'bull_rsi_ob': 75, 'bull_adx_thresh': 13.739050705057233, 'bull_atr_min_pct': 0.0019678109999300124, 'bull_atr_max_pct': 0.11570203539741256, 'bull_tp_mult': 2.1704554404515397, 'bull_tsl_mult': 0.2450434872370389, 'bull_time_stop': 157, 'bull_use_sma': False, 'bull_use_ema': False, 'bull_use_atr': False, 'bull_use_adx': False, 'bull_use_spike': True, 'bull_rsi_required': True, 'bear_strategy': 'mean_reversion', 'bear_bb_std_mult': 1.0678776381471984, 'bear_rsi_os': 50, 'bear_rsi_ob': 79, 'bear_adx_thresh': 9.92047638108729, 'bear_atr_min_pct': 0.025528595635122546, 'bear_atr_max_pct': 0.017743929536438535, 'bear_tp_mult': 2.9019183267441573, 'bear_tsl_mult': 0.7456277773065464, 'bear_time_stop': 189, 'bear_use_sma': True, 'bear_use_ema': True, 'bear_use_atr': False, 'bear_use_adx': False, 'bear_use_spike': False, 'bear_rsi_required': False, 'sideways_strategy': 'breakout', 'sideways_bb_std_mult': 3.408875681082666, 'sideways_rsi_os': 47, 'sideways_rsi_ob': 91, 'sideways_adx_thresh': 11.88293081187118, 'sideways_atr_min_pct': 0.02425840264873729, 'sideways_atr_max_pct': 0.04093045621144259, 'sideways_tp_mult': 2.716028292344081, 'sideways_tsl_mult': 0.7469345537343606, 'sideways_time_stop': 177, 'sideways_use_sma': True, 'sideways_use_ema': False, 'sideways_use_atr': False, 'sideways_use_adx': False, 'sideways_use_spike': True, 'sideways_rsi_required': False}.
[I 2025-08-31 02:17:37,851] Trial 444 finished with values: [-0.021049178514051303, 0.021046426940455217] and parameters: {'p_sma': 47, 'p_std': 36, 'p_atr': 22, 'p_adx': 18, 'rsi_period': 18, 'ema1': 8, 'ema2': 19, 'slip_atr_k': 0.23718322480163923, 'slip_spread_k': 0.7080814756488252, 'spread_hl_frac': 0.021177288776476413, 'bb_std_mult': 1.1567916362437378, 'rsi_os': 53, 'rsi_ob': 76, 'vol_spike': 0.15797423359303658, 'adx_thresh': 7.390700820337852, 'atr_min_pct': 0.006866629343487253, 'atr_max_pct': 0.06939230197984457, 'tp_mult': 1.4157412109142773, 'tsl_mult': 0.8838820360661224, 'strategy': 'breakout', 'time_stop': 108, 'use_sma': True, 'use_atr': False, 'use_adx': False, 'use_ema': True, 'use_spike': True, 'rsi_required': False, 'edge_k': 1.8535413670734417, 'edge_cap': 0.9998613715696973, 'bull_strategy': 'breakout', 'bull_bb_std_mult': 2.69762167780882, 'bull_rsi_os': 39, 'bull_rsi_ob': 90, 'bull_adx_thresh': 13.791749370058765, 'bull_atr_min_pct': 0.0007168597948779898, 'bull_atr_max_pct': 0.06583840072378663, 'bull_tp_mult': 2.429751141403402, 'bull_tsl_mult': 0.4697992372134655, 'bull_time_stop': 27, 'bull_use_sma': False, 'bull_use_ema': False, 'bull_use_atr': False, 'bull_use_adx': True, 'bull_use_spike': False, 'bull_rsi_required': True, 'bear_strategy': 'mean_reversion', 'bear_bb_std_mult': 1.0821857321331556, 'bear_rsi_os': 16, 'bear_rsi_ob': 77, 'bear_adx_thresh': 8.632314625581914, 'bear_atr_min_pct': 0.0077991263772086775, 'bear_atr_max_pct': 0.02471126003749762, 'bear_tp_mult': 1.505569141827827, 'bear_tsl_mult': 0.6863936505563117, 'bear_time_stop': 19, 'bear_use_sma': True, 'bear_use_ema': True, 'bear_use_atr': True, 'bear_use_adx': False, 'bear_use_spike': False, 'bear_rsi_required': False, 'sideways_strategy': 'breakout', 'sideways_bb_std_mult': 2.2842830094956335, 'sideways_rsi_os': 47, 'sideways_rsi_ob': 89, 'sideways_adx_thresh': 33.568504737788714, 'sideways_atr_min_pct': 0.01979874196162814, 'sideways_atr_max_pct': 0.1407988022912835, 'sideways_tp_mult': 1.0415525682331077, 'sideways_tsl_mult': 0.7467260846704356, 'sideways_time_stop': 178, 'sideways_use_sma': True, 'sideways_use_ema': False, 'sideways_use_atr': False, 'sideways_use_adx': False, 'sideways_use_spike': True, 'sideways_rsi_required': False}.
[I 2025-08-31 02:17:38,105] Trial 442 finished with values: [-1000000000.0, 1000000000.0] and parameters: {'p_sma': 20, 'p_std': 36, 'p_atr': 23, 'p_adx': 8, 'rsi_period': 24, 'ema1': 21, 'ema2': 19, 'slip_atr_k': 0.13530534335234187, 'slip_spread_k': 0.2271653628905149, 'spread_hl_frac': 0.03426033982885958, 'bb_std_mult': 1.764505635075738, 'rsi_os': 53, 'rsi_ob': 72, 'vol_spike': 0.25816871318245793, 'adx_thresh': 14.621000997841202, 'atr_min_pct': 0.01128637817118842, 'atr_max_pct': 0.06580649681379523, 'tp_mult': 2.7318331601062646, 'tsl_mult': 0.08782414955208082, 'strategy': 'breakout', 'time_stop': 13, 'use_sma': True, 'use_atr': False, 'use_adx': False, 'use_ema': True, 'use_spike': True, 'rsi_required': False, 'edge_k': 0.06445061584645173, 'edge_cap': 0.3647370354864518, 'bull_strategy': 'breakout', 'bull_bb_std_mult': 2.602064447528158, 'bull_rsi_os': 22, 'bull_rsi_ob': 72, 'bull_adx_thresh': 13.814639224477038, 'bull_atr_min_pct': 0.0020479201831502926, 'bull_atr_max_pct': 0.0849221517508577, 'bull_tp_mult': 2.1611657072192476, 'bull_tsl_mult': 0.4672039149487315, 'bull_time_stop': 159, 'bull_use_sma': False, 'bull_use_ema': False, 'bull_use_atr': False, 'bull_use_adx': True, 'bull_use_spike': False, 'bull_rsi_required': True, 'bear_strategy': 'mean_reversion', 'bear_bb_std_mult': 1.053075073524981, 'bear_rsi_os': 24, 'bear_rsi_ob': 79, 'bear_adx_thresh': 32.09686907601515, 'bear_atr_min_pct': 0.010088051208322265, 'bear_atr_max_pct': 0.1199598191804685, 'bear_tp_mult': 2.88371344910205, 'bear_tsl_mult': 0.7492343795780562, 'bear_time_stop': 255, 'bear_use_sma': True, 'bear_use_ema': True, 'bear_use_atr': False, 'bear_use_adx': False, 'bear_use_spike': False, 'bear_rsi_required': True, 'sideways_strategy': 'breakout', 'sideways_bb_std_mult': 3.253721097757209, 'sideways_rsi_os': 34, 'sideways_rsi_ob': 91, 'sideways_adx_thresh': 12.09763607474363, 'sideways_atr_min_pct': 0.015160056474131628, 'sideways_atr_max_pct': 0.1415362789885413, 'sideways_tp_mult': 2.544097818002368, 'sideways_tsl_mult': 0.7504032971087984, 'sideways_time_stop': 184, 'sideways_use_sma': True, 'sideways_use_ema': False, 'sideways_use_atr': False, 'sideways_use_adx': False, 'sideways_use_spike': True, 'sideways_rsi_required': False}.
[I 2025-08-31 02:17:38,252] Trial 443 finished with values: [-1000000000.0, 1000000000.0] and parameters: {'p_sma': 46, 'p_std': 47, 'p_atr': 30, 'p_adx': 9, 'rsi_period': 24, 'ema1': 15, 'ema2': 17, 'slip_atr_k': 0.03746961770416153, 'slip_spread_k': 0.6987299713072432, 'spread_hl_frac': 0.00866196034905103, 'bb_std_mult': 1.6584391714088087, 'rsi_os': 53, 'rsi_ob': 72, 'vol_spike': 0.25660106107917613, 'adx_thresh': 6.049827310965526, 'atr_min_pct': 0.01144560579359171, 'atr_max_pct': 0.06901803859375562, 'tp_mult': 2.6701843450826157, 'tsl_mult': 0.44402860576260694, 'strategy': 'breakout', 'time_stop': 105, 'use_sma': True, 'use_atr': False, 'use_adx': False, 'use_ema': True, 'use_spike': True, 'rsi_required': False, 'edge_k': 1.8991185767840966, 'edge_cap': 0.2884390591545166, 'bull_strategy': 'breakout', 'bull_bb_std_mult': 2.6767057810396384, 'bull_rsi_os': 37, 'bull_rsi_ob': 56, 'bull_adx_thresh': 13.706167764597073, 'bull_atr_min_pct': 0.0008807604167855795, 'bull_atr_max_pct': 0.0806605719658601, 'bull_tp_mult': 1.8301490781487808, 'bull_tsl_mult': 0.41375596327419073, 'bull_time_stop': 25, 'bull_use_sma': False, 'bull_use_ema': False, 'bull_use_atr': False, 'bull_use_adx': True, 'bull_use_spike': False, 'bull_rsi_required': False, 'bear_strategy': 'mean_reversion', 'bear_bb_std_mult': 1.0503177648112285, 'bear_rsi_os': 24, 'bear_rsi_ob': 78, 'bear_adx_thresh': 8.758336692716442, 'bear_atr_min_pct': 0.025702184389172173, 'bear_atr_max_pct': 0.08520072375935779, 'bear_tp_mult': 1.258923505919068, 'bear_tsl_mult': 0.9413669752134235, 'bear_time_stop': 19, 'bear_use_sma': True, 'bear_use_ema': True, 'bear_use_atr': False, 'bear_use_adx': False, 'bear_use_spike': False, 'bear_rsi_required': True, 'sideways_strategy': 'breakout', 'sideways_bb_std_mult': 2.1199082721686553, 'sideways_rsi_os': 47, 'sideways_rsi_ob': 91, 'sideways_adx_thresh': 19.964508194292602, 'sideways_atr_min_pct': 0.019822687750394065, 'sideways_atr_max_pct': 0.10975084418539588, 'sideways_tp_mult': 1.0103143375690138, 'sideways_tsl_mult': 0.6991383314987969, 'sideways_time_stop': 217, 'sideways_use_sma': True, 'sideways_use_ema': False, 'sideways_use_atr': False, 'sideways_use_adx': False, 'sideways_use_spike': True, 'sideways_rsi_required': False}.
[I 2025-08-31 02:18:29,308] Trial 445 finished with values: [-0.025436414060033163, 0.025334487002349627] and parameters: {'p_sma': 49, 'p_std': 36, 'p_atr': 22, 'p_adx': 9, 'rsi_period': 19, 'ema1': 8, 'ema2': 19, 'slip_atr_k': 0.16377058303934472, 'slip_spread_k': 0.7048196240882758, 'spread_hl_frac': 0.005896346480627951, 'bb_std_mult': 1.1552519621612205, 'rsi_os': 13, 'rsi_ob': 54, 'vol_spike': 0.20359132048332293, 'adx_thresh': 6.96001405630761, 'atr_min_pct': 0.00666209065956251, 'atr_max_pct': 0.06939244791096608, 'tp_mult': 2.6524322862886005, 'tsl_mult': 0.16996977854670003, 'strategy': 'breakout', 'time_stop': 91, 'use_sma': True, 'use_atr': False, 'use_adx': False, 'use_ema': True, 'use_spike': True, 'rsi_required': False, 'edge_k': 0.07783715199937435, 'edge_cap': 0.7910433718175178, 'bull_strategy': 'mean_reversion', 'bull_bb_std_mult': 2.554091408443723, 'bull_rsi_os': 21, 'bull_rsi_ob': 92, 'bull_adx_thresh': 12.86769397992522, 'bull_atr_min_pct': 0.0007237904725429439, 'bull_atr_max_pct': 0.06858638167856593, 'bull_tp_mult': 1.3968260796521057, 'bull_tsl_mult': 0.4673733100806391, 'bull_time_stop': 166, 'bull_use_sma': False, 'bull_use_ema': False, 'bull_use_atr': False, 'bull_use_adx': True, 'bull_use_spike': False, 'bull_rsi_required': False, 'bear_strategy': 'mean_reversion', 'bear_bb_std_mult': 0.9407997296108443, 'bear_rsi_os': 31, 'bear_rsi_ob': 94, 'bear_adx_thresh': 8.376948122512403, 'bear_atr_min_pct': 0.022112882661758728, 'bear_atr_max_pct': 0.023861702818866425, 'bear_tp_mult': 1.5930655744003592, 'bear_tsl_mult': 0.9516868710933515, 'bear_time_stop': 17, 'bear_use_sma': True, 'bear_use_ema': True, 'bear_use_atr': True, 'bear_use_adx': False, 'bear_use_spike': False, 'bear_rsi_required': False, 'sideways_strategy': 'breakout', 'sideways_bb_std_mult': 2.2808428089497883, 'sideways_rsi_os': 34, 'sideways_rsi_ob': 89, 'sideways_adx_thresh': 12.378632150202051, 'sideways_atr_min_pct': 0.019695694439058883, 'sideways_atr_max_pct': 0.07472824599116462, 'sideways_tp_mult': 1.045858265417634, 'sideways_tsl_mult': 0.7015488570095839, 'sideways_time_stop': 276, 'sideways_use_sma': True, 'sideways_use_ema': False, 'sideways_use_atr': False, 'sideways_use_adx': False, 'sideways_use_spike': True, 'sideways_rsi_required': False}.
[I 2025-08-31 02:18:29,872] Trial 448 finished with values: [-0.019451367196119285, 0.01935767573113582] and parameters: {'p_sma': 49, 'p_std': 40, 'p_atr': 22, 'p_adx': 14, 'rsi_period': 18, 'ema1': 8, 'ema2': 19, 'slip_atr_k': 0.03333437586929966, 'slip_spread_k': 0.2784981199557957, 'spread_hl_frac': 0.024916234337773936, 'bb_std_mult': 3.216721213942996, 'rsi_os': 46, 'rsi_ob': 74, 'vol_spike': 0.2099192427686924, 'adx_thresh': 7.653570459449114, 'atr_min_pct': 0.012976576777229267, 'atr_max_pct': 0.07280216207145429, 'tp_mult': 2.635097700000088, 'tsl_mult': 0.7793542933461237, 'strategy': 'breakout', 'time_stop': 91, 'use_sma': False, 'use_atr': True, 'use_adx': True, 'use_ema': True, 'use_spike': False, 'rsi_required': True, 'edge_k': 0.6808333291134764, 'edge_cap': 0.797087624554572, 'bull_strategy': 'mean_reversion', 'bull_bb_std_mult': 1.3476283430344775, 'bull_rsi_os': 39, 'bull_rsi_ob': 46, 'bull_adx_thresh': 14.464395629169797, 'bull_atr_min_pct': 0.0005759217032334759, 'bull_atr_max_pct': 0.06706777261946845, 'bull_tp_mult': 2.4261345294172707, 'bull_tsl_mult': 0.3797995617898713, 'bull_time_stop': 176, 'bull_use_sma': False, 'bull_use_ema': False, 'bull_use_atr': True, 'bull_use_adx': True, 'bull_use_spike': False, 'bull_rsi_required': False, 'bear_strategy': 'breakout', 'bear_bb_std_mult': 1.788196713963652, 'bear_rsi_os': 54, 'bear_rsi_ob': 58, 'bear_adx_thresh': 8.1206157429829, 'bear_atr_min_pct': 0.02998533021060295, 'bear_atr_max_pct': 0.02340079051547295, 'bear_tp_mult': 1.9537952463714354, 'bear_tsl_mult': 0.6821837951000986, 'bear_time_stop': 29, 'bear_use_sma': True, 'bear_use_ema': False, 'bear_use_atr': True, 'bear_use_adx': True, 'bear_use_spike': True, 'bear_rsi_required': False, 'sideways_strategy': 'mean_reversion', 'sideways_bb_std_mult': 0.9798812559640524, 'sideways_rsi_os': 10, 'sideways_rsi_ob': 89, 'sideways_adx_thresh': 13.580305635628937, 'sideways_atr_min_pct': 0.02220786709260845, 'sideways_atr_max_pct': 0.14754359402350414, 'sideways_tp_mult': 2.7694500464470178, 'sideways_tsl_mult': 0.7130964064028087, 'sideways_time_stop': 26, 'sideways_use_sma': False, 'sideways_use_ema': True, 'sideways_use_atr': True, 'sideways_use_adx': True, 'sideways_use_spike': False, 'sideways_rsi_required': True}.
[I 2025-08-31 02:18:30,158] Trial 446 finished with values: [-0.02442177050538319, 0.024327711778908134] and parameters: {'p_sma': 49, 'p_std': 36, 'p_atr': 22, 'p_adx': 9, 'rsi_period': 63, 'ema1': 8, 'ema2': 19, 'slip_atr_k': 0.038071042786630684, 'slip_spread_k': 0.7199243172536798, 'spread_hl_frac': 0.02127807539195324, 'bb_std_mult': 1.5888509270302853, 'rsi_os': 23, 'rsi_ob': 76, 'vol_spike': 0.2026396430651604, 'adx_thresh': 14.61235009090775, 'atr_min_pct': 0.013173973644076051, 'atr_max_pct': 0.06912215482156803, 'tp_mult': 2.667048051530318, 'tsl_mult': 0.6749856928763331, 'strategy': 'breakout', 'time_stop': 106, 'use_sma': True, 'use_atr': False, 'use_adx': False, 'use_ema': True, 'use_spike': True, 'rsi_required': False, 'edge_k': 0.6749702534283349, 'edge_cap': 0.35221417607626326, 'bull_strategy': 'mean_reversion', 'bull_bb_std_mult': 2.557766314900515, 'bull_rsi_os': 22, 'bull_rsi_ob': 90, 'bull_adx_thresh': 12.678028268617684, 'bull_atr_min_pct': 0.0006563119464739404, 'bull_atr_max_pct': 0.06793205096170818, 'bull_tp_mult': 1.8397279267740143, 'bull_tsl_mult': 0.47673198896232855, 'bull_time_stop': 174, 'bull_use_sma': False, 'bull_use_ema': False, 'bull_use_atr': True, 'bull_use_adx': True, 'bull_use_spike': False, 'bull_rsi_required': False, 'bear_strategy': 'mean_reversion', 'bear_bb_std_mult': 1.047786446133427, 'bear_rsi_os': 31, 'bear_rsi_ob': 58, 'bear_adx_thresh': 8.501882073668407, 'bear_atr_min_pct': 0.013784888839853867, 'bear_atr_max_pct': 0.024293664205433576, 'bear_tp_mult': 2.8253785540118512, 'bear_tsl_mult': 0.6834358857790125, 'bear_time_stop': 22, 'bear_use_sma': True, 'bear_use_ema': True, 'bear_use_atr': True, 'bear_use_adx': False, 'bear_use_spike': False, 'bear_rsi_required': False, 'sideways_strategy': 'breakout', 'sideways_bb_std_mult': 3.345059126237957, 'sideways_rsi_os': 48, 'sideways_rsi_ob': 89, 'sideways_adx_thresh': 12.33107725724653, 'sideways_atr_min_pct': 0.004306455652594408, 'sideways_atr_max_pct': 0.07470814892410434, 'sideways_tp_mult': 2.5361006451056385, 'sideways_tsl_mult': 0.7056297360055598, 'sideways_time_stop': 215, 'sideways_use_sma': True, 'sideways_use_ema': False, 'sideways_use_atr': False, 'sideways_use_adx': False, 'sideways_use_spike': True, 'sideways_rsi_required': False}.
[I 2025-08-31 02:18:30,513] Trial 447 finished with values: [-0.02120097098835927, 0.02109807310206626] and parameters: {'p_sma': 47, 'p_std': 43, 'p_atr': 22, 'p_adx': 9, 'rsi_period': 18, 'ema1': 12, 'ema2': 17, 'slip_atr_k': 0.16858748924905895, 'slip_spread_k': 0.2798318473045511, 'spread_hl_frac': 0.026462263155901212, 'bb_std_mult': 1.5996306979563935, 'rsi_os': 52, 'rsi_ob': 74, 'vol_spike': 0.26856050573057205, 'adx_thresh': 9.235329682922663, 'atr_min_pct': 0.012939176942941175, 'atr_max_pct': 0.07006322285048314, 'tp_mult': 2.656970483970464, 'tsl_mult': 0.17837870157772817, 'strategy': 'breakout', 'time_stop': 107, 'use_sma': False, 'use_atr': False, 'use_adx': True, 'use_ema': True, 'use_spike': False, 'rsi_required': False, 'edge_k': 0.6876771213437133, 'edge_cap': 0.7944801928825369, 'bull_strategy': 'mean_reversion', 'bull_bb_std_mult': 2.674710799825894, 'bull_rsi_os': 39, 'bull_rsi_ob': 90, 'bull_adx_thresh': 12.731862075178618, 'bull_atr_min_pct': 0.0007485077495584288, 'bull_atr_max_pct': 0.06711348164934516, 'bull_tp_mult': 1.8447670883995262, 'bull_tsl_mult': 0.6832517367982959, 'bull_time_stop': 174, 'bull_use_sma': False, 'bull_use_ema': False, 'bull_use_atr': True, 'bull_use_adx': True, 'bull_use_spike': False, 'bull_rsi_required': False, 'bear_strategy': 'mean_reversion', 'bear_bb_std_mult': 1.1247982044192024, 'bear_rsi_os': 12, 'bear_rsi_ob': 63, 'bear_adx_thresh': 8.6589043794994, 'bear_atr_min_pct': 0.02852173190110538, 'bear_atr_max_pct': 0.02549982171878379, 'bear_tp_mult': 1.9396717449427583, 'bear_tsl_mult': 0.6859779768286266, 'bear_time_stop': 27, 'bear_use_sma': True, 'bear_use_ema': False, 'bear_use_atr': True, 'bear_use_adx': True, 'bear_use_spike': False, 'bear_rsi_required': False, 'sideways_strategy': 'mean_reversion', 'sideways_bb_std_mult': 2.30190519181882, 'sideways_rsi_os': 48, 'sideways_rsi_ob': 89, 'sideways_adx_thresh': 19.11216293137658, 'sideways_atr_min_pct': 0.01987745282988635, 'sideways_atr_max_pct': 0.14068240346271407, 'sideways_tp_mult': 1.4133011725805058, 'sideways_tsl_mult': 0.7115009414208694, 'sideways_time_stop': 277, 'sideways_use_sma': True, 'sideways_use_ema': True, 'sideways_use_atr': False, 'sideways_use_adx': True, 'sideways_use_spike': True, 'sideways_rsi_required': False}.
[I 2025-08-31 02:18:31,738] Trial 451 finished with values: [-1000000000.0, 1000000000.0] and parameters: {'p_sma': 43, 'p_std': 40, 'p_atr': 24, 'p_adx': 10, 'rsi_period': 50, 'ema1': 7, 'ema2': 10, 'slip_atr_k': 0.23645382236907608, 'slip_spread_k': 0.27682185560589795, 'spread_hl_frac': 0.009622988707012397, 'bb_std_mult': 1.4589373076096481, 'rsi_os': 52, 'rsi_ob': 87, 'vol_spike': 0.16151399714872716, 'adx_thresh': 9.198835220719008, 'atr_min_pct': 0.024096102000820113, 'atr_max_pct': 0.0721507142264184, 'tp_mult': 2.926163389806557, 'tsl_mult': 0.14659756159603285, 'strategy': 'mean_reversion', 'time_stop': 219, 'use_sma': False, 'use_atr': True, 'use_adx': True, 'use_ema': False, 'use_spike': False, 'rsi_required': True, 'edge_k': 0.7267280523429667, 'edge_cap': 0.8168575536616315, 'bull_strategy': 'breakout', 'bull_bb_std_mult': 0.7484162834718173, 'bull_rsi_os': 39, 'bull_rsi_ob': 69, 'bull_adx_thresh': 14.678923487701312, 'bull_atr_min_pct': 0.0013933246027267138, 'bull_atr_max_pct': 0.0757406852589371, 'bull_tp_mult': 2.4342673553239202, 'bull_tsl_mult': 0.06839714978188188, 'bull_time_stop': 216, 'bull_use_sma': False, 'bull_use_ema': False, 'bull_use_atr': True, 'bull_use_adx': True, 'bull_use_spike': False, 'bull_rsi_required': False, 'bear_strategy': 'breakout', 'bear_bb_std_mult': 3.3846153975615296, 'bear_rsi_os': 23, 'bear_rsi_ob': 77, 'bear_adx_thresh': 7.215398962791248, 'bear_atr_min_pct': 0.007671095294728599, 'bear_atr_max_pct': 0.03528563689743394, 'bear_tp_mult': 1.9292375685530305, 'bear_tsl_mult': 0.10926502741475669, 'bear_time_stop': 118, 'bear_use_sma': False, 'bear_use_ema': False, 'bear_use_atr': False, 'bear_use_adx': True, 'bear_use_spike': True, 'bear_rsi_required': False, 'sideways_strategy': 'mean_reversion', 'sideways_bb_std_mult': 1.000355615111774, 'sideways_rsi_os': 55, 'sideways_rsi_ob': 56, 'sideways_adx_thresh': 19.030117007302287, 'sideways_atr_min_pct': 0.022587706486119952, 'sideways_atr_max_pct': 0.14976152137298035, 'sideways_tp_mult': 1.164764760126598, 'sideways_tsl_mult': 0.7198843388326167, 'sideways_time_stop': 46, 'sideways_use_sma': False, 'sideways_use_ema': True, 'sideways_use_atr': True, 'sideways_use_adx': True, 'sideways_use_spike': False, 'sideways_rsi_required': True}.
