[I 2025-08-31 00:06:34,349] Trial 36 finished with values: [-1000000000.0, 1000000000.0] and parameters: {'p_sma': 36, 'p_std': 45, 'p_atr': 30, 'p_adx': 28, 'rsi_period': 13, 'ema1': 28, 'ema2': 29, 'slip_atr_k': 0.03138651205575457, 'slip_spread_k': 0.8088792732897933, 'spread_hl_frac': 0.00853035409736622, 'bb_std_mult': 2.880603481854447, 'rsi_os': 29, 'rsi_ob': 65, 'vol_spike': 0.0707601479148241, 'adx_thresh': 26.47503441084818, 'atr_min_pct': 0.016629088179513526, 'atr_max_pct': 0.09505060071705893, 'tp_mult': 2.211334584117969, 'tsl_mult': 0.3851877990025072, 'strategy': 'breakout', 'time_stop': 244, 'use_sma': False, 'use_atr': False, 'use_adx': True, 'use_ema': True, 'use_spike': True, 'rsi_required': False, 'edge_k': 1.6427656772565697, 'edge_cap': 0.4208710418757545, 'bull_strategy': 'mean_reversion', 'bull_bb_std_mult': 1.1789062042332805, 'bull_rsi_os': 24, 'bull_rsi_ob': 87, 'bull_adx_thresh': 19.414031214178827, 'bull_atr_min_pct': 0.005611839049154131, 'bull_atr_max_pct': 0.033427302607984086, 'bull_tp_mult': 1.6449575598380435, 'bull_tsl_mult': 0.7630857860737555, 'bull_time_stop': 240, 'bull_use_sma': True, 'bull_use_ema': True, 'bull_use_atr': True, 'bull_use_adx': False, 'bull_use_spike': True, 'bull_rsi_required': True, 'bear_strategy': 'mean_reversion', 'bear_bb_std_mult': 1.4866068381229618, 'bear_rsi_os': 36, 'bear_rsi_ob': 68, 'bear_adx_thresh': 27.542106426428923, 'bear_atr_min_pct': 0.01573837072816423, 'bear_atr_max_pct': 0.12272980528299804, 'bear_tp_mult': 2.2397800649719954, 'bear_tsl_mult': 0.7027455899243917, 'bear_time_stop': 209, 'bear_use_sma': True, 'bear_use_ema': True, 'bear_use_atr': True, 'bear_use_adx': True, 'bear_use_spike': True, 'bear_rsi_required': False, 'sideways_strategy': 'mean_reversion', 'sideways_bb_std_mult': 0.5056590417394902, 'sideways_rsi_os': 5, 'sideways_rsi_ob': 83, 'sideways_adx_thresh': 14.049373216849059, 'sideways_atr_min_pct': 0.004401947164609017, 'sideways_atr_max_pct': 0.07857180133852226, 'sideways_tp_mult': 1.537819168386102, 'sideways_tsl_mult': 0.7224139668575909, 'sideways_time_stop': 71, 'sideways_use_sma': True, 'sideways_use_ema': False, 'sideways_use_atr': False, 'sideways_use_adx': False, 'sideways_use_spike': False, 'sideways_rsi_required': True}.
[I 2025-08-31 00:06:35,113] Trial 38 finished with values: [-1000000000.0, 1000000000.0] and parameters: {'p_sma': 35, 'p_std': 50, 'p_atr': 9, 'p_adx': 11, 'rsi_period': 12, 'ema1': 22, 'ema2': 29, 'slip_atr_k': 0.18696631555880552, 'slip_spread_k': 0.723546313489192, 'spread_hl_frac': 0.0092671505543537, 'bb_std_mult': 1.4361325136050285, 'rsi_os': 16, 'rsi_ob': 53, 'vol_spike': 0.21766298093293102, 'adx_thresh': 30.402515490148005, 'atr_min_pct': 0.020190379565881225, 'atr_max_pct': 0.07452176731120691, 'tp_mult': 2.7195374261129204, 'tsl_mult': 0.4728356782728675, 'strategy': 'breakout', 'time_stop': 243, 'use_sma': False, 'use_atr': True, 'use_adx': True, 'use_ema': True, 'use_spike': True, 'rsi_required': True, 'edge_k': 1.5702489066076228, 'edge_cap': 0.34701159259544756, 'bull_strategy': 'mean_reversion', 'bull_bb_std_mult': 1.653421466521109, 'bull_rsi_os': 42, 'bull_rsi_ob': 71, 'bull_adx_thresh': 10.048576287704321, 'bull_atr_min_pct': 0.005935904234259512, 'bull_atr_max_pct': 0.14226528099255936, 'bull_tp_mult': 2.0805228386823535, 'bull_tsl_mult': 0.3973371023182865, 'bull_time_stop': 138, 'bull_use_sma': False, 'bull_use_ema': True, 'bull_use_atr': True, 'bull_use_adx': True, 'bull_use_spike': True, 'bull_rsi_required': True, 'bear_strategy': 'breakout', 'bear_bb_std_mult': 1.2176753145910157, 'bear_rsi_os': 15, 'bear_rsi_ob': 68, 'bear_adx_thresh': 15.463170210219026, 'bear_atr_min_pct': 0.015215409073906805, 'bear_atr_max_pct': 0.12366277272303916, 'bear_tp_mult': 1.9535950018955563, 'bear_tsl_mult': 0.6903230037010349, 'bear_time_stop': 254, 'bear_use_sma': True, 'bear_use_ema': True, 'bear_use_atr': True, 'bear_use_adx': False, 'bear_use_spike': True, 'bear_rsi_required': False, 'sideways_strategy': 'breakout', 'sideways_bb_std_mult': 2.9732481354786024, 'sideways_rsi_os': 6, 'sideways_rsi_ob': 83, 'sideways_adx_thresh': 33.732234084531314, 'sideways_atr_min_pct': 0.005609787903329408, 'sideways_atr_max_pct': 0.05626976675889446, 'sideways_tp_mult': 1.5239835349849362, 'sideways_tsl_mult': 0.7253378705261198, 'sideways_time_stop': 35, 'sideways_use_sma': True, 'sideways_use_ema': False, 'sideways_use_atr': False, 'sideways_use_adx': False, 'sideways_use_spike': False, 'sideways_rsi_required': True}.
[I 2025-08-31 00:06:35,374] Trial 37 finished with values: [-1000000000.0, 1000000000.0] and parameters: {'p_sma': 36, 'p_std': 17, 'p_atr': 9, 'p_adx': 28, 'rsi_period': 68, 'ema1': 25, 'ema2': 30, 'slip_atr_k': 0.1866583800090391, 'slip_spread_k': 0.7547897257518095, 'spread_hl_frac': 0.009543128658365022, 'bb_std_mult': 1.221631813369259, 'rsi_os': 31, 'rsi_ob': 54, 'vol_spike': 0.22273972273592962, 'adx_thresh': 30.392349675403487, 'atr_min_pct': 0.014832458632548276, 'atr_max_pct': 0.09286367362911557, 'tp_mult': 2.5488620154658346, 'tsl_mult': 0.5198592263399323, 'strategy': 'breakout', 'time_stop': 242, 'use_sma': True, 'use_atr': True, 'use_adx': True, 'use_ema': True, 'use_spike': True, 'rsi_required': False, 'edge_k': 1.643270490858626, 'edge_cap': 0.36871147827661677, 'bull_strategy': 'mean_reversion', 'bull_bb_std_mult': 1.7757086458239368, 'bull_rsi_os': 36, 'bull_rsi_ob': 72, 'bull_adx_thresh': 19.112045591719294, 'bull_atr_min_pct': 0.006358610058028689, 'bull_atr_max_pct': 0.032080417047697596, 'bull_tp_mult': 2.4275428919310684, 'bull_tsl_mult': 0.773099612254356, 'bull_time_stop': 192, 'bull_use_sma': False, 'bull_use_ema': True, 'bull_use_atr': True, 'bull_use_adx': False, 'bull_use_spike': True, 'bull_rsi_required': True, 'bear_strategy': 'breakout', 'bear_bb_std_mult': 1.5558892969717655, 'bear_rsi_os': 36, 'bear_rsi_ob': 68, 'bear_adx_thresh': 18.682842094128425, 'bear_atr_min_pct': 0.007209295292107202, 'bear_atr_max_pct': 0.1252913976684481, 'bear_tp_mult': 2.7310655141587095, 'bear_tsl_mult': 0.7060478688779979, 'bear_time_stop': 240, 'bear_use_sma': True, 'bear_use_ema': True, 'bear_use_atr': True, 'bear_use_adx': False, 'bear_use_spike': True, 'bear_rsi_required': False, 'sideways_strategy': 'mean_reversion', 'sideways_bb_std_mult': 2.5708654646947786, 'sideways_rsi_os': 47, 'sideways_rsi_ob': 90, 'sideways_adx_thresh': 33.4039724283073, 'sideways_atr_min_pct': 0.013349961384059614, 'sideways_atr_max_pct': 0.05502232953809561, 'sideways_tp_mult': 1.5614209501745346, 'sideways_tsl_mult': 0.7434382998561566, 'sideways_time_stop': 297, 'sideways_use_sma': False, 'sideways_use_ema': False, 'sideways_use_atr': False, 'sideways_use_adx': False, 'sideways_use_spike': False, 'sideways_rsi_required': True}.
[I 2025-08-31 00:06:35,387] Trial 39 finished with values: [-1000000000.0, 1000000000.0] and parameters: {'p_sma': 14, 'p_std': 48, 'p_atr': 9, 'p_adx': 28, 'rsi_period': 46, 'ema1': 25, 'ema2': 29, 'slip_atr_k': 0.11469022761129742, 'slip_spread_k': 0.7243469477431621, 'spread_hl_frac': 0.009163753366164627, 'bb_std_mult': 1.2641135752671302, 'rsi_os': 12, 'rsi_ob': 93, 'vol_spike': 0.22433568433665224, 'adx_thresh': 8.992110385613191, 'atr_min_pct': 0.01661293332718567, 'atr_max_pct': 0.07273973022886697, 'tp_mult': 2.434104602685962, 'tsl_mult': 0.5100250859405898, 'strategy': 'breakout', 'time_stop': 243, 'use_sma': True, 'use_atr': True, 'use_adx': True, 'use_ema': True, 'use_spike': False, 'rsi_required': True, 'edge_k': 1.5818951433529438, 'edge_cap': 0.3566349444447721, 'bull_strategy': 'mean_reversion', 'bull_bb_std_mult': 1.8356490887815027, 'bull_rsi_os': 28, 'bull_rsi_ob': 65, 'bull_adx_thresh': 9.513716442626274, 'bull_atr_min_pct': 0.005920669075227565, 'bull_atr_max_pct': 0.13714979752709772, 'bull_tp_mult': 1.121152973223976, 'bull_tsl_mult': 0.13680335567325702, 'bull_time_stop': 194, 'bull_use_sma': False, 'bull_use_ema': True, 'bull_use_atr': True, 'bull_use_adx': True, 'bull_use_spike': True, 'bull_rsi_required': True, 'bear_strategy': 'breakout', 'bear_bb_std_mult': 1.2296655105943346, 'bear_rsi_os': 15, 'bear_rsi_ob': 69, 'bear_adx_thresh': 16.966171985135354, 'bear_atr_min_pct': 0.006945657351957908, 'bear_atr_max_pct': 0.11656104491198395, 'bear_tp_mult': 2.396180770437486, 'bear_tsl_mult': 0.6894426206732246, 'bear_time_stop': 251, 'bear_use_sma': True, 'bear_use_ema': False, 'bear_use_atr': False, 'bear_use_adx': False, 'bear_use_spike': False, 'bear_rsi_required': True, 'sideways_strategy': 'breakout', 'sideways_bb_std_mult': 2.8856020012270864, 'sideways_rsi_os': 5, 'sideways_rsi_ob': 83, 'sideways_adx_thresh': 33.75485251314243, 'sideways_atr_min_pct': 0.005196980227820763, 'sideways_atr_max_pct': 0.011204091884931239, 'sideways_tp_mult': 1.5635913967449648, 'sideways_tsl_mult': 0.39370251919479626, 'sideways_time_stop': 32, 'sideways_use_sma': True, 'sideways_use_ema': False, 'sideways_use_atr': False, 'sideways_use_adx': False, 'sideways_use_spike': True, 'sideways_rsi_required': True}.
[I 2025-08-31 00:07:08,428] Trial 40 finished with values: [-1000000000.0, 1000000000.0] and parameters: {'p_sma': 14, 'p_std': 51, 'p_atr': 9, 'p_adx': 12, 'rsi_period': 42, 'ema1': 22, 'ema2': 51, 'slip_atr_k': 0.11774673254575267, 'slip_spread_k': 0.7162181064628259, 'spread_hl_frac': 0.04670974410287158, 'bb_std_mult': 1.2781013610119243, 'rsi_os': 6, 'rsi_ob': 52, 'vol_spike': 0.21275381071480556, 'adx_thresh': 30.3086731166218, 'atr_min_pct': 0.025005282576297798, 'atr_max_pct': 0.07387963968050047, 'tp_mult': 2.550256611861751, 'tsl_mult': 0.5384266449766214, 'strategy': 'breakout', 'time_stop': 77, 'use_sma': True, 'use_atr': True, 'use_adx': False, 'use_ema': True, 'use_spike': False, 'rsi_required': True, 'edge_k': 0.1388838713792408, 'edge_cap': 0.1464988097307206, 'bull_strategy': 'mean_reversion', 'bull_bb_std_mult': 1.7955882447340394, 'bull_rsi_os': 28, 'bull_rsi_ob': 65, 'bull_adx_thresh': 9.495468222433265, 'bull_atr_min_pct': 0.016979522988154264, 'bull_atr_max_pct': 0.1446902842019253, 'bull_tp_mult': 1.0359120455862383, 'bull_tsl_mult': 0.6046841404240835, 'bull_time_stop': 201, 'bull_use_sma': False, 'bull_use_ema': True, 'bull_use_atr': True, 'bull_use_adx': True, 'bull_use_spike': True, 'bull_rsi_required': True, 'bear_strategy': 'breakout', 'bear_bb_std_mult': 2.3945134838771645, 'bear_rsi_os': 14, 'bear_rsi_ob': 73, 'bear_adx_thresh': 32.31286330479693, 'bear_atr_min_pct': 0.006654940065723331, 'bear_atr_max_pct': 0.0976350523291625, 'bear_tp_mult': 1.9493581930559096, 'bear_tsl_mult': 0.6784538610040335, 'bear_time_stop': 253, 'bear_use_sma': True, 'bear_use_ema': False, 'bear_use_atr': False, 'bear_use_adx': False, 'bear_use_spike': False, 'bear_rsi_required': True, 'sideways_strategy': 'breakout', 'sideways_bb_std_mult': 2.9547367018314348, 'sideways_rsi_os': 34, 'sideways_rsi_ob': 91, 'sideways_adx_thresh': 33.73590922700379, 'sideways_atr_min_pct': 0.0021601310385566544, 'sideways_atr_max_pct': 0.05820901253084099, 'sideways_tp_mult': 1.2767656360067208, 'sideways_tsl_mult': 0.007152404926712819, 'sideways_time_stop': 180, 'sideways_use_sma': True, 'sideways_use_ema': False, 'sideways_use_atr': False, 'sideways_use_adx': False, 'sideways_use_spike': True, 'sideways_rsi_required': False}.
[I 2025-08-31 00:07:08,901] Trial 41 finished with values: [-1000000000.0, 1000000000.0] and parameters: {'p_sma': 51, 'p_std': 21, 'p_atr': 9, 'p_adx': 18, 'rsi_period': 46, 'ema1': 5, 'ema2': 53, 'slip_atr_k': 0.10906608146720514, 'slip_spread_k': 0.09739562439493105, 'spread_hl_frac': 0.04934470346703736, 'bb_std_mult': 1.1528851679349128, 'rsi_os': 5, 'rsi_ob': 56, 'vol_spike': 0.2641348112459486, 'adx_thresh': 11.100050512854969, 'atr_min_pct': 0.014126726054578976, 'atr_max_pct': 0.11772655235329639, 'tp_mult': 2.5492802178379175, 'tsl_mult': 0.542711755970764, 'strategy': 'breakout', 'time_stop': 65, 'use_sma': True, 'use_atr': True, 'use_adx': False, 'use_ema': False, 'use_spike': False, 'rsi_required': False, 'edge_k': 0.12515896412688823, 'edge_cap': 0.18414084984264972, 'bull_strategy': 'breakout', 'bull_bb_std_mult': 1.8082358588648353, 'bull_rsi_os': 30, 'bull_rsi_ob': 64, 'bull_adx_thresh': 12.895662137269358, 'bull_atr_min_pct': 0.016675436381741113, 'bull_atr_max_pct': 0.14859345774576926, 'bull_tp_mult': 1.1248310683072198, 'bull_tsl_mult': 0.17298522413984596, 'bull_time_stop': 187, 'bull_use_sma': False, 'bull_use_ema': False, 'bull_use_atr': True, 'bull_use_adx': True, 'bull_use_spike': False, 'bull_rsi_required': True, 'bear_strategy': 'breakout', 'bear_bb_std_mult': 2.419139092402402, 'bear_rsi_os': 32, 'bear_rsi_ob': 73, 'bear_adx_thresh': 32.88317175993492, 'bear_atr_min_pct': 0.007463422120331428, 'bear_atr_max_pct': 0.07738182605417582, 'bear_tp_mult': 2.390413683782491, 'bear_tsl_mult': 0.8642489095589647, 'bear_time_stop': 37, 'bear_use_sma': False, 'bear_use_ema': False, 'bear_use_atr': False, 'bear_use_adx': False, 'bear_use_spike': False, 'bear_rsi_required': True, 'sideways_strategy': 'breakout', 'sideways_bb_std_mult': 1.3507847871201835, 'sideways_rsi_os': 35, 'sideways_rsi_ob': 91, 'sideways_adx_thresh': 21.465734096049786, 'sideways_atr_min_pct': 0.0026500003716490245, 'sideways_atr_max_pct': 0.06131913086226583, 'sideways_tp_mult': 2.244227039879178, 'sideways_tsl_mult': 0.38158248248805504, 'sideways_time_stop': 94, 'sideways_use_sma': False, 'sideways_use_ema': True, 'sideways_use_atr': False, 'sideways_use_adx': False, 'sideways_use_spike': True, 'sideways_rsi_required': False}.
[I 2025-08-31 00:07:09,026] Trial 42 finished with values: [-0.06447734949286821, 0.06431401301219035] and parameters: {'p_sma': 52, 'p_std': 30, 'p_atr': 25, 'p_adx': 18, 'rsi_period': 49, 'ema1': 5, 'ema2': 39, 'slip_atr_k': 0.11216163578140777, 'slip_spread_k': 0.09411355364326934, 'spread_hl_frac': 0.04330286685744691, 'bb_std_mult': 3.341395408083856, 'rsi_os': 25, 'rsi_ob': 57, 'vol_spike': 0.2986913561557049, 'adx_thresh': 16.56874211236065, 'atr_min_pct': 0.025320726167492293, 'atr_max_pct': 0.05807861998343326, 'tp_mult': 1.8795371909877305, 'tsl_mult': 0.26212032318736134, 'strategy': 'mean_reversion', 'time_stop': 81, 'use_sma': True, 'use_atr': True, 'use_adx': False, 'use_ema': False, 'use_spike': False, 'rsi_required': False, 'edge_k': 1.9728182148029343, 'edge_cap': 0.49284824375156994, 'bull_strategy': 'breakout', 'bull_bb_std_mult': 2.3402470602633874, 'bull_rsi_os': 30, 'bull_rsi_ob': 46, 'bull_adx_thresh': 22.65979418670648, 'bull_atr_min_pct': 0.02763853855307634, 'bull_atr_max_pct': 0.08260927617061299, 'bull_tp_mult': 2.5401689462928276, 'bull_tsl_mult': 0.4178720000291921, 'bull_time_stop': 61, 'bull_use_sma': True, 'bull_use_ema': False, 'bull_use_atr': True, 'bull_use_adx': True, 'bull_use_spike': False, 'bull_rsi_required': True, 'bear_strategy': 'breakout', 'bear_bb_std_mult': 0.900042898487222, 'bear_rsi_os': 55, 'bear_rsi_ob': 82, 'bear_adx_thresh': 24.622335998076814, 'bear_atr_min_pct': 0.0003725736963405349, 'bear_atr_max_pct': 0.03544014329678458, 'bear_tp_mult': 2.1642675799512046, 'bear_tsl_mult': 0.8812693054232479, 'bear_time_stop': 282, 'bear_use_sma': False, 'bear_use_ema': False, 'bear_use_atr': False, 'bear_use_adx': False, 'bear_use_spike': False, 'bear_rsi_required': True, 'sideways_strategy': 'breakout', 'sideways_bb_std_mult': 1.3340260461528641, 'sideways_rsi_os': 36, 'sideways_rsi_ob': 45, 'sideways_adx_thresh': 20.71885001856235, 'sideways_atr_min_pct': 0.0020674039252711798, 'sideways_atr_max_pct': 0.061764648327420006, 'sideways_tp_mult': 1.2311593818311042, 'sideways_tsl_mult': 0.5868684266040897, 'sideways_time_stop': 183, 'sideways_use_sma': False, 'sideways_use_ema': True, 'sideways_use_atr': True, 'sideways_use_adx': True, 'sideways_use_spike': True, 'sideways_rsi_required': False}.
[I 2025-08-31 00:07:09,194] Trial 43 finished with values: [-0.022949667961131626, 0.02284430051201393] and parameters: {'p_sma': 19, 'p_std': 36, 'p_atr': 25, 'p_adx': 19, 'rsi_period': 7, 'ema1': 6, 'ema2': 53, 'slip_atr_k': 0.07322198869839269, 'slip_spread_k': 0.09481199389081651, 'spread_hl_frac': 0.041330400724599634, 'bb_std_mult': 0.5886957288975514, 'rsi_os': 7, 'rsi_ob': 57, 'vol_spike': 0.28760405787220544, 'adx_thresh': 16.403642962646494, 'atr_min_pct': 0.014234396540232157, 'atr_max_pct': 0.11815916167558534, 'tp_mult': 1.7900171625314105, 'tsl_mult': 0.28618310486364595, 'strategy': 'mean_reversion', 'time_stop': 66, 'use_sma': True, 'use_atr': True, 'use_adx': False, 'use_ema': False, 'use_spike': False, 'rsi_required': False, 'edge_k': 0.12913469762080557, 'edge_cap': 0.48970667183976957, 'bull_strategy': 'breakout', 'bull_bb_std_mult': 2.3126373872245174, 'bull_rsi_os': 30, 'bull_rsi_ob': 55, 'bull_adx_thresh': 24.390513840518736, 'bull_atr_min_pct': 0.016675618551423754, 'bull_atr_max_pct': 0.08914164563219329, 'bull_tp_mult': 2.5243807784833647, 'bull_tsl_mult': 0.6409557391806828, 'bull_time_stop': 105, 'bull_use_sma': True, 'bull_use_ema': False, 'bull_use_atr': True, 'bull_use_adx': True, 'bull_use_spike': False, 'bull_rsi_required': True, 'bear_strategy': 'breakout', 'bear_bb_std_mult': 2.3723822804737718, 'bear_rsi_os': 32, 'bear_rsi_ob': 72, 'bear_adx_thresh': 24.51718988721278, 'bear_atr_min_pct': 0.002981547254025025, 'bear_atr_max_pct': 0.07946972829874799, 'bear_tp_mult': 2.1238842021865905, 'bear_tsl_mult': 0.8476839385883079, 'bear_time_stop': 41, 'bear_use_sma': False, 'bear_use_ema': False, 'bear_use_atr': False, 'bear_use_adx': False, 'bear_use_spike': False, 'bear_rsi_required': True, 'sideways_strategy': 'breakout', 'sideways_bb_std_mult': 1.3357578836802784, 'sideways_rsi_os': 38, 'sideways_rsi_ob': 70, 'sideways_adx_thresh': 21.85202727663623, 'sideways_atr_min_pct': 0.002493005438253617, 'sideways_atr_max_pct': 0.12082993018885549, 'sideways_tp_mult': 1.2608491764503142, 'sideways_tsl_mult': 0.30729797266748415, 'sideways_time_stop': 176, 'sideways_use_sma': False, 'sideways_use_ema': True, 'sideways_use_atr': True, 'sideways_use_adx': True, 'sideways_use_spike': True, 'sideways_rsi_required': False}.
[I 2025-08-31 00:07:09,514] Trial 44 finished with values: [-1000000000.0, 1000000000.0] and parameters: {'p_sma': 54, 'p_std': 21, 'p_atr': 24, 'p_adx': 18, 'rsi_period': 7, 'ema1': 15, 'ema2': 40, 'slip_atr_k': 0.00029194568252303814, 'slip_spread_k': 0.9869889203666274, 'spread_hl_frac': 0.042034849466426646, 'bb_std_mult': 0.8357342153001945, 'rsi_os': 25, 'rsi_ob': 45, 'vol_spike': 0.2667348832895718, 'adx_thresh': 14.448344991094954, 'atr_min_pct': 0.014004833332461624, 'atr_max_pct': 0.11671681671517135, 'tp_mult': 1.8480003337091668, 'tsl_mult': 0.3136653685483552, 'strategy': 'mean_reversion', 'time_stop': 200, 'use_sma': True, 'use_atr': True, 'use_adx': False, 'use_ema': False, 'use_spike': False, 'rsi_required': False, 'edge_k': 1.8313586013665266, 'edge_cap': 0.4875089155061435, 'bull_strategy': 'breakout', 'bull_bb_std_mult': 0.7277339166976893, 'bull_rsi_os': 31, 'bull_rsi_ob': 56, 'bull_adx_thresh': 12.030887884858753, 'bull_atr_min_pct': 0.001548217752463782, 'bull_atr_max_pct': 0.0850950334606711, 'bull_tp_mult': 2.517302640336148, 'bull_tsl_mult': 0.40654471194409963, 'bull_time_stop': 99, 'bull_use_sma': True, 'bull_use_ema': False, 'bull_use_atr': False, 'bull_use_adx': True, 'bull_use_spike': False, 'bull_rsi_required': True, 'bear_strategy': 'breakout', 'bear_bb_std_mult': 0.8350944601854193, 'bear_rsi_os': 32, 'bear_rsi_ob': 95, 'bear_adx_thresh': 24.495579175807087, 'bear_atr_min_pct': 4.0526277377116865e-06, 'bear_atr_max_pct': 0.039282777250226185, 'bear_tp_mult': 2.829219577246323, 'bear_tsl_mult': 0.5813219514919505, 'bear_time_stop': 281, 'bear_use_sma': False, 'bear_use_ema': False, 'bear_use_atr': False, 'bear_use_adx': False, 'bear_use_spike': False, 'bear_rsi_required': True, 'sideways_strategy': 'mean_reversion', 'sideways_bb_std_mult': 2.1020915638776763, 'sideways_rsi_os': 27, 'sideways_rsi_ob': 45, 'sideways_adx_thresh': 10.1600776805249, 'sideways_atr_min_pct': 0.009058560654179006, 'sideways_atr_max_pct': 0.11823969154273223, 'sideways_tp_mult': 2.2820882322694125, 'sideways_tsl_mult': 0.27977527577843053, 'sideways_time_stop': 236, 'sideways_use_sma': False, 'sideways_use_ema': True, 'sideways_use_atr': True, 'sideways_use_adx': True, 'sideways_use_spike': True, 'sideways_rsi_required': False}.
