[I 2025-08-31 00:41:37,111] Trial 343 finished with values: [-1000000000.0, 1000000000.0] and parameters: {'p_sma': 50, 'p_std': 52, 'p_atr': 23, 'p_adx': 24, 'rsi_period': 71, 'ema1': 7, 'ema2': 19, 'slip_atr_k': 0.18012637746755122, 'slip_spread_k': 0.22588134166337762, 'spread_hl_frac': 0.009176501032356753, 'bb_std_mult': 1.9777701632952884, 'rsi_os': 53, 'rsi_ob': 75, 'vol_spike': 0.18811845251234746, 'adx_thresh': 32.54790931930861, 'atr_min_pct': 0.01653385731439523, 'atr_max_pct': 0.0717280825268176, 'tp_mult': 2.769823176372001, 'tsl_mult': 0.1369674284520241, 'strategy': 'breakout', 'time_stop': 122, 'use_sma': True, 'use_atr': False, 'use_adx': False, 'use_ema': True, 'use_spike': True, 'rsi_required': False, 'edge_k': 0.7338667510368686, 'edge_cap': 0.8482676844344713, 'bull_strategy': 'breakout', 'bull_bb_std_mult': 2.787911927833517, 'bull_rsi_os': 41, 'bull_rsi_ob': 88, 'bull_adx_thresh': 19.8511019230604, 'bull_atr_min_pct': 0.022286105027234826, 'bull_atr_max_pct': 0.13667750654120342, 'bull_tp_mult': 2.473059060467209, 'bull_tsl_mult': 0.26956932218618473, 'bull_time_stop': 179, 'bull_use_sma': True, 'bull_use_ema': False, 'bull_use_atr': True, 'bull_use_adx': True, 'bull_use_spike': False, 'bull_rsi_required': True, 'bear_strategy': 'mean_reversion', 'bear_bb_std_mult': 1.07621586364623, 'bear_rsi_os': 52, 'bear_rsi_ob': 65, 'bear_adx_thresh': 6.972514840082656, 'bear_atr_min_pct': 0.009992408611161543, 'bear_atr_max_pct': 0.033766002299941165, 'bear_tp_mult': 1.9227844708228923, 'bear_tsl_mult': 0.09297422892172047, 'bear_time_stop': 233, 'bear_use_sma': True, 'bear_use_ema': True, 'bear_use_atr': False, 'bear_use_adx': False, 'bear_use_spike': False, 'bear_rsi_required': False, 'sideways_strategy': 'mean_reversion', 'sideways_bb_std_mult': 0.8244353773670468, 'sideways_rsi_os': 44, 'sideways_rsi_ob': 51, 'sideways_adx_thresh': 21.341770263382962, 'sideways_atr_min_pct': 0.016027510203796225, 'sideways_atr_max_pct': 0.05900786330377345, 'sideways_tp_mult': 1.314525176691894, 'sideways_tsl_mult': 0.5923494488264319, 'sideways_time_stop': 215, 'sideways_use_sma': True, 'sideways_use_ema': True, 'sideways_use_atr': True, 'sideways_use_adx': False, 'sideways_use_spike': True, 'sideways_rsi_required': False}.
[I 2025-08-31 00:41:37,301] Trial 341 finished with values: [-1000000000.0, 1000000000.0] and parameters: {'p_sma': 51, 'p_std': 40, 'p_atr': 23, 'p_adx': 9, 'rsi_period': 59, 'ema1': 7, 'ema2': 19, 'slip_atr_k': 0.034630904071495286, 'slip_spread_k': 0.6404780211315093, 'spread_hl_frac': 0.0010024234329062062, 'bb_std_mult': 0.8777328398896849, 'rsi_os': 54, 'rsi_ob': 54, 'vol_spike': 0.08258061930187537, 'adx_thresh': 13.92331961432268, 'atr_min_pct': 0.016515102908800518, 'atr_max_pct': 0.08439332383966969, 'tp_mult': 2.5814849278584266, 'tsl_mult': 0.1344295990811214, 'strategy': 'breakout', 'time_stop': 268, 'use_sma': True, 'use_atr': False, 'use_adx': False, 'use_ema': True, 'use_spike': True, 'rsi_required': False, 'edge_k': 0.746680126471123, 'edge_cap': 0.14302462760816348, 'bull_strategy': 'breakout', 'bull_bb_std_mult': 2.729459625796623, 'bull_rsi_os': 41, 'bull_rsi_ob': 70, 'bull_adx_thresh': 12.199777392391363, 'bull_atr_min_pct': 0.018422757378483572, 'bull_atr_max_pct': 0.13615105868291283, 'bull_tp_mult': 2.17440134102737, 'bull_tsl_mult': 0.2774708897727602, 'bull_time_stop': 157, 'bull_use_sma': True, 'bull_use_ema': False, 'bull_use_atr': True, 'bull_use_adx': True, 'bull_use_spike': False, 'bull_rsi_required': True, 'bear_strategy': 'mean_reversion', 'bear_bb_std_mult': 1.2808608299896933, 'bear_rsi_os': 10, 'bear_rsi_ob': 80, 'bear_adx_thresh': 7.789366051049695, 'bear_atr_min_pct': 0.008959514635373724, 'bear_atr_max_pct': 0.010868183465205867, 'bear_tp_mult': 2.101549703123148, 'bear_tsl_mult': 0.4422993131492202, 'bear_time_stop': 175, 'bear_use_sma': True, 'bear_use_ema': True, 'bear_use_atr': False, 'bear_use_adx': True, 'bear_use_spike': True, 'bear_rsi_required': False, 'sideways_strategy': 'mean_reversion', 'sideways_bb_std_mult': 2.7958098419253634, 'sideways_rsi_os': 9, 'sideways_rsi_ob': 87, 'sideways_adx_thresh': 28.46886937652798, 'sideways_atr_min_pct': 0.021846315860726703, 'sideways_atr_max_pct': 0.04298115491826459, 'sideways_tp_mult': 1.7929116139193562, 'sideways_tsl_mult': 0.9713149312005062, 'sideways_time_stop': 210, 'sideways_use_sma': True, 'sideways_use_ema': True, 'sideways_use_atr': True, 'sideways_use_adx': False, 'sideways_use_spike': True, 'sideways_rsi_required': False}.
[I 2025-08-31 00:42:07,902] Trial 346 finished with values: [-1000000000.0, 1000000000.0] and parameters: {'p_sma': 49, 'p_std': 41, 'p_atr': 23, 'p_adx': 30, 'rsi_period': 55, 'ema1': 17, 'ema2': 12, 'slip_atr_k': 0.03254180399548717, 'slip_spread_k': 0.25074369046875217, 'spread_hl_frac': 0.0008409880573214505, 'bb_std_mult': 0.9769045004263278, 'rsi_os': 39, 'rsi_ob': 69, 'vol_spike': 0.16594439804567074, 'adx_thresh': 18.213585318281467, 'atr_min_pct': 0.00509408355449935, 'atr_max_pct': 0.014675546096442144, 'tp_mult': 2.714931763608378, 'tsl_mult': 0.12154746258619316, 'strategy': 'breakout', 'time_stop': 249, 'use_sma': True, 'use_atr': False, 'use_adx': False, 'use_ema': True, 'use_spike': False, 'rsi_required': False, 'edge_k': 1.1739831153073617, 'edge_cap': 0.8583112310220089, 'bull_strategy': 'breakout', 'bull_bb_std_mult': 2.774567700848586, 'bull_rsi_os': 40, 'bull_rsi_ob': 70, 'bull_adx_thresh': 27.986753974231053, 'bull_atr_min_pct': 0.004488768053859754, 'bull_atr_max_pct': 0.03403552373749808, 'bull_tp_mult': 1.4034632239154483, 'bull_tsl_mult': 0.9382464077852233, 'bull_time_stop': 153, 'bull_use_sma': False, 'bull_use_ema': False, 'bull_use_atr': True, 'bull_use_adx': True, 'bull_use_spike': False, 'bull_rsi_required': False, 'bear_strategy': 'mean_reversion', 'bear_bb_std_mult': 1.8708981044213264, 'bear_rsi_os': 22, 'bear_rsi_ob': 80, 'bear_adx_thresh': 8.416999583016796, 'bear_atr_min_pct': 0.009077626851112984, 'bear_atr_max_pct': 0.04334984872760187, 'bear_tp_mult': 2.1201135971164238, 'bear_tsl_mult': 0.9728283076233509, 'bear_time_stop': 25, 'bear_use_sma': True, 'bear_use_ema': False, 'bear_use_atr': False, 'bear_use_adx': True, 'bear_use_spike': True, 'bear_rsi_required': False, 'sideways_strategy': 'mean_reversion', 'sideways_bb_std_mult': 1.1615792949540935, 'sideways_rsi_os': 10, 'sideways_rsi_ob': 91, 'sideways_adx_thresh': 23.56909661742896, 'sideways_atr_min_pct': 0.007853891727743572, 'sideways_atr_max_pct': 0.14367481311944938, 'sideways_tp_mult': 1.4462307975553508, 'sideways_tsl_mult': 0.036467265362226386, 'sideways_time_stop': 196, 'sideways_use_sma': True, 'sideways_use_ema': False, 'sideways_use_atr': False, 'sideways_use_adx': False, 'sideways_use_spike': True, 'sideways_rsi_required': True}.
[I 2025-08-31 00:42:08,211] Trial 347 finished with values: [-0.024975144431493956, 0.024937006198166547] and parameters: {'p_sma': 19, 'p_std': 8, 'p_atr': 16, 'p_adx': 30, 'rsi_period': 81, 'ema1': 17, 'ema2': 56, 'slip_atr_k': 0.05430161927657951, 'slip_spread_k': 0.24764644262024055, 'spread_hl_frac': 0.007786630232716429, 'bb_std_mult': 2.6741195034305196, 'rsi_os': 27, 'rsi_ob': 70, 'vol_spike': 0.1643054213502082, 'adx_thresh': 13.214960005360929, 'atr_min_pct': 0.029314693203574757, 'atr_max_pct': 0.12928281070711156, 'tp_mult': 1.1645615781746663, 'tsl_mult': 0.6977683123952945, 'strategy': 'mean_reversion', 'time_stop': 250, 'use_sma': True, 'use_atr': False, 'use_adx': False, 'use_ema': True, 'use_spike': False, 'rsi_required': False, 'edge_k': 1.7386398939026042, 'edge_cap': 0.8627743657376006, 'bull_strategy': 'mean_reversion', 'bull_bb_std_mult': 2.7906867522066867, 'bull_rsi_os': 5, 'bull_rsi_ob': 49, 'bull_adx_thresh': 18.08947603074682, 'bull_atr_min_pct': 0.0005374856691608026, 'bull_atr_max_pct': 0.07013624213080549, 'bull_tp_mult': 2.514958516712495, 'bull_tsl_mult': 0.9328075409147792, 'bull_time_stop': 150, 'bull_use_sma': False, 'bull_use_ema': False, 'bull_use_atr': True, 'bull_use_adx': True, 'bull_use_spike': False, 'bull_rsi_required': False, 'bear_strategy': 'mean_reversion', 'bear_bb_std_mult': 1.8710937806276986, 'bear_rsi_os': 22, 'bear_rsi_ob': 80, 'bear_adx_thresh': 8.546665005763451, 'bear_atr_min_pct': 0.009761064753893146, 'bear_atr_max_pct': 0.04325804162999847, 'bear_tp_mult': 1.8294768886649428, 'bear_tsl_mult': 0.6004017373061538, 'bear_time_stop': 25, 'bear_use_sma': True, 'bear_use_ema': False, 'bear_use_atr': False, 'bear_use_adx': True, 'bear_use_spike': False, 'bear_rsi_required': True, 'sideways_strategy': 'breakout', 'sideways_bb_std_mult': 1.1672204444466512, 'sideways_rsi_os': 45, 'sideways_rsi_ob': 91, 'sideways_adx_thresh': 18.56057063522658, 'sideways_atr_min_pct': 0.02107401062326767, 'sideways_atr_max_pct': 0.07455703872514714, 'sideways_tp_mult': 1.1130425314017658, 'sideways_tsl_mult': 0.8755303045268652, 'sideways_time_stop': 189, 'sideways_use_sma': True, 'sideways_use_ema': False, 'sideways_use_atr': False, 'sideways_use_adx': False, 'sideways_use_spike': True, 'sideways_rsi_required': True}.
[I 2025-08-31 00:42:08,448] Trial 345 finished with values: [-1000000000.0, 1000000000.0] and parameters: {'p_sma': 49, 'p_std': 52, 'p_atr': 24, 'p_adx': 27, 'rsi_period': 56, 'ema1': 6, 'ema2': 20, 'slip_atr_k': 0.03064831442333932, 'slip_spread_k': 0.22859944016175193, 'spread_hl_frac': 0.0004443368223359008, 'bb_std_mult': 1.9522284525859077, 'rsi_os': 52, 'rsi_ob': 69, 'vol_spike': 0.2016954379442067, 'adx_thresh': 10.687085208617715, 'atr_min_pct': 0.029296016258320047, 'atr_max_pct': 0.08459130209435473, 'tp_mult': 1.8129316296131035, 'tsl_mult': 0.13698337651026352, 'strategy': 'breakout', 'time_stop': 203, 'use_sma': True, 'use_atr': False, 'use_adx': False, 'use_ema': True, 'use_spike': True, 'rsi_required': False, 'edge_k': 0.730915305178119, 'edge_cap': 0.8508047762052089, 'bull_strategy': 'breakout', 'bull_bb_std_mult': 2.7814132736721526, 'bull_rsi_os': 41, 'bull_rsi_ob': 70, 'bull_adx_thresh': 12.414846753897189, 'bull_atr_min_pct': 0.00047896643478715706, 'bull_atr_max_pct': 0.07039960691770665, 'bull_tp_mult': 2.5293183360424902, 'bull_tsl_mult': 0.20532009092415487, 'bull_time_stop': 180, 'bull_use_sma': True, 'bull_use_ema': False, 'bull_use_atr': True, 'bull_use_adx': True, 'bull_use_spike': False, 'bull_rsi_required': False, 'bear_strategy': 'mean_reversion', 'bear_bb_std_mult': 1.121127757179443, 'bear_rsi_os': 52, 'bear_rsi_ob': 65, 'bear_adx_thresh': 8.410663207196611, 'bear_atr_min_pct': 0.01005159164876757, 'bear_atr_max_pct': 0.010962044053163091, 'bear_tp_mult': 2.7214998269556996, 'bear_tsl_mult': 0.09156919794526591, 'bear_time_stop': 252, 'bear_use_sma': True, 'bear_use_ema': True, 'bear_use_atr': False, 'bear_use_adx': True, 'bear_use_spike': False, 'bear_rsi_required': False, 'sideways_strategy': 'mean_reversion', 'sideways_bb_std_mult': 0.8220067289364088, 'sideways_rsi_os': 44, 'sideways_rsi_ob': 91, 'sideways_adx_thresh': 25.152958140383923, 'sideways_atr_min_pct': 0.015814395316178047, 'sideways_atr_max_pct': 0.043017954689587454, 'sideways_tp_mult': 1.1154738339153074, 'sideways_tsl_mult': 0.883423211840678, 'sideways_time_stop': 206, 'sideways_use_sma': True, 'sideways_use_ema': False, 'sideways_use_atr': False, 'sideways_use_adx': False, 'sideways_use_spike': True, 'sideways_rsi_required': True}.
[I 2025-08-31 00:42:08,689] Trial 344 finished with values: [-1000000000.0, 1000000000.0] and parameters: {'p_sma': 50, 'p_std': 41, 'p_atr': 23, 'p_adx': 26, 'rsi_period': 57, 'ema1': 6, 'ema2': 19, 'slip_atr_k': 0.180732678413776, 'slip_spread_k': 0.23393605386584712, 'spread_hl_frac': 0.00924828830261417, 'bb_std_mult': 0.8553520267131951, 'rsi_os': 8, 'rsi_ob': 52, 'vol_spike': 0.19057535377236076, 'adx_thresh': 5.274915098419823, 'atr_min_pct': 0.020339246520995842, 'atr_max_pct': 0.08886341547190617, 'tp_mult': 2.6570001528573934, 'tsl_mult': 0.1341104136453602, 'strategy': 'breakout', 'time_stop': 122, 'use_sma': True, 'use_atr': False, 'use_adx': False, 'use_ema': True, 'use_spike': True, 'rsi_required': False, 'edge_k': 1.72961603498262, 'edge_cap': 0.33382474393509, 'bull_strategy': 'breakout', 'bull_bb_std_mult': 2.7246125620119437, 'bull_rsi_os': 40, 'bull_rsi_ob': 72, 'bull_adx_thresh': 12.259319026012836, 'bull_atr_min_pct': 9.773034668036809e-06, 'bull_atr_max_pct': 0.07028099331717258, 'bull_tp_mult': 2.4838237430816394, 'bull_tsl_mult': 0.207895639846077, 'bull_time_stop': 281, 'bull_use_sma': True, 'bull_use_ema': False, 'bull_use_atr': True, 'bull_use_adx': True, 'bull_use_spike': False, 'bull_rsi_required': True, 'bear_strategy': 'mean_reversion', 'bear_bb_std_mult': 1.2772266527288907, 'bear_rsi_os': 47, 'bear_rsi_ob': 65, 'bear_adx_thresh': 7.484993288126767, 'bear_atr_min_pct': 0.009732933617528052, 'bear_atr_max_pct': 0.010454680301426269, 'bear_tp_mult': 1.9268391229799058, 'bear_tsl_mult': 0.6483398369895708, 'bear_time_stop': 117, 'bear_use_sma': True, 'bear_use_ema': True, 'bear_use_atr': False, 'bear_use_adx': True, 'bear_use_spike': False, 'bear_rsi_required': False, 'sideways_strategy': 'mean_reversion', 'sideways_bb_std_mult': 0.8498032163238647, 'sideways_rsi_os': 44, 'sideways_rsi_ob': 90, 'sideways_adx_thresh': 25.61653085291641, 'sideways_atr_min_pct': 0.02204745401945039, 'sideways_atr_max_pct': 0.1474352995301677, 'sideways_tp_mult': 1.789551431287926, 'sideways_tsl_mult': 0.8512325864723722, 'sideways_time_stop': 203, 'sideways_use_sma': True, 'sideways_use_ema': True, 'sideways_use_atr': True, 'sideways_use_adx': False, 'sideways_use_spike': True, 'sideways_rsi_required': True}.
[I 2025-08-31 00:42:09,244] Trial 351 finished with values: [-1000000000.0, 1000000000.0] and parameters: {'p_sma': 43, 'p_std': 36, 'p_atr': 10, 'p_adx': 21, 'rsi_period': 60, 'ema1': 6, 'ema2': 17, 'slip_atr_k': 0.04418698753598063, 'slip_spread_k': 0.2539169150987023, 'spread_hl_frac': 0.045508816180138856, 'bb_std_mult': 1.3633059985491336, 'rsi_os': 53, 'rsi_ob': 65, 'vol_spike': 0.17808336788158913, 'adx_thresh': 12.532498143919224, 'atr_min_pct': 0.013120131158148434, 'atr_max_pct': 0.0631134974878524, 'tp_mult': 2.0758569357815717, 'tsl_mult': 0.059126979755394514, 'strategy': 'mean_reversion', 'time_stop': 99, 'use_sma': True, 'use_atr': False, 'use_adx': True, 'use_ema': True, 'use_spike': False, 'rsi_required': False, 'edge_k': 0.6391583658832125, 'edge_cap': 0.48268061366034204, 'bull_strategy': 'mean_reversion', 'bull_bb_std_mult': 2.643494099542311, 'bull_rsi_os': 7, 'bull_rsi_ob': 81, 'bull_adx_thresh': 13.284186634330318, 'bull_atr_min_pct': 0.0010089951225530657, 'bull_atr_max_pct': 0.07443263541798117, 'bull_tp_mult': 1.7919688676496672, 'bull_tsl_mult': 0.33978126292227506, 'bull_time_stop': 169, 'bull_use_sma': False, 'bull_use_ema': False, 'bull_use_atr': True, 'bull_use_adx': True, 'bull_use_spike': False, 'bull_rsi_required': False, 'bear_strategy': 'mean_reversion', 'bear_bb_std_mult': 0.9250752038859983, 'bear_rsi_os': 23, 'bear_rsi_ob': 78, 'bear_adx_thresh': 6.513329572734941, 'bear_atr_min_pct': 0.008414332158349058, 'bear_atr_max_pct': 0.03631234996676009, 'bear_tp_mult': 2.9685283721975635, 'bear_tsl_mult': 0.7639035612298115, 'bear_time_stop': 185, 'bear_use_sma': True, 'bear_use_ema': False, 'bear_use_atr': False, 'bear_use_adx': False, 'bear_use_spike': False, 'bear_rsi_required': True, 'sideways_strategy': 'breakout', 'sideways_bb_std_mult': 1.6472008691857316, 'sideways_rsi_os': 31, 'sideways_rsi_ob': 89, 'sideways_adx_thresh': 31.12318543859093, 'sideways_atr_min_pct': 0.022809152085352356, 'sideways_atr_max_pct': 0.13432531280727872, 'sideways_tp_mult': 2.5454372696125525, 'sideways_tsl_mult': 0.829078813194089, 'sideways_time_stop': 142, 'sideways_use_sma': True, 'sideways_use_ema': False, 'sideways_use_atr': False, 'sideways_use_adx': False, 'sideways_use_spike': True, 'sideways_rsi_required': False}.
[I 2025-08-31 00:42:43,568] Trial 350 finished with values: [-1000000000.0, 1000000000.0] and parameters: {'p_sma': 38, 'p_std': 36, 'p_atr': 7, 'p_adx': 21, 'rsi_period': 60, 'ema1': 6, 'ema2': 17, 'slip_atr_k': 0.06493126811219127, 'slip_spread_k': 0.2671381527258303, 'spread_hl_frac': 0.045851157514406486, 'bb_std_mult': 2.4950821414774964, 'rsi_os': 8, 'rsi_ob': 65, 'vol_spike': 0.1773418717689798, 'adx_thresh': 5.3140076277552915, 'atr_min_pct': 0.018998185294393025, 'atr_max_pct': 0.0622432906172413, 'tp_mult': 2.6677761181486237, 'tsl_mult': 0.15741288425544653, 'strategy': 'breakout', 'time_stop': 100, 'use_sma': True, 'use_atr': False, 'use_adx': True, 'use_ema': True, 'use_spike': False, 'rsi_required': False, 'edge_k': 1.9407160601893347, 'edge_cap': 0.8061468590158232, 'bull_strategy': 'mean_reversion', 'bull_bb_std_mult': 2.6558582509416486, 'bull_rsi_os': 30, 'bull_rsi_ob': 72, 'bull_adx_thresh': 13.185338162648566, 'bull_atr_min_pct': 0.02092169528986163, 'bull_atr_max_pct': 0.05094261208010055, 'bull_tp_mult': 2.380676603546976, 'bull_tsl_mult': 0.3058940267421889, 'bull_time_stop': 279, 'bull_use_sma': False, 'bull_use_ema': False, 'bull_use_atr': True, 'bull_use_adx': True, 'bull_use_spike': False, 'bull_rsi_required': False, 'bear_strategy': 'mean_reversion', 'bear_bb_std_mult': 0.8402178166923323, 'bear_rsi_os': 24, 'bear_rsi_ob': 89, 'bear_adx_thresh': 7.308707242653473, 'bear_atr_min_pct': 0.01299024975430961, 'bear_atr_max_pct': 0.03625255388632696, 'bear_tp_mult': 2.922581023834448, 'bear_tsl_mult': 0.6513483684744408, 'bear_time_stop': 14, 'bear_use_sma': True, 'bear_use_ema': False, 'bear_use_atr': False, 'bear_use_adx': False, 'bear_use_spike': False, 'bear_rsi_required': False, 'sideways_strategy': 'mean_reversion', 'sideways_bb_std_mult': 3.4444954270008554, 'sideways_rsi_os': 24, 'sideways_rsi_ob': 89, 'sideways_adx_thresh': 30.998568780765446, 'sideways_atr_min_pct': 0.022649794241247655, 'sideways_atr_max_pct': 0.13505880690769845, 'sideways_tp_mult': 1.2038621354963144, 'sideways_tsl_mult': 0.8397998913463725, 'sideways_time_stop': 5, 'sideways_use_sma': True, 'sideways_use_ema': False, 'sideways_use_atr': False, 'sideways_use_adx': False, 'sideways_use_spike': True, 'sideways_rsi_required': False}.
[I 2025-08-31 00:42:44,211] Trial 348 finished with values: [-0.019957010543303455, 0.019860971024152022] and parameters: {'p_sma': 45, 'p_std': 39, 'p_atr': 24, 'p_adx': 8, 'rsi_period': 57, 'ema1': 6, 'ema2': 43, 'slip_atr_k': 0.06716945364075069, 'slip_spread_k': 0.24576491868906597, 'spread_hl_frac': 0.007682700989784398, 'bb_std_mult': 2.458349972512897, 'rsi_os': 27, 'rsi_ob': 85, 'vol_spike': 0.2031241611044034, 'adx_thresh': 11.388350915474184, 'atr_min_pct': 0.012972433574586772, 'atr_max_pct': 0.14980509837454506, 'tp_mult': 2.6686685994992825, 'tsl_mult': 0.7037121346244586, 'strategy': 'mean_reversion', 'time_stop': 99, 'use_sma': True, 'use_atr': False, 'use_adx': False, 'use_ema': True, 'use_spike': False, 'rsi_required': False, 'edge_k': 0.8258561042269776, 'edge_cap': 0.8060666077435608, 'bull_strategy': 'mean_reversion', 'bull_bb_std_mult': 2.657631650209398, 'bull_rsi_os': 5, 'bull_rsi_ob': 81, 'bull_adx_thresh': 13.29822352501995, 'bull_atr_min_pct': 0.0006974834879167911, 'bull_atr_max_pct': 0.07022748555543115, 'bull_tp_mult': 2.5146897162072404, 'bull_tsl_mult': 0.6667715334355268, 'bull_time_stop': 115, 'bull_use_sma': False, 'bull_use_ema': False, 'bull_use_atr': True, 'bull_use_adx': True, 'bull_use_spike': False, 'bull_rsi_required': False, 'bear_strategy': 'mean_reversion', 'bear_bb_std_mult': 1.1191736526670428, 'bear_rsi_os': 37, 'bear_rsi_ob': 69, 'bear_adx_thresh': 7.255395345297994, 'bear_atr_min_pct': 0.009797719368118333, 'bear_atr_max_pct': 0.010614353527248174, 'bear_tp_mult': 1.9896094024221882, 'bear_tsl_mult': 0.6512472821545818, 'bear_time_stop': 16, 'bear_use_sma': True, 'bear_use_ema': False, 'bear_use_atr': False, 'bear_use_adx': True, 'bear_use_spike': False, 'bear_rsi_required': True, 'sideways_strategy': 'breakout', 'sideways_bb_std_mult': 3.443336793025302, 'sideways_rsi_os': 46, 'sideways_rsi_ob': 89, 'sideways_adx_thresh': 25.51643008083709, 'sideways_atr_min_pct': 0.02850328052633818, 'sideways_atr_max_pct': 0.08718352047329507, 'sideways_tp_mult': 2.543619119239181, 'sideways_tsl_mult': 0.8825943857438288, 'sideways_time_stop': 191, 'sideways_use_sma': True, 'sideways_use_ema': False, 'sideways_use_atr': False, 'sideways_use_adx': False, 'sideways_use_spike': True, 'sideways_rsi_required': True}.
