[I 2025-08-31 02:52:42,354] Trial 692 finished with values: [-1000000000.0, 1000000000.0] and parameters: {'p_sma': 24, 'p_std': 50, 'p_atr': 17, 'p_adx': 26, 'rsi_period': 69, 'ema1': 22, 'ema2': 30, 'slip_atr_k': 0.09795578665456332, 'slip_spread_k': 0.9177666081737195, 'spread_hl_frac': 0.003464380148494781, 'bb_std_mult': 1.7142635292623154, 'rsi_os': 36, 'rsi_ob': 68, 'vol_spike': 0.18867463477645835, 'adx_thresh': 20.453209041588547, 'atr_min_pct': 0.003420811180090761, 'atr_max_pct': 0.0539725656595143, 'tp_mult': 1.9832243050300158, 'tsl_mult': 0.6078149259040826, 'strategy': 'mean_reversion', 'time_stop': 96, 'use_sma': True, 'use_atr': True, 'use_adx': False, 'use_ema': False, 'use_spike': False, 'rsi_required': True, 'edge_k': 0.4234174052708848, 'edge_cap': 0.5731740202302875, 'bull_strategy': 'breakout', 'bull_bb_std_mult': 3.5773050864803033, 'bull_rsi_os': 32, 'bull_rsi_ob': 64, 'bull_adx_thresh': 6.540575068807096, 'bull_atr_min_pct': 0.014563626622541626, 'bull_atr_max_pct': 0.1344443348971377, 'bull_tp_mult': 1.3125513961008204, 'bull_tsl_mult': 0.3224045666497695, 'bull_time_stop': 106, 'bull_use_sma': True, 'bull_use_ema': False, 'bull_use_atr': False, 'bull_use_adx': True, 'bull_use_spike': True, 'bull_rsi_required': True, 'bear_strategy': 'mean_reversion', 'bear_bb_std_mult': 1.3646114255622017, 'bear_rsi_os': 50, 'bear_rsi_ob': 45, 'bear_adx_thresh': 5.61781684415957, 'bear_atr_min_pct': 0.018232544663234193, 'bear_atr_max_pct': 0.06536518687457307, 'bear_tp_mult': 2.000370711268433, 'bear_tsl_mult': 0.5483319943719175, 'bear_time_stop': 5, 'bear_use_sma': False, 'bear_use_ema': False, 'bear_use_atr': False, 'bear_use_adx': True, 'bear_use_spike': False, 'bear_rsi_required': True, 'sideways_strategy': 'breakout', 'sideways_bb_std_mult': 0.6024551893953589, 'sideways_rsi_os': 51, 'sideways_rsi_ob': 74, 'sideways_adx_thresh': 18.335862810388598, 'sideways_atr_min_pct': 0.027576021648885788, 'sideways_atr_max_pct': 0.11599068550950936, 'sideways_tp_mult': 2.242518962416144, 'sideways_tsl_mult': 0.6659299582785687, 'sideways_time_stop': 205, 'sideways_use_sma': True, 'sideways_use_ema': False, 'sideways_use_atr': False, 'sideways_use_adx': False, 'sideways_use_spike': True, 'sideways_rsi_required': False}.
[I 2025-08-31 02:52:43,009] Trial 694 finished with values: [-1000000000.0, 1000000000.0] and parameters: {'p_sma': 13, 'p_std': 33, 'p_atr': 27, 'p_adx': 26, 'rsi_period': 67, 'ema1': 5, 'ema2': 12, 'slip_atr_k': 0.006829736235539952, 'slip_spread_k': 0.20443531835469927, 'spread_hl_frac': 0.0009903799930647695, 'bb_std_mult': 1.6971447564379645, 'rsi_os': 38, 'rsi_ob': 68, 'vol_spike': 0.08614687636923773, 'adx_thresh': 8.073029887744857, 'atr_min_pct': 0.010798763176498034, 'atr_max_pct': 0.1324408511133332, 'tp_mult': 2.881420873504415, 'tsl_mult': 0.3396315518769541, 'strategy': 'mean_reversion', 'time_stop': 292, 'use_sma': False, 'use_atr': False, 'use_adx': False, 'use_ema': False, 'use_spike': False, 'rsi_required': True, 'edge_k': 1.9638121004234073, 'edge_cap': 0.0800367396792493, 'bull_strategy': 'mean_reversion', 'bull_bb_std_mult': 3.557690376858617, 'bull_rsi_os': 46, 'bull_rsi_ob': 58, 'bull_adx_thresh': 5.013653486958625, 'bull_atr_min_pct': 0.003934671585644827, 'bull_atr_max_pct': 0.14178299810660314, 'bull_tp_mult': 2.837953340749593, 'bull_tsl_mult': 0.7399234545319334, 'bull_time_stop': 136, 'bull_use_sma': True, 'bull_use_ema': False, 'bull_use_atr': False, 'bull_use_adx': True, 'bull_use_spike': True, 'bull_rsi_required': True, 'bear_strategy': 'breakout', 'bear_bb_std_mult': 3.1240391036860036, 'bear_rsi_os': 50, 'bear_rsi_ob': 45, 'bear_adx_thresh': 5.94436897044687, 'bear_atr_min_pct': 0.005726646924421903, 'bear_atr_max_pct': 0.040882582902911684, 'bear_tp_mult': 2.102181914445887, 'bear_tsl_mult': 0.5411332454947364, 'bear_time_stop': 14, 'bear_use_sma': False, 'bear_use_ema': False, 'bear_use_atr': False, 'bear_use_adx': True, 'bear_use_spike': True, 'bear_rsi_required': True, 'sideways_strategy': 'breakout', 'sideways_bb_std_mult': 0.6172488997283349, 'sideways_rsi_os': 51, 'sideways_rsi_ob': 85, 'sideways_adx_thresh': 9.092720588286126, 'sideways_atr_min_pct': 0.025860721850648603, 'sideways_atr_max_pct': 0.11469832498482971, 'sideways_tp_mult': 2.573233062429627, 'sideways_tsl_mult': 0.541361837900406, 'sideways_time_stop': 196, 'sideways_use_sma': True, 'sideways_use_ema': False, 'sideways_use_atr': False, 'sideways_use_adx': False, 'sideways_use_spike': True, 'sideways_rsi_required': False}.
[I 2025-08-31 02:52:43,219] Trial 693 finished with values: [-1000000000.0, 1000000000.0] and parameters: {'p_sma': 24, 'p_std': 55, 'p_atr': 29, 'p_adx': 28, 'rsi_period': 22, 'ema1': 22, 'ema2': 30, 'slip_atr_k': 0.12629408921214022, 'slip_spread_k': 0.20239515771294686, 'spread_hl_frac': 0.00562122970049637, 'bb_std_mult': 1.7128902419843726, 'rsi_os': 10, 'rsi_ob': 68, 'vol_spike': 0.030483072887104223, 'adx_thresh': 20.35997687831984, 'atr_min_pct': 0.007578265871469929, 'atr_max_pct': 0.12513575375872826, 'tp_mult': 1.6186397427589425, 'tsl_mult': 0.4530692731889515, 'strategy': 'mean_reversion', 'time_stop': 98, 'use_sma': True, 'use_atr': False, 'use_adx': False, 'use_ema': False, 'use_spike': False, 'rsi_required': True, 'edge_k': 0.04386273405686891, 'edge_cap': 0.07641340626867715, 'bull_strategy': 'breakout', 'bull_bb_std_mult': 2.185126911733636, 'bull_rsi_os': 32, 'bull_rsi_ob': 83, 'bull_adx_thresh': 6.498706378635056, 'bull_atr_min_pct': 0.014895469611211172, 'bull_atr_max_pct': 0.14287398967157025, 'bull_tp_mult': 2.847025029690666, 'bull_tsl_mult': 0.14663588967764846, 'bull_time_stop': 105, 'bull_use_sma': True, 'bull_use_ema': False, 'bull_use_atr': False, 'bull_use_adx': True, 'bull_use_spike': True, 'bull_rsi_required': True, 'bear_strategy': 'breakout', 'bear_bb_std_mult': 1.3668534151508007, 'bear_rsi_os': 9, 'bear_rsi_ob': 45, 'bear_adx_thresh': 5.938434121611344, 'bear_atr_min_pct': 0.00463039054862808, 'bear_atr_max_pct': 0.01023940240031001, 'bear_tp_mult': 2.5599741919509347, 'bear_tsl_mult': 0.5449490517504966, 'bear_time_stop': 15, 'bear_use_sma': False, 'bear_use_ema': False, 'bear_use_atr': False, 'bear_use_adx': True, 'bear_use_spike': True, 'bear_rsi_required': True, 'sideways_strategy': 'breakout', 'sideways_bb_std_mult': 0.604648707236401, 'sideways_rsi_os': 40, 'sideways_rsi_ob': 74, 'sideways_adx_thresh': 9.115250358138294, 'sideways_atr_min_pct': 0.0273308126359743, 'sideways_atr_max_pct': 0.044769599034995826, 'sideways_tp_mult': 2.126329943759402, 'sideways_tsl_mult': 0.4173434005210177, 'sideways_time_stop': 241, 'sideways_use_sma': True, 'sideways_use_ema': False, 'sideways_use_atr': False, 'sideways_use_adx': False, 'sideways_use_spike': True, 'sideways_rsi_required': False}.
[I 2025-08-31 02:53:23,384] Trial 697 finished with values: [-1000000000.0, 1000000000.0] and parameters: {'p_sma': 31, 'p_std': 15, 'p_atr': 29, 'p_adx': 28, 'rsi_period': 67, 'ema1': 16, 'ema2': 48, 'slip_atr_k': 0.16941368640291532, 'slip_spread_k': 0.1949667426256163, 'spread_hl_frac': 0.0014020598522646336, 'bb_std_mult': 1.691221645497936, 'rsi_os': 38, 'rsi_ob': 68, 'vol_spike': 0.27107303829576956, 'adx_thresh': 31.468166004976055, 'atr_min_pct': 0.010755985946389313, 'atr_max_pct': 0.1264468332067578, 'tp_mult': 2.894994472605278, 'tsl_mult': 0.19775874608530397, 'strategy': 'mean_reversion', 'time_stop': 116, 'use_sma': False, 'use_atr': False, 'use_adx': False, 'use_ema': False, 'use_spike': True, 'rsi_required': True, 'edge_k': 0.6107033660242452, 'edge_cap': 0.7102601556604219, 'bull_strategy': 'breakout', 'bull_bb_std_mult': 2.309159790790979, 'bull_rsi_os': 8, 'bull_rsi_ob': 58, 'bull_adx_thresh': 25.825183306566988, 'bull_atr_min_pct': 0.008957312611644643, 'bull_atr_max_pct': 0.010503226898744264, 'bull_tp_mult': 2.315419646361603, 'bull_tsl_mult': 0.27404788308717515, 'bull_time_stop': 135, 'bull_use_sma': True, 'bull_use_ema': False, 'bull_use_atr': False, 'bull_use_adx': False, 'bull_use_spike': True, 'bull_rsi_required': True, 'bear_strategy': 'breakout', 'bear_bb_std_mult': 2.5772435528466966, 'bear_rsi_os': 32, 'bear_rsi_ob': 66, 'bear_adx_thresh': 11.505721196451162, 'bear_atr_min_pct': 0.005859697816933097, 'bear_atr_max_pct': 0.11901025486526362, 'bear_tp_mult': 1.366750513591108, 'bear_tsl_mult': 0.9055298453878298, 'bear_time_stop': 10, 'bear_use_sma': False, 'bear_use_ema': True, 'bear_use_atr': True, 'bear_use_adx': True, 'bear_use_spike': True, 'bear_rsi_required': True, 'sideways_strategy': 'breakout', 'sideways_bb_std_mult': 0.7140586868277713, 'sideways_rsi_os': 36, 'sideways_rsi_ob': 94, 'sideways_adx_thresh': 8.731087742955765, 'sideways_atr_min_pct': 0.002786217141160969, 'sideways_atr_max_pct': 0.04395861678879556, 'sideways_tp_mult': 2.4721566238315185, 'sideways_tsl_mult': 0.6693216371493521, 'sideways_time_stop': 196, 'sideways_use_sma': True, 'sideways_use_ema': False, 'sideways_use_atr': False, 'sideways_use_adx': False, 'sideways_use_spike': False, 'sideways_rsi_required': False}.
[I 2025-08-31 02:53:23,719] Trial 698 finished with values: [-1000000000.0, 1000000000.0] and parameters: {'p_sma': 37, 'p_std': 51, 'p_atr': 29, 'p_adx': 28, 'rsi_period': 72, 'ema1': 25, 'ema2': 26, 'slip_atr_k': 0.16961892185205363, 'slip_spread_k': 0.5001224970065488, 'spread_hl_frac': 0.002042926113168452, 'bb_std_mult': 3.5933404438591605, 'rsi_os': 40, 'rsi_ob': 88, 'vol_spike': 0.1821430480681978, 'adx_thresh': 21.294290921045, 'atr_min_pct': 0.007909796882478247, 'atr_max_pct': 0.125272155515471, 'tp_mult': 1.0881175257639584, 'tsl_mult': 0.2879955612691266, 'strategy': 'mean_reversion', 'time_stop': 118, 'use_sma': True, 'use_atr': False, 'use_adx': False, 'use_ema': False, 'use_spike': True, 'rsi_required': True, 'edge_k': 0.5858688727593913, 'edge_cap': 0.11613381218784266, 'bull_strategy': 'breakout', 'bull_bb_std_mult': 2.155955174987639, 'bull_rsi_os': 21, 'bull_rsi_ob': 83, 'bull_adx_thresh': 5.773852767128869, 'bull_atr_min_pct': 0.002967821978151721, 'bull_atr_max_pct': 0.061990445775084405, 'bull_tp_mult': 1.8640807563530304, 'bull_tsl_mult': 0.9617180745408178, 'bull_time_stop': 124, 'bull_use_sma': True, 'bull_use_ema': False, 'bull_use_atr': False, 'bull_use_adx': False, 'bull_use_spike': True, 'bull_rsi_required': True, 'bear_strategy': 'mean_reversion', 'bear_bb_std_mult': 2.3205209390080266, 'bear_rsi_os': 39, 'bear_rsi_ob': 47, 'bear_adx_thresh': 31.408280512197386, 'bear_atr_min_pct': 0.005358328476757689, 'bear_atr_max_pct': 0.01203130941916282, 'bear_tp_mult': 2.185184020986909, 'bear_tsl_mult': 0.5092763887655174, 'bear_time_stop': 10, 'bear_use_sma': False, 'bear_use_ema': True, 'bear_use_atr': True, 'bear_use_adx': False, 'bear_use_spike': False, 'bear_rsi_required': True, 'sideways_strategy': 'breakout', 'sideways_bb_std_mult': 0.5638146821353655, 'sideways_rsi_os': 41, 'sideways_rsi_ob': 94, 'sideways_adx_thresh': 21.217201376190076, 'sideways_atr_min_pct': 0.026414982412934322, 'sideways_atr_max_pct': 0.05370829785259884, 'sideways_tp_mult': 1.9230745727654457, 'sideways_tsl_mult': 0.24800324360011283, 'sideways_time_stop': 239, 'sideways_use_sma': True, 'sideways_use_ema': True, 'sideways_use_atr': False, 'sideways_use_adx': True, 'sideways_use_spike': False, 'sideways_rsi_required': False}.
[I 2025-08-31 02:53:24,180] Trial 696 finished with values: [-1000000000.0, 1000000000.0] and parameters: {'p_sma': 11, 'p_std': 15, 'p_atr': 29, 'p_adx': 28, 'rsi_period': 82, 'ema1': 5, 'ema2': 59, 'slip_atr_k': 0.12763207671110324, 'slip_spread_k': 0.20500989481665954, 'spread_hl_frac': 0.0011066205701318517, 'bb_std_mult': 2.9877426726720806, 'rsi_os': 38, 'rsi_ob': 68, 'vol_spike': 0.2802177153633924, 'adx_thresh': 8.128271404216445, 'atr_min_pct': 0.010799374125053458, 'atr_max_pct': 0.12588506415393164, 'tp_mult': 1.0782830167664705, 'tsl_mult': 0.28647145427237664, 'strategy': 'mean_reversion', 'time_stop': 295, 'use_sma': False, 'use_atr': False, 'use_adx': False, 'use_ema': False, 'use_spike': True, 'rsi_required': True, 'edge_k': 0.040179579273877164, 'edge_cap': 0.3227567625588722, 'bull_strategy': 'breakout', 'bull_bb_std_mult': 2.145369396696059, 'bull_rsi_os': 21, 'bull_rsi_ob': 92, 'bull_adx_thresh': 34.25292024080113, 'bull_atr_min_pct': 0.025999582140784586, 'bull_atr_max_pct': 0.14134824556633052, 'bull_tp_mult': 2.3233037661706626, 'bull_tsl_mult': 0.13766811558937406, 'bull_time_stop': 135, 'bull_use_sma': True, 'bull_use_ema': False, 'bull_use_atr': False, 'bull_use_adx': False, 'bull_use_spike': True, 'bull_rsi_required': True, 'bear_strategy': 'breakout', 'bear_bb_std_mult': 3.1569829630482973, 'bear_rsi_os': 32, 'bear_rsi_ob': 46, 'bear_adx_thresh': 6.498461524372635, 'bear_atr_min_pct': 0.029330678023424796, 'bear_atr_max_pct': 0.11853853187255403, 'bear_tp_mult': 2.0928280325814153, 'bear_tsl_mult': 0.9130173470629321, 'bear_time_stop': 10, 'bear_use_sma': False, 'bear_use_ema': True, 'bear_use_atr': True, 'bear_use_adx': True, 'bear_use_spike': True, 'bear_rsi_required': True, 'sideways_strategy': 'breakout', 'sideways_bb_std_mult': 0.6105120358354486, 'sideways_rsi_os': 42, 'sideways_rsi_ob': 94, 'sideways_adx_thresh': 8.983148514135317, 'sideways_atr_min_pct': 0.02566698751683904, 'sideways_atr_max_pct': 0.09993451277939153, 'sideways_tp_mult': 1.568445233628258, 'sideways_tsl_mult': 0.9594278272723035, 'sideways_time_stop': 196, 'sideways_use_sma': True, 'sideways_use_ema': False, 'sideways_use_atr': False, 'sideways_use_adx': False, 'sideways_use_spike': False, 'sideways_rsi_required': False}.
[I 2025-08-31 02:53:24,844] Trial 699 finished with values: [-1000000000.0, 1000000000.0] and parameters: {'p_sma': 54, 'p_std': 52, 'p_atr': 8, 'p_adx': 14, 'rsi_period': 37, 'ema1': 5, 'ema2': 26, 'slip_atr_k': 0.1675271481545618, 'slip_spread_k': 0.17827877305496714, 'spread_hl_frac': 3.470645018909934e-05, 'bb_std_mult': 1.6115957838781985, 'rsi_os': 18, 'rsi_ob': 66, 'vol_spike': 0.039998625837864676, 'adx_thresh': 34.37198454647129, 'atr_min_pct': 0.009443164026617781, 'atr_max_pct': 0.12276496154906089, 'tp_mult': 1.4173210038037856, 'tsl_mult': 0.278045598182278, 'strategy': 'mean_reversion', 'time_stop': 116, 'use_sma': True, 'use_atr': False, 'use_adx': True, 'use_ema': False, 'use_spike': True, 'rsi_required': True, 'edge_k': 0.3543056205206493, 'edge_cap': 0.11770515850151342, 'bull_strategy': 'breakout', 'bull_bb_std_mult': 2.578432224750706, 'bull_rsi_os': 44, 'bull_rsi_ob': 60, 'bull_adx_thresh': 16.94991645396721, 'bull_atr_min_pct': 0.01874368651894595, 'bull_atr_max_pct': 0.13903374331379478, 'bull_tp_mult': 2.314513360230356, 'bull_tsl_mult': 0.2763788295844322, 'bull_time_stop': 66, 'bull_use_sma': True, 'bull_use_ema': False, 'bull_use_atr': False, 'bull_use_adx': False, 'bull_use_spike': True, 'bull_rsi_required': True, 'bear_strategy': 'mean_reversion', 'bear_bb_std_mult': 2.323626584080157, 'bear_rsi_os': 32, 'bear_rsi_ob': 66, 'bear_adx_thresh': 11.37935878570886, 'bear_atr_min_pct': 0.005484616184635479, 'bear_atr_max_pct': 0.012501019267063623, 'bear_tp_mult': 1.4206448719663731, 'bear_tsl_mult': 0.5080189582091303, 'bear_time_stop': 10, 'bear_use_sma': False, 'bear_use_ema': True, 'bear_use_atr': True, 'bear_use_adx': False, 'bear_use_spike': False, 'bear_rsi_required': True, 'sideways_strategy': 'breakout', 'sideways_bb_std_mult': 0.7058554595654971, 'sideways_rsi_os': 34, 'sideways_rsi_ob': 94, 'sideways_adx_thresh': 18.794980810728436, 'sideways_atr_min_pct': 0.026403881549547415, 'sideways_atr_max_pct': 0.05230662525018415, 'sideways_tp_mult': 1.7488561279786734, 'sideways_tsl_mult': 0.670014993689549, 'sideways_time_stop': 228, 'sideways_use_sma': True, 'sideways_use_ema': True, 'sideways_use_atr': False, 'sideways_use_adx': True, 'sideways_use_spike': False, 'sideways_rsi_required': False}.
[I 2025-08-31 02:54:02,251] Trial 701 finished with values: [-1000000000.0, 1000000000.0] and parameters: {'p_sma': 54, 'p_std': 52, 'p_atr': 27, 'p_adx': 23, 'rsi_period': 70, 'ema1': 5, 'ema2': 59, 'slip_atr_k': 0.13644205649660143, 'slip_spread_k': 0.14112856436751073, 'spread_hl_frac': 2.5660268736541533e-05, 'bb_std_mult': 1.2130087056796932, 'rsi_os': 37, 'rsi_ob': 55, 'vol_spike': 0.19357655322041828, 'adx_thresh': 21.784209577376906, 'atr_min_pct': 0.00969293075774722, 'atr_max_pct': 0.11895921489785308, 'tp_mult': 1.2603934430280859, 'tsl_mult': 0.4857121262205753, 'strategy': 'mean_reversion', 'time_stop': 108, 'use_sma': True, 'use_atr': False, 'use_adx': True, 'use_ema': False, 'use_spike': False, 'rsi_required': True, 'edge_k': 0.6365226547531154, 'edge_cap': 0.11918281260548193, 'bull_strategy': 'mean_reversion', 'bull_bb_std_mult': 2.5518843250554912, 'bull_rsi_os': 44, 'bull_rsi_ob': 59, 'bull_adx_thresh': 34.21093714774969, 'bull_atr_min_pct': 0.018210307355376706, 'bull_atr_max_pct': 0.13914847306614844, 'bull_tp_mult': 2.309622481423774, 'bull_tsl_mult': 0.22761744473067116, 'bull_time_stop': 238, 'bull_use_sma': True, 'bull_use_ema': False, 'bull_use_atr': False, 'bull_use_adx': True, 'bull_use_spike': True, 'bull_rsi_required': True, 'bear_strategy': 'mean_reversion', 'bear_bb_std_mult': 2.9533837213199368, 'bear_rsi_os': 36, 'bear_rsi_ob': 48, 'bear_adx_thresh': 24.140935766272356, 'bear_atr_min_pct': 0.02911433231139713, 'bear_atr_max_pct': 0.010114848025055379, 'bear_tp_mult': 2.0851277465219042, 'bear_tsl_mult': 0.5181544087542638, 'bear_time_stop': 186, 'bear_use_sma': False, 'bear_use_ema': False, 'bear_use_atr': False, 'bear_use_adx': True, 'bear_use_spike': False, 'bear_rsi_required': True, 'sideways_strategy': 'breakout', 'sideways_bb_std_mult': 3.390172291836768, 'sideways_rsi_os': 42, 'sideways_rsi_ob': 53, 'sideways_adx_thresh': 5.033642240576459, 'sideways_atr_min_pct': 0.01641514414544321, 'sideways_atr_max_pct': 0.10106665374388689, 'sideways_tp_mult': 1.7488620800127201, 'sideways_tsl_mult': 0.3793387143082284, 'sideways_time_stop': 125, 'sideways_use_sma': True, 'sideways_use_ema': False, 'sideways_use_atr': False, 'sideways_use_adx': False, 'sideways_use_spike': True, 'sideways_rsi_required': True}.
[I 2025-08-31 02:54:02,514] Trial 703 finished with values: [-1000000000.0, 1000000000.0] and parameters: {'p_sma': 53, 'p_std': 24, 'p_atr': 26, 'p_adx': 22, 'rsi_period': 70, 'ema1': 5, 'ema2': 43, 'slip_atr_k': 0.07548071379508126, 'slip_spread_k': 0.13716116492373756, 'spread_hl_frac': 0.014845551649205382, 'bb_std_mult': 1.2289590945433768, 'rsi_os': 40, 'rsi_ob': 55, 'vol_spike': 0.2386464559816988, 'adx_thresh': 21.901171000823343, 'atr_min_pct': 0.008732017223678562, 'atr_max_pct': 0.1185690745782826, 'tp_mult': 1.6634048303610967, 'tsl_mult': 0.5846870944567363, 'strategy': 'mean_reversion', 'time_stop': 268, 'use_sma': True, 'use_atr': False, 'use_adx': True, 'use_ema': False, 'use_spike': False, 'rsi_required': True, 'edge_k': 1.3185818342541156, 'edge_cap': 0.13026109829303328, 'bull_strategy': 'mean_reversion', 'bull_bb_std_mult': 2.51139311310362, 'bull_rsi_os': 47, 'bull_rsi_ob': 85, 'bull_adx_thresh': 7.194700277019223, 'bull_atr_min_pct': 0.02325072889262383, 'bull_atr_max_pct': 0.10947379863158826, 'bull_tp_mult': 2.6423901923243456, 'bull_tsl_mult': 0.2261054886578906, 'bull_time_stop': 141, 'bull_use_sma': True, 'bull_use_ema': False, 'bull_use_atr': False, 'bull_use_adx': True, 'bull_use_spike': True, 'bull_rsi_required': True, 'bear_strategy': 'mean_reversion', 'bear_bb_std_mult': 1.2603245801199032, 'bear_rsi_os': 17, 'bear_rsi_ob': 48, 'bear_adx_thresh': 5.006986632162923, 'bear_atr_min_pct': 0.006760942941808838, 'bear_atr_max_pct': 0.017620611363185382, 'bear_tp_mult': 2.753573790653146, 'bear_tsl_mult': 0.935119080115725, 'bear_time_stop': 188, 'bear_use_sma': False, 'bear_use_ema': False, 'bear_use_atr': False, 'bear_use_adx': True, 'bear_use_spike': False, 'bear_rsi_required': True, 'sideways_strategy': 'breakout', 'sideways_bb_std_mult': 3.3931342415628363, 'sideways_rsi_os': 41, 'sideways_rsi_ob': 92, 'sideways_adx_thresh': 5.353663453633173, 'sideways_atr_min_pct': 0.02851436444428226, 'sideways_atr_max_pct': 0.1204050173812641, 'sideways_tp_mult': 1.6380482178531233, 'sideways_tsl_mult': 0.6753271158461258, 'sideways_time_stop': 125, 'sideways_use_sma': False, 'sideways_use_ema': False, 'sideways_use_atr': True, 'sideways_use_adx': False, 'sideways_use_spike': True, 'sideways_rsi_required': True}.
