[I 2025-08-31 03:15:37,779] Trial 854 finished with values: [-1000000000.0, 1000000000.0] and parameters: {'p_sma': 53, 'p_std': 48, 'p_atr': 19, 'p_adx': 24, 'rsi_period': 70, 'ema1': 16, 'ema2': 33, 'slip_atr_k': 0.18104078452764796, 'slip_spread_k': 0.8522328661048453, 'spread_hl_frac': 0.0017270032090254944, 'bb_std_mult': 2.7694018874177893, 'rsi_os': 46, 'rsi_ob': 68, 'vol_spike': 0.18935191979299507, 'adx_thresh': 20.900288958006662, 'atr_min_pct': 0.02997770355998628, 'atr_max_pct': 0.11992096186455835, 'tp_mult': 1.5115856437487232, 'tsl_mult': 0.8275742483259743, 'strategy': 'mean_reversion', 'time_stop': 107, 'use_sma': True, 'use_atr': False, 'use_adx': False, 'use_ema': False, 'use_spike': False, 'rsi_required': True, 'edge_k': 0.5567726125643696, 'edge_cap': 0.15488309556892696, 'bull_strategy': 'breakout', 'bull_bb_std_mult': 3.2924368165526587, 'bull_rsi_os': 10, 'bull_rsi_ob': 93, 'bull_adx_thresh': 24.566758932917534, 'bull_atr_min_pct': 0.02802851988310076, 'bull_atr_max_pct': 0.14107700256344757, 'bull_tp_mult': 2.3192096514650293, 'bull_tsl_mult': 0.893729531346505, 'bull_time_stop': 143, 'bull_use_sma': True, 'bull_use_ema': False, 'bull_use_atr': True, 'bull_use_adx': True, 'bull_use_spike': True, 'bull_rsi_required': True, 'bear_strategy': 'mean_reversion', 'bear_bb_std_mult': 1.3346104055373182, 'bear_rsi_os': 17, 'bear_rsi_ob': 46, 'bear_adx_thresh': 34.337534031310554, 'bear_atr_min_pct': 0.000616213560340903, 'bear_atr_max_pct': 0.0663325103777945, 'bear_tp_mult': 1.7760038082395708, 'bear_tsl_mult': 0.12906971619570518, 'bear_time_stop': 10, 'bear_use_sma': False, 'bear_use_ema': False, 'bear_use_atr': False, 'bear_use_adx': True, 'bear_use_spike': False, 'bear_rsi_required': True, 'sideways_strategy': 'breakout', 'sideways_bb_std_mult': 0.5020327024389286, 'sideways_rsi_os': 51, 'sideways_rsi_ob': 94, 'sideways_adx_thresh': 8.833053236174647, 'sideways_atr_min_pct': 0.02604140283411596, 'sideways_atr_max_pct': 0.05282566164811028, 'sideways_tp_mult': 1.8283482456626474, 'sideways_tsl_mult': 0.19517908545691276, 'sideways_time_stop': 236, 'sideways_use_sma': True, 'sideways_use_ema': False, 'sideways_use_atr': False, 'sideways_use_adx': False, 'sideways_use_spike': True, 'sideways_rsi_required': False}.
[I 2025-08-31 03:15:37,904] Trial 856 finished with values: [-1000000000.0, 1000000000.0] and parameters: {'p_sma': 59, 'p_std': 33, 'p_atr': 27, 'p_adx': 27, 'rsi_period': 52, 'ema1': 16, 'ema2': 32, 'slip_atr_k': 0.1781636853451412, 'slip_spread_k': 0.2140473119743499, 'spread_hl_frac': 0.0016331962788021025, 'bb_std_mult': 3.285946263101521, 'rsi_os': 37, 'rsi_ob': 56, 'vol_spike': 0.1923602554635239, 'adx_thresh': 25.75091741597799, 'atr_min_pct': 0.008140719423961046, 'atr_max_pct': 0.13049029237955162, 'tp_mult': 2.3695340402676557, 'tsl_mult': 0.5156414121941695, 'strategy': 'mean_reversion', 'time_stop': 205, 'use_sma': True, 'use_atr': False, 'use_adx': False, 'use_ema': False, 'use_spike': True, 'rsi_required': True, 'edge_k': 0.5509674426775624, 'edge_cap': 0.650008611607942, 'bull_strategy': 'breakout', 'bull_bb_std_mult': 2.4057864623844663, 'bull_rsi_os': 52, 'bull_rsi_ob': 58, 'bull_adx_thresh': 8.895732656425395, 'bull_atr_min_pct': 0.008215640553117763, 'bull_atr_max_pct': 0.14188960100206968, 'bull_tp_mult': 2.2964855335186, 'bull_tsl_mult': 0.9286375028319453, 'bull_time_stop': 142, 'bull_use_sma': False, 'bull_use_ema': False, 'bull_use_atr': True, 'bull_use_adx': True, 'bull_use_spike': False, 'bull_rsi_required': True, 'bear_strategy': 'mean_reversion', 'bear_bb_std_mult': 1.6738247542931508, 'bear_rsi_os': 18, 'bear_rsi_ob': 84, 'bear_adx_thresh': 5.006179943353203, 'bear_atr_min_pct': 8.124559405708366e-05, 'bear_atr_max_pct': 0.014911388931926195, 'bear_tp_mult': 2.1929626602382806, 'bear_tsl_mult': 0.003157291666204709, 'bear_time_stop': 10, 'bear_use_sma': False, 'bear_use_ema': True, 'bear_use_atr': False, 'bear_use_adx': True, 'bear_use_spike': False, 'bear_rsi_required': True, 'sideways_strategy': 'breakout', 'sideways_bb_std_mult': 0.5015503641512106, 'sideways_rsi_os': 35, 'sideways_rsi_ob': 77, 'sideways_adx_thresh': 7.501129864486847, 'sideways_atr_min_pct': 0.02596356792488138, 'sideways_atr_max_pct': 0.11055395211133572, 'sideways_tp_mult': 1.7468140896599982, 'sideways_tsl_mult': 0.1537323227936388, 'sideways_time_stop': 195, 'sideways_use_sma': True, 'sideways_use_ema': False, 'sideways_use_atr': False, 'sideways_use_adx': False, 'sideways_use_spike': True, 'sideways_rsi_required': False}.
[I 2025-08-31 03:15:38,053] Trial 857 finished with values: [-1000000000.0, 1000000000.0] and parameters: {'p_sma': 54, 'p_std': 16, 'p_atr': 27, 'p_adx': 30, 'rsi_period': 71, 'ema1': 5, 'ema2': 31, 'slip_atr_k': 0.22948700540825911, 'slip_spread_k': 0.20774582709163458, 'spread_hl_frac': 6.644914760557544e-05, 'bb_std_mult': 3.2997473247404097, 'rsi_os': 32, 'rsi_ob': 69, 'vol_spike': 0.19198641956669324, 'adx_thresh': 23.414540208469766, 'atr_min_pct': 0.008113489851562856, 'atr_max_pct': 0.12044105063280616, 'tp_mult': 1.6149030026653182, 'tsl_mult': 0.01446006015529716, 'strategy': 'mean_reversion', 'time_stop': 105, 'use_sma': True, 'use_atr': False, 'use_adx': False, 'use_ema': True, 'use_spike': True, 'rsi_required': True, 'edge_k': 0.5519809835632501, 'edge_cap': 0.15642853124367403, 'bull_strategy': 'breakout', 'bull_bb_std_mult': 2.3969900031479012, 'bull_rsi_os': 52, 'bull_rsi_ob': 81, 'bull_adx_thresh': 29.947630420291787, 'bull_atr_min_pct': 0.027857632183056757, 'bull_atr_max_pct': 0.14107194222813865, 'bull_tp_mult': 2.302515746391546, 'bull_tsl_mult': 0.8011736457095494, 'bull_time_stop': 236, 'bull_use_sma': False, 'bull_use_ema': False, 'bull_use_atr': True, 'bull_use_adx': True, 'bull_use_spike': False, 'bull_rsi_required': True, 'bear_strategy': 'mean_reversion', 'bear_bb_std_mult': 1.3238472703464461, 'bear_rsi_os': 34, 'bear_rsi_ob': 45, 'bear_adx_thresh': 6.3126703555023225, 'bear_atr_min_pct': 0.0002475959260321934, 'bear_atr_max_pct': 0.07053620611226753, 'bear_tp_mult': 1.7732120566240188, 'bear_tsl_mult': 0.5436125797595233, 'bear_time_stop': 254, 'bear_use_sma': False, 'bear_use_ema': True, 'bear_use_atr': False, 'bear_use_adx': True, 'bear_use_spike': True, 'bear_rsi_required': True, 'sideways_strategy': 'breakout', 'sideways_bb_std_mult': 0.6464893110006122, 'sideways_rsi_os': 37, 'sideways_rsi_ob': 79, 'sideways_adx_thresh': 10.045230915482612, 'sideways_atr_min_pct': 0.0037752072373201974, 'sideways_atr_max_pct': 0.1114749678588275, 'sideways_tp_mult': 2.210979504065672, 'sideways_tsl_mult': 0.6120908233475969, 'sideways_time_stop': 196, 'sideways_use_sma': True, 'sideways_use_ema': False, 'sideways_use_atr': False, 'sideways_use_adx': False, 'sideways_use_spike': True, 'sideways_rsi_required': False}.
[I 2025-08-31 03:16:11,373] Trial 861 finished with values: [-1000000000.0, 1000000000.0] and parameters: {'p_sma': 5, 'p_std': 30, 'p_atr': 12, 'p_adx': 12, 'rsi_period': 67, 'ema1': 6, 'ema2': 41, 'slip_atr_k': 0.08022676342298218, 'slip_spread_k': 0.12038477024073999, 'spread_hl_frac': 0.0036347209883963033, 'bb_std_mult': 1.3310383509647123, 'rsi_os': 40, 'rsi_ob': 83, 'vol_spike': 0.1688611273106495, 'adx_thresh': 22.426155944880133, 'atr_min_pct': 0.005908426168199088, 'atr_max_pct': 0.027631919681166017, 'tp_mult': 1.0394220751904246, 'tsl_mult': 0.25506838707740176, 'strategy': 'mean_reversion', 'time_stop': 120, 'use_sma': True, 'use_atr': True, 'use_adx': False, 'use_ema': True, 'use_spike': False, 'rsi_required': True, 'edge_k': 1.18571396893989, 'edge_cap': 0.12929854339481237, 'bull_strategy': 'breakout', 'bull_bb_std_mult': 2.107617401957882, 'bull_rsi_os': 53, 'bull_rsi_ob': 54, 'bull_adx_thresh': 27.21674888977721, 'bull_atr_min_pct': 0.01726726303122059, 'bull_atr_max_pct': 0.013483998459359464, 'bull_tp_mult': 2.2513330616112874, 'bull_tsl_mult': 0.7196264228050068, 'bull_time_stop': 59, 'bull_use_sma': True, 'bull_use_ema': False, 'bull_use_atr': False, 'bull_use_adx': False, 'bull_use_spike': True, 'bull_rsi_required': True, 'bear_strategy': 'breakout', 'bear_bb_std_mult': 2.2794936374861523, 'bear_rsi_os': 53, 'bear_rsi_ob': 48, 'bear_adx_thresh': 31.561709656184114, 'bear_atr_min_pct': 0.017661412763524138, 'bear_atr_max_pct': 0.015682526808701802, 'bear_tp_mult': 2.086961276249276, 'bear_tsl_mult': 0.5176471079611171, 'bear_time_stop': 22, 'bear_use_sma': False, 'bear_use_ema': False, 'bear_use_atr': True, 'bear_use_adx': True, 'bear_use_spike': True, 'bear_rsi_required': True, 'sideways_strategy': 'mean_reversion', 'sideways_bb_std_mult': 0.7033903683087372, 'sideways_rsi_os': 11, 'sideways_rsi_ob': 95, 'sideways_adx_thresh': 9.54209566643371, 'sideways_atr_min_pct': 0.002397124647934578, 'sideways_atr_max_pct': 0.036851806613023945, 'sideways_tp_mult': 1.7097469816088886, 'sideways_tsl_mult': 0.6609835136557164, 'sideways_time_stop': 204, 'sideways_use_sma': False, 'sideways_use_ema': False, 'sideways_use_atr': False, 'sideways_use_adx': False, 'sideways_use_spike': False, 'sideways_rsi_required': False}.
[I 2025-08-31 03:16:12,044] Trial 859 finished with values: [-1000000000.0, 1000000000.0] and parameters: {'p_sma': 5, 'p_std': 33, 'p_atr': 27, 'p_adx': 25, 'rsi_period': 42, 'ema1': 5, 'ema2': 58, 'slip_atr_k': 0.16848131553739001, 'slip_spread_k': 0.5502953484645318, 'spread_hl_frac': 0.023432962063957327, 'bb_std_mult': 1.7752641080548637, 'rsi_os': 35, 'rsi_ob': 69, 'vol_spike': 0.21480336406228367, 'adx_thresh': 23.334834593933813, 'atr_min_pct': 0.006144790019720637, 'atr_max_pct': 0.12946935370100254, 'tp_mult': 2.0699984680741847, 'tsl_mult': 0.966461429967356, 'strategy': 'mean_reversion', 'time_stop': 121, 'use_sma': True, 'use_atr': True, 'use_adx': False, 'use_ema': True, 'use_spike': True, 'rsi_required': True, 'edge_k': 1.184873200390312, 'edge_cap': 0.9075783867951278, 'bull_strategy': 'breakout', 'bull_bb_std_mult': 2.3677364861162054, 'bull_rsi_os': 52, 'bull_rsi_ob': 78, 'bull_adx_thresh': 27.245004250141925, 'bull_atr_min_pct': 0.003067889494199774, 'bull_atr_max_pct': 0.13835047089354022, 'bull_tp_mult': 1.6690523383945852, 'bull_tsl_mult': 0.7382664394227924, 'bull_time_stop': 135, 'bull_use_sma': False, 'bull_use_ema': False, 'bull_use_atr': False, 'bull_use_adx': True, 'bull_use_spike': False, 'bull_rsi_required': True, 'bear_strategy': 'mean_reversion', 'bear_bb_std_mult': 1.4565166953038933, 'bear_rsi_os': 37, 'bear_rsi_ob': 63, 'bear_adx_thresh': 5.02131335947047, 'bear_atr_min_pct': 0.005969437219381271, 'bear_atr_max_pct': 0.014240100784382682, 'bear_tp_mult': 2.202931405822566, 'bear_tsl_mult': 0.5351740308739206, 'bear_time_stop': 23, 'bear_use_sma': False, 'bear_use_ema': True, 'bear_use_atr': False, 'bear_use_adx': True, 'bear_use_spike': True, 'bear_rsi_required': True, 'sideways_strategy': 'mean_reversion', 'sideways_bb_std_mult': 2.212183661463583, 'sideways_rsi_os': 40, 'sideways_rsi_ob': 93, 'sideways_adx_thresh': 9.669255157064924, 'sideways_atr_min_pct': 0.01676872998172905, 'sideways_atr_max_pct': 0.07321891271014959, 'sideways_tp_mult': 1.66526779016786, 'sideways_tsl_mult': 0.9173733440187433, 'sideways_time_stop': 196, 'sideways_use_sma': False, 'sideways_use_ema': False, 'sideways_use_atr': False, 'sideways_use_adx': False, 'sideways_use_spike': True, 'sideways_rsi_required': False}.
[I 2025-08-31 03:16:12,196] Trial 860 finished with values: [-1000000000.0, 1000000000.0] and parameters: {'p_sma': 50, 'p_std': 53, 'p_atr': 20, 'p_adx': 25, 'rsi_period': 16, 'ema1': 5, 'ema2': 58, 'slip_atr_k': 0.0808678847510175, 'slip_spread_k': 0.5588080199730276, 'spread_hl_frac': 0.03305753247437304, 'bb_std_mult': 3.1530087417396007, 'rsi_os': 40, 'rsi_ob': 69, 'vol_spike': 0.21516063357805493, 'adx_thresh': 23.417906299129474, 'atr_min_pct': 0.0075658818625885344, 'atr_max_pct': 0.011938415570329958, 'tp_mult': 1.051444879855221, 'tsl_mult': 0.6841759484019971, 'strategy': 'mean_reversion', 'time_stop': 21, 'use_sma': True, 'use_atr': True, 'use_adx': False, 'use_ema': True, 'use_spike': True, 'rsi_required': True, 'edge_k': 0.4640638018590074, 'edge_cap': 0.13378792543812323, 'bull_strategy': 'breakout', 'bull_bb_std_mult': 2.9352889413581567, 'bull_rsi_os': 53, 'bull_rsi_ob': 81, 'bull_adx_thresh': 6.049607805547112, 'bull_atr_min_pct': 0.0024408876231390873, 'bull_atr_max_pct': 0.1375077627853952, 'bull_tp_mult': 2.243533121122632, 'bull_tsl_mult': 0.7318025383386795, 'bull_time_stop': 134, 'bull_use_sma': True, 'bull_use_ema': False, 'bull_use_atr': False, 'bull_use_adx': False, 'bull_use_spike': False, 'bull_rsi_required': True, 'bear_strategy': 'mean_reversion', 'bear_bb_std_mult': 1.449429112375439, 'bear_rsi_os': 18, 'bear_rsi_ob': 45, 'bear_adx_thresh': 6.147985554483965, 'bear_atr_min_pct': 0.00645987018946727, 'bear_atr_max_pct': 0.09814510226800746, 'bear_tp_mult': 2.089862038159115, 'bear_tsl_mult': 0.5261043119749802, 'bear_time_stop': 21, 'bear_use_sma': False, 'bear_use_ema': True, 'bear_use_atr': False, 'bear_use_adx': True, 'bear_use_spike': True, 'bear_rsi_required': True, 'sideways_strategy': 'mean_reversion', 'sideways_bb_std_mult': 0.651459610377991, 'sideways_rsi_os': 37, 'sideways_rsi_ob': 75, 'sideways_adx_thresh': 9.67000748106969, 'sideways_atr_min_pct': 0.004481433089034436, 'sideways_atr_max_pct': 0.12146889039913178, 'sideways_tp_mult': 1.6765588146216452, 'sideways_tsl_mult': 0.6700182596440757, 'sideways_time_stop': 113, 'sideways_use_sma': False, 'sideways_use_ema': False, 'sideways_use_atr': False, 'sideways_use_adx': False, 'sideways_use_spike': True, 'sideways_rsi_required': False}.
[I 2025-08-31 03:16:12,610] Trial 858 finished with values: [-1000000000.0, 1000000000.0] and parameters: {'p_sma': 53, 'p_std': 51, 'p_atr': 27, 'p_adx': 27, 'rsi_period': 12, 'ema1': 5, 'ema2': 38, 'slip_atr_k': 0.16793263831285485, 'slip_spread_k': 0.979701948713796, 'spread_hl_frac': 0.001485885175081113, 'bb_std_mult': 2.7774738430516446, 'rsi_os': 33, 'rsi_ob': 69, 'vol_spike': 0.1918165890665466, 'adx_thresh': 20.053355798859155, 'atr_min_pct': 0.027157169696409727, 'atr_max_pct': 0.12100543264442007, 'tp_mult': 2.3532246551252034, 'tsl_mult': 0.011394729861550046, 'strategy': 'mean_reversion', 'time_stop': 118, 'use_sma': True, 'use_atr': False, 'use_adx': False, 'use_ema': True, 'use_spike': True, 'rsi_required': True, 'edge_k': 0.5522760506460844, 'edge_cap': 0.13155617389618868, 'bull_strategy': 'breakout', 'bull_bb_std_mult': 2.399422075867659, 'bull_rsi_os': 23, 'bull_rsi_ob': 95, 'bull_adx_thresh': 7.207921400077682, 'bull_atr_min_pct': 0.017021174057864956, 'bull_atr_max_pct': 0.11214882517718627, 'bull_tp_mult': 2.0951691571024162, 'bull_tsl_mult': 0.3091918862254476, 'bull_time_stop': 121, 'bull_use_sma': True, 'bull_use_ema': False, 'bull_use_atr': True, 'bull_use_adx': True, 'bull_use_spike': False, 'bull_rsi_required': True, 'bear_strategy': 'mean_reversion', 'bear_bb_std_mult': 1.3188393695373999, 'bear_rsi_os': 34, 'bear_rsi_ob': 49, 'bear_adx_thresh': 26.287850173752208, 'bear_atr_min_pct': 0.006455427129313846, 'bear_atr_max_pct': 0.015602728147313012, 'bear_tp_mult': 2.2101108584152986, 'bear_tsl_mult': 0.5250898370907506, 'bear_time_stop': 24, 'bear_use_sma': False, 'bear_use_ema': True, 'bear_use_atr': False, 'bear_use_adx': True, 'bear_use_spike': True, 'bear_rsi_required': True, 'sideways_strategy': 'breakout', 'sideways_bb_std_mult': 1.63750225847815, 'sideways_rsi_os': 37, 'sideways_rsi_ob': 76, 'sideways_adx_thresh': 9.374171946498521, 'sideways_atr_min_pct': 0.01662870351411629, 'sideways_atr_max_pct': 0.1206669223336744, 'sideways_tp_mult': 1.662536329191165, 'sideways_tsl_mult': 0.9170874883999378, 'sideways_time_stop': 196, 'sideways_use_sma': True, 'sideways_use_ema': False, 'sideways_use_atr': False, 'sideways_use_adx': False, 'sideways_use_spike': True, 'sideways_rsi_required': False}.
[I 2025-08-31 03:16:45,316] Trial 865 finished with values: [-1000000000.0, 1000000000.0] and parameters: {'p_sma': 51, 'p_std': 51, 'p_atr': 28, 'p_adx': 18, 'rsi_period': 36, 'ema1': 11, 'ema2': 26, 'slip_atr_k': 0.019971948527219126, 'slip_spread_k': 0.14152817173816434, 'spread_hl_frac': 0.04795690485771433, 'bb_std_mult': 3.0331036866553323, 'rsi_os': 39, 'rsi_ob': 54, 'vol_spike': 0.052353288538233025, 'adx_thresh': 16.50856590999306, 'atr_min_pct': 0.010027566009939037, 'atr_max_pct': 0.08123250030808829, 'tp_mult': 2.948304385493019, 'tsl_mult': 0.2252471801843271, 'strategy': 'mean_reversion', 'time_stop': 102, 'use_sma': False, 'use_atr': False, 'use_adx': True, 'use_ema': False, 'use_spike': False, 'rsi_required': False, 'edge_k': 0.6173588710434754, 'edge_cap': 0.11173677497868202, 'bull_strategy': 'mean_reversion', 'bull_bb_std_mult': 3.0764469209848833, 'bull_rsi_os': 29, 'bull_rsi_ob': 56, 'bull_adx_thresh': 25.50094618510164, 'bull_atr_min_pct': 0.019584512200141124, 'bull_atr_max_pct': 0.14744310345720363, 'bull_tp_mult': 1.2174154992595894, 'bull_tsl_mult': 0.24291863901339386, 'bull_time_stop': 123, 'bull_use_sma': True, 'bull_use_ema': False, 'bull_use_atr': False, 'bull_use_adx': True, 'bull_use_spike': True, 'bull_rsi_required': False, 'bear_strategy': 'breakout', 'bear_bb_std_mult': 2.8760928463417708, 'bear_rsi_os': 16, 'bear_rsi_ob': 46, 'bear_adx_thresh': 5.6046594065861255, 'bear_atr_min_pct': 0.007798256518349101, 'bear_atr_max_pct': 0.12380452657708338, 'bear_tp_mult': 1.2303027798408221, 'bear_tsl_mult': 0.5564258927443974, 'bear_time_stop': 15, 'bear_use_sma': False, 'bear_use_ema': False, 'bear_use_atr': True, 'bear_use_adx': False, 'bear_use_spike': False, 'bear_rsi_required': True, 'sideways_strategy': 'breakout', 'sideways_bb_std_mult': 0.5913505903038689, 'sideways_rsi_os': 31, 'sideways_rsi_ob': 46, 'sideways_adx_thresh': 26.645613587568775, 'sideways_atr_min_pct': 0.01893087178495895, 'sideways_atr_max_pct': 0.05809003584087686, 'sideways_tp_mult': 2.847726752462435, 'sideways_tsl_mult': 0.712110900563115, 'sideways_time_stop': 104, 'sideways_use_sma': True, 'sideways_use_ema': False, 'sideways_use_atr': False, 'sideways_use_adx': True, 'sideways_use_spike': False, 'sideways_rsi_required': False}.
[I 2025-08-31 03:16:45,826] Trial 862 finished with values: [-1000000000.0, 1000000000.0] and parameters: {'p_sma': 52, 'p_std': 51, 'p_atr': 20, 'p_adx': 25, 'rsi_period': 42, 'ema1': 5, 'ema2': 16, 'slip_atr_k': 0.01825248958202577, 'slip_spread_k': 0.13639997279713503, 'spread_hl_frac': 0.03308050430895479, 'bb_std_mult': 1.7591318963610625, 'rsi_os': 35, 'rsi_ob': 69, 'vol_spike': 0.042747599514288526, 'adx_thresh': 19.732933559400013, 'atr_min_pct': 0.014309133482346007, 'atr_max_pct': 0.1226627999098088, 'tp_mult': 1.898359406339324, 'tsl_mult': 0.6845330125605942, 'strategy': 'mean_reversion', 'time_stop': 15, 'use_sma': False, 'use_atr': False, 'use_adx': False, 'use_ema': False, 'use_spike': False, 'rsi_required': True, 'edge_k': 1.888541526572221, 'edge_cap': 0.6179066117421931, 'bull_strategy': 'mean_reversion', 'bull_bb_std_mult': 2.9423820027976815, 'bull_rsi_os': 23, 'bull_rsi_ob': 95, 'bull_adx_thresh': 20.87093677244762, 'bull_atr_min_pct': 0.0031369310384305312, 'bull_atr_max_pct': 0.13649193191847114, 'bull_tp_mult': 1.2140267220632803, 'bull_tsl_mult': 0.24644805285779645, 'bull_time_stop': 122, 'bull_use_sma': True, 'bull_use_ema': False, 'bull_use_atr': False, 'bull_use_adx': True, 'bull_use_spike': True, 'bull_rsi_required': False, 'bear_strategy': 'mean_reversion', 'bear_bb_std_mult': 2.8484163653382093, 'bear_rsi_os': 18, 'bear_rsi_ob': 45, 'bear_adx_thresh': 5.997157014895834, 'bear_atr_min_pct': 0.005993286943121754, 'bear_atr_max_pct': 0.012703586740960065, 'bear_tp_mult': 1.050389239306281, 'bear_tsl_mult': 0.4894724146937937, 'bear_time_stop': 21, 'bear_use_sma': False, 'bear_use_ema': False, 'bear_use_atr': False, 'bear_use_adx': False, 'bear_use_spike': False, 'bear_rsi_required': True, 'sideways_strategy': 'breakout', 'sideways_bb_std_mult': 0.6138227493243367, 'sideways_rsi_os': 40, 'sideways_rsi_ob': 93, 'sideways_adx_thresh': 6.752796346283061, 'sideways_atr_min_pct': 0.024830623428109076, 'sideways_atr_max_pct': 0.05751238492595823, 'sideways_tp_mult': 1.6797960428448588, 'sideways_tsl_mult': 0.7145575134446989, 'sideways_time_stop': 109, 'sideways_use_sma': True, 'sideways_use_ema': False, 'sideways_use_atr': False, 'sideways_use_adx': False, 'sideways_use_spike': True, 'sideways_rsi_required': False}.
