[I 2025-08-31 00:03:21,286] Trial 9 finished with values: [-1000000000.0, 1000000000.0] and parameters: {'p_sma': 12, 'p_std': 40, 'p_atr': 21, 'p_adx': 11, 'rsi_period': 21, 'ema1': 10, 'ema2': 40, 'slip_atr_k': 0.0049623705868858115, 'slip_spread_k': 0.6071987627248564, 'spread_hl_frac': 0.00855173051467919, 'bb_std_mult': 3.219437230548497, 'rsi_os': 44, 'rsi_ob': 93, 'vol_spike': 0.22918677328556922, 'adx_thresh': 18.57028112922106, 'atr_min_pct': 0.028613279564432565, 'atr_max_pct': 0.1396196517496018, 'tp_mult': 1.597813870233556, 'tsl_mult': 0.796726946416299, 'strategy': 'mean_reversion', 'time_stop': 189, 'use_sma': True, 'use_atr': True, 'use_adx': True, 'use_ema': False, 'use_spike': True, 'rsi_required': True, 'edge_k': 0.7145039341468082, 'edge_cap': 0.8059435395404184, 'bull_strategy': 'breakout', 'bull_bb_std_mult': 3.3550562759613434, 'bull_rsi_os': 25, 'bull_rsi_ob': 62, 'bull_adx_thresh': 10.170176557197848, 'bull_atr_min_pct': 0.014432601019635415, 'bull_atr_max_pct': 0.017636152303543807, 'bull_tp_mult': 1.4506570526850189, 'bull_tsl_mult': 0.2915493463190718, 'bull_time_stop': 109, 'bull_use_sma': True, 'bull_use_ema': False, 'bull_use_atr': False, 'bull_use_adx': True, 'bull_use_spike': True, 'bull_rsi_required': False, 'bear_strategy': 'breakout', 'bear_bb_std_mult': 3.421528314857225, 'bear_rsi_os': 46, 'bear_rsi_ob': 54, 'bear_adx_thresh': 21.979524292627023, 'bear_atr_min_pct': 0.023782015806374818, 'bear_atr_max_pct': 0.03123192853418533, 'bear_tp_mult': 2.0886014230283747, 'bear_tsl_mult': 0.6222198443185882, 'bear_time_stop': 7, 'bear_use_sma': False, 'bear_use_ema': True, 'bear_use_atr': False, 'bear_use_adx': True, 'bear_use_spike': True, 'bear_rsi_required': True, 'sideways_strategy': 'mean_reversion', 'sideways_bb_std_mult': 0.7130692240593783, 'sideways_rsi_os': 53, 'sideways_rsi_ob': 80, 'sideways_adx_thresh': 25.72837630319201, 'sideways_atr_min_pct': 0.023953434951157915, 'sideways_atr_max_pct': 0.044623341691668206, 'sideways_tp_mult': 2.4129036230555774, 'sideways_tsl_mult': 0.4232287711037618, 'sideways_time_stop': 246, 'sideways_use_sma': True, 'sideways_use_ema': True, 'sideways_use_atr': True, 'sideways_use_adx': True, 'sideways_use_spike': False, 'sideways_rsi_required': True}.
[I 2025-08-31 00:03:21,859] Trial 10 finished with values: [-1000000000.0, 1000000000.0] and parameters: {'p_sma': 8, 'p_std': 60, 'p_atr': 27, 'p_adx': 27, 'rsi_period': 81, 'ema1': 16, 'ema2': 10, 'slip_atr_k': 0.22105082132717555, 'slip_spread_k': 0.4109345817190867, 'spread_hl_frac': 0.011606027241114814, 'bb_std_mult': 0.5827363067609257, 'rsi_os': 49, 'rsi_ob': 61, 'vol_spike': 0.04640604485713893, 'adx_thresh': 16.42858043115537, 'atr_min_pct': 0.009805320072085089, 'atr_max_pct': 0.0581184660631085, 'tp_mult': 1.6247144535793663, 'tsl_mult': 0.797750814375148, 'strategy': 'mean_reversion', 'time_stop': 14, 'use_sma': True, 'use_atr': True, 'use_adx': True, 'use_ema': False, 'use_spike': False, 'rsi_required': True, 'edge_k': 0.6510473572244304, 'edge_cap': 0.868265808451095, 'bull_strategy': 'mean_reversion', 'bull_bb_std_mult': 2.0472384627850664, 'bull_rsi_os': 18, 'bull_rsi_ob': 52, 'bull_adx_thresh': 8.3032868998498, 'bull_atr_min_pct': 6.0668825874253814e-05, 'bull_atr_max_pct': 0.07794693735401216, 'bull_tp_mult': 1.4116917078372657, 'bull_tsl_mult': 0.6420785002108492, 'bull_time_stop': 295, 'bull_use_sma': False, 'bull_use_ema': True, 'bull_use_atr': False, 'bull_use_adx': True, 'bull_use_spike': True, 'bull_rsi_required': False, 'bear_strategy': 'mean_reversion', 'bear_bb_std_mult': 0.8086652628995574, 'bear_rsi_os': 36, 'bear_rsi_ob': 91, 'bear_adx_thresh': 5.017888755711374, 'bear_atr_min_pct': 0.029661728026467937, 'bear_atr_max_pct': 0.10261823038337049, 'bear_tp_mult': 2.897297988495724, 'bear_tsl_mult': 0.9540232478774846, 'bear_time_stop': 124, 'bear_use_sma': False, 'bear_use_ema': False, 'bear_use_atr': False, 'bear_use_adx': True, 'bear_use_spike': True, 'bear_rsi_required': True, 'sideways_strategy': 'breakout', 'sideways_bb_std_mult': 2.078478585490601, 'sideways_rsi_os': 27, 'sideways_rsi_ob': 89, 'sideways_adx_thresh': 25.687742038194642, 'sideways_atr_min_pct': 0.025457133140452212, 'sideways_atr_max_pct': 0.02421941953564697, 'sideways_tp_mult': 1.390660196116802, 'sideways_tsl_mult': 0.12447204924318245, 'sideways_time_stop': 194, 'sideways_use_sma': True, 'sideways_use_ema': False, 'sideways_use_atr': True, 'sideways_use_adx': False, 'sideways_use_spike': True, 'sideways_rsi_required': True}.
[I 2025-08-31 00:03:22,231] Trial 11 finished with values: [-1000000000.0, 1000000000.0] and parameters: {'p_sma': 30, 'p_std': 19, 'p_atr': 13, 'p_adx': 15, 'rsi_period': 21, 'ema1': 9, 'ema2': 45, 'slip_atr_k': 0.010737573158282193, 'slip_spread_k': 0.15737602362698844, 'spread_hl_frac': 0.012747089702182407, 'bb_std_mult': 2.198034293213647, 'rsi_os': 10, 'rsi_ob': 79, 'vol_spike': 0.04702810778522728, 'adx_thresh': 22.685678946782627, 'atr_min_pct': 0.026527819244326612, 'atr_max_pct': 0.11091060206043495, 'tp_mult': 2.799872481600588, 'tsl_mult': 0.7523872110449188, 'strategy': 'mean_reversion', 'time_stop': 50, 'use_sma': True, 'use_atr': True, 'use_adx': True, 'use_ema': False, 'use_spike': True, 'rsi_required': False, 'edge_k': 1.2854872150681222, 'edge_cap': 0.492272750585209, 'bull_strategy': 'breakout', 'bull_bb_std_mult': 0.5614125596797879, 'bull_rsi_os': 18, 'bull_rsi_ob': 64, 'bull_adx_thresh': 23.290968143654087, 'bull_atr_min_pct': 0.02975385689976134, 'bull_atr_max_pct': 0.02123272026241002, 'bull_tp_mult': 2.236924963414484, 'bull_tsl_mult': 0.501270310152072, 'bull_time_stop': 218, 'bull_use_sma': True, 'bull_use_ema': True, 'bull_use_atr': False, 'bull_use_adx': False, 'bull_use_spike': False, 'bull_rsi_required': False, 'bear_strategy': 'breakout', 'bear_bb_std_mult': 3.059013345457578, 'bear_rsi_os': 51, 'bear_rsi_ob': 63, 'bear_adx_thresh': 9.175793592150724, 'bear_atr_min_pct': 0.022960243563506233, 'bear_atr_max_pct': 0.1362569459372052, 'bear_tp_mult': 2.3934674349077887, 'bear_tsl_mult': 0.3354202491183925, 'bear_time_stop': 9, 'bear_use_sma': True, 'bear_use_ema': True, 'bear_use_atr': False, 'bear_use_adx': True, 'bear_use_spike': False, 'bear_rsi_required': False, 'sideways_strategy': 'breakout', 'sideways_bb_std_mult': 2.656621224291612, 'sideways_rsi_os': 31, 'sideways_rsi_ob': 62, 'sideways_adx_thresh': 31.607694818007626, 'sideways_atr_min_pct': 0.024592056315117662, 'sideways_atr_max_pct': 0.1469444332157606, 'sideways_tp_mult': 2.93295284549294, 'sideways_tsl_mult': 0.848987431476412, 'sideways_time_stop': 5, 'sideways_use_sma': False, 'sideways_use_ema': False, 'sideways_use_atr': True, 'sideways_use_adx': True, 'sideways_use_spike': True, 'sideways_rsi_required': True}.
[I 2025-08-31 00:03:22,781] Trial 12 finished with values: [-1000000000.0, 1000000000.0] and parameters: {'p_sma': 31, 'p_std': 42, 'p_atr': 23, 'p_adx': 20, 'rsi_period': 56, 'ema1': 19, 'ema2': 27, 'slip_atr_k': 0.032043952553398786, 'slip_spread_k': 0.331619711500276, 'spread_hl_frac': 0.027135569512699072, 'bb_std_mult': 1.5865561553109642, 'rsi_os': 40, 'rsi_ob': 71, 'vol_spike': 0.038356794161287906, 'adx_thresh': 13.310116139684906, 'atr_min_pct': 0.017653695596926974, 'atr_max_pct': 0.11556892401473155, 'tp_mult': 2.8256180498465544, 'tsl_mult': 0.017272347599584292, 'strategy': 'mean_reversion', 'time_stop': 160, 'use_sma': False, 'use_atr': True, 'use_adx': True, 'use_ema': False, 'use_spike': False, 'rsi_required': True, 'edge_k': 1.4643090365197968, 'edge_cap': 0.8544549979738608, 'bull_strategy': 'mean_reversion', 'bull_bb_std_mult': 1.4744203931448516, 'bull_rsi_os': 14, 'bull_rsi_ob': 55, 'bull_adx_thresh': 13.439162595817447, 'bull_atr_min_pct': 0.00557377597588904, 'bull_atr_max_pct': 0.09617756351857787, 'bull_tp_mult': 2.69533365771505, 'bull_tsl_mult': 0.7119280517309046, 'bull_time_stop': 130, 'bull_use_sma': False, 'bull_use_ema': False, 'bull_use_atr': True, 'bull_use_adx': False, 'bull_use_spike': True, 'bull_rsi_required': False, 'bear_strategy': 'breakout', 'bear_bb_std_mult': 0.5504528720634368, 'bear_rsi_os': 19, 'bear_rsi_ob': 92, 'bear_adx_thresh': 20.616009297815765, 'bear_atr_min_pct': 0.0019339683951857477, 'bear_atr_max_pct': 0.043171669601241004, 'bear_tp_mult': 1.0582409194038955, 'bear_tsl_mult': 0.9657443423268236, 'bear_time_stop': 181, 'bear_use_sma': True, 'bear_use_ema': False, 'bear_use_atr': False, 'bear_use_adx': False, 'bear_use_spike': False, 'bear_rsi_required': True, 'sideways_strategy': 'breakout', 'sideways_bb_std_mult': 0.7477117702511675, 'sideways_rsi_os': 33, 'sideways_rsi_ob': 65, 'sideways_adx_thresh': 18.212485528941848, 'sideways_atr_min_pct': 0.013490655903096374, 'sideways_atr_max_pct': 0.12504099330715707, 'sideways_tp_mult': 1.719379086906084, 'sideways_tsl_mult': 0.4529700340929502, 'sideways_time_stop': 293, 'sideways_use_sma': False, 'sideways_use_ema': True, 'sideways_use_atr': True, 'sideways_use_adx': False, 'sideways_use_spike': True, 'sideways_rsi_required': False}.
[I 2025-08-31 00:03:52,334] Trial 13 finished with values: [-1000000000.0, 1000000000.0] and parameters: {'p_sma': 39, 'p_std': 11, 'p_atr': 7, 'p_adx': 7, 'rsi_period': 9, 'ema1': 30, 'ema2': 59, 'slip_atr_k': 0.2183292178401468, 'slip_spread_k': 0.41764045104016734, 'spread_hl_frac': 0.0013109243957755076, 'bb_std_mult': 2.6131167321190123, 'rsi_os': 39, 'rsi_ob': 71, 'vol_spike': 0.0036742641849546176, 'adx_thresh': 34.79376605016378, 'atr_min_pct': 0.0005461011112861576, 'atr_max_pct': 0.041096028849670264, 'tp_mult': 1.153008338722972, 'tsl_mult': 0.635168564468748, 'strategy': 'mean_reversion', 'time_stop': 285, 'use_sma': False, 'use_atr': False, 'use_adx': False, 'use_ema': False, 'use_spike': False, 'rsi_required': True, 'edge_k': 0.5942998968478637, 'edge_cap': 0.6542565056847571, 'bull_strategy': 'mean_reversion', 'bull_bb_std_mult': 0.5989328282060351, 'bull_rsi_os': 55, 'bull_rsi_ob': 77, 'bull_adx_thresh': 15.768020062582814, 'bull_atr_min_pct': 0.009768532225060057, 'bull_atr_max_pct': 0.09429067082862998, 'bull_tp_mult': 2.954208115308968, 'bull_tsl_mult': 0.9646472564170069, 'bull_time_stop': 29, 'bull_use_sma': True, 'bull_use_ema': False, 'bull_use_atr': True, 'bull_use_adx': False, 'bull_use_spike': False, 'bull_rsi_required': True, 'bear_strategy': 'mean_reversion', 'bear_bb_std_mult': 2.0937618498395825, 'bear_rsi_os': 40, 'bear_rsi_ob': 45, 'bear_adx_thresh': 34.53043312714477, 'bear_atr_min_pct': 0.012309181253639763, 'bear_atr_max_pct': 0.07061234049565795, 'bear_tp_mult': 2.478439244743697, 'bear_tsl_mult': 0.3428095379059979, 'bear_time_stop': 297, 'bear_use_sma': False, 'bear_use_ema': False, 'bear_use_atr': False, 'bear_use_adx': False, 'bear_use_spike': False, 'bear_rsi_required': False, 'sideways_strategy': 'breakout', 'sideways_bb_std_mult': 3.277130360104284, 'sideways_rsi_os': 9, 'sideways_rsi_ob': 93, 'sideways_adx_thresh': 32.830375320869045, 'sideways_atr_min_pct': 0.016398962313436318, 'sideways_atr_max_pct': 0.08731934869501103, 'sideways_tp_mult': 1.6919162143180584, 'sideways_tsl_mult': 0.6460901145894882, 'sideways_time_stop': 163, 'sideways_use_sma': False, 'sideways_use_ema': False, 'sideways_use_atr': True, 'sideways_use_adx': True, 'sideways_use_spike': False, 'sideways_rsi_required': True}.
[I 2025-08-31 00:03:53,871] Trial 14 finished with values: [-1000000000.0, 1000000000.0] and parameters: {'p_sma': 39, 'p_std': 16, 'p_atr': 7, 'p_adx': 8, 'rsi_period': 9, 'ema1': 29, 'ema2': 56, 'slip_atr_k': 0.1785323272252355, 'slip_spread_k': 0.7605148349644084, 'spread_hl_frac': 0.000614992595719308, 'bb_std_mult': 2.624556103268441, 'rsi_os': 35, 'rsi_ob': 71, 'vol_spike': 0.0022678581639290624, 'adx_thresh': 33.90075204297362, 'atr_min_pct': 0.0001870254118151865, 'atr_max_pct': 0.023782486021688858, 'tp_mult': 2.988459372757021, 'tsl_mult': 0.6002481769627588, 'strategy': 'mean_reversion', 'time_stop': 292, 'use_sma': False, 'use_atr': False, 'use_adx': False, 'use_ema': False, 'use_spike': False, 'rsi_required': False, 'edge_k': 0.4453891847989754, 'edge_cap': 0.23339729333512008, 'bull_strategy': 'mean_reversion', 'bull_bb_std_mult': 0.5207674118997921, 'bull_rsi_os': 55, 'bull_rsi_ob': 75, 'bull_adx_thresh': 14.436912556201825, 'bull_atr_min_pct': 0.00821261667817387, 'bull_atr_max_pct': 0.10626837284694968, 'bull_tp_mult': 2.9272109762543517, 'bull_tsl_mult': 0.9691388878343032, 'bull_time_stop': 28, 'bull_use_sma': True, 'bull_use_ema': False, 'bull_use_atr': True, 'bull_use_adx': False, 'bull_use_spike': False, 'bull_rsi_required': True, 'bear_strategy': 'mean_reversion', 'bear_bb_std_mult': 2.118019007154003, 'bear_rsi_os': 39, 'bear_rsi_ob': 46, 'bear_adx_thresh': 33.93193791593795, 'bear_atr_min_pct': 0.013967483381861361, 'bear_atr_max_pct': 0.05842912172454222, 'bear_tp_mult': 2.48428897851555, 'bear_tsl_mult': 0.3387038011681014, 'bear_time_stop': 293, 'bear_use_sma': False, 'bear_use_ema': False, 'bear_use_atr': False, 'bear_use_adx': False, 'bear_use_spike': False, 'bear_rsi_required': False, 'sideways_strategy': 'breakout', 'sideways_bb_std_mult': 3.5242336268757493, 'sideways_rsi_os': 8, 'sideways_rsi_ob': 95, 'sideways_adx_thresh': 34.66290224852773, 'sideways_atr_min_pct': 0.016176274755707022, 'sideways_atr_max_pct': 0.09371736380170143, 'sideways_tp_mult': 1.7504211253806772, 'sideways_tsl_mult': 0.6630258588065091, 'sideways_time_stop': 133, 'sideways_use_sma': False, 'sideways_use_ema': True, 'sideways_use_atr': True, 'sideways_use_adx': True, 'sideways_use_spike': False, 'sideways_rsi_required': True}.
[I 2025-08-31 00:03:54,127] Trial 15 finished with values: [-1000000000.0, 1000000000.0] and parameters: {'p_sma': 41, 'p_std': 7, 'p_atr': 7, 'p_adx': 23, 'rsi_period': 9, 'ema1': 30, 'ema2': 58, 'slip_atr_k': 0.06462223380261145, 'slip_spread_k': 0.8646332640745431, 'spread_hl_frac': 0.004586268064107593, 'bb_std_mult': 2.6540736186973293, 'rsi_os': 37, 'rsi_ob': 69, 'vol_spike': 0.1253962213371556, 'adx_thresh': 34.740569182864334, 'atr_min_pct': 0.0016612885614574573, 'atr_max_pct': 0.02490295250141379, 'tp_mult': 1.0301620437856893, 'tsl_mult': 0.5988696094966219, 'strategy': 'mean_reversion', 'time_stop': 295, 'use_sma': False, 'use_atr': False, 'use_adx': False, 'use_ema': True, 'use_spike': False, 'rsi_required': True, 'edge_k': 0.4714407267646952, 'edge_cap': 0.18269071589655667, 'bull_strategy': 'mean_reversion', 'bull_bb_std_mult': 0.5331031105757709, 'bull_rsi_os': 51, 'bull_rsi_ob': 76, 'bull_adx_thresh': 13.772228495148575, 'bull_atr_min_pct': 0.007682755400585049, 'bull_atr_max_pct': 0.09692416958646766, 'bull_tp_mult': 2.7856820823092807, 'bull_tsl_mult': 0.9987128101636291, 'bull_time_stop': 7, 'bull_use_sma': True, 'bull_use_ema': False, 'bull_use_atr': True, 'bull_use_adx': False, 'bull_use_spike': False, 'bull_rsi_required': True, 'bear_strategy': 'mean_reversion', 'bear_bb_std_mult': 2.1541904758497545, 'bear_rsi_os': 39, 'bear_rsi_ob': 46, 'bear_adx_thresh': 34.70945906817001, 'bear_atr_min_pct': 0.012737621646073309, 'bear_atr_max_pct': 0.06103584370745231, 'bear_tp_mult': 2.5435742462038498, 'bear_tsl_mult': 0.3543672091248798, 'bear_time_stop': 177, 'bear_use_sma': False, 'bear_use_ema': False, 'bear_use_atr': True, 'bear_use_adx': False, 'bear_use_spike': False, 'bear_rsi_required': False, 'sideways_strategy': 'breakout', 'sideways_bb_std_mult': 3.572211518372846, 'sideways_rsi_os': 10, 'sideways_rsi_ob': 94, 'sideways_adx_thresh': 5.431847144342255, 'sideways_atr_min_pct': 0.015747927568285528, 'sideways_atr_max_pct': 0.08908076782563255, 'sideways_tp_mult': 1.6402649334601207, 'sideways_tsl_mult': 0.6134028534000642, 'sideways_time_stop': 129, 'sideways_use_sma': False, 'sideways_use_ema': True, 'sideways_use_atr': True, 'sideways_use_adx': True, 'sideways_use_spike': False, 'sideways_rsi_required': True}.
[I 2025-08-31 00:03:54,654] Trial 16 finished with values: [-1000000000.0, 1000000000.0] and parameters: {'p_sma': 43, 'p_std': 22, 'p_atr': 7, 'p_adx': 8, 'rsi_period': 9, 'ema1': 30, 'ema2': 58, 'slip_atr_k': 0.16952196736464314, 'slip_spread_k': 0.8390068960930779, 'spread_hl_frac': 0.0008553888982497163, 'bb_std_mult': 2.640307597701892, 'rsi_os': 35, 'rsi_ob': 67, 'vol_spike': 0.12226503083190252, 'adx_thresh': 34.390719252271865, 'atr_min_pct': 0.005178124685937289, 'atr_max_pct': 0.020565200672542916, 'tp_mult': 1.091498137961513, 'tsl_mult': 0.5958892858649025, 'strategy': 'mean_reversion', 'time_stop': 287, 'use_sma': False, 'use_atr': False, 'use_adx': False, 'use_ema': True, 'use_spike': False, 'rsi_required': False, 'edge_k': 0.42549311172175375, 'edge_cap': 0.2728332360467827, 'bull_strategy': 'mean_reversion', 'bull_bb_std_mult': 0.6734651978523788, 'bull_rsi_os': 55, 'bull_rsi_ob': 73, 'bull_adx_thresh': 5.094690978747344, 'bull_atr_min_pct': 0.01027368752167412, 'bull_atr_max_pct': 0.05269091765580791, 'bull_tp_mult': 2.8625407710629416, 'bull_tsl_mult': 0.9591635159205977, 'bull_time_stop': 5, 'bull_use_sma': True, 'bull_use_ema': False, 'bull_use_atr': True, 'bull_use_adx': False, 'bull_use_spike': False, 'bull_rsi_required': True, 'bear_strategy': 'mean_reversion', 'bear_bb_std_mult': 2.2263676644738624, 'bear_rsi_os': 40, 'bear_rsi_ob': 45, 'bear_adx_thresh': 34.39943134370904, 'bear_atr_min_pct': 0.012372628135012878, 'bear_atr_max_pct': 0.0686376059025546, 'bear_tp_mult': 2.5911204843879148, 'bear_tsl_mult': 0.34515495977682875, 'bear_time_stop': 297, 'bear_use_sma': False, 'bear_use_ema': False, 'bear_use_atr': True, 'bear_use_adx': False, 'bear_use_spike': False, 'bear_rsi_required': False, 'sideways_strategy': 'breakout', 'sideways_bb_std_mult': 3.4880931114941855, 'sideways_rsi_os': 9, 'sideways_rsi_ob': 93, 'sideways_adx_thresh': 5.453960917665876, 'sideways_atr_min_pct': 0.017915496991017705, 'sideways_atr_max_pct': 0.0897220760129912, 'sideways_tp_mult': 1.8397898623382696, 'sideways_tsl_mult': 0.6236248568032842, 'sideways_time_stop': 132, 'sideways_use_sma': False, 'sideways_use_ema': True, 'sideways_use_atr': True, 'sideways_use_adx': True, 'sideways_use_spike': False, 'sideways_rsi_required': True}.
[I 2025-08-31 00:03:54,727] Trial 18 finished with values: [-1000000000.0, 1000000000.0] and parameters: {'p_sma': 41, 'p_std': 28, 'p_atr': 15, 'p_adx': 24, 'rsi_period': 37, 'ema1': 24, 'ema2': 11, 'slip_atr_k': 0.061709783379856234, 'slip_spread_k': 0.0004630913896863653, 'spread_hl_frac': 0.03501553398869614, 'bb_std_mult': 2.647202976725412, 'rsi_os': 53, 'rsi_ob': 61, 'vol_spike': 0.12880936507264062, 'adx_thresh': 5.31402544985732, 'atr_min_pct': 0.007476035453459219, 'atr_max_pct': 0.1468983976005474, 'tp_mult': 2.381671583035275, 'tsl_mult': 0.5197348198210388, 'strategy': 'mean_reversion', 'time_stop': 236, 'use_sma': False, 'use_atr': False, 'use_adx': False, 'use_ema': True, 'use_spike': False, 'rsi_required': False, 'edge_k': 1.0797452026161554, 'edge_cap': 0.28029184439239563, 'bull_strategy': 'mean_reversion', 'bull_bb_std_mult': 2.9411470935468302, 'bull_rsi_os': 40, 'bull_rsi_ob': 46, 'bull_adx_thresh': 5.818339796745307, 'bull_atr_min_pct': 0.0029981904098529593, 'bull_atr_max_pct': 0.05228668883433377, 'bull_tp_mult': 2.167495448695747, 'bull_tsl_mult': 0.8316186989769448, 'bull_time_stop': 84, 'bull_use_sma': True, 'bull_use_ema': False, 'bull_use_atr': True, 'bull_use_adx': False, 'bull_use_spike': False, 'bull_rsi_required': True, 'bear_strategy': 'mean_reversion', 'bear_bb_std_mult': 2.5789368364470393, 'bear_rsi_os': 29, 'bear_rsi_ob': 77, 'bear_adx_thresh': 29.638427079259202, 'bear_atr_min_pct': 0.019584671198104798, 'bear_atr_max_pct': 0.08033360614483215, 'bear_tp_mult': 1.6735948304288903, 'bear_tsl_mult': 0.4373457514596053, 'bear_time_stop': 173, 'bear_use_sma': False, 'bear_use_ema': False, 'bear_use_atr': True, 'bear_use_adx': False, 'bear_use_spike': True, 'bear_rsi_required': False, 'sideways_strategy': 'breakout', 'sideways_bb_std_mult': 0.9662967092557164, 'sideways_rsi_os': 16, 'sideways_rsi_ob': 86, 'sideways_adx_thresh': 5.153760034615479, 'sideways_atr_min_pct': 0.02968646056319825, 'sideways_atr_max_pct': 0.07221352088127568, 'sideways_tp_mult': 2.0598055810231535, 'sideways_tsl_mult': 0.572052654683591, 'sideways_time_stop': 119, 'sideways_use_sma': False, 'sideways_use_ema': True, 'sideways_use_atr': True, 'sideways_use_adx': True, 'sideways_use_spike': False, 'sideways_rsi_required': True}.
