[I 2025-08-31 00:27:07,921] Trial 204 finished with values: [-1000000000.0, 1000000000.0] and parameters: {'p_sma': 48, 'p_std': 43, 'p_atr': 12, 'p_adx': 19, 'rsi_period': 34, 'ema1': 22, 'ema2': 20, 'slip_atr_k': 0.05476392973575929, 'slip_spread_k': 0.41014082297108506, 'spread_hl_frac': 0.0021652207764064103, 'bb_std_mult': 3.52740246070897, 'rsi_os': 53, 'rsi_ob': 81, 'vol_spike': 0.0877436239368004, 'adx_thresh': 24.98064778376009, 'atr_min_pct': 0.007622407300856535, 'atr_max_pct': 0.06812433631641877, 'tp_mult': 2.6547310048751216, 'tsl_mult': 0.05025380155612551, 'strategy': 'breakout', 'time_stop': 35, 'use_sma': False, 'use_atr': True, 'use_adx': False, 'use_ema': False, 'use_spike': True, 'rsi_required': True, 'edge_k': 0.7592730879182724, 'edge_cap': 0.626267032726156, 'bull_strategy': 'breakout', 'bull_bb_std_mult': 2.518288724599197, 'bull_rsi_os': 29, 'bull_rsi_ob': 50, 'bull_adx_thresh': 14.427015821718037, 'bull_atr_min_pct': 0.00047606920924232813, 'bull_atr_max_pct': 0.11425336839484732, 'bull_tp_mult': 2.9997005735079303, 'bull_tsl_mult': 0.3175332139029806, 'bull_time_stop': 167, 'bull_use_sma': True, 'bull_use_ema': True, 'bull_use_atr': False, 'bull_use_adx': False, 'bull_use_spike': True, 'bull_rsi_required': True, 'bear_strategy': 'breakout', 'bear_bb_std_mult': 1.9790602089777054, 'bear_rsi_os': 26, 'bear_rsi_ob': 77, 'bear_adx_thresh': 28.641448899954433, 'bear_atr_min_pct': 0.009058053588518522, 'bear_atr_max_pct': 0.07989189308819676, 'bear_tp_mult': 2.0006856053264968, 'bear_tsl_mult': 0.8382380466043601, 'bear_time_stop': 214, 'bear_use_sma': False, 'bear_use_ema': True, 'bear_use_atr': False, 'bear_use_adx': True, 'bear_use_spike': False, 'bear_rsi_required': True, 'sideways_strategy': 'mean_reversion', 'sideways_bb_std_mult': 1.2546633128401223, 'sideways_rsi_os': 5, 'sideways_rsi_ob': 74, 'sideways_adx_thresh': 15.03784910445998, 'sideways_atr_min_pct': 0.02162297696682548, 'sideways_atr_max_pct': 0.14260255248347603, 'sideways_tp_mult': 1.236227736086866, 'sideways_tsl_mult': 0.49653696112970874, 'sideways_time_stop': 25, 'sideways_use_sma': True, 'sideways_use_ema': True, 'sideways_use_atr': True, 'sideways_use_adx': False, 'sideways_use_spike': False, 'sideways_rsi_required': True}.
[I 2025-08-31 00:27:13,258] Trial 209 finished with values: [-1000000000.0, 1000000000.0] and parameters: {'p_sma': 18, 'p_std': 44, 'p_atr': 14, 'p_adx': 12, 'rsi_period': 31, 'ema1': 19, 'ema2': 19, 'slip_atr_k': 0.03923194369569979, 'slip_spread_k': 0.4044743466207126, 'spread_hl_frac': 0.018834279134499404, 'bb_std_mult': 3.317179013124059, 'rsi_os': 53, 'rsi_ob': 46, 'vol_spike': 0.016178476411893728, 'adx_thresh': 23.00718796619466, 'atr_min_pct': 0.007775742640155143, 'atr_max_pct': 0.06163706564646824, 'tp_mult': 2.4778567833339804, 'tsl_mult': 0.16445637727734186, 'strategy': 'breakout', 'time_stop': 169, 'use_sma': True, 'use_atr': False, 'use_adx': False, 'use_ema': True, 'use_spike': False, 'rsi_required': True, 'edge_k': 1.3145629835447965, 'edge_cap': 0.9201387125954247, 'bull_strategy': 'mean_reversion', 'bull_bb_std_mult': 2.29566741075869, 'bull_rsi_os': 17, 'bull_rsi_ob': 51, 'bull_adx_thresh': 12.680347772554484, 'bull_atr_min_pct': 0.0008478553626442847, 'bull_atr_max_pct': 0.08839960067011554, 'bull_tp_mult': 1.2848757228114693, 'bull_tsl_mult': 0.48476163094751884, 'bull_time_stop': 300, 'bull_use_sma': True, 'bull_use_ema': False, 'bull_use_atr': False, 'bull_use_adx': True, 'bull_use_spike': False, 'bull_rsi_required': False, 'bear_strategy': 'breakout', 'bear_bb_std_mult': 3.559694825122643, 'bear_rsi_os': 36, 'bear_rsi_ob': 91, 'bear_adx_thresh': 18.49862354312544, 'bear_atr_min_pct': 0.026846930685105245, 'bear_atr_max_pct': 0.13648116465433088, 'bear_tp_mult': 1.544473972007028, 'bear_tsl_mult': 0.2147887818416926, 'bear_time_stop': 42, 'bear_use_sma': False, 'bear_use_ema': False, 'bear_use_atr': False, 'bear_use_adx': True, 'bear_use_spike': True, 'bear_rsi_required': False, 'sideways_strategy': 'mean_reversion', 'sideways_bb_std_mult': 1.2663507653392805, 'sideways_rsi_os': 46, 'sideways_rsi_ob': 73, 'sideways_adx_thresh': 30.619589489619095, 'sideways_atr_min_pct': 0.019004039989465236, 'sideways_atr_max_pct': 0.0666326707973462, 'sideways_tp_mult': 1.8993099207387762, 'sideways_tsl_mult': 0.3583524597525203, 'sideways_time_stop': 280, 'sideways_use_sma': False, 'sideways_use_ema': False, 'sideways_use_atr': False, 'sideways_use_adx': False, 'sideways_use_spike': True, 'sideways_rsi_required': False}.
[I 2025-08-31 00:27:13,444] Trial 208 finished with values: [-0.03557995494863464, 0.03554939706124153] and parameters: {'p_sma': 18, 'p_std': 5, 'p_atr': 14, 'p_adx': 7, 'rsi_period': 15, 'ema1': 19, 'ema2': 10, 'slip_atr_k': 0.13414341065053542, 'slip_spread_k': 0.8695682775024924, 'spread_hl_frac': 0.03304581423729699, 'bb_std_mult': 0.792713748193437, 'rsi_os': 53, 'rsi_ob': 67, 'vol_spike': 0.015837242829957698, 'adx_thresh': 13.699499429785869, 'atr_min_pct': 0.001436910292757133, 'atr_max_pct': 0.1498156294631487, 'tp_mult': 2.7445161135432197, 'tsl_mult': 0.044980537314714325, 'strategy': 'breakout', 'time_stop': 24, 'use_sma': True, 'use_atr': False, 'use_adx': False, 'use_ema': False, 'use_spike': False, 'rsi_required': True, 'edge_k': 0.7537479878302609, 'edge_cap': 0.7186514433239939, 'bull_strategy': 'breakout', 'bull_bb_std_mult': 2.326560332458555, 'bull_rsi_os': 49, 'bull_rsi_ob': 69, 'bull_adx_thresh': 12.802360989742233, 'bull_atr_min_pct': 1.4468846601100826e-05, 'bull_atr_max_pct': 0.11260286716951198, 'bull_tp_mult': 1.0934287343880875, 'bull_tsl_mult': 0.3210775568169639, 'bull_time_stop': 222, 'bull_use_sma': True, 'bull_use_ema': False, 'bull_use_atr': True, 'bull_use_adx': True, 'bull_use_spike': False, 'bull_rsi_required': False, 'bear_strategy': 'breakout', 'bear_bb_std_mult': 0.5898890947756877, 'bear_rsi_os': 29, 'bear_rsi_ob': 77, 'bear_adx_thresh': 29.047662373838033, 'bear_atr_min_pct': 0.024882079420061255, 'bear_atr_max_pct': 0.13696441250806826, 'bear_tp_mult': 1.9692256897851117, 'bear_tsl_mult': 0.2208999075754534, 'bear_time_stop': 128, 'bear_use_sma': False, 'bear_use_ema': False, 'bear_use_atr': False, 'bear_use_adx': True, 'bear_use_spike': False, 'bear_rsi_required': False, 'sideways_strategy': 'mean_reversion', 'sideways_bb_std_mult': 0.7553563693131993, 'sideways_rsi_os': 46, 'sideways_rsi_ob': 73, 'sideways_adx_thresh': 13.229933795294047, 'sideways_atr_min_pct': 0.007508809659503092, 'sideways_atr_max_pct': 0.0343625536289224, 'sideways_tp_mult': 2.451887313876811, 'sideways_tsl_mult': 0.2821710206095498, 'sideways_time_stop': 82, 'sideways_use_sma': False, 'sideways_use_ema': False, 'sideways_use_atr': False, 'sideways_use_adx': False, 'sideways_use_spike': True, 'sideways_rsi_required': False}.
[I 2025-08-31 00:27:13,547] Trial 210 finished with values: [-0.038341263685225724, 0.03828281871615224] and parameters: {'p_sma': 33, 'p_std': 5, 'p_atr': 14, 'p_adx': 7, 'rsi_period': 11, 'ema1': 21, 'ema2': 10, 'slip_atr_k': 0.03380924153291233, 'slip_spread_k': 0.6142525608185119, 'spread_hl_frac': 0.026433135423387797, 'bb_std_mult': 0.8366294291365752, 'rsi_os': 53, 'rsi_ob': 74, 'vol_spike': 0.016691802744796633, 'adx_thresh': 11.572106177006226, 'atr_min_pct': 0.01742537244834886, 'atr_max_pct': 0.06146102803068094, 'tp_mult': 1.047050680203733, 'tsl_mult': 0.14778922148283782, 'strategy': 'breakout', 'time_stop': 23, 'use_sma': True, 'use_atr': False, 'use_adx': False, 'use_ema': True, 'use_spike': False, 'rsi_required': False, 'edge_k': 0.5006923287690065, 'edge_cap': 0.5085658687677329, 'bull_strategy': 'mean_reversion', 'bull_bb_std_mult': 2.296216492407386, 'bull_rsi_os': 18, 'bull_rsi_ob': 69, 'bull_adx_thresh': 14.320488778079437, 'bull_atr_min_pct': 0.0010220030383228905, 'bull_atr_max_pct': 0.09011147664042332, 'bull_tp_mult': 2.143336104289562, 'bull_tsl_mult': 0.32440813303585897, 'bull_time_stop': 180, 'bull_use_sma': True, 'bull_use_ema': False, 'bull_use_atr': False, 'bull_use_adx': False, 'bull_use_spike': False, 'bull_rsi_required': False, 'bear_strategy': 'breakout', 'bear_bb_std_mult': 0.5570759230931174, 'bear_rsi_os': 52, 'bear_rsi_ob': 80, 'bear_adx_thresh': 14.839757642189397, 'bear_atr_min_pct': 0.01343406479819517, 'bear_atr_max_pct': 0.09572263118112292, 'bear_tp_mult': 2.042396986315744, 'bear_tsl_mult': 0.0007014189599754417, 'bear_time_stop': 275, 'bear_use_sma': False, 'bear_use_ema': False, 'bear_use_atr': True, 'bear_use_adx': True, 'bear_use_spike': True, 'bear_rsi_required': False, 'sideways_strategy': 'mean_reversion', 'sideways_bb_std_mult': 3.3817367417214186, 'sideways_rsi_os': 5, 'sideways_rsi_ob': 75, 'sideways_adx_thresh': 15.179655917940202, 'sideways_atr_min_pct': 0.021396422823742205, 'sideways_atr_max_pct': 0.028307850652531212, 'sideways_tp_mult': 1.0800682529110637, 'sideways_tsl_mult': 0.32612063220932364, 'sideways_time_stop': 109, 'sideways_use_sma': False, 'sideways_use_ema': False, 'sideways_use_atr': False, 'sideways_use_adx': False, 'sideways_use_spike': True, 'sideways_rsi_required': False}.
[I 2025-08-31 00:27:42,128] Trial 211 finished with values: [-1000000000.0, 1000000000.0] and parameters: {'p_sma': 18, 'p_std': 37, 'p_atr': 14, 'p_adx': 7, 'rsi_period': 11, 'ema1': 29, 'ema2': 19, 'slip_atr_k': 0.13262004785828643, 'slip_spread_k': 0.658946570300216, 'spread_hl_frac': 0.014760385858497677, 'bb_std_mult': 2.0443397449095335, 'rsi_os': 19, 'rsi_ob': 46, 'vol_spike': 0.1061339479112351, 'adx_thresh': 13.877320711448164, 'atr_min_pct': 0.0015808437154020418, 'atr_max_pct': 0.06174675729405382, 'tp_mult': 2.480260441356817, 'tsl_mult': 0.14448903442490602, 'strategy': 'breakout', 'time_stop': 24, 'use_sma': True, 'use_atr': False, 'use_adx': False, 'use_ema': True, 'use_spike': False, 'rsi_required': False, 'edge_k': 0.4970644521625145, 'edge_cap': 0.922037659501947, 'bull_strategy': 'mean_reversion', 'bull_bb_std_mult': 3.20183818408187, 'bull_rsi_os': 49, 'bull_rsi_ob': 69, 'bull_adx_thresh': 12.725000127925949, 'bull_atr_min_pct': 0.017808081740222116, 'bull_atr_max_pct': 0.08827657313340306, 'bull_tp_mult': 1.2380296988440453, 'bull_tsl_mult': 0.9802587992663463, 'bull_time_stop': 164, 'bull_use_sma': True, 'bull_use_ema': False, 'bull_use_atr': False, 'bull_use_adx': True, 'bull_use_spike': False, 'bull_rsi_required': False, 'bear_strategy': 'breakout', 'bear_bb_std_mult': 0.5513897276030884, 'bear_rsi_os': 44, 'bear_rsi_ob': 80, 'bear_adx_thresh': 28.218199293520584, 'bear_atr_min_pct': 0.010533578647212572, 'bear_atr_max_pct': 0.053059786924998, 'bear_tp_mult': 1.548579147469955, 'bear_tsl_mult': 0.2186075192318007, 'bear_time_stop': 244, 'bear_use_sma': False, 'bear_use_ema': False, 'bear_use_atr': True, 'bear_use_adx': True, 'bear_use_spike': True, 'bear_rsi_required': False, 'sideways_strategy': 'mean_reversion', 'sideways_bb_std_mult': 0.9969058788045182, 'sideways_rsi_os': 46, 'sideways_rsi_ob': 62, 'sideways_adx_thresh': 25.82574927783441, 'sideways_atr_min_pct': 0.019029912471927875, 'sideways_atr_max_pct': 0.12358749877973874, 'sideways_tp_mult': 1.0915400769567378, 'sideways_tsl_mult': 0.27599360510480386, 'sideways_time_stop': 39, 'sideways_use_sma': False, 'sideways_use_ema': False, 'sideways_use_atr': False, 'sideways_use_adx': False, 'sideways_use_spike': True, 'sideways_rsi_required': False}.
[I 2025-08-31 00:27:44,005] Trial 214 finished with values: [-1000000000.0, 1000000000.0] and parameters: {'p_sma': 49, 'p_std': 39, 'p_atr': 25, 'p_adx': 7, 'rsi_period': 45, 'ema1': 18, 'ema2': 17, 'slip_atr_k': 0.11531721603729934, 'slip_spread_k': 0.6562083805590192, 'spread_hl_frac': 0.04402625375568458, 'bb_std_mult': 2.8460138552373366, 'rsi_os': 13, 'rsi_ob': 79, 'vol_spike': 0.0059095764195699315, 'adx_thresh': 12.330841283409264, 'atr_min_pct': 0.018986771686608055, 'atr_max_pct': 0.06262899019027517, 'tp_mult': 2.593956090495886, 'tsl_mult': 0.13384108487000926, 'strategy': 'breakout', 'time_stop': 44, 'use_sma': True, 'use_atr': False, 'use_adx': False, 'use_ema': False, 'use_spike': False, 'rsi_required': True, 'edge_k': 1.520632303514565, 'edge_cap': 0.9468797118011576, 'bull_strategy': 'mean_reversion', 'bull_bb_std_mult': 3.188419038906659, 'bull_rsi_os': 35, 'bull_rsi_ob': 66, 'bull_adx_thresh': 19.02997724176714, 'bull_atr_min_pct': 0.02295796827062564, 'bull_atr_max_pct': 0.13538488889091366, 'bull_tp_mult': 2.9670353055248344, 'bull_tsl_mult': 0.9686650143099425, 'bull_time_stop': 160, 'bull_use_sma': False, 'bull_use_ema': True, 'bull_use_atr': False, 'bull_use_adx': True, 'bull_use_spike': False, 'bull_rsi_required': False, 'bear_strategy': 'mean_reversion', 'bear_bb_std_mult': 0.6343780097593159, 'bear_rsi_os': 44, 'bear_rsi_ob': 66, 'bear_adx_thresh': 28.044773323149837, 'bear_atr_min_pct': 0.022769868781546326, 'bear_atr_max_pct': 0.14224943533703413, 'bear_tp_mult': 1.9194927169897613, 'bear_tsl_mult': 0.19387138113574584, 'bear_time_stop': 194, 'bear_use_sma': True, 'bear_use_ema': False, 'bear_use_atr': True, 'bear_use_adx': True, 'bear_use_spike': False, 'bear_rsi_required': False, 'sideways_strategy': 'mean_reversion', 'sideways_bb_std_mult': 1.0151339699293804, 'sideways_rsi_os': 10, 'sideways_rsi_ob': 47, 'sideways_adx_thresh': 11.042293399734266, 'sideways_atr_min_pct': 0.009634666213539738, 'sideways_atr_max_pct': 0.13865219525835215, 'sideways_tp_mult': 1.6817466990551773, 'sideways_tsl_mult': 0.45228395691298134, 'sideways_time_stop': 93, 'sideways_use_sma': False, 'sideways_use_ema': False, 'sideways_use_atr': False, 'sideways_use_adx': False, 'sideways_use_spike': True, 'sideways_rsi_required': False}.
[I 2025-08-31 00:27:44,006] Trial 212 finished with values: [-1000000000.0, 1000000000.0] and parameters: {'p_sma': 51, 'p_std': 39, 'p_atr': 29, 'p_adx': 7, 'rsi_period': 8, 'ema1': 16, 'ema2': 10, 'slip_atr_k': 0.13383730531594842, 'slip_spread_k': 0.8080829634967484, 'spread_hl_frac': 0.025939648674135417, 'bb_std_mult': 3.4496547663583415, 'rsi_os': 11, 'rsi_ob': 74, 'vol_spike': 0.10563830538228854, 'adx_thresh': 13.813381920339445, 'atr_min_pct': 0.0012926527476291936, 'atr_max_pct': 0.06336882158239988, 'tp_mult': 2.5836913902924197, 'tsl_mult': 0.1357183476476751, 'strategy': 'breakout', 'time_stop': 24, 'use_sma': True, 'use_atr': False, 'use_adx': False, 'use_ema': False, 'use_spike': False, 'rsi_required': False, 'edge_k': 1.5025856594769604, 'edge_cap': 0.28691457848166313, 'bull_strategy': 'mean_reversion', 'bull_bb_std_mult': 2.402155289938872, 'bull_rsi_os': 27, 'bull_rsi_ob': 68, 'bull_adx_thresh': 7.956082772956764, 'bull_atr_min_pct': 0.023014408097885675, 'bull_atr_max_pct': 0.08837841115521668, 'bull_tp_mult': 1.095781100282139, 'bull_tsl_mult': 0.058024738996381386, 'bull_time_stop': 56, 'bull_use_sma': False, 'bull_use_ema': True, 'bull_use_atr': False, 'bull_use_adx': True, 'bull_use_spike': False, 'bull_rsi_required': False, 'bear_strategy': 'mean_reversion', 'bear_bb_std_mult': 0.5461301154988379, 'bear_rsi_os': 44, 'bear_rsi_ob': 85, 'bear_adx_thresh': 28.03527679126916, 'bear_atr_min_pct': 0.010355564002360972, 'bear_atr_max_pct': 0.05280226248194021, 'bear_tp_mult': 2.0434813157880694, 'bear_tsl_mult': 0.1751258634302642, 'bear_time_stop': 278, 'bear_use_sma': True, 'bear_use_ema': False, 'bear_use_atr': True, 'bear_use_adx': True, 'bear_use_spike': True, 'bear_rsi_required': False, 'sideways_strategy': 'mean_reversion', 'sideways_bb_std_mult': 1.6699666592321236, 'sideways_rsi_os': 28, 'sideways_rsi_ob': 62, 'sideways_adx_thresh': 11.107994945776706, 'sideways_atr_min_pct': 0.020588274753183408, 'sideways_atr_max_pct': 0.08143078950605367, 'sideways_tp_mult': 1.093350969789257, 'sideways_tsl_mult': 0.881866210455752, 'sideways_time_stop': 39, 'sideways_use_sma': False, 'sideways_use_ema': False, 'sideways_use_atr': False, 'sideways_use_adx': False, 'sideways_use_spike': True, 'sideways_rsi_required': False}.
[I 2025-08-31 00:27:44,213] Trial 213 finished with values: [-1000000000.0, 1000000000.0] and parameters: {'p_sma': 51, 'p_std': 37, 'p_atr': 29, 'p_adx': 7, 'rsi_period': 60, 'ema1': 26, 'ema2': 16, 'slip_atr_k': 0.14917492283300998, 'slip_spread_k': 0.3608966760984448, 'spread_hl_frac': 0.014709449372047427, 'bb_std_mult': 1.0889483269104145, 'rsi_os': 19, 'rsi_ob': 74, 'vol_spike': 0.026065440188203517, 'adx_thresh': 11.576085949952525, 'atr_min_pct': 0.0005623733967426719, 'atr_max_pct': 0.06344544553537448, 'tp_mult': 2.145984364192932, 'tsl_mult': 0.14553227510597838, 'strategy': 'breakout', 'time_stop': 227, 'use_sma': True, 'use_atr': False, 'use_adx': False, 'use_ema': True, 'use_spike': False, 'rsi_required': False, 'edge_k': 0.8462262376529547, 'edge_cap': 0.945173883074357, 'bull_strategy': 'mean_reversion', 'bull_bb_std_mult': 2.409189773918877, 'bull_rsi_os': 26, 'bull_rsi_ob': 68, 'bull_adx_thresh': 13.921201373774034, 'bull_atr_min_pct': 0.0012162277734411968, 'bull_atr_max_pct': 0.09028743784024439, 'bull_tp_mult': 2.802519452661921, 'bull_tsl_mult': 0.22446358701414199, 'bull_time_stop': 180, 'bull_use_sma': False, 'bull_use_ema': True, 'bull_use_atr': False, 'bull_use_adx': True, 'bull_use_spike': False, 'bull_rsi_required': False, 'bear_strategy': 'mean_reversion', 'bear_bb_std_mult': 0.5031088072555937, 'bear_rsi_os': 16, 'bear_rsi_ob': 80, 'bear_adx_thresh': 26.898839847753656, 'bear_atr_min_pct': 0.009989864720194232, 'bear_atr_max_pct': 0.14072715344797054, 'bear_tp_mult': 1.9106557776822162, 'bear_tsl_mult': 0.16769519090154344, 'bear_time_stop': 142, 'bear_use_sma': True, 'bear_use_ema': False, 'bear_use_atr': True, 'bear_use_adx': True, 'bear_use_spike': True, 'bear_rsi_required': False, 'sideways_strategy': 'mean_reversion', 'sideways_bb_std_mult': 1.509721015935472, 'sideways_rsi_os': 44, 'sideways_rsi_ob': 60, 'sideways_adx_thresh': 11.20161128130225, 'sideways_atr_min_pct': 0.00909718014184694, 'sideways_atr_max_pct': 0.12148698834110849, 'sideways_tp_mult': 1.0890900816860007, 'sideways_tsl_mult': 0.317536603121897, 'sideways_time_stop': 186, 'sideways_use_sma': False, 'sideways_use_ema': False, 'sideways_use_atr': False, 'sideways_use_adx': False, 'sideways_use_spike': True, 'sideways_rsi_required': False}.
[I 2025-08-31 00:27:44,681] Trial 217 finished with values: [-1000000000.0, 1000000000.0] and parameters: {'p_sma': 49, 'p_std': 37, 'p_atr': 13, 'p_adx': 29, 'rsi_period': 40, 'ema1': 10, 'ema2': 12, 'slip_atr_k': 0.05944961664252706, 'slip_spread_k': 0.7222325352585536, 'spread_hl_frac': 0.013253356884424004, 'bb_std_mult': 3.4661784687334456, 'rsi_os': 55, 'rsi_ob': 75, 'vol_spike': 0.05650938768216436, 'adx_thresh': 12.191417637755608, 'atr_min_pct': 0.0006264069900679887, 'atr_max_pct': 0.07378959682380389, 'tp_mult': 2.524271347389915, 'tsl_mult': 0.7704228406443303, 'strategy': 'mean_reversion', 'time_stop': 32, 'use_sma': True, 'use_atr': True, 'use_adx': True, 'use_ema': False, 'use_spike': False, 'rsi_required': True, 'edge_k': 0.6663769590712194, 'edge_cap': 0.937420845093213, 'bull_strategy': 'breakout', 'bull_bb_std_mult': 2.6284385958254153, 'bull_rsi_os': 38, 'bull_rsi_ob': 46, 'bull_adx_thresh': 15.125234331870574, 'bull_atr_min_pct': 0.0006027972675525667, 'bull_atr_max_pct': 0.05193047247073901, 'bull_tp_mult': 2.9560515601072437, 'bull_tsl_mult': 0.6471833753399667, 'bull_time_stop': 119, 'bull_use_sma': False, 'bull_use_ema': True, 'bull_use_atr': True, 'bull_use_adx': True, 'bull_use_spike': False, 'bull_rsi_required': False, 'bear_strategy': 'breakout', 'bear_bb_std_mult': 0.7760348690695599, 'bear_rsi_os': 18, 'bear_rsi_ob': 78, 'bear_adx_thresh': 24.31586508742172, 'bear_atr_min_pct': 0.00986071108838715, 'bear_atr_max_pct': 0.13927571033790825, 'bear_tp_mult': 1.8956784169234409, 'bear_tsl_mult': 0.9898753938181069, 'bear_time_stop': 65, 'bear_use_sma': False, 'bear_use_ema': False, 'bear_use_atr': True, 'bear_use_adx': True, 'bear_use_spike': False, 'bear_rsi_required': False, 'sideways_strategy': 'breakout', 'sideways_bb_std_mult': 2.9219601677272258, 'sideways_rsi_os': 44, 'sideways_rsi_ob': 67, 'sideways_adx_thresh': 11.784390999508124, 'sideways_atr_min_pct': 0.027992403096732184, 'sideways_atr_max_pct': 0.13879916524292368, 'sideways_tp_mult': 2.378728888769081, 'sideways_tsl_mult': 0.11942295475821296, 'sideways_time_stop': 135, 'sideways_use_sma': False, 'sideways_use_ema': False, 'sideways_use_atr': True, 'sideways_use_adx': False, 'sideways_use_spike': True, 'sideways_rsi_required': False}.
