[I 2025-08-31 00:51:25,244] Trial 415 finished with values: [-1000000000.0, 1000000000.0] and parameters: {'p_sma': 39, 'p_std': 39, 'p_atr': 21, 'p_adx': 8, 'rsi_period': 58, 'ema1': 8, 'ema2': 50, 'slip_atr_k': 0.029254040985215377, 'slip_spread_k': 0.24414398349395824, 'spread_hl_frac': 0.01218509320680233, 'bb_std_mult': 1.979539804802607, 'rsi_os': 42, 'rsi_ob': 73, 'vol_spike': 0.18722499069319853, 'adx_thresh': 10.765641827024758, 'atr_min_pct': 0.022790876199973668, 'atr_max_pct': 0.013550675562191541, 'tp_mult': 2.7541356627573013, 'tsl_mult': 0.142701876834623, 'strategy': 'breakout', 'time_stop': 152, 'use_sma': True, 'use_atr': False, 'use_adx': False, 'use_ema': True, 'use_spike': False, 'rsi_required': True, 'edge_k': 0.8047141326692645, 'edge_cap': 0.8375691677379279, 'bull_strategy': 'breakout', 'bull_bb_std_mult': 2.7667505427992607, 'bull_rsi_os': 39, 'bull_rsi_ob': 69, 'bull_adx_thresh': 23.557873934627388, 'bull_atr_min_pct': 0.0012121260217685505, 'bull_atr_max_pct': 0.07339397203991695, 'bull_tp_mult': 2.3907486346224807, 'bull_tsl_mult': 0.36517719194861376, 'bull_time_stop': 162, 'bull_use_sma': False, 'bull_use_ema': False, 'bull_use_atr': True, 'bull_use_adx': True, 'bull_use_spike': False, 'bull_rsi_required': False, 'bear_strategy': 'mean_reversion', 'bear_bb_std_mult': 1.2492692302573343, 'bear_rsi_os': 38, 'bear_rsi_ob': 84, 'bear_adx_thresh': 9.208365921783276, 'bear_atr_min_pct': 0.012624242260006835, 'bear_atr_max_pct': 0.022224927276625967, 'bear_tp_mult': 1.9146889971389103, 'bear_tsl_mult': 0.6738066087368858, 'bear_time_stop': 27, 'bear_use_sma': True, 'bear_use_ema': False, 'bear_use_atr': False, 'bear_use_adx': True, 'bear_use_spike': True, 'bear_rsi_required': False, 'sideways_strategy': 'mean_reversion', 'sideways_bb_std_mult': 1.4798515203745466, 'sideways_rsi_os': 20, 'sideways_rsi_ob': 89, 'sideways_adx_thresh': 30.437147041001417, 'sideways_atr_min_pct': 0.02152220765495286, 'sideways_atr_max_pct': 0.09837047782537305, 'sideways_tp_mult': 2.6649729336080794, 'sideways_tsl_mult': 0.6854570005677372, 'sideways_time_stop': 127, 'sideways_use_sma': True, 'sideways_use_ema': False, 'sideways_use_atr': False, 'sideways_use_adx': False, 'sideways_use_spike': True, 'sideways_rsi_required': False}.
[I 2025-08-31 00:51:25,302] Trial 416 finished with values: [-1000000000.0, 1000000000.0] and parameters: {'p_sma': 42, 'p_std': 39, 'p_atr': 21, 'p_adx': 8, 'rsi_period': 57, 'ema1': 28, 'ema2': 50, 'slip_atr_k': 0.032224008105525906, 'slip_spread_k': 0.24631976827000668, 'spread_hl_frac': 0.011988646432041245, 'bb_std_mult': 1.8224812255809755, 'rsi_os': 28, 'rsi_ob': 74, 'vol_spike': 0.18606955696230862, 'adx_thresh': 18.302784934473358, 'atr_min_pct': 0.023006670499113674, 'atr_max_pct': 0.010826312562287263, 'tp_mult': 2.6390986780697157, 'tsl_mult': 0.8249499713739183, 'strategy': 'breakout', 'time_stop': 79, 'use_sma': True, 'use_atr': False, 'use_adx': True, 'use_ema': False, 'use_spike': False, 'rsi_required': True, 'edge_k': 0.8087674345732642, 'edge_cap': 0.6761415020814001, 'bull_strategy': 'breakout', 'bull_bb_std_mult': 0.9067606223770117, 'bull_rsi_os': 39, 'bull_rsi_ob': 72, 'bull_adx_thresh': 16.855667614922528, 'bull_atr_min_pct': 0.00010585592196330265, 'bull_atr_max_pct': 0.07356066098478907, 'bull_tp_mult': 2.404567046127027, 'bull_tsl_mult': 0.3715932737303749, 'bull_time_stop': 163, 'bull_use_sma': False, 'bull_use_ema': False, 'bull_use_atr': True, 'bull_use_adx': True, 'bull_use_spike': False, 'bull_rsi_required': False, 'bear_strategy': 'mean_reversion', 'bear_bb_std_mult': 1.1929730278204767, 'bear_rsi_os': 5, 'bear_rsi_ob': 69, 'bear_adx_thresh': 9.371439947523735, 'bear_atr_min_pct': 0.02656705788959269, 'bear_atr_max_pct': 0.02271214369239038, 'bear_tp_mult': 1.9056440316713594, 'bear_tsl_mult': 0.5141186162979264, 'bear_time_stop': 23, 'bear_use_sma': False, 'bear_use_ema': False, 'bear_use_atr': False, 'bear_use_adx': True, 'bear_use_spike': True, 'bear_rsi_required': False, 'sideways_strategy': 'mean_reversion', 'sideways_bb_std_mult': 2.8586686992118002, 'sideways_rsi_os': 30, 'sideways_rsi_ob': 90, 'sideways_adx_thresh': 12.25971543641215, 'sideways_atr_min_pct': 0.02147357271422781, 'sideways_atr_max_pct': 0.14218558763627157, 'sideways_tp_mult': 1.4845329460447583, 'sideways_tsl_mult': 0.6909428598916598, 'sideways_time_stop': 10, 'sideways_use_sma': True, 'sideways_use_ema': False, 'sideways_use_atr': False, 'sideways_use_adx': False, 'sideways_use_spike': True, 'sideways_rsi_required': False}.
[I 2025-08-31 00:51:25,322] Trial 417 finished with values: [-1000000000.0, 1000000000.0] and parameters: {'p_sma': 50, 'p_std': 37, 'p_atr': 21, 'p_adx': 8, 'rsi_period': 7, 'ema1': 8, 'ema2': 20, 'slip_atr_k': 0.08744041595249011, 'slip_spread_k': 0.2628716202866362, 'spread_hl_frac': 0.04933788477895834, 'bb_std_mult': 1.1931402727959917, 'rsi_os': 53, 'rsi_ob': 74, 'vol_spike': 0.18653533344217754, 'adx_thresh': 13.291482139315356, 'atr_min_pct': 0.022617402450123718, 'atr_max_pct': 0.012430469479973352, 'tp_mult': 1.4897592728763738, 'tsl_mult': 0.29991727891135456, 'strategy': 'breakout', 'time_stop': 187, 'use_sma': True, 'use_atr': False, 'use_adx': False, 'use_ema': False, 'use_spike': False, 'rsi_required': True, 'edge_k': 0.8153042679561092, 'edge_cap': 0.838584155999679, 'bull_strategy': 'breakout', 'bull_bb_std_mult': 2.8811326895162557, 'bull_rsi_os': 54, 'bull_rsi_ob': 72, 'bull_adx_thresh': 14.142461211926703, 'bull_atr_min_pct': 7.71286698610825e-05, 'bull_atr_max_pct': 0.02833115672517158, 'bull_tp_mult': 2.2426009530589504, 'bull_tsl_mult': 0.0797154074167837, 'bull_time_stop': 165, 'bull_use_sma': False, 'bull_use_ema': False, 'bull_use_atr': True, 'bull_use_adx': True, 'bull_use_spike': False, 'bull_rsi_required': False, 'bear_strategy': 'mean_reversion', 'bear_bb_std_mult': 1.2483801622167778, 'bear_rsi_os': 39, 'bear_rsi_ob': 67, 'bear_adx_thresh': 9.205885078554402, 'bear_atr_min_pct': 0.006552508940224487, 'bear_atr_max_pct': 0.02199836859910653, 'bear_tp_mult': 1.905958330189283, 'bear_tsl_mult': 0.5136928532743587, 'bear_time_stop': 26, 'bear_use_sma': False, 'bear_use_ema': False, 'bear_use_atr': False, 'bear_use_adx': True, 'bear_use_spike': True, 'bear_rsi_required': False, 'sideways_strategy': 'mean_reversion', 'sideways_bb_std_mult': 2.861306857489723, 'sideways_rsi_os': 13, 'sideways_rsi_ob': 52, 'sideways_adx_thresh': 30.398795130792752, 'sideways_atr_min_pct': 0.021242452828061937, 'sideways_atr_max_pct': 0.1421004724160658, 'sideways_tp_mult': 1.9555991940405657, 'sideways_tsl_mult': 0.6879687112892144, 'sideways_time_stop': 164, 'sideways_use_sma': True, 'sideways_use_ema': False, 'sideways_use_atr': False, 'sideways_use_adx': False, 'sideways_use_spike': True, 'sideways_rsi_required': True}.
[I 2025-08-31 00:51:27,960] Trial 418 finished with values: [-1000000000.0, 1000000000.0] and parameters: {'p_sma': 14, 'p_std': 36, 'p_atr': 22, 'p_adx': 8, 'rsi_period': 56, 'ema1': 8, 'ema2': 36, 'slip_atr_k': 0.02263146165544641, 'slip_spread_k': 0.9272780471991167, 'spread_hl_frac': 0.0470414162134803, 'bb_std_mult': 1.492927836062981, 'rsi_os': 33, 'rsi_ob': 74, 'vol_spike': 0.21259962830290235, 'adx_thresh': 13.1902516365737, 'atr_min_pct': 0.017621135894123622, 'atr_max_pct': 0.01042695085873302, 'tp_mult': 2.6429941403366493, 'tsl_mult': 0.8250014045025365, 'strategy': 'breakout', 'time_stop': 67, 'use_sma': True, 'use_atr': False, 'use_adx': False, 'use_ema': False, 'use_spike': False, 'rsi_required': True, 'edge_k': 0.7359758116811722, 'edge_cap': 0.7820217743110486, 'bull_strategy': 'breakout', 'bull_bb_std_mult': 2.8747636110186083, 'bull_rsi_os': 5, 'bull_rsi_ob': 47, 'bull_adx_thresh': 14.00308887173809, 'bull_atr_min_pct': 0.0021197376845390544, 'bull_atr_max_pct': 0.07785560196116575, 'bull_tp_mult': 2.4654458176314367, 'bull_tsl_mult': 0.00094829840039512, 'bull_time_stop': 166, 'bull_use_sma': False, 'bull_use_ema': False, 'bull_use_atr': True, 'bull_use_adx': False, 'bull_use_spike': True, 'bull_rsi_required': False, 'bear_strategy': 'mean_reversion', 'bear_bb_std_mult': 2.9367405765823715, 'bear_rsi_os': 53, 'bear_rsi_ob': 75, 'bear_adx_thresh': 25.016867673825033, 'bear_atr_min_pct': 0.009244791754570632, 'bear_atr_max_pct': 0.02247745949008527, 'bear_tp_mult': 2.573562612750112, 'bear_tsl_mult': 0.51513283268721, 'bear_time_stop': 21, 'bear_use_sma': False, 'bear_use_ema': False, 'bear_use_atr': False, 'bear_use_adx': True, 'bear_use_spike': True, 'bear_rsi_required': False, 'sideways_strategy': 'mean_reversion', 'sideways_bb_std_mult': 1.0550619006438975, 'sideways_rsi_os': 46, 'sideways_rsi_ob': 51, 'sideways_adx_thresh': 12.357106025552236, 'sideways_atr_min_pct': 0.021578657532748898, 'sideways_atr_max_pct': 0.011982231078823291, 'sideways_tp_mult': 2.024024559007047, 'sideways_tsl_mult': 0.6946871625916285, 'sideways_time_stop': 30, 'sideways_use_sma': True, 'sideways_use_ema': False, 'sideways_use_atr': True, 'sideways_use_adx': False, 'sideways_use_spike': True, 'sideways_rsi_required': True}.
[I 2025-08-31 00:51:42,711] Trial 421 finished with values: [-1000000000.0, 1000000000.0] and parameters: {'p_sma': 47, 'p_std': 38, 'p_atr': 22, 'p_adx': 7, 'rsi_period': 16, 'ema1': 23, 'ema2': 18, 'slip_atr_k': 0.034917076913796134, 'slip_spread_k': 0.301296694551876, 'spread_hl_frac': 0.009297246401028005, 'bb_std_mult': 0.9385660555600023, 'rsi_os': 54, 'rsi_ob': 73, 'vol_spike': 0.1597464761840015, 'adx_thresh': 19.655079787514858, 'atr_min_pct': 0.011851488644409396, 'atr_max_pct': 0.02757979594264736, 'tp_mult': 2.809853658179436, 'tsl_mult': 0.16835282268940355, 'strategy': 'mean_reversion', 'time_stop': 86, 'use_sma': True, 'use_atr': True, 'use_adx': False, 'use_ema': True, 'use_spike': False, 'rsi_required': False, 'edge_k': 0.20570575813197556, 'edge_cap': 0.45277823438814946, 'bull_strategy': 'breakout', 'bull_bb_std_mult': 0.6272013748770966, 'bull_rsi_os': 10, 'bull_rsi_ob': 94, 'bull_adx_thresh': 13.26555642588583, 'bull_atr_min_pct': 0.0011834287890582682, 'bull_atr_max_pct': 0.08065579857200145, 'bull_tp_mult': 2.485984246509301, 'bull_tsl_mult': 0.34382371711583337, 'bull_time_stop': 171, 'bull_use_sma': True, 'bull_use_ema': False, 'bull_use_atr': True, 'bull_use_adx': True, 'bull_use_spike': False, 'bull_rsi_required': False, 'bear_strategy': 'mean_reversion', 'bear_bb_std_mult': 1.1198091618137385, 'bear_rsi_os': 51, 'bear_rsi_ob': 78, 'bear_adx_thresh': 22.89151912162256, 'bear_atr_min_pct': 0.00402957309683776, 'bear_atr_max_pct': 0.018492468604047973, 'bear_tp_mult': 1.773109617609093, 'bear_tsl_mult': 0.4138365683725477, 'bear_time_stop': 37, 'bear_use_sma': True, 'bear_use_ema': False, 'bear_use_atr': False, 'bear_use_adx': True, 'bear_use_spike': False, 'bear_rsi_required': False, 'sideways_strategy': 'mean_reversion', 'sideways_bb_std_mult': 1.06944755216173, 'sideways_rsi_os': 25, 'sideways_rsi_ob': 92, 'sideways_adx_thresh': 13.34962110183098, 'sideways_atr_min_pct': 0.018912303512703624, 'sideways_atr_max_pct': 0.14990599422964887, 'sideways_tp_mult': 1.2520709952943003, 'sideways_tsl_mult': 0.7210167194046726, 'sideways_time_stop': 154, 'sideways_use_sma': True, 'sideways_use_ema': False, 'sideways_use_atr': True, 'sideways_use_adx': True, 'sideways_use_spike': True, 'sideways_rsi_required': False}.
[I 2025-08-31 00:51:48,490] Trial 414 finished with values: [-1000000000.0, 1000000000.0] and parameters: {'p_sma': 59, 'p_std': 15, 'p_atr': 21, 'p_adx': 8, 'rsi_period': 63, 'ema1': 7, 'ema2': 18, 'slip_atr_k': 0.02913792026506682, 'slip_spread_k': 0.26191980187342523, 'spread_hl_frac': 0.011886256313330021, 'bb_std_mult': 1.6252851290150288, 'rsi_os': 13, 'rsi_ob': 74, 'vol_spike': 0.18855544870613483, 'adx_thresh': 10.976360906320009, 'atr_min_pct': 0.026568757240135767, 'atr_max_pct': 0.066756608361068, 'tp_mult': 1.3172709248948522, 'tsl_mult': 0.14361319087522736, 'strategy': 'breakout', 'time_stop': 274, 'use_sma': False, 'use_atr': False, 'use_adx': True, 'use_ema': True, 'use_spike': False, 'rsi_required': True, 'edge_k': 0.8101003300796569, 'edge_cap': 0.8486952138352363, 'bull_strategy': 'mean_reversion', 'bull_bb_std_mult': 2.760259318419009, 'bull_rsi_os': 40, 'bull_rsi_ob': 70, 'bull_adx_thresh': 13.194637904364107, 'bull_atr_min_pct': 0.0011779435106905635, 'bull_atr_max_pct': 0.07384898777020484, 'bull_tp_mult': 2.4072101645398747, 'bull_tsl_mult': 0.659412016245031, 'bull_time_stop': 161, 'bull_use_sma': True, 'bull_use_ema': True, 'bull_use_atr': True, 'bull_use_adx': True, 'bull_use_spike': False, 'bull_rsi_required': False, 'bear_strategy': 'breakout', 'bear_bb_std_mult': 1.2436105270137743, 'bear_rsi_os': 38, 'bear_rsi_ob': 79, 'bear_adx_thresh': 7.7283090502208145, 'bear_atr_min_pct': 0.01268945862379495, 'bear_atr_max_pct': 0.01935511265627991, 'bear_tp_mult': 2.465769588696839, 'bear_tsl_mult': 0.7129469287423966, 'bear_time_stop': 20, 'bear_use_sma': True, 'bear_use_ema': False, 'bear_use_atr': False, 'bear_use_adx': True, 'bear_use_spike': True, 'bear_rsi_required': False, 'sideways_strategy': 'mean_reversion', 'sideways_bb_std_mult': 1.0544011197130605, 'sideways_rsi_os': 24, 'sideways_rsi_ob': 63, 'sideways_adx_thresh': 11.592795971050299, 'sideways_atr_min_pct': 0.009274950510338175, 'sideways_atr_max_pct': 0.14254644512381334, 'sideways_tp_mult': 1.4793194673742196, 'sideways_tsl_mult': 0.68492160844353, 'sideways_time_stop': 181, 'sideways_use_sma': True, 'sideways_use_ema': True, 'sideways_use_atr': False, 'sideways_use_adx': False, 'sideways_use_spike': False, 'sideways_rsi_required': False}.
[I 2025-08-31 00:51:57,798] Trial 420 finished with values: [-1000000000.0, 1000000000.0] and parameters: {'p_sma': 47, 'p_std': 41, 'p_atr': 22, 'p_adx': 27, 'rsi_period': 80, 'ema1': 29, 'ema2': 33, 'slip_atr_k': 0.03488194007273397, 'slip_spread_k': 0.27413567627547136, 'spread_hl_frac': 0.007229403808560341, 'bb_std_mult': 3.0810870176806255, 'rsi_os': 49, 'rsi_ob': 75, 'vol_spike': 0.16821548837560357, 'adx_thresh': 12.59052656456457, 'atr_min_pct': 0.025683982119559426, 'atr_max_pct': 0.06936278793654549, 'tp_mult': 2.8008528435913216, 'tsl_mult': 0.15997195834485042, 'strategy': 'breakout', 'time_stop': 90, 'use_sma': True, 'use_atr': True, 'use_adx': False, 'use_ema': True, 'use_spike': False, 'rsi_required': False, 'edge_k': 0.7459769507522112, 'edge_cap': 0.45963154991000005, 'bull_strategy': 'breakout', 'bull_bb_std_mult': 1.525770129898182, 'bull_rsi_os': 8, 'bull_rsi_ob': 54, 'bull_adx_thresh': 13.132767600109586, 'bull_atr_min_pct': 0.01049370839405209, 'bull_atr_max_pct': 0.07805641767061551, 'bull_tp_mult': 2.4832548323802555, 'bull_tsl_mult': 0.29842064096729926, 'bull_time_stop': 169, 'bull_use_sma': True, 'bull_use_ema': False, 'bull_use_atr': True, 'bull_use_adx': False, 'bull_use_spike': True, 'bull_rsi_required': False, 'bear_strategy': 'mean_reversion', 'bear_bb_std_mult': 1.102889640293131, 'bear_rsi_os': 21, 'bear_rsi_ob': 78, 'bear_adx_thresh': 25.09004950563314, 'bear_atr_min_pct': 0.009065161785958648, 'bear_atr_max_pct': 0.018399432425296836, 'bear_tp_mult': 2.7505233430386613, 'bear_tsl_mult': 0.45236338199032267, 'bear_time_stop': 168, 'bear_use_sma': True, 'bear_use_ema': False, 'bear_use_atr': False, 'bear_use_adx': True, 'bear_use_spike': False, 'bear_rsi_required': False, 'sideways_strategy': 'mean_reversion', 'sideways_bb_std_mult': 3.074389839904224, 'sideways_rsi_os': 46, 'sideways_rsi_ob': 91, 'sideways_adx_thresh': 12.288294209401538, 'sideways_atr_min_pct': 0.008158664921441013, 'sideways_atr_max_pct': 0.14671537571529003, 'sideways_tp_mult': 1.2573658861203707, 'sideways_tsl_mult': 0.7137650294111599, 'sideways_time_stop': 283, 'sideways_use_sma': True, 'sideways_use_ema': False, 'sideways_use_atr': True, 'sideways_use_adx': True, 'sideways_use_spike': True, 'sideways_rsi_required': False}.
[I 2025-08-31 00:51:57,936] Trial 419 finished with values: [-1000000000.0, 1000000000.0] and parameters: {'p_sma': 50, 'p_std': 37, 'p_atr': 22, 'p_adx': 8, 'rsi_period': 71, 'ema1': 23, 'ema2': 36, 'slip_atr_k': 0.03485621879379164, 'slip_spread_k': 0.2637965532567246, 'spread_hl_frac': 0.007337188640169724, 'bb_std_mult': 1.3469488130597835, 'rsi_os': 15, 'rsi_ob': 74, 'vol_spike': 0.2143833107820817, 'adx_thresh': 13.133299142420269, 'atr_min_pct': 0.02183059968350204, 'atr_max_pct': 0.11025193874388488, 'tp_mult': 1.630374160908421, 'tsl_mult': 0.328678765074657, 'strategy': 'breakout', 'time_stop': 88, 'use_sma': True, 'use_atr': False, 'use_adx': False, 'use_ema': False, 'use_spike': False, 'rsi_required': False, 'edge_k': 0.2243536109777703, 'edge_cap': 0.8198450020649248, 'bull_strategy': 'breakout', 'bull_bb_std_mult': 2.9133568059616506, 'bull_rsi_os': 44, 'bull_rsi_ob': 94, 'bull_adx_thresh': 14.080149422861632, 'bull_atr_min_pct': 0.002392685698363546, 'bull_atr_max_pct': 0.07822577316600234, 'bull_tp_mult': 2.4770655272932007, 'bull_tsl_mult': 0.3118415615761152, 'bull_time_stop': 170, 'bull_use_sma': False, 'bull_use_ema': False, 'bull_use_atr': True, 'bull_use_adx': False, 'bull_use_spike': True, 'bull_rsi_required': False, 'bear_strategy': 'mean_reversion', 'bear_bb_std_mult': 1.6371196707305011, 'bear_rsi_os': 21, 'bear_rsi_ob': 76, 'bear_adx_thresh': 23.94177001354435, 'bear_atr_min_pct': 0.006688256015322521, 'bear_atr_max_pct': 0.0192521219826979, 'bear_tp_mult': 2.9445317047470256, 'bear_tsl_mult': 0.41489334877589557, 'bear_time_stop': 38, 'bear_use_sma': False, 'bear_use_ema': False, 'bear_use_atr': False, 'bear_use_adx': True, 'bear_use_spike': False, 'bear_rsi_required': False, 'sideways_strategy': 'mean_reversion', 'sideways_bb_std_mult': 1.0548681001097246, 'sideways_rsi_os': 42, 'sideways_rsi_ob': 51, 'sideways_adx_thresh': 11.48802606945716, 'sideways_atr_min_pct': 0.022356986367947786, 'sideways_atr_max_pct': 0.14228696033326713, 'sideways_tp_mult': 1.953316261004559, 'sideways_tsl_mult': 0.7067736949718388, 'sideways_time_stop': 164, 'sideways_use_sma': True, 'sideways_use_ema': False, 'sideways_use_atr': True, 'sideways_use_adx': False, 'sideways_use_spike': True, 'sideways_rsi_required': True}.
[I 2025-08-31 00:51:58,934] Trial 425 finished with values: [-1000000000.0, 1000000000.0] and parameters: {'p_sma': 17, 'p_std': 42, 'p_atr': 8, 'p_adx': 26, 'rsi_period': 53, 'ema1': 19, 'ema2': 43, 'slip_atr_k': 0.04169678167248908, 'slip_spread_k': 0.9949058123151338, 'spread_hl_frac': 0.035333749206514345, 'bb_std_mult': 2.0860159184312526, 'rsi_os': 52, 'rsi_ob': 73, 'vol_spike': 0.22240300812642055, 'adx_thresh': 15.561928891147796, 'atr_min_pct': 0.015385833537495983, 'atr_max_pct': 0.07368893327577676, 'tp_mult': 2.56198206167298, 'tsl_mult': 0.11747819145452984, 'strategy': 'mean_reversion', 'time_stop': 178, 'use_sma': True, 'use_atr': False, 'use_adx': False, 'use_ema': True, 'use_spike': True, 'rsi_required': False, 'edge_k': 0.6919007936654689, 'edge_cap': 0.3984754245617403, 'bull_strategy': 'breakout', 'bull_bb_std_mult': 2.667058303765533, 'bull_rsi_os': 37, 'bull_rsi_ob': 69, 'bull_adx_thresh': 14.644808773425577, 'bull_atr_min_pct': 0.0006415010464334329, 'bull_atr_max_pct': 0.127705370848517, 'bull_tp_mult': 1.0843168132473682, 'bull_tsl_mult': 0.7114898808474861, 'bull_time_stop': 12, 'bull_use_sma': False, 'bull_use_ema': False, 'bull_use_atr': False, 'bull_use_adx': True, 'bull_use_spike': False, 'bull_rsi_required': True, 'bear_strategy': 'mean_reversion', 'bear_bb_std_mult': 1.3283426574134247, 'bear_rsi_os': 22, 'bear_rsi_ob': 74, 'bear_adx_thresh': 19.657328379601186, 'bear_atr_min_pct': 0.00794466166224341, 'bear_atr_max_pct': 0.026192839409083492, 'bear_tp_mult': 1.6715103270811198, 'bear_tsl_mult': 0.3896882017888462, 'bear_time_stop': 217, 'bear_use_sma': True, 'bear_use_ema': True, 'bear_use_atr': False, 'bear_use_adx': False, 'bear_use_spike': False, 'bear_rsi_required': True, 'sideways_strategy': 'breakout', 'sideways_bb_std_mult': 1.1652383169249427, 'sideways_rsi_os': 8, 'sideways_rsi_ob': 77, 'sideways_adx_thresh': 13.191653580968527, 'sideways_atr_min_pct': 0.024586576832726092, 'sideways_atr_max_pct': 0.07962519365324974, 'sideways_tp_mult': 1.7440018902628311, 'sideways_tsl_mult': 0.7522717431230196, 'sideways_time_stop': 201, 'sideways_use_sma': True, 'sideways_use_ema': False, 'sideways_use_atr': False, 'sideways_use_adx': False, 'sideways_use_spike': True, 'sideways_rsi_required': False}.
