[I 2025-08-31 00:39:32,251] Trial 324 finished with values: [-1000000000.0, 1000000000.0] and parameters: {'p_sma': 56, 'p_std': 36, 'p_atr': 28, 'p_adx': 23, 'rsi_period': 54, 'ema1': 13, 'ema2': 21, 'slip_atr_k': 0.12750913485272206, 'slip_spread_k': 0.26542577908924986, 'spread_hl_frac': 0.010420504405647827, 'bb_std_mult': 2.2714619210295957, 'rsi_os': 50, 'rsi_ob': 76, 'vol_spike': 0.2774471779754986, 'adx_thresh': 34.862256055597484, 'atr_min_pct': 0.00963052856619658, 'atr_max_pct': 0.06558201783692197, 'tp_mult': 2.4613472216065717, 'tsl_mult': 0.10587772655337473, 'strategy': 'breakout', 'time_stop': 78, 'use_sma': True, 'use_atr': True, 'use_adx': False, 'use_ema': True, 'use_spike': False, 'rsi_required': False, 'edge_k': 0.7031320127006027, 'edge_cap': 0.8240821616732811, 'bull_strategy': 'breakout', 'bull_bb_std_mult': 3.017343735357387, 'bull_rsi_os': 15, 'bull_rsi_ob': 60, 'bull_adx_thresh': 16.90263275436834, 'bull_atr_min_pct': 0.0005478292786134339, 'bull_atr_max_pct': 0.0832062205332316, 'bull_tp_mult': 2.0975799100522767, 'bull_tsl_mult': 0.13744992348253982, 'bull_time_stop': 164, 'bull_use_sma': True, 'bull_use_ema': False, 'bull_use_atr': True, 'bull_use_adx': True, 'bull_use_spike': False, 'bull_rsi_required': False, 'bear_strategy': 'mean_reversion', 'bear_bb_std_mult': 1.1381449355875455, 'bear_rsi_os': 50, 'bear_rsi_ob': 63, 'bear_adx_thresh': 7.761480972931991, 'bear_atr_min_pct': 0.008070333691323987, 'bear_atr_max_pct': 0.012900907489818984, 'bear_tp_mult': 1.9668463020590259, 'bear_tsl_mult': 0.627982636818857, 'bear_time_stop': 36, 'bear_use_sma': True, 'bear_use_ema': False, 'bear_use_atr': False, 'bear_use_adx': True, 'bear_use_spike': False, 'bear_rsi_required': False, 'sideways_strategy': 'mean_reversion', 'sideways_bb_std_mult': 1.1280892943580656, 'sideways_rsi_os': 8, 'sideways_rsi_ob': 87, 'sideways_adx_thresh': 10.793798483637653, 'sideways_atr_min_pct': 0.024016723708507257, 'sideways_atr_max_pct': 0.13261718149746565, 'sideways_tp_mult': 1.1320957977853827, 'sideways_tsl_mult': 0.8628569306732186, 'sideways_time_stop': 176, 'sideways_use_sma': True, 'sideways_use_ema': False, 'sideways_use_atr': False, 'sideways_use_adx': False, 'sideways_use_spike': True, 'sideways_rsi_required': False}.
[I 2025-08-31 00:39:33,172] Trial 325 finished with values: [-1000000000.0, 1000000000.0] and parameters: {'p_sma': 14, 'p_std': 39, 'p_atr': 28, 'p_adx': 23, 'rsi_period': 53, 'ema1': 13, 'ema2': 16, 'slip_atr_k': 0.050476090377260745, 'slip_spread_k': 0.2906894538185214, 'spread_hl_frac': 0.010331717153763628, 'bb_std_mult': 1.3395622280561597, 'rsi_os': 50, 'rsi_ob': 71, 'vol_spike': 0.22401012326663414, 'adx_thresh': 23.30935687860253, 'atr_min_pct': 0.0038820508970747016, 'atr_max_pct': 0.021645612829050344, 'tp_mult': 2.3205389342993135, 'tsl_mult': 0.2679826939430785, 'strategy': 'breakout', 'time_stop': 107, 'use_sma': True, 'use_atr': False, 'use_adx': False, 'use_ema': True, 'use_spike': False, 'rsi_required': False, 'edge_k': 1.999772975445055, 'edge_cap': 0.8323317959626745, 'bull_strategy': 'mean_reversion', 'bull_bb_std_mult': 3.193012439528284, 'bull_rsi_os': 36, 'bull_rsi_ob': 71, 'bull_adx_thresh': 15.169736324749453, 'bull_atr_min_pct': 0.0008918239277519774, 'bull_atr_max_pct': 0.07242799145811504, 'bull_tp_mult': 2.1302717962972895, 'bull_tsl_mult': 0.2927018183129949, 'bull_time_stop': 162, 'bull_use_sma': True, 'bull_use_ema': False, 'bull_use_atr': True, 'bull_use_adx': True, 'bull_use_spike': False, 'bull_rsi_required': False, 'bear_strategy': 'mean_reversion', 'bear_bb_std_mult': 3.1659275552290267, 'bear_rsi_os': 25, 'bear_rsi_ob': 86, 'bear_adx_thresh': 8.696425931884699, 'bear_atr_min_pct': 0.007967963661935728, 'bear_atr_max_pct': 0.012874801905907039, 'bear_tp_mult': 1.96389948541413, 'bear_tsl_mult': 0.7050126397144497, 'bear_time_stop': 300, 'bear_use_sma': True, 'bear_use_ema': False, 'bear_use_atr': False, 'bear_use_adx': True, 'bear_use_spike': False, 'bear_rsi_required': False, 'sideways_strategy': 'mean_reversion', 'sideways_bb_std_mult': 0.6806512531002187, 'sideways_rsi_os': 47, 'sideways_rsi_ob': 88, 'sideways_adx_thresh': 10.732493037090975, 'sideways_atr_min_pct': 0.022705942960338763, 'sideways_atr_max_pct': 0.08145344080528703, 'sideways_tp_mult': 2.055183226982769, 'sideways_tsl_mult': 0.7482800014785647, 'sideways_time_stop': 153, 'sideways_use_sma': True, 'sideways_use_ema': False, 'sideways_use_atr': False, 'sideways_use_adx': False, 'sideways_use_spike': True, 'sideways_rsi_required': False}.
[I 2025-08-31 00:39:33,242] Trial 326 finished with values: [-0.029810728914622442, 0.02970579350476964] and parameters: {'p_sma': 49, 'p_std': 32, 'p_atr': 22, 'p_adx': 8, 'rsi_period': 54, 'ema1': 13, 'ema2': 39, 'slip_atr_k': 0.21519820809256668, 'slip_spread_k': 0.28663275866099425, 'spread_hl_frac': 0.011801160467624068, 'bb_std_mult': 1.4162062739901966, 'rsi_os': 45, 'rsi_ob': 74, 'vol_spike': 0.2496448036500936, 'adx_thresh': 17.709547188789138, 'atr_min_pct': 0.02542780210801586, 'atr_max_pct': 0.04737787105113081, 'tp_mult': 2.5091154759614294, 'tsl_mult': 0.7812380637109002, 'strategy': 'mean_reversion', 'time_stop': 107, 'use_sma': True, 'use_atr': False, 'use_adx': False, 'use_ema': True, 'use_spike': False, 'rsi_required': False, 'edge_k': 0.3182452107887487, 'edge_cap': 0.8244095166437694, 'bull_strategy': 'mean_reversion', 'bull_bb_std_mult': 3.0175192989577484, 'bull_rsi_os': 39, 'bull_rsi_ob': 71, 'bull_adx_thresh': 15.605591751488337, 'bull_atr_min_pct': 0.0006318219924370224, 'bull_atr_max_pct': 0.14957822338430143, 'bull_tp_mult': 2.1208095122026447, 'bull_tsl_mult': 0.993763479773089, 'bull_time_stop': 86, 'bull_use_sma': False, 'bull_use_ema': False, 'bull_use_atr': True, 'bull_use_adx': True, 'bull_use_spike': False, 'bull_rsi_required': False, 'bear_strategy': 'mean_reversion', 'bear_bb_std_mult': 2.5888152389578125, 'bear_rsi_os': 25, 'bear_rsi_ob': 72, 'bear_adx_thresh': 5.12225705492156, 'bear_atr_min_pct': 0.008066566976070454, 'bear_atr_max_pct': 0.09488545116512605, 'bear_tp_mult': 1.9636806906105746, 'bear_tsl_mult': 0.6978704881407501, 'bear_time_stop': 37, 'bear_use_sma': True, 'bear_use_ema': False, 'bear_use_atr': False, 'bear_use_adx': True, 'bear_use_spike': False, 'bear_rsi_required': True, 'sideways_strategy': 'breakout', 'sideways_bb_std_mult': 0.681649593803886, 'sideways_rsi_os': 47, 'sideways_rsi_ob': 92, 'sideways_adx_thresh': 17.293159657597705, 'sideways_atr_min_pct': 0.021565018144642817, 'sideways_atr_max_pct': 0.04955418955917287, 'sideways_tp_mult': 1.1320073617376893, 'sideways_tsl_mult': 0.7465721572966564, 'sideways_time_stop': 151, 'sideways_use_sma': True, 'sideways_use_ema': False, 'sideways_use_atr': False, 'sideways_use_adx': False, 'sideways_use_spike': True, 'sideways_rsi_required': False}.
[I 2025-08-31 00:39:33,798] Trial 330 finished with values: [-1000000000.0, 1000000000.0] and parameters: {'p_sma': 46, 'p_std': 27, 'p_atr': 22, 'p_adx': 20, 'rsi_period': 13, 'ema1': 8, 'ema2': 18, 'slip_atr_k': 0.030677375360190086, 'slip_spread_k': 0.2016081267338879, 'spread_hl_frac': 0.008123486637223891, 'bb_std_mult': 1.7191696556225846, 'rsi_os': 41, 'rsi_ob': 48, 'vol_spike': 0.12725603193986001, 'adx_thresh': 12.826934663429004, 'atr_min_pct': 0.013783229244809441, 'atr_max_pct': 0.07455464250597918, 'tp_mult': 2.6472137208808313, 'tsl_mult': 0.1721397679900209, 'strategy': 'mean_reversion', 'time_stop': 217, 'use_sma': True, 'use_atr': False, 'use_adx': True, 'use_ema': True, 'use_spike': True, 'rsi_required': False, 'edge_k': 0.8636280972754037, 'edge_cap': 0.7903000943354103, 'bull_strategy': 'breakout', 'bull_bb_std_mult': 2.4865804341802473, 'bull_rsi_os': 37, 'bull_rsi_ob': 55, 'bull_adx_thresh': 25.208554473073093, 'bull_atr_min_pct': 0.026401388847353185, 'bull_atr_max_pct': 0.07194053081522009, 'bull_tp_mult': 1.5540037874397212, 'bull_tsl_mult': 0.1780335439074261, 'bull_time_stop': 197, 'bull_use_sma': False, 'bull_use_ema': False, 'bull_use_atr': True, 'bull_use_adx': True, 'bull_use_spike': False, 'bull_rsi_required': True, 'bear_strategy': 'mean_reversion', 'bear_bb_std_mult': 0.932946315967984, 'bear_rsi_os': 45, 'bear_rsi_ob': 87, 'bear_adx_thresh': 14.59446394492071, 'bear_atr_min_pct': 0.02080669569145857, 'bear_atr_max_pct': 0.03631889818922006, 'bear_tp_mult': 1.0612902556060244, 'bear_tsl_mult': 0.7538196112488763, 'bear_time_stop': 143, 'bear_use_sma': True, 'bear_use_ema': True, 'bear_use_atr': False, 'bear_use_adx': False, 'bear_use_spike': True, 'bear_rsi_required': True, 'sideways_strategy': 'breakout', 'sideways_bb_std_mult': 1.5056082414373475, 'sideways_rsi_os': 15, 'sideways_rsi_ob': 90, 'sideways_adx_thresh': 19.3290165934744, 'sideways_atr_min_pct': 0.020590469621077828, 'sideways_atr_max_pct': 0.14358287337505338, 'sideways_tp_mult': 1.0828087827368167, 'sideways_tsl_mult': 0.6294431123201596, 'sideways_time_stop': 282, 'sideways_use_sma': True, 'sideways_use_ema': True, 'sideways_use_atr': True, 'sideways_use_adx': False, 'sideways_use_spike': True, 'sideways_rsi_required': False}.
[I 2025-08-31 00:40:02,421] Trial 327 finished with values: [-0.02480449923012007, 0.02471056355407865] and parameters: {'p_sma': 48, 'p_std': 22, 'p_atr': 22, 'p_adx': 20, 'rsi_period': 62, 'ema1': 22, 'ema2': 53, 'slip_atr_k': 0.04807373875863753, 'slip_spread_k': 0.20975096321050268, 'spread_hl_frac': 0.01167535471939802, 'bb_std_mult': 1.7337783622776675, 'rsi_os': 48, 'rsi_ob': 74, 'vol_spike': 0.19589845541054343, 'adx_thresh': 34.84340212131588, 'atr_min_pct': 0.0039036506446676767, 'atr_max_pct': 0.06533814718195899, 'tp_mult': 2.53007326141607, 'tsl_mult': 0.10604532059320403, 'strategy': 'mean_reversion', 'time_stop': 218, 'use_sma': True, 'use_atr': False, 'use_adx': True, 'use_ema': True, 'use_spike': False, 'rsi_required': False, 'edge_k': 0.12004762802090341, 'edge_cap': 0.6978921199689069, 'bull_strategy': 'mean_reversion', 'bull_bb_std_mult': 3.0327393719159788, 'bull_rsi_os': 9, 'bull_rsi_ob': 71, 'bull_adx_thresh': 15.244448558144173, 'bull_atr_min_pct': 0.0010246401505249851, 'bull_atr_max_pct': 0.08281479079697819, 'bull_tp_mult': 2.4278494941662783, 'bull_tsl_mult': 0.6389684386874397, 'bull_time_stop': 196, 'bull_use_sma': False, 'bull_use_ema': False, 'bull_use_atr': True, 'bull_use_adx': True, 'bull_use_spike': False, 'bull_rsi_required': False, 'bear_strategy': 'mean_reversion', 'bear_bb_std_mult': 1.1533040465616577, 'bear_rsi_os': 50, 'bear_rsi_ob': 53, 'bear_adx_thresh': 9.042924421747124, 'bear_atr_min_pct': 0.008018475468135191, 'bear_atr_max_pct': 0.012607217579804798, 'bear_tp_mult': 1.8783606698134327, 'bear_tsl_mult': 0.7038765286351057, 'bear_time_stop': 35, 'bear_use_sma': True, 'bear_use_ema': False, 'bear_use_atr': False, 'bear_use_adx': True, 'bear_use_spike': False, 'bear_rsi_required': True, 'sideways_strategy': 'breakout', 'sideways_bb_std_mult': 1.0746090589130002, 'sideways_rsi_os': 47, 'sideways_rsi_ob': 92, 'sideways_adx_thresh': 13.993739839605471, 'sideways_atr_min_pct': 0.012311844220083294, 'sideways_atr_max_pct': 0.13222919411084388, 'sideways_tp_mult': 1.1617820747923333, 'sideways_tsl_mult': 0.06759765002198337, 'sideways_time_stop': 154, 'sideways_use_sma': True, 'sideways_use_ema': False, 'sideways_use_atr': False, 'sideways_use_adx': False, 'sideways_use_spike': True, 'sideways_rsi_required': False}.
[I 2025-08-31 00:40:03,249] Trial 328 finished with values: [-1000000000.0, 1000000000.0] and parameters: {'p_sma': 13, 'p_std': 39, 'p_atr': 30, 'p_adx': 8, 'rsi_period': 17, 'ema1': 8, 'ema2': 50, 'slip_atr_k': 0.024303205454026505, 'slip_spread_k': 0.20561668370612984, 'spread_hl_frac': 0.011858403873419764, 'bb_std_mult': 1.9074690063385324, 'rsi_os': 34, 'rsi_ob': 74, 'vol_spike': 0.19559839003249269, 'adx_thresh': 27.207381817578252, 'atr_min_pct': 0.0037356230261067457, 'atr_max_pct': 0.07970712723692323, 'tp_mult': 2.9008985427341973, 'tsl_mult': 0.1728137813745082, 'strategy': 'mean_reversion', 'time_stop': 164, 'use_sma': True, 'use_atr': False, 'use_adx': True, 'use_ema': True, 'use_spike': True, 'rsi_required': False, 'edge_k': 1.9907025052033256, 'edge_cap': 0.20407679697410097, 'bull_strategy': 'mean_reversion', 'bull_bb_std_mult': 3.073676447651494, 'bull_rsi_os': 37, 'bull_rsi_ob': 71, 'bull_adx_thresh': 15.301625265586889, 'bull_atr_min_pct': 0.02019083762440876, 'bull_atr_max_pct': 0.0726015658790249, 'bull_tp_mult': 2.333313536628405, 'bull_tsl_mult': 0.2921340749210889, 'bull_time_stop': 175, 'bull_use_sma': False, 'bull_use_ema': False, 'bull_use_atr': True, 'bull_use_adx': True, 'bull_use_spike': False, 'bull_rsi_required': True, 'bear_strategy': 'mean_reversion', 'bear_bb_std_mult': 3.1773017803863897, 'bear_rsi_os': 25, 'bear_rsi_ob': 72, 'bear_adx_thresh': 14.748003539079999, 'bear_atr_min_pct': 0.007999704295199238, 'bear_atr_max_pct': 0.017514018118488836, 'bear_tp_mult': 1.8805214814775049, 'bear_tsl_mult': 0.7018009520982638, 'bear_time_stop': 34, 'bear_use_sma': True, 'bear_use_ema': True, 'bear_use_atr': False, 'bear_use_adx': False, 'bear_use_spike': False, 'bear_rsi_required': True, 'sideways_strategy': 'breakout', 'sideways_bb_std_mult': 0.91173554234407, 'sideways_rsi_os': 6, 'sideways_rsi_ob': 91, 'sideways_adx_thresh': 8.723946930864873, 'sideways_atr_min_pct': 0.014681638811565045, 'sideways_atr_max_pct': 0.14555998884874682, 'sideways_tp_mult': 2.208649196968279, 'sideways_tsl_mult': 0.6488207231068214, 'sideways_time_stop': 158, 'sideways_use_sma': True, 'sideways_use_ema': True, 'sideways_use_atr': True, 'sideways_use_adx': False, 'sideways_use_spike': True, 'sideways_rsi_required': False}.
[I 2025-08-31 00:40:03,825] Trial 329 finished with values: [-1000000000.0, 1000000000.0] and parameters: {'p_sma': 26, 'p_std': 22, 'p_atr': 24, 'p_adx': 20, 'rsi_period': 61, 'ema1': 8, 'ema2': 48, 'slip_atr_k': 0.031134206143334456, 'slip_spread_k': 0.20590818310351666, 'spread_hl_frac': 0.008191014458503438, 'bb_std_mult': 1.7252924359556405, 'rsi_os': 48, 'rsi_ob': 74, 'vol_spike': 0.1936795634728041, 'adx_thresh': 13.062644294615346, 'atr_min_pct': 0.01755323467915358, 'atr_max_pct': 0.11719955108717547, 'tp_mult': 2.6262974056951496, 'tsl_mult': 0.1726611359633891, 'strategy': 'mean_reversion', 'time_stop': 176, 'use_sma': True, 'use_atr': False, 'use_adx': True, 'use_ema': True, 'use_spike': True, 'rsi_required': False, 'edge_k': 0.8399019579935916, 'edge_cap': 0.1955317378069686, 'bull_strategy': 'mean_reversion', 'bull_bb_std_mult': 3.1535709626262562, 'bull_rsi_os': 37, 'bull_rsi_ob': 70, 'bull_adx_thresh': 13.496353469578196, 'bull_atr_min_pct': 0.0014310186114375083, 'bull_atr_max_pct': 0.05825037038248762, 'bull_tp_mult': 2.3179707443880972, 'bull_tsl_mult': 0.1778008376880581, 'bull_time_stop': 198, 'bull_use_sma': False, 'bull_use_ema': False, 'bull_use_atr': True, 'bull_use_adx': True, 'bull_use_spike': False, 'bull_rsi_required': True, 'bear_strategy': 'mean_reversion', 'bear_bb_std_mult': 2.569457280135221, 'bear_rsi_os': 21, 'bear_rsi_ob': 53, 'bear_adx_thresh': 6.465200185211724, 'bear_atr_min_pct': 0.009465562425742636, 'bear_atr_max_pct': 0.01772206395589574, 'bear_tp_mult': 1.8708822533917617, 'bear_tsl_mult': 0.693464637388292, 'bear_time_stop': 33, 'bear_use_sma': True, 'bear_use_ema': True, 'bear_use_atr': False, 'bear_use_adx': False, 'bear_use_spike': True, 'bear_rsi_required': True, 'sideways_strategy': 'breakout', 'sideways_bb_std_mult': 1.0144980890490378, 'sideways_rsi_os': 47, 'sideways_rsi_ob': 49, 'sideways_adx_thresh': 19.570562575086083, 'sideways_atr_min_pct': 0.012492971917709513, 'sideways_atr_max_pct': 0.14338525616481612, 'sideways_tp_mult': 1.1435047052214382, 'sideways_tsl_mult': 0.6425299432802998, 'sideways_time_stop': 18, 'sideways_use_sma': True, 'sideways_use_ema': True, 'sideways_use_atr': True, 'sideways_use_adx': False, 'sideways_use_spike': True, 'sideways_rsi_required': False}.
[I 2025-08-31 00:40:04,509] Trial 331 finished with values: [-1000000000.0, 1000000000.0] and parameters: {'p_sma': 35, 'p_std': 38, 'p_atr': 30, 'p_adx': 9, 'rsi_period': 73, 'ema1': 14, 'ema2': 36, 'slip_atr_k': 0.0218888611716556, 'slip_spread_k': 0.22906146124409307, 'spread_hl_frac': 0.03704570895928361, 'bb_std_mult': 1.7591647976564522, 'rsi_os': 55, 'rsi_ob': 59, 'vol_spike': 0.19489649650981913, 'adx_thresh': 13.456511981091749, 'atr_min_pct': 0.02622384734099832, 'atr_max_pct': 0.04432310409841098, 'tp_mult': 1.6627180719553785, 'tsl_mult': 0.8101228504348421, 'strategy': 'breakout', 'time_stop': 174, 'use_sma': True, 'use_atr': False, 'use_adx': True, 'use_ema': True, 'use_spike': False, 'rsi_required': False, 'edge_k': 0.8068893168542884, 'edge_cap': 0.19602014179829885, 'bull_strategy': 'breakout', 'bull_bb_std_mult': 2.055413256376744, 'bull_rsi_os': 21, 'bull_rsi_ob': 95, 'bull_adx_thresh': 32.05349556677616, 'bull_atr_min_pct': 0.0012804664808748205, 'bull_atr_max_pct': 0.0567791171821497, 'bull_tp_mult': 2.4235834625198893, 'bull_tsl_mult': 0.45001331598795424, 'bull_time_stop': 233, 'bull_use_sma': False, 'bull_use_ema': False, 'bull_use_atr': True, 'bull_use_adx': False, 'bull_use_spike': False, 'bull_rsi_required': False, 'bear_strategy': 'mean_reversion', 'bear_bb_std_mult': 2.37166021635593, 'bear_rsi_os': 12, 'bear_rsi_ob': 79, 'bear_adx_thresh': 19.89236319165967, 'bear_atr_min_pct': 0.00928104201748124, 'bear_atr_max_pct': 0.017622029214552, 'bear_tp_mult': 1.8693560033949939, 'bear_tsl_mult': 0.6897714813887926, 'bear_time_stop': 291, 'bear_use_sma': True, 'bear_use_ema': False, 'bear_use_atr': False, 'bear_use_adx': True, 'bear_use_spike': False, 'bear_rsi_required': False, 'sideways_strategy': 'mean_reversion', 'sideways_bb_std_mult': 1.0246632991671099, 'sideways_rsi_os': 46, 'sideways_rsi_ob': 93, 'sideways_adx_thresh': 5.636125731490182, 'sideways_atr_min_pct': 0.014437933328602508, 'sideways_atr_max_pct': 0.02245785396620454, 'sideways_tp_mult': 1.1658824207520875, 'sideways_tsl_mult': 0.6560831206051635, 'sideways_time_stop': 186, 'sideways_use_sma': True, 'sideways_use_ema': False, 'sideways_use_atr': False, 'sideways_use_adx': False, 'sideways_use_spike': True, 'sideways_rsi_required': True}.
[I 2025-08-31 00:40:34,663] Trial 332 finished with values: [-1000000000.0, 1000000000.0] and parameters: {'p_sma': 47, 'p_std': 55, 'p_atr': 20, 'p_adx': 8, 'rsi_period': 62, 'ema1': 5, 'ema2': 17, 'slip_atr_k': 0.041865300791180546, 'slip_spread_k': 0.2083103417299943, 'spread_hl_frac': 0.011544957366081406, 'bb_std_mult': 1.8795198524443057, 'rsi_os': 48, 'rsi_ob': 73, 'vol_spike': 0.19621041087454982, 'adx_thresh': 11.844419683244375, 'atr_min_pct': 0.006394112460910399, 'atr_max_pct': 0.11641997687720243, 'tp_mult': 2.7057144858368165, 'tsl_mult': 0.11890561459865955, 'strategy': 'breakout', 'time_stop': 85, 'use_sma': True, 'use_atr': False, 'use_adx': True, 'use_ema': True, 'use_spike': False, 'rsi_required': False, 'edge_k': 0.7999355103426883, 'edge_cap': 0.20535162342514773, 'bull_strategy': 'breakout', 'bull_bb_std_mult': 2.8280895705221654, 'bull_rsi_os': 22, 'bull_rsi_ob': 70, 'bull_adx_thresh': 34.61741933100238, 'bull_atr_min_pct': 0.020140705340372354, 'bull_atr_max_pct': 0.06286125675416886, 'bull_tp_mult': 2.3592387558411403, 'bull_tsl_mult': 0.32208027775867637, 'bull_time_stop': 7, 'bull_use_sma': False, 'bull_use_ema': False, 'bull_use_atr': True, 'bull_use_adx': True, 'bull_use_spike': False, 'bull_rsi_required': False, 'bear_strategy': 'mean_reversion', 'bear_bb_std_mult': 1.1681529371733184, 'bear_rsi_os': 21, 'bear_rsi_ob': 81, 'bear_adx_thresh': 8.40272387866774, 'bear_atr_min_pct': 0.004351894309439249, 'bear_atr_max_pct': 0.032566039096524266, 'bear_tp_mult': 1.8922349104917067, 'bear_tsl_mult': 0.6898946327375823, 'bear_time_stop': 286, 'bear_use_sma': True, 'bear_use_ema': False, 'bear_use_atr': False, 'bear_use_adx': False, 'bear_use_spike': False, 'bear_rsi_required': False, 'sideways_strategy': 'mean_reversion', 'sideways_bb_std_mult': 1.2440614577732374, 'sideways_rsi_os': 48, 'sideways_rsi_ob': 91, 'sideways_adx_thresh': 12.008093445381947, 'sideways_atr_min_pct': 0.01276434665455694, 'sideways_atr_max_pct': 0.022346782055499476, 'sideways_tp_mult': 1.073717302652358, 'sideways_tsl_mult': 0.9184694841448483, 'sideways_time_stop': 195, 'sideways_use_sma': True, 'sideways_use_ema': False, 'sideways_use_atr': False, 'sideways_use_adx': False, 'sideways_use_spike': True, 'sideways_rsi_required': True}.
