[I 2025-09-01 08:47:11,229] Trial 532 finished with values: [-1000000000.0, 1000000000.0] and parameters: {'p_sma': 18, 'p_std': 18, 'p_atr': 20, 'p_adx': 20, 'rsi_period': 56, 'ema1': 25, 'ema2': 54, 'slip_atr_k': 0.12325170962549357, 'slip_spread_k': 0.5321490057076694, 'spread_hl_frac': 0.04171123399524314, 'bb_std_mult': 3.2256093019035124, 'rsi_os': 24, 'rsi_ob': 72, 'vol_spike': 0.2441455890760371, 'adx_thresh': 16.177572582871342, 'atr_min_pct': 0.02032923765749813, 'atr_max_pct': 0.14996235887421194, 'tp_mult': 1.21212816274506, 'tsl_mult': 0.8491463057972517, 'strategy': 'mean_reversion', 'time_stop': 236, 'use_sma': True, 'use_atr': True, 'use_adx': False, 'use_ema': False, 'use_spike': False, 'rsi_required': True, 'edge_k': 1.081076554495244, 'edge_cap': 0.08450765550064565, 'bull_strategy': 'breakout', 'bull_bb_std_mult': 3.2634531959917013, 'bull_rsi_os': 39, 'bull_rsi_ob': 71, 'bull_adx_thresh': 5.581162168574227, 'bull_atr_min_pct': 0.024638419081845043, 'bull_atr_max_pct': 0.040448866518313156, 'bull_tp_mult': 2.2449535301787322, 'bull_tsl_mult': 0.735470344183548, 'bull_time_stop': 273, 'bull_use_sma': True, 'bull_use_ema': False, 'bull_use_atr': True, 'bull_use_adx': False, 'bull_use_spike': False, 'bull_rsi_required': False, 'bear_strategy': 'mean_reversion', 'bear_bb_std_mult': 3.0380429165669565, 'bear_rsi_os': 25, 'bear_rsi_ob': 67, 'bear_adx_thresh': 33.34759416749631, 'bear_atr_min_pct': 0.017519227644033544, 'bear_atr_max_pct': 0.08277130236191811, 'bear_tp_mult': 2.866332910934557, 'bear_tsl_mult': 0.35104432784272827, 'bear_time_stop': 79, 'bear_use_sma': False, 'bear_use_ema': False, 'bear_use_atr': False, 'bear_use_adx': True, 'bear_use_spike': True, 'bear_rsi_required': False, 'sideways_strategy': 'breakout', 'sideways_bb_std_mult': 2.0694657694380254, 'sideways_rsi_os': 42, 'sideways_rsi_ob': 55, 'sideways_adx_thresh': 10.55455930448465, 'sideways_atr_min_pct': 0.023005656504328374, 'sideways_atr_max_pct': 0.0256063611871881, 'sideways_tp_mult': 2.5434629691307866, 'sideways_tsl_mult': 0.17432328656798862, 'sideways_time_stop': 102, 'sideways_use_sma': False, 'sideways_use_ema': True, 'sideways_use_atr': True, 'sideways_use_adx': False, 'sideways_use_spike': False, 'sideways_rsi_required': False}.
[I 2025-09-01 08:47:12,667] Trial 529 finished with values: [-1000000000.0, 1000000000.0] and parameters: {'p_sma': 24, 'p_std': 12, 'p_atr': 17, 'p_adx': 7, 'rsi_period': 47, 'ema1': 29, 'ema2': 29, 'slip_atr_k': 0.18750883483321257, 'slip_spread_k': 0.6079123630688373, 'spread_hl_frac': 0.02456103387781872, 'bb_std_mult': 1.1095072181213286, 'rsi_os': 22, 'rsi_ob': 59, 'vol_spike': 0.2517015749827576, 'adx_thresh': 22.679088189534994, 'atr_min_pct': 0.02014527794332686, 'atr_max_pct': 0.03858677458762473, 'tp_mult': 2.3393834950824264, 'tsl_mult': 0.48680513676243925, 'strategy': 'mean_reversion', 'time_stop': 271, 'use_sma': False, 'use_atr': True, 'use_adx': True, 'use_ema': True, 'use_spike': True, 'rsi_required': True, 'edge_k': 0.5423783819425134, 'edge_cap': 0.8272267418268906, 'bull_strategy': 'mean_reversion', 'bull_bb_std_mult': 2.6100187569039703, 'bull_rsi_os': 10, 'bull_rsi_ob': 56, 'bull_adx_thresh': 23.494054880602402, 'bull_atr_min_pct': 0.029236865621492247, 'bull_atr_max_pct': 0.024557624116676446, 'bull_tp_mult': 1.0390521437937665, 'bull_tsl_mult': 0.7352699186696892, 'bull_time_stop': 123, 'bull_use_sma': True, 'bull_use_ema': False, 'bull_use_atr': False, 'bull_use_adx': True, 'bull_use_spike': True, 'bull_rsi_required': False, 'bear_strategy': 'mean_reversion', 'bear_bb_std_mult': 3.2360183188919014, 'bear_rsi_os': 27, 'bear_rsi_ob': 94, 'bear_adx_thresh': 7.5384177996294675, 'bear_atr_min_pct': 0.017551503871849557, 'bear_atr_max_pct': 0.0785504677029707, 'bear_tp_mult': 2.862024042616578, 'bear_tsl_mult': 0.6214580941098676, 'bear_time_stop': 64, 'bear_use_sma': False, 'bear_use_ema': True, 'bear_use_atr': True, 'bear_use_adx': True, 'bear_use_spike': True, 'bear_rsi_required': False, 'sideways_strategy': 'mean_reversion', 'sideways_bb_std_mult': 1.4888843997473629, 'sideways_rsi_os': 13, 'sideways_rsi_ob': 70, 'sideways_adx_thresh': 10.634655594784697, 'sideways_atr_min_pct': 0.02185234380257703, 'sideways_atr_max_pct': 0.1492859841219999, 'sideways_tp_mult': 1.2082926116800357, 'sideways_tsl_mult': 0.17084625074871182, 'sideways_time_stop': 39, 'sideways_use_sma': False, 'sideways_use_ema': False, 'sideways_use_atr': False, 'sideways_use_adx': True, 'sideways_use_spike': True, 'sideways_rsi_required': False}.
[I 2025-09-01 08:47:13,568] Trial 533 finished with values: [-1000000000.0, 1000000000.0] and parameters: {'p_sma': 9, 'p_std': 12, 'p_atr': 29, 'p_adx': 20, 'rsi_period': 33, 'ema1': 22, 'ema2': 54, 'slip_atr_k': 0.05916261094856344, 'slip_spread_k': 0.4542893765693929, 'spread_hl_frac': 0.023373539272335132, 'bb_std_mult': 1.661041543163803, 'rsi_os': 24, 'rsi_ob': 90, 'vol_spike': 0.2409183958767944, 'adx_thresh': 20.83756116213241, 'atr_min_pct': 0.018735085704209252, 'atr_max_pct': 0.03217257921970106, 'tp_mult': 2.4230075272941214, 'tsl_mult': 0.4914340123592261, 'strategy': 'mean_reversion', 'time_stop': 267, 'use_sma': True, 'use_atr': True, 'use_adx': False, 'use_ema': True, 'use_spike': True, 'rsi_required': True, 'edge_k': 1.4327866422268287, 'edge_cap': 0.15028818251036064, 'bull_strategy': 'breakout', 'bull_bb_std_mult': 2.8333866658310076, 'bull_rsi_os': 11, 'bull_rsi_ob': 80, 'bull_adx_thresh': 8.875316655604982, 'bull_atr_min_pct': 0.01886896006231093, 'bull_atr_max_pct': 0.09634045539749286, 'bull_tp_mult': 1.0389850568001342, 'bull_tsl_mult': 0.7320445210369517, 'bull_time_stop': 122, 'bull_use_sma': True, 'bull_use_ema': False, 'bull_use_atr': True, 'bull_use_adx': False, 'bull_use_spike': False, 'bull_rsi_required': False, 'bear_strategy': 'mean_reversion', 'bear_bb_std_mult': 1.5850679900756808, 'bear_rsi_os': 25, 'bear_rsi_ob': 61, 'bear_adx_thresh': 25.097702393108033, 'bear_atr_min_pct': 0.018100036915963603, 'bear_atr_max_pct': 0.08232303558904108, 'bear_tp_mult': 2.858783669870953, 'bear_tsl_mult': 0.13734791517646966, 'bear_time_stop': 38, 'bear_use_sma': True, 'bear_use_ema': False, 'bear_use_atr': False, 'bear_use_adx': True, 'bear_use_spike': True, 'bear_rsi_required': False, 'sideways_strategy': 'mean_reversion', 'sideways_bb_std_mult': 2.319903663443463, 'sideways_rsi_os': 37, 'sideways_rsi_ob': 69, 'sideways_adx_thresh': 9.394831070865067, 'sideways_atr_min_pct': 0.010515218849328559, 'sideways_atr_max_pct': 0.024571878269562815, 'sideways_tp_mult': 2.53827729021971, 'sideways_tsl_mult': 0.9708334959334552, 'sideways_time_stop': 37, 'sideways_use_sma': False, 'sideways_use_ema': True, 'sideways_use_atr': False, 'sideways_use_adx': False, 'sideways_use_spike': False, 'sideways_rsi_required': True}.
[I 2025-09-01 08:47:14,336] Trial 534 finished with values: [-1000000000.0, 1000000000.0] and parameters: {'p_sma': 5, 'p_std': 18, 'p_atr': 20, 'p_adx': 20, 'rsi_period': 56, 'ema1': 11, 'ema2': 14, 'slip_atr_k': 0.12403379823959321, 'slip_spread_k': 0.6901227668559514, 'spread_hl_frac': 0.04434141347428343, 'bb_std_mult': 2.813337778920882, 'rsi_os': 24, 'rsi_ob': 59, 'vol_spike': 0.24137197404705843, 'adx_thresh': 25.574237184486776, 'atr_min_pct': 0.020474987618303853, 'atr_max_pct': 0.14714836923750774, 'tp_mult': 1.2593432797197588, 'tsl_mult': 0.9006724965861659, 'strategy': 'mean_reversion', 'time_stop': 264, 'use_sma': True, 'use_atr': False, 'use_adx': False, 'use_ema': True, 'use_spike': True, 'rsi_required': True, 'edge_k': 1.0739796510786326, 'edge_cap': 0.08279563611652813, 'bull_strategy': 'breakout', 'bull_bb_std_mult': 2.7042011305503353, 'bull_rsi_os': 32, 'bull_rsi_ob': 72, 'bull_adx_thresh': 6.8012518024057815, 'bull_atr_min_pct': 0.005375320692125334, 'bull_atr_max_pct': 0.09637813899681213, 'bull_tp_mult': 2.2473924602452926, 'bull_tsl_mult': 0.19803177982891934, 'bull_time_stop': 123, 'bull_use_sma': False, 'bull_use_ema': True, 'bull_use_atr': True, 'bull_use_adx': False, 'bull_use_spike': False, 'bull_rsi_required': False, 'bear_strategy': 'mean_reversion', 'bear_bb_std_mult': 1.1676387274196807, 'bear_rsi_os': 25, 'bear_rsi_ob': 95, 'bear_adx_thresh': 32.63521015794172, 'bear_atr_min_pct': 0.027105349735200825, 'bear_atr_max_pct': 0.07498387481707434, 'bear_tp_mult': 2.8709967281046067, 'bear_tsl_mult': 0.3487944126419791, 'bear_time_stop': 75, 'bear_use_sma': True, 'bear_use_ema': False, 'bear_use_atr': False, 'bear_use_adx': True, 'bear_use_spike': True, 'bear_rsi_required': True, 'sideways_strategy': 'mean_reversion', 'sideways_bb_std_mult': 1.5355993138482238, 'sideways_rsi_os': 48, 'sideways_rsi_ob': 58, 'sideways_adx_thresh': 22.47056382183448, 'sideways_atr_min_pct': 0.017890878409322616, 'sideways_atr_max_pct': 0.03618985184306134, 'sideways_tp_mult': 1.2090549777952737, 'sideways_tsl_mult': 0.19311843004921084, 'sideways_time_stop': 39, 'sideways_use_sma': False, 'sideways_use_ema': True, 'sideways_use_atr': False, 'sideways_use_adx': False, 'sideways_use_spike': False, 'sideways_rsi_required': True}.
[I 2025-09-01 08:47:58,659] Trial 537 finished with values: [-1000000000.0, 1000000000.0] and parameters: {'p_sma': 19, 'p_std': 16, 'p_atr': 13, 'p_adx': 8, 'rsi_period': 58, 'ema1': 5, 'ema2': 14, 'slip_atr_k': 0.049777057356464455, 'slip_spread_k': 0.6913845646233993, 'spread_hl_frac': 0.022794104126739913, 'bb_std_mult': 3.4633930443298717, 'rsi_os': 28, 'rsi_ob': 52, 'vol_spike': 0.19380789216562838, 'adx_thresh': 6.440766095534869, 'atr_min_pct': 0.02822244219630951, 'atr_max_pct': 0.0598347568518797, 'tp_mult': 2.989721496574785, 'tsl_mult': 0.5213790626966005, 'strategy': 'breakout', 'time_stop': 24, 'use_sma': True, 'use_atr': False, 'use_adx': True, 'use_ema': True, 'use_spike': True, 'rsi_required': True, 'edge_k': 1.0595527519623402, 'edge_cap': 0.09523017599042548, 'bull_strategy': 'breakout', 'bull_bb_std_mult': 2.959662220447632, 'bull_rsi_os': 33, 'bull_rsi_ob': 67, 'bull_adx_thresh': 15.74464409454278, 'bull_atr_min_pct': 0.005373677314871551, 'bull_atr_max_pct': 0.029216808047467485, 'bull_tp_mult': 1.1433712090472543, 'bull_tsl_mult': 0.6851001069164453, 'bull_time_stop': 75, 'bull_use_sma': False, 'bull_use_ema': True, 'bull_use_atr': False, 'bull_use_adx': True, 'bull_use_spike': True, 'bull_rsi_required': True, 'bear_strategy': 'mean_reversion', 'bear_bb_std_mult': 3.3038451378450135, 'bear_rsi_os': 26, 'bear_rsi_ob': 85, 'bear_adx_thresh': 32.6347630033113, 'bear_atr_min_pct': 0.00820176249335946, 'bear_atr_max_pct': 0.10561402234589523, 'bear_tp_mult': 2.9129864357224635, 'bear_tsl_mult': 0.9015689930664939, 'bear_time_stop': 166, 'bear_use_sma': True, 'bear_use_ema': False, 'bear_use_atr': True, 'bear_use_adx': True, 'bear_use_spike': False, 'bear_rsi_required': True, 'sideways_strategy': 'mean_reversion', 'sideways_bb_std_mult': 0.5652953400994394, 'sideways_rsi_os': 49, 'sideways_rsi_ob': 76, 'sideways_adx_thresh': 8.828699452994325, 'sideways_atr_min_pct': 0.00418146897098866, 'sideways_atr_max_pct': 0.12030367423416931, 'sideways_tp_mult': 2.65850619258141, 'sideways_tsl_mult': 0.5326300446765655, 'sideways_time_stop': 255, 'sideways_use_sma': False, 'sideways_use_ema': False, 'sideways_use_atr': False, 'sideways_use_adx': True, 'sideways_use_spike': True, 'sideways_rsi_required': True}.
[I 2025-09-01 08:47:58,664] Trial 538 finished with values: [-1000000000.0, 1000000000.0] and parameters: {'p_sma': 19, 'p_std': 16, 'p_atr': 13, 'p_adx': 21, 'rsi_period': 44, 'ema1': 12, 'ema2': 10, 'slip_atr_k': 0.15584536563860404, 'slip_spread_k': 0.2502264437307379, 'spread_hl_frac': 0.010566345304244124, 'bb_std_mult': 3.4811742524986125, 'rsi_os': 25, 'rsi_ob': 52, 'vol_spike': 0.23152194459044223, 'adx_thresh': 10.254358308389737, 'atr_min_pct': 0.021390908963955447, 'atr_max_pct': 0.14454113751044376, 'tp_mult': 2.9819475195615066, 'tsl_mult': 0.3111915755267014, 'strategy': 'breakout', 'time_stop': 248, 'use_sma': True, 'use_atr': False, 'use_adx': True, 'use_ema': True, 'use_spike': False, 'rsi_required': True, 'edge_k': 0.10359640926944347, 'edge_cap': 0.9025278529909843, 'bull_strategy': 'breakout', 'bull_bb_std_mult': 2.9587240493834117, 'bull_rsi_os': 16, 'bull_rsi_ob': 67, 'bull_adx_thresh': 8.551494553732141, 'bull_atr_min_pct': 0.014202310187060009, 'bull_atr_max_pct': 0.032936849173165916, 'bull_tp_mult': 2.362259773307199, 'bull_tsl_mult': 0.033892199239390575, 'bull_time_stop': 161, 'bull_use_sma': False, 'bull_use_ema': True, 'bull_use_atr': False, 'bull_use_adx': True, 'bull_use_spike': True, 'bull_rsi_required': True, 'bear_strategy': 'breakout', 'bear_bb_std_mult': 3.1678308914306923, 'bear_rsi_os': 26, 'bear_rsi_ob': 50, 'bear_adx_thresh': 31.974561966548382, 'bear_atr_min_pct': 0.02304653405688208, 'bear_atr_max_pct': 0.07385506148585957, 'bear_tp_mult': 1.0955157327356257, 'bear_tsl_mult': 0.43554128432447387, 'bear_time_stop': 92, 'bear_use_sma': False, 'bear_use_ema': False, 'bear_use_atr': True, 'bear_use_adx': True, 'bear_use_spike': False, 'bear_rsi_required': True, 'sideways_strategy': 'mean_reversion', 'sideways_bb_std_mult': 2.822691145993433, 'sideways_rsi_os': 28, 'sideways_rsi_ob': 59, 'sideways_adx_thresh': 8.850008763177422, 'sideways_atr_min_pct': 0.02309845083218545, 'sideways_atr_max_pct': 0.03242401431570639, 'sideways_tp_mult': 2.6306180746801293, 'sideways_tsl_mult': 0.14413193431132018, 'sideways_time_stop': 145, 'sideways_use_sma': True, 'sideways_use_ema': False, 'sideways_use_atr': False, 'sideways_use_adx': True, 'sideways_use_spike': True, 'sideways_rsi_required': False}.
[I 2025-09-01 08:47:59,244] Trial 536 finished with values: [-1000000000.0, 1000000000.0] and parameters: {'p_sma': 19, 'p_std': 16, 'p_atr': 13, 'p_adx': 21, 'rsi_period': 32, 'ema1': 11, 'ema2': 14, 'slip_atr_k': 0.052867543354898947, 'slip_spread_k': 0.6902829516237482, 'spread_hl_frac': 0.02368392711486788, 'bb_std_mult': 1.6424012094295521, 'rsi_os': 28, 'rsi_ob': 52, 'vol_spike': 0.24144860179625585, 'adx_thresh': 18.735242786156235, 'atr_min_pct': 0.022805152662681766, 'atr_max_pct': 0.1449109912970531, 'tp_mult': 1.2472696332665616, 'tsl_mult': 0.21474841796883615, 'strategy': 'breakout', 'time_stop': 66, 'use_sma': True, 'use_atr': False, 'use_adx': False, 'use_ema': True, 'use_spike': True, 'rsi_required': True, 'edge_k': 1.0690281736922091, 'edge_cap': 0.08902792992278133, 'bull_strategy': 'breakout', 'bull_bb_std_mult': 2.685478458363489, 'bull_rsi_os': 16, 'bull_rsi_ob': 76, 'bull_adx_thresh': 8.77060741136751, 'bull_atr_min_pct': 0.019018317927839146, 'bull_atr_max_pct': 0.033303282037963476, 'bull_tp_mult': 2.368058891108121, 'bull_tsl_mult': 0.5446460283249439, 'bull_time_stop': 161, 'bull_use_sma': False, 'bull_use_ema': True, 'bull_use_atr': True, 'bull_use_adx': False, 'bull_use_spike': False, 'bull_rsi_required': True, 'bear_strategy': 'mean_reversion', 'bear_bb_std_mult': 1.3248026362424064, 'bear_rsi_os': 25, 'bear_rsi_ob': 61, 'bear_adx_thresh': 32.66101632039112, 'bear_atr_min_pct': 0.008081983767587144, 'bear_atr_max_pct': 0.07394000323434986, 'bear_tp_mult': 2.578134481493904, 'bear_tsl_mult': 0.9033593193386342, 'bear_time_stop': 35, 'bear_use_sma': True, 'bear_use_ema': False, 'bear_use_atr': False, 'bear_use_adx': True, 'bear_use_spike': False, 'bear_rsi_required': True, 'sideways_strategy': 'mean_reversion', 'sideways_bb_std_mult': 0.5000681117612097, 'sideways_rsi_os': 28, 'sideways_rsi_ob': 69, 'sideways_adx_thresh': 32.02722861499552, 'sideways_atr_min_pct': 0.017694150639384485, 'sideways_atr_max_pct': 0.12002073634163658, 'sideways_tp_mult': 2.513426862839127, 'sideways_tsl_mult': 0.3418507477747167, 'sideways_time_stop': 163, 'sideways_use_sma': False, 'sideways_use_ema': True, 'sideways_use_atr': False, 'sideways_use_adx': False, 'sideways_use_spike': False, 'sideways_rsi_required': True}.
[I 2025-09-01 08:47:59,598] Trial 535 finished with values: [-1000000000.0, 1000000000.0] and parameters: {'p_sma': 20, 'p_std': 12, 'p_atr': 30, 'p_adx': 22, 'rsi_period': 47, 'ema1': 11, 'ema2': 10, 'slip_atr_k': 0.051047776581574895, 'slip_spread_k': 0.6055385122258574, 'spread_hl_frac': 0.023961756641355674, 'bb_std_mult': 1.6553283917149777, 'rsi_os': 23, 'rsi_ob': 52, 'vol_spike': 0.15532134893926194, 'adx_thresh': 10.572982372997961, 'atr_min_pct': 0.008986362811553197, 'atr_max_pct': 0.08454494183472006, 'tp_mult': 2.4084079473215207, 'tsl_mult': 0.3103967640747422, 'strategy': 'breakout', 'time_stop': 161, 'use_sma': True, 'use_atr': False, 'use_adx': True, 'use_ema': True, 'use_spike': True, 'rsi_required': True, 'edge_k': 1.061824488344656, 'edge_cap': 0.39622211004892693, 'bull_strategy': 'breakout', 'bull_bb_std_mult': 2.690326973956135, 'bull_rsi_os': 16, 'bull_rsi_ob': 67, 'bull_adx_thresh': 6.638817602904126, 'bull_atr_min_pct': 0.009842360115992262, 'bull_atr_max_pct': 0.028940768924336488, 'bull_tp_mult': 2.3741813914941634, 'bull_tsl_mult': 0.696348414601675, 'bull_time_stop': 159, 'bull_use_sma': False, 'bull_use_ema': True, 'bull_use_atr': True, 'bull_use_adx': True, 'bull_use_spike': False, 'bull_rsi_required': True, 'bear_strategy': 'mean_reversion', 'bear_bb_std_mult': 1.5620125571284462, 'bear_rsi_os': 25, 'bear_rsi_ob': 86, 'bear_adx_thresh': 32.53807625355641, 'bear_atr_min_pct': 0.018561919648042574, 'bear_atr_max_pct': 0.0747697905878912, 'bear_tp_mult': 1.5578224587719707, 'bear_tsl_mult': 0.6194943718882233, 'bear_time_stop': 121, 'bear_use_sma': True, 'bear_use_ema': False, 'bear_use_atr': True, 'bear_use_adx': True, 'bear_use_spike': False, 'bear_rsi_required': True, 'sideways_strategy': 'mean_reversion', 'sideways_bb_std_mult': 2.3296717380452128, 'sideways_rsi_os': 39, 'sideways_rsi_ob': 69, 'sideways_adx_thresh': 13.322882832299374, 'sideways_atr_min_pct': 0.014328557331497512, 'sideways_atr_max_pct': 0.013515440403032764, 'sideways_tp_mult': 2.5082877535028407, 'sideways_tsl_mult': 0.193900979317629, 'sideways_time_stop': 38, 'sideways_use_sma': False, 'sideways_use_ema': False, 'sideways_use_atr': False, 'sideways_use_adx': True, 'sideways_use_spike': True, 'sideways_rsi_required': True}.
[I 2025-09-01 08:48:46,903] Trial 540 finished with values: [-1000000000.0, 1000000000.0] and parameters: {'p_sma': 40, 'p_std': 14, 'p_atr': 12, 'p_adx': 19, 'rsi_period': 30, 'ema1': 28, 'ema2': 48, 'slip_atr_k': 0.05263849129371011, 'slip_spread_k': 0.6596097441072979, 'spread_hl_frac': 0.0279564165389007, 'bb_std_mult': 3.3462816107810847, 'rsi_os': 20, 'rsi_ob': 56, 'vol_spike': 0.15713377139892606, 'adx_thresh': 24.108937894539345, 'atr_min_pct': 0.0036469299299426855, 'atr_max_pct': 0.14741743403829, 'tp_mult': 1.1515405923749846, 'tsl_mult': 0.3808973256935554, 'strategy': 'mean_reversion', 'time_stop': 191, 'use_sma': True, 'use_atr': True, 'use_adx': True, 'use_ema': True, 'use_spike': True, 'rsi_required': True, 'edge_k': 0.9179297074350272, 'edge_cap': 0.10370565040420969, 'bull_strategy': 'breakout', 'bull_bb_std_mult': 2.771934730687951, 'bull_rsi_os': 15, 'bull_rsi_ob': 68, 'bull_adx_thresh': 7.775835429563767, 'bull_atr_min_pct': 0.01317655670683415, 'bull_atr_max_pct': 0.13055215955505775, 'bull_tp_mult': 2.1873614101298258, 'bull_tsl_mult': 0.5454145555360517, 'bull_time_stop': 176, 'bull_use_sma': True, 'bull_use_ema': False, 'bull_use_atr': False, 'bull_use_adx': True, 'bull_use_spike': True, 'bull_rsi_required': False, 'bear_strategy': 'mean_reversion', 'bear_bb_std_mult': 3.050888560845569, 'bear_rsi_os': 26, 'bear_rsi_ob': 95, 'bear_adx_thresh': 32.119715406970016, 'bear_atr_min_pct': 0.022676321432171777, 'bear_atr_max_pct': 0.1359047234502308, 'bear_tp_mult': 1.0519968287483747, 'bear_tsl_mult': 0.09048163564127704, 'bear_time_stop': 122, 'bear_use_sma': False, 'bear_use_ema': False, 'bear_use_atr': True, 'bear_use_adx': False, 'bear_use_spike': True, 'bear_rsi_required': False, 'sideways_strategy': 'mean_reversion', 'sideways_bb_std_mult': 0.7031147341951407, 'sideways_rsi_os': 39, 'sideways_rsi_ob': 72, 'sideways_adx_thresh': 31.204847798814956, 'sideways_atr_min_pct': 0.023485195245543284, 'sideways_atr_max_pct': 0.034100271000934455, 'sideways_tp_mult': 2.5862151271343654, 'sideways_tsl_mult': 0.23049665418598417, 'sideways_time_stop': 30, 'sideways_use_sma': False, 'sideways_use_ema': False, 'sideways_use_atr': False, 'sideways_use_adx': True, 'sideways_use_spike': True, 'sideways_rsi_required': False}.
