[I 2025-09-01 08:45:43,294] Trial 524 finished with values: [-1000000000.0, 1000000000.0] and parameters: {'p_sma': 54, 'p_std': 15, 'p_atr': 12, 'p_adx': 19, 'rsi_period': 72, 'ema1': 16, 'ema2': 12, 'slip_atr_k': 0.06396046563196564, 'slip_spread_k': 0.8234480902114116, 'spread_hl_frac': 0.019098049657523236, 'bb_std_mult': 3.4541158575951747, 'rsi_os': 23, 'rsi_ob': 75, 'vol_spike': 0.0007645167157606658, 'adx_thresh': 25.093846298445524, 'atr_min_pct': 0.015718845773999873, 'atr_max_pct': 0.14691309162109817, 'tp_mult': 1.496324998876659, 'tsl_mult': 0.5464424642328765, 'strategy': 'mean_reversion', 'time_stop': 255, 'use_sma': True, 'use_atr': False, 'use_adx': True, 'use_ema': True, 'use_spike': True, 'rsi_required': True, 'edge_k': 1.0046840967606043, 'edge_cap': 0.47432711722964027, 'bull_strategy': 'breakout', 'bull_bb_std_mult': 1.8564342716300712, 'bull_rsi_os': 25, 'bull_rsi_ob': 69, 'bull_adx_thresh': 10.006753631152607, 'bull_atr_min_pct': 0.022072307710847394, 'bull_atr_max_pct': 0.043868332594424415, 'bull_tp_mult': 2.311045687446193, 'bull_tsl_mult': 0.6433095878607853, 'bull_time_stop': 152, 'bull_use_sma': True, 'bull_use_ema': True, 'bull_use_atr': False, 'bull_use_adx': True, 'bull_use_spike': True, 'bull_rsi_required': False, 'bear_strategy': 'breakout', 'bear_bb_std_mult': 1.2546202195888134, 'bear_rsi_os': 27, 'bear_rsi_ob': 77, 'bear_adx_thresh': 32.14734738906965, 'bear_atr_min_pct': 0.009845190275097448, 'bear_atr_max_pct': 0.012737072606248775, 'bear_tp_mult': 2.8668978269476417, 'bear_tsl_mult': 0.32274747030700174, 'bear_time_stop': 257, 'bear_use_sma': False, 'bear_use_ema': False, 'bear_use_atr': True, 'bear_use_adx': True, 'bear_use_spike': True, 'bear_rsi_required': True, 'sideways_strategy': 'mean_reversion', 'sideways_bb_std_mult': 0.5930511680010792, 'sideways_rsi_os': 39, 'sideways_rsi_ob': 59, 'sideways_adx_thresh': 9.772198556688206, 'sideways_atr_min_pct': 0.012559475589665107, 'sideways_atr_max_pct': 0.0995429433378148, 'sideways_tp_mult': 2.616736789444666, 'sideways_tsl_mult': 0.06512656203316236, 'sideways_time_stop': 230, 'sideways_use_sma': True, 'sideways_use_ema': False, 'sideways_use_atr': False, 'sideways_use_adx': True, 'sideways_use_spike': True, 'sideways_rsi_required': False}.
[I 2025-09-01 08:45:43,318] Trial 522 finished with values: [-0.15240657867017982, 0.1534064943598258] and parameters: {'p_sma': 52, 'p_std': 14, 'p_atr': 12, 'p_adx': 21, 'rsi_period': 61, 'ema1': 9, 'ema2': 13, 'slip_atr_k': 0.0642399071574656, 'slip_spread_k': 0.665706078301177, 'spread_hl_frac': 0.002629088385043679, 'bb_std_mult': 3.3793954690952064, 'rsi_os': 48, 'rsi_ob': 70, 'vol_spike': 0.2485558207538648, 'adx_thresh': 27.82944278711585, 'atr_min_pct': 0.021089425093516058, 'atr_max_pct': 0.14712094016772623, 'tp_mult': 1.2347090877203133, 'tsl_mult': 0.6122355168329051, 'strategy': 'mean_reversion', 'time_stop': 74, 'use_sma': True, 'use_atr': True, 'use_adx': True, 'use_ema': True, 'use_spike': True, 'rsi_required': True, 'edge_k': 0.21364838870569436, 'edge_cap': 0.050143847627683695, 'bull_strategy': 'breakout', 'bull_bb_std_mult': 1.8447303507218675, 'bull_rsi_os': 12, 'bull_rsi_ob': 69, 'bull_adx_thresh': 8.520250482528, 'bull_atr_min_pct': 3.328287327677981e-05, 'bull_atr_max_pct': 0.04339503163931664, 'bull_tp_mult': 2.29283467086878, 'bull_tsl_mult': 0.6406775806663634, 'bull_time_stop': 153, 'bull_use_sma': True, 'bull_use_ema': False, 'bull_use_atr': False, 'bull_use_adx': True, 'bull_use_spike': True, 'bull_rsi_required': False, 'bear_strategy': 'breakout', 'bear_bb_std_mult': 2.968427286883329, 'bear_rsi_os': 25, 'bear_rsi_ob': 95, 'bear_adx_thresh': 32.15359995358107, 'bear_atr_min_pct': 0.023396877397558365, 'bear_atr_max_pct': 0.11607490113406065, 'bear_tp_mult': 1.5086134127069746, 'bear_tsl_mult': 0.07257522151232766, 'bear_time_stop': 84, 'bear_use_sma': True, 'bear_use_ema': False, 'bear_use_atr': True, 'bear_use_adx': True, 'bear_use_spike': True, 'bear_rsi_required': False, 'sideways_strategy': 'mean_reversion', 'sideways_bb_std_mult': 0.7872703233608571, 'sideways_rsi_os': 30, 'sideways_rsi_ob': 67, 'sideways_adx_thresh': 18.592365269114183, 'sideways_atr_min_pct': 0.024307964438666278, 'sideways_atr_max_pct': 0.0440285647117671, 'sideways_tp_mult': 2.8433056295645844, 'sideways_tsl_mult': 0.20033384736075105, 'sideways_time_stop': 65, 'sideways_use_sma': True, 'sideways_use_ema': False, 'sideways_use_atr': False, 'sideways_use_adx': True, 'sideways_use_spike': True, 'sideways_rsi_required': True}.
[I 2025-09-01 08:45:43,318] Trial 523 finished with values: [-0.18429943223685497, 0.18406247032787793] and parameters: {'p_sma': 21, 'p_std': 14, 'p_atr': 28, 'p_adx': 29, 'rsi_period': 61, 'ema1': 7, 'ema2': 12, 'slip_atr_k': 0.06971993624979624, 'slip_spread_k': 0.6697637420999373, 'spread_hl_frac': 0.023913920347484827, 'bb_std_mult': 3.4332977118631645, 'rsi_os': 47, 'rsi_ob': 93, 'vol_spike': 0.08802400183962947, 'adx_thresh': 27.795518572157214, 'atr_min_pct': 0.021035407160679285, 'atr_max_pct': 0.1472295422175379, 'tp_mult': 1.344134097652781, 'tsl_mult': 0.5429617267518865, 'strategy': 'mean_reversion', 'time_stop': 256, 'use_sma': True, 'use_atr': False, 'use_adx': True, 'use_ema': True, 'use_spike': True, 'rsi_required': True, 'edge_k': 1.7612621026092228, 'edge_cap': 0.050203826206097105, 'bull_strategy': 'breakout', 'bull_bb_std_mult': 2.895525407102098, 'bull_rsi_os': 12, 'bull_rsi_ob': 69, 'bull_adx_thresh': 12.577490135029048, 'bull_atr_min_pct': 3.428905366366017e-05, 'bull_atr_max_pct': 0.0423134936994194, 'bull_tp_mult': 2.313529300222031, 'bull_tsl_mult': 0.6385778925736816, 'bull_time_stop': 153, 'bull_use_sma': True, 'bull_use_ema': True, 'bull_use_atr': False, 'bull_use_adx': True, 'bull_use_spike': True, 'bull_rsi_required': False, 'bear_strategy': 'breakout', 'bear_bb_std_mult': 2.9869460791960836, 'bear_rsi_os': 25, 'bear_rsi_ob': 48, 'bear_adx_thresh': 24.28065899872062, 'bear_atr_min_pct': 0.023279896850749163, 'bear_atr_max_pct': 0.08018094670869677, 'bear_tp_mult': 2.4978320439663704, 'bear_tsl_mult': 0.06427355513307251, 'bear_time_stop': 21, 'bear_use_sma': True, 'bear_use_ema': False, 'bear_use_atr': True, 'bear_use_adx': True, 'bear_use_spike': True, 'bear_rsi_required': True, 'sideways_strategy': 'mean_reversion', 'sideways_bb_std_mult': 1.3213939814141993, 'sideways_rsi_os': 40, 'sideways_rsi_ob': 67, 'sideways_adx_thresh': 12.51038602486075, 'sideways_atr_min_pct': 0.012486571361238137, 'sideways_atr_max_pct': 0.033234604088933556, 'sideways_tp_mult': 1.7940448325660452, 'sideways_tsl_mult': 0.40491654887707096, 'sideways_time_stop': 5, 'sideways_use_sma': True, 'sideways_use_ema': False, 'sideways_use_atr': True, 'sideways_use_adx': True, 'sideways_use_spike': True, 'sideways_rsi_required': True}.
[I 2025-09-01 08:46:27,415] Trial 527 finished with values: [-1000000000.0, 1000000000.0] and parameters: {'p_sma': 37, 'p_std': 23, 'p_atr': 14, 'p_adx': 25, 'rsi_period': 12, 'ema1': 18, 'ema2': 38, 'slip_atr_k': 0.048702677998825605, 'slip_spread_k': 0.7874458886477936, 'spread_hl_frac': 0.027245937368424657, 'bb_std_mult': 2.3561398716748663, 'rsi_os': 21, 'rsi_ob': 54, 'vol_spike': 0.060666273287052416, 'adx_thresh': 25.955350386001342, 'atr_min_pct': 0.02178070797909763, 'atr_max_pct': 0.0887993675966572, 'tp_mult': 1.1502676235581333, 'tsl_mult': 0.466924768432034, 'strategy': 'mean_reversion', 'time_stop': 215, 'use_sma': False, 'use_atr': True, 'use_adx': True, 'use_ema': True, 'use_spike': True, 'rsi_required': False, 'edge_k': 0.05455377095951619, 'edge_cap': 0.11140508472010854, 'bull_strategy': 'mean_reversion', 'bull_bb_std_mult': 1.7081383698064982, 'bull_rsi_os': 7, 'bull_rsi_ob': 63, 'bull_adx_thresh': 7.789577371358544, 'bull_atr_min_pct': 0.009123475792285965, 'bull_atr_max_pct': 0.10199921431425386, 'bull_tp_mult': 2.725224527459192, 'bull_tsl_mult': 0.6754539312429714, 'bull_time_stop': 287, 'bull_use_sma': True, 'bull_use_ema': False, 'bull_use_atr': False, 'bull_use_adx': True, 'bull_use_spike': True, 'bull_rsi_required': False, 'bear_strategy': 'mean_reversion', 'bear_bb_std_mult': 3.1789109411716274, 'bear_rsi_os': 27, 'bear_rsi_ob': 94, 'bear_adx_thresh': 18.591347662452915, 'bear_atr_min_pct': 0.024217756319163827, 'bear_atr_max_pct': 0.08763809815445792, 'bear_tp_mult': 2.337945579538526, 'bear_tsl_mult': 0.7183801065198029, 'bear_time_stop': 99, 'bear_use_sma': False, 'bear_use_ema': True, 'bear_use_atr': True, 'bear_use_adx': False, 'bear_use_spike': True, 'bear_rsi_required': False, 'sideways_strategy': 'mean_reversion', 'sideways_bb_std_mult': 3.2732483553289344, 'sideways_rsi_os': 38, 'sideways_rsi_ob': 61, 'sideways_adx_thresh': 7.394682965302516, 'sideways_atr_min_pct': 0.02388783518903377, 'sideways_atr_max_pct': 0.03068573715249636, 'sideways_tp_mult': 2.697763632891339, 'sideways_tsl_mult': 0.1426350448658556, 'sideways_time_stop': 199, 'sideways_use_sma': False, 'sideways_use_ema': False, 'sideways_use_atr': False, 'sideways_use_adx': True, 'sideways_use_spike': True, 'sideways_rsi_required': False}.
[I 2025-09-01 08:46:28,270] Trial 525 finished with values: [-1000000000.0, 1000000000.0] and parameters: {'p_sma': 14, 'p_std': 57, 'p_atr': 14, 'p_adx': 19, 'rsi_period': 61, 'ema1': 9, 'ema2': 31, 'slip_atr_k': 0.0002204648763164535, 'slip_spread_k': 0.6415713913949725, 'spread_hl_frac': 0.04760319822036087, 'bb_std_mult': 2.7395291690097165, 'rsi_os': 49, 'rsi_ob': 54, 'vol_spike': 0.018379873797912477, 'adx_thresh': 25.01295135214608, 'atr_min_pct': 0.021874301991339752, 'atr_max_pct': 0.03755286425553011, 'tp_mult': 1.6038327483098125, 'tsl_mult': 0.45640870728478294, 'strategy': 'mean_reversion', 'time_stop': 256, 'use_sma': True, 'use_atr': False, 'use_adx': True, 'use_ema': True, 'use_spike': True, 'rsi_required': True, 'edge_k': 1.9682647560377595, 'edge_cap': 0.10722978756410025, 'bull_strategy': 'breakout', 'bull_bb_std_mult': 2.619198268219604, 'bull_rsi_os': 12, 'bull_rsi_ob': 69, 'bull_adx_thresh': 23.810073506998215, 'bull_atr_min_pct': 0.0063316088006543005, 'bull_atr_max_pct': 0.025902021492615144, 'bull_tp_mult': 2.3185803539908534, 'bull_tsl_mult': 0.6389336328305073, 'bull_time_stop': 146, 'bull_use_sma': True, 'bull_use_ema': True, 'bull_use_atr': False, 'bull_use_adx': True, 'bull_use_spike': True, 'bull_rsi_required': False, 'bear_strategy': 'breakout', 'bear_bb_std_mult': 3.246126410595779, 'bear_rsi_os': 27, 'bear_rsi_ob': 94, 'bear_adx_thresh': 18.56476548365858, 'bear_atr_min_pct': 0.024217280884309668, 'bear_atr_max_pct': 0.0794012392546511, 'bear_tp_mult': 2.8584076243100247, 'bear_tsl_mult': 0.04458140200184562, 'bear_time_stop': 293, 'bear_use_sma': False, 'bear_use_ema': True, 'bear_use_atr': True, 'bear_use_adx': True, 'bear_use_spike': True, 'bear_rsi_required': True, 'sideways_strategy': 'mean_reversion', 'sideways_bb_std_mult': 0.7997849543009824, 'sideways_rsi_os': 39, 'sideways_rsi_ob': 72, 'sideways_adx_thresh': 9.718328867560917, 'sideways_atr_min_pct': 0.023848260353580876, 'sideways_atr_max_pct': 0.033749361356023584, 'sideways_tp_mult': 1.7605575494243468, 'sideways_tsl_mult': 0.4044345176212041, 'sideways_time_stop': 197, 'sideways_use_sma': True, 'sideways_use_ema': False, 'sideways_use_atr': False, 'sideways_use_adx': True, 'sideways_use_spike': True, 'sideways_rsi_required': False}.
[I 2025-09-01 08:46:28,917] Trial 528 finished with values: [-1000000000.0, 1000000000.0] and parameters: {'p_sma': 24, 'p_std': 15, 'p_atr': 14, 'p_adx': 19, 'rsi_period': 53, 'ema1': 9, 'ema2': 38, 'slip_atr_k': 0.18760340404035641, 'slip_spread_k': 0.6093525065900713, 'spread_hl_frac': 0.02450093588630396, 'bb_std_mult': 3.3697014419779556, 'rsi_os': 22, 'rsi_ob': 54, 'vol_spike': 0.23277027986826182, 'adx_thresh': 34.56464151779091, 'atr_min_pct': 0.020165857136413296, 'atr_max_pct': 0.03710692394736801, 'tp_mult': 2.7862321402661148, 'tsl_mult': 0.4600658132455077, 'strategy': 'mean_reversion', 'time_stop': 247, 'use_sma': False, 'use_atr': True, 'use_adx': True, 'use_ema': True, 'use_spike': True, 'rsi_required': False, 'edge_k': 0.05249587146777723, 'edge_cap': 0.10713683384590136, 'bull_strategy': 'mean_reversion', 'bull_bb_std_mult': 2.6091821507257817, 'bull_rsi_os': 13, 'bull_rsi_ob': 77, 'bull_adx_thresh': 7.964705255879123, 'bull_atr_min_pct': 0.006164490328131081, 'bull_atr_max_pct': 0.05296640886201071, 'bull_tp_mult': 1.794940128097935, 'bull_tsl_mult': 0.9481068111039527, 'bull_time_stop': 145, 'bull_use_sma': True, 'bull_use_ema': False, 'bull_use_atr': False, 'bull_use_adx': True, 'bull_use_spike': True, 'bull_rsi_required': False, 'bear_strategy': 'mean_reversion', 'bear_bb_std_mult': 1.9062146312652104, 'bear_rsi_os': 27, 'bear_rsi_ob': 94, 'bear_adx_thresh': 20.7078893471575, 'bear_atr_min_pct': 0.005415911387353312, 'bear_atr_max_pct': 0.07838475421676086, 'bear_tp_mult': 2.7059317740655806, 'bear_tsl_mult': 0.570740906604657, 'bear_time_stop': 95, 'bear_use_sma': False, 'bear_use_ema': True, 'bear_use_atr': True, 'bear_use_adx': False, 'bear_use_spike': True, 'bear_rsi_required': False, 'sideways_strategy': 'mean_reversion', 'sideways_bb_std_mult': 1.0423048551933667, 'sideways_rsi_os': 38, 'sideways_rsi_ob': 70, 'sideways_adx_thresh': 11.444561890636976, 'sideways_atr_min_pct': 0.021814432551892766, 'sideways_atr_max_pct': 0.03018698284576026, 'sideways_tp_mult': 2.473101442204432, 'sideways_tsl_mult': 0.819675657976866, 'sideways_time_stop': 300, 'sideways_use_sma': False, 'sideways_use_ema': False, 'sideways_use_atr': False, 'sideways_use_adx': True, 'sideways_use_spike': True, 'sideways_rsi_required': False}.
[I 2025-09-01 08:46:29,197] Trial 526 finished with values: [-1000000000.0, 1000000000.0] and parameters: {'p_sma': 37, 'p_std': 7, 'p_atr': 11, 'p_adx': 25, 'rsi_period': 67, 'ema1': 29, 'ema2': 30, 'slip_atr_k': 0.0005915837073191127, 'slip_spread_k': 0.6379440333664246, 'spread_hl_frac': 0.024407075344959568, 'bb_std_mult': 2.362946663764517, 'rsi_os': 18, 'rsi_ob': 79, 'vol_spike': 0.2495998997500786, 'adx_thresh': 22.71846861665673, 'atr_min_pct': 0.023579589050565293, 'atr_max_pct': 0.08809268275001245, 'tp_mult': 2.3256878941727086, 'tsl_mult': 0.4681388201714011, 'strategy': 'mean_reversion', 'time_stop': 248, 'use_sma': False, 'use_atr': True, 'use_adx': True, 'use_ema': True, 'use_spike': True, 'rsi_required': False, 'edge_k': 1.0095687762166814, 'edge_cap': 0.5197124577206156, 'bull_strategy': 'mean_reversion', 'bull_bb_std_mult': 2.8060374408450324, 'bull_rsi_os': 10, 'bull_rsi_ob': 56, 'bull_adx_thresh': 23.807966808819042, 'bull_atr_min_pct': 0.00827513073669282, 'bull_atr_max_pct': 0.053132562254599516, 'bull_tp_mult': 1.8025798326791937, 'bull_tsl_mult': 0.8631127017152042, 'bull_time_stop': 38, 'bull_use_sma': True, 'bull_use_ema': False, 'bull_use_atr': False, 'bull_use_adx': True, 'bull_use_spike': True, 'bull_rsi_required': False, 'bear_strategy': 'mean_reversion', 'bear_bb_std_mult': 1.9367593338583806, 'bear_rsi_os': 27, 'bear_rsi_ob': 94, 'bear_adx_thresh': 7.441924016198273, 'bear_atr_min_pct': 0.023966812156547286, 'bear_atr_max_pct': 0.07924106407566905, 'bear_tp_mult': 2.7439584261324423, 'bear_tsl_mult': 0.7209976626678822, 'bear_time_stop': 215, 'bear_use_sma': False, 'bear_use_ema': True, 'bear_use_atr': True, 'bear_use_adx': False, 'bear_use_spike': True, 'bear_rsi_required': False, 'sideways_strategy': 'mean_reversion', 'sideways_bb_std_mult': 0.957442737703224, 'sideways_rsi_os': 13, 'sideways_rsi_ob': 61, 'sideways_adx_thresh': 7.759395848489309, 'sideways_atr_min_pct': 0.02139372773909281, 'sideways_atr_max_pct': 0.030048930980273978, 'sideways_tp_mult': 1.6298750576890941, 'sideways_tsl_mult': 0.819188216016558, 'sideways_time_stop': 22, 'sideways_use_sma': False, 'sideways_use_ema': False, 'sideways_use_atr': False, 'sideways_use_adx': True, 'sideways_use_spike': True, 'sideways_rsi_required': False}.
[I 2025-09-01 08:46:30,411] Trial 531 finished with values: [-1000000000.0, 1000000000.0] and parameters: {'p_sma': 17, 'p_std': 19, 'p_atr': 11, 'p_adx': 20, 'rsi_period': 67, 'ema1': 29, 'ema2': 11, 'slip_atr_k': 0.05737599865917007, 'slip_spread_k': 0.6349219288187582, 'spread_hl_frac': 0.02183295954911523, 'bb_std_mult': 1.1248035798314446, 'rsi_os': 53, 'rsi_ob': 57, 'vol_spike': 0.2516845483251573, 'adx_thresh': 16.037451279336143, 'atr_min_pct': 0.02343999816771244, 'atr_max_pct': 0.09458220390200422, 'tp_mult': 1.2005811268894873, 'tsl_mult': 0.716459170342029, 'strategy': 'mean_reversion', 'time_stop': 236, 'use_sma': True, 'use_atr': True, 'use_adx': True, 'use_ema': False, 'use_spike': False, 'rsi_required': True, 'edge_k': 0.7596060032017278, 'edge_cap': 0.08298154022660975, 'bull_strategy': 'breakout', 'bull_bb_std_mult': 3.200970930452182, 'bull_rsi_os': 49, 'bull_rsi_ob': 71, 'bull_adx_thresh': 29.08762877204914, 'bull_atr_min_pct': 0.007162200172049297, 'bull_atr_max_pct': 0.03835467334122425, 'bull_tp_mult': 2.8409220470742524, 'bull_tsl_mult': 0.9776070981458316, 'bull_time_stop': 166, 'bull_use_sma': True, 'bull_use_ema': False, 'bull_use_atr': False, 'bull_use_adx': True, 'bull_use_spike': True, 'bull_rsi_required': False, 'bear_strategy': 'mean_reversion', 'bear_bb_std_mult': 2.450246137874892, 'bear_rsi_os': 25, 'bear_rsi_ob': 66, 'bear_adx_thresh': 30.05342776595861, 'bear_atr_min_pct': 0.014552265950094496, 'bear_atr_max_pct': 0.01890907006164745, 'bear_tp_mult': 2.746564013635643, 'bear_tsl_mult': 0.9797789213025364, 'bear_time_stop': 61, 'bear_use_sma': False, 'bear_use_ema': False, 'bear_use_atr': True, 'bear_use_adx': True, 'bear_use_spike': True, 'bear_rsi_required': False, 'sideways_strategy': 'breakout', 'sideways_bb_std_mult': 2.0728898590242566, 'sideways_rsi_os': 41, 'sideways_rsi_ob': 60, 'sideways_adx_thresh': 10.59219705110795, 'sideways_atr_min_pct': 0.021119304084856533, 'sideways_atr_max_pct': 0.026710755166935492, 'sideways_tp_mult': 2.604823162467133, 'sideways_tsl_mult': 0.172401578888997, 'sideways_time_stop': 102, 'sideways_use_sma': False, 'sideways_use_ema': False, 'sideways_use_atr': True, 'sideways_use_adx': True, 'sideways_use_spike': True, 'sideways_rsi_required': False}.
[I 2025-09-01 08:46:30,535] Trial 530 finished with values: [-1000000000.0, 1000000000.0] and parameters: {'p_sma': 23, 'p_std': 52, 'p_atr': 11, 'p_adx': 17, 'rsi_period': 39, 'ema1': 25, 'ema2': 29, 'slip_atr_k': 0.05800400110326097, 'slip_spread_k': 0.45624972837267286, 'spread_hl_frac': 0.022034449400065055, 'bb_std_mult': 0.7825945931542935, 'rsi_os': 52, 'rsi_ob': 56, 'vol_spike': 0.2314292904107851, 'adx_thresh': 20.821905054339428, 'atr_min_pct': 0.023890324383942528, 'atr_max_pct': 0.09295643080356512, 'tp_mult': 1.2086112455395501, 'tsl_mult': 0.4961030057608903, 'strategy': 'mean_reversion', 'time_stop': 271, 'use_sma': False, 'use_atr': True, 'use_adx': True, 'use_ema': False, 'use_spike': True, 'rsi_required': False, 'edge_k': 1.000632745057481, 'edge_cap': 0.1492261197483093, 'bull_strategy': 'mean_reversion', 'bull_bb_std_mult': 2.8251836825191203, 'bull_rsi_os': 10, 'bull_rsi_ob': 71, 'bull_adx_thresh': 28.560028270691532, 'bull_atr_min_pct': 0.02297649468539981, 'bull_atr_max_pct': 0.05270109291904725, 'bull_tp_mult': 1.7984861235939302, 'bull_tsl_mult': 0.7363188248937248, 'bull_time_stop': 138, 'bull_use_sma': True, 'bull_use_ema': False, 'bull_use_atr': False, 'bull_use_adx': True, 'bull_use_spike': True, 'bull_rsi_required': False, 'bear_strategy': 'mean_reversion', 'bear_bb_std_mult': 1.710413015456379, 'bear_rsi_os': 27, 'bear_rsi_ob': 93, 'bear_adx_thresh': 33.22366490448258, 'bear_atr_min_pct': 0.022628318527188447, 'bear_atr_max_pct': 0.018899242037029536, 'bear_tp_mult': 2.6886004026255086, 'bear_tsl_mult': 0.5742171139393993, 'bear_time_stop': 10, 'bear_use_sma': False, 'bear_use_ema': False, 'bear_use_atr': True, 'bear_use_adx': True, 'bear_use_spike': True, 'bear_rsi_required': False, 'sideways_strategy': 'breakout', 'sideways_bb_std_mult': 1.7892606264952329, 'sideways_rsi_os': 38, 'sideways_rsi_ob': 70, 'sideways_adx_thresh': 11.383782164197612, 'sideways_atr_min_pct': 0.0211055985268132, 'sideways_atr_max_pct': 0.02848398957217699, 'sideways_tp_mult': 2.95739539764209, 'sideways_tsl_mult': 0.8114336887340363, 'sideways_time_stop': 21, 'sideways_use_sma': False, 'sideways_use_ema': False, 'sideways_use_atr': True, 'sideways_use_adx': True, 'sideways_use_spike': True, 'sideways_rsi_required': False}.
