[I 2025-09-01 07:43:40,235] Trial 144 finished with values: [-1000000000.0, 1000000000.0] and parameters: {'p_sma': 31, 'p_std': 60, 'p_atr': 16, 'p_adx': 21, 'rsi_period': 79, 'ema1': 12, 'ema2': 24, 'slip_atr_k': 0.17483598594409844, 'slip_spread_k': 0.616626182543935, 'spread_hl_frac': 0.022961646009072034, 'bb_std_mult': 3.243543669930926, 'rsi_os': 43, 'rsi_ob': 75, 'vol_spike': 0.0486400413547748, 'adx_thresh': 23.743121954126313, 'atr_min_pct': 0.022313514333669283, 'atr_max_pct': 0.1417621009548814, 'tp_mult': 1.247735610109784, 'tsl_mult': 0.30356480271102204, 'strategy': 'mean_reversion', 'time_stop': 17, 'use_sma': True, 'use_atr': True, 'use_adx': True, 'use_ema': True, 'use_spike': True, 'rsi_required': True, 'edge_k': 0.09617042735171288, 'edge_cap': 0.14154953342176768, 'bull_strategy': 'breakout', 'bull_bb_std_mult': 2.958033594732488, 'bull_rsi_os': 15, 'bull_rsi_ob': 60, 'bull_adx_thresh': 22.338444656903942, 'bull_atr_min_pct': 0.004864546447976066, 'bull_atr_max_pct': 0.042267589518568065, 'bull_tp_mult': 2.141044180481885, 'bull_tsl_mult': 0.46498098172476765, 'bull_time_stop': 228, 'bull_use_sma': True, 'bull_use_ema': False, 'bull_use_atr': True, 'bull_use_adx': True, 'bull_use_spike': False, 'bull_rsi_required': True, 'bear_strategy': 'mean_reversion', 'bear_bb_std_mult': 3.1787175391306115, 'bear_rsi_os': 30, 'bear_rsi_ob': 85, 'bear_adx_thresh': 22.389227440123786, 'bear_atr_min_pct': 0.023604459989744486, 'bear_atr_max_pct': 0.010355106189784274, 'bear_tp_mult': 1.0170962305895022, 'bear_tsl_mult': 0.8987513453234679, 'bear_time_stop': 41, 'bear_use_sma': False, 'bear_use_ema': False, 'bear_use_atr': True, 'bear_use_adx': True, 'bear_use_spike': True, 'bear_rsi_required': False, 'sideways_strategy': 'mean_reversion', 'sideways_bb_std_mult': 0.6016252353563468, 'sideways_rsi_os': 40, 'sideways_rsi_ob': 73, 'sideways_adx_thresh': 9.753025220695466, 'sideways_atr_min_pct': 0.0012024260562123138, 'sideways_atr_max_pct': 0.014319577461804685, 'sideways_tp_mult': 1.382749215809886, 'sideways_tsl_mult': 0.17385359411245652, 'sideways_time_stop': 54, 'sideways_use_sma': False, 'sideways_use_ema': False, 'sideways_use_atr': False, 'sideways_use_adx': False, 'sideways_use_spike': False, 'sideways_rsi_required': False}.
[I 2025-09-01 07:43:41,054] Trial 146 finished with values: [-1000000000.0, 1000000000.0] and parameters: {'p_sma': 12, 'p_std': 21, 'p_atr': 15, 'p_adx': 21, 'rsi_period': 67, 'ema1': 11, 'ema2': 24, 'slip_atr_k': 0.14744080849270508, 'slip_spread_k': 0.6088568078731119, 'spread_hl_frac': 0.022691310819425756, 'bb_std_mult': 3.418182947236955, 'rsi_os': 47, 'rsi_ob': 75, 'vol_spike': 0.18298979643451532, 'adx_thresh': 23.810418080326233, 'atr_min_pct': 0.02239191745474394, 'atr_max_pct': 0.1092053734970462, 'tp_mult': 1.1199344000569185, 'tsl_mult': 0.5422660462429404, 'strategy': 'mean_reversion', 'time_stop': 14, 'use_sma': True, 'use_atr': True, 'use_adx': True, 'use_ema': True, 'use_spike': True, 'rsi_required': True, 'edge_k': 1.3469001725547407, 'edge_cap': 0.14026110736340303, 'bull_strategy': 'breakout', 'bull_bb_std_mult': 2.982204184712759, 'bull_rsi_os': 12, 'bull_rsi_ob': 66, 'bull_adx_thresh': 9.59609040352307, 'bull_atr_min_pct': 0.004817244997317652, 'bull_atr_max_pct': 0.045877812505148885, 'bull_tp_mult': 1.7348459976746802, 'bull_tsl_mult': 0.7173593763423902, 'bull_time_stop': 265, 'bull_use_sma': True, 'bull_use_ema': False, 'bull_use_atr': True, 'bull_use_adx': True, 'bull_use_spike': False, 'bull_rsi_required': True, 'bear_strategy': 'mean_reversion', 'bear_bb_std_mult': 3.1712984835595774, 'bear_rsi_os': 30, 'bear_rsi_ob': 95, 'bear_adx_thresh': 28.368988529937766, 'bear_atr_min_pct': 0.023976515585489102, 'bear_atr_max_pct': 0.1489226874699937, 'bear_tp_mult': 2.819448054883508, 'bear_tsl_mult': 0.8219731768603842, 'bear_time_stop': 206, 'bear_use_sma': False, 'bear_use_ema': False, 'bear_use_atr': True, 'bear_use_adx': True, 'bear_use_spike': True, 'bear_rsi_required': False, 'sideways_strategy': 'mean_reversion', 'sideways_bb_std_mult': 3.333095623625826, 'sideways_rsi_os': 7, 'sideways_rsi_ob': 59, 'sideways_adx_thresh': 17.65369833288295, 'sideways_atr_min_pct': 0.023618493643637307, 'sideways_atr_max_pct': 0.014752661343380657, 'sideways_tp_mult': 2.837541643502136, 'sideways_tsl_mult': 0.2982302904775644, 'sideways_time_stop': 22, 'sideways_use_sma': False, 'sideways_use_ema': False, 'sideways_use_atr': False, 'sideways_use_adx': False, 'sideways_use_spike': False, 'sideways_rsi_required': False}.
[I 2025-09-01 07:43:41,480] Trial 143 finished with values: [-1000000000.0, 1000000000.0] and parameters: {'p_sma': 31, 'p_std': 9, 'p_atr': 9, 'p_adx': 23, 'rsi_period': 62, 'ema1': 5, 'ema2': 16, 'slip_atr_k': 0.17427876322485136, 'slip_spread_k': 0.24191879151513357, 'spread_hl_frac': 0.022772401379542173, 'bb_std_mult': 3.572333139409103, 'rsi_os': 24, 'rsi_ob': 52, 'vol_spike': 0.21675073826729874, 'adx_thresh': 23.885328720418222, 'atr_min_pct': 0.023434340875458842, 'atr_max_pct': 0.1373217464718808, 'tp_mult': 2.845395082211624, 'tsl_mult': 0.3552115915278095, 'strategy': 'mean_reversion', 'time_stop': 58, 'use_sma': True, 'use_atr': True, 'use_adx': True, 'use_ema': True, 'use_spike': True, 'rsi_required': True, 'edge_k': 0.8297317776177586, 'edge_cap': 0.3575762834618258, 'bull_strategy': 'breakout', 'bull_bb_std_mult': 3.089389334040503, 'bull_rsi_os': 15, 'bull_rsi_ob': 49, 'bull_adx_thresh': 7.038855946152774, 'bull_atr_min_pct': 0.02542204465954954, 'bull_atr_max_pct': 0.03524436218655136, 'bull_tp_mult': 1.57068597804769, 'bull_tsl_mult': 0.7882402838628613, 'bull_time_stop': 113, 'bull_use_sma': True, 'bull_use_ema': False, 'bull_use_atr': False, 'bull_use_adx': True, 'bull_use_spike': True, 'bull_rsi_required': True, 'bear_strategy': 'mean_reversion', 'bear_bb_std_mult': 3.17128691280002, 'bear_rsi_os': 27, 'bear_rsi_ob': 89, 'bear_adx_thresh': 22.525648031710766, 'bear_atr_min_pct': 0.0012053244762792181, 'bear_atr_max_pct': 0.07618091601558045, 'bear_tp_mult': 1.054878604447997, 'bear_tsl_mult': 0.04297596145348492, 'bear_time_stop': 23, 'bear_use_sma': False, 'bear_use_ema': False, 'bear_use_atr': True, 'bear_use_adx': True, 'bear_use_spike': True, 'bear_rsi_required': False, 'sideways_strategy': 'mean_reversion', 'sideways_bb_std_mult': 0.5783057985313776, 'sideways_rsi_os': 34, 'sideways_rsi_ob': 73, 'sideways_adx_thresh': 10.80193124744619, 'sideways_atr_min_pct': 0.022471562878030753, 'sideways_atr_max_pct': 0.027686106219768507, 'sideways_tp_mult': 2.834339198116414, 'sideways_tsl_mult': 0.18688632947807285, 'sideways_time_stop': 231, 'sideways_use_sma': False, 'sideways_use_ema': False, 'sideways_use_atr': False, 'sideways_use_adx': True, 'sideways_use_spike': True, 'sideways_rsi_required': False}.
[I 2025-09-01 07:43:41,907] Trial 149 finished with values: [-1000000000.0, 1000000000.0] and parameters: {'p_sma': 21, 'p_std': 9, 'p_atr': 9, 'p_adx': 22, 'rsi_period': 71, 'ema1': 23, 'ema2': 27, 'slip_atr_k': 0.07059495182155556, 'slip_spread_k': 0.21074822819518246, 'spread_hl_frac': 0.024596194302137116, 'bb_std_mult': 3.427566171236036, 'rsi_os': 50, 'rsi_ob': 56, 'vol_spike': 0.03495663611452872, 'adx_thresh': 6.6624451851226585, 'atr_min_pct': 0.01981349195164092, 'atr_max_pct': 0.13642754485354075, 'tp_mult': 1.21445494632176, 'tsl_mult': 0.47971841459330833, 'strategy': 'mean_reversion', 'time_stop': 249, 'use_sma': True, 'use_atr': True, 'use_adx': True, 'use_ema': False, 'use_spike': True, 'rsi_required': True, 'edge_k': 0.20999992243375454, 'edge_cap': 0.3524919520586441, 'bull_strategy': 'breakout', 'bull_bb_std_mult': 2.7144793392658144, 'bull_rsi_os': 5, 'bull_rsi_ob': 72, 'bull_adx_thresh': 10.17538656434288, 'bull_atr_min_pct': 0.010237059310580639, 'bull_atr_max_pct': 0.0353093208077876, 'bull_tp_mult': 1.9766526686779942, 'bull_tsl_mult': 0.6594944880625772, 'bull_time_stop': 177, 'bull_use_sma': True, 'bull_use_ema': False, 'bull_use_atr': False, 'bull_use_adx': True, 'bull_use_spike': True, 'bull_rsi_required': False, 'bear_strategy': 'mean_reversion', 'bear_bb_std_mult': 1.3253678030767464, 'bear_rsi_os': 20, 'bear_rsi_ob': 70, 'bear_adx_thresh': 32.447289720841404, 'bear_atr_min_pct': 0.021821758289165355, 'bear_atr_max_pct': 0.07583408013399524, 'bear_tp_mult': 2.944510095545396, 'bear_tsl_mult': 0.04169792806368724, 'bear_time_stop': 132, 'bear_use_sma': False, 'bear_use_ema': False, 'bear_use_atr': True, 'bear_use_adx': True, 'bear_use_spike': False, 'bear_rsi_required': False, 'sideways_strategy': 'breakout', 'sideways_bb_std_mult': 1.0786718518461043, 'sideways_rsi_os': 37, 'sideways_rsi_ob': 67, 'sideways_adx_thresh': 20.284478213608963, 'sideways_atr_min_pct': 0.01835897503211871, 'sideways_atr_max_pct': 0.07830730641243078, 'sideways_tp_mult': 2.2935453722910815, 'sideways_tsl_mult': 0.19865180841382507, 'sideways_time_stop': 30, 'sideways_use_sma': False, 'sideways_use_ema': False, 'sideways_use_atr': True, 'sideways_use_adx': True, 'sideways_use_spike': True, 'sideways_rsi_required': False}.
[I 2025-09-01 07:44:21,094] Trial 147 finished with values: [-1000000000.0, 1000000000.0] and parameters: {'p_sma': 12, 'p_std': 9, 'p_atr': 16, 'p_adx': 21, 'rsi_period': 67, 'ema1': 12, 'ema2': 28, 'slip_atr_k': 0.10565403791829675, 'slip_spread_k': 0.13565539974833196, 'spread_hl_frac': 0.023074238484230097, 'bb_std_mult': 3.438047774458601, 'rsi_os': 24, 'rsi_ob': 75, 'vol_spike': 0.18489335372314578, 'adx_thresh': 23.833302785512267, 'atr_min_pct': 0.01973887336369269, 'atr_max_pct': 0.14066551100158992, 'tp_mult': 1.1101380179017477, 'tsl_mult': 0.5372551030472213, 'strategy': 'mean_reversion', 'time_stop': 59, 'use_sma': True, 'use_atr': True, 'use_adx': True, 'use_ema': True, 'use_spike': True, 'rsi_required': True, 'edge_k': 0.9616173411358433, 'edge_cap': 0.39029069195361477, 'bull_strategy': 'breakout', 'bull_bb_std_mult': 3.1172387691792354, 'bull_rsi_os': 15, 'bull_rsi_ob': 66, 'bull_adx_thresh': 9.038957879752033, 'bull_atr_min_pct': 0.0075230080974827305, 'bull_atr_max_pct': 0.03627830661215017, 'bull_tp_mult': 1.758748945756033, 'bull_tsl_mult': 0.4657198712206646, 'bull_time_stop': 265, 'bull_use_sma': True, 'bull_use_ema': False, 'bull_use_atr': True, 'bull_use_adx': True, 'bull_use_spike': False, 'bull_rsi_required': True, 'bear_strategy': 'mean_reversion', 'bear_bb_std_mult': 3.1753594626916386, 'bear_rsi_os': 28, 'bear_rsi_ob': 86, 'bear_adx_thresh': 33.89188446350265, 'bear_atr_min_pct': 0.02386357638413878, 'bear_atr_max_pct': 0.07530452903850832, 'bear_tp_mult': 1.989160962076637, 'bear_tsl_mult': 0.04095463132724197, 'bear_time_stop': 183, 'bear_use_sma': False, 'bear_use_ema': False, 'bear_use_atr': True, 'bear_use_adx': True, 'bear_use_spike': True, 'bear_rsi_required': False, 'sideways_strategy': 'mean_reversion', 'sideways_bb_std_mult': 0.5775393877276854, 'sideways_rsi_os': 7, 'sideways_rsi_ob': 63, 'sideways_adx_thresh': 10.04957670991785, 'sideways_atr_min_pct': 0.023689729604592476, 'sideways_atr_max_pct': 0.03483353877066132, 'sideways_tp_mult': 2.823899122687868, 'sideways_tsl_mult': 0.16824763701285228, 'sideways_time_stop': 22, 'sideways_use_sma': False, 'sideways_use_ema': False, 'sideways_use_atr': False, 'sideways_use_adx': False, 'sideways_use_spike': False, 'sideways_rsi_required': False}.
[I 2025-09-01 07:44:22,737] Trial 148 finished with values: [-1000000000.0, 1000000000.0] and parameters: {'p_sma': 37, 'p_std': 21, 'p_atr': 9, 'p_adx': 21, 'rsi_period': 72, 'ema1': 11, 'ema2': 38, 'slip_atr_k': 0.07227272023299557, 'slip_spread_k': 0.9381711122823702, 'spread_hl_frac': 0.022345292084968403, 'bb_std_mult': 3.284202950070861, 'rsi_os': 24, 'rsi_ob': 56, 'vol_spike': 0.030430256702381114, 'adx_thresh': 24.892596419088257, 'atr_min_pct': 0.022601432083799916, 'atr_max_pct': 0.1405887366824349, 'tp_mult': 1.1161078974861316, 'tsl_mult': 0.47692275126392114, 'strategy': 'mean_reversion', 'time_stop': 246, 'use_sma': True, 'use_atr': True, 'use_adx': True, 'use_ema': True, 'use_spike': True, 'rsi_required': True, 'edge_k': 0.5474873236366518, 'edge_cap': 0.35228724576742804, 'bull_strategy': 'breakout', 'bull_bb_std_mult': 3.080418140575972, 'bull_rsi_os': 12, 'bull_rsi_ob': 56, 'bull_adx_thresh': 9.88042431846711, 'bull_atr_min_pct': 0.01023212365371595, 'bull_atr_max_pct': 0.03540301634352722, 'bull_tp_mult': 1.9662504221088437, 'bull_tsl_mult': 0.5222777944403917, 'bull_time_stop': 178, 'bull_use_sma': True, 'bull_use_ema': False, 'bull_use_atr': False, 'bull_use_adx': True, 'bull_use_spike': True, 'bull_rsi_required': True, 'bear_strategy': 'mean_reversion', 'bear_bb_std_mult': 1.3378446072064054, 'bear_rsi_os': 20, 'bear_rsi_ob': 95, 'bear_adx_thresh': 28.11629881848098, 'bear_atr_min_pct': 0.02414614094078061, 'bear_atr_max_pct': 0.07800785828562243, 'bear_tp_mult': 2.933174129193834, 'bear_tsl_mult': 0.043278609622241115, 'bear_time_stop': 26, 'bear_use_sma': False, 'bear_use_ema': False, 'bear_use_atr': True, 'bear_use_adx': True, 'bear_use_spike': False, 'bear_rsi_required': False, 'sideways_strategy': 'mean_reversion', 'sideways_bb_std_mult': 3.3310890867938756, 'sideways_rsi_os': 7, 'sideways_rsi_ob': 59, 'sideways_adx_thresh': 11.572193395087712, 'sideways_atr_min_pct': 0.02371912348290663, 'sideways_atr_max_pct': 0.03673531956662443, 'sideways_tp_mult': 2.3173743322350377, 'sideways_tsl_mult': 0.1957928633265212, 'sideways_time_stop': 20, 'sideways_use_sma': False, 'sideways_use_ema': False, 'sideways_use_atr': False, 'sideways_use_adx': True, 'sideways_use_spike': True, 'sideways_rsi_required': False}.
[I 2025-09-01 07:44:23,250] Trial 150 finished with values: [-1000000000.0, 1000000000.0] and parameters: {'p_sma': 9, 'p_std': 16, 'p_atr': 11, 'p_adx': 20, 'rsi_period': 71, 'ema1': 11, 'ema2': 12, 'slip_atr_k': 0.07064621647671922, 'slip_spread_k': 0.6446920488738336, 'spread_hl_frac': 0.024730478091832306, 'bb_std_mult': 0.9400840303432965, 'rsi_os': 18, 'rsi_ob': 56, 'vol_spike': 0.2552034307816499, 'adx_thresh': 6.634634958924627, 'atr_min_pct': 0.019883377347503357, 'atr_max_pct': 0.03338976855435157, 'tp_mult': 2.4573904549458168, 'tsl_mult': 0.47657362134623915, 'strategy': 'mean_reversion', 'time_stop': 5, 'use_sma': True, 'use_atr': True, 'use_adx': True, 'use_ema': False, 'use_spike': True, 'rsi_required': True, 'edge_k': 0.2433788313104015, 'edge_cap': 0.5185204929635056, 'bull_strategy': 'breakout', 'bull_bb_std_mult': 2.693897969618297, 'bull_rsi_os': 31, 'bull_rsi_ob': 72, 'bull_adx_thresh': 10.030702772676905, 'bull_atr_min_pct': 0.01987133080974294, 'bull_atr_max_pct': 0.037515909380940446, 'bull_tp_mult': 1.670723062141139, 'bull_tsl_mult': 0.529677125895913, 'bull_time_stop': 163, 'bull_use_sma': True, 'bull_use_ema': False, 'bull_use_atr': False, 'bull_use_adx': True, 'bull_use_spike': True, 'bull_rsi_required': False, 'bear_strategy': 'mean_reversion', 'bear_bb_std_mult': 2.9233501391620944, 'bear_rsi_os': 20, 'bear_rsi_ob': 69, 'bear_adx_thresh': 32.5345115170644, 'bear_atr_min_pct': 0.022010386032554407, 'bear_atr_max_pct': 0.0880831782930805, 'bear_tp_mult': 2.921508473981742, 'bear_tsl_mult': 0.754967725224907, 'bear_time_stop': 97, 'bear_use_sma': False, 'bear_use_ema': False, 'bear_use_atr': True, 'bear_use_adx': True, 'bear_use_spike': False, 'bear_rsi_required': False, 'sideways_strategy': 'breakout', 'sideways_bb_std_mult': 0.674857411279654, 'sideways_rsi_os': 37, 'sideways_rsi_ob': 63, 'sideways_adx_thresh': 9.851944607089417, 'sideways_atr_min_pct': 0.006449289200755182, 'sideways_atr_max_pct': 0.07783934949998843, 'sideways_tp_mult': 2.3062600090385357, 'sideways_tsl_mult': 0.20961207735523749, 'sideways_time_stop': 30, 'sideways_use_sma': False, 'sideways_use_ema': False, 'sideways_use_atr': True, 'sideways_use_adx': True, 'sideways_use_spike': True, 'sideways_rsi_required': False}.
[I 2025-09-01 07:44:23,440] Trial 151 finished with values: [-0.09753229475288194, 0.09754357794953077] and parameters: {'p_sma': 18, 'p_std': 25, 'p_atr': 8, 'p_adx': 20, 'rsi_period': 58, 'ema1': 11, 'ema2': 12, 'slip_atr_k': 0.05106945165280333, 'slip_spread_k': 0.6520576838810227, 'spread_hl_frac': 0.025851861967520755, 'bb_std_mult': 0.7718047056743609, 'rsi_os': 23, 'rsi_ob': 63, 'vol_spike': 0.25674705305388296, 'adx_thresh': 24.893353146039406, 'atr_min_pct': 0.01943597373158562, 'atr_max_pct': 0.14981376962203502, 'tp_mult': 2.4644725640784797, 'tsl_mult': 0.46295282668931986, 'strategy': 'mean_reversion', 'time_stop': 247, 'use_sma': True, 'use_atr': True, 'use_adx': True, 'use_ema': True, 'use_spike': True, 'rsi_required': True, 'edge_k': 0.9601129727671389, 'edge_cap': 0.11474978234015709, 'bull_strategy': 'breakout', 'bull_bb_std_mult': 2.620058467803176, 'bull_rsi_os': 31, 'bull_rsi_ob': 53, 'bull_adx_thresh': 8.37950383015789, 'bull_atr_min_pct': 0.002150265717535923, 'bull_atr_max_pct': 0.1495525164461072, 'bull_tp_mult': 2.507820390753753, 'bull_tsl_mult': 0.5715798956846168, 'bull_time_stop': 163, 'bull_use_sma': True, 'bull_use_ema': False, 'bull_use_atr': False, 'bull_use_adx': True, 'bull_use_spike': True, 'bull_rsi_required': False, 'bear_strategy': 'mean_reversion', 'bear_bb_std_mult': 2.9115173406749233, 'bear_rsi_os': 51, 'bear_rsi_ob': 95, 'bear_adx_thresh': 26.46256093022517, 'bear_atr_min_pct': 0.02430458420368079, 'bear_atr_max_pct': 0.06114962527135328, 'bear_tp_mult': 2.7211722531131057, 'bear_tsl_mult': 0.19359120535359342, 'bear_time_stop': 57, 'bear_use_sma': False, 'bear_use_ema': False, 'bear_use_atr': True, 'bear_use_adx': True, 'bear_use_spike': False, 'bear_rsi_required': False, 'sideways_strategy': 'mean_reversion', 'sideways_bb_std_mult': 0.645778285163911, 'sideways_rsi_os': 42, 'sideways_rsi_ob': 57, 'sideways_adx_thresh': 11.619289148074602, 'sideways_atr_min_pct': 0.02443404524737336, 'sideways_atr_max_pct': 0.04460827932092224, 'sideways_tp_mult': 1.1652780592815708, 'sideways_tsl_mult': 0.2210096754483783, 'sideways_time_stop': 7, 'sideways_use_sma': False, 'sideways_use_ema': True, 'sideways_use_atr': False, 'sideways_use_adx': True, 'sideways_use_spike': True, 'sideways_rsi_required': False}.
[I 2025-09-01 07:45:04,036] Trial 154 finished with values: [-1000000000.0, 1000000000.0] and parameters: {'p_sma': 18, 'p_std': 25, 'p_atr': 17, 'p_adx': 20, 'rsi_period': 81, 'ema1': 30, 'ema2': 10, 'slip_atr_k': 0.05101295282867915, 'slip_spread_k': 0.6796880012739301, 'spread_hl_frac': 0.02000050222023656, 'bb_std_mult': 0.7802028795620446, 'rsi_os': 21, 'rsi_ob': 93, 'vol_spike': 0.2742004609848492, 'adx_thresh': 31.285265854437846, 'atr_min_pct': 0.021143413962066312, 'atr_max_pct': 0.14642057683659304, 'tp_mult': 2.24655960169375, 'tsl_mult': 0.4562111328074104, 'strategy': 'breakout', 'time_stop': 257, 'use_sma': False, 'use_atr': True, 'use_adx': False, 'use_ema': True, 'use_spike': True, 'rsi_required': False, 'edge_k': 0.9183954798642158, 'edge_cap': 0.11590756613286776, 'bull_strategy': 'mean_reversion', 'bull_bb_std_mult': 2.598882337717112, 'bull_rsi_os': 10, 'bull_rsi_ob': 70, 'bull_adx_thresh': 8.324328426604534, 'bull_atr_min_pct': 0.006149185272637848, 'bull_atr_max_pct': 0.05138462399323471, 'bull_tp_mult': 2.533216384905476, 'bull_tsl_mult': 0.5712300943645905, 'bull_time_stop': 150, 'bull_use_sma': False, 'bull_use_ema': False, 'bull_use_atr': False, 'bull_use_adx': True, 'bull_use_spike': True, 'bull_rsi_required': False, 'bear_strategy': 'mean_reversion', 'bear_bb_std_mult': 3.045530462857856, 'bear_rsi_os': 45, 'bear_rsi_ob': 78, 'bear_adx_thresh': 29.872013765586104, 'bear_atr_min_pct': 0.023030784998760042, 'bear_atr_max_pct': 0.08352714401949947, 'bear_tp_mult': 2.1727592869575765, 'bear_tsl_mult': 0.0027242972057486964, 'bear_time_stop': 88, 'bear_use_sma': False, 'bear_use_ema': False, 'bear_use_atr': True, 'bear_use_adx': True, 'bear_use_spike': True, 'bear_rsi_required': False, 'sideways_strategy': 'mean_reversion', 'sideways_bb_std_mult': 2.5840997158614534, 'sideways_rsi_os': 42, 'sideways_rsi_ob': 57, 'sideways_adx_thresh': 7.685964511077261, 'sideways_atr_min_pct': 0.01616819123077857, 'sideways_atr_max_pct': 0.03219092565644759, 'sideways_tp_mult': 2.9932069529774097, 'sideways_tsl_mult': 0.12767383268348867, 'sideways_time_stop': 9, 'sideways_use_sma': False, 'sideways_use_ema': True, 'sideways_use_atr': False, 'sideways_use_adx': True, 'sideways_use_spike': True, 'sideways_rsi_required': False}.
