[I 2025-09-01 07:33:22,586] Trial 80 finished with values: [-1000000000.0, 1000000000.0] and parameters: {'p_sma': 35, 'p_std': 32, 'p_atr': 27, 'p_adx': 27, 'rsi_period': 37, 'ema1': 9, 'ema2': 22, 'slip_atr_k': 0.16603600078238104, 'slip_spread_k': 0.699254894393046, 'spread_hl_frac': 0.008531643489738474, 'bb_std_mult': 0.5559909765606084, 'rsi_os': 19, 'rsi_ob': 57, 'vol_spike': 0.29763117502681313, 'adx_thresh': 22.40473880918063, 'atr_min_pct': 0.004329837057844021, 'atr_max_pct': 0.12790033853189767, 'tp_mult': 1.089636657005187, 'tsl_mult': 0.06162260165157699, 'strategy': 'mean_reversion', 'time_stop': 66, 'use_sma': True, 'use_atr': True, 'use_adx': True, 'use_ema': True, 'use_spike': False, 'rsi_required': True, 'edge_k': 1.0623792873002744, 'edge_cap': 0.4500144584768017, 'bull_strategy': 'mean_reversion', 'bull_bb_std_mult': 1.1817124941462716, 'bull_rsi_os': 49, 'bull_rsi_ob': 79, 'bull_adx_thresh': 19.4012865069476, 'bull_atr_min_pct': 0.011251899501743443, 'bull_atr_max_pct': 0.07093640812899338, 'bull_tp_mult': 1.2954922888283043, 'bull_tsl_mult': 0.2669739474165769, 'bull_time_stop': 18, 'bull_use_sma': True, 'bull_use_ema': False, 'bull_use_atr': True, 'bull_use_adx': True, 'bull_use_spike': False, 'bull_rsi_required': False, 'bear_strategy': 'breakout', 'bear_bb_std_mult': 1.8114565554982713, 'bear_rsi_os': 39, 'bear_rsi_ob': 75, 'bear_adx_thresh': 19.011560369630406, 'bear_atr_min_pct': 0.005789791205454128, 'bear_atr_max_pct': 0.07075998335217872, 'bear_tp_mult': 2.5077525268591434, 'bear_tsl_mult': 0.11150300154903942, 'bear_time_stop': 73, 'bear_use_sma': False, 'bear_use_ema': False, 'bear_use_atr': True, 'bear_use_adx': True, 'bear_use_spike': False, 'bear_rsi_required': True, 'sideways_strategy': 'breakout', 'sideways_bb_std_mult': 0.8925629378962407, 'sideways_rsi_os': 30, 'sideways_rsi_ob': 45, 'sideways_adx_thresh': 26.772984618999825, 'sideways_atr_min_pct': 0.02201183541009975, 'sideways_atr_max_pct': 0.08572946980911197, 'sideways_tp_mult': 1.9557231798693686, 'sideways_tsl_mult': 0.9479064995485739, 'sideways_time_stop': 270, 'sideways_use_sma': True, 'sideways_use_ema': True, 'sideways_use_atr': True, 'sideways_use_adx': False, 'sideways_use_spike': True, 'sideways_rsi_required': False}.
[I 2025-09-01 07:33:57,396] Trial 82 finished with values: [-1000000000.0, 1000000000.0] and parameters: {'p_sma': 17, 'p_std': 19, 'p_atr': 27, 'p_adx': 15, 'rsi_period': 61, 'ema1': 26, 'ema2': 12, 'slip_atr_k': 0.0425646367637928, 'slip_spread_k': 0.6980565679008277, 'spread_hl_frac': 4.400886683206956e-05, 'bb_std_mult': 1.8640666621386544, 'rsi_os': 30, 'rsi_ob': 74, 'vol_spike': 0.16774619468980148, 'adx_thresh': 22.47857884762432, 'atr_min_pct': 0.015545542908570308, 'atr_max_pct': 0.08090001275675471, 'tp_mult': 2.3582498528133797, 'tsl_mult': 0.4093304071861255, 'strategy': 'mean_reversion', 'time_stop': 221, 'use_sma': True, 'use_atr': True, 'use_adx': False, 'use_ema': True, 'use_spike': True, 'rsi_required': True, 'edge_k': 0.45753110975561917, 'edge_cap': 0.4845757819352457, 'bull_strategy': 'breakout', 'bull_bb_std_mult': 2.5388732894052484, 'bull_rsi_os': 28, 'bull_rsi_ob': 84, 'bull_adx_thresh': 19.005895748904383, 'bull_atr_min_pct': 0.006667496322554636, 'bull_atr_max_pct': 0.0584507226300902, 'bull_tp_mult': 2.5738800423614467, 'bull_tsl_mult': 0.5871333620717293, 'bull_time_stop': 136, 'bull_use_sma': True, 'bull_use_ema': False, 'bull_use_atr': False, 'bull_use_adx': False, 'bull_use_spike': True, 'bull_rsi_required': True, 'bear_strategy': 'breakout', 'bear_bb_std_mult': 3.356834660028875, 'bear_rsi_os': 7, 'bear_rsi_ob': 79, 'bear_adx_thresh': 16.631933969075533, 'bear_atr_min_pct': 0.02588343098811932, 'bear_atr_max_pct': 0.0764031561574673, 'bear_tp_mult': 2.673414750208336, 'bear_tsl_mult': 0.002430735280389118, 'bear_time_stop': 286, 'bear_use_sma': False, 'bear_use_ema': True, 'bear_use_atr': False, 'bear_use_adx': False, 'bear_use_spike': True, 'bear_rsi_required': False, 'sideways_strategy': 'breakout', 'sideways_bb_std_mult': 0.927453808602058, 'sideways_rsi_os': 37, 'sideways_rsi_ob': 82, 'sideways_adx_thresh': 5.160003157546992, 'sideways_atr_min_pct': 0.007169423477903156, 'sideways_atr_max_pct': 0.06696683123581836, 'sideways_tp_mult': 1.9771008155521057, 'sideways_tsl_mult': 0.5712252573232232, 'sideways_time_stop': 254, 'sideways_use_sma': True, 'sideways_use_ema': False, 'sideways_use_atr': True, 'sideways_use_adx': True, 'sideways_use_spike': True, 'sideways_rsi_required': True}.
[I 2025-09-01 07:34:00,316] Trial 84 finished with values: [-1000000000.0, 1000000000.0] and parameters: {'p_sma': 40, 'p_std': 19, 'p_atr': 8, 'p_adx': 8, 'rsi_period': 61, 'ema1': 23, 'ema2': 12, 'slip_atr_k': 0.03622401370933134, 'slip_spread_k': 0.7465588614588052, 'spread_hl_frac': 0.043092600823597046, 'bb_std_mult': 2.688647368812001, 'rsi_os': 30, 'rsi_ob': 62, 'vol_spike': 0.14816475727759726, 'adx_thresh': 18.53091108886935, 'atr_min_pct': 0.007873261453427904, 'atr_max_pct': 0.14642825115071287, 'tp_mult': 1.233519820060295, 'tsl_mult': 0.04570252677115276, 'strategy': 'mean_reversion', 'time_stop': 150, 'use_sma': True, 'use_atr': True, 'use_adx': False, 'use_ema': False, 'use_spike': True, 'rsi_required': False, 'edge_k': 1.989003746535666, 'edge_cap': 0.7481081749715615, 'bull_strategy': 'breakout', 'bull_bb_std_mult': 2.53551186335539, 'bull_rsi_os': 29, 'bull_rsi_ob': 65, 'bull_adx_thresh': 9.738831948958989, 'bull_atr_min_pct': 0.015664555074860118, 'bull_atr_max_pct': 0.09198071955520938, 'bull_tp_mult': 2.1422737117821957, 'bull_tsl_mult': 0.5833614243128443, 'bull_time_stop': 66, 'bull_use_sma': True, 'bull_use_ema': False, 'bull_use_atr': False, 'bull_use_adx': False, 'bull_use_spike': True, 'bull_rsi_required': True, 'bear_strategy': 'breakout', 'bear_bb_std_mult': 2.3348636561753007, 'bear_rsi_os': 27, 'bear_rsi_ob': 80, 'bear_adx_thresh': 8.281158503920526, 'bear_atr_min_pct': 0.029899595270520024, 'bear_atr_max_pct': 0.0851484656575989, 'bear_tp_mult': 2.220298577529749, 'bear_tsl_mult': 0.37294173448203094, 'bear_time_stop': 45, 'bear_use_sma': True, 'bear_use_ema': True, 'bear_use_atr': False, 'bear_use_adx': False, 'bear_use_spike': True, 'bear_rsi_required': False, 'sideways_strategy': 'mean_reversion', 'sideways_bb_std_mult': 1.0069531322452667, 'sideways_rsi_os': 33, 'sideways_rsi_ob': 51, 'sideways_adx_thresh': 23.446119255444174, 'sideways_atr_min_pct': 0.013890531458907262, 'sideways_atr_max_pct': 0.04752161547517731, 'sideways_tp_mult': 2.042361837138683, 'sideways_tsl_mult': 0.22235736597474326, 'sideways_time_stop': 252, 'sideways_use_sma': True, 'sideways_use_ema': False, 'sideways_use_atr': False, 'sideways_use_adx': True, 'sideways_use_spike': True, 'sideways_rsi_required': True}.
[I 2025-09-01 07:34:01,672] Trial 83 finished with values: [-1000000000.0, 1000000000.0] and parameters: {'p_sma': 18, 'p_std': 5, 'p_atr': 23, 'p_adx': 8, 'rsi_period': 62, 'ema1': 22, 'ema2': 12, 'slip_atr_k': 0.03444549619872973, 'slip_spread_k': 0.7470252364826809, 'spread_hl_frac': 0.04253138851705264, 'bb_std_mult': 1.896238520285034, 'rsi_os': 30, 'rsi_ob': 51, 'vol_spike': 0.2405414512068219, 'adx_thresh': 18.580245184556674, 'atr_min_pct': 0.02799598015635509, 'atr_max_pct': 0.07327937670135116, 'tp_mult': 2.419883860882902, 'tsl_mult': 0.45346245697540166, 'strategy': 'mean_reversion', 'time_stop': 152, 'use_sma': True, 'use_atr': True, 'use_adx': False, 'use_ema': False, 'use_spike': True, 'rsi_required': False, 'edge_k': 0.13644300193451897, 'edge_cap': 0.4704173333713146, 'bull_strategy': 'breakout', 'bull_bb_std_mult': 2.571511000066564, 'bull_rsi_os': 28, 'bull_rsi_ob': 65, 'bull_adx_thresh': 6.681505302171695, 'bull_atr_min_pct': 0.015569690277111659, 'bull_atr_max_pct': 0.10167049465209028, 'bull_tp_mult': 1.7157762983478002, 'bull_tsl_mult': 0.591598568698776, 'bull_time_stop': 72, 'bull_use_sma': True, 'bull_use_ema': False, 'bull_use_atr': False, 'bull_use_adx': False, 'bull_use_spike': True, 'bull_rsi_required': True, 'bear_strategy': 'breakout', 'bear_bb_std_mult': 2.323924994779312, 'bear_rsi_os': 7, 'bear_rsi_ob': 79, 'bear_adx_thresh': 8.307299812344821, 'bear_atr_min_pct': 0.01778277467626576, 'bear_atr_max_pct': 0.10776138935638066, 'bear_tp_mult': 2.518705949122986, 'bear_tsl_mult': 0.009106405586137345, 'bear_time_stop': 5, 'bear_use_sma': True, 'bear_use_ema': True, 'bear_use_atr': False, 'bear_use_adx': False, 'bear_use_spike': True, 'bear_rsi_required': False, 'sideways_strategy': 'mean_reversion', 'sideways_bb_std_mult': 0.9935118092038504, 'sideways_rsi_os': 38, 'sideways_rsi_ob': 51, 'sideways_adx_thresh': 26.886803715307625, 'sideways_atr_min_pct': 0.00736139886297312, 'sideways_atr_max_pct': 0.04838269966724302, 'sideways_tp_mult': 2.0516275017542074, 'sideways_tsl_mult': 0.951611484278972, 'sideways_time_stop': 93, 'sideways_use_sma': True, 'sideways_use_ema': False, 'sideways_use_atr': False, 'sideways_use_adx': True, 'sideways_use_spike': True, 'sideways_rsi_required': True}.
[I 2025-09-01 07:34:02,247] Trial 85 finished with values: [-1000000000.0, 1000000000.0] and parameters: {'p_sma': 18, 'p_std': 5, 'p_atr': 8, 'p_adx': 8, 'rsi_period': 52, 'ema1': 22, 'ema2': 12, 'slip_atr_k': 0.03569499610511947, 'slip_spread_k': 0.7400129651936389, 'spread_hl_frac': 0.042940358663692, 'bb_std_mult': 1.0268304380289834, 'rsi_os': 31, 'rsi_ob': 74, 'vol_spike': 0.14654525156426396, 'adx_thresh': 23.910259803811712, 'atr_min_pct': 0.028201834463858474, 'atr_max_pct': 0.07395859238091207, 'tp_mult': 2.463587163529553, 'tsl_mult': 0.047538518220619046, 'strategy': 'mean_reversion', 'time_stop': 188, 'use_sma': True, 'use_atr': True, 'use_adx': False, 'use_ema': False, 'use_spike': True, 'rsi_required': False, 'edge_k': 0.18987316386176034, 'edge_cap': 0.28013706636393104, 'bull_strategy': 'breakout', 'bull_bb_std_mult': 2.6420760207210656, 'bull_rsi_os': 54, 'bull_rsi_ob': 64, 'bull_adx_thresh': 6.8385345813968685, 'bull_atr_min_pct': 0.015436719528675997, 'bull_atr_max_pct': 0.0917009417546943, 'bull_tp_mult': 1.6954406800643027, 'bull_tsl_mult': 0.5849498284008329, 'bull_time_stop': 69, 'bull_use_sma': True, 'bull_use_ema': False, 'bull_use_atr': False, 'bull_use_adx': False, 'bull_use_spike': True, 'bull_rsi_required': True, 'bear_strategy': 'breakout', 'bear_bb_std_mult': 2.358395528390688, 'bear_rsi_os': 14, 'bear_rsi_ob': 80, 'bear_adx_thresh': 16.693876847193714, 'bear_atr_min_pct': 0.017891965692370292, 'bear_atr_max_pct': 0.07676423557058021, 'bear_tp_mult': 2.2737373991937067, 'bear_tsl_mult': 0.4230908590531959, 'bear_time_stop': 42, 'bear_use_sma': True, 'bear_use_ema': True, 'bear_use_atr': False, 'bear_use_adx': False, 'bear_use_spike': True, 'bear_rsi_required': False, 'sideways_strategy': 'mean_reversion', 'sideways_bb_std_mult': 0.9991790376520286, 'sideways_rsi_os': 37, 'sideways_rsi_ob': 82, 'sideways_adx_thresh': 34.88571201317668, 'sideways_atr_min_pct': 0.020358781015839673, 'sideways_atr_max_pct': 0.04856031888483263, 'sideways_tp_mult': 2.059116284365475, 'sideways_tsl_mult': 0.20926885304179438, 'sideways_time_stop': 133, 'sideways_use_sma': True, 'sideways_use_ema': False, 'sideways_use_atr': False, 'sideways_use_adx': True, 'sideways_use_spike': True, 'sideways_rsi_required': True}.
[I 2025-09-01 07:34:02,301] Trial 86 finished with values: [-1000000000.0, 1000000000.0] and parameters: {'p_sma': 47, 'p_std': 9, 'p_atr': 29, 'p_adx': 8, 'rsi_period': 73, 'ema1': 22, 'ema2': 44, 'slip_atr_k': 0.10015496750332498, 'slip_spread_k': 0.5221944339269443, 'spread_hl_frac': 0.045808672816306545, 'bb_std_mult': 2.13287874446845, 'rsi_os': 52, 'rsi_ob': 54, 'vol_spike': 0.14535145949084527, 'adx_thresh': 18.539433833282185, 'atr_min_pct': 0.009037943294690667, 'atr_max_pct': 0.07271275812442962, 'tp_mult': 1.2326034125764398, 'tsl_mult': 0.04903254894537755, 'strategy': 'mean_reversion', 'time_stop': 152, 'use_sma': True, 'use_atr': False, 'use_adx': False, 'use_ema': False, 'use_spike': True, 'rsi_required': False, 'edge_k': 0.8585442454080183, 'edge_cap': 0.307550060024804, 'bull_strategy': 'breakout', 'bull_bb_std_mult': 3.0463196037762557, 'bull_rsi_os': 51, 'bull_rsi_ob': 83, 'bull_adx_thresh': 9.942226260914044, 'bull_atr_min_pct': 0.01558955441937438, 'bull_atr_max_pct': 0.0921428469920737, 'bull_tp_mult': 2.703246569961595, 'bull_tsl_mult': 0.6434984924688493, 'bull_time_stop': 38, 'bull_use_sma': True, 'bull_use_ema': True, 'bull_use_atr': False, 'bull_use_adx': False, 'bull_use_spike': True, 'bull_rsi_required': True, 'bear_strategy': 'breakout', 'bear_bb_std_mult': 2.2036999314149446, 'bear_rsi_os': 27, 'bear_rsi_ob': 66, 'bear_adx_thresh': 8.47680218812746, 'bear_atr_min_pct': 0.014852544373107042, 'bear_atr_max_pct': 0.08351888541699143, 'bear_tp_mult': 2.2624562327240954, 'bear_tsl_mult': 0.17862168976191467, 'bear_time_stop': 44, 'bear_use_sma': True, 'bear_use_ema': True, 'bear_use_atr': False, 'bear_use_adx': False, 'bear_use_spike': True, 'bear_rsi_required': False, 'sideways_strategy': 'mean_reversion', 'sideways_bb_std_mult': 2.5236955452288528, 'sideways_rsi_os': 22, 'sideways_rsi_ob': 50, 'sideways_adx_thresh': 23.478129527595975, 'sideways_atr_min_pct': 0.026843259535847576, 'sideways_atr_max_pct': 0.04774038409543839, 'sideways_tp_mult': 2.054108508034107, 'sideways_tsl_mult': 0.8305575338419577, 'sideways_time_stop': 96, 'sideways_use_sma': True, 'sideways_use_ema': False, 'sideways_use_atr': False, 'sideways_use_adx': True, 'sideways_use_spike': True, 'sideways_rsi_required': True}.
[I 2025-09-01 07:34:02,819] Trial 87 finished with values: [-1000000000.0, 1000000000.0] and parameters: {'p_sma': 58, 'p_std': 6, 'p_atr': 10, 'p_adx': 22, 'rsi_period': 73, 'ema1': 11, 'ema2': 32, 'slip_atr_k': 0.07374212010291156, 'slip_spread_k': 0.6489068556504066, 'spread_hl_frac': 0.042539342157379714, 'bb_std_mult': 2.1222943556136538, 'rsi_os': 52, 'rsi_ob': 55, 'vol_spike': 0.15937242009508498, 'adx_thresh': 5.385696432821879, 'atr_min_pct': 0.02211882721035314, 'atr_max_pct': 0.07287789156259203, 'tp_mult': 1.608255369710214, 'tsl_mult': 0.45585804752599196, 'strategy': 'mean_reversion', 'time_stop': 18, 'use_sma': True, 'use_atr': False, 'use_adx': False, 'use_ema': False, 'use_spike': False, 'rsi_required': False, 'edge_k': 1.8459297439342235, 'edge_cap': 0.31730392277843256, 'bull_strategy': 'breakout', 'bull_bb_std_mult': 1.7439289755869196, 'bull_rsi_os': 55, 'bull_rsi_ob': 57, 'bull_adx_thresh': 5.0458305182799625, 'bull_atr_min_pct': 0.008249658540328365, 'bull_atr_max_pct': 0.04419476282544203, 'bull_tp_mult': 2.708297216390867, 'bull_tsl_mult': 0.641932182507759, 'bull_time_stop': 44, 'bull_use_sma': True, 'bull_use_ema': True, 'bull_use_atr': False, 'bull_use_adx': False, 'bull_use_spike': True, 'bull_rsi_required': True, 'bear_strategy': 'mean_reversion', 'bear_bb_std_mult': 2.198606141029488, 'bear_rsi_os': 48, 'bear_rsi_ob': 64, 'bear_adx_thresh': 8.91957950324977, 'bear_atr_min_pct': 0.014748604855817643, 'bear_atr_max_pct': 0.10357202751621972, 'bear_tp_mult': 2.5781561769336694, 'bear_tsl_mult': 0.18803022912127376, 'bear_time_stop': 269, 'bear_use_sma': True, 'bear_use_ema': True, 'bear_use_atr': False, 'bear_use_adx': False, 'bear_use_spike': True, 'bear_rsi_required': True, 'sideways_strategy': 'mean_reversion', 'sideways_bb_std_mult': 2.0233572350109874, 'sideways_rsi_os': 28, 'sideways_rsi_ob': 56, 'sideways_adx_thresh': 29.526826263711094, 'sideways_atr_min_pct': 0.026848700169720626, 'sideways_atr_max_pct': 0.10839927948487496, 'sideways_tp_mult': 2.1187102361833445, 'sideways_tsl_mult': 0.46679948285130385, 'sideways_time_stop': 84, 'sideways_use_sma': True, 'sideways_use_ema': False, 'sideways_use_atr': False, 'sideways_use_adx': True, 'sideways_use_spike': True, 'sideways_rsi_required': True}.
[I 2025-09-01 07:34:39,636] Trial 90 finished with values: [-1000000000.0, 1000000000.0] and parameters: {'p_sma': 14, 'p_std': 34, 'p_atr': 20, 'p_adx': 24, 'rsi_period': 55, 'ema1': 24, 'ema2': 15, 'slip_atr_k': 0.21076923942092166, 'slip_spread_k': 0.5885761654469588, 'spread_hl_frac': 0.04861818507433392, 'bb_std_mult': 3.0732250971061887, 'rsi_os': 28, 'rsi_ob': 61, 'vol_spike': 0.15968401722198172, 'adx_thresh': 19.81728881994964, 'atr_min_pct': 0.006303751201261058, 'atr_max_pct': 0.06298123150268833, 'tp_mult': 1.6364717233093475, 'tsl_mult': 0.022953863968504643, 'strategy': 'breakout', 'time_stop': 177, 'use_sma': False, 'use_atr': False, 'use_adx': True, 'use_ema': True, 'use_spike': False, 'rsi_required': True, 'edge_k': 1.8320674613046646, 'edge_cap': 0.5771949045028687, 'bull_strategy': 'breakout', 'bull_bb_std_mult': 2.3262853769495235, 'bull_rsi_os': 35, 'bull_rsi_ob': 86, 'bull_adx_thresh': 26.028931227182348, 'bull_atr_min_pct': 0.008080171918146755, 'bull_atr_max_pct': 0.0440299502268934, 'bull_tp_mult': 2.002885163509166, 'bull_tsl_mult': 0.5399181120574601, 'bull_time_stop': 162, 'bull_use_sma': False, 'bull_use_ema': True, 'bull_use_atr': True, 'bull_use_adx': True, 'bull_use_spike': False, 'bull_rsi_required': False, 'bear_strategy': 'mean_reversion', 'bear_bb_std_mult': 2.0067992766854457, 'bear_rsi_os': 29, 'bear_rsi_ob': 70, 'bear_adx_thresh': 26.744977085576046, 'bear_atr_min_pct': 0.004797674212000362, 'bear_atr_max_pct': 0.03977503582020776, 'bear_tp_mult': 1.6637994394645808, 'bear_tsl_mult': 0.5954931168449591, 'bear_time_stop': 87, 'bear_use_sma': False, 'bear_use_ema': False, 'bear_use_atr': True, 'bear_use_adx': True, 'bear_use_spike': False, 'bear_rsi_required': True, 'sideways_strategy': 'breakout', 'sideways_bb_std_mult': 2.132213098286887, 'sideways_rsi_os': 16, 'sideways_rsi_ob': 56, 'sideways_adx_thresh': 15.707932919365458, 'sideways_atr_min_pct': 0.0018052153716688508, 'sideways_atr_max_pct': 0.10861157246879219, 'sideways_tp_mult': 2.1243662661195013, 'sideways_tsl_mult': 0.7342109958568868, 'sideways_time_stop': 80, 'sideways_use_sma': True, 'sideways_use_ema': False, 'sideways_use_atr': True, 'sideways_use_adx': True, 'sideways_use_spike': False, 'sideways_rsi_required': False}.
[I 2025-09-01 07:34:39,925] Trial 89 finished with values: [-1000000000.0, 1000000000.0] and parameters: {'p_sma': 11, 'p_std': 8, 'p_atr': 10, 'p_adx': 22, 'rsi_period': 73, 'ema1': 26, 'ema2': 32, 'slip_atr_k': 0.07603007343638743, 'slip_spread_k': 0.6284900739693343, 'spread_hl_frac': 0.03396241208058995, 'bb_std_mult': 2.1586785617041944, 'rsi_os': 37, 'rsi_ob': 55, 'vol_spike': 0.13068616893960305, 'adx_thresh': 19.748283347373775, 'atr_min_pct': 0.008641535977720652, 'atr_max_pct': 0.06442032505342887, 'tp_mult': 1.8298889961542282, 'tsl_mult': 0.9253199601066877, 'strategy': 'mean_reversion', 'time_stop': 203, 'use_sma': True, 'use_atr': False, 'use_adx': True, 'use_ema': True, 'use_spike': False, 'rsi_required': True, 'edge_k': 1.685913669621495, 'edge_cap': 0.5669840463208555, 'bull_strategy': 'breakout', 'bull_bb_std_mult': 2.314659262733801, 'bull_rsi_os': 35, 'bull_rsi_ob': 83, 'bull_adx_thresh': 30.31385025279244, 'bull_atr_min_pct': 0.008041072601977978, 'bull_atr_max_pct': 0.044971285942873036, 'bull_tp_mult': 2.679466132776889, 'bull_tsl_mult': 0.6350752445790561, 'bull_time_stop': 51, 'bull_use_sma': False, 'bull_use_ema': True, 'bull_use_atr': True, 'bull_use_adx': True, 'bull_use_spike': False, 'bull_rsi_required': False, 'bear_strategy': 'mean_reversion', 'bear_bb_std_mult': 2.197979398117047, 'bear_rsi_os': 11, 'bear_rsi_ob': 65, 'bear_adx_thresh': 25.11835212461498, 'bear_atr_min_pct': 0.007342385336489833, 'bear_atr_max_pct': 0.04011558211495271, 'bear_tp_mult': 1.3371089077040799, 'bear_tsl_mult': 0.1752681773793578, 'bear_time_stop': 208, 'bear_use_sma': False, 'bear_use_ema': False, 'bear_use_atr': False, 'bear_use_adx': True, 'bear_use_spike': False, 'bear_rsi_required': True, 'sideways_strategy': 'breakout', 'sideways_bb_std_mult': 2.5157682136150368, 'sideways_rsi_os': 28, 'sideways_rsi_ob': 56, 'sideways_adx_thresh': 12.858746633686753, 'sideways_atr_min_pct': 0.01883251693892641, 'sideways_atr_max_pct': 0.10398451818109919, 'sideways_tp_mult': 2.114532986129136, 'sideways_tsl_mult': 0.644407454342176, 'sideways_time_stop': 192, 'sideways_use_sma': True, 'sideways_use_ema': False, 'sideways_use_atr': True, 'sideways_use_adx': True, 'sideways_use_spike': False, 'sideways_rsi_required': False}.
