[I 2025-09-01 08:05:01,488] Trial 279 finished with values: [-1000000000.0, 1000000000.0] and parameters: {'p_sma': 24, 'p_std': 24, 'p_atr': 22, 'p_adx': 20, 'rsi_period': 62, 'ema1': 6, 'ema2': 15, 'slip_atr_k': 0.034250220903053144, 'slip_spread_k': 0.6532561665609763, 'spread_hl_frac': 0.04955663103536366, 'bb_std_mult': 3.309617320477875, 'rsi_os': 19, 'rsi_ob': 88, 'vol_spike': 0.2909615583798837, 'adx_thresh': 24.228586612103197, 'atr_min_pct': 0.021131528144181174, 'atr_max_pct': 0.12276996553590053, 'tp_mult': 2.802708762290836, 'tsl_mult': 0.912912794766831, 'strategy': 'mean_reversion', 'time_stop': 80, 'use_sma': True, 'use_atr': True, 'use_adx': True, 'use_ema': True, 'use_spike': True, 'rsi_required': False, 'edge_k': 1.0119683846388337, 'edge_cap': 0.05016058822105473, 'bull_strategy': 'breakout', 'bull_bb_std_mult': 2.9938605841730577, 'bull_rsi_os': 12, 'bull_rsi_ob': 69, 'bull_adx_thresh': 25.016147484409835, 'bull_atr_min_pct': 0.02144351376339395, 'bull_atr_max_pct': 0.034001925774811065, 'bull_tp_mult': 1.5786301817161636, 'bull_tsl_mult': 0.6449711202752094, 'bull_time_stop': 233, 'bull_use_sma': True, 'bull_use_ema': False, 'bull_use_atr': False, 'bull_use_adx': True, 'bull_use_spike': True, 'bull_rsi_required': False, 'bear_strategy': 'mean_reversion', 'bear_bb_std_mult': 2.0058124397417045, 'bear_rsi_os': 51, 'bear_rsi_ob': 94, 'bear_adx_thresh': 32.32741076158755, 'bear_atr_min_pct': 0.018039408095663213, 'bear_atr_max_pct': 0.08237919102559223, 'bear_tp_mult': 2.468868091560794, 'bear_tsl_mult': 0.1101136253969063, 'bear_time_stop': 266, 'bear_use_sma': False, 'bear_use_ema': True, 'bear_use_atr': True, 'bear_use_adx': True, 'bear_use_spike': False, 'bear_rsi_required': False, 'sideways_strategy': 'mean_reversion', 'sideways_bb_std_mult': 0.8310409505987022, 'sideways_rsi_os': 39, 'sideways_rsi_ob': 57, 'sideways_adx_thresh': 10.050826934593214, 'sideways_atr_min_pct': 0.021365511338899752, 'sideways_atr_max_pct': 0.03415137225270208, 'sideways_tp_mult': 2.115566651482512, 'sideways_tsl_mult': 0.09580266651187487, 'sideways_time_stop': 227, 'sideways_use_sma': False, 'sideways_use_ema': True, 'sideways_use_atr': False, 'sideways_use_adx': True, 'sideways_use_spike': True, 'sideways_rsi_required': False}.
[I 2025-09-01 08:05:01,640] Trial 280 finished with values: [-1000000000.0, 1000000000.0] and parameters: {'p_sma': 24, 'p_std': 46, 'p_atr': 21, 'p_adx': 20, 'rsi_period': 68, 'ema1': 17, 'ema2': 41, 'slip_atr_k': 0.05421968177273437, 'slip_spread_k': 0.812565310570889, 'spread_hl_frac': 0.021523442941985983, 'bb_std_mult': 3.314236313434644, 'rsi_os': 15, 'rsi_ob': 56, 'vol_spike': 0.24736807804099642, 'adx_thresh': 28.480378387992104, 'atr_min_pct': 0.02110639447705141, 'atr_max_pct': 0.1499115284445431, 'tp_mult': 2.794053896897896, 'tsl_mult': 0.8890964361716174, 'strategy': 'mean_reversion', 'time_stop': 280, 'use_sma': True, 'use_atr': True, 'use_adx': True, 'use_ema': False, 'use_spike': True, 'rsi_required': False, 'edge_k': 1.650901714491138, 'edge_cap': 0.055455645160334334, 'bull_strategy': 'breakout', 'bull_bb_std_mult': 3.150085248728167, 'bull_rsi_os': 12, 'bull_rsi_ob': 60, 'bull_adx_thresh': 7.923596849278793, 'bull_atr_min_pct': 0.027500554110021745, 'bull_atr_max_pct': 0.03371476529638007, 'bull_tp_mult': 1.520171864011902, 'bull_tsl_mult': 0.6392081871380564, 'bull_time_stop': 181, 'bull_use_sma': True, 'bull_use_ema': False, 'bull_use_atr': False, 'bull_use_adx': True, 'bull_use_spike': True, 'bull_rsi_required': False, 'bear_strategy': 'breakout', 'bear_bb_std_mult': 2.3569335608832893, 'bear_rsi_os': 26, 'bear_rsi_ob': 84, 'bear_adx_thresh': 24.077672195232978, 'bear_atr_min_pct': 0.021581590204606597, 'bear_atr_max_pct': 0.08261927417988568, 'bear_tp_mult': 2.8221970225153825, 'bear_tsl_mult': 0.10711761673377544, 'bear_time_stop': 267, 'bear_use_sma': False, 'bear_use_ema': True, 'bear_use_atr': True, 'bear_use_adx': True, 'bear_use_spike': False, 'bear_rsi_required': False, 'sideways_strategy': 'mean_reversion', 'sideways_bb_std_mult': 0.664182960430415, 'sideways_rsi_os': 22, 'sideways_rsi_ob': 69, 'sideways_adx_thresh': 10.522090780134766, 'sideways_atr_min_pct': 0.024618458745867204, 'sideways_atr_max_pct': 0.12339778202915364, 'sideways_tp_mult': 2.6884451000993757, 'sideways_tsl_mult': 0.16074406798719107, 'sideways_time_stop': 94, 'sideways_use_sma': False, 'sideways_use_ema': True, 'sideways_use_atr': False, 'sideways_use_adx': True, 'sideways_use_spike': True, 'sideways_rsi_required': False}.
[I 2025-09-01 08:05:01,788] Trial 281 finished with values: [-1000000000.0, 1000000000.0] and parameters: {'p_sma': 22, 'p_std': 13, 'p_atr': 25, 'p_adx': 23, 'rsi_period': 62, 'ema1': 10, 'ema2': 15, 'slip_atr_k': 0.06263199819507784, 'slip_spread_k': 0.6550470487297643, 'spread_hl_frac': 0.023856786333219648, 'bb_std_mult': 3.4405092861237696, 'rsi_os': 15, 'rsi_ob': 56, 'vol_spike': 0.24749805511029116, 'adx_thresh': 28.492497779150444, 'atr_min_pct': 0.02126719222866387, 'atr_max_pct': 0.141657434738411, 'tp_mult': 1.9035427131819298, 'tsl_mult': 0.2751623523626525, 'strategy': 'mean_reversion', 'time_stop': 74, 'use_sma': True, 'use_atr': True, 'use_adx': True, 'use_ema': True, 'use_spike': True, 'rsi_required': True, 'edge_k': 1.013335153928001, 'edge_cap': 0.05478548481448089, 'bull_strategy': 'breakout', 'bull_bb_std_mult': 1.156931467648354, 'bull_rsi_os': 12, 'bull_rsi_ob': 70, 'bull_adx_thresh': 15.031361857461318, 'bull_atr_min_pct': 0.017389699607786246, 'bull_atr_max_pct': 0.033403306522813286, 'bull_tp_mult': 1.521043392947174, 'bull_tsl_mult': 0.586685532103651, 'bull_time_stop': 152, 'bull_use_sma': True, 'bull_use_ema': False, 'bull_use_atr': False, 'bull_use_adx': True, 'bull_use_spike': True, 'bull_rsi_required': False, 'bear_strategy': 'breakout', 'bear_bb_std_mult': 3.1046493890660507, 'bear_rsi_os': 26, 'bear_rsi_ob': 84, 'bear_adx_thresh': 23.919002192909904, 'bear_atr_min_pct': 0.023241414391137846, 'bear_atr_max_pct': 0.082490281153252, 'bear_tp_mult': 2.466142401881851, 'bear_tsl_mult': 0.1764820127551756, 'bear_time_stop': 108, 'bear_use_sma': False, 'bear_use_ema': True, 'bear_use_atr': True, 'bear_use_adx': True, 'bear_use_spike': False, 'bear_rsi_required': True, 'sideways_strategy': 'mean_reversion', 'sideways_bb_std_mult': 2.3824847603905437, 'sideways_rsi_os': 22, 'sideways_rsi_ob': 69, 'sideways_adx_thresh': 10.783897159534183, 'sideways_atr_min_pct': 0.013374524754026918, 'sideways_atr_max_pct': 0.12256222588900327, 'sideways_tp_mult': 2.709748031225746, 'sideways_tsl_mult': 0.15802650442134222, 'sideways_time_stop': 93, 'sideways_use_sma': False, 'sideways_use_ema': True, 'sideways_use_atr': False, 'sideways_use_adx': True, 'sideways_use_spike': True, 'sideways_rsi_required': False}.
[I 2025-09-01 08:05:49,603] Trial 284 finished with values: [-1000000000.0, 1000000000.0] and parameters: {'p_sma': 20, 'p_std': 14, 'p_atr': 11, 'p_adx': 23, 'rsi_period': 74, 'ema1': 10, 'ema2': 43, 'slip_atr_k': 0.18341192214067786, 'slip_spread_k': 0.14456643625755944, 'spread_hl_frac': 0.031704964856190454, 'bb_std_mult': 2.4816573461703415, 'rsi_os': 42, 'rsi_ob': 59, 'vol_spike': 0.08998251196723348, 'adx_thresh': 9.16207602639006, 'atr_min_pct': 0.001956848494960247, 'atr_max_pct': 0.08009195601857737, 'tp_mult': 1.4171640128244478, 'tsl_mult': 0.2726284279716863, 'strategy': 'mean_reversion', 'time_stop': 219, 'use_sma': True, 'use_atr': True, 'use_adx': True, 'use_ema': True, 'use_spike': True, 'rsi_required': True, 'edge_k': 1.0034308638020746, 'edge_cap': 0.10847274340369271, 'bull_strategy': 'breakout', 'bull_bb_std_mult': 2.308863171537251, 'bull_rsi_os': 14, 'bull_rsi_ob': 89, 'bull_adx_thresh': 10.315940766380146, 'bull_atr_min_pct': 0.007728377552116237, 'bull_atr_max_pct': 0.03988962964979257, 'bull_tp_mult': 2.8919711408038276, 'bull_tsl_mult': 0.5798433556301621, 'bull_time_stop': 118, 'bull_use_sma': False, 'bull_use_ema': False, 'bull_use_atr': False, 'bull_use_adx': True, 'bull_use_spike': True, 'bull_rsi_required': False, 'bear_strategy': 'breakout', 'bear_bb_std_mult': 3.004790193140453, 'bear_rsi_os': 24, 'bear_rsi_ob': 62, 'bear_adx_thresh': 31.773101884005513, 'bear_atr_min_pct': 0.026717702690049847, 'bear_atr_max_pct': 0.10155182243730909, 'bear_tp_mult': 2.887359532308497, 'bear_tsl_mult': 0.5963428646065098, 'bear_time_stop': 239, 'bear_use_sma': False, 'bear_use_ema': False, 'bear_use_atr': False, 'bear_use_adx': True, 'bear_use_spike': True, 'bear_rsi_required': True, 'sideways_strategy': 'mean_reversion', 'sideways_bb_std_mult': 3.2781185394781387, 'sideways_rsi_os': 9, 'sideways_rsi_ob': 58, 'sideways_adx_thresh': 8.567435874951785, 'sideways_atr_min_pct': 0.026499423518452293, 'sideways_atr_max_pct': 0.05944038065721326, 'sideways_tp_mult': 1.506040585315239, 'sideways_tsl_mult': 0.12917078418288444, 'sideways_time_stop': 26, 'sideways_use_sma': False, 'sideways_use_ema': False, 'sideways_use_atr': False, 'sideways_use_adx': True, 'sideways_use_spike': True, 'sideways_rsi_required': False}.
[I 2025-09-01 08:05:50,714] Trial 283 finished with values: [-1000000000.0, 1000000000.0] and parameters: {'p_sma': 20, 'p_std': 5, 'p_atr': 11, 'p_adx': 13, 'rsi_period': 57, 'ema1': 7, 'ema2': 16, 'slip_atr_k': 0.09757279379475074, 'slip_spread_k': 0.7158674640001745, 'spread_hl_frac': 0.01655936781650707, 'bb_std_mult': 2.4655839430717297, 'rsi_os': 34, 'rsi_ob': 77, 'vol_spike': 0.2590590702378068, 'adx_thresh': 23.319529157228445, 'atr_min_pct': 0.02170643026450333, 'atr_max_pct': 0.10464187420737049, 'tp_mult': 2.876144504164535, 'tsl_mult': 0.23328432626782963, 'strategy': 'mean_reversion', 'time_stop': 254, 'use_sma': True, 'use_atr': True, 'use_adx': True, 'use_ema': True, 'use_spike': True, 'rsi_required': True, 'edge_k': 0.05827097059567887, 'edge_cap': 0.11694057855255655, 'bull_strategy': 'breakout', 'bull_bb_std_mult': 2.72232828618544, 'bull_rsi_os': 14, 'bull_rsi_ob': 88, 'bull_adx_thresh': 22.73016949426773, 'bull_atr_min_pct': 0.014151509324533393, 'bull_atr_max_pct': 0.03962323739804565, 'bull_tp_mult': 2.292957108472304, 'bull_tsl_mult': 0.5540983266034454, 'bull_time_stop': 295, 'bull_use_sma': False, 'bull_use_ema': False, 'bull_use_atr': False, 'bull_use_adx': True, 'bull_use_spike': True, 'bull_rsi_required': False, 'bear_strategy': 'breakout', 'bear_bb_std_mult': 2.9965521472324466, 'bear_rsi_os': 24, 'bear_rsi_ob': 56, 'bear_adx_thresh': 27.713509052482557, 'bear_atr_min_pct': 0.00811528344106423, 'bear_atr_max_pct': 0.07689915471163339, 'bear_tp_mult': 2.87399248430377, 'bear_tsl_mult': 0.5942574541481483, 'bear_time_stop': 110, 'bear_use_sma': False, 'bear_use_ema': False, 'bear_use_atr': False, 'bear_use_adx': True, 'bear_use_spike': True, 'bear_rsi_required': True, 'sideways_strategy': 'mean_reversion', 'sideways_bb_std_mult': 2.4127416493662825, 'sideways_rsi_os': 9, 'sideways_rsi_ob': 81, 'sideways_adx_thresh': 8.625437454721522, 'sideways_atr_min_pct': 0.026971539880182388, 'sideways_atr_max_pct': 0.11845938862651428, 'sideways_tp_mult': 1.745241881809433, 'sideways_tsl_mult': 0.39522746946454557, 'sideways_time_stop': 27, 'sideways_use_sma': False, 'sideways_use_ema': False, 'sideways_use_atr': False, 'sideways_use_adx': True, 'sideways_use_spike': True, 'sideways_rsi_required': False}.
[I 2025-09-01 08:05:51,149] Trial 285 finished with values: [-1000000000.0, 1000000000.0] and parameters: {'p_sma': 20, 'p_std': 31, 'p_atr': 11, 'p_adx': 18, 'rsi_period': 58, 'ema1': 10, 'ema2': 12, 'slip_atr_k': 0.07410056913940305, 'slip_spread_k': 0.5853717670557876, 'spread_hl_frac': 0.03190342576358135, 'bb_std_mult': 3.4691256093523704, 'rsi_os': 42, 'rsi_ob': 59, 'vol_spike': 0.09559462285177617, 'adx_thresh': 15.604184595604517, 'atr_min_pct': 0.002357321704154638, 'atr_max_pct': 0.10416188697133547, 'tp_mult': 2.8790470047948005, 'tsl_mult': 0.0631553530544618, 'strategy': 'mean_reversion', 'time_stop': 273, 'use_sma': True, 'use_atr': True, 'use_adx': True, 'use_ema': True, 'use_spike': True, 'rsi_required': True, 'edge_k': 1.7229685148306508, 'edge_cap': 0.6162595245124015, 'bull_strategy': 'breakout', 'bull_bb_std_mult': 1.3803009708325589, 'bull_rsi_os': 44, 'bull_rsi_ob': 67, 'bull_adx_thresh': 22.75578496130743, 'bull_atr_min_pct': 0.007611956123304805, 'bull_atr_max_pct': 0.040025187341071876, 'bull_tp_mult': 2.291634473466436, 'bull_tsl_mult': 0.3399933067850705, 'bull_time_stop': 117, 'bull_use_sma': False, 'bull_use_ema': False, 'bull_use_atr': False, 'bull_use_adx': True, 'bull_use_spike': True, 'bull_rsi_required': False, 'bear_strategy': 'mean_reversion', 'bear_bb_std_mult': 3.0010915125990305, 'bear_rsi_os': 25, 'bear_rsi_ob': 62, 'bear_adx_thresh': 31.865368041448175, 'bear_atr_min_pct': 0.00889294539382721, 'bear_atr_max_pct': 0.07601218272325236, 'bear_tp_mult': 2.8766541601161544, 'bear_tsl_mult': 0.054922032485382966, 'bear_time_stop': 84, 'bear_use_sma': False, 'bear_use_ema': False, 'bear_use_atr': False, 'bear_use_adx': True, 'bear_use_spike': True, 'bear_rsi_required': True, 'sideways_strategy': 'mean_reversion', 'sideways_bb_std_mult': 1.0699169407601161, 'sideways_rsi_os': 36, 'sideways_rsi_ob': 58, 'sideways_adx_thresh': 31.098882776786144, 'sideways_atr_min_pct': 0.023674960199562542, 'sideways_atr_max_pct': 0.03748122460387181, 'sideways_tp_mult': 1.4975053589634104, 'sideways_tsl_mult': 0.2526397229228391, 'sideways_time_stop': 26, 'sideways_use_sma': False, 'sideways_use_ema': False, 'sideways_use_atr': False, 'sideways_use_adx': True, 'sideways_use_spike': True, 'sideways_rsi_required': False}.
[I 2025-09-01 08:05:51,543] Trial 282 finished with values: [-1000000000.0, 1000000000.0] and parameters: {'p_sma': 24, 'p_std': 24, 'p_atr': 25, 'p_adx': 20, 'rsi_period': 68, 'ema1': 19, 'ema2': 43, 'slip_atr_k': 0.09995609720185249, 'slip_spread_k': 0.5776640026813932, 'spread_hl_frac': 0.01665531369638179, 'bb_std_mult': 3.4553838927718252, 'rsi_os': 22, 'rsi_ob': 56, 'vol_spike': 0.08820554650079082, 'adx_thresh': 28.4521695216285, 'atr_min_pct': 0.027623151845417204, 'atr_max_pct': 0.11417211022370867, 'tp_mult': 2.572229133652896, 'tsl_mult': 0.7224536147004417, 'strategy': 'mean_reversion', 'time_stop': 275, 'use_sma': True, 'use_atr': True, 'use_adx': True, 'use_ema': True, 'use_spike': True, 'rsi_required': True, 'edge_k': 1.0089315331691457, 'edge_cap': 0.9975854578516354, 'bull_strategy': 'breakout', 'bull_bb_std_mult': 2.3166705328684993, 'bull_rsi_os': 12, 'bull_rsi_ob': 87, 'bull_adx_thresh': 7.95444926263823, 'bull_atr_min_pct': 0.017204620766779984, 'bull_atr_max_pct': 0.03986847140814334, 'bull_tp_mult': 1.5086828884541232, 'bull_tsl_mult': 0.5883979760691047, 'bull_time_stop': 152, 'bull_use_sma': False, 'bull_use_ema': False, 'bull_use_atr': False, 'bull_use_adx': True, 'bull_use_spike': True, 'bull_rsi_required': False, 'bear_strategy': 'breakout', 'bear_bb_std_mult': 3.0090084327201145, 'bear_rsi_os': 26, 'bear_rsi_ob': 83, 'bear_adx_thresh': 31.998502383633586, 'bear_atr_min_pct': 0.018524260572071787, 'bear_atr_max_pct': 0.01563079048740064, 'bear_tp_mult': 2.8898596395862324, 'bear_tsl_mult': 0.6046158578880634, 'bear_time_stop': 266, 'bear_use_sma': False, 'bear_use_ema': True, 'bear_use_atr': True, 'bear_use_adx': True, 'bear_use_spike': False, 'bear_rsi_required': True, 'sideways_strategy': 'mean_reversion', 'sideways_bb_std_mult': 0.8385628623829835, 'sideways_rsi_os': 36, 'sideways_rsi_ob': 57, 'sideways_adx_thresh': 30.95377896974035, 'sideways_atr_min_pct': 0.004932826052594602, 'sideways_atr_max_pct': 0.03740680672661228, 'sideways_tp_mult': 2.446805766403542, 'sideways_tsl_mult': 0.38834298486428886, 'sideways_time_stop': 27, 'sideways_use_sma': False, 'sideways_use_ema': True, 'sideways_use_atr': False, 'sideways_use_adx': True, 'sideways_use_spike': True, 'sideways_rsi_required': False}.
[I 2025-09-01 08:05:52,224] Trial 286 finished with values: [-1000000000.0, 1000000000.0] and parameters: {'p_sma': 8, 'p_std': 7, 'p_atr': 12, 'p_adx': 20, 'rsi_period': 65, 'ema1': 19, 'ema2': 31, 'slip_atr_k': 0.1407930256947003, 'slip_spread_k': 0.7125956707389979, 'spread_hl_frac': 0.023473801803513137, 'bb_std_mult': 3.470145868124651, 'rsi_os': 51, 'rsi_ob': 78, 'vol_spike': 0.26099785541153153, 'adx_thresh': 23.42532633216212, 'atr_min_pct': 0.021670687669021145, 'atr_max_pct': 0.10360886593043428, 'tp_mult': 2.559183300524462, 'tsl_mult': 0.46627230479191256, 'strategy': 'mean_reversion', 'time_stop': 255, 'use_sma': True, 'use_atr': True, 'use_adx': True, 'use_ema': True, 'use_spike': True, 'rsi_required': True, 'edge_k': 1.0613808974492676, 'edge_cap': 0.7380426246848553, 'bull_strategy': 'mean_reversion', 'bull_bb_std_mult': 2.730942039169869, 'bull_rsi_os': 15, 'bull_rsi_ob': 87, 'bull_adx_thresh': 8.185569539503472, 'bull_atr_min_pct': 0.0018353520514064088, 'bull_atr_max_pct': 0.043729670661361235, 'bull_tp_mult': 2.177431619056415, 'bull_tsl_mult': 0.716941164700037, 'bull_time_stop': 158, 'bull_use_sma': False, 'bull_use_ema': False, 'bull_use_atr': False, 'bull_use_adx': True, 'bull_use_spike': True, 'bull_rsi_required': False, 'bear_strategy': 'mean_reversion', 'bear_bb_std_mult': 2.9338549118346924, 'bear_rsi_os': 25, 'bear_rsi_ob': 79, 'bear_adx_thresh': 12.935036216551358, 'bear_atr_min_pct': 0.022426496966888018, 'bear_atr_max_pct': 0.07596214200426764, 'bear_tp_mult': 2.401754668812278, 'bear_tsl_mult': 0.055765147834778206, 'bear_time_stop': 191, 'bear_use_sma': False, 'bear_use_ema': False, 'bear_use_atr': True, 'bear_use_adx': True, 'bear_use_spike': True, 'bear_rsi_required': False, 'sideways_strategy': 'mean_reversion', 'sideways_bb_std_mult': 0.5917566344793121, 'sideways_rsi_os': 29, 'sideways_rsi_ob': 76, 'sideways_adx_thresh': 31.014475037356455, 'sideways_atr_min_pct': 0.010990828790197478, 'sideways_atr_max_pct': 0.026950100233084116, 'sideways_tp_mult': 2.762718043175428, 'sideways_tsl_mult': 0.3995546756151659, 'sideways_time_stop': 20, 'sideways_use_sma': False, 'sideways_use_ema': False, 'sideways_use_atr': False, 'sideways_use_adx': True, 'sideways_use_spike': True, 'sideways_rsi_required': False}.
[I 2025-09-01 08:05:52,271] Trial 288 finished with values: [-1000000000.0, 1000000000.0] and parameters: {'p_sma': 5, 'p_std': 11, 'p_atr': 12, 'p_adx': 11, 'rsi_period': 65, 'ema1': 11, 'ema2': 60, 'slip_atr_k': 0.1400073053636646, 'slip_spread_k': 0.6871425144810984, 'spread_hl_frac': 0.024895149228771906, 'bb_std_mult': 3.458322454708314, 'rsi_os': 51, 'rsi_ob': 54, 'vol_spike': 0.23038950128156055, 'adx_thresh': 25.541908924518438, 'atr_min_pct': 0.020723212844492352, 'atr_max_pct': 0.029364744337728635, 'tp_mult': 2.531623332555792, 'tsl_mult': 0.4711213959514734, 'strategy': 'mean_reversion', 'time_stop': 248, 'use_sma': False, 'use_atr': True, 'use_adx': True, 'use_ema': False, 'use_spike': True, 'rsi_required': True, 'edge_k': 0.8308530041353387, 'edge_cap': 0.7455172140379615, 'bull_strategy': 'mean_reversion', 'bull_bb_std_mult': 2.79096293005121, 'bull_rsi_os': 13, 'bull_rsi_ob': 71, 'bull_adx_thresh': 30.335382734649713, 'bull_atr_min_pct': 0.010886256042749478, 'bull_atr_max_pct': 0.04364555409026817, 'bull_tp_mult': 2.183440079499437, 'bull_tsl_mult': 0.7234109167481817, 'bull_time_stop': 157, 'bull_use_sma': True, 'bull_use_ema': False, 'bull_use_atr': False, 'bull_use_adx': True, 'bull_use_spike': True, 'bull_rsi_required': False, 'bear_strategy': 'mean_reversion', 'bear_bb_std_mult': 3.1207638411571326, 'bear_rsi_os': 26, 'bear_rsi_ob': 94, 'bear_adx_thresh': 15.100751778955907, 'bear_atr_min_pct': 0.022501106622845848, 'bear_atr_max_pct': 0.09327637669441076, 'bear_tp_mult': 2.6970072230737556, 'bear_tsl_mult': 0.13112825123445906, 'bear_time_stop': 79, 'bear_use_sma': False, 'bear_use_ema': False, 'bear_use_atr': True, 'bear_use_adx': True, 'bear_use_spike': True, 'bear_rsi_required': False, 'sideways_strategy': 'mean_reversion', 'sideways_bb_std_mult': 0.6038029441530331, 'sideways_rsi_os': 37, 'sideways_rsi_ob': 88, 'sideways_adx_thresh': 9.744556683898072, 'sideways_atr_min_pct': 0.004861932993960065, 'sideways_atr_max_pct': 0.024728491721512973, 'sideways_tp_mult': 2.4519410326353355, 'sideways_tsl_mult': 0.19711044456396226, 'sideways_time_stop': 47, 'sideways_use_sma': True, 'sideways_use_ema': False, 'sideways_use_atr': False, 'sideways_use_adx': True, 'sideways_use_spike': True, 'sideways_rsi_required': False}.
