[I 2025-09-01 08:29:25,285] Trial 424 finished with values: [-1000000000.0, 1000000000.0] and parameters: {'p_sma': 17, 'p_std': 13, 'p_atr': 11, 'p_adx': 20, 'rsi_period': 62, 'ema1': 18, 'ema2': 13, 'slip_atr_k': 0.13459602942027163, 'slip_spread_k': 0.6120235825588571, 'spread_hl_frac': 0.0481159659466264, 'bb_std_mult': 3.304868103728567, 'rsi_os': 11, 'rsi_ob': 59, 'vol_spike': 0.22968159381886166, 'adx_thresh': 12.601645866638538, 'atr_min_pct': 0.02268738663572937, 'atr_max_pct': 0.14677155094069808, 'tp_mult': 1.3759528093374898, 'tsl_mult': 0.2833525496684478, 'strategy': 'mean_reversion', 'time_stop': 111, 'use_sma': True, 'use_atr': True, 'use_adx': True, 'use_ema': True, 'use_spike': True, 'rsi_required': True, 'edge_k': 0.9125199511682323, 'edge_cap': 0.8191629241407419, 'bull_strategy': 'breakout', 'bull_bb_std_mult': 1.0144570313865442, 'bull_rsi_os': 15, 'bull_rsi_ob': 84, 'bull_adx_thresh': 9.957361113321127, 'bull_atr_min_pct': 0.004605903624451421, 'bull_atr_max_pct': 0.03565725438476806, 'bull_tp_mult': 2.399800158561608, 'bull_tsl_mult': 0.6891869477109801, 'bull_time_stop': 151, 'bull_use_sma': True, 'bull_use_ema': False, 'bull_use_atr': False, 'bull_use_adx': True, 'bull_use_spike': True, 'bull_rsi_required': False, 'bear_strategy': 'mean_reversion', 'bear_bb_std_mult': 1.5211504151228672, 'bear_rsi_os': 26, 'bear_rsi_ob': 93, 'bear_adx_thresh': 25.166384586983458, 'bear_atr_min_pct': 0.022672485961833952, 'bear_atr_max_pct': 0.04530491207918173, 'bear_tp_mult': 1.9893071151336508, 'bear_tsl_mult': 0.045665903484856045, 'bear_time_stop': 103, 'bear_use_sma': False, 'bear_use_ema': False, 'bear_use_atr': True, 'bear_use_adx': True, 'bear_use_spike': True, 'bear_rsi_required': False, 'sideways_strategy': 'mean_reversion', 'sideways_bb_std_mult': 0.6294255103708861, 'sideways_rsi_os': 24, 'sideways_rsi_ob': 65, 'sideways_adx_thresh': 9.06146915853072, 'sideways_atr_min_pct': 0.024092054100692317, 'sideways_atr_max_pct': 0.02825339628875476, 'sideways_tp_mult': 2.1833207974082156, 'sideways_tsl_mult': 0.1796855985549202, 'sideways_time_stop': 21, 'sideways_use_sma': False, 'sideways_use_ema': False, 'sideways_use_atr': False, 'sideways_use_adx': False, 'sideways_use_spike': False, 'sideways_rsi_required': False}.
[I 2025-09-01 08:29:25,788] Trial 425 finished with values: [-1000000000.0, 1000000000.0] and parameters: {'p_sma': 36, 'p_std': 6, 'p_atr': 23, 'p_adx': 17, 'rsi_period': 62, 'ema1': 6, 'ema2': 26, 'slip_atr_k': 0.05876338746661787, 'slip_spread_k': 0.9982705260729219, 'spread_hl_frac': 0.042749319273756387, 'bb_std_mult': 3.2842293637935778, 'rsi_os': 21, 'rsi_ob': 59, 'vol_spike': 0.23266266893010001, 'adx_thresh': 23.12359503348645, 'atr_min_pct': 0.02128565273694723, 'atr_max_pct': 0.14714306560955775, 'tp_mult': 1.4707259332615648, 'tsl_mult': 0.5339141464389175, 'strategy': 'mean_reversion', 'time_stop': 294, 'use_sma': True, 'use_atr': True, 'use_adx': True, 'use_ema': True, 'use_spike': True, 'rsi_required': True, 'edge_k': 1.0476140635052698, 'edge_cap': 0.10976909638626878, 'bull_strategy': 'breakout', 'bull_bb_std_mult': 1.016136871985409, 'bull_rsi_os': 16, 'bull_rsi_ob': 84, 'bull_adx_thresh': 6.280118840451063, 'bull_atr_min_pct': 0.022896262228206496, 'bull_atr_max_pct': 0.037572145228250246, 'bull_tp_mult': 2.2592629038152565, 'bull_tsl_mult': 0.6607391825270348, 'bull_time_stop': 108, 'bull_use_sma': True, 'bull_use_ema': False, 'bull_use_atr': False, 'bull_use_adx': True, 'bull_use_spike': True, 'bull_rsi_required': False, 'bear_strategy': 'mean_reversion', 'bear_bb_std_mult': 3.246207826739735, 'bear_rsi_os': 26, 'bear_rsi_ob': 68, 'bear_adx_thresh': 32.8480127130405, 'bear_atr_min_pct': 0.01707069234675704, 'bear_atr_max_pct': 0.044890023526028965, 'bear_tp_mult': 1.2178942813591989, 'bear_tsl_mult': 0.4088172071761369, 'bear_time_stop': 177, 'bear_use_sma': False, 'bear_use_ema': False, 'bear_use_atr': True, 'bear_use_adx': True, 'bear_use_spike': True, 'bear_rsi_required': False, 'sideways_strategy': 'mean_reversion', 'sideways_bb_std_mult': 0.7518190947218656, 'sideways_rsi_os': 27, 'sideways_rsi_ob': 65, 'sideways_adx_thresh': 9.10341910176875, 'sideways_atr_min_pct': 0.024098553488452808, 'sideways_atr_max_pct': 0.12139468910133874, 'sideways_tp_mult': 2.6097901087090376, 'sideways_tsl_mult': 0.17275428250158242, 'sideways_time_stop': 13, 'sideways_use_sma': False, 'sideways_use_ema': False, 'sideways_use_atr': False, 'sideways_use_adx': False, 'sideways_use_spike': False, 'sideways_rsi_required': False}.
[I 2025-09-01 08:29:26,081] Trial 426 finished with values: [-1000000000.0, 1000000000.0] and parameters: {'p_sma': 28, 'p_std': 6, 'p_atr': 11, 'p_adx': 9, 'rsi_period': 65, 'ema1': 18, 'ema2': 14, 'slip_atr_k': 0.005097738179685299, 'slip_spread_k': 0.9974915367595824, 'spread_hl_frac': 0.04287366672720594, 'bb_std_mult': 1.7819568191126884, 'rsi_os': 25, 'rsi_ob': 56, 'vol_spike': 0.2790086904727915, 'adx_thresh': 23.146951362976168, 'atr_min_pct': 0.002597660861450095, 'atr_max_pct': 0.09082200175823664, 'tp_mult': 1.1378288692254808, 'tsl_mult': 0.5114367469470288, 'strategy': 'mean_reversion', 'time_stop': 256, 'use_sma': True, 'use_atr': True, 'use_adx': True, 'use_ema': True, 'use_spike': True, 'rsi_required': True, 'edge_k': 0.8966705661783797, 'edge_cap': 0.47732379508347966, 'bull_strategy': 'breakout', 'bull_bb_std_mult': 2.653832162240818, 'bull_rsi_os': 15, 'bull_rsi_ob': 95, 'bull_adx_thresh': 6.3610935018592265, 'bull_atr_min_pct': 0.00997076020710123, 'bull_atr_max_pct': 0.04797644975560506, 'bull_tp_mult': 2.344218925637426, 'bull_tsl_mult': 0.7304463678998276, 'bull_time_stop': 162, 'bull_use_sma': True, 'bull_use_ema': False, 'bull_use_atr': False, 'bull_use_adx': True, 'bull_use_spike': True, 'bull_rsi_required': False, 'bear_strategy': 'mean_reversion', 'bear_bb_std_mult': 2.6218861264087896, 'bear_rsi_os': 48, 'bear_rsi_ob': 93, 'bear_adx_thresh': 33.02265558061265, 'bear_atr_min_pct': 0.022642626680427918, 'bear_atr_max_pct': 0.0860330078417747, 'bear_tp_mult': 2.2533771888132117, 'bear_tsl_mult': 0.04494847545176206, 'bear_time_stop': 203, 'bear_use_sma': False, 'bear_use_ema': False, 'bear_use_atr': True, 'bear_use_adx': True, 'bear_use_spike': True, 'bear_rsi_required': False, 'sideways_strategy': 'mean_reversion', 'sideways_bb_std_mult': 0.7718650142360876, 'sideways_rsi_os': 23, 'sideways_rsi_ob': 65, 'sideways_adx_thresh': 29.903015210131713, 'sideways_atr_min_pct': 0.02339585961141627, 'sideways_atr_max_pct': 0.02804764049206166, 'sideways_tp_mult': 2.168688896097746, 'sideways_tsl_mult': 0.175183607901294, 'sideways_time_stop': 13, 'sideways_use_sma': False, 'sideways_use_ema': False, 'sideways_use_atr': False, 'sideways_use_adx': False, 'sideways_use_spike': False, 'sideways_rsi_required': False}.
[I 2025-09-01 08:29:26,388] Trial 422 finished with values: [-1000000000.0, 1000000000.0] and parameters: {'p_sma': 17, 'p_std': 13, 'p_atr': 27, 'p_adx': 20, 'rsi_period': 63, 'ema1': 23, 'ema2': 44, 'slip_atr_k': 0.13531244396233288, 'slip_spread_k': 0.6166103698161723, 'spread_hl_frac': 0.023190062391710252, 'bb_std_mult': 3.281744044504438, 'rsi_os': 35, 'rsi_ob': 59, 'vol_spike': 0.2427142331196235, 'adx_thresh': 23.069632061503466, 'atr_min_pct': 0.02108308488032198, 'atr_max_pct': 0.14517991506068245, 'tp_mult': 1.1488078895246716, 'tsl_mult': 0.5261927651019787, 'strategy': 'mean_reversion', 'time_stop': 242, 'use_sma': True, 'use_atr': True, 'use_adx': True, 'use_ema': True, 'use_spike': True, 'rsi_required': True, 'edge_k': 0.9141752303272193, 'edge_cap': 0.09836526327684003, 'bull_strategy': 'breakout', 'bull_bb_std_mult': 2.653717991469492, 'bull_rsi_os': 6, 'bull_rsi_ob': 70, 'bull_adx_thresh': 6.292041458705078, 'bull_atr_min_pct': 0.016202876607048815, 'bull_atr_max_pct': 0.03692215146325719, 'bull_tp_mult': 1.6929890724247418, 'bull_tsl_mult': 0.22424292191772693, 'bull_time_stop': 214, 'bull_use_sma': True, 'bull_use_ema': False, 'bull_use_atr': False, 'bull_use_adx': True, 'bull_use_spike': True, 'bull_rsi_required': False, 'bear_strategy': 'mean_reversion', 'bear_bb_std_mult': 3.593123976670311, 'bear_rsi_os': 47, 'bear_rsi_ob': 57, 'bear_adx_thresh': 32.845893375053095, 'bear_atr_min_pct': 0.02287261895769615, 'bear_atr_max_pct': 0.10810298543260427, 'bear_tp_mult': 1.9326261269135576, 'bear_tsl_mult': 0.04271162547394607, 'bear_time_stop': 85, 'bear_use_sma': False, 'bear_use_ema': False, 'bear_use_atr': True, 'bear_use_adx': True, 'bear_use_spike': True, 'bear_rsi_required': False, 'sideways_strategy': 'mean_reversion', 'sideways_bb_std_mult': 0.5821240128139941, 'sideways_rsi_os': 40, 'sideways_rsi_ob': 66, 'sideways_adx_thresh': 9.174253807240934, 'sideways_atr_min_pct': 0.01635720871954533, 'sideways_atr_max_pct': 0.02777459197024586, 'sideways_tp_mult': 2.15729817015624, 'sideways_tsl_mult': 0.1775497995831113, 'sideways_time_stop': 14, 'sideways_use_sma': False, 'sideways_use_ema': False, 'sideways_use_atr': False, 'sideways_use_adx': True, 'sideways_use_spike': False, 'sideways_rsi_required': False}.
[I 2025-09-01 08:30:07,780] Trial 427 finished with values: [-1000000000.0, 1000000000.0] and parameters: {'p_sma': 49, 'p_std': 17, 'p_atr': 26, 'p_adx': 20, 'rsi_period': 65, 'ema1': 10, 'ema2': 14, 'slip_atr_k': 0.003241202610192978, 'slip_spread_k': 0.4956751500188833, 'spread_hl_frac': 0.007520450397326319, 'bb_std_mult': 1.4776636076178131, 'rsi_os': 30, 'rsi_ob': 56, 'vol_spike': 0.19684320473017147, 'adx_thresh': 23.16317077079516, 'atr_min_pct': 0.010897762746556981, 'atr_max_pct': 0.14204411523615346, 'tp_mult': 1.1594376280324328, 'tsl_mult': 0.0742220238871677, 'strategy': 'mean_reversion', 'time_stop': 259, 'use_sma': True, 'use_atr': True, 'use_adx': True, 'use_ema': False, 'use_spike': False, 'rsi_required': True, 'edge_k': 0.9641322213519953, 'edge_cap': 0.9431311741978272, 'bull_strategy': 'breakout', 'bull_bb_std_mult': 2.63380214670348, 'bull_rsi_os': 10, 'bull_rsi_ob': 70, 'bull_adx_thresh': 6.47955974403998, 'bull_atr_min_pct': 0.016108095834858005, 'bull_atr_max_pct': 0.04839972486401011, 'bull_tp_mult': 1.7308956022816417, 'bull_tsl_mult': 0.2189545845120658, 'bull_time_stop': 161, 'bull_use_sma': True, 'bull_use_ema': False, 'bull_use_atr': False, 'bull_use_adx': True, 'bull_use_spike': True, 'bull_rsi_required': False, 'bear_strategy': 'mean_reversion', 'bear_bb_std_mult': 0.9635383321260529, 'bear_rsi_os': 27, 'bear_rsi_ob': 72, 'bear_adx_thresh': 33.06206410218271, 'bear_atr_min_pct': 0.003377028923301018, 'bear_atr_max_pct': 0.08648454883797253, 'bear_tp_mult': 2.786678602983761, 'bear_tsl_mult': 0.09720012328938776, 'bear_time_stop': 85, 'bear_use_sma': True, 'bear_use_ema': False, 'bear_use_atr': True, 'bear_use_adx': False, 'bear_use_spike': False, 'bear_rsi_required': False, 'sideways_strategy': 'breakout', 'sideways_bb_std_mult': 0.7683959073981708, 'sideways_rsi_os': 11, 'sideways_rsi_ob': 65, 'sideways_adx_thresh': 29.60454136419098, 'sideways_atr_min_pct': 0.005140895463868561, 'sideways_atr_max_pct': 0.13876445586317965, 'sideways_tp_mult': 2.5982907583938126, 'sideways_tsl_mult': 0.24989451757791054, 'sideways_time_stop': 12, 'sideways_use_sma': False, 'sideways_use_ema': False, 'sideways_use_atr': True, 'sideways_use_adx': True, 'sideways_use_spike': True, 'sideways_rsi_required': True}.
[I 2025-09-01 08:30:08,310] Trial 428 finished with values: [-1000000000.0, 1000000000.0] and parameters: {'p_sma': 28, 'p_std': 58, 'p_atr': 26, 'p_adx': 9, 'rsi_period': 16, 'ema1': 8, 'ema2': 43, 'slip_atr_k': 0.06706800458511433, 'slip_spread_k': 0.6407665796495595, 'spread_hl_frac': 0.003614429283109913, 'bb_std_mult': 1.4958268415851506, 'rsi_os': 36, 'rsi_ob': 56, 'vol_spike': 0.1998129549155379, 'adx_thresh': 24.234503062570184, 'atr_min_pct': 0.02105229061964847, 'atr_max_pct': 0.08962983791992674, 'tp_mult': 1.151398756705014, 'tsl_mult': 0.8747940165115768, 'strategy': 'breakout', 'time_stop': 255, 'use_sma': True, 'use_atr': True, 'use_adx': True, 'use_ema': False, 'use_spike': False, 'rsi_required': True, 'edge_k': 1.0016906250820603, 'edge_cap': 0.09314784530917027, 'bull_strategy': 'breakout', 'bull_bb_std_mult': 2.6678480926392174, 'bull_rsi_os': 28, 'bull_rsi_ob': 95, 'bull_adx_thresh': 7.098976246312645, 'bull_atr_min_pct': 0.009900336780558744, 'bull_atr_max_pct': 0.04845956031223434, 'bull_tp_mult': 2.5317902017898737, 'bull_tsl_mult': 0.973633458854112, 'bull_time_stop': 163, 'bull_use_sma': False, 'bull_use_ema': False, 'bull_use_atr': False, 'bull_use_adx': True, 'bull_use_spike': True, 'bull_rsi_required': True, 'bear_strategy': 'mean_reversion', 'bear_bb_std_mult': 3.061166887412506, 'bear_rsi_os': 27, 'bear_rsi_ob': 57, 'bear_adx_thresh': 27.474683931612226, 'bear_atr_min_pct': 0.011570223512053973, 'bear_atr_max_pct': 0.08684736417838403, 'bear_tp_mult': 2.8243875511858563, 'bear_tsl_mult': 0.10133374444510757, 'bear_time_stop': 289, 'bear_use_sma': True, 'bear_use_ema': False, 'bear_use_atr': True, 'bear_use_adx': False, 'bear_use_spike': False, 'bear_rsi_required': False, 'sideways_strategy': 'breakout', 'sideways_bb_std_mult': 2.5331984235228755, 'sideways_rsi_os': 31, 'sideways_rsi_ob': 64, 'sideways_adx_thresh': 9.644921127562942, 'sideways_atr_min_pct': 0.016552680689388883, 'sideways_atr_max_pct': 0.031638407213528855, 'sideways_tp_mult': 2.640752389687518, 'sideways_tsl_mult': 0.24265393300419935, 'sideways_time_stop': 23, 'sideways_use_sma': False, 'sideways_use_ema': False, 'sideways_use_atr': True, 'sideways_use_adx': True, 'sideways_use_spike': True, 'sideways_rsi_required': True}.
[I 2025-09-01 08:30:08,732] Trial 429 finished with values: [-0.03754550130009193, 0.037110199444324365] and parameters: {'p_sma': 50, 'p_std': 16, 'p_atr': 24, 'p_adx': 20, 'rsi_period': 60, 'ema1': 8, 'ema2': 44, 'slip_atr_k': 0.06676512128570605, 'slip_spread_k': 0.021907838384986333, 'spread_hl_frac': 0.003653533880942434, 'bb_std_mult': 1.2375275848494023, 'rsi_os': 46, 'rsi_ob': 56, 'vol_spike': 0.07415070327526785, 'adx_thresh': 19.238325722833192, 'atr_min_pct': 0.020931797373269275, 'atr_max_pct': 0.14263485310539484, 'tp_mult': 1.0992528642348014, 'tsl_mult': 0.44558590427147643, 'strategy': 'breakout', 'time_stop': 202, 'use_sma': True, 'use_atr': True, 'use_adx': True, 'use_ema': False, 'use_spike': False, 'rsi_required': True, 'edge_k': 0.9722892474263931, 'edge_cap': 0.9427225453748393, 'bull_strategy': 'breakout', 'bull_bb_std_mult': 3.587612711336469, 'bull_rsi_os': 51, 'bull_rsi_ob': 70, 'bull_adx_thresh': 7.145703771994167, 'bull_atr_min_pct': 0.003169137375572048, 'bull_atr_max_pct': 0.04519436018759876, 'bull_tp_mult': 1.7063354474323265, 'bull_tsl_mult': 0.5981021115453071, 'bull_time_stop': 279, 'bull_use_sma': False, 'bull_use_ema': False, 'bull_use_atr': False, 'bull_use_adx': True, 'bull_use_spike': True, 'bull_rsi_required': True, 'bear_strategy': 'mean_reversion', 'bear_bb_std_mult': 3.063067818906866, 'bear_rsi_os': 30, 'bear_rsi_ob': 95, 'bear_adx_thresh': 31.00985549733355, 'bear_atr_min_pct': 0.023581500297353918, 'bear_atr_max_pct': 0.1094177809404402, 'bear_tp_mult': 2.814425278898825, 'bear_tsl_mult': 0.08654799397415197, 'bear_time_stop': 85, 'bear_use_sma': True, 'bear_use_ema': False, 'bear_use_atr': True, 'bear_use_adx': False, 'bear_use_spike': False, 'bear_rsi_required': False, 'sideways_strategy': 'breakout', 'sideways_bb_std_mult': 0.6623617534059267, 'sideways_rsi_os': 40, 'sideways_rsi_ob': 64, 'sideways_adx_thresh': 19.82127945473467, 'sideways_atr_min_pct': 0.008892296609860033, 'sideways_atr_max_pct': 0.032421155596116226, 'sideways_tp_mult': 2.642012664570483, 'sideways_tsl_mult': 0.2110639629585304, 'sideways_time_stop': 244, 'sideways_use_sma': False, 'sideways_use_ema': False, 'sideways_use_atr': True, 'sideways_use_adx': True, 'sideways_use_spike': True, 'sideways_rsi_required': True}.
[I 2025-09-01 08:30:08,972] Trial 430 finished with values: [-0.2122667470425027, 0.21212170949056247] and parameters: {'p_sma': 40, 'p_std': 16, 'p_atr': 26, 'p_adx': 26, 'rsi_period': 59, 'ema1': 13, 'ema2': 11, 'slip_atr_k': 0.06505797528508507, 'slip_spread_k': 0.12128626846602131, 'spread_hl_frac': 0.007829950095727553, 'bb_std_mult': 1.487089207067165, 'rsi_os': 30, 'rsi_ob': 85, 'vol_spike': 0.21805879013824073, 'adx_thresh': 7.021162514109594, 'atr_min_pct': 0.018337855996328378, 'atr_max_pct': 0.03129020675546915, 'tp_mult': 1.0895304409741586, 'tsl_mult': 0.1993874187331353, 'strategy': 'breakout', 'time_stop': 282, 'use_sma': False, 'use_atr': True, 'use_adx': True, 'use_ema': False, 'use_spike': False, 'rsi_required': True, 'edge_k': 0.3641686269657246, 'edge_cap': 0.946578428350293, 'bull_strategy': 'mean_reversion', 'bull_bb_std_mult': 2.7733469616577766, 'bull_rsi_os': 11, 'bull_rsi_ob': 67, 'bull_adx_thresh': 10.997837258162743, 'bull_atr_min_pct': 0.0009581147462974756, 'bull_atr_max_pct': 0.04410875767891037, 'bull_tp_mult': 2.1338160669937847, 'bull_tsl_mult': 0.5981694831084392, 'bull_time_stop': 158, 'bull_use_sma': False, 'bull_use_ema': False, 'bull_use_atr': True, 'bull_use_adx': True, 'bull_use_spike': False, 'bull_rsi_required': True, 'bear_strategy': 'breakout', 'bear_bb_std_mult': 3.046328784941744, 'bear_rsi_os': 27, 'bear_rsi_ob': 95, 'bear_adx_thresh': 31.073386451490904, 'bear_atr_min_pct': 0.023730619925716335, 'bear_atr_max_pct': 0.02363436455668145, 'bear_tp_mult': 2.4957619313097807, 'bear_tsl_mult': 0.10257350048571806, 'bear_time_stop': 74, 'bear_use_sma': True, 'bear_use_ema': True, 'bear_use_atr': True, 'bear_use_adx': False, 'bear_use_spike': False, 'bear_rsi_required': True, 'sideways_strategy': 'breakout', 'sideways_bb_std_mult': 1.264982912338533, 'sideways_rsi_os': 38, 'sideways_rsi_ob': 64, 'sideways_adx_thresh': 7.7570980019310785, 'sideways_atr_min_pct': 0.012963998149314995, 'sideways_atr_max_pct': 0.03150335650629809, 'sideways_tp_mult': 1.3703277125989017, 'sideways_tsl_mult': 0.2082176134059051, 'sideways_time_stop': 23, 'sideways_use_sma': False, 'sideways_use_ema': False, 'sideways_use_atr': True, 'sideways_use_adx': True, 'sideways_use_spike': True, 'sideways_rsi_required': True}.
[I 2025-09-01 08:30:52,630] Trial 431 finished with values: [-1000000000.0, 1000000000.0] and parameters: {'p_sma': 20, 'p_std': 49, 'p_atr': 13, 'p_adx': 16, 'rsi_period': 60, 'ema1': 26, 'ema2': 45, 'slip_atr_k': 0.06522053257166256, 'slip_spread_k': 0.12309606162237591, 'spread_hl_frac': 0.0034324303456416093, 'bb_std_mult': 3.5146344996501755, 'rsi_os': 23, 'rsi_ob': 55, 'vol_spike': 0.25937523787959194, 'adx_thresh': 10.026911324798013, 'atr_min_pct': 0.016025897220420793, 'atr_max_pct': 0.038773434661289526, 'tp_mult': 1.0990963360434494, 'tsl_mult': 0.417678796395476, 'strategy': 'breakout', 'time_stop': 185, 'use_sma': False, 'use_atr': True, 'use_adx': True, 'use_ema': False, 'use_spike': False, 'rsi_required': True, 'edge_k': 1.43973513068358, 'edge_cap': 0.7569103962296193, 'bull_strategy': 'mean_reversion', 'bull_bb_std_mult': 2.760870130073143, 'bull_rsi_os': 51, 'bull_rsi_ob': 67, 'bull_adx_thresh': 9.277728890009136, 'bull_atr_min_pct': 0.027614467672801978, 'bull_atr_max_pct': 0.05498945387625204, 'bull_tp_mult': 2.1013625575183634, 'bull_tsl_mult': 0.9999000738674368, 'bull_time_stop': 277, 'bull_use_sma': False, 'bull_use_ema': False, 'bull_use_atr': True, 'bull_use_adx': False, 'bull_use_spike': False, 'bull_rsi_required': True, 'bear_strategy': 'breakout', 'bear_bb_std_mult': 3.0579716113534365, 'bear_rsi_os': 40, 'bear_rsi_ob': 83, 'bear_adx_thresh': 30.96230412970531, 'bear_atr_min_pct': 0.023969310817010994, 'bear_atr_max_pct': 0.07626648662909055, 'bear_tp_mult': 2.8128844370604162, 'bear_tsl_mult': 0.07602805999621902, 'bear_time_stop': 227, 'bear_use_sma': True, 'bear_use_ema': True, 'bear_use_atr': True, 'bear_use_adx': False, 'bear_use_spike': False, 'bear_rsi_required': True, 'sideways_strategy': 'breakout', 'sideways_bb_std_mult': 2.4328344401743442, 'sideways_rsi_os': 38, 'sideways_rsi_ob': 63, 'sideways_adx_thresh': 19.530404783858582, 'sideways_atr_min_pct': 0.013130647111361374, 'sideways_atr_max_pct': 0.13047803880628112, 'sideways_tp_mult': 1.6159287119399393, 'sideways_tsl_mult': 0.15589867906211535, 'sideways_time_stop': 24, 'sideways_use_sma': False, 'sideways_use_ema': False, 'sideways_use_atr': True, 'sideways_use_adx': True, 'sideways_use_spike': True, 'sideways_rsi_required': True}.
