[I 2025-09-01 07:23:56,010] Trial 27 finished with values: [-1000000000.0, 1000000000.0] and parameters: {'p_sma': 38, 'p_std': 37, 'p_atr': 25, 'p_adx': 10, 'rsi_period': 41, 'ema1': 30, 'ema2': 38, 'slip_atr_k': 0.06332559782556031, 'slip_spread_k': 0.11562442075775714, 'spread_hl_frac': 0.021934500077888178, 'bb_std_mult': 3.556484379097683, 'rsi_os': 35, 'rsi_ob': 72, 'vol_spike': 0.2220061401760032, 'adx_thresh': 9.23932939196307, 'atr_min_pct': 0.015079115433030983, 'atr_max_pct': 0.0971983466597128, 'tp_mult': 1.726386453013968, 'tsl_mult': 0.5376010597972791, 'strategy': 'breakout', 'time_stop': 114, 'use_sma': False, 'use_atr': True, 'use_adx': True, 'use_ema': False, 'use_spike': True, 'rsi_required': True, 'edge_k': 0.5843254663092904, 'edge_cap': 0.5355904346678699, 'bull_strategy': 'mean_reversion', 'bull_bb_std_mult': 1.4570621860072213, 'bull_rsi_os': 55, 'bull_rsi_ob': 53, 'bull_adx_thresh': 29.453174038919506, 'bull_atr_min_pct': 0.006096299134245607, 'bull_atr_max_pct': 0.13504759187697118, 'bull_tp_mult': 2.776316430671982, 'bull_tsl_mult': 0.3409275574041283, 'bull_time_stop': 273, 'bull_use_sma': False, 'bull_use_ema': False, 'bull_use_atr': True, 'bull_use_adx': True, 'bull_use_spike': False, 'bull_rsi_required': True, 'bear_strategy': 'mean_reversion', 'bear_bb_std_mult': 3.2484303817284985, 'bear_rsi_os': 32, 'bear_rsi_ob': 77, 'bear_adx_thresh': 23.218998787334147, 'bear_atr_min_pct': 0.003527296531388561, 'bear_atr_max_pct': 0.1026318031349716, 'bear_tp_mult': 2.610587408259872, 'bear_tsl_mult': 0.9843466349321459, 'bear_time_stop': 261, 'bear_use_sma': False, 'bear_use_ema': True, 'bear_use_atr': True, 'bear_use_adx': True, 'bear_use_spike': False, 'bear_rsi_required': False, 'sideways_strategy': 'breakout', 'sideways_bb_std_mult': 3.57601473407712, 'sideways_rsi_os': 32, 'sideways_rsi_ob': 71, 'sideways_adx_thresh': 23.92216047089228, 'sideways_atr_min_pct': 0.012231392130158093, 'sideways_atr_max_pct': 0.09207758481651057, 'sideways_tp_mult': 2.9927429083799306, 'sideways_tsl_mult': 0.6770396570162641, 'sideways_time_stop': 104, 'sideways_use_sma': False, 'sideways_use_ema': True, 'sideways_use_atr': True, 'sideways_use_adx': False, 'sideways_use_spike': False, 'sideways_rsi_required': False}.
[I 2025-09-01 07:23:56,590] Trial 28 finished with values: [-1000000000.0, 1000000000.0] and parameters: {'p_sma': 7, 'p_std': 37, 'p_atr': 29, 'p_adx': 10, 'rsi_period': 14, 'ema1': 8, 'ema2': 39, 'slip_atr_k': 0.15076649527334524, 'slip_spread_k': 0.11806761386744088, 'spread_hl_frac': 0.012498363532309582, 'bb_std_mult': 3.3013666291442765, 'rsi_os': 36, 'rsi_ob': 64, 'vol_spike': 0.08785301051151059, 'adx_thresh': 8.890791332022214, 'atr_min_pct': 0.021059519928427844, 'atr_max_pct': 0.10016579164778211, 'tp_mult': 1.787615713877288, 'tsl_mult': 0.19361589093357687, 'strategy': 'breakout', 'time_stop': 113, 'use_sma': False, 'use_atr': True, 'use_adx': True, 'use_ema': False, 'use_spike': True, 'rsi_required': True, 'edge_k': 0.35408088930869785, 'edge_cap': 0.5376192905316612, 'bull_strategy': 'mean_reversion', 'bull_bb_std_mult': 0.5439448436377359, 'bull_rsi_os': 41, 'bull_rsi_ob': 54, 'bull_adx_thresh': 29.117990373759127, 'bull_atr_min_pct': 0.003178567780236093, 'bull_atr_max_pct': 0.11837609731102976, 'bull_tp_mult': 2.7725357317097488, 'bull_tsl_mult': 0.13162220111941686, 'bull_time_stop': 258, 'bull_use_sma': False, 'bull_use_ema': False, 'bull_use_atr': True, 'bull_use_adx': True, 'bull_use_spike': False, 'bull_rsi_required': True, 'bear_strategy': 'mean_reversion', 'bear_bb_std_mult': 0.5217328310409375, 'bear_rsi_os': 32, 'bear_rsi_ob': 88, 'bear_adx_thresh': 23.087385405433423, 'bear_atr_min_pct': 0.000730854699818268, 'bear_atr_max_pct': 0.10566176662212279, 'bear_tp_mult': 2.609283962119613, 'bear_tsl_mult': 0.4551811922624847, 'bear_time_stop': 148, 'bear_use_sma': False, 'bear_use_ema': True, 'bear_use_atr': True, 'bear_use_adx': True, 'bear_use_spike': False, 'bear_rsi_required': False, 'sideways_strategy': 'breakout', 'sideways_bb_std_mult': 3.478090817874473, 'sideways_rsi_os': 51, 'sideways_rsi_ob': 69, 'sideways_adx_thresh': 24.06023979962978, 'sideways_atr_min_pct': 0.01238091956781883, 'sideways_atr_max_pct': 0.09266481912401153, 'sideways_tp_mult': 1.5376537864617208, 'sideways_tsl_mult': 0.5644531245307833, 'sideways_time_stop': 238, 'sideways_use_sma': False, 'sideways_use_ema': True, 'sideways_use_atr': True, 'sideways_use_adx': False, 'sideways_use_spike': False, 'sideways_rsi_required': False}.
[I 2025-09-01 07:24:28,703] Trial 29 finished with values: [-1000000000.0, 1000000000.0] and parameters: {'p_sma': 10, 'p_std': 37, 'p_atr': 29, 'p_adx': 10, 'rsi_period': 43, 'ema1': 9, 'ema2': 29, 'slip_atr_k': 0.1549427984109341, 'slip_spread_k': 0.12205190891840367, 'spread_hl_frac': 0.010913030373759004, 'bb_std_mult': 3.284204072852054, 'rsi_os': 36, 'rsi_ob': 64, 'vol_spike': 0.09198878867304307, 'adx_thresh': 7.551194763010654, 'atr_min_pct': 0.02684122792094807, 'atr_max_pct': 0.14860623776108914, 'tp_mult': 1.6965633235978501, 'tsl_mult': 0.545214551258195, 'strategy': 'breakout', 'time_stop': 148, 'use_sma': False, 'use_atr': True, 'use_adx': True, 'use_ema': False, 'use_spike': True, 'rsi_required': True, 'edge_k': 0.05176318537576963, 'edge_cap': 0.5421164084029951, 'bull_strategy': 'mean_reversion', 'bull_bb_std_mult': 2.4623785916830103, 'bull_rsi_os': 41, 'bull_rsi_ob': 54, 'bull_adx_thresh': 12.539655365374557, 'bull_atr_min_pct': 0.0002822538483569, 'bull_atr_max_pct': 0.11695847780629416, 'bull_tp_mult': 2.759888811644837, 'bull_tsl_mult': 0.10670803036248266, 'bull_time_stop': 264, 'bull_use_sma': False, 'bull_use_ema': True, 'bull_use_atr': False, 'bull_use_adx': True, 'bull_use_spike': True, 'bull_rsi_required': True, 'bear_strategy': 'mean_reversion', 'bear_bb_std_mult': 3.1856683482083916, 'bear_rsi_os': 54, 'bear_rsi_ob': 62, 'bear_adx_thresh': 23.22221722857761, 'bear_atr_min_pct': 0.0004338310993180156, 'bear_atr_max_pct': 0.021845398087908814, 'bear_tp_mult': 1.2342912322418393, 'bear_tsl_mult': 0.44419863366697154, 'bear_time_stop': 159, 'bear_use_sma': True, 'bear_use_ema': True, 'bear_use_atr': True, 'bear_use_adx': False, 'bear_use_spike': False, 'bear_rsi_required': False, 'sideways_strategy': 'mean_reversion', 'sideways_bb_std_mult': 3.4720111184109372, 'sideways_rsi_os': 52, 'sideways_rsi_ob': 61, 'sideways_adx_thresh': 30.609052373388156, 'sideways_atr_min_pct': 0.012186822868573135, 'sideways_atr_max_pct': 0.06534462209108846, 'sideways_tp_mult': 1.51926965258086, 'sideways_tsl_mult': 0.999624605455066, 'sideways_time_stop': 41, 'sideways_use_sma': True, 'sideways_use_ema': True, 'sideways_use_atr': False, 'sideways_use_adx': False, 'sideways_use_spike': False, 'sideways_rsi_required': True}.
[I 2025-09-01 07:24:34,692] Trial 32 finished with values: [-0.14470971044451852, 0.14520192686013975] and parameters: {'p_sma': 59, 'p_std': 25, 'p_atr': 30, 'p_adx': 17, 'rsi_period': 27, 'ema1': 23, 'ema2': 30, 'slip_atr_k': 0.21780560966775225, 'slip_spread_k': 0.837319444984017, 'spread_hl_frac': 0.005982968012008642, 'bb_std_mult': 0.6239529314882923, 'rsi_os': 17, 'rsi_ob': 62, 'vol_spike': 0.15401953475325825, 'adx_thresh': 13.973750467950655, 'atr_min_pct': 0.026431635402816456, 'atr_max_pct': 0.1255186298820787, 'tp_mult': 1.3850095108650837, 'tsl_mult': 0.7360404729229483, 'strategy': 'mean_reversion', 'time_stop': 167, 'use_sma': True, 'use_atr': False, 'use_adx': False, 'use_ema': False, 'use_spike': False, 'rsi_required': False, 'edge_k': 0.02266919344067031, 'edge_cap': 0.36498888940973506, 'bull_strategy': 'breakout', 'bull_bb_std_mult': 2.604129491579663, 'bull_rsi_os': 50, 'bull_rsi_ob': 80, 'bull_adx_thresh': 13.901323654353252, 'bull_atr_min_pct': 8.725106348536973e-05, 'bull_atr_max_pct': 0.1237213353899965, 'bull_tp_mult': 1.419030335638622, 'bull_tsl_mult': 0.7207023633387176, 'bull_time_stop': 7, 'bull_use_sma': True, 'bull_use_ema': True, 'bull_use_atr': False, 'bull_use_adx': True, 'bull_use_spike': True, 'bull_rsi_required': False, 'bear_strategy': 'breakout', 'bear_bb_std_mult': 3.23181528753821, 'bear_rsi_os': 20, 'bear_rsi_ob': 61, 'bear_adx_thresh': 10.046195295319114, 'bear_atr_min_pct': 0.01357159185980804, 'bear_atr_max_pct': 0.02608434368237255, 'bear_tp_mult': 1.2308711227520444, 'bear_tsl_mult': 0.10862915503448956, 'bear_time_stop': 166, 'bear_use_sma': True, 'bear_use_ema': False, 'bear_use_atr': True, 'bear_use_adx': False, 'bear_use_spike': False, 'bear_rsi_required': True, 'sideways_strategy': 'mean_reversion', 'sideways_bb_std_mult': 1.9121521518058207, 'sideways_rsi_os': 22, 'sideways_rsi_ob': 88, 'sideways_adx_thresh': 30.7158934442068, 'sideways_atr_min_pct': 0.024935093590075782, 'sideways_atr_max_pct': 0.059696133631218104, 'sideways_tp_mult': 1.902978083757675, 'sideways_tsl_mult': 0.9882381451739697, 'sideways_time_stop': 38, 'sideways_use_sma': True, 'sideways_use_ema': False, 'sideways_use_atr': False, 'sideways_use_adx': True, 'sideways_use_spike': True, 'sideways_rsi_required': True}.
[I 2025-09-01 07:24:34,970] Trial 30 finished with values: [-1000000000.0, 1000000000.0] and parameters: {'p_sma': 9, 'p_std': 27, 'p_atr': 29, 'p_adx': 17, 'rsi_period': 42, 'ema1': 8, 'ema2': 29, 'slip_atr_k': 0.14909753365101888, 'slip_spread_k': 0.1361534835557634, 'spread_hl_frac': 0.011780076889888176, 'bb_std_mult': 3.3268993221428795, 'rsi_os': 15, 'rsi_ob': 66, 'vol_spike': 0.1126267481652051, 'adx_thresh': 12.95421562857715, 'atr_min_pct': 0.020710537275233597, 'atr_max_pct': 0.12616708850796526, 'tp_mult': 1.6800073745666728, 'tsl_mult': 0.19094565358121068, 'strategy': 'breakout', 'time_stop': 147, 'use_sma': False, 'use_atr': True, 'use_adx': True, 'use_ema': False, 'use_spike': True, 'rsi_required': True, 'edge_k': 0.41728076902867806, 'edge_cap': 0.3824267465624898, 'bull_strategy': 'mean_reversion', 'bull_bb_std_mult': 0.7533968742505582, 'bull_rsi_os': 55, 'bull_rsi_ob': 54, 'bull_adx_thresh': 28.314523734108825, 'bull_atr_min_pct': 0.0028286376017305627, 'bull_atr_max_pct': 0.11930187597972892, 'bull_tp_mult': 1.380417458645249, 'bull_tsl_mult': 0.10674273729209524, 'bull_time_stop': 7, 'bull_use_sma': False, 'bull_use_ema': True, 'bull_use_atr': False, 'bull_use_adx': True, 'bull_use_spike': True, 'bull_rsi_required': True, 'bear_strategy': 'mean_reversion', 'bear_bb_std_mult': 3.205172402332545, 'bear_rsi_os': 36, 'bear_rsi_ob': 86, 'bear_adx_thresh': 9.686043126360232, 'bear_atr_min_pct': 0.0008955711940377975, 'bear_atr_max_pct': 0.02078781217189283, 'bear_tp_mult': 1.2124321753021465, 'bear_tsl_mult': 0.4510296875354828, 'bear_time_stop': 157, 'bear_use_sma': True, 'bear_use_ema': True, 'bear_use_atr': True, 'bear_use_adx': False, 'bear_use_spike': False, 'bear_rsi_required': False, 'sideways_strategy': 'mean_reversion', 'sideways_bb_std_mult': 1.3494647692791752, 'sideways_rsi_os': 51, 'sideways_rsi_ob': 59, 'sideways_adx_thresh': 30.024880290457446, 'sideways_atr_min_pct': 0.012483375369522834, 'sideways_atr_max_pct': 0.06895723248766725, 'sideways_tp_mult': 1.0219507193838795, 'sideways_tsl_mult': 0.9921535805727454, 'sideways_time_stop': 42, 'sideways_use_sma': True, 'sideways_use_ema': True, 'sideways_use_atr': False, 'sideways_use_adx': False, 'sideways_use_spike': False, 'sideways_rsi_required': True}.
[I 2025-09-01 07:24:35,681] Trial 31 finished with values: [-0.20607097366004834, 0.20683384627245527] and parameters: {'p_sma': 10, 'p_std': 28, 'p_atr': 29, 'p_adx': 17, 'rsi_period': 27, 'ema1': 8, 'ema2': 31, 'slip_atr_k': 0.15597953417054902, 'slip_spread_k': 0.8034145251886473, 'spread_hl_frac': 0.011684291405808036, 'bb_std_mult': 3.231890725792355, 'rsi_os': 16, 'rsi_ob': 63, 'vol_spike': 0.10377201126896514, 'adx_thresh': 13.735120852668608, 'atr_min_pct': 0.026433858413169906, 'atr_max_pct': 0.12348265993868317, 'tp_mult': 1.3714674577397072, 'tsl_mult': 0.14517815661034383, 'strategy': 'mean_reversion', 'time_stop': 146, 'use_sma': True, 'use_atr': True, 'use_adx': False, 'use_ema': False, 'use_spike': False, 'rsi_required': False, 'edge_k': 0.3275165363424849, 'edge_cap': 0.3644553352379288, 'bull_strategy': 'breakout', 'bull_bb_std_mult': 2.425414146719978, 'bull_rsi_os': 41, 'bull_rsi_ob': 80, 'bull_adx_thresh': 12.260891768310964, 'bull_atr_min_pct': 0.00288917565752115, 'bull_atr_max_pct': 0.11974682175785455, 'bull_tp_mult': 2.1944770268795724, 'bull_tsl_mult': 0.11730534995605618, 'bull_time_stop': 85, 'bull_use_sma': True, 'bull_use_ema': True, 'bull_use_atr': False, 'bull_use_adx': True, 'bull_use_spike': True, 'bull_rsi_required': True, 'bear_strategy': 'breakout', 'bear_bb_std_mult': 2.6505521765533633, 'bear_rsi_os': 37, 'bear_rsi_ob': 62, 'bear_adx_thresh': 10.276166490188189, 'bear_atr_min_pct': 0.000700388874723205, 'bear_atr_max_pct': 0.02152880909447681, 'bear_tp_mult': 2.131087085008349, 'bear_tsl_mult': 0.4338944253560237, 'bear_time_stop': 168, 'bear_use_sma': True, 'bear_use_ema': False, 'bear_use_atr': True, 'bear_use_adx': False, 'bear_use_spike': False, 'bear_rsi_required': True, 'sideways_strategy': 'mean_reversion', 'sideways_bb_std_mult': 1.3230369021115127, 'sideways_rsi_os': 52, 'sideways_rsi_ob': 60, 'sideways_adx_thresh': 30.849503990712947, 'sideways_atr_min_pct': 0.011112519947837563, 'sideways_atr_max_pct': 0.06355428113788385, 'sideways_tp_mult': 1.5245853668353857, 'sideways_tsl_mult': 0.9222939499225897, 'sideways_time_stop': 52, 'sideways_use_sma': True, 'sideways_use_ema': True, 'sideways_use_atr': False, 'sideways_use_adx': True, 'sideways_use_spike': True, 'sideways_rsi_required': True}.
[I 2025-09-01 07:24:35,898] Trial 36 finished with values: [-1000000000.0, 1000000000.0] and parameters: {'p_sma': 19, 'p_std': 45, 'p_atr': 25, 'p_adx': 12, 'rsi_period': 8, 'ema1': 23, 'ema2': 21, 'slip_atr_k': 0.10216145518667454, 'slip_spread_k': 0.025792004901394765, 'spread_hl_frac': 0.000946623696864643, 'bb_std_mult': 2.3672470728949078, 'rsi_os': 26, 'rsi_ob': 49, 'vol_spike': 0.15129507754719357, 'adx_thresh': 11.683280840422952, 'atr_min_pct': 0.012380189331287475, 'atr_max_pct': 0.1373012745913892, 'tp_mult': 1.6004620721071725, 'tsl_mult': 0.05604097187805679, 'strategy': 'mean_reversion', 'time_stop': 5, 'use_sma': True, 'use_atr': False, 'use_adx': False, 'use_ema': True, 'use_spike': False, 'rsi_required': False, 'edge_k': 0.8075336785289281, 'edge_cap': 0.6616380767973223, 'bull_strategy': 'breakout', 'bull_bb_std_mult': 1.3022390263015637, 'bull_rsi_os': 6, 'bull_rsi_ob': 71, 'bull_adx_thresh': 22.18071995351153, 'bull_atr_min_pct': 0.026228683511525446, 'bull_atr_max_pct': 0.10467256425393483, 'bull_tp_mult': 2.5148381942744846, 'bull_tsl_mult': 0.5800392553000214, 'bull_time_stop': 42, 'bull_use_sma': True, 'bull_use_ema': False, 'bull_use_atr': True, 'bull_use_adx': False, 'bull_use_spike': False, 'bull_rsi_required': False, 'bear_strategy': 'breakout', 'bear_bb_std_mult': 2.7475217951457847, 'bear_rsi_os': 41, 'bear_rsi_ob': 72, 'bear_adx_thresh': 20.094702353296114, 'bear_atr_min_pct': 0.004598646445535105, 'bear_atr_max_pct': 0.036586170995998146, 'bear_tp_mult': 2.275870026258145, 'bear_tsl_mult': 0.21117153143500453, 'bear_time_stop': 220, 'bear_use_sma': False, 'bear_use_ema': False, 'bear_use_atr': False, 'bear_use_adx': True, 'bear_use_spike': True, 'bear_rsi_required': True, 'sideways_strategy': 'breakout', 'sideways_bb_std_mult': 0.7466071494460803, 'sideways_rsi_os': 42, 'sideways_rsi_ob': 64, 'sideways_adx_thresh': 18.90807953909713, 'sideways_atr_min_pct': 0.02935654012490968, 'sideways_atr_max_pct': 0.07704390637365245, 'sideways_tp_mult': 1.1022609360906492, 'sideways_tsl_mult': 0.9019678721559169, 'sideways_time_stop': 125, 'sideways_use_sma': False, 'sideways_use_ema': False, 'sideways_use_atr': True, 'sideways_use_adx': True, 'sideways_use_spike': True, 'sideways_rsi_required': False}.
[I 2025-09-01 07:24:36,080] Trial 37 finished with values: [-1000000000.0, 1000000000.0] and parameters: {'p_sma': 29, 'p_std': 60, 'p_atr': 20, 'p_adx': 12, 'rsi_period': 75, 'ema1': 16, 'ema2': 37, 'slip_atr_k': 0.10459335017750683, 'slip_spread_k': 0.19214510695843778, 'spread_hl_frac': 0.028423636075965972, 'bb_std_mult': 2.730189010228467, 'rsi_os': 52, 'rsi_ob': 58, 'vol_spike': 0.1997009450250823, 'adx_thresh': 11.757973481742955, 'atr_min_pct': 0.016680474745025632, 'atr_max_pct': 0.03151350608321943, 'tp_mult': 1.885448743090643, 'tsl_mult': 0.2511688056930982, 'strategy': 'mean_reversion', 'time_stop': 224, 'use_sma': True, 'use_atr': True, 'use_adx': False, 'use_ema': False, 'use_spike': False, 'rsi_required': False, 'edge_k': 1.17330824081767, 'edge_cap': 0.8176601055309145, 'bull_strategy': 'breakout', 'bull_bb_std_mult': 0.7729399823493437, 'bull_rsi_os': 19, 'bull_rsi_ob': 71, 'bull_adx_thresh': 34.87580766336042, 'bull_atr_min_pct': 0.008711085082087096, 'bull_atr_max_pct': 0.03634291731012815, 'bull_tp_mult': 1.9633598006581257, 'bull_tsl_mult': 0.6502651345639208, 'bull_time_stop': 23, 'bull_use_sma': True, 'bull_use_ema': False, 'bull_use_atr': True, 'bull_use_adx': False, 'bull_use_spike': False, 'bull_rsi_required': False, 'bear_strategy': 'breakout', 'bear_bb_std_mult': 1.1706544629448037, 'bear_rsi_os': 27, 'bear_rsi_ob': 57, 'bear_adx_thresh': 17.311211468176644, 'bear_atr_min_pct': 0.007104377074402556, 'bear_atr_max_pct': 0.034145823044212896, 'bear_tp_mult': 2.0732426337093113, 'bear_tsl_mult': 0.3517969081194039, 'bear_time_stop': 68, 'bear_use_sma': False, 'bear_use_ema': False, 'bear_use_atr': False, 'bear_use_adx': True, 'bear_use_spike': True, 'bear_rsi_required': True, 'sideways_strategy': 'breakout', 'sideways_bb_std_mult': 1.736724795656899, 'sideways_rsi_os': 48, 'sideways_rsi_ob': 74, 'sideways_adx_thresh': 21.072003921206687, 'sideways_atr_min_pct': 0.016207658563414894, 'sideways_atr_max_pct': 0.09949727257218902, 'sideways_tp_mult': 2.2431477847552235, 'sideways_tsl_mult': 0.20247997473129686, 'sideways_time_stop': 87, 'sideways_use_sma': False, 'sideways_use_ema': True, 'sideways_use_atr': True, 'sideways_use_adx': True, 'sideways_use_spike': True, 'sideways_rsi_required': False}.
[I 2025-09-01 07:25:04,972] Trial 33 finished with values: [-0.04016820049324088, 0.04048460559389498] and parameters: {'p_sma': 30, 'p_std': 30, 'p_atr': 29, 'p_adx': 17, 'rsi_period': 26, 'ema1': 16, 'ema2': 18, 'slip_atr_k': 0.10697133383761946, 'slip_spread_k': 0.806741111283432, 'spread_hl_frac': 0.03512283192148706, 'bb_std_mult': 2.7524126109462133, 'rsi_os': 31, 'rsi_ob': 60, 'vol_spike': 0.15771191440807664, 'adx_thresh': 14.091493375204351, 'atr_min_pct': 0.01242863486746254, 'atr_max_pct': 0.12895762263772273, 'tp_mult': 1.355724350630653, 'tsl_mult': 0.09006528340238928, 'strategy': 'mean_reversion', 'time_stop': 171, 'use_sma': True, 'use_atr': False, 'use_adx': False, 'use_ema': False, 'use_spike': False, 'rsi_required': False, 'edge_k': 1.1952040290933184, 'edge_cap': 0.6513845890239063, 'bull_strategy': 'breakout', 'bull_bb_std_mult': 0.8138177281029061, 'bull_rsi_os': 51, 'bull_rsi_ob': 79, 'bull_adx_thresh': 14.024571151565699, 'bull_atr_min_pct': 0.0032802213403249126, 'bull_atr_max_pct': 0.038218327613684294, 'bull_tp_mult': 2.1896591452379495, 'bull_tsl_mult': 0.631625382149799, 'bull_time_stop': 185, 'bull_use_sma': True, 'bull_use_ema': True, 'bull_use_atr': False, 'bull_use_adx': False, 'bull_use_spike': True, 'bull_rsi_required': False, 'bear_strategy': 'breakout', 'bear_bb_std_mult': 2.6053868648602267, 'bear_rsi_os': 20, 'bear_rsi_ob': 56, 'bear_adx_thresh': 12.21271941250494, 'bear_atr_min_pct': 0.01274529126639675, 'bear_atr_max_pct': 0.03620533729139165, 'bear_tp_mult': 2.7695279411359737, 'bear_tsl_mult': 0.14845992634249838, 'bear_time_stop': 74, 'bear_use_sma': True, 'bear_use_ema': False, 'bear_use_atr': False, 'bear_use_adx': False, 'bear_use_spike': True, 'bear_rsi_required': True, 'sideways_strategy': 'mean_reversion', 'sideways_bb_std_mult': 1.8609591998541726, 'sideways_rsi_os': 26, 'sideways_rsi_ob': 60, 'sideways_adx_thresh': 20.49758462585266, 'sideways_atr_min_pct': 0.029604551980040618, 'sideways_atr_max_pct': 0.05665561402143571, 'sideways_tp_mult': 1.8485969094426928, 'sideways_tsl_mult': 0.8953771797093463, 'sideways_time_stop': 132, 'sideways_use_sma': True, 'sideways_use_ema': False, 'sideways_use_atr': False, 'sideways_use_adx': True, 'sideways_use_spike': True, 'sideways_rsi_required': True}.
