[I 2025-09-01 07:40:48,840] Trial 127 finished with values: [-1000000000.0, 1000000000.0] and parameters: {'p_sma': 21, 'p_std': 16, 'p_atr': 14, 'p_adx': 22, 'rsi_period': 22, 'ema1': 10, 'ema2': 35, 'slip_atr_k': 0.06933123104953572, 'slip_spread_k': 0.5948628954001892, 'spread_hl_frac': 0.02222422146325221, 'bb_std_mult': 3.4461696281539087, 'rsi_os': 20, 'rsi_ob': 54, 'vol_spike': 0.2016319267100366, 'adx_thresh': 24.374169636555024, 'atr_min_pct': 0.02275305503163109, 'atr_max_pct': 0.13949082907236818, 'tp_mult': 1.227131992684176, 'tsl_mult': 0.43942411565855577, 'strategy': 'mean_reversion', 'time_stop': 264, 'use_sma': True, 'use_atr': True, 'use_adx': True, 'use_ema': True, 'use_spike': True, 'rsi_required': True, 'edge_k': 0.4257242032697127, 'edge_cap': 0.09185843839449742, 'bull_strategy': 'breakout', 'bull_bb_std_mult': 2.755063826386514, 'bull_rsi_os': 12, 'bull_rsi_ob': 62, 'bull_adx_thresh': 24.582788521783705, 'bull_atr_min_pct': 0.008891789156588772, 'bull_atr_max_pct': 0.040270964413606024, 'bull_tp_mult': 1.3585184478565855, 'bull_tsl_mult': 0.9453709083184756, 'bull_time_stop': 168, 'bull_use_sma': True, 'bull_use_ema': False, 'bull_use_atr': False, 'bull_use_adx': True, 'bull_use_spike': True, 'bull_rsi_required': False, 'bear_strategy': 'mean_reversion', 'bear_bb_std_mult': 3.2662424088307462, 'bear_rsi_os': 29, 'bear_rsi_ob': 95, 'bear_adx_thresh': 21.26581048745248, 'bear_atr_min_pct': 0.022613744362459234, 'bear_atr_max_pct': 0.06631412924076456, 'bear_tp_mult': 2.8024545040783906, 'bear_tsl_mult': 0.027895759318215113, 'bear_time_stop': 171, 'bear_use_sma': False, 'bear_use_ema': False, 'bear_use_atr': True, 'bear_use_adx': True, 'bear_use_spike': True, 'bear_rsi_required': False, 'sideways_strategy': 'mean_reversion', 'sideways_bb_std_mult': 0.5034650630592261, 'sideways_rsi_os': 10, 'sideways_rsi_ob': 64, 'sideways_adx_thresh': 8.223303815708391, 'sideways_atr_min_pct': 0.023006959116990654, 'sideways_atr_max_pct': 0.028561432046966845, 'sideways_tp_mult': 2.5106200776239915, 'sideways_tsl_mult': 0.23381977522096103, 'sideways_time_stop': 29, 'sideways_use_sma': False, 'sideways_use_ema': False, 'sideways_use_atr': False, 'sideways_use_adx': True, 'sideways_use_spike': True, 'sideways_rsi_required': False}.
[I 2025-09-01 07:40:49,974] Trial 126 finished with values: [-1000000000.0, 1000000000.0] and parameters: {'p_sma': 20, 'p_std': 11, 'p_atr': 11, 'p_adx': 21, 'rsi_period': 24, 'ema1': 10, 'ema2': 34, 'slip_atr_k': 0.05008505850135435, 'slip_spread_k': 0.6625301031083985, 'spread_hl_frac': 0.021550677331170706, 'bb_std_mult': 2.9286216443963697, 'rsi_os': 27, 'rsi_ob': 54, 'vol_spike': 0.23939641757886354, 'adx_thresh': 24.22789653241407, 'atr_min_pct': 0.02069798572185414, 'atr_max_pct': 0.14134686432660296, 'tp_mult': 2.7277666665617017, 'tsl_mult': 0.3951765858560184, 'strategy': 'breakout', 'time_stop': 263, 'use_sma': True, 'use_atr': True, 'use_adx': True, 'use_ema': True, 'use_spike': True, 'rsi_required': True, 'edge_k': 0.07450508287797752, 'edge_cap': 0.07683107572541725, 'bull_strategy': 'breakout', 'bull_bb_std_mult': 2.761160533003017, 'bull_rsi_os': 11, 'bull_rsi_ob': 63, 'bull_adx_thresh': 24.515148517195833, 'bull_atr_min_pct': 0.013817829693024114, 'bull_atr_max_pct': 0.049308946747886016, 'bull_tp_mult': 2.3833619604138554, 'bull_tsl_mult': 0.8600879163439746, 'bull_time_stop': 168, 'bull_use_sma': True, 'bull_use_ema': False, 'bull_use_atr': False, 'bull_use_adx': True, 'bull_use_spike': True, 'bull_rsi_required': False, 'bear_strategy': 'mean_reversion', 'bear_bb_std_mult': 2.98902372725614, 'bear_rsi_os': 26, 'bear_rsi_ob': 92, 'bear_adx_thresh': 34.98962459530339, 'bear_atr_min_pct': 0.022872295697954487, 'bear_atr_max_pct': 0.07816323141403912, 'bear_tp_mult': 2.779605983090097, 'bear_tsl_mult': 0.10585285114756982, 'bear_time_stop': 16, 'bear_use_sma': False, 'bear_use_ema': False, 'bear_use_atr': True, 'bear_use_adx': True, 'bear_use_spike': True, 'bear_rsi_required': False, 'sideways_strategy': 'mean_reversion', 'sideways_bb_std_mult': 0.5261593824816573, 'sideways_rsi_os': 46, 'sideways_rsi_ob': 66, 'sideways_adx_thresh': 10.337250899214048, 'sideways_atr_min_pct': 0.022212984822350332, 'sideways_atr_max_pct': 0.03439153639829183, 'sideways_tp_mult': 2.5180679656525924, 'sideways_tsl_mult': 0.19411838241552182, 'sideways_time_stop': 75, 'sideways_use_sma': False, 'sideways_use_ema': False, 'sideways_use_atr': False, 'sideways_use_adx': True, 'sideways_use_spike': True, 'sideways_rsi_required': False}.
[I 2025-09-01 07:40:50,318] Trial 125 finished with values: [-1000000000.0, 1000000000.0] and parameters: {'p_sma': 24, 'p_std': 11, 'p_atr': 11, 'p_adx': 21, 'rsi_period': 21, 'ema1': 10, 'ema2': 35, 'slip_atr_k': 0.20470658319145074, 'slip_spread_k': 0.600005975374362, 'spread_hl_frac': 0.02966890764287905, 'bb_std_mult': 2.9327134667736323, 'rsi_os': 22, 'rsi_ob': 79, 'vol_spike': 0.2360327304591088, 'adx_thresh': 24.448128308668526, 'atr_min_pct': 0.02036646343394601, 'atr_max_pct': 0.1490148137531191, 'tp_mult': 2.673384662387882, 'tsl_mult': 0.5053401362626017, 'strategy': 'breakout', 'time_stop': 258, 'use_sma': True, 'use_atr': True, 'use_adx': True, 'use_ema': True, 'use_spike': True, 'rsi_required': True, 'edge_k': 1.0861898113243742, 'edge_cap': 0.07712819875788907, 'bull_strategy': 'breakout', 'bull_bb_std_mult': 2.9106711320503003, 'bull_rsi_os': 11, 'bull_rsi_ob': 70, 'bull_adx_thresh': 8.780668695422118, 'bull_atr_min_pct': 0.013603739309652751, 'bull_atr_max_pct': 0.04793581572178922, 'bull_tp_mult': 2.381553290279954, 'bull_tsl_mult': 0.8950362002584514, 'bull_time_stop': 167, 'bull_use_sma': True, 'bull_use_ema': False, 'bull_use_atr': False, 'bull_use_adx': True, 'bull_use_spike': True, 'bull_rsi_required': False, 'bear_strategy': 'mean_reversion', 'bear_bb_std_mult': 3.260423050098279, 'bear_rsi_os': 26, 'bear_rsi_ob': 92, 'bear_adx_thresh': 21.747200188322307, 'bear_atr_min_pct': 0.02295875598599977, 'bear_atr_max_pct': 0.08588110191098482, 'bear_tp_mult': 2.785063531633937, 'bear_tsl_mult': 0.13025199864437534, 'bear_time_stop': 146, 'bear_use_sma': False, 'bear_use_ema': False, 'bear_use_atr': True, 'bear_use_adx': True, 'bear_use_spike': True, 'bear_rsi_required': False, 'sideways_strategy': 'mean_reversion', 'sideways_bb_std_mult': 0.5069771042037938, 'sideways_rsi_os': 41, 'sideways_rsi_ob': 62, 'sideways_adx_thresh': 12.062786762393154, 'sideways_atr_min_pct': 0.0219664498960154, 'sideways_atr_max_pct': 0.03013751362501341, 'sideways_tp_mult': 2.690835962122285, 'sideways_tsl_mult': 0.16826142363683422, 'sideways_time_stop': 77, 'sideways_use_sma': False, 'sideways_use_ema': False, 'sideways_use_atr': False, 'sideways_use_adx': True, 'sideways_use_spike': True, 'sideways_rsi_required': False}.
[I 2025-09-01 07:40:50,892] Trial 129 finished with values: [-1000000000.0, 1000000000.0] and parameters: {'p_sma': 24, 'p_std': 18, 'p_atr': 12, 'p_adx': 20, 'rsi_period': 66, 'ema1': 11, 'ema2': 15, 'slip_atr_k': 0.08496061901725142, 'slip_spread_k': 0.5715659272652704, 'spread_hl_frac': 0.03160168413457668, 'bb_std_mult': 3.107140665560406, 'rsi_os': 54, 'rsi_ob': 58, 'vol_spike': 0.23090730783359745, 'adx_thresh': 23.50302441526325, 'atr_min_pct': 0.02080605277422407, 'atr_max_pct': 0.03092349721624526, 'tp_mult': 1.1312517807622016, 'tsl_mult': 0.4908146231662076, 'strategy': 'mean_reversion', 'time_stop': 281, 'use_sma': True, 'use_atr': True, 'use_adx': True, 'use_ema': False, 'use_spike': True, 'rsi_required': False, 'edge_k': 0.9925050277152051, 'edge_cap': 0.17550012955891803, 'bull_strategy': 'breakout', 'bull_bb_std_mult': 3.1337216045590908, 'bull_rsi_os': 13, 'bull_rsi_ob': 66, 'bull_adx_thresh': 10.866783351436862, 'bull_atr_min_pct': 0.014575994043556197, 'bull_atr_max_pct': 0.05534869478593722, 'bull_tp_mult': 2.3888785128861407, 'bull_tsl_mult': 0.6038952936580918, 'bull_time_stop': 120, 'bull_use_sma': True, 'bull_use_ema': False, 'bull_use_atr': False, 'bull_use_adx': True, 'bull_use_spike': True, 'bull_rsi_required': False, 'bear_strategy': 'mean_reversion', 'bear_bb_std_mult': 3.033854163960712, 'bear_rsi_os': 54, 'bear_rsi_ob': 94, 'bear_adx_thresh': 30.751120786129626, 'bear_atr_min_pct': 0.020899609936228507, 'bear_atr_max_pct': 0.09405589967909543, 'bear_tp_mult': 2.731477665085099, 'bear_tsl_mult': 0.09729419170272467, 'bear_time_stop': 10, 'bear_use_sma': False, 'bear_use_ema': False, 'bear_use_atr': True, 'bear_use_adx': True, 'bear_use_spike': True, 'bear_rsi_required': False, 'sideways_strategy': 'mean_reversion', 'sideways_bb_std_mult': 0.7436287944991186, 'sideways_rsi_os': 38, 'sideways_rsi_ob': 59, 'sideways_adx_thresh': 9.09530670247597, 'sideways_atr_min_pct': 0.021666590493411117, 'sideways_atr_max_pct': 0.03145566704532948, 'sideways_tp_mult': 2.6551514836330856, 'sideways_tsl_mult': 0.27509510113745483, 'sideways_time_stop': 77, 'sideways_use_sma': False, 'sideways_use_ema': True, 'sideways_use_atr': False, 'sideways_use_adx': True, 'sideways_use_spike': True, 'sideways_rsi_required': False}.
[I 2025-09-01 07:40:51,183] Trial 133 finished with values: [-1000000000.0, 1000000000.0] and parameters: {'p_sma': 23, 'p_std': 58, 'p_atr': 10, 'p_adx': 17, 'rsi_period': 76, 'ema1': 12, 'ema2': 42, 'slip_atr_k': 0.13052104529321373, 'slip_spread_k': 0.00608263713082674, 'spread_hl_frac': 0.025641503551430612, 'bb_std_mult': 2.6454382876877682, 'rsi_os': 50, 'rsi_ob': 92, 'vol_spike': 0.22227957080940688, 'adx_thresh': 27.02051135502546, 'atr_min_pct': 0.0012473031511521376, 'atr_max_pct': 0.13429302854070557, 'tp_mult': 1.9072854825382841, 'tsl_mult': 0.90808040854723, 'strategy': 'mean_reversion', 'time_stop': 39, 'use_sma': False, 'use_atr': True, 'use_adx': False, 'use_ema': True, 'use_spike': True, 'rsi_required': False, 'edge_k': 0.9055735022620073, 'edge_cap': 0.120554849284118, 'bull_strategy': 'mean_reversion', 'bull_bb_std_mult': 2.9542025545050166, 'bull_rsi_os': 10, 'bull_rsi_ob': 68, 'bull_adx_thresh': 21.195466410135676, 'bull_atr_min_pct': 0.018168033796529502, 'bull_atr_max_pct': 0.025712371565163608, 'bull_tp_mult': 2.112066786409851, 'bull_tsl_mult': 0.3584544230436171, 'bull_time_stop': 155, 'bull_use_sma': False, 'bull_use_ema': False, 'bull_use_atr': True, 'bull_use_adx': True, 'bull_use_spike': False, 'bull_rsi_required': False, 'bear_strategy': 'mean_reversion', 'bear_bb_std_mult': 3.3829430893378447, 'bear_rsi_os': 31, 'bear_rsi_ob': 90, 'bear_adx_thresh': 27.4622572367673, 'bear_atr_min_pct': 0.02382837040960178, 'bear_atr_max_pct': 0.09044841180939049, 'bear_tp_mult': 1.7050755326333427, 'bear_tsl_mult': 0.14825971777608543, 'bear_time_stop': 111, 'bear_use_sma': False, 'bear_use_ema': False, 'bear_use_atr': True, 'bear_use_adx': True, 'bear_use_spike': True, 'bear_rsi_required': False, 'sideways_strategy': 'mean_reversion', 'sideways_bb_std_mult': 0.6309777435963362, 'sideways_rsi_os': 15, 'sideways_rsi_ob': 91, 'sideways_adx_thresh': 9.475068391872021, 'sideways_atr_min_pct': 0.02405924441977485, 'sideways_atr_max_pct': 0.025340981364896528, 'sideways_tp_mult': 2.8540573478441003, 'sideways_tsl_mult': 0.12417297460355325, 'sideways_time_stop': 99, 'sideways_use_sma': False, 'sideways_use_ema': True, 'sideways_use_atr': False, 'sideways_use_adx': False, 'sideways_use_spike': False, 'sideways_rsi_required': False}.
[I 2025-09-01 07:41:31,487] Trial 134 finished with values: [-0.039080825430915844, 0.03897299841962621] and parameters: {'p_sma': 44, 'p_std': 14, 'p_atr': 12, 'p_adx': 20, 'rsi_period': 55, 'ema1': 9, 'ema2': 13, 'slip_atr_k': 0.04560415993290076, 'slip_spread_k': 0.6323488339847088, 'spread_hl_frac': 0.02659094674023875, 'bb_std_mult': 3.2870890906059884, 'rsi_os': 25, 'rsi_ob': 55, 'vol_spike': 0.011480319474484774, 'adx_thresh': 25.428037961650546, 'atr_min_pct': 0.02449975654521437, 'atr_max_pct': 0.13691084167100978, 'tp_mult': 2.2799674738741835, 'tsl_mult': 0.3725333904624586, 'strategy': 'mean_reversion', 'time_stop': 276, 'use_sma': True, 'use_atr': True, 'use_adx': True, 'use_ema': False, 'use_spike': True, 'rsi_required': True, 'edge_k': 1.942828137818469, 'edge_cap': 0.10801167410762542, 'bull_strategy': 'breakout', 'bull_bb_std_mult': 2.8615981125961314, 'bull_rsi_os': 9, 'bull_rsi_ob': 56, 'bull_adx_thresh': 7.053095360037885, 'bull_atr_min_pct': 0.003559076307291193, 'bull_atr_max_pct': 0.12273349341334508, 'bull_tp_mult': 1.296091245338117, 'bull_tsl_mult': 0.6629197922777494, 'bull_time_stop': 16, 'bull_use_sma': True, 'bull_use_ema': False, 'bull_use_atr': True, 'bull_use_adx': True, 'bull_use_spike': False, 'bull_rsi_required': False, 'bear_strategy': 'mean_reversion', 'bear_bb_std_mult': 3.179124254136263, 'bear_rsi_os': 21, 'bear_rsi_ob': 73, 'bear_adx_thresh': 6.3518421086642896, 'bear_atr_min_pct': 0.024667947506335053, 'bear_atr_max_pct': 0.12968316745502512, 'bear_tp_mult': 1.4029360708026821, 'bear_tsl_mult': 0.8346566062533598, 'bear_time_stop': 79, 'bear_use_sma': False, 'bear_use_ema': False, 'bear_use_atr': True, 'bear_use_adx': True, 'bear_use_spike': True, 'bear_rsi_required': False, 'sideways_strategy': 'mean_reversion', 'sideways_bb_std_mult': 2.9730864036105222, 'sideways_rsi_os': 36, 'sideways_rsi_ob': 72, 'sideways_adx_thresh': 8.377789969211621, 'sideways_atr_min_pct': 0.02449991511436619, 'sideways_atr_max_pct': 0.013356846185650778, 'sideways_tp_mult': 1.1257745161505588, 'sideways_tsl_mult': 0.1507444863964005, 'sideways_time_stop': 12, 'sideways_use_sma': False, 'sideways_use_ema': False, 'sideways_use_atr': False, 'sideways_use_adx': True, 'sideways_use_spike': True, 'sideways_rsi_required': False}.
[I 2025-09-01 07:41:31,513] Trial 132 finished with values: [-1000000000.0, 1000000000.0] and parameters: {'p_sma': 23, 'p_std': 18, 'p_atr': 12, 'p_adx': 20, 'rsi_period': 75, 'ema1': 11, 'ema2': 15, 'slip_atr_k': 0.1300077842885315, 'slip_spread_k': 0.5753510808102981, 'spread_hl_frac': 0.026472836670341903, 'bb_std_mult': 3.270918739019124, 'rsi_os': 25, 'rsi_ob': 58, 'vol_spike': 0.2237147589657335, 'adx_thresh': 26.719303444332233, 'atr_min_pct': 0.004161655552949263, 'atr_max_pct': 0.10396922031648997, 'tp_mult': 2.3241843005466087, 'tsl_mult': 0.5694558855190989, 'strategy': 'mean_reversion', 'time_stop': 278, 'use_sma': False, 'use_atr': True, 'use_adx': False, 'use_ema': False, 'use_spike': True, 'rsi_required': False, 'edge_k': 0.984804511981321, 'edge_cap': 0.17030807566397466, 'bull_strategy': 'mean_reversion', 'bull_bb_std_mult': 2.8622186159242204, 'bull_rsi_os': 9, 'bull_rsi_ob': 68, 'bull_adx_thresh': 5.4241630499612565, 'bull_atr_min_pct': 0.014790838920021376, 'bull_atr_max_pct': 0.055220582740497834, 'bull_tp_mult': 1.3099345221480851, 'bull_tsl_mult': 0.8424754527814378, 'bull_time_stop': 157, 'bull_use_sma': False, 'bull_use_ema': False, 'bull_use_atr': True, 'bull_use_adx': True, 'bull_use_spike': False, 'bull_rsi_required': False, 'bear_strategy': 'mean_reversion', 'bear_bb_std_mult': 3.3896314971425556, 'bear_rsi_os': 22, 'bear_rsi_ob': 94, 'bear_adx_thresh': 27.15491632029661, 'bear_atr_min_pct': 0.020897749853997227, 'bear_atr_max_pct': 0.09385483846564967, 'bear_tp_mult': 1.431593735184184, 'bear_tsl_mult': 0.16659384239126998, 'bear_time_stop': 115, 'bear_use_sma': False, 'bear_use_ema': False, 'bear_use_atr': True, 'bear_use_adx': True, 'bear_use_spike': True, 'bear_rsi_required': False, 'sideways_strategy': 'mean_reversion', 'sideways_bb_std_mult': 0.7311533000034425, 'sideways_rsi_os': 38, 'sideways_rsi_ob': 90, 'sideways_adx_thresh': 9.185933632926703, 'sideways_atr_min_pct': 0.02416850756604689, 'sideways_atr_max_pct': 0.14698784799848913, 'sideways_tp_mult': 1.2804594290483808, 'sideways_tsl_mult': 0.2764130274889116, 'sideways_time_stop': 58, 'sideways_use_sma': False, 'sideways_use_ema': True, 'sideways_use_atr': False, 'sideways_use_adx': False, 'sideways_use_spike': False, 'sideways_rsi_required': False}.
[I 2025-09-01 07:41:32,191] Trial 130 finished with values: [-1000000000.0, 1000000000.0] and parameters: {'p_sma': 46, 'p_std': 14, 'p_atr': 12, 'p_adx': 20, 'rsi_period': 75, 'ema1': 11, 'ema2': 15, 'slip_atr_k': 0.12891764278986134, 'slip_spread_k': 0.640520672397009, 'spread_hl_frac': 0.03138166548299642, 'bb_std_mult': 3.0848767946863145, 'rsi_os': 22, 'rsi_ob': 58, 'vol_spike': 0.016166901274099255, 'adx_thresh': 26.829579015602885, 'atr_min_pct': 0.00142488186167662, 'atr_max_pct': 0.10249539916747416, 'tp_mult': 2.6971090155543687, 'tsl_mult': 0.572876857211951, 'strategy': 'mean_reversion', 'time_stop': 285, 'use_sma': True, 'use_atr': True, 'use_adx': True, 'use_ema': False, 'use_spike': True, 'rsi_required': False, 'edge_k': 0.9929673238076321, 'edge_cap': 0.18550398617422592, 'bull_strategy': 'breakout', 'bull_bb_std_mult': 2.8615280236777876, 'bull_rsi_os': 13, 'bull_rsi_ob': 66, 'bull_adx_thresh': 5.693117788715957, 'bull_atr_min_pct': 0.010683537654047448, 'bull_atr_max_pct': 0.03904795689036922, 'bull_tp_mult': 2.6289344414051437, 'bull_tsl_mult': 0.8384128916883835, 'bull_time_stop': 157, 'bull_use_sma': True, 'bull_use_ema': False, 'bull_use_atr': False, 'bull_use_adx': True, 'bull_use_spike': True, 'bull_rsi_required': False, 'bear_strategy': 'mean_reversion', 'bear_bb_std_mult': 3.378674010500996, 'bear_rsi_os': 54, 'bear_rsi_ob': 94, 'bear_adx_thresh': 27.341694493929197, 'bear_atr_min_pct': 0.02095677097547493, 'bear_atr_max_pct': 0.09145052122904315, 'bear_tp_mult': 1.4332465002539556, 'bear_tsl_mult': 0.11042458245366575, 'bear_time_stop': 10, 'bear_use_sma': False, 'bear_use_ema': False, 'bear_use_atr': True, 'bear_use_adx': True, 'bear_use_spike': True, 'bear_rsi_required': False, 'sideways_strategy': 'mean_reversion', 'sideways_bb_std_mult': 0.739385798527142, 'sideways_rsi_os': 38, 'sideways_rsi_ob': 66, 'sideways_adx_thresh': 10.386690881890386, 'sideways_atr_min_pct': 0.02196819609784472, 'sideways_atr_max_pct': 0.031949646426234914, 'sideways_tp_mult': 1.2465833908916322, 'sideways_tsl_mult': 0.14710683370142646, 'sideways_time_stop': 76, 'sideways_use_sma': False, 'sideways_use_ema': True, 'sideways_use_atr': False, 'sideways_use_adx': True, 'sideways_use_spike': True, 'sideways_rsi_required': False}.
[I 2025-09-01 07:41:32,689] Trial 131 finished with values: [-1000000000.0, 1000000000.0] and parameters: {'p_sma': 24, 'p_std': 18, 'p_atr': 12, 'p_adx': 20, 'rsi_period': 75, 'ema1': 12, 'ema2': 15, 'slip_atr_k': 0.08498763491563735, 'slip_spread_k': 0.0038962911904896202, 'spread_hl_frac': 0.03265888772821555, 'bb_std_mult': 3.0975133976939713, 'rsi_os': 22, 'rsi_ob': 59, 'vol_spike': 0.008292262064712536, 'adx_thresh': 26.8924369375873, 'atr_min_pct': 0.0016612476795771491, 'atr_max_pct': 0.10167524008548864, 'tp_mult': 2.2967972547627484, 'tsl_mult': 0.9977200802153545, 'strategy': 'mean_reversion', 'time_stop': 270, 'use_sma': True, 'use_atr': True, 'use_adx': True, 'use_ema': False, 'use_spike': True, 'rsi_required': False, 'edge_k': 0.9910615394381435, 'edge_cap': 0.18351383694008963, 'bull_strategy': 'breakout', 'bull_bb_std_mult': 2.900304066730412, 'bull_rsi_os': 9, 'bull_rsi_ob': 65, 'bull_adx_thresh': 27.136736498212624, 'bull_atr_min_pct': 0.029114438589958037, 'bull_atr_max_pct': 0.04401454681038814, 'bull_tp_mult': 2.6301207113947487, 'bull_tsl_mult': 0.6041638004153149, 'bull_time_stop': 14, 'bull_use_sma': True, 'bull_use_ema': False, 'bull_use_atr': True, 'bull_use_adx': True, 'bull_use_spike': False, 'bull_rsi_required': False, 'bear_strategy': 'mean_reversion', 'bear_bb_std_mult': 3.3626787018772215, 'bear_rsi_os': 22, 'bear_rsi_ob': 94, 'bear_adx_thresh': 6.86379890980678, 'bear_atr_min_pct': 0.020793348274389438, 'bear_atr_max_pct': 0.09182983114988706, 'bear_tp_mult': 2.7298559223760632, 'bear_tsl_mult': 0.13678349397213768, 'bear_time_stop': 111, 'bear_use_sma': False, 'bear_use_ema': False, 'bear_use_atr': True, 'bear_use_adx': True, 'bear_use_spike': True, 'bear_rsi_required': False, 'sideways_strategy': 'mean_reversion', 'sideways_bb_std_mult': 0.73167494873057, 'sideways_rsi_os': 36, 'sideways_rsi_ob': 89, 'sideways_adx_thresh': 9.18881538508892, 'sideways_atr_min_pct': 0.021627688009449444, 'sideways_atr_max_pct': 0.03133237449952952, 'sideways_tp_mult': 1.0845909762781694, 'sideways_tsl_mult': 0.26664329483561355, 'sideways_time_stop': 104, 'sideways_use_sma': False, 'sideways_use_ema': True, 'sideways_use_atr': False, 'sideways_use_adx': False, 'sideways_use_spike': False, 'sideways_rsi_required': False}.
