[I 2025-09-01 08:37:29,656] Trial 479 finished with values: [-1000000000.0, 1000000000.0] and parameters: {'p_sma': 42, 'p_std': 16, 'p_atr': 9, 'p_adx': 18, 'rsi_period': 58, 'ema1': 10, 'ema2': 49, 'slip_atr_k': 0.1931961761237826, 'slip_spread_k': 0.6952077386055199, 'spread_hl_frac': 0.02385467239265022, 'bb_std_mult': 2.8684705712851204, 'rsi_os': 39, 'rsi_ob': 58, 'vol_spike': 0.2266472526726044, 'adx_thresh': 26.88183565108378, 'atr_min_pct': 0.0166298505976029, 'atr_max_pct': 0.01613833763084359, 'tp_mult': 1.0147048609777345, 'tsl_mult': 0.5350187746276494, 'strategy': 'mean_reversion', 'time_stop': 234, 'use_sma': True, 'use_atr': True, 'use_adx': True, 'use_ema': False, 'use_spike': False, 'rsi_required': True, 'edge_k': 0.8560249393505758, 'edge_cap': 0.07152450488715865, 'bull_strategy': 'breakout', 'bull_bb_std_mult': 0.6443296329088788, 'bull_rsi_os': 13, 'bull_rsi_ob': 69, 'bull_adx_thresh': 8.906549052755194, 'bull_atr_min_pct': 0.01541163724490962, 'bull_atr_max_pct': 0.01354422828745798, 'bull_tp_mult': 2.2575905145748014, 'bull_tsl_mult': 0.6593954619897198, 'bull_time_stop': 49, 'bull_use_sma': True, 'bull_use_ema': False, 'bull_use_atr': True, 'bull_use_adx': True, 'bull_use_spike': False, 'bull_rsi_required': False, 'bear_strategy': 'mean_reversion', 'bear_bb_std_mult': 3.1233404623686214, 'bear_rsi_os': 26, 'bear_rsi_ob': 95, 'bear_adx_thresh': 31.990892977714296, 'bear_atr_min_pct': 0.00855708471166769, 'bear_atr_max_pct': 0.08188261452569445, 'bear_tp_mult': 2.852927944683598, 'bear_tsl_mult': 0.1170638031277268, 'bear_time_stop': 97, 'bear_use_sma': False, 'bear_use_ema': False, 'bear_use_atr': True, 'bear_use_adx': True, 'bear_use_spike': False, 'bear_rsi_required': False, 'sideways_strategy': 'breakout', 'sideways_bb_std_mult': 2.991485279103668, 'sideways_rsi_os': 29, 'sideways_rsi_ob': 47, 'sideways_adx_thresh': 23.237093598962165, 'sideways_atr_min_pct': 0.022201049792894445, 'sideways_atr_max_pct': 0.024472279877707375, 'sideways_tp_mult': 1.0147546592750882, 'sideways_tsl_mult': 0.17873294854939745, 'sideways_time_stop': 250, 'sideways_use_sma': False, 'sideways_use_ema': False, 'sideways_use_atr': True, 'sideways_use_adx': True, 'sideways_use_spike': True, 'sideways_rsi_required': False}.
[I 2025-09-01 08:38:08,816] Trial 478 finished with values: [-1000000000.0, 1000000000.0] and parameters: {'p_sma': 22, 'p_std': 10, 'p_atr': 9, 'p_adx': 18, 'rsi_period': 58, 'ema1': 10, 'ema2': 35, 'slip_atr_k': 0.1844250566943451, 'slip_spread_k': 0.692487797263335, 'spread_hl_frac': 0.022451791826901314, 'bb_std_mult': 2.1980817471605714, 'rsi_os': 21, 'rsi_ob': 54, 'vol_spike': 0.22835247396100783, 'adx_thresh': 16.705719569499816, 'atr_min_pct': 0.012091082491057737, 'atr_max_pct': 0.14255160353929683, 'tp_mult': 1.0447056976033056, 'tsl_mult': 0.5238426141994508, 'strategy': 'mean_reversion', 'time_stop': 259, 'use_sma': False, 'use_atr': True, 'use_adx': True, 'use_ema': True, 'use_spike': False, 'rsi_required': True, 'edge_k': 0.8746235597624039, 'edge_cap': 0.09318036002121761, 'bull_strategy': 'breakout', 'bull_bb_std_mult': 0.661140297465804, 'bull_rsi_os': 21, 'bull_rsi_ob': 91, 'bull_adx_thresh': 9.585300338340982, 'bull_atr_min_pct': 0.007672420247273988, 'bull_atr_max_pct': 0.05045411135775806, 'bull_tp_mult': 2.278888517565744, 'bull_tsl_mult': 0.6449421339302771, 'bull_time_stop': 47, 'bull_use_sma': True, 'bull_use_ema': False, 'bull_use_atr': False, 'bull_use_adx': True, 'bull_use_spike': True, 'bull_rsi_required': False, 'bear_strategy': 'breakout', 'bear_bb_std_mult': 3.2136395630448433, 'bear_rsi_os': 25, 'bear_rsi_ob': 95, 'bear_adx_thresh': 11.741328307280106, 'bear_atr_min_pct': 0.010288754102221728, 'bear_atr_max_pct': 0.0594009743722034, 'bear_tp_mult': 2.731402182582978, 'bear_tsl_mult': 0.12000971070544313, 'bear_time_stop': 99, 'bear_use_sma': False, 'bear_use_ema': False, 'bear_use_atr': True, 'bear_use_adx': True, 'bear_use_spike': True, 'bear_rsi_required': False, 'sideways_strategy': 'breakout', 'sideways_bb_std_mult': 0.5706640998531756, 'sideways_rsi_os': 42, 'sideways_rsi_ob': 67, 'sideways_adx_thresh': 7.841328422871311, 'sideways_atr_min_pct': 0.022496767615502806, 'sideways_atr_max_pct': 0.14094541032625188, 'sideways_tp_mult': 1.146249237466831, 'sideways_tsl_mult': 0.13790880689377014, 'sideways_time_stop': 211, 'sideways_use_sma': False, 'sideways_use_ema': False, 'sideways_use_atr': True, 'sideways_use_adx': True, 'sideways_use_spike': True, 'sideways_rsi_required': False}.
[I 2025-09-01 08:38:09,447] Trial 477 finished with values: [-1000000000.0, 1000000000.0] and parameters: {'p_sma': 20, 'p_std': 11, 'p_atr': 9, 'p_adx': 8, 'rsi_period': 57, 'ema1': 10, 'ema2': 58, 'slip_atr_k': 0.07593553026056538, 'slip_spread_k': 0.48344523740197526, 'spread_hl_frac': 0.02241828526450035, 'bb_std_mult': 0.9591155101289435, 'rsi_os': 19, 'rsi_ob': 58, 'vol_spike': 0.2564003333178875, 'adx_thresh': 23.954826459876625, 'atr_min_pct': 0.00608241329447805, 'atr_max_pct': 0.01588798113273983, 'tp_mult': 1.0515849663562078, 'tsl_mult': 0.5255962964926474, 'strategy': 'mean_reversion', 'time_stop': 258, 'use_sma': False, 'use_atr': True, 'use_adx': True, 'use_ema': True, 'use_spike': True, 'rsi_required': True, 'edge_k': 0.5877187884684606, 'edge_cap': 0.08856967757593992, 'bull_strategy': 'breakout', 'bull_bb_std_mult': 3.004758622721813, 'bull_rsi_os': 52, 'bull_rsi_ob': 69, 'bull_adx_thresh': 8.884690984235423, 'bull_atr_min_pct': 0.00748487422834331, 'bull_atr_max_pct': 0.01362371678022814, 'bull_tp_mult': 2.3019352832695676, 'bull_tsl_mult': 0.43105241190835597, 'bull_time_stop': 262, 'bull_use_sma': True, 'bull_use_ema': False, 'bull_use_atr': False, 'bull_use_adx': True, 'bull_use_spike': True, 'bull_rsi_required': False, 'bear_strategy': 'breakout', 'bear_bb_std_mult': 2.958395240172491, 'bear_rsi_os': 11, 'bear_rsi_ob': 95, 'bear_adx_thresh': 33.063871059856176, 'bear_atr_min_pct': 0.023317215527295283, 'bear_atr_max_pct': 0.08208991410348863, 'bear_tp_mult': 2.7242232997841165, 'bear_tsl_mult': 0.11921849642025323, 'bear_time_stop': 99, 'bear_use_sma': False, 'bear_use_ema': False, 'bear_use_atr': True, 'bear_use_adx': True, 'bear_use_spike': True, 'bear_rsi_required': False, 'sideways_strategy': 'breakout', 'sideways_bb_std_mult': 3.592362167444927, 'sideways_rsi_os': 42, 'sideways_rsi_ob': 67, 'sideways_adx_thresh': 23.01459522358255, 'sideways_atr_min_pct': 0.022477959184840936, 'sideways_atr_max_pct': 0.033706132847738275, 'sideways_tp_mult': 2.9972514898048024, 'sideways_tsl_mult': 0.1371464837138258, 'sideways_time_stop': 16, 'sideways_use_sma': False, 'sideways_use_ema': False, 'sideways_use_atr': True, 'sideways_use_adx': True, 'sideways_use_spike': True, 'sideways_rsi_required': False}.
[I 2025-09-01 08:38:11,478] Trial 480 finished with values: [-1000000000.0, 1000000000.0] and parameters: {'p_sma': 42, 'p_std': 15, 'p_atr': 28, 'p_adx': 18, 'rsi_period': 71, 'ema1': 10, 'ema2': 42, 'slip_atr_k': 0.061006974855784116, 'slip_spread_k': 0.6903069359419349, 'spread_hl_frac': 0.026325903454336705, 'bb_std_mult': 3.5048752534764755, 'rsi_os': 40, 'rsi_ob': 58, 'vol_spike': 0.25621724983905375, 'adx_thresh': 24.055763271974023, 'atr_min_pct': 0.01936981312758996, 'atr_max_pct': 0.09626520786707997, 'tp_mult': 1.0472543792077835, 'tsl_mult': 0.5327264119189898, 'strategy': 'mean_reversion', 'time_stop': 251, 'use_sma': True, 'use_atr': True, 'use_adx': True, 'use_ema': False, 'use_spike': False, 'rsi_required': True, 'edge_k': 1.1997098299955842, 'edge_cap': 0.49713443929187673, 'bull_strategy': 'breakout', 'bull_bb_std_mult': 2.949522382623789, 'bull_rsi_os': 13, 'bull_rsi_ob': 69, 'bull_adx_thresh': 8.764503899227433, 'bull_atr_min_pct': 0.027050060299101328, 'bull_atr_max_pct': 0.03930909875550004, 'bull_tp_mult': 2.2814278452201697, 'bull_tsl_mult': 0.04377273900487294, 'bull_time_stop': 145, 'bull_use_sma': True, 'bull_use_ema': False, 'bull_use_atr': True, 'bull_use_adx': True, 'bull_use_spike': False, 'bull_rsi_required': False, 'bear_strategy': 'mean_reversion', 'bear_bb_std_mult': 2.810699546694949, 'bear_rsi_os': 25, 'bear_rsi_ob': 51, 'bear_adx_thresh': 24.611523926104606, 'bear_atr_min_pct': 0.02254181490061409, 'bear_atr_max_pct': 0.08200787668056636, 'bear_tp_mult': 2.7283249416585047, 'bear_tsl_mult': 0.8247762578223183, 'bear_time_stop': 96, 'bear_use_sma': True, 'bear_use_ema': False, 'bear_use_atr': True, 'bear_use_adx': True, 'bear_use_spike': False, 'bear_rsi_required': False, 'sideways_strategy': 'breakout', 'sideways_bb_std_mult': 3.3420024898077205, 'sideways_rsi_os': 29, 'sideways_rsi_ob': 79, 'sideways_adx_thresh': 7.694032009753151, 'sideways_atr_min_pct': 0.022044659385622466, 'sideways_atr_max_pct': 0.07304925068012529, 'sideways_tp_mult': 2.5495990590659408, 'sideways_tsl_mult': 0.17279026600846262, 'sideways_time_stop': 24, 'sideways_use_sma': False, 'sideways_use_ema': False, 'sideways_use_atr': True, 'sideways_use_adx': True, 'sideways_use_spike': True, 'sideways_rsi_required': True}.
[I 2025-09-01 08:38:11,670] Trial 481 finished with values: [-1000000000.0, 1000000000.0] and parameters: {'p_sma': 39, 'p_std': 23, 'p_atr': 12, 'p_adx': 20, 'rsi_period': 71, 'ema1': 28, 'ema2': 15, 'slip_atr_k': 0.18041289301180288, 'slip_spread_k': 0.3293738382013104, 'spread_hl_frac': 0.02703600631318966, 'bb_std_mult': 0.9843336844083148, 'rsi_os': 21, 'rsi_ob': 55, 'vol_spike': 0.2584091256723938, 'adx_thresh': 6.08896003873388, 'atr_min_pct': 0.022950877396452792, 'atr_max_pct': 0.14751543017615346, 'tp_mult': 1.216366433654641, 'tsl_mult': 0.46873009357019246, 'strategy': 'mean_reversion', 'time_stop': 171, 'use_sma': True, 'use_atr': True, 'use_adx': True, 'use_ema': True, 'use_spike': True, 'rsi_required': True, 'edge_k': 0.9757613758643318, 'edge_cap': 0.050171542158571, 'bull_strategy': 'breakout', 'bull_bb_std_mult': 2.9937227781198503, 'bull_rsi_os': 14, 'bull_rsi_ob': 55, 'bull_adx_thresh': 8.67917875855075, 'bull_atr_min_pct': 0.02968499366965619, 'bull_atr_max_pct': 0.03452549253883801, 'bull_tp_mult': 2.290061278394254, 'bull_tsl_mult': 0.7401501833479682, 'bull_time_stop': 26, 'bull_use_sma': True, 'bull_use_ema': False, 'bull_use_atr': False, 'bull_use_adx': True, 'bull_use_spike': True, 'bull_rsi_required': False, 'bear_strategy': 'breakout', 'bear_bb_std_mult': 3.4896504948648457, 'bear_rsi_os': 25, 'bear_rsi_ob': 92, 'bear_adx_thresh': 19.592456149934517, 'bear_atr_min_pct': 0.022535847640106316, 'bear_atr_max_pct': 0.09864556642329175, 'bear_tp_mult': 2.9963927443318705, 'bear_tsl_mult': 0.10442668723094962, 'bear_time_stop': 199, 'bear_use_sma': True, 'bear_use_ema': False, 'bear_use_atr': True, 'bear_use_adx': True, 'bear_use_spike': True, 'bear_rsi_required': False, 'sideways_strategy': 'breakout', 'sideways_bb_std_mult': 0.5651766422247654, 'sideways_rsi_os': 16, 'sideways_rsi_ob': 66, 'sideways_adx_thresh': 7.789072395749805, 'sideways_atr_min_pct': 0.023916585047861354, 'sideways_atr_max_pct': 0.1259374571460464, 'sideways_tp_mult': 2.5225474708307725, 'sideways_tsl_mult': 0.5992466529593365, 'sideways_time_stop': 24, 'sideways_use_sma': False, 'sideways_use_ema': False, 'sideways_use_atr': True, 'sideways_use_adx': True, 'sideways_use_spike': True, 'sideways_rsi_required': True}.
[I 2025-09-01 08:38:12,345] Trial 482 finished with values: [-1000000000.0, 1000000000.0] and parameters: {'p_sma': 19, 'p_std': 18, 'p_atr': 12, 'p_adx': 20, 'rsi_period': 71, 'ema1': 19, 'ema2': 13, 'slip_atr_k': 0.16027645327682297, 'slip_spread_k': 0.4442509278204258, 'spread_hl_frac': 0.026417168745101156, 'bb_std_mult': 1.1859441253931504, 'rsi_os': 50, 'rsi_ob': 56, 'vol_spike': 0.255655951746661, 'adx_thresh': 32.16378377243492, 'atr_min_pct': 0.0231667271464925, 'atr_max_pct': 0.11678870391495441, 'tp_mult': 2.047067702806999, 'tsl_mult': 0.5811106323003088, 'strategy': 'mean_reversion', 'time_stop': 167, 'use_sma': True, 'use_atr': True, 'use_adx': True, 'use_ema': True, 'use_spike': True, 'rsi_required': True, 'edge_k': 0.6028105438587299, 'edge_cap': 0.49387247254680877, 'bull_strategy': 'breakout', 'bull_bb_std_mult': 3.003872760135698, 'bull_rsi_os': 14, 'bull_rsi_ob': 55, 'bull_adx_thresh': 8.614248219319542, 'bull_atr_min_pct': 0.027199391272389163, 'bull_atr_max_pct': 0.03854352857982354, 'bull_tp_mult': 2.2969660193755077, 'bull_tsl_mult': 0.6249695294401563, 'bull_time_stop': 143, 'bull_use_sma': True, 'bull_use_ema': False, 'bull_use_atr': True, 'bull_use_adx': True, 'bull_use_spike': False, 'bull_rsi_required': False, 'bear_strategy': 'mean_reversion', 'bear_bb_std_mult': 2.9493510742597753, 'bear_rsi_os': 41, 'bear_rsi_ob': 94, 'bear_adx_thresh': 31.231612151983256, 'bear_atr_min_pct': 0.021913320858950213, 'bear_atr_max_pct': 0.0814231600722577, 'bear_tp_mult': 1.6767896657866552, 'bear_tsl_mult': 0.604915765516986, 'bear_time_stop': 107, 'bear_use_sma': True, 'bear_use_ema': False, 'bear_use_atr': True, 'bear_use_adx': False, 'bear_use_spike': False, 'bear_rsi_required': False, 'sideways_strategy': 'mean_reversion', 'sideways_bb_std_mult': 0.6506727060670958, 'sideways_rsi_os': 16, 'sideways_rsi_ob': 92, 'sideways_adx_thresh': 8.769602566804567, 'sideways_atr_min_pct': 0.023977069857626414, 'sideways_atr_max_pct': 0.12840941994107552, 'sideways_tp_mult': 2.5376530465195795, 'sideways_tsl_mult': 0.6492951484915754, 'sideways_time_stop': 24, 'sideways_use_sma': False, 'sideways_use_ema': False, 'sideways_use_atr': False, 'sideways_use_adx': True, 'sideways_use_spike': True, 'sideways_rsi_required': True}.
[I 2025-09-01 08:38:57,160] Trial 484 finished with values: [-0.038073401222392556, 0.03875036192649917] and parameters: {'p_sma': 48, 'p_std': 42, 'p_atr': 12, 'p_adx': 20, 'rsi_period': 69, 'ema1': 6, 'ema2': 15, 'slip_atr_k': 0.1602459100950464, 'slip_spread_k': 0.585415870777369, 'spread_hl_frac': 0.02393932316006504, 'bb_std_mult': 3.340094061331774, 'rsi_os': 27, 'rsi_ob': 60, 'vol_spike': 0.21972408238822294, 'adx_thresh': 25.01117748032326, 'atr_min_pct': 0.020113731751975315, 'atr_max_pct': 0.14659683617651748, 'tp_mult': 2.06082494141142, 'tsl_mult': 0.4654973284278895, 'strategy': 'mean_reversion', 'time_stop': 238, 'use_sma': True, 'use_atr': True, 'use_adx': True, 'use_ema': True, 'use_spike': True, 'rsi_required': True, 'edge_k': 0.977758135689024, 'edge_cap': 0.133647265316794, 'bull_strategy': 'breakout', 'bull_bb_std_mult': 2.8609200544852866, 'bull_rsi_os': 12, 'bull_rsi_ob': 85, 'bull_adx_thresh': 29.300448656251262, 'bull_atr_min_pct': 0.002686441431582816, 'bull_atr_max_pct': 0.01948037189058094, 'bull_tp_mult': 2.3223650544516548, 'bull_tsl_mult': 0.5894875039317459, 'bull_time_stop': 158, 'bull_use_sma': True, 'bull_use_ema': False, 'bull_use_atr': False, 'bull_use_adx': True, 'bull_use_spike': True, 'bull_rsi_required': False, 'bear_strategy': 'mean_reversion', 'bear_bb_std_mult': 3.1357323679224662, 'bear_rsi_os': 16, 'bear_rsi_ob': 92, 'bear_adx_thresh': 31.274837692905294, 'bear_atr_min_pct': 0.024207977753454055, 'bear_atr_max_pct': 0.06521061155121152, 'bear_tp_mult': 1.4796114622639065, 'bear_tsl_mult': 0.45358863632528157, 'bear_time_stop': 88, 'bear_use_sma': True, 'bear_use_ema': False, 'bear_use_atr': True, 'bear_use_adx': False, 'bear_use_spike': True, 'bear_rsi_required': False, 'sideways_strategy': 'mean_reversion', 'sideways_bb_std_mult': 3.441940438232016, 'sideways_rsi_os': 25, 'sideways_rsi_ob': 65, 'sideways_adx_thresh': 8.636774680954991, 'sideways_atr_min_pct': 0.018494332032009404, 'sideways_atr_max_pct': 0.03173874347342969, 'sideways_tp_mult': 2.633187114107978, 'sideways_tsl_mult': 0.5962150800250676, 'sideways_time_stop': 9, 'sideways_use_sma': False, 'sideways_use_ema': False, 'sideways_use_atr': False, 'sideways_use_adx': True, 'sideways_use_spike': True, 'sideways_rsi_required': True}.
[I 2025-09-01 08:38:57,882] Trial 483 finished with values: [-1000000000.0, 1000000000.0] and parameters: {'p_sma': 55, 'p_std': 46, 'p_atr': 14, 'p_adx': 20, 'rsi_period': 74, 'ema1': 19, 'ema2': 53, 'slip_atr_k': 0.05564577671833197, 'slip_spread_k': 0.8569333070266167, 'spread_hl_frac': 0.026584761110889643, 'bb_std_mult': 3.3496356005504517, 'rsi_os': 27, 'rsi_ob': 60, 'vol_spike': 0.2199698469510273, 'adx_thresh': 28.37484469110476, 'atr_min_pct': 0.018800377860327924, 'atr_max_pct': 0.14827295050156894, 'tp_mult': 1.1996621338296296, 'tsl_mult': 0.4662533756033538, 'strategy': 'mean_reversion', 'time_stop': 238, 'use_sma': True, 'use_atr': True, 'use_adx': True, 'use_ema': False, 'use_spike': True, 'rsi_required': True, 'edge_k': 1.0515646822468527, 'edge_cap': 0.41908316956887015, 'bull_strategy': 'breakout', 'bull_bb_std_mult': 2.8647431032173496, 'bull_rsi_os': 14, 'bull_rsi_ob': 60, 'bull_adx_thresh': 7.334007154542979, 'bull_atr_min_pct': 0.003913728008612056, 'bull_atr_max_pct': 0.03414560942286605, 'bull_tp_mult': 2.2685101902941778, 'bull_tsl_mult': 0.3387952971324548, 'bull_time_stop': 142, 'bull_use_sma': True, 'bull_use_ema': False, 'bull_use_atr': True, 'bull_use_adx': True, 'bull_use_spike': False, 'bull_rsi_required': False, 'bear_strategy': 'mean_reversion', 'bear_bb_std_mult': 3.459220029450562, 'bear_rsi_os': 24, 'bear_rsi_ob': 94, 'bear_adx_thresh': 29.348573260722596, 'bear_atr_min_pct': 0.0224663698599089, 'bear_atr_max_pct': 0.04200313949426027, 'bear_tp_mult': 2.972139093881056, 'bear_tsl_mult': 0.05865788077104775, 'bear_time_stop': 86, 'bear_use_sma': True, 'bear_use_ema': False, 'bear_use_atr': True, 'bear_use_adx': False, 'bear_use_spike': False, 'bear_rsi_required': False, 'sideways_strategy': 'mean_reversion', 'sideways_bb_std_mult': 3.463593376031895, 'sideways_rsi_os': 16, 'sideways_rsi_ob': 64, 'sideways_adx_thresh': 8.611023032236366, 'sideways_atr_min_pct': 0.02393350809131102, 'sideways_atr_max_pct': 0.03125782610537281, 'sideways_tp_mult': 2.1230764663317667, 'sideways_tsl_mult': 0.20246478695655967, 'sideways_time_stop': 24, 'sideways_use_sma': False, 'sideways_use_ema': False, 'sideways_use_atr': False, 'sideways_use_adx': True, 'sideways_use_spike': True, 'sideways_rsi_required': True}.
[I 2025-09-01 08:38:57,904] Trial 485 finished with values: [-1000000000.0, 1000000000.0] and parameters: {'p_sma': 58, 'p_std': 18, 'p_atr': 15, 'p_adx': 27, 'rsi_period': 54, 'ema1': 29, 'ema2': 53, 'slip_atr_k': 0.05640020368232841, 'slip_spread_k': 0.2811566158231953, 'spread_hl_frac': 0.02386320899691491, 'bb_std_mult': 3.245598308310706, 'rsi_os': 27, 'rsi_ob': 56, 'vol_spike': 0.2449216754398117, 'adx_thresh': 32.28430112502677, 'atr_min_pct': 0.019840036221034724, 'atr_max_pct': 0.14755340500496147, 'tp_mult': 1.663727194198467, 'tsl_mult': 0.5018434045060444, 'strategy': 'mean_reversion', 'time_stop': 85, 'use_sma': True, 'use_atr': True, 'use_adx': True, 'use_ema': True, 'use_spike': True, 'rsi_required': True, 'edge_k': 1.0296778549179069, 'edge_cap': 0.10802423817489257, 'bull_strategy': 'breakout', 'bull_bb_std_mult': 2.854399869880478, 'bull_rsi_os': 54, 'bull_rsi_ob': 62, 'bull_adx_thresh': 7.185267431948057, 'bull_atr_min_pct': 0.006178349812669048, 'bull_atr_max_pct': 0.04696656806930972, 'bull_tp_mult': 2.3198091027452303, 'bull_tsl_mult': 0.4648363899329193, 'bull_time_stop': 83, 'bull_use_sma': False, 'bull_use_ema': False, 'bull_use_atr': False, 'bull_use_adx': True, 'bull_use_spike': True, 'bull_rsi_required': False, 'bear_strategy': 'mean_reversion', 'bear_bb_std_mult': 3.1593934009653784, 'bear_rsi_os': 16, 'bear_rsi_ob': 94, 'bear_adx_thresh': 25.82010421253464, 'bear_atr_min_pct': 0.013851394055262964, 'bear_atr_max_pct': 0.06550630505257363, 'bear_tp_mult': 2.943357770438195, 'bear_tsl_mult': 0.5154599019202821, 'bear_time_stop': 86, 'bear_use_sma': False, 'bear_use_ema': False, 'bear_use_atr': True, 'bear_use_adx': False, 'bear_use_spike': True, 'bear_rsi_required': True, 'sideways_strategy': 'mean_reversion', 'sideways_bb_std_mult': 2.5710952094552586, 'sideways_rsi_os': 41, 'sideways_rsi_ob': 64, 'sideways_adx_thresh': 25.190528562248126, 'sideways_atr_min_pct': 0.02127356491763868, 'sideways_atr_max_pct': 0.03186635442297854, 'sideways_tp_mult': 2.131666918767153, 'sideways_tsl_mult': 0.6468176544053857, 'sideways_time_stop': 137, 'sideways_use_sma': False, 'sideways_use_ema': False, 'sideways_use_atr': False, 'sideways_use_adx': True, 'sideways_use_spike': True, 'sideways_rsi_required': False}.
