[I 2025-09-01 07:52:06,496] Trial 200 finished with values: [-0.09390868498056937, 0.09369307794880177] and parameters: {'p_sma': 20, 'p_std': 10, 'p_atr': 13, 'p_adx': 21, 'rsi_period': 43, 'ema1': 11, 'ema2': 26, 'slip_atr_k': 0.22565946777187168, 'slip_spread_k': 0.18911189534972772, 'spread_hl_frac': 0.028774400772227975, 'bb_std_mult': 3.2937579681663687, 'rsi_os': 23, 'rsi_ob': 56, 'vol_spike': 0.2464454064518311, 'adx_thresh': 15.371746501374359, 'atr_min_pct': 0.023770402106169736, 'atr_max_pct': 0.14976977030669067, 'tp_mult': 1.4077276156975196, 'tsl_mult': 0.4654225213737232, 'strategy': 'breakout', 'time_stop': 247, 'use_sma': False, 'use_atr': True, 'use_adx': True, 'use_ema': True, 'use_spike': True, 'rsi_required': True, 'edge_k': 0.9829065017477191, 'edge_cap': 0.32463349545648346, 'bull_strategy': 'mean_reversion', 'bull_bb_std_mult': 0.6116872807719607, 'bull_rsi_os': 39, 'bull_rsi_ob': 66, 'bull_adx_thresh': 26.579573323343634, 'bull_atr_min_pct': 0.0028224910287678023, 'bull_atr_max_pct': 0.11116677938635774, 'bull_tp_mult': 2.235423476538985, 'bull_tsl_mult': 0.7259928200669745, 'bull_time_stop': 300, 'bull_use_sma': False, 'bull_use_ema': False, 'bull_use_atr': False, 'bull_use_adx': True, 'bull_use_spike': True, 'bull_rsi_required': True, 'bear_strategy': 'mean_reversion', 'bear_bb_std_mult': 0.5064107310036117, 'bear_rsi_os': 55, 'bear_rsi_ob': 93, 'bear_adx_thresh': 29.586937304600216, 'bear_atr_min_pct': 0.02276108072474024, 'bear_atr_max_pct': 0.027126589972236388, 'bear_tp_mult': 2.320437053997032, 'bear_tsl_mult': 0.08423441655496168, 'bear_time_stop': 93, 'bear_use_sma': False, 'bear_use_ema': False, 'bear_use_atr': True, 'bear_use_adx': True, 'bear_use_spike': False, 'bear_rsi_required': False, 'sideways_strategy': 'mean_reversion', 'sideways_bb_std_mult': 0.6408013275184353, 'sideways_rsi_os': 40, 'sideways_rsi_ob': 63, 'sideways_adx_thresh': 19.447669971415458, 'sideways_atr_min_pct': 0.02723526190139646, 'sideways_atr_max_pct': 0.029840039818380727, 'sideways_tp_mult': 2.603313699964226, 'sideways_tsl_mult': 0.14926269655862678, 'sideways_time_stop': 17, 'sideways_use_sma': False, 'sideways_use_ema': False, 'sideways_use_atr': False, 'sideways_use_adx': True, 'sideways_use_spike': True, 'sideways_rsi_required': False}.
[I 2025-09-01 07:52:07,372] Trial 199 finished with values: [-1000000000.0, 1000000000.0] and parameters: {'p_sma': 21, 'p_std': 57, 'p_atr': 13, 'p_adx': 21, 'rsi_period': 67, 'ema1': 12, 'ema2': 17, 'slip_atr_k': 0.2257672379016208, 'slip_spread_k': 0.3774339304460393, 'spread_hl_frac': 0.0069908324627682705, 'bb_std_mult': 3.292675563333927, 'rsi_os': 23, 'rsi_ob': 56, 'vol_spike': 0.2471225737933367, 'adx_thresh': 8.92032876917677, 'atr_min_pct': 0.020887518609985632, 'atr_max_pct': 0.1498435560734437, 'tp_mult': 2.355799595004681, 'tsl_mult': 0.4683961796983338, 'strategy': 'mean_reversion', 'time_stop': 28, 'use_sma': True, 'use_atr': False, 'use_adx': True, 'use_ema': False, 'use_spike': False, 'rsi_required': False, 'edge_k': 0.9054827685255934, 'edge_cap': 0.7480181762471567, 'bull_strategy': 'breakout', 'bull_bb_std_mult': 0.9227943621332575, 'bull_rsi_os': 32, 'bull_rsi_ob': 61, 'bull_adx_thresh': 33.61159269830354, 'bull_atr_min_pct': 0.002015662607883118, 'bull_atr_max_pct': 0.04443948853542194, 'bull_tp_mult': 1.2945085681479913, 'bull_tsl_mult': 0.7323696129348365, 'bull_time_stop': 37, 'bull_use_sma': True, 'bull_use_ema': True, 'bull_use_atr': True, 'bull_use_adx': False, 'bull_use_spike': False, 'bull_rsi_required': False, 'bear_strategy': 'breakout', 'bear_bb_std_mult': 0.9326584184943891, 'bear_rsi_os': 52, 'bear_rsi_ob': 93, 'bear_adx_thresh': 29.4640928429754, 'bear_atr_min_pct': 0.028701923507498943, 'bear_atr_max_pct': 0.08143510104068197, 'bear_tp_mult': 1.8431924281658063, 'bear_tsl_mult': 0.07893396849448812, 'bear_time_stop': 91, 'bear_use_sma': False, 'bear_use_ema': False, 'bear_use_atr': False, 'bear_use_adx': False, 'bear_use_spike': False, 'bear_rsi_required': True, 'sideways_strategy': 'mean_reversion', 'sideways_bb_std_mult': 0.6521652223687313, 'sideways_rsi_os': 40, 'sideways_rsi_ob': 52, 'sideways_adx_thresh': 33.02006040838323, 'sideways_atr_min_pct': 0.022653462628984565, 'sideways_atr_max_pct': 0.03421978314280033, 'sideways_tp_mult': 2.5838673683274003, 'sideways_tsl_mult': 0.919024410616109, 'sideways_time_stop': 31, 'sideways_use_sma': True, 'sideways_use_ema': False, 'sideways_use_atr': False, 'sideways_use_adx': True, 'sideways_use_spike': True, 'sideways_rsi_required': False}.
[I 2025-09-01 07:52:07,389] Trial 197 finished with values: [-0.038242162443657635, 0.038012492240310364] and parameters: {'p_sma': 16, 'p_std': 17, 'p_atr': 11, 'p_adx': 21, 'rsi_period': 63, 'ema1': 22, 'ema2': 11, 'slip_atr_k': 0.061536714857474195, 'slip_spread_k': 0.22119148849626008, 'spread_hl_frac': 0.015470636225248958, 'bb_std_mult': 3.399698305421173, 'rsi_os': 23, 'rsi_ob': 89, 'vol_spike': 0.23793924296226154, 'adx_thresh': 25.64446231386623, 'atr_min_pct': 0.017489438020308903, 'atr_max_pct': 0.046636626564348395, 'tp_mult': 1.14334459981399, 'tsl_mult': 0.4714346146166823, 'strategy': 'mean_reversion', 'time_stop': 246, 'use_sma': True, 'use_atr': False, 'use_adx': True, 'use_ema': False, 'use_spike': False, 'rsi_required': False, 'edge_k': 0.9066187026970787, 'edge_cap': 0.7522773869982432, 'bull_strategy': 'breakout', 'bull_bb_std_mult': 1.82642183853856, 'bull_rsi_os': 6, 'bull_rsi_ob': 68, 'bull_adx_thresh': 30.022029342668212, 'bull_atr_min_pct': 0.0019222083964980314, 'bull_atr_max_pct': 0.1182175454491688, 'bull_tp_mult': 1.3016190412342197, 'bull_tsl_mult': 0.6750414762931257, 'bull_time_stop': 282, 'bull_use_sma': True, 'bull_use_ema': True, 'bull_use_atr': True, 'bull_use_adx': False, 'bull_use_spike': False, 'bull_rsi_required': False, 'bear_strategy': 'breakout', 'bear_bb_std_mult': 2.0411510903527215, 'bear_rsi_os': 52, 'bear_rsi_ob': 67, 'bear_adx_thresh': 31.082813835273797, 'bear_atr_min_pct': 0.02792522239907411, 'bear_atr_max_pct': 0.027616559919606744, 'bear_tp_mult': 2.9382050502810846, 'bear_tsl_mult': 0.07298172054348911, 'bear_time_stop': 86, 'bear_use_sma': False, 'bear_use_ema': False, 'bear_use_atr': False, 'bear_use_adx': False, 'bear_use_spike': False, 'bear_rsi_required': True, 'sideways_strategy': 'mean_reversion', 'sideways_bb_std_mult': 0.5392618804520399, 'sideways_rsi_os': 38, 'sideways_rsi_ob': 65, 'sideways_adx_thresh': 19.75883095179803, 'sideways_atr_min_pct': 0.0035425392876163066, 'sideways_atr_max_pct': 0.0663196388357366, 'sideways_tp_mult': 1.349848960647876, 'sideways_tsl_mult': 0.15837402755004365, 'sideways_time_stop': 28, 'sideways_use_sma': True, 'sideways_use_ema': False, 'sideways_use_atr': False, 'sideways_use_adx': True, 'sideways_use_spike': True, 'sideways_rsi_required': False}.
[I 2025-09-01 07:52:08,057] Trial 202 finished with values: [-1000000000.0, 1000000000.0] and parameters: {'p_sma': 54, 'p_std': 15, 'p_atr': 12, 'p_adx': 24, 'rsi_period': 35, 'ema1': 12, 'ema2': 45, 'slip_atr_k': 0.13712602937607815, 'slip_spread_k': 0.6999714050625134, 'spread_hl_frac': 0.02343110351792094, 'bb_std_mult': 0.5086731734620933, 'rsi_os': 51, 'rsi_ob': 89, 'vol_spike': 0.0977674330195311, 'adx_thresh': 25.611859558385014, 'atr_min_pct': 0.00509962771328271, 'atr_max_pct': 0.14987094189542516, 'tp_mult': 1.158778430485498, 'tsl_mult': 0.6254521548276901, 'strategy': 'mean_reversion', 'time_stop': 133, 'use_sma': True, 'use_atr': False, 'use_adx': False, 'use_ema': True, 'use_spike': False, 'rsi_required': True, 'edge_k': 1.0524383576759115, 'edge_cap': 0.40898049448205137, 'bull_strategy': 'breakout', 'bull_bb_std_mult': 2.8960768550369647, 'bull_rsi_os': 8, 'bull_rsi_ob': 69, 'bull_adx_thresh': 9.933430990001096, 'bull_atr_min_pct': 0.003740152002739975, 'bull_atr_max_pct': 0.04521654475341812, 'bull_tp_mult': 2.376157658547636, 'bull_tsl_mult': 0.7087137296438349, 'bull_time_stop': 162, 'bull_use_sma': True, 'bull_use_ema': True, 'bull_use_atr': False, 'bull_use_adx': False, 'bull_use_spike': True, 'bull_rsi_required': False, 'bear_strategy': 'breakout', 'bear_bb_std_mult': 0.9320323236915444, 'bear_rsi_os': 30, 'bear_rsi_ob': 95, 'bear_adx_thresh': 31.403876493989074, 'bear_atr_min_pct': 0.028474839183782415, 'bear_atr_max_pct': 0.10425476245056406, 'bear_tp_mult': 2.3863109853471562, 'bear_tsl_mult': 0.04988314269093614, 'bear_time_stop': 79, 'bear_use_sma': False, 'bear_use_ema': False, 'bear_use_atr': False, 'bear_use_adx': False, 'bear_use_spike': True, 'bear_rsi_required': True, 'sideways_strategy': 'breakout', 'sideways_bb_std_mult': 0.7250620582105154, 'sideways_rsi_os': 5, 'sideways_rsi_ob': 67, 'sideways_adx_thresh': 32.79970434792817, 'sideways_atr_min_pct': 0.022654365299188652, 'sideways_atr_max_pct': 0.0672804924077112, 'sideways_tp_mult': 1.7144899989676923, 'sideways_tsl_mult': 0.13631276917439414, 'sideways_time_stop': 23, 'sideways_use_sma': True, 'sideways_use_ema': False, 'sideways_use_atr': True, 'sideways_use_adx': True, 'sideways_use_spike': True, 'sideways_rsi_required': False}.
[I 2025-09-01 07:52:45,283] Trial 203 finished with values: [-1000000000.0, 1000000000.0] and parameters: {'p_sma': 42, 'p_std': 15, 'p_atr': 12, 'p_adx': 14, 'rsi_period': 25, 'ema1': 10, 'ema2': 14, 'slip_atr_k': 0.1456595165748396, 'slip_spread_k': 0.6529859791325062, 'spread_hl_frac': 0.023945903972092352, 'bb_std_mult': 3.545936324826935, 'rsi_os': 14, 'rsi_ob': 54, 'vol_spike': 0.04025853816440224, 'adx_thresh': 25.53639017140996, 'atr_min_pct': 0.008068251197567513, 'atr_max_pct': 0.14495810734669087, 'tp_mult': 1.1504923658855197, 'tsl_mult': 0.7605314598244616, 'strategy': 'mean_reversion', 'time_stop': 259, 'use_sma': True, 'use_atr': True, 'use_adx': False, 'use_ema': True, 'use_spike': True, 'rsi_required': True, 'edge_k': 1.3258266226112816, 'edge_cap': 0.05057836626586932, 'bull_strategy': 'breakout', 'bull_bb_std_mult': 2.237545839559634, 'bull_rsi_os': 8, 'bull_rsi_ob': 69, 'bull_adx_thresh': 8.862151777199097, 'bull_atr_min_pct': 0.02738395035203212, 'bull_atr_max_pct': 0.04788166695081026, 'bull_tp_mult': 2.4648148399455674, 'bull_tsl_mult': 0.961892534319189, 'bull_time_stop': 223, 'bull_use_sma': True, 'bull_use_ema': False, 'bull_use_atr': False, 'bull_use_adx': True, 'bull_use_spike': True, 'bull_rsi_required': False, 'bear_strategy': 'mean_reversion', 'bear_bb_std_mult': 2.0559974521202875, 'bear_rsi_os': 30, 'bear_rsi_ob': 79, 'bear_adx_thresh': 23.385466451750112, 'bear_atr_min_pct': 0.02223431199682236, 'bear_atr_max_pct': 0.10289780761533619, 'bear_tp_mult': 2.9522244973869234, 'bear_tsl_mult': 0.055790420882574604, 'bear_time_stop': 79, 'bear_use_sma': False, 'bear_use_ema': False, 'bear_use_atr': True, 'bear_use_adx': True, 'bear_use_spike': True, 'bear_rsi_required': False, 'sideways_strategy': 'breakout', 'sideways_bb_std_mult': 0.7181247378610911, 'sideways_rsi_os': 5, 'sideways_rsi_ob': 93, 'sideways_adx_thresh': 10.949864465196997, 'sideways_atr_min_pct': 0.015382097206185658, 'sideways_atr_max_pct': 0.07305015678378805, 'sideways_tp_mult': 1.0148251696199853, 'sideways_tsl_mult': 0.17242167483406157, 'sideways_time_stop': 23, 'sideways_use_sma': False, 'sideways_use_ema': False, 'sideways_use_atr': True, 'sideways_use_adx': True, 'sideways_use_spike': True, 'sideways_rsi_required': False}.
[I 2025-09-01 07:52:46,304] Trial 204 finished with values: [-0.24137325488044148, 0.24131461253949443] and parameters: {'p_sma': 46, 'p_std': 15, 'p_atr': 12, 'p_adx': 20, 'rsi_period': 63, 'ema1': 18, 'ema2': 59, 'slip_atr_k': 0.04968859949880854, 'slip_spread_k': 0.4759456650622667, 'spread_hl_frac': 0.023432718578699146, 'bb_std_mult': 3.509164400129707, 'rsi_os': 14, 'rsi_ob': 55, 'vol_spike': 0.2558313774639271, 'adx_thresh': 25.40332818758717, 'atr_min_pct': 0.004778341404903137, 'atr_max_pct': 0.10593840877089414, 'tp_mult': 1.1504084117174291, 'tsl_mult': 0.4181100432342969, 'strategy': 'mean_reversion', 'time_stop': 243, 'use_sma': True, 'use_atr': True, 'use_adx': False, 'use_ema': True, 'use_spike': True, 'rsi_required': True, 'edge_k': 1.0504629663138756, 'edge_cap': 0.6330163128887601, 'bull_strategy': 'breakout', 'bull_bb_std_mult': 2.250567699664844, 'bull_rsi_os': 6, 'bull_rsi_ob': 69, 'bull_adx_thresh': 8.89129244103272, 'bull_atr_min_pct': 0.0036080377048925086, 'bull_atr_max_pct': 0.06733196222608434, 'bull_tp_mult': 1.8393306907356548, 'bull_tsl_mult': 0.6397632692675337, 'bull_time_stop': 282, 'bull_use_sma': True, 'bull_use_ema': False, 'bull_use_atr': False, 'bull_use_adx': True, 'bull_use_spike': True, 'bull_rsi_required': False, 'bear_strategy': 'mean_reversion', 'bear_bb_std_mult': 2.0637217254325138, 'bear_rsi_os': 45, 'bear_rsi_ob': 80, 'bear_adx_thresh': 31.124636240180482, 'bear_atr_min_pct': 0.027258056464457996, 'bear_atr_max_pct': 0.08340708139653394, 'bear_tp_mult': 2.963506756852258, 'bear_tsl_mult': 0.056908811599112, 'bear_time_stop': 77, 'bear_use_sma': False, 'bear_use_ema': False, 'bear_use_atr': True, 'bear_use_adx': True, 'bear_use_spike': True, 'bear_rsi_required': False, 'sideways_strategy': 'breakout', 'sideways_bb_std_mult': 3.2018366987745503, 'sideways_rsi_os': 39, 'sideways_rsi_ob': 66, 'sideways_adx_thresh': 24.066380314123744, 'sideways_atr_min_pct': 6.597747775338725e-06, 'sideways_atr_max_pct': 0.032618367281184855, 'sideways_tp_mult': 1.2825487921254735, 'sideways_tsl_mult': 0.1336599539495189, 'sideways_time_stop': 23, 'sideways_use_sma': False, 'sideways_use_ema': False, 'sideways_use_atr': True, 'sideways_use_adx': True, 'sideways_use_spike': True, 'sideways_rsi_required': False}.
[I 2025-09-01 07:52:46,337] Trial 201 finished with values: [-0.3429034415640161, 0.34288227890918854] and parameters: {'p_sma': 20, 'p_std': 58, 'p_atr': 12, 'p_adx': 21, 'rsi_period': 37, 'ema1': 11, 'ema2': 17, 'slip_atr_k': 0.13487515877144302, 'slip_spread_k': 0.6900721987249476, 'spread_hl_frac': 0.03947475874065734, 'bb_std_mult': 3.2927395985387236, 'rsi_os': 25, 'rsi_ob': 89, 'vol_spike': 0.24984157905473375, 'adx_thresh': 25.782761256914714, 'atr_min_pct': 0.020829966957870226, 'atr_max_pct': 0.11545628363761326, 'tp_mult': 1.150857987947591, 'tsl_mult': 0.457175094001393, 'strategy': 'breakout', 'time_stop': 266, 'use_sma': False, 'use_atr': False, 'use_adx': False, 'use_ema': True, 'use_spike': False, 'rsi_required': True, 'edge_k': 0.9751882948345911, 'edge_cap': 0.05175778405815423, 'bull_strategy': 'mean_reversion', 'bull_bb_std_mult': 2.8066193756016844, 'bull_rsi_os': 11, 'bull_rsi_ob': 66, 'bull_adx_thresh': 10.142671169965277, 'bull_atr_min_pct': 0.02289504175097648, 'bull_atr_max_pct': 0.1112368296808387, 'bull_tp_mult': 2.240790411506006, 'bull_tsl_mult': 0.723447870991338, 'bull_time_stop': 37, 'bull_use_sma': False, 'bull_use_ema': True, 'bull_use_atr': False, 'bull_use_adx': False, 'bull_use_spike': True, 'bull_rsi_required': True, 'bear_strategy': 'breakout', 'bear_bb_std_mult': 3.232154820801669, 'bear_rsi_os': 53, 'bear_rsi_ob': 81, 'bear_adx_thresh': 23.327729420014993, 'bear_atr_min_pct': 0.021626050329368842, 'bear_atr_max_pct': 0.08141197063938131, 'bear_tp_mult': 1.8498628404891266, 'bear_tsl_mult': 0.0728640691877505, 'bear_time_stop': 92, 'bear_use_sma': False, 'bear_use_ema': False, 'bear_use_atr': True, 'bear_use_adx': False, 'bear_use_spike': True, 'bear_rsi_required': False, 'sideways_strategy': 'breakout', 'sideways_bb_std_mult': 0.6545456579243246, 'sideways_rsi_os': 40, 'sideways_rsi_ob': 93, 'sideways_adx_thresh': 24.23673384553634, 'sideways_atr_min_pct': 0.0001549213952207057, 'sideways_atr_max_pct': 0.07393815075579756, 'sideways_tp_mult': 1.215747545728082, 'sideways_tsl_mult': 0.8022234758211495, 'sideways_time_stop': 18, 'sideways_use_sma': True, 'sideways_use_ema': False, 'sideways_use_atr': True, 'sideways_use_adx': True, 'sideways_use_spike': True, 'sideways_rsi_required': False}.
[I 2025-09-01 07:52:46,822] Trial 205 finished with values: [-1000000000.0, 1000000000.0] and parameters: {'p_sma': 58, 'p_std': 16, 'p_atr': 12, 'p_adx': 20, 'rsi_period': 26, 'ema1': 26, 'ema2': 14, 'slip_atr_k': 0.16994101541929765, 'slip_spread_k': 0.6449321480205892, 'spread_hl_frac': 0.02448296744240459, 'bb_std_mult': 3.5218859135533003, 'rsi_os': 25, 'rsi_ob': 48, 'vol_spike': 0.2525200753319804, 'adx_thresh': 25.15226718631515, 'atr_min_pct': 0.007935484810803865, 'atr_max_pct': 0.049100850615823345, 'tp_mult': 1.2041804524958741, 'tsl_mult': 0.8141529297444016, 'strategy': 'breakout', 'time_stop': 52, 'use_sma': False, 'use_atr': True, 'use_adx': False, 'use_ema': True, 'use_spike': True, 'rsi_required': True, 'edge_k': 1.1925795803533366, 'edge_cap': 0.630248309823372, 'bull_strategy': 'mean_reversion', 'bull_bb_std_mult': 2.2606966861360216, 'bull_rsi_os': 16, 'bull_rsi_ob': 68, 'bull_adx_thresh': 8.742304896703708, 'bull_atr_min_pct': 0.023225884509591684, 'bull_atr_max_pct': 0.04094007975730739, 'bull_tp_mult': 1.481158334055833, 'bull_tsl_mult': 0.9608489244312926, 'bull_time_stop': 159, 'bull_use_sma': False, 'bull_use_ema': False, 'bull_use_atr': False, 'bull_use_adx': True, 'bull_use_spike': True, 'bull_rsi_required': True, 'bear_strategy': 'mean_reversion', 'bear_bb_std_mult': 3.1703261713072917, 'bear_rsi_os': 34, 'bear_rsi_ob': 95, 'bear_adx_thresh': 32.172058712401, 'bear_atr_min_pct': 0.021440951599064874, 'bear_atr_max_pct': 0.08325701603654166, 'bear_tp_mult': 2.949523679740349, 'bear_tsl_mult': 0.7548893307766951, 'bear_time_stop': 100, 'bear_use_sma': False, 'bear_use_ema': False, 'bear_use_atr': True, 'bear_use_adx': True, 'bear_use_spike': True, 'bear_rsi_required': False, 'sideways_strategy': 'mean_reversion', 'sideways_bb_std_mult': 1.5241997931146947, 'sideways_rsi_os': 39, 'sideways_rsi_ob': 68, 'sideways_adx_thresh': 8.152322712224613, 'sideways_atr_min_pct': 0.015398800736113607, 'sideways_atr_max_pct': 0.060909660087387206, 'sideways_tp_mult': 1.321794043610703, 'sideways_tsl_mult': 0.8076435415640686, 'sideways_time_stop': 5, 'sideways_use_sma': False, 'sideways_use_ema': False, 'sideways_use_atr': False, 'sideways_use_adx': True, 'sideways_use_spike': True, 'sideways_rsi_required': False}.
[I 2025-09-01 07:52:47,462] Trial 208 finished with values: [-1000000000.0, 1000000000.0] and parameters: {'p_sma': 18, 'p_std': 16, 'p_atr': 13, 'p_adx': 20, 'rsi_period': 9, 'ema1': 10, 'ema2': 14, 'slip_atr_k': 0.1160739267587471, 'slip_spread_k': 0.6458678343636174, 'spread_hl_frac': 0.025129767399567824, 'bb_std_mult': 3.353658490756575, 'rsi_os': 25, 'rsi_ob': 48, 'vol_spike': 0.0013285095676257574, 'adx_thresh': 24.637872955397984, 'atr_min_pct': 0.006464286721924799, 'atr_max_pct': 0.1460966582651839, 'tp_mult': 1.2082619338771972, 'tsl_mult': 0.8937844108335878, 'strategy': 'mean_reversion', 'time_stop': 54, 'use_sma': True, 'use_atr': True, 'use_adx': True, 'use_ema': True, 'use_spike': True, 'rsi_required': True, 'edge_k': 0.2815074248428071, 'edge_cap': 0.11219718840873216, 'bull_strategy': 'breakout', 'bull_bb_std_mult': 1.6668623310449941, 'bull_rsi_os': 16, 'bull_rsi_ob': 68, 'bull_adx_thresh': 7.601296104347504, 'bull_atr_min_pct': 0.010721219978073297, 'bull_atr_max_pct': 0.03367258692405547, 'bull_tp_mult': 2.0947201661459145, 'bull_tsl_mult': 0.6599481985259174, 'bull_time_stop': 150, 'bull_use_sma': True, 'bull_use_ema': False, 'bull_use_atr': False, 'bull_use_adx': True, 'bull_use_spike': True, 'bull_rsi_required': False, 'bear_strategy': 'mean_reversion', 'bear_bb_std_mult': 3.2254561765043346, 'bear_rsi_os': 27, 'bear_rsi_ob': 95, 'bear_adx_thresh': 19.404738306531417, 'bear_atr_min_pct': 0.023896210535512576, 'bear_atr_max_pct': 0.13946376774541397, 'bear_tp_mult': 2.837629680036657, 'bear_tsl_mult': 0.11236231452678977, 'bear_time_stop': 97, 'bear_use_sma': True, 'bear_use_ema': True, 'bear_use_atr': True, 'bear_use_adx': True, 'bear_use_spike': True, 'bear_rsi_required': False, 'sideways_strategy': 'mean_reversion', 'sideways_bb_std_mult': 0.5436103494992175, 'sideways_rsi_os': 37, 'sideways_rsi_ob': 68, 'sideways_adx_thresh': 8.469500487005964, 'sideways_atr_min_pct': 0.01671189157790542, 'sideways_atr_max_pct': 0.06211221211428637, 'sideways_tp_mult': 2.534284737922188, 'sideways_tsl_mult': 0.8405080419654573, 'sideways_time_stop': 205, 'sideways_use_sma': False, 'sideways_use_ema': False, 'sideways_use_atr': False, 'sideways_use_adx': False, 'sideways_use_spike': False, 'sideways_rsi_required': True}.
