[I 2025-09-01 08:22:37,454] Trial 388 finished with values: [-1000000000.0, 1000000000.0] and parameters: {'p_sma': 22, 'p_std': 13, 'p_atr': 11, 'p_adx': 20, 'rsi_period': 76, 'ema1': 9, 'ema2': 13, 'slip_atr_k': 0.08229045155146389, 'slip_spread_k': 0.8383458245811409, 'spread_hl_frac': 0.006440542533467, 'bb_std_mult': 3.315654488588904, 'rsi_os': 7, 'rsi_ob': 80, 'vol_spike': 0.14909237411315332, 'adx_thresh': 24.803746447888905, 'atr_min_pct': 0.02137191266320484, 'atr_max_pct': 0.08604197254185697, 'tp_mult': 2.4915389613273344, 'tsl_mult': 0.9314445296056046, 'strategy': 'breakout', 'time_stop': 249, 'use_sma': True, 'use_atr': True, 'use_adx': True, 'use_ema': True, 'use_spike': False, 'rsi_required': False, 'edge_k': 0.8463332592917621, 'edge_cap': 0.6641733360114889, 'bull_strategy': 'breakout', 'bull_bb_std_mult': 2.9479326632000182, 'bull_rsi_os': 24, 'bull_rsi_ob': 79, 'bull_adx_thresh': 10.474984696428672, 'bull_atr_min_pct': 0.021022279280344187, 'bull_atr_max_pct': 0.04609740677080629, 'bull_tp_mult': 2.549301662347272, 'bull_tsl_mult': 0.6565302176018448, 'bull_time_stop': 134, 'bull_use_sma': False, 'bull_use_ema': False, 'bull_use_atr': True, 'bull_use_adx': False, 'bull_use_spike': False, 'bull_rsi_required': True, 'bear_strategy': 'mean_reversion', 'bear_bb_std_mult': 2.4163630036694532, 'bear_rsi_os': 29, 'bear_rsi_ob': 95, 'bear_adx_thresh': 29.42145232370996, 'bear_atr_min_pct': 0.023397040271368054, 'bear_atr_max_pct': 0.08865362366614966, 'bear_tp_mult': 2.8820569197408976, 'bear_tsl_mult': 0.11155939710605786, 'bear_time_stop': 100, 'bear_use_sma': True, 'bear_use_ema': True, 'bear_use_atr': True, 'bear_use_adx': False, 'bear_use_spike': True, 'bear_rsi_required': False, 'sideways_strategy': 'mean_reversion', 'sideways_bb_std_mult': 2.0034026931683258, 'sideways_rsi_os': 38, 'sideways_rsi_ob': 76, 'sideways_adx_thresh': 14.966844161015253, 'sideways_atr_min_pct': 0.028405711188444597, 'sideways_atr_max_pct': 0.03852313944878586, 'sideways_tp_mult': 2.6211364563000585, 'sideways_tsl_mult': 0.18394682640002968, 'sideways_time_stop': 41, 'sideways_use_sma': False, 'sideways_use_ema': False, 'sideways_use_atr': False, 'sideways_use_adx': True, 'sideways_use_spike': True, 'sideways_rsi_required': True}.
[I 2025-09-01 08:22:37,474] Trial 386 finished with values: [-0.04728699049726093, 0.048187145979855656] and parameters: {'p_sma': 22, 'p_std': 14, 'p_atr': 11, 'p_adx': 24, 'rsi_period': 45, 'ema1': 9, 'ema2': 12, 'slip_atr_k': 0.05114558776698971, 'slip_spread_k': 0.7592555445022882, 'spread_hl_frac': 0.025750559662373163, 'bb_std_mult': 2.777840190652648, 'rsi_os': 7, 'rsi_ob': 71, 'vol_spike': 0.01462512890692047, 'adx_thresh': 24.76866967824155, 'atr_min_pct': 0.021512915878857633, 'atr_max_pct': 0.14160163919700927, 'tp_mult': 1.2006515364118666, 'tsl_mult': 0.4778748140822543, 'strategy': 'breakout', 'time_stop': 252, 'use_sma': True, 'use_atr': False, 'use_adx': False, 'use_ema': False, 'use_spike': False, 'rsi_required': False, 'edge_k': 1.3912166139664488, 'edge_cap': 0.45765634772546243, 'bull_strategy': 'breakout', 'bull_bb_std_mult': 0.9587835137569214, 'bull_rsi_os': 49, 'bull_rsi_ob': 86, 'bull_adx_thresh': 9.447927470205522, 'bull_atr_min_pct': 0.01599596189984404, 'bull_atr_max_pct': 0.04615170297478391, 'bull_tp_mult': 2.3399213113394732, 'bull_tsl_mult': 0.2535461460362088, 'bull_time_stop': 291, 'bull_use_sma': False, 'bull_use_ema': True, 'bull_use_atr': True, 'bull_use_adx': False, 'bull_use_spike': False, 'bull_rsi_required': True, 'bear_strategy': 'breakout', 'bear_bb_std_mult': 2.420297407494703, 'bear_rsi_os': 29, 'bear_rsi_ob': 95, 'bear_adx_thresh': 26.26978700492798, 'bear_atr_min_pct': 0.0017420839607973637, 'bear_atr_max_pct': 0.08852639604919407, 'bear_tp_mult': 2.8077653929266186, 'bear_tsl_mult': 0.11359752683463625, 'bear_time_stop': 101, 'bear_use_sma': True, 'bear_use_ema': False, 'bear_use_atr': False, 'bear_use_adx': False, 'bear_use_spike': True, 'bear_rsi_required': True, 'sideways_strategy': 'breakout', 'sideways_bb_std_mult': 1.7845268089311523, 'sideways_rsi_os': 7, 'sideways_rsi_ob': 67, 'sideways_adx_thresh': 5.844144290252601, 'sideways_atr_min_pct': 0.02280598414599043, 'sideways_atr_max_pct': 0.03404212212616261, 'sideways_tp_mult': 2.609615862690365, 'sideways_tsl_mult': 0.8568680900498213, 'sideways_time_stop': 33, 'sideways_use_sma': True, 'sideways_use_ema': False, 'sideways_use_atr': True, 'sideways_use_adx': False, 'sideways_use_spike': True, 'sideways_rsi_required': True}.
[I 2025-09-01 08:22:37,857] Trial 387 finished with values: [-1000000000.0, 1000000000.0] and parameters: {'p_sma': 22, 'p_std': 13, 'p_atr': 18, 'p_adx': 10, 'rsi_period': 49, 'ema1': 19, 'ema2': 13, 'slip_atr_k': 0.05064923373561267, 'slip_spread_k': 0.5652534426425228, 'spread_hl_frac': 0.025069515695344855, 'bb_std_mult': 0.9054275765976882, 'rsi_os': 43, 'rsi_ob': 53, 'vol_spike': 0.1584316694773045, 'adx_thresh': 24.83562278882406, 'atr_min_pct': 0.02148991286348095, 'atr_max_pct': 0.14741731991114673, 'tp_mult': 1.1928660110327827, 'tsl_mult': 0.4774443626060563, 'strategy': 'breakout', 'time_stop': 252, 'use_sma': True, 'use_atr': False, 'use_adx': False, 'use_ema': True, 'use_spike': False, 'rsi_required': False, 'edge_k': 1.3914151090688385, 'edge_cap': 0.12485265441125415, 'bull_strategy': 'breakout', 'bull_bb_std_mult': 2.9437020557035027, 'bull_rsi_os': 16, 'bull_rsi_ob': 66, 'bull_adx_thresh': 10.095459085189423, 'bull_atr_min_pct': 0.023778439498415252, 'bull_atr_max_pct': 0.06845422689100963, 'bull_tp_mult': 2.8963736397462303, 'bull_tsl_mult': 0.6494578682706229, 'bull_time_stop': 82, 'bull_use_sma': False, 'bull_use_ema': True, 'bull_use_atr': True, 'bull_use_adx': False, 'bull_use_spike': False, 'bull_rsi_required': True, 'bear_strategy': 'breakout', 'bear_bb_std_mult': 1.4498060803768436, 'bear_rsi_os': 39, 'bear_rsi_ob': 74, 'bear_adx_thresh': 20.24180391932522, 'bear_atr_min_pct': 0.018202823423157176, 'bear_atr_max_pct': 0.08040585811214411, 'bear_tp_mult': 2.2945483868327887, 'bear_tsl_mult': 0.11277482472975253, 'bear_time_stop': 94, 'bear_use_sma': True, 'bear_use_ema': True, 'bear_use_atr': False, 'bear_use_adx': False, 'bear_use_spike': True, 'bear_rsi_required': True, 'sideways_strategy': 'breakout', 'sideways_bb_std_mult': 1.0400445862695038, 'sideways_rsi_os': 21, 'sideways_rsi_ob': 72, 'sideways_adx_thresh': 10.422804692601602, 'sideways_atr_min_pct': 0.028475852852502214, 'sideways_atr_max_pct': 0.033526257081944746, 'sideways_tp_mult': 2.611946081912765, 'sideways_tsl_mult': 0.19218222530322276, 'sideways_time_stop': 43, 'sideways_use_sma': False, 'sideways_use_ema': False, 'sideways_use_atr': True, 'sideways_use_adx': True, 'sideways_use_spike': True, 'sideways_rsi_required': True}.
[I 2025-09-01 08:23:23,074] Trial 393 finished with values: [-1000000000.0, 1000000000.0] and parameters: {'p_sma': 26, 'p_std': 16, 'p_atr': 13, 'p_adx': 21, 'rsi_period': 9, 'ema1': 10, 'ema2': 17, 'slip_atr_k': 0.056487057063206766, 'slip_spread_k': 0.6975489443545921, 'spread_hl_frac': 0.02910245803070783, 'bb_std_mult': 3.204502812273369, 'rsi_os': 24, 'rsi_ob': 87, 'vol_spike': 0.21039504123277813, 'adx_thresh': 24.035347776109244, 'atr_min_pct': 0.00800199218961439, 'atr_max_pct': 0.14646198241566516, 'tp_mult': 1.0985632395281115, 'tsl_mult': 0.5232949362437835, 'strategy': 'mean_reversion', 'time_stop': 136, 'use_sma': False, 'use_atr': True, 'use_adx': True, 'use_ema': True, 'use_spike': True, 'rsi_required': True, 'edge_k': 0.9500609443991195, 'edge_cap': 0.7021404771961457, 'bull_strategy': 'mean_reversion', 'bull_bb_std_mult': 2.843631398270586, 'bull_rsi_os': 18, 'bull_rsi_ob': 69, 'bull_adx_thresh': 8.097168602925109, 'bull_atr_min_pct': 0.006495388882185964, 'bull_atr_max_pct': 0.03661903981412731, 'bull_tp_mult': 2.233694448550522, 'bull_tsl_mult': 0.7305929306002004, 'bull_time_stop': 42, 'bull_use_sma': True, 'bull_use_ema': False, 'bull_use_atr': False, 'bull_use_adx': True, 'bull_use_spike': True, 'bull_rsi_required': False, 'bear_strategy': 'mean_reversion', 'bear_bb_std_mult': 3.3280445929793174, 'bear_rsi_os': 16, 'bear_rsi_ob': 56, 'bear_adx_thresh': 32.47572479887627, 'bear_atr_min_pct': 0.02245910610314573, 'bear_atr_max_pct': 0.08496872970529018, 'bear_tp_mult': 2.3801565467275188, 'bear_tsl_mult': 0.9415332344839973, 'bear_time_stop': 77, 'bear_use_sma': False, 'bear_use_ema': False, 'bear_use_atr': True, 'bear_use_adx': True, 'bear_use_spike': False, 'bear_rsi_required': False, 'sideways_strategy': 'mean_reversion', 'sideways_bb_std_mult': 2.103766498348542, 'sideways_rsi_os': 37, 'sideways_rsi_ob': 87, 'sideways_adx_thresh': 8.692308220223266, 'sideways_atr_min_pct': 0.02198998128878562, 'sideways_atr_max_pct': 0.03010191059532818, 'sideways_tp_mult': 2.4493822614144243, 'sideways_tsl_mult': 0.42334184119221524, 'sideways_time_stop': 20, 'sideways_use_sma': False, 'sideways_use_ema': True, 'sideways_use_atr': False, 'sideways_use_adx': True, 'sideways_use_spike': False, 'sideways_rsi_required': False}.
[I 2025-09-01 08:23:23,099] Trial 392 finished with values: [-1000000000.0, 1000000000.0] and parameters: {'p_sma': 24, 'p_std': 16, 'p_atr': 15, 'p_adx': 21, 'rsi_period': 52, 'ema1': 13, 'ema2': 15, 'slip_atr_k': 0.05801899659842993, 'slip_spread_k': 0.6966343500782769, 'spread_hl_frac': 0.024816519242585728, 'bb_std_mult': 0.893348104843156, 'rsi_os': 47, 'rsi_ob': 87, 'vol_spike': 0.26060286673569305, 'adx_thresh': 15.465040867340928, 'atr_min_pct': 0.020670731279519395, 'atr_max_pct': 0.14721368508121738, 'tp_mult': 1.1031416287130629, 'tsl_mult': 0.8388711424140896, 'strategy': 'mean_reversion', 'time_stop': 141, 'use_sma': False, 'use_atr': True, 'use_adx': True, 'use_ema': True, 'use_spike': True, 'rsi_required': True, 'edge_k': 0.9554492862079185, 'edge_cap': 0.0795142915909135, 'bull_strategy': 'mean_reversion', 'bull_bb_std_mult': 2.89203838653265, 'bull_rsi_os': 11, 'bull_rsi_ob': 66, 'bull_adx_thresh': 6.746007056550829, 'bull_atr_min_pct': 0.013976872155588961, 'bull_atr_max_pct': 0.03547128587243912, 'bull_tp_mult': 2.214956659934985, 'bull_tsl_mult': 0.6005036081948354, 'bull_time_stop': 169, 'bull_use_sma': True, 'bull_use_ema': False, 'bull_use_atr': False, 'bull_use_adx': True, 'bull_use_spike': True, 'bull_rsi_required': False, 'bear_strategy': 'mean_reversion', 'bear_bb_std_mult': 3.3341184687872656, 'bear_rsi_os': 52, 'bear_rsi_ob': 95, 'bear_adx_thresh': 20.29386929061148, 'bear_atr_min_pct': 0.025694308514293773, 'bear_atr_max_pct': 0.08389400984447581, 'bear_tp_mult': 2.3774054449874074, 'bear_tsl_mult': 0.9409594108136656, 'bear_time_stop': 280, 'bear_use_sma': False, 'bear_use_ema': False, 'bear_use_atr': True, 'bear_use_adx': True, 'bear_use_spike': False, 'bear_rsi_required': False, 'sideways_strategy': 'mean_reversion', 'sideways_bb_std_mult': 3.234825847660076, 'sideways_rsi_os': 21, 'sideways_rsi_ob': 87, 'sideways_adx_thresh': 8.431465199663698, 'sideways_atr_min_pct': 0.021939509884524637, 'sideways_atr_max_pct': 0.14788682666352915, 'sideways_tp_mult': 2.357227231156775, 'sideways_tsl_mult': 0.41895198185706434, 'sideways_time_stop': 20, 'sideways_use_sma': False, 'sideways_use_ema': True, 'sideways_use_atr': False, 'sideways_use_adx': True, 'sideways_use_spike': False, 'sideways_rsi_required': False}.
[I 2025-09-01 08:23:23,390] Trial 391 finished with values: [-1000000000.0, 1000000000.0] and parameters: {'p_sma': 24, 'p_std': 16, 'p_atr': 15, 'p_adx': 21, 'rsi_period': 64, 'ema1': 10, 'ema2': 10, 'slip_atr_k': 0.09434229473903319, 'slip_spread_k': 0.6523126209612758, 'spread_hl_frac': 0.024751102041515673, 'bb_std_mult': 3.4308487221289097, 'rsi_os': 24, 'rsi_ob': 53, 'vol_spike': 0.22718545265228463, 'adx_thresh': 24.190685572563805, 'atr_min_pct': 0.0190130314040208, 'atr_max_pct': 0.14696097919364293, 'tp_mult': 1.2383992823731336, 'tsl_mult': 0.5193834366509417, 'strategy': 'mean_reversion', 'time_stop': 260, 'use_sma': False, 'use_atr': True, 'use_adx': True, 'use_ema': True, 'use_spike': True, 'rsi_required': True, 'edge_k': 0.9294299814813275, 'edge_cap': 0.7835119278417058, 'bull_strategy': 'mean_reversion', 'bull_bb_std_mult': 2.8672760813960108, 'bull_rsi_os': 16, 'bull_rsi_ob': 66, 'bull_adx_thresh': 8.027856710760378, 'bull_atr_min_pct': 0.0047060083273064435, 'bull_atr_max_pct': 0.0273067608229973, 'bull_tp_mult': 2.890034842513948, 'bull_tsl_mult': 0.4916280653436038, 'bull_time_stop': 41, 'bull_use_sma': True, 'bull_use_ema': False, 'bull_use_atr': False, 'bull_use_adx': True, 'bull_use_spike': True, 'bull_rsi_required': False, 'bear_strategy': 'mean_reversion', 'bear_bb_std_mult': 3.3122874442528247, 'bear_rsi_os': 33, 'bear_rsi_ob': 68, 'bear_adx_thresh': 19.81038934914565, 'bear_atr_min_pct': 0.02236497271062538, 'bear_atr_max_pct': 0.08491093048482146, 'bear_tp_mult': 2.842891144477899, 'bear_tsl_mult': 0.03951177701355327, 'bear_time_stop': 93, 'bear_use_sma': False, 'bear_use_ema': False, 'bear_use_atr': True, 'bear_use_adx': True, 'bear_use_spike': False, 'bear_rsi_required': False, 'sideways_strategy': 'mean_reversion', 'sideways_bb_std_mult': 3.2371910133380624, 'sideways_rsi_os': 21, 'sideways_rsi_ob': 64, 'sideways_adx_thresh': 9.800150397691706, 'sideways_atr_min_pct': 0.026758637937287975, 'sideways_atr_max_pct': 0.029742629557832315, 'sideways_tp_mult': 2.353908580967782, 'sideways_tsl_mult': 0.14751902650104268, 'sideways_time_stop': 22, 'sideways_use_sma': False, 'sideways_use_ema': True, 'sideways_use_atr': False, 'sideways_use_adx': True, 'sideways_use_spike': False, 'sideways_rsi_required': False}.
[I 2025-09-01 08:23:23,584] Trial 390 finished with values: [-0.09927259137117339, 0.09922747241361302] and parameters: {'p_sma': 29, 'p_std': 37, 'p_atr': 20, 'p_adx': 30, 'rsi_period': 53, 'ema1': 17, 'ema2': 13, 'slip_atr_k': 0.05076646690369709, 'slip_spread_k': 0.698371384133292, 'spread_hl_frac': 0.02512096375323923, 'bb_std_mult': 2.694643214388828, 'rsi_os': 43, 'rsi_ob': 55, 'vol_spike': 0.22625053285392566, 'adx_thresh': 24.90637261506174, 'atr_min_pct': 0.01905881695618604, 'atr_max_pct': 0.08685326050662615, 'tp_mult': 1.2377393222991515, 'tsl_mult': 0.2503269762895112, 'strategy': 'mean_reversion', 'time_stop': 260, 'use_sma': False, 'use_atr': True, 'use_adx': True, 'use_ema': False, 'use_spike': True, 'rsi_required': True, 'edge_k': 1.400217476768817, 'edge_cap': 0.08106193899897454, 'bull_strategy': 'mean_reversion', 'bull_bb_std_mult': 2.951032120324661, 'bull_rsi_os': 53, 'bull_rsi_ob': 94, 'bull_adx_thresh': 6.89470340849317, 'bull_atr_min_pct': 0.0015964294320293584, 'bull_atr_max_pct': 0.09435134751736324, 'bull_tp_mult': 2.3421900060762417, 'bull_tsl_mult': 0.4943714838393015, 'bull_time_stop': 165, 'bull_use_sma': True, 'bull_use_ema': False, 'bull_use_atr': False, 'bull_use_adx': True, 'bull_use_spike': True, 'bull_rsi_required': True, 'bear_strategy': 'mean_reversion', 'bear_bb_std_mult': 3.0253309756258115, 'bear_rsi_os': 5, 'bear_rsi_ob': 95, 'bear_adx_thresh': 29.98127752658138, 'bear_atr_min_pct': 0.02235925417903528, 'bear_atr_max_pct': 0.08433237723800291, 'bear_tp_mult': 1.5048396493552345, 'bear_tsl_mult': 0.24451209501009719, 'bear_time_stop': 66, 'bear_use_sma': False, 'bear_use_ema': False, 'bear_use_atr': True, 'bear_use_adx': True, 'bear_use_spike': True, 'bear_rsi_required': False, 'sideways_strategy': 'mean_reversion', 'sideways_bb_std_mult': 1.9798674426805511, 'sideways_rsi_os': 38, 'sideways_rsi_ob': 67, 'sideways_adx_thresh': 8.355609704155428, 'sideways_atr_min_pct': 0.021966033078387036, 'sideways_atr_max_pct': 0.14799727525769477, 'sideways_tp_mult': 2.3641640804613915, 'sideways_tsl_mult': 0.4314929139237931, 'sideways_time_stop': 40, 'sideways_use_sma': False, 'sideways_use_ema': False, 'sideways_use_atr': False, 'sideways_use_adx': False, 'sideways_use_spike': True, 'sideways_rsi_required': False}.
[I 2025-09-01 08:24:04,783] Trial 394 finished with values: [-0.033500122680655164, 0.03381617850650437] and parameters: {'p_sma': 20, 'p_std': 58, 'p_atr': 22, 'p_adx': 30, 'rsi_period': 64, 'ema1': 17, 'ema2': 22, 'slip_atr_k': 0.0954439569307119, 'slip_spread_k': 0.6552967720923453, 'spread_hl_frac': 0.023576219070870038, 'bb_std_mult': 3.428040889008782, 'rsi_os': 41, 'rsi_ob': 55, 'vol_spike': 0.23981915910917015, 'adx_thresh': 30.301288489797926, 'atr_min_pct': 0.0018314679763871446, 'atr_max_pct': 0.13731539337111587, 'tp_mult': 1.2340550840902036, 'tsl_mult': 0.3996519975438857, 'strategy': 'mean_reversion', 'time_stop': 256, 'use_sma': True, 'use_atr': True, 'use_adx': True, 'use_ema': False, 'use_spike': True, 'rsi_required': True, 'edge_k': 1.034660668005192, 'edge_cap': 0.916215591509824, 'bull_strategy': 'breakout', 'bull_bb_std_mult': 3.5127429783662967, 'bull_rsi_os': 41, 'bull_rsi_ob': 68, 'bull_adx_thresh': 19.611300298139053, 'bull_atr_min_pct': 0.001161592580527413, 'bull_atr_max_pct': 0.14587798929546897, 'bull_tp_mult': 1.3999062699429874, 'bull_tsl_mult': 0.4870733801027896, 'bull_time_stop': 238, 'bull_use_sma': True, 'bull_use_ema': False, 'bull_use_atr': False, 'bull_use_adx': True, 'bull_use_spike': True, 'bull_rsi_required': False, 'bear_strategy': 'mean_reversion', 'bear_bb_std_mult': 2.988695676003644, 'bear_rsi_os': 27, 'bear_rsi_ob': 94, 'bear_adx_thresh': 30.06266185132288, 'bear_atr_min_pct': 0.022314388484136374, 'bear_atr_max_pct': 0.0220440022180231, 'bear_tp_mult': 1.5311326921090618, 'bear_tsl_mult': 0.0919452042268193, 'bear_time_stop': 66, 'bear_use_sma': False, 'bear_use_ema': False, 'bear_use_atr': True, 'bear_use_adx': True, 'bear_use_spike': True, 'bear_rsi_required': False, 'sideways_strategy': 'mean_reversion', 'sideways_bb_std_mult': 0.9489610894217977, 'sideways_rsi_os': 12, 'sideways_rsi_ob': 89, 'sideways_adx_thresh': 9.867301830392481, 'sideways_atr_min_pct': 0.02054280420693187, 'sideways_atr_max_pct': 0.08658573409527626, 'sideways_tp_mult': 1.4516904176448986, 'sideways_tsl_mult': 0.6815436950009786, 'sideways_time_stop': 26, 'sideways_use_sma': False, 'sideways_use_ema': False, 'sideways_use_atr': False, 'sideways_use_adx': False, 'sideways_use_spike': True, 'sideways_rsi_required': False}.
[I 2025-09-01 08:24:05,604] Trial 397 finished with values: [-0.08620221614476431, 0.08624231226710775] and parameters: {'p_sma': 20, 'p_std': 27, 'p_atr': 19, 'p_adx': 8, 'rsi_period': 63, 'ema1': 10, 'ema2': 35, 'slip_atr_k': 0.06912318450920424, 'slip_spread_k': 0.66388190634072, 'spread_hl_frac': 0.039864056209931886, 'bb_std_mult': 3.4381450280187176, 'rsi_os': 25, 'rsi_ob': 58, 'vol_spike': 0.09590281117671909, 'adx_thresh': 22.882439258285896, 'atr_min_pct': 0.0054363096097979815, 'atr_max_pct': 0.13876996768797228, 'tp_mult': 1.1531478309024965, 'tsl_mult': 0.4405861811174806, 'strategy': 'mean_reversion', 'time_stop': 24, 'use_sma': True, 'use_atr': True, 'use_adx': True, 'use_ema': True, 'use_spike': True, 'rsi_required': True, 'edge_k': 1.040498577711184, 'edge_cap': 0.9188206677390185, 'bull_strategy': 'breakout', 'bull_bb_std_mult': 2.7950763786847177, 'bull_rsi_os': 10, 'bull_rsi_ob': 68, 'bull_adx_thresh': 23.312519819176455, 'bull_atr_min_pct': 0.0021976377021564342, 'bull_atr_max_pct': 0.057409142107416725, 'bull_tp_mult': 1.9009406763085086, 'bull_tsl_mult': 0.674552120148273, 'bull_time_stop': 158, 'bull_use_sma': True, 'bull_use_ema': False, 'bull_use_atr': False, 'bull_use_adx': True, 'bull_use_spike': True, 'bull_rsi_required': False, 'bear_strategy': 'mean_reversion', 'bear_bb_std_mult': 3.245295452391902, 'bear_rsi_os': 24, 'bear_rsi_ob': 92, 'bear_adx_thresh': 33.42179605681049, 'bear_atr_min_pct': 0.015506908470898749, 'bear_atr_max_pct': 0.07574819115341587, 'bear_tp_mult': 2.758311444336542, 'bear_tsl_mult': 0.0872309701356637, 'bear_time_stop': 81, 'bear_use_sma': False, 'bear_use_ema': False, 'bear_use_atr': True, 'bear_use_adx': True, 'bear_use_spike': True, 'bear_rsi_required': False, 'sideways_strategy': 'mean_reversion', 'sideways_bb_std_mult': 0.5039408246703005, 'sideways_rsi_os': 40, 'sideways_rsi_ob': 71, 'sideways_adx_thresh': 28.818833620397886, 'sideways_atr_min_pct': 0.00295799390482911, 'sideways_atr_max_pct': 0.08658732782491561, 'sideways_tp_mult': 1.4458073855175804, 'sideways_tsl_mult': 0.21452557008592643, 'sideways_time_stop': 113, 'sideways_use_sma': False, 'sideways_use_ema': False, 'sideways_use_atr': False, 'sideways_use_adx': True, 'sideways_use_spike': True, 'sideways_rsi_required': False}.
