[I 2025-09-01 07:37:38,529] Trial 109 finished with values: [-1000000000.0, 1000000000.0] and parameters: {'p_sma': 21, 'p_std': 31, 'p_atr': 26, 'p_adx': 13, 'rsi_period': 64, 'ema1': 11, 'ema2': 11, 'slip_atr_k': 0.24882167072782818, 'slip_spread_k': 0.6470586288650739, 'spread_hl_frac': 0.044535793672598474, 'bb_std_mult': 1.337166662240278, 'rsi_os': 24, 'rsi_ob': 60, 'vol_spike': 0.24498270085269014, 'adx_thresh': 19.253311905694698, 'atr_min_pct': 0.013760867763330683, 'atr_max_pct': 0.12838299583636345, 'tp_mult': 1.04502177545732, 'tsl_mult': 0.4292520481421082, 'strategy': 'mean_reversion', 'time_stop': 263, 'use_sma': True, 'use_atr': False, 'use_adx': True, 'use_ema': True, 'use_spike': False, 'rsi_required': True, 'edge_k': 1.388784439124906, 'edge_cap': 0.8264220676632188, 'bull_strategy': 'breakout', 'bull_bb_std_mult': 1.3902160544408346, 'bull_rsi_os': 7, 'bull_rsi_ob': 72, 'bull_adx_thresh': 8.215704696268382, 'bull_atr_min_pct': 0.006906211217628511, 'bull_atr_max_pct': 0.10779846202620422, 'bull_tp_mult': 2.0258690304650635, 'bull_tsl_mult': 0.6625742111546619, 'bull_time_stop': 291, 'bull_use_sma': True, 'bull_use_ema': True, 'bull_use_atr': False, 'bull_use_adx': False, 'bull_use_spike': True, 'bull_rsi_required': False, 'bear_strategy': 'mean_reversion', 'bear_bb_std_mult': 1.726880569663892, 'bear_rsi_os': 31, 'bear_rsi_ob': 95, 'bear_adx_thresh': 12.036876114574122, 'bear_atr_min_pct': 0.003034548245530305, 'bear_atr_max_pct': 0.07969251422787006, 'bear_tp_mult': 2.8541977358925137, 'bear_tsl_mult': 0.7329786322943559, 'bear_time_stop': 54, 'bear_use_sma': False, 'bear_use_ema': False, 'bear_use_atr': True, 'bear_use_adx': False, 'bear_use_spike': True, 'bear_rsi_required': False, 'sideways_strategy': 'mean_reversion', 'sideways_bb_std_mult': 0.6196407485199336, 'sideways_rsi_os': 39, 'sideways_rsi_ob': 80, 'sideways_adx_thresh': 29.51772278043309, 'sideways_atr_min_pct': 0.026203975313242745, 'sideways_atr_max_pct': 0.015944067631438776, 'sideways_tp_mult': 1.9082911808439489, 'sideways_tsl_mult': 0.15790885767267604, 'sideways_time_stop': 178, 'sideways_use_sma': True, 'sideways_use_ema': False, 'sideways_use_atr': False, 'sideways_use_adx': True, 'sideways_use_spike': True, 'sideways_rsi_required': False}.
[I 2025-09-01 07:37:39,747] Trial 110 finished with values: [-0.017740059125308072, 0.01821086794510294] and parameters: {'p_sma': 20, 'p_std': 15, 'p_atr': 12, 'p_adx': 20, 'rsi_period': 64, 'ema1': 10, 'ema2': 13, 'slip_atr_k': 0.057344338702009445, 'slip_spread_k': 0.6531176519390783, 'spread_hl_frac': 0.024156982053186168, 'bb_std_mult': 3.4101291216523544, 'rsi_os': 24, 'rsi_ob': 56, 'vol_spike': 0.2422968325656445, 'adx_thresh': 25.101155189159496, 'atr_min_pct': 0.02115808463741492, 'atr_max_pct': 0.14955630560795002, 'tp_mult': 1.1824726922982443, 'tsl_mult': 0.48652779589517986, 'strategy': 'mean_reversion', 'time_stop': 250, 'use_sma': True, 'use_atr': True, 'use_adx': True, 'use_ema': True, 'use_spike': True, 'rsi_required': True, 'edge_k': 1.003882587136018, 'edge_cap': 0.08432257372967672, 'bull_strategy': 'breakout', 'bull_bb_std_mult': 2.8455775662507388, 'bull_rsi_os': 13, 'bull_rsi_ob': 69, 'bull_adx_thresh': 8.317066495058498, 'bull_atr_min_pct': 0.004492727794693194, 'bull_atr_max_pct': 0.04128833984797492, 'bull_tp_mult': 2.280922365642272, 'bull_tsl_mult': 0.6632880878588511, 'bull_time_stop': 156, 'bull_use_sma': True, 'bull_use_ema': False, 'bull_use_atr': False, 'bull_use_adx': True, 'bull_use_spike': True, 'bull_rsi_required': False, 'bear_strategy': 'mean_reversion', 'bear_bb_std_mult': 3.1350970656655175, 'bear_rsi_os': 26, 'bear_rsi_ob': 95, 'bear_adx_thresh': 32.00107244494986, 'bear_atr_min_pct': 0.023153984348926092, 'bear_atr_max_pct': 0.08045281399211295, 'bear_tp_mult': 2.831714898304351, 'bear_tsl_mult': 0.08596921621952153, 'bear_time_stop': 89, 'bear_use_sma': False, 'bear_use_ema': False, 'bear_use_atr': True, 'bear_use_adx': True, 'bear_use_spike': True, 'bear_rsi_required': False, 'sideways_strategy': 'mean_reversion', 'sideways_bb_std_mult': 0.6227439548884877, 'sideways_rsi_os': 39, 'sideways_rsi_ob': 65, 'sideways_adx_thresh': 9.20462865397377, 'sideways_atr_min_pct': 0.022927723086841, 'sideways_atr_max_pct': 0.030599074406710815, 'sideways_tp_mult': 2.5837476803590076, 'sideways_tsl_mult': 0.16702492025293814, 'sideways_time_stop': 26, 'sideways_use_sma': False, 'sideways_use_ema': False, 'sideways_use_atr': False, 'sideways_use_adx': True, 'sideways_use_spike': True, 'sideways_rsi_required': False}.
[I 2025-09-01 07:37:39,748] Trial 111 finished with values: [-1000000000.0, 1000000000.0] and parameters: {'p_sma': 20, 'p_std': 15, 'p_atr': 19, 'p_adx': 20, 'rsi_period': 65, 'ema1': 28, 'ema2': 13, 'slip_atr_k': 0.05746020258371169, 'slip_spread_k': 0.39966408947095056, 'spread_hl_frac': 0.03716684594046417, 'bb_std_mult': 2.200174385296881, 'rsi_os': 31, 'rsi_ob': 56, 'vol_spike': 0.17509844062858876, 'adx_thresh': 25.050067088317444, 'atr_min_pct': 0.00871577103813706, 'atr_max_pct': 0.04156862633274981, 'tp_mult': 1.2048196012531167, 'tsl_mult': 0.015681325495465165, 'strategy': 'mean_reversion', 'time_stop': 105, 'use_sma': True, 'use_atr': True, 'use_adx': True, 'use_ema': True, 'use_spike': True, 'rsi_required': True, 'edge_k': 0.9973010494771266, 'edge_cap': 0.10561291022430774, 'bull_strategy': 'breakout', 'bull_bb_std_mult': 1.620227255217727, 'bull_rsi_os': 13, 'bull_rsi_ob': 87, 'bull_adx_thresh': 18.552938398832726, 'bull_atr_min_pct': 0.006746265551367207, 'bull_atr_max_pct': 0.02426627983546672, 'bull_tp_mult': 2.5626800706886113, 'bull_tsl_mult': 0.48830693838873207, 'bull_time_stop': 149, 'bull_use_sma': True, 'bull_use_ema': False, 'bull_use_atr': True, 'bull_use_adx': True, 'bull_use_spike': False, 'bull_rsi_required': False, 'bear_strategy': 'mean_reversion', 'bear_bb_std_mult': 1.7164719086022748, 'bear_rsi_os': 31, 'bear_rsi_ob': 90, 'bear_adx_thresh': 31.9153393413449, 'bear_atr_min_pct': 0.01706735487169359, 'bear_atr_max_pct': 0.0804760566563933, 'bear_tp_mult': 1.9377354873325527, 'bear_tsl_mult': 0.3615545442205855, 'bear_time_stop': 282, 'bear_use_sma': False, 'bear_use_ema': False, 'bear_use_atr': True, 'bear_use_adx': True, 'bear_use_spike': True, 'bear_rsi_required': True, 'sideways_strategy': 'mean_reversion', 'sideways_bb_std_mult': 0.6663307496968054, 'sideways_rsi_os': 20, 'sideways_rsi_ob': 74, 'sideways_adx_thresh': 21.76597859121958, 'sideways_atr_min_pct': 0.008838891150330135, 'sideways_atr_max_pct': 0.03347720294339907, 'sideways_tp_mult': 2.01092587198374, 'sideways_tsl_mult': 0.6293117667659031, 'sideways_time_stop': 28, 'sideways_use_sma': False, 'sideways_use_ema': False, 'sideways_use_atr': False, 'sideways_use_adx': True, 'sideways_use_spike': True, 'sideways_rsi_required': False}.
[I 2025-09-01 07:37:40,208] Trial 108 finished with values: [-1000000000.0, 1000000000.0] and parameters: {'p_sma': 20, 'p_std': 36, 'p_atr': 15, 'p_adx': 13, 'rsi_period': 64, 'ema1': 11, 'ema2': 18, 'slip_atr_k': 0.09360719909724627, 'slip_spread_k': 0.7153770808805548, 'spread_hl_frac': 0.048552704870374386, 'bb_std_mult': 1.3490610934469125, 'rsi_os': 25, 'rsi_ob': 90, 'vol_spike': 0.25154258267722135, 'adx_thresh': 24.991534550190032, 'atr_min_pct': 0.023975918174987954, 'atr_max_pct': 0.12769842421894, 'tp_mult': 1.0416232590594967, 'tsl_mult': 0.01766124055337646, 'strategy': 'mean_reversion', 'time_stop': 143, 'use_sma': True, 'use_atr': False, 'use_adx': True, 'use_ema': True, 'use_spike': False, 'rsi_required': True, 'edge_k': 1.4241835856882883, 'edge_cap': 0.8809029458754926, 'bull_strategy': 'breakout', 'bull_bb_std_mult': 2.8203788611805805, 'bull_rsi_os': 7, 'bull_rsi_ob': 69, 'bull_adx_thresh': 8.33992965462728, 'bull_atr_min_pct': 0.0067518081176986215, 'bull_atr_max_pct': 0.06807219902685287, 'bull_tp_mult': 2.0272520055093453, 'bull_tsl_mult': 0.7550318459774776, 'bull_time_stop': 292, 'bull_use_sma': True, 'bull_use_ema': True, 'bull_use_atr': False, 'bull_use_adx': False, 'bull_use_spike': True, 'bull_rsi_required': False, 'bear_strategy': 'breakout', 'bear_bb_std_mult': 2.2857044931930925, 'bear_rsi_os': 21, 'bear_rsi_ob': 95, 'bear_adx_thresh': 12.192555132338597, 'bear_atr_min_pct': 0.01113130130287035, 'bear_atr_max_pct': 0.023739190498093362, 'bear_tp_mult': 2.5767333082058785, 'bear_tsl_mult': 0.361747861922996, 'bear_time_stop': 87, 'bear_use_sma': True, 'bear_use_ema': False, 'bear_use_atr': True, 'bear_use_adx': False, 'bear_use_spike': True, 'bear_rsi_required': False, 'sideways_strategy': 'mean_reversion', 'sideways_bb_std_mult': 1.3864336653259188, 'sideways_rsi_os': 20, 'sideways_rsi_ob': 81, 'sideways_adx_thresh': 29.29637839650982, 'sideways_atr_min_pct': 0.022791820060638887, 'sideways_atr_max_pct': 0.02378206568935021, 'sideways_tp_mult': 1.9200810809484357, 'sideways_tsl_mult': 0.16971548951908583, 'sideways_time_stop': 126, 'sideways_use_sma': True, 'sideways_use_ema': False, 'sideways_use_atr': False, 'sideways_use_adx': True, 'sideways_use_spike': True, 'sideways_rsi_required': True}.
[I 2025-09-01 07:38:27,728] Trial 113 finished with values: [-1000000000.0, 1000000000.0] and parameters: {'p_sma': 19, 'p_std': 17, 'p_atr': 17, 'p_adx': 20, 'rsi_period': 66, 'ema1': 9, 'ema2': 11, 'slip_atr_k': 0.055311607072202354, 'slip_spread_k': 0.5436867310550856, 'spread_hl_frac': 0.023555132894075542, 'bb_std_mult': 3.413876377232824, 'rsi_os': 21, 'rsi_ob': 88, 'vol_spike': 0.21775617477726095, 'adx_thresh': 28.565166882806416, 'atr_min_pct': 0.02118408651610072, 'atr_max_pct': 0.14968351715148792, 'tp_mult': 2.006770188025207, 'tsl_mult': 0.48241208168775573, 'strategy': 'breakout', 'time_stop': 254, 'use_sma': False, 'use_atr': True, 'use_adx': False, 'use_ema': False, 'use_spike': True, 'rsi_required': False, 'edge_k': 0.5226470193779815, 'edge_cap': 0.06835795223927221, 'bull_strategy': 'mean_reversion', 'bull_bb_std_mult': 2.833931980123733, 'bull_rsi_os': 14, 'bull_rsi_ob': 69, 'bull_adx_thresh': 7.162819967395137, 'bull_atr_min_pct': 0.004151753702837555, 'bull_atr_max_pct': 0.041082475284686074, 'bull_tp_mult': 1.0707113671140651, 'bull_tsl_mult': 0.8494296459350948, 'bull_time_stop': 157, 'bull_use_sma': False, 'bull_use_ema': False, 'bull_use_atr': True, 'bull_use_adx': True, 'bull_use_spike': False, 'bull_rsi_required': False, 'bear_strategy': 'mean_reversion', 'bear_bb_std_mult': 3.1492296302296605, 'bear_rsi_os': 26, 'bear_rsi_ob': 95, 'bear_adx_thresh': 33.303785159818155, 'bear_atr_min_pct': 0.02350084084046795, 'bear_atr_max_pct': 0.0750222037731312, 'bear_tp_mult': 2.972576621092478, 'bear_tsl_mult': 0.08398574923817935, 'bear_time_stop': 136, 'bear_use_sma': False, 'bear_use_ema': False, 'bear_use_atr': True, 'bear_use_adx': True, 'bear_use_spike': True, 'bear_rsi_required': False, 'sideways_strategy': 'mean_reversion', 'sideways_bb_std_mult': 0.5807091275041216, 'sideways_rsi_os': 40, 'sideways_rsi_ob': 65, 'sideways_adx_thresh': 9.365364853342747, 'sideways_atr_min_pct': 0.023291228360141882, 'sideways_atr_max_pct': 0.024439539726130038, 'sideways_tp_mult': 2.5557980865690526, 'sideways_tsl_mult': 0.0626578131609413, 'sideways_time_stop': 19, 'sideways_use_sma': False, 'sideways_use_ema': True, 'sideways_use_atr': False, 'sideways_use_adx': False, 'sideways_use_spike': False, 'sideways_rsi_required': False}.
[I 2025-09-01 07:38:28,160] Trial 114 finished with values: [-1000000000.0, 1000000000.0] and parameters: {'p_sma': 19, 'p_std': 22, 'p_atr': 20, 'p_adx': 20, 'rsi_period': 68, 'ema1': 9, 'ema2': 11, 'slip_atr_k': 0.19520557372469166, 'slip_spread_k': 0.5486360878117142, 'spread_hl_frac': 0.023728009058599484, 'bb_std_mult': 3.4941027533150777, 'rsi_os': 21, 'rsi_ob': 58, 'vol_spike': 0.20985973483049944, 'adx_thresh': 29.665691105495288, 'atr_min_pct': 0.02125609106516046, 'atr_max_pct': 0.1491478290506811, 'tp_mult': 1.9971308040344637, 'tsl_mult': 0.48046687698275026, 'strategy': 'breakout', 'time_stop': 251, 'use_sma': False, 'use_atr': True, 'use_adx': False, 'use_ema': False, 'use_spike': True, 'rsi_required': False, 'edge_k': 1.7592566660874465, 'edge_cap': 0.09636112196900785, 'bull_strategy': 'mean_reversion', 'bull_bb_std_mult': 2.818363068334775, 'bull_rsi_os': 12, 'bull_rsi_ob': 69, 'bull_adx_thresh': 7.424735003426534, 'bull_atr_min_pct': 0.004224106153160715, 'bull_atr_max_pct': 0.04164932158571185, 'bull_tp_mult': 1.5818402266496236, 'bull_tsl_mult': 0.8743476110559618, 'bull_time_stop': 139, 'bull_use_sma': False, 'bull_use_ema': False, 'bull_use_atr': True, 'bull_use_adx': True, 'bull_use_spike': False, 'bull_rsi_required': False, 'bear_strategy': 'mean_reversion', 'bear_bb_std_mult': 3.1069921738835284, 'bear_rsi_os': 28, 'bear_rsi_ob': 95, 'bear_adx_thresh': 33.511858817444725, 'bear_atr_min_pct': 0.023492520591080136, 'bear_atr_max_pct': 0.07882431288545355, 'bear_tp_mult': 2.9692053621157926, 'bear_tsl_mult': 0.08093987010314482, 'bear_time_stop': 163, 'bear_use_sma': False, 'bear_use_ema': False, 'bear_use_atr': True, 'bear_use_adx': True, 'bear_use_spike': True, 'bear_rsi_required': False, 'sideways_strategy': 'mean_reversion', 'sideways_bb_std_mult': 0.5644633974607074, 'sideways_rsi_os': 41, 'sideways_rsi_ob': 65, 'sideways_adx_thresh': 9.465945950294982, 'sideways_atr_min_pct': 0.022868058880805318, 'sideways_atr_max_pct': 0.02968784028108662, 'sideways_tp_mult': 2.5822457416139186, 'sideways_tsl_mult': 0.07804822540438475, 'sideways_time_stop': 16, 'sideways_use_sma': False, 'sideways_use_ema': True, 'sideways_use_atr': False, 'sideways_use_adx': False, 'sideways_use_spike': False, 'sideways_rsi_required': False}.
[I 2025-09-01 07:38:28,434] Trial 112 finished with values: [-0.06633986832760552, 0.0667807119058647] and parameters: {'p_sma': 19, 'p_std': 10, 'p_atr': 12, 'p_adx': 20, 'rsi_period': 55, 'ema1': 28, 'ema2': 13, 'slip_atr_k': 0.10546204167776588, 'slip_spread_k': 0.3537507163543674, 'spread_hl_frac': 0.018561465348919073, 'bb_std_mult': 1.8185396272741043, 'rsi_os': 31, 'rsi_ob': 63, 'vol_spike': 0.1006466512386475, 'adx_thresh': 25.2995418497648, 'atr_min_pct': 0.024209437954082154, 'atr_max_pct': 0.06800588654157891, 'tp_mult': 1.1369138231030866, 'tsl_mult': 0.4662749413779537, 'strategy': 'mean_reversion', 'time_stop': 36, 'use_sma': True, 'use_atr': True, 'use_adx': True, 'use_ema': True, 'use_spike': True, 'rsi_required': True, 'edge_k': 0.9963790207111017, 'edge_cap': 0.11036247419924705, 'bull_strategy': 'breakout', 'bull_bb_std_mult': 1.9780112449805283, 'bull_rsi_os': 14, 'bull_rsi_ob': 87, 'bull_adx_thresh': 7.474547398070975, 'bull_atr_min_pct': 0.003428141175325026, 'bull_atr_max_pct': 0.10131614796510803, 'bull_tp_mult': 2.528268173000808, 'bull_tsl_mult': 0.8559333860597572, 'bull_time_stop': 113, 'bull_use_sma': True, 'bull_use_ema': False, 'bull_use_atr': True, 'bull_use_adx': True, 'bull_use_spike': False, 'bull_rsi_required': False, 'bear_strategy': 'breakout', 'bear_bb_std_mult': 2.6701359051514304, 'bear_rsi_os': 54, 'bear_rsi_ob': 52, 'bear_adx_thresh': 33.443194010153114, 'bear_atr_min_pct': 0.015458445080927674, 'bear_atr_max_pct': 0.018582968501362346, 'bear_tp_mult': 1.8988026858489155, 'bear_tsl_mult': 0.6144664037947928, 'bear_time_stop': 230, 'bear_use_sma': False, 'bear_use_ema': True, 'bear_use_atr': True, 'bear_use_adx': True, 'bear_use_spike': True, 'bear_rsi_required': True, 'sideways_strategy': 'mean_reversion', 'sideways_bb_std_mult': 1.3834665564013942, 'sideways_rsi_os': 20, 'sideways_rsi_ob': 74, 'sideways_adx_thresh': 23.004217444871944, 'sideways_atr_min_pct': 0.02288714165701384, 'sideways_atr_max_pct': 0.027706656042958466, 'sideways_tp_mult': 2.5929086635821137, 'sideways_tsl_mult': 0.7071076203400256, 'sideways_time_stop': 166, 'sideways_use_sma': False, 'sideways_use_ema': False, 'sideways_use_atr': False, 'sideways_use_adx': True, 'sideways_use_spike': True, 'sideways_rsi_required': False}.
[I 2025-09-01 07:38:28,601] Trial 115 finished with values: [-1000000000.0, 1000000000.0] and parameters: {'p_sma': 18, 'p_std': 20, 'p_atr': 18, 'p_adx': 20, 'rsi_period': 68, 'ema1': 7, 'ema2': 11, 'slip_atr_k': 0.19567645526460686, 'slip_spread_k': 0.3556284959153069, 'spread_hl_frac': 0.023617307301063272, 'bb_std_mult': 3.364051746864997, 'rsi_os': 21, 'rsi_ob': 84, 'vol_spike': 0.21331173460495698, 'adx_thresh': 29.09198475798331, 'atr_min_pct': 0.02129649531817734, 'atr_max_pct': 0.14397876114844438, 'tp_mult': 1.9829484953437924, 'tsl_mult': 0.607627698138667, 'strategy': 'breakout', 'time_stop': 251, 'use_sma': False, 'use_atr': True, 'use_adx': False, 'use_ema': False, 'use_spike': True, 'rsi_required': False, 'edge_k': 0.2923794791640709, 'edge_cap': 0.08146242715027548, 'bull_strategy': 'mean_reversion', 'bull_bb_std_mult': 2.786156801975856, 'bull_rsi_os': 11, 'bull_rsi_ob': 68, 'bull_adx_thresh': 7.448850437394038, 'bull_atr_min_pct': 0.0045097379780087024, 'bull_atr_max_pct': 0.04084708972407964, 'bull_tp_mult': 1.106054240993633, 'bull_tsl_mult': 0.9461377934147381, 'bull_time_stop': 158, 'bull_use_sma': False, 'bull_use_ema': False, 'bull_use_atr': True, 'bull_use_adx': True, 'bull_use_spike': False, 'bull_rsi_required': False, 'bear_strategy': 'mean_reversion', 'bear_bb_std_mult': 3.1417116954517468, 'bear_rsi_os': 28, 'bear_rsi_ob': 94, 'bear_adx_thresh': 28.87054715832448, 'bear_atr_min_pct': 0.026046373734107287, 'bear_atr_max_pct': 0.08276957401054136, 'bear_tp_mult': 2.99745645836886, 'bear_tsl_mult': 0.0800631882077388, 'bear_time_stop': 139, 'bear_use_sma': False, 'bear_use_ema': False, 'bear_use_atr': True, 'bear_use_adx': True, 'bear_use_spike': True, 'bear_rsi_required': False, 'sideways_strategy': 'mean_reversion', 'sideways_bb_std_mult': 0.5873478440942467, 'sideways_rsi_os': 40, 'sideways_rsi_ob': 65, 'sideways_adx_thresh': 9.913145161256658, 'sideways_atr_min_pct': 0.02112368498772493, 'sideways_atr_max_pct': 0.029777785845162226, 'sideways_tp_mult': 2.552872821859372, 'sideways_tsl_mult': 0.07758975224137754, 'sideways_time_stop': 14, 'sideways_use_sma': False, 'sideways_use_ema': True, 'sideways_use_atr': False, 'sideways_use_adx': False, 'sideways_use_spike': False, 'sideways_rsi_required': False}.
[I 2025-09-01 07:39:20,942] Trial 119 finished with values: [-1000000000.0, 1000000000.0] and parameters: {'p_sma': 15, 'p_std': 46, 'p_atr': 12, 'p_adx': 19, 'rsi_period': 70, 'ema1': 10, 'ema2': 14, 'slip_atr_k': 0.06109123324277729, 'slip_spread_k': 0.05539578155307495, 'spread_hl_frac': 0.027777186432138518, 'bb_std_mult': 3.176703720587887, 'rsi_os': 24, 'rsi_ob': 56, 'vol_spike': 0.19336393934653412, 'adx_thresh': 26.11596567623646, 'atr_min_pct': 0.018882608432096926, 'atr_max_pct': 0.1477916880305925, 'tp_mult': 1.2631273467966384, 'tsl_mult': 0.5628927502392975, 'strategy': 'mean_reversion', 'time_stop': 270, 'use_sma': False, 'use_atr': True, 'use_adx': True, 'use_ema': False, 'use_spike': True, 'rsi_required': False, 'edge_k': 1.6281174831057565, 'edge_cap': 0.12943934551382108, 'bull_strategy': 'mean_reversion', 'bull_bb_std_mult': 3.0804733940293656, 'bull_rsi_os': 14, 'bull_rsi_ob': 67, 'bull_adx_thresh': 6.2600120619263375, 'bull_atr_min_pct': 0.009992752022861845, 'bull_atr_max_pct': 0.03415587890713346, 'bull_tp_mult': 2.283271585868699, 'bull_tsl_mult': 0.3695033601431554, 'bull_time_stop': 150, 'bull_use_sma': False, 'bull_use_ema': False, 'bull_use_atr': True, 'bull_use_adx': True, 'bull_use_spike': False, 'bull_rsi_required': False, 'bear_strategy': 'mean_reversion', 'bear_bb_std_mult': 3.437451856517471, 'bear_rsi_os': 24, 'bear_rsi_ob': 91, 'bear_adx_thresh': 29.884728240767757, 'bear_atr_min_pct': 0.02255451583863617, 'bear_atr_max_pct': 0.08913934640965074, 'bear_tp_mult': 2.906772564058142, 'bear_tsl_mult': 0.03869847609821706, 'bear_time_stop': 153, 'bear_use_sma': False, 'bear_use_ema': False, 'bear_use_atr': True, 'bear_use_adx': True, 'bear_use_spike': True, 'bear_rsi_required': False, 'sideways_strategy': 'mean_reversion', 'sideways_bb_std_mult': 0.6714891726222215, 'sideways_rsi_os': 36, 'sideways_rsi_ob': 68, 'sideways_adx_thresh': 8.928391738229083, 'sideways_atr_min_pct': 0.023777144913768398, 'sideways_atr_max_pct': 0.03892180500711981, 'sideways_tp_mult': 2.6141642952709736, 'sideways_tsl_mult': 0.25994040993352907, 'sideways_time_stop': 50, 'sideways_use_sma': False, 'sideways_use_ema': True, 'sideways_use_atr': False, 'sideways_use_adx': False, 'sideways_use_spike': False, 'sideways_rsi_required': False}.
