[I 2025-09-01 07:42:15,332] Trial 135 finished with values: [-1000000000.0, 1000000000.0] and parameters: {'p_sma': 44, 'p_std': 14, 'p_atr': 14, 'p_adx': 19, 'rsi_period': 55, 'ema1': 9, 'ema2': 13, 'slip_atr_k': 0.05929190341773123, 'slip_spread_k': 0.6370388788712501, 'spread_hl_frac': 0.03353722212111858, 'bb_std_mult': 3.3435450896129972, 'rsi_os': 20, 'rsi_ob': 57, 'vol_spike': 0.006908703460540289, 'adx_thresh': 33.85971564418099, 'atr_min_pct': 0.02435713711919169, 'atr_max_pct': 0.1462978636968454, 'tp_mult': 1.276340311740361, 'tsl_mult': 0.43414912550865126, 'strategy': 'mean_reversion', 'time_stop': 287, 'use_sma': True, 'use_atr': True, 'use_adx': True, 'use_ema': True, 'use_spike': True, 'rsi_required': True, 'edge_k': 1.6948196374962765, 'edge_cap': 0.14940302718140158, 'bull_strategy': 'breakout', 'bull_bb_std_mult': 2.994223712573222, 'bull_rsi_os': 13, 'bull_rsi_ob': 72, 'bull_adx_thresh': 23.41128766357288, 'bull_atr_min_pct': 0.016342263526911018, 'bull_atr_max_pct': 0.03902100178664275, 'bull_tp_mult': 2.611575897567602, 'bull_tsl_mult': 0.03295361739308594, 'bull_time_stop': 15, 'bull_use_sma': True, 'bull_use_ema': False, 'bull_use_atr': False, 'bull_use_adx': True, 'bull_use_spike': True, 'bull_rsi_required': False, 'bear_strategy': 'mean_reversion', 'bear_bb_std_mult': 3.4948565483118563, 'bear_rsi_os': 24, 'bear_rsi_ob': 95, 'bear_adx_thresh': 5.945407897892169, 'bear_atr_min_pct': 0.022026583031194806, 'bear_atr_max_pct': 0.08051261479119101, 'bear_tp_mult': 2.0961718633943605, 'bear_tsl_mult': 0.8108367527567679, 'bear_time_stop': 67, 'bear_use_sma': False, 'bear_use_ema': False, 'bear_use_atr': True, 'bear_use_adx': True, 'bear_use_spike': True, 'bear_rsi_required': False, 'sideways_strategy': 'mean_reversion', 'sideways_bb_std_mult': 3.589280686620146, 'sideways_rsi_os': 43, 'sideways_rsi_ob': 69, 'sideways_adx_thresh': 8.474652419685038, 'sideways_atr_min_pct': 0.014477447723515422, 'sideways_atr_max_pct': 0.04170357393435561, 'sideways_tp_mult': 2.448073136913287, 'sideways_tsl_mult': 0.14699396706356277, 'sideways_time_stop': 110, 'sideways_use_sma': False, 'sideways_use_ema': False, 'sideways_use_atr': False, 'sideways_use_adx': True, 'sideways_use_spike': True, 'sideways_rsi_required': False}.
[I 2025-09-01 07:42:15,999] Trial 138 finished with values: [-1000000000.0, 1000000000.0] and parameters: {'p_sma': 44, 'p_std': 49, 'p_atr': 13, 'p_adx': 19, 'rsi_period': 55, 'ema1': 9, 'ema2': 13, 'slip_atr_k': 0.05859207884670113, 'slip_spread_k': 0.685563477566757, 'spread_hl_frac': 0.014155171706764023, 'bb_std_mult': 3.349865174288912, 'rsi_os': 26, 'rsi_ob': 55, 'vol_spike': 0.26573541630670844, 'adx_thresh': 33.756938475879, 'atr_min_pct': 0.021825495141665503, 'atr_max_pct': 0.1460185883073142, 'tp_mult': 2.1174147863813886, 'tsl_mult': 0.8478317503705493, 'strategy': 'mean_reversion', 'time_stop': 221, 'use_sma': True, 'use_atr': True, 'use_adx': True, 'use_ema': True, 'use_spike': True, 'rsi_required': True, 'edge_k': 1.5184529373764986, 'edge_cap': 0.10818122137001955, 'bull_strategy': 'breakout', 'bull_bb_std_mult': 2.480922219384484, 'bull_rsi_os': 26, 'bull_rsi_ob': 57, 'bull_adx_thresh': 7.804544164035692, 'bull_atr_min_pct': 0.022031531939525555, 'bull_atr_max_pct': 0.12308919976200296, 'bull_tp_mult': 2.229414392547872, 'bull_tsl_mult': 0.43768354502708495, 'bull_time_stop': 31, 'bull_use_sma': True, 'bull_use_ema': False, 'bull_use_atr': False, 'bull_use_adx': True, 'bull_use_spike': True, 'bull_rsi_required': False, 'bear_strategy': 'mean_reversion', 'bear_bb_std_mult': 2.8760944117607377, 'bear_rsi_os': 24, 'bear_rsi_ob': 63, 'bear_adx_thresh': 33.00853425228259, 'bear_atr_min_pct': 0.024656620368597167, 'bear_atr_max_pct': 0.1292856209808984, 'bear_tp_mult': 2.8743212923266515, 'bear_tsl_mult': 0.018171292927940924, 'bear_time_stop': 232, 'bear_use_sma': False, 'bear_use_ema': False, 'bear_use_atr': True, 'bear_use_adx': True, 'bear_use_spike': True, 'bear_rsi_required': False, 'sideways_strategy': 'mean_reversion', 'sideways_bb_std_mult': 2.7366723838762743, 'sideways_rsi_os': 44, 'sideways_rsi_ob': 72, 'sideways_adx_thresh': 7.87531789127714, 'sideways_atr_min_pct': 0.02524792786234998, 'sideways_atr_max_pct': 0.022463287549897147, 'sideways_tp_mult': 2.580426128243226, 'sideways_tsl_mult': 0.21621596277357522, 'sideways_time_stop': 240, 'sideways_use_sma': False, 'sideways_use_ema': False, 'sideways_use_atr': False, 'sideways_use_adx': True, 'sideways_use_spike': True, 'sideways_rsi_required': False}.
[I 2025-09-01 07:42:16,385] Trial 137 finished with values: [-0.11802363911906011, 0.11870219365011975] and parameters: {'p_sma': 44, 'p_std': 20, 'p_atr': 13, 'p_adx': 19, 'rsi_period': 59, 'ema1': 21, 'ema2': 13, 'slip_atr_k': 0.06021268771196491, 'slip_spread_k': 0.9968376855423815, 'spread_hl_frac': 0.014484251805188168, 'bb_std_mult': 3.347355006414852, 'rsi_os': 26, 'rsi_ob': 55, 'vol_spike': 0.26793203515716296, 'adx_thresh': 25.059982195826464, 'atr_min_pct': 0.02476134057901903, 'atr_max_pct': 0.09449104533753773, 'tp_mult': 1.295283479444625, 'tsl_mult': 0.4308156866765256, 'strategy': 'mean_reversion', 'time_stop': 273, 'use_sma': True, 'use_atr': True, 'use_adx': True, 'use_ema': True, 'use_spike': True, 'rsi_required': True, 'edge_k': 1.252491046272671, 'edge_cap': 0.15030445907990297, 'bull_strategy': 'breakout', 'bull_bb_std_mult': 2.630038979996177, 'bull_rsi_os': 13, 'bull_rsi_ob': 73, 'bull_adx_thresh': 23.242317900843307, 'bull_atr_min_pct': 0.00020190851391294062, 'bull_atr_max_pct': 0.03720133981977387, 'bull_tp_mult': 1.8481167802921026, 'bull_tsl_mult': 0.676204519533536, 'bull_time_stop': 28, 'bull_use_sma': True, 'bull_use_ema': False, 'bull_use_atr': False, 'bull_use_adx': True, 'bull_use_spike': True, 'bull_rsi_required': False, 'bear_strategy': 'mean_reversion', 'bear_bb_std_mult': 3.5174976903343893, 'bear_rsi_os': 24, 'bear_rsi_ob': 73, 'bear_adx_thresh': 33.1509042741708, 'bear_atr_min_pct': 0.00010753002366144238, 'bear_atr_max_pct': 0.08210870000448107, 'bear_tp_mult': 2.867585386055296, 'bear_tsl_mult': 0.8721039391484189, 'bear_time_stop': 77, 'bear_use_sma': False, 'bear_use_ema': False, 'bear_use_atr': True, 'bear_use_adx': True, 'bear_use_spike': True, 'bear_rsi_required': False, 'sideways_strategy': 'mean_reversion', 'sideways_bb_std_mult': 0.8287588769787525, 'sideways_rsi_os': 43, 'sideways_rsi_ob': 93, 'sideways_adx_thresh': 8.587317271085615, 'sideways_atr_min_pct': 0.024827328742642037, 'sideways_atr_max_pct': 0.04169899914391751, 'sideways_tp_mult': 2.457031351072448, 'sideways_tsl_mult': 0.14294859878094784, 'sideways_time_stop': 12, 'sideways_use_sma': False, 'sideways_use_ema': False, 'sideways_use_atr': False, 'sideways_use_adx': True, 'sideways_use_spike': True, 'sideways_rsi_required': False}.
[I 2025-09-01 07:42:16,385] Trial 136 finished with values: [-1000000000.0, 1000000000.0] and parameters: {'p_sma': 44, 'p_std': 14, 'p_atr': 14, 'p_adx': 19, 'rsi_period': 56, 'ema1': 9, 'ema2': 13, 'slip_atr_k': 0.05921763173276992, 'slip_spread_k': 0.18430754466393923, 'spread_hl_frac': 0.033693762598410074, 'bb_std_mult': 3.341139949479494, 'rsi_os': 27, 'rsi_ob': 57, 'vol_spike': 0.26286252886540057, 'adx_thresh': 8.305399281905917, 'atr_min_pct': 0.024945683010220834, 'atr_max_pct': 0.1456226410881853, 'tp_mult': 1.3000345026660525, 'tsl_mult': 0.4376058995048433, 'strategy': 'mean_reversion', 'time_stop': 295, 'use_sma': True, 'use_atr': True, 'use_adx': True, 'use_ema': True, 'use_spike': True, 'rsi_required': True, 'edge_k': 1.253674049601584, 'edge_cap': 0.10440574018643009, 'bull_strategy': 'breakout', 'bull_bb_std_mult': 2.485362406717637, 'bull_rsi_os': 13, 'bull_rsi_ob': 73, 'bull_adx_thresh': 7.878011136668095, 'bull_atr_min_pct': 0.029062153081001622, 'bull_atr_max_pct': 0.043800687318605064, 'bull_tp_mult': 2.613482333425374, 'bull_tsl_mult': 0.024498993689009707, 'bull_time_stop': 17, 'bull_use_sma': True, 'bull_use_ema': False, 'bull_use_atr': False, 'bull_use_adx': True, 'bull_use_spike': True, 'bull_rsi_required': False, 'bear_strategy': 'mean_reversion', 'bear_bb_std_mult': 0.8827392439320494, 'bear_rsi_os': 24, 'bear_rsi_ob': 95, 'bear_adx_thresh': 29.15734116260545, 'bear_atr_min_pct': 0.024834549650465117, 'bear_atr_max_pct': 0.08096041890522995, 'bear_tp_mult': 2.858129027584924, 'bear_tsl_mult': 0.11892264183987183, 'bear_time_stop': 78, 'bear_use_sma': False, 'bear_use_ema': False, 'bear_use_atr': True, 'bear_use_adx': True, 'bear_use_spike': True, 'bear_rsi_required': False, 'sideways_strategy': 'mean_reversion', 'sideways_bb_std_mult': 2.95073496339889, 'sideways_rsi_os': 36, 'sideways_rsi_ob': 69, 'sideways_adx_thresh': 8.259216066447053, 'sideways_atr_min_pct': 0.025288396302883993, 'sideways_atr_max_pct': 0.0365487063990636, 'sideways_tp_mult': 2.45168553740154, 'sideways_tsl_mult': 0.15115919231564265, 'sideways_time_stop': 44, 'sideways_use_sma': False, 'sideways_use_ema': False, 'sideways_use_atr': False, 'sideways_use_adx': True, 'sideways_use_spike': True, 'sideways_rsi_required': False}.
[I 2025-09-01 07:42:58,979] Trial 140 finished with values: [-1000000000.0, 1000000000.0] and parameters: {'p_sma': 19, 'p_std': 44, 'p_atr': 10, 'p_adx': 14, 'rsi_period': 84, 'ema1': 10, 'ema2': 47, 'slip_atr_k': 0.06576558998042961, 'slip_spread_k': 0.6612115547403628, 'spread_hl_frac': 0.02483620070161732, 'bb_std_mult': 3.5210535045267775, 'rsi_os': 14, 'rsi_ob': 88, 'vol_spike': 0.24554766050406832, 'adx_thresh': 25.63142769499942, 'atr_min_pct': 0.018380607190868797, 'atr_max_pct': 0.04177735612260928, 'tp_mult': 1.1736576836100376, 'tsl_mult': 0.6515025143317034, 'strategy': 'breakout', 'time_stop': 292, 'use_sma': False, 'use_atr': True, 'use_adx': False, 'use_ema': True, 'use_spike': True, 'rsi_required': True, 'edge_k': 1.1834822286059374, 'edge_cap': 0.2688626294743108, 'bull_strategy': 'mean_reversion', 'bull_bb_std_mult': 3.256703604806167, 'bull_rsi_os': 38, 'bull_rsi_ob': 69, 'bull_adx_thresh': 8.688042182333007, 'bull_atr_min_pct': 0.026890540554455052, 'bull_atr_max_pct': 0.03093143241720199, 'bull_tp_mult': 2.2941516614529993, 'bull_tsl_mult': 0.39089449200073806, 'bull_time_stop': 146, 'bull_use_sma': False, 'bull_use_ema': False, 'bull_use_atr': False, 'bull_use_adx': True, 'bull_use_spike': True, 'bull_rsi_required': False, 'bear_strategy': 'mean_reversion', 'bear_bb_std_mult': 0.6545082874807087, 'bear_rsi_os': 5, 'bear_rsi_ob': 93, 'bear_adx_thresh': 34.217546733715, 'bear_atr_min_pct': 0.02534010742514571, 'bear_atr_max_pct': 0.06827946249219564, 'bear_tp_mult': 1.5951610740028452, 'bear_tsl_mult': 0.07600686960350059, 'bear_time_stop': 218, 'bear_use_sma': False, 'bear_use_ema': False, 'bear_use_atr': True, 'bear_use_adx': True, 'bear_use_spike': True, 'bear_rsi_required': False, 'sideways_strategy': 'mean_reversion', 'sideways_bb_std_mult': 0.9295611323789201, 'sideways_rsi_os': 50, 'sideways_rsi_ob': 64, 'sideways_adx_thresh': 6.62455610333579, 'sideways_atr_min_pct': 0.02320504182111977, 'sideways_atr_max_pct': 0.025798958784120966, 'sideways_tp_mult': 2.5255110129781624, 'sideways_tsl_mult': 0.09943657266995089, 'sideways_time_stop': 89, 'sideways_use_sma': False, 'sideways_use_ema': False, 'sideways_use_atr': False, 'sideways_use_adx': True, 'sideways_use_spike': True, 'sideways_rsi_required': False}.
[I 2025-09-01 07:42:59,921] Trial 142 finished with values: [-1000000000.0, 1000000000.0] and parameters: {'p_sma': 19, 'p_std': 44, 'p_atr': 10, 'p_adx': 23, 'rsi_period': 63, 'ema1': 10, 'ema2': 17, 'slip_atr_k': 0.04505800050288905, 'slip_spread_k': 0.45550846677872703, 'spread_hl_frac': 0.0174517385580149, 'bb_std_mult': 3.5987335253372654, 'rsi_os': 25, 'rsi_ob': 71, 'vol_spike': 0.06351443720058372, 'adx_thresh': 25.725599485834, 'atr_min_pct': 0.023404901980005985, 'atr_max_pct': 0.0451185263540717, 'tp_mult': 1.1827328366629675, 'tsl_mult': 0.7394991810166022, 'strategy': 'breakout', 'time_stop': 225, 'use_sma': False, 'use_atr': True, 'use_adx': False, 'use_ema': True, 'use_spike': True, 'rsi_required': True, 'edge_k': 1.058424117405885, 'edge_cap': 0.05000803069970035, 'bull_strategy': 'mean_reversion', 'bull_bb_std_mult': 3.358944446262602, 'bull_rsi_os': 17, 'bull_rsi_ob': 69, 'bull_adx_thresh': 29.189554593976204, 'bull_atr_min_pct': 0.003328661493665461, 'bull_atr_max_pct': 0.03124371182626355, 'bull_tp_mult': 2.207244026431412, 'bull_tsl_mult': 0.12637650150955543, 'bull_time_stop': 145, 'bull_use_sma': False, 'bull_use_ema': False, 'bull_use_atr': False, 'bull_use_adx': True, 'bull_use_spike': True, 'bull_rsi_required': False, 'bear_strategy': 'mean_reversion', 'bear_bb_std_mult': 1.541254355870222, 'bear_rsi_os': 27, 'bear_rsi_ob': 93, 'bear_adx_thresh': 30.51779781995279, 'bear_atr_min_pct': 0.0013607798875397287, 'bear_atr_max_pct': 0.0674432065383934, 'bear_tp_mult': 1.9115187712792505, 'bear_tsl_mult': 0.073711331879753, 'bear_time_stop': 126, 'bear_use_sma': False, 'bear_use_ema': False, 'bear_use_atr': True, 'bear_use_adx': True, 'bear_use_spike': True, 'bear_rsi_required': False, 'sideways_strategy': 'mean_reversion', 'sideways_bb_std_mult': 0.6386495126924262, 'sideways_rsi_os': 49, 'sideways_rsi_ob': 61, 'sideways_adx_thresh': 11.192302790285694, 'sideways_atr_min_pct': 0.022517556901863123, 'sideways_atr_max_pct': 0.027072894152048645, 'sideways_tp_mult': 2.380355779391036, 'sideways_tsl_mult': 0.09147871841640337, 'sideways_time_stop': 88, 'sideways_use_sma': False, 'sideways_use_ema': False, 'sideways_use_atr': False, 'sideways_use_adx': True, 'sideways_use_spike': True, 'sideways_rsi_required': False}.
[I 2025-09-01 07:42:59,950] Trial 141 finished with values: [-1000000000.0, 1000000000.0] and parameters: {'p_sma': 19, 'p_std': 12, 'p_atr': 10, 'p_adx': 23, 'rsi_period': 62, 'ema1': 10, 'ema2': 16, 'slip_atr_k': 0.04504125662044383, 'slip_spread_k': 0.2936719043688499, 'spread_hl_frac': 0.02681741056074804, 'bb_std_mult': 3.5368091011638056, 'rsi_os': 25, 'rsi_ob': 61, 'vol_spike': 0.2460234299006584, 'adx_thresh': 25.689565956432745, 'atr_min_pct': 0.02358072909492633, 'atr_max_pct': 0.08976795562119705, 'tp_mult': 2.8602034338508817, 'tsl_mult': 0.365877506133256, 'strategy': 'breakout', 'time_stop': 224, 'use_sma': False, 'use_atr': True, 'use_adx': False, 'use_ema': True, 'use_spike': True, 'rsi_required': True, 'edge_k': 0.8696054935354581, 'edge_cap': 0.06304201566997727, 'bull_strategy': 'mean_reversion', 'bull_bb_std_mult': 3.3284537940539414, 'bull_rsi_os': 15, 'bull_rsi_ob': 69, 'bull_adx_thresh': 7.0708700438942795, 'bull_atr_min_pct': 0.026272915286772152, 'bull_atr_max_pct': 0.03245799530050038, 'bull_tp_mult': 1.19001806530918, 'bull_tsl_mult': 0.2235864448764351, 'bull_time_stop': 144, 'bull_use_sma': False, 'bull_use_ema': False, 'bull_use_atr': False, 'bull_use_adx': True, 'bull_use_spike': True, 'bull_rsi_required': False, 'bear_strategy': 'mean_reversion', 'bear_bb_std_mult': 1.2325074191172485, 'bear_rsi_os': 27, 'bear_rsi_ob': 89, 'bear_adx_thresh': 24.272374232411778, 'bear_atr_min_pct': 0.025484665467429057, 'bear_atr_max_pct': 0.07035189883828966, 'bear_tp_mult': 1.5922146804629784, 'bear_tsl_mult': 0.08312325684268558, 'bear_time_stop': 218, 'bear_use_sma': False, 'bear_use_ema': False, 'bear_use_atr': True, 'bear_use_adx': True, 'bear_use_spike': True, 'bear_rsi_required': False, 'sideways_strategy': 'mean_reversion', 'sideways_bb_std_mult': 0.9177079276699682, 'sideways_rsi_os': 54, 'sideways_rsi_ob': 61, 'sideways_adx_thresh': 13.685309185023762, 'sideways_atr_min_pct': 0.020454572841875573, 'sideways_atr_max_pct': 0.14203194873662162, 'sideways_tp_mult': 2.529397178625313, 'sideways_tsl_mult': 0.1948566024320685, 'sideways_time_stop': 230, 'sideways_use_sma': False, 'sideways_use_ema': False, 'sideways_use_atr': False, 'sideways_use_adx': True, 'sideways_use_spike': True, 'sideways_rsi_required': False}.
[I 2025-09-01 07:43:00,128] Trial 139 finished with values: [-0.10121795523503374, 0.10145945667150781] and parameters: {'p_sma': 31, 'p_std': 49, 'p_atr': 13, 'p_adx': 19, 'rsi_period': 84, 'ema1': 9, 'ema2': 16, 'slip_atr_k': 0.054486582006666784, 'slip_spread_k': 0.686427343866489, 'spread_hl_frac': 0.021197273133158636, 'bb_std_mult': 3.5444002163171606, 'rsi_os': 26, 'rsi_ob': 55, 'vol_spike': 0.2657716467950102, 'adx_thresh': 32.705231116745374, 'atr_min_pct': 0.021871484238558433, 'atr_max_pct': 0.0897682031926624, 'tp_mult': 1.170394626540224, 'tsl_mult': 0.6572728699483439, 'strategy': 'mean_reversion', 'time_stop': 224, 'use_sma': True, 'use_atr': True, 'use_adx': True, 'use_ema': True, 'use_spike': True, 'rsi_required': True, 'edge_k': 1.0495041599927257, 'edge_cap': 0.09984466182890717, 'bull_strategy': 'breakout', 'bull_bb_std_mult': 3.485451835812578, 'bull_rsi_os': 40, 'bull_rsi_ob': 59, 'bull_adx_thresh': 7.67361613889747, 'bull_atr_min_pct': 0.00016535907865906224, 'bull_atr_max_pct': 0.04262899952745107, 'bull_tp_mult': 2.2194304857229508, 'bull_tsl_mult': 0.4311817736125022, 'bull_time_stop': 138, 'bull_use_sma': True, 'bull_use_ema': False, 'bull_use_atr': False, 'bull_use_adx': True, 'bull_use_spike': True, 'bull_rsi_required': False, 'bear_strategy': 'mean_reversion', 'bear_bb_std_mult': 0.8948945138502193, 'bear_rsi_os': 25, 'bear_rsi_ob': 89, 'bear_adx_thresh': 24.103871558628086, 'bear_atr_min_pct': 0.02505992800377546, 'bear_atr_max_pct': 0.130891891593372, 'bear_tp_mult': 2.86533320162047, 'bear_tsl_mult': 0.892616366516284, 'bear_time_stop': 232, 'bear_use_sma': False, 'bear_use_ema': False, 'bear_use_atr': True, 'bear_use_adx': True, 'bear_use_spike': True, 'bear_rsi_required': False, 'sideways_strategy': 'mean_reversion', 'sideways_bb_std_mult': 0.8364623210709138, 'sideways_rsi_os': 40, 'sideways_rsi_ob': 73, 'sideways_adx_thresh': 6.50980436557057, 'sideways_atr_min_pct': 0.024990705103259132, 'sideways_atr_max_pct': 0.021666874632199143, 'sideways_tp_mult': 2.558117949412831, 'sideways_tsl_mult': 0.09601047834046017, 'sideways_time_stop': 87, 'sideways_use_sma': False, 'sideways_use_ema': False, 'sideways_use_atr': False, 'sideways_use_adx': True, 'sideways_use_spike': True, 'sideways_rsi_required': False}.
[I 2025-09-01 07:43:39,581] Trial 145 finished with values: [-0.04793273591795222, 0.048744953056231874] and parameters: {'p_sma': 31, 'p_std': 21, 'p_atr': 9, 'p_adx': 21, 'rsi_period': 82, 'ema1': 11, 'ema2': 10, 'slip_atr_k': 0.053618635397024925, 'slip_spread_k': 0.8354365680290294, 'spread_hl_frac': 0.022716385201277427, 'bb_std_mult': 3.2628281682028253, 'rsi_os': 24, 'rsi_ob': 75, 'vol_spike': 0.25645505565193555, 'adx_thresh': 23.857945529525686, 'atr_min_pct': 0.022279545766534337, 'atr_max_pct': 0.14205315677653088, 'tp_mult': 2.5017063488198605, 'tsl_mult': 0.5421354415605817, 'strategy': 'mean_reversion', 'time_stop': 7, 'use_sma': True, 'use_atr': True, 'use_adx': True, 'use_ema': True, 'use_spike': True, 'rsi_required': True, 'edge_k': 0.9498013910865167, 'edge_cap': 0.14227009136778296, 'bull_strategy': 'breakout', 'bull_bb_std_mult': 3.4651620065288444, 'bull_rsi_os': 40, 'bull_rsi_ob': 66, 'bull_adx_thresh': 9.430180545041466, 'bull_atr_min_pct': 0.0035505955926380508, 'bull_atr_max_pct': 0.1493150563650263, 'bull_tp_mult': 2.144704433715245, 'bull_tsl_mult': 0.46869572134720083, 'bull_time_stop': 137, 'bull_use_sma': True, 'bull_use_ema': False, 'bull_use_atr': True, 'bull_use_adx': True, 'bull_use_spike': False, 'bull_rsi_required': True, 'bear_strategy': 'mean_reversion', 'bear_bb_std_mult': 3.183494701088012, 'bear_rsi_os': 51, 'bear_rsi_ob': 85, 'bear_adx_thresh': 32.423695006926295, 'bear_atr_min_pct': 0.023464050426212003, 'bear_atr_max_pct': 0.14778995596387265, 'bear_tp_mult': 1.0478999042086208, 'bear_tsl_mult': 0.041167180556201693, 'bear_time_stop': 24, 'bear_use_sma': False, 'bear_use_ema': False, 'bear_use_atr': True, 'bear_use_adx': True, 'bear_use_spike': True, 'bear_rsi_required': False, 'sideways_strategy': 'mean_reversion', 'sideways_bb_std_mult': 0.5765979483547784, 'sideways_rsi_os': 40, 'sideways_rsi_ob': 59, 'sideways_adx_thresh': 9.777889698235615, 'sideways_atr_min_pct': 0.02370332108698174, 'sideways_atr_max_pct': 0.013630106090583752, 'sideways_tp_mult': 2.8244418833526317, 'sideways_tsl_mult': 0.18599714335435433, 'sideways_time_stop': 55, 'sideways_use_sma': False, 'sideways_use_ema': False, 'sideways_use_atr': False, 'sideways_use_adx': False, 'sideways_use_spike': False, 'sideways_rsi_required': False}.
