[I 2025-09-01 07:45:04,234] Trial 153 finished with values: [-0.039537432670614714, 0.039500521535977495] and parameters: {'p_sma': 9, 'p_std': 26, 'p_atr': 11, 'p_adx': 12, 'rsi_period': 11, 'ema1': 8, 'ema2': 12, 'slip_atr_k': 0.22479457488132015, 'slip_spread_k': 0.6499845643521148, 'spread_hl_frac': 0.02630570499353616, 'bb_std_mult': 3.2896578469049436, 'rsi_os': 19, 'rsi_ob': 63, 'vol_spike': 0.2563667350232891, 'adx_thresh': 31.234836241162853, 'atr_min_pct': 0.021292632147324245, 'atr_max_pct': 0.052738398156797955, 'tp_mult': 2.4485172325895843, 'tsl_mult': 0.45222693692947036, 'strategy': 'breakout', 'time_stop': 5, 'use_sma': False, 'use_atr': True, 'use_adx': True, 'use_ema': False, 'use_spike': True, 'rsi_required': False, 'edge_k': 1.9214677110453753, 'edge_cap': 0.5191829718615989, 'bull_strategy': 'mean_reversion', 'bull_bb_std_mult': 2.5852057053591335, 'bull_rsi_os': 10, 'bull_rsi_ob': 68, 'bull_adx_thresh': 28.640176649979797, 'bull_atr_min_pct': 0.0021331438469700576, 'bull_atr_max_pct': 0.051084734227918746, 'bull_tp_mult': 2.0870320660212727, 'bull_tsl_mult': 0.6314778114309438, 'bull_time_stop': 164, 'bull_use_sma': False, 'bull_use_ema': False, 'bull_use_atr': False, 'bull_use_adx': True, 'bull_use_spike': True, 'bull_rsi_required': False, 'bear_strategy': 'mean_reversion', 'bear_bb_std_mult': 2.8380292067332276, 'bear_rsi_os': 10, 'bear_rsi_ob': 91, 'bear_adx_thresh': 19.559067958335373, 'bear_atr_min_pct': 0.023202529033496285, 'bear_atr_max_pct': 0.08785161253583387, 'bear_tp_mult': 2.8154040068453434, 'bear_tsl_mult': 0.7804902417127524, 'bear_time_stop': 55, 'bear_use_sma': False, 'bear_use_ema': False, 'bear_use_atr': True, 'bear_use_adx': True, 'bear_use_spike': True, 'bear_rsi_required': False, 'sideways_strategy': 'breakout', 'sideways_bb_std_mult': 0.6699106639345687, 'sideways_rsi_os': 13, 'sideways_rsi_ob': 57, 'sideways_adx_thresh': 33.33708334489991, 'sideways_atr_min_pct': 0.015950970603275313, 'sideways_atr_max_pct': 0.04396448211489285, 'sideways_tp_mult': 2.597917781656937, 'sideways_tsl_mult': 0.2261128772195522, 'sideways_time_stop': 9, 'sideways_use_sma': False, 'sideways_use_ema': True, 'sideways_use_atr': True, 'sideways_use_adx': True, 'sideways_use_spike': True, 'sideways_rsi_required': False}.
[I 2025-09-01 07:45:05,580] Trial 155 finished with values: [-0.028408054164477448, 0.028031752745045466] and parameters: {'p_sma': 20, 'p_std': 12, 'p_atr': 19, 'p_adx': 20, 'rsi_period': 31, 'ema1': 30, 'ema2': 40, 'slip_atr_k': 0.06437444982043251, 'slip_spread_k': 0.6821463601127622, 'spread_hl_frac': 0.020165247573707735, 'bb_std_mult': 3.4922462038052964, 'rsi_os': 21, 'rsi_ob': 85, 'vol_spike': 0.27513790933717885, 'adx_thresh': 11.239701129872381, 'atr_min_pct': 0.021634820557130383, 'atr_max_pct': 0.14431083475715936, 'tp_mult': 2.608492563677213, 'tsl_mult': 0.5149015857831426, 'strategy': 'breakout', 'time_stop': 29, 'use_sma': False, 'use_atr': True, 'use_adx': False, 'use_ema': True, 'use_spike': True, 'rsi_required': False, 'edge_k': 1.9082176778860038, 'edge_cap': 0.07057740607736405, 'bull_strategy': 'mean_reversion', 'bull_bb_std_mult': 2.824232115876303, 'bull_rsi_os': 23, 'bull_rsi_ob': 68, 'bull_adx_thresh': 30.61353897662027, 'bull_atr_min_pct': 0.003828587196336013, 'bull_atr_max_pct': 0.11227465369638234, 'bull_tp_mult': 1.9149057836491439, 'bull_tsl_mult': 0.6227120738825378, 'bull_time_stop': 152, 'bull_use_sma': False, 'bull_use_ema': False, 'bull_use_atr': False, 'bull_use_adx': True, 'bull_use_spike': True, 'bull_rsi_required': False, 'bear_strategy': 'mean_reversion', 'bear_bb_std_mult': 3.108596840841618, 'bear_rsi_os': 48, 'bear_rsi_ob': 93, 'bear_adx_thresh': 19.513430199568887, 'bear_atr_min_pct': 0.023416616861042065, 'bear_atr_max_pct': 0.135005991173141, 'bear_tp_mult': 1.802420725496605, 'bear_tsl_mult': 0.00032280186519179077, 'bear_time_stop': 88, 'bear_use_sma': False, 'bear_use_ema': False, 'bear_use_atr': True, 'bear_use_adx': True, 'bear_use_spike': True, 'bear_rsi_required': False, 'sideways_strategy': 'breakout', 'sideways_bb_std_mult': 3.4924259071426738, 'sideways_rsi_os': 14, 'sideways_rsi_ob': 86, 'sideways_adx_thresh': 7.197846851759749, 'sideways_atr_min_pct': 0.02262896903546509, 'sideways_atr_max_pct': 0.13378384848303285, 'sideways_tp_mult': 2.9073506874808346, 'sideways_tsl_mult': 0.11866613169549817, 'sideways_time_stop': 42, 'sideways_use_sma': False, 'sideways_use_ema': True, 'sideways_use_atr': True, 'sideways_use_adx': True, 'sideways_use_spike': True, 'sideways_rsi_required': False}.
[I 2025-09-01 07:45:05,599] Trial 152 finished with values: [-1000000000.0, 1000000000.0] and parameters: {'p_sma': 9, 'p_std': 16, 'p_atr': 24, 'p_adx': 20, 'rsi_period': 30, 'ema1': 7, 'ema2': 12, 'slip_atr_k': 0.21999029484607496, 'slip_spread_k': 0.6548799218746713, 'spread_hl_frac': 0.026239590963327807, 'bb_std_mult': 0.9266218010528671, 'rsi_os': 21, 'rsi_ob': 53, 'vol_spike': 0.2765727083713703, 'adx_thresh': 5.242654424731244, 'atr_min_pct': 0.021633304229908973, 'atr_max_pct': 0.036132313831335444, 'tp_mult': 2.5504523333210054, 'tsl_mult': 0.4603796943491086, 'strategy': 'mean_reversion', 'time_stop': 7, 'use_sma': True, 'use_atr': True, 'use_adx': True, 'use_ema': False, 'use_spike': True, 'rsi_required': False, 'edge_k': 0.7112558466526839, 'edge_cap': 0.5003318572995465, 'bull_strategy': 'breakout', 'bull_bb_std_mult': 2.5914648265817384, 'bull_rsi_os': 8, 'bull_rsi_ob': 55, 'bull_adx_thresh': 33.97076121194857, 'bull_atr_min_pct': 0.008712348330186201, 'bull_atr_max_pct': 0.14779473422443803, 'bull_tp_mult': 2.532502465574403, 'bull_tsl_mult': 0.5315452135228537, 'bull_time_stop': 164, 'bull_use_sma': True, 'bull_use_ema': False, 'bull_use_atr': False, 'bull_use_adx': True, 'bull_use_spike': True, 'bull_rsi_required': False, 'bear_strategy': 'mean_reversion', 'bear_bb_std_mult': 2.9270814228023108, 'bear_rsi_os': 47, 'bear_rsi_ob': 68, 'bear_adx_thresh': 25.829358173294235, 'bear_atr_min_pct': 0.0229959921499852, 'bear_atr_max_pct': 0.13816013038516595, 'bear_tp_mult': 2.7031538059873084, 'bear_tsl_mult': 0.39880310931969876, 'bear_time_stop': 90, 'bear_use_sma': False, 'bear_use_ema': False, 'bear_use_atr': True, 'bear_use_adx': True, 'bear_use_spike': False, 'bear_rsi_required': False, 'sideways_strategy': 'breakout', 'sideways_bb_std_mult': 2.617284939974431, 'sideways_rsi_os': 42, 'sideways_rsi_ob': 86, 'sideways_adx_thresh': 11.580895391536552, 'sideways_atr_min_pct': 0.01589936146810498, 'sideways_atr_max_pct': 0.03645400823776532, 'sideways_tp_mult': 1.1498325398654412, 'sideways_tsl_mult': 0.22318313822531205, 'sideways_time_stop': 9, 'sideways_use_sma': False, 'sideways_use_ema': True, 'sideways_use_atr': True, 'sideways_use_adx': True, 'sideways_use_spike': True, 'sideways_rsi_required': False}.
[I 2025-09-01 07:45:46,162] Trial 157 finished with values: [-1000000000.0, 1000000000.0] and parameters: {'p_sma': 20, 'p_std': 51, 'p_atr': 12, 'p_adx': 12, 'rsi_period': 39, 'ema1': 7, 'ema2': 11, 'slip_atr_k': 0.06333570764470253, 'slip_spread_k': 0.8316165455155933, 'spread_hl_frac': 0.0037905211244743595, 'bb_std_mult': 3.482317260952148, 'rsi_os': 39, 'rsi_ob': 85, 'vol_spike': 0.2086403059151383, 'adx_thresh': 26.259661221748743, 'atr_min_pct': 0.026255648703567204, 'atr_max_pct': 0.14381254232030447, 'tp_mult': 1.6718054249636725, 'tsl_mult': 0.5209670003738895, 'strategy': 'mean_reversion', 'time_stop': 232, 'use_sma': True, 'use_atr': True, 'use_adx': True, 'use_ema': False, 'use_spike': True, 'rsi_required': False, 'edge_k': 1.02436726248907, 'edge_cap': 0.06633521842819412, 'bull_strategy': 'breakout', 'bull_bb_std_mult': 2.83045284905872, 'bull_rsi_os': 23, 'bull_rsi_ob': 68, 'bull_adx_thresh': 31.013738395273, 'bull_atr_min_pct': 0.011307404328874287, 'bull_atr_max_pct': 0.13177369303386674, 'bull_tp_mult': 1.0214568775411745, 'bull_tsl_mult': 0.7317468230744482, 'bull_time_stop': 135, 'bull_use_sma': True, 'bull_use_ema': False, 'bull_use_atr': True, 'bull_use_adx': True, 'bull_use_spike': False, 'bull_rsi_required': False, 'bear_strategy': 'mean_reversion', 'bear_bb_std_mult': 2.8063907299893245, 'bear_rsi_os': 48, 'bear_rsi_ob': 93, 'bear_adx_thresh': 18.48862252460233, 'bear_atr_min_pct': 0.02829721236032566, 'bear_atr_max_pct': 0.1067789258291918, 'bear_tp_mult': 1.7824611154436147, 'bear_tsl_mult': 0.11747606013121695, 'bear_time_stop': 162, 'bear_use_sma': False, 'bear_use_ema': False, 'bear_use_atr': True, 'bear_use_adx': True, 'bear_use_spike': True, 'bear_rsi_required': False, 'sideways_strategy': 'breakout', 'sideways_bb_std_mult': 0.6774957319202024, 'sideways_rsi_os': 35, 'sideways_rsi_ob': 95, 'sideways_adx_thresh': 9.027223261736571, 'sideways_atr_min_pct': 0.021186209943134127, 'sideways_atr_max_pct': 0.03968039761756352, 'sideways_tp_mult': 2.718836861571343, 'sideways_tsl_mult': 0.11743993132136171, 'sideways_time_stop': 41, 'sideways_use_sma': False, 'sideways_use_ema': False, 'sideways_use_atr': True, 'sideways_use_adx': True, 'sideways_use_spike': True, 'sideways_rsi_required': False}.
[I 2025-09-01 07:45:46,187] Trial 156 finished with values: [-1000000000.0, 1000000000.0] and parameters: {'p_sma': 20, 'p_std': 17, 'p_atr': 12, 'p_adx': 12, 'rsi_period': 11, 'ema1': 9, 'ema2': 11, 'slip_atr_k': 0.0385192654046759, 'slip_spread_k': 0.828393387089833, 'spread_hl_frac': 0.02420487190748735, 'bb_std_mult': 0.64272231862628, 'rsi_os': 39, 'rsi_ob': 59, 'vol_spike': 0.20545050326849593, 'adx_thresh': 5.007701925350622, 'atr_min_pct': 0.02166487643995208, 'atr_max_pct': 0.14693929821554017, 'tp_mult': 1.676153382858463, 'tsl_mult': 0.5008630174284889, 'strategy': 'mean_reversion', 'time_stop': 235, 'use_sma': True, 'use_atr': True, 'use_adx': True, 'use_ema': False, 'use_spike': True, 'rsi_required': False, 'edge_k': 1.7506605963869917, 'edge_cap': 0.07005329094320323, 'bull_strategy': 'breakout', 'bull_bb_std_mult': 0.911935313800508, 'bull_rsi_os': 14, 'bull_rsi_ob': 70, 'bull_adx_thresh': 28.19282920425983, 'bull_atr_min_pct': 0.011626649156445798, 'bull_atr_max_pct': 0.040183353458602564, 'bull_tp_mult': 1.9082748295091172, 'bull_tsl_mult': 0.623969530406516, 'bull_time_stop': 153, 'bull_use_sma': True, 'bull_use_ema': False, 'bull_use_atr': True, 'bull_use_adx': True, 'bull_use_spike': False, 'bull_rsi_required': False, 'bear_strategy': 'mean_reversion', 'bear_bb_std_mult': 3.0863691870236285, 'bear_rsi_os': 35, 'bear_rsi_ob': 93, 'bear_adx_thresh': 18.702186624476976, 'bear_atr_min_pct': 0.023463526996167227, 'bear_atr_max_pct': 0.019579189946869628, 'bear_tp_mult': 1.2615068426592244, 'bear_tsl_mult': 0.10352976630958843, 'bear_time_stop': 198, 'bear_use_sma': False, 'bear_use_ema': False, 'bear_use_atr': True, 'bear_use_adx': True, 'bear_use_spike': True, 'bear_rsi_required': False, 'sideways_strategy': 'breakout', 'sideways_bb_std_mult': 2.9866975449284743, 'sideways_rsi_os': 38, 'sideways_rsi_ob': 70, 'sideways_adx_thresh': 8.681492225762579, 'sideways_atr_min_pct': 0.022736056185658972, 'sideways_atr_max_pct': 0.12639666320906887, 'sideways_tp_mult': 2.7269901952862323, 'sideways_tsl_mult': 0.2495968382049366, 'sideways_time_stop': 38, 'sideways_use_sma': False, 'sideways_use_ema': False, 'sideways_use_atr': True, 'sideways_use_adx': True, 'sideways_use_spike': True, 'sideways_rsi_required': False}.
[I 2025-09-01 07:45:46,161] Trial 159 finished with values: [-1000000000.0, 1000000000.0] and parameters: {'p_sma': 22, 'p_std': 12, 'p_atr': 19, 'p_adx': 11, 'rsi_period': 41, 'ema1': 29, 'ema2': 30, 'slip_atr_k': 0.06440709636127007, 'slip_spread_k': 0.8852594511573524, 'spread_hl_frac': 0.0040617175475966966, 'bb_std_mult': 3.4752894903176474, 'rsi_os': 40, 'rsi_ob': 59, 'vol_spike': 0.2075556118231121, 'adx_thresh': 11.261496968856271, 'atr_min_pct': 0.0060097206310792545, 'atr_max_pct': 0.055225404365422545, 'tp_mult': 1.2257593032042395, 'tsl_mult': 0.9417811776006235, 'strategy': 'breakout', 'time_stop': 234, 'use_sma': False, 'use_atr': True, 'use_adx': False, 'use_ema': True, 'use_spike': True, 'rsi_required': True, 'edge_k': 1.033102671846915, 'edge_cap': 0.6859268624529388, 'bull_strategy': 'mean_reversion', 'bull_bb_std_mult': 2.8139057049719707, 'bull_rsi_os': 23, 'bull_rsi_ob': 68, 'bull_adx_thresh': 30.918612273745676, 'bull_atr_min_pct': 0.011159597274348778, 'bull_atr_max_pct': 0.040503743128857427, 'bull_tp_mult': 2.0873858240628738, 'bull_tsl_mult': 0.7642445180887701, 'bull_time_stop': 99, 'bull_use_sma': False, 'bull_use_ema': False, 'bull_use_atr': False, 'bull_use_adx': True, 'bull_use_spike': True, 'bull_rsi_required': False, 'bear_strategy': 'mean_reversion', 'bear_bb_std_mult': 3.095666253750042, 'bear_rsi_os': 32, 'bear_rsi_ob': 93, 'bear_adx_thresh': 31.391638081878575, 'bear_atr_min_pct': 0.02329516382791738, 'bear_atr_max_pct': 0.10827305520084998, 'bear_tp_mult': 1.8015400823429981, 'bear_tsl_mult': 0.16380860997091273, 'bear_time_stop': 121, 'bear_use_sma': False, 'bear_use_ema': False, 'bear_use_atr': True, 'bear_use_adx': True, 'bear_use_spike': True, 'bear_rsi_required': False, 'sideways_strategy': 'breakout', 'sideways_bb_std_mult': 3.0494926725497455, 'sideways_rsi_os': 9, 'sideways_rsi_ob': 95, 'sideways_adx_thresh': 8.642282791338392, 'sideways_atr_min_pct': 0.021052287667758695, 'sideways_atr_max_pct': 0.018445775753550178, 'sideways_tp_mult': 2.7236431880576917, 'sideways_tsl_mult': 0.15943325744595013, 'sideways_time_stop': 35, 'sideways_use_sma': False, 'sideways_use_ema': False, 'sideways_use_atr': True, 'sideways_use_adx': False, 'sideways_use_spike': False, 'sideways_rsi_required': False}.
[I 2025-09-01 07:45:46,678] Trial 158 finished with values: [-0.1576518020400316, 0.15749863080402834] and parameters: {'p_sma': 20, 'p_std': 15, 'p_atr': 20, 'p_adx': 12, 'rsi_period': 40, 'ema1': 29, 'ema2': 11, 'slip_atr_k': 0.0639415736420401, 'slip_spread_k': 0.627190936618054, 'spread_hl_frac': 0.010346371974056268, 'bb_std_mult': 3.4853500249517353, 'rsi_os': 39, 'rsi_ob': 59, 'vol_spike': 0.20159803980605534, 'adx_thresh': 26.133908778278805, 'atr_min_pct': 0.029992576134314563, 'atr_max_pct': 0.05576285979021675, 'tp_mult': 1.2341788269359304, 'tsl_mult': 0.5005733602528648, 'strategy': 'breakout', 'time_stop': 237, 'use_sma': False, 'use_atr': True, 'use_adx': False, 'use_ema': True, 'use_spike': True, 'rsi_required': True, 'edge_k': 1.964083671770131, 'edge_cap': 0.6940168578952823, 'bull_strategy': 'mean_reversion', 'bull_bb_std_mult': 0.5049514217488364, 'bull_rsi_os': 23, 'bull_rsi_ob': 68, 'bull_adx_thresh': 28.59775293831791, 'bull_atr_min_pct': 0.0008557222606600072, 'bull_atr_max_pct': 0.04047975380287669, 'bull_tp_mult': 2.0678790150642885, 'bull_tsl_mult': 0.50065731403567, 'bull_time_stop': 96, 'bull_use_sma': False, 'bull_use_ema': False, 'bull_use_atr': False, 'bull_use_adx': True, 'bull_use_spike': True, 'bull_rsi_required': False, 'bear_strategy': 'mean_reversion', 'bear_bb_std_mult': 3.117544365841632, 'bear_rsi_os': 17, 'bear_rsi_ob': 93, 'bear_adx_thresh': 30.674195358224665, 'bear_atr_min_pct': 0.026277565679129387, 'bear_atr_max_pct': 0.08140844126016883, 'bear_tp_mult': 1.5044245383034898, 'bear_tsl_mult': 0.1639029339703869, 'bear_time_stop': 192, 'bear_use_sma': False, 'bear_use_ema': False, 'bear_use_atr': True, 'bear_use_adx': True, 'bear_use_spike': True, 'bear_rsi_required': False, 'sideways_strategy': 'breakout', 'sideways_bb_std_mult': 3.0871625566943344, 'sideways_rsi_os': 35, 'sideways_rsi_ob': 84, 'sideways_adx_thresh': 33.711787757158646, 'sideways_atr_min_pct': 0.021055427193636556, 'sideways_atr_max_pct': 0.0889581836861757, 'sideways_tp_mult': 2.7253793997955036, 'sideways_tsl_mult': 0.2494350481609387, 'sideways_time_stop': 41, 'sideways_use_sma': False, 'sideways_use_ema': False, 'sideways_use_atr': True, 'sideways_use_adx': False, 'sideways_use_spike': False, 'sideways_rsi_required': False}.
[I 2025-09-01 07:46:28,324] Trial 162 finished with values: [-1000000000.0, 1000000000.0] and parameters: {'p_sma': 15, 'p_std': 41, 'p_atr': 21, 'p_adx': 17, 'rsi_period': 64, 'ema1': 10, 'ema2': 14, 'slip_atr_k': 0.05535592631212162, 'slip_spread_k': 0.7383178829127589, 'spread_hl_frac': 0.027136573588111036, 'bb_std_mult': 1.1172848845773733, 'rsi_os': 19, 'rsi_ob': 65, 'vol_spike': 0.23378142760453444, 'adx_thresh': 34.82129096904553, 'atr_min_pct': 0.01712587165248714, 'atr_max_pct': 0.1499078691257774, 'tp_mult': 1.8492871746563644, 'tsl_mult': 0.8693445596154863, 'strategy': 'breakout', 'time_stop': 267, 'use_sma': False, 'use_atr': True, 'use_adx': False, 'use_ema': True, 'use_spike': True, 'rsi_required': True, 'edge_k': 1.9550546595547926, 'edge_cap': 0.20640409627275402, 'bull_strategy': 'mean_reversion', 'bull_bb_std_mult': 0.5034647992411625, 'bull_rsi_os': 21, 'bull_rsi_ob': 49, 'bull_adx_thresh': 9.135870877261688, 'bull_atr_min_pct': 0.018556790563945835, 'bull_atr_max_pct': 0.06000699102047506, 'bull_tp_mult': 1.4113300400752484, 'bull_tsl_mult': 0.2829826261842195, 'bull_time_stop': 87, 'bull_use_sma': False, 'bull_use_ema': False, 'bull_use_atr': False, 'bull_use_adx': True, 'bull_use_spike': True, 'bull_rsi_required': True, 'bear_strategy': 'mean_reversion', 'bear_bb_std_mult': 1.004341503351204, 'bear_rsi_os': 8, 'bear_rsi_ob': 91, 'bear_adx_thresh': 30.62690082911851, 'bear_atr_min_pct': 0.02631980699215988, 'bear_atr_max_pct': 0.07270621302066063, 'bear_tp_mult': 2.646080222872564, 'bear_tsl_mult': 0.022328889126943974, 'bear_time_stop': 71, 'bear_use_sma': False, 'bear_use_ema': False, 'bear_use_atr': True, 'bear_use_adx': True, 'bear_use_spike': True, 'bear_rsi_required': False, 'sideways_strategy': 'mean_reversion', 'sideways_bb_std_mult': 0.7712186053004545, 'sideways_rsi_os': 14, 'sideways_rsi_ob': 84, 'sideways_adx_thresh': 15.51802680845568, 'sideways_atr_min_pct': 0.009262080233611374, 'sideways_atr_max_pct': 0.025526069984812584, 'sideways_tp_mult': 1.6172474641157566, 'sideways_tsl_mult': 0.9675730624213297, 'sideways_time_stop': 257, 'sideways_use_sma': False, 'sideways_use_ema': False, 'sideways_use_atr': False, 'sideways_use_adx': False, 'sideways_use_spike': False, 'sideways_rsi_required': False}.
[I 2025-09-01 07:46:28,873] Trial 161 finished with values: [-1000000000.0, 1000000000.0] and parameters: {'p_sma': 5, 'p_std': 56, 'p_atr': 21, 'p_adx': 19, 'rsi_period': 64, 'ema1': 10, 'ema2': 40, 'slip_atr_k': 0.11893493627914553, 'slip_spread_k': 0.7019917025304331, 'spread_hl_frac': 0.010681248626734708, 'bb_std_mult': 3.3867124698750195, 'rsi_os': 23, 'rsi_ob': 57, 'vol_spike': 0.23435092775410793, 'adx_thresh': 22.900493751109206, 'atr_min_pct': 0.027398467342875252, 'atr_max_pct': 0.14480411042494468, 'tp_mult': 1.3288835337791745, 'tsl_mult': 0.7097044504688694, 'strategy': 'breakout', 'time_stop': 277, 'use_sma': False, 'use_atr': True, 'use_adx': False, 'use_ema': True, 'use_spike': True, 'rsi_required': True, 'edge_k': 1.1397650966025143, 'edge_cap': 0.2114288795060725, 'bull_strategy': 'mean_reversion', 'bull_bb_std_mult': 2.77791633268572, 'bull_rsi_os': 19, 'bull_rsi_ob': 64, 'bull_adx_thresh': 6.592911920139079, 'bull_atr_min_pct': 0.001156657747213552, 'bull_atr_max_pct': 0.1135268288764884, 'bull_tp_mult': 1.4301796817320866, 'bull_tsl_mult': 0.504202775895905, 'bull_time_stop': 159, 'bull_use_sma': False, 'bull_use_ema': False, 'bull_use_atr': False, 'bull_use_adx': True, 'bull_use_spike': True, 'bull_rsi_required': True, 'bear_strategy': 'mean_reversion', 'bear_bb_std_mult': 1.0364327469747554, 'bear_rsi_os': 17, 'bear_rsi_ob': 61, 'bear_adx_thresh': 30.27901626517783, 'bear_atr_min_pct': 0.02142169402142489, 'bear_atr_max_pct': 0.08231142215759502, 'bear_tp_mult': 2.6323207262122, 'bear_tsl_mult': 0.9836380570395947, 'bear_time_stop': 107, 'bear_use_sma': False, 'bear_use_ema': False, 'bear_use_atr': True, 'bear_use_adx': True, 'bear_use_spike': True, 'bear_rsi_required': False, 'sideways_strategy': 'mean_reversion', 'sideways_bb_std_mult': 3.487847398407447, 'sideways_rsi_os': 14, 'sideways_rsi_ob': 77, 'sideways_adx_thresh': 7.134110888875087, 'sideways_atr_min_pct': 0.008255466224158767, 'sideways_atr_max_pct': 0.09541462923515971, 'sideways_tp_mult': 2.931924597086141, 'sideways_tsl_mult': 0.9752492947285998, 'sideways_time_stop': 255, 'sideways_use_sma': False, 'sideways_use_ema': False, 'sideways_use_atr': False, 'sideways_use_adx': False, 'sideways_use_spike': False, 'sideways_rsi_required': False}.
