[I 2025-09-01 07:25:13,419] Trial 35 finished with values: [-0.050024016728493215, 0.0510589662999099] and parameters: {'p_sma': 53, 'p_std': 46, 'p_atr': 25, 'p_adx': 12, 'rsi_period': 27, 'ema1': 23, 'ema2': 15, 'slip_atr_k': 0.09950500354070979, 'slip_spread_k': 0.026671255996215115, 'spread_hl_frac': 0.035974637286459304, 'bb_std_mult': 2.243819626781807, 'rsi_os': 28, 'rsi_ob': 60, 'vol_spike': 0.1574670340838641, 'adx_thresh': 11.409902949942238, 'atr_min_pct': 0.016670593573238454, 'atr_max_pct': 0.14129673437265813, 'tp_mult': 1.339657604776343, 'tsl_mult': 0.10349539257832839, 'strategy': 'mean_reversion', 'time_stop': 22, 'use_sma': True, 'use_atr': True, 'use_adx': False, 'use_ema': False, 'use_spike': False, 'rsi_required': False, 'edge_k': 1.2186055658853951, 'edge_cap': 0.6385030384873954, 'bull_strategy': 'breakout', 'bull_bb_std_mult': 1.3013003291788994, 'bull_rsi_os': 21, 'bull_rsi_ob': 72, 'bull_adx_thresh': 22.136256223602924, 'bull_atr_min_pct': 0.0035086156372266955, 'bull_atr_max_pct': 0.039691910884501656, 'bull_tp_mult': 2.4991496501955597, 'bull_tsl_mult': 0.6151046115096444, 'bull_time_stop': 34, 'bull_use_sma': True, 'bull_use_ema': False, 'bull_use_atr': True, 'bull_use_adx': False, 'bull_use_spike': False, 'bull_rsi_required': True, 'bear_strategy': 'breakout', 'bear_bb_std_mult': 2.6725168416306198, 'bear_rsi_os': 27, 'bear_rsi_ob': 55, 'bear_adx_thresh': 17.454454339712193, 'bear_atr_min_pct': 0.004473272318499772, 'bear_atr_max_pct': 0.035383075514997586, 'bear_tp_mult': 2.1157906690394563, 'bear_tsl_mult': 0.5795498654542113, 'bear_time_stop': 89, 'bear_use_sma': False, 'bear_use_ema': False, 'bear_use_atr': False, 'bear_use_adx': True, 'bear_use_spike': True, 'bear_rsi_required': True, 'sideways_strategy': 'breakout', 'sideways_bb_std_mult': 1.7042795455736561, 'sideways_rsi_os': 44, 'sideways_rsi_ob': 66, 'sideways_adx_thresh': 20.19057104528562, 'sideways_atr_min_pct': 0.02889345266502873, 'sideways_atr_max_pct': 0.13463479780586146, 'sideways_tp_mult': 1.7168193204491038, 'sideways_tsl_mult': 0.8981958530424752, 'sideways_time_stop': 122, 'sideways_use_sma': False, 'sideways_use_ema': True, 'sideways_use_atr': True, 'sideways_use_adx': True, 'sideways_use_spike': True, 'sideways_rsi_required': False}.
[I 2025-09-01 07:25:13,820] Trial 34 finished with values: [-0.051291462641568475, 0.0525091911725203] and parameters: {'p_sma': 52, 'p_std': 45, 'p_atr': 28, 'p_adx': 12, 'rsi_period': 27, 'ema1': 23, 'ema2': 15, 'slip_atr_k': 0.10131300150412981, 'slip_spread_k': 0.03960728229940382, 'spread_hl_frac': 0.027984603097492636, 'bb_std_mult': 2.3475392018647465, 'rsi_os': 27, 'rsi_ob': 67, 'vol_spike': 0.14954379527238168, 'adx_thresh': 11.534547127472898, 'atr_min_pct': 0.011304265954519346, 'atr_max_pct': 0.13631564219312534, 'tp_mult': 1.663856069556495, 'tsl_mult': 0.0952815389166837, 'strategy': 'mean_reversion', 'time_stop': 139, 'use_sma': True, 'use_atr': True, 'use_adx': False, 'use_ema': False, 'use_spike': False, 'rsi_required': False, 'edge_k': 1.175463624955624, 'edge_cap': 0.6447923560059894, 'bull_strategy': 'breakout', 'bull_bb_std_mult': 0.7408219703502843, 'bull_rsi_os': 20, 'bull_rsi_ob': 72, 'bull_adx_thresh': 22.15463730011788, 'bull_atr_min_pct': 0.0032456173308472403, 'bull_atr_max_pct': 0.10697826852476425, 'bull_tp_mult': 2.487072496736597, 'bull_tsl_mult': 0.613804472700781, 'bull_time_stop': 37, 'bull_use_sma': True, 'bull_use_ema': False, 'bull_use_atr': True, 'bull_use_adx': True, 'bull_use_spike': False, 'bull_rsi_required': True, 'bear_strategy': 'breakout', 'bear_bb_std_mult': 2.700554090150614, 'bear_rsi_os': 28, 'bear_rsi_ob': 95, 'bear_adx_thresh': 25.55247214292628, 'bear_atr_min_pct': 0.004640543427967988, 'bear_atr_max_pct': 0.035717436049450824, 'bear_tp_mult': 2.143755114427738, 'bear_tsl_mult': 0.19858560676867731, 'bear_time_stop': 80, 'bear_use_sma': False, 'bear_use_ema': False, 'bear_use_atr': True, 'bear_use_adx': True, 'bear_use_spike': False, 'bear_rsi_required': True, 'sideways_strategy': 'breakout', 'sideways_bb_std_mult': 1.6085896971410842, 'sideways_rsi_os': 50, 'sideways_rsi_ob': 66, 'sideways_adx_thresh': 19.018937362965268, 'sideways_atr_min_pct': 0.02935986446033629, 'sideways_atr_max_pct': 0.07237394732043115, 'sideways_tp_mult': 1.1142348185658146, 'sideways_tsl_mult': 0.8926370083699086, 'sideways_time_stop': 120, 'sideways_use_sma': True, 'sideways_use_ema': True, 'sideways_use_atr': True, 'sideways_use_adx': True, 'sideways_use_spike': True, 'sideways_rsi_required': False}.
[I 2025-09-01 07:25:16,175] Trial 38 finished with values: [-0.030687672705255187, 0.03117482193156747] and parameters: {'p_sma': 44, 'p_std': 33, 'p_atr': 28, 'p_adx': 8, 'rsi_period': 52, 'ema1': 26, 'ema2': 56, 'slip_atr_k': 0.07591056830953448, 'slip_spread_k': 0.6895131097687356, 'spread_hl_frac': 0.03567103739580446, 'bb_std_mult': 2.233516059063941, 'rsi_os': 41, 'rsi_ob': 60, 'vol_spike': 0.2596034831474264, 'adx_thresh': 15.063948043036508, 'atr_min_pct': 0.023955922825912326, 'atr_max_pct': 0.07852059470454567, 'tp_mult': 1.279844236777157, 'tsl_mult': 0.32979932587659966, 'strategy': 'mean_reversion', 'time_stop': 173, 'use_sma': True, 'use_atr': True, 'use_adx': False, 'use_ema': True, 'use_spike': False, 'rsi_required': False, 'edge_k': 0.8744994395178824, 'edge_cap': 0.9675997836963056, 'bull_strategy': 'breakout', 'bull_bb_std_mult': 1.7617201092706718, 'bull_rsi_os': 48, 'bull_rsi_ob': 79, 'bull_adx_thresh': 17.263511158578133, 'bull_atr_min_pct': 0.003632504965501806, 'bull_atr_max_pct': 0.10876301239373543, 'bull_tp_mult': 2.4904439962785894, 'bull_tsl_mult': 0.4807902980901958, 'bull_time_stop': 42, 'bull_use_sma': True, 'bull_use_ema': False, 'bull_use_atr': False, 'bull_use_adx': True, 'bull_use_spike': True, 'bull_rsi_required': True, 'bear_strategy': 'breakout', 'bear_bb_std_mult': 2.4865867305222387, 'bear_rsi_os': 42, 'bear_rsi_ob': 72, 'bear_adx_thresh': 25.12239418384936, 'bear_atr_min_pct': 0.00829771587403079, 'bear_atr_max_pct': 0.010765875043628415, 'bear_tp_mult': 2.400402607436685, 'bear_tsl_mult': 0.5807037435122242, 'bear_time_stop': 236, 'bear_use_sma': False, 'bear_use_ema': False, 'bear_use_atr': True, 'bear_use_adx': True, 'bear_use_spike': False, 'bear_rsi_required': True, 'sideways_strategy': 'breakout', 'sideways_bb_std_mult': 0.7853754038815202, 'sideways_rsi_os': 43, 'sideways_rsi_ob': 67, 'sideways_adx_thresh': 17.535922825075183, 'sideways_atr_min_pct': 0.02005378601824215, 'sideways_atr_max_pct': 0.11266047607152693, 'sideways_tp_mult': 1.719648119523335, 'sideways_tsl_mult': 0.7295283147499491, 'sideways_time_stop': 117, 'sideways_use_sma': True, 'sideways_use_ema': False, 'sideways_use_atr': True, 'sideways_use_adx': True, 'sideways_use_spike': True, 'sideways_rsi_required': False}.
[I 2025-09-01 07:25:44,532] Trial 39 finished with values: [-1000000000.0, 1000000000.0] and parameters: {'p_sma': 43, 'p_std': 34, 'p_atr': 28, 'p_adx': 21, 'rsi_period': 54, 'ema1': 14, 'ema2': 12, 'slip_atr_k': 0.06929679919198431, 'slip_spread_k': 0.7286335184043402, 'spread_hl_frac': 0.03585033543449296, 'bb_std_mult': 2.2626867256924417, 'rsi_os': 30, 'rsi_ob': 53, 'vol_spike': 0.1317471118549429, 'adx_thresh': 22.04271000378563, 'atr_min_pct': 0.00912691757109917, 'atr_max_pct': 0.0754485728858132, 'tp_mult': 1.240265509138261, 'tsl_mult': 0.10691657882062586, 'strategy': 'mean_reversion', 'time_stop': 185, 'use_sma': True, 'use_atr': False, 'use_adx': False, 'use_ema': True, 'use_spike': False, 'rsi_required': False, 'edge_k': 1.1637977029650572, 'edge_cap': 0.9119297456068706, 'bull_strategy': 'breakout', 'bull_bb_std_mult': 1.7908177455323449, 'bull_rsi_os': 48, 'bull_rsi_ob': 64, 'bull_adx_thresh': 9.579025287179174, 'bull_atr_min_pct': 0.023079410573579706, 'bull_atr_max_pct': 0.04171110050486108, 'bull_tp_mult': 2.23559929605477, 'bull_tsl_mult': 0.8521208471577902, 'bull_time_stop': 184, 'bull_use_sma': True, 'bull_use_ema': True, 'bull_use_atr': False, 'bull_use_adx': False, 'bull_use_spike': True, 'bull_rsi_required': False, 'bear_strategy': 'breakout', 'bear_bb_std_mult': 2.3513998698802134, 'bear_rsi_os': 19, 'bear_rsi_ob': 51, 'bear_adx_thresh': 6.083426026037272, 'bear_atr_min_pct': 0.018668457782794835, 'bear_atr_max_pct': 0.04327671052530935, 'bear_tp_mult': 2.9980064524761776, 'bear_tsl_mult': 0.08567962596112273, 'bear_time_stop': 75, 'bear_use_sma': True, 'bear_use_ema': True, 'bear_use_atr': False, 'bear_use_adx': False, 'bear_use_spike': True, 'bear_rsi_required': True, 'sideways_strategy': 'mean_reversion', 'sideways_bb_std_mult': 2.8306484395155076, 'sideways_rsi_os': 26, 'sideways_rsi_ob': 55, 'sideways_adx_thresh': 13.705983552984, 'sideways_atr_min_pct': 0.027496461117748606, 'sideways_atr_max_pct': 0.051929117894874637, 'sideways_tp_mult': 2.4212635732517955, 'sideways_tsl_mult': 0.7214260568121658, 'sideways_time_stop': 162, 'sideways_use_sma': True, 'sideways_use_ema': False, 'sideways_use_atr': False, 'sideways_use_adx': True, 'sideways_use_spike': True, 'sideways_rsi_required': True}.
[I 2025-09-01 07:25:56,807] Trial 40 finished with values: [-1000000000.0, 1000000000.0] and parameters: {'p_sma': 43, 'p_std': 33, 'p_atr': 26, 'p_adx': 21, 'rsi_period': 27, 'ema1': 14, 'ema2': 11, 'slip_atr_k': 0.07242014372644962, 'slip_spread_k': 0.6772515638639449, 'spread_hl_frac': 0.03589998226906958, 'bb_std_mult': 2.1314684913456947, 'rsi_os': 29, 'rsi_ob': 54, 'vol_spike': 0.045278993246212915, 'adx_thresh': 23.233315313843356, 'atr_min_pct': 0.009652496987656805, 'atr_max_pct': 0.07629128910809085, 'tp_mult': 1.2156864220600363, 'tsl_mult': 0.0003012410786824987, 'strategy': 'mean_reversion', 'time_stop': 274, 'use_sma': True, 'use_atr': False, 'use_adx': True, 'use_ema': True, 'use_spike': True, 'rsi_required': False, 'edge_k': 1.1732409271876283, 'edge_cap': 0.8041145415068339, 'bull_strategy': 'breakout', 'bull_bb_std_mult': 1.6927456218386923, 'bull_rsi_os': 52, 'bull_rsi_ob': 85, 'bull_adx_thresh': 9.299028310203834, 'bull_atr_min_pct': 0.023578354359010064, 'bull_atr_max_pct': 0.0444867638855341, 'bull_tp_mult': 2.186006306168124, 'bull_tsl_mult': 0.8218567692459762, 'bull_time_stop': 194, 'bull_use_sma': True, 'bull_use_ema': True, 'bull_use_atr': False, 'bull_use_adx': False, 'bull_use_spike': True, 'bull_rsi_required': False, 'bear_strategy': 'breakout', 'bear_bb_std_mult': 2.4913521464936728, 'bear_rsi_os': 19, 'bear_rsi_ob': 95, 'bear_adx_thresh': 12.97793998915176, 'bear_atr_min_pct': 0.017261061685683768, 'bear_atr_max_pct': 0.0760350562166989, 'bear_tp_mult': 2.7964472819717847, 'bear_tsl_mult': 0.27684760863577895, 'bear_time_stop': 66, 'bear_use_sma': True, 'bear_use_ema': True, 'bear_use_atr': False, 'bear_use_adx': False, 'bear_use_spike': True, 'bear_rsi_required': False, 'sideways_strategy': 'mean_reversion', 'sideways_bb_std_mult': 2.07435208519279, 'sideways_rsi_os': 27, 'sideways_rsi_ob': 53, 'sideways_adx_thresh': 12.459730235901661, 'sideways_atr_min_pct': 0.027878629156214044, 'sideways_atr_max_pct': 0.050064230457821116, 'sideways_tp_mult': 1.9921454746734153, 'sideways_tsl_mult': 0.720411518270587, 'sideways_time_stop': 146, 'sideways_use_sma': True, 'sideways_use_ema': False, 'sideways_use_atr': False, 'sideways_use_adx': True, 'sideways_use_spike': False, 'sideways_rsi_required': True}.
[I 2025-09-01 07:26:01,516] Trial 41 finished with values: [-0.025459705314747727, 0.02579068022941352] and parameters: {'p_sma': 22, 'p_std': 32, 'p_atr': 28, 'p_adx': 21, 'rsi_period': 51, 'ema1': 13, 'ema2': 14, 'slip_atr_k': 0.07100380264363174, 'slip_spread_k': 0.6838921122686261, 'spread_hl_frac': 0.04416316646861471, 'bb_std_mult': 2.107966315842475, 'rsi_os': 30, 'rsi_ob': 54, 'vol_spike': 0.13679899028166947, 'adx_thresh': 21.835756321681878, 'atr_min_pct': 0.010640701798062296, 'atr_max_pct': 0.14000799197343283, 'tp_mult': 1.2407857563274238, 'tsl_mult': 0.0010739891277780633, 'strategy': 'mean_reversion', 'time_stop': 179, 'use_sma': True, 'use_atr': False, 'use_adx': True, 'use_ema': True, 'use_spike': False, 'rsi_required': True, 'edge_k': 0.9487933530980538, 'edge_cap': 0.8357953506736916, 'bull_strategy': 'breakout', 'bull_bb_std_mult': 1.3442623235958933, 'bull_rsi_os': 52, 'bull_rsi_ob': 86, 'bull_adx_thresh': 9.074119034882735, 'bull_atr_min_pct': 0.0036139960048715315, 'bull_atr_max_pct': 0.046570431240892926, 'bull_tp_mult': 2.111561184369592, 'bull_tsl_mult': 0.6384880869773168, 'bull_time_stop': 176, 'bull_use_sma': True, 'bull_use_ema': True, 'bull_use_atr': False, 'bull_use_adx': False, 'bull_use_spike': True, 'bull_rsi_required': False, 'bear_strategy': 'breakout', 'bear_bb_std_mult': 2.3483255466121418, 'bear_rsi_os': 20, 'bear_rsi_ob': 49, 'bear_adx_thresh': 13.053171642153428, 'bear_atr_min_pct': 0.018416100282472075, 'bear_atr_max_pct': 0.07975595937686053, 'bear_tp_mult': 2.789301936394916, 'bear_tsl_mult': 0.25300649052836666, 'bear_time_stop': 79, 'bear_use_sma': True, 'bear_use_ema': True, 'bear_use_atr': False, 'bear_use_adx': False, 'bear_use_spike': True, 'bear_rsi_required': True, 'sideways_strategy': 'mean_reversion', 'sideways_bb_std_mult': 1.9898160783681913, 'sideways_rsi_os': 26, 'sideways_rsi_ob': 56, 'sideways_adx_thresh': 25.832141444843682, 'sideways_atr_min_pct': 0.02715474262699459, 'sideways_atr_max_pct': 0.05169831738178112, 'sideways_tp_mult': 2.0362625113338266, 'sideways_tsl_mult': 0.7372985778980667, 'sideways_time_stop': 157, 'sideways_use_sma': True, 'sideways_use_ema': False, 'sideways_use_atr': False, 'sideways_use_adx': True, 'sideways_use_spike': True, 'sideways_rsi_required': True}.
[I 2025-09-01 07:26:02,918] Trial 42 finished with values: [-1000000000.0, 1000000000.0] and parameters: {'p_sma': 55, 'p_std': 33, 'p_atr': 14, 'p_adx': 8, 'rsi_period': 51, 'ema1': 26, 'ema2': 57, 'slip_atr_k': 0.07074406547879185, 'slip_spread_k': 0.7009072672683225, 'spread_hl_frac': 0.04425233301281124, 'bb_std_mult': 2.0906667616414754, 'rsi_os': 30, 'rsi_ob': 60, 'vol_spike': 0.26105655138153694, 'adx_thresh': 23.18749023073979, 'atr_min_pct': 0.021796982634497544, 'atr_max_pct': 0.07762283109505456, 'tp_mult': 1.284669431884191, 'tsl_mult': 0.9998789369044325, 'strategy': 'mean_reversion', 'time_stop': 183, 'use_sma': True, 'use_atr': False, 'use_adx': True, 'use_ema': True, 'use_spike': False, 'rsi_required': True, 'edge_k': 0.9400375803630329, 'edge_cap': 0.9807827266845742, 'bull_strategy': 'breakout', 'bull_bb_std_mult': 1.8875108787149715, 'bull_rsi_os': 11, 'bull_rsi_ob': 78, 'bull_adx_thresh': 17.099601479919965, 'bull_atr_min_pct': 0.015678724166429146, 'bull_atr_max_pct': 0.09791875420320865, 'bull_tp_mult': 2.483930117952717, 'bull_tsl_mult': 0.5154936888036374, 'bull_time_stop': 182, 'bull_use_sma': True, 'bull_use_ema': True, 'bull_use_atr': False, 'bull_use_adx': False, 'bull_use_spike': True, 'bull_rsi_required': True, 'bear_strategy': 'breakout', 'bear_bb_std_mult': 2.333171167802816, 'bear_rsi_os': 43, 'bear_rsi_ob': 45, 'bear_adx_thresh': 5.072355827291444, 'bear_atr_min_pct': 0.008253274084219967, 'bear_atr_max_pct': 0.12406972011309932, 'bear_tp_mult': 2.4324857611492963, 'bear_tsl_mult': 0.5960527383149179, 'bear_time_stop': 291, 'bear_use_sma': False, 'bear_use_ema': True, 'bear_use_atr': False, 'bear_use_adx': False, 'bear_use_spike': False, 'bear_rsi_required': True, 'sideways_strategy': 'breakout', 'sideways_bb_std_mult': 0.7370367984525772, 'sideways_rsi_os': 28, 'sideways_rsi_ob': 55, 'sideways_adx_thresh': 12.586018400870799, 'sideways_atr_min_pct': 0.01958536572919338, 'sideways_atr_max_pct': 0.13510578870157647, 'sideways_tp_mult': 2.015140776341411, 'sideways_tsl_mult': 0.7424217265812887, 'sideways_time_stop': 149, 'sideways_use_sma': True, 'sideways_use_ema': False, 'sideways_use_atr': True, 'sideways_use_adx': True, 'sideways_use_spike': True, 'sideways_rsi_required': False}.
[I 2025-09-01 07:26:04,064] Trial 45 finished with values: [-1000000000.0, 1000000000.0] and parameters: {'p_sma': 19, 'p_std': 30, 'p_atr': 10, 'p_adx': 25, 'rsi_period': 50, 'ema1': 11, 'ema2': 15, 'slip_atr_k': 0.03310161100333074, 'slip_spread_k': 0.5220801408644397, 'spread_hl_frac': 0.04468232563360896, 'bb_std_mult': 1.834395137562653, 'rsi_os': 22, 'rsi_ob': 48, 'vol_spike': 0.13506487941705503, 'adx_thresh': 28.385343931198907, 'atr_min_pct': 0.01202654359673402, 'atr_max_pct': 0.14046175962399318, 'tp_mult': 1.0595192685234778, 'tsl_mult': 0.07873182240019118, 'strategy': 'mean_reversion', 'time_stop': 173, 'use_sma': True, 'use_atr': False, 'use_adx': True, 'use_ema': True, 'use_spike': False, 'rsi_required': True, 'edge_k': 0.932948166976891, 'edge_cap': 0.9581302344884742, 'bull_strategy': 'breakout', 'bull_bb_std_mult': 2.223532802291667, 'bull_rsi_os': 52, 'bull_rsi_ob': 86, 'bull_adx_thresh': 6.659530984418291, 'bull_atr_min_pct': 0.00417874028022976, 'bull_atr_max_pct': 0.06564132257119476, 'bull_tp_mult': 2.090325886151617, 'bull_tsl_mult': 0.677256773622484, 'bull_time_stop': 174, 'bull_use_sma': True, 'bull_use_ema': True, 'bull_use_atr': False, 'bull_use_adx': False, 'bull_use_spike': True, 'bull_rsi_required': False, 'bear_strategy': 'breakout', 'bear_bb_std_mult': 1.8746297125973572, 'bear_rsi_os': 28, 'bear_rsi_ob': 48, 'bear_adx_thresh': 13.695656718244757, 'bear_atr_min_pct': 0.019990311833325735, 'bear_atr_max_pct': 0.12962306273752827, 'bear_tp_mult': 2.73683136925851, 'bear_tsl_mult': 0.5647047528921625, 'bear_time_stop': 82, 'bear_use_sma': True, 'bear_use_ema': True, 'bear_use_atr': False, 'bear_use_adx': False, 'bear_use_spike': True, 'bear_rsi_required': True, 'sideways_strategy': 'mean_reversion', 'sideways_bb_std_mult': 1.9696868332651118, 'sideways_rsi_os': 24, 'sideways_rsi_ob': 47, 'sideways_adx_thresh': 27.140595086844854, 'sideways_atr_min_pct': 0.023657585157673567, 'sideways_atr_max_pct': 0.03652775351649924, 'sideways_tp_mult': 1.7470919697789784, 'sideways_tsl_mult': 0.5911783234378697, 'sideways_time_stop': 184, 'sideways_use_sma': True, 'sideways_use_ema': False, 'sideways_use_atr': False, 'sideways_use_adx': True, 'sideways_use_spike': True, 'sideways_rsi_required': True}.
[I 2025-09-01 07:26:37,403] Trial 43 finished with values: [-0.025878511696558193, 0.025557015909686672] and parameters: {'p_sma': 55, 'p_std': 12, 'p_atr': 10, 'p_adx': 8, 'rsi_period': 66, 'ema1': 26, 'ema2': 56, 'slip_atr_k': 0.031906847116112066, 'slip_spread_k': 0.6685678178510552, 'spread_hl_frac': 0.04491639865274847, 'bb_std_mult': 1.640617721766759, 'rsi_os': 5, 'rsi_ob': 60, 'vol_spike': 0.2564966071002933, 'adx_thresh': 15.250899005798036, 'atr_min_pct': 0.023849805170225242, 'atr_max_pct': 0.07129142007235138, 'tp_mult': 1.0543851509629838, 'tsl_mult': 0.47278279896308073, 'strategy': 'mean_reversion', 'time_stop': 175, 'use_sma': True, 'use_atr': True, 'use_adx': True, 'use_ema': True, 'use_spike': True, 'rsi_required': True, 'edge_k': 0.9911431355393794, 'edge_cap': 0.9919481004800457, 'bull_strategy': 'breakout', 'bull_bb_std_mult': 2.16311336695139, 'bull_rsi_os': 12, 'bull_rsi_ob': 80, 'bull_adx_thresh': 17.077093018023422, 'bull_atr_min_pct': 0.016488405881209034, 'bull_atr_max_pct': 0.09756000513842948, 'bull_tp_mult': 2.4941795231988997, 'bull_tsl_mult': 0.5078223764417622, 'bull_time_stop': 101, 'bull_use_sma': True, 'bull_use_ema': False, 'bull_use_atr': False, 'bull_use_adx': False, 'bull_use_spike': True, 'bull_rsi_required': True, 'bear_strategy': 'breakout', 'bear_bb_std_mult': 2.522238721235327, 'bear_rsi_os': 42, 'bear_rsi_ob': 94, 'bear_adx_thresh': 32.94040397168189, 'bear_atr_min_pct': 0.008398976049413113, 'bear_atr_max_pct': 0.04310175933093448, 'bear_tp_mult': 2.433976848149051, 'bear_tsl_mult': 0.5965243592548662, 'bear_time_stop': 293, 'bear_use_sma': False, 'bear_use_ema': False, 'bear_use_atr': True, 'bear_use_adx': False, 'bear_use_spike': False, 'bear_rsi_required': False, 'sideways_strategy': 'breakout', 'sideways_bb_std_mult': 1.126654922693868, 'sideways_rsi_os': 35, 'sideways_rsi_ob': 78, 'sideways_adx_thresh': 11.345995926418745, 'sideways_atr_min_pct': 0.005343351938000821, 'sideways_atr_max_pct': 0.11353184342583783, 'sideways_tp_mult': 2.041203254844077, 'sideways_tsl_mult': 0.5422597715549615, 'sideways_time_stop': 145, 'sideways_use_sma': True, 'sideways_use_ema': False, 'sideways_use_atr': True, 'sideways_use_adx': True, 'sideways_use_spike': True, 'sideways_rsi_required': False}.
