[I 2025-09-01 08:44:07,898] Trial 515 finished with values: [-1000000000.0, 1000000000.0] and parameters: {'p_sma': 19, 'p_std': 33, 'p_atr': 23, 'p_adx': 19, 'rsi_period': 34, 'ema1': 26, 'ema2': 22, 'slip_atr_k': 0.04495227719446206, 'slip_spread_k': 0.6531462878707806, 'spread_hl_frac': 0.025445528479216176, 'bb_std_mult': 3.5254504733104945, 'rsi_os': 16, 'rsi_ob': 88, 'vol_spike': 0.24240257286668257, 'adx_thresh': 26.65264618243825, 'atr_min_pct': 0.013419415948611924, 'atr_max_pct': 0.09878263561629023, 'tp_mult': 2.453426871555298, 'tsl_mult': 0.47539160304276123, 'strategy': 'mean_reversion', 'time_stop': 31, 'use_sma': False, 'use_atr': False, 'use_adx': True, 'use_ema': False, 'use_spike': False, 'rsi_required': True, 'edge_k': 1.1160023483891635, 'edge_cap': 0.11970458597115648, 'bull_strategy': 'mean_reversion', 'bull_bb_std_mult': 1.4236197231715635, 'bull_rsi_os': 17, 'bull_rsi_ob': 88, 'bull_adx_thresh': 14.498493660501437, 'bull_atr_min_pct': 0.011795410961374129, 'bull_atr_max_pct': 0.03569853378610847, 'bull_tp_mult': 2.998927511367026, 'bull_tsl_mult': 0.6842331083268718, 'bull_time_stop': 158, 'bull_use_sma': True, 'bull_use_ema': True, 'bull_use_atr': False, 'bull_use_adx': True, 'bull_use_spike': True, 'bull_rsi_required': False, 'bear_strategy': 'mean_reversion', 'bear_bb_std_mult': 2.3724932371072116, 'bear_rsi_os': 26, 'bear_rsi_ob': 58, 'bear_adx_thresh': 32.658764045644624, 'bear_atr_min_pct': 0.022223783977904647, 'bear_atr_max_pct': 0.10223802673781651, 'bear_tp_mult': 2.1112593757360685, 'bear_tsl_mult': 0.0816463120738649, 'bear_time_stop': 93, 'bear_use_sma': True, 'bear_use_ema': True, 'bear_use_atr': True, 'bear_use_adx': True, 'bear_use_spike': False, 'bear_rsi_required': False, 'sideways_strategy': 'breakout', 'sideways_bb_std_mult': 1.8776069131947444, 'sideways_rsi_os': 51, 'sideways_rsi_ob': 93, 'sideways_adx_thresh': 34.94796082992599, 'sideways_atr_min_pct': 0.005228975565854624, 'sideways_atr_max_pct': 0.09547589329899744, 'sideways_tp_mult': 1.414497435497272, 'sideways_tsl_mult': 0.5713714735751128, 'sideways_time_stop': 26, 'sideways_use_sma': True, 'sideways_use_ema': False, 'sideways_use_atr': True, 'sideways_use_adx': True, 'sideways_use_spike': True, 'sideways_rsi_required': True}.
[I 2025-09-01 08:44:08,171] Trial 514 finished with values: [-1000000000.0, 1000000000.0] and parameters: {'p_sma': 15, 'p_std': 58, 'p_atr': 10, 'p_adx': 14, 'rsi_period': 27, 'ema1': 10, 'ema2': 16, 'slip_atr_k': 0.08545227658041242, 'slip_spread_k': 0.5656632036686324, 'spread_hl_frac': 0.025916310586278364, 'bb_std_mult': 3.536171026822427, 'rsi_os': 16, 'rsi_ob': 82, 'vol_spike': 0.11345916608382722, 'adx_thresh': 26.96559279750456, 'atr_min_pct': 0.019553685976611834, 'atr_max_pct': 0.021777130154551655, 'tp_mult': 1.8065552604227237, 'tsl_mult': 0.5164194487206332, 'strategy': 'mean_reversion', 'time_stop': 41, 'use_sma': False, 'use_atr': True, 'use_adx': True, 'use_ema': False, 'use_spike': False, 'rsi_required': True, 'edge_k': 1.526969002735483, 'edge_cap': 0.127779260859375, 'bull_strategy': 'mean_reversion', 'bull_bb_std_mult': 1.4286353260166358, 'bull_rsi_os': 13, 'bull_rsi_ob': 68, 'bull_adx_thresh': 31.78653731148392, 'bull_atr_min_pct': 0.00474575819674311, 'bull_atr_max_pct': 0.061476554367575514, 'bull_tp_mult': 2.2095605938710414, 'bull_tsl_mult': 0.3956381820244487, 'bull_time_stop': 14, 'bull_use_sma': True, 'bull_use_ema': False, 'bull_use_atr': False, 'bull_use_adx': True, 'bull_use_spike': True, 'bull_rsi_required': False, 'bear_strategy': 'mean_reversion', 'bear_bb_std_mult': 1.0212956063885754, 'bear_rsi_os': 26, 'bear_rsi_ob': 94, 'bear_adx_thresh': 32.847406172824115, 'bear_atr_min_pct': 0.022120446627593795, 'bear_atr_max_pct': 0.14931404230265993, 'bear_tp_mult': 1.982667486280783, 'bear_tsl_mult': 0.15325983937493615, 'bear_time_stop': 91, 'bear_use_sma': False, 'bear_use_ema': True, 'bear_use_atr': True, 'bear_use_adx': True, 'bear_use_spike': False, 'bear_rsi_required': False, 'sideways_strategy': 'breakout', 'sideways_bb_std_mult': 0.6067950551181867, 'sideways_rsi_os': 19, 'sideways_rsi_ob': 63, 'sideways_adx_thresh': 34.99708585394193, 'sideways_atr_min_pct': 0.005201151808613826, 'sideways_atr_max_pct': 0.13153098373558156, 'sideways_tp_mult': 1.087781528164193, 'sideways_tsl_mult': 0.2542743114825512, 'sideways_time_stop': 219, 'sideways_use_sma': False, 'sideways_use_ema': False, 'sideways_use_atr': False, 'sideways_use_adx': True, 'sideways_use_spike': True, 'sideways_rsi_required': False}.
[I 2025-09-01 08:44:08,561] Trial 513 finished with values: [-0.06087582897931021, 0.060676162855314214] and parameters: {'p_sma': 50, 'p_std': 39, 'p_atr': 10, 'p_adx': 13, 'rsi_period': 27, 'ema1': 10, 'ema2': 15, 'slip_atr_k': 0.045344230222231593, 'slip_spread_k': 0.9489758988260308, 'spread_hl_frac': 0.025935892447218455, 'bb_std_mult': 2.287031187563141, 'rsi_os': 16, 'rsi_ob': 57, 'vol_spike': 0.24254491061013386, 'adx_thresh': 25.574162817430473, 'atr_min_pct': 0.019414171637415035, 'atr_max_pct': 0.14464187409889562, 'tp_mult': 1.1140606852313146, 'tsl_mult': 0.3561369932284949, 'strategy': 'mean_reversion', 'time_stop': 223, 'use_sma': False, 'use_atr': True, 'use_adx': True, 'use_ema': False, 'use_spike': False, 'rsi_required': True, 'edge_k': 1.1049404266097744, 'edge_cap': 0.06509854051713365, 'bull_strategy': 'mean_reversion', 'bull_bb_std_mult': 1.4200095168679379, 'bull_rsi_os': 17, 'bull_rsi_ob': 73, 'bull_adx_thresh': 17.306572573182635, 'bull_atr_min_pct': 0.004023834326403592, 'bull_atr_max_pct': 0.03525592536052992, 'bull_tp_mult': 2.2113353845282284, 'bull_tsl_mult': 0.7878540729731885, 'bull_time_stop': 106, 'bull_use_sma': True, 'bull_use_ema': False, 'bull_use_atr': False, 'bull_use_adx': True, 'bull_use_spike': True, 'bull_rsi_required': False, 'bear_strategy': 'mean_reversion', 'bear_bb_std_mult': 2.7592917761413904, 'bear_rsi_os': 26, 'bear_rsi_ob': 58, 'bear_adx_thresh': 34.25775530478344, 'bear_atr_min_pct': 0.02512746029537344, 'bear_atr_max_pct': 0.13962616406152056, 'bear_tp_mult': 2.7584609950982264, 'bear_tsl_mult': 0.07927937070987354, 'bear_time_stop': 176, 'bear_use_sma': False, 'bear_use_ema': True, 'bear_use_atr': True, 'bear_use_adx': True, 'bear_use_spike': False, 'bear_rsi_required': False, 'sideways_strategy': 'breakout', 'sideways_bb_std_mult': 1.8831821339315404, 'sideways_rsi_os': 51, 'sideways_rsi_ob': 63, 'sideways_adx_thresh': 9.034800743889194, 'sideways_atr_min_pct': 0.0064785533039879144, 'sideways_atr_max_pct': 0.1325547793704718, 'sideways_tp_mult': 1.5004572095049054, 'sideways_tsl_mult': 0.18110620443483597, 'sideways_time_stop': 186, 'sideways_use_sma': False, 'sideways_use_ema': False, 'sideways_use_atr': False, 'sideways_use_adx': True, 'sideways_use_spike': True, 'sideways_rsi_required': False}.
[I 2025-09-01 08:44:09,944] Trial 516 finished with values: [-1000000000.0, 1000000000.0] and parameters: {'p_sma': 7, 'p_std': 47, 'p_atr': 25, 'p_adx': 9, 'rsi_period': 27, 'ema1': 10, 'ema2': 52, 'slip_atr_k': 0.086362584333926, 'slip_spread_k': 0.7091718845696235, 'spread_hl_frac': 0.030398986688608416, 'bb_std_mult': 1.4234618748357961, 'rsi_os': 23, 'rsi_ob': 58, 'vol_spike': 0.09861947073870969, 'adx_thresh': 24.149798838625728, 'atr_min_pct': 0.020906739861562298, 'atr_max_pct': 0.020512872218601562, 'tp_mult': 2.277525924553758, 'tsl_mult': 0.5113597813209314, 'strategy': 'breakout', 'time_stop': 44, 'use_sma': True, 'use_atr': True, 'use_adx': False, 'use_ema': True, 'use_spike': True, 'rsi_required': True, 'edge_k': 0.9103282050318964, 'edge_cap': 0.06817650493400537, 'bull_strategy': 'breakout', 'bull_bb_std_mult': 2.4528119292720607, 'bull_rsi_os': 55, 'bull_rsi_ob': 92, 'bull_adx_thresh': 9.31895757962799, 'bull_atr_min_pct': 0.01811714254886487, 'bull_atr_max_pct': 0.14400291899858525, 'bull_tp_mult': 2.203931020710517, 'bull_tsl_mult': 0.3882467665340097, 'bull_time_stop': 198, 'bull_use_sma': False, 'bull_use_ema': False, 'bull_use_atr': True, 'bull_use_adx': False, 'bull_use_spike': False, 'bull_rsi_required': True, 'bear_strategy': 'mean_reversion', 'bear_bb_std_mult': 3.104671862590397, 'bear_rsi_os': 26, 'bear_rsi_ob': 92, 'bear_adx_thresh': 31.254175553004824, 'bear_atr_min_pct': 0.020369063825025666, 'bear_atr_max_pct': 0.12273816255057068, 'bear_tp_mult': 2.8046752689266117, 'bear_tsl_mult': 0.09964093929685745, 'bear_time_stop': 90, 'bear_use_sma': False, 'bear_use_ema': False, 'bear_use_atr': False, 'bear_use_adx': True, 'bear_use_spike': False, 'bear_rsi_required': False, 'sideways_strategy': 'mean_reversion', 'sideways_bb_std_mult': 0.5161436934599107, 'sideways_rsi_os': 10, 'sideways_rsi_ob': 62, 'sideways_adx_thresh': 9.031625480929485, 'sideways_atr_min_pct': 0.023226140264755748, 'sideways_atr_max_pct': 0.10455648978635697, 'sideways_tp_mult': 1.4968103534837325, 'sideways_tsl_mult': 0.11825714987408736, 'sideways_time_stop': 13, 'sideways_use_sma': False, 'sideways_use_ema': True, 'sideways_use_atr': False, 'sideways_use_adx': False, 'sideways_use_spike': False, 'sideways_rsi_required': False}.
[I 2025-09-01 08:44:53,573] Trial 519 finished with values: [-1000000000.0, 1000000000.0] and parameters: {'p_sma': 41, 'p_std': 15, 'p_atr': 22, 'p_adx': 24, 'rsi_period': 67, 'ema1': 11, 'ema2': 14, 'slip_atr_k': 0.05448481700631163, 'slip_spread_k': 0.3121223519072612, 'spread_hl_frac': 0.008397707907857033, 'bb_std_mult': 0.690040561634949, 'rsi_os': 33, 'rsi_ob': 77, 'vol_spike': 0.23642388900043754, 'adx_thresh': 29.134576706580333, 'atr_min_pct': 0.02257692809213383, 'atr_max_pct': 0.14690419260417692, 'tp_mult': 1.1747225500968521, 'tsl_mult': 0.43324897682831853, 'strategy': 'breakout', 'time_stop': 242, 'use_sma': True, 'use_atr': False, 'use_adx': False, 'use_ema': True, 'use_spike': True, 'rsi_required': False, 'edge_k': 1.162457782563914, 'edge_cap': 0.5565509736903023, 'bull_strategy': 'breakout', 'bull_bb_std_mult': 3.0539292526658546, 'bull_rsi_os': 44, 'bull_rsi_ob': 74, 'bull_adx_thresh': 21.59833974091029, 'bull_atr_min_pct': 0.015158565203215273, 'bull_atr_max_pct': 0.046029251831936104, 'bull_tp_mult': 1.1804460698759502, 'bull_tsl_mult': 0.884540532784432, 'bull_time_stop': 300, 'bull_use_sma': False, 'bull_use_ema': True, 'bull_use_atr': True, 'bull_use_adx': False, 'bull_use_spike': False, 'bull_rsi_required': True, 'bear_strategy': 'mean_reversion', 'bear_bb_std_mult': 3.1360655756315676, 'bear_rsi_os': 26, 'bear_rsi_ob': 92, 'bear_adx_thresh': 31.41670595580698, 'bear_atr_min_pct': 0.012254428869189232, 'bear_atr_max_pct': 0.07628558999666081, 'bear_tp_mult': 2.8261280978456305, 'bear_tsl_mult': 0.10868176485504277, 'bear_time_stop': 79, 'bear_use_sma': True, 'bear_use_ema': False, 'bear_use_atr': False, 'bear_use_adx': True, 'bear_use_spike': True, 'bear_rsi_required': False, 'sideways_strategy': 'mean_reversion', 'sideways_bb_std_mult': 1.6638282603155805, 'sideways_rsi_os': 36, 'sideways_rsi_ob': 81, 'sideways_adx_thresh': 24.191679743066814, 'sideways_atr_min_pct': 0.023468763215807164, 'sideways_atr_max_pct': 0.05498007852598997, 'sideways_tp_mult': 2.7206858860536456, 'sideways_tsl_mult': 0.12103272710747107, 'sideways_time_stop': 46, 'sideways_use_sma': True, 'sideways_use_ema': True, 'sideways_use_atr': True, 'sideways_use_adx': False, 'sideways_use_spike': False, 'sideways_rsi_required': True}.
[I 2025-09-01 08:44:53,841] Trial 518 finished with values: [-1000000000.0, 1000000000.0] and parameters: {'p_sma': 27, 'p_std': 47, 'p_atr': 12, 'p_adx': 26, 'rsi_period': 49, 'ema1': 11, 'ema2': 13, 'slip_atr_k': 0.05553821843631282, 'slip_spread_k': 0.7105221785110044, 'spread_hl_frac': 0.0006620126646425528, 'bb_std_mult': 3.2911092163332487, 'rsi_os': 25, 'rsi_ob': 51, 'vol_spike': 0.23835194085808126, 'adx_thresh': 17.81541595622582, 'atr_min_pct': 0.007119425313274185, 'atr_max_pct': 0.14380955777930737, 'tp_mult': 1.1806302856007167, 'tsl_mult': 0.43940484781259753, 'strategy': 'breakout', 'time_stop': 146, 'use_sma': True, 'use_atr': True, 'use_adx': False, 'use_ema': True, 'use_spike': True, 'rsi_required': False, 'edge_k': 0.8276090072145933, 'edge_cap': 0.06695950146479555, 'bull_strategy': 'breakout', 'bull_bb_std_mult': 3.044911958800044, 'bull_rsi_os': 51, 'bull_rsi_ob': 74, 'bull_adx_thresh': 9.318503576186973, 'bull_atr_min_pct': 0.014765937669914993, 'bull_atr_max_pct': 0.03099209280899721, 'bull_tp_mult': 2.255704848204426, 'bull_tsl_mult': 0.782995999562237, 'bull_time_stop': 194, 'bull_use_sma': False, 'bull_use_ema': False, 'bull_use_atr': True, 'bull_use_adx': False, 'bull_use_spike': False, 'bull_rsi_required': True, 'bear_strategy': 'mean_reversion', 'bear_bb_std_mult': 3.119266253008077, 'bear_rsi_os': 26, 'bear_rsi_ob': 90, 'bear_adx_thresh': 31.296761882672712, 'bear_atr_min_pct': 0.020416753433373822, 'bear_atr_max_pct': 0.12290925067879648, 'bear_tp_mult': 2.8005514637872317, 'bear_tsl_mult': 0.11378032216839681, 'bear_time_stop': 127, 'bear_use_sma': False, 'bear_use_ema': False, 'bear_use_atr': False, 'bear_use_adx': True, 'bear_use_spike': True, 'bear_rsi_required': False, 'sideways_strategy': 'mean_reversion', 'sideways_bb_std_mult': 1.6384452380629924, 'sideways_rsi_os': 36, 'sideways_rsi_ob': 63, 'sideways_adx_thresh': 16.311814724908448, 'sideways_atr_min_pct': 0.02746518563999282, 'sideways_atr_max_pct': 0.05391082828609928, 'sideways_tp_mult': 2.5266732245427157, 'sideways_tsl_mult': 0.11702280275693236, 'sideways_time_stop': 13, 'sideways_use_sma': False, 'sideways_use_ema': True, 'sideways_use_atr': False, 'sideways_use_adx': False, 'sideways_use_spike': False, 'sideways_rsi_required': False}.
[I 2025-09-01 08:44:54,431] Trial 517 finished with values: [-1000000000.0, 1000000000.0] and parameters: {'p_sma': 27, 'p_std': 5, 'p_atr': 25, 'p_adx': 9, 'rsi_period': 50, 'ema1': 10, 'ema2': 16, 'slip_atr_k': 0.11625257680405326, 'slip_spread_k': 0.10564425078967621, 'spread_hl_frac': 0.03076804697090453, 'bb_std_mult': 2.9525518948012035, 'rsi_os': 48, 'rsi_ob': 58, 'vol_spike': 0.23794811541772679, 'adx_thresh': 5.060601635166563, 'atr_min_pct': 0.02242800490486016, 'atr_max_pct': 0.11363073707260282, 'tp_mult': 2.859860944623548, 'tsl_mult': 0.5017896013261839, 'strategy': 'breakout', 'time_stop': 41, 'use_sma': True, 'use_atr': True, 'use_adx': False, 'use_ema': True, 'use_spike': True, 'rsi_required': True, 'edge_k': 0.8922086398143586, 'edge_cap': 0.06791984431488446, 'bull_strategy': 'breakout', 'bull_bb_std_mult': 3.469675295169486, 'bull_rsi_os': 43, 'bull_rsi_ob': 68, 'bull_adx_thresh': 21.61122241618864, 'bull_atr_min_pct': 0.01803567795131539, 'bull_atr_max_pct': 0.04631857909309566, 'bull_tp_mult': 1.2478819839546889, 'bull_tsl_mult': 0.3896330348869169, 'bull_time_stop': 108, 'bull_use_sma': False, 'bull_use_ema': False, 'bull_use_atr': True, 'bull_use_adx': False, 'bull_use_spike': False, 'bull_rsi_required': True, 'bear_strategy': 'mean_reversion', 'bear_bb_std_mult': 3.1117921113625324, 'bear_rsi_os': 26, 'bear_rsi_ob': 91, 'bear_adx_thresh': 31.434668947444244, 'bear_atr_min_pct': 0.02509631346106038, 'bear_atr_max_pct': 0.026216843725161455, 'bear_tp_mult': 2.7801426688844253, 'bear_tsl_mult': 0.10959211538322843, 'bear_time_stop': 178, 'bear_use_sma': False, 'bear_use_ema': False, 'bear_use_atr': False, 'bear_use_adx': True, 'bear_use_spike': False, 'bear_rsi_required': False, 'sideways_strategy': 'mean_reversion', 'sideways_bb_std_mult': 0.5071687506849898, 'sideways_rsi_os': 40, 'sideways_rsi_ob': 62, 'sideways_adx_thresh': 24.080339668553307, 'sideways_atr_min_pct': 0.028151901476896536, 'sideways_atr_max_pct': 0.061263368157307596, 'sideways_tp_mult': 1.4978655439629462, 'sideways_tsl_mult': 0.2644259987873969, 'sideways_time_stop': 51, 'sideways_use_sma': False, 'sideways_use_ema': True, 'sideways_use_atr': False, 'sideways_use_adx': False, 'sideways_use_spike': False, 'sideways_rsi_required': False}.
[I 2025-09-01 08:44:54,942] Trial 520 finished with values: [-0.034298740586536924, 0.03471789793210695] and parameters: {'p_sma': 9, 'p_std': 15, 'p_atr': 12, 'p_adx': 29, 'rsi_period': 48, 'ema1': 11, 'ema2': 13, 'slip_atr_k': 0.18745279675275017, 'slip_spread_k': 0.6662145638493416, 'spread_hl_frac': 0.024169762795504326, 'bb_std_mult': 0.6956212570592042, 'rsi_os': 25, 'rsi_ob': 70, 'vol_spike': 0.23918306419561994, 'adx_thresh': 29.264685783399546, 'atr_min_pct': 0.022701219845835337, 'atr_max_pct': 0.1465316547937144, 'tp_mult': 1.1728707053018759, 'tsl_mult': 0.45152188046200425, 'strategy': 'breakout', 'time_stop': 256, 'use_sma': True, 'use_atr': False, 'use_adx': True, 'use_ema': True, 'use_spike': True, 'rsi_required': False, 'edge_k': 0.10509941197704731, 'edge_cap': 0.05190533891561987, 'bull_strategy': 'breakout', 'bull_bb_std_mult': 2.897035021165714, 'bull_rsi_os': 44, 'bull_rsi_ob': 93, 'bull_adx_thresh': 15.954595952310143, 'bull_atr_min_pct': 0.0030322548921356517, 'bull_atr_max_pct': 0.04585748170805247, 'bull_tp_mult': 1.6620413995187822, 'bull_tsl_mult': 0.6024925245014889, 'bull_time_stop': 154, 'bull_use_sma': False, 'bull_use_ema': True, 'bull_use_atr': False, 'bull_use_adx': True, 'bull_use_spike': True, 'bull_rsi_required': True, 'bear_strategy': 'breakout', 'bear_bb_std_mult': 2.451951294517105, 'bear_rsi_os': 25, 'bear_rsi_ob': 95, 'bear_adx_thresh': 14.719671047727756, 'bear_atr_min_pct': 0.02344174812412989, 'bear_atr_max_pct': 0.012517392330375188, 'bear_tp_mult': 2.8499736102601148, 'bear_tsl_mult': 0.111430596406719, 'bear_time_stop': 81, 'bear_use_sma': True, 'bear_use_ema': False, 'bear_use_atr': True, 'bear_use_adx': True, 'bear_use_spike': True, 'bear_rsi_required': False, 'sideways_strategy': 'mean_reversion', 'sideways_bb_std_mult': 1.6523826477679016, 'sideways_rsi_os': 36, 'sideways_rsi_ob': 65, 'sideways_adx_thresh': 7.695668375066971, 'sideways_atr_min_pct': 0.024054396070098537, 'sideways_atr_max_pct': 0.03369521069597123, 'sideways_tp_mult': 2.7295413346111843, 'sideways_tsl_mult': 0.16419220876178953, 'sideways_time_stop': 49, 'sideways_use_sma': True, 'sideways_use_ema': False, 'sideways_use_atr': True, 'sideways_use_adx': True, 'sideways_use_spike': True, 'sideways_rsi_required': True}.
[I 2025-09-01 08:45:42,735] Trial 521 finished with values: [-0.04182333896723689, 0.04224130953996358] and parameters: {'p_sma': 21, 'p_std': 45, 'p_atr': 12, 'p_adx': 21, 'rsi_period': 73, 'ema1': 23, 'ema2': 13, 'slip_atr_k': 0.06844936861627826, 'slip_spread_k': 0.6724434661355029, 'spread_hl_frac': 0.03289282950428071, 'bb_std_mult': 3.299993814873559, 'rsi_os': 25, 'rsi_ob': 93, 'vol_spike': 0.23956982356587647, 'adx_thresh': 27.670645656430857, 'atr_min_pct': 0.007046202748501856, 'atr_max_pct': 0.14422157178634545, 'tp_mult': 2.8520081319400874, 'tsl_mult': 0.549172536630033, 'strategy': 'mean_reversion', 'time_stop': 90, 'use_sma': True, 'use_atr': True, 'use_adx': True, 'use_ema': True, 'use_spike': True, 'rsi_required': True, 'edge_k': 1.627943332621451, 'edge_cap': 0.05126461511198145, 'bull_strategy': 'breakout', 'bull_bb_std_mult': 2.8970367166413755, 'bull_rsi_os': 5, 'bull_rsi_ob': 94, 'bull_adx_thresh': 9.881255587698332, 'bull_atr_min_pct': 0.0030247422434785017, 'bull_atr_max_pct': 0.04930605046079391, 'bull_tp_mult': 2.2621561069274194, 'bull_tsl_mult': 0.6018108483074569, 'bull_time_stop': 154, 'bull_use_sma': True, 'bull_use_ema': False, 'bull_use_atr': False, 'bull_use_adx': True, 'bull_use_spike': True, 'bull_rsi_required': False, 'bear_strategy': 'breakout', 'bear_bb_std_mult': 2.9713932199467936, 'bear_rsi_os': 25, 'bear_rsi_ob': 95, 'bear_adx_thresh': 14.639574085182009, 'bear_atr_min_pct': 0.023070532600073045, 'bear_atr_max_pct': 0.09224755941233352, 'bear_tp_mult': 2.5115641203676313, 'bear_tsl_mult': 0.06616666460362866, 'bear_time_stop': 20, 'bear_use_sma': False, 'bear_use_ema': False, 'bear_use_atr': True, 'bear_use_adx': True, 'bear_use_spike': True, 'bear_rsi_required': False, 'sideways_strategy': 'mean_reversion', 'sideways_bb_std_mult': 2.2155590751432404, 'sideways_rsi_os': 40, 'sideways_rsi_ob': 65, 'sideways_adx_thresh': 18.893168442534634, 'sideways_atr_min_pct': 0.01695893397395985, 'sideways_atr_max_pct': 0.10821464519824356, 'sideways_tp_mult': 2.3260453661915954, 'sideways_tsl_mult': 0.16439959319681163, 'sideways_time_stop': 31, 'sideways_use_sma': False, 'sideways_use_ema': False, 'sideways_use_atr': False, 'sideways_use_adx': True, 'sideways_use_spike': True, 'sideways_rsi_required': False}.
