[I 2025-09-01 08:41:08,171] Trial 497 finished with values: [-0.07875278575920852, 0.07920355104333082] and parameters: {'p_sma': 22, 'p_std': 13, 'p_atr': 12, 'p_adx': 21, 'rsi_period': 73, 'ema1': 24, 'ema2': 12, 'slip_atr_k': 0.06261757394154838, 'slip_spread_k': 0.2020331971498428, 'spread_hl_frac': 0.02126721751490468, 'bb_std_mult': 3.3074499150076226, 'rsi_os': 44, 'rsi_ob': 55, 'vol_spike': 0.04130342591980821, 'adx_thresh': 23.54685974943694, 'atr_min_pct': 0.010984799780277433, 'atr_max_pct': 0.029535617065614354, 'tp_mult': 1.1635889095521121, 'tsl_mult': 0.7932315497322947, 'strategy': 'mean_reversion', 'time_stop': 253, 'use_sma': True, 'use_atr': True, 'use_adx': True, 'use_ema': True, 'use_spike': True, 'rsi_required': True, 'edge_k': 0.9675988885572503, 'edge_cap': 0.36516086271637027, 'bull_strategy': 'breakout', 'bull_bb_std_mult': 1.09583534562123, 'bull_rsi_os': 23, 'bull_rsi_ob': 58, 'bull_adx_thresh': 34.65149966972079, 'bull_atr_min_pct': 0.0009318029676404008, 'bull_atr_max_pct': 0.04555473593509483, 'bull_tp_mult': 2.3128073217933687, 'bull_tsl_mult': 0.6211211573920755, 'bull_time_stop': 163, 'bull_use_sma': True, 'bull_use_ema': False, 'bull_use_atr': True, 'bull_use_adx': True, 'bull_use_spike': False, 'bull_rsi_required': False, 'bear_strategy': 'mean_reversion', 'bear_bb_std_mult': 3.2018894045871744, 'bear_rsi_os': 53, 'bear_rsi_ob': 83, 'bear_adx_thresh': 31.653604462807817, 'bear_atr_min_pct': 0.022897097285181894, 'bear_atr_max_pct': 0.0843298688267757, 'bear_tp_mult': 1.3067181300914452, 'bear_tsl_mult': 0.7023794015644269, 'bear_time_stop': 158, 'bear_use_sma': False, 'bear_use_ema': False, 'bear_use_atr': True, 'bear_use_adx': True, 'bear_use_spike': False, 'bear_rsi_required': False, 'sideways_strategy': 'breakout', 'sideways_bb_std_mult': 1.0804526787232442, 'sideways_rsi_os': 44, 'sideways_rsi_ob': 66, 'sideways_adx_thresh': 33.74577653794792, 'sideways_atr_min_pct': 0.02355457404795376, 'sideways_atr_max_pct': 0.027586358130242836, 'sideways_tp_mult': 2.562187913137151, 'sideways_tsl_mult': 0.17659847974704934, 'sideways_time_stop': 29, 'sideways_use_sma': False, 'sideways_use_ema': False, 'sideways_use_atr': True, 'sideways_use_adx': True, 'sideways_use_spike': True, 'sideways_rsi_required': False}.
[I 2025-09-01 08:41:08,655] Trial 498 finished with values: [-1000000000.0, 1000000000.0] and parameters: {'p_sma': 19, 'p_std': 15, 'p_atr': 12, 'p_adx': 28, 'rsi_period': 70, 'ema1': 10, 'ema2': 10, 'slip_atr_k': 0.0631448523318533, 'slip_spread_k': 0.6670570928605674, 'spread_hl_frac': 0.025134207433372607, 'bb_std_mult': 3.0505384333587466, 'rsi_os': 45, 'rsi_ob': 57, 'vol_spike': 0.042417392769408535, 'adx_thresh': 23.529644640456787, 'atr_min_pct': 0.0110887513221824, 'atr_max_pct': 0.1392846821967848, 'tp_mult': 2.7286323608022798, 'tsl_mult': 0.16935401334278571, 'strategy': 'mean_reversion', 'time_stop': 265, 'use_sma': True, 'use_atr': True, 'use_adx': True, 'use_ema': True, 'use_spike': True, 'rsi_required': True, 'edge_k': 0.981036091937234, 'edge_cap': 0.44387240407248973, 'bull_strategy': 'breakout', 'bull_bb_std_mult': 2.932537275092054, 'bull_rsi_os': 31, 'bull_rsi_ob': 66, 'bull_adx_thresh': 34.407782410465444, 'bull_atr_min_pct': 0.009568112170131735, 'bull_atr_max_pct': 0.11316826593247653, 'bull_tp_mult': 2.3176035749403443, 'bull_tsl_mult': 0.6283418678872823, 'bull_time_stop': 163, 'bull_use_sma': True, 'bull_use_ema': False, 'bull_use_atr': True, 'bull_use_adx': True, 'bull_use_spike': False, 'bull_rsi_required': False, 'bear_strategy': 'mean_reversion', 'bear_bb_std_mult': 3.2056372871520527, 'bear_rsi_os': 14, 'bear_rsi_ob': 93, 'bear_adx_thresh': 8.870050106893775, 'bear_atr_min_pct': 0.022944058619180852, 'bear_atr_max_pct': 0.03695195579401151, 'bear_tp_mult': 2.860158191174608, 'bear_tsl_mult': 0.09405608578944942, 'bear_time_stop': 102, 'bear_use_sma': False, 'bear_use_ema': False, 'bear_use_atr': True, 'bear_use_adx': True, 'bear_use_spike': False, 'bear_rsi_required': False, 'sideways_strategy': 'breakout', 'sideways_bb_std_mult': 0.7287704847555908, 'sideways_rsi_os': 39, 'sideways_rsi_ob': 66, 'sideways_adx_thresh': 21.725964782187642, 'sideways_atr_min_pct': 0.021693236650189685, 'sideways_atr_max_pct': 0.035710496406837045, 'sideways_tp_mult': 1.8679072387690756, 'sideways_tsl_mult': 0.9221736073155777, 'sideways_time_stop': 269, 'sideways_use_sma': False, 'sideways_use_ema': False, 'sideways_use_atr': True, 'sideways_use_adx': True, 'sideways_use_spike': True, 'sideways_rsi_required': False}.
[I 2025-09-01 08:41:09,270] Trial 496 finished with values: [-0.1720522740553766, 0.1720377206048935] and parameters: {'p_sma': 22, 'p_std': 14, 'p_atr': 12, 'p_adx': 16, 'rsi_period': 17, 'ema1': 17, 'ema2': 13, 'slip_atr_k': 0.1397354991630078, 'slip_spread_k': 0.6636283760555362, 'spread_hl_frac': 0.024737862884790743, 'bb_std_mult': 3.316115908328216, 'rsi_os': 29, 'rsi_ob': 53, 'vol_spike': 0.14916153044743363, 'adx_thresh': 25.208895778793913, 'atr_min_pct': 0.008371407172202585, 'atr_max_pct': 0.07398395105841142, 'tp_mult': 1.1550194048137967, 'tsl_mult': 0.9184768286240512, 'strategy': 'mean_reversion', 'time_stop': 251, 'use_sma': True, 'use_atr': True, 'use_adx': True, 'use_ema': True, 'use_spike': True, 'rsi_required': True, 'edge_k': 0.9639913403019496, 'edge_cap': 0.2796880474173148, 'bull_strategy': 'breakout', 'bull_bb_std_mult': 2.937685258746239, 'bull_rsi_os': 34, 'bull_rsi_ob': 75, 'bull_adx_thresh': 24.63503444848125, 'bull_atr_min_pct': 0.0008743671304994598, 'bull_atr_max_pct': 0.03802410207722403, 'bull_tp_mult': 2.3273785255599777, 'bull_tsl_mult': 0.6712018188216039, 'bull_time_stop': 162, 'bull_use_sma': True, 'bull_use_ema': False, 'bull_use_atr': True, 'bull_use_adx': True, 'bull_use_spike': False, 'bull_rsi_required': False, 'bear_strategy': 'mean_reversion', 'bear_bb_std_mult': 2.107352850827917, 'bear_rsi_os': 14, 'bear_rsi_ob': 93, 'bear_adx_thresh': 30.259348281909855, 'bear_atr_min_pct': 0.025785883557819286, 'bear_atr_max_pct': 0.07050607081360855, 'bear_tp_mult': 2.2755576142004403, 'bear_tsl_mult': 0.24820288230868848, 'bear_time_stop': 104, 'bear_use_sma': False, 'bear_use_ema': False, 'bear_use_atr': True, 'bear_use_adx': True, 'bear_use_spike': False, 'bear_rsi_required': False, 'sideways_strategy': 'breakout', 'sideways_bb_std_mult': 0.7424109648881575, 'sideways_rsi_os': 53, 'sideways_rsi_ob': 66, 'sideways_adx_thresh': 8.458487256041579, 'sideways_atr_min_pct': 0.009847870653969651, 'sideways_atr_max_pct': 0.14508439643273752, 'sideways_tp_mult': 2.5633640645079723, 'sideways_tsl_mult': 0.7325735953409043, 'sideways_time_stop': 267, 'sideways_use_sma': False, 'sideways_use_ema': False, 'sideways_use_atr': True, 'sideways_use_adx': True, 'sideways_use_spike': True, 'sideways_rsi_required': False}.
[I 2025-09-01 08:41:09,583] Trial 495 finished with values: [-0.08124702382332472, 0.0812691601931001] and parameters: {'p_sma': 22, 'p_std': 53, 'p_atr': 12, 'p_adx': 12, 'rsi_period': 19, 'ema1': 16, 'ema2': 13, 'slip_atr_k': 0.045885666980072765, 'slip_spread_k': 0.5040051992319753, 'spread_hl_frac': 0.021106319922071015, 'bb_std_mult': 1.876103596327075, 'rsi_os': 24, 'rsi_ob': 53, 'vol_spike': 0.07853006307855581, 'adx_thresh': 23.53036075864114, 'atr_min_pct': 0.022122275982481662, 'atr_max_pct': 0.1408113934555131, 'tp_mult': 1.3968049191021654, 'tsl_mult': 0.16841379348625052, 'strategy': 'mean_reversion', 'time_stop': 252, 'use_sma': True, 'use_atr': True, 'use_adx': True, 'use_ema': True, 'use_spike': True, 'rsi_required': True, 'edge_k': 0.9584962687952778, 'edge_cap': 0.2843847217719027, 'bull_strategy': 'breakout', 'bull_bb_std_mult': 2.9286702412511647, 'bull_rsi_os': 10, 'bull_rsi_ob': 66, 'bull_adx_thresh': 8.245234794488598, 'bull_atr_min_pct': 0.001020478761266595, 'bull_atr_max_pct': 0.037714571511282435, 'bull_tp_mult': 2.3425903838134348, 'bull_tsl_mult': 0.6197698874278463, 'bull_time_stop': 240, 'bull_use_sma': True, 'bull_use_ema': False, 'bull_use_atr': True, 'bull_use_adx': True, 'bull_use_spike': False, 'bull_rsi_required': False, 'bear_strategy': 'mean_reversion', 'bear_bb_std_mult': 3.2158151631646, 'bear_rsi_os': 28, 'bear_rsi_ob': 93, 'bear_adx_thresh': 30.539555941841584, 'bear_atr_min_pct': 0.02288619756969193, 'bear_atr_max_pct': 0.10919799130552589, 'bear_tp_mult': 1.6025223070217236, 'bear_tsl_mult': 0.09614317512667618, 'bear_time_stop': 104, 'bear_use_sma': False, 'bear_use_ema': False, 'bear_use_atr': True, 'bear_use_adx': True, 'bear_use_spike': False, 'bear_rsi_required': False, 'sideways_strategy': 'breakout', 'sideways_bb_std_mult': 0.7391417992705261, 'sideways_rsi_os': 22, 'sideways_rsi_ob': 66, 'sideways_adx_thresh': 6.372035120543707, 'sideways_atr_min_pct': 0.009815573367381439, 'sideways_atr_max_pct': 0.035671275213005386, 'sideways_tp_mult': 2.5683731368667084, 'sideways_tsl_mult': 0.1819942428468931, 'sideways_time_stop': 266, 'sideways_use_sma': False, 'sideways_use_ema': False, 'sideways_use_atr': True, 'sideways_use_adx': True, 'sideways_use_spike': True, 'sideways_rsi_required': False}.
[I 2025-09-01 08:41:56,238] Trial 502 finished with values: [-1000000000.0, 1000000000.0] and parameters: {'p_sma': 17, 'p_std': 16, 'p_atr': 16, 'p_adx': 20, 'rsi_period': 68, 'ema1': 12, 'ema2': 15, 'slip_atr_k': 0.07277779362553263, 'slip_spread_k': 0.6510536696209753, 'spread_hl_frac': 0.014636970154939227, 'bb_std_mult': 3.3681563876092344, 'rsi_os': 22, 'rsi_ob': 56, 'vol_spike': 0.24509629180916545, 'adx_thresh': 24.890257037242176, 'atr_min_pct': 0.0023260348528874996, 'atr_max_pct': 0.1470537347985258, 'tp_mult': 1.279779538367426, 'tsl_mult': 0.4480188538288111, 'strategy': 'mean_reversion', 'time_stop': 245, 'use_sma': True, 'use_atr': False, 'use_adx': True, 'use_ema': True, 'use_spike': False, 'rsi_required': False, 'edge_k': 1.2619682808515784, 'edge_cap': 0.7952204029156986, 'bull_strategy': 'breakout', 'bull_bb_std_mult': 2.807657525891998, 'bull_rsi_os': 42, 'bull_rsi_ob': 65, 'bull_adx_thresh': 16.606141385661363, 'bull_atr_min_pct': 0.011547062436894072, 'bull_atr_max_pct': 0.0810132859976982, 'bull_tp_mult': 2.2080247455502424, 'bull_tsl_mult': 0.6902220334868283, 'bull_time_stop': 62, 'bull_use_sma': True, 'bull_use_ema': True, 'bull_use_atr': False, 'bull_use_adx': True, 'bull_use_spike': True, 'bull_rsi_required': False, 'bear_strategy': 'mean_reversion', 'bear_bb_std_mult': 2.647563761541222, 'bear_rsi_os': 26, 'bear_rsi_ob': 72, 'bear_adx_thresh': 31.848006172914527, 'bear_atr_min_pct': 0.024659678676124258, 'bear_atr_max_pct': 0.08050005435724737, 'bear_tp_mult': 2.832208938648777, 'bear_tsl_mult': 0.27643766832984307, 'bear_time_stop': 93, 'bear_use_sma': True, 'bear_use_ema': False, 'bear_use_atr': False, 'bear_use_adx': False, 'bear_use_spike': True, 'bear_rsi_required': False, 'sideways_strategy': 'mean_reversion', 'sideways_bb_std_mult': 0.6031703948422587, 'sideways_rsi_os': 40, 'sideways_rsi_ob': 90, 'sideways_adx_thresh': 28.25479752041319, 'sideways_atr_min_pct': 0.02313248105425312, 'sideways_atr_max_pct': 0.04015385795939001, 'sideways_tp_mult': 2.514897145705003, 'sideways_tsl_mult': 0.04123335705932968, 'sideways_time_stop': 20, 'sideways_use_sma': True, 'sideways_use_ema': False, 'sideways_use_atr': False, 'sideways_use_adx': True, 'sideways_use_spike': True, 'sideways_rsi_required': True}.
[I 2025-09-01 08:41:56,859] Trial 499 finished with values: [-1000000000.0, 1000000000.0] and parameters: {'p_sma': 11, 'p_std': 15, 'p_atr': 27, 'p_adx': 20, 'rsi_period': 17, 'ema1': 17, 'ema2': 26, 'slip_atr_k': 0.03748046683477431, 'slip_spread_k': 0.6714295186248385, 'spread_hl_frac': 0.03690755279857124, 'bb_std_mult': 3.0285196337949554, 'rsi_os': 22, 'rsi_ob': 57, 'vol_spike': 0.26346058445367415, 'adx_thresh': 21.46038428175258, 'atr_min_pct': 0.028987961537415032, 'atr_max_pct': 0.14023095923789278, 'tp_mult': 1.2660000817419832, 'tsl_mult': 0.1890201966733937, 'strategy': 'mean_reversion', 'time_stop': 244, 'use_sma': True, 'use_atr': False, 'use_adx': True, 'use_ema': True, 'use_spike': True, 'rsi_required': False, 'edge_k': 0.9640618316531808, 'edge_cap': 0.8638320806888153, 'bull_strategy': 'breakout', 'bull_bb_std_mult': 2.8023084304717054, 'bull_rsi_os': 31, 'bull_rsi_ob': 65, 'bull_adx_thresh': 22.803062090119106, 'bull_atr_min_pct': 0.02818828323560161, 'bull_atr_max_pct': 0.039896950539349496, 'bull_tp_mult': 2.300299985558504, 'bull_tsl_mult': 0.6344097685412841, 'bull_time_stop': 135, 'bull_use_sma': True, 'bull_use_ema': True, 'bull_use_atr': False, 'bull_use_adx': True, 'bull_use_spike': True, 'bull_rsi_required': False, 'bear_strategy': 'mean_reversion', 'bear_bb_std_mult': 2.105053328682589, 'bear_rsi_os': 37, 'bear_rsi_ob': 93, 'bear_adx_thresh': 30.86824320573717, 'bear_atr_min_pct': 0.0244943118715237, 'bear_atr_max_pct': 0.08016106852974896, 'bear_tp_mult': 2.875316302971122, 'bear_tsl_mult': 2.588312841747542e-05, 'bear_time_stop': 104, 'bear_use_sma': True, 'bear_use_ema': False, 'bear_use_atr': False, 'bear_use_adx': True, 'bear_use_spike': True, 'bear_rsi_required': False, 'sideways_strategy': 'mean_reversion', 'sideways_bb_std_mult': 0.7309320112257763, 'sideways_rsi_os': 12, 'sideways_rsi_ob': 65, 'sideways_adx_thresh': 8.456172478957882, 'sideways_atr_min_pct': 0.008827248691807973, 'sideways_atr_max_pct': 0.03495917178495882, 'sideways_tp_mult': 1.245229527336968, 'sideways_tsl_mult': 0.18002268424928064, 'sideways_time_stop': 267, 'sideways_use_sma': True, 'sideways_use_ema': False, 'sideways_use_atr': True, 'sideways_use_adx': True, 'sideways_use_spike': True, 'sideways_rsi_required': True}.
[I 2025-09-01 08:41:56,866] Trial 501 finished with values: [-1000000000.0, 1000000000.0] and parameters: {'p_sma': 59, 'p_std': 28, 'p_atr': 27, 'p_adx': 11, 'rsi_period': 60, 'ema1': 12, 'ema2': 14, 'slip_atr_k': 0.03527267443575767, 'slip_spread_k': 0.04726354354804391, 'spread_hl_frac': 0.022838671473365938, 'bb_std_mult': 3.381618370693782, 'rsi_os': 12, 'rsi_ob': 95, 'vol_spike': 0.03419712024878292, 'adx_thresh': 26.562004100764533, 'atr_min_pct': 0.024950161648035464, 'atr_max_pct': 0.12798982258008196, 'tp_mult': 1.2666830730620928, 'tsl_mult': 0.4783510660427689, 'strategy': 'mean_reversion', 'time_stop': 97, 'use_sma': True, 'use_atr': False, 'use_adx': True, 'use_ema': True, 'use_spike': False, 'rsi_required': False, 'edge_k': 0.2782490358263062, 'edge_cap': 0.6435841581601343, 'bull_strategy': 'breakout', 'bull_bb_std_mult': 2.1717607537632078, 'bull_rsi_os': 8, 'bull_rsi_ob': 69, 'bull_adx_thresh': 8.293273269773348, 'bull_atr_min_pct': 0.0242633638765704, 'bull_atr_max_pct': 0.04031572045836023, 'bull_tp_mult': 2.229220490205034, 'bull_tsl_mult': 0.6895824486451356, 'bull_time_stop': 174, 'bull_use_sma': True, 'bull_use_ema': True, 'bull_use_atr': False, 'bull_use_adx': True, 'bull_use_spike': True, 'bull_rsi_required': False, 'bear_strategy': 'mean_reversion', 'bear_bb_std_mult': 0.7081966756206841, 'bear_rsi_os': 28, 'bear_rsi_ob': 95, 'bear_adx_thresh': 28.388130291546105, 'bear_atr_min_pct': 0.021597349371633823, 'bear_atr_max_pct': 0.04721421952474943, 'bear_tp_mult': 2.8279192856052315, 'bear_tsl_mult': 0.2787627407365725, 'bear_time_stop': 207, 'bear_use_sma': True, 'bear_use_ema': False, 'bear_use_atr': False, 'bear_use_adx': False, 'bear_use_spike': True, 'bear_rsi_required': False, 'sideways_strategy': 'mean_reversion', 'sideways_bb_std_mult': 0.6252858484863503, 'sideways_rsi_os': 50, 'sideways_rsi_ob': 62, 'sideways_adx_thresh': 8.331584607655387, 'sideways_atr_min_pct': 0.013709213096929134, 'sideways_atr_max_pct': 0.03803080627917026, 'sideways_tp_mult': 1.5927502781337721, 'sideways_tsl_mult': 0.1170695223075936, 'sideways_time_stop': 9, 'sideways_use_sma': True, 'sideways_use_ema': False, 'sideways_use_atr': False, 'sideways_use_adx': True, 'sideways_use_spike': True, 'sideways_rsi_required': True}.
[I 2025-09-01 08:41:57,068] Trial 500 finished with values: [-0.05803090183552051, 0.05821310742776018] and parameters: {'p_sma': 22, 'p_std': 16, 'p_atr': 14, 'p_adx': 20, 'rsi_period': 15, 'ema1': 10, 'ema2': 14, 'slip_atr_k': 0.03798920023040764, 'slip_spread_k': 0.653269916772053, 'spread_hl_frac': 0.004403483973541816, 'bb_std_mult': 3.3882530599888576, 'rsi_os': 12, 'rsi_ob': 95, 'vol_spike': 0.033647581504094845, 'adx_thresh': 24.938310328162565, 'atr_min_pct': 0.021503625558085257, 'atr_max_pct': 0.07357829787703822, 'tp_mult': 1.2235897283551886, 'tsl_mult': 0.9475501551897866, 'strategy': 'mean_reversion', 'time_stop': 244, 'use_sma': True, 'use_atr': False, 'use_adx': True, 'use_ema': True, 'use_spike': False, 'rsi_required': False, 'edge_k': 1.4681862692983896, 'edge_cap': 0.07152630433505923, 'bull_strategy': 'breakout', 'bull_bb_std_mult': 2.797282952425304, 'bull_rsi_os': 11, 'bull_rsi_ob': 69, 'bull_adx_thresh': 9.198350974446793, 'bull_atr_min_pct': 0.02799644319810187, 'bull_atr_max_pct': 0.05038346754428194, 'bull_tp_mult': 2.227598150947303, 'bull_tsl_mult': 0.2406365056031612, 'bull_time_stop': 159, 'bull_use_sma': True, 'bull_use_ema': True, 'bull_use_atr': False, 'bull_use_adx': True, 'bull_use_spike': True, 'bull_rsi_required': False, 'bear_strategy': 'mean_reversion', 'bear_bb_std_mult': 2.1098781683720005, 'bear_rsi_os': 28, 'bear_rsi_ob': 72, 'bear_adx_thresh': 30.852540575048543, 'bear_atr_min_pct': 0.021450639993930834, 'bear_atr_max_pct': 0.08093579152821487, 'bear_tp_mult': 2.8342435582650776, 'bear_tsl_mult': 0.0013789120360347962, 'bear_time_stop': 284, 'bear_use_sma': True, 'bear_use_ema': False, 'bear_use_atr': False, 'bear_use_adx': True, 'bear_use_spike': True, 'bear_rsi_required': False, 'sideways_strategy': 'mean_reversion', 'sideways_bb_std_mult': 0.5964622119262772, 'sideways_rsi_os': 18, 'sideways_rsi_ob': 62, 'sideways_adx_thresh': 8.341491897773942, 'sideways_atr_min_pct': 0.003339972431757432, 'sideways_atr_max_pct': 0.03936769810319623, 'sideways_tp_mult': 2.496507158484939, 'sideways_tsl_mult': 0.7400630087515145, 'sideways_time_stop': 281, 'sideways_use_sma': True, 'sideways_use_ema': False, 'sideways_use_atr': False, 'sideways_use_adx': True, 'sideways_use_spike': True, 'sideways_rsi_required': True}.
[I 2025-09-01 08:41:58,035] Trial 506 finished with values: [-1000000000.0, 1000000000.0] and parameters: {'p_sma': 20, 'p_std': 17, 'p_atr': 7, 'p_adx': 22, 'rsi_period': 70, 'ema1': 14, 'ema2': 36, 'slip_atr_k': 0.05221856398503094, 'slip_spread_k': 0.7466127484626061, 'spread_hl_frac': 0.023272709760296932, 'bb_std_mult': 1.80122165683937, 'rsi_os': 26, 'rsi_ob': 55, 'vol_spike': 0.2837547140768233, 'adx_thresh': 15.137213788523429, 'atr_min_pct': 0.020409157823669886, 'atr_max_pct': 0.010769798506513426, 'tp_mult': 1.212630511879187, 'tsl_mult': 0.5059137038332353, 'strategy': 'breakout', 'time_stop': 230, 'use_sma': False, 'use_atr': True, 'use_adx': False, 'use_ema': True, 'use_spike': True, 'rsi_required': True, 'edge_k': 1.0426903988869378, 'edge_cap': 0.16481700989175022, 'bull_strategy': 'mean_reversion', 'bull_bb_std_mult': 2.0776745627265463, 'bull_rsi_os': 15, 'bull_rsi_ob': 72, 'bull_adx_thresh': 5.993207184494704, 'bull_atr_min_pct': 0.006763232240976689, 'bull_atr_max_pct': 0.04401825468602361, 'bull_tp_mult': 2.2790954937405057, 'bull_tsl_mult': 0.6573281781975583, 'bull_time_stop': 148, 'bull_use_sma': False, 'bull_use_ema': False, 'bull_use_atr': False, 'bull_use_adx': False, 'bull_use_spike': True, 'bull_rsi_required': True, 'bear_strategy': 'breakout', 'bear_bb_std_mult': 0.625885394695834, 'bear_rsi_os': 45, 'bear_rsi_ob': 84, 'bear_adx_thresh': 32.95229557779156, 'bear_atr_min_pct': 0.0031795616627855496, 'bear_atr_max_pct': 0.08898745140742642, 'bear_tp_mult': 2.4108331925643323, 'bear_tsl_mult': 0.041889359442673385, 'bear_time_stop': 81, 'bear_use_sma': False, 'bear_use_ema': True, 'bear_use_atr': True, 'bear_use_adx': True, 'bear_use_spike': True, 'bear_rsi_required': True, 'sideways_strategy': 'mean_reversion', 'sideways_bb_std_mult': 1.2053178076794593, 'sideways_rsi_os': 40, 'sideways_rsi_ob': 86, 'sideways_adx_thresh': 29.090541281365297, 'sideways_atr_min_pct': 0.025169929581091773, 'sideways_atr_max_pct': 0.08498208658158803, 'sideways_tp_mult': 2.772945614904252, 'sideways_tsl_mult': 0.14799806013433947, 'sideways_time_stop': 32, 'sideways_use_sma': False, 'sideways_use_ema': True, 'sideways_use_atr': False, 'sideways_use_adx': False, 'sideways_use_spike': False, 'sideways_rsi_required': False}.
