[I 2025-09-01 08:53:23,169] Trial 564 finished with values: [-1000000000.0, 1000000000.0] and parameters: {'p_sma': 26, 'p_std': 14, 'p_atr': 22, 'p_adx': 30, 'rsi_period': 64, 'ema1': 10, 'ema2': 16, 'slip_atr_k': 0.0646872991520777, 'slip_spread_k': 0.6768076364556004, 'spread_hl_frac': 0.026956831561917877, 'bb_std_mult': 3.489116191397567, 'rsi_os': 43, 'rsi_ob': 57, 'vol_spike': 0.24712864937579018, 'adx_thresh': 24.563994081576475, 'atr_min_pct': 0.020696378255336552, 'atr_max_pct': 0.06243473169131893, 'tp_mult': 1.769170069147267, 'tsl_mult': 0.019142035127785006, 'strategy': 'mean_reversion', 'time_stop': 227, 'use_sma': True, 'use_atr': True, 'use_adx': True, 'use_ema': False, 'use_spike': True, 'rsi_required': False, 'edge_k': 1.1540752730058121, 'edge_cap': 0.6686159141844639, 'bull_strategy': 'breakout', 'bull_bb_std_mult': 3.532885883123621, 'bull_rsi_os': 20, 'bull_rsi_ob': 69, 'bull_adx_thresh': 7.1531218385304385, 'bull_atr_min_pct': 0.00792480503301231, 'bull_atr_max_pct': 0.05661018261271888, 'bull_tp_mult': 2.771510048162157, 'bull_tsl_mult': 0.6456881204931654, 'bull_time_stop': 143, 'bull_use_sma': True, 'bull_use_ema': False, 'bull_use_atr': False, 'bull_use_adx': True, 'bull_use_spike': True, 'bull_rsi_required': False, 'bear_strategy': 'mean_reversion', 'bear_bb_std_mult': 1.9999194205590114, 'bear_rsi_os': 24, 'bear_rsi_ob': 95, 'bear_adx_thresh': 33.672701674203594, 'bear_atr_min_pct': 0.025776271723120782, 'bear_atr_max_pct': 0.12968029228887334, 'bear_tp_mult': 1.451367502604046, 'bear_tsl_mult': 0.4072077237715705, 'bear_time_stop': 95, 'bear_use_sma': False, 'bear_use_ema': True, 'bear_use_atr': True, 'bear_use_adx': True, 'bear_use_spike': True, 'bear_rsi_required': False, 'sideways_strategy': 'breakout', 'sideways_bb_std_mult': 3.032568294515494, 'sideways_rsi_os': 11, 'sideways_rsi_ob': 64, 'sideways_adx_thresh': 9.017008103047427, 'sideways_atr_min_pct': 0.015097712932283644, 'sideways_atr_max_pct': 0.09295687431143439, 'sideways_tp_mult': 2.622476207719287, 'sideways_tsl_mult': 0.4390135554940022, 'sideways_time_stop': 30, 'sideways_use_sma': True, 'sideways_use_ema': False, 'sideways_use_atr': True, 'sideways_use_adx': True, 'sideways_use_spike': True, 'sideways_rsi_required': False}.
[I 2025-09-01 08:53:23,692] Trial 567 finished with values: [-1000000000.0, 1000000000.0] and parameters: {'p_sma': 17, 'p_std': 13, 'p_atr': 12, 'p_adx': 20, 'rsi_period': 63, 'ema1': 10, 'ema2': 51, 'slip_atr_k': 0.015773829732545305, 'slip_spread_k': 0.6713552004354196, 'spread_hl_frac': 0.045630843055352595, 'bb_std_mult': 1.7362211850316345, 'rsi_os': 22, 'rsi_ob': 57, 'vol_spike': 0.09394339167600224, 'adx_thresh': 24.570121353728325, 'atr_min_pct': 0.02770254578232097, 'atr_max_pct': 0.07964134718860195, 'tp_mult': 1.1249276746417203, 'tsl_mult': 0.599045141662115, 'strategy': 'mean_reversion', 'time_stop': 229, 'use_sma': True, 'use_atr': False, 'use_adx': True, 'use_ema': False, 'use_spike': True, 'rsi_required': False, 'edge_k': 0.9595399467143635, 'edge_cap': 0.1442520442755526, 'bull_strategy': 'breakout', 'bull_bb_std_mult': 1.1527137772099314, 'bull_rsi_os': 12, 'bull_rsi_ob': 70, 'bull_adx_thresh': 5.069547842676432, 'bull_atr_min_pct': 0.005810603641888567, 'bull_atr_max_pct': 0.1227497723985703, 'bull_tp_mult': 2.6401890066145195, 'bull_tsl_mult': 0.5836372255238399, 'bull_time_stop': 234, 'bull_use_sma': True, 'bull_use_ema': True, 'bull_use_atr': False, 'bull_use_adx': True, 'bull_use_spike': True, 'bull_rsi_required': False, 'bear_strategy': 'mean_reversion', 'bear_bb_std_mult': 2.514520331354497, 'bear_rsi_os': 27, 'bear_rsi_ob': 95, 'bear_adx_thresh': 15.237929970199048, 'bear_atr_min_pct': 0.02364752194107537, 'bear_atr_max_pct': 0.03195244636709553, 'bear_tp_mult': 1.4666813561797605, 'bear_tsl_mult': 0.08081381361559316, 'bear_time_stop': 29, 'bear_use_sma': False, 'bear_use_ema': True, 'bear_use_atr': True, 'bear_use_adx': True, 'bear_use_spike': True, 'bear_rsi_required': False, 'sideways_strategy': 'mean_reversion', 'sideways_bb_std_mult': 0.5487431692438856, 'sideways_rsi_os': 41, 'sideways_rsi_ob': 64, 'sideways_adx_thresh': 17.66129894893288, 'sideways_atr_min_pct': 0.023504604403348815, 'sideways_atr_max_pct': 0.1022592605809175, 'sideways_tp_mult': 1.153919195447648, 'sideways_tsl_mult': 0.1543350633427224, 'sideways_time_stop': 215, 'sideways_use_sma': False, 'sideways_use_ema': True, 'sideways_use_atr': False, 'sideways_use_adx': True, 'sideways_use_spike': True, 'sideways_rsi_required': False}.
[I 2025-09-01 08:53:24,232] Trial 569 finished with values: [-1000000000.0, 1000000000.0] and parameters: {'p_sma': 21, 'p_std': 14, 'p_atr': 12, 'p_adx': 20, 'rsi_period': 65, 'ema1': 22, 'ema2': 51, 'slip_atr_k': 0.04680835796992642, 'slip_spread_k': 0.514099154632638, 'spread_hl_frac': 0.039190197170305266, 'bb_std_mult': 2.8918264469747417, 'rsi_os': 22, 'rsi_ob': 78, 'vol_spike': 0.06822661457282263, 'adx_thresh': 26.908440607839555, 'atr_min_pct': 0.02046846246826037, 'atr_max_pct': 0.0798067061873628, 'tp_mult': 1.1658471339658307, 'tsl_mult': 0.45352828268527234, 'strategy': 'mean_reversion', 'time_stop': 152, 'use_sma': True, 'use_atr': True, 'use_adx': True, 'use_ema': True, 'use_spike': True, 'rsi_required': True, 'edge_k': 0.411726175804383, 'edge_cap': 0.09752851755272214, 'bull_strategy': 'breakout', 'bull_bb_std_mult': 0.5947766118546585, 'bull_rsi_os': 13, 'bull_rsi_ob': 93, 'bull_adx_thresh': 17.78387154748399, 'bull_atr_min_pct': 0.005526459084305768, 'bull_atr_max_pct': 0.04303631369546398, 'bull_tp_mult': 1.4888676077592922, 'bull_tsl_mult': 0.33229563797495043, 'bull_time_stop': 154, 'bull_use_sma': True, 'bull_use_ema': False, 'bull_use_atr': False, 'bull_use_adx': True, 'bull_use_spike': True, 'bull_rsi_required': False, 'bear_strategy': 'mean_reversion', 'bear_bb_std_mult': 3.1062365524653934, 'bear_rsi_os': 48, 'bear_rsi_ob': 92, 'bear_adx_thresh': 15.005438515766837, 'bear_atr_min_pct': 0.023711110930208078, 'bear_atr_max_pct': 0.1126165015677648, 'bear_tp_mult': 2.166045245309687, 'bear_tsl_mult': 0.10955846746963462, 'bear_time_stop': 103, 'bear_use_sma': True, 'bear_use_ema': False, 'bear_use_atr': True, 'bear_use_adx': True, 'bear_use_spike': True, 'bear_rsi_required': False, 'sideways_strategy': 'breakout', 'sideways_bb_std_mult': 2.2580891905013516, 'sideways_rsi_os': 41, 'sideways_rsi_ob': 89, 'sideways_adx_thresh': 18.01087510172414, 'sideways_atr_min_pct': 0.028767963702929986, 'sideways_atr_max_pct': 0.09287378735990971, 'sideways_tp_mult': 1.155339411435179, 'sideways_tsl_mult': 0.15775627179021195, 'sideways_time_stop': 27, 'sideways_use_sma': False, 'sideways_use_ema': False, 'sideways_use_atr': True, 'sideways_use_adx': True, 'sideways_use_spike': True, 'sideways_rsi_required': True}.
[I 2025-09-01 08:53:25,315] Trial 573 finished with values: [-1000000000.0, 1000000000.0] and parameters: {'p_sma': 22, 'p_std': 36, 'p_atr': 29, 'p_adx': 21, 'rsi_period': 66, 'ema1': 15, 'ema2': 13, 'slip_atr_k': 0.05473756339713442, 'slip_spread_k': 0.6454091947721655, 'spread_hl_frac': 2.3651771429690494e-05, 'bb_std_mult': 2.5740083541485355, 'rsi_os': 55, 'rsi_ob': 91, 'vol_spike': 0.2285349480478464, 'adx_thresh': 20.16535107211492, 'atr_min_pct': 0.026449667852848552, 'atr_max_pct': 0.1498552020357009, 'tp_mult': 1.4346296607300206, 'tsl_mult': 0.5659986012223055, 'strategy': 'mean_reversion', 'time_stop': 246, 'use_sma': False, 'use_atr': True, 'use_adx': False, 'use_ema': True, 'use_spike': True, 'rsi_required': True, 'edge_k': 0.8573337353776584, 'edge_cap': 0.08265555157951014, 'bull_strategy': 'mean_reversion', 'bull_bb_std_mult': 2.78556279177134, 'bull_rsi_os': 37, 'bull_rsi_ob': 67, 'bull_adx_thresh': 29.966519137453872, 'bull_atr_min_pct': 0.006476928266355103, 'bull_atr_max_pct': 0.038320872392090866, 'bull_tp_mult': 2.286395597577432, 'bull_tsl_mult': 0.6277492593217616, 'bull_time_stop': 29, 'bull_use_sma': False, 'bull_use_ema': False, 'bull_use_atr': True, 'bull_use_adx': False, 'bull_use_spike': False, 'bull_rsi_required': False, 'bear_strategy': 'mean_reversion', 'bear_bb_std_mult': 1.4304960497018064, 'bear_rsi_os': 26, 'bear_rsi_ob': 69, 'bear_adx_thresh': 31.800504354571995, 'bear_atr_min_pct': 0.023238857236402812, 'bear_atr_max_pct': 0.10033178027821336, 'bear_tp_mult': 2.8884536009438886, 'bear_tsl_mult': 0.07595477552467016, 'bear_time_stop': 85, 'bear_use_sma': True, 'bear_use_ema': False, 'bear_use_atr': False, 'bear_use_adx': False, 'bear_use_spike': True, 'bear_rsi_required': True, 'sideways_strategy': 'mean_reversion', 'sideways_bb_std_mult': 1.130077918939333, 'sideways_rsi_os': 26, 'sideways_rsi_ob': 65, 'sideways_adx_thresh': 8.228064953174991, 'sideways_atr_min_pct': 0.019468939505041853, 'sideways_atr_max_pct': 0.14156118069784732, 'sideways_tp_mult': 2.5564698895064666, 'sideways_tsl_mult': 0.20414018474556578, 'sideways_time_stop': 53, 'sideways_use_sma': False, 'sideways_use_ema': False, 'sideways_use_atr': False, 'sideways_use_adx': False, 'sideways_use_spike': False, 'sideways_rsi_required': True}.
[I 2025-09-01 08:54:11,722] Trial 572 finished with values: [-1000000000.0, 1000000000.0] and parameters: {'p_sma': 22, 'p_std': 36, 'p_atr': 11, 'p_adx': 24, 'rsi_period': 66, 'ema1': 12, 'ema2': 39, 'slip_atr_k': 0.20897344949963587, 'slip_spread_k': 0.13800952604447314, 'spread_hl_frac': 0.023832733054193655, 'bb_std_mult': 3.433310327650222, 'rsi_os': 40, 'rsi_ob': 55, 'vol_spike': 0.22792876519941327, 'adx_thresh': 26.90815662001987, 'atr_min_pct': 0.01862354225328974, 'atr_max_pct': 0.1499934159230487, 'tp_mult': 1.2024595829125233, 'tsl_mult': 0.5629737150119959, 'strategy': 'mean_reversion', 'time_stop': 247, 'use_sma': False, 'use_atr': True, 'use_adx': False, 'use_ema': True, 'use_spike': True, 'rsi_required': True, 'edge_k': 0.4887284369099446, 'edge_cap': 0.05009023289567043, 'bull_strategy': 'mean_reversion', 'bull_bb_std_mult': 2.761270165378584, 'bull_rsi_os': 37, 'bull_rsi_ob': 66, 'bull_adx_thresh': 18.5315795271502, 'bull_atr_min_pct': 0.009009105903966617, 'bull_atr_max_pct': 0.04145141361276735, 'bull_tp_mult': 2.2937902007525492, 'bull_tsl_mult': 0.3263403508358791, 'bull_time_stop': 151, 'bull_use_sma': False, 'bull_use_ema': False, 'bull_use_atr': False, 'bull_use_adx': False, 'bull_use_spike': True, 'bull_rsi_required': False, 'bear_strategy': 'mean_reversion', 'bear_bb_std_mult': 0.5718796661527141, 'bear_rsi_os': 48, 'bear_rsi_ob': 48, 'bear_adx_thresh': 25.81344196377947, 'bear_atr_min_pct': 0.00617789590702196, 'bear_atr_max_pct': 0.09770132809693538, 'bear_tp_mult': 2.7905437009260434, 'bear_tsl_mult': 0.10454281557686745, 'bear_time_stop': 86, 'bear_use_sma': True, 'bear_use_ema': False, 'bear_use_atr': False, 'bear_use_adx': False, 'bear_use_spike': True, 'bear_rsi_required': True, 'sideways_strategy': 'mean_reversion', 'sideways_bb_std_mult': 0.6789477858901964, 'sideways_rsi_os': 39, 'sideways_rsi_ob': 67, 'sideways_adx_thresh': 32.74244285670226, 'sideways_atr_min_pct': 0.018579273798894312, 'sideways_atr_max_pct': 0.028784890717954516, 'sideways_tp_mult': 1.2998980504526552, 'sideways_tsl_mult': 0.6106549032760611, 'sideways_time_stop': 14, 'sideways_use_sma': False, 'sideways_use_ema': False, 'sideways_use_atr': False, 'sideways_use_adx': False, 'sideways_use_spike': False, 'sideways_rsi_required': True}.
[I 2025-09-01 08:54:12,570] Trial 570 finished with values: [-1000000000.0, 1000000000.0] and parameters: {'p_sma': 22, 'p_std': 54, 'p_atr': 11, 'p_adx': 20, 'rsi_period': 65, 'ema1': 15, 'ema2': 13, 'slip_atr_k': 0.045446138656121945, 'slip_spread_k': 0.6500011353907121, 'spread_hl_frac': 0.023709316153177642, 'bb_std_mult': 2.5368410537390713, 'rsi_os': 22, 'rsi_ob': 55, 'vol_spike': 0.2283116574725629, 'adx_thresh': 26.92893906036796, 'atr_min_pct': 0.019101332115496833, 'atr_max_pct': 0.14718021092467606, 'tp_mult': 1.2178864534343021, 'tsl_mult': 0.7808569690624628, 'strategy': 'mean_reversion', 'time_stop': 59, 'use_sma': True, 'use_atr': True, 'use_adx': True, 'use_ema': True, 'use_spike': True, 'rsi_required': True, 'edge_k': 1.5891478703901216, 'edge_cap': 0.09351833782030836, 'bull_strategy': 'breakout', 'bull_bb_std_mult': 0.7196800968922923, 'bull_rsi_os': 47, 'bull_rsi_ob': 93, 'bull_adx_thresh': 22.194749163984607, 'bull_atr_min_pct': 0.0089466369914339, 'bull_atr_max_pct': 0.04185531536185319, 'bull_tp_mult': 2.2990954570593454, 'bull_tsl_mult': 0.6692600411763114, 'bull_time_stop': 266, 'bull_use_sma': True, 'bull_use_ema': False, 'bull_use_atr': False, 'bull_use_adx': False, 'bull_use_spike': True, 'bull_rsi_required': False, 'bear_strategy': 'mean_reversion', 'bear_bb_std_mult': 3.0945972855464428, 'bear_rsi_os': 26, 'bear_rsi_ob': 83, 'bear_adx_thresh': 32.13683412181786, 'bear_atr_min_pct': 0.023263847979951194, 'bear_atr_max_pct': 0.07664313679436577, 'bear_tp_mult': 2.8839013774639453, 'bear_tsl_mult': 0.08087308038257042, 'bear_time_stop': 86, 'bear_use_sma': True, 'bear_use_ema': False, 'bear_use_atr': True, 'bear_use_adx': True, 'bear_use_spike': True, 'bear_rsi_required': True, 'sideways_strategy': 'mean_reversion', 'sideways_bb_std_mult': 0.5025211692370501, 'sideways_rsi_os': 41, 'sideways_rsi_ob': 67, 'sideways_adx_thresh': 17.89058753870869, 'sideways_atr_min_pct': 0.027020993917425802, 'sideways_atr_max_pct': 0.1025422501247531, 'sideways_tp_mult': 1.2970848935949246, 'sideways_tsl_mult': 0.21478175162992252, 'sideways_time_stop': 16, 'sideways_use_sma': False, 'sideways_use_ema': True, 'sideways_use_atr': False, 'sideways_use_adx': False, 'sideways_use_spike': True, 'sideways_rsi_required': True}.
[I 2025-09-01 08:54:13,451] Trial 574 finished with values: [-1000000000.0, 1000000000.0] and parameters: {'p_sma': 7, 'p_std': 16, 'p_atr': 17, 'p_adx': 24, 'rsi_period': 62, 'ema1': 6, 'ema2': 13, 'slip_atr_k': 0.22973114289950985, 'slip_spread_k': 0.6202730042945038, 'spread_hl_frac': 0.025504651064036994, 'bb_std_mult': 0.877589216835549, 'rsi_os': 18, 'rsi_ob': 55, 'vol_spike': 0.24411788800013842, 'adx_thresh': 11.214553042982109, 'atr_min_pct': 0.019102054439761675, 'atr_max_pct': 0.14717765366902857, 'tp_mult': 2.0961039325815705, 'tsl_mult': 0.08125515677234296, 'strategy': 'mean_reversion', 'time_stop': 61, 'use_sma': True, 'use_atr': True, 'use_adx': True, 'use_ema': True, 'use_spike': True, 'rsi_required': True, 'edge_k': 1.812587100752494, 'edge_cap': 0.5332059491338641, 'bull_strategy': 'breakout', 'bull_bb_std_mult': 2.721092578998355, 'bull_rsi_os': 14, 'bull_rsi_ob': 90, 'bull_adx_thresh': 31.38828407347024, 'bull_atr_min_pct': 0.0073655804797233965, 'bull_atr_max_pct': 0.01896040614577136, 'bull_tp_mult': 1.2167642914085337, 'bull_tsl_mult': 0.5036650080030656, 'bull_time_stop': 243, 'bull_use_sma': True, 'bull_use_ema': False, 'bull_use_atr': False, 'bull_use_adx': False, 'bull_use_spike': True, 'bull_rsi_required': False, 'bear_strategy': 'mean_reversion', 'bear_bb_std_mult': 3.279863017486268, 'bear_rsi_os': 53, 'bear_rsi_ob': 48, 'bear_adx_thresh': 19.483883221100673, 'bear_atr_min_pct': 0.0219489508629875, 'bear_atr_max_pct': 0.09570771730689853, 'bear_tp_mult': 2.7884959491481087, 'bear_tsl_mult': 0.6926378238075515, 'bear_time_stop': 91, 'bear_use_sma': False, 'bear_use_ema': False, 'bear_use_atr': True, 'bear_use_adx': True, 'bear_use_spike': True, 'bear_rsi_required': True, 'sideways_strategy': 'mean_reversion', 'sideways_bb_std_mult': 1.2606496931227187, 'sideways_rsi_os': 42, 'sideways_rsi_ob': 50, 'sideways_adx_thresh': 8.218770454012043, 'sideways_atr_min_pct': 0.02193404066251092, 'sideways_atr_max_pct': 0.08956427026240803, 'sideways_tp_mult': 1.3213371279384099, 'sideways_tsl_mult': 0.4625075600819583, 'sideways_time_stop': 59, 'sideways_use_sma': False, 'sideways_use_ema': False, 'sideways_use_atr': False, 'sideways_use_adx': True, 'sideways_use_spike': True, 'sideways_rsi_required': False}.
[I 2025-09-01 08:54:14,050] Trial 571 finished with values: [-1000000000.0, 0.40820531382218367] and parameters: {'p_sma': 22, 'p_std': 16, 'p_atr': 11, 'p_adx': 20, 'rsi_period': 65, 'ema1': 19, 'ema2': 32, 'slip_atr_k': 0.22851576032878496, 'slip_spread_k': 0.9329528218835669, 'spread_hl_frac': 0.025600173829909832, 'bb_std_mult': 2.5942511402602206, 'rsi_os': 40, 'rsi_ob': 55, 'vol_spike': 0.23579958273564902, 'adx_thresh': 26.931479548162923, 'atr_min_pct': 0.01919893879535197, 'atr_max_pct': 0.1470803520439698, 'tp_mult': 1.1192717080321988, 'tsl_mult': 0.5857121736367463, 'strategy': 'mean_reversion', 'time_stop': 49, 'use_sma': True, 'use_atr': True, 'use_adx': True, 'use_ema': True, 'use_spike': True, 'rsi_required': True, 'edge_k': 1.5864591750734878, 'edge_cap': 0.0976604313588494, 'bull_strategy': 'breakout', 'bull_bb_std_mult': 2.779269270564261, 'bull_rsi_os': 13, 'bull_rsi_ob': 90, 'bull_adx_thresh': 16.132308282573774, 'bull_atr_min_pct': 0.009212533986618823, 'bull_atr_max_pct': 0.038040329066934116, 'bull_tp_mult': 1.1088196996804212, 'bull_tsl_mult': 0.6344459144141312, 'bull_time_stop': 151, 'bull_use_sma': True, 'bull_use_ema': False, 'bull_use_atr': False, 'bull_use_adx': False, 'bull_use_spike': True, 'bull_rsi_required': False, 'bear_strategy': 'mean_reversion', 'bear_bb_std_mult': 3.1088717187151516, 'bear_rsi_os': 41, 'bear_rsi_ob': 48, 'bear_adx_thresh': 19.208604493496342, 'bear_atr_min_pct': 5.548695986436897e-05, 'bear_atr_max_pct': 0.11243485739327977, 'bear_tp_mult': 2.8961373704768985, 'bear_tsl_mult': 0.7888326654601082, 'bear_time_stop': 85, 'bear_use_sma': True, 'bear_use_ema': False, 'bear_use_atr': True, 'bear_use_adx': True, 'bear_use_spike': True, 'bear_rsi_required': True, 'sideways_strategy': 'mean_reversion', 'sideways_bb_std_mult': 0.7007727669553663, 'sideways_rsi_os': 22, 'sideways_rsi_ob': 67, 'sideways_adx_thresh': 33.02080190146145, 'sideways_atr_min_pct': 0.02337416227163302, 'sideways_atr_max_pct': 0.03458128308078279, 'sideways_tp_mult': 1.3305980495245133, 'sideways_tsl_mult': 0.9105731392152093, 'sideways_time_stop': 157, 'sideways_use_sma': False, 'sideways_use_ema': True, 'sideways_use_atr': False, 'sideways_use_adx': False, 'sideways_use_spike': True, 'sideways_rsi_required': True}.
[I 2025-09-01 08:54:59,145] Trial 576 finished with values: [-1000000000.0, 1000000000.0] and parameters: {'p_sma': 7, 'p_std': 16, 'p_atr': 25, 'p_adx': 19, 'rsi_period': 62, 'ema1': 9, 'ema2': 14, 'slip_atr_k': 0.025393641144827145, 'slip_spread_k': 0.6353632061671425, 'spread_hl_frac': 0.01703265807108438, 'bb_std_mult': 1.8526399330988108, 'rsi_os': 30, 'rsi_ob': 71, 'vol_spike': 0.20015022533797827, 'adx_thresh': 34.99203344369135, 'atr_min_pct': 0.022084134491535467, 'atr_max_pct': 0.12964578921725534, 'tp_mult': 1.108730790392353, 'tsl_mult': 0.5022675911171427, 'strategy': 'mean_reversion', 'time_stop': 296, 'use_sma': True, 'use_atr': True, 'use_adx': True, 'use_ema': True, 'use_spike': True, 'rsi_required': True, 'edge_k': 1.0978415540810498, 'edge_cap': 0.18375809063238807, 'bull_strategy': 'breakout', 'bull_bb_std_mult': 2.8218753470034126, 'bull_rsi_os': 13, 'bull_rsi_ob': 68, 'bull_adx_thresh': 7.712434517402555, 'bull_atr_min_pct': 0.005209186222349029, 'bull_atr_max_pct': 0.035186457320588393, 'bull_tp_mult': 1.2152830076366965, 'bull_tsl_mult': 0.5056287758393838, 'bull_time_stop': 159, 'bull_use_sma': True, 'bull_use_ema': False, 'bull_use_atr': True, 'bull_use_adx': True, 'bull_use_spike': False, 'bull_rsi_required': False, 'bear_strategy': 'breakout', 'bear_bb_std_mult': 1.6272317462443442, 'bear_rsi_os': 10, 'bear_rsi_ob': 88, 'bear_adx_thresh': 19.489392043967477, 'bear_atr_min_pct': 0.013134194658428695, 'bear_atr_max_pct': 0.08765664037023331, 'bear_tp_mult': 2.7261008575834196, 'bear_tsl_mult': 0.13499002757637335, 'bear_time_stop': 77, 'bear_use_sma': False, 'bear_use_ema': False, 'bear_use_atr': True, 'bear_use_adx': True, 'bear_use_spike': True, 'bear_rsi_required': False, 'sideways_strategy': 'mean_reversion', 'sideways_bb_std_mult': 0.850729025595659, 'sideways_rsi_os': 22, 'sideways_rsi_ob': 91, 'sideways_adx_thresh': 10.086520438039287, 'sideways_atr_min_pct': 0.003035655986099013, 'sideways_atr_max_pct': 0.1459876858136931, 'sideways_tp_mult': 2.6077728953333814, 'sideways_tsl_mult': 0.38290724322897596, 'sideways_time_stop': 21, 'sideways_use_sma': False, 'sideways_use_ema': False, 'sideways_use_atr': False, 'sideways_use_adx': True, 'sideways_use_spike': True, 'sideways_rsi_required': False}.
