[I 2025-09-01 08:24:07,386] Trial 396 finished with values: [-0.14240460092971985, 0.14215377602524856] and parameters: {'p_sma': 20, 'p_std': 25, 'p_atr': 21, 'p_adx': 19, 'rsi_period': 36, 'ema1': 17, 'ema2': 14, 'slip_atr_k': 0.07080489780072789, 'slip_spread_k': 0.587612538084529, 'spread_hl_frac': 0.023663344044092968, 'bb_std_mult': 3.4353680457148394, 'rsi_os': 25, 'rsi_ob': 58, 'vol_spike': 0.2385694709899693, 'adx_thresh': 30.654962658582022, 'atr_min_pct': 0.02039482831957597, 'atr_max_pct': 0.13817595293358637, 'tp_mult': 1.162588525247893, 'tsl_mult': 0.43063668241023817, 'strategy': 'mean_reversion', 'time_stop': 27, 'use_sma': True, 'use_atr': True, 'use_adx': True, 'use_ema': False, 'use_spike': True, 'rsi_required': True, 'edge_k': 1.311268809441538, 'edge_cap': 0.270049315413499, 'bull_strategy': 'breakout', 'bull_bb_std_mult': 2.498448907640753, 'bull_rsi_os': 53, 'bull_rsi_ob': 91, 'bull_adx_thresh': 8.758528242045061, 'bull_atr_min_pct': 0.0011374084927763465, 'bull_atr_max_pct': 0.11101341065047392, 'bull_tp_mult': 2.3742032695557715, 'bull_tsl_mult': 0.39417874023274113, 'bull_time_stop': 159, 'bull_use_sma': True, 'bull_use_ema': False, 'bull_use_atr': False, 'bull_use_adx': True, 'bull_use_spike': True, 'bull_rsi_required': False, 'bear_strategy': 'mean_reversion', 'bear_bb_std_mult': 2.9967440649967614, 'bear_rsi_os': 27, 'bear_rsi_ob': 94, 'bear_adx_thresh': 11.979298921382867, 'bear_atr_min_pct': 0.01947822764974105, 'bear_atr_max_pct': 0.07650138687027064, 'bear_tp_mult': 2.7579971348497647, 'bear_tsl_mult': 0.5790849147939886, 'bear_time_stop': 260, 'bear_use_sma': False, 'bear_use_ema': False, 'bear_use_atr': True, 'bear_use_adx': True, 'bear_use_spike': True, 'bear_rsi_required': False, 'sideways_strategy': 'mean_reversion', 'sideways_bb_std_mult': 0.7410109332466143, 'sideways_rsi_os': 40, 'sideways_rsi_ob': 74, 'sideways_adx_thresh': 23.784782812272486, 'sideways_atr_min_pct': 0.02364023814336597, 'sideways_atr_max_pct': 0.08782122273238467, 'sideways_tp_mult': 2.9122298449615203, 'sideways_tsl_mult': 0.2145794868589999, 'sideways_time_stop': 181, 'sideways_use_sma': False, 'sideways_use_ema': False, 'sideways_use_atr': False, 'sideways_use_adx': False, 'sideways_use_spike': True, 'sideways_rsi_required': False}.
[I 2025-09-01 08:24:07,397] Trial 395 finished with values: [-1000000000.0, 1000000000.0] and parameters: {'p_sma': 20, 'p_std': 56, 'p_atr': 12, 'p_adx': 19, 'rsi_period': 64, 'ema1': 24, 'ema2': 14, 'slip_atr_k': 0.20121982248982395, 'slip_spread_k': 0.5923980793674392, 'spread_hl_frac': 0.0014141093593684068, 'bb_std_mult': 2.3421140095809787, 'rsi_os': 41, 'rsi_ob': 90, 'vol_spike': 0.23889138564810392, 'adx_thresh': 24.17532274125405, 'atr_min_pct': 0.005348676591649804, 'atr_max_pct': 0.137086704297312, 'tp_mult': 1.2389468654254798, 'tsl_mult': 0.7442161859382009, 'strategy': 'mean_reversion', 'time_stop': 264, 'use_sma': True, 'use_atr': True, 'use_adx': True, 'use_ema': False, 'use_spike': True, 'rsi_required': True, 'edge_k': 1.2916869885516513, 'edge_cap': 0.08121080992015828, 'bull_strategy': 'breakout', 'bull_bb_std_mult': 2.8072705461119805, 'bull_rsi_os': 41, 'bull_rsi_ob': 68, 'bull_adx_thresh': 8.234387358426462, 'bull_atr_min_pct': 0.008793518223905297, 'bull_atr_max_pct': 0.03981064844312593, 'bull_tp_mult': 2.3591947902850663, 'bull_tsl_mult': 0.48097492772219413, 'bull_time_stop': 159, 'bull_use_sma': True, 'bull_use_ema': False, 'bull_use_atr': False, 'bull_use_adx': True, 'bull_use_spike': True, 'bull_rsi_required': False, 'bear_strategy': 'mean_reversion', 'bear_bb_std_mult': 2.2327869683750374, 'bear_rsi_os': 27, 'bear_rsi_ob': 94, 'bear_adx_thresh': 33.47421417679695, 'bear_atr_min_pct': 0.0026347586606690846, 'bear_atr_max_pct': 0.07563938154143893, 'bear_tp_mult': 2.7612956798055905, 'bear_tsl_mult': 0.5818742105083716, 'bear_time_stop': 66, 'bear_use_sma': False, 'bear_use_ema': False, 'bear_use_atr': True, 'bear_use_adx': True, 'bear_use_spike': True, 'bear_rsi_required': False, 'sideways_strategy': 'mean_reversion', 'sideways_bb_std_mult': 0.7417131236113051, 'sideways_rsi_os': 49, 'sideways_rsi_ob': 74, 'sideways_adx_thresh': 9.787449334454461, 'sideways_atr_min_pct': 0.023520435490573758, 'sideways_atr_max_pct': 0.12758238950983497, 'sideways_tp_mult': 2.6732381276225206, 'sideways_tsl_mult': 0.15741163855536175, 'sideways_time_stop': 25, 'sideways_use_sma': False, 'sideways_use_ema': False, 'sideways_use_atr': False, 'sideways_use_adx': False, 'sideways_use_spike': True, 'sideways_rsi_required': False}.
[I 2025-09-01 08:24:52,740] Trial 399 finished with values: [-1000000000.0, 1000000000.0] and parameters: {'p_sma': 18, 'p_std': 20, 'p_atr': 8, 'p_adx': 20, 'rsi_period': 67, 'ema1': 11, 'ema2': 49, 'slip_atr_k': 0.02340973145485388, 'slip_spread_k': 0.595320031633556, 'spread_hl_frac': 0.023492217278524487, 'bb_std_mult': 3.3436211068033703, 'rsi_os': 13, 'rsi_ob': 83, 'vol_spike': 0.24078231417018894, 'adx_thresh': 16.733917684845856, 'atr_min_pct': 0.0019628683581102892, 'atr_max_pct': 0.1438292862946386, 'tp_mult': 2.592429301707923, 'tsl_mult': 0.31849899200460197, 'strategy': 'mean_reversion', 'time_stop': 117, 'use_sma': True, 'use_atr': True, 'use_adx': True, 'use_ema': False, 'use_spike': True, 'rsi_required': True, 'edge_k': 1.2703767333561506, 'edge_cap': 0.0716637912449708, 'bull_strategy': 'breakout', 'bull_bb_std_mult': 2.772033116140389, 'bull_rsi_os': 13, 'bull_rsi_ob': 70, 'bull_adx_thresh': 19.694068997678922, 'bull_atr_min_pct': 0.024721690627023993, 'bull_atr_max_pct': 0.10683701085296496, 'bull_tp_mult': 1.3960619603910511, 'bull_tsl_mult': 0.6999840635584622, 'bull_time_stop': 96, 'bull_use_sma': True, 'bull_use_ema': False, 'bull_use_atr': False, 'bull_use_adx': True, 'bull_use_spike': True, 'bull_rsi_required': False, 'bear_strategy': 'mean_reversion', 'bear_bb_std_mult': 1.8666730629879662, 'bear_rsi_os': 55, 'bear_rsi_ob': 65, 'bear_adx_thresh': 30.978817872233055, 'bear_atr_min_pct': 0.023169386828219347, 'bear_atr_max_pct': 0.021368471553432453, 'bear_tp_mult': 1.1353011953711927, 'bear_tsl_mult': 0.9990016508942888, 'bear_time_stop': 88, 'bear_use_sma': False, 'bear_use_ema': True, 'bear_use_atr': True, 'bear_use_adx': True, 'bear_use_spike': True, 'bear_rsi_required': False, 'sideways_strategy': 'mean_reversion', 'sideways_bb_std_mult': 2.3659182778746706, 'sideways_rsi_os': 39, 'sideways_rsi_ob': 80, 'sideways_adx_thresh': 23.519091551391433, 'sideways_atr_min_pct': 0.023679764575243168, 'sideways_atr_max_pct': 0.060842581482132715, 'sideways_tp_mult': 2.68695833488823, 'sideways_tsl_mult': 0.691873606360984, 'sideways_time_stop': 181, 'sideways_use_sma': False, 'sideways_use_ema': False, 'sideways_use_atr': False, 'sideways_use_adx': False, 'sideways_use_spike': True, 'sideways_rsi_required': False}.
[I 2025-09-01 08:24:53,204] Trial 398 finished with values: [-1000000000.0, 1000000000.0] and parameters: {'p_sma': 20, 'p_std': 15, 'p_atr': 12, 'p_adx': 20, 'rsi_period': 67, 'ema1': 24, 'ema2': 14, 'slip_atr_k': 0.06877307624282208, 'slip_spread_k': 0.9365449241123411, 'spread_hl_frac': 0.021894045714012864, 'bb_std_mult': 0.7014669572819936, 'rsi_os': 25, 'rsi_ob': 90, 'vol_spike': 0.24371583593750334, 'adx_thresh': 20.053989135029113, 'atr_min_pct': 0.022650457895798306, 'atr_max_pct': 0.13718771945940444, 'tp_mult': 1.759236009932631, 'tsl_mult': 0.4388421024904812, 'strategy': 'mean_reversion', 'time_stop': 120, 'use_sma': True, 'use_atr': True, 'use_adx': True, 'use_ema': True, 'use_spike': True, 'rsi_required': True, 'edge_k': 1.8871753210475974, 'edge_cap': 0.08275455381099417, 'bull_strategy': 'breakout', 'bull_bb_std_mult': 3.506587217359429, 'bull_rsi_os': 13, 'bull_rsi_ob': 72, 'bull_adx_thresh': 23.240405101401596, 'bull_atr_min_pct': 0.020243454325128633, 'bull_atr_max_pct': 0.10667433149433886, 'bull_tp_mult': 2.3960422241497925, 'bull_tsl_mult': 0.7046672504943517, 'bull_time_stop': 158, 'bull_use_sma': True, 'bull_use_ema': False, 'bull_use_atr': False, 'bull_use_adx': True, 'bull_use_spike': True, 'bull_rsi_required': False, 'bear_strategy': 'mean_reversion', 'bear_bb_std_mult': 2.7400004812380985, 'bear_rsi_os': 24, 'bear_rsi_ob': 92, 'bear_adx_thresh': 33.48226008985946, 'bear_atr_min_pct': 0.023120040564849308, 'bear_atr_max_pct': 0.05228845535079642, 'bear_tp_mult': 2.128975154997299, 'bear_tsl_mult': 0.08834310784038005, 'bear_time_stop': 210, 'bear_use_sma': False, 'bear_use_ema': False, 'bear_use_atr': True, 'bear_use_adx': True, 'bear_use_spike': True, 'bear_rsi_required': False, 'sideways_strategy': 'mean_reversion', 'sideways_bb_std_mult': 0.501267605705598, 'sideways_rsi_os': 39, 'sideways_rsi_ob': 70, 'sideways_adx_thresh': 9.662011506351293, 'sideways_atr_min_pct': 0.023795013429750052, 'sideways_atr_max_pct': 0.08719775321247661, 'sideways_tp_mult': 2.2746869599729935, 'sideways_tsl_mult': 0.1689890250001634, 'sideways_time_stop': 26, 'sideways_use_sma': False, 'sideways_use_ema': False, 'sideways_use_atr': False, 'sideways_use_adx': True, 'sideways_use_spike': True, 'sideways_rsi_required': False}.
[I 2025-09-01 08:24:53,494] Trial 400 finished with values: [-1000000000.0, 1000000000.0] and parameters: {'p_sma': 7, 'p_std': 22, 'p_atr': 22, 'p_adx': 20, 'rsi_period': 67, 'ema1': 29, 'ema2': 12, 'slip_atr_k': 0.05673544114653055, 'slip_spread_k': 0.6202448751872153, 'spread_hl_frac': 0.009919922433557835, 'bb_std_mult': 1.8612379485907817, 'rsi_os': 41, 'rsi_ob': 83, 'vol_spike': 0.25256742353956607, 'adx_thresh': 23.62310800532922, 'atr_min_pct': 0.021009296006463316, 'atr_max_pct': 0.10191190595742747, 'tp_mult': 2.5976297821387977, 'tsl_mult': 0.5060065200270112, 'strategy': 'mean_reversion', 'time_stop': 246, 'use_sma': True, 'use_atr': True, 'use_adx': True, 'use_ema': True, 'use_spike': True, 'rsi_required': True, 'edge_k': 0.994370674965514, 'edge_cap': 0.08640297370707695, 'bull_strategy': 'breakout', 'bull_bb_std_mult': 2.7790399133163777, 'bull_rsi_os': 41, 'bull_rsi_ob': 70, 'bull_adx_thresh': 17.267326797020424, 'bull_atr_min_pct': 0.008552952561183174, 'bull_atr_max_pct': 0.04025262717497907, 'bull_tp_mult': 1.763524935779338, 'bull_tsl_mult': 0.711951805956212, 'bull_time_stop': 177, 'bull_use_sma': True, 'bull_use_ema': False, 'bull_use_atr': False, 'bull_use_adx': True, 'bull_use_spike': True, 'bull_rsi_required': False, 'bear_strategy': 'mean_reversion', 'bear_bb_std_mult': 2.6902315305986098, 'bear_rsi_os': 49, 'bear_rsi_ob': 61, 'bear_adx_thresh': 31.32792989711806, 'bear_atr_min_pct': 0.023166696589861528, 'bear_atr_max_pct': 0.0794022059806344, 'bear_tp_mult': 1.5374070822201729, 'bear_tsl_mult': 0.9156169760672681, 'bear_time_stop': 72, 'bear_use_sma': False, 'bear_use_ema': True, 'bear_use_atr': True, 'bear_use_adx': True, 'bear_use_spike': True, 'bear_rsi_required': False, 'sideways_strategy': 'mean_reversion', 'sideways_bb_std_mult': 1.6580346745658139, 'sideways_rsi_os': 35, 'sideways_rsi_ob': 89, 'sideways_adx_thresh': 9.491464967426662, 'sideways_atr_min_pct': 0.017883761929868965, 'sideways_atr_max_pct': 0.050388335721967076, 'sideways_tp_mult': 2.6980198302663894, 'sideways_tsl_mult': 0.1602266849036574, 'sideways_time_stop': 27, 'sideways_use_sma': False, 'sideways_use_ema': False, 'sideways_use_atr': False, 'sideways_use_adx': True, 'sideways_use_spike': True, 'sideways_rsi_required': False}.
[I 2025-09-01 08:24:53,934] Trial 401 finished with values: [-1000000000.0, 1000000000.0] and parameters: {'p_sma': 17, 'p_std': 15, 'p_atr': 28, 'p_adx': 20, 'rsi_period': 67, 'ema1': 11, 'ema2': 59, 'slip_atr_k': 0.17016358354149574, 'slip_spread_k': 0.9477265515858831, 'spread_hl_frac': 0.00963090769649633, 'bb_std_mult': 3.3568274412631256, 'rsi_os': 23, 'rsi_ob': 57, 'vol_spike': 0.13391639470415836, 'adx_thresh': 26.607254708330178, 'atr_min_pct': 0.008640281711776453, 'atr_max_pct': 0.14305008905703676, 'tp_mult': 1.1271998365206397, 'tsl_mult': 0.9984015101080019, 'strategy': 'mean_reversion', 'time_stop': 244, 'use_sma': True, 'use_atr': True, 'use_adx': True, 'use_ema': True, 'use_spike': True, 'rsi_required': True, 'edge_k': 1.884701018991415, 'edge_cap': 0.3932815192863618, 'bull_strategy': 'breakout', 'bull_bb_std_mult': 3.0014161247090874, 'bull_rsi_os': 13, 'bull_rsi_ob': 76, 'bull_adx_thresh': 19.37791840733621, 'bull_atr_min_pct': 0.020156443522782976, 'bull_atr_max_pct': 0.03921447830196353, 'bull_tp_mult': 2.2649358707296487, 'bull_tsl_mult': 0.709205461515142, 'bull_time_stop': 179, 'bull_use_sma': True, 'bull_use_ema': False, 'bull_use_atr': False, 'bull_use_adx': True, 'bull_use_spike': True, 'bull_rsi_required': False, 'bear_strategy': 'mean_reversion', 'bear_bb_std_mult': 1.8572785703706587, 'bear_rsi_os': 10, 'bear_rsi_ob': 80, 'bear_adx_thresh': 31.2631429723094, 'bear_atr_min_pct': 0.02311347274084847, 'bear_atr_max_pct': 0.1307454664134775, 'bear_tp_mult': 1.5512843038347355, 'bear_tsl_mult': 0.2968921385050958, 'bear_time_stop': 88, 'bear_use_sma': False, 'bear_use_ema': True, 'bear_use_atr': True, 'bear_use_adx': True, 'bear_use_spike': True, 'bear_rsi_required': False, 'sideways_strategy': 'mean_reversion', 'sideways_bb_std_mult': 2.369354042756405, 'sideways_rsi_os': 35, 'sideways_rsi_ob': 56, 'sideways_adx_thresh': 31.835952001015837, 'sideways_atr_min_pct': 0.0206118669704812, 'sideways_atr_max_pct': 0.03628809112440253, 'sideways_tp_mult': 2.5625701747653187, 'sideways_tsl_mult': 0.1309888650428942, 'sideways_time_stop': 15, 'sideways_use_sma': False, 'sideways_use_ema': False, 'sideways_use_atr': False, 'sideways_use_adx': True, 'sideways_use_spike': True, 'sideways_rsi_required': False}.
[I 2025-09-01 08:25:38,099] Trial 402 finished with values: [-1000000000.0, 1000000000.0] and parameters: {'p_sma': 33, 'p_std': 59, 'p_atr': 27, 'p_adx': 20, 'rsi_period': 61, 'ema1': 9, 'ema2': 15, 'slip_atr_k': 0.18612388932319102, 'slip_spread_k': 0.19998463526180382, 'spread_hl_frac': 0.02214701178294074, 'bb_std_mult': 0.58869777617706, 'rsi_os': 26, 'rsi_ob': 57, 'vol_spike': 0.08434019395960642, 'adx_thresh': 12.10118321616254, 'atr_min_pct': 0.0008329494000597661, 'atr_max_pct': 0.013129298734897182, 'tp_mult': 2.7603752805211084, 'tsl_mult': 0.4998083145156486, 'strategy': 'mean_reversion', 'time_stop': 256, 'use_sma': True, 'use_atr': True, 'use_adx': True, 'use_ema': True, 'use_spike': True, 'rsi_required': True, 'edge_k': 1.4884818740283623, 'edge_cap': 0.7315492291306096, 'bull_strategy': 'breakout', 'bull_bb_std_mult': 3.486797493473608, 'bull_rsi_os': 14, 'bull_rsi_ob': 55, 'bull_adx_thresh': 16.821104683563256, 'bull_atr_min_pct': 0.017869617541521415, 'bull_atr_max_pct': 0.04037470857830153, 'bull_tp_mult': 2.164889015052393, 'bull_tsl_mult': 0.9024219394655837, 'bull_time_stop': 152, 'bull_use_sma': True, 'bull_use_ema': False, 'bull_use_atr': False, 'bull_use_adx': True, 'bull_use_spike': True, 'bull_rsi_required': False, 'bear_strategy': 'mean_reversion', 'bear_bb_std_mult': 1.0340685714833178, 'bear_rsi_os': 25, 'bear_rsi_ob': 78, 'bear_adx_thresh': 31.456667927511475, 'bear_atr_min_pct': 0.029617954486206893, 'bear_atr_max_pct': 0.07926985324329656, 'bear_tp_mult': 1.8001659862099313, 'bear_tsl_mult': 0.6227311106745463, 'bear_time_stop': 212, 'bear_use_sma': False, 'bear_use_ema': False, 'bear_use_atr': True, 'bear_use_adx': True, 'bear_use_spike': True, 'bear_rsi_required': False, 'sideways_strategy': 'mean_reversion', 'sideways_bb_std_mult': 0.5559365148415953, 'sideways_rsi_os': 10, 'sideways_rsi_ob': 63, 'sideways_adx_thresh': 31.81050140873186, 'sideways_atr_min_pct': 0.02040708028340115, 'sideways_atr_max_pct': 0.03619425616377197, 'sideways_tp_mult': 1.098084802418381, 'sideways_tsl_mult': 0.1765299064842636, 'sideways_time_stop': 171, 'sideways_use_sma': False, 'sideways_use_ema': False, 'sideways_use_atr': False, 'sideways_use_adx': True, 'sideways_use_spike': False, 'sideways_rsi_required': False}.
[I 2025-09-01 08:25:38,876] Trial 405 finished with values: [-1000000000.0, 1000000000.0] and parameters: {'p_sma': 12, 'p_std': 12, 'p_atr': 7, 'p_adx': 25, 'rsi_period': 61, 'ema1': 9, 'ema2': 16, 'slip_atr_k': 0.1203747335244191, 'slip_spread_k': 0.6533455879080254, 'spread_hl_frac': 0.022653699424700403, 'bb_std_mult': 2.88583302304857, 'rsi_os': 54, 'rsi_ob': 78, 'vol_spike': 0.035724977721056456, 'adx_thresh': 13.677978352884502, 'atr_min_pct': 0.0288624690294716, 'atr_max_pct': 0.14704087488821538, 'tp_mult': 2.7583711123267656, 'tsl_mult': 0.5395760800930564, 'strategy': 'breakout', 'time_stop': 221, 'use_sma': False, 'use_atr': False, 'use_adx': False, 'use_ema': True, 'use_spike': False, 'rsi_required': False, 'edge_k': 1.0247350024320263, 'edge_cap': 0.6160230005237332, 'bull_strategy': 'mean_reversion', 'bull_bb_std_mult': 0.5766621372808503, 'bull_rsi_os': 14, 'bull_rsi_ob': 62, 'bull_adx_thresh': 20.89725546698137, 'bull_atr_min_pct': 0.021425454843152926, 'bull_atr_max_pct': 0.051244311385112484, 'bull_tp_mult': 1.1269480352111247, 'bull_tsl_mult': 0.6168268735426147, 'bull_time_stop': 152, 'bull_use_sma': False, 'bull_use_ema': True, 'bull_use_atr': True, 'bull_use_adx': False, 'bull_use_spike': False, 'bull_rsi_required': False, 'bear_strategy': 'breakout', 'bear_bb_std_mult': 2.3347490670700037, 'bear_rsi_os': 25, 'bear_rsi_ob': 95, 'bear_adx_thresh': 32.117423067969625, 'bear_atr_min_pct': 0.004011413443624157, 'bear_atr_max_pct': 0.10291273334001581, 'bear_tp_mult': 1.8089618911654306, 'bear_tsl_mult': 0.06729604471626822, 'bear_time_stop': 95, 'bear_use_sma': True, 'bear_use_ema': False, 'bear_use_atr': False, 'bear_use_adx': False, 'bear_use_spike': False, 'bear_rsi_required': True, 'sideways_strategy': 'breakout', 'sideways_bb_std_mult': 0.8376512697876562, 'sideways_rsi_os': 55, 'sideways_rsi_ob': 60, 'sideways_adx_thresh': 13.011417401352833, 'sideways_atr_min_pct': 0.007335361179606784, 'sideways_atr_max_pct': 0.05267907216574986, 'sideways_tp_mult': 2.5661356970680167, 'sideways_tsl_mult': 0.28909814953580915, 'sideways_time_stop': 268, 'sideways_use_sma': True, 'sideways_use_ema': True, 'sideways_use_atr': True, 'sideways_use_adx': True, 'sideways_use_spike': False, 'sideways_rsi_required': True}.
[I 2025-09-01 08:25:39,081] Trial 404 finished with values: [-1000000000.0, 1000000000.0] and parameters: {'p_sma': 12, 'p_std': 15, 'p_atr': 13, 'p_adx': 20, 'rsi_period': 61, 'ema1': 14, 'ema2': 15, 'slip_atr_k': 0.1181910204027901, 'slip_spread_k': 0.328513747023332, 'spread_hl_frac': 0.022346770851787913, 'bb_std_mult': 1.0447280446120024, 'rsi_os': 22, 'rsi_ob': 95, 'vol_spike': 0.21900944073437134, 'adx_thresh': 13.462389151277616, 'atr_min_pct': 0.0008789122356444665, 'atr_max_pct': 0.012275419379124033, 'tp_mult': 2.3517790905462395, 'tsl_mult': 0.39375584768639194, 'strategy': 'breakout', 'time_stop': 255, 'use_sma': True, 'use_atr': False, 'use_adx': False, 'use_ema': True, 'use_spike': False, 'rsi_required': True, 'edge_k': 1.0314221029243371, 'edge_cap': 0.11357162766370155, 'bull_strategy': 'breakout', 'bull_bb_std_mult': 2.8675523835754606, 'bull_rsi_os': 39, 'bull_rsi_ob': 63, 'bull_adx_thresh': 8.856374534657466, 'bull_atr_min_pct': 0.016856015199589423, 'bull_atr_max_pct': 0.03640217082435082, 'bull_tp_mult': 2.1002723704146784, 'bull_tsl_mult': 0.32766485612830965, 'bull_time_stop': 237, 'bull_use_sma': False, 'bull_use_ema': True, 'bull_use_atr': True, 'bull_use_adx': True, 'bull_use_spike': False, 'bull_rsi_required': False, 'bear_strategy': 'breakout', 'bear_bb_std_mult': 3.20977525677985, 'bear_rsi_os': 25, 'bear_rsi_ob': 90, 'bear_adx_thresh': 32.48703658662409, 'bear_atr_min_pct': 0.021775887406784725, 'bear_atr_max_pct': 0.07070759581122671, 'bear_tp_mult': 2.844223930701791, 'bear_tsl_mult': 0.06330244974780204, 'bear_time_stop': 91, 'bear_use_sma': True, 'bear_use_ema': False, 'bear_use_atr': False, 'bear_use_adx': False, 'bear_use_spike': False, 'bear_rsi_required': True, 'sideways_strategy': 'breakout', 'sideways_bb_std_mult': 0.9387774346402165, 'sideways_rsi_os': 12, 'sideways_rsi_ob': 65, 'sideways_adx_thresh': 9.059136502906506, 'sideways_atr_min_pct': 0.020302029888757508, 'sideways_atr_max_pct': 0.05256526866862806, 'sideways_tp_mult': 2.574605659507659, 'sideways_tsl_mult': 0.12608647254353006, 'sideways_time_stop': 34, 'sideways_use_sma': True, 'sideways_use_ema': True, 'sideways_use_atr': True, 'sideways_use_adx': True, 'sideways_use_spike': False, 'sideways_rsi_required': True}.
