[I 2025-09-01 08:25:39,498] Trial 403 finished with values: [-0.09554171156011293, 0.09604598483542925] and parameters: {'p_sma': 38, 'p_std': 11, 'p_atr': 13, 'p_adx': 20, 'rsi_period': 78, 'ema1': 22, 'ema2': 16, 'slip_atr_k': 0.05671761369091619, 'slip_spread_k': 0.6205062438446518, 'spread_hl_frac': 0.012655563101156474, 'bb_std_mult': 1.068715148734082, 'rsi_os': 27, 'rsi_ob': 57, 'vol_spike': 0.08343069469432979, 'adx_thresh': 23.65352483192146, 'atr_min_pct': 0.0219395524907788, 'atr_max_pct': 0.10146912972533831, 'tp_mult': 1.32217118911664, 'tsl_mult': 0.39819594961623417, 'strategy': 'mean_reversion', 'time_stop': 219, 'use_sma': True, 'use_atr': False, 'use_adx': False, 'use_ema': True, 'use_spike': True, 'rsi_required': True, 'edge_k': 0.6193981585686046, 'edge_cap': 0.12437912181547965, 'bull_strategy': 'breakout', 'bull_bb_std_mult': 2.8856309920620262, 'bull_rsi_os': 14, 'bull_rsi_ob': 69, 'bull_adx_thresh': 18.78794411348114, 'bull_atr_min_pct': 0.02675730108330468, 'bull_atr_max_pct': 0.0832616579841439, 'bull_tp_mult': 2.1490222114294455, 'bull_tsl_mult': 0.6166645418020015, 'bull_time_stop': 153, 'bull_use_sma': True, 'bull_use_ema': True, 'bull_use_atr': True, 'bull_use_adx': True, 'bull_use_spike': False, 'bull_rsi_required': False, 'bear_strategy': 'breakout', 'bear_bb_std_mult': 2.7989997520058365, 'bear_rsi_os': 50, 'bear_rsi_ob': 89, 'bear_adx_thresh': 32.34048742234707, 'bear_atr_min_pct': 0.004228632064973394, 'bear_atr_max_pct': 0.13251914732305137, 'bear_tp_mult': 1.7965129049171829, 'bear_tsl_mult': 0.059288340082773554, 'bear_time_stop': 91, 'bear_use_sma': False, 'bear_use_ema': True, 'bear_use_atr': False, 'bear_use_adx': True, 'bear_use_spike': True, 'bear_rsi_required': True, 'sideways_strategy': 'breakout', 'sideways_bb_std_mult': 0.8439523048233821, 'sideways_rsi_os': 18, 'sideways_rsi_ob': 57, 'sideways_adx_thresh': 12.735287871909254, 'sideways_atr_min_pct': 0.020375972395969298, 'sideways_atr_max_pct': 0.03630276800828889, 'sideways_tp_mult': 2.567887979518649, 'sideways_tsl_mult': 0.12528814839596308, 'sideways_time_stop': 34, 'sideways_use_sma': True, 'sideways_use_ema': False, 'sideways_use_atr': True, 'sideways_use_adx': True, 'sideways_use_spike': False, 'sideways_rsi_required': False}.
[I 2025-09-01 08:26:21,799] Trial 409 finished with values: [-0.05397299714044179, 0.05379924195508918] and parameters: {'p_sma': 19, 'p_std': 17, 'p_atr': 11, 'p_adx': 29, 'rsi_period': 65, 'ema1': 28, 'ema2': 41, 'slip_atr_k': 0.01980103708409363, 'slip_spread_k': 0.04423060146504637, 'spread_hl_frac': 0.02393912927143025, 'bb_std_mult': 1.323282074688501, 'rsi_os': 24, 'rsi_ob': 54, 'vol_spike': 0.23339076977466622, 'adx_thresh': 9.442048739555657, 'atr_min_pct': 0.021035790373858845, 'atr_max_pct': 0.08047985514231601, 'tp_mult': 1.0570735135135165, 'tsl_mult': 0.05467309611861704, 'strategy': 'mean_reversion', 'time_stop': 248, 'use_sma': False, 'use_atr': True, 'use_adx': True, 'use_ema': True, 'use_spike': True, 'rsi_required': False, 'edge_k': 0.9811671592100366, 'edge_cap': 0.10368348113727724, 'bull_strategy': 'mean_reversion', 'bull_bb_std_mult': 2.7304742743162294, 'bull_rsi_os': 12, 'bull_rsi_ob': 67, 'bull_adx_thresh': 7.410303016301361, 'bull_atr_min_pct': 0.00287167773811625, 'bull_atr_max_pct': 0.04658130325209393, 'bull_tp_mult': 1.8156881625840409, 'bull_tsl_mult': 0.6769292196578587, 'bull_time_stop': 167, 'bull_use_sma': True, 'bull_use_ema': False, 'bull_use_atr': False, 'bull_use_adx': False, 'bull_use_spike': True, 'bull_rsi_required': True, 'bear_strategy': 'mean_reversion', 'bear_bb_std_mult': 3.0375606441635457, 'bear_rsi_os': 44, 'bear_rsi_ob': 93, 'bear_adx_thresh': 16.266308865849126, 'bear_atr_min_pct': 0.024073044174376747, 'bear_atr_max_pct': 0.07782553112237217, 'bear_tp_mult': 1.6970495981673006, 'bear_tsl_mult': 0.8181354185672791, 'bear_time_stop': 108, 'bear_use_sma': False, 'bear_use_ema': False, 'bear_use_atr': True, 'bear_use_adx': True, 'bear_use_spike': True, 'bear_rsi_required': False, 'sideways_strategy': 'mean_reversion', 'sideways_bb_std_mult': 0.6333505103001265, 'sideways_rsi_os': 38, 'sideways_rsi_ob': 54, 'sideways_adx_thresh': 7.1084716120128775, 'sideways_atr_min_pct': 0.022655149360889783, 'sideways_atr_max_pct': 0.025076933713261938, 'sideways_tp_mult': 2.492312178491716, 'sideways_tsl_mult': 0.1921630345539229, 'sideways_time_stop': 299, 'sideways_use_sma': False, 'sideways_use_ema': False, 'sideways_use_atr': False, 'sideways_use_adx': True, 'sideways_use_spike': True, 'sideways_rsi_required': False}.
[I 2025-09-01 08:26:21,804] Trial 408 finished with values: [-1000000000.0, 1000000000.0] and parameters: {'p_sma': 39, 'p_std': 17, 'p_atr': 11, 'p_adx': 11, 'rsi_period': 65, 'ema1': 28, 'ema2': 13, 'slip_atr_k': 0.04179528803648361, 'slip_spread_k': 0.6316075693825856, 'spread_hl_frac': 0.024037743618615572, 'bb_std_mult': 3.2490720805864552, 'rsi_os': 27, 'rsi_ob': 55, 'vol_spike': 0.2337089528236509, 'adx_thresh': 25.292590927243534, 'atr_min_pct': 0.020315695912610315, 'atr_max_pct': 0.08123067783564752, 'tp_mult': 2.4243797029914407, 'tsl_mult': 0.4710809485476026, 'strategy': 'mean_reversion', 'time_stop': 239, 'use_sma': True, 'use_atr': True, 'use_adx': True, 'use_ema': True, 'use_spike': True, 'rsi_required': True, 'edge_k': 0.8986277413000305, 'edge_cap': 0.13440284796986207, 'bull_strategy': 'breakout', 'bull_bb_std_mult': 2.9002881912710206, 'bull_rsi_os': 55, 'bull_rsi_ob': 49, 'bull_adx_thresh': 26.07425994510745, 'bull_atr_min_pct': 0.015057550135660836, 'bull_atr_max_pct': 0.08280886955331462, 'bull_tp_mult': 2.293416227562668, 'bull_tsl_mult': 0.6818131656163974, 'bull_time_stop': 143, 'bull_use_sma': True, 'bull_use_ema': False, 'bull_use_atr': False, 'bull_use_adx': True, 'bull_use_spike': True, 'bull_rsi_required': True, 'bear_strategy': 'mean_reversion', 'bear_bb_std_mult': 1.1779553083561343, 'bear_rsi_os': 44, 'bear_rsi_ob': 89, 'bear_adx_thresh': 27.912294528418848, 'bear_atr_min_pct': 0.024075996018824715, 'bear_atr_max_pct': 0.13424182591059056, 'bear_tp_mult': 2.9307648842439322, 'bear_tsl_mult': 0.1489409097608611, 'bear_time_stop': 107, 'bear_use_sma': False, 'bear_use_ema': False, 'bear_use_atr': True, 'bear_use_adx': True, 'bear_use_spike': True, 'bear_rsi_required': False, 'sideways_strategy': 'mean_reversion', 'sideways_bb_std_mult': 0.6230046188774869, 'sideways_rsi_os': 41, 'sideways_rsi_ob': 54, 'sideways_adx_thresh': 7.439101915225456, 'sideways_atr_min_pct': 0.02457702151167893, 'sideways_atr_max_pct': 0.02603492898277772, 'sideways_tp_mult': 1.6758338623727465, 'sideways_tsl_mult': 0.7692677850598542, 'sideways_time_stop': 151, 'sideways_use_sma': False, 'sideways_use_ema': False, 'sideways_use_atr': False, 'sideways_use_adx': True, 'sideways_use_spike': True, 'sideways_rsi_required': False}.
[I 2025-09-01 08:26:22,003] Trial 407 finished with values: [-0.033855402844165994, 0.033594366042528974] and parameters: {'p_sma': 21, 'p_std': 24, 'p_atr': 13, 'p_adx': 26, 'rsi_period': 79, 'ema1': 14, 'ema2': 56, 'slip_atr_k': 0.15875192826448, 'slip_spread_k': 0.6344600107398913, 'spread_hl_frac': 0.017980056295491195, 'bb_std_mult': 1.057727071375989, 'rsi_os': 36, 'rsi_ob': 75, 'vol_spike': 0.23338732353592148, 'adx_thresh': 22.29964920620383, 'atr_min_pct': 0.02182173205223643, 'atr_max_pct': 0.0709291858703144, 'tp_mult': 1.3350061155956696, 'tsl_mult': 0.633295403498267, 'strategy': 'mean_reversion', 'time_stop': 95, 'use_sma': True, 'use_atr': False, 'use_adx': False, 'use_ema': True, 'use_spike': False, 'rsi_required': True, 'edge_k': 0.9086952284674971, 'edge_cap': 0.12207559843044563, 'bull_strategy': 'breakout', 'bull_bb_std_mult': 2.9006553416166994, 'bull_rsi_os': 55, 'bull_rsi_ob': 68, 'bull_adx_thresh': 8.797170229193352, 'bull_atr_min_pct': 0.0032546412503172404, 'bull_atr_max_pct': 0.0462217283476701, 'bull_tp_mult': 2.0887936521696906, 'bull_tsl_mult': 0.6727585190976506, 'bull_time_stop': 143, 'bull_use_sma': False, 'bull_use_ema': True, 'bull_use_atr': True, 'bull_use_adx': True, 'bull_use_spike': False, 'bull_rsi_required': True, 'bear_strategy': 'breakout', 'bear_bb_std_mult': 2.099630116168715, 'bear_rsi_os': 28, 'bear_rsi_ob': 93, 'bear_adx_thresh': 27.78488070452451, 'bear_atr_min_pct': 0.021922977208119997, 'bear_atr_max_pct': 0.07256583368763869, 'bear_tp_mult': 2.935411347075764, 'bear_tsl_mult': 0.13475227865421247, 'bear_time_stop': 79, 'bear_use_sma': False, 'bear_use_ema': False, 'bear_use_atr': False, 'bear_use_adx': True, 'bear_use_spike': True, 'bear_rsi_required': True, 'sideways_strategy': 'breakout', 'sideways_bb_std_mult': 2.866639296879074, 'sideways_rsi_os': 12, 'sideways_rsi_ob': 54, 'sideways_adx_thresh': 8.92926619336668, 'sideways_atr_min_pct': 0.024846080075689492, 'sideways_atr_max_pct': 0.024916276804837618, 'sideways_tp_mult': 2.6549860311657825, 'sideways_tsl_mult': 0.12346229550403282, 'sideways_time_stop': 34, 'sideways_use_sma': True, 'sideways_use_ema': False, 'sideways_use_atr': True, 'sideways_use_adx': True, 'sideways_use_spike': True, 'sideways_rsi_required': False}.
[I 2025-09-01 08:26:22,224] Trial 406 finished with values: [-1000000000.0, 1000000000.0] and parameters: {'p_sma': 18, 'p_std': 45, 'p_atr': 13, 'p_adx': 15, 'rsi_period': 65, 'ema1': 22, 'ema2': 27, 'slip_atr_k': 0.020183013340655295, 'slip_spread_k': 0.6368440870794904, 'spread_hl_frac': 0.02312563661683475, 'bb_std_mult': 1.0721219258345265, 'rsi_os': 9, 'rsi_ob': 76, 'vol_spike': 0.17025636165439398, 'adx_thresh': 26.003162621998555, 'atr_min_pct': 0.02416959760207687, 'atr_max_pct': 0.07848549399158769, 'tp_mult': 1.3101599145523055, 'tsl_mult': 0.39419343896396836, 'strategy': 'breakout', 'time_stop': 77, 'use_sma': False, 'use_atr': False, 'use_adx': False, 'use_ema': True, 'use_spike': False, 'rsi_required': False, 'edge_k': 0.5082799268088792, 'edge_cap': 0.11734194487154179, 'bull_strategy': 'mean_reversion', 'bull_bb_std_mult': 2.8896107366183, 'bull_rsi_os': 12, 'bull_rsi_ob': 69, 'bull_adx_thresh': 8.742584289115737, 'bull_atr_min_pct': 0.021827291572457937, 'bull_atr_max_pct': 0.1242411242765394, 'bull_tp_mult': 2.296731940729594, 'bull_tsl_mult': 0.6771314943842022, 'bull_time_stop': 142, 'bull_use_sma': False, 'bull_use_ema': True, 'bull_use_atr': True, 'bull_use_adx': False, 'bull_use_spike': False, 'bull_rsi_required': True, 'bear_strategy': 'breakout', 'bear_bb_std_mult': 3.224360320776812, 'bear_rsi_os': 28, 'bear_rsi_ob': 89, 'bear_adx_thresh': 32.407836591265664, 'bear_atr_min_pct': 0.025003708140993078, 'bear_atr_max_pct': 0.132382532768054, 'bear_tp_mult': 2.9354951890751115, 'bear_tsl_mult': 0.06323458607557883, 'bear_time_stop': 95, 'bear_use_sma': True, 'bear_use_ema': False, 'bear_use_atr': False, 'bear_use_adx': False, 'bear_use_spike': False, 'bear_rsi_required': True, 'sideways_strategy': 'breakout', 'sideways_bb_std_mult': 0.8428175977462105, 'sideways_rsi_os': 55, 'sideways_rsi_ob': 57, 'sideways_adx_thresh': 26.745381962182663, 'sideways_atr_min_pct': 0.024553956825944155, 'sideways_atr_max_pct': 0.02492409180759189, 'sideways_tp_mult': 2.4810360532742735, 'sideways_tsl_mult': 0.775176400277838, 'sideways_time_stop': 35, 'sideways_use_sma': True, 'sideways_use_ema': True, 'sideways_use_atr': True, 'sideways_use_adx': True, 'sideways_use_spike': False, 'sideways_rsi_required': True}.
[I 2025-09-01 08:27:06,306] Trial 410 finished with values: [-1000000000.0, 1000000000.0] and parameters: {'p_sma': 21, 'p_std': 46, 'p_atr': 17, 'p_adx': 15, 'rsi_period': 72, 'ema1': 10, 'ema2': 23, 'slip_atr_k': 0.1575296440572397, 'slip_spread_k': 0.29773874700498393, 'spread_hl_frac': 0.021067001516622882, 'bb_std_mult': 1.945437267774256, 'rsi_os': 20, 'rsi_ob': 56, 'vol_spike': 0.25256532391862985, 'adx_thresh': 24.981120265654468, 'atr_min_pct': 0.01960886787975776, 'atr_max_pct': 0.1063841818060466, 'tp_mult': 1.1867325162869868, 'tsl_mult': 0.10153057396965237, 'strategy': 'mean_reversion', 'time_stop': 78, 'use_sma': True, 'use_atr': True, 'use_adx': True, 'use_ema': False, 'use_spike': False, 'rsi_required': True, 'edge_k': 1.0883920662932922, 'edge_cap': 0.8816424061229196, 'bull_strategy': 'breakout', 'bull_bb_std_mult': 2.8345852194105956, 'bull_rsi_os': 46, 'bull_rsi_ob': 71, 'bull_adx_thresh': 26.89812446172272, 'bull_atr_min_pct': 0.02909704027880316, 'bull_atr_max_pct': 0.139627531883098, 'bull_tp_mult': 2.304235863066463, 'bull_tsl_mult': 0.5479638035554828, 'bull_time_stop': 34, 'bull_use_sma': True, 'bull_use_ema': False, 'bull_use_atr': False, 'bull_use_adx': True, 'bull_use_spike': True, 'bull_rsi_required': False, 'bear_strategy': 'mean_reversion', 'bear_bb_std_mult': 1.6702468779823254, 'bear_rsi_os': 28, 'bear_rsi_ob': 94, 'bear_adx_thresh': 9.929123813393945, 'bear_atr_min_pct': 0.008630406466061405, 'bear_atr_max_pct': 0.08237336407621645, 'bear_tp_mult': 2.1919726055438895, 'bear_tsl_mult': 0.3416395582888297, 'bear_time_stop': 82, 'bear_use_sma': True, 'bear_use_ema': False, 'bear_use_atr': True, 'bear_use_adx': False, 'bear_use_spike': False, 'bear_rsi_required': False, 'sideways_strategy': 'mean_reversion', 'sideways_bb_std_mult': 3.5509737522340306, 'sideways_rsi_os': 37, 'sideways_rsi_ob': 65, 'sideways_adx_thresh': 26.724228125186116, 'sideways_atr_min_pct': 0.023086345207171344, 'sideways_atr_max_pct': 0.030721708436332356, 'sideways_tp_mult': 1.2489037441469029, 'sideways_tsl_mult': 0.6668381800450343, 'sideways_time_stop': 136, 'sideways_use_sma': False, 'sideways_use_ema': False, 'sideways_use_atr': False, 'sideways_use_adx': False, 'sideways_use_spike': True, 'sideways_rsi_required': True}.
[I 2025-09-01 08:27:07,126] Trial 412 finished with values: [-1000000000.0, 1000000000.0] and parameters: {'p_sma': 21, 'p_std': 51, 'p_atr': 12, 'p_adx': 15, 'rsi_period': 71, 'ema1': 10, 'ema2': 22, 'slip_atr_k': 0.00922668918632967, 'slip_spread_k': 0.25534730343989787, 'spread_hl_frac': 0.01833709996779856, 'bb_std_mult': 2.179106898172927, 'rsi_os': 49, 'rsi_ob': 76, 'vol_spike': 0.05508294772211872, 'adx_thresh': 26.33928729554515, 'atr_min_pct': 0.024081093265939345, 'atr_max_pct': 0.11491088497414997, 'tp_mult': 1.1677137958786101, 'tsl_mult': 0.4914240231436563, 'strategy': 'mean_reversion', 'time_stop': 213, 'use_sma': True, 'use_atr': True, 'use_adx': True, 'use_ema': False, 'use_spike': False, 'rsi_required': True, 'edge_k': 0.27561103645360985, 'edge_cap': 0.15847800449451427, 'bull_strategy': 'breakout', 'bull_bb_std_mult': 3.068056060484367, 'bull_rsi_os': 11, 'bull_rsi_ob': 81, 'bull_adx_thresh': 22.294774136153105, 'bull_atr_min_pct': 0.0052509904544502965, 'bull_atr_max_pct': 0.06309124080994806, 'bull_tp_mult': 2.5775041058038606, 'bull_tsl_mult': 0.02166216254538955, 'bull_time_stop': 144, 'bull_use_sma': True, 'bull_use_ema': False, 'bull_use_atr': False, 'bull_use_adx': True, 'bull_use_spike': True, 'bull_rsi_required': False, 'bear_strategy': 'mean_reversion', 'bear_bb_std_mult': 1.6779734265137847, 'bear_rsi_os': 36, 'bear_rsi_ob': 70, 'bear_adx_thresh': 34.868329901731784, 'bear_atr_min_pct': 0.022530850331679557, 'bear_atr_max_pct': 0.07300835480287743, 'bear_tp_mult': 1.439056603641371, 'bear_tsl_mult': 0.339874658505113, 'bear_time_stop': 79, 'bear_use_sma': True, 'bear_use_ema': False, 'bear_use_atr': True, 'bear_use_adx': False, 'bear_use_spike': False, 'bear_rsi_required': False, 'sideways_strategy': 'mean_reversion', 'sideways_bb_std_mult': 2.6882051271818703, 'sideways_rsi_os': 37, 'sideways_rsi_ob': 65, 'sideways_adx_thresh': 26.705026253781458, 'sideways_atr_min_pct': 0.0230054952063632, 'sideways_atr_max_pct': 0.01822464444471715, 'sideways_tp_mult': 1.8078365698170031, 'sideways_tsl_mult': 0.1511106724999205, 'sideways_time_stop': 60, 'sideways_use_sma': False, 'sideways_use_ema': False, 'sideways_use_atr': False, 'sideways_use_adx': False, 'sideways_use_spike': True, 'sideways_rsi_required': True}.
[I 2025-09-01 08:27:07,517] Trial 411 finished with values: [-1000000000.0, 1000000000.0] and parameters: {'p_sma': 21, 'p_std': 14, 'p_atr': 17, 'p_adx': 15, 'rsi_period': 72, 'ema1': 10, 'ema2': 23, 'slip_atr_k': 0.14535225948163213, 'slip_spread_k': 0.6680360288478248, 'spread_hl_frac': 0.020556726479950098, 'bb_std_mult': 3.4761193556922074, 'rsi_os': 9, 'rsi_ob': 76, 'vol_spike': 0.18114915722768277, 'adx_thresh': 26.484503509701113, 'atr_min_pct': 0.026167370876053444, 'atr_max_pct': 0.07153312840521735, 'tp_mult': 1.1757166685883154, 'tsl_mult': 0.49210507563843636, 'strategy': 'mean_reversion', 'time_stop': 227, 'use_sma': True, 'use_atr': True, 'use_adx': True, 'use_ema': False, 'use_spike': False, 'rsi_required': True, 'edge_k': 0.510327890887127, 'edge_cap': 0.1635958456033319, 'bull_strategy': 'breakout', 'bull_bb_std_mult': 1.1329113739581302, 'bull_rsi_os': 21, 'bull_rsi_ob': 72, 'bull_adx_thresh': 14.746355006809008, 'bull_atr_min_pct': 0.007361715653130679, 'bull_atr_max_pct': 0.0442397997560846, 'bull_tp_mult': 2.4543453162840407, 'bull_tsl_mult': 0.654387916118978, 'bull_time_stop': 33, 'bull_use_sma': True, 'bull_use_ema': False, 'bull_use_atr': False, 'bull_use_adx': True, 'bull_use_spike': True, 'bull_rsi_required': False, 'bear_strategy': 'mean_reversion', 'bear_bb_std_mult': 3.093136233282573, 'bear_rsi_os': 28, 'bear_rsi_ob': 94, 'bear_adx_thresh': 30.35497902979783, 'bear_atr_min_pct': 0.024827227653135237, 'bear_atr_max_pct': 0.07306621469791436, 'bear_tp_mult': 2.8705687366863724, 'bear_tsl_mult': 0.09556023478232106, 'bear_time_stop': 76, 'bear_use_sma': True, 'bear_use_ema': False, 'bear_use_atr': True, 'bear_use_adx': False, 'bear_use_spike': False, 'bear_rsi_required': False, 'sideways_strategy': 'mean_reversion', 'sideways_bb_std_mult': 2.6677757286217565, 'sideways_rsi_os': 37, 'sideways_rsi_ob': 65, 'sideways_adx_thresh': 9.008507918333619, 'sideways_atr_min_pct': 0.023026095960974036, 'sideways_atr_max_pct': 0.11326706800818587, 'sideways_tp_mult': 1.8789013892343722, 'sideways_tsl_mult': 0.14256329872804072, 'sideways_time_stop': 222, 'sideways_use_sma': False, 'sideways_use_ema': False, 'sideways_use_atr': False, 'sideways_use_adx': False, 'sideways_use_spike': True, 'sideways_rsi_required': True}.
[I 2025-09-01 08:27:08,270] Trial 413 finished with values: [-1000000000.0, 0.5832827111848645] and parameters: {'p_sma': 21, 'p_std': 14, 'p_atr': 17, 'p_adx': 19, 'rsi_period': 13, 'ema1': 10, 'ema2': 56, 'slip_atr_k': 0.03417233811660178, 'slip_spread_k': 0.26364935878497187, 'spread_hl_frac': 0.03255956424182625, 'bb_std_mult': 1.9264871756424122, 'rsi_os': 22, 'rsi_ob': 61, 'vol_spike': 0.05494673171721319, 'adx_thresh': 25.242887906399726, 'atr_min_pct': 0.01937990923312597, 'atr_max_pct': 0.10667689931119918, 'tp_mult': 2.0651889322910417, 'tsl_mult': 0.4954441230289682, 'strategy': 'mean_reversion', 'time_stop': 258, 'use_sma': True, 'use_atr': True, 'use_adx': True, 'use_ema': False, 'use_spike': True, 'rsi_required': True, 'edge_k': 1.0851537434177618, 'edge_cap': 0.8895624846761236, 'bull_strategy': 'breakout', 'bull_bb_std_mult': 2.9955340349481863, 'bull_rsi_os': 34, 'bull_rsi_ob': 71, 'bull_adx_thresh': 22.251220327467216, 'bull_atr_min_pct': 0.013169174706294504, 'bull_atr_max_pct': 0.09966980238712636, 'bull_tp_mult': 2.4613261621099856, 'bull_tsl_mult': 0.6572155675772565, 'bull_time_stop': 244, 'bull_use_sma': True, 'bull_use_ema': False, 'bull_use_atr': False, 'bull_use_adx': True, 'bull_use_spike': True, 'bull_rsi_required': False, 'bear_strategy': 'mean_reversion', 'bear_bb_std_mult': 3.088366423631155, 'bear_rsi_os': 36, 'bear_rsi_ob': 94, 'bear_adx_thresh': 30.386081472029808, 'bear_atr_min_pct': 0.013163352093077792, 'bear_atr_max_pct': 0.07251961641576916, 'bear_tp_mult': 1.4356092997179002, 'bear_tsl_mult': 0.4777906394658121, 'bear_time_stop': 81, 'bear_use_sma': False, 'bear_use_ema': False, 'bear_use_atr': True, 'bear_use_adx': True, 'bear_use_spike': True, 'bear_rsi_required': False, 'sideways_strategy': 'mean_reversion', 'sideways_bb_std_mult': 0.5786678006033537, 'sideways_rsi_os': 44, 'sideways_rsi_ob': 65, 'sideways_adx_thresh': 27.738107511957523, 'sideways_atr_min_pct': 3.77455568082042e-05, 'sideways_atr_max_pct': 0.01939770466180194, 'sideways_tp_mult': 2.6560537598230725, 'sideways_tsl_mult': 0.14506593042890983, 'sideways_time_stop': 130, 'sideways_use_sma': False, 'sideways_use_ema': False, 'sideways_use_atr': False, 'sideways_use_adx': False, 'sideways_use_spike': True, 'sideways_rsi_required': False}.
