[I 2025-09-01 08:05:52,289] Trial 289 finished with values: [-1000000000.0, 1000000000.0] and parameters: {'p_sma': 18, 'p_std': 7, 'p_atr': 12, 'p_adx': 11, 'rsi_period': 65, 'ema1': 13, 'ema2': 31, 'slip_atr_k': 0.06245189540561054, 'slip_spread_k': 0.7419660870467596, 'spread_hl_frac': 0.024056647674894772, 'bb_std_mult': 2.5735969902903153, 'rsi_os': 25, 'rsi_ob': 50, 'vol_spike': 0.22923213449660185, 'adx_thresh': 33.19113373302973, 'atr_min_pct': 0.020539332861987756, 'atr_max_pct': 0.14715292099660493, 'tp_mult': 1.116953289252216, 'tsl_mult': 0.468362219812986, 'strategy': 'mean_reversion', 'time_stop': 249, 'use_sma': False, 'use_atr': True, 'use_adx': True, 'use_ema': False, 'use_spike': True, 'rsi_required': True, 'edge_k': 0.3128488866083048, 'edge_cap': 0.07211044291351064, 'bull_strategy': 'mean_reversion', 'bull_bb_std_mult': 0.956992068574223, 'bull_rsi_os': 40, 'bull_rsi_ob': 71, 'bull_adx_thresh': 18.14973509439934, 'bull_atr_min_pct': 0.004996010606887985, 'bull_atr_max_pct': 0.0436941693395098, 'bull_tp_mult': 2.775054398798188, 'bull_tsl_mult': 0.6585855080583461, 'bull_time_stop': 201, 'bull_use_sma': True, 'bull_use_ema': False, 'bull_use_atr': False, 'bull_use_adx': False, 'bull_use_spike': True, 'bull_rsi_required': False, 'bear_strategy': 'mean_reversion', 'bear_bb_std_mult': 1.6008805181093435, 'bear_rsi_os': 29, 'bear_rsi_ob': 94, 'bear_adx_thresh': 13.219061876346288, 'bear_atr_min_pct': 0.022488389334093882, 'bear_atr_max_pct': 0.10940412665069389, 'bear_tp_mult': 1.2191081209618984, 'bear_tsl_mult': 0.1446190057484002, 'bear_time_stop': 200, 'bear_use_sma': False, 'bear_use_ema': False, 'bear_use_atr': True, 'bear_use_adx': False, 'bear_use_spike': True, 'bear_rsi_required': False, 'sideways_strategy': 'mean_reversion', 'sideways_bb_std_mult': 2.2586159376765407, 'sideways_rsi_os': 37, 'sideways_rsi_ob': 77, 'sideways_adx_thresh': 9.747331905996383, 'sideways_atr_min_pct': 0.02187571953756528, 'sideways_atr_max_pct': 0.01265825763539731, 'sideways_tp_mult': 2.4722426306434766, 'sideways_tsl_mult': 0.19126280374372562, 'sideways_time_stop': 18, 'sideways_use_sma': True, 'sideways_use_ema': False, 'sideways_use_atr': False, 'sideways_use_adx': True, 'sideways_use_spike': True, 'sideways_rsi_required': False}.
[I 2025-09-01 08:06:33,353] Trial 287 finished with values: [-1000000000.0, 1000000000.0] and parameters: {'p_sma': 18, 'p_std': 17, 'p_atr': 12, 'p_adx': 17, 'rsi_period': 65, 'ema1': 11, 'ema2': 10, 'slip_atr_k': 0.1420399958461216, 'slip_spread_k': 0.4410979709887731, 'spread_hl_frac': 0.023637451426620902, 'bb_std_mult': 3.463890040770093, 'rsi_os': 22, 'rsi_ob': 54, 'vol_spike': 0.2316638313566591, 'adx_thresh': 25.629628505251066, 'atr_min_pct': 0.020495877290661615, 'atr_max_pct': 0.14635802826851707, 'tp_mult': 2.61141222460781, 'tsl_mult': 0.7181853291037287, 'strategy': 'mean_reversion', 'time_stop': 12, 'use_sma': False, 'use_atr': True, 'use_adx': True, 'use_ema': True, 'use_spike': True, 'rsi_required': True, 'edge_k': 1.0744722058073553, 'edge_cap': 0.08402655177221409, 'bull_strategy': 'mean_reversion', 'bull_bb_std_mult': 2.8630727845341544, 'bull_rsi_os': 50, 'bull_rsi_ob': 67, 'bull_adx_thresh': 11.276407799141131, 'bull_atr_min_pct': 0.006627337329959891, 'bull_atr_max_pct': 0.12602959420426435, 'bull_tp_mult': 2.18538679997987, 'bull_tsl_mult': 0.7109145609831407, 'bull_time_stop': 204, 'bull_use_sma': True, 'bull_use_ema': False, 'bull_use_atr': False, 'bull_use_adx': True, 'bull_use_spike': True, 'bull_rsi_required': False, 'bear_strategy': 'mean_reversion', 'bear_bb_std_mult': 3.0998611309192574, 'bear_rsi_os': 25, 'bear_rsi_ob': 94, 'bear_adx_thresh': 13.006947192455794, 'bear_atr_min_pct': 0.0143436552488841, 'bear_atr_max_pct': 0.06457871662277083, 'bear_tp_mult': 2.6819427497119097, 'bear_tsl_mult': 0.056759226333157865, 'bear_time_stop': 194, 'bear_use_sma': False, 'bear_use_ema': False, 'bear_use_atr': True, 'bear_use_adx': True, 'bear_use_spike': True, 'bear_rsi_required': False, 'sideways_strategy': 'mean_reversion', 'sideways_bb_std_mult': 1.0999707054392465, 'sideways_rsi_os': 36, 'sideways_rsi_ob': 88, 'sideways_adx_thresh': 31.212183710331757, 'sideways_atr_min_pct': 0.010923711489735248, 'sideways_atr_max_pct': 0.13660973506304502, 'sideways_tp_mult': 2.456122492377843, 'sideways_tsl_mult': 0.25191783924689193, 'sideways_time_stop': 19, 'sideways_use_sma': True, 'sideways_use_ema': False, 'sideways_use_atr': False, 'sideways_use_adx': True, 'sideways_use_spike': True, 'sideways_rsi_required': False}.
[I 2025-09-01 08:06:38,470] Trial 290 finished with values: [-1000000000.0, 1000000000.0] and parameters: {'p_sma': 18, 'p_std': 57, 'p_atr': 30, 'p_adx': 7, 'rsi_period': 28, 'ema1': 9, 'ema2': 60, 'slip_atr_k': 0.06092006501475018, 'slip_spread_k': 0.4397085690710208, 'spread_hl_frac': 0.027192547964465148, 'bb_std_mult': 1.5373187848373533, 'rsi_os': 25, 'rsi_ob': 54, 'vol_spike': 0.2295683146099431, 'adx_thresh': 25.41870174663173, 'atr_min_pct': 0.007467954524105012, 'atr_max_pct': 0.052502415227677915, 'tp_mult': 1.0528067278210447, 'tsl_mult': 0.14536505025802682, 'strategy': 'breakout', 'time_stop': 247, 'use_sma': False, 'use_atr': True, 'use_adx': False, 'use_ema': False, 'use_spike': True, 'rsi_required': True, 'edge_k': 1.5679944755176647, 'edge_cap': 0.1542256692545386, 'bull_strategy': 'mean_reversion', 'bull_bb_std_mult': 2.8056656552238857, 'bull_rsi_os': 54, 'bull_rsi_ob': 70, 'bull_adx_thresh': 26.631052253737373, 'bull_atr_min_pct': 0.006613514128432008, 'bull_atr_max_pct': 0.10285552262258603, 'bull_tp_mult': 1.422810565896261, 'bull_tsl_mult': 0.3678978577571645, 'bull_time_stop': 66, 'bull_use_sma': True, 'bull_use_ema': False, 'bull_use_atr': True, 'bull_use_adx': False, 'bull_use_spike': False, 'bull_rsi_required': True, 'bear_strategy': 'mean_reversion', 'bear_bb_std_mult': 3.4487358137805204, 'bear_rsi_os': 53, 'bear_rsi_ob': 76, 'bear_adx_thresh': 33.151603387552115, 'bear_atr_min_pct': 0.023194219229362854, 'bear_atr_max_pct': 0.07923023974458548, 'bear_tp_mult': 2.78879809239013, 'bear_tsl_mult': 0.44099382810774906, 'bear_time_stop': 79, 'bear_use_sma': False, 'bear_use_ema': False, 'bear_use_atr': True, 'bear_use_adx': False, 'bear_use_spike': True, 'bear_rsi_required': False, 'sideways_strategy': 'mean_reversion', 'sideways_bb_std_mult': 2.245897467829202, 'sideways_rsi_os': 53, 'sideways_rsi_ob': 60, 'sideways_adx_thresh': 32.27562685575737, 'sideways_atr_min_pct': 0.0034438657303392066, 'sideways_atr_max_pct': 0.01424490224842162, 'sideways_tp_mult': 2.583157713511959, 'sideways_tsl_mult': 0.21716673798609254, 'sideways_time_stop': 34, 'sideways_use_sma': True, 'sideways_use_ema': False, 'sideways_use_atr': False, 'sideways_use_adx': True, 'sideways_use_spike': True, 'sideways_rsi_required': False}.
[I 2025-09-01 08:06:40,124] Trial 291 finished with values: [-1000000000.0, 1000000000.0] and parameters: {'p_sma': 18, 'p_std': 14, 'p_atr': 30, 'p_adx': 21, 'rsi_period': 28, 'ema1': 9, 'ema2': 22, 'slip_atr_k': 0.19753108488612192, 'slip_spread_k': 0.1753387440702357, 'spread_hl_frac': 0.027175574366936347, 'bb_std_mult': 3.4003899680978855, 'rsi_os': 25, 'rsi_ob': 55, 'vol_spike': 0.17118067489047278, 'adx_thresh': 24.614095994854818, 'atr_min_pct': 0.02067252027648948, 'atr_max_pct': 0.06722977452509338, 'tp_mult': 1.548448529886037, 'tsl_mult': 0.6041915726279619, 'strategy': 'breakout', 'time_stop': 267, 'use_sma': False, 'use_atr': False, 'use_adx': False, 'use_ema': False, 'use_spike': False, 'rsi_required': False, 'edge_k': 1.0731062144770074, 'edge_cap': 0.07098120904021256, 'bull_strategy': 'breakout', 'bull_bb_std_mult': 2.895646525419775, 'bull_rsi_os': 54, 'bull_rsi_ob': 54, 'bull_adx_thresh': 29.13178067463053, 'bull_atr_min_pct': 0.009494532337703504, 'bull_atr_max_pct': 0.12587834597927167, 'bull_tp_mult': 1.3890227341480759, 'bull_tsl_mult': 0.12352103768270167, 'bull_time_stop': 287, 'bull_use_sma': True, 'bull_use_ema': True, 'bull_use_atr': True, 'bull_use_adx': False, 'bull_use_spike': False, 'bull_rsi_required': True, 'bear_strategy': 'mean_reversion', 'bear_bb_std_mult': 0.7136814341695854, 'bear_rsi_os': 5, 'bear_rsi_ob': 95, 'bear_adx_thresh': 28.854788598375485, 'bear_atr_min_pct': 0.02317725359404973, 'bear_atr_max_pct': 0.05897320331706195, 'bear_tp_mult': 1.459882577464446, 'bear_tsl_mult': 0.4374776812722023, 'bear_time_stop': 88, 'bear_use_sma': False, 'bear_use_ema': False, 'bear_use_atr': True, 'bear_use_adx': False, 'bear_use_spike': True, 'bear_rsi_required': False, 'sideways_strategy': 'breakout', 'sideways_bb_std_mult': 2.0334346250464512, 'sideways_rsi_os': 53, 'sideways_rsi_ob': 85, 'sideways_adx_thresh': 13.301668044535173, 'sideways_atr_min_pct': 0.009036949827909839, 'sideways_atr_max_pct': 0.018726024611744743, 'sideways_tp_mult': 2.57007426825201, 'sideways_tsl_mult': 0.7378530684499027, 'sideways_time_stop': 39, 'sideways_use_sma': True, 'sideways_use_ema': False, 'sideways_use_atr': True, 'sideways_use_adx': True, 'sideways_use_spike': True, 'sideways_rsi_required': False}.
[I 2025-09-01 08:06:40,582] Trial 292 finished with values: [-1000000000.0, 1000000000.0] and parameters: {'p_sma': 19, 'p_std': 14, 'p_atr': 30, 'p_adx': 9, 'rsi_period': 28, 'ema1': 9, 'ema2': 12, 'slip_atr_k': 0.0450079707263944, 'slip_spread_k': 0.6367609969583031, 'spread_hl_frac': 0.026660146934153, 'bb_std_mult': 3.375123044304963, 'rsi_os': 29, 'rsi_ob': 54, 'vol_spike': 0.15169149150806277, 'adx_thresh': 24.700939217796723, 'atr_min_pct': 0.013791245681858374, 'atr_max_pct': 0.06739348101419544, 'tp_mult': 1.2517271922389623, 'tsl_mult': 0.36629707995883687, 'strategy': 'breakout', 'time_stop': 9, 'use_sma': True, 'use_atr': False, 'use_adx': False, 'use_ema': True, 'use_spike': False, 'rsi_required': False, 'edge_k': 0.9458563586746105, 'edge_cap': 0.486473765907343, 'bull_strategy': 'breakout', 'bull_bb_std_mult': 2.8657797532039373, 'bull_rsi_os': 51, 'bull_rsi_ob': 54, 'bull_adx_thresh': 24.01354094616743, 'bull_atr_min_pct': 0.006645688361755323, 'bull_atr_max_pct': 0.10355143352603044, 'bull_tp_mult': 2.225520788505323, 'bull_tsl_mult': 0.7049668092247819, 'bull_time_stop': 125, 'bull_use_sma': True, 'bull_use_ema': True, 'bull_use_atr': True, 'bull_use_adx': True, 'bull_use_spike': False, 'bull_rsi_required': True, 'bear_strategy': 'mean_reversion', 'bear_bb_std_mult': 1.8230649634268818, 'bear_rsi_os': 13, 'bear_rsi_ob': 95, 'bear_adx_thresh': 29.017779044328854, 'bear_atr_min_pct': 0.023247554628474124, 'bear_atr_max_pct': 0.06460311564091277, 'bear_tp_mult': 2.817935095165769, 'bear_tsl_mult': 0.6292147681833764, 'bear_time_stop': 223, 'bear_use_sma': False, 'bear_use_ema': False, 'bear_use_atr': True, 'bear_use_adx': True, 'bear_use_spike': True, 'bear_rsi_required': False, 'sideways_strategy': 'breakout', 'sideways_bb_std_mult': 2.5013468857709196, 'sideways_rsi_os': 33, 'sideways_rsi_ob': 47, 'sideways_adx_thresh': 18.29689699817083, 'sideways_atr_min_pct': 0.02871984422134386, 'sideways_atr_max_pct': 0.03264541146754591, 'sideways_tp_mult': 2.5775508249136565, 'sideways_tsl_mult': 0.16782440285343334, 'sideways_time_stop': 35, 'sideways_use_sma': False, 'sideways_use_ema': False, 'sideways_use_atr': True, 'sideways_use_adx': True, 'sideways_use_spike': True, 'sideways_rsi_required': False}.
[I 2025-09-01 08:07:37,114] Trial 293 finished with values: [-1000000000.0, 1000000000.0] and parameters: {'p_sma': 13, 'p_std': 57, 'p_atr': 30, 'p_adx': 28, 'rsi_period': 40, 'ema1': 9, 'ema2': 12, 'slip_atr_k': 0.196973276925808, 'slip_spread_k': 0.3081044992801565, 'spread_hl_frac': 0.02694907345965373, 'bb_std_mult': 1.4903519409759642, 'rsi_os': 25, 'rsi_ob': 84, 'vol_spike': 0.24229867320751228, 'adx_thresh': 24.678360045725356, 'atr_min_pct': 0.02169079549232727, 'atr_max_pct': 0.0668968196764737, 'tp_mult': 1.0505030929617074, 'tsl_mult': 0.5000647004775614, 'strategy': 'breakout', 'time_stop': 267, 'use_sma': True, 'use_atr': False, 'use_adx': False, 'use_ema': True, 'use_spike': False, 'rsi_required': False, 'edge_k': 0.9621034998538537, 'edge_cap': 0.12251678628226177, 'bull_strategy': 'breakout', 'bull_bb_std_mult': 2.87895049764816, 'bull_rsi_os': 30, 'bull_rsi_ob': 70, 'bull_adx_thresh': 26.605362520277794, 'bull_atr_min_pct': 0.010335788768766813, 'bull_atr_max_pct': 0.1032142606723786, 'bull_tp_mult': 1.6833305038482291, 'bull_tsl_mult': 0.781093139567913, 'bull_time_stop': 141, 'bull_use_sma': True, 'bull_use_ema': True, 'bull_use_atr': True, 'bull_use_adx': False, 'bull_use_spike': False, 'bull_rsi_required': True, 'bear_strategy': 'mean_reversion', 'bear_bb_std_mult': 1.7893561269685372, 'bear_rsi_os': 39, 'bear_rsi_ob': 95, 'bear_adx_thresh': 33.06439227068577, 'bear_atr_min_pct': 0.02337005021785748, 'bear_atr_max_pct': 0.06953834286766993, 'bear_tp_mult': 2.7940723058321475, 'bear_tsl_mult': 0.5162398091057522, 'bear_time_stop': 86, 'bear_use_sma': True, 'bear_use_ema': False, 'bear_use_atr': True, 'bear_use_adx': False, 'bear_use_spike': True, 'bear_rsi_required': False, 'sideways_strategy': 'breakout', 'sideways_bb_std_mult': 0.6977007191744686, 'sideways_rsi_os': 11, 'sideways_rsi_ob': 52, 'sideways_adx_thresh': 25.0414423583134, 'sideways_atr_min_pct': 0.024215115309896854, 'sideways_atr_max_pct': 0.033182022039016, 'sideways_tp_mult': 1.2802715048988444, 'sideways_tsl_mult': 0.731759356241823, 'sideways_time_stop': 150, 'sideways_use_sma': False, 'sideways_use_ema': False, 'sideways_use_atr': True, 'sideways_use_adx': False, 'sideways_use_spike': False, 'sideways_rsi_required': True}.
[I 2025-09-01 08:07:38,889] Trial 295 finished with values: [-1000000000.0, 1000000000.0] and parameters: {'p_sma': 13, 'p_std': 15, 'p_atr': 13, 'p_adx': 22, 'rsi_period': 63, 'ema1': 10, 'ema2': 27, 'slip_atr_k': 0.15048550093504912, 'slip_spread_k': 0.6361722936375239, 'spread_hl_frac': 0.03726792018671089, 'bb_std_mult': 3.268744075280837, 'rsi_os': 48, 'rsi_ob': 58, 'vol_spike': 0.24156506747128756, 'adx_thresh': 26.48440018399808, 'atr_min_pct': 0.01379657319606058, 'atr_max_pct': 0.06236234213805725, 'tp_mult': 1.705181266577295, 'tsl_mult': 0.4435524514636911, 'strategy': 'mean_reversion', 'time_stop': 232, 'use_sma': True, 'use_atr': False, 'use_adx': True, 'use_ema': True, 'use_spike': False, 'rsi_required': False, 'edge_k': 0.9606441840493832, 'edge_cap': 0.19975824117915308, 'bull_strategy': 'breakout', 'bull_bb_std_mult': 2.854561643116249, 'bull_rsi_os': 47, 'bull_rsi_ob': 58, 'bull_adx_thresh': 6.857791934929201, 'bull_atr_min_pct': 0.023242747441273255, 'bull_atr_max_pct': 0.02561896088835578, 'bull_tp_mult': 1.028863731889956, 'bull_tsl_mult': 0.6808606282007674, 'bull_time_stop': 165, 'bull_use_sma': True, 'bull_use_ema': True, 'bull_use_atr': False, 'bull_use_adx': True, 'bull_use_spike': True, 'bull_rsi_required': False, 'bear_strategy': 'mean_reversion', 'bear_bb_std_mult': 2.236333460990003, 'bear_rsi_os': 12, 'bear_rsi_ob': 90, 'bear_adx_thresh': 7.754210603107715, 'bear_atr_min_pct': 0.02178121657501776, 'bear_atr_max_pct': 0.06880106054906027, 'bear_tp_mult': 2.9336646040143926, 'bear_tsl_mult': 0.09680307492788964, 'bear_time_stop': 95, 'bear_use_sma': True, 'bear_use_ema': False, 'bear_use_atr': True, 'bear_use_adx': True, 'bear_use_spike': False, 'bear_rsi_required': False, 'sideways_strategy': 'breakout', 'sideways_bb_std_mult': 0.6817428965516333, 'sideways_rsi_os': 25, 'sideways_rsi_ob': 46, 'sideways_adx_thresh': 24.84626404120735, 'sideways_atr_min_pct': 0.02426048211603085, 'sideways_atr_max_pct': 0.12666966095675417, 'sideways_tp_mult': 1.4012059900004306, 'sideways_tsl_mult': 0.17212245056876876, 'sideways_time_stop': 37, 'sideways_use_sma': False, 'sideways_use_ema': True, 'sideways_use_atr': True, 'sideways_use_adx': False, 'sideways_use_spike': False, 'sideways_rsi_required': True}.
[I 2025-09-01 08:07:38,907] Trial 294 finished with values: [-1000000000.0, 1000000000.0] and parameters: {'p_sma': 47, 'p_std': 14, 'p_atr': 24, 'p_adx': 22, 'rsi_period': 63, 'ema1': 10, 'ema2': 12, 'slip_atr_k': 0.19599711913348294, 'slip_spread_k': 0.17772771467634962, 'spread_hl_frac': 0.0003906149882201386, 'bb_std_mult': 1.9400547640197012, 'rsi_os': 23, 'rsi_ob': 62, 'vol_spike': 0.021611211893505955, 'adx_thresh': 22.547171772909074, 'atr_min_pct': 0.013776776462982039, 'atr_max_pct': 0.03596612176249291, 'tp_mult': 1.2599355977544617, 'tsl_mult': 0.4916905508650826, 'strategy': 'breakout', 'time_stop': 232, 'use_sma': True, 'use_atr': False, 'use_adx': False, 'use_ema': True, 'use_spike': False, 'rsi_required': False, 'edge_k': 0.9241013647399332, 'edge_cap': 0.492793638042702, 'bull_strategy': 'breakout', 'bull_bb_std_mult': 3.2592747803936857, 'bull_rsi_os': 13, 'bull_rsi_ob': 54, 'bull_adx_thresh': 19.858835459691303, 'bull_atr_min_pct': 0.023328136309760605, 'bull_atr_max_pct': 0.04715226180125489, 'bull_tp_mult': 2.230737838211537, 'bull_tsl_mult': 0.48255373742888796, 'bull_time_stop': 218, 'bull_use_sma': True, 'bull_use_ema': True, 'bull_use_atr': True, 'bull_use_adx': True, 'bull_use_spike': False, 'bull_rsi_required': True, 'bear_strategy': 'mean_reversion', 'bear_bb_std_mult': 3.3356784893254443, 'bear_rsi_os': 27, 'bear_rsi_ob': 95, 'bear_adx_thresh': 28.802150067572512, 'bear_atr_min_pct': 0.003530444105890651, 'bear_atr_max_pct': 0.11299080149577884, 'bear_tp_mult': 2.9213122072893745, 'bear_tsl_mult': 0.8023648008160185, 'bear_time_stop': 90, 'bear_use_sma': True, 'bear_use_ema': False, 'bear_use_atr': True, 'bear_use_adx': True, 'bear_use_spike': False, 'bear_rsi_required': False, 'sideways_strategy': 'breakout', 'sideways_bb_std_mult': 2.520497692927492, 'sideways_rsi_os': 34, 'sideways_rsi_ob': 62, 'sideways_adx_thresh': 6.664450386720162, 'sideways_atr_min_pct': 0.024273345841775915, 'sideways_atr_max_pct': 0.018883537412939515, 'sideways_tp_mult': 2.6238287520006947, 'sideways_tsl_mult': 0.17639185025500634, 'sideways_time_stop': 37, 'sideways_use_sma': False, 'sideways_use_ema': True, 'sideways_use_atr': True, 'sideways_use_adx': False, 'sideways_use_spike': False, 'sideways_rsi_required': True}.
[I 2025-09-01 08:07:39,273] Trial 296 finished with values: [-1000000000.0, 1000000000.0] and parameters: {'p_sma': 13, 'p_std': 50, 'p_atr': 13, 'p_adx': 20, 'rsi_period': 60, 'ema1': 10, 'ema2': 39, 'slip_atr_k': 0.05019788546058146, 'slip_spread_k': 0.6789184569032848, 'spread_hl_frac': 0.010481321530012229, 'bb_std_mult': 0.8445015918886039, 'rsi_os': 47, 'rsi_ob': 85, 'vol_spike': 0.021201863811261795, 'adx_thresh': 26.196359587867732, 'atr_min_pct': 0.01510163868651076, 'atr_max_pct': 0.1499670351588073, 'tp_mult': 1.1773250144222922, 'tsl_mult': 0.49660440807502365, 'strategy': 'mean_reversion', 'time_stop': 261, 'use_sma': True, 'use_atr': True, 'use_adx': True, 'use_ema': True, 'use_spike': True, 'rsi_required': True, 'edge_k': 0.9382841957896174, 'edge_cap': 0.12240510271111159, 'bull_strategy': 'breakout', 'bull_bb_std_mult': 1.6952671906957546, 'bull_rsi_os': 13, 'bull_rsi_ob': 68, 'bull_adx_thresh': 6.9371879627965125, 'bull_atr_min_pct': 0.023277252405765295, 'bull_atr_max_pct': 0.04765031976191529, 'bull_tp_mult': 2.3344820035416145, 'bull_tsl_mult': 0.7856152072049047, 'bull_time_stop': 222, 'bull_use_sma': True, 'bull_use_ema': False, 'bull_use_atr': False, 'bull_use_adx': True, 'bull_use_spike': True, 'bull_rsi_required': False, 'bear_strategy': 'mean_reversion', 'bear_bb_std_mult': 3.3267962066382037, 'bear_rsi_os': 27, 'bear_rsi_ob': 53, 'bear_adx_thresh': 32.61360710353538, 'bear_atr_min_pct': 0.003707904394319811, 'bear_atr_max_pct': 0.06927565432639231, 'bear_tp_mult': 2.8430700288566926, 'bear_tsl_mult': 0.21002012526933966, 'bear_time_stop': 70, 'bear_use_sma': True, 'bear_use_ema': True, 'bear_use_atr': False, 'bear_use_adx': True, 'bear_use_spike': False, 'bear_rsi_required': False, 'sideways_strategy': 'mean_reversion', 'sideways_bb_std_mult': 0.6760903925872461, 'sideways_rsi_os': 39, 'sideways_rsi_ob': 59, 'sideways_adx_thresh': 6.6804501300905965, 'sideways_atr_min_pct': 0.022706636886988874, 'sideways_atr_max_pct': 0.026615816071145937, 'sideways_tp_mult': 1.2652825057954658, 'sideways_tsl_mult': 0.14802287208859566, 'sideways_time_stop': 181, 'sideways_use_sma': False, 'sideways_use_ema': True, 'sideways_use_atr': False, 'sideways_use_adx': False, 'sideways_use_spike': False, 'sideways_rsi_required': True}.
