[I 2025-09-01 08:19:44,040] Trial 372 finished with values: [-1000000000.0, 1000000000.0] and parameters: {'p_sma': 17, 'p_std': 17, 'p_atr': 13, 'p_adx': 28, 'rsi_period': 67, 'ema1': 20, 'ema2': 30, 'slip_atr_k': 0.03756384502032194, 'slip_spread_k': 0.2424754908537896, 'spread_hl_frac': 0.0354489564754229, 'bb_std_mult': 2.6001232847616644, 'rsi_os': 53, 'rsi_ob': 82, 'vol_spike': 0.23359913022043888, 'adx_thresh': 24.590937447510093, 'atr_min_pct': 0.021501224521025555, 'atr_max_pct': 0.03510818279636037, 'tp_mult': 1.1830893643241829, 'tsl_mult': 0.7774517590848324, 'strategy': 'mean_reversion', 'time_stop': 250, 'use_sma': True, 'use_atr': True, 'use_adx': True, 'use_ema': True, 'use_spike': True, 'rsi_required': True, 'edge_k': 0.04074299485673272, 'edge_cap': 0.2461090239395437, 'bull_strategy': 'breakout', 'bull_bb_std_mult': 1.6387468945534425, 'bull_rsi_os': 11, 'bull_rsi_ob': 69, 'bull_adx_thresh': 8.720780666018356, 'bull_atr_min_pct': 0.002585375261259684, 'bull_atr_max_pct': 0.12862081709863735, 'bull_tp_mult': 1.1601658953295741, 'bull_tsl_mult': 0.6828329432079359, 'bull_time_stop': 191, 'bull_use_sma': True, 'bull_use_ema': False, 'bull_use_atr': False, 'bull_use_adx': True, 'bull_use_spike': True, 'bull_rsi_required': False, 'bear_strategy': 'mean_reversion', 'bear_bb_std_mult': 3.5036602476729657, 'bear_rsi_os': 7, 'bear_rsi_ob': 95, 'bear_adx_thresh': 31.678015071299757, 'bear_atr_min_pct': 0.013948331715359757, 'bear_atr_max_pct': 0.054621947940095464, 'bear_tp_mult': 2.344937321855039, 'bear_tsl_mult': 0.1048255221423674, 'bear_time_stop': 90, 'bear_use_sma': False, 'bear_use_ema': False, 'bear_use_atr': True, 'bear_use_adx': True, 'bear_use_spike': True, 'bear_rsi_required': False, 'sideways_strategy': 'mean_reversion', 'sideways_bb_std_mult': 0.7189655386388734, 'sideways_rsi_os': 38, 'sideways_rsi_ob': 62, 'sideways_adx_thresh': 9.352232749371204, 'sideways_atr_min_pct': 0.023186779084066186, 'sideways_atr_max_pct': 0.02821062380788927, 'sideways_tp_mult': 2.5515084932019514, 'sideways_tsl_mult': 0.21793790439654617, 'sideways_time_stop': 37, 'sideways_use_sma': True, 'sideways_use_ema': False, 'sideways_use_atr': False, 'sideways_use_adx': True, 'sideways_use_spike': True, 'sideways_rsi_required': False}.
[I 2025-09-01 08:20:24,244] Trial 367 finished with values: [-0.12270240043320502, 0.12396861847009152] and parameters: {'p_sma': 21, 'p_std': 15, 'p_atr': 16, 'p_adx': 28, 'rsi_period': 74, 'ema1': 5, 'ema2': 52, 'slip_atr_k': 0.05284946205161323, 'slip_spread_k': 0.7173251310592479, 'spread_hl_frac': 0.025496647460593068, 'bb_std_mult': 2.4038706603458238, 'rsi_os': 37, 'rsi_ob': 55, 'vol_spike': 0.2532209099584223, 'adx_thresh': 31.461315084588797, 'atr_min_pct': 0.02211202613518579, 'atr_max_pct': 0.03394995336668629, 'tp_mult': 1.2000753592022861, 'tsl_mult': 0.45826150392484677, 'strategy': 'breakout', 'time_stop': 241, 'use_sma': True, 'use_atr': False, 'use_adx': False, 'use_ema': True, 'use_spike': True, 'rsi_required': False, 'edge_k': 0.9920419875581147, 'edge_cap': 0.3508523226346846, 'bull_strategy': 'breakout', 'bull_bb_std_mult': 1.4283819461319052, 'bull_rsi_os': 15, 'bull_rsi_ob': 61, 'bull_adx_thresh': 16.1847319512567, 'bull_atr_min_pct': 0.00036318700980756194, 'bull_atr_max_pct': 0.03421698066342454, 'bull_tp_mult': 2.193245079651881, 'bull_tsl_mult': 0.9362289468171634, 'bull_time_stop': 17, 'bull_use_sma': False, 'bull_use_ema': True, 'bull_use_atr': False, 'bull_use_adx': True, 'bull_use_spike': True, 'bull_rsi_required': True, 'bear_strategy': 'mean_reversion', 'bear_bb_std_mult': 1.269848334113821, 'bear_rsi_os': 7, 'bear_rsi_ob': 59, 'bear_adx_thresh': 31.70859417087427, 'bear_atr_min_pct': 0.009080919651846736, 'bear_atr_max_pct': 0.057159038208766756, 'bear_tp_mult': 2.997379469740225, 'bear_tsl_mult': 0.07951431725004847, 'bear_time_stop': 112, 'bear_use_sma': False, 'bear_use_ema': False, 'bear_use_atr': False, 'bear_use_adx': False, 'bear_use_spike': True, 'bear_rsi_required': True, 'sideways_strategy': 'mean_reversion', 'sideways_bb_std_mult': 0.5850200404670909, 'sideways_rsi_os': 14, 'sideways_rsi_ob': 59, 'sideways_adx_thresh': 8.691757699825308, 'sideways_atr_min_pct': 0.021286792392312563, 'sideways_atr_max_pct': 0.03737148505905997, 'sideways_tp_mult': 2.6737444515881403, 'sideways_tsl_mult': 0.2683354430556062, 'sideways_time_stop': 51, 'sideways_use_sma': False, 'sideways_use_ema': False, 'sideways_use_atr': False, 'sideways_use_adx': True, 'sideways_use_spike': True, 'sideways_rsi_required': False}.
[I 2025-09-01 08:20:27,639] Trial 370 finished with values: [-0.12541557394917147, 0.12519334137260718] and parameters: {'p_sma': 19, 'p_std': 17, 'p_atr': 16, 'p_adx': 20, 'rsi_period': 74, 'ema1': 10, 'ema2': 42, 'slip_atr_k': 0.05451100968853542, 'slip_spread_k': 0.7109487410786012, 'spread_hl_frac': 0.021391501835991974, 'bb_std_mult': 3.2693354162488686, 'rsi_os': 21, 'rsi_ob': 77, 'vol_spike': 0.10580914565424482, 'adx_thresh': 10.299679536122541, 'atr_min_pct': 0.01620676024004067, 'atr_max_pct': 0.0346385347595099, 'tp_mult': 2.309156608128395, 'tsl_mult': 0.4569802018755613, 'strategy': 'breakout', 'time_stop': 242, 'use_sma': True, 'use_atr': False, 'use_adx': False, 'use_ema': True, 'use_spike': True, 'rsi_required': False, 'edge_k': 1.0137641044611425, 'edge_cap': 0.07228482200152345, 'bull_strategy': 'breakout', 'bull_bb_std_mult': 2.8365013897184013, 'bull_rsi_os': 17, 'bull_rsi_ob': 66, 'bull_adx_thresh': 8.543338813048889, 'bull_atr_min_pct': 0.0003031548126487243, 'bull_atr_max_pct': 0.032806316038018535, 'bull_tp_mult': 2.607640919163154, 'bull_tsl_mult': 0.628490141182739, 'bull_time_stop': 20, 'bull_use_sma': False, 'bull_use_ema': True, 'bull_use_atr': False, 'bull_use_adx': True, 'bull_use_spike': True, 'bull_rsi_required': True, 'bear_strategy': 'mean_reversion', 'bear_bb_std_mult': 2.013201606397666, 'bear_rsi_os': 33, 'bear_rsi_ob': 51, 'bear_adx_thresh': 30.77894232021112, 'bear_atr_min_pct': 0.020562516532198857, 'bear_atr_max_pct': 0.03266161247047836, 'bear_tp_mult': 2.8610257594222954, 'bear_tsl_mult': 0.08666014985222525, 'bear_time_stop': 78, 'bear_use_sma': False, 'bear_use_ema': False, 'bear_use_atr': False, 'bear_use_adx': False, 'bear_use_spike': True, 'bear_rsi_required': False, 'sideways_strategy': 'mean_reversion', 'sideways_bb_std_mult': 0.6954485728000896, 'sideways_rsi_os': 33, 'sideways_rsi_ob': 62, 'sideways_adx_thresh': 21.82887987498786, 'sideways_atr_min_pct': 0.0057969414295159834, 'sideways_atr_max_pct': 0.03131675795206378, 'sideways_tp_mult': 1.729989531155621, 'sideways_tsl_mult': 0.8257440367645666, 'sideways_time_stop': 5, 'sideways_use_sma': False, 'sideways_use_ema': False, 'sideways_use_atr': False, 'sideways_use_adx': True, 'sideways_use_spike': True, 'sideways_rsi_required': False}.
[I 2025-09-01 08:20:27,966] Trial 371 finished with values: [-0.11482177031466034, 0.11429194288823159] and parameters: {'p_sma': 51, 'p_std': 54, 'p_atr': 21, 'p_adx': 28, 'rsi_period': 69, 'ema1': 10, 'ema2': 30, 'slip_atr_k': 0.21493117204703255, 'slip_spread_k': 0.6765649597071184, 'spread_hl_frac': 0.024355248636073197, 'bb_std_mult': 3.3918065245881324, 'rsi_os': 24, 'rsi_ob': 56, 'vol_spike': 0.2472707990241262, 'adx_thresh': 24.677527964394077, 'atr_min_pct': 0.01996641191740284, 'atr_max_pct': 0.14504632591988462, 'tp_mult': 1.5948914572102297, 'tsl_mult': 0.45523621977127304, 'strategy': 'mean_reversion', 'time_stop': 149, 'use_sma': True, 'use_atr': True, 'use_adx': True, 'use_ema': True, 'use_spike': True, 'rsi_required': True, 'edge_k': 1.5527831251753161, 'edge_cap': 0.10613723430345191, 'bull_strategy': 'breakout', 'bull_bb_std_mult': 2.215413160680216, 'bull_rsi_os': 11, 'bull_rsi_ob': 69, 'bull_adx_thresh': 8.432660690433133, 'bull_atr_min_pct': 0.00018500518284201434, 'bull_atr_max_pct': 0.032886756833759495, 'bull_tp_mult': 2.513307778462941, 'bull_tsl_mult': 0.6494791018023457, 'bull_time_stop': 48, 'bull_use_sma': True, 'bull_use_ema': False, 'bull_use_atr': False, 'bull_use_adx': True, 'bull_use_spike': True, 'bull_rsi_required': True, 'bear_strategy': 'mean_reversion', 'bear_bb_std_mult': 3.224880424939683, 'bear_rsi_os': 7, 'bear_rsi_ob': 95, 'bear_adx_thresh': 30.703106653285932, 'bear_atr_min_pct': 0.022876408319346016, 'bear_atr_max_pct': 0.05679883890960187, 'bear_tp_mult': 2.856502503475624, 'bear_tsl_mult': 0.0999253104171591, 'bear_time_stop': 90, 'bear_use_sma': False, 'bear_use_ema': False, 'bear_use_atr': True, 'bear_use_adx': True, 'bear_use_spike': True, 'bear_rsi_required': False, 'sideways_strategy': 'mean_reversion', 'sideways_bb_std_mult': 0.8864011763778565, 'sideways_rsi_os': 34, 'sideways_rsi_ob': 62, 'sideways_adx_thresh': 21.41229857827811, 'sideways_atr_min_pct': 0.006144617733367169, 'sideways_atr_max_pct': 0.02622231316789789, 'sideways_tp_mult': 2.548297707456338, 'sideways_tsl_mult': 0.1346075565379476, 'sideways_time_stop': 88, 'sideways_use_sma': True, 'sideways_use_ema': False, 'sideways_use_atr': False, 'sideways_use_adx': True, 'sideways_use_spike': True, 'sideways_rsi_required': False}.
[I 2025-09-01 08:20:28,303] Trial 373 finished with values: [-1000000000.0, 1000000000.0] and parameters: {'p_sma': 19, 'p_std': 54, 'p_atr': 12, 'p_adx': 20, 'rsi_period': 70, 'ema1': 10, 'ema2': 13, 'slip_atr_k': 0.06152156706457589, 'slip_spread_k': 0.6737234606501478, 'spread_hl_frac': 0.021017655553039326, 'bb_std_mult': 3.399355724834717, 'rsi_os': 45, 'rsi_ob': 56, 'vol_spike': 0.2486480805015694, 'adx_thresh': 33.54528279232553, 'atr_min_pct': 0.020003596933782064, 'atr_max_pct': 0.06366479903754947, 'tp_mult': 1.136809850901868, 'tsl_mult': 0.5386779238880233, 'strategy': 'mean_reversion', 'time_stop': 205, 'use_sma': True, 'use_atr': True, 'use_adx': True, 'use_ema': True, 'use_spike': True, 'rsi_required': True, 'edge_k': 1.538591603041918, 'edge_cap': 0.762541932619065, 'bull_strategy': 'breakout', 'bull_bb_std_mult': 2.914911191049353, 'bull_rsi_os': 12, 'bull_rsi_ob': 92, 'bull_adx_thresh': 16.126010961535936, 'bull_atr_min_pct': 0.015516848278486373, 'bull_atr_max_pct': 0.034140678717514125, 'bull_tp_mult': 2.163720955037642, 'bull_tsl_mult': 0.627778861709519, 'bull_time_stop': 148, 'bull_use_sma': True, 'bull_use_ema': False, 'bull_use_atr': False, 'bull_use_adx': True, 'bull_use_spike': True, 'bull_rsi_required': False, 'bear_strategy': 'mean_reversion', 'bear_bb_std_mult': 2.011302584891867, 'bear_rsi_os': 28, 'bear_rsi_ob': 92, 'bear_adx_thresh': 32.011459257827134, 'bear_atr_min_pct': 0.026861746054345492, 'bear_atr_max_pct': 0.07727007532019135, 'bear_tp_mult': 1.2012257312194792, 'bear_tsl_mult': 0.21251635884896508, 'bear_time_stop': 229, 'bear_use_sma': False, 'bear_use_ema': False, 'bear_use_atr': True, 'bear_use_adx': True, 'bear_use_spike': True, 'bear_rsi_required': False, 'sideways_strategy': 'mean_reversion', 'sideways_bb_std_mult': 0.6889736140167926, 'sideways_rsi_os': 47, 'sideways_rsi_ob': 56, 'sideways_adx_thresh': 7.751582846982739, 'sideways_atr_min_pct': 0.005900827728675633, 'sideways_atr_max_pct': 0.021872894640083712, 'sideways_tp_mult': 2.8820437401527434, 'sideways_tsl_mult': 0.15147321494829558, 'sideways_time_stop': 86, 'sideways_use_sma': False, 'sideways_use_ema': False, 'sideways_use_atr': False, 'sideways_use_adx': True, 'sideways_use_spike': True, 'sideways_rsi_required': False}.
[I 2025-09-01 08:20:29,133] Trial 375 finished with values: [-1000000000.0, 1000000000.0] and parameters: {'p_sma': 5, 'p_std': 34, 'p_atr': 11, 'p_adx': 21, 'rsi_period': 69, 'ema1': 29, 'ema2': 32, 'slip_atr_k': 0.13053017889582536, 'slip_spread_k': 0.6749392274463959, 'spread_hl_frac': 0.02412021624135339, 'bb_std_mult': 3.392489351224545, 'rsi_os': 15, 'rsi_ob': 45, 'vol_spike': 0.2464500272978933, 'adx_thresh': 14.460882034479493, 'atr_min_pct': 0.01996106612728676, 'atr_max_pct': 0.14542700803832703, 'tp_mult': 1.5747606940101686, 'tsl_mult': 0.4917538534553068, 'strategy': 'mean_reversion', 'time_stop': 149, 'use_sma': False, 'use_atr': True, 'use_adx': True, 'use_ema': True, 'use_spike': True, 'rsi_required': True, 'edge_k': 0.07048157502938945, 'edge_cap': 0.09775227971244359, 'bull_strategy': 'mean_reversion', 'bull_bb_std_mult': 1.9303592658575628, 'bull_rsi_os': 30, 'bull_rsi_ob': 53, 'bull_adx_thresh': 5.64149847159584, 'bull_atr_min_pct': 0.01756745788425582, 'bull_atr_max_pct': 0.0412708827563553, 'bull_tp_mult': 1.0135053573219013, 'bull_tsl_mult': 0.1058545266885898, 'bull_time_stop': 207, 'bull_use_sma': True, 'bull_use_ema': False, 'bull_use_atr': False, 'bull_use_adx': True, 'bull_use_spike': True, 'bull_rsi_required': False, 'bear_strategy': 'mean_reversion', 'bear_bb_std_mult': 3.262692164611893, 'bear_rsi_os': 28, 'bear_rsi_ob': 94, 'bear_adx_thresh': 7.168280580015821, 'bear_atr_min_pct': 0.02292798683933365, 'bear_atr_max_pct': 0.11544874501503226, 'bear_tp_mult': 2.852007040455725, 'bear_tsl_mult': 0.1950991468042571, 'bear_time_stop': 85, 'bear_use_sma': False, 'bear_use_ema': False, 'bear_use_atr': True, 'bear_use_adx': True, 'bear_use_spike': False, 'bear_rsi_required': False, 'sideways_strategy': 'mean_reversion', 'sideways_bb_std_mult': 0.6486953035544984, 'sideways_rsi_os': 16, 'sideways_rsi_ob': 66, 'sideways_adx_thresh': 7.612714103811564, 'sideways_atr_min_pct': 0.025172406280184054, 'sideways_atr_max_pct': 0.021246034191828668, 'sideways_tp_mult': 2.7585232984465438, 'sideways_tsl_mult': 0.33044515044426115, 'sideways_time_stop': 27, 'sideways_use_sma': True, 'sideways_use_ema': True, 'sideways_use_atr': False, 'sideways_use_adx': True, 'sideways_use_spike': True, 'sideways_rsi_required': False}.
[I 2025-09-01 08:20:29,166] Trial 377 finished with values: [-1000000000.0, 1000000000.0] and parameters: {'p_sma': 53, 'p_std': 29, 'p_atr': 11, 'p_adx': 17, 'rsi_period': 62, 'ema1': 12, 'ema2': 32, 'slip_atr_k': 0.24211342070861633, 'slip_spread_k': 0.7896621272482424, 'spread_hl_frac': 0.0226928929832497, 'bb_std_mult': 3.4770480746580605, 'rsi_os': 50, 'rsi_ob': 47, 'vol_spike': 0.18983188215623556, 'adx_thresh': 18.670005697245376, 'atr_min_pct': 0.025261252457245375, 'atr_max_pct': 0.14547285893578016, 'tp_mult': 1.1595863283211503, 'tsl_mult': 0.672531829280234, 'strategy': 'mean_reversion', 'time_stop': 261, 'use_sma': False, 'use_atr': True, 'use_adx': True, 'use_ema': True, 'use_spike': True, 'rsi_required': True, 'edge_k': 0.6869394322044362, 'edge_cap': 0.10090751162766079, 'bull_strategy': 'mean_reversion', 'bull_bb_std_mult': 1.7265190009090323, 'bull_rsi_os': 13, 'bull_rsi_ob': 71, 'bull_adx_thresh': 14.106987040559941, 'bull_atr_min_pct': 0.008159580729886467, 'bull_atr_max_pct': 0.03870452554264168, 'bull_tp_mult': 1.555217342988466, 'bull_tsl_mult': 0.662186540569826, 'bull_time_stop': 170, 'bull_use_sma': True, 'bull_use_ema': False, 'bull_use_atr': False, 'bull_use_adx': False, 'bull_use_spike': True, 'bull_rsi_required': False, 'bear_strategy': 'mean_reversion', 'bear_bb_std_mult': 2.9352501743814794, 'bear_rsi_os': 30, 'bear_rsi_ob': 94, 'bear_adx_thresh': 11.260009786441753, 'bear_atr_min_pct': 0.024750641856361034, 'bear_atr_max_pct': 0.12798122941585904, 'bear_tp_mult': 2.587260982799539, 'bear_tsl_mult': 0.14571363371704626, 'bear_time_stop': 86, 'bear_use_sma': True, 'bear_use_ema': True, 'bear_use_atr': True, 'bear_use_adx': True, 'bear_use_spike': False, 'bear_rsi_required': False, 'sideways_strategy': 'mean_reversion', 'sideways_bb_std_mult': 1.5438960720336636, 'sideways_rsi_os': 42, 'sideways_rsi_ob': 66, 'sideways_adx_thresh': 24.4465725339057, 'sideways_atr_min_pct': 0.0035064239024757814, 'sideways_atr_max_pct': 0.023500127217345727, 'sideways_tp_mult': 2.741497421394949, 'sideways_tsl_mult': 0.329766842672471, 'sideways_time_stop': 28, 'sideways_use_sma': False, 'sideways_use_ema': True, 'sideways_use_atr': False, 'sideways_use_adx': True, 'sideways_use_spike': True, 'sideways_rsi_required': False}.
[I 2025-09-01 08:20:30,122] Trial 378 finished with values: [-1000000000.0, 1000000000.0] and parameters: {'p_sma': 54, 'p_std': 10, 'p_atr': 12, 'p_adx': 22, 'rsi_period': 63, 'ema1': 12, 'ema2': 15, 'slip_atr_k': 0.24144010608350291, 'slip_spread_k': 0.9082102635921561, 'spread_hl_frac': 0.022550034072172553, 'bb_std_mult': 3.489914495492808, 'rsi_os': 23, 'rsi_ob': 49, 'vol_spike': 0.23892858132486486, 'adx_thresh': 26.871564490354128, 'atr_min_pct': 0.026747158019241594, 'atr_max_pct': 0.14060839521656432, 'tp_mult': 2.1846180940662365, 'tsl_mult': 0.7996908607035472, 'strategy': 'mean_reversion', 'time_stop': 90, 'use_sma': False, 'use_atr': True, 'use_adx': True, 'use_ema': True, 'use_spike': True, 'rsi_required': True, 'edge_k': 1.0433500326159253, 'edge_cap': 0.19301995301241126, 'bull_strategy': 'mean_reversion', 'bull_bb_std_mult': 2.8142884168852995, 'bull_rsi_os': 13, 'bull_rsi_ob': 46, 'bull_adx_thresh': 13.936605704357518, 'bull_atr_min_pct': 0.008109621668695366, 'bull_atr_max_pct': 0.03822727995094477, 'bull_tp_mult': 2.4220678401224003, 'bull_tsl_mult': 0.6774086080512411, 'bull_time_stop': 155, 'bull_use_sma': True, 'bull_use_ema': False, 'bull_use_atr': False, 'bull_use_adx': False, 'bull_use_spike': True, 'bull_rsi_required': False, 'bear_strategy': 'mean_reversion', 'bear_bb_std_mult': 2.9352004857313805, 'bear_rsi_os': 24, 'bear_rsi_ob': 93, 'bear_adx_thresh': 21.51149084560585, 'bear_atr_min_pct': 0.024617655341254006, 'bear_atr_max_pct': 0.0281943886071055, 'bear_tp_mult': 2.9207154449594723, 'bear_tsl_mult': 0.0632549066854454, 'bear_time_stop': 184, 'bear_use_sma': True, 'bear_use_ema': True, 'bear_use_atr': True, 'bear_use_adx': True, 'bear_use_spike': False, 'bear_rsi_required': False, 'sideways_strategy': 'mean_reversion', 'sideways_bb_std_mult': 0.7383528637278481, 'sideways_rsi_os': 42, 'sideways_rsi_ob': 69, 'sideways_adx_thresh': 9.645882483489073, 'sideways_atr_min_pct': 0.024109989141408324, 'sideways_atr_max_pct': 0.029220467339019292, 'sideways_tp_mult': 2.5710537312125057, 'sideways_tsl_mult': 0.9901159361961875, 'sideways_time_stop': 234, 'sideways_use_sma': False, 'sideways_use_ema': True, 'sideways_use_atr': False, 'sideways_use_adx': True, 'sideways_use_spike': True, 'sideways_rsi_required': False}.
[I 2025-09-01 08:20:37,059] Trial 380 finished with values: [-1000000000.0, 1000000000.0] and parameters: {'p_sma': 43, 'p_std': 15, 'p_atr': 14, 'p_adx': 18, 'rsi_period': 39, 'ema1': 23, 'ema2': 50, 'slip_atr_k': 0.04424029078248162, 'slip_spread_k': 0.6485155652546062, 'spread_hl_frac': 0.03445254469079912, 'bb_std_mult': 3.263215386383648, 'rsi_os': 52, 'rsi_ob': 66, 'vol_spike': 0.2237566361547932, 'adx_thresh': 26.048808122438317, 'atr_min_pct': 0.009828859853298379, 'atr_max_pct': 0.04830009602290626, 'tp_mult': 1.0665581513649585, 'tsl_mult': 0.36064583055624994, 'strategy': 'mean_reversion', 'time_stop': 272, 'use_sma': True, 'use_atr': True, 'use_adx': True, 'use_ema': False, 'use_spike': False, 'rsi_required': True, 'edge_k': 0.7515660260779878, 'edge_cap': 0.8545952874594736, 'bull_strategy': 'breakout', 'bull_bb_std_mult': 2.681143661205976, 'bull_rsi_os': 7, 'bull_rsi_ob': 58, 'bull_adx_thresh': 7.408642370082816, 'bull_atr_min_pct': 0.018701768338125653, 'bull_atr_max_pct': 0.044600544305278274, 'bull_tp_mult': 1.6243160994155112, 'bull_tsl_mult': 0.768035681621799, 'bull_time_stop': 162, 'bull_use_sma': True, 'bull_use_ema': False, 'bull_use_atr': True, 'bull_use_adx': True, 'bull_use_spike': False, 'bull_rsi_required': False, 'bear_strategy': 'breakout', 'bear_bb_std_mult': 0.655586211336131, 'bear_rsi_os': 45, 'bear_rsi_ob': 63, 'bear_adx_thresh': 8.078130722328279, 'bear_atr_min_pct': 0.010859053290235149, 'bear_atr_max_pct': 0.08016774120460936, 'bear_tp_mult': 1.08367562187243, 'bear_tsl_mult': 0.1250523319124003, 'bear_time_stop': 196, 'bear_use_sma': False, 'bear_use_ema': False, 'bear_use_atr': True, 'bear_use_adx': True, 'bear_use_spike': True, 'bear_rsi_required': False, 'sideways_strategy': 'breakout', 'sideways_bb_std_mult': 3.0937813598619783, 'sideways_rsi_os': 39, 'sideways_rsi_ob': 64, 'sideways_adx_thresh': 8.889868269566673, 'sideways_atr_min_pct': 0.023437103339983636, 'sideways_atr_max_pct': 0.03567730396002899, 'sideways_tp_mult': 2.2152720489016646, 'sideways_tsl_mult': 0.7185369892034593, 'sideways_time_stop': 253, 'sideways_use_sma': False, 'sideways_use_ema': False, 'sideways_use_atr': True, 'sideways_use_adx': False, 'sideways_use_spike': False, 'sideways_rsi_required': True}.
