[I 2025-09-01 08:17:34,168] Trial 353 finished with values: [-1000000000.0, 1000000000.0] and parameters: {'p_sma': 20, 'p_std': 9, 'p_atr': 11, 'p_adx': 11, 'rsi_period': 14, 'ema1': 11, 'ema2': 10, 'slip_atr_k': 0.055643917712509754, 'slip_spread_k': 0.6185918539308483, 'spread_hl_frac': 0.026507576426977205, 'bb_std_mult': 2.9689170546653725, 'rsi_os': 24, 'rsi_ob': 56, 'vol_spike': 0.00010919654104105114, 'adx_thresh': 23.40413315145525, 'atr_min_pct': 0.022378660815119376, 'atr_max_pct': 0.14806055975587057, 'tp_mult': 1.3246164959420568, 'tsl_mult': 0.43730368661905555, 'strategy': 'mean_reversion', 'time_stop': 249, 'use_sma': True, 'use_atr': True, 'use_adx': True, 'use_ema': True, 'use_spike': True, 'rsi_required': True, 'edge_k': 1.0241178097341106, 'edge_cap': 0.08456846747549646, 'bull_strategy': 'breakout', 'bull_bb_std_mult': 2.6526002287620907, 'bull_rsi_os': 45, 'bull_rsi_ob': 48, 'bull_adx_thresh': 8.375741794849901, 'bull_atr_min_pct': 0.010512402376315115, 'bull_atr_max_pct': 0.036309107890874305, 'bull_tp_mult': 2.0019959698625054, 'bull_tsl_mult': 0.608847389002736, 'bull_time_stop': 156, 'bull_use_sma': True, 'bull_use_ema': False, 'bull_use_atr': False, 'bull_use_adx': True, 'bull_use_spike': True, 'bull_rsi_required': True, 'bear_strategy': 'mean_reversion', 'bear_bb_std_mult': 0.5421735122328302, 'bear_rsi_os': 32, 'bear_rsi_ob': 91, 'bear_adx_thresh': 34.00750826194156, 'bear_atr_min_pct': 0.014751363035925136, 'bear_atr_max_pct': 0.0844244657468574, 'bear_tp_mult': 1.952574208757562, 'bear_tsl_mult': 0.10217247551710266, 'bear_time_stop': 89, 'bear_use_sma': False, 'bear_use_ema': False, 'bear_use_atr': True, 'bear_use_adx': True, 'bear_use_spike': True, 'bear_rsi_required': True, 'sideways_strategy': 'mean_reversion', 'sideways_bb_std_mult': 2.805161273357038, 'sideways_rsi_os': 45, 'sideways_rsi_ob': 81, 'sideways_adx_thresh': 8.20137320870574, 'sideways_atr_min_pct': 0.02913178432753035, 'sideways_atr_max_pct': 0.07516486337231645, 'sideways_tp_mult': 2.5704792116844657, 'sideways_tsl_mult': 0.10126722006406624, 'sideways_time_stop': 36, 'sideways_use_sma': False, 'sideways_use_ema': False, 'sideways_use_atr': False, 'sideways_use_adx': True, 'sideways_use_spike': True, 'sideways_rsi_required': False}.
[I 2025-09-01 08:17:34,310] Trial 351 finished with values: [-1000000000.0, 1000000000.0] and parameters: {'p_sma': 20, 'p_std': 38, 'p_atr': 11, 'p_adx': 21, 'rsi_period': 41, 'ema1': 10, 'ema2': 14, 'slip_atr_k': 0.05546507646531889, 'slip_spread_k': 0.648527359641344, 'spread_hl_frac': 0.022090470470279067, 'bb_std_mult': 3.4357773019527924, 'rsi_os': 44, 'rsi_ob': 56, 'vol_spike': 0.24235106566670533, 'adx_thresh': 32.62485166349998, 'atr_min_pct': 0.014541427099945393, 'atr_max_pct': 0.07001269123167567, 'tp_mult': 1.2426974354501839, 'tsl_mult': 0.7042424397204025, 'strategy': 'breakout', 'time_stop': 81, 'use_sma': True, 'use_atr': True, 'use_adx': True, 'use_ema': True, 'use_spike': True, 'rsi_required': False, 'edge_k': 1.066309483102126, 'edge_cap': 0.08720411673878992, 'bull_strategy': 'breakout', 'bull_bb_std_mult': 2.7694334964947864, 'bull_rsi_os': 14, 'bull_rsi_ob': 67, 'bull_adx_thresh': 6.6446861524161145, 'bull_atr_min_pct': 0.007834566309529993, 'bull_atr_max_pct': 0.04517617107335525, 'bull_tp_mult': 1.3466949193854962, 'bull_tsl_mult': 0.43938531466292063, 'bull_time_stop': 300, 'bull_use_sma': False, 'bull_use_ema': False, 'bull_use_atr': True, 'bull_use_adx': True, 'bull_use_spike': False, 'bull_rsi_required': True, 'bear_strategy': 'mean_reversion', 'bear_bb_std_mult': 0.5355151742643367, 'bear_rsi_os': 29, 'bear_rsi_ob': 54, 'bear_adx_thresh': 33.95132119766258, 'bear_atr_min_pct': 0.014866153120011692, 'bear_atr_max_pct': 0.07861514925242707, 'bear_tp_mult': 2.642458833755104, 'bear_tsl_mult': 0.2752313485357749, 'bear_time_stop': 100, 'bear_use_sma': True, 'bear_use_ema': False, 'bear_use_atr': False, 'bear_use_adx': False, 'bear_use_spike': True, 'bear_rsi_required': False, 'sideways_strategy': 'mean_reversion', 'sideways_bb_std_mult': 0.6324468099983351, 'sideways_rsi_os': 45, 'sideways_rsi_ob': 92, 'sideways_adx_thresh': 9.21205368143671, 'sideways_atr_min_pct': 0.0189092702329269, 'sideways_atr_max_pct': 0.03351057464603118, 'sideways_tp_mult': 1.6367969233877895, 'sideways_tsl_mult': 0.45130494913556857, 'sideways_time_stop': 22, 'sideways_use_sma': False, 'sideways_use_ema': False, 'sideways_use_atr': False, 'sideways_use_adx': True, 'sideways_use_spike': True, 'sideways_rsi_required': True}.
[I 2025-09-01 08:17:34,522] Trial 349 finished with values: [-1000000000.0, 1000000000.0] and parameters: {'p_sma': 28, 'p_std': 8, 'p_atr': 29, 'p_adx': 27, 'rsi_period': 66, 'ema1': 10, 'ema2': 14, 'slip_atr_k': 0.04819648788103673, 'slip_spread_k': 0.35162226657396123, 'spread_hl_frac': 0.02483192109670486, 'bb_std_mult': 2.5251923450820737, 'rsi_os': 10, 'rsi_ob': 58, 'vol_spike': 0.23621206514068516, 'adx_thresh': 6.358756122290908, 'atr_min_pct': 0.019750948789912487, 'atr_max_pct': 0.11157368470223819, 'tp_mult': 1.1555331935689177, 'tsl_mult': 0.5338343910969284, 'strategy': 'breakout', 'time_stop': 237, 'use_sma': True, 'use_atr': False, 'use_adx': False, 'use_ema': True, 'use_spike': True, 'rsi_required': False, 'edge_k': 1.0612581911048444, 'edge_cap': 0.6386624610240532, 'bull_strategy': 'breakout', 'bull_bb_std_mult': 2.755907777115534, 'bull_rsi_os': 35, 'bull_rsi_ob': 48, 'bull_adx_thresh': 12.835653156524746, 'bull_atr_min_pct': 0.013440503765912892, 'bull_atr_max_pct': 0.016793789702501047, 'bull_tp_mult': 1.3426748077969597, 'bull_tsl_mult': 0.4532429211559505, 'bull_time_stop': 148, 'bull_use_sma': False, 'bull_use_ema': True, 'bull_use_atr': False, 'bull_use_adx': True, 'bull_use_spike': True, 'bull_rsi_required': True, 'bear_strategy': 'mean_reversion', 'bear_bb_std_mult': 3.4366978782637854, 'bear_rsi_os': 32, 'bear_rsi_ob': 95, 'bear_adx_thresh': 32.18260917351904, 'bear_atr_min_pct': 0.006986268091888027, 'bear_atr_max_pct': 0.013187495924366396, 'bear_tp_mult': 2.900434695640649, 'bear_tsl_mult': 0.8485968544349927, 'bear_time_stop': 243, 'bear_use_sma': False, 'bear_use_ema': False, 'bear_use_atr': True, 'bear_use_adx': False, 'bear_use_spike': True, 'bear_rsi_required': False, 'sideways_strategy': 'mean_reversion', 'sideways_bb_std_mult': 0.6500747253191126, 'sideways_rsi_os': 38, 'sideways_rsi_ob': 78, 'sideways_adx_thresh': 20.294714312261018, 'sideways_atr_min_pct': 0.018993486768002714, 'sideways_atr_max_pct': 0.07538374592897673, 'sideways_tp_mult': 2.3241646763246635, 'sideways_tsl_mult': 0.134355902462699, 'sideways_time_stop': 29, 'sideways_use_sma': True, 'sideways_use_ema': False, 'sideways_use_atr': False, 'sideways_use_adx': True, 'sideways_use_spike': True, 'sideways_rsi_required': False}.
[I 2025-09-01 08:18:14,132] Trial 354 finished with values: [-1000000000.0, 1000000000.0] and parameters: {'p_sma': 21, 'p_std': 13, 'p_atr': 7, 'p_adx': 27, 'rsi_period': 30, 'ema1': 8, 'ema2': 55, 'slip_atr_k': 0.14694487291621972, 'slip_spread_k': 0.1328885203145317, 'spread_hl_frac': 0.026594230846765536, 'bb_std_mult': 0.7727290374918709, 'rsi_os': 24, 'rsi_ob': 56, 'vol_spike': 0.23643658838064432, 'adx_thresh': 23.066855122860293, 'atr_min_pct': 0.02960838158073483, 'atr_max_pct': 0.05400346638563422, 'tp_mult': 1.0859631446567857, 'tsl_mult': 0.5083143859852622, 'strategy': 'mean_reversion', 'time_stop': 269, 'use_sma': True, 'use_atr': True, 'use_adx': True, 'use_ema': True, 'use_spike': True, 'rsi_required': True, 'edge_k': 1.0278112976177303, 'edge_cap': 0.08761317061875033, 'bull_strategy': 'breakout', 'bull_bb_std_mult': 2.679332946620969, 'bull_rsi_os': 33, 'bull_rsi_ob': 68, 'bull_adx_thresh': 8.137225611509871, 'bull_atr_min_pct': 0.005838599959594543, 'bull_atr_max_pct': 0.045239090271744956, 'bull_tp_mult': 2.438615290842798, 'bull_tsl_mult': 0.19731988317623267, 'bull_time_stop': 159, 'bull_use_sma': True, 'bull_use_ema': False, 'bull_use_atr': False, 'bull_use_adx': True, 'bull_use_spike': True, 'bull_rsi_required': False, 'bear_strategy': 'mean_reversion', 'bear_bb_std_mult': 3.2831790633992584, 'bear_rsi_os': 23, 'bear_rsi_ob': 91, 'bear_adx_thresh': 31.476191943869864, 'bear_atr_min_pct': 0.02274783153775838, 'bear_atr_max_pct': 0.0855856866248781, 'bear_tp_mult': 2.751601383057367, 'bear_tsl_mult': 0.37525023126372625, 'bear_time_stop': 273, 'bear_use_sma': False, 'bear_use_ema': False, 'bear_use_atr': True, 'bear_use_adx': True, 'bear_use_spike': True, 'bear_rsi_required': True, 'sideways_strategy': 'mean_reversion', 'sideways_bb_std_mult': 1.386804449901289, 'sideways_rsi_os': 36, 'sideways_rsi_ob': 67, 'sideways_adx_thresh': 20.547123538143445, 'sideways_atr_min_pct': 0.022338183313813584, 'sideways_atr_max_pct': 0.03219041732882925, 'sideways_tp_mult': 2.4117441443807284, 'sideways_tsl_mult': 0.20620861604242458, 'sideways_time_stop': 20, 'sideways_use_sma': False, 'sideways_use_ema': False, 'sideways_use_atr': False, 'sideways_use_adx': True, 'sideways_use_spike': True, 'sideways_rsi_required': False}.
[I 2025-09-01 08:18:15,154] Trial 356 finished with values: [-1000000000.0, 1000000000.0] and parameters: {'p_sma': 58, 'p_std': 13, 'p_atr': 12, 'p_adx': 27, 'rsi_period': 17, 'ema1': 26, 'ema2': 16, 'slip_atr_k': 0.05947984675442712, 'slip_spread_k': 0.6303510592063408, 'spread_hl_frac': 0.023431695137326725, 'bb_std_mult': 2.2522056713820633, 'rsi_os': 40, 'rsi_ob': 57, 'vol_spike': 0.26264146059880555, 'adx_thresh': 26.35145916257369, 'atr_min_pct': 0.020894584212773997, 'atr_max_pct': 0.09863296942143483, 'tp_mult': 1.0986209571705505, 'tsl_mult': 0.4840548169003794, 'strategy': 'mean_reversion', 'time_stop': 109, 'use_sma': False, 'use_atr': False, 'use_adx': False, 'use_ema': True, 'use_spike': True, 'rsi_required': True, 'edge_k': 1.6243582132981425, 'edge_cap': 0.3233548716112177, 'bull_strategy': 'mean_reversion', 'bull_bb_std_mult': 3.307492007586424, 'bull_rsi_os': 13, 'bull_rsi_ob': 68, 'bull_adx_thresh': 30.616359220653475, 'bull_atr_min_pct': 0.0057917106537252825, 'bull_atr_max_pct': 0.01605058635979982, 'bull_tp_mult': 1.6642773880309254, 'bull_tsl_mult': 0.5672324191495474, 'bull_time_stop': 126, 'bull_use_sma': True, 'bull_use_ema': True, 'bull_use_atr': False, 'bull_use_adx': True, 'bull_use_spike': True, 'bull_rsi_required': False, 'bear_strategy': 'mean_reversion', 'bear_bb_std_mult': 1.638873154465158, 'bear_rsi_os': 23, 'bear_rsi_ob': 90, 'bear_adx_thresh': 32.30114915578597, 'bear_atr_min_pct': 0.02391229539049823, 'bear_atr_max_pct': 0.08690196404344333, 'bear_tp_mult': 2.4202258161254306, 'bear_tsl_mult': 0.028297310207234104, 'bear_time_stop': 285, 'bear_use_sma': False, 'bear_use_ema': False, 'bear_use_atr': True, 'bear_use_adx': True, 'bear_use_spike': False, 'bear_rsi_required': False, 'sideways_strategy': 'mean_reversion', 'sideways_bb_std_mult': 0.506012612606067, 'sideways_rsi_os': 36, 'sideways_rsi_ob': 75, 'sideways_adx_thresh': 10.977050732459697, 'sideways_atr_min_pct': 0.022411850844301355, 'sideways_atr_max_pct': 0.045811050471514486, 'sideways_tp_mult': 2.5139009139949247, 'sideways_tsl_mult': 0.18628456688270997, 'sideways_time_stop': 42, 'sideways_use_sma': False, 'sideways_use_ema': True, 'sideways_use_atr': False, 'sideways_use_adx': True, 'sideways_use_spike': True, 'sideways_rsi_required': False}.
[I 2025-09-01 08:18:15,851] Trial 357 finished with values: [-1000000000.0, 1000000000.0] and parameters: {'p_sma': 25, 'p_std': 50, 'p_atr': 12, 'p_adx': 13, 'rsi_period': 7, 'ema1': 8, 'ema2': 55, 'slip_atr_k': 0.0625526842961837, 'slip_spread_k': 0.6356719493673554, 'spread_hl_frac': 0.04142938246187695, 'bb_std_mult': 3.2515404939409285, 'rsi_os': 23, 'rsi_ob': 57, 'vol_spike': 0.29980746512438905, 'adx_thresh': 5.073871353617196, 'atr_min_pct': 0.020794009672142368, 'atr_max_pct': 0.09768740613245011, 'tp_mult': 1.5257808407110307, 'tsl_mult': 0.4864260919988425, 'strategy': 'mean_reversion', 'time_stop': 263, 'use_sma': False, 'use_atr': True, 'use_adx': True, 'use_ema': True, 'use_spike': True, 'rsi_required': True, 'edge_k': 0.98682480101417, 'edge_cap': 0.3159486727494053, 'bull_strategy': 'mean_reversion', 'bull_bb_std_mult': 3.025659849258278, 'bull_rsi_os': 13, 'bull_rsi_ob': 83, 'bull_adx_thresh': 28.502670585653544, 'bull_atr_min_pct': 0.007230049455856969, 'bull_atr_max_pct': 0.07884836108353217, 'bull_tp_mult': 2.1967112450180006, 'bull_tsl_mult': 0.6745052512782677, 'bull_time_stop': 184, 'bull_use_sma': True, 'bull_use_ema': False, 'bull_use_atr': False, 'bull_use_adx': True, 'bull_use_spike': True, 'bull_rsi_required': False, 'bear_strategy': 'mean_reversion', 'bear_bb_std_mult': 1.3477983392152773, 'bear_rsi_os': 23, 'bear_rsi_ob': 46, 'bear_adx_thresh': 31.305378332949658, 'bear_atr_min_pct': 0.02397670416363564, 'bear_atr_max_pct': 0.07179264801505708, 'bear_tp_mult': 2.744522900547634, 'bear_tsl_mult': 0.02765756933483482, 'bear_time_stop': 71, 'bear_use_sma': False, 'bear_use_ema': False, 'bear_use_atr': True, 'bear_use_adx': True, 'bear_use_spike': False, 'bear_rsi_required': True, 'sideways_strategy': 'mean_reversion', 'sideways_bb_std_mult': 0.5090725656555336, 'sideways_rsi_os': 23, 'sideways_rsi_ob': 52, 'sideways_adx_thresh': 19.358831412627396, 'sideways_atr_min_pct': 0.022484768931553108, 'sideways_atr_max_pct': 0.04620144178282447, 'sideways_tp_mult': 2.41025253980974, 'sideways_tsl_mult': 0.19767989646417838, 'sideways_time_stop': 18, 'sideways_use_sma': False, 'sideways_use_ema': True, 'sideways_use_atr': False, 'sideways_use_adx': True, 'sideways_use_spike': True, 'sideways_rsi_required': False}.
[I 2025-09-01 08:18:16,502] Trial 355 finished with values: [-1000000000.0, 1000000000.0] and parameters: {'p_sma': 15, 'p_std': 30, 'p_atr': 12, 'p_adx': 13, 'rsi_period': 7, 'ema1': 8, 'ema2': 20, 'slip_atr_k': 0.16185911367492362, 'slip_spread_k': 0.6329970032664081, 'spread_hl_frac': 0.023137841561089778, 'bb_std_mult': 2.2526086912180534, 'rsi_os': 23, 'rsi_ob': 57, 'vol_spike': 0.058719545220377686, 'adx_thresh': 5.791785728031174, 'atr_min_pct': 0.020889905228501007, 'atr_max_pct': 0.14266927600882423, 'tp_mult': 1.8828413507454034, 'tsl_mult': 0.48835396235279416, 'strategy': 'mean_reversion', 'time_stop': 172, 'use_sma': False, 'use_atr': False, 'use_adx': False, 'use_ema': True, 'use_spike': True, 'rsi_required': True, 'edge_k': 1.133282298909574, 'edge_cap': 0.11246210399762628, 'bull_strategy': 'mean_reversion', 'bull_bb_std_mult': 3.2094509869463383, 'bull_rsi_os': 9, 'bull_rsi_ob': 68, 'bull_adx_thresh': 9.650732299778872, 'bull_atr_min_pct': 0.005796221921715208, 'bull_atr_max_pct': 0.016433253614869553, 'bull_tp_mult': 2.1236392673134525, 'bull_tsl_mult': 0.1996690100763549, 'bull_time_stop': 161, 'bull_use_sma': True, 'bull_use_ema': True, 'bull_use_atr': False, 'bull_use_adx': True, 'bull_use_spike': True, 'bull_rsi_required': False, 'bear_strategy': 'mean_reversion', 'bear_bb_std_mult': 3.1519688068960927, 'bear_rsi_os': 23, 'bear_rsi_ob': 95, 'bear_adx_thresh': 29.724876618881808, 'bear_atr_min_pct': 0.02876302923625497, 'bear_atr_max_pct': 0.08104864333047195, 'bear_tp_mult': 2.7513841007193447, 'bear_tsl_mult': 0.32534256429941016, 'bear_time_stop': 86, 'bear_use_sma': False, 'bear_use_ema': False, 'bear_use_atr': True, 'bear_use_adx': True, 'bear_use_spike': False, 'bear_rsi_required': False, 'sideways_strategy': 'mean_reversion', 'sideways_bb_std_mult': 0.5304256115743567, 'sideways_rsi_os': 36, 'sideways_rsi_ob': 75, 'sideways_adx_thresh': 11.783729358212126, 'sideways_atr_min_pct': 0.022360214974530234, 'sideways_atr_max_pct': 0.04565946978935715, 'sideways_tp_mult': 2.5940548347366694, 'sideways_tsl_mult': 0.19242157193032086, 'sideways_time_stop': 214, 'sideways_use_sma': False, 'sideways_use_ema': True, 'sideways_use_atr': False, 'sideways_use_adx': True, 'sideways_use_spike': True, 'sideways_rsi_required': False}.
[I 2025-09-01 08:18:58,384] Trial 360 finished with values: [-0.031164012938459718, 0.031533720690300984] and parameters: {'p_sma': 23, 'p_std': 15, 'p_atr': 16, 'p_adx': 21, 'rsi_period': 70, 'ema1': 9, 'ema2': 12, 'slip_atr_k': 0.07205966332734284, 'slip_spread_k': 0.6655775354427366, 'spread_hl_frac': 0.027613680643300262, 'bb_std_mult': 3.4990370459292177, 'rsi_os': 26, 'rsi_ob': 82, 'vol_spike': 0.12118022372322121, 'adx_thresh': 11.463856357498077, 'atr_min_pct': 0.027532932140833275, 'atr_max_pct': 0.14215927349333374, 'tp_mult': 1.4198178026373802, 'tsl_mult': 0.5136381541341664, 'strategy': 'mean_reversion', 'time_stop': 140, 'use_sma': True, 'use_atr': True, 'use_adx': True, 'use_ema': False, 'use_spike': True, 'rsi_required': True, 'edge_k': 0.08573558374363588, 'edge_cap': 0.9666926344731519, 'bull_strategy': 'breakout', 'bull_bb_std_mult': 3.1713093736912796, 'bull_rsi_os': 7, 'bull_rsi_ob': 51, 'bull_adx_thresh': 10.068011357129226, 'bull_atr_min_pct': 0.004013386888267011, 'bull_atr_max_pct': 0.0332869060971898, 'bull_tp_mult': 2.1117291040909256, 'bull_tsl_mult': 0.9442768368766253, 'bull_time_stop': 66, 'bull_use_sma': True, 'bull_use_ema': False, 'bull_use_atr': False, 'bull_use_adx': False, 'bull_use_spike': True, 'bull_rsi_required': False, 'bear_strategy': 'mean_reversion', 'bear_bb_std_mult': 3.1607981451550913, 'bear_rsi_os': 7, 'bear_rsi_ob': 75, 'bear_adx_thresh': 32.69177392209377, 'bear_atr_min_pct': 0.022437170645991676, 'bear_atr_max_pct': 0.08133208608303717, 'bear_tp_mult': 1.3622880909988173, 'bear_tsl_mult': 0.05594079734352966, 'bear_time_stop': 163, 'bear_use_sma': False, 'bear_use_ema': True, 'bear_use_atr': True, 'bear_use_adx': True, 'bear_use_spike': True, 'bear_rsi_required': False, 'sideways_strategy': 'mean_reversion', 'sideways_bb_std_mult': 0.7859605797859324, 'sideways_rsi_os': 41, 'sideways_rsi_ob': 46, 'sideways_adx_thresh': 9.761268251687184, 'sideways_atr_min_pct': 0.023682402578044454, 'sideways_atr_max_pct': 0.13314127663894362, 'sideways_tp_mult': 2.607338333175439, 'sideways_tsl_mult': 0.5551247023286976, 'sideways_time_stop': 35, 'sideways_use_sma': False, 'sideways_use_ema': False, 'sideways_use_atr': False, 'sideways_use_adx': False, 'sideways_use_spike': False, 'sideways_rsi_required': False}.
[I 2025-09-01 08:18:59,105] Trial 359 finished with values: [-1000000000.0, 1000000000.0] and parameters: {'p_sma': 48, 'p_std': 50, 'p_atr': 13, 'p_adx': 20, 'rsi_period': 20, 'ema1': 9, 'ema2': 20, 'slip_atr_k': 0.06406334567515048, 'slip_spread_k': 0.662736149165534, 'spread_hl_frac': 0.02401244615270147, 'bb_std_mult': 2.1175631269709028, 'rsi_os': 23, 'rsi_ob': 74, 'vol_spike': 0.07131006003143518, 'adx_thresh': 5.477920880297107, 'atr_min_pct': 0.027781274334616964, 'atr_max_pct': 0.14306750829945028, 'tp_mult': 1.8703993801797174, 'tsl_mult': 0.1793941345734193, 'strategy': 'mean_reversion', 'time_stop': 299, 'use_sma': False, 'use_atr': True, 'use_adx': True, 'use_ema': True, 'use_spike': True, 'rsi_required': True, 'edge_k': 1.231197691793472, 'edge_cap': 0.7130425407159044, 'bull_strategy': 'mean_reversion', 'bull_bb_std_mult': 3.020929961464856, 'bull_rsi_os': 50, 'bull_rsi_ob': 51, 'bull_adx_thresh': 28.745820477708666, 'bull_atr_min_pct': 0.004156076078021421, 'bull_atr_max_pct': 0.07776603526065076, 'bull_tp_mult': 2.118076048620587, 'bull_tsl_mult': 0.5367039420543077, 'bull_time_stop': 163, 'bull_use_sma': True, 'bull_use_ema': False, 'bull_use_atr': False, 'bull_use_adx': False, 'bull_use_spike': True, 'bull_rsi_required': False, 'bear_strategy': 'mean_reversion', 'bear_bb_std_mult': 3.147779904604517, 'bear_rsi_os': 21, 'bear_rsi_ob': 67, 'bear_adx_thresh': 15.240553197150827, 'bear_atr_min_pct': 0.021062868633279715, 'bear_atr_max_pct': 0.14146007038700145, 'bear_tp_mult': 2.811632011698437, 'bear_tsl_mult': 0.14968761781692058, 'bear_time_stop': 73, 'bear_use_sma': False, 'bear_use_ema': True, 'bear_use_atr': True, 'bear_use_adx': True, 'bear_use_spike': False, 'bear_rsi_required': False, 'sideways_strategy': 'mean_reversion', 'sideways_bb_std_mult': 2.463755971322324, 'sideways_rsi_os': 41, 'sideways_rsi_ob': 73, 'sideways_adx_thresh': 11.936132662344276, 'sideways_atr_min_pct': 0.02365791926936439, 'sideways_atr_max_pct': 0.058264463442006295, 'sideways_tp_mult': 2.600832790441886, 'sideways_tsl_mult': 0.16851823551773001, 'sideways_time_stop': 15, 'sideways_use_sma': False, 'sideways_use_ema': True, 'sideways_use_atr': False, 'sideways_use_adx': True, 'sideways_use_spike': True, 'sideways_rsi_required': False}.
