[I 2025-09-01 08:48:47,727] Trial 539 finished with values: [-0.16027804490223785, 0.15998675622413638] and parameters: {'p_sma': 45, 'p_std': 14, 'p_atr': 12, 'p_adx': 19, 'rsi_period': 62, 'ema1': 28, 'ema2': 42, 'slip_atr_k': 0.24637322217523613, 'slip_spread_k': 0.1687070238072314, 'spread_hl_frac': 0.028267067983764264, 'bb_std_mult': 1.3288503235466633, 'rsi_os': 20, 'rsi_ob': 56, 'vol_spike': 0.2477102666581984, 'adx_thresh': 18.850235329731934, 'atr_min_pct': 0.022730106777307555, 'atr_max_pct': 0.14720248748770984, 'tp_mult': 1.0787966748232778, 'tsl_mult': 0.38487273658845467, 'strategy': 'mean_reversion', 'time_stop': 253, 'use_sma': True, 'use_atr': True, 'use_adx': True, 'use_ema': True, 'use_spike': True, 'rsi_required': True, 'edge_k': 0.9340579785447224, 'edge_cap': 0.09792660109076334, 'bull_strategy': 'breakout', 'bull_bb_std_mult': 1.5571850109998018, 'bull_rsi_os': 19, 'bull_rsi_ob': 68, 'bull_adx_thresh': 10.506373181324536, 'bull_atr_min_pct': 0.0016568934965216931, 'bull_atr_max_pct': 0.10883619795748758, 'bull_tp_mult': 2.2797599452046984, 'bull_tsl_mult': 0.6972268266204414, 'bull_time_stop': 68, 'bull_use_sma': True, 'bull_use_ema': False, 'bull_use_atr': False, 'bull_use_adx': True, 'bull_use_spike': True, 'bull_rsi_required': False, 'bear_strategy': 'mean_reversion', 'bear_bb_std_mult': 3.0665154502409706, 'bear_rsi_os': 24, 'bear_rsi_ob': 95, 'bear_adx_thresh': 31.93876179843819, 'bear_atr_min_pct': 0.010735174418719835, 'bear_atr_max_pct': 0.08715397953690042, 'bear_tp_mult': 2.79990584123463, 'bear_tsl_mult': 0.4936210161494662, 'bear_time_stop': 87, 'bear_use_sma': False, 'bear_use_ema': False, 'bear_use_atr': True, 'bear_use_adx': False, 'bear_use_spike': True, 'bear_rsi_required': False, 'sideways_strategy': 'mean_reversion', 'sideways_bb_std_mult': 0.7009678305334357, 'sideways_rsi_os': 24, 'sideways_rsi_ob': 72, 'sideways_adx_thresh': 9.425656107006674, 'sideways_atr_min_pct': 0.02349620826206966, 'sideways_atr_max_pct': 0.01975653750157849, 'sideways_tp_mult': 2.5031316352411728, 'sideways_tsl_mult': 0.33027680582551633, 'sideways_time_stop': 163, 'sideways_use_sma': False, 'sideways_use_ema': False, 'sideways_use_atr': False, 'sideways_use_adx': True, 'sideways_use_spike': True, 'sideways_rsi_required': False}.
[I 2025-09-01 08:48:48,063] Trial 541 finished with values: [-0.19030846242689547, 0.19115298497789213] and parameters: {'p_sma': 21, 'p_std': 10, 'p_atr': 30, 'p_adx': 22, 'rsi_period': 62, 'ema1': 10, 'ema2': 15, 'slip_atr_k': 0.21388865583202876, 'slip_spread_k': 0.1592813162024106, 'spread_hl_frac': 0.028196974021192818, 'bb_std_mult': 3.3351251756825233, 'rsi_os': 25, 'rsi_ob': 56, 'vol_spike': 0.1546694766834318, 'adx_thresh': 24.124046730491948, 'atr_min_pct': 0.02212198807482413, 'atr_max_pct': 0.14805892202423085, 'tp_mult': 1.0783522192725419, 'tsl_mult': 0.27475599471174167, 'strategy': 'mean_reversion', 'time_stop': 188, 'use_sma': True, 'use_atr': True, 'use_adx': True, 'use_ema': False, 'use_spike': True, 'rsi_required': False, 'edge_k': 0.9327615828976019, 'edge_cap': 0.1182867609092975, 'bull_strategy': 'breakout', 'bull_bb_std_mult': 2.7625311363862406, 'bull_rsi_os': 14, 'bull_rsi_ob': 53, 'bull_adx_thresh': 8.043344033311726, 'bull_atr_min_pct': 0.0017389644333611395, 'bull_atr_max_pct': 0.12876108737404732, 'bull_tp_mult': 2.182855174683084, 'bull_tsl_mult': 0.4392939584559177, 'bull_time_stop': 176, 'bull_use_sma': True, 'bull_use_ema': False, 'bull_use_atr': False, 'bull_use_adx': True, 'bull_use_spike': True, 'bull_rsi_required': False, 'bear_strategy': 'mean_reversion', 'bear_bb_std_mult': 3.0547133435325424, 'bear_rsi_os': 27, 'bear_rsi_ob': 71, 'bear_adx_thresh': 12.365729249989126, 'bear_atr_min_pct': 0.010901055991188275, 'bear_atr_max_pct': 0.08946161839808639, 'bear_tp_mult': 1.6413726952956444, 'bear_tsl_mult': 0.09042020900136584, 'bear_time_stop': 99, 'bear_use_sma': False, 'bear_use_ema': False, 'bear_use_atr': True, 'bear_use_adx': False, 'bear_use_spike': True, 'bear_rsi_required': False, 'sideways_strategy': 'breakout', 'sideways_bb_std_mult': 0.6926904685295229, 'sideways_rsi_os': 24, 'sideways_rsi_ob': 72, 'sideways_adx_thresh': 9.690640021465866, 'sideways_atr_min_pct': 0.014343694148117779, 'sideways_atr_max_pct': 0.033951617273467745, 'sideways_tp_mult': 2.587890934679044, 'sideways_tsl_mult': 0.23221756573677627, 'sideways_time_stop': 27, 'sideways_use_sma': True, 'sideways_use_ema': False, 'sideways_use_atr': True, 'sideways_use_adx': True, 'sideways_use_spike': True, 'sideways_rsi_required': False}.
[I 2025-09-01 08:48:48,320] Trial 542 finished with values: [-0.13099166326010814, 0.13071863660272096] and parameters: {'p_sma': 21, 'p_std': 24, 'p_atr': 12, 'p_adx': 19, 'rsi_period': 62, 'ema1': 10, 'ema2': 15, 'slip_atr_k': 0.1326979369246845, 'slip_spread_k': 0.6556574052340178, 'spread_hl_frac': 0.0357647661711793, 'bb_std_mult': 3.342183612849009, 'rsi_os': 25, 'rsi_ob': 56, 'vol_spike': 0.24832326016163425, 'adx_thresh': 30.707524512533617, 'atr_min_pct': 0.01042439705970299, 'atr_max_pct': 0.12237384367394198, 'tp_mult': 1.8985859197068942, 'tsl_mult': 0.5056156341003967, 'strategy': 'mean_reversion', 'time_stop': 244, 'use_sma': True, 'use_atr': True, 'use_adx': True, 'use_ema': False, 'use_spike': False, 'rsi_required': False, 'edge_k': 0.9439981143793794, 'edge_cap': 0.6075629315064164, 'bull_strategy': 'breakout', 'bull_bb_std_mult': 2.7604254542823665, 'bull_rsi_os': 14, 'bull_rsi_ob': 68, 'bull_adx_thresh': 7.693933191508515, 'bull_atr_min_pct': 0.0017129810733257297, 'bull_atr_max_pct': 0.0404758736841107, 'bull_tp_mult': 2.9155919227902753, 'bull_tsl_mult': 0.4759359620207924, 'bull_time_stop': 218, 'bull_use_sma': True, 'bull_use_ema': False, 'bull_use_atr': False, 'bull_use_adx': True, 'bull_use_spike': True, 'bull_rsi_required': False, 'bear_strategy': 'breakout', 'bear_bb_std_mult': 2.1837119872418467, 'bear_rsi_os': 27, 'bear_rsi_ob': 95, 'bear_adx_thresh': 12.164861623668763, 'bear_atr_min_pct': 0.023481302987996944, 'bear_atr_max_pct': 0.06257513773973751, 'bear_tp_mult': 1.3420337027943368, 'bear_tsl_mult': 0.08958161339023821, 'bear_time_stop': 89, 'bear_use_sma': False, 'bear_use_ema': False, 'bear_use_atr': True, 'bear_use_adx': False, 'bear_use_spike': True, 'bear_rsi_required': False, 'sideways_strategy': 'breakout', 'sideways_bb_std_mult': 0.7084398896837671, 'sideways_rsi_os': 24, 'sideways_rsi_ob': 74, 'sideways_adx_thresh': 9.555348170105638, 'sideways_atr_min_pct': 0.02436672679937431, 'sideways_atr_max_pct': 0.01977722487275404, 'sideways_tp_mult': 2.59133106452131, 'sideways_tsl_mult': 0.2272582040008806, 'sideways_time_stop': 30, 'sideways_use_sma': True, 'sideways_use_ema': False, 'sideways_use_atr': True, 'sideways_use_adx': True, 'sideways_use_spike': True, 'sideways_rsi_required': False}.
[I 2025-09-01 08:48:49,465] Trial 545 finished with values: [-1000000000.0, 1000000000.0] and parameters: {'p_sma': 22, 'p_std': 28, 'p_atr': 8, 'p_adx': 14, 'rsi_period': 79, 'ema1': 20, 'ema2': 60, 'slip_atr_k': 0.06316684812101314, 'slip_spread_k': 0.0018075029352802585, 'spread_hl_frac': 0.033834598101531464, 'bb_std_mult': 1.9606330389422328, 'rsi_os': 38, 'rsi_ob': 49, 'vol_spike': 0.23388897076490334, 'adx_thresh': 26.395830087170104, 'atr_min_pct': 0.020823771416911354, 'atr_max_pct': 0.14179774726021824, 'tp_mult': 1.1424893445908915, 'tsl_mult': 0.24581674084672506, 'strategy': 'mean_reversion', 'time_stop': 241, 'use_sma': False, 'use_atr': True, 'use_adx': True, 'use_ema': False, 'use_spike': False, 'rsi_required': False, 'edge_k': 1.0148431469094252, 'edge_cap': 0.6147479877300648, 'bull_strategy': 'mean_reversion', 'bull_bb_std_mult': 2.8973140055783264, 'bull_rsi_os': 13, 'bull_rsi_ob': 70, 'bull_adx_thresh': 20.665245263752855, 'bull_atr_min_pct': 0.00375062865549083, 'bull_atr_max_pct': 0.04005311631536514, 'bull_tp_mult': 2.329359060088328, 'bull_tsl_mult': 0.6611406623246789, 'bull_time_stop': 130, 'bull_use_sma': True, 'bull_use_ema': False, 'bull_use_atr': False, 'bull_use_adx': True, 'bull_use_spike': True, 'bull_rsi_required': False, 'bear_strategy': 'breakout', 'bear_bb_std_mult': 0.9225529751283026, 'bear_rsi_os': 55, 'bear_rsi_ob': 51, 'bear_adx_thresh': 10.742187187799292, 'bear_atr_min_pct': 0.02351174674054878, 'bear_atr_max_pct': 0.06178721152290466, 'bear_tp_mult': 2.2237215512530994, 'bear_tsl_mult': 0.16891878251473225, 'bear_time_stop': 91, 'bear_use_sma': False, 'bear_use_ema': True, 'bear_use_atr': True, 'bear_use_adx': True, 'bear_use_spike': True, 'bear_rsi_required': False, 'sideways_strategy': 'breakout', 'sideways_bb_std_mult': 1.972541969895857, 'sideways_rsi_os': 40, 'sideways_rsi_ob': 56, 'sideways_adx_thresh': 8.021406189593916, 'sideways_atr_min_pct': 0.022117939066342258, 'sideways_atr_max_pct': 0.04126449687088488, 'sideways_tp_mult': 2.745040881268277, 'sideways_tsl_mult': 0.0993196125324563, 'sideways_time_stop': 18, 'sideways_use_sma': True, 'sideways_use_ema': False, 'sideways_use_atr': True, 'sideways_use_adx': True, 'sideways_use_spike': True, 'sideways_rsi_required': False}.
[I 2025-09-01 08:49:32,758] Trial 543 finished with values: [-1000000000.0, 1000000000.0] and parameters: {'p_sma': 46, 'p_std': 29, 'p_atr': 12, 'p_adx': 18, 'rsi_period': 21, 'ema1': 18, 'ema2': 59, 'slip_atr_k': 0.1310892626016583, 'slip_spread_k': 0.8979733471868956, 'spread_hl_frac': 0.03383923037752978, 'bb_std_mult': 1.95921033766498, 'rsi_os': 25, 'rsi_ob': 87, 'vol_spike': 0.23571974263790035, 'adx_thresh': 26.327506176690132, 'atr_min_pct': 0.003008478738300494, 'atr_max_pct': 0.12368338534672424, 'tp_mult': 1.0791098914625263, 'tsl_mult': 0.9869517414471309, 'strategy': 'mean_reversion', 'time_stop': 251, 'use_sma': True, 'use_atr': True, 'use_adx': True, 'use_ema': False, 'use_spike': False, 'rsi_required': False, 'edge_k': 1.0029498124096103, 'edge_cap': 0.6960171029355984, 'bull_strategy': 'breakout', 'bull_bb_std_mult': 1.5606631463801783, 'bull_rsi_os': 13, 'bull_rsi_ob': 70, 'bull_adx_thresh': 8.273342554460331, 'bull_atr_min_pct': 0.004613627362287308, 'bull_atr_max_pct': 0.03685795122794415, 'bull_tp_mult': 2.2819025228038687, 'bull_tsl_mult': 0.6644147078470615, 'bull_time_stop': 22, 'bull_use_sma': True, 'bull_use_ema': False, 'bull_use_atr': False, 'bull_use_adx': True, 'bull_use_spike': True, 'bull_rsi_required': False, 'bear_strategy': 'breakout', 'bear_bb_std_mult': 3.16814021852009, 'bear_rsi_os': 9, 'bear_rsi_ob': 73, 'bear_adx_thresh': 23.40182180468583, 'bear_atr_min_pct': 0.010764087415292029, 'bear_atr_max_pct': 0.08941353066464179, 'bear_tp_mult': 1.358854638758673, 'bear_tsl_mult': 0.1692381446830321, 'bear_time_stop': 89, 'bear_use_sma': False, 'bear_use_ema': False, 'bear_use_atr': True, 'bear_use_adx': False, 'bear_use_spike': True, 'bear_rsi_required': False, 'sideways_strategy': 'breakout', 'sideways_bb_std_mult': 2.928013918772933, 'sideways_rsi_os': 40, 'sideways_rsi_ob': 74, 'sideways_adx_thresh': 9.605969876641582, 'sideways_atr_min_pct': 0.02456484327324628, 'sideways_atr_max_pct': 0.021016419559067655, 'sideways_tp_mult': 1.5462446700811396, 'sideways_tsl_mult': 0.09967049122542847, 'sideways_time_stop': 131, 'sideways_use_sma': True, 'sideways_use_ema': False, 'sideways_use_atr': True, 'sideways_use_adx': True, 'sideways_use_spike': True, 'sideways_rsi_required': False}.
[I 2025-09-01 08:49:34,622] Trial 544 finished with values: [-0.04849400320937147, 0.048098624839664136] and parameters: {'p_sma': 21, 'p_std': 15, 'p_atr': 11, 'p_adx': 20, 'rsi_period': 66, 'ema1': 10, 'ema2': 17, 'slip_atr_k': 0.13306119006323439, 'slip_spread_k': 0.6271502405547049, 'spread_hl_frac': 0.025241875689785313, 'bb_std_mult': 3.4227184160021484, 'rsi_os': 26, 'rsi_ob': 55, 'vol_spike': 0.23367242378646463, 'adx_thresh': 26.259026099676927, 'atr_min_pct': 0.02446675602326386, 'atr_max_pct': 0.13375286338983217, 'tp_mult': 1.1409268082066135, 'tsl_mult': 0.5118736936457068, 'strategy': 'mean_reversion', 'time_stop': 137, 'use_sma': False, 'use_atr': True, 'use_adx': True, 'use_ema': False, 'use_spike': False, 'rsi_required': False, 'edge_k': 1.0106840714145446, 'edge_cap': 0.1234762628759617, 'bull_strategy': 'mean_reversion', 'bull_bb_std_mult': 2.8847835927438257, 'bull_rsi_os': 13, 'bull_rsi_ob': 59, 'bull_adx_thresh': 7.451738661076395, 'bull_atr_min_pct': 0.0038259411443608993, 'bull_atr_max_pct': 0.03992552962689793, 'bull_tp_mult': 2.3217619344791407, 'bull_tsl_mult': 0.44730069823541696, 'bull_time_stop': 187, 'bull_use_sma': True, 'bull_use_ema': False, 'bull_use_atr': False, 'bull_use_adx': True, 'bull_use_spike': True, 'bull_rsi_required': False, 'bear_strategy': 'breakout', 'bear_bb_std_mult': 3.1477361894884837, 'bear_rsi_os': 27, 'bear_rsi_ob': 80, 'bear_adx_thresh': 12.225618017951557, 'bear_atr_min_pct': 0.015422589198164324, 'bear_atr_max_pct': 0.08505151725793918, 'bear_tp_mult': 1.3484113882069995, 'bear_tsl_mult': 0.9495051477094467, 'bear_time_stop': 97, 'bear_use_sma': False, 'bear_use_ema': True, 'bear_use_atr': True, 'bear_use_adx': True, 'bear_use_spike': True, 'bear_rsi_required': False, 'sideways_strategy': 'breakout', 'sideways_bb_std_mult': 0.6010230835959487, 'sideways_rsi_os': 41, 'sideways_rsi_ob': 55, 'sideways_adx_thresh': 7.79876710925636, 'sideways_atr_min_pct': 0.011467080997159616, 'sideways_atr_max_pct': 0.08261402141665569, 'sideways_tp_mult': 2.0782065834464865, 'sideways_tsl_mult': 0.15888485897363164, 'sideways_time_stop': 71, 'sideways_use_sma': True, 'sideways_use_ema': False, 'sideways_use_atr': True, 'sideways_use_adx': True, 'sideways_use_spike': True, 'sideways_rsi_required': False}.
[I 2025-09-01 08:49:34,915] Trial 547 finished with values: [-1000000000.0, 1000000000.0] and parameters: {'p_sma': 29, 'p_std': 31, 'p_atr': 11, 'p_adx': 26, 'rsi_period': 24, 'ema1': 12, 'ema2': 20, 'slip_atr_k': 0.1972069630149229, 'slip_spread_k': 0.35029120502947453, 'spread_hl_frac': 0.019974622281334384, 'bb_std_mult': 3.1517578093646397, 'rsi_os': 22, 'rsi_ob': 87, 'vol_spike': 0.1781096172922015, 'adx_thresh': 11.945563814439902, 'atr_min_pct': 0.011684239604669624, 'atr_max_pct': 0.14988705752096326, 'tp_mult': 1.167729161353218, 'tsl_mult': 0.9957214825402129, 'strategy': 'mean_reversion', 'time_stop': 261, 'use_sma': True, 'use_atr': True, 'use_adx': False, 'use_ema': True, 'use_spike': True, 'rsi_required': True, 'edge_k': 0.9988465674814566, 'edge_cap': 0.3323810966690637, 'bull_strategy': 'breakout', 'bull_bb_std_mult': 1.9626428145607562, 'bull_rsi_os': 11, 'bull_rsi_ob': 54, 'bull_adx_thresh': 9.033717514406842, 'bull_atr_min_pct': 0.010654052026810986, 'bull_atr_max_pct': 0.036456953408574286, 'bull_tp_mult': 1.5740620697359295, 'bull_tsl_mult': 0.6636347990839925, 'bull_time_stop': 188, 'bull_use_sma': True, 'bull_use_ema': False, 'bull_use_atr': False, 'bull_use_adx': False, 'bull_use_spike': True, 'bull_rsi_required': False, 'bear_strategy': 'mean_reversion', 'bear_bb_std_mult': 0.8149058712130786, 'bear_rsi_os': 26, 'bear_rsi_ob': 93, 'bear_adx_thresh': 30.066762698412656, 'bear_atr_min_pct': 0.01654255951634747, 'bear_atr_max_pct': 0.08496720625038368, 'bear_tp_mult': 1.9524611302798671, 'bear_tsl_mult': 0.047927953493252864, 'bear_time_stop': 81, 'bear_use_sma': False, 'bear_use_ema': False, 'bear_use_atr': False, 'bear_use_adx': True, 'bear_use_spike': True, 'bear_rsi_required': False, 'sideways_strategy': 'mean_reversion', 'sideways_bb_std_mult': 0.6165053114888049, 'sideways_rsi_os': 41, 'sideways_rsi_ob': 61, 'sideways_adx_thresh': 10.256237148605415, 'sideways_atr_min_pct': 0.0227675996179235, 'sideways_atr_max_pct': 0.11272267840469524, 'sideways_tp_mult': 2.694404073430326, 'sideways_tsl_mult': 0.15558312925859694, 'sideways_time_stop': 17, 'sideways_use_sma': False, 'sideways_use_ema': True, 'sideways_use_atr': False, 'sideways_use_adx': False, 'sideways_use_spike': False, 'sideways_rsi_required': False}.
[I 2025-09-01 08:49:35,248] Trial 546 finished with values: [-0.03448370951052371, 0.03711305852836853] and parameters: {'p_sma': 35, 'p_std': 41, 'p_atr': 11, 'p_adx': 26, 'rsi_period': 24, 'ema1': 9, 'ema2': 17, 'slip_atr_k': 0.0776797961441309, 'slip_spread_k': 0.9647174661519323, 'spread_hl_frac': 0.012496007455560391, 'bb_std_mult': 3.4191638344882618, 'rsi_os': 26, 'rsi_ob': 57, 'vol_spike': 0.14394006625413888, 'adx_thresh': 26.400832322401396, 'atr_min_pct': 0.016470316707074627, 'atr_max_pct': 0.13496769556151741, 'tp_mult': 1.1471371324458899, 'tsl_mult': 0.47832398175098817, 'strategy': 'mean_reversion', 'time_stop': 242, 'use_sma': False, 'use_atr': True, 'use_adx': True, 'use_ema': True, 'use_spike': False, 'rsi_required': True, 'edge_k': 1.9106305750798274, 'edge_cap': 0.659228604715016, 'bull_strategy': 'mean_reversion', 'bull_bb_std_mult': 1.9742808350657732, 'bull_rsi_os': 13, 'bull_rsi_ob': 93, 'bull_adx_thresh': 9.330389541329993, 'bull_atr_min_pct': 0.010593605680139012, 'bull_atr_max_pct': 0.07501198923355236, 'bull_tp_mult': 2.3102177933423116, 'bull_tsl_mult': 0.6767981780172522, 'bull_time_stop': 166, 'bull_use_sma': True, 'bull_use_ema': False, 'bull_use_atr': False, 'bull_use_adx': True, 'bull_use_spike': True, 'bull_rsi_required': False, 'bear_strategy': 'breakout', 'bear_bb_std_mult': 3.1548932853772818, 'bear_rsi_os': 26, 'bear_rsi_ob': 54, 'bear_adx_thresh': 30.212150395736053, 'bear_atr_min_pct': 0.003916910495940616, 'bear_atr_max_pct': 0.08285538809312083, 'bear_tp_mult': 2.8180611304822407, 'bear_tsl_mult': 0.16969961513803095, 'bear_time_stop': 108, 'bear_use_sma': False, 'bear_use_ema': True, 'bear_use_atr': True, 'bear_use_adx': True, 'bear_use_spike': True, 'bear_rsi_required': False, 'sideways_strategy': 'mean_reversion', 'sideways_bb_std_mult': 0.599972316990553, 'sideways_rsi_os': 41, 'sideways_rsi_ob': 59, 'sideways_adx_thresh': 8.157819801295632, 'sideways_atr_min_pct': 0.015908909269585558, 'sideways_atr_max_pct': 0.03794160729685522, 'sideways_tp_mult': 2.553705700747207, 'sideways_tsl_mult': 0.4933368510836647, 'sideways_time_stop': 18, 'sideways_use_sma': False, 'sideways_use_ema': False, 'sideways_use_atr': False, 'sideways_use_adx': True, 'sideways_use_spike': True, 'sideways_rsi_required': False}.
[I 2025-09-01 08:50:17,984] Trial 550 finished with values: [-1000000000.0, 1000000000.0] and parameters: {'p_sma': 17, 'p_std': 13, 'p_atr': 10, 'p_adx': 11, 'rsi_period': 84, 'ema1': 9, 'ema2': 13, 'slip_atr_k': 0.0764007341883708, 'slip_spread_k': 0.5876261663579508, 'spread_hl_frac': 0.007237071967206254, 'bb_std_mult': 3.5566583163625416, 'rsi_os': 23, 'rsi_ob': 60, 'vol_spike': 0.10664380243985416, 'adx_thresh': 25.009594173251152, 'atr_min_pct': 0.005670519084181079, 'atr_max_pct': 0.14250587771265588, 'tp_mult': 1.303579877877089, 'tsl_mult': 0.4774107804016107, 'strategy': 'breakout', 'time_stop': 124, 'use_sma': True, 'use_atr': True, 'use_adx': True, 'use_ema': True, 'use_spike': True, 'rsi_required': True, 'edge_k': 1.2351814138242303, 'edge_cap': 0.0727041366273711, 'bull_strategy': 'breakout', 'bull_bb_std_mult': 2.5305352591772694, 'bull_rsi_os': 12, 'bull_rsi_ob': 86, 'bull_adx_thresh': 11.1576281405843, 'bull_atr_min_pct': 0.011957824097325875, 'bull_atr_max_pct': 0.04780554858231702, 'bull_tp_mult': 1.6619554747236487, 'bull_tsl_mult': 0.1694640611463184, 'bull_time_stop': 166, 'bull_use_sma': True, 'bull_use_ema': False, 'bull_use_atr': True, 'bull_use_adx': True, 'bull_use_spike': False, 'bull_rsi_required': True, 'bear_strategy': 'mean_reversion', 'bear_bb_std_mult': 3.227404368116135, 'bear_rsi_os': 24, 'bear_rsi_ob': 92, 'bear_adx_thresh': 31.61085762609998, 'bear_atr_min_pct': 0.02902781908765068, 'bear_atr_max_pct': 0.05772684131881203, 'bear_tp_mult': 2.8032916042874714, 'bear_tsl_mult': 0.11751547673074847, 'bear_time_stop': 83, 'bear_use_sma': False, 'bear_use_ema': False, 'bear_use_atr': True, 'bear_use_adx': True, 'bear_use_spike': False, 'bear_rsi_required': False, 'sideways_strategy': 'mean_reversion', 'sideways_bb_std_mult': 2.7218545749724052, 'sideways_rsi_os': 37, 'sideways_rsi_ob': 58, 'sideways_adx_thresh': 8.726303715179176, 'sideways_atr_min_pct': 0.007526944871578632, 'sideways_atr_max_pct': 0.03812584622109697, 'sideways_tp_mult': 2.2922124873439125, 'sideways_tsl_mult': 0.8635841745419146, 'sideways_time_stop': 177, 'sideways_use_sma': False, 'sideways_use_ema': False, 'sideways_use_atr': False, 'sideways_use_adx': True, 'sideways_use_spike': True, 'sideways_rsi_required': False}.
