[I 2025-09-01 07:28:31,650] Trial 54 finished with values: [-1000000000.0, 1000000000.0] and parameters: {'p_sma': 16, 'p_std': 17, 'p_atr': 12, 'p_adx': 30, 'rsi_period': 75, 'ema1': 12, 'ema2': 24, 'slip_atr_k': 0.05541463527092432, 'slip_spread_k': 0.7541121003459532, 'spread_hl_frac': 0.042047566057886364, 'bb_std_mult': 1.9592989070427338, 'rsi_os': 9, 'rsi_ob': 56, 'vol_spike': 0.12409597515119705, 'adx_thresh': 24.90282687083076, 'atr_min_pct': 0.0025614999206989286, 'atr_max_pct': 0.08698499641995708, 'tp_mult': 1.445683656317771, 'tsl_mult': 0.13551857507442605, 'strategy': 'mean_reversion', 'time_stop': 159, 'use_sma': True, 'use_atr': False, 'use_adx': True, 'use_ema': True, 'use_spike': True, 'rsi_required': True, 'edge_k': 0.7514493297597542, 'edge_cap': 0.8111720047725408, 'bull_strategy': 'breakout', 'bull_bb_std_mult': 2.2464322960331087, 'bull_rsi_os': 5, 'bull_rsi_ob': 81, 'bull_adx_thresh': 14.184219799897498, 'bull_atr_min_pct': 0.01427488071450681, 'bull_atr_max_pct': 0.06372171254168901, 'bull_tp_mult': 2.118643536895409, 'bull_tsl_mult': 0.4995013445723558, 'bull_time_stop': 106, 'bull_use_sma': True, 'bull_use_ema': True, 'bull_use_atr': False, 'bull_use_adx': False, 'bull_use_spike': True, 'bull_rsi_required': False, 'bear_strategy': 'breakout', 'bear_bb_std_mult': 2.2129414519434576, 'bear_rsi_os': 39, 'bear_rsi_ob': 48, 'bear_adx_thresh': 32.86200905276809, 'bear_atr_min_pct': 0.01637747277226926, 'bear_atr_max_pct': 0.04539100039763144, 'bear_tp_mult': 2.7494342792400928, 'bear_tsl_mult': 0.31403596744370765, 'bear_time_stop': 300, 'bear_use_sma': True, 'bear_use_ema': True, 'bear_use_atr': False, 'bear_use_adx': False, 'bear_use_spike': True, 'bear_rsi_required': False, 'sideways_strategy': 'mean_reversion', 'sideways_bb_std_mult': 3.185694780790789, 'sideways_rsi_os': 29, 'sideways_rsi_ob': 77, 'sideways_adx_thresh': 16.437784761547256, 'sideways_atr_min_pct': 0.02618813749789337, 'sideways_atr_max_pct': 0.04265663926952604, 'sideways_tp_mult': 2.328261696713163, 'sideways_tsl_mult': 0.3632554911398474, 'sideways_time_stop': 139, 'sideways_use_sma': True, 'sideways_use_ema': False, 'sideways_use_atr': False, 'sideways_use_adx': True, 'sideways_use_spike': False, 'sideways_rsi_required': True}.
[I 2025-09-01 07:28:34,755] Trial 56 finished with values: [-1000000000.0, 1000000000.0] and parameters: {'p_sma': 28, 'p_std': 15, 'p_atr': 7, 'p_adx': 19, 'rsi_period': 48, 'ema1': 15, 'ema2': 55, 'slip_atr_k': 0.05068313560682249, 'slip_spread_k': 0.7686807460334041, 'spread_hl_frac': 0.04105240014279066, 'bb_std_mult': 2.597868888695196, 'rsi_os': 10, 'rsi_ob': 59, 'vol_spike': 0.1903743405138723, 'adx_thresh': 21.054517331947164, 'atr_min_pct': 0.0026460719436691947, 'atr_max_pct': 0.07005448054702765, 'tp_mult': 1.4475012312451772, 'tsl_mult': 0.3337470754818813, 'strategy': 'mean_reversion', 'time_stop': 181, 'use_sma': True, 'use_atr': False, 'use_adx': True, 'use_ema': True, 'use_spike': True, 'rsi_required': True, 'edge_k': 0.7038541844967556, 'edge_cap': 0.8101588473202966, 'bull_strategy': 'breakout', 'bull_bb_std_mult': 1.6670660991272153, 'bull_rsi_os': 9, 'bull_rsi_ob': 78, 'bull_adx_thresh': 14.58544265825342, 'bull_atr_min_pct': 0.014465674458551495, 'bull_atr_max_pct': 0.020120151935939294, 'bull_tp_mult': 1.212467486790459, 'bull_tsl_mult': 0.5510202716426138, 'bull_time_stop': 105, 'bull_use_sma': True, 'bull_use_ema': True, 'bull_use_atr': False, 'bull_use_adx': False, 'bull_use_spike': True, 'bull_rsi_required': False, 'bear_strategy': 'breakout', 'bear_bb_std_mult': 1.5756261223048993, 'bear_rsi_os': 22, 'bear_rsi_ob': 47, 'bear_adx_thresh': 32.026578599681535, 'bear_atr_min_pct': 0.02123413767186156, 'bear_atr_max_pct': 0.14260114338854088, 'bear_tp_mult': 2.7243183035614216, 'bear_tsl_mult': 0.24754925358689941, 'bear_time_stop': 278, 'bear_use_sma': True, 'bear_use_ema': True, 'bear_use_atr': False, 'bear_use_adx': False, 'bear_use_spike': True, 'bear_rsi_required': False, 'sideways_strategy': 'mean_reversion', 'sideways_bb_std_mult': 2.20407541698244, 'sideways_rsi_os': 21, 'sideways_rsi_ob': 52, 'sideways_adx_thresh': 22.2647421170421, 'sideways_atr_min_pct': 0.024170092122090953, 'sideways_atr_max_pct': 0.04649276082092868, 'sideways_tp_mult': 2.31773182829716, 'sideways_tsl_mult': 0.09963648512940426, 'sideways_time_stop': 143, 'sideways_use_sma': True, 'sideways_use_ema': False, 'sideways_use_atr': False, 'sideways_use_adx': False, 'sideways_use_spike': True, 'sideways_rsi_required': True}.
[I 2025-09-01 07:28:35,846] Trial 55 finished with values: [-1000000000.0, 1000000000.0] and parameters: {'p_sma': 14, 'p_std': 17, 'p_atr': 7, 'p_adx': 30, 'rsi_period': 63, 'ema1': 12, 'ema2': 26, 'slip_atr_k': 0.05123343093883037, 'slip_spread_k': 0.4721419421389321, 'spread_hl_frac': 0.041652153200601096, 'bb_std_mult': 2.5739462619124795, 'rsi_os': 10, 'rsi_ob': 59, 'vol_spike': 0.12167379936185807, 'adx_thresh': 21.377148720309005, 'atr_min_pct': 0.010385199478462039, 'atr_max_pct': 0.0683209629288654, 'tp_mult': 1.443289680490584, 'tsl_mult': 0.45426746003951485, 'strategy': 'mean_reversion', 'time_stop': 181, 'use_sma': True, 'use_atr': False, 'use_adx': True, 'use_ema': True, 'use_spike': True, 'rsi_required': True, 'edge_k': 0.743676179277849, 'edge_cap': 0.8162927184701236, 'bull_strategy': 'breakout', 'bull_bb_std_mult': 3.19290136467839, 'bull_rsi_os': 8, 'bull_rsi_ob': 82, 'bull_adx_thresh': 14.323114919366212, 'bull_atr_min_pct': 0.014345413180468718, 'bull_atr_max_pct': 0.06343925284949782, 'bull_tp_mult': 2.053419428691776, 'bull_tsl_mult': 0.5616515530041987, 'bull_time_stop': 104, 'bull_use_sma': True, 'bull_use_ema': True, 'bull_use_atr': False, 'bull_use_adx': False, 'bull_use_spike': True, 'bull_rsi_required': False, 'bear_strategy': 'mean_reversion', 'bear_bb_std_mult': 1.6469757769174718, 'bear_rsi_os': 9, 'bear_rsi_ob': 47, 'bear_adx_thresh': 32.78609290101255, 'bear_atr_min_pct': 0.021540129418615085, 'bear_atr_max_pct': 0.044573199188330054, 'bear_tp_mult': 2.724780562974382, 'bear_tsl_mult': 0.2329966305585537, 'bear_time_stop': 236, 'bear_use_sma': True, 'bear_use_ema': True, 'bear_use_atr': False, 'bear_use_adx': False, 'bear_use_spike': True, 'bear_rsi_required': False, 'sideways_strategy': 'mean_reversion', 'sideways_bb_std_mult': 1.4586855958811848, 'sideways_rsi_os': 29, 'sideways_rsi_ob': 57, 'sideways_adx_thresh': 22.75325461117126, 'sideways_atr_min_pct': 0.026008155890342874, 'sideways_atr_max_pct': 0.04183293632402788, 'sideways_tp_mult': 1.9439014263871384, 'sideways_tsl_mult': 0.37973380151377023, 'sideways_time_stop': 159, 'sideways_use_sma': True, 'sideways_use_ema': False, 'sideways_use_atr': False, 'sideways_use_adx': True, 'sideways_use_spike': True, 'sideways_rsi_required': True}.
[I 2025-09-01 07:28:36,623] Trial 59 finished with values: [-1000000000.0, 1000000000.0] and parameters: {'p_sma': 57, 'p_std': 8, 'p_atr': 15, 'p_adx': 22, 'rsi_period': 71, 'ema1': 16, 'ema2': 13, 'slip_atr_k': 0.041429627324902435, 'slip_spread_k': 0.6642665601312963, 'spread_hl_frac': 0.03781273042945506, 'bb_std_mult': 1.8052146474722641, 'rsi_os': 32, 'rsi_ob': 47, 'vol_spike': 0.14320017113915937, 'adx_thresh': 15.772499855488148, 'atr_min_pct': 0.010286507965994035, 'atr_max_pct': 0.13015748355385093, 'tp_mult': 1.2667198231560208, 'tsl_mult': 0.4307801665416515, 'strategy': 'mean_reversion', 'time_stop': 126, 'use_sma': True, 'use_atr': False, 'use_adx': True, 'use_ema': True, 'use_spike': False, 'rsi_required': True, 'edge_k': 1.0947587155510716, 'edge_cap': 0.9500010109248911, 'bull_strategy': 'mean_reversion', 'bull_bb_std_mult': 3.2647927651474857, 'bull_rsi_os': 52, 'bull_rsi_ob': 84, 'bull_adx_thresh': 20.273446158262164, 'bull_atr_min_pct': 0.02999121573255511, 'bull_atr_max_pct': 0.07179495432549424, 'bull_tp_mult': 2.4084602021483814, 'bull_tsl_mult': 0.3997414032074603, 'bull_time_stop': 208, 'bull_use_sma': True, 'bull_use_ema': True, 'bull_use_atr': False, 'bull_use_adx': False, 'bull_use_spike': True, 'bull_rsi_required': False, 'bear_strategy': 'breakout', 'bear_bb_std_mult': 1.9272223358054414, 'bear_rsi_os': 16, 'bear_rsi_ob': 91, 'bear_adx_thresh': 15.902649605466019, 'bear_atr_min_pct': 0.02716841786552026, 'bear_atr_max_pct': 0.06156116003526803, 'bear_tp_mult': 2.5395268434584666, 'bear_tsl_mult': 0.7853592804911025, 'bear_time_stop': 23, 'bear_use_sma': True, 'bear_use_ema': True, 'bear_use_atr': False, 'bear_use_adx': False, 'bear_use_spike': True, 'bear_rsi_required': True, 'sideways_strategy': 'mean_reversion', 'sideways_bb_std_mult': 0.8835364205296814, 'sideways_rsi_os': 25, 'sideways_rsi_ob': 58, 'sideways_adx_thresh': 25.845835181883967, 'sideways_atr_min_pct': 0.02253182674491331, 'sideways_atr_max_pct': 0.058962543733608486, 'sideways_tp_mult': 1.8221046329957988, 'sideways_tsl_mult': 0.6167867021377128, 'sideways_time_stop': 112, 'sideways_use_sma': True, 'sideways_use_ema': False, 'sideways_use_atr': False, 'sideways_use_adx': False, 'sideways_use_spike': True, 'sideways_rsi_required': True}.
[I 2025-09-01 07:29:07,300] Trial 57 finished with values: [-1000000000.0, 1000000000.0] and parameters: {'p_sma': 29, 'p_std': 22, 'p_atr': 14, 'p_adx': 19, 'rsi_period': 47, 'ema1': 10, 'ema2': 56, 'slip_atr_k': 0.040070999669027725, 'slip_spread_k': 0.7784961206372166, 'spread_hl_frac': 0.037880868045717546, 'bb_std_mult': 2.547536041044598, 'rsi_os': 23, 'rsi_ob': 59, 'vol_spike': 0.137387883707223, 'adx_thresh': 24.505344061213055, 'atr_min_pct': 0.01036035104444049, 'atr_max_pct': 0.06802303140979155, 'tp_mult': 1.2711387587121956, 'tsl_mult': 0.32150436109838193, 'strategy': 'mean_reversion', 'time_stop': 181, 'use_sma': True, 'use_atr': False, 'use_adx': True, 'use_ema': True, 'use_spike': True, 'rsi_required': True, 'edge_k': 0.7453151633395629, 'edge_cap': 0.8135105941743191, 'bull_strategy': 'mean_reversion', 'bull_bb_std_mult': 1.6830086986433672, 'bull_rsi_os': 51, 'bull_rsi_ob': 82, 'bull_adx_thresh': 14.305388088051487, 'bull_atr_min_pct': 0.016590438522924595, 'bull_atr_max_pct': 0.048677432626920786, 'bull_tp_mult': 2.408152828161629, 'bull_tsl_mult': 0.6849607742150334, 'bull_time_stop': 235, 'bull_use_sma': True, 'bull_use_ema': True, 'bull_use_atr': False, 'bull_use_adx': False, 'bull_use_spike': True, 'bull_rsi_required': False, 'bear_strategy': 'breakout', 'bear_bb_std_mult': 1.6728370563728867, 'bear_rsi_os': 9, 'bear_rsi_ob': 47, 'bear_adx_thresh': 11.580576472214053, 'bear_atr_min_pct': 0.027557196070623593, 'bear_atr_max_pct': 0.06173689196408433, 'bear_tp_mult': 2.7507023839703457, 'bear_tsl_mult': 0.7578453727651335, 'bear_time_stop': 277, 'bear_use_sma': True, 'bear_use_ema': True, 'bear_use_atr': False, 'bear_use_adx': False, 'bear_use_spike': True, 'bear_rsi_required': False, 'sideways_strategy': 'mean_reversion', 'sideways_bb_std_mult': 2.684826071703128, 'sideways_rsi_os': 24, 'sideways_rsi_ob': 58, 'sideways_adx_thresh': 22.55059273041762, 'sideways_atr_min_pct': 0.023500152322471834, 'sideways_atr_max_pct': 0.05781167256943303, 'sideways_tp_mult': 1.8301286439201432, 'sideways_tsl_mult': 0.02408822197669097, 'sideways_time_stop': 135, 'sideways_use_sma': True, 'sideways_use_ema': False, 'sideways_use_atr': False, 'sideways_use_adx': False, 'sideways_use_spike': True, 'sideways_rsi_required': True}.
[I 2025-09-01 07:29:26,746] Trial 58 finished with values: [-1000000000.0, 1000000000.0] and parameters: {'p_sma': 28, 'p_std': 8, 'p_atr': 7, 'p_adx': 19, 'rsi_period': 46, 'ema1': 16, 'ema2': 13, 'slip_atr_k': 0.08008281408131618, 'slip_spread_k': 0.6839780261543082, 'spread_hl_frac': 0.038236002770687394, 'bb_std_mult': 1.801543651143558, 'rsi_os': 23, 'rsi_ob': 59, 'vol_spike': 0.18943615194261476, 'adx_thresh': 20.397947288171796, 'atr_min_pct': 0.009521757439162557, 'atr_max_pct': 0.1326770439208204, 'tp_mult': 1.3030827676708467, 'tsl_mult': 0.3358443016238336, 'strategy': 'mean_reversion', 'time_stop': 185, 'use_sma': True, 'use_atr': False, 'use_adx': True, 'use_ema': True, 'use_spike': False, 'rsi_required': True, 'edge_k': 1.4769840376718415, 'edge_cap': 0.6935988932889678, 'bull_strategy': 'mean_reversion', 'bull_bb_std_mult': 3.15853564914082, 'bull_rsi_os': 9, 'bull_rsi_ob': 78, 'bull_adx_thresh': 15.43013677819824, 'bull_atr_min_pct': 0.010740189039389664, 'bull_atr_max_pct': 0.04762876913462215, 'bull_tp_mult': 1.1783058576431553, 'bull_tsl_mult': 0.6586178312394277, 'bull_time_stop': 210, 'bull_use_sma': True, 'bull_use_ema': True, 'bull_use_atr': False, 'bull_use_adx': False, 'bull_use_spike': True, 'bull_rsi_required': False, 'bear_strategy': 'breakout', 'bear_bb_std_mult': 2.423357028048802, 'bear_rsi_os': 17, 'bear_rsi_ob': 56, 'bear_adx_thresh': 11.600854946030985, 'bear_atr_min_pct': 0.0267290132387849, 'bear_atr_max_pct': 0.14168627274794582, 'bear_tp_mult': 2.6805543090329835, 'bear_tsl_mult': 0.23216911414175018, 'bear_time_stop': 238, 'bear_use_sma': True, 'bear_use_ema': True, 'bear_use_atr': False, 'bear_use_adx': False, 'bear_use_spike': True, 'bear_rsi_required': True, 'sideways_strategy': 'mean_reversion', 'sideways_bb_std_mult': 2.2245547346801335, 'sideways_rsi_os': 24, 'sideways_rsi_ob': 94, 'sideways_adx_thresh': 25.686254613712087, 'sideways_atr_min_pct': 0.023567252044552074, 'sideways_atr_max_pct': 0.05632298208160667, 'sideways_tp_mult': 1.9514167642280125, 'sideways_tsl_mult': 0.13372975742748439, 'sideways_time_stop': 200, 'sideways_use_sma': True, 'sideways_use_ema': False, 'sideways_use_atr': False, 'sideways_use_adx': False, 'sideways_use_spike': True, 'sideways_rsi_required': True}.
[I 2025-09-01 07:29:27,676] Trial 61 finished with values: [-1000000000.0, 1000000000.0] and parameters: {'p_sma': 22, 'p_std': 24, 'p_atr': 10, 'p_adx': 20, 'rsi_period': 79, 'ema1': 10, 'ema2': 60, 'slip_atr_k': 0.0001772570755755598, 'slip_spread_k': 0.5569825497266244, 'spread_hl_frac': 0.04418556658129102, 'bb_std_mult': 2.1778845588910984, 'rsi_os': 39, 'rsi_ob': 53, 'vol_spike': 0.25019484942824594, 'adx_thresh': 19.2216314100535, 'atr_min_pct': 0.00013280411711406176, 'atr_max_pct': 0.04106033167811755, 'tp_mult': 1.127194454832086, 'tsl_mult': 0.9129283407626462, 'strategy': 'mean_reversion', 'time_stop': 242, 'use_sma': True, 'use_atr': False, 'use_adx': True, 'use_ema': True, 'use_spike': False, 'rsi_required': True, 'edge_k': 1.482480374028139, 'edge_cap': 0.5992044108447986, 'bull_strategy': 'mean_reversion', 'bull_bb_std_mult': 1.9212516785382745, 'bull_rsi_os': 47, 'bull_rsi_ob': 77, 'bull_adx_thresh': 31.996363755075322, 'bull_atr_min_pct': 0.005068383763675699, 'bull_atr_max_pct': 0.09604340271844303, 'bull_tp_mult': 1.919040452254454, 'bull_tsl_mult': 0.6764571577523101, 'bull_time_stop': 170, 'bull_use_sma': True, 'bull_use_ema': True, 'bull_use_atr': False, 'bull_use_adx': False, 'bull_use_spike': True, 'bull_rsi_required': False, 'bear_strategy': 'breakout', 'bear_bb_std_mult': 2.4455745579697172, 'bear_rsi_os': 42, 'bear_rsi_ob': 57, 'bear_adx_thresh': 29.48565143674279, 'bear_atr_min_pct': 0.012572643486779488, 'bear_atr_max_pct': 0.1176272290936487, 'bear_tp_mult': 1.8553347499705473, 'bear_tsl_mult': 0.6293180258021055, 'bear_time_stop': 274, 'bear_use_sma': True, 'bear_use_ema': True, 'bear_use_atr': False, 'bear_use_adx': False, 'bear_use_spike': True, 'bear_rsi_required': True, 'sideways_strategy': 'mean_reversion', 'sideways_bb_std_mult': 1.9301033134347056, 'sideways_rsi_os': 40, 'sideways_rsi_ob': 62, 'sideways_adx_thresh': 11.377367923795179, 'sideways_atr_min_pct': 0.027421572449149837, 'sideways_atr_max_pct': 0.032387347639735636, 'sideways_tp_mult': 2.1561742451131196, 'sideways_tsl_mult': 0.018213733760182205, 'sideways_time_stop': 201, 'sideways_use_sma': True, 'sideways_use_ema': False, 'sideways_use_atr': False, 'sideways_use_adx': True, 'sideways_use_spike': True, 'sideways_rsi_required': True}.
[I 2025-09-01 07:29:28,885] Trial 60 finished with values: [-1000000000.0, 0.47777066245366945] and parameters: {'p_sma': 33, 'p_std': 23, 'p_atr': 14, 'p_adx': 22, 'rsi_period': 59, 'ema1': 16, 'ema2': 10, 'slip_atr_k': 0.07958019244695648, 'slip_spread_k': 0.6634197137745119, 'spread_hl_frac': 0.038442040293113065, 'bb_std_mult': 1.7724924937902404, 'rsi_os': 22, 'rsi_ob': 53, 'vol_spike': 0.14044318873330514, 'adx_thresh': 26.20159855500458, 'atr_min_pct': 0.024158014278043535, 'atr_max_pct': 0.131526370512009, 'tp_mult': 1.2994792368707444, 'tsl_mult': 0.5960907515960895, 'strategy': 'mean_reversion', 'time_stop': 128, 'use_sma': True, 'use_atr': False, 'use_adx': True, 'use_ema': True, 'use_spike': False, 'rsi_required': True, 'edge_k': 1.5029982233744983, 'edge_cap': 0.7694115661282807, 'bull_strategy': 'mean_reversion', 'bull_bb_std_mult': 1.8826906876764047, 'bull_rsi_os': 52, 'bull_rsi_ob': 84, 'bull_adx_thresh': 20.50403778138281, 'bull_atr_min_pct': 0.029597591391824055, 'bull_atr_max_pct': 0.04774371954394673, 'bull_tp_mult': 1.8702485824269537, 'bull_tsl_mult': 0.6820961261241238, 'bull_time_stop': 209, 'bull_use_sma': True, 'bull_use_ema': True, 'bull_use_atr': False, 'bull_use_adx': False, 'bull_use_spike': True, 'bull_rsi_required': False, 'bear_strategy': 'breakout', 'bear_bb_std_mult': 2.4282342507266326, 'bear_rsi_os': 16, 'bear_rsi_ob': 56, 'bear_adx_thresh': 29.374723282504473, 'bear_atr_min_pct': 0.019042172028917122, 'bear_atr_max_pct': 0.0929558617612486, 'bear_tp_mult': 2.5491402081772083, 'bear_tsl_mult': 0.6176168688577621, 'bear_time_stop': 25, 'bear_use_sma': True, 'bear_use_ema': True, 'bear_use_atr': False, 'bear_use_adx': False, 'bear_use_spike': True, 'bear_rsi_required': True, 'sideways_strategy': 'mean_reversion', 'sideways_bb_std_mult': 2.631482312456699, 'sideways_rsi_os': 25, 'sideways_rsi_ob': 58, 'sideways_adx_thresh': 11.146653589415159, 'sideways_atr_min_pct': 0.0004328606581365862, 'sideways_atr_max_pct': 0.05682045980222403, 'sideways_tp_mult': 2.6673463445648005, 'sideways_tsl_mult': 0.13339799762677534, 'sideways_time_stop': 196, 'sideways_use_sma': True, 'sideways_use_ema': False, 'sideways_use_atr': False, 'sideways_use_adx': False, 'sideways_use_spike': True, 'sideways_rsi_required': True}.
[I 2025-09-01 07:29:59,472] Trial 62 finished with values: [-1000000000.0, 1000000000.0] and parameters: {'p_sma': 20, 'p_std': 30, 'p_atr': 9, 'p_adx': 20, 'rsi_period': 80, 'ema1': 27, 'ema2': 60, 'slip_atr_k': 0.004897607456331159, 'slip_spread_k': 0.5558032446136758, 'spread_hl_frac': 0.04406419128613341, 'bb_std_mult': 1.546939535954801, 'rsi_os': 39, 'rsi_ob': 95, 'vol_spike': 0.24659507034989583, 'adx_thresh': 26.91521621414638, 'atr_min_pct': 0.023254489712561135, 'atr_max_pct': 0.035992139002309215, 'tp_mult': 2.5999448749929375, 'tsl_mult': 0.07492179815562451, 'strategy': 'mean_reversion', 'time_stop': 252, 'use_sma': True, 'use_atr': False, 'use_adx': True, 'use_ema': True, 'use_spike': False, 'rsi_required': True, 'edge_k': 1.2850963219485712, 'edge_cap': 0.11256422220867462, 'bull_strategy': 'breakout', 'bull_bb_std_mult': 1.9037414559400714, 'bull_rsi_os': 46, 'bull_rsi_ob': 49, 'bull_adx_thresh': 11.428757811960997, 'bull_atr_min_pct': 0.005098572136953141, 'bull_atr_max_pct': 0.0959278380488059, 'bull_tp_mult': 1.8796313443776265, 'bull_tsl_mult': 0.6230670001582589, 'bull_time_stop': 171, 'bull_use_sma': True, 'bull_use_ema': True, 'bull_use_atr': False, 'bull_use_adx': False, 'bull_use_spike': True, 'bull_rsi_required': False, 'bear_strategy': 'breakout', 'bear_bb_std_mult': 2.4394193726041835, 'bear_rsi_os': 50, 'bear_rsi_ob': 58, 'bear_adx_thresh': 29.704376097355464, 'bear_atr_min_pct': 0.013124649678174657, 'bear_atr_max_pct': 0.07250203626492564, 'bear_tp_mult': 1.8749882890840204, 'bear_tsl_mult': 0.40687048356362665, 'bear_time_stop': 98, 'bear_use_sma': True, 'bear_use_ema': False, 'bear_use_atr': True, 'bear_use_adx': False, 'bear_use_spike': True, 'bear_rsi_required': True, 'sideways_strategy': 'mean_reversion', 'sideways_bb_std_mult': 1.9821731555113429, 'sideways_rsi_os': 18, 'sideways_rsi_ob': 95, 'sideways_adx_thresh': 8.449765990285922, 'sideways_atr_min_pct': 0.0006756978655124727, 'sideways_atr_max_pct': 0.08114591686942843, 'sideways_tp_mult': 2.1486187015733615, 'sideways_tsl_mult': 0.4437736771467862, 'sideways_time_stop': 201, 'sideways_use_sma': True, 'sideways_use_ema': False, 'sideways_use_atr': False, 'sideways_use_adx': True, 'sideways_use_spike': True, 'sideways_rsi_required': False}.
