[I 2025-09-01 08:14:40,652] Trial 333 finished with values: [-1000000000.0, 1000000000.0] and parameters: {'p_sma': 8, 'p_std': 14, 'p_atr': 12, 'p_adx': 18, 'rsi_period': 26, 'ema1': 7, 'ema2': 15, 'slip_atr_k': 0.2084708653036562, 'slip_spread_k': 0.5928039909488847, 'spread_hl_frac': 0.02195173857155114, 'bb_std_mult': 0.6538009439384567, 'rsi_os': 24, 'rsi_ob': 86, 'vol_spike': 0.2564325843812486, 'adx_thresh': 24.984685608294534, 'atr_min_pct': 0.012775155566628336, 'atr_max_pct': 0.13953321478006564, 'tp_mult': 1.1601665717216303, 'tsl_mult': 0.6180133342059455, 'strategy': 'mean_reversion', 'time_stop': 69, 'use_sma': False, 'use_atr': False, 'use_adx': False, 'use_ema': True, 'use_spike': True, 'rsi_required': False, 'edge_k': 0.6428636271482501, 'edge_cap': 0.08258497434774768, 'bull_strategy': 'mean_reversion', 'bull_bb_std_mult': 2.809097484711948, 'bull_rsi_os': 43, 'bull_rsi_ob': 69, 'bull_adx_thresh': 8.337522549624719, 'bull_atr_min_pct': 0.005087686381883475, 'bull_atr_max_pct': 0.05286652888873425, 'bull_tp_mult': 1.065613180350053, 'bull_tsl_mult': 0.696835939464524, 'bull_time_stop': 133, 'bull_use_sma': True, 'bull_use_ema': True, 'bull_use_atr': True, 'bull_use_adx': True, 'bull_use_spike': False, 'bull_rsi_required': True, 'bear_strategy': 'mean_reversion', 'bear_bb_std_mult': 2.595452073551668, 'bear_rsi_os': 48, 'bear_rsi_ob': 56, 'bear_adx_thresh': 31.048014988820725, 'bear_atr_min_pct': 0.00814117344728749, 'bear_atr_max_pct': 0.09070020070392473, 'bear_tp_mult': 2.7786531563711967, 'bear_tsl_mult': 0.04326918080170882, 'bear_time_stop': 81, 'bear_use_sma': False, 'bear_use_ema': False, 'bear_use_atr': True, 'bear_use_adx': True, 'bear_use_spike': True, 'bear_rsi_required': False, 'sideways_strategy': 'mean_reversion', 'sideways_bb_std_mult': 2.0746042410121746, 'sideways_rsi_os': 39, 'sideways_rsi_ob': 68, 'sideways_adx_thresh': 22.66996694627643, 'sideways_atr_min_pct': 0.013591583819074927, 'sideways_atr_max_pct': 0.10951075690498649, 'sideways_tp_mult': 2.1967642235180778, 'sideways_tsl_mult': 0.021261798801091747, 'sideways_time_stop': 122, 'sideways_use_sma': False, 'sideways_use_ema': False, 'sideways_use_atr': False, 'sideways_use_adx': True, 'sideways_use_spike': True, 'sideways_rsi_required': False}.
[I 2025-09-01 08:14:41,125] Trial 331 finished with values: [-0.046345049252568216, 0.046648513615086505] and parameters: {'p_sma': 22, 'p_std': 14, 'p_atr': 19, 'p_adx': 9, 'rsi_period': 64, 'ema1': 10, 'ema2': 12, 'slip_atr_k': 0.1906482272021528, 'slip_spread_k': 0.880193584240715, 'spread_hl_frac': 0.019331051527002218, 'bb_std_mult': 3.1584273240431546, 'rsi_os': 25, 'rsi_ob': 55, 'vol_spike': 0.20429002782127614, 'adx_thresh': 27.754170568610398, 'atr_min_pct': 0.02153905537829726, 'atr_max_pct': 0.03913370435511347, 'tp_mult': 2.0210622464949886, 'tsl_mult': 0.5554638293959075, 'strategy': 'mean_reversion', 'time_stop': 68, 'use_sma': True, 'use_atr': True, 'use_adx': True, 'use_ema': True, 'use_spike': True, 'rsi_required': True, 'edge_k': 1.7775934392650012, 'edge_cap': 0.1750452867276278, 'bull_strategy': 'breakout', 'bull_bb_std_mult': 1.2227836250521804, 'bull_rsi_os': 12, 'bull_rsi_ob': 47, 'bull_adx_thresh': 9.102681760172636, 'bull_atr_min_pct': 0.00368494111629898, 'bull_atr_max_pct': 0.11931027887149681, 'bull_tp_mult': 2.0695554048407327, 'bull_tsl_mult': 0.6995668417840876, 'bull_time_stop': 154, 'bull_use_sma': True, 'bull_use_ema': False, 'bull_use_atr': False, 'bull_use_adx': True, 'bull_use_spike': True, 'bull_rsi_required': True, 'bear_strategy': 'mean_reversion', 'bear_bb_std_mult': 3.0237981107693677, 'bear_rsi_os': 11, 'bear_rsi_ob': 94, 'bear_adx_thresh': 20.947393310282102, 'bear_atr_min_pct': 0.026226472437455347, 'bear_atr_max_pct': 0.03703079013327401, 'bear_tp_mult': 2.842726572887671, 'bear_tsl_mult': 0.7414757573094731, 'bear_time_stop': 80, 'bear_use_sma': False, 'bear_use_ema': False, 'bear_use_atr': True, 'bear_use_adx': True, 'bear_use_spike': True, 'bear_rsi_required': False, 'sideways_strategy': 'mean_reversion', 'sideways_bb_std_mult': 3.3103431114122968, 'sideways_rsi_os': 40, 'sideways_rsi_ob': 68, 'sideways_adx_thresh': 15.324101068793597, 'sideways_atr_min_pct': 0.022305343298966617, 'sideways_atr_max_pct': 0.028779306159841707, 'sideways_tp_mult': 1.9671942797438522, 'sideways_tsl_mult': 0.23760973053343865, 'sideways_time_stop': 186, 'sideways_use_sma': False, 'sideways_use_ema': False, 'sideways_use_atr': False, 'sideways_use_adx': True, 'sideways_use_spike': True, 'sideways_rsi_required': False}.
[I 2025-09-01 08:15:27,401] Trial 338 finished with values: [-1000000000.0, 1000000000.0] and parameters: {'p_sma': 17, 'p_std': 15, 'p_atr': 11, 'p_adx': 22, 'rsi_period': 60, 'ema1': 15, 'ema2': 37, 'slip_atr_k': 0.05867927625930679, 'slip_spread_k': 0.0017707545651640122, 'spread_hl_frac': 0.04490348196077849, 'bb_std_mult': 3.5248961117648205, 'rsi_os': 25, 'rsi_ob': 58, 'vol_spike': 0.03149256678783473, 'adx_thresh': 21.94711385811661, 'atr_min_pct': 0.02042939620918292, 'atr_max_pct': 0.07413050253066515, 'tp_mult': 1.1942252392274924, 'tsl_mult': 0.4104236017777817, 'strategy': 'mean_reversion', 'time_stop': 226, 'use_sma': True, 'use_atr': True, 'use_adx': True, 'use_ema': True, 'use_spike': False, 'rsi_required': True, 'edge_k': 1.107336242202138, 'edge_cap': 0.9506473202721901, 'bull_strategy': 'breakout', 'bull_bb_std_mult': 2.9098353949948295, 'bull_rsi_os': 17, 'bull_rsi_ob': 84, 'bull_adx_thresh': 23.640016702424717, 'bull_atr_min_pct': 0.010121962108930837, 'bull_atr_max_pct': 0.03524034373133375, 'bull_tp_mult': 2.5612776671433792, 'bull_tsl_mult': 0.657573715068507, 'bull_time_stop': 247, 'bull_use_sma': True, 'bull_use_ema': False, 'bull_use_atr': False, 'bull_use_adx': True, 'bull_use_spike': True, 'bull_rsi_required': False, 'bear_strategy': 'breakout', 'bear_bb_std_mult': 2.948009950563561, 'bear_rsi_os': 21, 'bear_rsi_ob': 80, 'bear_adx_thresh': 34.86858994418432, 'bear_atr_min_pct': 0.02614658619012021, 'bear_atr_max_pct': 0.08238939149033482, 'bear_tp_mult': 2.8414973697219623, 'bear_tsl_mult': 0.6337851743010425, 'bear_time_stop': 91, 'bear_use_sma': True, 'bear_use_ema': False, 'bear_use_atr': False, 'bear_use_adx': True, 'bear_use_spike': True, 'bear_rsi_required': True, 'sideways_strategy': 'breakout', 'sideways_bb_std_mult': 0.8325400657605466, 'sideways_rsi_os': 11, 'sideways_rsi_ob': 62, 'sideways_adx_thresh': 8.432093770285768, 'sideways_atr_min_pct': 0.022920167989819176, 'sideways_atr_max_pct': 0.028711716021808935, 'sideways_tp_mult': 2.678419287854115, 'sideways_tsl_mult': 0.23570861568501422, 'sideways_time_stop': 14, 'sideways_use_sma': True, 'sideways_use_ema': False, 'sideways_use_atr': True, 'sideways_use_adx': True, 'sideways_use_spike': False, 'sideways_rsi_required': True}.
[I 2025-09-01 08:15:27,424] Trial 336 finished with values: [-1000000000.0, 1000000000.0] and parameters: {'p_sma': 20, 'p_std': 15, 'p_atr': 12, 'p_adx': 14, 'rsi_period': 80, 'ema1': 17, 'ema2': 15, 'slip_atr_k': 0.024658398630126588, 'slip_spread_k': 0.5838241009576373, 'spread_hl_frac': 0.0451243234631011, 'bb_std_mult': 3.499746787147501, 'rsi_os': 5, 'rsi_ob': 64, 'vol_spike': 0.1360654862545739, 'adx_thresh': 24.98567802448119, 'atr_min_pct': 0.020686161848688257, 'atr_max_pct': 0.14991204526049123, 'tp_mult': 1.1795695099948338, 'tsl_mult': 0.4925912854047823, 'strategy': 'breakout', 'time_stop': 127, 'use_sma': True, 'use_atr': True, 'use_adx': True, 'use_ema': True, 'use_spike': True, 'rsi_required': True, 'edge_k': 1.949703285356216, 'edge_cap': 0.07939835328165884, 'bull_strategy': 'breakout', 'bull_bb_std_mult': 2.8101261241096296, 'bull_rsi_os': 38, 'bull_rsi_ob': 60, 'bull_adx_thresh': 8.70521018757616, 'bull_atr_min_pct': 0.02110782699904397, 'bull_atr_max_pct': 0.04979166414373304, 'bull_tp_mult': 2.0701165136363104, 'bull_tsl_mult': 0.5063598554627134, 'bull_time_stop': 152, 'bull_use_sma': False, 'bull_use_ema': False, 'bull_use_atr': False, 'bull_use_adx': True, 'bull_use_spike': True, 'bull_rsi_required': False, 'bear_strategy': 'mean_reversion', 'bear_bb_std_mult': 3.092904850173842, 'bear_rsi_os': 53, 'bear_rsi_ob': 95, 'bear_adx_thresh': 32.04082303389367, 'bear_atr_min_pct': 0.02363548359787312, 'bear_atr_max_pct': 0.06060017658561462, 'bear_tp_mult': 2.5261837065704262, 'bear_tsl_mult': 0.7053098494190572, 'bear_time_stop': 92, 'bear_use_sma': True, 'bear_use_ema': False, 'bear_use_atr': False, 'bear_use_adx': False, 'bear_use_spike': True, 'bear_rsi_required': True, 'sideways_strategy': 'mean_reversion', 'sideways_bb_std_mult': 2.7392218525308403, 'sideways_rsi_os': 32, 'sideways_rsi_ob': 61, 'sideways_adx_thresh': 26.665669209703147, 'sideways_atr_min_pct': 0.017199142582661565, 'sideways_atr_max_pct': 0.029611900297289568, 'sideways_tp_mult': 1.8785738944152592, 'sideways_tsl_mult': 0.012596920366824804, 'sideways_time_stop': 23, 'sideways_use_sma': False, 'sideways_use_ema': False, 'sideways_use_atr': False, 'sideways_use_adx': True, 'sideways_use_spike': True, 'sideways_rsi_required': True}.
[I 2025-09-01 08:15:28,700] Trial 335 finished with values: [-1000000000.0, 1000000000.0] and parameters: {'p_sma': 21, 'p_std': 16, 'p_atr': 26, 'p_adx': 7, 'rsi_period': 64, 'ema1': 15, 'ema2': 15, 'slip_atr_k': 0.08769088485122993, 'slip_spread_k': 0.39098848063974534, 'spread_hl_frac': 0.045083604671870656, 'bb_std_mult': 3.4255855642225983, 'rsi_os': 7, 'rsi_ob': 86, 'vol_spike': 0.10108555392305195, 'adx_thresh': 27.81889873630482, 'atr_min_pct': 0.021884814907151242, 'atr_max_pct': 0.07438727934426557, 'tp_mult': 1.0916343353675761, 'tsl_mult': 0.6515594125541724, 'strategy': 'mean_reversion', 'time_stop': 128, 'use_sma': True, 'use_atr': True, 'use_adx': True, 'use_ema': True, 'use_spike': True, 'rsi_required': True, 'edge_k': 0.48419547868712576, 'edge_cap': 0.5666102680615787, 'bull_strategy': 'breakout', 'bull_bb_std_mult': 2.8115030950440922, 'bull_rsi_os': 48, 'bull_rsi_ob': 80, 'bull_adx_thresh': 9.030558975323874, 'bull_atr_min_pct': 0.005110591185560342, 'bull_atr_max_pct': 0.020243441614246016, 'bull_tp_mult': 2.083399823989959, 'bull_tsl_mult': 0.6988212109035187, 'bull_time_stop': 161, 'bull_use_sma': True, 'bull_use_ema': False, 'bull_use_atr': True, 'bull_use_adx': True, 'bull_use_spike': False, 'bull_rsi_required': False, 'bear_strategy': 'mean_reversion', 'bear_bb_std_mult': 3.0913954061219586, 'bear_rsi_os': 47, 'bear_rsi_ob': 95, 'bear_adx_thresh': 9.398405286048245, 'bear_atr_min_pct': 0.007816518966083107, 'bear_atr_max_pct': 0.04891709490997814, 'bear_tp_mult': 2.1516356997758788, 'bear_tsl_mult': 0.048996352752068595, 'bear_time_stop': 93, 'bear_use_sma': True, 'bear_use_ema': False, 'bear_use_atr': False, 'bear_use_adx': True, 'bear_use_spike': True, 'bear_rsi_required': True, 'sideways_strategy': 'mean_reversion', 'sideways_bb_std_mult': 0.7079506320041656, 'sideways_rsi_os': 39, 'sideways_rsi_ob': 61, 'sideways_adx_thresh': 12.809628801527559, 'sideways_atr_min_pct': 0.01713622892893096, 'sideways_atr_max_pct': 0.028694615692978848, 'sideways_tp_mult': 2.6290463854045587, 'sideways_tsl_mult': 0.020959202838743196, 'sideways_time_stop': 13, 'sideways_use_sma': False, 'sideways_use_ema': False, 'sideways_use_atr': False, 'sideways_use_adx': True, 'sideways_use_spike': True, 'sideways_rsi_required': True}.
[I 2025-09-01 08:15:29,146] Trial 337 finished with values: [-1000000000.0, 1000000000.0] and parameters: {'p_sma': 11, 'p_std': 16, 'p_atr': 24, 'p_adx': 20, 'rsi_period': 68, 'ema1': 22, 'ema2': 27, 'slip_atr_k': 0.028790236951394432, 'slip_spread_k': 0.7352187785782175, 'spread_hl_frac': 0.023517853842156405, 'bb_std_mult': 1.2154570643434996, 'rsi_os': 18, 'rsi_ob': 92, 'vol_spike': 0.010695911439644934, 'adx_thresh': 19.26096417674873, 'atr_min_pct': 0.02073493615186931, 'atr_max_pct': 0.042180202855130335, 'tp_mult': 1.1961269302036779, 'tsl_mult': 0.4086804290355634, 'strategy': 'breakout', 'time_stop': 225, 'use_sma': True, 'use_atr': True, 'use_adx': True, 'use_ema': True, 'use_spike': True, 'rsi_required': True, 'edge_k': 1.9448507589381998, 'edge_cap': 0.06521686230588573, 'bull_strategy': 'breakout', 'bull_bb_std_mult': 2.963879646337081, 'bull_rsi_os': 37, 'bull_rsi_ob': 90, 'bull_adx_thresh': 9.06779099199572, 'bull_atr_min_pct': 0.012684728289969381, 'bull_atr_max_pct': 0.03962475647526376, 'bull_tp_mult': 1.7780647649372259, 'bull_tsl_mult': 0.38177958933058, 'bull_time_stop': 9, 'bull_use_sma': False, 'bull_use_ema': False, 'bull_use_atr': False, 'bull_use_adx': False, 'bull_use_spike': True, 'bull_rsi_required': False, 'bear_strategy': 'mean_reversion', 'bear_bb_std_mult': 1.0995943252252207, 'bear_rsi_os': 25, 'bear_rsi_ob': 64, 'bear_adx_thresh': 20.983713880909306, 'bear_atr_min_pct': 0.0008858918454811154, 'bear_atr_max_pct': 0.08260442899130593, 'bear_tp_mult': 2.9131483863824728, 'bear_tsl_mult': 0.7122599163834222, 'bear_time_stop': 149, 'bear_use_sma': True, 'bear_use_ema': False, 'bear_use_atr': False, 'bear_use_adx': False, 'bear_use_spike': False, 'bear_rsi_required': True, 'sideways_strategy': 'mean_reversion', 'sideways_bb_std_mult': 0.9848461977915377, 'sideways_rsi_os': 42, 'sideways_rsi_ob': 60, 'sideways_adx_thresh': 8.612086570760876, 'sideways_atr_min_pct': 0.027830951394771795, 'sideways_atr_max_pct': 0.09679721833225251, 'sideways_tp_mult': 2.9962731330154324, 'sideways_tsl_mult': 0.22766933234107606, 'sideways_time_stop': 243, 'sideways_use_sma': True, 'sideways_use_ema': True, 'sideways_use_atr': False, 'sideways_use_adx': True, 'sideways_use_spike': True, 'sideways_rsi_required': True}.
[I 2025-09-01 08:16:08,452] Trial 342 finished with values: [-0.034117243367007166, 0.03429544007204605] and parameters: {'p_sma': 22, 'p_std': 37, 'p_atr': 13, 'p_adx': 21, 'rsi_period': 47, 'ema1': 10, 'ema2': 18, 'slip_atr_k': 0.16682439810881827, 'slip_spread_k': 0.6845806912665376, 'spread_hl_frac': 0.030706650291771956, 'bb_std_mult': 1.064095221644106, 'rsi_os': 21, 'rsi_ob': 59, 'vol_spike': 0.27900616904276143, 'adx_thresh': 25.926079768757816, 'atr_min_pct': 0.009443410159085432, 'atr_max_pct': 0.058164072969461134, 'tp_mult': 1.0159167815064931, 'tsl_mult': 0.9776063230683734, 'strategy': 'mean_reversion', 'time_stop': 37, 'use_sma': True, 'use_atr': True, 'use_adx': True, 'use_ema': False, 'use_spike': False, 'rsi_required': True, 'edge_k': 1.7100945047459657, 'edge_cap': 0.12396746460110258, 'bull_strategy': 'breakout', 'bull_bb_std_mult': 0.6262593102708931, 'bull_rsi_os': 9, 'bull_rsi_ob': 48, 'bull_adx_thresh': 7.8438863632075755, 'bull_atr_min_pct': 0.0038693402662760275, 'bull_atr_max_pct': 0.04253074239992735, 'bull_tp_mult': 1.7186463105096705, 'bull_tsl_mult': 0.6384109917605023, 'bull_time_stop': 171, 'bull_use_sma': True, 'bull_use_ema': False, 'bull_use_atr': False, 'bull_use_adx': True, 'bull_use_spike': True, 'bull_rsi_required': False, 'bear_strategy': 'breakout', 'bear_bb_std_mult': 1.5206318037172237, 'bear_rsi_os': 30, 'bear_rsi_ob': 93, 'bear_adx_thresh': 33.00108006495199, 'bear_atr_min_pct': 0.024358255948970474, 'bear_atr_max_pct': 0.013211251021332332, 'bear_tp_mult': 2.6637083694651786, 'bear_tsl_mult': 0.14122268103340418, 'bear_time_stop': 31, 'bear_use_sma': False, 'bear_use_ema': True, 'bear_use_atr': True, 'bear_use_adx': True, 'bear_use_spike': True, 'bear_rsi_required': False, 'sideways_strategy': 'breakout', 'sideways_bb_std_mult': 3.461903720439752, 'sideways_rsi_os': 41, 'sideways_rsi_ob': 95, 'sideways_adx_thresh': 28.991469397936356, 'sideways_atr_min_pct': 0.023871528294419717, 'sideways_atr_max_pct': 0.02368405837133596, 'sideways_tp_mult': 2.524009215060399, 'sideways_tsl_mult': 0.36164122890499417, 'sideways_time_stop': 153, 'sideways_use_sma': False, 'sideways_use_ema': False, 'sideways_use_atr': True, 'sideways_use_adx': False, 'sideways_use_spike': False, 'sideways_rsi_required': False}.
[I 2025-09-01 08:16:10,546] Trial 341 finished with values: [-1000000000.0, 1000000000.0] and parameters: {'p_sma': 10, 'p_std': 12, 'p_atr': 13, 'p_adx': 19, 'rsi_period': 47, 'ema1': 20, 'ema2': 34, 'slip_atr_k': 0.1676223031513639, 'slip_spread_k': 0.7511497048158811, 'spread_hl_frac': 0.023819850150326793, 'bb_std_mult': 1.0701516375546078, 'rsi_os': 21, 'rsi_ob': 59, 'vol_spike': 0.24901080524594243, 'adx_thresh': 25.580760423497125, 'atr_min_pct': 0.02145423228411554, 'atr_max_pct': 0.14567986273057615, 'tp_mult': 1.645437839276524, 'tsl_mult': 0.46193700917065794, 'strategy': 'mean_reversion', 'time_stop': 241, 'use_sma': True, 'use_atr': True, 'use_adx': True, 'use_ema': False, 'use_spike': True, 'rsi_required': True, 'edge_k': 0.9861276514676637, 'edge_cap': 0.872969880644066, 'bull_strategy': 'breakout', 'bull_bb_std_mult': 2.9263756616223673, 'bull_rsi_os': 10, 'bull_rsi_ob': 69, 'bull_adx_thresh': 20.262439641886694, 'bull_atr_min_pct': 0.018160833777494473, 'bull_atr_max_pct': 0.11861902125569654, 'bull_tp_mult': 1.8310296285267285, 'bull_tsl_mult': 0.6410260062515538, 'bull_time_stop': 9, 'bull_use_sma': True, 'bull_use_ema': False, 'bull_use_atr': False, 'bull_use_adx': False, 'bull_use_spike': True, 'bull_rsi_required': False, 'bear_strategy': 'mean_reversion', 'bear_bb_std_mult': 1.1084814324549814, 'bear_rsi_os': 30, 'bear_rsi_ob': 71, 'bear_adx_thresh': 33.06566952336784, 'bear_atr_min_pct': 0.02451062906857211, 'bear_atr_max_pct': 0.07472566213117543, 'bear_tp_mult': 1.2653496583170498, 'bear_tsl_mult': 0.10892606605092099, 'bear_time_stop': 235, 'bear_use_sma': False, 'bear_use_ema': True, 'bear_use_atr': True, 'bear_use_adx': True, 'bear_use_spike': False, 'bear_rsi_required': False, 'sideways_strategy': 'mean_reversion', 'sideways_bb_std_mult': 3.315963236204073, 'sideways_rsi_os': 35, 'sideways_rsi_ob': 58, 'sideways_adx_thresh': 29.09547685881408, 'sideways_atr_min_pct': 0.024073680200048846, 'sideways_atr_max_pct': 0.09862184208734731, 'sideways_tp_mult': 1.9646251105665147, 'sideways_tsl_mult': 0.1886113154320211, 'sideways_time_stop': 188, 'sideways_use_sma': True, 'sideways_use_ema': True, 'sideways_use_atr': False, 'sideways_use_adx': False, 'sideways_use_spike': True, 'sideways_rsi_required': False}.
[I 2025-09-01 08:16:10,563] Trial 340 finished with values: [-1000000000.0, 1000000000.0] and parameters: {'p_sma': 22, 'p_std': 16, 'p_atr': 26, 'p_adx': 22, 'rsi_period': 56, 'ema1': 12, 'ema2': 12, 'slip_atr_k': 0.09021524672032102, 'slip_spread_k': 0.3891071661801868, 'spread_hl_frac': 0.01938709038744562, 'bb_std_mult': 3.2074413497671674, 'rsi_os': 23, 'rsi_ob': 61, 'vol_spike': 0.24947713098557947, 'adx_thresh': 27.754383716142282, 'atr_min_pct': 0.021428457732037574, 'atr_max_pct': 0.0817455980706329, 'tp_mult': 2.8390389112355368, 'tsl_mult': 0.4688320947383925, 'strategy': 'mean_reversion', 'time_stop': 56, 'use_sma': True, 'use_atr': True, 'use_adx': True, 'use_ema': True, 'use_spike': True, 'rsi_required': True, 'edge_k': 0.8541958332111672, 'edge_cap': 0.12263169881649591, 'bull_strategy': 'breakout', 'bull_bb_std_mult': 2.946589453139862, 'bull_rsi_os': 26, 'bull_rsi_ob': 90, 'bull_adx_thresh': 9.10147468264104, 'bull_atr_min_pct': 0.012835254846474688, 'bull_atr_max_pct': 0.13220495504958, 'bull_tp_mult': 1.854487598443261, 'bull_tsl_mult': 0.6372212415694687, 'bull_time_stop': 214, 'bull_use_sma': True, 'bull_use_ema': False, 'bull_use_atr': False, 'bull_use_adx': False, 'bull_use_spike': True, 'bull_rsi_required': False, 'bear_strategy': 'mean_reversion', 'bear_bb_std_mult': 1.5349628499618668, 'bear_rsi_os': 30, 'bear_rsi_ob': 94, 'bear_adx_thresh': 32.86017489920457, 'bear_atr_min_pct': 0.024295468587454145, 'bear_atr_max_pct': 0.07508876238909021, 'bear_tp_mult': 1.4221896786976824, 'bear_tsl_mult': 0.12159510318937547, 'bear_time_stop': 147, 'bear_use_sma': False, 'bear_use_ema': True, 'bear_use_atr': True, 'bear_use_adx': True, 'bear_use_spike': False, 'bear_rsi_required': False, 'sideways_strategy': 'mean_reversion', 'sideways_bb_std_mult': 0.7038982421672613, 'sideways_rsi_os': 41, 'sideways_rsi_ob': 49, 'sideways_adx_thresh': 27.471897477944726, 'sideways_atr_min_pct': 0.026009612879935036, 'sideways_atr_max_pct': 0.09657442610144673, 'sideways_tp_mult': 2.6284592345890134, 'sideways_tsl_mult': 0.3721616409774837, 'sideways_time_stop': 154, 'sideways_use_sma': False, 'sideways_use_ema': True, 'sideways_use_atr': False, 'sideways_use_adx': True, 'sideways_use_spike': True, 'sideways_rsi_required': False}.
