[I 2025-09-01 08:03:35,291] Trial 271 finished with values: [-1000000000.0, 1000000000.0] and parameters: {'p_sma': 19, 'p_std': 15, 'p_atr': 13, 'p_adx': 29, 'rsi_period': 64, 'ema1': 11, 'ema2': 13, 'slip_atr_k': 0.20712154740796376, 'slip_spread_k': 0.3872929621007487, 'spread_hl_frac': 0.02828572405326765, 'bb_std_mult': 3.56011137480163, 'rsi_os': 24, 'rsi_ob': 57, 'vol_spike': 0.26997900582278306, 'adx_thresh': 18.986816686303293, 'atr_min_pct': 0.020709061309211633, 'atr_max_pct': 0.08419943341596525, 'tp_mult': 2.067710873985743, 'tsl_mult': 0.5389081116003828, 'strategy': 'mean_reversion', 'time_stop': 258, 'use_sma': False, 'use_atr': True, 'use_adx': True, 'use_ema': True, 'use_spike': True, 'rsi_required': True, 'edge_k': 1.0530192682549584, 'edge_cap': 0.07935441021504652, 'bull_strategy': 'mean_reversion', 'bull_bb_std_mult': 2.7773964062610292, 'bull_rsi_os': 32, 'bull_rsi_ob': 71, 'bull_adx_thresh': 9.63181382369977, 'bull_atr_min_pct': 0.020444257798639905, 'bull_atr_max_pct': 0.06176142961743355, 'bull_tp_mult': 1.7403912085052942, 'bull_tsl_mult': 0.41694317066179865, 'bull_time_stop': 196, 'bull_use_sma': True, 'bull_use_ema': False, 'bull_use_atr': False, 'bull_use_adx': False, 'bull_use_spike': True, 'bull_rsi_required': False, 'bear_strategy': 'mean_reversion', 'bear_bb_std_mult': 3.153220826948763, 'bear_rsi_os': 27, 'bear_rsi_ob': 93, 'bear_adx_thresh': 30.164774210476782, 'bear_atr_min_pct': 0.016215962727419774, 'bear_atr_max_pct': 0.0725342771181121, 'bear_tp_mult': 1.010263215768242, 'bear_tsl_mult': 0.07601645105547292, 'bear_time_stop': 87, 'bear_use_sma': False, 'bear_use_ema': False, 'bear_use_atr': True, 'bear_use_adx': False, 'bear_use_spike': True, 'bear_rsi_required': True, 'sideways_strategy': 'mean_reversion', 'sideways_bb_std_mult': 0.6577029472797952, 'sideways_rsi_os': 51, 'sideways_rsi_ob': 74, 'sideways_adx_thresh': 15.053394823939648, 'sideways_atr_min_pct': 0.023363714312729177, 'sideways_atr_max_pct': 0.02936784162923319, 'sideways_tp_mult': 2.5182187445424074, 'sideways_tsl_mult': 0.20897049142687263, 'sideways_time_stop': 238, 'sideways_use_sma': True, 'sideways_use_ema': False, 'sideways_use_atr': False, 'sideways_use_adx': True, 'sideways_use_spike': True, 'sideways_rsi_required': False}.
[I 2025-09-01 08:03:36,326] Trial 270 finished with values: [-1000000000.0, 1000000000.0] and parameters: {'p_sma': 21, 'p_std': 16, 'p_atr': 13, 'p_adx': 19, 'rsi_period': 64, 'ema1': 9, 'ema2': 13, 'slip_atr_k': 0.04159532004799274, 'slip_spread_k': 0.631439904430701, 'spread_hl_frac': 0.013899689604360317, 'bb_std_mult': 2.7226227792146975, 'rsi_os': 24, 'rsi_ob': 57, 'vol_spike': 0.2372578401581275, 'adx_thresh': 31.9669551095077, 'atr_min_pct': 0.012102369128451793, 'atr_max_pct': 0.1499730961761043, 'tp_mult': 1.1978895369362055, 'tsl_mult': 0.5206402193637338, 'strategy': 'mean_reversion', 'time_stop': 228, 'use_sma': True, 'use_atr': True, 'use_adx': True, 'use_ema': True, 'use_spike': True, 'rsi_required': True, 'edge_k': 0.4835053050084611, 'edge_cap': 0.7078148305871675, 'bull_strategy': 'breakout', 'bull_bb_std_mult': 2.4647371202440174, 'bull_rsi_os': 13, 'bull_rsi_ob': 65, 'bull_adx_thresh': 31.439867413587734, 'bull_atr_min_pct': 0.020303570031610173, 'bull_atr_max_pct': 0.056248637914478726, 'bull_tp_mult': 1.2235271171020254, 'bull_tsl_mult': 0.826030927685508, 'bull_time_stop': 159, 'bull_use_sma': True, 'bull_use_ema': False, 'bull_use_atr': False, 'bull_use_adx': True, 'bull_use_spike': True, 'bull_rsi_required': False, 'bear_strategy': 'mean_reversion', 'bear_bb_std_mult': 2.593037141463168, 'bear_rsi_os': 24, 'bear_rsi_ob': 93, 'bear_adx_thresh': 9.80496227950539, 'bear_atr_min_pct': 0.022502178464294795, 'bear_atr_max_pct': 0.13783419422714013, 'bear_tp_mult': 1.961706689942194, 'bear_tsl_mult': 0.08512508147004515, 'bear_time_stop': 88, 'bear_use_sma': False, 'bear_use_ema': False, 'bear_use_atr': False, 'bear_use_adx': True, 'bear_use_spike': True, 'bear_rsi_required': True, 'sideways_strategy': 'mean_reversion', 'sideways_bb_std_mult': 0.6004165144058952, 'sideways_rsi_os': 51, 'sideways_rsi_ob': 60, 'sideways_adx_thresh': 9.393404888707977, 'sideways_atr_min_pct': 0.023303460202051048, 'sideways_atr_max_pct': 0.13991689827720286, 'sideways_tp_mult': 2.518605556955939, 'sideways_tsl_mult': 0.9533210404272447, 'sideways_time_stop': 81, 'sideways_use_sma': False, 'sideways_use_ema': False, 'sideways_use_atr': False, 'sideways_use_adx': True, 'sideways_use_spike': True, 'sideways_rsi_required': False}.
[I 2025-09-01 08:03:36,998] Trial 273 finished with values: [-1000000000.0, 1000000000.0] and parameters: {'p_sma': 27, 'p_std': 48, 'p_atr': 13, 'p_adx': 12, 'rsi_period': 61, 'ema1': 30, 'ema2': 14, 'slip_atr_k': 0.06494461355142771, 'slip_spread_k': 0.5014535602344766, 'spread_hl_frac': 0.046798244429634414, 'bb_std_mult': 3.3889735839421746, 'rsi_os': 24, 'rsi_ob': 57, 'vol_spike': 0.25382841553417396, 'adx_thresh': 21.644959748848628, 'atr_min_pct': 0.00674106621256544, 'atr_max_pct': 0.1459802192626625, 'tp_mult': 2.082334019080431, 'tsl_mult': 0.5164129193868144, 'strategy': 'mean_reversion', 'time_stop': 149, 'use_sma': False, 'use_atr': False, 'use_adx': False, 'use_ema': True, 'use_spike': False, 'rsi_required': True, 'edge_k': 1.796705683100342, 'edge_cap': 0.0894701775332596, 'bull_strategy': 'mean_reversion', 'bull_bb_std_mult': 2.9817423586294907, 'bull_rsi_os': 13, 'bull_rsi_ob': 76, 'bull_adx_thresh': 31.31815792670007, 'bull_atr_min_pct': 0.012073184425417726, 'bull_atr_max_pct': 0.013624323491203238, 'bull_tp_mult': 1.2184260249705994, 'bull_tsl_mult': 0.6913794267731004, 'bull_time_stop': 79, 'bull_use_sma': True, 'bull_use_ema': True, 'bull_use_atr': True, 'bull_use_adx': False, 'bull_use_spike': False, 'bull_rsi_required': True, 'bear_strategy': 'mean_reversion', 'bear_bb_std_mult': 3.15680871051514, 'bear_rsi_os': 27, 'bear_rsi_ob': 93, 'bear_adx_thresh': 8.656131925256512, 'bear_atr_min_pct': 0.02487749785795754, 'bear_atr_max_pct': 0.07294324595712842, 'bear_tp_mult': 2.7453126359016964, 'bear_tsl_mult': 0.058332669304462584, 'bear_time_stop': 246, 'bear_use_sma': False, 'bear_use_ema': False, 'bear_use_atr': False, 'bear_use_adx': False, 'bear_use_spike': True, 'bear_rsi_required': False, 'sideways_strategy': 'breakout', 'sideways_bb_std_mult': 1.3400333488061378, 'sideways_rsi_os': 51, 'sideways_rsi_ob': 75, 'sideways_adx_thresh': 21.85557536160467, 'sideways_atr_min_pct': 0.023230310151418306, 'sideways_atr_max_pct': 0.1463599460459339, 'sideways_tp_mult': 2.514402727665945, 'sideways_tsl_mult': 0.3538531525034554, 'sideways_time_stop': 18, 'sideways_use_sma': True, 'sideways_use_ema': False, 'sideways_use_atr': True, 'sideways_use_adx': True, 'sideways_use_spike': True, 'sideways_rsi_required': False}.
[I 2025-09-01 08:03:37,203] Trial 272 finished with values: [-1000000000.0, 1000000000.0] and parameters: {'p_sma': 34, 'p_std': 15, 'p_atr': 13, 'p_adx': 21, 'rsi_period': 18, 'ema1': 26, 'ema2': 13, 'slip_atr_k': 0.12659319923069365, 'slip_spread_k': 0.8618628664733858, 'spread_hl_frac': 0.028614651565225007, 'bb_std_mult': 3.375933201262816, 'rsi_os': 24, 'rsi_ob': 57, 'vol_spike': 0.27396454254191754, 'adx_thresh': 26.264834437367377, 'atr_min_pct': 0.010925287351245032, 'atr_max_pct': 0.05790721522803542, 'tp_mult': 1.842842674155476, 'tsl_mult': 0.5389018292792477, 'strategy': 'mean_reversion', 'time_stop': 259, 'use_sma': False, 'use_atr': False, 'use_adx': False, 'use_ema': True, 'use_spike': True, 'rsi_required': False, 'edge_k': 0.8800992504553191, 'edge_cap': 0.08783177738908603, 'bull_strategy': 'mean_reversion', 'bull_bb_std_mult': 3.046446266571734, 'bull_rsi_os': 32, 'bull_rsi_ob': 48, 'bull_adx_thresh': 9.469144361573745, 'bull_atr_min_pct': 0.02690145833669378, 'bull_atr_max_pct': 0.04480666619587559, 'bull_tp_mult': 1.234146867471334, 'bull_tsl_mult': 0.05307983793504284, 'bull_time_stop': 161, 'bull_use_sma': True, 'bull_use_ema': True, 'bull_use_atr': True, 'bull_use_adx': False, 'bull_use_spike': False, 'bull_rsi_required': True, 'bear_strategy': 'mean_reversion', 'bear_bb_std_mult': 3.1813296869131693, 'bear_rsi_os': 27, 'bear_rsi_ob': 93, 'bear_adx_thresh': 20.607334110671136, 'bear_atr_min_pct': 0.025473372811302384, 'bear_atr_max_pct': 0.0904475316312718, 'bear_tp_mult': 2.739020227871101, 'bear_tsl_mult': 0.07766509915522496, 'bear_time_stop': 255, 'bear_use_sma': False, 'bear_use_ema': False, 'bear_use_atr': True, 'bear_use_adx': False, 'bear_use_spike': True, 'bear_rsi_required': False, 'sideways_strategy': 'breakout', 'sideways_bb_std_mult': 0.5480336251417335, 'sideways_rsi_os': 6, 'sideways_rsi_ob': 74, 'sideways_adx_thresh': 9.400891151579485, 'sideways_atr_min_pct': 0.023337830759818375, 'sideways_atr_max_pct': 0.028742754206774513, 'sideways_tp_mult': 2.527259723726656, 'sideways_tsl_mult': 0.32311248022530875, 'sideways_time_stop': 300, 'sideways_use_sma': True, 'sideways_use_ema': False, 'sideways_use_atr': True, 'sideways_use_adx': True, 'sideways_use_spike': True, 'sideways_rsi_required': False}.
[I 2025-09-01 08:04:17,726] Trial 277 finished with values: [-1000000000.0, 1000000000.0] and parameters: {'p_sma': 16, 'p_std': 41, 'p_atr': 26, 'p_adx': 27, 'rsi_period': 69, 'ema1': 12, 'ema2': 34, 'slip_atr_k': 0.0525442112905379, 'slip_spread_k': 0.5405565015241223, 'spread_hl_frac': 0.02555415889305797, 'bb_std_mult': 1.0850419448291664, 'rsi_os': 53, 'rsi_ob': 55, 'vol_spike': 0.24489384612565523, 'adx_thresh': 5.972077169039448, 'atr_min_pct': 0.01977893923963989, 'atr_max_pct': 0.14695067544292903, 'tp_mult': 1.3077575304930218, 'tsl_mult': 0.4932531585514246, 'strategy': 'breakout', 'time_stop': 248, 'use_sma': True, 'use_atr': True, 'use_adx': True, 'use_ema': False, 'use_spike': False, 'rsi_required': True, 'edge_k': 1.4938887992000218, 'edge_cap': 0.7760080992882334, 'bull_strategy': 'breakout', 'bull_bb_std_mult': 2.8444124061227476, 'bull_rsi_os': 15, 'bull_rsi_ob': 56, 'bull_adx_thresh': 15.781338129062135, 'bull_atr_min_pct': 0.01570201028757705, 'bull_atr_max_pct': 0.10857611265712042, 'bull_tp_mult': 2.3521020990032184, 'bull_tsl_mult': 0.1634984343455364, 'bull_time_stop': 166, 'bull_use_sma': True, 'bull_use_ema': False, 'bull_use_atr': False, 'bull_use_adx': True, 'bull_use_spike': True, 'bull_rsi_required': False, 'bear_strategy': 'mean_reversion', 'bear_bb_std_mult': 3.369117573298278, 'bear_rsi_os': 45, 'bear_rsi_ob': 94, 'bear_adx_thresh': 33.64547594345123, 'bear_atr_min_pct': 0.023075819439353225, 'bear_atr_max_pct': 0.12584478029149582, 'bear_tp_mult': 1.7685887913672143, 'bear_tsl_mult': 0.4747720443594534, 'bear_time_stop': 92, 'bear_use_sma': True, 'bear_use_ema': False, 'bear_use_atr': True, 'bear_use_adx': True, 'bear_use_spike': True, 'bear_rsi_required': False, 'sideways_strategy': 'mean_reversion', 'sideways_bb_std_mult': 1.6532357153857318, 'sideways_rsi_os': 40, 'sideways_rsi_ob': 61, 'sideways_adx_thresh': 8.76982612130215, 'sideways_atr_min_pct': 0.022742826515751706, 'sideways_atr_max_pct': 0.03024382204771095, 'sideways_tp_mult': 1.7006812959428903, 'sideways_tsl_mult': 0.5582749170302003, 'sideways_time_stop': 176, 'sideways_use_sma': False, 'sideways_use_ema': False, 'sideways_use_atr': False, 'sideways_use_adx': False, 'sideways_use_spike': False, 'sideways_rsi_required': True}.
[I 2025-09-01 08:04:18,245] Trial 275 finished with values: [-1000000000.0, 1000000000.0] and parameters: {'p_sma': 18, 'p_std': 15, 'p_atr': 12, 'p_adx': 20, 'rsi_period': 22, 'ema1': 15, 'ema2': 53, 'slip_atr_k': 0.1250689121660677, 'slip_spread_k': 0.5436084779949386, 'spread_hl_frac': 0.039403848651774744, 'bb_std_mult': 3.382834446912203, 'rsi_os': 31, 'rsi_ob': 53, 'vol_spike': 0.2541187557166937, 'adx_thresh': 17.989901569064962, 'atr_min_pct': 0.019773353564413985, 'atr_max_pct': 0.14638868568148086, 'tp_mult': 1.2965254014121317, 'tsl_mult': 0.503778673350758, 'strategy': 'breakout', 'time_stop': 145, 'use_sma': False, 'use_atr': False, 'use_adx': False, 'use_ema': True, 'use_spike': False, 'rsi_required': True, 'edge_k': 0.8813138324729851, 'edge_cap': 0.09295271804716017, 'bull_strategy': 'mean_reversion', 'bull_bb_std_mult': 3.353962004914705, 'bull_rsi_os': 15, 'bull_rsi_ob': 50, 'bull_adx_thresh': 6.53541112572425, 'bull_atr_min_pct': 0.01225982167887506, 'bull_atr_max_pct': 0.012020083459899661, 'bull_tp_mult': 2.361664807536859, 'bull_tsl_mult': 0.688360081990734, 'bull_time_stop': 163, 'bull_use_sma': True, 'bull_use_ema': True, 'bull_use_atr': True, 'bull_use_adx': False, 'bull_use_spike': False, 'bull_rsi_required': True, 'bear_strategy': 'mean_reversion', 'bear_bb_std_mult': 0.5709539824048826, 'bear_rsi_os': 28, 'bear_rsi_ob': 92, 'bear_adx_thresh': 6.47109396084489, 'bear_atr_min_pct': 0.004442133352323742, 'bear_atr_max_pct': 0.032718468310079386, 'bear_tp_mult': 1.7768336099406004, 'bear_tsl_mult': 0.3984697493197388, 'bear_time_stop': 92, 'bear_use_sma': True, 'bear_use_ema': False, 'bear_use_atr': True, 'bear_use_adx': False, 'bear_use_spike': True, 'bear_rsi_required': False, 'sideways_strategy': 'breakout', 'sideways_bb_std_mult': 0.5408459969976235, 'sideways_rsi_os': 40, 'sideways_rsi_ob': 50, 'sideways_adx_thresh': 28.20560416118797, 'sideways_atr_min_pct': 0.02266236842895577, 'sideways_atr_max_pct': 0.14979869781105937, 'sideways_tp_mult': 1.9911945837883458, 'sideways_tsl_mult': 0.05412152371819101, 'sideways_time_stop': 115, 'sideways_use_sma': True, 'sideways_use_ema': False, 'sideways_use_atr': True, 'sideways_use_adx': False, 'sideways_use_spike': False, 'sideways_rsi_required': True}.
[I 2025-09-01 08:04:18,689] Trial 274 finished with values: [-1000000000.0, 1000000000.0] and parameters: {'p_sma': 27, 'p_std': 16, 'p_atr': 14, 'p_adx': 21, 'rsi_period': 21, 'ema1': 11, 'ema2': 14, 'slip_atr_k': 0.11987284097589108, 'slip_spread_k': 0.5422027361936276, 'spread_hl_frac': 0.039205914403552644, 'bb_std_mult': 2.727845440582045, 'rsi_os': 21, 'rsi_ob': 87, 'vol_spike': 0.2928664134505894, 'adx_thresh': 18.284323806604053, 'atr_min_pct': 0.01969409167512875, 'atr_max_pct': 0.12210718942965867, 'tp_mult': 1.1553521120351364, 'tsl_mult': 0.5153689582945373, 'strategy': 'mean_reversion', 'time_stop': 63, 'use_sma': True, 'use_atr': False, 'use_adx': False, 'use_ema': True, 'use_spike': False, 'rsi_required': True, 'edge_k': 0.892257675509231, 'edge_cap': 0.927242399121918, 'bull_strategy': 'breakout', 'bull_bb_std_mult': 2.983398857657404, 'bull_rsi_os': 13, 'bull_rsi_ob': 73, 'bull_adx_thresh': 31.323593810108342, 'bull_atr_min_pct': 0.012640797867338367, 'bull_atr_max_pct': 0.10804472704221707, 'bull_tp_mult': 2.3560230938577544, 'bull_tsl_mult': 0.691828823054269, 'bull_time_stop': 80, 'bull_use_sma': True, 'bull_use_ema': True, 'bull_use_atr': True, 'bull_use_adx': False, 'bull_use_spike': False, 'bull_rsi_required': True, 'bear_strategy': 'mean_reversion', 'bear_bb_std_mult': 1.086488433197554, 'bear_rsi_os': 51, 'bear_rsi_ob': 88, 'bear_adx_thresh': 32.661629351672275, 'bear_atr_min_pct': 0.02541032679525732, 'bear_atr_max_pct': 0.13730523200164665, 'bear_tp_mult': 2.739037125886656, 'bear_tsl_mult': 0.39285329456534585, 'bear_time_stop': 282, 'bear_use_sma': True, 'bear_use_ema': False, 'bear_use_atr': False, 'bear_use_adx': False, 'bear_use_spike': True, 'bear_rsi_required': False, 'sideways_strategy': 'breakout', 'sideways_bb_std_mult': 0.500150886832096, 'sideways_rsi_os': 40, 'sideways_rsi_ob': 61, 'sideways_adx_thresh': 20.01555190015494, 'sideways_atr_min_pct': 0.007700520924868115, 'sideways_atr_max_pct': 0.02939600873517914, 'sideways_tp_mult': 2.0910428015351457, 'sideways_tsl_mult': 0.10981815085838942, 'sideways_time_stop': 169, 'sideways_use_sma': False, 'sideways_use_ema': False, 'sideways_use_atr': True, 'sideways_use_adx': False, 'sideways_use_spike': False, 'sideways_rsi_required': True}.
[I 2025-09-01 08:04:19,013] Trial 276 finished with values: [-0.12032018962144209, 0.12010567850228855] and parameters: {'p_sma': 34, 'p_std': 16, 'p_atr': 14, 'p_adx': 21, 'rsi_period': 53, 'ema1': 12, 'ema2': 41, 'slip_atr_k': 0.0329002560339306, 'slip_spread_k': 0.8483234689794635, 'spread_hl_frac': 0.021385087870256076, 'bb_std_mult': 3.3256587863272435, 'rsi_os': 11, 'rsi_ob': 55, 'vol_spike': 0.2920644322692023, 'adx_thresh': 26.316807308107734, 'atr_min_pct': 0.019611735722247503, 'atr_max_pct': 0.1222292344043059, 'tp_mult': 1.3184333533447088, 'tsl_mult': 0.46849925897537037, 'strategy': 'breakout', 'time_stop': 250, 'use_sma': True, 'use_atr': False, 'use_adx': False, 'use_ema': False, 'use_spike': False, 'rsi_required': False, 'edge_k': 0.8853735939021979, 'edge_cap': 0.9282700939893547, 'bull_strategy': 'breakout', 'bull_bb_std_mult': 3.0565027791970776, 'bull_rsi_os': 10, 'bull_rsi_ob': 73, 'bull_adx_thresh': 9.471762810820666, 'bull_atr_min_pct': 0.028532524859230697, 'bull_atr_max_pct': 0.13365458227678434, 'bull_tp_mult': 1.3219708578867686, 'bull_tsl_mult': 0.6496412229037289, 'bull_time_stop': 233, 'bull_use_sma': True, 'bull_use_ema': True, 'bull_use_atr': True, 'bull_use_adx': True, 'bull_use_spike': False, 'bull_rsi_required': True, 'bear_strategy': 'mean_reversion', 'bear_bb_std_mult': 3.197547994588689, 'bear_rsi_os': 28, 'bear_rsi_ob': 50, 'bear_adx_thresh': 32.56649347803786, 'bear_atr_min_pct': 0.0016772446847126733, 'bear_atr_max_pct': 0.12631487828970622, 'bear_tp_mult': 2.8102414442628785, 'bear_tsl_mult': 0.11270287299153503, 'bear_time_stop': 93, 'bear_use_sma': True, 'bear_use_ema': False, 'bear_use_atr': True, 'bear_use_adx': True, 'bear_use_spike': True, 'bear_rsi_required': False, 'sideways_strategy': 'breakout', 'sideways_bb_std_mult': 1.6108665903448651, 'sideways_rsi_os': 40, 'sideways_rsi_ob': 50, 'sideways_adx_thresh': 28.320453156355157, 'sideways_atr_min_pct': 0.022497713366203837, 'sideways_atr_max_pct': 0.029508696763381238, 'sideways_tp_mult': 2.0847297534937805, 'sideways_tsl_mult': 0.04876441683227506, 'sideways_time_stop': 173, 'sideways_use_sma': False, 'sideways_use_ema': False, 'sideways_use_atr': True, 'sideways_use_adx': False, 'sideways_use_spike': False, 'sideways_rsi_required': True}.
[I 2025-09-01 08:05:00,053] Trial 278 finished with values: [-1000000000.0, 1000000000.0] and parameters: {'p_sma': 22, 'p_std': 16, 'p_atr': 22, 'p_adx': 20, 'rsi_period': 36, 'ema1': 23, 'ema2': 53, 'slip_atr_k': 0.17221649408164316, 'slip_spread_k': 0.6589216923030073, 'spread_hl_frac': 0.00405542500110035, 'bb_std_mult': 2.2942257253264167, 'rsi_os': 22, 'rsi_ob': 74, 'vol_spike': 0.24802202900780126, 'adx_thresh': 24.33708037517995, 'atr_min_pct': 0.02118627800100897, 'atr_max_pct': 0.14162798107615043, 'tp_mult': 1.1495423562931624, 'tsl_mult': 0.8863585507266873, 'strategy': 'breakout', 'time_stop': 62, 'use_sma': True, 'use_atr': True, 'use_adx': True, 'use_ema': True, 'use_spike': True, 'rsi_required': True, 'edge_k': 0.396159063051272, 'edge_cap': 0.05653743464002474, 'bull_strategy': 'breakout', 'bull_bb_std_mult': 1.818324892210628, 'bull_rsi_os': 10, 'bull_rsi_ob': 69, 'bull_adx_thresh': 24.872927145556663, 'bull_atr_min_pct': 0.027703229957354723, 'bull_atr_max_pct': 0.03423282169796313, 'bull_tp_mult': 2.2963871516778993, 'bull_tsl_mult': 0.6419153710579558, 'bull_time_stop': 281, 'bull_use_sma': True, 'bull_use_ema': False, 'bull_use_atr': False, 'bull_use_adx': True, 'bull_use_spike': True, 'bull_rsi_required': False, 'bear_strategy': 'mean_reversion', 'bear_bb_std_mult': 2.38679230487391, 'bear_rsi_os': 28, 'bear_rsi_ob': 59, 'bear_adx_thresh': 23.905085888633238, 'bear_atr_min_pct': 0.004717672496617977, 'bear_atr_max_pct': 0.010118857854000837, 'bear_tp_mult': 2.4827265288311233, 'bear_tsl_mult': 0.18556152332119297, 'bear_time_stop': 78, 'bear_use_sma': True, 'bear_use_ema': True, 'bear_use_atr': True, 'bear_use_adx': True, 'bear_use_spike': True, 'bear_rsi_required': False, 'sideways_strategy': 'mean_reversion', 'sideways_bb_std_mult': 2.5850066556595523, 'sideways_rsi_os': 40, 'sideways_rsi_ob': 69, 'sideways_adx_thresh': 13.96584198360133, 'sideways_atr_min_pct': 0.021558984781795073, 'sideways_atr_max_pct': 0.022389205491206363, 'sideways_tp_mult': 2.100231459099582, 'sideways_tsl_mult': 0.1053265103530086, 'sideways_time_stop': 261, 'sideways_use_sma': False, 'sideways_use_ema': False, 'sideways_use_atr': False, 'sideways_use_adx': False, 'sideways_use_spike': False, 'sideways_rsi_required': True}.
