[I 2025-09-01 07:36:01,089] Trial 101 finished with values: [-0.07272973261820792, 0.072151981441346] and parameters: {'p_sma': 58, 'p_std': 31, 'p_atr': 27, 'p_adx': 18, 'rsi_period': 18, 'ema1': 29, 'ema2': 57, 'slip_atr_k': 0.2306057394849112, 'slip_spread_k': 0.6208553616396005, 'spread_hl_frac': 0.041384797884258744, 'bb_std_mult': 2.4853814776329943, 'rsi_os': 12, 'rsi_ob': 52, 'vol_spike': 0.055283172951744106, 'adx_thresh': 23.319198716764205, 'atr_min_pct': 0.009657839166063711, 'atr_max_pct': 0.13963256203066254, 'tp_mult': 1.3165797552059824, 'tsl_mult': 0.01687094450315213, 'strategy': 'breakout', 'time_stop': 229, 'use_sma': False, 'use_atr': False, 'use_adx': True, 'use_ema': False, 'use_spike': False, 'rsi_required': True, 'edge_k': 0.7667845393154744, 'edge_cap': 0.8398352995428032, 'bull_strategy': 'mean_reversion', 'bull_bb_std_mult': 1.1149322471281347, 'bull_rsi_os': 21, 'bull_rsi_ob': 77, 'bull_adx_thresh': 12.236037044229326, 'bull_atr_min_pct': 0.01320379201967328, 'bull_atr_max_pct': 0.08164979463071576, 'bull_tp_mult': 2.3633389784967966, 'bull_tsl_mult': 0.8116946030863385, 'bull_time_stop': 178, 'bull_use_sma': True, 'bull_use_ema': True, 'bull_use_atr': False, 'bull_use_adx': False, 'bull_use_spike': True, 'bull_rsi_required': False, 'bear_strategy': 'breakout', 'bear_bb_std_mult': 1.277403515390275, 'bear_rsi_os': 30, 'bear_rsi_ob': 90, 'bear_adx_thresh': 13.33583772995592, 'bear_atr_min_pct': 0.005222632421183756, 'bear_atr_max_pct': 0.09085636617790308, 'bear_tp_mult': 2.0348627631330234, 'bear_tsl_mult': 0.21784032020284444, 'bear_time_stop': 253, 'bear_use_sma': True, 'bear_use_ema': True, 'bear_use_atr': False, 'bear_use_adx': False, 'bear_use_spike': True, 'bear_rsi_required': True, 'sideways_strategy': 'breakout', 'sideways_bb_std_mult': 1.7788116759423487, 'sideways_rsi_os': 44, 'sideways_rsi_ob': 72, 'sideways_adx_thresh': 26.18911458062643, 'sideways_atr_min_pct': 0.004705012175860536, 'sideways_atr_max_pct': 0.08489808859346112, 'sideways_tp_mult': 2.393498407682857, 'sideways_tsl_mult': 0.5936838560510268, 'sideways_time_stop': 164, 'sideways_use_sma': True, 'sideways_use_ema': False, 'sideways_use_atr': True, 'sideways_use_adx': True, 'sideways_use_spike': True, 'sideways_rsi_required': True}.
[I 2025-09-01 07:36:01,562] Trial 102 finished with values: [-0.025748125472497274, 0.02678984665422951] and parameters: {'p_sma': 23, 'p_std': 31, 'p_atr': 22, 'p_adx': 18, 'rsi_period': 50, 'ema1': 19, 'ema2': 57, 'slip_atr_k': 0.029998353928077377, 'slip_spread_k': 0.6246865419586495, 'spread_hl_frac': 0.00497598733873476, 'bb_std_mult': 2.0293304520040816, 'rsi_os': 45, 'rsi_ob': 58, 'vol_spike': 0.17615850310801212, 'adx_thresh': 25.07397587018892, 'atr_min_pct': 0.027168248613527415, 'atr_max_pct': 0.1463567710226412, 'tp_mult': 1.3946173918380798, 'tsl_mult': 0.28715701936974325, 'strategy': 'breakout', 'time_stop': 231, 'use_sma': False, 'use_atr': False, 'use_adx': False, 'use_ema': False, 'use_spike': False, 'rsi_required': True, 'edge_k': 1.363822641086223, 'edge_cap': 0.8321284725823301, 'bull_strategy': 'mean_reversion', 'bull_bb_std_mult': 2.8364031845519695, 'bull_rsi_os': 8, 'bull_rsi_ob': 77, 'bull_adx_thresh': 12.29559301857944, 'bull_atr_min_pct': 0.02244124680941776, 'bull_atr_max_pct': 0.07680016719140613, 'bull_tp_mult': 2.1693536883912237, 'bull_tsl_mult': 0.7994617387068382, 'bull_time_stop': 217, 'bull_use_sma': True, 'bull_use_ema': True, 'bull_use_atr': False, 'bull_use_adx': False, 'bull_use_spike': True, 'bull_rsi_required': True, 'bear_strategy': 'breakout', 'bear_bb_std_mult': 2.3962557365615367, 'bear_rsi_os': 31, 'bear_rsi_ob': 90, 'bear_adx_thresh': 33.52619041331569, 'bear_atr_min_pct': 0.002609543418064325, 'bear_atr_max_pct': 0.09050479855041178, 'bear_tp_mult': 2.888760814902859, 'bear_tsl_mult': 0.2114862449790709, 'bear_time_stop': 136, 'bear_use_sma': True, 'bear_use_ema': True, 'bear_use_atr': False, 'bear_use_adx': False, 'bear_use_spike': True, 'bear_rsi_required': True, 'sideways_strategy': 'breakout', 'sideways_bb_std_mult': 3.3225149638693345, 'sideways_rsi_os': 39, 'sideways_rsi_ob': 72, 'sideways_adx_thresh': 26.184640237772925, 'sideways_atr_min_pct': 0.01690063315087095, 'sideways_atr_max_pct': 0.08635576380754768, 'sideways_tp_mult': 2.4375500136052284, 'sideways_tsl_mult': 0.6023273749058169, 'sideways_time_stop': 163, 'sideways_use_sma': True, 'sideways_use_ema': False, 'sideways_use_atr': True, 'sideways_use_adx': False, 'sideways_use_spike': False, 'sideways_rsi_required': True}.
[I 2025-09-01 07:36:02,063] Trial 99 finished with values: [-1000000000.0, 1000000000.0] and parameters: {'p_sma': 55, 'p_std': 54, 'p_atr': 9, 'p_adx': 26, 'rsi_period': 46, 'ema1': 19, 'ema2': 57, 'slip_atr_k': 0.018377751232962383, 'slip_spread_k': 0.623273942014384, 'spread_hl_frac': 0.046396616547549785, 'bb_std_mult': 2.017718140012845, 'rsi_os': 46, 'rsi_ob': 70, 'vol_spike': 0.22836249132856884, 'adx_thresh': 22.878310566975436, 'atr_min_pct': 0.009984473162685688, 'atr_max_pct': 0.023622274119927386, 'tp_mult': 1.3968504397464279, 'tsl_mult': 0.23814490665139904, 'strategy': 'breakout', 'time_stop': 49, 'use_sma': False, 'use_atr': True, 'use_adx': True, 'use_ema': True, 'use_spike': True, 'rsi_required': True, 'edge_k': 0.8617556485661706, 'edge_cap': 0.42135435652985986, 'bull_strategy': 'mean_reversion', 'bull_bb_std_mult': 1.0887204775441344, 'bull_rsi_os': 18, 'bull_rsi_ob': 51, 'bull_adx_thresh': 15.287379999795371, 'bull_atr_min_pct': 0.027899897170571723, 'bull_atr_max_pct': 0.013913894228081203, 'bull_tp_mult': 2.1656521523504533, 'bull_tsl_mult': 0.7995375771564341, 'bull_time_stop': 251, 'bull_use_sma': True, 'bull_use_ema': False, 'bull_use_atr': False, 'bull_use_adx': False, 'bull_use_spike': True, 'bull_rsi_required': True, 'bear_strategy': 'breakout', 'bear_bb_std_mult': 2.852709865519033, 'bear_rsi_os': 19, 'bear_rsi_ob': 47, 'bear_adx_thresh': 13.535399626359892, 'bear_atr_min_pct': 0.012595934089185922, 'bear_atr_max_pct': 0.11332292921830482, 'bear_tp_mult': 1.1247354975715522, 'bear_tsl_mult': 0.22195735445869108, 'bear_time_stop': 117, 'bear_use_sma': True, 'bear_use_ema': True, 'bear_use_atr': False, 'bear_use_adx': False, 'bear_use_spike': True, 'bear_rsi_required': False, 'sideways_strategy': 'mean_reversion', 'sideways_bb_std_mult': 1.56972653854625, 'sideways_rsi_os': 25, 'sideways_rsi_ob': 71, 'sideways_adx_thresh': 27.662384174925027, 'sideways_atr_min_pct': 0.017093541827352822, 'sideways_atr_max_pct': 0.06917807273378052, 'sideways_tp_mult': 2.186396986906013, 'sideways_tsl_mult': 0.4048492182963169, 'sideways_time_stop': 167, 'sideways_use_sma': True, 'sideways_use_ema': False, 'sideways_use_atr': False, 'sideways_use_adx': False, 'sideways_use_spike': True, 'sideways_rsi_required': True}.
[I 2025-09-01 07:36:03,679] Trial 100 finished with values: [-1000000000.0, 1000000000.0] and parameters: {'p_sma': 51, 'p_std': 55, 'p_atr': 22, 'p_adx': 26, 'rsi_period': 50, 'ema1': 19, 'ema2': 56, 'slip_atr_k': 0.23571627203086373, 'slip_spread_k': 0.6214320126898019, 'spread_hl_frac': 0.04605696858988483, 'bb_std_mult': 2.035485151876334, 'rsi_os': 45, 'rsi_ob': 52, 'vol_spike': 0.07723043949590182, 'adx_thresh': 20.611331728425405, 'atr_min_pct': 0.009886112620552516, 'atr_max_pct': 0.13924024369054855, 'tp_mult': 2.1644395494084105, 'tsl_mult': 0.2602520967341112, 'strategy': 'breakout', 'time_stop': 212, 'use_sma': False, 'use_atr': False, 'use_adx': True, 'use_ema': False, 'use_spike': False, 'rsi_required': True, 'edge_k': 0.7834299947023714, 'edge_cap': 0.8405375448282872, 'bull_strategy': 'mean_reversion', 'bull_bb_std_mult': 2.179827706766688, 'bull_rsi_os': 53, 'bull_rsi_ob': 76, 'bull_adx_thresh': 12.667010419459793, 'bull_atr_min_pct': 0.005784434910672912, 'bull_atr_max_pct': 0.07687398131174045, 'bull_tp_mult': 2.3498906728200857, 'bull_tsl_mult': 0.6996238746122077, 'bull_time_stop': 174, 'bull_use_sma': True, 'bull_use_ema': True, 'bull_use_atr': False, 'bull_use_adx': False, 'bull_use_spike': True, 'bull_rsi_required': True, 'bear_strategy': 'breakout', 'bear_bb_std_mult': 2.47852593850062, 'bear_rsi_os': 18, 'bear_rsi_ob': 83, 'bear_adx_thresh': 11.840555907400894, 'bear_atr_min_pct': 0.01265849352332227, 'bear_atr_max_pct': 0.11974432928075282, 'bear_tp_mult': 2.482044374603385, 'bear_tsl_mult': 0.206532280050917, 'bear_time_stop': 250, 'bear_use_sma': True, 'bear_use_ema': True, 'bear_use_atr': False, 'bear_use_adx': False, 'bear_use_spike': True, 'bear_rsi_required': True, 'sideways_strategy': 'mean_reversion', 'sideways_bb_std_mult': 1.55403120280087, 'sideways_rsi_os': 33, 'sideways_rsi_ob': 71, 'sideways_adx_thresh': 26.335432030283563, 'sideways_atr_min_pct': 0.002193336516457073, 'sideways_atr_max_pct': 0.1232384866816049, 'sideways_tp_mult': 2.749513688942969, 'sideways_tsl_mult': 0.771109134244938, 'sideways_time_stop': 209, 'sideways_use_sma': True, 'sideways_use_ema': False, 'sideways_use_atr': False, 'sideways_use_adx': True, 'sideways_use_spike': True, 'sideways_rsi_required': True}.
[I 2025-09-01 07:36:03,684] Trial 105 finished with values: [-1000000000.0, 1000000000.0] and parameters: {'p_sma': 22, 'p_std': 29, 'p_atr': 22, 'p_adx': 28, 'rsi_period': 77, 'ema1': 10, 'ema2': 37, 'slip_atr_k': 0.02868007758849697, 'slip_spread_k': 0.692635641657393, 'spread_hl_frac': 0.005112405113581811, 'bb_std_mult': 1.90950375636354, 'rsi_os': 33, 'rsi_ob': 46, 'vol_spike': 0.033023811444298945, 'adx_thresh': 20.52447799299168, 'atr_min_pct': 0.02712418122437843, 'atr_max_pct': 0.14613896385108896, 'tp_mult': 1.265733094193957, 'tsl_mult': 0.0727298913430846, 'strategy': 'mean_reversion', 'time_stop': 91, 'use_sma': True, 'use_atr': False, 'use_adx': False, 'use_ema': False, 'use_spike': False, 'rsi_required': False, 'edge_k': 0.9385673133092428, 'edge_cap': 0.17137285092361876, 'bull_strategy': 'breakout', 'bull_bb_std_mult': 1.2803931912718451, 'bull_rsi_os': 24, 'bull_rsi_ob': 45, 'bull_adx_thresh': 10.412663204819001, 'bull_atr_min_pct': 0.022737036022607137, 'bull_atr_max_pct': 0.0518514319678553, 'bull_tp_mult': 2.049770455032854, 'bull_tsl_mult': 0.0003205257311996723, 'bull_time_stop': 220, 'bull_use_sma': False, 'bull_use_ema': True, 'bull_use_atr': False, 'bull_use_adx': False, 'bull_use_spike': True, 'bull_rsi_required': False, 'bear_strategy': 'breakout', 'bear_bb_std_mult': 2.4061697592838516, 'bear_rsi_os': 15, 'bear_rsi_ob': 92, 'bear_adx_thresh': 31.220592432375245, 'bear_atr_min_pct': 0.0022301333427088028, 'bear_atr_max_pct': 0.12316904835252207, 'bear_tp_mult': 2.4874441588098444, 'bear_tsl_mult': 0.6595793975378401, 'bear_time_stop': 266, 'bear_use_sma': True, 'bear_use_ema': True, 'bear_use_atr': True, 'bear_use_adx': False, 'bear_use_spike': False, 'bear_rsi_required': True, 'sideways_strategy': 'breakout', 'sideways_bb_std_mult': 2.2159737864541, 'sideways_rsi_os': 29, 'sideways_rsi_ob': 76, 'sideways_adx_thresh': 6.823761978427237, 'sideways_atr_min_pct': 0.0023944173361883196, 'sideways_atr_max_pct': 0.09149347532333972, 'sideways_tp_mult': 2.0157671569611417, 'sideways_tsl_mult': 0.5333635697019458, 'sideways_time_stop': 156, 'sideways_use_sma': True, 'sideways_use_ema': False, 'sideways_use_atr': True, 'sideways_use_adx': True, 'sideways_use_spike': False, 'sideways_rsi_required': True}.
[I 2025-09-01 07:36:47,613] Trial 104 finished with values: [-1000000000.0, 1000000000.0] and parameters: {'p_sma': 22, 'p_std': 33, 'p_atr': 22, 'p_adx': 29, 'rsi_period': 50, 'ema1': 19, 'ema2': 15, 'slip_atr_k': 0.012011470024575893, 'slip_spread_k': 0.1638026385098008, 'spread_hl_frac': 0.04341508422795656, 'bb_std_mult': 1.930732780428515, 'rsi_os': 28, 'rsi_ob': 46, 'vol_spike': 0.22694199278593039, 'adx_thresh': 21.910362933019414, 'atr_min_pct': 0.020179917980489136, 'atr_max_pct': 0.14571510679493171, 'tp_mult': 1.396592668786523, 'tsl_mult': 0.5236479073568313, 'strategy': 'breakout', 'time_stop': 116, 'use_sma': True, 'use_atr': False, 'use_adx': False, 'use_ema': True, 'use_spike': False, 'rsi_required': True, 'edge_k': 0.939759306090759, 'edge_cap': 0.19571665632703172, 'bull_strategy': 'breakout', 'bull_bb_std_mult': 1.2895799264168095, 'bull_rsi_os': 18, 'bull_rsi_ob': 84, 'bull_adx_thresh': 10.189606288455009, 'bull_atr_min_pct': 0.023722642687540183, 'bull_atr_max_pct': 0.05118861446799969, 'bull_tp_mult': 2.1717670011410326, 'bull_tsl_mult': 0.7040103262092854, 'bull_time_stop': 166, 'bull_use_sma': False, 'bull_use_ema': True, 'bull_use_atr': False, 'bull_use_adx': False, 'bull_use_spike': True, 'bull_rsi_required': True, 'bear_strategy': 'breakout', 'bear_bb_std_mult': 1.937818708615361, 'bear_rsi_os': 37, 'bear_rsi_ob': 94, 'bear_adx_thresh': 31.226980285949786, 'bear_atr_min_pct': 0.012653727024682059, 'bear_atr_max_pct': 0.12391352630991899, 'bear_tp_mult': 1.1057753656223666, 'bear_tsl_mult': 0.9553607654898183, 'bear_time_stop': 102, 'bear_use_sma': True, 'bear_use_ema': True, 'bear_use_atr': False, 'bear_use_adx': False, 'bear_use_spike': False, 'bear_rsi_required': True, 'sideways_strategy': 'breakout', 'sideways_bb_std_mult': 3.265912042860883, 'sideways_rsi_os': 29, 'sideways_rsi_ob': 70, 'sideways_adx_thresh': 27.38959715584579, 'sideways_atr_min_pct': 0.016996803427163906, 'sideways_atr_max_pct': 0.04437746044207331, 'sideways_tp_mult': 1.616082815062605, 'sideways_tsl_mult': 0.4719578084505594, 'sideways_time_stop': 158, 'sideways_use_sma': True, 'sideways_use_ema': False, 'sideways_use_atr': True, 'sideways_use_adx': False, 'sideways_use_spike': False, 'sideways_rsi_required': True}.
[I 2025-09-01 07:36:48,014] Trial 103 finished with values: [-1000000000.0, 1000000000.0] and parameters: {'p_sma': 23, 'p_std': 29, 'p_atr': 11, 'p_adx': 29, 'rsi_period': 77, 'ema1': 19, 'ema2': 59, 'slip_atr_k': 0.028252379728649177, 'slip_spread_k': 0.9112768278308769, 'spread_hl_frac': 0.04864187565282031, 'bb_std_mult': 1.9974664533554198, 'rsi_os': 45, 'rsi_ob': 90, 'vol_spike': 0.22883963349570446, 'adx_thresh': 12.23297654310493, 'atr_min_pct': 0.019498963858132976, 'atr_max_pct': 0.1463648775428611, 'tp_mult': 2.1727681460439743, 'tsl_mult': 0.22147261993907147, 'strategy': 'breakout', 'time_stop': 142, 'use_sma': False, 'use_atr': False, 'use_adx': False, 'use_ema': True, 'use_spike': False, 'rsi_required': False, 'edge_k': 0.9394759355770242, 'edge_cap': 0.973698227379404, 'bull_strategy': 'mean_reversion', 'bull_bb_std_mult': 1.3063200866727638, 'bull_rsi_os': 18, 'bull_rsi_ob': 51, 'bull_adx_thresh': 13.44646134268203, 'bull_atr_min_pct': 0.021055898145774354, 'bull_atr_max_pct': 0.0777462054486241, 'bull_tp_mult': 2.1796111784975554, 'bull_tsl_mult': 0.7557459055124562, 'bull_time_stop': 60, 'bull_use_sma': False, 'bull_use_ema': True, 'bull_use_atr': False, 'bull_use_adx': False, 'bull_use_spike': True, 'bull_rsi_required': True, 'bear_strategy': 'breakout', 'bear_bb_std_mult': 2.398457814361996, 'bear_rsi_os': 20, 'bear_rsi_ob': 83, 'bear_adx_thresh': 31.180188108297887, 'bear_atr_min_pct': 0.02822341352248761, 'bear_atr_max_pct': 0.024157268962561804, 'bear_tp_mult': 2.9019713909597593, 'bear_tsl_mult': 0.9163938989543052, 'bear_time_stop': 103, 'bear_use_sma': True, 'bear_use_ema': True, 'bear_use_atr': False, 'bear_use_adx': False, 'bear_use_spike': False, 'bear_rsi_required': True, 'sideways_strategy': 'breakout', 'sideways_bb_std_mult': 1.1764000476759087, 'sideways_rsi_os': 33, 'sideways_rsi_ob': 70, 'sideways_adx_thresh': 27.634446632777262, 'sideways_atr_min_pct': 0.01745293278016584, 'sideways_atr_max_pct': 0.06965010955208902, 'sideways_tp_mult': 2.486956169101071, 'sideways_tsl_mult': 0.828939904860673, 'sideways_time_stop': 214, 'sideways_use_sma': True, 'sideways_use_ema': False, 'sideways_use_atr': True, 'sideways_use_adx': False, 'sideways_use_spike': False, 'sideways_rsi_required': True}.
[I 2025-09-01 07:36:48,500] Trial 107 finished with values: [-1000000000.0, 1000000000.0] and parameters: {'p_sma': 23, 'p_std': 32, 'p_atr': 15, 'p_adx': 13, 'rsi_period': 52, 'ema1': 9, 'ema2': 18, 'slip_atr_k': 0.007945153462910345, 'slip_spread_k': 0.7167270514499828, 'spread_hl_frac': 0.01479694307240593, 'bb_std_mult': 1.3293931277373083, 'rsi_os': 28, 'rsi_ob': 60, 'vol_spike': 0.24971061633550035, 'adx_thresh': 21.711159359739323, 'atr_min_pct': 0.025613765884939924, 'atr_max_pct': 0.1275356906431609, 'tp_mult': 1.0566083056706406, 'tsl_mult': 0.1241510312789624, 'strategy': 'mean_reversion', 'time_stop': 115, 'use_sma': True, 'use_atr': False, 'use_adx': True, 'use_ema': True, 'use_spike': False, 'rsi_required': True, 'edge_k': 1.4220853351197758, 'edge_cap': 0.8831531649192425, 'bull_strategy': 'breakout', 'bull_bb_std_mult': 1.3580315888833188, 'bull_rsi_os': 48, 'bull_rsi_ob': 85, 'bull_adx_thresh': 11.661163751238673, 'bull_atr_min_pct': 0.0243875788553149, 'bull_atr_max_pct': 0.11499682512850215, 'bull_tp_mult': 2.1965343565343085, 'bull_tsl_mult': 0.5609778775969596, 'bull_time_stop': 296, 'bull_use_sma': True, 'bull_use_ema': True, 'bull_use_atr': False, 'bull_use_adx': False, 'bull_use_spike': True, 'bull_rsi_required': False, 'bear_strategy': 'breakout', 'bear_bb_std_mult': 3.0770230916155015, 'bear_rsi_os': 37, 'bear_rsi_ob': 93, 'bear_adx_thresh': 12.237190613787652, 'bear_atr_min_pct': 0.024841183947201792, 'bear_atr_max_pct': 0.09979868324637481, 'bear_tp_mult': 2.8458385513948996, 'bear_tsl_mult': 0.7300561111638181, 'bear_time_stop': 51, 'bear_use_sma': True, 'bear_use_ema': False, 'bear_use_atr': False, 'bear_use_adx': False, 'bear_use_spike': False, 'bear_rsi_required': False, 'sideways_strategy': 'breakout', 'sideways_bb_std_mult': 3.3841097595366114, 'sideways_rsi_os': 54, 'sideways_rsi_ob': 80, 'sideways_adx_thresh': 33.853696545587916, 'sideways_atr_min_pct': 0.026034677210863773, 'sideways_atr_max_pct': 0.019925298587768453, 'sideways_tp_mult': 1.9130937817467113, 'sideways_tsl_mult': 0.5995961625887896, 'sideways_time_stop': 176, 'sideways_use_sma': True, 'sideways_use_ema': False, 'sideways_use_atr': True, 'sideways_use_adx': True, 'sideways_use_spike': True, 'sideways_rsi_required': True}.
[I 2025-09-01 07:36:49,020] Trial 106 finished with values: [-1000000000.0, 1000000000.0] and parameters: {'p_sma': 26, 'p_std': 33, 'p_atr': 15, 'p_adx': 29, 'rsi_period': 52, 'ema1': 11, 'ema2': 18, 'slip_atr_k': 0.010789454185814791, 'slip_spread_k': 0.7159130103469664, 'spread_hl_frac': 0.024198564282512304, 'bb_std_mult': 1.5034257506010977, 'rsi_os': 24, 'rsi_ob': 58, 'vol_spike': 0.2533034738899376, 'adx_thresh': 19.277151097648556, 'atr_min_pct': 0.019782656298674674, 'atr_max_pct': 0.12962221500425597, 'tp_mult': 1.0560043959853873, 'tsl_mult': 0.16829326871575975, 'strategy': 'mean_reversion', 'time_stop': 142, 'use_sma': True, 'use_atr': False, 'use_adx': True, 'use_ema': True, 'use_spike': False, 'rsi_required': True, 'edge_k': 1.0942710538024076, 'edge_cap': 0.9147352832518089, 'bull_strategy': 'breakout', 'bull_bb_std_mult': 1.3222935537615466, 'bull_rsi_os': 7, 'bull_rsi_ob': 73, 'bull_adx_thresh': 8.219796007830071, 'bull_atr_min_pct': 0.020351676093592397, 'bull_atr_max_pct': 0.06929792114052741, 'bull_tp_mult': 2.2799682737133615, 'bull_tsl_mult': 0.7538096694117298, 'bull_time_stop': 288, 'bull_use_sma': True, 'bull_use_ema': True, 'bull_use_atr': False, 'bull_use_adx': False, 'bull_use_spike': True, 'bull_rsi_required': False, 'bear_strategy': 'breakout', 'bear_bb_std_mult': 2.287662812740615, 'bear_rsi_os': 26, 'bear_rsi_ob': 93, 'bear_adx_thresh': 11.951013129740147, 'bear_atr_min_pct': 0.02499474998784585, 'bear_atr_max_pct': 0.022830742145511146, 'bear_tp_mult': 2.597206664234831, 'bear_tsl_mult': 0.929294104441694, 'bear_time_stop': 104, 'bear_use_sma': True, 'bear_use_ema': False, 'bear_use_atr': False, 'bear_use_adx': False, 'bear_use_spike': False, 'bear_rsi_required': False, 'sideways_strategy': 'breakout', 'sideways_bb_std_mult': 2.80839549153669, 'sideways_rsi_os': 31, 'sideways_rsi_ob': 80, 'sideways_adx_thresh': 29.247980707254925, 'sideways_atr_min_pct': 0.026026557777643882, 'sideways_atr_max_pct': 0.017224598864708826, 'sideways_tp_mult': 2.480461339417617, 'sideways_tsl_mult': 0.4611225957812768, 'sideways_time_stop': 158, 'sideways_use_sma': True, 'sideways_use_ema': False, 'sideways_use_atr': True, 'sideways_use_adx': True, 'sideways_use_spike': True, 'sideways_rsi_required': True}.
