[I 2025-09-01 08:57:52,753] Trial 596 finished with values: [-0.05246432844608229, 0.05281029715440008] and parameters: {'p_sma': 23, 'p_std': 16, 'p_atr': 16, 'p_adx': 20, 'rsi_period': 40, 'ema1': 8, 'ema2': 13, 'slip_atr_k': 0.1409199842673971, 'slip_spread_k': 0.33961292290125483, 'spread_hl_frac': 0.04257840362485353, 'bb_std_mult': 3.3532511447821896, 'rsi_os': 24, 'rsi_ob': 90, 'vol_spike': 0.10214884496088171, 'adx_thresh': 14.169468065078288, 'atr_min_pct': 0.00949266593948179, 'atr_max_pct': 0.14989824960531245, 'tp_mult': 1.6180854654864245, 'tsl_mult': 0.8717837772547163, 'strategy': 'breakout', 'time_stop': 195, 'use_sma': True, 'use_atr': False, 'use_adx': True, 'use_ema': False, 'use_spike': True, 'rsi_required': True, 'edge_k': 1.019464499256788, 'edge_cap': 0.26236183123399265, 'bull_strategy': 'breakout', 'bull_bb_std_mult': 2.8318439979975416, 'bull_rsi_os': 12, 'bull_rsi_ob': 82, 'bull_adx_thresh': 24.437257310767613, 'bull_atr_min_pct': 0.003080499267784857, 'bull_atr_max_pct': 0.033116185268079044, 'bull_tp_mult': 2.1677390474087934, 'bull_tsl_mult': 0.6722490567240308, 'bull_time_stop': 286, 'bull_use_sma': True, 'bull_use_ema': True, 'bull_use_atr': False, 'bull_use_adx': True, 'bull_use_spike': True, 'bull_rsi_required': False, 'bear_strategy': 'mean_reversion', 'bear_bb_std_mult': 3.5050383069497526, 'bear_rsi_os': 24, 'bear_rsi_ob': 91, 'bear_adx_thresh': 30.63093682500534, 'bear_atr_min_pct': 0.007552906987258938, 'bear_atr_max_pct': 0.075551036107587, 'bear_tp_mult': 1.992523894541536, 'bear_tsl_mult': 0.8617321706117798, 'bear_time_stop': 78, 'bear_use_sma': False, 'bear_use_ema': False, 'bear_use_atr': True, 'bear_use_adx': True, 'bear_use_spike': True, 'bear_rsi_required': False, 'sideways_strategy': 'breakout', 'sideways_bb_std_mult': 0.7160676767655966, 'sideways_rsi_os': 46, 'sideways_rsi_ob': 66, 'sideways_adx_thresh': 21.22540583922857, 'sideways_atr_min_pct': 0.01691118240588504, 'sideways_atr_max_pct': 0.10652725088564015, 'sideways_tp_mult': 2.5469044840850015, 'sideways_tsl_mult': 0.1447783492818094, 'sideways_time_stop': 74, 'sideways_use_sma': True, 'sideways_use_ema': False, 'sideways_use_atr': False, 'sideways_use_adx': True, 'sideways_use_spike': True, 'sideways_rsi_required': False}.
[I 2025-09-01 08:57:53,153] Trial 594 finished with values: [-1000000000.0, 1000000000.0] and parameters: {'p_sma': 23, 'p_std': 33, 'p_atr': 18, 'p_adx': 20, 'rsi_period': 19, 'ema1': 9, 'ema2': 40, 'slip_atr_k': 0.24151715268897195, 'slip_spread_k': 0.9775034969250176, 'spread_hl_frac': 0.041709745975974266, 'bb_std_mult': 3.5263058603525277, 'rsi_os': 24, 'rsi_ob': 57, 'vol_spike': 0.019294718741410644, 'adx_thresh': 28.36074596855189, 'atr_min_pct': 0.0250783851970768, 'atr_max_pct': 0.04748088214047933, 'tp_mult': 2.29576294730271, 'tsl_mult': 0.8790158321051975, 'strategy': 'mean_reversion', 'time_stop': 242, 'use_sma': False, 'use_atr': True, 'use_adx': True, 'use_ema': False, 'use_spike': True, 'rsi_required': True, 'edge_k': 0.9409296943399793, 'edge_cap': 0.08506781598105084, 'bull_strategy': 'mean_reversion', 'bull_bb_std_mult': 2.460981452430105, 'bull_rsi_os': 5, 'bull_rsi_ob': 46, 'bull_adx_thresh': 9.05016709882466, 'bull_atr_min_pct': 0.006910252505523882, 'bull_atr_max_pct': 0.13875888351935012, 'bull_tp_mult': 1.4032479518128156, 'bull_tsl_mult': 0.15430860069515773, 'bull_time_stop': 172, 'bull_use_sma': True, 'bull_use_ema': False, 'bull_use_atr': False, 'bull_use_adx': True, 'bull_use_spike': True, 'bull_rsi_required': False, 'bear_strategy': 'mean_reversion', 'bear_bb_std_mult': 2.9945430858813062, 'bear_rsi_os': 24, 'bear_rsi_ob': 76, 'bear_adx_thresh': 32.48214357095155, 'bear_atr_min_pct': 0.02239015573221961, 'bear_atr_max_pct': 0.07563601020706005, 'bear_tp_mult': 2.02215959674942, 'bear_tsl_mult': 0.08445874721957802, 'bear_time_stop': 99, 'bear_use_sma': False, 'bear_use_ema': False, 'bear_use_atr': True, 'bear_use_adx': True, 'bear_use_spike': True, 'bear_rsi_required': False, 'sideways_strategy': 'mean_reversion', 'sideways_bb_std_mult': 0.6345865207854967, 'sideways_rsi_os': 35, 'sideways_rsi_ob': 64, 'sideways_adx_thresh': 8.444726037615059, 'sideways_atr_min_pct': 0.013134042477506033, 'sideways_atr_max_pct': 0.03274451489292954, 'sideways_tp_mult': 2.498857832437802, 'sideways_tsl_mult': 0.4857201923603598, 'sideways_time_stop': 274, 'sideways_use_sma': False, 'sideways_use_ema': True, 'sideways_use_atr': False, 'sideways_use_adx': False, 'sideways_use_spike': True, 'sideways_rsi_required': False}.
[I 2025-09-01 08:57:53,332] Trial 593 finished with values: [-1000000000.0, 1000000000.0] and parameters: {'p_sma': 21, 'p_std': 14, 'p_atr': 26, 'p_adx': 7, 'rsi_period': 61, 'ema1': 8, 'ema2': 13, 'slip_atr_k': 0.05830978988307475, 'slip_spread_k': 0.04718038245018097, 'spread_hl_frac': 0.04222634515231516, 'bb_std_mult': 1.006003881381864, 'rsi_os': 25, 'rsi_ob': 70, 'vol_spike': 0.02730885973995127, 'adx_thresh': 15.489587234904242, 'atr_min_pct': 0.02054391518841917, 'atr_max_pct': 0.1454468606969408, 'tp_mult': 1.6122335042202254, 'tsl_mult': 0.9607940480443636, 'strategy': 'mean_reversion', 'time_stop': 257, 'use_sma': False, 'use_atr': True, 'use_adx': True, 'use_ema': False, 'use_spike': True, 'rsi_required': True, 'edge_k': 1.51386385060297, 'edge_cap': 0.47620569024890963, 'bull_strategy': 'mean_reversion', 'bull_bb_std_mult': 0.993045233818997, 'bull_rsi_os': 52, 'bull_rsi_ob': 95, 'bull_adx_thresh': 8.88660845363999, 'bull_atr_min_pct': 0.00612225218201563, 'bull_atr_max_pct': 0.03853257543847771, 'bull_tp_mult': 2.1749499390685036, 'bull_tsl_mult': 0.6928145791470378, 'bull_time_stop': 172, 'bull_use_sma': True, 'bull_use_ema': False, 'bull_use_atr': False, 'bull_use_adx': True, 'bull_use_spike': True, 'bull_rsi_required': False, 'bear_strategy': 'mean_reversion', 'bear_bb_std_mult': 1.0910952168803831, 'bear_rsi_os': 37, 'bear_rsi_ob': 71, 'bear_adx_thresh': 32.25769203340987, 'bear_atr_min_pct': 0.0217372396740391, 'bear_atr_max_pct': 0.02229473514533297, 'bear_tp_mult': 2.559167891035211, 'bear_tsl_mult': 0.9299233664269663, 'bear_time_stop': 239, 'bear_use_sma': False, 'bear_use_ema': False, 'bear_use_atr': True, 'bear_use_adx': True, 'bear_use_spike': True, 'bear_rsi_required': False, 'sideways_strategy': 'mean_reversion', 'sideways_bb_std_mult': 0.596543355189867, 'sideways_rsi_os': 25, 'sideways_rsi_ob': 49, 'sideways_adx_thresh': 28.183264216059143, 'sideways_atr_min_pct': 0.024520227186644563, 'sideways_atr_max_pct': 0.032910430831828194, 'sideways_tp_mult': 1.4428270489152581, 'sideways_tsl_mult': 0.24861763630908829, 'sideways_time_stop': 249, 'sideways_use_sma': False, 'sideways_use_ema': True, 'sideways_use_atr': False, 'sideways_use_adx': False, 'sideways_use_spike': True, 'sideways_rsi_required': False}.
[I 2025-09-01 08:58:26,659] Trial 598 finished with values: [-1000000000.0, 1000000000.0] and parameters: {'p_sma': 20, 'p_std': 30, 'p_atr': 13, 'p_adx': 7, 'rsi_period': 45, 'ema1': 12, 'ema2': 45, 'slip_atr_k': 0.07997601344320443, 'slip_spread_k': 0.7551270412245433, 'spread_hl_frac': 0.02116502652653936, 'bb_std_mult': 2.2444083830101844, 'rsi_os': 26, 'rsi_ob': 57, 'vol_spike': 0.027236891404763625, 'adx_thresh': 24.319396429113414, 'atr_min_pct': 0.01699750023699601, 'atr_max_pct': 0.1499916829651172, 'tp_mult': 1.0592616850433823, 'tsl_mult': 0.4885955078905106, 'strategy': 'mean_reversion', 'time_stop': 34, 'use_sma': True, 'use_atr': True, 'use_adx': False, 'use_ema': True, 'use_spike': False, 'rsi_required': True, 'edge_k': 0.9502413027781769, 'edge_cap': 0.05180612370583104, 'bull_strategy': 'breakout', 'bull_bb_std_mult': 2.7423614463479957, 'bull_rsi_os': 54, 'bull_rsi_ob': 84, 'bull_adx_thresh': 14.83303283918735, 'bull_atr_min_pct': 0.005757714030207399, 'bull_atr_max_pct': 0.062488876738161406, 'bull_tp_mult': 1.5498978570520876, 'bull_tsl_mult': 0.7007618145371922, 'bull_time_stop': 114, 'bull_use_sma': False, 'bull_use_ema': False, 'bull_use_atr': False, 'bull_use_adx': True, 'bull_use_spike': True, 'bull_rsi_required': True, 'bear_strategy': 'mean_reversion', 'bear_bb_std_mult': 3.3518398893693235, 'bear_rsi_os': 15, 'bear_rsi_ob': 74, 'bear_adx_thresh': 29.64850403932797, 'bear_atr_min_pct': 0.011797108932652081, 'bear_atr_max_pct': 0.024077975341988973, 'bear_tp_mult': 2.760028205418936, 'bear_tsl_mult': 0.9886293547717011, 'bear_time_stop': 100, 'bear_use_sma': False, 'bear_use_ema': False, 'bear_use_atr': False, 'bear_use_adx': True, 'bear_use_spike': False, 'bear_rsi_required': False, 'sideways_strategy': 'mean_reversion', 'sideways_bb_std_mult': 0.6325668215808022, 'sideways_rsi_os': 52, 'sideways_rsi_ob': 63, 'sideways_adx_thresh': 9.117817576077998, 'sideways_atr_min_pct': 0.013544501397152828, 'sideways_atr_max_pct': 0.029530653413237226, 'sideways_tp_mult': 2.5180918192004835, 'sideways_tsl_mult': 0.07508123918496504, 'sideways_time_stop': 36, 'sideways_use_sma': False, 'sideways_use_ema': False, 'sideways_use_atr': False, 'sideways_use_adx': True, 'sideways_use_spike': False, 'sideways_rsi_required': False}.
[I 2025-09-01 08:58:27,363] Trial 599 finished with values: [-1000000000.0, 1000000000.0] and parameters: {'p_sma': 43, 'p_std': 17, 'p_atr': 13, 'p_adx': 9, 'rsi_period': 45, 'ema1': 17, 'ema2': 19, 'slip_atr_k': 0.05819372668314368, 'slip_spread_k': 0.6677641447932657, 'spread_hl_frac': 0.021249306669845217, 'bb_std_mult': 3.33722028237995, 'rsi_os': 26, 'rsi_ob': 83, 'vol_spike': 0.24000909308784035, 'adx_thresh': 24.282823407184644, 'atr_min_pct': 0.020541169946951026, 'atr_max_pct': 0.03329200806361353, 'tp_mult': 1.0693835250354584, 'tsl_mult': 0.5346233997191121, 'strategy': 'mean_reversion', 'time_stop': 109, 'use_sma': True, 'use_atr': True, 'use_adx': False, 'use_ema': True, 'use_spike': False, 'rsi_required': True, 'edge_k': 1.6477841170632181, 'edge_cap': 0.05103933012523997, 'bull_strategy': 'breakout', 'bull_bb_std_mult': 2.727687757036127, 'bull_rsi_os': 12, 'bull_rsi_ob': 72, 'bull_adx_thresh': 14.043271735464511, 'bull_atr_min_pct': 0.005969957914319745, 'bull_atr_max_pct': 0.13358367710409402, 'bull_tp_mult': 1.5541077023924412, 'bull_tsl_mult': 0.7003232301599256, 'bull_time_stop': 147, 'bull_use_sma': False, 'bull_use_ema': False, 'bull_use_atr': False, 'bull_use_adx': True, 'bull_use_spike': True, 'bull_rsi_required': True, 'bear_strategy': 'mean_reversion', 'bear_bb_std_mult': 1.0543169744057295, 'bear_rsi_os': 7, 'bear_rsi_ob': 94, 'bear_adx_thresh': 32.45588072162368, 'bear_atr_min_pct': 0.013820316817779597, 'bear_atr_max_pct': 0.08276979363128292, 'bear_tp_mult': 2.6584775557064644, 'bear_tsl_mult': 0.9317690391216518, 'bear_time_stop': 79, 'bear_use_sma': False, 'bear_use_ema': False, 'bear_use_atr': False, 'bear_use_adx': True, 'bear_use_spike': False, 'bear_rsi_required': False, 'sideways_strategy': 'mean_reversion', 'sideways_bb_std_mult': 0.7902786079724842, 'sideways_rsi_os': 43, 'sideways_rsi_ob': 82, 'sideways_adx_thresh': 9.201684636862653, 'sideways_atr_min_pct': 0.009380863776765322, 'sideways_atr_max_pct': 0.028294563119753598, 'sideways_tp_mult': 2.5794422217521116, 'sideways_tsl_mult': 0.9835501924886795, 'sideways_time_stop': 289, 'sideways_use_sma': False, 'sideways_use_ema': False, 'sideways_use_atr': True, 'sideways_use_adx': True, 'sideways_use_spike': False, 'sideways_rsi_required': False}.
[I 2025-09-01 08:58:28,200] Trial 597 finished with values: [-1000000000.0, 1000000000.0] and parameters: {'p_sma': 43, 'p_std': 53, 'p_atr': 13, 'p_adx': 29, 'rsi_period': 61, 'ema1': 13, 'ema2': 10, 'slip_atr_k': 0.1933701753515431, 'slip_spread_k': 0.5830592238582275, 'spread_hl_frac': 0.02133679861418731, 'bb_std_mult': 2.239073565073644, 'rsi_os': 25, 'rsi_ob': 92, 'vol_spike': 0.027784296393429733, 'adx_thresh': 5.85744558261605, 'atr_min_pct': 0.02309213296253394, 'atr_max_pct': 0.14782193518987283, 'tp_mult': 2.2886087284244003, 'tsl_mult': 0.9657798777270228, 'strategy': 'mean_reversion', 'time_stop': 238, 'use_sma': True, 'use_atr': True, 'use_adx': True, 'use_ema': False, 'use_spike': False, 'rsi_required': True, 'edge_k': 1.5218462106035138, 'edge_cap': 0.4753855948920548, 'bull_strategy': 'breakout', 'bull_bb_std_mult': 2.7215663123024423, 'bull_rsi_os': 12, 'bull_rsi_ob': 58, 'bull_adx_thresh': 17.077484790577074, 'bull_atr_min_pct': 0.005786430503167092, 'bull_atr_max_pct': 0.1326699040812731, 'bull_tp_mult': 2.1842549266874163, 'bull_tsl_mult': 0.6958618821573881, 'bull_time_stop': 79, 'bull_use_sma': True, 'bull_use_ema': False, 'bull_use_atr': False, 'bull_use_adx': True, 'bull_use_spike': True, 'bull_rsi_required': True, 'bear_strategy': 'mean_reversion', 'bear_bb_std_mult': 3.0786084823099094, 'bear_rsi_os': 24, 'bear_rsi_ob': 82, 'bear_adx_thresh': 30.105516240438803, 'bear_atr_min_pct': 0.022485657096156266, 'bear_atr_max_pct': 0.13837724228142997, 'bear_tp_mult': 2.9629227971722067, 'bear_tsl_mult': 0.9911230011663377, 'bear_time_stop': 100, 'bear_use_sma': False, 'bear_use_ema': False, 'bear_use_atr': True, 'bear_use_adx': True, 'bear_use_spike': False, 'bear_rsi_required': False, 'sideways_strategy': 'mean_reversion', 'sideways_bb_std_mult': 2.5105505003048187, 'sideways_rsi_os': 43, 'sideways_rsi_ob': 82, 'sideways_adx_thresh': 9.145071215029882, 'sideways_atr_min_pct': 0.01706787027323335, 'sideways_atr_max_pct': 0.10952414246234124, 'sideways_tp_mult': 2.5063305645429756, 'sideways_tsl_mult': 0.6595643426025539, 'sideways_time_stop': 34, 'sideways_use_sma': False, 'sideways_use_ema': False, 'sideways_use_atr': False, 'sideways_use_adx': True, 'sideways_use_spike': True, 'sideways_rsi_required': False}.
Starting optimization (600 trials, n_jobs=4) | multi-objective=True
Saved trials CSV -> runs/REAL_RECHECK_prev_winner/h_broad_r0.04_s911/trials_metrics.csv
Saved Pareto plot -> runs/REAL_RECHECK_prev_winner/h_broad_r0.04_s911/pareto_return_vs_drawdown.png
Top-K under DD cap: [326] (agg='median')
=== Selected trial(s) ===
top_k=1 selected_trial_numbers=[326] primary=326
ret%_train=0.00% dd%_train=0.00% trades=0
ret%_test=0.00% dd%_test=0.00% pnl_test=0.00 trades_test=0
WFO fold 1: OOS PnL=0.00 trades=0 win_rate=0.00% avg=0.000000 ret%=0.00% maxDD=0.000000 maxDD%=0.00%
WFO fold 2: OOS PnL=0.00 trades=0 win_rate=0.00% avg=0.000000 ret%=0.00% maxDD=0.000000 maxDD%=0.00%
WFO fold 3: OOS PnL=0.00 trades=0 win_rate=0.00% avg=0.000000 ret%=0.00% maxDD=0.000000 maxDD%=0.00%
WFO fold 4: OOS PnL=0.00 trades=0 win_rate=0.00% avg=0.000000 ret%=0.00% maxDD=0.000000 maxDD%=0.00%
WFO fold 5: OOS PnL=0.00 trades=0 win_rate=0.00% avg=0.000000 ret%=0.00% maxDD=0.000000 maxDD%=0.00%
WFO fold 6: OOS PnL=0.00 trades=0 win_rate=0.00% avg=0.000000 ret%=0.00% maxDD=0.000000 maxDD%=0.00%
WFO summary: meanPnL=0.00 stdPnL=0.00 meanWR=0.00% meanAvg=0.000000 meanRet%=0.00% worstDD=0.000000 worstDD%=0.00% folds=6 trades=0
Wrote runs/REAL_RECHECK_prev_winner/h_broad_r0.04_s911/strategy_profile.json
=== ECHO SELECTED PARAMS (JSON) ===
{
  "adx_thresh": 26.801678857770955,
  "aggregate_params": "median",
  "atr_max_pct": 0.14493613124074323,
  "atr_min_pct": 0.02123923921512431,
  "bar_priority": "stop_first",
  "bb_std_mult": 1.879140369596384,
  "bear_adx_thresh": 10.516248439920219,
  "bear_atr_max_pct": 0.021601707700635388,
  "bear_atr_min_pct": 0.019677019914912774,
  "bear_bb_std_mult": 0.8532322853609193,
  "bear_rsi_ob": 88,
  "bear_rsi_os": 26,
  "bear_rsi_required": false,
  "bear_strategy": "breakout",
  "bear_time_stop": 300,
  "bear_tp_mult": 2.8778966506833963,
  "bear_tsl_mult": 0.07214699716596373,
  "bear_use_adx": true,
  "bear_use_atr": true,
  "bear_use_ema": true,
  "bear_use_sma": false,
  "bear_use_spike": true,
  "bull_adx_thresh": 21.671107071242957,
  "bull_atr_max_pct": 0.0854142383092713,
  "bull_atr_min_pct": 0.011750086955451355,
  "bull_bb_std_mult": 2.7152403227128703,
  "bull_rsi_ob": 68,
  "bull_rsi_os": 11,
  "bull_rsi_required": false,
  "bull_strategy": "breakout",
  "bull_time_stop": 156,
  "bull_tp_mult": 1.2679574914466505,
  "bull_tsl_mult": 0.029972650844671933,
  "bull_use_adx": true,
  "bull_use_atr": false,
  "bull_use_ema": false,
  "bull_use_sma": true,
  "bull_use_spike": true,
  "cooldown_bars": 30,
  "daily_loss_limit_pct": 0.12,
  "edge_cap": 0.08615355516307922,
  "edge_k": 1.042403061175782,
  "ema1": 11,
  "ema2": 13,
  "embargo_bars": 150,
  "fee": 0.001,
  "fill_timing": "next_open",
  "include_hours_set": "{0, 1, 2, 3, 14, 15, 16, 17, 18, 19, 20, 22}",
  "lockout_bars": 100,
  "max_consec_losses": 7,
  "max_notional_pct_equity": 1.0,
  "min_notional": 5.0,
  "ml_thresh": 0.0,
  "objective": "multi",
  "p_adx": 12,
  "p_atr": 15,
  "p_sma": 55,
  "p_std": 21,
  "participation_cap": 1.0,
  "price_step": 0.0001,
  "proba_temp": 1.0,
  "qty_step": 0.0001,
  "regime_adapt": true,
  "regime_band": 0.006,
  "regime_fast": 50,
  "regime_overrides": {
    "bear": {
      "adx": 20.0,
      "allowed_sides": [
        "long",
        "short"
      ],
      "atr_range": [
        0.0015,
        0.06
      ],
      "bb_std_mult": 1.2571599337995167,
      "mode": "breakout",
      "rsi_required": true,
      "time_stop_bars": 122,
      "tp_mult": 1.7149673432024581,
      "tsl_mult": 0.25,
      "use_adx": true,
      "use_atr": true
    },
    "bull": {
      "adx": 18.0,
      "allowed_sides": [
        "long",
        "short"
      ],
      "atr_range": [
        0.0008,
        0.06
      ],
      "bb_std_mult": 2.0169431746748376,
      "mode": "mean_reversion",
      "rsi_required": false,
      "time_stop_bars": 214,
      "tp_mult": 1.9194251920826044,
      "tsl_mult": 0.6891458682949287,
      "use_adx": true,
      "use_atr": true
    },
    "sideways": {
      "adx": 15.0,
      "allowed_sides": [
        "long",
        "short"
      ],
      "atr_range": [
        0.001,
        0.14
      ],
      "bb_std_mult": 1.5828092896467827,
      "mode": "breakout",
      "rsi_required": true,
      "time_stop_bars": 235,
      "tp_mult": 2.341879695778944,
      "tsl_mult": 0.651967765830165,
      "use_adx": true,
      "use_atr": true
    }
  },
  "regime_slow": 200,
  "risk_min_stop_frac": 0.001,
  "risk_per_trade": 0.04,
  "risk_stop_atr_mult": 1.0,
  "round_exits": true,
  "rsi_key": "rsi62",
  "rsi_ob": 57,
  "rsi_os": 22,
  "rsi_period": 62,
  "rsi_required": true,
  "select_top_k": 1,
  "session_end": 24,
  "session_start": 0,
  "sides": "short",
  "sideways_adx_thresh": 10.670280444278854,
  "sideways_atr_max_pct": 0.024810864381640034,
  "sideways_atr_min_pct": 0.009983303827276708,
  "sideways_bb_std_mult": 1.272879660523839,
  "sideways_rsi_ob": 69,
  "sideways_rsi_os": 27,
  "sideways_rsi_required": false,
  "sideways_strategy": "breakout",
  "sideways_time_stop": 24,
  "sideways_tp_mult": 2.789284481649167,
  "sideways_tsl_mult": 0.12887840093030023,
  "sideways_use_adx": false,
  "sideways_use_atr": true,
  "sideways_use_ema": false,
  "sideways_use_sma": false,
  "sideways_use_spike": true,
  "slip_atr_k": 0.049966621053927504,
  "slip_spread_k": 0.7788244859019616,
  "slippage": 0.0006,
  "spread_hl_frac": 0.024291224698574778,
  "start_equity": 20000.0,
  "stop_extra_slip": 0.0,
  "strategy": "mean_reversion",
  "time_stop": 290,
  "tp_mult": 2.721480909779862,
  "tsl_mult": 0.4564233228571107,
  "use_adx": true,
  "use_atr": true,
  "use_ema": false,
  "use_ml": false,
  "use_sma": true,
  "use_spike": false,
  "vol_spike": 0.14584909663724557,
  "wfo_folds": 6
}
Wrote runs/REAL_RECHECK_prev_winner/h_broad_r0.04_s911/best_params.pkl
