[I 2025-09-01 08:12:53,908] Trial 326 finished with values: [-1000000000.0, 1000000000.0] and parameters: {'p_sma': 55, 'p_std': 21, 'p_atr': 15, 'p_adx': 12, 'rsi_period': 62, 'ema1': 11, 'ema2': 13, 'slip_atr_k': 0.049966621053927504, 'slip_spread_k': 0.7788244859019616, 'spread_hl_frac': 0.024291224698574778, 'bb_std_mult': 1.879140369596384, 'rsi_os': 22, 'rsi_ob': 57, 'vol_spike': 0.14584909663724557, 'adx_thresh': 26.801678857770955, 'atr_min_pct': 0.02123923921512431, 'atr_max_pct': 0.14493613124074323, 'tp_mult': 2.721480909779862, 'tsl_mult': 0.4564233228571107, 'strategy': 'mean_reversion', 'time_stop': 290, 'use_sma': True, 'use_atr': True, 'use_adx': True, 'use_ema': False, 'use_spike': False, 'rsi_required': True, 'edge_k': 1.042403061175782, 'edge_cap': 0.08615355516307922, 'bull_strategy': 'breakout', 'bull_bb_std_mult': 2.7152403227128703, 'bull_rsi_os': 11, 'bull_rsi_ob': 68, 'bull_adx_thresh': 21.671107071242957, 'bull_atr_min_pct': 0.011750086955451355, 'bull_atr_max_pct': 0.0854142383092713, 'bull_tp_mult': 1.2679574914466505, 'bull_tsl_mult': 0.029972650844671933, 'bull_time_stop': 156, 'bull_use_sma': True, 'bull_use_ema': False, 'bull_use_atr': False, 'bull_use_adx': True, 'bull_use_spike': True, 'bull_rsi_required': False, 'bear_strategy': 'breakout', 'bear_bb_std_mult': 0.8532322853609193, 'bear_rsi_os': 26, 'bear_rsi_ob': 88, 'bear_adx_thresh': 10.516248439920219, 'bear_atr_min_pct': 0.019677019914912774, 'bear_atr_max_pct': 0.021601707700635388, 'bear_tp_mult': 2.8778966506833963, 'bear_tsl_mult': 0.07214699716596373, 'bear_time_stop': 300, 'bear_use_sma': False, 'bear_use_ema': True, 'bear_use_atr': True, 'bear_use_adx': True, 'bear_use_spike': True, 'bear_rsi_required': False, 'sideways_strategy': 'breakout', 'sideways_bb_std_mult': 1.272879660523839, 'sideways_rsi_os': 27, 'sideways_rsi_ob': 69, 'sideways_adx_thresh': 10.670280444278854, 'sideways_atr_min_pct': 0.009983303827276708, 'sideways_atr_max_pct': 0.024810864381640034, 'sideways_tp_mult': 2.789284481649167, 'sideways_tsl_mult': 0.12887840093030023, 'sideways_time_stop': 24, 'sideways_use_sma': False, 'sideways_use_ema': False, 'sideways_use_atr': True, 'sideways_use_adx': False, 'sideways_use_spike': True, 'sideways_rsi_required': False}.
[I 2025-09-01 08:12:54,288] Trial 325 finished with values: [-1000000000.0, 1000000000.0] and parameters: {'p_sma': 19, 'p_std': 52, 'p_atr': 16, 'p_adx': 19, 'rsi_period': 38, 'ema1': 28, 'ema2': 13, 'slip_atr_k': 0.06880591427607882, 'slip_spread_k': 0.9954516487386683, 'spread_hl_frac': 0.0031765316367793756, 'bb_std_mult': 1.9938838165255195, 'rsi_os': 36, 'rsi_ob': 57, 'vol_spike': 0.22150100420586538, 'adx_thresh': 26.76484555203785, 'atr_min_pct': 0.021128993773415438, 'atr_max_pct': 0.11756631350765812, 'tp_mult': 2.709801821866647, 'tsl_mult': 0.11374066995675158, 'strategy': 'mean_reversion', 'time_stop': 287, 'use_sma': True, 'use_atr': True, 'use_adx': True, 'use_ema': True, 'use_spike': False, 'rsi_required': True, 'edge_k': 0.7746619608906722, 'edge_cap': 0.11746208185033773, 'bull_strategy': 'breakout', 'bull_bb_std_mult': 2.724260094452191, 'bull_rsi_os': 11, 'bull_rsi_ob': 68, 'bull_adx_thresh': 7.156683580338349, 'bull_atr_min_pct': 0.011736298319667935, 'bull_atr_max_pct': 0.08561697747210745, 'bull_tp_mult': 2.1471626502979166, 'bull_tsl_mult': 0.6301335927053291, 'bull_time_stop': 32, 'bull_use_sma': True, 'bull_use_ema': False, 'bull_use_atr': False, 'bull_use_adx': False, 'bull_use_spike': True, 'bull_rsi_required': False, 'bear_strategy': 'mean_reversion', 'bear_bb_std_mult': 3.1468524971260585, 'bear_rsi_os': 26, 'bear_rsi_ob': 93, 'bear_adx_thresh': 25.55981388365145, 'bear_atr_min_pct': 0.009568610531901719, 'bear_atr_max_pct': 0.11839347071485123, 'bear_tp_mult': 2.880982189506364, 'bear_tsl_mult': 0.06827480601350723, 'bear_time_stop': 113, 'bear_use_sma': False, 'bear_use_ema': True, 'bear_use_atr': True, 'bear_use_adx': True, 'bear_use_spike': True, 'bear_rsi_required': False, 'sideways_strategy': 'mean_reversion', 'sideways_bb_std_mult': 3.0409890000149327, 'sideways_rsi_os': 37, 'sideways_rsi_ob': 75, 'sideways_adx_thresh': 10.745473191688706, 'sideways_atr_min_pct': 0.022944234589300554, 'sideways_atr_max_pct': 0.08471038065945598, 'sideways_tp_mult': 2.715320951834775, 'sideways_tsl_mult': 0.11816511500382598, 'sideways_time_stop': 163, 'sideways_use_sma': False, 'sideways_use_ema': True, 'sideways_use_atr': False, 'sideways_use_adx': False, 'sideways_use_spike': True, 'sideways_rsi_required': False}.
[I 2025-09-01 08:12:54,656] Trial 323 finished with values: [-0.024545157136163787, 0.02402220074855916] and parameters: {'p_sma': 55, 'p_std': 16, 'p_atr': 15, 'p_adx': 18, 'rsi_period': 66, 'ema1': 11, 'ema2': 13, 'slip_atr_k': 0.022949564468858527, 'slip_spread_k': 0.6235911545054359, 'spread_hl_frac': 0.02939060543183513, 'bb_std_mult': 2.013791537105349, 'rsi_os': 22, 'rsi_ob': 66, 'vol_spike': 0.23443616186347663, 'adx_thresh': 23.633407170341407, 'atr_min_pct': 0.021026456252463785, 'atr_max_pct': 0.1499367426668749, 'tp_mult': 1.213564921716937, 'tsl_mult': 0.4055611154069516, 'strategy': 'mean_reversion', 'time_stop': 159, 'use_sma': True, 'use_atr': True, 'use_adx': True, 'use_ema': False, 'use_spike': False, 'rsi_required': True, 'edge_k': 0.015337239280475479, 'edge_cap': 0.11857677456924981, 'bull_strategy': 'breakout', 'bull_bb_std_mult': 2.82796127230488, 'bull_rsi_os': 11, 'bull_rsi_ob': 56, 'bull_adx_thresh': 6.229740291314357, 'bull_atr_min_pct': 0.0037598756715734915, 'bull_atr_max_pct': 0.028678948303510955, 'bull_tp_mult': 1.7148723241487627, 'bull_tsl_mult': 0.6282866120950156, 'bull_time_stop': 42, 'bull_use_sma': True, 'bull_use_ema': False, 'bull_use_atr': False, 'bull_use_adx': False, 'bull_use_spike': True, 'bull_rsi_required': False, 'bear_strategy': 'breakout', 'bear_bb_std_mult': 2.2943338632904338, 'bear_rsi_os': 11, 'bear_rsi_ob': 93, 'bear_adx_thresh': 34.869286986133886, 'bear_atr_min_pct': 0.023997250689297246, 'bear_atr_max_pct': 0.10676271352830584, 'bear_tp_mult': 2.813609275563789, 'bear_tsl_mult': 0.8308980952815062, 'bear_time_stop': 97, 'bear_use_sma': False, 'bear_use_ema': True, 'bear_use_atr': True, 'bear_use_adx': True, 'bear_use_spike': True, 'bear_rsi_required': False, 'sideways_strategy': 'breakout', 'sideways_bb_std_mult': 3.434214699477039, 'sideways_rsi_os': 37, 'sideways_rsi_ob': 90, 'sideways_adx_thresh': 7.5821358697346515, 'sideways_atr_min_pct': 0.013777745451138074, 'sideways_atr_max_pct': 0.06755142353996213, 'sideways_tp_mult': 2.6852892625107136, 'sideways_tsl_mult': 0.13029152441429984, 'sideways_time_stop': 22, 'sideways_use_sma': False, 'sideways_use_ema': True, 'sideways_use_atr': True, 'sideways_use_adx': True, 'sideways_use_spike': True, 'sideways_rsi_required': False}.
[I 2025-09-01 08:13:46,554] Trial 330 finished with values: [-1000000000.0, 1000000000.0] and parameters: {'p_sma': 32, 'p_std': 13, 'p_atr': 13, 'p_adx': 20, 'rsi_period': 54, 'ema1': 9, 'ema2': 51, 'slip_atr_k': 0.07770855464773316, 'slip_spread_k': 0.6286232529171174, 'spread_hl_frac': 0.029531701273350662, 'bb_std_mult': 3.4911033171559827, 'rsi_os': 29, 'rsi_ob': 89, 'vol_spike': 0.2504226595422306, 'adx_thresh': 16.214596601075947, 'atr_min_pct': 0.022893727093092814, 'atr_max_pct': 0.1496954369405568, 'tp_mult': 1.2045510618794593, 'tsl_mult': 0.8545255897972563, 'strategy': 'mean_reversion', 'time_stop': 253, 'use_sma': True, 'use_atr': False, 'use_adx': False, 'use_ema': True, 'use_spike': True, 'rsi_required': True, 'edge_k': 0.916760930172572, 'edge_cap': 0.06599546828994626, 'bull_strategy': 'breakout', 'bull_bb_std_mult': 3.0248698720999236, 'bull_rsi_os': 13, 'bull_rsi_ob': 77, 'bull_adx_thresh': 17.336008136441546, 'bull_atr_min_pct': 0.010938175754597844, 'bull_atr_max_pct': 0.14484708158103074, 'bull_tp_mult': 2.8500187243595576, 'bull_tsl_mult': 0.6559248234756212, 'bull_time_stop': 42, 'bull_use_sma': True, 'bull_use_ema': True, 'bull_use_atr': False, 'bull_use_adx': True, 'bull_use_spike': True, 'bull_rsi_required': False, 'bear_strategy': 'mean_reversion', 'bear_bb_std_mult': 0.6140013104663988, 'bear_rsi_os': 44, 'bear_rsi_ob': 94, 'bear_adx_thresh': 22.02182335805751, 'bear_atr_min_pct': 0.01582393117505857, 'bear_atr_max_pct': 0.077500109182573, 'bear_tp_mult': 2.0651471012879887, 'bear_tsl_mult': 0.48885611548323266, 'bear_time_stop': 13, 'bear_use_sma': False, 'bear_use_ema': False, 'bear_use_atr': True, 'bear_use_adx': True, 'bear_use_spike': False, 'bear_rsi_required': False, 'sideways_strategy': 'mean_reversion', 'sideways_bb_std_mult': 0.5929732607715752, 'sideways_rsi_os': 30, 'sideways_rsi_ob': 73, 'sideways_adx_thresh': 17.40897877877549, 'sideways_atr_min_pct': 0.012072355381555658, 'sideways_atr_max_pct': 0.07145492732955597, 'sideways_tp_mult': 2.637633182526516, 'sideways_tsl_mult': 0.30748131613095453, 'sideways_time_stop': 34, 'sideways_use_sma': False, 'sideways_use_ema': False, 'sideways_use_atr': False, 'sideways_use_adx': True, 'sideways_use_spike': True, 'sideways_rsi_required': False}.
[I 2025-09-01 08:13:48,225] Trial 328 finished with values: [-1000000000.0, 1000000000.0] and parameters: {'p_sma': 19, 'p_std': 13, 'p_atr': 21, 'p_adx': 20, 'rsi_period': 63, 'ema1': 9, 'ema2': 12, 'slip_atr_k': 0.07719301432061385, 'slip_spread_k': 0.9234311212042232, 'spread_hl_frac': 0.015325935775740712, 'bb_std_mult': 3.1122526424138397, 'rsi_os': 29, 'rsi_ob': 66, 'vol_spike': 0.20535111773305192, 'adx_thresh': 25.483277738314158, 'atr_min_pct': 0.022948649985048253, 'atr_max_pct': 0.11782302813432947, 'tp_mult': 1.2167719933150742, 'tsl_mult': 0.863566998166168, 'strategy': 'mean_reversion', 'time_stop': 31, 'use_sma': True, 'use_atr': True, 'use_adx': True, 'use_ema': True, 'use_spike': True, 'rsi_required': True, 'edge_k': 1.0726901258896524, 'edge_cap': 0.101973505832243, 'bull_strategy': 'breakout', 'bull_bb_std_mult': 3.5817262010656097, 'bull_rsi_os': 12, 'bull_rsi_ob': 68, 'bull_adx_thresh': 7.215125711429124, 'bull_atr_min_pct': 0.009638144097268753, 'bull_atr_max_pct': 0.04126665066027095, 'bull_tp_mult': 2.1617250712876293, 'bull_tsl_mult': 0.6105334349814479, 'bull_time_stop': 155, 'bull_use_sma': True, 'bull_use_ema': False, 'bull_use_atr': False, 'bull_use_adx': True, 'bull_use_spike': True, 'bull_rsi_required': False, 'bear_strategy': 'mean_reversion', 'bear_bb_std_mult': 3.025550671639111, 'bear_rsi_os': 27, 'bear_rsi_ob': 94, 'bear_adx_thresh': 32.63879628738345, 'bear_atr_min_pct': 0.025090646699191116, 'bear_atr_max_pct': 0.07797530845634137, 'bear_tp_mult': 1.8877618119337778, 'bear_tsl_mult': 0.1063578887896558, 'bear_time_stop': 67, 'bear_use_sma': False, 'bear_use_ema': False, 'bear_use_atr': True, 'bear_use_adx': True, 'bear_use_spike': False, 'bear_rsi_required': False, 'sideways_strategy': 'mean_reversion', 'sideways_bb_std_mult': 3.0328266863167066, 'sideways_rsi_os': 30, 'sideways_rsi_ob': 90, 'sideways_adx_thresh': 16.978386009982486, 'sideways_atr_min_pct': 0.006868707826619148, 'sideways_atr_max_pct': 0.07092520026145731, 'sideways_tp_mult': 1.333793314563275, 'sideways_tsl_mult': 0.2004724031493473, 'sideways_time_stop': 162, 'sideways_use_sma': False, 'sideways_use_ema': False, 'sideways_use_atr': False, 'sideways_use_adx': True, 'sideways_use_spike': True, 'sideways_rsi_required': False}.
[I 2025-09-01 08:13:48,226] Trial 327 finished with values: [-1000000000.0, 1000000000.0] and parameters: {'p_sma': 55, 'p_std': 52, 'p_atr': 11, 'p_adx': 9, 'rsi_period': 50, 'ema1': 9, 'ema2': 51, 'slip_atr_k': 0.05228011289229492, 'slip_spread_k': 0.11342901759026752, 'spread_hl_frac': 0.03413618796208297, 'bb_std_mult': 2.0047783293368027, 'rsi_os': 25, 'rsi_ob': 89, 'vol_spike': 0.267579276018369, 'adx_thresh': 16.158976271205187, 'atr_min_pct': 0.022934567606657866, 'atr_max_pct': 0.141878949797497, 'tp_mult': 2.0246471136545354, 'tsl_mult': 0.54919936698354, 'strategy': 'mean_reversion', 'time_stop': 284, 'use_sma': True, 'use_atr': True, 'use_adx': True, 'use_ema': True, 'use_spike': False, 'rsi_required': True, 'edge_k': 1.4640684361394514, 'edge_cap': 0.11212376362060728, 'bull_strategy': 'breakout', 'bull_bb_std_mult': 1.7794212236878242, 'bull_rsi_os': 12, 'bull_rsi_ob': 75, 'bull_adx_thresh': 11.99592276246231, 'bull_atr_min_pct': 0.011560539850634849, 'bull_atr_max_pct': 0.06033287494628629, 'bull_tp_mult': 2.1563209089636928, 'bull_tsl_mult': 0.2750791928003957, 'bull_time_stop': 92, 'bull_use_sma': True, 'bull_use_ema': False, 'bull_use_atr': False, 'bull_use_adx': True, 'bull_use_spike': True, 'bull_rsi_required': False, 'bear_strategy': 'mean_reversion', 'bear_bb_std_mult': 2.294551680904701, 'bear_rsi_os': 11, 'bear_rsi_ob': 94, 'bear_adx_thresh': 25.48726270059369, 'bear_atr_min_pct': 0.025175782606852073, 'bear_atr_max_pct': 0.03854889148682183, 'bear_tp_mult': 2.8689777636897644, 'bear_tsl_mult': 0.7400239385107861, 'bear_time_stop': 81, 'bear_use_sma': False, 'bear_use_ema': True, 'bear_use_atr': True, 'bear_use_adx': True, 'bear_use_spike': True, 'bear_rsi_required': False, 'sideways_strategy': 'mean_reversion', 'sideways_bb_std_mult': 0.5645002144837887, 'sideways_rsi_os': 40, 'sideways_rsi_ob': 90, 'sideways_adx_thresh': 17.138663633238743, 'sideways_atr_min_pct': 0.006820151754750292, 'sideways_atr_max_pct': 0.07119810611424829, 'sideways_tp_mult': 1.3282404428960373, 'sideways_tsl_mult': 0.31538446907701484, 'sideways_time_stop': 159, 'sideways_use_sma': False, 'sideways_use_ema': False, 'sideways_use_atr': False, 'sideways_use_adx': False, 'sideways_use_spike': True, 'sideways_rsi_required': False}.
[I 2025-09-01 08:13:49,332] Trial 329 finished with values: [-0.03476545457250846, 0.03524334819287936] and parameters: {'p_sma': 22, 'p_std': 13, 'p_atr': 11, 'p_adx': 20, 'rsi_period': 49, 'ema1': 9, 'ema2': 12, 'slip_atr_k': 0.0879504529621092, 'slip_spread_k': 0.6296405006235943, 'spread_hl_frac': 0.01143677086235703, 'bb_std_mult': 3.436965507985819, 'rsi_os': 25, 'rsi_ob': 61, 'vol_spike': 0.20493414326729997, 'adx_thresh': 17.29651077747574, 'atr_min_pct': 0.012950202755006713, 'atr_max_pct': 0.14166945847212434, 'tp_mult': 1.200326408500853, 'tsl_mult': 0.5508563117474095, 'strategy': 'mean_reversion', 'time_stop': 226, 'use_sma': True, 'use_atr': False, 'use_adx': False, 'use_ema': True, 'use_spike': True, 'rsi_required': True, 'edge_k': 1.0782692577733959, 'edge_cap': 0.06778986906813697, 'bull_strategy': 'breakout', 'bull_bb_std_mult': 2.8030477052865623, 'bull_rsi_os': 13, 'bull_rsi_ob': 69, 'bull_adx_thresh': 27.80075547210064, 'bull_atr_min_pct': 0.003654636530483387, 'bull_atr_max_pct': 0.019909708156189386, 'bull_tp_mult': 2.0833533153592367, 'bull_tsl_mult': 0.6922758307929288, 'bull_time_stop': 45, 'bull_use_sma': True, 'bull_use_ema': True, 'bull_use_atr': False, 'bull_use_adx': True, 'bull_use_spike': True, 'bull_rsi_required': True, 'bear_strategy': 'mean_reversion', 'bear_bb_std_mult': 3.0546499136179714, 'bear_rsi_os': 44, 'bear_rsi_ob': 94, 'bear_adx_thresh': 32.74839760324651, 'bear_atr_min_pct': 0.0077000343306323155, 'bear_atr_max_pct': 0.07694336035040063, 'bear_tp_mult': 2.652038967298215, 'bear_tsl_mult': 0.7427270776265587, 'bear_time_stop': 10, 'bear_use_sma': False, 'bear_use_ema': False, 'bear_use_atr': True, 'bear_use_adx': True, 'bear_use_spike': False, 'bear_rsi_required': False, 'sideways_strategy': 'mean_reversion', 'sideways_bb_std_mult': 0.5728758754764457, 'sideways_rsi_os': 40, 'sideways_rsi_ob': 56, 'sideways_adx_thresh': 9.476663266035018, 'sideways_atr_min_pct': 0.0069171530833288565, 'sideways_atr_max_pct': 0.1431880516460292, 'sideways_tp_mult': 2.6418526738004027, 'sideways_tsl_mult': 0.9860916154854654, 'sideways_time_stop': 32, 'sideways_use_sma': False, 'sideways_use_ema': False, 'sideways_use_atr': False, 'sideways_use_adx': True, 'sideways_use_spike': True, 'sideways_rsi_required': False}.
[I 2025-09-01 08:14:39,650] Trial 334 finished with values: [-1000000000.0, 1000000000.0] and parameters: {'p_sma': 22, 'p_std': 14, 'p_atr': 12, 'p_adx': 18, 'rsi_period': 26, 'ema1': 7, 'ema2': 16, 'slip_atr_k': 0.1913211283675813, 'slip_spread_k': 0.5150358112725747, 'spread_hl_frac': 0.03639663155943664, 'bb_std_mult': 3.4323837995714452, 'rsi_os': 44, 'rsi_ob': 55, 'vol_spike': 0.08140733790812389, 'adx_thresh': 12.466957472947598, 'atr_min_pct': 0.00012728030920326934, 'atr_max_pct': 0.12822341793546416, 'tp_mult': 2.4328184259461554, 'tsl_mult': 0.03434314439063585, 'strategy': 'mean_reversion', 'time_stop': 263, 'use_sma': False, 'use_atr': False, 'use_adx': False, 'use_ema': False, 'use_spike': True, 'rsi_required': False, 'edge_k': 1.754929373535719, 'edge_cap': 0.17152426201454052, 'bull_strategy': 'mean_reversion', 'bull_bb_std_mult': 1.1121319435299943, 'bull_rsi_os': 13, 'bull_rsi_ob': 72, 'bull_adx_thresh': 8.508246310435688, 'bull_atr_min_pct': 0.018722678472551685, 'bull_atr_max_pct': 0.14001495102299555, 'bull_tp_mult': 1.0646835709437588, 'bull_tsl_mult': 0.6896245736826007, 'bull_time_stop': 277, 'bull_use_sma': True, 'bull_use_ema': True, 'bull_use_atr': False, 'bull_use_adx': True, 'bull_use_spike': True, 'bull_rsi_required': True, 'bear_strategy': 'breakout', 'bear_bb_std_mult': 3.073056388671877, 'bear_rsi_os': 38, 'bear_rsi_ob': 78, 'bear_adx_thresh': 31.200911954195817, 'bear_atr_min_pct': 0.022327000386367996, 'bear_atr_max_pct': 0.09101314834368088, 'bear_tp_mult': 2.7780609835137793, 'bear_tsl_mult': 0.09149249546196034, 'bear_time_stop': 81, 'bear_use_sma': False, 'bear_use_ema': False, 'bear_use_atr': True, 'bear_use_adx': True, 'bear_use_spike': True, 'bear_rsi_required': False, 'sideways_strategy': 'breakout', 'sideways_bb_std_mult': 2.3194135381132384, 'sideways_rsi_os': 38, 'sideways_rsi_ob': 56, 'sideways_adx_thresh': 22.839117643597927, 'sideways_atr_min_pct': 0.02210693855942388, 'sideways_atr_max_pct': 0.10935083814006982, 'sideways_tp_mult': 1.5681171625141541, 'sideways_tsl_mult': 0.5132052334092103, 'sideways_time_stop': 123, 'sideways_use_sma': False, 'sideways_use_ema': False, 'sideways_use_atr': True, 'sideways_use_adx': True, 'sideways_use_spike': True, 'sideways_rsi_required': False}.
[I 2025-09-01 08:14:40,149] Trial 332 finished with values: [-1000000000.0, 1000000000.0] and parameters: {'p_sma': 8, 'p_std': 44, 'p_atr': 13, 'p_adx': 18, 'rsi_period': 64, 'ema1': 7, 'ema2': 54, 'slip_atr_k': 0.009975751346476852, 'slip_spread_k': 0.5170931317741152, 'spread_hl_frac': 0.03647345453852336, 'bb_std_mult': 3.4456226369131935, 'rsi_os': 24, 'rsi_ob': 55, 'vol_spike': 0.2587169908590063, 'adx_thresh': 15.01102793043013, 'atr_min_pct': 0.022111539718352433, 'atr_max_pct': 0.13940510581393017, 'tp_mult': 1.0990905196348748, 'tsl_mult': 0.03627851983407321, 'strategy': 'mean_reversion', 'time_stop': 71, 'use_sma': False, 'use_atr': False, 'use_adx': False, 'use_ema': True, 'use_spike': True, 'rsi_required': False, 'edge_k': 1.032533489050082, 'edge_cap': 0.5619747596411563, 'bull_strategy': 'mean_reversion', 'bull_bb_std_mult': 1.2107978257713132, 'bull_rsi_os': 43, 'bull_rsi_ob': 72, 'bull_adx_thresh': 27.541443478707777, 'bull_atr_min_pct': 0.004834761870664868, 'bull_atr_max_pct': 0.05401324479690644, 'bull_tp_mult': 1.072416854679659, 'bull_tsl_mult': 0.6944487847255754, 'bull_time_stop': 161, 'bull_use_sma': True, 'bull_use_ema': True, 'bull_use_atr': True, 'bull_use_adx': True, 'bull_use_spike': False, 'bull_rsi_required': True, 'bear_strategy': 'mean_reversion', 'bear_bb_std_mult': 2.561755075707217, 'bear_rsi_os': 38, 'bear_rsi_ob': 51, 'bear_adx_thresh': 31.306853401079913, 'bear_atr_min_pct': 0.0022266212416454326, 'bear_atr_max_pct': 0.08373308301195281, 'bear_tp_mult': 1.0444582458869485, 'bear_tsl_mult': 0.08646395385565056, 'bear_time_stop': 258, 'bear_use_sma': False, 'bear_use_ema': False, 'bear_use_atr': True, 'bear_use_adx': True, 'bear_use_spike': True, 'bear_rsi_required': False, 'sideways_strategy': 'mean_reversion', 'sideways_bb_std_mult': 0.715432200337317, 'sideways_rsi_os': 38, 'sideways_rsi_ob': 68, 'sideways_adx_thresh': 9.341775029920882, 'sideways_atr_min_pct': 0.00854519913805368, 'sideways_atr_max_pct': 0.033133393583583894, 'sideways_tp_mult': 1.5768913749217068, 'sideways_tsl_mult': 0.9758343733058537, 'sideways_time_stop': 60, 'sideways_use_sma': False, 'sideways_use_ema': False, 'sideways_use_atr': False, 'sideways_use_adx': True, 'sideways_use_spike': True, 'sideways_rsi_required': False}.
