[I 2025-09-01 08:27:56,247] Trial 415 finished with values: [-1000000000.0, 1000000000.0] and parameters: {'p_sma': 15, 'p_std': 32, 'p_atr': 10, 'p_adx': 19, 'rsi_period': 13, 'ema1': 15, 'ema2': 12, 'slip_atr_k': 0.06575928671735871, 'slip_spread_k': 0.6824252298625214, 'spread_hl_frac': 0.026362230997947947, 'bb_std_mult': 3.599689990558493, 'rsi_os': 22, 'rsi_ob': 54, 'vol_spike': 0.26812267080767865, 'adx_thresh': 25.312037554954365, 'atr_min_pct': 0.021968772611418927, 'atr_max_pct': 0.04577358405230398, 'tp_mult': 1.2673318256499913, 'tsl_mult': 0.5594695030296463, 'strategy': 'mean_reversion', 'time_stop': 265, 'use_sma': True, 'use_atr': True, 'use_adx': True, 'use_ema': True, 'use_spike': True, 'rsi_required': True, 'edge_k': 1.1725356466606702, 'edge_cap': 0.41275675301892917, 'bull_strategy': 'breakout', 'bull_bb_std_mult': 0.898510102173548, 'bull_rsi_os': 9, 'bull_rsi_ob': 68, 'bull_adx_thresh': 27.78370399346114, 'bull_atr_min_pct': 0.013220632452327113, 'bull_atr_max_pct': 0.043789276747392504, 'bull_tp_mult': 2.2116497533524493, 'bull_tsl_mult': 0.6387470760326867, 'bull_time_stop': 122, 'bull_use_sma': True, 'bull_use_ema': False, 'bull_use_atr': False, 'bull_use_adx': True, 'bull_use_spike': True, 'bull_rsi_required': False, 'bear_strategy': 'mean_reversion', 'bear_bb_std_mult': 2.105751983424239, 'bear_rsi_os': 54, 'bear_rsi_ob': 81, 'bear_adx_thresh': 31.90807984068055, 'bear_atr_min_pct': 0.022069325293200766, 'bear_atr_max_pct': 0.07916692962314173, 'bear_tp_mult': 2.83218006025099, 'bear_tsl_mult': 0.47771795058454075, 'bear_time_stop': 254, 'bear_use_sma': False, 'bear_use_ema': True, 'bear_use_atr': True, 'bear_use_adx': True, 'bear_use_spike': True, 'bear_rsi_required': False, 'sideways_strategy': 'mean_reversion', 'sideways_bb_std_mult': 2.8531239757265987, 'sideways_rsi_os': 43, 'sideways_rsi_ob': 66, 'sideways_adx_thresh': 8.335318530813895, 'sideways_atr_min_pct': 0.022399951428861548, 'sideways_atr_max_pct': 0.042282079249478494, 'sideways_tp_mult': 1.2972159074727192, 'sideways_tsl_mult': 0.07447966275427281, 'sideways_time_stop': 17, 'sideways_use_sma': False, 'sideways_use_ema': False, 'sideways_use_atr': False, 'sideways_use_adx': True, 'sideways_use_spike': True, 'sideways_rsi_required': False}.
[I 2025-09-01 08:27:56,720] Trial 417 finished with values: [-1000000000.0, 1000000000.0] and parameters: {'p_sma': 19, 'p_std': 53, 'p_atr': 10, 'p_adx': 20, 'rsi_period': 23, 'ema1': 27, 'ema2': 12, 'slip_atr_k': 0.07620209543657377, 'slip_spread_k': 0.6782265113276711, 'spread_hl_frac': 0.024209109707704422, 'bb_std_mult': 3.3672062636709033, 'rsi_os': 23, 'rsi_ob': 55, 'vol_spike': 0.2603002009178508, 'adx_thresh': 21.399401238666222, 'atr_min_pct': 0.021873083066643425, 'atr_max_pct': 0.14999432364488843, 'tp_mult': 1.279008255229043, 'tsl_mult': 0.6260585288960848, 'strategy': 'breakout', 'time_stop': 266, 'use_sma': True, 'use_atr': True, 'use_adx': True, 'use_ema': True, 'use_spike': True, 'rsi_required': True, 'edge_k': 0.9577399351897974, 'edge_cap': 0.292251171377865, 'bull_strategy': 'breakout', 'bull_bb_std_mult': 2.719750593915745, 'bull_rsi_os': 44, 'bull_rsi_ob': 68, 'bull_adx_thresh': 27.98961988185991, 'bull_atr_min_pct': 0.010513343346468956, 'bull_atr_max_pct': 0.14588316909313034, 'bull_tp_mult': 1.9950840781799486, 'bull_tsl_mult': 0.6372452106403074, 'bull_time_stop': 164, 'bull_use_sma': False, 'bull_use_ema': False, 'bull_use_atr': False, 'bull_use_adx': False, 'bull_use_spike': True, 'bull_rsi_required': True, 'bear_strategy': 'mean_reversion', 'bear_bb_std_mult': 3.160301495775385, 'bear_rsi_os': 26, 'bear_rsi_ob': 55, 'bear_adx_thresh': 31.902044160372917, 'bear_atr_min_pct': 0.02173697131218324, 'bear_atr_max_pct': 0.08082444978493666, 'bear_tp_mult': 1.3531191145701271, 'bear_tsl_mult': 0.12833541558871603, 'bear_time_stop': 15, 'bear_use_sma': False, 'bear_use_ema': True, 'bear_use_atr': True, 'bear_use_adx': True, 'bear_use_spike': True, 'bear_rsi_required': False, 'sideways_strategy': 'mean_reversion', 'sideways_bb_std_mult': 3.3732076366458177, 'sideways_rsi_os': 39, 'sideways_rsi_ob': 66, 'sideways_adx_thresh': 25.695364174728766, 'sideways_atr_min_pct': 0.015356265506309938, 'sideways_atr_max_pct': 0.03951506958143316, 'sideways_tp_mult': 1.3034229008574956, 'sideways_tsl_mult': 0.06058867599281981, 'sideways_time_stop': 48, 'sideways_use_sma': False, 'sideways_use_ema': False, 'sideways_use_atr': False, 'sideways_use_adx': True, 'sideways_use_spike': True, 'sideways_rsi_required': False}.
[I 2025-09-01 08:27:56,947] Trial 414 finished with values: [-1000000000.0, 1000000000.0] and parameters: {'p_sma': 19, 'p_std': 19, 'p_atr': 10, 'p_adx': 19, 'rsi_period': 32, 'ema1': 15, 'ema2': 12, 'slip_atr_k': 0.05083125506807602, 'slip_spread_k': 0.6829057899928226, 'spread_hl_frac': 0.026568946212216213, 'bb_std_mult': 3.387167999342232, 'rsi_os': 39, 'rsi_ob': 61, 'vol_spike': 0.24610883956928548, 'adx_thresh': 25.478843324227576, 'atr_min_pct': 0.021836101712795142, 'atr_max_pct': 0.14402631211684636, 'tp_mult': 1.214236180730059, 'tsl_mult': 0.63721256492791, 'strategy': 'mean_reversion', 'time_stop': 59, 'use_sma': True, 'use_atr': True, 'use_adx': True, 'use_ema': True, 'use_spike': True, 'rsi_required': True, 'edge_k': 0.7987920778352087, 'edge_cap': 0.07455832117749656, 'bull_strategy': 'breakout', 'bull_bb_std_mult': 1.8156187377405522, 'bull_rsi_os': 33, 'bull_rsi_ob': 77, 'bull_adx_thresh': 27.81961679093093, 'bull_atr_min_pct': 0.019130351827138632, 'bull_atr_max_pct': 0.14606993414518016, 'bull_tp_mult': 2.2262230182586653, 'bull_tsl_mult': 0.5235722944801944, 'bull_time_stop': 195, 'bull_use_sma': True, 'bull_use_ema': False, 'bull_use_atr': False, 'bull_use_adx': True, 'bull_use_spike': True, 'bull_rsi_required': False, 'bear_strategy': 'mean_reversion', 'bear_bb_std_mult': 3.151422001343939, 'bear_rsi_os': 54, 'bear_rsi_ob': 81, 'bear_adx_thresh': 31.733292128516187, 'bear_atr_min_pct': 0.02372695710151359, 'bear_atr_max_pct': 0.08139488356050092, 'bear_tp_mult': 2.836682761246165, 'bear_tsl_mult': 0.17665832989882252, 'bear_time_stop': 14, 'bear_use_sma': False, 'bear_use_ema': True, 'bear_use_atr': True, 'bear_use_adx': True, 'bear_use_spike': True, 'bear_rsi_required': False, 'sideways_strategy': 'mean_reversion', 'sideways_bb_std_mult': 2.8714604901693748, 'sideways_rsi_os': 43, 'sideways_rsi_ob': 64, 'sideways_adx_thresh': 8.259227773162822, 'sideways_atr_min_pct': 0.00450545108008492, 'sideways_atr_max_pct': 0.10129710315628201, 'sideways_tp_mult': 2.651647549516085, 'sideways_tsl_mult': 0.5903989288819134, 'sideways_time_stop': 106, 'sideways_use_sma': False, 'sideways_use_ema': False, 'sideways_use_atr': False, 'sideways_use_adx': True, 'sideways_use_spike': True, 'sideways_rsi_required': False}.
[I 2025-09-01 08:27:57,539] Trial 416 finished with values: [-1000000000.0, 1000000000.0] and parameters: {'p_sma': 23, 'p_std': 39, 'p_atr': 10, 'p_adx': 19, 'rsi_period': 31, 'ema1': 15, 'ema2': 56, 'slip_atr_k': 0.05329653095389594, 'slip_spread_k': 0.681257851304496, 'spread_hl_frac': 0.02618019604977221, 'bb_std_mult': 3.4190213096789064, 'rsi_os': 22, 'rsi_ob': 61, 'vol_spike': 0.26787754059146474, 'adx_thresh': 25.285413543671876, 'atr_min_pct': 0.02194513567052074, 'atr_max_pct': 0.04597747681004637, 'tp_mult': 1.2668238570267583, 'tsl_mult': 0.6366531502233459, 'strategy': 'mean_reversion', 'time_stop': 95, 'use_sma': True, 'use_atr': True, 'use_adx': True, 'use_ema': True, 'use_spike': True, 'rsi_required': True, 'edge_k': 1.170758925867546, 'edge_cap': 0.06603482995216298, 'bull_strategy': 'breakout', 'bull_bb_std_mult': 2.9876734698781418, 'bull_rsi_os': 9, 'bull_rsi_ob': 68, 'bull_adx_thresh': 34.38878751513664, 'bull_atr_min_pct': 0.013180676831936551, 'bull_atr_max_pct': 0.04190846485027933, 'bull_tp_mult': 2.9495368171067615, 'bull_tsl_mult': 0.5790241022377054, 'bull_time_stop': 199, 'bull_use_sma': True, 'bull_use_ema': False, 'bull_use_atr': False, 'bull_use_adx': True, 'bull_use_spike': True, 'bull_rsi_required': False, 'bear_strategy': 'mean_reversion', 'bear_bb_std_mult': 3.163269833423738, 'bear_rsi_os': 31, 'bear_rsi_ob': 81, 'bear_adx_thresh': 31.55128865334725, 'bear_atr_min_pct': 0.022142368663576873, 'bear_atr_max_pct': 0.08092754577878931, 'bear_tp_mult': 2.0889085173298554, 'bear_tsl_mult': 0.46973551415483494, 'bear_time_stop': 166, 'bear_use_sma': False, 'bear_use_ema': True, 'bear_use_atr': True, 'bear_use_adx': True, 'bear_use_spike': True, 'bear_rsi_required': False, 'sideways_strategy': 'mean_reversion', 'sideways_bb_std_mult': 1.4544546612719997, 'sideways_rsi_os': 43, 'sideways_rsi_ob': 66, 'sideways_adx_thresh': 27.676771393676496, 'sideways_atr_min_pct': 0.004216448472950919, 'sideways_atr_max_pct': 0.028733319213831782, 'sideways_tp_mult': 2.065644436713381, 'sideways_tsl_mult': 0.9275762692462091, 'sideways_time_stop': 207, 'sideways_use_sma': False, 'sideways_use_ema': False, 'sideways_use_atr': False, 'sideways_use_adx': True, 'sideways_use_spike': True, 'sideways_rsi_required': False}.
[I 2025-09-01 08:28:42,522] Trial 420 finished with values: [-1000000000.0, 1000000000.0] and parameters: {'p_sma': 18, 'p_std': 24, 'p_atr': 12, 'p_adx': 21, 'rsi_period': 81, 'ema1': 11, 'ema2': 10, 'slip_atr_k': 0.20621461847040817, 'slip_spread_k': 0.08789878567069498, 'spread_hl_frac': 0.016351323516264393, 'bb_std_mult': 3.4642498107507746, 'rsi_os': 24, 'rsi_ob': 52, 'vol_spike': 0.25036046762109554, 'adx_thresh': 24.579865156447042, 'atr_min_pct': 0.020441664750384832, 'atr_max_pct': 0.1472374792558457, 'tp_mult': 2.2339679376860575, 'tsl_mult': 0.9720852117173785, 'strategy': 'mean_reversion', 'time_stop': 249, 'use_sma': False, 'use_atr': False, 'use_adx': False, 'use_ema': True, 'use_spike': True, 'rsi_required': False, 'edge_k': 1.0124989241369815, 'edge_cap': 0.06964717526643614, 'bull_strategy': 'mean_reversion', 'bull_bb_std_mult': 3.1809001185193058, 'bull_rsi_os': 12, 'bull_rsi_ob': 51, 'bull_adx_thresh': 7.979265416273966, 'bull_atr_min_pct': 0.006391677219909643, 'bull_atr_max_pct': 0.11537529991876738, 'bull_tp_mult': 2.1776565928021347, 'bull_tsl_mult': 0.09127734283793804, 'bull_time_stop': 172, 'bull_use_sma': True, 'bull_use_ema': True, 'bull_use_atr': True, 'bull_use_adx': False, 'bull_use_spike': False, 'bull_rsi_required': False, 'bear_strategy': 'breakout', 'bear_bb_std_mult': 2.989403031512462, 'bear_rsi_os': 18, 'bear_rsi_ob': 64, 'bear_adx_thresh': 8.92107345459213, 'bear_atr_min_pct': 0.009619219938948376, 'bear_atr_max_pct': 0.09107698809590918, 'bear_tp_mult': 2.8876196392137614, 'bear_tsl_mult': 0.09144945213112099, 'bear_time_stop': 142, 'bear_use_sma': False, 'bear_use_ema': False, 'bear_use_atr': False, 'bear_use_adx': True, 'bear_use_spike': True, 'bear_rsi_required': True, 'sideways_strategy': 'breakout', 'sideways_bb_std_mult': 0.6850814979248784, 'sideways_rsi_os': 41, 'sideways_rsi_ob': 64, 'sideways_adx_thresh': 10.39250606868848, 'sideways_atr_min_pct': 0.029898335766570763, 'sideways_atr_max_pct': 0.06581097525153866, 'sideways_tp_mult': 2.5244582316192608, 'sideways_tsl_mult': 0.34600747462124437, 'sideways_time_stop': 29, 'sideways_use_sma': True, 'sideways_use_ema': True, 'sideways_use_atr': True, 'sideways_use_adx': True, 'sideways_use_spike': True, 'sideways_rsi_required': False}.
[I 2025-09-01 08:28:42,723] Trial 421 finished with values: [-1000000000.0, 1000000000.0] and parameters: {'p_sma': 45, 'p_std': 15, 'p_atr': 12, 'p_adx': 21, 'rsi_period': 59, 'ema1': 12, 'ema2': 10, 'slip_atr_k': 0.045116063791411504, 'slip_spread_k': 0.6553726797734489, 'spread_hl_frac': 0.0250188849819006, 'bb_std_mult': 3.1571985527627, 'rsi_os': 26, 'rsi_ob': 51, 'vol_spike': 0.06363041094389392, 'adx_thresh': 21.972981624111338, 'atr_min_pct': 0.020360276336058285, 'atr_max_pct': 0.0225608921669588, 'tp_mult': 1.1266299865272207, 'tsl_mult': 0.4726983628643785, 'strategy': 'breakout', 'time_stop': 248, 'use_sma': False, 'use_atr': False, 'use_adx': False, 'use_ema': True, 'use_spike': True, 'rsi_required': False, 'edge_k': 1.004817652426306, 'edge_cap': 0.09403285022467947, 'bull_strategy': 'mean_reversion', 'bull_bb_std_mult': 3.2538728792886227, 'bull_rsi_os': 25, 'bull_rsi_ob': 74, 'bull_adx_thresh': 32.393791812842736, 'bull_atr_min_pct': 0.011772954137759008, 'bull_atr_max_pct': 0.01001207229087446, 'bull_tp_mult': 1.197724932140153, 'bull_tsl_mult': 0.8270793669690639, 'bull_time_stop': 57, 'bull_use_sma': False, 'bull_use_ema': True, 'bull_use_atr': True, 'bull_use_adx': False, 'bull_use_spike': False, 'bull_rsi_required': True, 'bear_strategy': 'breakout', 'bear_bb_std_mult': 1.7577469396279761, 'bear_rsi_os': 23, 'bear_rsi_ob': 52, 'bear_adx_thresh': 21.965541058009997, 'bear_atr_min_pct': 0.006942040139785588, 'bear_atr_max_pct': 0.09604245450739893, 'bear_tp_mult': 2.7072325612221846, 'bear_tsl_mult': 0.019728971090303887, 'bear_time_stop': 100, 'bear_use_sma': False, 'bear_use_ema': False, 'bear_use_atr': False, 'bear_use_adx': True, 'bear_use_spike': True, 'bear_rsi_required': True, 'sideways_strategy': 'breakout', 'sideways_bb_std_mult': 0.6836643274218733, 'sideways_rsi_os': 29, 'sideways_rsi_ob': 64, 'sideways_adx_thresh': 10.333595968378113, 'sideways_atr_min_pct': 0.02506339128370609, 'sideways_atr_max_pct': 0.03212773866122004, 'sideways_tp_mult': 2.541680951970518, 'sideways_tsl_mult': 0.205015467551146, 'sideways_time_stop': 29, 'sideways_use_sma': True, 'sideways_use_ema': True, 'sideways_use_atr': True, 'sideways_use_adx': True, 'sideways_use_spike': True, 'sideways_rsi_required': False}.
[I 2025-09-01 08:28:43,060] Trial 418 finished with values: [-1000000000.0, 1000000000.0] and parameters: {'p_sma': 23, 'p_std': 41, 'p_atr': 12, 'p_adx': 20, 'rsi_period': 63, 'ema1': 11, 'ema2': 54, 'slip_atr_k': 0.047808264385889095, 'slip_spread_k': 0.36552766076305987, 'spread_hl_frac': 0.014159926055491833, 'bb_std_mult': 3.407126804057326, 'rsi_os': 24, 'rsi_ob': 52, 'vol_spike': 0.24573358455267877, 'adx_thresh': 27.22013540405637, 'atr_min_pct': 0.02027189174035499, 'atr_max_pct': 0.14996635525527888, 'tp_mult': 1.2166275518417202, 'tsl_mult': 0.46622562884328994, 'strategy': 'breakout', 'time_stop': 249, 'use_sma': True, 'use_atr': False, 'use_adx': False, 'use_ema': True, 'use_spike': True, 'rsi_required': False, 'edge_k': 0.7936332898681204, 'edge_cap': 0.06497655528721484, 'bull_strategy': 'breakout', 'bull_bb_std_mult': 1.5702317476171161, 'bull_rsi_os': 6, 'bull_rsi_ob': 69, 'bull_adx_thresh': 7.985702573383395, 'bull_atr_min_pct': 0.012041221553979041, 'bull_atr_max_pct': 0.11623115325056317, 'bull_tp_mult': 2.9579753798797785, 'bull_tsl_mult': 0.5271175988482883, 'bull_time_stop': 211, 'bull_use_sma': False, 'bull_use_ema': True, 'bull_use_atr': False, 'bull_use_adx': False, 'bull_use_spike': True, 'bull_rsi_required': True, 'bear_strategy': 'mean_reversion', 'bear_bb_std_mult': 3.1625426727762176, 'bear_rsi_os': 23, 'bear_rsi_ob': 55, 'bear_adx_thresh': 31.697024494820994, 'bear_atr_min_pct': 0.027566325092546418, 'bear_atr_max_pct': 0.08171909757580789, 'bear_tp_mult': 2.8783419958708873, 'bear_tsl_mult': 0.12821344610681862, 'bear_time_stop': 161, 'bear_use_sma': False, 'bear_use_ema': False, 'bear_use_atr': False, 'bear_use_adx': True, 'bear_use_spike': True, 'bear_rsi_required': False, 'sideways_strategy': 'mean_reversion', 'sideways_bb_std_mult': 0.574431761132824, 'sideways_rsi_os': 39, 'sideways_rsi_ob': 66, 'sideways_adx_thresh': 25.74072965455816, 'sideways_atr_min_pct': 0.01020327023305554, 'sideways_atr_max_pct': 0.04008931626933121, 'sideways_tp_mult': 2.5381852511443, 'sideways_tsl_mult': 0.0012169327518113948, 'sideways_time_stop': 29, 'sideways_use_sma': True, 'sideways_use_ema': True, 'sideways_use_atr': False, 'sideways_use_adx': True, 'sideways_use_spike': True, 'sideways_rsi_required': False}.
[I 2025-09-01 08:28:43,071] Trial 419 finished with values: [-1000000000.0, 1000000000.0] and parameters: {'p_sma': 10, 'p_std': 16, 'p_atr': 12, 'p_adx': 21, 'rsi_period': 63, 'ema1': 9, 'ema2': 10, 'slip_atr_k': 0.046309420388104705, 'slip_spread_k': 0.6558989130355238, 'spread_hl_frac': 0.02480602724521582, 'bb_std_mult': 3.427460999647694, 'rsi_os': 24, 'rsi_ob': 56, 'vol_spike': 0.10928784223067634, 'adx_thresh': 24.307688210212607, 'atr_min_pct': 0.020240639796191038, 'atr_max_pct': 0.14442639389902756, 'tp_mult': 2.256541845394503, 'tsl_mult': 0.9659368071312, 'strategy': 'mean_reversion', 'time_stop': 101, 'use_sma': False, 'use_atr': False, 'use_adx': False, 'use_ema': True, 'use_spike': True, 'rsi_required': False, 'edge_k': 0.8114196412113176, 'edge_cap': 0.06334054352872624, 'bull_strategy': 'mean_reversion', 'bull_bb_std_mult': 1.3876653427404144, 'bull_rsi_os': 6, 'bull_rsi_ob': 51, 'bull_adx_thresh': 5.036619771982661, 'bull_atr_min_pct': 0.0037189313894174132, 'bull_atr_max_pct': 0.11531159608265239, 'bull_tp_mult': 2.8344105973744567, 'bull_tsl_mult': 0.6925180765951906, 'bull_time_stop': 56, 'bull_use_sma': True, 'bull_use_ema': True, 'bull_use_atr': True, 'bull_use_adx': True, 'bull_use_spike': False, 'bull_rsi_required': False, 'bear_strategy': 'breakout', 'bear_bb_std_mult': 0.845839201567538, 'bear_rsi_os': 23, 'bear_rsi_ob': 95, 'bear_adx_thresh': 22.20947444228693, 'bear_atr_min_pct': 0.02733285915784689, 'bear_atr_max_pct': 0.08290803623027297, 'bear_tp_mult': 2.56270835552435, 'bear_tsl_mult': 0.17603940885464509, 'bear_time_stop': 142, 'bear_use_sma': False, 'bear_use_ema': False, 'bear_use_atr': False, 'bear_use_adx': True, 'bear_use_spike': True, 'bear_rsi_required': True, 'sideways_strategy': 'mean_reversion', 'sideways_bb_std_mult': 2.223303560432081, 'sideways_rsi_os': 41, 'sideways_rsi_ob': 64, 'sideways_adx_thresh': 10.304776830263734, 'sideways_atr_min_pct': 0.02234007721993081, 'sideways_atr_max_pct': 0.10047250521068415, 'sideways_tp_mult': 2.541556101642134, 'sideways_tsl_mult': 0.0015250924887101336, 'sideways_time_stop': 107, 'sideways_use_sma': True, 'sideways_use_ema': True, 'sideways_use_atr': False, 'sideways_use_adx': True, 'sideways_use_spike': True, 'sideways_rsi_required': False}.
[I 2025-09-01 08:28:44,576] Trial 423 finished with values: [-1000000000.0, 1000000000.0] and parameters: {'p_sma': 35, 'p_std': 13, 'p_atr': 13, 'p_adx': 20, 'rsi_period': 63, 'ema1': 9, 'ema2': 13, 'slip_atr_k': 0.05929912503880618, 'slip_spread_k': 0.735858493892215, 'spread_hl_frac': 0.023310212007675125, 'bb_std_mult': 3.293508045509012, 'rsi_os': 51, 'rsi_ob': 59, 'vol_spike': 0.24305622842085936, 'adx_thresh': 7.862561924093557, 'atr_min_pct': 0.022946897560905767, 'atr_max_pct': 0.09433836555700992, 'tp_mult': 2.967997530024886, 'tsl_mult': 0.5267469868325042, 'strategy': 'mean_reversion', 'time_stop': 240, 'use_sma': True, 'use_atr': True, 'use_adx': True, 'use_ema': True, 'use_spike': True, 'rsi_required': True, 'edge_k': 1.0553641500353768, 'edge_cap': 0.8120237953112956, 'bull_strategy': 'breakout', 'bull_bb_std_mult': 2.8213169905955473, 'bull_rsi_os': 16, 'bull_rsi_ob': 70, 'bull_adx_thresh': 8.375731344048916, 'bull_atr_min_pct': 0.022692976005779304, 'bull_atr_max_pct': 0.03699389168124434, 'bull_tp_mult': 1.9482359076186546, 'bull_tsl_mult': 0.6914890234372298, 'bull_time_stop': 150, 'bull_use_sma': True, 'bull_use_ema': False, 'bull_use_atr': False, 'bull_use_adx': True, 'bull_use_spike': True, 'bull_rsi_required': False, 'bear_strategy': 'mean_reversion', 'bear_bb_std_mult': 3.230206624713381, 'bear_rsi_os': 12, 'bear_rsi_ob': 95, 'bear_adx_thresh': 13.562906569733386, 'bear_atr_min_pct': 0.016907594567758727, 'bear_atr_max_pct': 0.07746205243094677, 'bear_tp_mult': 1.9282218506658513, 'bear_tsl_mult': 0.3977598603893353, 'bear_time_stop': 88, 'bear_use_sma': False, 'bear_use_ema': False, 'bear_use_atr': True, 'bear_use_adx': True, 'bear_use_spike': True, 'bear_rsi_required': False, 'sideways_strategy': 'mean_reversion', 'sideways_bb_std_mult': 0.5733746309728016, 'sideways_rsi_os': 27, 'sideways_rsi_ob': 66, 'sideways_adx_thresh': 9.004194579571115, 'sideways_atr_min_pct': 0.022256692501480477, 'sideways_atr_max_pct': 0.12182888478887068, 'sideways_tp_mult': 2.601845704024781, 'sideways_tsl_mult': 0.17920841751241479, 'sideways_time_stop': 283, 'sideways_use_sma': False, 'sideways_use_ema': False, 'sideways_use_atr': False, 'sideways_use_adx': True, 'sideways_use_spike': False, 'sideways_rsi_required': False}.
