[I 2025-09-01 07:56:21,195] Trial 226 finished with values: [-1000000000.0, 1000000000.0] and parameters: {'p_sma': 20, 'p_std': 59, 'p_atr': 9, 'p_adx': 29, 'rsi_period': 29, 'ema1': 25, 'ema2': 13, 'slip_atr_k': 0.10620846810335896, 'slip_spread_k': 0.12197386373821822, 'spread_hl_frac': 0.022985119254658664, 'bb_std_mult': 1.798250688579353, 'rsi_os': 26, 'rsi_ob': 71, 'vol_spike': 0.2459783817719489, 'adx_thresh': 25.18368754192873, 'atr_min_pct': 0.02377979075206922, 'atr_max_pct': 0.1492225088654259, 'tp_mult': 1.1331181372617194, 'tsl_mult': 0.9368663635898392, 'strategy': 'mean_reversion', 'time_stop': 239, 'use_sma': True, 'use_atr': True, 'use_adx': True, 'use_ema': True, 'use_spike': True, 'rsi_required': True, 'edge_k': 1.0018375566860898, 'edge_cap': 0.7260202841676634, 'bull_strategy': 'breakout', 'bull_bb_std_mult': 2.8385877607327954, 'bull_rsi_os': 14, 'bull_rsi_ob': 69, 'bull_adx_thresh': 20.646375075472868, 'bull_atr_min_pct': 0.004579154255365883, 'bull_atr_max_pct': 0.038843242614212, 'bull_tp_mult': 2.0376772565925227, 'bull_tsl_mult': 0.2883931636242354, 'bull_time_stop': 112, 'bull_use_sma': False, 'bull_use_ema': False, 'bull_use_atr': False, 'bull_use_adx': False, 'bull_use_spike': True, 'bull_rsi_required': False, 'bear_strategy': 'mean_reversion', 'bear_bb_std_mult': 3.152568845364608, 'bear_rsi_os': 36, 'bear_rsi_ob': 61, 'bear_adx_thresh': 22.50152271276234, 'bear_atr_min_pct': 0.02226418594291197, 'bear_atr_max_pct': 0.07422860473864666, 'bear_tp_mult': 1.9197955793959125, 'bear_tsl_mult': 0.07008893070062987, 'bear_time_stop': 211, 'bear_use_sma': False, 'bear_use_ema': False, 'bear_use_atr': True, 'bear_use_adx': False, 'bear_use_spike': True, 'bear_rsi_required': True, 'sideways_strategy': 'mean_reversion', 'sideways_bb_std_mult': 0.6301740165038133, 'sideways_rsi_os': 21, 'sideways_rsi_ob': 66, 'sideways_adx_thresh': 9.7892541857485, 'sideways_atr_min_pct': 0.023149832491914834, 'sideways_atr_max_pct': 0.02803940994516141, 'sideways_tp_mult': 2.5085942824387155, 'sideways_tsl_mult': 0.15650278214628702, 'sideways_time_stop': 218, 'sideways_use_sma': False, 'sideways_use_ema': False, 'sideways_use_atr': False, 'sideways_use_adx': True, 'sideways_use_spike': True, 'sideways_rsi_required': False}.
[I 2025-09-01 07:56:21,544] Trial 224 finished with values: [-0.11482878316858258, 0.11473863797911481] and parameters: {'p_sma': 20, 'p_std': 16, 'p_atr': 9, 'p_adx': 24, 'rsi_period': 65, 'ema1': 28, 'ema2': 13, 'slip_atr_k': 0.06379119953597523, 'slip_spread_k': 0.40855347747283, 'spread_hl_frac': 0.02321525140016884, 'bb_std_mult': 0.8218412752184645, 'rsi_os': 24, 'rsi_ob': 55, 'vol_spike': 0.24639227894104596, 'adx_thresh': 25.00069789286865, 'atr_min_pct': 0.017669855068759625, 'atr_max_pct': 0.07646874287318058, 'tp_mult': 1.1228875402618217, 'tsl_mult': 0.9614146830112309, 'strategy': 'mean_reversion', 'time_stop': 196, 'use_sma': True, 'use_atr': True, 'use_adx': True, 'use_ema': True, 'use_spike': True, 'rsi_required': True, 'edge_k': 1.0204500376829575, 'edge_cap': 0.07470644128275516, 'bull_strategy': 'breakout', 'bull_bb_std_mult': 0.8248068889697306, 'bull_rsi_os': 14, 'bull_rsi_ob': 69, 'bull_adx_thresh': 7.177772022556694, 'bull_atr_min_pct': 0.018352423349484094, 'bull_atr_max_pct': 0.03857754008527066, 'bull_tp_mult': 2.042246403692302, 'bull_tsl_mult': 0.04881346932152131, 'bull_time_stop': 154, 'bull_use_sma': True, 'bull_use_ema': False, 'bull_use_atr': False, 'bull_use_adx': True, 'bull_use_spike': True, 'bull_rsi_required': False, 'bear_strategy': 'breakout', 'bear_bb_std_mult': 1.9253520505288668, 'bear_rsi_os': 40, 'bear_rsi_ob': 61, 'bear_adx_thresh': 33.251026008056414, 'bear_atr_min_pct': 0.02429976805491881, 'bear_atr_max_pct': 0.01917958058725089, 'bear_tp_mult': 2.793485176533943, 'bear_tsl_mult': 0.0797045228494824, 'bear_time_stop': 211, 'bear_use_sma': False, 'bear_use_ema': True, 'bear_use_atr': True, 'bear_use_adx': True, 'bear_use_spike': True, 'bear_rsi_required': False, 'sideways_strategy': 'breakout', 'sideways_bb_std_mult': 2.1822835960995346, 'sideways_rsi_os': 39, 'sideways_rsi_ob': 86, 'sideways_adx_thresh': 23.399031546116454, 'sideways_atr_min_pct': 0.0016899559586150137, 'sideways_atr_max_pct': 0.02779590156959861, 'sideways_tp_mult': 1.1159369632034293, 'sideways_tsl_mult': 0.7054085271104436, 'sideways_time_stop': 220, 'sideways_use_sma': False, 'sideways_use_ema': False, 'sideways_use_atr': True, 'sideways_use_adx': True, 'sideways_use_spike': True, 'sideways_rsi_required': False}.
[I 2025-09-01 07:56:21,921] Trial 225 finished with values: [-0.1814691760727244, 0.18125945651083972] and parameters: {'p_sma': 20, 'p_std': 17, 'p_atr': 9, 'p_adx': 20, 'rsi_period': 62, 'ema1': 28, 'ema2': 13, 'slip_atr_k': 0.09031763817305388, 'slip_spread_k': 0.16384185508023036, 'spread_hl_frac': 0.023840291841105116, 'bb_std_mult': 1.8111376506064105, 'rsi_os': 24, 'rsi_ob': 57, 'vol_spike': 0.16451259772538349, 'adx_thresh': 24.190565083263497, 'atr_min_pct': 0.01765913750620314, 'atr_max_pct': 0.12492787841628458, 'tp_mult': 1.1206604199320926, 'tsl_mult': 0.8538627285230278, 'strategy': 'mean_reversion', 'time_stop': 238, 'use_sma': True, 'use_atr': True, 'use_adx': True, 'use_ema': True, 'use_spike': True, 'rsi_required': True, 'edge_k': 0.988627672754891, 'edge_cap': 0.6738943788904398, 'bull_strategy': 'breakout', 'bull_bb_std_mult': 0.8441775363532122, 'bull_rsi_os': 14, 'bull_rsi_ob': 69, 'bull_adx_thresh': 9.368616104063552, 'bull_atr_min_pct': 0.0008970957081316667, 'bull_atr_max_pct': 0.03910895299469499, 'bull_tp_mult': 2.482795308013098, 'bull_tsl_mult': 0.10650446301732247, 'bull_time_stop': 154, 'bull_use_sma': True, 'bull_use_ema': False, 'bull_use_atr': False, 'bull_use_adx': True, 'bull_use_spike': True, 'bull_rsi_required': False, 'bear_strategy': 'mean_reversion', 'bear_bb_std_mult': 1.718288035223648, 'bear_rsi_os': 31, 'bear_rsi_ob': 94, 'bear_adx_thresh': 33.30996635431043, 'bear_atr_min_pct': 0.015560562411475715, 'bear_atr_max_pct': 0.018265165478376325, 'bear_tp_mult': 2.7763623261690786, 'bear_tsl_mult': 0.06870726061609364, 'bear_time_stop': 137, 'bear_use_sma': False, 'bear_use_ema': True, 'bear_use_atr': True, 'bear_use_adx': True, 'bear_use_spike': True, 'bear_rsi_required': False, 'sideways_strategy': 'mean_reversion', 'sideways_bb_std_mult': 0.6259374884402482, 'sideways_rsi_os': 39, 'sideways_rsi_ob': 91, 'sideways_adx_thresh': 10.17165965376261, 'sideways_atr_min_pct': 0.02281708499194515, 'sideways_atr_max_pct': 0.026870363329451447, 'sideways_tp_mult': 1.1121616732756463, 'sideways_tsl_mult': 0.1522622752947638, 'sideways_time_stop': 34, 'sideways_use_sma': False, 'sideways_use_ema': False, 'sideways_use_atr': False, 'sideways_use_adx': True, 'sideways_use_spike': True, 'sideways_rsi_required': False}.
[I 2025-09-01 07:56:22,917] Trial 229 finished with values: [-1000000000.0, 1000000000.0] and parameters: {'p_sma': 6, 'p_std': 17, 'p_atr': 12, 'p_adx': 24, 'rsi_period': 65, 'ema1': 8, 'ema2': 14, 'slip_atr_k': 0.0652737277797846, 'slip_spread_k': 0.2833783383212518, 'spread_hl_frac': 0.035074537731158005, 'bb_std_mult': 2.539723126634586, 'rsi_os': 53, 'rsi_ob': 78, 'vol_spike': 0.2600727386400619, 'adx_thresh': 24.320104142065617, 'atr_min_pct': 0.002895514297303791, 'atr_max_pct': 0.07738334412698236, 'tp_mult': 1.8747822013631006, 'tsl_mult': 0.5060153572150127, 'strategy': 'mean_reversion', 'time_stop': 257, 'use_sma': True, 'use_atr': True, 'use_adx': True, 'use_ema': False, 'use_spike': True, 'rsi_required': True, 'edge_k': 0.44636157719391045, 'edge_cap': 0.5174540080482659, 'bull_strategy': 'breakout', 'bull_bb_std_mult': 2.8603833722214826, 'bull_rsi_os': 13, 'bull_rsi_ob': 68, 'bull_adx_thresh': 8.262512529425097, 'bull_atr_min_pct': 0.006065338785156358, 'bull_atr_max_pct': 0.03676580977245869, 'bull_tp_mult': 2.576657980418024, 'bull_tsl_mult': 0.5946459280631827, 'bull_time_stop': 155, 'bull_use_sma': True, 'bull_use_ema': False, 'bull_use_atr': False, 'bull_use_adx': False, 'bull_use_spike': True, 'bull_rsi_required': False, 'bear_strategy': 'mean_reversion', 'bear_bb_std_mult': 3.0505842271133132, 'bear_rsi_os': 40, 'bear_rsi_ob': 58, 'bear_adx_thresh': 33.183786518743084, 'bear_atr_min_pct': 0.024116992243371375, 'bear_atr_max_pct': 0.08200044857544637, 'bear_tp_mult': 1.0705631101100095, 'bear_tsl_mult': 0.8942629297520421, 'bear_time_stop': 172, 'bear_use_sma': False, 'bear_use_ema': False, 'bear_use_atr': True, 'bear_use_adx': False, 'bear_use_spike': True, 'bear_rsi_required': False, 'sideways_strategy': 'mean_reversion', 'sideways_bb_std_mult': 2.8977278465442597, 'sideways_rsi_os': 40, 'sideways_rsi_ob': 91, 'sideways_adx_thresh': 23.139102407268055, 'sideways_atr_min_pct': 0.009557696876199607, 'sideways_atr_max_pct': 0.03062681249063516, 'sideways_tp_mult': 2.4483988349554533, 'sideways_tsl_mult': 0.13909157108229642, 'sideways_time_stop': 35, 'sideways_use_sma': True, 'sideways_use_ema': False, 'sideways_use_atr': False, 'sideways_use_adx': False, 'sideways_use_spike': False, 'sideways_rsi_required': False}.
[I 2025-09-01 07:57:04,178] Trial 230 finished with values: [-1000000000.0, 1000000000.0] and parameters: {'p_sma': 6, 'p_std': 17, 'p_atr': 12, 'p_adx': 18, 'rsi_period': 62, 'ema1': 8, 'ema2': 14, 'slip_atr_k': 0.06800514178771783, 'slip_spread_k': 0.267563241094726, 'spread_hl_frac': 0.03510363191640749, 'bb_std_mult': 1.3847226430122084, 'rsi_os': 22, 'rsi_ob': 57, 'vol_spike': 0.016058873458783873, 'adx_thresh': 24.240142804302415, 'atr_min_pct': 0.018072390338560257, 'atr_max_pct': 0.14977617746079816, 'tp_mult': 1.3495224959267016, 'tsl_mult': 0.49847785181300164, 'strategy': 'breakout', 'time_stop': 235, 'use_sma': False, 'use_atr': True, 'use_adx': False, 'use_ema': False, 'use_spike': True, 'rsi_required': True, 'edge_k': 1.056441712993161, 'edge_cap': 0.1331165746002121, 'bull_strategy': 'mean_reversion', 'bull_bb_std_mult': 2.7669351575816905, 'bull_rsi_os': 13, 'bull_rsi_ob': 67, 'bull_adx_thresh': 8.25969235933417, 'bull_atr_min_pct': 0.006161332325026891, 'bull_atr_max_pct': 0.03626084270010295, 'bull_tp_mult': 2.2332993076189838, 'bull_tsl_mult': 0.10256241501493452, 'bull_time_stop': 149, 'bull_use_sma': False, 'bull_use_ema': False, 'bull_use_atr': False, 'bull_use_adx': False, 'bull_use_spike': True, 'bull_rsi_required': True, 'bear_strategy': 'mean_reversion', 'bear_bb_std_mult': 3.0418683365618233, 'bear_rsi_os': 21, 'bear_rsi_ob': 48, 'bear_adx_thresh': 32.89584153712726, 'bear_atr_min_pct': 0.022897189267221982, 'bear_atr_max_pct': 0.036928820679176355, 'bear_tp_mult': 2.104129896143129, 'bear_tsl_mult': 0.15073321824476027, 'bear_time_stop': 300, 'bear_use_sma': False, 'bear_use_ema': False, 'bear_use_atr': True, 'bear_use_adx': False, 'bear_use_spike': False, 'bear_rsi_required': False, 'sideways_strategy': 'mean_reversion', 'sideways_bb_std_mult': 0.7295237059775943, 'sideways_rsi_os': 48, 'sideways_rsi_ob': 65, 'sideways_adx_thresh': 10.291865735441972, 'sideways_atr_min_pct': 0.022384051636891538, 'sideways_atr_max_pct': 0.03128025867406726, 'sideways_tp_mult': 2.6376903960557296, 'sideways_tsl_mult': 0.12685247472459488, 'sideways_time_stop': 23, 'sideways_use_sma': True, 'sideways_use_ema': False, 'sideways_use_atr': False, 'sideways_use_adx': False, 'sideways_use_spike': False, 'sideways_rsi_required': False}.
[I 2025-09-01 07:57:05,141] Trial 228 finished with values: [-1000000000.0, 1000000000.0] and parameters: {'p_sma': 20, 'p_std': 16, 'p_atr': 12, 'p_adx': 7, 'rsi_period': 65, 'ema1': 9, 'ema2': 13, 'slip_atr_k': 0.06387062036781302, 'slip_spread_k': 0.6274280057741305, 'spread_hl_frac': 0.023238708534001576, 'bb_std_mult': 3.24592123213518, 'rsi_os': 22, 'rsi_ob': 72, 'vol_spike': 0.011652085024904557, 'adx_thresh': 24.93541552503263, 'atr_min_pct': 0.017894506637709154, 'atr_max_pct': 0.07633883837607397, 'tp_mult': 1.1231129277054133, 'tsl_mult': 0.5009388134383916, 'strategy': 'mean_reversion', 'time_stop': 235, 'use_sma': True, 'use_atr': True, 'use_adx': True, 'use_ema': True, 'use_spike': True, 'rsi_required': True, 'edge_k': 0.4239930431727783, 'edge_cap': 0.09717627750520719, 'bull_strategy': 'breakout', 'bull_bb_std_mult': 2.850088439004944, 'bull_rsi_os': 13, 'bull_rsi_ob': 69, 'bull_adx_thresh': 19.551213296945253, 'bull_atr_min_pct': 0.004562381048447332, 'bull_atr_max_pct': 0.036546034219846084, 'bull_tp_mult': 2.030331489581378, 'bull_tsl_mult': 0.26920997512753264, 'bull_time_stop': 103, 'bull_use_sma': False, 'bull_use_ema': False, 'bull_use_atr': False, 'bull_use_adx': False, 'bull_use_spike': True, 'bull_rsi_required': False, 'bear_strategy': 'mean_reversion', 'bear_bb_std_mult': 3.052314112469931, 'bear_rsi_os': 36, 'bear_rsi_ob': 60, 'bear_adx_thresh': 32.579852629616305, 'bear_atr_min_pct': 0.02282668943007906, 'bear_atr_max_pct': 0.08217428398431466, 'bear_tp_mult': 2.4358806664188934, 'bear_tsl_mult': 0.07443204354646979, 'bear_time_stop': 171, 'bear_use_sma': False, 'bear_use_ema': False, 'bear_use_atr': True, 'bear_use_adx': False, 'bear_use_spike': True, 'bear_rsi_required': True, 'sideways_strategy': 'mean_reversion', 'sideways_bb_std_mult': 1.138906678367114, 'sideways_rsi_os': 39, 'sideways_rsi_ob': 65, 'sideways_adx_thresh': 10.118763035041646, 'sideways_atr_min_pct': 0.009894321950348575, 'sideways_atr_max_pct': 0.030668972961101628, 'sideways_tp_mult': 2.5080738328466246, 'sideways_tsl_mult': 0.15475910909014964, 'sideways_time_stop': 119, 'sideways_use_sma': False, 'sideways_use_ema': False, 'sideways_use_atr': False, 'sideways_use_adx': True, 'sideways_use_spike': True, 'sideways_rsi_required': False}.
[I 2025-09-01 07:57:05,911] Trial 231 finished with values: [-1000000000.0, 1000000000.0] and parameters: {'p_sma': 13, 'p_std': 13, 'p_atr': 12, 'p_adx': 20, 'rsi_period': 62, 'ema1': 9, 'ema2': 14, 'slip_atr_k': 0.005620713912979483, 'slip_spread_k': 0.7873379636436462, 'spread_hl_frac': 0.025889487525618753, 'bb_std_mult': 3.239390599380156, 'rsi_os': 27, 'rsi_ob': 51, 'vol_spike': 0.23476246662957462, 'adx_thresh': 32.93995003710775, 'atr_min_pct': 0.028284897754254218, 'atr_max_pct': 0.04478523136568323, 'tp_mult': 2.030907710114935, 'tsl_mult': 0.5060557675597612, 'strategy': 'breakout', 'time_stop': 256, 'use_sma': False, 'use_atr': True, 'use_adx': False, 'use_ema': False, 'use_spike': True, 'rsi_required': True, 'edge_k': 0.7221512544719791, 'edge_cap': 0.7102516387394221, 'bull_strategy': 'mean_reversion', 'bull_bb_std_mult': 2.7486877538209757, 'bull_rsi_os': 13, 'bull_rsi_ob': 67, 'bull_adx_thresh': 8.560038797959695, 'bull_atr_min_pct': 0.006141107270125103, 'bull_atr_max_pct': 0.036326560058191765, 'bull_tp_mult': 1.3555094178562044, 'bull_tsl_mult': 0.6431055284362146, 'bull_time_stop': 148, 'bull_use_sma': False, 'bull_use_ema': False, 'bull_use_atr': False, 'bull_use_adx': False, 'bull_use_spike': True, 'bull_rsi_required': True, 'bear_strategy': 'mean_reversion', 'bear_bb_std_mult': 3.040246923697734, 'bear_rsi_os': 6, 'bear_rsi_ob': 52, 'bear_adx_thresh': 32.497571293591, 'bear_atr_min_pct': 0.02285952195966842, 'bear_atr_max_pct': 0.08144620618528788, 'bear_tp_mult': 1.187133732826023, 'bear_tsl_mult': 0.11919432199813051, 'bear_time_stop': 224, 'bear_use_sma': False, 'bear_use_ema': False, 'bear_use_atr': True, 'bear_use_adx': False, 'bear_use_spike': False, 'bear_rsi_required': False, 'sideways_strategy': 'mean_reversion', 'sideways_bb_std_mult': 2.8536742868779377, 'sideways_rsi_os': 48, 'sideways_rsi_ob': 65, 'sideways_adx_thresh': 29.945143993897823, 'sideways_atr_min_pct': 0.022255466960741987, 'sideways_atr_max_pct': 0.0312915226137451, 'sideways_tp_mult': 1.550370987356129, 'sideways_tsl_mult': 0.1356084541537953, 'sideways_time_stop': 21, 'sideways_use_sma': True, 'sideways_use_ema': True, 'sideways_use_atr': False, 'sideways_use_adx': False, 'sideways_use_spike': False, 'sideways_rsi_required': False}.
[I 2025-09-01 07:57:07,222] Trial 232 finished with values: [-1000000000.0, 1000000000.0] and parameters: {'p_sma': 17, 'p_std': 50, 'p_atr': 12, 'p_adx': 20, 'rsi_period': 62, 'ema1': 27, 'ema2': 28, 'slip_atr_k': 0.004420840320360386, 'slip_spread_k': 0.33618292540765327, 'spread_hl_frac': 0.025952756658103343, 'bb_std_mult': 3.2548919704266854, 'rsi_os': 22, 'rsi_ob': 58, 'vol_spike': 0.053460320114138246, 'adx_thresh': 9.721087054820636, 'atr_min_pct': 0.018613540543140034, 'atr_max_pct': 0.1495175694106225, 'tp_mult': 1.2907629361024047, 'tsl_mult': 0.4746004830521165, 'strategy': 'breakout', 'time_stop': 21, 'use_sma': False, 'use_atr': True, 'use_adx': False, 'use_ema': True, 'use_spike': True, 'rsi_required': False, 'edge_k': 1.0610642492293854, 'edge_cap': 0.13653569521782344, 'bull_strategy': 'mean_reversion', 'bull_bb_std_mult': 2.766358854944301, 'bull_rsi_os': 12, 'bull_rsi_ob': 67, 'bull_adx_thresh': 8.631892946212766, 'bull_atr_min_pct': 0.0039939701288048265, 'bull_atr_max_pct': 0.0356106436605647, 'bull_tp_mult': 1.9325116208652455, 'bull_tsl_mult': 0.6435317893822448, 'bull_time_stop': 148, 'bull_use_sma': False, 'bull_use_ema': False, 'bull_use_atr': True, 'bull_use_adx': True, 'bull_use_spike': False, 'bull_rsi_required': True, 'bear_strategy': 'mean_reversion', 'bear_bb_std_mult': 1.5268832866290385, 'bear_rsi_os': 43, 'bear_rsi_ob': 95, 'bear_adx_thresh': 24.75005261100222, 'bear_atr_min_pct': 0.022928927882617925, 'bear_atr_max_pct': 0.06419294751225764, 'bear_tp_mult': 2.017030265454353, 'bear_tsl_mult': 0.1382559363602548, 'bear_time_stop': 288, 'bear_use_sma': False, 'bear_use_ema': False, 'bear_use_atr': False, 'bear_use_adx': True, 'bear_use_spike': False, 'bear_rsi_required': True, 'sideways_strategy': 'mean_reversion', 'sideways_bb_std_mult': 0.7323035746991046, 'sideways_rsi_os': 32, 'sideways_rsi_ob': 65, 'sideways_adx_thresh': 10.3650174169477, 'sideways_atr_min_pct': 0.004289811089866414, 'sideways_atr_max_pct': 0.12060987112130475, 'sideways_tp_mult': 1.6067800152101972, 'sideways_tsl_mult': 0.5777568841599029, 'sideways_time_stop': 46, 'sideways_use_sma': False, 'sideways_use_ema': True, 'sideways_use_atr': False, 'sideways_use_adx': True, 'sideways_use_spike': True, 'sideways_rsi_required': False}.
[I 2025-09-01 07:57:49,398] Trial 235 finished with values: [-0.03294490210142598, 0.033422640315946446] and parameters: {'p_sma': 17, 'p_std': 14, 'p_atr': 13, 'p_adx': 15, 'rsi_period': 48, 'ema1': 11, 'ema2': 15, 'slip_atr_k': 0.05982430182105381, 'slip_spread_k': 0.023280189714320276, 'spread_hl_frac': 0.024564050065519764, 'bb_std_mult': 3.397659786680012, 'rsi_os': 17, 'rsi_ob': 83, 'vol_spike': 0.239126775932717, 'adx_thresh': 25.737834596657066, 'atr_min_pct': 0.013022142545364103, 'atr_max_pct': 0.14980931500403627, 'tp_mult': 1.183171497052008, 'tsl_mult': 0.4776182220771828, 'strategy': 'mean_reversion', 'time_stop': 246, 'use_sma': True, 'use_atr': False, 'use_adx': True, 'use_ema': True, 'use_spike': True, 'rsi_required': False, 'edge_k': 1.0036746707815323, 'edge_cap': 0.10623699723795359, 'bull_strategy': 'breakout', 'bull_bb_std_mult': 2.976464656715013, 'bull_rsi_os': 12, 'bull_rsi_ob': 93, 'bull_adx_thresh': 27.53175042637247, 'bull_atr_min_pct': 0.0033108979257314335, 'bull_atr_max_pct': 0.09946051034876191, 'bull_tp_mult': 2.269723142580717, 'bull_tsl_mult': 0.7072464297043857, 'bull_time_stop': 162, 'bull_use_sma': True, 'bull_use_ema': False, 'bull_use_atr': True, 'bull_use_adx': True, 'bull_use_spike': False, 'bull_rsi_required': False, 'bear_strategy': 'breakout', 'bear_bb_std_mult': 3.1905811476378205, 'bear_rsi_os': 43, 'bear_rsi_ob': 66, 'bear_adx_thresh': 31.246015572487885, 'bear_atr_min_pct': 0.02204253285563863, 'bear_atr_max_pct': 0.07743579805666426, 'bear_tp_mult': 2.195484819259521, 'bear_tsl_mult': 0.6556571887671919, 'bear_time_stop': 289, 'bear_use_sma': True, 'bear_use_ema': False, 'bear_use_atr': False, 'bear_use_adx': True, 'bear_use_spike': True, 'bear_rsi_required': True, 'sideways_strategy': 'breakout', 'sideways_bb_std_mult': 2.6604147405932483, 'sideways_rsi_os': 13, 'sideways_rsi_ob': 88, 'sideways_adx_thresh': 9.089607788208092, 'sideways_atr_min_pct': 0.01232179849845825, 'sideways_atr_max_pct': 0.03532044334027525, 'sideways_tp_mult': 2.550085482813135, 'sideways_tsl_mult': 0.17084353542207173, 'sideways_time_stop': 19, 'sideways_use_sma': False, 'sideways_use_ema': False, 'sideways_use_atr': True, 'sideways_use_adx': True, 'sideways_use_spike': True, 'sideways_rsi_required': True}.
