[I 2025-09-01 08:42:39,284] Trial 504 finished with values: [-0.025225061418450045, 0.027946570186030785] and parameters: {'p_sma': 37, 'p_std': 19, 'p_atr': 21, 'p_adx': 21, 'rsi_period': 35, 'ema1': 8, 'ema2': 36, 'slip_atr_k': 0.05022899960838516, 'slip_spread_k': 0.6522059171716936, 'spread_hl_frac': 0.0045091830480938, 'bb_std_mult': 3.4734818282632305, 'rsi_os': 26, 'rsi_ob': 67, 'vol_spike': 0.24909967724208032, 'adx_thresh': 12.893764960421857, 'atr_min_pct': 0.0212399462020215, 'atr_max_pct': 0.037063957539127106, 'tp_mult': 2.996941778186878, 'tsl_mult': 0.5128882219923959, 'strategy': 'breakout', 'time_stop': 264, 'use_sma': True, 'use_atr': True, 'use_adx': False, 'use_ema': True, 'use_spike': True, 'rsi_required': True, 'edge_k': 1.0410941992256468, 'edge_cap': 0.0704014566417075, 'bull_strategy': 'breakout', 'bull_bb_std_mult': 1.871095476461804, 'bull_rsi_os': 44, 'bull_rsi_ob': 77, 'bull_adx_thresh': 5.909628131058435, 'bull_atr_min_pct': 0.02162394534941673, 'bull_atr_max_pct': 0.04968791175900031, 'bull_tp_mult': 2.2796991960988726, 'bull_tsl_mult': 0.6558362984118694, 'bull_time_stop': 12, 'bull_use_sma': False, 'bull_use_ema': False, 'bull_use_atr': False, 'bull_use_adx': False, 'bull_use_spike': True, 'bull_rsi_required': True, 'bear_strategy': 'breakout', 'bear_bb_std_mult': 3.350154347420726, 'bear_rsi_os': 27, 'bear_rsi_ob': 67, 'bear_adx_thresh': 32.848261507955414, 'bear_atr_min_pct': 0.0028808748202175417, 'bear_atr_max_pct': 0.10225123974436803, 'bear_tp_mult': 2.608518965993205, 'bear_tsl_mult': 0.047791715002343485, 'bear_time_stop': 294, 'bear_use_sma': False, 'bear_use_ema': False, 'bear_use_atr': True, 'bear_use_adx': True, 'bear_use_spike': True, 'bear_rsi_required': True, 'sideways_strategy': 'mean_reversion', 'sideways_bb_std_mult': 0.5582958888247749, 'sideways_rsi_os': 45, 'sideways_rsi_ob': 86, 'sideways_adx_thresh': 17.29903992300728, 'sideways_atr_min_pct': 0.003811122207714594, 'sideways_atr_max_pct': 0.07708954498219607, 'sideways_tp_mult': 2.7663616361821113, 'sideways_tsl_mult': 0.25781449922612726, 'sideways_time_stop': 281, 'sideways_use_sma': False, 'sideways_use_ema': True, 'sideways_use_atr': False, 'sideways_use_adx': False, 'sideways_use_spike': False, 'sideways_rsi_required': False}.
[I 2025-09-01 08:42:39,293] Trial 505 finished with values: [-1000000000.0, 0.41212025596620006] and parameters: {'p_sma': 20, 'p_std': 17, 'p_atr': 10, 'p_adx': 21, 'rsi_period': 70, 'ema1': 14, 'ema2': 57, 'slip_atr_k': 0.1052929387594659, 'slip_spread_k': 0.6822610621039277, 'spread_hl_frac': 0.04636535666382235, 'bb_std_mult': 3.479316471339825, 'rsi_os': 26, 'rsi_ob': 55, 'vol_spike': 0.24116504717143733, 'adx_thresh': 9.606646638680324, 'atr_min_pct': 0.02037113594970938, 'atr_max_pct': 0.0538406543326994, 'tp_mult': 2.138623987893885, 'tsl_mult': 0.06550956069512759, 'strategy': 'breakout', 'time_stop': 231, 'use_sma': False, 'use_atr': True, 'use_adx': False, 'use_ema': True, 'use_spike': True, 'rsi_required': True, 'edge_k': 1.0388140703743252, 'edge_cap': 0.16866199092953515, 'bull_strategy': 'mean_reversion', 'bull_bb_std_mult': 1.60892999583018, 'bull_rsi_os': 15, 'bull_rsi_ob': 83, 'bull_adx_thresh': 13.51407130062082, 'bull_atr_min_pct': 0.019917000714479195, 'bull_atr_max_pct': 0.148039608494289, 'bull_tp_mult': 2.2799485820882945, 'bull_tsl_mult': 0.0899454205178799, 'bull_time_stop': 180, 'bull_use_sma': False, 'bull_use_ema': False, 'bull_use_atr': False, 'bull_use_adx': False, 'bull_use_spike': True, 'bull_rsi_required': True, 'bear_strategy': 'breakout', 'bear_bb_std_mult': 0.6210536999443927, 'bear_rsi_os': 45, 'bear_rsi_ob': 94, 'bear_adx_thresh': 10.014332621740941, 'bear_atr_min_pct': 0.0010840794625334993, 'bear_atr_max_pct': 0.08451028649797517, 'bear_tp_mult': 2.428557175164831, 'bear_tsl_mult': 0.8817520228901132, 'bear_time_stop': 55, 'bear_use_sma': False, 'bear_use_ema': True, 'bear_use_atr': True, 'bear_use_adx': True, 'bear_use_spike': True, 'bear_rsi_required': True, 'sideways_strategy': 'mean_reversion', 'sideways_bb_std_mult': 1.226797826628268, 'sideways_rsi_os': 38, 'sideways_rsi_ob': 52, 'sideways_adx_thresh': 17.452786989974594, 'sideways_atr_min_pct': 0.025066334515705002, 'sideways_atr_max_pct': 0.017587267181579963, 'sideways_tp_mult': 2.652743734139065, 'sideways_tsl_mult': 0.2140126570242277, 'sideways_time_stop': 35, 'sideways_use_sma': False, 'sideways_use_ema': True, 'sideways_use_atr': False, 'sideways_use_adx': False, 'sideways_use_spike': False, 'sideways_rsi_required': False}.
[I 2025-09-01 08:42:39,732] Trial 503 finished with values: [-1000000000.0, 1000000000.0] and parameters: {'p_sma': 20, 'p_std': 17, 'p_atr': 21, 'p_adx': 22, 'rsi_period': 68, 'ema1': 8, 'ema2': 11, 'slip_atr_k': 0.050169537884159565, 'slip_spread_k': 0.7291588903990541, 'spread_hl_frac': 0.023004660944472854, 'bb_std_mult': 3.4791303327224847, 'rsi_os': 26, 'rsi_ob': 55, 'vol_spike': 0.20489771888527544, 'adx_thresh': 24.55787407765371, 'atr_min_pct': 0.02123576401328909, 'atr_max_pct': 0.1497787198598278, 'tp_mult': 1.2184279766829502, 'tsl_mult': 0.049129356590914164, 'strategy': 'breakout', 'time_stop': 289, 'use_sma': True, 'use_atr': True, 'use_adx': False, 'use_ema': True, 'use_spike': True, 'rsi_required': True, 'edge_k': 1.035425212861167, 'edge_cap': 0.9621524208842711, 'bull_strategy': 'breakout', 'bull_bb_std_mult': 2.7528907019483184, 'bull_rsi_os': 11, 'bull_rsi_ob': 83, 'bull_adx_thresh': 6.722501833371416, 'bull_atr_min_pct': 0.021400619206628495, 'bull_atr_max_pct': 0.1486860795896584, 'bull_tp_mult': 2.2897770483372395, 'bull_tsl_mult': 0.6539470924064712, 'bull_time_stop': 149, 'bull_use_sma': False, 'bull_use_ema': False, 'bull_use_atr': False, 'bull_use_adx': False, 'bull_use_spike': True, 'bull_rsi_required': True, 'bear_strategy': 'breakout', 'bear_bb_std_mult': 3.353105527179443, 'bear_rsi_os': 5, 'bear_rsi_ob': 95, 'bear_adx_thresh': 9.79399744368216, 'bear_atr_min_pct': 0.0031507302064524133, 'bear_atr_max_pct': 0.08384249890970491, 'bear_tp_mult': 2.6160041685181374, 'bear_tsl_mult': 0.050293059639299025, 'bear_time_stop': 80, 'bear_use_sma': False, 'bear_use_ema': False, 'bear_use_atr': True, 'bear_use_adx': True, 'bear_use_spike': True, 'bear_rsi_required': True, 'sideways_strategy': 'mean_reversion', 'sideways_bb_std_mult': 0.5551052864456005, 'sideways_rsi_os': 38, 'sideways_rsi_ob': 64, 'sideways_adx_thresh': 27.308910216526964, 'sideways_atr_min_pct': 0.024950475101729, 'sideways_atr_max_pct': 0.06358730916260133, 'sideways_tp_mult': 2.664148679231677, 'sideways_tsl_mult': 0.14677175708288426, 'sideways_time_stop': 286, 'sideways_use_sma': False, 'sideways_use_ema': True, 'sideways_use_atr': False, 'sideways_use_adx': False, 'sideways_use_spike': False, 'sideways_rsi_required': False}.
[I 2025-09-01 08:42:40,074] Trial 507 finished with values: [-0.34680030649690885, 0.3468026534890635] and parameters: {'p_sma': 20, 'p_std': 12, 'p_atr': 21, 'p_adx': 21, 'rsi_period': 60, 'ema1': 8, 'ema2': 56, 'slip_atr_k': 0.14475032421037462, 'slip_spread_k': 0.6836191818484645, 'spread_hl_frac': 0.015993147332693712, 'bb_std_mult': 3.5985732100751933, 'rsi_os': 36, 'rsi_ob': 62, 'vol_spike': 0.2517854153216159, 'adx_thresh': 24.440090613887968, 'atr_min_pct': 0.01505152894514967, 'atr_max_pct': 0.14991191130101378, 'tp_mult': 2.5512326686493365, 'tsl_mult': 0.5715731483312757, 'strategy': 'mean_reversion', 'time_stop': 130, 'use_sma': True, 'use_atr': True, 'use_adx': True, 'use_ema': True, 'use_spike': True, 'rsi_required': True, 'edge_k': 0.35453052007193975, 'edge_cap': 0.09334746199723735, 'bull_strategy': 'breakout', 'bull_bb_std_mult': 2.87240830652071, 'bull_rsi_os': 14, 'bull_rsi_ob': 83, 'bull_adx_thresh': 13.566319548168241, 'bull_atr_min_pct': 0.002196734674001593, 'bull_atr_max_pct': 0.1495535866081345, 'bull_tp_mult': 2.288418466782512, 'bull_tsl_mult': 0.6534431927815921, 'bull_time_stop': 157, 'bull_use_sma': True, 'bull_use_ema': False, 'bull_use_atr': False, 'bull_use_adx': True, 'bull_use_spike': True, 'bull_rsi_required': False, 'bear_strategy': 'breakout', 'bear_bb_std_mult': 3.250259267647564, 'bear_rsi_os': 42, 'bear_rsi_ob': 75, 'bear_adx_thresh': 31.66845507443019, 'bear_atr_min_pct': 0.0008657596187081514, 'bear_atr_max_pct': 0.08462695596668449, 'bear_tp_mult': 2.9015594377924447, 'bear_tsl_mult': 0.881389357370804, 'bear_time_stop': 54, 'bear_use_sma': False, 'bear_use_ema': False, 'bear_use_atr': True, 'bear_use_adx': True, 'bear_use_spike': True, 'bear_rsi_required': True, 'sideways_strategy': 'mean_reversion', 'sideways_bb_std_mult': 0.5507255733479747, 'sideways_rsi_os': 39, 'sideways_rsi_ob': 64, 'sideways_adx_thresh': 9.925322398431314, 'sideways_atr_min_pct': 0.02245592944314426, 'sideways_atr_max_pct': 0.07657813103494109, 'sideways_tp_mult': 2.6039248737398815, 'sideways_tsl_mult': 0.20983264216304784, 'sideways_time_stop': 37, 'sideways_use_sma': False, 'sideways_use_ema': False, 'sideways_use_atr': False, 'sideways_use_adx': True, 'sideways_use_spike': True, 'sideways_rsi_required': False}.
[I 2025-09-01 08:43:21,592] Trial 509 finished with values: [-1000000000.0, 1000000000.0] and parameters: {'p_sma': 33, 'p_std': 13, 'p_atr': 8, 'p_adx': 20, 'rsi_period': 36, 'ema1': 8, 'ema2': 41, 'slip_atr_k': 0.06071621573983074, 'slip_spread_k': 0.6035932795463651, 'spread_hl_frac': 0.02464508838707303, 'bb_std_mult': 1.5653414850123921, 'rsi_os': 38, 'rsi_ob': 67, 'vol_spike': 0.24602594790091728, 'adx_thresh': 24.50176265976734, 'atr_min_pct': 0.010055494936866333, 'atr_max_pct': 0.11971730418314686, 'tp_mult': 1.9935639386950916, 'tsl_mult': 0.6593315656233568, 'strategy': 'mean_reversion', 'time_stop': 289, 'use_sma': True, 'use_atr': True, 'use_adx': True, 'use_ema': True, 'use_spike': True, 'rsi_required': True, 'edge_k': 0.3550199649030865, 'edge_cap': 0.08661259707032068, 'bull_strategy': 'breakout', 'bull_bb_std_mult': 2.7315951869146056, 'bull_rsi_os': 13, 'bull_rsi_ob': 70, 'bull_adx_thresh': 19.984172611770166, 'bull_atr_min_pct': 0.005571368670857453, 'bull_atr_max_pct': 0.07104285741044966, 'bull_tp_mult': 2.3539991576842016, 'bull_tsl_mult': 0.5148753362543674, 'bull_time_stop': 169, 'bull_use_sma': True, 'bull_use_ema': False, 'bull_use_atr': False, 'bull_use_adx': True, 'bull_use_spike': True, 'bull_rsi_required': False, 'bear_strategy': 'mean_reversion', 'bear_bb_std_mult': 1.4960195157909908, 'bear_rsi_os': 51, 'bear_rsi_ob': 75, 'bear_adx_thresh': 27.2851348115014, 'bear_atr_min_pct': 0.006866953911957149, 'bear_atr_max_pct': 0.05431455408167149, 'bear_tp_mult': 2.6316658323735513, 'bear_tsl_mult': 0.06025311985820712, 'bear_time_stop': 189, 'bear_use_sma': False, 'bear_use_ema': False, 'bear_use_atr': True, 'bear_use_adx': False, 'bear_use_spike': True, 'bear_rsi_required': False, 'sideways_strategy': 'mean_reversion', 'sideways_bb_std_mult': 0.6682360642583343, 'sideways_rsi_os': 46, 'sideways_rsi_ob': 48, 'sideways_adx_thresh': 10.735683344991203, 'sideways_atr_min_pct': 0.022448322085231277, 'sideways_atr_max_pct': 0.027190035558524478, 'sideways_tp_mult': 2.6161594833249393, 'sideways_tsl_mult': 0.15842141931191753, 'sideways_time_stop': 19, 'sideways_use_sma': False, 'sideways_use_ema': False, 'sideways_use_atr': False, 'sideways_use_adx': True, 'sideways_use_spike': True, 'sideways_rsi_required': False}.
[I 2025-09-01 08:43:22,799] Trial 510 finished with values: [-0.07009541668933128, 0.07049410813518255] and parameters: {'p_sma': 18, 'p_std': 19, 'p_atr': 13, 'p_adx': 20, 'rsi_period': 60, 'ema1': 9, 'ema2': 40, 'slip_atr_k': 0.22770357914352246, 'slip_spread_k': 0.6443295821336519, 'spread_hl_frac': 0.011824330891211533, 'bb_std_mult': 3.2015004195491334, 'rsi_os': 31, 'rsi_ob': 62, 'vol_spike': 0.24581807069044292, 'adx_thresh': 25.862944010543185, 'atr_min_pct': 0.01489649525233014, 'atr_max_pct': 0.14998117961415128, 'tp_mult': 2.0057990591871593, 'tsl_mult': 0.11343845179605139, 'strategy': 'mean_reversion', 'time_stop': 263, 'use_sma': True, 'use_atr': True, 'use_adx': True, 'use_ema': True, 'use_spike': True, 'rsi_required': True, 'edge_k': 0.645865364325668, 'edge_cap': 0.0986452081658104, 'bull_strategy': 'breakout', 'bull_bb_std_mult': 0.5510156008860632, 'bull_rsi_os': 14, 'bull_rsi_ob': 47, 'bull_adx_thresh': 27.21542606612263, 'bull_atr_min_pct': 0.002311241776291935, 'bull_atr_max_pct': 0.08996190772379628, 'bull_tp_mult': 2.346572510059288, 'bull_tsl_mult': 0.6667448239393555, 'bull_time_stop': 168, 'bull_use_sma': True, 'bull_use_ema': False, 'bull_use_atr': False, 'bull_use_adx': True, 'bull_use_spike': True, 'bull_rsi_required': False, 'bear_strategy': 'mean_reversion', 'bear_bb_std_mult': 3.012890616713966, 'bear_rsi_os': 24, 'bear_rsi_ob': 95, 'bear_adx_thresh': 13.389843002367105, 'bear_atr_min_pct': 0.021935859595419, 'bear_atr_max_pct': 0.054220807865803966, 'bear_tp_mult': 2.902609667446619, 'bear_tsl_mult': 0.6644977986875924, 'bear_time_stop': 188, 'bear_use_sma': False, 'bear_use_ema': False, 'bear_use_atr': True, 'bear_use_adx': False, 'bear_use_spike': True, 'bear_rsi_required': False, 'sideways_strategy': 'mean_reversion', 'sideways_bb_std_mult': 0.658911582209042, 'sideways_rsi_os': 5, 'sideways_rsi_ob': 68, 'sideways_adx_thresh': 6.999950327592693, 'sideways_atr_min_pct': 0.022577952304624414, 'sideways_atr_max_pct': 0.027851279529480813, 'sideways_tp_mult': 2.4309633562464605, 'sideways_tsl_mult': 0.7041910267018298, 'sideways_time_stop': 20, 'sideways_use_sma': False, 'sideways_use_ema': False, 'sideways_use_atr': False, 'sideways_use_adx': True, 'sideways_use_spike': True, 'sideways_rsi_required': False}.
[I 2025-09-01 08:43:22,805] Trial 511 finished with values: [-0.03538050884641486, 0.03586209539921729] and parameters: {'p_sma': 14, 'p_std': 19, 'p_atr': 13, 'p_adx': 20, 'rsi_period': 32, 'ema1': 9, 'ema2': 12, 'slip_atr_k': 2.0827570115386496e-05, 'slip_spread_k': 0.6028901121936836, 'spread_hl_frac': 0.025799808805967925, 'bb_std_mult': 3.2457882162024077, 'rsi_os': 6, 'rsi_ob': 88, 'vol_spike': 0.2438913633476891, 'adx_thresh': 13.000619477452302, 'atr_min_pct': 0.021080545816825273, 'atr_max_pct': 0.0379706403157173, 'tp_mult': 1.1056187727598976, 'tsl_mult': 0.352453581330599, 'strategy': 'mean_reversion', 'time_stop': 264, 'use_sma': True, 'use_atr': True, 'use_adx': True, 'use_ema': False, 'use_spike': True, 'rsi_required': True, 'edge_k': 1.1129073377501904, 'edge_cap': 0.5576935250832882, 'bull_strategy': 'breakout', 'bull_bb_std_mult': 3.077799178861766, 'bull_rsi_os': 13, 'bull_rsi_ob': 73, 'bull_adx_thresh': 19.074732158136666, 'bull_atr_min_pct': 0.003122430564121611, 'bull_atr_max_pct': 0.03549377023698669, 'bull_tp_mult': 2.355089502583223, 'bull_tsl_mult': 0.7318164667103212, 'bull_time_stop': 156, 'bull_use_sma': True, 'bull_use_ema': False, 'bull_use_atr': False, 'bull_use_adx': True, 'bull_use_spike': True, 'bull_rsi_required': False, 'bear_strategy': 'mean_reversion', 'bear_bb_std_mult': 3.0248688271713755, 'bear_rsi_os': 24, 'bear_rsi_ob': 94, 'bear_adx_thresh': 32.60763565570775, 'bear_atr_min_pct': 0.02203740216560845, 'bear_atr_max_pct': 0.05501297144025221, 'bear_tp_mult': 2.7993491465243245, 'bear_tsl_mult': 0.07404206131142019, 'bear_time_stop': 92, 'bear_use_sma': False, 'bear_use_ema': False, 'bear_use_atr': True, 'bear_use_adx': False, 'bear_use_spike': True, 'bear_rsi_required': False, 'sideways_strategy': 'breakout', 'sideways_bb_std_mult': 0.6664200925993011, 'sideways_rsi_os': 5, 'sideways_rsi_ob': 68, 'sideways_adx_thresh': 7.040724600001624, 'sideways_atr_min_pct': 0.027417279916424352, 'sideways_atr_max_pct': 0.0600129495972749, 'sideways_tp_mult': 2.711564203366494, 'sideways_tsl_mult': 0.11722075620796163, 'sideways_time_stop': 236, 'sideways_use_sma': False, 'sideways_use_ema': False, 'sideways_use_atr': False, 'sideways_use_adx': True, 'sideways_use_spike': True, 'sideways_rsi_required': False}.
[I 2025-09-01 08:43:22,977] Trial 508 finished with values: [-1000000000.0, 1000000000.0] and parameters: {'p_sma': 33, 'p_std': 13, 'p_atr': 13, 'p_adx': 20, 'rsi_period': 68, 'ema1': 8, 'ema2': 11, 'slip_atr_k': 0.060735758983829005, 'slip_spread_k': 0.42122951194618474, 'spread_hl_frac': 0.026056174752053105, 'bb_std_mult': 2.2945644162810486, 'rsi_os': 25, 'rsi_ob': 57, 'vol_spike': 0.2471270525583925, 'adx_thresh': 12.919324498075273, 'atr_min_pct': 0.021457230875423734, 'atr_max_pct': 0.14997795659173116, 'tp_mult': 2.9268152549637776, 'tsl_mult': 0.6673540513771465, 'strategy': 'mean_reversion', 'time_stop': 262, 'use_sma': True, 'use_atr': True, 'use_adx': True, 'use_ema': True, 'use_spike': True, 'rsi_required': True, 'edge_k': 0.4616738883103886, 'edge_cap': 0.08753090230930088, 'bull_strategy': 'breakout', 'bull_bb_std_mult': 0.9491308351064962, 'bull_rsi_os': 14, 'bull_rsi_ob': 68, 'bull_adx_thresh': 18.904525480696098, 'bull_atr_min_pct': 0.01581791206945889, 'bull_atr_max_pct': 0.07021606142437074, 'bull_tp_mult': 2.3600766707284837, 'bull_tsl_mult': 0.7272267595937288, 'bull_time_stop': 117, 'bull_use_sma': True, 'bull_use_ema': False, 'bull_use_atr': False, 'bull_use_adx': True, 'bull_use_spike': True, 'bull_rsi_required': False, 'bear_strategy': 'mean_reversion', 'bear_bb_std_mult': 3.34490236919867, 'bear_rsi_os': 49, 'bear_rsi_ob': 75, 'bear_adx_thresh': 34.494463532031844, 'bear_atr_min_pct': 0.006891520155259472, 'bear_atr_max_pct': 0.0779733175407507, 'bear_tp_mult': 2.8930737194867335, 'bear_tsl_mult': 0.6577205865981195, 'bear_time_stop': 172, 'bear_use_sma': False, 'bear_use_ema': False, 'bear_use_atr': True, 'bear_use_adx': False, 'bear_use_spike': True, 'bear_rsi_required': False, 'sideways_strategy': 'mean_reversion', 'sideways_bb_std_mult': 0.6638555587185283, 'sideways_rsi_os': 38, 'sideways_rsi_ob': 68, 'sideways_adx_thresh': 5.12647105303598, 'sideways_atr_min_pct': 0.022588950524708187, 'sideways_atr_max_pct': 0.028410629726793167, 'sideways_tp_mult': 2.423226950590859, 'sideways_tsl_mult': 0.47286378648047805, 'sideways_time_stop': 238, 'sideways_use_sma': False, 'sideways_use_ema': False, 'sideways_use_atr': False, 'sideways_use_adx': True, 'sideways_use_spike': True, 'sideways_rsi_required': False}.
[I 2025-09-01 08:44:07,888] Trial 512 finished with values: [-1000000000.0, 1000000000.0] and parameters: {'p_sma': 18, 'p_std': 35, 'p_atr': 13, 'p_adx': 13, 'rsi_period': 59, 'ema1': 13, 'ema2': 12, 'slip_atr_k': 0.23834449344919795, 'slip_spread_k': 0.5749927312131802, 'spread_hl_frac': 0.025766462921536108, 'bb_std_mult': 0.5838430334722755, 'rsi_os': 6, 'rsi_ob': 56, 'vol_spike': 0.11292745315671188, 'adx_thresh': 13.799402879871641, 'atr_min_pct': 0.01965496917891056, 'atr_max_pct': 0.1456178115731078, 'tp_mult': 1.1167453719274711, 'tsl_mult': 0.478984859889949, 'strategy': 'mean_reversion', 'time_stop': 114, 'use_sma': True, 'use_atr': True, 'use_adx': True, 'use_ema': False, 'use_spike': False, 'rsi_required': True, 'edge_k': 1.1048746459481258, 'edge_cap': 0.12730407308238229, 'bull_strategy': 'breakout', 'bull_bb_std_mult': 1.3776383556650629, 'bull_rsi_os': 17, 'bull_rsi_ob': 49, 'bull_adx_thresh': 30.689866621878686, 'bull_atr_min_pct': 0.0101728947664885, 'bull_atr_max_pct': 0.09118124686345863, 'bull_tp_mult': 2.2225165574814607, 'bull_tsl_mult': 0.30555824972246237, 'bull_time_stop': 12, 'bull_use_sma': True, 'bull_use_ema': False, 'bull_use_atr': False, 'bull_use_adx': True, 'bull_use_spike': True, 'bull_rsi_required': False, 'bear_strategy': 'mean_reversion', 'bear_bb_std_mult': 2.3527106638712345, 'bear_rsi_os': 40, 'bear_rsi_ob': 94, 'bear_adx_thresh': 34.28230605890824, 'bear_atr_min_pct': 0.02211945110924378, 'bear_atr_max_pct': 0.07371028393839935, 'bear_tp_mult': 2.1148137679425227, 'bear_tsl_mult': 0.1431655968495893, 'bear_time_stop': 94, 'bear_use_sma': False, 'bear_use_ema': False, 'bear_use_atr': True, 'bear_use_adx': False, 'bear_use_spike': True, 'bear_rsi_required': False, 'sideways_strategy': 'breakout', 'sideways_bb_std_mult': 0.6625211640165516, 'sideways_rsi_os': 15, 'sideways_rsi_ob': 67, 'sideways_adx_thresh': 26.202990564021647, 'sideways_atr_min_pct': 0.02173570148500021, 'sideways_atr_max_pct': 0.1324205051999955, 'sideways_tp_mult': 1.0967159574001273, 'sideways_tsl_mult': 0.7892710599382426, 'sideways_time_stop': 26, 'sideways_use_sma': False, 'sideways_use_ema': False, 'sideways_use_atr': False, 'sideways_use_adx': True, 'sideways_use_spike': True, 'sideways_rsi_required': False}.
