[I 2025-09-01 07:21:48,376] Trial 9 finished with values: [-0.15049967971621814, 0.15022411754667023] and parameters: {'p_sma': 30, 'p_std': 6, 'p_atr': 23, 'p_adx': 23, 'rsi_period': 47, 'ema1': 6, 'ema2': 42, 'slip_atr_k': 0.20408892620191652, 'slip_spread_k': 0.9520341652440883, 'spread_hl_frac': 0.008070524143349734, 'bb_std_mult': 1.8814132882102939, 'rsi_os': 22, 'rsi_ob': 57, 'vol_spike': 0.272917092553604, 'adx_thresh': 25.802574980550865, 'atr_min_pct': 0.0009951700727889555, 'atr_max_pct': 0.13364517249541585, 'tp_mult': 1.507629133892376, 'tsl_mult': 0.25997995157325327, 'strategy': 'mean_reversion', 'time_stop': 36, 'use_sma': True, 'use_atr': True, 'use_adx': True, 'use_ema': True, 'use_spike': False, 'rsi_required': True, 'edge_k': 1.3462647709669275, 'edge_cap': 0.5063046712788819, 'bull_strategy': 'breakout', 'bull_bb_std_mult': 2.980748019797835, 'bull_rsi_os': 22, 'bull_rsi_ob': 51, 'bull_adx_thresh': 25.3051325620503, 'bull_atr_min_pct': 0.0009342665559469753, 'bull_atr_max_pct': 0.14874130137860542, 'bull_tp_mult': 2.971666407974892, 'bull_tsl_mult': 0.4499015906213979, 'bull_time_stop': 154, 'bull_use_sma': False, 'bull_use_ema': True, 'bull_use_atr': True, 'bull_use_adx': True, 'bull_use_spike': True, 'bull_rsi_required': True, 'bear_strategy': 'breakout', 'bear_bb_std_mult': 3.022635658838026, 'bear_rsi_os': 31, 'bear_rsi_ob': 81, 'bear_adx_thresh': 20.151990151070443, 'bear_atr_min_pct': 0.022761705159316623, 'bear_atr_max_pct': 0.13124643981979783, 'bear_tp_mult': 1.495690481330872, 'bear_tsl_mult': 0.8048200280293265, 'bear_time_stop': 100, 'bear_use_sma': True, 'bear_use_ema': False, 'bear_use_atr': True, 'bear_use_adx': False, 'bear_use_spike': False, 'bear_rsi_required': True, 'sideways_strategy': 'mean_reversion', 'sideways_bb_std_mult': 2.9424150284494797, 'sideways_rsi_os': 38, 'sideways_rsi_ob': 91, 'sideways_adx_thresh': 22.048758695932367, 'sideways_atr_min_pct': 0.00014502961609914376, 'sideways_atr_max_pct': 0.029689937985207148, 'sideways_tp_mult': 2.708730892604924, 'sideways_tsl_mult': 0.08179001687756526, 'sideways_time_stop': 273, 'sideways_use_sma': True, 'sideways_use_ema': True, 'sideways_use_atr': False, 'sideways_use_adx': True, 'sideways_use_spike': True, 'sideways_rsi_required': False}.
[I 2025-09-01 07:21:48,888] Trial 10 finished with values: [-1000000000.0, 1000000000.0] and parameters: {'p_sma': 48, 'p_std': 19, 'p_atr': 19, 'p_adx': 10, 'rsi_period': 60, 'ema1': 21, 'ema2': 55, 'slip_atr_k': 0.08658761379357516, 'slip_spread_k': 0.4235819132345544, 'spread_hl_frac': 0.0416826218743712, 'bb_std_mult': 3.3881751438055083, 'rsi_os': 35, 'rsi_ob': 95, 'vol_spike': 0.2025893455613821, 'adx_thresh': 25.678852021275464, 'atr_min_pct': 0.008376492320280014, 'atr_max_pct': 0.079645368379444, 'tp_mult': 1.8708082556741656, 'tsl_mult': 0.18577523902738446, 'strategy': 'breakout', 'time_stop': 125, 'use_sma': False, 'use_atr': False, 'use_adx': False, 'use_ema': True, 'use_spike': False, 'rsi_required': False, 'edge_k': 0.8645211861002342, 'edge_cap': 0.9645011629125129, 'bull_strategy': 'breakout', 'bull_bb_std_mult': 3.5762645233039057, 'bull_rsi_os': 16, 'bull_rsi_ob': 83, 'bull_adx_thresh': 26.451153378317795, 'bull_atr_min_pct': 0.0047068304180746855, 'bull_atr_max_pct': 0.1270554370790673, 'bull_tp_mult': 1.0931612788240141, 'bull_tsl_mult': 0.8643996141945196, 'bull_time_stop': 24, 'bull_use_sma': True, 'bull_use_ema': False, 'bull_use_atr': True, 'bull_use_adx': False, 'bull_use_spike': False, 'bull_rsi_required': True, 'bear_strategy': 'mean_reversion', 'bear_bb_std_mult': 1.438232972521899, 'bear_rsi_os': 9, 'bear_rsi_ob': 49, 'bear_adx_thresh': 24.336193037946625, 'bear_atr_min_pct': 0.011952393276686785, 'bear_atr_max_pct': 0.0670984838235779, 'bear_tp_mult': 1.1457713227518422, 'bear_tsl_mult': 0.4582168822137451, 'bear_time_stop': 224, 'bear_use_sma': True, 'bear_use_ema': False, 'bear_use_atr': False, 'bear_use_adx': True, 'bear_use_spike': False, 'bear_rsi_required': True, 'sideways_strategy': 'mean_reversion', 'sideways_bb_std_mult': 1.3230914729820942, 'sideways_rsi_os': 7, 'sideways_rsi_ob': 75, 'sideways_adx_thresh': 20.87873679940311, 'sideways_atr_min_pct': 0.0289490585871092, 'sideways_atr_max_pct': 0.0403564341538237, 'sideways_tp_mult': 1.682009969352781, 'sideways_tsl_mult': 0.26910539194612615, 'sideways_time_stop': 266, 'sideways_use_sma': False, 'sideways_use_ema': True, 'sideways_use_atr': False, 'sideways_use_adx': False, 'sideways_use_spike': True, 'sideways_rsi_required': False}.
[I 2025-09-01 07:21:49,431] Trial 13 finished with values: [-1000000000.0, 1000000000.0] and parameters: {'p_sma': 36, 'p_std': 48, 'p_atr': 30, 'p_adx': 23, 'rsi_period': 33, 'ema1': 5, 'ema2': 42, 'slip_atr_k': 0.006184218125313279, 'slip_spread_k': 0.9651557826980908, 'spread_hl_frac': 0.02735929211428254, 'bb_std_mult': 2.811925051912091, 'rsi_os': 49, 'rsi_ob': 69, 'vol_spike': 0.2980101779190712, 'adx_thresh': 6.203660245480767, 'atr_min_pct': 0.029326733518634438, 'atr_max_pct': 0.017259748570700756, 'tp_mult': 2.3733001062039074, 'tsl_mult': 0.966669868149394, 'strategy': 'mean_reversion', 'time_stop': 94, 'use_sma': True, 'use_atr': True, 'use_adx': False, 'use_ema': False, 'use_spike': False, 'rsi_required': False, 'edge_k': 0.1508631962515804, 'edge_cap': 0.6105051311730629, 'bull_strategy': 'breakout', 'bull_bb_std_mult': 0.5857034374787531, 'bull_rsi_os': 24, 'bull_rsi_ob': 67, 'bull_adx_thresh': 15.574719192255415, 'bull_atr_min_pct': 0.00994653652505365, 'bull_atr_max_pct': 0.14837970587622623, 'bull_tp_mult': 2.999819303129561, 'bull_tsl_mult': 0.2941290633293192, 'bull_time_stop': 32, 'bull_use_sma': True, 'bull_use_ema': False, 'bull_use_atr': True, 'bull_use_adx': True, 'bull_use_spike': False, 'bull_rsi_required': True, 'bear_strategy': 'breakout', 'bear_bb_std_mult': 1.7821107802323506, 'bear_rsi_os': 53, 'bear_rsi_ob': 60, 'bear_adx_thresh': 28.68741507279888, 'bear_atr_min_pct': 0.001696907649809576, 'bear_atr_max_pct': 0.013589702086497388, 'bear_tp_mult': 1.9621865429951633, 'bear_tsl_mult': 0.8597996248113655, 'bear_time_stop': 36, 'bear_use_sma': False, 'bear_use_ema': False, 'bear_use_atr': True, 'bear_use_adx': True, 'bear_use_spike': False, 'bear_rsi_required': True, 'sideways_strategy': 'breakout', 'sideways_bb_std_mult': 2.59894318985324, 'sideways_rsi_os': 55, 'sideways_rsi_ob': 94, 'sideways_adx_thresh': 14.128707285891192, 'sideways_atr_min_pct': 0.003079726731789174, 'sideways_atr_max_pct': 0.015793825925205035, 'sideways_tp_mult': 1.042634016848421, 'sideways_tsl_mult': 0.6442956050794645, 'sideways_time_stop': 16, 'sideways_use_sma': False, 'sideways_use_ema': True, 'sideways_use_atr': True, 'sideways_use_adx': True, 'sideways_use_spike': True, 'sideways_rsi_required': False}.
[I 2025-09-01 07:21:49,527] Trial 14 finished with values: [-1000000000.0, 1000000000.0] and parameters: {'p_sma': 5, 'p_std': 46, 'p_atr': 29, 'p_adx': 21, 'rsi_period': 33, 'ema1': 27, 'ema2': 43, 'slip_atr_k': 0.009967817033724582, 'slip_spread_k': 0.8917510325424285, 'spread_hl_frac': 0.026676375513039145, 'bb_std_mult': 2.8877875452619364, 'rsi_os': 49, 'rsi_ob': 68, 'vol_spike': 0.28806573842058897, 'adx_thresh': 6.004533971486509, 'atr_min_pct': 0.029104929676584963, 'atr_max_pct': 0.013652244009343326, 'tp_mult': 2.223998744666909, 'tsl_mult': 0.8690855480521154, 'strategy': 'mean_reversion', 'time_stop': 80, 'use_sma': True, 'use_atr': True, 'use_adx': False, 'use_ema': False, 'use_spike': False, 'rsi_required': False, 'edge_k': 0.2241565535222949, 'edge_cap': 0.6458062816443926, 'bull_strategy': 'breakout', 'bull_bb_std_mult': 0.601740868284637, 'bull_rsi_os': 17, 'bull_rsi_ob': 68, 'bull_adx_thresh': 15.418295149800873, 'bull_atr_min_pct': 0.009615521804357255, 'bull_atr_max_pct': 0.010109417432592666, 'bull_tp_mult': 2.9831685541284068, 'bull_tsl_mult': 0.34510391682853886, 'bull_time_stop': 9, 'bull_use_sma': True, 'bull_use_ema': False, 'bull_use_atr': True, 'bull_use_adx': True, 'bull_use_spike': False, 'bull_rsi_required': True, 'bear_strategy': 'breakout', 'bear_bb_std_mult': 1.6449478457614215, 'bear_rsi_os': 52, 'bear_rsi_ob': 60, 'bear_adx_thresh': 30.388268951175533, 'bear_atr_min_pct': 0.002409434962689246, 'bear_atr_max_pct': 0.01191103237562377, 'bear_tp_mult': 1.9477818509669564, 'bear_tsl_mult': 0.8560877031108679, 'bear_time_stop': 44, 'bear_use_sma': False, 'bear_use_ema': False, 'bear_use_atr': True, 'bear_use_adx': True, 'bear_use_spike': False, 'bear_rsi_required': True, 'sideways_strategy': 'breakout', 'sideways_bb_std_mult': 0.5600371740736354, 'sideways_rsi_os': 55, 'sideways_rsi_ob': 45, 'sideways_adx_thresh': 13.590409865950356, 'sideways_atr_min_pct': 0.0019337171203800702, 'sideways_atr_max_pct': 0.012002391189982003, 'sideways_tp_mult': 1.0232281166792248, 'sideways_tsl_mult': 0.6599271837566667, 'sideways_time_stop': 22, 'sideways_use_sma': False, 'sideways_use_ema': True, 'sideways_use_atr': True, 'sideways_use_adx': True, 'sideways_use_spike': True, 'sideways_rsi_required': False}.
[I 2025-09-01 07:21:49,911] Trial 11 finished with values: [-1000000000.0, 1000000000.0] and parameters: {'p_sma': 16, 'p_std': 5, 'p_atr': 13, 'p_adx': 19, 'rsi_period': 60, 'ema1': 12, 'ema2': 59, 'slip_atr_k': 0.014088590765295311, 'slip_spread_k': 0.5339203160998691, 'spread_hl_frac': 0.04873463282012777, 'bb_std_mult': 3.1666932436085293, 'rsi_os': 44, 'rsi_ob': 62, 'vol_spike': 0.2639664502599111, 'adx_thresh': 26.844177681154523, 'atr_min_pct': 0.02864330823228626, 'atr_max_pct': 0.13505841226728563, 'tp_mult': 1.1912514717568812, 'tsl_mult': 0.6776614231632494, 'strategy': 'breakout', 'time_stop': 135, 'use_sma': False, 'use_atr': True, 'use_adx': False, 'use_ema': True, 'use_spike': True, 'rsi_required': True, 'edge_k': 1.396427324617257, 'edge_cap': 0.4105852754935769, 'bull_strategy': 'mean_reversion', 'bull_bb_std_mult': 1.589164689993028, 'bull_rsi_os': 53, 'bull_rsi_ob': 46, 'bull_adx_thresh': 12.016526201707483, 'bull_atr_min_pct': 0.007164472680624295, 'bull_atr_max_pct': 0.024548506375825625, 'bull_tp_mult': 1.1362588323270062, 'bull_tsl_mult': 0.4298786318102412, 'bull_time_stop': 298, 'bull_use_sma': False, 'bull_use_ema': True, 'bull_use_atr': False, 'bull_use_adx': False, 'bull_use_spike': True, 'bull_rsi_required': False, 'bear_strategy': 'mean_reversion', 'bear_bb_std_mult': 3.026264108193802, 'bear_rsi_os': 15, 'bear_rsi_ob': 67, 'bear_adx_thresh': 18.762135349521536, 'bear_atr_min_pct': 0.021933472583779992, 'bear_atr_max_pct': 0.1160271972154193, 'bear_tp_mult': 1.3931569062167397, 'bear_tsl_mult': 0.2700672221502911, 'bear_time_stop': 8, 'bear_use_sma': True, 'bear_use_ema': True, 'bear_use_atr': False, 'bear_use_adx': False, 'bear_use_spike': False, 'bear_rsi_required': False, 'sideways_strategy': 'breakout', 'sideways_bb_std_mult': 0.9051982511472604, 'sideways_rsi_os': 8, 'sideways_rsi_ob': 57, 'sideways_adx_thresh': 19.33042654614457, 'sideways_atr_min_pct': 0.008711038184403958, 'sideways_atr_max_pct': 0.06389251769974154, 'sideways_tp_mult': 2.51891229147785, 'sideways_tsl_mult': 0.44140220401324826, 'sideways_time_stop': 25, 'sideways_use_sma': False, 'sideways_use_ema': False, 'sideways_use_atr': False, 'sideways_use_adx': False, 'sideways_use_spike': False, 'sideways_rsi_required': False}.
[I 2025-09-01 07:22:21,263] Trial 12 finished with values: [-0.10830144573549261, 0.10775704572973392] and parameters: {'p_sma': 13, 'p_std': 47, 'p_atr': 25, 'p_adx': 13, 'rsi_period': 14, 'ema1': 28, 'ema2': 49, 'slip_atr_k': 0.19512565824325034, 'slip_spread_k': 0.8173341934469452, 'spread_hl_frac': 0.023184610835107727, 'bb_std_mult': 0.846397937614154, 'rsi_os': 35, 'rsi_ob': 81, 'vol_spike': 0.03941792250995173, 'adx_thresh': 13.64544714630124, 'atr_min_pct': 0.0062061455678042166, 'atr_max_pct': 0.11740615318394136, 'tp_mult': 1.4807456856408354, 'tsl_mult': 0.8081389192272134, 'strategy': 'breakout', 'time_stop': 284, 'use_sma': False, 'use_atr': False, 'use_adx': False, 'use_ema': True, 'use_spike': True, 'rsi_required': False, 'edge_k': 0.7441228293201705, 'edge_cap': 0.4862805253486045, 'bull_strategy': 'mean_reversion', 'bull_bb_std_mult': 1.1104164141969528, 'bull_rsi_os': 31, 'bull_rsi_ob': 92, 'bull_adx_thresh': 27.185387584897292, 'bull_atr_min_pct': 0.021448039539623803, 'bull_atr_max_pct': 0.08752180113353342, 'bull_tp_mult': 1.393701127268499, 'bull_tsl_mult': 0.9359860538669941, 'bull_time_stop': 123, 'bull_use_sma': False, 'bull_use_ema': True, 'bull_use_atr': True, 'bull_use_adx': True, 'bull_use_spike': False, 'bull_rsi_required': False, 'bear_strategy': 'mean_reversion', 'bear_bb_std_mult': 1.4012705850691938, 'bear_rsi_os': 15, 'bear_rsi_ob': 71, 'bear_adx_thresh': 30.747232222956345, 'bear_atr_min_pct': 0.0021114122293472513, 'bear_atr_max_pct': 0.11183771769851605, 'bear_tp_mult': 2.990135556956981, 'bear_tsl_mult': 0.9828397126077664, 'bear_time_stop': 156, 'bear_use_sma': False, 'bear_use_ema': True, 'bear_use_atr': True, 'bear_use_adx': True, 'bear_use_spike': True, 'bear_rsi_required': False, 'sideways_strategy': 'mean_reversion', 'sideways_bb_std_mult': 2.8374982105790116, 'sideways_rsi_os': 15, 'sideways_rsi_ob': 82, 'sideways_adx_thresh': 5.263099224393223, 'sideways_atr_min_pct': 0.001867707376165234, 'sideways_atr_max_pct': 0.14481908433842797, 'sideways_tp_mult': 1.1279047233298443, 'sideways_tsl_mult': 0.8748005317476683, 'sideways_time_stop': 243, 'sideways_use_sma': True, 'sideways_use_ema': False, 'sideways_use_atr': False, 'sideways_use_adx': True, 'sideways_use_spike': False, 'sideways_rsi_required': False}.
[I 2025-09-01 07:22:23,386] Trial 18 finished with values: [-1000000000.0, 1000000000.0] and parameters: {'p_sma': 43, 'p_std': 42, 'p_atr': 21, 'p_adx': 12, 'rsi_period': 8, 'ema1': 25, 'ema2': 34, 'slip_atr_k': 0.24065688599383867, 'slip_spread_k': 0.20987609249125505, 'spread_hl_frac': 0.018761571866964182, 'bb_std_mult': 2.547134668435989, 'rsi_os': 40, 'rsi_ob': 45, 'vol_spike': 0.10985579407760006, 'adx_thresh': 11.665606112164685, 'atr_min_pct': 0.018886958325508456, 'atr_max_pct': 0.11362652842648904, 'tp_mult': 2.2189604077643748, 'tsl_mult': 0.5828097442096779, 'strategy': 'mean_reversion', 'time_stop': 195, 'use_sma': True, 'use_atr': True, 'use_adx': False, 'use_ema': False, 'use_spike': False, 'rsi_required': False, 'edge_k': 0.5265469095655997, 'edge_cap': 0.0550096064066265, 'bull_strategy': 'mean_reversion', 'bull_bb_std_mult': 1.13516581338858, 'bull_rsi_os': 42, 'bull_rsi_ob': 75, 'bull_adx_thresh': 5.61240865001947, 'bull_atr_min_pct': 0.0160220388811926, 'bull_atr_max_pct': 0.10594391476791892, 'bull_tp_mult': 2.6230290161987937, 'bull_tsl_mult': 0.04503500982988198, 'bull_time_stop': 67, 'bull_use_sma': True, 'bull_use_ema': False, 'bull_use_atr': True, 'bull_use_adx': True, 'bull_use_spike': False, 'bull_rsi_required': True, 'bear_strategy': 'breakout', 'bear_bb_std_mult': 2.7197792976144957, 'bear_rsi_os': 23, 'bear_rsi_ob': 54, 'bear_adx_thresh': 5.300903980359575, 'bear_atr_min_pct': 0.0067728553121473595, 'bear_atr_max_pct': 0.026257913276458683, 'bear_tp_mult': 2.3302956521977896, 'bear_tsl_mult': 0.007998170168788066, 'bear_time_stop': 107, 'bear_use_sma': False, 'bear_use_ema': False, 'bear_use_atr': True, 'bear_use_adx': True, 'bear_use_spike': True, 'bear_rsi_required': True, 'sideways_strategy': 'breakout', 'sideways_bb_std_mult': 1.614698095312181, 'sideways_rsi_os': 47, 'sideways_rsi_ob': 64, 'sideways_adx_thresh': 17.48108037031335, 'sideways_atr_min_pct': 0.008252316350891306, 'sideways_atr_max_pct': 0.10462096628142784, 'sideways_tp_mult': 1.2462475118837189, 'sideways_tsl_mult': 0.9730004305839781, 'sideways_time_stop': 71, 'sideways_use_sma': True, 'sideways_use_ema': True, 'sideways_use_atr': True, 'sideways_use_adx': False, 'sideways_use_spike': True, 'sideways_rsi_required': True}.
[I 2025-09-01 07:22:28,489] Trial 17 finished with values: [-0.13528283714431177, 0.13549798463126128] and parameters: {'p_sma': 49, 'p_std': 44, 'p_atr': 21, 'p_adx': 13, 'rsi_period': 7, 'ema1': 24, 'ema2': 35, 'slip_atr_k': 0.24008575965540863, 'slip_spread_k': 0.22280916882496415, 'spread_hl_frac': 0.012862545201387743, 'bb_std_mult': 2.3595006182576217, 'rsi_os': 25, 'rsi_ob': 78, 'vol_spike': 0.008283905784747081, 'adx_thresh': 12.996414819710369, 'atr_min_pct': 0.01845587993113868, 'atr_max_pct': 0.05869856819680515, 'tp_mult': 1.571605344985745, 'tsl_mult': 0.2891130497071842, 'strategy': 'mean_reversion', 'time_stop': 218, 'use_sma': True, 'use_atr': True, 'use_adx': False, 'use_ema': False, 'use_spike': False, 'rsi_required': False, 'edge_k': 0.5242653459712734, 'edge_cap': 0.06498065375298206, 'bull_strategy': 'breakout', 'bull_bb_std_mult': 1.1431180189822687, 'bull_rsi_os': 27, 'bull_rsi_ob': 76, 'bull_adx_thresh': 22.072813732518288, 'bull_atr_min_pct': 0.0012640003048487343, 'bull_atr_max_pct': 0.10495631454881452, 'bull_tp_mult': 2.643076015142081, 'bull_tsl_mult': 0.00930651139022301, 'bull_time_stop': 54, 'bull_use_sma': True, 'bull_use_ema': False, 'bull_use_atr': True, 'bull_use_adx': True, 'bull_use_spike': False, 'bull_rsi_required': True, 'bear_strategy': 'breakout', 'bear_bb_std_mult': 2.842640798574534, 'bear_rsi_os': 25, 'bear_rsi_ob': 54, 'bear_adx_thresh': 25.527135408742406, 'bear_atr_min_pct': 0.00657301775272117, 'bear_atr_max_pct': 0.030944529207115753, 'bear_tp_mult': 2.2642839100912258, 'bear_tsl_mult': 0.024182378379495384, 'bear_time_stop': 103, 'bear_use_sma': False, 'bear_use_ema': False, 'bear_use_atr': True, 'bear_use_adx': True, 'bear_use_spike': False, 'bear_rsi_required': True, 'sideways_strategy': 'breakout', 'sideways_bb_std_mult': 1.6006964452890438, 'sideways_rsi_os': 47, 'sideways_rsi_ob': 65, 'sideways_adx_thresh': 18.011912977491253, 'sideways_atr_min_pct': 0.008831316176389319, 'sideways_atr_max_pct': 0.14953689833915657, 'sideways_tp_mult': 2.21524961385731, 'sideways_tsl_mult': 0.24203505099116224, 'sideways_time_stop': 74, 'sideways_use_sma': True, 'sideways_use_ema': True, 'sideways_use_atr': True, 'sideways_use_adx': True, 'sideways_use_spike': True, 'sideways_rsi_required': True}.
[I 2025-09-01 07:22:28,902] Trial 16 finished with values: [-1000000000.0, 1000000000.0] and parameters: {'p_sma': 47, 'p_std': 43, 'p_atr': 22, 'p_adx': 12, 'rsi_period': 34, 'ema1': 25, 'ema2': 34, 'slip_atr_k': 0.2468294694571151, 'slip_spread_k': 0.1628606813339291, 'spread_hl_frac': 0.016844603451123118, 'bb_std_mult': 3.067450743924816, 'rsi_os': 42, 'rsi_ob': 77, 'vol_spike': 0.0010019813826822599, 'adx_thresh': 13.190582985426921, 'atr_min_pct': 0.018575212741233537, 'atr_max_pct': 0.12326493517717221, 'tp_mult': 1.538105661893211, 'tsl_mult': 0.6345311639188789, 'strategy': 'mean_reversion', 'time_stop': 197, 'use_sma': True, 'use_atr': True, 'use_adx': False, 'use_ema': False, 'use_spike': False, 'rsi_required': False, 'edge_k': 1.956633545888257, 'edge_cap': 0.4358374489395115, 'bull_strategy': 'mean_reversion', 'bull_bb_std_mult': 1.2145495644248785, 'bull_rsi_os': 27, 'bull_rsi_ob': 74, 'bull_adx_thresh': 5.242353232573816, 'bull_atr_min_pct': 0.008797339573980139, 'bull_atr_max_pct': 0.11325481415862784, 'bull_tp_mult': 2.5980785107035014, 'bull_tsl_mult': 0.03528194397907103, 'bull_time_stop': 60, 'bull_use_sma': True, 'bull_use_ema': False, 'bull_use_atr': True, 'bull_use_adx': True, 'bull_use_spike': False, 'bull_rsi_required': True, 'bear_strategy': 'breakout', 'bear_bb_std_mult': 2.8949733696636466, 'bear_rsi_os': 24, 'bear_rsi_ob': 81, 'bear_adx_thresh': 34.90717473243993, 'bear_atr_min_pct': 0.006512582064763258, 'bear_atr_max_pct': 0.14488952266757382, 'bear_tp_mult': 2.220932262873578, 'bear_tsl_mult': 0.038472041828672476, 'bear_time_stop': 120, 'bear_use_sma': False, 'bear_use_ema': False, 'bear_use_atr': True, 'bear_use_adx': True, 'bear_use_spike': False, 'bear_rsi_required': True, 'sideways_strategy': 'breakout', 'sideways_bb_std_mult': 1.5607214733549666, 'sideways_rsi_os': 45, 'sideways_rsi_ob': 64, 'sideways_adx_thresh': 15.794884388744963, 'sideways_atr_min_pct': 0.0080955191254326, 'sideways_atr_max_pct': 0.14494980897570386, 'sideways_tp_mult': 2.199638199053166, 'sideways_tsl_mult': 0.2889314015856892, 'sideways_time_stop': 69, 'sideways_use_sma': True, 'sideways_use_ema': True, 'sideways_use_atr': True, 'sideways_use_adx': False, 'sideways_use_spike': True, 'sideways_rsi_required': True}.
