[I 2025-09-01 07:47:56,140] Trial 169 finished with values: [-0.05805842723601995, 0.058376421950950844] and parameters: {'p_sma': 21, 'p_std': 19, 'p_atr': 23, 'p_adx': 22, 'rsi_period': 65, 'ema1': 8, 'ema2': 14, 'slip_atr_k': 0.048307579227032646, 'slip_spread_k': 0.09996338170173913, 'spread_hl_frac': 0.007540585078725192, 'bb_std_mult': 3.3872823963804137, 'rsi_os': 25, 'rsi_ob': 56, 'vol_spike': 0.2495521706350711, 'adx_thresh': 13.044072266960143, 'atr_min_pct': 0.003385986987450058, 'atr_max_pct': 0.14720295083502433, 'tp_mult': 1.0834746482798367, 'tsl_mult': 0.5289505615201228, 'strategy': 'mean_reversion', 'time_stop': 253, 'use_sma': True, 'use_atr': True, 'use_adx': True, 'use_ema': False, 'use_spike': True, 'rsi_required': False, 'edge_k': 0.9189759053389678, 'edge_cap': 0.13060145035975348, 'bull_strategy': 'breakout', 'bull_bb_std_mult': 0.5912455143108035, 'bull_rsi_os': 25, 'bull_rsi_ob': 71, 'bull_adx_thresh': 8.24812505547411, 'bull_atr_min_pct': 0.0027587696516416784, 'bull_atr_max_pct': 0.12146251894857903, 'bull_tp_mult': 2.2758140233657125, 'bull_tsl_mult': 0.6358722188122361, 'bull_time_stop': 151, 'bull_use_sma': True, 'bull_use_ema': False, 'bull_use_atr': True, 'bull_use_adx': True, 'bull_use_spike': False, 'bull_rsi_required': False, 'bear_strategy': 'mean_reversion', 'bear_bb_std_mult': 3.04744834998991, 'bear_rsi_os': 34, 'bear_rsi_ob': 75, 'bear_adx_thresh': 31.52216013506399, 'bear_atr_min_pct': 0.019982938514840804, 'bear_atr_max_pct': 0.08775117936991673, 'bear_tp_mult': 2.818477126645927, 'bear_tsl_mult': 0.09568663001196258, 'bear_time_stop': 50, 'bear_use_sma': False, 'bear_use_ema': True, 'bear_use_atr': True, 'bear_use_adx': True, 'bear_use_spike': True, 'bear_rsi_required': False, 'sideways_strategy': 'mean_reversion', 'sideways_bb_std_mult': 0.5509715339769627, 'sideways_rsi_os': 41, 'sideways_rsi_ob': 65, 'sideways_adx_thresh': 9.679550708031996, 'sideways_atr_min_pct': 0.011570708785085732, 'sideways_atr_max_pct': 0.08240440541494799, 'sideways_tp_mult': 2.492561418643088, 'sideways_tsl_mult': 0.1666558413210906, 'sideways_time_stop': 14, 'sideways_use_sma': False, 'sideways_use_ema': True, 'sideways_use_atr': False, 'sideways_use_adx': True, 'sideways_use_spike': True, 'sideways_rsi_required': False}.
[I 2025-09-01 07:47:56,337] Trial 172 finished with values: [-1000000000.0, 1000000000.0] and parameters: {'p_sma': 17, 'p_std': 12, 'p_atr': 7, 'p_adx': 22, 'rsi_period': 66, 'ema1': 9, 'ema2': 12, 'slip_atr_k': 0.0524515448227646, 'slip_spread_k': 0.6330049085666258, 'spread_hl_frac': 0.006922276530184342, 'bb_std_mult': 3.4056752154023346, 'rsi_os': 22, 'rsi_ob': 56, 'vol_spike': 0.23919706404163074, 'adx_thresh': 30.306319798610026, 'atr_min_pct': 0.016224322373949968, 'atr_max_pct': 0.14218800924276795, 'tp_mult': 1.266057757199525, 'tsl_mult': 0.528295074033842, 'strategy': 'mean_reversion', 'time_stop': 25, 'use_sma': True, 'use_atr': True, 'use_adx': True, 'use_ema': False, 'use_spike': True, 'rsi_required': False, 'edge_k': 0.9229180356377298, 'edge_cap': 0.13253437505689622, 'bull_strategy': 'breakout', 'bull_bb_std_mult': 2.7275631127331117, 'bull_rsi_os': 25, 'bull_rsi_ob': 69, 'bull_adx_thresh': 29.62827987847779, 'bull_atr_min_pct': 0.023958702396777186, 'bull_atr_max_pct': 0.12322576267593204, 'bull_tp_mult': 2.2639431780470165, 'bull_tsl_mult': 0.6723813734707935, 'bull_time_stop': 171, 'bull_use_sma': True, 'bull_use_ema': False, 'bull_use_atr': True, 'bull_use_adx': True, 'bull_use_spike': False, 'bull_rsi_required': False, 'bear_strategy': 'mean_reversion', 'bear_bb_std_mult': 1.129351247087266, 'bear_rsi_os': 34, 'bear_rsi_ob': 71, 'bear_adx_thresh': 31.22396615071543, 'bear_atr_min_pct': 0.029997180502976954, 'bear_atr_max_pct': 0.11394110960776324, 'bear_tp_mult': 1.6461663591816258, 'bear_tsl_mult': 0.09182083418679032, 'bear_time_stop': 66, 'bear_use_sma': False, 'bear_use_ema': True, 'bear_use_atr': False, 'bear_use_adx': True, 'bear_use_spike': False, 'bear_rsi_required': False, 'sideways_strategy': 'mean_reversion', 'sideways_bb_std_mult': 3.1967499099116523, 'sideways_rsi_os': 38, 'sideways_rsi_ob': 71, 'sideways_adx_thresh': 8.087981585271397, 'sideways_atr_min_pct': 0.0030007353833603097, 'sideways_atr_max_pct': 0.02262225139112578, 'sideways_tp_mult': 2.5000905905627144, 'sideways_tsl_mult': 0.1792411542119429, 'sideways_time_stop': 14, 'sideways_use_sma': False, 'sideways_use_ema': False, 'sideways_use_atr': False, 'sideways_use_adx': True, 'sideways_use_spike': True, 'sideways_rsi_required': False}.
[I 2025-09-01 07:47:56,892] Trial 176 finished with values: [-1000000000.0, 1000000000.0] and parameters: {'p_sma': 39, 'p_std': 38, 'p_atr': 17, 'p_adx': 28, 'rsi_period': 62, 'ema1': 11, 'ema2': 37, 'slip_atr_k': 0.05994557210670298, 'slip_spread_k': 0.6622782433022558, 'spread_hl_frac': 0.024284219612416745, 'bb_std_mult': 3.202067614395792, 'rsi_os': 55, 'rsi_ob': 87, 'vol_spike': 0.25880632738629594, 'adx_thresh': 25.80362398341785, 'atr_min_pct': 0.020281330370499843, 'atr_max_pct': 0.14980477979577816, 'tp_mult': 1.218741613515139, 'tsl_mult': 0.4844961392783566, 'strategy': 'mean_reversion', 'time_stop': 67, 'use_sma': True, 'use_atr': False, 'use_adx': True, 'use_ema': True, 'use_spike': False, 'rsi_required': True, 'edge_k': 1.060608134055583, 'edge_cap': 0.06495963973911933, 'bull_strategy': 'breakout', 'bull_bb_std_mult': 2.7991516134011265, 'bull_rsi_os': 19, 'bull_rsi_ob': 46, 'bull_adx_thresh': 7.194362205206258, 'bull_atr_min_pct': 0.012908498340149229, 'bull_atr_max_pct': 0.08244897592899615, 'bull_tp_mult': 2.3565029800605006, 'bull_tsl_mult': 0.6491601263922281, 'bull_time_stop': 203, 'bull_use_sma': True, 'bull_use_ema': True, 'bull_use_atr': False, 'bull_use_adx': True, 'bull_use_spike': True, 'bull_rsi_required': True, 'bear_strategy': 'mean_reversion', 'bear_bb_std_mult': 0.6920249723619616, 'bear_rsi_os': 32, 'bear_rsi_ob': 57, 'bear_adx_thresh': 32.8767749773636, 'bear_atr_min_pct': 0.024474627529777297, 'bear_atr_max_pct': 0.09925589861127267, 'bear_tp_mult': 2.910145396597287, 'bear_tsl_mult': 0.1441032683953815, 'bear_time_stop': 58, 'bear_use_sma': True, 'bear_use_ema': False, 'bear_use_atr': False, 'bear_use_adx': True, 'bear_use_spike': True, 'bear_rsi_required': True, 'sideways_strategy': 'breakout', 'sideways_bb_std_mult': 0.68847589104316, 'sideways_rsi_os': 17, 'sideways_rsi_ob': 88, 'sideways_adx_thresh': 16.44737193257254, 'sideways_atr_min_pct': 0.02399430259966035, 'sideways_atr_max_pct': 0.034705095689091345, 'sideways_tp_mult': 2.5742584183142703, 'sideways_tsl_mult': 0.11467291758653646, 'sideways_time_stop': 46, 'sideways_use_sma': False, 'sideways_use_ema': False, 'sideways_use_atr': True, 'sideways_use_adx': True, 'sideways_use_spike': True, 'sideways_rsi_required': True}.
[I 2025-09-01 07:48:38,450] Trial 177 finished with values: [-1000000000.0, 1000000000.0] and parameters: {'p_sma': 18, 'p_std': 20, 'p_atr': 8, 'p_adx': 7, 'rsi_period': 69, 'ema1': 15, 'ema2': 13, 'slip_atr_k': 0.24045950230063784, 'slip_spread_k': 0.2648943440430631, 'spread_hl_frac': 0.025593713282290247, 'bb_std_mult': 3.5044706722315477, 'rsi_os': 29, 'rsi_ob': 60, 'vol_spike': 0.24605082132359662, 'adx_thresh': 14.136043431332004, 'atr_min_pct': 0.004386227480542312, 'atr_max_pct': 0.1440482950652091, 'tp_mult': 2.4066690656300507, 'tsl_mult': 0.4941287999209895, 'strategy': 'mean_reversion', 'time_stop': 259, 'use_sma': True, 'use_atr': True, 'use_adx': True, 'use_ema': True, 'use_spike': True, 'rsi_required': True, 'edge_k': 0.3848191750911387, 'edge_cap': 0.4263240236769859, 'bull_strategy': 'breakout', 'bull_bb_std_mult': 2.855012751507859, 'bull_rsi_os': 37, 'bull_rsi_ob': 67, 'bull_adx_thresh': 32.025546696649755, 'bull_atr_min_pct': 0.028219988865200697, 'bull_atr_max_pct': 0.0430052554937477, 'bull_tp_mult': 2.3185240946656105, 'bull_tsl_mult': 0.7113388772823002, 'bull_time_stop': 158, 'bull_use_sma': True, 'bull_use_ema': False, 'bull_use_atr': False, 'bull_use_adx': True, 'bull_use_spike': True, 'bull_rsi_required': False, 'bear_strategy': 'mean_reversion', 'bear_bb_std_mult': 3.2008976704843333, 'bear_rsi_os': 6, 'bear_rsi_ob': 94, 'bear_adx_thresh': 32.374450215180325, 'bear_atr_min_pct': 0.006410181137160253, 'bear_atr_max_pct': 0.12722980861772393, 'bear_tp_mult': 2.0437264070004524, 'bear_tsl_mult': 0.6479110584309066, 'bear_time_stop': 16, 'bear_use_sma': True, 'bear_use_ema': False, 'bear_use_atr': True, 'bear_use_adx': True, 'bear_use_spike': True, 'bear_rsi_required': True, 'sideways_strategy': 'mean_reversion', 'sideways_bb_std_mult': 0.5020860440555117, 'sideways_rsi_os': 12, 'sideways_rsi_ob': 64, 'sideways_adx_thresh': 30.81752877073672, 'sideways_atr_min_pct': 0.013724909659003904, 'sideways_atr_max_pct': 0.030539370421182634, 'sideways_tp_mult': 2.555219569539693, 'sideways_tsl_mult': 0.1997841972978186, 'sideways_time_stop': 35, 'sideways_use_sma': False, 'sideways_use_ema': False, 'sideways_use_atr': False, 'sideways_use_adx': True, 'sideways_use_spike': True, 'sideways_rsi_required': True}.
[I 2025-09-01 07:48:38,750] Trial 173 finished with values: [-1000000000.0, 1000000000.0] and parameters: {'p_sma': 21, 'p_std': 18, 'p_atr': 19, 'p_adx': 28, 'rsi_period': 69, 'ema1': 11, 'ema2': 12, 'slip_atr_k': 0.0323495890079466, 'slip_spread_k': 0.6652518029285841, 'spread_hl_frac': 0.02499441884961006, 'bb_std_mult': 3.2131044923239664, 'rsi_os': 24, 'rsi_ob': 73, 'vol_spike': 0.2503084512530912, 'adx_thresh': 14.07226948769798, 'atr_min_pct': 0.016258871434236034, 'atr_max_pct': 0.12316661493925139, 'tp_mult': 1.7850410626725473, 'tsl_mult': 0.8233974599443739, 'strategy': 'mean_reversion', 'time_stop': 123, 'use_sma': True, 'use_atr': True, 'use_adx': True, 'use_ema': True, 'use_spike': True, 'rsi_required': True, 'edge_k': 0.00011988580914423785, 'edge_cap': 0.062313641891194316, 'bull_strategy': 'breakout', 'bull_bb_std_mult': 2.411932848829892, 'bull_rsi_os': 17, 'bull_rsi_ob': 70, 'bull_adx_thresh': 20.095789250254555, 'bull_atr_min_pct': 0.02007383345459467, 'bull_atr_max_pct': 0.0736653788068624, 'bull_tp_mult': 2.338428101979839, 'bull_tsl_mult': 0.6511322125391255, 'bull_time_stop': 173, 'bull_use_sma': True, 'bull_use_ema': False, 'bull_use_atr': False, 'bull_use_adx': True, 'bull_use_spike': True, 'bull_rsi_required': False, 'bear_strategy': 'mean_reversion', 'bear_bb_std_mult': 1.1347005074193355, 'bear_rsi_os': 31, 'bear_rsi_ob': 92, 'bear_adx_thresh': 32.804607705387006, 'bear_atr_min_pct': 0.019510254822515248, 'bear_atr_max_pct': 0.04803581509783534, 'bear_tp_mult': 2.8935648481604197, 'bear_tsl_mult': 0.12797255520626394, 'bear_time_stop': 50, 'bear_use_sma': True, 'bear_use_ema': True, 'bear_use_atr': False, 'bear_use_adx': True, 'bear_use_spike': False, 'bear_rsi_required': True, 'sideways_strategy': 'mean_reversion', 'sideways_bb_std_mult': 2.8471768903296995, 'sideways_rsi_os': 38, 'sideways_rsi_ob': 64, 'sideways_adx_thresh': 16.329052193607886, 'sideways_atr_min_pct': 0.024578842151528106, 'sideways_atr_max_pct': 0.028349646644975836, 'sideways_tp_mult': 2.5599904167831355, 'sideways_tsl_mult': 0.18617465832589378, 'sideways_time_stop': 33, 'sideways_use_sma': False, 'sideways_use_ema': False, 'sideways_use_atr': False, 'sideways_use_adx': True, 'sideways_use_spike': True, 'sideways_rsi_required': True}.
[I 2025-09-01 07:48:39,009] Trial 174 finished with values: [-1000000000.0, 1000000000.0] and parameters: {'p_sma': 18, 'p_std': 17, 'p_atr': 7, 'p_adx': 20, 'rsi_period': 63, 'ema1': 25, 'ema2': 12, 'slip_atr_k': 0.18242943510678308, 'slip_spread_k': 0.6727743600446555, 'spread_hl_frac': 0.024869125689893294, 'bb_std_mult': 3.2151027453735086, 'rsi_os': 24, 'rsi_ob': 73, 'vol_spike': 0.25209991910190077, 'adx_thresh': 14.354489972779815, 'atr_min_pct': 0.02559351057734523, 'atr_max_pct': 0.14983562574765513, 'tp_mult': 2.892962083892864, 'tsl_mult': 0.48972846653303165, 'strategy': 'mean_reversion', 'time_stop': 69, 'use_sma': True, 'use_atr': True, 'use_adx': True, 'use_ema': True, 'use_spike': True, 'rsi_required': True, 'edge_k': 1.0697212111277197, 'edge_cap': 0.06566136818918548, 'bull_strategy': 'breakout', 'bull_bb_std_mult': 3.5365129579832804, 'bull_rsi_os': 45, 'bull_rsi_ob': 67, 'bull_adx_thresh': 25.38808090505255, 'bull_atr_min_pct': 0.0281454796981575, 'bull_atr_max_pct': 0.043277610434966515, 'bull_tp_mult': 2.324770939345436, 'bull_tsl_mult': 0.65107909192336, 'bull_time_stop': 174, 'bull_use_sma': True, 'bull_use_ema': False, 'bull_use_atr': False, 'bull_use_adx': True, 'bull_use_spike': True, 'bull_rsi_required': False, 'bear_strategy': 'mean_reversion', 'bear_bb_std_mult': 3.212487784924941, 'bear_rsi_os': 32, 'bear_rsi_ob': 57, 'bear_adx_thresh': 32.94251533176315, 'bear_atr_min_pct': 0.029459957230435298, 'bear_atr_max_pct': 0.08467830565096893, 'bear_tp_mult': 2.8907831443104204, 'bear_tsl_mult': 0.1352012821595296, 'bear_time_stop': 49, 'bear_use_sma': True, 'bear_use_ema': False, 'bear_use_atr': False, 'bear_use_adx': True, 'bear_use_spike': True, 'bear_rsi_required': True, 'sideways_strategy': 'mean_reversion', 'sideways_bb_std_mult': 0.6907157550433258, 'sideways_rsi_os': 12, 'sideways_rsi_ob': 64, 'sideways_adx_thresh': 30.344126198101062, 'sideways_atr_min_pct': 0.02431081259631821, 'sideways_atr_max_pct': 0.14183199604368535, 'sideways_tp_mult': 2.5720778019876263, 'sideways_tsl_mult': 0.18035574436453086, 'sideways_time_stop': 277, 'sideways_use_sma': False, 'sideways_use_ema': False, 'sideways_use_atr': False, 'sideways_use_adx': True, 'sideways_use_spike': True, 'sideways_rsi_required': True}.
[I 2025-09-01 07:48:39,295] Trial 175 finished with values: [-1000000000.0, 1000000000.0] and parameters: {'p_sma': 23, 'p_std': 53, 'p_atr': 19, 'p_adx': 19, 'rsi_period': 69, 'ema1': 15, 'ema2': 12, 'slip_atr_k': 0.24460489735415486, 'slip_spread_k': 0.6680177847219692, 'spread_hl_frac': 0.0243530810656433, 'bb_std_mult': 3.5180704609972793, 'rsi_os': 24, 'rsi_ob': 55, 'vol_spike': 0.25746980946909087, 'adx_thresh': 26.044230511347976, 'atr_min_pct': 0.0022190623945976783, 'atr_max_pct': 0.14474948904684312, 'tp_mult': 1.5831279397029712, 'tsl_mult': 0.49141618303308465, 'strategy': 'mean_reversion', 'time_stop': 261, 'use_sma': True, 'use_atr': False, 'use_adx': True, 'use_ema': True, 'use_spike': False, 'rsi_required': True, 'edge_k': 1.076941499758384, 'edge_cap': 0.05131804532545791, 'bull_strategy': 'breakout', 'bull_bb_std_mult': 2.7816473557800574, 'bull_rsi_os': 19, 'bull_rsi_ob': 47, 'bull_adx_thresh': 32.54643941198816, 'bull_atr_min_pct': 0.00810781965752419, 'bull_atr_max_pct': 0.04280370768265847, 'bull_tp_mult': 2.335019155621629, 'bull_tsl_mult': 0.6531110024370153, 'bull_time_stop': 62, 'bull_use_sma': True, 'bull_use_ema': True, 'bull_use_atr': False, 'bull_use_adx': True, 'bull_use_spike': True, 'bull_rsi_required': True, 'bear_strategy': 'mean_reversion', 'bear_bb_std_mult': 3.12288488358527, 'bear_rsi_os': 38, 'bear_rsi_ob': 94, 'bear_adx_thresh': 32.80217102759251, 'bear_atr_min_pct': 0.024460250965004628, 'bear_atr_max_pct': 0.0840390688957592, 'bear_tp_mult': 2.9014506085481586, 'bear_tsl_mult': 0.1263189293125629, 'bear_time_stop': 98, 'bear_use_sma': True, 'bear_use_ema': False, 'bear_use_atr': False, 'bear_use_adx': True, 'bear_use_spike': True, 'bear_rsi_required': True, 'sideways_strategy': 'breakout', 'sideways_bb_std_mult': 0.6858430571327176, 'sideways_rsi_os': 53, 'sideways_rsi_ob': 75, 'sideways_adx_thresh': 8.840366088894854, 'sideways_atr_min_pct': 0.02168528423977667, 'sideways_atr_max_pct': 0.03329440711096296, 'sideways_tp_mult': 2.5629916560743515, 'sideways_tsl_mult': 0.11572078702439864, 'sideways_time_stop': 33, 'sideways_use_sma': False, 'sideways_use_ema': False, 'sideways_use_atr': True, 'sideways_use_adx': True, 'sideways_use_spike': True, 'sideways_rsi_required': True}.
[I 2025-09-01 07:49:21,102] Trial 181 finished with values: [-1000000000.0, 1000000000.0] and parameters: {'p_sma': 27, 'p_std': 14, 'p_atr': 18, 'p_adx': 18, 'rsi_period': 61, 'ema1': 10, 'ema2': 15, 'slip_atr_k': 0.04307805491460916, 'slip_spread_k': 0.6159974694317727, 'spread_hl_frac': 0.02650846620083213, 'bb_std_mult': 1.2601253648969326, 'rsi_os': 53, 'rsi_ob': 50, 'vol_spike': 0.22859015457897686, 'adx_thresh': 24.579005498306767, 'atr_min_pct': 0.02155887102433226, 'atr_max_pct': 0.13842724927679143, 'tp_mult': 2.124573852845701, 'tsl_mult': 0.9641735520892369, 'strategy': 'breakout', 'time_stop': 77, 'use_sma': False, 'use_atr': False, 'use_adx': False, 'use_ema': True, 'use_spike': False, 'rsi_required': True, 'edge_k': 0.9706663419906484, 'edge_cap': 0.6147896227064118, 'bull_strategy': 'mean_reversion', 'bull_bb_std_mult': 2.953904201829368, 'bull_rsi_os': 7, 'bull_rsi_ob': 53, 'bull_adx_thresh': 8.547157235731177, 'bull_atr_min_pct': 0.015095720870512282, 'bull_atr_max_pct': 0.05018463233355789, 'bull_tp_mult': 2.1608465059632374, 'bull_tsl_mult': 0.6212529314882718, 'bull_time_stop': 147, 'bull_use_sma': False, 'bull_use_ema': True, 'bull_use_atr': False, 'bull_use_adx': True, 'bull_use_spike': True, 'bull_rsi_required': False, 'bear_strategy': 'mean_reversion', 'bear_bb_std_mult': 3.1170280607556213, 'bear_rsi_os': 29, 'bear_rsi_ob': 95, 'bear_adx_thresh': 31.91085521960036, 'bear_atr_min_pct': 0.01839646098919984, 'bear_atr_max_pct': 0.0719718097070954, 'bear_tp_mult': 2.7865138155366003, 'bear_tsl_mult': 0.4609849462873154, 'bear_time_stop': 37, 'bear_use_sma': False, 'bear_use_ema': False, 'bear_use_atr': True, 'bear_use_adx': True, 'bear_use_spike': True, 'bear_rsi_required': False, 'sideways_strategy': 'mean_reversion', 'sideways_bb_std_mult': 0.6228390864308373, 'sideways_rsi_os': 39, 'sideways_rsi_ob': 49, 'sideways_adx_thresh': 18.32729451922622, 'sideways_atr_min_pct': 0.02336408842479493, 'sideways_atr_max_pct': 0.10327131805972149, 'sideways_tp_mult': 1.4119312946582672, 'sideways_tsl_mult': 0.14836990420920151, 'sideways_time_stop': 51, 'sideways_use_sma': False, 'sideways_use_ema': True, 'sideways_use_atr': False, 'sideways_use_adx': False, 'sideways_use_spike': False, 'sideways_rsi_required': False}.
[I 2025-09-01 07:49:22,194] Trial 179 finished with values: [-1000000000.0, 1000000000.0] and parameters: {'p_sma': 25, 'p_std': 14, 'p_atr': 16, 'p_adx': 19, 'rsi_period': 60, 'ema1': 10, 'ema2': 15, 'slip_atr_k': 0.06772607968171161, 'slip_spread_k': 0.600387509864803, 'spread_hl_frac': 0.0026233694659315403, 'bb_std_mult': 1.2244511363962256, 'rsi_os': 16, 'rsi_ob': 55, 'vol_spike': 0.2299151783814799, 'adx_thresh': 24.519185749457463, 'atr_min_pct': 0.007142597359889971, 'atr_max_pct': 0.02717405460612974, 'tp_mult': 1.1915826652943267, 'tsl_mult': 0.6894459732941187, 'strategy': 'breakout', 'time_stop': 246, 'use_sma': False, 'use_atr': False, 'use_adx': False, 'use_ema': True, 'use_spike': False, 'rsi_required': True, 'edge_k': 0.6248865906447181, 'edge_cap': 0.09390079816597141, 'bull_strategy': 'mean_reversion', 'bull_bb_std_mult': 2.9465951303597824, 'bull_rsi_os': 43, 'bull_rsi_ob': 52, 'bull_adx_thresh': 8.581468504261254, 'bull_atr_min_pct': 0.01764385304970545, 'bull_atr_max_pct': 0.09446815598266796, 'bull_tp_mult': 2.1288030259672417, 'bull_tsl_mult': 0.6194732469528923, 'bull_time_stop': 239, 'bull_use_sma': False, 'bull_use_ema': True, 'bull_use_atr': False, 'bull_use_adx': True, 'bull_use_spike': True, 'bull_rsi_required': True, 'bear_strategy': 'mean_reversion', 'bear_bb_std_mult': 3.1028652012226736, 'bear_rsi_os': 23, 'bear_rsi_ob': 95, 'bear_adx_thresh': 31.88362903079923, 'bear_atr_min_pct': 0.02342745570079312, 'bear_atr_max_pct': 0.14594380906758125, 'bear_tp_mult': 1.3817823352601133, 'bear_tsl_mult': 0.46685310906805705, 'bear_time_stop': 98, 'bear_use_sma': False, 'bear_use_ema': False, 'bear_use_atr': True, 'bear_use_adx': True, 'bear_use_spike': True, 'bear_rsi_required': False, 'sideways_strategy': 'breakout', 'sideways_bb_std_mult': 0.6311659580720043, 'sideways_rsi_os': 39, 'sideways_rsi_ob': 58, 'sideways_adx_thresh': 8.872024360501447, 'sideways_atr_min_pct': 0.022033946724085714, 'sideways_atr_max_pct': 0.1150600808924955, 'sideways_tp_mult': 2.658907600473089, 'sideways_tsl_mult': 0.1309953595781565, 'sideways_time_stop': 19, 'sideways_use_sma': False, 'sideways_use_ema': True, 'sideways_use_atr': True, 'sideways_use_adx': False, 'sideways_use_spike': False, 'sideways_rsi_required': False}.
