[I 2025-09-01 08:36:43,813] Trial 468 finished with values: [-1000000000.0, 1000000000.0] and parameters: {'p_sma': 53, 'p_std': 36, 'p_atr': 12, 'p_adx': 10, 'rsi_period': 76, 'ema1': 27, 'ema2': 16, 'slip_atr_k': 0.04113531120227901, 'slip_spread_k': 0.5516598958105752, 'spread_hl_frac': 0.04049884782719941, 'bb_std_mult': 0.8344950285134642, 'rsi_os': 23, 'rsi_ob': 92, 'vol_spike': 0.26363925701307955, 'adx_thresh': 26.008430872495797, 'atr_min_pct': 0.007766515358394333, 'atr_max_pct': 0.026469127082295506, 'tp_mult': 2.6209224265132414, 'tsl_mult': 0.44775307592977814, 'strategy': 'breakout', 'time_stop': 249, 'use_sma': False, 'use_atr': False, 'use_adx': False, 'use_ema': True, 'use_spike': True, 'rsi_required': False, 'edge_k': 0.0063901410193377695, 'edge_cap': 0.2041938189477433, 'bull_strategy': 'mean_reversion', 'bull_bb_std_mult': 0.7994938696620941, 'bull_rsi_os': 15, 'bull_rsi_ob': 52, 'bull_adx_thresh': 8.06441734942555, 'bull_atr_min_pct': 0.026248968502980845, 'bull_atr_max_pct': 0.13538184801030112, 'bull_tp_mult': 1.6299451948615924, 'bull_tsl_mult': 0.6921172923965083, 'bull_time_stop': 249, 'bull_use_sma': False, 'bull_use_ema': True, 'bull_use_atr': False, 'bull_use_adx': False, 'bull_use_spike': True, 'bull_rsi_required': True, 'bear_strategy': 'breakout', 'bear_bb_std_mult': 1.0666131040002906, 'bear_rsi_os': 43, 'bear_rsi_ob': 49, 'bear_adx_thresh': 15.666222910381755, 'bear_atr_min_pct': 0.02654896364303265, 'bear_atr_max_pct': 0.07696235961189377, 'bear_tp_mult': 2.8408615176153007, 'bear_tsl_mult': 0.07008243629963215, 'bear_time_stop': 111, 'bear_use_sma': False, 'bear_use_ema': True, 'bear_use_atr': False, 'bear_use_adx': True, 'bear_use_spike': True, 'bear_rsi_required': True, 'sideways_strategy': 'mean_reversion', 'sideways_bb_std_mult': 3.515615160601838, 'sideways_rsi_os': 34, 'sideways_rsi_ob': 95, 'sideways_adx_thresh': 10.625748045195623, 'sideways_atr_min_pct': 0.02288871936475924, 'sideways_atr_max_pct': 0.04907274057785406, 'sideways_tp_mult': 2.6088742749355927, 'sideways_tsl_mult': 0.30010664113853136, 'sideways_time_stop': 176, 'sideways_use_sma': True, 'sideways_use_ema': True, 'sideways_use_atr': False, 'sideways_use_adx': False, 'sideways_use_spike': False, 'sideways_rsi_required': False}.
[I 2025-09-01 08:36:44,120] Trial 470 finished with values: [-1000000000.0, 1000000000.0] and parameters: {'p_sma': 32, 'p_std': 18, 'p_atr': 12, 'p_adx': 10, 'rsi_period': 63, 'ema1': 11, 'ema2': 24, 'slip_atr_k': 0.013577208938853946, 'slip_spread_k': 0.915737348564849, 'spread_hl_frac': 0.040205379759911494, 'bb_std_mult': 3.4726943364533667, 'rsi_os': 23, 'rsi_ob': 55, 'vol_spike': 0.1644986751682875, 'adx_thresh': 11.790102193176246, 'atr_min_pct': 0.0001738084743196696, 'atr_max_pct': 0.14767504862381722, 'tp_mult': 1.287822245952603, 'tsl_mult': 0.3719901280374108, 'strategy': 'breakout', 'time_stop': 193, 'use_sma': True, 'use_atr': False, 'use_adx': False, 'use_ema': True, 'use_spike': True, 'rsi_required': False, 'edge_k': 0.9440399004905342, 'edge_cap': 0.3105213005084261, 'bull_strategy': 'breakout', 'bull_bb_std_mult': 0.7906065889477873, 'bull_rsi_os': 12, 'bull_rsi_ob': 78, 'bull_adx_thresh': 7.2855075319270135, 'bull_atr_min_pct': 0.005119225565605126, 'bull_atr_max_pct': 0.11021055197689972, 'bull_tp_mult': 2.560883878554881, 'bull_tsl_mult': 0.681261221890531, 'bull_time_stop': 152, 'bull_use_sma': False, 'bull_use_ema': True, 'bull_use_atr': True, 'bull_use_adx': False, 'bull_use_spike': False, 'bull_rsi_required': True, 'bear_strategy': 'mean_reversion', 'bear_bb_std_mult': 0.5015285342054927, 'bear_rsi_os': 46, 'bear_rsi_ob': 53, 'bear_adx_thresh': 31.616963850233283, 'bear_atr_min_pct': 0.007593640754023152, 'bear_atr_max_pct': 0.07743852017068169, 'bear_tp_mult': 2.531903165632246, 'bear_tsl_mult': 0.8594118058129288, 'bear_time_stop': 184, 'bear_use_sma': False, 'bear_use_ema': False, 'bear_use_atr': False, 'bear_use_adx': True, 'bear_use_spike': True, 'bear_rsi_required': False, 'sideways_strategy': 'mean_reversion', 'sideways_bb_std_mult': 0.7930209039100732, 'sideways_rsi_os': 34, 'sideways_rsi_ob': 64, 'sideways_adx_thresh': 10.255444049289904, 'sideways_atr_min_pct': 0.012140013836678551, 'sideways_atr_max_pct': 0.11102812549475401, 'sideways_tp_mult': 2.4067839682155396, 'sideways_tsl_mult': 0.16659502648162508, 'sideways_time_stop': 157, 'sideways_use_sma': True, 'sideways_use_ema': True, 'sideways_use_atr': False, 'sideways_use_adx': False, 'sideways_use_spike': False, 'sideways_rsi_required': False}.
[I 2025-09-01 08:36:44,491] Trial 467 finished with values: [-1000000000.0, 1000000000.0] and parameters: {'p_sma': 35, 'p_std': 21, 'p_atr': 19, 'p_adx': 21, 'rsi_period': 81, 'ema1': 5, 'ema2': 31, 'slip_atr_k': 0.1514203291722665, 'slip_spread_k': 0.37045868056121667, 'spread_hl_frac': 0.020670008013946, 'bb_std_mult': 1.5925810872430999, 'rsi_os': 23, 'rsi_ob': 75, 'vol_spike': 0.02301925279852418, 'adx_thresh': 26.171572569210444, 'atr_min_pct': 0.02054960283123171, 'atr_max_pct': 0.1476303844550446, 'tp_mult': 1.7663407461194798, 'tsl_mult': 0.82653580609315, 'strategy': 'breakout', 'time_stop': 244, 'use_sma': True, 'use_atr': False, 'use_adx': False, 'use_ema': True, 'use_spike': True, 'rsi_required': False, 'edge_k': 0.9371972834408437, 'edge_cap': 0.20001719405961993, 'bull_strategy': 'breakout', 'bull_bb_std_mult': 3.3933934519802493, 'bull_rsi_os': 29, 'bull_rsi_ob': 78, 'bull_adx_thresh': 8.071766956802811, 'bull_atr_min_pct': 0.022203616453549502, 'bull_atr_max_pct': 0.13658835059798272, 'bull_tp_mult': 2.305867109286568, 'bull_tsl_mult': 0.693352320532447, 'bull_time_stop': 250, 'bull_use_sma': False, 'bull_use_ema': True, 'bull_use_atr': False, 'bull_use_adx': False, 'bull_use_spike': True, 'bull_rsi_required': True, 'bear_strategy': 'mean_reversion', 'bear_bb_std_mult': 0.5083291718871215, 'bear_rsi_os': 27, 'bear_rsi_ob': 74, 'bear_adx_thresh': 16.903345712667672, 'bear_atr_min_pct': 0.026567107499898966, 'bear_atr_max_pct': 0.09490827222379641, 'bear_tp_mult': 2.814336034644593, 'bear_tsl_mult': 0.07795862947194455, 'bear_time_stop': 116, 'bear_use_sma': False, 'bear_use_ema': False, 'bear_use_atr': False, 'bear_use_adx': True, 'bear_use_spike': True, 'bear_rsi_required': False, 'sideways_strategy': 'mean_reversion', 'sideways_bb_std_mult': 0.8083390481617476, 'sideways_rsi_os': 20, 'sideways_rsi_ob': 83, 'sideways_adx_thresh': 10.7023967075622, 'sideways_atr_min_pct': 0.024200069353150416, 'sideways_atr_max_pct': 0.036715558663245204, 'sideways_tp_mult': 1.6788914910633808, 'sideways_tsl_mult': 0.36645668769713874, 'sideways_time_stop': 41, 'sideways_use_sma': True, 'sideways_use_ema': True, 'sideways_use_atr': False, 'sideways_use_adx': False, 'sideways_use_spike': False, 'sideways_rsi_required': False}.
[I 2025-09-01 08:36:45,300] Trial 473 finished with values: [-1000000000.0, 1000000000.0] and parameters: {'p_sma': 20, 'p_std': 60, 'p_atr': 11, 'p_adx': 17, 'rsi_period': 9, 'ema1': 23, 'ema2': 46, 'slip_atr_k': 0.06545031636199386, 'slip_spread_k': 0.3684989382287387, 'spread_hl_frac': 0.028282740163501664, 'bb_std_mult': 3.268347214938588, 'rsi_os': 55, 'rsi_ob': 56, 'vol_spike': 0.18455476788722974, 'adx_thresh': 20.280615469608467, 'atr_min_pct': 0.020902672263161365, 'atr_max_pct': 0.06940623634437665, 'tp_mult': 2.3732404988802185, 'tsl_mult': 0.2610170397144285, 'strategy': 'mean_reversion', 'time_stop': 63, 'use_sma': True, 'use_atr': True, 'use_adx': True, 'use_ema': True, 'use_spike': True, 'rsi_required': True, 'edge_k': 1.7897843714170514, 'edge_cap': 0.05240566409681747, 'bull_strategy': 'breakout', 'bull_bb_std_mult': 2.7772479663510046, 'bull_rsi_os': 29, 'bull_rsi_ob': 50, 'bull_adx_thresh': 21.178200432169366, 'bull_atr_min_pct': 0.012486816261550574, 'bull_atr_max_pct': 0.08690798765352618, 'bull_tp_mult': 2.160122114830547, 'bull_tsl_mult': 0.12544663742300383, 'bull_time_stop': 169, 'bull_use_sma': True, 'bull_use_ema': False, 'bull_use_atr': False, 'bull_use_adx': True, 'bull_use_spike': True, 'bull_rsi_required': False, 'bear_strategy': 'mean_reversion', 'bear_bb_std_mult': 3.1727584998081553, 'bear_rsi_os': 50, 'bear_rsi_ob': 93, 'bear_adx_thresh': 32.13028558571498, 'bear_atr_min_pct': 0.022608486752641474, 'bear_atr_max_pct': 0.08616411846821109, 'bear_tp_mult': 2.7932261599544645, 'bear_tsl_mult': 0.0470402131854424, 'bear_time_stop': 77, 'bear_use_sma': False, 'bear_use_ema': False, 'bear_use_atr': True, 'bear_use_adx': True, 'bear_use_spike': True, 'bear_rsi_required': False, 'sideways_strategy': 'mean_reversion', 'sideways_bb_std_mult': 0.6728395540455515, 'sideways_rsi_os': 38, 'sideways_rsi_ob': 50, 'sideways_adx_thresh': 15.336221830270564, 'sideways_atr_min_pct': 0.0023607049671297235, 'sideways_atr_max_pct': 0.029600243708215207, 'sideways_tp_mult': 2.7253513360305486, 'sideways_tsl_mult': 0.6817222382617394, 'sideways_time_stop': 32, 'sideways_use_sma': False, 'sideways_use_ema': False, 'sideways_use_atr': False, 'sideways_use_adx': True, 'sideways_use_spike': True, 'sideways_rsi_required': False}.
[I 2025-09-01 08:37:27,076] Trial 472 finished with values: [-0.02559421943498641, 0.02563821551411936] and parameters: {'p_sma': 58, 'p_std': 24, 'p_atr': 11, 'p_adx': 27, 'rsi_period': 80, 'ema1': 23, 'ema2': 13, 'slip_atr_k': 0.06385077702667197, 'slip_spread_k': 0.6551067242891244, 'spread_hl_frac': 0.022656406553998133, 'bb_std_mult': 3.4026143319156037, 'rsi_os': 24, 'rsi_ob': 56, 'vol_spike': 0.22700502126578853, 'adx_thresh': 6.285228344065795, 'atr_min_pct': 0.020432833507615863, 'atr_max_pct': 0.07700066866684163, 'tp_mult': 1.1797346539768376, 'tsl_mult': 0.5315050433354921, 'strategy': 'mean_reversion', 'time_stop': 63, 'use_sma': True, 'use_atr': True, 'use_adx': True, 'use_ema': True, 'use_spike': True, 'rsi_required': True, 'edge_k': 1.6637605850312824, 'edge_cap': 0.9107047027296262, 'bull_strategy': 'breakout', 'bull_bb_std_mult': 2.7966133914082323, 'bull_rsi_os': 8, 'bull_rsi_ob': 50, 'bull_adx_thresh': 7.1346110051441585, 'bull_atr_min_pct': 0.004071005397235464, 'bull_atr_max_pct': 0.046576070692026746, 'bull_tp_mult': 2.303355239042563, 'bull_tsl_mult': 0.12696246568099517, 'bull_time_stop': 168, 'bull_use_sma': True, 'bull_use_ema': False, 'bull_use_atr': False, 'bull_use_adx': True, 'bull_use_spike': True, 'bull_rsi_required': False, 'bear_strategy': 'mean_reversion', 'bear_bb_std_mult': 3.472027785404786, 'bear_rsi_os': 21, 'bear_rsi_ob': 93, 'bear_adx_thresh': 33.10784718172594, 'bear_atr_min_pct': 0.010449704595878063, 'bear_atr_max_pct': 0.016391423142195508, 'bear_tp_mult': 1.1382913961871126, 'bear_tsl_mult': 0.0413445337189973, 'bear_time_stop': 79, 'bear_use_sma': False, 'bear_use_ema': False, 'bear_use_atr': True, 'bear_use_adx': True, 'bear_use_spike': True, 'bear_rsi_required': False, 'sideways_strategy': 'mean_reversion', 'sideways_bb_std_mult': 0.6833881455544354, 'sideways_rsi_os': 32, 'sideways_rsi_ob': 46, 'sideways_adx_thresh': 9.450066269121361, 'sideways_atr_min_pct': 0.023019520134458463, 'sideways_atr_max_pct': 0.14087085048221393, 'sideways_tp_mult': 2.7309593862056185, 'sideways_tsl_mult': 0.14100413843168325, 'sideways_time_stop': 127, 'sideways_use_sma': False, 'sideways_use_ema': False, 'sideways_use_atr': False, 'sideways_use_adx': True, 'sideways_use_spike': True, 'sideways_rsi_required': False}.
[I 2025-09-01 08:37:27,881] Trial 471 finished with values: [-1000000000.0, 1000000000.0] and parameters: {'p_sma': 31, 'p_std': 60, 'p_atr': 12, 'p_adx': 10, 'rsi_period': 80, 'ema1': 13, 'ema2': 12, 'slip_atr_k': 0.04268359519662106, 'slip_spread_k': 0.6498011463004687, 'spread_hl_frac': 0.031936774033478624, 'bb_std_mult': 3.4434559216598983, 'rsi_os': 23, 'rsi_ob': 69, 'vol_spike': 0.29558638510096535, 'adx_thresh': 25.1054743150509, 'atr_min_pct': 0.020983273030013554, 'atr_max_pct': 0.06966228605856235, 'tp_mult': 1.1797604340829433, 'tsl_mult': 0.4165641652404541, 'strategy': 'mean_reversion', 'time_stop': 254, 'use_sma': True, 'use_atr': False, 'use_adx': False, 'use_ema': True, 'use_spike': True, 'rsi_required': False, 'edge_k': 1.6608346767152724, 'edge_cap': 0.3065825633834385, 'bull_strategy': 'mean_reversion', 'bull_bb_std_mult': 2.7656245868401426, 'bull_rsi_os': 15, 'bull_rsi_ob': 52, 'bull_adx_thresh': 7.150187303972581, 'bull_atr_min_pct': 0.012532487084394374, 'bull_atr_max_pct': 0.04597617675178939, 'bull_tp_mult': 1.8580064768034334, 'bull_tsl_mult': 0.18217917941271528, 'bull_time_stop': 153, 'bull_use_sma': True, 'bull_use_ema': True, 'bull_use_atr': False, 'bull_use_adx': True, 'bull_use_spike': True, 'bull_rsi_required': True, 'bear_strategy': 'mean_reversion', 'bear_bb_std_mult': 3.0446826329199386, 'bear_rsi_os': 31, 'bear_rsi_ob': 53, 'bear_adx_thresh': 31.573992889234724, 'bear_atr_min_pct': 0.0022364290751471175, 'bear_atr_max_pct': 0.08632004470354937, 'bear_tp_mult': 1.1421618535870022, 'bear_tsl_mult': 0.041163904011806265, 'bear_time_stop': 250, 'bear_use_sma': False, 'bear_use_ema': True, 'bear_use_atr': False, 'bear_use_adx': True, 'bear_use_spike': True, 'bear_rsi_required': True, 'sideways_strategy': 'mean_reversion', 'sideways_bb_std_mult': 0.6795990826784604, 'sideways_rsi_os': 32, 'sideways_rsi_ob': 63, 'sideways_adx_thresh': 9.362594192798367, 'sideways_atr_min_pct': 0.023019967964241463, 'sideways_atr_max_pct': 0.041944817557920164, 'sideways_tp_mult': 1.9898845719436193, 'sideways_tsl_mult': 0.3595942595206365, 'sideways_time_stop': 31, 'sideways_use_sma': True, 'sideways_use_ema': True, 'sideways_use_atr': False, 'sideways_use_adx': False, 'sideways_use_spike': False, 'sideways_rsi_required': False}.
[I 2025-09-01 08:37:28,555] Trial 474 finished with values: [-0.16855177499184426, 0.16824904473718488] and parameters: {'p_sma': 20, 'p_std': 13, 'p_atr': 11, 'p_adx': 19, 'rsi_period': 9, 'ema1': 10, 'ema2': 12, 'slip_atr_k': 0.06619053712511012, 'slip_spread_k': 0.14415661922271972, 'spread_hl_frac': 0.013441549098132203, 'bb_std_mult': 3.3235482260988003, 'rsi_os': 24, 'rsi_ob': 80, 'vol_spike': 0.18430517539679528, 'adx_thresh': 10.727217210634786, 'atr_min_pct': 0.02112452131582228, 'atr_max_pct': 0.14997050297480902, 'tp_mult': 2.37271296217037, 'tsl_mult': 0.4153937316401196, 'strategy': 'mean_reversion', 'time_stop': 300, 'use_sma': True, 'use_atr': True, 'use_adx': True, 'use_ema': True, 'use_spike': True, 'rsi_required': True, 'edge_k': 1.0831723788143046, 'edge_cap': 0.7717589191673622, 'bull_strategy': 'breakout', 'bull_bb_std_mult': 2.7740144636198822, 'bull_rsi_os': 46, 'bull_rsi_ob': 50, 'bull_adx_thresh': 15.440932991798887, 'bull_atr_min_pct': 0.012470008389082382, 'bull_atr_max_pct': 0.09877076046539324, 'bull_tp_mult': 1.3208643189447482, 'bull_tsl_mult': 0.4073409202989712, 'bull_time_stop': 167, 'bull_use_sma': True, 'bull_use_ema': False, 'bull_use_atr': False, 'bull_use_adx': True, 'bull_use_spike': True, 'bull_rsi_required': False, 'bear_strategy': 'mean_reversion', 'bear_bb_std_mult': 0.7842329204868834, 'bear_rsi_os': 21, 'bear_rsi_ob': 93, 'bear_adx_thresh': 33.060237845653134, 'bear_atr_min_pct': 0.023080654246522326, 'bear_atr_max_pct': 0.08563651043821763, 'bear_tp_mult': 1.1724677326984536, 'bear_tsl_mult': 0.7957410723232015, 'bear_time_stop': 81, 'bear_use_sma': False, 'bear_use_ema': False, 'bear_use_atr': True, 'bear_use_adx': True, 'bear_use_spike': True, 'bear_rsi_required': False, 'sideways_strategy': 'mean_reversion', 'sideways_bb_std_mult': 0.7193122303930106, 'sideways_rsi_os': 38, 'sideways_rsi_ob': 49, 'sideways_adx_thresh': 9.468811269368613, 'sideways_atr_min_pct': 0.0025479400840638655, 'sideways_atr_max_pct': 0.029294903797762874, 'sideways_tp_mult': 2.0146214022572178, 'sideways_tsl_mult': 0.6732147362115792, 'sideways_time_stop': 98, 'sideways_use_sma': False, 'sideways_use_ema': False, 'sideways_use_atr': False, 'sideways_use_adx': True, 'sideways_use_spike': True, 'sideways_rsi_required': False}.
[I 2025-09-01 08:37:28,875] Trial 475 finished with values: [-1000000000.0, 1000000000.0] and parameters: {'p_sma': 31, 'p_std': 13, 'p_atr': 18, 'p_adx': 8, 'rsi_period': 64, 'ema1': 11, 'ema2': 12, 'slip_atr_k': 0.06790395614989769, 'slip_spread_k': 0.6579541536936782, 'spread_hl_frac': 0.022482168502692638, 'bb_std_mult': 3.3959152029571618, 'rsi_os': 19, 'rsi_ob': 69, 'vol_spike': 0.2953675475286551, 'adx_thresh': 16.770536144351727, 'atr_min_pct': 0.00148122424299987, 'atr_max_pct': 0.14213355759637242, 'tp_mult': 2.8136459440443615, 'tsl_mult': 0.4173419687118619, 'strategy': 'mean_reversion', 'time_stop': 258, 'use_sma': False, 'use_atr': True, 'use_adx': True, 'use_ema': True, 'use_spike': True, 'rsi_required': True, 'edge_k': 0.7148861043231022, 'edge_cap': 0.08470299540254919, 'bull_strategy': 'mean_reversion', 'bull_bb_std_mult': 2.890088155240549, 'bull_rsi_os': 11, 'bull_rsi_ob': 91, 'bull_adx_thresh': 15.086136421884111, 'bull_atr_min_pct': 0.007563888292042357, 'bull_atr_max_pct': 0.04178820511214867, 'bull_tp_mult': 2.447736433598206, 'bull_tsl_mult': 0.6460138461089703, 'bull_time_stop': 262, 'bull_use_sma': True, 'bull_use_ema': False, 'bull_use_atr': False, 'bull_use_adx': True, 'bull_use_spike': True, 'bull_rsi_required': False, 'bear_strategy': 'breakout', 'bear_bb_std_mult': 1.209215003587596, 'bear_rsi_os': 31, 'bear_rsi_ob': 93, 'bear_adx_thresh': 33.06026147436924, 'bear_atr_min_pct': 0.004807120835702373, 'bear_atr_max_pct': 0.08881550768284857, 'bear_tp_mult': 2.216478889694965, 'bear_tsl_mult': 0.12349453347620304, 'bear_time_stop': 250, 'bear_use_sma': False, 'bear_use_ema': True, 'bear_use_atr': True, 'bear_use_adx': True, 'bear_use_spike': True, 'bear_rsi_required': True, 'sideways_strategy': 'mean_reversion', 'sideways_bb_std_mult': 0.6960688079203312, 'sideways_rsi_os': 32, 'sideways_rsi_ob': 63, 'sideways_adx_thresh': 9.28069366532222, 'sideways_atr_min_pct': 0.02317720855119873, 'sideways_atr_max_pct': 0.03441174698149814, 'sideways_tp_mult': 2.042268873952719, 'sideways_tsl_mult': 0.13308817919381144, 'sideways_time_stop': 16, 'sideways_use_sma': False, 'sideways_use_ema': False, 'sideways_use_atr': False, 'sideways_use_adx': True, 'sideways_use_spike': True, 'sideways_rsi_required': False}.
[I 2025-09-01 08:37:29,604] Trial 476 finished with values: [-1000000000.0, 1000000000.0] and parameters: {'p_sma': 9, 'p_std': 11, 'p_atr': 18, 'p_adx': 25, 'rsi_period': 57, 'ema1': 10, 'ema2': 13, 'slip_atr_k': 0.06776311956682617, 'slip_spread_k': 0.6426314550309656, 'spread_hl_frac': 0.013379890684837775, 'bb_std_mult': 2.199118477589351, 'rsi_os': 52, 'rsi_ob': 47, 'vol_spike': 0.2294206626807607, 'adx_thresh': 33.177118046776755, 'atr_min_pct': 0.0014490854421200395, 'atr_max_pct': 0.08334806460982991, 'tp_mult': 1.1887375910912052, 'tsl_mult': 0.030069715767364558, 'strategy': 'mean_reversion', 'time_stop': 258, 'use_sma': False, 'use_atr': True, 'use_adx': True, 'use_ema': True, 'use_spike': True, 'rsi_required': True, 'edge_k': 0.8732463812915074, 'edge_cap': 0.08303894763942939, 'bull_strategy': 'mean_reversion', 'bull_bb_std_mult': 1.1764153189325668, 'bull_rsi_os': 21, 'bull_rsi_ob': 87, 'bull_adx_thresh': 9.578655905004002, 'bull_atr_min_pct': 0.004717206933540141, 'bull_atr_max_pct': 0.09892728912336464, 'bull_tp_mult': 2.294273070237316, 'bull_tsl_mult': 0.6444644110152669, 'bull_time_stop': 159, 'bull_use_sma': True, 'bull_use_ema': False, 'bull_use_atr': False, 'bull_use_adx': True, 'bull_use_spike': True, 'bull_rsi_required': False, 'bear_strategy': 'mean_reversion', 'bear_bb_std_mult': 3.039038824548428, 'bear_rsi_os': 31, 'bear_rsi_ob': 94, 'bear_adx_thresh': 11.506831267394816, 'bear_atr_min_pct': 0.02324890255162105, 'bear_atr_max_pct': 0.015983765559116986, 'bear_tp_mult': 2.8597126965951154, 'bear_tsl_mult': 0.13344754474002818, 'bear_time_stop': 81, 'bear_use_sma': False, 'bear_use_ema': True, 'bear_use_atr': True, 'bear_use_adx': True, 'bear_use_spike': True, 'bear_rsi_required': False, 'sideways_strategy': 'mean_reversion', 'sideways_bb_std_mult': 1.7438472972695176, 'sideways_rsi_os': 37, 'sideways_rsi_ob': 46, 'sideways_adx_thresh': 9.583749204866072, 'sideways_atr_min_pct': 0.023246026144566643, 'sideways_atr_max_pct': 0.028807507106296152, 'sideways_tp_mult': 1.9963828123377463, 'sideways_tsl_mult': 0.13559570124118264, 'sideways_time_stop': 16, 'sideways_use_sma': False, 'sideways_use_ema': False, 'sideways_use_atr': False, 'sideways_use_adx': True, 'sideways_use_spike': True, 'sideways_rsi_required': False}.
