[I 2025-09-01 08:18:59,618] Trial 361 finished with values: [-0.26085504818795957, 0.26098568149319795] and parameters: {'p_sma': 23, 'p_std': 17, 'p_atr': 13, 'p_adx': 20, 'rsi_period': 20, 'ema1': 21, 'ema2': 12, 'slip_atr_k': 0.11393795846978243, 'slip_spread_k': 0.6620553544283804, 'spread_hl_frac': 0.040613645503624354, 'bb_std_mult': 2.0998113381978256, 'rsi_os': 20, 'rsi_ob': 69, 'vol_spike': 0.27368194649129923, 'adx_thresh': 11.242434954431383, 'atr_min_pct': 0.027809156367390807, 'atr_max_pct': 0.13015712576724137, 'tp_mult': 1.428661131768747, 'tsl_mult': 0.1740743464683726, 'strategy': 'mean_reversion', 'time_stop': 256, 'use_sma': True, 'use_atr': True, 'use_adx': True, 'use_ema': False, 'use_spike': False, 'rsi_required': True, 'edge_k': 1.218235396221648, 'edge_cap': 0.5383967181747837, 'bull_strategy': 'breakout', 'bull_bb_std_mult': 2.8762601946075943, 'bull_rsi_os': 22, 'bull_rsi_ob': 70, 'bull_adx_thresh': 7.365056741520344, 'bull_atr_min_pct': 0.004028400142210063, 'bull_atr_max_pct': 0.030358211847241332, 'bull_tp_mult': 2.367336730141406, 'bull_tsl_mult': 0.8482048515015388, 'bull_time_stop': 152, 'bull_use_sma': True, 'bull_use_ema': False, 'bull_use_atr': True, 'bull_use_adx': False, 'bull_use_spike': False, 'bull_rsi_required': False, 'bear_strategy': 'breakout', 'bear_bb_std_mult': 2.9707386860911402, 'bear_rsi_os': 21, 'bear_rsi_ob': 60, 'bear_adx_thresh': 14.61239897037461, 'bear_atr_min_pct': 0.023335192767628823, 'bear_atr_max_pct': 0.11173504981498865, 'bear_tp_mult': 2.816335780095928, 'bear_tsl_mult': 0.05145924091486383, 'bear_time_stop': 98, 'bear_use_sma': True, 'bear_use_ema': True, 'bear_use_atr': False, 'bear_use_adx': True, 'bear_use_spike': True, 'bear_rsi_required': False, 'sideways_strategy': 'breakout', 'sideways_bb_std_mult': 2.178699288190533, 'sideways_rsi_os': 40, 'sideways_rsi_ob': 84, 'sideways_adx_thresh': 9.890516589761994, 'sideways_atr_min_pct': 0.0021232786567139863, 'sideways_atr_max_pct': 0.13208790345150545, 'sideways_tp_mult': 2.618253795491038, 'sideways_tsl_mult': 0.9072772564187817, 'sideways_time_stop': 36, 'sideways_use_sma': False, 'sideways_use_ema': False, 'sideways_use_atr': True, 'sideways_use_adx': False, 'sideways_use_spike': False, 'sideways_rsi_required': True}.
[I 2025-09-01 08:18:59,759] Trial 358 finished with values: [-1000000000.0, 1000000000.0] and parameters: {'p_sma': 47, 'p_std': 15, 'p_atr': 12, 'p_adx': 21, 'rsi_period': 11, 'ema1': 11, 'ema2': 16, 'slip_atr_k': 0.06039277153942864, 'slip_spread_k': 0.6314179592370703, 'spread_hl_frac': 0.04148078462031931, 'bb_std_mult': 3.048906504033556, 'rsi_os': 35, 'rsi_ob': 74, 'vol_spike': 0.2709122449900989, 'adx_thresh': 11.056273053519925, 'atr_min_pct': 0.020739415359794292, 'atr_max_pct': 0.14981748981471982, 'tp_mult': 1.4860460055049103, 'tsl_mult': 0.47996694347041413, 'strategy': 'mean_reversion', 'time_stop': 170, 'use_sma': False, 'use_atr': True, 'use_adx': True, 'use_ema': True, 'use_spike': True, 'rsi_required': True, 'edge_k': 1.1274204497207994, 'edge_cap': 0.5349429837507225, 'bull_strategy': 'mean_reversion', 'bull_bb_std_mult': 3.07489620018961, 'bull_rsi_os': 40, 'bull_rsi_ob': 70, 'bull_adx_thresh': 9.88076324770905, 'bull_atr_min_pct': 0.007078992075285678, 'bull_atr_max_pct': 0.07850340391175704, 'bull_tp_mult': 2.1125956114588753, 'bull_tsl_mult': 0.8674387643479625, 'bull_time_stop': 167, 'bull_use_sma': True, 'bull_use_ema': False, 'bull_use_atr': False, 'bull_use_adx': False, 'bull_use_spike': True, 'bull_rsi_required': False, 'bear_strategy': 'mean_reversion', 'bear_bb_std_mult': 3.1567961848612938, 'bear_rsi_os': 29, 'bear_rsi_ob': 75, 'bear_adx_thresh': 15.618303179265332, 'bear_atr_min_pct': 0.0235275271756133, 'bear_atr_max_pct': 0.08147800198400565, 'bear_tp_mult': 2.8125778513369206, 'bear_tsl_mult': 0.024946605221549997, 'bear_time_stop': 165, 'bear_use_sma': False, 'bear_use_ema': True, 'bear_use_atr': True, 'bear_use_adx': True, 'bear_use_spike': False, 'bear_rsi_required': False, 'sideways_strategy': 'mean_reversion', 'sideways_bb_std_mult': 0.5491285916878976, 'sideways_rsi_os': 43, 'sideways_rsi_ob': 73, 'sideways_adx_thresh': 32.49679503435033, 'sideways_atr_min_pct': 0.02365091729522725, 'sideways_atr_max_pct': 0.03453092354047679, 'sideways_tp_mult': 2.6073919572722524, 'sideways_tsl_mult': 0.7540574479277671, 'sideways_time_stop': 216, 'sideways_use_sma': False, 'sideways_use_ema': True, 'sideways_use_atr': False, 'sideways_use_adx': True, 'sideways_use_spike': True, 'sideways_rsi_required': False}.
[I 2025-09-01 08:19:40,954] Trial 364 finished with values: [-1000000000.0, 1000000000.0] and parameters: {'p_sma': 17, 'p_std': 32, 'p_atr': 24, 'p_adx': 22, 'rsi_period': 11, 'ema1': 11, 'ema2': 28, 'slip_atr_k': 0.24568569755400566, 'slip_spread_k': 0.28552405392753444, 'spread_hl_frac': 0.028131065882133918, 'bb_std_mult': 3.058306827297585, 'rsi_os': 26, 'rsi_ob': 54, 'vol_spike': 0.11723809140444036, 'adx_thresh': 25.34374161999272, 'atr_min_pct': 0.015433588217929794, 'atr_max_pct': 0.1476931712015094, 'tp_mult': 2.111797836983804, 'tsl_mult': 0.9136693305576064, 'strategy': 'mean_reversion', 'time_stop': 183, 'use_sma': True, 'use_atr': True, 'use_adx': True, 'use_ema': False, 'use_spike': True, 'rsi_required': True, 'edge_k': 0.892877100280894, 'edge_cap': 0.1477463554372791, 'bull_strategy': 'breakout', 'bull_bb_std_mult': 1.5359444639450572, 'bull_rsi_os': 47, 'bull_rsi_ob': 65, 'bull_adx_thresh': 15.452279034454627, 'bull_atr_min_pct': 0.02250364300333517, 'bull_atr_max_pct': 0.07399885564808015, 'bull_tp_mult': 1.9488963087249163, 'bull_tsl_mult': 0.7167526842737424, 'bull_time_stop': 140, 'bull_use_sma': True, 'bull_use_ema': False, 'bull_use_atr': False, 'bull_use_adx': True, 'bull_use_spike': True, 'bull_rsi_required': False, 'bear_strategy': 'mean_reversion', 'bear_bb_std_mult': 3.04420625476069, 'bear_rsi_os': 28, 'bear_rsi_ob': 94, 'bear_adx_thresh': 32.70986210275748, 'bear_atr_min_pct': 0.012129837964336712, 'bear_atr_max_pct': 0.08277894965128936, 'bear_tp_mult': 1.641745191348199, 'bear_tsl_mult': 0.09413773197926067, 'bear_time_stop': 86, 'bear_use_sma': False, 'bear_use_ema': False, 'bear_use_atr': True, 'bear_use_adx': True, 'bear_use_spike': True, 'bear_rsi_required': False, 'sideways_strategy': 'mean_reversion', 'sideways_bb_std_mult': 0.7666594564314257, 'sideways_rsi_os': 37, 'sideways_rsi_ob': 71, 'sideways_adx_thresh': 33.397017327971184, 'sideways_atr_min_pct': 0.024503863155060947, 'sideways_atr_max_pct': 0.010386303432822236, 'sideways_tp_mult': 2.638857537115253, 'sideways_tsl_mult': 0.49509343655039306, 'sideways_time_stop': 100, 'sideways_use_sma': True, 'sideways_use_ema': False, 'sideways_use_atr': False, 'sideways_use_adx': False, 'sideways_use_spike': False, 'sideways_rsi_required': False}.
[I 2025-09-01 08:19:41,713] Trial 363 finished with values: [-1000000000.0, 1000000000.0] and parameters: {'p_sma': 23, 'p_std': 5, 'p_atr': 27, 'p_adx': 19, 'rsi_period': 63, 'ema1': 11, 'ema2': 24, 'slip_atr_k': 0.07188102614554873, 'slip_spread_k': 0.6014600517601365, 'spread_hl_frac': 0.027700446160777888, 'bb_std_mult': 3.4574469204252773, 'rsi_os': 26, 'rsi_ob': 54, 'vol_spike': 0.12123063583420507, 'adx_thresh': 11.577714309444588, 'atr_min_pct': 0.00705814244899634, 'atr_max_pct': 0.14962236708901927, 'tp_mult': 1.3735403201787133, 'tsl_mult': 0.509274623882568, 'strategy': 'mean_reversion', 'time_stop': 257, 'use_sma': True, 'use_atr': True, 'use_adx': True, 'use_ema': False, 'use_spike': False, 'rsi_required': True, 'edge_k': 0.9646135160633713, 'edge_cap': 0.13096936715782365, 'bull_strategy': 'breakout', 'bull_bb_std_mult': 2.122489155525845, 'bull_rsi_os': 22, 'bull_rsi_ob': 70, 'bull_adx_thresh': 24.382169730526847, 'bull_atr_min_pct': 0.025805232402340103, 'bull_atr_max_pct': 0.07305602364395855, 'bull_tp_mult': 1.2860387451364335, 'bull_tsl_mult': 0.716729614470699, 'bull_time_stop': 110, 'bull_use_sma': True, 'bull_use_ema': False, 'bull_use_atr': True, 'bull_use_adx': False, 'bull_use_spike': False, 'bull_rsi_required': False, 'bear_strategy': 'breakout', 'bear_bb_std_mult': 3.0367199296379845, 'bear_rsi_os': 14, 'bear_rsi_ob': 82, 'bear_adx_thresh': 32.826877396101224, 'bear_atr_min_pct': 0.022460831877519224, 'bear_atr_max_pct': 0.11153807885733427, 'bear_tp_mult': 1.3766340926775156, 'bear_tsl_mult': 0.052634071044795595, 'bear_time_stop': 96, 'bear_use_sma': True, 'bear_use_ema': False, 'bear_use_atr': True, 'bear_use_adx': True, 'bear_use_spike': True, 'bear_rsi_required': False, 'sideways_strategy': 'breakout', 'sideways_bb_std_mult': 0.8077648570290784, 'sideways_rsi_os': 41, 'sideways_rsi_ob': 71, 'sideways_adx_thresh': 9.84706191379021, 'sideways_atr_min_pct': 0.007872567176410928, 'sideways_atr_max_pct': 0.016356310820814575, 'sideways_tp_mult': 1.2245393593739002, 'sideways_tsl_mult': 0.4954447737380164, 'sideways_time_stop': 200, 'sideways_use_sma': False, 'sideways_use_ema': False, 'sideways_use_atr': True, 'sideways_use_adx': False, 'sideways_use_spike': False, 'sideways_rsi_required': True}.
[I 2025-09-01 08:19:41,714] Trial 365 finished with values: [-1000000000.0, 1000000000.0] and parameters: {'p_sma': 21, 'p_std': 41, 'p_atr': 29, 'p_adx': 19, 'rsi_period': 34, 'ema1': 9, 'ema2': 38, 'slip_atr_k': 0.2498403476342974, 'slip_spread_k': 0.6057429729622126, 'spread_hl_frac': 0.02774067761777151, 'bb_std_mult': 3.5187984209085608, 'rsi_os': 25, 'rsi_ob': 84, 'vol_spike': 0.1168251644506841, 'adx_thresh': 25.208246306029004, 'atr_min_pct': 0.0073941243412769374, 'atr_max_pct': 0.02871631816952313, 'tp_mult': 2.1341705955286825, 'tsl_mult': 0.51436769739587, 'strategy': 'mean_reversion', 'time_stop': 251, 'use_sma': True, 'use_atr': True, 'use_adx': True, 'use_ema': False, 'use_spike': False, 'rsi_required': True, 'edge_k': 0.8955913794929453, 'edge_cap': 0.14513197527542315, 'bull_strategy': 'breakout', 'bull_bb_std_mult': 2.411107718997312, 'bull_rsi_os': 14, 'bull_rsi_ob': 73, 'bull_adx_thresh': 18.219838024497616, 'bull_atr_min_pct': 0.016916522636726532, 'bull_atr_max_pct': 0.07244397707219766, 'bull_tp_mult': 1.268865833425961, 'bull_tsl_mult': 0.35417443407273613, 'bull_time_stop': 286, 'bull_use_sma': True, 'bull_use_ema': False, 'bull_use_atr': True, 'bull_use_adx': True, 'bull_use_spike': False, 'bull_rsi_required': False, 'bear_strategy': 'breakout', 'bear_bb_std_mult': 3.0704946860147393, 'bear_rsi_os': 50, 'bear_rsi_ob': 94, 'bear_adx_thresh': 32.83373960382048, 'bear_atr_min_pct': 0.012169460396258026, 'bear_atr_max_pct': 0.08349505425514991, 'bear_tp_mult': 2.9485631568532567, 'bear_tsl_mult': 0.8882151774329323, 'bear_time_stop': 176, 'bear_use_sma': False, 'bear_use_ema': False, 'bear_use_atr': True, 'bear_use_adx': True, 'bear_use_spike': True, 'bear_rsi_required': True, 'sideways_strategy': 'breakout', 'sideways_bb_std_mult': 0.7818569172873646, 'sideways_rsi_os': 37, 'sideways_rsi_ob': 53, 'sideways_adx_thresh': 10.496460282273814, 'sideways_atr_min_pct': 0.012785213815081176, 'sideways_atr_max_pct': 0.026261417729381488, 'sideways_tp_mult': 2.4975574984752074, 'sideways_tsl_mult': 0.16702496870603262, 'sideways_time_stop': 26, 'sideways_use_sma': True, 'sideways_use_ema': False, 'sideways_use_atr': True, 'sideways_use_adx': False, 'sideways_use_spike': False, 'sideways_rsi_required': True}.
[I 2025-09-01 08:19:42,224] Trial 362 finished with values: [-0.11211333079566799, 0.11189519207491926] and parameters: {'p_sma': 34, 'p_std': 15, 'p_atr': 22, 'p_adx': 19, 'rsi_period': 62, 'ema1': 21, 'ema2': 44, 'slip_atr_k': 0.07311982353875496, 'slip_spread_k': 0.6620713340768317, 'spread_hl_frac': 0.04723943731940633, 'bb_std_mult': 2.098559330231018, 'rsi_os': 26, 'rsi_ob': 54, 'vol_spike': 0.2554573340165729, 'adx_thresh': 25.155095055790323, 'atr_min_pct': 0.016873264895304222, 'atr_max_pct': 0.1496255815397615, 'tp_mult': 1.4191817866718437, 'tsl_mult': 0.5106511507574757, 'strategy': 'mean_reversion', 'time_stop': 255, 'use_sma': True, 'use_atr': True, 'use_adx': True, 'use_ema': False, 'use_spike': False, 'rsi_required': True, 'edge_k': 0.9686591190728854, 'edge_cap': 0.5870238394470573, 'bull_strategy': 'breakout', 'bull_bb_std_mult': 2.396969236929949, 'bull_rsi_os': 15, 'bull_rsi_ob': 70, 'bull_adx_thresh': 29.53637432507015, 'bull_atr_min_pct': 0.025922748837320382, 'bull_atr_max_pct': 0.048512286240400895, 'bull_tp_mult': 2.3812065568485243, 'bull_tsl_mult': 0.8596863979768544, 'bull_time_stop': 139, 'bull_use_sma': True, 'bull_use_ema': False, 'bull_use_atr': True, 'bull_use_adx': False, 'bull_use_spike': False, 'bull_rsi_required': False, 'bear_strategy': 'breakout', 'bear_bb_std_mult': 0.9233508660596517, 'bear_rsi_os': 21, 'bear_rsi_ob': 82, 'bear_adx_thresh': 32.859283164960544, 'bear_atr_min_pct': 0.021345890275150034, 'bear_atr_max_pct': 0.14035073230804798, 'bear_tp_mult': 1.865284559697594, 'bear_tsl_mult': 0.45632431543718316, 'bear_time_stop': 99, 'bear_use_sma': True, 'bear_use_ema': True, 'bear_use_atr': True, 'bear_use_adx': True, 'bear_use_spike': True, 'bear_rsi_required': False, 'sideways_strategy': 'breakout', 'sideways_bb_std_mult': 0.5831890430667951, 'sideways_rsi_os': 41, 'sideways_rsi_ob': 46, 'sideways_adx_thresh': 32.50386970438591, 'sideways_atr_min_pct': 0.001948808022073369, 'sideways_atr_max_pct': 0.03448786265761804, 'sideways_tp_mult': 2.6574519646339643, 'sideways_tsl_mult': 0.16685611804669193, 'sideways_time_stop': 199, 'sideways_use_sma': False, 'sideways_use_ema': False, 'sideways_use_atr': True, 'sideways_use_adx': False, 'sideways_use_spike': False, 'sideways_rsi_required': True}.
[I 2025-09-01 08:19:43,088] Trial 366 finished with values: [-1000000000.0, 1000000000.0] and parameters: {'p_sma': 21, 'p_std': 14, 'p_atr': 25, 'p_adx': 19, 'rsi_period': 34, 'ema1': 9, 'ema2': 38, 'slip_atr_k': 0.0678092113346502, 'slip_spread_k': 0.6090477293829166, 'spread_hl_frac': 0.025424288616650526, 'bb_std_mult': 2.417863037267981, 'rsi_os': 25, 'rsi_ob': 55, 'vol_spike': 0.21951034906918662, 'adx_thresh': 31.391763025446878, 'atr_min_pct': 0.02229138319928372, 'atr_max_pct': 0.01844000748259339, 'tp_mult': 1.2135886411516765, 'tsl_mult': 0.5081179721618283, 'strategy': 'breakout', 'time_stop': 243, 'use_sma': True, 'use_atr': True, 'use_adx': True, 'use_ema': True, 'use_spike': False, 'rsi_required': False, 'edge_k': 0.328350739025578, 'edge_cap': 0.9719542443996478, 'bull_strategy': 'breakout', 'bull_bb_std_mult': 2.3952828161651363, 'bull_rsi_os': 15, 'bull_rsi_ob': 73, 'bull_adx_thresh': 33.269979641114816, 'bull_atr_min_pct': 0.014879683596744488, 'bull_atr_max_pct': 0.047851816619756446, 'bull_tp_mult': 2.2052600726060563, 'bull_tsl_mult': 0.993074394207373, 'bull_time_stop': 66, 'bull_use_sma': False, 'bull_use_ema': False, 'bull_use_atr': True, 'bull_use_adx': True, 'bull_use_spike': False, 'bull_rsi_required': False, 'bear_strategy': 'breakout', 'bear_bb_std_mult': 3.072780746644693, 'bear_rsi_os': 42, 'bear_rsi_ob': 58, 'bear_adx_thresh': 23.114948333577757, 'bear_atr_min_pct': 0.02225444839562549, 'bear_atr_max_pct': 0.09384047240779583, 'bear_tp_mult': 1.8548442804414749, 'bear_tsl_mult': 0.4189939376625026, 'bear_time_stop': 95, 'bear_use_sma': True, 'bear_use_ema': False, 'bear_use_atr': True, 'bear_use_adx': False, 'bear_use_spike': True, 'bear_rsi_required': True, 'sideways_strategy': 'breakout', 'sideways_bb_std_mult': 0.5888603190658427, 'sideways_rsi_os': 39, 'sideways_rsi_ob': 45, 'sideways_adx_thresh': 10.34832224232684, 'sideways_atr_min_pct': 0.02145736354680132, 'sideways_atr_max_pct': 0.13560988484628558, 'sideways_tp_mult': 2.47630456580047, 'sideways_tsl_mult': 0.5637079642785812, 'sideways_time_stop': 144, 'sideways_use_sma': False, 'sideways_use_ema': False, 'sideways_use_atr': True, 'sideways_use_adx': True, 'sideways_use_spike': True, 'sideways_rsi_required': True}.
[I 2025-09-01 08:19:43,120] Trial 368 finished with values: [-1000000000.0, 1000000000.0] and parameters: {'p_sma': 19, 'p_std': 26, 'p_atr': 10, 'p_adx': 26, 'rsi_period': 65, 'ema1': 5, 'ema2': 52, 'slip_atr_k': 0.05242472117055037, 'slip_spread_k': 0.719275551088487, 'spread_hl_frac': 0.046962581966967676, 'bb_std_mult': 1.6546310985699062, 'rsi_os': 21, 'rsi_ob': 55, 'vol_spike': 0.25481285705529155, 'adx_thresh': 29.00107601334635, 'atr_min_pct': 0.022148140189794118, 'atr_max_pct': 0.017111893107850648, 'tp_mult': 1.225964661419091, 'tsl_mult': 0.46480395015538006, 'strategy': 'breakout', 'time_stop': 244, 'use_sma': True, 'use_atr': False, 'use_adx': False, 'use_ema': True, 'use_spike': True, 'rsi_required': False, 'edge_k': 0.9957063169905271, 'edge_cap': 0.9762738134481823, 'bull_strategy': 'breakout', 'bull_bb_std_mult': 2.8489019791141894, 'bull_rsi_os': 15, 'bull_rsi_ob': 69, 'bull_adx_thresh': 29.681178483968502, 'bull_atr_min_pct': 0.029928209607119442, 'bull_atr_max_pct': 0.04914857396792623, 'bull_tp_mult': 2.9903961722182024, 'bull_tsl_mult': 0.9387429204860052, 'bull_time_stop': 26, 'bull_use_sma': False, 'bull_use_ema': True, 'bull_use_atr': False, 'bull_use_adx': True, 'bull_use_spike': True, 'bull_rsi_required': True, 'bear_strategy': 'mean_reversion', 'bear_bb_std_mult': 2.860392461093201, 'bear_rsi_os': 42, 'bear_rsi_ob': 50, 'bear_adx_thresh': 23.2162629134072, 'bear_atr_min_pct': 0.021538905221695187, 'bear_atr_max_pct': 0.10676900880462405, 'bear_tp_mult': 1.8539540863876982, 'bear_tsl_mult': 0.07881973286100584, 'bear_time_stop': 78, 'bear_use_sma': False, 'bear_use_ema': False, 'bear_use_atr': False, 'bear_use_adx': False, 'bear_use_spike': True, 'bear_rsi_required': True, 'sideways_strategy': 'mean_reversion', 'sideways_bb_std_mult': 0.5734477550219924, 'sideways_rsi_os': 25, 'sideways_rsi_ob': 69, 'sideways_adx_thresh': 8.637714720641878, 'sideways_atr_min_pct': 0.021391857739224484, 'sideways_atr_max_pct': 0.03142932496071413, 'sideways_tp_mult': 1.7471868926691834, 'sideways_tsl_mult': 0.27135964661949796, 'sideways_time_stop': 52, 'sideways_use_sma': False, 'sideways_use_ema': False, 'sideways_use_atr': False, 'sideways_use_adx': True, 'sideways_use_spike': True, 'sideways_rsi_required': False}.
[I 2025-09-01 08:19:43,174] Trial 369 finished with values: [-1000000000.0, 1000000000.0] and parameters: {'p_sma': 19, 'p_std': 14, 'p_atr': 25, 'p_adx': 14, 'rsi_period': 65, 'ema1': 10, 'ema2': 36, 'slip_atr_k': 0.10278311869386494, 'slip_spread_k': 0.720271675897113, 'spread_hl_frac': 0.038328955045651175, 'bb_std_mult': 2.435663568849756, 'rsi_os': 24, 'rsi_ob': 51, 'vol_spike': 0.16625619752895693, 'adx_thresh': 31.40028239775256, 'atr_min_pct': 0.022279698027054862, 'atr_max_pct': 0.019576734261832096, 'tp_mult': 2.2992233127540267, 'tsl_mult': 0.4546500526053505, 'strategy': 'breakout', 'time_stop': 242, 'use_sma': True, 'use_atr': False, 'use_adx': False, 'use_ema': True, 'use_spike': True, 'rsi_required': False, 'edge_k': 0.3141088719460988, 'edge_cap': 0.06810035243616583, 'bull_strategy': 'breakout', 'bull_bb_std_mult': 2.2068152504319993, 'bull_rsi_os': 17, 'bull_rsi_ob': 61, 'bull_adx_thresh': 8.54967897939555, 'bull_atr_min_pct': 0.000412006627728184, 'bull_atr_max_pct': 0.03174877878847762, 'bull_tp_mult': 2.501666841614205, 'bull_tsl_mult': 0.6490059116345404, 'bull_time_stop': 66, 'bull_use_sma': False, 'bull_use_ema': True, 'bull_use_atr': False, 'bull_use_adx': True, 'bull_use_spike': True, 'bull_rsi_required': True, 'bear_strategy': 'mean_reversion', 'bear_bb_std_mult': 0.7854788944013202, 'bear_rsi_os': 35, 'bear_rsi_ob': 49, 'bear_adx_thresh': 30.842805801428906, 'bear_atr_min_pct': 0.02062416660064428, 'bear_atr_max_pct': 0.06688733976733219, 'bear_tp_mult': 2.854190265196975, 'bear_tsl_mult': 0.08109923479627285, 'bear_time_stop': 113, 'bear_use_sma': False, 'bear_use_ema': False, 'bear_use_atr': False, 'bear_use_adx': False, 'bear_use_spike': True, 'bear_rsi_required': True, 'sideways_strategy': 'mean_reversion', 'sideways_bb_std_mult': 0.5984904983037601, 'sideways_rsi_os': 39, 'sideways_rsi_ob': 59, 'sideways_adx_thresh': 13.755248232922078, 'sideways_atr_min_pct': 0.021587867545620393, 'sideways_atr_max_pct': 0.031962451675654716, 'sideways_tp_mult': 2.683640553455722, 'sideways_tsl_mult': 0.9442437742109653, 'sideways_time_stop': 143, 'sideways_use_sma': False, 'sideways_use_ema': False, 'sideways_use_atr': False, 'sideways_use_adx': True, 'sideways_use_spike': True, 'sideways_rsi_required': False}.
