[I 2025-09-01 07:26:46,062] Trial 44 finished with values: [-0.035958889269795735, 0.037972787203945195] and parameters: {'p_sma': 54, 'p_std': 12, 'p_atr': 10, 'p_adx': 8, 'rsi_period': 48, 'ema1': 26, 'ema2': 56, 'slip_atr_k': 0.03681348052713828, 'slip_spread_k': 0.5793702449204022, 'spread_hl_frac': 0.04273429288944806, 'bb_std_mult': 1.8041324414546274, 'rsi_os': 5, 'rsi_ob': 59, 'vol_spike': 0.2554087962141459, 'adx_thresh': 28.47686613779598, 'atr_min_pct': 0.024017708207761952, 'atr_max_pct': 0.09126806577638705, 'tp_mult': 1.0568935026583288, 'tsl_mult': 0.46218929150306537, 'strategy': 'mean_reversion', 'time_stop': 177, 'use_sma': True, 'use_atr': True, 'use_adx': True, 'use_ema': True, 'use_spike': False, 'rsi_required': True, 'edge_k': 0.9306254469864763, 'edge_cap': 0.9997140745949915, 'bull_strategy': 'breakout', 'bull_bb_std_mult': 2.17738993241916, 'bull_rsi_os': 38, 'bull_rsi_ob': 80, 'bull_adx_thresh': 17.058516283804547, 'bull_atr_min_pct': 0.003558003270902277, 'bull_atr_max_pct': 0.09683628342154126, 'bull_tp_mult': 2.46861303966073, 'bull_tsl_mult': 0.529209775362719, 'bull_time_stop': 166, 'bull_use_sma': True, 'bull_use_ema': False, 'bull_use_atr': False, 'bull_use_adx': True, 'bull_use_spike': True, 'bull_rsi_required': True, 'bear_strategy': 'breakout', 'bear_bb_std_mult': 1.8882256528208234, 'bear_rsi_os': 5, 'bear_rsi_ob': 46, 'bear_adx_thresh': 29.242134625795522, 'bear_atr_min_pct': 0.00820791104172406, 'bear_atr_max_pct': 0.016668373125589036, 'bear_tp_mult': 2.4486348020251736, 'bear_tsl_mult': 0.5824574520634377, 'bear_time_stop': 299, 'bear_use_sma': False, 'bear_use_ema': False, 'bear_use_atr': True, 'bear_use_adx': True, 'bear_use_spike': False, 'bear_rsi_required': True, 'sideways_strategy': 'breakout', 'sideways_bb_std_mult': 1.146554567712644, 'sideways_rsi_os': 36, 'sideways_rsi_ob': 68, 'sideways_adx_thresh': 17.065330289589344, 'sideways_atr_min_pct': 0.020063194043434044, 'sideways_atr_max_pct': 0.11287557003233681, 'sideways_tp_mult': 1.717015180854398, 'sideways_tsl_mult': 0.5112542928649463, 'sideways_time_stop': 122, 'sideways_use_sma': True, 'sideways_use_ema': False, 'sideways_use_atr': True, 'sideways_use_adx': True, 'sideways_use_spike': True, 'sideways_rsi_required': False}.
[I 2025-09-01 07:26:52,214] Trial 47 finished with values: [-0.1118605365255746, 0.11168550573421283] and parameters: {'p_sma': 22, 'p_std': 22, 'p_atr': 28, 'p_adx': 23, 'rsi_period': 66, 'ema1': 11, 'ema2': 16, 'slip_atr_k': 0.08767770734653603, 'slip_spread_k': 0.5763439790536113, 'spread_hl_frac': 0.04623956987843183, 'bb_std_mult': 1.693451215686567, 'rsi_os': 32, 'rsi_ob': 50, 'vol_spike': 0.16034084852753794, 'adx_thresh': 30.547827488870773, 'atr_min_pct': 0.013467297560275438, 'atr_max_pct': 0.14334913750676764, 'tp_mult': 1.0174558112210907, 'tsl_mult': 0.03948022232839259, 'strategy': 'breakout', 'time_stop': 204, 'use_sma': False, 'use_atr': False, 'use_adx': True, 'use_ema': True, 'use_spike': True, 'rsi_required': True, 'edge_k': 1.0664503929721554, 'edge_cap': 0.9101927873178088, 'bull_strategy': 'breakout', 'bull_bb_std_mult': 1.3562596372444025, 'bull_rsi_os': 48, 'bull_rsi_ob': 94, 'bull_adx_thresh': 7.399452405350489, 'bull_atr_min_pct': 0.001875331291650119, 'bull_atr_max_pct': 0.027101926556692926, 'bull_tp_mult': 1.9042520055641527, 'bull_tsl_mult': 0.7735298082105927, 'bull_time_stop': 218, 'bull_use_sma': False, 'bull_use_ema': True, 'bull_use_atr': False, 'bull_use_adx': False, 'bull_use_spike': True, 'bull_rsi_required': False, 'bear_strategy': 'mean_reversion', 'bear_bb_std_mult': 1.98585444118219, 'bear_rsi_os': 5, 'bear_rsi_ob': 51, 'bear_adx_thresh': 11.568112802115783, 'bear_atr_min_pct': 0.023213127740807686, 'bear_atr_max_pct': 0.08885701005954312, 'bear_tp_mult': 2.8677259514683784, 'bear_tsl_mult': 0.18246643752782427, 'bear_time_stop': 48, 'bear_use_sma': True, 'bear_use_ema': True, 'bear_use_atr': False, 'bear_use_adx': False, 'bear_use_spike': True, 'bear_rsi_required': False, 'sideways_strategy': 'mean_reversion', 'sideways_bb_std_mult': 1.8105496933105105, 'sideways_rsi_os': 19, 'sideways_rsi_ob': 51, 'sideways_adx_thresh': 34.57910664630586, 'sideways_atr_min_pct': 0.029976039962455153, 'sideways_atr_max_pct': 0.02437370263215772, 'sideways_tp_mult': 2.073677568953308, 'sideways_tsl_mult': 0.5340482187199738, 'sideways_time_stop': 130, 'sideways_use_sma': True, 'sideways_use_ema': False, 'sideways_use_atr': False, 'sideways_use_adx': True, 'sideways_use_spike': True, 'sideways_rsi_required': True}.
[I 2025-09-01 07:26:53,775] Trial 46 finished with values: [-0.02980679555017629, 0.030495536959415627] and parameters: {'p_sma': 19, 'p_std': 29, 'p_atr': 7, 'p_adx': 25, 'rsi_period': 67, 'ema1': 11, 'ema2': 14, 'slip_atr_k': 0.028617859574341556, 'slip_spread_k': 0.5760389386326508, 'spread_hl_frac': 0.044816687045086775, 'bb_std_mult': 1.7530947962976304, 'rsi_os': 24, 'rsi_ob': 49, 'vol_spike': 0.1241043103967095, 'adx_thresh': 30.464689005479173, 'atr_min_pct': 0.011744988009779415, 'atr_max_pct': 0.13997559064845386, 'tp_mult': 1.0151059027783516, 'tsl_mult': 0.09234959939090498, 'strategy': 'breakout', 'time_stop': 172, 'use_sma': False, 'use_atr': False, 'use_adx': True, 'use_ema': True, 'use_spike': False, 'rsi_required': True, 'edge_k': 1.0198636734852131, 'edge_cap': 0.8987151641441958, 'bull_strategy': 'breakout', 'bull_bb_std_mult': 1.3533370886977663, 'bull_rsi_os': 52, 'bull_rsi_ob': 86, 'bull_adx_thresh': 7.29160155502575, 'bull_atr_min_pct': 0.004380728280321415, 'bull_atr_max_pct': 0.06423622569596588, 'bull_tp_mult': 2.086847671860547, 'bull_tsl_mult': 0.6501758585878075, 'bull_time_stop': 165, 'bull_use_sma': False, 'bull_use_ema': True, 'bull_use_atr': False, 'bull_use_adx': False, 'bull_use_spike': True, 'bull_rsi_required': False, 'bear_strategy': 'breakout', 'bear_bb_std_mult': 1.8735813217847488, 'bear_rsi_os': 6, 'bear_rsi_ob': 48, 'bear_adx_thresh': 13.147472473757706, 'bear_atr_min_pct': 0.023802879041309594, 'bear_atr_max_pct': 0.086871665747724, 'bear_tp_mult': 2.756869885742488, 'bear_tsl_mult': 0.18548598551705842, 'bear_time_stop': 83, 'bear_use_sma': True, 'bear_use_ema': True, 'bear_use_atr': False, 'bear_use_adx': False, 'bear_use_spike': True, 'bear_rsi_required': True, 'sideways_strategy': 'mean_reversion', 'sideways_bb_std_mult': 1.8853985948697307, 'sideways_rsi_os': 20, 'sideways_rsi_ob': 50, 'sideways_adx_thresh': 28.208618047220067, 'sideways_atr_min_pct': 0.023374211329972507, 'sideways_atr_max_pct': 0.033140776350055884, 'sideways_tp_mult': 1.7853949308658599, 'sideways_tsl_mult': 0.5369307287231317, 'sideways_time_stop': 192, 'sideways_use_sma': True, 'sideways_use_ema': False, 'sideways_use_atr': False, 'sideways_use_adx': True, 'sideways_use_spike': True, 'sideways_rsi_required': True}.
[I 2025-09-01 07:26:54,811] Trial 50 finished with values: [-1000000000.0, 1000000000.0] and parameters: {'p_sma': 60, 'p_std': 10, 'p_atr': 8, 'p_adx': 25, 'rsi_period': 57, 'ema1': 20, 'ema2': 19, 'slip_atr_k': 0.024572138733792548, 'slip_spread_k': 0.6189062376851802, 'spread_hl_frac': 0.04950745257347029, 'bb_std_mult': 1.5786466890256763, 'rsi_os': 6, 'rsi_ob': 45, 'vol_spike': 0.25544157239945015, 'adx_thresh': 15.007655297310393, 'atr_min_pct': 0.008198763929632494, 'atr_max_pct': 0.050632878244140374, 'tp_mult': 1.0814954278056021, 'tsl_mult': 0.02723905028809126, 'strategy': 'mean_reversion', 'time_stop': 209, 'use_sma': True, 'use_atr': False, 'use_adx': True, 'use_ema': True, 'use_spike': True, 'rsi_required': True, 'edge_k': 0.9727776857335895, 'edge_cap': 0.8630820737956251, 'bull_strategy': 'breakout', 'bull_bb_std_mult': 2.719362738785617, 'bull_rsi_os': 12, 'bull_rsi_ob': 85, 'bull_adx_thresh': 10.526856001070486, 'bull_atr_min_pct': 0.01914773646920607, 'bull_atr_max_pct': 0.05425579932463303, 'bull_tp_mult': 2.3099673282949738, 'bull_tsl_mult': 0.45390775815563006, 'bull_time_stop': 144, 'bull_use_sma': True, 'bull_use_ema': True, 'bull_use_atr': False, 'bull_use_adx': False, 'bull_use_spike': True, 'bull_rsi_required': False, 'bear_strategy': 'breakout', 'bear_bb_std_mult': 2.560470416573926, 'bear_rsi_os': 12, 'bear_rsi_ob': 51, 'bear_adx_thresh': 7.518899309785169, 'bear_atr_min_pct': 0.01387419110784085, 'bear_atr_max_pct': 0.08067767684602326, 'bear_tp_mult': 2.4487822236006904, 'bear_tsl_mult': 0.5163825904832149, 'bear_time_stop': 17, 'bear_use_sma': True, 'bear_use_ema': True, 'bear_use_atr': False, 'bear_use_adx': False, 'bear_use_spike': True, 'bear_rsi_required': False, 'sideways_strategy': 'mean_reversion', 'sideways_bb_std_mult': 1.0700496812542435, 'sideways_rsi_os': 34, 'sideways_rsi_ob': 86, 'sideways_adx_thresh': 7.078169314338819, 'sideways_atr_min_pct': 0.006018313554051751, 'sideways_atr_max_pct': 0.11168370517719914, 'sideways_tp_mult': 1.879842508106618, 'sideways_tsl_mult': 0.4854124206704321, 'sideways_time_stop': 183, 'sideways_use_sma': True, 'sideways_use_ema': False, 'sideways_use_atr': False, 'sideways_use_adx': True, 'sideways_use_spike': True, 'sideways_rsi_required': True}.
[I 2025-09-01 07:27:29,694] Trial 48 finished with values: [-1000000000.0, 1000000000.0] and parameters: {'p_sma': 60, 'p_std': 11, 'p_atr': 8, 'p_adx': 24, 'rsi_period': 66, 'ema1': 20, 'ema2': 18, 'slip_atr_k': 0.021604071842998007, 'slip_spread_k': 0.6084768096027182, 'spread_hl_frac': 0.046263887588357505, 'bb_std_mult': 1.6738671207628126, 'rsi_os': 6, 'rsi_ob': 51, 'vol_spike': 0.1669425704713673, 'adx_thresh': 18.06146317280899, 'atr_min_pct': 0.013270459113343904, 'atr_max_pct': 0.04813876504296594, 'tp_mult': 1.0370950410909003, 'tsl_mult': 0.04202463182279382, 'strategy': 'mean_reversion', 'time_stop': 206, 'use_sma': True, 'use_atr': False, 'use_adx': True, 'use_ema': True, 'use_spike': True, 'rsi_required': True, 'edge_k': 1.0403794839358904, 'edge_cap': 0.9027789749968722, 'bull_strategy': 'breakout', 'bull_bb_std_mult': 2.728487825874023, 'bull_rsi_os': 13, 'bull_rsi_ob': 95, 'bull_adx_thresh': 7.906523731677803, 'bull_atr_min_pct': 0.01809579016888847, 'bull_atr_max_pct': 0.05143816929004412, 'bull_tp_mult': 2.3096058964488075, 'bull_tsl_mult': 0.776335583598219, 'bull_time_stop': 144, 'bull_use_sma': True, 'bull_use_ema': True, 'bull_use_atr': False, 'bull_use_adx': False, 'bull_use_spike': True, 'bull_rsi_required': False, 'bear_strategy': 'breakout', 'bear_bb_std_mult': 2.6026534050912793, 'bear_rsi_os': 13, 'bear_rsi_ob': 52, 'bear_adx_thresh': 7.589366207421801, 'bear_atr_min_pct': 0.02419712438175334, 'bear_atr_max_pct': 0.0875250722331743, 'bear_tp_mult': 2.86695549011652, 'bear_tsl_mult': 0.38434494741924724, 'bear_time_stop': 53, 'bear_use_sma': True, 'bear_use_ema': True, 'bear_use_atr': False, 'bear_use_adx': False, 'bear_use_spike': True, 'bear_rsi_required': False, 'sideways_strategy': 'mean_reversion', 'sideways_bb_std_mult': 1.818070304567057, 'sideways_rsi_os': 35, 'sideways_rsi_ob': 87, 'sideways_adx_thresh': 25.607749348378487, 'sideways_atr_min_pct': 0.0053430662544022775, 'sideways_atr_max_pct': 0.11153755118972689, 'sideways_tp_mult': 2.0793013351153884, 'sideways_tsl_mult': 0.38144677873759547, 'sideways_time_stop': 186, 'sideways_use_sma': True, 'sideways_use_ema': False, 'sideways_use_atr': False, 'sideways_use_adx': True, 'sideways_use_spike': True, 'sideways_rsi_required': True}.
[I 2025-09-01 07:27:39,327] Trial 49 finished with values: [-1000000000.0, 1000000000.0] and parameters: {'p_sma': 60, 'p_std': 11, 'p_atr': 11, 'p_adx': 24, 'rsi_period': 65, 'ema1': 20, 'ema2': 19, 'slip_atr_k': 0.029424766129011362, 'slip_spread_k': 0.5960602863747856, 'spread_hl_frac': 0.0499626878993306, 'bb_std_mult': 1.6879178788172131, 'rsi_os': 5, 'rsi_ob': 50, 'vol_spike': 0.2808100835598167, 'adx_thresh': 29.859518655600077, 'atr_min_pct': 0.00747303740042349, 'atr_max_pct': 0.050546951323100636, 'tp_mult': 1.0225855297016693, 'tsl_mult': 0.03480337028359337, 'strategy': 'breakout', 'time_stop': 214, 'use_sma': False, 'use_atr': False, 'use_adx': True, 'use_ema': True, 'use_spike': True, 'rsi_required': True, 'edge_k': 1.0215376545025154, 'edge_cap': 0.9268420446860736, 'bull_strategy': 'breakout', 'bull_bb_std_mult': 2.0083778328620046, 'bull_rsi_os': 13, 'bull_rsi_ob': 93, 'bull_adx_thresh': 7.59647767663296, 'bull_atr_min_pct': 0.01782258472572814, 'bull_atr_max_pct': 0.030091945374354827, 'bull_tp_mult': 2.31430453871673, 'bull_tsl_mult': 0.7808037209800419, 'bull_time_stop': 142, 'bull_use_sma': False, 'bull_use_ema': True, 'bull_use_atr': False, 'bull_use_adx': False, 'bull_use_spike': True, 'bull_rsi_required': False, 'bear_strategy': 'breakout', 'bear_bb_std_mult': 2.532148052838832, 'bear_rsi_os': 13, 'bear_rsi_ob': 51, 'bear_adx_thresh': 15.02096768182389, 'bear_atr_min_pct': 0.023226842472900924, 'bear_atr_max_pct': 0.08612359374365071, 'bear_tp_mult': 2.4526652680016614, 'bear_tsl_mult': 0.508607441963828, 'bear_time_stop': 132, 'bear_use_sma': True, 'bear_use_ema': True, 'bear_use_atr': False, 'bear_use_adx': False, 'bear_use_spike': True, 'bear_rsi_required': False, 'sideways_strategy': 'mean_reversion', 'sideways_bb_std_mult': 1.148281746156687, 'sideways_rsi_os': 35, 'sideways_rsi_ob': 87, 'sideways_adx_thresh': 28.495564691375307, 'sideways_atr_min_pct': 0.00579830977432691, 'sideways_atr_max_pct': 0.11262667860929039, 'sideways_tp_mult': 2.0299922829847983, 'sideways_tsl_mult': 0.48426071273651394, 'sideways_time_stop': 181, 'sideways_use_sma': True, 'sideways_use_ema': False, 'sideways_use_atr': False, 'sideways_use_adx': True, 'sideways_use_spike': True, 'sideways_rsi_required': True}.
[I 2025-09-01 07:27:44,339] Trial 51 finished with values: [-1000000000.0, 1000000000.0] and parameters: {'p_sma': 60, 'p_std': 11, 'p_atr': 12, 'p_adx': 26, 'rsi_period': 56, 'ema1': 20, 'ema2': 22, 'slip_atr_k': 0.027066600528481626, 'slip_spread_k': 0.6057777409305004, 'spread_hl_frac': 0.049125795136132265, 'bb_std_mult': 1.9558397240686143, 'rsi_os': 5, 'rsi_ob': 56, 'vol_spike': 0.06452626641232455, 'adx_thresh': 34.62009059402347, 'atr_min_pct': 0.007422588398788121, 'atr_max_pct': 0.0860073008667588, 'tp_mult': 1.145680241454844, 'tsl_mult': 0.14735464239625154, 'strategy': 'mean_reversion', 'time_stop': 162, 'use_sma': True, 'use_atr': False, 'use_adx': True, 'use_ema': True, 'use_spike': True, 'rsi_required': True, 'edge_k': 0.8655745173673097, 'edge_cap': 0.8687281441666048, 'bull_strategy': 'breakout', 'bull_bb_std_mult': 2.274592845923226, 'bull_rsi_os': 12, 'bull_rsi_ob': 86, 'bull_adx_thresh': 10.463705953826421, 'bull_atr_min_pct': 0.019887541949404786, 'bull_atr_max_pct': 0.053693864858765074, 'bull_tp_mult': 2.3333326755247, 'bull_tsl_mult': 0.5085963236921335, 'bull_time_stop': 143, 'bull_use_sma': True, 'bull_use_ema': True, 'bull_use_atr': False, 'bull_use_adx': False, 'bull_use_spike': True, 'bull_rsi_required': False, 'bear_strategy': 'breakout', 'bear_bb_std_mult': 2.27536120807348, 'bear_rsi_os': 35, 'bear_rsi_ob': 85, 'bear_adx_thresh': 7.799761558893184, 'bear_atr_min_pct': 0.015612568474671962, 'bear_atr_max_pct': 0.0767255933844127, 'bear_tp_mult': 2.46027896780183, 'bear_tsl_mult': 0.3113291691044484, 'bear_time_stop': 127, 'bear_use_sma': True, 'bear_use_ema': True, 'bear_use_atr': False, 'bear_use_adx': False, 'bear_use_spike': True, 'bear_rsi_required': False, 'sideways_strategy': 'mean_reversion', 'sideways_bb_std_mult': 1.1203201271476981, 'sideways_rsi_os': 34, 'sideways_rsi_ob': 79, 'sideways_adx_thresh': 28.337942330428948, 'sideways_atr_min_pct': 0.005887032259681265, 'sideways_atr_max_pct': 0.11237560250976683, 'sideways_tp_mult': 2.3586854090943477, 'sideways_tsl_mult': 0.4985391546134191, 'sideways_time_stop': 180, 'sideways_use_sma': True, 'sideways_use_ema': False, 'sideways_use_atr': False, 'sideways_use_adx': True, 'sideways_use_spike': False, 'sideways_rsi_required': True}.
[I 2025-09-01 07:27:44,785] Trial 52 finished with values: [-1000000000.0, 1000000000.0] and parameters: {'p_sma': 16, 'p_std': 15, 'p_atr': 11, 'p_adx': 29, 'rsi_period': 63, 'ema1': 13, 'ema2': 25, 'slip_atr_k': 0.01812680530635581, 'slip_spread_k': 0.47842111331547976, 'spread_hl_frac': 0.04184263242160553, 'bb_std_mult': 1.9783256017057675, 'rsi_os': 10, 'rsi_ob': 55, 'vol_spike': 0.1253005737889576, 'adx_thresh': 17.73866426907362, 'atr_min_pct': 0.00692933907911626, 'atr_max_pct': 0.08563928837486562, 'tp_mult': 1.170816974988387, 'tsl_mult': 0.4800108438558285, 'strategy': 'breakout', 'time_stop': 158, 'use_sma': False, 'use_atr': False, 'use_adx': True, 'use_ema': True, 'use_spike': True, 'rsi_required': True, 'edge_k': 0.83128361251215, 'edge_cap': 0.9292127744207145, 'bull_strategy': 'breakout', 'bull_bb_std_mult': 2.128439418313584, 'bull_rsi_os': 37, 'bull_rsi_ob': 82, 'bull_adx_thresh': 16.812253922147075, 'bull_atr_min_pct': 0.007375086456224025, 'bull_atr_max_pct': 0.06128524327000091, 'bull_tp_mult': 2.0774815505760484, 'bull_tsl_mult': 0.5203199784159287, 'bull_time_stop': 161, 'bull_use_sma': False, 'bull_use_ema': True, 'bull_use_atr': False, 'bull_use_adx': False, 'bull_use_spike': True, 'bull_rsi_required': False, 'bear_strategy': 'mean_reversion', 'bear_bb_std_mult': 2.2585380679053553, 'bear_rsi_os': 38, 'bear_rsi_ob': 65, 'bear_adx_thresh': 32.767935390846844, 'bear_atr_min_pct': 0.016720617962485366, 'bear_atr_max_pct': 0.044476180937836764, 'bear_tp_mult': 2.884943202655765, 'bear_tsl_mult': 0.31414616897937375, 'bear_time_stop': 57, 'bear_use_sma': True, 'bear_use_ema': True, 'bear_use_atr': False, 'bear_use_adx': False, 'bear_use_spike': True, 'bear_rsi_required': False, 'sideways_strategy': 'mean_reversion', 'sideways_bb_std_mult': 1.4559027440359849, 'sideways_rsi_os': 35, 'sideways_rsi_ob': 76, 'sideways_adx_thresh': 28.42688962370442, 'sideways_atr_min_pct': 0.025614056483222722, 'sideways_atr_max_pct': 0.024132183912997287, 'sideways_tp_mult': 2.4537986898578295, 'sideways_tsl_mult': 0.37365781227976547, 'sideways_time_stop': 165, 'sideways_use_sma': True, 'sideways_use_ema': False, 'sideways_use_atr': False, 'sideways_use_adx': True, 'sideways_use_spike': False, 'sideways_rsi_required': True}.
[I 2025-09-01 07:28:13,830] Trial 53 finished with values: [-1000000000.0, 1000000000.0] and parameters: {'p_sma': 13, 'p_std': 16, 'p_atr': 11, 'p_adx': 28, 'rsi_period': 71, 'ema1': 13, 'ema2': 26, 'slip_atr_k': 0.05291455396742151, 'slip_spread_k': 0.4585926483443112, 'spread_hl_frac': 0.04201866896556366, 'bb_std_mult': 1.0106420062966925, 'rsi_os': 10, 'rsi_ob': 57, 'vol_spike': 0.2875954792180633, 'adx_thresh': 28.772621498316056, 'atr_min_pct': 0.0027511830408888625, 'atr_max_pct': 0.08632836545559487, 'tp_mult': 1.446444444908329, 'tsl_mult': 0.14636688185198532, 'strategy': 'breakout', 'time_stop': 157, 'use_sma': False, 'use_atr': False, 'use_adx': True, 'use_ema': True, 'use_spike': True, 'rsi_required': True, 'edge_k': 1.3221010400951354, 'edge_cap': 0.9992823469623442, 'bull_strategy': 'breakout', 'bull_bb_std_mult': 2.1082607017035775, 'bull_rsi_os': 6, 'bull_rsi_ob': 87, 'bull_adx_thresh': 17.14428738221346, 'bull_atr_min_pct': 0.007675618643775574, 'bull_atr_max_pct': 0.0655708537868256, 'bull_tp_mult': 2.061550431674965, 'bull_tsl_mult': 0.521996454288792, 'bull_time_stop': 163, 'bull_use_sma': False, 'bull_use_ema': True, 'bull_use_atr': False, 'bull_use_adx': False, 'bull_use_spike': True, 'bull_rsi_required': False, 'bear_strategy': 'mean_reversion', 'bear_bb_std_mult': 2.234876431451233, 'bear_rsi_os': 35, 'bear_rsi_ob': 85, 'bear_adx_thresh': 32.66224351287448, 'bear_atr_min_pct': 0.015739837329337474, 'bear_atr_max_pct': 0.04692685778329329, 'bear_tp_mult': 2.411285986484359, 'bear_tsl_mult': 0.2708330659741651, 'bear_time_stop': 125, 'bear_use_sma': True, 'bear_use_ema': True, 'bear_use_atr': False, 'bear_use_adx': False, 'bear_use_spike': True, 'bear_rsi_required': False, 'sideways_strategy': 'mean_reversion', 'sideways_bb_std_mult': 2.1529956633945, 'sideways_rsi_os': 21, 'sideways_rsi_ob': 79, 'sideways_adx_thresh': 28.65262299903744, 'sideways_atr_min_pct': 0.025464442658267177, 'sideways_atr_max_pct': 0.04348109818361252, 'sideways_tp_mult': 2.3448181606608327, 'sideways_tsl_mult': 0.7594357162162751, 'sideways_time_stop': 162, 'sideways_use_sma': True, 'sideways_use_ema': False, 'sideways_use_atr': False, 'sideways_use_adx': True, 'sideways_use_spike': False, 'sideways_rsi_required': True}.
