[I 2025-09-01 08:08:24,515] Trial 299 finished with values: [-1000000000.0, 1000000000.0] and parameters: {'p_sma': 21, 'p_std': 54, 'p_atr': 12, 'p_adx': 19, 'rsi_period': 44, 'ema1': 24, 'ema2': 33, 'slip_atr_k': 0.052542004970893244, 'slip_spread_k': 0.24584564977847134, 'spread_hl_frac': 0.02575077049480166, 'bb_std_mult': 0.8238671940198012, 'rsi_os': 38, 'rsi_ob': 57, 'vol_spike': 0.26528354168331875, 'adx_thresh': 7.44424493200356, 'atr_min_pct': 0.0009252551516613378, 'atr_max_pct': 0.10038448843054182, 'tp_mult': 1.179857490003286, 'tsl_mult': 0.9509020885097802, 'strategy': 'mean_reversion', 'time_stop': 191, 'use_sma': True, 'use_atr': True, 'use_adx': True, 'use_ema': True, 'use_spike': True, 'rsi_required': True, 'edge_k': 1.118447691654141, 'edge_cap': 0.9019263810881397, 'bull_strategy': 'breakout', 'bull_bb_std_mult': 1.9908454129106568, 'bull_rsi_os': 26, 'bull_rsi_ob': 69, 'bull_adx_thresh': 9.005586714846203, 'bull_atr_min_pct': 0.00418246167497353, 'bull_atr_max_pct': 0.03723431444564978, 'bull_tp_mult': 2.3166834949477915, 'bull_tsl_mult': 0.6282194905386163, 'bull_time_stop': 190, 'bull_use_sma': True, 'bull_use_ema': False, 'bull_use_atr': False, 'bull_use_adx': True, 'bull_use_spike': True, 'bull_rsi_required': False, 'bear_strategy': 'breakout', 'bear_bb_std_mult': 3.192208811257117, 'bear_rsi_os': 49, 'bear_rsi_ob': 53, 'bear_adx_thresh': 17.244297554640365, 'bear_atr_min_pct': 0.021041979433486912, 'bear_atr_max_pct': 0.07941948254235921, 'bear_tp_mult': 2.350503598627506, 'bear_tsl_mult': 0.03586101738502505, 'bear_time_stop': 229, 'bear_use_sma': False, 'bear_use_ema': True, 'bear_use_atr': False, 'bear_use_adx': True, 'bear_use_spike': True, 'bear_rsi_required': False, 'sideways_strategy': 'mean_reversion', 'sideways_bb_std_mult': 0.5547082315301629, 'sideways_rsi_os': 31, 'sideways_rsi_ob': 71, 'sideways_adx_thresh': 21.193279656674846, 'sideways_atr_min_pct': 0.02284160702985089, 'sideways_atr_max_pct': 0.027057442106582355, 'sideways_tp_mult': 2.2745926903586433, 'sideways_tsl_mult': 0.13377901546734608, 'sideways_time_stop': 53, 'sideways_use_sma': False, 'sideways_use_ema': False, 'sideways_use_atr': False, 'sideways_use_adx': True, 'sideways_use_spike': True, 'sideways_rsi_required': False}.
[I 2025-09-01 08:08:24,944] Trial 298 finished with values: [-1000000000.0, 1000000000.0] and parameters: {'p_sma': 57, 'p_std': 16, 'p_atr': 12, 'p_adx': 19, 'rsi_period': 44, 'ema1': 8, 'ema2': 39, 'slip_atr_k': 0.05361152425620585, 'slip_spread_k': 0.6778845915791161, 'spread_hl_frac': 0.04231827195422992, 'bb_std_mult': 3.1882466295170766, 'rsi_os': 38, 'rsi_ob': 81, 'vol_spike': 0.25152762269108714, 'adx_thresh': 26.176821686327184, 'atr_min_pct': 0.022747278947468377, 'atr_max_pct': 0.1498374139248183, 'tp_mult': 1.1798199873914135, 'tsl_mult': 0.9454126933995334, 'strategy': 'mean_reversion', 'time_stop': 255, 'use_sma': True, 'use_atr': True, 'use_adx': True, 'use_ema': True, 'use_spike': True, 'rsi_required': True, 'edge_k': 1.0252283966754914, 'edge_cap': 0.8961775803342085, 'bull_strategy': 'breakout', 'bull_bb_std_mult': 1.9752046542211137, 'bull_rsi_os': 15, 'bull_rsi_ob': 68, 'bull_adx_thresh': 7.587726456624279, 'bull_atr_min_pct': 0.00844273767161962, 'bull_atr_max_pct': 0.03711584554321648, 'bull_tp_mult': 1.1111936310131796, 'bull_tsl_mult': 0.6227323971188355, 'bull_time_stop': 22, 'bull_use_sma': True, 'bull_use_ema': False, 'bull_use_atr': False, 'bull_use_adx': True, 'bull_use_spike': True, 'bull_rsi_required': False, 'bear_strategy': 'breakout', 'bear_bb_std_mult': 1.318392612333485, 'bear_rsi_os': 9, 'bear_rsi_ob': 78, 'bear_adx_thresh': 34.02462032490419, 'bear_atr_min_pct': 0.02098675620578523, 'bear_atr_max_pct': 0.1439427056013337, 'bear_tp_mult': 2.607221321697309, 'bear_tsl_mult': 0.0370573337539399, 'bear_time_stop': 276, 'bear_use_sma': False, 'bear_use_ema': True, 'bear_use_atr': False, 'bear_use_adx': True, 'bear_use_spike': True, 'bear_rsi_required': False, 'sideways_strategy': 'mean_reversion', 'sideways_bb_std_mult': 0.5615317083288474, 'sideways_rsi_os': 41, 'sideways_rsi_ob': 56, 'sideways_adx_thresh': 9.144457932744544, 'sideways_atr_min_pct': 0.022690062426594212, 'sideways_atr_max_pct': 0.027625103209585295, 'sideways_tp_mult': 2.5434423407016635, 'sideways_tsl_mult': 0.9035387124321088, 'sideways_time_stop': 142, 'sideways_use_sma': False, 'sideways_use_ema': False, 'sideways_use_atr': False, 'sideways_use_adx': True, 'sideways_use_spike': True, 'sideways_rsi_required': False}.
[I 2025-09-01 08:08:25,336] Trial 297 finished with values: [-1000000000.0, 1000000000.0] and parameters: {'p_sma': 21, 'p_std': 38, 'p_atr': 13, 'p_adx': 25, 'rsi_period': 51, 'ema1': 10, 'ema2': 14, 'slip_atr_k': 0.05277232992390282, 'slip_spread_k': 0.6768995773014866, 'spread_hl_frac': 0.010326295420022995, 'bb_std_mult': 2.374753209033708, 'rsi_os': 13, 'rsi_ob': 81, 'vol_spike': 0.23992053955696008, 'adx_thresh': 22.60673871680552, 'atr_min_pct': 0.022380337218110127, 'atr_max_pct': 0.14462330427299724, 'tp_mult': 1.1795842919569342, 'tsl_mult': 0.4382265566425693, 'strategy': 'mean_reversion', 'time_stop': 231, 'use_sma': True, 'use_atr': True, 'use_adx': True, 'use_ema': True, 'use_spike': True, 'rsi_required': True, 'edge_k': 0.9283322553588499, 'edge_cap': 0.527638183794751, 'bull_strategy': 'breakout', 'bull_bb_std_mult': 2.604049827828552, 'bull_rsi_os': 13, 'bull_rsi_ob': 68, 'bull_adx_thresh': 20.823578914770476, 'bull_atr_min_pct': 0.004316699414108532, 'bull_atr_max_pct': 0.04777533503755773, 'bull_tp_mult': 2.3167882695035615, 'bull_tsl_mult': 0.6773476555301199, 'bull_time_stop': 224, 'bull_use_sma': True, 'bull_use_ema': False, 'bull_use_atr': False, 'bull_use_adx': True, 'bull_use_spike': True, 'bull_rsi_required': False, 'bear_strategy': 'mean_reversion', 'bear_bb_std_mult': 2.4702580506218115, 'bear_rsi_os': 8, 'bear_rsi_ob': 91, 'bear_adx_thresh': 16.8015337586118, 'bear_atr_min_pct': 0.024523828745069195, 'bear_atr_max_pct': 0.14514877269666404, 'bear_tp_mult': 2.9225684369554874, 'bear_tsl_mult': 0.10398013692012911, 'bear_time_stop': 95, 'bear_use_sma': True, 'bear_use_ema': True, 'bear_use_atr': False, 'bear_use_adx': True, 'bear_use_spike': False, 'bear_rsi_required': False, 'sideways_strategy': 'mean_reversion', 'sideways_bb_std_mult': 0.6512241249845837, 'sideways_rsi_os': 24, 'sideways_rsi_ob': 71, 'sideways_adx_thresh': 6.789678095848897, 'sideways_atr_min_pct': 0.014885142302561945, 'sideways_atr_max_pct': 0.027320899906157776, 'sideways_tp_mult': 1.3990288803130333, 'sideways_tsl_mult': 0.8201497068341925, 'sideways_time_stop': 22, 'sideways_use_sma': False, 'sideways_use_ema': True, 'sideways_use_atr': False, 'sideways_use_adx': False, 'sideways_use_spike': False, 'sideways_rsi_required': True}.
[I 2025-09-01 08:08:25,631] Trial 300 finished with values: [-0.03540091491430808, 0.035897838545438] and parameters: {'p_sma': 21, 'p_std': 26, 'p_atr': 10, 'p_adx': 19, 'rsi_period': 50, 'ema1': 11, 'ema2': 14, 'slip_atr_k': 0.08905090180307598, 'slip_spread_k': 0.6040716477247129, 'spread_hl_frac': 0.04809947687270741, 'bb_std_mult': 2.353310985937963, 'rsi_os': 13, 'rsi_ob': 57, 'vol_spike': 0.07424134457815901, 'adx_thresh': 7.309427398618215, 'atr_min_pct': 0.02290570731500826, 'atr_max_pct': 0.14443271281239276, 'tp_mult': 2.180813041428751, 'tsl_mult': 0.9440051354324099, 'strategy': 'mean_reversion', 'time_stop': 240, 'use_sma': True, 'use_atr': True, 'use_adx': True, 'use_ema': True, 'use_spike': True, 'rsi_required': True, 'edge_k': 1.0372977305244269, 'edge_cap': 0.10113995675094982, 'bull_strategy': 'breakout', 'bull_bb_std_mult': 2.099238544740804, 'bull_rsi_os': 28, 'bull_rsi_ob': 68, 'bull_adx_thresh': 9.004399961090021, 'bull_atr_min_pct': 0.004112128542958896, 'bull_atr_max_pct': 0.03779868413264637, 'bull_tp_mult': 2.253615785817714, 'bull_tsl_mult': 0.6223155643745373, 'bull_time_stop': 59, 'bull_use_sma': True, 'bull_use_ema': False, 'bull_use_atr': False, 'bull_use_adx': True, 'bull_use_spike': True, 'bull_rsi_required': False, 'bear_strategy': 'breakout', 'bear_bb_std_mult': 2.449717799295002, 'bear_rsi_os': 8, 'bear_rsi_ob': 81, 'bear_adx_thresh': 34.911476313743094, 'bear_atr_min_pct': 0.02395817189329768, 'bear_atr_max_pct': 0.029261789723708957, 'bear_tp_mult': 2.8480174413899464, 'bear_tsl_mult': 0.03306216185531768, 'bear_time_stop': 275, 'bear_use_sma': False, 'bear_use_ema': True, 'bear_use_atr': False, 'bear_use_adx': True, 'bear_use_spike': True, 'bear_rsi_required': True, 'sideways_strategy': 'mean_reversion', 'sideways_bb_std_mult': 0.5403185047871776, 'sideways_rsi_os': 43, 'sideways_rsi_ob': 71, 'sideways_adx_thresh': 11.514821343840335, 'sideways_atr_min_pct': 0.022242490112608135, 'sideways_atr_max_pct': 0.035745567001089204, 'sideways_tp_mult': 2.539020054209966, 'sideways_tsl_mult': 0.8262563634185116, 'sideways_time_stop': 22, 'sideways_use_sma': False, 'sideways_use_ema': False, 'sideways_use_atr': False, 'sideways_use_adx': True, 'sideways_use_spike': True, 'sideways_rsi_required': False}.
[I 2025-09-01 08:08:26,487] Trial 301 finished with values: [-1000000000.0, 1000000000.0] and parameters: {'p_sma': 21, 'p_std': 26, 'p_atr': 11, 'p_adx': 30, 'rsi_period': 24, 'ema1': 26, 'ema2': 14, 'slip_atr_k': 0.05688012417604078, 'slip_spread_k': 0.6608385634119078, 'spread_hl_frac': 0.02524782183254754, 'bb_std_mult': 1.2951345884424308, 'rsi_os': 13, 'rsi_ob': 46, 'vol_spike': 0.05153531670393549, 'adx_thresh': 24.132160784456218, 'atr_min_pct': 0.022914559341308673, 'atr_max_pct': 0.01025301541484512, 'tp_mult': 1.1250882850067463, 'tsl_mult': 0.43477018152668767, 'strategy': 'mean_reversion', 'time_stop': 137, 'use_sma': True, 'use_atr': True, 'use_adx': True, 'use_ema': True, 'use_spike': True, 'rsi_required': True, 'edge_k': 0.6915504922249931, 'edge_cap': 0.09935115676367277, 'bull_strategy': 'breakout', 'bull_bb_std_mult': 2.1828700146090765, 'bull_rsi_os': 14, 'bull_rsi_ob': 79, 'bull_adx_thresh': 7.608385372931617, 'bull_atr_min_pct': 0.00845530430629045, 'bull_atr_max_pct': 0.04113394690890419, 'bull_tp_mult': 2.25597204043001, 'bull_tsl_mult': 0.6591695365739596, 'bull_time_stop': 151, 'bull_use_sma': False, 'bull_use_ema': False, 'bull_use_atr': False, 'bull_use_adx': True, 'bull_use_spike': True, 'bull_rsi_required': False, 'bear_strategy': 'mean_reversion', 'bear_bb_std_mult': 2.479231961911012, 'bear_rsi_os': 23, 'bear_rsi_ob': 92, 'bear_adx_thresh': 29.893944882346705, 'bear_atr_min_pct': 0.024608875551824953, 'bear_atr_max_pct': 0.14490155739215343, 'bear_tp_mult': 1.3376564881093547, 'bear_tsl_mult': 0.35771687048326606, 'bear_time_stop': 96, 'bear_use_sma': False, 'bear_use_ema': False, 'bear_use_atr': True, 'bear_use_adx': True, 'bear_use_spike': True, 'bear_rsi_required': True, 'sideways_strategy': 'mean_reversion', 'sideways_bb_std_mult': 0.6268503263345933, 'sideways_rsi_os': 39, 'sideways_rsi_ob': 70, 'sideways_adx_thresh': 34.198028937500695, 'sideways_atr_min_pct': 0.006036999266158059, 'sideways_atr_max_pct': 0.12943356977406667, 'sideways_tp_mult': 2.616835014680982, 'sideways_tsl_mult': 0.21379125843612137, 'sideways_time_stop': 22, 'sideways_use_sma': False, 'sideways_use_ema': False, 'sideways_use_atr': False, 'sideways_use_adx': True, 'sideways_use_spike': True, 'sideways_rsi_required': False}.
[I 2025-09-01 08:09:07,378] Trial 303 finished with values: [-1000000000.0, 1000000000.0] and parameters: {'p_sma': 45, 'p_std': 22, 'p_atr': 27, 'p_adx': 26, 'rsi_period': 67, 'ema1': 22, 'ema2': 19, 'slip_atr_k': 0.08377888611306328, 'slip_spread_k': 0.6151408796146018, 'spread_hl_frac': 0.018220809388202995, 'bb_std_mult': 0.9708868136064714, 'rsi_os': 27, 'rsi_ob': 58, 'vol_spike': 0.23528075072509108, 'adx_thresh': 30.928008350281722, 'atr_min_pct': 0.020255778334744592, 'atr_max_pct': 0.09224446852268829, 'tp_mult': 2.191952838256345, 'tsl_mult': 0.6821097880402734, 'strategy': 'mean_reversion', 'time_stop': 114, 'use_sma': True, 'use_atr': True, 'use_adx': True, 'use_ema': False, 'use_spike': True, 'rsi_required': True, 'edge_k': 1.2469316664073509, 'edge_cap': 0.104032760170036, 'bull_strategy': 'breakout', 'bull_bb_std_mult': 1.0426479376593494, 'bull_rsi_os': 42, 'bull_rsi_ob': 62, 'bull_adx_thresh': 8.40429872308725, 'bull_atr_min_pct': 0.026260376978482127, 'bull_atr_max_pct': 0.09651287058438948, 'bull_tp_mult': 1.174387248870946, 'bull_tsl_mult': 0.9754429058431602, 'bull_time_stop': 58, 'bull_use_sma': False, 'bull_use_ema': False, 'bull_use_atr': False, 'bull_use_adx': True, 'bull_use_spike': True, 'bull_rsi_required': False, 'bear_strategy': 'mean_reversion', 'bear_bb_std_mult': 3.07229986863122, 'bear_rsi_os': 23, 'bear_rsi_ob': 69, 'bear_adx_thresh': 31.528712307261106, 'bear_atr_min_pct': 0.02424104397581507, 'bear_atr_max_pct': 0.13047862569008567, 'bear_tp_mult': 1.3159938375282245, 'bear_tsl_mult': 0.00370785446908449, 'bear_time_stop': 100, 'bear_use_sma': False, 'bear_use_ema': False, 'bear_use_atr': True, 'bear_use_adx': True, 'bear_use_spike': True, 'bear_rsi_required': True, 'sideways_strategy': 'mean_reversion', 'sideways_bb_std_mult': 2.142990664330309, 'sideways_rsi_os': 43, 'sideways_rsi_ob': 92, 'sideways_adx_thresh': 33.98121008416418, 'sideways_atr_min_pct': 0.02545423488530061, 'sideways_atr_max_pct': 0.03125321202627785, 'sideways_tp_mult': 2.55522237887768, 'sideways_tsl_mult': 0.2073323323594064, 'sideways_time_stop': 68, 'sideways_use_sma': False, 'sideways_use_ema': False, 'sideways_use_atr': False, 'sideways_use_adx': True, 'sideways_use_spike': True, 'sideways_rsi_required': False}.
[I 2025-09-01 08:09:07,608] Trial 304 finished with values: [-0.18589579164979408, 0.18575884814499807] and parameters: {'p_sma': 23, 'p_std': 13, 'p_atr': 10, 'p_adx': 21, 'rsi_period': 67, 'ema1': 11, 'ema2': 13, 'slip_atr_k': 0.06775142399142789, 'slip_spread_k': 0.6050492469352212, 'spread_hl_frac': 0.024652249943643085, 'bb_std_mult': 0.9728660996369185, 'rsi_os': 32, 'rsi_ob': 56, 'vol_spike': 0.04817952708128488, 'adx_thresh': 24.08196538146983, 'atr_min_pct': 0.020343721661475283, 'atr_max_pct': 0.09161082025733909, 'tp_mult': 1.1077037924250068, 'tsl_mult': 0.5341509599076109, 'strategy': 'mean_reversion', 'time_stop': 240, 'use_sma': True, 'use_atr': True, 'use_adx': True, 'use_ema': True, 'use_spike': True, 'rsi_required': True, 'edge_k': 0.11585956967057565, 'edge_cap': 0.33531940056422604, 'bull_strategy': 'breakout', 'bull_bb_std_mult': 2.667252736070533, 'bull_rsi_os': 10, 'bull_rsi_ob': 72, 'bull_adx_thresh': 8.511522023322247, 'bull_atr_min_pct': 0.013630122058947744, 'bull_atr_max_pct': 0.1498059227075552, 'bull_tp_mult': 2.1232136538820323, 'bull_tsl_mult': 0.6517080822162559, 'bull_time_stop': 152, 'bull_use_sma': False, 'bull_use_ema': False, 'bull_use_atr': False, 'bull_use_adx': False, 'bull_use_spike': True, 'bull_rsi_required': False, 'bear_strategy': 'mean_reversion', 'bear_bb_std_mult': 1.4837511220276185, 'bear_rsi_os': 23, 'bear_rsi_ob': 47, 'bear_adx_thresh': 31.587866425395482, 'bear_atr_min_pct': 0.02375216279012807, 'bear_atr_max_pct': 0.029106629924766224, 'bear_tp_mult': 2.106471602508728, 'bear_tsl_mult': 0.3578591302966706, 'bear_time_stop': 83, 'bear_use_sma': False, 'bear_use_ema': False, 'bear_use_atr': True, 'bear_use_adx': False, 'bear_use_spike': True, 'bear_rsi_required': True, 'sideways_strategy': 'mean_reversion', 'sideways_bb_std_mult': 2.964589155241229, 'sideways_rsi_os': 45, 'sideways_rsi_ob': 61, 'sideways_adx_thresh': 11.524050090651395, 'sideways_atr_min_pct': 0.000727264777449976, 'sideways_atr_max_pct': 0.042687355507689984, 'sideways_tp_mult': 2.6353676980465446, 'sideways_tsl_mult': 0.2296742030838831, 'sideways_time_stop': 30, 'sideways_use_sma': False, 'sideways_use_ema': False, 'sideways_use_atr': False, 'sideways_use_adx': True, 'sideways_use_spike': True, 'sideways_rsi_required': False}.
[I 2025-09-01 08:09:07,949] Trial 305 finished with values: [-1000000000.0, 1000000000.0] and parameters: {'p_sma': 30, 'p_std': 28, 'p_atr': 10, 'p_adx': 21, 'rsi_period': 66, 'ema1': 23, 'ema2': 11, 'slip_atr_k': 0.06418405276112049, 'slip_spread_k': 0.6097152646239943, 'spread_hl_frac': 0.006275170802155325, 'bb_std_mult': 3.307831985503902, 'rsi_os': 27, 'rsi_ob': 56, 'vol_spike': 0.11319648547737392, 'adx_thresh': 8.259278247975637, 'atr_min_pct': 0.011486582675565026, 'atr_max_pct': 0.14335986848513543, 'tp_mult': 2.4622134966331886, 'tsl_mult': 0.5253863223679522, 'strategy': 'mean_reversion', 'time_stop': 239, 'use_sma': False, 'use_atr': True, 'use_adx': True, 'use_ema': True, 'use_spike': True, 'rsi_required': True, 'edge_k': 1.8340311008946923, 'edge_cap': 0.09629073385868758, 'bull_strategy': 'mean_reversion', 'bull_bb_std_mult': 2.643996340025212, 'bull_rsi_os': 11, 'bull_rsi_ob': 63, 'bull_adx_thresh': 8.485011138212775, 'bull_atr_min_pct': 0.01629922400300388, 'bull_atr_max_pct': 0.07964182509674388, 'bull_tp_mult': 2.454378890767976, 'bull_tsl_mult': 0.9615549806340781, 'bull_time_stop': 138, 'bull_use_sma': False, 'bull_use_ema': False, 'bull_use_atr': False, 'bull_use_adx': False, 'bull_use_spike': True, 'bull_rsi_required': False, 'bear_strategy': 'mean_reversion', 'bear_bb_std_mult': 3.5426547863181437, 'bear_rsi_os': 46, 'bear_rsi_ob': 69, 'bear_adx_thresh': 31.63772531158507, 'bear_atr_min_pct': 0.023818195212557566, 'bear_atr_max_pct': 0.052968491907501955, 'bear_tp_mult': 1.8242807951465754, 'bear_tsl_mult': 0.0050414616420222935, 'bear_time_stop': 83, 'bear_use_sma': False, 'bear_use_ema': False, 'bear_use_atr': True, 'bear_use_adx': False, 'bear_use_spike': True, 'bear_rsi_required': False, 'sideways_strategy': 'mean_reversion', 'sideways_bb_std_mult': 0.7827372339634677, 'sideways_rsi_os': 19, 'sideways_rsi_ob': 94, 'sideways_adx_thresh': 11.446876171813228, 'sideways_atr_min_pct': 0.001106474184884753, 'sideways_atr_max_pct': 0.0426305345101422, 'sideways_tp_mult': 2.6100922665391337, 'sideways_tsl_mult': 0.8448877197421767, 'sideways_time_stop': 68, 'sideways_use_sma': True, 'sideways_use_ema': False, 'sideways_use_atr': False, 'sideways_use_adx': True, 'sideways_use_spike': True, 'sideways_rsi_required': False}.
[I 2025-09-01 08:09:08,171] Trial 302 finished with values: [-0.021779298860929885, 0.021766822758652136] and parameters: {'p_sma': 45, 'p_std': 38, 'p_atr': 28, 'p_adx': 21, 'rsi_period': 67, 'ema1': 11, 'ema2': 14, 'slip_atr_k': 0.06973362495304235, 'slip_spread_k': 0.6038362210377303, 'spread_hl_frac': 0.0481426311523749, 'bb_std_mult': 0.975234708773246, 'rsi_os': 27, 'rsi_ob': 56, 'vol_spike': 0.07566987609634654, 'adx_thresh': 7.9871704752878365, 'atr_min_pct': 0.022102955284955237, 'atr_max_pct': 0.13581762459373903, 'tp_mult': 1.1236541462774685, 'tsl_mult': 0.4279023965559006, 'strategy': 'mean_reversion', 'time_stop': 238, 'use_sma': True, 'use_atr': True, 'use_adx': True, 'use_ema': True, 'use_spike': True, 'rsi_required': True, 'edge_k': 1.0407797249626938, 'edge_cap': 0.09998180775805815, 'bull_strategy': 'breakout', 'bull_bb_std_mult': 2.596354327879833, 'bull_rsi_os': 28, 'bull_rsi_ob': 79, 'bull_adx_thresh': 33.252962957112345, 'bull_atr_min_pct': 0.026283470005578808, 'bull_atr_max_pct': 0.0982335921079441, 'bull_tp_mult': 2.2719659945209982, 'bull_tsl_mult': 0.6580314526710995, 'bull_time_stop': 149, 'bull_use_sma': False, 'bull_use_ema': False, 'bull_use_atr': False, 'bull_use_adx': True, 'bull_use_spike': True, 'bull_rsi_required': False, 'bear_strategy': 'mean_reversion', 'bear_bb_std_mult': 3.1400471341573586, 'bear_rsi_os': 23, 'bear_rsi_ob': 67, 'bear_adx_thresh': 21.95751468256352, 'bear_atr_min_pct': 0.024629419676698586, 'bear_atr_max_pct': 0.028761646768330935, 'bear_tp_mult': 1.3104027148239688, 'bear_tsl_mult': 0.3725036334478896, 'bear_time_stop': 216, 'bear_use_sma': False, 'bear_use_ema': False, 'bear_use_atr': True, 'bear_use_adx': True, 'bear_use_spike': True, 'bear_rsi_required': True, 'sideways_strategy': 'mean_reversion', 'sideways_bb_std_mult': 3.1443730640341605, 'sideways_rsi_os': 43, 'sideways_rsi_ob': 60, 'sideways_adx_thresh': 33.30834579455028, 'sideways_atr_min_pct': 0.0026432273132054526, 'sideways_atr_max_pct': 0.03519153971991329, 'sideways_tp_mult': 2.610842649779383, 'sideways_tsl_mult': 0.8481760618862226, 'sideways_time_stop': 24, 'sideways_use_sma': False, 'sideways_use_ema': False, 'sideways_use_atr': False, 'sideways_use_adx': True, 'sideways_use_spike': True, 'sideways_rsi_required': False}.
