[I 2025-09-01 07:22:29,319] Trial 15 finished with values: [-0.11573341520461489, 0.11547523540154934] and parameters: {'p_sma': 5, 'p_std': 43, 'p_atr': 23, 'p_adx': 13, 'rsi_period': 7, 'ema1': 28, 'ema2': 43, 'slip_atr_k': 0.24419688269143341, 'slip_spread_k': 0.24002875944389473, 'spread_hl_frac': 0.028819717355907545, 'bb_std_mult': 2.862240178136837, 'rsi_os': 44, 'rsi_ob': 76, 'vol_spike': 0.0016909018898797201, 'adx_thresh': 12.279072245474802, 'atr_min_pct': 0.02917768089001897, 'atr_max_pct': 0.1204751432177783, 'tp_mult': 2.2314583001744817, 'tsl_mult': 0.6480267884237125, 'strategy': 'mean_reversion', 'time_stop': 228, 'use_sma': True, 'use_atr': True, 'use_adx': False, 'use_ema': False, 'use_spike': False, 'rsi_required': False, 'edge_k': 1.914843737935024, 'edge_cap': 0.5019263368383173, 'bull_strategy': 'mean_reversion', 'bull_bb_std_mult': 1.1842373087835973, 'bull_rsi_os': 25, 'bull_rsi_ob': 70, 'bull_adx_thresh': 13.44057021352698, 'bull_atr_min_pct': 0.009298532238233867, 'bull_atr_max_pct': 0.012261796161856423, 'bull_tp_mult': 2.686767999080884, 'bull_tsl_mult': 0.37841339100143145, 'bull_time_stop': 6, 'bull_use_sma': True, 'bull_use_ema': False, 'bull_use_atr': True, 'bull_use_adx': True, 'bull_use_spike': False, 'bull_rsi_required': True, 'bear_strategy': 'breakout', 'bear_bb_std_mult': 2.794582015478117, 'bear_rsi_os': 55, 'bear_rsi_ob': 62, 'bear_adx_thresh': 26.220869532930443, 'bear_atr_min_pct': 0.0016798995483205273, 'bear_atr_max_pct': 0.010209553383881197, 'bear_tp_mult': 2.0146724388627693, 'bear_tsl_mult': 0.05043676932333835, 'bear_time_stop': 107, 'bear_use_sma': False, 'bear_use_ema': False, 'bear_use_atr': True, 'bear_use_adx': True, 'bear_use_spike': False, 'bear_rsi_required': True, 'sideways_strategy': 'breakout', 'sideways_bb_std_mult': 0.5194436099515902, 'sideways_rsi_os': 55, 'sideways_rsi_ob': 63, 'sideways_adx_thresh': 15.10753523971242, 'sideways_atr_min_pct': 0.007333549770336206, 'sideways_atr_max_pct': 0.1444046612134518, 'sideways_tp_mult': 2.238468907741412, 'sideways_tsl_mult': 0.6132433854462276, 'sideways_time_stop': 33, 'sideways_use_sma': True, 'sideways_use_ema': True, 'sideways_use_atr': True, 'sideways_use_adx': False, 'sideways_use_spike': True, 'sideways_rsi_required': True}.
[I 2025-09-01 07:22:29,473] Trial 20 finished with values: [-1000000000.0, 1000000000.0] and parameters: {'p_sma': 25, 'p_std': 37, 'p_atr': 27, 'p_adx': 15, 'rsi_period': 33, 'ema1': 18, 'ema2': 50, 'slip_atr_k': 0.13144274434649642, 'slip_spread_k': 0.2944484761266416, 'spread_hl_frac': 0.031042840205697995, 'bb_std_mult': 3.0508990059899928, 'rsi_os': 55, 'rsi_ob': 76, 'vol_spike': 0.17608516135984048, 'adx_thresh': 19.633034961693987, 'atr_min_pct': 0.019260573962327658, 'atr_max_pct': 0.1176342967131709, 'tp_mult': 2.947469708565069, 'tsl_mult': 0.003321483116614121, 'strategy': 'mean_reversion', 'time_stop': 238, 'use_sma': True, 'use_atr': True, 'use_adx': False, 'use_ema': False, 'use_spike': False, 'rsi_required': False, 'edge_k': 1.8088771832760306, 'edge_cap': 0.7165921722519495, 'bull_strategy': 'breakout', 'bull_bb_std_mult': 1.036912677615811, 'bull_rsi_os': 46, 'bull_rsi_ob': 60, 'bull_adx_thresh': 18.915287087355164, 'bull_atr_min_pct': 0.012587503637600764, 'bull_atr_max_pct': 0.0746342252161714, 'bull_tp_mult': 1.674612966192957, 'bull_tsl_mult': 0.21012622436678108, 'bull_time_stop': 200, 'bull_use_sma': True, 'bull_use_ema': False, 'bull_use_atr': True, 'bull_use_adx': True, 'bull_use_spike': False, 'bull_rsi_required': True, 'bear_strategy': 'breakout', 'bear_bb_std_mult': 2.1051398302019835, 'bear_rsi_os': 46, 'bear_rsi_ob': 81, 'bear_adx_thresh': 26.167875906748918, 'bear_atr_min_pct': 0.029112113020292416, 'bear_atr_max_pct': 0.06874610021858336, 'bear_tp_mult': 1.7707812032271197, 'bear_tsl_mult': 0.7129108390699671, 'bear_time_stop': 195, 'bear_use_sma': False, 'bear_use_ema': False, 'bear_use_atr': True, 'bear_use_adx': True, 'bear_use_spike': False, 'bear_rsi_required': True, 'sideways_strategy': 'breakout', 'sideways_bb_std_mult': 0.5034035325155739, 'sideways_rsi_os': 39, 'sideways_rsi_ob': 83, 'sideways_adx_thresh': 10.194312371075156, 'sideways_atr_min_pct': 0.01786727153133006, 'sideways_atr_max_pct': 0.12843994659569502, 'sideways_tp_mult': 1.358356149815592, 'sideways_tsl_mult': 0.7958417786655312, 'sideways_time_stop': 66, 'sideways_use_sma': False, 'sideways_use_ema': True, 'sideways_use_atr': True, 'sideways_use_adx': True, 'sideways_use_spike': True, 'sideways_rsi_required': False}.
[I 2025-09-01 07:22:29,538] Trial 22 finished with values: [-1000000000.0, 1000000000.0] and parameters: {'p_sma': 26, 'p_std': 54, 'p_atr': 27, 'p_adx': 7, 'rsi_period': 22, 'ema1': 18, 'ema2': 52, 'slip_atr_k': 0.12457620403668201, 'slip_spread_k': 0.31430771078846664, 'spread_hl_frac': 0.033578363066739655, 'bb_std_mult': 1.445620824362401, 'rsi_os': 55, 'rsi_ob': 86, 'vol_spike': 0.17754127636444353, 'adx_thresh': 17.396343067784684, 'atr_min_pct': 0.025190731989992672, 'atr_max_pct': 0.06280230502799897, 'tp_mult': 2.916620434953108, 'tsl_mult': 0.7882489775248237, 'strategy': 'mean_reversion', 'time_stop': 86, 'use_sma': True, 'use_atr': False, 'use_adx': False, 'use_ema': False, 'use_spike': False, 'rsi_required': False, 'edge_k': 1.5696518820078673, 'edge_cap': 0.7233701628471976, 'bull_strategy': 'breakout', 'bull_bb_std_mult': 0.9152921184738264, 'bull_rsi_os': 45, 'bull_rsi_ob': 61, 'bull_adx_thresh': 18.658897926934827, 'bull_atr_min_pct': 0.013144038874276412, 'bull_atr_max_pct': 0.08059061849459391, 'bull_tp_mult': 1.6048601603292059, 'bull_tsl_mult': 0.19621707090889673, 'bull_time_stop': 120, 'bull_use_sma': True, 'bull_use_ema': False, 'bull_use_atr': True, 'bull_use_adx': False, 'bull_use_spike': False, 'bull_rsi_required': False, 'bear_strategy': 'breakout', 'bear_bb_std_mult': 2.1272492153067883, 'bear_rsi_os': 46, 'bear_rsi_ob': 67, 'bear_adx_thresh': 21.794053599846748, 'bear_atr_min_pct': 0.029126044855748552, 'bear_atr_max_pct': 0.0679663182983288, 'bear_tp_mult': 1.7297620977374808, 'bear_tsl_mult': 0.7248206922157738, 'bear_time_stop': 198, 'bear_use_sma': False, 'bear_use_ema': False, 'bear_use_atr': False, 'bear_use_adx': True, 'bear_use_spike': True, 'bear_rsi_required': True, 'sideways_strategy': 'breakout', 'sideways_bb_std_mult': 2.4760019360075693, 'sideways_rsi_os': 14, 'sideways_rsi_ob': 80, 'sideways_adx_thresh': 9.912231305555697, 'sideways_atr_min_pct': 0.017948655053032777, 'sideways_atr_max_pct': 0.1236681891713973, 'sideways_tp_mult': 1.3683477614723096, 'sideways_tsl_mult': 0.8242768622332417, 'sideways_time_stop': 202, 'sideways_use_sma': False, 'sideways_use_ema': False, 'sideways_use_atr': True, 'sideways_use_adx': True, 'sideways_use_spike': True, 'sideways_rsi_required': False}.
[I 2025-09-01 07:23:02,379] Trial 19 finished with values: [-1000000000.0, 1000000000.0] and parameters: {'p_sma': 52, 'p_std': 40, 'p_atr': 27, 'p_adx': 14, 'rsi_period': 34, 'ema1': 24, 'ema2': 48, 'slip_atr_k': 0.12166806160499924, 'slip_spread_k': 0.2522663105338691, 'spread_hl_frac': 0.031324700889636785, 'bb_std_mult': 1.3081876006246056, 'rsi_os': 45, 'rsi_ob': 78, 'vol_spike': 0.021788606504023283, 'adx_thresh': 16.347293533396744, 'atr_min_pct': 0.0184684691642751, 'atr_max_pct': 0.0551149363892779, 'tp_mult': 2.972785376355004, 'tsl_mult': 0.41750992653799, 'strategy': 'mean_reversion', 'time_stop': 251, 'use_sma': True, 'use_atr': True, 'use_adx': False, 'use_ema': False, 'use_spike': False, 'rsi_required': False, 'edge_k': 1.7624405328846042, 'edge_cap': 0.24002881702593598, 'bull_strategy': 'breakout', 'bull_bb_std_mult': 1.0904659897492854, 'bull_rsi_os': 30, 'bull_rsi_ob': 62, 'bull_adx_thresh': 20.526528494124967, 'bull_atr_min_pct': 0.011917591173116401, 'bull_atr_max_pct': 0.08010019342723948, 'bull_tp_mult': 1.6380452375375087, 'bull_tsl_mult': 0.20774082546968298, 'bull_time_stop': 51, 'bull_use_sma': True, 'bull_use_ema': False, 'bull_use_atr': True, 'bull_use_adx': True, 'bull_use_spike': False, 'bull_rsi_required': True, 'bear_strategy': 'breakout', 'bear_bb_std_mult': 2.0452919701972005, 'bear_rsi_os': 46, 'bear_rsi_ob': 82, 'bear_adx_thresh': 34.69937276767318, 'bear_atr_min_pct': 0.006191958200779859, 'bear_atr_max_pct': 0.06432924372033191, 'bear_tp_mult': 1.0348670114316971, 'bear_tsl_mult': 0.6388991384254442, 'bear_time_stop': 197, 'bear_use_sma': False, 'bear_use_ema': False, 'bear_use_atr': True, 'bear_use_adx': True, 'bear_use_spike': False, 'bear_rsi_required': True, 'sideways_strategy': 'breakout', 'sideways_bb_std_mult': 0.519492135394775, 'sideways_rsi_os': 47, 'sideways_rsi_ob': 83, 'sideways_adx_thresh': 5.931826777063705, 'sideways_atr_min_pct': 0.017372888182700302, 'sideways_atr_max_pct': 0.14771049901191063, 'sideways_tp_mult': 1.381048584275999, 'sideways_tsl_mult': 0.8187186354852838, 'sideways_time_stop': 74, 'sideways_use_sma': False, 'sideways_use_ema': True, 'sideways_use_atr': True, 'sideways_use_adx': True, 'sideways_use_spike': True, 'sideways_rsi_required': True}.
[I 2025-09-01 07:23:08,657] Trial 21 finished with values: [-1000000000.0, 1000000000.0] and parameters: {'p_sma': 25, 'p_std': 51, 'p_atr': 27, 'p_adx': 15, 'rsi_period': 22, 'ema1': 18, 'ema2': 49, 'slip_atr_k': 0.12554100162938045, 'slip_spread_k': 0.32537708982827085, 'spread_hl_frac': 0.03246285985877543, 'bb_std_mult': 1.1853968844524498, 'rsi_os': 48, 'rsi_ob': 87, 'vol_spike': 0.182120223332721, 'adx_thresh': 18.845333738161116, 'atr_min_pct': 0.02598791881818617, 'atr_max_pct': 0.11383236114709475, 'tp_mult': 2.507287610683122, 'tsl_mult': 0.3763653905450516, 'strategy': 'mean_reversion', 'time_stop': 84, 'use_sma': True, 'use_atr': False, 'use_adx': False, 'use_ema': False, 'use_spike': False, 'rsi_required': False, 'edge_k': 1.5947224105420705, 'edge_cap': 0.7383066091021163, 'bull_strategy': 'breakout', 'bull_bb_std_mult': 0.9302634319413902, 'bull_rsi_os': 45, 'bull_rsi_ob': 60, 'bull_adx_thresh': 18.19623380129885, 'bull_atr_min_pct': 0.013054681154146378, 'bull_atr_max_pct': 0.07967963127793484, 'bull_tp_mult': 1.764273287495853, 'bull_tsl_mult': 0.2124949912642466, 'bull_time_stop': 123, 'bull_use_sma': True, 'bull_use_ema': False, 'bull_use_atr': True, 'bull_use_adx': False, 'bull_use_spike': False, 'bull_rsi_required': False, 'bear_strategy': 'breakout', 'bear_bb_std_mult': 2.1299007355649078, 'bear_rsi_os': 47, 'bear_rsi_ob': 69, 'bear_adx_thresh': 27.77962834652983, 'bear_atr_min_pct': 0.009784601521554897, 'bear_atr_max_pct': 0.05407523655892671, 'bear_tp_mult': 1.7489776713173715, 'bear_tsl_mult': 0.6699210936983555, 'bear_time_stop': 201, 'bear_use_sma': False, 'bear_use_ema': False, 'bear_use_atr': False, 'bear_use_adx': True, 'bear_use_spike': True, 'bear_rsi_required': True, 'sideways_strategy': 'breakout', 'sideways_bb_std_mult': 0.5478223748686774, 'sideways_rsi_os': 37, 'sideways_rsi_ob': 81, 'sideways_adx_thresh': 9.38524777396001, 'sideways_atr_min_pct': 0.01815758515710341, 'sideways_atr_max_pct': 0.12219286563404057, 'sideways_tp_mult': 1.3151924504758712, 'sideways_tsl_mult': 0.8113672532799888, 'sideways_time_stop': 50, 'sideways_use_sma': False, 'sideways_use_ema': False, 'sideways_use_atr': True, 'sideways_use_adx': True, 'sideways_use_spike': True, 'sideways_rsi_required': False}.
[I 2025-09-01 07:23:11,136] Trial 23 finished with values: [-1000000000.0, 1000000000.0] and parameters: {'p_sma': 39, 'p_std': 53, 'p_atr': 16, 'p_adx': 7, 'rsi_period': 83, 'ema1': 18, 'ema2': 48, 'slip_atr_k': 0.1177894021827134, 'slip_spread_k': 0.6255695349202094, 'spread_hl_frac': 0.022288099881413087, 'bb_std_mult': 1.4191716788973356, 'rsi_os': 49, 'rsi_ob': 86, 'vol_spike': 0.23845317006829858, 'adx_thresh': 20.48495956649944, 'atr_min_pct': 0.0053281634290696205, 'atr_max_pct': 0.06348716584283733, 'tp_mult': 2.0632966531655668, 'tsl_mult': 0.3785847180880221, 'strategy': 'mean_reversion', 'time_stop': 85, 'use_sma': True, 'use_atr': False, 'use_adx': False, 'use_ema': False, 'use_spike': False, 'rsi_required': False, 'edge_k': 1.6744707942726282, 'edge_cap': 0.2243350760552385, 'bull_strategy': 'breakout', 'bull_bb_std_mult': 2.0019857480698775, 'bull_rsi_os': 33, 'bull_rsi_ob': 89, 'bull_adx_thresh': 24.286838433170622, 'bull_atr_min_pct': 0.019245042873256603, 'bull_atr_max_pct': 0.08895216277290906, 'bull_tp_mult': 1.6200322456915395, 'bull_tsl_mult': 0.977760224001119, 'bull_time_stop': 123, 'bull_use_sma': True, 'bull_use_ema': False, 'bull_use_atr': True, 'bull_use_adx': False, 'bull_use_spike': False, 'bull_rsi_required': False, 'bear_strategy': 'breakout', 'bear_bb_std_mult': 3.5599328918406616, 'bear_rsi_os': 46, 'bear_rsi_ob': 69, 'bear_adx_thresh': 34.37795870617988, 'bear_atr_min_pct': 0.009482434985106918, 'bear_atr_max_pct': 0.05271789533373712, 'bear_tp_mult': 1.0285711234857327, 'bear_tsl_mult': 0.6729882315234172, 'bear_time_stop': 256, 'bear_use_sma': False, 'bear_use_ema': False, 'bear_use_atr': False, 'bear_use_adx': True, 'bear_use_spike': True, 'bear_rsi_required': True, 'sideways_strategy': 'breakout', 'sideways_bb_std_mult': 2.4136515068127773, 'sideways_rsi_os': 12, 'sideways_rsi_ob': 49, 'sideways_adx_thresh': 32.80017955845231, 'sideways_atr_min_pct': 0.026582279203303947, 'sideways_atr_max_pct': 0.11960359329351805, 'sideways_tp_mult': 1.3198710190462464, 'sideways_tsl_mult': 0.8615091710587035, 'sideways_time_stop': 213, 'sideways_use_sma': False, 'sideways_use_ema': False, 'sideways_use_atr': True, 'sideways_use_adx': True, 'sideways_use_spike': True, 'sideways_rsi_required': False}.
[I 2025-09-01 07:23:13,036] Trial 24 finished with values: [-1000000000.0, 1000000000.0] and parameters: {'p_sma': 38, 'p_std': 51, 'p_atr': 24, 'p_adx': 10, 'rsi_period': 39, 'ema1': 30, 'ema2': 47, 'slip_atr_k': 0.05533567771647836, 'slip_spread_k': 0.003901317815443048, 'spread_hl_frac': 0.020913405653952128, 'bb_std_mult': 3.557290488173725, 'rsi_os': 48, 'rsi_ob': 73, 'vol_spike': 0.2220748788976472, 'adx_thresh': 9.372401285078507, 'atr_min_pct': 0.014716998435674788, 'atr_max_pct': 0.11037269717572015, 'tp_mult': 2.053362430786205, 'tsl_mult': 0.38665515877147894, 'strategy': 'mean_reversion', 'time_stop': 62, 'use_sma': True, 'use_atr': True, 'use_adx': False, 'use_ema': False, 'use_spike': False, 'rsi_required': False, 'edge_k': 0.5916551389533444, 'edge_cap': 0.24567027778566392, 'bull_strategy': 'breakout', 'bull_bb_std_mult': 1.4963260097562983, 'bull_rsi_os': 33, 'bull_rsi_ob': 90, 'bull_adx_thresh': 24.21668936699556, 'bull_atr_min_pct': 0.0061049377905899255, 'bull_atr_max_pct': 0.13729489053172106, 'bull_tp_mult': 1.7964348551100167, 'bull_tsl_mult': 0.3048008476552142, 'bull_time_stop': 129, 'bull_use_sma': True, 'bull_use_ema': False, 'bull_use_atr': True, 'bull_use_adx': True, 'bull_use_spike': False, 'bull_rsi_required': True, 'bear_strategy': 'breakout', 'bear_bb_std_mult': 3.4829418883565775, 'bear_rsi_os': 48, 'bear_rsi_ob': 77, 'bear_adx_thresh': 27.53592281030199, 'bear_atr_min_pct': 0.009945821346234479, 'bear_atr_max_pct': 0.055671076836174394, 'bear_tp_mult': 1.07814482986552, 'bear_tsl_mult': 0.9750443575348818, 'bear_time_stop': 257, 'bear_use_sma': False, 'bear_use_ema': False, 'bear_use_atr': True, 'bear_use_adx': True, 'bear_use_spike': False, 'bear_rsi_required': True, 'sideways_strategy': 'breakout', 'sideways_bb_std_mult': 2.144487809756755, 'sideways_rsi_os': 32, 'sideways_rsi_ob': 50, 'sideways_adx_thresh': 32.91912906409037, 'sideways_atr_min_pct': 0.020771703089802432, 'sideways_atr_max_pct': 0.08663537082825659, 'sideways_tp_mult': 1.210449445080755, 'sideways_tsl_mult': 0.6609674553702849, 'sideways_time_stop': 93, 'sideways_use_sma': False, 'sideways_use_ema': True, 'sideways_use_atr': True, 'sideways_use_adx': True, 'sideways_use_spike': True, 'sideways_rsi_required': False}.
[I 2025-09-01 07:23:50,414] Trial 25 finished with values: [-1000000000.0, 1000000000.0] and parameters: {'p_sma': 38, 'p_std': 51, 'p_atr': 16, 'p_adx': 9, 'rsi_period': 14, 'ema1': 30, 'ema2': 46, 'slip_atr_k': 0.04091170747788164, 'slip_spread_k': 0.10880549271057023, 'spread_hl_frac': 0.024654036462674316, 'bb_std_mult': 3.5997111847659333, 'rsi_os': 48, 'rsi_ob': 72, 'vol_spike': 0.23358329279699447, 'adx_thresh': 9.724093934204095, 'atr_min_pct': 0.0054570763654587, 'atr_max_pct': 0.10769898166702464, 'tp_mult': 2.0837998822157338, 'tsl_mult': 0.1859493571060289, 'strategy': 'mean_reversion', 'time_stop': 103, 'use_sma': True, 'use_atr': True, 'use_adx': False, 'use_ema': False, 'use_spike': False, 'rsi_required': False, 'edge_k': 0.5832196851099034, 'edge_cap': 0.5312021664427865, 'bull_strategy': 'breakout', 'bull_bb_std_mult': 0.5384623724137243, 'bull_rsi_os': 33, 'bull_rsi_ob': 88, 'bull_adx_thresh': 23.932437610276512, 'bull_atr_min_pct': 0.006024557474605931, 'bull_atr_max_pct': 0.13415840766948092, 'bull_tp_mult': 2.316575539712289, 'bull_tsl_mult': 0.33464522945297337, 'bull_time_stop': 130, 'bull_use_sma': True, 'bull_use_ema': False, 'bull_use_atr': True, 'bull_use_adx': True, 'bull_use_spike': False, 'bull_rsi_required': True, 'bear_strategy': 'breakout', 'bear_bb_std_mult': 3.5420104700723947, 'bear_rsi_os': 32, 'bear_rsi_ob': 77, 'bear_adx_thresh': 27.401968121946297, 'bear_atr_min_pct': 0.01074450892987594, 'bear_atr_max_pct': 0.10212304668118577, 'bear_tp_mult': 2.6600779908760837, 'bear_tsl_mult': 0.9428053070593729, 'bear_time_stop': 263, 'bear_use_sma': False, 'bear_use_ema': False, 'bear_use_atr': True, 'bear_use_adx': True, 'bear_use_spike': False, 'bear_rsi_required': True, 'sideways_strategy': 'breakout', 'sideways_bb_std_mult': 2.321603794861712, 'sideways_rsi_os': 31, 'sideways_rsi_ob': 70, 'sideways_adx_thresh': 23.9951354436204, 'sideways_atr_min_pct': 0.025261545030482013, 'sideways_atr_max_pct': 0.09586133172504728, 'sideways_tp_mult': 1.201853813466584, 'sideways_tsl_mult': 0.7035665588995057, 'sideways_time_stop': 101, 'sideways_use_sma': False, 'sideways_use_ema': True, 'sideways_use_atr': True, 'sideways_use_adx': True, 'sideways_use_spike': True, 'sideways_rsi_required': False}.
[I 2025-09-01 07:23:54,484] Trial 26 finished with values: [-1000000000.0, 1000000000.0] and parameters: {'p_sma': 38, 'p_std': 38, 'p_atr': 18, 'p_adx': 10, 'rsi_period': 84, 'ema1': 30, 'ema2': 46, 'slip_atr_k': 0.04829489764761377, 'slip_spread_k': 0.09739233508748774, 'spread_hl_frac': 0.02243302675748469, 'bb_std_mult': 3.5493472634653496, 'rsi_os': 36, 'rsi_ob': 72, 'vol_spike': 0.21960106023696846, 'adx_thresh': 8.490986476011749, 'atr_min_pct': 0.005276735664951191, 'atr_max_pct': 0.0991311553360488, 'tp_mult': 2.0759504529666994, 'tsl_mult': 0.5348590005603663, 'strategy': 'breakout', 'time_stop': 47, 'use_sma': False, 'use_atr': True, 'use_adx': True, 'use_ema': False, 'use_spike': True, 'rsi_required': True, 'edge_k': 0.6752350467469311, 'edge_cap': 0.5222492684408082, 'bull_strategy': 'mean_reversion', 'bull_bb_std_mult': 1.5020941293885268, 'bull_rsi_os': 33, 'bull_rsi_ob': 90, 'bull_adx_thresh': 23.791907267091776, 'bull_atr_min_pct': 0.006156066502067172, 'bull_atr_max_pct': 0.1343940571626868, 'bull_tp_mult': 2.761795091757937, 'bull_tsl_mult': 0.33374927329994486, 'bull_time_stop': 261, 'bull_use_sma': False, 'bull_use_ema': False, 'bull_use_atr': True, 'bull_use_adx': True, 'bull_use_spike': False, 'bull_rsi_required': True, 'bear_strategy': 'mean_reversion', 'bear_bb_std_mult': 3.5375133131174854, 'bear_rsi_os': 55, 'bear_rsi_ob': 77, 'bear_adx_thresh': 23.742385970668895, 'bear_atr_min_pct': 0.0035688122714673948, 'bear_atr_max_pct': 0.09704168787751902, 'bear_tp_mult': 2.5410918811360643, 'bear_tsl_mult': 0.138013856962159, 'bear_time_stop': 259, 'bear_use_sma': False, 'bear_use_ema': True, 'bear_use_atr': True, 'bear_use_adx': True, 'bear_use_spike': False, 'bear_rsi_required': False, 'sideways_strategy': 'breakout', 'sideways_bb_std_mult': 2.304008518249032, 'sideways_rsi_os': 31, 'sideways_rsi_ob': 71, 'sideways_adx_thresh': 24.27391494691969, 'sideways_atr_min_pct': 0.021435014551955296, 'sideways_atr_max_pct': 0.08947429233585166, 'sideways_tp_mult': 1.5595396824331385, 'sideways_tsl_mult': 0.6642960074080668, 'sideways_time_stop': 300, 'sideways_use_sma': False, 'sideways_use_ema': True, 'sideways_use_atr': True, 'sideways_use_adx': False, 'sideways_use_spike': False, 'sideways_rsi_required': False}.
