[I 2025-09-01 07:30:17,222] Trial 64 finished with values: [-1000000000.0, 1000000000.0] and parameters: {'p_sma': 33, 'p_std': 30, 'p_atr': 26, 'p_adx': 9, 'rsi_period': 59, 'ema1': 27, 'ema2': 10, 'slip_atr_k': 0.09217871938601761, 'slip_spread_k': 0.9197489264737947, 'spread_hl_frac': 0.047086342522179296, 'bb_std_mult': 1.5409884078034635, 'rsi_os': 33, 'rsi_ob': 94, 'vol_spike': 0.26853181409580285, 'adx_thresh': 27.65999669201055, 'atr_min_pct': 0.0235401598069392, 'atr_max_pct': 0.14428453080704404, 'tp_mult': 2.554082482973909, 'tsl_mult': 0.5861692403161413, 'strategy': 'mean_reversion', 'time_stop': 193, 'use_sma': True, 'use_atr': True, 'use_adx': True, 'use_ema': True, 'use_spike': False, 'rsi_required': True, 'edge_k': 1.2723473798108351, 'edge_cap': 0.776267321183193, 'bull_strategy': 'breakout', 'bull_bb_std_mult': 1.3010782509145746, 'bull_rsi_os': 15, 'bull_rsi_ob': 47, 'bull_adx_thresh': 11.050985839146925, 'bull_atr_min_pct': 0.004280457448525874, 'bull_atr_max_pct': 0.03211449948924401, 'bull_tp_mult': 1.8202157911976744, 'bull_tsl_mult': 0.46309863926828193, 'bull_time_stop': 76, 'bull_use_sma': True, 'bull_use_ema': False, 'bull_use_atr': False, 'bull_use_adx': False, 'bull_use_spike': True, 'bull_rsi_required': True, 'bear_strategy': 'breakout', 'bear_bb_std_mult': 3.0464631869454006, 'bear_rsi_os': 50, 'bear_rsi_ob': 53, 'bear_adx_thresh': 17.740530641604135, 'bear_atr_min_pct': 0.01894578864431351, 'bear_atr_max_pct': 0.14950660174729796, 'bear_tp_mult': 2.8167354838606737, 'bear_tsl_mult': 0.5801520947707753, 'bear_time_stop': 32, 'bear_use_sma': False, 'bear_use_ema': False, 'bear_use_atr': True, 'bear_use_adx': False, 'bear_use_spike': False, 'bear_rsi_required': True, 'sideways_strategy': 'breakout', 'sideways_bb_std_mult': 1.714600506630958, 'sideways_rsi_os': 18, 'sideways_rsi_ob': 68, 'sideways_adx_thresh': 8.20442803751576, 'sideways_atr_min_pct': 0.0033082821132075415, 'sideways_atr_max_pct': 0.035659691954446515, 'sideways_tp_mult': 2.5883678176341847, 'sideways_tsl_mult': 0.43380915434919237, 'sideways_time_stop': 224, 'sideways_use_sma': True, 'sideways_use_ema': False, 'sideways_use_atr': True, 'sideways_use_adx': True, 'sideways_use_spike': True, 'sideways_rsi_required': False}.
[I 2025-09-01 07:30:18,077] Trial 65 finished with values: [-1000000000.0, 1000000000.0] and parameters: {'p_sma': 53, 'p_std': 30, 'p_atr': 26, 'p_adx': 9, 'rsi_period': 53, 'ema1': 27, 'ema2': 52, 'slip_atr_k': 0.0917029238538712, 'slip_spread_k': 0.8720556440931475, 'spread_hl_frac': 0.04373906682869702, 'bb_std_mult': 1.529112621543952, 'rsi_os': 13, 'rsi_ob': 61, 'vol_spike': 0.2724335000293226, 'adx_thresh': 27.219637088319423, 'atr_min_pct': 0.01637249631989787, 'atr_max_pct': 0.14207817623627264, 'tp_mult': 2.5669250874998437, 'tsl_mult': 0.0004527203608821335, 'strategy': 'mean_reversion', 'time_stop': 193, 'use_sma': True, 'use_atr': True, 'use_adx': True, 'use_ema': True, 'use_spike': False, 'rsi_required': True, 'edge_k': 1.3043237533488625, 'edge_cap': 0.878782774941262, 'bull_strategy': 'breakout', 'bull_bb_std_mult': 1.252398224234285, 'bull_rsi_os': 15, 'bull_rsi_ob': 47, 'bull_adx_thresh': 5.751663005389865, 'bull_atr_min_pct': 0.020922409367830595, 'bull_atr_max_pct': 0.0844676375203587, 'bull_tp_mult': 1.0148985929332492, 'bull_tsl_mult': 0.6180840245823276, 'bull_time_stop': 83, 'bull_use_sma': True, 'bull_use_ema': False, 'bull_use_atr': False, 'bull_use_adx': False, 'bull_use_spike': True, 'bull_rsi_required': True, 'bear_strategy': 'breakout', 'bear_bb_std_mult': 1.0600016195971493, 'bear_rsi_os': 21, 'bear_rsi_ob': 54, 'bear_adx_thresh': 17.621595083808092, 'bear_atr_min_pct': 0.018137528499295535, 'bear_atr_max_pct': 0.11190911935240624, 'bear_tp_mult': 2.3497081065629946, 'bear_tsl_mult': 0.5616294017018277, 'bear_time_stop': 93, 'bear_use_sma': False, 'bear_use_ema': False, 'bear_use_atr': True, 'bear_use_adx': False, 'bear_use_spike': False, 'bear_rsi_required': True, 'sideways_strategy': 'breakout', 'sideways_bb_std_mult': 2.0603801755253683, 'sideways_rsi_os': 18, 'sideways_rsi_ob': 73, 'sideways_adx_thresh': 20.472398535668155, 'sideways_atr_min_pct': 0.003604584669563598, 'sideways_atr_max_pct': 0.13611035518387907, 'sideways_tp_mult': 1.7123514298318843, 'sideways_tsl_mult': 0.8516755616057353, 'sideways_time_stop': 225, 'sideways_use_sma': True, 'sideways_use_ema': False, 'sideways_use_atr': True, 'sideways_use_adx': True, 'sideways_use_spike': True, 'sideways_rsi_required': False}.
[I 2025-09-01 07:30:18,077] Trial 63 finished with values: [-1000000000.0, 1000000000.0] and parameters: {'p_sma': 21, 'p_std': 30, 'p_atr': 9, 'p_adx': 20, 'rsi_period': 54, 'ema1': 27, 'ema2': 10, 'slip_atr_k': 0.0008626245055648532, 'slip_spread_k': 0.5635272797621654, 'spread_hl_frac': 0.044139808887035094, 'bb_std_mult': 1.235213032817758, 'rsi_os': 13, 'rsi_ob': 94, 'vol_spike': 0.21076144107361908, 'adx_thresh': 33.4728962961247, 'atr_min_pct': 5.540701259876442e-05, 'atr_max_pct': 0.14906801880630843, 'tp_mult': 1.1333526757776036, 'tsl_mult': 0.8429963934155738, 'strategy': 'mean_reversion', 'time_stop': 242, 'use_sma': True, 'use_atr': True, 'use_adx': True, 'use_ema': True, 'use_spike': False, 'rsi_required': True, 'edge_k': 0.8968933901644508, 'edge_cap': 0.15249125410059206, 'bull_strategy': 'breakout', 'bull_bb_std_mult': 1.8223278665723568, 'bull_rsi_os': 16, 'bull_rsi_ob': 67, 'bull_adx_thresh': 11.432985498353375, 'bull_atr_min_pct': 0.02597357363957537, 'bull_atr_max_pct': 0.09741164176355038, 'bull_tp_mult': 1.8024228661872335, 'bull_tsl_mult': 0.6143445563755083, 'bull_time_stop': 171, 'bull_use_sma': True, 'bull_use_ema': False, 'bull_use_atr': False, 'bull_use_adx': False, 'bull_use_spike': True, 'bull_rsi_required': False, 'bear_strategy': 'breakout', 'bear_bb_std_mult': 2.898717560391609, 'bear_rsi_os': 50, 'bear_rsi_ob': 53, 'bear_adx_thresh': 14.250197859995593, 'bear_atr_min_pct': 0.019012406874833635, 'bear_atr_max_pct': 0.12381754236267647, 'bear_tp_mult': 2.8152413213130765, 'bear_tsl_mult': 0.6338146114313762, 'bear_time_stop': 94, 'bear_use_sma': True, 'bear_use_ema': False, 'bear_use_atr': True, 'bear_use_adx': False, 'bear_use_spike': False, 'bear_rsi_required': True, 'sideways_strategy': 'mean_reversion', 'sideways_bb_std_mult': 1.2423591813809998, 'sideways_rsi_os': 18, 'sideways_rsi_ob': 61, 'sideways_adx_thresh': 8.727233433573357, 'sideways_atr_min_pct': 0.027921827985651692, 'sideways_atr_max_pct': 0.027733085414756314, 'sideways_tp_mult': 2.1587568380875526, 'sideways_tsl_mult': 0.552919590107971, 'sideways_time_stop': 5, 'sideways_use_sma': True, 'sideways_use_ema': False, 'sideways_use_atr': False, 'sideways_use_adx': True, 'sideways_use_spike': True, 'sideways_rsi_required': False}.
[I 2025-09-01 07:30:42,393] Trial 66 finished with values: [-0.1479155369457047, 0.1478753921789573] and parameters: {'p_sma': 53, 'p_std': 35, 'p_atr': 26, 'p_adx': 9, 'rsi_period': 53, 'ema1': 28, 'ema2': 53, 'slip_atr_k': 0.22313214941595333, 'slip_spread_k': 0.8638996769902503, 'spread_hl_frac': 0.0476985162287071, 'bb_std_mult': 1.160130830212084, 'rsi_os': 32, 'rsi_ob': 90, 'vol_spike': 0.2696369954838625, 'adx_thresh': 33.26012140473652, 'atr_min_pct': 0.028020084272411212, 'atr_max_pct': 0.1428327439554533, 'tp_mult': 2.822281853476166, 'tsl_mult': 0.0005906516393138217, 'strategy': 'mean_reversion', 'time_stop': 28, 'use_sma': True, 'use_atr': True, 'use_adx': True, 'use_ema': True, 'use_spike': False, 'rsi_required': True, 'edge_k': 0.9127988640857952, 'edge_cap': 0.9975155494720032, 'bull_strategy': 'breakout', 'bull_bb_std_mult': 1.371791623039186, 'bull_rsi_os': 16, 'bull_rsi_ob': 92, 'bull_adx_thresh': 10.995475186927777, 'bull_atr_min_pct': 0.0014616907512555906, 'bull_atr_max_pct': 0.03419543520946817, 'bull_tp_mult': 2.0144555435548113, 'bull_tsl_mult': 0.6042642315912021, 'bull_time_stop': 189, 'bull_use_sma': True, 'bull_use_ema': False, 'bull_use_atr': False, 'bull_use_adx': False, 'bull_use_spike': True, 'bull_rsi_required': True, 'bear_strategy': 'breakout', 'bear_bb_std_mult': 2.9362249823965536, 'bear_rsi_os': 22, 'bear_rsi_ob': 53, 'bear_adx_thresh': 17.919098706263238, 'bear_atr_min_pct': 0.014511214832324834, 'bear_atr_max_pct': 0.05729997371779226, 'bear_tp_mult': 2.8160999684112245, 'bear_tsl_mult': 0.5504034316801728, 'bear_time_stop': 95, 'bear_use_sma': False, 'bear_use_ema': False, 'bear_use_atr': True, 'bear_use_adx': False, 'bear_use_spike': False, 'bear_rsi_required': True, 'sideways_strategy': 'breakout', 'sideways_bb_std_mult': 1.2431320426451729, 'sideways_rsi_os': 42, 'sideways_rsi_ob': 55, 'sideways_adx_thresh': 20.994653561221693, 'sideways_atr_min_pct': 0.004303488011453095, 'sideways_atr_max_pct': 0.13894636550899656, 'sideways_tp_mult': 1.6669283429712431, 'sideways_tsl_mult': 0.8503835648445631, 'sideways_time_stop': 224, 'sideways_use_sma': True, 'sideways_use_ema': False, 'sideways_use_atr': True, 'sideways_use_adx': True, 'sideways_use_spike': True, 'sideways_rsi_required': False}.
[I 2025-09-01 07:31:07,321] Trial 69 finished with values: [-0.08028901000377298, 0.08058106408759169] and parameters: {'p_sma': 50, 'p_std': 35, 'p_atr': 24, 'p_adx': 7, 'rsi_period': 36, 'ema1': 25, 'ema2': 17, 'slip_atr_k': 0.061967053237020474, 'slip_spread_k': 0.7255624697335312, 'spread_hl_frac': 0.04780620631395134, 'bb_std_mult': 2.2092120463271434, 'rsi_os': 28, 'rsi_ob': 84, 'vol_spike': 0.23412766020414166, 'adx_thresh': 31.29458095120042, 'atr_min_pct': 0.013525931040154088, 'atr_max_pct': 0.02145670999078459, 'tp_mult': 2.772710139780491, 'tsl_mult': 0.49608542734599403, 'strategy': 'breakout', 'time_stop': 172, 'use_sma': False, 'use_atr': True, 'use_adx': True, 'use_ema': True, 'use_spike': True, 'rsi_required': True, 'edge_k': 1.1235136573314684, 'edge_cap': 0.59383342006855, 'bull_strategy': 'breakout', 'bull_bb_std_mult': 1.413489041088321, 'bull_rsi_os': 54, 'bull_rsi_ob': 91, 'bull_adx_thresh': 8.041920025434539, 'bull_atr_min_pct': 0.0019229405101720434, 'bull_atr_max_pct': 0.03764946870281029, 'bull_tp_mult': 2.862452434826495, 'bull_tsl_mult': 0.7400262054350812, 'bull_time_stop': 232, 'bull_use_sma': False, 'bull_use_ema': False, 'bull_use_atr': False, 'bull_use_adx': False, 'bull_use_spike': True, 'bull_rsi_required': True, 'bear_strategy': 'mean_reversion', 'bear_bb_std_mult': 0.8450014838494528, 'bear_rsi_os': 25, 'bear_rsi_ob': 49, 'bear_adx_thresh': 15.929903249107783, 'bear_atr_min_pct': 0.024513561059991737, 'bear_atr_max_pct': 0.01639970384684382, 'bear_tp_mult': 2.916425151858928, 'bear_tsl_mult': 0.15123278705305176, 'bear_time_stop': 112, 'bear_use_sma': False, 'bear_use_ema': False, 'bear_use_atr': False, 'bear_use_adx': False, 'bear_use_spike': False, 'bear_rsi_required': False, 'sideways_strategy': 'breakout', 'sideways_bb_std_mult': 2.375546455822446, 'sideways_rsi_os': 8, 'sideways_rsi_ob': 48, 'sideways_adx_thresh': 16.744545371782614, 'sideways_atr_min_pct': 0.009739574869925428, 'sideways_atr_max_pct': 0.017410684926503023, 'sideways_tp_mult': 1.674118704709596, 'sideways_tsl_mult': 0.6311566766571133, 'sideways_time_stop': 173, 'sideways_use_sma': True, 'sideways_use_ema': False, 'sideways_use_atr': True, 'sideways_use_adx': True, 'sideways_use_spike': True, 'sideways_rsi_required': False}.
[I 2025-09-01 07:31:08,613] Trial 67 finished with values: [-0.10057630065778889, 0.10089441599976975] and parameters: {'p_sma': 53, 'p_std': 40, 'p_atr': 24, 'p_adx': 16, 'rsi_period': 51, 'ema1': 5, 'ema2': 52, 'slip_atr_k': 0.11251064526318716, 'slip_spread_k': 0.8523774611288815, 'spread_hl_frac': 0.04775408301203534, 'bb_std_mult': 1.293968031617787, 'rsi_os': 29, 'rsi_ob': 81, 'vol_spike': 0.2097498454179657, 'adx_thresh': 31.799625649860964, 'atr_min_pct': 0.01708603716173745, 'atr_max_pct': 0.14076641568562595, 'tp_mult': 1.3522266525569817, 'tsl_mult': 0.01765620200884005, 'strategy': 'mean_reversion', 'time_stop': 172, 'use_sma': True, 'use_atr': True, 'use_adx': True, 'use_ema': True, 'use_spike': False, 'rsi_required': True, 'edge_k': 0.9112258264856266, 'edge_cap': 0.8631628416025451, 'bull_strategy': 'breakout', 'bull_bb_std_mult': 0.9935357573348871, 'bull_rsi_os': 54, 'bull_rsi_ob': 92, 'bull_adx_thresh': 6.13778317686913, 'bull_atr_min_pct': 0.0015499577147491915, 'bull_atr_max_pct': 0.037676705742937446, 'bull_tp_mult': 2.874122298693684, 'bull_tsl_mult': 0.727627114113224, 'bull_time_stop': 193, 'bull_use_sma': True, 'bull_use_ema': False, 'bull_use_atr': False, 'bull_use_adx': False, 'bull_use_spike': True, 'bull_rsi_required': True, 'bear_strategy': 'breakout', 'bear_bb_std_mult': 1.049732521936286, 'bear_rsi_os': 21, 'bear_rsi_ob': 45, 'bear_adx_thresh': 14.006639052027932, 'bear_atr_min_pct': 0.01084313767191213, 'bear_atr_max_pct': 0.09678892419616388, 'bear_tp_mult': 2.9352018929765653, 'bear_tsl_mult': 0.5497098970960052, 'bear_time_stop': 95, 'bear_use_sma': False, 'bear_use_ema': False, 'bear_use_atr': True, 'bear_use_adx': False, 'bear_use_spike': False, 'bear_rsi_required': True, 'sideways_strategy': 'breakout', 'sideways_bb_std_mult': 1.2984203654885398, 'sideways_rsi_os': 41, 'sideways_rsi_ob': 90, 'sideways_adx_thresh': 32.0409317111375, 'sideways_atr_min_pct': 0.010546329350821036, 'sideways_atr_max_pct': 0.13810142316952828, 'sideways_tp_mult': 1.7251744701357428, 'sideways_tsl_mult': 0.5347621138700775, 'sideways_time_stop': 155, 'sideways_use_sma': True, 'sideways_use_ema': False, 'sideways_use_atr': True, 'sideways_use_adx': True, 'sideways_use_spike': True, 'sideways_rsi_required': False}.
[I 2025-09-01 07:31:09,723] Trial 68 finished with values: [-0.12044701665950908, 0.12018655108519048] and parameters: {'p_sma': 31, 'p_std': 35, 'p_atr': 30, 'p_adx': 7, 'rsi_period': 49, 'ema1': 25, 'ema2': 16, 'slip_atr_k': 0.11316705432939184, 'slip_spread_k': 0.9916178672344678, 'spread_hl_frac': 0.04746215846820086, 'bb_std_mult': 2.254779914452625, 'rsi_os': 8, 'rsi_ob': 81, 'vol_spike': 0.16790994517275723, 'adx_thresh': 16.951687523613643, 'atr_min_pct': 0.029920171368315637, 'atr_max_pct': 0.09366204212964274, 'tp_mult': 2.859774394318971, 'tsl_mult': 0.49618479003297894, 'strategy': 'breakout', 'time_stop': 171, 'use_sma': False, 'use_atr': True, 'use_adx': True, 'use_ema': True, 'use_spike': True, 'rsi_required': True, 'edge_k': 1.1238789642097897, 'edge_cap': 0.9942385547484247, 'bull_strategy': 'breakout', 'bull_bb_std_mult': 1.005188853770006, 'bull_rsi_os': 43, 'bull_rsi_ob': 57, 'bull_adx_thresh': 13.107833246393575, 'bull_atr_min_pct': 0.0015690871163577956, 'bull_atr_max_pct': 0.03752743333509507, 'bull_tp_mult': 1.996740447341246, 'bull_tsl_mult': 0.7205322304825955, 'bull_time_stop': 236, 'bull_use_sma': False, 'bull_use_ema': False, 'bull_use_atr': False, 'bull_use_adx': False, 'bull_use_spike': True, 'bull_rsi_required': True, 'bear_strategy': 'mean_reversion', 'bear_bb_std_mult': 0.7748537328762113, 'bear_rsi_os': 25, 'bear_rsi_ob': 49, 'bear_adx_thresh': 21.323154080578895, 'bear_atr_min_pct': 0.024211774898245476, 'bear_atr_max_pct': 0.0576126083798367, 'bear_tp_mult': 1.6185474224264484, 'bear_tsl_mult': 0.681238431140099, 'bear_time_stop': 110, 'bear_use_sma': False, 'bear_use_ema': False, 'bear_use_atr': False, 'bear_use_adx': False, 'bear_use_spike': False, 'bear_rsi_required': False, 'sideways_strategy': 'breakout', 'sideways_bb_std_mult': 2.429211893183609, 'sideways_rsi_os': 43, 'sideways_rsi_ob': 48, 'sideways_adx_thresh': 16.90808214743868, 'sideways_atr_min_pct': 0.010466597889212347, 'sideways_atr_max_pct': 0.12813288232576545, 'sideways_tp_mult': 1.657128186710063, 'sideways_tsl_mult': 0.7537140685093905, 'sideways_time_stop': 172, 'sideways_use_sma': True, 'sideways_use_ema': False, 'sideways_use_atr': True, 'sideways_use_adx': True, 'sideways_use_spike': True, 'sideways_rsi_required': False}.
[I 2025-09-01 07:31:34,964] Trial 70 finished with values: [-1000000000.0, 1000000000.0] and parameters: {'p_sma': 50, 'p_std': 39, 'p_atr': 30, 'p_adx': 18, 'rsi_period': 40, 'ema1': 13, 'ema2': 17, 'slip_atr_k': 0.11145658340732476, 'slip_spread_k': 0.7247419433443847, 'spread_hl_frac': 0.04012179468310926, 'bb_std_mult': 2.2610611851522795, 'rsi_os': 8, 'rsi_ob': 47, 'vol_spike': 0.09151039974390127, 'adx_thresh': 16.72745222600794, 'atr_min_pct': 0.014240362893435204, 'atr_max_pct': 0.09293634286379573, 'tp_mult': 1.3748873804710762, 'tsl_mult': 0.5093922756886625, 'strategy': 'breakout', 'time_stop': 168, 'use_sma': False, 'use_atr': True, 'use_adx': True, 'use_ema': True, 'use_spike': True, 'rsi_required': True, 'edge_k': 1.134752269559478, 'edge_cap': 0.8549252307465215, 'bull_strategy': 'breakout', 'bull_bb_std_mult': 1.0237092510129062, 'bull_rsi_os': 49, 'bull_rsi_ob': 74, 'bull_adx_thresh': 8.63866434497567, 'bull_atr_min_pct': 0.01686463122991843, 'bull_atr_max_pct': 0.038453257325516986, 'bull_tp_mult': 1.5230585079131118, 'bull_tsl_mult': 0.7292560546456215, 'bull_time_stop': 286, 'bull_use_sma': False, 'bull_use_ema': False, 'bull_use_atr': False, 'bull_use_adx': False, 'bull_use_spike': True, 'bull_rsi_required': True, 'bear_strategy': 'mean_reversion', 'bear_bb_std_mult': 2.1237897441325635, 'bear_rsi_os': 25, 'bear_rsi_ob': 49, 'bear_adx_thresh': 12.769659558974391, 'bear_atr_min_pct': 0.011521646337569233, 'bear_atr_max_pct': 0.09405183028512654, 'bear_tp_mult': 1.5332279256237378, 'bear_tsl_mult': 0.678101032423076, 'bear_time_stop': 248, 'bear_use_sma': False, 'bear_use_ema': True, 'bear_use_atr': False, 'bear_use_adx': False, 'bear_use_spike': True, 'bear_rsi_required': False, 'sideways_strategy': 'breakout', 'sideways_bb_std_mult': 1.465769489113589, 'sideways_rsi_os': 5, 'sideways_rsi_ob': 47, 'sideways_adx_thresh': 32.4406185536703, 'sideways_atr_min_pct': 0.009973215796064248, 'sideways_atr_max_pct': 0.12982947955886548, 'sideways_tp_mult': 2.087872381831723, 'sideways_tsl_mult': 0.6090806439385186, 'sideways_time_stop': 172, 'sideways_use_sma': True, 'sideways_use_ema': False, 'sideways_use_atr': True, 'sideways_use_adx': True, 'sideways_use_spike': True, 'sideways_rsi_required': True}.
[I 2025-09-01 07:31:54,878] Trial 72 finished with values: [-1000000000.0, 1000000000.0] and parameters: {'p_sma': 25, 'p_std': 13, 'p_atr': 30, 'p_adx': 18, 'rsi_period': 44, 'ema1': 13, 'ema2': 58, 'slip_atr_k': 0.18728782985475442, 'slip_spread_k': 0.6454551607528045, 'spread_hl_frac': 0.045522537358375005, 'bb_std_mult': 2.045748821604389, 'rsi_os': 8, 'rsi_ob': 52, 'vol_spike': 0.09278448754040453, 'adx_thresh': 10.735467242563715, 'atr_min_pct': 0.01457815115313453, 'atr_max_pct': 0.1059048864779773, 'tp_mult': 1.1926663268688498, 'tsl_mult': 0.6712336695542324, 'strategy': 'breakout', 'time_stop': 198, 'use_sma': False, 'use_atr': False, 'use_adx': True, 'use_ema': True, 'use_spike': True, 'rsi_required': True, 'edge_k': 0.9688501314667959, 'edge_cap': 0.9474149420418867, 'bull_strategy': 'breakout', 'bull_bb_std_mult': 2.365744575976322, 'bull_rsi_os': 43, 'bull_rsi_ob': 88, 'bull_adx_thresh': 17.90750969356385, 'bull_atr_min_pct': 0.017174175476706535, 'bull_atr_max_pct': 0.02066831373344427, 'bull_tp_mult': 2.580611110834348, 'bull_tsl_mult': 0.9122574101211238, 'bull_time_stop': 154, 'bull_use_sma': False, 'bull_use_ema': True, 'bull_use_atr': False, 'bull_use_adx': False, 'bull_use_spike': True, 'bull_rsi_required': True, 'bear_strategy': 'mean_reversion', 'bear_bb_std_mult': 2.6393720420877336, 'bear_rsi_os': 18, 'bear_rsi_ob': 83, 'bear_adx_thresh': 12.677049275031216, 'bear_atr_min_pct': 0.011895520325315663, 'bear_atr_max_pct': 0.05007350212657072, 'bear_tp_mult': 1.4617373430125702, 'bear_tsl_mult': 0.06586396476338444, 'bear_time_stop': 180, 'bear_use_sma': True, 'bear_use_ema': True, 'bear_use_atr': False, 'bear_use_adx': False, 'bear_use_spike': True, 'bear_rsi_required': False, 'sideways_strategy': 'mean_reversion', 'sideways_bb_std_mult': 1.8114384571871631, 'sideways_rsi_os': 37, 'sideways_rsi_ob': 85, 'sideways_adx_thresh': 14.789520562796959, 'sideways_atr_min_pct': 0.015963973441320417, 'sideways_atr_max_pct': 0.13062427057854206, 'sideways_tp_mult': 2.956826853375918, 'sideways_tsl_mult': 0.7753491079443787, 'sideways_time_stop': 112, 'sideways_use_sma': True, 'sideways_use_ema': False, 'sideways_use_atr': False, 'sideways_use_adx': True, 'sideways_use_spike': False, 'sideways_rsi_required': True}.
