[I 2025-09-01 08:02:03,757] Trial 262 finished with values: [-1000000000.0, 1000000000.0] and parameters: {'p_sma': 30, 'p_std': 43, 'p_atr': 12, 'p_adx': 21, 'rsi_period': 66, 'ema1': 21, 'ema2': 38, 'slip_atr_k': 0.2173665866100108, 'slip_spread_k': 0.9747464245705328, 'spread_hl_frac': 0.0223953982219711, 'bb_std_mult': 2.2165808587239795, 'rsi_os': 23, 'rsi_ob': 65, 'vol_spike': 0.1080373168954957, 'adx_thresh': 20.3086876771658, 'atr_min_pct': 0.021213408848406872, 'atr_max_pct': 0.14270948448745047, 'tp_mult': 2.3285585078908313, 'tsl_mult': 0.3901161967853211, 'strategy': 'mean_reversion', 'time_stop': 242, 'use_sma': True, 'use_atr': False, 'use_adx': True, 'use_ema': True, 'use_spike': False, 'rsi_required': False, 'edge_k': 0.9685768710809699, 'edge_cap': 0.5453042179665873, 'bull_strategy': 'breakout', 'bull_bb_std_mult': 3.4290833103308254, 'bull_rsi_os': 11, 'bull_rsi_ob': 70, 'bull_adx_thresh': 8.52246364491194, 'bull_atr_min_pct': 0.021471023900652714, 'bull_atr_max_pct': 0.04923447324952593, 'bull_tp_mult': 2.2397856100924805, 'bull_tsl_mult': 0.665627919983026, 'bull_time_stop': 146, 'bull_use_sma': True, 'bull_use_ema': True, 'bull_use_atr': True, 'bull_use_adx': True, 'bull_use_spike': False, 'bull_rsi_required': False, 'bear_strategy': 'mean_reversion', 'bear_bb_std_mult': 3.268681628583567, 'bear_rsi_os': 26, 'bear_rsi_ob': 95, 'bear_adx_thresh': 21.828328442174378, 'bear_atr_min_pct': 0.02423984396394235, 'bear_atr_max_pct': 0.07814546845063591, 'bear_tp_mult': 2.7901135677002338, 'bear_tsl_mult': 0.026416888073589218, 'bear_time_stop': 74, 'bear_use_sma': False, 'bear_use_ema': True, 'bear_use_atr': False, 'bear_use_adx': True, 'bear_use_spike': True, 'bear_rsi_required': False, 'sideways_strategy': 'breakout', 'sideways_bb_std_mult': 0.7625209525276295, 'sideways_rsi_os': 38, 'sideways_rsi_ob': 58, 'sideways_adx_thresh': 8.008640295098436, 'sideways_atr_min_pct': 0.02794778061037885, 'sideways_atr_max_pct': 0.025565746611775457, 'sideways_tp_mult': 2.565411460678078, 'sideways_tsl_mult': 0.1497435436617773, 'sideways_time_stop': 285, 'sideways_use_sma': False, 'sideways_use_ema': False, 'sideways_use_atr': True, 'sideways_use_adx': True, 'sideways_use_spike': True, 'sideways_rsi_required': False}.
[I 2025-09-01 08:02:04,024] Trial 260 finished with values: [-1000000000.0, 1000000000.0] and parameters: {'p_sma': 49, 'p_std': 60, 'p_atr': 12, 'p_adx': 20, 'rsi_period': 66, 'ema1': 10, 'ema2': 11, 'slip_atr_k': 0.2395044473237566, 'slip_spread_k': 0.6926694038877931, 'spread_hl_frac': 0.02665710014305749, 'bb_std_mult': 3.34485539444504, 'rsi_os': 38, 'rsi_ob': 47, 'vol_spike': 0.23150401499194714, 'adx_thresh': 27.29372642021457, 'atr_min_pct': 0.0223397964058447, 'atr_max_pct': 0.10906727853226658, 'tp_mult': 2.9904254957641605, 'tsl_mult': 0.4915729527639864, 'strategy': 'breakout', 'time_stop': 241, 'use_sma': True, 'use_atr': True, 'use_adx': True, 'use_ema': True, 'use_spike': True, 'rsi_required': True, 'edge_k': 0.9635867575112183, 'edge_cap': 0.10508731210946598, 'bull_strategy': 'breakout', 'bull_bb_std_mult': 2.9158262024101833, 'bull_rsi_os': 11, 'bull_rsi_ob': 85, 'bull_adx_thresh': 8.484156216892309, 'bull_atr_min_pct': 0.02228916783687874, 'bull_atr_max_pct': 0.08851508447556067, 'bull_tp_mult': 2.216890683304994, 'bull_tsl_mult': 0.6720332353234646, 'bull_time_stop': 146, 'bull_use_sma': True, 'bull_use_ema': False, 'bull_use_atr': False, 'bull_use_adx': True, 'bull_use_spike': True, 'bull_rsi_required': False, 'bear_strategy': 'mean_reversion', 'bear_bb_std_mult': 3.267542997600057, 'bear_rsi_os': 26, 'bear_rsi_ob': 66, 'bear_adx_thresh': 32.37454109599393, 'bear_atr_min_pct': 0.023909951332001692, 'bear_atr_max_pct': 0.02565141900178302, 'bear_tp_mult': 2.790399979349737, 'bear_tsl_mult': 0.8036718707722195, 'bear_time_stop': 88, 'bear_use_sma': False, 'bear_use_ema': True, 'bear_use_atr': True, 'bear_use_adx': True, 'bear_use_spike': False, 'bear_rsi_required': False, 'sideways_strategy': 'mean_reversion', 'sideways_bb_std_mult': 0.7217945818991882, 'sideways_rsi_os': 38, 'sideways_rsi_ob': 55, 'sideways_adx_thresh': 8.081547424144814, 'sideways_atr_min_pct': 0.020612777166809263, 'sideways_atr_max_pct': 0.032396992396252725, 'sideways_tp_mult': 1.1916670595644536, 'sideways_tsl_mult': 0.4418171331961983, 'sideways_time_stop': 281, 'sideways_use_sma': False, 'sideways_use_ema': True, 'sideways_use_atr': False, 'sideways_use_adx': True, 'sideways_use_spike': True, 'sideways_rsi_required': False}.
[I 2025-09-01 08:02:04,334] Trial 261 finished with values: [-1000000000.0, 1000000000.0] and parameters: {'p_sma': 36, 'p_std': 60, 'p_atr': 12, 'p_adx': 21, 'rsi_period': 66, 'ema1': 10, 'ema2': 11, 'slip_atr_k': 0.0694899222706564, 'slip_spread_k': 0.2212357810016149, 'spread_hl_frac': 0.022452136674451947, 'bb_std_mult': 2.843835120212593, 'rsi_os': 23, 'rsi_ob': 65, 'vol_spike': 0.21665104983588773, 'adx_thresh': 27.34478019331451, 'atr_min_pct': 0.0003831022113579153, 'atr_max_pct': 0.10785252504528021, 'tp_mult': 1.5012956253391299, 'tsl_mult': 0.6346758108831516, 'strategy': 'breakout', 'time_stop': 242, 'use_sma': True, 'use_atr': False, 'use_adx': True, 'use_ema': True, 'use_spike': False, 'rsi_required': False, 'edge_k': 0.9714780228672799, 'edge_cap': 0.4645130888915694, 'bull_strategy': 'breakout', 'bull_bb_std_mult': 2.937971984380508, 'bull_rsi_os': 11, 'bull_rsi_ob': 68, 'bull_adx_thresh': 8.767238627531185, 'bull_atr_min_pct': 0.017051851252347237, 'bull_atr_max_pct': 0.08374550171498242, 'bull_tp_mult': 2.203332270779475, 'bull_tsl_mult': 0.6694190765302275, 'bull_time_stop': 146, 'bull_use_sma': True, 'bull_use_ema': True, 'bull_use_atr': True, 'bull_use_adx': True, 'bull_use_spike': False, 'bull_rsi_required': False, 'bear_strategy': 'mean_reversion', 'bear_bb_std_mult': 3.243713362619988, 'bear_rsi_os': 26, 'bear_rsi_ob': 45, 'bear_adx_thresh': 31.581522898654594, 'bear_atr_min_pct': 9.78985497315267e-06, 'bear_atr_max_pct': 0.044600926778607254, 'bear_tp_mult': 1.6163067221951883, 'bear_tsl_mult': 0.02394550162536739, 'bear_time_stop': 75, 'bear_use_sma': False, 'bear_use_ema': True, 'bear_use_atr': True, 'bear_use_adx': True, 'bear_use_spike': False, 'bear_rsi_required': False, 'sideways_strategy': 'breakout', 'sideways_bb_std_mult': 0.7575161761452025, 'sideways_rsi_os': 27, 'sideways_rsi_ob': 72, 'sideways_adx_thresh': 8.014618642379432, 'sideways_atr_min_pct': 0.022027397520858454, 'sideways_atr_max_pct': 0.02534126986941186, 'sideways_tp_mult': 2.9745303261565605, 'sideways_tsl_mult': 0.13626565408280844, 'sideways_time_stop': 286, 'sideways_use_sma': False, 'sideways_use_ema': True, 'sideways_use_atr': True, 'sideways_use_adx': True, 'sideways_use_spike': True, 'sideways_rsi_required': False}.
[I 2025-09-01 08:02:04,997] Trial 267 finished with values: [-1000000000.0, 1000000000.0] and parameters: {'p_sma': 39, 'p_std': 34, 'p_atr': 11, 'p_adx': 19, 'rsi_period': 61, 'ema1': 5, 'ema2': 58, 'slip_atr_k': 0.04653386574213661, 'slip_spread_k': 0.3625476551844746, 'spread_hl_frac': 0.023424547858070105, 'bb_std_mult': 0.6941247550932308, 'rsi_os': 5, 'rsi_ob': 60, 'vol_spike': 0.2854049228127993, 'adx_thresh': 24.996146990582062, 'atr_min_pct': 0.02218524718574755, 'atr_max_pct': 0.014480660278003848, 'tp_mult': 1.2154937437233055, 'tsl_mult': 0.5764291826335391, 'strategy': 'mean_reversion', 'time_stop': 176, 'use_sma': True, 'use_atr': True, 'use_adx': True, 'use_ema': False, 'use_spike': True, 'rsi_required': True, 'edge_k': 1.141149651660447, 'edge_cap': 0.8622416963948096, 'bull_strategy': 'breakout', 'bull_bb_std_mult': 2.755772463391917, 'bull_rsi_os': 30, 'bull_rsi_ob': 66, 'bull_adx_thresh': 5.2370876790690915, 'bull_atr_min_pct': 0.01958047260198706, 'bull_atr_max_pct': 0.031072490826608845, 'bull_tp_mult': 2.2695061939043235, 'bull_tsl_mult': 0.4466845492601033, 'bull_time_stop': 249, 'bull_use_sma': False, 'bull_use_ema': False, 'bull_use_atr': False, 'bull_use_adx': False, 'bull_use_spike': True, 'bull_rsi_required': False, 'bear_strategy': 'breakout', 'bear_bb_std_mult': 0.8293250246232495, 'bear_rsi_os': 25, 'bear_rsi_ob': 95, 'bear_adx_thresh': 30.695523611014426, 'bear_atr_min_pct': 0.029119255062515986, 'bear_atr_max_pct': 0.08502412718257087, 'bear_tp_mult': 2.854995861901546, 'bear_tsl_mult': 0.9992842614904809, 'bear_time_stop': 97, 'bear_use_sma': False, 'bear_use_ema': False, 'bear_use_atr': True, 'bear_use_adx': False, 'bear_use_spike': True, 'bear_rsi_required': True, 'sideways_strategy': 'mean_reversion', 'sideways_bb_std_mult': 0.9648744537208871, 'sideways_rsi_os': 39, 'sideways_rsi_ob': 70, 'sideways_adx_thresh': 8.692079826212668, 'sideways_atr_min_pct': 0.029977300144604056, 'sideways_atr_max_pct': 0.06975829411949265, 'sideways_tp_mult': 2.6487599011749254, 'sideways_tsl_mult': 0.4798301268206839, 'sideways_time_stop': 11, 'sideways_use_sma': False, 'sideways_use_ema': False, 'sideways_use_atr': False, 'sideways_use_adx': True, 'sideways_use_spike': True, 'sideways_rsi_required': False}.
[I 2025-09-01 08:02:05,009] Trial 265 finished with values: [-1000000000.0, 1000000000.0] and parameters: {'p_sma': 36, 'p_std': 52, 'p_atr': 11, 'p_adx': 19, 'rsi_period': 42, 'ema1': 10, 'ema2': 49, 'slip_atr_k': 0.23621339012122883, 'slip_spread_k': 0.21302215440928646, 'spread_hl_frac': 0.025379217017095713, 'bb_std_mult': 3.5316289683581537, 'rsi_os': 26, 'rsi_ob': 95, 'vol_spike': 0.1970292270987698, 'adx_thresh': 24.981274323262447, 'atr_min_pct': 0.022477103403423588, 'atr_max_pct': 0.014401507663648047, 'tp_mult': 2.995188635348738, 'tsl_mult': 0.4717443945199672, 'strategy': 'mean_reversion', 'time_stop': 131, 'use_sma': True, 'use_atr': True, 'use_adx': True, 'use_ema': False, 'use_spike': True, 'rsi_required': True, 'edge_k': 1.097882687848885, 'edge_cap': 0.2292084994457494, 'bull_strategy': 'breakout', 'bull_bb_std_mult': 2.9063056718950016, 'bull_rsi_os': 39, 'bull_rsi_ob': 68, 'bull_adx_thresh': 9.004347691371485, 'bull_atr_min_pct': 0.014759305668119574, 'bull_atr_max_pct': 0.07544769748129171, 'bull_tp_mult': 2.2542127626275787, 'bull_tsl_mult': 0.7502860916105258, 'bull_time_stop': 28, 'bull_use_sma': False, 'bull_use_ema': False, 'bull_use_atr': False, 'bull_use_adx': True, 'bull_use_spike': True, 'bull_rsi_required': False, 'bear_strategy': 'breakout', 'bear_bb_std_mult': 0.9971705504517485, 'bear_rsi_os': 25, 'bear_rsi_ob': 95, 'bear_adx_thresh': 31.04555235746868, 'bear_atr_min_pct': 0.0001374579305589308, 'bear_atr_max_pct': 0.08725371149278914, 'bear_tp_mult': 1.5846068451873556, 'bear_tsl_mult': 0.3354057287234016, 'bear_time_stop': 95, 'bear_use_sma': False, 'bear_use_ema': False, 'bear_use_atr': True, 'bear_use_adx': True, 'bear_use_spike': False, 'bear_rsi_required': False, 'sideways_strategy': 'mean_reversion', 'sideways_bb_std_mult': 0.7131561188572818, 'sideways_rsi_os': 42, 'sideways_rsi_ob': 69, 'sideways_adx_thresh': 18.996894415057657, 'sideways_atr_min_pct': 0.006459722108482219, 'sideways_atr_max_pct': 0.045863508626897004, 'sideways_tp_mult': 2.654274561171024, 'sideways_tsl_mult': 0.47393875967483967, 'sideways_time_stop': 10, 'sideways_use_sma': False, 'sideways_use_ema': True, 'sideways_use_atr': False, 'sideways_use_adx': True, 'sideways_use_spike': True, 'sideways_rsi_required': False}.
[I 2025-09-01 08:02:48,543] Trial 268 finished with values: [-1000000000.0, 1000000000.0] and parameters: {'p_sma': 54, 'p_std': 18, 'p_atr': 29, 'p_adx': 28, 'rsi_period': 70, 'ema1': 9, 'ema2': 13, 'slip_atr_k': 0.1093946020304515, 'slip_spread_k': 0.6104168822335316, 'spread_hl_frac': 0.03040237683052626, 'bb_std_mult': 3.148305453077782, 'rsi_os': 26, 'rsi_ob': 68, 'vol_spike': 0.18488517291014922, 'adx_thresh': 23.710058086267516, 'atr_min_pct': 0.009126908851152252, 'atr_max_pct': 0.032710554281752735, 'tp_mult': 1.243040837618976, 'tsl_mult': 0.3157298489393015, 'strategy': 'mean_reversion', 'time_stop': 250, 'use_sma': True, 'use_atr': True, 'use_adx': True, 'use_ema': True, 'use_spike': True, 'rsi_required': True, 'edge_k': 1.915361614948061, 'edge_cap': 0.05788324389109055, 'bull_strategy': 'breakout', 'bull_bb_std_mult': 2.875901025351617, 'bull_rsi_os': 14, 'bull_rsi_ob': 82, 'bull_adx_thresh': 7.804728644342566, 'bull_atr_min_pct': 0.015380035920513513, 'bull_atr_max_pct': 0.03906516915686669, 'bull_tp_mult': 2.3168831973573503, 'bull_tsl_mult': 0.8848087339481241, 'bull_time_stop': 155, 'bull_use_sma': False, 'bull_use_ema': False, 'bull_use_atr': False, 'bull_use_adx': True, 'bull_use_spike': True, 'bull_rsi_required': False, 'bear_strategy': 'breakout', 'bear_bb_std_mult': 3.0876454052326032, 'bear_rsi_os': 28, 'bear_rsi_ob': 70, 'bear_adx_thresh': 31.056385846658632, 'bear_atr_min_pct': 0.021415923334793398, 'bear_atr_max_pct': 0.120111813874165, 'bear_tp_mult': 1.568165328124271, 'bear_tsl_mult': 0.7290931446502521, 'bear_time_stop': 104, 'bear_use_sma': False, 'bear_use_ema': False, 'bear_use_atr': True, 'bear_use_adx': True, 'bear_use_spike': True, 'bear_rsi_required': False, 'sideways_strategy': 'mean_reversion', 'sideways_bb_std_mult': 1.4355658681657935, 'sideways_rsi_os': 42, 'sideways_rsi_ob': 71, 'sideways_adx_thresh': 34.89163500230906, 'sideways_atr_min_pct': 0.022576859842927236, 'sideways_atr_max_pct': 0.07572333993356509, 'sideways_tp_mult': 2.5903261842457392, 'sideways_tsl_mult': 0.17860478602354515, 'sideways_time_stop': 198, 'sideways_use_sma': False, 'sideways_use_ema': False, 'sideways_use_atr': False, 'sideways_use_adx': True, 'sideways_use_spike': True, 'sideways_rsi_required': False}.
[I 2025-09-01 08:02:48,976] Trial 269 finished with values: [-1000000000.0, 1000000000.0] and parameters: {'p_sma': 21, 'p_std': 18, 'p_atr': 29, 'p_adx': 19, 'rsi_period': 64, 'ema1': 18, 'ema2': 29, 'slip_atr_k': 0.16497003771038202, 'slip_spread_k': 0.6259236412163943, 'spread_hl_frac': 0.025071730477986387, 'bb_std_mult': 3.428201470785916, 'rsi_os': 25, 'rsi_ob': 69, 'vol_spike': 0.23868961394700203, 'adx_thresh': 32.18444306444614, 'atr_min_pct': 0.021525485302590495, 'atr_max_pct': 0.13189149164929828, 'tp_mult': 1.201498510096826, 'tsl_mult': 0.7637981059612743, 'strategy': 'mean_reversion', 'time_stop': 254, 'use_sma': True, 'use_atr': True, 'use_adx': True, 'use_ema': True, 'use_spike': True, 'rsi_required': True, 'edge_k': 1.0173549968107356, 'edge_cap': 0.6592638248382016, 'bull_strategy': 'breakout', 'bull_bb_std_mult': 2.6510556675173653, 'bull_rsi_os': 14, 'bull_rsi_ob': 46, 'bull_adx_thresh': 7.691735651301387, 'bull_atr_min_pct': 0.018969685691084665, 'bull_atr_max_pct': 0.07078457154536862, 'bull_tp_mult': 2.318900847032777, 'bull_tsl_mult': 0.8253844100607868, 'bull_time_stop': 153, 'bull_use_sma': True, 'bull_use_ema': False, 'bull_use_atr': False, 'bull_use_adx': True, 'bull_use_spike': True, 'bull_rsi_required': False, 'bear_strategy': 'mean_reversion', 'bear_bb_std_mult': 2.750205510110408, 'bear_rsi_os': 24, 'bear_rsi_ob': 71, 'bear_adx_thresh': 31.44900365447489, 'bear_atr_min_pct': 0.022199287631169833, 'bear_atr_max_pct': 0.12210430512782329, 'bear_tp_mult': 2.878096094919389, 'bear_tsl_mult': 0.09076039408428425, 'bear_time_stop': 101, 'bear_use_sma': False, 'bear_use_ema': False, 'bear_use_atr': False, 'bear_use_adx': True, 'bear_use_spike': True, 'bear_rsi_required': False, 'sideways_strategy': 'mean_reversion', 'sideways_bb_std_mult': 0.600818386116465, 'sideways_rsi_os': 37, 'sideways_rsi_ob': 72, 'sideways_adx_thresh': 27.06007849732494, 'sideways_atr_min_pct': 0.025546519294173994, 'sideways_atr_max_pct': 0.11084475087854462, 'sideways_tp_mult': 2.5888069719544093, 'sideways_tsl_mult': 0.18123200591184482, 'sideways_time_stop': 41, 'sideways_use_sma': False, 'sideways_use_ema': False, 'sideways_use_atr': False, 'sideways_use_adx': True, 'sideways_use_spike': True, 'sideways_rsi_required': False}.
[I 2025-09-01 08:02:49,272] Trial 266 finished with values: [-1000000000.0, 1000000000.0] and parameters: {'p_sma': 10, 'p_std': 18, 'p_atr': 11, 'p_adx': 19, 'rsi_period': 64, 'ema1': 9, 'ema2': 55, 'slip_atr_k': 0.07007099517149926, 'slip_spread_k': 0.22116437167210606, 'spread_hl_frac': 0.022966402351246758, 'bb_std_mult': 3.545871790064666, 'rsi_os': 26, 'rsi_ob': 55, 'vol_spike': 0.2834774013085725, 'adx_thresh': 25.133552529969123, 'atr_min_pct': 0.02212644343624408, 'atr_max_pct': 0.07175116876041014, 'tp_mult': 1.2099029825743197, 'tsl_mult': 0.7575761952367692, 'strategy': 'mean_reversion', 'time_stop': 178, 'use_sma': True, 'use_atr': True, 'use_adx': True, 'use_ema': False, 'use_spike': True, 'rsi_required': True, 'edge_k': 1.9103175485200423, 'edge_cap': 0.45507751068562696, 'bull_strategy': 'breakout', 'bull_bb_std_mult': 2.7691278145422746, 'bull_rsi_os': 38, 'bull_rsi_ob': 66, 'bull_adx_thresh': 5.259008231626371, 'bull_atr_min_pct': 0.01913716650342769, 'bull_atr_max_pct': 0.05787898531711527, 'bull_tp_mult': 2.2593597717844416, 'bull_tsl_mult': 0.8739946530300547, 'bull_time_stop': 12, 'bull_use_sma': False, 'bull_use_ema': False, 'bull_use_atr': False, 'bull_use_adx': True, 'bull_use_spike': True, 'bull_rsi_required': False, 'bear_strategy': 'breakout', 'bear_bb_std_mult': 3.0776548041620657, 'bear_rsi_os': 25, 'bear_rsi_ob': 95, 'bear_adx_thresh': 30.83434476487325, 'bear_atr_min_pct': 0.01508246578688391, 'bear_atr_max_pct': 0.08704924323471205, 'bear_tp_mult': 1.6092191939537053, 'bear_tsl_mult': 0.08001462607663412, 'bear_time_stop': 101, 'bear_use_sma': False, 'bear_use_ema': False, 'bear_use_atr': True, 'bear_use_adx': True, 'bear_use_spike': True, 'bear_rsi_required': True, 'sideways_strategy': 'mean_reversion', 'sideways_bb_std_mult': 0.648342112011911, 'sideways_rsi_os': 42, 'sideways_rsi_ob': 72, 'sideways_adx_thresh': 9.465523889442634, 'sideways_atr_min_pct': 0.02195952848920383, 'sideways_atr_max_pct': 0.14014871700247147, 'sideways_tp_mult': 2.6489547574802184, 'sideways_tsl_mult': 0.7832504967378697, 'sideways_time_stop': 9, 'sideways_use_sma': False, 'sideways_use_ema': False, 'sideways_use_atr': False, 'sideways_use_adx': True, 'sideways_use_spike': True, 'sideways_rsi_required': False}.
[I 2025-09-01 08:02:49,965] Trial 264 finished with values: [-1000000000.0, 1000000000.0] and parameters: {'p_sma': 36, 'p_std': 18, 'p_atr': 12, 'p_adx': 19, 'rsi_period': 66, 'ema1': 5, 'ema2': 29, 'slip_atr_k': 0.2348201794240241, 'slip_spread_k': 0.6098125697039565, 'spread_hl_frac': 0.02266233416896622, 'bb_std_mult': 3.5615941914313867, 'rsi_os': 23, 'rsi_ob': 69, 'vol_spike': 0.23503777157952915, 'adx_thresh': 25.20564588135548, 'atr_min_pct': 0.022263590630272737, 'atr_max_pct': 0.08523370738926474, 'tp_mult': 1.6135271439724357, 'tsl_mult': 0.47825156574020145, 'strategy': 'mean_reversion', 'time_stop': 242, 'use_sma': True, 'use_atr': True, 'use_adx': True, 'use_ema': True, 'use_spike': True, 'rsi_required': False, 'edge_k': 1.1043915782820872, 'edge_cap': 0.11619967381435684, 'bull_strategy': 'breakout', 'bull_bb_std_mult': 2.896621816630439, 'bull_rsi_os': 11, 'bull_rsi_ob': 82, 'bull_adx_thresh': 8.752443898876027, 'bull_atr_min_pct': 0.020464348306110165, 'bull_atr_max_pct': 0.030148394068444002, 'bull_tp_mult': 2.2412979308139356, 'bull_tsl_mult': 0.40638165972820023, 'bull_time_stop': 146, 'bull_use_sma': False, 'bull_use_ema': False, 'bull_use_atr': False, 'bull_use_adx': True, 'bull_use_spike': True, 'bull_rsi_required': False, 'bear_strategy': 'mean_reversion', 'bear_bb_std_mult': 3.1029286569516032, 'bear_rsi_os': 25, 'bear_rsi_ob': 95, 'bear_adx_thresh': 31.026896322407925, 'bear_atr_min_pct': 0.024129391126157456, 'bear_atr_max_pct': 0.04423012567713689, 'bear_tp_mult': 1.5785502091861108, 'bear_tsl_mult': 0.08128371223808512, 'bear_time_stop': 98, 'bear_use_sma': False, 'bear_use_ema': False, 'bear_use_atr': True, 'bear_use_adx': True, 'bear_use_spike': False, 'bear_rsi_required': False, 'sideways_strategy': 'mean_reversion', 'sideways_bb_std_mult': 0.742344979172926, 'sideways_rsi_os': 38, 'sideways_rsi_ob': 72, 'sideways_adx_thresh': 8.17190043768314, 'sideways_atr_min_pct': 0.02076997756759028, 'sideways_atr_max_pct': 0.11209321308591264, 'sideways_tp_mult': 2.650940652598398, 'sideways_tsl_mult': 0.9619187901858479, 'sideways_time_stop': 82, 'sideways_use_sma': False, 'sideways_use_ema': True, 'sideways_use_atr': False, 'sideways_use_adx': True, 'sideways_use_spike': True, 'sideways_rsi_required': False}.
