[I 2025-09-01 08:32:21,484] Trial 439 finished with values: [-1000000000.0, 1000000000.0] and parameters: {'p_sma': 50, 'p_std': 15, 'p_atr': 12, 'p_adx': 19, 'rsi_period': 43, 'ema1': 11, 'ema2': 15, 'slip_atr_k': 0.1264298359932107, 'slip_spread_k': 0.8062283966986676, 'spread_hl_frac': 0.005774970752547466, 'bb_std_mult': 1.2456943723655751, 'rsi_os': 23, 'rsi_ob': 58, 'vol_spike': 0.22395660201157902, 'adx_thresh': 24.704134898117328, 'atr_min_pct': 0.01297984623337401, 'atr_max_pct': 0.1320243683126717, 'tp_mult': 1.1972407902624784, 'tsl_mult': 0.49215259773455833, 'strategy': 'mean_reversion', 'time_stop': 16, 'use_sma': True, 'use_atr': True, 'use_adx': True, 'use_ema': True, 'use_spike': True, 'rsi_required': True, 'edge_k': 1.042423047497134, 'edge_cap': 0.1303160862342972, 'bull_strategy': 'breakout', 'bull_bb_std_mult': 2.918404918109776, 'bull_rsi_os': 18, 'bull_rsi_ob': 45, 'bull_adx_thresh': 7.5189294286342525, 'bull_atr_min_pct': 0.006997415783827959, 'bull_atr_max_pct': 0.040293938350608266, 'bull_tp_mult': 2.7407828453513234, 'bull_tsl_mult': 0.36540257628510675, 'bull_time_stop': 147, 'bull_use_sma': True, 'bull_use_ema': False, 'bull_use_atr': False, 'bull_use_adx': True, 'bull_use_spike': True, 'bull_rsi_required': False, 'bear_strategy': 'mean_reversion', 'bear_bb_std_mult': 2.9827868151187578, 'bear_rsi_os': 24, 'bear_rsi_ob': 94, 'bear_adx_thresh': 32.31681658524875, 'bear_atr_min_pct': 0.021765686096832066, 'bear_atr_max_pct': 0.08350833366752479, 'bear_tp_mult': 2.868710645631371, 'bear_tsl_mult': 0.6395928047009862, 'bear_time_stop': 124, 'bear_use_sma': False, 'bear_use_ema': False, 'bear_use_atr': True, 'bear_use_adx': True, 'bear_use_spike': True, 'bear_rsi_required': False, 'sideways_strategy': 'mean_reversion', 'sideways_bb_std_mult': 0.5386263281840957, 'sideways_rsi_os': 14, 'sideways_rsi_ob': 63, 'sideways_adx_thresh': 6.382443874585606, 'sideways_atr_min_pct': 0.022830385845037004, 'sideways_atr_max_pct': 0.034936730971968574, 'sideways_tp_mult': 1.052394466004411, 'sideways_tsl_mult': 0.5162211849714883, 'sideways_time_stop': 34, 'sideways_use_sma': False, 'sideways_use_ema': False, 'sideways_use_atr': False, 'sideways_use_adx': True, 'sideways_use_spike': True, 'sideways_rsi_required': False}.
[I 2025-09-01 08:32:21,605] Trial 440 finished with values: [-1000000000.0, 1000000000.0] and parameters: {'p_sma': 22, 'p_std': 34, 'p_atr': 12, 'p_adx': 19, 'rsi_period': 38, 'ema1': 20, 'ema2': 17, 'slip_atr_k': 0.10923275798805608, 'slip_spread_k': 0.6975136220938865, 'spread_hl_frac': 0.02426269439981392, 'bb_std_mult': 0.7381055564737189, 'rsi_os': 28, 'rsi_ob': 58, 'vol_spike': 0.2388666694572533, 'adx_thresh': 25.96408082862024, 'atr_min_pct': 0.004861984725190409, 'atr_max_pct': 0.056128696010591464, 'tp_mult': 1.2376051331418116, 'tsl_mult': 0.5000762956893954, 'strategy': 'mean_reversion', 'time_stop': 18, 'use_sma': True, 'use_atr': True, 'use_adx': True, 'use_ema': True, 'use_spike': True, 'rsi_required': True, 'edge_k': 1.061537558587233, 'edge_cap': 0.8405552802113423, 'bull_strategy': 'breakout', 'bull_bb_std_mult': 2.8161410370900413, 'bull_rsi_os': 12, 'bull_rsi_ob': 93, 'bull_adx_thresh': 7.568439728634895, 'bull_atr_min_pct': 0.025124033260337176, 'bull_atr_max_pct': 0.04025600845922999, 'bull_tp_mult': 2.325863342973158, 'bull_tsl_mult': 0.35209421057633505, 'bull_time_stop': 102, 'bull_use_sma': True, 'bull_use_ema': False, 'bull_use_atr': False, 'bull_use_adx': True, 'bull_use_spike': True, 'bull_rsi_required': False, 'bear_strategy': 'mean_reversion', 'bear_bb_std_mult': 1.3717806462506021, 'bear_rsi_os': 9, 'bear_rsi_ob': 93, 'bear_adx_thresh': 29.829536533139613, 'bear_atr_min_pct': 0.021408375677783687, 'bear_atr_max_pct': 0.08344285924281998, 'bear_tp_mult': 1.739201550280943, 'bear_tsl_mult': 0.2693696453784596, 'bear_time_stop': 24, 'bear_use_sma': False, 'bear_use_ema': False, 'bear_use_atr': True, 'bear_use_adx': True, 'bear_use_spike': True, 'bear_rsi_required': False, 'sideways_strategy': 'mean_reversion', 'sideways_bb_std_mult': 0.5626454075083438, 'sideways_rsi_os': 39, 'sideways_rsi_ob': 63, 'sideways_adx_thresh': 30.4528086933835, 'sideways_atr_min_pct': 0.027262266517286138, 'sideways_atr_max_pct': 0.023371117589901624, 'sideways_tp_mult': 2.300962651584458, 'sideways_tsl_mult': 0.12526583517852552, 'sideways_time_stop': 34, 'sideways_use_sma': False, 'sideways_use_ema': False, 'sideways_use_atr': False, 'sideways_use_adx': True, 'sideways_use_spike': True, 'sideways_rsi_required': False}.
[I 2025-09-01 08:33:01,029] Trial 445 finished with values: [-1000000000.0, 1000000000.0] and parameters: {'p_sma': 21, 'p_std': 37, 'p_atr': 11, 'p_adx': 23, 'rsi_period': 69, 'ema1': 9, 'ema2': 50, 'slip_atr_k': 0.09878233323092996, 'slip_spread_k': 0.23392889727063038, 'spread_hl_frac': 0.02159182064244581, 'bb_std_mult': 3.3407497799684824, 'rsi_os': 12, 'rsi_ob': 55, 'vol_spike': 0.248074722579456, 'adx_thresh': 23.77558692873352, 'atr_min_pct': 0.021454512290892024, 'atr_max_pct': 0.12053282947326482, 'tp_mult': 1.6265998484903792, 'tsl_mult': 0.5493712230493033, 'strategy': 'mean_reversion', 'time_stop': 240, 'use_sma': True, 'use_atr': True, 'use_adx': True, 'use_ema': False, 'use_spike': False, 'rsi_required': True, 'edge_k': 0.9399421671033112, 'edge_cap': 0.380893069856367, 'bull_strategy': 'breakout', 'bull_bb_std_mult': 2.120661269373323, 'bull_rsi_os': 13, 'bull_rsi_ob': 75, 'bull_adx_thresh': 24.059719110451034, 'bull_atr_min_pct': 0.00811320118793154, 'bull_atr_max_pct': 0.032009272721953266, 'bull_tp_mult': 2.494661781599414, 'bull_tsl_mult': 0.6554231596610303, 'bull_time_stop': 169, 'bull_use_sma': True, 'bull_use_ema': False, 'bull_use_atr': False, 'bull_use_adx': True, 'bull_use_spike': True, 'bull_rsi_required': False, 'bear_strategy': 'mean_reversion', 'bear_bb_std_mult': 3.1284648442286462, 'bear_rsi_os': 13, 'bear_rsi_ob': 77, 'bear_adx_thresh': 31.35983949774191, 'bear_atr_min_pct': 0.00039549830613903013, 'bear_atr_max_pct': 0.1250507741873186, 'bear_tp_mult': 1.6430485903475287, 'bear_tsl_mult': 0.11236561610673905, 'bear_time_stop': 84, 'bear_use_sma': True, 'bear_use_ema': False, 'bear_use_atr': True, 'bear_use_adx': False, 'bear_use_spike': False, 'bear_rsi_required': False, 'sideways_strategy': 'breakout', 'sideways_bb_std_mult': 1.5877680716200877, 'sideways_rsi_os': 41, 'sideways_rsi_ob': 67, 'sideways_adx_thresh': 9.818375491554924, 'sideways_atr_min_pct': 0.021418181898998637, 'sideways_atr_max_pct': 0.030300793855600958, 'sideways_tp_mult': 2.5073026871298816, 'sideways_tsl_mult': 0.47811073303342977, 'sideways_time_stop': 71, 'sideways_use_sma': False, 'sideways_use_ema': False, 'sideways_use_atr': True, 'sideways_use_adx': False, 'sideways_use_spike': True, 'sideways_rsi_required': True}.
[I 2025-09-01 08:33:01,493] Trial 446 finished with values: [-1000000000.0, 1000000000.0] and parameters: {'p_sma': 21, 'p_std': 30, 'p_atr': 11, 'p_adx': 23, 'rsi_period': 68, 'ema1': 12, 'ema2': 40, 'slip_atr_k': 0.05147656223309174, 'slip_spread_k': 0.8917007356079781, 'spread_hl_frac': 0.029873087201573643, 'bb_std_mult': 3.345545492642296, 'rsi_os': 25, 'rsi_ob': 55, 'vol_spike': 0.04742471516006881, 'adx_thresh': 23.950490939817684, 'atr_min_pct': 0.029710593851848287, 'atr_max_pct': 0.05985251971818717, 'tp_mult': 2.8969578772542963, 'tsl_mult': 0.558623779218181, 'strategy': 'mean_reversion', 'time_stop': 230, 'use_sma': True, 'use_atr': True, 'use_adx': True, 'use_ema': False, 'use_spike': False, 'rsi_required': True, 'edge_k': 0.44354092328373307, 'edge_cap': 0.0553104795744766, 'bull_strategy': 'breakout', 'bull_bb_std_mult': 2.8610389468387223, 'bull_rsi_os': 42, 'bull_rsi_ob': 82, 'bull_adx_thresh': 20.328338939807065, 'bull_atr_min_pct': 0.007881808158744084, 'bull_atr_max_pct': 0.03128215518627259, 'bull_tp_mult': 2.184750782365189, 'bull_tsl_mult': 0.6577021152668836, 'bull_time_stop': 173, 'bull_use_sma': True, 'bull_use_ema': False, 'bull_use_atr': False, 'bull_use_adx': True, 'bull_use_spike': True, 'bull_rsi_required': False, 'bear_strategy': 'mean_reversion', 'bear_bb_std_mult': 3.1714224014397336, 'bear_rsi_os': 13, 'bear_rsi_ob': 86, 'bear_adx_thresh': 33.675381817038435, 'bear_atr_min_pct': 0.02260296861041114, 'bear_atr_max_pct': 0.06870419075261584, 'bear_tp_mult': 2.7767391956889953, 'bear_tsl_mult': 0.006578002120115389, 'bear_time_stop': 193, 'bear_use_sma': True, 'bear_use_ema': False, 'bear_use_atr': True, 'bear_use_adx': False, 'bear_use_spike': False, 'bear_rsi_required': False, 'sideways_strategy': 'breakout', 'sideways_bb_std_mult': 1.7071659308056146, 'sideways_rsi_os': 42, 'sideways_rsi_ob': 67, 'sideways_adx_thresh': 9.659544712135173, 'sideways_atr_min_pct': 0.008118543356004756, 'sideways_atr_max_pct': 0.029935577178863117, 'sideways_tp_mult': 2.48547304634914, 'sideways_tsl_mult': 0.03554762594378966, 'sideways_time_stop': 20, 'sideways_use_sma': False, 'sideways_use_ema': False, 'sideways_use_atr': True, 'sideways_use_adx': False, 'sideways_use_spike': True, 'sideways_rsi_required': True}.
[I 2025-09-01 08:33:01,643] Trial 443 finished with values: [-1000000000.0, 1000000000.0] and parameters: {'p_sma': 37, 'p_std': 12, 'p_atr': 20, 'p_adx': 23, 'rsi_period': 51, 'ema1': 9, 'ema2': 39, 'slip_atr_k': 0.030840614351668974, 'slip_spread_k': 0.8706437684929754, 'spread_hl_frac': 0.021812956374780902, 'bb_std_mult': 3.3670528973871687, 'rsi_os': 18, 'rsi_ob': 55, 'vol_spike': 0.23674378780473837, 'adx_thresh': 23.906915709790958, 'atr_min_pct': 0.02161497072037576, 'atr_max_pct': 0.05744981346113348, 'tp_mult': 1.1860058038069392, 'tsl_mult': 0.6028102736968204, 'strategy': 'mean_reversion', 'time_stop': 16, 'use_sma': True, 'use_atr': True, 'use_adx': True, 'use_ema': True, 'use_spike': True, 'rsi_required': True, 'edge_k': 1.0443276229951843, 'edge_cap': 0.10796795730637349, 'bull_strategy': 'breakout', 'bull_bb_std_mult': 0.5040432464048872, 'bull_rsi_os': 18, 'bull_rsi_ob': 89, 'bull_adx_thresh': 24.980300452089736, 'bull_atr_min_pct': 0.015248384577136755, 'bull_atr_max_pct': 0.03935891949934431, 'bull_tp_mult': 2.416312993628761, 'bull_tsl_mult': 0.37111611748584594, 'bull_time_stop': 170, 'bull_use_sma': True, 'bull_use_ema': False, 'bull_use_atr': False, 'bull_use_adx': True, 'bull_use_spike': True, 'bull_rsi_required': False, 'bear_strategy': 'mean_reversion', 'bear_bb_std_mult': 2.9952596408102155, 'bear_rsi_os': 33, 'bear_rsi_ob': 93, 'bear_adx_thresh': 10.7968437908821, 'bear_atr_min_pct': 0.025570759131897977, 'bear_atr_max_pct': 0.08307976173757536, 'bear_tp_mult': 2.9182886417015372, 'bear_tsl_mult': 0.690216028496319, 'bear_time_stop': 298, 'bear_use_sma': True, 'bear_use_ema': False, 'bear_use_atr': True, 'bear_use_adx': False, 'bear_use_spike': False, 'bear_rsi_required': False, 'sideways_strategy': 'breakout', 'sideways_bb_std_mult': 1.509195007740113, 'sideways_rsi_os': 14, 'sideways_rsi_ob': 63, 'sideways_adx_thresh': 9.854210991760551, 'sideways_atr_min_pct': 0.008174764970480508, 'sideways_atr_max_pct': 0.10416791021891542, 'sideways_tp_mult': 2.489304210906019, 'sideways_tsl_mult': 0.1888192343281218, 'sideways_time_stop': 168, 'sideways_use_sma': False, 'sideways_use_ema': False, 'sideways_use_atr': True, 'sideways_use_adx': True, 'sideways_use_spike': True, 'sideways_rsi_required': True}.
[I 2025-09-01 08:33:01,867] Trial 444 finished with values: [-0.17165347792768282, 0.17142633756919412] and parameters: {'p_sma': 22, 'p_std': 12, 'p_atr': 12, 'p_adx': 20, 'rsi_period': 51, 'ema1': 11, 'ema2': 15, 'slip_atr_k': 0.10076340663159276, 'slip_spread_k': 0.5729705366875584, 'spread_hl_frac': 0.02219108085861242, 'bb_std_mult': 3.3558067839306736, 'rsi_os': 28, 'rsi_ob': 81, 'vol_spike': 0.09226631069070414, 'adx_thresh': 29.12909155002082, 'atr_min_pct': 0.02834099503284529, 'atr_max_pct': 0.1405690402219818, 'tp_mult': 1.5462824145560152, 'tsl_mult': 0.5501348365261167, 'strategy': 'mean_reversion', 'time_stop': 228, 'use_sma': True, 'use_atr': True, 'use_adx': True, 'use_ema': False, 'use_spike': True, 'rsi_required': True, 'edge_k': 1.0381174755772669, 'edge_cap': 0.051925103675603164, 'bull_strategy': 'breakout', 'bull_bb_std_mult': 3.5937738871531204, 'bull_rsi_os': 12, 'bull_rsi_ob': 72, 'bull_adx_thresh': 8.580350443155906, 'bull_atr_min_pct': 0.001481047355670988, 'bull_atr_max_pct': 0.12083845884636714, 'bull_tp_mult': 1.4911889954930333, 'bull_tsl_mult': 0.7666652047426756, 'bull_time_stop': 175, 'bull_use_sma': True, 'bull_use_ema': False, 'bull_use_atr': False, 'bull_use_adx': True, 'bull_use_spike': True, 'bull_rsi_required': False, 'bear_strategy': 'mean_reversion', 'bear_bb_std_mult': 3.009828247107552, 'bear_rsi_os': 52, 'bear_rsi_ob': 62, 'bear_adx_thresh': 29.74756783947135, 'bear_atr_min_pct': 0.014332627923474494, 'bear_atr_max_pct': 0.08353802299936354, 'bear_tp_mult': 2.7686991279324324, 'bear_tsl_mult': 0.7252416004406232, 'bear_time_stop': 83, 'bear_use_sma': True, 'bear_use_ema': False, 'bear_use_atr': True, 'bear_use_adx': False, 'bear_use_spike': False, 'bear_rsi_required': False, 'sideways_strategy': 'breakout', 'sideways_bb_std_mult': 0.6211122677903446, 'sideways_rsi_os': 52, 'sideways_rsi_ob': 67, 'sideways_adx_thresh': 9.853722131615724, 'sideways_atr_min_pct': 0.022647842847943637, 'sideways_atr_max_pct': 0.031188458742716047, 'sideways_tp_mult': 1.5364789622246635, 'sideways_tsl_mult': 0.1890571842459486, 'sideways_time_stop': 167, 'sideways_use_sma': False, 'sideways_use_ema': False, 'sideways_use_atr': True, 'sideways_use_adx': True, 'sideways_use_spike': True, 'sideways_rsi_required': True}.
[I 2025-09-01 08:33:45,657] Trial 447 finished with values: [-0.09698568947697828, 0.09753827600019813] and parameters: {'p_sma': 18, 'p_std': 12, 'p_atr': 8, 'p_adx': 20, 'rsi_period': 68, 'ema1': 12, 'ema2': 37, 'slip_atr_k': 0.17525136492532728, 'slip_spread_k': 0.6249600071658684, 'spread_hl_frac': 0.011137305004977102, 'bb_std_mult': 3.4537349905446075, 'rsi_os': 21, 'rsi_ob': 56, 'vol_spike': 0.047612118718056276, 'adx_thresh': 17.539623600190904, 'atr_min_pct': 0.019962922859069244, 'atr_max_pct': 0.14088587944434916, 'tp_mult': 1.5326943812832288, 'tsl_mult': 0.8974328491867789, 'strategy': 'mean_reversion', 'time_stop': 261, 'use_sma': True, 'use_atr': True, 'use_adx': True, 'use_ema': False, 'use_spike': True, 'rsi_required': True, 'edge_k': 1.3467313171873785, 'edge_cap': 0.1120248092075962, 'bull_strategy': 'breakout', 'bull_bb_std_mult': 2.843551220544883, 'bull_rsi_os': 38, 'bull_rsi_ob': 70, 'bull_adx_thresh': 33.8424947806587, 'bull_atr_min_pct': 0.0014167622573954125, 'bull_atr_max_pct': 0.14147507818829896, 'bull_tp_mult': 2.3758661206452474, 'bull_tsl_mult': 0.6703819330636723, 'bull_time_stop': 156, 'bull_use_sma': True, 'bull_use_ema': False, 'bull_use_atr': True, 'bull_use_adx': False, 'bull_use_spike': False, 'bull_rsi_required': False, 'bear_strategy': 'mean_reversion', 'bear_bb_std_mult': 3.1983333962502027, 'bear_rsi_os': 32, 'bear_rsi_ob': 62, 'bear_adx_thresh': 33.577033030340594, 'bear_atr_min_pct': 0.016036758163984567, 'bear_atr_max_pct': 0.0674167506822933, 'bear_tp_mult': 2.7657652159887394, 'bear_tsl_mult': 0.4321784919030967, 'bear_time_stop': 91, 'bear_use_sma': True, 'bear_use_ema': False, 'bear_use_atr': True, 'bear_use_adx': False, 'bear_use_spike': False, 'bear_rsi_required': False, 'sideways_strategy': 'breakout', 'sideways_bb_std_mult': 0.6186026251541745, 'sideways_rsi_os': 42, 'sideways_rsi_ob': 65, 'sideways_adx_thresh': 15.893710615690477, 'sideways_atr_min_pct': 0.02359555915317359, 'sideways_atr_max_pct': 0.03827960039677384, 'sideways_tp_mult': 2.6296689172875998, 'sideways_tsl_mult': 0.5546498773049587, 'sideways_time_stop': 19, 'sideways_use_sma': False, 'sideways_use_ema': False, 'sideways_use_atr': True, 'sideways_use_adx': True, 'sideways_use_spike': True, 'sideways_rsi_required': True}.
[I 2025-09-01 08:33:46,513] Trial 448 finished with values: [-0.12161104332869976, 0.12139153973588215] and parameters: {'p_sma': 18, 'p_std': 8, 'p_atr': 29, 'p_adx': 20, 'rsi_period': 48, 'ema1': 11, 'ema2': 13, 'slip_atr_k': 0.07265521260012334, 'slip_spread_k': 0.40530018840824655, 'spread_hl_frac': 0.04870347255345482, 'bb_std_mult': 3.4552600218932357, 'rsi_os': 24, 'rsi_ob': 93, 'vol_spike': 0.14319129326113186, 'adx_thresh': 25.338533574145856, 'atr_min_pct': 0.020078019933630946, 'atr_max_pct': 0.14296783773596905, 'tp_mult': 1.5415993904722145, 'tsl_mult': 0.46589892898948376, 'strategy': 'breakout', 'time_stop': 133, 'use_sma': False, 'use_atr': True, 'use_adx': True, 'use_ema': True, 'use_spike': True, 'rsi_required': True, 'edge_k': 0.9804340769167789, 'edge_cap': 0.2558984431832631, 'bull_strategy': 'mean_reversion', 'bull_bb_std_mult': 2.008197162105656, 'bull_rsi_os': 38, 'bull_rsi_ob': 72, 'bull_adx_thresh': 8.342394304452597, 'bull_atr_min_pct': 0.0023925320344907824, 'bull_atr_max_pct': 0.12090408683329507, 'bull_tp_mult': 1.593518707368452, 'bull_tsl_mult': 0.7631830984762317, 'bull_time_stop': 156, 'bull_use_sma': False, 'bull_use_ema': False, 'bull_use_atr': True, 'bull_use_adx': False, 'bull_use_spike': False, 'bull_rsi_required': True, 'bear_strategy': 'breakout', 'bear_bb_std_mult': 1.2865385931036584, 'bear_rsi_os': 35, 'bear_rsi_ob': 79, 'bear_adx_thresh': 21.355436707456672, 'bear_atr_min_pct': 0.0231001911475524, 'bear_atr_max_pct': 0.010134015857719073, 'bear_tp_mult': 2.7550316912521415, 'bear_tsl_mult': 0.22804142776374586, 'bear_time_stop': 70, 'bear_use_sma': False, 'bear_use_ema': True, 'bear_use_atr': True, 'bear_use_adx': True, 'bear_use_spike': True, 'bear_rsi_required': True, 'sideways_strategy': 'mean_reversion', 'sideways_bb_std_mult': 2.938585056473626, 'sideways_rsi_os': 36, 'sideways_rsi_ob': 65, 'sideways_adx_thresh': 8.164138253687224, 'sideways_atr_min_pct': 0.023570796557236078, 'sideways_atr_max_pct': 0.02651211247514995, 'sideways_tp_mult': 1.7696700573083188, 'sideways_tsl_mult': 0.14069265773614748, 'sideways_time_stop': 18, 'sideways_use_sma': False, 'sideways_use_ema': True, 'sideways_use_atr': False, 'sideways_use_adx': True, 'sideways_use_spike': False, 'sideways_rsi_required': False}.
[I 2025-09-01 08:33:46,966] Trial 450 finished with values: [-1000000000.0, 1000000000.0] and parameters: {'p_sma': 14, 'p_std': 8, 'p_atr': 7, 'p_adx': 22, 'rsi_period': 64, 'ema1': 8, 'ema2': 37, 'slip_atr_k': 0.07152695297887057, 'slip_spread_k': 0.6292810871280767, 'spread_hl_frac': 0.02556630835382798, 'bb_std_mult': 2.6021432728568077, 'rsi_os': 24, 'rsi_ob': 56, 'vol_spike': 0.1027260765502499, 'adx_thresh': 22.425774556267402, 'atr_min_pct': 0.022581310328152214, 'atr_max_pct': 0.1476149293458986, 'tp_mult': 1.3304592334792944, 'tsl_mult': 0.4595831032756199, 'strategy': 'breakout', 'time_stop': 210, 'use_sma': False, 'use_atr': True, 'use_adx': True, 'use_ema': True, 'use_spike': True, 'rsi_required': True, 'edge_k': 1.350450242847124, 'edge_cap': 0.9928089702099824, 'bull_strategy': 'mean_reversion', 'bull_bb_std_mult': 1.4997166970272473, 'bull_rsi_os': 32, 'bull_rsi_ob': 64, 'bull_adx_thresh': 9.948624987283154, 'bull_atr_min_pct': 0.0059876074994543805, 'bull_atr_max_pct': 0.07581014148805669, 'bull_tp_mult': 2.368858461526093, 'bull_tsl_mult': 0.6182820515520525, 'bull_time_stop': 156, 'bull_use_sma': False, 'bull_use_ema': False, 'bull_use_atr': True, 'bull_use_adx': False, 'bull_use_spike': False, 'bull_rsi_required': True, 'bear_strategy': 'breakout', 'bear_bb_std_mult': 3.1981206374579, 'bear_rsi_os': 15, 'bear_rsi_ob': 95, 'bear_adx_thresh': 18.142857321343104, 'bear_atr_min_pct': 0.02899984435321245, 'bear_atr_max_pct': 0.030692431072749042, 'bear_tp_mult': 2.839246774297555, 'bear_tsl_mult': 0.12256016907201239, 'bear_time_stop': 235, 'bear_use_sma': False, 'bear_use_ema': True, 'bear_use_atr': True, 'bear_use_adx': True, 'bear_use_spike': True, 'bear_rsi_required': True, 'sideways_strategy': 'mean_reversion', 'sideways_bb_std_mult': 1.3532432736141535, 'sideways_rsi_os': 36, 'sideways_rsi_ob': 65, 'sideways_adx_thresh': 24.520519243012856, 'sideways_atr_min_pct': 0.02359583825231157, 'sideways_atr_max_pct': 0.02607588051057052, 'sideways_tp_mult': 2.6332188462295387, 'sideways_tsl_mult': 0.1482954372012503, 'sideways_time_stop': 261, 'sideways_use_sma': False, 'sideways_use_ema': True, 'sideways_use_atr': False, 'sideways_use_adx': True, 'sideways_use_spike': False, 'sideways_rsi_required': False}.
