[I 2025-09-01 07:54:54,042] Trial 216 finished with values: [-1000000000.0, 1000000000.0] and parameters: {'p_sma': 22, 'p_std': 15, 'p_atr': 23, 'p_adx': 21, 'rsi_period': 67, 'ema1': 10, 'ema2': 36, 'slip_atr_k': 0.055408101970058486, 'slip_spread_k': 0.30839401321615767, 'spread_hl_frac': 0.022127061851948245, 'bb_std_mult': 3.4266313398905477, 'rsi_os': 23, 'rsi_ob': 56, 'vol_spike': 0.24170971102412908, 'adx_thresh': 23.903483209868174, 'atr_min_pct': 0.02564835029881352, 'atr_max_pct': 0.1469188444309368, 'tp_mult': 1.0773134920314114, 'tsl_mult': 0.5242638893746002, 'strategy': 'mean_reversion', 'time_stop': 241, 'use_sma': True, 'use_atr': False, 'use_adx': True, 'use_ema': True, 'use_spike': False, 'rsi_required': False, 'edge_k': 1.869633724608796, 'edge_cap': 0.5726835938632626, 'bull_strategy': 'breakout', 'bull_bb_std_mult': 2.909650411259414, 'bull_rsi_os': 46, 'bull_rsi_ob': 55, 'bull_adx_thresh': 12.902115100457124, 'bull_atr_min_pct': 0.007608969650735179, 'bull_atr_max_pct': 0.042126875227818404, 'bull_tp_mult': 2.3663380833671295, 'bull_tsl_mult': 0.3249946059455262, 'bull_time_stop': 214, 'bull_use_sma': True, 'bull_use_ema': True, 'bull_use_atr': True, 'bull_use_adx': True, 'bull_use_spike': False, 'bull_rsi_required': False, 'bear_strategy': 'mean_reversion', 'bear_bb_std_mult': 1.4108780635732034, 'bear_rsi_os': 28, 'bear_rsi_ob': 93, 'bear_adx_thresh': 18.22898621241707, 'bear_atr_min_pct': 0.02344753391829781, 'bear_atr_max_pct': 0.07927251844561418, 'bear_tp_mult': 1.2551833641474812, 'bear_tsl_mult': 0.09384868897134466, 'bear_time_stop': 204, 'bear_use_sma': False, 'bear_use_ema': False, 'bear_use_atr': True, 'bear_use_adx': True, 'bear_use_spike': False, 'bear_rsi_required': False, 'sideways_strategy': 'mean_reversion', 'sideways_bb_std_mult': 2.0896420606358745, 'sideways_rsi_os': 10, 'sideways_rsi_ob': 65, 'sideways_adx_thresh': 22.391281004905856, 'sideways_atr_min_pct': 0.014382127485341439, 'sideways_atr_max_pct': 0.05097611236355602, 'sideways_tp_mult': 2.594376613698294, 'sideways_tsl_mult': 0.10916557006870978, 'sideways_time_stop': 186, 'sideways_use_sma': False, 'sideways_use_ema': False, 'sideways_use_atr': False, 'sideways_use_adx': True, 'sideways_use_spike': True, 'sideways_rsi_required': False}.
[I 2025-09-01 07:54:54,348] Trial 217 finished with values: [-1000000000.0, 1000000000.0] and parameters: {'p_sma': 29, 'p_std': 18, 'p_atr': 16, 'p_adx': 25, 'rsi_period': 68, 'ema1': 10, 'ema2': 11, 'slip_atr_k': 0.20203708142337584, 'slip_spread_k': 0.6580867011769098, 'spread_hl_frac': 0.03680110547615195, 'bb_std_mult': 2.406393147150055, 'rsi_os': 41, 'rsi_ob': 56, 'vol_spike': 0.2372869075585243, 'adx_thresh': 13.211604735565551, 'atr_min_pct': 0.02158479144776366, 'atr_max_pct': 0.14680697112541088, 'tp_mult': 2.093213505046607, 'tsl_mult': 0.516359152983773, 'strategy': 'mean_reversion', 'time_stop': 97, 'use_sma': True, 'use_atr': False, 'use_adx': True, 'use_ema': True, 'use_spike': False, 'rsi_required': True, 'edge_k': 0.17553147302880612, 'edge_cap': 0.08871557027841635, 'bull_strategy': 'breakout', 'bull_bb_std_mult': 2.9324912634790166, 'bull_rsi_os': 46, 'bull_rsi_ob': 70, 'bull_adx_thresh': 15.670839480056491, 'bull_atr_min_pct': 0.013148467949867963, 'bull_atr_max_pct': 0.04397192684244388, 'bull_tp_mult': 2.351419487296173, 'bull_tsl_mult': 0.6268038688027779, 'bull_time_stop': 136, 'bull_use_sma': False, 'bull_use_ema': True, 'bull_use_atr': False, 'bull_use_adx': True, 'bull_use_spike': True, 'bull_rsi_required': False, 'bear_strategy': 'mean_reversion', 'bear_bb_std_mult': 3.2740918538976937, 'bear_rsi_os': 28, 'bear_rsi_ob': 93, 'bear_adx_thresh': 31.52627994622934, 'bear_atr_min_pct': 0.013971160490917053, 'bear_atr_max_pct': 0.0854908650278954, 'bear_tp_mult': 2.71038601924246, 'bear_tsl_mult': 0.0939010295840755, 'bear_time_stop': 181, 'bear_use_sma': False, 'bear_use_ema': False, 'bear_use_atr': True, 'bear_use_adx': True, 'bear_use_spike': True, 'bear_rsi_required': False, 'sideways_strategy': 'mean_reversion', 'sideways_bb_std_mult': 3.413278600010006, 'sideways_rsi_os': 16, 'sideways_rsi_ob': 64, 'sideways_adx_thresh': 31.496059700229914, 'sideways_atr_min_pct': 0.014370961475189455, 'sideways_atr_max_pct': 0.032622228460158345, 'sideways_tp_mult': 2.5859559050343495, 'sideways_tsl_mult': 0.5070745459850633, 'sideways_time_stop': 29, 'sideways_use_sma': False, 'sideways_use_ema': False, 'sideways_use_atr': False, 'sideways_use_adx': True, 'sideways_use_spike': True, 'sideways_rsi_required': False}.
[I 2025-09-01 07:54:54,652] Trial 215 finished with values: [-1000000000.0, 1000000000.0] and parameters: {'p_sma': 22, 'p_std': 15, 'p_atr': 23, 'p_adx': 21, 'rsi_period': 67, 'ema1': 10, 'ema2': 12, 'slip_atr_k': 0.05554260632324096, 'slip_spread_k': 0.6530753939943675, 'spread_hl_frac': 0.0198740136508694, 'bb_std_mult': 3.4316103610123627, 'rsi_os': 23, 'rsi_ob': 56, 'vol_spike': 0.24215894757487544, 'adx_thresh': 31.31319681123952, 'atr_min_pct': 0.01573310086805735, 'atr_max_pct': 0.14761333541382538, 'tp_mult': 1.081309730040198, 'tsl_mult': 0.48425645837786124, 'strategy': 'mean_reversion', 'time_stop': 244, 'use_sma': True, 'use_atr': False, 'use_adx': True, 'use_ema': False, 'use_spike': False, 'rsi_required': False, 'edge_k': 1.7265099988796981, 'edge_cap': 0.0932200213242925, 'bull_strategy': 'breakout', 'bull_bb_std_mult': 1.514815572082321, 'bull_rsi_os': 20, 'bull_rsi_ob': 70, 'bull_adx_thresh': 17.648660622074388, 'bull_atr_min_pct': 0.013140635748230309, 'bull_atr_max_pct': 0.04251020242675194, 'bull_tp_mult': 2.3678340484376723, 'bull_tsl_mult': 0.6246642100818522, 'bull_time_stop': 142, 'bull_use_sma': True, 'bull_use_ema': True, 'bull_use_atr': True, 'bull_use_adx': True, 'bull_use_spike': False, 'bull_rsi_required': False, 'bear_strategy': 'mean_reversion', 'bear_bb_std_mult': 1.3829028105413115, 'bear_rsi_os': 25, 'bear_rsi_ob': 93, 'bear_adx_thresh': 31.814694684353228, 'bear_atr_min_pct': 0.02348156932128005, 'bear_atr_max_pct': 0.08578018871205757, 'bear_tp_mult': 1.5258866358177547, 'bear_tsl_mult': 0.09957202399277199, 'bear_time_stop': 261, 'bear_use_sma': False, 'bear_use_ema': False, 'bear_use_atr': False, 'bear_use_adx': True, 'bear_use_spike': False, 'bear_rsi_required': False, 'sideways_strategy': 'mean_reversion', 'sideways_bb_std_mult': 3.3841885594234364, 'sideways_rsi_os': 10, 'sideways_rsi_ob': 63, 'sideways_adx_thresh': 9.541046897966265, 'sideways_atr_min_pct': 0.022994511539044898, 'sideways_atr_max_pct': 0.04028762164171279, 'sideways_tp_mult': 1.8435097992259102, 'sideways_tsl_mult': 0.1814543398414709, 'sideways_time_stop': 190, 'sideways_use_sma': False, 'sideways_use_ema': True, 'sideways_use_atr': False, 'sideways_use_adx': True, 'sideways_use_spike': True, 'sideways_rsi_required': False}.
[I 2025-09-01 07:54:55,547] Trial 221 finished with values: [-1000000000.0, 1000000000.0] and parameters: {'p_sma': 19, 'p_std': 12, 'p_atr': 14, 'p_adx': 19, 'rsi_period': 16, 'ema1': 9, 'ema2': 16, 'slip_atr_k': 0.04671690588784582, 'slip_spread_k': 0.6335112414061557, 'spread_hl_frac': 0.025326023170408773, 'bb_std_mult': 3.4781078773210345, 'rsi_os': 33, 'rsi_ob': 54, 'vol_spike': 0.22986126896104442, 'adx_thresh': 30.871630332083576, 'atr_min_pct': 0.022714966009284285, 'atr_max_pct': 0.014081045646007248, 'tp_mult': 2.9573254675256804, 'tsl_mult': 0.4633662693847028, 'strategy': 'breakout', 'time_stop': 249, 'use_sma': False, 'use_atr': True, 'use_adx': False, 'use_ema': True, 'use_spike': True, 'rsi_required': True, 'edge_k': 0.9535129280074204, 'edge_cap': 0.06990372101481465, 'bull_strategy': 'mean_reversion', 'bull_bb_std_mult': 2.036446233821416, 'bull_rsi_os': 20, 'bull_rsi_ob': 77, 'bull_adx_thresh': 11.714363875519574, 'bull_atr_min_pct': 0.014909476636537067, 'bull_atr_max_pct': 0.05254002097811819, 'bull_tp_mult': 2.918919489365488, 'bull_tsl_mult': 0.6825521208626381, 'bull_time_stop': 229, 'bull_use_sma': True, 'bull_use_ema': False, 'bull_use_atr': False, 'bull_use_adx': True, 'bull_use_spike': True, 'bull_rsi_required': True, 'bear_strategy': 'breakout', 'bear_bb_std_mult': 3.1421145863928195, 'bear_rsi_os': 25, 'bear_rsi_ob': 75, 'bear_adx_thresh': 32.56369898992815, 'bear_atr_min_pct': 0.0020427231309590767, 'bear_atr_max_pct': 0.11027305269574052, 'bear_tp_mult': 2.8742620647125627, 'bear_tsl_mult': 0.032460801559662134, 'bear_time_stop': 20, 'bear_use_sma': True, 'bear_use_ema': False, 'bear_use_atr': True, 'bear_use_adx': True, 'bear_use_spike': True, 'bear_rsi_required': False, 'sideways_strategy': 'mean_reversion', 'sideways_bb_std_mult': 2.3306877733031, 'sideways_rsi_os': 38, 'sideways_rsi_ob': 83, 'sideways_adx_thresh': 25.303162848818612, 'sideways_atr_min_pct': 0.021472306015026858, 'sideways_atr_max_pct': 0.010683292905097758, 'sideways_tp_mult': 1.7807186471088863, 'sideways_tsl_mult': 0.18532616291522636, 'sideways_time_stop': 12, 'sideways_use_sma': True, 'sideways_use_ema': False, 'sideways_use_atr': False, 'sideways_use_adx': False, 'sideways_use_spike': False, 'sideways_rsi_required': True}.
[I 2025-09-01 07:55:37,241] Trial 220 finished with values: [-1000000000.0, 1000000000.0] and parameters: {'p_sma': 19, 'p_std': 39, 'p_atr': 14, 'p_adx': 19, 'rsi_period': 58, 'ema1': 11, 'ema2': 16, 'slip_atr_k': 0.2008575645275778, 'slip_spread_k': 0.6579425305834877, 'spread_hl_frac': 0.008968123731319298, 'bb_std_mult': 1.471988778122042, 'rsi_os': 24, 'rsi_ob': 80, 'vol_spike': 0.23326733813139444, 'adx_thresh': 13.05479157098338, 'atr_min_pct': 0.020016250902608612, 'atr_max_pct': 0.1436874827842075, 'tp_mult': 1.1841767964619616, 'tsl_mult': 0.45227640937166413, 'strategy': 'mean_reversion', 'time_stop': 251, 'use_sma': True, 'use_atr': True, 'use_adx': True, 'use_ema': True, 'use_spike': True, 'rsi_required': True, 'edge_k': 0.5969959896209538, 'edge_cap': 0.09127274245848582, 'bull_strategy': 'breakout', 'bull_bb_std_mult': 1.5170386953143056, 'bull_rsi_os': 20, 'bull_rsi_ob': 91, 'bull_adx_thresh': 18.528282180064714, 'bull_atr_min_pct': 0.026399225936078536, 'bull_atr_max_pct': 0.05321167432859027, 'bull_tp_mult': 1.797477527404444, 'bull_tsl_mult': 0.6828822320841362, 'bull_time_stop': 164, 'bull_use_sma': True, 'bull_use_ema': False, 'bull_use_atr': False, 'bull_use_adx': True, 'bull_use_spike': True, 'bull_rsi_required': False, 'bear_strategy': 'mean_reversion', 'bear_bb_std_mult': 0.6112356519829281, 'bear_rsi_os': 25, 'bear_rsi_ob': 46, 'bear_adx_thresh': 31.831004666595803, 'bear_atr_min_pct': 0.017553544213122527, 'bear_atr_max_pct': 0.1433060374585589, 'bear_tp_mult': 2.8707175012083748, 'bear_tsl_mult': 0.09834291022602701, 'bear_time_stop': 181, 'bear_use_sma': True, 'bear_use_ema': False, 'bear_use_atr': True, 'bear_use_adx': True, 'bear_use_spike': True, 'bear_rsi_required': False, 'sideways_strategy': 'mean_reversion', 'sideways_bb_std_mult': 1.9869866773365126, 'sideways_rsi_os': 50, 'sideways_rsi_ob': 82, 'sideways_adx_thresh': 9.228384369901805, 'sideways_atr_min_pct': 0.002744348740505661, 'sideways_atr_max_pct': 0.03384820986604675, 'sideways_tp_mult': 2.353198081310695, 'sideways_tsl_mult': 0.1814193911978723, 'sideways_time_stop': 29, 'sideways_use_sma': False, 'sideways_use_ema': False, 'sideways_use_atr': False, 'sideways_use_adx': True, 'sideways_use_spike': True, 'sideways_rsi_required': True}.
[I 2025-09-01 07:55:38,002] Trial 222 finished with values: [-1000000000.0, 1000000000.0] and parameters: {'p_sma': 56, 'p_std': 39, 'p_atr': 18, 'p_adx': 11, 'rsi_period': 65, 'ema1': 30, 'ema2': 33, 'slip_atr_k': 0.03865083442352618, 'slip_spread_k': 0.5254709830869908, 'spread_hl_frac': 0.009031434648559558, 'bb_std_mult': 3.349886281780894, 'rsi_os': 33, 'rsi_ob': 54, 'vol_spike': 0.29913515692883064, 'adx_thresh': 26.102074162924346, 'atr_min_pct': 0.029264161539821112, 'atr_max_pct': 0.09915439481613703, 'tp_mult': 2.910321822508548, 'tsl_mult': 0.9844194037131521, 'strategy': 'breakout', 'time_stop': 253, 'use_sma': False, 'use_atr': True, 'use_adx': False, 'use_ema': True, 'use_spike': True, 'rsi_required': True, 'edge_k': 0.6022032937912253, 'edge_cap': 0.07167198297938474, 'bull_strategy': 'mean_reversion', 'bull_bb_std_mult': 1.1792171532222373, 'bull_rsi_os': 34, 'bull_rsi_ob': 72, 'bull_adx_thresh': 6.732749653627685, 'bull_atr_min_pct': 0.0182715566796042, 'bull_atr_max_pct': 0.04737245729089445, 'bull_tp_mult': 1.791630205630271, 'bull_tsl_mult': 0.6828132314256412, 'bull_time_stop': 122, 'bull_use_sma': True, 'bull_use_ema': False, 'bull_use_atr': False, 'bull_use_adx': True, 'bull_use_spike': True, 'bull_rsi_required': True, 'bear_strategy': 'breakout', 'bear_bb_std_mult': 1.9691021181966313, 'bear_rsi_os': 10, 'bear_rsi_ob': 94, 'bear_adx_thresh': 30.8335944611174, 'bear_atr_min_pct': 0.024661822215346733, 'bear_atr_max_pct': 0.08033913576115068, 'bear_tp_mult': 2.8782926290449216, 'bear_tsl_mult': 0.7107252796034834, 'bear_time_stop': 19, 'bear_use_sma': True, 'bear_use_ema': True, 'bear_use_atr': True, 'bear_use_adx': True, 'bear_use_spike': True, 'bear_rsi_required': False, 'sideways_strategy': 'breakout', 'sideways_bb_std_mult': 2.5400437451537234, 'sideways_rsi_os': 38, 'sideways_rsi_ob': 86, 'sideways_adx_thresh': 8.972823680433748, 'sideways_atr_min_pct': 0.02158135432905683, 'sideways_atr_max_pct': 0.020346852756150773, 'sideways_tp_mult': 1.7843528798529846, 'sideways_tsl_mult': 0.1580324892011992, 'sideways_time_stop': 15, 'sideways_use_sma': True, 'sideways_use_ema': False, 'sideways_use_atr': True, 'sideways_use_adx': False, 'sideways_use_spike': False, 'sideways_rsi_required': True}.
[I 2025-09-01 07:55:38,308] Trial 223 finished with values: [-0.11411887650781005, 0.11499243109628624] and parameters: {'p_sma': 56, 'p_std': 27, 'p_atr': 18, 'p_adx': 19, 'rsi_period': 23, 'ema1': 11, 'ema2': 49, 'slip_atr_k': 0.07416406492853492, 'slip_spread_k': 0.5944536923465732, 'spread_hl_frac': 0.011529572773070491, 'bb_std_mult': 0.9000392131525372, 'rsi_os': 24, 'rsi_ob': 55, 'vol_spike': 0.024562421652045613, 'adx_thresh': 34.15947768477346, 'atr_min_pct': 0.019960641666380893, 'atr_max_pct': 0.14428082467657513, 'tp_mult': 1.2526682451277171, 'tsl_mult': 0.99145770465605, 'strategy': 'mean_reversion', 'time_stop': 196, 'use_sma': True, 'use_atr': True, 'use_adx': True, 'use_ema': True, 'use_spike': True, 'rsi_required': True, 'edge_k': 0.5834037921942947, 'edge_cap': 0.06793916619320672, 'bull_strategy': 'breakout', 'bull_bb_std_mult': 0.815962554101626, 'bull_rsi_os': 34, 'bull_rsi_ob': 67, 'bull_adx_thresh': 18.818343905769936, 'bull_atr_min_pct': 4.9964242286332054e-05, 'bull_atr_max_pct': 0.04759534465996365, 'bull_tp_mult': 2.490733926613737, 'bull_tsl_mult': 0.6837780143672605, 'bull_time_stop': 169, 'bull_use_sma': True, 'bull_use_ema': False, 'bull_use_atr': False, 'bull_use_adx': True, 'bull_use_spike': True, 'bull_rsi_required': False, 'bear_strategy': 'mean_reversion', 'bear_bb_std_mult': 1.6982447107320633, 'bear_rsi_os': 23, 'bear_rsi_ob': 94, 'bear_adx_thresh': 30.828019724990728, 'bear_atr_min_pct': 0.0250525182704869, 'bear_atr_max_pct': 0.12655528624782006, 'bear_tp_mult': 2.9972980576642394, 'bear_tsl_mult': 0.9254843504121022, 'bear_time_stop': 137, 'bear_use_sma': False, 'bear_use_ema': True, 'bear_use_atr': True, 'bear_use_adx': True, 'bear_use_spike': True, 'bear_rsi_required': False, 'sideways_strategy': 'breakout', 'sideways_bb_std_mult': 0.680427716049971, 'sideways_rsi_os': 37, 'sideways_rsi_ob': 67, 'sideways_adx_thresh': 28.916043069908987, 'sideways_atr_min_pct': 0.02382390048250462, 'sideways_atr_max_pct': 0.021377557728944417, 'sideways_tp_mult': 2.484185270434036, 'sideways_tsl_mult': 0.9998309859128118, 'sideways_time_stop': 37, 'sideways_use_sma': False, 'sideways_use_ema': False, 'sideways_use_atr': True, 'sideways_use_adx': True, 'sideways_use_spike': True, 'sideways_rsi_required': False}.
[I 2025-09-01 07:55:38,324] Trial 219 finished with values: [-1000000000.0, 1000000000.0] and parameters: {'p_sma': 40, 'p_std': 15, 'p_atr': 18, 'p_adx': 25, 'rsi_period': 68, 'ema1': 10, 'ema2': 16, 'slip_atr_k': 0.046640639685374366, 'slip_spread_k': 0.653817676158426, 'spread_hl_frac': 0.00957466577396913, 'bb_std_mult': 0.888919692907246, 'rsi_os': 24, 'rsi_ob': 56, 'vol_spike': 0.16444109400856344, 'adx_thresh': 7.794094449679374, 'atr_min_pct': 0.029489779522408242, 'atr_max_pct': 0.03065275592399401, 'tp_mult': 1.08567219650611, 'tsl_mult': 0.5253528874042862, 'strategy': 'mean_reversion', 'time_stop': 98, 'use_sma': True, 'use_atr': False, 'use_adx': True, 'use_ema': True, 'use_spike': False, 'rsi_required': True, 'edge_k': 0.9499773518429884, 'edge_cap': 0.09204680647106459, 'bull_strategy': 'breakout', 'bull_bb_std_mult': 1.7416114753622356, 'bull_rsi_os': 44, 'bull_rsi_ob': 91, 'bull_adx_thresh': 9.32951901936882, 'bull_atr_min_pct': 0.01316590479080839, 'bull_atr_max_pct': 0.04348399444286706, 'bull_tp_mult': 2.3728980053822535, 'bull_tsl_mult': 0.6268884882811214, 'bull_time_stop': 168, 'bull_use_sma': True, 'bull_use_ema': True, 'bull_use_atr': False, 'bull_use_adx': True, 'bull_use_spike': True, 'bull_rsi_required': False, 'bear_strategy': 'mean_reversion', 'bear_bb_std_mult': 0.6918173372370195, 'bear_rsi_os': 25, 'bear_rsi_ob': 92, 'bear_adx_thresh': 31.644577632362154, 'bear_atr_min_pct': 0.023595265705909266, 'bear_atr_max_pct': 0.0794968193856608, 'bear_tp_mult': 1.1133564689024276, 'bear_tsl_mult': 0.09708240263756336, 'bear_time_stop': 27, 'bear_use_sma': False, 'bear_use_ema': False, 'bear_use_atr': True, 'bear_use_adx': True, 'bear_use_spike': True, 'bear_rsi_required': False, 'sideways_strategy': 'mean_reversion', 'sideways_bb_std_mult': 2.271642694107936, 'sideways_rsi_os': 50, 'sideways_rsi_ob': 47, 'sideways_adx_thresh': 31.826262395387836, 'sideways_atr_min_pct': 0.02152228088546283, 'sideways_atr_max_pct': 0.05154324961472151, 'sideways_tp_mult': 2.3597514699555715, 'sideways_tsl_mult': 0.17813525147926307, 'sideways_time_stop': 30, 'sideways_use_sma': False, 'sideways_use_ema': False, 'sideways_use_atr': False, 'sideways_use_adx': True, 'sideways_use_spike': True, 'sideways_rsi_required': False}.
[I 2025-09-01 07:56:20,867] Trial 227 finished with values: [-0.05528993976306085, 0.055001759207594036] and parameters: {'p_sma': 20, 'p_std': 17, 'p_atr': 9, 'p_adx': 20, 'rsi_period': 62, 'ema1': 17, 'ema2': 13, 'slip_atr_k': 0.06624009712940138, 'slip_spread_k': 0.27063493675126293, 'spread_hl_frac': 0.02360121715523981, 'bb_std_mult': 1.8365540686241657, 'rsi_os': 27, 'rsi_ob': 72, 'vol_spike': 0.12786335709943902, 'adx_thresh': 25.01562814981623, 'atr_min_pct': 0.023749890329038216, 'atr_max_pct': 0.14969288033016792, 'tp_mult': 1.1507249267282647, 'tsl_mult': 0.8413380077068723, 'strategy': 'mean_reversion', 'time_stop': 235, 'use_sma': True, 'use_atr': True, 'use_adx': True, 'use_ema': True, 'use_spike': True, 'rsi_required': True, 'edge_k': 0.9980927572922178, 'edge_cap': 0.12871396676117572, 'bull_strategy': 'breakout', 'bull_bb_std_mult': 2.8463461232479634, 'bull_rsi_os': 14, 'bull_rsi_ob': 69, 'bull_adx_thresh': 7.178570624225347, 'bull_atr_min_pct': 0.009717064175893277, 'bull_atr_max_pct': 0.039215871523804915, 'bull_tp_mult': 2.019929381530315, 'bull_tsl_mult': 0.6428246154556516, 'bull_time_stop': 108, 'bull_use_sma': False, 'bull_use_ema': False, 'bull_use_atr': False, 'bull_use_adx': False, 'bull_use_spike': True, 'bull_rsi_required': False, 'bear_strategy': 'mean_reversion', 'bear_bb_std_mult': 3.0505578842612184, 'bear_rsi_os': 43, 'bear_rsi_ob': 48, 'bear_adx_thresh': 33.110213995906676, 'bear_atr_min_pct': 0.02282872393688297, 'bear_atr_max_pct': 0.07454867923738154, 'bear_tp_mult': 1.907707499007793, 'bear_tsl_mult': 0.06722149561290958, 'bear_time_stop': 173, 'bear_use_sma': False, 'bear_use_ema': False, 'bear_use_atr': True, 'bear_use_adx': False, 'bear_use_spike': True, 'bear_rsi_required': True, 'sideways_strategy': 'mean_reversion', 'sideways_bb_std_mult': 0.6206003551074656, 'sideways_rsi_os': 21, 'sideways_rsi_ob': 65, 'sideways_adx_thresh': 10.106654919339002, 'sideways_atr_min_pct': 0.0016374676667339962, 'sideways_atr_max_pct': 0.02860594028650589, 'sideways_tp_mult': 1.5884050598295816, 'sideways_tsl_mult': 0.7130191865852101, 'sideways_time_stop': 24, 'sideways_use_sma': False, 'sideways_use_ema': False, 'sideways_use_atr': False, 'sideways_use_adx': True, 'sideways_use_spike': True, 'sideways_rsi_required': False}.
