[I 2025-09-01 08:38:58,733] Trial 486 finished with values: [-0.14603316798445953, 0.1465175347551134] and parameters: {'p_sma': 48, 'p_std': 25, 'p_atr': 13, 'p_adx': 27, 'rsi_period': 69, 'ema1': 6, 'ema2': 11, 'slip_atr_k': 0.054985917541581324, 'slip_spread_k': 0.6005484574977402, 'spread_hl_frac': 0.02407218270293539, 'bb_std_mult': 3.2503528104896797, 'rsi_os': 8, 'rsi_ob': 84, 'vol_spike': 0.22036181687772843, 'adx_thresh': 24.90514594290936, 'atr_min_pct': 0.02713740511515063, 'atr_max_pct': 0.1499600453101655, 'tp_mult': 1.6668167370111984, 'tsl_mult': 0.704063462642942, 'strategy': 'breakout', 'time_stop': 239, 'use_sma': True, 'use_atr': True, 'use_adx': False, 'use_ema': True, 'use_spike': True, 'rsi_required': True, 'edge_k': 1.0395554534815217, 'edge_cap': 0.13585949574953574, 'bull_strategy': 'breakout', 'bull_bb_std_mult': 2.8575973653530555, 'bull_rsi_os': 45, 'bull_rsi_ob': 67, 'bull_adx_thresh': 7.287561959477804, 'bull_atr_min_pct': 6.772278399431661e-05, 'bull_atr_max_pct': 0.047584880123718316, 'bull_tp_mult': 2.3381807076463055, 'bull_tsl_mult': 0.5849593707013384, 'bull_time_stop': 95, 'bull_use_sma': False, 'bull_use_ema': False, 'bull_use_atr': False, 'bull_use_adx': False, 'bull_use_spike': True, 'bull_rsi_required': True, 'bear_strategy': 'mean_reversion', 'bear_bb_std_mult': 3.1376698820879527, 'bear_rsi_os': 16, 'bear_rsi_ob': 88, 'bear_adx_thresh': 32.39851148131013, 'bear_atr_min_pct': 0.023990618678514097, 'bear_atr_max_pct': 0.04217253904528449, 'bear_tp_mult': 2.954054498468703, 'bear_tsl_mult': 0.5200075357913988, 'bear_time_stop': 87, 'bear_use_sma': False, 'bear_use_ema': False, 'bear_use_atr': True, 'bear_use_adx': False, 'bear_use_spike': True, 'bear_rsi_required': True, 'sideways_strategy': 'mean_reversion', 'sideways_bb_std_mult': 3.464791163762337, 'sideways_rsi_os': 41, 'sideways_rsi_ob': 77, 'sideways_adx_thresh': 32.93949534366605, 'sideways_atr_min_pct': 0.02094685542197454, 'sideways_atr_max_pct': 0.030872209870779977, 'sideways_tp_mult': 2.6355887182971744, 'sideways_tsl_mult': 0.19624886043188156, 'sideways_time_stop': 56, 'sideways_use_sma': False, 'sideways_use_ema': True, 'sideways_use_atr': False, 'sideways_use_adx': False, 'sideways_use_spike': False, 'sideways_rsi_required': False}.
[I 2025-09-01 08:39:39,949] Trial 489 finished with values: [-1000000000.0, 1000000000.0] and parameters: {'p_sma': 24, 'p_std': 32, 'p_atr': 13, 'p_adx': 19, 'rsi_period': 69, 'ema1': 11, 'ema2': 13, 'slip_atr_k': 0.04791487677778444, 'slip_spread_k': 0.08123994776664939, 'spread_hl_frac': 0.023029540205719796, 'bb_std_mult': 3.43464339974394, 'rsi_os': 8, 'rsi_ob': 85, 'vol_spike': 0.23636957328660024, 'adx_thresh': 19.658717592449065, 'atr_min_pct': 0.029962990028943266, 'atr_max_pct': 0.06572355866419838, 'tp_mult': 1.108763442814443, 'tsl_mult': 0.6964362519608553, 'strategy': 'breakout', 'time_stop': 6, 'use_sma': True, 'use_atr': False, 'use_adx': False, 'use_ema': True, 'use_spike': False, 'rsi_required': False, 'edge_k': 0.9988283602671812, 'edge_cap': 0.06849432308079734, 'bull_strategy': 'mean_reversion', 'bull_bb_std_mult': 2.246967931147159, 'bull_rsi_os': 12, 'bull_rsi_ob': 67, 'bull_adx_thresh': 7.733402143156627, 'bull_atr_min_pct': 0.008707136097936548, 'bull_atr_max_pct': 0.04186069802162531, 'bull_tp_mult': 2.2662865209541296, 'bull_tsl_mult': 0.673308602755467, 'bull_time_stop': 225, 'bull_use_sma': False, 'bull_use_ema': True, 'bull_use_atr': False, 'bull_use_adx': False, 'bull_use_spike': True, 'bull_rsi_required': True, 'bear_strategy': 'mean_reversion', 'bear_bb_std_mult': 3.068468859152472, 'bear_rsi_os': 22, 'bear_rsi_ob': 69, 'bear_adx_thresh': 32.34136606532366, 'bear_atr_min_pct': 0.02112040613175354, 'bear_atr_max_pct': 0.07471156863041543, 'bear_tp_mult': 1.3805932339381939, 'bear_tsl_mult': 0.0920566653001265, 'bear_time_stop': 68, 'bear_use_sma': False, 'bear_use_ema': True, 'bear_use_atr': False, 'bear_use_adx': True, 'bear_use_spike': True, 'bear_rsi_required': True, 'sideways_strategy': 'mean_reversion', 'sideways_bb_std_mult': 2.4567534053383073, 'sideways_rsi_os': 35, 'sideways_rsi_ob': 77, 'sideways_adx_thresh': 11.650447624822924, 'sideways_atr_min_pct': 0.023110202841342922, 'sideways_atr_max_pct': 0.08034499135380432, 'sideways_tp_mult': 2.920912105651193, 'sideways_tsl_mult': 0.44748419983978627, 'sideways_time_stop': 204, 'sideways_use_sma': True, 'sideways_use_ema': True, 'sideways_use_atr': False, 'sideways_use_adx': False, 'sideways_use_spike': False, 'sideways_rsi_required': False}.
[I 2025-09-01 08:39:40,752] Trial 488 finished with values: [-1000000000.0, 1000000000.0] and parameters: {'p_sma': 25, 'p_std': 31, 'p_atr': 13, 'p_adx': 19, 'rsi_period': 56, 'ema1': 11, 'ema2': 28, 'slip_atr_k': 0.17065321328803357, 'slip_spread_k': 0.08066549388713723, 'spread_hl_frac': 0.019996569030078543, 'bb_std_mult': 3.4178810374140904, 'rsi_os': 14, 'rsi_ob': 85, 'vol_spike': 0.2353191581169598, 'adx_thresh': 7.59942075309865, 'atr_min_pct': 0.027024481957948973, 'atr_max_pct': 0.043155731700374234, 'tp_mult': 1.1715363549843363, 'tsl_mult': 0.5016797416717046, 'strategy': 'breakout', 'time_stop': 277, 'use_sma': True, 'use_atr': False, 'use_adx': False, 'use_ema': True, 'use_spike': False, 'rsi_required': False, 'edge_k': 1.0114977062474393, 'edge_cap': 0.06948753467247398, 'bull_strategy': 'mean_reversion', 'bull_bb_std_mult': 2.564257137318211, 'bull_rsi_os': 12, 'bull_rsi_ob': 67, 'bull_adx_thresh': 7.682823095986813, 'bull_atr_min_pct': 0.008748578685128308, 'bull_atr_max_pct': 0.04217705055941348, 'bull_tp_mult': 2.2532630984142825, 'bull_tsl_mult': 0.9567416835340308, 'bull_time_stop': 206, 'bull_use_sma': False, 'bull_use_ema': True, 'bull_use_atr': False, 'bull_use_adx': False, 'bull_use_spike': True, 'bull_rsi_required': True, 'bear_strategy': 'mean_reversion', 'bear_bb_std_mult': 3.0751520955703566, 'bear_rsi_os': 22, 'bear_rsi_ob': 95, 'bear_adx_thresh': 32.301861485907445, 'bear_atr_min_pct': 0.009295554536599263, 'bear_atr_max_pct': 0.14271585382797075, 'bear_tp_mult': 1.241991169215519, 'bear_tsl_mult': 0.9179796642053081, 'bear_time_stop': 70, 'bear_use_sma': False, 'bear_use_ema': True, 'bear_use_atr': False, 'bear_use_adx': True, 'bear_use_spike': True, 'bear_rsi_required': True, 'sideways_strategy': 'mean_reversion', 'sideways_bb_std_mult': 1.4208368678506198, 'sideways_rsi_os': 40, 'sideways_rsi_ob': 66, 'sideways_adx_thresh': 9.947178531269948, 'sideways_atr_min_pct': 0.022984592617640753, 'sideways_atr_max_pct': 0.02731029610405337, 'sideways_tp_mult': 2.593023742406042, 'sideways_tsl_mult': 0.1517809924119853, 'sideways_time_stop': 125, 'sideways_use_sma': True, 'sideways_use_ema': True, 'sideways_use_atr': False, 'sideways_use_adx': False, 'sideways_use_spike': False, 'sideways_rsi_required': False}.
[I 2025-09-01 08:39:40,933] Trial 490 finished with values: [-1000000000.0, 1000000000.0] and parameters: {'p_sma': 18, 'p_std': 38, 'p_atr': 11, 'p_adx': 7, 'rsi_period': 59, 'ema1': 11, 'ema2': 18, 'slip_atr_k': 0.202247711206505, 'slip_spread_k': 0.08073809391278225, 'spread_hl_frac': 0.01731598668914882, 'bb_std_mult': 3.4236791462294405, 'rsi_os': 25, 'rsi_ob': 64, 'vol_spike': 0.2340659805836191, 'adx_thresh': 30.074811397861694, 'atr_min_pct': 0.022105939473785106, 'atr_max_pct': 0.14366587355973914, 'tp_mult': 2.1025149154763003, 'tsl_mult': 0.09391351988743046, 'strategy': 'breakout', 'time_stop': 106, 'use_sma': True, 'use_atr': False, 'use_adx': False, 'use_ema': True, 'use_spike': False, 'rsi_required': False, 'edge_k': 1.5773198872605718, 'edge_cap': 0.9143219316668099, 'bull_strategy': 'mean_reversion', 'bull_bb_std_mult': 2.3556157044329664, 'bull_rsi_os': 13, 'bull_rsi_ob': 71, 'bull_adx_thresh': 26.05039954271569, 'bull_atr_min_pct': 0.02360966418271787, 'bull_atr_max_pct': 0.04138800045934782, 'bull_tp_mult': 2.2502757450325674, 'bull_tsl_mult': 0.8383475091270279, 'bull_time_stop': 205, 'bull_use_sma': True, 'bull_use_ema': True, 'bull_use_atr': False, 'bull_use_adx': False, 'bull_use_spike': True, 'bull_rsi_required': True, 'bear_strategy': 'mean_reversion', 'bear_bb_std_mult': 2.2567131077981375, 'bear_rsi_os': 34, 'bear_rsi_ob': 46, 'bear_adx_thresh': 6.716848743768846, 'bear_atr_min_pct': 0.02367695161586094, 'bear_atr_max_pct': 0.14274888715079803, 'bear_tp_mult': 2.1561140557636285, 'bear_tsl_mult': 0.194816571395882, 'bear_time_stop': 74, 'bear_use_sma': False, 'bear_use_ema': True, 'bear_use_atr': False, 'bear_use_adx': True, 'bear_use_spike': True, 'bear_rsi_required': False, 'sideways_strategy': 'mean_reversion', 'sideways_bb_std_mult': 2.4791515164867057, 'sideways_rsi_os': 35, 'sideways_rsi_ob': 68, 'sideways_adx_thresh': 10.049982172550543, 'sideways_atr_min_pct': 0.019285363713754864, 'sideways_atr_max_pct': 0.13634752702687286, 'sideways_tp_mult': 2.588600385898066, 'sideways_tsl_mult': 0.39331436662365044, 'sideways_time_stop': 36, 'sideways_use_sma': True, 'sideways_use_ema': True, 'sideways_use_atr': False, 'sideways_use_adx': False, 'sideways_use_spike': False, 'sideways_rsi_required': False}.
[I 2025-09-01 08:39:41,180] Trial 487 finished with values: [-1000000000.0, 1000000000.0] and parameters: {'p_sma': 21, 'p_std': 16, 'p_atr': 15, 'p_adx': 19, 'rsi_period': 58, 'ema1': 11, 'ema2': 28, 'slip_atr_k': 0.055512951913717565, 'slip_spread_k': 0.8577631590441033, 'spread_hl_frac': 0.02408010572556851, 'bb_std_mult': 3.4104165948331318, 'rsi_os': 24, 'rsi_ob': 45, 'vol_spike': 0.23633124047566398, 'adx_thresh': 7.636850024084888, 'atr_min_pct': 0.025960757880389818, 'atr_max_pct': 0.06522717985402843, 'tp_mult': 1.104930880990141, 'tsl_mult': 0.4910428729165487, 'strategy': 'breakout', 'time_stop': 277, 'use_sma': True, 'use_atr': True, 'use_adx': False, 'use_ema': False, 'use_spike': True, 'rsi_required': True, 'edge_k': 1.0777013665492141, 'edge_cap': 0.7279085499908197, 'bull_strategy': 'mean_reversion', 'bull_bb_std_mult': 2.3360388436077515, 'bull_rsi_os': 12, 'bull_rsi_ob': 60, 'bull_adx_thresh': 26.21954516087767, 'bull_atr_min_pct': 0.016705038205254197, 'bull_atr_max_pct': 0.12550554501820876, 'bull_tp_mult': 2.2593283501676766, 'bull_tsl_mult': 0.709284715481923, 'bull_time_stop': 82, 'bull_use_sma': False, 'bull_use_ema': False, 'bull_use_atr': False, 'bull_use_adx': False, 'bull_use_spike': True, 'bull_rsi_required': True, 'bear_strategy': 'mean_reversion', 'bear_bb_std_mult': 3.0788536290332247, 'bear_rsi_os': 24, 'bear_rsi_ob': 46, 'bear_adx_thresh': 29.33507594165125, 'bear_atr_min_pct': 0.02370112470298928, 'bear_atr_max_pct': 0.07489373507737412, 'bear_tp_mult': 2.941603298113874, 'bear_tsl_mult': 0.06185090354164431, 'bear_time_stop': 85, 'bear_use_sma': False, 'bear_use_ema': True, 'bear_use_atr': True, 'bear_use_adx': True, 'bear_use_spike': True, 'bear_rsi_required': True, 'sideways_strategy': 'mean_reversion', 'sideways_bb_std_mult': 2.58200778657921, 'sideways_rsi_os': 41, 'sideways_rsi_ob': 64, 'sideways_adx_thresh': 20.06772260994155, 'sideways_atr_min_pct': 0.011057922187829325, 'sideways_atr_max_pct': 0.030721718957171358, 'sideways_tp_mult': 2.121843438618108, 'sideways_tsl_mult': 0.1963864680203793, 'sideways_time_stop': 150, 'sideways_use_sma': False, 'sideways_use_ema': True, 'sideways_use_atr': False, 'sideways_use_adx': False, 'sideways_use_spike': False, 'sideways_rsi_required': False}.
[I 2025-09-01 08:40:25,347] Trial 492 finished with values: [-1000000000.0, 1000000000.0] and parameters: {'p_sma': 29, 'p_std': 16, 'p_atr': 11, 'p_adx': 30, 'rsi_period': 55, 'ema1': 9, 'ema2': 33, 'slip_atr_k': 0.0930175211425257, 'slip_spread_k': 0.6270256201302826, 'spread_hl_frac': 0.03447167681508075, 'bb_std_mult': 3.518433422374852, 'rsi_os': 24, 'rsi_ob': 78, 'vol_spike': 0.27498795505279594, 'adx_thresh': 24.290651317294667, 'atr_min_pct': 0.02593572400103796, 'atr_max_pct': 0.14413674910038932, 'tp_mult': 2.649266687428379, 'tsl_mult': 0.8682944060636941, 'strategy': 'mean_reversion', 'time_stop': 177, 'use_sma': False, 'use_atr': True, 'use_adx': True, 'use_ema': False, 'use_spike': True, 'rsi_required': True, 'edge_k': 1.081576574482035, 'edge_cap': 0.7330692634659877, 'bull_strategy': 'breakout', 'bull_bb_std_mult': 2.714992639351635, 'bull_rsi_os': 50, 'bull_rsi_ob': 71, 'bull_adx_thresh': 25.49527186418556, 'bull_atr_min_pct': 0.016657542484244878, 'bull_atr_max_pct': 0.10415861595491013, 'bull_tp_mult': 2.2446075125381664, 'bull_tsl_mult': 0.6628662972211592, 'bull_time_stop': 154, 'bull_use_sma': True, 'bull_use_ema': False, 'bull_use_atr': False, 'bull_use_adx': True, 'bull_use_spike': True, 'bull_rsi_required': False, 'bear_strategy': 'breakout', 'bear_bb_std_mult': 1.777657417249091, 'bear_rsi_os': 23, 'bear_rsi_ob': 63, 'bear_adx_thresh': 5.050588168018741, 'bear_atr_min_pct': 0.023604453587508695, 'bear_atr_max_pct': 0.12809662507220337, 'bear_tp_mult': 2.7790695625908435, 'bear_tsl_mult': 0.02060527991587624, 'bear_time_stop': 43, 'bear_use_sma': False, 'bear_use_ema': False, 'bear_use_atr': True, 'bear_use_adx': True, 'bear_use_spike': True, 'bear_rsi_required': False, 'sideways_strategy': 'mean_reversion', 'sideways_bb_std_mult': 2.63621080184842, 'sideways_rsi_os': 37, 'sideways_rsi_ob': 63, 'sideways_adx_thresh': 9.41276103835585, 'sideways_atr_min_pct': 0.015380129120172947, 'sideways_atr_max_pct': 0.023698641909510227, 'sideways_tp_mult': 2.6761651938031075, 'sideways_tsl_mult': 0.1622457628579388, 'sideways_time_stop': 116, 'sideways_use_sma': False, 'sideways_use_ema': False, 'sideways_use_atr': False, 'sideways_use_adx': True, 'sideways_use_spike': True, 'sideways_rsi_required': False}.
[I 2025-09-01 08:40:25,781] Trial 493 finished with values: [-1000000000.0, 1000000000.0] and parameters: {'p_sma': 21, 'p_std': 51, 'p_atr': 22, 'p_adx': 21, 'rsi_period': 55, 'ema1': 25, 'ema2': 45, 'slip_atr_k': 0.059165024537487475, 'slip_spread_k': 0.6264476716999411, 'spread_hl_frac': 0.02919083593404282, 'bb_std_mult': 2.484908046982361, 'rsi_os': 15, 'rsi_ob': 54, 'vol_spike': 0.1359920595176923, 'adx_thresh': 25.49343910594388, 'atr_min_pct': 0.021213612778108185, 'atr_max_pct': 0.07746721435406342, 'tp_mult': 1.8666728985096146, 'tsl_mult': 0.2949429609304861, 'strategy': 'mean_reversion', 'time_stop': 247, 'use_sma': False, 'use_atr': True, 'use_adx': True, 'use_ema': False, 'use_spike': True, 'rsi_required': True, 'edge_k': 0.3968994533116803, 'edge_cap': 0.10117418050029381, 'bull_strategy': 'breakout', 'bull_bb_std_mult': 1.2512854539306337, 'bull_rsi_os': 40, 'bull_rsi_ob': 70, 'bull_adx_thresh': 9.644532864103528, 'bull_atr_min_pct': 0.016709463984851507, 'bull_atr_max_pct': 0.12609209770092222, 'bull_tp_mult': 2.231128268997227, 'bull_tsl_mult': 0.7064823252834346, 'bull_time_stop': 152, 'bull_use_sma': True, 'bull_use_ema': False, 'bull_use_atr': False, 'bull_use_adx': True, 'bull_use_spike': True, 'bull_rsi_required': False, 'bear_strategy': 'breakout', 'bear_bb_std_mult': 1.8069381944394607, 'bear_rsi_os': 23, 'bear_rsi_ob': 64, 'bear_adx_thresh': 33.72290785774497, 'bear_atr_min_pct': 0.0196591457573762, 'bear_atr_max_pct': 0.07802095737067374, 'bear_tp_mult': 1.8948073963887517, 'bear_tsl_mult': 0.02575263512396292, 'bear_time_stop': 94, 'bear_use_sma': False, 'bear_use_ema': False, 'bear_use_atr': True, 'bear_use_adx': True, 'bear_use_spike': True, 'bear_rsi_required': False, 'sideways_strategy': 'mean_reversion', 'sideways_bb_std_mult': 2.616327452126978, 'sideways_rsi_os': 37, 'sideways_rsi_ob': 65, 'sideways_adx_thresh': 9.261784875931886, 'sideways_atr_min_pct': 0.02459551373417044, 'sideways_atr_max_pct': 0.022554119583486118, 'sideways_tp_mult': 2.474878579791062, 'sideways_tsl_mult': 0.08510461502538175, 'sideways_time_stop': 150, 'sideways_use_sma': False, 'sideways_use_ema': False, 'sideways_use_atr': False, 'sideways_use_adx': True, 'sideways_use_spike': True, 'sideways_rsi_required': False}.
[I 2025-09-01 08:40:26,234] Trial 494 finished with values: [-1000000000.0, 1000000000.0] and parameters: {'p_sma': 44, 'p_std': 14, 'p_atr': 11, 'p_adx': 16, 'rsi_period': 25, 'ema1': 9, 'ema2': 13, 'slip_atr_k': 0.02743398678863923, 'slip_spread_k': 0.6211980463287492, 'spread_hl_frac': 0.02913723151675757, 'bb_std_mult': 2.4677881871057945, 'rsi_os': 24, 'rsi_ob': 54, 'vol_spike': 0.24638340506421766, 'adx_thresh': 25.508850416442034, 'atr_min_pct': 0.020624980740970834, 'atr_max_pct': 0.13621001606062996, 'tp_mult': 1.4552465405691168, 'tsl_mult': 0.7468531852297946, 'strategy': 'mean_reversion', 'time_stop': 182, 'use_sma': False, 'use_atr': True, 'use_adx': True, 'use_ema': False, 'use_spike': True, 'rsi_required': True, 'edge_k': 0.937234465868825, 'edge_cap': 0.10750224183251138, 'bull_strategy': 'breakout', 'bull_bb_std_mult': 2.7007736290921147, 'bull_rsi_os': 19, 'bull_rsi_ob': 81, 'bull_adx_thresh': 8.410166155832123, 'bull_atr_min_pct': 0.010487561338412586, 'bull_atr_max_pct': 0.03773737697283088, 'bull_tp_mult': 2.3347096119062787, 'bull_tsl_mult': 0.6672548707675363, 'bull_time_stop': 152, 'bull_use_sma': True, 'bull_use_ema': False, 'bull_use_atr': True, 'bull_use_adx': True, 'bull_use_spike': False, 'bull_rsi_required': False, 'bear_strategy': 'breakout', 'bear_bb_std_mult': 1.781928734087138, 'bear_rsi_os': 26, 'bear_rsi_ob': 87, 'bear_adx_thresh': 33.5003203753014, 'bear_atr_min_pct': 0.011506967844613358, 'bear_atr_max_pct': 0.07121352067670714, 'bear_tp_mult': 2.7779680188573113, 'bear_tsl_mult': 0.08883772616848283, 'bear_time_stop': 263, 'bear_use_sma': False, 'bear_use_ema': False, 'bear_use_atr': True, 'bear_use_adx': True, 'bear_use_spike': False, 'bear_rsi_required': False, 'sideways_strategy': 'mean_reversion', 'sideways_bb_std_mult': 3.0880628977434483, 'sideways_rsi_os': 53, 'sideways_rsi_ob': 89, 'sideways_adx_thresh': 9.196206999294832, 'sideways_atr_min_pct': 0.02251813047853764, 'sideways_atr_max_pct': 0.023175369875005215, 'sideways_tp_mult': 1.8327544902825945, 'sideways_tsl_mult': 0.09501601821178338, 'sideways_time_stop': 31, 'sideways_use_sma': False, 'sideways_use_ema': False, 'sideways_use_atr': False, 'sideways_use_adx': True, 'sideways_use_spike': True, 'sideways_rsi_required': False}.
[I 2025-09-01 08:40:26,443] Trial 491 finished with values: [-0.2342137788979367, 0.23401844714558662] and parameters: {'p_sma': 18, 'p_std': 14, 'p_atr': 11, 'p_adx': 19, 'rsi_period': 58, 'ema1': 9, 'ema2': 33, 'slip_atr_k': 0.2033240548865471, 'slip_spread_k': 0.6306245959680751, 'spread_hl_frac': 0.021615652473203843, 'bb_std_mult': 3.4939710868846463, 'rsi_os': 24, 'rsi_ob': 73, 'vol_spike': 0.1354806079631574, 'adx_thresh': 30.103810064951944, 'atr_min_pct': 0.02211865924772277, 'atr_max_pct': 0.04172432320156423, 'tp_mult': 1.1547474439748677, 'tsl_mult': 0.4931168628153757, 'strategy': 'mean_reversion', 'time_stop': 278, 'use_sma': False, 'use_atr': True, 'use_adx': True, 'use_ema': False, 'use_spike': True, 'rsi_required': True, 'edge_k': 1.6941163174781688, 'edge_cap': 0.7216558868312987, 'bull_strategy': 'mean_reversion', 'bull_bb_std_mult': 1.2493517310706888, 'bull_rsi_os': 13, 'bull_rsi_ob': 70, 'bull_adx_thresh': 10.650882031021629, 'bull_atr_min_pct': 0.001090618523304786, 'bull_atr_max_pct': 0.043992701602080145, 'bull_tp_mult': 2.263322845179446, 'bull_tsl_mult': 0.7124622209108996, 'bull_time_stop': 238, 'bull_use_sma': True, 'bull_use_ema': False, 'bull_use_atr': False, 'bull_use_adx': True, 'bull_use_spike': True, 'bull_rsi_required': False, 'bear_strategy': 'mean_reversion', 'bear_bb_std_mult': 0.8846797217556455, 'bear_rsi_os': 28, 'bear_rsi_ob': 95, 'bear_adx_thresh': 6.594245495837967, 'bear_atr_min_pct': 0.012967708425029603, 'bear_atr_max_pct': 0.07755331081086986, 'bear_tp_mult': 2.77894870074293, 'bear_tsl_mult': 0.24567264512057174, 'bear_time_stop': 75, 'bear_use_sma': False, 'bear_use_ema': True, 'bear_use_atr': True, 'bear_use_adx': True, 'bear_use_spike': True, 'bear_rsi_required': False, 'sideways_strategy': 'mean_reversion', 'sideways_bb_std_mult': 2.169131388052683, 'sideways_rsi_os': 37, 'sideways_rsi_ob': 68, 'sideways_adx_thresh': 10.059644901248515, 'sideways_atr_min_pct': 0.007169232419432693, 'sideways_atr_max_pct': 0.010623288574804629, 'sideways_tp_mult': 2.580696513811332, 'sideways_tsl_mult': 0.15889388285593573, 'sideways_time_stop': 126, 'sideways_use_sma': False, 'sideways_use_ema': False, 'sideways_use_atr': False, 'sideways_use_adx': True, 'sideways_use_spike': True, 'sideways_rsi_required': False}.
