[I 2025-09-01 08:33:46,966] Trial 449 finished with values: [-1000000000.0, 1000000000.0] and parameters: {'p_sma': 18, 'p_std': 43, 'p_atr': 29, 'p_adx': 20, 'rsi_period': 29, 'ema1': 11, 'ema2': 13, 'slip_atr_k': 0.05777016868223863, 'slip_spread_k': 0.41022120669936496, 'spread_hl_frac': 0.025712196115692604, 'bb_std_mult': 3.4680503309669635, 'rsi_os': 34, 'rsi_ob': 56, 'vol_spike': 0.007930136593428755, 'adx_thresh': 18.367156440281086, 'atr_min_pct': 0.019766323518248093, 'atr_max_pct': 0.14203473173110426, 'tp_mult': 1.5502589116122467, 'tsl_mult': 0.4684272472124905, 'strategy': 'breakout', 'time_stop': 199, 'use_sma': False, 'use_atr': True, 'use_adx': True, 'use_ema': True, 'use_spike': True, 'rsi_required': True, 'edge_k': 0.9794302956489626, 'edge_cap': 0.07784004953224305, 'bull_strategy': 'mean_reversion', 'bull_bb_std_mult': 3.050863416651508, 'bull_rsi_os': 37, 'bull_rsi_ob': 65, 'bull_adx_thresh': 8.345503762230473, 'bull_atr_min_pct': 0.0056153869902194715, 'bull_atr_max_pct': 0.04591657183766444, 'bull_tp_mult': 2.802172534666626, 'bull_tsl_mult': 0.3144856243629204, 'bull_time_stop': 114, 'bull_use_sma': False, 'bull_use_ema': False, 'bull_use_atr': True, 'bull_use_adx': False, 'bull_use_spike': False, 'bull_rsi_required': True, 'bear_strategy': 'breakout', 'bear_bb_std_mult': 3.1957907545031263, 'bear_rsi_os': 26, 'bear_rsi_ob': 76, 'bear_adx_thresh': 30.508642015841367, 'bear_atr_min_pct': 0.01610557327770997, 'bear_atr_max_pct': 0.10457388240711843, 'bear_tp_mult': 2.953509862991143, 'bear_tsl_mult': 0.3752745584913355, 'bear_time_stop': 236, 'bear_use_sma': False, 'bear_use_ema': True, 'bear_use_atr': True, 'bear_use_adx': True, 'bear_use_spike': True, 'bear_rsi_required': True, 'sideways_strategy': 'mean_reversion', 'sideways_bb_std_mult': 0.7319998230259095, 'sideways_rsi_os': 37, 'sideways_rsi_ob': 65, 'sideways_adx_thresh': 8.198448220586796, 'sideways_atr_min_pct': 0.02343286604947963, 'sideways_atr_max_pct': 0.02675772683967753, 'sideways_tp_mult': 2.640878198979371, 'sideways_tsl_mult': 0.55569034727637, 'sideways_time_stop': 19, 'sideways_use_sma': False, 'sideways_use_ema': True, 'sideways_use_atr': False, 'sideways_use_adx': True, 'sideways_use_spike': False, 'sideways_rsi_required': False}.
[I 2025-09-01 08:33:47,913] Trial 453 finished with values: [-1000000000.0, 1000000000.0] and parameters: {'p_sma': 16, 'p_std': 14, 'p_atr': 28, 'p_adx': 21, 'rsi_period': 62, 'ema1': 16, 'ema2': 14, 'slip_atr_k': 0.04970968452167496, 'slip_spread_k': 0.6031860091395362, 'spread_hl_frac': 0.0018690288970458283, 'bb_std_mult': 3.5935646491415714, 'rsi_os': 54, 'rsi_ob': 63, 'vol_spike': 0.2508759137223597, 'adx_thresh': 24.74484810792174, 'atr_min_pct': 0.02078083865645883, 'atr_max_pct': 0.14980569236791808, 'tp_mult': 1.9733566851144684, 'tsl_mult': 0.4413679325231983, 'strategy': 'mean_reversion', 'time_stop': 251, 'use_sma': True, 'use_atr': False, 'use_adx': False, 'use_ema': True, 'use_spike': False, 'rsi_required': False, 'edge_k': 1.0014995076978237, 'edge_cap': 0.0882166441930125, 'bull_strategy': 'breakout', 'bull_bb_std_mult': 2.9820070438546225, 'bull_rsi_os': 15, 'bull_rsi_ob': 68, 'bull_adx_thresh': 30.929891231032244, 'bull_atr_min_pct': 0.017262546602559232, 'bull_atr_max_pct': 0.03516605393306762, 'bull_tp_mult': 2.2309077579848586, 'bull_tsl_mult': 0.6802044771469833, 'bull_time_stop': 220, 'bull_use_sma': True, 'bull_use_ema': True, 'bull_use_atr': False, 'bull_use_adx': True, 'bull_use_spike': True, 'bull_rsi_required': False, 'bear_strategy': 'mean_reversion', 'bear_bb_std_mult': 1.5768306950578934, 'bear_rsi_os': 25, 'bear_rsi_ob': 66, 'bear_adx_thresh': 31.676520512425395, 'bear_atr_min_pct': 0.017806940961581075, 'bear_atr_max_pct': 0.07459078253087272, 'bear_tp_mult': 1.0137012425409537, 'bear_tsl_mult': 0.06674088211889867, 'bear_time_stop': 270, 'bear_use_sma': False, 'bear_use_ema': False, 'bear_use_atr': False, 'bear_use_adx': True, 'bear_use_spike': True, 'bear_rsi_required': False, 'sideways_strategy': 'mean_reversion', 'sideways_bb_std_mult': 0.9959828555135619, 'sideways_rsi_os': 46, 'sideways_rsi_ob': 64, 'sideways_adx_thresh': 9.138734614342999, 'sideways_atr_min_pct': 0.01756744885677537, 'sideways_atr_max_pct': 0.05806460716969212, 'sideways_tp_mult': 1.4313102833267866, 'sideways_tsl_mult': 0.11243712968078023, 'sideways_time_stop': 64, 'sideways_use_sma': True, 'sideways_use_ema': False, 'sideways_use_atr': False, 'sideways_use_adx': False, 'sideways_use_spike': True, 'sideways_rsi_required': False}.
[I 2025-09-01 08:34:28,922] Trial 451 finished with values: [-1000000000.0, 1000000000.0] and parameters: {'p_sma': 20, 'p_std': 17, 'p_atr': 22, 'p_adx': 22, 'rsi_period': 64, 'ema1': 8, 'ema2': 11, 'slip_atr_k': 0.058303614916340445, 'slip_spread_k': 0.6410287970099539, 'spread_hl_frac': 0.04892746370557302, 'bb_std_mult': 2.548284318976304, 'rsi_os': 24, 'rsi_ob': 53, 'vol_spike': 0.25187719426250865, 'adx_thresh': 25.07634114718171, 'atr_min_pct': 0.0066631571037756975, 'atr_max_pct': 0.14996418440438009, 'tp_mult': 1.9514414970872096, 'tsl_mult': 0.7336485788605208, 'strategy': 'breakout', 'time_stop': 203, 'use_sma': False, 'use_atr': True, 'use_adx': True, 'use_ema': True, 'use_spike': True, 'rsi_required': True, 'edge_k': 0.9843660872733994, 'edge_cap': 0.25477288828607475, 'bull_strategy': 'mean_reversion', 'bull_bb_std_mult': 1.479850172931301, 'bull_rsi_os': 36, 'bull_rsi_ob': 64, 'bull_adx_thresh': 10.099398724346232, 'bull_atr_min_pct': 0.017271259649516785, 'bull_atr_max_pct': 0.022850767871564807, 'bull_tp_mult': 2.223581094089924, 'bull_tsl_mult': 0.6080968711876873, 'bull_time_stop': 294, 'bull_use_sma': False, 'bull_use_ema': False, 'bull_use_atr': True, 'bull_use_adx': False, 'bull_use_spike': False, 'bull_rsi_required': True, 'bear_strategy': 'breakout', 'bear_bb_std_mult': 3.3953695325238464, 'bear_rsi_os': 18, 'bear_rsi_ob': 79, 'bear_adx_thresh': 17.746635206929867, 'bear_atr_min_pct': 0.023010617865465047, 'bear_atr_max_pct': 0.028891554739354633, 'bear_tp_mult': 1.0777832448224827, 'bear_tsl_mult': 0.3741204676444003, 'bear_time_stop': 270, 'bear_use_sma': False, 'bear_use_ema': True, 'bear_use_atr': True, 'bear_use_adx': True, 'bear_use_spike': True, 'bear_rsi_required': True, 'sideways_strategy': 'mean_reversion', 'sideways_bb_std_mult': 0.7252783928815683, 'sideways_rsi_os': 36, 'sideways_rsi_ob': 65, 'sideways_adx_thresh': 8.17596558362456, 'sideways_atr_min_pct': 0.021829247380442045, 'sideways_atr_max_pct': 0.02672423955387411, 'sideways_tp_mult': 2.561856444168841, 'sideways_tsl_mult': 0.8000099945307508, 'sideways_time_stop': 5, 'sideways_use_sma': False, 'sideways_use_ema': True, 'sideways_use_atr': False, 'sideways_use_adx': True, 'sideways_use_spike': False, 'sideways_rsi_required': False}.
[I 2025-09-01 08:34:29,647] Trial 452 finished with values: [-1000000000.0, 1000000000.0] and parameters: {'p_sma': 26, 'p_std': 44, 'p_atr': 16, 'p_adx': 21, 'rsi_period': 29, 'ema1': 21, 'ema2': 13, 'slip_atr_k': 0.05874744266909303, 'slip_spread_k': 0.6398294585185298, 'spread_hl_frac': 0.03856799802499222, 'bb_std_mult': 3.550585462116836, 'rsi_os': 34, 'rsi_ob': 57, 'vol_spike': 0.24905753835555752, 'adx_thresh': 22.35647938945199, 'atr_min_pct': 0.019300669860843046, 'atr_max_pct': 0.14998311074433485, 'tp_mult': 1.3392110972525353, 'tsl_mult': 0.6752486583512682, 'strategy': 'breakout', 'time_stop': 201, 'use_sma': True, 'use_atr': False, 'use_adx': False, 'use_ema': True, 'use_spike': True, 'rsi_required': False, 'edge_k': 0.1240122164447287, 'edge_cap': 0.08792836821725078, 'bull_strategy': 'breakout', 'bull_bb_std_mult': 2.478495294436714, 'bull_rsi_os': 36, 'bull_rsi_ob': 68, 'bull_adx_thresh': 10.261980157198785, 'bull_atr_min_pct': 0.01114324849995393, 'bull_atr_max_pct': 0.09321466680874477, 'bull_tp_mult': 2.2113254875157553, 'bull_tsl_mult': 0.6098325525646284, 'bull_time_stop': 188, 'bull_use_sma': False, 'bull_use_ema': True, 'bull_use_atr': False, 'bull_use_adx': True, 'bull_use_spike': True, 'bull_rsi_required': True, 'bear_strategy': 'mean_reversion', 'bear_bb_std_mult': 2.1832544986989064, 'bear_rsi_os': 26, 'bear_rsi_ob': 95, 'bear_adx_thresh': 28.640340412063438, 'bear_atr_min_pct': 0.024790477124489743, 'bear_atr_max_pct': 0.07483842826095126, 'bear_tp_mult': 2.8412077079356113, 'bear_tsl_mult': 0.38143495995976173, 'bear_time_stop': 236, 'bear_use_sma': False, 'bear_use_ema': False, 'bear_use_atr': True, 'bear_use_adx': True, 'bear_use_spike': True, 'bear_rsi_required': False, 'sideways_strategy': 'mean_reversion', 'sideways_bb_std_mult': 0.7159351055908345, 'sideways_rsi_os': 23, 'sideways_rsi_ob': 65, 'sideways_adx_thresh': 18.787008864000953, 'sideways_atr_min_pct': 0.02565363859038137, 'sideways_atr_max_pct': 0.024827689764838557, 'sideways_tp_mult': 2.2407343298607847, 'sideways_tsl_mult': 0.8855795788879581, 'sideways_time_stop': 28, 'sideways_use_sma': True, 'sideways_use_ema': True, 'sideways_use_atr': False, 'sideways_use_adx': False, 'sideways_use_spike': False, 'sideways_rsi_required': False}.
[I 2025-09-01 08:34:29,919] Trial 454 finished with values: [-1000000000.0, 1000000000.0] and parameters: {'p_sma': 16, 'p_std': 14, 'p_atr': 21, 'p_adx': 21, 'rsi_period': 62, 'ema1': 10, 'ema2': 60, 'slip_atr_k': 0.08219323935350148, 'slip_spread_k': 0.9697620021846218, 'spread_hl_frac': 0.0232080949301322, 'bb_std_mult': 3.566256981888478, 'rsi_os': 22, 'rsi_ob': 53, 'vol_spike': 0.2495328913935369, 'adx_thresh': 15.684009894782058, 'atr_min_pct': 0.020824801034009754, 'atr_max_pct': 0.1474093367681259, 'tp_mult': 1.9297451809854707, 'tsl_mult': 0.43058870257263404, 'strategy': 'mean_reversion', 'time_stop': 252, 'use_sma': True, 'use_atr': False, 'use_adx': False, 'use_ema': True, 'use_spike': False, 'rsi_required': False, 'edge_k': 0.2050558397690656, 'edge_cap': 0.6941586622324147, 'bull_strategy': 'breakout', 'bull_bb_std_mult': 0.8668589948539358, 'bull_rsi_os': 24, 'bull_rsi_ob': 68, 'bull_adx_thresh': 9.26596720426278, 'bull_atr_min_pct': 0.017570971739522278, 'bull_atr_max_pct': 0.04283946986991091, 'bull_tp_mult': 2.2340849511076675, 'bull_tsl_mult': 0.5632196288300126, 'bull_time_stop': 148, 'bull_use_sma': True, 'bull_use_ema': True, 'bull_use_atr': False, 'bull_use_adx': True, 'bull_use_spike': True, 'bull_rsi_required': False, 'bear_strategy': 'mean_reversion', 'bear_bb_std_mult': 1.9565673693591017, 'bear_rsi_os': 28, 'bear_rsi_ob': 94, 'bear_adx_thresh': 31.775895822160752, 'bear_atr_min_pct': 0.028293744074509117, 'bear_atr_max_pct': 0.03494949501206445, 'bear_tp_mult': 2.907016819698074, 'bear_tsl_mult': 0.05693276136665805, 'bear_time_stop': 274, 'bear_use_sma': False, 'bear_use_ema': False, 'bear_use_atr': False, 'bear_use_adx': True, 'bear_use_spike': True, 'bear_rsi_required': False, 'sideways_strategy': 'mean_reversion', 'sideways_bb_std_mult': 0.5035052071466525, 'sideways_rsi_os': 40, 'sideways_rsi_ob': 64, 'sideways_adx_thresh': 7.005570487627788, 'sideways_atr_min_pct': 0.02162174988898958, 'sideways_atr_max_pct': 0.03274269911892865, 'sideways_tp_mult': 2.808431974789034, 'sideways_tsl_mult': 0.11130908507211792, 'sideways_time_stop': 227, 'sideways_use_sma': True, 'sideways_use_ema': False, 'sideways_use_atr': False, 'sideways_use_adx': False, 'sideways_use_spike': True, 'sideways_rsi_required': False}.
[I 2025-09-01 08:34:30,088] Trial 455 finished with values: [-1000000000.0, 1000000000.0] and parameters: {'p_sma': 20, 'p_std': 17, 'p_atr': 23, 'p_adx': 20, 'rsi_period': 64, 'ema1': 21, 'ema2': 11, 'slip_atr_k': 0.06133018193395868, 'slip_spread_k': 0.6474105392299677, 'spread_hl_frac': 0.03874638793767893, 'bb_std_mult': 3.525004140520774, 'rsi_os': 23, 'rsi_ob': 66, 'vol_spike': 0.23106641320295818, 'adx_thresh': 27.437199919347044, 'atr_min_pct': 0.02340165555916625, 'atr_max_pct': 0.14999119805002406, 'tp_mult': 1.2376178643468574, 'tsl_mult': 0.4855272214728354, 'strategy': 'mean_reversion', 'time_stop': 239, 'use_sma': True, 'use_atr': True, 'use_adx': True, 'use_ema': True, 'use_spike': True, 'rsi_required': True, 'edge_k': 0.1623275032827063, 'edge_cap': 0.23438327039881424, 'bull_strategy': 'breakout', 'bull_bb_std_mult': 1.7567063400868899, 'bull_rsi_os': 24, 'bull_rsi_ob': 68, 'bull_adx_thresh': 32.806173293681674, 'bull_atr_min_pct': 0.010974098518343755, 'bull_atr_max_pct': 0.09461482987612164, 'bull_tp_mult': 2.1812996826810953, 'bull_tsl_mult': 0.5627734546806784, 'bull_time_stop': 293, 'bull_use_sma': True, 'bull_use_ema': False, 'bull_use_atr': False, 'bull_use_adx': True, 'bull_use_spike': True, 'bull_rsi_required': False, 'bear_strategy': 'mean_reversion', 'bear_bb_std_mult': 3.3793529661599866, 'bear_rsi_os': 18, 'bear_rsi_ob': 94, 'bear_adx_thresh': 26.7995409877213, 'bear_atr_min_pct': 0.02461622451750264, 'bear_atr_max_pct': 0.09045119563834744, 'bear_tp_mult': 2.905806657747298, 'bear_tsl_mult': 0.09615571060562654, 'bear_time_stop': 278, 'bear_use_sma': False, 'bear_use_ema': False, 'bear_use_atr': True, 'bear_use_adx': True, 'bear_use_spike': True, 'bear_rsi_required': False, 'sideways_strategy': 'mean_reversion', 'sideways_bb_std_mult': 0.502843785650201, 'sideways_rsi_os': 6, 'sideways_rsi_ob': 91, 'sideways_adx_thresh': 21.04704615498121, 'sideways_atr_min_pct': 0.02186281991604363, 'sideways_atr_max_pct': 0.03243818381257692, 'sideways_tp_mult': 2.5550970122123378, 'sideways_tsl_mult': 0.1625263344467815, 'sideways_time_stop': 274, 'sideways_use_sma': False, 'sideways_use_ema': False, 'sideways_use_atr': False, 'sideways_use_adx': True, 'sideways_use_spike': True, 'sideways_rsi_required': False}.
[I 2025-09-01 08:35:12,919] Trial 456 finished with values: [-1000000000.0, 1000000000.0] and parameters: {'p_sma': 23, 'p_std': 14, 'p_atr': 13, 'p_adx': 24, 'rsi_period': 65, 'ema1': 10, 'ema2': 12, 'slip_atr_k': 0.08066672948497569, 'slip_spread_k': 0.6720817745248616, 'spread_hl_frac': 0.023529431564547978, 'bb_std_mult': 0.6358925583873314, 'rsi_os': 37, 'rsi_ob': 57, 'vol_spike': 0.2127735068484368, 'adx_thresh': 25.434145531352623, 'atr_min_pct': 0.009127199639045857, 'atr_max_pct': 0.1451809307615564, 'tp_mult': 1.2533828840075745, 'tsl_mult': 0.5201362646985105, 'strategy': 'mean_reversion', 'time_stop': 239, 'use_sma': True, 'use_atr': False, 'use_adx': False, 'use_ema': True, 'use_spike': True, 'rsi_required': False, 'edge_k': 1.726645195232812, 'edge_cap': 0.06794475823852303, 'bull_strategy': 'breakout', 'bull_bb_std_mult': 2.7190909013983067, 'bull_rsi_os': 10, 'bull_rsi_ob': 68, 'bull_adx_thresh': 32.99316206487248, 'bull_atr_min_pct': 0.011078536937582394, 'bull_atr_max_pct': 0.051861874345524764, 'bull_tp_mult': 1.9076350819333079, 'bull_tsl_mult': 0.919810717925593, 'bull_time_stop': 147, 'bull_use_sma': True, 'bull_use_ema': True, 'bull_use_atr': False, 'bull_use_adx': True, 'bull_use_spike': True, 'bull_rsi_required': False, 'bear_strategy': 'mean_reversion', 'bear_bb_std_mult': 2.294510784863698, 'bear_rsi_os': 29, 'bear_rsi_ob': 94, 'bear_adx_thresh': 14.124314882413152, 'bear_atr_min_pct': 0.022132456124855107, 'bear_atr_max_pct': 0.07858556503172566, 'bear_tp_mult': 2.8768182980897627, 'bear_tsl_mult': 0.5557789871391923, 'bear_time_stop': 103, 'bear_use_sma': False, 'bear_use_ema': False, 'bear_use_atr': False, 'bear_use_adx': True, 'bear_use_spike': True, 'bear_rsi_required': False, 'sideways_strategy': 'mean_reversion', 'sideways_bb_std_mult': 2.1276832190795694, 'sideways_rsi_os': 9, 'sideways_rsi_ob': 64, 'sideways_adx_thresh': 7.266083984745176, 'sideways_atr_min_pct': 0.025543026601909866, 'sideways_atr_max_pct': 0.021179847730726585, 'sideways_tp_mult': 2.239305097258562, 'sideways_tsl_mult': 0.8877237617051712, 'sideways_time_stop': 27, 'sideways_use_sma': True, 'sideways_use_ema': False, 'sideways_use_atr': False, 'sideways_use_adx': False, 'sideways_use_spike': True, 'sideways_rsi_required': False}.
[I 2025-09-01 08:35:13,800] Trial 458 finished with values: [-1000000000.0, 1000000000.0] and parameters: {'p_sma': 23, 'p_std': 15, 'p_atr': 13, 'p_adx': 13, 'rsi_period': 22, 'ema1': 10, 'ema2': 11, 'slip_atr_k': 0.2355331306051064, 'slip_spread_k': 0.528389252436908, 'spread_hl_frac': 0.023577962819386032, 'bb_std_mult': 3.4207900292397144, 'rsi_os': 26, 'rsi_ob': 65, 'vol_spike': 0.1898937691637939, 'adx_thresh': 14.45950584683876, 'atr_min_pct': 0.021737195445798753, 'atr_max_pct': 0.14505975405428836, 'tp_mult': 1.2471155743930236, 'tsl_mult': 0.4857343584083425, 'strategy': 'mean_reversion', 'time_stop': 269, 'use_sma': True, 'use_atr': True, 'use_adx': True, 'use_ema': True, 'use_spike': True, 'rsi_required': True, 'edge_k': 1.080595401322252, 'edge_cap': 0.5476194006260549, 'bull_strategy': 'breakout', 'bull_bb_std_mult': 2.8316117158376963, 'bull_rsi_os': 11, 'bull_rsi_ob': 71, 'bull_adx_thresh': 6.881476718806422, 'bull_atr_min_pct': 0.020760526269360945, 'bull_atr_max_pct': 0.03860524557158769, 'bull_tp_mult': 1.910935841202536, 'bull_tsl_mult': 0.8885554607123743, 'bull_time_stop': 164, 'bull_use_sma': True, 'bull_use_ema': False, 'bull_use_atr': False, 'bull_use_adx': True, 'bull_use_spike': True, 'bull_rsi_required': False, 'bear_strategy': 'mean_reversion', 'bear_bb_std_mult': 3.1282704269158885, 'bear_rsi_os': 29, 'bear_rsi_ob': 91, 'bear_adx_thresh': 12.570612653897632, 'bear_atr_min_pct': 0.022284350505217838, 'bear_atr_max_pct': 0.07943131561442399, 'bear_tp_mult': 2.8886025259343744, 'bear_tsl_mult': 0.10168472747582484, 'bear_time_stop': 76, 'bear_use_sma': False, 'bear_use_ema': False, 'bear_use_atr': True, 'bear_use_adx': True, 'bear_use_spike': True, 'bear_rsi_required': False, 'sideways_strategy': 'mean_reversion', 'sideways_bb_std_mult': 3.168233057238946, 'sideways_rsi_os': 8, 'sideways_rsi_ob': 85, 'sideways_adx_thresh': 13.560231534492456, 'sideways_atr_min_pct': 0.026430206166561814, 'sideways_atr_max_pct': 0.020776466097621522, 'sideways_tp_mult': 2.5772511815208525, 'sideways_tsl_mult': 0.974524559025129, 'sideways_time_stop': 27, 'sideways_use_sma': False, 'sideways_use_ema': False, 'sideways_use_atr': False, 'sideways_use_adx': True, 'sideways_use_spike': True, 'sideways_rsi_required': False}.
[I 2025-09-01 08:35:14,271] Trial 457 finished with values: [-1000000000.0, 1000000000.0] and parameters: {'p_sma': 46, 'p_std': 14, 'p_atr': 13, 'p_adx': 19, 'rsi_period': 66, 'ema1': 30, 'ema2': 12, 'slip_atr_k': 0.23347896086919417, 'slip_spread_k': 0.6726144592121712, 'spread_hl_frac': 0.0230949900953826, 'bb_std_mult': 2.0241184580057365, 'rsi_os': 20, 'rsi_ob': 65, 'vol_spike': 0.21199771397481293, 'adx_thresh': 14.654311906455662, 'atr_min_pct': 0.021393003696498242, 'atr_max_pct': 0.14536241131857147, 'tp_mult': 1.238382239112396, 'tsl_mult': 0.4868347692516412, 'strategy': 'mean_reversion', 'time_stop': 269, 'use_sma': True, 'use_atr': True, 'use_adx': True, 'use_ema': True, 'use_spike': False, 'rsi_required': True, 'edge_k': 0.9406208677580321, 'edge_cap': 0.6809177975566156, 'bull_strategy': 'breakout', 'bull_bb_std_mult': 1.7733731978706062, 'bull_rsi_os': 12, 'bull_rsi_ob': 70, 'bull_adx_thresh': 32.98976297656221, 'bull_atr_min_pct': 0.02079057691962033, 'bull_atr_max_pct': 0.0425159150258302, 'bull_tp_mult': 1.3713934159582815, 'bull_tsl_mult': 0.9154293461994703, 'bull_time_stop': 163, 'bull_use_sma': True, 'bull_use_ema': False, 'bull_use_atr': False, 'bull_use_adx': True, 'bull_use_spike': True, 'bull_rsi_required': False, 'bear_strategy': 'mean_reversion', 'bear_bb_std_mult': 3.1051321417332196, 'bear_rsi_os': 8, 'bear_rsi_ob': 94, 'bear_adx_thresh': 32.541632270426796, 'bear_atr_min_pct': 0.028157715146368494, 'bear_atr_max_pct': 0.05080129490800868, 'bear_tp_mult': 2.897472936604816, 'bear_tsl_mult': 0.09615354802852273, 'bear_time_stop': 35, 'bear_use_sma': False, 'bear_use_ema': False, 'bear_use_atr': False, 'bear_use_adx': True, 'bear_use_spike': True, 'bear_rsi_required': False, 'sideways_strategy': 'mean_reversion', 'sideways_bb_std_mult': 2.296404013997413, 'sideways_rsi_os': 6, 'sideways_rsi_ob': 84, 'sideways_adx_thresh': 20.865137701323576, 'sideways_atr_min_pct': 0.022378963733198132, 'sideways_atr_max_pct': 0.03273755786839881, 'sideways_tp_mult': 2.541156381902801, 'sideways_tsl_mult': 0.16390655916144836, 'sideways_time_stop': 46, 'sideways_use_sma': False, 'sideways_use_ema': False, 'sideways_use_atr': False, 'sideways_use_adx': True, 'sideways_use_spike': True, 'sideways_rsi_required': False}.
