[I 2025-09-01 07:57:49,809] Trial 234 finished with values: [-0.2606665239704675, 0.260785543389805] and parameters: {'p_sma': 17, 'p_std': 55, 'p_atr': 13, 'p_adx': 14, 'rsi_period': 13, 'ema1': 19, 'ema2': 23, 'slip_atr_k': 0.19110506754934026, 'slip_spread_k': 0.9299929396985919, 'spread_hl_frac': 0.025784061403530442, 'bb_std_mult': 3.377224241138708, 'rsi_os': 37, 'rsi_ob': 63, 'vol_spike': 0.12983075023852667, 'adx_thresh': 25.425383215689507, 'atr_min_pct': 0.026682041787547864, 'atr_max_pct': 0.14587491413856268, 'tp_mult': 1.180847169208843, 'tsl_mult': 0.6881668288045435, 'strategy': 'breakout', 'time_stop': 247, 'use_sma': True, 'use_atr': True, 'use_adx': True, 'use_ema': True, 'use_spike': True, 'rsi_required': False, 'edge_k': 0.9809685563887783, 'edge_cap': 0.05001426116647842, 'bull_strategy': 'breakout', 'bull_bb_std_mult': 2.988895789232594, 'bull_rsi_os': 12, 'bull_rsi_ob': 70, 'bull_adx_thresh': 7.472051200774827, 'bull_atr_min_pct': 0.002839545069805595, 'bull_atr_max_pct': 0.041527259189073955, 'bull_tp_mult': 1.9223198416600924, 'bull_tsl_mult': 0.6425869591475526, 'bull_time_stop': 71, 'bull_use_sma': True, 'bull_use_ema': False, 'bull_use_atr': True, 'bull_use_adx': True, 'bull_use_spike': False, 'bull_rsi_required': False, 'bear_strategy': 'breakout', 'bear_bb_std_mult': 3.201254831309648, 'bear_rsi_os': 27, 'bear_rsi_ob': 52, 'bear_adx_thresh': 24.827927615436423, 'bear_atr_min_pct': 0.0007000658637382751, 'bear_atr_max_pct': 0.0776950898798322, 'bear_tp_mult': 2.8133886595638242, 'bear_tsl_mult': 0.28432497759839803, 'bear_time_stop': 5, 'bear_use_sma': True, 'bear_use_ema': False, 'bear_use_atr': False, 'bear_use_adx': True, 'bear_use_spike': True, 'bear_rsi_required': False, 'sideways_strategy': 'mean_reversion', 'sideways_bb_std_mult': 2.6580191716479042, 'sideways_rsi_os': 40, 'sideways_rsi_ob': 89, 'sideways_adx_thresh': 19.735001858618027, 'sideways_atr_min_pct': 0.023021014553666105, 'sideways_atr_max_pct': 0.03513838628417295, 'sideways_tp_mult': 2.5608361130955193, 'sideways_tsl_mult': 0.38646077855667543, 'sideways_time_stop': 20, 'sideways_use_sma': False, 'sideways_use_ema': True, 'sideways_use_atr': False, 'sideways_use_adx': True, 'sideways_use_spike': True, 'sideways_rsi_required': True}.
[I 2025-09-01 07:57:50,174] Trial 236 finished with values: [-0.06145756147659254, 0.061903375466464614] and parameters: {'p_sma': 21, 'p_std': 14, 'p_atr': 13, 'p_adx': 14, 'rsi_period': 12, 'ema1': 11, 'ema2': 12, 'slip_atr_k': 0.05182389559173804, 'slip_spread_k': 0.8863424383689467, 'spread_hl_frac': 0.024499032269328386, 'bb_std_mult': 3.4782197183149055, 'rsi_os': 17, 'rsi_ob': 63, 'vol_spike': 0.13025071184959197, 'adx_thresh': 25.63318226501768, 'atr_min_pct': 0.020671503266092184, 'atr_max_pct': 0.14494120320727963, 'tp_mult': 1.1826448019664544, 'tsl_mult': 0.4484036210249261, 'strategy': 'mean_reversion', 'time_stop': 120, 'use_sma': True, 'use_atr': False, 'use_adx': True, 'use_ema': True, 'use_spike': False, 'rsi_required': True, 'edge_k': 0.9918843383721228, 'edge_cap': 0.30318958219082304, 'bull_strategy': 'breakout', 'bull_bb_std_mult': 3.557556957602638, 'bull_rsi_os': 12, 'bull_rsi_ob': 71, 'bull_adx_thresh': 28.009515011096912, 'bull_atr_min_pct': 0.002594802367133663, 'bull_atr_max_pct': 0.041561478085666424, 'bull_tp_mult': 2.3019421936415925, 'bull_tsl_mult': 0.7072349048684545, 'bull_time_stop': 73, 'bull_use_sma': True, 'bull_use_ema': True, 'bull_use_atr': True, 'bull_use_adx': True, 'bull_use_spike': False, 'bull_rsi_required': False, 'bear_strategy': 'breakout', 'bear_bb_std_mult': 2.6577374256683552, 'bear_rsi_os': 17, 'bear_rsi_ob': 94, 'bear_adx_thresh': 25.85345469706105, 'bear_atr_min_pct': 0.021960854700394054, 'bear_atr_max_pct': 0.07758667661662293, 'bear_tp_mult': 2.8433287078773475, 'bear_tsl_mult': 0.054681752254872644, 'bear_time_stop': 53, 'bear_use_sma': True, 'bear_use_ema': False, 'bear_use_atr': False, 'bear_use_adx': True, 'bear_use_spike': True, 'bear_rsi_required': False, 'sideways_strategy': 'breakout', 'sideways_bb_std_mult': 3.544637925778935, 'sideways_rsi_os': 13, 'sideways_rsi_ob': 67, 'sideways_adx_thresh': 9.15534604268455, 'sideways_atr_min_pct': 0.012407589746759432, 'sideways_atr_max_pct': 0.10604732466425752, 'sideways_tp_mult': 2.561575052803161, 'sideways_tsl_mult': 0.16742547508761815, 'sideways_time_stop': 128, 'sideways_use_sma': False, 'sideways_use_ema': False, 'sideways_use_atr': True, 'sideways_use_adx': True, 'sideways_use_spike': True, 'sideways_rsi_required': True}.
[I 2025-09-01 07:57:50,366] Trial 233 finished with values: [-1000000000.0, 1000000000.0] and parameters: {'p_sma': 17, 'p_std': 55, 'p_atr': 12, 'p_adx': 13, 'rsi_period': 63, 'ema1': 27, 'ema2': 56, 'slip_atr_k': 0.06041496908800089, 'slip_spread_k': 0.33746264608500637, 'spread_hl_frac': 0.026033150311647598, 'bb_std_mult': 3.231170010597, 'rsi_os': 17, 'rsi_ob': 52, 'vol_spike': 0.2238995966691809, 'adx_thresh': 9.784493658606, 'atr_min_pct': 0.016574961988621514, 'atr_max_pct': 0.043585791114433406, 'tp_mult': 1.2503923114295112, 'tsl_mult': 0.1914071270736002, 'strategy': 'breakout', 'time_stop': 247, 'use_sma': True, 'use_atr': True, 'use_adx': True, 'use_ema': True, 'use_spike': True, 'rsi_required': False, 'edge_k': 0.7259638394461092, 'edge_cap': 0.3036505574614234, 'bull_strategy': 'breakout', 'bull_bb_std_mult': 1.8957492392803068, 'bull_rsi_os': 12, 'bull_rsi_ob': 89, 'bull_adx_thresh': 32.94253725508205, 'bull_atr_min_pct': 0.00877059383186585, 'bull_atr_max_pct': 0.11986381139165013, 'bull_tp_mult': 2.4387083824507068, 'bull_tsl_mult': 0.643007538006735, 'bull_time_stop': 160, 'bull_use_sma': True, 'bull_use_ema': False, 'bull_use_atr': True, 'bull_use_adx': True, 'bull_use_spike': False, 'bull_rsi_required': False, 'bear_strategy': 'mean_reversion', 'bear_bb_std_mult': 3.2078872739053184, 'bear_rsi_os': 43, 'bear_rsi_ob': 95, 'bear_adx_thresh': 32.520878755476936, 'bear_atr_min_pct': 0.022957295633991646, 'bear_atr_max_pct': 0.07001174147887407, 'bear_tp_mult': 2.2477047191262747, 'bear_tsl_mult': 0.13553167218944223, 'bear_time_stop': 57, 'bear_use_sma': True, 'bear_use_ema': False, 'bear_use_atr': False, 'bear_use_adx': True, 'bear_use_spike': True, 'bear_rsi_required': True, 'sideways_strategy': 'mean_reversion', 'sideways_bb_std_mult': 0.6086450043098587, 'sideways_rsi_os': 13, 'sideways_rsi_ob': 63, 'sideways_adx_thresh': 12.27233394520768, 'sideways_atr_min_pct': 0.024051168724672237, 'sideways_atr_max_pct': 0.03593580600502916, 'sideways_tp_mult': 2.551785015671084, 'sideways_tsl_mult': 0.2142780787257283, 'sideways_time_stop': 17, 'sideways_use_sma': False, 'sideways_use_ema': True, 'sideways_use_atr': False, 'sideways_use_adx': True, 'sideways_use_spike': True, 'sideways_rsi_required': True}.
[I 2025-09-01 07:58:32,780] Trial 237 finished with values: [-1000000000.0, 1000000000.0] and parameters: {'p_sma': 21, 'p_std': 14, 'p_atr': 11, 'p_adx': 15, 'rsi_period': 48, 'ema1': 11, 'ema2': 31, 'slip_atr_k': 0.05994722213120206, 'slip_spread_k': 0.7069841291076482, 'spread_hl_frac': 0.03253578043843744, 'bb_std_mult': 3.400698233708431, 'rsi_os': 44, 'rsi_ob': 83, 'vol_spike': 0.2496898268007151, 'adx_thresh': 26.716839095561646, 'atr_min_pct': 0.02201580685350106, 'atr_max_pct': 0.14456313199164947, 'tp_mult': 1.1850455100164938, 'tsl_mult': 0.19349833516313036, 'strategy': 'mean_reversion', 'time_stop': 267, 'use_sma': True, 'use_atr': False, 'use_adx': True, 'use_ema': True, 'use_spike': False, 'rsi_required': True, 'edge_k': 0.34538402610763996, 'edge_cap': 0.08387054742100454, 'bull_strategy': 'breakout', 'bull_bb_std_mult': 2.3597704165495608, 'bull_rsi_os': 11, 'bull_rsi_ob': 80, 'bull_adx_thresh': 9.103719206773961, 'bull_atr_min_pct': 0.008977740889615834, 'bull_atr_max_pct': 0.04018730811858639, 'bull_tp_mult': 2.4295838934337697, 'bull_tsl_mult': 0.7137356670962838, 'bull_time_stop': 162, 'bull_use_sma': True, 'bull_use_ema': True, 'bull_use_atr': False, 'bull_use_adx': True, 'bull_use_spike': True, 'bull_rsi_required': False, 'bear_strategy': 'mean_reversion', 'bear_bb_std_mult': 3.124302574491031, 'bear_rsi_os': 17, 'bear_rsi_ob': 95, 'bear_adx_thresh': 5.094824507345685, 'bear_atr_min_pct': 0.02191496950908287, 'bear_atr_max_pct': 0.0773202019697861, 'bear_tp_mult': 1.4057694698046466, 'bear_tsl_mult': 0.5652079022089714, 'bear_time_stop': 93, 'bear_use_sma': True, 'bear_use_ema': False, 'bear_use_atr': True, 'bear_use_adx': True, 'bear_use_spike': True, 'bear_rsi_required': False, 'sideways_strategy': 'breakout', 'sideways_bb_std_mult': 0.6044751413776543, 'sideways_rsi_os': 37, 'sideways_rsi_ob': 63, 'sideways_adx_thresh': 12.37484470108262, 'sideways_atr_min_pct': 0.012505537877569734, 'sideways_atr_max_pct': 0.03570224331821398, 'sideways_tp_mult': 1.6522119690868082, 'sideways_tsl_mult': 0.16862237547291026, 'sideways_time_stop': 25, 'sideways_use_sma': False, 'sideways_use_ema': False, 'sideways_use_atr': True, 'sideways_use_adx': True, 'sideways_use_spike': True, 'sideways_rsi_required': True}.
[I 2025-09-01 07:58:33,337] Trial 240 finished with values: [-0.12204387497290914, 0.12333414422094639] and parameters: {'p_sma': 60, 'p_std': 14, 'p_atr': 11, 'p_adx': 27, 'rsi_period': 48, 'ema1': 11, 'ema2': 12, 'slip_atr_k': 0.05182135994379771, 'slip_spread_k': 0.669851467992192, 'spread_hl_frac': 0.024495439902978183, 'bb_std_mult': 3.4962859579921237, 'rsi_os': 46, 'rsi_ob': 55, 'vol_spike': 0.08372063496747488, 'adx_thresh': 25.85563962298159, 'atr_min_pct': 0.021266514535787765, 'atr_max_pct': 0.03815059720171267, 'tp_mult': 1.9593387011503465, 'tsl_mult': 0.4519860562173957, 'strategy': 'mean_reversion', 'time_stop': 106, 'use_sma': True, 'use_atr': False, 'use_adx': True, 'use_ema': True, 'use_spike': False, 'rsi_required': True, 'edge_k': 1.6713428341398469, 'edge_cap': 0.09899082830153283, 'bull_strategy': 'breakout', 'bull_bb_std_mult': 3.518895346817173, 'bull_rsi_os': 14, 'bull_rsi_ob': 61, 'bull_adx_thresh': 26.1361766658774, 'bull_atr_min_pct': 0.001510285690072825, 'bull_atr_max_pct': 0.04625409859676314, 'bull_tp_mult': 2.2672836888232424, 'bull_tsl_mult': 0.013992938307411162, 'bull_time_stop': 50, 'bull_use_sma': True, 'bull_use_ema': True, 'bull_use_atr': False, 'bull_use_adx': True, 'bull_use_spike': True, 'bull_rsi_required': False, 'bear_strategy': 'breakout', 'bear_bb_std_mult': 3.143709153806554, 'bear_rsi_os': 47, 'bear_rsi_ob': 77, 'bear_adx_thresh': 5.008129975367826, 'bear_atr_min_pct': 0.005651014713550666, 'bear_atr_max_pct': 0.04718280489801871, 'bear_tp_mult': 2.926337523106534, 'bear_tsl_mult': 0.04861639428186443, 'bear_time_stop': 52, 'bear_use_sma': False, 'bear_use_ema': False, 'bear_use_atr': True, 'bear_use_adx': True, 'bear_use_spike': True, 'bear_rsi_required': False, 'sideways_strategy': 'breakout', 'sideways_bb_std_mult': 3.2581184276998068, 'sideways_rsi_os': 39, 'sideways_rsi_ob': 53, 'sideways_adx_thresh': 8.799509524491814, 'sideways_atr_min_pct': 0.023228911205480894, 'sideways_atr_max_pct': 0.14452857229088636, 'sideways_tp_mult': 2.635158619082583, 'sideways_tsl_mult': 0.16749056071772894, 'sideways_time_stop': 26, 'sideways_use_sma': False, 'sideways_use_ema': False, 'sideways_use_atr': True, 'sideways_use_adx': True, 'sideways_use_spike': True, 'sideways_rsi_required': False}.
[I 2025-09-01 07:58:33,349] Trial 238 finished with values: [-1000000000.0, 1000000000.0] and parameters: {'p_sma': 59, 'p_std': 14, 'p_atr': 11, 'p_adx': 15, 'rsi_period': 66, 'ema1': 11, 'ema2': 41, 'slip_atr_k': 0.05936441600220012, 'slip_spread_k': 0.06814636318840683, 'spread_hl_frac': 0.024469242638147502, 'bb_std_mult': 3.4146520995645187, 'rsi_os': 16, 'rsi_ob': 76, 'vol_spike': 0.24832301519506272, 'adx_thresh': 26.545773593418353, 'atr_min_pct': 0.013107216228478527, 'atr_max_pct': 0.14467698905821258, 'tp_mult': 1.9601730994310773, 'tsl_mult': 0.4529273978694336, 'strategy': 'mean_reversion', 'time_stop': 246, 'use_sma': True, 'use_atr': False, 'use_adx': True, 'use_ema': True, 'use_spike': False, 'rsi_required': True, 'edge_k': 0.24707858309669173, 'edge_cap': 0.9510715305071974, 'bull_strategy': 'breakout', 'bull_bb_std_mult': 0.9887624584086312, 'bull_rsi_os': 11, 'bull_rsi_ob': 71, 'bull_adx_thresh': 10.694800608070057, 'bull_atr_min_pct': 0.009865975098317012, 'bull_atr_max_pct': 0.10042214000233829, 'bull_tp_mult': 2.9933828527893267, 'bull_tsl_mult': 0.14637556743558305, 'bull_time_stop': 160, 'bull_use_sma': True, 'bull_use_ema': True, 'bull_use_atr': False, 'bull_use_adx': True, 'bull_use_spike': True, 'bull_rsi_required': False, 'bear_strategy': 'mean_reversion', 'bear_bb_std_mult': 3.1249126274227317, 'bear_rsi_os': 22, 'bear_rsi_ob': 95, 'bear_adx_thresh': 31.19470647957741, 'bear_atr_min_pct': 0.01021687448999917, 'bear_atr_max_pct': 0.147554672137706, 'bear_tp_mult': 2.1817097770598517, 'bear_tsl_mult': 0.5643160166511437, 'bear_time_stop': 92, 'bear_use_sma': True, 'bear_use_ema': False, 'bear_use_atr': True, 'bear_use_adx': True, 'bear_use_spike': True, 'bear_rsi_required': False, 'sideways_strategy': 'breakout', 'sideways_bb_std_mult': 0.5532800973425718, 'sideways_rsi_os': 37, 'sideways_rsi_ob': 63, 'sideways_adx_thresh': 8.983476835092446, 'sideways_atr_min_pct': 0.02448247362738431, 'sideways_atr_max_pct': 0.035725114542389, 'sideways_tp_mult': 2.549516494822496, 'sideways_tsl_mult': 0.029768363667744713, 'sideways_time_stop': 24, 'sideways_use_sma': False, 'sideways_use_ema': False, 'sideways_use_atr': True, 'sideways_use_adx': True, 'sideways_use_spike': True, 'sideways_rsi_required': True}.
[I 2025-09-01 07:58:33,534] Trial 239 finished with values: [-1000000000.0, 1000000000.0] and parameters: {'p_sma': 59, 'p_std': 14, 'p_atr': 11, 'p_adx': 22, 'rsi_period': 45, 'ema1': 11, 'ema2': 12, 'slip_atr_k': 0.05052067747128782, 'slip_spread_k': 0.7634327048296398, 'spread_hl_frac': 0.024627463262212268, 'bb_std_mult': 3.4937191413446613, 'rsi_os': 45, 'rsi_ob': 83, 'vol_spike': 0.11809406062538054, 'adx_thresh': 25.977023878202754, 'atr_min_pct': 0.02079082225465269, 'atr_max_pct': 0.14436564099020133, 'tp_mult': 1.1861056438775284, 'tsl_mult': 0.45620570157329005, 'strategy': 'mean_reversion', 'time_stop': 105, 'use_sma': True, 'use_atr': False, 'use_adx': True, 'use_ema': True, 'use_spike': False, 'rsi_required': True, 'edge_k': 0.5263065333572774, 'edge_cap': 0.26676849629910226, 'bull_strategy': 'breakout', 'bull_bb_std_mult': 2.398617157270828, 'bull_rsi_os': 11, 'bull_rsi_ob': 83, 'bull_adx_thresh': 9.069574596768456, 'bull_atr_min_pct': 0.005458542399574376, 'bull_atr_max_pct': 0.09966193733613972, 'bull_tp_mult': 2.2997176018023033, 'bull_tsl_mult': 0.38202389225579214, 'bull_time_stop': 46, 'bull_use_sma': True, 'bull_use_ema': True, 'bull_use_atr': False, 'bull_use_adx': True, 'bull_use_spike': True, 'bull_rsi_required': False, 'bear_strategy': 'breakout', 'bear_bb_std_mult': 3.1307638480939595, 'bear_rsi_os': 17, 'bear_rsi_ob': 94, 'bear_adx_thresh': 14.265912042845695, 'bear_atr_min_pct': 0.010043032310743244, 'bear_atr_max_pct': 0.09669643353988645, 'bear_tp_mult': 1.3814098274780302, 'bear_tsl_mult': 0.5748949717329122, 'bear_time_stop': 47, 'bear_use_sma': False, 'bear_use_ema': False, 'bear_use_atr': True, 'bear_use_adx': True, 'bear_use_spike': True, 'bear_rsi_required': False, 'sideways_strategy': 'breakout', 'sideways_bb_std_mult': 0.5603132621674936, 'sideways_rsi_os': 39, 'sideways_rsi_ob': 53, 'sideways_adx_thresh': 9.091818386707791, 'sideways_atr_min_pct': 0.023577151985648345, 'sideways_atr_max_pct': 0.10103835014378139, 'sideways_tp_mult': 2.6075687379201615, 'sideways_tsl_mult': 0.6851531784038828, 'sideways_time_stop': 26, 'sideways_use_sma': False, 'sideways_use_ema': False, 'sideways_use_atr': True, 'sideways_use_adx': True, 'sideways_use_spike': True, 'sideways_rsi_required': False}.
[I 2025-09-01 07:58:34,523] Trial 244 finished with values: [-1000000000.0, 1000000000.0] and parameters: {'p_sma': 21, 'p_std': 15, 'p_atr': 13, 'p_adx': 19, 'rsi_period': 64, 'ema1': 16, 'ema2': 15, 'slip_atr_k': 0.016005524314525496, 'slip_spread_k': 0.021418800800573623, 'spread_hl_frac': 0.024098812360961546, 'bb_std_mult': 0.5808801348439927, 'rsi_os': 50, 'rsi_ob': 56, 'vol_spike': 0.14039968261171074, 'adx_thresh': 25.05215440843339, 'atr_min_pct': 0.021245722432011085, 'atr_max_pct': 0.09569370093328813, 'tp_mult': 1.227796142712381, 'tsl_mult': 0.48234349509178903, 'strategy': 'mean_reversion', 'time_stop': 255, 'use_sma': False, 'use_atr': True, 'use_adx': False, 'use_ema': False, 'use_spike': True, 'rsi_required': True, 'edge_k': 0.9252235084001161, 'edge_cap': 0.33770652816034297, 'bull_strategy': 'mean_reversion', 'bull_bb_std_mult': 2.841913228337656, 'bull_rsi_os': 13, 'bull_rsi_ob': 70, 'bull_adx_thresh': 34.2698014136789, 'bull_atr_min_pct': 0.0025392286124933275, 'bull_atr_max_pct': 0.043605938450748935, 'bull_tp_mult': 2.2779624728632335, 'bull_tsl_mult': 0.6686108720511293, 'bull_time_stop': 60, 'bull_use_sma': True, 'bull_use_ema': False, 'bull_use_atr': False, 'bull_use_adx': True, 'bull_use_spike': True, 'bull_rsi_required': True, 'bear_strategy': 'mean_reversion', 'bear_bb_std_mult': 2.9897682957437763, 'bear_rsi_os': 8, 'bear_rsi_ob': 94, 'bear_adx_thresh': 8.142191381396309, 'bear_atr_min_pct': 0.02371122046988946, 'bear_atr_max_pct': 0.1338717943279793, 'bear_tp_mult': 2.844546180482833, 'bear_tsl_mult': 0.8680134964361894, 'bear_time_stop': 161, 'bear_use_sma': False, 'bear_use_ema': True, 'bear_use_atr': True, 'bear_use_adx': True, 'bear_use_spike': False, 'bear_rsi_required': False, 'sideways_strategy': 'mean_reversion', 'sideways_bb_std_mult': 0.6721085373686416, 'sideways_rsi_os': 38, 'sideways_rsi_ob': 66, 'sideways_adx_thresh': 20.73623466962335, 'sideways_atr_min_pct': 0.019448053996430143, 'sideways_atr_max_pct': 0.10611392840488498, 'sideways_tp_mult': 2.664692974267089, 'sideways_tsl_mult': 0.6131528417577388, 'sideways_time_stop': 70, 'sideways_use_sma': True, 'sideways_use_ema': False, 'sideways_use_atr': False, 'sideways_use_adx': False, 'sideways_use_spike': False, 'sideways_rsi_required': False}.
[I 2025-09-01 07:59:15,081] Trial 242 finished with values: [-1000000000.0, 1000000000.0] and parameters: {'p_sma': 23, 'p_std': 15, 'p_atr': 13, 'p_adx': 10, 'rsi_period': 78, 'ema1': 10, 'ema2': 15, 'slip_atr_k': 0.015959909339049713, 'slip_spread_k': 0.8985400333976029, 'spread_hl_frac': 0.024041527271805526, 'bb_std_mult': 1.5961849672116761, 'rsi_os': 25, 'rsi_ob': 57, 'vol_spike': 0.2349099789664471, 'adx_thresh': 17.205226586662235, 'atr_min_pct': 0.020825454892921612, 'atr_max_pct': 0.09589727789450028, 'tp_mult': 2.2191456192091814, 'tsl_mult': 0.3405025802784599, 'strategy': 'mean_reversion', 'time_stop': 263, 'use_sma': False, 'use_atr': True, 'use_adx': False, 'use_ema': True, 'use_spike': True, 'rsi_required': True, 'edge_k': 1.9944664771466738, 'edge_cap': 0.06535520837452952, 'bull_strategy': 'mean_reversion', 'bull_bb_std_mult': 2.9562950120640035, 'bull_rsi_os': 12, 'bull_rsi_ob': 68, 'bull_adx_thresh': 28.656581254190616, 'bull_atr_min_pct': 0.007078756450586428, 'bull_atr_max_pct': 0.09452723005385334, 'bull_tp_mult': 2.2931456359820417, 'bull_tsl_mult': 0.6654085679251807, 'bull_time_stop': 90, 'bull_use_sma': True, 'bull_use_ema': False, 'bull_use_atr': False, 'bull_use_adx': True, 'bull_use_spike': True, 'bull_rsi_required': True, 'bear_strategy': 'breakout', 'bear_bb_std_mult': 2.9668225788853873, 'bear_rsi_os': 29, 'bear_rsi_ob': 94, 'bear_adx_thresh': 30.25525519634473, 'bear_atr_min_pct': 0.011973260707431065, 'bear_atr_max_pct': 0.09754708430146866, 'bear_tp_mult': 2.8471295791668467, 'bear_tsl_mult': 0.8716515006762244, 'bear_time_stop': 158, 'bear_use_sma': False, 'bear_use_ema': True, 'bear_use_atr': True, 'bear_use_adx': True, 'bear_use_spike': True, 'bear_rsi_required': False, 'sideways_strategy': 'mean_reversion', 'sideways_bb_std_mult': 0.6881068777764282, 'sideways_rsi_os': 31, 'sideways_rsi_ob': 67, 'sideways_adx_thresh': 26.214736493863153, 'sideways_atr_min_pct': 0.0195618022469537, 'sideways_atr_max_pct': 0.10539254441788663, 'sideways_tp_mult': 2.604549092194099, 'sideways_tsl_mult': 0.18716343853302195, 'sideways_time_stop': 136, 'sideways_use_sma': True, 'sideways_use_ema': False, 'sideways_use_atr': False, 'sideways_use_adx': False, 'sideways_use_spike': False, 'sideways_rsi_required': False}.
