[I 2025-09-01 07:46:29,188] Trial 163 finished with values: [-0.048822728303342555, 0.04912460446035829] and parameters: {'p_sma': 16, 'p_std': 23, 'p_atr': 23, 'p_adx': 30, 'rsi_period': 64, 'ema1': 8, 'ema2': 40, 'slip_atr_k': 0.1203727583586085, 'slip_spread_k': 0.09813013651927238, 'spread_hl_frac': 0.021255261753124144, 'bb_std_mult': 3.3978602631881563, 'rsi_os': 23, 'rsi_ob': 57, 'vol_spike': 0.23133284412212768, 'adx_thresh': 30.39097663736726, 'atr_min_pct': 0.017078853515362404, 'atr_max_pct': 0.14352906999976411, 'tp_mult': 2.764268360606267, 'tsl_mult': 0.37933258299128975, 'strategy': 'mean_reversion', 'time_stop': 266, 'use_sma': True, 'use_atr': True, 'use_adx': True, 'use_ema': True, 'use_spike': True, 'rsi_required': True, 'edge_k': 1.5839576220695233, 'edge_cap': 0.0914681996658053, 'bull_strategy': 'breakout', 'bull_bb_std_mult': 2.8917995703259263, 'bull_rsi_os': 19, 'bull_rsi_ob': 74, 'bull_adx_thresh': 6.45999331897027, 'bull_atr_min_pct': 0.0029465512473492743, 'bull_atr_max_pct': 0.06076977965730905, 'bull_tp_mult': 2.9266472415954254, 'bull_tsl_mult': 0.6885887220112608, 'bull_time_stop': 159, 'bull_use_sma': True, 'bull_use_ema': False, 'bull_use_atr': False, 'bull_use_adx': True, 'bull_use_spike': True, 'bull_rsi_required': True, 'bear_strategy': 'mean_reversion', 'bear_bb_std_mult': 3.281679322775683, 'bear_rsi_os': 9, 'bear_rsi_ob': 94, 'bear_adx_thresh': 31.44302678137995, 'bear_atr_min_pct': 0.02143383989449035, 'bear_atr_max_pct': 0.07137168301013011, 'bear_tp_mult': 2.8162775159802504, 'bear_tsl_mult': 0.78124372795692, 'bear_time_stop': 71, 'bear_use_sma': False, 'bear_use_ema': False, 'bear_use_atr': True, 'bear_use_adx': True, 'bear_use_spike': True, 'bear_rsi_required': False, 'sideways_strategy': 'mean_reversion', 'sideways_bb_std_mult': 0.5389256780654418, 'sideways_rsi_os': 40, 'sideways_rsi_ob': 77, 'sideways_adx_thresh': 15.826210154289292, 'sideways_atr_min_pct': 0.004169469034363079, 'sideways_atr_max_pct': 0.081721898079067, 'sideways_tp_mult': 2.668847699889932, 'sideways_tsl_mult': 0.17477089430533507, 'sideways_time_stop': 25, 'sideways_use_sma': False, 'sideways_use_ema': False, 'sideways_use_atr': False, 'sideways_use_adx': True, 'sideways_use_spike': True, 'sideways_rsi_required': False}.
[I 2025-09-01 07:46:29,313] Trial 160 finished with values: [-0.19011456410404337, 0.18996335547837254] and parameters: {'p_sma': 15, 'p_std': 15, 'p_atr': 21, 'p_adx': 17, 'rsi_period': 64, 'ema1': 10, 'ema2': 20, 'slip_atr_k': 0.2299648659989117, 'slip_spread_k': 0.7011086066196809, 'spread_hl_frac': 0.020555800270295556, 'bb_std_mult': 1.102847554858178, 'rsi_os': 12, 'rsi_ob': 57, 'vol_spike': 0.2323296697182283, 'adx_thresh': 34.88607539215541, 'atr_min_pct': 0.0006529555064079037, 'atr_max_pct': 0.05117873692288193, 'tp_mult': 1.1764709027763438, 'tsl_mult': 0.3824788194179611, 'strategy': 'breakout', 'time_stop': 265, 'use_sma': False, 'use_atr': True, 'use_adx': False, 'use_ema': True, 'use_spike': True, 'rsi_required': True, 'edge_k': 1.1286410787825718, 'edge_cap': 0.09486799858601819, 'bull_strategy': 'mean_reversion', 'bull_bb_std_mult': 2.8836925356601886, 'bull_rsi_os': 20, 'bull_rsi_ob': 74, 'bull_adx_thresh': 8.9062055521721, 'bull_atr_min_pct': 0.0012530973876158855, 'bull_atr_max_pct': 0.04584344648700643, 'bull_tp_mult': 2.9455426635625894, 'bull_tsl_mult': 0.6915681415693973, 'bull_time_stop': 86, 'bull_use_sma': False, 'bull_use_ema': False, 'bull_use_atr': False, 'bull_use_adx': True, 'bull_use_spike': True, 'bull_rsi_required': True, 'bear_strategy': 'mean_reversion', 'bear_bb_std_mult': 3.264116905936423, 'bear_rsi_os': 22, 'bear_rsi_ob': 94, 'bear_adx_thresh': 19.78913176780459, 'bear_atr_min_pct': 0.021356118348285498, 'bear_atr_max_pct': 0.08171727661759208, 'bear_tp_mult': 2.6581522038317273, 'bear_tsl_mult': 0.7853875880231016, 'bear_time_stop': 107, 'bear_use_sma': False, 'bear_use_ema': False, 'bear_use_atr': True, 'bear_use_adx': True, 'bear_use_spike': True, 'bear_rsi_required': False, 'sideways_strategy': 'mean_reversion', 'sideways_bb_std_mult': 0.7542845016903155, 'sideways_rsi_os': 40, 'sideways_rsi_ob': 66, 'sideways_adx_thresh': 33.66437631420129, 'sideways_atr_min_pct': 0.004839303036686294, 'sideways_atr_max_pct': 0.13163730420261013, 'sideways_tp_mult': 2.6546898403465637, 'sideways_tsl_mult': 0.17899461307628609, 'sideways_time_stop': 24, 'sideways_use_sma': False, 'sideways_use_ema': False, 'sideways_use_atr': False, 'sideways_use_adx': False, 'sideways_use_spike': False, 'sideways_rsi_required': False}.
[I 2025-09-01 07:46:29,853] Trial 166 finished with values: [-1000000000.0, 1000000000.0] and parameters: {'p_sma': 49, 'p_std': 6, 'p_atr': 11, 'p_adx': 21, 'rsi_period': 61, 'ema1': 18, 'ema2': 14, 'slip_atr_k': 0.14103373172399358, 'slip_spread_k': 0.40765082614393683, 'spread_hl_frac': 0.02535290089853889, 'bb_std_mult': 3.267650468540218, 'rsi_os': 27, 'rsi_ob': 54, 'vol_spike': 0.2441325565068604, 'adx_thresh': 17.565119337664246, 'atr_min_pct': 0.018408130608321995, 'atr_max_pct': 0.017325597282620606, 'tp_mult': 2.624819989492054, 'tsl_mult': 0.7437263920566018, 'strategy': 'mean_reversion', 'time_stop': 256, 'use_sma': True, 'use_atr': True, 'use_adx': True, 'use_ema': True, 'use_spike': True, 'rsi_required': True, 'edge_k': 1.5411382785951433, 'edge_cap': 0.08406666356251101, 'bull_strategy': 'breakout', 'bull_bb_std_mult': 2.9335813866346543, 'bull_rsi_os': 6, 'bull_rsi_ob': 67, 'bull_adx_thresh': 27.033868436119104, 'bull_atr_min_pct': 0.021764769656380974, 'bull_atr_max_pct': 0.017987876868815235, 'bull_tp_mult': 2.436918828043031, 'bull_tsl_mult': 0.6626185243552878, 'bull_time_stop': 215, 'bull_use_sma': True, 'bull_use_ema': False, 'bull_use_atr': False, 'bull_use_adx': True, 'bull_use_spike': True, 'bull_rsi_required': False, 'bear_strategy': 'mean_reversion', 'bear_bb_std_mult': 3.0051319103038248, 'bear_rsi_os': 28, 'bear_rsi_ob': 95, 'bear_adx_thresh': 31.629435773225776, 'bear_atr_min_pct': 0.004215380427650987, 'bear_atr_max_pct': 0.03322967891862747, 'bear_tp_mult': 2.821713307168082, 'bear_tsl_mult': 0.0650376642239976, 'bear_time_stop': 140, 'bear_use_sma': False, 'bear_use_ema': False, 'bear_use_atr': True, 'bear_use_adx': True, 'bear_use_spike': False, 'bear_rsi_required': False, 'sideways_strategy': 'mean_reversion', 'sideways_bb_std_mult': 0.6223028441573311, 'sideways_rsi_os': 39, 'sideways_rsi_ob': 69, 'sideways_adx_thresh': 7.979820319307704, 'sideways_atr_min_pct': 0.02325140773675695, 'sideways_atr_max_pct': 0.03219623715082606, 'sideways_tp_mult': 2.414800328328726, 'sideways_tsl_mult': 0.13962046555436342, 'sideways_time_stop': 17, 'sideways_use_sma': False, 'sideways_use_ema': True, 'sideways_use_atr': False, 'sideways_use_adx': True, 'sideways_use_spike': True, 'sideways_rsi_required': False}.
[I 2025-09-01 07:47:09,434] Trial 164 finished with values: [-1000000000.0, 1000000000.0] and parameters: {'p_sma': 48, 'p_std': 23, 'p_atr': 12, 'p_adx': 30, 'rsi_period': 34, 'ema1': 10, 'ema2': 33, 'slip_atr_k': 0.21329683525136217, 'slip_spread_k': 0.693681961559017, 'spread_hl_frac': 0.02129677603227322, 'bb_std_mult': 3.294552905159035, 'rsi_os': 27, 'rsi_ob': 54, 'vol_spike': 0.22560478787966956, 'adx_thresh': 25.144092062564283, 'atr_min_pct': 0.02723070519848425, 'atr_max_pct': 0.11614534732663179, 'tp_mult': 1.1613710573904426, 'tsl_mult': 0.2692363139706024, 'strategy': 'mean_reversion', 'time_stop': 96, 'use_sma': True, 'use_atr': True, 'use_adx': True, 'use_ema': True, 'use_spike': True, 'rsi_required': True, 'edge_k': 0.48875193959636665, 'edge_cap': 0.2484075465663531, 'bull_strategy': 'breakout', 'bull_bb_std_mult': 0.7719563562570042, 'bull_rsi_os': 12, 'bull_rsi_ob': 64, 'bull_adx_thresh': 7.7373817801039735, 'bull_atr_min_pct': 0.021936942261106627, 'bull_atr_max_pct': 0.13851906157976535, 'bull_tp_mult': 2.4123262475990352, 'bull_tsl_mult': 0.6968314852204708, 'bull_time_stop': 160, 'bull_use_sma': True, 'bull_use_ema': False, 'bull_use_atr': False, 'bull_use_adx': True, 'bull_use_spike': True, 'bull_rsi_required': False, 'bear_strategy': 'mean_reversion', 'bear_bb_std_mult': 3.241133714995282, 'bear_rsi_os': 22, 'bear_rsi_ob': 94, 'bear_adx_thresh': 24.922025712986112, 'bear_atr_min_pct': 0.022139609793895447, 'bear_atr_max_pct': 0.03476998171099516, 'bear_tp_mult': 2.757432386253274, 'bear_tsl_mult': 0.9906731916789635, 'bear_time_stop': 105, 'bear_use_sma': False, 'bear_use_ema': False, 'bear_use_atr': True, 'bear_use_adx': True, 'bear_use_spike': True, 'bear_rsi_required': False, 'sideways_strategy': 'mean_reversion', 'sideways_bb_std_mult': 3.4948012893934584, 'sideways_rsi_os': 40, 'sideways_rsi_ob': 67, 'sideways_adx_thresh': 10.682037202695051, 'sideways_atr_min_pct': 0.022874688033338687, 'sideways_atr_max_pct': 0.09551425251333696, 'sideways_tp_mult': 2.634509593056367, 'sideways_tsl_mult': 0.1358691803884328, 'sideways_time_stop': 25, 'sideways_use_sma': False, 'sideways_use_ema': False, 'sideways_use_atr': False, 'sideways_use_adx': True, 'sideways_use_spike': True, 'sideways_rsi_required': False}.
[I 2025-09-01 07:47:11,128] Trial 168 finished with values: [-1000000000.0, 1000000000.0] and parameters: {'p_sma': 22, 'p_std': 23, 'p_atr': 13, 'p_adx': 20, 'rsi_period': 65, 'ema1': 8, 'ema2': 32, 'slip_atr_k': 0.047981489955112755, 'slip_spread_k': 0.32027446490821165, 'spread_hl_frac': 0.0282661966764309, 'bb_std_mult': 3.3034217451173, 'rsi_os': 25, 'rsi_ob': 82, 'vol_spike': 0.2500105605356494, 'adx_thresh': 9.831866653499427, 'atr_min_pct': 0.02074352673270638, 'atr_max_pct': 0.09679991807935086, 'tp_mult': 2.7678839065025276, 'tsl_mult': 0.41359197200957126, 'strategy': 'mean_reversion', 'time_stop': 253, 'use_sma': True, 'use_atr': True, 'use_adx': True, 'use_ema': True, 'use_spike': True, 'rsi_required': True, 'edge_k': 1.6284350544724862, 'edge_cap': 0.2516400262303385, 'bull_strategy': 'breakout', 'bull_bb_std_mult': 3.0041794326255395, 'bull_rsi_os': 8, 'bull_rsi_ob': 71, 'bull_adx_thresh': 7.8621449608337795, 'bull_atr_min_pct': 0.009189959765588113, 'bull_atr_max_pct': 0.04607630285670982, 'bull_tp_mult': 2.8882139520906893, 'bull_tsl_mult': 0.6331808718690238, 'bull_time_stop': 151, 'bull_use_sma': True, 'bull_use_ema': False, 'bull_use_atr': False, 'bull_use_adx': True, 'bull_use_spike': True, 'bull_rsi_required': False, 'bear_strategy': 'mean_reversion', 'bear_bb_std_mult': 3.2975981395774663, 'bear_rsi_os': 12, 'bear_rsi_ob': 76, 'bear_adx_thresh': 32.51990064752307, 'bear_atr_min_pct': 0.02207981401015498, 'bear_atr_max_pct': 0.08623414222237392, 'bear_tp_mult': 2.763390197624534, 'bear_tsl_mult': 0.7014633305501051, 'bear_time_stop': 81, 'bear_use_sma': False, 'bear_use_ema': False, 'bear_use_atr': True, 'bear_use_adx': True, 'bear_use_spike': True, 'bear_rsi_required': False, 'sideways_strategy': 'mean_reversion', 'sideways_bb_std_mult': 0.5515738581357769, 'sideways_rsi_os': 41, 'sideways_rsi_ob': 67, 'sideways_adx_thresh': 10.630820654330018, 'sideways_atr_min_pct': 0.011608808114526836, 'sideways_atr_max_pct': 0.14928348452450604, 'sideways_tp_mult': 2.6125625008713613, 'sideways_tsl_mult': 0.16204009168448485, 'sideways_time_stop': 27, 'sideways_use_sma': False, 'sideways_use_ema': True, 'sideways_use_atr': False, 'sideways_use_adx': True, 'sideways_use_spike': True, 'sideways_rsi_required': False}.
[I 2025-09-01 07:47:11,678] Trial 167 finished with values: [-0.0253171250372356, 0.02564408213041741] and parameters: {'p_sma': 22, 'p_std': 23, 'p_atr': 23, 'p_adx': 21, 'rsi_period': 60, 'ema1': 18, 'ema2': 14, 'slip_atr_k': 0.04904405292551561, 'slip_spread_k': 0.4030816933586786, 'spread_hl_frac': 0.006581967597173496, 'bb_std_mult': 3.2671872591108433, 'rsi_os': 25, 'rsi_ob': 56, 'vol_spike': 0.2395915156952695, 'adx_thresh': 17.36586035959598, 'atr_min_pct': 0.016251236132678752, 'atr_max_pct': 0.1499210153806079, 'tp_mult': 1.0792423246279743, 'tsl_mult': 0.5098593559651123, 'strategy': 'mean_reversion', 'time_stop': 257, 'use_sma': True, 'use_atr': True, 'use_adx': True, 'use_ema': True, 'use_spike': True, 'rsi_required': True, 'edge_k': 0.8946029940066339, 'edge_cap': 0.08679289006386642, 'bull_strategy': 'breakout', 'bull_bb_std_mult': 2.948610665004262, 'bull_rsi_os': 6, 'bull_rsi_ob': 67, 'bull_adx_thresh': 29.878724894699822, 'bull_atr_min_pct': 0.0028902036193451885, 'bull_atr_max_pct': 0.0435193169695733, 'bull_tp_mult': 2.421652909173741, 'bull_tsl_mult': 0.6549528414967211, 'bull_time_stop': 153, 'bull_use_sma': True, 'bull_use_ema': False, 'bull_use_atr': False, 'bull_use_adx': True, 'bull_use_spike': True, 'bull_rsi_required': False, 'bear_strategy': 'mean_reversion', 'bear_bb_std_mult': 3.0261764708281387, 'bear_rsi_os': 12, 'bear_rsi_ob': 58, 'bear_adx_thresh': 31.5487035605797, 'bear_atr_min_pct': 0.02234262197742937, 'bear_atr_max_pct': 0.0884913261524895, 'bear_tp_mult': 2.8257456128803975, 'bear_tsl_mult': 0.9987546947061186, 'bear_time_stop': 82, 'bear_use_sma': False, 'bear_use_ema': False, 'bear_use_atr': True, 'bear_use_adx': True, 'bear_use_spike': False, 'bear_rsi_required': False, 'sideways_strategy': 'mean_reversion', 'sideways_bb_std_mult': 0.56032582408024, 'sideways_rsi_os': 39, 'sideways_rsi_ob': 67, 'sideways_adx_thresh': 10.40255796393955, 'sideways_atr_min_pct': 0.022481808175804172, 'sideways_atr_max_pct': 0.12005903662274969, 'sideways_tp_mult': 2.4981914022728575, 'sideways_tsl_mult': 0.9191197097905749, 'sideways_time_stop': 17, 'sideways_use_sma': False, 'sideways_use_ema': True, 'sideways_use_atr': False, 'sideways_use_adx': True, 'sideways_use_spike': True, 'sideways_rsi_required': False}.
[I 2025-09-01 07:47:12,187] Trial 165 finished with values: [-0.10168331986481971, 0.10120922474020823] and parameters: {'p_sma': 48, 'p_std': 6, 'p_atr': 23, 'p_adx': 21, 'rsi_period': 60, 'ema1': 8, 'ema2': 20, 'slip_atr_k': 0.23214879898418023, 'slip_spread_k': 0.6808043672388204, 'spread_hl_frac': 0.021272389698245332, 'bb_std_mult': 3.294737009981492, 'rsi_os': 25, 'rsi_ob': 82, 'vol_spike': 0.077487855754832, 'adx_thresh': 12.86340875261256, 'atr_min_pct': 0.01818063728706801, 'atr_max_pct': 0.1471414351092118, 'tp_mult': 1.164391353674038, 'tsl_mult': 0.2649729691268399, 'strategy': 'mean_reversion', 'time_stop': 216, 'use_sma': True, 'use_atr': True, 'use_adx': True, 'use_ema': True, 'use_spike': True, 'rsi_required': True, 'edge_k': 1.612785209212722, 'edge_cap': 0.24033227437128318, 'bull_strategy': 'breakout', 'bull_bb_std_mult': 2.8857433456329895, 'bull_rsi_os': 34, 'bull_rsi_ob': 71, 'bull_adx_thresh': 7.849915192430697, 'bull_atr_min_pct': 0.002754359139964708, 'bull_atr_max_pct': 0.13912180354079726, 'bull_tp_mult': 2.428026404897571, 'bull_tsl_mult': 0.8055504900903108, 'bull_time_stop': 152, 'bull_use_sma': True, 'bull_use_ema': False, 'bull_use_atr': False, 'bull_use_adx': True, 'bull_use_spike': True, 'bull_rsi_required': False, 'bear_strategy': 'mean_reversion', 'bear_bb_std_mult': 3.0378522029195674, 'bear_rsi_os': 10, 'bear_rsi_ob': 95, 'bear_adx_thresh': 20.108190570087036, 'bear_atr_min_pct': 0.022372049522510304, 'bear_atr_max_pct': 0.078866304557014, 'bear_tp_mult': 2.8254716570130447, 'bear_tsl_mult': 0.06266261055296887, 'bear_time_stop': 169, 'bear_use_sma': False, 'bear_use_ema': False, 'bear_use_atr': True, 'bear_use_adx': True, 'bear_use_spike': True, 'bear_rsi_required': False, 'sideways_strategy': 'mean_reversion', 'sideways_bb_std_mult': 0.5578743069915398, 'sideways_rsi_os': 40, 'sideways_rsi_ob': 67, 'sideways_adx_thresh': 9.395382421633013, 'sideways_atr_min_pct': 0.011581951560297989, 'sideways_atr_max_pct': 0.12020273391563688, 'sideways_tp_mult': 2.4060185318313914, 'sideways_tsl_mult': 0.3401801956749451, 'sideways_time_stop': 25, 'sideways_use_sma': False, 'sideways_use_ema': True, 'sideways_use_atr': False, 'sideways_use_adx': True, 'sideways_use_spike': True, 'sideways_rsi_required': False}.
[I 2025-09-01 07:47:54,418] Trial 171 finished with values: [-1000000000.0, 1000000000.0] and parameters: {'p_sma': 17, 'p_std': 12, 'p_atr': 18, 'p_adx': 15, 'rsi_period': 66, 'ema1': 9, 'ema2': 14, 'slip_atr_k': 0.053947637175659424, 'slip_spread_k': 0.628964794505298, 'spread_hl_frac': 0.023781038193821817, 'bb_std_mult': 3.4080491108006057, 'rsi_os': 22, 'rsi_ob': 53, 'vol_spike': 0.2384334102518838, 'adx_thresh': 24.57689142549053, 'atr_min_pct': 0.019237737621704113, 'atr_max_pct': 0.14738205937163207, 'tp_mult': 2.039126458401256, 'tsl_mult': 0.5328662699779121, 'strategy': 'mean_reversion', 'time_stop': 241, 'use_sma': True, 'use_atr': True, 'use_adx': True, 'use_ema': False, 'use_spike': True, 'rsi_required': False, 'edge_k': 0.9018908400451988, 'edge_cap': 0.08849438405822554, 'bull_strategy': 'breakout', 'bull_bb_std_mult': 3.1912733123477217, 'bull_rsi_os': 21, 'bull_rsi_ob': 69, 'bull_adx_thresh': 10.898144055964535, 'bull_atr_min_pct': 0.02372352545464157, 'bull_atr_max_pct': 0.12225824775843946, 'bull_tp_mult': 2.2620885115950187, 'bull_tsl_mult': 0.6741363789477766, 'bull_time_stop': 141, 'bull_use_sma': True, 'bull_use_ema': False, 'bull_use_atr': True, 'bull_use_adx': True, 'bull_use_spike': False, 'bull_rsi_required': False, 'bear_strategy': 'mean_reversion', 'bear_bb_std_mult': 3.0514638823714026, 'bear_rsi_os': 25, 'bear_rsi_ob': 82, 'bear_adx_thresh': 31.457793433748517, 'bear_atr_min_pct': 0.022546952704649712, 'bear_atr_max_pct': 0.07806804483670131, 'bear_tp_mult': 1.6744651026329904, 'bear_tsl_mult': 0.0895766187871549, 'bear_time_stop': 242, 'bear_use_sma': False, 'bear_use_ema': True, 'bear_use_atr': True, 'bear_use_adx': True, 'bear_use_spike': True, 'bear_rsi_required': False, 'sideways_strategy': 'mean_reversion', 'sideways_bb_std_mult': 2.3882170755403203, 'sideways_rsi_os': 37, 'sideways_rsi_ob': 46, 'sideways_adx_thresh': 9.720670086387708, 'sideways_atr_min_pct': 0.022312733022946982, 'sideways_atr_max_pct': 0.02328106487726745, 'sideways_tp_mult': 2.4991943426959056, 'sideways_tsl_mult': 0.3409925648065219, 'sideways_time_stop': 13, 'sideways_use_sma': False, 'sideways_use_ema': False, 'sideways_use_atr': False, 'sideways_use_adx': True, 'sideways_use_spike': True, 'sideways_rsi_required': False}.
[I 2025-09-01 07:47:55,832] Trial 170 finished with values: [-0.06373494656813705, 0.0642156503069558] and parameters: {'p_sma': 21, 'p_std': 12, 'p_atr': 11, 'p_adx': 15, 'rsi_period': 67, 'ema1': 21, 'ema2': 10, 'slip_atr_k': 0.05533737986221215, 'slip_spread_k': 0.0926042983801415, 'spread_hl_frac': 0.006879044412678392, 'bb_std_mult': 3.4251169646215884, 'rsi_os': 23, 'rsi_ob': 56, 'vol_spike': 0.24043402720591187, 'adx_thresh': 13.121986434775817, 'atr_min_pct': 0.029030262568548935, 'atr_max_pct': 0.14682296240877946, 'tp_mult': 1.0815440783641854, 'tsl_mult': 0.5238537198463422, 'strategy': 'mean_reversion', 'time_stop': 248, 'use_sma': True, 'use_atr': True, 'use_adx': True, 'use_ema': False, 'use_spike': True, 'rsi_required': False, 'edge_k': 0.9096757205085675, 'edge_cap': 0.13012605561352086, 'bull_strategy': 'breakout', 'bull_bb_std_mult': 0.6177209517968352, 'bull_rsi_os': 5, 'bull_rsi_ob': 70, 'bull_adx_thresh': 29.89894254126717, 'bull_atr_min_pct': 0.002849127011574407, 'bull_atr_max_pct': 0.12299383227384171, 'bull_tp_mult': 2.805762603182857, 'bull_tsl_mult': 0.6838070421735759, 'bull_time_stop': 141, 'bull_use_sma': True, 'bull_use_ema': False, 'bull_use_atr': True, 'bull_use_adx': True, 'bull_use_spike': False, 'bull_rsi_required': False, 'bear_strategy': 'mean_reversion', 'bear_bb_std_mult': 1.1612143142569857, 'bear_rsi_os': 10, 'bear_rsi_ob': 66, 'bear_adx_thresh': 9.289392119304946, 'bear_atr_min_pct': 0.013854415273022103, 'bear_atr_max_pct': 0.07804825189563544, 'bear_tp_mult': 1.1703241341398343, 'bear_tsl_mult': 0.09145334621197614, 'bear_time_stop': 169, 'bear_use_sma': False, 'bear_use_ema': True, 'bear_use_atr': True, 'bear_use_adx': True, 'bear_use_spike': False, 'bear_rsi_required': False, 'sideways_strategy': 'mean_reversion', 'sideways_bb_std_mult': 2.8857791443202334, 'sideways_rsi_os': 38, 'sideways_rsi_ob': 65, 'sideways_adx_thresh': 9.617140209438372, 'sideways_atr_min_pct': 0.0040617603349681775, 'sideways_atr_max_pct': 0.029047977610481637, 'sideways_tp_mult': 2.4942348884235326, 'sideways_tsl_mult': 0.9197074667294164, 'sideways_time_stop': 33, 'sideways_use_sma': False, 'sideways_use_ema': False, 'sideways_use_atr': False, 'sideways_use_adx': True, 'sideways_use_spike': True, 'sideways_rsi_required': False}.
