[I 2025-09-01 08:54:59,500] Trial 578 finished with values: [-0.03531174908131396, 0.0350056077638551] and parameters: {'p_sma': 20, 'p_std': 51, 'p_atr': 14, 'p_adx': 19, 'rsi_period': 63, 'ema1': 9, 'ema2': 49, 'slip_atr_k': 0.031816797323359416, 'slip_spread_k': 0.5885518830163344, 'spread_hl_frac': 0.022449540391744915, 'bb_std_mult': 3.320825642707045, 'rsi_os': 5, 'rsi_ob': 71, 'vol_spike': 0.24000309087668267, 'adx_thresh': 13.28200115774716, 'atr_min_pct': 0.02231673005020434, 'atr_max_pct': 0.12847697170359249, 'tp_mult': 1.2672007146094908, 'tsl_mult': 0.4947246956776394, 'strategy': 'breakout', 'time_stop': 111, 'use_sma': True, 'use_atr': False, 'use_adx': True, 'use_ema': True, 'use_spike': False, 'rsi_required': True, 'edge_k': 1.6912828779942686, 'edge_cap': 0.07241988508018501, 'bull_strategy': 'breakout', 'bull_bb_std_mult': 2.848029115940752, 'bull_rsi_os': 15, 'bull_rsi_ob': 68, 'bull_adx_thresh': 7.763813208000357, 'bull_atr_min_pct': 0.009776547964791283, 'bull_atr_max_pct': 0.10648510569622638, 'bull_tp_mult': 2.340393820799668, 'bull_tsl_mult': 0.20903684097602387, 'bull_time_stop': 157, 'bull_use_sma': True, 'bull_use_ema': True, 'bull_use_atr': True, 'bull_use_adx': True, 'bull_use_spike': False, 'bull_rsi_required': True, 'bear_strategy': 'breakout', 'bear_bb_std_mult': 1.6258427903700974, 'bear_rsi_os': 28, 'bear_rsi_ob': 93, 'bear_adx_thresh': 31.255194788002786, 'bear_atr_min_pct': 0.023994496452086695, 'bear_atr_max_pct': 0.08649844468826882, 'bear_tp_mult': 2.4660181400763475, 'bear_tsl_mult': 0.22845706855531928, 'bear_time_stop': 77, 'bear_use_sma': False, 'bear_use_ema': False, 'bear_use_atr': True, 'bear_use_adx': True, 'bear_use_spike': False, 'bear_rsi_required': False, 'sideways_strategy': 'mean_reversion', 'sideways_bb_std_mult': 1.5911553175951823, 'sideways_rsi_os': 40, 'sideways_rsi_ob': 65, 'sideways_adx_thresh': 10.052827366274604, 'sideways_atr_min_pct': 0.0017225000357548679, 'sideways_atr_max_pct': 0.059802910508988665, 'sideways_tp_mult': 1.7277666289926605, 'sideways_tsl_mult': 0.12957357406036446, 'sideways_time_stop': 25, 'sideways_use_sma': True, 'sideways_use_ema': False, 'sideways_use_atr': False, 'sideways_use_adx': True, 'sideways_use_spike': True, 'sideways_rsi_required': False}.
[I 2025-09-01 08:54:59,845] Trial 577 finished with values: [-0.16332282189991199, 0.16367312384116925] and parameters: {'p_sma': 20, 'p_std': 17, 'p_atr': 13, 'p_adx': 19, 'rsi_period': 62, 'ema1': 16, 'ema2': 14, 'slip_atr_k': 0.06104410719960686, 'slip_spread_k': 0.8844093660283967, 'spread_hl_frac': 0.022341482248409775, 'bb_std_mult': 3.310590714870121, 'rsi_os': 5, 'rsi_ob': 81, 'vol_spike': 0.23814196479535513, 'adx_thresh': 23.816765184940692, 'atr_min_pct': 0.02092980618303116, 'atr_max_pct': 0.07607490031226148, 'tp_mult': 2.632522579098401, 'tsl_mult': 0.49824666465139844, 'strategy': 'mean_reversion', 'time_stop': 48, 'use_sma': True, 'use_atr': False, 'use_adx': True, 'use_ema': True, 'use_spike': True, 'rsi_required': True, 'edge_k': 1.0439011292358216, 'edge_cap': 0.12104812364439099, 'bull_strategy': 'breakout', 'bull_bb_std_mult': 1.6403955941228574, 'bull_rsi_os': 8, 'bull_rsi_ob': 68, 'bull_adx_thresh': 7.684812205188818, 'bull_atr_min_pct': 0.0006716810938947881, 'bull_atr_max_pct': 0.1060256694246999, 'bull_tp_mult': 2.344530998120258, 'bull_tsl_mult': 0.29575120658966925, 'bull_time_stop': 161, 'bull_use_sma': True, 'bull_use_ema': True, 'bull_use_atr': True, 'bull_use_adx': True, 'bull_use_spike': False, 'bull_rsi_required': False, 'bear_strategy': 'breakout', 'bear_bb_std_mult': 2.9299429872088383, 'bear_rsi_os': 10, 'bear_rsi_ob': 52, 'bear_adx_thresh': 9.115208387863577, 'bear_atr_min_pct': 0.013101039604964542, 'bear_atr_max_pct': 0.03626436705356785, 'bear_tp_mult': 2.69702275703842, 'bear_tsl_mult': 0.5934200192969799, 'bear_time_stop': 287, 'bear_use_sma': False, 'bear_use_ema': False, 'bear_use_atr': True, 'bear_use_adx': True, 'bear_use_spike': True, 'bear_rsi_required': False, 'sideways_strategy': 'mean_reversion', 'sideways_bb_std_mult': 0.8303375863265444, 'sideways_rsi_os': 36, 'sideways_rsi_ob': 87, 'sideways_adx_thresh': 33.92512858176475, 'sideways_atr_min_pct': 0.001998823047497161, 'sideways_atr_max_pct': 0.03466049866632659, 'sideways_tp_mult': 2.8870598906954488, 'sideways_tsl_mult': 0.12304559656622638, 'sideways_time_stop': 172, 'sideways_use_sma': True, 'sideways_use_ema': False, 'sideways_use_atr': False, 'sideways_use_adx': True, 'sideways_use_spike': True, 'sideways_rsi_required': False}.
[I 2025-09-01 08:55:00,078] Trial 575 finished with values: [-0.09503513670953512, 0.0945109084485026] and parameters: {'p_sma': 58, 'p_std': 51, 'p_atr': 13, 'p_adx': 19, 'rsi_period': 62, 'ema1': 27, 'ema2': 13, 'slip_atr_k': 0.061181254064935714, 'slip_spread_k': 0.6525516987716189, 'spread_hl_frac': 0.024950258831409014, 'bb_std_mult': 3.599838846759032, 'rsi_os': 26, 'rsi_ob': 53, 'vol_spike': 0.237910961619951, 'adx_thresh': 23.61999416548449, 'atr_min_pct': 0.01917208165318256, 'atr_max_pct': 0.05588914547032061, 'tp_mult': 2.102077791375627, 'tsl_mult': 0.7775935427093227, 'strategy': 'mean_reversion', 'time_stop': 259, 'use_sma': True, 'use_atr': True, 'use_adx': True, 'use_ema': True, 'use_spike': True, 'rsi_required': True, 'edge_k': 1.0492657248369526, 'edge_cap': 0.11676909978538436, 'bull_strategy': 'breakout', 'bull_bb_std_mult': 3.036413315344946, 'bull_rsi_os': 23, 'bull_rsi_ob': 68, 'bull_adx_thresh': 6.028261182587277, 'bull_atr_min_pct': 0.0006276185712222205, 'bull_atr_max_pct': 0.02138224953868753, 'bull_tp_mult': 2.3428054274522943, 'bull_tsl_mult': 0.6628345932909118, 'bull_time_stop': 161, 'bull_use_sma': True, 'bull_use_ema': False, 'bull_use_atr': False, 'bull_use_adx': True, 'bull_use_spike': True, 'bull_rsi_required': False, 'bear_strategy': 'mean_reversion', 'bear_bb_std_mult': 3.270302342850715, 'bear_rsi_os': 28, 'bear_rsi_ob': 94, 'bear_adx_thresh': 30.92537819443416, 'bear_atr_min_pct': 0.0016193727562799718, 'bear_atr_max_pct': 0.04709246692032569, 'bear_tp_mult': 2.7188287975529635, 'bear_tsl_mult': 0.21997974939077147, 'bear_time_stop': 93, 'bear_use_sma': False, 'bear_use_ema': False, 'bear_use_atr': True, 'bear_use_adx': True, 'bear_use_spike': True, 'bear_rsi_required': False, 'sideways_strategy': 'mean_reversion', 'sideways_bb_std_mult': 0.5038602310596894, 'sideways_rsi_os': 42, 'sideways_rsi_ob': 66, 'sideways_adx_thresh': 10.93652759987419, 'sideways_atr_min_pct': 0.021807581391352908, 'sideways_atr_max_pct': 0.023377508744355315, 'sideways_tp_mult': 1.8874798993403479, 'sideways_tsl_mult': 0.9113882984617141, 'sideways_time_stop': 157, 'sideways_use_sma': False, 'sideways_use_ema': True, 'sideways_use_atr': False, 'sideways_use_adx': True, 'sideways_use_spike': True, 'sideways_rsi_required': False}.
[I 2025-09-01 08:55:43,051] Trial 580 finished with values: [-1000000000.0, 1000000000.0] and parameters: {'p_sma': 20, 'p_std': 59, 'p_atr': 10, 'p_adx': 19, 'rsi_period': 63, 'ema1': 16, 'ema2': 22, 'slip_atr_k': 0.11036822698939229, 'slip_spread_k': 0.7051299093393874, 'spread_hl_frac': 0.02257744395787566, 'bb_std_mult': 1.5389431591341216, 'rsi_os': 44, 'rsi_ob': 59, 'vol_spike': 0.27797118395199194, 'adx_thresh': 23.47689929011536, 'atr_min_pct': 0.019836819233655614, 'atr_max_pct': 0.07629142426112323, 'tp_mult': 1.255115162134078, 'tsl_mult': 0.7293572214995039, 'strategy': 'breakout', 'time_stop': 83, 'use_sma': False, 'use_atr': False, 'use_adx': False, 'use_ema': True, 'use_spike': False, 'rsi_required': True, 'edge_k': 1.054881550567504, 'edge_cap': 0.115071803965547, 'bull_strategy': 'mean_reversion', 'bull_bb_std_mult': 1.6800285980660012, 'bull_rsi_os': 8, 'bull_rsi_ob': 70, 'bull_adx_thresh': 25.139441695709966, 'bull_atr_min_pct': 0.0009555779634914177, 'bull_atr_max_pct': 0.05021101265126324, 'bull_tp_mult': 2.266626477388589, 'bull_tsl_mult': 0.7583352990847139, 'bull_time_stop': 181, 'bull_use_sma': False, 'bull_use_ema': True, 'bull_use_atr': True, 'bull_use_adx': True, 'bull_use_spike': False, 'bull_rsi_required': True, 'bear_strategy': 'breakout', 'bear_bb_std_mult': 3.400385150277613, 'bear_rsi_os': 28, 'bear_rsi_ob': 93, 'bear_adx_thresh': 31.20207059945779, 'bear_atr_min_pct': 0.002449862548044848, 'bear_atr_max_pct': 0.07926673357036222, 'bear_tp_mult': 2.460680777240511, 'bear_tsl_mult': 0.0999096231591943, 'bear_time_stop': 108, 'bear_use_sma': False, 'bear_use_ema': False, 'bear_use_atr': False, 'bear_use_adx': True, 'bear_use_spike': False, 'bear_rsi_required': False, 'sideways_strategy': 'mean_reversion', 'sideways_bb_std_mult': 3.3766188847829928, 'sideways_rsi_os': 7, 'sideways_rsi_ob': 94, 'sideways_adx_thresh': 9.373837769825323, 'sideways_atr_min_pct': 0.02160512829056688, 'sideways_atr_max_pct': 0.023142856166068877, 'sideways_tp_mult': 2.5236576342505526, 'sideways_tsl_mult': 0.0510449079208769, 'sideways_time_stop': 35, 'sideways_use_sma': True, 'sideways_use_ema': False, 'sideways_use_atr': False, 'sideways_use_adx': True, 'sideways_use_spike': False, 'sideways_rsi_required': False}.
[I 2025-09-01 08:55:43,573] Trial 581 finished with values: [-1000000000.0, 1000000000.0] and parameters: {'p_sma': 20, 'p_std': 38, 'p_atr': 14, 'p_adx': 21, 'rsi_period': 63, 'ema1': 24, 'ema2': 23, 'slip_atr_k': 0.17911246573544737, 'slip_spread_k': 0.6580918372094896, 'spread_hl_frac': 0.024669259742710614, 'bb_std_mult': 3.463445340858299, 'rsi_os': 26, 'rsi_ob': 59, 'vol_spike': 0.057801166838240006, 'adx_thresh': 9.221642671292987, 'atr_min_pct': 0.0020449832866919655, 'atr_max_pct': 0.14156644480526423, 'tp_mult': 1.2613615982802588, 'tsl_mult': 0.46851031815480687, 'strategy': 'breakout', 'time_stop': 84, 'use_sma': False, 'use_atr': False, 'use_adx': False, 'use_ema': True, 'use_spike': False, 'rsi_required': True, 'edge_k': 1.9995689028584593, 'edge_cap': 0.7453598147025754, 'bull_strategy': 'mean_reversion', 'bull_bb_std_mult': 2.8719951530647263, 'bull_rsi_os': 30, 'bull_rsi_ob': 71, 'bull_adx_thresh': 8.490480436753161, 'bull_atr_min_pct': 0.006528507885129691, 'bull_atr_max_pct': 0.04749640927415389, 'bull_tp_mult': 1.2918476676786175, 'bull_tsl_mult': 0.7131638843301746, 'bull_time_stop': 182, 'bull_use_sma': False, 'bull_use_ema': True, 'bull_use_atr': False, 'bull_use_adx': True, 'bull_use_spike': True, 'bull_rsi_required': True, 'bear_strategy': 'mean_reversion', 'bear_bb_std_mult': 3.4017202015679766, 'bear_rsi_os': 28, 'bear_rsi_ob': 93, 'bear_adx_thresh': 31.303575740791068, 'bear_atr_min_pct': 0.02391343042260525, 'bear_atr_max_pct': 0.0791582099981517, 'bear_tp_mult': 2.8250733677148174, 'bear_tsl_mult': 0.22156311996117406, 'bear_time_stop': 107, 'bear_use_sma': False, 'bear_use_ema': False, 'bear_use_atr': False, 'bear_use_adx': True, 'bear_use_spike': False, 'bear_rsi_required': False, 'sideways_strategy': 'mean_reversion', 'sideways_bb_std_mult': 3.351128258431996, 'sideways_rsi_os': 40, 'sideways_rsi_ob': 47, 'sideways_adx_thresh': 10.968138391136343, 'sideways_atr_min_pct': 0.025878883241994808, 'sideways_atr_max_pct': 0.030860835760521507, 'sideways_tp_mult': 1.0460322267070832, 'sideways_tsl_mult': 0.5822232512212276, 'sideways_time_stop': 44, 'sideways_use_sma': True, 'sideways_use_ema': False, 'sideways_use_atr': True, 'sideways_use_adx': True, 'sideways_use_spike': False, 'sideways_rsi_required': False}.
[I 2025-09-01 08:55:43,931] Trial 579 finished with values: [-0.08359752031524659, 0.08342141395872589] and parameters: {'p_sma': 20, 'p_std': 9, 'p_atr': 14, 'p_adx': 19, 'rsi_period': 63, 'ema1': 23, 'ema2': 12, 'slip_atr_k': 0.06124071353526829, 'slip_spread_k': 0.7073830632105047, 'spread_hl_frac': 0.022325679289777592, 'bb_std_mult': 3.3157367175464927, 'rsi_os': 23, 'rsi_ob': 59, 'vol_spike': 0.05114799232850485, 'adx_thresh': 23.534123409914248, 'atr_min_pct': 0.001989424056784617, 'atr_max_pct': 0.14063490777983276, 'tp_mult': 1.2518376063504424, 'tsl_mult': 0.33365231559679775, 'strategy': 'breakout', 'time_stop': 84, 'use_sma': True, 'use_atr': False, 'use_adx': False, 'use_ema': True, 'use_spike': False, 'rsi_required': True, 'edge_k': 1.0510137548845377, 'edge_cap': 0.11413781625810492, 'bull_strategy': 'breakout', 'bull_bb_std_mult': 0.8855990166514107, 'bull_rsi_os': 15, 'bull_rsi_ob': 70, 'bull_adx_thresh': 8.872088909204557, 'bull_atr_min_pct': 0.009824922278168858, 'bull_atr_max_pct': 0.10471302050813197, 'bull_tp_mult': 2.3486164524875264, 'bull_tsl_mult': 0.7586419483779897, 'bull_time_stop': 164, 'bull_use_sma': False, 'bull_use_ema': True, 'bull_use_atr': False, 'bull_use_adx': True, 'bull_use_spike': True, 'bull_rsi_required': True, 'bear_strategy': 'mean_reversion', 'bear_bb_std_mult': 2.950881160578244, 'bear_rsi_os': 35, 'bear_rsi_ob': 93, 'bear_adx_thresh': 16.42135967653729, 'bear_atr_min_pct': 0.023118160107155693, 'bear_atr_max_pct': 0.07935824173939003, 'bear_tp_mult': 2.822206930298194, 'bear_tsl_mult': 0.20448837829122857, 'bear_time_stop': 160, 'bear_use_sma': False, 'bear_use_ema': False, 'bear_use_atr': False, 'bear_use_adx': True, 'bear_use_spike': False, 'bear_rsi_required': False, 'sideways_strategy': 'mean_reversion', 'sideways_bb_std_mult': 0.6085210664896916, 'sideways_rsi_os': 36, 'sideways_rsi_ob': 63, 'sideways_adx_thresh': 10.95268430201489, 'sideways_atr_min_pct': 0.0017728851381977693, 'sideways_atr_max_pct': 0.060488273981421634, 'sideways_tp_mult': 1.863045121571226, 'sideways_tsl_mult': 0.12345566362641255, 'sideways_time_stop': 172, 'sideways_use_sma': True, 'sideways_use_ema': False, 'sideways_use_atr': False, 'sideways_use_adx': True, 'sideways_use_spike': False, 'sideways_rsi_required': False}.
[I 2025-09-01 08:55:44,179] Trial 582 finished with values: [-1000000000.0, 1000000000.0] and parameters: {'p_sma': 51, 'p_std': 15, 'p_atr': 14, 'p_adx': 16, 'rsi_period': 64, 'ema1': 26, 'ema2': 11, 'slip_atr_k': 0.054621798596757594, 'slip_spread_k': 0.6900348488433035, 'spread_hl_frac': 0.015535988100601533, 'bb_std_mult': 3.464007523652078, 'rsi_os': 24, 'rsi_ob': 59, 'vol_spike': 0.16845743933309185, 'adx_thresh': 25.272305990391576, 'atr_min_pct': 0.006534110152904218, 'atr_max_pct': 0.1410411143068458, 'tp_mult': 1.2636059354696099, 'tsl_mult': 0.4696519080835385, 'strategy': 'breakout', 'time_stop': 81, 'use_sma': False, 'use_atr': False, 'use_adx': False, 'use_ema': True, 'use_spike': False, 'rsi_required': False, 'edge_k': 0.9843100661027634, 'edge_cap': 0.07296199846365695, 'bull_strategy': 'mean_reversion', 'bull_bb_std_mult': 2.874635595755552, 'bull_rsi_os': 15, 'bull_rsi_ob': 70, 'bull_adx_thresh': 10.245639687600514, 'bull_atr_min_pct': 0.0017639020931721847, 'bull_atr_max_pct': 0.04669413160145333, 'bull_tp_mult': 1.3051621004085838, 'bull_tsl_mult': 0.20801954809923362, 'bull_time_stop': 132, 'bull_use_sma': False, 'bull_use_ema': True, 'bull_use_atr': False, 'bull_use_adx': True, 'bull_use_spike': True, 'bull_rsi_required': True, 'bear_strategy': 'mean_reversion', 'bear_bb_std_mult': 2.239417787426484, 'bear_rsi_os': 12, 'bear_rsi_ob': 92, 'bear_adx_thresh': 28.87592083595279, 'bear_atr_min_pct': 0.024119576786632235, 'bear_atr_max_pct': 0.0789105418756083, 'bear_tp_mult': 2.4599080394775865, 'bear_tsl_mult': 0.10226991453731918, 'bear_time_stop': 162, 'bear_use_sma': False, 'bear_use_ema': True, 'bear_use_atr': False, 'bear_use_adx': True, 'bear_use_spike': False, 'bear_rsi_required': False, 'sideways_strategy': 'mean_reversion', 'sideways_bb_std_mult': 2.4013686112689854, 'sideways_rsi_os': 40, 'sideways_rsi_ob': 63, 'sideways_adx_thresh': 9.539908290596705, 'sideways_atr_min_pct': 0.02307908227269983, 'sideways_atr_max_pct': 0.08011116801633968, 'sideways_tp_mult': 1.0469186780142454, 'sideways_tsl_mult': 0.5789464313821866, 'sideways_time_stop': 26, 'sideways_use_sma': True, 'sideways_use_ema': False, 'sideways_use_atr': True, 'sideways_use_adx': True, 'sideways_use_spike': False, 'sideways_rsi_required': False}.
[I 2025-09-01 08:55:45,187] Trial 586 finished with values: [-1000000000.0, 1000000000.0] and parameters: {'p_sma': 39, 'p_std': 18, 'p_atr': 12, 'p_adx': 21, 'rsi_period': 37, 'ema1': 7, 'ema2': 26, 'slip_atr_k': 0.05101048475895226, 'slip_spread_k': 0.5484484448225762, 'spread_hl_frac': 0.001957590032517796, 'bb_std_mult': 3.3735269440313127, 'rsi_os': 24, 'rsi_ob': 50, 'vol_spike': 0.2456528521314062, 'adx_thresh': 26.044961177176592, 'atr_min_pct': 0.022340046940076908, 'atr_max_pct': 0.11805153332541882, 'tp_mult': 1.1701888361508213, 'tsl_mult': 0.4056049364350291, 'strategy': 'mean_reversion', 'time_stop': 114, 'use_sma': True, 'use_atr': True, 'use_adx': True, 'use_ema': False, 'use_spike': True, 'rsi_required': False, 'edge_k': 1.366752697941411, 'edge_cap': 0.06573774072071964, 'bull_strategy': 'breakout', 'bull_bb_std_mult': 2.9702417854798435, 'bull_rsi_os': 12, 'bull_rsi_ob': 65, 'bull_adx_thresh': 9.362004450604479, 'bull_atr_min_pct': 0.003601411331192692, 'bull_atr_max_pct': 0.039919636927322234, 'bull_tp_mult': 2.224969549424607, 'bull_tsl_mult': 0.4145371924928459, 'bull_time_stop': 148, 'bull_use_sma': True, 'bull_use_ema': False, 'bull_use_atr': False, 'bull_use_adx': True, 'bull_use_spike': True, 'bull_rsi_required': False, 'bear_strategy': 'mean_reversion', 'bear_bb_std_mult': 3.1377868731888947, 'bear_rsi_os': 39, 'bear_rsi_ob': 63, 'bear_adx_thresh': 12.913741319847013, 'bear_atr_min_pct': 0.022986596446557726, 'bear_atr_max_pct': 0.09239775634075263, 'bear_tp_mult': 2.754889609749481, 'bear_tsl_mult': 0.14862524391019888, 'bear_time_stop': 262, 'bear_use_sma': False, 'bear_use_ema': True, 'bear_use_atr': True, 'bear_use_adx': False, 'bear_use_spike': True, 'bear_rsi_required': False, 'sideways_strategy': 'breakout', 'sideways_bb_std_mult': 1.7280291775849026, 'sideways_rsi_os': 30, 'sideways_rsi_ob': 65, 'sideways_adx_thresh': 12.392127557875748, 'sideways_atr_min_pct': 0.02222665306174646, 'sideways_atr_max_pct': 0.02685615731307547, 'sideways_tp_mult': 2.661996071481768, 'sideways_tsl_mult': 0.72179905552989, 'sideways_time_stop': 189, 'sideways_use_sma': False, 'sideways_use_ema': True, 'sideways_use_atr': False, 'sideways_use_adx': False, 'sideways_use_spike': True, 'sideways_rsi_required': False}.
[I 2025-09-01 08:56:24,864] Trial 583 finished with values: [-0.09656219736109106, 0.09639315849038152] and parameters: {'p_sma': 35, 'p_std': 38, 'p_atr': 19, 'p_adx': 21, 'rsi_period': 36, 'ema1': 7, 'ema2': 17, 'slip_atr_k': 0.05473972840687115, 'slip_spread_k': 0.2646445013343719, 'spread_hl_frac': 0.024302428057843623, 'bb_std_mult': 3.462869901550479, 'rsi_os': 23, 'rsi_ob': 50, 'vol_spike': 0.24668435793602392, 'adx_thresh': 25.378453863254347, 'atr_min_pct': 0.022298957861651817, 'atr_max_pct': 0.1404085342169042, 'tp_mult': 1.1732128684776708, 'tsl_mult': 0.4696605303874499, 'strategy': 'breakout', 'time_stop': 218, 'use_sma': True, 'use_atr': True, 'use_adx': False, 'use_ema': True, 'use_spike': False, 'rsi_required': False, 'edge_k': 1.6970985782578587, 'edge_cap': 0.9269221056713388, 'bull_strategy': 'breakout', 'bull_bb_std_mult': 3.3196707996222514, 'bull_rsi_os': 39, 'bull_rsi_ob': 87, 'bull_adx_thresh': 10.288198557522815, 'bull_atr_min_pct': 0.0015953872574141618, 'bull_atr_max_pct': 0.039620644719040934, 'bull_tp_mult': 1.3111749750298078, 'bull_tsl_mult': 0.9028366165179338, 'bull_time_stop': 132, 'bull_use_sma': False, 'bull_use_ema': False, 'bull_use_atr': False, 'bull_use_adx': True, 'bull_use_spike': True, 'bull_rsi_required': True, 'bear_strategy': 'mean_reversion', 'bear_bb_std_mult': 3.1492740052792256, 'bear_rsi_os': 35, 'bear_rsi_ob': 93, 'bear_adx_thresh': 33.04603863334669, 'bear_atr_min_pct': 0.02385456306926262, 'bear_atr_max_pct': 0.0822170590603501, 'bear_tp_mult': 2.282620607655998, 'bear_tsl_mult': 0.050306869366891105, 'bear_time_stop': 157, 'bear_use_sma': False, 'bear_use_ema': True, 'bear_use_atr': False, 'bear_use_adx': False, 'bear_use_spike': False, 'bear_rsi_required': False, 'sideways_strategy': 'mean_reversion', 'sideways_bb_std_mult': 1.6076336963374778, 'sideways_rsi_os': 40, 'sideways_rsi_ob': 80, 'sideways_adx_thresh': 12.093322091593102, 'sideways_atr_min_pct': 0.026041620029196393, 'sideways_atr_max_pct': 0.030720120108467835, 'sideways_tp_mult': 1.7298688190915679, 'sideways_tsl_mult': 0.16870248192424925, 'sideways_time_stop': 188, 'sideways_use_sma': False, 'sideways_use_ema': False, 'sideways_use_atr': True, 'sideways_use_adx': True, 'sideways_use_spike': False, 'sideways_rsi_required': False}.
