[I 2025-09-01 08:30:53,650] Trial 432 finished with values: [-1000000000.0, 1000000000.0] and parameters: {'p_sma': 20, 'p_std': 16, 'p_atr': 13, 'p_adx': 26, 'rsi_period': 60, 'ema1': 14, 'ema2': 33, 'slip_atr_k': 0.055193712223221975, 'slip_spread_k': 0.6598985026478562, 'spread_hl_frac': 0.027405805706306154, 'bb_std_mult': 3.496650656027096, 'rsi_os': 14, 'rsi_ob': 48, 'vol_spike': 0.07524794569434055, 'adx_thresh': 30.321316350489766, 'atr_min_pct': 0.015245956307209823, 'atr_max_pct': 0.14990496716547608, 'tp_mult': 1.0802495767292617, 'tsl_mult': 0.451868395118437, 'strategy': 'breakout', 'time_stop': 86, 'use_sma': False, 'use_atr': True, 'use_adx': True, 'use_ema': True, 'use_spike': True, 'rsi_required': True, 'edge_k': 0.9694154564000894, 'edge_cap': 0.3457611489280196, 'bull_strategy': 'mean_reversion', 'bull_bb_std_mult': 2.307212637470738, 'bull_rsi_os': 13, 'bull_rsi_ob': 67, 'bull_adx_thresh': 9.424478138868837, 'bull_atr_min_pct': 0.01844191696822707, 'bull_atr_max_pct': 0.08874785756695132, 'bull_tp_mult': 2.1041190698105394, 'bull_tsl_mult': 0.7998775939010923, 'bull_time_stop': 281, 'bull_use_sma': False, 'bull_use_ema': False, 'bull_use_atr': True, 'bull_use_adx': False, 'bull_use_spike': False, 'bull_rsi_required': True, 'bear_strategy': 'breakout', 'bear_bb_std_mult': 3.293437440047616, 'bear_rsi_os': 30, 'bear_rsi_ob': 95, 'bear_adx_thresh': 31.00332192968461, 'bear_atr_min_pct': 0.02366080364708973, 'bear_atr_max_pct': 0.023694477163310593, 'bear_tp_mult': 2.8234211011234485, 'bear_tsl_mult': 0.08042751846260231, 'bear_time_stop': 228, 'bear_use_sma': False, 'bear_use_ema': True, 'bear_use_atr': True, 'bear_use_adx': True, 'bear_use_spike': True, 'bear_rsi_required': True, 'sideways_strategy': 'mean_reversion', 'sideways_bb_std_mult': 0.6789757203730056, 'sideways_rsi_os': 38, 'sideways_rsi_ob': 67, 'sideways_adx_thresh': 14.431105050657763, 'sideways_atr_min_pct': 0.013978565741122677, 'sideways_atr_max_pct': 0.134444494494325, 'sideways_tp_mult': 2.448476361362151, 'sideways_tsl_mult': 0.21350066209579766, 'sideways_time_stop': 92, 'sideways_use_sma': False, 'sideways_use_ema': True, 'sideways_use_atr': False, 'sideways_use_adx': True, 'sideways_use_spike': True, 'sideways_rsi_required': False}.
[I 2025-09-01 08:30:54,126] Trial 433 finished with values: [-1000000000.0, 1000000000.0] and parameters: {'p_sma': 19, 'p_std': 16, 'p_atr': 13, 'p_adx': 7, 'rsi_period': 60, 'ema1': 26, 'ema2': 34, 'slip_atr_k': 0.056547679825502455, 'slip_spread_k': 0.6610753364637947, 'spread_hl_frac': 0.049999068103641756, 'bb_std_mult': 3.503717973223568, 'rsi_os': 23, 'rsi_ob': 54, 'vol_spike': 0.258583274359406, 'adx_thresh': 6.949442480178192, 'atr_min_pct': 0.018200411336792604, 'atr_max_pct': 0.14737585657344035, 'tp_mult': 1.078780613701591, 'tsl_mult': 0.4477009888156445, 'strategy': 'breakout', 'time_stop': 245, 'use_sma': False, 'use_atr': True, 'use_adx': True, 'use_ema': True, 'use_spike': True, 'rsi_required': True, 'edge_k': 1.602942903270249, 'edge_cap': 0.5994075472959144, 'bull_strategy': 'mean_reversion', 'bull_bb_std_mult': 2.7597874279366503, 'bull_rsi_os': 11, 'bull_rsi_ob': 69, 'bull_adx_thresh': 11.022880846274994, 'bull_atr_min_pct': 0.028638517673208862, 'bull_atr_max_pct': 0.041160504418650226, 'bull_tp_mult': 2.125523914853979, 'bull_tsl_mult': 2.5187647973434757e-05, 'bull_time_stop': 280, 'bull_use_sma': False, 'bull_use_ema': False, 'bull_use_atr': True, 'bull_use_adx': False, 'bull_use_spike': False, 'bull_rsi_required': True, 'bear_strategy': 'breakout', 'bear_bb_std_mult': 2.8942838362587286, 'bear_rsi_os': 30, 'bear_rsi_ob': 95, 'bear_adx_thresh': 5.603031039950704, 'bear_atr_min_pct': 0.024086563351159176, 'bear_atr_max_pct': 0.07565962457319161, 'bear_tp_mult': 2.4389135334015934, 'bear_tsl_mult': 0.07684677756481809, 'bear_time_stop': 98, 'bear_use_sma': False, 'bear_use_ema': True, 'bear_use_atr': True, 'bear_use_adx': True, 'bear_use_spike': True, 'bear_rsi_required': True, 'sideways_strategy': 'mean_reversion', 'sideways_bb_std_mult': 0.6400264800087121, 'sideways_rsi_os': 38, 'sideways_rsi_ob': 67, 'sideways_adx_thresh': 14.49659993781982, 'sideways_atr_min_pct': 0.01139574507419519, 'sideways_atr_max_pct': 0.10697560788470356, 'sideways_tp_mult': 2.447990876989208, 'sideways_tsl_mult': 0.21091956916135673, 'sideways_time_stop': 43, 'sideways_use_sma': True, 'sideways_use_ema': True, 'sideways_use_atr': False, 'sideways_use_adx': True, 'sideways_use_spike': True, 'sideways_rsi_required': False}.
[I 2025-09-01 08:30:54,444] Trial 434 finished with values: [-1000000000.0, 1000000000.0] and parameters: {'p_sma': 20, 'p_std': 49, 'p_atr': 14, 'p_adx': 21, 'rsi_period': 60, 'ema1': 11, 'ema2': 47, 'slip_atr_k': 0.05399012656034052, 'slip_spread_k': 0.6631175948452819, 'spread_hl_frac': 0.037591503802318814, 'bb_std_mult': 1.6769915287708164, 'rsi_os': 26, 'rsi_ob': 70, 'vol_spike': 0.2872922763364236, 'adx_thresh': 8.668712795234795, 'atr_min_pct': 0.020742103028087218, 'atr_max_pct': 0.12519739571466426, 'tp_mult': 2.6860188167101633, 'tsl_mult': 0.23679866807275235, 'strategy': 'mean_reversion', 'time_stop': 162, 'use_sma': False, 'use_atr': False, 'use_adx': False, 'use_ema': True, 'use_spike': True, 'rsi_required': False, 'edge_k': 1.1302940248221804, 'edge_cap': 0.3483821844522446, 'bull_strategy': 'mean_reversion', 'bull_bb_std_mult': 1.2795656456771367, 'bull_rsi_os': 14, 'bull_rsi_ob': 69, 'bull_adx_thresh': 30.145214643372896, 'bull_atr_min_pct': 0.018433325488776256, 'bull_atr_max_pct': 0.05572597852150335, 'bull_tp_mult': 2.0616512378261014, 'bull_tsl_mult': 0.668714949207489, 'bull_time_stop': 128, 'bull_use_sma': True, 'bull_use_ema': True, 'bull_use_atr': False, 'bull_use_adx': False, 'bull_use_spike': True, 'bull_rsi_required': False, 'bear_strategy': 'breakout', 'bear_bb_std_mult': 2.8990744121698757, 'bear_rsi_os': 30, 'bear_rsi_ob': 45, 'bear_adx_thresh': 34.338396420560755, 'bear_atr_min_pct': 0.023571172553281852, 'bear_atr_max_pct': 0.14709148202782749, 'bear_tp_mult': 2.9757413963880217, 'bear_tsl_mult': 0.08015440403619896, 'bear_time_stop': 98, 'bear_use_sma': False, 'bear_use_ema': True, 'bear_use_atr': False, 'bear_use_adx': True, 'bear_use_spike': True, 'bear_rsi_required': True, 'sideways_strategy': 'mean_reversion', 'sideways_bb_std_mult': 0.6756915391945918, 'sideways_rsi_os': 40, 'sideways_rsi_ob': 66, 'sideways_adx_thresh': 14.307743509737456, 'sideways_atr_min_pct': 0.001358825488394803, 'sideways_atr_max_pct': 0.091066659123201, 'sideways_tp_mult': 1.9145505250713042, 'sideways_tsl_mult': 0.15995453995484515, 'sideways_time_stop': 243, 'sideways_use_sma': True, 'sideways_use_ema': True, 'sideways_use_atr': False, 'sideways_use_adx': True, 'sideways_use_spike': True, 'sideways_rsi_required': False}.
[I 2025-09-01 08:31:37,942] Trial 438 finished with values: [-1000000000.0, 1000000000.0] and parameters: {'p_sma': 56, 'p_std': 14, 'p_atr': 24, 'p_adx': 14, 'rsi_period': 57, 'ema1': 10, 'ema2': 19, 'slip_atr_k': 0.0394443829014479, 'slip_spread_k': 0.018206817862114588, 'spread_hl_frac': 0.033300428113190624, 'bb_std_mult': 2.9452383519298846, 'rsi_os': 25, 'rsi_ob': 57, 'vol_spike': 0.1266330208050401, 'adx_thresh': 25.814564533530277, 'atr_min_pct': 0.022416430411219126, 'atr_max_pct': 0.04970234728007463, 'tp_mult': 2.529628755285656, 'tsl_mult': 0.47764128798620287, 'strategy': 'mean_reversion', 'time_stop': 154, 'use_sma': True, 'use_atr': False, 'use_adx': False, 'use_ema': True, 'use_spike': True, 'rsi_required': False, 'edge_k': 0.8572572552158344, 'edge_cap': 0.08881502782717972, 'bull_strategy': 'breakout', 'bull_bb_std_mult': 0.7245098521690416, 'bull_rsi_os': 13, 'bull_rsi_ob': 59, 'bull_adx_thresh': 8.751535752267426, 'bull_atr_min_pct': 0.01449382000525739, 'bull_atr_max_pct': 0.02605386406684388, 'bull_tp_mult': 2.2633703353335326, 'bull_tsl_mult': 0.6324748130149598, 'bull_time_stop': 90, 'bull_use_sma': True, 'bull_use_ema': True, 'bull_use_atr': False, 'bull_use_adx': True, 'bull_use_spike': True, 'bull_rsi_required': False, 'bear_strategy': 'mean_reversion', 'bear_bb_std_mult': 3.1103694068590575, 'bear_rsi_os': 25, 'bear_rsi_ob': 92, 'bear_adx_thresh': 18.756332779562328, 'bear_atr_min_pct': 0.019141470217268558, 'bear_atr_max_pct': 0.0791049416069314, 'bear_tp_mult': 2.7162246145685023, 'bear_tsl_mult': 0.7479951115973344, 'bear_time_stop': 90, 'bear_use_sma': False, 'bear_use_ema': False, 'bear_use_atr': False, 'bear_use_adx': True, 'bear_use_spike': True, 'bear_rsi_required': False, 'sideways_strategy': 'mean_reversion', 'sideways_bb_std_mult': 2.775454404900568, 'sideways_rsi_os': 17, 'sideways_rsi_ob': 64, 'sideways_adx_thresh': 22.145555359841975, 'sideways_atr_min_pct': 0.021768341300462957, 'sideways_atr_max_pct': 0.07808908737544897, 'sideways_tp_mult': 2.588132733897017, 'sideways_tsl_mult': 0.6302815675304844, 'sideways_time_stop': 38, 'sideways_use_sma': False, 'sideways_use_ema': False, 'sideways_use_atr': False, 'sideways_use_adx': False, 'sideways_use_spike': True, 'sideways_rsi_required': False}.
[I 2025-09-01 08:31:38,594] Trial 436 finished with values: [-0.1474546333482727, 0.1472509483059118] and parameters: {'p_sma': 19, 'p_std': 15, 'p_atr': 12, 'p_adx': 25, 'rsi_period': 43, 'ema1': 10, 'ema2': 29, 'slip_atr_k': 0.16471299283231286, 'slip_spread_k': 0.6393204190839064, 'spread_hl_frac': 0.04597943219106866, 'bb_std_mult': 3.385456081177827, 'rsi_os': 26, 'rsi_ob': 67, 'vol_spike': 0.25289547227346476, 'adx_thresh': 8.828678923307573, 'atr_min_pct': 0.020926377834381116, 'atr_max_pct': 0.12543855665836093, 'tp_mult': 1.209008495042425, 'tsl_mult': 0.4762318428353782, 'strategy': 'mean_reversion', 'time_stop': 155, 'use_sma': True, 'use_atr': False, 'use_adx': False, 'use_ema': True, 'use_spike': True, 'rsi_required': False, 'edge_k': 1.127509413298688, 'edge_cap': 0.13187218629337932, 'bull_strategy': 'breakout', 'bull_bb_std_mult': 2.9509602165305275, 'bull_rsi_os': 14, 'bull_rsi_ob': 69, 'bull_adx_thresh': 12.020022427971673, 'bull_atr_min_pct': 0.014433687776002395, 'bull_atr_max_pct': 0.12924840012621652, 'bull_tp_mult': 2.2534038767510887, 'bull_tsl_mult': 0.0008529125492722778, 'bull_time_stop': 146, 'bull_use_sma': True, 'bull_use_ema': True, 'bull_use_atr': False, 'bull_use_adx': True, 'bull_use_spike': True, 'bull_rsi_required': False, 'bear_strategy': 'mean_reversion', 'bear_bb_std_mult': 2.9055008937259386, 'bear_rsi_os': 22, 'bear_rsi_ob': 94, 'bear_adx_thresh': 32.195151542163245, 'bear_atr_min_pct': 0.005604409863762089, 'bear_atr_max_pct': 0.13678014399248775, 'bear_tp_mult': 2.728633264934515, 'bear_tsl_mult': 0.7570135869964563, 'bear_time_stop': 60, 'bear_use_sma': False, 'bear_use_ema': False, 'bear_use_atr': False, 'bear_use_adx': True, 'bear_use_spike': True, 'bear_rsi_required': False, 'sideways_strategy': 'mean_reversion', 'sideways_bb_std_mult': 2.7532665587439284, 'sideways_rsi_os': 40, 'sideways_rsi_ob': 66, 'sideways_adx_thresh': 11.113942777473891, 'sideways_atr_min_pct': 0.0013932954850384878, 'sideways_atr_max_pct': 0.03468362792104815, 'sideways_tp_mult': 2.579471983164821, 'sideways_tsl_mult': 0.08836471951103775, 'sideways_time_stop': 243, 'sideways_use_sma': True, 'sideways_use_ema': False, 'sideways_use_atr': False, 'sideways_use_adx': True, 'sideways_use_spike': True, 'sideways_rsi_required': False}.
[I 2025-09-01 08:31:38,809] Trial 437 finished with values: [-0.1915247613329717, 0.19146256694891525] and parameters: {'p_sma': 47, 'p_std': 10, 'p_atr': 24, 'p_adx': 14, 'rsi_period': 38, 'ema1': 10, 'ema2': 15, 'slip_atr_k': 0.11223275968727502, 'slip_spread_k': 0.019099485932077664, 'spread_hl_frac': 0.005931249973096311, 'bb_std_mult': 2.320467184382929, 'rsi_os': 32, 'rsi_ob': 57, 'vol_spike': 0.2251310210749347, 'adx_thresh': 26.14614618264079, 'atr_min_pct': 0.011699568482327356, 'atr_max_pct': 0.14417703537273435, 'tp_mult': 1.2117010918448206, 'tsl_mult': 0.22710783407793195, 'strategy': 'mean_reversion', 'time_stop': 43, 'use_sma': True, 'use_atr': False, 'use_adx': False, 'use_ema': True, 'use_spike': True, 'rsi_required': False, 'edge_k': 1.1260415659794325, 'edge_cap': 0.13952464472366014, 'bull_strategy': 'breakout', 'bull_bb_std_mult': 2.908218109120605, 'bull_rsi_os': 14, 'bull_rsi_ob': 45, 'bull_adx_thresh': 8.83673196406987, 'bull_atr_min_pct': 0.02398341506115153, 'bull_atr_max_pct': 0.040007853405640836, 'bull_tp_mult': 2.3212566419129006, 'bull_tsl_mult': 0.631197572082694, 'bull_time_stop': 129, 'bull_use_sma': True, 'bull_use_ema': True, 'bull_use_atr': False, 'bull_use_adx': True, 'bull_use_spike': True, 'bull_rsi_required': False, 'bear_strategy': 'mean_reversion', 'bear_bb_std_mult': 3.093274761797723, 'bear_rsi_os': 24, 'bear_rsi_ob': 92, 'bear_adx_thresh': 32.30987531963202, 'bear_atr_min_pct': 0.020145409907430252, 'bear_atr_max_pct': 0.078727244261285, 'bear_tp_mult': 1.2935531310550386, 'bear_tsl_mult': 0.4992593524799846, 'bear_time_stop': 220, 'bear_use_sma': False, 'bear_use_ema': False, 'bear_use_atr': False, 'bear_use_adx': True, 'bear_use_spike': True, 'bear_rsi_required': False, 'sideways_strategy': 'mean_reversion', 'sideways_bb_std_mult': 1.8805328904905478, 'sideways_rsi_os': 40, 'sideways_rsi_ob': 66, 'sideways_adx_thresh': 11.204900983422927, 'sideways_atr_min_pct': 0.00116384162828859, 'sideways_atr_max_pct': 0.08329263514311412, 'sideways_tp_mult': 1.1805897815246058, 'sideways_tsl_mult': 0.6242543096186324, 'sideways_time_stop': 37, 'sideways_use_sma': True, 'sideways_use_ema': False, 'sideways_use_atr': False, 'sideways_use_adx': False, 'sideways_use_spike': True, 'sideways_rsi_required': False}.
[I 2025-09-01 08:31:39,102] Trial 435 finished with values: [-0.07148389742206418, 0.0724951009663846] and parameters: {'p_sma': 25, 'p_std': 16, 'p_atr': 9, 'p_adx': 21, 'rsi_period': 66, 'ema1': 10, 'ema2': 19, 'slip_atr_k': 0.12664164399452915, 'slip_spread_k': 0.8054250936988347, 'spread_hl_frac': 0.0274007117444532, 'bb_std_mult': 1.7073311585400504, 'rsi_os': 48, 'rsi_ob': 54, 'vol_spike': 0.12557844558163253, 'adx_thresh': 26.442023494624333, 'atr_min_pct': 0.00466291236532705, 'atr_max_pct': 0.049954339043879956, 'tp_mult': 2.1624729550762396, 'tsl_mult': 0.00030802380201977453, 'strategy': 'mean_reversion', 'time_stop': 245, 'use_sma': True, 'use_atr': False, 'use_adx': False, 'use_ema': True, 'use_spike': True, 'rsi_required': False, 'edge_k': 1.1159021665849314, 'edge_cap': 0.08923708335441309, 'bull_strategy': 'breakout', 'bull_bb_std_mult': 2.914798319033731, 'bull_rsi_os': 14, 'bull_rsi_ob': 69, 'bull_adx_thresh': 11.925243798132552, 'bull_atr_min_pct': 0.003023983297125058, 'bull_atr_max_pct': 0.04221013011737383, 'bull_tp_mult': 2.273715654363959, 'bull_tsl_mult': 0.8053280088450565, 'bull_time_stop': 138, 'bull_use_sma': True, 'bull_use_ema': True, 'bull_use_atr': False, 'bull_use_adx': True, 'bull_use_spike': True, 'bull_rsi_required': False, 'bear_strategy': 'mean_reversion', 'bear_bb_std_mult': 2.540929061246662, 'bear_rsi_os': 30, 'bear_rsi_ob': 95, 'bear_adx_thresh': 34.16467663378594, 'bear_atr_min_pct': 0.023571560125851366, 'bear_atr_max_pct': 0.09960156909177255, 'bear_tp_mult': 2.6218414298628967, 'bear_tsl_mult': 0.8908768067229642, 'bear_time_stop': 222, 'bear_use_sma': False, 'bear_use_ema': False, 'bear_use_atr': False, 'bear_use_adx': True, 'bear_use_spike': True, 'bear_rsi_required': False, 'sideways_strategy': 'mean_reversion', 'sideways_bb_std_mult': 0.6739311796746303, 'sideways_rsi_os': 50, 'sideways_rsi_ob': 66, 'sideways_adx_thresh': 10.94798580458057, 'sideways_atr_min_pct': 0.022744153642039435, 'sideways_atr_max_pct': 0.09087436999728492, 'sideways_tp_mult': 1.928514549913863, 'sideways_tsl_mult': 0.7462953590777536, 'sideways_time_stop': 94, 'sideways_use_sma': True, 'sideways_use_ema': True, 'sideways_use_atr': False, 'sideways_use_adx': True, 'sideways_use_spike': True, 'sideways_rsi_required': False}.
[I 2025-09-01 08:32:20,479] Trial 442 finished with values: [-1000000000.0, 1000000000.0] and parameters: {'p_sma': 6, 'p_std': 19, 'p_atr': 11, 'p_adx': 29, 'rsi_period': 64, 'ema1': 20, 'ema2': 17, 'slip_atr_k': 0.06258367669330774, 'slip_spread_k': 0.17008991182334038, 'spread_hl_frac': 0.02436634689925727, 'bb_std_mult': 1.2892388906460663, 'rsi_os': 46, 'rsi_ob': 58, 'vol_spike': 0.2392828968262599, 'adx_thresh': 24.711213336671424, 'atr_min_pct': 0.01274050515117039, 'atr_max_pct': 0.13073113664181724, 'tp_mult': 1.0323754773049667, 'tsl_mult': 0.5013377590966244, 'strategy': 'mean_reversion', 'time_stop': 34, 'use_sma': True, 'use_atr': True, 'use_adx': True, 'use_ema': True, 'use_spike': False, 'rsi_required': True, 'edge_k': 0.6642394044565001, 'edge_cap': 0.5163624168576879, 'bull_strategy': 'breakout', 'bull_bb_std_mult': 2.8070241068429036, 'bull_rsi_os': 47, 'bull_rsi_ob': 71, 'bull_adx_thresh': 7.737583105121833, 'bull_atr_min_pct': 0.025234688963117258, 'bull_atr_max_pct': 0.04524097290060369, 'bull_tp_mult': 2.6222859377307306, 'bull_tsl_mult': 0.0663228814619648, 'bull_time_stop': 155, 'bull_use_sma': True, 'bull_use_ema': False, 'bull_use_atr': False, 'bull_use_adx': True, 'bull_use_spike': True, 'bull_rsi_required': False, 'bear_strategy': 'mean_reversion', 'bear_bb_std_mult': 3.268159019331335, 'bear_rsi_os': 28, 'bear_rsi_ob': 85, 'bear_adx_thresh': 14.87671498442228, 'bear_atr_min_pct': 0.021434661021343438, 'bear_atr_max_pct': 0.03982350688218301, 'bear_tp_mult': 2.864898623160469, 'bear_tsl_mult': 0.1409587512451011, 'bear_time_stop': 95, 'bear_use_sma': False, 'bear_use_ema': False, 'bear_use_atr': True, 'bear_use_adx': True, 'bear_use_spike': True, 'bear_rsi_required': False, 'sideways_strategy': 'mean_reversion', 'sideways_bb_std_mult': 0.5551326273510196, 'sideways_rsi_os': 39, 'sideways_rsi_ob': 64, 'sideways_adx_thresh': 8.53974681668516, 'sideways_atr_min_pct': 0.023218297853655402, 'sideways_atr_max_pct': 0.03367000631478557, 'sideways_tp_mult': 2.643335314716209, 'sideways_tsl_mult': 0.12704653190624018, 'sideways_time_stop': 30, 'sideways_use_sma': False, 'sideways_use_ema': False, 'sideways_use_atr': False, 'sideways_use_adx': True, 'sideways_use_spike': False, 'sideways_rsi_required': False}.
[I 2025-09-01 08:32:21,064] Trial 441 finished with values: [-1000000000.0, 1000000000.0] and parameters: {'p_sma': 6, 'p_std': 34, 'p_atr': 20, 'p_adx': 19, 'rsi_period': 66, 'ema1': 9, 'ema2': 12, 'slip_atr_k': 0.06034628254995595, 'slip_spread_k': 0.6999863056190262, 'spread_hl_frac': 0.02429613625392363, 'bb_std_mult': 3.2023277881572723, 'rsi_os': 46, 'rsi_ob': 88, 'vol_spike': 0.2374665356615071, 'adx_thresh': 19.207780702861672, 'atr_min_pct': 0.017197112481989657, 'atr_max_pct': 0.1475837490602793, 'tp_mult': 1.8281876487260267, 'tsl_mult': 0.5098514212264056, 'strategy': 'mean_reversion', 'time_stop': 253, 'use_sma': True, 'use_atr': True, 'use_adx': True, 'use_ema': True, 'use_spike': True, 'rsi_required': True, 'edge_k': 0.5574431426693578, 'edge_cap': 0.18413080226179185, 'bull_strategy': 'breakout', 'bull_bb_std_mult': 1.67576501791648, 'bull_rsi_os': 12, 'bull_rsi_ob': 89, 'bull_adx_thresh': 7.566676462373802, 'bull_atr_min_pct': 0.006719906424808266, 'bull_atr_max_pct': 0.04423306183134759, 'bull_tp_mult': 2.4130415946883086, 'bull_tsl_mult': 0.37078862539396895, 'bull_time_stop': 155, 'bull_use_sma': True, 'bull_use_ema': False, 'bull_use_atr': False, 'bull_use_adx': True, 'bull_use_spike': True, 'bull_rsi_required': False, 'bear_strategy': 'mean_reversion', 'bear_bb_std_mult': 1.3892808873918083, 'bear_rsi_os': 22, 'bear_rsi_ob': 93, 'bear_adx_thresh': 7.623023931640004, 'bear_atr_min_pct': 0.025293115201353605, 'bear_atr_max_pct': 0.12110262480088083, 'bear_tp_mult': 1.744792395065006, 'bear_tsl_mult': 0.6420233504548629, 'bear_time_stop': 25, 'bear_use_sma': False, 'bear_use_ema': False, 'bear_use_atr': True, 'bear_use_adx': True, 'bear_use_spike': True, 'bear_rsi_required': False, 'sideways_strategy': 'mean_reversion', 'sideways_bb_std_mult': 0.550640649265, 'sideways_rsi_os': 39, 'sideways_rsi_ob': 65, 'sideways_adx_thresh': 30.482515192562676, 'sideways_atr_min_pct': 0.009194392079005515, 'sideways_atr_max_pct': 0.09407024792316465, 'sideways_tp_mult': 2.7038220867779996, 'sideways_tsl_mult': 0.5173466576416972, 'sideways_time_stop': 119, 'sideways_use_sma': False, 'sideways_use_ema': False, 'sideways_use_atr': False, 'sideways_use_adx': True, 'sideways_use_spike': False, 'sideways_rsi_required': False}.
