[I 2025-09-01 07:53:28,721] Trial 207 finished with values: [-1000000000.0, 1000000000.0] and parameters: {'p_sma': 52, 'p_std': 17, 'p_atr': 13, 'p_adx': 20, 'rsi_period': 9, 'ema1': 6, 'ema2': 11, 'slip_atr_k': 0.06197539848549789, 'slip_spread_k': 0.9456726866327274, 'spread_hl_frac': 0.025118841186329812, 'bb_std_mult': 3.388596693493711, 'rsi_os': 25, 'rsi_ob': 58, 'vol_spike': 0.21681670621268032, 'adx_thresh': 24.763898427984792, 'atr_min_pct': 0.02205247419288156, 'atr_max_pct': 0.06999827383662335, 'tp_mult': 1.2131854899102046, 'tsl_mult': 0.8207575168765027, 'strategy': 'mean_reversion', 'time_stop': 250, 'use_sma': True, 'use_atr': True, 'use_adx': True, 'use_ema': True, 'use_spike': True, 'rsi_required': True, 'edge_k': 1.1909671861560427, 'edge_cap': 0.11131615204782373, 'bull_strategy': 'breakout', 'bull_bb_std_mult': 2.8058053564788588, 'bull_rsi_os': 16, 'bull_rsi_ob': 68, 'bull_adx_thresh': 13.725915478342234, 'bull_atr_min_pct': 0.0093759092093787, 'bull_atr_max_pct': 0.03317093358632521, 'bull_tp_mult': 2.11867958739407, 'bull_tsl_mult': 0.656861777713859, 'bull_time_stop': 22, 'bull_use_sma': True, 'bull_use_ema': False, 'bull_use_atr': False, 'bull_use_adx': True, 'bull_use_spike': True, 'bull_rsi_required': False, 'bear_strategy': 'mean_reversion', 'bear_bb_std_mult': 3.151894598832058, 'bear_rsi_os': 34, 'bear_rsi_ob': 95, 'bear_adx_thresh': 32.04755014201874, 'bear_atr_min_pct': 0.013452718368119293, 'bear_atr_max_pct': 0.11578117168592425, 'bear_tp_mult': 2.8170434153009927, 'bear_tsl_mult': 0.7690150774690954, 'bear_time_stop': 101, 'bear_use_sma': True, 'bear_use_ema': True, 'bear_use_atr': True, 'bear_use_adx': True, 'bear_use_spike': True, 'bear_rsi_required': False, 'sideways_strategy': 'mean_reversion', 'sideways_bb_std_mult': 0.5735263706886552, 'sideways_rsi_os': 55, 'sideways_rsi_ob': 78, 'sideways_adx_thresh': 8.283128659932975, 'sideways_atr_min_pct': 0.01667009832293893, 'sideways_atr_max_pct': 0.1257438814051259, 'sideways_tp_mult': 2.8880365912808306, 'sideways_tsl_mult': 0.1647498841999898, 'sideways_time_stop': 246, 'sideways_use_sma': False, 'sideways_use_ema': False, 'sideways_use_atr': False, 'sideways_use_adx': False, 'sideways_use_spike': False, 'sideways_rsi_required': True}.
[I 2025-09-01 07:53:29,193] Trial 209 finished with values: [-1000000000.0, 1000000000.0] and parameters: {'p_sma': 18, 'p_std': 42, 'p_atr': 13, 'p_adx': 20, 'rsi_period': 32, 'ema1': 10, 'ema2': 40, 'slip_atr_k': 0.11420159933719363, 'slip_spread_k': 0.6178540364441324, 'spread_hl_frac': 0.015395782826222242, 'bb_std_mult': 1.0064787253291265, 'rsi_os': 28, 'rsi_ob': 61, 'vol_spike': 0.1530126646989658, 'adx_thresh': 24.565439313149643, 'atr_min_pct': 0.024669482482268055, 'atr_max_pct': 0.060985291250670974, 'tp_mult': 1.0120729500770629, 'tsl_mult': 0.5060009891943378, 'strategy': 'mean_reversion', 'time_stop': 250, 'use_sma': True, 'use_atr': True, 'use_adx': True, 'use_ema': True, 'use_spike': True, 'rsi_required': True, 'edge_k': 1.375648363091246, 'edge_cap': 0.11506969432238615, 'bull_strategy': 'breakout', 'bull_bb_std_mult': 2.8848823690517063, 'bull_rsi_os': 17, 'bull_rsi_ob': 74, 'bull_adx_thresh': 7.786784176858747, 'bull_atr_min_pct': 0.025573728274212094, 'bull_atr_max_pct': 0.03855605617014517, 'bull_tp_mult': 2.306507717570123, 'bull_tsl_mult': 0.6539859777027054, 'bull_time_stop': 150, 'bull_use_sma': True, 'bull_use_ema': False, 'bull_use_atr': False, 'bull_use_adx': True, 'bull_use_spike': True, 'bull_rsi_required': False, 'bear_strategy': 'mean_reversion', 'bear_bb_std_mult': 3.081083427938052, 'bear_rsi_os': 26, 'bear_rsi_ob': 95, 'bear_adx_thresh': 15.931390786380092, 'bear_atr_min_pct': 0.011347893461422148, 'bear_atr_max_pct': 0.11577957974029995, 'bear_tp_mult': 2.8236546331149657, 'bear_tsl_mult': 0.1131578603873343, 'bear_time_stop': 86, 'bear_use_sma': True, 'bear_use_ema': True, 'bear_use_atr': True, 'bear_use_adx': True, 'bear_use_spike': True, 'bear_rsi_required': False, 'sideways_strategy': 'mean_reversion', 'sideways_bb_std_mult': 0.5697255271584518, 'sideways_rsi_os': 55, 'sideways_rsi_ob': 64, 'sideways_adx_thresh': 8.230004580278951, 'sideways_atr_min_pct': 0.024165927857333812, 'sideways_atr_max_pct': 0.028277299629662182, 'sideways_tp_mult': 2.5300012445499873, 'sideways_tsl_mult': 0.6646008490020827, 'sideways_time_stop': 35, 'sideways_use_sma': False, 'sideways_use_ema': False, 'sideways_use_atr': False, 'sideways_use_adx': False, 'sideways_use_spike': False, 'sideways_rsi_required': True}.
[I 2025-09-01 07:53:30,059] Trial 206 finished with values: [-1000000000.0, 1000000000.0] and parameters: {'p_sma': 18, 'p_std': 16, 'p_atr': 12, 'p_adx': 20, 'rsi_period': 63, 'ema1': 22, 'ema2': 59, 'slip_atr_k': 0.2123606359339854, 'slip_spread_k': 0.6840584386227135, 'spread_hl_frac': 0.015832703382719186, 'bb_std_mult': 3.3706491596479324, 'rsi_os': 25, 'rsi_ob': 85, 'vol_spike': 0.25349957062620776, 'adx_thresh': 5.813950900385102, 'atr_min_pct': 0.02220336815084665, 'atr_max_pct': 0.04799129380519432, 'tp_mult': 1.2205260971341951, 'tsl_mult': 0.16024504955142377, 'strategy': 'breakout', 'time_stop': 243, 'use_sma': False, 'use_atr': True, 'use_adx': True, 'use_ema': True, 'use_spike': True, 'rsi_required': True, 'edge_k': 1.5799715024590426, 'edge_cap': 0.1158194867904992, 'bull_strategy': 'mean_reversion', 'bull_bb_std_mult': 2.803200570200833, 'bull_rsi_os': 16, 'bull_rsi_ob': 67, 'bull_adx_thresh': 7.608308269456737, 'bull_atr_min_pct': 0.024935476151284948, 'bull_atr_max_pct': 0.1165732272493725, 'bull_tp_mult': 1.4684637040485402, 'bull_tsl_mult': 0.08832766504245093, 'bull_time_stop': 160, 'bull_use_sma': False, 'bull_use_ema': False, 'bull_use_atr': False, 'bull_use_adx': True, 'bull_use_spike': True, 'bull_rsi_required': True, 'bear_strategy': 'mean_reversion', 'bear_bb_std_mult': 3.185475292771857, 'bear_rsi_os': 34, 'bear_rsi_ob': 95, 'bear_adx_thresh': 19.38046735260484, 'bear_atr_min_pct': 0.013347651569131567, 'bear_atr_max_pct': 0.14030894450389592, 'bear_tp_mult': 2.8397568767459207, 'bear_tsl_mult': 0.770125183689992, 'bear_time_stop': 73, 'bear_use_sma': False, 'bear_use_ema': True, 'bear_use_atr': True, 'bear_use_adx': True, 'bear_use_spike': True, 'bear_rsi_required': False, 'sideways_strategy': 'mean_reversion', 'sideways_bb_std_mult': 1.512975512958817, 'sideways_rsi_os': 41, 'sideways_rsi_ob': 68, 'sideways_adx_thresh': 8.523099756226083, 'sideways_atr_min_pct': 0.01666084889479813, 'sideways_atr_max_pct': 0.08905960843014682, 'sideways_tp_mult': 2.9068833612158813, 'sideways_tsl_mult': 0.45258161637848804, 'sideways_time_stop': 204, 'sideways_use_sma': False, 'sideways_use_ema': False, 'sideways_use_atr': False, 'sideways_use_adx': True, 'sideways_use_spike': True, 'sideways_rsi_required': False}.
[I 2025-09-01 07:53:30,928] Trial 210 finished with values: [-1000000000.0, 1000000000.0] and parameters: {'p_sma': 51, 'p_std': 14, 'p_atr': 11, 'p_adx': 20, 'rsi_period': 64, 'ema1': 24, 'ema2': 39, 'slip_atr_k': 0.06239396295127864, 'slip_spread_k': 0.6819759424786084, 'spread_hl_frac': 0.02672641495184026, 'bb_std_mult': 2.6485260811821765, 'rsi_os': 28, 'rsi_ob': 93, 'vol_spike': 0.06846507411758808, 'adx_thresh': 11.266399157200027, 'atr_min_pct': 0.02458518699902706, 'atr_max_pct': 0.08923728850455424, 'tp_mult': 2.5942602602587868, 'tsl_mult': 0.4892680151512288, 'strategy': 'mean_reversion', 'time_stop': 251, 'use_sma': True, 'use_atr': True, 'use_adx': True, 'use_ema': True, 'use_spike': True, 'rsi_required': True, 'edge_k': 1.3739528730152935, 'edge_cap': 0.475324773130389, 'bull_strategy': 'breakout', 'bull_bb_std_mult': 1.0525254607067098, 'bull_rsi_os': 10, 'bull_rsi_ob': 50, 'bull_adx_thresh': 31.466033858398117, 'bull_atr_min_pct': 0.025497720960309056, 'bull_atr_max_pct': 0.06295527130030944, 'bull_tp_mult': 2.1569909913150447, 'bull_tsl_mult': 0.6646279534978676, 'bull_time_stop': 251, 'bull_use_sma': True, 'bull_use_ema': False, 'bull_use_atr': False, 'bull_use_adx': True, 'bull_use_spike': True, 'bull_rsi_required': False, 'bear_strategy': 'mean_reversion', 'bear_bb_std_mult': 3.089071414901717, 'bear_rsi_os': 19, 'bear_rsi_ob': 95, 'bear_adx_thresh': 30.382173099780935, 'bear_atr_min_pct': 0.013323033391566036, 'bear_atr_max_pct': 0.0306351998602205, 'bear_tp_mult': 2.807438618607759, 'bear_tsl_mult': 0.545089842227529, 'bear_time_stop': 87, 'bear_use_sma': False, 'bear_use_ema': True, 'bear_use_atr': True, 'bear_use_adx': True, 'bear_use_spike': True, 'bear_rsi_required': False, 'sideways_strategy': 'mean_reversion', 'sideways_bb_std_mult': 0.5813562874407697, 'sideways_rsi_os': 41, 'sideways_rsi_ob': 64, 'sideways_adx_thresh': 9.173656878527742, 'sideways_atr_min_pct': 0.00534807940884636, 'sideways_atr_max_pct': 0.1380105632240039, 'sideways_tp_mult': 1.4299903255668127, 'sideways_tsl_mult': 0.3625933546733936, 'sideways_time_stop': 245, 'sideways_use_sma': False, 'sideways_use_ema': True, 'sideways_use_atr': False, 'sideways_use_adx': True, 'sideways_use_spike': True, 'sideways_rsi_required': False}.
[I 2025-09-01 07:54:11,806] Trial 214 finished with values: [-1000000000.0, 1000000000.0] and parameters: {'p_sma': 21, 'p_std': 13, 'p_atr': 8, 'p_adx': 19, 'rsi_period': 61, 'ema1': 9, 'ema2': 12, 'slip_atr_k': 0.0539307896396511, 'slip_spread_k': 0.09987304153325538, 'spread_hl_frac': 0.02280709069143527, 'bb_std_mult': 2.772264591573235, 'rsi_os': 9, 'rsi_ob': 57, 'vol_spike': 0.23920131054742746, 'adx_thresh': 26.123242777128336, 'atr_min_pct': 0.01877113833213252, 'atr_max_pct': 0.14671364751028987, 'tp_mult': 2.2648231508547743, 'tsl_mult': 0.29107837368549927, 'strategy': 'mean_reversion', 'time_stop': 257, 'use_sma': True, 'use_atr': True, 'use_adx': True, 'use_ema': False, 'use_spike': True, 'rsi_required': False, 'edge_k': 1.0269624148579024, 'edge_cap': 0.07847916030352853, 'bull_strategy': 'breakout', 'bull_bb_std_mult': 0.6968990738593086, 'bull_rsi_os': 36, 'bull_rsi_ob': 70, 'bull_adx_thresh': 8.355282215935523, 'bull_atr_min_pct': 0.019644680583592793, 'bull_atr_max_pct': 0.07759378012180426, 'bull_tp_mult': 1.1531212222163227, 'bull_tsl_mult': 0.685991955293656, 'bull_time_stop': 270, 'bull_use_sma': True, 'bull_use_ema': False, 'bull_use_atr': True, 'bull_use_adx': False, 'bull_use_spike': False, 'bull_rsi_required': False, 'bear_strategy': 'breakout', 'bear_bb_std_mult': 1.199122802510118, 'bear_rsi_os': 23, 'bear_rsi_ob': 72, 'bear_adx_thresh': 33.094906355862584, 'bear_atr_min_pct': 0.022906454494052292, 'bear_atr_max_pct': 0.07820250551460906, 'bear_tp_mult': 2.8619916238492613, 'bear_tsl_mult': 0.2574747005889124, 'bear_time_stop': 67, 'bear_use_sma': False, 'bear_use_ema': False, 'bear_use_atr': False, 'bear_use_adx': False, 'bear_use_spike': False, 'bear_rsi_required': True, 'sideways_strategy': 'mean_reversion', 'sideways_bb_std_mult': 1.3017863616497956, 'sideways_rsi_os': 38, 'sideways_rsi_ob': 65, 'sideways_adx_thresh': 9.757665226848054, 'sideways_atr_min_pct': 0.0037644743791982963, 'sideways_atr_max_pct': 0.029510146271923565, 'sideways_tp_mult': 2.7828350729166553, 'sideways_tsl_mult': 0.7659945313183074, 'sideways_time_stop': 33, 'sideways_use_sma': True, 'sideways_use_ema': False, 'sideways_use_atr': False, 'sideways_use_adx': True, 'sideways_use_spike': True, 'sideways_rsi_required': False}.
[I 2025-09-01 07:54:12,444] Trial 212 finished with values: [-1000000000.0, 1000000000.0] and parameters: {'p_sma': 8, 'p_std': 14, 'p_atr': 11, 'p_adx': 30, 'rsi_period': 64, 'ema1': 22, 'ema2': 53, 'slip_atr_k': 0.2126568479079815, 'slip_spread_k': 0.6795127489476185, 'spread_hl_frac': 0.019903728188613856, 'bb_std_mult': 2.6246715330395043, 'rsi_os': 22, 'rsi_ob': 65, 'vol_spike': 0.06903508525551948, 'adx_thresh': 18.061619784131246, 'atr_min_pct': 0.015714577820616762, 'atr_max_pct': 0.14065224701613271, 'tp_mult': 1.7820691380263256, 'tsl_mult': 0.4850424745650618, 'strategy': 'breakout', 'time_stop': 260, 'use_sma': True, 'use_atr': True, 'use_adx': True, 'use_ema': False, 'use_spike': True, 'rsi_required': False, 'edge_k': 0.10172586821102048, 'edge_cap': 0.4437453107138108, 'bull_strategy': 'breakout', 'bull_bb_std_mult': 2.660235876412065, 'bull_rsi_os': 18, 'bull_rsi_ob': 48, 'bull_adx_thresh': 22.765179109502824, 'bull_atr_min_pct': 0.02491900021007902, 'bull_atr_max_pct': 0.13510598629813317, 'bull_tp_mult': 2.16563529868089, 'bull_tsl_mult': 0.4134978018789792, 'bull_time_stop': 270, 'bull_use_sma': True, 'bull_use_ema': False, 'bull_use_atr': True, 'bull_use_adx': False, 'bull_use_spike': False, 'bull_rsi_required': True, 'bear_strategy': 'mean_reversion', 'bear_bb_std_mult': 3.0864404401573458, 'bear_rsi_os': 19, 'bear_rsi_ob': 72, 'bear_adx_thresh': 20.67654016717829, 'bear_atr_min_pct': 0.009031513107185203, 'bear_atr_max_pct': 0.07658710283161953, 'bear_tp_mult': 1.4746401307656953, 'bear_tsl_mult': 0.612181264044063, 'bear_time_stop': 71, 'bear_use_sma': False, 'bear_use_ema': False, 'bear_use_atr': False, 'bear_use_adx': False, 'bear_use_spike': True, 'bear_rsi_required': True, 'sideways_strategy': 'mean_reversion', 'sideways_bb_std_mult': 1.0376297815413111, 'sideways_rsi_os': 41, 'sideways_rsi_ob': 62, 'sideways_adx_thresh': 27.948548911335344, 'sideways_atr_min_pct': 0.017984301861580117, 'sideways_atr_max_pct': 0.040784264177790124, 'sideways_tp_mult': 1.8552072416680863, 'sideways_tsl_mult': 0.754454756210663, 'sideways_time_stop': 259, 'sideways_use_sma': True, 'sideways_use_ema': True, 'sideways_use_atr': False, 'sideways_use_adx': True, 'sideways_use_spike': True, 'sideways_rsi_required': False}.
[I 2025-09-01 07:54:12,619] Trial 213 finished with values: [-1000000000.0, 1000000000.0] and parameters: {'p_sma': 22, 'p_std': 14, 'p_atr': 11, 'p_adx': 30, 'rsi_period': 61, 'ema1': 9, 'ema2': 36, 'slip_atr_k': 0.05342689695636465, 'slip_spread_k': 0.5671807283370224, 'spread_hl_frac': 0.02168006393616185, 'bb_std_mult': 0.7111591998320861, 'rsi_os': 21, 'rsi_ob': 93, 'vol_spike': 0.10534113150991192, 'adx_thresh': 11.929733477248835, 'atr_min_pct': 0.025746187312667063, 'atr_max_pct': 0.13938544541023576, 'tp_mult': 1.1128221786720993, 'tsl_mult': 0.4852087583714096, 'strategy': 'mean_reversion', 'time_stop': 261, 'use_sma': True, 'use_atr': True, 'use_adx': True, 'use_ema': False, 'use_spike': True, 'rsi_required': False, 'edge_k': 1.010306003578904, 'edge_cap': 0.5806872317030745, 'bull_strategy': 'breakout', 'bull_bb_std_mult': 0.695201846873388, 'bull_rsi_os': 36, 'bull_rsi_ob': 45, 'bull_adx_thresh': 23.816176884585875, 'bull_atr_min_pct': 0.00768022757889578, 'bull_atr_max_pct': 0.03705632683707318, 'bull_tp_mult': 2.188360229836, 'bull_tsl_mult': 0.3183529356219614, 'bull_time_stop': 273, 'bull_use_sma': True, 'bull_use_ema': False, 'bull_use_atr': True, 'bull_use_adx': False, 'bull_use_spike': False, 'bull_rsi_required': False, 'bear_strategy': 'breakout', 'bear_bb_std_mult': 1.4597072341883335, 'bear_rsi_os': 19, 'bear_rsi_ob': 87, 'bear_adx_thresh': 7.358117154439313, 'bear_atr_min_pct': 0.02250282839478009, 'bear_atr_max_pct': 0.07604512551359487, 'bear_tp_mult': 1.532857620778191, 'bear_tsl_mult': 0.314024307886617, 'bear_time_stop': 83, 'bear_use_sma': False, 'bear_use_ema': False, 'bear_use_atr': False, 'bear_use_adx': False, 'bear_use_spike': False, 'bear_rsi_required': True, 'sideways_strategy': 'mean_reversion', 'sideways_bb_std_mult': 1.7712626759910217, 'sideways_rsi_os': 38, 'sideways_rsi_ob': 62, 'sideways_adx_thresh': 9.456542713964524, 'sideways_atr_min_pct': 0.007850868979797254, 'sideways_atr_max_pct': 0.03875961423763833, 'sideways_tp_mult': 1.8349579372607967, 'sideways_tsl_mult': 0.0836695314492727, 'sideways_time_stop': 192, 'sideways_use_sma': False, 'sideways_use_ema': True, 'sideways_use_atr': False, 'sideways_use_adx': True, 'sideways_use_spike': True, 'sideways_rsi_required': False}.
[I 2025-09-01 07:54:12,952] Trial 211 finished with values: [-1000000000.0, 1000000000.0] and parameters: {'p_sma': 22, 'p_std': 42, 'p_atr': 11, 'p_adx': 22, 'rsi_period': 64, 'ema1': 14, 'ema2': 36, 'slip_atr_k': 0.09605328995561739, 'slip_spread_k': 0.6187288262734946, 'spread_hl_frac': 0.020256449200456512, 'bb_std_mult': 2.6628269030583813, 'rsi_os': 28, 'rsi_ob': 86, 'vol_spike': 0.06887661814809849, 'adx_thresh': 12.331475104809922, 'atr_min_pct': 0.025573869152220853, 'atr_max_pct': 0.14081217738713234, 'tp_mult': 2.27036740688431, 'tsl_mult': 0.16412647069278846, 'strategy': 'mean_reversion', 'time_stop': 300, 'use_sma': True, 'use_atr': True, 'use_adx': True, 'use_ema': False, 'use_spike': True, 'rsi_required': False, 'edge_k': 1.861047413254655, 'edge_cap': 0.7963192569834476, 'bull_strategy': 'breakout', 'bull_bb_std_mult': 2.914651356110187, 'bull_rsi_os': 36, 'bull_rsi_ob': 74, 'bull_adx_thresh': 8.03487561536515, 'bull_atr_min_pct': 0.029999052696278235, 'bull_atr_max_pct': 0.11726827855214075, 'bull_tp_mult': 2.3011669819700735, 'bull_tsl_mult': 0.31868418823104383, 'bull_time_stop': 159, 'bull_use_sma': True, 'bull_use_ema': False, 'bull_use_atr': True, 'bull_use_adx': True, 'bull_use_spike': False, 'bull_rsi_required': False, 'bear_strategy': 'mean_reversion', 'bear_bb_std_mult': 1.3999847840033013, 'bear_rsi_os': 18, 'bear_rsi_ob': 73, 'bear_adx_thresh': 7.061378748228805, 'bear_atr_min_pct': 0.011458062486878699, 'bear_atr_max_pct': 0.01273226567659938, 'bear_tp_mult': 2.7058235925007534, 'bear_tsl_mult': 0.5280528661161363, 'bear_time_stop': 84, 'bear_use_sma': False, 'bear_use_ema': False, 'bear_use_atr': False, 'bear_use_adx': True, 'bear_use_spike': True, 'bear_rsi_required': True, 'sideways_strategy': 'mean_reversion', 'sideways_bb_std_mult': 3.4023951520874323, 'sideways_rsi_os': 41, 'sideways_rsi_ob': 64, 'sideways_adx_thresh': 34.42890040931367, 'sideways_atr_min_pct': 0.005596941290177236, 'sideways_atr_max_pct': 0.03962694149623873, 'sideways_tp_mult': 2.5845197686617376, 'sideways_tsl_mult': 0.49378649421066556, 'sideways_time_stop': 234, 'sideways_use_sma': False, 'sideways_use_ema': True, 'sideways_use_atr': False, 'sideways_use_adx': True, 'sideways_use_spike': True, 'sideways_rsi_required': False}.
[I 2025-09-01 07:54:53,006] Trial 218 finished with values: [-1000000000.0, 1000000000.0] and parameters: {'p_sma': 20, 'p_std': 45, 'p_atr': 23, 'p_adx': 21, 'rsi_period': 67, 'ema1': 10, 'ema2': 11, 'slip_atr_k': 0.05715481742021368, 'slip_spread_k': 0.6615015773874997, 'spread_hl_frac': 0.024342870525790816, 'bb_std_mult': 3.4290401419150536, 'rsi_os': 23, 'rsi_ob': 68, 'vol_spike': 0.2421621232725021, 'adx_thresh': 22.636225327083853, 'atr_min_pct': 0.02117146321519984, 'atr_max_pct': 0.1477724771262438, 'tp_mult': 1.6422939187685317, 'tsl_mult': 0.23498862592894892, 'strategy': 'mean_reversion', 'time_stop': 245, 'use_sma': False, 'use_atr': False, 'use_adx': True, 'use_ema': True, 'use_spike': False, 'rsi_required': True, 'edge_k': 0.18359907185771396, 'edge_cap': 0.7635993256314129, 'bull_strategy': 'mean_reversion', 'bull_bb_std_mult': 2.7285196172140074, 'bull_rsi_os': 5, 'bull_rsi_ob': 55, 'bull_adx_thresh': 17.506269411278026, 'bull_atr_min_pct': 0.005323611093802822, 'bull_atr_max_pct': 0.0415745832113501, 'bull_tp_mult': 1.0663249550267748, 'bull_tsl_mult': 0.35211364095100023, 'bull_time_stop': 142, 'bull_use_sma': False, 'bull_use_ema': True, 'bull_use_atr': False, 'bull_use_adx': True, 'bull_use_spike': True, 'bull_rsi_required': False, 'bear_strategy': 'mean_reversion', 'bear_bb_std_mult': 3.2546332574549233, 'bear_rsi_os': 29, 'bear_rsi_ob': 93, 'bear_adx_thresh': 18.228125169257574, 'bear_atr_min_pct': 0.02777577453159242, 'bear_atr_max_pct': 0.08672815886262349, 'bear_tp_mult': 2.901594777807437, 'bear_tsl_mult': 0.38271696429747265, 'bear_time_stop': 143, 'bear_use_sma': False, 'bear_use_ema': False, 'bear_use_atr': True, 'bear_use_adx': True, 'bear_use_spike': False, 'bear_rsi_required': False, 'sideways_strategy': 'breakout', 'sideways_bb_std_mult': 1.4047874082106828, 'sideways_rsi_os': 19, 'sideways_rsi_ob': 66, 'sideways_adx_thresh': 22.273774405529345, 'sideways_atr_min_pct': 0.02238059600311557, 'sideways_atr_max_pct': 0.027086785869623396, 'sideways_tp_mult': 2.6275552501808375, 'sideways_tsl_mult': 0.006511518922024395, 'sideways_time_stop': 28, 'sideways_use_sma': False, 'sideways_use_ema': False, 'sideways_use_atr': True, 'sideways_use_adx': True, 'sideways_use_spike': True, 'sideways_rsi_required': False}.
