[I 2025-09-01 08:11:18,995] Trial 315 finished with values: [-1000000000.0, 1000000000.0] and parameters: {'p_sma': 20, 'p_std': 17, 'p_atr': 13, 'p_adx': 19, 'rsi_period': 18, 'ema1': 10, 'ema2': 14, 'slip_atr_k': 0.00018938758937722677, 'slip_spread_k': 0.6660972693249686, 'spread_hl_frac': 0.020643038519175393, 'bb_std_mult': 3.4102205956365896, 'rsi_os': 19, 'rsi_ob': 94, 'vol_spike': 0.2435900782078809, 'adx_thresh': 20.935443449664085, 'atr_min_pct': 0.010330693591988911, 'atr_max_pct': 0.024908904735888325, 'tp_mult': 1.1252653482185535, 'tsl_mult': 0.5160371056488555, 'strategy': 'mean_reversion', 'time_stop': 246, 'use_sma': True, 'use_atr': True, 'use_adx': True, 'use_ema': True, 'use_spike': True, 'rsi_required': False, 'edge_k': 0.9881823408688, 'edge_cap': 0.07186394115268818, 'bull_strategy': 'breakout', 'bull_bb_std_mult': 2.5291497779599994, 'bull_rsi_os': 37, 'bull_rsi_ob': 70, 'bull_adx_thresh': 25.628414600613514, 'bull_atr_min_pct': 0.028676388344640334, 'bull_atr_max_pct': 0.037558100270623354, 'bull_tp_mult': 2.6491294964108367, 'bull_tsl_mult': 0.0036653757339362714, 'bull_time_stop': 143, 'bull_use_sma': True, 'bull_use_ema': False, 'bull_use_atr': True, 'bull_use_adx': True, 'bull_use_spike': False, 'bull_rsi_required': False, 'bear_strategy': 'mean_reversion', 'bear_bb_std_mult': 3.07686891214908, 'bear_rsi_os': 26, 'bear_rsi_ob': 95, 'bear_adx_thresh': 6.093876452138142, 'bear_atr_min_pct': 0.005253712563276905, 'bear_atr_max_pct': 0.0800353284827309, 'bear_tp_mult': 2.72107633868131, 'bear_tsl_mult': 0.09342245908112667, 'bear_time_stop': 89, 'bear_use_sma': False, 'bear_use_ema': False, 'bear_use_atr': True, 'bear_use_adx': True, 'bear_use_spike': True, 'bear_rsi_required': False, 'sideways_strategy': 'mean_reversion', 'sideways_bb_std_mult': 0.9053293531255502, 'sideways_rsi_os': 41, 'sideways_rsi_ob': 59, 'sideways_adx_thresh': 8.478166724082138, 'sideways_atr_min_pct': 0.01575338680748839, 'sideways_atr_max_pct': 0.0886887552188964, 'sideways_tp_mult': 2.5279308281225794, 'sideways_tsl_mult': 0.17936206434545166, 'sideways_time_stop': 30, 'sideways_use_sma': False, 'sideways_use_ema': False, 'sideways_use_atr': False, 'sideways_use_adx': True, 'sideways_use_spike': True, 'sideways_rsi_required': False}.
[I 2025-09-01 08:11:20,447] Trial 316 finished with values: [-0.2520009217645893, 0.251861508608888] and parameters: {'p_sma': 52, 'p_std': 31, 'p_atr': 14, 'p_adx': 24, 'rsi_period': 70, 'ema1': 10, 'ema2': 14, 'slip_atr_k': 0.13390995391265145, 'slip_spread_k': 0.6673434806245275, 'spread_hl_frac': 0.02058884370169698, 'bb_std_mult': 3.5953251033811338, 'rsi_os': 24, 'rsi_ob': 60, 'vol_spike': 0.24542976704711872, 'adx_thresh': 24.643267187478823, 'atr_min_pct': 0.019411020325810668, 'atr_max_pct': 0.08810523305518608, 'tp_mult': 2.371364791447023, 'tsl_mult': 0.4564549837507734, 'strategy': 'mean_reversion', 'time_stop': 245, 'use_sma': False, 'use_atr': True, 'use_adx': True, 'use_ema': True, 'use_spike': True, 'rsi_required': False, 'edge_k': 0.9828007944679141, 'edge_cap': 0.842162527448685, 'bull_strategy': 'mean_reversion', 'bull_bb_std_mult': 0.5362115332097035, 'bull_rsi_os': 14, 'bull_rsi_ob': 70, 'bull_adx_thresh': 7.859293873388881, 'bull_atr_min_pct': 9.510185491098944e-06, 'bull_atr_max_pct': 0.03753435844971937, 'bull_tp_mult': 2.4965344399307963, 'bull_tsl_mult': 0.7434696769256794, 'bull_time_stop': 143, 'bull_use_sma': False, 'bull_use_ema': False, 'bull_use_atr': True, 'bull_use_adx': True, 'bull_use_spike': False, 'bull_rsi_required': False, 'bear_strategy': 'mean_reversion', 'bear_bb_std_mult': 0.9780537958026003, 'bear_rsi_os': 25, 'bear_rsi_ob': 95, 'bear_adx_thresh': 5.994164966024972, 'bear_atr_min_pct': 0.02278231829509526, 'bear_atr_max_pct': 0.07924882765941149, 'bear_tp_mult': 2.7297963241863217, 'bear_tsl_mult': 0.09430312153898328, 'bear_time_stop': 91, 'bear_use_sma': True, 'bear_use_ema': False, 'bear_use_atr': False, 'bear_use_adx': True, 'bear_use_spike': True, 'bear_rsi_required': True, 'sideways_strategy': 'mean_reversion', 'sideways_bb_std_mult': 0.705860012481553, 'sideways_rsi_os': 19, 'sideways_rsi_ob': 60, 'sideways_adx_thresh': 23.80110395294669, 'sideways_atr_min_pct': 0.0025997946335094297, 'sideways_atr_max_pct': 0.022446276454735063, 'sideways_tp_mult': 2.4950056910979765, 'sideways_tsl_mult': 0.14583827801882332, 'sideways_time_stop': 237, 'sideways_use_sma': False, 'sideways_use_ema': False, 'sideways_use_atr': False, 'sideways_use_adx': True, 'sideways_use_spike': True, 'sideways_rsi_required': True}.
[I 2025-09-01 08:11:20,999] Trial 318 finished with values: [-0.1373892883644534, 0.13720120046413037] and parameters: {'p_sma': 52, 'p_std': 17, 'p_atr': 14, 'p_adx': 19, 'rsi_period': 72, 'ema1': 25, 'ema2': 57, 'slip_atr_k': 0.05739721476474866, 'slip_spread_k': 0.6669723500065582, 'spread_hl_frac': 0.04331991139349942, 'bb_std_mult': 2.892121431880489, 'rsi_os': 11, 'rsi_ob': 56, 'vol_spike': 0.24421028539280293, 'adx_thresh': 34.421119464230166, 'atr_min_pct': 0.01033162923566031, 'atr_max_pct': 0.14732461444509973, 'tp_mult': 1.1366162657318297, 'tsl_mult': 0.5114071092004333, 'strategy': 'mean_reversion', 'time_stop': 250, 'use_sma': False, 'use_atr': True, 'use_adx': True, 'use_ema': True, 'use_spike': True, 'rsi_required': False, 'edge_k': 0.9882476956305617, 'edge_cap': 0.14334663275966392, 'bull_strategy': 'mean_reversion', 'bull_bb_std_mult': 2.079212765988829, 'bull_rsi_os': 14, 'bull_rsi_ob': 71, 'bull_adx_thresh': 34.980841047208244, 'bull_atr_min_pct': 0.0010788295992685526, 'bull_atr_max_pct': 0.041975029055788246, 'bull_tp_mult': 2.9399369113297293, 'bull_tsl_mult': 0.7410986134407567, 'bull_time_stop': 149, 'bull_use_sma': False, 'bull_use_ema': False, 'bull_use_atr': True, 'bull_use_adx': True, 'bull_use_spike': False, 'bull_rsi_required': False, 'bear_strategy': 'mean_reversion', 'bear_bb_std_mult': 3.0748210492110513, 'bear_rsi_os': 27, 'bear_rsi_ob': 49, 'bear_adx_thresh': 5.918810232482446, 'bear_atr_min_pct': 0.023093753446052974, 'bear_atr_max_pct': 0.08204954162575132, 'bear_tp_mult': 1.1098248011325649, 'bear_tsl_mult': 0.9764773279995973, 'bear_time_stop': 106, 'bear_use_sma': True, 'bear_use_ema': False, 'bear_use_atr': False, 'bear_use_adx': True, 'bear_use_spike': True, 'bear_rsi_required': True, 'sideways_strategy': 'mean_reversion', 'sideways_bb_std_mult': 3.511449561147626, 'sideways_rsi_os': 41, 'sideways_rsi_ob': 83, 'sideways_adx_thresh': 5.7381799743178075, 'sideways_atr_min_pct': 0.015994489526922468, 'sideways_atr_max_pct': 0.07955704830526153, 'sideways_tp_mult': 2.4905614581602253, 'sideways_tsl_mult': 0.14809848007042845, 'sideways_time_stop': 5, 'sideways_use_sma': True, 'sideways_use_ema': False, 'sideways_use_atr': False, 'sideways_use_adx': True, 'sideways_use_spike': True, 'sideways_rsi_required': True}.
[I 2025-09-01 08:11:21,321] Trial 317 finished with values: [-0.09263741989464525, 0.09241444845686117] and parameters: {'p_sma': 38, 'p_std': 48, 'p_atr': 14, 'p_adx': 21, 'rsi_period': 84, 'ema1': 29, 'ema2': 14, 'slip_atr_k': 0.05779666981783307, 'slip_spread_k': 0.9558380872354875, 'spread_hl_frac': 0.02579480440522918, 'bb_std_mult': 3.38817385626226, 'rsi_os': 8, 'rsi_ob': 56, 'vol_spike': 0.1777718071600233, 'adx_thresh': 25.06216926209627, 'atr_min_pct': 0.02025168674534714, 'atr_max_pct': 0.04626058193166911, 'tp_mult': 1.1363672919978978, 'tsl_mult': 0.5124817247871326, 'strategy': 'mean_reversion', 'time_stop': 250, 'use_sma': False, 'use_atr': True, 'use_adx': True, 'use_ema': True, 'use_spike': True, 'rsi_required': False, 'edge_k': 0.9792045190779847, 'edge_cap': 0.8067195528380618, 'bull_strategy': 'mean_reversion', 'bull_bb_std_mult': 1.5963716353787114, 'bull_rsi_os': 45, 'bull_rsi_ob': 70, 'bull_adx_thresh': 8.12685960873341, 'bull_atr_min_pct': 0.0014603640846474059, 'bull_atr_max_pct': 0.1359489275049081, 'bull_tp_mult': 2.6515621042519575, 'bull_tsl_mult': 0.7489434846619896, 'bull_time_stop': 144, 'bull_use_sma': False, 'bull_use_ema': False, 'bull_use_atr': True, 'bull_use_adx': True, 'bull_use_spike': False, 'bull_rsi_required': False, 'bear_strategy': 'mean_reversion', 'bear_bb_std_mult': 2.794872279993596, 'bear_rsi_os': 25, 'bear_rsi_ob': 95, 'bear_adx_thresh': 33.456929936114406, 'bear_atr_min_pct': 0.022671665488860408, 'bear_atr_max_pct': 0.14999896111015493, 'bear_tp_mult': 2.9579299158102286, 'bear_tsl_mult': 0.1621806374002997, 'bear_time_stop': 215, 'bear_use_sma': True, 'bear_use_ema': False, 'bear_use_atr': False, 'bear_use_adx': True, 'bear_use_spike': True, 'bear_rsi_required': True, 'sideways_strategy': 'mean_reversion', 'sideways_bb_std_mult': 1.4727440426429874, 'sideways_rsi_os': 6, 'sideways_rsi_ob': 82, 'sideways_adx_thresh': 16.061224179581437, 'sideways_atr_min_pct': 0.02241838417821532, 'sideways_atr_max_pct': 0.03952482980750774, 'sideways_tp_mult': 1.9181669404541135, 'sideways_tsl_mult': 0.1521321902470921, 'sideways_time_stop': 291, 'sideways_use_sma': False, 'sideways_use_ema': False, 'sideways_use_atr': False, 'sideways_use_adx': True, 'sideways_use_spike': True, 'sideways_rsi_required': True}.
[I 2025-09-01 08:12:01,158] Trial 320 finished with values: [-0.13110341632531308, 0.13248873423307223] and parameters: {'p_sma': 43, 'p_std': 11, 'p_atr': 17, 'p_adx': 21, 'rsi_period': 61, 'ema1': 27, 'ema2': 21, 'slip_atr_k': 0.17781223633534649, 'slip_spread_k': 0.06795699938778466, 'spread_hl_frac': 0.03321091415035245, 'bb_std_mult': 3.3571189738807155, 'rsi_os': 26, 'rsi_ob': 55, 'vol_spike': 0.12450659072384299, 'adx_thresh': 34.27894065976396, 'atr_min_pct': 0.0285405231229636, 'atr_max_pct': 0.14743617266634992, 'tp_mult': 2.9317760791271334, 'tsl_mult': 0.5877284599022807, 'strategy': 'breakout', 'time_stop': 200, 'use_sma': True, 'use_atr': True, 'use_adx': True, 'use_ema': True, 'use_spike': True, 'rsi_required': True, 'edge_k': 1.091984743040517, 'edge_cap': 0.2874729968447377, 'bull_strategy': 'breakout', 'bull_bb_std_mult': 2.9046346403400296, 'bull_rsi_os': 52, 'bull_rsi_ob': 81, 'bull_adx_thresh': 10.475125316797419, 'bull_atr_min_pct': 0.002015466521395358, 'bull_atr_max_pct': 0.13667922472877897, 'bull_tp_mult': 1.989496428605192, 'bull_tsl_mult': 0.6475411172163423, 'bull_time_stop': 151, 'bull_use_sma': False, 'bull_use_ema': False, 'bull_use_atr': False, 'bull_use_adx': True, 'bull_use_spike': True, 'bull_rsi_required': False, 'bear_strategy': 'mean_reversion', 'bear_bb_std_mult': 2.9013383494597376, 'bear_rsi_os': 27, 'bear_rsi_ob': 92, 'bear_adx_thresh': 18.917242350513245, 'bear_atr_min_pct': 0.010780080046912156, 'bear_atr_max_pct': 0.07331346074980503, 'bear_tp_mult': 2.9702224895906126, 'bear_tsl_mult': 0.9678870470560813, 'bear_time_stop': 187, 'bear_use_sma': True, 'bear_use_ema': False, 'bear_use_atr': False, 'bear_use_adx': False, 'bear_use_spike': True, 'bear_rsi_required': True, 'sideways_strategy': 'mean_reversion', 'sideways_bb_std_mult': 0.6370005605983833, 'sideways_rsi_os': 43, 'sideways_rsi_ob': 82, 'sideways_adx_thresh': 9.443157570991863, 'sideways_atr_min_pct': 0.021039830245374706, 'sideways_atr_max_pct': 0.038969580051777614, 'sideways_tp_mult': 2.5825850227698366, 'sideways_tsl_mult': 0.6477979142620645, 'sideways_time_stop': 208, 'sideways_use_sma': True, 'sideways_use_ema': False, 'sideways_use_atr': False, 'sideways_use_adx': True, 'sideways_use_spike': False, 'sideways_rsi_required': True}.
[I 2025-09-01 08:12:01,770] Trial 319 finished with values: [-0.13514972576155693, 0.13487665632906531] and parameters: {'p_sma': 22, 'p_std': 17, 'p_atr': 28, 'p_adx': 8, 'rsi_period': 65, 'ema1': 27, 'ema2': 57, 'slip_atr_k': 0.1766476311694023, 'slip_spread_k': 0.065648001562428, 'spread_hl_frac': 0.0258521307717508, 'bb_std_mult': 3.594410909495655, 'rsi_os': 24, 'rsi_ob': 56, 'vol_spike': 0.23616201976410783, 'adx_thresh': 24.726246289593774, 'atr_min_pct': 0.019288486144258002, 'atr_max_pct': 0.14732660400763184, 'tp_mult': 2.9272967992628516, 'tsl_mult': 0.5897172863206881, 'strategy': 'mean_reversion', 'time_stop': 158, 'use_sma': False, 'use_atr': True, 'use_adx': True, 'use_ema': True, 'use_spike': True, 'rsi_required': True, 'edge_k': 1.3416721374406593, 'edge_cap': 0.14327883250824203, 'bull_strategy': 'mean_reversion', 'bull_bb_std_mult': 2.838985838959476, 'bull_rsi_os': 52, 'bull_rsi_ob': 50, 'bull_adx_thresh': 14.54245553152807, 'bull_atr_min_pct': 0.0020173520163786606, 'bull_atr_max_pct': 0.06935021475952514, 'bull_tp_mult': 2.5091064030600005, 'bull_tsl_mult': 0.7468000871039606, 'bull_time_stop': 149, 'bull_use_sma': False, 'bull_use_ema': False, 'bull_use_atr': False, 'bull_use_adx': True, 'bull_use_spike': True, 'bull_rsi_required': False, 'bear_strategy': 'mean_reversion', 'bear_bb_std_mult': 1.225688810794903, 'bear_rsi_os': 6, 'bear_rsi_ob': 92, 'bear_adx_thresh': 33.384230312067565, 'bear_atr_min_pct': 0.022744171058646064, 'bear_atr_max_pct': 0.08217117185232022, 'bear_tp_mult': 2.000897465486745, 'bear_tsl_mult': 0.8297327510463828, 'bear_time_stop': 251, 'bear_use_sma': True, 'bear_use_ema': False, 'bear_use_atr': False, 'bear_use_adx': True, 'bear_use_spike': True, 'bear_rsi_required': True, 'sideways_strategy': 'mean_reversion', 'sideways_bb_std_mult': 0.6954738907285127, 'sideways_rsi_os': 49, 'sideways_rsi_ob': 70, 'sideways_adx_thresh': 16.56455542096872, 'sideways_atr_min_pct': 0.020919327022965856, 'sideways_atr_max_pct': 0.0789938269460781, 'sideways_tp_mult': 2.5837141373483203, 'sideways_tsl_mult': 0.15525072356992178, 'sideways_time_stop': 10, 'sideways_use_sma': True, 'sideways_use_ema': False, 'sideways_use_atr': False, 'sideways_use_adx': True, 'sideways_use_spike': True, 'sideways_rsi_required': True}.
[I 2025-09-01 08:12:02,333] Trial 322 finished with values: [-1000000000.0, 1000000000.0] and parameters: {'p_sma': 23, 'p_std': 16, 'p_atr': 17, 'p_adx': 13, 'rsi_period': 66, 'ema1': 11, 'ema2': 10, 'slip_atr_k': 0.06517887746186109, 'slip_spread_k': 0.6220140113711962, 'spread_hl_frac': 0.025199341677824727, 'bb_std_mult': 3.2630382031128167, 'rsi_os': 26, 'rsi_ob': 53, 'vol_spike': 0.23832019223811834, 'adx_thresh': 23.94974301757777, 'atr_min_pct': 0.008561365887294812, 'atr_max_pct': 0.1499325947721126, 'tp_mult': 1.2789143586953002, 'tsl_mult': 0.2945751782928187, 'strategy': 'breakout', 'time_stop': 237, 'use_sma': True, 'use_atr': True, 'use_adx': True, 'use_ema': False, 'use_spike': True, 'rsi_required': True, 'edge_k': 0.3713625134823463, 'edge_cap': 0.4018573568055535, 'bull_strategy': 'breakout', 'bull_bb_std_mult': 3.1108473261086806, 'bull_rsi_os': 15, 'bull_rsi_ob': 56, 'bull_adx_thresh': 6.2592694986044055, 'bull_atr_min_pct': 0.015311891944705721, 'bull_atr_max_pct': 0.028529847287144576, 'bull_tp_mult': 2.3815375269783003, 'bull_tsl_mult': 0.29863184794977315, 'bull_time_stop': 164, 'bull_use_sma': True, 'bull_use_ema': False, 'bull_use_atr': False, 'bull_use_adx': False, 'bull_use_spike': True, 'bull_rsi_required': False, 'bear_strategy': 'breakout', 'bear_bb_std_mult': 3.286099349024968, 'bear_rsi_os': 24, 'bear_rsi_ob': 92, 'bear_adx_thresh': 20.008978541404908, 'bear_atr_min_pct': 0.02377670705672659, 'bear_atr_max_pct': 0.07420294700863121, 'bear_tp_mult': 2.808133862420379, 'bear_tsl_mult': 0.2938906661002603, 'bear_time_stop': 97, 'bear_use_sma': False, 'bear_use_ema': False, 'bear_use_atr': True, 'bear_use_adx': False, 'bear_use_spike': True, 'bear_rsi_required': False, 'sideways_strategy': 'breakout', 'sideways_bb_std_mult': 0.6326186471966536, 'sideways_rsi_os': 47, 'sideways_rsi_ob': 51, 'sideways_adx_thresh': 7.6910368633273345, 'sideways_atr_min_pct': 0.021013768665154378, 'sideways_atr_max_pct': 0.06766897111575713, 'sideways_tp_mult': 2.0364813167161615, 'sideways_tsl_mult': 0.660933248497167, 'sideways_time_stop': 23, 'sideways_use_sma': True, 'sideways_use_ema': True, 'sideways_use_atr': True, 'sideways_use_adx': True, 'sideways_use_spike': False, 'sideways_rsi_required': False}.
[I 2025-09-01 08:12:02,531] Trial 321 finished with values: [-0.112694764222527, 0.11408391410055785] and parameters: {'p_sma': 38, 'p_std': 11, 'p_atr': 28, 'p_adx': 8, 'rsi_period': 84, 'ema1': 30, 'ema2': 23, 'slip_atr_k': 0.0659257208755164, 'slip_spread_k': 0.06377847770443051, 'spread_hl_frac': 0.02583953435545791, 'bb_std_mult': 3.346756258818034, 'rsi_os': 46, 'rsi_ob': 53, 'vol_spike': 0.23466574741450422, 'adx_thresh': 23.88932753700547, 'atr_min_pct': 0.02010280358851518, 'atr_max_pct': 0.14722394869897162, 'tp_mult': 1.2705702612293928, 'tsl_mult': 0.5816311585887105, 'strategy': 'breakout', 'time_stop': 159, 'use_sma': True, 'use_atr': True, 'use_adx': True, 'use_ema': True, 'use_spike': True, 'rsi_required': True, 'edge_k': 0.008122271308411366, 'edge_cap': 0.7959781027493072, 'bull_strategy': 'breakout', 'bull_bb_std_mult': 0.7596950162405605, 'bull_rsi_os': 15, 'bull_rsi_ob': 94, 'bull_adx_thresh': 19.159058693202763, 'bull_atr_min_pct': 0.0019658541338971013, 'bull_atr_max_pct': 0.046096973696438406, 'bull_tp_mult': 2.4097982952995567, 'bull_tsl_mult': 0.2995000670702659, 'bull_time_stop': 164, 'bull_use_sma': True, 'bull_use_ema': False, 'bull_use_atr': False, 'bull_use_adx': False, 'bull_use_spike': True, 'bull_rsi_required': False, 'bear_strategy': 'mean_reversion', 'bear_bb_std_mult': 2.7037433903802337, 'bear_rsi_os': 37, 'bear_rsi_ob': 93, 'bear_adx_thresh': 18.966764418378563, 'bear_atr_min_pct': 0.029491303378475817, 'bear_atr_max_pct': 0.10558822821851085, 'bear_tp_mult': 2.811625129446283, 'bear_tsl_mult': 0.15969778115808153, 'bear_time_stop': 218, 'bear_use_sma': False, 'bear_use_ema': False, 'bear_use_atr': True, 'bear_use_adx': False, 'bear_use_spike': True, 'bear_rsi_required': False, 'sideways_strategy': 'mean_reversion', 'sideways_bb_std_mult': 0.6382032882540395, 'sideways_rsi_os': 37, 'sideways_rsi_ob': 70, 'sideways_adx_thresh': 14.380608950669954, 'sideways_atr_min_pct': 0.02015506017567285, 'sideways_atr_max_pct': 0.05516439020009684, 'sideways_tp_mult': 2.5894441910564403, 'sideways_tsl_mult': 0.16333432647046564, 'sideways_time_stop': 291, 'sideways_use_sma': True, 'sideways_use_ema': True, 'sideways_use_atr': False, 'sideways_use_adx': True, 'sideways_use_spike': False, 'sideways_rsi_required': False}.
[I 2025-09-01 08:12:52,966] Trial 324 finished with values: [-1000000000.0, 1000000000.0] and parameters: {'p_sma': 26, 'p_std': 33, 'p_atr': 15, 'p_adx': 18, 'rsi_period': 66, 'ema1': 11, 'ema2': 13, 'slip_atr_k': 0.06823195624743483, 'slip_spread_k': 0.4868055419091179, 'spread_hl_frac': 0.024845319239446106, 'bb_std_mult': 1.6168439142754805, 'rsi_os': 22, 'rsi_ob': 53, 'vol_spike': 0.22235238086256637, 'adx_thresh': 23.605983503095295, 'atr_min_pct': 0.020898603150184658, 'atr_max_pct': 0.14503800243303097, 'tp_mult': 1.2708500164351146, 'tsl_mult': 0.30312872145264735, 'strategy': 'breakout', 'time_stop': 253, 'use_sma': True, 'use_atr': True, 'use_adx': True, 'use_ema': False, 'use_spike': False, 'rsi_required': True, 'edge_k': 0.8135606081874969, 'edge_cap': 0.6048459378309319, 'bull_strategy': 'breakout', 'bull_bb_std_mult': 0.7702773196232116, 'bull_rsi_os': 11, 'bull_rsi_ob': 45, 'bull_adx_thresh': 5.954443465445662, 'bull_atr_min_pct': 0.007257229072508118, 'bull_atr_max_pct': 0.04597270123180374, 'bull_tp_mult': 2.393191581978698, 'bull_tsl_mult': 0.6260106992140098, 'bull_time_stop': 178, 'bull_use_sma': True, 'bull_use_ema': False, 'bull_use_atr': False, 'bull_use_adx': False, 'bull_use_spike': True, 'bull_rsi_required': False, 'bear_strategy': 'breakout', 'bear_bb_std_mult': 3.1477305658268007, 'bear_rsi_os': 24, 'bear_rsi_ob': 87, 'bear_adx_thresh': 10.502120109195197, 'bear_atr_min_pct': 0.023878210662647142, 'bear_atr_max_pct': 0.11844341736628262, 'bear_tp_mult': 2.282569496421477, 'bear_tsl_mult': 0.2598883539050838, 'bear_time_stop': 100, 'bear_use_sma': False, 'bear_use_ema': True, 'bear_use_atr': True, 'bear_use_adx': False, 'bear_use_spike': True, 'bear_rsi_required': False, 'sideways_strategy': 'breakout', 'sideways_bb_std_mult': 2.676685830696894, 'sideways_rsi_os': 13, 'sideways_rsi_ob': 85, 'sideways_adx_thresh': 8.076224252319143, 'sideways_atr_min_pct': 0.024832342302491532, 'sideways_atr_max_pct': 0.0556078571533666, 'sideways_tp_mult': 2.719802911339815, 'sideways_tsl_mult': 0.12166945933098086, 'sideways_time_stop': 271, 'sideways_use_sma': False, 'sideways_use_ema': True, 'sideways_use_atr': True, 'sideways_use_adx': False, 'sideways_use_spike': False, 'sideways_rsi_required': False}.
