[I 2025-09-01 07:31:55,834] Trial 71 finished with values: [-1000000000.0, 1000000000.0] and parameters: {'p_sma': 24, 'p_std': 40, 'p_atr': 30, 'p_adx': 8, 'rsi_period': 49, 'ema1': 6, 'ema2': 14, 'slip_atr_k': 0.18774548369990968, 'slip_spread_k': 0.3712373697169563, 'spread_hl_frac': 0.04026404937799872, 'bb_std_mult': 2.321236077702469, 'rsi_os': 8, 'rsi_ob': 80, 'vol_spike': 0.08810940592434954, 'adx_thresh': 15.957230636448745, 'atr_min_pct': 0.017086197011552617, 'atr_max_pct': 0.13677396380564721, 'tp_mult': 1.3460684482193868, 'tsl_mult': 0.7107503167102431, 'strategy': 'breakout', 'time_stop': 135, 'use_sma': False, 'use_atr': True, 'use_adx': True, 'use_ema': True, 'use_spike': False, 'rsi_required': True, 'edge_k': 1.000013978938814, 'edge_cap': 0.8470093635866933, 'bull_strategy': 'breakout', 'bull_bb_std_mult': 1.5781355073294845, 'bull_rsi_os': 44, 'bull_rsi_ob': 89, 'bull_adx_thresh': 13.278446221827325, 'bull_atr_min_pct': 0.01736751090619613, 'bull_atr_max_pct': 0.020636242316193636, 'bull_tp_mult': 2.135852681861387, 'bull_tsl_mult': 0.4040551080605892, 'bull_time_stop': 198, 'bull_use_sma': False, 'bull_use_ema': False, 'bull_use_atr': False, 'bull_use_adx': False, 'bull_use_spike': True, 'bull_rsi_required': True, 'bear_strategy': 'breakout', 'bear_bb_std_mult': 2.0868001212001586, 'bear_rsi_os': 30, 'bear_rsi_ob': 45, 'bear_adx_thresh': 12.976425659037082, 'bear_atr_min_pct': 0.02231682785781373, 'bear_atr_max_pct': 0.09730676647163342, 'bear_tp_mult': 1.563424855383448, 'bear_tsl_mult': 0.6905873752719641, 'bear_time_stop': 244, 'bear_use_sma': False, 'bear_use_ema': True, 'bear_use_atr': False, 'bear_use_adx': False, 'bear_use_spike': True, 'bear_rsi_required': True, 'sideways_strategy': 'breakout', 'sideways_bb_std_mult': 1.8501934729482428, 'sideways_rsi_os': 5, 'sideways_rsi_ob': 92, 'sideways_adx_thresh': 24.727827012378636, 'sideways_atr_min_pct': 0.014879849712907404, 'sideways_atr_max_pct': 0.12861048427798538, 'sideways_tp_mult': 2.849093900476315, 'sideways_tsl_mult': 0.6964265927991599, 'sideways_time_stop': 155, 'sideways_use_sma': True, 'sideways_use_ema': False, 'sideways_use_atr': True, 'sideways_use_adx': True, 'sideways_use_spike': False, 'sideways_rsi_required': True}.
[I 2025-09-01 07:31:56,471] Trial 73 finished with values: [-1000000000.0, 1000000000.0] and parameters: {'p_sma': 45, 'p_std': 13, 'p_atr': 17, 'p_adx': 11, 'rsi_period': 43, 'ema1': 13, 'ema2': 58, 'slip_atr_k': 0.17910613938076553, 'slip_spread_k': 0.38153730183835327, 'spread_hl_frac': 0.040584093048663145, 'bb_std_mult': 2.054047794241163, 'rsi_os': 26, 'rsi_ob': 69, 'vol_spike': 0.09379840562644376, 'adx_thresh': 10.241813804695566, 'atr_min_pct': 0.01993511549375872, 'atr_max_pct': 0.13694246561840284, 'tp_mult': 2.2866412830229494, 'tsl_mult': 0.7055577628391629, 'strategy': 'mean_reversion', 'time_stop': 139, 'use_sma': True, 'use_atr': False, 'use_adx': True, 'use_ema': True, 'use_spike': False, 'rsi_required': True, 'edge_k': 0.8122126593028025, 'edge_cap': 0.6916075308208227, 'bull_strategy': 'breakout', 'bull_bb_std_mult': 3.5940290238843566, 'bull_rsi_os': 24, 'bull_rsi_ob': 88, 'bull_adx_thresh': 17.769219811857667, 'bull_atr_min_pct': 0.017188325431032422, 'bull_atr_max_pct': 0.019275234598388223, 'bull_tp_mult': 2.228057336513997, 'bull_tsl_mult': 0.914980955463113, 'bull_time_stop': 154, 'bull_use_sma': True, 'bull_use_ema': True, 'bull_use_atr': False, 'bull_use_adx': False, 'bull_use_spike': True, 'bull_rsi_required': False, 'bear_strategy': 'breakout', 'bear_bb_std_mult': 2.119981956324898, 'bear_rsi_os': 44, 'bear_rsi_ob': 93, 'bear_adx_thresh': 12.7100072646417, 'bear_atr_min_pct': 0.020327461317297218, 'bear_atr_max_pct': 0.028324863314768724, 'bear_tp_mult': 2.6286205635961415, 'bear_tsl_mult': 0.8483535549237127, 'bear_time_stop': 212, 'bear_use_sma': True, 'bear_use_ema': True, 'bear_use_atr': True, 'bear_use_adx': False, 'bear_use_spike': True, 'bear_rsi_required': True, 'sideways_strategy': 'mean_reversion', 'sideways_bb_std_mult': 1.500686948957309, 'sideways_rsi_os': 11, 'sideways_rsi_ob': 84, 'sideways_adx_thresh': 14.648586798956432, 'sideways_atr_min_pct': 0.015130660346723392, 'sideways_atr_max_pct': 0.11783092822555938, 'sideways_tp_mult': 2.8953326038414744, 'sideways_tsl_mult': 0.6911129228520912, 'sideways_time_stop': 117, 'sideways_use_sma': False, 'sideways_use_ema': False, 'sideways_use_atr': False, 'sideways_use_adx': True, 'sideways_use_spike': False, 'sideways_rsi_required': True}.
[I 2025-09-01 07:32:26,526] Trial 74 finished with values: [-1000000000.0, 1000000000.0] and parameters: {'p_sma': 24, 'p_std': 58, 'p_atr': 28, 'p_adx': 11, 'rsi_period': 45, 'ema1': 15, 'ema2': 14, 'slip_atr_k': 0.18572453111225867, 'slip_spread_k': 0.6447850364371956, 'spread_hl_frac': 0.045638627326431244, 'bb_std_mult': 2.3805415257340243, 'rsi_os': 25, 'rsi_ob': 55, 'vol_spike': 0.07360085898402739, 'adx_thresh': 10.447797806204118, 'atr_min_pct': 0.02519812805142955, 'atr_max_pct': 0.13676887375330973, 'tp_mult': 1.2004655653519616, 'tsl_mult': 0.10597220196387404, 'strategy': 'mean_reversion', 'time_stop': 135, 'use_sma': True, 'use_atr': False, 'use_adx': True, 'use_ema': True, 'use_spike': False, 'rsi_required': True, 'edge_k': 0.9890041740447302, 'edge_cap': 0.6508611152456565, 'bull_strategy': 'breakout', 'bull_bb_std_mult': 1.556153209239998, 'bull_rsi_os': 20, 'bull_rsi_ob': 88, 'bull_adx_thresh': 17.688455750183167, 'bull_atr_min_pct': 0.0035670608803496416, 'bull_atr_max_pct': 0.10918584860068431, 'bull_tp_mult': 2.48565569025479, 'bull_tsl_mult': 0.9218572804307594, 'bull_time_stop': 181, 'bull_use_sma': True, 'bull_use_ema': True, 'bull_use_atr': False, 'bull_use_adx': False, 'bull_use_spike': True, 'bull_rsi_required': False, 'bear_strategy': 'breakout', 'bear_bb_std_mult': 2.6636842161165086, 'bear_rsi_os': 44, 'bear_rsi_ob': 94, 'bear_adx_thresh': 10.883930006105134, 'bear_atr_min_pct': 0.00869092534833225, 'bear_atr_max_pct': 0.03969007105878505, 'bear_tp_mult': 2.634402704950502, 'bear_tsl_mult': 0.4848912540966506, 'bear_time_stop': 82, 'bear_use_sma': True, 'bear_use_ema': True, 'bear_use_atr': True, 'bear_use_adx': False, 'bear_use_spike': True, 'bear_rsi_required': True, 'sideways_strategy': 'mean_reversion', 'sideways_bb_std_mult': 3.1157805469030473, 'sideways_rsi_os': 27, 'sideways_rsi_ob': 66, 'sideways_adx_thresh': 6.884050422754905, 'sideways_atr_min_pct': 0.029193093354923105, 'sideways_atr_max_pct': 0.072771276202125, 'sideways_tp_mult': 2.256463533098191, 'sideways_tsl_mult': 0.31378660817924875, 'sideways_time_stop': 117, 'sideways_use_sma': False, 'sideways_use_ema': False, 'sideways_use_atr': False, 'sideways_use_adx': True, 'sideways_use_spike': False, 'sideways_rsi_required': True}.
[I 2025-09-01 07:32:37,889] Trial 75 finished with values: [-0.035633588483363954, 0.03519025117394373] and parameters: {'p_sma': 56, 'p_std': 58, 'p_atr': 28, 'p_adx': 11, 'rsi_period': 69, 'ema1': 7, 'ema2': 14, 'slip_atr_k': 0.03474555376469012, 'slip_spread_k': 0.6969432622886947, 'spread_hl_frac': 0.03635379217156216, 'bb_std_mult': 2.3679644581979407, 'rsi_os': 26, 'rsi_ob': 68, 'vol_spike': 0.11432793695242888, 'adx_thresh': 22.42872889054362, 'atr_min_pct': 0.011998598818844073, 'atr_max_pct': 0.13616096738093442, 'tp_mult': 1.1166276064423308, 'tsl_mult': 0.09606263695717798, 'strategy': 'mean_reversion', 'time_stop': 136, 'use_sma': True, 'use_atr': False, 'use_adx': True, 'use_ema': True, 'use_spike': False, 'rsi_required': True, 'edge_k': 1.2304863848147396, 'edge_cap': 0.3073195000809575, 'bull_strategy': 'breakout', 'bull_bb_std_mult': 1.6158933365237498, 'bull_rsi_os': 19, 'bull_rsi_ob': 79, 'bull_adx_thresh': 15.828210752701525, 'bull_atr_min_pct': 0.002796399266515147, 'bull_atr_max_pct': 0.10325330162697503, 'bull_tp_mult': 2.488589377554168, 'bull_tsl_mult': 0.25362491817430133, 'bull_time_stop': 247, 'bull_use_sma': True, 'bull_use_ema': True, 'bull_use_atr': False, 'bull_use_adx': False, 'bull_use_spike': True, 'bull_rsi_required': False, 'bear_strategy': 'breakout', 'bear_bb_std_mult': 2.724288041811485, 'bear_rsi_os': 28, 'bear_rsi_ob': 74, 'bear_adx_thresh': 10.8558052493741, 'bear_atr_min_pct': 0.008190635489509018, 'bear_atr_max_pct': 0.0409612633688747, 'bear_tp_mult': 2.6151169936518093, 'bear_tsl_mult': 0.48298935383485087, 'bear_time_stop': 213, 'bear_use_sma': True, 'bear_use_ema': True, 'bear_use_atr': True, 'bear_use_adx': False, 'bear_use_spike': True, 'bear_rsi_required': True, 'sideways_strategy': 'mean_reversion', 'sideways_bb_std_mult': 1.671334384707255, 'sideways_rsi_os': 11, 'sideways_rsi_ob': 45, 'sideways_adx_thresh': 18.87352944160632, 'sideways_atr_min_pct': 0.028738066534063567, 'sideways_atr_max_pct': 0.07153289705402016, 'sideways_tp_mult': 2.267162383297023, 'sideways_tsl_mult': 0.691598737326682, 'sideways_time_stop': 116, 'sideways_use_sma': False, 'sideways_use_ema': False, 'sideways_use_atr': False, 'sideways_use_adx': True, 'sideways_use_spike': True, 'sideways_rsi_required': True}.
[I 2025-09-01 07:32:38,912] Trial 76 finished with values: [-1000000000.0, 1000000000.0] and parameters: {'p_sma': 56, 'p_std': 28, 'p_atr': 18, 'p_adx': 11, 'rsi_period': 57, 'ema1': 29, 'ema2': 55, 'slip_atr_k': 0.014558636336092463, 'slip_spread_k': 0.8059015075247852, 'spread_hl_frac': 0.01660975116090932, 'bb_std_mult': 2.4330524408686847, 'rsi_os': 26, 'rsi_ob': 66, 'vol_spike': 0.11180532782155259, 'adx_thresh': 15.038791298309613, 'atr_min_pct': 0.01141303266679527, 'atr_max_pct': 0.12025227762933693, 'tp_mult': 1.958472982694534, 'tsl_mult': 0.09391258022090732, 'strategy': 'mean_reversion', 'time_stop': 287, 'use_sma': True, 'use_atr': False, 'use_adx': True, 'use_ema': True, 'use_spike': False, 'rsi_required': True, 'edge_k': 0.8147335166028368, 'edge_cap': 0.6613052149235387, 'bull_strategy': 'breakout', 'bull_bb_std_mult': 1.5496228094024274, 'bull_rsi_os': 22, 'bull_rsi_ob': 73, 'bull_adx_thresh': 16.14470835654398, 'bull_atr_min_pct': 0.004154757933181884, 'bull_atr_max_pct': 0.11042769003335288, 'bull_tp_mult': 2.2379230667210135, 'bull_tsl_mult': 0.48120993238117227, 'bull_time_stop': 180, 'bull_use_sma': True, 'bull_use_ema': True, 'bull_use_atr': False, 'bull_use_adx': False, 'bull_use_spike': True, 'bull_rsi_required': False, 'bear_strategy': 'breakout', 'bear_bb_std_mult': 2.7090539112193612, 'bear_rsi_os': 43, 'bear_rsi_ob': 92, 'bear_adx_thresh': 31.44520595259658, 'bear_atr_min_pct': 0.008280097248904699, 'bear_atr_max_pct': 0.030079208544855192, 'bear_tp_mult': 2.169708994846512, 'bear_tsl_mult': 0.8620606136545079, 'bear_time_stop': 224, 'bear_use_sma': True, 'bear_use_ema': False, 'bear_use_atr': True, 'bear_use_adx': False, 'bear_use_spike': False, 'bear_rsi_required': True, 'sideways_strategy': 'mean_reversion', 'sideways_bb_std_mult': 1.6461967323952578, 'sideways_rsi_os': 12, 'sideways_rsi_ob': 54, 'sideways_adx_thresh': 18.782257183727395, 'sideways_atr_min_pct': 0.028646596720513836, 'sideways_atr_max_pct': 0.07610827210219007, 'sideways_tp_mult': 2.26050958509644, 'sideways_tsl_mult': 0.8903238809797592, 'sideways_time_stop': 121, 'sideways_use_sma': False, 'sideways_use_ema': False, 'sideways_use_atr': False, 'sideways_use_adx': False, 'sideways_use_spike': True, 'sideways_rsi_required': False}.
[I 2025-09-01 07:32:39,429] Trial 77 finished with values: [-1000000000.0, 1000000000.0] and parameters: {'p_sma': 56, 'p_std': 27, 'p_atr': 28, 'p_adx': 27, 'rsi_period': 57, 'ema1': 15, 'ema2': 14, 'slip_atr_k': 0.1678914128902292, 'slip_spread_k': 0.7997164165663484, 'spread_hl_frac': 0.03617440604222932, 'bb_std_mult': 2.3690470908149788, 'rsi_os': 42, 'rsi_ob': 66, 'vol_spike': 0.11031393224435657, 'adx_thresh': 14.368970198924242, 'atr_min_pct': 0.01179409871471857, 'atr_max_pct': 0.11959344962702428, 'tp_mult': 1.101924673511192, 'tsl_mult': 0.10145845585226493, 'strategy': 'mean_reversion', 'time_stop': 298, 'use_sma': True, 'use_atr': False, 'use_adx': True, 'use_ema': True, 'use_spike': False, 'rsi_required': True, 'edge_k': 1.222168833290598, 'edge_cap': 0.6459821590799992, 'bull_strategy': 'mean_reversion', 'bull_bb_std_mult': 1.5616573272645384, 'bull_rsi_os': 19, 'bull_rsi_ob': 79, 'bull_adx_thresh': 21.41324138895998, 'bull_atr_min_pct': 0.003550233981524648, 'bull_atr_max_pct': 0.07161372638647809, 'bull_tp_mult': 2.477277279094489, 'bull_tsl_mult': 0.26002251515940233, 'bull_time_stop': 115, 'bull_use_sma': True, 'bull_use_ema': True, 'bull_use_atr': False, 'bull_use_adx': True, 'bull_use_spike': True, 'bull_rsi_required': False, 'bear_strategy': 'breakout', 'bear_bb_std_mult': 2.7322274957192967, 'bear_rsi_os': 41, 'bear_rsi_ob': 74, 'bear_adx_thresh': 33.9300949784347, 'bear_atr_min_pct': 0.008235301313065865, 'bear_atr_max_pct': 0.07067850120866338, 'bear_tp_mult': 2.356763377826401, 'bear_tsl_mult': 0.483893636854578, 'bear_time_stop': 144, 'bear_use_sma': True, 'bear_use_ema': False, 'bear_use_atr': True, 'bear_use_adx': True, 'bear_use_spike': False, 'bear_rsi_required': True, 'sideways_strategy': 'mean_reversion', 'sideways_bb_std_mult': 0.6390936452270586, 'sideways_rsi_os': 27, 'sideways_rsi_ob': 53, 'sideways_adx_thresh': 19.57337307505212, 'sideways_atr_min_pct': 0.028885895467813113, 'sideways_atr_max_pct': 0.07310121439662554, 'sideways_tp_mult': 2.270957899883859, 'sideways_tsl_mult': 0.8945160140066737, 'sideways_time_stop': 124, 'sideways_use_sma': False, 'sideways_use_ema': True, 'sideways_use_atr': False, 'sideways_use_adx': False, 'sideways_use_spike': True, 'sideways_rsi_required': False}.
[I 2025-09-01 07:33:13,915] Trial 78 finished with values: [-1000000000.0, 1000000000.0] and parameters: {'p_sma': 35, 'p_std': 27, 'p_atr': 28, 'p_adx': 27, 'rsi_period': 70, 'ema1': 17, 'ema2': 21, 'slip_atr_k': 0.13668062026417738, 'slip_spread_k': 0.8041252443613601, 'spread_hl_frac': 0.016034018568496514, 'bb_std_mult': 0.5246618206739393, 'rsi_os': 34, 'rsi_ob': 57, 'vol_spike': 0.11279982114692497, 'adx_thresh': 15.008941499357864, 'atr_min_pct': 0.011811162798810903, 'atr_max_pct': 0.12073517751260812, 'tp_mult': 1.0929164928226576, 'tsl_mult': 0.07976045360652154, 'strategy': 'mean_reversion', 'time_stop': 75, 'use_sma': True, 'use_atr': False, 'use_adx': True, 'use_ema': True, 'use_spike': False, 'rsi_required': True, 'edge_k': 0.6746705358026035, 'edge_cap': 0.9675257059636342, 'bull_strategy': 'mean_reversion', 'bull_bb_std_mult': 2.944649513563518, 'bull_rsi_os': 50, 'bull_rsi_ob': 80, 'bull_adx_thresh': 16.059019197408418, 'bull_atr_min_pct': 0.0025185403215603848, 'bull_atr_max_pct': 0.1432475143663836, 'bull_tp_mult': 2.523672129913533, 'bull_tsl_mult': 0.4823476221785899, 'bull_time_stop': 96, 'bull_use_sma': True, 'bull_use_ema': True, 'bull_use_atr': True, 'bull_use_adx': True, 'bull_use_spike': False, 'bull_rsi_required': False, 'bear_strategy': 'breakout', 'bear_bb_std_mult': 2.77111961943432, 'bear_rsi_os': 40, 'bear_rsi_ob': 72, 'bear_adx_thresh': 33.7563318631792, 'bear_atr_min_pct': 0.008141615311403779, 'bear_atr_max_pct': 0.13525304686441825, 'bear_tp_mult': 2.3619711815204933, 'bear_tsl_mult': 0.4854181508743916, 'bear_time_stop': 82, 'bear_use_sma': False, 'bear_use_ema': False, 'bear_use_atr': True, 'bear_use_adx': True, 'bear_use_spike': False, 'bear_rsi_required': True, 'sideways_strategy': 'breakout', 'sideways_bb_std_mult': 1.6993079407182132, 'sideways_rsi_os': 32, 'sideways_rsi_ob': 54, 'sideways_adx_thresh': 19.087632627707936, 'sideways_atr_min_pct': 0.021705689994532627, 'sideways_atr_max_pct': 0.09946734387298614, 'sideways_tp_mult': 1.9050429737170622, 'sideways_tsl_mult': 0.8924023206493817, 'sideways_time_stop': 284, 'sideways_use_sma': True, 'sideways_use_ema': True, 'sideways_use_atr': True, 'sideways_use_adx': False, 'sideways_use_spike': True, 'sideways_rsi_required': False}.
[I 2025-09-01 07:33:20,214] Trial 81 finished with values: [-0.07410833302850006, 0.07657865764752243] and parameters: {'p_sma': 35, 'p_std': 32, 'p_atr': 27, 'p_adx': 15, 'rsi_period': 37, 'ema1': 17, 'ema2': 20, 'slip_atr_k': 0.1418852963992124, 'slip_spread_k': 0.7097518151977226, 'spread_hl_frac': 0.00796401921959659, 'bb_std_mult': 0.7354623343585995, 'rsi_os': 18, 'rsi_ob': 57, 'vol_spike': 0.01968871371130207, 'adx_thresh': 22.32475868499266, 'atr_min_pct': 0.012664493485235632, 'atr_max_pct': 0.05984860809105559, 'tp_mult': 1.0848301616809435, 'tsl_mult': 0.4048464951745846, 'strategy': 'mean_reversion', 'time_stop': 73, 'use_sma': True, 'use_atr': True, 'use_adx': True, 'use_ema': True, 'use_spike': True, 'rsi_required': True, 'edge_k': 0.6316478247338788, 'edge_cap': 0.966373866306067, 'bull_strategy': 'mean_reversion', 'bull_bb_std_mult': 1.2009526359935634, 'bull_rsi_os': 50, 'bull_rsi_ob': 76, 'bull_adx_thresh': 19.528935019812046, 'bull_atr_min_pct': 0.011493326641988792, 'bull_atr_max_pct': 0.05765844136156187, 'bull_tp_mult': 1.2605468019250505, 'bull_tsl_mult': 0.5445893280029765, 'bull_time_stop': 92, 'bull_use_sma': True, 'bull_use_ema': False, 'bull_use_atr': True, 'bull_use_adx': False, 'bull_use_spike': False, 'bull_rsi_required': True, 'bear_strategy': 'breakout', 'bear_bb_std_mult': 0.5870196028864882, 'bear_rsi_os': 34, 'bear_rsi_ob': 89, 'bear_adx_thresh': 28.19833426505209, 'bear_atr_min_pct': 0.0035905973739264324, 'bear_atr_max_pct': 0.13577026721321278, 'bear_tp_mult': 2.9622589891660445, 'bear_tsl_mult': 0.11574411275089816, 'bear_time_stop': 63, 'bear_use_sma': False, 'bear_use_ema': True, 'bear_use_atr': False, 'bear_use_adx': False, 'bear_use_spike': True, 'bear_rsi_required': False, 'sideways_strategy': 'breakout', 'sideways_bb_std_mult': 0.8560438809760085, 'sideways_rsi_os': 30, 'sideways_rsi_ob': 45, 'sideways_adx_thresh': 5.224889276396988, 'sideways_atr_min_pct': 0.024450844849796094, 'sideways_atr_max_pct': 0.09988284019640847, 'sideways_tp_mult': 1.9524767602480646, 'sideways_tsl_mult': 0.5766652937572813, 'sideways_time_stop': 296, 'sideways_use_sma': True, 'sideways_use_ema': False, 'sideways_use_atr': True, 'sideways_use_adx': True, 'sideways_use_spike': True, 'sideways_rsi_required': True}.
[I 2025-09-01 07:33:22,584] Trial 79 finished with values: [-1000000000.0, 1000000000.0] and parameters: {'p_sma': 35, 'p_std': 28, 'p_atr': 13, 'p_adx': 14, 'rsi_period': 57, 'ema1': 17, 'ema2': 22, 'slip_atr_k': 0.059851932169095665, 'slip_spread_k': 0.7982661049255436, 'spread_hl_frac': 0.03610505947925965, 'bb_std_mult': 1.9133153229356523, 'rsi_os': 20, 'rsi_ob': 51, 'vol_spike': 0.11535847453037457, 'adx_thresh': 22.234163826314074, 'atr_min_pct': 0.011529125524082992, 'atr_max_pct': 0.11983983388149563, 'tp_mult': 1.0970429232061383, 'tsl_mult': 0.2133570115999141, 'strategy': 'mean_reversion', 'time_stop': 101, 'use_sma': True, 'use_atr': False, 'use_adx': True, 'use_ema': True, 'use_spike': False, 'rsi_required': True, 'edge_k': 0.6500725190149192, 'edge_cap': 0.4590157228020161, 'bull_strategy': 'mean_reversion', 'bull_bb_std_mult': 3.45685103966939, 'bull_rsi_os': 39, 'bull_rsi_ob': 79, 'bull_adx_thresh': 16.255041196292964, 'bull_atr_min_pct': 0.0107914632929964, 'bull_atr_max_pct': 0.05778945872908691, 'bull_tp_mult': 2.2343082626116106, 'bull_tsl_mult': 0.24876184880565566, 'bull_time_stop': 132, 'bull_use_sma': True, 'bull_use_ema': True, 'bull_use_atr': False, 'bull_use_adx': False, 'bull_use_spike': True, 'bull_rsi_required': False, 'bear_strategy': 'breakout', 'bear_bb_std_mult': 0.5264724006013708, 'bear_rsi_os': 40, 'bear_rsi_ob': 76, 'bear_adx_thresh': 34.37975045255067, 'bear_atr_min_pct': 0.008649099391534402, 'bear_atr_max_pct': 0.06987327438425604, 'bear_tp_mult': 2.953404947759509, 'bear_tsl_mult': 0.12728320433612972, 'bear_time_stop': 71, 'bear_use_sma': True, 'bear_use_ema': False, 'bear_use_atr': True, 'bear_use_adx': False, 'bear_use_spike': False, 'bear_rsi_required': True, 'sideways_strategy': 'mean_reversion', 'sideways_bb_std_mult': 1.705399574571771, 'sideways_rsi_os': 30, 'sideways_rsi_ob': 54, 'sideways_adx_thresh': 18.339838352092272, 'sideways_atr_min_pct': 0.022315837789886495, 'sideways_atr_max_pct': 0.09813836738196968, 'sideways_tp_mult': 1.9629256431177884, 'sideways_tsl_mult': 0.9407330191165496, 'sideways_time_stop': 286, 'sideways_use_sma': False, 'sideways_use_ema': True, 'sideways_use_atr': False, 'sideways_use_adx': False, 'sideways_use_spike': True, 'sideways_rsi_required': False}.
