[I 2025-09-01 08:35:14,495] Trial 459 finished with values: [-1000000000.0, 1000000000.0] and parameters: {'p_sma': 23, 'p_std': 15, 'p_atr': 13, 'p_adx': 18, 'rsi_period': 66, 'ema1': 30, 'ema2': 21, 'slip_atr_k': 0.22224867321758415, 'slip_spread_k': 0.6722104540409316, 'spread_hl_frac': 0.03583023901124946, 'bb_std_mult': 3.3965197528174724, 'rsi_os': 27, 'rsi_ob': 54, 'vol_spike': 0.21160003988610046, 'adx_thresh': 27.10909887176216, 'atr_min_pct': 0.02163440564412542, 'atr_max_pct': 0.14491624181827945, 'tp_mult': 1.13055150373078, 'tsl_mult': 0.5179864370573632, 'strategy': 'mean_reversion', 'time_stop': 53, 'use_sma': True, 'use_atr': True, 'use_adx': True, 'use_ema': False, 'use_spike': True, 'rsi_required': True, 'edge_k': 1.081968584254857, 'edge_cap': 0.07267271439935995, 'bull_strategy': 'breakout', 'bull_bb_std_mult': 2.7116013983384413, 'bull_rsi_os': 30, 'bull_rsi_ob': 71, 'bull_adx_thresh': 31.866585833232, 'bull_atr_min_pct': 0.004280614682140217, 'bull_atr_max_pct': 0.03818288512176296, 'bull_tp_mult': 2.4628151190398686, 'bull_tsl_mult': 0.7122504016646196, 'bull_time_stop': 72, 'bull_use_sma': True, 'bull_use_ema': False, 'bull_use_atr': False, 'bull_use_adx': True, 'bull_use_spike': True, 'bull_rsi_required': False, 'bear_strategy': 'mean_reversion', 'bear_bb_std_mult': 3.0862351983531635, 'bear_rsi_os': 29, 'bear_rsi_ob': 70, 'bear_adx_thresh': 32.463857921220416, 'bear_atr_min_pct': 0.02994671938976379, 'bear_atr_max_pct': 0.050864660506763526, 'bear_tp_mult': 2.0358853525465936, 'bear_tsl_mult': 0.026669276227149374, 'bear_time_stop': 151, 'bear_use_sma': False, 'bear_use_ema': False, 'bear_use_atr': True, 'bear_use_adx': True, 'bear_use_spike': True, 'bear_rsi_required': False, 'sideways_strategy': 'mean_reversion', 'sideways_bb_std_mult': 0.6165083154106841, 'sideways_rsi_os': 9, 'sideways_rsi_ob': 63, 'sideways_adx_thresh': 17.99224649937667, 'sideways_atr_min_pct': 0.02640335250197384, 'sideways_atr_max_pct': 0.06763535666638842, 'sideways_tp_mult': 2.5862714820533714, 'sideways_tsl_mult': 0.19575444145372556, 'sideways_time_stop': 193, 'sideways_use_sma': False, 'sideways_use_ema': False, 'sideways_use_atr': False, 'sideways_use_adx': True, 'sideways_use_spike': True, 'sideways_rsi_required': False}.
[I 2025-09-01 08:35:15,282] Trial 460 finished with values: [-1000000000.0, 1000000000.0] and parameters: {'p_sma': 21, 'p_std': 15, 'p_atr': 12, 'p_adx': 19, 'rsi_period': 22, 'ema1': 9, 'ema2': 21, 'slip_atr_k': 0.22191147047412174, 'slip_spread_k': 0.7151406259628599, 'spread_hl_frac': 0.02531612520588199, 'bb_std_mult': 2.038337282277841, 'rsi_os': 26, 'rsi_ob': 50, 'vol_spike': 0.06700929451243964, 'adx_thresh': 24.53086486775814, 'atr_min_pct': 0.021678447453421817, 'atr_max_pct': 0.14487355457217518, 'tp_mult': 1.1347591262270305, 'tsl_mult': 0.4867246134850265, 'strategy': 'mean_reversion', 'time_stop': 265, 'use_sma': True, 'use_atr': True, 'use_adx': True, 'use_ema': False, 'use_spike': True, 'rsi_required': True, 'edge_k': 1.8391945908430314, 'edge_cap': 0.1000319266534899, 'bull_strategy': 'breakout', 'bull_bb_std_mult': 2.841737065156237, 'bull_rsi_os': 13, 'bull_rsi_ob': 70, 'bull_adx_thresh': 18.067586527051073, 'bull_atr_min_pct': 0.013707184300506936, 'bull_atr_max_pct': 0.05937526743892023, 'bull_tp_mult': 2.34948470792628, 'bull_tsl_mult': 0.2821971745659506, 'bull_time_stop': 162, 'bull_use_sma': True, 'bull_use_ema': False, 'bull_use_atr': False, 'bull_use_adx': True, 'bull_use_spike': True, 'bull_rsi_required': False, 'bear_strategy': 'mean_reversion', 'bear_bb_std_mult': 3.114236716459227, 'bear_rsi_os': 24, 'bear_rsi_ob': 91, 'bear_adx_thresh': 32.630933762143165, 'bear_atr_min_pct': 0.029914946294685604, 'bear_atr_max_pct': 0.08011672601285522, 'bear_tp_mult': 2.053345132748196, 'bear_tsl_mult': 0.3035610178799265, 'bear_time_stop': 136, 'bear_use_sma': False, 'bear_use_ema': False, 'bear_use_atr': True, 'bear_use_adx': True, 'bear_use_spike': True, 'bear_rsi_required': False, 'sideways_strategy': 'mean_reversion', 'sideways_bb_std_mult': 0.6157026430577117, 'sideways_rsi_os': 39, 'sideways_rsi_ob': 66, 'sideways_adx_thresh': 34.36396143939866, 'sideways_atr_min_pct': 0.02917348487872677, 'sideways_atr_max_pct': 0.015417495209038068, 'sideways_tp_mult': 2.595437232303166, 'sideways_tsl_mult': 0.9999384665439817, 'sideways_time_stop': 47, 'sideways_use_sma': False, 'sideways_use_ema': False, 'sideways_use_atr': False, 'sideways_use_adx': True, 'sideways_use_spike': True, 'sideways_rsi_required': False}.
[I 2025-09-01 08:35:15,344] Trial 462 finished with values: [-1000000000.0, 1000000000.0] and parameters: {'p_sma': 21, 'p_std': 55, 'p_atr': 12, 'p_adx': 30, 'rsi_period': 78, 'ema1': 9, 'ema2': 25, 'slip_atr_k': 0.2199954293236291, 'slip_spread_k': 0.7187373434629474, 'spread_hl_frac': 0.025178375077225066, 'bb_std_mult': 3.0981218955969734, 'rsi_os': 42, 'rsi_ob': 49, 'vol_spike': 0.2425540732815601, 'adx_thresh': 34.04992886449627, 'atr_min_pct': 0.02236888762451576, 'atr_max_pct': 0.1469332946104106, 'tp_mult': 1.1299613304283196, 'tsl_mult': 0.3412097208265283, 'strategy': 'mean_reversion', 'time_stop': 259, 'use_sma': True, 'use_atr': True, 'use_adx': True, 'use_ema': False, 'use_spike': True, 'rsi_required': True, 'edge_k': 1.0090222916588931, 'edge_cap': 0.1124152344066034, 'bull_strategy': 'breakout', 'bull_bb_std_mult': 2.929898961345333, 'bull_rsi_os': 27, 'bull_rsi_ob': 69, 'bull_adx_thresh': 18.080094020257864, 'bull_atr_min_pct': 0.0033413236063547097, 'bull_atr_max_pct': 0.06470000218970194, 'bull_tp_mult': 2.020709220062937, 'bull_tsl_mult': 0.7204887407949114, 'bull_time_stop': 140, 'bull_use_sma': True, 'bull_use_ema': False, 'bull_use_atr': False, 'bull_use_adx': True, 'bull_use_spike': True, 'bull_rsi_required': False, 'bear_strategy': 'mean_reversion', 'bear_bb_std_mult': 3.2751812758921797, 'bear_rsi_os': 20, 'bear_rsi_ob': 59, 'bear_adx_thresh': 22.634646786523565, 'bear_atr_min_pct': 0.020781149522473362, 'bear_atr_max_pct': 0.11759465198553629, 'bear_tp_mult': 2.0533490710223794, 'bear_tsl_mult': 0.3076955806552669, 'bear_time_stop': 135, 'bear_use_sma': True, 'bear_use_ema': False, 'bear_use_atr': True, 'bear_use_adx': False, 'bear_use_spike': False, 'bear_rsi_required': False, 'sideways_strategy': 'breakout', 'sideways_bb_std_mult': 0.627265973940642, 'sideways_rsi_os': 39, 'sideways_rsi_ob': 66, 'sideways_adx_thresh': 28.58078741875996, 'sideways_atr_min_pct': 0.0005194384505622165, 'sideways_atr_max_pct': 0.0360648409590596, 'sideways_tp_mult': 2.6902842571024856, 'sideways_tsl_mult': 0.8367149749829768, 'sideways_time_stop': 33, 'sideways_use_sma': False, 'sideways_use_ema': False, 'sideways_use_atr': True, 'sideways_use_adx': True, 'sideways_use_spike': True, 'sideways_rsi_required': True}.
[I 2025-09-01 08:35:16,319] Trial 465 finished with values: [-1000000000.0, 1000000000.0] and parameters: {'p_sma': 57, 'p_std': 27, 'p_atr': 11, 'p_adx': 20, 'rsi_period': 41, 'ema1': 7, 'ema2': 14, 'slip_atr_k': 0.05214990837309526, 'slip_spread_k': 0.6112751707887111, 'spread_hl_frac': 0.02442606726796536, 'bb_std_mult': 1.3859722100473295, 'rsi_os': 5, 'rsi_ob': 46, 'vol_spike': 0.23295477627350675, 'adx_thresh': 25.527955643172973, 'atr_min_pct': 0.0033951459346116125, 'atr_max_pct': 0.06313843520628219, 'tp_mult': 1.1725694093649692, 'tsl_mult': 0.5060646249718147, 'strategy': 'mean_reversion', 'time_stop': 123, 'use_sma': False, 'use_atr': True, 'use_adx': True, 'use_ema': True, 'use_spike': False, 'rsi_required': True, 'edge_k': 1.4967546744219848, 'edge_cap': 0.14949797128169287, 'bull_strategy': 'mean_reversion', 'bull_bb_std_mult': 3.0978995791575175, 'bull_rsi_os': 16, 'bull_rsi_ob': 73, 'bull_adx_thresh': 8.907394682643899, 'bull_atr_min_pct': 0.009014929532903379, 'bull_atr_max_pct': 0.04492930082497702, 'bull_tp_mult': 2.29061097723138, 'bull_tsl_mult': 0.6452417780723985, 'bull_time_stop': 150, 'bull_use_sma': True, 'bull_use_ema': False, 'bull_use_atr': True, 'bull_use_adx': True, 'bull_use_spike': False, 'bull_rsi_required': False, 'bear_strategy': 'breakout', 'bear_bb_std_mult': 3.278332908676516, 'bear_rsi_os': 6, 'bear_rsi_ob': 95, 'bear_adx_thresh': 30.71602723164023, 'bear_atr_min_pct': 0.02337595151113718, 'bear_atr_max_pct': 0.01999352050778635, 'bear_tp_mult': 2.7988126921033816, 'bear_tsl_mult': 0.9677016490269559, 'bear_time_stop': 93, 'bear_use_sma': True, 'bear_use_ema': True, 'bear_use_atr': True, 'bear_use_adx': False, 'bear_use_spike': False, 'bear_rsi_required': True, 'sideways_strategy': 'breakout', 'sideways_bb_std_mult': 2.0365511559156206, 'sideways_rsi_os': 48, 'sideways_rsi_ob': 67, 'sideways_adx_thresh': 8.687978271831646, 'sideways_atr_min_pct': 0.01456570049898318, 'sideways_atr_max_pct': 0.029373013581079677, 'sideways_tp_mult': 1.4747447506413849, 'sideways_tsl_mult': 0.23224340386386622, 'sideways_time_stop': 295, 'sideways_use_sma': False, 'sideways_use_ema': False, 'sideways_use_atr': True, 'sideways_use_adx': True, 'sideways_use_spike': True, 'sideways_rsi_required': True}.
[I 2025-09-01 08:35:56,983] Trial 463 finished with values: [-1000000000.0, 1000000000.0] and parameters: {'p_sma': 19, 'p_std': 17, 'p_atr': 14, 'p_adx': 20, 'rsi_period': 41, 'ema1': 9, 'ema2': 14, 'slip_atr_k': 0.05225133671827334, 'slip_spread_k': 0.7717746251619895, 'spread_hl_frac': 0.025214795622889207, 'bb_std_mult': 2.6828213902252314, 'rsi_os': 25, 'rsi_ob': 73, 'vol_spike': 0.1730932046931616, 'adx_thresh': 24.47573547447445, 'atr_min_pct': 0.014210707640348355, 'atr_max_pct': 0.1087818286926244, 'tp_mult': 1.1896353511769682, 'tsl_mult': 0.12932712842041316, 'strategy': 'mean_reversion', 'time_stop': 142, 'use_sma': True, 'use_atr': True, 'use_adx': True, 'use_ema': False, 'use_spike': True, 'rsi_required': True, 'edge_k': 1.0203342270158888, 'edge_cap': 0.11606375253679588, 'bull_strategy': 'breakout', 'bull_bb_std_mult': 3.3076803698655843, 'bull_rsi_os': 13, 'bull_rsi_ob': 79, 'bull_adx_thresh': 9.053189294869997, 'bull_atr_min_pct': 0.013878635349461354, 'bull_atr_max_pct': 0.0650264612265261, 'bull_tp_mult': 1.9931803179108225, 'bull_tsl_mult': 0.27634795608492957, 'bull_time_stop': 138, 'bull_use_sma': True, 'bull_use_ema': False, 'bull_use_atr': False, 'bull_use_adx': True, 'bull_use_spike': True, 'bull_rsi_required': False, 'bear_strategy': 'mean_reversion', 'bear_bb_std_mult': 2.499718164326881, 'bear_rsi_os': 37, 'bear_rsi_ob': 60, 'bear_adx_thresh': 23.697837079628176, 'bear_atr_min_pct': 0.0062739721735728445, 'bear_atr_max_pct': 0.08080962679712173, 'bear_tp_mult': 2.3192859569504565, 'bear_tsl_mult': 0.13565349757376804, 'bear_time_stop': 89, 'bear_use_sma': True, 'bear_use_ema': False, 'bear_use_atr': True, 'bear_use_adx': False, 'bear_use_spike': False, 'bear_rsi_required': False, 'sideways_strategy': 'breakout', 'sideways_bb_std_mult': 1.1489595970153106, 'sideways_rsi_os': 26, 'sideways_rsi_ob': 66, 'sideways_adx_thresh': 12.155716548898265, 'sideways_atr_min_pct': 0.029351699115362638, 'sideways_atr_max_pct': 0.11619410517092474, 'sideways_tp_mult': 2.669324472387837, 'sideways_tsl_mult': 0.19242224545456615, 'sideways_time_stop': 82, 'sideways_use_sma': False, 'sideways_use_ema': False, 'sideways_use_atr': True, 'sideways_use_adx': True, 'sideways_use_spike': True, 'sideways_rsi_required': True}.
[I 2025-09-01 08:35:58,516] Trial 461 finished with values: [-1000000000.0, 1000000000.0] and parameters: {'p_sma': 21, 'p_std': 56, 'p_atr': 25, 'p_adx': 11, 'rsi_period': 66, 'ema1': 9, 'ema2': 14, 'slip_atr_k': 0.20948088046764896, 'slip_spread_k': 0.7688885121148104, 'spread_hl_frac': 0.025169185794210486, 'bb_std_mult': 3.131297423578033, 'rsi_os': 25, 'rsi_ob': 94, 'vol_spike': 0.24258159868239754, 'adx_thresh': 24.518895516179875, 'atr_min_pct': 0.021597947679863595, 'atr_max_pct': 0.1457909201067089, 'tp_mult': 1.125831426389161, 'tsl_mult': 0.8283169097762167, 'strategy': 'mean_reversion', 'time_stop': 54, 'use_sma': True, 'use_atr': True, 'use_adx': True, 'use_ema': False, 'use_spike': False, 'rsi_required': True, 'edge_k': 1.8459512127403945, 'edge_cap': 0.1166506084004088, 'bull_strategy': 'breakout', 'bull_bb_std_mult': 3.127420696622303, 'bull_rsi_os': 27, 'bull_rsi_ob': 70, 'bull_adx_thresh': 8.043786772351186, 'bull_atr_min_pct': 0.013847230394788072, 'bull_atr_max_pct': 0.04316648274855435, 'bull_tp_mult': 1.1006591429476273, 'bull_tsl_mult': 0.2729174015040744, 'bull_time_stop': 6, 'bull_use_sma': True, 'bull_use_ema': False, 'bull_use_atr': False, 'bull_use_adx': True, 'bull_use_spike': True, 'bull_rsi_required': False, 'bear_strategy': 'mean_reversion', 'bear_bb_std_mult': 3.2774107585713685, 'bear_rsi_os': 23, 'bear_rsi_ob': 59, 'bear_adx_thresh': 22.751767194090295, 'bear_atr_min_pct': 0.015201962412780075, 'bear_atr_max_pct': 0.0926605022688155, 'bear_tp_mult': 2.806291618012014, 'bear_tsl_mult': 0.15124039204670314, 'bear_time_stop': 150, 'bear_use_sma': True, 'bear_use_ema': False, 'bear_use_atr': True, 'bear_use_adx': False, 'bear_use_spike': True, 'bear_rsi_required': False, 'sideways_strategy': 'mean_reversion', 'sideways_bb_std_mult': 0.6176400343631067, 'sideways_rsi_os': 39, 'sideways_rsi_ob': 83, 'sideways_adx_thresh': 8.804432272423684, 'sideways_atr_min_pct': 0.022338849495540478, 'sideways_atr_max_pct': 0.06827171965505958, 'sideways_tp_mult': 1.6955427764991486, 'sideways_tsl_mult': 0.2307418366608118, 'sideways_time_stop': 41, 'sideways_use_sma': False, 'sideways_use_ema': False, 'sideways_use_atr': False, 'sideways_use_adx': True, 'sideways_use_spike': True, 'sideways_rsi_required': True}.
[I 2025-09-01 08:35:59,686] Trial 464 finished with values: [-1000000000.0, 1000000000.0] and parameters: {'p_sma': 19, 'p_std': 20, 'p_atr': 19, 'p_adx': 20, 'rsi_period': 83, 'ema1': 10, 'ema2': 14, 'slip_atr_k': 0.05249129811927133, 'slip_spread_k': 0.6180119232536865, 'spread_hl_frac': 0.0251300452289903, 'bb_std_mult': 0.824673061060357, 'rsi_os': 42, 'rsi_ob': 57, 'vol_spike': 0.2420115824964264, 'adx_thresh': 25.579782598215637, 'atr_min_pct': 0.02241440847710976, 'atr_max_pct': 0.1094604034049873, 'tp_mult': 2.4825715031335505, 'tsl_mult': 0.3226321473181393, 'strategy': 'mean_reversion', 'time_stop': 246, 'use_sma': False, 'use_atr': True, 'use_adx': True, 'use_ema': True, 'use_spike': False, 'rsi_required': True, 'edge_k': 1.011641106590738, 'edge_cap': 0.5763817257910728, 'bull_strategy': 'mean_reversion', 'bull_bb_std_mult': 3.371549458386399, 'bull_rsi_os': 27, 'bull_rsi_ob': 47, 'bull_adx_thresh': 8.063706414861832, 'bull_atr_min_pct': 0.02636469082515581, 'bull_atr_max_pct': 0.028939276103079264, 'bull_tp_mult': 1.5291998819162513, 'bull_tsl_mult': 0.6382252634549803, 'bull_time_stop': 183, 'bull_use_sma': True, 'bull_use_ema': False, 'bull_use_atr': False, 'bull_use_adx': True, 'bull_use_spike': True, 'bull_rsi_required': False, 'bear_strategy': 'breakout', 'bear_bb_std_mult': 3.2935571003960007, 'bear_rsi_os': 6, 'bear_rsi_ob': 95, 'bear_adx_thresh': 30.766197541936354, 'bear_atr_min_pct': 0.018632032628283085, 'bear_atr_max_pct': 0.1136504699152151, 'bear_tp_mult': 2.8229176468060717, 'bear_tsl_mult': 0.16062061204671235, 'bear_time_stop': 89, 'bear_use_sma': True, 'bear_use_ema': True, 'bear_use_atr': True, 'bear_use_adx': False, 'bear_use_spike': False, 'bear_rsi_required': True, 'sideways_strategy': 'breakout', 'sideways_bb_std_mult': 0.893128634659768, 'sideways_rsi_os': 41, 'sideways_rsi_ob': 83, 'sideways_adx_thresh': 16.669431955968754, 'sideways_atr_min_pct': 0.02096653705630693, 'sideways_atr_max_pct': 0.11573869328258314, 'sideways_tp_mult': 1.6895105519783287, 'sideways_tsl_mult': 0.22526783776160128, 'sideways_time_stop': 40, 'sideways_use_sma': False, 'sideways_use_ema': False, 'sideways_use_atr': True, 'sideways_use_adx': True, 'sideways_use_spike': True, 'sideways_rsi_required': True}.
[I 2025-09-01 08:35:59,940] Trial 466 finished with values: [-1000000000.0, 1000000000.0] and parameters: {'p_sma': 19, 'p_std': 22, 'p_atr': 19, 'p_adx': 20, 'rsi_period': 76, 'ema1': 10, 'ema2': 14, 'slip_atr_k': 0.0479589622503106, 'slip_spread_k': 0.8360914302816, 'spread_hl_frac': 0.017981536271029226, 'bb_std_mult': 2.657593354519968, 'rsi_os': 25, 'rsi_ob': 57, 'vol_spike': 0.17272328794632985, 'adx_thresh': 26.22933850745822, 'atr_min_pct': 0.020446524657245856, 'atr_max_pct': 0.026012777468301142, 'tp_mult': 2.202480661903773, 'tsl_mult': 0.7725499567034642, 'strategy': 'breakout', 'time_stop': 247, 'use_sma': True, 'use_atr': True, 'use_adx': True, 'use_ema': True, 'use_spike': True, 'rsi_required': True, 'edge_k': 0.9175382451341506, 'edge_cap': 0.20714492564008957, 'bull_strategy': 'breakout', 'bull_bb_std_mult': 3.386827920705619, 'bull_rsi_os': 14, 'bull_rsi_ob': 66, 'bull_adx_thresh': 8.02153495007554, 'bull_atr_min_pct': 0.01946056627780416, 'bull_atr_max_pct': 0.13580938795978853, 'bull_tp_mult': 1.43270476618358, 'bull_tsl_mult': 0.6652482947270754, 'bull_time_stop': 231, 'bull_use_sma': False, 'bull_use_ema': False, 'bull_use_atr': False, 'bull_use_adx': False, 'bull_use_spike': True, 'bull_rsi_required': False, 'bear_strategy': 'mean_reversion', 'bear_bb_std_mult': 3.0128999580148816, 'bear_rsi_os': 27, 'bear_rsi_ob': 95, 'bear_adx_thresh': 15.818840695358402, 'bear_atr_min_pct': 0.024055801103256103, 'bear_atr_max_pct': 0.0709781593220477, 'bear_tp_mult': 2.665575838050946, 'bear_tsl_mult': 0.07610991636734125, 'bear_time_stop': 115, 'bear_use_sma': False, 'bear_use_ema': False, 'bear_use_atr': True, 'bear_use_adx': True, 'bear_use_spike': True, 'bear_rsi_required': False, 'sideways_strategy': 'mean_reversion', 'sideways_bb_std_mult': 0.9009977180571991, 'sideways_rsi_os': 20, 'sideways_rsi_ob': 81, 'sideways_adx_thresh': 8.845139194459252, 'sideways_atr_min_pct': 0.024295905533873126, 'sideways_atr_max_pct': 0.037809725671645804, 'sideways_tp_mult': 2.8669335254362744, 'sideways_tsl_mult': 0.9437037911165312, 'sideways_time_stop': 81, 'sideways_use_sma': False, 'sideways_use_ema': False, 'sideways_use_atr': False, 'sideways_use_adx': True, 'sideways_use_spike': True, 'sideways_rsi_required': False}.
[I 2025-09-01 08:36:43,123] Trial 469 finished with values: [-1000000000.0, 1000000000.0] and parameters: {'p_sma': 17, 'p_std': 40, 'p_atr': 30, 'p_adx': 21, 'rsi_period': 62, 'ema1': 27, 'ema2': 16, 'slip_atr_k': 0.15031581005461486, 'slip_spread_k': 0.9169765927807677, 'spread_hl_frac': 0.04404723922719542, 'bb_std_mult': 3.2036134814281882, 'rsi_os': 22, 'rsi_ob': 82, 'vol_spike': 0.16296595113914145, 'adx_thresh': 26.190739455104236, 'atr_min_pct': 0.007867717363113707, 'atr_max_pct': 0.02544080751408985, 'tp_mult': 1.2920985911552203, 'tsl_mult': 0.44755377564291243, 'strategy': 'breakout', 'time_stop': 254, 'use_sma': True, 'use_atr': False, 'use_adx': False, 'use_ema': True, 'use_spike': True, 'rsi_required': False, 'edge_k': 0.9248698725416752, 'edge_cap': 0.6293906103264696, 'bull_strategy': 'breakout', 'bull_bb_std_mult': 0.8006188656535538, 'bull_rsi_os': 48, 'bull_rsi_ob': 67, 'bull_adx_thresh': 13.046875416596858, 'bull_atr_min_pct': 0.01928708746935332, 'bull_atr_max_pct': 0.035972337586428996, 'bull_tp_mult': 1.4311078174947127, 'bull_tsl_mult': 0.6881088637747865, 'bull_time_stop': 253, 'bull_use_sma': False, 'bull_use_ema': True, 'bull_use_atr': True, 'bull_use_adx': False, 'bull_use_spike': False, 'bull_rsi_required': True, 'bear_strategy': 'mean_reversion', 'bear_bb_std_mult': 3.5392554786268375, 'bear_rsi_os': 27, 'bear_rsi_ob': 49, 'bear_adx_thresh': 16.701043379569462, 'bear_atr_min_pct': 0.024278300830582224, 'bear_atr_max_pct': 0.07694327219510363, 'bear_tp_mult': 2.678808788621885, 'bear_tsl_mult': 0.08112103987035213, 'bear_time_stop': 116, 'bear_use_sma': False, 'bear_use_ema': False, 'bear_use_atr': False, 'bear_use_adx': True, 'bear_use_spike': True, 'bear_rsi_required': False, 'sideways_strategy': 'mean_reversion', 'sideways_bb_std_mult': 0.815009762396181, 'sideways_rsi_os': 34, 'sideways_rsi_ob': 95, 'sideways_adx_thresh': 10.336607384417759, 'sideways_atr_min_pct': 0.02492351673073673, 'sideways_atr_max_pct': 0.04915440363797419, 'sideways_tp_mult': 2.5222950279182115, 'sideways_tsl_mult': 0.3014598098805704, 'sideways_time_stop': 24, 'sideways_use_sma': True, 'sideways_use_ema': True, 'sideways_use_atr': False, 'sideways_use_adx': False, 'sideways_use_spike': False, 'sideways_rsi_required': False}.
