[I 2025-09-01 08:21:01,316] Trial 376 finished with values: [-1000000000.0, 1000000000.0] and parameters: {'p_sma': 14, 'p_std': 29, 'p_atr': 23, 'p_adx': 21, 'rsi_period': 62, 'ema1': 30, 'ema2': 25, 'slip_atr_k': 0.152551776665521, 'slip_spread_k': 0.3138942905687607, 'spread_hl_frac': 0.023064326972256737, 'bb_std_mult': 3.4717532366169355, 'rsi_os': 16, 'rsi_ob': 60, 'vol_spike': 0.263688546690232, 'adx_thresh': 8.877332711073338, 'atr_min_pct': 0.027129603045254812, 'atr_max_pct': 0.1456449403121359, 'tp_mult': 1.1189369982332853, 'tsl_mult': 0.5673000001249842, 'strategy': 'mean_reversion', 'time_stop': 277, 'use_sma': False, 'use_atr': True, 'use_adx': True, 'use_ema': True, 'use_spike': True, 'rsi_required': True, 'edge_k': 0.7444688536932556, 'edge_cap': 0.09837449565414418, 'bull_strategy': 'mean_reversion', 'bull_bb_std_mult': 2.5915399275354325, 'bull_rsi_os': 12, 'bull_rsi_ob': 71, 'bull_adx_thresh': 7.550839892047421, 'bull_atr_min_pct': 0.009457029430528764, 'bull_atr_max_pct': 0.040888987933242096, 'bull_tp_mult': 2.6845717877048036, 'bull_tsl_mult': 0.11084805591042712, 'bull_time_stop': 147, 'bull_use_sma': True, 'bull_use_ema': False, 'bull_use_atr': False, 'bull_use_adx': True, 'bull_use_spike': True, 'bull_rsi_required': False, 'bear_strategy': 'mean_reversion', 'bear_bb_std_mult': 0.6513667637428315, 'bear_rsi_os': 46, 'bear_rsi_ob': 93, 'bear_adx_thresh': 6.838409128367115, 'bear_atr_min_pct': 0.006331084611344493, 'bear_atr_max_pct': 0.07738162775154064, 'bear_tp_mult': 2.7194598270281354, 'bear_tsl_mult': 0.21304689860637543, 'bear_time_stop': 84, 'bear_use_sma': False, 'bear_use_ema': True, 'bear_use_atr': True, 'bear_use_adx': True, 'bear_use_spike': False, 'bear_rsi_required': False, 'sideways_strategy': 'mean_reversion', 'sideways_bb_std_mult': 2.6001628086630353, 'sideways_rsi_os': 48, 'sideways_rsi_ob': 64, 'sideways_adx_thresh': 8.06056732142972, 'sideways_atr_min_pct': 0.024210064871639937, 'sideways_atr_max_pct': 0.023346033200753152, 'sideways_tp_mult': 2.566377994217732, 'sideways_tsl_mult': 0.15655034403942222, 'sideways_time_stop': 256, 'sideways_use_sma': False, 'sideways_use_ema': True, 'sideways_use_atr': False, 'sideways_use_adx': True, 'sideways_use_spike': True, 'sideways_rsi_required': False}.
[I 2025-09-01 08:21:01,791] Trial 374 finished with values: [-1000000000.0, 1000000000.0] and parameters: {'p_sma': 51, 'p_std': 47, 'p_atr': 14, 'p_adx': 20, 'rsi_period': 69, 'ema1': 25, 'ema2': 13, 'slip_atr_k': 0.2159264978523968, 'slip_spread_k': 0.6772387499579439, 'spread_hl_frac': 0.023998412093385713, 'bb_std_mult': 3.379771223207676, 'rsi_os': 17, 'rsi_ob': 56, 'vol_spike': 0.24598384903463005, 'adx_thresh': 33.53025502021047, 'atr_min_pct': 0.024994816575698908, 'atr_max_pct': 0.14522206542944943, 'tp_mult': 1.706778589958258, 'tsl_mult': 0.42565704438296725, 'strategy': 'mean_reversion', 'time_stop': 14, 'use_sma': True, 'use_atr': True, 'use_adx': True, 'use_ema': True, 'use_spike': True, 'rsi_required': True, 'edge_k': 0.08131242933484562, 'edge_cap': 0.10254534248078559, 'bull_strategy': 'breakout', 'bull_bb_std_mult': 1.9239065107762796, 'bull_rsi_os': 29, 'bull_rsi_ob': 53, 'bull_adx_thresh': 5.729395831594108, 'bull_atr_min_pct': 0.00941366701896694, 'bull_atr_max_pct': 0.03884698795602298, 'bull_tp_mult': 2.680536541008238, 'bull_tsl_mult': 0.6308960010501125, 'bull_time_stop': 147, 'bull_use_sma': True, 'bull_use_ema': False, 'bull_use_atr': False, 'bull_use_adx': True, 'bull_use_spike': True, 'bull_rsi_required': False, 'bear_strategy': 'mean_reversion', 'bear_bb_std_mult': 0.721799186688092, 'bear_rsi_os': 20, 'bear_rsi_ob': 76, 'bear_adx_thresh': 32.11837215014555, 'bear_atr_min_pct': 0.023070648981206258, 'bear_atr_max_pct': 0.03291281747977513, 'bear_tp_mult': 2.7054619835062255, 'bear_tsl_mult': 0.6670901262660591, 'bear_time_stop': 83, 'bear_use_sma': False, 'bear_use_ema': False, 'bear_use_atr': True, 'bear_use_adx': True, 'bear_use_spike': False, 'bear_rsi_required': False, 'sideways_strategy': 'mean_reversion', 'sideways_bb_std_mult': 0.6778555589011996, 'sideways_rsi_os': 33, 'sideways_rsi_ob': 48, 'sideways_adx_thresh': 9.256649291910573, 'sideways_atr_min_pct': 0.005832969070044599, 'sideways_atr_max_pct': 0.02667399856042658, 'sideways_tp_mult': 2.7505320114071177, 'sideways_tsl_mult': 0.8103027469183881, 'sideways_time_stop': 12, 'sideways_use_sma': False, 'sideways_use_ema': True, 'sideways_use_atr': False, 'sideways_use_adx': True, 'sideways_use_spike': True, 'sideways_rsi_required': False}.
[I 2025-09-01 08:21:02,954] Trial 379 finished with values: [-1000000000.0, 1000000000.0] and parameters: {'p_sma': 43, 'p_std': 48, 'p_atr': 14, 'p_adx': 18, 'rsi_period': 64, 'ema1': 25, 'ema2': 58, 'slip_atr_k': 0.04414697505324955, 'slip_spread_k': 0.6454760245126997, 'spread_hl_frac': 7.498628944598018e-05, 'bb_std_mult': 3.53535835470072, 'rsi_os': 17, 'rsi_ob': 68, 'vol_spike': 0.2386648249905475, 'adx_thresh': 26.851745385629766, 'atr_min_pct': 0.009685325679518228, 'atr_max_pct': 0.06068536709789184, 'tp_mult': 1.7087742773600967, 'tsl_mult': 0.8054687890405373, 'strategy': 'mean_reversion', 'time_stop': 270, 'use_sma': True, 'use_atr': True, 'use_adx': True, 'use_ema': False, 'use_spike': True, 'rsi_required': True, 'edge_k': 0.1863620202903472, 'edge_cap': 0.05147733610911223, 'bull_strategy': 'breakout', 'bull_bb_std_mult': 2.7062619243944495, 'bull_rsi_os': 13, 'bull_rsi_ob': 71, 'bull_adx_thresh': 7.494643766075873, 'bull_atr_min_pct': 0.011094934972575111, 'bull_atr_max_pct': 0.04370916636626056, 'bull_tp_mult': 2.428145378754113, 'bull_tsl_mult': 0.6786164297586379, 'bull_time_stop': 155, 'bull_use_sma': True, 'bull_use_ema': False, 'bull_use_atr': False, 'bull_use_adx': True, 'bull_use_spike': True, 'bull_rsi_required': False, 'bear_strategy': 'mean_reversion', 'bear_bb_std_mult': 3.1640759399747873, 'bear_rsi_os': 19, 'bear_rsi_ob': 93, 'bear_adx_thresh': 8.449671405927749, 'bear_atr_min_pct': 0.010946812628553263, 'bear_atr_max_pct': 0.1232487731111103, 'bear_tp_mult': 2.914419966361347, 'bear_tsl_mult': 0.06589244737713569, 'bear_time_stop': 39, 'bear_use_sma': False, 'bear_use_ema': False, 'bear_use_atr': True, 'bear_use_adx': True, 'bear_use_spike': True, 'bear_rsi_required': False, 'sideways_strategy': 'mean_reversion', 'sideways_bb_std_mult': 3.1233583490243673, 'sideways_rsi_os': 52, 'sideways_rsi_ob': 68, 'sideways_adx_thresh': 9.299182388963596, 'sideways_atr_min_pct': 0.011889131713120801, 'sideways_atr_max_pct': 0.11836238462323007, 'sideways_tp_mult': 1.5273760021737057, 'sideways_tsl_mult': 0.7138802519671101, 'sideways_time_stop': 232, 'sideways_use_sma': False, 'sideways_use_ema': False, 'sideways_use_atr': False, 'sideways_use_adx': False, 'sideways_use_spike': False, 'sideways_rsi_required': False}.
[I 2025-09-01 08:21:11,474] Trial 381 finished with values: [-1000000000.0, 1000000000.0] and parameters: {'p_sma': 32, 'p_std': 18, 'p_atr': 12, 'p_adx': 12, 'rsi_period': 67, 'ema1': 11, 'ema2': 11, 'slip_atr_k': 0.06036803241304354, 'slip_spread_k': 0.6428034041499211, 'spread_hl_frac': 0.015005544722989107, 'bb_std_mult': 3.5368911660556375, 'rsi_os': 30, 'rsi_ob': 59, 'vol_spike': 0.23188313045760262, 'adx_thresh': 25.59256603819602, 'atr_min_pct': 0.023413165203136684, 'atr_max_pct': 0.14994129113301477, 'tp_mult': 1.2778852426849365, 'tsl_mult': 0.15142281984117434, 'strategy': 'mean_reversion', 'time_stop': 191, 'use_sma': True, 'use_atr': True, 'use_adx': True, 'use_ema': True, 'use_spike': True, 'rsi_required': True, 'edge_k': 1.1085777364665192, 'edge_cap': 0.06958052987723493, 'bull_strategy': 'breakout', 'bull_bb_std_mult': 2.592646867742376, 'bull_rsi_os': 12, 'bull_rsi_ob': 57, 'bull_adx_thresh': 11.506067154491078, 'bull_atr_min_pct': 0.009344490667957797, 'bull_atr_max_pct': 0.04231456243503814, 'bull_tp_mult': 2.6744894055394544, 'bull_tsl_mult': 0.047825651786963075, 'bull_time_stop': 151, 'bull_use_sma': True, 'bull_use_ema': False, 'bull_use_atr': False, 'bull_use_adx': True, 'bull_use_spike': True, 'bull_rsi_required': False, 'bear_strategy': 'mean_reversion', 'bear_bb_std_mult': 3.183246194468808, 'bear_rsi_os': 19, 'bear_rsi_ob': 47, 'bear_adx_thresh': 32.01014928319439, 'bear_atr_min_pct': 0.024100725067186538, 'bear_atr_max_pct': 0.016803446656604965, 'bear_tp_mult': 2.028862526967827, 'bear_tsl_mult': 0.7755323419869125, 'bear_time_stop': 5, 'bear_use_sma': False, 'bear_use_ema': False, 'bear_use_atr': True, 'bear_use_adx': True, 'bear_use_spike': True, 'bear_rsi_required': False, 'sideways_strategy': 'mean_reversion', 'sideways_bb_std_mult': 0.6569191244827957, 'sideways_rsi_os': 28, 'sideways_rsi_ob': 93, 'sideways_adx_thresh': 11.102208429404522, 'sideways_atr_min_pct': 0.014832469662015173, 'sideways_atr_max_pct': 0.1184275555927917, 'sideways_tp_mult': 2.5098049263220323, 'sideways_tsl_mult': 0.110009040885793, 'sideways_time_stop': 10, 'sideways_use_sma': False, 'sideways_use_ema': False, 'sideways_use_atr': False, 'sideways_use_adx': True, 'sideways_use_spike': True, 'sideways_rsi_required': False}.
[I 2025-09-01 08:21:49,520] Trial 382 finished with values: [-1000000000.0, 1000000000.0] and parameters: {'p_sma': 60, 'p_std': 43, 'p_atr': 13, 'p_adx': 12, 'rsi_period': 24, 'ema1': 11, 'ema2': 11, 'slip_atr_k': 0.06408309647601358, 'slip_spread_k': 0.15406897828719568, 'spread_hl_frac': 0.04364523988467886, 'bb_std_mult': 3.55994909246614, 'rsi_os': 32, 'rsi_ob': 92, 'vol_spike': 0.02814793763752302, 'adx_thresh': 25.658052544052833, 'atr_min_pct': 0.02356262000398649, 'atr_max_pct': 0.14991110716880152, 'tp_mult': 1.713238814548434, 'tsl_mult': 0.009078491614713191, 'strategy': 'mean_reversion', 'time_stop': 234, 'use_sma': True, 'use_atr': True, 'use_adx': True, 'use_ema': True, 'use_spike': True, 'rsi_required': True, 'edge_k': 1.817000630995763, 'edge_cap': 0.05086242230369751, 'bull_strategy': 'breakout', 'bull_bb_std_mult': 2.725169023780144, 'bull_rsi_os': 14, 'bull_rsi_ob': 57, 'bull_adx_thresh': 7.969895998955695, 'bull_atr_min_pct': 0.011025675365607607, 'bull_atr_max_pct': 0.09128067890079802, 'bull_tp_mult': 2.4708192628679524, 'bull_tsl_mult': 0.16281456211720885, 'bull_time_stop': 269, 'bull_use_sma': True, 'bull_use_ema': False, 'bull_use_atr': False, 'bull_use_adx': True, 'bull_use_spike': True, 'bull_rsi_required': False, 'bear_strategy': 'mean_reversion', 'bear_bb_std_mult': 3.117889484411467, 'bear_rsi_os': 20, 'bear_rsi_ob': 47, 'bear_adx_thresh': 33.30994084736118, 'bear_atr_min_pct': 0.01646251269955514, 'bear_atr_max_pct': 0.062247429720985105, 'bear_tp_mult': 2.7984807047334987, 'bear_tsl_mult': 0.6793383204211912, 'bear_time_stop': 125, 'bear_use_sma': False, 'bear_use_ema': False, 'bear_use_atr': True, 'bear_use_adx': True, 'bear_use_spike': True, 'bear_rsi_required': False, 'sideways_strategy': 'mean_reversion', 'sideways_bb_std_mult': 1.1298011226660138, 'sideways_rsi_os': 40, 'sideways_rsi_ob': 94, 'sideways_adx_thresh': 18.029257852000583, 'sideways_atr_min_pct': 0.019781646458847182, 'sideways_atr_max_pct': 0.027316334182869408, 'sideways_tp_mult': 2.8156825728691586, 'sideways_tsl_mult': 0.10719380073120477, 'sideways_time_stop': 20, 'sideways_use_sma': True, 'sideways_use_ema': False, 'sideways_use_atr': False, 'sideways_use_adx': True, 'sideways_use_spike': True, 'sideways_rsi_required': False}.
[I 2025-09-01 08:21:50,984] Trial 383 finished with values: [-1000000000.0, 1000000000.0] and parameters: {'p_sma': 60, 'p_std': 18, 'p_atr': 12, 'p_adx': 24, 'rsi_period': 46, 'ema1': 11, 'ema2': 11, 'slip_atr_k': 0.06244612989731643, 'slip_spread_k': 0.46918941404921494, 'spread_hl_frac': 0.026191577319906005, 'bb_std_mult': 3.543667962618461, 'rsi_os': 28, 'rsi_ob': 64, 'vol_spike': 0.014402550916370549, 'adx_thresh': 25.655803457944593, 'atr_min_pct': 0.003913076449734277, 'atr_max_pct': 0.14990778413488332, 'tp_mult': 1.9849930290851099, 'tsl_mult': 0.14621573336222682, 'strategy': 'mean_reversion', 'time_stop': 235, 'use_sma': True, 'use_atr': False, 'use_adx': False, 'use_ema': False, 'use_spike': True, 'rsi_required': True, 'edge_k': 1.0939593888655785, 'edge_cap': 0.05132670867420613, 'bull_strategy': 'breakout', 'bull_bb_std_mult': 1.0711949095176614, 'bull_rsi_os': 31, 'bull_rsi_ob': 86, 'bull_adx_thresh': 9.327549871329552, 'bull_atr_min_pct': 0.012355272845879943, 'bull_atr_max_pct': 0.04268556110038939, 'bull_tp_mult': 2.0315097565042874, 'bull_tsl_mult': 0.42100365092664355, 'bull_time_stop': 269, 'bull_use_sma': True, 'bull_use_ema': True, 'bull_use_atr': False, 'bull_use_adx': True, 'bull_use_spike': True, 'bull_rsi_required': False, 'bear_strategy': 'breakout', 'bear_bb_std_mult': 3.1745648952948797, 'bear_rsi_os': 13, 'bear_rsi_ob': 94, 'bear_adx_thresh': 17.990786494517025, 'bear_atr_min_pct': 0.02414698920001093, 'bear_atr_max_pct': 0.062358956585203004, 'bear_tp_mult': 2.8013531913579937, 'bear_tsl_mult': 0.05430112185671295, 'bear_time_stop': 155, 'bear_use_sma': False, 'bear_use_ema': False, 'bear_use_atr': False, 'bear_use_adx': True, 'bear_use_spike': True, 'bear_rsi_required': True, 'sideways_strategy': 'breakout', 'sideways_bb_std_mult': 1.8273309644977307, 'sideways_rsi_os': 38, 'sideways_rsi_ob': 51, 'sideways_adx_thresh': 11.158098488303873, 'sideways_atr_min_pct': 0.01974770350306104, 'sideways_atr_max_pct': 0.12435427887864026, 'sideways_tp_mult': 2.523954970665964, 'sideways_tsl_mult': 0.10204096938988066, 'sideways_time_stop': 76, 'sideways_use_sma': True, 'sideways_use_ema': False, 'sideways_use_atr': True, 'sideways_use_adx': False, 'sideways_use_spike': False, 'sideways_rsi_required': False}.
[I 2025-09-01 08:21:52,196] Trial 384 finished with values: [-0.060538759145003174, 0.06152866528432911] and parameters: {'p_sma': 60, 'p_std': 18, 'p_atr': 12, 'p_adx': 16, 'rsi_period': 46, 'ema1': 19, 'ema2': 46, 'slip_atr_k': 0.06344730496526749, 'slip_spread_k': 0.6255997932395496, 'spread_hl_frac': 0.025913111483923067, 'bb_std_mult': 1.562018779024653, 'rsi_os': 23, 'rsi_ob': 72, 'vol_spike': 0.23366450724451962, 'adx_thresh': 25.79763510121288, 'atr_min_pct': 0.021423179933518964, 'atr_max_pct': 0.1478832065433125, 'tp_mult': 1.2974089877992856, 'tsl_mult': 0.47675537390957967, 'strategy': 'mean_reversion', 'time_stop': 234, 'use_sma': True, 'use_atr': False, 'use_adx': False, 'use_ema': True, 'use_spike': False, 'rsi_required': True, 'edge_k': 1.9982784083754548, 'edge_cap': 0.11970544848725839, 'bull_strategy': 'breakout', 'bull_bb_std_mult': 3.1319883815380956, 'bull_rsi_os': 14, 'bull_rsi_ob': 67, 'bull_adx_thresh': 9.407127231407008, 'bull_atr_min_pct': 0.0126255089155492, 'bull_atr_max_pct': 0.04293885760327434, 'bull_tp_mult': 1.450931213294571, 'bull_tsl_mult': 0.16681228940488396, 'bull_time_stop': 75, 'bull_use_sma': False, 'bull_use_ema': True, 'bull_use_atr': True, 'bull_use_adx': True, 'bull_use_spike': False, 'bull_rsi_required': False, 'bear_strategy': 'breakout', 'bear_bb_std_mult': 3.111550011531871, 'bear_rsi_os': 39, 'bear_rsi_ob': 47, 'bear_adx_thresh': 31.336847375806535, 'bear_atr_min_pct': 0.005184875523069026, 'bear_atr_max_pct': 0.0730386271935876, 'bear_tp_mult': 2.8031102494049467, 'bear_tsl_mult': 0.7795279118645518, 'bear_time_stop': 6, 'bear_use_sma': True, 'bear_use_ema': False, 'bear_use_atr': False, 'bear_use_adx': False, 'bear_use_spike': True, 'bear_rsi_required': True, 'sideways_strategy': 'breakout', 'sideways_bb_std_mult': 1.2077915802719188, 'sideways_rsi_os': 5, 'sideways_rsi_ob': 51, 'sideways_adx_thresh': 10.281322028930147, 'sideways_atr_min_pct': 0.023019501232153617, 'sideways_atr_max_pct': 0.03278679666439758, 'sideways_tp_mult': 2.5169866888768837, 'sideways_tsl_mult': 0.5414894355374571, 'sideways_time_stop': 277, 'sideways_use_sma': True, 'sideways_use_ema': False, 'sideways_use_atr': True, 'sideways_use_adx': True, 'sideways_use_spike': True, 'sideways_rsi_required': True}.
[I 2025-09-01 08:21:53,279] Trial 385 finished with values: [-1000000000.0, 1000000000.0] and parameters: {'p_sma': 22, 'p_std': 12, 'p_atr': 18, 'p_adx': 10, 'rsi_period': 65, 'ema1': 10, 'ema2': 12, 'slip_atr_k': 0.06227533871419032, 'slip_spread_k': 0.4584014630876038, 'spread_hl_frac': 0.0046021990391645305, 'bb_std_mult': 2.7800692249446124, 'rsi_os': 6, 'rsi_ob': 71, 'vol_spike': 0.027768853713401362, 'adx_thresh': 26.156747974072015, 'atr_min_pct': 0.004109188567782945, 'atr_max_pct': 0.14999510064863672, 'tp_mult': 1.1928964691723851, 'tsl_mult': 0.9288785707922732, 'strategy': 'breakout', 'time_stop': 234, 'use_sma': True, 'use_atr': False, 'use_adx': False, 'use_ema': True, 'use_spike': False, 'rsi_required': False, 'edge_k': 1.667331844176252, 'edge_cap': 0.6704327031460102, 'bull_strategy': 'breakout', 'bull_bb_std_mult': 3.377431602935625, 'bull_rsi_os': 49, 'bull_rsi_ob': 80, 'bull_adx_thresh': 9.303395352672382, 'bull_atr_min_pct': 0.028065725204157295, 'bull_atr_max_pct': 0.06782775571156786, 'bull_tp_mult': 2.0448911518358384, 'bull_tsl_mult': 0.2566256600067081, 'bull_time_stop': 134, 'bull_use_sma': False, 'bull_use_ema': True, 'bull_use_atr': True, 'bull_use_adx': False, 'bull_use_spike': False, 'bull_rsi_required': False, 'bear_strategy': 'breakout', 'bear_bb_std_mult': 3.1039152328864184, 'bear_rsi_os': 29, 'bear_rsi_ob': 73, 'bear_adx_thresh': 26.239786209160943, 'bear_atr_min_pct': 0.02362710809284712, 'bear_atr_max_pct': 0.08729245268327182, 'bear_tp_mult': 2.792503991523585, 'bear_tsl_mult': 0.11252160386698817, 'bear_time_stop': 104, 'bear_use_sma': True, 'bear_use_ema': False, 'bear_use_atr': False, 'bear_use_adx': False, 'bear_use_spike': True, 'bear_rsi_required': True, 'sideways_strategy': 'breakout', 'sideways_bb_std_mult': 0.6189145055080107, 'sideways_rsi_os': 7, 'sideways_rsi_ob': 61, 'sideways_adx_thresh': 34.8481859634437, 'sideways_atr_min_pct': 0.009457036867671614, 'sideways_atr_max_pct': 0.033422213581197936, 'sideways_tp_mult': 2.018986128371891, 'sideways_tsl_mult': 0.18631370907271916, 'sideways_time_stop': 76, 'sideways_use_sma': True, 'sideways_use_ema': False, 'sideways_use_atr': True, 'sideways_use_adx': True, 'sideways_use_spike': True, 'sideways_rsi_required': True}.
[I 2025-09-01 08:22:36,880] Trial 389 finished with values: [-1000000000.0, 1000000000.0] and parameters: {'p_sma': 57, 'p_std': 14, 'p_atr': 10, 'p_adx': 20, 'rsi_period': 66, 'ema1': 9, 'ema2': 14, 'slip_atr_k': 0.2317644279350815, 'slip_spread_k': 0.4303445211729815, 'spread_hl_frac': 0.008588624103091098, 'bb_std_mult': 3.322181051366561, 'rsi_os': 22, 'rsi_ob': 57, 'vol_spike': 0.15443020732614865, 'adx_thresh': 34.99518228001756, 'atr_min_pct': 0.013286071878159519, 'atr_max_pct': 0.14188341821953493, 'tp_mult': 1.9178193072308591, 'tsl_mult': 0.49183901455271917, 'strategy': 'breakout', 'time_stop': 249, 'use_sma': True, 'use_atr': True, 'use_adx': True, 'use_ema': True, 'use_spike': True, 'rsi_required': False, 'edge_k': 0.4119327446064597, 'edge_cap': 0.4576041571074751, 'bull_strategy': 'breakout', 'bull_bb_std_mult': 2.05153687836397, 'bull_rsi_os': 8, 'bull_rsi_ob': 88, 'bull_adx_thresh': 21.668619595877477, 'bull_atr_min_pct': 0.010174598604598803, 'bull_atr_max_pct': 0.011125489899180524, 'bull_tp_mult': 2.2725937782127428, 'bull_tsl_mult': 0.6516244663190246, 'bull_time_stop': 228, 'bull_use_sma': True, 'bull_use_ema': False, 'bull_use_atr': False, 'bull_use_adx': False, 'bull_use_spike': True, 'bull_rsi_required': True, 'bear_strategy': 'mean_reversion', 'bear_bb_std_mult': 1.4475875721632645, 'bear_rsi_os': 30, 'bear_rsi_ob': 87, 'bear_adx_thresh': 24.56393170424285, 'bear_atr_min_pct': 0.0016381070289802607, 'bear_atr_max_pct': 0.08114270087180407, 'bear_tp_mult': 2.893304980334421, 'bear_tsl_mult': 0.5159772725613682, 'bear_time_stop': 92, 'bear_use_sma': False, 'bear_use_ema': True, 'bear_use_atr': True, 'bear_use_adx': True, 'bear_use_spike': True, 'bear_rsi_required': False, 'sideways_strategy': 'mean_reversion', 'sideways_bb_std_mult': 1.3189916447814594, 'sideways_rsi_os': 40, 'sideways_rsi_ob': 58, 'sideways_adx_thresh': 5.667289790456492, 'sideways_atr_min_pct': 0.02262770360369056, 'sideways_atr_max_pct': 0.02978901883341325, 'sideways_tp_mult': 2.629108094619766, 'sideways_tsl_mult': 0.8547495226361355, 'sideways_time_stop': 33, 'sideways_use_sma': False, 'sideways_use_ema': False, 'sideways_use_atr': False, 'sideways_use_adx': True, 'sideways_use_spike': True, 'sideways_rsi_required': False}.
