[I 2025-09-01 07:39:21,885] Trial 117 finished with values: [-1000000000.0, 1000000000.0] and parameters: {'p_sma': 16, 'p_std': 7, 'p_atr': 13, 'p_adx': 19, 'rsi_period': 69, 'ema1': 8, 'ema2': 14, 'slip_atr_k': 0.07702361665463978, 'slip_spread_k': 0.33898025305407264, 'spread_hl_frac': 0.02773620452323905, 'bb_std_mult': 3.207765715858594, 'rsi_os': 24, 'rsi_ob': 56, 'vol_spike': 0.19096631833731698, 'adx_thresh': 26.243871961901384, 'atr_min_pct': 0.01894143193622623, 'atr_max_pct': 0.1431969131453259, 'tp_mult': 1.1351001678976487, 'tsl_mult': 0.6110556217738997, 'strategy': 'mean_reversion', 'time_stop': 233, 'use_sma': False, 'use_atr': True, 'use_adx': False, 'use_ema': False, 'use_spike': True, 'rsi_required': False, 'edge_k': 0.2877173311613608, 'edge_cap': 0.05016798858121673, 'bull_strategy': 'mean_reversion', 'bull_bb_std_mult': 3.023242577805449, 'bull_rsi_os': 14, 'bull_rsi_ob': 67, 'bull_adx_thresh': 6.135085518801812, 'bull_atr_min_pct': 0.009479379953266687, 'bull_atr_max_pct': 0.034035323556645104, 'bull_tp_mult': 2.4512804178451826, 'bull_tsl_mult': 0.31980861130595395, 'bull_time_stop': 279, 'bull_use_sma': False, 'bull_use_ema': False, 'bull_use_atr': True, 'bull_use_adx': True, 'bull_use_spike': False, 'bull_rsi_required': False, 'bear_strategy': 'mean_reversion', 'bear_bb_std_mult': 3.4336413646483996, 'bear_rsi_os': 24, 'bear_rsi_ob': 91, 'bear_adx_thresh': 28.62478680602876, 'bear_atr_min_pct': 0.025864582080227506, 'bear_atr_max_pct': 0.07376899987358485, 'bear_tp_mult': 2.8912733395195116, 'bear_tsl_mult': 0.03641191496154731, 'bear_time_stop': 177, 'bear_use_sma': False, 'bear_use_ema': False, 'bear_use_atr': True, 'bear_use_adx': True, 'bear_use_spike': True, 'bear_rsi_required': False, 'sideways_strategy': 'mean_reversion', 'sideways_bb_std_mult': 0.685511146759025, 'sideways_rsi_os': 43, 'sideways_rsi_ob': 68, 'sideways_adx_thresh': 7.75041901859317, 'sideways_atr_min_pct': 0.021010262812349436, 'sideways_atr_max_pct': 0.03829991221513456, 'sideways_tp_mult': 2.6283137188305954, 'sideways_tsl_mult': 0.3372667153447839, 'sideways_time_stop': 6, 'sideways_use_sma': False, 'sideways_use_ema': True, 'sideways_use_atr': False, 'sideways_use_adx': False, 'sideways_use_spike': False, 'sideways_rsi_required': False}.
[I 2025-09-01 07:39:22,352] Trial 118 finished with values: [-1000000000.0, 1000000000.0] and parameters: {'p_sma': 15, 'p_std': 19, 'p_atr': 13, 'p_adx': 19, 'rsi_period': 59, 'ema1': 8, 'ema2': 14, 'slip_atr_k': 0.07931373491089128, 'slip_spread_k': 0.05488836797164054, 'spread_hl_frac': 0.017947282790037784, 'bb_std_mult': 3.1729463183891227, 'rsi_os': 23, 'rsi_ob': 83, 'vol_spike': 0.1949683870803871, 'adx_thresh': 26.442371058774185, 'atr_min_pct': 0.015676254289672252, 'atr_max_pct': 0.1445284097353488, 'tp_mult': 1.1610040528737096, 'tsl_mult': 0.5588672204914421, 'strategy': 'mean_reversion', 'time_stop': 231, 'use_sma': False, 'use_atr': True, 'use_adx': False, 'use_ema': False, 'use_spike': True, 'rsi_required': False, 'edge_k': 0.3509709052338138, 'edge_cap': 0.12600258585854196, 'bull_strategy': 'mean_reversion', 'bull_bb_std_mult': 3.0403060615813606, 'bull_rsi_os': 14, 'bull_rsi_ob': 67, 'bull_adx_thresh': 6.460155201110213, 'bull_atr_min_pct': 0.00976823237125457, 'bull_atr_max_pct': 0.03474629357015976, 'bull_tp_mult': 2.2554773497259357, 'bull_tsl_mult': 0.7817616236090089, 'bull_time_stop': 150, 'bull_use_sma': False, 'bull_use_ema': False, 'bull_use_atr': True, 'bull_use_adx': True, 'bull_use_spike': False, 'bull_rsi_required': False, 'bear_strategy': 'mean_reversion', 'bear_bb_std_mult': 3.46111941802805, 'bear_rsi_os': 33, 'bear_rsi_ob': 91, 'bear_adx_thresh': 30.041071928259868, 'bear_atr_min_pct': 0.02177848360994815, 'bear_atr_max_pct': 0.07354243246676374, 'bear_tp_mult': 2.913174637733413, 'bear_tsl_mult': 0.1512756869946506, 'bear_time_stop': 153, 'bear_use_sma': False, 'bear_use_ema': False, 'bear_use_atr': True, 'bear_use_adx': True, 'bear_use_spike': True, 'bear_rsi_required': False, 'sideways_strategy': 'mean_reversion', 'sideways_bb_std_mult': 0.7007249386407757, 'sideways_rsi_os': 36, 'sideways_rsi_ob': 68, 'sideways_adx_thresh': 7.398027103555759, 'sideways_atr_min_pct': 0.02128849212999865, 'sideways_atr_max_pct': 0.039150333129949776, 'sideways_tp_mult': 2.61990287338337, 'sideways_tsl_mult': 0.0014858363993384416, 'sideways_time_stop': 64, 'sideways_use_sma': False, 'sideways_use_ema': True, 'sideways_use_atr': False, 'sideways_use_adx': False, 'sideways_use_spike': False, 'sideways_rsi_required': False}.
[I 2025-09-01 07:39:22,721] Trial 116 finished with values: [-0.023620895162576594, 0.024057027326216007] and parameters: {'p_sma': 15, 'p_std': 21, 'p_atr': 20, 'p_adx': 19, 'rsi_period': 68, 'ema1': 8, 'ema2': 14, 'slip_atr_k': 0.06066064855562749, 'slip_spread_k': 0.0589484734749291, 'spread_hl_frac': 0.025634323314941268, 'bb_std_mult': 3.4348863667068095, 'rsi_os': 21, 'rsi_ob': 85, 'vol_spike': 0.21576541294189783, 'adx_thresh': 29.28321531714849, 'atr_min_pct': 0.018942866966749263, 'atr_max_pct': 0.14896150147835846, 'tp_mult': 2.922186337570051, 'tsl_mult': 0.5583485406861478, 'strategy': 'breakout', 'time_stop': 232, 'use_sma': False, 'use_atr': True, 'use_adx': False, 'use_ema': False, 'use_spike': True, 'rsi_required': False, 'edge_k': 0.2960940224030456, 'edge_cap': 0.35480449902259115, 'bull_strategy': 'mean_reversion', 'bull_bb_std_mult': 3.021529574139543, 'bull_rsi_os': 31, 'bull_rsi_ob': 67, 'bull_adx_thresh': 5.9265506017296214, 'bull_atr_min_pct': 0.003402160652119549, 'bull_atr_max_pct': 0.04019039651911431, 'bull_tp_mult': 2.9229136508710685, 'bull_tsl_mult': 0.956718069023927, 'bull_time_stop': 137, 'bull_use_sma': False, 'bull_use_ema': False, 'bull_use_atr': True, 'bull_use_adx': True, 'bull_use_spike': False, 'bull_rsi_required': False, 'bear_strategy': 'mean_reversion', 'bear_bb_std_mult': 3.30202567526413, 'bear_rsi_os': 29, 'bear_rsi_ob': 91, 'bear_adx_thresh': 28.879142774917, 'bear_atr_min_pct': 0.022265846698882853, 'bear_atr_max_pct': 0.0837065788807903, 'bear_tp_mult': 2.8917454536546816, 'bear_tsl_mult': 0.057038438007335435, 'bear_time_stop': 150, 'bear_use_sma': False, 'bear_use_ema': False, 'bear_use_atr': True, 'bear_use_adx': True, 'bear_use_spike': True, 'bear_rsi_required': False, 'sideways_strategy': 'mean_reversion', 'sideways_bb_std_mult': 0.7183944866841907, 'sideways_rsi_os': 41, 'sideways_rsi_ob': 68, 'sideways_adx_thresh': 10.043570366200324, 'sideways_atr_min_pct': 0.01929557200526719, 'sideways_atr_max_pct': 0.029654191310162746, 'sideways_tp_mult': 2.616148843250911, 'sideways_tsl_mult': 0.2636545754283442, 'sideways_time_stop': 5, 'sideways_use_sma': False, 'sideways_use_ema': True, 'sideways_use_atr': False, 'sideways_use_adx': False, 'sideways_use_spike': False, 'sideways_rsi_required': False}.
[I 2025-09-01 07:39:23,172] Trial 122 finished with values: [-1000000000.0, 1000000000.0] and parameters: {'p_sma': 41, 'p_std': 21, 'p_atr': 12, 'p_adx': 18, 'rsi_period': 62, 'ema1': 6, 'ema2': 45, 'slip_atr_k': 0.15950143661023208, 'slip_spread_k': 0.4935749052957967, 'spread_hl_frac': 0.025227418908299812, 'bb_std_mult': 2.749089915098433, 'rsi_os': 18, 'rsi_ob': 77, 'vol_spike': 0.28849916402079795, 'adx_thresh': 27.962361982067925, 'atr_min_pct': 0.017894423599792052, 'atr_max_pct': 0.01706851239388213, 'tp_mult': 2.940429500405341, 'tsl_mult': 0.46434413498697336, 'strategy': 'mean_reversion', 'time_stop': 238, 'use_sma': True, 'use_atr': True, 'use_adx': True, 'use_ema': True, 'use_spike': True, 'rsi_required': True, 'edge_k': 1.1516133062358143, 'edge_cap': 0.15823331325198667, 'bull_strategy': 'breakout', 'bull_bb_std_mult': 2.897878013735272, 'bull_rsi_os': 31, 'bull_rsi_ob': 71, 'bull_adx_thresh': 9.336778976864522, 'bull_atr_min_pct': 0.022572271617946355, 'bull_atr_max_pct': 0.14506530489113342, 'bull_tp_mult': 2.967410191897447, 'bull_tsl_mult': 0.06391377026219602, 'bull_time_stop': 130, 'bull_use_sma': True, 'bull_use_ema': False, 'bull_use_atr': False, 'bull_use_adx': True, 'bull_use_spike': True, 'bull_rsi_required': False, 'bear_strategy': 'mean_reversion', 'bear_bb_std_mult': 3.3355353143407274, 'bear_rsi_os': 29, 'bear_rsi_ob': 94, 'bear_adx_thresh': 34.514333399401686, 'bear_atr_min_pct': 0.026870245216455056, 'bear_atr_max_pct': 0.08309453960663707, 'bear_tp_mult': 2.8363628528515337, 'bear_tsl_mult': 0.06634518358591424, 'bear_time_stop': 32, 'bear_use_sma': False, 'bear_use_ema': False, 'bear_use_atr': True, 'bear_use_adx': True, 'bear_use_spike': True, 'bear_rsi_required': False, 'sideways_strategy': 'mean_reversion', 'sideways_bb_std_mult': 0.8065990272069787, 'sideways_rsi_os': 39, 'sideways_rsi_ob': 62, 'sideways_adx_thresh': 5.800298883816331, 'sideways_atr_min_pct': 0.024116722236596208, 'sideways_atr_max_pct': 0.02018452487355394, 'sideways_tp_mult': 2.7729916785564352, 'sideways_tsl_mult': 0.11897690230248961, 'sideways_time_stop': 37, 'sideways_use_sma': False, 'sideways_use_ema': False, 'sideways_use_atr': False, 'sideways_use_adx': True, 'sideways_use_spike': True, 'sideways_rsi_required': False}.
[I 2025-09-01 07:40:08,422] Trial 120 finished with values: [-1000000000.0, 1000000000.0] and parameters: {'p_sma': 17, 'p_std': 7, 'p_atr': 13, 'p_adx': 18, 'rsi_period': 60, 'ema1': 8, 'ema2': 44, 'slip_atr_k': 0.07678213288081848, 'slip_spread_k': 0.4292093907893051, 'spread_hl_frac': 0.018854472928236186, 'bb_std_mult': 2.8505785705151467, 'rsi_os': 23, 'rsi_ob': 77, 'vol_spike': 0.2930864458687441, 'adx_thresh': 25.447627991860116, 'atr_min_pct': 0.017699764637447497, 'atr_max_pct': 0.14309577131065937, 'tp_mult': 1.7264633831889173, 'tsl_mult': 0.46904815030895247, 'strategy': 'mean_reversion', 'time_stop': 237, 'use_sma': True, 'use_atr': True, 'use_adx': False, 'use_ema': True, 'use_spike': True, 'rsi_required': True, 'edge_k': 1.1635156703782332, 'edge_cap': 0.05375269418132194, 'bull_strategy': 'breakout', 'bull_bb_std_mult': 2.67090840528648, 'bull_rsi_os': 15, 'bull_rsi_ob': 71, 'bull_adx_thresh': 9.344884170022606, 'bull_atr_min_pct': 0.012367352910588783, 'bull_atr_max_pct': 0.03196063185978058, 'bull_tp_mult': 2.4696583698522994, 'bull_tsl_mult': 0.30421162568039517, 'bull_time_stop': 275, 'bull_use_sma': True, 'bull_use_ema': False, 'bull_use_atr': False, 'bull_use_adx': True, 'bull_use_spike': True, 'bull_rsi_required': False, 'bear_strategy': 'mean_reversion', 'bear_bb_std_mult': 3.5966615621232316, 'bear_rsi_os': 33, 'bear_rsi_ob': 93, 'bear_adx_thresh': 32.04396012948503, 'bear_atr_min_pct': 0.0255337870196979, 'bear_atr_max_pct': 0.0729420004067739, 'bear_tp_mult': 2.8380957554893587, 'bear_tsl_mult': 0.05484500841356796, 'bear_time_stop': 31, 'bear_use_sma': False, 'bear_use_ema': False, 'bear_use_atr': True, 'bear_use_adx': True, 'bear_use_spike': True, 'bear_rsi_required': False, 'sideways_strategy': 'mean_reversion', 'sideways_bb_std_mult': 0.7051417534332226, 'sideways_rsi_os': 39, 'sideways_rsi_ob': 68, 'sideways_adx_thresh': 7.453938755669441, 'sideways_atr_min_pct': 0.02005564485983501, 'sideways_atr_max_pct': 0.026745248766030173, 'sideways_tp_mult': 2.6356925055995393, 'sideways_tsl_mult': 0.0443896715919635, 'sideways_time_stop': 63, 'sideways_use_sma': False, 'sideways_use_ema': False, 'sideways_use_atr': False, 'sideways_use_adx': True, 'sideways_use_spike': True, 'sideways_rsi_required': False}.
[I 2025-09-01 07:40:09,163] Trial 121 finished with values: [-1000000000.0, 1000000000.0] and parameters: {'p_sma': 41, 'p_std': 23, 'p_atr': 11, 'p_adx': 18, 'rsi_period': 16, 'ema1': 8, 'ema2': 13, 'slip_atr_k': 0.20416724806323752, 'slip_spread_k': 0.4282401670782413, 'spread_hl_frac': 0.01886486307675757, 'bb_std_mult': 2.8009411530395796, 'rsi_os': 23, 'rsi_ob': 79, 'vol_spike': 0.2847210619004576, 'adx_thresh': 27.78761154903178, 'atr_min_pct': 0.024302950220868487, 'atr_max_pct': 0.14945458071724893, 'tp_mult': 2.994337826083187, 'tsl_mult': 0.5155968579847912, 'strategy': 'mean_reversion', 'time_stop': 243, 'use_sma': True, 'use_atr': True, 'use_adx': True, 'use_ema': True, 'use_spike': True, 'rsi_required': True, 'edge_k': 1.0944282453286391, 'edge_cap': 0.1285983411624588, 'bull_strategy': 'breakout', 'bull_bb_std_mult': 2.9029869058145725, 'bull_rsi_os': 16, 'bull_rsi_ob': 70, 'bull_adx_thresh': 9.249632917292972, 'bull_atr_min_pct': 0.012618444414453074, 'bull_atr_max_pct': 0.04612140035639611, 'bull_tp_mult': 2.323017905518977, 'bull_tsl_mult': 0.07429283410229864, 'bull_time_stop': 129, 'bull_use_sma': True, 'bull_use_ema': False, 'bull_use_atr': False, 'bull_use_adx': True, 'bull_use_spike': True, 'bull_rsi_required': False, 'bear_strategy': 'mean_reversion', 'bear_bb_std_mult': 3.231947608090431, 'bear_rsi_os': 33, 'bear_rsi_ob': 93, 'bear_adx_thresh': 31.965369719496866, 'bear_atr_min_pct': 0.021613715235670433, 'bear_atr_max_pct': 0.08610353685277275, 'bear_tp_mult': 1.1804219712325275, 'bear_tsl_mult': 0.060173548531205864, 'bear_time_stop': 35, 'bear_use_sma': False, 'bear_use_ema': False, 'bear_use_atr': True, 'bear_use_adx': True, 'bear_use_spike': True, 'bear_rsi_required': False, 'sideways_strategy': 'mean_reversion', 'sideways_bb_std_mult': 0.7851244460814082, 'sideways_rsi_os': 39, 'sideways_rsi_ob': 62, 'sideways_adx_thresh': 5.982469770573408, 'sideways_atr_min_pct': 0.01981754992447301, 'sideways_atr_max_pct': 0.021422330948379153, 'sideways_tp_mult': 2.731262891265471, 'sideways_tsl_mult': 0.03728331479531974, 'sideways_time_stop': 65, 'sideways_use_sma': False, 'sideways_use_ema': False, 'sideways_use_atr': False, 'sideways_use_adx': True, 'sideways_use_spike': True, 'sideways_rsi_required': False}.
[I 2025-09-01 07:40:09,888] Trial 124 finished with values: [-1000000000.0, 1000000000.0] and parameters: {'p_sma': 17, 'p_std': 10, 'p_atr': 11, 'p_adx': 21, 'rsi_period': 16, 'ema1': 10, 'ema2': 28, 'slip_atr_k': 0.051140333820441364, 'slip_spread_k': 0.6622139365327275, 'spread_hl_frac': 0.01907343585871377, 'bb_std_mult': 2.8917123551967365, 'rsi_os': 26, 'rsi_ob': 79, 'vol_spike': 0.23859899173923416, 'adx_thresh': 25.570450296782457, 'atr_min_pct': 0.022804034315844823, 'atr_max_pct': 0.14872161609693332, 'tp_mult': 1.335984608413963, 'tsl_mult': 0.5076167065752478, 'strategy': 'breakout', 'time_stop': 243, 'use_sma': True, 'use_atr': True, 'use_adx': True, 'use_ema': True, 'use_spike': True, 'rsi_required': True, 'edge_k': 1.0788459074680636, 'edge_cap': 0.08084709292505196, 'bull_strategy': 'breakout', 'bull_bb_std_mult': 2.6921897000977624, 'bull_rsi_os': 16, 'bull_rsi_ob': 70, 'bull_adx_thresh': 33.19062573962615, 'bull_atr_min_pct': 0.012132692953790778, 'bull_atr_max_pct': 0.048706859153357915, 'bull_tp_mult': 2.3365728497969256, 'bull_tsl_mult': 0.896882318752389, 'bull_time_stop': 138, 'bull_use_sma': True, 'bull_use_ema': False, 'bull_use_atr': False, 'bull_use_adx': True, 'bull_use_spike': True, 'bull_rsi_required': False, 'bear_strategy': 'mean_reversion', 'bear_bb_std_mult': 2.9746449213235726, 'bear_rsi_os': 26, 'bear_rsi_ob': 92, 'bear_adx_thresh': 32.063811810348476, 'bear_atr_min_pct': 0.023955962986529366, 'bear_atr_max_pct': 0.08662903467705607, 'bear_tp_mult': 2.7563992113871225, 'bear_tsl_mult': 0.0962876991734237, 'bear_time_stop': 145, 'bear_use_sma': False, 'bear_use_ema': False, 'bear_use_atr': True, 'bear_use_adx': True, 'bear_use_spike': True, 'bear_rsi_required': False, 'sideways_strategy': 'mean_reversion', 'sideways_bb_std_mult': 0.5086287411382164, 'sideways_rsi_os': 41, 'sideways_rsi_ob': 66, 'sideways_adx_thresh': 10.255139209107906, 'sideways_atr_min_pct': 0.022127266319531762, 'sideways_atr_max_pct': 0.03299645433842367, 'sideways_tp_mult': 2.683353818201189, 'sideways_tsl_mult': 0.18312714106592276, 'sideways_time_stop': 47, 'sideways_use_sma': False, 'sideways_use_ema': False, 'sideways_use_atr': False, 'sideways_use_adx': True, 'sideways_use_spike': True, 'sideways_rsi_required': False}.
[I 2025-09-01 07:40:10,691] Trial 123 finished with values: [-1000000000.0, 1000000000.0] and parameters: {'p_sma': 17, 'p_std': 16, 'p_atr': 21, 'p_adx': 18, 'rsi_period': 10, 'ema1': 9, 'ema2': 35, 'slip_atr_k': 0.16039905475987742, 'slip_spread_k': 0.9630043407258506, 'spread_hl_frac': 0.009245354149623127, 'bb_std_mult': 2.928561616323625, 'rsi_os': 16, 'rsi_ob': 53, 'vol_spike': 0.24140110345813423, 'adx_thresh': 27.466778414988696, 'atr_min_pct': 0.02042495774510899, 'atr_max_pct': 0.14936632093201418, 'tp_mult': 1.7456351859406853, 'tsl_mult': 0.522651071595661, 'strategy': 'breakout', 'time_stop': 244, 'use_sma': True, 'use_atr': True, 'use_adx': True, 'use_ema': True, 'use_spike': True, 'rsi_required': True, 'edge_k': 1.1095691970708177, 'edge_cap': 0.21848684042866579, 'bull_strategy': 'breakout', 'bull_bb_std_mult': 3.296411682836003, 'bull_rsi_os': 17, 'bull_rsi_ob': 71, 'bull_adx_thresh': 32.2284908407406, 'bull_atr_min_pct': 0.025019412645820818, 'bull_atr_max_pct': 0.048522263831169365, 'bull_tp_mult': 2.825879151850357, 'bull_tsl_mult': 0.8953291594248821, 'bull_time_stop': 126, 'bull_use_sma': True, 'bull_use_ema': False, 'bull_use_atr': False, 'bull_use_adx': True, 'bull_use_spike': True, 'bull_rsi_required': False, 'bear_strategy': 'mean_reversion', 'bear_bb_std_mult': 3.305326276467938, 'bear_rsi_os': 29, 'bear_rsi_ob': 92, 'bear_adx_thresh': 32.08876171707291, 'bear_atr_min_pct': 0.022832120628829267, 'bear_atr_max_pct': 0.08475960593159913, 'bear_tp_mult': 1.813079335862981, 'bear_tsl_mult': 0.05062303219039552, 'bear_time_stop': 124, 'bear_use_sma': False, 'bear_use_ema': False, 'bear_use_atr': True, 'bear_use_adx': True, 'bear_use_spike': True, 'bear_rsi_required': False, 'sideways_strategy': 'mean_reversion', 'sideways_bb_std_mult': 0.8106151632150138, 'sideways_rsi_os': 39, 'sideways_rsi_ob': 62, 'sideways_adx_thresh': 5.9065609621362665, 'sideways_atr_min_pct': 0.019269280384077027, 'sideways_atr_max_pct': 0.034460773284770076, 'sideways_tp_mult': 2.7798644277735622, 'sideways_tsl_mult': 0.10803298067094286, 'sideways_time_stop': 36, 'sideways_use_sma': False, 'sideways_use_ema': False, 'sideways_use_atr': False, 'sideways_use_adx': True, 'sideways_use_spike': True, 'sideways_rsi_required': False}.
[I 2025-09-01 07:40:48,805] Trial 128 finished with values: [-1000000000.0, 1000000000.0] and parameters: {'p_sma': 21, 'p_std': 11, 'p_atr': 14, 'p_adx': 22, 'rsi_period': 72, 'ema1': 10, 'ema2': 10, 'slip_atr_k': 0.041544471574423585, 'slip_spread_k': 0.5966183454659354, 'spread_hl_frac': 0.029304222304312653, 'bb_std_mult': 3.464929873738077, 'rsi_os': 41, 'rsi_ob': 54, 'vol_spike': 0.26448614403424436, 'adx_thresh': 24.45166300231506, 'atr_min_pct': 0.0226796942779911, 'atr_max_pct': 0.11274495723090419, 'tp_mult': 1.2006005882600201, 'tsl_mult': 0.4044138364015467, 'strategy': 'mean_reversion', 'time_stop': 258, 'use_sma': True, 'use_atr': True, 'use_adx': True, 'use_ema': True, 'use_spike': True, 'rsi_required': True, 'edge_k': 0.036794386084637365, 'edge_cap': 0.08632344774974524, 'bull_strategy': 'breakout', 'bull_bb_std_mult': 2.7576464388100015, 'bull_rsi_os': 11, 'bull_rsi_ob': 62, 'bull_adx_thresh': 24.78234168259268, 'bull_atr_min_pct': 0.013592399202625487, 'bull_atr_max_pct': 0.13893786452536516, 'bull_tp_mult': 2.528899143574878, 'bull_tsl_mult': 0.8234227929587066, 'bull_time_stop': 170, 'bull_use_sma': True, 'bull_use_ema': False, 'bull_use_atr': False, 'bull_use_adx': True, 'bull_use_spike': True, 'bull_rsi_required': False, 'bear_strategy': 'mean_reversion', 'bear_bb_std_mult': 2.9754243740698385, 'bear_rsi_os': 35, 'bear_rsi_ob': 88, 'bear_adx_thresh': 20.80539037165657, 'bear_atr_min_pct': 0.022334237648618603, 'bear_atr_max_pct': 0.07894197021912386, 'bear_tp_mult': 2.7792277089692465, 'bear_tsl_mult': 0.1325107171133369, 'bear_time_stop': 132, 'bear_use_sma': False, 'bear_use_ema': False, 'bear_use_atr': True, 'bear_use_adx': True, 'bear_use_spike': True, 'bear_rsi_required': False, 'sideways_strategy': 'mean_reversion', 'sideways_bb_std_mult': 0.5931832431179792, 'sideways_rsi_os': 42, 'sideways_rsi_ob': 64, 'sideways_adx_thresh': 12.135735079704158, 'sideways_atr_min_pct': 0.023183077250504416, 'sideways_atr_max_pct': 0.02936791138557396, 'sideways_tp_mult': 2.4281460306440374, 'sideways_tsl_mult': 0.2413823316350252, 'sideways_time_stop': 26, 'sideways_use_sma': False, 'sideways_use_ema': False, 'sideways_use_atr': False, 'sideways_use_adx': True, 'sideways_use_spike': True, 'sideways_rsi_required': False}.
