[I 2025-09-01 08:16:11,324] Trial 339 finished with values: [-1000000000.0, 1000000000.0] and parameters: {'p_sma': 22, 'p_std': 16, 'p_atr': 19, 'p_adx': 7, 'rsi_period': 68, 'ema1': 12, 'ema2': 12, 'slip_atr_k': 0.08896463780849406, 'slip_spread_k': 0.6878783057446317, 'spread_hl_frac': 0.019442076890268445, 'bb_std_mult': 3.31844009514887, 'rsi_os': 31, 'rsi_ob': 79, 'vol_spike': 0.19716851933453153, 'adx_thresh': 25.880269153907427, 'atr_min_pct': 0.009222361279972353, 'atr_max_pct': 0.040936677775247704, 'tp_mult': 2.837313115965405, 'tsl_mult': 0.6481083383816342, 'strategy': 'mean_reversion', 'time_stop': 216, 'use_sma': True, 'use_atr': True, 'use_adx': True, 'use_ema': True, 'use_spike': True, 'rsi_required': True, 'edge_k': 0.4607126464051683, 'edge_cap': 0.05680121958713141, 'bull_strategy': 'breakout', 'bull_bb_std_mult': 2.966955685156164, 'bull_rsi_os': 10, 'bull_rsi_ob': 69, 'bull_adx_thresh': 7.809829870815751, 'bull_atr_min_pct': 0.01658625605666954, 'bull_atr_max_pct': 0.02057609866169878, 'bull_tp_mult': 2.72152829087894, 'bull_tsl_mult': 0.6423359320122721, 'bull_time_stop': 168, 'bull_use_sma': True, 'bull_use_ema': False, 'bull_use_atr': False, 'bull_use_adx': False, 'bull_use_spike': True, 'bull_rsi_required': False, 'bear_strategy': 'mean_reversion', 'bear_bb_std_mult': 1.1269988805482236, 'bear_rsi_os': 31, 'bear_rsi_ob': 94, 'bear_adx_thresh': 32.82366170024317, 'bear_atr_min_pct': 0.0011102866448932693, 'bear_atr_max_pct': 0.0485079024731597, 'bear_tp_mult': 1.2646507575425763, 'bear_tsl_mult': 0.13202669264509706, 'bear_time_stop': 84, 'bear_use_sma': False, 'bear_use_ema': True, 'bear_use_atr': True, 'bear_use_adx': True, 'bear_use_spike': False, 'bear_rsi_required': False, 'sideways_strategy': 'mean_reversion', 'sideways_bb_std_mult': 2.920622458831682, 'sideways_rsi_os': 20, 'sideways_rsi_ob': 60, 'sideways_adx_thresh': 8.70683138779987, 'sideways_atr_min_pct': 0.02764321358670187, 'sideways_atr_max_pct': 0.06408412478965786, 'sideways_tp_mult': 1.9627208544643833, 'sideways_tsl_mult': 0.7853931031457446, 'sideways_time_stop': 194, 'sideways_use_sma': False, 'sideways_use_ema': True, 'sideways_use_atr': False, 'sideways_use_adx': True, 'sideways_use_spike': True, 'sideways_rsi_required': False}.
[I 2025-09-01 08:16:12,233] Trial 344 finished with values: [-1000000000.0, 1000000000.0] and parameters: {'p_sma': 45, 'p_std': 19, 'p_atr': 12, 'p_adx': 21, 'rsi_period': 56, 'ema1': 6, 'ema2': 11, 'slip_atr_k': 0.03873632621900873, 'slip_spread_k': 0.6949042056440133, 'spread_hl_frac': 0.030908724260876954, 'bb_std_mult': 3.332951636124136, 'rsi_os': 27, 'rsi_ob': 46, 'vol_spike': 0.2274833630935529, 'adx_thresh': 24.397475739816105, 'atr_min_pct': 0.0013553958406740396, 'atr_max_pct': 0.14529933708927753, 'tp_mult': 1.0152452707077395, 'tsl_mult': 0.4987140683453098, 'strategy': 'mean_reversion', 'time_stop': 102, 'use_sma': False, 'use_atr': True, 'use_adx': True, 'use_ema': True, 'use_spike': False, 'rsi_required': True, 'edge_k': 1.708996348828278, 'edge_cap': 0.12293610415960793, 'bull_strategy': 'mean_reversion', 'bull_bb_std_mult': 1.325698589068374, 'bull_rsi_os': 23, 'bull_rsi_ob': 71, 'bull_adx_thresh': 7.693489873592931, 'bull_atr_min_pct': 0.021895753864532082, 'bull_atr_max_pct': 0.04265094169376852, 'bull_tp_mult': 1.8831725013459677, 'bull_tsl_mult': 0.8055852134551136, 'bull_time_stop': 259, 'bull_use_sma': True, 'bull_use_ema': False, 'bull_use_atr': False, 'bull_use_adx': True, 'bull_use_spike': True, 'bull_rsi_required': False, 'bear_strategy': 'breakout', 'bear_bb_std_mult': 3.23703238269339, 'bear_rsi_os': 31, 'bear_rsi_ob': 93, 'bear_adx_thresh': 12.433958609884069, 'bear_atr_min_pct': 0.021981813546393118, 'bear_atr_max_pct': 0.08808183799333197, 'bear_tp_mult': 2.208663015021615, 'bear_tsl_mult': 0.1345403419223509, 'bear_time_stop': 204, 'bear_use_sma': False, 'bear_use_ema': True, 'bear_use_atr': True, 'bear_use_adx': True, 'bear_use_spike': True, 'bear_rsi_required': False, 'sideways_strategy': 'breakout', 'sideways_bb_std_mult': 1.5787054349773821, 'sideways_rsi_os': 26, 'sideways_rsi_ob': 63, 'sideways_adx_thresh': 7.445929501925072, 'sideways_atr_min_pct': 0.025865705935667588, 'sideways_atr_max_pct': 0.06394738085619105, 'sideways_tp_mult': 1.0169133453702037, 'sideways_tsl_mult': 0.6267642212803896, 'sideways_time_stop': 263, 'sideways_use_sma': False, 'sideways_use_ema': False, 'sideways_use_atr': True, 'sideways_use_adx': True, 'sideways_use_spike': False, 'sideways_rsi_required': False}.
[I 2025-09-01 08:16:12,505] Trial 346 finished with values: [-1000000000.0, 1000000000.0] and parameters: {'p_sma': 41, 'p_std': 36, 'p_atr': 11, 'p_adx': 21, 'rsi_period': 61, 'ema1': 16, 'ema2': 18, 'slip_atr_k': 0.10829473125966652, 'slip_spread_k': 0.1957587177744866, 'spread_hl_frac': 0.049797569257902116, 'bb_std_mult': 2.818181688062408, 'rsi_os': 27, 'rsi_ob': 50, 'vol_spike': 0.2272093746239263, 'adx_thresh': 24.36510290299057, 'atr_min_pct': 0.006402942229882986, 'atr_max_pct': 0.14520356346773464, 'tp_mult': 1.044910775565062, 'tsl_mult': 0.9779634255908276, 'strategy': 'mean_reversion', 'time_stop': 253, 'use_sma': False, 'use_atr': False, 'use_adx': False, 'use_ema': False, 'use_spike': False, 'rsi_required': True, 'edge_k': 0.14539320606452877, 'edge_cap': 0.09904535870074636, 'bull_strategy': 'mean_reversion', 'bull_bb_std_mult': 0.6308753220672507, 'bull_rsi_os': 15, 'bull_rsi_ob': 71, 'bull_adx_thresh': 10.124445204166237, 'bull_atr_min_pct': 0.02682026705334503, 'bull_atr_max_pct': 0.04230968960858549, 'bull_tp_mult': 2.3862659938543374, 'bull_tsl_mult': 0.14522484448554462, 'bull_time_stop': 176, 'bull_use_sma': True, 'bull_use_ema': True, 'bull_use_atr': True, 'bull_use_adx': True, 'bull_use_spike': False, 'bull_rsi_required': False, 'bear_strategy': 'breakout', 'bear_bb_std_mult': 1.7480168842931572, 'bear_rsi_os': 22, 'bear_rsi_ob': 93, 'bear_adx_thresh': 28.159006212557337, 'bear_atr_min_pct': 0.022025784477701066, 'bear_atr_max_pct': 0.10022959022064094, 'bear_tp_mult': 1.7404904565211285, 'bear_tsl_mult': 0.5362058957536854, 'bear_time_stop': 104, 'bear_use_sma': False, 'bear_use_ema': False, 'bear_use_atr': True, 'bear_use_adx': True, 'bear_use_spike': True, 'bear_rsi_required': False, 'sideways_strategy': 'breakout', 'sideways_bb_std_mult': 1.9308232643606589, 'sideways_rsi_os': 54, 'sideways_rsi_ob': 87, 'sideways_adx_thresh': 7.298421994285901, 'sideways_atr_min_pct': 0.024839257701867838, 'sideways_atr_max_pct': 0.14321637329162118, 'sideways_tp_mult': 1.1414862759368671, 'sideways_tsl_mult': 0.16779965272305722, 'sideways_time_stop': 134, 'sideways_use_sma': False, 'sideways_use_ema': False, 'sideways_use_atr': True, 'sideways_use_adx': False, 'sideways_use_spike': False, 'sideways_rsi_required': False}.
[I 2025-09-01 08:16:51,129] Trial 343 finished with values: [-1000000000.0, 1000000000.0] and parameters: {'p_sma': 18, 'p_std': 56, 'p_atr': 13, 'p_adx': 19, 'rsi_period': 61, 'ema1': 16, 'ema2': 11, 'slip_atr_k': 0.2272883243535288, 'slip_spread_k': 0.6820358498738892, 'spread_hl_frac': 0.03069994388285238, 'bb_std_mult': 3.3275543610015523, 'rsi_os': 22, 'rsi_ob': 59, 'vol_spike': 0.24870241578991503, 'adx_thresh': 25.790942992978433, 'atr_min_pct': 0.006012551888995786, 'atr_max_pct': 0.05751515172920657, 'tp_mult': 1.6545733786425738, 'tsl_mult': 0.46378110918730264, 'strategy': 'mean_reversion', 'time_stop': 38, 'use_sma': True, 'use_atr': True, 'use_adx': True, 'use_ema': False, 'use_spike': False, 'rsi_required': True, 'edge_k': 0.9328805975445794, 'edge_cap': 0.22677320926132588, 'bull_strategy': 'breakout', 'bull_bb_std_mult': 2.8745351311273115, 'bull_rsi_os': 26, 'bull_rsi_ob': 69, 'bull_adx_thresh': 7.892145406971981, 'bull_atr_min_pct': 0.019673762340413802, 'bull_atr_max_pct': 0.1327469151959737, 'bull_tp_mult': 1.7152720124165575, 'bull_tsl_mult': 0.14209005769432093, 'bull_time_stop': 255, 'bull_use_sma': True, 'bull_use_ema': False, 'bull_use_atr': False, 'bull_use_adx': False, 'bull_use_spike': True, 'bull_rsi_required': False, 'bear_strategy': 'breakout', 'bear_bb_std_mult': 3.209184180964609, 'bear_rsi_os': 30, 'bear_rsi_ob': 71, 'bear_adx_thresh': 13.872821042408713, 'bear_atr_min_pct': 0.024449714203082076, 'bear_atr_max_pct': 0.07561580811697848, 'bear_tp_mult': 1.487183580935532, 'bear_tsl_mult': 0.5387226907132471, 'bear_time_stop': 30, 'bear_use_sma': False, 'bear_use_ema': True, 'bear_use_atr': True, 'bear_use_adx': True, 'bear_use_spike': True, 'bear_rsi_required': False, 'sideways_strategy': 'breakout', 'sideways_bb_std_mult': 3.4253557513107538, 'sideways_rsi_os': 18, 'sideways_rsi_ob': 63, 'sideways_adx_thresh': 10.045919537352004, 'sideways_atr_min_pct': 0.0238851303674727, 'sideways_atr_max_pct': 0.037112766835144424, 'sideways_tp_mult': 2.533960004537408, 'sideways_tsl_mult': 0.3725768831181809, 'sideways_time_stop': 224, 'sideways_use_sma': False, 'sideways_use_ema': False, 'sideways_use_atr': True, 'sideways_use_adx': False, 'sideways_use_spike': False, 'sideways_rsi_required': False}.
[I 2025-09-01 08:16:51,397] Trial 345 finished with values: [-1000000000.0, 1000000000.0] and parameters: {'p_sma': 18, 'p_std': 20, 'p_atr': 12, 'p_adx': 25, 'rsi_period': 61, 'ema1': 6, 'ema2': 18, 'slip_atr_k': 0.048048566407784495, 'slip_spread_k': 0.6874699131056811, 'spread_hl_frac': 0.024722457390345665, 'bb_std_mult': 3.357613744473088, 'rsi_os': 33, 'rsi_ob': 79, 'vol_spike': 0.2296774528736507, 'adx_thresh': 24.242606629520818, 'atr_min_pct': 0.019849300314203743, 'atr_max_pct': 0.11244596232121423, 'tp_mult': 1.1377405167998302, 'tsl_mult': 0.825173768861575, 'strategy': 'mean_reversion', 'time_stop': 255, 'use_sma': False, 'use_atr': False, 'use_adx': False, 'use_ema': False, 'use_spike': False, 'rsi_required': True, 'edge_k': 0.9365816600755208, 'edge_cap': 0.6483948739351153, 'bull_strategy': 'mean_reversion', 'bull_bb_std_mult': 1.331894401416534, 'bull_rsi_os': 10, 'bull_rsi_ob': 59, 'bull_adx_thresh': 7.861322206340593, 'bull_atr_min_pct': 0.019583754965276964, 'bull_atr_max_pct': 0.04181000129075133, 'bull_tp_mult': 2.4634085843641467, 'bull_tsl_mult': 0.6690563858418356, 'bull_time_stop': 256, 'bull_use_sma': True, 'bull_use_ema': True, 'bull_use_atr': False, 'bull_use_adx': True, 'bull_use_spike': True, 'bull_rsi_required': False, 'bear_strategy': 'breakout', 'bear_bb_std_mult': 3.207376203184575, 'bear_rsi_os': 31, 'bear_rsi_ob': 93, 'bear_adx_thresh': 31.990817264413863, 'bear_atr_min_pct': 0.021815480434948353, 'bear_atr_max_pct': 0.09626074015024202, 'bear_tp_mult': 2.8829749036016805, 'bear_tsl_mult': 0.5471290036027527, 'bear_time_stop': 107, 'bear_use_sma': False, 'bear_use_ema': False, 'bear_use_atr': True, 'bear_use_adx': True, 'bear_use_spike': True, 'bear_rsi_required': False, 'sideways_strategy': 'breakout', 'sideways_bb_std_mult': 1.934053571228289, 'sideways_rsi_os': 37, 'sideways_rsi_ob': 63, 'sideways_adx_thresh': 25.532600077756506, 'sideways_atr_min_pct': 0.02155135327275608, 'sideways_atr_max_pct': 0.14296407218835872, 'sideways_tp_mult': 1.8134618463524088, 'sideways_tsl_mult': 0.598777551744225, 'sideways_time_stop': 31, 'sideways_use_sma': False, 'sideways_use_ema': False, 'sideways_use_atr': True, 'sideways_use_adx': False, 'sideways_use_spike': False, 'sideways_rsi_required': False}.
[I 2025-09-01 08:16:51,757] Trial 348 finished with values: [-1000000000.0, 1000000000.0] and parameters: {'p_sma': 18, 'p_std': 59, 'p_atr': 12, 'p_adx': 15, 'rsi_period': 59, 'ema1': 24, 'ema2': 13, 'slip_atr_k': 0.047296622873618584, 'slip_spread_k': 0.8194031564243465, 'spread_hl_frac': 0.011452902986092217, 'bb_std_mult': 1.3586492992458061, 'rsi_os': 22, 'rsi_ob': 58, 'vol_spike': 0.04293391954745822, 'adx_thresh': 17.62761835666284, 'atr_min_pct': 0.004802616045269013, 'atr_max_pct': 0.11124430355740762, 'tp_mult': 1.1443665937839909, 'tsl_mult': 0.08195805376600385, 'strategy': 'breakout', 'time_stop': 245, 'use_sma': True, 'use_atr': True, 'use_adx': True, 'use_ema': True, 'use_spike': True, 'rsi_required': False, 'edge_k': 0.9346236650952182, 'edge_cap': 0.2178614140322226, 'bull_strategy': 'breakout', 'bull_bb_std_mult': 2.8538254834601595, 'bull_rsi_os': 16, 'bull_rsi_ob': 64, 'bull_adx_thresh': 32.021229065105395, 'bull_atr_min_pct': 0.01361483371449319, 'bull_atr_max_pct': 0.03971918060702311, 'bull_tp_mult': 2.7744928036785392, 'bull_tsl_mult': 0.6649641848389869, 'bull_time_stop': 148, 'bull_use_sma': False, 'bull_use_ema': False, 'bull_use_atr': False, 'bull_use_adx': True, 'bull_use_spike': True, 'bull_rsi_required': False, 'bear_strategy': 'mean_reversion', 'bear_bb_std_mult': 3.1299486984198768, 'bear_rsi_os': 22, 'bear_rsi_ob': 95, 'bear_adx_thresh': 31.98961645956679, 'bear_atr_min_pct': 0.02289681122797577, 'bear_atr_max_pct': 0.02507220406152129, 'bear_tp_mult': 2.903623769664297, 'bear_tsl_mult': 0.06810276770948656, 'bear_time_stop': 244, 'bear_use_sma': False, 'bear_use_ema': False, 'bear_use_atr': True, 'bear_use_adx': False, 'bear_use_spike': True, 'bear_rsi_required': False, 'sideways_strategy': 'mean_reversion', 'sideways_bb_std_mult': 3.454900104473575, 'sideways_rsi_os': 38, 'sideways_rsi_ob': 95, 'sideways_adx_thresh': 18.63977585932613, 'sideways_atr_min_pct': 0.023048917561730917, 'sideways_atr_max_pct': 0.022928095458009317, 'sideways_tp_mult': 2.147160932389202, 'sideways_tsl_mult': 0.13895354228558598, 'sideways_time_stop': 30, 'sideways_use_sma': True, 'sideways_use_ema': False, 'sideways_use_atr': False, 'sideways_use_adx': True, 'sideways_use_spike': True, 'sideways_rsi_required': False}.
[I 2025-09-01 08:16:51,923] Trial 347 finished with values: [-1000000000.0, 1000000000.0] and parameters: {'p_sma': 41, 'p_std': 35, 'p_atr': 11, 'p_adx': 19, 'rsi_period': 42, 'ema1': 10, 'ema2': 14, 'slip_atr_k': 0.048131803663499756, 'slip_spread_k': 0.5608982617476804, 'spread_hl_frac': 0.024796034491722727, 'bb_std_mult': 3.405933202211621, 'rsi_os': 10, 'rsi_ob': 62, 'vol_spike': 0.24365697611411308, 'adx_thresh': 7.0125716536543585, 'atr_min_pct': 0.014609066601192357, 'atr_max_pct': 0.12561206079904513, 'tp_mult': 2.234876128602259, 'tsl_mult': 0.5295227923772594, 'strategy': 'breakout', 'time_stop': 39, 'use_sma': True, 'use_atr': False, 'use_adx': False, 'use_ema': False, 'use_spike': False, 'rsi_required': True, 'edge_k': 0.5678279102549892, 'edge_cap': 0.10175920625759478, 'bull_strategy': 'breakout', 'bull_bb_std_mult': 0.6736923437513285, 'bull_rsi_os': 35, 'bull_rsi_ob': 64, 'bull_adx_thresh': 10.879770111515725, 'bull_atr_min_pct': 0.02538967038033322, 'bull_atr_max_pct': 0.0655225774584156, 'bull_tp_mult': 1.5930353405133795, 'bull_tsl_mult': 0.14152001681730725, 'bull_time_stop': 173, 'bull_use_sma': False, 'bull_use_ema': True, 'bull_use_atr': True, 'bull_use_adx': True, 'bull_use_spike': False, 'bull_rsi_required': False, 'bear_strategy': 'breakout', 'bear_bb_std_mult': 2.0709184493407093, 'bear_rsi_os': 22, 'bear_rsi_ob': 93, 'bear_adx_thresh': 27.051643253678034, 'bear_atr_min_pct': 0.017543987695128063, 'bear_atr_max_pct': 0.07674070584691454, 'bear_tp_mult': 2.6665273595901278, 'bear_tsl_mult': 0.8464357418124544, 'bear_time_stop': 32, 'bear_use_sma': False, 'bear_use_ema': False, 'bear_use_atr': True, 'bear_use_adx': False, 'bear_use_spike': True, 'bear_rsi_required': False, 'sideways_strategy': 'breakout', 'sideways_bb_std_mult': 3.1952867516013805, 'sideways_rsi_os': 54, 'sideways_rsi_ob': 57, 'sideways_adx_thresh': 10.055730206380598, 'sideways_atr_min_pct': 0.02297456819780788, 'sideways_atr_max_pct': 0.14444220150634507, 'sideways_tp_mult': 2.53479190503059, 'sideways_tsl_mult': 0.45811866794862033, 'sideways_time_stop': 30, 'sideways_use_sma': False, 'sideways_use_ema': False, 'sideways_use_atr': True, 'sideways_use_adx': False, 'sideways_use_spike': False, 'sideways_rsi_required': False}.
[I 2025-09-01 08:16:52,748] Trial 352 finished with values: [-1000000000.0, 1000000000.0] and parameters: {'p_sma': 20, 'p_std': 18, 'p_atr': 13, 'p_adx': 23, 'rsi_period': 66, 'ema1': 9, 'ema2': 14, 'slip_atr_k': 0.054717137629848235, 'slip_spread_k': 0.6541187079958376, 'spread_hl_frac': 0.022419705167300425, 'bb_std_mult': 0.5024222120949935, 'rsi_os': 34, 'rsi_ob': 48, 'vol_spike': 0.2800526609340404, 'adx_thresh': 32.542895020174775, 'atr_min_pct': 0.018870986379471887, 'atr_max_pct': 0.14769456338227285, 'tp_mult': 1.2575169458611426, 'tsl_mult': 0.6976771200108117, 'strategy': 'mean_reversion', 'time_stop': 236, 'use_sma': True, 'use_atr': True, 'use_adx': True, 'use_ema': True, 'use_spike': True, 'rsi_required': False, 'edge_k': 1.0679712547373377, 'edge_cap': 0.050021302219964134, 'bull_strategy': 'breakout', 'bull_bb_std_mult': 2.7669644980546306, 'bull_rsi_os': 28, 'bull_rsi_ob': 67, 'bull_adx_thresh': 6.699646455572074, 'bull_atr_min_pct': 0.0007863574430950517, 'bull_atr_max_pct': 0.09785859740552576, 'bull_tp_mult': 1.4674730981207977, 'bull_tsl_mult': 0.4573694837278093, 'bull_time_stop': 86, 'bull_use_sma': True, 'bull_use_ema': False, 'bull_use_atr': False, 'bull_use_adx': True, 'bull_use_spike': True, 'bull_rsi_required': True, 'bear_strategy': 'mean_reversion', 'bear_bb_std_mult': 3.3879050334162604, 'bear_rsi_os': 16, 'bear_rsi_ob': 95, 'bear_adx_thresh': 16.40249982099943, 'bear_atr_min_pct': 0.02335853245984754, 'bear_atr_max_pct': 0.07867777514250143, 'bear_tp_mult': 2.8384256030532984, 'bear_tsl_mult': 0.08274750780470601, 'bear_time_stop': 62, 'bear_use_sma': True, 'bear_use_ema': False, 'bear_use_atr': False, 'bear_use_adx': True, 'bear_use_spike': True, 'bear_rsi_required': False, 'sideways_strategy': 'mean_reversion', 'sideways_bb_std_mult': 0.654069785615309, 'sideways_rsi_os': 39, 'sideways_rsi_ob': 70, 'sideways_adx_thresh': 9.101189236702217, 'sideways_atr_min_pct': 0.013993489743277927, 'sideways_atr_max_pct': 0.11485506045481492, 'sideways_tp_mult': 1.0710042652148375, 'sideways_tsl_mult': 0.16805558671295617, 'sideways_time_stop': 23, 'sideways_use_sma': True, 'sideways_use_ema': False, 'sideways_use_atr': False, 'sideways_use_adx': True, 'sideways_use_spike': True, 'sideways_rsi_required': True}.
[I 2025-09-01 08:17:33,527] Trial 350 finished with values: [-1000000000.0, 1000000000.0] and parameters: {'p_sma': 20, 'p_std': 9, 'p_atr': 11, 'p_adx': 23, 'rsi_period': 58, 'ema1': 10, 'ema2': 13, 'slip_atr_k': 0.05727035267314701, 'slip_spread_k': 0.3488609399767964, 'spread_hl_frac': 0.012050310692364598, 'bb_std_mult': 0.5023344033845185, 'rsi_os': 25, 'rsi_ob': 58, 'vol_spike': 0.24205280922218003, 'adx_thresh': 17.20873898608296, 'atr_min_pct': 0.012107813023183082, 'atr_max_pct': 0.14695855441987907, 'tp_mult': 1.2446555612691128, 'tsl_mult': 0.44132187010147067, 'strategy': 'breakout', 'time_stop': 247, 'use_sma': True, 'use_atr': True, 'use_adx': True, 'use_ema': True, 'use_spike': True, 'rsi_required': False, 'edge_k': 1.0683348010794091, 'edge_cap': 0.08049557115343452, 'bull_strategy': 'breakout', 'bull_bb_std_mult': 2.750542586921586, 'bull_rsi_os': 35, 'bull_rsi_ob': 67, 'bull_adx_thresh': 12.666109042006957, 'bull_atr_min_pct': 0.00887502653990546, 'bull_atr_max_pct': 0.03816723267342801, 'bull_tp_mult': 2.7781498098188755, 'bull_tsl_mult': 0.6057931160864294, 'bull_time_stop': 54, 'bull_use_sma': False, 'bull_use_ema': False, 'bull_use_atr': True, 'bull_use_adx': True, 'bull_use_spike': False, 'bull_rsi_required': True, 'bear_strategy': 'mean_reversion', 'bear_bb_std_mult': 3.419927080897847, 'bear_rsi_os': 22, 'bear_rsi_ob': 54, 'bear_adx_thresh': 33.901167947819985, 'bear_atr_min_pct': 0.02289176071788738, 'bear_atr_max_pct': 0.013643897848999123, 'bear_tp_mult': 2.671873399403246, 'bear_tsl_mult': 0.07279282109266982, 'bear_time_stop': 243, 'bear_use_sma': True, 'bear_use_ema': False, 'bear_use_atr': False, 'bear_use_adx': False, 'bear_use_spike': True, 'bear_rsi_required': False, 'sideways_strategy': 'mean_reversion', 'sideways_bb_std_mult': 0.6366376844717945, 'sideways_rsi_os': 39, 'sideways_rsi_ob': 80, 'sideways_adx_thresh': 9.285125718715893, 'sideways_atr_min_pct': 0.022962506974153717, 'sideways_atr_max_pct': 0.02546234192303268, 'sideways_tp_mult': 2.5589513302980857, 'sideways_tsl_mult': 0.14338131508557853, 'sideways_time_stop': 25, 'sideways_use_sma': True, 'sideways_use_ema': False, 'sideways_use_atr': False, 'sideways_use_adx': True, 'sideways_use_spike': True, 'sideways_rsi_required': True}.
