[I 2025-09-01 08:09:50,918] Trial 307 finished with values: [-1000000000.0, 1000000000.0] and parameters: {'p_sma': 30, 'p_std': 28, 'p_atr': 10, 'p_adx': 20, 'rsi_period': 61, 'ema1': 8, 'ema2': 11, 'slip_atr_k': 0.0613540318614681, 'slip_spread_k': 0.6458411675119395, 'spread_hl_frac': 0.0015076475729378265, 'bb_std_mult': 1.7428360473033861, 'rsi_os': 23, 'rsi_ob': 52, 'vol_spike': 0.18850467167513663, 'adx_thresh': 25.34156449130564, 'atr_min_pct': 0.021248664447549418, 'atr_max_pct': 0.14315543545151982, 'tp_mult': 1.229426996774367, 'tsl_mult': 0.477601380540839, 'strategy': 'mean_reversion', 'time_stop': 46, 'use_sma': False, 'use_atr': True, 'use_adx': True, 'use_ema': True, 'use_spike': True, 'rsi_required': True, 'edge_k': 1.1637755984535663, 'edge_cap': 0.09066846193523379, 'bull_strategy': 'mean_reversion', 'bull_bb_std_mult': 2.9446363604116, 'bull_rsi_os': 16, 'bull_rsi_ob': 69, 'bull_adx_thresh': 13.424572443464395, 'bull_atr_min_pct': 0.015985230896327633, 'bull_atr_max_pct': 0.051020307064785095, 'bull_tp_mult': 2.412048852709719, 'bull_tsl_mult': 0.07958449396536643, 'bull_time_stop': 103, 'bull_use_sma': True, 'bull_use_ema': False, 'bull_use_atr': False, 'bull_use_adx': True, 'bull_use_spike': True, 'bull_rsi_required': False, 'bear_strategy': 'breakout', 'bear_bb_std_mult': 1.9131640170725492, 'bear_rsi_os': 41, 'bear_rsi_ob': 58, 'bear_adx_thresh': 11.497039381717675, 'bear_atr_min_pct': 0.02799335661815493, 'bear_atr_max_pct': 0.08512999640680172, 'bear_tp_mult': 2.845919370969237, 'bear_tsl_mult': 0.3142854339856828, 'bear_time_stop': 74, 'bear_use_sma': False, 'bear_use_ema': False, 'bear_use_atr': True, 'bear_use_adx': True, 'bear_use_spike': True, 'bear_rsi_required': False, 'sideways_strategy': 'mean_reversion', 'sideways_bb_std_mult': 0.7745872533413433, 'sideways_rsi_os': 38, 'sideways_rsi_ob': 62, 'sideways_adx_thresh': 8.987368898157001, 'sideways_atr_min_pct': 0.02186125051545252, 'sideways_atr_max_pct': 0.034923806624539575, 'sideways_tp_mult': 1.6641153896140584, 'sideways_tsl_mult': 0.15033962558547595, 'sideways_time_stop': 17, 'sideways_use_sma': True, 'sideways_use_ema': False, 'sideways_use_atr': False, 'sideways_use_adx': True, 'sideways_use_spike': True, 'sideways_rsi_required': False}.
[I 2025-09-01 08:09:51,575] Trial 306 finished with values: [-1000000000.0, 1000000000.0] and parameters: {'p_sma': 30, 'p_std': 15, 'p_atr': 10, 'p_adx': 20, 'rsi_period': 60, 'ema1': 12, 'ema2': 11, 'slip_atr_k': 0.06226997875489679, 'slip_spread_k': 0.6463601899861865, 'spread_hl_frac': 0.023456570060485134, 'bb_std_mult': 3.3133752924117474, 'rsi_os': 23, 'rsi_ob': 55, 'vol_spike': 0.15837600786462375, 'adx_thresh': 8.167905144576647, 'atr_min_pct': 0.011281044383340816, 'atr_max_pct': 0.14371572478629827, 'tp_mult': 1.8105092558166158, 'tsl_mult': 0.4846602098186821, 'strategy': 'mean_reversion', 'time_stop': 21, 'use_sma': False, 'use_atr': True, 'use_adx': True, 'use_ema': True, 'use_spike': True, 'rsi_required': True, 'edge_k': 1.4099909634311212, 'edge_cap': 0.2667628550445165, 'bull_strategy': 'mean_reversion', 'bull_bb_std_mult': 0.8923432435965286, 'bull_rsi_os': 12, 'bull_rsi_ob': 69, 'bull_adx_thresh': 8.944711424022271, 'bull_atr_min_pct': 0.014394856077046986, 'bull_atr_max_pct': 0.043445437764753084, 'bull_tp_mult': 2.4585946501453853, 'bull_tsl_mult': 0.6020653947251544, 'bull_time_stop': 99, 'bull_use_sma': True, 'bull_use_ema': False, 'bull_use_atr': False, 'bull_use_adx': True, 'bull_use_spike': True, 'bull_rsi_required': False, 'bear_strategy': 'breakout', 'bear_bb_std_mult': 1.9156657834885582, 'bear_rsi_os': 55, 'bear_rsi_ob': 74, 'bear_adx_thresh': 32.197146174954725, 'bear_atr_min_pct': 0.027609168936435995, 'bear_atr_max_pct': 0.08465069131612059, 'bear_tp_mult': 2.836922983348624, 'bear_tsl_mult': 0.12154272206958569, 'bear_time_stop': 75, 'bear_use_sma': False, 'bear_use_ema': False, 'bear_use_atr': True, 'bear_use_adx': True, 'bear_use_spike': True, 'bear_rsi_required': False, 'sideways_strategy': 'mean_reversion', 'sideways_bb_std_mult': 0.7561374129568015, 'sideways_rsi_os': 38, 'sideways_rsi_ob': 54, 'sideways_adx_thresh': 8.965754522391274, 'sideways_atr_min_pct': 0.02202438162278561, 'sideways_atr_max_pct': 0.034153673413653066, 'sideways_tp_mult': 2.606867367721569, 'sideways_tsl_mult': 0.5807522522167854, 'sideways_time_stop': 16, 'sideways_use_sma': True, 'sideways_use_ema': False, 'sideways_use_atr': False, 'sideways_use_adx': True, 'sideways_use_spike': True, 'sideways_rsi_required': False}.
[I 2025-09-01 08:09:51,825] Trial 308 finished with values: [-1000000000.0, 1000000000.0] and parameters: {'p_sma': 19, 'p_std': 15, 'p_atr': 14, 'p_adx': 20, 'rsi_period': 63, 'ema1': 13, 'ema2': 13, 'slip_atr_k': 0.04205254198648261, 'slip_spread_k': 0.4671273048934033, 'spread_hl_frac': 0.04816953882622429, 'bb_std_mult': 1.7385283137272047, 'rsi_os': 23, 'rsi_ob': 67, 'vol_spike': 0.21367260228675988, 'adx_thresh': 25.253508085364526, 'atr_min_pct': 0.021730813113196898, 'atr_max_pct': 0.14685961774296633, 'tp_mult': 2.647707634968067, 'tsl_mult': 0.47822987034621106, 'strategy': 'breakout', 'time_stop': 50, 'use_sma': True, 'use_atr': True, 'use_adx': True, 'use_ema': True, 'use_spike': True, 'rsi_required': True, 'edge_k': 1.153061600088002, 'edge_cap': 0.36744191616843036, 'bull_strategy': 'breakout', 'bull_bb_std_mult': 2.9636917781981746, 'bull_rsi_os': 28, 'bull_rsi_ob': 52, 'bull_adx_thresh': 33.589499215695554, 'bull_atr_min_pct': 0.00911526535749394, 'bull_atr_max_pct': 0.04152994299631469, 'bull_tp_mult': 2.42148262070072, 'bull_tsl_mult': 0.22062872157174418, 'bull_time_stop': 159, 'bull_use_sma': True, 'bull_use_ema': False, 'bull_use_atr': False, 'bull_use_adx': True, 'bull_use_spike': True, 'bull_rsi_required': False, 'bear_strategy': 'breakout', 'bear_bb_std_mult': 3.154802587869742, 'bear_rsi_os': 41, 'bear_rsi_ob': 93, 'bear_adx_thresh': 32.32740266086495, 'bear_atr_min_pct': 0.020223264522633976, 'bear_atr_max_pct': 0.0855423799314287, 'bear_tp_mult': 1.6661715833333761, 'bear_tsl_mult': 0.12736694872592413, 'bear_time_stop': 76, 'bear_use_sma': False, 'bear_use_ema': False, 'bear_use_atr': True, 'bear_use_adx': True, 'bear_use_spike': True, 'bear_rsi_required': False, 'sideways_strategy': 'mean_reversion', 'sideways_bb_std_mult': 3.592992772588727, 'sideways_rsi_os': 41, 'sideways_rsi_ob': 62, 'sideways_adx_thresh': 33.183916184598445, 'sideways_atr_min_pct': 0.02203777343433695, 'sideways_atr_max_pct': 0.03511167223590349, 'sideways_tp_mult': 2.3937652397861626, 'sideways_tsl_mult': 0.27970099580882823, 'sideways_time_stop': 17, 'sideways_use_sma': False, 'sideways_use_ema': False, 'sideways_use_atr': False, 'sideways_use_adx': True, 'sideways_use_spike': True, 'sideways_rsi_required': False}.
[I 2025-09-01 08:09:52,019] Trial 309 finished with values: [-1000000000.0, 1000000000.0] and parameters: {'p_sma': 40, 'p_std': 35, 'p_atr': 20, 'p_adx': 20, 'rsi_period': 10, 'ema1': 11, 'ema2': 47, 'slip_atr_k': 0.04212969619408438, 'slip_spread_k': 0.6490924417269791, 'spread_hl_frac': 0.022923942037443443, 'bb_std_mult': 2.155873450781976, 'rsi_os': 40, 'rsi_ob': 52, 'vol_spike': 0.07609883216483189, 'adx_thresh': 19.85096044357089, 'atr_min_pct': 0.021095367671624787, 'atr_max_pct': 0.1381488268003298, 'tp_mult': 2.659549183334039, 'tsl_mult': 0.48956593740545534, 'strategy': 'breakout', 'time_stop': 48, 'use_sma': True, 'use_atr': True, 'use_adx': True, 'use_ema': True, 'use_spike': True, 'rsi_required': True, 'edge_k': 0.2457546460011062, 'edge_cap': 0.3712300115866024, 'bull_strategy': 'breakout', 'bull_bb_std_mult': 2.792640309491752, 'bull_rsi_os': 16, 'bull_rsi_ob': 92, 'bull_adx_thresh': 13.434297127749495, 'bull_atr_min_pct': 0.014543457151864874, 'bull_atr_max_pct': 0.11272398266434769, 'bull_tp_mult': 2.54567748667342, 'bull_tsl_mult': 0.07147392072509501, 'bull_time_stop': 159, 'bull_use_sma': True, 'bull_use_ema': False, 'bull_use_atr': False, 'bull_use_adx': True, 'bull_use_spike': True, 'bull_rsi_required': False, 'bear_strategy': 'breakout', 'bear_bb_std_mult': 3.210867880954408, 'bear_rsi_os': 28, 'bear_rsi_ob': 81, 'bear_adx_thresh': 26.39065028518575, 'bear_atr_min_pct': 0.01688326915351654, 'bear_atr_max_pct': 0.08619315475243128, 'bear_tp_mult': 2.848482714862263, 'bear_tsl_mult': 0.12436410868886247, 'bear_time_stop': 292, 'bear_use_sma': False, 'bear_use_ema': False, 'bear_use_atr': True, 'bear_use_adx': True, 'bear_use_spike': True, 'bear_rsi_required': False, 'sideways_strategy': 'mean_reversion', 'sideways_bb_std_mult': 0.5789293286515742, 'sideways_rsi_os': 38, 'sideways_rsi_ob': 78, 'sideways_adx_thresh': 8.88068676320523, 'sideways_atr_min_pct': 0.023530950189024076, 'sideways_atr_max_pct': 0.03595181845602757, 'sideways_tp_mult': 2.946560217920097, 'sideways_tsl_mult': 0.12446711400739158, 'sideways_time_stop': 105, 'sideways_use_sma': False, 'sideways_use_ema': False, 'sideways_use_atr': False, 'sideways_use_adx': True, 'sideways_use_spike': True, 'sideways_rsi_required': False}.
[I 2025-09-01 08:09:52,737] Trial 313 finished with values: [-1000000000.0, 1000000000.0] and parameters: {'p_sma': 16, 'p_std': 45, 'p_atr': 8, 'p_adx': 16, 'rsi_period': 35, 'ema1': 18, 'ema2': 17, 'slip_atr_k': 0.07226523603943834, 'slip_spread_k': 0.6944284480534878, 'spread_hl_frac': 0.007832141844936524, 'bb_std_mult': 3.5253880045706127, 'rsi_os': 54, 'rsi_ob': 71, 'vol_spike': 0.004299029194497622, 'adx_thresh': 25.831208211069136, 'atr_min_pct': 0.026432786137825043, 'atr_max_pct': 0.1342205874112496, 'tp_mult': 1.228849929625499, 'tsl_mult': 0.21164359292684193, 'strategy': 'mean_reversion', 'time_stop': 259, 'use_sma': True, 'use_atr': False, 'use_adx': False, 'use_ema': False, 'use_spike': False, 'rsi_required': True, 'edge_k': 1.0419052049735786, 'edge_cap': 0.42953636027290876, 'bull_strategy': 'breakout', 'bull_bb_std_mult': 1.8754434406407068, 'bull_rsi_os': 24, 'bull_rsi_ob': 66, 'bull_adx_thresh': 32.61907177763136, 'bull_atr_min_pct': 0.017856366525452184, 'bull_atr_max_pct': 0.045337850652157514, 'bull_tp_mult': 2.1417171752424413, 'bull_tsl_mult': 0.6742228681117015, 'bull_time_stop': 171, 'bull_use_sma': True, 'bull_use_ema': True, 'bull_use_atr': False, 'bull_use_adx': False, 'bull_use_spike': True, 'bull_rsi_required': True, 'bear_strategy': 'mean_reversion', 'bear_bb_std_mult': 3.1335813215714197, 'bear_rsi_os': 26, 'bear_rsi_ob': 94, 'bear_adx_thresh': 30.420838235344323, 'bear_atr_min_pct': 0.02211963952287458, 'bear_atr_max_pct': 0.07677823842138747, 'bear_tp_mult': 2.241245804396426, 'bear_tsl_mult': 0.06756351080196862, 'bear_time_stop': 103, 'bear_use_sma': False, 'bear_use_ema': True, 'bear_use_atr': True, 'bear_use_adx': False, 'bear_use_spike': False, 'bear_rsi_required': False, 'sideways_strategy': 'breakout', 'sideways_bb_std_mult': 0.5128475587733861, 'sideways_rsi_os': 15, 'sideways_rsi_ob': 68, 'sideways_adx_thresh': 10.020452648773874, 'sideways_atr_min_pct': 0.0236060582037753, 'sideways_atr_max_pct': 0.03140647166355347, 'sideways_tp_mult': 2.86329752876933, 'sideways_tsl_mult': 0.07921511542759507, 'sideways_time_stop': 29, 'sideways_use_sma': False, 'sideways_use_ema': True, 'sideways_use_atr': True, 'sideways_use_adx': False, 'sideways_use_spike': False, 'sideways_rsi_required': False}.
[I 2025-09-01 08:10:33,880] Trial 311 finished with values: [-1000000000.0, 1000000000.0] and parameters: {'p_sma': 16, 'p_std': 40, 'p_atr': 11, 'p_adx': 16, 'rsi_period': 31, 'ema1': 14, 'ema2': 15, 'slip_atr_k': 0.04719435114562976, 'slip_spread_k': 0.7075555564680533, 'spread_hl_frac': 0.022748242256428363, 'bb_std_mult': 1.425340041039738, 'rsi_os': 21, 'rsi_ob': 58, 'vol_spike': 0.25313239910924684, 'adx_thresh': 25.923755015662408, 'atr_min_pct': 0.0030382422704836407, 'atr_max_pct': 0.13442693883181828, 'tp_mult': 1.3606868571364505, 'tsl_mult': 0.21123219553070594, 'strategy': 'mean_reversion', 'time_stop': 165, 'use_sma': True, 'use_atr': False, 'use_adx': False, 'use_ema': False, 'use_spike': False, 'rsi_required': True, 'edge_k': 0.23273202060528075, 'edge_cap': 0.4326481486592779, 'bull_strategy': 'breakout', 'bull_bb_std_mult': 2.74900603941086, 'bull_rsi_os': 33, 'bull_rsi_ob': 67, 'bull_adx_thresh': 9.682694746695015, 'bull_atr_min_pct': 0.02444961769322163, 'bull_atr_max_pct': 0.1148769647145026, 'bull_tp_mult': 2.070965456321322, 'bull_tsl_mult': 0.6734338504942973, 'bull_time_stop': 170, 'bull_use_sma': True, 'bull_use_ema': True, 'bull_use_atr': False, 'bull_use_adx': True, 'bull_use_spike': True, 'bull_rsi_required': True, 'bear_strategy': 'mean_reversion', 'bear_bb_std_mult': 3.198207800438971, 'bear_rsi_os': 28, 'bear_rsi_ob': 67, 'bear_adx_thresh': 30.27001162850243, 'bear_atr_min_pct': 0.021935929525189204, 'bear_atr_max_pct': 0.04105801030150844, 'bear_tp_mult': 2.7640134866045725, 'bear_tsl_mult': 0.9347321125879218, 'bear_time_stop': 86, 'bear_use_sma': False, 'bear_use_ema': True, 'bear_use_atr': True, 'bear_use_adx': True, 'bear_use_spike': False, 'bear_rsi_required': False, 'sideways_strategy': 'breakout', 'sideways_bb_std_mult': 0.5122757223489387, 'sideways_rsi_os': 39, 'sideways_rsi_ob': 68, 'sideways_adx_thresh': 30.304030259362012, 'sideways_atr_min_pct': 0.023472385738944432, 'sideways_atr_max_pct': 0.030451978703436074, 'sideways_tp_mult': 2.6751066631297573, 'sideways_tsl_mult': 0.07864016112133665, 'sideways_time_stop': 45, 'sideways_use_sma': False, 'sideways_use_ema': False, 'sideways_use_atr': True, 'sideways_use_adx': False, 'sideways_use_spike': True, 'sideways_rsi_required': False}.
[I 2025-09-01 08:10:34,421] Trial 312 finished with values: [-1000000000.0, 1000000000.0] and parameters: {'p_sma': 20, 'p_std': 13, 'p_atr': 8, 'p_adx': 29, 'rsi_period': 77, 'ema1': 18, 'ema2': 48, 'slip_atr_k': 0.21896085485954392, 'slip_spread_k': 0.6974580930157158, 'spread_hl_frac': 0.013591290138311056, 'bb_std_mult': 3.5126645274880985, 'rsi_os': 26, 'rsi_ob': 94, 'vol_spike': 0.2559842539855788, 'adx_thresh': 20.70215302158374, 'atr_min_pct': 0.004108830473566166, 'atr_max_pct': 0.025588323809682588, 'tp_mult': 1.2269737724412302, 'tsl_mult': 0.34103124908367133, 'strategy': 'mean_reversion', 'time_stop': 258, 'use_sma': True, 'use_atr': False, 'use_adx': False, 'use_ema': False, 'use_spike': False, 'rsi_required': True, 'edge_k': 1.0484250537366495, 'edge_cap': 0.6792268088608219, 'bull_strategy': 'breakout', 'bull_bb_std_mult': 1.4597691036155944, 'bull_rsi_os': 55, 'bull_rsi_ob': 67, 'bull_adx_thresh': 25.645199622095145, 'bull_atr_min_pct': 0.02436491037515149, 'bull_atr_max_pct': 0.09207502007417394, 'bull_tp_mult': 1.9681201120384917, 'bull_tsl_mult': 0.9071632294987522, 'bull_time_stop': 264, 'bull_use_sma': True, 'bull_use_ema': True, 'bull_use_atr': False, 'bull_use_adx': False, 'bull_use_spike': True, 'bull_rsi_required': True, 'bear_strategy': 'mean_reversion', 'bear_bb_std_mult': 3.134195270755215, 'bear_rsi_os': 29, 'bear_rsi_ob': 65, 'bear_adx_thresh': 30.409264767367798, 'bear_atr_min_pct': 0.0127403431071643, 'bear_atr_max_pct': 0.042042277938725815, 'bear_tp_mult': 2.7749833592378783, 'bear_tsl_mult': 0.06627045449503324, 'bear_time_stop': 87, 'bear_use_sma': False, 'bear_use_ema': True, 'bear_use_atr': True, 'bear_use_adx': False, 'bear_use_spike': False, 'bear_rsi_required': False, 'sideways_strategy': 'breakout', 'sideways_bb_std_mult': 1.1753525235478062, 'sideways_rsi_os': 39, 'sideways_rsi_ob': 48, 'sideways_adx_thresh': 10.214074714535498, 'sideways_atr_min_pct': 0.023073517205386692, 'sideways_atr_max_pct': 0.03077365740056874, 'sideways_tp_mult': 2.554833850116123, 'sideways_tsl_mult': 0.176006029473474, 'sideways_time_stop': 30, 'sideways_use_sma': False, 'sideways_use_ema': True, 'sideways_use_atr': True, 'sideways_use_adx': False, 'sideways_use_spike': False, 'sideways_rsi_required': False}.
[I 2025-09-01 08:10:34,551] Trial 310 finished with values: [-1000000000.0, 1000000000.0] and parameters: {'p_sma': 16, 'p_std': 15, 'p_atr': 20, 'p_adx': 20, 'rsi_period': 63, 'ema1': 10, 'ema2': 48, 'slip_atr_k': 0.047178355792853816, 'slip_spread_k': 0.6467462833219252, 'spread_hl_frac': 0.023480807621928695, 'bb_std_mult': 1.4174740506620602, 'rsi_os': 24, 'rsi_ob': 57, 'vol_spike': 0.2130216285752778, 'adx_thresh': 20.977730296097352, 'atr_min_pct': 0.021940549812552754, 'atr_max_pct': 0.13396515658947628, 'tp_mult': 1.8047559670388604, 'tsl_mult': 0.24907665113140404, 'strategy': 'breakout', 'time_stop': 259, 'use_sma': True, 'use_atr': False, 'use_adx': False, 'use_ema': True, 'use_spike': True, 'rsi_required': True, 'edge_k': 0.2510472091137156, 'edge_cap': 0.43555949220518486, 'bull_strategy': 'breakout', 'bull_bb_std_mult': 1.8647375731577964, 'bull_rsi_os': 12, 'bull_rsi_ob': 65, 'bull_adx_thresh': 9.13047262608312, 'bull_atr_min_pct': 0.014329708726179877, 'bull_atr_max_pct': 0.04293967664279782, 'bull_tp_mult': 2.111688025224489, 'bull_tsl_mult': 0.6831779764780077, 'bull_time_stop': 157, 'bull_use_sma': True, 'bull_use_ema': True, 'bull_use_atr': False, 'bull_use_adx': True, 'bull_use_spike': True, 'bull_rsi_required': True, 'bear_strategy': 'mean_reversion', 'bear_bb_std_mult': 3.2198278420826734, 'bear_rsi_os': 29, 'bear_rsi_ob': 73, 'bear_adx_thresh': 30.669075455457477, 'bear_atr_min_pct': 0.01265792563984266, 'bear_atr_max_pct': 0.08837658318542423, 'bear_tp_mult': 1.7081741788098606, 'bear_tsl_mult': 0.9100018501853357, 'bear_time_stop': 292, 'bear_use_sma': False, 'bear_use_ema': False, 'bear_use_atr': True, 'bear_use_adx': True, 'bear_use_spike': False, 'bear_rsi_required': False, 'sideways_strategy': 'mean_reversion', 'sideways_bb_std_mult': 0.6020903532580024, 'sideways_rsi_os': 15, 'sideways_rsi_ob': 54, 'sideways_adx_thresh': 25.98728507321635, 'sideways_atr_min_pct': 0.023513339543707677, 'sideways_atr_max_pct': 0.030743861700327245, 'sideways_tp_mult': 2.941042228148764, 'sideways_tsl_mult': 0.1880545874072101, 'sideways_time_stop': 45, 'sideways_use_sma': False, 'sideways_use_ema': False, 'sideways_use_atr': False, 'sideways_use_adx': True, 'sideways_use_spike': True, 'sideways_rsi_required': False}.
[I 2025-09-01 08:10:34,738] Trial 314 finished with values: [-1000000000.0, 1000000000.0] and parameters: {'p_sma': 20, 'p_std': 40, 'p_atr': 11, 'p_adx': 29, 'rsi_period': 63, 'ema1': 14, 'ema2': 48, 'slip_atr_k': 0.2222039413687414, 'slip_spread_k': 0.4150183346213693, 'spread_hl_frac': 0.02424703920015425, 'bb_std_mult': 3.3907947563671543, 'rsi_os': 20, 'rsi_ob': 73, 'vol_spike': 0.17893594065859095, 'adx_thresh': 13.76386717417759, 'atr_min_pct': 0.0031284892512793254, 'atr_max_pct': 0.14720906828994867, 'tp_mult': 2.3888533934064506, 'tsl_mult': 0.3385585460633478, 'strategy': 'mean_reversion', 'time_stop': 244, 'use_sma': True, 'use_atr': False, 'use_adx': False, 'use_ema': True, 'use_spike': True, 'rsi_required': False, 'edge_k': 0.9979316993471768, 'edge_cap': 0.0723432913705698, 'bull_strategy': 'breakout', 'bull_bb_std_mult': 2.542661819743775, 'bull_rsi_os': 14, 'bull_rsi_ob': 70, 'bull_adx_thresh': 9.686543491603597, 'bull_atr_min_pct': 0.005779545371487723, 'bull_atr_max_pct': 0.03789570465091176, 'bull_tp_mult': 2.592952138613931, 'bull_tsl_mult': 0.6605710695236884, 'bull_time_stop': 142, 'bull_use_sma': True, 'bull_use_ema': True, 'bull_use_atr': True, 'bull_use_adx': True, 'bull_use_spike': False, 'bull_rsi_required': True, 'bear_strategy': 'mean_reversion', 'bear_bb_std_mult': 3.2263457751026223, 'bear_rsi_os': 25, 'bear_rsi_ob': 95, 'bear_adx_thresh': 22.71299363603757, 'bear_atr_min_pct': 0.005970961991274625, 'bear_atr_max_pct': 0.07915049675565969, 'bear_tp_mult': 1.1523629913511937, 'bear_tsl_mult': 0.6747214524619101, 'bear_time_stop': 87, 'bear_use_sma': False, 'bear_use_ema': False, 'bear_use_atr': True, 'bear_use_adx': True, 'bear_use_spike': False, 'bear_rsi_required': False, 'sideways_strategy': 'mean_reversion', 'sideways_bb_std_mult': 1.7690070473702075, 'sideways_rsi_os': 39, 'sideways_rsi_ob': 73, 'sideways_adx_thresh': 29.820618775247148, 'sideways_atr_min_pct': 0.018263859528928617, 'sideways_atr_max_pct': 0.049484856731019725, 'sideways_tp_mult': 2.5498128787100653, 'sideways_tsl_mult': 0.4227022433912272, 'sideways_time_stop': 250, 'sideways_use_sma': False, 'sideways_use_ema': False, 'sideways_use_atr': False, 'sideways_use_adx': True, 'sideways_use_spike': True, 'sideways_rsi_required': False}.
