[I 2025-09-01 07:34:40,719] Trial 88 finished with values: [-1000000000.0, 1000000000.0] and parameters: {'p_sma': 11, 'p_std': 42, 'p_atr': 29, 'p_adx': 23, 'rsi_period': 11, 'ema1': 26, 'ema2': 50, 'slip_atr_k': 0.09891008628153637, 'slip_spread_k': 0.5152293720708764, 'spread_hl_frac': 0.025946581100603962, 'bb_std_mult': 2.9803230499283195, 'rsi_os': 37, 'rsi_ob': 54, 'vol_spike': 0.1562262296680558, 'adx_thresh': 24.102108836150627, 'atr_min_pct': 0.022033426072420363, 'atr_max_pct': 0.0824308395678128, 'tp_mult': 1.8179392548386384, 'tsl_mult': 0.7836999382780181, 'strategy': 'mean_reversion', 'time_stop': 263, 'use_sma': True, 'use_atr': False, 'use_adx': True, 'use_ema': True, 'use_spike': False, 'rsi_required': False, 'edge_k': 1.8824888186505704, 'edge_cap': 0.5582638155485483, 'bull_strategy': 'breakout', 'bull_bb_std_mult': 1.7403141117874175, 'bull_rsi_os': 55, 'bull_rsi_ob': 86, 'bull_adx_thresh': 30.590664206327975, 'bull_atr_min_pct': 0.018894523932021998, 'bull_atr_max_pct': 0.08682072988427945, 'bull_tp_mult': 2.654496819128767, 'bull_tsl_mult': 0.6401698017806019, 'bull_time_stop': 44, 'bull_use_sma': True, 'bull_use_ema': True, 'bull_use_atr': True, 'bull_use_adx': True, 'bull_use_spike': False, 'bull_rsi_required': False, 'bear_strategy': 'mean_reversion', 'bear_bb_std_mult': 2.190088039737523, 'bear_rsi_os': 14, 'bear_rsi_ob': 68, 'bear_adx_thresh': 14.666197203442813, 'bear_atr_min_pct': 0.014435257589803342, 'bear_atr_max_pct': 0.06436088259153108, 'bear_tp_mult': 2.294305265653311, 'bear_tsl_mult': 0.5932347030759442, 'bear_time_stop': 61, 'bear_use_sma': True, 'bear_use_ema': True, 'bear_use_atr': False, 'bear_use_adx': True, 'bear_use_spike': False, 'bear_rsi_required': True, 'sideways_strategy': 'breakout', 'sideways_bb_std_mult': 2.0198780809366057, 'sideways_rsi_os': 22, 'sideways_rsi_ob': 63, 'sideways_adx_thresh': 12.947266820282966, 'sideways_atr_min_pct': 0.02070072624989326, 'sideways_atr_max_pct': 0.03677088562911649, 'sideways_tp_mult': 1.7760174582629615, 'sideways_tsl_mult': 0.7294184885346372, 'sideways_time_stop': 132, 'sideways_use_sma': True, 'sideways_use_ema': False, 'sideways_use_atr': True, 'sideways_use_adx': True, 'sideways_use_spike': True, 'sideways_rsi_required': True}.
[I 2025-09-01 07:34:41,152] Trial 91 finished with values: [-1000000000.0, 1000000000.0] and parameters: {'p_sma': 14, 'p_std': 34, 'p_atr': 25, 'p_adx': 24, 'rsi_period': 31, 'ema1': 24, 'ema2': 50, 'slip_atr_k': 0.06616391272227226, 'slip_spread_k': 0.582401870666795, 'spread_hl_frac': 0.02041911294616481, 'bb_std_mult': 1.6299014037762614, 'rsi_os': 27, 'rsi_ob': 49, 'vol_spike': 0.10203856134953682, 'adx_thresh': 19.92678575283603, 'atr_min_pct': 0.011101921968373202, 'atr_max_pct': 0.08157381283436123, 'tp_mult': 1.1640579215714133, 'tsl_mult': 0.5541620173576594, 'strategy': 'breakout', 'time_stop': 205, 'use_sma': False, 'use_atr': False, 'use_adx': True, 'use_ema': True, 'use_spike': False, 'rsi_required': True, 'edge_k': 1.2194997003451975, 'edge_cap': 0.9306750586562516, 'bull_strategy': 'breakout', 'bull_bb_std_mult': 0.8550055659365583, 'bull_rsi_os': 35, 'bull_rsi_ob': 86, 'bull_adx_thresh': 25.86208970203116, 'bull_atr_min_pct': 0.002398812028788328, 'bull_atr_max_pct': 0.10102038312280284, 'bull_tp_mult': 2.2722707939240254, 'bull_tsl_mult': 0.5459459476740001, 'bull_time_stop': 162, 'bull_use_sma': False, 'bull_use_ema': True, 'bull_use_atr': True, 'bull_use_adx': True, 'bull_use_spike': False, 'bull_rsi_required': False, 'bear_strategy': 'mean_reversion', 'bear_bb_std_mult': 2.535719347732019, 'bear_rsi_os': 23, 'bear_rsi_ob': 60, 'bear_adx_thresh': 25.275576181854653, 'bear_atr_min_pct': 0.01975793902600296, 'bear_atr_max_pct': 0.038598313916629864, 'bear_tp_mult': 1.3297841471216303, 'bear_tsl_mult': 0.34049751487008256, 'bear_time_stop': 87, 'bear_use_sma': False, 'bear_use_ema': False, 'bear_use_atr': True, 'bear_use_adx': True, 'bear_use_spike': False, 'bear_rsi_required': True, 'sideways_strategy': 'breakout', 'sideways_bb_std_mult': 2.11363981172892, 'sideways_rsi_os': 23, 'sideways_rsi_ob': 60, 'sideways_adx_thresh': 31.501018156745424, 'sideways_atr_min_pct': 0.018984938104799703, 'sideways_atr_max_pct': 0.053001887767160055, 'sideways_tp_mult': 2.2002866876478198, 'sideways_tsl_mult': 0.6418127824378698, 'sideways_time_stop': 192, 'sideways_use_sma': False, 'sideways_use_ema': True, 'sideways_use_atr': True, 'sideways_use_adx': True, 'sideways_use_spike': False, 'sideways_rsi_required': False}.
[I 2025-09-01 07:34:41,561] Trial 93 finished with values: [-1000000000.0, 1000000000.0] and parameters: {'p_sma': 27, 'p_std': 13, 'p_atr': 13, 'p_adx': 16, 'rsi_period': 68, 'ema1': 14, 'ema2': 50, 'slip_atr_k': 0.06504269731114551, 'slip_spread_k': 0.6743740132331724, 'spread_hl_frac': 0.04510234173186506, 'bb_std_mult': 1.4208462543943838, 'rsi_os': 34, 'rsi_ob': 49, 'vol_spike': 0.2606556419968645, 'adx_thresh': 21.30076268793431, 'atr_min_pct': 0.010623240798601169, 'atr_max_pct': 0.011374084585832597, 'tp_mult': 1.1595105040472788, 'tsl_mult': 0.7894468772850175, 'strategy': 'mean_reversion', 'time_stop': 161, 'use_sma': True, 'use_atr': False, 'use_adx': True, 'use_ema': True, 'use_spike': False, 'rsi_required': True, 'edge_k': 1.2126489858153409, 'edge_cap': 0.8961804810301628, 'bull_strategy': 'breakout', 'bull_bb_std_mult': 2.0496682332258915, 'bull_rsi_os': 47, 'bull_rsi_ob': 81, 'bull_adx_thresh': 23.00147834799145, 'bull_atr_min_pct': 0.019081329421372376, 'bull_atr_max_pct': 0.08552071995525225, 'bull_tp_mult': 2.3870354080631575, 'bull_tsl_mult': 0.4300819834358852, 'bull_time_stop': 187, 'bull_use_sma': True, 'bull_use_ema': True, 'bull_use_atr': False, 'bull_use_adx': False, 'bull_use_spike': True, 'bull_rsi_required': False, 'bear_strategy': 'breakout', 'bear_bb_std_mult': 2.5252913077226635, 'bear_rsi_os': 23, 'bear_rsi_ob': 87, 'bear_adx_thresh': 30.453510877074137, 'bear_atr_min_pct': 0.01990354347728512, 'bear_atr_max_pct': 0.034130574766147316, 'bear_tp_mult': 2.7807539045407994, 'bear_tsl_mult': 0.33061582421299684, 'bear_time_stop': 61, 'bear_use_sma': True, 'bear_use_ema': True, 'bear_use_atr': True, 'bear_use_adx': False, 'bear_use_spike': False, 'bear_rsi_required': True, 'sideways_strategy': 'mean_reversion', 'sideways_bb_std_mult': 2.2780935074223, 'sideways_rsi_os': 23, 'sideways_rsi_ob': 63, 'sideways_adx_thresh': 10.765109048769, 'sideways_atr_min_pct': 0.02807534071296932, 'sideways_atr_max_pct': 0.05453006472314366, 'sideways_tp_mult': 1.8279489837802079, 'sideways_tsl_mult': 0.7944621334226152, 'sideways_time_stop': 148, 'sideways_use_sma': False, 'sideways_use_ema': True, 'sideways_use_atr': False, 'sideways_use_adx': True, 'sideways_use_spike': True, 'sideways_rsi_required': True}.
[I 2025-09-01 07:34:41,788] Trial 95 finished with values: [-1000000000.0, 1000000000.0] and parameters: {'p_sma': 7, 'p_std': 13, 'p_atr': 29, 'p_adx': 25, 'rsi_period': 80, 'ema1': 12, 'ema2': 17, 'slip_atr_k': 0.046236607754231315, 'slip_spread_k': 0.07194266082475553, 'spread_hl_frac': 0.044936957849593846, 'bb_std_mult': 1.444936070582056, 'rsi_os': 6, 'rsi_ob': 64, 'vol_spike': 0.25767547228128374, 'adx_thresh': 25.554554970187375, 'atr_min_pct': 0.017834108644906616, 'atr_max_pct': 0.012334439837475564, 'tp_mult': 2.6484839221562373, 'tsl_mult': 0.3543075876242327, 'strategy': 'mean_reversion', 'time_stop': 163, 'use_sma': True, 'use_atr': True, 'use_adx': True, 'use_ema': True, 'use_spike': True, 'rsi_required': True, 'edge_k': 0.9605921142374074, 'edge_cap': 0.6263389282219045, 'bull_strategy': 'breakout', 'bull_bb_std_mult': 0.6570780126227864, 'bull_rsi_os': 51, 'bull_rsi_ob': 81, 'bull_adx_thresh': 27.772189778151173, 'bull_atr_min_pct': 0.0052540216585439895, 'bull_atr_max_pct': 0.13040137863400691, 'bull_tp_mult': 2.436089439981231, 'bull_tsl_mult': 0.9795175799516176, 'bull_time_stop': 188, 'bull_use_sma': True, 'bull_use_ema': False, 'bull_use_atr': False, 'bull_use_adx': False, 'bull_use_spike': True, 'bull_rsi_required': False, 'bear_strategy': 'breakout', 'bear_bb_std_mult': 1.433295341951296, 'bear_rsi_os': 33, 'bear_rsi_ob': 55, 'bear_adx_thresh': 11.068335277931297, 'bear_atr_min_pct': 0.016413763400205943, 'bear_atr_max_pct': 0.014489674960533053, 'bear_tp_mult': 2.7816551593255716, 'bear_tsl_mult': 0.29531389495326077, 'bear_time_stop': 295, 'bear_use_sma': True, 'bear_use_ema': True, 'bear_use_atr': True, 'bear_use_adx': False, 'bear_use_spike': True, 'bear_rsi_required': False, 'sideways_strategy': 'mean_reversion', 'sideways_bb_std_mult': 1.8788375017433365, 'sideways_rsi_os': 49, 'sideways_rsi_ob': 78, 'sideways_adx_thresh': 10.802441335791485, 'sideways_atr_min_pct': 0.024697194243185405, 'sideways_atr_max_pct': 0.011420196662199358, 'sideways_tp_mult': 1.454400016516472, 'sideways_tsl_mult': 0.5138842218217685, 'sideways_time_stop': 142, 'sideways_use_sma': True, 'sideways_use_ema': True, 'sideways_use_atr': False, 'sideways_use_adx': True, 'sideways_use_spike': True, 'sideways_rsi_required': True}.
[I 2025-09-01 07:34:41,822] Trial 92 finished with values: [-1000000000.0, 1000000000.0] and parameters: {'p_sma': 7, 'p_std': 49, 'p_atr': 28, 'p_adx': 16, 'rsi_period': 25, 'ema1': 14, 'ema2': 54, 'slip_atr_k': 0.08519260990435723, 'slip_spread_k': 0.25746439518141606, 'spread_hl_frac': 0.0021977974517884136, 'bb_std_mult': 1.641103979106351, 'rsi_os': 37, 'rsi_ob': 49, 'vol_spike': 0.13351733761466902, 'adx_thresh': 21.189940471475026, 'atr_min_pct': 0.010724191889197694, 'atr_max_pct': 0.01002201499877095, 'tp_mult': 1.0100382565879733, 'tsl_mult': 0.7752635945501012, 'strategy': 'mean_reversion', 'time_stop': 202, 'use_sma': True, 'use_atr': False, 'use_adx': True, 'use_ema': True, 'use_spike': False, 'rsi_required': True, 'edge_k': 1.031446354848099, 'edge_cap': 0.8951946173381078, 'bull_strategy': 'breakout', 'bull_bb_std_mult': 0.7071311485513567, 'bull_rsi_os': 53, 'bull_rsi_ob': 81, 'bull_adx_thresh': 8.786178456988516, 'bull_atr_min_pct': 0.019201523145456464, 'bull_atr_max_pct': 0.08605712640649188, 'bull_tp_mult': 1.4728223741333735, 'bull_tsl_mult': 0.07524041782994656, 'bull_time_stop': 202, 'bull_use_sma': True, 'bull_use_ema': True, 'bull_use_atr': True, 'bull_use_adx': True, 'bull_use_spike': False, 'bull_rsi_required': False, 'bear_strategy': 'breakout', 'bear_bb_std_mult': 2.53262724995154, 'bear_rsi_os': 11, 'bear_rsi_ob': 59, 'bear_adx_thresh': 14.561347105819422, 'bear_atr_min_pct': 0.010446316709492654, 'bear_atr_max_pct': 0.06422076352210965, 'bear_tp_mult': 1.2969245298525651, 'bear_tsl_mult': 0.5297440466863756, 'bear_time_stop': 295, 'bear_use_sma': False, 'bear_use_ema': False, 'bear_use_atr': True, 'bear_use_adx': True, 'bear_use_spike': False, 'bear_rsi_required': True, 'sideways_strategy': 'breakout', 'sideways_bb_std_mult': 1.9121420719096156, 'sideways_rsi_os': 23, 'sideways_rsi_ob': 60, 'sideways_adx_thresh': 31.611554762544444, 'sideways_atr_min_pct': 0.029626158910222362, 'sideways_atr_max_pct': 0.054430504859364855, 'sideways_tp_mult': 1.7729312013979248, 'sideways_tsl_mult': 0.3167111096246381, 'sideways_time_stop': 149, 'sideways_use_sma': False, 'sideways_use_ema': True, 'sideways_use_atr': True, 'sideways_use_adx': True, 'sideways_use_spike': True, 'sideways_rsi_required': False}.
[I 2025-09-01 07:35:20,573] Trial 96 finished with values: [-1000000000.0, 1000000000.0] and parameters: {'p_sma': 6, 'p_std': 36, 'p_atr': 28, 'p_adx': 21, 'rsi_period': 82, 'ema1': 7, 'ema2': 54, 'slip_atr_k': 0.045985171941999956, 'slip_spread_k': 0.2827233799899432, 'spread_hl_frac': 0.030030469334678588, 'bb_std_mult': 1.736385545704544, 'rsi_os': 6, 'rsi_ob': 67, 'vol_spike': 0.27775208585649036, 'adx_thresh': 7.366145848167514, 'atr_min_pct': 0.0126684861273366, 'atr_max_pct': 0.13347953599179027, 'tp_mult': 1.5437539762117456, 'tsl_mult': 0.6258072155531821, 'strategy': 'mean_reversion', 'time_stop': 189, 'use_sma': True, 'use_atr': True, 'use_adx': True, 'use_ema': True, 'use_spike': True, 'rsi_required': True, 'edge_k': 1.0344445982127006, 'edge_cap': 0.7893111375463516, 'bull_strategy': 'breakout', 'bull_bb_std_mult': 1.4474679725089592, 'bull_rsi_os': 10, 'bull_rsi_ob': 90, 'bull_adx_thresh': 34.48070057371973, 'bull_atr_min_pct': 0.0006408902592656847, 'bull_atr_max_pct': 0.1280587706351817, 'bull_tp_mult': 1.4763575341661608, 'bull_tsl_mult': 0.9883273485983537, 'bull_time_stop': 147, 'bull_use_sma': True, 'bull_use_ema': False, 'bull_use_atr': False, 'bull_use_adx': False, 'bull_use_spike': True, 'bull_rsi_required': False, 'bear_strategy': 'breakout', 'bear_bb_std_mult': 1.482972475231247, 'bear_rsi_os': 52, 'bear_rsi_ob': 50, 'bear_adx_thresh': 10.713999382478603, 'bear_atr_min_pct': 0.009466206046323058, 'bear_atr_max_pct': 0.05086518523100032, 'bear_tp_mult': 2.68160758792338, 'bear_tsl_mult': 0.2920995962682998, 'bear_time_stop': 187, 'bear_use_sma': False, 'bear_use_ema': False, 'bear_use_atr': False, 'bear_use_adx': False, 'bear_use_spike': True, 'bear_rsi_required': False, 'sideways_strategy': 'mean_reversion', 'sideways_bb_std_mult': 1.8891392561667428, 'sideways_rsi_os': 26, 'sideways_rsi_ob': 75, 'sideways_adx_thresh': 24.764439626005935, 'sideways_atr_min_pct': 0.013092095954137104, 'sideways_atr_max_pct': 0.06165310272137044, 'sideways_tp_mult': 1.4788874489236297, 'sideways_tsl_mult': 0.5144973719482625, 'sideways_time_stop': 140, 'sideways_use_sma': True, 'sideways_use_ema': False, 'sideways_use_atr': False, 'sideways_use_adx': True, 'sideways_use_spike': True, 'sideways_rsi_required': False}.
[I 2025-09-01 07:35:21,211] Trial 98 finished with values: [-1000000000.0, 1000000000.0] and parameters: {'p_sma': 54, 'p_std': 25, 'p_atr': 16, 'p_adx': 21, 'rsi_period': 46, 'ema1': 6, 'ema2': 40, 'slip_atr_k': 0.02065805932404688, 'slip_spread_k': 0.774307082493839, 'spread_hl_frac': 0.03897401735082153, 'bb_std_mult': 2.042300946854763, 'rsi_os': 7, 'rsi_ob': 67, 'vol_spike': 0.12089248163434163, 'adx_thresh': 7.231516587811518, 'atr_min_pct': 0.012517913933401945, 'atr_max_pct': 0.022202209297083157, 'tp_mult': 1.5143948232556574, 'tsl_mult': 0.12354122261877176, 'strategy': 'mean_reversion', 'time_stop': 177, 'use_sma': True, 'use_atr': True, 'use_adx': True, 'use_ema': True, 'use_spike': True, 'rsi_required': True, 'edge_k': 0.8823950194116998, 'edge_cap': 0.7270457587893637, 'bull_strategy': 'breakout', 'bull_bb_std_mult': 1.4506049786503548, 'bull_rsi_os': 10, 'bull_rsi_ob': 90, 'bull_adx_thresh': 15.037469249776343, 'bull_atr_min_pct': 0.02720517389811427, 'bull_atr_max_pct': 0.02893731790947568, 'bull_tp_mult': 1.9535378246027022, 'bull_tsl_mult': 0.166162445464703, 'bull_time_stop': 251, 'bull_use_sma': True, 'bull_use_ema': False, 'bull_use_atr': False, 'bull_use_adx': False, 'bull_use_spike': True, 'bull_rsi_required': True, 'bear_strategy': 'breakout', 'bear_bb_std_mult': 2.796908894418953, 'bear_rsi_os': 19, 'bear_rsi_ob': 46, 'bear_adx_thresh': 13.660997889674597, 'bear_atr_min_pct': 0.02083424295572258, 'bear_atr_max_pct': 0.051352000214448454, 'bear_tp_mult': 2.6852148489080023, 'bear_tsl_mult': 0.24639766331258497, 'bear_time_stop': 118, 'bear_use_sma': False, 'bear_use_ema': True, 'bear_use_atr': False, 'bear_use_adx': False, 'bear_use_spike': True, 'bear_rsi_required': False, 'sideways_strategy': 'mean_reversion', 'sideways_bb_std_mult': 3.0448329076689706, 'sideways_rsi_os': 26, 'sideways_rsi_ob': 67, 'sideways_adx_thresh': 25.02772557614774, 'sideways_atr_min_pct': 0.011628042514191587, 'sideways_atr_max_pct': 0.06337010385670283, 'sideways_tp_mult': 1.8794955350511584, 'sideways_tsl_mult': 0.6741182203801325, 'sideways_time_stop': 140, 'sideways_use_sma': True, 'sideways_use_ema': False, 'sideways_use_atr': False, 'sideways_use_adx': False, 'sideways_use_spike': True, 'sideways_rsi_required': False}.
[I 2025-09-01 07:35:21,732] Trial 97 finished with values: [-0.08932470573836504, 0.0888963710506066] and parameters: {'p_sma': 51, 'p_std': 53, 'p_atr': 28, 'p_adx': 21, 'rsi_period': 47, 'ema1': 7, 'ema2': 54, 'slip_atr_k': 0.02043026594361942, 'slip_spread_k': 0.7719519431465528, 'spread_hl_frac': 0.04620543393070253, 'bb_std_mult': 1.725944115751031, 'rsi_os': 5, 'rsi_ob': 68, 'vol_spike': 0.1207773259741647, 'adx_thresh': 23.23424017151129, 'atr_min_pct': 0.012750403690418978, 'atr_max_pct': 0.025844807018434925, 'tp_mult': 1.5344747983404181, 'tsl_mult': 0.17309586343780017, 'strategy': 'mean_reversion', 'time_stop': 213, 'use_sma': True, 'use_atr': True, 'use_adx': True, 'use_ema': True, 'use_spike': True, 'rsi_required': True, 'edge_k': 1.0413325722736393, 'edge_cap': 0.7816160754775464, 'bull_strategy': 'breakout', 'bull_bb_std_mult': 2.166916406701771, 'bull_rsi_os': 53, 'bull_rsi_ob': 94, 'bull_adx_thresh': 14.901065602010382, 'bull_atr_min_pct': 0.0007192432157508135, 'bull_atr_max_pct': 0.01382732399604971, 'bull_tp_mult': 2.1036211799024738, 'bull_tsl_mult': 0.700857413931125, 'bull_time_stop': 244, 'bull_use_sma': True, 'bull_use_ema': False, 'bull_use_atr': False, 'bull_use_adx': False, 'bull_use_spike': True, 'bull_rsi_required': True, 'bear_strategy': 'breakout', 'bear_bb_std_mult': 2.591729242240084, 'bear_rsi_os': 18, 'bear_rsi_ob': 50, 'bear_adx_thresh': 15.46460929057147, 'bear_atr_min_pct': 0.010257486129735559, 'bear_atr_max_pct': 0.11827425836858727, 'bear_tp_mult': 2.3946884272467446, 'bear_tsl_mult': 0.2661198225205006, 'bear_time_stop': 76, 'bear_use_sma': False, 'bear_use_ema': False, 'bear_use_atr': False, 'bear_use_adx': False, 'bear_use_spike': True, 'bear_rsi_required': False, 'sideways_strategy': 'mean_reversion', 'sideways_bb_std_mult': 0.7905032589716521, 'sideways_rsi_os': 26, 'sideways_rsi_ob': 67, 'sideways_adx_thresh': 21.55818852025173, 'sideways_atr_min_pct': 0.012930632647083308, 'sideways_atr_max_pct': 0.11683087119238074, 'sideways_tp_mult': 2.702158254885906, 'sideways_tsl_mult': 0.3096820842130792, 'sideways_time_stop': 58, 'sideways_use_sma': True, 'sideways_use_ema': False, 'sideways_use_atr': False, 'sideways_use_adx': True, 'sideways_use_spike': True, 'sideways_rsi_required': False}.
[I 2025-09-01 07:35:22,199] Trial 94 finished with values: [-1000000000.0, 1000000000.0] and parameters: {'p_sma': 26, 'p_std': 13, 'p_atr': 28, 'p_adx': 25, 'rsi_period': 30, 'ema1': 12, 'ema2': 16, 'slip_atr_k': 0.0675135603806668, 'slip_spread_k': 0.6736196821214988, 'spread_hl_frac': 0.020098167984338916, 'bb_std_mult': 1.6273330046119165, 'rsi_os': 6, 'rsi_ob': 67, 'vol_spike': 0.2790891091812964, 'adx_thresh': 21.125071110011188, 'atr_min_pct': 0.009729236824901736, 'atr_max_pct': 0.05535213903111874, 'tp_mult': 1.501154723569667, 'tsl_mult': 0.5395170644303322, 'strategy': 'mean_reversion', 'time_stop': 162, 'use_sma': True, 'use_atr': True, 'use_adx': True, 'use_ema': True, 'use_spike': True, 'rsi_required': True, 'edge_k': 1.038636252134131, 'edge_cap': 0.9308860434726961, 'bull_strategy': 'breakout', 'bull_bb_std_mult': 1.4535051135234232, 'bull_rsi_os': 53, 'bull_rsi_ob': 75, 'bull_adx_thresh': 8.904118057647455, 'bull_atr_min_pct': 0.005483665679611982, 'bull_atr_max_pct': 0.027839942816058408, 'bull_tp_mult': 2.430148111547376, 'bull_tsl_mult': 0.17209979896527772, 'bull_time_stop': 245, 'bull_use_sma': True, 'bull_use_ema': False, 'bull_use_atr': False, 'bull_use_adx': False, 'bull_use_spike': True, 'bull_rsi_required': False, 'bear_strategy': 'breakout', 'bear_bb_std_mult': 2.5105854822511526, 'bear_rsi_os': 23, 'bear_rsi_ob': 50, 'bear_adx_thresh': 13.490904076285464, 'bear_atr_min_pct': 0.005148737261542217, 'bear_atr_max_pct': 0.015969666125259584, 'bear_tp_mult': 2.690902186545695, 'bear_tsl_mult': 0.3413583417377291, 'bear_time_stop': 189, 'bear_use_sma': False, 'bear_use_ema': False, 'bear_use_atr': True, 'bear_use_adx': False, 'bear_use_spike': True, 'bear_rsi_required': True, 'sideways_strategy': 'mean_reversion', 'sideways_bb_std_mult': 2.306133677192693, 'sideways_rsi_os': 45, 'sideways_rsi_ob': 60, 'sideways_adx_thresh': 11.542821676421289, 'sideways_atr_min_pct': 0.025033212052158076, 'sideways_atr_max_pct': 0.05370624778042485, 'sideways_tp_mult': 2.2056505183853923, 'sideways_tsl_mult': 0.4046536875317786, 'sideways_time_stop': 148, 'sideways_use_sma': False, 'sideways_use_ema': True, 'sideways_use_atr': False, 'sideways_use_adx': True, 'sideways_use_spike': True, 'sideways_rsi_required': False}.
