[I 2025-09-01 08:56:24,878] Trial 585 finished with values: [-0.10318591500365859, 0.10272500495097464] and parameters: {'p_sma': 47, 'p_std': 15, 'p_atr': 21, 'p_adx': 21, 'rsi_period': 66, 'ema1': 20, 'ema2': 15, 'slip_atr_k': 0.10401442507451625, 'slip_spread_k': 0.42543683807332444, 'spread_hl_frac': 0.02364992659091222, 'bb_std_mult': 0.6436197800708157, 'rsi_os': 21, 'rsi_ob': 86, 'vol_spike': 0.24772998082334308, 'adx_thresh': 25.30790686037873, 'atr_min_pct': 0.0291847425402268, 'atr_max_pct': 0.11449249027142824, 'tp_mult': 2.903138887013304, 'tsl_mult': 0.41118602552702876, 'strategy': 'mean_reversion', 'time_stop': 165, 'use_sma': True, 'use_atr': True, 'use_adx': True, 'use_ema': False, 'use_spike': True, 'rsi_required': False, 'edge_k': 0.988522918575407, 'edge_cap': 0.06781300240724385, 'bull_strategy': 'breakout', 'bull_bb_std_mult': 3.3323655448103713, 'bull_rsi_os': 11, 'bull_rsi_ob': 67, 'bull_adx_thresh': 10.005422931715472, 'bull_atr_min_pct': 0.0019830423121867634, 'bull_atr_max_pct': 0.111402072042346, 'bull_tp_mult': 2.2309483370347447, 'bull_tsl_mult': 0.6841387582352855, 'bull_time_stop': 150, 'bull_use_sma': True, 'bull_use_ema': False, 'bull_use_atr': False, 'bull_use_adx': True, 'bull_use_spike': True, 'bull_rsi_required': False, 'bear_strategy': 'mean_reversion', 'bear_bb_std_mult': 3.1361884358522065, 'bear_rsi_os': 26, 'bear_rsi_ob': 65, 'bear_adx_thresh': 12.920378052345933, 'bear_atr_min_pct': 0.024225937669567613, 'bear_atr_max_pct': 0.015342633614967224, 'bear_tp_mult': 1.2738773688345215, 'bear_tsl_mult': 0.04555958093695603, 'bear_time_stop': 300, 'bear_use_sma': False, 'bear_use_ema': True, 'bear_use_atr': True, 'bear_use_adx': False, 'bear_use_spike': True, 'bear_rsi_required': False, 'sideways_strategy': 'breakout', 'sideways_bb_std_mult': 2.4044282356410482, 'sideways_rsi_os': 37, 'sideways_rsi_ob': 80, 'sideways_adx_thresh': 12.123608390694637, 'sideways_atr_min_pct': 0.023085075715238372, 'sideways_atr_max_pct': 0.02767501877965654, 'sideways_tp_mult': 2.662124493316891, 'sideways_tsl_mult': 0.17809712798737123, 'sideways_time_stop': 210, 'sideways_use_sma': False, 'sideways_use_ema': False, 'sideways_use_atr': True, 'sideways_use_adx': True, 'sideways_use_spike': True, 'sideways_rsi_required': False}.
[I 2025-09-01 08:56:26,073] Trial 587 finished with values: [-1000000000.0, 1000000000.0] and parameters: {'p_sma': 35, 'p_std': 5, 'p_atr': 12, 'p_adx': 27, 'rsi_period': 66, 'ema1': 11, 'ema2': 15, 'slip_atr_k': 0.042045255171412915, 'slip_spread_k': 0.1919378332776026, 'spread_hl_frac': 0.023490762470058435, 'bb_std_mult': 3.404167257790968, 'rsi_os': 21, 'rsi_ob': 66, 'vol_spike': 0.2672497242780763, 'adx_thresh': 29.64643818435512, 'atr_min_pct': 0.021856368548567626, 'atr_max_pct': 0.11179998294565532, 'tp_mult': 1.2047472976103821, 'tsl_mult': 0.49036811744451836, 'strategy': 'mean_reversion', 'time_stop': 249, 'use_sma': True, 'use_atr': True, 'use_adx': True, 'use_ema': True, 'use_spike': True, 'rsi_required': True, 'edge_k': 1.6857596911629031, 'edge_cap': 0.9668983998749172, 'bull_strategy': 'breakout', 'bull_bb_std_mult': 3.163803911606615, 'bull_rsi_os': 48, 'bull_rsi_ob': 87, 'bull_adx_thresh': 8.058300654429118, 'bull_atr_min_pct': 0.005045773138450173, 'bull_atr_max_pct': 0.11247779470562443, 'bull_tp_mult': 1.857742715439918, 'bull_tsl_mult': 0.611076918307451, 'bull_time_stop': 225, 'bull_use_sma': True, 'bull_use_ema': False, 'bull_use_atr': False, 'bull_use_adx': True, 'bull_use_spike': True, 'bull_rsi_required': False, 'bear_strategy': 'mean_reversion', 'bear_bb_std_mult': 3.1634791887643665, 'bear_rsi_os': 26, 'bear_rsi_ob': 65, 'bear_adx_thresh': 33.009750028108115, 'bear_atr_min_pct': 0.019342178205579624, 'bear_atr_max_pct': 0.07224866036676918, 'bear_tp_mult': 1.1266798579325963, 'bear_tsl_mult': 0.05393105227449769, 'bear_time_stop': 67, 'bear_use_sma': False, 'bear_use_ema': False, 'bear_use_atr': True, 'bear_use_adx': False, 'bear_use_spike': True, 'bear_rsi_required': False, 'sideways_strategy': 'mean_reversion', 'sideways_bb_std_mult': 2.898834781410917, 'sideways_rsi_os': 55, 'sideways_rsi_ob': 65, 'sideways_adx_thresh': 10.173154750651275, 'sideways_atr_min_pct': 0.008368107606258602, 'sideways_atr_max_pct': 0.016944603943390674, 'sideways_tp_mult': 2.8133518100129615, 'sideways_tsl_mult': 0.16973602776059982, 'sideways_time_stop': 260, 'sideways_use_sma': False, 'sideways_use_ema': False, 'sideways_use_atr': False, 'sideways_use_adx': True, 'sideways_use_spike': True, 'sideways_rsi_required': True}.
[I 2025-09-01 08:56:26,239] Trial 584 finished with values: [-0.09924357018538665, 0.10079415042265394] and parameters: {'p_sma': 36, 'p_std': 18, 'p_atr': 27, 'p_adx': 16, 'rsi_period': 37, 'ema1': 11, 'ema2': 11, 'slip_atr_k': 0.0522354983623067, 'slip_spread_k': 0.2082118998699367, 'spread_hl_frac': 0.0156842312761689, 'bb_std_mult': 3.3993295950746703, 'rsi_os': 23, 'rsi_ob': 56, 'vol_spike': 0.24833061829954878, 'adx_thresh': 25.862130380751786, 'atr_min_pct': 0.0008232935138336971, 'atr_max_pct': 0.04450972802961007, 'tp_mult': 1.174026447783439, 'tsl_mult': 0.43172509523466174, 'strategy': 'mean_reversion', 'time_stop': 249, 'use_sma': True, 'use_atr': True, 'use_adx': True, 'use_ema': True, 'use_spike': True, 'rsi_required': False, 'edge_k': 0.978565302352916, 'edge_cap': 0.9241198124134756, 'bull_strategy': 'breakout', 'bull_bb_std_mult': 2.6492324467914186, 'bull_rsi_os': 15, 'bull_rsi_ob': 70, 'bull_adx_thresh': 10.433524671849709, 'bull_atr_min_pct': 0.0019660067699084783, 'bull_atr_max_pct': 0.04384112322495287, 'bull_tp_mult': 1.8608076935813154, 'bull_tsl_mult': 0.4215957620374676, 'bull_time_stop': 52, 'bull_use_sma': True, 'bull_use_ema': False, 'bull_use_atr': False, 'bull_use_adx': True, 'bull_use_spike': True, 'bull_rsi_required': False, 'bear_strategy': 'mean_reversion', 'bear_bb_std_mult': 3.1533896475433387, 'bear_rsi_os': 26, 'bear_rsi_ob': 65, 'bear_adx_thresh': 33.03954915459892, 'bear_atr_min_pct': 0.023039083758122993, 'bear_atr_max_pct': 0.08270032938025008, 'bear_tp_mult': 2.852345574690046, 'bear_tsl_mult': 0.04470745209592524, 'bear_time_stop': 160, 'bear_use_sma': False, 'bear_use_ema': True, 'bear_use_atr': True, 'bear_use_adx': False, 'bear_use_spike': True, 'bear_rsi_required': False, 'sideways_strategy': 'breakout', 'sideways_bb_std_mult': 1.7206110039176525, 'sideways_rsi_os': 37, 'sideways_rsi_ob': 65, 'sideways_adx_thresh': 12.0745883047592, 'sideways_atr_min_pct': 0.023102469300616248, 'sideways_atr_max_pct': 0.0789361548172024, 'sideways_tp_mult': 2.7907014210750614, 'sideways_tsl_mult': 0.6926464281114215, 'sideways_time_stop': 10, 'sideways_use_sma': False, 'sideways_use_ema': False, 'sideways_use_atr': True, 'sideways_use_adx': True, 'sideways_use_spike': True, 'sideways_rsi_required': False}.
[I 2025-09-01 08:56:27,225] Trial 589 finished with values: [-1000000000.0, 1000000000.0] and parameters: {'p_sma': 18, 'p_std': 11, 'p_atr': 24, 'p_adx': 27, 'rsi_period': 65, 'ema1': 11, 'ema2': 14, 'slip_atr_k': 0.07166788322744039, 'slip_spread_k': 0.6190452956720046, 'spread_hl_frac': 0.023178968969475938, 'bb_std_mult': 0.7428793837457859, 'rsi_os': 25, 'rsi_ob': 56, 'vol_spike': 0.2608564346464793, 'adx_thresh': 31.981754812877938, 'atr_min_pct': 0.021256232276282868, 'atr_max_pct': 0.010104229693286185, 'tp_mult': 2.723891583749406, 'tsl_mult': 0.4325541298611483, 'strategy': 'mean_reversion', 'time_stop': 249, 'use_sma': True, 'use_atr': True, 'use_adx': True, 'use_ema': True, 'use_spike': True, 'rsi_required': True, 'edge_k': 0.8328901384076776, 'edge_cap': 0.7985559533151714, 'bull_strategy': 'breakout', 'bull_bb_std_mult': 2.1706131707543235, 'bull_rsi_os': 14, 'bull_rsi_ob': 69, 'bull_adx_thresh': 8.130388752290061, 'bull_atr_min_pct': 0.00469788660551626, 'bull_atr_max_pct': 0.04434242010197583, 'bull_tp_mult': 1.9366001454217696, 'bull_tsl_mult': 0.6509364991021694, 'bull_time_stop': 226, 'bull_use_sma': True, 'bull_use_ema': False, 'bull_use_atr': True, 'bull_use_adx': False, 'bull_use_spike': False, 'bull_rsi_required': False, 'bear_strategy': 'breakout', 'bear_bb_std_mult': 1.8652117772675507, 'bear_rsi_os': 26, 'bear_rsi_ob': 95, 'bear_adx_thresh': 20.27256882665726, 'bear_atr_min_pct': 0.025246999550133917, 'bear_atr_max_pct': 0.08592466544112032, 'bear_tp_mult': 1.1375500395023836, 'bear_tsl_mult': 0.4536911440181995, 'bear_time_stop': 218, 'bear_use_sma': True, 'bear_use_ema': False, 'bear_use_atr': True, 'bear_use_adx': True, 'bear_use_spike': True, 'bear_rsi_required': True, 'sideways_strategy': 'mean_reversion', 'sideways_bb_std_mult': 1.814032732153751, 'sideways_rsi_os': 39, 'sideways_rsi_ob': 92, 'sideways_adx_thresh': 13.958375803577036, 'sideways_atr_min_pct': 0.008302878367734221, 'sideways_atr_max_pct': 0.04377424309253734, 'sideways_tp_mult': 2.60153877443293, 'sideways_tsl_mult': 0.7694273319332618, 'sideways_time_stop': 259, 'sideways_use_sma': False, 'sideways_use_ema': False, 'sideways_use_atr': False, 'sideways_use_adx': True, 'sideways_use_spike': True, 'sideways_rsi_required': True}.
[I 2025-09-01 08:57:08,739] Trial 588 finished with values: [-1000000000.0, 1000000000.0] and parameters: {'p_sma': 10, 'p_std': 45, 'p_atr': 24, 'p_adx': 27, 'rsi_period': 65, 'ema1': 14, 'ema2': 49, 'slip_atr_k': 0.033123978829089795, 'slip_spread_k': 0.21416121299693336, 'spread_hl_frac': 0.02608010393569199, 'bb_std_mult': 3.166304085501219, 'rsi_os': 37, 'rsi_ob': 58, 'vol_spike': 0.2688769370133044, 'adx_thresh': 25.899375740936442, 'atr_min_pct': 0.021458796663856344, 'atr_max_pct': 0.11045336103560202, 'tp_mult': 1.0109195726770945, 'tsl_mult': 0.43439933837616085, 'strategy': 'mean_reversion', 'time_stop': 175, 'use_sma': True, 'use_atr': True, 'use_adx': True, 'use_ema': True, 'use_spike': True, 'rsi_required': True, 'edge_k': 0.8971507738074519, 'edge_cap': 0.8000240974658125, 'bull_strategy': 'breakout', 'bull_bb_std_mult': 2.652942779163824, 'bull_rsi_os': 43, 'bull_rsi_ob': 69, 'bull_adx_thresh': 32.403826999034116, 'bull_atr_min_pct': 0.004747889377483198, 'bull_atr_max_pct': 0.04470198910139028, 'bull_tp_mult': 2.2880866841991887, 'bull_tsl_mult': 0.238329469164693, 'bull_time_stop': 63, 'bull_use_sma': True, 'bull_use_ema': False, 'bull_use_atr': True, 'bull_use_adx': False, 'bull_use_spike': False, 'bull_rsi_required': False, 'bear_strategy': 'breakout', 'bear_bb_std_mult': 3.2601261789456104, 'bear_rsi_os': 26, 'bear_rsi_ob': 95, 'bear_adx_thresh': 31.72584351969121, 'bear_atr_min_pct': 0.019059169901551692, 'bear_atr_max_pct': 0.08615869002242936, 'bear_tp_mult': 2.854126462162653, 'bear_tsl_mult': 0.4623552933395857, 'bear_time_stop': 222, 'bear_use_sma': True, 'bear_use_ema': False, 'bear_use_atr': True, 'bear_use_adx': True, 'bear_use_spike': True, 'bear_rsi_required': True, 'sideways_strategy': 'mean_reversion', 'sideways_bb_std_mult': 0.589598557955814, 'sideways_rsi_os': 39, 'sideways_rsi_ob': 51, 'sideways_adx_thresh': 7.730336810692748, 'sideways_atr_min_pct': 0.022626155290180014, 'sideways_atr_max_pct': 0.03863024760338571, 'sideways_tp_mult': 2.7917190683459383, 'sideways_tsl_mult': 0.20190852414106997, 'sideways_time_stop': 8, 'sideways_use_sma': False, 'sideways_use_ema': False, 'sideways_use_atr': False, 'sideways_use_adx': True, 'sideways_use_spike': True, 'sideways_rsi_required': True}.
[I 2025-09-01 08:57:10,459] Trial 590 finished with values: [-1000000000.0, 1000000000.0] and parameters: {'p_sma': 18, 'p_std': 11, 'p_atr': 28, 'p_adx': 13, 'rsi_period': 65, 'ema1': 10, 'ema2': 36, 'slip_atr_k': 0.07202761974685142, 'slip_spread_k': 0.6258605046348749, 'spread_hl_frac': 0.03500978802881178, 'bb_std_mult': 2.9860475781171036, 'rsi_os': 25, 'rsi_ob': 56, 'vol_spike': 0.29972490587920414, 'adx_thresh': 15.55167903751973, 'atr_min_pct': 0.02115798194146621, 'atr_max_pct': 0.14518576712882703, 'tp_mult': 1.7064761893200697, 'tsl_mult': 0.4402014905483597, 'strategy': 'mean_reversion', 'time_stop': 257, 'use_sma': True, 'use_atr': True, 'use_adx': True, 'use_ema': True, 'use_spike': True, 'rsi_required': True, 'edge_k': 1.2014082231949001, 'edge_cap': 0.08646625260611723, 'bull_strategy': 'breakout', 'bull_bb_std_mult': 3.436950015766575, 'bull_rsi_os': 14, 'bull_rsi_ob': 69, 'bull_adx_thresh': 12.312535122706034, 'bull_atr_min_pct': 0.008450510653128601, 'bull_atr_max_pct': 0.043884497209778696, 'bull_tp_mult': 1.6818618506422536, 'bull_tsl_mult': 0.648664237343634, 'bull_time_stop': 170, 'bull_use_sma': True, 'bull_use_ema': False, 'bull_use_atr': True, 'bull_use_adx': False, 'bull_use_spike': False, 'bull_rsi_required': False, 'bear_strategy': 'breakout', 'bear_bb_std_mult': 3.2364602488846668, 'bear_rsi_os': 25, 'bear_rsi_ob': 95, 'bear_adx_thresh': 31.787771924348874, 'bear_atr_min_pct': 0.003901559704779428, 'bear_atr_max_pct': 0.12560476846125435, 'bear_tp_mult': 2.8660298124073136, 'bear_tsl_mult': 0.12583947540782153, 'bear_time_stop': 208, 'bear_use_sma': True, 'bear_use_ema': False, 'bear_use_atr': True, 'bear_use_adx': True, 'bear_use_spike': True, 'bear_rsi_required': True, 'sideways_strategy': 'mean_reversion', 'sideways_bb_std_mult': 1.8099841080884367, 'sideways_rsi_os': 38, 'sideways_rsi_ob': 92, 'sideways_adx_thresh': 28.08557381363982, 'sideways_atr_min_pct': 0.02464620909294779, 'sideways_atr_max_pct': 0.03796468315125988, 'sideways_tp_mult': 2.602235022994291, 'sideways_tsl_mult': 0.20565066150774802, 'sideways_time_stop': 21, 'sideways_use_sma': False, 'sideways_use_ema': True, 'sideways_use_atr': False, 'sideways_use_adx': False, 'sideways_use_spike': True, 'sideways_rsi_required': False}.
[I 2025-09-01 08:57:10,737] Trial 592 finished with values: [-1000000000.0, 1000000000.0] and parameters: {'p_sma': 21, 'p_std': 14, 'p_atr': 12, 'p_adx': 12, 'rsi_period': 65, 'ema1': 9, 'ema2': 34, 'slip_atr_k': 0.032858252971670734, 'slip_spread_k': 0.9763205729872424, 'spread_hl_frac': 0.014311036900851679, 'bb_std_mult': 3.525777972192352, 'rsi_os': 17, 'rsi_ob': 54, 'vol_spike': 0.23294535701726699, 'adx_thresh': 28.7630316522217, 'atr_min_pct': 0.025272655260268048, 'atr_max_pct': 0.14451917004310075, 'tp_mult': 1.578262898664708, 'tsl_mult': 0.6862249253810607, 'strategy': 'mean_reversion', 'time_stop': 71, 'use_sma': False, 'use_atr': True, 'use_adx': True, 'use_ema': True, 'use_spike': True, 'rsi_required': True, 'edge_k': 0.9214684955296126, 'edge_cap': 0.21879126726976167, 'bull_strategy': 'mean_reversion', 'bull_bb_std_mult': 2.4469924985323392, 'bull_rsi_os': 44, 'bull_rsi_ob': 66, 'bull_adx_thresh': 8.87716373165317, 'bull_atr_min_pct': 0.006812750728020206, 'bull_atr_max_pct': 0.04195156261651841, 'bull_tp_mult': 1.4065121394369422, 'bull_tsl_mult': 0.15290238972171477, 'bull_time_stop': 167, 'bull_use_sma': True, 'bull_use_ema': False, 'bull_use_atr': True, 'bull_use_adx': False, 'bull_use_spike': False, 'bull_rsi_required': False, 'bear_strategy': 'breakout', 'bear_bb_std_mult': 2.9977900395746273, 'bear_rsi_os': 43, 'bear_rsi_ob': 68, 'bear_adx_thresh': 31.84417889296474, 'bear_atr_min_pct': 0.009137847089396755, 'bear_atr_max_pct': 0.07669608673771901, 'bear_tp_mult': 1.6154516306416251, 'bear_tsl_mult': 0.12067417322825624, 'bear_time_stop': 243, 'bear_use_sma': True, 'bear_use_ema': False, 'bear_use_atr': True, 'bear_use_adx': True, 'bear_use_spike': True, 'bear_rsi_required': True, 'sideways_strategy': 'mean_reversion', 'sideways_bb_std_mult': 0.5826529591083405, 'sideways_rsi_os': 38, 'sideways_rsi_ob': 86, 'sideways_adx_thresh': 7.700846717795034, 'sideways_atr_min_pct': 0.021185601026836802, 'sideways_atr_max_pct': 0.03832721390186104, 'sideways_tp_mult': 1.437200897208819, 'sideways_tsl_mult': 0.20397544985496213, 'sideways_time_stop': 20, 'sideways_use_sma': False, 'sideways_use_ema': True, 'sideways_use_atr': False, 'sideways_use_adx': False, 'sideways_use_spike': True, 'sideways_rsi_required': False}.
[I 2025-09-01 08:57:10,757] Trial 591 finished with values: [-1000000000.0, 1000000000.0] and parameters: {'p_sma': 18, 'p_std': 14, 'p_atr': 12, 'p_adx': 20, 'rsi_period': 7, 'ema1': 10, 'ema2': 34, 'slip_atr_k': 0.07171833991795652, 'slip_spread_k': 0.6295640885933156, 'spread_hl_frac': 0.03495573934307821, 'bb_std_mult': 1.378120003743733, 'rsi_os': 33, 'rsi_ob': 53, 'vol_spike': 0.23288779312726196, 'adx_thresh': 17.986365619687145, 'atr_min_pct': 0.02114455603171869, 'atr_max_pct': 0.14597270333409185, 'tp_mult': 2.5558527157656172, 'tsl_mult': 0.5084376533686398, 'strategy': 'mean_reversion', 'time_stop': 241, 'use_sma': False, 'use_atr': True, 'use_adx': True, 'use_ema': True, 'use_spike': True, 'rsi_required': True, 'edge_k': 0.897428741371281, 'edge_cap': 0.08194745670970448, 'bull_strategy': 'mean_reversion', 'bull_bb_std_mult': 2.4320589526712784, 'bull_rsi_os': 25, 'bull_rsi_ob': 69, 'bull_adx_thresh': 8.996751039460495, 'bull_atr_min_pct': 0.007594477714529634, 'bull_atr_max_pct': 0.04218159582285193, 'bull_tp_mult': 2.3878859114979507, 'bull_tsl_mult': 0.24933601322108895, 'bull_time_stop': 171, 'bull_use_sma': True, 'bull_use_ema': False, 'bull_use_atr': True, 'bull_use_adx': False, 'bull_use_spike': False, 'bull_rsi_required': False, 'bear_strategy': 'breakout', 'bear_bb_std_mult': 1.1364589437860522, 'bear_rsi_os': 25, 'bear_rsi_ob': 95, 'bear_adx_thresh': 31.931798632959033, 'bear_atr_min_pct': 0.008824634239283575, 'bear_atr_max_pct': 0.08558086550707808, 'bear_tp_mult': 2.5510631191210025, 'bear_tsl_mult': 0.4571063148054988, 'bear_time_stop': 224, 'bear_use_sma': True, 'bear_use_ema': False, 'bear_use_atr': True, 'bear_use_adx': True, 'bear_use_spike': True, 'bear_rsi_required': True, 'sideways_strategy': 'mean_reversion', 'sideways_bb_std_mult': 0.5879703633366746, 'sideways_rsi_os': 39, 'sideways_rsi_ob': 49, 'sideways_adx_thresh': 8.524319169825096, 'sideways_atr_min_pct': 0.006418609974564955, 'sideways_atr_max_pct': 0.03790976314847259, 'sideways_tp_mult': 1.4542403089512952, 'sideways_tsl_mult': 0.20377521447292732, 'sideways_time_stop': 26, 'sideways_use_sma': False, 'sideways_use_ema': True, 'sideways_use_atr': False, 'sideways_use_adx': False, 'sideways_use_spike': True, 'sideways_rsi_required': True}.
[I 2025-09-01 08:57:52,515] Trial 595 finished with values: [-0.03884793340522741, 0.039311692528273594] and parameters: {'p_sma': 15, 'p_std': 16, 'p_atr': 11, 'p_adx': 20, 'rsi_period': 40, 'ema1': 8, 'ema2': 12, 'slip_atr_k': 0.14100908149883393, 'slip_spread_k': 0.04601617395964053, 'spread_hl_frac': 0.024885681577161346, 'bb_std_mult': 2.8273128226617903, 'rsi_os': 29, 'rsi_ob': 76, 'vol_spike': 0.08116863932247177, 'adx_thresh': 13.840455165895044, 'atr_min_pct': 0.020018066471492523, 'atr_max_pct': 0.09922563504833457, 'tp_mult': 1.2224439918246985, 'tsl_mult': 0.19771223522817016, 'strategy': 'breakout', 'time_stop': 257, 'use_sma': True, 'use_atr': False, 'use_adx': True, 'use_ema': False, 'use_spike': True, 'rsi_required': True, 'edge_k': 1.0220454991153856, 'edge_cap': 0.09962995815755349, 'bull_strategy': 'breakout', 'bull_bb_std_mult': 2.8088671912709855, 'bull_rsi_os': 5, 'bull_rsi_ob': 76, 'bull_adx_thresh': 22.87280484519421, 'bull_atr_min_pct': 0.0034594340537680455, 'bull_atr_max_pct': 0.03174449614079928, 'bull_tp_mult': 2.699612253993598, 'bull_tsl_mult': 0.6707378403127437, 'bull_time_stop': 156, 'bull_use_sma': True, 'bull_use_ema': True, 'bull_use_atr': False, 'bull_use_adx': True, 'bull_use_spike': True, 'bull_rsi_required': False, 'bear_strategy': 'mean_reversion', 'bear_bb_std_mult': 3.5907957482480533, 'bear_rsi_os': 17, 'bear_rsi_ob': 71, 'bear_adx_thresh': 23.943750030264955, 'bear_atr_min_pct': 0.021523412173161994, 'bear_atr_max_pct': 0.07430206796209847, 'bear_tp_mult': 1.992683754126368, 'bear_tsl_mult': 0.07452252406258496, 'bear_time_stop': 140, 'bear_use_sma': False, 'bear_use_ema': False, 'bear_use_atr': True, 'bear_use_adx': True, 'bear_use_spike': True, 'bear_rsi_required': False, 'sideways_strategy': 'breakout', 'sideways_bb_std_mult': 0.9469219645668869, 'sideways_rsi_os': 46, 'sideways_rsi_ob': 66, 'sideways_adx_thresh': 22.218834638836483, 'sideways_atr_min_pct': 0.02384162131092436, 'sideways_atr_max_pct': 0.0329174566775304, 'sideways_tp_mult': 2.5516356524031623, 'sideways_tsl_mult': 0.14075469827063553, 'sideways_time_stop': 275, 'sideways_use_sma': True, 'sideways_use_ema': False, 'sideways_use_atr': False, 'sideways_use_adx': True, 'sideways_use_spike': True, 'sideways_rsi_required': False}.
