[I 2025-09-01 14:49:32,606] Trial 722 finished with values: [-1000000000.0, 1000000000.0] and parameters: {'p_sma': 34, 'p_std': 41, 'p_atr': 25, 'p_adx': 12, 'rsi_period': 36, 'ema1': 21, 'ema2': 54, 'slip_atr_k': 0.023840934773549503, 'slip_spread_k': 0.0739809408546808, 'spread_hl_frac': 0.04990490314534808, 'bb_std_mult': 3.592741696448396, 'rsi_os': 39, 'rsi_ob': 85, 'vol_spike': 0.2309369638082771, 'adx_thresh': 23.978875421444098, 'atr_min_pct': 0.02761129103904508, 'atr_max_pct': 0.1382759727326053, 'tp_mult': 1.1165311755548188, 'tsl_mult': 0.7835637079941559, 'strategy': 'breakout', 'time_stop': 237, 'use_sma': True, 'use_atr': False, 'use_adx': False, 'use_ema': False, 'use_spike': False, 'rsi_required': False, 'edge_k': 0.9744515915261266, 'edge_cap': 0.8565714477394464, 'bull_strategy': 'breakout', 'bull_bb_std_mult': 2.568764689090913, 'bull_rsi_os': 50, 'bull_rsi_ob': 64, 'bull_adx_thresh': 30.596610140210867, 'bull_atr_min_pct': 0.005738330213811169, 'bull_atr_max_pct': 0.02082105960310489, 'bull_tp_mult': 2.7968767670342616, 'bull_tsl_mult': 0.43783121247875456, 'bull_time_stop': 86, 'bull_use_sma': False, 'bull_use_ema': False, 'bull_use_atr': True, 'bull_use_adx': False, 'bull_use_spike': False, 'bull_rsi_required': True, 'bear_strategy': 'breakout', 'bear_bb_std_mult': 3.380714454887241, 'bear_rsi_os': 7, 'bear_rsi_ob': 83, 'bear_adx_thresh': 25.676084907681865, 'bear_atr_min_pct': 0.002977600312086711, 'bear_atr_max_pct': 0.04721378177185911, 'bear_tp_mult': 1.7084086350380276, 'bear_tsl_mult': 0.9491315351738768, 'bear_time_stop': 261, 'bear_use_sma': True, 'bear_use_ema': False, 'bear_use_atr': False, 'bear_use_adx': True, 'bear_use_spike': False, 'bear_rsi_required': False, 'sideways_strategy': 'breakout', 'sideways_bb_std_mult': 1.6457855510168973, 'sideways_rsi_os': 51, 'sideways_rsi_ob': 79, 'sideways_adx_thresh': 6.050619048284503, 'sideways_atr_min_pct': 0.018668099893240534, 'sideways_atr_max_pct': 0.03348219652645183, 'sideways_tp_mult': 2.5846946319385733, 'sideways_tsl_mult': 0.2751313074162671, 'sideways_time_stop': 169, 'sideways_use_sma': False, 'sideways_use_ema': False, 'sideways_use_atr': True, 'sideways_use_adx': False, 'sideways_use_spike': False, 'sideways_rsi_required': False}.
[I 2025-09-01 14:49:33,668] Trial 720 finished with values: [-1000000000.0, 1000000000.0] and parameters: {'p_sma': 16, 'p_std': 47, 'p_atr': 25, 'p_adx': 11, 'rsi_period': 68, 'ema1': 29, 'ema2': 17, 'slip_atr_k': 0.024937815942018944, 'slip_spread_k': 0.4107535507587241, 'spread_hl_frac': 0.01664641478768056, 'bb_std_mult': 1.3460451668763103, 'rsi_os': 39, 'rsi_ob': 85, 'vol_spike': 0.2429745151565207, 'adx_thresh': 28.638841868841077, 'atr_min_pct': 0.0023153270469223382, 'atr_max_pct': 0.13848742170944867, 'tp_mult': 1.0410375452729086, 'tsl_mult': 0.7898781913840619, 'strategy': 'mean_reversion', 'time_stop': 190, 'use_sma': False, 'use_atr': False, 'use_adx': False, 'use_ema': True, 'use_spike': True, 'rsi_required': False, 'edge_k': 0.8752553167777066, 'edge_cap': 0.3087735516336483, 'bull_strategy': 'breakout', 'bull_bb_std_mult': 3.4547366358179583, 'bull_rsi_os': 34, 'bull_rsi_ob': 64, 'bull_adx_thresh': 25.65273622427985, 'bull_atr_min_pct': 0.0018989618179746054, 'bull_atr_max_pct': 0.032209159270249046, 'bull_tp_mult': 2.809376251806057, 'bull_tsl_mult': 0.518998978026324, 'bull_time_stop': 104, 'bull_use_sma': False, 'bull_use_ema': False, 'bull_use_atr': False, 'bull_use_adx': False, 'bull_use_spike': True, 'bull_rsi_required': True, 'bear_strategy': 'breakout', 'bear_bb_std_mult': 2.3887016639427903, 'bear_rsi_os': 41, 'bear_rsi_ob': 91, 'bear_adx_thresh': 25.495580925109394, 'bear_atr_min_pct': 0.025805535034802388, 'bear_atr_max_pct': 0.040865817413892974, 'bear_tp_mult': 1.654892807790132, 'bear_tsl_mult': 0.2226580656666437, 'bear_time_stop': 229, 'bear_use_sma': True, 'bear_use_ema': True, 'bear_use_atr': True, 'bear_use_adx': True, 'bear_use_spike': False, 'bear_rsi_required': True, 'sideways_strategy': 'breakout', 'sideways_bb_std_mult': 2.3489826125460724, 'sideways_rsi_os': 36, 'sideways_rsi_ob': 55, 'sideways_adx_thresh': 7.534812016120752, 'sideways_atr_min_pct': 0.008675872059604014, 'sideways_atr_max_pct': 0.12464192289014062, 'sideways_tp_mult': 2.573970317722763, 'sideways_tsl_mult': 0.2795116206055029, 'sideways_time_stop': 164, 'sideways_use_sma': True, 'sideways_use_ema': True, 'sideways_use_atr': True, 'sideways_use_adx': False, 'sideways_use_spike': False, 'sideways_rsi_required': True}.
[I 2025-09-01 14:49:34,056] Trial 719 finished with values: [-1000000000.0, 1000000000.0] and parameters: {'p_sma': 15, 'p_std': 47, 'p_atr': 27, 'p_adx': 11, 'rsi_period': 62, 'ema1': 11, 'ema2': 18, 'slip_atr_k': 0.010972550385370596, 'slip_spread_k': 0.06526252071876497, 'spread_hl_frac': 0.04488124625405037, 'bb_std_mult': 2.3566129740857997, 'rsi_os': 25, 'rsi_ob': 85, 'vol_spike': 0.22452387991208408, 'adx_thresh': 28.192602810217323, 'atr_min_pct': 0.025592456417124678, 'atr_max_pct': 0.13389826224757678, 'tp_mult': 1.0119657557881827, 'tsl_mult': 0.7839704087122388, 'strategy': 'mean_reversion', 'time_stop': 48, 'use_sma': False, 'use_atr': False, 'use_adx': False, 'use_ema': False, 'use_spike': True, 'rsi_required': False, 'edge_k': 1.6172494938594661, 'edge_cap': 0.8588921879642109, 'bull_strategy': 'mean_reversion', 'bull_bb_std_mult': 2.5654078711239774, 'bull_rsi_os': 9, 'bull_rsi_ob': 54, 'bull_adx_thresh': 30.34681259457435, 'bull_atr_min_pct': 0.004314309081504859, 'bull_atr_max_pct': 0.031449398321901204, 'bull_tp_mult': 1.556887163634304, 'bull_tsl_mult': 0.5210290760916696, 'bull_time_stop': 114, 'bull_use_sma': False, 'bull_use_ema': False, 'bull_use_atr': False, 'bull_use_adx': True, 'bull_use_spike': True, 'bull_rsi_required': True, 'bear_strategy': 'breakout', 'bear_bb_std_mult': 3.442486620836846, 'bear_rsi_os': 32, 'bear_rsi_ob': 92, 'bear_adx_thresh': 25.612724546360518, 'bear_atr_min_pct': 0.00304357830464677, 'bear_atr_max_pct': 0.0770889823492296, 'bear_tp_mult': 1.1137360450778795, 'bear_tsl_mult': 0.5488363310927844, 'bear_time_stop': 148, 'bear_use_sma': False, 'bear_use_ema': True, 'bear_use_atr': False, 'bear_use_adx': True, 'bear_use_spike': False, 'bear_rsi_required': True, 'sideways_strategy': 'mean_reversion', 'sideways_bb_std_mult': 3.346840384089183, 'sideways_rsi_os': 53, 'sideways_rsi_ob': 80, 'sideways_adx_thresh': 6.124237964239342, 'sideways_atr_min_pct': 0.020157891243130527, 'sideways_atr_max_pct': 0.12411753104058647, 'sideways_tp_mult': 1.3467809389393026, 'sideways_tsl_mult': 0.11282361075321168, 'sideways_time_stop': 114, 'sideways_use_sma': True, 'sideways_use_ema': True, 'sideways_use_atr': True, 'sideways_use_adx': False, 'sideways_use_spike': False, 'sideways_rsi_required': True}.
[I 2025-09-01 14:50:14,007] Trial 723 finished with values: [-1000000000.0, 1000000000.0] and parameters: {'p_sma': 43, 'p_std': 49, 'p_atr': 25, 'p_adx': 18, 'rsi_period': 41, 'ema1': 21, 'ema2': 16, 'slip_atr_k': 0.02461325744185809, 'slip_spread_k': 0.07252669733829047, 'spread_hl_frac': 0.01667482052673552, 'bb_std_mult': 1.7383636111416232, 'rsi_os': 39, 'rsi_ob': 85, 'vol_spike': 0.23232363315888185, 'adx_thresh': 16.54406199220567, 'atr_min_pct': 0.02635198440178494, 'atr_max_pct': 0.029226431362736394, 'tp_mult': 1.121974071797815, 'tsl_mult': 0.405282291310068, 'strategy': 'mean_reversion', 'time_stop': 238, 'use_sma': True, 'use_atr': False, 'use_adx': False, 'use_ema': False, 'use_spike': False, 'rsi_required': False, 'edge_k': 0.9711859132132581, 'edge_cap': 0.3116656145171017, 'bull_strategy': 'breakout', 'bull_bb_std_mult': 3.4336222830291945, 'bull_rsi_os': 34, 'bull_rsi_ob': 55, 'bull_adx_thresh': 30.934744962864123, 'bull_atr_min_pct': 0.003323688271204612, 'bull_atr_max_pct': 0.08411310550640927, 'bull_tp_mult': 1.5542492959945138, 'bull_tsl_mult': 0.39903378582505133, 'bull_time_stop': 105, 'bull_use_sma': False, 'bull_use_ema': False, 'bull_use_atr': True, 'bull_use_adx': True, 'bull_use_spike': False, 'bull_rsi_required': True, 'bear_strategy': 'breakout', 'bear_bb_std_mult': 3.3462650901778024, 'bear_rsi_os': 22, 'bear_rsi_ob': 78, 'bear_adx_thresh': 30.89630404494263, 'bear_atr_min_pct': 0.01173400034454584, 'bear_atr_max_pct': 0.14362725303467133, 'bear_tp_mult': 2.239124593069022, 'bear_tsl_mult': 0.03878222851262758, 'bear_time_stop': 215, 'bear_use_sma': True, 'bear_use_ema': False, 'bear_use_atr': False, 'bear_use_adx': True, 'bear_use_spike': False, 'bear_rsi_required': False, 'sideways_strategy': 'breakout', 'sideways_bb_std_mult': 1.6436878436166606, 'sideways_rsi_os': 22, 'sideways_rsi_ob': 80, 'sideways_adx_thresh': 7.570505858304316, 'sideways_atr_min_pct': 0.008675026662338107, 'sideways_atr_max_pct': 0.1442461316918916, 'sideways_tp_mult': 2.7605973557021812, 'sideways_tsl_mult': 0.25082651536494627, 'sideways_time_stop': 180, 'sideways_use_sma': False, 'sideways_use_ema': False, 'sideways_use_atr': True, 'sideways_use_adx': False, 'sideways_use_spike': False, 'sideways_rsi_required': False}.
[I 2025-09-01 14:50:15,210] Trial 726 finished with values: [-1000000000.0, 1000000000.0] and parameters: {'p_sma': 7, 'p_std': 25, 'p_atr': 28, 'p_adx': 12, 'rsi_period': 67, 'ema1': 23, 'ema2': 16, 'slip_atr_k': 0.11587035004286834, 'slip_spread_k': 0.10094206505526064, 'spread_hl_frac': 0.00845152161840845, 'bb_std_mult': 3.4531595430437267, 'rsi_os': 42, 'rsi_ob': 82, 'vol_spike': 0.29575869495485974, 'adx_thresh': 25.215703761331586, 'atr_min_pct': 0.026357884424018343, 'atr_max_pct': 0.14222901361562754, 'tp_mult': 2.1388257175788152, 'tsl_mult': 0.6847736421442225, 'strategy': 'mean_reversion', 'time_stop': 226, 'use_sma': True, 'use_atr': False, 'use_adx': False, 'use_ema': True, 'use_spike': False, 'rsi_required': True, 'edge_k': 0.6779715439557552, 'edge_cap': 0.3381992753028615, 'bull_strategy': 'breakout', 'bull_bb_std_mult': 1.9691722169736214, 'bull_rsi_os': 36, 'bull_rsi_ob': 56, 'bull_adx_thresh': 14.712419091089757, 'bull_atr_min_pct': 0.003588975315112625, 'bull_atr_max_pct': 0.010001801808306787, 'bull_tp_mult': 2.8660939381473836, 'bull_tsl_mult': 0.9729731448590953, 'bull_time_stop': 33, 'bull_use_sma': True, 'bull_use_ema': True, 'bull_use_atr': True, 'bull_use_adx': True, 'bull_use_spike': False, 'bull_rsi_required': True, 'bear_strategy': 'breakout', 'bear_bb_std_mult': 3.549014545019866, 'bear_rsi_os': 47, 'bear_rsi_ob': 85, 'bear_adx_thresh': 34.204240302244514, 'bear_atr_min_pct': 0.01991375958610169, 'bear_atr_max_pct': 0.0679122045189402, 'bear_tp_mult': 1.5544938594952347, 'bear_tsl_mult': 0.6194435049900597, 'bear_time_stop': 208, 'bear_use_sma': True, 'bear_use_ema': False, 'bear_use_atr': True, 'bear_use_adx': True, 'bear_use_spike': False, 'bear_rsi_required': False, 'sideways_strategy': 'breakout', 'sideways_bb_std_mult': 3.139884329392924, 'sideways_rsi_os': 47, 'sideways_rsi_ob': 65, 'sideways_adx_thresh': 21.4014213571595, 'sideways_atr_min_pct': 0.0026451219358525884, 'sideways_atr_max_pct': 0.13515411424688756, 'sideways_tp_mult': 1.6020205349781573, 'sideways_tsl_mult': 0.8199000743712066, 'sideways_time_stop': 256, 'sideways_use_sma': False, 'sideways_use_ema': False, 'sideways_use_atr': True, 'sideways_use_adx': True, 'sideways_use_spike': False, 'sideways_rsi_required': False}.
[I 2025-09-01 14:50:16,031] Trial 725 finished with values: [-1000000000.0, 1000000000.0] and parameters: {'p_sma': 11, 'p_std': 49, 'p_atr': 28, 'p_adx': 12, 'rsi_period': 67, 'ema1': 23, 'ema2': 16, 'slip_atr_k': 0.11468619100440965, 'slip_spread_k': 0.34166902300950597, 'spread_hl_frac': 0.002832762298817711, 'bb_std_mult': 3.4386818509681394, 'rsi_os': 42, 'rsi_ob': 84, 'vol_spike': 0.04414860722625387, 'adx_thresh': 26.450643913940993, 'atr_min_pct': 0.02551266796956094, 'atr_max_pct': 0.14203556942605755, 'tp_mult': 1.0902358268199788, 'tsl_mult': 0.40361436241192294, 'strategy': 'mean_reversion', 'time_stop': 228, 'use_sma': True, 'use_atr': False, 'use_adx': False, 'use_ema': False, 'use_spike': True, 'rsi_required': True, 'edge_k': 0.8328455697039093, 'edge_cap': 0.33106104072501663, 'bull_strategy': 'breakout', 'bull_bb_std_mult': 3.104545969804347, 'bull_rsi_os': 36, 'bull_rsi_ob': 54, 'bull_adx_thresh': 33.31101175382913, 'bull_atr_min_pct': 0.015018601828377885, 'bull_atr_max_pct': 0.021449123253056947, 'bull_tp_mult': 1.5686820148612215, 'bull_tsl_mult': 0.39799719648361875, 'bull_time_stop': 72, 'bull_use_sma': True, 'bull_use_ema': True, 'bull_use_atr': True, 'bull_use_adx': True, 'bull_use_spike': False, 'bull_rsi_required': True, 'bear_strategy': 'breakout', 'bear_bb_std_mult': 3.1278235928574327, 'bear_rsi_os': 47, 'bear_rsi_ob': 88, 'bear_adx_thresh': 14.74082095759012, 'bear_atr_min_pct': 0.020077329871217495, 'bear_atr_max_pct': 0.037659215737363846, 'bear_tp_mult': 2.273174234751953, 'bear_tsl_mult': 0.8696835157340905, 'bear_time_stop': 98, 'bear_use_sma': True, 'bear_use_ema': True, 'bear_use_atr': False, 'bear_use_adx': True, 'bear_use_spike': False, 'bear_rsi_required': True, 'sideways_strategy': 'breakout', 'sideways_bb_std_mult': 1.2196042713951054, 'sideways_rsi_os': 47, 'sideways_rsi_ob': 52, 'sideways_adx_thresh': 7.573642631386304, 'sideways_atr_min_pct': 0.02144815636980526, 'sideways_atr_max_pct': 0.1493562204216678, 'sideways_tp_mult': 1.4193989334637576, 'sideways_tsl_mult': 0.08044312634552292, 'sideways_time_stop': 45, 'sideways_use_sma': True, 'sideways_use_ema': False, 'sideways_use_atr': True, 'sideways_use_adx': True, 'sideways_use_spike': False, 'sideways_rsi_required': True}.
[I 2025-09-01 14:50:16,031] Trial 724 finished with values: [-1000000000.0, 1000000000.0] and parameters: {'p_sma': 36, 'p_std': 49, 'p_atr': 25, 'p_adx': 26, 'rsi_period': 69, 'ema1': 23, 'ema2': 18, 'slip_atr_k': 3.668414194891653e-05, 'slip_spread_k': 0.10588132496570349, 'spread_hl_frac': 0.0059555009116467, 'bb_std_mult': 1.7474427620618085, 'rsi_os': 42, 'rsi_ob': 74, 'vol_spike': 0.014919756031118225, 'adx_thresh': 26.656841266923507, 'atr_min_pct': 0.025623297149413422, 'atr_max_pct': 0.11308788815598697, 'tp_mult': 2.7973541987730237, 'tsl_mult': 0.6744418355719581, 'strategy': 'mean_reversion', 'time_stop': 229, 'use_sma': True, 'use_atr': False, 'use_adx': False, 'use_ema': True, 'use_spike': True, 'rsi_required': False, 'edge_k': 0.8483807620016472, 'edge_cap': 0.4582630669050669, 'bull_strategy': 'breakout', 'bull_bb_std_mult': 1.9732081659812972, 'bull_rsi_os': 34, 'bull_rsi_ob': 50, 'bull_adx_thresh': 25.62886872444198, 'bull_atr_min_pct': 0.01722080802499422, 'bull_atr_max_pct': 0.14162851989914976, 'bull_tp_mult': 2.8295295603717645, 'bull_tsl_mult': 0.9786848427626829, 'bull_time_stop': 234, 'bull_use_sma': True, 'bull_use_ema': True, 'bull_use_atr': True, 'bull_use_adx': True, 'bull_use_spike': False, 'bull_rsi_required': True, 'bear_strategy': 'breakout', 'bear_bb_std_mult': 2.375358872260803, 'bear_rsi_os': 29, 'bear_rsi_ob': 63, 'bear_adx_thresh': 5.589051454754959, 'bear_atr_min_pct': 0.011529517022572922, 'bear_atr_max_pct': 0.029703873488135912, 'bear_tp_mult': 2.2661849576935915, 'bear_tsl_mult': 0.32933374389300196, 'bear_time_stop': 187, 'bear_use_sma': True, 'bear_use_ema': True, 'bear_use_atr': True, 'bear_use_adx': True, 'bear_use_spike': False, 'bear_rsi_required': True, 'sideways_strategy': 'breakout', 'sideways_bb_std_mult': 1.5312930627923482, 'sideways_rsi_os': 35, 'sideways_rsi_ob': 46, 'sideways_adx_thresh': 7.5785098131570745, 'sideways_atr_min_pct': 0.013346339893568286, 'sideways_atr_max_pct': 0.06312228916003233, 'sideways_tp_mult': 2.7658491277205424, 'sideways_tsl_mult': 0.23121404167548368, 'sideways_time_stop': 115, 'sideways_use_sma': True, 'sideways_use_ema': False, 'sideways_use_atr': True, 'sideways_use_adx': True, 'sideways_use_spike': False, 'sideways_rsi_required': True}.
[I 2025-09-01 14:50:58,703] Trial 727 finished with values: [-0.07484539982243477, 0.07462743863767074] and parameters: {'p_sma': 7, 'p_std': 46, 'p_atr': 7, 'p_adx': 12, 'rsi_period': 82, 'ema1': 15, 'ema2': 18, 'slip_atr_k': 0.09957457956630991, 'slip_spread_k': 0.10320581609502699, 'spread_hl_frac': 0.008596395716475112, 'bb_std_mult': 2.867533154674414, 'rsi_os': 36, 'rsi_ob': 82, 'vol_spike': 0.04394022496335735, 'adx_thresh': 26.648140817944448, 'atr_min_pct': 0.028414755632111717, 'atr_max_pct': 0.1498625269990698, 'tp_mult': 2.797261814153202, 'tsl_mult': 0.5449518101062436, 'strategy': 'mean_reversion', 'time_stop': 230, 'use_sma': True, 'use_atr': False, 'use_adx': True, 'use_ema': True, 'use_spike': True, 'rsi_required': True, 'edge_k': 0.6730351284833317, 'edge_cap': 0.33565549602156, 'bull_strategy': 'breakout', 'bull_bb_std_mult': 0.7587281290189156, 'bull_rsi_os': 21, 'bull_rsi_ob': 90, 'bull_adx_thresh': 33.14932477020855, 'bull_atr_min_pct': 0.02938183406411466, 'bull_atr_max_pct': 0.13478119291174043, 'bull_tp_mult': 1.9520882104707993, 'bull_tsl_mult': 0.6153241850650989, 'bull_time_stop': 70, 'bull_use_sma': True, 'bull_use_ema': True, 'bull_use_atr': True, 'bull_use_adx': True, 'bull_use_spike': False, 'bull_rsi_required': True, 'bear_strategy': 'breakout', 'bear_bb_std_mult': 3.5208219726668655, 'bear_rsi_os': 36, 'bear_rsi_ob': 88, 'bear_adx_thresh': 11.684745556813011, 'bear_atr_min_pct': 0.027359011868212872, 'bear_atr_max_pct': 0.04899388651216251, 'bear_tp_mult': 2.6890722769193296, 'bear_tsl_mult': 0.15878741836009447, 'bear_time_stop': 208, 'bear_use_sma': True, 'bear_use_ema': True, 'bear_use_atr': True, 'bear_use_adx': True, 'bear_use_spike': True, 'bear_rsi_required': True, 'sideways_strategy': 'breakout', 'sideways_bb_std_mult': 3.448178318487152, 'sideways_rsi_os': 47, 'sideways_rsi_ob': 65, 'sideways_adx_thresh': 16.086512637003384, 'sideways_atr_min_pct': 0.0013086967307930387, 'sideways_atr_max_pct': 0.11998961944684375, 'sideways_tp_mult': 1.415773837656224, 'sideways_tsl_mult': 0.08125077530399971, 'sideways_time_stop': 46, 'sideways_use_sma': True, 'sideways_use_ema': False, 'sideways_use_atr': False, 'sideways_use_adx': True, 'sideways_use_spike': False, 'sideways_rsi_required': True}.
[I 2025-09-01 14:50:59,516] Trial 730 finished with values: [-0.02501697993543639, 0.025336785132609424] and parameters: {'p_sma': 35, 'p_std': 19, 'p_atr': 9, 'p_adx': 9, 'rsi_period': 64, 'ema1': 17, 'ema2': 20, 'slip_atr_k': 0.10046397257895857, 'slip_spread_k': 0.49319948012579706, 'spread_hl_frac': 0.042913254308115906, 'bb_std_mult': 1.825621580589957, 'rsi_os': 21, 'rsi_ob': 58, 'vol_spike': 0.06967616596609325, 'adx_thresh': 8.216113276467128, 'atr_min_pct': 0.020853776692526683, 'atr_max_pct': 0.14991084748292782, 'tp_mult': 1.068461241017822, 'tsl_mult': 0.02162322252471577, 'strategy': 'breakout', 'time_stop': 253, 'use_sma': True, 'use_atr': True, 'use_adx': True, 'use_ema': True, 'use_spike': True, 'rsi_required': False, 'edge_k': 0.7355660117811411, 'edge_cap': 0.6466633425644537, 'bull_strategy': 'breakout', 'bull_bb_std_mult': 3.3659248692571064, 'bull_rsi_os': 37, 'bull_rsi_ob': 60, 'bull_adx_thresh': 13.735410724317148, 'bull_atr_min_pct': 0.0029200767821758906, 'bull_atr_max_pct': 0.13485887933405444, 'bull_tp_mult': 2.9027167481589653, 'bull_tsl_mult': 0.6154777682919642, 'bull_time_stop': 250, 'bull_use_sma': True, 'bull_use_ema': True, 'bull_use_atr': True, 'bull_use_adx': True, 'bull_use_spike': False, 'bull_rsi_required': False, 'bear_strategy': 'mean_reversion', 'bear_bb_std_mult': 3.5455111067973717, 'bear_rsi_os': 34, 'bear_rsi_ob': 88, 'bear_adx_thresh': 11.48149135924845, 'bear_atr_min_pct': 0.02807292083826733, 'bear_atr_max_pct': 0.04879132177065269, 'bear_tp_mult': 2.8982671705249716, 'bear_tsl_mult': 0.15538683562988598, 'bear_time_stop': 219, 'bear_use_sma': True, 'bear_use_ema': True, 'bear_use_atr': True, 'bear_use_adx': False, 'bear_use_spike': True, 'bear_rsi_required': True, 'sideways_strategy': 'breakout', 'sideways_bb_std_mult': 1.0880713422139066, 'sideways_rsi_os': 12, 'sideways_rsi_ob': 63, 'sideways_adx_thresh': 8.325552193209276, 'sideways_atr_min_pct': 0.019058893709266455, 'sideways_atr_max_pct': 0.09771669070073238, 'sideways_tp_mult': 2.8248928638702053, 'sideways_tsl_mult': 0.011925839759616919, 'sideways_time_stop': 174, 'sideways_use_sma': True, 'sideways_use_ema': False, 'sideways_use_atr': False, 'sideways_use_adx': True, 'sideways_use_spike': True, 'sideways_rsi_required': True}.
