[I 2025-09-01 13:47:47,369] Trial 289 finished with values: [-1000000000.0, 1000000000.0] and parameters: {'p_sma': 31, 'p_std': 50, 'p_atr': 25, 'p_adx': 11, 'rsi_period': 69, 'ema1': 16, 'ema2': 14, 'slip_atr_k': 0.016328717096324205, 'slip_spread_k': 0.00219409690610034, 'spread_hl_frac': 0.005955825703334996, 'bb_std_mult': 1.1518827377264556, 'rsi_os': 28, 'rsi_ob': 86, 'vol_spike': 0.23650425633475183, 'adx_thresh': 26.537574810820526, 'atr_min_pct': 0.0219658851414743, 'atr_max_pct': 0.1313722467493797, 'tp_mult': 1.9192933815265323, 'tsl_mult': 0.44529904044333846, 'strategy': 'mean_reversion', 'time_stop': 22, 'use_sma': True, 'use_atr': False, 'use_adx': False, 'use_ema': True, 'use_spike': True, 'rsi_required': False, 'edge_k': 0.9842374463024024, 'edge_cap': 0.9193662906828501, 'bull_strategy': 'breakout', 'bull_bb_std_mult': 3.5137686023566603, 'bull_rsi_os': 33, 'bull_rsi_ob': 56, 'bull_adx_thresh': 31.97714126381312, 'bull_atr_min_pct': 0.0037279107342983306, 'bull_atr_max_pct': 0.11797300541866623, 'bull_tp_mult': 2.9412717674225055, 'bull_tsl_mult': 0.3874379819520206, 'bull_time_stop': 102, 'bull_use_sma': True, 'bull_use_ema': False, 'bull_use_atr': True, 'bull_use_adx': True, 'bull_use_spike': False, 'bull_rsi_required': True, 'bear_strategy': 'breakout', 'bear_bb_std_mult': 2.774115894229009, 'bear_rsi_os': 23, 'bear_rsi_ob': 86, 'bear_adx_thresh': 15.353231552520096, 'bear_atr_min_pct': 0.013298851426325252, 'bear_atr_max_pct': 0.045127495414488905, 'bear_tp_mult': 2.1830901982247926, 'bear_tsl_mult': 0.21441630442250975, 'bear_time_stop': 137, 'bear_use_sma': True, 'bear_use_ema': True, 'bear_use_atr': True, 'bear_use_adx': True, 'bear_use_spike': False, 'bear_rsi_required': True, 'sideways_strategy': 'breakout', 'sideways_bb_std_mult': 2.544456174812018, 'sideways_rsi_os': 22, 'sideways_rsi_ob': 84, 'sideways_adx_thresh': 8.404791970388874, 'sideways_atr_min_pct': 0.02246756391824016, 'sideways_atr_max_pct': 0.06790883650674151, 'sideways_tp_mult': 2.8225165332576787, 'sideways_tsl_mult': 0.338060216731568, 'sideways_time_stop': 252, 'sideways_use_sma': True, 'sideways_use_ema': True, 'sideways_use_atr': True, 'sideways_use_adx': True, 'sideways_use_spike': False, 'sideways_rsi_required': True}.
[I 2025-09-01 13:47:47,816] Trial 288 finished with values: [-0.15108743398130542, 0.1505803703333113] and parameters: {'p_sma': 45, 'p_std': 35, 'p_atr': 25, 'p_adx': 11, 'rsi_period': 20, 'ema1': 20, 'ema2': 20, 'slip_atr_k': 0.24076868399555557, 'slip_spread_k': 0.07120071149634677, 'spread_hl_frac': 0.0062943853954303625, 'bb_std_mult': 1.1463294110174922, 'rsi_os': 41, 'rsi_ob': 60, 'vol_spike': 0.25489141910300583, 'adx_thresh': 34.90403976091875, 'atr_min_pct': 0.02148322320428663, 'atr_max_pct': 0.14103953412181564, 'tp_mult': 1.9183277424968317, 'tsl_mult': 0.7230901324819514, 'strategy': 'mean_reversion', 'time_stop': 235, 'use_sma': True, 'use_atr': False, 'use_adx': False, 'use_ema': True, 'use_spike': True, 'rsi_required': False, 'edge_k': 0.8862651319471281, 'edge_cap': 0.9537460220044602, 'bull_strategy': 'mean_reversion', 'bull_bb_std_mult': 1.765646565506139, 'bull_rsi_os': 37, 'bull_rsi_ob': 56, 'bull_adx_thresh': 26.122984930863176, 'bull_atr_min_pct': 0.019283047897289678, 'bull_atr_max_pct': 0.07892733546351931, 'bull_tp_mult': 2.8471366733369425, 'bull_tsl_mult': 0.61170836319977, 'bull_time_stop': 77, 'bull_use_sma': True, 'bull_use_ema': False, 'bull_use_atr': True, 'bull_use_adx': True, 'bull_use_spike': False, 'bull_rsi_required': False, 'bear_strategy': 'breakout', 'bear_bb_std_mult': 3.3968371363027705, 'bear_rsi_os': 46, 'bear_rsi_ob': 86, 'bear_adx_thresh': 12.453306346462623, 'bear_atr_min_pct': 0.002293047116494129, 'bear_atr_max_pct': 0.04376907691174695, 'bear_tp_mult': 2.912444328034487, 'bear_tsl_mult': 0.8761805544304413, 'bear_time_stop': 227, 'bear_use_sma': True, 'bear_use_ema': True, 'bear_use_atr': True, 'bear_use_adx': True, 'bear_use_spike': False, 'bear_rsi_required': True, 'sideways_strategy': 'breakout', 'sideways_bb_std_mult': 3.003298021381822, 'sideways_rsi_os': 21, 'sideways_rsi_ob': 68, 'sideways_adx_thresh': 8.315054448652958, 'sideways_atr_min_pct': 0.022533953872200432, 'sideways_atr_max_pct': 0.07469147057099089, 'sideways_tp_mult': 2.8199541170338898, 'sideways_tsl_mult': 0.28650311508884235, 'sideways_time_stop': 189, 'sideways_use_sma': True, 'sideways_use_ema': False, 'sideways_use_atr': True, 'sideways_use_adx': True, 'sideways_use_spike': False, 'sideways_rsi_required': True}.
[I 2025-09-01 13:47:48,140] Trial 290 finished with values: [-1000000000.0, 1000000000.0] and parameters: {'p_sma': 46, 'p_std': 50, 'p_atr': 21, 'p_adx': 11, 'rsi_period': 68, 'ema1': 16, 'ema2': 14, 'slip_atr_k': 0.015427506241124484, 'slip_spread_k': 0.05864349381000965, 'spread_hl_frac': 0.005943193866434599, 'bb_std_mult': 2.430424490764864, 'rsi_os': 41, 'rsi_ob': 86, 'vol_spike': 0.022534499953929005, 'adx_thresh': 20.242039060030873, 'atr_min_pct': 0.009985441741581634, 'atr_max_pct': 0.1313015729158145, 'tp_mult': 2.2745490086653497, 'tsl_mult': 0.777730859538059, 'strategy': 'mean_reversion', 'time_stop': 21, 'use_sma': True, 'use_atr': False, 'use_adx': False, 'use_ema': True, 'use_spike': True, 'rsi_required': False, 'edge_k': 0.9955602734897863, 'edge_cap': 0.9434091670601567, 'bull_strategy': 'breakout', 'bull_bb_std_mult': 0.6213759116132365, 'bull_rsi_os': 33, 'bull_rsi_ob': 56, 'bull_adx_thresh': 29.618266468191592, 'bull_atr_min_pct': 0.0047577908405474325, 'bull_atr_max_pct': 0.11057100521907233, 'bull_tp_mult': 2.9368334336491646, 'bull_tsl_mult': 0.01370669760401133, 'bull_time_stop': 294, 'bull_use_sma': True, 'bull_use_ema': False, 'bull_use_atr': True, 'bull_use_adx': True, 'bull_use_spike': False, 'bull_rsi_required': True, 'bear_strategy': 'breakout', 'bear_bb_std_mult': 3.598101600630914, 'bear_rsi_os': 31, 'bear_rsi_ob': 49, 'bear_adx_thresh': 15.661913738554153, 'bear_atr_min_pct': 0.0019262969286868849, 'bear_atr_max_pct': 0.04370726274512341, 'bear_tp_mult': 2.919110366726059, 'bear_tsl_mult': 0.000751095844589933, 'bear_time_stop': 221, 'bear_use_sma': True, 'bear_use_ema': True, 'bear_use_atr': True, 'bear_use_adx': True, 'bear_use_spike': False, 'bear_rsi_required': True, 'sideways_strategy': 'breakout', 'sideways_bb_std_mult': 1.4409531427402487, 'sideways_rsi_os': 13, 'sideways_rsi_ob': 81, 'sideways_adx_thresh': 29.161958646880507, 'sideways_atr_min_pct': 0.02250997271435998, 'sideways_atr_max_pct': 0.068322010037807, 'sideways_tp_mult': 2.8411050621867293, 'sideways_tsl_mult': 0.8229143144052828, 'sideways_time_stop': 251, 'sideways_use_sma': True, 'sideways_use_ema': True, 'sideways_use_atr': True, 'sideways_use_adx': True, 'sideways_use_spike': False, 'sideways_rsi_required': True}.
[I 2025-09-01 13:47:48,429] Trial 291 finished with values: [-1000000000.0, 1000000000.0] and parameters: {'p_sma': 39, 'p_std': 50, 'p_atr': 24, 'p_adx': 11, 'rsi_period': 67, 'ema1': 28, 'ema2': 12, 'slip_atr_k': 0.1403892897985771, 'slip_spread_k': 0.11530956811450593, 'spread_hl_frac': 0.02579931463540897, 'bb_std_mult': 3.40063971333744, 'rsi_os': 36, 'rsi_ob': 85, 'vol_spike': 0.23752786927505523, 'adx_thresh': 26.77083914724978, 'atr_min_pct': 0.009967043227712453, 'atr_max_pct': 0.13264562946134428, 'tp_mult': 1.0442822474027054, 'tsl_mult': 0.7772632146204513, 'strategy': 'mean_reversion', 'time_stop': 232, 'use_sma': True, 'use_atr': False, 'use_adx': False, 'use_ema': True, 'use_spike': True, 'rsi_required': False, 'edge_k': 0.9876694814169101, 'edge_cap': 0.34589792130241753, 'bull_strategy': 'breakout', 'bull_bb_std_mult': 0.6429566720317084, 'bull_rsi_os': 35, 'bull_rsi_ob': 55, 'bull_adx_thresh': 31.827520377724213, 'bull_atr_min_pct': 0.017650422791314915, 'bull_atr_max_pct': 0.13336082062801385, 'bull_tp_mult': 2.9510877818169234, 'bull_tsl_mult': 0.911264378894886, 'bull_time_stop': 103, 'bull_use_sma': True, 'bull_use_ema': False, 'bull_use_atr': True, 'bull_use_adx': True, 'bull_use_spike': False, 'bull_rsi_required': True, 'bear_strategy': 'breakout', 'bear_bb_std_mult': 3.3977882713312333, 'bear_rsi_os': 34, 'bear_rsi_ob': 86, 'bear_adx_thresh': 29.436651421678285, 'bear_atr_min_pct': 0.002244701104115261, 'bear_atr_max_pct': 0.044914761426093505, 'bear_tp_mult': 2.3951284543522986, 'bear_tsl_mult': 0.8619079659125505, 'bear_time_stop': 222, 'bear_use_sma': True, 'bear_use_ema': True, 'bear_use_atr': True, 'bear_use_adx': True, 'bear_use_spike': False, 'bear_rsi_required': True, 'sideways_strategy': 'breakout', 'sideways_bb_std_mult': 1.4264818770083194, 'sideways_rsi_os': 15, 'sideways_rsi_ob': 69, 'sideways_adx_thresh': 20.399191333332155, 'sideways_atr_min_pct': 0.017563959898029766, 'sideways_atr_max_pct': 0.06833549205414931, 'sideways_tp_mult': 2.8136205088797395, 'sideways_tsl_mult': 0.9219731232712296, 'sideways_time_stop': 191, 'sideways_use_sma': True, 'sideways_use_ema': True, 'sideways_use_atr': True, 'sideways_use_adx': True, 'sideways_use_spike': False, 'sideways_rsi_required': True}.
[I 2025-09-01 13:47:49,148] Trial 294 finished with values: [-1000000000.0, 1000000000.0] and parameters: {'p_sma': 38, 'p_std': 47, 'p_atr': 24, 'p_adx': 14, 'rsi_period': 65, 'ema1': 11, 'ema2': 12, 'slip_atr_k': 0.0026112082171578545, 'slip_spread_k': 0.20029573594561334, 'spread_hl_frac': 0.026104121914984034, 'bb_std_mult': 1.7576005066340679, 'rsi_os': 53, 'rsi_ob': 85, 'vol_spike': 0.23422684155609463, 'adx_thresh': 30.46155417813607, 'atr_min_pct': 0.024966570345124332, 'atr_max_pct': 0.13859539517101654, 'tp_mult': 2.385557053414072, 'tsl_mult': 0.5403321136082638, 'strategy': 'mean_reversion', 'time_stop': 249, 'use_sma': False, 'use_atr': False, 'use_adx': False, 'use_ema': True, 'use_spike': True, 'rsi_required': False, 'edge_k': 1.5212949649793588, 'edge_cap': 0.3385026203104429, 'bull_strategy': 'breakout', 'bull_bb_std_mult': 2.8445061829887974, 'bull_rsi_os': 42, 'bull_rsi_ob': 54, 'bull_adx_thresh': 11.770356929027159, 'bull_atr_min_pct': 0.023443515315243583, 'bull_atr_max_pct': 0.02356634757629533, 'bull_tp_mult': 1.4034546201962674, 'bull_tsl_mult': 0.12609776153428304, 'bull_time_stop': 93, 'bull_use_sma': False, 'bull_use_ema': True, 'bull_use_atr': False, 'bull_use_adx': False, 'bull_use_spike': True, 'bull_rsi_required': True, 'bear_strategy': 'breakout', 'bear_bb_std_mult': 2.450823941397147, 'bear_rsi_os': 44, 'bear_rsi_ob': 77, 'bear_adx_thresh': 12.822529147886176, 'bear_atr_min_pct': 0.014708335772499977, 'bear_atr_max_pct': 0.04318828510509129, 'bear_tp_mult': 2.4064670457757584, 'bear_tsl_mult': 0.7943388537886562, 'bear_time_stop': 123, 'bear_use_sma': False, 'bear_use_ema': True, 'bear_use_atr': False, 'bear_use_adx': False, 'bear_use_spike': False, 'bear_rsi_required': True, 'sideways_strategy': 'breakout', 'sideways_bb_std_mult': 3.5837714275380126, 'sideways_rsi_os': 50, 'sideways_rsi_ob': 66, 'sideways_adx_thresh': 20.164733241293852, 'sideways_atr_min_pct': 0.02030269705553257, 'sideways_atr_max_pct': 0.0816738411282002, 'sideways_tp_mult': 2.2275867686842976, 'sideways_tsl_mult': 0.2697325244170174, 'sideways_time_stop': 179, 'sideways_use_sma': True, 'sideways_use_ema': False, 'sideways_use_atr': True, 'sideways_use_adx': True, 'sideways_use_spike': True, 'sideways_rsi_required': True}.
[I 2025-09-01 13:47:49,151] Trial 292 finished with values: [-1000000000.0, 1000000000.0] and parameters: {'p_sma': 38, 'p_std': 52, 'p_atr': 24, 'p_adx': 10, 'rsi_period': 67, 'ema1': 6, 'ema2': 19, 'slip_atr_k': 0.0036358834569272195, 'slip_spread_k': 0.9509326769724253, 'spread_hl_frac': 0.030487564787693294, 'bb_std_mult': 2.9659616832363405, 'rsi_os': 53, 'rsi_ob': 71, 'vol_spike': 0.23494105199268753, 'adx_thresh': 34.55643197344619, 'atr_min_pct': 0.029906312596353218, 'atr_max_pct': 0.14057134999227353, 'tp_mult': 2.3935730451041506, 'tsl_mult': 0.7749402638322551, 'strategy': 'mean_reversion', 'time_stop': 185, 'use_sma': True, 'use_atr': False, 'use_adx': False, 'use_ema': True, 'use_spike': True, 'rsi_required': False, 'edge_k': 1.0968058202553992, 'edge_cap': 0.33266225317449344, 'bull_strategy': 'breakout', 'bull_bb_std_mult': 0.6459945647578142, 'bull_rsi_os': 35, 'bull_rsi_ob': 55, 'bull_adx_thresh': 26.167217548586542, 'bull_atr_min_pct': 0.02377001299800985, 'bull_atr_max_pct': 0.023805298563078732, 'bull_tp_mult': 1.0117458649619384, 'bull_tsl_mult': 0.13529492041918312, 'bull_time_stop': 258, 'bull_use_sma': True, 'bull_use_ema': True, 'bull_use_atr': True, 'bull_use_adx': True, 'bull_use_spike': False, 'bull_rsi_required': True, 'bear_strategy': 'breakout', 'bear_bb_std_mult': 3.3870869263671937, 'bear_rsi_os': 34, 'bear_rsi_ob': 75, 'bear_adx_thresh': 12.69789742961228, 'bear_atr_min_pct': 0.017844561530770974, 'bear_atr_max_pct': 0.043302741933484455, 'bear_tp_mult': 2.397271398898205, 'bear_tsl_mult': 0.08303091871856802, 'bear_time_stop': 226, 'bear_use_sma': True, 'bear_use_ema': True, 'bear_use_atr': True, 'bear_use_adx': True, 'bear_use_spike': False, 'bear_rsi_required': True, 'sideways_strategy': 'breakout', 'sideways_bb_std_mult': 3.273559062855017, 'sideways_rsi_os': 13, 'sideways_rsi_ob': 72, 'sideways_adx_thresh': 22.42899402142357, 'sideways_atr_min_pct': 0.017625348767345214, 'sideways_atr_max_pct': 0.07407390041344919, 'sideways_tp_mult': 1.6803713998852137, 'sideways_tsl_mult': 0.26969558169953983, 'sideways_time_stop': 189, 'sideways_use_sma': True, 'sideways_use_ema': False, 'sideways_use_atr': True, 'sideways_use_adx': True, 'sideways_use_spike': False, 'sideways_rsi_required': True}.
[I 2025-09-01 13:47:49,997] Trial 297 finished with values: [-1000000000.0, 1000000000.0] and parameters: {'p_sma': 33, 'p_std': 55, 'p_atr': 26, 'p_adx': 12, 'rsi_period': 55, 'ema1': 22, 'ema2': 39, 'slip_atr_k': 0.17698077627311226, 'slip_spread_k': 0.05495624379043282, 'spread_hl_frac': 0.00892900402091697, 'bb_std_mult': 1.8137031668707604, 'rsi_os': 19, 'rsi_ob': 48, 'vol_spike': 0.2254784198366494, 'adx_thresh': 32.62866809427305, 'atr_min_pct': 0.02417152670312766, 'atr_max_pct': 0.11357055724649753, 'tp_mult': 1.0188061662807752, 'tsl_mult': 0.48621704947348243, 'strategy': 'mean_reversion', 'time_stop': 273, 'use_sma': True, 'use_atr': False, 'use_adx': True, 'use_ema': False, 'use_spike': True, 'rsi_required': False, 'edge_k': 0.9261321731558942, 'edge_cap': 0.5951170256384258, 'bull_strategy': 'breakout', 'bull_bb_std_mult': 3.2978103356828323, 'bull_rsi_os': 38, 'bull_rsi_ob': 51, 'bull_adx_thresh': 10.538852390117047, 'bull_atr_min_pct': 0.003089420643127902, 'bull_atr_max_pct': 0.029459831037348658, 'bull_tp_mult': 2.8902587844141174, 'bull_tsl_mult': 0.40496822070200134, 'bull_time_stop': 91, 'bull_use_sma': False, 'bull_use_ema': True, 'bull_use_atr': True, 'bull_use_adx': True, 'bull_use_spike': True, 'bull_rsi_required': True, 'bear_strategy': 'breakout', 'bear_bb_std_mult': 1.596517225991484, 'bear_rsi_os': 32, 'bear_rsi_ob': 45, 'bear_adx_thresh': 11.78376099589787, 'bear_atr_min_pct': 0.00415589406496551, 'bear_atr_max_pct': 0.11937339980961137, 'bear_tp_mult': 2.2536994085595095, 'bear_tsl_mult': 0.19231461284270762, 'bear_time_stop': 217, 'bear_use_sma': True, 'bear_use_ema': True, 'bear_use_atr': False, 'bear_use_adx': False, 'bear_use_spike': True, 'bear_rsi_required': True, 'sideways_strategy': 'breakout', 'sideways_bb_std_mult': 1.7157557526746765, 'sideways_rsi_os': 50, 'sideways_rsi_ob': 58, 'sideways_adx_thresh': 6.369763029294658, 'sideways_atr_min_pct': 0.0247933357654707, 'sideways_atr_max_pct': 0.0635241469616541, 'sideways_tp_mult': 2.622835674823456, 'sideways_tsl_mult': 0.21081670477490136, 'sideways_time_stop': 169, 'sideways_use_sma': True, 'sideways_use_ema': False, 'sideways_use_atr': False, 'sideways_use_adx': True, 'sideways_use_spike': True, 'sideways_rsi_required': False}.
[I 2025-09-01 13:48:25,031] Trial 295 finished with values: [-1000000000.0, 1000000000.0] and parameters: {'p_sma': 29, 'p_std': 14, 'p_atr': 24, 'p_adx': 14, 'rsi_period': 65, 'ema1': 6, 'ema2': 39, 'slip_atr_k': 0.005630777240360588, 'slip_spread_k': 0.9797467125759983, 'spread_hl_frac': 0.008948176311250399, 'bb_std_mult': 1.7929239266662589, 'rsi_os': 19, 'rsi_ob': 82, 'vol_spike': 0.22783822562160871, 'adx_thresh': 24.63706274120065, 'atr_min_pct': 0.02988447764427224, 'atr_max_pct': 0.13861852733646404, 'tp_mult': 1.0154681999786144, 'tsl_mult': 0.7332855795772837, 'strategy': 'mean_reversion', 'time_stop': 246, 'use_sma': False, 'use_atr': False, 'use_adx': False, 'use_ema': False, 'use_spike': True, 'rsi_required': False, 'edge_k': 0.9112726610134705, 'edge_cap': 0.350416269129313, 'bull_strategy': 'breakout', 'bull_bb_std_mult': 2.472638102277076, 'bull_rsi_os': 36, 'bull_rsi_ob': 48, 'bull_adx_thresh': 27.168513863324065, 'bull_atr_min_pct': 0.0242961903141446, 'bull_atr_max_pct': 0.024225337886778466, 'bull_tp_mult': 2.793343329095347, 'bull_tsl_mult': 0.44296084373420685, 'bull_time_stop': 200, 'bull_use_sma': False, 'bull_use_ema': True, 'bull_use_atr': False, 'bull_use_adx': False, 'bull_use_spike': True, 'bull_rsi_required': True, 'bear_strategy': 'breakout', 'bear_bb_std_mult': 1.5554677787556406, 'bear_rsi_os': 34, 'bear_rsi_ob': 51, 'bear_adx_thresh': 12.898952816446618, 'bear_atr_min_pct': 0.029944131073523506, 'bear_atr_max_pct': 0.04161012732463652, 'bear_tp_mult': 2.260876601852922, 'bear_tsl_mult': 0.4051522761270472, 'bear_time_stop': 214, 'bear_use_sma': False, 'bear_use_ema': True, 'bear_use_atr': False, 'bear_use_adx': False, 'bear_use_spike': False, 'bear_rsi_required': True, 'sideways_strategy': 'breakout', 'sideways_bb_std_mult': 3.2561781262851417, 'sideways_rsi_os': 50, 'sideways_rsi_ob': 66, 'sideways_adx_thresh': 22.39513664318892, 'sideways_atr_min_pct': 0.024489092967183084, 'sideways_atr_max_pct': 0.02319270652117178, 'sideways_tp_mult': 1.735441931390465, 'sideways_tsl_mult': 0.2704998238810608, 'sideways_time_stop': 57, 'sideways_use_sma': True, 'sideways_use_ema': False, 'sideways_use_atr': True, 'sideways_use_adx': True, 'sideways_use_spike': True, 'sideways_rsi_required': False}.
[I 2025-09-01 13:48:25,976] Trial 293 finished with values: [-1000000000.0, 1000000000.0] and parameters: {'p_sma': 38, 'p_std': 34, 'p_atr': 24, 'p_adx': 12, 'rsi_period': 67, 'ema1': 30, 'ema2': 39, 'slip_atr_k': 0.17597871185777916, 'slip_spread_k': 0.11150300908608403, 'spread_hl_frac': 0.01711738748385507, 'bb_std_mult': 1.7863955993800664, 'rsi_os': 19, 'rsi_ob': 82, 'vol_spike': 0.10208442096844905, 'adx_thresh': 30.863469225926927, 'atr_min_pct': 0.009428450037651595, 'atr_max_pct': 0.13167533810635396, 'tp_mult': 1.01427708604965, 'tsl_mult': 0.542667233745666, 'strategy': 'mean_reversion', 'time_stop': 246, 'use_sma': True, 'use_atr': False, 'use_adx': False, 'use_ema': True, 'use_spike': True, 'rsi_required': False, 'edge_k': 1.1838101750267087, 'edge_cap': 0.6034569257152302, 'bull_strategy': 'breakout', 'bull_bb_std_mult': 1.8515664227297668, 'bull_rsi_os': 5, 'bull_rsi_ob': 54, 'bull_adx_thresh': 29.450673457107563, 'bull_atr_min_pct': 0.004810744786270076, 'bull_atr_max_pct': 0.02934408330355382, 'bull_tp_mult': 2.7932884542744714, 'bull_tsl_mult': 0.13161394636694468, 'bull_time_stop': 92, 'bull_use_sma': False, 'bull_use_ema': True, 'bull_use_atr': True, 'bull_use_adx': True, 'bull_use_spike': True, 'bull_rsi_required': True, 'bear_strategy': 'breakout', 'bear_bb_std_mult': 3.5867518398837603, 'bear_rsi_os': 34, 'bear_rsi_ob': 83, 'bear_adx_thresh': 29.75881348185647, 'bear_atr_min_pct': 0.015245836263170673, 'bear_atr_max_pct': 0.04334514901979073, 'bear_tp_mult': 2.2614688432066283, 'bear_tsl_mult': 0.15564149685556017, 'bear_time_stop': 220, 'bear_use_sma': True, 'bear_use_ema': True, 'bear_use_atr': False, 'bear_use_adx': True, 'bear_use_spike': False, 'bear_rsi_required': True, 'sideways_strategy': 'breakout', 'sideways_bb_std_mult': 2.702096263563882, 'sideways_rsi_os': 50, 'sideways_rsi_ob': 66, 'sideways_adx_thresh': 22.461192353718246, 'sideways_atr_min_pct': 0.020366196530165373, 'sideways_atr_max_pct': 0.06314356291484105, 'sideways_tp_mult': 2.296777817877359, 'sideways_tsl_mult': 0.2686877248756831, 'sideways_time_stop': 150, 'sideways_use_sma': True, 'sideways_use_ema': True, 'sideways_use_atr': True, 'sideways_use_adx': True, 'sideways_use_spike': False, 'sideways_rsi_required': True}.
