[I 2025-09-01 14:43:23,946] Trial 675 finished with values: [-1000000000.0, 1000000000.0] and parameters: {'p_sma': 36, 'p_std': 25, 'p_atr': 26, 'p_adx': 10, 'rsi_period': 66, 'ema1': 27, 'ema2': 45, 'slip_atr_k': 0.13085543647274228, 'slip_spread_k': 0.8090996522223309, 'spread_hl_frac': 0.007980419843434249, 'bb_std_mult': 1.6456974678792224, 'rsi_os': 39, 'rsi_ob': 83, 'vol_spike': 0.2681203511125948, 'adx_thresh': 26.420571210660288, 'atr_min_pct': 0.02601202349869978, 'atr_max_pct': 0.14530064486728791, 'tp_mult': 1.1706129831365786, 'tsl_mult': 0.09627676283024716, 'strategy': 'breakout', 'time_stop': 71, 'use_sma': False, 'use_atr': True, 'use_adx': False, 'use_ema': True, 'use_spike': True, 'rsi_required': False, 'edge_k': 1.4526080821597391, 'edge_cap': 0.18878905112539757, 'bull_strategy': 'breakout', 'bull_bb_std_mult': 2.4189697517741693, 'bull_rsi_os': 38, 'bull_rsi_ob': 76, 'bull_adx_thresh': 34.95585818572705, 'bull_atr_min_pct': 0.003526652745345429, 'bull_atr_max_pct': 0.030862657205230272, 'bull_tp_mult': 2.8652917512425904, 'bull_tsl_mult': 0.25000538369979225, 'bull_time_stop': 107, 'bull_use_sma': True, 'bull_use_ema': True, 'bull_use_atr': True, 'bull_use_adx': True, 'bull_use_spike': False, 'bull_rsi_required': True, 'bear_strategy': 'breakout', 'bear_bb_std_mult': 3.4054880895163233, 'bear_rsi_os': 49, 'bear_rsi_ob': 57, 'bear_adx_thresh': 11.891470649905944, 'bear_atr_min_pct': 0.023836162087697073, 'bear_atr_max_pct': 0.04244871515318055, 'bear_tp_mult': 2.2610189756602583, 'bear_tsl_mult': 0.8142550880132632, 'bear_time_stop': 127, 'bear_use_sma': True, 'bear_use_ema': True, 'bear_use_atr': True, 'bear_use_adx': True, 'bear_use_spike': True, 'bear_rsi_required': True, 'sideways_strategy': 'breakout', 'sideways_bb_std_mult': 1.5838059443432622, 'sideways_rsi_os': 11, 'sideways_rsi_ob': 83, 'sideways_adx_thresh': 8.3193228118398, 'sideways_atr_min_pct': 0.02091132453711628, 'sideways_atr_max_pct': 0.06751312126219271, 'sideways_tp_mult': 1.0735332323560705, 'sideways_tsl_mult': 0.32370126761023693, 'sideways_time_stop': 167, 'sideways_use_sma': True, 'sideways_use_ema': False, 'sideways_use_atr': False, 'sideways_use_adx': True, 'sideways_use_spike': False, 'sideways_rsi_required': True}.
[I 2025-09-01 14:43:25,438] Trial 676 finished with values: [-1000000000.0, 1000000000.0] and parameters: {'p_sma': 53, 'p_std': 59, 'p_atr': 26, 'p_adx': 13, 'rsi_period': 66, 'ema1': 12, 'ema2': 19, 'slip_atr_k': 0.04649096510849812, 'slip_spread_k': 0.017727487467554773, 'spread_hl_frac': 0.015660405462226728, 'bb_std_mult': 1.5928206169227443, 'rsi_os': 53, 'rsi_ob': 83, 'vol_spike': 0.24678413026057303, 'adx_thresh': 7.644717324227541, 'atr_min_pct': 0.027201401156698498, 'atr_max_pct': 0.1438179584486329, 'tp_mult': 2.2857117740652257, 'tsl_mult': 0.09903328707717268, 'strategy': 'breakout', 'time_stop': 209, 'use_sma': False, 'use_atr': True, 'use_adx': False, 'use_ema': True, 'use_spike': True, 'rsi_required': True, 'edge_k': 0.9640537212873768, 'edge_cap': 0.8996110604987861, 'bull_strategy': 'breakout', 'bull_bb_std_mult': 3.2389920588445107, 'bull_rsi_os': 38, 'bull_rsi_ob': 53, 'bull_adx_thresh': 23.93790147349785, 'bull_atr_min_pct': 0.017967690374182534, 'bull_atr_max_pct': 0.09845185492259736, 'bull_tp_mult': 2.868516176879571, 'bull_tsl_mult': 0.3850972724385396, 'bull_time_stop': 269, 'bull_use_sma': True, 'bull_use_ema': True, 'bull_use_atr': True, 'bull_use_adx': True, 'bull_use_spike': False, 'bull_rsi_required': True, 'bear_strategy': 'mean_reversion', 'bear_bb_std_mult': 3.398771409467943, 'bear_rsi_os': 30, 'bear_rsi_ob': 86, 'bear_adx_thresh': 11.971787903321612, 'bear_atr_min_pct': 0.002335442991670306, 'bear_atr_max_pct': 0.050096800229644606, 'bear_tp_mult': 2.277567485437896, 'bear_tsl_mult': 0.12416343287140877, 'bear_time_stop': 10, 'bear_use_sma': True, 'bear_use_ema': True, 'bear_use_atr': True, 'bear_use_adx': False, 'bear_use_spike': True, 'bear_rsi_required': True, 'sideways_strategy': 'breakout', 'sideways_bb_std_mult': 1.405712220196716, 'sideways_rsi_os': 51, 'sideways_rsi_ob': 67, 'sideways_adx_thresh': 22.5149580206963, 'sideways_atr_min_pct': 0.005311144821021619, 'sideways_atr_max_pct': 0.06690043169774937, 'sideways_tp_mult': 2.847545383563931, 'sideways_tsl_mult': 0.3688580211037755, 'sideways_time_stop': 205, 'sideways_use_sma': True, 'sideways_use_ema': False, 'sideways_use_atr': False, 'sideways_use_adx': True, 'sideways_use_spike': True, 'sideways_rsi_required': True}.
[I 2025-09-01 14:43:26,818] Trial 678 finished with values: [-1000000000.0, 1000000000.0] and parameters: {'p_sma': 36, 'p_std': 45, 'p_atr': 14, 'p_adx': 13, 'rsi_period': 66, 'ema1': 22, 'ema2': 35, 'slip_atr_k': 0.012472498212230143, 'slip_spread_k': 0.04934482937940564, 'spread_hl_frac': 0.007892332765617313, 'bb_std_mult': 1.8025465407498364, 'rsi_os': 36, 'rsi_ob': 51, 'vol_spike': 0.2672272688010268, 'adx_thresh': 30.46366281234805, 'atr_min_pct': 0.027549224989268716, 'atr_max_pct': 0.026860628574649492, 'tp_mult': 2.295943832030308, 'tsl_mult': 0.09743396252006681, 'strategy': 'mean_reversion', 'time_stop': 28, 'use_sma': True, 'use_atr': True, 'use_adx': False, 'use_ema': True, 'use_spike': True, 'rsi_required': True, 'edge_k': 0.9623473031394433, 'edge_cap': 0.36747943885035694, 'bull_strategy': 'breakout', 'bull_bb_std_mult': 2.4014322011695866, 'bull_rsi_os': 36, 'bull_rsi_ob': 53, 'bull_adx_thresh': 31.0666407828851, 'bull_atr_min_pct': 0.017898646819006037, 'bull_atr_max_pct': 0.03018638595028591, 'bull_tp_mult': 2.5889548909710025, 'bull_tsl_mult': 0.38664747887942863, 'bull_time_stop': 77, 'bull_use_sma': True, 'bull_use_ema': True, 'bull_use_atr': True, 'bull_use_adx': True, 'bull_use_spike': True, 'bull_rsi_required': True, 'bear_strategy': 'mean_reversion', 'bear_bb_std_mult': 1.302728741358475, 'bear_rsi_os': 32, 'bear_rsi_ob': 86, 'bear_adx_thresh': 11.500701123409621, 'bear_atr_min_pct': 0.023033049035801462, 'bear_atr_max_pct': 0.037277626375407054, 'bear_tp_mult': 2.1082657408509684, 'bear_tsl_mult': 0.8135520302023789, 'bear_time_stop': 208, 'bear_use_sma': True, 'bear_use_ema': True, 'bear_use_atr': True, 'bear_use_adx': False, 'bear_use_spike': True, 'bear_rsi_required': True, 'sideways_strategy': 'breakout', 'sideways_bb_std_mult': 2.593581426320691, 'sideways_rsi_os': 52, 'sideways_rsi_ob': 66, 'sideways_adx_thresh': 8.073226993102473, 'sideways_atr_min_pct': 0.018892079246616008, 'sideways_atr_max_pct': 0.06804567346071069, 'sideways_tp_mult': 2.864709372531806, 'sideways_tsl_mult': 0.37027363282302483, 'sideways_time_stop': 164, 'sideways_use_sma': True, 'sideways_use_ema': False, 'sideways_use_atr': False, 'sideways_use_adx': True, 'sideways_use_spike': True, 'sideways_rsi_required': True}.
[I 2025-09-01 14:44:10,682] Trial 681 finished with values: [-1000000000.0, 1000000000.0] and parameters: {'p_sma': 10, 'p_std': 33, 'p_atr': 9, 'p_adx': 12, 'rsi_period': 63, 'ema1': 20, 'ema2': 15, 'slip_atr_k': 0.22230144653987588, 'slip_spread_k': 0.0829047149751077, 'spread_hl_frac': 0.0052593839693710325, 'bb_std_mult': 1.0735873188622578, 'rsi_os': 34, 'rsi_ob': 85, 'vol_spike': 0.22324504138539172, 'adx_thresh': 19.767452130397707, 'atr_min_pct': 0.025591211910519655, 'atr_max_pct': 0.1347273546577181, 'tp_mult': 1.5184152648854652, 'tsl_mult': 0.2953660014384696, 'strategy': 'mean_reversion', 'time_stop': 42, 'use_sma': True, 'use_atr': False, 'use_adx': True, 'use_ema': True, 'use_spike': False, 'rsi_required': False, 'edge_k': 0.2661107807981805, 'edge_cap': 0.7150046454821815, 'bull_strategy': 'mean_reversion', 'bull_bb_std_mult': 1.8405342059915233, 'bull_rsi_os': 19, 'bull_rsi_ob': 85, 'bull_adx_thresh': 7.282156839997663, 'bull_atr_min_pct': 0.006509531928010912, 'bull_atr_max_pct': 0.13225365653941196, 'bull_tp_mult': 1.864300577946248, 'bull_tsl_mult': 0.4290285615638905, 'bull_time_stop': 87, 'bull_use_sma': False, 'bull_use_ema': False, 'bull_use_atr': False, 'bull_use_adx': True, 'bull_use_spike': False, 'bull_rsi_required': True, 'bear_strategy': 'breakout', 'bear_bb_std_mult': 3.5522298950827222, 'bear_rsi_os': 31, 'bear_rsi_ob': 87, 'bear_adx_thresh': 12.827996613273323, 'bear_atr_min_pct': 0.015726025056151675, 'bear_atr_max_pct': 0.04287060028291172, 'bear_tp_mult': 2.2352806417580204, 'bear_tsl_mult': 0.15981320650344702, 'bear_time_stop': 195, 'bear_use_sma': False, 'bear_use_ema': False, 'bear_use_atr': True, 'bear_use_adx': True, 'bear_use_spike': False, 'bear_rsi_required': False, 'sideways_strategy': 'mean_reversion', 'sideways_bb_std_mult': 1.7415237102829701, 'sideways_rsi_os': 49, 'sideways_rsi_ob': 70, 'sideways_adx_thresh': 6.337237760477341, 'sideways_atr_min_pct': 0.009387287467725956, 'sideways_atr_max_pct': 0.02613173179016566, 'sideways_tp_mult': 1.6370727625833117, 'sideways_tsl_mult': 0.5832459220111462, 'sideways_time_stop': 85, 'sideways_use_sma': False, 'sideways_use_ema': True, 'sideways_use_atr': True, 'sideways_use_adx': True, 'sideways_use_spike': False, 'sideways_rsi_required': False}.
[I 2025-09-01 14:44:11,027] Trial 677 finished with values: [-1000000000.0, 1000000000.0] and parameters: {'p_sma': 10, 'p_std': 45, 'p_atr': 14, 'p_adx': 13, 'rsi_period': 48, 'ema1': 22, 'ema2': 17, 'slip_atr_k': 0.011079417377863627, 'slip_spread_k': 0.5791666913435833, 'spread_hl_frac': 0.007984069001801763, 'bb_std_mult': 3.1536531274748425, 'rsi_os': 30, 'rsi_ob': 79, 'vol_spike': 0.2206886606425607, 'adx_thresh': 32.46848026208204, 'atr_min_pct': 0.027279065728218123, 'atr_max_pct': 0.1352365998422212, 'tp_mult': 1.157236195960989, 'tsl_mult': 0.10199586158298551, 'strategy': 'mean_reversion', 'time_stop': 225, 'use_sma': True, 'use_atr': True, 'use_adx': False, 'use_ema': True, 'use_spike': True, 'rsi_required': True, 'edge_k': 0.9690016290308376, 'edge_cap': 0.8972221706343722, 'bull_strategy': 'breakout', 'bull_bb_std_mult': 1.15787932033814, 'bull_rsi_os': 36, 'bull_rsi_ob': 54, 'bull_adx_thresh': 7.25885666512594, 'bull_atr_min_pct': 0.006229273968298142, 'bull_atr_max_pct': 0.1004689894555662, 'bull_tp_mult': 2.8110529545226166, 'bull_tsl_mult': 0.9154981700000597, 'bull_time_stop': 78, 'bull_use_sma': True, 'bull_use_ema': True, 'bull_use_atr': True, 'bull_use_adx': True, 'bull_use_spike': True, 'bull_rsi_required': True, 'bear_strategy': 'mean_reversion', 'bear_bb_std_mult': 3.4098476086552214, 'bear_rsi_os': 22, 'bear_rsi_ob': 58, 'bear_adx_thresh': 21.000850479489962, 'bear_atr_min_pct': 0.0011204684121908053, 'bear_atr_max_pct': 0.042391910942373115, 'bear_tp_mult': 2.111714962326112, 'bear_tsl_mult': 0.8095449522385206, 'bear_time_stop': 207, 'bear_use_sma': True, 'bear_use_ema': True, 'bear_use_atr': True, 'bear_use_adx': False, 'bear_use_spike': True, 'bear_rsi_required': True, 'sideways_strategy': 'breakout', 'sideways_bb_std_mult': 0.6749470140204987, 'sideways_rsi_os': 52, 'sideways_rsi_ob': 66, 'sideways_adx_thresh': 8.243213135138213, 'sideways_atr_min_pct': 0.0068197607122056116, 'sideways_atr_max_pct': 0.06739451070719014, 'sideways_tp_mult': 2.8589653159647157, 'sideways_tsl_mult': 0.5786656479783057, 'sideways_time_stop': 205, 'sideways_use_sma': True, 'sideways_use_ema': False, 'sideways_use_atr': False, 'sideways_use_adx': True, 'sideways_use_spike': True, 'sideways_rsi_required': True}.
[I 2025-09-01 14:44:11,536] Trial 680 finished with values: [-1000000000.0, 1000000000.0] and parameters: {'p_sma': 36, 'p_std': 51, 'p_atr': 14, 'p_adx': 9, 'rsi_period': 74, 'ema1': 16, 'ema2': 34, 'slip_atr_k': 0.010631254107120701, 'slip_spread_k': 0.057271352681204854, 'spread_hl_frac': 0.03669139439863667, 'bb_std_mult': 1.1577696425173187, 'rsi_os': 36, 'rsi_ob': 85, 'vol_spike': 0.2221866966752976, 'adx_thresh': 11.477480052424264, 'atr_min_pct': 0.015627878554623418, 'atr_max_pct': 0.1345132526025457, 'tp_mult': 1.069503434739721, 'tsl_mult': 0.1868506428084824, 'strategy': 'mean_reversion', 'time_stop': 241, 'use_sma': True, 'use_atr': False, 'use_adx': True, 'use_ema': True, 'use_spike': True, 'rsi_required': True, 'edge_k': 1.0786197623741796, 'edge_cap': 0.28654747278962, 'bull_strategy': 'breakout', 'bull_bb_std_mult': 3.0405804925417703, 'bull_rsi_os': 35, 'bull_rsi_ob': 55, 'bull_adx_thresh': 17.712985424165616, 'bull_atr_min_pct': 0.02870099609805327, 'bull_atr_max_pct': 0.022664577917039738, 'bull_tp_mult': 1.512479418700202, 'bull_tsl_mult': 0.43800589041617727, 'bull_time_stop': 86, 'bull_use_sma': True, 'bull_use_ema': True, 'bull_use_atr': False, 'bull_use_adx': True, 'bull_use_spike': True, 'bull_rsi_required': True, 'bear_strategy': 'mean_reversion', 'bear_bb_std_mult': 3.560978489963094, 'bear_rsi_os': 32, 'bear_rsi_ob': 87, 'bear_adx_thresh': 20.92958023375474, 'bear_atr_min_pct': 0.0012781052518234064, 'bear_atr_max_pct': 0.0377971977260262, 'bear_tp_mult': 2.9201732528697004, 'bear_tsl_mult': 0.16210537189553123, 'bear_time_stop': 208, 'bear_use_sma': True, 'bear_use_ema': True, 'bear_use_atr': True, 'bear_use_adx': False, 'bear_use_spike': False, 'bear_rsi_required': True, 'sideways_strategy': 'breakout', 'sideways_bb_std_mult': 0.5216063345499371, 'sideways_rsi_os': 49, 'sideways_rsi_ob': 66, 'sideways_adx_thresh': 6.193294690485239, 'sideways_atr_min_pct': 0.01904100961258321, 'sideways_atr_max_pct': 0.08348551825852173, 'sideways_tp_mult': 2.7521254054073783, 'sideways_tsl_mult': 0.8910390643070186, 'sideways_time_stop': 177, 'sideways_use_sma': True, 'sideways_use_ema': True, 'sideways_use_atr': True, 'sideways_use_adx': True, 'sideways_use_spike': True, 'sideways_rsi_required': True}.
[I 2025-09-01 14:44:11,749] Trial 679 finished with values: [-1000000000.0, 1000000000.0] and parameters: {'p_sma': 36, 'p_std': 52, 'p_atr': 14, 'p_adx': 13, 'rsi_period': 74, 'ema1': 22, 'ema2': 17, 'slip_atr_k': 0.1583283365485545, 'slip_spread_k': 0.5963950410511747, 'spread_hl_frac': 0.0052938247501722905, 'bb_std_mult': 1.8187426940944122, 'rsi_os': 6, 'rsi_ob': 85, 'vol_spike': 0.21989702582815554, 'adx_thresh': 19.875753995762246, 'atr_min_pct': 0.015408571272336986, 'atr_max_pct': 0.13486817639176318, 'tp_mult': 1.0664315551691086, 'tsl_mult': 0.17837128491452575, 'strategy': 'mean_reversion', 'time_stop': 22, 'use_sma': True, 'use_atr': False, 'use_adx': True, 'use_ema': True, 'use_spike': True, 'rsi_required': True, 'edge_k': 0.9632999982724348, 'edge_cap': 0.36142890109032993, 'bull_strategy': 'breakout', 'bull_bb_std_mult': 1.1547980848605732, 'bull_rsi_os': 36, 'bull_rsi_ob': 86, 'bull_adx_thresh': 27.02793671598502, 'bull_atr_min_pct': 0.006268155805373453, 'bull_atr_max_pct': 0.13999817899133668, 'bull_tp_mult': 2.83164748462435, 'bull_tsl_mult': 0.4416379242703309, 'bull_time_stop': 271, 'bull_use_sma': True, 'bull_use_ema': True, 'bull_use_atr': False, 'bull_use_adx': True, 'bull_use_spike': True, 'bull_rsi_required': True, 'bear_strategy': 'mean_reversion', 'bear_bb_std_mult': 3.5470070888694356, 'bear_rsi_os': 43, 'bear_rsi_ob': 86, 'bear_adx_thresh': 21.886184907488072, 'bear_atr_min_pct': 0.025156546711242636, 'bear_atr_max_pct': 0.043534913244662334, 'bear_tp_mult': 2.23172455082449, 'bear_tsl_mult': 0.1090687046784875, 'bear_time_stop': 195, 'bear_use_sma': True, 'bear_use_ema': True, 'bear_use_atr': True, 'bear_use_adx': False, 'bear_use_spike': True, 'bear_rsi_required': True, 'sideways_strategy': 'breakout', 'sideways_bb_std_mult': 1.7466628939149296, 'sideways_rsi_os': 51, 'sideways_rsi_ob': 58, 'sideways_adx_thresh': 6.459378867140631, 'sideways_atr_min_pct': 0.019330580429833013, 'sideways_atr_max_pct': 0.06438036189452066, 'sideways_tp_mult': 2.8652739824095073, 'sideways_tsl_mult': 0.24140886619782181, 'sideways_time_stop': 68, 'sideways_use_sma': True, 'sideways_use_ema': True, 'sideways_use_atr': False, 'sideways_use_adx': True, 'sideways_use_spike': True, 'sideways_rsi_required': True}.
[I 2025-09-01 14:44:12,816] Trial 682 finished with values: [-1000000000.0, 1000000000.0] and parameters: {'p_sma': 37, 'p_std': 38, 'p_atr': 8, 'p_adx': 12, 'rsi_period': 74, 'ema1': 30, 'ema2': 17, 'slip_atr_k': 0.09723737627784944, 'slip_spread_k': 0.05815939481511967, 'spread_hl_frac': 0.04085401954259066, 'bb_std_mult': 3.1466517697500187, 'rsi_os': 40, 'rsi_ob': 49, 'vol_spike': 0.23588950209900147, 'adx_thresh': 12.214342180308357, 'atr_min_pct': 0.0050354224843621, 'atr_max_pct': 0.052760653902608215, 'tp_mult': 1.0697487707216944, 'tsl_mult': 0.7679896429604542, 'strategy': 'mean_reversion', 'time_stop': 138, 'use_sma': True, 'use_atr': False, 'use_adx': False, 'use_ema': True, 'use_spike': True, 'rsi_required': False, 'edge_k': 1.0854913384533185, 'edge_cap': 0.2901291652977336, 'bull_strategy': 'breakout', 'bull_bb_std_mult': 3.0638486593417436, 'bull_rsi_os': 36, 'bull_rsi_ob': 55, 'bull_adx_thresh': 26.901895873120157, 'bull_atr_min_pct': 0.001964369666844462, 'bull_atr_max_pct': 0.022601986704187657, 'bull_tp_mult': 2.8003080785392034, 'bull_tsl_mult': 0.676151261327322, 'bull_time_stop': 90, 'bull_use_sma': True, 'bull_use_ema': True, 'bull_use_atr': True, 'bull_use_adx': True, 'bull_use_spike': True, 'bull_rsi_required': False, 'bear_strategy': 'breakout', 'bear_bb_std_mult': 3.521945272636855, 'bear_rsi_os': 40, 'bear_rsi_ob': 82, 'bear_adx_thresh': 14.363628624775412, 'bear_atr_min_pct': 0.00632431113773756, 'bear_atr_max_pct': 0.04809753284802491, 'bear_tp_mult': 2.314390061873512, 'bear_tsl_mult': 0.10310696600855505, 'bear_time_stop': 43, 'bear_use_sma': True, 'bear_use_ema': True, 'bear_use_atr': True, 'bear_use_adx': True, 'bear_use_spike': False, 'bear_rsi_required': True, 'sideways_strategy': 'breakout', 'sideways_bb_std_mult': 1.514671763122234, 'sideways_rsi_os': 27, 'sideways_rsi_ob': 77, 'sideways_adx_thresh': 7.3563697770171315, 'sideways_atr_min_pct': 0.029934760052395808, 'sideways_atr_max_pct': 0.07077197653147138, 'sideways_tp_mult': 2.7530820355919396, 'sideways_tsl_mult': 0.2437269100893857, 'sideways_time_stop': 66, 'sideways_use_sma': True, 'sideways_use_ema': True, 'sideways_use_atr': True, 'sideways_use_adx': False, 'sideways_use_spike': False, 'sideways_rsi_required': True}.
[I 2025-09-01 14:44:12,837] Trial 684 finished with values: [-1000000000.0, 1000000000.0] and parameters: {'p_sma': 26, 'p_std': 49, 'p_atr': 24, 'p_adx': 28, 'rsi_period': 24, 'ema1': 21, 'ema2': 48, 'slip_atr_k': 0.022252448992148732, 'slip_spread_k': 0.07923324013920194, 'spread_hl_frac': 0.011330309278014615, 'bb_std_mult': 3.2475333343950528, 'rsi_os': 20, 'rsi_ob': 49, 'vol_spike': 0.23575193767438415, 'adx_thresh': 24.785418939919882, 'atr_min_pct': 0.02614159454876321, 'atr_max_pct': 0.03561860487086464, 'tp_mult': 2.439934432405854, 'tsl_mult': 0.8110623738493614, 'strategy': 'mean_reversion', 'time_stop': 136, 'use_sma': True, 'use_atr': False, 'use_adx': False, 'use_ema': True, 'use_spike': True, 'rsi_required': False, 'edge_k': 1.5390469036837136, 'edge_cap': 0.3079637808375009, 'bull_strategy': 'breakout', 'bull_bb_std_mult': 3.0911854677312918, 'bull_rsi_os': 18, 'bull_rsi_ob': 67, 'bull_adx_thresh': 29.322546144877027, 'bull_atr_min_pct': 0.002261405527142112, 'bull_atr_max_pct': 0.026782604432440214, 'bull_tp_mult': 2.787142285330198, 'bull_tsl_mult': 0.4424501368589735, 'bull_time_stop': 257, 'bull_use_sma': True, 'bull_use_ema': True, 'bull_use_atr': True, 'bull_use_adx': False, 'bull_use_spike': False, 'bull_rsi_required': False, 'bear_strategy': 'breakout', 'bear_bb_std_mult': 2.288846544650687, 'bear_rsi_os': 33, 'bear_rsi_ob': 73, 'bear_adx_thresh': 6.333903342558818, 'bear_atr_min_pct': 0.003392206302448092, 'bear_atr_max_pct': 0.06370102095539366, 'bear_tp_mult': 2.636871853111007, 'bear_tsl_mult': 0.6463163380450652, 'bear_time_stop': 173, 'bear_use_sma': True, 'bear_use_ema': True, 'bear_use_atr': True, 'bear_use_adx': True, 'bear_use_spike': False, 'bear_rsi_required': True, 'sideways_strategy': 'breakout', 'sideways_bb_std_mult': 3.4195995878906196, 'sideways_rsi_os': 10, 'sideways_rsi_ob': 45, 'sideways_adx_thresh': 29.184649286751903, 'sideways_atr_min_pct': 0.0203415870671357, 'sideways_atr_max_pct': 0.09419038189955721, 'sideways_tp_mult': 2.8017371819211117, 'sideways_tsl_mult': 0.24282561919940546, 'sideways_time_stop': 265, 'sideways_use_sma': True, 'sideways_use_ema': False, 'sideways_use_atr': True, 'sideways_use_adx': False, 'sideways_use_spike': False, 'sideways_rsi_required': True}.
