[I 2025-09-01 13:10:14,030] Trial 55 finished with values: [-1000000000.0, 1000000000.0] and parameters: {'p_sma': 27, 'p_std': 19, 'p_atr': 10, 'p_adx': 22, 'rsi_period': 32, 'ema1': 22, 'ema2': 21, 'slip_atr_k': 0.08030942559400442, 'slip_spread_k': 0.5243025985323032, 'spread_hl_frac': 0.020891119226049658, 'bb_std_mult': 1.8142629025484132, 'rsi_os': 42, 'rsi_ob': 77, 'vol_spike': 0.12459860337481933, 'adx_thresh': 13.372123132268086, 'atr_min_pct': 0.029746594313479847, 'atr_max_pct': 0.05879821323288162, 'tp_mult': 2.0149650892201034, 'tsl_mult': 0.68507964039759, 'strategy': 'mean_reversion', 'time_stop': 163, 'use_sma': False, 'use_atr': False, 'use_adx': False, 'use_ema': False, 'use_spike': False, 'rsi_required': True, 'edge_k': 0.3801515720414801, 'edge_cap': 0.23906369956862134, 'bull_strategy': 'breakout', 'bull_bb_std_mult': 2.877338590591848, 'bull_rsi_os': 39, 'bull_rsi_ob': 60, 'bull_adx_thresh': 18.33471547702489, 'bull_atr_min_pct': 0.01821425080097337, 'bull_atr_max_pct': 0.039981972440516954, 'bull_tp_mult': 2.1691136836821663, 'bull_tsl_mult': 0.7073112627756554, 'bull_time_stop': 98, 'bull_use_sma': True, 'bull_use_ema': False, 'bull_use_atr': False, 'bull_use_adx': True, 'bull_use_spike': False, 'bull_rsi_required': True, 'bear_strategy': 'mean_reversion', 'bear_bb_std_mult': 2.1437555918251943, 'bear_rsi_os': 31, 'bear_rsi_ob': 47, 'bear_adx_thresh': 17.685852690987165, 'bear_atr_min_pct': 0.01796227333548639, 'bear_atr_max_pct': 0.05293320287262761, 'bear_tp_mult': 2.2238546839206133, 'bear_tsl_mult': 0.4699574933657285, 'bear_time_stop': 143, 'bear_use_sma': True, 'bear_use_ema': True, 'bear_use_atr': True, 'bear_use_adx': False, 'bear_use_spike': False, 'bear_rsi_required': False, 'sideways_strategy': 'mean_reversion', 'sideways_bb_std_mult': 0.9455250339919133, 'sideways_rsi_os': 40, 'sideways_rsi_ob': 57, 'sideways_adx_thresh': 21.222403713614156, 'sideways_atr_min_pct': 0.029046405076078696, 'sideways_atr_max_pct': 0.07912671347587759, 'sideways_tp_mult': 1.5774788382312739, 'sideways_tsl_mult': 0.8479760676409193, 'sideways_time_stop': 102, 'sideways_use_sma': False, 'sideways_use_ema': True, 'sideways_use_atr': True, 'sideways_use_adx': False, 'sideways_use_spike': True, 'sideways_rsi_required': False}.
[I 2025-09-01 13:10:14,519] Trial 54 finished with values: [-0.041164103449874756, 0.04092351802617086] and parameters: {'p_sma': 26, 'p_std': 13, 'p_atr': 29, 'p_adx': 17, 'rsi_period': 30, 'ema1': 23, 'ema2': 20, 'slip_atr_k': 0.08900025108058707, 'slip_spread_k': 0.5453650341699352, 'spread_hl_frac': 0.020273245958043182, 'bb_std_mult': 1.8321134061137, 'rsi_os': 40, 'rsi_ob': 87, 'vol_spike': 0.1279078375913488, 'adx_thresh': 16.3726149830045, 'atr_min_pct': 0.003063868280741471, 'atr_max_pct': 0.05611084984949319, 'tp_mult': 2.4110593550346824, 'tsl_mult': 0.12458597618368594, 'strategy': 'mean_reversion', 'time_stop': 143, 'use_sma': False, 'use_atr': False, 'use_adx': False, 'use_ema': False, 'use_spike': False, 'rsi_required': True, 'edge_k': 0.4058810687106653, 'edge_cap': 0.22619185935665698, 'bull_strategy': 'breakout', 'bull_bb_std_mult': 2.9302681065885783, 'bull_rsi_os': 39, 'bull_rsi_ob': 59, 'bull_adx_thresh': 18.420977498274805, 'bull_atr_min_pct': 0.00221573021260932, 'bull_atr_max_pct': 0.02888679514237296, 'bull_tp_mult': 1.1302505203883544, 'bull_tsl_mult': 0.6855166372566055, 'bull_time_stop': 98, 'bull_use_sma': True, 'bull_use_ema': False, 'bull_use_atr': False, 'bull_use_adx': True, 'bull_use_spike': False, 'bull_rsi_required': True, 'bear_strategy': 'mean_reversion', 'bear_bb_std_mult': 3.0607687735206044, 'bear_rsi_os': 32, 'bear_rsi_ob': 63, 'bear_adx_thresh': 17.453030018555808, 'bear_atr_min_pct': 0.011052547236464627, 'bear_atr_max_pct': 0.14907601037072032, 'bear_tp_mult': 2.2052209613510314, 'bear_tsl_mult': 0.4512945115869176, 'bear_time_stop': 163, 'bear_use_sma': True, 'bear_use_ema': True, 'bear_use_atr': True, 'bear_use_adx': True, 'bear_use_spike': False, 'bear_rsi_required': False, 'sideways_strategy': 'mean_reversion', 'sideways_bb_std_mult': 0.5987105875909522, 'sideways_rsi_os': 11, 'sideways_rsi_ob': 58, 'sideways_adx_thresh': 26.110802222328104, 'sideways_atr_min_pct': 0.029654523555822966, 'sideways_atr_max_pct': 0.07695537116160579, 'sideways_tp_mult': 2.2506485860803145, 'sideways_tsl_mult': 0.8765289394941767, 'sideways_time_stop': 114, 'sideways_use_sma': False, 'sideways_use_ema': True, 'sideways_use_atr': True, 'sideways_use_adx': False, 'sideways_use_spike': True, 'sideways_rsi_required': True}.
[I 2025-09-01 13:10:14,848] Trial 58 finished with values: [-1000000000.0, 1000000000.0] and parameters: {'p_sma': 23, 'p_std': 51, 'p_atr': 29, 'p_adx': 20, 'rsi_period': 81, 'ema1': 5, 'ema2': 51, 'slip_atr_k': 0.1462900536787057, 'slip_spread_k': 0.5486503139761962, 'spread_hl_frac': 0.03721919576950413, 'bb_std_mult': 1.682483809452206, 'rsi_os': 50, 'rsi_ob': 52, 'vol_spike': 0.05416001306197836, 'adx_thresh': 17.071370035813697, 'atr_min_pct': 0.002920926805272551, 'atr_max_pct': 0.08164045219369657, 'tp_mult': 1.8233538842401762, 'tsl_mult': 0.13292024754622123, 'strategy': 'mean_reversion', 'time_stop': 26, 'use_sma': True, 'use_atr': True, 'use_adx': False, 'use_ema': True, 'use_spike': False, 'rsi_required': True, 'edge_k': 0.5678468258477651, 'edge_cap': 0.8603803279368379, 'bull_strategy': 'breakout', 'bull_bb_std_mult': 2.055716297526506, 'bull_rsi_os': 53, 'bull_rsi_ob': 58, 'bull_adx_thresh': 13.092649460196291, 'bull_atr_min_pct': 0.0042711335018082545, 'bull_atr_max_pct': 0.011964352601306918, 'bull_tp_mult': 2.4229273985276167, 'bull_tsl_mult': 0.6307641021380349, 'bull_time_stop': 136, 'bull_use_sma': True, 'bull_use_ema': False, 'bull_use_atr': False, 'bull_use_adx': False, 'bull_use_spike': False, 'bull_rsi_required': True, 'bear_strategy': 'mean_reversion', 'bear_bb_std_mult': 0.652558194807713, 'bear_rsi_os': 51, 'bear_rsi_ob': 63, 'bear_adx_thresh': 20.848647797060714, 'bear_atr_min_pct': 0.019054777475026638, 'bear_atr_max_pct': 0.10979927543971991, 'bear_tp_mult': 2.3991229145818824, 'bear_tsl_mult': 0.2927626520917627, 'bear_time_stop': 157, 'bear_use_sma': True, 'bear_use_ema': True, 'bear_use_atr': False, 'bear_use_adx': False, 'bear_use_spike': False, 'bear_rsi_required': False, 'sideways_strategy': 'mean_reversion', 'sideways_bb_std_mult': 0.5142619344351769, 'sideways_rsi_os': 30, 'sideways_rsi_ob': 66, 'sideways_adx_thresh': 17.308611304117832, 'sideways_atr_min_pct': 0.0058464347163441266, 'sideways_atr_max_pct': 0.10624255188329974, 'sideways_tp_mult': 1.746917895776975, 'sideways_tsl_mult': 0.8774067517894177, 'sideways_time_stop': 58, 'sideways_use_sma': False, 'sideways_use_ema': False, 'sideways_use_atr': True, 'sideways_use_adx': False, 'sideways_use_spike': False, 'sideways_rsi_required': True}.
[I 2025-09-01 13:10:53,889] Trial 60 finished with values: [-1000000000.0, 1000000000.0] and parameters: {'p_sma': 26, 'p_std': 47, 'p_atr': 20, 'p_adx': 18, 'rsi_period': 56, 'ema1': 20, 'ema2': 53, 'slip_atr_k': 0.028107218876134432, 'slip_spread_k': 0.7706496370899555, 'spread_hl_frac': 0.01690278529667403, 'bb_std_mult': 2.6553559085740495, 'rsi_os': 8, 'rsi_ob': 92, 'vol_spike': 0.10936190644660596, 'adx_thresh': 16.076622983709232, 'atr_min_pct': 0.02449213171811447, 'atr_max_pct': 0.03887501856974589, 'tp_mult': 2.1523572189894247, 'tsl_mult': 0.5824158908210388, 'strategy': 'mean_reversion', 'time_stop': 218, 'use_sma': False, 'use_atr': False, 'use_adx': False, 'use_ema': True, 'use_spike': False, 'rsi_required': True, 'edge_k': 0.26229663152975835, 'edge_cap': 0.104689556024956, 'bull_strategy': 'mean_reversion', 'bull_bb_std_mult': 3.3894131868422184, 'bull_rsi_os': 52, 'bull_rsi_ob': 86, 'bull_adx_thresh': 23.125407856172764, 'bull_atr_min_pct': 0.0021152592587503315, 'bull_atr_max_pct': 0.10599531138227633, 'bull_tp_mult': 1.2611203430627145, 'bull_tsl_mult': 0.25631095817255023, 'bull_time_stop': 151, 'bull_use_sma': True, 'bull_use_ema': False, 'bull_use_atr': False, 'bull_use_adx': False, 'bull_use_spike': False, 'bull_rsi_required': True, 'bear_strategy': 'mean_reversion', 'bear_bb_std_mult': 1.3200677274716868, 'bear_rsi_os': 44, 'bear_rsi_ob': 75, 'bear_adx_thresh': 20.331526277160073, 'bear_atr_min_pct': 0.009811918878552806, 'bear_atr_max_pct': 0.0933061969411095, 'bear_tp_mult': 2.8814026933394086, 'bear_tsl_mult': 0.5288740068282801, 'bear_time_stop': 199, 'bear_use_sma': True, 'bear_use_ema': True, 'bear_use_atr': True, 'bear_use_adx': True, 'bear_use_spike': False, 'bear_rsi_required': False, 'sideways_strategy': 'mean_reversion', 'sideways_bb_std_mult': 0.6844483134932656, 'sideways_rsi_os': 23, 'sideways_rsi_ob': 52, 'sideways_adx_thresh': 14.822092768947165, 'sideways_atr_min_pct': 0.02652259331604795, 'sideways_atr_max_pct': 0.09456773564692539, 'sideways_tp_mult': 1.3362100641890866, 'sideways_tsl_mult': 0.7867331132599757, 'sideways_time_stop': 19, 'sideways_use_sma': False, 'sideways_use_ema': False, 'sideways_use_atr': True, 'sideways_use_adx': False, 'sideways_use_spike': False, 'sideways_rsi_required': False}.
[I 2025-09-01 13:10:54,690] Trial 56 finished with values: [-0.03748956131347747, 0.03732440103910318] and parameters: {'p_sma': 27, 'p_std': 19, 'p_atr': 29, 'p_adx': 17, 'rsi_period': 33, 'ema1': 21, 'ema2': 52, 'slip_atr_k': 0.08635690462953896, 'slip_spread_k': 0.5696018687895724, 'spread_hl_frac': 0.01666961648259696, 'bb_std_mult': 2.776716322689455, 'rsi_os': 41, 'rsi_ob': 88, 'vol_spike': 0.1062333145331834, 'adx_thresh': 16.974491788042485, 'atr_min_pct': 0.002681422907941735, 'atr_max_pct': 0.07173487947453765, 'tp_mult': 1.849204083388805, 'tsl_mult': 0.1547347598247351, 'strategy': 'mean_reversion', 'time_stop': 165, 'use_sma': False, 'use_atr': False, 'use_adx': False, 'use_ema': True, 'use_spike': False, 'rsi_required': True, 'edge_k': 0.5748974771649976, 'edge_cap': 0.20859558059838268, 'bull_strategy': 'breakout', 'bull_bb_std_mult': 2.0108962606778418, 'bull_rsi_os': 55, 'bull_rsi_ob': 59, 'bull_adx_thresh': 18.144899940484088, 'bull_atr_min_pct': 0.0021239889645208784, 'bull_atr_max_pct': 0.11293817349284804, 'bull_tp_mult': 2.1613046107476177, 'bull_tsl_mult': 0.6858684320659438, 'bull_time_stop': 96, 'bull_use_sma': True, 'bull_use_ema': False, 'bull_use_atr': False, 'bull_use_adx': True, 'bull_use_spike': False, 'bull_rsi_required': True, 'bear_strategy': 'mean_reversion', 'bear_bb_std_mult': 2.181410216895674, 'bear_rsi_os': 32, 'bear_rsi_ob': 48, 'bear_adx_thresh': 20.28981828080945, 'bear_atr_min_pct': 0.017349138860427424, 'bear_atr_max_pct': 0.1490036916632878, 'bear_tp_mult': 2.8533018445500167, 'bear_tsl_mult': 0.5092249975053543, 'bear_time_stop': 146, 'bear_use_sma': True, 'bear_use_ema': True, 'bear_use_atr': True, 'bear_use_adx': False, 'bear_use_spike': False, 'bear_rsi_required': False, 'sideways_strategy': 'mean_reversion', 'sideways_bb_std_mult': 2.019391708697934, 'sideways_rsi_os': 23, 'sideways_rsi_ob': 49, 'sideways_adx_thresh': 17.868410313819158, 'sideways_atr_min_pct': 0.004212112993335206, 'sideways_atr_max_pct': 0.07676106814795834, 'sideways_tp_mult': 1.3456531061005408, 'sideways_tsl_mult': 0.8661759636101931, 'sideways_time_stop': 112, 'sideways_use_sma': False, 'sideways_use_ema': True, 'sideways_use_atr': True, 'sideways_use_adx': False, 'sideways_use_spike': False, 'sideways_rsi_required': False}.
[I 2025-09-01 13:10:54,962] Trial 57 finished with values: [-0.035318770584708226, 0.03513731962705613] and parameters: {'p_sma': 27, 'p_std': 25, 'p_atr': 29, 'p_adx': 17, 'rsi_period': 32, 'ema1': 21, 'ema2': 51, 'slip_atr_k': 0.15090722872312037, 'slip_spread_k': 0.5483968671566917, 'spread_hl_frac': 0.016392740623880058, 'bb_std_mult': 1.8468668473344378, 'rsi_os': 41, 'rsi_ob': 77, 'vol_spike': 0.10881394390800951, 'adx_thresh': 34.58915164629992, 'atr_min_pct': 0.0022858120295197147, 'atr_max_pct': 0.042091999390399426, 'tp_mult': 1.844342311866697, 'tsl_mult': 0.121977604167686, 'strategy': 'mean_reversion', 'time_stop': 171, 'use_sma': True, 'use_atr': False, 'use_adx': False, 'use_ema': True, 'use_spike': False, 'rsi_required': True, 'edge_k': 0.5697276520961214, 'edge_cap': 0.10916976708800519, 'bull_strategy': 'breakout', 'bull_bb_std_mult': 1.8471507139011871, 'bull_rsi_os': 55, 'bull_rsi_ob': 59, 'bull_adx_thresh': 17.38119320227822, 'bull_atr_min_pct': 0.002183870122755503, 'bull_atr_max_pct': 0.10555455200309682, 'bull_tp_mult': 2.4539859719682204, 'bull_tsl_mult': 0.646220143949951, 'bull_time_stop': 145, 'bull_use_sma': True, 'bull_use_ema': False, 'bull_use_atr': False, 'bull_use_adx': False, 'bull_use_spike': False, 'bull_rsi_required': True, 'bear_strategy': 'mean_reversion', 'bear_bb_std_mult': 1.2891603581622675, 'bear_rsi_os': 51, 'bear_rsi_ob': 48, 'bear_adx_thresh': 10.323139608910893, 'bear_atr_min_pct': 0.01884874442376856, 'bear_atr_max_pct': 0.11043594728705611, 'bear_tp_mult': 2.888639271000493, 'bear_tsl_mult': 0.29521285787625595, 'bear_time_stop': 160, 'bear_use_sma': True, 'bear_use_ema': True, 'bear_use_atr': True, 'bear_use_adx': False, 'bear_use_spike': False, 'bear_rsi_required': False, 'sideways_strategy': 'mean_reversion', 'sideways_bb_std_mult': 0.5522505845886794, 'sideways_rsi_os': 35, 'sideways_rsi_ob': 51, 'sideways_adx_thresh': 15.633975239085705, 'sideways_atr_min_pct': 0.005182265715164746, 'sideways_atr_max_pct': 0.07723921678175029, 'sideways_tp_mult': 1.3348269260009396, 'sideways_tsl_mult': 0.8603514001122939, 'sideways_time_stop': 68, 'sideways_use_sma': False, 'sideways_use_ema': False, 'sideways_use_atr': True, 'sideways_use_adx': False, 'sideways_use_spike': False, 'sideways_rsi_required': False}.
[I 2025-09-01 13:10:55,152] Trial 59 finished with values: [-0.02200142770688507, 0.021769882485296307] and parameters: {'p_sma': 24, 'p_std': 46, 'p_atr': 29, 'p_adx': 20, 'rsi_period': 26, 'ema1': 20, 'ema2': 51, 'slip_atr_k': 0.15141835261051775, 'slip_spread_k': 0.5556966025920053, 'spread_hl_frac': 0.01752749486906502, 'bb_std_mult': 2.5891009840754684, 'rsi_os': 49, 'rsi_ob': 93, 'vol_spike': 0.055832099016690784, 'adx_thresh': 16.9258249791934, 'atr_min_pct': 0.0023160468781847337, 'atr_max_pct': 0.08009488118738534, 'tp_mult': 1.814292991495981, 'tsl_mult': 0.11496689436286778, 'strategy': 'mean_reversion', 'time_stop': 18, 'use_sma': True, 'use_atr': True, 'use_adx': False, 'use_ema': True, 'use_spike': False, 'rsi_required': True, 'edge_k': 0.2628021168110327, 'edge_cap': 0.37310773370797545, 'bull_strategy': 'breakout', 'bull_bb_std_mult': 3.364235829765907, 'bull_rsi_os': 51, 'bull_rsi_ob': 58, 'bull_adx_thresh': 6.464456628987341, 'bull_atr_min_pct': 0.0021965989216045437, 'bull_atr_max_pct': 0.020353188776089964, 'bull_tp_mult': 1.6596431884609766, 'bull_tsl_mult': 0.6248525721022828, 'bull_time_stop': 147, 'bull_use_sma': True, 'bull_use_ema': False, 'bull_use_atr': False, 'bull_use_adx': False, 'bull_use_spike': False, 'bull_rsi_required': True, 'bear_strategy': 'mean_reversion', 'bear_bb_std_mult': 1.3275758131950213, 'bear_rsi_os': 18, 'bear_rsi_ob': 63, 'bear_adx_thresh': 10.48377140482721, 'bear_atr_min_pct': 0.009997386844845165, 'bear_atr_max_pct': 0.11138220853454467, 'bear_tp_mult': 2.8357926279947248, 'bear_tsl_mult': 0.33411867553003016, 'bear_time_stop': 159, 'bear_use_sma': True, 'bear_use_ema': True, 'bear_use_atr': True, 'bear_use_adx': False, 'bear_use_spike': False, 'bear_rsi_required': False, 'sideways_strategy': 'mean_reversion', 'sideways_bb_std_mult': 0.6196802329526965, 'sideways_rsi_os': 35, 'sideways_rsi_ob': 49, 'sideways_adx_thresh': 15.39679488652532, 'sideways_atr_min_pct': 0.02663775664176337, 'sideways_atr_max_pct': 0.09490771421735261, 'sideways_tp_mult': 2.8036873785661753, 'sideways_tsl_mult': 0.7949190974058501, 'sideways_time_stop': 58, 'sideways_use_sma': False, 'sideways_use_ema': False, 'sideways_use_atr': True, 'sideways_use_adx': False, 'sideways_use_spike': False, 'sideways_rsi_required': True}.
[I 2025-09-01 13:11:32,812] Trial 63 finished with values: [-1000000000.0, 1000000000.0] and parameters: {'p_sma': 11, 'p_std': 60, 'p_atr': 26, 'p_adx': 17, 'rsi_period': 62, 'ema1': 21, 'ema2': 48, 'slip_atr_k': 0.09933193634836998, 'slip_spread_k': 0.32044952397809007, 'spread_hl_frac': 0.027701741903011466, 'bb_std_mult': 3.128736167970596, 'rsi_os': 42, 'rsi_ob': 95, 'vol_spike': 0.07632618331509763, 'adx_thresh': 34.89424333891539, 'atr_min_pct': 0.00922307699281441, 'atr_max_pct': 0.02728353690075909, 'tp_mult': 1.0434162890932843, 'tsl_mult': 0.9312567693984793, 'strategy': 'breakout', 'time_stop': 178, 'use_sma': True, 'use_atr': True, 'use_adx': True, 'use_ema': False, 'use_spike': False, 'rsi_required': True, 'edge_k': 0.5488462238505923, 'edge_cap': 0.38243990500000397, 'bull_strategy': 'mean_reversion', 'bull_bb_std_mult': 1.8715076347201012, 'bull_rsi_os': 9, 'bull_rsi_ob': 92, 'bull_adx_thresh': 29.090664056700398, 'bull_atr_min_pct': 0.004750506187118676, 'bull_atr_max_pct': 0.12209943786981446, 'bull_tp_mult': 1.384580654598916, 'bull_tsl_mult': 0.5418864194115559, 'bull_time_stop': 79, 'bull_use_sma': True, 'bull_use_ema': True, 'bull_use_atr': False, 'bull_use_adx': False, 'bull_use_spike': False, 'bull_rsi_required': False, 'bear_strategy': 'mean_reversion', 'bear_bb_std_mult': 1.0458955455429029, 'bear_rsi_os': 40, 'bear_rsi_ob': 78, 'bear_adx_thresh': 22.36745504734209, 'bear_atr_min_pct': 0.021945600488785466, 'bear_atr_max_pct': 0.11176367675650689, 'bear_tp_mult': 2.308911486420418, 'bear_tsl_mult': 0.01714394876216127, 'bear_time_stop': 27, 'bear_use_sma': False, 'bear_use_ema': True, 'bear_use_atr': False, 'bear_use_adx': False, 'bear_use_spike': False, 'bear_rsi_required': False, 'sideways_strategy': 'mean_reversion', 'sideways_bb_std_mult': 1.3166689687867614, 'sideways_rsi_os': 35, 'sideways_rsi_ob': 45, 'sideways_adx_thresh': 15.772279468816627, 'sideways_atr_min_pct': 0.0034930145344069592, 'sideways_atr_max_pct': 0.137763984916778, 'sideways_tp_mult': 1.3165804937005487, 'sideways_tsl_mult': 0.9552144861604762, 'sideways_time_stop': 54, 'sideways_use_sma': False, 'sideways_use_ema': False, 'sideways_use_atr': True, 'sideways_use_adx': False, 'sideways_use_spike': False, 'sideways_rsi_required': False}.
[I 2025-09-01 13:11:33,351] Trial 64 finished with values: [-1000000000.0, 1000000000.0] and parameters: {'p_sma': 11, 'p_std': 46, 'p_atr': 28, 'p_adx': 17, 'rsi_period': 17, 'ema1': 19, 'ema2': 48, 'slip_atr_k': 0.1543720694127565, 'slip_spread_k': 0.4607459103883232, 'spread_hl_frac': 0.0169519904095399, 'bb_std_mult': 3.0396738790524207, 'rsi_os': 49, 'rsi_ob': 95, 'vol_spike': 0.058487953907456876, 'adx_thresh': 34.5642464434913, 'atr_min_pct': 0.00337622810001389, 'atr_max_pct': 0.08244051394009114, 'tp_mult': 1.5843123952189104, 'tsl_mult': 0.09923941853204998, 'strategy': 'breakout', 'time_stop': 32, 'use_sma': True, 'use_atr': True, 'use_adx': True, 'use_ema': True, 'use_spike': False, 'rsi_required': True, 'edge_k': 0.24863033522609546, 'edge_cap': 0.38516640483940234, 'bull_strategy': 'breakout', 'bull_bb_std_mult': 3.115598369825487, 'bull_rsi_os': 49, 'bull_rsi_ob': 54, 'bull_adx_thresh': 6.521271309182918, 'bull_atr_min_pct': 0.015338327784703175, 'bull_atr_max_pct': 0.02036004584749351, 'bull_tp_mult': 1.3982982991624566, 'bull_tsl_mult': 0.6689855620150561, 'bull_time_stop': 164, 'bull_use_sma': True, 'bull_use_ema': True, 'bull_use_atr': False, 'bull_use_adx': False, 'bull_use_spike': False, 'bull_rsi_required': True, 'bear_strategy': 'mean_reversion', 'bear_bb_std_mult': 1.0410374555674764, 'bear_rsi_os': 18, 'bear_rsi_ob': 66, 'bear_adx_thresh': 10.628891182871646, 'bear_atr_min_pct': 0.011713343239609578, 'bear_atr_max_pct': 0.076381784670254, 'bear_tp_mult': 2.8456500682794124, 'bear_tsl_mult': 0.3099439950728564, 'bear_time_stop': 131, 'bear_use_sma': False, 'bear_use_ema': True, 'bear_use_atr': True, 'bear_use_adx': False, 'bear_use_spike': False, 'bear_rsi_required': False, 'sideways_strategy': 'mean_reversion', 'sideways_bb_std_mult': 0.9434506027338396, 'sideways_rsi_os': 36, 'sideways_rsi_ob': 49, 'sideways_adx_thresh': 15.859410303391813, 'sideways_atr_min_pct': 0.02649123590556495, 'sideways_atr_max_pct': 0.09189688033361382, 'sideways_tp_mult': 2.90117057153176, 'sideways_tsl_mult': 0.5498271641753637, 'sideways_time_stop': 68, 'sideways_use_sma': False, 'sideways_use_ema': False, 'sideways_use_atr': True, 'sideways_use_adx': False, 'sideways_use_spike': False, 'sideways_rsi_required': True}.
