[I 2025-09-01 13:21:16,348] Trial 129 finished with values: [-1000000000.0, 1000000000.0] and parameters: {'p_sma': 52, 'p_std': 44, 'p_atr': 30, 'p_adx': 7, 'rsi_period': 76, 'ema1': 12, 'ema2': 34, 'slip_atr_k': 0.06653815917297276, 'slip_spread_k': 0.31962705998604, 'spread_hl_frac': 0.01277334596897009, 'bb_std_mult': 0.5303303021279859, 'rsi_os': 41, 'rsi_ob': 76, 'vol_spike': 0.25474173519763704, 'adx_thresh': 11.414589721913936, 'atr_min_pct': 0.00684305030692756, 'atr_max_pct': 0.03249394471039737, 'tp_mult': 1.541135982371137, 'tsl_mult': 0.5003665437883171, 'strategy': 'breakout', 'time_stop': 79, 'use_sma': True, 'use_atr': True, 'use_adx': True, 'use_ema': False, 'use_spike': False, 'rsi_required': True, 'edge_k': 0.5322481317437237, 'edge_cap': 0.8479380523440169, 'bull_strategy': 'breakout', 'bull_bb_std_mult': 3.0474035997736912, 'bull_rsi_os': 49, 'bull_rsi_ob': 90, 'bull_adx_thresh': 7.43108378636333, 'bull_atr_min_pct': 0.014528000109962682, 'bull_atr_max_pct': 0.0244528357833343, 'bull_tp_mult': 2.208512647935911, 'bull_tsl_mult': 0.4532146394547473, 'bull_time_stop': 14, 'bull_use_sma': True, 'bull_use_ema': True, 'bull_use_atr': True, 'bull_use_adx': True, 'bull_use_spike': True, 'bull_rsi_required': True, 'bear_strategy': 'mean_reversion', 'bear_bb_std_mult': 3.1858354666469797, 'bear_rsi_os': 12, 'bear_rsi_ob': 79, 'bear_adx_thresh': 9.509871399597515, 'bear_atr_min_pct': 0.02294748764754815, 'bear_atr_max_pct': 0.03432976935027278, 'bear_tp_mult': 2.662707255265444, 'bear_tsl_mult': 0.5836483550005429, 'bear_time_stop': 251, 'bear_use_sma': True, 'bear_use_ema': False, 'bear_use_atr': True, 'bear_use_adx': True, 'bear_use_spike': False, 'bear_rsi_required': False, 'sideways_strategy': 'mean_reversion', 'sideways_bb_std_mult': 0.6867223375529781, 'sideways_rsi_os': 32, 'sideways_rsi_ob': 94, 'sideways_adx_thresh': 5.029813502989089, 'sideways_atr_min_pct': 0.011659668447970468, 'sideways_atr_max_pct': 0.12427847364356354, 'sideways_tp_mult': 2.693666640626099, 'sideways_tsl_mult': 0.49704877936695213, 'sideways_time_stop': 216, 'sideways_use_sma': False, 'sideways_use_ema': False, 'sideways_use_atr': True, 'sideways_use_adx': False, 'sideways_use_spike': False, 'sideways_rsi_required': True}.
[I 2025-09-01 13:21:16,778] Trial 126 finished with values: [-0.0416326595191322, 0.04143140674177847] and parameters: {'p_sma': 51, 'p_std': 8, 'p_atr': 30, 'p_adx': 7, 'rsi_period': 77, 'ema1': 26, 'ema2': 57, 'slip_atr_k': 0.11835521249133667, 'slip_spread_k': 0.3772484943118032, 'spread_hl_frac': 0.009209895982542878, 'bb_std_mult': 1.4909755433912788, 'rsi_os': 39, 'rsi_ob': 67, 'vol_spike': 0.22383761910577168, 'adx_thresh': 11.196878698680237, 'atr_min_pct': 0.006666753615588848, 'atr_max_pct': 0.05273356732881442, 'tp_mult': 1.6357306113791552, 'tsl_mult': 0.04927089836893428, 'strategy': 'breakout', 'time_stop': 234, 'use_sma': True, 'use_atr': True, 'use_adx': False, 'use_ema': True, 'use_spike': False, 'rsi_required': True, 'edge_k': 0.5311729759321872, 'edge_cap': 0.8513862681025273, 'bull_strategy': 'breakout', 'bull_bb_std_mult': 1.9368344229925787, 'bull_rsi_os': 37, 'bull_rsi_ob': 67, 'bull_adx_thresh': 19.336744088722725, 'bull_atr_min_pct': 0.000508866758319633, 'bull_atr_max_pct': 0.024289401713836437, 'bull_tp_mult': 1.6966061262010173, 'bull_tsl_mult': 0.3786086497352794, 'bull_time_stop': 53, 'bull_use_sma': True, 'bull_use_ema': True, 'bull_use_atr': True, 'bull_use_adx': True, 'bull_use_spike': False, 'bull_rsi_required': True, 'bear_strategy': 'mean_reversion', 'bear_bb_std_mult': 0.9069168421924614, 'bear_rsi_os': 12, 'bear_rsi_ob': 87, 'bear_adx_thresh': 11.083936921806961, 'bear_atr_min_pct': 0.02392628138836729, 'bear_atr_max_pct': 0.07440301968534091, 'bear_tp_mult': 2.576006288611153, 'bear_tsl_mult': 0.5679543678725419, 'bear_time_stop': 252, 'bear_use_sma': True, 'bear_use_ema': False, 'bear_use_atr': True, 'bear_use_adx': True, 'bear_use_spike': False, 'bear_rsi_required': False, 'sideways_strategy': 'mean_reversion', 'sideways_bb_std_mult': 1.1405091459776933, 'sideways_rsi_os': 25, 'sideways_rsi_ob': 92, 'sideways_adx_thresh': 13.399359502087263, 'sideways_atr_min_pct': 0.00814652873228728, 'sideways_atr_max_pct': 0.1192753351807892, 'sideways_tp_mult': 2.9366856521378493, 'sideways_tsl_mult': 0.4902704134425851, 'sideways_time_stop': 32, 'sideways_use_sma': False, 'sideways_use_ema': False, 'sideways_use_atr': True, 'sideways_use_adx': False, 'sideways_use_spike': False, 'sideways_rsi_required': True}.
[I 2025-09-01 13:21:16,958] Trial 128 finished with values: [-1000000000.0, 1000000000.0] and parameters: {'p_sma': 51, 'p_std': 23, 'p_atr': 30, 'p_adx': 7, 'rsi_period': 76, 'ema1': 21, 'ema2': 57, 'slip_atr_k': 0.06705017500167774, 'slip_spread_k': 0.3685081790364551, 'spread_hl_frac': 0.008206150417207188, 'bb_std_mult': 1.546393519373976, 'rsi_os': 37, 'rsi_ob': 85, 'vol_spike': 0.22459516073894176, 'adx_thresh': 10.662612078803152, 'atr_min_pct': 0.012999079200541056, 'atr_max_pct': 0.042178969278849184, 'tp_mult': 1.541673012926851, 'tsl_mult': 0.6624993061936124, 'strategy': 'breakout', 'time_stop': 90, 'use_sma': True, 'use_atr': True, 'use_adx': False, 'use_ema': False, 'use_spike': False, 'rsi_required': True, 'edge_k': 0.527586714529975, 'edge_cap': 0.8249647595864631, 'bull_strategy': 'breakout', 'bull_bb_std_mult': 3.0942204056638505, 'bull_rsi_os': 46, 'bull_rsi_ob': 86, 'bull_adx_thresh': 8.90950852713295, 'bull_atr_min_pct': 0.021452133202888246, 'bull_atr_max_pct': 0.02411700916017998, 'bull_tp_mult': 2.2271286876969874, 'bull_tsl_mult': 0.4542075661785795, 'bull_time_stop': 12, 'bull_use_sma': True, 'bull_use_ema': True, 'bull_use_atr': True, 'bull_use_adx': True, 'bull_use_spike': True, 'bull_rsi_required': True, 'bear_strategy': 'mean_reversion', 'bear_bb_std_mult': 1.1666722476577411, 'bear_rsi_os': 12, 'bear_rsi_ob': 45, 'bear_adx_thresh': 12.694462253577985, 'bear_atr_min_pct': 0.024204955004301545, 'bear_atr_max_pct': 0.09380510472459958, 'bear_tp_mult': 2.5611894510702307, 'bear_tsl_mult': 0.5498621903059862, 'bear_time_stop': 277, 'bear_use_sma': True, 'bear_use_ema': False, 'bear_use_atr': True, 'bear_use_adx': True, 'bear_use_spike': False, 'bear_rsi_required': False, 'sideways_strategy': 'mean_reversion', 'sideways_bb_std_mult': 2.632677099903423, 'sideways_rsi_os': 32, 'sideways_rsi_ob': 94, 'sideways_adx_thresh': 16.400438045266956, 'sideways_atr_min_pct': 0.011525773149927846, 'sideways_atr_max_pct': 0.12451686674504553, 'sideways_tp_mult': 2.8244063090579323, 'sideways_tsl_mult': 0.3478464264448356, 'sideways_time_stop': 222, 'sideways_use_sma': False, 'sideways_use_ema': False, 'sideways_use_atr': True, 'sideways_use_adx': False, 'sideways_use_spike': False, 'sideways_rsi_required': True}.
[I 2025-09-01 13:21:17,133] Trial 127 finished with values: [-1000000000.0, 1000000000.0] and parameters: {'p_sma': 51, 'p_std': 23, 'p_atr': 30, 'p_adx': 20, 'rsi_period': 76, 'ema1': 26, 'ema2': 60, 'slip_atr_k': 0.04324822802037538, 'slip_spread_k': 0.362651245127715, 'spread_hl_frac': 0.009410108364409968, 'bb_std_mult': 0.511691465294563, 'rsi_os': 40, 'rsi_ob': 67, 'vol_spike': 0.25808619473352684, 'adx_thresh': 12.906600195695491, 'atr_min_pct': 0.007236095948711646, 'atr_max_pct': 0.03619657681607471, 'tp_mult': 1.6225855881249431, 'tsl_mult': 0.0381853885454278, 'strategy': 'breakout', 'time_stop': 96, 'use_sma': True, 'use_atr': True, 'use_adx': False, 'use_ema': True, 'use_spike': False, 'rsi_required': True, 'edge_k': 0.5207030747129466, 'edge_cap': 0.8498180095585075, 'bull_strategy': 'breakout', 'bull_bb_std_mult': 1.9260188816651629, 'bull_rsi_os': 49, 'bull_rsi_ob': 71, 'bull_adx_thresh': 9.104941594534047, 'bull_atr_min_pct': 0.0023325563793002626, 'bull_atr_max_pct': 0.024990514910550758, 'bull_tp_mult': 2.211443991503165, 'bull_tsl_mult': 0.37962174279155037, 'bull_time_stop': 52, 'bull_use_sma': True, 'bull_use_ema': True, 'bull_use_atr': True, 'bull_use_adx': True, 'bull_use_spike': False, 'bull_rsi_required': True, 'bear_strategy': 'mean_reversion', 'bear_bb_std_mult': 0.8355790708863683, 'bear_rsi_os': 12, 'bear_rsi_ob': 90, 'bear_adx_thresh': 18.558878073676148, 'bear_atr_min_pct': 0.024367404248670732, 'bear_atr_max_pct': 0.0750395014522388, 'bear_tp_mult': 2.5675669935001304, 'bear_tsl_mult': 0.5551384608317184, 'bear_time_stop': 253, 'bear_use_sma': True, 'bear_use_ema': False, 'bear_use_atr': True, 'bear_use_adx': True, 'bear_use_spike': False, 'bear_rsi_required': False, 'sideways_strategy': 'mean_reversion', 'sideways_bb_std_mult': 0.6732282477850622, 'sideways_rsi_os': 24, 'sideways_rsi_ob': 92, 'sideways_adx_thresh': 32.19686110761882, 'sideways_atr_min_pct': 0.008727325388649308, 'sideways_atr_max_pct': 0.125555109922932, 'sideways_tp_mult': 2.94066514804182, 'sideways_tsl_mult': 0.6440299567897554, 'sideways_time_stop': 7, 'sideways_use_sma': False, 'sideways_use_ema': False, 'sideways_use_atr': True, 'sideways_use_adx': False, 'sideways_use_spike': False, 'sideways_rsi_required': True}.
[I 2025-09-01 13:21:54,493] Trial 131 finished with values: [-1000000000.0, 1000000000.0] and parameters: {'p_sma': 54, 'p_std': 39, 'p_atr': 12, 'p_adx': 30, 'rsi_period': 65, 'ema1': 20, 'ema2': 12, 'slip_atr_k': 0.24246233223202096, 'slip_spread_k': 0.41771047117713833, 'spread_hl_frac': 0.03875989042629342, 'bb_std_mult': 1.6986725528120354, 'rsi_os': 34, 'rsi_ob': 73, 'vol_spike': 0.2407171750323963, 'adx_thresh': 12.813768016683758, 'atr_min_pct': 0.0073869201409469554, 'atr_max_pct': 0.04665791920934618, 'tp_mult': 2.8836290599688024, 'tsl_mult': 0.13110504525489552, 'strategy': 'breakout', 'time_stop': 94, 'use_sma': False, 'use_atr': False, 'use_adx': False, 'use_ema': True, 'use_spike': False, 'rsi_required': False, 'edge_k': 1.6621833343018486, 'edge_cap': 0.7446066039696909, 'bull_strategy': 'breakout', 'bull_bb_std_mult': 0.7952661911153756, 'bull_rsi_os': 51, 'bull_rsi_ob': 49, 'bull_adx_thresh': 9.615968731914837, 'bull_atr_min_pct': 0.025515496658072994, 'bull_atr_max_pct': 0.02120939488582872, 'bull_tp_mult': 2.5667486044802357, 'bull_tsl_mult': 0.9582203479043803, 'bull_time_stop': 31, 'bull_use_sma': True, 'bull_use_ema': True, 'bull_use_atr': True, 'bull_use_adx': True, 'bull_use_spike': False, 'bull_rsi_required': False, 'bear_strategy': 'mean_reversion', 'bear_bb_std_mult': 3.3844919249823056, 'bear_rsi_os': 5, 'bear_rsi_ob': 84, 'bear_adx_thresh': 10.311304727766862, 'bear_atr_min_pct': 0.024639134770782327, 'bear_atr_max_pct': 0.0795382664644651, 'bear_tp_mult': 2.6124381706831694, 'bear_tsl_mult': 0.46261188382342755, 'bear_time_stop': 275, 'bear_use_sma': True, 'bear_use_ema': False, 'bear_use_atr': False, 'bear_use_adx': True, 'bear_use_spike': False, 'bear_rsi_required': False, 'sideways_strategy': 'mean_reversion', 'sideways_bb_std_mult': 3.2520617372235283, 'sideways_rsi_os': 21, 'sideways_rsi_ob': 89, 'sideways_adx_thresh': 28.023687202218763, 'sideways_atr_min_pct': 0.008911748607110482, 'sideways_atr_max_pct': 0.11094464939035553, 'sideways_tp_mult': 2.7601238890431232, 'sideways_tsl_mult': 0.6431929898887713, 'sideways_time_stop': 5, 'sideways_use_sma': False, 'sideways_use_ema': False, 'sideways_use_atr': True, 'sideways_use_adx': False, 'sideways_use_spike': False, 'sideways_rsi_required': True}.
[I 2025-09-01 13:21:55,067] Trial 130 finished with values: [-1000000000.0, 1000000000.0] and parameters: {'p_sma': 50, 'p_std': 23, 'p_atr': 23, 'p_adx': 17, 'rsi_period': 71, 'ema1': 17, 'ema2': 26, 'slip_atr_k': 0.021849423757576134, 'slip_spread_k': 0.8719123131167381, 'spread_hl_frac': 0.04495334256080628, 'bb_std_mult': 1.4956039266394967, 'rsi_os': 37, 'rsi_ob': 93, 'vol_spike': 0.24108737136810657, 'adx_thresh': 12.952214876473207, 'atr_min_pct': 0.007370554730610068, 'atr_max_pct': 0.05500031036370462, 'tp_mult': 1.1681789795899054, 'tsl_mult': 0.13317375143746443, 'strategy': 'breakout', 'time_stop': 232, 'use_sma': True, 'use_atr': True, 'use_adx': False, 'use_ema': True, 'use_spike': False, 'rsi_required': False, 'edge_k': 1.669647755252098, 'edge_cap': 0.7496200417511217, 'bull_strategy': 'breakout', 'bull_bb_std_mult': 0.7590700594979436, 'bull_rsi_os': 11, 'bull_rsi_ob': 49, 'bull_adx_thresh': 8.756696695036934, 'bull_atr_min_pct': 0.02172884130040141, 'bull_atr_max_pct': 0.11008164281050538, 'bull_tp_mult': 2.5851480952585426, 'bull_tsl_mult': 0.37627823059631815, 'bull_time_stop': 11, 'bull_use_sma': True, 'bull_use_ema': True, 'bull_use_atr': True, 'bull_use_adx': True, 'bull_use_spike': False, 'bull_rsi_required': True, 'bear_strategy': 'mean_reversion', 'bear_bb_std_mult': 1.176362636091766, 'bear_rsi_os': 12, 'bear_rsi_ob': 87, 'bear_adx_thresh': 12.579767771035517, 'bear_atr_min_pct': 0.024215658690135256, 'bear_atr_max_pct': 0.08630750123410139, 'bear_tp_mult': 2.4103174011393453, 'bear_tsl_mult': 0.6252268122832711, 'bear_time_stop': 273, 'bear_use_sma': True, 'bear_use_ema': False, 'bear_use_atr': True, 'bear_use_adx': True, 'bear_use_spike': False, 'bear_rsi_required': False, 'sideways_strategy': 'mean_reversion', 'sideways_bb_std_mult': 2.3016164010544404, 'sideways_rsi_os': 24, 'sideways_rsi_ob': 89, 'sideways_adx_thresh': 16.083760558753077, 'sideways_atr_min_pct': 0.01042415500074285, 'sideways_atr_max_pct': 0.11040566631260837, 'sideways_tp_mult': 2.935769331432714, 'sideways_tsl_mult': 0.3357751411047696, 'sideways_time_stop': 5, 'sideways_use_sma': False, 'sideways_use_ema': False, 'sideways_use_atr': True, 'sideways_use_adx': False, 'sideways_use_spike': False, 'sideways_rsi_required': True}.
[I 2025-09-01 13:21:55,094] Trial 132 finished with values: [-1000000000.0, 1000000000.0] and parameters: {'p_sma': 54, 'p_std': 39, 'p_atr': 22, 'p_adx': 17, 'rsi_period': 65, 'ema1': 20, 'ema2': 12, 'slip_atr_k': 0.24469543390830803, 'slip_spread_k': 0.18735345069530418, 'spread_hl_frac': 0.039466899463691196, 'bb_std_mult': 2.0231710893502863, 'rsi_os': 10, 'rsi_ob': 94, 'vol_spike': 0.2637659723996412, 'adx_thresh': 13.004753844371873, 'atr_min_pct': 0.014628911414903332, 'atr_max_pct': 0.047471183708850166, 'tp_mult': 2.7882080867088592, 'tsl_mult': 0.38589363427868556, 'strategy': 'breakout', 'time_stop': 213, 'use_sma': False, 'use_atr': False, 'use_adx': False, 'use_ema': True, 'use_spike': False, 'rsi_required': False, 'edge_k': 1.0304858189327695, 'edge_cap': 0.7370196544634237, 'bull_strategy': 'breakout', 'bull_bb_std_mult': 0.5923539687075117, 'bull_rsi_os': 41, 'bull_rsi_ob': 71, 'bull_adx_thresh': 22.102302194043286, 'bull_atr_min_pct': 0.0025220721592433236, 'bull_atr_max_pct': 0.10930301785118987, 'bull_tp_mult': 2.5851001844422052, 'bull_tsl_mult': 0.27922175045825953, 'bull_time_stop': 31, 'bull_use_sma': True, 'bull_use_ema': True, 'bull_use_atr': True, 'bull_use_adx': True, 'bull_use_spike': False, 'bull_rsi_required': False, 'bear_strategy': 'mean_reversion', 'bear_bb_std_mult': 0.5907750343467664, 'bear_rsi_os': 5, 'bear_rsi_ob': 90, 'bear_adx_thresh': 22.594762345532047, 'bear_atr_min_pct': 0.026582253849755946, 'bear_atr_max_pct': 0.07905257089486643, 'bear_tp_mult': 2.4094120098007656, 'bear_tsl_mult': 0.46575467424723216, 'bear_time_stop': 273, 'bear_use_sma': True, 'bear_use_ema': False, 'bear_use_atr': False, 'bear_use_adx': True, 'bear_use_spike': False, 'bear_rsi_required': False, 'sideways_strategy': 'mean_reversion', 'sideways_bb_std_mult': 2.136621113703143, 'sideways_rsi_os': 22, 'sideways_rsi_ob': 89, 'sideways_adx_thresh': 11.268571435926102, 'sideways_atr_min_pct': 0.008875663225988765, 'sideways_atr_max_pct': 0.019401276238403105, 'sideways_tp_mult': 2.7601398267523787, 'sideways_tsl_mult': 0.6482659400657809, 'sideways_time_stop': 8, 'sideways_use_sma': False, 'sideways_use_ema': False, 'sideways_use_atr': True, 'sideways_use_adx': False, 'sideways_use_spike': False, 'sideways_rsi_required': True}.
[I 2025-09-01 13:21:55,420] Trial 133 finished with values: [-1000000000.0, 1000000000.0] and parameters: {'p_sma': 49, 'p_std': 39, 'p_atr': 15, 'p_adx': 17, 'rsi_period': 71, 'ema1': 19, 'ema2': 55, 'slip_atr_k': 0.04940970139083915, 'slip_spread_k': 0.2040340556330238, 'spread_hl_frac': 0.040858455738191635, 'bb_std_mult': 1.7939302215497988, 'rsi_os': 34, 'rsi_ob': 93, 'vol_spike': 0.2391681884125136, 'adx_thresh': 8.786152292005273, 'atr_min_pct': 0.01712603404237116, 'atr_max_pct': 0.047301580198087154, 'tp_mult': 2.8666522628247226, 'tsl_mult': 0.1315632034188694, 'strategy': 'breakout', 'time_stop': 213, 'use_sma': False, 'use_atr': False, 'use_adx': True, 'use_ema': True, 'use_spike': False, 'rsi_required': False, 'edge_k': 0.5900585372578289, 'edge_cap': 0.7639951142653695, 'bull_strategy': 'mean_reversion', 'bull_bb_std_mult': 0.6146289285011204, 'bull_rsi_os': 51, 'bull_rsi_ob': 49, 'bull_adx_thresh': 22.44610724941934, 'bull_atr_min_pct': 0.012841510175023671, 'bull_atr_max_pct': 0.13397039211663958, 'bull_tp_mult': 1.7602254881717536, 'bull_tsl_mult': 0.9684322521848538, 'bull_time_stop': 33, 'bull_use_sma': False, 'bull_use_ema': True, 'bull_use_atr': True, 'bull_use_adx': True, 'bull_use_spike': False, 'bull_rsi_required': False, 'bear_strategy': 'mean_reversion', 'bear_bb_std_mult': 1.0446431031523824, 'bear_rsi_os': 5, 'bear_rsi_ob': 69, 'bear_adx_thresh': 7.99664741099844, 'bear_atr_min_pct': 0.021892267162115366, 'bear_atr_max_pct': 0.08712532655002474, 'bear_tp_mult': 2.7105801410600385, 'bear_tsl_mult': 0.929452965270193, 'bear_time_stop': 261, 'bear_use_sma': True, 'bear_use_ema': False, 'bear_use_atr': False, 'bear_use_adx': True, 'bear_use_spike': False, 'bear_rsi_required': False, 'sideways_strategy': 'mean_reversion', 'sideways_bb_std_mult': 3.0046720982074913, 'sideways_rsi_os': 30, 'sideways_rsi_ob': 89, 'sideways_adx_thresh': 11.437498154240423, 'sideways_atr_min_pct': 0.01041461841028436, 'sideways_atr_max_pct': 0.02080456391043336, 'sideways_tp_mult': 2.786331883686104, 'sideways_tsl_mult': 0.33013438459553585, 'sideways_time_stop': 5, 'sideways_use_sma': False, 'sideways_use_ema': False, 'sideways_use_atr': True, 'sideways_use_adx': False, 'sideways_use_spike': False, 'sideways_rsi_required': True}.
[I 2025-09-01 13:22:35,116] Trial 134 finished with values: [-1000000000.0, 1000000000.0] and parameters: {'p_sma': 49, 'p_std': 43, 'p_atr': 7, 'p_adx': 18, 'rsi_period': 74, 'ema1': 19, 'ema2': 38, 'slip_atr_k': 0.04915759355710243, 'slip_spread_k': 0.4039081945311896, 'spread_hl_frac': 0.04203500307503802, 'bb_std_mult': 1.7956338355651607, 'rsi_os': 43, 'rsi_ob': 89, 'vol_spike': 0.2148774123604808, 'adx_thresh': 9.007586692308188, 'atr_min_pct': 0.02924568661201994, 'atr_max_pct': 0.04305896475957995, 'tp_mult': 1.4066879656493754, 'tsl_mult': 0.10985606675035334, 'strategy': 'breakout', 'time_stop': 85, 'use_sma': True, 'use_atr': True, 'use_adx': True, 'use_ema': False, 'use_spike': True, 'rsi_required': True, 'edge_k': 0.29326082503610973, 'edge_cap': 0.8228592917617382, 'bull_strategy': 'mean_reversion', 'bull_bb_std_mult': 2.288933664604615, 'bull_rsi_os': 52, 'bull_rsi_ob': 46, 'bull_adx_thresh': 6.366288478690104, 'bull_atr_min_pct': 0.013168296398329726, 'bull_atr_max_pct': 0.1235157608843287, 'bull_tp_mult': 1.7784919888072488, 'bull_tsl_mult': 0.3478264118760887, 'bull_time_stop': 20, 'bull_use_sma': False, 'bull_use_ema': True, 'bull_use_atr': True, 'bull_use_adx': True, 'bull_use_spike': True, 'bull_rsi_required': True, 'bear_strategy': 'mean_reversion', 'bear_bb_std_mult': 1.0570209020869081, 'bear_rsi_os': 36, 'bear_rsi_ob': 93, 'bear_adx_thresh': 9.239914496133537, 'bear_atr_min_pct': 0.02193643197026762, 'bear_atr_max_pct': 0.0710202502091532, 'bear_tp_mult': 2.705315214394025, 'bear_tsl_mult': 0.9414236194751686, 'bear_time_stop': 261, 'bear_use_sma': False, 'bear_use_ema': False, 'bear_use_atr': True, 'bear_use_adx': True, 'bear_use_spike': False, 'bear_rsi_required': True, 'sideways_strategy': 'mean_reversion', 'sideways_bb_std_mult': 0.7856671280860048, 'sideways_rsi_os': 28, 'sideways_rsi_ob': 93, 'sideways_adx_thresh': 14.125505968084713, 'sideways_atr_min_pct': 0.012212042987538793, 'sideways_atr_max_pct': 0.12915316848472827, 'sideways_tp_mult': 2.1935676595453852, 'sideways_tsl_mult': 0.5666560295034228, 'sideways_time_stop': 192, 'sideways_use_sma': True, 'sideways_use_ema': False, 'sideways_use_atr': True, 'sideways_use_adx': False, 'sideways_use_spike': True, 'sideways_rsi_required': False}.
