[I 2025-09-01 13:49:47,042] Trial 304 finished with values: [-1000000000.0, 1000000000.0] and parameters: {'p_sma': 35, 'p_std': 48, 'p_atr': 22, 'p_adx': 10, 'rsi_period': 32, 'ema1': 21, 'ema2': 25, 'slip_atr_k': 0.2270729869262023, 'slip_spread_k': 0.09303306536187567, 'spread_hl_frac': 0.007327693954571626, 'bb_std_mult': 3.1504982296511845, 'rsi_os': 32, 'rsi_ob': 61, 'vol_spike': 0.19638471627428275, 'adx_thresh': 5.134777004611873, 'atr_min_pct': 0.028613491848929307, 'atr_max_pct': 0.13488870633065805, 'tp_mult': 2.1447855493892165, 'tsl_mult': 0.9099047222273235, 'strategy': 'mean_reversion', 'time_stop': 62, 'use_sma': True, 'use_atr': False, 'use_adx': True, 'use_ema': True, 'use_spike': True, 'rsi_required': False, 'edge_k': 0.8632828274970683, 'edge_cap': 0.4080237035124007, 'bull_strategy': 'breakout', 'bull_bb_std_mult': 3.106382000622291, 'bull_rsi_os': 10, 'bull_rsi_ob': 94, 'bull_adx_thresh': 27.721354567505575, 'bull_atr_min_pct': 0.0033330612614691528, 'bull_atr_max_pct': 0.026348132112341643, 'bull_tp_mult': 2.8320309535871546, 'bull_tsl_mult': 0.24020240250360003, 'bull_time_stop': 88, 'bull_use_sma': True, 'bull_use_ema': True, 'bull_use_atr': True, 'bull_use_adx': True, 'bull_use_spike': False, 'bull_rsi_required': True, 'bear_strategy': 'breakout', 'bear_bb_std_mult': 3.5357694457515656, 'bear_rsi_os': 22, 'bear_rsi_ob': 91, 'bear_adx_thresh': 12.281584375502959, 'bear_atr_min_pct': 0.0027194853006683923, 'bear_atr_max_pct': 0.04826852359571974, 'bear_tp_mult': 2.210035278209876, 'bear_tsl_mult': 0.13332706728505955, 'bear_time_stop': 202, 'bear_use_sma': True, 'bear_use_ema': True, 'bear_use_atr': True, 'bear_use_adx': True, 'bear_use_spike': False, 'bear_rsi_required': True, 'sideways_strategy': 'breakout', 'sideways_bb_std_mult': 1.7923799618965601, 'sideways_rsi_os': 51, 'sideways_rsi_ob': 69, 'sideways_adx_thresh': 25.274777434132766, 'sideways_atr_min_pct': 0.021752635697703308, 'sideways_atr_max_pct': 0.06555819362921153, 'sideways_tp_mult': 2.768245778006817, 'sideways_tsl_mult': 0.29775512004494536, 'sideways_time_stop': 174, 'sideways_use_sma': True, 'sideways_use_ema': True, 'sideways_use_atr': True, 'sideways_use_adx': True, 'sideways_use_spike': False, 'sideways_rsi_required': True}.
[I 2025-09-01 13:49:48,294] Trial 305 finished with values: [-1000000000.0, 1000000000.0] and parameters: {'p_sma': 35, 'p_std': 18, 'p_atr': 25, 'p_adx': 12, 'rsi_period': 64, 'ema1': 22, 'ema2': 18, 'slip_atr_k': 0.010844896842519634, 'slip_spread_k': 0.2511186427811547, 'spread_hl_frac': 0.0071055769152176505, 'bb_std_mult': 3.5087041337506553, 'rsi_os': 37, 'rsi_ob': 66, 'vol_spike': 0.05344900341188301, 'adx_thresh': 25.055075040906704, 'atr_min_pct': 0.023184083878401474, 'atr_max_pct': 0.13555586458052718, 'tp_mult': 2.312431932659808, 'tsl_mult': 0.9112910964300175, 'strategy': 'mean_reversion', 'time_stop': 284, 'use_sma': True, 'use_atr': False, 'use_adx': False, 'use_ema': True, 'use_spike': True, 'rsi_required': False, 'edge_k': 0.8619715449536852, 'edge_cap': 0.35428185490517405, 'bull_strategy': 'breakout', 'bull_bb_std_mult': 3.121550545641746, 'bull_rsi_os': 15, 'bull_rsi_ob': 63, 'bull_adx_thresh': 24.793234683760733, 'bull_atr_min_pct': 0.02252348708223086, 'bull_atr_max_pct': 0.02747789721038848, 'bull_tp_mult': 2.836844254083203, 'bull_tsl_mult': 0.38649847920125047, 'bull_time_stop': 89, 'bull_use_sma': True, 'bull_use_ema': False, 'bull_use_atr': True, 'bull_use_adx': False, 'bull_use_spike': False, 'bull_rsi_required': True, 'bear_strategy': 'breakout', 'bear_bb_std_mult': 3.5377362196185396, 'bear_rsi_os': 21, 'bear_rsi_ob': 91, 'bear_adx_thresh': 12.372027921745731, 'bear_atr_min_pct': 0.013989499824090802, 'bear_atr_max_pct': 0.04820305417262859, 'bear_tp_mult': 2.753836371288975, 'bear_tsl_mult': 0.21857158095586174, 'bear_time_stop': 205, 'bear_use_sma': True, 'bear_use_ema': True, 'bear_use_atr': True, 'bear_use_adx': True, 'bear_use_spike': True, 'bear_rsi_required': True, 'sideways_strategy': 'breakout', 'sideways_bb_std_mult': 1.2682583950150257, 'sideways_rsi_os': 34, 'sideways_rsi_ob': 69, 'sideways_adx_thresh': 30.895452865831224, 'sideways_atr_min_pct': 0.005180932512394631, 'sideways_atr_max_pct': 0.06135654895963066, 'sideways_tp_mult': 1.070832323125384, 'sideways_tsl_mult': 0.24314639864997992, 'sideways_time_stop': 98, 'sideways_use_sma': True, 'sideways_use_ema': True, 'sideways_use_atr': False, 'sideways_use_adx': True, 'sideways_use_spike': False, 'sideways_rsi_required': True}.
[I 2025-09-01 13:49:48,546] Trial 307 finished with values: [-1000000000.0, 1000000000.0] and parameters: {'p_sma': 35, 'p_std': 49, 'p_atr': 25, 'p_adx': 25, 'rsi_period': 64, 'ema1': 22, 'ema2': 26, 'slip_atr_k': 0.00963610008771685, 'slip_spread_k': 0.8621968242756226, 'spread_hl_frac': 0.03833826784208083, 'bb_std_mult': 1.7393118351944432, 'rsi_os': 33, 'rsi_ob': 66, 'vol_spike': 0.2192044239044487, 'adx_thresh': 25.79091792738004, 'atr_min_pct': 0.02791540484671345, 'atr_max_pct': 0.13651743109988163, 'tp_mult': 2.3109965992710437, 'tsl_mult': 0.6966940227263496, 'strategy': 'mean_reversion', 'time_stop': 233, 'use_sma': False, 'use_atr': False, 'use_adx': False, 'use_ema': False, 'use_spike': True, 'rsi_required': False, 'edge_k': 1.4378809382317377, 'edge_cap': 0.41249464148774706, 'bull_strategy': 'breakout', 'bull_bb_std_mult': 3.350128103107682, 'bull_rsi_os': 11, 'bull_rsi_ob': 95, 'bull_adx_thresh': 24.422160616210732, 'bull_atr_min_pct': 0.02228166668033637, 'bull_atr_max_pct': 0.026894270623515126, 'bull_tp_mult': 2.824189249700747, 'bull_tsl_mult': 0.2440518554851419, 'bull_time_stop': 87, 'bull_use_sma': True, 'bull_use_ema': False, 'bull_use_atr': False, 'bull_use_adx': False, 'bull_use_spike': False, 'bull_rsi_required': False, 'bear_strategy': 'breakout', 'bear_bb_std_mult': 3.5340098509890687, 'bear_rsi_os': 31, 'bear_rsi_ob': 84, 'bear_adx_thresh': 7.066940622949863, 'bear_atr_min_pct': 0.0030262650362430014, 'bear_atr_max_pct': 0.1322791104352733, 'bear_tp_mult': 2.1996568554009936, 'bear_tsl_mult': 0.17990065733281493, 'bear_time_stop': 209, 'bear_use_sma': False, 'bear_use_ema': True, 'bear_use_atr': True, 'bear_use_adx': True, 'bear_use_spike': True, 'bear_rsi_required': True, 'sideways_strategy': 'breakout', 'sideways_bb_std_mult': 1.5828731604239665, 'sideways_rsi_os': 49, 'sideways_rsi_ob': 71, 'sideways_adx_thresh': 25.029317871075335, 'sideways_atr_min_pct': 0.018691370481627525, 'sideways_atr_max_pct': 0.013503029536446151, 'sideways_tp_mult': 2.6991761116747215, 'sideways_tsl_mult': 0.24115372144152278, 'sideways_time_stop': 165, 'sideways_use_sma': True, 'sideways_use_ema': True, 'sideways_use_atr': False, 'sideways_use_adx': True, 'sideways_use_spike': False, 'sideways_rsi_required': False}.
[I 2025-09-01 13:49:49,579] Trial 309 finished with values: [-1000000000.0, 1000000000.0] and parameters: {'p_sma': 34, 'p_std': 49, 'p_atr': 26, 'p_adx': 10, 'rsi_period': 60, 'ema1': 21, 'ema2': 29, 'slip_atr_k': 0.011380464183393613, 'slip_spread_k': 0.512026020489815, 'spread_hl_frac': 0.021031444826453853, 'bb_std_mult': 2.5643586743688083, 'rsi_os': 40, 'rsi_ob': 73, 'vol_spike': 0.21716510095999733, 'adx_thresh': 5.1645859939329135, 'atr_min_pct': 0.023295314010094575, 'atr_max_pct': 0.1397786198872746, 'tp_mult': 1.749027961822438, 'tsl_mult': 0.5822228855184487, 'strategy': 'mean_reversion', 'time_stop': 231, 'use_sma': False, 'use_atr': False, 'use_adx': False, 'use_ema': True, 'use_spike': True, 'rsi_required': False, 'edge_k': 1.4174688833621725, 'edge_cap': 0.3540909273694457, 'bull_strategy': 'breakout', 'bull_bb_std_mult': 2.286721679043658, 'bull_rsi_os': 34, 'bull_rsi_ob': 64, 'bull_adx_thresh': 18.618954083043956, 'bull_atr_min_pct': 0.00616350818379475, 'bull_atr_max_pct': 0.026289067899685527, 'bull_tp_mult': 2.758687882522518, 'bull_tsl_mult': 0.8323921301237576, 'bull_time_stop': 96, 'bull_use_sma': True, 'bull_use_ema': False, 'bull_use_atr': False, 'bull_use_adx': False, 'bull_use_spike': False, 'bull_rsi_required': True, 'bear_strategy': 'breakout', 'bear_bb_std_mult': 3.5378943600196853, 'bear_rsi_os': 22, 'bear_rsi_ob': 88, 'bear_adx_thresh': 12.380026588856811, 'bear_atr_min_pct': 0.0026477085391383975, 'bear_atr_max_pct': 0.10428514583968004, 'bear_tp_mult': 2.190201726254001, 'bear_tsl_mult': 0.10210463592175241, 'bear_time_stop': 204, 'bear_use_sma': False, 'bear_use_ema': True, 'bear_use_atr': True, 'bear_use_adx': False, 'bear_use_spike': True, 'bear_rsi_required': True, 'sideways_strategy': 'breakout', 'sideways_bb_std_mult': 1.2797183233767613, 'sideways_rsi_os': 34, 'sideways_rsi_ob': 67, 'sideways_adx_thresh': 30.66728957724744, 'sideways_atr_min_pct': 0.018846235796578514, 'sideways_atr_max_pct': 0.06081420062060688, 'sideways_tp_mult': 1.9981162370246142, 'sideways_tsl_mult': 0.3436370318146816, 'sideways_time_stop': 263, 'sideways_use_sma': True, 'sideways_use_ema': False, 'sideways_use_atr': False, 'sideways_use_adx': True, 'sideways_use_spike': True, 'sideways_rsi_required': True}.
[I 2025-09-01 13:50:29,706] Trial 310 finished with values: [-1000000000.0, 1000000000.0] and parameters: {'p_sma': 37, 'p_std': 36, 'p_atr': 26, 'p_adx': 12, 'rsi_period': 60, 'ema1': 23, 'ema2': 35, 'slip_atr_k': 0.01099948814279348, 'slip_spread_k': 0.5153029413158304, 'spread_hl_frac': 0.006143812350532092, 'bb_std_mult': 0.9538883313486504, 'rsi_os': 43, 'rsi_ob': 67, 'vol_spike': 0.22056782990825838, 'adx_thresh': 26.564935945373993, 'atr_min_pct': 0.00794267812601578, 'atr_max_pct': 0.13851638004564615, 'tp_mult': 1.1756837538495177, 'tsl_mult': 0.34691599371648246, 'strategy': 'mean_reversion', 'time_stop': 231, 'use_sma': False, 'use_atr': False, 'use_adx': False, 'use_ema': False, 'use_spike': True, 'rsi_required': False, 'edge_k': 0.9383960114650673, 'edge_cap': 0.4791056931688462, 'bull_strategy': 'breakout', 'bull_bb_std_mult': 3.596521155824673, 'bull_rsi_os': 14, 'bull_rsi_ob': 61, 'bull_adx_thresh': 28.698348677786544, 'bull_atr_min_pct': 0.016300643655220534, 'bull_atr_max_pct': 0.018842264559238035, 'bull_tp_mult': 2.7528593091417846, 'bull_tsl_mult': 0.8207863338441354, 'bull_time_stop': 96, 'bull_use_sma': True, 'bull_use_ema': False, 'bull_use_atr': False, 'bull_use_adx': False, 'bull_use_spike': False, 'bull_rsi_required': False, 'bear_strategy': 'breakout', 'bear_bb_std_mult': 3.5418363388605494, 'bear_rsi_os': 41, 'bear_rsi_ob': 89, 'bear_adx_thresh': 25.54921667179613, 'bear_atr_min_pct': 0.026932135397309542, 'bear_atr_max_pct': 0.04527314764642308, 'bear_tp_mult': 2.1677466093526814, 'bear_tsl_mult': 0.10216509926752243, 'bear_time_stop': 211, 'bear_use_sma': False, 'bear_use_ema': True, 'bear_use_atr': True, 'bear_use_adx': False, 'bear_use_spike': True, 'bear_rsi_required': True, 'sideways_strategy': 'breakout', 'sideways_bb_std_mult': 1.6117822024173933, 'sideways_rsi_os': 34, 'sideways_rsi_ob': 71, 'sideways_adx_thresh': 10.240669890746792, 'sideways_atr_min_pct': 0.005158667380130816, 'sideways_atr_max_pct': 0.035214817032567125, 'sideways_tp_mult': 1.8309955614868112, 'sideways_tsl_mult': 0.252715273139237, 'sideways_time_stop': 265, 'sideways_use_sma': True, 'sideways_use_ema': False, 'sideways_use_atr': False, 'sideways_use_adx': True, 'sideways_use_spike': True, 'sideways_rsi_required': False}.
[I 2025-09-01 13:50:30,154] Trial 313 finished with values: [-1000000000.0, 1000000000.0] and parameters: {'p_sma': 37, 'p_std': 46, 'p_atr': 15, 'p_adx': 29, 'rsi_period': 69, 'ema1': 20, 'ema2': 20, 'slip_atr_k': 0.01939914512175734, 'slip_spread_k': 0.0175997104104101, 'spread_hl_frac': 0.0059988630672952355, 'bb_std_mult': 1.6690122122358335, 'rsi_os': 44, 'rsi_ob': 83, 'vol_spike': 0.2418016956893641, 'adx_thresh': 23.760855738612033, 'atr_min_pct': 0.008188875394564348, 'atr_max_pct': 0.1398280718387167, 'tp_mult': 1.0682241933452234, 'tsl_mult': 0.7549987756763905, 'strategy': 'mean_reversion', 'time_stop': 241, 'use_sma': True, 'use_atr': False, 'use_adx': False, 'use_ema': True, 'use_spike': True, 'rsi_required': False, 'edge_k': 1.7736882605627085, 'edge_cap': 0.2812831488166971, 'bull_strategy': 'breakout', 'bull_bb_std_mult': 1.5501502440513066, 'bull_rsi_os': 38, 'bull_rsi_ob': 54, 'bull_adx_thresh': 28.89255313688535, 'bull_atr_min_pct': 0.016025872349308565, 'bull_atr_max_pct': 0.09904100564577692, 'bull_tp_mult': 2.903811768174361, 'bull_tsl_mult': 0.42121570573084294, 'bull_time_stop': 179, 'bull_use_sma': False, 'bull_use_ema': True, 'bull_use_atr': True, 'bull_use_adx': True, 'bull_use_spike': True, 'bull_rsi_required': True, 'bear_strategy': 'breakout', 'bear_bb_std_mult': 3.435617212060217, 'bear_rsi_os': 33, 'bear_rsi_ob': 89, 'bear_adx_thresh': 11.510032350298156, 'bear_atr_min_pct': 0.02705930466537511, 'bear_atr_max_pct': 0.04105481656381536, 'bear_tp_mult': 1.048346177096946, 'bear_tsl_mult': 0.9970300370306547, 'bear_time_stop': 224, 'bear_use_sma': True, 'bear_use_ema': True, 'bear_use_atr': False, 'bear_use_adx': False, 'bear_use_spike': False, 'bear_rsi_required': True, 'sideways_strategy': 'breakout', 'sideways_bb_std_mult': 2.8359212569481107, 'sideways_rsi_os': 52, 'sideways_rsi_ob': 64, 'sideways_adx_thresh': 18.833967156599535, 'sideways_atr_min_pct': 0.020633310296601863, 'sideways_atr_max_pct': 0.07156232467808521, 'sideways_tp_mult': 2.5900350973669757, 'sideways_tsl_mult': 0.8673836496073527, 'sideways_time_stop': 183, 'sideways_use_sma': True, 'sideways_use_ema': False, 'sideways_use_atr': True, 'sideways_use_adx': True, 'sideways_use_spike': True, 'sideways_rsi_required': True}.
[I 2025-09-01 13:50:30,832] Trial 312 finished with values: [-1000000000.0, 1000000000.0] and parameters: {'p_sma': 37, 'p_std': 46, 'p_atr': 26, 'p_adx': 12, 'rsi_period': 44, 'ema1': 23, 'ema2': 20, 'slip_atr_k': 0.15305209532964653, 'slip_spread_k': 0.049386981034272776, 'spread_hl_frac': 0.006020989613916284, 'bb_std_mult': 1.6630167000458598, 'rsi_os': 45, 'rsi_ob': 68, 'vol_spike': 0.08756597938632454, 'adx_thresh': 23.81220795728809, 'atr_min_pct': 0.012361006170881267, 'atr_max_pct': 0.14034097713983396, 'tp_mult': 1.0771934794285554, 'tsl_mult': 0.3384675290216479, 'strategy': 'mean_reversion', 'time_stop': 252, 'use_sma': True, 'use_atr': False, 'use_adx': False, 'use_ema': True, 'use_spike': True, 'rsi_required': False, 'edge_k': 0.7848381166953151, 'edge_cap': 0.46896740049307023, 'bull_strategy': 'breakout', 'bull_bb_std_mult': 1.5264770403964711, 'bull_rsi_os': 35, 'bull_rsi_ob': 54, 'bull_adx_thresh': 26.898819661088474, 'bull_atr_min_pct': 0.005522158173602866, 'bull_atr_max_pct': 0.019019582389640955, 'bull_tp_mult': 2.74366172971356, 'bull_tsl_mult': 0.20653014884936155, 'bull_time_stop': 96, 'bull_use_sma': False, 'bull_use_ema': True, 'bull_use_atr': True, 'bull_use_adx': True, 'bull_use_spike': True, 'bull_rsi_required': True, 'bear_strategy': 'breakout', 'bear_bb_std_mult': 2.040416689863507, 'bear_rsi_os': 43, 'bear_rsi_ob': 89, 'bear_adx_thresh': 11.394985446603073, 'bear_atr_min_pct': 0.017062051985885125, 'bear_atr_max_pct': 0.04539512721548326, 'bear_tp_mult': 1.0566368027156878, 'bear_tsl_mult': 0.10455522756525684, 'bear_time_stop': 236, 'bear_use_sma': True, 'bear_use_ema': True, 'bear_use_atr': False, 'bear_use_adx': False, 'bear_use_spike': False, 'bear_rsi_required': True, 'sideways_strategy': 'breakout', 'sideways_bb_std_mult': 1.4933769528943461, 'sideways_rsi_os': 17, 'sideways_rsi_ob': 67, 'sideways_adx_thresh': 7.920076161591213, 'sideways_atr_min_pct': 0.020339254141319856, 'sideways_atr_max_pct': 0.030226292298358957, 'sideways_tp_mult': 2.60321945485526, 'sideways_tsl_mult': 0.3465266729677083, 'sideways_time_stop': 182, 'sideways_use_sma': True, 'sideways_use_ema': False, 'sideways_use_atr': True, 'sideways_use_adx': True, 'sideways_use_spike': True, 'sideways_rsi_required': True}.
[I 2025-09-01 13:50:31,104] Trial 311 finished with values: [-1000000000.0, 1000000000.0] and parameters: {'p_sma': 33, 'p_std': 46, 'p_atr': 18, 'p_adx': 24, 'rsi_period': 70, 'ema1': 13, 'ema2': 11, 'slip_atr_k': 0.13423465012024852, 'slip_spread_k': 0.030791129965016054, 'spread_hl_frac': 0.02116958596587608, 'bb_std_mult': 1.7091789529271713, 'rsi_os': 40, 'rsi_ob': 83, 'vol_spike': 0.21228619457605102, 'adx_thresh': 26.67951025099636, 'atr_min_pct': 0.01981446768104479, 'atr_max_pct': 0.13920194113881434, 'tp_mult': 1.1686606479563872, 'tsl_mult': 0.5709224175592188, 'strategy': 'mean_reversion', 'time_stop': 253, 'use_sma': False, 'use_atr': False, 'use_adx': False, 'use_ema': False, 'use_spike': True, 'rsi_required': False, 'edge_k': 1.77558513205462, 'edge_cap': 0.35178049981005705, 'bull_strategy': 'breakout', 'bull_bb_std_mult': 3.455621999607632, 'bull_rsi_os': 34, 'bull_rsi_ob': 53, 'bull_adx_thresh': 28.856480474330574, 'bull_atr_min_pct': 0.00531680397498277, 'bull_atr_max_pct': 0.01943110278005559, 'bull_tp_mult': 2.748178242930545, 'bull_tsl_mult': 0.2657585975307248, 'bull_time_stop': 182, 'bull_use_sma': False, 'bull_use_ema': True, 'bull_use_atr': False, 'bull_use_adx': True, 'bull_use_spike': False, 'bull_rsi_required': False, 'bear_strategy': 'breakout', 'bear_bb_std_mult': 3.433759616806333, 'bear_rsi_os': 43, 'bear_rsi_ob': 89, 'bear_adx_thresh': 25.721680332630687, 'bear_atr_min_pct': 0.0277403195074977, 'bear_atr_max_pct': 0.10353604297120536, 'bear_tp_mult': 2.1765344859657514, 'bear_tsl_mult': 0.24986636605752843, 'bear_time_stop': 79, 'bear_use_sma': False, 'bear_use_ema': True, 'bear_use_atr': False, 'bear_use_adx': False, 'bear_use_spike': False, 'bear_rsi_required': True, 'sideways_strategy': 'breakout', 'sideways_bb_std_mult': 2.8555659291243485, 'sideways_rsi_os': 49, 'sideways_rsi_ob': 67, 'sideways_adx_thresh': 7.985430994316146, 'sideways_atr_min_pct': 0.020683570489409817, 'sideways_atr_max_pct': 0.041326987557844995, 'sideways_tp_mult': 1.981787853256706, 'sideways_tsl_mult': 0.6566045422736605, 'sideways_time_stop': 179, 'sideways_use_sma': True, 'sideways_use_ema': False, 'sideways_use_atr': True, 'sideways_use_adx': True, 'sideways_use_spike': True, 'sideways_rsi_required': False}.
[I 2025-09-01 13:51:08,373] Trial 314 finished with values: [-1000000000.0, 1000000000.0] and parameters: {'p_sma': 9, 'p_std': 57, 'p_atr': 16, 'p_adx': 29, 'rsi_period': 44, 'ema1': 13, 'ema2': 19, 'slip_atr_k': 0.1546037013840318, 'slip_spread_k': 0.018555480752947107, 'spread_hl_frac': 0.0024009445168724497, 'bb_std_mult': 1.3410397592301702, 'rsi_os': 41, 'rsi_ob': 56, 'vol_spike': 0.24134641425835604, 'adx_thresh': 23.563397869440237, 'atr_min_pct': 0.026301200367703725, 'atr_max_pct': 0.12827063484156476, 'tp_mult': 1.0820205356537427, 'tsl_mult': 0.7321463982182942, 'strategy': 'mean_reversion', 'time_stop': 242, 'use_sma': True, 'use_atr': False, 'use_adx': False, 'use_ema': True, 'use_spike': True, 'rsi_required': False, 'edge_k': 0.800642069073767, 'edge_cap': 0.516196905305077, 'bull_strategy': 'breakout', 'bull_bb_std_mult': 3.4157769730556558, 'bull_rsi_os': 35, 'bull_rsi_ob': 46, 'bull_adx_thresh': 34.86950297053646, 'bull_atr_min_pct': 0.0050836428303110874, 'bull_atr_max_pct': 0.08558798552441133, 'bull_tp_mult': 1.2633930824932031, 'bull_tsl_mult': 0.44480143135487693, 'bull_time_stop': 179, 'bull_use_sma': False, 'bull_use_ema': True, 'bull_use_atr': True, 'bull_use_adx': True, 'bull_use_spike': True, 'bull_rsi_required': True, 'bear_strategy': 'breakout', 'bear_bb_std_mult': 3.4345469894089233, 'bear_rsi_os': 33, 'bear_rsi_ob': 89, 'bear_adx_thresh': 10.872495663018205, 'bear_atr_min_pct': 0.0034681051074747465, 'bear_atr_max_pct': 0.040896543569543156, 'bear_tp_mult': 2.280828632124553, 'bear_tsl_mult': 0.37317363206041404, 'bear_time_stop': 236, 'bear_use_sma': True, 'bear_use_ema': True, 'bear_use_atr': False, 'bear_use_adx': True, 'bear_use_spike': False, 'bear_rsi_required': True, 'sideways_strategy': 'breakout', 'sideways_bb_std_mult': 1.474416118610209, 'sideways_rsi_os': 40, 'sideways_rsi_ob': 67, 'sideways_adx_thresh': 11.031106512417017, 'sideways_atr_min_pct': 0.020627456877104107, 'sideways_atr_max_pct': 0.07105913012406849, 'sideways_tp_mult': 2.7311322957180417, 'sideways_tsl_mult': 0.8720316578692315, 'sideways_time_stop': 184, 'sideways_use_sma': True, 'sideways_use_ema': False, 'sideways_use_atr': True, 'sideways_use_adx': True, 'sideways_use_spike': False, 'sideways_rsi_required': True}.
