[I 2025-09-01 14:55:13,524] Trial 756 finished with values: [-1000000000.0, 1000000000.0] and parameters: {'p_sma': 37, 'p_std': 46, 'p_atr': 25, 'p_adx': 12, 'rsi_period': 30, 'ema1': 20, 'ema2': 17, 'slip_atr_k': 0.013209131126894964, 'slip_spread_k': 0.05303869607900073, 'spread_hl_frac': 0.006415380641646856, 'bb_std_mult': 2.5249586755607103, 'rsi_os': 38, 'rsi_ob': 83, 'vol_spike': 0.20464808921970182, 'adx_thresh': 30.29804314972121, 'atr_min_pct': 0.026978731676337492, 'atr_max_pct': 0.14564070445213229, 'tp_mult': 1.108212171367649, 'tsl_mult': 0.7300594856969361, 'strategy': 'mean_reversion', 'time_stop': 80, 'use_sma': True, 'use_atr': False, 'use_adx': False, 'use_ema': True, 'use_spike': False, 'rsi_required': False, 'edge_k': 1.004582185301673, 'edge_cap': 0.8834462063759092, 'bull_strategy': 'breakout', 'bull_bb_std_mult': 2.4710103127253795, 'bull_rsi_os': 37, 'bull_rsi_ob': 56, 'bull_adx_thresh': 24.567365148410996, 'bull_atr_min_pct': 0.0051099313810396355, 'bull_atr_max_pct': 0.019778633001218456, 'bull_tp_mult': 2.476423361832765, 'bull_tsl_mult': 0.44655136075167917, 'bull_time_stop': 96, 'bull_use_sma': True, 'bull_use_ema': True, 'bull_use_atr': True, 'bull_use_adx': True, 'bull_use_spike': False, 'bull_rsi_required': True, 'bear_strategy': 'breakout', 'bear_bb_std_mult': 3.5983579854556433, 'bear_rsi_os': 35, 'bear_rsi_ob': 85, 'bear_adx_thresh': 11.258178933357872, 'bear_atr_min_pct': 0.01534913561049219, 'bear_atr_max_pct': 0.04656138472558331, 'bear_tp_mult': 2.220660652067028, 'bear_tsl_mult': 0.12768435072086182, 'bear_time_stop': 227, 'bear_use_sma': True, 'bear_use_ema': False, 'bear_use_atr': True, 'bear_use_adx': True, 'bear_use_spike': False, 'bear_rsi_required': False, 'sideways_strategy': 'breakout', 'sideways_bb_std_mult': 3.245452524513646, 'sideways_rsi_os': 24, 'sideways_rsi_ob': 66, 'sideways_adx_thresh': 8.156102943069708, 'sideways_atr_min_pct': 0.019405993538946897, 'sideways_atr_max_pct': 0.0716616476494016, 'sideways_tp_mult': 2.626999838367894, 'sideways_tsl_mult': 0.24474348673563323, 'sideways_time_stop': 86, 'sideways_use_sma': False, 'sideways_use_ema': False, 'sideways_use_atr': True, 'sideways_use_adx': True, 'sideways_use_spike': False, 'sideways_rsi_required': False}.
[I 2025-09-01 14:55:13,891] Trial 755 finished with values: [-1000000000.0, 1000000000.0] and parameters: {'p_sma': 17, 'p_std': 46, 'p_atr': 25, 'p_adx': 12, 'rsi_period': 65, 'ema1': 21, 'ema2': 15, 'slip_atr_k': 0.19112474131058044, 'slip_spread_k': 0.11093308370512414, 'spread_hl_frac': 0.04158867844924748, 'bb_std_mult': 1.9140019647435182, 'rsi_os': 38, 'rsi_ob': 51, 'vol_spike': 0.2084026493638203, 'adx_thresh': 24.090596137354165, 'atr_min_pct': 0.026593951933286595, 'atr_max_pct': 0.14561393650959364, 'tp_mult': 1.2384353323137516, 'tsl_mult': 0.7277870382695485, 'strategy': 'mean_reversion', 'time_stop': 102, 'use_sma': True, 'use_atr': False, 'use_adx': False, 'use_ema': True, 'use_spike': True, 'rsi_required': False, 'edge_k': 0.9947831934004452, 'edge_cap': 0.35490801908322245, 'bull_strategy': 'breakout', 'bull_bb_std_mult': 2.0642087147222297, 'bull_rsi_os': 36, 'bull_rsi_ob': 55, 'bull_adx_thresh': 27.8546531954779, 'bull_atr_min_pct': 0.002117937479128672, 'bull_atr_max_pct': 0.14493741330824958, 'bull_tp_mult': 2.83131631484294, 'bull_tsl_mult': 0.4459214004562194, 'bull_time_stop': 146, 'bull_use_sma': True, 'bull_use_ema': True, 'bull_use_atr': True, 'bull_use_adx': True, 'bull_use_spike': False, 'bull_rsi_required': True, 'bear_strategy': 'breakout', 'bear_bb_std_mult': 3.4832996694305502, 'bear_rsi_os': 54, 'bear_rsi_ob': 72, 'bear_adx_thresh': 13.366100320260859, 'bear_atr_min_pct': 0.015705702564117966, 'bear_atr_max_pct': 0.14757881327283134, 'bear_tp_mult': 2.28023498857615, 'bear_tsl_mult': 0.12660023673617984, 'bear_time_stop': 237, 'bear_use_sma': True, 'bear_use_ema': True, 'bear_use_atr': True, 'bear_use_adx': True, 'bear_use_spike': False, 'bear_rsi_required': True, 'sideways_strategy': 'breakout', 'sideways_bb_std_mult': 1.559756663442824, 'sideways_rsi_os': 29, 'sideways_rsi_ob': 66, 'sideways_adx_thresh': 8.126521962215826, 'sideways_atr_min_pct': 0.003625179417963479, 'sideways_atr_max_pct': 0.08507583091034517, 'sideways_tp_mult': 1.9033779371631327, 'sideways_tsl_mult': 0.32664288598629004, 'sideways_time_stop': 29, 'sideways_use_sma': True, 'sideways_use_ema': False, 'sideways_use_atr': True, 'sideways_use_adx': True, 'sideways_use_spike': False, 'sideways_rsi_required': True}.
[I 2025-09-01 14:55:15,284] Trial 758 finished with values: [-1000000000.0, 1000000000.0] and parameters: {'p_sma': 46, 'p_std': 37, 'p_atr': 29, 'p_adx': 12, 'rsi_period': 37, 'ema1': 20, 'ema2': 16, 'slip_atr_k': 0.01329316943115523, 'slip_spread_k': 0.8915552666649706, 'spread_hl_frac': 0.006817062631286197, 'bb_std_mult': 1.7723064217979052, 'rsi_os': 38, 'rsi_ob': 47, 'vol_spike': 0.033495087407038035, 'adx_thresh': 31.749805419815395, 'atr_min_pct': 0.018534534353902298, 'atr_max_pct': 0.14583851815951715, 'tp_mult': 1.5074290892227034, 'tsl_mult': 0.07070088350698867, 'strategy': 'mean_reversion', 'time_stop': 237, 'use_sma': True, 'use_atr': False, 'use_adx': False, 'use_ema': True, 'use_spike': True, 'rsi_required': False, 'edge_k': 0.9283302654419028, 'edge_cap': 0.39517844336927493, 'bull_strategy': 'breakout', 'bull_bb_std_mult': 1.10581317946801, 'bull_rsi_os': 34, 'bull_rsi_ob': 55, 'bull_adx_thresh': 29.03531761416524, 'bull_atr_min_pct': 0.003347862067884965, 'bull_atr_max_pct': 0.020633145966960077, 'bull_tp_mult': 2.8555487545341194, 'bull_tsl_mult': 0.4404922051604333, 'bull_time_stop': 95, 'bull_use_sma': True, 'bull_use_ema': True, 'bull_use_atr': True, 'bull_use_adx': True, 'bull_use_spike': False, 'bull_rsi_required': True, 'bear_strategy': 'breakout', 'bear_bb_std_mult': 3.5990018721439743, 'bear_rsi_os': 30, 'bear_rsi_ob': 85, 'bear_adx_thresh': 12.92696445284236, 'bear_atr_min_pct': 0.0015921947408674955, 'bear_atr_max_pct': 0.04776812870858352, 'bear_tp_mult': 2.275278074686264, 'bear_tsl_mult': 0.2140605055622422, 'bear_time_stop': 170, 'bear_use_sma': True, 'bear_use_ema': True, 'bear_use_atr': True, 'bear_use_adx': True, 'bear_use_spike': False, 'bear_rsi_required': True, 'sideways_strategy': 'breakout', 'sideways_bb_std_mult': 1.5784691379870404, 'sideways_rsi_os': 49, 'sideways_rsi_ob': 62, 'sideways_adx_thresh': 9.596650466803833, 'sideways_atr_min_pct': 0.019717967866414617, 'sideways_atr_max_pct': 0.08366027237891349, 'sideways_tp_mult': 2.3507461652171946, 'sideways_tsl_mult': 0.24966559433510016, 'sideways_time_stop': 190, 'sideways_use_sma': True, 'sideways_use_ema': False, 'sideways_use_atr': True, 'sideways_use_adx': True, 'sideways_use_spike': False, 'sideways_rsi_required': True}.
[I 2025-09-01 14:55:15,333] Trial 759 finished with values: [-1000000000.0, 1000000000.0] and parameters: {'p_sma': 9, 'p_std': 54, 'p_atr': 29, 'p_adx': 11, 'rsi_period': 64, 'ema1': 7, 'ema2': 16, 'slip_atr_k': 0.02059080825538432, 'slip_spread_k': 0.050686294985691396, 'spread_hl_frac': 0.04716993853443184, 'bb_std_mult': 1.7709160389842498, 'rsi_os': 38, 'rsi_ob': 47, 'vol_spike': 0.20478125186908908, 'adx_thresh': 6.289023704567269, 'atr_min_pct': 0.024133079860366606, 'atr_max_pct': 0.07187709358762422, 'tp_mult': 1.0499353443171018, 'tsl_mult': 0.7705629053508187, 'strategy': 'mean_reversion', 'time_stop': 293, 'use_sma': True, 'use_atr': False, 'use_adx': False, 'use_ema': True, 'use_spike': True, 'rsi_required': False, 'edge_k': 1.8047330109111321, 'edge_cap': 0.7026679847386161, 'bull_strategy': 'breakout', 'bull_bb_std_mult': 3.1093915783622106, 'bull_rsi_os': 34, 'bull_rsi_ob': 55, 'bull_adx_thresh': 29.11970650269008, 'bull_atr_min_pct': 0.022972138739630856, 'bull_atr_max_pct': 0.024830507876426128, 'bull_tp_mult': 2.9173349274488674, 'bull_tsl_mult': 0.43933050384697087, 'bull_time_stop': 92, 'bull_use_sma': True, 'bull_use_ema': True, 'bull_use_atr': True, 'bull_use_adx': True, 'bull_use_spike': False, 'bull_rsi_required': True, 'bear_strategy': 'breakout', 'bear_bb_std_mult': 3.599238335176887, 'bear_rsi_os': 32, 'bear_rsi_ob': 91, 'bear_adx_thresh': 9.93841314478829, 'bear_atr_min_pct': 0.001610639617473756, 'bear_atr_max_pct': 0.07761395553885382, 'bear_tp_mult': 2.267731165856779, 'bear_tsl_mult': 0.14855122661551384, 'bear_time_stop': 209, 'bear_use_sma': True, 'bear_use_ema': True, 'bear_use_atr': True, 'bear_use_adx': True, 'bear_use_spike': False, 'bear_rsi_required': True, 'sideways_strategy': 'breakout', 'sideways_bb_std_mult': 1.8781470602498986, 'sideways_rsi_os': 48, 'sideways_rsi_ob': 66, 'sideways_adx_thresh': 8.348208814203755, 'sideways_atr_min_pct': 0.028082435892923627, 'sideways_atr_max_pct': 0.07200107322737363, 'sideways_tp_mult': 2.349978648668989, 'sideways_tsl_mult': 0.3075912733556163, 'sideways_time_stop': 197, 'sideways_use_sma': True, 'sideways_use_ema': False, 'sideways_use_atr': True, 'sideways_use_adx': True, 'sideways_use_spike': False, 'sideways_rsi_required': True}.
[I 2025-09-01 14:55:55,129] Trial 760 finished with values: [-1000000000.0, 1000000000.0] and parameters: {'p_sma': 9, 'p_std': 54, 'p_atr': 29, 'p_adx': 26, 'rsi_period': 65, 'ema1': 15, 'ema2': 40, 'slip_atr_k': 0.029226691400470732, 'slip_spread_k': 0.9741437396509942, 'spread_hl_frac': 0.005404415450322248, 'bb_std_mult': 1.7721942510393172, 'rsi_os': 39, 'rsi_ob': 51, 'vol_spike': 0.2520928068447337, 'adx_thresh': 25.16738375225679, 'atr_min_pct': 0.01827065113792435, 'atr_max_pct': 0.13402480939730296, 'tp_mult': 1.0488238014230307, 'tsl_mult': 0.7661944150302112, 'strategy': 'mean_reversion', 'time_stop': 291, 'use_sma': True, 'use_atr': False, 'use_adx': False, 'use_ema': True, 'use_spike': True, 'rsi_required': False, 'edge_k': 0.9338452939071287, 'edge_cap': 0.14752085590388375, 'bull_strategy': 'breakout', 'bull_bb_std_mult': 1.0805595353783977, 'bull_rsi_os': 23, 'bull_rsi_ob': 89, 'bull_adx_thresh': 28.92583237844546, 'bull_atr_min_pct': 0.003426184282910513, 'bull_atr_max_pct': 0.024082555707840403, 'bull_tp_mult': 2.400136486337148, 'bull_tsl_mult': 0.8174611884745429, 'bull_time_stop': 91, 'bull_use_sma': True, 'bull_use_ema': True, 'bull_use_atr': True, 'bull_use_adx': True, 'bull_use_spike': False, 'bull_rsi_required': True, 'bear_strategy': 'breakout', 'bear_bb_std_mult': 1.2956074980285917, 'bear_rsi_os': 29, 'bear_rsi_ob': 91, 'bear_adx_thresh': 12.589140395016173, 'bear_atr_min_pct': 0.0017172793367127793, 'bear_atr_max_pct': 0.03359975210700136, 'bear_tp_mult': 2.122974130122951, 'bear_tsl_mult': 0.9323552991507276, 'bear_time_stop': 211, 'bear_use_sma': True, 'bear_use_ema': True, 'bear_use_atr': True, 'bear_use_adx': True, 'bear_use_spike': False, 'bear_rsi_required': True, 'sideways_strategy': 'breakout', 'sideways_bb_std_mult': 2.7600973904603903, 'sideways_rsi_os': 40, 'sideways_rsi_ob': 62, 'sideways_adx_thresh': 8.787239513270977, 'sideways_atr_min_pct': 0.0185861344480458, 'sideways_atr_max_pct': 0.08385331234964154, 'sideways_tp_mult': 1.2336437395056492, 'sideways_tsl_mult': 0.24155585162392146, 'sideways_time_stop': 30, 'sideways_use_sma': True, 'sideways_use_ema': False, 'sideways_use_atr': True, 'sideways_use_adx': True, 'sideways_use_spike': False, 'sideways_rsi_required': True}.
[I 2025-09-01 14:55:56,991] Trial 761 finished with values: [-1000000000.0, 1000000000.0] and parameters: {'p_sma': 9, 'p_std': 48, 'p_atr': 11, 'p_adx': 15, 'rsi_period': 23, 'ema1': 15, 'ema2': 19, 'slip_atr_k': 0.021145822816061866, 'slip_spread_k': 0.23009728217073283, 'spread_hl_frac': 0.021767616795559185, 'bb_std_mult': 1.7669991923008375, 'rsi_os': 23, 'rsi_ob': 82, 'vol_spike': 0.2502462447864176, 'adx_thresh': 31.974834991014696, 'atr_min_pct': 0.023894022583526082, 'atr_max_pct': 0.04074796088922065, 'tp_mult': 1.0122253716764735, 'tsl_mult': 0.9248718064507135, 'strategy': 'mean_reversion', 'time_stop': 116, 'use_sma': True, 'use_atr': False, 'use_adx': False, 'use_ema': True, 'use_spike': True, 'rsi_required': False, 'edge_k': 0.9434239322304256, 'edge_cap': 0.3980764685607834, 'bull_strategy': 'breakout', 'bull_bb_std_mult': 1.0914627334585705, 'bull_rsi_os': 29, 'bull_rsi_ob': 92, 'bull_adx_thresh': 28.737470538960032, 'bull_atr_min_pct': 0.0036267774253512003, 'bull_atr_max_pct': 0.02360683160933498, 'bull_tp_mult': 2.920674182423021, 'bull_tsl_mult': 0.7391274681176532, 'bull_time_stop': 92, 'bull_use_sma': True, 'bull_use_ema': True, 'bull_use_atr': True, 'bull_use_adx': True, 'bull_use_spike': True, 'bull_rsi_required': True, 'bear_strategy': 'breakout', 'bear_bb_std_mult': 1.0834065684382987, 'bear_rsi_os': 30, 'bear_rsi_ob': 91, 'bear_adx_thresh': 12.652746932448327, 'bear_atr_min_pct': 0.006627104610664731, 'bear_atr_max_pct': 0.03340313051595669, 'bear_tp_mult': 2.2606168604526884, 'bear_tsl_mult': 0.935512522193952, 'bear_time_stop': 212, 'bear_use_sma': True, 'bear_use_ema': True, 'bear_use_atr': True, 'bear_use_adx': True, 'bear_use_spike': False, 'bear_rsi_required': True, 'sideways_strategy': 'breakout', 'sideways_bb_std_mult': 2.4092149305566424, 'sideways_rsi_os': 10, 'sideways_rsi_ob': 59, 'sideways_adx_thresh': 8.947967371558896, 'sideways_atr_min_pct': 0.00956784951733029, 'sideways_atr_max_pct': 0.06086545507374745, 'sideways_tp_mult': 2.7143020398784703, 'sideways_tsl_mult': 0.9073856889533178, 'sideways_time_stop': 213, 'sideways_use_sma': True, 'sideways_use_ema': False, 'sideways_use_atr': True, 'sideways_use_adx': False, 'sideways_use_spike': False, 'sideways_rsi_required': True}.
[I 2025-09-01 14:55:59,683] Trial 763 finished with values: [-1000000000.0, 1000000000.0] and parameters: {'p_sma': 41, 'p_std': 47, 'p_atr': 24, 'p_adx': 10, 'rsi_period': 62, 'ema1': 22, 'ema2': 19, 'slip_atr_k': 0.047827387942004, 'slip_spread_k': 0.06549306192751415, 'spread_hl_frac': 0.005500070847695126, 'bb_std_mult': 0.7880082550306517, 'rsi_os': 40, 'rsi_ob': 89, 'vol_spike': 0.24984332231915107, 'adx_thresh': 25.334297238147048, 'atr_min_pct': 0.0074386334247548746, 'atr_max_pct': 0.1340239614017282, 'tp_mult': 1.8011127031490584, 'tsl_mult': 0.7763674525137048, 'strategy': 'mean_reversion', 'time_stop': 243, 'use_sma': False, 'use_atr': False, 'use_adx': False, 'use_ema': False, 'use_spike': True, 'rsi_required': True, 'edge_k': 0.8219014467574819, 'edge_cap': 0.444552665123659, 'bull_strategy': 'breakout', 'bull_bb_std_mult': 1.3139988335553294, 'bull_rsi_os': 39, 'bull_rsi_ob': 51, 'bull_adx_thresh': 31.529100482224905, 'bull_atr_min_pct': 0.019437393532857956, 'bull_atr_max_pct': 0.10519895405608995, 'bull_tp_mult': 2.7807482608957486, 'bull_tsl_mult': 0.4740548590291729, 'bull_time_stop': 186, 'bull_use_sma': True, 'bull_use_ema': True, 'bull_use_atr': True, 'bull_use_adx': False, 'bull_use_spike': True, 'bull_rsi_required': True, 'bear_strategy': 'breakout', 'bear_bb_std_mult': 3.5365154115265827, 'bear_rsi_os': 49, 'bear_rsi_ob': 82, 'bear_adx_thresh': 12.177513322465531, 'bear_atr_min_pct': 0.006821747182055452, 'bear_atr_max_pct': 0.03478555026892552, 'bear_tp_mult': 2.110007079165353, 'bear_tsl_mult': 0.19847450923981572, 'bear_time_stop': 218, 'bear_use_sma': True, 'bear_use_ema': True, 'bear_use_atr': False, 'bear_use_adx': False, 'bear_use_spike': False, 'bear_rsi_required': True, 'sideways_strategy': 'breakout', 'sideways_bb_std_mult': 1.7121279475960356, 'sideways_rsi_os': 10, 'sideways_rsi_ob': 67, 'sideways_adx_thresh': 29.24656444941879, 'sideways_atr_min_pct': 0.021569614515799404, 'sideways_atr_max_pct': 0.06159481109762395, 'sideways_tp_mult': 2.716812133317778, 'sideways_tsl_mult': 0.9283053856184804, 'sideways_time_stop': 264, 'sideways_use_sma': True, 'sideways_use_ema': False, 'sideways_use_atr': True, 'sideways_use_adx': False, 'sideways_use_spike': False, 'sideways_rsi_required': True}.
[I 2025-09-01 14:56:00,454] Trial 762 finished with values: [-1000000000.0, 1000000000.0] and parameters: {'p_sma': 38, 'p_std': 49, 'p_atr': 24, 'p_adx': 26, 'rsi_period': 62, 'ema1': 15, 'ema2': 19, 'slip_atr_k': 0.020704343947138014, 'slip_spread_k': 0.06873932085358542, 'spread_hl_frac': 0.0032079671444486322, 'bb_std_mult': 1.5094064890287746, 'rsi_os': 39, 'rsi_ob': 89, 'vol_spike': 0.22628775057130496, 'adx_thresh': 25.084307550820597, 'atr_min_pct': 0.02899616793940442, 'atr_max_pct': 0.13654952265230932, 'tp_mult': 1.038905555167563, 'tsl_mult': 0.5893427519810082, 'strategy': 'mean_reversion', 'time_stop': 291, 'use_sma': False, 'use_atr': False, 'use_adx': False, 'use_ema': True, 'use_spike': True, 'rsi_required': False, 'edge_k': 0.14501073857040703, 'edge_cap': 0.4463123855961922, 'bull_strategy': 'breakout', 'bull_bb_std_mult': 3.4890566115117116, 'bull_rsi_os': 31, 'bull_rsi_ob': 92, 'bull_adx_thresh': 30.347501460368193, 'bull_atr_min_pct': 0.0010468274607805515, 'bull_atr_max_pct': 0.024507846627297394, 'bull_tp_mult': 1.7412062345643888, 'bull_tsl_mult': 0.1360395718883639, 'bull_time_stop': 185, 'bull_use_sma': True, 'bull_use_ema': True, 'bull_use_atr': True, 'bull_use_adx': False, 'bull_use_spike': True, 'bull_rsi_required': True, 'bear_strategy': 'breakout', 'bear_bb_std_mult': 1.284511377011599, 'bear_rsi_os': 50, 'bear_rsi_ob': 91, 'bear_adx_thresh': 18.632052513479834, 'bear_atr_min_pct': 0.0067512723540894826, 'bear_atr_max_pct': 0.033597967617246566, 'bear_tp_mult': 2.3552737365191243, 'bear_tsl_mult': 0.15514019371309323, 'bear_time_stop': 62, 'bear_use_sma': True, 'bear_use_ema': True, 'bear_use_atr': True, 'bear_use_adx': True, 'bear_use_spike': False, 'bear_rsi_required': True, 'sideways_strategy': 'breakout', 'sideways_bb_std_mult': 1.8791939197283896, 'sideways_rsi_os': 50, 'sideways_rsi_ob': 72, 'sideways_adx_thresh': 6.487029704924836, 'sideways_atr_min_pct': 0.006622461114239489, 'sideways_atr_max_pct': 0.06112802389168556, 'sideways_tp_mult': 2.7067364033594092, 'sideways_tsl_mult': 0.16518344050146533, 'sideways_time_stop': 213, 'sideways_use_sma': True, 'sideways_use_ema': False, 'sideways_use_atr': True, 'sideways_use_adx': False, 'sideways_use_spike': False, 'sideways_rsi_required': True}.
[I 2025-09-01 14:56:45,014] Trial 764 finished with values: [-0.06797822557214017, 0.0674983770800473] and parameters: {'p_sma': 41, 'p_std': 43, 'p_atr': 11, 'p_adx': 11, 'rsi_period': 67, 'ema1': 22, 'ema2': 53, 'slip_atr_k': 0.050363944852781506, 'slip_spread_k': 0.6938577008623513, 'spread_hl_frac': 0.017849838254478174, 'bb_std_mult': 1.5004601936631088, 'rsi_os': 40, 'rsi_ob': 82, 'vol_spike': 0.008122582573923898, 'adx_thresh': 17.171163174981956, 'atr_min_pct': 0.00795547363770863, 'atr_max_pct': 0.051469770154557164, 'tp_mult': 1.010208045400994, 'tsl_mult': 0.8046656567642609, 'strategy': 'breakout', 'time_stop': 300, 'use_sma': False, 'use_atr': True, 'use_adx': False, 'use_ema': False, 'use_spike': False, 'rsi_required': False, 'edge_k': 0.8138903330774655, 'edge_cap': 0.33403759352991774, 'bull_strategy': 'mean_reversion', 'bull_bb_std_mult': 3.410128063100218, 'bull_rsi_os': 38, 'bull_rsi_ob': 77, 'bull_adx_thresh': 31.50950664174527, 'bull_atr_min_pct': 0.004102215970742356, 'bull_atr_max_pct': 0.02999000256427251, 'bull_tp_mult': 1.7442180244818304, 'bull_tsl_mult': 0.5627428593972956, 'bull_time_stop': 210, 'bull_use_sma': False, 'bull_use_ema': False, 'bull_use_atr': True, 'bull_use_adx': False, 'bull_use_spike': True, 'bull_rsi_required': False, 'bear_strategy': 'breakout', 'bear_bb_std_mult': 3.3807491971595285, 'bear_rsi_os': 46, 'bear_rsi_ob': 82, 'bear_adx_thresh': 14.831759923873461, 'bear_atr_min_pct': 0.003303227785360431, 'bear_atr_max_pct': 0.14037591782739461, 'bear_tp_mult': 2.417966095689182, 'bear_tsl_mult': 0.17457262641593335, 'bear_time_stop': 219, 'bear_use_sma': False, 'bear_use_ema': False, 'bear_use_atr': False, 'bear_use_adx': False, 'bear_use_spike': False, 'bear_rsi_required': False, 'sideways_strategy': 'mean_reversion', 'sideways_bb_std_mult': 1.4435173363624536, 'sideways_rsi_os': 50, 'sideways_rsi_ob': 68, 'sideways_adx_thresh': 20.311654186345862, 'sideways_atr_min_pct': 0.02180193655063077, 'sideways_atr_max_pct': 0.060800301301222284, 'sideways_tp_mult': 2.7047128596664813, 'sideways_tsl_mult': 0.9056394354914756, 'sideways_time_stop': 173, 'sideways_use_sma': False, 'sideways_use_ema': False, 'sideways_use_atr': True, 'sideways_use_adx': False, 'sideways_use_spike': False, 'sideways_rsi_required': False}.
