[I 2025-09-01 13:04:55,542] Trial 18 finished with values: [-1000000000.0, 1000000000.0] and parameters: {'p_sma': 49, 'p_std': 6, 'p_atr': 30, 'p_adx': 7, 'rsi_period': 74, 'ema1': 18, 'ema2': 43, 'slip_atr_k': 0.10250290259608112, 'slip_spread_k': 0.2624244793688473, 'spread_hl_frac': 0.013214608834568492, 'bb_std_mult': 1.3501387456329779, 'rsi_os': 40, 'rsi_ob': 77, 'vol_spike': 0.17278279794631637, 'adx_thresh': 24.74793392026312, 'atr_min_pct': 0.02410465368937212, 'atr_max_pct': 0.0883250764969066, 'tp_mult': 1.3925982467464997, 'tsl_mult': 0.4174680371950585, 'strategy': 'mean_reversion', 'time_stop': 95, 'use_sma': False, 'use_atr': False, 'use_adx': False, 'use_ema': True, 'use_spike': True, 'rsi_required': False, 'edge_k': 0.2591285235648795, 'edge_cap': 0.8306717107827668, 'bull_strategy': 'breakout', 'bull_bb_std_mult': 0.5409702421247637, 'bull_rsi_os': 17, 'bull_rsi_ob': 95, 'bull_adx_thresh': 25.63137056770209, 'bull_atr_min_pct': 0.006063220951220751, 'bull_atr_max_pct': 0.10111156445820185, 'bull_tp_mult': 1.5189662988794372, 'bull_tsl_mult': 0.9925327377514488, 'bull_time_stop': 135, 'bull_use_sma': False, 'bull_use_ema': False, 'bull_use_atr': True, 'bull_use_adx': True, 'bull_use_spike': True, 'bull_rsi_required': False, 'bear_strategy': 'mean_reversion', 'bear_bb_std_mult': 1.1100543363178046, 'bear_rsi_os': 28, 'bear_rsi_ob': 59, 'bear_adx_thresh': 12.823849873841521, 'bear_atr_min_pct': 0.001509882411310455, 'bear_atr_max_pct': 0.08586890579720291, 'bear_tp_mult': 1.7095746676237227, 'bear_tsl_mult': 0.388291408144559, 'bear_time_stop': 133, 'bear_use_sma': False, 'bear_use_ema': False, 'bear_use_atr': True, 'bear_use_adx': False, 'bear_use_spike': True, 'bear_rsi_required': True, 'sideways_strategy': 'mean_reversion', 'sideways_bb_std_mult': 1.0566566780202495, 'sideways_rsi_os': 33, 'sideways_rsi_ob': 61, 'sideways_adx_thresh': 6.94712128041586, 'sideways_atr_min_pct': 0.013120435633090321, 'sideways_atr_max_pct': 0.10070196759427247, 'sideways_tp_mult': 2.5613679642946527, 'sideways_tsl_mult': 0.7732769917729317, 'sideways_time_stop': 245, 'sideways_use_sma': True, 'sideways_use_ema': True, 'sideways_use_atr': False, 'sideways_use_adx': False, 'sideways_use_spike': False, 'sideways_rsi_required': False}.
[I 2025-09-01 13:05:34,335] Trial 20 finished with values: [-0.0497980942466989, 0.049562516758961166] and parameters: {'p_sma': 35, 'p_std': 37, 'p_atr': 16, 'p_adx': 26, 'rsi_period': 69, 'ema1': 15, 'ema2': 44, 'slip_atr_k': 0.1966512097052434, 'slip_spread_k': 0.5333456241279395, 'spread_hl_frac': 0.024487000417125496, 'bb_std_mult': 1.483686846959487, 'rsi_os': 13, 'rsi_ob': 75, 'vol_spike': 0.16496015570628064, 'adx_thresh': 22.845914976949768, 'atr_min_pct': 0.012398680445308362, 'atr_max_pct': 0.0891105969245898, 'tp_mult': 1.7179866164983753, 'tsl_mult': 0.9877853717064262, 'strategy': 'mean_reversion', 'time_stop': 92, 'use_sma': True, 'use_atr': True, 'use_adx': False, 'use_ema': True, 'use_spike': True, 'rsi_required': False, 'edge_k': 0.7866891856632228, 'edge_cap': 0.8967558690815394, 'bull_strategy': 'breakout', 'bull_bb_std_mult': 0.8735832889380442, 'bull_rsi_os': 55, 'bull_rsi_ob': 59, 'bull_adx_thresh': 17.277942880453985, 'bull_atr_min_pct': 1.7693247802824316e-05, 'bull_atr_max_pct': 0.05989866749107067, 'bull_tp_mult': 2.4482537405885156, 'bull_tsl_mult': 0.8539119273988713, 'bull_time_stop': 135, 'bull_use_sma': False, 'bull_use_ema': False, 'bull_use_atr': True, 'bull_use_adx': True, 'bull_use_spike': True, 'bull_rsi_required': True, 'bear_strategy': 'mean_reversion', 'bear_bb_std_mult': 3.5624403559034175, 'bear_rsi_os': 24, 'bear_rsi_ob': 59, 'bear_adx_thresh': 13.739415088069315, 'bear_atr_min_pct': 0.005278873816768101, 'bear_atr_max_pct': 0.14878131571555905, 'bear_tp_mult': 1.7851923637441958, 'bear_tsl_mult': 0.9848778133046168, 'bear_time_stop': 218, 'bear_use_sma': True, 'bear_use_ema': False, 'bear_use_atr': False, 'bear_use_adx': True, 'bear_use_spike': True, 'bear_rsi_required': True, 'sideways_strategy': 'mean_reversion', 'sideways_bb_std_mult': 0.501032827714271, 'sideways_rsi_os': 5, 'sideways_rsi_ob': 80, 'sideways_adx_thresh': 11.193091132024268, 'sideways_atr_min_pct': 0.024475270736411887, 'sideways_atr_max_pct': 0.10622244656434492, 'sideways_tp_mult': 1.0470004953148144, 'sideways_tsl_mult': 0.8780628008697473, 'sideways_time_stop': 221, 'sideways_use_sma': True, 'sideways_use_ema': False, 'sideways_use_atr': False, 'sideways_use_adx': False, 'sideways_use_spike': False, 'sideways_rsi_required': True}.
[I 2025-09-01 13:05:34,321] Trial 22 finished with values: [-1000000000.0, 1000000000.0] and parameters: {'p_sma': 35, 'p_std': 34, 'p_atr': 15, 'p_adx': 17, 'rsi_period': 38, 'ema1': 25, 'ema2': 46, 'slip_atr_k': 0.17054524413307515, 'slip_spread_k': 0.5946789830301555, 'spread_hl_frac': 0.02263536896708191, 'bb_std_mult': 1.938378041694459, 'rsi_os': 12, 'rsi_ob': 59, 'vol_spike': 0.17140804672695592, 'adx_thresh': 22.733673419872346, 'atr_min_pct': 0.013437086810978119, 'atr_max_pct': 0.0553664298776709, 'tp_mult': 1.7237935742242374, 'tsl_mult': 0.9691120107585273, 'strategy': 'mean_reversion', 'time_stop': 129, 'use_sma': True, 'use_atr': True, 'use_adx': False, 'use_ema': True, 'use_spike': True, 'rsi_required': False, 'edge_k': 0.8843873139437823, 'edge_cap': 0.9577509040949796, 'bull_strategy': 'breakout', 'bull_bb_std_mult': 0.9266629440819385, 'bull_rsi_os': 23, 'bull_rsi_ob': 84, 'bull_adx_thresh': 17.527531506528394, 'bull_atr_min_pct': 0.01792457964318743, 'bull_atr_max_pct': 0.05322539046611028, 'bull_tp_mult': 2.3781906284840915, 'bull_tsl_mult': 0.863846599047443, 'bull_time_stop': 193, 'bull_use_sma': False, 'bull_use_ema': False, 'bull_use_atr': True, 'bull_use_adx': False, 'bull_use_spike': True, 'bull_rsi_required': True, 'bear_strategy': 'mean_reversion', 'bear_bb_std_mult': 0.5306587158827063, 'bear_rsi_os': 53, 'bear_rsi_ob': 75, 'bear_adx_thresh': 12.764211887281446, 'bear_atr_min_pct': 0.005376490390302864, 'bear_atr_max_pct': 0.12498069901914631, 'bear_tp_mult': 1.410533191902708, 'bear_tsl_mult': 0.005520844541498315, 'bear_time_stop': 218, 'bear_use_sma': True, 'bear_use_ema': False, 'bear_use_atr': False, 'bear_use_adx': True, 'bear_use_spike': True, 'bear_rsi_required': True, 'sideways_strategy': 'mean_reversion', 'sideways_bb_std_mult': 0.503380168692535, 'sideways_rsi_os': 6, 'sideways_rsi_ob': 83, 'sideways_adx_thresh': 10.430893316308076, 'sideways_atr_min_pct': 0.0016047538933377965, 'sideways_atr_max_pct': 0.11935611671788736, 'sideways_tp_mult': 2.334395858169582, 'sideways_tsl_mult': 0.8746409747020784, 'sideways_time_stop': 188, 'sideways_use_sma': True, 'sideways_use_ema': False, 'sideways_use_atr': False, 'sideways_use_adx': False, 'sideways_use_spike': False, 'sideways_rsi_required': True}.
[I 2025-09-01 13:05:35,055] Trial 19 finished with values: [-0.05281256760072173, 0.052511669258492814] and parameters: {'p_sma': 51, 'p_std': 35, 'p_atr': 16, 'p_adx': 9, 'rsi_period': 71, 'ema1': 16, 'ema2': 47, 'slip_atr_k': 0.17484762106884144, 'slip_spread_k': 0.5134117785470858, 'spread_hl_frac': 0.025581554576042487, 'bb_std_mult': 1.5364573738477894, 'rsi_os': 11, 'rsi_ob': 75, 'vol_spike': 0.1734351944709291, 'adx_thresh': 23.08536063049752, 'atr_min_pct': 0.012314770143803132, 'atr_max_pct': 0.08641128394754366, 'tp_mult': 1.7040709460768346, 'tsl_mult': 0.3810950250411815, 'strategy': 'mean_reversion', 'time_stop': 97, 'use_sma': False, 'use_atr': False, 'use_adx': False, 'use_ema': True, 'use_spike': True, 'rsi_required': False, 'edge_k': 0.8115442142899802, 'edge_cap': 0.8322720652376148, 'bull_strategy': 'breakout', 'bull_bb_std_mult': 0.7981461986018796, 'bull_rsi_os': 55, 'bull_rsi_ob': 60, 'bull_adx_thresh': 16.713915631551117, 'bull_atr_min_pct': 0.0006420934087217126, 'bull_atr_max_pct': 0.0606910381766492, 'bull_tp_mult': 2.3523317821446286, 'bull_tsl_mult': 0.8226462823189259, 'bull_time_stop': 141, 'bull_use_sma': False, 'bull_use_ema': False, 'bull_use_atr': True, 'bull_use_adx': False, 'bull_use_spike': True, 'bull_rsi_required': False, 'bear_strategy': 'mean_reversion', 'bear_bb_std_mult': 0.5522272054082873, 'bear_rsi_os': 26, 'bear_rsi_ob': 59, 'bear_adx_thresh': 13.459014048994405, 'bear_atr_min_pct': 0.005240501547504429, 'bear_atr_max_pct': 0.07569091209061715, 'bear_tp_mult': 1.6983806914994377, 'bear_tsl_mult': 0.9779059962567448, 'bear_time_stop': 221, 'bear_use_sma': False, 'bear_use_ema': False, 'bear_use_atr': False, 'bear_use_adx': True, 'bear_use_spike': True, 'bear_rsi_required': True, 'sideways_strategy': 'mean_reversion', 'sideways_bb_std_mult': 2.5394291412578553, 'sideways_rsi_os': 25, 'sideways_rsi_ob': 80, 'sideways_adx_thresh': 10.264148676330077, 'sideways_atr_min_pct': 0.02495400260019704, 'sideways_atr_max_pct': 0.09697835983239522, 'sideways_tp_mult': 1.0586888044201554, 'sideways_tsl_mult': 0.8901198632094409, 'sideways_time_stop': 206, 'sideways_use_sma': True, 'sideways_use_ema': False, 'sideways_use_atr': False, 'sideways_use_adx': False, 'sideways_use_spike': False, 'sideways_rsi_required': True}.
[I 2025-09-01 13:05:35,065] Trial 21 finished with values: [-0.04031013643772907, 0.04006762715463087] and parameters: {'p_sma': 34, 'p_std': 36, 'p_atr': 16, 'p_adx': 10, 'rsi_period': 72, 'ema1': 15, 'ema2': 42, 'slip_atr_k': 0.19585228493106194, 'slip_spread_k': 0.5466588054972533, 'spread_hl_frac': 0.04824940544779081, 'bb_std_mult': 1.558235359182273, 'rsi_os': 13, 'rsi_ob': 74, 'vol_spike': 0.18111899920184443, 'adx_thresh': 23.578681868023697, 'atr_min_pct': 0.023237133031033714, 'atr_max_pct': 0.08989982301019186, 'tp_mult': 1.7003405585450038, 'tsl_mult': 0.9717503936778565, 'strategy': 'mean_reversion', 'time_stop': 91, 'use_sma': True, 'use_atr': True, 'use_adx': False, 'use_ema': True, 'use_spike': True, 'rsi_required': False, 'edge_k': 0.7362731982771588, 'edge_cap': 0.8836232377821935, 'bull_strategy': 'breakout', 'bull_bb_std_mult': 0.8771047704426718, 'bull_rsi_os': 17, 'bull_rsi_ob': 63, 'bull_adx_thresh': 18.03976620381643, 'bull_atr_min_pct': 0.0020652334011038234, 'bull_atr_max_pct': 0.06317196557223922, 'bull_tp_mult': 2.2600250616915365, 'bull_tsl_mult': 0.8199209930712383, 'bull_time_stop': 131, 'bull_use_sma': False, 'bull_use_ema': False, 'bull_use_atr': True, 'bull_use_adx': True, 'bull_use_spike': True, 'bull_rsi_required': True, 'bear_strategy': 'mean_reversion', 'bear_bb_std_mult': 0.5080196299587253, 'bear_rsi_os': 52, 'bear_rsi_ob': 61, 'bear_adx_thresh': 13.852604064263659, 'bear_atr_min_pct': 0.005249819701134668, 'bear_atr_max_pct': 0.1485521404970893, 'bear_tp_mult': 1.7683879880483668, 'bear_tsl_mult': 0.6036702192740825, 'bear_time_stop': 210, 'bear_use_sma': True, 'bear_use_ema': False, 'bear_use_atr': False, 'bear_use_adx': True, 'bear_use_spike': True, 'bear_rsi_required': True, 'sideways_strategy': 'mean_reversion', 'sideways_bb_std_mult': 2.3659721245549123, 'sideways_rsi_os': 48, 'sideways_rsi_ob': 82, 'sideways_adx_thresh': 9.433543211626144, 'sideways_atr_min_pct': 0.00028369955707865935, 'sideways_atr_max_pct': 0.09701523387404491, 'sideways_tp_mult': 2.4616593015645085, 'sideways_tsl_mult': 0.9228936451555105, 'sideways_time_stop': 232, 'sideways_use_sma': True, 'sideways_use_ema': False, 'sideways_use_atr': False, 'sideways_use_adx': False, 'sideways_use_spike': False, 'sideways_rsi_required': True}.
[I 2025-09-01 13:05:35,358] Trial 25 finished with values: [-1000000000.0, 1000000000.0] and parameters: {'p_sma': 28, 'p_std': 39, 'p_atr': 16, 'p_adx': 26, 'rsi_period': 68, 'ema1': 15, 'ema2': 31, 'slip_atr_k': 0.1912213280892005, 'slip_spread_k': 0.8392185077084424, 'spread_hl_frac': 0.0495861787368614, 'bb_std_mult': 1.491479651820469, 'rsi_os': 54, 'rsi_ob': 73, 'vol_spike': 0.21579236964311121, 'adx_thresh': 22.16294634250451, 'atr_min_pct': 0.02125299657758836, 'atr_max_pct': 0.11762123899583883, 'tp_mult': 2.305683645976532, 'tsl_mult': 0.729320499743981, 'strategy': 'mean_reversion', 'time_stop': 69, 'use_sma': True, 'use_atr': True, 'use_adx': False, 'use_ema': False, 'use_spike': True, 'rsi_required': False, 'edge_k': 0.6935447652877332, 'edge_cap': 0.9004447531513653, 'bull_strategy': 'breakout', 'bull_bb_std_mult': 2.4713663587157466, 'bull_rsi_os': 53, 'bull_rsi_ob': 62, 'bull_adx_thresh': 13.811459412510478, 'bull_atr_min_pct': 0.001828523627835583, 'bull_atr_max_pct': 0.0652298141068231, 'bull_tp_mult': 2.629842603896084, 'bull_tsl_mult': 0.001778076041331067, 'bull_time_stop': 157, 'bull_use_sma': False, 'bull_use_ema': False, 'bull_use_atr': True, 'bull_use_adx': True, 'bull_use_spike': True, 'bull_rsi_required': True, 'bear_strategy': 'mean_reversion', 'bear_bb_std_mult': 0.505932241210154, 'bear_rsi_os': 19, 'bear_rsi_ob': 60, 'bear_adx_thresh': 16.361441150671748, 'bear_atr_min_pct': 0.005326599406242865, 'bear_atr_max_pct': 0.0697880449584956, 'bear_tp_mult': 1.9058478312215617, 'bear_tsl_mult': 0.9793720575388616, 'bear_time_stop': 218, 'bear_use_sma': True, 'bear_use_ema': False, 'bear_use_atr': False, 'bear_use_adx': True, 'bear_use_spike': True, 'bear_rsi_required': True, 'sideways_strategy': 'mean_reversion', 'sideways_bb_std_mult': 2.543706148715904, 'sideways_rsi_os': 48, 'sideways_rsi_ob': 86, 'sideways_adx_thresh': 20.865941581448105, 'sideways_atr_min_pct': 0.008606136901905351, 'sideways_atr_max_pct': 0.05451430048088185, 'sideways_tp_mult': 1.0528655857092557, 'sideways_tsl_mult': 0.9809408725216461, 'sideways_time_stop': 198, 'sideways_use_sma': True, 'sideways_use_ema': False, 'sideways_use_atr': False, 'sideways_use_adx': False, 'sideways_use_spike': True, 'sideways_rsi_required': True}.
[I 2025-09-01 13:06:12,524] Trial 27 finished with values: [-1000000000.0, 1000000000.0] and parameters: {'p_sma': 25, 'p_std': 38, 'p_atr': 16, 'p_adx': 16, 'rsi_period': 70, 'ema1': 10, 'ema2': 15, 'slip_atr_k': 0.20384981851501568, 'slip_spread_k': 0.5770901280974083, 'spread_hl_frac': 0.04426191355635844, 'bb_std_mult': 1.095405815572545, 'rsi_os': 37, 'rsi_ob': 70, 'vol_spike': 0.1635957830124801, 'adx_thresh': 23.34332165071067, 'atr_min_pct': 0.025795287576819925, 'atr_max_pct': 0.09375758563987295, 'tp_mult': 1.672906502571373, 'tsl_mult': 0.373099542232921, 'strategy': 'mean_reversion', 'time_stop': 135, 'use_sma': True, 'use_atr': True, 'use_adx': False, 'use_ema': True, 'use_spike': True, 'rsi_required': False, 'edge_k': 0.7517438784025123, 'edge_cap': 0.9030156503829061, 'bull_strategy': 'breakout', 'bull_bb_std_mult': 1.8248556409411492, 'bull_rsi_os': 28, 'bull_rsi_ob': 73, 'bull_adx_thresh': 18.547811468072744, 'bull_atr_min_pct': 0.00619744643140256, 'bull_atr_max_pct': 0.06618347901758617, 'bull_tp_mult': 2.22981653882434, 'bull_tsl_mult': 0.36778519698109735, 'bull_time_stop': 187, 'bull_use_sma': False, 'bull_use_ema': False, 'bull_use_atr': True, 'bull_use_adx': True, 'bull_use_spike': True, 'bull_rsi_required': True, 'bear_strategy': 'mean_reversion', 'bear_bb_std_mult': 0.7806323256510044, 'bear_rsi_os': 22, 'bear_rsi_ob': 94, 'bear_adx_thresh': 22.517942531732132, 'bear_atr_min_pct': 0.007424251442257019, 'bear_atr_max_pct': 0.14871114481697978, 'bear_tp_mult': 1.4651683313683925, 'bear_tsl_mult': 0.6258979824590769, 'bear_time_stop': 296, 'bear_use_sma': True, 'bear_use_ema': False, 'bear_use_atr': False, 'bear_use_adx': True, 'bear_use_spike': True, 'bear_rsi_required': True, 'sideways_strategy': 'mean_reversion', 'sideways_bb_std_mult': 2.7197821841863106, 'sideways_rsi_os': 55, 'sideways_rsi_ob': 78, 'sideways_adx_thresh': 34.80292109228481, 'sideways_atr_min_pct': 0.0038767812067040026, 'sideways_atr_max_pct': 0.09220011907765312, 'sideways_tp_mult': 2.7073269236791715, 'sideways_tsl_mult': 0.9315347878939434, 'sideways_time_stop': 214, 'sideways_use_sma': True, 'sideways_use_ema': False, 'sideways_use_atr': False, 'sideways_use_adx': False, 'sideways_use_spike': False, 'sideways_rsi_required': True}.
[I 2025-09-01 13:06:13,148] Trial 23 finished with values: [-0.045380949508416646, 0.045134804595575104] and parameters: {'p_sma': 25, 'p_std': 38, 'p_atr': 16, 'p_adx': 26, 'rsi_period': 67, 'ema1': 14, 'ema2': 18, 'slip_atr_k': 0.1947992777311789, 'slip_spread_k': 0.8221302963954482, 'spread_hl_frac': 0.04966176149626202, 'bb_std_mult': 1.2397613308377957, 'rsi_os': 14, 'rsi_ob': 71, 'vol_spike': 0.23578198592202498, 'adx_thresh': 19.893902540362443, 'atr_min_pct': 0.012834819260581875, 'atr_max_pct': 0.09515692177970585, 'tp_mult': 1.7074059222418698, 'tsl_mult': 0.9834984032163308, 'strategy': 'mean_reversion', 'time_stop': 141, 'use_sma': True, 'use_atr': True, 'use_adx': False, 'use_ema': True, 'use_spike': True, 'rsi_required': False, 'edge_k': 1.285091100965538, 'edge_cap': 0.8614007803917578, 'bull_strategy': 'breakout', 'bull_bb_std_mult': 1.277636666617496, 'bull_rsi_os': 55, 'bull_rsi_ob': 61, 'bull_adx_thresh': 17.25030455485134, 'bull_atr_min_pct': 0.0008236924335332414, 'bull_atr_max_pct': 0.06020210483107577, 'bull_tp_mult': 2.769131748051378, 'bull_tsl_mult': 0.8215844207558975, 'bull_time_stop': 228, 'bull_use_sma': False, 'bull_use_ema': False, 'bull_use_atr': True, 'bull_use_adx': True, 'bull_use_spike': True, 'bull_rsi_required': True, 'bear_strategy': 'mean_reversion', 'bear_bb_std_mult': 3.3910201627952126, 'bear_rsi_os': 22, 'bear_rsi_ob': 62, 'bear_adx_thresh': 15.745247340103482, 'bear_atr_min_pct': 0.005271492721307615, 'bear_atr_max_pct': 0.14988574890211961, 'bear_tp_mult': 1.9005957333614525, 'bear_tsl_mult': 0.9640174282557985, 'bear_time_stop': 297, 'bear_use_sma': True, 'bear_use_ema': False, 'bear_use_atr': False, 'bear_use_adx': True, 'bear_use_spike': True, 'bear_rsi_required': True, 'sideways_strategy': 'mean_reversion', 'sideways_bb_std_mult': 0.5256680305914362, 'sideways_rsi_os': 5, 'sideways_rsi_ob': 81, 'sideways_adx_thresh': 9.915700921267923, 'sideways_atr_min_pct': 0.023724303109755627, 'sideways_atr_max_pct': 0.1005678502458634, 'sideways_tp_mult': 1.0430679011435857, 'sideways_tsl_mult': 0.9673561058458672, 'sideways_time_stop': 187, 'sideways_use_sma': True, 'sideways_use_ema': False, 'sideways_use_atr': False, 'sideways_use_adx': False, 'sideways_use_spike': False, 'sideways_rsi_required': True}.
[I 2025-09-01 13:06:13,761] Trial 24 finished with values: [-0.037137414235153154, 0.03689172676552701] and parameters: {'p_sma': 28, 'p_std': 38, 'p_atr': 16, 'p_adx': 26, 'rsi_period': 69, 'ema1': 14, 'ema2': 50, 'slip_atr_k': 0.20360340824556492, 'slip_spread_k': 0.8196072315864049, 'spread_hl_frac': 0.034100559629443014, 'bb_std_mult': 1.173628783236963, 'rsi_os': 13, 'rsi_ob': 70, 'vol_spike': 0.24758235238794524, 'adx_thresh': 19.91674664768101, 'atr_min_pct': 0.012527609743367554, 'atr_max_pct': 0.09683078029760246, 'tp_mult': 2.3081543546636896, 'tsl_mult': 0.9888631088212897, 'strategy': 'mean_reversion', 'time_stop': 144, 'use_sma': True, 'use_atr': True, 'use_adx': False, 'use_ema': True, 'use_spike': True, 'rsi_required': False, 'edge_k': 1.25239175855041, 'edge_cap': 0.8866316546527245, 'bull_strategy': 'breakout', 'bull_bb_std_mult': 1.2466033560269811, 'bull_rsi_os': 55, 'bull_rsi_ob': 58, 'bull_adx_thresh': 18.227822123099735, 'bull_atr_min_pct': 0.0015783504797973293, 'bull_atr_max_pct': 0.06547811738817691, 'bull_tp_mult': 2.7421312523024217, 'bull_tsl_mult': 0.8161937709839815, 'bull_time_stop': 222, 'bull_use_sma': False, 'bull_use_ema': False, 'bull_use_atr': True, 'bull_use_adx': True, 'bull_use_spike': True, 'bull_rsi_required': True, 'bear_strategy': 'mean_reversion', 'bear_bb_std_mult': 3.3107451625509325, 'bear_rsi_os': 22, 'bear_rsi_ob': 61, 'bear_adx_thresh': 16.56587611053612, 'bear_atr_min_pct': 0.006252741331079331, 'bear_atr_max_pct': 0.1496859782825755, 'bear_tp_mult': 1.9063644298074993, 'bear_tsl_mult': 0.9971000966418195, 'bear_time_stop': 297, 'bear_use_sma': True, 'bear_use_ema': False, 'bear_use_atr': False, 'bear_use_adx': True, 'bear_use_spike': True, 'bear_rsi_required': True, 'sideways_strategy': 'mean_reversion', 'sideways_bb_std_mult': 0.5065105018211178, 'sideways_rsi_os': 6, 'sideways_rsi_ob': 81, 'sideways_adx_thresh': 10.534335401938426, 'sideways_atr_min_pct': 0.023880913054678588, 'sideways_atr_max_pct': 0.09639039291167917, 'sideways_tp_mult': 1.0621255134147234, 'sideways_tsl_mult': 0.9750344534259718, 'sideways_time_stop': 184, 'sideways_use_sma': True, 'sideways_use_ema': False, 'sideways_use_atr': False, 'sideways_use_adx': False, 'sideways_use_spike': False, 'sideways_rsi_required': True}.
