[I 2025-09-01 13:06:14,030] Trial 26 finished with values: [-0.03665374605587679, 0.03639742214213746] and parameters: {'p_sma': 28, 'p_std': 41, 'p_atr': 16, 'p_adx': 25, 'rsi_period': 70, 'ema1': 15, 'ema2': 47, 'slip_atr_k': 0.1961048847526983, 'slip_spread_k': 0.829703049262693, 'spread_hl_frac': 0.04990566035982237, 'bb_std_mult': 1.0786402313884014, 'rsi_os': 36, 'rsi_ob': 72, 'vol_spike': 0.21646264897370357, 'adx_thresh': 21.402959408432952, 'atr_min_pct': 0.022379651391081657, 'atr_max_pct': 0.09490138235564467, 'tp_mult': 2.3191023832219892, 'tsl_mult': 0.7504229807270688, 'strategy': 'mean_reversion', 'time_stop': 136, 'use_sma': True, 'use_atr': True, 'use_adx': False, 'use_ema': False, 'use_spike': True, 'rsi_required': False, 'edge_k': 0.7049577479291789, 'edge_cap': 0.8921844516967217, 'bull_strategy': 'breakout', 'bull_bb_std_mult': 2.5801703020249134, 'bull_rsi_os': 31, 'bull_rsi_ob': 58, 'bull_adx_thresh': 13.377455938258073, 'bull_atr_min_pct': 0.0019321252418869426, 'bull_atr_max_pct': 0.07302528180073334, 'bull_tp_mult': 2.6728133175587323, 'bull_tsl_mult': 0.03012254891864158, 'bull_time_stop': 158, 'bull_use_sma': False, 'bull_use_ema': False, 'bull_use_atr': True, 'bull_use_adx': True, 'bull_use_spike': True, 'bull_rsi_required': True, 'bear_strategy': 'mean_reversion', 'bear_bb_std_mult': 0.8273721711185793, 'bear_rsi_os': 18, 'bear_rsi_ob': 60, 'bear_adx_thresh': 16.23304664828511, 'bear_atr_min_pct': 0.005495059124180291, 'bear_atr_max_pct': 0.14709282196652035, 'bear_tp_mult': 1.8466593014115806, 'bear_tsl_mult': 0.8684578401415004, 'bear_time_stop': 288, 'bear_use_sma': True, 'bear_use_ema': False, 'bear_use_atr': False, 'bear_use_adx': True, 'bear_use_spike': True, 'bear_rsi_required': True, 'sideways_strategy': 'mean_reversion', 'sideways_bb_std_mult': 2.463744901698023, 'sideways_rsi_os': 49, 'sideways_rsi_ob': 86, 'sideways_adx_thresh': 8.788713227377492, 'sideways_atr_min_pct': 0.009700591720978672, 'sideways_atr_max_pct': 0.09877654255391251, 'sideways_tp_mult': 1.0606923679054427, 'sideways_tsl_mult': 0.995780722245228, 'sideways_time_stop': 193, 'sideways_use_sma': True, 'sideways_use_ema': False, 'sideways_use_atr': False, 'sideways_use_adx': False, 'sideways_use_spike': True, 'sideways_rsi_required': True}.
[I 2025-09-01 13:06:52,780] Trial 28 finished with values: [-1000000000.0, 1000000000.0] and parameters: {'p_sma': 18, 'p_std': 29, 'p_atr': 9, 'p_adx': 9, 'rsi_period': 59, 'ema1': 8, 'ema2': 46, 'slip_atr_k': 0.1838736684785804, 'slip_spread_k': 0.4866329274501603, 'spread_hl_frac': 0.040190692027713276, 'bb_std_mult': 1.7102710843170819, 'rsi_os': 11, 'rsi_ob': 63, 'vol_spike': 0.1974820358226498, 'adx_thresh': 11.844290307023343, 'atr_min_pct': 0.013685633215741691, 'atr_max_pct': 0.10781531181319383, 'tp_mult': 1.2009985264866747, 'tsl_mult': 0.9940789497288023, 'strategy': 'mean_reversion', 'time_stop': 177, 'use_sma': True, 'use_atr': True, 'use_adx': False, 'use_ema': True, 'use_spike': True, 'rsi_required': False, 'edge_k': 1.2839751152544716, 'edge_cap': 0.6916807257793525, 'bull_strategy': 'breakout', 'bull_bb_std_mult': 1.231018056478739, 'bull_rsi_os': 33, 'bull_rsi_ob': 57, 'bull_adx_thresh': 10.961599834686588, 'bull_atr_min_pct': 0.005644145236029078, 'bull_atr_max_pct': 0.05655329338569641, 'bull_tp_mult': 2.4164954801050738, 'bull_tsl_mult': 0.8728228085899767, 'bull_time_stop': 129, 'bull_use_sma': False, 'bull_use_ema': False, 'bull_use_atr': True, 'bull_use_adx': True, 'bull_use_spike': True, 'bull_rsi_required': True, 'bear_strategy': 'mean_reversion', 'bear_bb_std_mult': 3.2830814099258894, 'bear_rsi_os': 40, 'bear_rsi_ob': 67, 'bear_adx_thresh': 27.825990082895935, 'bear_atr_min_pct': 0.003719243860290268, 'bear_atr_max_pct': 0.01876573667620235, 'bear_tp_mult': 1.8781551363284907, 'bear_tsl_mult': 0.850022304267412, 'bear_time_stop': 206, 'bear_use_sma': True, 'bear_use_ema': False, 'bear_use_atr': False, 'bear_use_adx': True, 'bear_use_spike': True, 'bear_rsi_required': True, 'sideways_strategy': 'mean_reversion', 'sideways_bb_std_mult': 1.9216649287249514, 'sideways_rsi_os': 26, 'sideways_rsi_ob': 88, 'sideways_adx_thresh': 8.862025053254328, 'sideways_atr_min_pct': 0.011403070479523332, 'sideways_atr_max_pct': 0.10897838714788607, 'sideways_tp_mult': 1.9091771799764476, 'sideways_tsl_mult': 0.6268683093555505, 'sideways_time_stop': 252, 'sideways_use_sma': True, 'sideways_use_ema': False, 'sideways_use_atr': False, 'sideways_use_adx': False, 'sideways_use_spike': False, 'sideways_rsi_required': True}.
[I 2025-09-01 13:06:53,958] Trial 31 finished with values: [-1000000000.0, 1000000000.0] and parameters: {'p_sma': 19, 'p_std': 53, 'p_atr': 7, 'p_adx': 24, 'rsi_period': 60, 'ema1': 8, 'ema2': 49, 'slip_atr_k': 0.22244504729858733, 'slip_spread_k': 0.7014050486009871, 'spread_hl_frac': 0.0428652456210011, 'bb_std_mult': 0.975037579385997, 'rsi_os': 28, 'rsi_ob': 56, 'vol_spike': 0.2537361091001798, 'adx_thresh': 11.547764070761392, 'atr_min_pct': 0.007691318768388557, 'atr_max_pct': 0.10927237412414235, 'tp_mult': 2.5365479386781096, 'tsl_mult': 0.7559736126236334, 'strategy': 'mean_reversion', 'time_stop': 200, 'use_sma': True, 'use_atr': True, 'use_adx': False, 'use_ema': False, 'use_spike': False, 'rsi_required': True, 'edge_k': 0.6124164017724373, 'edge_cap': 0.7219888434550091, 'bull_strategy': 'breakout', 'bull_bb_std_mult': 3.1433536924143355, 'bull_rsi_os': 36, 'bull_rsi_ob': 53, 'bull_adx_thresh': 11.315782348587094, 'bull_atr_min_pct': 0.005683822067648654, 'bull_atr_max_pct': 0.08613325091184307, 'bull_tp_mult': 2.960812052238827, 'bull_tsl_mult': 0.0045464696044945005, 'bull_time_stop': 223, 'bull_use_sma': True, 'bull_use_ema': False, 'bull_use_atr': True, 'bull_use_adx': True, 'bull_use_spike': False, 'bull_rsi_required': True, 'bear_strategy': 'mean_reversion', 'bear_bb_std_mult': 2.4482035031248195, 'bear_rsi_os': 6, 'bear_rsi_ob': 76, 'bear_adx_thresh': 26.68187112615802, 'bear_atr_min_pct': 0.00879250962826304, 'bear_atr_max_pct': 0.012968807354618112, 'bear_tp_mult': 1.5389865912882486, 'bear_tsl_mult': 0.8392464392732275, 'bear_time_stop': 272, 'bear_use_sma': True, 'bear_use_ema': True, 'bear_use_atr': False, 'bear_use_adx': True, 'bear_use_spike': False, 'bear_rsi_required': False, 'sideways_strategy': 'mean_reversion', 'sideways_bb_std_mult': 1.8319227949368369, 'sideways_rsi_os': 47, 'sideways_rsi_ob': 89, 'sideways_adx_thresh': 8.074230598194177, 'sideways_atr_min_pct': 0.010874624648616011, 'sideways_atr_max_pct': 0.12065821116181646, 'sideways_tp_mult': 1.2464116232417366, 'sideways_tsl_mult': 0.5860665289258341, 'sideways_time_stop': 164, 'sideways_use_sma': False, 'sideways_use_ema': False, 'sideways_use_atr': True, 'sideways_use_adx': False, 'sideways_use_spike': True, 'sideways_rsi_required': True}.
[I 2025-09-01 13:06:53,958] Trial 29 finished with values: [-1000000000.0, 1000000000.0] and parameters: {'p_sma': 19, 'p_std': 29, 'p_atr': 8, 'p_adx': 14, 'rsi_period': 57, 'ema1': 8, 'ema2': 20, 'slip_atr_k': 0.20977183527244547, 'slip_spread_k': 0.7046901586466282, 'spread_hl_frac': 0.03892963066355528, 'bb_std_mult': 1.6868031821781204, 'rsi_os': 17, 'rsi_ob': 56, 'vol_spike': 0.2448585908996616, 'adx_thresh': 20.18947711673196, 'atr_min_pct': 0.02094511384987657, 'atr_max_pct': 0.11141318081676307, 'tp_mult': 1.2125454297850915, 'tsl_mult': 0.21192747513038318, 'strategy': 'mean_reversion', 'time_stop': 178, 'use_sma': True, 'use_atr': True, 'use_adx': False, 'use_ema': False, 'use_spike': False, 'rsi_required': True, 'edge_k': 1.2792922860254667, 'edge_cap': 0.6789630185419568, 'bull_strategy': 'breakout', 'bull_bb_std_mult': 1.214507946324652, 'bull_rsi_os': 34, 'bull_rsi_ob': 56, 'bull_adx_thresh': 10.27186628634658, 'bull_atr_min_pct': 0.006012089930153513, 'bull_atr_max_pct': 0.026964482236487515, 'bull_tp_mult': 2.722067136825151, 'bull_tsl_mult': 0.9172496681080727, 'bull_time_stop': 225, 'bull_use_sma': True, 'bull_use_ema': False, 'bull_use_atr': True, 'bull_use_adx': True, 'bull_use_spike': False, 'bull_rsi_required': True, 'bear_strategy': 'mean_reversion', 'bear_bb_std_mult': 3.3684421943701537, 'bear_rsi_os': 5, 'bear_rsi_ob': 65, 'bear_adx_thresh': 25.9142009335407, 'bear_atr_min_pct': 0.009184865506676661, 'bear_atr_max_pct': 0.020574009105822494, 'bear_tp_mult': 1.9289864345008558, 'bear_tsl_mult': 0.8185307186844871, 'bear_time_stop': 196, 'bear_use_sma': True, 'bear_use_ema': True, 'bear_use_atr': False, 'bear_use_adx': True, 'bear_use_spike': False, 'bear_rsi_required': False, 'sideways_strategy': 'mean_reversion', 'sideways_bb_std_mult': 1.8936244736682408, 'sideways_rsi_os': 49, 'sideways_rsi_ob': 87, 'sideways_adx_thresh': 8.34039197034824, 'sideways_atr_min_pct': 0.011412405942132442, 'sideways_atr_max_pct': 0.1106542045838767, 'sideways_tp_mult': 2.41879347245387, 'sideways_tsl_mult': 0.5980500869155572, 'sideways_time_stop': 249, 'sideways_use_sma': False, 'sideways_use_ema': False, 'sideways_use_atr': True, 'sideways_use_adx': False, 'sideways_use_spike': True, 'sideways_rsi_required': True}.
[I 2025-09-01 13:06:54,322] Trial 30 finished with values: [-1000000000.0, 1000000000.0] and parameters: {'p_sma': 19, 'p_std': 30, 'p_atr': 7, 'p_adx': 26, 'rsi_period': 59, 'ema1': 7, 'ema2': 59, 'slip_atr_k': 0.2062714252364112, 'slip_spread_k': 0.8457415274360218, 'spread_hl_frac': 0.04078798053487275, 'bb_std_mult': 1.005466554154351, 'rsi_os': 19, 'rsi_ob': 55, 'vol_spike': 0.2476638031616694, 'adx_thresh': 19.899384922307533, 'atr_min_pct': 0.007561730091992608, 'atr_max_pct': 0.110343831802552, 'tp_mult': 2.5192288670574223, 'tsl_mult': 0.7576662097831612, 'strategy': 'mean_reversion', 'time_stop': 167, 'use_sma': True, 'use_atr': True, 'use_adx': False, 'use_ema': False, 'use_spike': False, 'rsi_required': True, 'edge_k': 1.33915690128841, 'edge_cap': 0.7233494800978579, 'bull_strategy': 'breakout', 'bull_bb_std_mult': 1.4286122972030686, 'bull_rsi_os': 50, 'bull_rsi_ob': 55, 'bull_adx_thresh': 12.2429662751324, 'bull_atr_min_pct': 0.004657780758918938, 'bull_atr_max_pct': 0.09008877724889161, 'bull_tp_mult': 2.9935818363727837, 'bull_tsl_mult': 0.719819701505369, 'bull_time_stop': 228, 'bull_use_sma': True, 'bull_use_ema': False, 'bull_use_atr': True, 'bull_use_adx': True, 'bull_use_spike': False, 'bull_rsi_required': True, 'bear_strategy': 'mean_reversion', 'bear_bb_std_mult': 3.2312640176755503, 'bear_rsi_os': 5, 'bear_rsi_ob': 65, 'bear_adx_thresh': 27.935457939184943, 'bear_atr_min_pct': 0.023362062307341752, 'bear_atr_max_pct': 0.13863006646574252, 'bear_tp_mult': 1.9625122447124788, 'bear_tsl_mult': 0.846819945856125, 'bear_time_stop': 300, 'bear_use_sma': True, 'bear_use_ema': True, 'bear_use_atr': False, 'bear_use_adx': True, 'bear_use_spike': False, 'bear_rsi_required': False, 'sideways_strategy': 'mean_reversion', 'sideways_bb_std_mult': 0.7896199368738877, 'sideways_rsi_os': 16, 'sideways_rsi_ob': 87, 'sideways_adx_thresh': 23.542928713950328, 'sideways_atr_min_pct': 0.02211986855956316, 'sideways_atr_max_pct': 0.011551141496064982, 'sideways_tp_mult': 1.8504798006628231, 'sideways_tsl_mult': 0.6310558324299065, 'sideways_time_stop': 126, 'sideways_use_sma': False, 'sideways_use_ema': False, 'sideways_use_atr': True, 'sideways_use_adx': False, 'sideways_use_spike': True, 'sideways_rsi_required': True}.
[I 2025-09-01 13:07:32,622] Trial 34 finished with values: [-1000000000.0, 1000000000.0] and parameters: {'p_sma': 30, 'p_std': 45, 'p_atr': 18, 'p_adx': 27, 'rsi_period': 25, 'ema1': 13, 'ema2': 57, 'slip_atr_k': 0.2293579399098115, 'slip_spread_k': 0.7968269819726173, 'spread_hl_frac': 0.04936801114459909, 'bb_std_mult': 1.0430154328048926, 'rsi_os': 36, 'rsi_ob': 67, 'vol_spike': 0.20066769343196716, 'adx_thresh': 18.826721346714425, 'atr_min_pct': 0.02500380821903906, 'atr_max_pct': 0.12422011837448674, 'tp_mult': 2.748150901103199, 'tsl_mult': 0.026512655013235298, 'strategy': 'mean_reversion', 'time_stop': 129, 'use_sma': True, 'use_atr': True, 'use_adx': False, 'use_ema': False, 'use_spike': True, 'rsi_required': False, 'edge_k': 1.9469654409257928, 'edge_cap': 0.9888845076328514, 'bull_strategy': 'breakout', 'bull_bb_std_mult': 2.679179869270737, 'bull_rsi_os': 14, 'bull_rsi_ob': 65, 'bull_adx_thresh': 14.670556684686899, 'bull_atr_min_pct': 0.0032679111206733186, 'bull_atr_max_pct': 0.09127619461649618, 'bull_tp_mult': 2.8009724807766325, 'bull_tsl_mult': 0.0910047269634705, 'bull_time_stop': 294, 'bull_use_sma': False, 'bull_use_ema': False, 'bull_use_atr': True, 'bull_use_adx': True, 'bull_use_spike': True, 'bull_rsi_required': True, 'bear_strategy': 'breakout', 'bear_bb_std_mult': 2.808961916534694, 'bear_rsi_os': 16, 'bear_rsi_ob': 55, 'bear_adx_thresh': 19.14260833027099, 'bear_atr_min_pct': 0.015013903034968381, 'bear_atr_max_pct': 0.06345256928128737, 'bear_tp_mult': 1.2391294369736494, 'bear_tsl_mult': 0.9053408751730432, 'bear_time_stop': 46, 'bear_use_sma': True, 'bear_use_ema': False, 'bear_use_atr': False, 'bear_use_adx': True, 'bear_use_spike': True, 'bear_rsi_required': True, 'sideways_strategy': 'mean_reversion', 'sideways_bb_std_mult': 2.179197564349475, 'sideways_rsi_os': 53, 'sideways_rsi_ob': 94, 'sideways_adx_thresh': 12.410595827895436, 'sideways_atr_min_pct': 0.006657348032237451, 'sideways_atr_max_pct': 0.08727789154263751, 'sideways_tp_mult': 1.2043235542097268, 'sideways_tsl_mult': 0.9978507267222324, 'sideways_time_stop': 121, 'sideways_use_sma': True, 'sideways_use_ema': False, 'sideways_use_atr': False, 'sideways_use_adx': True, 'sideways_use_spike': True, 'sideways_rsi_required': True}.
[I 2025-09-01 13:07:33,006] Trial 32 finished with values: [-1000000000.0, 1000000000.0] and parameters: {'p_sma': 18, 'p_std': 44, 'p_atr': 22, 'p_adx': 24, 'rsi_period': 38, 'ema1': 8, 'ema2': 58, 'slip_atr_k': 0.2300179598057563, 'slip_spread_k': 0.6948954452227549, 'spread_hl_frac': 0.045088809223685584, 'bb_std_mult': 1.007595520443333, 'rsi_os': 37, 'rsi_ob': 56, 'vol_spike': 0.24601982926452245, 'adx_thresh': 18.70083130931669, 'atr_min_pct': 0.008134245346134786, 'atr_max_pct': 0.1266941149485688, 'tp_mult': 2.693697023962396, 'tsl_mult': 0.7580574068538087, 'strategy': 'mean_reversion', 'time_stop': 229, 'use_sma': True, 'use_atr': True, 'use_adx': False, 'use_ema': False, 'use_spike': False, 'rsi_required': True, 'edge_k': 0.6554624614587412, 'edge_cap': 0.9972320975920576, 'bull_strategy': 'breakout', 'bull_bb_std_mult': 3.0754238210547657, 'bull_rsi_os': 41, 'bull_rsi_ob': 65, 'bull_adx_thresh': 11.207307695000466, 'bull_atr_min_pct': 0.003793761682650783, 'bull_atr_max_pct': 0.08919155370011403, 'bull_tp_mult': 2.9872565133936377, 'bull_tsl_mult': 0.004383685354522229, 'bull_time_stop': 222, 'bull_use_sma': True, 'bull_use_ema': False, 'bull_use_atr': True, 'bull_use_adx': True, 'bull_use_spike': False, 'bull_rsi_required': True, 'bear_strategy': 'breakout', 'bear_bb_std_mult': 2.650857311731609, 'bear_rsi_os': 6, 'bear_rsi_ob': 54, 'bear_adx_thresh': 19.550260859094994, 'bear_atr_min_pct': 0.008832126740696944, 'bear_atr_max_pct': 0.06132455296352861, 'bear_tp_mult': 1.2622392535760363, 'bear_tsl_mult': 0.8077061288639288, 'bear_time_stop': 45, 'bear_use_sma': True, 'bear_use_ema': True, 'bear_use_atr': False, 'bear_use_adx': True, 'bear_use_spike': False, 'bear_rsi_required': False, 'sideways_strategy': 'mean_reversion', 'sideways_bb_std_mult': 2.174624114483324, 'sideways_rsi_os': 46, 'sideways_rsi_ob': 89, 'sideways_adx_thresh': 13.537102702092962, 'sideways_atr_min_pct': 0.006270878331408294, 'sideways_atr_max_pct': 0.12146127192294298, 'sideways_tp_mult': 1.246367011430602, 'sideways_tsl_mult': 0.12201877077589351, 'sideways_time_stop': 130, 'sideways_use_sma': False, 'sideways_use_ema': False, 'sideways_use_atr': True, 'sideways_use_adx': True, 'sideways_use_spike': True, 'sideways_rsi_required': True}.
[I 2025-09-01 13:07:33,471] Trial 33 finished with values: [-1000000000.0, 1000000000.0] and parameters: {'p_sma': 30, 'p_std': 44, 'p_atr': 21, 'p_adx': 27, 'rsi_period': 24, 'ema1': 13, 'ema2': 57, 'slip_atr_k': 0.22941169222881283, 'slip_spread_k': 0.8461741091304056, 'spread_hl_frac': 0.04925887396963767, 'bb_std_mult': 1.1331014175694853, 'rsi_os': 37, 'rsi_ob': 67, 'vol_spike': 0.23560755065956324, 'adx_thresh': 18.708250282712463, 'atr_min_pct': 0.0007744280911447399, 'atr_max_pct': 0.12864152865953524, 'tp_mult': 2.785724320627216, 'tsl_mult': 0.624134679493091, 'strategy': 'mean_reversion', 'time_stop': 128, 'use_sma': True, 'use_atr': True, 'use_adx': False, 'use_ema': False, 'use_spike': True, 'rsi_required': False, 'edge_k': 0.6335058761153962, 'edge_cap': 0.9197405835349848, 'bull_strategy': 'breakout', 'bull_bb_std_mult': 2.575473188613546, 'bull_rsi_os': 42, 'bull_rsi_ob': 65, 'bull_adx_thresh': 14.583553506253804, 'bull_atr_min_pct': 0.003430860221273955, 'bull_atr_max_pct': 0.09212971920237809, 'bull_tp_mult': 2.8193721357342376, 'bull_tsl_mult': 0.08370768892990156, 'bull_time_stop': 82, 'bull_use_sma': False, 'bull_use_ema': False, 'bull_use_atr': True, 'bull_use_adx': True, 'bull_use_spike': True, 'bull_rsi_required': True, 'bear_strategy': 'breakout', 'bear_bb_std_mult': 2.774489702231002, 'bear_rsi_os': 19, 'bear_rsi_ob': 55, 'bear_adx_thresh': 19.038023184535486, 'bear_atr_min_pct': 0.01555954344771823, 'bear_atr_max_pct': 0.06304934266177699, 'bear_tp_mult': 2.019855058537934, 'bear_tsl_mult': 0.9116894159211791, 'bear_time_stop': 298, 'bear_use_sma': True, 'bear_use_ema': False, 'bear_use_atr': False, 'bear_use_adx': True, 'bear_use_spike': True, 'bear_rsi_required': True, 'sideways_strategy': 'mean_reversion', 'sideways_bb_std_mult': 2.259314240409439, 'sideways_rsi_os': 52, 'sideways_rsi_ob': 95, 'sideways_adx_thresh': 14.388123032963296, 'sideways_atr_min_pct': 0.006921136931739428, 'sideways_atr_max_pct': 0.08696697315184498, 'sideways_tp_mult': 1.1675421816699783, 'sideways_tsl_mult': 0.9936664920342668, 'sideways_time_stop': 130, 'sideways_use_sma': True, 'sideways_use_ema': False, 'sideways_use_atr': False, 'sideways_use_adx': True, 'sideways_use_spike': True, 'sideways_rsi_required': True}.
[I 2025-09-01 13:07:33,954] Trial 35 finished with values: [-1000000000.0, 1000000000.0] and parameters: {'p_sma': 30, 'p_std': 43, 'p_atr': 18, 'p_adx': 30, 'rsi_period': 41, 'ema1': 13, 'ema2': 54, 'slip_atr_k': 0.2306933677385946, 'slip_spread_k': 0.7929299061827124, 'spread_hl_frac': 0.04949984267627835, 'bb_std_mult': 1.2511778743775064, 'rsi_os': 37, 'rsi_ob': 81, 'vol_spike': 0.2097788382446788, 'adx_thresh': 27.894100246867495, 'atr_min_pct': 0.02574451194540059, 'atr_max_pct': 0.12531158289275082, 'tp_mult': 2.793622045691134, 'tsl_mult': 0.6357037232838366, 'strategy': 'breakout', 'time_stop': 123, 'use_sma': True, 'use_atr': True, 'use_adx': False, 'use_ema': False, 'use_spike': True, 'rsi_required': False, 'edge_k': 1.9658936786211365, 'edge_cap': 0.9999615644777387, 'bull_strategy': 'breakout', 'bull_bb_std_mult': 2.4734197170909034, 'bull_rsi_os': 13, 'bull_rsi_ob': 66, 'bull_adx_thresh': 8.306162979914351, 'bull_atr_min_pct': 0.0026594549189684277, 'bull_atr_max_pct': 0.07333720645601419, 'bull_tp_mult': 2.7764272595648207, 'bull_tsl_mult': 0.12366685166578538, 'bull_time_stop': 299, 'bull_use_sma': False, 'bull_use_ema': True, 'bull_use_atr': True, 'bull_use_adx': True, 'bull_use_spike': True, 'bull_rsi_required': True, 'bear_strategy': 'breakout', 'bear_bb_std_mult': 2.83168602229878, 'bear_rsi_os': 16, 'bear_rsi_ob': 89, 'bear_adx_thresh': 18.438134481252145, 'bear_atr_min_pct': 0.015869566397883585, 'bear_atr_max_pct': 0.058499656458750576, 'bear_tp_mult': 1.2166879954206218, 'bear_tsl_mult': 0.6371194806189955, 'bear_time_stop': 72, 'bear_use_sma': True, 'bear_use_ema': False, 'bear_use_atr': True, 'bear_use_adx': False, 'bear_use_spike': True, 'bear_rsi_required': True, 'sideways_strategy': 'mean_reversion', 'sideways_bb_std_mult': 2.2238045747352237, 'sideways_rsi_os': 51, 'sideways_rsi_ob': 95, 'sideways_adx_thresh': 13.831617101403278, 'sideways_atr_min_pct': 0.00676201489205309, 'sideways_atr_max_pct': 0.08676690939217217, 'sideways_tp_mult': 1.4109241190663453, 'sideways_tsl_mult': 0.012357991521297407, 'sideways_time_stop': 179, 'sideways_use_sma': True, 'sideways_use_ema': True, 'sideways_use_atr': False, 'sideways_use_adx': True, 'sideways_use_spike': True, 'sideways_rsi_required': False}.
