[I 2025-09-01 15:05:28,035] Trial 816 finished with values: [-1000000000.0, 1000000000.0] and parameters: {'p_sma': 52, 'p_std': 39, 'p_atr': 26, 'p_adx': 13, 'rsi_period': 39, 'ema1': 19, 'ema2': 18, 'slip_atr_k': 0.04396038263084813, 'slip_spread_k': 0.1044596256820917, 'spread_hl_frac': 0.00010307218822406747, 'bb_std_mult': 1.8390779760046625, 'rsi_os': 26, 'rsi_ob': 80, 'vol_spike': 0.24202588188395796, 'adx_thresh': 24.37846870450972, 'atr_min_pct': 0.02667933194738211, 'atr_max_pct': 0.03151669534446597, 'tp_mult': 1.1924524301137756, 'tsl_mult': 0.7195749502861831, 'strategy': 'mean_reversion', 'time_stop': 229, 'use_sma': True, 'use_atr': False, 'use_adx': False, 'use_ema': True, 'use_spike': True, 'rsi_required': False, 'edge_k': 1.774865387303084, 'edge_cap': 0.31239214971396795, 'bull_strategy': 'breakout', 'bull_bb_std_mult': 3.1935144871059644, 'bull_rsi_os': 32, 'bull_rsi_ob': 52, 'bull_adx_thresh': 25.118379290325535, 'bull_atr_min_pct': 0.013628835780234204, 'bull_atr_max_pct': 0.048586746468930644, 'bull_tp_mult': 2.2999532182950375, 'bull_tsl_mult': 0.4593726548099183, 'bull_time_stop': 90, 'bull_use_sma': True, 'bull_use_ema': True, 'bull_use_atr': False, 'bull_use_adx': True, 'bull_use_spike': False, 'bull_rsi_required': True, 'bear_strategy': 'breakout', 'bear_bb_std_mult': 3.5999278383274307, 'bear_rsi_os': 23, 'bear_rsi_ob': 66, 'bear_adx_thresh': 11.273322137355715, 'bear_atr_min_pct': 0.002695198107173367, 'bear_atr_max_pct': 0.10448312368880631, 'bear_tp_mult': 1.9316365144614593, 'bear_tsl_mult': 0.5880780920926609, 'bear_time_stop': 124, 'bear_use_sma': True, 'bear_use_ema': True, 'bear_use_atr': True, 'bear_use_adx': True, 'bear_use_spike': False, 'bear_rsi_required': True, 'sideways_strategy': 'mean_reversion', 'sideways_bb_std_mult': 3.1320647065816303, 'sideways_rsi_os': 52, 'sideways_rsi_ob': 67, 'sideways_adx_thresh': 9.085597479955819, 'sideways_atr_min_pct': 0.002987285184786439, 'sideways_atr_max_pct': 0.09813869780050508, 'sideways_tp_mult': 2.736196323114025, 'sideways_tsl_mult': 0.47749168879401266, 'sideways_time_stop': 173, 'sideways_use_sma': True, 'sideways_use_ema': False, 'sideways_use_atr': True, 'sideways_use_adx': False, 'sideways_use_spike': False, 'sideways_rsi_required': True}.
[I 2025-09-01 15:05:29,244] Trial 821 finished with values: [-1000000000.0, 1000000000.0] and parameters: {'p_sma': 38, 'p_std': 51, 'p_atr': 22, 'p_adx': 9, 'rsi_period': 38, 'ema1': 22, 'ema2': 18, 'slip_atr_k': 0.015663851316788695, 'slip_spread_k': 0.020607970643550695, 'spread_hl_frac': 0.02947354000980105, 'bb_std_mult': 1.7510215743665392, 'rsi_os': 38, 'rsi_ob': 85, 'vol_spike': 0.22057672571855408, 'adx_thresh': 16.35301063624533, 'atr_min_pct': 0.025907508091902374, 'atr_max_pct': 0.01578015460000949, 'tp_mult': 1.0539695011925296, 'tsl_mult': 0.0754331334190061, 'strategy': 'mean_reversion', 'time_stop': 234, 'use_sma': True, 'use_atr': False, 'use_adx': False, 'use_ema': True, 'use_spike': True, 'rsi_required': False, 'edge_k': 0.9133865992018748, 'edge_cap': 0.7343495365019812, 'bull_strategy': 'breakout', 'bull_bb_std_mult': 2.8967073365462097, 'bull_rsi_os': 35, 'bull_rsi_ob': 73, 'bull_adx_thresh': 12.370232245254087, 'bull_atr_min_pct': 0.02336919939768526, 'bull_atr_max_pct': 0.12409669373608748, 'bull_tp_mult': 2.9065799731963904, 'bull_tsl_mult': 0.3910309560584564, 'bull_time_stop': 43, 'bull_use_sma': True, 'bull_use_ema': True, 'bull_use_atr': True, 'bull_use_adx': True, 'bull_use_spike': False, 'bull_rsi_required': True, 'bear_strategy': 'mean_reversion', 'bear_bb_std_mult': 3.115972655062249, 'bear_rsi_os': 36, 'bear_rsi_ob': 75, 'bear_adx_thresh': 11.12375123729506, 'bear_atr_min_pct': 0.01848866544383044, 'bear_atr_max_pct': 0.05450588337955145, 'bear_tp_mult': 2.9554867906137883, 'bear_tsl_mult': 0.1448318536341735, 'bear_time_stop': 78, 'bear_use_sma': True, 'bear_use_ema': True, 'bear_use_atr': True, 'bear_use_adx': True, 'bear_use_spike': False, 'bear_rsi_required': True, 'sideways_strategy': 'breakout', 'sideways_bb_std_mult': 2.6199015557631817, 'sideways_rsi_os': 34, 'sideways_rsi_ob': 65, 'sideways_adx_thresh': 7.638439559272949, 'sideways_atr_min_pct': 0.027477568596834118, 'sideways_atr_max_pct': 0.0729870677484984, 'sideways_tp_mult': 1.1895605968044685, 'sideways_tsl_mult': 0.664321343989562, 'sideways_time_stop': 207, 'sideways_use_sma': True, 'sideways_use_ema': False, 'sideways_use_atr': True, 'sideways_use_adx': True, 'sideways_use_spike': True, 'sideways_rsi_required': True}.
[I 2025-09-01 15:06:08,273] Trial 822 finished with values: [-1000000000.0, 1000000000.0] and parameters: {'p_sma': 38, 'p_std': 51, 'p_atr': 24, 'p_adx': 18, 'rsi_period': 67, 'ema1': 22, 'ema2': 19, 'slip_atr_k': 0.015077094584959271, 'slip_spread_k': 0.02369954234820342, 'spread_hl_frac': 0.007972576929079774, 'bb_std_mult': 2.754913797238194, 'rsi_os': 38, 'rsi_ob': 84, 'vol_spike': 0.18150377555343467, 'adx_thresh': 21.25200895592512, 'atr_min_pct': 0.025810068743908066, 'atr_max_pct': 0.13719531505792096, 'tp_mult': 2.6314777364604516, 'tsl_mult': 0.30974004348677664, 'strategy': 'mean_reversion', 'time_stop': 233, 'use_sma': True, 'use_atr': False, 'use_adx': False, 'use_ema': True, 'use_spike': True, 'rsi_required': False, 'edge_k': 0.8976477425450459, 'edge_cap': 0.7270891422918757, 'bull_strategy': 'breakout', 'bull_bb_std_mult': 2.4498387149220315, 'bull_rsi_os': 34, 'bull_rsi_ob': 56, 'bull_adx_thresh': 18.437953660586572, 'bull_atr_min_pct': 0.02767588301419201, 'bull_atr_max_pct': 0.08491197756465513, 'bull_tp_mult': 2.2959744002511147, 'bull_tsl_mult': 0.38779529115273276, 'bull_time_stop': 84, 'bull_use_sma': True, 'bull_use_ema': True, 'bull_use_atr': True, 'bull_use_adx': True, 'bull_use_spike': False, 'bull_rsi_required': True, 'bear_strategy': 'mean_reversion', 'bear_bb_std_mult': 1.954096674727534, 'bear_rsi_os': 31, 'bear_rsi_ob': 87, 'bear_adx_thresh': 12.409505025830544, 'bear_atr_min_pct': 0.003857482545742507, 'bear_atr_max_pct': 0.05454900227930655, 'bear_tp_mult': 2.2086246037557022, 'bear_tsl_mult': 0.382412180077413, 'bear_time_stop': 206, 'bear_use_sma': True, 'bear_use_ema': True, 'bear_use_atr': True, 'bear_use_adx': True, 'bear_use_spike': True, 'bear_rsi_required': True, 'sideways_strategy': 'breakout', 'sideways_bb_std_mult': 2.2993208560593197, 'sideways_rsi_os': 34, 'sideways_rsi_ob': 88, 'sideways_adx_thresh': 7.260782475156017, 'sideways_atr_min_pct': 0.027663125391789077, 'sideways_atr_max_pct': 0.06569148118156197, 'sideways_tp_mult': 2.8625559003826884, 'sideways_tsl_mult': 0.6425073607421874, 'sideways_time_stop': 183, 'sideways_use_sma': True, 'sideways_use_ema': False, 'sideways_use_atr': False, 'sideways_use_adx': True, 'sideways_use_spike': True, 'sideways_rsi_required': True}.
[I 2025-09-01 15:06:09,320] Trial 820 finished with values: [-0.05812344218372423, 0.05820178360191992] and parameters: {'p_sma': 49, 'p_std': 51, 'p_atr': 18, 'p_adx': 16, 'rsi_period': 28, 'ema1': 19, 'ema2': 20, 'slip_atr_k': 0.04225660722000066, 'slip_spread_k': 0.9994547707544721, 'spread_hl_frac': 0.015528995591743295, 'bb_std_mult': 1.8624260806593302, 'rsi_os': 55, 'rsi_ob': 91, 'vol_spike': 0.2585119266699635, 'adx_thresh': 15.676008809258494, 'atr_min_pct': 0.01705054368852223, 'atr_max_pct': 0.05574322854412553, 'tp_mult': 2.6377961182970138, 'tsl_mult': 0.5714303248481574, 'strategy': 'breakout', 'time_stop': 108, 'use_sma': True, 'use_atr': True, 'use_adx': False, 'use_ema': True, 'use_spike': False, 'rsi_required': False, 'edge_k': 0.8803497063859163, 'edge_cap': 0.721429733931642, 'bull_strategy': 'breakout', 'bull_bb_std_mult': 2.4559645175589058, 'bull_rsi_os': 29, 'bull_rsi_ob': 74, 'bull_adx_thresh': 7.063507078980445, 'bull_atr_min_pct': 0.0041206244514385044, 'bull_atr_max_pct': 0.031026209583344063, 'bull_tp_mult': 2.8959244103880386, 'bull_tsl_mult': 0.39312441972391865, 'bull_time_stop': 83, 'bull_use_sma': True, 'bull_use_ema': True, 'bull_use_atr': True, 'bull_use_adx': True, 'bull_use_spike': False, 'bull_rsi_required': True, 'bear_strategy': 'breakout', 'bear_bb_std_mult': 2.339977061402476, 'bear_rsi_os': 33, 'bear_rsi_ob': 87, 'bear_adx_thresh': 10.883601207090031, 'bear_atr_min_pct': 0.0018739362240438196, 'bear_atr_max_pct': 0.05502396144145977, 'bear_tp_mult': 2.2073220022011912, 'bear_tsl_mult': 0.7106324580441354, 'bear_time_stop': 204, 'bear_use_sma': False, 'bear_use_ema': True, 'bear_use_atr': True, 'bear_use_adx': True, 'bear_use_spike': False, 'bear_rsi_required': False, 'sideways_strategy': 'mean_reversion', 'sideways_bb_std_mult': 2.637651145022701, 'sideways_rsi_os': 43, 'sideways_rsi_ob': 67, 'sideways_adx_thresh': 12.533927407122988, 'sideways_atr_min_pct': 0.020842169533676708, 'sideways_atr_max_pct': 0.03786970796285844, 'sideways_tp_mult': 2.87074326473406, 'sideways_tsl_mult': 0.2522365099411391, 'sideways_time_stop': 163, 'sideways_use_sma': False, 'sideways_use_ema': False, 'sideways_use_atr': True, 'sideways_use_adx': True, 'sideways_use_spike': True, 'sideways_rsi_required': True}.
[I 2025-09-01 15:06:10,492] Trial 823 finished with values: [-1000000000.0, 1000000000.0] and parameters: {'p_sma': 36, 'p_std': 47, 'p_atr': 22, 'p_adx': 11, 'rsi_period': 41, 'ema1': 22, 'ema2': 19, 'slip_atr_k': 0.016804542967972236, 'slip_spread_k': 0.024177985953198027, 'spread_hl_frac': 0.009132197030041821, 'bb_std_mult': 1.8730070860245267, 'rsi_os': 38, 'rsi_ob': 85, 'vol_spike': 0.25890841773566514, 'adx_thresh': 13.033878199881544, 'atr_min_pct': 0.02217832187825751, 'atr_max_pct': 0.022219304939006326, 'tp_mult': 1.1471640158910597, 'tsl_mult': 0.34854164387818587, 'strategy': 'breakout', 'time_stop': 237, 'use_sma': True, 'use_atr': True, 'use_adx': False, 'use_ema': True, 'use_spike': False, 'rsi_required': False, 'edge_k': 0.9124422086683455, 'edge_cap': 0.9605091801976439, 'bull_strategy': 'breakout', 'bull_bb_std_mult': 3.2652001903726013, 'bull_rsi_os': 35, 'bull_rsi_ob': 82, 'bull_adx_thresh': 18.196414931289603, 'bull_atr_min_pct': 0.004541684423534838, 'bull_atr_max_pct': 0.02648890469018446, 'bull_tp_mult': 2.0937556327176035, 'bull_tsl_mult': 0.3914200218734834, 'bull_time_stop': 168, 'bull_use_sma': True, 'bull_use_ema': True, 'bull_use_atr': True, 'bull_use_adx': True, 'bull_use_spike': False, 'bull_rsi_required': True, 'bear_strategy': 'mean_reversion', 'bear_bb_std_mult': 0.5011676433518153, 'bear_rsi_os': 48, 'bear_rsi_ob': 87, 'bear_adx_thresh': 12.393778695866873, 'bear_atr_min_pct': 0.022753375571170378, 'bear_atr_max_pct': 0.062169976720219705, 'bear_tp_mult': 2.3241446166905333, 'bear_tsl_mult': 0.13442813195956171, 'bear_time_stop': 250, 'bear_use_sma': False, 'bear_use_ema': True, 'bear_use_atr': True, 'bear_use_adx': True, 'bear_use_spike': True, 'bear_rsi_required': False, 'sideways_strategy': 'breakout', 'sideways_bb_std_mult': 1.5707323443039147, 'sideways_rsi_os': 49, 'sideways_rsi_ob': 65, 'sideways_adx_thresh': 34.3223917794006, 'sideways_atr_min_pct': 0.013654036650161716, 'sideways_atr_max_pct': 0.037900390903547285, 'sideways_tp_mult': 2.8494456714167704, 'sideways_tsl_mult': 0.2442062703521533, 'sideways_time_stop': 183, 'sideways_use_sma': False, 'sideways_use_ema': True, 'sideways_use_atr': False, 'sideways_use_adx': True, 'sideways_use_spike': True, 'sideways_rsi_required': True}.
[I 2025-09-01 15:06:11,892] Trial 824 finished with values: [-1000000000.0, 1000000000.0] and parameters: {'p_sma': 32, 'p_std': 24, 'p_atr': 8, 'p_adx': 18, 'rsi_period': 67, 'ema1': 21, 'ema2': 15, 'slip_atr_k': 0.01457690792675249, 'slip_spread_k': 0.9542862865567459, 'spread_hl_frac': 0.008194327905992792, 'bb_std_mult': 1.8720430111613042, 'rsi_os': 37, 'rsi_ob': 84, 'vol_spike': 0.25939915792358825, 'adx_thresh': 26.952946353581233, 'atr_min_pct': 0.017290095984020926, 'atr_max_pct': 0.05633643525384087, 'tp_mult': 1.0103119360704707, 'tsl_mult': 0.6822428335974738, 'strategy': 'breakout', 'time_stop': 247, 'use_sma': False, 'use_atr': True, 'use_adx': False, 'use_ema': True, 'use_spike': False, 'rsi_required': False, 'edge_k': 0.7235123131860872, 'edge_cap': 0.28176375150521443, 'bull_strategy': 'breakout', 'bull_bb_std_mult': 3.1245814212239464, 'bull_rsi_os': 34, 'bull_rsi_ob': 54, 'bull_adx_thresh': 18.17847235312309, 'bull_atr_min_pct': 0.010747716504682297, 'bull_atr_max_pct': 0.03772595645898671, 'bull_tp_mult': 1.6916486737196077, 'bull_tsl_mult': 0.4195406668491262, 'bull_time_stop': 10, 'bull_use_sma': True, 'bull_use_ema': True, 'bull_use_atr': True, 'bull_use_adx': False, 'bull_use_spike': False, 'bull_rsi_required': True, 'bear_strategy': 'breakout', 'bear_bb_std_mult': 3.5954346431857633, 'bear_rsi_os': 26, 'bear_rsi_ob': 89, 'bear_adx_thresh': 12.483048629045186, 'bear_atr_min_pct': 0.0041464796390200745, 'bear_atr_max_pct': 0.03012442382441067, 'bear_tp_mult': 2.324061093771348, 'bear_tsl_mult': 0.0016498699439898568, 'bear_time_stop': 218, 'bear_use_sma': False, 'bear_use_ema': True, 'bear_use_atr': True, 'bear_use_adx': True, 'bear_use_spike': True, 'bear_rsi_required': False, 'sideways_strategy': 'breakout', 'sideways_bb_std_mult': 1.5656625035960239, 'sideways_rsi_os': 20, 'sideways_rsi_ob': 88, 'sideways_adx_thresh': 7.010047367253978, 'sideways_atr_min_pct': 0.014480893428111135, 'sideways_atr_max_pct': 0.10599556505545567, 'sideways_tp_mult': 2.6936086077821084, 'sideways_tsl_mult': 0.7429558833303721, 'sideways_time_stop': 185, 'sideways_use_sma': False, 'sideways_use_ema': True, 'sideways_use_atr': False, 'sideways_use_adx': True, 'sideways_use_spike': True, 'sideways_rsi_required': True}.
[I 2025-09-01 15:07:00,382] Trial 828 finished with values: [-1000000000.0, 1000000000.0] and parameters: {'p_sma': 60, 'p_std': 26, 'p_atr': 15, 'p_adx': 12, 'rsi_period': 68, 'ema1': 21, 'ema2': 41, 'slip_atr_k': 0.0048960139813888325, 'slip_spread_k': 0.048880803325965366, 'spread_hl_frac': 0.006554054831892936, 'bb_std_mult': 2.053507468760019, 'rsi_os': 7, 'rsi_ob': 87, 'vol_spike': 0.14568273703584922, 'adx_thresh': 17.713324382378083, 'atr_min_pct': 0.0269682854976343, 'atr_max_pct': 0.04870295278560864, 'tp_mult': 1.0959142673268636, 'tsl_mult': 0.7413904425786634, 'strategy': 'mean_reversion', 'time_stop': 167, 'use_sma': False, 'use_atr': False, 'use_adx': True, 'use_ema': False, 'use_spike': True, 'rsi_required': True, 'edge_k': 0.12284238092584931, 'edge_cap': 0.3351789055560408, 'bull_strategy': 'breakout', 'bull_bb_std_mult': 2.0117419174853057, 'bull_rsi_os': 37, 'bull_rsi_ob': 57, 'bull_adx_thresh': 30.60684529598724, 'bull_atr_min_pct': 0.003505943558887928, 'bull_atr_max_pct': 0.018236222339370403, 'bull_tp_mult': 2.0067307167754587, 'bull_tsl_mult': 0.19513847963431907, 'bull_time_stop': 103, 'bull_use_sma': False, 'bull_use_ema': False, 'bull_use_atr': False, 'bull_use_adx': False, 'bull_use_spike': True, 'bull_rsi_required': True, 'bear_strategy': 'breakout', 'bear_bb_std_mult': 3.5989055687884917, 'bear_rsi_os': 34, 'bear_rsi_ob': 45, 'bear_adx_thresh': 11.670882375232663, 'bear_atr_min_pct': 0.004817874686777602, 'bear_atr_max_pct': 0.08282072474263007, 'bear_tp_mult': 2.251427726571609, 'bear_tsl_mult': 0.09388308650295477, 'bear_time_stop': 20, 'bear_use_sma': True, 'bear_use_ema': True, 'bear_use_atr': False, 'bear_use_adx': False, 'bear_use_spike': False, 'bear_rsi_required': True, 'sideways_strategy': 'breakout', 'sideways_bb_std_mult': 3.521770301960347, 'sideways_rsi_os': 39, 'sideways_rsi_ob': 49, 'sideways_adx_thresh': 10.370394057851449, 'sideways_atr_min_pct': 0.007981284685734651, 'sideways_atr_max_pct': 0.0680326496207987, 'sideways_tp_mult': 2.914102490642677, 'sideways_tsl_mult': 0.516962456440439, 'sideways_time_stop': 281, 'sideways_use_sma': True, 'sideways_use_ema': False, 'sideways_use_atr': True, 'sideways_use_adx': True, 'sideways_use_spike': False, 'sideways_rsi_required': False}.
[I 2025-09-01 15:07:01,521] Trial 826 finished with values: [-1000000000.0, 1000000000.0] and parameters: {'p_sma': 11, 'p_std': 47, 'p_atr': 25, 'p_adx': 23, 'rsi_period': 65, 'ema1': 24, 'ema2': 53, 'slip_atr_k': 0.12619164429347154, 'slip_spread_k': 0.05320909856687664, 'spread_hl_frac': 0.03464892054516751, 'bb_std_mult': 2.505028109056805, 'rsi_os': 39, 'rsi_ob': 73, 'vol_spike': 0.08609413336273801, 'adx_thresh': 26.817195345756037, 'atr_min_pct': 0.019056826390848, 'atr_max_pct': 0.06488564067777321, 'tp_mult': 2.2791106347973997, 'tsl_mult': 0.3549473103477879, 'strategy': 'mean_reversion', 'time_stop': 241, 'use_sma': False, 'use_atr': True, 'use_adx': False, 'use_ema': False, 'use_spike': False, 'rsi_required': True, 'edge_k': 0.7074662859193384, 'edge_cap': 0.2877389755319144, 'bull_strategy': 'breakout', 'bull_bb_std_mult': 3.1408363293151536, 'bull_rsi_os': 34, 'bull_rsi_ob': 54, 'bull_adx_thresh': 30.090043531416306, 'bull_atr_min_pct': 0.01902372024730998, 'bull_atr_max_pct': 0.061842163813709466, 'bull_tp_mult': 1.3298005760440017, 'bull_tsl_mult': 0.4226785296193641, 'bull_time_stop': 97, 'bull_use_sma': False, 'bull_use_ema': False, 'bull_use_atr': True, 'bull_use_adx': False, 'bull_use_spike': True, 'bull_rsi_required': True, 'bear_strategy': 'breakout', 'bear_bb_std_mult': 0.9752770812192821, 'bear_rsi_os': 48, 'bear_rsi_ob': 89, 'bear_adx_thresh': 13.036215707867045, 'bear_atr_min_pct': 0.02060959841773829, 'bear_atr_max_pct': 0.03100778538503063, 'bear_tp_mult': 2.325870937126226, 'bear_tsl_mult': 0.12821491681373398, 'bear_time_stop': 215, 'bear_use_sma': False, 'bear_use_ema': True, 'bear_use_atr': True, 'bear_use_adx': True, 'bear_use_spike': True, 'bear_rsi_required': False, 'sideways_strategy': 'breakout', 'sideways_bb_std_mult': 0.8614047103665412, 'sideways_rsi_os': 19, 'sideways_rsi_ob': 69, 'sideways_adx_thresh': 28.905545742786135, 'sideways_atr_min_pct': 0.01891541201189384, 'sideways_atr_max_pct': 0.06864591039727813, 'sideways_tp_mult': 2.772759139268286, 'sideways_tsl_mult': 0.5207054426622607, 'sideways_time_stop': 149, 'sideways_use_sma': False, 'sideways_use_ema': True, 'sideways_use_atr': False, 'sideways_use_adx': True, 'sideways_use_spike': False, 'sideways_rsi_required': False}.
[I 2025-09-01 15:07:02,286] Trial 825 finished with values: [-0.017469256313506598, 0.01896990908952077] and parameters: {'p_sma': 59, 'p_std': 24, 'p_atr': 28, 'p_adx': 10, 'rsi_period': 65, 'ema1': 21, 'ema2': 43, 'slip_atr_k': 0.007504104636275929, 'slip_spread_k': 0.04903138837424764, 'spread_hl_frac': 0.008816608143845519, 'bb_std_mult': 1.8758494695963286, 'rsi_os': 45, 'rsi_ob': 83, 'vol_spike': 0.25114158900308, 'adx_thresh': 22.814939273767415, 'atr_min_pct': 0.022058988310541996, 'atr_max_pct': 0.0570310439147916, 'tp_mult': 1.1285448636832134, 'tsl_mult': 0.27263435072488607, 'strategy': 'breakout', 'time_stop': 246, 'use_sma': False, 'use_atr': True, 'use_adx': False, 'use_ema': True, 'use_spike': False, 'rsi_required': True, 'edge_k': 1.1709922472357714, 'edge_cap': 0.28977738727749686, 'bull_strategy': 'breakout', 'bull_bb_std_mult': 0.9406242769091151, 'bull_rsi_os': 34, 'bull_rsi_ob': 54, 'bull_adx_thresh': 30.215483520261984, 'bull_atr_min_pct': 0.004319760141768314, 'bull_atr_max_pct': 0.02560482284608433, 'bull_tp_mult': 2.8503289618136867, 'bull_tsl_mult': 0.42695961025828494, 'bull_time_stop': 62, 'bull_use_sma': True, 'bull_use_ema': False, 'bull_use_atr': True, 'bull_use_adx': False, 'bull_use_spike': False, 'bull_rsi_required': True, 'bear_strategy': 'breakout', 'bear_bb_std_mult': 3.5967679684879688, 'bear_rsi_os': 33, 'bear_rsi_ob': 89, 'bear_adx_thresh': 9.64477208148095, 'bear_atr_min_pct': 0.002121404630427008, 'bear_atr_max_pct': 0.04050843882384963, 'bear_tp_mult': 2.3229228870964875, 'bear_tsl_mult': 0.24966019278180995, 'bear_time_stop': 240, 'bear_use_sma': False, 'bear_use_ema': True, 'bear_use_atr': True, 'bear_use_adx': True, 'bear_use_spike': False, 'bear_rsi_required': False, 'sideways_strategy': 'breakout', 'sideways_bb_std_mult': 3.5209136678792774, 'sideways_rsi_os': 51, 'sideways_rsi_ob': 48, 'sideways_adx_thresh': 23.067185270247748, 'sideways_atr_min_pct': 0.014454072948600877, 'sideways_atr_max_pct': 0.020990450656626497, 'sideways_tp_mult': 2.9161849759879526, 'sideways_tsl_mult': 0.2422951247872951, 'sideways_time_stop': 120, 'sideways_use_sma': False, 'sideways_use_ema': True, 'sideways_use_atr': True, 'sideways_use_adx': True, 'sideways_use_spike': False, 'sideways_rsi_required': True}.
