[I 2025-09-01 14:44:12,843] Trial 683 finished with values: [-1000000000.0, 1000000000.0] and parameters: {'p_sma': 24, 'p_std': 38, 'p_atr': 16, 'p_adx': 12, 'rsi_period': 67, 'ema1': 18, 'ema2': 17, 'slip_atr_k': 0.022568924667361476, 'slip_spread_k': 0.05979993853907439, 'spread_hl_frac': 0.036960156698007327, 'bb_std_mult': 1.474017678722776, 'rsi_os': 40, 'rsi_ob': 49, 'vol_spike': 0.23350546681154294, 'adx_thresh': 25.487688428232854, 'atr_min_pct': 0.02871899183304656, 'atr_max_pct': 0.03455740348772789, 'tp_mult': 2.0355699170834494, 'tsl_mult': 0.1824753033726818, 'strategy': 'mean_reversion', 'time_stop': 241, 'use_sma': True, 'use_atr': False, 'use_adx': True, 'use_ema': True, 'use_spike': True, 'rsi_required': False, 'edge_k': 0.8667006753493254, 'edge_cap': 0.3414097299394635, 'bull_strategy': 'breakout', 'bull_bb_std_mult': 1.0409756487544808, 'bull_rsi_os': 30, 'bull_rsi_ob': 55, 'bull_adx_thresh': 20.398850475453013, 'bull_atr_min_pct': 0.02876390211642338, 'bull_atr_max_pct': 0.022843835811471463, 'bull_tp_mult': 1.506664637026375, 'bull_tsl_mult': 0.4414832035925952, 'bull_time_stop': 255, 'bull_use_sma': True, 'bull_use_ema': True, 'bull_use_atr': False, 'bull_use_adx': False, 'bull_use_spike': False, 'bull_rsi_required': False, 'bear_strategy': 'breakout', 'bear_bb_std_mult': 3.545302700465828, 'bear_rsi_os': 43, 'bear_rsi_ob': 88, 'bear_adx_thresh': 27.946988478767466, 'bear_atr_min_pct': 0.00444611167147154, 'bear_atr_max_pct': 0.12494880925623127, 'bear_tp_mult': 2.6520438643466484, 'bear_tsl_mult': 0.6458136984891959, 'bear_time_stop': 287, 'bear_use_sma': True, 'bear_use_ema': True, 'bear_use_atr': True, 'bear_use_adx': True, 'bear_use_spike': False, 'bear_rsi_required': True, 'sideways_strategy': 'breakout', 'sideways_bb_std_mult': 1.5300579486715498, 'sideways_rsi_os': 51, 'sideways_rsi_ob': 65, 'sideways_adx_thresh': 7.281047956726784, 'sideways_atr_min_pct': 0.019406923562277512, 'sideways_atr_max_pct': 0.0923021445015619, 'sideways_tp_mult': 1.2814661336176743, 'sideways_tsl_mult': 0.24086570830856618, 'sideways_time_stop': 179, 'sideways_use_sma': True, 'sideways_use_ema': True, 'sideways_use_atr': True, 'sideways_use_adx': False, 'sideways_use_spike': False, 'sideways_rsi_required': True}.
[I 2025-09-01 14:44:18,167] Trial 687 finished with values: [-1000000000.0, 1000000000.0] and parameters: {'p_sma': 24, 'p_std': 46, 'p_atr': 16, 'p_adx': 7, 'rsi_period': 57, 'ema1': 21, 'ema2': 19, 'slip_atr_k': 0.07819960631544165, 'slip_spread_k': 0.6553094319827742, 'spread_hl_frac': 0.0019282798617178496, 'bb_std_mult': 2.5453056420162987, 'rsi_os': 39, 'rsi_ob': 58, 'vol_spike': 0.23095784515696444, 'adx_thresh': 16.10662727896176, 'atr_min_pct': 0.02510874592311848, 'atr_max_pct': 0.018465294897664512, 'tp_mult': 1.2325339637292456, 'tsl_mult': 0.9141260049393212, 'strategy': 'mean_reversion', 'time_stop': 235, 'use_sma': False, 'use_atr': False, 'use_adx': False, 'use_ema': True, 'use_spike': False, 'rsi_required': False, 'edge_k': 0.8480305934220153, 'edge_cap': 0.805636151058533, 'bull_strategy': 'mean_reversion', 'bull_bb_std_mult': 3.2712784867869718, 'bull_rsi_os': 6, 'bull_rsi_ob': 58, 'bull_adx_thresh': 9.426748746182694, 'bull_atr_min_pct': 0.004851185825505939, 'bull_atr_max_pct': 0.10697748011753815, 'bull_tp_mult': 2.905398106153723, 'bull_tsl_mult': 0.40653421874217766, 'bull_time_stop': 97, 'bull_use_sma': False, 'bull_use_ema': False, 'bull_use_atr': True, 'bull_use_adx': False, 'bull_use_spike': False, 'bull_rsi_required': True, 'bear_strategy': 'breakout', 'bear_bb_std_mult': 3.4850347090948683, 'bear_rsi_os': 28, 'bear_rsi_ob': 89, 'bear_adx_thresh': 26.43947759410217, 'bear_atr_min_pct': 0.004432747530016653, 'bear_atr_max_pct': 0.040866889425782156, 'bear_tp_mult': 2.1632930216990385, 'bear_tsl_mult': 0.1496888255395174, 'bear_time_stop': 222, 'bear_use_sma': False, 'bear_use_ema': False, 'bear_use_atr': True, 'bear_use_adx': True, 'bear_use_spike': False, 'bear_rsi_required': False, 'sideways_strategy': 'mean_reversion', 'sideways_bb_std_mult': 1.5503314791154985, 'sideways_rsi_os': 51, 'sideways_rsi_ob': 65, 'sideways_adx_thresh': 10.620436556390857, 'sideways_atr_min_pct': 0.014176659833557332, 'sideways_atr_max_pct': 0.07329611014862374, 'sideways_tp_mult': 1.7981570437149104, 'sideways_tsl_mult': 0.27796480473332846, 'sideways_time_stop': 104, 'sideways_use_sma': False, 'sideways_use_ema': False, 'sideways_use_atr': True, 'sideways_use_adx': True, 'sideways_use_spike': False, 'sideways_rsi_required': False}.
[I 2025-09-01 14:44:19,006] Trial 688 finished with values: [-1000000000.0, 1000000000.0] and parameters: {'p_sma': 35, 'p_std': 48, 'p_atr': 27, 'p_adx': 7, 'rsi_period': 57, 'ema1': 21, 'ema2': 10, 'slip_atr_k': 0.004189257935231002, 'slip_spread_k': 0.09918650720862361, 'spread_hl_frac': 0.0062440342248804934, 'bb_std_mult': 2.684353985224164, 'rsi_os': 43, 'rsi_ob': 82, 'vol_spike': 0.24391151524918508, 'adx_thresh': 26.190646935078245, 'atr_min_pct': 0.02520758345104463, 'atr_max_pct': 0.01859410607774485, 'tp_mult': 1.9782926370692695, 'tsl_mult': 0.5758687484629854, 'strategy': 'breakout', 'time_stop': 232, 'use_sma': False, 'use_atr': False, 'use_adx': False, 'use_ema': False, 'use_spike': False, 'rsi_required': False, 'edge_k': 0.7965535562463089, 'edge_cap': 0.3385871826221027, 'bull_strategy': 'mean_reversion', 'bull_bb_std_mult': 3.3025665082284834, 'bull_rsi_os': 40, 'bull_rsi_ob': 92, 'bull_adx_thresh': 31.478240752569157, 'bull_atr_min_pct': 0.004750651121739643, 'bull_atr_max_pct': 0.11210490366712293, 'bull_tp_mult': 2.9213173355226263, 'bull_tsl_mult': 0.41367490730140344, 'bull_time_stop': 300, 'bull_use_sma': False, 'bull_use_ema': False, 'bull_use_atr': True, 'bull_use_adx': True, 'bull_use_spike': False, 'bull_rsi_required': True, 'bear_strategy': 'breakout', 'bear_bb_std_mult': 1.5209139290332188, 'bear_rsi_os': 24, 'bear_rsi_ob': 90, 'bear_adx_thresh': 11.192734365834486, 'bear_atr_min_pct': 0.003070599694158937, 'bear_atr_max_pct': 0.05347736544356328, 'bear_tp_mult': 2.295090354152013, 'bear_tsl_mult': 0.4761238219325648, 'bear_time_stop': 221, 'bear_use_sma': False, 'bear_use_ema': False, 'bear_use_atr': False, 'bear_use_adx': True, 'bear_use_spike': False, 'bear_rsi_required': False, 'sideways_strategy': 'mean_reversion', 'sideways_bb_std_mult': 2.0055684872828916, 'sideways_rsi_os': 42, 'sideways_rsi_ob': 68, 'sideways_adx_thresh': 13.89123994033541, 'sideways_atr_min_pct': 0.004250982370179606, 'sideways_atr_max_pct': 0.057279664329026266, 'sideways_tp_mult': 1.8101408836318016, 'sideways_tsl_mult': 0.05758524060713638, 'sideways_time_stop': 275, 'sideways_use_sma': False, 'sideways_use_ema': False, 'sideways_use_atr': True, 'sideways_use_adx': True, 'sideways_use_spike': False, 'sideways_rsi_required': False}.
[I 2025-09-01 14:44:26,449] Trial 685 finished with values: [-1000000000.0, 1000000000.0] and parameters: {'p_sma': 57, 'p_std': 49, 'p_atr': 27, 'p_adx': 12, 'rsi_period': 57, 'ema1': 21, 'ema2': 18, 'slip_atr_k': 0.02116984713845696, 'slip_spread_k': 0.08031484123926455, 'spread_hl_frac': 0.04080719803097546, 'bb_std_mult': 1.7284609474062929, 'rsi_os': 40, 'rsi_ob': 55, 'vol_spike': 0.23586637605244806, 'adx_thresh': 24.68027258092324, 'atr_min_pct': 0.00786570559053221, 'atr_max_pct': 0.016873490344967476, 'tp_mult': 2.463756781033386, 'tsl_mult': 0.8114455542543284, 'strategy': 'mean_reversion', 'time_stop': 233, 'use_sma': True, 'use_atr': False, 'use_adx': False, 'use_ema': True, 'use_spike': False, 'rsi_required': False, 'edge_k': 1.5697467772498257, 'edge_cap': 0.34345670687242785, 'bull_strategy': 'mean_reversion', 'bull_bb_std_mult': 2.1304089286341035, 'bull_rsi_os': 42, 'bull_rsi_ob': 84, 'bull_adx_thresh': 29.571675315693337, 'bull_atr_min_pct': 0.004639751320242214, 'bull_atr_max_pct': 0.04717056852287008, 'bull_tp_mult': 2.2295314937153536, 'bull_tsl_mult': 0.41270746896750155, 'bull_time_stop': 93, 'bull_use_sma': False, 'bull_use_ema': False, 'bull_use_atr': True, 'bull_use_adx': False, 'bull_use_spike': False, 'bull_rsi_required': False, 'bear_strategy': 'breakout', 'bear_bb_std_mult': 3.490196391443326, 'bear_rsi_os': 35, 'bear_rsi_ob': 73, 'bear_adx_thresh': 26.49839907790397, 'bear_atr_min_pct': 0.004452923712055029, 'bear_atr_max_pct': 0.02814836558108199, 'bear_tp_mult': 2.3057376889925227, 'bear_tsl_mult': 0.48704037926694616, 'bear_time_stop': 163, 'bear_use_sma': False, 'bear_use_ema': False, 'bear_use_atr': True, 'bear_use_adx': True, 'bear_use_spike': False, 'bear_rsi_required': False, 'sideways_strategy': 'mean_reversion', 'sideways_bb_std_mult': 1.513390763989014, 'sideways_rsi_os': 55, 'sideways_rsi_ob': 67, 'sideways_adx_thresh': 7.039699248588081, 'sideways_atr_min_pct': 0.01400984150465618, 'sideways_atr_max_pct': 0.07254310230570245, 'sideways_tp_mult': 2.7924129283028827, 'sideways_tsl_mult': 0.2736170726994558, 'sideways_time_stop': 173, 'sideways_use_sma': False, 'sideways_use_ema': False, 'sideways_use_atr': True, 'sideways_use_adx': False, 'sideways_use_spike': False, 'sideways_rsi_required': False}.
[I 2025-09-01 14:44:31,930] Trial 686 finished with values: [-1000000000.0, 1000000000.0] and parameters: {'p_sma': 47, 'p_std': 49, 'p_atr': 18, 'p_adx': 12, 'rsi_period': 40, 'ema1': 18, 'ema2': 48, 'slip_atr_k': 0.0231093061142241, 'slip_spread_k': 0.8654539446883631, 'spread_hl_frac': 0.018256602556684286, 'bb_std_mult': 1.4543263319846296, 'rsi_os': 43, 'rsi_ob': 60, 'vol_spike': 0.22985021911136477, 'adx_thresh': 6.624023865436463, 'atr_min_pct': 0.02511257847353144, 'atr_max_pct': 0.036680227524677214, 'tp_mult': 2.741265774717346, 'tsl_mult': 0.8008222526234354, 'strategy': 'mean_reversion', 'time_stop': 235, 'use_sma': True, 'use_atr': False, 'use_adx': False, 'use_ema': True, 'use_spike': False, 'rsi_required': False, 'edge_k': 0.8586024856101755, 'edge_cap': 0.3388530081884124, 'bull_strategy': 'mean_reversion', 'bull_bb_std_mult': 3.3011869320117664, 'bull_rsi_os': 30, 'bull_rsi_ob': 84, 'bull_adx_thresh': 29.33634085338802, 'bull_atr_min_pct': 0.004688512116093874, 'bull_atr_max_pct': 0.11701250939854112, 'bull_tp_mult': 1.7110372644436485, 'bull_tsl_mult': 0.5347934037282899, 'bull_time_stop': 300, 'bull_use_sma': False, 'bull_use_ema': False, 'bull_use_atr': True, 'bull_use_adx': False, 'bull_use_spike': False, 'bull_rsi_required': False, 'bear_strategy': 'breakout', 'bear_bb_std_mult': 2.296581601397337, 'bear_rsi_os': 33, 'bear_rsi_ob': 89, 'bear_adx_thresh': 26.48223723606523, 'bear_atr_min_pct': 0.004340705700879241, 'bear_atr_max_pct': 0.06279776490513306, 'bear_tp_mult': 2.5747743559414564, 'bear_tsl_mult': 0.1993564907537837, 'bear_time_stop': 231, 'bear_use_sma': False, 'bear_use_ema': False, 'bear_use_atr': True, 'bear_use_adx': True, 'bear_use_spike': False, 'bear_rsi_required': False, 'sideways_strategy': 'mean_reversion', 'sideways_bb_std_mult': 0.8348014224702143, 'sideways_rsi_os': 51, 'sideways_rsi_ob': 65, 'sideways_adx_thresh': 33.88054695891772, 'sideways_atr_min_pct': 0.020407617782615694, 'sideways_atr_max_pct': 0.09446024892395165, 'sideways_tp_mult': 1.8166538576515574, 'sideways_tsl_mult': 0.27558389365732117, 'sideways_time_stop': 173, 'sideways_use_sma': False, 'sideways_use_ema': False, 'sideways_use_atr': True, 'sideways_use_adx': False, 'sideways_use_spike': False, 'sideways_rsi_required': False}.
[I 2025-09-01 14:45:02,027] Trial 689 finished with values: [-0.024646819707326406, 0.02444881566222501] and parameters: {'p_sma': 47, 'p_std': 50, 'p_atr': 18, 'p_adx': 20, 'rsi_period': 63, 'ema1': 20, 'ema2': 18, 'slip_atr_k': 0.018551684108246598, 'slip_spread_k': 0.6352124062319255, 'spread_hl_frac': 0.04604181494259343, 'bb_std_mult': 1.9493874690487838, 'rsi_os': 43, 'rsi_ob': 82, 'vol_spike': 0.24294463637545066, 'adx_thresh': 19.013326330526485, 'atr_min_pct': 0.006396480261618549, 'atr_max_pct': 0.1080137788737405, 'tp_mult': 1.9581443302131893, 'tsl_mult': 0.8897737049817973, 'strategy': 'breakout', 'time_stop': 232, 'use_sma': True, 'use_atr': False, 'use_adx': False, 'use_ema': False, 'use_spike': False, 'rsi_required': False, 'edge_k': 1.218731158031368, 'edge_cap': 0.43318609275404857, 'bull_strategy': 'mean_reversion', 'bull_bb_std_mult': 2.7322936464279612, 'bull_rsi_os': 34, 'bull_rsi_ob': 80, 'bull_adx_thresh': 31.58746599186283, 'bull_atr_min_pct': 0.0010783917863724408, 'bull_atr_max_pct': 0.01878392155416657, 'bull_tp_mult': 1.2005786710030213, 'bull_tsl_mult': 0.5460865816614651, 'bull_time_stop': 72, 'bull_use_sma': False, 'bull_use_ema': False, 'bull_use_atr': True, 'bull_use_adx': True, 'bull_use_spike': False, 'bull_rsi_required': True, 'bear_strategy': 'breakout', 'bear_bb_std_mult': 2.915045109062128, 'bear_rsi_os': 24, 'bear_rsi_ob': 91, 'bear_adx_thresh': 11.272436005094205, 'bear_atr_min_pct': 0.00546281197748142, 'bear_atr_max_pct': 0.05254566363907172, 'bear_tp_mult': 2.4038410737790654, 'bear_tsl_mult': 0.4870950512762533, 'bear_time_stop': 158, 'bear_use_sma': False, 'bear_use_ema': False, 'bear_use_atr': False, 'bear_use_adx': True, 'bear_use_spike': False, 'bear_rsi_required': False, 'sideways_strategy': 'mean_reversion', 'sideways_bb_std_mult': 2.0048526403865585, 'sideways_rsi_os': 46, 'sideways_rsi_ob': 88, 'sideways_adx_thresh': 31.9681639122702, 'sideways_atr_min_pct': 0.006163187122858269, 'sideways_atr_max_pct': 0.0563517608036396, 'sideways_tp_mult': 1.6953942152452577, 'sideways_tsl_mult': 0.16236320981762986, 'sideways_time_stop': 26, 'sideways_use_sma': False, 'sideways_use_ema': False, 'sideways_use_atr': True, 'sideways_use_adx': True, 'sideways_use_spike': False, 'sideways_rsi_required': False}.
[I 2025-09-01 14:45:03,174] Trial 690 finished with values: [-1000000000.0, 1000000000.0] and parameters: {'p_sma': 29, 'p_std': 50, 'p_atr': 24, 'p_adx': 19, 'rsi_period': 69, 'ema1': 6, 'ema2': 20, 'slip_atr_k': 0.1755940619361612, 'slip_spread_k': 0.9453592924819161, 'spread_hl_frac': 0.02617362610391797, 'bb_std_mult': 1.9570521568957153, 'rsi_os': 37, 'rsi_ob': 75, 'vol_spike': 0.24093563666201845, 'adx_thresh': 34.94842848599846, 'atr_min_pct': 0.01704815476012119, 'atr_max_pct': 0.0728974251390624, 'tp_mult': 1.0381382165332589, 'tsl_mult': 0.8508605220583675, 'strategy': 'mean_reversion', 'time_stop': 249, 'use_sma': True, 'use_atr': False, 'use_adx': False, 'use_ema': True, 'use_spike': True, 'rsi_required': False, 'edge_k': 0.5554990481949331, 'edge_cap': 0.8435157208839491, 'bull_strategy': 'breakout', 'bull_bb_std_mult': 1.605776129379833, 'bull_rsi_os': 8, 'bull_rsi_ob': 73, 'bull_adx_thresh': 30.280172460210867, 'bull_atr_min_pct': 0.0040499992209797105, 'bull_atr_max_pct': 0.018064404950058382, 'bull_tp_mult': 2.69291911432595, 'bull_tsl_mult': 0.48770368866749386, 'bull_time_stop': 120, 'bull_use_sma': True, 'bull_use_ema': True, 'bull_use_atr': True, 'bull_use_adx': True, 'bull_use_spike': False, 'bull_rsi_required': True, 'bear_strategy': 'breakout', 'bear_bb_std_mult': 3.599161257394834, 'bear_rsi_os': 13, 'bear_rsi_ob': 89, 'bear_adx_thresh': 12.50486369314072, 'bear_atr_min_pct': 0.009416584948914706, 'bear_atr_max_pct': 0.04795024838459053, 'bear_tp_mult': 2.1999987254978195, 'bear_tsl_mult': 0.1947568284496245, 'bear_time_stop': 233, 'bear_use_sma': True, 'bear_use_ema': True, 'bear_use_atr': True, 'bear_use_adx': True, 'bear_use_spike': False, 'bear_rsi_required': True, 'sideways_strategy': 'breakout', 'sideways_bb_std_mult': 2.0988429263987323, 'sideways_rsi_os': 54, 'sideways_rsi_ob': 63, 'sideways_adx_thresh': 33.96430898808029, 'sideways_atr_min_pct': 0.020352176478548503, 'sideways_atr_max_pct': 0.06338020555284456, 'sideways_tp_mult': 2.6319403902250014, 'sideways_tsl_mult': 0.266939766095507, 'sideways_time_stop': 220, 'sideways_use_sma': True, 'sideways_use_ema': False, 'sideways_use_atr': True, 'sideways_use_adx': True, 'sideways_use_spike': False, 'sideways_rsi_required': True}.
[I 2025-09-01 14:45:04,868] Trial 691 finished with values: [-1000000000.0, 1000000000.0] and parameters: {'p_sma': 38, 'p_std': 20, 'p_atr': 25, 'p_adx': 11, 'rsi_period': 70, 'ema1': 6, 'ema2': 19, 'slip_atr_k': 0.015843017534889283, 'slip_spread_k': 0.933638768625857, 'spread_hl_frac': 0.03890877925304604, 'bb_std_mult': 1.8183137650436358, 'rsi_os': 37, 'rsi_ob': 82, 'vol_spike': 0.22790943948700162, 'adx_thresh': 13.975939479742703, 'atr_min_pct': 0.01915242003224575, 'atr_max_pct': 0.13839270386165856, 'tp_mult': 1.7040738839266312, 'tsl_mult': 0.9752785329901892, 'strategy': 'breakout', 'time_stop': 249, 'use_sma': True, 'use_atr': False, 'use_adx': False, 'use_ema': True, 'use_spike': True, 'rsi_required': False, 'edge_k': 0.49422738918434184, 'edge_cap': 0.2420870808562251, 'bull_strategy': 'breakout', 'bull_bb_std_mult': 3.204156487736906, 'bull_rsi_os': 34, 'bull_rsi_ob': 50, 'bull_adx_thresh': 23.128315933222076, 'bull_atr_min_pct': 0.003983991509111696, 'bull_atr_max_pct': 0.01887433965033049, 'bull_tp_mult': 2.6752388636300095, 'bull_tsl_mult': 0.7136323803503912, 'bull_time_stop': 285, 'bull_use_sma': True, 'bull_use_ema': True, 'bull_use_atr': True, 'bull_use_adx': True, 'bull_use_spike': False, 'bull_rsi_required': True, 'bear_strategy': 'breakout', 'bear_bb_std_mult': 3.596412256696726, 'bear_rsi_os': 20, 'bear_rsi_ob': 80, 'bear_adx_thresh': 12.502389065763428, 'bear_atr_min_pct': 0.0090899188694204, 'bear_atr_max_pct': 0.045408683653065066, 'bear_tp_mult': 2.4443306387172448, 'bear_tsl_mult': 0.1961703570946678, 'bear_time_stop': 235, 'bear_use_sma': True, 'bear_use_ema': True, 'bear_use_atr': True, 'bear_use_adx': True, 'bear_use_spike': False, 'bear_rsi_required': True, 'sideways_strategy': 'breakout', 'sideways_bb_std_mult': 1.6036595032513383, 'sideways_rsi_os': 50, 'sideways_rsi_ob': 70, 'sideways_adx_thresh': 18.049327244764346, 'sideways_atr_min_pct': 0.02480617523450611, 'sideways_atr_max_pct': 0.06302981625213394, 'sideways_tp_mult': 2.1559550929454625, 'sideways_tsl_mult': 0.22266216008704143, 'sideways_time_stop': 217, 'sideways_use_sma': True, 'sideways_use_ema': False, 'sideways_use_atr': True, 'sideways_use_adx': True, 'sideways_use_spike': False, 'sideways_rsi_required': True}.
[I 2025-09-01 14:45:05,526] Trial 692 finished with values: [-1000000000.0, 1000000000.0] and parameters: {'p_sma': 42, 'p_std': 47, 'p_atr': 25, 'p_adx': 22, 'rsi_period': 77, 'ema1': 20, 'ema2': 20, 'slip_atr_k': 0.015802315998464933, 'slip_spread_k': 0.03159980536504098, 'spread_hl_frac': 0.006863068975890951, 'bb_std_mult': 1.8406515695030472, 'rsi_os': 37, 'rsi_ob': 68, 'vol_spike': 0.28278777683461487, 'adx_thresh': 22.675892401506825, 'atr_min_pct': 0.02675493855663776, 'atr_max_pct': 0.1375799880930028, 'tp_mult': 1.137804148976587, 'tsl_mult': 0.9838553530578509, 'strategy': 'breakout', 'time_stop': 223, 'use_sma': True, 'use_atr': True, 'use_adx': False, 'use_ema': False, 'use_spike': True, 'rsi_required': False, 'edge_k': 1.210074975566278, 'edge_cap': 0.24515290640305004, 'bull_strategy': 'breakout', 'bull_bb_std_mult': 3.201526922626242, 'bull_rsi_os': 13, 'bull_rsi_ob': 80, 'bull_adx_thresh': 30.263653393674403, 'bull_atr_min_pct': 0.003818773555557699, 'bull_atr_max_pct': 0.06330420698544825, 'bull_tp_mult': 1.0911581453405201, 'bull_tsl_mult': 0.7228169448341053, 'bull_time_stop': 105, 'bull_use_sma': True, 'bull_use_ema': True, 'bull_use_atr': True, 'bull_use_adx': True, 'bull_use_spike': False, 'bull_rsi_required': True, 'bear_strategy': 'breakout', 'bear_bb_std_mult': 3.438962482487023, 'bear_rsi_os': 31, 'bear_rsi_ob': 53, 'bear_adx_thresh': 12.468807026537434, 'bear_atr_min_pct': 0.0020636828983625604, 'bear_atr_max_pct': 0.04797228447065114, 'bear_tp_mult': 2.3896595898509756, 'bear_tsl_mult': 0.9089965121479928, 'bear_time_stop': 134, 'bear_use_sma': True, 'bear_use_ema': True, 'bear_use_atr': False, 'bear_use_adx': True, 'bear_use_spike': False, 'bear_rsi_required': True, 'sideways_strategy': 'breakout', 'sideways_bb_std_mult': 2.106597517499592, 'sideways_rsi_os': 46, 'sideways_rsi_ob': 56, 'sideways_adx_thresh': 7.715672334368638, 'sideways_atr_min_pct': 0.024263573062603166, 'sideways_atr_max_pct': 0.08694872295851715, 'sideways_tp_mult': 2.6181062704918037, 'sideways_tsl_mult': 0.7904941141270597, 'sideways_time_stop': 186, 'sideways_use_sma': True, 'sideways_use_ema': False, 'sideways_use_atr': True, 'sideways_use_adx': True, 'sideways_use_spike': False, 'sideways_rsi_required': True}.
