[I 2025-09-01 14:36:53,022] Trial 633 finished with values: [-1000000000.0, 1000000000.0] and parameters: {'p_sma': 48, 'p_std': 40, 'p_atr': 12, 'p_adx': 16, 'rsi_period': 63, 'ema1': 22, 'ema2': 20, 'slip_atr_k': 0.008907341151850622, 'slip_spread_k': 0.002397327259033702, 'spread_hl_frac': 0.027683673955396775, 'bb_std_mult': 3.389776773196669, 'rsi_os': 39, 'rsi_ob': 85, 'vol_spike': 0.029486625302401703, 'adx_thresh': 25.644255446652924, 'atr_min_pct': 0.026668091366886065, 'atr_max_pct': 0.14042187669195047, 'tp_mult': 1.7718406292085258, 'tsl_mult': 0.44644048500803074, 'strategy': 'mean_reversion', 'time_stop': 218, 'use_sma': True, 'use_atr': False, 'use_adx': True, 'use_ema': True, 'use_spike': True, 'rsi_required': False, 'edge_k': 0.6349934189096391, 'edge_cap': 0.3142848931910024, 'bull_strategy': 'breakout', 'bull_bb_std_mult': 3.1285558378988227, 'bull_rsi_os': 54, 'bull_rsi_ob': 59, 'bull_adx_thresh': 14.102974553991759, 'bull_atr_min_pct': 0.0032299396324974904, 'bull_atr_max_pct': 0.015454534369153767, 'bull_tp_mult': 1.424834546485755, 'bull_tsl_mult': 0.41952474738250917, 'bull_time_stop': 44, 'bull_use_sma': True, 'bull_use_ema': True, 'bull_use_atr': False, 'bull_use_adx': True, 'bull_use_spike': True, 'bull_rsi_required': True, 'bear_strategy': 'mean_reversion', 'bear_bb_std_mult': 3.597355833467827, 'bear_rsi_os': 33, 'bear_rsi_ob': 86, 'bear_adx_thresh': 26.991929253837274, 'bear_atr_min_pct': 0.003233545208909734, 'bear_atr_max_pct': 0.05988011042724234, 'bear_tp_mult': 2.5960792969003146, 'bear_tsl_mult': 0.9394232461101122, 'bear_time_stop': 196, 'bear_use_sma': True, 'bear_use_ema': True, 'bear_use_atr': True, 'bear_use_adx': True, 'bear_use_spike': False, 'bear_rsi_required': True, 'sideways_strategy': 'breakout', 'sideways_bb_std_mult': 1.5470476263098867, 'sideways_rsi_os': 8, 'sideways_rsi_ob': 65, 'sideways_adx_thresh': 5.844285260486664, 'sideways_atr_min_pct': 0.01678795533209821, 'sideways_atr_max_pct': 0.14283255331122965, 'sideways_tp_mult': 1.01732597705884, 'sideways_tsl_mult': 0.29157935999574636, 'sideways_time_stop': 30, 'sideways_use_sma': True, 'sideways_use_ema': True, 'sideways_use_atr': True, 'sideways_use_adx': True, 'sideways_use_spike': True, 'sideways_rsi_required': True}.
[I 2025-09-01 14:36:53,032] Trial 632 finished with values: [-1000000000.0, 1000000000.0] and parameters: {'p_sma': 44, 'p_std': 23, 'p_atr': 12, 'p_adx': 12, 'rsi_period': 16, 'ema1': 29, 'ema2': 14, 'slip_atr_k': 0.009647645255118615, 'slip_spread_k': 0.043931218795507765, 'spread_hl_frac': 0.008103408526028645, 'bb_std_mult': 3.3892431032108585, 'rsi_os': 21, 'rsi_ob': 83, 'vol_spike': 0.029122219752203873, 'adx_thresh': 18.702742831073557, 'atr_min_pct': 0.02645051094353884, 'atr_max_pct': 0.13968779487332708, 'tp_mult': 1.1218169050717817, 'tsl_mult': 0.6938419619119303, 'strategy': 'mean_reversion', 'time_stop': 275, 'use_sma': True, 'use_atr': False, 'use_adx': True, 'use_ema': True, 'use_spike': True, 'rsi_required': False, 'edge_k': 0.9263152165456348, 'edge_cap': 0.31069656689030656, 'bull_strategy': 'breakout', 'bull_bb_std_mult': 3.349334618341687, 'bull_rsi_os': 38, 'bull_rsi_ob': 49, 'bull_adx_thresh': 14.195069646141691, 'bull_atr_min_pct': 0.004225911762274522, 'bull_atr_max_pct': 0.031289222042715586, 'bull_tp_mult': 2.817885992241838, 'bull_tsl_mult': 0.4401896952718841, 'bull_time_stop': 95, 'bull_use_sma': True, 'bull_use_ema': True, 'bull_use_atr': False, 'bull_use_adx': True, 'bull_use_spike': True, 'bull_rsi_required': True, 'bear_strategy': 'mean_reversion', 'bear_bb_std_mult': 3.436477405408479, 'bear_rsi_os': 33, 'bear_rsi_ob': 86, 'bear_adx_thresh': 5.682014408653943, 'bear_atr_min_pct': 0.003156040873057722, 'bear_atr_max_pct': 0.07898671210964629, 'bear_tp_mult': 2.221117231912586, 'bear_tsl_mult': 0.8741831955719723, 'bear_time_stop': 247, 'bear_use_sma': True, 'bear_use_ema': True, 'bear_use_atr': True, 'bear_use_adx': True, 'bear_use_spike': False, 'bear_rsi_required': True, 'sideways_strategy': 'breakout', 'sideways_bb_std_mult': 0.5620959396096046, 'sideways_rsi_os': 7, 'sideways_rsi_ob': 65, 'sideways_adx_thresh': 21.86019053483845, 'sideways_atr_min_pct': 0.01704846371353388, 'sideways_atr_max_pct': 0.06013847542820005, 'sideways_tp_mult': 2.04133168781763, 'sideways_tsl_mult': 0.28852997762240445, 'sideways_time_stop': 107, 'sideways_use_sma': True, 'sideways_use_ema': True, 'sideways_use_atr': True, 'sideways_use_adx': True, 'sideways_use_spike': True, 'sideways_rsi_required': True}.
[I 2025-09-01 14:36:53,512] Trial 630 finished with values: [-1000000000.0, 1000000000.0] and parameters: {'p_sma': 38, 'p_std': 40, 'p_atr': 22, 'p_adx': 21, 'rsi_period': 63, 'ema1': 19, 'ema2': 14, 'slip_atr_k': 0.15415477502259867, 'slip_spread_k': 0.044854412061400964, 'spread_hl_frac': 0.027729288159273724, 'bb_std_mult': 1.4340945313525828, 'rsi_os': 23, 'rsi_ob': 83, 'vol_spike': 0.13268496206670538, 'adx_thresh': 25.29408599332769, 'atr_min_pct': 0.026472993018008047, 'atr_max_pct': 0.14093611099491002, 'tp_mult': 1.752213103399567, 'tsl_mult': 0.4520548437303646, 'strategy': 'mean_reversion', 'time_stop': 226, 'use_sma': True, 'use_atr': False, 'use_adx': True, 'use_ema': True, 'use_spike': True, 'rsi_required': False, 'edge_k': 0.9346199022099605, 'edge_cap': 0.9224327398104247, 'bull_strategy': 'breakout', 'bull_bb_std_mult': 1.276113631783014, 'bull_rsi_os': 34, 'bull_rsi_ob': 59, 'bull_adx_thresh': 29.1789493361081, 'bull_atr_min_pct': 0.011199064939432696, 'bull_atr_max_pct': 0.016375051362979922, 'bull_tp_mult': 2.8574915190640846, 'bull_tsl_mult': 0.4178231202315917, 'bull_time_stop': 108, 'bull_use_sma': True, 'bull_use_ema': True, 'bull_use_atr': False, 'bull_use_adx': True, 'bull_use_spike': True, 'bull_rsi_required': True, 'bear_strategy': 'mean_reversion', 'bear_bb_std_mult': 3.4235000441468966, 'bear_rsi_os': 33, 'bear_rsi_ob': 64, 'bear_adx_thresh': 11.425182288675561, 'bear_atr_min_pct': 0.013348094438249298, 'bear_atr_max_pct': 0.09707843663450208, 'bear_tp_mult': 1.5163730387298233, 'bear_tsl_mult': 0.14586982645192476, 'bear_time_stop': 246, 'bear_use_sma': True, 'bear_use_ema': True, 'bear_use_atr': True, 'bear_use_adx': True, 'bear_use_spike': False, 'bear_rsi_required': True, 'sideways_strategy': 'breakout', 'sideways_bb_std_mult': 1.5376840184470066, 'sideways_rsi_os': 20, 'sideways_rsi_ob': 65, 'sideways_adx_thresh': 21.746431935002754, 'sideways_atr_min_pct': 0.00328402291829925, 'sideways_atr_max_pct': 0.06036144770008481, 'sideways_tp_mult': 2.4309084248222628, 'sideways_tsl_mult': 0.2870542492938156, 'sideways_time_stop': 279, 'sideways_use_sma': True, 'sideways_use_ema': True, 'sideways_use_atr': True, 'sideways_use_adx': True, 'sideways_use_spike': True, 'sideways_rsi_required': True}.
[I 2025-09-01 14:36:53,955] Trial 631 finished with values: [-1000000000.0, 1000000000.0] and parameters: {'p_sma': 44, 'p_std': 23, 'p_atr': 22, 'p_adx': 12, 'rsi_period': 63, 'ema1': 29, 'ema2': 20, 'slip_atr_k': 0.20024270176714432, 'slip_spread_k': 0.7825647096181365, 'spread_hl_frac': 0.007620301132534816, 'bb_std_mult': 1.7652498729986639, 'rsi_os': 43, 'rsi_ob': 83, 'vol_spike': 0.24664009243307827, 'adx_thresh': 25.343041267539554, 'atr_min_pct': 0.026276682834164167, 'atr_max_pct': 0.14005001490743643, 'tp_mult': 1.1186356445040808, 'tsl_mult': 0.2835795310242364, 'strategy': 'mean_reversion', 'time_stop': 217, 'use_sma': True, 'use_atr': False, 'use_adx': True, 'use_ema': True, 'use_spike': True, 'rsi_required': False, 'edge_k': 0.2117022501947039, 'edge_cap': 0.726647243410257, 'bull_strategy': 'breakout', 'bull_bb_std_mult': 3.3714516500604113, 'bull_rsi_os': 11, 'bull_rsi_ob': 59, 'bull_adx_thresh': 10.414509476162559, 'bull_atr_min_pct': 0.022533641308682833, 'bull_atr_max_pct': 0.10861083549705078, 'bull_tp_mult': 1.0290968565933682, 'bull_tsl_mult': 0.4206305775638001, 'bull_time_stop': 77, 'bull_use_sma': True, 'bull_use_ema': True, 'bull_use_atr': False, 'bull_use_adx': True, 'bull_use_spike': True, 'bull_rsi_required': True, 'bear_strategy': 'mean_reversion', 'bear_bb_std_mult': 3.4497922603249584, 'bear_rsi_os': 32, 'bear_rsi_ob': 64, 'bear_adx_thresh': 27.113734537940513, 'bear_atr_min_pct': 0.0031411366675899873, 'bear_atr_max_pct': 0.0801334882227244, 'bear_tp_mult': 1.336774799504963, 'bear_tsl_mult': 0.6575681076371034, 'bear_time_stop': 153, 'bear_use_sma': True, 'bear_use_ema': True, 'bear_use_atr': True, 'bear_use_adx': True, 'bear_use_spike': False, 'bear_rsi_required': True, 'sideways_strategy': 'breakout', 'sideways_bb_std_mult': 1.5565285189047144, 'sideways_rsi_os': 50, 'sideways_rsi_ob': 65, 'sideways_adx_thresh': 22.011280101318878, 'sideways_atr_min_pct': 0.021032973816159862, 'sideways_atr_max_pct': 0.06024047917223727, 'sideways_tp_mult': 2.8492374562161036, 'sideways_tsl_mult': 0.6743917991329629, 'sideways_time_stop': 191, 'sideways_use_sma': True, 'sideways_use_ema': True, 'sideways_use_atr': True, 'sideways_use_adx': True, 'sideways_use_spike': True, 'sideways_rsi_required': True}.
[I 2025-09-01 14:36:55,625] Trial 636 finished with values: [-1000000000.0, 1000000000.0] and parameters: {'p_sma': 19, 'p_std': 51, 'p_atr': 13, 'p_adx': 11, 'rsi_period': 67, 'ema1': 5, 'ema2': 37, 'slip_atr_k': 0.015831032540411214, 'slip_spread_k': 0.08529776044987378, 'spread_hl_frac': 0.004918418876495579, 'bb_std_mult': 1.7812993097622134, 'rsi_os': 9, 'rsi_ob': 46, 'vol_spike': 0.15467420325355333, 'adx_thresh': 26.526922241822085, 'atr_min_pct': 0.011650590698405483, 'atr_max_pct': 0.05410392040715295, 'tp_mult': 1.0179297467062915, 'tsl_mult': 0.7147893559803544, 'strategy': 'mean_reversion', 'time_stop': 181, 'use_sma': True, 'use_atr': False, 'use_adx': False, 'use_ema': False, 'use_spike': False, 'rsi_required': False, 'edge_k': 0.7460574653157621, 'edge_cap': 0.7887266030671384, 'bull_strategy': 'breakout', 'bull_bb_std_mult': 3.0336597583803933, 'bull_rsi_os': 36, 'bull_rsi_ob': 90, 'bull_adx_thresh': 30.596563124351903, 'bull_atr_min_pct': 0.018639907781008498, 'bull_atr_max_pct': 0.02672547791893605, 'bull_tp_mult': 2.7882324467316484, 'bull_tsl_mult': 0.3720184600981289, 'bull_time_stop': 80, 'bull_use_sma': True, 'bull_use_ema': True, 'bull_use_atr': True, 'bull_use_adx': False, 'bull_use_spike': False, 'bull_rsi_required': True, 'bear_strategy': 'breakout', 'bear_bb_std_mult': 3.5998640984297112, 'bear_rsi_os': 39, 'bear_rsi_ob': 69, 'bear_adx_thresh': 20.56908289279922, 'bear_atr_min_pct': 0.00400388289799977, 'bear_atr_max_pct': 0.043220674777617964, 'bear_tp_mult': 1.3593691309966622, 'bear_tsl_mult': 0.3703015731386874, 'bear_time_stop': 233, 'bear_use_sma': True, 'bear_use_ema': False, 'bear_use_atr': False, 'bear_use_adx': True, 'bear_use_spike': False, 'bear_rsi_required': False, 'sideways_strategy': 'breakout', 'sideways_bb_std_mult': 1.7155323654636319, 'sideways_rsi_os': 49, 'sideways_rsi_ob': 71, 'sideways_adx_thresh': 7.092606430753972, 'sideways_atr_min_pct': 0.020966146412057414, 'sideways_atr_max_pct': 0.1363431305707289, 'sideways_tp_mult': 2.913404012505799, 'sideways_tsl_mult': 0.25895084937433993, 'sideways_time_stop': 153, 'sideways_use_sma': False, 'sideways_use_ema': False, 'sideways_use_atr': True, 'sideways_use_adx': False, 'sideways_use_spike': False, 'sideways_rsi_required': True}.
[I 2025-09-01 14:37:31,640] Trial 637 finished with values: [-1000000000.0, 1000000000.0] and parameters: {'p_sma': 19, 'p_std': 48, 'p_atr': 7, 'p_adx': 28, 'rsi_period': 65, 'ema1': 5, 'ema2': 40, 'slip_atr_k': 0.06838721501052558, 'slip_spread_k': 0.21878185834075614, 'spread_hl_frac': 0.03498862013572448, 'bb_std_mult': 1.6943776042835095, 'rsi_os': 41, 'rsi_ob': 82, 'vol_spike': 0.0716607791837656, 'adx_thresh': 26.259523930057373, 'atr_min_pct': 0.025879839891287518, 'atr_max_pct': 0.05933747695846804, 'tp_mult': 1.250909914840952, 'tsl_mult': 0.6043936592874976, 'strategy': 'mean_reversion', 'time_stop': 245, 'use_sma': True, 'use_atr': False, 'use_adx': False, 'use_ema': False, 'use_spike': False, 'rsi_required': False, 'edge_k': 1.150325011301502, 'edge_cap': 0.41252673680947866, 'bull_strategy': 'breakout', 'bull_bb_std_mult': 3.2536336059476656, 'bull_rsi_os': 24, 'bull_rsi_ob': 53, 'bull_adx_thresh': 25.401549561654978, 'bull_atr_min_pct': 0.025410676489408895, 'bull_atr_max_pct': 0.09037758454071926, 'bull_tp_mult': 2.801254784041601, 'bull_tsl_mult': 0.3698986862700908, 'bull_time_stop': 134, 'bull_use_sma': True, 'bull_use_ema': True, 'bull_use_atr': True, 'bull_use_adx': False, 'bull_use_spike': False, 'bull_rsi_required': True, 'bear_strategy': 'breakout', 'bear_bb_std_mult': 3.500266014317136, 'bear_rsi_os': 9, 'bear_rsi_ob': 89, 'bear_adx_thresh': 12.49644125735953, 'bear_atr_min_pct': 0.002315957175593766, 'bear_atr_max_pct': 0.039079471525086035, 'bear_tp_mult': 2.2773062602782166, 'bear_tsl_mult': 0.12667175513886497, 'bear_time_stop': 233, 'bear_use_sma': True, 'bear_use_ema': False, 'bear_use_atr': False, 'bear_use_adx': True, 'bear_use_spike': False, 'bear_rsi_required': False, 'sideways_strategy': 'breakout', 'sideways_bb_std_mult': 1.4782455275561113, 'sideways_rsi_os': 52, 'sideways_rsi_ob': 54, 'sideways_adx_thresh': 14.982205909793006, 'sideways_atr_min_pct': 0.0190983622114295, 'sideways_atr_max_pct': 0.04464222951892569, 'sideways_tp_mult': 2.9008461673493393, 'sideways_tsl_mult': 0.2591068427196591, 'sideways_time_stop': 182, 'sideways_use_sma': False, 'sideways_use_ema': False, 'sideways_use_atr': True, 'sideways_use_adx': False, 'sideways_use_spike': False, 'sideways_rsi_required': True}.
[I 2025-09-01 14:37:32,103] Trial 634 finished with values: [-1000000000.0, 1000000000.0] and parameters: {'p_sma': 39, 'p_std': 48, 'p_atr': 22, 'p_adx': 21, 'rsi_period': 50, 'ema1': 19, 'ema2': 49, 'slip_atr_k': 0.19989761991875066, 'slip_spread_k': 0.08380284731918099, 'spread_hl_frac': 0.005055928022050055, 'bb_std_mult': 0.901781931897851, 'rsi_os': 22, 'rsi_ob': 60, 'vol_spike': 0.1319863628762552, 'adx_thresh': 24.947082406572815, 'atr_min_pct': 0.026072701595696572, 'atr_max_pct': 0.09946455385828941, 'tp_mult': 1.0127965367415348, 'tsl_mult': 0.27940542215468034, 'strategy': 'mean_reversion', 'time_stop': 247, 'use_sma': True, 'use_atr': False, 'use_adx': False, 'use_ema': True, 'use_spike': True, 'rsi_required': False, 'edge_k': 1.1573512252963998, 'edge_cap': 0.4123134779314791, 'bull_strategy': 'breakout', 'bull_bb_std_mult': 3.069192905282666, 'bull_rsi_os': 13, 'bull_rsi_ob': 69, 'bull_adx_thresh': 29.34622077138447, 'bull_atr_min_pct': 0.022707223347083402, 'bull_atr_max_pct': 0.1285901486142571, 'bull_tp_mult': 2.85788194910218, 'bull_tsl_mult': 0.8527572768414318, 'bull_time_stop': 76, 'bull_use_sma': True, 'bull_use_ema': True, 'bull_use_atr': True, 'bull_use_adx': False, 'bull_use_spike': False, 'bull_rsi_required': True, 'bear_strategy': 'breakout', 'bear_bb_std_mult': 3.4952912635237476, 'bear_rsi_os': 31, 'bear_rsi_ob': 89, 'bear_adx_thresh': 12.734808756006064, 'bear_atr_min_pct': 0.003980171380231233, 'bear_atr_max_pct': 0.10966640913513778, 'bear_tp_mult': 2.287616254079418, 'bear_tsl_mult': 0.5227363670766677, 'bear_time_stop': 120, 'bear_use_sma': True, 'bear_use_ema': True, 'bear_use_atr': True, 'bear_use_adx': True, 'bear_use_spike': False, 'bear_rsi_required': True, 'sideways_strategy': 'breakout', 'sideways_bb_std_mult': 1.712976475289426, 'sideways_rsi_os': 52, 'sideways_rsi_ob': 68, 'sideways_adx_thresh': 12.922834987285658, 'sideways_atr_min_pct': 0.020727798416136995, 'sideways_atr_max_pct': 0.06863152751823946, 'sideways_tp_mult': 2.9184414634574853, 'sideways_tsl_mult': 0.6756466483738035, 'sideways_time_stop': 81, 'sideways_use_sma': True, 'sideways_use_ema': False, 'sideways_use_atr': True, 'sideways_use_adx': False, 'sideways_use_spike': False, 'sideways_rsi_required': True}.
[I 2025-09-01 14:37:32,573] Trial 635 finished with values: [-0.0467359031236243, 0.04655227176755878] and parameters: {'p_sma': 56, 'p_std': 48, 'p_atr': 7, 'p_adx': 21, 'rsi_period': 50, 'ema1': 19, 'ema2': 28, 'slip_atr_k': 0.017332283977933613, 'slip_spread_k': 0.08261834144535392, 'spread_hl_frac': 0.005281417131736936, 'bb_std_mult': 1.927061412525617, 'rsi_os': 45, 'rsi_ob': 72, 'vol_spike': 0.2448489393562317, 'adx_thresh': 24.919192792617523, 'atr_min_pct': 0.026106600338546778, 'atr_max_pct': 0.05791268106416987, 'tp_mult': 1.0125065130677988, 'tsl_mult': 0.7082509416884768, 'strategy': 'mean_reversion', 'time_stop': 178, 'use_sma': True, 'use_atr': False, 'use_adx': False, 'use_ema': True, 'use_spike': True, 'rsi_required': False, 'edge_k': 0.7697434052858061, 'edge_cap': 0.32785365987299286, 'bull_strategy': 'breakout', 'bull_bb_std_mult': 1.3778957033120216, 'bull_rsi_os': 37, 'bull_rsi_ob': 87, 'bull_adx_thresh': 10.436509809694686, 'bull_atr_min_pct': 0.011091387607373117, 'bull_atr_max_pct': 0.09030957409414096, 'bull_tp_mult': 1.0420734203341757, 'bull_tsl_mult': 0.3655631401437132, 'bull_time_stop': 107, 'bull_use_sma': True, 'bull_use_ema': True, 'bull_use_atr': True, 'bull_use_adx': False, 'bull_use_spike': False, 'bull_rsi_required': True, 'bear_strategy': 'breakout', 'bear_bb_std_mult': 3.5980778445944153, 'bear_rsi_os': 32, 'bear_rsi_ob': 89, 'bear_adx_thresh': 12.73779538539083, 'bear_atr_min_pct': 0.004155114119879343, 'bear_atr_max_pct': 0.010442751400914094, 'bear_tp_mult': 1.5383147340726606, 'bear_tsl_mult': 0.14124739064915554, 'bear_time_stop': 179, 'bear_use_sma': True, 'bear_use_ema': True, 'bear_use_atr': True, 'bear_use_adx': True, 'bear_use_spike': False, 'bear_rsi_required': True, 'sideways_strategy': 'breakout', 'sideways_bb_std_mult': 1.7107880606700758, 'sideways_rsi_os': 52, 'sideways_rsi_ob': 68, 'sideways_adx_thresh': 13.047629927605422, 'sideways_atr_min_pct': 0.0032721182194080847, 'sideways_atr_max_pct': 0.06861214322965108, 'sideways_tp_mult': 2.8509492932264022, 'sideways_tsl_mult': 0.5163695475966701, 'sideways_time_stop': 125, 'sideways_use_sma': True, 'sideways_use_ema': False, 'sideways_use_atr': True, 'sideways_use_adx': False, 'sideways_use_spike': False, 'sideways_rsi_required': True}.
[I 2025-09-01 14:37:33,019] Trial 638 finished with values: [-0.034371857020228935, 0.03399953535618655] and parameters: {'p_sma': 37, 'p_std': 48, 'p_atr': 24, 'p_adx': 12, 'rsi_period': 27, 'ema1': 21, 'ema2': 29, 'slip_atr_k': 0.06868856068499235, 'slip_spread_k': 0.5524498310355253, 'spread_hl_frac': 0.019964760988001616, 'bb_std_mult': 1.9246964172311358, 'rsi_os': 45, 'rsi_ob': 64, 'vol_spike': 0.11704307841160218, 'adx_thresh': 24.181393532246055, 'atr_min_pct': 0.009430335151734151, 'atr_max_pct': 0.05803634784613221, 'tp_mult': 1.2217111779155385, 'tsl_mult': 0.6065344652980134, 'strategy': 'mean_reversion', 'time_stop': 246, 'use_sma': False, 'use_atr': False, 'use_adx': False, 'use_ema': True, 'use_spike': True, 'rsi_required': False, 'edge_k': 1.0811753389587868, 'edge_cap': 0.12049678045167184, 'bull_strategy': 'breakout', 'bull_bb_std_mult': 1.3612808093997582, 'bull_rsi_os': 26, 'bull_rsi_ob': 52, 'bull_adx_thresh': 29.31594650152739, 'bull_atr_min_pct': 0.012369550755488283, 'bull_atr_max_pct': 0.018994595184840972, 'bull_tp_mult': 2.9634622155416936, 'bull_tsl_mult': 0.5014107754612983, 'bull_time_stop': 134, 'bull_use_sma': True, 'bull_use_ema': True, 'bull_use_atr': True, 'bull_use_adx': False, 'bull_use_spike': False, 'bull_rsi_required': True, 'bear_strategy': 'breakout', 'bear_bb_std_mult': 3.1167116641380543, 'bear_rsi_os': 31, 'bear_rsi_ob': 89, 'bear_adx_thresh': 12.717764575625418, 'bear_atr_min_pct': 0.0023709929603973083, 'bear_atr_max_pct': 0.010014476914692844, 'bear_tp_mult': 2.279008529069557, 'bear_tsl_mult': 0.7923937820488435, 'bear_time_stop': 224, 'bear_use_sma': True, 'bear_use_ema': True, 'bear_use_atr': True, 'bear_use_adx': True, 'bear_use_spike': True, 'bear_rsi_required': True, 'sideways_strategy': 'breakout', 'sideways_bb_std_mult': 1.6053013965474763, 'sideways_rsi_os': 52, 'sideways_rsi_ob': 60, 'sideways_adx_thresh': 15.010280793254458, 'sideways_atr_min_pct': 0.019307673059449203, 'sideways_atr_max_pct': 0.0684549646132635, 'sideways_tp_mult': 2.659449388941893, 'sideways_tsl_mult': 0.4023293936897634, 'sideways_time_stop': 183, 'sideways_use_sma': True, 'sideways_use_ema': False, 'sideways_use_atr': False, 'sideways_use_adx': False, 'sideways_use_spike': False, 'sideways_rsi_required': True}.
