[I 2025-09-01 13:55:05,267] Trial 341 finished with values: [-0.0831703096736135, 0.08294883684790412] and parameters: {'p_sma': 36, 'p_std': 50, 'p_atr': 26, 'p_adx': 25, 'rsi_period': 67, 'ema1': 21, 'ema2': 20, 'slip_atr_k': 0.021921229025730415, 'slip_spread_k': 0.655100885262308, 'spread_hl_frac': 0.0051791777492274284, 'bb_std_mult': 2.4791206468320786, 'rsi_os': 37, 'rsi_ob': 82, 'vol_spike': 0.22307361645186058, 'adx_thresh': 24.20583225409618, 'atr_min_pct': 0.028148470300184195, 'atr_max_pct': 0.1367970699951937, 'tp_mult': 1.0693583181035506, 'tsl_mult': 0.7795388534791832, 'strategy': 'mean_reversion', 'time_stop': 259, 'use_sma': False, 'use_atr': False, 'use_adx': False, 'use_ema': False, 'use_spike': True, 'rsi_required': False, 'edge_k': 1.0734606782150378, 'edge_cap': 0.07218812387754014, 'bull_strategy': 'breakout', 'bull_bb_std_mult': 3.1879366674468255, 'bull_rsi_os': 28, 'bull_rsi_ob': 65, 'bull_adx_thresh': 30.452466535389146, 'bull_atr_min_pct': 0.012586643978856005, 'bull_atr_max_pct': 0.019964174124714868, 'bull_tp_mult': 1.1341958124513092, 'bull_tsl_mult': 0.763748088063501, 'bull_time_stop': 84, 'bull_use_sma': True, 'bull_use_ema': True, 'bull_use_atr': False, 'bull_use_adx': True, 'bull_use_spike': False, 'bull_rsi_required': True, 'bear_strategy': 'breakout', 'bear_bb_std_mult': 0.5471842524583652, 'bear_rsi_os': 45, 'bear_rsi_ob': 86, 'bear_adx_thresh': 12.123257509741109, 'bear_atr_min_pct': 0.0032345092232048877, 'bear_atr_max_pct': 0.11429735045770342, 'bear_tp_mult': 1.670097904605717, 'bear_tsl_mult': 0.4245059833543956, 'bear_time_stop': 64, 'bear_use_sma': False, 'bear_use_ema': True, 'bear_use_atr': True, 'bear_use_adx': True, 'bear_use_spike': False, 'bear_rsi_required': True, 'sideways_strategy': 'breakout', 'sideways_bb_std_mult': 3.423906279814352, 'sideways_rsi_os': 51, 'sideways_rsi_ob': 69, 'sideways_adx_thresh': 16.696530326633063, 'sideways_atr_min_pct': 0.0017276074340993822, 'sideways_atr_max_pct': 0.14067869136376093, 'sideways_tp_mult': 2.2640074100541154, 'sideways_tsl_mult': 0.22703508013894652, 'sideways_time_stop': 273, 'sideways_use_sma': True, 'sideways_use_ema': False, 'sideways_use_atr': True, 'sideways_use_adx': True, 'sideways_use_spike': False, 'sideways_rsi_required': False}.
[I 2025-09-01 13:55:05,621] Trial 340 finished with values: [-0.08335407338928724, 0.08275508829318975] and parameters: {'p_sma': 34, 'p_std': 22, 'p_atr': 10, 'p_adx': 26, 'rsi_period': 67, 'ema1': 9, 'ema2': 20, 'slip_atr_k': 0.020771129673261633, 'slip_spread_k': 0.08576139337711025, 'spread_hl_frac': 0.031400512250328444, 'bb_std_mult': 1.8236547833080043, 'rsi_os': 36, 'rsi_ob': 78, 'vol_spike': 0.22390609757656893, 'adx_thresh': 25.51043221788846, 'atr_min_pct': 0.011146595464694854, 'atr_max_pct': 0.13673658820546314, 'tp_mult': 1.0726939454074274, 'tsl_mult': 0.7449428643594063, 'strategy': 'mean_reversion', 'time_stop': 258, 'use_sma': False, 'use_atr': False, 'use_adx': False, 'use_ema': False, 'use_spike': True, 'rsi_required': False, 'edge_k': 0.941063176708941, 'edge_cap': 0.158775690978671, 'bull_strategy': 'breakout', 'bull_bb_std_mult': 3.3604769051416516, 'bull_rsi_os': 35, 'bull_rsi_ob': 51, 'bull_adx_thresh': 26.48240587953337, 'bull_atr_min_pct': 0.004518538828135691, 'bull_atr_max_pct': 0.04969564238430385, 'bull_tp_mult': 2.8133029840672594, 'bull_tsl_mult': 0.4636738790553714, 'bull_time_stop': 85, 'bull_use_sma': True, 'bull_use_ema': True, 'bull_use_atr': False, 'bull_use_adx': True, 'bull_use_spike': False, 'bull_rsi_required': True, 'bear_strategy': 'breakout', 'bear_bb_std_mult': 1.7586587927869988, 'bear_rsi_os': 46, 'bear_rsi_ob': 88, 'bear_adx_thresh': 13.036543539411026, 'bear_atr_min_pct': 0.0027545481215002967, 'bear_atr_max_pct': 0.10966622608356788, 'bear_tp_mult': 1.6721890907760142, 'bear_tsl_mult': 0.9234155254503804, 'bear_time_stop': 65, 'bear_use_sma': False, 'bear_use_ema': True, 'bear_use_atr': True, 'bear_use_adx': True, 'bear_use_spike': False, 'bear_rsi_required': True, 'sideways_strategy': 'breakout', 'sideways_bb_std_mult': 1.512253573210868, 'sideways_rsi_os': 17, 'sideways_rsi_ob': 69, 'sideways_adx_thresh': 23.335663932046998, 'sideways_atr_min_pct': 0.0020353061035182692, 'sideways_atr_max_pct': 0.09839008777802338, 'sideways_tp_mult': 1.6674568287913636, 'sideways_tsl_mult': 0.7428030390607173, 'sideways_time_stop': 186, 'sideways_use_sma': True, 'sideways_use_ema': True, 'sideways_use_atr': True, 'sideways_use_adx': True, 'sideways_use_spike': False, 'sideways_rsi_required': False}.
[I 2025-09-01 13:55:44,704] Trial 344 finished with values: [-0.03290688170034206, 0.03233371770638246] and parameters: {'p_sma': 37, 'p_std': 46, 'p_atr': 25, 'p_adx': 10, 'rsi_period': 8, 'ema1': 14, 'ema2': 20, 'slip_atr_k': 0.02209182927491693, 'slip_spread_k': 0.1126461113564149, 'spread_hl_frac': 0.006342714902599807, 'bb_std_mult': 1.8120244877305722, 'rsi_os': 40, 'rsi_ob': 82, 'vol_spike': 0.2248838723631438, 'adx_thresh': 25.50061180999405, 'atr_min_pct': 0.02492859563539937, 'atr_max_pct': 0.1343960911273458, 'tp_mult': 1.010642968969195, 'tsl_mult': 0.7765823670658512, 'strategy': 'mean_reversion', 'time_stop': 158, 'use_sma': True, 'use_atr': False, 'use_adx': False, 'use_ema': False, 'use_spike': True, 'rsi_required': False, 'edge_k': 0.9458468131889248, 'edge_cap': 0.2334302580596998, 'bull_strategy': 'breakout', 'bull_bb_std_mult': 3.1467685275999107, 'bull_rsi_os': 35, 'bull_rsi_ob': 53, 'bull_adx_thresh': 27.351579592136392, 'bull_atr_min_pct': 0.012759775936159835, 'bull_atr_max_pct': 0.13732210143604365, 'bull_tp_mult': 1.2228100072364008, 'bull_tsl_mult': 0.7161284152631229, 'bull_time_stop': 192, 'bull_use_sma': True, 'bull_use_ema': True, 'bull_use_atr': True, 'bull_use_adx': True, 'bull_use_spike': False, 'bull_rsi_required': True, 'bear_strategy': 'breakout', 'bear_bb_std_mult': 3.598666190419384, 'bear_rsi_os': 33, 'bear_rsi_ob': 90, 'bear_adx_thresh': 6.243602376144775, 'bear_atr_min_pct': 0.0030422817775099063, 'bear_atr_max_pct': 0.010672452823722992, 'bear_tp_mult': 1.9323707070924436, 'bear_tsl_mult': 0.713839474609689, 'bear_time_stop': 202, 'bear_use_sma': True, 'bear_use_ema': True, 'bear_use_atr': True, 'bear_use_adx': True, 'bear_use_spike': False, 'bear_rsi_required': True, 'sideways_strategy': 'breakout', 'sideways_bb_std_mult': 0.5001757449424526, 'sideways_rsi_os': 51, 'sideways_rsi_ob': 64, 'sideways_adx_thresh': 9.393308898842053, 'sideways_atr_min_pct': 0.021892503560376225, 'sideways_atr_max_pct': 0.06977170533816998, 'sideways_tp_mult': 1.4539727263847422, 'sideways_tsl_mult': 0.23448996031484629, 'sideways_time_stop': 115, 'sideways_use_sma': True, 'sideways_use_ema': False, 'sideways_use_atr': True, 'sideways_use_adx': True, 'sideways_use_spike': False, 'sideways_rsi_required': False}.
[I 2025-09-01 13:55:45,023] Trial 345 finished with values: [-1000000000.0, 1000000000.0] and parameters: {'p_sma': 37, 'p_std': 46, 'p_atr': 10, 'p_adx': 13, 'rsi_period': 64, 'ema1': 21, 'ema2': 17, 'slip_atr_k': 0.06651987006436182, 'slip_spread_k': 0.11682553918626515, 'spread_hl_frac': 0.006388972757063765, 'bb_std_mult': 1.2242269845083888, 'rsi_os': 39, 'rsi_ob': 52, 'vol_spike': 0.18956746187429693, 'adx_thresh': 34.2123812994421, 'atr_min_pct': 0.017153808955361425, 'atr_max_pct': 0.14095260883188637, 'tp_mult': 1.1595245239245704, 'tsl_mult': 0.5192849405025343, 'strategy': 'mean_reversion', 'time_stop': 237, 'use_sma': True, 'use_atr': False, 'use_adx': False, 'use_ema': True, 'use_spike': True, 'rsi_required': False, 'edge_k': 0.8580056449216266, 'edge_cap': 0.4309634452234574, 'bull_strategy': 'breakout', 'bull_bb_std_mult': 3.1309088079419287, 'bull_rsi_os': 28, 'bull_rsi_ob': 66, 'bull_adx_thresh': 21.9411275155504, 'bull_atr_min_pct': 0.01241902603317305, 'bull_atr_max_pct': 0.1385025552418179, 'bull_tp_mult': 2.5852886418570193, 'bull_tsl_mult': 0.4176356367583213, 'bull_time_stop': 80, 'bull_use_sma': True, 'bull_use_ema': True, 'bull_use_atr': True, 'bull_use_adx': True, 'bull_use_spike': False, 'bull_rsi_required': True, 'bear_strategy': 'breakout', 'bear_bb_std_mult': 3.5947529678556536, 'bear_rsi_os': 20, 'bear_rsi_ob': 90, 'bear_adx_thresh': 24.90136147209074, 'bear_atr_min_pct': 0.00810181028377669, 'bear_atr_max_pct': 0.11516377287230158, 'bear_tp_mult': 2.2278306950185187, 'bear_tsl_mult': 0.12221433654569219, 'bear_time_stop': 86, 'bear_use_sma': True, 'bear_use_ema': True, 'bear_use_atr': True, 'bear_use_adx': True, 'bear_use_spike': False, 'bear_rsi_required': True, 'sideways_strategy': 'breakout', 'sideways_bb_std_mult': 1.4536539907083137, 'sideways_rsi_os': 51, 'sideways_rsi_ob': 69, 'sideways_adx_thresh': 8.197734166487727, 'sideways_atr_min_pct': 0.023694133610747167, 'sideways_atr_max_pct': 0.06751058134088259, 'sideways_tp_mult': 2.698357694465872, 'sideways_tsl_mult': 0.9038949383463757, 'sideways_time_stop': 161, 'sideways_use_sma': True, 'sideways_use_ema': False, 'sideways_use_atr': True, 'sideways_use_adx': True, 'sideways_use_spike': False, 'sideways_rsi_required': True}.
[I 2025-09-01 13:55:45,347] Trial 346 finished with values: [-0.041265663214273496, 0.041095726434580246] and parameters: {'p_sma': 37, 'p_std': 22, 'p_atr': 10, 'p_adx': 24, 'rsi_period': 62, 'ema1': 21, 'ema2': 17, 'slip_atr_k': 0.007888218140246211, 'slip_spread_k': 0.19355084439563036, 'spread_hl_frac': 0.006890811268538884, 'bb_std_mult': 1.7942768280713328, 'rsi_os': 40, 'rsi_ob': 84, 'vol_spike': 0.0940134783506168, 'adx_thresh': 34.08777692166188, 'atr_min_pct': 0.009054821876230417, 'atr_max_pct': 0.017159267250172985, 'tp_mult': 1.1723516578806448, 'tsl_mult': 0.5129700980962877, 'strategy': 'mean_reversion', 'time_stop': 50, 'use_sma': True, 'use_atr': False, 'use_adx': False, 'use_ema': True, 'use_spike': True, 'rsi_required': False, 'edge_k': 0.9409112182432056, 'edge_cap': 0.4321145233738537, 'bull_strategy': 'breakout', 'bull_bb_std_mult': 1.6389444201357488, 'bull_rsi_os': 38, 'bull_rsi_ob': 56, 'bull_adx_thresh': 34.35644505309659, 'bull_atr_min_pct': 0.0034175733035165766, 'bull_atr_max_pct': 0.13675498924121213, 'bull_tp_mult': 2.8535954666402965, 'bull_tsl_mult': 0.41332056911641224, 'bull_time_stop': 215, 'bull_use_sma': True, 'bull_use_ema': True, 'bull_use_atr': True, 'bull_use_adx': True, 'bull_use_spike': True, 'bull_rsi_required': True, 'bear_strategy': 'breakout', 'bear_bb_std_mult': 3.540149973967944, 'bear_rsi_os': 35, 'bear_rsi_ob': 48, 'bear_adx_thresh': 10.94167061266404, 'bear_atr_min_pct': 0.001498140792061205, 'bear_atr_max_pct': 0.04261592240229592, 'bear_tp_mult': 2.2230960194070812, 'bear_tsl_mult': 0.1262474660615295, 'bear_time_stop': 71, 'bear_use_sma': True, 'bear_use_ema': True, 'bear_use_atr': True, 'bear_use_adx': True, 'bear_use_spike': True, 'bear_rsi_required': True, 'sideways_strategy': 'breakout', 'sideways_bb_std_mult': 3.052725622564128, 'sideways_rsi_os': 49, 'sideways_rsi_ob': 77, 'sideways_adx_thresh': 8.192609812472034, 'sideways_atr_min_pct': 0.01802914265002926, 'sideways_atr_max_pct': 0.06925205648781016, 'sideways_tp_mult': 2.6334455664113534, 'sideways_tsl_mult': 0.60115683559449, 'sideways_time_stop': 162, 'sideways_use_sma': True, 'sideways_use_ema': False, 'sideways_use_atr': False, 'sideways_use_adx': True, 'sideways_use_spike': False, 'sideways_rsi_required': True}.
[I 2025-09-01 13:55:45,650] Trial 347 finished with values: [-1000000000.0, 1000000000.0] and parameters: {'p_sma': 37, 'p_std': 53, 'p_atr': 26, 'p_adx': 10, 'rsi_period': 62, 'ema1': 21, 'ema2': 46, 'slip_atr_k': 0.01900292307683863, 'slip_spread_k': 0.7132697456781251, 'spread_hl_frac': 0.006458372479909654, 'bb_std_mult': 1.7611958378438441, 'rsi_os': 42, 'rsi_ob': 84, 'vol_spike': 0.03007941489508835, 'adx_thresh': 17.71231521820206, 'atr_min_pct': 0.00032347176891585686, 'atr_max_pct': 0.1269944598752923, 'tp_mult': 1.1661940744874981, 'tsl_mult': 0.5244620687137368, 'strategy': 'mean_reversion', 'time_stop': 270, 'use_sma': True, 'use_atr': False, 'use_adx': False, 'use_ema': True, 'use_spike': True, 'rsi_required': False, 'edge_k': 1.7074575004874957, 'edge_cap': 0.23328067051254137, 'bull_strategy': 'breakout', 'bull_bb_std_mult': 3.166633129036503, 'bull_rsi_os': 38, 'bull_rsi_ob': 89, 'bull_adx_thresh': 31.137978705159032, 'bull_atr_min_pct': 0.002640028332858972, 'bull_atr_max_pct': 0.06764376378386461, 'bull_tp_mult': 2.596933150038435, 'bull_tsl_mult': 0.4140789219696087, 'bull_time_stop': 207, 'bull_use_sma': True, 'bull_use_ema': True, 'bull_use_atr': True, 'bull_use_adx': True, 'bull_use_spike': True, 'bull_rsi_required': True, 'bear_strategy': 'breakout', 'bear_bb_std_mult': 2.276209327119118, 'bear_rsi_os': 35, 'bear_rsi_ob': 48, 'bear_adx_thresh': 6.171277401908638, 'bear_atr_min_pct': 0.008095747662438556, 'bear_atr_max_pct': 0.043447665757408535, 'bear_tp_mult': 2.220590250419319, 'bear_tsl_mult': 0.11856073876462214, 'bear_time_stop': 74, 'bear_use_sma': True, 'bear_use_ema': True, 'bear_use_atr': True, 'bear_use_adx': True, 'bear_use_spike': True, 'bear_rsi_required': True, 'sideways_strategy': 'breakout', 'sideways_bb_std_mult': 1.4603596006221007, 'sideways_rsi_os': 52, 'sideways_rsi_ob': 63, 'sideways_adx_thresh': 7.865079891647369, 'sideways_atr_min_pct': 0.021017004309304112, 'sideways_atr_max_pct': 0.06790223113266693, 'sideways_tp_mult': 2.363319974604467, 'sideways_tsl_mult': 0.09205025108389081, 'sideways_time_stop': 160, 'sideways_use_sma': True, 'sideways_use_ema': False, 'sideways_use_atr': False, 'sideways_use_adx': False, 'sideways_use_spike': True, 'sideways_rsi_required': True}.
[I 2025-09-01 13:56:23,988] Trial 351 finished with values: [-0.019631943933328677, 0.01993997371160182] and parameters: {'p_sma': 9, 'p_std': 9, 'p_atr': 11, 'p_adx': 11, 'rsi_period': 29, 'ema1': 30, 'ema2': 18, 'slip_atr_k': 0.008844938448366733, 'slip_spread_k': 0.07136102544262048, 'spread_hl_frac': 0.008686900605207045, 'bb_std_mult': 3.2299704356095154, 'rsi_os': 39, 'rsi_ob': 86, 'vol_spike': 0.24916962923865849, 'adx_thresh': 28.982985442133284, 'atr_min_pct': 0.026733198987480652, 'atr_max_pct': 0.12047055824433485, 'tp_mult': 2.0792502601125724, 'tsl_mult': 0.8100577472252134, 'strategy': 'mean_reversion', 'time_stop': 235, 'use_sma': True, 'use_atr': True, 'use_adx': False, 'use_ema': True, 'use_spike': False, 'rsi_required': True, 'edge_k': 0.0959299372973692, 'edge_cap': 0.33751078423325354, 'bull_strategy': 'breakout', 'bull_bb_std_mult': 3.4579330182527848, 'bull_rsi_os': 6, 'bull_rsi_ob': 60, 'bull_adx_thresh': 29.371421690598666, 'bull_atr_min_pct': 0.006042142178823562, 'bull_atr_max_pct': 0.02562073662701255, 'bull_tp_mult': 2.724515370221524, 'bull_tsl_mult': 0.7438493390304259, 'bull_time_stop': 159, 'bull_use_sma': False, 'bull_use_ema': True, 'bull_use_atr': True, 'bull_use_adx': True, 'bull_use_spike': False, 'bull_rsi_required': False, 'bear_strategy': 'breakout', 'bear_bb_std_mult': 3.383082771517718, 'bear_rsi_os': 41, 'bear_rsi_ob': 79, 'bear_adx_thresh': 5.059319265695203, 'bear_atr_min_pct': 0.003942878465997868, 'bear_atr_max_pct': 0.03516280574293799, 'bear_tp_mult': 2.294646426829341, 'bear_tsl_mult': 0.806525185322587, 'bear_time_stop': 231, 'bear_use_sma': True, 'bear_use_ema': True, 'bear_use_atr': False, 'bear_use_adx': False, 'bear_use_spike': False, 'bear_rsi_required': False, 'sideways_strategy': 'mean_reversion', 'sideways_bb_std_mult': 1.606532064913926, 'sideways_rsi_os': 53, 'sideways_rsi_ob': 74, 'sideways_adx_thresh': 19.67894235117755, 'sideways_atr_min_pct': 0.01942439767783958, 'sideways_atr_max_pct': 0.05867799870477164, 'sideways_tp_mult': 2.764171868358602, 'sideways_tsl_mult': 0.2535633296442355, 'sideways_time_stop': 179, 'sideways_use_sma': False, 'sideways_use_ema': False, 'sideways_use_atr': True, 'sideways_use_adx': False, 'sideways_use_spike': True, 'sideways_rsi_required': True}.
[I 2025-09-01 13:56:25,441] Trial 348 finished with values: [-0.08568360383359086, 0.08506313755435585] and parameters: {'p_sma': 35, 'p_std': 36, 'p_atr': 11, 'p_adx': 11, 'rsi_period': 39, 'ema1': 28, 'ema2': 17, 'slip_atr_k': 0.00782743684247951, 'slip_spread_k': 0.7081916682416332, 'spread_hl_frac': 0.04024012625446115, 'bb_std_mult': 0.6680199216095479, 'rsi_os': 40, 'rsi_ob': 86, 'vol_spike': 0.031163807068040214, 'adx_thresh': 23.312525653899215, 'atr_min_pct': 5.0510876274004884e-05, 'atr_max_pct': 0.12032389261995216, 'tp_mult': 2.0976640383491567, 'tsl_mult': 0.812752689353538, 'strategy': 'mean_reversion', 'time_stop': 56, 'use_sma': True, 'use_atr': False, 'use_adx': False, 'use_ema': True, 'use_spike': True, 'rsi_required': True, 'edge_k': 1.7136956787912248, 'edge_cap': 0.9861944604365672, 'bull_strategy': 'breakout', 'bull_bb_std_mult': 1.6499678384856589, 'bull_rsi_os': 6, 'bull_rsi_ob': 75, 'bull_adx_thresh': 29.37278594744213, 'bull_atr_min_pct': 0.010904599781666476, 'bull_atr_max_pct': 0.025466162631612277, 'bull_tp_mult': 2.8524472887246883, 'bull_tsl_mult': 0.8884495401522366, 'bull_time_stop': 153, 'bull_use_sma': False, 'bull_use_ema': True, 'bull_use_atr': True, 'bull_use_adx': True, 'bull_use_spike': True, 'bull_rsi_required': False, 'bear_strategy': 'breakout', 'bear_bb_std_mult': 2.2784433341673753, 'bear_rsi_os': 41, 'bear_rsi_ob': 87, 'bear_adx_thresh': 12.227048911563873, 'bear_atr_min_pct': 0.001453737824710435, 'bear_atr_max_pct': 0.042782634521542774, 'bear_tp_mult': 1.80444841956317, 'bear_tsl_mult': 0.1538562895687497, 'bear_time_stop': 28, 'bear_use_sma': True, 'bear_use_ema': True, 'bear_use_atr': False, 'bear_use_adx': False, 'bear_use_spike': True, 'bear_rsi_required': True, 'sideways_strategy': 'breakout', 'sideways_bb_std_mult': 1.586501949928472, 'sideways_rsi_os': 49, 'sideways_rsi_ob': 48, 'sideways_adx_thresh': 7.570388342714052, 'sideways_atr_min_pct': 0.021021144115291896, 'sideways_atr_max_pct': 0.010273384035687255, 'sideways_tp_mult': 1.1331398009617613, 'sideways_tsl_mult': 0.27080656855921764, 'sideways_time_stop': 178, 'sideways_use_sma': True, 'sideways_use_ema': False, 'sideways_use_atr': False, 'sideways_use_adx': False, 'sideways_use_spike': True, 'sideways_rsi_required': True}.
[I 2025-09-01 13:56:25,981] Trial 350 finished with values: [-1000000000.0, 1000000000.0] and parameters: {'p_sma': 35, 'p_std': 53, 'p_atr': 15, 'p_adx': 11, 'rsi_period': 30, 'ema1': 27, 'ema2': 18, 'slip_atr_k': 0.008408043053776616, 'slip_spread_k': 0.07021710479475143, 'spread_hl_frac': 0.009003764821802453, 'bb_std_mult': 1.6819859513038211, 'rsi_os': 42, 'rsi_ob': 87, 'vol_spike': 0.03160940955358299, 'adx_thresh': 28.13509966496013, 'atr_min_pct': 0.02659971412032618, 'atr_max_pct': 0.14095546403709555, 'tp_mult': 2.919496842136293, 'tsl_mult': 0.6390682967510966, 'strategy': 'mean_reversion', 'time_stop': 238, 'use_sma': True, 'use_atr': True, 'use_adx': False, 'use_ema': True, 'use_spike': True, 'rsi_required': True, 'edge_k': 1.722073991342508, 'edge_cap': 0.3374773350636741, 'bull_strategy': 'breakout', 'bull_bb_std_mult': 3.467231803016279, 'bull_rsi_os': 17, 'bull_rsi_ob': 91, 'bull_adx_thresh': 29.435026055958886, 'bull_atr_min_pct': 0.006205002665458911, 'bull_atr_max_pct': 0.028333514193191425, 'bull_tp_mult': 2.772243988668006, 'bull_tsl_mult': 0.43119632139061237, 'bull_time_stop': 201, 'bull_use_sma': False, 'bull_use_ema': True, 'bull_use_atr': True, 'bull_use_adx': True, 'bull_use_spike': True, 'bull_rsi_required': False, 'bear_strategy': 'breakout', 'bear_bb_std_mult': 3.411595197204509, 'bear_rsi_os': 31, 'bear_rsi_ob': 54, 'bear_adx_thresh': 12.171353673382583, 'bear_atr_min_pct': 0.018144680490824287, 'bear_atr_max_pct': 0.04428684268228212, 'bear_tp_mult': 2.9945266061082956, 'bear_tsl_mult': 0.8075661399482192, 'bear_time_stop': 231, 'bear_use_sma': True, 'bear_use_ema': True, 'bear_use_atr': False, 'bear_use_adx': False, 'bear_use_spike': True, 'bear_rsi_required': True, 'sideways_strategy': 'breakout', 'sideways_bb_std_mult': 1.5957202940083124, 'sideways_rsi_os': 54, 'sideways_rsi_ob': 65, 'sideways_adx_thresh': 19.67916749379745, 'sideways_atr_min_pct': 0.02094924572312262, 'sideways_atr_max_pct': 0.010346019786494104, 'sideways_tp_mult': 2.3338161383875, 'sideways_tsl_mult': 0.8413125699053213, 'sideways_time_stop': 178, 'sideways_use_sma': True, 'sideways_use_ema': False, 'sideways_use_atr': False, 'sideways_use_adx': False, 'sideways_use_spike': True, 'sideways_rsi_required': True}.
