[I 2025-09-01 13:56:26,838] Trial 349 finished with values: [-1000000000.0, 1000000000.0] and parameters: {'p_sma': 35, 'p_std': 53, 'p_atr': 11, 'p_adx': 11, 'rsi_period': 82, 'ema1': 21, 'ema2': 17, 'slip_atr_k': 0.008334017828267249, 'slip_spread_k': 0.8420593691985829, 'spread_hl_frac': 0.04034318451749095, 'bb_std_mult': 1.7689644824784332, 'rsi_os': 42, 'rsi_ob': 72, 'vol_spike': 0.2323056053473741, 'adx_thresh': 32.82205835578228, 'atr_min_pct': 0.00017432180935555812, 'atr_max_pct': 0.12015433818044263, 'tp_mult': 2.086995114737896, 'tsl_mult': 0.856601288060752, 'strategy': 'mean_reversion', 'time_stop': 236, 'use_sma': True, 'use_atr': False, 'use_adx': False, 'use_ema': True, 'use_spike': True, 'rsi_required': True, 'edge_k': 0.10082267935549727, 'edge_cap': 0.9741831616478233, 'bull_strategy': 'breakout', 'bull_bb_std_mult': 1.909548603425076, 'bull_rsi_os': 38, 'bull_rsi_ob': 89, 'bull_adx_thresh': 29.23791358453007, 'bull_atr_min_pct': 0.0060328111794746685, 'bull_atr_max_pct': 0.06804759964654285, 'bull_tp_mult': 2.862068162707457, 'bull_tsl_mult': 0.4360945914110701, 'bull_time_stop': 130, 'bull_use_sma': False, 'bull_use_ema': True, 'bull_use_atr': True, 'bull_use_adx': True, 'bull_use_spike': True, 'bull_rsi_required': False, 'bear_strategy': 'breakout', 'bear_bb_std_mult': 3.3804481346949102, 'bear_rsi_os': 33, 'bear_rsi_ob': 53, 'bear_adx_thresh': 10.860115334488244, 'bear_atr_min_pct': 0.003949668336322993, 'bear_atr_max_pct': 0.1498442988236372, 'bear_tp_mult': 2.302054913572432, 'bear_tsl_mult': 0.0809693942089104, 'bear_time_stop': 73, 'bear_use_sma': True, 'bear_use_ema': True, 'bear_use_atr': False, 'bear_use_adx': False, 'bear_use_spike': True, 'bear_rsi_required': True, 'sideways_strategy': 'breakout', 'sideways_bb_std_mult': 1.6053440391845466, 'sideways_rsi_os': 53, 'sideways_rsi_ob': 48, 'sideways_adx_thresh': 19.796042100272317, 'sideways_atr_min_pct': 0.020981260225839855, 'sideways_atr_max_pct': 0.05036511012509573, 'sideways_tp_mult': 2.6482405063251244, 'sideways_tsl_mult': 0.8401939059244113, 'sideways_time_stop': 178, 'sideways_use_sma': True, 'sideways_use_ema': False, 'sideways_use_atr': False, 'sideways_use_adx': False, 'sideways_use_spike': True, 'sideways_rsi_required': True}.
[I 2025-09-01 13:56:27,559] Trial 352 finished with values: [-1000000000.0, 1000000000.0] and parameters: {'p_sma': 35, 'p_std': 25, 'p_atr': 25, 'p_adx': 13, 'rsi_period': 82, 'ema1': 22, 'ema2': 18, 'slip_atr_k': 0.007234391269223317, 'slip_spread_k': 0.07124999373235212, 'spread_hl_frac': 0.008717668143742955, 'bb_std_mult': 1.9511805867000374, 'rsi_os': 31, 'rsi_ob': 47, 'vol_spike': 0.23238011953729482, 'adx_thresh': 28.8930192895956, 'atr_min_pct': 0.026782370347069703, 'atr_max_pct': 0.14177106699663564, 'tp_mult': 2.2631146736534937, 'tsl_mult': 0.8151459177715542, 'strategy': 'mean_reversion', 'time_stop': 237, 'use_sma': True, 'use_atr': True, 'use_adx': False, 'use_ema': True, 'use_spike': False, 'rsi_required': True, 'edge_k': 1.1524070623840348, 'edge_cap': 0.050798284432712504, 'bull_strategy': 'breakout', 'bull_bb_std_mult': 3.5024064031333575, 'bull_rsi_os': 6, 'bull_rsi_ob': 70, 'bull_adx_thresh': 29.339456805850503, 'bull_atr_min_pct': 0.01078463751779326, 'bull_atr_max_pct': 0.02503693672923528, 'bull_tp_mult': 2.7715838718024206, 'bull_tsl_mult': 0.43195120315460156, 'bull_time_stop': 132, 'bull_use_sma': False, 'bull_use_ema': True, 'bull_use_atr': True, 'bull_use_adx': True, 'bull_use_spike': False, 'bull_rsi_required': False, 'bear_strategy': 'breakout', 'bear_bb_std_mult': 3.3905049739817854, 'bear_rsi_os': 31, 'bear_rsi_ob': 79, 'bear_adx_thresh': 12.227216748730616, 'bear_atr_min_pct': 0.026418919360100764, 'bear_atr_max_pct': 0.14265036690501282, 'bear_tp_mult': 2.298412380023667, 'bear_tsl_mult': 0.16207231282474668, 'bear_time_stop': 233, 'bear_use_sma': True, 'bear_use_ema': True, 'bear_use_atr': False, 'bear_use_adx': False, 'bear_use_spike': False, 'bear_rsi_required': False, 'sideways_strategy': 'breakout', 'sideways_bb_std_mult': 1.60150122418146, 'sideways_rsi_os': 22, 'sideways_rsi_ob': 48, 'sideways_adx_thresh': 31.363527403909735, 'sideways_atr_min_pct': 0.01947607962855774, 'sideways_atr_max_pct': 0.08501231362009795, 'sideways_tp_mult': 1.8937435924776072, 'sideways_tsl_mult': 0.18156404045946722, 'sideways_time_stop': 178, 'sideways_use_sma': False, 'sideways_use_ema': False, 'sideways_use_atr': True, 'sideways_use_adx': True, 'sideways_use_spike': True, 'sideways_rsi_required': True}.
[I 2025-09-01 13:56:27,573] Trial 354 finished with values: [-1000000000.0, 1000000000.0] and parameters: {'p_sma': 15, 'p_std': 9, 'p_atr': 25, 'p_adx': 12, 'rsi_period': 25, 'ema1': 8, 'ema2': 41, 'slip_atr_k': 0.16145696163670065, 'slip_spread_k': 0.07890247663945972, 'spread_hl_frac': 0.003534134984483156, 'bb_std_mult': 1.9494850076332626, 'rsi_os': 39, 'rsi_ob': 49, 'vol_spike': 0.27461713501230034, 'adx_thresh': 33.25793783270397, 'atr_min_pct': 0.024545079196958225, 'atr_max_pct': 0.1333613755758256, 'tp_mult': 1.109273928353184, 'tsl_mult': 0.38409439196246625, 'strategy': 'mean_reversion', 'time_stop': 234, 'use_sma': True, 'use_atr': False, 'use_adx': False, 'use_ema': True, 'use_spike': False, 'rsi_required': False, 'edge_k': 0.9965018805111803, 'edge_cap': 0.3201170467390008, 'bull_strategy': 'mean_reversion', 'bull_bb_std_mult': 1.1600497789613076, 'bull_rsi_os': 33, 'bull_rsi_ob': 54, 'bull_adx_thresh': 28.790327419929923, 'bull_atr_min_pct': 0.0040750051817240035, 'bull_atr_max_pct': 0.023498160063291543, 'bull_tp_mult': 2.9051246601764276, 'bull_tsl_mult': 0.942679786101803, 'bull_time_stop': 131, 'bull_use_sma': True, 'bull_use_ema': False, 'bull_use_atr': True, 'bull_use_adx': True, 'bull_use_spike': False, 'bull_rsi_required': True, 'bear_strategy': 'breakout', 'bear_bb_std_mult': 3.238367160309429, 'bear_rsi_os': 33, 'bear_rsi_ob': 88, 'bear_adx_thresh': 7.936316300334219, 'bear_atr_min_pct': 0.003935409395535639, 'bear_atr_max_pct': 0.04844910159493205, 'bear_tp_mult': 1.5672717386900445, 'bear_tsl_mult': 0.9769995268914031, 'bear_time_stop': 217, 'bear_use_sma': True, 'bear_use_ema': True, 'bear_use_atr': True, 'bear_use_adx': True, 'bear_use_spike': False, 'bear_rsi_required': False, 'sideways_strategy': 'mean_reversion', 'sideways_bb_std_mult': 2.5299237939340857, 'sideways_rsi_os': 40, 'sideways_rsi_ob': 67, 'sideways_adx_thresh': 31.342715306020324, 'sideways_atr_min_pct': 0.019207726523280365, 'sideways_atr_max_pct': 0.05181982755572602, 'sideways_tp_mult': 1.325172891406028, 'sideways_tsl_mult': 0.6333761954746011, 'sideways_time_stop': 281, 'sideways_use_sma': False, 'sideways_use_ema': True, 'sideways_use_atr': True, 'sideways_use_adx': True, 'sideways_use_spike': False, 'sideways_rsi_required': True}.
[I 2025-09-01 13:56:27,588] Trial 355 finished with values: [-1000000000.0, 1000000000.0] and parameters: {'p_sma': 15, 'p_std': 14, 'p_atr': 18, 'p_adx': 14, 'rsi_period': 13, 'ema1': 22, 'ema2': 41, 'slip_atr_k': 0.004014312295048507, 'slip_spread_k': 0.03488367745259488, 'spread_hl_frac': 0.0034427641385708398, 'bb_std_mult': 2.3114312587813233, 'rsi_os': 5, 'rsi_ob': 48, 'vol_spike': 0.251624610678586, 'adx_thresh': 8.65851986325484, 'atr_min_pct': 0.02461981669912957, 'atr_max_pct': 0.13432888002676593, 'tp_mult': 2.982202924945343, 'tsl_mult': 0.7581706477664425, 'strategy': 'mean_reversion', 'time_stop': 15, 'use_sma': True, 'use_atr': False, 'use_adx': True, 'use_ema': True, 'use_spike': False, 'rsi_required': False, 'edge_k': 1.88475351214719, 'edge_cap': 0.3177875778102832, 'bull_strategy': 'mean_reversion', 'bull_bb_std_mult': 1.121397783124092, 'bull_rsi_os': 33, 'bull_rsi_ob': 54, 'bull_adx_thresh': 28.207034812276365, 'bull_atr_min_pct': 0.004016240085911763, 'bull_atr_max_pct': 0.02407600651352933, 'bull_tp_mult': 1.4116296196049374, 'bull_tsl_mult': 0.40085328052346764, 'bull_time_stop': 96, 'bull_use_sma': True, 'bull_use_ema': False, 'bull_use_atr': True, 'bull_use_adx': False, 'bull_use_spike': False, 'bull_rsi_required': True, 'bear_strategy': 'breakout', 'bear_bb_std_mult': 3.525378392069218, 'bear_rsi_os': 39, 'bear_rsi_ob': 79, 'bear_adx_thresh': 5.04521911456394, 'bear_atr_min_pct': 0.025340727137424728, 'bear_atr_max_pct': 0.023689075812945486, 'bear_tp_mult': 1.5762552539813932, 'bear_tsl_mult': 0.16322331286336964, 'bear_time_stop': 17, 'bear_use_sma': True, 'bear_use_ema': True, 'bear_use_atr': True, 'bear_use_adx': True, 'bear_use_spike': False, 'bear_rsi_required': False, 'sideways_strategy': 'mean_reversion', 'sideways_bb_std_mult': 2.530689514755263, 'sideways_rsi_os': 10, 'sideways_rsi_ob': 55, 'sideways_adx_thresh': 6.540919210288989, 'sideways_atr_min_pct': 0.019373668552931, 'sideways_atr_max_pct': 0.08618929595792028, 'sideways_tp_mult': 2.757473012255323, 'sideways_tsl_mult': 0.17797768671833292, 'sideways_time_stop': 173, 'sideways_use_sma': False, 'sideways_use_ema': True, 'sideways_use_atr': True, 'sideways_use_adx': True, 'sideways_use_spike': False, 'sideways_rsi_required': True}.
[I 2025-09-01 13:56:28,307] Trial 356 finished with values: [-1000000000.0, 1000000000.0] and parameters: {'p_sma': 59, 'p_std': 58, 'p_atr': 25, 'p_adx': 14, 'rsi_period': 48, 'ema1': 20, 'ema2': 53, 'slip_atr_k': 0.015535110552242382, 'slip_spread_k': 0.04230368466871787, 'spread_hl_frac': 0.003583648391444045, 'bb_std_mult': 2.3095557808933016, 'rsi_os': 39, 'rsi_ob': 49, 'vol_spike': 0.24476171593402482, 'adx_thresh': 8.400836389474028, 'atr_min_pct': 0.024404546095958792, 'atr_max_pct': 0.133894063247272, 'tp_mult': 1.1102748567585718, 'tsl_mult': 0.7589989477029582, 'strategy': 'mean_reversion', 'time_stop': 246, 'use_sma': True, 'use_atr': False, 'use_adx': True, 'use_ema': True, 'use_spike': False, 'rsi_required': False, 'edge_k': 1.8298945758186391, 'edge_cap': 0.31863631286897665, 'bull_strategy': 'mean_reversion', 'bull_bb_std_mult': 1.1186754145363955, 'bull_rsi_os': 36, 'bull_rsi_ob': 54, 'bull_adx_thresh': 10.0862038365604, 'bull_atr_min_pct': 0.029800550392389775, 'bull_atr_max_pct': 0.02245875181491524, 'bull_tp_mult': 2.7226733561616254, 'bull_tsl_mult': 0.9459146270916348, 'bull_time_stop': 97, 'bull_use_sma': True, 'bull_use_ema': False, 'bull_use_atr': False, 'bull_use_adx': False, 'bull_use_spike': False, 'bull_rsi_required': True, 'bear_strategy': 'mean_reversion', 'bear_bb_std_mult': 3.508121599760265, 'bear_rsi_os': 37, 'bear_rsi_ob': 89, 'bear_adx_thresh': 11.594359305096177, 'bear_atr_min_pct': 0.0036641655724717246, 'bear_atr_max_pct': 0.04773813631007022, 'bear_tp_mult': 2.162618442231189, 'bear_tsl_mult': 0.7647017456114775, 'bear_time_stop': 217, 'bear_use_sma': True, 'bear_use_ema': True, 'bear_use_atr': True, 'bear_use_adx': True, 'bear_use_spike': False, 'bear_rsi_required': False, 'sideways_strategy': 'mean_reversion', 'sideways_bb_std_mult': 2.546000743598953, 'sideways_rsi_os': 8, 'sideways_rsi_ob': 67, 'sideways_adx_thresh': 6.421141340627382, 'sideways_atr_min_pct': 0.026960927885591967, 'sideways_atr_max_pct': 0.05918902361586489, 'sideways_tp_mult': 1.3219370922531128, 'sideways_tsl_mult': 0.24606216860502478, 'sideways_time_stop': 70, 'sideways_use_sma': False, 'sideways_use_ema': True, 'sideways_use_atr': True, 'sideways_use_adx': True, 'sideways_use_spike': False, 'sideways_rsi_required': True}.
[I 2025-09-01 13:56:29,975] Trial 359 finished with values: [-1000000000.0, 1000000000.0] and parameters: {'p_sma': 38, 'p_std': 30, 'p_atr': 24, 'p_adx': 8, 'rsi_period': 65, 'ema1': 21, 'ema2': 19, 'slip_atr_k': 0.054659457365523995, 'slip_spread_k': 0.10547206878491558, 'spread_hl_frac': 0.007954786183669422, 'bb_std_mult': 1.5554056928610114, 'rsi_os': 17, 'rsi_ob': 81, 'vol_spike': 0.23776895677413945, 'adx_thresh': 20.926814960130233, 'atr_min_pct': 0.021138219491906682, 'atr_max_pct': 0.01035176956272156, 'tp_mult': 1.045464570586907, 'tsl_mult': 0.7830149416797628, 'strategy': 'mean_reversion', 'time_stop': 249, 'use_sma': False, 'use_atr': True, 'use_adx': False, 'use_ema': False, 'use_spike': True, 'rsi_required': False, 'edge_k': 0.8113168326678438, 'edge_cap': 0.3539876588388105, 'bull_strategy': 'breakout', 'bull_bb_std_mult': 3.3194798545699467, 'bull_rsi_os': 30, 'bull_rsi_ob': 58, 'bull_adx_thresh': 32.04181116642545, 'bull_atr_min_pct': 0.019683281708746763, 'bull_atr_max_pct': 0.10377980356845135, 'bull_tp_mult': 1.4407217957720335, 'bull_tsl_mult': 0.18980986447464698, 'bull_time_stop': 103, 'bull_use_sma': True, 'bull_use_ema': True, 'bull_use_atr': True, 'bull_use_adx': True, 'bull_use_spike': False, 'bull_rsi_required': True, 'bear_strategy': 'breakout', 'bear_bb_std_mult': 3.4689516252754102, 'bear_rsi_os': 32, 'bear_rsi_ob': 92, 'bear_adx_thresh': 10.571472231010953, 'bear_atr_min_pct': 0.002441068318350097, 'bear_atr_max_pct': 0.13534454998132528, 'bear_tp_mult': 2.2611083822416598, 'bear_tsl_mult': 0.32402940902977817, 'bear_time_stop': 208, 'bear_use_sma': False, 'bear_use_ema': True, 'bear_use_atr': True, 'bear_use_adx': True, 'bear_use_spike': False, 'bear_rsi_required': True, 'sideways_strategy': 'breakout', 'sideways_bb_std_mult': 2.2666093973939963, 'sideways_rsi_os': 50, 'sideways_rsi_ob': 74, 'sideways_adx_thresh': 21.69890580137434, 'sideways_atr_min_pct': 0.020041296309149918, 'sideways_atr_max_pct': 0.06543032876306551, 'sideways_tp_mult': 2.96589623428967, 'sideways_tsl_mult': 0.2605323468805526, 'sideways_time_stop': 186, 'sideways_use_sma': True, 'sideways_use_ema': False, 'sideways_use_atr': True, 'sideways_use_adx': True, 'sideways_use_spike': False, 'sideways_rsi_required': False}.
[I 2025-09-01 13:56:54,723] Trial 353 finished with values: [-1000000000.0, 1000000000.0] and parameters: {'p_sma': 39, 'p_std': 13, 'p_atr': 25, 'p_adx': 12, 'rsi_period': 14, 'ema1': 30, 'ema2': 18, 'slip_atr_k': 0.050781446280931675, 'slip_spread_k': 0.8405014093053425, 'spread_hl_frac': 0.0033457700172276647, 'bb_std_mult': 1.692873595910555, 'rsi_os': 5, 'rsi_ob': 87, 'vol_spike': 0.24919542198456998, 'adx_thresh': 24.171936672948117, 'atr_min_pct': 0.024692081764223873, 'atr_max_pct': 0.1415343080627608, 'tp_mult': 2.908537118589463, 'tsl_mult': 0.7005449444015034, 'strategy': 'mean_reversion', 'time_stop': 14, 'use_sma': True, 'use_atr': True, 'use_adx': False, 'use_ema': True, 'use_spike': False, 'rsi_required': False, 'edge_k': 1.1511022757383065, 'edge_cap': 0.05028462625851393, 'bull_strategy': 'mean_reversion', 'bull_bb_std_mult': 1.1645966109065586, 'bull_rsi_os': 17, 'bull_rsi_ob': 54, 'bull_adx_thresh': 28.151906683806395, 'bull_atr_min_pct': 0.029892180956561896, 'bull_atr_max_pct': 0.029278243533162544, 'bull_tp_mult': 1.4259419059302179, 'bull_tsl_mult': 0.6303305971086325, 'bull_time_stop': 236, 'bull_use_sma': True, 'bull_use_ema': True, 'bull_use_atr': True, 'bull_use_adx': True, 'bull_use_spike': False, 'bull_rsi_required': False, 'bear_strategy': 'breakout', 'bear_bb_std_mult': 3.368978936126612, 'bear_rsi_os': 31, 'bear_rsi_ob': 54, 'bear_adx_thresh': 11.662984587300555, 'bear_atr_min_pct': 0.01841579155153855, 'bear_atr_max_pct': 0.03577842630989186, 'bear_tp_mult': 2.303352507517831, 'bear_tsl_mult': 0.8021775379150463, 'bear_time_stop': 41, 'bear_use_sma': True, 'bear_use_ema': True, 'bear_use_atr': False, 'bear_use_adx': False, 'bear_use_spike': False, 'bear_rsi_required': False, 'sideways_strategy': 'mean_reversion', 'sideways_bb_std_mult': 2.2641212339280425, 'sideways_rsi_os': 53, 'sideways_rsi_ob': 74, 'sideways_adx_thresh': 19.542291351000056, 'sideways_atr_min_pct': 0.02699872313565096, 'sideways_atr_max_pct': 0.05789552777377676, 'sideways_tp_mult': 2.77537807772707, 'sideways_tsl_mult': 0.14561802871620028, 'sideways_time_stop': 219, 'sideways_use_sma': False, 'sideways_use_ema': True, 'sideways_use_atr': True, 'sideways_use_adx': True, 'sideways_use_spike': False, 'sideways_rsi_required': True}.
[I 2025-09-01 13:57:00,520] Trial 358 finished with values: [-1000000000.0, 1000000000.0] and parameters: {'p_sma': 39, 'p_std': 5, 'p_atr': 24, 'p_adx': 12, 'rsi_period': 70, 'ema1': 5, 'ema2': 19, 'slip_atr_k': 0.143819341489765, 'slip_spread_k': 0.098755441627185, 'spread_hl_frac': 0.00769887300508704, 'bb_std_mult': 3.2246409342531273, 'rsi_os': 39, 'rsi_ob': 60, 'vol_spike': 0.24552146837413705, 'adx_thresh': 26.561459096926768, 'atr_min_pct': 0.02729462425769865, 'atr_max_pct': 0.1449321713032242, 'tp_mult': 2.850195683166903, 'tsl_mult': 0.7020612257389168, 'strategy': 'mean_reversion', 'time_stop': 183, 'use_sma': False, 'use_atr': False, 'use_adx': False, 'use_ema': True, 'use_spike': True, 'rsi_required': False, 'edge_k': 1.8262699925971915, 'edge_cap': 0.35692161526276445, 'bull_strategy': 'breakout', 'bull_bb_std_mult': 1.764104639885907, 'bull_rsi_os': 30, 'bull_rsi_ob': 58, 'bull_adx_thresh': 18.703590046770838, 'bull_atr_min_pct': 0.019713419377875865, 'bull_atr_max_pct': 0.029872519435404525, 'bull_tp_mult': 2.700757699773466, 'bull_tsl_mult': 0.7928945783693699, 'bull_time_stop': 102, 'bull_use_sma': True, 'bull_use_ema': True, 'bull_use_atr': False, 'bull_use_adx': True, 'bull_use_spike': False, 'bull_rsi_required': True, 'bear_strategy': 'mean_reversion', 'bear_bb_std_mult': 3.4870320573625677, 'bear_rsi_os': 32, 'bear_rsi_ob': 92, 'bear_adx_thresh': 13.696587586257511, 'bear_atr_min_pct': 0.003497289532969572, 'bear_atr_max_pct': 0.03688006264722559, 'bear_tp_mult': 2.173038919711723, 'bear_tsl_mult': 0.1773453015943296, 'bear_time_stop': 209, 'bear_use_sma': False, 'bear_use_ema': True, 'bear_use_atr': True, 'bear_use_adx': True, 'bear_use_spike': False, 'bear_rsi_required': True, 'sideways_strategy': 'breakout', 'sideways_bb_std_mult': 1.711915691773728, 'sideways_rsi_os': 48, 'sideways_rsi_ob': 68, 'sideways_adx_thresh': 21.562397984936048, 'sideways_atr_min_pct': 0.01697515566577708, 'sideways_atr_max_pct': 0.030031690599722993, 'sideways_tp_mult': 2.7814572386468717, 'sideways_tsl_mult': 0.14378228798677178, 'sideways_time_stop': 185, 'sideways_use_sma': True, 'sideways_use_ema': False, 'sideways_use_atr': True, 'sideways_use_adx': True, 'sideways_use_spike': False, 'sideways_rsi_required': True}.
[I 2025-09-01 13:57:00,536] Trial 357 finished with values: [-1000000000.0, 1000000000.0] and parameters: {'p_sma': 39, 'p_std': 12, 'p_atr': 24, 'p_adx': 14, 'rsi_period': 69, 'ema1': 20, 'ema2': 18, 'slip_atr_k': 0.012130518765034402, 'slip_spread_k': 0.038749712345030767, 'spread_hl_frac': 0.007651286595463186, 'bb_std_mult': 2.306182216092371, 'rsi_os': 5, 'rsi_ob': 68, 'vol_spike': 0.24518739439194462, 'adx_thresh': 8.757959967803998, 'atr_min_pct': 0.023398438097546798, 'atr_max_pct': 0.14475727176448253, 'tp_mult': 1.0405281761396985, 'tsl_mult': 0.7603365035689337, 'strategy': 'mean_reversion', 'time_stop': 248, 'use_sma': False, 'use_atr': False, 'use_adx': True, 'use_ema': True, 'use_spike': True, 'rsi_required': False, 'edge_k': 0.8114046993262753, 'edge_cap': 0.262868651837409, 'bull_strategy': 'mean_reversion', 'bull_bb_std_mult': 1.7619252581840115, 'bull_rsi_os': 24, 'bull_rsi_ob': 56, 'bull_adx_thresh': 9.688176581921768, 'bull_atr_min_pct': 0.029817550249996775, 'bull_atr_max_pct': 0.021262571595981494, 'bull_tp_mult': 2.73814356486413, 'bull_tsl_mult': 0.4728116771591548, 'bull_time_stop': 97, 'bull_use_sma': True, 'bull_use_ema': False, 'bull_use_atr': False, 'bull_use_adx': False, 'bull_use_spike': False, 'bull_rsi_required': True, 'bear_strategy': 'mean_reversion', 'bear_bb_std_mult': 3.5349403452269734, 'bear_rsi_os': 32, 'bear_rsi_ob': 89, 'bear_adx_thresh': 13.576650828999664, 'bear_atr_min_pct': 0.0022871072775657864, 'bear_atr_max_pct': 0.035983150565292873, 'bear_tp_mult': 2.1688545070596104, 'bear_tsl_mult': 0.18014769240996711, 'bear_time_stop': 107, 'bear_use_sma': False, 'bear_use_ema': True, 'bear_use_atr': True, 'bear_use_adx': True, 'bear_use_spike': False, 'bear_rsi_required': True, 'sideways_strategy': 'mean_reversion', 'sideways_bb_std_mult': 2.449112711971759, 'sideways_rsi_os': 50, 'sideways_rsi_ob': 74, 'sideways_adx_thresh': 6.273170998225271, 'sideways_atr_min_pct': 0.017153647285594337, 'sideways_atr_max_pct': 0.057668198649174614, 'sideways_tp_mult': 2.954221729047154, 'sideways_tsl_mult': 0.24961972225658963, 'sideways_time_stop': 172, 'sideways_use_sma': True, 'sideways_use_ema': True, 'sideways_use_atr': True, 'sideways_use_adx': True, 'sideways_use_spike': False, 'sideways_rsi_required': True}.
