[I 2025-09-01 14:28:40,120] Trial 575 finished with values: [-0.022740099386989843, 0.02433064222478521] and parameters: {'p_sma': 33, 'p_std': 48, 'p_atr': 17, 'p_adx': 11, 'rsi_period': 67, 'ema1': 26, 'ema2': 48, 'slip_atr_k': 0.01771616183397256, 'slip_spread_k': 0.3238430203200393, 'spread_hl_frac': 0.005220308750189909, 'bb_std_mult': 1.7621157781509278, 'rsi_os': 8, 'rsi_ob': 81, 'vol_spike': 0.14763439709931958, 'adx_thresh': 25.807721420736097, 'atr_min_pct': 0.026623158493231627, 'atr_max_pct': 0.05027789044286698, 'tp_mult': 1.0949564108085084, 'tsl_mult': 0.05141758346455322, 'strategy': 'breakout', 'time_stop': 160, 'use_sma': False, 'use_atr': True, 'use_adx': False, 'use_ema': True, 'use_spike': True, 'rsi_required': False, 'edge_k': 0.8631930613956118, 'edge_cap': 0.3316283573271097, 'bull_strategy': 'breakout', 'bull_bb_std_mult': 3.249084790005859, 'bull_rsi_os': 46, 'bull_rsi_ob': 75, 'bull_adx_thresh': 30.183011104980373, 'bull_atr_min_pct': 0.020819465742752872, 'bull_atr_max_pct': 0.026683001561602557, 'bull_tp_mult': 2.5661021936505524, 'bull_tsl_mult': 0.9272007366709744, 'bull_time_stop': 96, 'bull_use_sma': True, 'bull_use_ema': True, 'bull_use_atr': True, 'bull_use_adx': False, 'bull_use_spike': False, 'bull_rsi_required': False, 'bear_strategy': 'breakout', 'bear_bb_std_mult': 3.4994391737755954, 'bear_rsi_os': 45, 'bear_rsi_ob': 62, 'bear_adx_thresh': 15.104452762086549, 'bear_atr_min_pct': 0.00369969094242886, 'bear_atr_max_pct': 0.11272210533000245, 'bear_tp_mult': 1.1377277141953837, 'bear_tsl_mult': 0.6349938226507111, 'bear_time_stop': 212, 'bear_use_sma': True, 'bear_use_ema': True, 'bear_use_atr': True, 'bear_use_adx': True, 'bear_use_spike': True, 'bear_rsi_required': True, 'sideways_strategy': 'mean_reversion', 'sideways_bb_std_mult': 1.6745395884584686, 'sideways_rsi_os': 52, 'sideways_rsi_ob': 65, 'sideways_adx_thresh': 22.868487913068318, 'sideways_atr_min_pct': 0.028688567348095086, 'sideways_atr_max_pct': 0.07104190717325834, 'sideways_tp_mult': 1.9492895809036754, 'sideways_tsl_mult': 0.6181706271338812, 'sideways_time_stop': 130, 'sideways_use_sma': True, 'sideways_use_ema': False, 'sideways_use_atr': False, 'sideways_use_adx': False, 'sideways_use_spike': False, 'sideways_rsi_required': True}.
[I 2025-09-01 14:28:40,775] Trial 577 finished with values: [-1000000000.0, 1000000000.0] and parameters: {'p_sma': 36, 'p_std': 49, 'p_atr': 27, 'p_adx': 13, 'rsi_period': 69, 'ema1': 22, 'ema2': 17, 'slip_atr_k': 0.09454452006834038, 'slip_spread_k': 0.011354255007152314, 'spread_hl_frac': 0.029859088581781282, 'bb_std_mult': 1.7771902932680046, 'rsi_os': 40, 'rsi_ob': 66, 'vol_spike': 0.2376933059257506, 'adx_thresh': 24.723141081634857, 'atr_min_pct': 0.011290933417733252, 'atr_max_pct': 0.14015536289843203, 'tp_mult': 2.5753837197002527, 'tsl_mult': 0.7293365863919403, 'strategy': 'mean_reversion', 'time_stop': 250, 'use_sma': False, 'use_atr': True, 'use_adx': True, 'use_ema': True, 'use_spike': True, 'rsi_required': False, 'edge_k': 0.9365503726703569, 'edge_cap': 0.165155449771827, 'bull_strategy': 'breakout', 'bull_bb_std_mult': 3.2193116400438377, 'bull_rsi_os': 46, 'bull_rsi_ob': 56, 'bull_adx_thresh': 30.311902499718432, 'bull_atr_min_pct': 0.003242664131101425, 'bull_atr_max_pct': 0.02666579168030021, 'bull_tp_mult': 2.908825444926512, 'bull_tsl_mult': 0.4170587582811187, 'bull_time_stop': 74, 'bull_use_sma': False, 'bull_use_ema': True, 'bull_use_atr': False, 'bull_use_adx': False, 'bull_use_spike': False, 'bull_rsi_required': False, 'bear_strategy': 'breakout', 'bear_bb_std_mult': 1.8663931268240637, 'bear_rsi_os': 33, 'bear_rsi_ob': 64, 'bear_adx_thresh': 21.130628890225022, 'bear_atr_min_pct': 0.018444118529722497, 'bear_atr_max_pct': 0.04500810560398814, 'bear_tp_mult': 2.1911460322204506, 'bear_tsl_mult': 0.14501600869434123, 'bear_time_stop': 213, 'bear_use_sma': True, 'bear_use_ema': True, 'bear_use_atr': True, 'bear_use_adx': True, 'bear_use_spike': True, 'bear_rsi_required': True, 'sideways_strategy': 'mean_reversion', 'sideways_bb_std_mult': 1.8264145295155618, 'sideways_rsi_os': 30, 'sideways_rsi_ob': 76, 'sideways_adx_thresh': 7.989841193212083, 'sideways_atr_min_pct': 0.012417444543189812, 'sideways_atr_max_pct': 0.10288031305385875, 'sideways_tp_mult': 1.9700540150172954, 'sideways_tsl_mult': 0.29588826436904136, 'sideways_time_stop': 137, 'sideways_use_sma': True, 'sideways_use_ema': False, 'sideways_use_atr': False, 'sideways_use_adx': True, 'sideways_use_spike': True, 'sideways_rsi_required': False}.
[I 2025-09-01 14:28:41,161] Trial 576 finished with values: [-1000000000.0, 1000000000.0] and parameters: {'p_sma': 33, 'p_std': 58, 'p_atr': 23, 'p_adx': 13, 'rsi_period': 69, 'ema1': 22, 'ema2': 40, 'slip_atr_k': 0.09444441794044357, 'slip_spread_k': 0.4279061706781697, 'spread_hl_frac': 0.04359293152814768, 'bb_std_mult': 1.7702309171406472, 'rsi_os': 38, 'rsi_ob': 81, 'vol_spike': 0.05060309405188747, 'adx_thresh': 34.4257781587803, 'atr_min_pct': 0.02764736534530049, 'atr_max_pct': 0.14145422650549197, 'tp_mult': 2.5641363022777446, 'tsl_mult': 0.7893072197730964, 'strategy': 'mean_reversion', 'time_stop': 250, 'use_sma': True, 'use_atr': False, 'use_adx': False, 'use_ema': True, 'use_spike': True, 'rsi_required': False, 'edge_k': 1.6440534815825303, 'edge_cap': 0.25587267036704464, 'bull_strategy': 'breakout', 'bull_bb_std_mult': 0.7287148420534602, 'bull_rsi_os': 41, 'bull_rsi_ob': 75, 'bull_adx_thresh': 21.336602376596975, 'bull_atr_min_pct': 0.022177123912337886, 'bull_atr_max_pct': 0.11068907671253227, 'bull_tp_mult': 2.5500876731208173, 'bull_tsl_mult': 0.8764606410004712, 'bull_time_stop': 74, 'bull_use_sma': True, 'bull_use_ema': True, 'bull_use_atr': True, 'bull_use_adx': True, 'bull_use_spike': False, 'bull_rsi_required': True, 'bear_strategy': 'breakout', 'bear_bb_std_mult': 0.529825372959082, 'bear_rsi_os': 33, 'bear_rsi_ob': 75, 'bear_adx_thresh': 14.733735249576199, 'bear_atr_min_pct': 0.0028199519121071695, 'bear_atr_max_pct': 0.1270410426884981, 'bear_tp_mult': 1.144621896766815, 'bear_tsl_mult': 0.14220629047119293, 'bear_time_stop': 213, 'bear_use_sma': True, 'bear_use_ema': True, 'bear_use_atr': True, 'bear_use_adx': False, 'bear_use_spike': False, 'bear_rsi_required': True, 'sideways_strategy': 'breakout', 'sideways_bb_std_mult': 0.9702716317456495, 'sideways_rsi_os': 21, 'sideways_rsi_ob': 65, 'sideways_adx_thresh': 7.926211916869423, 'sideways_atr_min_pct': 0.028935851830166677, 'sideways_atr_max_pct': 0.06971602728512544, 'sideways_tp_mult': 2.3552691045378595, 'sideways_tsl_mult': 0.6233300158072375, 'sideways_time_stop': 178, 'sideways_use_sma': True, 'sideways_use_ema': False, 'sideways_use_atr': True, 'sideways_use_adx': True, 'sideways_use_spike': True, 'sideways_rsi_required': False}.
[I 2025-09-01 14:28:42,106] Trial 579 finished with values: [-1000000000.0, 1000000000.0] and parameters: {'p_sma': 36, 'p_std': 47, 'p_atr': 23, 'p_adx': 13, 'rsi_period': 67, 'ema1': 25, 'ema2': 23, 'slip_atr_k': 0.015647225190936226, 'slip_spread_k': 0.0871908249832089, 'spread_hl_frac': 0.005434455025728352, 'bb_std_mult': 1.8889273212490656, 'rsi_os': 11, 'rsi_ob': 49, 'vol_spike': 0.23790838449806984, 'adx_thresh': 24.759361028090066, 'atr_min_pct': 0.024919017373309524, 'atr_max_pct': 0.140912599425118, 'tp_mult': 1.1998456956328198, 'tsl_mult': 0.7247136027978084, 'strategy': 'mean_reversion', 'time_stop': 133, 'use_sma': False, 'use_atr': False, 'use_adx': True, 'use_ema': True, 'use_spike': True, 'rsi_required': False, 'edge_k': 1.6670011313236444, 'edge_cap': 0.24991764914708392, 'bull_strategy': 'breakout', 'bull_bb_std_mult': 3.2325129046445724, 'bull_rsi_os': 15, 'bull_rsi_ob': 56, 'bull_adx_thresh': 21.228847546781285, 'bull_atr_min_pct': 0.007635474611670658, 'bull_atr_max_pct': 0.08656964517764908, 'bull_tp_mult': 2.7716743592061652, 'bull_tsl_mult': 0.5982774135129643, 'bull_time_stop': 128, 'bull_use_sma': True, 'bull_use_ema': True, 'bull_use_atr': False, 'bull_use_adx': False, 'bull_use_spike': False, 'bull_rsi_required': True, 'bear_strategy': 'mean_reversion', 'bear_bb_std_mult': 3.4799381476299356, 'bear_rsi_os': 33, 'bear_rsi_ob': 68, 'bear_adx_thresh': 7.731197703497358, 'bear_atr_min_pct': 0.0026173576827686314, 'bear_atr_max_pct': 0.12842118486530632, 'bear_tp_mult': 1.2640025707199323, 'bear_tsl_mult': 0.14740954271919904, 'bear_time_stop': 289, 'bear_use_sma': True, 'bear_use_ema': True, 'bear_use_atr': True, 'bear_use_adx': True, 'bear_use_spike': True, 'bear_rsi_required': True, 'sideways_strategy': 'breakout', 'sideways_bb_std_mult': 2.795000527790872, 'sideways_rsi_os': 50, 'sideways_rsi_ob': 77, 'sideways_adx_thresh': 8.073704912568296, 'sideways_atr_min_pct': 0.026825321631845755, 'sideways_atr_max_pct': 0.07117229609392427, 'sideways_tp_mult': 1.9502213998352498, 'sideways_tsl_mult': 0.8537091259519567, 'sideways_time_stop': 170, 'sideways_use_sma': True, 'sideways_use_ema': False, 'sideways_use_atr': False, 'sideways_use_adx': True, 'sideways_use_spike': True, 'sideways_rsi_required': False}.
[I 2025-09-01 14:29:17,785] Trial 581 finished with values: [-1000000000.0, 1000000000.0] and parameters: {'p_sma': 37, 'p_std': 47, 'p_atr': 7, 'p_adx': 21, 'rsi_period': 12, 'ema1': 22, 'ema2': 38, 'slip_atr_k': 0.01560229610816806, 'slip_spread_k': 0.8521852638668223, 'spread_hl_frac': 0.0453980857696271, 'bb_std_mult': 1.8771512984289414, 'rsi_os': 38, 'rsi_ob': 82, 'vol_spike': 0.18785845355085498, 'adx_thresh': 34.255423258137796, 'atr_min_pct': 0.016630301448413345, 'atr_max_pct': 0.0899552032125427, 'tp_mult': 1.1555727405797105, 'tsl_mult': 0.9328609825542107, 'strategy': 'mean_reversion', 'time_stop': 133, 'use_sma': True, 'use_atr': False, 'use_adx': False, 'use_ema': True, 'use_spike': True, 'rsi_required': False, 'edge_k': 1.0003336304787158, 'edge_cap': 0.4745404752726926, 'bull_strategy': 'mean_reversion', 'bull_bb_std_mult': 0.7186764735183655, 'bull_rsi_os': 41, 'bull_rsi_ob': 57, 'bull_adx_thresh': 21.041487665348892, 'bull_atr_min_pct': 0.005075239696249616, 'bull_atr_max_pct': 0.020157207724759558, 'bull_tp_mult': 2.7719466671699067, 'bull_tsl_mult': 0.4278161687348929, 'bull_time_stop': 128, 'bull_use_sma': True, 'bull_use_ema': True, 'bull_use_atr': True, 'bull_use_adx': True, 'bull_use_spike': True, 'bull_rsi_required': True, 'bear_strategy': 'mean_reversion', 'bear_bb_std_mult': 1.2472458687555599, 'bear_rsi_os': 36, 'bear_rsi_ob': 88, 'bear_adx_thresh': 12.998442894660393, 'bear_atr_min_pct': 0.0026471227379417893, 'bear_atr_max_pct': 0.05025575216475841, 'bear_tp_mult': 2.2242995115528035, 'bear_tsl_mult': 0.07856170979543597, 'bear_time_stop': 236, 'bear_use_sma': False, 'bear_use_ema': True, 'bear_use_atr': True, 'bear_use_adx': True, 'bear_use_spike': False, 'bear_rsi_required': True, 'sideways_strategy': 'breakout', 'sideways_bb_std_mult': 0.9759004727253133, 'sideways_rsi_os': 50, 'sideways_rsi_ob': 68, 'sideways_adx_thresh': 7.767995476684751, 'sideways_atr_min_pct': 0.015437946382180481, 'sideways_atr_max_pct': 0.0751543837277831, 'sideways_tp_mult': 2.6081881849682995, 'sideways_tsl_mult': 0.7879179870028447, 'sideways_time_stop': 171, 'sideways_use_sma': True, 'sideways_use_ema': False, 'sideways_use_atr': True, 'sideways_use_adx': True, 'sideways_use_spike': False, 'sideways_rsi_required': False}.
[I 2025-09-01 14:29:18,595] Trial 582 finished with values: [-1000000000.0, 1000000000.0] and parameters: {'p_sma': 38, 'p_std': 46, 'p_atr': 23, 'p_adx': 24, 'rsi_period': 32, 'ema1': 21, 'ema2': 21, 'slip_atr_k': 0.016208997006813972, 'slip_spread_k': 0.08760537979976418, 'spread_hl_frac': 0.006637822104575211, 'bb_std_mult': 1.8925749218742018, 'rsi_os': 40, 'rsi_ob': 82, 'vol_spike': 0.2861378646899627, 'adx_thresh': 14.713064744411712, 'atr_min_pct': 0.025022667541853, 'atr_max_pct': 0.13631086779095056, 'tp_mult': 1.232710582696263, 'tsl_mult': 0.7566150102355005, 'strategy': 'mean_reversion', 'time_stop': 147, 'use_sma': True, 'use_atr': False, 'use_adx': True, 'use_ema': True, 'use_spike': True, 'rsi_required': False, 'edge_k': 0.537494259529635, 'edge_cap': 0.6637299009299635, 'bull_strategy': 'mean_reversion', 'bull_bb_std_mult': 3.16542862967965, 'bull_rsi_os': 15, 'bull_rsi_ob': 57, 'bull_adx_thresh': 7.839478351421178, 'bull_atr_min_pct': 0.004887997447110329, 'bull_atr_max_pct': 0.01894802863930225, 'bull_tp_mult': 1.1394618833739634, 'bull_tsl_mult': 0.44214044346492215, 'bull_time_stop': 100, 'bull_use_sma': True, 'bull_use_ema': True, 'bull_use_atr': False, 'bull_use_adx': True, 'bull_use_spike': True, 'bull_rsi_required': True, 'bear_strategy': 'mean_reversion', 'bear_bb_std_mult': 1.2459793751371429, 'bear_rsi_os': 36, 'bear_rsi_ob': 88, 'bear_adx_thresh': 25.41451956817808, 'bear_atr_min_pct': 0.002260316290933308, 'bear_atr_max_pct': 0.0504200279268211, 'bear_tp_mult': 2.2261561416594398, 'bear_tsl_mult': 0.1651195770764754, 'bear_time_stop': 5, 'bear_use_sma': False, 'bear_use_ema': True, 'bear_use_atr': True, 'bear_use_adx': True, 'bear_use_spike': False, 'bear_rsi_required': True, 'sideways_strategy': 'breakout', 'sideways_bb_std_mult': 0.8878753343932773, 'sideways_rsi_os': 50, 'sideways_rsi_ob': 67, 'sideways_adx_thresh': 6.563632813251641, 'sideways_atr_min_pct': 0.015111345340902013, 'sideways_atr_max_pct': 0.07764332992311827, 'sideways_tp_mult': 2.8429838892609314, 'sideways_tsl_mult': 0.661089259979293, 'sideways_time_stop': 170, 'sideways_use_sma': True, 'sideways_use_ema': False, 'sideways_use_atr': True, 'sideways_use_adx': True, 'sideways_use_spike': False, 'sideways_rsi_required': True}.
[I 2025-09-01 14:29:19,904] Trial 580 finished with values: [-1000000000.0, 1000000000.0] and parameters: {'p_sma': 14, 'p_std': 58, 'p_atr': 23, 'p_adx': 17, 'rsi_period': 69, 'ema1': 22, 'ema2': 23, 'slip_atr_k': 0.01666297522936823, 'slip_spread_k': 0.011359559072542269, 'spread_hl_frac': 0.006483881601392678, 'bb_std_mult': 1.873178751449032, 'rsi_os': 40, 'rsi_ob': 66, 'vol_spike': 0.17964399148066984, 'adx_thresh': 34.65202311229204, 'atr_min_pct': 0.02485501666741948, 'atr_max_pct': 0.13972600379111838, 'tp_mult': 1.1452897958488186, 'tsl_mult': 0.7262202658257525, 'strategy': 'mean_reversion', 'time_stop': 25, 'use_sma': True, 'use_atr': False, 'use_adx': True, 'use_ema': True, 'use_spike': True, 'rsi_required': False, 'edge_k': 0.5221057926707156, 'edge_cap': 0.6612865054982514, 'bull_strategy': 'mean_reversion', 'bull_bb_std_mult': 3.181544650006902, 'bull_rsi_os': 30, 'bull_rsi_ob': 57, 'bull_adx_thresh': 20.887262760387717, 'bull_atr_min_pct': 0.003043540598426022, 'bull_atr_max_pct': 0.019798558913103784, 'bull_tp_mult': 1.4554584521847027, 'bull_tsl_mult': 0.41886267363737645, 'bull_time_stop': 73, 'bull_use_sma': False, 'bull_use_ema': True, 'bull_use_atr': False, 'bull_use_adx': True, 'bull_use_spike': False, 'bull_rsi_required': True, 'bear_strategy': 'mean_reversion', 'bear_bb_std_mult': 3.461066945669225, 'bear_rsi_os': 33, 'bear_rsi_ob': 88, 'bear_adx_thresh': 12.965780972252773, 'bear_atr_min_pct': 0.014231501426334243, 'bear_atr_max_pct': 0.022848154039870054, 'bear_tp_mult': 2.1748837044706684, 'bear_tsl_mult': 0.07594664423662094, 'bear_time_stop': 190, 'bear_use_sma': True, 'bear_use_ema': True, 'bear_use_atr': True, 'bear_use_adx': True, 'bear_use_spike': False, 'bear_rsi_required': True, 'sideways_strategy': 'breakout', 'sideways_bb_std_mult': 2.793378409570132, 'sideways_rsi_os': 31, 'sideways_rsi_ob': 70, 'sideways_adx_thresh': 7.890757313348811, 'sideways_atr_min_pct': 0.02056250822605208, 'sideways_atr_max_pct': 0.07486801838313978, 'sideways_tp_mult': 2.6273845902411215, 'sideways_tsl_mult': 0.3074784653496, 'sideways_time_stop': 145, 'sideways_use_sma': True, 'sideways_use_ema': False, 'sideways_use_atr': True, 'sideways_use_adx': True, 'sideways_use_spike': True, 'sideways_rsi_required': False}.
[I 2025-09-01 14:29:21,397] Trial 583 finished with values: [-1000000000.0, 1000000000.0] and parameters: {'p_sma': 28, 'p_std': 51, 'p_atr': 27, 'p_adx': 12, 'rsi_period': 32, 'ema1': 21, 'ema2': 38, 'slip_atr_k': 0.045604780753870755, 'slip_spread_k': 0.05370292728014893, 'spread_hl_frac': 0.04524732319335564, 'bb_std_mult': 1.8373914422247708, 'rsi_os': 40, 'rsi_ob': 78, 'vol_spike': 0.18516773178537588, 'adx_thresh': 22.592385966267745, 'atr_min_pct': 0.027176323235054246, 'atr_max_pct': 0.09007603393543526, 'tp_mult': 1.0477463370466247, 'tsl_mult': 0.3782194466967644, 'strategy': 'mean_reversion', 'time_stop': 147, 'use_sma': True, 'use_atr': False, 'use_adx': False, 'use_ema': False, 'use_spike': True, 'rsi_required': True, 'edge_k': 0.9974886190936698, 'edge_cap': 0.8748393084656223, 'bull_strategy': 'mean_reversion', 'bull_bb_std_mult': 2.352189551627736, 'bull_rsi_os': 39, 'bull_rsi_ob': 83, 'bull_adx_thresh': 13.48737819767122, 'bull_atr_min_pct': 0.005104526282587575, 'bull_atr_max_pct': 0.060041645407225626, 'bull_tp_mult': 1.6639259216527504, 'bull_tsl_mult': 0.4350168985464282, 'bull_time_stop': 181, 'bull_use_sma': True, 'bull_use_ema': True, 'bull_use_atr': True, 'bull_use_adx': True, 'bull_use_spike': True, 'bull_rsi_required': True, 'bear_strategy': 'mean_reversion', 'bear_bb_std_mult': 3.4939733554905836, 'bear_rsi_os': 19, 'bear_rsi_ob': 88, 'bear_adx_thresh': 34.33582903299772, 'bear_atr_min_pct': 0.014191048530475748, 'bear_atr_max_pct': 0.02164724790899568, 'bear_tp_mult': 2.353387718510825, 'bear_tsl_mult': 0.9627272316705511, 'bear_time_stop': 197, 'bear_use_sma': False, 'bear_use_ema': True, 'bear_use_atr': True, 'bear_use_adx': True, 'bear_use_spike': False, 'bear_rsi_required': True, 'sideways_strategy': 'breakout', 'sideways_bb_std_mult': 1.5797367045101525, 'sideways_rsi_os': 50, 'sideways_rsi_ob': 67, 'sideways_adx_thresh': 6.524590037196257, 'sideways_atr_min_pct': 0.020444341295795688, 'sideways_atr_max_pct': 0.07596099054192, 'sideways_tp_mult': 1.597378660999484, 'sideways_tsl_mult': 0.9404029054449035, 'sideways_time_stop': 184, 'sideways_use_sma': True, 'sideways_use_ema': False, 'sideways_use_atr': True, 'sideways_use_adx': True, 'sideways_use_spike': False, 'sideways_rsi_required': True}.
[I 2025-09-01 14:29:57,945] Trial 585 finished with values: [-0.28317917384657, 0.28311668761011355] and parameters: {'p_sma': 24, 'p_std': 52, 'p_atr': 27, 'p_adx': 12, 'rsi_period': 63, 'ema1': 21, 'ema2': 15, 'slip_atr_k': 0.003926707399599697, 'slip_spread_k': 0.059848813705421854, 'spread_hl_frac': 0.0416826462271544, 'bb_std_mult': 3.5897679106758407, 'rsi_os': 35, 'rsi_ob': 56, 'vol_spike': 0.20539431101754482, 'adx_thresh': 25.20742127112384, 'atr_min_pct': 0.026813937045962865, 'atr_max_pct': 0.13728315650252917, 'tp_mult': 1.047491465258686, 'tsl_mult': 0.4099455090421329, 'strategy': 'mean_reversion', 'time_stop': 223, 'use_sma': True, 'use_atr': False, 'use_adx': False, 'use_ema': False, 'use_spike': True, 'rsi_required': True, 'edge_k': 0.9261696577287326, 'edge_cap': 0.09887225811616801, 'bull_strategy': 'breakout', 'bull_bb_std_mult': 3.5990397406329704, 'bull_rsi_os': 39, 'bull_rsi_ob': 55, 'bull_adx_thresh': 29.25648934532903, 'bull_atr_min_pct': 0.02501748432941576, 'bull_atr_max_pct': 0.021086846770125848, 'bull_tp_mult': 2.828258640969972, 'bull_tsl_mult': 0.945706953149682, 'bull_time_stop': 82, 'bull_use_sma': False, 'bull_use_ema': False, 'bull_use_atr': True, 'bull_use_adx': True, 'bull_use_spike': False, 'bull_rsi_required': True, 'bear_strategy': 'breakout', 'bear_bb_std_mult': 3.479330598563206, 'bear_rsi_os': 5, 'bear_rsi_ob': 87, 'bear_adx_thresh': 11.79581721602719, 'bear_atr_min_pct': 0.010345341087024739, 'bear_atr_max_pct': 0.09302586632360801, 'bear_tp_mult': 2.343837971176943, 'bear_tsl_mult': 0.12313067745706333, 'bear_time_stop': 104, 'bear_use_sma': True, 'bear_use_ema': False, 'bear_use_atr': False, 'bear_use_adx': True, 'bear_use_spike': False, 'bear_rsi_required': True, 'sideways_strategy': 'breakout', 'sideways_bb_std_mult': 2.0730211539718386, 'sideways_rsi_os': 53, 'sideways_rsi_ob': 66, 'sideways_adx_thresh': 7.026193371378425, 'sideways_atr_min_pct': 5.388891589878583e-05, 'sideways_atr_max_pct': 0.038629793170319275, 'sideways_tp_mult': 2.693535667558046, 'sideways_tsl_mult': 0.31420668450955286, 'sideways_time_stop': 187, 'sideways_use_sma': True, 'sideways_use_ema': False, 'sideways_use_atr': True, 'sideways_use_adx': True, 'sideways_use_spike': False, 'sideways_rsi_required': True}.
