[I 2025-09-01 14:32:44,876] Trial 601 finished with values: [-1000000000.0, 1000000000.0] and parameters: {'p_sma': 39, 'p_std': 45, 'p_atr': 26, 'p_adx': 13, 'rsi_period': 71, 'ema1': 21, 'ema2': 54, 'slip_atr_k': 0.08111880235262933, 'slip_spread_k': 0.05129053450434298, 'spread_hl_frac': 0.005128679077003828, 'bb_std_mult': 1.8080598537187829, 'rsi_os': 46, 'rsi_ob': 83, 'vol_spike': 0.11215483866255566, 'adx_thresh': 25.209772232741585, 'atr_min_pct': 0.00379562593662096, 'atr_max_pct': 0.13830557827200643, 'tp_mult': 1.8874948210563656, 'tsl_mult': 0.9115508471040308, 'strategy': 'mean_reversion', 'time_stop': 197, 'use_sma': False, 'use_atr': False, 'use_adx': False, 'use_ema': True, 'use_spike': True, 'rsi_required': False, 'edge_k': 1.0344288307772804, 'edge_cap': 0.3176777330456117, 'bull_strategy': 'breakout', 'bull_bb_std_mult': 3.2046335670166055, 'bull_rsi_os': 35, 'bull_rsi_ob': 53, 'bull_adx_thresh': 26.0507127346671, 'bull_atr_min_pct': 0.004572737613299336, 'bull_atr_max_pct': 0.024827017040672184, 'bull_tp_mult': 2.9999098488905673, 'bull_tsl_mult': 0.45601280480524875, 'bull_time_stop': 116, 'bull_use_sma': True, 'bull_use_ema': True, 'bull_use_atr': True, 'bull_use_adx': True, 'bull_use_spike': False, 'bull_rsi_required': True, 'bear_strategy': 'mean_reversion', 'bear_bb_std_mult': 1.1326127726167705, 'bear_rsi_os': 34, 'bear_rsi_ob': 89, 'bear_adx_thresh': 12.391597838641431, 'bear_atr_min_pct': 0.01738828395790689, 'bear_atr_max_pct': 0.04489261789588006, 'bear_tp_mult': 2.2120347329898387, 'bear_tsl_mult': 0.2540381297875446, 'bear_time_stop': 239, 'bear_use_sma': True, 'bear_use_ema': True, 'bear_use_atr': True, 'bear_use_adx': True, 'bear_use_spike': False, 'bear_rsi_required': True, 'sideways_strategy': 'breakout', 'sideways_bb_std_mult': 2.9990808389064236, 'sideways_rsi_os': 43, 'sideways_rsi_ob': 70, 'sideways_adx_thresh': 8.690687807008388, 'sideways_atr_min_pct': 0.021427899925248198, 'sideways_atr_max_pct': 0.05299996509296612, 'sideways_tp_mult': 2.996266316560547, 'sideways_tsl_mult': 0.28932153543294753, 'sideways_time_stop': 299, 'sideways_use_sma': True, 'sideways_use_ema': False, 'sideways_use_atr': True, 'sideways_use_adx': True, 'sideways_use_spike': False, 'sideways_rsi_required': True}.
[I 2025-09-01 14:32:45,732] Trial 602 finished with values: [-1000000000.0, 1000000000.0] and parameters: {'p_sma': 34, 'p_std': 44, 'p_atr': 26, 'p_adx': 12, 'rsi_period': 71, 'ema1': 21, 'ema2': 52, 'slip_atr_k': 0.0185496024904489, 'slip_spread_k': 0.6801488009441758, 'spread_hl_frac': 0.005007176522330084, 'bb_std_mult': 1.7974101259581012, 'rsi_os': 42, 'rsi_ob': 58, 'vol_spike': 0.21534195550752688, 'adx_thresh': 16.278865925979872, 'atr_min_pct': 0.00901055900092242, 'atr_max_pct': 0.13857040544634638, 'tp_mult': 1.3168413605111011, 'tsl_mult': 0.9996518309740463, 'strategy': 'mean_reversion', 'time_stop': 56, 'use_sma': False, 'use_atr': False, 'use_adx': False, 'use_ema': False, 'use_spike': True, 'rsi_required': True, 'edge_k': 0.830818573567732, 'edge_cap': 0.31515167908548547, 'bull_strategy': 'breakout', 'bull_bb_std_mult': 1.6512417691906378, 'bull_rsi_os': 35, 'bull_rsi_ob': 53, 'bull_adx_thresh': 30.313791202948472, 'bull_atr_min_pct': 0.004452293462366511, 'bull_atr_max_pct': 0.025336466383538116, 'bull_tp_mult': 2.930189816592883, 'bull_tsl_mult': 0.19623118523910982, 'bull_time_stop': 89, 'bull_use_sma': True, 'bull_use_ema': True, 'bull_use_atr': True, 'bull_use_adx': True, 'bull_use_spike': False, 'bull_rsi_required': True, 'bear_strategy': 'breakout', 'bear_bb_std_mult': 1.135318931442018, 'bear_rsi_os': 34, 'bear_rsi_ob': 59, 'bear_adx_thresh': 12.226867592977866, 'bear_atr_min_pct': 0.02865054617952445, 'bear_atr_max_pct': 0.06978660345716695, 'bear_tp_mult': 2.8254560087927048, 'bear_tsl_mult': 0.7227238439994786, 'bear_time_stop': 229, 'bear_use_sma': True, 'bear_use_ema': True, 'bear_use_atr': False, 'bear_use_adx': True, 'bear_use_spike': False, 'bear_rsi_required': True, 'sideways_strategy': 'breakout', 'sideways_bb_std_mult': 1.6257137203716452, 'sideways_rsi_os': 43, 'sideways_rsi_ob': 61, 'sideways_adx_thresh': 8.5569950048176, 'sideways_atr_min_pct': 0.018181906669831334, 'sideways_atr_max_pct': 0.05279480185500864, 'sideways_tp_mult': 2.730032049842908, 'sideways_tsl_mult': 0.24009253095521815, 'sideways_time_stop': 158, 'sideways_use_sma': True, 'sideways_use_ema': False, 'sideways_use_atr': True, 'sideways_use_adx': True, 'sideways_use_spike': False, 'sideways_rsi_required': True}.
[I 2025-09-01 14:32:46,071] Trial 604 finished with values: [-0.22359719796484168, 0.22339148135374787] and parameters: {'p_sma': 26, 'p_std': 48, 'p_atr': 26, 'p_adx': 10, 'rsi_period': 59, 'ema1': 22, 'ema2': 19, 'slip_atr_k': 0.23649265696062866, 'slip_spread_k': 0.7216252550741462, 'spread_hl_frac': 0.006312561371609932, 'bb_std_mult': 2.214459391591783, 'rsi_os': 38, 'rsi_ob': 86, 'vol_spike': 0.21515462171303837, 'adx_thresh': 32.90854672557849, 'atr_min_pct': 0.025374447214742087, 'atr_max_pct': 0.029485147701365684, 'tp_mult': 2.498077685042601, 'tsl_mult': 0.8174624433705417, 'strategy': 'mean_reversion', 'time_stop': 54, 'use_sma': False, 'use_atr': False, 'use_adx': False, 'use_ema': False, 'use_spike': False, 'rsi_required': True, 'edge_k': 1.046903884569636, 'edge_cap': 0.31892890867001983, 'bull_strategy': 'mean_reversion', 'bull_bb_std_mult': 3.370304400130303, 'bull_rsi_os': 35, 'bull_rsi_ob': 63, 'bull_adx_thresh': 16.537507483114034, 'bull_atr_min_pct': 0.004595888169028996, 'bull_atr_max_pct': 0.11477678372924273, 'bull_tp_mult': 2.13633690882348, 'bull_tsl_mult': 0.6947478483699636, 'bull_time_stop': 114, 'bull_use_sma': True, 'bull_use_ema': False, 'bull_use_atr': True, 'bull_use_adx': False, 'bull_use_spike': False, 'bull_rsi_required': True, 'bear_strategy': 'breakout', 'bear_bb_std_mult': 3.5222470446766785, 'bear_rsi_os': 31, 'bear_rsi_ob': 72, 'bear_adx_thresh': 11.294077781152609, 'bear_atr_min_pct': 0.017686471217823505, 'bear_atr_max_pct': 0.05485922557857316, 'bear_tp_mult': 2.417522145615215, 'bear_tsl_mult': 0.42948714619065775, 'bear_time_stop': 230, 'bear_use_sma': True, 'bear_use_ema': False, 'bear_use_atr': False, 'bear_use_adx': True, 'bear_use_spike': True, 'bear_rsi_required': False, 'sideways_strategy': 'breakout', 'sideways_bb_std_mult': 1.6447284875893842, 'sideways_rsi_os': 49, 'sideways_rsi_ob': 70, 'sideways_adx_thresh': 28.61900768665892, 'sideways_atr_min_pct': 0.000705170302486657, 'sideways_atr_max_pct': 0.12127590520996936, 'sideways_tp_mult': 2.208383650361195, 'sideways_tsl_mult': 0.31203995100675497, 'sideways_time_stop': 259, 'sideways_use_sma': False, 'sideways_use_ema': True, 'sideways_use_atr': False, 'sideways_use_adx': True, 'sideways_use_spike': False, 'sideways_rsi_required': True}.
[I 2025-09-01 14:32:46,912] Trial 606 finished with values: [-1000000000.0, 1000000000.0] and parameters: {'p_sma': 60, 'p_std': 46, 'p_atr': 20, 'p_adx': 12, 'rsi_period': 66, 'ema1': 21, 'ema2': 21, 'slip_atr_k': 0.16300304656424974, 'slip_spread_k': 0.9641939426231088, 'spread_hl_frac': 0.006150000125448207, 'bb_std_mult': 1.6300038897060292, 'rsi_os': 42, 'rsi_ob': 86, 'vol_spike': 0.2231651551278775, 'adx_thresh': 10.080551653484378, 'atr_min_pct': 0.014992182348644262, 'atr_max_pct': 0.13829766342660346, 'tp_mult': 2.5029937997703406, 'tsl_mult': 0.8771986834236376, 'strategy': 'breakout', 'time_stop': 118, 'use_sma': True, 'use_atr': False, 'use_adx': False, 'use_ema': False, 'use_spike': False, 'rsi_required': True, 'edge_k': 0.8308698129030413, 'edge_cap': 0.7749471286836747, 'bull_strategy': 'breakout', 'bull_bb_std_mult': 3.0089226194193417, 'bull_rsi_os': 10, 'bull_rsi_ob': 52, 'bull_adx_thresh': 31.210529425519937, 'bull_atr_min_pct': 0.0035688416823081246, 'bull_atr_max_pct': 0.02334610855582041, 'bull_tp_mult': 2.1488514249208293, 'bull_tsl_mult': 0.5685909261546586, 'bull_time_stop': 109, 'bull_use_sma': True, 'bull_use_ema': True, 'bull_use_atr': True, 'bull_use_adx': True, 'bull_use_spike': False, 'bull_rsi_required': True, 'bear_strategy': 'breakout', 'bear_bb_std_mult': 3.263744383996569, 'bear_rsi_os': 34, 'bear_rsi_ob': 93, 'bear_adx_thresh': 19.977898234767906, 'bear_atr_min_pct': 0.01525929502433502, 'bear_atr_max_pct': 0.05404235275549408, 'bear_tp_mult': 2.2995632649532656, 'bear_tsl_mult': 0.4382039604281033, 'bear_time_stop': 113, 'bear_use_sma': True, 'bear_use_ema': False, 'bear_use_atr': False, 'bear_use_adx': True, 'bear_use_spike': False, 'bear_rsi_required': False, 'sideways_strategy': 'breakout', 'sideways_bb_std_mult': 1.609725062290509, 'sideways_rsi_os': 26, 'sideways_rsi_ob': 66, 'sideways_adx_thresh': 34.51550817457024, 'sideways_atr_min_pct': 0.01923156044497558, 'sideways_atr_max_pct': 0.06332636872449726, 'sideways_tp_mult': 2.54878805112089, 'sideways_tsl_mult': 0.5404035232380767, 'sideways_time_stop': 166, 'sideways_use_sma': False, 'sideways_use_ema': False, 'sideways_use_atr': True, 'sideways_use_adx': True, 'sideways_use_spike': False, 'sideways_rsi_required': True}.
[I 2025-09-01 14:33:24,011] Trial 607 finished with values: [-1000000000.0, 1000000000.0] and parameters: {'p_sma': 37, 'p_std': 37, 'p_atr': 16, 'p_adx': 22, 'rsi_period': 65, 'ema1': 22, 'ema2': 21, 'slip_atr_k': 0.16316626837176437, 'slip_spread_k': 0.03586911633726461, 'spread_hl_frac': 0.011615499900125096, 'bb_std_mult': 1.6322367005618659, 'rsi_os': 17, 'rsi_ob': 86, 'vol_spike': 0.16979953721689883, 'adx_thresh': 32.89112468470083, 'atr_min_pct': 0.017865740705791857, 'atr_max_pct': 0.11514674489501328, 'tp_mult': 1.1960783493704708, 'tsl_mult': 0.2068727625710602, 'strategy': 'breakout', 'time_stop': 223, 'use_sma': True, 'use_atr': True, 'use_adx': False, 'use_ema': False, 'use_spike': False, 'rsi_required': True, 'edge_k': 1.5641237203435248, 'edge_cap': 0.3739589302754737, 'bull_strategy': 'mean_reversion', 'bull_bb_std_mult': 3.269776004792891, 'bull_rsi_os': 35, 'bull_rsi_ob': 70, 'bull_adx_thresh': 30.443188811752574, 'bull_atr_min_pct': 0.0037058707332845507, 'bull_atr_max_pct': 0.048482655198435406, 'bull_tp_mult': 1.2296368907115771, 'bull_tsl_mult': 0.2034507112138681, 'bull_time_stop': 92, 'bull_use_sma': True, 'bull_use_ema': False, 'bull_use_atr': True, 'bull_use_adx': True, 'bull_use_spike': False, 'bull_rsi_required': False, 'bear_strategy': 'breakout', 'bear_bb_std_mult': 3.2464936437116667, 'bear_rsi_os': 17, 'bear_rsi_ob': 81, 'bear_adx_thresh': 13.60194147862569, 'bear_atr_min_pct': 0.028735445165770125, 'bear_atr_max_pct': 0.040786745346980055, 'bear_tp_mult': 2.941210557259233, 'bear_tsl_mult': 0.18199757081928775, 'bear_time_stop': 231, 'bear_use_sma': True, 'bear_use_ema': False, 'bear_use_atr': False, 'bear_use_adx': True, 'bear_use_spike': False, 'bear_rsi_required': False, 'sideways_strategy': 'mean_reversion', 'sideways_bb_std_mult': 1.6319113141074832, 'sideways_rsi_os': 55, 'sideways_rsi_ob': 66, 'sideways_adx_thresh': 31.482012320683886, 'sideways_atr_min_pct': 0.022761158290577704, 'sideways_atr_max_pct': 0.06315731885544201, 'sideways_tp_mult': 2.829535139041737, 'sideways_tsl_mult': 0.30567146192015027, 'sideways_time_stop': 166, 'sideways_use_sma': False, 'sideways_use_ema': False, 'sideways_use_atr': True, 'sideways_use_adx': True, 'sideways_use_spike': False, 'sideways_rsi_required': True}.
[I 2025-09-01 14:33:24,751] Trial 609 finished with values: [-1000000000.0, 1000000000.0] and parameters: {'p_sma': 37, 'p_std': 50, 'p_atr': 28, 'p_adx': 11, 'rsi_period': 65, 'ema1': 20, 'ema2': 21, 'slip_atr_k': 0.10219540356199971, 'slip_spread_k': 0.9663114260643396, 'spread_hl_frac': 0.0009929038854586889, 'bb_std_mult': 2.713328712123599, 'rsi_os': 33, 'rsi_ob': 84, 'vol_spike': 0.125271160322022, 'adx_thresh': 10.089385669080235, 'atr_min_pct': 0.010792402835076445, 'atr_max_pct': 0.1265456135986303, 'tp_mult': 1.0839825781785486, 'tsl_mult': 0.8752260488155144, 'strategy': 'breakout', 'time_stop': 118, 'use_sma': True, 'use_atr': True, 'use_adx': False, 'use_ema': True, 'use_spike': True, 'rsi_required': False, 'edge_k': 0.9622723428447821, 'edge_cap': 0.8426725221149308, 'bull_strategy': 'breakout', 'bull_bb_std_mult': 0.9722357454346475, 'bull_rsi_os': 37, 'bull_rsi_ob': 77, 'bull_adx_thresh': 31.152186585961687, 'bull_atr_min_pct': 0.0036417243134158448, 'bull_atr_max_pct': 0.05693551475912528, 'bull_tp_mult': 1.235519734971434, 'bull_tsl_mult': 0.41686449848041823, 'bull_time_stop': 93, 'bull_use_sma': True, 'bull_use_ema': True, 'bull_use_atr': True, 'bull_use_adx': True, 'bull_use_spike': False, 'bull_rsi_required': False, 'bear_strategy': 'breakout', 'bear_bb_std_mult': 2.981463324757627, 'bear_rsi_os': 21, 'bear_rsi_ob': 77, 'bear_adx_thresh': 10.649322196755179, 'bear_atr_min_pct': 0.024927902647353832, 'bear_atr_max_pct': 0.1337656008140497, 'bear_tp_mult': 1.8282086050625583, 'bear_tsl_mult': 0.21271607954762423, 'bear_time_stop': 204, 'bear_use_sma': True, 'bear_use_ema': True, 'bear_use_atr': True, 'bear_use_adx': False, 'bear_use_spike': False, 'bear_rsi_required': True, 'sideways_strategy': 'mean_reversion', 'sideways_bb_std_mult': 1.735925416155892, 'sideways_rsi_os': 52, 'sideways_rsi_ob': 66, 'sideways_adx_thresh': 34.96089109831763, 'sideways_atr_min_pct': 0.02785745369356739, 'sideways_atr_max_pct': 0.06300030005485198, 'sideways_tp_mult': 2.8145378996738755, 'sideways_tsl_mult': 0.5439850673279282, 'sideways_time_stop': 66, 'sideways_use_sma': True, 'sideways_use_ema': False, 'sideways_use_atr': True, 'sideways_use_adx': True, 'sideways_use_spike': False, 'sideways_rsi_required': True}.
[I 2025-09-01 14:33:25,659] Trial 610 finished with values: [-1000000000.0, 1000000000.0] and parameters: {'p_sma': 35, 'p_std': 49, 'p_atr': 16, 'p_adx': 25, 'rsi_period': 64, 'ema1': 7, 'ema2': 50, 'slip_atr_k': 0.0748301466779202, 'slip_spread_k': 0.12750158954523527, 'spread_hl_frac': 0.008413343831401493, 'bb_std_mult': 1.5497193344467155, 'rsi_os': 34, 'rsi_ob': 84, 'vol_spike': 0.17060518664055513, 'adx_thresh': 23.580902703688754, 'atr_min_pct': 0.013268996949437197, 'atr_max_pct': 0.11446019207302689, 'tp_mult': 2.3622795444211637, 'tsl_mult': 0.6407893114557087, 'strategy': 'breakout', 'time_stop': 67, 'use_sma': True, 'use_atr': True, 'use_adx': False, 'use_ema': True, 'use_spike': True, 'rsi_required': False, 'edge_k': 0.9725681834630003, 'edge_cap': 0.3765510467918991, 'bull_strategy': 'breakout', 'bull_bb_std_mult': 0.9557596423933108, 'bull_rsi_os': 37, 'bull_rsi_ob': 56, 'bull_adx_thresh': 29.802069257819166, 'bull_atr_min_pct': 0.0037541327613487088, 'bull_atr_max_pct': 0.019315631313466954, 'bull_tp_mult': 2.831807274274248, 'bull_tsl_mult': 0.4277578563710714, 'bull_time_stop': 81, 'bull_use_sma': True, 'bull_use_ema': False, 'bull_use_atr': True, 'bull_use_adx': True, 'bull_use_spike': False, 'bull_rsi_required': False, 'bear_strategy': 'breakout', 'bear_bb_std_mult': 2.95563085247459, 'bear_rsi_os': 36, 'bear_rsi_ob': 87, 'bear_adx_thresh': 13.421648401534107, 'bear_atr_min_pct': 0.007612145327213772, 'bear_atr_max_pct': 0.04092013511879794, 'bear_tp_mult': 2.2640366422327225, 'bear_tsl_mult': 0.18550178791692526, 'bear_time_stop': 207, 'bear_use_sma': True, 'bear_use_ema': True, 'bear_use_atr': True, 'bear_use_adx': False, 'bear_use_spike': False, 'bear_rsi_required': True, 'sideways_strategy': 'mean_reversion', 'sideways_bb_std_mult': 1.7905450180321256, 'sideways_rsi_os': 55, 'sideways_rsi_ob': 64, 'sideways_adx_thresh': 31.363194731907747, 'sideways_atr_min_pct': 0.022490121506994244, 'sideways_atr_max_pct': 0.07078372976772444, 'sideways_tp_mult': 2.8161786599868592, 'sideways_tsl_mult': 0.2638402130569403, 'sideways_time_stop': 210, 'sideways_use_sma': True, 'sideways_use_ema': False, 'sideways_use_atr': True, 'sideways_use_adx': True, 'sideways_use_spike': False, 'sideways_rsi_required': True}.
[I 2025-09-01 14:33:26,271] Trial 608 finished with values: [-1000000000.0, 1000000000.0] and parameters: {'p_sma': 31, 'p_std': 42, 'p_atr': 23, 'p_adx': 22, 'rsi_period': 38, 'ema1': 7, 'ema2': 21, 'slip_atr_k': 0.08908458628998218, 'slip_spread_k': 0.7230839553310018, 'spread_hl_frac': 0.01482822482972879, 'bb_std_mult': 1.54817526664781, 'rsi_os': 50, 'rsi_ob': 86, 'vol_spike': 0.2526155199553915, 'adx_thresh': 10.328007599909952, 'atr_min_pct': 0.027006559173589247, 'atr_max_pct': 0.1336477463061062, 'tp_mult': 1.0890904236443788, 'tsl_mult': 0.8179139558201232, 'strategy': 'breakout', 'time_stop': 106, 'use_sma': True, 'use_atr': True, 'use_adx': False, 'use_ema': True, 'use_spike': False, 'rsi_required': False, 'edge_k': 0.8712479051825235, 'edge_cap': 0.33801107766534844, 'bull_strategy': 'mean_reversion', 'bull_bb_std_mult': 3.3882193256462987, 'bull_rsi_os': 9, 'bull_rsi_ob': 81, 'bull_adx_thresh': 31.039343783157012, 'bull_atr_min_pct': 0.029328178085106585, 'bull_atr_max_pct': 0.11397567200897413, 'bull_tp_mult': 1.1033796434080712, 'bull_tsl_mult': 0.5693334974098804, 'bull_time_stop': 82, 'bull_use_sma': True, 'bull_use_ema': False, 'bull_use_atr': True, 'bull_use_adx': False, 'bull_use_spike': False, 'bull_rsi_required': False, 'bear_strategy': 'breakout', 'bear_bb_std_mult': 3.534767996053196, 'bear_rsi_os': 21, 'bear_rsi_ob': 88, 'bear_adx_thresh': 13.392793682707502, 'bear_atr_min_pct': 0.008465752635692584, 'bear_atr_max_pct': 0.04086697028742588, 'bear_tp_mult': 2.279269417349607, 'bear_tsl_mult': 0.4380704525164949, 'bear_time_stop': 113, 'bear_use_sma': True, 'bear_use_ema': False, 'bear_use_atr': True, 'bear_use_adx': True, 'bear_use_spike': True, 'bear_rsi_required': False, 'sideways_strategy': 'mean_reversion', 'sideways_bb_std_mult': 1.7921436449074388, 'sideways_rsi_os': 51, 'sideways_rsi_ob': 66, 'sideways_adx_thresh': 17.07721945786555, 'sideways_atr_min_pct': 0.022577888156955737, 'sideways_atr_max_pct': 0.06273415721133817, 'sideways_tp_mult': 2.5528924954171432, 'sideways_tsl_mult': 0.9563766118013515, 'sideways_time_stop': 179, 'sideways_use_sma': False, 'sideways_use_ema': True, 'sideways_use_atr': False, 'sideways_use_adx': True, 'sideways_use_spike': False, 'sideways_rsi_required': True}.
[I 2025-09-01 14:34:01,868] Trial 611 finished with values: [-1000000000.0, 1000000000.0] and parameters: {'p_sma': 35, 'p_std': 50, 'p_atr': 24, 'p_adx': 11, 'rsi_period': 63, 'ema1': 7, 'ema2': 16, 'slip_atr_k': 0.2457465859223965, 'slip_spread_k': 0.8816111014908793, 'spread_hl_frac': 0.000776424419042656, 'bb_std_mult': 2.7524142306970094, 'rsi_os': 15, 'rsi_ob': 61, 'vol_spike': 0.12313336666002879, 'adx_thresh': 12.644858386601069, 'atr_min_pct': 0.02708141852514364, 'atr_max_pct': 0.12638587271542134, 'tp_mult': 2.354851447180684, 'tsl_mult': 0.7916590053234746, 'strategy': 'mean_reversion', 'time_stop': 206, 'use_sma': True, 'use_atr': True, 'use_adx': False, 'use_ema': True, 'use_spike': True, 'rsi_required': False, 'edge_k': 0.007999574408469878, 'edge_cap': 0.34406140703434623, 'bull_strategy': 'breakout', 'bull_bb_std_mult': 3.3115701172523506, 'bull_rsi_os': 17, 'bull_rsi_ob': 66, 'bull_adx_thresh': 29.73712816647919, 'bull_atr_min_pct': 0.005597212747292829, 'bull_atr_max_pct': 0.055905965494325305, 'bull_tp_mult': 2.8399158363686605, 'bull_tsl_mult': 0.4185238238963055, 'bull_time_stop': 273, 'bull_use_sma': True, 'bull_use_ema': True, 'bull_use_atr': True, 'bull_use_adx': True, 'bull_use_spike': True, 'bull_rsi_required': False, 'bear_strategy': 'breakout', 'bear_bb_std_mult': 1.5001260902951306, 'bear_rsi_os': 36, 'bear_rsi_ob': 74, 'bear_adx_thresh': 13.001046284473805, 'bear_atr_min_pct': 0.0038893052424244633, 'bear_atr_max_pct': 0.02702267445125784, 'bear_tp_mult': 1.0738180446161962, 'bear_tsl_mult': 0.21261510037990933, 'bear_time_stop': 209, 'bear_use_sma': True, 'bear_use_ema': True, 'bear_use_atr': True, 'bear_use_adx': False, 'bear_use_spike': True, 'bear_rsi_required': True, 'sideways_strategy': 'mean_reversion', 'sideways_bb_std_mult': 3.131707073108947, 'sideways_rsi_os': 52, 'sideways_rsi_ob': 65, 'sideways_adx_thresh': 9.671618611359865, 'sideways_atr_min_pct': 0.02777823070617852, 'sideways_atr_max_pct': 0.06973404811895607, 'sideways_tp_mult': 1.4653194101037896, 'sideways_tsl_mult': 0.3432385235644185, 'sideways_time_stop': 180, 'sideways_use_sma': True, 'sideways_use_ema': False, 'sideways_use_atr': False, 'sideways_use_adx': True, 'sideways_use_spike': False, 'sideways_rsi_required': True}.
