[I 2025-09-01 14:20:45,877] Trial 525 finished with values: [-1000000000.0, 1000000000.0] and parameters: {'p_sma': 36, 'p_std': 48, 'p_atr': 23, 'p_adx': 22, 'rsi_period': 33, 'ema1': 21, 'ema2': 49, 'slip_atr_k': 0.009079279628454093, 'slip_spread_k': 0.1080062646136551, 'spread_hl_frac': 0.014110250842938122, 'bb_std_mult': 2.174151228035593, 'rsi_os': 40, 'rsi_ob': 52, 'vol_spike': 0.23576679680343846, 'adx_thresh': 23.12050994296633, 'atr_min_pct': 0.02538536997581586, 'atr_max_pct': 0.05358202845963472, 'tp_mult': 1.1541634164744283, 'tsl_mult': 0.7306352428298691, 'strategy': 'mean_reversion', 'time_stop': 246, 'use_sma': True, 'use_atr': False, 'use_adx': True, 'use_ema': True, 'use_spike': False, 'rsi_required': True, 'edge_k': 0.9543351084241564, 'edge_cap': 0.5317995009841913, 'bull_strategy': 'breakout', 'bull_bb_std_mult': 3.1455193499007073, 'bull_rsi_os': 8, 'bull_rsi_ob': 82, 'bull_adx_thresh': 29.945868598906806, 'bull_atr_min_pct': 0.015591100598631332, 'bull_atr_max_pct': 0.1346951484741376, 'bull_tp_mult': 2.8807868606829614, 'bull_tsl_mult': 0.4323749879135894, 'bull_time_stop': 78, 'bull_use_sma': True, 'bull_use_ema': False, 'bull_use_atr': False, 'bull_use_adx': False, 'bull_use_spike': True, 'bull_rsi_required': True, 'bear_strategy': 'breakout', 'bear_bb_std_mult': 3.0083961943150173, 'bear_rsi_os': 32, 'bear_rsi_ob': 84, 'bear_adx_thresh': 12.2487994440978, 'bear_atr_min_pct': 0.009686199782679952, 'bear_atr_max_pct': 0.09978206385982794, 'bear_tp_mult': 2.1129380415790875, 'bear_tsl_mult': 0.895830080695498, 'bear_time_stop': 279, 'bear_use_sma': True, 'bear_use_ema': False, 'bear_use_atr': False, 'bear_use_adx': False, 'bear_use_spike': False, 'bear_rsi_required': False, 'sideways_strategy': 'breakout', 'sideways_bb_std_mult': 1.6928997732059994, 'sideways_rsi_os': 45, 'sideways_rsi_ob': 69, 'sideways_adx_thresh': 5.001893368622699, 'sideways_atr_min_pct': 0.01964375323518823, 'sideways_atr_max_pct': 0.06035064486825363, 'sideways_tp_mult': 1.8795253156757818, 'sideways_tsl_mult': 0.3186479474034187, 'sideways_time_stop': 183, 'sideways_use_sma': False, 'sideways_use_ema': False, 'sideways_use_atr': True, 'sideways_use_adx': True, 'sideways_use_spike': False, 'sideways_rsi_required': True}.
[I 2025-09-01 14:20:47,192] Trial 522 finished with values: [-1000000000.0, 1000000000.0] and parameters: {'p_sma': 36, 'p_std': 48, 'p_atr': 16, 'p_adx': 11, 'rsi_period': 72, 'ema1': 7, 'ema2': 18, 'slip_atr_k': 0.009891397420005327, 'slip_spread_k': 0.10597233139684027, 'spread_hl_frac': 0.005151604555655573, 'bb_std_mult': 0.6195580027929786, 'rsi_os': 40, 'rsi_ob': 81, 'vol_spike': 0.23611953494866153, 'adx_thresh': 12.59413766930222, 'atr_min_pct': 0.025621778917936378, 'atr_max_pct': 0.09232683591318414, 'tp_mult': 1.1083994492293798, 'tsl_mult': 0.8022741687347191, 'strategy': 'mean_reversion', 'time_stop': 12, 'use_sma': True, 'use_atr': False, 'use_adx': True, 'use_ema': True, 'use_spike': False, 'rsi_required': False, 'edge_k': 1.3151941577283026, 'edge_cap': 0.4094178938546638, 'bull_strategy': 'mean_reversion', 'bull_bb_std_mult': 3.185422578267741, 'bull_rsi_os': 12, 'bull_rsi_ob': 81, 'bull_adx_thresh': 11.045352260765453, 'bull_atr_min_pct': 0.01562875271461636, 'bull_atr_max_pct': 0.08370753712228596, 'bull_tp_mult': 2.291841423629753, 'bull_tsl_mult': 0.37346645430170067, 'bull_time_stop': 71, 'bull_use_sma': True, 'bull_use_ema': True, 'bull_use_atr': False, 'bull_use_adx': True, 'bull_use_spike': False, 'bull_rsi_required': True, 'bear_strategy': 'breakout', 'bear_bb_std_mult': 2.170063774533922, 'bear_rsi_os': 31, 'bear_rsi_ob': 76, 'bear_adx_thresh': 11.438922095127632, 'bear_atr_min_pct': 0.009744345006585825, 'bear_atr_max_pct': 0.09919641975428276, 'bear_tp_mult': 2.314069849714276, 'bear_tsl_mult': 0.14835242456081826, 'bear_time_stop': 209, 'bear_use_sma': False, 'bear_use_ema': True, 'bear_use_atr': False, 'bear_use_adx': False, 'bear_use_spike': False, 'bear_rsi_required': False, 'sideways_strategy': 'breakout', 'sideways_bb_std_mult': 1.7062400015328276, 'sideways_rsi_os': 50, 'sideways_rsi_ob': 59, 'sideways_adx_thresh': 5.0555936883416175, 'sideways_atr_min_pct': 0.02138573755064914, 'sideways_atr_max_pct': 0.07058974232790562, 'sideways_tp_mult': 2.784629195080773, 'sideways_tsl_mult': 0.0019529815377676285, 'sideways_time_stop': 179, 'sideways_use_sma': False, 'sideways_use_ema': False, 'sideways_use_atr': True, 'sideways_use_adx': True, 'sideways_use_spike': False, 'sideways_rsi_required': True}.
[I 2025-09-01 14:20:47,194] Trial 523 finished with values: [-1000000000.0, 1000000000.0] and parameters: {'p_sma': 10, 'p_std': 48, 'p_atr': 24, 'p_adx': 11, 'rsi_period': 70, 'ema1': 22, 'ema2': 12, 'slip_atr_k': 0.021278683577479543, 'slip_spread_k': 0.10751507653640416, 'spread_hl_frac': 0.004779715377281166, 'bb_std_mult': 1.0414883532298589, 'rsi_os': 40, 'rsi_ob': 60, 'vol_spike': 0.23379582313601863, 'adx_thresh': 29.52670873978775, 'atr_min_pct': 0.025176793066444894, 'atr_max_pct': 0.10176163312140192, 'tp_mult': 1.1787016979965215, 'tsl_mult': 0.42992913624031615, 'strategy': 'mean_reversion', 'time_stop': 251, 'use_sma': True, 'use_atr': False, 'use_adx': True, 'use_ema': True, 'use_spike': False, 'rsi_required': False, 'edge_k': 1.116503797354446, 'edge_cap': 0.463549382253775, 'bull_strategy': 'mean_reversion', 'bull_bb_std_mult': 3.3786993359726543, 'bull_rsi_os': 42, 'bull_rsi_ob': 54, 'bull_adx_thresh': 10.279839749801859, 'bull_atr_min_pct': 0.004841735392366166, 'bull_atr_max_pct': 0.13447411858353117, 'bull_tp_mult': 2.8539111096323033, 'bull_tsl_mult': 0.8592856681431994, 'bull_time_stop': 141, 'bull_use_sma': True, 'bull_use_ema': True, 'bull_use_atr': False, 'bull_use_adx': True, 'bull_use_spike': False, 'bull_rsi_required': True, 'bear_strategy': 'breakout', 'bear_bb_std_mult': 3.4580122611067856, 'bear_rsi_os': 31, 'bear_rsi_ob': 91, 'bear_adx_thresh': 11.604536326071292, 'bear_atr_min_pct': 0.004540464432599138, 'bear_atr_max_pct': 0.10138495165672581, 'bear_tp_mult': 2.9151158253717857, 'bear_tsl_mult': 0.2883957608720068, 'bear_time_stop': 210, 'bear_use_sma': False, 'bear_use_ema': True, 'bear_use_atr': False, 'bear_use_adx': False, 'bear_use_spike': False, 'bear_rsi_required': False, 'sideways_strategy': 'breakout', 'sideways_bb_std_mult': 3.397726271291133, 'sideways_rsi_os': 46, 'sideways_rsi_ob': 69, 'sideways_adx_thresh': 10.12755753566533, 'sideways_atr_min_pct': 0.02134597072150598, 'sideways_atr_max_pct': 0.0709871929020912, 'sideways_tp_mult': 2.778581238190433, 'sideways_tsl_mult': 0.24425491288381926, 'sideways_time_stop': 181, 'sideways_use_sma': False, 'sideways_use_ema': False, 'sideways_use_atr': True, 'sideways_use_adx': True, 'sideways_use_spike': False, 'sideways_rsi_required': True}.
[I 2025-09-01 14:20:47,456] Trial 524 finished with values: [-1000000000.0, 1000000000.0] and parameters: {'p_sma': 36, 'p_std': 41, 'p_atr': 26, 'p_adx': 11, 'rsi_period': 63, 'ema1': 22, 'ema2': 16, 'slip_atr_k': 0.008133058487914294, 'slip_spread_k': 0.26858747174051223, 'spread_hl_frac': 0.00468674612563275, 'bb_std_mult': 1.584302237656828, 'rsi_os': 39, 'rsi_ob': 81, 'vol_spike': 0.2354744290039234, 'adx_thresh': 7.734792551497556, 'atr_min_pct': 0.025592830458224643, 'atr_max_pct': 0.1331919037292107, 'tp_mult': 1.1504032314600312, 'tsl_mult': 0.7980055433087923, 'strategy': 'mean_reversion', 'time_stop': 247, 'use_sma': True, 'use_atr': False, 'use_adx': True, 'use_ema': True, 'use_spike': False, 'rsi_required': True, 'edge_k': 0.9541045586877758, 'edge_cap': 0.38303937428927953, 'bull_strategy': 'mean_reversion', 'bull_bb_std_mult': 2.8942667959369097, 'bull_rsi_os': 42, 'bull_rsi_ob': 54, 'bull_adx_thresh': 19.444417951633522, 'bull_atr_min_pct': 0.009047791625240706, 'bull_atr_max_pct': 0.03085666516325382, 'bull_tp_mult': 2.856699419980189, 'bull_tsl_mult': 0.43322793176955715, 'bull_time_stop': 143, 'bull_use_sma': True, 'bull_use_ema': False, 'bull_use_atr': False, 'bull_use_adx': True, 'bull_use_spike': False, 'bull_rsi_required': True, 'bear_strategy': 'breakout', 'bear_bb_std_mult': 3.4493276715086805, 'bear_rsi_os': 14, 'bear_rsi_ob': 90, 'bear_adx_thresh': 12.203100310082657, 'bear_atr_min_pct': 0.0044529177531844825, 'bear_atr_max_pct': 0.09961353098957643, 'bear_tp_mult': 2.116304325877807, 'bear_tsl_mult': 0.8896643406810034, 'bear_time_stop': 115, 'bear_use_sma': False, 'bear_use_ema': False, 'bear_use_atr': False, 'bear_use_adx': False, 'bear_use_spike': False, 'bear_rsi_required': False, 'sideways_strategy': 'breakout', 'sideways_bb_std_mult': 1.6814931956427943, 'sideways_rsi_os': 14, 'sideways_rsi_ob': 67, 'sideways_adx_thresh': 6.4156098899728615, 'sideways_atr_min_pct': 0.021174019861040186, 'sideways_atr_max_pct': 0.07253492650842, 'sideways_tp_mult': 2.8117082503506623, 'sideways_tsl_mult': 0.32395401275245833, 'sideways_time_stop': 181, 'sideways_use_sma': False, 'sideways_use_ema': False, 'sideways_use_atr': True, 'sideways_use_adx': True, 'sideways_use_spike': False, 'sideways_rsi_required': True}.
[I 2025-09-01 14:21:24,903] Trial 526 finished with values: [-0.04665082389666675, 0.04634654123015116] and parameters: {'p_sma': 36, 'p_std': 41, 'p_atr': 24, 'p_adx': 13, 'rsi_period': 19, 'ema1': 29, 'ema2': 22, 'slip_atr_k': 0.005081175306792959, 'slip_spread_k': 0.06436960171926397, 'spread_hl_frac': 0.006278419399481639, 'bb_std_mult': 1.6021046827589056, 'rsi_os': 10, 'rsi_ob': 83, 'vol_spike': 0.23579527352351612, 'adx_thresh': 8.06375598455996, 'atr_min_pct': 0.025839809252168763, 'atr_max_pct': 0.10360652856461625, 'tp_mult': 1.1112886482654074, 'tsl_mult': 0.8032379941285792, 'strategy': 'mean_reversion', 'time_stop': 249, 'use_sma': True, 'use_atr': False, 'use_adx': False, 'use_ema': True, 'use_spike': False, 'rsi_required': False, 'edge_k': 0.9202507730863575, 'edge_cap': 0.3808595811659674, 'bull_strategy': 'breakout', 'bull_bb_std_mult': 3.363438330272012, 'bull_rsi_os': 29, 'bull_rsi_ob': 55, 'bull_adx_thresh': 10.92113533830347, 'bull_atr_min_pct': 0.004218892922305696, 'bull_atr_max_pct': 0.09688495510457222, 'bull_tp_mult': 2.8471985335110515, 'bull_tsl_mult': 0.2069434511881954, 'bull_time_stop': 179, 'bull_use_sma': True, 'bull_use_ema': True, 'bull_use_atr': True, 'bull_use_adx': True, 'bull_use_spike': False, 'bull_rsi_required': True, 'bear_strategy': 'breakout', 'bear_bb_std_mult': 2.148833148258325, 'bear_rsi_os': 46, 'bear_rsi_ob': 90, 'bear_adx_thresh': 13.363360789408022, 'bear_atr_min_pct': 0.0029541316225339858, 'bear_atr_max_pct': 0.04860184727437398, 'bear_tp_mult': 2.42685495112826, 'bear_tsl_mult': 0.14512343011913686, 'bear_time_stop': 97, 'bear_use_sma': True, 'bear_use_ema': True, 'bear_use_atr': True, 'bear_use_adx': True, 'bear_use_spike': False, 'bear_rsi_required': False, 'sideways_strategy': 'breakout', 'sideways_bb_std_mult': 1.559541714096226, 'sideways_rsi_os': 54, 'sideways_rsi_ob': 46, 'sideways_adx_thresh': 6.504915760813813, 'sideways_atr_min_pct': 0.020419318777322597, 'sideways_atr_max_pct': 0.07119510108723558, 'sideways_tp_mult': 2.8210775510279165, 'sideways_tsl_mult': 0.1789410483092575, 'sideways_time_stop': 166, 'sideways_use_sma': False, 'sideways_use_ema': False, 'sideways_use_atr': True, 'sideways_use_adx': True, 'sideways_use_spike': False, 'sideways_rsi_required': True}.
[I 2025-09-01 14:21:26,192] Trial 529 finished with values: [-1000000000.0, 1000000000.0] and parameters: {'p_sma': 23, 'p_std': 43, 'p_atr': 26, 'p_adx': 23, 'rsi_period': 51, 'ema1': 18, 'ema2': 21, 'slip_atr_k': 0.07895464477690156, 'slip_spread_k': 0.0632542615142575, 'spread_hl_frac': 0.03481168752831855, 'bb_std_mult': 1.8983232001699806, 'rsi_os': 37, 'rsi_ob': 83, 'vol_spike': 0.22830265049413687, 'adx_thresh': 25.42001186857954, 'atr_min_pct': 0.010259532125431493, 'atr_max_pct': 0.12701204890664647, 'tp_mult': 2.30822079010048, 'tsl_mult': 0.7526818521556934, 'strategy': 'mean_reversion', 'time_stop': 240, 'use_sma': False, 'use_atr': True, 'use_adx': False, 'use_ema': True, 'use_spike': True, 'rsi_required': False, 'edge_k': 1.5345686979616056, 'edge_cap': 0.3319073929577083, 'bull_strategy': 'breakout', 'bull_bb_std_mult': 3.2892633903950417, 'bull_rsi_os': 35, 'bull_rsi_ob': 55, 'bull_adx_thresh': 29.4137178593044, 'bull_atr_min_pct': 0.021315517470960738, 'bull_atr_max_pct': 0.02495591176425325, 'bull_tp_mult': 2.830725607812745, 'bull_tsl_mult': 0.3162550704580064, 'bull_time_stop': 84, 'bull_use_sma': True, 'bull_use_ema': True, 'bull_use_atr': True, 'bull_use_adx': False, 'bull_use_spike': True, 'bull_rsi_required': True, 'bear_strategy': 'breakout', 'bear_bb_std_mult': 3.5985253551474843, 'bear_rsi_os': 16, 'bear_rsi_ob': 80, 'bear_adx_thresh': 13.08811897174037, 'bear_atr_min_pct': 0.0028249918745099807, 'bear_atr_max_pct': 0.049374088299860446, 'bear_tp_mult': 2.256805935020736, 'bear_tsl_mult': 0.1663657161909854, 'bear_time_stop': 222, 'bear_use_sma': True, 'bear_use_ema': True, 'bear_use_atr': True, 'bear_use_adx': True, 'bear_use_spike': True, 'bear_rsi_required': True, 'sideways_strategy': 'mean_reversion', 'sideways_bb_std_mult': 1.3427900247823399, 'sideways_rsi_os': 48, 'sideways_rsi_ob': 63, 'sideways_adx_thresh': 8.986989386113889, 'sideways_atr_min_pct': 0.025851851156278624, 'sideways_atr_max_pct': 0.06593455239144505, 'sideways_tp_mult': 1.0934733188089794, 'sideways_tsl_mult': 0.17832791461866415, 'sideways_time_stop': 163, 'sideways_use_sma': True, 'sideways_use_ema': False, 'sideways_use_atr': False, 'sideways_use_adx': True, 'sideways_use_spike': True, 'sideways_rsi_required': False}.
[I 2025-09-01 14:21:26,471] Trial 527 finished with values: [-1000000000.0, 1000000000.0] and parameters: {'p_sma': 35, 'p_std': 43, 'p_atr': 26, 'p_adx': 23, 'rsi_period': 68, 'ema1': 30, 'ema2': 21, 'slip_atr_k': 0.004949506446847414, 'slip_spread_k': 0.2418586786714172, 'spread_hl_frac': 0.03644797731674636, 'bb_std_mult': 2.5470460833582766, 'rsi_os': 10, 'rsi_ob': 83, 'vol_spike': 0.22688458050295324, 'adx_thresh': 27.42171949241185, 'atr_min_pct': 0.02623383335557571, 'atr_max_pct': 0.12640030154938514, 'tp_mult': 1.0990527701737312, 'tsl_mult': 0.030518161481595474, 'strategy': 'mean_reversion', 'time_stop': 241, 'use_sma': False, 'use_atr': True, 'use_adx': False, 'use_ema': True, 'use_spike': True, 'rsi_required': False, 'edge_k': 1.9509412911836959, 'edge_cap': 0.332205687740517, 'bull_strategy': 'breakout', 'bull_bb_std_mult': 3.300311522413637, 'bull_rsi_os': 44, 'bull_rsi_ob': 55, 'bull_adx_thresh': 29.080114136096167, 'bull_atr_min_pct': 0.0024428364441640427, 'bull_atr_max_pct': 0.12176529567483466, 'bull_tp_mult': 2.7062456724301267, 'bull_tsl_mult': 0.621822823218095, 'bull_time_stop': 113, 'bull_use_sma': True, 'bull_use_ema': True, 'bull_use_atr': True, 'bull_use_adx': False, 'bull_use_spike': True, 'bull_rsi_required': True, 'bear_strategy': 'breakout', 'bear_bb_std_mult': 3.596123873039371, 'bear_rsi_os': 35, 'bear_rsi_ob': 47, 'bear_adx_thresh': 9.907084173350695, 'bear_atr_min_pct': 0.027339349796669847, 'bear_atr_max_pct': 0.04205969203009924, 'bear_tp_mult': 2.2562488444185824, 'bear_tsl_mult': 0.17047365883822363, 'bear_time_stop': 222, 'bear_use_sma': True, 'bear_use_ema': True, 'bear_use_atr': True, 'bear_use_adx': True, 'bear_use_spike': True, 'bear_rsi_required': True, 'sideways_strategy': 'mean_reversion', 'sideways_bb_std_mult': 1.5623564500872122, 'sideways_rsi_os': 31, 'sideways_rsi_ob': 79, 'sideways_adx_thresh': 8.643483868059116, 'sideways_atr_min_pct': 0.020426907372265456, 'sideways_atr_max_pct': 0.03303305902453294, 'sideways_tp_mult': 2.497345925383474, 'sideways_tsl_mult': 0.18553456050786957, 'sideways_time_stop': 295, 'sideways_use_sma': True, 'sideways_use_ema': False, 'sideways_use_atr': False, 'sideways_use_adx': True, 'sideways_use_spike': True, 'sideways_rsi_required': False}.
[I 2025-09-01 14:21:26,710] Trial 528 finished with values: [-0.04112669692672277, 0.04076007158751063] and parameters: {'p_sma': 18, 'p_std': 19, 'p_atr': 26, 'p_adx': 23, 'rsi_period': 78, 'ema1': 30, 'ema2': 53, 'slip_atr_k': 0.14223693144633848, 'slip_spread_k': 0.4524665976799998, 'spread_hl_frac': 0.006680170172477016, 'bb_std_mult': 1.8268622125827194, 'rsi_os': 26, 'rsi_ob': 83, 'vol_spike': 0.22662716121444593, 'adx_thresh': 27.447458684456127, 'atr_min_pct': 0.026719252179363835, 'atr_max_pct': 0.13661327002849538, 'tp_mult': 2.7797526619056447, 'tsl_mult': 0.07636079802447848, 'strategy': 'mean_reversion', 'time_stop': 239, 'use_sma': False, 'use_atr': True, 'use_adx': False, 'use_ema': True, 'use_spike': True, 'rsi_required': False, 'edge_k': 0.9157497393632639, 'edge_cap': 0.3327227841160005, 'bull_strategy': 'breakout', 'bull_bb_std_mult': 3.3065153439478334, 'bull_rsi_os': 44, 'bull_rsi_ob': 78, 'bull_adx_thresh': 29.218658044393372, 'bull_atr_min_pct': 0.007117318380848595, 'bull_atr_max_pct': 0.02433238198400015, 'bull_tp_mult': 2.710465625594044, 'bull_tsl_mult': 0.3135789112161551, 'bull_time_stop': 87, 'bull_use_sma': True, 'bull_use_ema': True, 'bull_use_atr': True, 'bull_use_adx': False, 'bull_use_spike': True, 'bull_rsi_required': True, 'bear_strategy': 'breakout', 'bear_bb_std_mult': 3.597726635075318, 'bear_rsi_os': 46, 'bear_rsi_ob': 89, 'bear_adx_thresh': 30.06034440335786, 'bear_atr_min_pct': 0.0029100470446357172, 'bear_atr_max_pct': 0.04869065416742338, 'bear_tp_mult': 2.2505448475915766, 'bear_tsl_mult': 0.16506649979734545, 'bear_time_stop': 96, 'bear_use_sma': True, 'bear_use_ema': True, 'bear_use_atr': True, 'bear_use_adx': True, 'bear_use_spike': True, 'bear_rsi_required': True, 'sideways_strategy': 'mean_reversion', 'sideways_bb_std_mult': 1.5657366649580695, 'sideways_rsi_os': 48, 'sideways_rsi_ob': 63, 'sideways_adx_thresh': 9.063049217256129, 'sideways_atr_min_pct': 0.020397144947666854, 'sideways_atr_max_pct': 0.032548570791149506, 'sideways_tp_mult': 1.1018555667301366, 'sideways_tsl_mult': 0.18818186548291027, 'sideways_time_stop': 167, 'sideways_use_sma': True, 'sideways_use_ema': False, 'sideways_use_atr': False, 'sideways_use_adx': True, 'sideways_use_spike': True, 'sideways_rsi_required': False}.
[I 2025-09-01 14:22:02,794] Trial 532 finished with values: [-1000000000.0, 1000000000.0] and parameters: {'p_sma': 26, 'p_std': 47, 'p_atr': 17, 'p_adx': 12, 'rsi_period': 79, 'ema1': 23, 'ema2': 17, 'slip_atr_k': 0.036319914423930635, 'slip_spread_k': 0.4464161687201512, 'spread_hl_frac': 0.006154486642615347, 'bb_std_mult': 1.8232988074980845, 'rsi_os': 32, 'rsi_ob': 86, 'vol_spike': 0.2544956784052696, 'adx_thresh': 24.987364185633258, 'atr_min_pct': 0.026882721167723875, 'atr_max_pct': 0.11797398019284647, 'tp_mult': 1.0525256990962666, 'tsl_mult': 0.7292821708422474, 'strategy': 'breakout', 'time_stop': 232, 'use_sma': True, 'use_atr': False, 'use_adx': False, 'use_ema': False, 'use_spike': True, 'rsi_required': True, 'edge_k': 0.9068100229014534, 'edge_cap': 0.25794340828624274, 'bull_strategy': 'breakout', 'bull_bb_std_mult': 3.22044935567836, 'bull_rsi_os': 38, 'bull_rsi_ob': 78, 'bull_adx_thresh': 30.213385744423697, 'bull_atr_min_pct': 0.0035047881986240586, 'bull_atr_max_pct': 0.01765039329390525, 'bull_tp_mult': 2.780490547817341, 'bull_tsl_mult': 0.46119695646184655, 'bull_time_stop': 90, 'bull_use_sma': False, 'bull_use_ema': False, 'bull_use_atr': True, 'bull_use_adx': True, 'bull_use_spike': False, 'bull_rsi_required': False, 'bear_strategy': 'mean_reversion', 'bear_bb_std_mult': 3.505479328063311, 'bear_rsi_os': 33, 'bear_rsi_ob': 56, 'bear_adx_thresh': 10.772645435144145, 'bear_atr_min_pct': 0.008552929122658509, 'bear_atr_max_pct': 0.010897179694294351, 'bear_tp_mult': 2.3077991457740525, 'bear_tsl_mult': 0.20509142212008122, 'bear_time_stop': 238, 'bear_use_sma': True, 'bear_use_ema': False, 'bear_use_atr': True, 'bear_use_adx': True, 'bear_use_spike': False, 'bear_rsi_required': True, 'sideways_strategy': 'breakout', 'sideways_bb_std_mult': 1.8444337944305524, 'sideways_rsi_os': 51, 'sideways_rsi_ob': 68, 'sideways_adx_thresh': 6.9752574139813035, 'sideways_atr_min_pct': 0.019531662077140455, 'sideways_atr_max_pct': 0.06256125316731898, 'sideways_tp_mult': 2.328097583268881, 'sideways_tsl_mult': 0.39463466761147914, 'sideways_time_stop': 149, 'sideways_use_sma': True, 'sideways_use_ema': True, 'sideways_use_atr': True, 'sideways_use_adx': False, 'sideways_use_spike': False, 'sideways_rsi_required': True}.
