[I 2025-09-01 13:35:35,623] Trial 216 finished with values: [-1000000000.0, 1000000000.0] and parameters: {'p_sma': 32, 'p_std': 48, 'p_atr': 20, 'p_adx': 15, 'rsi_period': 63, 'ema1': 21, 'ema2': 59, 'slip_atr_k': 0.0193600802604179, 'slip_spread_k': 0.38547369508373025, 'spread_hl_frac': 0.005367246697720355, 'bb_std_mult': 1.671066932796456, 'rsi_os': 39, 'rsi_ob': 94, 'vol_spike': 0.25183241024798325, 'adx_thresh': 14.234174701955702, 'atr_min_pct': 0.016595396612116297, 'atr_max_pct': 0.10168169276144708, 'tp_mult': 1.430590242635445, 'tsl_mult': 0.2717973007883882, 'strategy': 'mean_reversion', 'time_stop': 239, 'use_sma': True, 'use_atr': False, 'use_adx': False, 'use_ema': True, 'use_spike': True, 'rsi_required': False, 'edge_k': 0.47625215187710357, 'edge_cap': 0.37507681496745315, 'bull_strategy': 'breakout', 'bull_bb_std_mult': 3.5609140919379505, 'bull_rsi_os': 52, 'bull_rsi_ob': 47, 'bull_adx_thresh': 5.990363605337301, 'bull_atr_min_pct': 0.021273683765609716, 'bull_atr_max_pct': 0.02035152796142269, 'bull_tp_mult': 1.7476823255983767, 'bull_tsl_mult': 0.4795563684606788, 'bull_time_stop': 97, 'bull_use_sma': True, 'bull_use_ema': False, 'bull_use_atr': True, 'bull_use_adx': True, 'bull_use_spike': False, 'bull_rsi_required': True, 'bear_strategy': 'breakout', 'bear_bb_std_mult': 0.835856099429068, 'bear_rsi_os': 32, 'bear_rsi_ob': 89, 'bear_adx_thresh': 10.827035011111581, 'bear_atr_min_pct': 0.005606684540524714, 'bear_atr_max_pct': 0.09428332437926105, 'bear_tp_mult': 2.242918775079519, 'bear_tsl_mult': 0.0338914850436952, 'bear_time_stop': 221, 'bear_use_sma': True, 'bear_use_ema': False, 'bear_use_atr': False, 'bear_use_adx': True, 'bear_use_spike': False, 'bear_rsi_required': True, 'sideways_strategy': 'breakout', 'sideways_bb_std_mult': 1.8761883862199191, 'sideways_rsi_os': 48, 'sideways_rsi_ob': 94, 'sideways_adx_thresh': 9.81153666298161, 'sideways_atr_min_pct': 0.008392316003234602, 'sideways_atr_max_pct': 0.12718339177167268, 'sideways_tp_mult': 2.6653527937605586, 'sideways_tsl_mult': 0.10459406548523942, 'sideways_time_stop': 38, 'sideways_use_sma': True, 'sideways_use_ema': False, 'sideways_use_atr': True, 'sideways_use_adx': True, 'sideways_use_spike': False, 'sideways_rsi_required': True}.
[I 2025-09-01 13:35:36,044] Trial 215 finished with values: [-1000000000.0, 1000000000.0] and parameters: {'p_sma': 42, 'p_std': 49, 'p_atr': 20, 'p_adx': 9, 'rsi_period': 67, 'ema1': 21, 'ema2': 45, 'slip_atr_k': 0.011165737055555024, 'slip_spread_k': 0.38909384459078716, 'spread_hl_frac': 0.005990055916582345, 'bb_std_mult': 1.7995312575147404, 'rsi_os': 40, 'rsi_ob': 94, 'vol_spike': 0.2502038277926626, 'adx_thresh': 14.43012150210499, 'atr_min_pct': 0.016202470834804965, 'atr_max_pct': 0.05250632096350871, 'tp_mult': 1.3661859960148857, 'tsl_mult': 0.25661560286343205, 'strategy': 'breakout', 'time_stop': 264, 'use_sma': True, 'use_atr': False, 'use_adx': False, 'use_ema': True, 'use_spike': True, 'rsi_required': False, 'edge_k': 0.4596742537827278, 'edge_cap': 0.37188238457175704, 'bull_strategy': 'breakout', 'bull_bb_std_mult': 3.299047435789594, 'bull_rsi_os': 52, 'bull_rsi_ob': 52, 'bull_adx_thresh': 5.110481521580414, 'bull_atr_min_pct': 0.021098090235281333, 'bull_atr_max_pct': 0.02098803122594242, 'bull_tp_mult': 1.709381002024721, 'bull_tsl_mult': 0.4848506288706055, 'bull_time_stop': 105, 'bull_use_sma': True, 'bull_use_ema': True, 'bull_use_atr': True, 'bull_use_adx': True, 'bull_use_spike': False, 'bull_rsi_required': True, 'bear_strategy': 'breakout', 'bear_bb_std_mult': 3.0895016652787506, 'bear_rsi_os': 32, 'bear_rsi_ob': 86, 'bear_adx_thresh': 10.6298319468515, 'bear_atr_min_pct': 0.005583281987119847, 'bear_atr_max_pct': 0.09257144455864072, 'bear_tp_mult': 2.220307080438029, 'bear_tsl_mult': 0.031057941489752397, 'bear_time_stop': 222, 'bear_use_sma': True, 'bear_use_ema': False, 'bear_use_atr': True, 'bear_use_adx': True, 'bear_use_spike': False, 'bear_rsi_required': True, 'sideways_strategy': 'breakout', 'sideways_bb_std_mult': 1.8107498568093665, 'sideways_rsi_os': 50, 'sideways_rsi_ob': 94, 'sideways_adx_thresh': 8.316737618330402, 'sideways_atr_min_pct': 0.008575423602360886, 'sideways_atr_max_pct': 0.127420265831205, 'sideways_tp_mult': 2.6588923863633327, 'sideways_tsl_mult': 0.38906194585830456, 'sideways_time_stop': 123, 'sideways_use_sma': True, 'sideways_use_ema': False, 'sideways_use_atr': True, 'sideways_use_adx': True, 'sideways_use_spike': False, 'sideways_rsi_required': True}.
[I 2025-09-01 13:36:16,209] Trial 218 finished with values: [-1000000000.0, 1000000000.0] and parameters: {'p_sma': 43, 'p_std': 47, 'p_atr': 26, 'p_adx': 12, 'rsi_period': 68, 'ema1': 21, 'ema2': 59, 'slip_atr_k': 0.001720333070988747, 'slip_spread_k': 0.22090754553135938, 'spread_hl_frac': 0.0056449778586194375, 'bb_std_mult': 1.7664113801417447, 'rsi_os': 39, 'rsi_ob': 94, 'vol_spike': 0.243309092804746, 'adx_thresh': 14.565501535505906, 'atr_min_pct': 0.012231635890462724, 'atr_max_pct': 0.045255349996211204, 'tp_mult': 1.341931926418523, 'tsl_mult': 0.2700659024452577, 'strategy': 'breakout', 'time_stop': 263, 'use_sma': True, 'use_atr': False, 'use_adx': False, 'use_ema': True, 'use_spike': True, 'rsi_required': False, 'edge_k': 0.0016150833591311864, 'edge_cap': 0.2529376677036207, 'bull_strategy': 'breakout', 'bull_bb_std_mult': 3.311923980108413, 'bull_rsi_os': 52, 'bull_rsi_ob': 58, 'bull_adx_thresh': 5.5855360576459026, 'bull_atr_min_pct': 0.016937187995159485, 'bull_atr_max_pct': 0.02047626805475164, 'bull_tp_mult': 2.145084616434729, 'bull_tsl_mult': 0.43508198120274527, 'bull_time_stop': 67, 'bull_use_sma': True, 'bull_use_ema': True, 'bull_use_atr': True, 'bull_use_adx': True, 'bull_use_spike': False, 'bull_rsi_required': True, 'bear_strategy': 'breakout', 'bear_bb_std_mult': 0.8617011948319496, 'bear_rsi_os': 32, 'bear_rsi_ob': 93, 'bear_adx_thresh': 28.87638625093427, 'bear_atr_min_pct': 0.005323763771667927, 'bear_atr_max_pct': 0.09556333025205643, 'bear_tp_mult': 2.233706123813616, 'bear_tsl_mult': 0.02473081699678009, 'bear_time_stop': 193, 'bear_use_sma': True, 'bear_use_ema': True, 'bear_use_atr': True, 'bear_use_adx': True, 'bear_use_spike': False, 'bear_rsi_required': True, 'sideways_strategy': 'breakout', 'sideways_bb_std_mult': 1.7613825963495244, 'sideways_rsi_os': 48, 'sideways_rsi_ob': 94, 'sideways_adx_thresh': 9.629532405783166, 'sideways_atr_min_pct': 0.006455296298874825, 'sideways_atr_max_pct': 0.1285151758546239, 'sideways_tp_mult': 2.690573603533894, 'sideways_tsl_mult': 0.31648096421780514, 'sideways_time_stop': 124, 'sideways_use_sma': True, 'sideways_use_ema': False, 'sideways_use_atr': True, 'sideways_use_adx': True, 'sideways_use_spike': False, 'sideways_rsi_required': True}.
[I 2025-09-01 13:36:16,230] Trial 221 finished with values: [-1000000000.0, 1000000000.0] and parameters: {'p_sma': 35, 'p_std': 47, 'p_atr': 12, 'p_adx': 10, 'rsi_period': 68, 'ema1': 28, 'ema2': 22, 'slip_atr_k': 0.030028914879696573, 'slip_spread_k': 0.31557014748857715, 'spread_hl_frac': 0.0034578057519186267, 'bb_std_mult': 1.5976215944045662, 'rsi_os': 38, 'rsi_ob': 93, 'vol_spike': 0.2441793904351978, 'adx_thresh': 17.738125741113993, 'atr_min_pct': 0.021337678028960236, 'atr_max_pct': 0.045991829610356784, 'tp_mult': 2.666003675903627, 'tsl_mult': 0.8305554251759237, 'strategy': 'breakout', 'time_stop': 241, 'use_sma': False, 'use_atr': False, 'use_adx': True, 'use_ema': False, 'use_spike': True, 'rsi_required': False, 'edge_k': 1.5990120877286125, 'edge_cap': 0.251105251357304, 'bull_strategy': 'mean_reversion', 'bull_bb_std_mult': 3.4664776195003686, 'bull_rsi_os': 51, 'bull_rsi_ob': 69, 'bull_adx_thresh': 12.73058994197844, 'bull_atr_min_pct': 0.00592757836633692, 'bull_atr_max_pct': 0.023498835882211105, 'bull_tp_mult': 2.1658947486261155, 'bull_tsl_mult': 0.43419526181271506, 'bull_time_stop': 57, 'bull_use_sma': False, 'bull_use_ema': True, 'bull_use_atr': True, 'bull_use_adx': True, 'bull_use_spike': True, 'bull_rsi_required': True, 'bear_strategy': 'breakout', 'bear_bb_std_mult': 0.9613644247161028, 'bear_rsi_os': 34, 'bear_rsi_ob': 94, 'bear_adx_thresh': 31.39570511491723, 'bear_atr_min_pct': 0.004184465670842421, 'bear_atr_max_pct': 0.010644966636047457, 'bear_tp_mult': 2.310414020289883, 'bear_tsl_mult': 0.07337854908554237, 'bear_time_stop': 198, 'bear_use_sma': False, 'bear_use_ema': True, 'bear_use_atr': True, 'bear_use_adx': True, 'bear_use_spike': False, 'bear_rsi_required': True, 'sideways_strategy': 'breakout', 'sideways_bb_std_mult': 1.6323653338140898, 'sideways_rsi_os': 48, 'sideways_rsi_ob': 70, 'sideways_adx_thresh': 7.51940116177782, 'sideways_atr_min_pct': 0.006550994841389266, 'sideways_atr_max_pct': 0.13086137015478003, 'sideways_tp_mult': 2.7079249570980983, 'sideways_tsl_mult': 0.316149623763065, 'sideways_time_stop': 16, 'sideways_use_sma': True, 'sideways_use_ema': False, 'sideways_use_atr': True, 'sideways_use_adx': True, 'sideways_use_spike': False, 'sideways_rsi_required': False}.
[I 2025-09-01 13:36:16,584] Trial 219 finished with values: [-0.25857186950343236, 0.2584507426618547] and parameters: {'p_sma': 42, 'p_std': 47, 'p_atr': 17, 'p_adx': 10, 'rsi_period': 68, 'ema1': 21, 'ema2': 22, 'slip_atr_k': 0.017530947410992363, 'slip_spread_k': 0.8192576704131218, 'spread_hl_frac': 0.00391668387397245, 'bb_std_mult': 1.6421322609059423, 'rsi_os': 39, 'rsi_ob': 93, 'vol_spike': 0.2460740169192473, 'adx_thresh': 14.594718107269752, 'atr_min_pct': 0.014614792275330215, 'atr_max_pct': 0.04565723861823324, 'tp_mult': 2.6513088604097623, 'tsl_mult': 0.7947693682911077, 'strategy': 'breakout', 'time_stop': 264, 'use_sma': True, 'use_atr': False, 'use_adx': True, 'use_ema': True, 'use_spike': True, 'rsi_required': False, 'edge_k': 0.49840892316723556, 'edge_cap': 0.2950098319933444, 'bull_strategy': 'mean_reversion', 'bull_bb_std_mult': 3.302390296306501, 'bull_rsi_os': 52, 'bull_rsi_ob': 58, 'bull_adx_thresh': 25.099749954653063, 'bull_atr_min_pct': 0.0020867819343488264, 'bull_atr_max_pct': 0.01990466990537342, 'bull_tp_mult': 2.171012212224208, 'bull_tsl_mult': 0.4260311879582612, 'bull_time_stop': 69, 'bull_use_sma': True, 'bull_use_ema': True, 'bull_use_atr': True, 'bull_use_adx': True, 'bull_use_spike': True, 'bull_rsi_required': True, 'bear_strategy': 'breakout', 'bear_bb_std_mult': 0.8820692641128595, 'bear_rsi_os': 33, 'bear_rsi_ob': 93, 'bear_adx_thresh': 31.65223419530502, 'bear_atr_min_pct': 0.004341243458724619, 'bear_atr_max_pct': 0.08587783925080193, 'bear_tp_mult': 2.220182314620547, 'bear_tsl_mult': 0.1508485189110622, 'bear_time_stop': 225, 'bear_use_sma': True, 'bear_use_ema': True, 'bear_use_atr': True, 'bear_use_adx': True, 'bear_use_spike': False, 'bear_rsi_required': True, 'sideways_strategy': 'breakout', 'sideways_bb_std_mult': 1.8787470289092327, 'sideways_rsi_os': 48, 'sideways_rsi_ob': 93, 'sideways_adx_thresh': 9.535226455187905, 'sideways_atr_min_pct': 2.3702120329134255e-05, 'sideways_atr_max_pct': 0.1297705796539609, 'sideways_tp_mult': 2.7106795613199104, 'sideways_tsl_mult': 0.10565202709429619, 'sideways_time_stop': 22, 'sideways_use_sma': True, 'sideways_use_ema': False, 'sideways_use_atr': True, 'sideways_use_adx': True, 'sideways_use_spike': False, 'sideways_rsi_required': True}.
[I 2025-09-01 13:36:16,793] Trial 220 finished with values: [-1000000000.0, 1000000000.0] and parameters: {'p_sma': 42, 'p_std': 47, 'p_atr': 14, 'p_adx': 13, 'rsi_period': 68, 'ema1': 23, 'ema2': 59, 'slip_atr_k': 0.03034513704167148, 'slip_spread_k': 0.13489615548234052, 'spread_hl_frac': 0.0034985701984490023, 'bb_std_mult': 1.2959827059268212, 'rsi_os': 38, 'rsi_ob': 93, 'vol_spike': 0.24437227925359933, 'adx_thresh': 14.755743338858698, 'atr_min_pct': 0.017545479826040204, 'atr_max_pct': 0.04539126969467232, 'tp_mult': 1.3534733213876884, 'tsl_mult': 0.7885484034227609, 'strategy': 'breakout', 'time_stop': 263, 'use_sma': False, 'use_atr': False, 'use_adx': True, 'use_ema': False, 'use_spike': True, 'rsi_required': False, 'edge_k': 1.5968553181289298, 'edge_cap': 0.2561788791325158, 'bull_strategy': 'mean_reversion', 'bull_bb_std_mult': 3.2862974039262514, 'bull_rsi_os': 51, 'bull_rsi_ob': 70, 'bull_adx_thresh': 21.475832625137578, 'bull_atr_min_pct': 0.016913163157874517, 'bull_atr_max_pct': 0.05804324845340368, 'bull_tp_mult': 2.1006026413800565, 'bull_tsl_mult': 0.41442416312779107, 'bull_time_stop': 67, 'bull_use_sma': True, 'bull_use_ema': True, 'bull_use_atr': True, 'bull_use_adx': True, 'bull_use_spike': True, 'bull_rsi_required': True, 'bear_strategy': 'breakout', 'bear_bb_std_mult': 0.8977258025786098, 'bear_rsi_os': 35, 'bear_rsi_ob': 93, 'bear_adx_thresh': 9.721542390302048, 'bear_atr_min_pct': 0.004394653666083496, 'bear_atr_max_pct': 0.08603076829533736, 'bear_tp_mult': 2.2111310736848866, 'bear_tsl_mult': 0.062035154146291877, 'bear_time_stop': 198, 'bear_use_sma': False, 'bear_use_ema': True, 'bear_use_atr': True, 'bear_use_adx': True, 'bear_use_spike': False, 'bear_rsi_required': True, 'sideways_strategy': 'breakout', 'sideways_bb_std_mult': 2.0969649491186524, 'sideways_rsi_os': 50, 'sideways_rsi_ob': 93, 'sideways_adx_thresh': 7.714265601792713, 'sideways_atr_min_pct': 0.008829308607966267, 'sideways_atr_max_pct': 0.12879133027622297, 'sideways_tp_mult': 1.1607399389260902, 'sideways_tsl_mult': 0.3016904219401092, 'sideways_time_stop': 16, 'sideways_use_sma': True, 'sideways_use_ema': False, 'sideways_use_atr': True, 'sideways_use_adx': True, 'sideways_use_spike': False, 'sideways_rsi_required': True}.
[I 2025-09-01 13:36:56,379] Trial 222 finished with values: [-1000000000.0, 1000000000.0] and parameters: {'p_sma': 38, 'p_std': 52, 'p_atr': 29, 'p_adx': 13, 'rsi_period': 68, 'ema1': 14, 'ema2': 59, 'slip_atr_k': 0.015790977125245534, 'slip_spread_k': 0.6610936594862752, 'spread_hl_frac': 0.007649775681946195, 'bb_std_mult': 0.6365003067891044, 'rsi_os': 41, 'rsi_ob': 51, 'vol_spike': 0.24265476209405545, 'adx_thresh': 13.274883144470436, 'atr_min_pct': 0.02434317397559605, 'atr_max_pct': 0.042863794815997426, 'tp_mult': 2.822093002712488, 'tsl_mult': 0.1880481891105207, 'strategy': 'mean_reversion', 'time_stop': 246, 'use_sma': True, 'use_atr': False, 'use_adx': True, 'use_ema': True, 'use_spike': True, 'rsi_required': False, 'edge_k': 0.5081624947227239, 'edge_cap': 0.2944268250982006, 'bull_strategy': 'mean_reversion', 'bull_bb_std_mult': 3.264701174565325, 'bull_rsi_os': 50, 'bull_rsi_ob': 54, 'bull_adx_thresh': 6.204174690846785, 'bull_atr_min_pct': 0.0020159521955110454, 'bull_atr_max_pct': 0.1497531768486659, 'bull_tp_mult': 1.5647537762103645, 'bull_tsl_mult': 0.982360279270257, 'bull_time_stop': 68, 'bull_use_sma': True, 'bull_use_ema': True, 'bull_use_atr': True, 'bull_use_adx': True, 'bull_use_spike': True, 'bull_rsi_required': False, 'bear_strategy': 'breakout', 'bear_bb_std_mult': 0.9088396262360564, 'bear_rsi_os': 35, 'bear_rsi_ob': 90, 'bear_adx_thresh': 8.432627710584072, 'bear_atr_min_pct': 0.00681709492062574, 'bear_atr_max_pct': 0.08443169744831151, 'bear_tp_mult': 2.1956351505306437, 'bear_tsl_mult': 0.23554322927358584, 'bear_time_stop': 176, 'bear_use_sma': True, 'bear_use_ema': False, 'bear_use_atr': True, 'bear_use_adx': True, 'bear_use_spike': False, 'bear_rsi_required': True, 'sideways_strategy': 'breakout', 'sideways_bb_std_mult': 2.0767835770679364, 'sideways_rsi_os': 46, 'sideways_rsi_ob': 93, 'sideways_adx_thresh': 9.110459460900419, 'sideways_atr_min_pct': 0.008942903749981522, 'sideways_atr_max_pct': 0.12415855038022675, 'sideways_tp_mult': 2.7212760457639047, 'sideways_tsl_mult': 0.1262418537243691, 'sideways_time_stop': 143, 'sideways_use_sma': True, 'sideways_use_ema': False, 'sideways_use_atr': True, 'sideways_use_adx': True, 'sideways_use_spike': True, 'sideways_rsi_required': True}.
[I 2025-09-01 13:36:57,326] Trial 223 finished with values: [-0.19598484056945964, 0.19586153559102354] and parameters: {'p_sma': 38, 'p_std': 54, 'p_atr': 29, 'p_adx': 13, 'rsi_period': 63, 'ema1': 14, 'ema2': 59, 'slip_atr_k': 0.01694263767307717, 'slip_spread_k': 0.4016938412063114, 'spread_hl_frac': 0.0075608347178211036, 'bb_std_mult': 3.342476340369987, 'rsi_os': 42, 'rsi_ob': 93, 'vol_spike': 0.24114122103639207, 'adx_thresh': 15.917557896341327, 'atr_min_pct': 0.024391713318538802, 'atr_max_pct': 0.042466547218660965, 'tp_mult': 2.4483835198418533, 'tsl_mult': 0.184725435167312, 'strategy': 'mean_reversion', 'time_stop': 246, 'use_sma': True, 'use_atr': False, 'use_adx': True, 'use_ema': True, 'use_spike': True, 'rsi_required': False, 'edge_k': 0.35463946238504507, 'edge_cap': 0.29349150450588524, 'bull_strategy': 'mean_reversion', 'bull_bb_std_mult': 3.3437202627079565, 'bull_rsi_os': 50, 'bull_rsi_ob': 72, 'bull_adx_thresh': 21.364047507248166, 'bull_atr_min_pct': 0.0016636230205747038, 'bull_atr_max_pct': 0.0176718584380937, 'bull_tp_mult': 2.1108225301340657, 'bull_tsl_mult': 0.4107481074152225, 'bull_time_stop': 68, 'bull_use_sma': True, 'bull_use_ema': True, 'bull_use_atr': True, 'bull_use_adx': True, 'bull_use_spike': True, 'bull_rsi_required': False, 'bear_strategy': 'breakout', 'bear_bb_std_mult': 1.725795396798199, 'bear_rsi_os': 35, 'bear_rsi_ob': 83, 'bear_adx_thresh': 21.787063719429835, 'bear_atr_min_pct': 0.004185249109303394, 'bear_atr_max_pct': 0.08599740847441063, 'bear_tp_mult': 2.193745312548495, 'bear_tsl_mult': 0.11508842380354449, 'bear_time_stop': 230, 'bear_use_sma': True, 'bear_use_ema': False, 'bear_use_atr': True, 'bear_use_adx': True, 'bear_use_spike': False, 'bear_rsi_required': True, 'sideways_strategy': 'breakout', 'sideways_bb_std_mult': 2.11023737658593, 'sideways_rsi_os': 46, 'sideways_rsi_ob': 60, 'sideways_adx_thresh': 9.180639754327352, 'sideways_atr_min_pct': 0.0002826404886599413, 'sideways_atr_max_pct': 0.14225318149633098, 'sideways_tp_mult': 2.547755618744027, 'sideways_tsl_mult': 0.13681420029992486, 'sideways_time_stop': 23, 'sideways_use_sma': True, 'sideways_use_ema': False, 'sideways_use_atr': True, 'sideways_use_adx': True, 'sideways_use_spike': True, 'sideways_rsi_required': True}.
[I 2025-09-01 13:36:57,910] Trial 225 finished with values: [-0.044863173856193095, 0.044658036358570075] and parameters: {'p_sma': 38, 'p_std': 19, 'p_atr': 30, 'p_adx': 15, 'rsi_period': 64, 'ema1': 21, 'ema2': 60, 'slip_atr_k': 0.02330104648682288, 'slip_spread_k': 0.40218935883368295, 'spread_hl_frac': 0.007618732257589681, 'bb_std_mult': 0.8613636353283671, 'rsi_os': 40, 'rsi_ob': 93, 'vol_spike': 0.23878943567669952, 'adx_thresh': 15.839426473544869, 'atr_min_pct': 0.018807331694116323, 'atr_max_pct': 0.03876500634616696, 'tp_mult': 1.26031325835304, 'tsl_mult': 0.160566418187975, 'strategy': 'mean_reversion', 'time_stop': 258, 'use_sma': True, 'use_atr': False, 'use_adx': False, 'use_ema': True, 'use_spike': True, 'rsi_required': False, 'edge_k': 0.4316551970640568, 'edge_cap': 0.2196578857074616, 'bull_strategy': 'breakout', 'bull_bb_std_mult': 1.7963500278338411, 'bull_rsi_os': 54, 'bull_rsi_ob': 56, 'bull_adx_thresh': 6.441172090739546, 'bull_atr_min_pct': 0.001404526871200266, 'bull_atr_max_pct': 0.017067516536916898, 'bull_tp_mult': 1.6170295629950464, 'bull_tsl_mult': 0.009051671640879944, 'bull_time_stop': 79, 'bull_use_sma': True, 'bull_use_ema': False, 'bull_use_atr': True, 'bull_use_adx': True, 'bull_use_spike': False, 'bull_rsi_required': False, 'bear_strategy': 'breakout', 'bear_bb_std_mult': 3.2152450267086374, 'bear_rsi_os': 31, 'bear_rsi_ob': 90, 'bear_adx_thresh': 21.889575092782668, 'bear_atr_min_pct': 0.0064455809116000596, 'bear_atr_max_pct': 0.08340033900620837, 'bear_tp_mult': 2.3256367359100807, 'bear_tsl_mult': 0.11221617404222199, 'bear_time_stop': 179, 'bear_use_sma': True, 'bear_use_ema': False, 'bear_use_atr': False, 'bear_use_adx': True, 'bear_use_spike': True, 'bear_rsi_required': True, 'sideways_strategy': 'breakout', 'sideways_bb_std_mult': 2.1780092859490594, 'sideways_rsi_os': 46, 'sideways_rsi_ob': 95, 'sideways_adx_thresh': 6.4182064097767135, 'sideways_atr_min_pct': 0.008991776214198104, 'sideways_atr_max_pct': 0.12438321656742751, 'sideways_tp_mult': 2.5651854813987107, 'sideways_tsl_mult': 0.2123988793890878, 'sideways_time_stop': 300, 'sideways_use_sma': True, 'sideways_use_ema': True, 'sideways_use_atr': False, 'sideways_use_adx': True, 'sideways_use_spike': True, 'sideways_rsi_required': True}.
