[I 2025-09-01 13:36:58,198] Trial 224 finished with values: [-1000000000.0, 1000000000.0] and parameters: {'p_sma': 38, 'p_std': 54, 'p_atr': 30, 'p_adx': 13, 'rsi_period': 66, 'ema1': 29, 'ema2': 59, 'slip_atr_k': 0.04016900086240599, 'slip_spread_k': 0.8675144265397805, 'spread_hl_frac': 0.00767672941251813, 'bb_std_mult': 0.8576368320394976, 'rsi_os': 41, 'rsi_ob': 93, 'vol_spike': 0.11275667306913986, 'adx_thresh': 15.616474566908186, 'atr_min_pct': 0.01949024900801828, 'atr_max_pct': 0.03877183610984629, 'tp_mult': 1.2521257669959747, 'tsl_mult': 0.1507370253978419, 'strategy': 'breakout', 'time_stop': 244, 'use_sma': True, 'use_atr': False, 'use_adx': False, 'use_ema': True, 'use_spike': True, 'rsi_required': False, 'edge_k': 0.4168245937990196, 'edge_cap': 0.4166115228069984, 'bull_strategy': 'breakout', 'bull_bb_std_mult': 0.8346711422830959, 'bull_rsi_os': 55, 'bull_rsi_ob': 54, 'bull_adx_thresh': 6.321413284295219, 'bull_atr_min_pct': 0.00180942208306967, 'bull_atr_max_pct': 0.08461200038084238, 'bull_tp_mult': 1.5529140750330712, 'bull_tsl_mult': 0.8315838389980439, 'bull_time_stop': 81, 'bull_use_sma': True, 'bull_use_ema': True, 'bull_use_atr': True, 'bull_use_adx': True, 'bull_use_spike': False, 'bull_rsi_required': False, 'bear_strategy': 'breakout', 'bear_bb_std_mult': 0.9165053128141245, 'bear_rsi_os': 35, 'bear_rsi_ob': 87, 'bear_adx_thresh': 9.88790830915735, 'bear_atr_min_pct': 0.00634096733303818, 'bear_atr_max_pct': 0.08484618939129084, 'bear_tp_mult': 2.330160504800652, 'bear_tsl_mult': 0.23273114207374168, 'bear_time_stop': 204, 'bear_use_sma': True, 'bear_use_ema': False, 'bear_use_atr': True, 'bear_use_adx': True, 'bear_use_spike': True, 'bear_rsi_required': True, 'sideways_strategy': 'breakout', 'sideways_bb_std_mult': 2.1023836450426563, 'sideways_rsi_os': 47, 'sideways_rsi_ob': 93, 'sideways_adx_thresh': 7.827277805804305, 'sideways_atr_min_pct': 0.009273236533048033, 'sideways_atr_max_pct': 0.12515506889276787, 'sideways_tp_mult': 1.1561369898999774, 'sideways_tsl_mult': 0.21163650298878323, 'sideways_time_stop': 144, 'sideways_use_sma': True, 'sideways_use_ema': True, 'sideways_use_atr': False, 'sideways_use_adx': True, 'sideways_use_spike': True, 'sideways_rsi_required': True}.
[I 2025-09-01 13:37:37,819] Trial 228 finished with values: [-0.024195310357703392, 0.024081301061310182] and parameters: {'p_sma': 40, 'p_std': 59, 'p_atr': 30, 'p_adx': 11, 'rsi_period': 70, 'ema1': 13, 'ema2': 60, 'slip_atr_k': 0.00663217447599199, 'slip_spread_k': 0.6251379756672248, 'spread_hl_frac': 0.004850261856060068, 'bb_std_mult': 1.8862092807472968, 'rsi_os': 14, 'rsi_ob': 54, 'vol_spike': 0.07566536268342618, 'adx_thresh': 21.9986456736936, 'atr_min_pct': 0.029933266055480752, 'atr_max_pct': 0.13509989848662277, 'tp_mult': 1.46920477725537, 'tsl_mult': 0.16634913343956237, 'strategy': 'breakout', 'time_stop': 249, 'use_sma': False, 'use_atr': False, 'use_adx': False, 'use_ema': False, 'use_spike': True, 'rsi_required': False, 'edge_k': 1.3176509256447981, 'edge_cap': 0.3199524934707527, 'bull_strategy': 'breakout', 'bull_bb_std_mult': 3.400915264555171, 'bull_rsi_os': 19, 'bull_rsi_ob': 57, 'bull_adx_thresh': 5.537760132494978, 'bull_atr_min_pct': 0.000933049304170477, 'bull_atr_max_pct': 0.04172240228118292, 'bull_tp_mult': 2.5219155096287644, 'bull_tsl_mult': 0.5201418045889286, 'bull_time_stop': 49, 'bull_use_sma': False, 'bull_use_ema': False, 'bull_use_atr': False, 'bull_use_adx': False, 'bull_use_spike': False, 'bull_rsi_required': True, 'bear_strategy': 'breakout', 'bear_bb_std_mult': 2.6044780077197123, 'bear_rsi_os': 31, 'bear_rsi_ob': 87, 'bear_adx_thresh': 32.28327907038759, 'bear_atr_min_pct': 0.002481795187223591, 'bear_atr_max_pct': 0.13086172329095228, 'bear_tp_mult': 2.1425852341652036, 'bear_tsl_mult': 0.09083089556232155, 'bear_time_stop': 156, 'bear_use_sma': False, 'bear_use_ema': False, 'bear_use_atr': False, 'bear_use_adx': False, 'bear_use_spike': False, 'bear_rsi_required': True, 'sideways_strategy': 'breakout', 'sideways_bb_std_mult': 2.3717926098480757, 'sideways_rsi_os': 49, 'sideways_rsi_ob': 83, 'sideways_adx_thresh': 5.602998672936521, 'sideways_atr_min_pct': 0.007898921370598735, 'sideways_atr_max_pct': 0.13517364757417935, 'sideways_tp_mult': 1.505523431088384, 'sideways_tsl_mult': 0.6176738500093307, 'sideways_time_stop': 88, 'sideways_use_sma': True, 'sideways_use_ema': False, 'sideways_use_atr': True, 'sideways_use_adx': True, 'sideways_use_spike': False, 'sideways_rsi_required': False}.
[I 2025-09-01 13:37:38,813] Trial 229 finished with values: [-0.03057926037044978, 0.030344597639514855] and parameters: {'p_sma': 40, 'p_std': 46, 'p_atr': 30, 'p_adx': 11, 'rsi_period': 43, 'ema1': 13, 'ema2': 60, 'slip_atr_k': 0.0060912507997238526, 'slip_spread_k': 0.6275312355689304, 'spread_hl_frac': 0.004433337346779538, 'bb_std_mult': 1.6897719763689314, 'rsi_os': 22, 'rsi_ob': 54, 'vol_spike': 0.004419162038584223, 'adx_thresh': 22.130041722649445, 'atr_min_pct': 0.029721244135361865, 'atr_max_pct': 0.09341735697698458, 'tp_mult': 1.4705495408419362, 'tsl_mult': 0.16145820993177767, 'strategy': 'breakout', 'time_stop': 229, 'use_sma': False, 'use_atr': False, 'use_adx': False, 'use_ema': False, 'use_spike': True, 'rsi_required': False, 'edge_k': 0.38503743830670034, 'edge_cap': 0.3273988194408969, 'bull_strategy': 'breakout', 'bull_bb_std_mult': 1.9603795449031596, 'bull_rsi_os': 29, 'bull_rsi_ob': 88, 'bull_adx_thresh': 32.96021324374363, 'bull_atr_min_pct': 0.0009362270459564782, 'bull_atr_max_pct': 0.05484718697584833, 'bull_tp_mult': 1.7984457389142001, 'bull_tsl_mult': 0.4368575495272708, 'bull_time_stop': 49, 'bull_use_sma': False, 'bull_use_ema': False, 'bull_use_atr': False, 'bull_use_adx': False, 'bull_use_spike': False, 'bull_rsi_required': True, 'bear_strategy': 'breakout', 'bear_bb_std_mult': 1.0075195537882353, 'bear_rsi_os': 33, 'bear_rsi_ob': 87, 'bear_adx_thresh': 11.175220109169947, 'bear_atr_min_pct': 0.00505391008754193, 'bear_atr_max_pct': 0.09096199745011257, 'bear_tp_mult': 2.1564233465047264, 'bear_tsl_mult': 0.27380809574617293, 'bear_time_stop': 155, 'bear_use_sma': False, 'bear_use_ema': False, 'bear_use_atr': False, 'bear_use_adx': False, 'bear_use_spike': False, 'bear_rsi_required': True, 'sideways_strategy': 'breakout', 'sideways_bb_std_mult': 1.5530719766080494, 'sideways_rsi_os': 44, 'sideways_rsi_ob': 63, 'sideways_adx_thresh': 5.635619013757559, 'sideways_atr_min_pct': 0.017109370070303054, 'sideways_atr_max_pct': 0.1348911607135971, 'sideways_tp_mult': 2.4812307906088935, 'sideways_tsl_mult': 0.6199746293080349, 'sideways_time_stop': 174, 'sideways_use_sma': True, 'sideways_use_ema': False, 'sideways_use_atr': True, 'sideways_use_adx': True, 'sideways_use_spike': False, 'sideways_rsi_required': False}.
[I 2025-09-01 13:37:39,304] Trial 227 finished with values: [-0.0691115675438978, 0.06899785882068359] and parameters: {'p_sma': 40, 'p_std': 6, 'p_atr': 30, 'p_adx': 11, 'rsi_period': 61, 'ema1': 29, 'ema2': 60, 'slip_atr_k': 0.03885101512042041, 'slip_spread_k': 0.37071362028327576, 'spread_hl_frac': 0.006885112066780657, 'bb_std_mult': 3.1799861453574056, 'rsi_os': 40, 'rsi_ob': 93, 'vol_spike': 0.2317531649756003, 'adx_thresh': 22.280610629948868, 'atr_min_pct': 0.018880653119249823, 'atr_max_pct': 0.03878841211017675, 'tp_mult': 1.472419529818954, 'tsl_mult': 0.16006232627917447, 'strategy': 'breakout', 'time_stop': 232, 'use_sma': True, 'use_atr': False, 'use_adx': False, 'use_ema': True, 'use_spike': True, 'rsi_required': False, 'edge_k': 0.4272934981941737, 'edge_cap': 0.22682102346881822, 'bull_strategy': 'breakout', 'bull_bb_std_mult': 0.837292070067289, 'bull_rsi_os': 55, 'bull_rsi_ob': 80, 'bull_adx_thresh': 17.41493124867553, 'bull_atr_min_pct': 0.0010025998966356328, 'bull_atr_max_pct': 0.04295023975780969, 'bull_tp_mult': 1.8014453476381014, 'bull_tsl_mult': 0.5139662546989371, 'bull_time_stop': 81, 'bull_use_sma': False, 'bull_use_ema': False, 'bull_use_atr': False, 'bull_use_adx': True, 'bull_use_spike': False, 'bull_rsi_required': True, 'bear_strategy': 'breakout', 'bear_bb_std_mult': 2.5561868597259187, 'bear_rsi_os': 28, 'bear_rsi_ob': 87, 'bear_adx_thresh': 33.0287429363576, 'bear_atr_min_pct': 0.0025736098541459967, 'bear_atr_max_pct': 0.10018977042606524, 'bear_tp_mult': 2.3330754901360904, 'bear_tsl_mult': 0.20244895723208417, 'bear_time_stop': 206, 'bear_use_sma': True, 'bear_use_ema': False, 'bear_use_atr': False, 'bear_use_adx': False, 'bear_use_spike': True, 'bear_rsi_required': True, 'sideways_strategy': 'breakout', 'sideways_bb_std_mult': 2.166496725893178, 'sideways_rsi_os': 43, 'sideways_rsi_ob': 63, 'sideways_adx_thresh': 6.123992632535298, 'sideways_atr_min_pct': 0.007920276691862538, 'sideways_atr_max_pct': 0.12474268965022407, 'sideways_tp_mult': 1.7891661549451816, 'sideways_tsl_mult': 0.35308994504531876, 'sideways_time_stop': 31, 'sideways_use_sma': True, 'sideways_use_ema': True, 'sideways_use_atr': False, 'sideways_use_adx': True, 'sideways_use_spike': False, 'sideways_rsi_required': False}.
[I 2025-09-01 13:37:39,672] Trial 226 finished with values: [-0.04159300606334815, 0.041357594327754175] and parameters: {'p_sma': 34, 'p_std': 46, 'p_atr': 30, 'p_adx': 16, 'rsi_period': 45, 'ema1': 22, 'ema2': 26, 'slip_atr_k': 0.022968838212602323, 'slip_spread_k': 0.404265037295952, 'spread_hl_frac': 0.007496023714066848, 'bb_std_mult': 1.8834049643131834, 'rsi_os': 40, 'rsi_ob': 57, 'vol_spike': 0.007414078931108903, 'adx_thresh': 15.968381092261398, 'atr_min_pct': 0.027821593438848997, 'atr_max_pct': 0.03927666198959307, 'tp_mult': 1.4488840152981708, 'tsl_mult': 0.1639559284075197, 'strategy': 'breakout', 'time_stop': 245, 'use_sma': True, 'use_atr': False, 'use_adx': False, 'use_ema': True, 'use_spike': True, 'rsi_required': False, 'edge_k': 0.4036647625188424, 'edge_cap': 0.4181408381012996, 'bull_strategy': 'breakout', 'bull_bb_std_mult': 1.9666564242640818, 'bull_rsi_os': 23, 'bull_rsi_ob': 72, 'bull_adx_thresh': 17.935298804097744, 'bull_atr_min_pct': 0.0012290210810024832, 'bull_atr_max_pct': 0.04174144311528414, 'bull_tp_mult': 2.328160424160972, 'bull_tsl_mult': 0.7352803328733227, 'bull_time_stop': 82, 'bull_use_sma': False, 'bull_use_ema': False, 'bull_use_atr': True, 'bull_use_adx': True, 'bull_use_spike': False, 'bull_rsi_required': True, 'bear_strategy': 'breakout', 'bear_bb_std_mult': 0.9772173899148052, 'bear_rsi_os': 31, 'bear_rsi_ob': 87, 'bear_adx_thresh': 32.402202819598195, 'bear_atr_min_pct': 0.0024621694404511974, 'bear_atr_max_pct': 0.12481518164935265, 'bear_tp_mult': 2.1457099385237277, 'bear_tsl_mult': 0.11246575898644562, 'bear_time_stop': 229, 'bear_use_sma': True, 'bear_use_ema': False, 'bear_use_atr': False, 'bear_use_adx': True, 'bear_use_spike': True, 'bear_rsi_required': True, 'sideways_strategy': 'breakout', 'sideways_bb_std_mult': 2.1778557977747415, 'sideways_rsi_os': 46, 'sideways_rsi_ob': 60, 'sideways_adx_thresh': 8.531938520048426, 'sideways_atr_min_pct': 0.007974641810780425, 'sideways_atr_max_pct': 0.12484871940208585, 'sideways_tp_mult': 1.7969766705307089, 'sideways_tsl_mult': 0.2140011481812265, 'sideways_time_stop': 87, 'sideways_use_sma': True, 'sideways_use_ema': True, 'sideways_use_atr': False, 'sideways_use_adx': True, 'sideways_use_spike': False, 'sideways_rsi_required': False}.
[I 2025-09-01 13:38:17,443] Trial 233 finished with values: [-1000000000.0, 1000000000.0] and parameters: {'p_sma': 36, 'p_std': 59, 'p_atr': 11, 'p_adx': 11, 'rsi_period': 70, 'ema1': 22, 'ema2': 36, 'slip_atr_k': 0.0010259256196415677, 'slip_spread_k': 0.6924002952276608, 'spread_hl_frac': 0.0047169700231214275, 'bb_std_mult': 1.8583146581219783, 'rsi_os': 45, 'rsi_ob': 54, 'vol_spike': 0.07788796271925115, 'adx_thresh': 12.837955399611474, 'atr_min_pct': 0.02981051607867362, 'atr_max_pct': 0.10723594629558628, 'tp_mult': 1.4233952465304054, 'tsl_mult': 0.13948053198291635, 'strategy': 'breakout', 'time_stop': 256, 'use_sma': False, 'use_atr': False, 'use_adx': False, 'use_ema': False, 'use_spike': True, 'rsi_required': False, 'edge_k': 0.6323336899067764, 'edge_cap': 0.31951211747419817, 'bull_strategy': 'breakout', 'bull_bb_std_mult': 2.5949596579846976, 'bull_rsi_os': 25, 'bull_rsi_ob': 57, 'bull_adx_thresh': 32.8812993520296, 'bull_atr_min_pct': 0.0028236530412415295, 'bull_atr_max_pct': 0.13089790871116314, 'bull_tp_mult': 1.8168072546746574, 'bull_tsl_mult': 0.449344644078592, 'bull_time_stop': 114, 'bull_use_sma': True, 'bull_use_ema': True, 'bull_use_atr': False, 'bull_use_adx': False, 'bull_use_spike': False, 'bull_rsi_required': True, 'bear_strategy': 'breakout', 'bear_bb_std_mult': 2.1163424074210533, 'bear_rsi_os': 33, 'bear_rsi_ob': 89, 'bear_adx_thresh': 11.416374534694382, 'bear_atr_min_pct': 0.006827097330289031, 'bear_atr_max_pct': 0.08783092488858356, 'bear_tp_mult': 2.2797345233329045, 'bear_tsl_mult': 0.27780175566139625, 'bear_time_stop': 130, 'bear_use_sma': False, 'bear_use_ema': False, 'bear_use_atr': True, 'bear_use_adx': False, 'bear_use_spike': False, 'bear_rsi_required': True, 'sideways_strategy': 'breakout', 'sideways_bb_std_mult': 2.3658178747678176, 'sideways_rsi_os': 44, 'sideways_rsi_ob': 95, 'sideways_adx_thresh': 5.5675752752132075, 'sideways_atr_min_pct': 0.01666081663050125, 'sideways_atr_max_pct': 0.13544321360440564, 'sideways_tp_mult': 1.4936238297551427, 'sideways_tsl_mult': 0.39624168971712864, 'sideways_time_stop': 233, 'sideways_use_sma': True, 'sideways_use_ema': False, 'sideways_use_atr': True, 'sideways_use_adx': True, 'sideways_use_spike': False, 'sideways_rsi_required': True}.
[I 2025-09-01 13:38:17,708] Trial 230 finished with values: [-1000000000.0, 1000000000.0] and parameters: {'p_sma': 34, 'p_std': 46, 'p_atr': 30, 'p_adx': 7, 'rsi_period': 50, 'ema1': 13, 'ema2': 10, 'slip_atr_k': 0.006416358302195989, 'slip_spread_k': 0.37366130429747074, 'spread_hl_frac': 0.004379810416277309, 'bb_std_mult': 1.8677591112313288, 'rsi_os': 23, 'rsi_ob': 58, 'vol_spike': 0.07743159952001077, 'adx_thresh': 21.70471067848978, 'atr_min_pct': 0.02242340094718767, 'atr_max_pct': 0.04761217529875271, 'tp_mult': 1.4774751599919034, 'tsl_mult': 0.15100369756098372, 'strategy': 'breakout', 'time_stop': 230, 'use_sma': False, 'use_atr': False, 'use_adx': False, 'use_ema': False, 'use_spike': True, 'rsi_required': False, 'edge_k': 0.38812588122055863, 'edge_cap': 0.32281490931108336, 'bull_strategy': 'breakout', 'bull_bb_std_mult': 2.611974012016831, 'bull_rsi_os': 25, 'bull_rsi_ob': 56, 'bull_adx_thresh': 5.597014285723635, 'bull_atr_min_pct': 0.027840883440914954, 'bull_atr_max_pct': 0.04203497462710873, 'bull_tp_mult': 1.8125509756314775, 'bull_tsl_mult': 0.40373201422471144, 'bull_time_stop': 115, 'bull_use_sma': False, 'bull_use_ema': False, 'bull_use_atr': False, 'bull_use_adx': False, 'bull_use_spike': False, 'bull_rsi_required': True, 'bear_strategy': 'breakout', 'bear_bb_std_mult': 1.985932409578142, 'bear_rsi_os': 31, 'bear_rsi_ob': 89, 'bear_adx_thresh': 19.443661732248177, 'bear_atr_min_pct': 0.007710761543044814, 'bear_atr_max_pct': 0.09958874585358174, 'bear_tp_mult': 2.1452276512097104, 'bear_tsl_mult': 0.09713798897479914, 'bear_time_stop': 158, 'bear_use_sma': False, 'bear_use_ema': False, 'bear_use_atr': False, 'bear_use_adx': False, 'bear_use_spike': False, 'bear_rsi_required': True, 'sideways_strategy': 'breakout', 'sideways_bb_std_mult': 2.3865685742849596, 'sideways_rsi_os': 44, 'sideways_rsi_ob': 56, 'sideways_adx_thresh': 5.450456156792015, 'sideways_atr_min_pct': 0.02227163574889886, 'sideways_atr_max_pct': 0.13575465146878674, 'sideways_tp_mult': 1.7154681241242702, 'sideways_tsl_mult': 0.4012588078410696, 'sideways_time_stop': 271, 'sideways_use_sma': True, 'sideways_use_ema': False, 'sideways_use_atr': True, 'sideways_use_adx': True, 'sideways_use_spike': False, 'sideways_rsi_required': False}.
[I 2025-09-01 13:38:17,956] Trial 231 finished with values: [-1000000000.0, 1000000000.0] and parameters: {'p_sma': 40, 'p_std': 59, 'p_atr': 30, 'p_adx': 11, 'rsi_period': 13, 'ema1': 22, 'ema2': 60, 'slip_atr_k': 0.007481494235136114, 'slip_spread_k': 0.7784076002237992, 'spread_hl_frac': 0.004601173251572791, 'bb_std_mult': 1.880001457581065, 'rsi_os': 23, 'rsi_ob': 54, 'vol_spike': 0.08179889205197773, 'adx_thresh': 13.250933091019961, 'atr_min_pct': 0.028422904978441143, 'atr_max_pct': 0.09339596639254498, 'tp_mult': 1.4711157540594797, 'tsl_mult': 0.1591281156120701, 'strategy': 'breakout', 'time_stop': 255, 'use_sma': False, 'use_atr': False, 'use_adx': False, 'use_ema': False, 'use_spike': True, 'rsi_required': False, 'edge_k': 0.6372308966360174, 'edge_cap': 0.31181432378988394, 'bull_strategy': 'breakout', 'bull_bb_std_mult': 3.3885023177795124, 'bull_rsi_os': 29, 'bull_rsi_ob': 89, 'bull_adx_thresh': 5.580109279490546, 'bull_atr_min_pct': 0.0025707006878115547, 'bull_atr_max_pct': 0.055196117266135006, 'bull_tp_mult': 1.799873129755784, 'bull_tsl_mult': 0.5195702210706101, 'bull_time_stop': 114, 'bull_use_sma': False, 'bull_use_ema': False, 'bull_use_atr': False, 'bull_use_adx': False, 'bull_use_spike': False, 'bull_rsi_required': True, 'bear_strategy': 'breakout', 'bear_bb_std_mult': 1.0113197870397703, 'bear_rsi_os': 31, 'bear_rsi_ob': 89, 'bear_adx_thresh': 11.203426866881404, 'bear_atr_min_pct': 0.007357828097895226, 'bear_atr_max_pct': 0.0885325925313137, 'bear_tp_mult': 2.1460271137836293, 'bear_tsl_mult': 0.20366992009896726, 'bear_time_stop': 182, 'bear_use_sma': False, 'bear_use_ema': False, 'bear_use_atr': False, 'bear_use_adx': False, 'bear_use_spike': False, 'bear_rsi_required': True, 'sideways_strategy': 'breakout', 'sideways_bb_std_mult': 2.39479169454863, 'sideways_rsi_os': 44, 'sideways_rsi_ob': 95, 'sideways_adx_thresh': 8.51291963349314, 'sideways_atr_min_pct': 0.00799292818862385, 'sideways_atr_max_pct': 0.134704791813982, 'sideways_tp_mult': 1.490493474358059, 'sideways_tsl_mult': 0.17699716193099413, 'sideways_time_stop': 16, 'sideways_use_sma': True, 'sideways_use_ema': False, 'sideways_use_atr': True, 'sideways_use_adx': True, 'sideways_use_spike': False, 'sideways_rsi_required': False}.
[I 2025-09-01 13:38:18,277] Trial 232 finished with values: [-0.014018091535965893, 0.013835585622248474] and parameters: {'p_sma': 34, 'p_std': 46, 'p_atr': 30, 'p_adx': 7, 'rsi_period': 70, 'ema1': 22, 'ema2': 11, 'slip_atr_k': 0.006669056699102199, 'slip_spread_k': 0.6278487959134254, 'spread_hl_frac': 0.0048067475403307134, 'bb_std_mult': 1.8691341591905408, 'rsi_os': 22, 'rsi_ob': 56, 'vol_spike': 0.07984578055786817, 'adx_thresh': 13.213247927599673, 'atr_min_pct': 0.026690449312959674, 'atr_max_pct': 0.1363933759306511, 'tp_mult': 1.4246828463459116, 'tsl_mult': 0.14190708234597582, 'strategy': 'breakout', 'time_stop': 248, 'use_sma': False, 'use_atr': False, 'use_adx': False, 'use_ema': False, 'use_spike': True, 'rsi_required': False, 'edge_k': 1.3209422707796028, 'edge_cap': 0.32284829402773324, 'bull_strategy': 'breakout', 'bull_bb_std_mult': 1.9803877948338615, 'bull_rsi_os': 19, 'bull_rsi_ob': 57, 'bull_adx_thresh': 15.674723227752487, 'bull_atr_min_pct': 0.0025065316366231958, 'bull_atr_max_pct': 0.11271394362075474, 'bull_tp_mult': 2.535461077741784, 'bull_tsl_mult': 0.40382545883217735, 'bull_time_stop': 113, 'bull_use_sma': False, 'bull_use_ema': False, 'bull_use_atr': False, 'bull_use_adx': False, 'bull_use_spike': False, 'bull_rsi_required': True, 'bear_strategy': 'breakout', 'bear_bb_std_mult': 2.0104626829546226, 'bear_rsi_os': 31, 'bear_rsi_ob': 88, 'bear_adx_thresh': 11.254261534704558, 'bear_atr_min_pct': 0.0007937353240304468, 'bear_atr_max_pct': 0.044881902723646686, 'bear_tp_mult': 2.132665009850657, 'bear_tsl_mult': 0.10073185708632354, 'bear_time_stop': 157, 'bear_use_sma': False, 'bear_use_ema': False, 'bear_use_atr': True, 'bear_use_adx': False, 'bear_use_spike': False, 'bear_rsi_required': True, 'sideways_strategy': 'breakout', 'sideways_bb_std_mult': 2.399996930366857, 'sideways_rsi_os': 44, 'sideways_rsi_ob': 83, 'sideways_adx_thresh': 8.32259739757815, 'sideways_atr_min_pct': 0.016948552672064944, 'sideways_atr_max_pct': 0.13447857062726948, 'sideways_tp_mult': 2.751360933569393, 'sideways_tsl_mult': 0.17944974084577597, 'sideways_time_stop': 16, 'sideways_use_sma': True, 'sideways_use_ema': False, 'sideways_use_atr': True, 'sideways_use_adx': True, 'sideways_use_spike': False, 'sideways_rsi_required': False}.
