[I 2025-09-01 14:04:46,403] Trial 413 finished with values: [-1000000000.0, 1000000000.0] and parameters: {'p_sma': 35, 'p_std': 45, 'p_atr': 16, 'p_adx': 10, 'rsi_period': 52, 'ema1': 22, 'ema2': 40, 'slip_atr_k': 0.06350542756031874, 'slip_spread_k': 0.5875971496734927, 'spread_hl_frac': 0.04156919616390139, 'bb_std_mult': 1.6829862665360082, 'rsi_os': 7, 'rsi_ob': 65, 'vol_spike': 0.24261070686628605, 'adx_thresh': 24.899549268757053, 'atr_min_pct': 0.021456955714282452, 'atr_max_pct': 0.10038646717444992, 'tp_mult': 1.1160094316222176, 'tsl_mult': 0.8076741944999093, 'strategy': 'breakout', 'time_stop': 246, 'use_sma': True, 'use_atr': False, 'use_adx': False, 'use_ema': True, 'use_spike': True, 'rsi_required': False, 'edge_k': 0.8621786984044342, 'edge_cap': 0.39039310789555004, 'bull_strategy': 'breakout', 'bull_bb_std_mult': 3.0419193789011842, 'bull_rsi_os': 24, 'bull_rsi_ob': 57, 'bull_adx_thresh': 29.77571841982858, 'bull_atr_min_pct': 0.02840577774377053, 'bull_atr_max_pct': 0.06252302224692916, 'bull_tp_mult': 1.2578013369747607, 'bull_tsl_mult': 0.41374093466231743, 'bull_time_stop': 94, 'bull_use_sma': True, 'bull_use_ema': True, 'bull_use_atr': True, 'bull_use_adx': True, 'bull_use_spike': False, 'bull_rsi_required': True, 'bear_strategy': 'breakout', 'bear_bb_std_mult': 3.425182407726416, 'bear_rsi_os': 33, 'bear_rsi_ob': 90, 'bear_adx_thresh': 13.890895933967812, 'bear_atr_min_pct': 0.002677784641377947, 'bear_atr_max_pct': 0.11023534229006865, 'bear_tp_mult': 1.4569271525709584, 'bear_tsl_mult': 0.9542879239429516, 'bear_time_stop': 181, 'bear_use_sma': True, 'bear_use_ema': True, 'bear_use_atr': False, 'bear_use_adx': True, 'bear_use_spike': False, 'bear_rsi_required': True, 'sideways_strategy': 'breakout', 'sideways_bb_std_mult': 2.893944907066767, 'sideways_rsi_os': 52, 'sideways_rsi_ob': 84, 'sideways_adx_thresh': 27.626840427774287, 'sideways_atr_min_pct': 0.015742134219317208, 'sideways_atr_max_pct': 0.08885211323506673, 'sideways_tp_mult': 1.9562791599067983, 'sideways_tsl_mult': 0.2938495876281344, 'sideways_time_stop': 176, 'sideways_use_sma': True, 'sideways_use_ema': False, 'sideways_use_atr': True, 'sideways_use_adx': True, 'sideways_use_spike': False, 'sideways_rsi_required': True}.
[I 2025-09-01 14:04:46,403] Trial 415 finished with values: [-0.07048324150582941, 0.06971045412513026] and parameters: {'p_sma': 40, 'p_std': 28, 'p_atr': 8, 'p_adx': 15, 'rsi_period': 69, 'ema1': 5, 'ema2': 52, 'slip_atr_k': 0.19615336460069097, 'slip_spread_k': 0.04408800660771165, 'spread_hl_frac': 0.005951430455546634, 'bb_std_mult': 2.654236084693528, 'rsi_os': 7, 'rsi_ob': 66, 'vol_spike': 0.2417727480746724, 'adx_thresh': 24.63525622090376, 'atr_min_pct': 0.015280081285861308, 'atr_max_pct': 0.1402648372382784, 'tp_mult': 1.047786121047412, 'tsl_mult': 0.2915402486465176, 'strategy': 'mean_reversion', 'time_stop': 123, 'use_sma': True, 'use_atr': False, 'use_adx': False, 'use_ema': True, 'use_spike': True, 'rsi_required': False, 'edge_k': 1.5176123512682946, 'edge_cap': 0.3945690841946531, 'bull_strategy': 'breakout', 'bull_bb_std_mult': 3.3753076605390855, 'bull_rsi_os': 36, 'bull_rsi_ob': 57, 'bull_adx_thresh': 30.544073369711178, 'bull_atr_min_pct': 0.00962903565633138, 'bull_atr_max_pct': 0.09461708588767341, 'bull_tp_mult': 2.3922312669808443, 'bull_tsl_mult': 0.809227748084826, 'bull_time_stop': 87, 'bull_use_sma': True, 'bull_use_ema': True, 'bull_use_atr': True, 'bull_use_adx': True, 'bull_use_spike': True, 'bull_rsi_required': True, 'bear_strategy': 'breakout', 'bear_bb_std_mult': 3.3446726026960003, 'bear_rsi_os': 37, 'bear_rsi_ob': 78, 'bear_adx_thresh': 8.235097934150827, 'bear_atr_min_pct': 0.002761177504900343, 'bear_atr_max_pct': 0.11075419547149615, 'bear_tp_mult': 2.1159645027671083, 'bear_tsl_mult': 0.14013748545917376, 'bear_time_stop': 240, 'bear_use_sma': True, 'bear_use_ema': True, 'bear_use_atr': False, 'bear_use_adx': True, 'bear_use_spike': False, 'bear_rsi_required': True, 'sideways_strategy': 'breakout', 'sideways_bb_std_mult': 1.4440524138485702, 'sideways_rsi_os': 53, 'sideways_rsi_ob': 66, 'sideways_adx_thresh': 27.863986073580005, 'sideways_atr_min_pct': 0.013913169418029177, 'sideways_atr_max_pct': 0.1466272201539577, 'sideways_tp_mult': 1.94818786693452, 'sideways_tsl_mult': 0.29009552855408094, 'sideways_time_stop': 254, 'sideways_use_sma': True, 'sideways_use_ema': False, 'sideways_use_atr': True, 'sideways_use_adx': True, 'sideways_use_spike': False, 'sideways_rsi_required': True}.
[I 2025-09-01 14:04:46,753] Trial 416 finished with values: [-0.0726578275757025, 0.07191769470726639] and parameters: {'p_sma': 34, 'p_std': 47, 'p_atr': 8, 'p_adx': 14, 'rsi_period': 53, 'ema1': 5, 'ema2': 15, 'slip_atr_k': 0.16228464048821037, 'slip_spread_k': 0.05590763899843537, 'spread_hl_frac': 0.0010077439631006845, 'bb_std_mult': 1.688981253438182, 'rsi_os': 43, 'rsi_ob': 85, 'vol_spike': 0.24172272371229492, 'adx_thresh': 24.77375414990755, 'atr_min_pct': 0.021321384154567306, 'atr_max_pct': 0.14041470431895656, 'tp_mult': 2.658555645637489, 'tsl_mult': 0.7376764855463661, 'strategy': 'mean_reversion', 'time_stop': 59, 'use_sma': True, 'use_atr': False, 'use_adx': True, 'use_ema': True, 'use_spike': True, 'rsi_required': False, 'edge_k': 1.5149691225343758, 'edge_cap': 0.37687537068561666, 'bull_strategy': 'breakout', 'bull_bb_std_mult': 1.5737451129997206, 'bull_rsi_os': 24, 'bull_rsi_ob': 57, 'bull_adx_thresh': 30.402532269038996, 'bull_atr_min_pct': 0.003792469006213789, 'bull_atr_max_pct': 0.04521582174705974, 'bull_tp_mult': 2.778710881244618, 'bull_tsl_mult': 0.4129521188734717, 'bull_time_stop': 89, 'bull_use_sma': True, 'bull_use_ema': True, 'bull_use_atr': True, 'bull_use_adx': True, 'bull_use_spike': True, 'bull_rsi_required': True, 'bear_strategy': 'breakout', 'bear_bb_std_mult': 1.8456975562596531, 'bear_rsi_os': 37, 'bear_rsi_ob': 62, 'bear_adx_thresh': 8.536940793234539, 'bear_atr_min_pct': 0.002776375967651716, 'bear_atr_max_pct': 0.042224728110117606, 'bear_tp_mult': 2.129867636701815, 'bear_tsl_mult': 0.6401296868669053, 'bear_time_stop': 223, 'bear_use_sma': True, 'bear_use_ema': True, 'bear_use_atr': False, 'bear_use_adx': True, 'bear_use_spike': False, 'bear_rsi_required': True, 'sideways_strategy': 'breakout', 'sideways_bb_std_mult': 2.455482190670988, 'sideways_rsi_os': 52, 'sideways_rsi_ob': 58, 'sideways_adx_thresh': 26.470171347004325, 'sideways_atr_min_pct': 0.015734895186053536, 'sideways_atr_max_pct': 0.09574994110257523, 'sideways_tp_mult': 2.7612739577733802, 'sideways_tsl_mult': 0.2886992599101488, 'sideways_time_stop': 176, 'sideways_use_sma': True, 'sideways_use_ema': False, 'sideways_use_atr': True, 'sideways_use_adx': True, 'sideways_use_spike': True, 'sideways_rsi_required': True}.
[I 2025-09-01 14:05:26,300] Trial 417 finished with values: [-1000000000.0, 1000000000.0] and parameters: {'p_sma': 40, 'p_std': 11, 'p_atr': 15, 'p_adx': 14, 'rsi_period': 26, 'ema1': 30, 'ema2': 19, 'slip_atr_k': 0.018571684380207683, 'slip_spread_k': 0.058831483367877746, 'spread_hl_frac': 0.006092428750800264, 'bb_std_mult': 2.0026868145328214, 'rsi_os': 38, 'rsi_ob': 51, 'vol_spike': 0.22336059081151174, 'adx_thresh': 24.92818532483838, 'atr_min_pct': 0.0223549780039476, 'atr_max_pct': 0.14176410996500283, 'tp_mult': 1.7998681793130364, 'tsl_mult': 0.7487653839214673, 'strategy': 'mean_reversion', 'time_stop': 246, 'use_sma': True, 'use_atr': False, 'use_adx': True, 'use_ema': True, 'use_spike': True, 'rsi_required': False, 'edge_k': 0.9878396824433721, 'edge_cap': 0.38240873290095945, 'bull_strategy': 'breakout', 'bull_bb_std_mult': 3.3280115427570713, 'bull_rsi_os': 16, 'bull_rsi_ob': 76, 'bull_adx_thresh': 30.478889411170773, 'bull_atr_min_pct': 0.028575602348519503, 'bull_atr_max_pct': 0.07969161402487568, 'bull_tp_mult': 2.8965549496996124, 'bull_tsl_mult': 0.8100264531792647, 'bull_time_stop': 109, 'bull_use_sma': True, 'bull_use_ema': True, 'bull_use_atr': True, 'bull_use_adx': False, 'bull_use_spike': True, 'bull_rsi_required': True, 'bear_strategy': 'breakout', 'bear_bb_std_mult': 3.422106055876563, 'bear_rsi_os': 5, 'bear_rsi_ob': 45, 'bear_adx_thresh': 12.558416031844748, 'bear_atr_min_pct': 0.0073404878334084, 'bear_atr_max_pct': 0.13973251573174636, 'bear_tp_mult': 2.303552168564312, 'bear_tsl_mult': 0.2115173129923043, 'bear_time_stop': 221, 'bear_use_sma': True, 'bear_use_ema': True, 'bear_use_atr': True, 'bear_use_adx': True, 'bear_use_spike': False, 'bear_rsi_required': True, 'sideways_strategy': 'breakout', 'sideways_bb_std_mult': 1.4449829309850741, 'sideways_rsi_os': 52, 'sideways_rsi_ob': 47, 'sideways_adx_thresh': 8.652954449080388, 'sideways_atr_min_pct': 0.01918047007501813, 'sideways_atr_max_pct': 0.06492021322736356, 'sideways_tp_mult': 2.7640891142785327, 'sideways_tsl_mult': 0.08517345588988023, 'sideways_time_stop': 175, 'sideways_use_sma': True, 'sideways_use_ema': False, 'sideways_use_atr': True, 'sideways_use_adx': True, 'sideways_use_spike': True, 'sideways_rsi_required': True}.
[I 2025-09-01 14:05:27,333] Trial 419 finished with values: [-1000000000.0, 1000000000.0] and parameters: {'p_sma': 38, 'p_std': 49, 'p_atr': 18, 'p_adx': 16, 'rsi_period': 66, 'ema1': 13, 'ema2': 19, 'slip_atr_k': 0.22579368721219173, 'slip_spread_k': 0.6220464338075054, 'spread_hl_frac': 0.03215146170170081, 'bb_std_mult': 1.9762284644210901, 'rsi_os': 35, 'rsi_ob': 79, 'vol_spike': 0.23357237730025476, 'adx_thresh': 33.548360925403294, 'atr_min_pct': 0.020094680753041588, 'atr_max_pct': 0.13458838116224758, 'tp_mult': 2.032269092517261, 'tsl_mult': 0.7487335752666593, 'strategy': 'mean_reversion', 'time_stop': 240, 'use_sma': True, 'use_atr': True, 'use_adx': True, 'use_ema': True, 'use_spike': True, 'rsi_required': False, 'edge_k': 0.8071954920002591, 'edge_cap': 0.31927785500828054, 'bull_strategy': 'breakout', 'bull_bb_std_mult': 1.5998905409470863, 'bull_rsi_os': 33, 'bull_rsi_ob': 53, 'bull_adx_thresh': 30.37655987523883, 'bull_atr_min_pct': 0.0031663512367789276, 'bull_atr_max_pct': 0.03983412416441619, 'bull_tp_mult': 2.8858562529800764, 'bull_tsl_mult': 0.28568627759105575, 'bull_time_stop': 117, 'bull_use_sma': True, 'bull_use_ema': True, 'bull_use_atr': True, 'bull_use_adx': False, 'bull_use_spike': True, 'bull_rsi_required': True, 'bear_strategy': 'breakout', 'bear_bb_std_mult': 2.6848086313005313, 'bear_rsi_os': 18, 'bear_rsi_ob': 74, 'bear_adx_thresh': 12.461362683473126, 'bear_atr_min_pct': 0.02609576394470519, 'bear_atr_max_pct': 0.06291968289152214, 'bear_tp_mult': 2.3098669283237947, 'bear_tsl_mult': 0.10198092521437635, 'bear_time_stop': 224, 'bear_use_sma': True, 'bear_use_ema': True, 'bear_use_atr': True, 'bear_use_adx': True, 'bear_use_spike': False, 'bear_rsi_required': True, 'sideways_strategy': 'breakout', 'sideways_bb_std_mult': 3.074415817459031, 'sideways_rsi_os': 50, 'sideways_rsi_ob': 47, 'sideways_adx_thresh': 8.49931819992133, 'sideways_atr_min_pct': 0.019358413889662265, 'sideways_atr_max_pct': 0.06522867826267228, 'sideways_tp_mult': 2.763105695789244, 'sideways_tsl_mult': 0.6256583543125507, 'sideways_time_stop': 238, 'sideways_use_sma': True, 'sideways_use_ema': False, 'sideways_use_atr': True, 'sideways_use_adx': True, 'sideways_use_spike': True, 'sideways_rsi_required': True}.
[I 2025-09-01 14:05:27,340] Trial 418 finished with values: [-1000000000.0, 1000000000.0] and parameters: {'p_sma': 38, 'p_std': 15, 'p_atr': 26, 'p_adx': 14, 'rsi_period': 26, 'ema1': 17, 'ema2': 19, 'slip_atr_k': 0.22387818589585773, 'slip_spread_k': 0.0640798320111464, 'spread_hl_frac': 0.025258607385132623, 'bb_std_mult': 0.629116211225059, 'rsi_os': 13, 'rsi_ob': 55, 'vol_spike': 0.22155687425540205, 'adx_thresh': 33.58233716118784, 'atr_min_pct': 0.016811283535452397, 'atr_max_pct': 0.05486993049802587, 'tp_mult': 1.7795998926739127, 'tsl_mult': 0.7455810486131291, 'strategy': 'mean_reversion', 'time_stop': 240, 'use_sma': True, 'use_atr': True, 'use_adx': True, 'use_ema': True, 'use_spike': True, 'rsi_required': False, 'edge_k': 1.0005005931517437, 'edge_cap': 0.3710157106294447, 'bull_strategy': 'breakout', 'bull_bb_std_mult': 3.3157215798207016, 'bull_rsi_os': 10, 'bull_rsi_ob': 53, 'bull_adx_thresh': 30.486773129774377, 'bull_atr_min_pct': 0.0029617376023207543, 'bull_atr_max_pct': 0.10181351104271663, 'bull_tp_mult': 2.8882825152952325, 'bull_tsl_mult': 0.40197217780674793, 'bull_time_stop': 86, 'bull_use_sma': True, 'bull_use_ema': True, 'bull_use_atr': True, 'bull_use_adx': False, 'bull_use_spike': True, 'bull_rsi_required': True, 'bear_strategy': 'breakout', 'bear_bb_std_mult': 1.6719424851029445, 'bear_rsi_os': 52, 'bear_rsi_ob': 74, 'bear_adx_thresh': 31.241565981942948, 'bear_atr_min_pct': 0.013779063826856125, 'bear_atr_max_pct': 0.13384664236862825, 'bear_tp_mult': 2.3103188841824696, 'bear_tsl_mult': 0.12424699552440174, 'bear_time_stop': 226, 'bear_use_sma': True, 'bear_use_ema': True, 'bear_use_atr': True, 'bear_use_adx': True, 'bear_use_spike': False, 'bear_rsi_required': True, 'sideways_strategy': 'breakout', 'sideways_bb_std_mult': 1.4707883281847582, 'sideways_rsi_os': 50, 'sideways_rsi_ob': 47, 'sideways_adx_thresh': 20.509246821129796, 'sideways_atr_min_pct': 0.019528980314026095, 'sideways_atr_max_pct': 0.06539826656141964, 'sideways_tp_mult': 1.7871488151194286, 'sideways_tsl_mult': 0.23952283266589183, 'sideways_time_stop': 243, 'sideways_use_sma': True, 'sideways_use_ema': False, 'sideways_use_atr': True, 'sideways_use_adx': True, 'sideways_use_spike': True, 'sideways_rsi_required': True}.
[I 2025-09-01 14:05:27,650] Trial 420 finished with values: [-1000000000.0, 1000000000.0] and parameters: {'p_sma': 38, 'p_std': 37, 'p_atr': 26, 'p_adx': 16, 'rsi_period': 26, 'ema1': 12, 'ema2': 19, 'slip_atr_k': 0.01992285765689943, 'slip_spread_k': 0.6133643275590038, 'spread_hl_frac': 0.004160266922032171, 'bb_std_mult': 1.7543772401894202, 'rsi_os': 38, 'rsi_ob': 55, 'vol_spike': 0.22401353722254402, 'adx_thresh': 25.565401250615018, 'atr_min_pct': 0.0224364413934708, 'atr_max_pct': 0.1437603273617441, 'tp_mult': 2.9990892379990055, 'tsl_mult': 0.320272859580191, 'strategy': 'mean_reversion', 'time_stop': 269, 'use_sma': True, 'use_atr': True, 'use_adx': True, 'use_ema': True, 'use_spike': True, 'rsi_required': False, 'edge_k': 0.818625281158649, 'edge_cap': 0.3211186735282886, 'bull_strategy': 'breakout', 'bull_bb_std_mult': 3.329895376684536, 'bull_rsi_os': 38, 'bull_rsi_ob': 76, 'bull_adx_thresh': 31.307086298759735, 'bull_atr_min_pct': 0.003087906997130732, 'bull_atr_max_pct': 0.03202721037527119, 'bull_tp_mult': 2.8741331294697963, 'bull_tsl_mult': 0.45120724128224365, 'bull_time_stop': 114, 'bull_use_sma': True, 'bull_use_ema': True, 'bull_use_atr': True, 'bull_use_adx': False, 'bull_use_spike': False, 'bull_rsi_required': True, 'bear_strategy': 'breakout', 'bear_bb_std_mult': 3.5363458577533766, 'bear_rsi_os': 5, 'bear_rsi_ob': 74, 'bear_adx_thresh': 31.160115604374298, 'bear_atr_min_pct': 0.007143297453023521, 'bear_atr_max_pct': 0.1347075920688321, 'bear_tp_mult': 2.3190422320901094, 'bear_tsl_mult': 0.21513281396398493, 'bear_time_stop': 225, 'bear_use_sma': True, 'bear_use_ema': True, 'bear_use_atr': True, 'bear_use_adx': True, 'bear_use_spike': False, 'bear_rsi_required': True, 'sideways_strategy': 'breakout', 'sideways_bb_std_mult': 2.315770955405639, 'sideways_rsi_os': 50, 'sideways_rsi_ob': 55, 'sideways_adx_thresh': 6.550990759854657, 'sideways_atr_min_pct': 0.025369093722116265, 'sideways_atr_max_pct': 0.06461028515494728, 'sideways_tp_mult': 1.8053904312573033, 'sideways_tsl_mult': 0.23631227000061938, 'sideways_time_stop': 283, 'sideways_use_sma': True, 'sideways_use_ema': False, 'sideways_use_atr': True, 'sideways_use_adx': True, 'sideways_use_spike': True, 'sideways_rsi_required': True}.
[I 2025-09-01 14:06:05,000] Trial 421 finished with values: [-0.11780340584318072, 0.11728673173429634] and parameters: {'p_sma': 38, 'p_std': 37, 'p_atr': 18, 'p_adx': 14, 'rsi_period': 42, 'ema1': 20, 'ema2': 18, 'slip_atr_k': 0.021672757183736353, 'slip_spread_k': 0.0021405521062443644, 'spread_hl_frac': 0.032168167111414556, 'bb_std_mult': 1.7580427338877964, 'rsi_os': 13, 'rsi_ob': 79, 'vol_spike': 0.2347494181479134, 'adx_thresh': 33.50691267404078, 'atr_min_pct': 0.020391913722772614, 'atr_max_pct': 0.14473580532275318, 'tp_mult': 2.0381524115714376, 'tsl_mult': 0.49129086586053705, 'strategy': 'mean_reversion', 'time_stop': 241, 'use_sma': True, 'use_atr': True, 'use_adx': False, 'use_ema': True, 'use_spike': True, 'rsi_required': False, 'edge_k': 0.004262048914703498, 'edge_cap': 0.32822104158313575, 'bull_strategy': 'breakout', 'bull_bb_std_mult': 3.47321359911375, 'bull_rsi_os': 33, 'bull_rsi_ob': 65, 'bull_adx_thresh': 31.33994984197999, 'bull_atr_min_pct': 0.02461803904377827, 'bull_atr_max_pct': 0.10159660226311373, 'bull_tp_mult': 2.076225891193473, 'bull_tsl_mult': 0.3717394166876058, 'bull_time_stop': 197, 'bull_use_sma': True, 'bull_use_ema': True, 'bull_use_atr': True, 'bull_use_adx': False, 'bull_use_spike': False, 'bull_rsi_required': True, 'bear_strategy': 'breakout', 'bear_bb_std_mult': 2.1758441260514148, 'bear_rsi_os': 50, 'bear_rsi_ob': 84, 'bear_adx_thresh': 14.993260360032174, 'bear_atr_min_pct': 0.0012930893391975336, 'bear_atr_max_pct': 0.041727900950957825, 'bear_tp_mult': 1.6927543745001088, 'bear_tsl_mult': 0.09235403203554127, 'bear_time_stop': 225, 'bear_use_sma': True, 'bear_use_ema': True, 'bear_use_atr': True, 'bear_use_adx': True, 'bear_use_spike': True, 'bear_rsi_required': True, 'sideways_strategy': 'breakout', 'sideways_bb_std_mult': 3.0497145162596673, 'sideways_rsi_os': 50, 'sideways_rsi_ob': 72, 'sideways_adx_thresh': 6.714481256057364, 'sideways_atr_min_pct': 0.01988780127383734, 'sideways_atr_max_pct': 0.14096290513208867, 'sideways_tp_mult': 2.659915633747625, 'sideways_tsl_mult': 0.808299006304866, 'sideways_time_stop': 164, 'sideways_use_sma': True, 'sideways_use_ema': False, 'sideways_use_atr': False, 'sideways_use_adx': True, 'sideways_use_spike': False, 'sideways_rsi_required': True}.
[I 2025-09-01 14:06:05,001] Trial 422 finished with values: [-1000000000.0, 1000000000.0] and parameters: {'p_sma': 36, 'p_std': 48, 'p_atr': 12, 'p_adx': 15, 'rsi_period': 42, 'ema1': 20, 'ema2': 18, 'slip_atr_k': 0.1256535642103654, 'slip_spread_k': 0.10791128263678701, 'spread_hl_frac': 0.004192897351782902, 'bb_std_mult': 3.3157319001061945, 'rsi_os': 40, 'rsi_ob': 81, 'vol_spike': 0.2329963248205809, 'adx_thresh': 27.947733276168023, 'atr_min_pct': 0.0082138412587181, 'atr_max_pct': 0.11520179102957351, 'tp_mult': 1.6627171617646677, 'tsl_mult': 0.6784591536449355, 'strategy': 'mean_reversion', 'time_stop': 166, 'use_sma': False, 'use_atr': False, 'use_adx': False, 'use_ema': False, 'use_spike': True, 'rsi_required': True, 'edge_k': 1.0553250219784331, 'edge_cap': 0.3353078160191553, 'bull_strategy': 'mean_reversion', 'bull_bb_std_mult': 3.104216725516268, 'bull_rsi_os': 38, 'bull_rsi_ob': 66, 'bull_adx_thresh': 31.304198982558933, 'bull_atr_min_pct': 0.00362595481707421, 'bull_atr_max_pct': 0.08624770533936765, 'bull_tp_mult': 2.8349231204130616, 'bull_tsl_mult': 0.7504841060871483, 'bull_time_stop': 67, 'bull_use_sma': True, 'bull_use_ema': False, 'bull_use_atr': False, 'bull_use_adx': True, 'bull_use_spike': False, 'bull_rsi_required': True, 'bear_strategy': 'breakout', 'bear_bb_std_mult': 3.556606059501673, 'bear_rsi_os': 23, 'bear_rsi_ob': 87, 'bear_adx_thresh': 11.47252828449521, 'bear_atr_min_pct': 0.0013487758898691198, 'bear_atr_max_pct': 0.01780720856454128, 'bear_tp_mult': 2.2539480999112094, 'bear_tsl_mult': 0.06354441772400797, 'bear_time_stop': 15, 'bear_use_sma': False, 'bear_use_ema': True, 'bear_use_atr': True, 'bear_use_adx': True, 'bear_use_spike': True, 'bear_rsi_required': True, 'sideways_strategy': 'mean_reversion', 'sideways_bb_std_mult': 2.3336464834349377, 'sideways_rsi_os': 20, 'sideways_rsi_ob': 86, 'sideways_adx_thresh': 6.759664603708118, 'sideways_atr_min_pct': 0.006314733147135839, 'sideways_atr_max_pct': 0.0702167129573966, 'sideways_tp_mult': 2.3079777888285187, 'sideways_tsl_mult': 0.8039545917320383, 'sideways_time_stop': 206, 'sideways_use_sma': True, 'sideways_use_ema': False, 'sideways_use_atr': False, 'sideways_use_adx': True, 'sideways_use_spike': False, 'sideways_rsi_required': False}.
