[I 2025-09-01 14:48:12,969] Trial 712 finished with values: [-1000000000.0, 1000000000.0] and parameters: {'p_sma': 40, 'p_std': 26, 'p_atr': 17, 'p_adx': 24, 'rsi_period': 71, 'ema1': 20, 'ema2': 21, 'slip_atr_k': 0.1434753557463134, 'slip_spread_k': 0.20345456413897967, 'spread_hl_frac': 0.009376750213567143, 'bb_std_mult': 2.0588686867398995, 'rsi_os': 31, 'rsi_ob': 66, 'vol_spike': 0.2291830521933508, 'adx_thresh': 24.739807549178042, 'atr_min_pct': 0.028493977586891463, 'atr_max_pct': 0.14078301143112237, 'tp_mult': 1.9111542432231579, 'tsl_mult': 0.7053385813635434, 'strategy': 'mean_reversion', 'time_stop': 280, 'use_sma': True, 'use_atr': True, 'use_adx': True, 'use_ema': True, 'use_spike': True, 'rsi_required': True, 'edge_k': 0.9197961562636533, 'edge_cap': 0.26472625750373735, 'bull_strategy': 'breakout', 'bull_bb_std_mult': 1.7580514782379055, 'bull_rsi_os': 35, 'bull_rsi_ob': 52, 'bull_adx_thresh': 31.40468112335276, 'bull_atr_min_pct': 0.020255456366749306, 'bull_atr_max_pct': 0.023739141815525087, 'bull_tp_mult': 1.4055121619499404, 'bull_tsl_mult': 0.35385203084933636, 'bull_time_stop': 79, 'bull_use_sma': True, 'bull_use_ema': True, 'bull_use_atr': True, 'bull_use_adx': True, 'bull_use_spike': False, 'bull_rsi_required': False, 'bear_strategy': 'breakout', 'bear_bb_std_mult': 1.2198390687787741, 'bear_rsi_os': 32, 'bear_rsi_ob': 55, 'bear_adx_thresh': 23.86065166538647, 'bear_atr_min_pct': 0.0020498767151249297, 'bear_atr_max_pct': 0.05095517819256362, 'bear_tp_mult': 2.257722248298829, 'bear_tsl_mult': 0.1753380969219351, 'bear_time_stop': 86, 'bear_use_sma': True, 'bear_use_ema': True, 'bear_use_atr': True, 'bear_use_adx': False, 'bear_use_spike': True, 'bear_rsi_required': True, 'sideways_strategy': 'breakout', 'sideways_bb_std_mult': 2.8312532800362504, 'sideways_rsi_os': 8, 'sideways_rsi_ob': 69, 'sideways_adx_thresh': 6.950954137973313, 'sideways_atr_min_pct': 0.02078426919320473, 'sideways_atr_max_pct': 0.07478099246406704, 'sideways_tp_mult': 1.1479480714781625, 'sideways_tsl_mult': 0.31224415258450416, 'sideways_time_stop': 243, 'sideways_use_sma': True, 'sideways_use_ema': False, 'sideways_use_atr': False, 'sideways_use_adx': True, 'sideways_use_spike': False, 'sideways_rsi_required': True}.
[I 2025-09-01 14:48:13,518] Trial 713 finished with values: [-1000000000.0, 1000000000.0] and parameters: {'p_sma': 35, 'p_std': 51, 'p_atr': 17, 'p_adx': 12, 'rsi_period': 70, 'ema1': 22, 'ema2': 16, 'slip_atr_k': 0.15313410676672287, 'slip_spread_k': 0.06656913303537049, 'spread_hl_frac': 0.009786113036423759, 'bb_std_mult': 1.8833721705979833, 'rsi_os': 38, 'rsi_ob': 70, 'vol_spike': 0.2482658631113417, 'adx_thresh': 5.501155079853671, 'atr_min_pct': 0.027000303026581525, 'atr_max_pct': 0.03148173448508913, 'tp_mult': 1.8751486896351448, 'tsl_mult': 0.7165563363707327, 'strategy': 'mean_reversion', 'time_stop': 217, 'use_sma': True, 'use_atr': True, 'use_adx': True, 'use_ema': True, 'use_spike': True, 'rsi_required': False, 'edge_k': 0.9329816695020237, 'edge_cap': 0.4975755503865855, 'bull_strategy': 'breakout', 'bull_bb_std_mult': 2.987967066670981, 'bull_rsi_os': 16, 'bull_rsi_ob': 52, 'bull_adx_thresh': 31.078181571484592, 'bull_atr_min_pct': 0.003319315923829128, 'bull_atr_max_pct': 0.025571562816717512, 'bull_tp_mult': 2.868805319155526, 'bull_tsl_mult': 0.4835242750515688, 'bull_time_stop': 95, 'bull_use_sma': True, 'bull_use_ema': True, 'bull_use_atr': True, 'bull_use_adx': True, 'bull_use_spike': False, 'bull_rsi_required': False, 'bear_strategy': 'mean_reversion', 'bear_bb_std_mult': 3.53091342872711, 'bear_rsi_os': 26, 'bear_rsi_ob': 59, 'bear_adx_thresh': 12.002766544152573, 'bear_atr_min_pct': 0.017880730153915704, 'bear_atr_max_pct': 0.09558999202114625, 'bear_tp_mult': 2.213349950210732, 'bear_tsl_mult': 0.11806820118657003, 'bear_time_stop': 221, 'bear_use_sma': True, 'bear_use_ema': True, 'bear_use_atr': True, 'bear_use_adx': False, 'bear_use_spike': False, 'bear_rsi_required': True, 'sideways_strategy': 'breakout', 'sideways_bb_std_mult': 1.308143239661011, 'sideways_rsi_os': 18, 'sideways_rsi_ob': 84, 'sideways_adx_thresh': 7.174304661591631, 'sideways_atr_min_pct': 0.020585766350354796, 'sideways_atr_max_pct': 0.07656653780323198, 'sideways_tp_mult': 2.7292440273455494, 'sideways_tsl_mult': 0.4334921094072133, 'sideways_time_stop': 191, 'sideways_use_sma': True, 'sideways_use_ema': False, 'sideways_use_atr': True, 'sideways_use_adx': True, 'sideways_use_spike': True, 'sideways_rsi_required': True}.
[I 2025-09-01 14:48:13,900] Trial 711 finished with values: [-1000000000.0, 1000000000.0] and parameters: {'p_sma': 40, 'p_std': 32, 'p_atr': 17, 'p_adx': 24, 'rsi_period': 67, 'ema1': 8, 'ema2': 21, 'slip_atr_k': 0.22679214683192134, 'slip_spread_k': 0.7538132427181687, 'spread_hl_frac': 0.03451475566106077, 'bb_std_mult': 1.8716586248239984, 'rsi_os': 47, 'rsi_ob': 78, 'vol_spike': 0.11717411441675793, 'adx_thresh': 24.4402554150783, 'atr_min_pct': 0.02698853782125874, 'atr_max_pct': 0.14509474956113588, 'tp_mult': 2.8956638232087752, 'tsl_mult': 0.940498547402223, 'strategy': 'mean_reversion', 'time_stop': 213, 'use_sma': True, 'use_atr': True, 'use_adx': True, 'use_ema': True, 'use_spike': True, 'rsi_required': True, 'edge_k': 0.9204564945002662, 'edge_cap': 0.3785223910287979, 'bull_strategy': 'breakout', 'bull_bb_std_mult': 1.7581619289119192, 'bull_rsi_os': 35, 'bull_rsi_ob': 52, 'bull_adx_thresh': 31.632051794072588, 'bull_atr_min_pct': 0.020263398372867922, 'bull_atr_max_pct': 0.024414320131510365, 'bull_tp_mult': 2.2830288453577747, 'bull_tsl_mult': 0.4278417078351727, 'bull_time_stop': 81, 'bull_use_sma': True, 'bull_use_ema': True, 'bull_use_atr': True, 'bull_use_adx': True, 'bull_use_spike': False, 'bull_rsi_required': False, 'bear_strategy': 'breakout', 'bear_bb_std_mult': 3.498128678242207, 'bear_rsi_os': 11, 'bear_rsi_ob': 90, 'bear_adx_thresh': 11.05901506010922, 'bear_atr_min_pct': 0.01796030827835693, 'bear_atr_max_pct': 0.05104666897968904, 'bear_tp_mult': 2.198903170806945, 'bear_tsl_mult': 0.11487532850855325, 'bear_time_stop': 220, 'bear_use_sma': True, 'bear_use_ema': True, 'bear_use_atr': True, 'bear_use_adx': False, 'bear_use_spike': True, 'bear_rsi_required': True, 'sideways_strategy': 'breakout', 'sideways_bb_std_mult': 1.4982682875907192, 'sideways_rsi_os': 18, 'sideways_rsi_ob': 69, 'sideways_adx_thresh': 6.815124633125998, 'sideways_atr_min_pct': 0.016069535022504265, 'sideways_atr_max_pct': 0.07459284026844104, 'sideways_tp_mult': 2.417780160384479, 'sideways_tsl_mult': 0.3135406585888561, 'sideways_time_stop': 192, 'sideways_use_sma': True, 'sideways_use_ema': False, 'sideways_use_atr': False, 'sideways_use_adx': True, 'sideways_use_spike': False, 'sideways_rsi_required': True}.
[I 2025-09-01 14:48:14,223] Trial 714 finished with values: [-1000000000.0, 1000000000.0] and parameters: {'p_sma': 51, 'p_std': 50, 'p_atr': 24, 'p_adx': 24, 'rsi_period': 71, 'ema1': 22, 'ema2': 21, 'slip_atr_k': 0.01706368633148936, 'slip_spread_k': 0.13009643894229272, 'spread_hl_frac': 0.003799388368385163, 'bb_std_mult': 2.263575509758537, 'rsi_os': 41, 'rsi_ob': 81, 'vol_spike': 0.24989014299733112, 'adx_thresh': 5.729270634180596, 'atr_min_pct': 0.02646912946612975, 'atr_max_pct': 0.13017665858633612, 'tp_mult': 1.0729768857773347, 'tsl_mult': 0.647802247597958, 'strategy': 'mean_reversion', 'time_stop': 214, 'use_sma': True, 'use_atr': True, 'use_adx': False, 'use_ema': True, 'use_spike': True, 'rsi_required': False, 'edge_k': 1.0143677688688462, 'edge_cap': 0.5619350746218068, 'bull_strategy': 'breakout', 'bull_bb_std_mult': 3.2741709552783704, 'bull_rsi_os': 54, 'bull_rsi_ob': 52, 'bull_adx_thresh': 29.67117172082511, 'bull_atr_min_pct': 0.004132188959881474, 'bull_atr_max_pct': 0.025271177947402693, 'bull_tp_mult': 2.9586149850388415, 'bull_tsl_mult': 0.3550342737808686, 'bull_time_stop': 95, 'bull_use_sma': True, 'bull_use_ema': True, 'bull_use_atr': True, 'bull_use_adx': True, 'bull_use_spike': False, 'bull_rsi_required': False, 'bear_strategy': 'mean_reversion', 'bear_bb_std_mult': 3.532085498918174, 'bear_rsi_os': 33, 'bear_rsi_ob': 89, 'bear_adx_thresh': 12.074677820277373, 'bear_atr_min_pct': 0.002260872297901907, 'bear_atr_max_pct': 0.0955956165444894, 'bear_tp_mult': 2.206919833282162, 'bear_tsl_mult': 0.1764874202752244, 'bear_time_stop': 119, 'bear_use_sma': True, 'bear_use_ema': True, 'bear_use_atr': True, 'bear_use_adx': True, 'bear_use_spike': False, 'bear_rsi_required': True, 'sideways_strategy': 'breakout', 'sideways_bb_std_mult': 1.4901873086537978, 'sideways_rsi_os': 52, 'sideways_rsi_ob': 77, 'sideways_adx_thresh': 8.76355984399481, 'sideways_atr_min_pct': 0.02081139575762037, 'sideways_atr_max_pct': 0.0781068356696054, 'sideways_tp_mult': 2.413499668678609, 'sideways_tsl_mult': 0.3182452208746113, 'sideways_time_stop': 194, 'sideways_use_sma': True, 'sideways_use_ema': False, 'sideways_use_atr': True, 'sideways_use_adx': True, 'sideways_use_spike': True, 'sideways_rsi_required': True}.
[I 2025-09-01 14:48:54,495] Trial 715 finished with values: [-1000000000.0, 1000000000.0] and parameters: {'p_sma': 20, 'p_std': 31, 'p_atr': 24, 'p_adx': 25, 'rsi_period': 25, 'ema1': 28, 'ema2': 19, 'slip_atr_k': 0.15098768693270564, 'slip_spread_k': 0.12861080001445815, 'spread_hl_frac': 0.0147292333153257, 'bb_std_mult': 1.8730798356496672, 'rsi_os': 29, 'rsi_ob': 78, 'vol_spike': 0.24887138386149626, 'adx_thresh': 26.734995868194808, 'atr_min_pct': 0.027077573411215614, 'atr_max_pct': 0.12422843747201412, 'tp_mult': 1.0499343874482618, 'tsl_mult': 0.6521276874051656, 'strategy': 'mean_reversion', 'time_stop': 244, 'use_sma': True, 'use_atr': True, 'use_adx': False, 'use_ema': True, 'use_spike': True, 'rsi_required': False, 'edge_k': 0.8719185691747424, 'edge_cap': 0.3779580566587655, 'bull_strategy': 'mean_reversion', 'bull_bb_std_mult': 3.252628150440169, 'bull_rsi_os': 37, 'bull_rsi_ob': 57, 'bull_adx_thresh': 19.399877034162213, 'bull_atr_min_pct': 0.004582101650932508, 'bull_atr_max_pct': 0.01633227123863508, 'bull_tp_mult': 2.9258355853864537, 'bull_tsl_mult': 0.4915940635612415, 'bull_time_stop': 96, 'bull_use_sma': True, 'bull_use_ema': True, 'bull_use_atr': True, 'bull_use_adx': True, 'bull_use_spike': False, 'bull_rsi_required': False, 'bear_strategy': 'mean_reversion', 'bear_bb_std_mult': 0.6060002141295446, 'bear_rsi_os': 14, 'bear_rsi_ob': 89, 'bear_adx_thresh': 13.11746593030401, 'bear_atr_min_pct': 0.02441331263122192, 'bear_atr_max_pct': 0.12858189934292616, 'bear_tp_mult': 2.203862769411266, 'bear_tsl_mult': 0.12021122105284615, 'bear_time_stop': 223, 'bear_use_sma': False, 'bear_use_ema': True, 'bear_use_atr': True, 'bear_use_adx': True, 'bear_use_spike': False, 'bear_rsi_required': True, 'sideways_strategy': 'mean_reversion', 'sideways_bb_std_mult': 2.652839256541458, 'sideways_rsi_os': 18, 'sideways_rsi_ob': 68, 'sideways_adx_thresh': 30.967611641602588, 'sideways_atr_min_pct': 0.01618932446556328, 'sideways_atr_max_pct': 0.06645176356855717, 'sideways_tp_mult': 2.70963529255969, 'sideways_tsl_mult': 0.30739115881533285, 'sideways_time_stop': 169, 'sideways_use_sma': True, 'sideways_use_ema': False, 'sideways_use_atr': True, 'sideways_use_adx': True, 'sideways_use_spike': True, 'sideways_rsi_required': True}.
[I 2025-09-01 14:48:55,067] Trial 718 finished with values: [-1000000000.0, 1000000000.0] and parameters: {'p_sma': 36, 'p_std': 21, 'p_atr': 27, 'p_adx': 25, 'rsi_period': 32, 'ema1': 11, 'ema2': 18, 'slip_atr_k': 0.013445166366768332, 'slip_spread_k': 0.259867032755703, 'spread_hl_frac': 0.014909945046585188, 'bb_std_mult': 1.5522094603487293, 'rsi_os': 40, 'rsi_ob': 64, 'vol_spike': 0.2272738081571512, 'adx_thresh': 25.03207636854895, 'atr_min_pct': 0.025459293360928118, 'atr_max_pct': 0.13362458060734442, 'tp_mult': 1.4028792686172606, 'tsl_mult': 0.8370295021438947, 'strategy': 'mean_reversion', 'time_stop': 249, 'use_sma': False, 'use_atr': False, 'use_adx': False, 'use_ema': False, 'use_spike': True, 'rsi_required': False, 'edge_k': 1.356731861419623, 'edge_cap': 0.9246031755563469, 'bull_strategy': 'mean_reversion', 'bull_bb_std_mult': 2.8746158995760798, 'bull_rsi_os': 32, 'bull_rsi_ob': 56, 'bull_adx_thresh': 18.962343504138296, 'bull_atr_min_pct': 0.004446289134011258, 'bull_atr_max_pct': 0.015794404567999368, 'bull_tp_mult': 1.770346292589091, 'bull_tsl_mult': 0.7557931863232155, 'bull_time_stop': 112, 'bull_use_sma': True, 'bull_use_ema': True, 'bull_use_atr': False, 'bull_use_adx': True, 'bull_use_spike': True, 'bull_rsi_required': True, 'bear_strategy': 'breakout', 'bear_bb_std_mult': 2.189708908980658, 'bear_rsi_os': 32, 'bear_rsi_ob': 86, 'bear_adx_thresh': 12.88563626893988, 'bear_atr_min_pct': 0.003132058526831086, 'bear_atr_max_pct': 0.11717193501051201, 'bear_tp_mult': 2.3155012160191726, 'bear_tsl_mult': 0.5453858007272323, 'bear_time_stop': 150, 'bear_use_sma': False, 'bear_use_ema': True, 'bear_use_atr': False, 'bear_use_adx': True, 'bear_use_spike': False, 'bear_rsi_required': True, 'sideways_strategy': 'mean_reversion', 'sideways_bb_std_mult': 3.3668887153623355, 'sideways_rsi_os': 53, 'sideways_rsi_ob': 47, 'sideways_adx_thresh': 6.204384237592184, 'sideways_atr_min_pct': 0.019889794917203715, 'sideways_atr_max_pct': 0.0669067034514138, 'sideways_tp_mult': 1.8651765823824296, 'sideways_tsl_mult': 0.10760060525940196, 'sideways_time_stop': 98, 'sideways_use_sma': True, 'sideways_use_ema': True, 'sideways_use_atr': True, 'sideways_use_adx': True, 'sideways_use_spike': False, 'sideways_rsi_required': True}.
[I 2025-09-01 14:48:55,630] Trial 716 finished with values: [-1000000000.0, 1000000000.0] and parameters: {'p_sma': 49, 'p_std': 56, 'p_atr': 27, 'p_adx': 11, 'rsi_period': 32, 'ema1': 11, 'ema2': 20, 'slip_atr_k': 0.22625328108034226, 'slip_spread_k': 0.13149109061247516, 'spread_hl_frac': 0.04474874642827893, 'bb_std_mult': 1.854226933155704, 'rsi_os': 29, 'rsi_ob': 81, 'vol_spike': 0.18020072956147565, 'adx_thresh': 28.32840304612421, 'atr_min_pct': 0.0023654784084724267, 'atr_max_pct': 0.12516034441584206, 'tp_mult': 2.8958945603927164, 'tsl_mult': 0.8327966408848316, 'strategy': 'mean_reversion', 'time_stop': 48, 'use_sma': True, 'use_atr': False, 'use_adx': False, 'use_ema': True, 'use_spike': True, 'rsi_required': False, 'edge_k': 0.17595276938242466, 'edge_cap': 0.37529887699167414, 'bull_strategy': 'mean_reversion', 'bull_bb_std_mult': 2.8279668682599524, 'bull_rsi_os': 32, 'bull_rsi_ob': 78, 'bull_adx_thresh': 29.579656799345894, 'bull_atr_min_pct': 0.0044768987946080885, 'bull_atr_max_pct': 0.05795483594951065, 'bull_tp_mult': 2.9493755815558247, 'bull_tsl_mult': 0.4137471564001179, 'bull_time_stop': 95, 'bull_use_sma': True, 'bull_use_ema': True, 'bull_use_atr': False, 'bull_use_adx': True, 'bull_use_spike': True, 'bull_rsi_required': True, 'bear_strategy': 'breakout', 'bear_bb_std_mult': 3.4586433789526727, 'bear_rsi_os': 33, 'bear_rsi_ob': 51, 'bear_adx_thresh': 13.189119621081833, 'bear_atr_min_pct': 0.0243055148794603, 'bear_atr_max_pct': 0.04357930077231066, 'bear_tp_mult': 1.92378420079886, 'bear_tsl_mult': 0.2147386625760931, 'bear_time_stop': 230, 'bear_use_sma': False, 'bear_use_ema': True, 'bear_use_atr': True, 'bear_use_adx': True, 'bear_use_spike': False, 'bear_rsi_required': True, 'sideways_strategy': 'mean_reversion', 'sideways_bb_std_mult': 2.3307364575880802, 'sideways_rsi_os': 52, 'sideways_rsi_ob': 68, 'sideways_adx_thresh': 28.532503098607062, 'sideways_atr_min_pct': 0.02330528727868682, 'sideways_atr_max_pct': 0.0466251149853291, 'sideways_tp_mult': 2.397797846281601, 'sideways_tsl_mult': 0.49874528403349505, 'sideways_time_stop': 97, 'sideways_use_sma': True, 'sideways_use_ema': True, 'sideways_use_atr': True, 'sideways_use_adx': True, 'sideways_use_spike': False, 'sideways_rsi_required': True}.
[I 2025-09-01 14:48:55,875] Trial 717 finished with values: [-1000000000.0, 1000000000.0] and parameters: {'p_sma': 15, 'p_std': 54, 'p_atr': 24, 'p_adx': 11, 'rsi_period': 25, 'ema1': 25, 'ema2': 26, 'slip_atr_k': 0.016854941292857552, 'slip_spread_k': 0.13026851580014176, 'spread_hl_frac': 0.00455980340840452, 'bb_std_mult': 3.0633186299763686, 'rsi_os': 25, 'rsi_ob': 76, 'vol_spike': 0.24230863678746487, 'adx_thresh': 11.186678437735397, 'atr_min_pct': 0.002300904138369907, 'atr_max_pct': 0.014358145124693217, 'tp_mult': 1.0389018004640864, 'tsl_mult': 0.8353043703005967, 'strategy': 'mean_reversion', 'time_stop': 247, 'use_sma': False, 'use_atr': False, 'use_adx': False, 'use_ema': True, 'use_spike': True, 'rsi_required': False, 'edge_k': 0.8778788364716094, 'edge_cap': 0.573450263906654, 'bull_strategy': 'mean_reversion', 'bull_bb_std_mult': 3.275673547137707, 'bull_rsi_os': 54, 'bull_rsi_ob': 68, 'bull_adx_thresh': 19.105192848949038, 'bull_atr_min_pct': 0.0014246487506763914, 'bull_atr_max_pct': 0.015202615420880902, 'bull_tp_mult': 2.9442665388941656, 'bull_tsl_mult': 0.3758468406234442, 'bull_time_stop': 94, 'bull_use_sma': True, 'bull_use_ema': True, 'bull_use_atr': False, 'bull_use_adx': True, 'bull_use_spike': True, 'bull_rsi_required': True, 'bear_strategy': 'mean_reversion', 'bear_bb_std_mult': 2.6759255604938903, 'bear_rsi_os': 41, 'bear_rsi_ob': 89, 'bear_adx_thresh': 12.951501585926147, 'bear_atr_min_pct': 0.024510909329389166, 'bear_atr_max_pct': 0.041646456473311916, 'bear_tp_mult': 1.114005308271884, 'bear_tsl_mult': 0.14495240013981456, 'bear_time_stop': 293, 'bear_use_sma': False, 'bear_use_ema': True, 'bear_use_atr': True, 'bear_use_adx': True, 'bear_use_spike': False, 'bear_rsi_required': True, 'sideways_strategy': 'mean_reversion', 'sideways_bb_std_mult': 1.772271636834125, 'sideways_rsi_os': 30, 'sideways_rsi_ob': 68, 'sideways_adx_thresh': 8.688402812942265, 'sideways_atr_min_pct': 0.02572417920119332, 'sideways_atr_max_pct': 0.04581117698480718, 'sideways_tp_mult': 2.723988549214837, 'sideways_tsl_mult': 0.4969209692810232, 'sideways_time_stop': 163, 'sideways_use_sma': True, 'sideways_use_ema': True, 'sideways_use_atr': True, 'sideways_use_adx': True, 'sideways_use_spike': True, 'sideways_rsi_required': True}.
[I 2025-09-01 14:49:31,774] Trial 721 finished with values: [-0.062421018425999675, 0.061755478288812] and parameters: {'p_sma': 34, 'p_std': 47, 'p_atr': 23, 'p_adx': 10, 'rsi_period': 62, 'ema1': 16, 'ema2': 17, 'slip_atr_k': 0.12686343435956915, 'slip_spread_k': 0.41017226673491197, 'spread_hl_frac': 0.005933175844135261, 'bb_std_mult': 2.3437425847396534, 'rsi_os': 11, 'rsi_ob': 57, 'vol_spike': 0.24464379590132077, 'adx_thresh': 10.873480095657035, 'atr_min_pct': 0.012305087403174576, 'atr_max_pct': 0.13681153006846414, 'tp_mult': 1.0342462893228843, 'tsl_mult': 0.7904796860638716, 'strategy': 'breakout', 'time_stop': 95, 'use_sma': False, 'use_atr': False, 'use_adx': False, 'use_ema': True, 'use_spike': True, 'rsi_required': False, 'edge_k': 0.8801100339243807, 'edge_cap': 0.3519816428347015, 'bull_strategy': 'breakout', 'bull_bb_std_mult': 2.522601083818545, 'bull_rsi_os': 45, 'bull_rsi_ob': 55, 'bull_adx_thresh': 30.37741836746517, 'bull_atr_min_pct': 0.005580421803506186, 'bull_atr_max_pct': 0.03171856178596548, 'bull_tp_mult': 1.4657264008217412, 'bull_tsl_mult': 0.4446461701670809, 'bull_time_stop': 87, 'bull_use_sma': False, 'bull_use_ema': False, 'bull_use_atr': True, 'bull_use_adx': False, 'bull_use_spike': False, 'bull_rsi_required': True, 'bear_strategy': 'breakout', 'bear_bb_std_mult': 1.9071786675987903, 'bear_rsi_os': 44, 'bear_rsi_ob': 92, 'bear_adx_thresh': 11.934208278408946, 'bear_atr_min_pct': 0.0030820916301701152, 'bear_atr_max_pct': 0.04182651571889107, 'bear_tp_mult': 1.1236152815821254, 'bear_tsl_mult': 0.1495314682362796, 'bear_time_stop': 180, 'bear_use_sma': True, 'bear_use_ema': True, 'bear_use_atr': True, 'bear_use_adx': True, 'bear_use_spike': False, 'bear_rsi_required': True, 'sideways_strategy': 'breakout', 'sideways_bb_std_mult': 1.6467994258176297, 'sideways_rsi_os': 51, 'sideways_rsi_ob': 65, 'sideways_adx_thresh': 24.66144937316804, 'sideways_atr_min_pct': 0.025757038040854927, 'sideways_atr_max_pct': 0.10960547379897168, 'sideways_tp_mult': 2.573605723686028, 'sideways_tsl_mult': 0.27883444854370426, 'sideways_time_stop': 166, 'sideways_use_sma': True, 'sideways_use_ema': False, 'sideways_use_atr': True, 'sideways_use_adx': False, 'sideways_use_spike': False, 'sideways_rsi_required': True}.
