[I 2025-09-01 15:13:40,627] Trial 865 finished with values: [-1000000000.0, 1000000000.0] and parameters: {'p_sma': 38, 'p_std': 49, 'p_atr': 20, 'p_adx': 22, 'rsi_period': 67, 'ema1': 24, 'ema2': 18, 'slip_atr_k': 0.009236742173716766, 'slip_spread_k': 0.8715052336364026, 'spread_hl_frac': 0.005539127263326409, 'bb_std_mult': 1.674343114671838, 'rsi_os': 35, 'rsi_ob': 78, 'vol_spike': 0.1899720271755079, 'adx_thresh': 13.483192490515528, 'atr_min_pct': 0.015430165710283121, 'atr_max_pct': 0.13935897690562296, 'tp_mult': 1.1517168086476424, 'tsl_mult': 0.729390708238473, 'strategy': 'breakout', 'time_stop': 224, 'use_sma': True, 'use_atr': False, 'use_adx': False, 'use_ema': False, 'use_spike': True, 'rsi_required': True, 'edge_k': 0.9810582362925098, 'edge_cap': 0.2712026139659699, 'bull_strategy': 'mean_reversion', 'bull_bb_std_mult': 3.452630179811632, 'bull_rsi_os': 23, 'bull_rsi_ob': 53, 'bull_adx_thresh': 29.767246107371022, 'bull_atr_min_pct': 0.012448123206617253, 'bull_atr_max_pct': 0.024057156483088135, 'bull_tp_mult': 2.8327636083832703, 'bull_tsl_mult': 0.12041155036438828, 'bull_time_stop': 92, 'bull_use_sma': True, 'bull_use_ema': False, 'bull_use_atr': True, 'bull_use_adx': True, 'bull_use_spike': False, 'bull_rsi_required': False, 'bear_strategy': 'mean_reversion', 'bear_bb_std_mult': 3.541812626860486, 'bear_rsi_os': 35, 'bear_rsi_ob': 88, 'bear_adx_thresh': 6.833690593943498, 'bear_atr_min_pct': 0.011952756422450316, 'bear_atr_max_pct': 0.13274027859930815, 'bear_tp_mult': 1.7742111851333, 'bear_tsl_mult': 0.35273337591229503, 'bear_time_stop': 46, 'bear_use_sma': True, 'bear_use_ema': False, 'bear_use_atr': False, 'bear_use_adx': False, 'bear_use_spike': False, 'bear_rsi_required': True, 'sideways_strategy': 'mean_reversion', 'sideways_bb_std_mult': 1.5385210682742567, 'sideways_rsi_os': 9, 'sideways_rsi_ob': 76, 'sideways_adx_thresh': 33.441452858998005, 'sideways_atr_min_pct': 0.021709735077437124, 'sideways_atr_max_pct': 0.07212710580529104, 'sideways_tp_mult': 2.146815165366589, 'sideways_tsl_mult': 0.12669892106519282, 'sideways_time_stop': 72, 'sideways_use_sma': True, 'sideways_use_ema': False, 'sideways_use_atr': True, 'sideways_use_adx': True, 'sideways_use_spike': False, 'sideways_rsi_required': True}.
[I 2025-09-01 15:13:40,808] Trial 864 finished with values: [-1000000000.0, 1000000000.0] and parameters: {'p_sma': 39, 'p_std': 48, 'p_atr': 26, 'p_adx': 27, 'rsi_period': 67, 'ema1': 21, 'ema2': 23, 'slip_atr_k': 0.1194494653638541, 'slip_spread_k': 0.0731854647524246, 'spread_hl_frac': 0.00811127109052094, 'bb_std_mult': 1.6608102539103116, 'rsi_os': 38, 'rsi_ob': 78, 'vol_spike': 0.2442441284332321, 'adx_thresh': 13.714862765803847, 'atr_min_pct': 0.013193154435819216, 'atr_max_pct': 0.09187059549270617, 'tp_mult': 2.926407378647064, 'tsl_mult': 0.7319026780958898, 'strategy': 'breakout', 'time_stop': 122, 'use_sma': True, 'use_atr': False, 'use_adx': False, 'use_ema': False, 'use_spike': True, 'rsi_required': True, 'edge_k': 1.4348758332154616, 'edge_cap': 0.36872765355846177, 'bull_strategy': 'mean_reversion', 'bull_bb_std_mult': 3.1313805285022096, 'bull_rsi_os': 30, 'bull_rsi_ob': 52, 'bull_adx_thresh': 34.902936414842074, 'bull_atr_min_pct': 0.012440234304577876, 'bull_atr_max_pct': 0.02388296381327945, 'bull_tp_mult': 2.071933639159269, 'bull_tsl_mult': 0.4058384099916845, 'bull_time_stop': 90, 'bull_use_sma': True, 'bull_use_ema': False, 'bull_use_atr': True, 'bull_use_adx': True, 'bull_use_spike': False, 'bull_rsi_required': False, 'bear_strategy': 'mean_reversion', 'bear_bb_std_mult': 2.665058047990126, 'bear_rsi_os': 16, 'bear_rsi_ob': 48, 'bear_adx_thresh': 11.595523392303418, 'bear_atr_min_pct': 0.011833925854863626, 'bear_atr_max_pct': 0.016483223465980204, 'bear_tp_mult': 2.1385558023633764, 'bear_tsl_mult': 0.20996331185388806, 'bear_time_stop': 226, 'bear_use_sma': True, 'bear_use_ema': False, 'bear_use_atr': False, 'bear_use_adx': False, 'bear_use_spike': False, 'bear_rsi_required': True, 'sideways_strategy': 'mean_reversion', 'sideways_bb_std_mult': 3.2261438908221907, 'sideways_rsi_os': 40, 'sideways_rsi_ob': 68, 'sideways_adx_thresh': 32.05297474442396, 'sideways_atr_min_pct': 0.021440627603852524, 'sideways_atr_max_pct': 0.07315102717273624, 'sideways_tp_mult': 2.65737479625716, 'sideways_tsl_mult': 0.37289825540675114, 'sideways_time_stop': 158, 'sideways_use_sma': True, 'sideways_use_ema': False, 'sideways_use_atr': True, 'sideways_use_adx': True, 'sideways_use_spike': False, 'sideways_rsi_required': True}.
[I 2025-09-01 15:13:42,324] Trial 869 finished with values: [-1000000000.0, 1000000000.0] and parameters: {'p_sma': 36, 'p_std': 18, 'p_atr': 19, 'p_adx': 28, 'rsi_period': 58, 'ema1': 20, 'ema2': 31, 'slip_atr_k': 0.02926944299310616, 'slip_spread_k': 0.06298005378804938, 'spread_hl_frac': 0.00570060104563289, 'bb_std_mult': 1.735911083495143, 'rsi_os': 41, 'rsi_ob': 46, 'vol_spike': 0.15923010567474316, 'adx_thresh': 24.848304953910755, 'atr_min_pct': 0.026219487022033184, 'atr_max_pct': 0.13326395607110278, 'tp_mult': 2.1107902891008217, 'tsl_mult': 0.7701558563579117, 'strategy': 'mean_reversion', 'time_stop': 22, 'use_sma': True, 'use_atr': False, 'use_adx': False, 'use_ema': True, 'use_spike': True, 'rsi_required': False, 'edge_k': 0.9267194536144364, 'edge_cap': 0.3221184961963606, 'bull_strategy': 'breakout', 'bull_bb_std_mult': 3.238556083472671, 'bull_rsi_os': 33, 'bull_rsi_ob': 60, 'bull_adx_thresh': 22.819280476635534, 'bull_atr_min_pct': 0.0035744006844005086, 'bull_atr_max_pct': 0.016997936198135617, 'bull_tp_mult': 1.8591461183114935, 'bull_tsl_mult': 0.0003109926519117012, 'bull_time_stop': 83, 'bull_use_sma': True, 'bull_use_ema': True, 'bull_use_atr': True, 'bull_use_adx': True, 'bull_use_spike': False, 'bull_rsi_required': True, 'bear_strategy': 'breakout', 'bear_bb_std_mult': 3.0398885818126784, 'bear_rsi_os': 34, 'bear_rsi_ob': 64, 'bear_adx_thresh': 19.432194398194937, 'bear_atr_min_pct': 0.0037879055590521976, 'bear_atr_max_pct': 0.07259094407586965, 'bear_tp_mult': 2.4960786121531586, 'bear_tsl_mult': 0.4666836484437126, 'bear_time_stop': 235, 'bear_use_sma': True, 'bear_use_ema': True, 'bear_use_atr': True, 'bear_use_adx': True, 'bear_use_spike': False, 'bear_rsi_required': True, 'sideways_strategy': 'breakout', 'sideways_bb_std_mult': 1.6889546477673105, 'sideways_rsi_os': 50, 'sideways_rsi_ob': 59, 'sideways_adx_thresh': 20.862591112166886, 'sideways_atr_min_pct': 0.019878503808972454, 'sideways_atr_max_pct': 0.04242988437314453, 'sideways_tp_mult': 2.7467432673361736, 'sideways_tsl_mult': 0.628846764704425, 'sideways_time_stop': 183, 'sideways_use_sma': True, 'sideways_use_ema': False, 'sideways_use_atr': True, 'sideways_use_adx': True, 'sideways_use_spike': True, 'sideways_rsi_required': True}.
[I 2025-09-01 15:13:43,592] Trial 870 finished with values: [-1000000000.0, 1000000000.0] and parameters: {'p_sma': 35, 'p_std': 57, 'p_atr': 21, 'p_adx': 11, 'rsi_period': 64, 'ema1': 7, 'ema2': 16, 'slip_atr_k': 0.0040431098440200115, 'slip_spread_k': 0.7665223415484392, 'spread_hl_frac': 0.019360931955553624, 'bb_std_mult': 1.7672575953725997, 'rsi_os': 40, 'rsi_ob': 50, 'vol_spike': 0.17545385715766917, 'adx_thresh': 26.005741416383795, 'atr_min_pct': 0.009031998365842522, 'atr_max_pct': 0.07032885249346761, 'tp_mult': 2.3675674476200514, 'tsl_mult': 0.7515226777218803, 'strategy': 'mean_reversion', 'time_stop': 236, 'use_sma': True, 'use_atr': False, 'use_adx': False, 'use_ema': True, 'use_spike': True, 'rsi_required': False, 'edge_k': 0.2694251708842853, 'edge_cap': 0.46337113618427656, 'bull_strategy': 'breakout', 'bull_bb_std_mult': 3.214289014513899, 'bull_rsi_os': 36, 'bull_rsi_ob': 54, 'bull_adx_thresh': 31.01532731016722, 'bull_atr_min_pct': 0.010003085883432052, 'bull_atr_max_pct': 0.126472321553102, 'bull_tp_mult': 1.3872329798164311, 'bull_tsl_mult': 0.7755794382239763, 'bull_time_stop': 163, 'bull_use_sma': True, 'bull_use_ema': True, 'bull_use_atr': True, 'bull_use_adx': True, 'bull_use_spike': False, 'bull_rsi_required': True, 'bear_strategy': 'breakout', 'bear_bb_std_mult': 0.9040207630687436, 'bear_rsi_os': 31, 'bear_rsi_ob': 47, 'bear_adx_thresh': 12.05708693737558, 'bear_atr_min_pct': 0.0022097261014883875, 'bear_atr_max_pct': 0.051040859172958884, 'bear_tp_mult': 2.5739914558116213, 'bear_tsl_mult': 0.12079242334068005, 'bear_time_stop': 183, 'bear_use_sma': True, 'bear_use_ema': True, 'bear_use_atr': True, 'bear_use_adx': True, 'bear_use_spike': False, 'bear_rsi_required': True, 'sideways_strategy': 'breakout', 'sideways_bb_std_mult': 1.5219250006199627, 'sideways_rsi_os': 47, 'sideways_rsi_ob': 46, 'sideways_adx_thresh': 6.1307031452735785, 'sideways_atr_min_pct': 0.018060958517089172, 'sideways_atr_max_pct': 0.0662866818789644, 'sideways_tp_mult': 2.548961835880114, 'sideways_tsl_mult': 0.9254109305271999, 'sideways_time_stop': 176, 'sideways_use_sma': True, 'sideways_use_ema': False, 'sideways_use_atr': True, 'sideways_use_adx': True, 'sideways_use_spike': False, 'sideways_rsi_required': True}.
[I 2025-09-01 15:14:18,019] Trial 866 finished with values: [-1000000000.0, 1000000000.0] and parameters: {'p_sma': 46, 'p_std': 48, 'p_atr': 26, 'p_adx': 8, 'rsi_period': 66, 'ema1': 20, 'ema2': 18, 'slip_atr_k': 0.008259905941153875, 'slip_spread_k': 0.06612337846186289, 'spread_hl_frac': 0.0052033758488646015, 'bb_std_mult': 1.670839996485908, 'rsi_os': 41, 'rsi_ob': 86, 'vol_spike': 0.2422563275058151, 'adx_thresh': 13.882419721299625, 'atr_min_pct': 0.002867685320351688, 'atr_max_pct': 0.04522421527968384, 'tp_mult': 2.368518437075176, 'tsl_mult': 0.7269408490724135, 'strategy': 'mean_reversion', 'time_stop': 230, 'use_sma': True, 'use_atr': False, 'use_adx': False, 'use_ema': False, 'use_spike': True, 'rsi_required': False, 'edge_k': 0.7537719847847362, 'edge_cap': 0.37293222636876766, 'bull_strategy': 'breakout', 'bull_bb_std_mult': 3.457555306652527, 'bull_rsi_os': 33, 'bull_rsi_ob': 60, 'bull_adx_thresh': 34.93096336987536, 'bull_atr_min_pct': 0.025578733777974712, 'bull_atr_max_pct': 0.12599042907103192, 'bull_tp_mult': 2.833455663218554, 'bull_tsl_mult': 0.7779418604357695, 'bull_time_stop': 5, 'bull_use_sma': True, 'bull_use_ema': True, 'bull_use_atr': True, 'bull_use_adx': True, 'bull_use_spike': False, 'bull_rsi_required': True, 'bear_strategy': 'mean_reversion', 'bear_bb_std_mult': 3.599538639417554, 'bear_rsi_os': 34, 'bear_rsi_ob': 88, 'bear_adx_thresh': 27.031476542067377, 'bear_atr_min_pct': 0.012914872169461002, 'bear_atr_max_pct': 0.13202685691335841, 'bear_tp_mult': 2.2500988865080114, 'bear_tsl_mult': 0.8818703956926036, 'bear_time_stop': 227, 'bear_use_sma': True, 'bear_use_ema': True, 'bear_use_atr': True, 'bear_use_adx': False, 'bear_use_spike': False, 'bear_rsi_required': True, 'sideways_strategy': 'breakout', 'sideways_bb_std_mult': 3.2248657984076816, 'sideways_rsi_os': 51, 'sideways_rsi_ob': 68, 'sideways_adx_thresh': 31.953129103501034, 'sideways_atr_min_pct': 0.019927057128929084, 'sideways_atr_max_pct': 0.06923018281296367, 'sideways_tp_mult': 1.3979165520546264, 'sideways_tsl_mult': 0.27950717528330565, 'sideways_time_stop': 156, 'sideways_use_sma': True, 'sideways_use_ema': False, 'sideways_use_atr': True, 'sideways_use_adx': True, 'sideways_use_spike': False, 'sideways_rsi_required': True}.
[I 2025-09-01 15:14:18,548] Trial 867 finished with values: [-1000000000.0, 1000000000.0] and parameters: {'p_sma': 6, 'p_std': 48, 'p_atr': 26, 'p_adx': 11, 'rsi_period': 58, 'ema1': 9, 'ema2': 40, 'slip_atr_k': 0.008519191056083057, 'slip_spread_k': 0.6489032597718337, 'spread_hl_frac': 0.005401627869361249, 'bb_std_mult': 1.7468700403134505, 'rsi_os': 41, 'rsi_ob': 86, 'vol_spike': 0.23456755313963468, 'adx_thresh': 24.650846796326157, 'atr_min_pct': 0.013374099758199982, 'atr_max_pct': 0.0341999998222962, 'tp_mult': 2.688264228670976, 'tsl_mult': 0.8512439390720831, 'strategy': 'mean_reversion', 'time_stop': 73, 'use_sma': True, 'use_atr': False, 'use_adx': False, 'use_ema': False, 'use_spike': True, 'rsi_required': True, 'edge_k': 0.6475839626447604, 'edge_cap': 0.3731202275735781, 'bull_strategy': 'mean_reversion', 'bull_bb_std_mult': 3.227052264832841, 'bull_rsi_os': 31, 'bull_rsi_ob': 54, 'bull_adx_thresh': 7.928994888008269, 'bull_atr_min_pct': 0.003672623811997292, 'bull_atr_max_pct': 0.02499611891754804, 'bull_tp_mult': 2.8272674923000323, 'bull_tsl_mult': 0.24617002276805922, 'bull_time_stop': 83, 'bull_use_sma': True, 'bull_use_ema': False, 'bull_use_atr': True, 'bull_use_adx': True, 'bull_use_spike': False, 'bull_rsi_required': False, 'bear_strategy': 'mean_reversion', 'bear_bb_std_mult': 0.6010900869296654, 'bear_rsi_os': 31, 'bear_rsi_ob': 88, 'bear_adx_thresh': 22.80934940900441, 'bear_atr_min_pct': 0.012886202682363223, 'bear_atr_max_pct': 0.13799659846966764, 'bear_tp_mult': 2.964894376728258, 'bear_tsl_mult': 0.21208444733376824, 'bear_time_stop': 35, 'bear_use_sma': True, 'bear_use_ema': False, 'bear_use_atr': False, 'bear_use_adx': False, 'bear_use_spike': False, 'bear_rsi_required': True, 'sideways_strategy': 'breakout', 'sideways_bb_std_mult': 1.543636616159068, 'sideways_rsi_os': 7, 'sideways_rsi_ob': 70, 'sideways_adx_thresh': 31.935569516459886, 'sideways_atr_min_pct': 0.018203671377483306, 'sideways_atr_max_pct': 0.13799927699616651, 'sideways_tp_mult': 2.5665658736268337, 'sideways_tsl_mult': 0.9275509673468523, 'sideways_time_stop': 153, 'sideways_use_sma': True, 'sideways_use_ema': False, 'sideways_use_atr': True, 'sideways_use_adx': True, 'sideways_use_spike': False, 'sideways_rsi_required': True}.
[I 2025-09-01 15:14:19,169] Trial 868 finished with values: [-1000000000.0, 1000000000.0] and parameters: {'p_sma': 6, 'p_std': 6, 'p_atr': 19, 'p_adx': 8, 'rsi_period': 64, 'ema1': 9, 'ema2': 31, 'slip_atr_k': 0.20345507093310436, 'slip_spread_k': 0.07491032411419056, 'spread_hl_frac': 0.006007577858147259, 'bb_std_mult': 3.377920397725168, 'rsi_os': 40, 'rsi_ob': 86, 'vol_spike': 0.23202484171568594, 'adx_thresh': 18.389342927340227, 'atr_min_pct': 0.01366556658460962, 'atr_max_pct': 0.04434378838873721, 'tp_mult': 2.3722165599414815, 'tsl_mult': 0.889772924836346, 'strategy': 'mean_reversion', 'time_stop': 23, 'use_sma': True, 'use_atr': False, 'use_adx': False, 'use_ema': False, 'use_spike': True, 'rsi_required': False, 'edge_k': 0.7718605117448898, 'edge_cap': 0.36550146185691684, 'bull_strategy': 'breakout', 'bull_bb_std_mult': 3.2196068364026167, 'bull_rsi_os': 31, 'bull_rsi_ob': 55, 'bull_adx_thresh': 30.41012502965911, 'bull_atr_min_pct': 0.003574777526202439, 'bull_atr_max_pct': 0.12679083493761262, 'bull_tp_mult': 2.1946443576915535, 'bull_tsl_mult': 0.15726176131010733, 'bull_time_stop': 83, 'bull_use_sma': True, 'bull_use_ema': True, 'bull_use_atr': True, 'bull_use_adx': True, 'bull_use_spike': False, 'bull_rsi_required': True, 'bear_strategy': 'breakout', 'bear_bb_std_mult': 0.9344878563601704, 'bear_rsi_os': 33, 'bear_rsi_ob': 63, 'bear_adx_thresh': 18.02214057356154, 'bear_atr_min_pct': 0.0036410516714098936, 'bear_atr_max_pct': 0.052832366372204925, 'bear_tp_mult': 2.267438851324, 'bear_tsl_mult': 0.47614176396672936, 'bear_time_stop': 183, 'bear_use_sma': True, 'bear_use_ema': True, 'bear_use_atr': True, 'bear_use_adx': True, 'bear_use_spike': False, 'bear_rsi_required': True, 'sideways_strategy': 'breakout', 'sideways_bb_std_mult': 1.6419569572122867, 'sideways_rsi_os': 7, 'sideways_rsi_ob': 79, 'sideways_adx_thresh': 6.056483876310162, 'sideways_atr_min_pct': 0.0180848466853956, 'sideways_atr_max_pct': 0.08734125561680291, 'sideways_tp_mult': 2.7486046842392056, 'sideways_tsl_mult': 0.37099849359084985, 'sideways_time_stop': 183, 'sideways_use_sma': True, 'sideways_use_ema': False, 'sideways_use_atr': True, 'sideways_use_adx': True, 'sideways_use_spike': False, 'sideways_rsi_required': True}.
[I 2025-09-01 15:14:20,804] Trial 871 finished with values: [-1000000000.0, 1000000000.0] and parameters: {'p_sma': 36, 'p_std': 47, 'p_atr': 25, 'p_adx': 23, 'rsi_period': 54, 'ema1': 20, 'ema2': 18, 'slip_atr_k': 0.2294544052715234, 'slip_spread_k': 0.0924386607565383, 'spread_hl_frac': 0.02120009677079254, 'bb_std_mult': 1.9120136385059439, 'rsi_os': 32, 'rsi_ob': 85, 'vol_spike': 0.23527750660004396, 'adx_thresh': 18.22148077775107, 'atr_min_pct': 0.02691278637382604, 'atr_max_pct': 0.03416256008235355, 'tp_mult': 1.2036860547189916, 'tsl_mult': 0.6913106758622892, 'strategy': 'mean_reversion', 'time_stop': 232, 'use_sma': True, 'use_atr': False, 'use_adx': False, 'use_ema': False, 'use_spike': True, 'rsi_required': False, 'edge_k': 1.6534096778247158, 'edge_cap': 0.32302104437766027, 'bull_strategy': 'breakout', 'bull_bb_std_mult': 3.340728820071487, 'bull_rsi_os': 38, 'bull_rsi_ob': 55, 'bull_adx_thresh': 7.831375120848154, 'bull_atr_min_pct': 0.002880070772920974, 'bull_atr_max_pct': 0.02759145792617724, 'bull_tp_mult': 2.559418507415823, 'bull_tsl_mult': 0.8423594038629593, 'bull_time_stop': 100, 'bull_use_sma': True, 'bull_use_ema': True, 'bull_use_atr': True, 'bull_use_adx': True, 'bull_use_spike': False, 'bull_rsi_required': True, 'bear_strategy': 'breakout', 'bear_bb_std_mult': 1.1769559028490102, 'bear_rsi_os': 33, 'bear_rsi_ob': 52, 'bear_adx_thresh': 14.545893404965803, 'bear_atr_min_pct': 0.021923944148742353, 'bear_atr_max_pct': 0.07907501090642877, 'bear_tp_mult': 1.5609627499197725, 'bear_tsl_mult': 0.8908279637239666, 'bear_time_stop': 229, 'bear_use_sma': True, 'bear_use_ema': True, 'bear_use_atr': True, 'bear_use_adx': True, 'bear_use_spike': False, 'bear_rsi_required': True, 'sideways_strategy': 'breakout', 'sideways_bb_std_mult': 0.8058603959515442, 'sideways_rsi_os': 45, 'sideways_rsi_ob': 95, 'sideways_adx_thresh': 7.29766667903005, 'sideways_atr_min_pct': 0.01892453562707447, 'sideways_atr_max_pct': 0.06887899456644626, 'sideways_tp_mult': 2.700469271816774, 'sideways_tsl_mult': 0.8902093364346251, 'sideways_time_stop': 151, 'sideways_use_sma': True, 'sideways_use_ema': False, 'sideways_use_atr': True, 'sideways_use_adx': True, 'sideways_use_spike': False, 'sideways_rsi_required': True}.
[I 2025-09-01 15:14:22,048] Trial 872 finished with values: [-1000000000.0, 1000000000.0] and parameters: {'p_sma': 31, 'p_std': 47, 'p_atr': 25, 'p_adx': 13, 'rsi_period': 69, 'ema1': 19, 'ema2': 27, 'slip_atr_k': 0.20304950813531011, 'slip_spread_k': 0.6518037837190037, 'spread_hl_frac': 0.006966444462143312, 'bb_std_mult': 3.3849199001942467, 'rsi_os': 34, 'rsi_ob': 48, 'vol_spike': 0.27825731896027883, 'adx_thresh': 7.835813749261483, 'atr_min_pct': 0.008051920717783705, 'atr_max_pct': 0.14205928612507387, 'tp_mult': 1.2482864962622504, 'tsl_mult': 0.6948066400410486, 'strategy': 'mean_reversion', 'time_stop': 280, 'use_sma': True, 'use_atr': False, 'use_adx': True, 'use_ema': True, 'use_spike': True, 'rsi_required': False, 'edge_k': 0.4799136807536766, 'edge_cap': 0.3245254579162174, 'bull_strategy': 'breakout', 'bull_bb_std_mult': 3.3114889056229786, 'bull_rsi_os': 35, 'bull_rsi_ob': 54, 'bull_adx_thresh': 5.062237446615869, 'bull_atr_min_pct': 0.0028562473566406043, 'bull_atr_max_pct': 0.027635326649279514, 'bull_tp_mult': 2.91524853792207, 'bull_tsl_mult': 0.45054230910622844, 'bull_time_stop': 101, 'bull_use_sma': True, 'bull_use_ema': True, 'bull_use_atr': True, 'bull_use_adx': True, 'bull_use_spike': False, 'bull_rsi_required': True, 'bear_strategy': 'breakout', 'bear_bb_std_mult': 1.1903204943776622, 'bear_rsi_os': 33, 'bear_rsi_ob': 85, 'bear_adx_thresh': 25.158837287243117, 'bear_atr_min_pct': 0.0035029996390958827, 'bear_atr_max_pct': 0.049343292044760324, 'bear_tp_mult': 1.5401193292508355, 'bear_tsl_mult': 0.5304277132412878, 'bear_time_stop': 200, 'bear_use_sma': True, 'bear_use_ema': True, 'bear_use_atr': True, 'bear_use_adx': True, 'bear_use_spike': False, 'bear_rsi_required': True, 'sideways_strategy': 'breakout', 'sideways_bb_std_mult': 1.6344010906422335, 'sideways_rsi_os': 15, 'sideways_rsi_ob': 65, 'sideways_adx_thresh': 7.042382482446328, 'sideways_atr_min_pct': 0.019115452903830873, 'sideways_atr_max_pct': 0.06225087169378074, 'sideways_tp_mult': 2.6944944778683566, 'sideways_tsl_mult': 0.8855009811452377, 'sideways_time_stop': 190, 'sideways_use_sma': True, 'sideways_use_ema': False, 'sideways_use_atr': True, 'sideways_use_adx': True, 'sideways_use_spike': False, 'sideways_rsi_required': True}.
