[I 2025-09-01 14:37:34,215] Trial 642 finished with values: [-1000000000.0, 1000000000.0] and parameters: {'p_sma': 34, 'p_std': 29, 'p_atr': 25, 'p_adx': 9, 'rsi_period': 70, 'ema1': 20, 'ema2': 16, 'slip_atr_k': 0.11407704381911227, 'slip_spread_k': 0.46851326911618085, 'spread_hl_frac': 0.022894063422232616, 'bb_std_mult': 3.0199895533336956, 'rsi_os': 19, 'rsi_ob': 47, 'vol_spike': 0.14164140219262886, 'adx_thresh': 20.53372779536531, 'atr_min_pct': 0.027109352777714882, 'atr_max_pct': 0.12991944239089076, 'tp_mult': 1.093226101075445, 'tsl_mult': 0.8361872393526774, 'strategy': 'mean_reversion', 'time_stop': 229, 'use_sma': False, 'use_atr': False, 'use_adx': False, 'use_ema': True, 'use_spike': True, 'rsi_required': True, 'edge_k': 1.510925128988922, 'edge_cap': 0.35120389506886435, 'bull_strategy': 'mean_reversion', 'bull_bb_std_mult': 2.8650157014498605, 'bull_rsi_os': 28, 'bull_rsi_ob': 54, 'bull_adx_thresh': 31.317195366979874, 'bull_atr_min_pct': 0.003821120809144064, 'bull_atr_max_pct': 0.02564770555272531, 'bull_tp_mult': 2.7408366034729745, 'bull_tsl_mult': 0.9679223372900987, 'bull_time_stop': 222, 'bull_use_sma': True, 'bull_use_ema': False, 'bull_use_atr': True, 'bull_use_adx': True, 'bull_use_spike': False, 'bull_rsi_required': False, 'bear_strategy': 'breakout', 'bear_bb_std_mult': 0.6267490909530278, 'bear_rsi_os': 27, 'bear_rsi_ob': 87, 'bear_adx_thresh': 11.9660653947327, 'bear_atr_min_pct': 0.004974043253009733, 'bear_atr_max_pct': 0.047785098180925634, 'bear_tp_mult': 1.2328566751817487, 'bear_tsl_mult': 0.31742847973387134, 'bear_time_stop': 201, 'bear_use_sma': False, 'bear_use_ema': True, 'bear_use_atr': True, 'bear_use_adx': False, 'bear_use_spike': True, 'bear_rsi_required': True, 'sideways_strategy': 'mean_reversion', 'sideways_bb_std_mult': 2.363440437444767, 'sideways_rsi_os': 49, 'sideways_rsi_ob': 57, 'sideways_adx_thresh': 17.737357007677975, 'sideways_atr_min_pct': 0.011017614800518941, 'sideways_atr_max_pct': 0.07096703843402065, 'sideways_tp_mult': 2.7777274333428914, 'sideways_tsl_mult': 0.07363526257225689, 'sideways_time_stop': 98, 'sideways_use_sma': True, 'sideways_use_ema': False, 'sideways_use_atr': False, 'sideways_use_adx': True, 'sideways_use_spike': False, 'sideways_rsi_required': True}.
[I 2025-09-01 14:38:07,414] Trial 639 finished with values: [-1000000000.0, 1000000000.0] and parameters: {'p_sma': 56, 'p_std': 46, 'p_atr': 24, 'p_adx': 18, 'rsi_period': 70, 'ema1': 20, 'ema2': 28, 'slip_atr_k': 0.22900975473498042, 'slip_spread_k': 0.7458356149099379, 'spread_hl_frac': 0.007023649892127184, 'bb_std_mult': 2.1327699182647346, 'rsi_os': 19, 'rsi_ob': 67, 'vol_spike': 0.2596113087206957, 'adx_thresh': 24.746879094993766, 'atr_min_pct': 0.02709477103576888, 'atr_max_pct': 0.10016388598537315, 'tp_mult': 2.005889617625596, 'tsl_mult': 0.8032080663582515, 'strategy': 'mean_reversion', 'time_stop': 228, 'use_sma': False, 'use_atr': False, 'use_adx': False, 'use_ema': True, 'use_spike': True, 'rsi_required': True, 'edge_k': 0.8184454538864981, 'edge_cap': 0.2303547793494929, 'bull_strategy': 'breakout', 'bull_bb_std_mult': 3.1605806933045324, 'bull_rsi_os': 35, 'bull_rsi_ob': 69, 'bull_adx_thresh': 7.773427721268613, 'bull_atr_min_pct': 0.003920331084651673, 'bull_atr_max_pct': 0.018792215085114673, 'bull_tp_mult': 2.953786718992811, 'bull_tsl_mult': 0.6556875328586871, 'bull_time_stop': 94, 'bull_use_sma': True, 'bull_use_ema': True, 'bull_use_atr': True, 'bull_use_adx': True, 'bull_use_spike': False, 'bull_rsi_required': True, 'bear_strategy': 'breakout', 'bear_bb_std_mult': 3.170875774327907, 'bear_rsi_os': 27, 'bear_rsi_ob': 91, 'bear_adx_thresh': 11.893858594336706, 'bear_atr_min_pct': 0.011203291656693154, 'bear_atr_max_pct': 0.03475047887860762, 'bear_tp_mult': 2.3763168495626705, 'bear_tsl_mult': 0.17079547424576585, 'bear_time_stop': 226, 'bear_use_sma': True, 'bear_use_ema': True, 'bear_use_atr': True, 'bear_use_adx': False, 'bear_use_spike': True, 'bear_rsi_required': True, 'sideways_strategy': 'breakout', 'sideways_bb_std_mult': 1.5834385541406462, 'sideways_rsi_os': 34, 'sideways_rsi_ob': 60, 'sideways_adx_thresh': 8.246702381614782, 'sideways_atr_min_pct': 0.025272584451263277, 'sideways_atr_max_pct': 0.08081213252024494, 'sideways_tp_mult': 1.1256969733391378, 'sideways_tsl_mult': 0.2228076232464939, 'sideways_time_stop': 169, 'sideways_use_sma': True, 'sideways_use_ema': False, 'sideways_use_atr': False, 'sideways_use_adx': True, 'sideways_use_spike': False, 'sideways_rsi_required': True}.
[I 2025-09-01 14:38:07,434] Trial 640 finished with values: [-1000000000.0, 1000000000.0] and parameters: {'p_sma': 37, 'p_std': 46, 'p_atr': 10, 'p_adx': 12, 'rsi_period': 79, 'ema1': 21, 'ema2': 11, 'slip_atr_k': 0.14578551909827278, 'slip_spread_k': 0.46472394338019807, 'spread_hl_frac': 0.0068582135588465785, 'bb_std_mult': 1.6427220030174607, 'rsi_os': 38, 'rsi_ob': 78, 'vol_spike': 0.21966017392356946, 'adx_thresh': 15.40937596435289, 'atr_min_pct': 0.025031360526350643, 'atr_max_pct': 0.13089845689968962, 'tp_mult': 2.1834847513177036, 'tsl_mult': 0.03380032118172227, 'strategy': 'mean_reversion', 'time_stop': 230, 'use_sma': False, 'use_atr': False, 'use_adx': False, 'use_ema': True, 'use_spike': True, 'rsi_required': True, 'edge_k': 1.4959474219265352, 'edge_cap': 0.3275818056065578, 'bull_strategy': 'mean_reversion', 'bull_bb_std_mult': 1.3895840438817193, 'bull_rsi_os': 26, 'bull_rsi_ob': 54, 'bull_adx_thresh': 31.06568523944443, 'bull_atr_min_pct': 0.02356771594679692, 'bull_atr_max_pct': 0.019158555904751903, 'bull_tp_mult': 2.702105481976953, 'bull_tsl_mult': 0.14925461397826761, 'bull_time_stop': 225, 'bull_use_sma': True, 'bull_use_ema': False, 'bull_use_atr': True, 'bull_use_adx': True, 'bull_use_spike': False, 'bull_rsi_required': True, 'bear_strategy': 'breakout', 'bear_bb_std_mult': 1.7322019174126404, 'bear_rsi_os': 34, 'bear_rsi_ob': 91, 'bear_adx_thresh': 24.65186659254053, 'bear_atr_min_pct': 0.0025282744239578524, 'bear_atr_max_pct': 0.04850276664171258, 'bear_tp_mult': 1.1953362179171312, 'bear_tsl_mult': 0.46147198516184557, 'bear_time_stop': 226, 'bear_use_sma': False, 'bear_use_ema': True, 'bear_use_atr': True, 'bear_use_adx': False, 'bear_use_spike': True, 'bear_rsi_required': True, 'sideways_strategy': 'mean_reversion', 'sideways_bb_std_mult': 1.6171683600615807, 'sideways_rsi_os': 54, 'sideways_rsi_ob': 60, 'sideways_adx_thresh': 8.321298188366917, 'sideways_atr_min_pct': 0.01926843914790056, 'sideways_atr_max_pct': 0.07098812461351951, 'sideways_tp_mult': 2.6458378348934875, 'sideways_tsl_mult': 0.5144041267179098, 'sideways_time_stop': 124, 'sideways_use_sma': True, 'sideways_use_ema': False, 'sideways_use_atr': False, 'sideways_use_adx': True, 'sideways_use_spike': False, 'sideways_rsi_required': True}.
[I 2025-09-01 14:38:07,707] Trial 641 finished with values: [-1000000000.0, 1000000000.0] and parameters: {'p_sma': 37, 'p_std': 46, 'p_atr': 24, 'p_adx': 12, 'rsi_period': 80, 'ema1': 21, 'ema2': 11, 'slip_atr_k': 0.035745935872769447, 'slip_spread_k': 0.063064238013425, 'spread_hl_frac': 0.022639319618682385, 'bb_std_mult': 1.6115391129474919, 'rsi_os': 40, 'rsi_ob': 69, 'vol_spike': 0.21944758503569875, 'adx_thresh': 23.943524339655173, 'atr_min_pct': 0.027894410145272903, 'atr_max_pct': 0.0767094218832482, 'tp_mult': 2.1905513965553642, 'tsl_mult': 0.7841286306265135, 'strategy': 'mean_reversion', 'time_stop': 228, 'use_sma': False, 'use_atr': False, 'use_adx': False, 'use_ema': True, 'use_spike': True, 'rsi_required': True, 'edge_k': 0.30686028990948633, 'edge_cap': 0.8260175356313961, 'bull_strategy': 'mean_reversion', 'bull_bb_std_mult': 3.2117418578130357, 'bull_rsi_os': 35, 'bull_rsi_ob': 54, 'bull_adx_thresh': 22.68429055652649, 'bull_atr_min_pct': 0.003826255008186248, 'bull_atr_max_pct': 0.0848206967353719, 'bull_tp_mult': 2.9648025518566135, 'bull_tsl_mult': 0.5043401215925801, 'bull_time_stop': 28, 'bull_use_sma': True, 'bull_use_ema': False, 'bull_use_atr': True, 'bull_use_adx': True, 'bull_use_spike': False, 'bull_rsi_required': False, 'bear_strategy': 'breakout', 'bear_bb_std_mult': 3.360537335322612, 'bear_rsi_os': 12, 'bear_rsi_ob': 57, 'bear_adx_thresh': 24.91976406261213, 'bear_atr_min_pct': 0.0049025570808055126, 'bear_atr_max_pct': 0.04878385104749571, 'bear_tp_mult': 1.2330246302708416, 'bear_tsl_mult': 0.17021452433620438, 'bear_time_stop': 225, 'bear_use_sma': False, 'bear_use_ema': True, 'bear_use_atr': True, 'bear_use_adx': False, 'bear_use_spike': True, 'bear_rsi_required': True, 'sideways_strategy': 'mean_reversion', 'sideways_bb_std_mult': 2.515293017398104, 'sideways_rsi_os': 54, 'sideways_rsi_ob': 76, 'sideways_adx_thresh': 8.276822635141794, 'sideways_atr_min_pct': 0.02029943147303344, 'sideways_atr_max_pct': 0.08107599523247874, 'sideways_tp_mult': 2.6418458589184617, 'sideways_tsl_mult': 0.2360567161234246, 'sideways_time_stop': 177, 'sideways_use_sma': True, 'sideways_use_ema': False, 'sideways_use_atr': False, 'sideways_use_adx': True, 'sideways_use_spike': False, 'sideways_rsi_required': True}.
[I 2025-09-01 14:38:08,644] Trial 643 finished with values: [-1000000000.0, 1000000000.0] and parameters: {'p_sma': 25, 'p_std': 53, 'p_atr': 24, 'p_adx': 18, 'rsi_period': 35, 'ema1': 16, 'ema2': 18, 'slip_atr_k': 0.02204524472201585, 'slip_spread_k': 0.25464837771150295, 'spread_hl_frac': 0.029240437466979012, 'bb_std_mult': 1.679134019517592, 'rsi_os': 40, 'rsi_ob': 85, 'vol_spike': 0.018112498869534727, 'adx_thresh': 21.14453990450782, 'atr_min_pct': 0.02813780810664174, 'atr_max_pct': 0.07676552282380791, 'tp_mult': 1.149387929999565, 'tsl_mult': 0.7941397061370974, 'strategy': 'breakout', 'time_stop': 233, 'use_sma': True, 'use_atr': False, 'use_adx': False, 'use_ema': False, 'use_spike': True, 'rsi_required': True, 'edge_k': 0.8523230393675193, 'edge_cap': 0.32761417473678206, 'bull_strategy': 'breakout', 'bull_bb_std_mult': 2.0703975443820024, 'bull_rsi_os': 35, 'bull_rsi_ob': 55, 'bull_adx_thresh': 13.000130218427223, 'bull_atr_min_pct': 0.023597843352619496, 'bull_atr_max_pct': 0.019992786218071747, 'bull_tp_mult': 2.708180763541433, 'bull_tsl_mult': 0.14836514841092924, 'bull_time_stop': 93, 'bull_use_sma': True, 'bull_use_ema': True, 'bull_use_atr': True, 'bull_use_adx': True, 'bull_use_spike': False, 'bull_rsi_required': True, 'bear_strategy': 'breakout', 'bear_bb_std_mult': 2.1193576661686118, 'bear_rsi_os': 25, 'bear_rsi_ob': 92, 'bear_adx_thresh': 24.541298761167788, 'bear_atr_min_pct': 0.016826081682414094, 'bear_atr_max_pct': 0.01896956463054314, 'bear_tp_mult': 2.2369543462634613, 'bear_tsl_mult': 0.6272225927481084, 'bear_time_stop': 188, 'bear_use_sma': True, 'bear_use_ema': True, 'bear_use_atr': False, 'bear_use_adx': False, 'bear_use_spike': False, 'bear_rsi_required': True, 'sideways_strategy': 'breakout', 'sideways_bb_std_mult': 1.6086613236570468, 'sideways_rsi_os': 34, 'sideways_rsi_ob': 81, 'sideways_adx_thresh': 7.883637785401072, 'sideways_atr_min_pct': 0.020285281522518406, 'sideways_atr_max_pct': 0.0799838892018618, 'sideways_tp_mult': 2.085671687408271, 'sideways_tsl_mult': 0.2311241029109165, 'sideways_time_stop': 176, 'sideways_use_sma': True, 'sideways_use_ema': False, 'sideways_use_atr': True, 'sideways_use_adx': True, 'sideways_use_spike': False, 'sideways_rsi_required': True}.
[I 2025-09-01 14:38:55,424] Trial 644 finished with values: [-1000000000.0, 1000000000.0] and parameters: {'p_sma': 21, 'p_std': 53, 'p_atr': 21, 'p_adx': 8, 'rsi_period': 67, 'ema1': 22, 'ema2': 18, 'slip_atr_k': 0.004882029006488403, 'slip_spread_k': 0.0641324828221164, 'spread_hl_frac': 0.008190399318261963, 'bb_std_mult': 1.3626450910543373, 'rsi_os': 40, 'rsi_ob': 88, 'vol_spike': 0.22961768504625524, 'adx_thresh': 25.820249661291317, 'atr_min_pct': 0.028162443282687237, 'atr_max_pct': 0.07770904697269083, 'tp_mult': 1.1392105522894072, 'tsl_mult': 0.7907526775255483, 'strategy': 'breakout', 'time_stop': 84, 'use_sma': True, 'use_atr': True, 'use_adx': True, 'use_ema': False, 'use_spike': False, 'rsi_required': False, 'edge_k': 0.30933753199305236, 'edge_cap': 0.29656575925382944, 'bull_strategy': 'breakout', 'bull_bb_std_mult': 3.2215335898973088, 'bull_rsi_os': 34, 'bull_rsi_ob': 56, 'bull_adx_thresh': 18.272558167017184, 'bull_atr_min_pct': 0.007360577769255497, 'bull_atr_max_pct': 0.02825277097438117, 'bull_tp_mult': 2.837523403858539, 'bull_tsl_mult': 0.4540453888690916, 'bull_time_stop': 199, 'bull_use_sma': False, 'bull_use_ema': True, 'bull_use_atr': False, 'bull_use_adx': True, 'bull_use_spike': True, 'bull_rsi_required': False, 'bear_strategy': 'breakout', 'bear_bb_std_mult': 2.115658742971894, 'bear_rsi_os': 34, 'bear_rsi_ob': 87, 'bear_adx_thresh': 10.96297789754072, 'bear_atr_min_pct': 0.016957370851216222, 'bear_atr_max_pct': 0.14290832235787101, 'bear_tp_mult': 2.232433376511178, 'bear_tsl_mult': 0.010312657942331716, 'bear_time_stop': 211, 'bear_use_sma': True, 'bear_use_ema': False, 'bear_use_atr': False, 'bear_use_adx': True, 'bear_use_spike': False, 'bear_rsi_required': False, 'sideways_strategy': 'breakout', 'sideways_bb_std_mult': 1.4581036223301755, 'sideways_rsi_os': 51, 'sideways_rsi_ob': 48, 'sideways_adx_thresh': 6.045899945394924, 'sideways_atr_min_pct': 0.02028681048843446, 'sideways_atr_max_pct': 0.10789714524438111, 'sideways_tp_mult': 2.5909791209927304, 'sideways_tsl_mult': 0.27766973942912315, 'sideways_time_stop': 176, 'sideways_use_sma': False, 'sideways_use_ema': True, 'sideways_use_atr': True, 'sideways_use_adx': True, 'sideways_use_spike': False, 'sideways_rsi_required': False}.
[I 2025-09-01 14:38:55,962] Trial 645 finished with values: [-1000000000.0, 1000000000.0] and parameters: {'p_sma': 21, 'p_std': 27, 'p_atr': 21, 'p_adx': 8, 'rsi_period': 35, 'ema1': 22, 'ema2': 18, 'slip_atr_k': 0.007128176266788739, 'slip_spread_k': 0.06704248654674577, 'spread_hl_frac': 0.03386708089124614, 'bb_std_mult': 2.4512374359768936, 'rsi_os': 40, 'rsi_ob': 85, 'vol_spike': 0.03859233243750425, 'adx_thresh': 25.901405781170304, 'atr_min_pct': 0.02534067507700324, 'atr_max_pct': 0.1383197849165527, 'tp_mult': 1.1504072626901707, 'tsl_mult': 0.7871939575379856, 'strategy': 'breakout', 'time_stop': 243, 'use_sma': True, 'use_atr': True, 'use_adx': True, 'use_ema': False, 'use_spike': False, 'rsi_required': False, 'edge_k': 0.8899860819257884, 'edge_cap': 0.2975808594868616, 'bull_strategy': 'breakout', 'bull_bb_std_mult': 2.035792269408166, 'bull_rsi_os': 32, 'bull_rsi_ob': 56, 'bull_adx_thresh': 30.287625573084334, 'bull_atr_min_pct': 0.02453470918483755, 'bull_atr_max_pct': 0.028301526846393452, 'bull_tp_mult': 2.507671873364999, 'bull_tsl_mult': 0.4524878454774617, 'bull_time_stop': 29, 'bull_use_sma': False, 'bull_use_ema': True, 'bull_use_atr': False, 'bull_use_adx': True, 'bull_use_spike': True, 'bull_rsi_required': False, 'bear_strategy': 'breakout', 'bear_bb_std_mult': 2.1167962012891577, 'bear_rsi_os': 34, 'bear_rsi_ob': 52, 'bear_adx_thresh': 10.702451779007472, 'bear_atr_min_pct': 0.026819674810878137, 'bear_atr_max_pct': 0.04361631460710868, 'bear_tp_mult': 2.227409513225367, 'bear_tsl_mult': 0.8364013051074004, 'bear_time_stop': 212, 'bear_use_sma': True, 'bear_use_ema': False, 'bear_use_atr': False, 'bear_use_adx': True, 'bear_use_spike': False, 'bear_rsi_required': False, 'sideways_strategy': 'breakout', 'sideways_bb_std_mult': 1.4455007070915844, 'sideways_rsi_os': 50, 'sideways_rsi_ob': 48, 'sideways_adx_thresh': 7.248945203507236, 'sideways_atr_min_pct': 0.020224430867453156, 'sideways_atr_max_pct': 0.048373058967134, 'sideways_tp_mult': 2.7392892669049043, 'sideways_tsl_mult': 0.2781179713612318, 'sideways_time_stop': 141, 'sideways_use_sma': False, 'sideways_use_ema': True, 'sideways_use_atr': True, 'sideways_use_adx': True, 'sideways_use_spike': False, 'sideways_rsi_required': False}.
[I 2025-09-01 14:38:56,586] Trial 647 finished with values: [-1000000000.0, 1000000000.0] and parameters: {'p_sma': 22, 'p_std': 51, 'p_atr': 25, 'p_adx': 13, 'rsi_period': 65, 'ema1': 22, 'ema2': 19, 'slip_atr_k': 0.006884505696756776, 'slip_spread_k': 0.02323264952240678, 'spread_hl_frac': 0.03767164857523352, 'bb_std_mult': 1.8293196927564452, 'rsi_os': 52, 'rsi_ob': 54, 'vol_spike': 0.2289314532922568, 'adx_thresh': 25.81483057770229, 'atr_min_pct': 0.027487312152280473, 'atr_max_pct': 0.137542038591903, 'tp_mult': 1.075184034910675, 'tsl_mult': 0.7347775214943325, 'strategy': 'breakout', 'time_stop': 238, 'use_sma': True, 'use_atr': True, 'use_adx': True, 'use_ema': False, 'use_spike': False, 'rsi_required': False, 'edge_k': 0.9059069211098731, 'edge_cap': 0.29829650557013293, 'bull_strategy': 'breakout', 'bull_bb_std_mult': 3.3204080231804403, 'bull_rsi_os': 49, 'bull_rsi_ob': 56, 'bull_adx_thresh': 28.361801323141705, 'bull_atr_min_pct': 0.024491914144991467, 'bull_atr_max_pct': 0.028333801230805845, 'bull_tp_mult': 2.8569186366020447, 'bull_tsl_mult': 0.45563830046489945, 'bull_time_stop': 86, 'bull_use_sma': False, 'bull_use_ema': True, 'bull_use_atr': False, 'bull_use_adx': True, 'bull_use_spike': True, 'bull_rsi_required': True, 'bear_strategy': 'mean_reversion', 'bear_bb_std_mult': 1.9756614863163018, 'bear_rsi_os': 34, 'bear_rsi_ob': 55, 'bear_adx_thresh': 11.226267679394917, 'bear_atr_min_pct': 0.0028708021524657345, 'bear_atr_max_pct': 0.04205281659233906, 'bear_tp_mult': 1.8619756508384384, 'bear_tsl_mult': 0.0041337240203764836, 'bear_time_stop': 212, 'bear_use_sma': True, 'bear_use_ema': False, 'bear_use_atr': False, 'bear_use_adx': True, 'bear_use_spike': False, 'bear_rsi_required': False, 'sideways_strategy': 'breakout', 'sideways_bb_std_mult': 1.0394527748486986, 'sideways_rsi_os': 50, 'sideways_rsi_ob': 69, 'sideways_adx_thresh': 6.062173113772291, 'sideways_atr_min_pct': 0.018429695477568713, 'sideways_atr_max_pct': 0.06527784531124858, 'sideways_tp_mult': 2.745602136104971, 'sideways_tsl_mult': 0.48115324603221016, 'sideways_time_stop': 190, 'sideways_use_sma': False, 'sideways_use_ema': True, 'sideways_use_atr': True, 'sideways_use_adx': True, 'sideways_use_spike': True, 'sideways_rsi_required': False}.
[I 2025-09-01 14:38:57,274] Trial 646 finished with values: [-1000000000.0, 1000000000.0] and parameters: {'p_sma': 35, 'p_std': 57, 'p_atr': 21, 'p_adx': 15, 'rsi_period': 65, 'ema1': 6, 'ema2': 18, 'slip_atr_k': 0.02421979288154956, 'slip_spread_k': 0.2825226446785156, 'spread_hl_frac': 0.029699820649827877, 'bb_std_mult': 1.8280920802700806, 'rsi_os': 39, 'rsi_ob': 85, 'vol_spike': 0.04092901079533752, 'adx_thresh': 25.865231098355284, 'atr_min_pct': 0.02790498952495819, 'atr_max_pct': 0.13733915462841398, 'tp_mult': 1.371870540312834, 'tsl_mult': 0.7390200118153761, 'strategy': 'breakout', 'time_stop': 86, 'use_sma': True, 'use_atr': True, 'use_adx': True, 'use_ema': False, 'use_spike': False, 'rsi_required': False, 'edge_k': 0.8933654904172059, 'edge_cap': 0.2964563792159117, 'bull_strategy': 'breakout', 'bull_bb_std_mult': 0.5063838912684815, 'bull_rsi_os': 32, 'bull_rsi_ob': 56, 'bull_adx_thresh': 13.232210836308301, 'bull_atr_min_pct': 0.002936927535307818, 'bull_atr_max_pct': 0.024346227297000526, 'bull_tp_mult': 2.5136539163280562, 'bull_tsl_mult': 0.6043477066901544, 'bull_time_stop': 188, 'bull_use_sma': False, 'bull_use_ema': True, 'bull_use_atr': False, 'bull_use_adx': True, 'bull_use_spike': True, 'bull_rsi_required': True, 'bear_strategy': 'mean_reversion', 'bear_bb_std_mult': 1.9847942256085205, 'bear_rsi_os': 34, 'bear_rsi_ob': 70, 'bear_adx_thresh': 19.42969631123305, 'bear_atr_min_pct': 0.006884557651119659, 'bear_atr_max_pct': 0.04239986003848984, 'bear_tp_mult': 2.9976067255809538, 'bear_tsl_mult': 0.10547575413489182, 'bear_time_stop': 18, 'bear_use_sma': True, 'bear_use_ema': False, 'bear_use_atr': False, 'bear_use_adx': True, 'bear_use_spike': False, 'bear_rsi_required': False, 'sideways_strategy': 'breakout', 'sideways_bb_std_mult': 1.9401969364778775, 'sideways_rsi_os': 27, 'sideways_rsi_ob': 66, 'sideways_adx_thresh': 7.037790402100558, 'sideways_atr_min_pct': 0.015843282328898315, 'sideways_atr_max_pct': 0.1269116197188687, 'sideways_tp_mult': 2.184902302096253, 'sideways_tsl_mult': 0.46876973356483653, 'sideways_time_stop': 146, 'sideways_use_sma': False, 'sideways_use_ema': True, 'sideways_use_atr': True, 'sideways_use_adx': True, 'sideways_use_spike': True, 'sideways_rsi_required': False}.
