[I 2025-09-01 14:45:06,377] Trial 694 finished with values: [-1000000000.0, 1000000000.0] and parameters: {'p_sma': 35, 'p_std': 47, 'p_atr': 25, 'p_adx': 11, 'rsi_period': 78, 'ema1': 23, 'ema2': 16, 'slip_atr_k': 0.13687189785273499, 'slip_spread_k': 0.6936529521396027, 'spread_hl_frac': 0.010129360883822571, 'bb_std_mult': 1.8420982566583035, 'rsi_os': 54, 'rsi_ob': 84, 'vol_spike': 0.2825501806683769, 'adx_thresh': 14.249231016212164, 'atr_min_pct': 0.01968368469429086, 'atr_max_pct': 0.13847330025486773, 'tp_mult': 1.8065435530037344, 'tsl_mult': 0.967405659381235, 'strategy': 'mean_reversion', 'time_stop': 223, 'use_sma': False, 'use_atr': True, 'use_adx': True, 'use_ema': True, 'use_spike': True, 'rsi_required': False, 'edge_k': 1.2795580625606333, 'edge_cap': 0.30410769275332644, 'bull_strategy': 'breakout', 'bull_bb_std_mult': 3.2166260913833966, 'bull_rsi_os': 17, 'bull_rsi_ob': 91, 'bull_adx_thresh': 11.376327525323315, 'bull_atr_min_pct': 0.0037752581870408967, 'bull_atr_max_pct': 0.028045561650003933, 'bull_tp_mult': 2.828806163323569, 'bull_tsl_mult': 0.2760656242719971, 'bull_time_stop': 154, 'bull_use_sma': True, 'bull_use_ema': True, 'bull_use_atr': False, 'bull_use_adx': True, 'bull_use_spike': False, 'bull_rsi_required': True, 'bear_strategy': 'breakout', 'bear_bb_std_mult': 0.6792345503633235, 'bear_rsi_os': 31, 'bear_rsi_ob': 85, 'bear_adx_thresh': 12.997657690115105, 'bear_atr_min_pct': 0.007546691717586097, 'bear_atr_max_pct': 0.04512112714318116, 'bear_tp_mult': 2.4566466138155882, 'bear_tsl_mult': 0.8956498933099291, 'bear_time_stop': 109, 'bear_use_sma': True, 'bear_use_ema': True, 'bear_use_atr': True, 'bear_use_adx': True, 'bear_use_spike': True, 'bear_rsi_required': True, 'sideways_strategy': 'breakout', 'sideways_bb_std_mult': 3.5326939474076493, 'sideways_rsi_os': 52, 'sideways_rsi_ob': 73, 'sideways_adx_thresh': 6.7467529755963795, 'sideways_atr_min_pct': 0.02433823318125521, 'sideways_atr_max_pct': 0.07036835503705655, 'sideways_tp_mult': 2.7336967939560766, 'sideways_tsl_mult': 0.3323767092767146, 'sideways_time_stop': 168, 'sideways_use_sma': True, 'sideways_use_ema': False, 'sideways_use_atr': False, 'sideways_use_adx': True, 'sideways_use_spike': False, 'sideways_rsi_required': True}.
[I 2025-09-01 14:45:06,406] Trial 695 finished with values: [-1000000000.0, 1000000000.0] and parameters: {'p_sma': 35, 'p_std': 9, 'p_atr': 25, 'p_adx': 12, 'rsi_period': 68, 'ema1': 25, 'ema2': 15, 'slip_atr_k': 0.21544260434656592, 'slip_spread_k': 0.8355860051431698, 'spread_hl_frac': 0.04882498080294309, 'bb_std_mult': 1.6790767220423732, 'rsi_os': 55, 'rsi_ob': 84, 'vol_spike': 0.20086808706964893, 'adx_thresh': 26.865052648083076, 'atr_min_pct': 0.02691749144668201, 'atr_max_pct': 0.023737233683635645, 'tp_mult': 2.5943435765790372, 'tsl_mult': 0.7430086885334792, 'strategy': 'mean_reversion', 'time_stop': 244, 'use_sma': False, 'use_atr': True, 'use_adx': True, 'use_ema': True, 'use_spike': True, 'rsi_required': True, 'edge_k': 1.0303743762074695, 'edge_cap': 0.3061387158474722, 'bull_strategy': 'breakout', 'bull_bb_std_mult': 3.209690324602104, 'bull_rsi_os': 22, 'bull_rsi_ob': 88, 'bull_adx_thresh': 28.345877074416588, 'bull_atr_min_pct': 0.0037227818079257637, 'bull_atr_max_pct': 0.028474361857958652, 'bull_tp_mult': 2.836251901383709, 'bull_tsl_mult': 0.8292204499895559, 'bull_time_stop': 83, 'bull_use_sma': True, 'bull_use_ema': True, 'bull_use_atr': False, 'bull_use_adx': True, 'bull_use_spike': False, 'bull_rsi_required': True, 'bear_strategy': 'mean_reversion', 'bear_bb_std_mult': 3.5991714874851275, 'bear_rsi_os': 31, 'bear_rsi_ob': 85, 'bear_adx_thresh': 32.79759702763004, 'bear_atr_min_pct': 0.007703184904254705, 'bear_atr_max_pct': 0.08265895266480468, 'bear_tp_mult': 2.235531724080596, 'bear_tsl_mult': 0.8911887893413667, 'bear_time_stop': 106, 'bear_use_sma': True, 'bear_use_ema': True, 'bear_use_atr': True, 'bear_use_adx': False, 'bear_use_spike': True, 'bear_rsi_required': True, 'sideways_strategy': 'breakout', 'sideways_bb_std_mult': 1.4322223353038819, 'sideways_rsi_os': 31, 'sideways_rsi_ob': 68, 'sideways_adx_thresh': 6.72029245764627, 'sideways_atr_min_pct': 0.015043296095722476, 'sideways_atr_max_pct': 0.0698247904767876, 'sideways_tp_mult': 2.7255343636864633, 'sideways_tsl_mult': 0.2923139203568841, 'sideways_time_stop': 186, 'sideways_use_sma': True, 'sideways_use_ema': False, 'sideways_use_atr': False, 'sideways_use_adx': True, 'sideways_use_spike': True, 'sideways_rsi_required': True}.
[I 2025-09-01 14:45:35,252] Trial 693 finished with values: [-1000000000.0, 1000000000.0] and parameters: {'p_sma': 45, 'p_std': 9, 'p_atr': 19, 'p_adx': 11, 'rsi_period': 68, 'ema1': 20, 'ema2': 15, 'slip_atr_k': 0.21620924506132894, 'slip_spread_k': 0.44714759977282137, 'spread_hl_frac': 0.026475151495163034, 'bb_std_mult': 0.9787175150718384, 'rsi_os': 37, 'rsi_ob': 72, 'vol_spike': 0.2404394416609375, 'adx_thresh': 21.516088887436766, 'atr_min_pct': 0.019613861923225083, 'atr_max_pct': 0.02260055645826095, 'tp_mult': 1.0427687782450263, 'tsl_mult': 0.7329728195150671, 'strategy': 'mean_reversion', 'time_stop': 269, 'use_sma': True, 'use_atr': True, 'use_adx': False, 'use_ema': True, 'use_spike': True, 'rsi_required': False, 'edge_k': 1.9760799819438573, 'edge_cap': 0.619320516765707, 'bull_strategy': 'breakout', 'bull_bb_std_mult': 3.1971431370388803, 'bull_rsi_os': 34, 'bull_rsi_ob': 95, 'bull_adx_thresh': 24.79625096587678, 'bull_atr_min_pct': 0.026011613741540304, 'bull_atr_max_pct': 0.02812301302425862, 'bull_tp_mult': 1.0843935581316986, 'bull_tsl_mult': 0.1708304839200938, 'bull_time_stop': 152, 'bull_use_sma': True, 'bull_use_ema': True, 'bull_use_atr': True, 'bull_use_adx': True, 'bull_use_spike': False, 'bull_rsi_required': True, 'bear_strategy': 'breakout', 'bear_bb_std_mult': 3.5970751304499986, 'bear_rsi_os': 20, 'bear_rsi_ob': 45, 'bear_adx_thresh': 12.429999225345128, 'bear_atr_min_pct': 0.007811945881973703, 'bear_atr_max_pct': 0.048189639017504775, 'bear_tp_mult': 2.4596188749631307, 'bear_tsl_mult': 0.9142038590110065, 'bear_time_stop': 213, 'bear_use_sma': True, 'bear_use_ema': True, 'bear_use_atr': True, 'bear_use_adx': True, 'bear_use_spike': False, 'bear_rsi_required': True, 'sideways_strategy': 'breakout', 'sideways_bb_std_mult': 1.6030714811217186, 'sideways_rsi_os': 54, 'sideways_rsi_ob': 70, 'sideways_adx_thresh': 15.661859439287252, 'sideways_atr_min_pct': 0.024432691677143854, 'sideways_atr_max_pct': 0.06911871865404955, 'sideways_tp_mult': 2.6409666730465102, 'sideways_tsl_mult': 0.7866952500645059, 'sideways_time_stop': 220, 'sideways_use_sma': True, 'sideways_use_ema': False, 'sideways_use_atr': True, 'sideways_use_adx': True, 'sideways_use_spike': False, 'sideways_rsi_required': True}.
[I 2025-09-01 14:45:36,160] Trial 696 finished with values: [-1000000000.0, 1000000000.0] and parameters: {'p_sma': 58, 'p_std': 46, 'p_atr': 19, 'p_adx': 16, 'rsi_period': 53, 'ema1': 22, 'ema2': 15, 'slip_atr_k': 0.005795752234653813, 'slip_spread_k': 0.10030963434344992, 'spread_hl_frac': 0.004036236945750088, 'bb_std_mult': 0.9603904747156511, 'rsi_os': 38, 'rsi_ob': 84, 'vol_spike': 0.15990853552603673, 'adx_thresh': 31.27479066136906, 'atr_min_pct': 0.003206268223943277, 'atr_max_pct': 0.1413349881067142, 'tp_mult': 2.3960037432077095, 'tsl_mult': 0.7328404759819946, 'strategy': 'mean_reversion', 'time_stop': 268, 'use_sma': False, 'use_atr': True, 'use_adx': True, 'use_ema': True, 'use_spike': True, 'rsi_required': True, 'edge_k': 0.9154486797789085, 'edge_cap': 0.6100524414319564, 'bull_strategy': 'breakout', 'bull_bb_std_mult': 3.2402947536128623, 'bull_rsi_os': 37, 'bull_rsi_ob': 88, 'bull_adx_thresh': 31.015022849030228, 'bull_atr_min_pct': 0.013675722419800269, 'bull_atr_max_pct': 0.028271301184365782, 'bull_tp_mult': 2.835458506889046, 'bull_tsl_mult': 0.8646012242426713, 'bull_time_stop': 5, 'bull_use_sma': True, 'bull_use_ema': True, 'bull_use_atr': False, 'bull_use_adx': True, 'bull_use_spike': False, 'bull_rsi_required': True, 'bear_strategy': 'mean_reversion', 'bear_bb_std_mult': 3.5963538648011, 'bear_rsi_os': 36, 'bear_rsi_ob': 68, 'bear_adx_thresh': 10.262199137110766, 'bear_atr_min_pct': 0.00819436576942871, 'bear_atr_max_pct': 0.04061151270152561, 'bear_tp_mult': 2.2317264802693506, 'bear_tsl_mult': 0.12663774445273854, 'bear_time_stop': 213, 'bear_use_sma': True, 'bear_use_ema': True, 'bear_use_atr': True, 'bear_use_adx': False, 'bear_use_spike': True, 'bear_rsi_required': True, 'sideways_strategy': 'breakout', 'sideways_bb_std_mult': 1.4559939492772802, 'sideways_rsi_os': 52, 'sideways_rsi_ob': 67, 'sideways_adx_thresh': 30.365140514202018, 'sideways_atr_min_pct': 0.014846923178646276, 'sideways_atr_max_pct': 0.06877341320036474, 'sideways_tp_mult': 2.7341523562418653, 'sideways_tsl_mult': 0.7574482980195631, 'sideways_time_stop': 167, 'sideways_use_sma': True, 'sideways_use_ema': False, 'sideways_use_atr': False, 'sideways_use_adx': True, 'sideways_use_spike': True, 'sideways_rsi_required': True}.
[I 2025-09-01 14:45:44,938] Trial 698 finished with values: [-1000000000.0, 1000000000.0] and parameters: {'p_sma': 13, 'p_std': 43, 'p_atr': 24, 'p_adx': 23, 'rsi_period': 53, 'ema1': 21, 'ema2': 44, 'slip_atr_k': 0.008372267428933614, 'slip_spread_k': 0.09046399495380511, 'spread_hl_frac': 0.004324599380660399, 'bb_std_mult': 3.301274997688564, 'rsi_os': 38, 'rsi_ob': 80, 'vol_spike': 0.06227428160710298, 'adx_thresh': 21.576381889797613, 'atr_min_pct': 0.0032254279511282954, 'atr_max_pct': 0.141221197382636, 'tp_mult': 1.087372399543998, 'tsl_mult': 0.7287013292349536, 'strategy': 'mean_reversion', 'time_stop': 265, 'use_sma': True, 'use_atr': False, 'use_adx': False, 'use_ema': True, 'use_spike': True, 'rsi_required': False, 'edge_k': 1.689743942744391, 'edge_cap': 0.10641301785586665, 'bull_strategy': 'breakout', 'bull_bb_std_mult': 3.332308008274042, 'bull_rsi_os': 37, 'bull_rsi_ob': 56, 'bull_adx_thresh': 27.604815653888828, 'bull_atr_min_pct': 0.005229209018982517, 'bull_atr_max_pct': 0.10290404212468365, 'bull_tp_mult': 2.179362393342834, 'bull_tsl_mult': 0.12438150975791346, 'bull_time_stop': 56, 'bull_use_sma': True, 'bull_use_ema': True, 'bull_use_atr': True, 'bull_use_adx': True, 'bull_use_spike': True, 'bull_rsi_required': True, 'bear_strategy': 'mean_reversion', 'bear_bb_std_mult': 3.599414465816461, 'bear_rsi_os': 35, 'bear_rsi_ob': 70, 'bear_adx_thresh': 10.25090784455048, 'bear_atr_min_pct': 0.0003834850354298633, 'bear_atr_max_pct': 0.10239912715757041, 'bear_tp_mult': 2.1727894158836176, 'bear_tsl_mult': 0.140099289522652, 'bear_time_stop': 213, 'bear_use_sma': True, 'bear_use_ema': True, 'bear_use_atr': True, 'bear_use_adx': True, 'bear_use_spike': False, 'bear_rsi_required': True, 'sideways_strategy': 'breakout', 'sideways_bb_std_mult': 2.4768696545534237, 'sideways_rsi_os': 6, 'sideways_rsi_ob': 67, 'sideways_adx_thresh': 5.722036309770933, 'sideways_atr_min_pct': 0.01857869520194442, 'sideways_atr_max_pct': 0.11592707289311446, 'sideways_tp_mult': 2.780801833457629, 'sideways_tsl_mult': 0.9476669373767855, 'sideways_time_stop': 181, 'sideways_use_sma': True, 'sideways_use_ema': True, 'sideways_use_atr': True, 'sideways_use_adx': True, 'sideways_use_spike': True, 'sideways_rsi_required': True}.
[I 2025-09-01 14:45:45,251] Trial 697 finished with values: [-1000000000.0, 1000000000.0] and parameters: {'p_sma': 32, 'p_std': 36, 'p_atr': 23, 'p_adx': 16, 'rsi_period': 68, 'ema1': 13, 'ema2': 18, 'slip_atr_k': 0.21563266458615032, 'slip_spread_k': 0.23254209337637216, 'spread_hl_frac': 0.006207253121448735, 'bb_std_mult': 3.3165622963386725, 'rsi_os': 39, 'rsi_ob': 80, 'vol_spike': 0.062057960369937826, 'adx_thresh': 23.905292664645245, 'atr_min_pct': 0.011565121894988881, 'atr_max_pct': 0.06253525799916691, 'tp_mult': 1.091219777866677, 'tsl_mult': 0.7389746475031531, 'strategy': 'mean_reversion', 'time_stop': 266, 'use_sma': True, 'use_atr': False, 'use_adx': True, 'use_ema': True, 'use_spike': True, 'rsi_required': True, 'edge_k': 1.9938404667416258, 'edge_cap': 0.13524409437015034, 'bull_strategy': 'breakout', 'bull_bb_std_mult': 3.562708531079548, 'bull_rsi_os': 35, 'bull_rsi_ob': 95, 'bull_adx_thresh': 28.355476722758638, 'bull_atr_min_pct': 0.013347331407841579, 'bull_atr_max_pct': 0.024808427361013904, 'bull_tp_mult': 2.7391185677707894, 'bull_tsl_mult': 0.8690024727504007, 'bull_time_stop': 101, 'bull_use_sma': True, 'bull_use_ema': True, 'bull_use_atr': True, 'bull_use_adx': True, 'bull_use_spike': True, 'bull_rsi_required': True, 'bear_strategy': 'mean_reversion', 'bear_bb_std_mult': 3.2020866022401444, 'bear_rsi_os': 34, 'bear_rsi_ob': 95, 'bear_adx_thresh': 18.765741715530215, 'bear_atr_min_pct': 0.013560744353273453, 'bear_atr_max_pct': 0.07170136214098151, 'bear_tp_mult': 2.2428305889021303, 'bear_tsl_mult': 0.7771907798944853, 'bear_time_stop': 214, 'bear_use_sma': True, 'bear_use_ema': True, 'bear_use_atr': True, 'bear_use_adx': False, 'bear_use_spike': True, 'bear_rsi_required': True, 'sideways_strategy': 'breakout', 'sideways_bb_std_mult': 1.4465108653325625, 'sideways_rsi_os': 37, 'sideways_rsi_ob': 68, 'sideways_adx_thresh': 27.633861052764754, 'sideways_atr_min_pct': 0.021215940696366096, 'sideways_atr_max_pct': 0.029820458793649293, 'sideways_tp_mult': 2.6626862710495915, 'sideways_tsl_mult': 0.2931118521992694, 'sideways_time_stop': 184, 'sideways_use_sma': True, 'sideways_use_ema': True, 'sideways_use_atr': False, 'sideways_use_adx': True, 'sideways_use_spike': True, 'sideways_rsi_required': True}.
[I 2025-09-01 14:46:17,843] Trial 700 finished with values: [-0.01935775542104945, 0.020044853107955937] and parameters: {'p_sma': 32, 'p_std': 48, 'p_atr': 24, 'p_adx': 13, 'rsi_period': 62, 'ema1': 13, 'ema2': 18, 'slip_atr_k': 0.009854578314037387, 'slip_spread_k': 0.08031834323013479, 'spread_hl_frac': 0.024295761029142122, 'bb_std_mult': 1.7102659340862232, 'rsi_os': 32, 'rsi_ob': 80, 'vol_spike': 0.22769240619876802, 'adx_thresh': 23.876704691760622, 'atr_min_pct': 0.026430326506840976, 'atr_max_pct': 0.06226492900696708, 'tp_mult': 1.0945594655154027, 'tsl_mult': 0.6998043231508795, 'strategy': 'mean_reversion', 'time_stop': 176, 'use_sma': True, 'use_atr': False, 'use_adx': False, 'use_ema': False, 'use_spike': True, 'rsi_required': False, 'edge_k': 1.6747458264007422, 'edge_cap': 0.36576190654830065, 'bull_strategy': 'breakout', 'bull_bb_std_mult': 1.5385687181030097, 'bull_rsi_os': 24, 'bull_rsi_ob': 56, 'bull_adx_thresh': 16.023963084674854, 'bull_atr_min_pct': 0.005329793623397303, 'bull_atr_max_pct': 0.07015606868332307, 'bull_tp_mult': 2.890143192856091, 'bull_tsl_mult': 0.46057058228471176, 'bull_time_stop': 176, 'bull_use_sma': True, 'bull_use_ema': True, 'bull_use_atr': True, 'bull_use_adx': True, 'bull_use_spike': True, 'bull_rsi_required': False, 'bear_strategy': 'breakout', 'bear_bb_std_mult': 3.307287680463094, 'bear_rsi_os': 35, 'bear_rsi_ob': 70, 'bear_adx_thresh': 29.198525125933607, 'bear_atr_min_pct': 0.0026008051694566847, 'bear_atr_max_pct': 0.036179572049991476, 'bear_tp_mult': 2.770156374304621, 'bear_tsl_mult': 0.6709780631407676, 'bear_time_stop': 242, 'bear_use_sma': True, 'bear_use_ema': True, 'bear_use_atr': False, 'bear_use_adx': True, 'bear_use_spike': False, 'bear_rsi_required': True, 'sideways_strategy': 'breakout', 'sideways_bb_std_mult': 1.1730554706635394, 'sideways_rsi_os': 15, 'sideways_rsi_ob': 67, 'sideways_adx_thresh': 11.833317383359724, 'sideways_atr_min_pct': 0.02115466327831197, 'sideways_atr_max_pct': 0.06522675930163188, 'sideways_tp_mult': 2.514440225612606, 'sideways_tsl_mult': 0.9470848180124982, 'sideways_time_stop': 181, 'sideways_use_sma': True, 'sideways_use_ema': True, 'sideways_use_atr': True, 'sideways_use_adx': True, 'sideways_use_spike': False, 'sideways_rsi_required': True}.
[I 2025-09-01 14:46:18,345] Trial 702 finished with values: [-0.029496196134162322, 0.029239003575802044] and parameters: {'p_sma': 37, 'p_std': 48, 'p_atr': 10, 'p_adx': 13, 'rsi_period': 28, 'ema1': 19, 'ema2': 13, 'slip_atr_k': 0.012527274912785992, 'slip_spread_k': 0.7815526740910502, 'spread_hl_frac': 0.0069691490382595, 'bb_std_mult': 1.723139655519391, 'rsi_os': 41, 'rsi_ob': 82, 'vol_spike': 0.25167091213228604, 'adx_thresh': 25.399536550047458, 'atr_min_pct': 0.02606807012244117, 'atr_max_pct': 0.1325338045720953, 'tp_mult': 1.279052170879607, 'tsl_mult': 0.7712027468269284, 'strategy': 'mean_reversion', 'time_stop': 203, 'use_sma': True, 'use_atr': False, 'use_adx': False, 'use_ema': False, 'use_spike': True, 'rsi_required': False, 'edge_k': 0.7513641185400768, 'edge_cap': 0.36908369110658973, 'bull_strategy': 'breakout', 'bull_bb_std_mult': 0.5690549091023291, 'bull_rsi_os': 5, 'bull_rsi_ob': 53, 'bull_adx_thresh': 30.59668075773079, 'bull_atr_min_pct': 0.021089398492176344, 'bull_atr_max_pct': 0.02201540079410527, 'bull_tp_mult': 2.784973511711807, 'bull_tsl_mult': 0.6481187733082098, 'bull_time_stop': 91, 'bull_use_sma': True, 'bull_use_ema': True, 'bull_use_atr': True, 'bull_use_adx': False, 'bull_use_spike': False, 'bull_rsi_required': False, 'bear_strategy': 'breakout', 'bear_bb_std_mult': 3.5000269732118414, 'bear_rsi_os': 32, 'bear_rsi_ob': 93, 'bear_adx_thresh': 29.107089012802184, 'bear_atr_min_pct': 0.0026814431291015926, 'bear_atr_max_pct': 0.1333148576473961, 'bear_tp_mult': 1.9925958023688883, 'bear_tsl_mult': 0.1703848992443576, 'bear_time_stop': 225, 'bear_use_sma': True, 'bear_use_ema': True, 'bear_use_atr': False, 'bear_use_adx': True, 'bear_use_spike': False, 'bear_rsi_required': True, 'sideways_strategy': 'breakout', 'sideways_bb_std_mult': 2.940105091986519, 'sideways_rsi_os': 15, 'sideways_rsi_ob': 49, 'sideways_adx_thresh': 7.458042743583052, 'sideways_atr_min_pct': 0.01987319145934599, 'sideways_atr_max_pct': 0.039618252541807855, 'sideways_tp_mult': 2.9436570393690396, 'sideways_tsl_mult': 0.2571779005204845, 'sideways_time_stop': 58, 'sideways_use_sma': True, 'sideways_use_ema': False, 'sideways_use_atr': True, 'sideways_use_adx': False, 'sideways_use_spike': False, 'sideways_rsi_required': True}.
[I 2025-09-01 14:46:18,486] Trial 699 finished with values: [-1000000000.0, 1000000000.0] and parameters: {'p_sma': 37, 'p_std': 6, 'p_atr': 24, 'p_adx': 13, 'rsi_period': 65, 'ema1': 22, 'ema2': 13, 'slip_atr_k': 0.007643153332445734, 'slip_spread_k': 0.09976909185739394, 'spread_hl_frac': 0.023597173288924633, 'bb_std_mult': 1.7704059877036613, 'rsi_os': 39, 'rsi_ob': 80, 'vol_spike': 0.2602744615897326, 'adx_thresh': 25.461422524742705, 'atr_min_pct': 0.0261388589099895, 'atr_max_pct': 0.08138929438084092, 'tp_mult': 1.3355744277800454, 'tsl_mult': 0.7004027258168762, 'strategy': 'mean_reversion', 'time_stop': 60, 'use_sma': True, 'use_atr': False, 'use_adx': False, 'use_ema': False, 'use_spike': True, 'rsi_required': True, 'edge_k': 1.6985338198110154, 'edge_cap': 0.21450081746885713, 'bull_strategy': 'breakout', 'bull_bb_std_mult': 3.32684139654117, 'bull_rsi_os': 32, 'bull_rsi_ob': 56, 'bull_adx_thresh': 30.730181481359814, 'bull_atr_min_pct': 0.016015021263516144, 'bull_atr_max_pct': 0.12698916489147177, 'bull_tp_mult': 2.171423648260703, 'bull_tsl_mult': 0.4640705551812429, 'bull_time_stop': 98, 'bull_use_sma': True, 'bull_use_ema': True, 'bull_use_atr': True, 'bull_use_adx': True, 'bull_use_spike': True, 'bull_rsi_required': True, 'bear_strategy': 'mean_reversion', 'bear_bb_std_mult': 3.492137970713881, 'bear_rsi_os': 34, 'bear_rsi_ob': 88, 'bear_adx_thresh': 10.379707346027311, 'bear_atr_min_pct': 0.012183487627412792, 'bear_atr_max_pct': 0.03955131786840612, 'bear_tp_mult': 2.7704280578586493, 'bear_tsl_mult': 0.13572861885639625, 'bear_time_stop': 226, 'bear_use_sma': True, 'bear_use_ema': True, 'bear_use_atr': False, 'bear_use_adx': False, 'bear_use_spike': False, 'bear_rsi_required': True, 'sideways_strategy': 'breakout', 'sideways_bb_std_mult': 1.8820047490241805, 'sideways_rsi_os': 6, 'sideways_rsi_ob': 67, 'sideways_adx_thresh': 5.890195490314135, 'sideways_atr_min_pct': 0.018428661303904637, 'sideways_atr_max_pct': 0.0655576763188415, 'sideways_tp_mult': 1.4582960542623056, 'sideways_tsl_mult': 0.5516333277645159, 'sideways_time_stop': 36, 'sideways_use_sma': True, 'sideways_use_ema': True, 'sideways_use_atr': True, 'sideways_use_adx': True, 'sideways_use_spike': True, 'sideways_rsi_required': True}.
