[I 2025-09-01 14:06:04,993] Trial 423 finished with values: [-1000000000.0, 1000000000.0] and parameters: {'p_sma': 59, 'p_std': 48, 'p_atr': 20, 'p_adx': 15, 'rsi_period': 63, 'ema1': 27, 'ema2': 18, 'slip_atr_k': 0.02143040741735399, 'slip_spread_k': 0.11171591357693621, 'spread_hl_frac': 0.03898542493605954, 'bb_std_mult': 2.5454321880296855, 'rsi_os': 17, 'rsi_ob': 81, 'vol_spike': 0.1369508098316655, 'adx_thresh': 26.36672298713381, 'atr_min_pct': 0.018382126017227635, 'atr_max_pct': 0.14553488556829303, 'tp_mult': 1.6644198952629043, 'tsl_mult': 0.6893670767902792, 'strategy': 'mean_reversion', 'time_stop': 220, 'use_sma': False, 'use_atr': False, 'use_adx': False, 'use_ema': False, 'use_spike': True, 'rsi_required': True, 'edge_k': 0.8968497198395563, 'edge_cap': 0.2458116197925458, 'bull_strategy': 'mean_reversion', 'bull_bb_std_mult': 3.458658664530499, 'bull_rsi_os': 34, 'bull_rsi_ob': 87, 'bull_adx_thresh': 31.298876714664278, 'bull_atr_min_pct': 0.0036040287127850567, 'bull_atr_max_pct': 0.026821782734149518, 'bull_tp_mult': 2.44383216686845, 'bull_tsl_mult': 0.9074994751581182, 'bull_time_stop': 197, 'bull_use_sma': True, 'bull_use_ema': False, 'bull_use_atr': False, 'bull_use_adx': True, 'bull_use_spike': False, 'bull_rsi_required': True, 'bear_strategy': 'breakout', 'bear_bb_std_mult': 3.54692956371706, 'bear_rsi_os': 30, 'bear_rsi_ob': 87, 'bear_adx_thresh': 11.738939036224261, 'bear_atr_min_pct': 0.004567477921598494, 'bear_atr_max_pct': 0.0424537293992098, 'bear_tp_mult': 2.2585155980395264, 'bear_tsl_mult': 0.5937875910655077, 'bear_time_stop': 218, 'bear_use_sma': False, 'bear_use_ema': True, 'bear_use_atr': True, 'bear_use_adx': True, 'bear_use_spike': True, 'bear_rsi_required': True, 'sideways_strategy': 'mean_reversion', 'sideways_bb_std_mult': 2.3398358989648425, 'sideways_rsi_os': 20, 'sideways_rsi_ob': 66, 'sideways_adx_thresh': 5.4979741400779485, 'sideways_atr_min_pct': 0.025158434688902727, 'sideways_atr_max_pct': 0.13916293992686626, 'sideways_tp_mult': 1.5660611320092097, 'sideways_tsl_mult': 0.2646797844548545, 'sideways_time_stop': 270, 'sideways_use_sma': True, 'sideways_use_ema': False, 'sideways_use_atr': False, 'sideways_use_adx': True, 'sideways_use_spike': False, 'sideways_rsi_required': False}.
[I 2025-09-01 14:06:05,863] Trial 424 finished with values: [-1000000000.0, 1000000000.0] and parameters: {'p_sma': 36, 'p_std': 48, 'p_atr': 22, 'p_adx': 15, 'rsi_period': 36, 'ema1': 20, 'ema2': 18, 'slip_atr_k': 0.006909712210356454, 'slip_spread_k': 0.10152248233239147, 'spread_hl_frac': 0.007223172927643395, 'bb_std_mult': 2.4478015558774517, 'rsi_os': 22, 'rsi_ob': 81, 'vol_spike': 0.13680256768130564, 'adx_thresh': 26.342471532249842, 'atr_min_pct': 0.016208322711644508, 'atr_max_pct': 0.13288653271457496, 'tp_mult': 1.120850099342562, 'tsl_mult': 0.6915274947120172, 'strategy': 'mean_reversion', 'time_stop': 165, 'use_sma': False, 'use_atr': False, 'use_adx': False, 'use_ema': False, 'use_spike': False, 'rsi_required': True, 'edge_k': 0.907086999628973, 'edge_cap': 0.33631207078663927, 'bull_strategy': 'mean_reversion', 'bull_bb_std_mult': 2.8069778120333186, 'bull_rsi_os': 22, 'bull_rsi_ob': 54, 'bull_adx_thresh': 29.866929522872418, 'bull_atr_min_pct': 0.024519403140768455, 'bull_atr_max_pct': 0.027450661108066057, 'bull_tp_mult': 1.5743678736381228, 'bull_tsl_mult': 0.7855678064121447, 'bull_time_stop': 100, 'bull_use_sma': False, 'bull_use_ema': False, 'bull_use_atr': False, 'bull_use_adx': True, 'bull_use_spike': False, 'bull_rsi_required': False, 'bear_strategy': 'mean_reversion', 'bear_bb_std_mult': 3.5490236552349934, 'bear_rsi_os': 30, 'bear_rsi_ob': 87, 'bear_adx_thresh': 11.741265096442133, 'bear_atr_min_pct': 0.024343679429981176, 'bear_atr_max_pct': 0.0421048627779251, 'bear_tp_mult': 2.2549028961587525, 'bear_tsl_mult': 0.06809389508635033, 'bear_time_stop': 297, 'bear_use_sma': False, 'bear_use_ema': True, 'bear_use_atr': True, 'bear_use_adx': False, 'bear_use_spike': True, 'bear_rsi_required': False, 'sideways_strategy': 'mean_reversion', 'sideways_bb_std_mult': 1.6701080518598852, 'sideways_rsi_os': 14, 'sideways_rsi_ob': 66, 'sideways_adx_thresh': 29.62880517599621, 'sideways_atr_min_pct': 0.020693671974591103, 'sideways_atr_max_pct': 0.06911152728184795, 'sideways_tp_mult': 2.8460391006162453, 'sideways_tsl_mult': 0.8096064322081827, 'sideways_time_stop': 204, 'sideways_use_sma': False, 'sideways_use_ema': True, 'sideways_use_atr': False, 'sideways_use_adx': False, 'sideways_use_spike': False, 'sideways_rsi_required': False}.
[I 2025-09-01 14:06:06,873] Trial 426 finished with values: [-1000000000.0, 1000000000.0] and parameters: {'p_sma': 34, 'p_std': 9, 'p_atr': 25, 'p_adx': 10, 'rsi_period': 35, 'ema1': 25, 'ema2': 20, 'slip_atr_k': 0.03037201766589202, 'slip_spread_k': 0.07667706837938465, 'spread_hl_frac': 0.04787325314779807, 'bb_std_mult': 1.5609265556938934, 'rsi_os': 30, 'rsi_ob': 84, 'vol_spike': 0.19137318007817747, 'adx_thresh': 23.98009434857216, 'atr_min_pct': 0.022136154163659657, 'atr_max_pct': 0.015522670975312083, 'tp_mult': 1.1327205365507877, 'tsl_mult': 0.7840007497179652, 'strategy': 'breakout', 'time_stop': 231, 'use_sma': True, 'use_atr': False, 'use_adx': False, 'use_ema': True, 'use_spike': False, 'rsi_required': False, 'edge_k': 0.9133534397708769, 'edge_cap': 0.49071416364610443, 'bull_strategy': 'breakout', 'bull_bb_std_mult': 3.219497148664058, 'bull_rsi_os': 35, 'bull_rsi_ob': 62, 'bull_adx_thresh': 29.205849602625502, 'bull_atr_min_pct': 0.004864262296331769, 'bull_atr_max_pct': 0.05687519118657433, 'bull_tp_mult': 2.7912296163473775, 'bull_tsl_mult': 0.09910425143356366, 'bull_time_stop': 99, 'bull_use_sma': False, 'bull_use_ema': True, 'bull_use_atr': True, 'bull_use_adx': True, 'bull_use_spike': False, 'bull_rsi_required': False, 'bear_strategy': 'mean_reversion', 'bear_bb_std_mult': 3.5978594278832396, 'bear_rsi_os': 34, 'bear_rsi_ob': 88, 'bear_adx_thresh': 12.16596367000106, 'bear_atr_min_pct': 0.009761225638461206, 'bear_atr_max_pct': 0.046365386508266965, 'bear_tp_mult': 2.2145328486590934, 'bear_tsl_mult': 0.4227019893391939, 'bear_time_stop': 232, 'bear_use_sma': True, 'bear_use_ema': False, 'bear_use_atr': True, 'bear_use_adx': False, 'bear_use_spike': False, 'bear_rsi_required': False, 'sideways_strategy': 'breakout', 'sideways_bb_std_mult': 1.7030145886567343, 'sideways_rsi_os': 16, 'sideways_rsi_ob': 77, 'sideways_adx_thresh': 6.9750318917113425, 'sideways_atr_min_pct': 0.020667861656716784, 'sideways_atr_max_pct': 0.069154708524939, 'sideways_tp_mult': 2.720642694348568, 'sideways_tsl_mult': 0.26026413837848106, 'sideways_time_stop': 223, 'sideways_use_sma': False, 'sideways_use_ema': True, 'sideways_use_atr': True, 'sideways_use_adx': False, 'sideways_use_spike': False, 'sideways_rsi_required': True}.
[I 2025-09-01 14:06:43,304] Trial 428 finished with values: [-0.020421544960822935, 0.02024956230512573] and parameters: {'p_sma': 34, 'p_std': 29, 'p_atr': 25, 'p_adx': 10, 'rsi_period': 67, 'ema1': 21, 'ema2': 20, 'slip_atr_k': 0.03044499736156411, 'slip_spread_k': 0.8189123569137364, 'spread_hl_frac': 0.04765208608713935, 'bb_std_mult': 1.5580332121256832, 'rsi_os': 48, 'rsi_ob': 84, 'vol_spike': 0.09611930712318584, 'adx_thresh': 25.67137626496761, 'atr_min_pct': 0.012620985108931553, 'atr_max_pct': 0.13605011708817746, 'tp_mult': 1.0719194710281192, 'tsl_mult': 0.775491330199903, 'strategy': 'breakout', 'time_stop': 230, 'use_sma': True, 'use_atr': False, 'use_adx': False, 'use_ema': True, 'use_spike': False, 'rsi_required': False, 'edge_k': 1.1846805794745334, 'edge_cap': 0.3082897597517524, 'bull_strategy': 'breakout', 'bull_bb_std_mult': 3.2240207905158154, 'bull_rsi_os': 35, 'bull_rsi_ob': 62, 'bull_adx_thresh': 29.804173817503955, 'bull_atr_min_pct': 0.002300093183949588, 'bull_atr_max_pct': 0.01984976049330192, 'bull_tp_mult': 2.7517577575782615, 'bull_tsl_mult': 0.8381038889054038, 'bull_time_stop': 281, 'bull_use_sma': False, 'bull_use_ema': True, 'bull_use_atr': True, 'bull_use_adx': True, 'bull_use_spike': False, 'bull_rsi_required': False, 'bear_strategy': 'mean_reversion', 'bear_bb_std_mult': 3.5999520447795526, 'bear_rsi_os': 34, 'bear_rsi_ob': 95, 'bear_adx_thresh': 12.010999124779067, 'bear_atr_min_pct': 0.009388039062786447, 'bear_atr_max_pct': 0.0378714060141385, 'bear_tp_mult': 2.1931108046741024, 'bear_tsl_mult': 0.6946150512522196, 'bear_time_stop': 234, 'bear_use_sma': True, 'bear_use_ema': False, 'bear_use_atr': True, 'bear_use_adx': False, 'bear_use_spike': False, 'bear_rsi_required': False, 'sideways_strategy': 'breakout', 'sideways_bb_std_mult': 1.3598340800285884, 'sideways_rsi_os': 22, 'sideways_rsi_ob': 78, 'sideways_adx_thresh': 33.53002169320979, 'sideways_atr_min_pct': 0.021052594169532653, 'sideways_atr_max_pct': 0.035866995778714064, 'sideways_tp_mult': 2.7244311622845276, 'sideways_tsl_mult': 0.8861819445361092, 'sideways_time_stop': 88, 'sideways_use_sma': False, 'sideways_use_ema': True, 'sideways_use_atr': True, 'sideways_use_adx': False, 'sideways_use_spike': False, 'sideways_rsi_required': True}.
[I 2025-09-01 14:06:43,359] Trial 429 finished with values: [-0.013274654501193028, 0.013286046077784212] and parameters: {'p_sma': 36, 'p_std': 24, 'p_atr': 25, 'p_adx': 8, 'rsi_period': 67, 'ema1': 21, 'ema2': 16, 'slip_atr_k': 0.010213983330694657, 'slip_spread_k': 0.49695627661025843, 'spread_hl_frac': 0.027020240596404534, 'bb_std_mult': 1.8438755237064826, 'rsi_os': 39, 'rsi_ob': 69, 'vol_spike': 0.2496551754571547, 'adx_thresh': 25.52473339009683, 'atr_min_pct': 0.005952614570981037, 'atr_max_pct': 0.10438866010365953, 'tp_mult': 2.4704111512315396, 'tsl_mult': 0.7257170928545613, 'strategy': 'breakout', 'time_stop': 229, 'use_sma': True, 'use_atr': False, 'use_adx': False, 'use_ema': True, 'use_spike': True, 'rsi_required': False, 'edge_k': 1.757947702725559, 'edge_cap': 0.3030728521434398, 'bull_strategy': 'breakout', 'bull_bb_std_mult': 2.7459413601416096, 'bull_rsi_os': 37, 'bull_rsi_ob': 56, 'bull_adx_thresh': 9.20131551568188, 'bull_atr_min_pct': 0.00410977264198682, 'bull_atr_max_pct': 0.010696709716818964, 'bull_tp_mult': 2.751711205219298, 'bull_tsl_mult': 0.14670913685575954, 'bull_time_stop': 212, 'bull_use_sma': True, 'bull_use_ema': True, 'bull_use_atr': True, 'bull_use_adx': True, 'bull_use_spike': False, 'bull_rsi_required': True, 'bear_strategy': 'breakout', 'bear_bb_std_mult': 3.4629821677014876, 'bear_rsi_os': 35, 'bear_rsi_ob': 76, 'bear_adx_thresh': 29.79998578791654, 'bear_atr_min_pct': 0.004013052633725872, 'bear_atr_max_pct': 0.03815061884610369, 'bear_tp_mult': 2.1725567257603076, 'bear_tsl_mult': 0.14493588703524968, 'bear_time_stop': 192, 'bear_use_sma': True, 'bear_use_ema': False, 'bear_use_atr': False, 'bear_use_adx': True, 'bear_use_spike': False, 'bear_rsi_required': True, 'sideways_strategy': 'breakout', 'sideways_bb_std_mult': 1.5938821368415248, 'sideways_rsi_os': 32, 'sideways_rsi_ob': 50, 'sideways_adx_thresh': 22.844603767180896, 'sideways_atr_min_pct': 0.021575884792727054, 'sideways_atr_max_pct': 0.07902712250385578, 'sideways_tp_mult': 1.4662874148582508, 'sideways_tsl_mult': 0.8973934500040441, 'sideways_time_stop': 215, 'sideways_use_sma': True, 'sideways_use_ema': False, 'sideways_use_atr': True, 'sideways_use_adx': True, 'sideways_use_spike': False, 'sideways_rsi_required': True}.
[I 2025-09-01 14:06:43,359] Trial 427 finished with values: [-1000000000.0, 1000000000.0] and parameters: {'p_sma': 25, 'p_std': 9, 'p_atr': 25, 'p_adx': 10, 'rsi_period': 37, 'ema1': 25, 'ema2': 20, 'slip_atr_k': 0.030780568661340085, 'slip_spread_k': 0.8205766643849505, 'spread_hl_frac': 0.04760754852744823, 'bb_std_mult': 1.5795409515327798, 'rsi_os': 39, 'rsi_ob': 84, 'vol_spike': 0.05170108997703762, 'adx_thresh': 32.33167115625755, 'atr_min_pct': 0.005688146274214609, 'atr_max_pct': 0.012798744962157438, 'tp_mult': 1.3098337720687558, 'tsl_mult': 0.7718479525393607, 'strategy': 'breakout', 'time_stop': 230, 'use_sma': True, 'use_atr': False, 'use_adx': False, 'use_ema': True, 'use_spike': False, 'rsi_required': False, 'edge_k': 0.9179084745742131, 'edge_cap': 0.3042876221580235, 'bull_strategy': 'breakout', 'bull_bb_std_mult': 2.729913254844279, 'bull_rsi_os': 35, 'bull_rsi_ob': 83, 'bull_adx_thresh': 29.08010349724347, 'bull_atr_min_pct': 0.0042909883334611605, 'bull_atr_max_pct': 0.11944533514527789, 'bull_tp_mult': 2.6947504199423973, 'bull_tsl_mult': 0.44103715910548735, 'bull_time_stop': 102, 'bull_use_sma': False, 'bull_use_ema': True, 'bull_use_atr': True, 'bull_use_adx': True, 'bull_use_spike': False, 'bull_rsi_required': False, 'bear_strategy': 'mean_reversion', 'bear_bb_std_mult': 3.448333495715484, 'bear_rsi_os': 34, 'bear_rsi_ob': 88, 'bear_adx_thresh': 29.781395371145194, 'bear_atr_min_pct': 0.024451655325228347, 'bear_atr_max_pct': 0.046573156045783014, 'bear_tp_mult': 1.6206069028895194, 'bear_tsl_mult': 0.14449870446481927, 'bear_time_stop': 103, 'bear_use_sma': True, 'bear_use_ema': False, 'bear_use_atr': True, 'bear_use_adx': False, 'bear_use_spike': False, 'bear_rsi_required': False, 'sideways_strategy': 'breakout', 'sideways_bb_std_mult': 1.6652543911391, 'sideways_rsi_os': 55, 'sideways_rsi_ob': 64, 'sideways_adx_thresh': 7.407236936543965, 'sideways_atr_min_pct': 0.02057245045630516, 'sideways_atr_max_pct': 0.03536209158642328, 'sideways_tp_mult': 1.158970380841425, 'sideways_tsl_mult': 0.25477711097025, 'sideways_time_stop': 197, 'sideways_use_sma': False, 'sideways_use_ema': True, 'sideways_use_atr': True, 'sideways_use_adx': False, 'sideways_use_spike': False, 'sideways_rsi_required': True}.
[I 2025-09-01 14:06:43,661] Trial 425 finished with values: [-1000000000.0, 1000000000.0] and parameters: {'p_sma': 34, 'p_std': 51, 'p_atr': 25, 'p_adx': 10, 'rsi_period': 35, 'ema1': 25, 'ema2': 20, 'slip_atr_k': 0.03088439912880335, 'slip_spread_k': 0.07652248646012258, 'spread_hl_frac': 0.007115953870297583, 'bb_std_mult': 2.437635370711025, 'rsi_os': 32, 'rsi_ob': 85, 'vol_spike': 0.25051076001292355, 'adx_thresh': 32.46020552694331, 'atr_min_pct': 0.013604153309318905, 'atr_max_pct': 0.10419933054785635, 'tp_mult': 2.477967091753894, 'tsl_mult': 0.7726728883664652, 'strategy': 'breakout', 'time_stop': 251, 'use_sma': True, 'use_atr': False, 'use_adx': False, 'use_ema': True, 'use_spike': False, 'rsi_required': False, 'edge_k': 0.8625772171331745, 'edge_cap': 0.30051854291404995, 'bull_strategy': 'breakout', 'bull_bb_std_mult': 2.74514655491038, 'bull_rsi_os': 22, 'bull_rsi_ob': 54, 'bull_adx_thresh': 29.18881447393109, 'bull_atr_min_pct': 0.01359398742458855, 'bull_atr_max_pct': 0.019689100666514872, 'bull_tp_mult': 2.6938932875788613, 'bull_tsl_mult': 0.44575812957065186, 'bull_time_stop': 205, 'bull_use_sma': False, 'bull_use_ema': True, 'bull_use_atr': True, 'bull_use_adx': True, 'bull_use_spike': False, 'bull_rsi_required': False, 'bear_strategy': 'mean_reversion', 'bear_bb_std_mult': 3.597162771836974, 'bear_rsi_os': 34, 'bear_rsi_ob': 88, 'bear_adx_thresh': 13.29659637197825, 'bear_atr_min_pct': 0.028741356024557588, 'bear_atr_max_pct': 0.055828757599580725, 'bear_tp_mult': 2.202728664957185, 'bear_tsl_mult': 0.700785026700341, 'bear_time_stop': 90, 'bear_use_sma': True, 'bear_use_ema': False, 'bear_use_atr': True, 'bear_use_adx': False, 'bear_use_spike': False, 'bear_rsi_required': False, 'sideways_strategy': 'breakout', 'sideways_bb_std_mult': 1.6905510235701973, 'sideways_rsi_os': 13, 'sideways_rsi_ob': 64, 'sideways_adx_thresh': 7.45588781204127, 'sideways_atr_min_pct': 0.020721321018999688, 'sideways_atr_max_pct': 0.035596678877664746, 'sideways_tp_mult': 2.840344141507831, 'sideways_tsl_mult': 0.25519799967989304, 'sideways_time_stop': 41, 'sideways_use_sma': False, 'sideways_use_ema': True, 'sideways_use_atr': True, 'sideways_use_adx': False, 'sideways_use_spike': False, 'sideways_rsi_required': True}.
[I 2025-09-01 14:07:20,074] Trial 430 finished with values: [-0.021528616736002926, 0.021577548342700842] and parameters: {'p_sma': 35, 'p_std': 23, 'p_atr': 26, 'p_adx': 27, 'rsi_period': 67, 'ema1': 21, 'ema2': 15, 'slip_atr_k': 0.04209113156077454, 'slip_spread_k': 0.9604113111282051, 'spread_hl_frac': 0.02687466909293649, 'bb_std_mult': 1.8632612415918033, 'rsi_os': 42, 'rsi_ob': 74, 'vol_spike': 0.25018490659613685, 'adx_thresh': 25.42793962718109, 'atr_min_pct': 0.013796992180456928, 'atr_max_pct': 0.1362307104041041, 'tp_mult': 1.0715825871212965, 'tsl_mult': 0.7212575866580394, 'strategy': 'mean_reversion', 'time_stop': 251, 'use_sma': True, 'use_atr': False, 'use_adx': False, 'use_ema': True, 'use_spike': True, 'rsi_required': False, 'edge_k': 0.8455948947724662, 'edge_cap': 0.3649062300740774, 'bull_strategy': 'breakout', 'bull_bb_std_mult': 3.192217176926132, 'bull_rsi_os': 18, 'bull_rsi_ob': 55, 'bull_adx_thresh': 29.791762801559802, 'bull_atr_min_pct': 0.013449932227110946, 'bull_atr_max_pct': 0.020443709006400825, 'bull_tp_mult': 2.768261500986507, 'bull_tsl_mult': 0.15050986573418323, 'bull_time_stop': 93, 'bull_use_sma': True, 'bull_use_ema': True, 'bull_use_atr': True, 'bull_use_adx': True, 'bull_use_spike': False, 'bull_rsi_required': True, 'bear_strategy': 'breakout', 'bear_bb_std_mult': 3.4809296663317832, 'bear_rsi_os': 31, 'bear_rsi_ob': 82, 'bear_adx_thresh': 26.889809246343845, 'bear_atr_min_pct': 0.004036389990193998, 'bear_atr_max_pct': 0.03721339413116669, 'bear_tp_mult': 2.358931845142928, 'bear_tsl_mult': 0.6910191724809537, 'bear_time_stop': 192, 'bear_use_sma': True, 'bear_use_ema': True, 'bear_use_atr': True, 'bear_use_adx': True, 'bear_use_spike': False, 'bear_rsi_required': True, 'sideways_strategy': 'breakout', 'sideways_bb_std_mult': 1.5892823412858612, 'sideways_rsi_os': 47, 'sideways_rsi_ob': 67, 'sideways_adx_thresh': 11.783183069151296, 'sideways_atr_min_pct': 0.003362677488191336, 'sideways_atr_max_pct': 0.06031004194175747, 'sideways_tp_mult': 2.7292128460098906, 'sideways_tsl_mult': 0.32321650749371805, 'sideways_time_stop': 214, 'sideways_use_sma': True, 'sideways_use_ema': False, 'sideways_use_atr': True, 'sideways_use_adx': True, 'sideways_use_spike': False, 'sideways_rsi_required': True}.
[I 2025-09-01 14:07:20,602] Trial 432 finished with values: [-0.02245411350282156, 0.02229576917304549] and parameters: {'p_sma': 35, 'p_std': 6, 'p_atr': 13, 'p_adx': 11, 'rsi_period': 67, 'ema1': 21, 'ema2': 15, 'slip_atr_k': 0.08819246468879463, 'slip_spread_k': 0.7324869243878612, 'spread_hl_frac': 0.0027700715267084883, 'bb_std_mult': 0.5021661276011453, 'rsi_os': 39, 'rsi_ob': 87, 'vol_spike': 0.09551990858311195, 'adx_thresh': 25.908567354148577, 'atr_min_pct': 0.02809407996513531, 'atr_max_pct': 0.13578761956496224, 'tp_mult': 1.0822585316589357, 'tsl_mult': 0.37451289684079436, 'strategy': 'mean_reversion', 'time_stop': 137, 'use_sma': True, 'use_atr': False, 'use_adx': False, 'use_ema': True, 'use_spike': True, 'rsi_required': False, 'edge_k': 0.9746808858442242, 'edge_cap': 0.3605919288714927, 'bull_strategy': 'breakout', 'bull_bb_std_mult': 0.9103027295373667, 'bull_rsi_os': 13, 'bull_rsi_ob': 56, 'bull_adx_thresh': 29.622205391503908, 'bull_atr_min_pct': 0.00868265588025827, 'bull_atr_max_pct': 0.02262823686143228, 'bull_tp_mult': 2.750034639823134, 'bull_tsl_mult': 0.7088368955004423, 'bull_time_stop': 93, 'bull_use_sma': True, 'bull_use_ema': True, 'bull_use_atr': True, 'bull_use_adx': True, 'bull_use_spike': False, 'bull_rsi_required': True, 'bear_strategy': 'breakout', 'bear_bb_std_mult': 3.479965653287008, 'bear_rsi_os': 27, 'bear_rsi_ob': 58, 'bear_adx_thresh': 9.615492940996571, 'bear_atr_min_pct': 0.005896077984290947, 'bear_atr_max_pct': 0.037961583248824725, 'bear_tp_mult': 1.533608718906155, 'bear_tsl_mult': 0.28143683664448005, 'bear_time_stop': 123, 'bear_use_sma': True, 'bear_use_ema': True, 'bear_use_atr': True, 'bear_use_adx': True, 'bear_use_spike': False, 'bear_rsi_required': True, 'sideways_strategy': 'breakout', 'sideways_bb_std_mult': 1.6014250939765755, 'sideways_rsi_os': 43, 'sideways_rsi_ob': 50, 'sideways_adx_thresh': 30.618824690501164, 'sideways_atr_min_pct': 0.0035299326977417823, 'sideways_atr_max_pct': 0.07920015467123213, 'sideways_tp_mult': 2.7988933761757715, 'sideways_tsl_mult': 0.897851713034522, 'sideways_time_stop': 91, 'sideways_use_sma': True, 'sideways_use_ema': False, 'sideways_use_atr': True, 'sideways_use_adx': True, 'sideways_use_spike': False, 'sideways_rsi_required': True}.
