[I 2025-09-01 14:19:29,736] Trial 513 finished with values: [-1000000000.0, 1000000000.0] and parameters: {'p_sma': 40, 'p_std': 14, 'p_atr': 19, 'p_adx': 21, 'rsi_period': 66, 'ema1': 24, 'ema2': 15, 'slip_atr_k': 0.17317824667612164, 'slip_spread_k': 0.5024243768871923, 'spread_hl_frac': 0.011669621483778854, 'bb_std_mult': 1.6992812349630952, 'rsi_os': 41, 'rsi_ob': 85, 'vol_spike': 0.24745837102381363, 'adx_thresh': 24.10943308815819, 'atr_min_pct': 0.02622579673251038, 'atr_max_pct': 0.13718820187455805, 'tp_mult': 2.4461865166288694, 'tsl_mult': 0.7236130676611208, 'strategy': 'breakout', 'time_stop': 113, 'use_sma': True, 'use_atr': True, 'use_adx': False, 'use_ema': False, 'use_spike': True, 'rsi_required': True, 'edge_k': 0.8184778808470283, 'edge_cap': 0.30097215473063565, 'bull_strategy': 'breakout', 'bull_bb_std_mult': 2.514907933381987, 'bull_rsi_os': 25, 'bull_rsi_ob': 56, 'bull_adx_thresh': 28.613890677161613, 'bull_atr_min_pct': 0.025002815329061637, 'bull_atr_max_pct': 0.023209767182602287, 'bull_tp_mult': 1.1859022780876993, 'bull_tsl_mult': 0.41948934120469444, 'bull_time_stop': 192, 'bull_use_sma': False, 'bull_use_ema': False, 'bull_use_atr': True, 'bull_use_adx': True, 'bull_use_spike': True, 'bull_rsi_required': False, 'bear_strategy': 'mean_reversion', 'bear_bb_std_mult': 0.5916501735981419, 'bear_rsi_os': 34, 'bear_rsi_ob': 88, 'bear_adx_thresh': 12.625372391807135, 'bear_atr_min_pct': 0.0010354369359320964, 'bear_atr_max_pct': 0.1363110258206764, 'bear_tp_mult': 1.7022707382666158, 'bear_tsl_mult': 0.0541210612126824, 'bear_time_stop': 249, 'bear_use_sma': True, 'bear_use_ema': False, 'bear_use_atr': True, 'bear_use_adx': True, 'bear_use_spike': False, 'bear_rsi_required': True, 'sideways_strategy': 'breakout', 'sideways_bb_std_mult': 1.4194611788251117, 'sideways_rsi_os': 52, 'sideways_rsi_ob': 66, 'sideways_adx_thresh': 8.269612987656666, 'sideways_atr_min_pct': 0.028335623727088997, 'sideways_atr_max_pct': 0.04216183871689129, 'sideways_tp_mult': 2.587379296206077, 'sideways_tsl_mult': 0.7031273515973406, 'sideways_time_stop': 158, 'sideways_use_sma': True, 'sideways_use_ema': True, 'sideways_use_atr': True, 'sideways_use_adx': False, 'sideways_use_spike': True, 'sideways_rsi_required': False}.
[I 2025-09-01 14:19:29,751] Trial 512 finished with values: [-1000000000.0, 1000000000.0] and parameters: {'p_sma': 15, 'p_std': 39, 'p_atr': 8, 'p_adx': 12, 'rsi_period': 9, 'ema1': 24, 'ema2': 15, 'slip_atr_k': 0.073093130700535, 'slip_spread_k': 0.542378848444425, 'spread_hl_frac': 0.030867643617588602, 'bb_std_mult': 1.6987982075801442, 'rsi_os': 28, 'rsi_ob': 83, 'vol_spike': 0.23065752015994576, 'adx_thresh': 25.84839245231169, 'atr_min_pct': 0.026654113157576445, 'atr_max_pct': 0.13736775365820142, 'tp_mult': 1.6292589653705616, 'tsl_mult': 0.924478615440274, 'strategy': 'breakout', 'time_stop': 232, 'use_sma': True, 'use_atr': True, 'use_adx': False, 'use_ema': False, 'use_spike': True, 'rsi_required': False, 'edge_k': 0.8066981328866457, 'edge_cap': 0.35371968530560344, 'bull_strategy': 'breakout', 'bull_bb_std_mult': 2.6396782981434184, 'bull_rsi_os': 33, 'bull_rsi_ob': 65, 'bull_adx_thresh': 16.090090643935056, 'bull_atr_min_pct': 0.003956097707922677, 'bull_atr_max_pct': 0.12643733785808509, 'bull_tp_mult': 1.1156833543156939, 'bull_tsl_mult': 0.11248694798266157, 'bull_time_stop': 192, 'bull_use_sma': False, 'bull_use_ema': True, 'bull_use_atr': True, 'bull_use_adx': True, 'bull_use_spike': False, 'bull_rsi_required': False, 'bear_strategy': 'mean_reversion', 'bear_bb_std_mult': 1.778632265751477, 'bear_rsi_os': 34, 'bear_rsi_ob': 58, 'bear_adx_thresh': 20.320423014340353, 'bear_atr_min_pct': 0.003741092567421546, 'bear_atr_max_pct': 0.040946760067017286, 'bear_tp_mult': 1.4747563418123166, 'bear_tsl_mult': 0.0460875929491229, 'bear_time_stop': 230, 'bear_use_sma': True, 'bear_use_ema': True, 'bear_use_atr': True, 'bear_use_adx': True, 'bear_use_spike': False, 'bear_rsi_required': True, 'sideways_strategy': 'breakout', 'sideways_bb_std_mult': 1.5931539586414136, 'sideways_rsi_os': 52, 'sideways_rsi_ob': 66, 'sideways_adx_thresh': 25.887774788660643, 'sideways_atr_min_pct': 0.018998073855849826, 'sideways_atr_max_pct': 0.04266991713787693, 'sideways_tp_mult': 2.7285136931353535, 'sideways_tsl_mult': 0.22237435991149374, 'sideways_time_stop': 267, 'sideways_use_sma': True, 'sideways_use_ema': True, 'sideways_use_atr': True, 'sideways_use_adx': False, 'sideways_use_spike': False, 'sideways_rsi_required': True}.
[I 2025-09-01 14:19:30,606] Trial 515 finished with values: [-1000000000.0, 1000000000.0] and parameters: {'p_sma': 34, 'p_std': 46, 'p_atr': 25, 'p_adx': 12, 'rsi_period': 9, 'ema1': 20, 'ema2': 32, 'slip_atr_k': 0.04747217886947527, 'slip_spread_k': 0.19012994684217793, 'spread_hl_frac': 0.042256533060077414, 'bb_std_mult': 1.746022040995455, 'rsi_os': 55, 'rsi_ob': 48, 'vol_spike': 0.24714119781104188, 'adx_thresh': 24.14151634803963, 'atr_min_pct': 0.026028842499004022, 'atr_max_pct': 0.1425093829427547, 'tp_mult': 1.1076883976195444, 'tsl_mult': 0.7743001638411015, 'strategy': 'breakout', 'time_stop': 236, 'use_sma': False, 'use_atr': True, 'use_adx': False, 'use_ema': False, 'use_spike': True, 'rsi_required': True, 'edge_k': 0.8723033547001827, 'edge_cap': 0.2935024282466543, 'bull_strategy': 'breakout', 'bull_bb_std_mult': 0.6412482754833275, 'bull_rsi_os': 34, 'bull_rsi_ob': 47, 'bull_adx_thresh': 16.06451136962705, 'bull_atr_min_pct': 0.003122439619473862, 'bull_atr_max_pct': 0.02103929110001004, 'bull_tp_mult': 1.612806904909633, 'bull_tsl_mult': 0.1195253396959699, 'bull_time_stop': 244, 'bull_use_sma': False, 'bull_use_ema': False, 'bull_use_atr': True, 'bull_use_adx': True, 'bull_use_spike': True, 'bull_rsi_required': False, 'bear_strategy': 'mean_reversion', 'bear_bb_std_mult': 3.5369418333399585, 'bear_rsi_os': 33, 'bear_rsi_ob': 89, 'bear_adx_thresh': 12.696755379217292, 'bear_atr_min_pct': 0.003300259832742283, 'bear_atr_max_pct': 0.1372791922288732, 'bear_tp_mult': 2.3537513025217844, 'bear_tsl_mult': 0.05208143969351911, 'bear_time_stop': 231, 'bear_use_sma': True, 'bear_use_ema': False, 'bear_use_atr': True, 'bear_use_adx': True, 'bear_use_spike': True, 'bear_rsi_required': True, 'sideways_strategy': 'mean_reversion', 'sideways_bb_std_mult': 2.04281353560573, 'sideways_rsi_os': 53, 'sideways_rsi_ob': 73, 'sideways_adx_thresh': 8.259226768157543, 'sideways_atr_min_pct': 0.011743202654475563, 'sideways_atr_max_pct': 0.13744968609835018, 'sideways_tp_mult': 2.672959638177021, 'sideways_tsl_mult': 0.29050346991628817, 'sideways_time_stop': 157, 'sideways_use_sma': True, 'sideways_use_ema': True, 'sideways_use_atr': False, 'sideways_use_adx': False, 'sideways_use_spike': True, 'sideways_rsi_required': False}.
[I 2025-09-01 14:19:31,406] Trial 518 finished with values: [-1000000000.0, 1000000000.0] and parameters: {'p_sma': 34, 'p_std': 57, 'p_atr': 25, 'p_adx': 29, 'rsi_period': 67, 'ema1': 21, 'ema2': 19, 'slip_atr_k': 0.013725455703439887, 'slip_spread_k': 0.001075073210048405, 'spread_hl_frac': 0.00774811473930414, 'bb_std_mult': 1.4394163902569133, 'rsi_os': 55, 'rsi_ob': 55, 'vol_spike': 0.24315629111380554, 'adx_thresh': 24.761689074683588, 'atr_min_pct': 0.025399897267717603, 'atr_max_pct': 0.01642790134788734, 'tp_mult': 1.2520901408713396, 'tsl_mult': 0.6463493712113574, 'strategy': 'mean_reversion', 'time_stop': 237, 'use_sma': False, 'use_atr': False, 'use_adx': False, 'use_ema': True, 'use_spike': True, 'rsi_required': False, 'edge_k': 0.10287585180815773, 'edge_cap': 0.3420477975391732, 'bull_strategy': 'breakout', 'bull_bb_std_mult': 0.6565565299726326, 'bull_rsi_os': 19, 'bull_rsi_ob': 53, 'bull_adx_thresh': 23.04687290452471, 'bull_atr_min_pct': 0.003032296585387324, 'bull_atr_max_pct': 0.020284437461723027, 'bull_tp_mult': 2.97384361170622, 'bull_tsl_mult': 0.549426553385287, 'bull_time_stop': 89, 'bull_use_sma': True, 'bull_use_ema': True, 'bull_use_atr': True, 'bull_use_adx': True, 'bull_use_spike': False, 'bull_rsi_required': True, 'bear_strategy': 'breakout', 'bear_bb_std_mult': 3.5981524306720765, 'bear_rsi_os': 33, 'bear_rsi_ob': 86, 'bear_adx_thresh': 10.465315602048321, 'bear_atr_min_pct': 0.005243160584393438, 'bear_atr_max_pct': 0.04504189087881763, 'bear_tp_mult': 1.3982293326451418, 'bear_tsl_mult': 0.1208531669036575, 'bear_time_stop': 219, 'bear_use_sma': True, 'bear_use_ema': True, 'bear_use_atr': True, 'bear_use_adx': True, 'bear_use_spike': True, 'bear_rsi_required': True, 'sideways_strategy': 'mean_reversion', 'sideways_bb_std_mult': 1.7590023499620608, 'sideways_rsi_os': 33, 'sideways_rsi_ob': 88, 'sideways_adx_thresh': 7.490373804215106, 'sideways_atr_min_pct': 0.02201320258824238, 'sideways_atr_max_pct': 0.14978551620183725, 'sideways_tp_mult': 2.661785099789311, 'sideways_tsl_mult': 0.7407803792340417, 'sideways_time_stop': 238, 'sideways_use_sma': True, 'sideways_use_ema': False, 'sideways_use_atr': False, 'sideways_use_adx': True, 'sideways_use_spike': False, 'sideways_rsi_required': True}.
[I 2025-09-01 14:19:31,421] Trial 517 finished with values: [-1000000000.0, 1000000000.0] and parameters: {'p_sma': 34, 'p_std': 46, 'p_atr': 25, 'p_adx': 13, 'rsi_period': 67, 'ema1': 17, 'ema2': 19, 'slip_atr_k': 0.014705446809182732, 'slip_spread_k': 0.08889935409974595, 'spread_hl_frac': 0.007781192576165395, 'bb_std_mult': 1.7645023917135194, 'rsi_os': 38, 'rsi_ob': 68, 'vol_spike': 0.14594162696623367, 'adx_thresh': 17.20329330687093, 'atr_min_pct': 0.02740158409076706, 'atr_max_pct': 0.017220221136797886, 'tp_mult': 1.0458293583522573, 'tsl_mult': 0.7670261016626874, 'strategy': 'mean_reversion', 'time_stop': 236, 'use_sma': False, 'use_atr': False, 'use_adx': False, 'use_ema': True, 'use_spike': True, 'rsi_required': False, 'edge_k': 0.7021849240800264, 'edge_cap': 0.6826133566697229, 'bull_strategy': 'breakout', 'bull_bb_std_mult': 3.3185422471750057, 'bull_rsi_os': 36, 'bull_rsi_ob': 53, 'bull_adx_thresh': 31.253317001436322, 'bull_atr_min_pct': 0.002977554863850982, 'bull_atr_max_pct': 0.01585003689842035, 'bull_tp_mult': 1.769131195105636, 'bull_tsl_mult': 0.5562839879329061, 'bull_time_stop': 203, 'bull_use_sma': True, 'bull_use_ema': True, 'bull_use_atr': True, 'bull_use_adx': True, 'bull_use_spike': False, 'bull_rsi_required': True, 'bear_strategy': 'breakout', 'bear_bb_std_mult': 3.5397608572313506, 'bear_rsi_os': 24, 'bear_rsi_ob': 86, 'bear_adx_thresh': 9.402760242420891, 'bear_atr_min_pct': 0.0018180259139923551, 'bear_atr_max_pct': 0.044800562300814424, 'bear_tp_mult': 2.341683877747353, 'bear_tsl_mult': 0.1858055806028407, 'bear_time_stop': 52, 'bear_use_sma': True, 'bear_use_ema': True, 'bear_use_atr': True, 'bear_use_adx': True, 'bear_use_spike': True, 'bear_rsi_required': True, 'sideways_strategy': 'mean_reversion', 'sideways_bb_std_mult': 2.017092225063838, 'sideways_rsi_os': 49, 'sideways_rsi_ob': 88, 'sideways_adx_thresh': 7.417826585598266, 'sideways_atr_min_pct': 0.02254589277591525, 'sideways_atr_max_pct': 0.06681137419103414, 'sideways_tp_mult': 2.6522010550998205, 'sideways_tsl_mult': 0.27659875407720386, 'sideways_time_stop': 190, 'sideways_use_sma': True, 'sideways_use_ema': False, 'sideways_use_atr': False, 'sideways_use_adx': True, 'sideways_use_spike': False, 'sideways_rsi_required': True}.
[I 2025-09-01 14:20:05,217] Trial 519 finished with values: [-1000000000.0, 1000000000.0] and parameters: {'p_sma': 38, 'p_std': 50, 'p_atr': 25, 'p_adx': 26, 'rsi_period': 66, 'ema1': 17, 'ema2': 19, 'slip_atr_k': 0.22810548078206844, 'slip_spread_k': 0.07791398554540813, 'spread_hl_frac': 0.007913080089268224, 'bb_std_mult': 2.9157915720086187, 'rsi_os': 38, 'rsi_ob': 54, 'vol_spike': 0.2651280048189643, 'adx_thresh': 6.394428155326688, 'atr_min_pct': 0.02735128128691318, 'atr_max_pct': 0.14021330347745278, 'tp_mult': 1.0492869649999534, 'tsl_mult': 0.7638323857815739, 'strategy': 'mean_reversion', 'time_stop': 140, 'use_sma': True, 'use_atr': False, 'use_adx': False, 'use_ema': True, 'use_spike': True, 'rsi_required': False, 'edge_k': 1.7711466943739334, 'edge_cap': 0.6835557775498422, 'bull_strategy': 'breakout', 'bull_bb_std_mult': 1.3757462934071665, 'bull_rsi_os': 23, 'bull_rsi_ob': 52, 'bull_adx_thresh': 31.239683424170586, 'bull_atr_min_pct': 0.00477551366519395, 'bull_atr_max_pct': 0.0442267620442268, 'bull_tp_mult': 2.9074563269049145, 'bull_tsl_mult': 0.7620148037408997, 'bull_time_stop': 88, 'bull_use_sma': True, 'bull_use_ema': True, 'bull_use_atr': True, 'bull_use_adx': True, 'bull_use_spike': False, 'bull_rsi_required': True, 'bear_strategy': 'breakout', 'bear_bb_std_mult': 2.544911195807146, 'bear_rsi_os': 24, 'bear_rsi_ob': 92, 'bear_adx_thresh': 19.150280804961866, 'bear_atr_min_pct': 0.0019105270217182097, 'bear_atr_max_pct': 0.11907563742889177, 'bear_tp_mult': 2.215913434502219, 'bear_tsl_mult': 0.11887186989020125, 'bear_time_stop': 183, 'bear_use_sma': True, 'bear_use_ema': True, 'bear_use_atr': True, 'bear_use_adx': True, 'bear_use_spike': False, 'bear_rsi_required': True, 'sideways_strategy': 'breakout', 'sideways_bb_std_mult': 1.4965940954051413, 'sideways_rsi_os': 49, 'sideways_rsi_ob': 68, 'sideways_adx_thresh': 7.486574800153575, 'sideways_atr_min_pct': 0.022165482339281724, 'sideways_atr_max_pct': 0.0775020115639339, 'sideways_tp_mult': 1.6656179906177546, 'sideways_tsl_mult': 0.2744037692351722, 'sideways_time_stop': 191, 'sideways_use_sma': True, 'sideways_use_ema': False, 'sideways_use_atr': True, 'sideways_use_adx': True, 'sideways_use_spike': False, 'sideways_rsi_required': True}.
[I 2025-09-01 14:20:05,567] Trial 516 finished with values: [-1000000000.0, 1000000000.0] and parameters: {'p_sma': 34, 'p_std': 50, 'p_atr': 25, 'p_adx': 12, 'rsi_period': 66, 'ema1': 21, 'ema2': 19, 'slip_atr_k': 0.23096506667419864, 'slip_spread_k': 0.08487807015369558, 'spread_hl_frac': 0.030485502050821005, 'bb_std_mult': 2.3521093049194617, 'rsi_os': 41, 'rsi_ob': 58, 'vol_spike': 0.24314736175357454, 'adx_thresh': 28.39384576328257, 'atr_min_pct': 0.02746896639039357, 'atr_max_pct': 0.14282580321004934, 'tp_mult': 1.2605095353131106, 'tsl_mult': 0.6198448833375946, 'strategy': 'breakout', 'time_stop': 140, 'use_sma': True, 'use_atr': False, 'use_adx': False, 'use_ema': False, 'use_spike': True, 'rsi_required': False, 'edge_k': 0.8580560995081109, 'edge_cap': 0.9405381005604969, 'bull_strategy': 'breakout', 'bull_bb_std_mult': 0.6281624753292705, 'bull_rsi_os': 36, 'bull_rsi_ob': 47, 'bull_adx_thresh': 29.98505441657987, 'bull_atr_min_pct': 0.0030872350430266645, 'bull_atr_max_pct': 0.05806698850671159, 'bull_tp_mult': 2.993267843112128, 'bull_tsl_mult': 0.40083414627462904, 'bull_time_stop': 103, 'bull_use_sma': True, 'bull_use_ema': True, 'bull_use_atr': True, 'bull_use_adx': True, 'bull_use_spike': False, 'bull_rsi_required': False, 'bear_strategy': 'mean_reversion', 'bear_bb_std_mult': 3.536990046263149, 'bear_rsi_os': 34, 'bear_rsi_ob': 86, 'bear_adx_thresh': 19.003540508117382, 'bear_atr_min_pct': 0.005279412980072678, 'bear_atr_max_pct': 0.04460091820696145, 'bear_tp_mult': 2.017469009128445, 'bear_tsl_mult': 0.1243634763869795, 'bear_time_stop': 230, 'bear_use_sma': True, 'bear_use_ema': True, 'bear_use_atr': True, 'bear_use_adx': True, 'bear_use_spike': False, 'bear_rsi_required': True, 'sideways_strategy': 'breakout', 'sideways_bb_std_mult': 1.475167777040717, 'sideways_rsi_os': 52, 'sideways_rsi_ob': 60, 'sideways_adx_thresh': 7.588755485738943, 'sideways_atr_min_pct': 0.01632622902303041, 'sideways_atr_max_pct': 0.042607455683156374, 'sideways_tp_mult': 2.6568336360544347, 'sideways_tsl_mult': 0.2856633611772966, 'sideways_time_stop': 55, 'sideways_use_sma': True, 'sideways_use_ema': False, 'sideways_use_atr': True, 'sideways_use_adx': False, 'sideways_use_spike': True, 'sideways_rsi_required': False}.
[I 2025-09-01 14:20:08,595] Trial 520 finished with values: [-1000000000.0, 1000000000.0] and parameters: {'p_sma': 38, 'p_std': 8, 'p_atr': 24, 'p_adx': 27, 'rsi_period': 82, 'ema1': 21, 'ema2': 18, 'slip_atr_k': 0.02068429346165906, 'slip_spread_k': 0.08487162847806237, 'spread_hl_frac': 0.004950846367936048, 'bb_std_mult': 0.5987455809546229, 'rsi_os': 38, 'rsi_ob': 61, 'vol_spike': 0.2624585237441978, 'adx_thresh': 25.33079965133731, 'atr_min_pct': 0.027453502776845884, 'atr_max_pct': 0.14441225141222105, 'tp_mult': 1.038782052161771, 'tsl_mult': 0.42897717658306034, 'strategy': 'mean_reversion', 'time_stop': 249, 'use_sma': True, 'use_atr': False, 'use_adx': False, 'use_ema': True, 'use_spike': True, 'rsi_required': False, 'edge_k': 1.3008319138908158, 'edge_cap': 0.41173266059859837, 'bull_strategy': 'mean_reversion', 'bull_bb_std_mult': 1.5312219578685706, 'bull_rsi_os': 36, 'bull_rsi_ob': 94, 'bull_adx_thresh': 31.338666195910417, 'bull_atr_min_pct': 0.004688986656070853, 'bull_atr_max_pct': 0.08199417909283546, 'bull_tp_mult': 1.4366140655174438, 'bull_tsl_mult': 0.3881804070601093, 'bull_time_stop': 227, 'bull_use_sma': True, 'bull_use_ema': True, 'bull_use_atr': True, 'bull_use_adx': True, 'bull_use_spike': False, 'bull_rsi_required': True, 'bear_strategy': 'breakout', 'bear_bb_std_mult': 2.7228899330522123, 'bear_rsi_os': 31, 'bear_rsi_ob': 63, 'bear_adx_thresh': 11.44169346801601, 'bear_atr_min_pct': 0.01818687177071367, 'bear_atr_max_pct': 0.04971488648786532, 'bear_tp_mult': 2.2082293158695947, 'bear_tsl_mult': 0.19033471568179128, 'bear_time_stop': 185, 'bear_use_sma': False, 'bear_use_ema': True, 'bear_use_atr': True, 'bear_use_adx': True, 'bear_use_spike': False, 'bear_rsi_required': True, 'sideways_strategy': 'breakout', 'sideways_bb_std_mult': 2.8223761842788053, 'sideways_rsi_os': 49, 'sideways_rsi_ob': 59, 'sideways_adx_thresh': 19.091208791534363, 'sideways_atr_min_pct': 0.024655516333356838, 'sideways_atr_max_pct': 0.06741622782601142, 'sideways_tp_mult': 2.7815960208383332, 'sideways_tsl_mult': 0.27874811033736874, 'sideways_time_stop': 222, 'sideways_use_sma': True, 'sideways_use_ema': False, 'sideways_use_atr': True, 'sideways_use_adx': True, 'sideways_use_spike': False, 'sideways_rsi_required': True}.
[I 2025-09-01 14:20:08,895] Trial 521 finished with values: [-1000000000.0, 1000000000.0] and parameters: {'p_sma': 38, 'p_std': 50, 'p_atr': 16, 'p_adx': 11, 'rsi_period': 65, 'ema1': 22, 'ema2': 18, 'slip_atr_k': 0.02169102805987526, 'slip_spread_k': 0.26615655571655283, 'spread_hl_frac': 0.0048062350453812915, 'bb_std_mult': 0.6278800393086004, 'rsi_os': 39, 'rsi_ob': 81, 'vol_spike': 0.26600540952804164, 'adx_thresh': 28.706508844606024, 'atr_min_pct': 0.027393334846438216, 'atr_max_pct': 0.14077492690698357, 'tp_mult': 1.3230859799537877, 'tsl_mult': 0.21114088044212675, 'strategy': 'mean_reversion', 'time_stop': 259, 'use_sma': True, 'use_atr': False, 'use_adx': True, 'use_ema': True, 'use_spike': True, 'rsi_required': False, 'edge_k': 0.17752583470277172, 'edge_cap': 0.8882658664868042, 'bull_strategy': 'mean_reversion', 'bull_bb_std_mult': 1.678340604872509, 'bull_rsi_os': 40, 'bull_rsi_ob': 54, 'bull_adx_thresh': 31.07810434896971, 'bull_atr_min_pct': 0.0049747818570464244, 'bull_atr_max_pct': 0.032357535319737715, 'bull_tp_mult': 2.5664824400901978, 'bull_tsl_mult': 0.39759833582546683, 'bull_time_stop': 102, 'bull_use_sma': True, 'bull_use_ema': True, 'bull_use_atr': False, 'bull_use_adx': True, 'bull_use_spike': False, 'bull_rsi_required': True, 'bear_strategy': 'breakout', 'bear_bb_std_mult': 1.292749039906751, 'bear_rsi_os': 31, 'bear_rsi_ob': 76, 'bear_adx_thresh': 11.289225146345334, 'bear_atr_min_pct': 0.004657986060805072, 'bear_atr_max_pct': 0.05846929002061841, 'bear_tp_mult': 1.8967163260673745, 'bear_tsl_mult': 0.14879938855764036, 'bear_time_stop': 208, 'bear_use_sma': False, 'bear_use_ema': True, 'bear_use_atr': False, 'bear_use_adx': False, 'bear_use_spike': False, 'bear_rsi_required': True, 'sideways_strategy': 'breakout', 'sideways_bb_std_mult': 1.4948824264229528, 'sideways_rsi_os': 50, 'sideways_rsi_ob': 59, 'sideways_adx_thresh': 9.882818537717625, 'sideways_atr_min_pct': 0.021321011343700787, 'sideways_atr_max_pct': 0.07843864982348361, 'sideways_tp_mult': 2.778734759290224, 'sideways_tsl_mult': 0.2468893275104385, 'sideways_time_stop': 179, 'sideways_use_sma': True, 'sideways_use_ema': False, 'sideways_use_atr': True, 'sideways_use_adx': True, 'sideways_use_spike': False, 'sideways_rsi_required': True}.
