[I 2025-09-01 14:52:22,865] Trial 735 finished with values: [-0.1020291206018954, 0.10163349055493663] and parameters: {'p_sma': 33, 'p_std': 45, 'p_atr': 8, 'p_adx': 28, 'rsi_period': 43, 'ema1': 21, 'ema2': 19, 'slip_atr_k': 0.060383882553617416, 'slip_spread_k': 0.030128531355745024, 'spread_hl_frac': 0.004951883659755719, 'bb_std_mult': 2.590281429605717, 'rsi_os': 40, 'rsi_ob': 84, 'vol_spike': 0.17220406976119115, 'adx_thresh': 25.350950216570364, 'atr_min_pct': 0.006035708918855418, 'atr_max_pct': 0.13590243454882578, 'tp_mult': 2.3233200579441915, 'tsl_mult': 0.2605614136624157, 'strategy': 'mean_reversion', 'time_stop': 244, 'use_sma': False, 'use_atr': False, 'use_adx': False, 'use_ema': True, 'use_spike': True, 'rsi_required': False, 'edge_k': 0.9664142253041401, 'edge_cap': 0.4129211717334834, 'bull_strategy': 'breakout', 'bull_bb_std_mult': 1.6502171987792777, 'bull_rsi_os': 52, 'bull_rsi_ob': 57, 'bull_adx_thresh': 23.764221965041592, 'bull_atr_min_pct': 0.00278650706614559, 'bull_atr_max_pct': 0.01885302072662532, 'bull_tp_mult': 2.032528920996352, 'bull_tsl_mult': 0.47254393970021114, 'bull_time_stop': 220, 'bull_use_sma': True, 'bull_use_ema': True, 'bull_use_atr': False, 'bull_use_adx': False, 'bull_use_spike': False, 'bull_rsi_required': True, 'bear_strategy': 'breakout', 'bear_bb_std_mult': 3.4917692868166132, 'bear_rsi_os': 52, 'bear_rsi_ob': 86, 'bear_adx_thresh': 19.943680706611264, 'bear_atr_min_pct': 0.0009803549854681057, 'bear_atr_max_pct': 0.12040498219528653, 'bear_tp_mult': 2.363819584665817, 'bear_tsl_mult': 0.1348704187953292, 'bear_time_stop': 70, 'bear_use_sma': True, 'bear_use_ema': True, 'bear_use_atr': True, 'bear_use_adx': True, 'bear_use_spike': False, 'bear_rsi_required': True, 'sideways_strategy': 'breakout', 'sideways_bb_std_mult': 1.5302123188922856, 'sideways_rsi_os': 49, 'sideways_rsi_ob': 67, 'sideways_adx_thresh': 6.431656074805058, 'sideways_atr_min_pct': 0.02123626804332755, 'sideways_atr_max_pct': 0.06327592324793074, 'sideways_tp_mult': 2.1029683074708387, 'sideways_tsl_mult': 0.29225378024818194, 'sideways_time_stop': 185, 'sideways_use_sma': True, 'sideways_use_ema': True, 'sideways_use_atr': True, 'sideways_use_adx': True, 'sideways_use_spike': False, 'sideways_rsi_required': True}.
[I 2025-09-01 14:52:23,898] Trial 739 finished with values: [-0.013577495201965606, 0.01402544552202946] and parameters: {'p_sma': 31, 'p_std': 46, 'p_atr': 12, 'p_adx': 23, 'rsi_period': 34, 'ema1': 21, 'ema2': 36, 'slip_atr_k': 0.01365708391885027, 'slip_spread_k': 0.27976473224452564, 'spread_hl_frac': 0.006473561222811286, 'bb_std_mult': 1.578468954939705, 'rsi_os': 40, 'rsi_ob': 67, 'vol_spike': 0.1384517948226097, 'adx_thresh': 24.291042231217904, 'atr_min_pct': 0.02760260314079969, 'atr_max_pct': 0.131379207293741, 'tp_mult': 1.1203188881172887, 'tsl_mult': 0.6161726681567483, 'strategy': 'mean_reversion', 'time_stop': 237, 'use_sma': False, 'use_atr': False, 'use_adx': False, 'use_ema': True, 'use_spike': True, 'rsi_required': False, 'edge_k': 1.4215650263806001, 'edge_cap': 0.7721319202419891, 'bull_strategy': 'breakout', 'bull_bb_std_mult': 3.2831382826484394, 'bull_rsi_os': 47, 'bull_rsi_ob': 55, 'bull_adx_thresh': 8.566567507259863, 'bull_atr_min_pct': 0.0027456094918961514, 'bull_atr_max_pct': 0.05340624893562919, 'bull_tp_mult': 2.3319063650746026, 'bull_tsl_mult': 0.4375121102073104, 'bull_time_stop': 126, 'bull_use_sma': True, 'bull_use_ema': True, 'bull_use_atr': False, 'bull_use_adx': True, 'bull_use_spike': True, 'bull_rsi_required': True, 'bear_strategy': 'breakout', 'bear_bb_std_mult': 3.0392846254847803, 'bear_rsi_os': 32, 'bear_rsi_ob': 89, 'bear_adx_thresh': 12.208817723681292, 'bear_atr_min_pct': 0.00499280466580634, 'bear_atr_max_pct': 0.040161838387369454, 'bear_tp_mult': 2.169470333857642, 'bear_tsl_mult': 0.10251873438810505, 'bear_time_stop': 5, 'bear_use_sma': True, 'bear_use_ema': True, 'bear_use_atr': True, 'bear_use_adx': True, 'bear_use_spike': False, 'bear_rsi_required': True, 'sideways_strategy': 'breakout', 'sideways_bb_std_mult': 1.5580844915903185, 'sideways_rsi_os': 41, 'sideways_rsi_ob': 74, 'sideways_adx_thresh': 26.83666184111699, 'sideways_atr_min_pct': 0.021188152811076378, 'sideways_atr_max_pct': 0.1281651830147813, 'sideways_tp_mult': 1.23378791770718, 'sideways_tsl_mult': 0.6955515639892571, 'sideways_time_stop': 158, 'sideways_use_sma': True, 'sideways_use_ema': True, 'sideways_use_atr': True, 'sideways_use_adx': False, 'sideways_use_spike': False, 'sideways_rsi_required': True}.
[I 2025-09-01 14:52:25,278] Trial 741 finished with values: [-1000000000.0, 1000000000.0] and parameters: {'p_sma': 22, 'p_std': 36, 'p_atr': 20, 'p_adx': 12, 'rsi_period': 15, 'ema1': 21, 'ema2': 12, 'slip_atr_k': 0.018067265604088344, 'slip_spread_k': 0.16216966313996983, 'spread_hl_frac': 0.039526355606631286, 'bb_std_mult': 1.570031125727103, 'rsi_os': 34, 'rsi_ob': 45, 'vol_spike': 0.13780222389939728, 'adx_thresh': 12.666898227504138, 'atr_min_pct': 0.01304690635197063, 'atr_max_pct': 0.13971392383948184, 'tp_mult': 1.7260951087291148, 'tsl_mult': 0.7674399920624881, 'strategy': 'mean_reversion', 'time_stop': 10, 'use_sma': True, 'use_atr': False, 'use_adx': False, 'use_ema': True, 'use_spike': False, 'rsi_required': False, 'edge_k': 0.8402842815098114, 'edge_cap': 0.42173868335420084, 'bull_strategy': 'breakout', 'bull_bb_std_mult': 3.0874167034002533, 'bull_rsi_os': 10, 'bull_rsi_ob': 73, 'bull_adx_thresh': 17.43030588422086, 'bull_atr_min_pct': 0.00257128641947904, 'bull_atr_max_pct': 0.0235197917293459, 'bull_tp_mult': 2.331939765763387, 'bull_tsl_mult': 0.4239411896826378, 'bull_time_stop': 275, 'bull_use_sma': True, 'bull_use_ema': True, 'bull_use_atr': True, 'bull_use_adx': True, 'bull_use_spike': False, 'bull_rsi_required': True, 'bear_strategy': 'breakout', 'bear_bb_std_mult': 2.7925917323854956, 'bear_rsi_os': 32, 'bear_rsi_ob': 87, 'bear_adx_thresh': 12.569682087305896, 'bear_atr_min_pct': 0.0038829120369780184, 'bear_atr_max_pct': 0.09080718038442213, 'bear_tp_mult': 2.0875162305766075, 'bear_tsl_mult': 0.10464956629025013, 'bear_time_stop': 221, 'bear_use_sma': True, 'bear_use_ema': False, 'bear_use_atr': True, 'bear_use_adx': True, 'bear_use_spike': False, 'bear_rsi_required': False, 'sideways_strategy': 'breakout', 'sideways_bb_std_mult': 2.237294088644643, 'sideways_rsi_os': 51, 'sideways_rsi_ob': 69, 'sideways_adx_thresh': 12.616475676836835, 'sideways_atr_min_pct': 0.0001429876201950002, 'sideways_atr_max_pct': 0.06654160763388213, 'sideways_tp_mult': 2.1110490134037594, 'sideways_tsl_mult': 0.6575943444090574, 'sideways_time_stop': 158, 'sideways_use_sma': False, 'sideways_use_ema': False, 'sideways_use_atr': True, 'sideways_use_adx': True, 'sideways_use_spike': False, 'sideways_rsi_required': False}.
[I 2025-09-01 14:52:25,333] Trial 743 finished with values: [-1000000000.0, 1000000000.0] and parameters: {'p_sma': 39, 'p_std': 11, 'p_atr': 25, 'p_adx': 8, 'rsi_period': 27, 'ema1': 20, 'ema2': 34, 'slip_atr_k': 0.019140407017181296, 'slip_spread_k': 0.28642606680180693, 'spread_hl_frac': 0.03813263373813978, 'bb_std_mult': 1.7070791495411917, 'rsi_os': 37, 'rsi_ob': 45, 'vol_spike': 0.22452884101830436, 'adx_thresh': 18.02309936609802, 'atr_min_pct': 0.02743624355496863, 'atr_max_pct': 0.10142935861222481, 'tp_mult': 1.177712597007926, 'tsl_mult': 0.6264707232209055, 'strategy': 'mean_reversion', 'time_stop': 155, 'use_sma': True, 'use_atr': False, 'use_adx': False, 'use_ema': True, 'use_spike': False, 'rsi_required': False, 'edge_k': 1.175485556905979, 'edge_cap': 0.20007710071522422, 'bull_strategy': 'breakout', 'bull_bb_std_mult': 3.2767353933279915, 'bull_rsi_os': 10, 'bull_rsi_ob': 81, 'bull_adx_thresh': 29.313257245233604, 'bull_atr_min_pct': 0.0034167547072661824, 'bull_atr_max_pct': 0.022497600509843656, 'bull_tp_mult': 1.1521641040134412, 'bull_tsl_mult': 0.4196071126501996, 'bull_time_stop': 99, 'bull_use_sma': True, 'bull_use_ema': True, 'bull_use_atr': True, 'bull_use_adx': True, 'bull_use_spike': True, 'bull_rsi_required': True, 'bear_strategy': 'breakout', 'bear_bb_std_mult': 3.5453004886996204, 'bear_rsi_os': 31, 'bear_rsi_ob': 89, 'bear_adx_thresh': 12.456033016216317, 'bear_atr_min_pct': 0.003959240661076869, 'bear_atr_max_pct': 0.0417870537111114, 'bear_tp_mult': 2.1761625329683225, 'bear_tsl_mult': 0.10313655789201845, 'bear_time_stop': 223, 'bear_use_sma': True, 'bear_use_ema': False, 'bear_use_atr': True, 'bear_use_adx': True, 'bear_use_spike': False, 'bear_rsi_required': False, 'sideways_strategy': 'breakout', 'sideways_bb_std_mult': 1.4804054836310006, 'sideways_rsi_os': 51, 'sideways_rsi_ob': 69, 'sideways_adx_thresh': 5.7432926876978465, 'sideways_atr_min_pct': 0.017407498053319072, 'sideways_atr_max_pct': 0.04147581402951469, 'sideways_tp_mult': 1.297807062488603, 'sideways_tsl_mult': 0.22001552355888526, 'sideways_time_stop': 160, 'sideways_use_sma': False, 'sideways_use_ema': False, 'sideways_use_atr': True, 'sideways_use_adx': False, 'sideways_use_spike': False, 'sideways_rsi_required': False}.
[I 2025-09-01 14:52:59,617] Trial 740 finished with values: [-0.02762261388595233, 0.02694635165683431] and parameters: {'p_sma': 31, 'p_std': 27, 'p_atr': 24, 'p_adx': 12, 'rsi_period': 15, 'ema1': 21, 'ema2': 17, 'slip_atr_k': 0.01762576949339582, 'slip_spread_k': 0.1553853323163673, 'spread_hl_frac': 0.004805944017688466, 'bb_std_mult': 1.7049111875269578, 'rsi_os': 37, 'rsi_ob': 81, 'vol_spike': 0.09148739490754139, 'adx_thresh': 24.910638804288634, 'atr_min_pct': 0.02777406309442533, 'atr_max_pct': 0.13071771302362362, 'tp_mult': 1.1612765189119942, 'tsl_mult': 0.6298012835429752, 'strategy': 'mean_reversion', 'time_stop': 260, 'use_sma': True, 'use_atr': False, 'use_adx': False, 'use_ema': True, 'use_spike': False, 'rsi_required': False, 'edge_k': 0.9490543894383681, 'edge_cap': 0.1946349234866111, 'bull_strategy': 'breakout', 'bull_bb_std_mult': 1.665005915553698, 'bull_rsi_os': 28, 'bull_rsi_ob': 47, 'bull_adx_thresh': 30.00488604540644, 'bull_atr_min_pct': 0.002624659888426073, 'bull_atr_max_pct': 0.02294209209704231, 'bull_tp_mult': 2.8293740886999403, 'bull_tsl_mult': 0.0016370977093607686, 'bull_time_stop': 278, 'bull_use_sma': True, 'bull_use_ema': True, 'bull_use_atr': True, 'bull_use_adx': True, 'bull_use_spike': False, 'bull_rsi_required': True, 'bear_strategy': 'breakout', 'bear_bb_std_mult': 3.5445115149217905, 'bear_rsi_os': 25, 'bear_rsi_ob': 63, 'bear_adx_thresh': 11.97185285160046, 'bear_atr_min_pct': 0.0037115155351136637, 'bear_atr_max_pct': 0.05288244549733793, 'bear_tp_mult': 2.1731067413550598, 'bear_tsl_mult': 0.09820293780676961, 'bear_time_stop': 223, 'bear_use_sma': True, 'bear_use_ema': False, 'bear_use_atr': True, 'bear_use_adx': True, 'bear_use_spike': False, 'bear_rsi_required': False, 'sideways_strategy': 'breakout', 'sideways_bb_std_mult': 1.4691477307211527, 'sideways_rsi_os': 54, 'sideways_rsi_ob': 70, 'sideways_adx_thresh': 5.726688286005249, 'sideways_atr_min_pct': 0.01959510036283422, 'sideways_atr_max_pct': 0.022899766941383827, 'sideways_tp_mult': 2.7440323964368707, 'sideways_tsl_mult': 0.6857043333978071, 'sideways_time_stop': 135, 'sideways_use_sma': False, 'sideways_use_ema': False, 'sideways_use_atr': True, 'sideways_use_adx': True, 'sideways_use_spike': False, 'sideways_rsi_required': False}.
[I 2025-09-01 14:53:00,278] Trial 742 finished with values: [-1000000000.0, 1000000000.0] and parameters: {'p_sma': 39, 'p_std': 48, 'p_atr': 24, 'p_adx': 12, 'rsi_period': 63, 'ema1': 20, 'ema2': 36, 'slip_atr_k': 0.21000637641610964, 'slip_spread_k': 0.14911429494414674, 'spread_hl_frac': 0.0061506654240495486, 'bb_std_mult': 1.7072143493745586, 'rsi_os': 33, 'rsi_ob': 61, 'vol_spike': 0.09228192049818852, 'adx_thresh': 24.39508092949149, 'atr_min_pct': 0.027744095227248935, 'atr_max_pct': 0.1311767487128676, 'tp_mult': 1.6757849283618071, 'tsl_mult': 0.3550890578374784, 'strategy': 'mean_reversion', 'time_stop': 144, 'use_sma': True, 'use_atr': False, 'use_adx': False, 'use_ema': True, 'use_spike': False, 'rsi_required': False, 'edge_k': 0.8502975768997195, 'edge_cap': 0.8131973469157787, 'bull_strategy': 'breakout', 'bull_bb_std_mult': 2.784115839827973, 'bull_rsi_os': 10, 'bull_rsi_ob': 81, 'bull_adx_thresh': 15.459155914827733, 'bull_atr_min_pct': 0.0033940831239915367, 'bull_atr_max_pct': 0.0730691301732123, 'bull_tp_mult': 1.6586705887855313, 'bull_tsl_mult': 0.43405937418585494, 'bull_time_stop': 291, 'bull_use_sma': True, 'bull_use_ema': True, 'bull_use_atr': True, 'bull_use_adx': True, 'bull_use_spike': True, 'bull_rsi_required': True, 'bear_strategy': 'breakout', 'bear_bb_std_mult': 3.5985137245700938, 'bear_rsi_os': 32, 'bear_rsi_ob': 48, 'bear_adx_thresh': 12.10894692040209, 'bear_atr_min_pct': 0.005786227690243541, 'bear_atr_max_pct': 0.052449530511250064, 'bear_tp_mult': 1.7568633244160874, 'bear_tsl_mult': 0.8423376311736529, 'bear_time_stop': 249, 'bear_use_sma': True, 'bear_use_ema': False, 'bear_use_atr': True, 'bear_use_adx': True, 'bear_use_spike': False, 'bear_rsi_required': False, 'sideways_strategy': 'breakout', 'sideways_bb_std_mult': 2.248266460592095, 'sideways_rsi_os': 54, 'sideways_rsi_ob': 71, 'sideways_adx_thresh': 8.342030522775035, 'sideways_atr_min_pct': 0.010700199299799248, 'sideways_atr_max_pct': 0.1399175612634564, 'sideways_tp_mult': 2.731203340157074, 'sideways_tsl_mult': 0.21971998656552882, 'sideways_time_stop': 159, 'sideways_use_sma': False, 'sideways_use_ema': False, 'sideways_use_atr': True, 'sideways_use_adx': False, 'sideways_use_spike': False, 'sideways_rsi_required': False}.
[I 2025-09-01 14:53:03,725] Trial 744 finished with values: [-0.06201190937937606, 0.06132465495035851] and parameters: {'p_sma': 60, 'p_std': 48, 'p_atr': 25, 'p_adx': 12, 'rsi_period': 34, 'ema1': 20, 'ema2': 17, 'slip_atr_k': 0.20795136728728736, 'slip_spread_k': 0.29742201775087673, 'spread_hl_frac': 0.007604664028875323, 'bb_std_mult': 2.110400362063025, 'rsi_os': 37, 'rsi_ob': 81, 'vol_spike': 0.22353148548424673, 'adx_thresh': 23.5275511879554, 'atr_min_pct': 0.027591955594890857, 'atr_max_pct': 0.13090385896863524, 'tp_mult': 1.0757891545424796, 'tsl_mult': 0.701813985967841, 'strategy': 'mean_reversion', 'time_stop': 172, 'use_sma': True, 'use_atr': False, 'use_adx': False, 'use_ema': True, 'use_spike': True, 'rsi_required': False, 'edge_k': 0.8932924126872801, 'edge_cap': 0.19302177765878564, 'bull_strategy': 'breakout', 'bull_bb_std_mult': 2.7733028491022, 'bull_rsi_os': 12, 'bull_rsi_ob': 71, 'bull_adx_thresh': 29.975078107440794, 'bull_atr_min_pct': 0.010718347438427585, 'bull_atr_max_pct': 0.021796829150136317, 'bull_tp_mult': 2.836670903949379, 'bull_tsl_mult': 0.6767221375681947, 'bull_time_stop': 123, 'bull_use_sma': True, 'bull_use_ema': True, 'bull_use_atr': True, 'bull_use_adx': True, 'bull_use_spike': True, 'bull_rsi_required': True, 'bear_strategy': 'breakout', 'bear_bb_std_mult': 1.009523462519425, 'bear_rsi_os': 31, 'bear_rsi_ob': 87, 'bear_adx_thresh': 12.0956578574355, 'bear_atr_min_pct': 6.147762878578721e-05, 'bear_atr_max_pct': 0.11426728724686468, 'bear_tp_mult': 2.167348631362522, 'bear_tsl_mult': 0.2612774022010934, 'bear_time_stop': 18, 'bear_use_sma': True, 'bear_use_ema': True, 'bear_use_atr': True, 'bear_use_adx': True, 'bear_use_spike': False, 'bear_rsi_required': True, 'sideways_strategy': 'breakout', 'sideways_bb_std_mult': 0.6357317834860565, 'sideways_rsi_os': 54, 'sideways_rsi_ob': 66, 'sideways_adx_thresh': 26.895608105666636, 'sideways_atr_min_pct': 0.019689387600914394, 'sideways_atr_max_pct': 0.0612091309516605, 'sideways_tp_mult': 1.0506007502344756, 'sideways_tsl_mult': 0.22354773973839046, 'sideways_time_stop': 292, 'sideways_use_sma': True, 'sideways_use_ema': False, 'sideways_use_atr': True, 'sideways_use_adx': False, 'sideways_use_spike': False, 'sideways_rsi_required': True}.
[I 2025-09-01 14:53:04,106] Trial 745 finished with values: [-1000000000.0, 1000000000.0] and parameters: {'p_sma': 37, 'p_std': 48, 'p_atr': 25, 'p_adx': 11, 'rsi_period': 63, 'ema1': 19, 'ema2': 47, 'slip_atr_k': 0.012887398043395415, 'slip_spread_k': 0.08380690092387588, 'spread_hl_frac': 0.007758264269611003, 'bb_std_mult': 1.710510803053272, 'rsi_os': 41, 'rsi_ob': 69, 'vol_spike': 0.2326400760388776, 'adx_thresh': 24.77045981961674, 'atr_min_pct': 0.025114670123441957, 'atr_max_pct': 0.08874785957360158, 'tp_mult': 1.5501572713465126, 'tsl_mult': 0.1371741568182132, 'strategy': 'mean_reversion', 'time_stop': 248, 'use_sma': True, 'use_atr': True, 'use_adx': False, 'use_ema': False, 'use_spike': True, 'rsi_required': False, 'edge_k': 0.8899120796355118, 'edge_cap': 0.3283107664607345, 'bull_strategy': 'breakout', 'bull_bb_std_mult': 2.7865909964093922, 'bull_rsi_os': 12, 'bull_rsi_ob': 54, 'bull_adx_thresh': 29.923496116938217, 'bull_atr_min_pct': 0.0039796840629749445, 'bull_atr_max_pct': 0.04503102267204597, 'bull_tp_mult': 1.6471958521458063, 'bull_tsl_mult': 0.6744120276891927, 'bull_time_stop': 130, 'bull_use_sma': False, 'bull_use_ema': False, 'bull_use_atr': True, 'bull_use_adx': True, 'bull_use_spike': False, 'bull_rsi_required': True, 'bear_strategy': 'breakout', 'bear_bb_std_mult': 3.597999009975362, 'bear_rsi_os': 25, 'bear_rsi_ob': 46, 'bear_adx_thresh': 11.994598690442603, 'bear_atr_min_pct': 0.005492145562160296, 'bear_atr_max_pct': 0.05478129743582119, 'bear_tp_mult': 1.0578379625766527, 'bear_tsl_mult': 0.18204216124657985, 'bear_time_stop': 215, 'bear_use_sma': True, 'bear_use_ema': True, 'bear_use_atr': False, 'bear_use_adx': True, 'bear_use_spike': False, 'bear_rsi_required': True, 'sideways_strategy': 'mean_reversion', 'sideways_bb_std_mult': 1.629757140264561, 'sideways_rsi_os': 54, 'sideways_rsi_ob': 74, 'sideways_adx_thresh': 27.332538094319688, 'sideways_atr_min_pct': 0.01043947149468305, 'sideways_atr_max_pct': 0.13054765267353322, 'sideways_tp_mult': 2.7161748077375756, 'sideways_tsl_mult': 0.04764142546092598, 'sideways_time_stop': 293, 'sideways_use_sma': True, 'sideways_use_ema': False, 'sideways_use_atr': True, 'sideways_use_adx': True, 'sideways_use_spike': False, 'sideways_rsi_required': True}.
[I 2025-09-01 14:53:44,464] Trial 746 finished with values: [-1000000000.0, 1000000000.0] and parameters: {'p_sma': 28, 'p_std': 47, 'p_atr': 25, 'p_adx': 21, 'rsi_period': 34, 'ema1': 19, 'ema2': 18, 'slip_atr_k': 0.08508619979916564, 'slip_spread_k': 0.07898235709293926, 'spread_hl_frac': 0.007796874437822513, 'bb_std_mult': 1.7566782045411313, 'rsi_os': 41, 'rsi_ob': 86, 'vol_spike': 0.28816269690574126, 'adx_thresh': 25.99366111203672, 'atr_min_pct': 0.024926820457805365, 'atr_max_pct': 0.13216429141401445, 'tp_mult': 1.0679041715431636, 'tsl_mult': 0.4621329813333653, 'strategy': 'mean_reversion', 'time_stop': 163, 'use_sma': True, 'use_atr': True, 'use_adx': False, 'use_ema': False, 'use_spike': True, 'rsi_required': False, 'edge_k': 1.4224641943529877, 'edge_cap': 0.318504141958179, 'bull_strategy': 'mean_reversion', 'bull_bb_std_mult': 3.3094587867350076, 'bull_rsi_os': 33, 'bull_rsi_ob': 66, 'bull_adx_thresh': 15.284041032932041, 'bull_atr_min_pct': 0.007097121385757079, 'bull_atr_max_pct': 0.053006180936982006, 'bull_tp_mult': 2.7693312335169313, 'bull_tsl_mult': 0.95083152146729, 'bull_time_stop': 201, 'bull_use_sma': False, 'bull_use_ema': False, 'bull_use_atr': True, 'bull_use_adx': True, 'bull_use_spike': True, 'bull_rsi_required': False, 'bear_strategy': 'breakout', 'bear_bb_std_mult': 2.025543040839042, 'bear_rsi_os': 34, 'bear_rsi_ob': 69, 'bear_adx_thresh': 27.448329385052684, 'bear_atr_min_pct': 0.005879540371226582, 'bear_atr_max_pct': 0.04989490690931638, 'bear_tp_mult': 2.2443317390143047, 'bear_tsl_mult': 0.7039283199470902, 'bear_time_stop': 51, 'bear_use_sma': False, 'bear_use_ema': True, 'bear_use_atr': False, 'bear_use_adx': True, 'bear_use_spike': True, 'bear_rsi_required': True, 'sideways_strategy': 'mean_reversion', 'sideways_bb_std_mult': 1.6599558578330174, 'sideways_rsi_os': 53, 'sideways_rsi_ob': 74, 'sideways_adx_thresh': 22.76901284997315, 'sideways_atr_min_pct': 0.010485739495566677, 'sideways_atr_max_pct': 0.06732051495053158, 'sideways_tp_mult': 1.0123277686163856, 'sideways_tsl_mult': 0.26305630823120796, 'sideways_time_stop': 171, 'sideways_use_sma': True, 'sideways_use_ema': False, 'sideways_use_atr': False, 'sideways_use_adx': False, 'sideways_use_spike': False, 'sideways_rsi_required': True}.
