[I 2025-09-01 13:45:50,278] Trial 277 finished with values: [-1000000000.0, 1000000000.0] and parameters: {'p_sma': 7, 'p_std': 48, 'p_atr': 23, 'p_adx': 29, 'rsi_period': 27, 'ema1': 21, 'ema2': 18, 'slip_atr_k': 0.021644341386240856, 'slip_spread_k': 0.030487271879194464, 'spread_hl_frac': 0.00787878512583805, 'bb_std_mult': 1.8605389142534892, 'rsi_os': 39, 'rsi_ob': 79, 'vol_spike': 0.23320758161787097, 'adx_thresh': 25.641073173041192, 'atr_min_pct': 0.02449499167505708, 'atr_max_pct': 0.13502351403022905, 'tp_mult': 1.044962600582653, 'tsl_mult': 0.7439806849359605, 'strategy': 'mean_reversion', 'time_stop': 43, 'use_sma': False, 'use_atr': False, 'use_adx': False, 'use_ema': False, 'use_spike': True, 'rsi_required': False, 'edge_k': 0.9193208331764202, 'edge_cap': 0.3377481321380228, 'bull_strategy': 'breakout', 'bull_bb_std_mult': 0.5551915319748877, 'bull_rsi_os': 34, 'bull_rsi_ob': 54, 'bull_adx_thresh': 32.381240996839274, 'bull_atr_min_pct': 0.0032078133133400643, 'bull_atr_max_pct': 0.13675827600849866, 'bull_tp_mult': 2.71160333023729, 'bull_tsl_mult': 0.45196295370076917, 'bull_time_stop': 100, 'bull_use_sma': True, 'bull_use_ema': True, 'bull_use_atr': False, 'bull_use_adx': False, 'bull_use_spike': False, 'bull_rsi_required': True, 'bear_strategy': 'breakout', 'bear_bb_std_mult': 3.59484156967398, 'bear_rsi_os': 39, 'bear_rsi_ob': 56, 'bear_adx_thresh': 22.75393962309311, 'bear_atr_min_pct': 0.003448019997711139, 'bear_atr_max_pct': 0.04626248360690794, 'bear_tp_mult': 1.270964443434214, 'bear_tsl_mult': 0.8383335135586278, 'bear_time_stop': 222, 'bear_use_sma': False, 'bear_use_ema': True, 'bear_use_atr': True, 'bear_use_adx': False, 'bear_use_spike': False, 'bear_rsi_required': True, 'sideways_strategy': 'breakout', 'sideways_bb_std_mult': 1.4917425760467125, 'sideways_rsi_os': 39, 'sideways_rsi_ob': 70, 'sideways_adx_thresh': 6.485036476789063, 'sideways_atr_min_pct': 0.020713632468994225, 'sideways_atr_max_pct': 0.07117550367938666, 'sideways_tp_mult': 2.7434348221416176, 'sideways_tsl_mult': 0.7273088093297442, 'sideways_time_stop': 167, 'sideways_use_sma': True, 'sideways_use_ema': False, 'sideways_use_atr': True, 'sideways_use_adx': True, 'sideways_use_spike': True, 'sideways_rsi_required': False}.
[I 2025-09-01 13:46:30,188] Trial 283 finished with values: [-1000000000.0, 1000000000.0] and parameters: {'p_sma': 36, 'p_std': 49, 'p_atr': 26, 'p_adx': 13, 'rsi_period': 66, 'ema1': 23, 'ema2': 16, 'slip_atr_k': 0.004734754345879288, 'slip_spread_k': 0.10771809349014694, 'spread_hl_frac': 0.03630555481543407, 'bb_std_mult': 1.6515647610008755, 'rsi_os': 37, 'rsi_ob': 83, 'vol_spike': 0.24518879767211188, 'adx_thresh': 24.622193375702324, 'atr_min_pct': 0.02582478455416422, 'atr_max_pct': 0.13762483348602125, 'tp_mult': 1.083655015940089, 'tsl_mult': 0.7469090088783914, 'strategy': 'mean_reversion', 'time_stop': 227, 'use_sma': True, 'use_atr': False, 'use_adx': False, 'use_ema': True, 'use_spike': True, 'rsi_required': False, 'edge_k': 0.8379651676854337, 'edge_cap': 0.37178250744276886, 'bull_strategy': 'breakout', 'bull_bb_std_mult': 1.6746779154410933, 'bull_rsi_os': 35, 'bull_rsi_ob': 79, 'bull_adx_thresh': 27.714300994471323, 'bull_atr_min_pct': 0.015198667679550287, 'bull_atr_max_pct': 0.02065246532601789, 'bull_tp_mult': 2.7580538459015065, 'bull_tsl_mult': 0.5618159335419324, 'bull_time_stop': 95, 'bull_use_sma': False, 'bull_use_ema': True, 'bull_use_atr': True, 'bull_use_adx': True, 'bull_use_spike': True, 'bull_rsi_required': True, 'bear_strategy': 'breakout', 'bear_bb_std_mult': 3.4661419614550564, 'bear_rsi_os': 35, 'bear_rsi_ob': 63, 'bear_adx_thresh': 28.77502664867564, 'bear_atr_min_pct': 0.009614023568836998, 'bear_atr_max_pct': 0.04941631394402075, 'bear_tp_mult': 2.2951104124851107, 'bear_tsl_mult': 0.9257016630567398, 'bear_time_stop': 230, 'bear_use_sma': True, 'bear_use_ema': True, 'bear_use_atr': False, 'bear_use_adx': True, 'bear_use_spike': False, 'bear_rsi_required': True, 'sideways_strategy': 'breakout', 'sideways_bb_std_mult': 1.355012179505823, 'sideways_rsi_os': 11, 'sideways_rsi_ob': 66, 'sideways_adx_thresh': 5.5947922544259745, 'sideways_atr_min_pct': 0.018858822094295687, 'sideways_atr_max_pct': 0.06629243034063188, 'sideways_tp_mult': 2.685040677668129, 'sideways_tsl_mult': 0.8864600007718311, 'sideways_time_stop': 182, 'sideways_use_sma': True, 'sideways_use_ema': False, 'sideways_use_atr': True, 'sideways_use_adx': True, 'sideways_use_spike': False, 'sideways_rsi_required': True}.
[I 2025-09-01 13:46:30,586] Trial 280 finished with values: [-0.03560146964301203, 0.03677412013556481] and parameters: {'p_sma': 36, 'p_std': 5, 'p_atr': 25, 'p_adx': 13, 'rsi_period': 64, 'ema1': 25, 'ema2': 16, 'slip_atr_k': 0.02701557944146543, 'slip_spread_k': 0.03685654849872683, 'spread_hl_frac': 0.005282120688950558, 'bb_std_mult': 1.8594355043097837, 'rsi_os': 37, 'rsi_ob': 83, 'vol_spike': 0.23256425915828105, 'adx_thresh': 25.460971646289856, 'atr_min_pct': 0.02579612618121007, 'atr_max_pct': 0.13490542846248443, 'tp_mult': 1.0543626169400944, 'tsl_mult': 0.7442908001095729, 'strategy': 'mean_reversion', 'time_stop': 242, 'use_sma': False, 'use_atr': False, 'use_adx': False, 'use_ema': False, 'use_spike': True, 'rsi_required': False, 'edge_k': 0.8448464568734825, 'edge_cap': 0.363388845894575, 'bull_strategy': 'breakout', 'bull_bb_std_mult': 0.5535384299572192, 'bull_rsi_os': 33, 'bull_rsi_ob': 54, 'bull_adx_thresh': 30.426265734156836, 'bull_atr_min_pct': 0.005939329144189641, 'bull_atr_max_pct': 0.025321898446274554, 'bull_tp_mult': 2.7080711887669877, 'bull_tsl_mult': 0.4730747445033881, 'bull_time_stop': 84, 'bull_use_sma': True, 'bull_use_ema': True, 'bull_use_atr': False, 'bull_use_adx': True, 'bull_use_spike': False, 'bull_rsi_required': True, 'bear_strategy': 'breakout', 'bear_bb_std_mult': 3.4708750994530853, 'bear_rsi_os': 35, 'bear_rsi_ob': 79, 'bear_adx_thresh': 13.791404768383185, 'bear_atr_min_pct': 0.0021250518830940026, 'bear_atr_max_pct': 0.047961064175440264, 'bear_tp_mult': 2.313527511705769, 'bear_tsl_mult': 0.1397854827533254, 'bear_time_stop': 300, 'bear_use_sma': False, 'bear_use_ema': True, 'bear_use_atr': True, 'bear_use_adx': True, 'bear_use_spike': False, 'bear_rsi_required': True, 'sideways_strategy': 'breakout', 'sideways_bb_std_mult': 1.5366549461836465, 'sideways_rsi_os': 51, 'sideways_rsi_ob': 65, 'sideways_adx_thresh': 6.414807070641612, 'sideways_atr_min_pct': 0.01920851550677357, 'sideways_atr_max_pct': 0.06509835526856417, 'sideways_tp_mult': 1.3693692613801738, 'sideways_tsl_mult': 0.24722839304947128, 'sideways_time_stop': 167, 'sideways_use_sma': True, 'sideways_use_ema': False, 'sideways_use_atr': True, 'sideways_use_adx': True, 'sideways_use_spike': False, 'sideways_rsi_required': False}.
[I 2025-09-01 13:46:30,841] Trial 282 finished with values: [-0.038586859950433205, 0.03853377721372723] and parameters: {'p_sma': 36, 'p_std': 49, 'p_atr': 26, 'p_adx': 13, 'rsi_period': 39, 'ema1': 23, 'ema2': 16, 'slip_atr_k': 0.026929085818412843, 'slip_spread_k': 0.10610637868553127, 'spread_hl_frac': 0.005487514577218222, 'bb_std_mult': 1.6657232601536016, 'rsi_os': 14, 'rsi_ob': 83, 'vol_spike': 0.24652433061952136, 'adx_thresh': 24.777993215925175, 'atr_min_pct': 0.008695868278436903, 'atr_max_pct': 0.13723102751967953, 'tp_mult': 1.092942918780138, 'tsl_mult': 0.74975995980376, 'strategy': 'mean_reversion', 'time_stop': 161, 'use_sma': True, 'use_atr': False, 'use_adx': False, 'use_ema': True, 'use_spike': True, 'rsi_required': False, 'edge_k': 0.8333587396300667, 'edge_cap': 0.37116867012877147, 'bull_strategy': 'breakout', 'bull_bb_std_mult': 1.3345933439049258, 'bull_rsi_os': 33, 'bull_rsi_ob': 69, 'bull_adx_thresh': 33.23166460500012, 'bull_atr_min_pct': 0.018489179506767296, 'bull_atr_max_pct': 0.03218973031030671, 'bull_tp_mult': 2.7704851919387203, 'bull_tsl_mult': 0.5645252462424035, 'bull_time_stop': 95, 'bull_use_sma': False, 'bull_use_ema': True, 'bull_use_atr': True, 'bull_use_adx': True, 'bull_use_spike': True, 'bull_rsi_required': True, 'bear_strategy': 'breakout', 'bear_bb_std_mult': 3.464147332753751, 'bear_rsi_os': 35, 'bear_rsi_ob': 92, 'bear_adx_thresh': 7.662932759408358, 'bear_atr_min_pct': 0.002202248771448014, 'bear_atr_max_pct': 0.05015852383216971, 'bear_tp_mult': 2.298497113049392, 'bear_tsl_mult': 0.6807453848679892, 'bear_time_stop': 205, 'bear_use_sma': True, 'bear_use_ema': True, 'bear_use_atr': False, 'bear_use_adx': True, 'bear_use_spike': False, 'bear_rsi_required': True, 'sideways_strategy': 'breakout', 'sideways_bb_std_mult': 1.5894990521640784, 'sideways_rsi_os': 10, 'sideways_rsi_ob': 65, 'sideways_adx_thresh': 5.602509199462113, 'sideways_atr_min_pct': 0.002041895704918771, 'sideways_atr_max_pct': 0.06539441329079693, 'sideways_tp_mult': 2.6793260291230063, 'sideways_tsl_mult': 0.3165411288857035, 'sideways_time_stop': 178, 'sideways_use_sma': True, 'sideways_use_ema': False, 'sideways_use_atr': True, 'sideways_use_adx': True, 'sideways_use_spike': False, 'sideways_rsi_required': True}.
[I 2025-09-01 13:46:31,070] Trial 281 finished with values: [-1000000000.0, 1000000000.0] and parameters: {'p_sma': 36, 'p_std': 49, 'p_atr': 26, 'p_adx': 30, 'rsi_period': 66, 'ema1': 20, 'ema2': 33, 'slip_atr_k': 0.1665537999747359, 'slip_spread_k': 0.0832475796758924, 'spread_hl_frac': 0.019408291537450578, 'bb_std_mult': 1.6648990177540193, 'rsi_os': 13, 'rsi_ob': 83, 'vol_spike': 0.24501478390177422, 'adx_thresh': 25.08269098647066, 'atr_min_pct': 0.02600918400549853, 'atr_max_pct': 0.13750106310072713, 'tp_mult': 1.0902549525771805, 'tsl_mult': 0.7520238110196481, 'strategy': 'mean_reversion', 'time_stop': 227, 'use_sma': True, 'use_atr': False, 'use_adx': False, 'use_ema': True, 'use_spike': True, 'rsi_required': False, 'edge_k': 0.8401948870144345, 'edge_cap': 0.36576753831726483, 'bull_strategy': 'breakout', 'bull_bb_std_mult': 3.348699146792227, 'bull_rsi_os': 35, 'bull_rsi_ob': 74, 'bull_adx_thresh': 33.285863650006206, 'bull_atr_min_pct': 0.0267626143850149, 'bull_atr_max_pct': 0.021160924565923195, 'bull_tp_mult': 2.766480140374961, 'bull_tsl_mult': 0.5083218911065496, 'bull_time_stop': 83, 'bull_use_sma': False, 'bull_use_ema': True, 'bull_use_atr': True, 'bull_use_adx': True, 'bull_use_spike': True, 'bull_rsi_required': True, 'bear_strategy': 'breakout', 'bear_bb_std_mult': 3.4731689102341887, 'bear_rsi_os': 35, 'bear_rsi_ob': 63, 'bear_adx_thresh': 11.215083094021994, 'bear_atr_min_pct': 0.010790225388777774, 'bear_atr_max_pct': 0.050365004251321184, 'bear_tp_mult': 2.860679559354185, 'bear_tsl_mult': 0.13253820817053621, 'bear_time_stop': 46, 'bear_use_sma': True, 'bear_use_ema': True, 'bear_use_atr': False, 'bear_use_adx': True, 'bear_use_spike': False, 'bear_rsi_required': True, 'sideways_strategy': 'breakout', 'sideways_bb_std_mult': 1.3898562783686002, 'sideways_rsi_os': 6, 'sideways_rsi_ob': 65, 'sideways_adx_thresh': 5.536240093420678, 'sideways_atr_min_pct': 0.01911643424819988, 'sideways_atr_max_pct': 0.07683046549896498, 'sideways_tp_mult': 1.358714628595524, 'sideways_tsl_mult': 0.6936291625573172, 'sideways_time_stop': 183, 'sideways_use_sma': True, 'sideways_use_ema': False, 'sideways_use_atr': True, 'sideways_use_adx': True, 'sideways_use_spike': False, 'sideways_rsi_required': True}.
[I 2025-09-01 13:47:08,058] Trial 286 finished with values: [-1000000000.0, 1000000000.0] and parameters: {'p_sma': 34, 'p_std': 48, 'p_atr': 27, 'p_adx': 25, 'rsi_period': 62, 'ema1': 8, 'ema2': 27, 'slip_atr_k': 0.20169682025518776, 'slip_spread_k': 0.08052984268944209, 'spread_hl_frac': 0.006986843947390015, 'bb_std_mult': 1.2599754848875404, 'rsi_os': 47, 'rsi_ob': 74, 'vol_spike': 0.13242717302360507, 'adx_thresh': 23.814010392541533, 'atr_min_pct': 0.026917152091601785, 'atr_max_pct': 0.14243052831608177, 'tp_mult': 1.092748876786668, 'tsl_mult': 0.7130519536464363, 'strategy': 'mean_reversion', 'time_stop': 35, 'use_sma': True, 'use_atr': False, 'use_adx': True, 'use_ema': True, 'use_spike': True, 'rsi_required': False, 'edge_k': 0.8004749940684166, 'edge_cap': 0.30110143969191583, 'bull_strategy': 'mean_reversion', 'bull_bb_std_mult': 3.1632680660010015, 'bull_rsi_os': 35, 'bull_rsi_ob': 52, 'bull_adx_thresh': 30.875904161602957, 'bull_atr_min_pct': 0.003990057461253077, 'bull_atr_max_pct': 0.09171669080533257, 'bull_tp_mult': 2.845908900776183, 'bull_tsl_mult': 0.42497658637343494, 'bull_time_stop': 86, 'bull_use_sma': True, 'bull_use_ema': True, 'bull_use_atr': True, 'bull_use_adx': True, 'bull_use_spike': False, 'bull_rsi_required': False, 'bear_strategy': 'breakout', 'bear_bb_std_mult': 2.6639678905330477, 'bear_rsi_os': 33, 'bear_rsi_ob': 89, 'bear_adx_thresh': 11.496658114156629, 'bear_atr_min_pct': 0.003048747935397231, 'bear_atr_max_pct': 0.03919127138404382, 'bear_tp_mult': 2.2192562639318014, 'bear_tsl_mult': 0.11453078492994172, 'bear_time_stop': 22, 'bear_use_sma': True, 'bear_use_ema': True, 'bear_use_atr': True, 'bear_use_adx': True, 'bear_use_spike': True, 'bear_rsi_required': True, 'sideways_strategy': 'breakout', 'sideways_bb_std_mult': 1.75272747089434, 'sideways_rsi_os': 52, 'sideways_rsi_ob': 67, 'sideways_adx_thresh': 7.487441799304797, 'sideways_atr_min_pct': 0.01996432839389464, 'sideways_atr_max_pct': 0.05985758804169387, 'sideways_tp_mult': 1.8664418303657901, 'sideways_tsl_mult': 0.6982698283525348, 'sideways_time_stop': 173, 'sideways_use_sma': True, 'sideways_use_ema': False, 'sideways_use_atr': False, 'sideways_use_adx': True, 'sideways_use_spike': False, 'sideways_rsi_required': True}.
[I 2025-09-01 13:47:08,816] Trial 287 finished with values: [-1000000000.0, 1000000000.0] and parameters: {'p_sma': 34, 'p_std': 21, 'p_atr': 24, 'p_adx': 12, 'rsi_period': 68, 'ema1': 20, 'ema2': 10, 'slip_atr_k': 0.009644918517052981, 'slip_spread_k': 0.06175221091417305, 'spread_hl_frac': 0.007234326386737978, 'bb_std_mult': 3.0985266857729292, 'rsi_os': 10, 'rsi_ob': 80, 'vol_spike': 0.16832036533834224, 'adx_thresh': 25.79505026403573, 'atr_min_pct': 0.027069326715552025, 'atr_max_pct': 0.14265465775637215, 'tp_mult': 2.0623431114417072, 'tsl_mult': 0.7116755176786697, 'strategy': 'mean_reversion', 'time_stop': 236, 'use_sma': True, 'use_atr': False, 'use_adx': True, 'use_ema': True, 'use_spike': True, 'rsi_required': False, 'edge_k': 0.8807266293214522, 'edge_cap': 0.3001581937109368, 'bull_strategy': 'mean_reversion', 'bull_bb_std_mult': 2.100451929388285, 'bull_rsi_os': 37, 'bull_rsi_ob': 56, 'bull_adx_thresh': 30.79037950620003, 'bull_atr_min_pct': 0.02894681896967146, 'bull_atr_max_pct': 0.03410660975565881, 'bull_tp_mult': 2.862282691692723, 'bull_tsl_mult': 0.4260532347727708, 'bull_time_stop': 222, 'bull_use_sma': True, 'bull_use_ema': False, 'bull_use_atr': True, 'bull_use_adx': True, 'bull_use_spike': False, 'bull_rsi_required': False, 'bear_strategy': 'breakout', 'bear_bb_std_mult': 3.53782205570283, 'bear_rsi_os': 33, 'bear_rsi_ob': 84, 'bear_adx_thresh': 23.691457589700388, 'bear_atr_min_pct': 0.0029206184130797317, 'bear_atr_max_pct': 0.03810702409586446, 'bear_tp_mult': 1.8796409031720434, 'bear_tsl_mult': 0.11426725441491281, 'bear_time_stop': 36, 'bear_use_sma': True, 'bear_use_ema': True, 'bear_use_atr': True, 'bear_use_adx': True, 'bear_use_spike': True, 'bear_rsi_required': True, 'sideways_strategy': 'breakout', 'sideways_bb_std_mult': 1.1823645254990924, 'sideways_rsi_os': 52, 'sideways_rsi_ob': 68, 'sideways_adx_thresh': 7.542896207493139, 'sideways_atr_min_pct': 0.020071240490338427, 'sideways_atr_max_pct': 0.05986766711169749, 'sideways_tp_mult': 2.4229993893328787, 'sideways_tsl_mult': 0.7590769694954465, 'sideways_time_stop': 172, 'sideways_use_sma': True, 'sideways_use_ema': False, 'sideways_use_atr': False, 'sideways_use_adx': True, 'sideways_use_spike': False, 'sideways_rsi_required': True}.
[I 2025-09-01 13:47:09,059] Trial 285 finished with values: [-1000000000.0, 1000000000.0] and parameters: {'p_sma': 37, 'p_std': 21, 'p_atr': 25, 'p_adx': 12, 'rsi_period': 37, 'ema1': 20, 'ema2': 27, 'slip_atr_k': 0.008811181085102432, 'slip_spread_k': 0.0802976305107106, 'spread_hl_frac': 0.007033603692013164, 'bb_std_mult': 1.7261100372496256, 'rsi_os': 39, 'rsi_ob': 80, 'vol_spike': 0.13542118999955358, 'adx_thresh': 25.852997409695433, 'atr_min_pct': 0.026400046411406055, 'atr_max_pct': 0.1428492816694041, 'tp_mult': 1.15785637760418, 'tsl_mult': 0.7123961759529862, 'strategy': 'mean_reversion', 'time_stop': 300, 'use_sma': True, 'use_atr': False, 'use_adx': True, 'use_ema': True, 'use_spike': True, 'rsi_required': False, 'edge_k': 1.3313950653745992, 'edge_cap': 0.3026423158662321, 'bull_strategy': 'mean_reversion', 'bull_bb_std_mult': 2.1017989776004686, 'bull_rsi_os': 37, 'bull_rsi_ob': 52, 'bull_adx_thresh': 34.45509631485475, 'bull_atr_min_pct': 0.004129577793221878, 'bull_atr_max_pct': 0.09247274856315205, 'bull_tp_mult': 1.3357048483904104, 'bull_tsl_mult': 0.43476948638804735, 'bull_time_stop': 78, 'bull_use_sma': True, 'bull_use_ema': True, 'bull_use_atr': True, 'bull_use_adx': True, 'bull_use_spike': False, 'bull_rsi_required': False, 'bear_strategy': 'breakout', 'bear_bb_std_mult': 3.5299586136588452, 'bear_rsi_os': 33, 'bear_rsi_ob': 89, 'bear_adx_thresh': 11.726510114621423, 'bear_atr_min_pct': 0.010856197537571048, 'bear_atr_max_pct': 0.03987944959825471, 'bear_tp_mult': 1.6193056469137557, 'bear_tsl_mult': 0.7525427595220822, 'bear_time_stop': 35, 'bear_use_sma': True, 'bear_use_ema': True, 'bear_use_atr': True, 'bear_use_adx': True, 'bear_use_spike': True, 'bear_rsi_required': True, 'sideways_strategy': 'breakout', 'sideways_bb_std_mult': 3.1909821256684676, 'sideways_rsi_os': 52, 'sideways_rsi_ob': 67, 'sideways_adx_thresh': 7.549467197098563, 'sideways_atr_min_pct': 0.019480439092261107, 'sideways_atr_max_pct': 0.07580057435302999, 'sideways_tp_mult': 2.436261621098238, 'sideways_tsl_mult': 0.2892245509289376, 'sideways_time_stop': 217, 'sideways_use_sma': True, 'sideways_use_ema': False, 'sideways_use_atr': False, 'sideways_use_adx': True, 'sideways_use_spike': False, 'sideways_rsi_required': True}.
[I 2025-09-01 13:47:09,362] Trial 284 finished with values: [-0.07216956012554165, 0.07169567339720986] and parameters: {'p_sma': 10, 'p_std': 48, 'p_atr': 25, 'p_adx': 12, 'rsi_period': 9, 'ema1': 20, 'ema2': 33, 'slip_atr_k': 0.20366371712967038, 'slip_spread_k': 0.08462743470995254, 'spread_hl_frac': 0.005322707985167318, 'bb_std_mult': 1.7091885291053144, 'rsi_os': 26, 'rsi_ob': 86, 'vol_spike': 0.11620159596010415, 'adx_thresh': 25.608605062645605, 'atr_min_pct': 0.021433418888831216, 'atr_max_pct': 0.1426648454873684, 'tp_mult': 1.9287164023962333, 'tsl_mult': 0.7121661036755038, 'strategy': 'mean_reversion', 'time_stop': 249, 'use_sma': True, 'use_atr': False, 'use_adx': False, 'use_ema': True, 'use_spike': True, 'rsi_required': False, 'edge_k': 0.8049635019415308, 'edge_cap': 0.30746651046471557, 'bull_strategy': 'breakout', 'bull_bb_std_mult': 3.156301508211353, 'bull_rsi_os': 37, 'bull_rsi_ob': 56, 'bull_adx_thresh': 30.780002566395154, 'bull_atr_min_pct': 0.018430317075247563, 'bull_atr_max_pct': 0.0331372798368202, 'bull_tp_mult': 2.8430969365955443, 'bull_tsl_mult': 0.01520751512966767, 'bull_time_stop': 84, 'bull_use_sma': True, 'bull_use_ema': True, 'bull_use_atr': True, 'bull_use_adx': True, 'bull_use_spike': False, 'bull_rsi_required': False, 'bear_strategy': 'breakout', 'bear_bb_std_mult': 3.474963890515949, 'bear_rsi_os': 32, 'bear_rsi_ob': 92, 'bear_adx_thresh': 5.454169422921588, 'bear_atr_min_pct': 0.001865723662134427, 'bear_atr_max_pct': 0.038477153646622776, 'bear_tp_mult': 1.6075581943556467, 'bear_tsl_mult': 0.14782606601990586, 'bear_time_stop': 209, 'bear_use_sma': True, 'bear_use_ema': True, 'bear_use_atr': True, 'bear_use_adx': True, 'bear_use_spike': False, 'bear_rsi_required': True, 'sideways_strategy': 'breakout', 'sideways_bb_std_mult': 1.5833822406618911, 'sideways_rsi_os': 21, 'sideways_rsi_ob': 65, 'sideways_adx_thresh': 7.3430966329710206, 'sideways_atr_min_pct': 0.022142059698932272, 'sideways_atr_max_pct': 0.07660284023443482, 'sideways_tp_mult': 1.5319940031713932, 'sideways_tsl_mult': 0.8156301247308988, 'sideways_time_stop': 110, 'sideways_use_sma': True, 'sideways_use_ema': False, 'sideways_use_atr': True, 'sideways_use_adx': True, 'sideways_use_spike': False, 'sideways_rsi_required': True}.
