[I 2025-09-01 13:43:11,139] Trial 260 finished with values: [-1000000000.0, 1000000000.0] and parameters: {'p_sma': 13, 'p_std': 29, 'p_atr': 25, 'p_adx': 11, 'rsi_period': 64, 'ema1': 10, 'ema2': 23, 'slip_atr_k': 0.016982089235908118, 'slip_spread_k': 0.12535008063432074, 'spread_hl_frac': 0.034344202481164085, 'bb_std_mult': 2.610063590951471, 'rsi_os': 33, 'rsi_ob': 84, 'vol_spike': 0.048080300984466195, 'adx_thresh': 26.830560889498933, 'atr_min_pct': 0.0252754162735609, 'atr_max_pct': 0.1438413918472868, 'tp_mult': 1.0820101779131455, 'tsl_mult': 0.7732236583337073, 'strategy': 'mean_reversion', 'time_stop': 240, 'use_sma': False, 'use_atr': False, 'use_adx': True, 'use_ema': True, 'use_spike': True, 'rsi_required': False, 'edge_k': 0.8835514059798524, 'edge_cap': 0.36651803447557396, 'bull_strategy': 'mean_reversion', 'bull_bb_std_mult': 3.1497037311245486, 'bull_rsi_os': 38, 'bull_rsi_ob': 77, 'bull_adx_thresh': 34.057785186728644, 'bull_atr_min_pct': 0.004907089394761666, 'bull_atr_max_pct': 0.024065748013916678, 'bull_tp_mult': 2.850045506671086, 'bull_tsl_mult': 0.42965205784464533, 'bull_time_stop': 134, 'bull_use_sma': True, 'bull_use_ema': True, 'bull_use_atr': True, 'bull_use_adx': True, 'bull_use_spike': False, 'bull_rsi_required': True, 'bear_strategy': 'breakout', 'bear_bb_std_mult': 3.3786007864620773, 'bear_rsi_os': 33, 'bear_rsi_ob': 87, 'bear_adx_thresh': 12.081630021573773, 'bear_atr_min_pct': 0.0025203697839574213, 'bear_atr_max_pct': 0.04986517386345027, 'bear_tp_mult': 2.1800541145218006, 'bear_tsl_mult': 0.09681967879730871, 'bear_time_stop': 223, 'bear_use_sma': False, 'bear_use_ema': True, 'bear_use_atr': True, 'bear_use_adx': False, 'bear_use_spike': False, 'bear_rsi_required': True, 'sideways_strategy': 'breakout', 'sideways_bb_std_mult': 1.511679675096184, 'sideways_rsi_os': 51, 'sideways_rsi_ob': 69, 'sideways_adx_thresh': 8.024315466585655, 'sideways_atr_min_pct': 0.020494132567538157, 'sideways_atr_max_pct': 0.07378573125120773, 'sideways_tp_mult': 2.8043255108338236, 'sideways_tsl_mult': 0.2406754953388705, 'sideways_time_stop': 175, 'sideways_use_sma': True, 'sideways_use_ema': False, 'sideways_use_atr': True, 'sideways_use_adx': True, 'sideways_use_spike': True, 'sideways_rsi_required': True}.
[I 2025-09-01 13:43:11,140] Trial 262 finished with values: [-0.030974016212639066, 0.030631511755588668] and parameters: {'p_sma': 11, 'p_std': 48, 'p_atr': 25, 'p_adx': 11, 'rsi_period': 67, 'ema1': 5, 'ema2': 11, 'slip_atr_k': 0.0186877837644605, 'slip_spread_k': 0.057698212062619714, 'spread_hl_frac': 0.039410597104391036, 'bb_std_mult': 1.793123464773103, 'rsi_os': 11, 'rsi_ob': 83, 'vol_spike': 0.04170747090028673, 'adx_thresh': 27.286908619168315, 'atr_min_pct': 0.02494417887310344, 'atr_max_pct': 0.12551886866732348, 'tp_mult': 1.0733002377555785, 'tsl_mult': 0.7565114055146858, 'strategy': 'mean_reversion', 'time_stop': 171, 'use_sma': False, 'use_atr': False, 'use_adx': True, 'use_ema': True, 'use_spike': True, 'rsi_required': False, 'edge_k': 0.8741945159718159, 'edge_cap': 0.32681358572545194, 'bull_strategy': 'mean_reversion', 'bull_bb_std_mult': 3.362510569116529, 'bull_rsi_os': 37, 'bull_rsi_ob': 65, 'bull_adx_thresh': 25.592651928018814, 'bull_atr_min_pct': 0.0036948396363860295, 'bull_atr_max_pct': 0.10754656357772983, 'bull_tp_mult': 2.8547009858827797, 'bull_tsl_mult': 0.6288000976567635, 'bull_time_stop': 248, 'bull_use_sma': False, 'bull_use_ema': True, 'bull_use_atr': True, 'bull_use_adx': True, 'bull_use_spike': False, 'bull_rsi_required': True, 'bear_strategy': 'breakout', 'bear_bb_std_mult': 3.5965255647804386, 'bear_rsi_os': 48, 'bear_rsi_ob': 87, 'bear_adx_thresh': 11.918248412301402, 'bear_atr_min_pct': 0.002239988978456755, 'bear_atr_max_pct': 0.06041398515796929, 'bear_tp_mult': 2.1755026642847533, 'bear_tsl_mult': 0.09538785488594781, 'bear_time_stop': 215, 'bear_use_sma': False, 'bear_use_ema': True, 'bear_use_atr': True, 'bear_use_adx': False, 'bear_use_spike': False, 'bear_rsi_required': True, 'sideways_strategy': 'breakout', 'sideways_bb_std_mult': 1.3932645374486685, 'sideways_rsi_os': 50, 'sideways_rsi_ob': 67, 'sideways_adx_thresh': 28.578749104201815, 'sideways_atr_min_pct': 0.020272216843471826, 'sideways_atr_max_pct': 0.07069703843776506, 'sideways_tp_mult': 2.777663071234429, 'sideways_tsl_mult': 0.23270995424213972, 'sideways_time_stop': 174, 'sideways_use_sma': True, 'sideways_use_ema': False, 'sideways_use_atr': True, 'sideways_use_adx': True, 'sideways_use_spike': True, 'sideways_rsi_required': True}.
[I 2025-09-01 13:43:49,555] Trial 265 finished with values: [-0.04756872507543808, 0.04657750736874013] and parameters: {'p_sma': 38, 'p_std': 24, 'p_atr': 24, 'p_adx': 12, 'rsi_period': 41, 'ema1': 21, 'ema2': 28, 'slip_atr_k': 0.06350297228402468, 'slip_spread_k': 0.019089759144139413, 'spread_hl_frac': 0.0216953853146895, 'bb_std_mult': 2.7386959600962504, 'rsi_os': 44, 'rsi_ob': 81, 'vol_spike': 0.23659660483451128, 'adx_thresh': 24.510089491243285, 'atr_min_pct': 0.026815169261914774, 'atr_max_pct': 0.1348008318891284, 'tp_mult': 1.1687854613860813, 'tsl_mult': 0.73059144348291, 'strategy': 'mean_reversion', 'time_stop': 243, 'use_sma': True, 'use_atr': False, 'use_adx': False, 'use_ema': False, 'use_spike': True, 'rsi_required': False, 'edge_k': 1.0365517838829283, 'edge_cap': 0.47788433682515763, 'bull_strategy': 'breakout', 'bull_bb_std_mult': 3.289072040888044, 'bull_rsi_os': 31, 'bull_rsi_ob': 53, 'bull_adx_thresh': 30.35559237030037, 'bull_atr_min_pct': 0.0036715613922304467, 'bull_atr_max_pct': 0.048191277832958054, 'bull_tp_mult': 2.914234330281185, 'bull_tsl_mult': 0.46452075515092534, 'bull_time_stop': 111, 'bull_use_sma': False, 'bull_use_ema': True, 'bull_use_atr': False, 'bull_use_adx': False, 'bull_use_spike': True, 'bull_rsi_required': True, 'bear_strategy': 'breakout', 'bear_bb_std_mult': 3.4466893714498066, 'bear_rsi_os': 35, 'bear_rsi_ob': 48, 'bear_adx_thresh': 11.537480365716517, 'bear_atr_min_pct': 0.0030733742501988215, 'bear_atr_max_pct': 0.06728342293443083, 'bear_tp_mult': 1.3632554108781103, 'bear_tsl_mult': 0.12468182054942678, 'bear_time_stop': 219, 'bear_use_sma': True, 'bear_use_ema': True, 'bear_use_atr': True, 'bear_use_adx': True, 'bear_use_spike': True, 'bear_rsi_required': True, 'sideways_strategy': 'breakout', 'sideways_bb_std_mult': 1.7172291652477996, 'sideways_rsi_os': 54, 'sideways_rsi_ob': 64, 'sideways_adx_thresh': 26.382909871676297, 'sideways_atr_min_pct': 0.019540165424395198, 'sideways_atr_max_pct': 0.061236758777344795, 'sideways_tp_mult': 2.6477930104330785, 'sideways_tsl_mult': 0.27893351851736337, 'sideways_time_stop': 165, 'sideways_use_sma': True, 'sideways_use_ema': False, 'sideways_use_atr': False, 'sideways_use_adx': True, 'sideways_use_spike': False, 'sideways_rsi_required': False}.
[I 2025-09-01 13:43:50,858] Trial 264 finished with values: [-1000000000.0, 1000000000.0] and parameters: {'p_sma': 15, 'p_std': 24, 'p_atr': 24, 'p_adx': 12, 'rsi_period': 67, 'ema1': 21, 'ema2': 25, 'slip_atr_k': 0.23325148159926545, 'slip_spread_k': 0.011641504130962432, 'spread_hl_frac': 0.032007731606096, 'bb_std_mult': 1.5905260486401813, 'rsi_os': 31, 'rsi_ob': 81, 'vol_spike': 0.2296139371460849, 'adx_thresh': 24.327105960042307, 'atr_min_pct': 0.029274058763437596, 'atr_max_pct': 0.14781533006400333, 'tp_mult': 1.1962972798615645, 'tsl_mult': 0.7215925477124159, 'strategy': 'mean_reversion', 'time_stop': 192, 'use_sma': True, 'use_atr': False, 'use_adx': False, 'use_ema': False, 'use_spike': True, 'rsi_required': False, 'edge_k': 0.7645622186608916, 'edge_cap': 0.30864776726018783, 'bull_strategy': 'breakout', 'bull_bb_std_mult': 3.2659167048020508, 'bull_rsi_os': 34, 'bull_rsi_ob': 53, 'bull_adx_thresh': 32.63575276934435, 'bull_atr_min_pct': 0.0036823237099097104, 'bull_atr_max_pct': 0.027538689593698346, 'bull_tp_mult': 2.8099647641514607, 'bull_tsl_mult': 0.22481786664935755, 'bull_time_stop': 110, 'bull_use_sma': False, 'bull_use_ema': True, 'bull_use_atr': False, 'bull_use_adx': False, 'bull_use_spike': True, 'bull_rsi_required': True, 'bear_strategy': 'breakout', 'bear_bb_std_mult': 3.445599245736353, 'bear_rsi_os': 35, 'bear_rsi_ob': 88, 'bear_adx_thresh': 13.578794628725424, 'bear_atr_min_pct': 0.0030232599289343695, 'bear_atr_max_pct': 0.05772562703949283, 'bear_tp_mult': 2.0974488459889296, 'bear_tsl_mult': 0.6541999810208909, 'bear_time_stop': 218, 'bear_use_sma': True, 'bear_use_ema': True, 'bear_use_atr': True, 'bear_use_adx': True, 'bear_use_spike': True, 'bear_rsi_required': True, 'sideways_strategy': 'breakout', 'sideways_bb_std_mult': 1.7112982037398812, 'sideways_rsi_os': 54, 'sideways_rsi_ob': 64, 'sideways_adx_thresh': 5.09220392673854, 'sideways_atr_min_pct': 0.01943996725165007, 'sideways_atr_max_pct': 0.0689153873438612, 'sideways_tp_mult': 2.6495217576454007, 'sideways_tsl_mult': 0.2753124644944457, 'sideways_time_stop': 180, 'sideways_use_sma': True, 'sideways_use_ema': False, 'sideways_use_atr': False, 'sideways_use_adx': True, 'sideways_use_spike': False, 'sideways_rsi_required': False}.
[I 2025-09-01 13:43:51,285] Trial 266 finished with values: [-0.05509218183682496, 0.055077735023988536] and parameters: {'p_sma': 38, 'p_std': 37, 'p_atr': 24, 'p_adx': 12, 'rsi_period': 34, 'ema1': 21, 'ema2': 28, 'slip_atr_k': 8.204073242520926e-05, 'slip_spread_k': 0.07660971833447805, 'spread_hl_frac': 0.006631103552929958, 'bb_std_mult': 1.5839675471647927, 'rsi_os': 35, 'rsi_ob': 81, 'vol_spike': 0.22731890314638092, 'adx_thresh': 24.599609265876975, 'atr_min_pct': 0.029098698682082633, 'atr_max_pct': 0.14852451980835835, 'tp_mult': 1.1848213526977827, 'tsl_mult': 0.7219383574920738, 'strategy': 'mean_reversion', 'time_stop': 147, 'use_sma': True, 'use_atr': False, 'use_adx': False, 'use_ema': False, 'use_spike': True, 'rsi_required': False, 'edge_k': 1.023764834946334, 'edge_cap': 0.3102607384532242, 'bull_strategy': 'breakout', 'bull_bb_std_mult': 3.2609838151184, 'bull_rsi_os': 31, 'bull_rsi_ob': 87, 'bull_adx_thresh': 30.233128278609342, 'bull_atr_min_pct': 0.0038071403465166345, 'bull_atr_max_pct': 0.07363159722491125, 'bull_tp_mult': 2.9094483900164696, 'bull_tsl_mult': 0.9562106269758813, 'bull_time_stop': 112, 'bull_use_sma': False, 'bull_use_ema': True, 'bull_use_atr': False, 'bull_use_adx': False, 'bull_use_spike': True, 'bull_rsi_required': True, 'bear_strategy': 'breakout', 'bear_bb_std_mult': 3.4562528259204837, 'bear_rsi_os': 51, 'bear_rsi_ob': 53, 'bear_adx_thresh': 30.69726536247378, 'bear_atr_min_pct': 0.002739849650965183, 'bear_atr_max_pct': 0.042042776788493476, 'bear_tp_mult': 2.091139824498567, 'bear_tsl_mult': 0.3485841832983516, 'bear_time_stop': 210, 'bear_use_sma': True, 'bear_use_ema': True, 'bear_use_atr': True, 'bear_use_adx': True, 'bear_use_spike': True, 'bear_rsi_required': True, 'sideways_strategy': 'breakout', 'sideways_bb_std_mult': 1.3169013566973455, 'sideways_rsi_os': 53, 'sideways_rsi_ob': 64, 'sideways_adx_thresh': 26.531282280718372, 'sideways_atr_min_pct': 0.01929456889927743, 'sideways_atr_max_pct': 0.06819646704245406, 'sideways_tp_mult': 2.720945296103921, 'sideways_tsl_mult': 0.2841494727666245, 'sideways_time_stop': 164, 'sideways_use_sma': True, 'sideways_use_ema': False, 'sideways_use_atr': False, 'sideways_use_adx': True, 'sideways_use_spike': False, 'sideways_rsi_required': False}.
[I 2025-09-01 13:43:51,958] Trial 263 finished with values: [-1000000000.0, 1000000000.0] and parameters: {'p_sma': 14, 'p_std': 24, 'p_atr': 24, 'p_adx': 11, 'rsi_period': 67, 'ema1': 10, 'ema2': 11, 'slip_atr_k': 0.2092196790844165, 'slip_spread_k': 0.057254693993580304, 'spread_hl_frac': 0.03849309942173647, 'bb_std_mult': 1.5973533904213248, 'rsi_os': 40, 'rsi_ob': 81, 'vol_spike': 0.2863467074757341, 'adx_thresh': 23.32627301895355, 'atr_min_pct': 0.025176071814182212, 'atr_max_pct': 0.12481097319239831, 'tp_mult': 1.070563475956096, 'tsl_mult': 0.7650663890106937, 'strategy': 'mean_reversion', 'time_stop': 169, 'use_sma': False, 'use_atr': False, 'use_adx': True, 'use_ema': True, 'use_spike': True, 'rsi_required': False, 'edge_k': 0.748575181837037, 'edge_cap': 0.32402901235878, 'bull_strategy': 'breakout', 'bull_bb_std_mult': 2.0317056677638723, 'bull_rsi_os': 37, 'bull_rsi_ob': 86, 'bull_adx_thresh': 29.732173795701105, 'bull_atr_min_pct': 0.005123285950683287, 'bull_atr_max_pct': 0.07379872320655062, 'bull_tp_mult': 2.817947950141117, 'bull_tsl_mult': 0.4089177184159356, 'bull_time_stop': 209, 'bull_use_sma': False, 'bull_use_ema': True, 'bull_use_atr': True, 'bull_use_adx': True, 'bull_use_spike': True, 'bull_rsi_required': True, 'bear_strategy': 'breakout', 'bear_bb_std_mult': 3.4159079457154577, 'bear_rsi_os': 32, 'bear_rsi_ob': 87, 'bear_adx_thresh': 11.88917671148121, 'bear_atr_min_pct': 0.0026379181977391167, 'bear_atr_max_pct': 0.06075100006936965, 'bear_tp_mult': 2.3142284532163346, 'bear_tsl_mult': 0.11812074941656639, 'bear_time_stop': 214, 'bear_use_sma': False, 'bear_use_ema': True, 'bear_use_atr': True, 'bear_use_adx': False, 'bear_use_spike': False, 'bear_rsi_required': True, 'sideways_strategy': 'breakout', 'sideways_bb_std_mult': 1.4077615567224635, 'sideways_rsi_os': 50, 'sideways_rsi_ob': 67, 'sideways_adx_thresh': 5.962132797190195, 'sideways_atr_min_pct': 0.018292898993901557, 'sideways_atr_max_pct': 0.07388448593256515, 'sideways_tp_mult': 2.7994185541728625, 'sideways_tsl_mult': 0.28286155160646154, 'sideways_time_stop': 176, 'sideways_use_sma': True, 'sideways_use_ema': False, 'sideways_use_atr': True, 'sideways_use_adx': True, 'sideways_use_spike': True, 'sideways_rsi_required': True}.
[I 2025-09-01 13:44:29,652] Trial 269 finished with values: [-0.01861304327826352, 0.019365394235811656] and parameters: {'p_sma': 37, 'p_std': 5, 'p_atr': 24, 'p_adx': 12, 'rsi_period': 67, 'ema1': 22, 'ema2': 18, 'slip_atr_k': 0.01168036892294604, 'slip_spread_k': 0.0844615194467431, 'spread_hl_frac': 0.00854041635832195, 'bb_std_mult': 1.7507226992997849, 'rsi_os': 40, 'rsi_ob': 82, 'vol_spike': 0.15534762188353973, 'adx_thresh': 26.331917263154235, 'atr_min_pct': 0.027754720521725663, 'atr_max_pct': 0.1406726103043295, 'tp_mult': 1.1287027713379583, 'tsl_mult': 0.806748019516389, 'strategy': 'mean_reversion', 'time_stop': 184, 'use_sma': True, 'use_atr': False, 'use_adx': False, 'use_ema': True, 'use_spike': True, 'rsi_required': False, 'edge_k': 0.9604966627296863, 'edge_cap': 0.34076086229320873, 'bull_strategy': 'breakout', 'bull_bb_std_mult': 2.0283913756448633, 'bull_rsi_os': 36, 'bull_rsi_ob': 55, 'bull_adx_thresh': 33.17505160196381, 'bull_atr_min_pct': 0.004747160947722916, 'bull_atr_max_pct': 0.02135703484326181, 'bull_tp_mult': 2.805368940245421, 'bull_tsl_mult': 0.9976991360302127, 'bull_time_stop': 102, 'bull_use_sma': True, 'bull_use_ema': True, 'bull_use_atr': True, 'bull_use_adx': True, 'bull_use_spike': False, 'bull_rsi_required': True, 'bear_strategy': 'breakout', 'bear_bb_std_mult': 3.331603545814776, 'bear_rsi_os': 32, 'bear_rsi_ob': 62, 'bear_adx_thresh': 34.17806545911603, 'bear_atr_min_pct': 0.0013401271325916694, 'bear_atr_max_pct': 0.039769495697279666, 'bear_tp_mult': 1.173799850163801, 'bear_tsl_mult': 0.1651110042884827, 'bear_time_stop': 213, 'bear_use_sma': True, 'bear_use_ema': True, 'bear_use_atr': True, 'bear_use_adx': True, 'bear_use_spike': False, 'bear_rsi_required': True, 'sideways_strategy': 'breakout', 'sideways_bb_std_mult': 1.4190805965643654, 'sideways_rsi_os': 52, 'sideways_rsi_ob': 68, 'sideways_adx_thresh': 6.975917034695838, 'sideways_atr_min_pct': 0.018659720408439804, 'sideways_atr_max_pct': 0.05741453925493074, 'sideways_tp_mult': 2.7400737493935057, 'sideways_tsl_mult': 0.3112417771732886, 'sideways_time_stop': 195, 'sideways_use_sma': True, 'sideways_use_ema': False, 'sideways_use_atr': True, 'sideways_use_adx': True, 'sideways_use_spike': False, 'sideways_rsi_required': True}.
[I 2025-09-01 13:44:30,257] Trial 268 finished with values: [-1000000000.0, 1000000000.0] and parameters: {'p_sma': 39, 'p_std': 11, 'p_atr': 24, 'p_adx': 12, 'rsi_period': 22, 'ema1': 22, 'ema2': 18, 'slip_atr_k': 0.002971374630197629, 'slip_spread_k': 0.08057304138718578, 'spread_hl_frac': 0.006673086578788191, 'bb_std_mult': 2.3076415667104677, 'rsi_os': 42, 'rsi_ob': 82, 'vol_spike': 0.15649269950484918, 'adx_thresh': 26.252653005963506, 'atr_min_pct': 0.023048630216219643, 'atr_max_pct': 0.12020896310184347, 'tp_mult': 1.1291106217134241, 'tsl_mult': 0.7955182325749923, 'strategy': 'mean_reversion', 'time_stop': 143, 'use_sma': True, 'use_atr': False, 'use_adx': False, 'use_ema': True, 'use_spike': True, 'rsi_required': False, 'edge_k': 0.9626321581153461, 'edge_cap': 0.34281086149913165, 'bull_strategy': 'breakout', 'bull_bb_std_mult': 1.0017350094461899, 'bull_rsi_os': 36, 'bull_rsi_ob': 55, 'bull_adx_thresh': 28.20441340374849, 'bull_atr_min_pct': 0.005067531439524135, 'bull_atr_max_pct': 0.030541779362713913, 'bull_tp_mult': 2.8123398590306348, 'bull_tsl_mult': 0.4070804639523607, 'bull_time_stop': 232, 'bull_use_sma': True, 'bull_use_ema': True, 'bull_use_atr': True, 'bull_use_adx': True, 'bull_use_spike': False, 'bull_rsi_required': True, 'bear_strategy': 'breakout', 'bear_bb_std_mult': 3.504469489538423, 'bear_rsi_os': 32, 'bear_rsi_ob': 90, 'bear_adx_thresh': 12.70351044806585, 'bear_atr_min_pct': 0.02888157881938572, 'bear_atr_max_pct': 0.0288246056179509, 'bear_tp_mult': 2.2685733985222187, 'bear_tsl_mult': 0.3453918536813132, 'bear_time_stop': 90, 'bear_use_sma': True, 'bear_use_ema': True, 'bear_use_atr': True, 'bear_use_adx': True, 'bear_use_spike': False, 'bear_rsi_required': True, 'sideways_strategy': 'breakout', 'sideways_bb_std_mult': 1.6345463923155048, 'sideways_rsi_os': 52, 'sideways_rsi_ob': 68, 'sideways_adx_thresh': 6.817055212845001, 'sideways_atr_min_pct': 0.018206996319136155, 'sideways_atr_max_pct': 0.06785529254243153, 'sideways_tp_mult': 1.2882778233893553, 'sideways_tsl_mult': 0.3065730264980514, 'sideways_time_stop': 194, 'sideways_use_sma': True, 'sideways_use_ema': False, 'sideways_use_atr': True, 'sideways_use_adx': True, 'sideways_use_spike': False, 'sideways_rsi_required': True}.
[I 2025-09-01 13:44:30,257] Trial 267 finished with values: [-0.032851878699297066, 0.0326356706621146] and parameters: {'p_sma': 39, 'p_std': 50, 'p_atr': 24, 'p_adx': 12, 'rsi_period': 49, 'ema1': 22, 'ema2': 26, 'slip_atr_k': 0.23247208717216436, 'slip_spread_k': 0.08103622291954801, 'spread_hl_frac': 0.0065820798358115695, 'bb_std_mult': 1.5994208385394522, 'rsi_os': 42, 'rsi_ob': 81, 'vol_spike': 0.22546566042553462, 'adx_thresh': 26.084634051070676, 'atr_min_pct': 0.029572018638050188, 'atr_max_pct': 0.14165989782632707, 'tp_mult': 1.1535500050952543, 'tsl_mult': 0.7204132597530477, 'strategy': 'mean_reversion', 'time_stop': 247, 'use_sma': True, 'use_atr': False, 'use_adx': False, 'use_ema': True, 'use_spike': True, 'rsi_required': False, 'edge_k': 0.755468053666788, 'edge_cap': 0.9986135698432714, 'bull_strategy': 'breakout', 'bull_bb_std_mult': 3.254673394165194, 'bull_rsi_os': 34, 'bull_rsi_ob': 85, 'bull_adx_thresh': 24.75937852883804, 'bull_atr_min_pct': 0.003671037515155178, 'bull_atr_max_pct': 0.02872058447085878, 'bull_tp_mult': 2.812921770621962, 'bull_tsl_mult': 0.273577113896409, 'bull_time_stop': 230, 'bull_use_sma': True, 'bull_use_ema': True, 'bull_use_atr': True, 'bull_use_adx': True, 'bull_use_spike': True, 'bull_rsi_required': True, 'bear_strategy': 'breakout', 'bear_bb_std_mult': 3.3415768830156223, 'bear_rsi_os': 32, 'bear_rsi_ob': 90, 'bear_adx_thresh': 30.70363812684458, 'bear_atr_min_pct': 0.0026613944520038637, 'bear_atr_max_pct': 0.055266899402778236, 'bear_tp_mult': 1.9218214491807646, 'bear_tsl_mult': 0.6553379305683321, 'bear_time_stop': 209, 'bear_use_sma': True, 'bear_use_ema': True, 'bear_use_atr': True, 'bear_use_adx': True, 'bear_use_spike': True, 'bear_rsi_required': True, 'sideways_strategy': 'breakout', 'sideways_bb_std_mult': 1.293519627860925, 'sideways_rsi_os': 53, 'sideways_rsi_ob': 67, 'sideways_adx_thresh': 7.043151111544449, 'sideways_atr_min_pct': 0.0194216534841179, 'sideways_atr_max_pct': 0.06897834827774518, 'sideways_tp_mult': 1.294725834950607, 'sideways_tsl_mult': 0.28526577357043115, 'sideways_time_stop': 196, 'sideways_use_sma': True, 'sideways_use_ema': False, 'sideways_use_atr': False, 'sideways_use_adx': True, 'sideways_use_spike': False, 'sideways_rsi_required': True}.
