[I 2025-09-01 14:07:21,055] Trial 431 finished with values: [-1000000000.0, 1000000000.0] and parameters: {'p_sma': 35, 'p_std': 40, 'p_atr': 7, 'p_adx': 13, 'rsi_period': 71, 'ema1': 21, 'ema2': 45, 'slip_atr_k': 0.1306170968662104, 'slip_spread_k': 0.4625778901920834, 'spread_hl_frac': 0.005564945099642116, 'bb_std_mult': 1.8544003432901566, 'rsi_os': 42, 'rsi_ob': 69, 'vol_spike': 0.25001676765952446, 'adx_thresh': 25.48749435628318, 'atr_min_pct': 0.018751739095376745, 'atr_max_pct': 0.13602196183818233, 'tp_mult': 1.0712370700764249, 'tsl_mult': 0.7212513560008861, 'strategy': 'mean_reversion', 'time_stop': 253, 'use_sma': True, 'use_atr': False, 'use_adx': False, 'use_ema': True, 'use_spike': True, 'rsi_required': False, 'edge_k': 1.4632902652567954, 'edge_cap': 0.6178100883541093, 'bull_strategy': 'breakout', 'bull_bb_std_mult': 3.2098672111477207, 'bull_rsi_os': 37, 'bull_rsi_ob': 55, 'bull_adx_thresh': 29.83661879083158, 'bull_atr_min_pct': 0.0027379757253875796, 'bull_atr_max_pct': 0.11579844099044835, 'bull_tp_mult': 1.3693111226299424, 'bull_tsl_mult': 0.8424545955870562, 'bull_time_stop': 279, 'bull_use_sma': True, 'bull_use_ema': True, 'bull_use_atr': True, 'bull_use_adx': True, 'bull_use_spike': False, 'bull_rsi_required': True, 'bear_strategy': 'breakout', 'bear_bb_std_mult': 2.0723144443300447, 'bear_rsi_os': 44, 'bear_rsi_ob': 95, 'bear_adx_thresh': 26.66261548135434, 'bear_atr_min_pct': 0.028846940130716467, 'bear_atr_max_pct': 0.12632770552332667, 'bear_tp_mult': 2.369795277330387, 'bear_tsl_mult': 0.11199508169619332, 'bear_time_stop': 190, 'bear_use_sma': True, 'bear_use_ema': True, 'bear_use_atr': True, 'bear_use_adx': True, 'bear_use_spike': False, 'bear_rsi_required': True, 'sideways_strategy': 'breakout', 'sideways_bb_std_mult': 1.597963583114006, 'sideways_rsi_os': 47, 'sideways_rsi_ob': 50, 'sideways_adx_thresh': 22.815030127817508, 'sideways_atr_min_pct': 0.01891275253973166, 'sideways_atr_max_pct': 0.06046818125519558, 'sideways_tp_mult': 2.800572740043466, 'sideways_tsl_mult': 0.8907208965254283, 'sideways_time_stop': 40, 'sideways_use_sma': True, 'sideways_use_ema': False, 'sideways_use_atr': True, 'sideways_use_adx': True, 'sideways_use_spike': False, 'sideways_rsi_required': True}.
[I 2025-09-01 14:07:21,454] Trial 433 finished with values: [-0.04846121179463625, 0.048634439497759745] and parameters: {'p_sma': 35, 'p_std': 24, 'p_atr': 7, 'p_adx': 24, 'rsi_period': 61, 'ema1': 21, 'ema2': 15, 'slip_atr_k': 0.014794324552537251, 'slip_spread_k': 0.9462256369521027, 'spread_hl_frac': 0.02304319840139279, 'bb_std_mult': 1.8259209889367363, 'rsi_os': 42, 'rsi_ob': 53, 'vol_spike': 0.2884378789668738, 'adx_thresh': 25.55092473846763, 'atr_min_pct': 0.019224991416385194, 'atr_max_pct': 0.13576255208788984, 'tp_mult': 1.0733708145613963, 'tsl_mult': 0.7248113489758052, 'strategy': 'mean_reversion', 'time_stop': 257, 'use_sma': True, 'use_atr': False, 'use_adx': False, 'use_ema': True, 'use_spike': True, 'rsi_required': False, 'edge_k': 1.1902243618782111, 'edge_cap': 0.3603484810973001, 'bull_strategy': 'breakout', 'bull_bb_std_mult': 3.1949250125449313, 'bull_rsi_os': 13, 'bull_rsi_ob': 56, 'bull_adx_thresh': 29.856954983230743, 'bull_atr_min_pct': 0.0023488238826363667, 'bull_atr_max_pct': 0.14626164300624422, 'bull_tp_mult': 2.785220843618518, 'bull_tsl_mult': 0.14729291652062226, 'bull_time_stop': 56, 'bull_use_sma': True, 'bull_use_ema': True, 'bull_use_atr': True, 'bull_use_adx': True, 'bull_use_spike': False, 'bull_rsi_required': True, 'bear_strategy': 'breakout', 'bear_bb_std_mult': 1.1528620995437049, 'bear_rsi_os': 41, 'bear_rsi_ob': 90, 'bear_adx_thresh': 26.73835153085339, 'bear_atr_min_pct': 0.0037872343435848203, 'bear_atr_max_pct': 0.12554377477565876, 'bear_tp_mult': 2.359238030169312, 'bear_tsl_mult': 0.10909042563168325, 'bear_time_stop': 123, 'bear_use_sma': True, 'bear_use_ema': True, 'bear_use_atr': True, 'bear_use_adx': True, 'bear_use_spike': False, 'bear_rsi_required': True, 'sideways_strategy': 'breakout', 'sideways_bb_std_mult': 1.949861224390966, 'sideways_rsi_os': 32, 'sideways_rsi_ob': 69, 'sideways_adx_thresh': 16.48001358220154, 'sideways_atr_min_pct': 0.01832600753087956, 'sideways_atr_max_pct': 0.07339901608418507, 'sideways_tp_mult': 1.4606293905377448, 'sideways_tsl_mult': 0.28000494298290934, 'sideways_time_stop': 186, 'sideways_use_sma': True, 'sideways_use_ema': False, 'sideways_use_atr': True, 'sideways_use_adx': True, 'sideways_use_spike': False, 'sideways_rsi_required': True}.
[I 2025-09-01 14:07:22,369] Trial 435 finished with values: [-1000000000.0, 1000000000.0] and parameters: {'p_sma': 16, 'p_std': 20, 'p_atr': 26, 'p_adx': 13, 'rsi_period': 63, 'ema1': 21, 'ema2': 48, 'slip_atr_k': 0.0037838499482400426, 'slip_spread_k': 0.0312564453278931, 'spread_hl_frac': 0.00542847780137626, 'bb_std_mult': 1.8557830867144087, 'rsi_os': 42, 'rsi_ob': 45, 'vol_spike': 0.0009613782775302337, 'adx_thresh': 25.199292787792928, 'atr_min_pct': 0.01865235458162393, 'atr_max_pct': 0.13900651205053596, 'tp_mult': 1.9551553633658725, 'tsl_mult': 0.9998935880441018, 'strategy': 'mean_reversion', 'time_stop': 238, 'use_sma': True, 'use_atr': False, 'use_adx': False, 'use_ema': True, 'use_spike': True, 'rsi_required': False, 'edge_k': 0.8460501832973759, 'edge_cap': 0.7426037716813262, 'bull_strategy': 'breakout', 'bull_bb_std_mult': 3.1874617280841964, 'bull_rsi_os': 44, 'bull_rsi_ob': 55, 'bull_adx_thresh': 14.12717834667903, 'bull_atr_min_pct': 0.0026489143976729276, 'bull_atr_max_pct': 0.02541232578800307, 'bull_tp_mult': 1.3649191531596516, 'bull_tsl_mult': 0.3758384228609384, 'bull_time_stop': 81, 'bull_use_sma': True, 'bull_use_ema': True, 'bull_use_atr': True, 'bull_use_adx': True, 'bull_use_spike': True, 'bull_rsi_required': True, 'bear_strategy': 'breakout', 'bear_bb_std_mult': 3.0566532283930457, 'bear_rsi_os': 39, 'bear_rsi_ob': 90, 'bear_adx_thresh': 12.99889140182924, 'bear_atr_min_pct': 0.003966213518733911, 'bear_atr_max_pct': 0.0653092625983539, 'bear_tp_mult': 2.3708318991960993, 'bear_tsl_mult': 0.11713322966775042, 'bear_time_stop': 213, 'bear_use_sma': True, 'bear_use_ema': True, 'bear_use_atr': True, 'bear_use_adx': True, 'bear_use_spike': False, 'bear_rsi_required': True, 'sideways_strategy': 'mean_reversion', 'sideways_bb_std_mult': 1.0349226695201208, 'sideways_rsi_os': 53, 'sideways_rsi_ob': 69, 'sideways_adx_thresh': 16.818885630200814, 'sideways_atr_min_pct': 0.021240746906803876, 'sideways_atr_max_pct': 0.05417961104574894, 'sideways_tp_mult': 2.6667472129283616, 'sideways_tsl_mult': 0.2822418969066694, 'sideways_time_stop': 182, 'sideways_use_sma': True, 'sideways_use_ema': False, 'sideways_use_atr': True, 'sideways_use_adx': True, 'sideways_use_spike': False, 'sideways_rsi_required': False}.
[I 2025-09-01 14:07:58,083] Trial 437 finished with values: [-1000000000.0, 1000000000.0] and parameters: {'p_sma': 36, 'p_std': 20, 'p_atr': 14, 'p_adx': 29, 'rsi_period': 59, 'ema1': 22, 'ema2': 17, 'slip_atr_k': 0.005147735657989861, 'slip_spread_k': 0.02959878825071073, 'spread_hl_frac': 0.008206058186823354, 'bb_std_mult': 2.3731763137580315, 'rsi_os': 40, 'rsi_ob': 83, 'vol_spike': 0.14610021281757266, 'adx_thresh': 19.427207533435535, 'atr_min_pct': 0.019715155193033955, 'atr_max_pct': 0.0745519900692877, 'tp_mult': 1.0257588988575552, 'tsl_mult': 0.9018912110385682, 'strategy': 'mean_reversion', 'time_stop': 237, 'use_sma': False, 'use_atr': False, 'use_adx': False, 'use_ema': False, 'use_spike': True, 'rsi_required': True, 'edge_k': 1.9184001072160228, 'edge_cap': 0.28331747773158406, 'bull_strategy': 'mean_reversion', 'bull_bb_std_mult': 3.28369813417385, 'bull_rsi_os': 36, 'bull_rsi_ob': 68, 'bull_adx_thresh': 9.137447204929106, 'bull_atr_min_pct': 0.026489532872518578, 'bull_atr_max_pct': 0.013040442192198798, 'bull_tp_mult': 2.9914975664079724, 'bull_tsl_mult': 0.6773525980738341, 'bull_time_stop': 211, 'bull_use_sma': True, 'bull_use_ema': False, 'bull_use_atr': False, 'bull_use_adx': True, 'bull_use_spike': True, 'bull_rsi_required': True, 'bear_strategy': 'breakout', 'bear_bb_std_mult': 3.0829700513185614, 'bear_rsi_os': 32, 'bear_rsi_ob': 85, 'bear_adx_thresh': 11.177139201864986, 'bear_atr_min_pct': 0.0030813742744307485, 'bear_atr_max_pct': 0.06573256380703606, 'bear_tp_mult': 1.2789198161045214, 'bear_tsl_mult': 0.1953557016547711, 'bear_time_stop': 203, 'bear_use_sma': False, 'bear_use_ema': True, 'bear_use_atr': False, 'bear_use_adx': True, 'bear_use_spike': False, 'bear_rsi_required': True, 'sideways_strategy': 'mean_reversion', 'sideways_bb_std_mult': 1.3794152935102115, 'sideways_rsi_os': 48, 'sideways_rsi_ob': 67, 'sideways_adx_thresh': 9.481095731137179, 'sideways_atr_min_pct': 0.022105180430480917, 'sideways_atr_max_pct': 0.0558088287538937, 'sideways_tp_mult': 2.6765047923080605, 'sideways_tsl_mult': 0.3311664030475222, 'sideways_time_stop': 156, 'sideways_use_sma': True, 'sideways_use_ema': False, 'sideways_use_atr': True, 'sideways_use_adx': True, 'sideways_use_spike': False, 'sideways_rsi_required': False}.
[I 2025-09-01 14:07:59,079] Trial 434 finished with values: [-1000000000.0, 1000000000.0] and parameters: {'p_sma': 49, 'p_std': 40, 'p_atr': 26, 'p_adx': 24, 'rsi_period': 67, 'ema1': 21, 'ema2': 17, 'slip_atr_k': 0.003898706315105827, 'slip_spread_k': 0.9600269636463011, 'spread_hl_frac': 0.020532990636449, 'bb_std_mult': 1.8557366791728829, 'rsi_os': 42, 'rsi_ob': 87, 'vol_spike': 0.08690683701759398, 'adx_thresh': 19.010339159081365, 'atr_min_pct': 0.01876185445361353, 'atr_max_pct': 0.13583015890218217, 'tp_mult': 1.0653189946792345, 'tsl_mult': 0.7233811011052946, 'strategy': 'mean_reversion', 'time_stop': 245, 'use_sma': True, 'use_atr': False, 'use_adx': False, 'use_ema': True, 'use_spike': True, 'rsi_required': False, 'edge_k': 0.9651435107352438, 'edge_cap': 0.6202410154322235, 'bull_strategy': 'breakout', 'bull_bb_std_mult': 0.8000547441412322, 'bull_rsi_os': 13, 'bull_rsi_ob': 49, 'bull_adx_thresh': 30.122515587711263, 'bull_atr_min_pct': 0.002186379508417046, 'bull_atr_max_pct': 0.08253802684875555, 'bull_tp_mult': 2.767039563919578, 'bull_tsl_mult': 0.8357480760416547, 'bull_time_stop': 91, 'bull_use_sma': True, 'bull_use_ema': True, 'bull_use_atr': True, 'bull_use_adx': True, 'bull_use_spike': False, 'bull_rsi_required': True, 'bear_strategy': 'breakout', 'bear_bb_std_mult': 3.073673355285025, 'bear_rsi_os': 32, 'bear_rsi_ob': 95, 'bear_adx_thresh': 9.618486065720907, 'bear_atr_min_pct': 0.003831715504520646, 'bear_atr_max_pct': 0.1206937407063936, 'bear_tp_mult': 1.5334157512048368, 'bear_tsl_mult': 0.3587896186866747, 'bear_time_stop': 193, 'bear_use_sma': True, 'bear_use_ema': True, 'bear_use_atr': True, 'bear_use_adx': True, 'bear_use_spike': False, 'bear_rsi_required': True, 'sideways_strategy': 'breakout', 'sideways_bb_std_mult': 1.0343123877707472, 'sideways_rsi_os': 48, 'sideways_rsi_ob': 67, 'sideways_adx_thresh': 16.5871684164744, 'sideways_atr_min_pct': 0.022415286099398316, 'sideways_atr_max_pct': 0.05380389392121168, 'sideways_tp_mult': 2.791684731269045, 'sideways_tsl_mult': 0.32886105259857895, 'sideways_time_stop': 214, 'sideways_use_sma': True, 'sideways_use_ema': False, 'sideways_use_atr': True, 'sideways_use_adx': True, 'sideways_use_spike': False, 'sideways_rsi_required': True}.
[I 2025-09-01 14:07:59,424] Trial 436 finished with values: [-0.051746839710855475, 0.05156122665846942] and parameters: {'p_sma': 60, 'p_std': 20, 'p_atr': 14, 'p_adx': 13, 'rsi_period': 61, 'ema1': 21, 'ema2': 22, 'slip_atr_k': 0.015168819708814254, 'slip_spread_k': 0.9453120715538834, 'spread_hl_frac': 0.027118811855781234, 'bb_std_mult': 1.8034925169010685, 'rsi_os': 44, 'rsi_ob': 53, 'vol_spike': 0.22758997814623227, 'adx_thresh': 34.98436897341273, 'atr_min_pct': 0.012476632904837068, 'atr_max_pct': 0.13985962812196243, 'tp_mult': 1.012121585714765, 'tsl_mult': 0.7292343177956453, 'strategy': 'mean_reversion', 'time_stop': 237, 'use_sma': True, 'use_atr': False, 'use_adx': False, 'use_ema': False, 'use_spike': True, 'rsi_required': False, 'edge_k': 0.6612151095453553, 'edge_cap': 0.35448663035267725, 'bull_strategy': 'mean_reversion', 'bull_bb_std_mult': 3.133297154756992, 'bull_rsi_os': 36, 'bull_rsi_ob': 68, 'bull_adx_thresh': 30.71430157997254, 'bull_atr_min_pct': 0.002310790313205686, 'bull_atr_max_pct': 0.03123973988282728, 'bull_tp_mult': 2.849020236088203, 'bull_tsl_mult': 0.5124320881646593, 'bull_time_stop': 82, 'bull_use_sma': True, 'bull_use_ema': False, 'bull_use_atr': True, 'bull_use_adx': True, 'bull_use_spike': True, 'bull_rsi_required': True, 'bear_strategy': 'breakout', 'bear_bb_std_mult': 3.057703284447726, 'bear_rsi_os': 40, 'bear_rsi_ob': 82, 'bear_adx_thresh': 22.396136336698493, 'bear_atr_min_pct': 0.011226202126625865, 'bear_atr_max_pct': 0.04910774616654268, 'bear_tp_mult': 2.174756473320122, 'bear_tsl_mult': 0.3563718349089511, 'bear_time_stop': 235, 'bear_use_sma': False, 'bear_use_ema': True, 'bear_use_atr': False, 'bear_use_adx': True, 'bear_use_spike': False, 'bear_rsi_required': True, 'sideways_strategy': 'mean_reversion', 'sideways_bb_std_mult': 1.3841011255518778, 'sideways_rsi_os': 54, 'sideways_rsi_ob': 70, 'sideways_adx_thresh': 11.895636324153566, 'sideways_atr_min_pct': 0.022277299966748272, 'sideways_atr_max_pct': 0.055092109102586675, 'sideways_tp_mult': 2.6599068233872316, 'sideways_tsl_mult': 0.3283881054997803, 'sideways_time_stop': 183, 'sideways_use_sma': True, 'sideways_use_ema': False, 'sideways_use_atr': True, 'sideways_use_adx': True, 'sideways_use_spike': False, 'sideways_rsi_required': False}.
[I 2025-09-01 14:08:00,352] Trial 438 finished with values: [-1000000000.0, 1000000000.0] and parameters: {'p_sma': 14, 'p_std': 50, 'p_atr': 23, 'p_adx': 12, 'rsi_period': 23, 'ema1': 22, 'ema2': 22, 'slip_atr_k': 0.1842669117392583, 'slip_spread_k': 0.7903697937366074, 'spread_hl_frac': 0.026948340781534432, 'bb_std_mult': 1.0257948326761945, 'rsi_os': 48, 'rsi_ob': 83, 'vol_spike': 0.215252170752883, 'adx_thresh': 24.081729804686383, 'atr_min_pct': 0.012621520158905549, 'atr_max_pct': 0.10848692526468443, 'tp_mult': 1.0111297611653693, 'tsl_mult': 0.7344831591912548, 'strategy': 'mean_reversion', 'time_stop': 50, 'use_sma': False, 'use_atr': True, 'use_adx': False, 'use_ema': False, 'use_spike': True, 'rsi_required': True, 'edge_k': 0.7767634811754838, 'edge_cap': 0.1172551603604644, 'bull_strategy': 'mean_reversion', 'bull_bb_std_mult': 2.0312865527558586, 'bull_rsi_os': 36, 'bull_rsi_ob': 50, 'bull_adx_thresh': 30.594641225897014, 'bull_atr_min_pct': 0.006378733226966336, 'bull_atr_max_pct': 0.03147198455880013, 'bull_tp_mult': 2.9585876345714577, 'bull_tsl_mult': 0.39881649158070637, 'bull_time_stop': 93, 'bull_use_sma': True, 'bull_use_ema': False, 'bull_use_atr': False, 'bull_use_adx': False, 'bull_use_spike': False, 'bull_rsi_required': True, 'bear_strategy': 'breakout', 'bear_bb_std_mult': 3.4993937527382313, 'bear_rsi_os': 32, 'bear_rsi_ob': 82, 'bear_adx_thresh': 15.67723305497892, 'bear_atr_min_pct': 0.011414973675437295, 'bear_atr_max_pct': 0.12183900373259192, 'bear_tp_mult': 1.933321707850363, 'bear_tsl_mult': 0.3599733482394756, 'bear_time_stop': 203, 'bear_use_sma': False, 'bear_use_ema': True, 'bear_use_atr': False, 'bear_use_adx': True, 'bear_use_spike': False, 'bear_rsi_required': True, 'sideways_strategy': 'breakout', 'sideways_bb_std_mult': 1.326433008835144, 'sideways_rsi_os': 48, 'sideways_rsi_ob': 60, 'sideways_adx_thresh': 7.975270180612725, 'sideways_atr_min_pct': 0.02181281319603324, 'sideways_atr_max_pct': 0.0671056176684475, 'sideways_tp_mult': 2.730932305967815, 'sideways_tsl_mult': 0.3199605395164459, 'sideways_time_stop': 52, 'sideways_use_sma': True, 'sideways_use_ema': False, 'sideways_use_atr': True, 'sideways_use_adx': True, 'sideways_use_spike': False, 'sideways_rsi_required': True}.
[I 2025-09-01 14:08:36,888] Trial 439 finished with values: [-0.06531494201282584, 0.06502903199952562] and parameters: {'p_sma': 60, 'p_std': 29, 'p_atr': 24, 'p_adx': 11, 'rsi_period': 65, 'ema1': 9, 'ema2': 17, 'slip_atr_k': 0.1837343163648364, 'slip_spread_k': 0.13345647335258748, 'spread_hl_frac': 0.020532353838630158, 'bb_std_mult': 2.9369575090803606, 'rsi_os': 38, 'rsi_ob': 83, 'vol_spike': 0.1762702290239878, 'adx_thresh': 23.90080365691363, 'atr_min_pct': 0.009395091820160448, 'atr_max_pct': 0.13309381508704535, 'tp_mult': 2.3373966213208837, 'tsl_mult': 0.7530967327243577, 'strategy': 'breakout', 'time_stop': 246, 'use_sma': True, 'use_atr': True, 'use_adx': False, 'use_ema': True, 'use_spike': True, 'rsi_required': False, 'edge_k': 0.6768928921505158, 'edge_cap': 0.41585078933635544, 'bull_strategy': 'breakout', 'bull_bb_std_mult': 1.276350527651544, 'bull_rsi_os': 34, 'bull_rsi_ob': 71, 'bull_adx_thresh': 30.836117138719928, 'bull_atr_min_pct': 0.0039517954436092545, 'bull_atr_max_pct': 0.031468774492545246, 'bull_tp_mult': 2.2765054166958243, 'bull_tsl_mult': 0.3955611975784794, 'bull_time_stop': 175, 'bull_use_sma': True, 'bull_use_ema': True, 'bull_use_atr': True, 'bull_use_adx': False, 'bull_use_spike': False, 'bull_rsi_required': True, 'bear_strategy': 'breakout', 'bear_bb_std_mult': 3.4887725965266543, 'bear_rsi_os': 35, 'bear_rsi_ob': 92, 'bear_adx_thresh': 15.879631540402574, 'bear_atr_min_pct': 0.0017756579715250793, 'bear_atr_max_pct': 0.04867095815311178, 'bear_tp_mult': 2.176071149798635, 'bear_tsl_mult': 0.16342215290587955, 'bear_time_stop': 235, 'bear_use_sma': True, 'bear_use_ema': True, 'bear_use_atr': False, 'bear_use_adx': True, 'bear_use_spike': True, 'bear_rsi_required': True, 'sideways_strategy': 'breakout', 'sideways_bb_std_mult': 1.4967746433376123, 'sideways_rsi_os': 24, 'sideways_rsi_ob': 68, 'sideways_adx_thresh': 11.767883616070186, 'sideways_atr_min_pct': 0.019956349827447966, 'sideways_atr_max_pct': 0.0625107150672422, 'sideways_tp_mult': 2.905917073991751, 'sideways_tsl_mult': 0.7580025181131, 'sideways_time_stop': 69, 'sideways_use_sma': True, 'sideways_use_ema': False, 'sideways_use_atr': False, 'sideways_use_adx': True, 'sideways_use_spike': False, 'sideways_rsi_required': True}.
[I 2025-09-01 14:08:37,944] Trial 440 finished with values: [-0.03649479491522667, 0.036044123315046424] and parameters: {'p_sma': 33, 'p_std': 50, 'p_atr': 24, 'p_adx': 12, 'rsi_period': 65, 'ema1': 9, 'ema2': 28, 'slip_atr_k': 0.13827162581859576, 'slip_spread_k': 0.2642989141477614, 'spread_hl_frac': 0.02669806155781176, 'bb_std_mult': 1.2151242978995715, 'rsi_os': 37, 'rsi_ob': 83, 'vol_spike': 0.1757514275438793, 'adx_thresh': 23.80214692836543, 'atr_min_pct': 0.029536766585427525, 'atr_max_pct': 0.09236198040970423, 'tp_mult': 1.2035375983316527, 'tsl_mult': 0.7476948524233794, 'strategy': 'breakout', 'time_stop': 218, 'use_sma': True, 'use_atr': True, 'use_adx': True, 'use_ema': False, 'use_spike': True, 'rsi_required': False, 'edge_k': 0.09131045945524274, 'edge_cap': 0.3423363936646479, 'bull_strategy': 'mean_reversion', 'bull_bb_std_mult': 2.0345912550237495, 'bull_rsi_os': 34, 'bull_rsi_ob': 90, 'bull_adx_thresh': 30.651753289235703, 'bull_atr_min_pct': 0.006455993287768089, 'bull_atr_max_pct': 0.016896549486580287, 'bull_tp_mult': 2.853900683224254, 'bull_tsl_mult': 0.5508297017339457, 'bull_time_stop': 86, 'bull_use_sma': True, 'bull_use_ema': False, 'bull_use_atr': True, 'bull_use_adx': False, 'bull_use_spike': False, 'bull_rsi_required': True, 'bear_strategy': 'breakout', 'bear_bb_std_mult': 3.4836068889856158, 'bear_rsi_os': 35, 'bear_rsi_ob': 89, 'bear_adx_thresh': 12.720020365750553, 'bear_atr_min_pct': 0.0018659885714926785, 'bear_atr_max_pct': 0.04837245058873896, 'bear_tp_mult': 2.172301100019666, 'bear_tsl_mult': 0.23932195903156817, 'bear_time_stop': 237, 'bear_use_sma': False, 'bear_use_ema': False, 'bear_use_atr': False, 'bear_use_adx': True, 'bear_use_spike': True, 'bear_rsi_required': True, 'sideways_strategy': 'breakout', 'sideways_bb_std_mult': 1.4926502583767571, 'sideways_rsi_os': 39, 'sideways_rsi_ob': 65, 'sideways_adx_thresh': 7.944260924022464, 'sideways_atr_min_pct': 0.005563979446189207, 'sideways_atr_max_pct': 0.040310116110765716, 'sideways_tp_mult': 2.7307625773123068, 'sideways_tsl_mult': 0.163274374836754, 'sideways_time_stop': 165, 'sideways_use_sma': True, 'sideways_use_ema': False, 'sideways_use_atr': False, 'sideways_use_adx': True, 'sideways_use_spike': True, 'sideways_rsi_required': True}.
