[I 2025-09-01 14:22:03,802] Trial 533 finished with values: [-0.1102252955144204, 0.11046533525707089] and parameters: {'p_sma': 33, 'p_std': 47, 'p_atr': 25, 'p_adx': 12, 'rsi_period': 21, 'ema1': 9, 'ema2': 39, 'slip_atr_k': 0.015332739366793711, 'slip_spread_k': 0.025425198313319977, 'spread_hl_frac': 0.006066929323553185, 'bb_std_mult': 1.7940009374201795, 'rsi_os': 21, 'rsi_ob': 85, 'vol_spike': 0.20314525165320477, 'adx_thresh': 32.98460457498842, 'atr_min_pct': 0.026848154083449604, 'atr_max_pct': 0.1180380994407311, 'tp_mult': 2.876437994819084, 'tsl_mult': 0.851909879144011, 'strategy': 'breakout', 'time_stop': 231, 'use_sma': True, 'use_atr': False, 'use_adx': False, 'use_ema': False, 'use_spike': True, 'rsi_required': True, 'edge_k': 0.8783505596404142, 'edge_cap': 0.571418231027049, 'bull_strategy': 'breakout', 'bull_bb_std_mult': 3.2152933947077154, 'bull_rsi_os': 38, 'bull_rsi_ob': 57, 'bull_adx_thresh': 30.237178644177874, 'bull_atr_min_pct': 0.003381696431542541, 'bull_atr_max_pct': 0.06597377081324482, 'bull_tp_mult': 2.9082471988912606, 'bull_tsl_mult': 0.6448911736569345, 'bull_time_stop': 163, 'bull_use_sma': False, 'bull_use_ema': False, 'bull_use_atr': True, 'bull_use_adx': True, 'bull_use_spike': False, 'bull_rsi_required': False, 'bear_strategy': 'mean_reversion', 'bear_bb_std_mult': 3.50388296747076, 'bear_rsi_os': 52, 'bear_rsi_ob': 56, 'bear_adx_thresh': 22.1005961542138, 'bear_atr_min_pct': 0.0014070475493072796, 'bear_atr_max_pct': 0.03487223202136705, 'bear_tp_mult': 1.8367503469439228, 'bear_tsl_mult': 0.33139623754490327, 'bear_time_stop': 108, 'bear_use_sma': True, 'bear_use_ema': False, 'bear_use_atr': True, 'bear_use_adx': True, 'bear_use_spike': False, 'bear_rsi_required': True, 'sideways_strategy': 'breakout', 'sideways_bb_std_mult': 1.4164569155744093, 'sideways_rsi_os': 51, 'sideways_rsi_ob': 68, 'sideways_adx_thresh': 11.285991435273584, 'sideways_atr_min_pct': 0.01945253931982853, 'sideways_atr_max_pct': 0.060877790831517814, 'sideways_tp_mult': 1.4790252131233053, 'sideways_tsl_mult': 0.8785487370488654, 'sideways_time_stop': 64, 'sideways_use_sma': True, 'sideways_use_ema': True, 'sideways_use_atr': True, 'sideways_use_adx': False, 'sideways_use_spike': False, 'sideways_rsi_required': True}.
[I 2025-09-01 14:22:04,758] Trial 531 finished with values: [-1000000000.0, 1000000000.0] and parameters: {'p_sma': 19, 'p_std': 12, 'p_atr': 26, 'p_adx': 16, 'rsi_period': 68, 'ema1': 19, 'ema2': 26, 'slip_atr_k': 0.14112174091713445, 'slip_spread_k': 0.2393651422878732, 'spread_hl_frac': 3.229851289389754e-05, 'bb_std_mult': 1.8058336729784732, 'rsi_os': 37, 'rsi_ob': 72, 'vol_spike': 0.25283111819514803, 'adx_thresh': 24.886677969034842, 'atr_min_pct': 0.02653653225737916, 'atr_max_pct': 0.14643307942724665, 'tp_mult': 1.0786403980390147, 'tsl_mult': 0.3068327019851482, 'strategy': 'breakout', 'time_stop': 231, 'use_sma': True, 'use_atr': False, 'use_adx': False, 'use_ema': False, 'use_spike': True, 'rsi_required': False, 'edge_k': 0.5902272972203911, 'edge_cap': 0.33632268134871957, 'bull_strategy': 'breakout', 'bull_bb_std_mult': 3.197957424465226, 'bull_rsi_os': 38, 'bull_rsi_ob': 59, 'bull_adx_thresh': 30.247514154821822, 'bull_atr_min_pct': 0.003481404199544826, 'bull_atr_max_pct': 0.018658233562869324, 'bull_tp_mult': 2.6834607004898325, 'bull_tsl_mult': 0.6278131935391794, 'bull_time_stop': 267, 'bull_use_sma': False, 'bull_use_ema': True, 'bull_use_atr': True, 'bull_use_adx': True, 'bull_use_spike': False, 'bull_rsi_required': False, 'bear_strategy': 'mean_reversion', 'bear_bb_std_mult': 3.50219647525062, 'bear_rsi_os': 35, 'bear_rsi_ob': 56, 'bear_adx_thresh': 22.23662551616306, 'bear_atr_min_pct': 0.001265114239038306, 'bear_atr_max_pct': 0.04274960910404909, 'bear_tp_mult': 2.2599161994835986, 'bear_tsl_mult': 0.6496965180290937, 'bear_time_stop': 220, 'bear_use_sma': True, 'bear_use_ema': True, 'bear_use_atr': True, 'bear_use_adx': True, 'bear_use_spike': False, 'bear_rsi_required': True, 'sideways_strategy': 'breakout', 'sideways_bb_std_mult': 1.412565758132919, 'sideways_rsi_os': 51, 'sideways_rsi_ob': 68, 'sideways_adx_thresh': 6.992705688595535, 'sideways_atr_min_pct': 0.020307205537574594, 'sideways_atr_max_pct': 0.06195530171091056, 'sideways_tp_mult': 2.4777691424698265, 'sideways_tsl_mult': 0.0702271300083791, 'sideways_time_stop': 174, 'sideways_use_sma': True, 'sideways_use_ema': True, 'sideways_use_atr': True, 'sideways_use_adx': False, 'sideways_use_spike': True, 'sideways_rsi_required': False}.
[I 2025-09-01 14:22:05,053] Trial 530 finished with values: [-1000000000.0, 1000000000.0] and parameters: {'p_sma': 31, 'p_std': 19, 'p_atr': 26, 'p_adx': 23, 'rsi_period': 67, 'ema1': 18, 'ema2': 17, 'slip_atr_k': 0.013421709324683886, 'slip_spread_k': 0.12779428657527364, 'spread_hl_frac': 0.006139362014389094, 'bb_std_mult': 1.8122554992334377, 'rsi_os': 37, 'rsi_ob': 86, 'vol_spike': 0.22613278394688274, 'adx_thresh': 18.734899849118506, 'atr_min_pct': 0.02676432258952083, 'atr_max_pct': 0.14705775529025095, 'tp_mult': 1.0788905893266154, 'tsl_mult': 0.8503713799061539, 'strategy': 'mean_reversion', 'time_stop': 240, 'use_sma': False, 'use_atr': True, 'use_adx': False, 'use_ema': True, 'use_spike': True, 'rsi_required': False, 'edge_k': 1.4955663465393667, 'edge_cap': 0.33872815665811984, 'bull_strategy': 'breakout', 'bull_bb_std_mult': 0.913817587499739, 'bull_rsi_os': 38, 'bull_rsi_ob': 56, 'bull_adx_thresh': 29.55539619200805, 'bull_atr_min_pct': 0.01848328070084657, 'bull_atr_max_pct': 0.023788014258923032, 'bull_tp_mult': 2.9244617940098045, 'bull_tsl_mult': 0.6288699149487174, 'bull_time_stop': 166, 'bull_use_sma': False, 'bull_use_ema': True, 'bull_use_atr': True, 'bull_use_adx': False, 'bull_use_spike': True, 'bull_rsi_required': False, 'bear_strategy': 'breakout', 'bear_bb_std_mult': 1.9647336580940178, 'bear_rsi_os': 8, 'bear_rsi_ob': 45, 'bear_adx_thresh': 10.534726404535718, 'bear_atr_min_pct': 0.0272313332949852, 'bear_atr_max_pct': 0.04214482899220828, 'bear_tp_mult': 2.957445514826798, 'bear_tsl_mult': 0.7094226425232029, 'bear_time_stop': 222, 'bear_use_sma': True, 'bear_use_ema': True, 'bear_use_atr': True, 'bear_use_adx': True, 'bear_use_spike': True, 'bear_rsi_required': True, 'sideways_strategy': 'mean_reversion', 'sideways_bb_std_mult': 1.337333873666334, 'sideways_rsi_os': 48, 'sideways_rsi_ob': 72, 'sideways_adx_thresh': 8.85542333064417, 'sideways_atr_min_pct': 0.025702847447735315, 'sideways_atr_max_pct': 0.061400055552295274, 'sideways_tp_mult': 1.1742325884617337, 'sideways_tsl_mult': 0.3066770551572269, 'sideways_time_stop': 174, 'sideways_use_sma': True, 'sideways_use_ema': True, 'sideways_use_atr': False, 'sideways_use_adx': True, 'sideways_use_spike': True, 'sideways_rsi_required': False}.
[I 2025-09-01 14:22:41,835] Trial 535 finished with values: [-1000000000.0, 1000000000.0] and parameters: {'p_sma': 37, 'p_std': 45, 'p_atr': 22, 'p_adx': 16, 'rsi_period': 64, 'ema1': 20, 'ema2': 13, 'slip_atr_k': 0.24119951760276317, 'slip_spread_k': 0.30803813883125686, 'spread_hl_frac': 0.00886394748809431, 'bb_std_mult': 0.7068389249446205, 'rsi_os': 37, 'rsi_ob': 88, 'vol_spike': 0.24046722436572576, 'adx_thresh': 5.172194898144792, 'atr_min_pct': 0.004301507264057217, 'atr_max_pct': 0.14599439420562907, 'tp_mult': 1.0862392118366202, 'tsl_mult': 0.7799998413729611, 'strategy': 'mean_reversion', 'time_stop': 31, 'use_sma': True, 'use_atr': False, 'use_adx': False, 'use_ema': True, 'use_spike': True, 'rsi_required': False, 'edge_k': 0.22395931883448517, 'edge_cap': 0.35001609111435183, 'bull_strategy': 'breakout', 'bull_bb_std_mult': 3.035456155070431, 'bull_rsi_os': 6, 'bull_rsi_ob': 60, 'bull_adx_thresh': 17.154687334637426, 'bull_atr_min_pct': 0.023225647005803825, 'bull_atr_max_pct': 0.02179379936118757, 'bull_tp_mult': 1.3956844707522833, 'bull_tsl_mult': 0.7163322500569299, 'bull_time_stop': 99, 'bull_use_sma': True, 'bull_use_ema': True, 'bull_use_atr': True, 'bull_use_adx': True, 'bull_use_spike': False, 'bull_rsi_required': True, 'bear_strategy': 'breakout', 'bear_bb_std_mult': 1.9302763158497072, 'bear_rsi_os': 18, 'bear_rsi_ob': 45, 'bear_adx_thresh': 9.018437932923884, 'bear_atr_min_pct': 0.013586056936169518, 'bear_atr_max_pct': 0.07424475110697612, 'bear_tp_mult': 2.185363364159038, 'bear_tsl_mult': 0.2556143633849352, 'bear_time_stop': 220, 'bear_use_sma': True, 'bear_use_ema': True, 'bear_use_atr': True, 'bear_use_adx': True, 'bear_use_spike': False, 'bear_rsi_required': True, 'sideways_strategy': 'breakout', 'sideways_bb_std_mult': 1.6300448875264857, 'sideways_rsi_os': 53, 'sideways_rsi_ob': 72, 'sideways_adx_thresh': 6.939494770403747, 'sideways_atr_min_pct': 0.018391945080393365, 'sideways_atr_max_pct': 0.14524643188650058, 'sideways_tp_mult': 2.875732199438351, 'sideways_tsl_mult': 0.303777564182412, 'sideways_time_stop': 174, 'sideways_use_sma': True, 'sideways_use_ema': False, 'sideways_use_atr': True, 'sideways_use_adx': True, 'sideways_use_spike': False, 'sideways_rsi_required': True}.
[I 2025-09-01 14:22:42,593] Trial 537 finished with values: [-1000000000.0, 1000000000.0] and parameters: {'p_sma': 13, 'p_std': 45, 'p_atr': 28, 'p_adx': 13, 'rsi_period': 64, 'ema1': 27, 'ema2': 16, 'slip_atr_k': 0.2401944593376043, 'slip_spread_k': 0.2940903667489375, 'spread_hl_frac': 0.03392641986018169, 'bb_std_mult': 1.937511890418511, 'rsi_os': 6, 'rsi_ob': 84, 'vol_spike': 0.27819690932739494, 'adx_thresh': 26.521986616020197, 'atr_min_pct': 0.026072107103497173, 'atr_max_pct': 0.1386201554462926, 'tp_mult': 1.0130149915413798, 'tsl_mult': 0.683066075906248, 'strategy': 'mean_reversion', 'time_stop': 71, 'use_sma': True, 'use_atr': False, 'use_adx': False, 'use_ema': True, 'use_spike': True, 'rsi_required': False, 'edge_k': 1.0085920838838758, 'edge_cap': 0.3502686567117616, 'bull_strategy': 'breakout', 'bull_bb_std_mult': 1.0344305098267765, 'bull_rsi_os': 15, 'bull_rsi_ob': 60, 'bull_adx_thresh': 17.320126543938564, 'bull_atr_min_pct': 0.023018527716244346, 'bull_atr_max_pct': 0.027678389706325315, 'bull_tp_mult': 2.793678106473574, 'bull_tsl_mult': 0.4872716370318192, 'bull_time_stop': 96, 'bull_use_sma': True, 'bull_use_ema': True, 'bull_use_atr': True, 'bull_use_adx': True, 'bull_use_spike': False, 'bull_rsi_required': True, 'bear_strategy': 'breakout', 'bear_bb_std_mult': 3.315910516606559, 'bear_rsi_os': 50, 'bear_rsi_ob': 88, 'bear_adx_thresh': 12.201399215382992, 'bear_atr_min_pct': 0.003476494697103723, 'bear_atr_max_pct': 0.07434479789175069, 'bear_tp_mult': 2.1589911167403653, 'bear_tsl_mult': 0.7668542234994841, 'bear_time_stop': 216, 'bear_use_sma': True, 'bear_use_ema': True, 'bear_use_atr': True, 'bear_use_adx': True, 'bear_use_spike': False, 'bear_rsi_required': True, 'sideways_strategy': 'breakout', 'sideways_bb_std_mult': 1.1001432088508976, 'sideways_rsi_os': 53, 'sideways_rsi_ob': 78, 'sideways_adx_thresh': 31.751358156461315, 'sideways_atr_min_pct': 0.018454008186718926, 'sideways_atr_max_pct': 0.08902209011614605, 'sideways_tp_mult': 2.7152051482979083, 'sideways_tsl_mult': 0.6375875191593467, 'sideways_time_stop': 244, 'sideways_use_sma': True, 'sideways_use_ema': False, 'sideways_use_atr': True, 'sideways_use_adx': True, 'sideways_use_spike': False, 'sideways_rsi_required': True}.
[I 2025-09-01 14:22:43,399] Trial 536 finished with values: [-1000000000.0, 1000000000.0] and parameters: {'p_sma': 7, 'p_std': 33, 'p_atr': 24, 'p_adx': 13, 'rsi_period': 64, 'ema1': 20, 'ema2': 16, 'slip_atr_k': 0.013689136378906841, 'slip_spread_k': 0.29616837416288255, 'spread_hl_frac': 0.023721400930357475, 'bb_std_mult': 1.907332482965128, 'rsi_os': 27, 'rsi_ob': 88, 'vol_spike': 0.24018484836988468, 'adx_thresh': 15.299167176856132, 'atr_min_pct': 0.009122985552667473, 'atr_max_pct': 0.13391215404669934, 'tp_mult': 2.9577066790988273, 'tsl_mult': 0.77938199907351, 'strategy': 'mean_reversion', 'time_stop': 221, 'use_sma': True, 'use_atr': False, 'use_adx': False, 'use_ema': True, 'use_spike': True, 'rsi_required': False, 'edge_k': 0.9951135786169452, 'edge_cap': 0.8591900820989508, 'bull_strategy': 'breakout', 'bull_bb_std_mult': 3.1094596469543636, 'bull_rsi_os': 32, 'bull_rsi_ob': 56, 'bull_adx_thresh': 32.34273223838505, 'bull_atr_min_pct': 0.00605298451308974, 'bull_atr_max_pct': 0.021221369693390824, 'bull_tp_mult': 2.788141317894952, 'bull_tsl_mult': 0.46419079599027213, 'bull_time_stop': 101, 'bull_use_sma': True, 'bull_use_ema': True, 'bull_use_atr': True, 'bull_use_adx': True, 'bull_use_spike': False, 'bull_rsi_required': True, 'bear_strategy': 'breakout', 'bear_bb_std_mult': 2.881508820895063, 'bear_rsi_os': 18, 'bear_rsi_ob': 81, 'bear_adx_thresh': 12.40388310757374, 'bear_atr_min_pct': 0.003631199976917272, 'bear_atr_max_pct': 0.07477978077624343, 'bear_tp_mult': 2.1958571622995104, 'bear_tsl_mult': 0.8139710053054654, 'bear_time_stop': 226, 'bear_use_sma': True, 'bear_use_ema': True, 'bear_use_atr': True, 'bear_use_adx': True, 'bear_use_spike': False, 'bear_rsi_required': True, 'sideways_strategy': 'breakout', 'sideways_bb_std_mult': 1.6145630346683284, 'sideways_rsi_os': 9, 'sideways_rsi_ob': 72, 'sideways_adx_thresh': 8.167629319737387, 'sideways_atr_min_pct': 0.018417259346893738, 'sideways_atr_max_pct': 0.06680658969730438, 'sideways_tp_mult': 2.8793735783509558, 'sideways_tsl_mult': 0.7642969170903322, 'sideways_time_stop': 46, 'sideways_use_sma': True, 'sideways_use_ema': False, 'sideways_use_atr': True, 'sideways_use_adx': True, 'sideways_use_spike': False, 'sideways_rsi_required': True}.
[I 2025-09-01 14:22:43,772] Trial 534 finished with values: [-1000000000.0, 1000000000.0] and parameters: {'p_sma': 37, 'p_std': 45, 'p_atr': 22, 'p_adx': 16, 'rsi_period': 59, 'ema1': 19, 'ema2': 47, 'slip_atr_k': 0.014743541007917332, 'slip_spread_k': 0.02740092487652928, 'spread_hl_frac': 0.0088230343130862, 'bb_std_mult': 2.6894740230470715, 'rsi_os': 37, 'rsi_ob': 87, 'vol_spike': 0.006582019276367285, 'adx_thresh': 19.984799243745606, 'atr_min_pct': 0.004512899917661576, 'atr_max_pct': 0.14660633801018014, 'tp_mult': 1.9324591785368106, 'tsl_mult': 0.34345355435223746, 'strategy': 'mean_reversion', 'time_stop': 169, 'use_sma': True, 'use_atr': False, 'use_adx': False, 'use_ema': False, 'use_spike': True, 'rsi_required': False, 'edge_k': 0.5760925846642307, 'edge_cap': 0.5761889225050097, 'bull_strategy': 'breakout', 'bull_bb_std_mult': 0.8923044937218947, 'bull_rsi_os': 7, 'bull_rsi_ob': 57, 'bull_adx_thresh': 30.62138167828437, 'bull_atr_min_pct': 0.018045669043821034, 'bull_atr_max_pct': 0.11287535257197565, 'bull_tp_mult': 2.9204119867751643, 'bull_tsl_mult': 0.5042636882512591, 'bull_time_stop': 279, 'bull_use_sma': False, 'bull_use_ema': True, 'bull_use_atr': True, 'bull_use_adx': True, 'bull_use_spike': False, 'bull_rsi_required': False, 'bear_strategy': 'mean_reversion', 'bear_bb_std_mult': 3.3176600760540396, 'bear_rsi_os': 53, 'bear_rsi_ob': 61, 'bear_adx_thresh': 12.514263667116232, 'bear_atr_min_pct': 0.0013072319667805973, 'bear_atr_max_pct': 0.0743395118284262, 'bear_tp_mult': 2.737374222832155, 'bear_tsl_mult': 0.39152134625924606, 'bear_time_stop': 218, 'bear_use_sma': True, 'bear_use_ema': True, 'bear_use_atr': True, 'bear_use_adx': True, 'bear_use_spike': False, 'bear_rsi_required': True, 'sideways_strategy': 'breakout', 'sideways_bb_std_mult': 1.3962281744245635, 'sideways_rsi_os': 53, 'sideways_rsi_ob': 72, 'sideways_adx_thresh': 34.18279000205336, 'sideways_atr_min_pct': 0.019542227716652455, 'sideways_atr_max_pct': 0.10180542166116298, 'sideways_tp_mult': 2.8857594697686437, 'sideways_tsl_mult': 0.303698900233921, 'sideways_time_stop': 174, 'sideways_use_sma': True, 'sideways_use_ema': True, 'sideways_use_atr': True, 'sideways_use_adx': True, 'sideways_use_spike': False, 'sideways_rsi_required': True}.
[I 2025-09-01 14:22:44,719] Trial 540 finished with values: [-1000000000.0, 1000000000.0] and parameters: {'p_sma': 58, 'p_std': 16, 'p_atr': 25, 'p_adx': 24, 'rsi_period': 70, 'ema1': 21, 'ema2': 20, 'slip_atr_k': 0.14968311367201387, 'slip_spread_k': 0.07132238999568043, 'spread_hl_frac': 0.039133966243631774, 'bb_std_mult': 1.6515998472936615, 'rsi_os': 39, 'rsi_ob': 49, 'vol_spike': 0.081815959076049, 'adx_thresh': 30.561822387884824, 'atr_min_pct': 0.027845433388559923, 'atr_max_pct': 0.1361652004659222, 'tp_mult': 1.2062700091869416, 'tsl_mult': 0.5836176137162075, 'strategy': 'mean_reversion', 'time_stop': 169, 'use_sma': True, 'use_atr': False, 'use_adx': True, 'use_ema': True, 'use_spike': True, 'rsi_required': True, 'edge_k': 0.8342815460297228, 'edge_cap': 0.21005929170400722, 'bull_strategy': 'mean_reversion', 'bull_bb_std_mult': 1.82096583681856, 'bull_rsi_os': 35, 'bull_rsi_ob': 53, 'bull_adx_thresh': 30.973877217527026, 'bull_atr_min_pct': 0.028073770391208314, 'bull_atr_max_pct': 0.13010323848342129, 'bull_tp_mult': 2.834511130628985, 'bull_tsl_mult': 0.4158291179395849, 'bull_time_stop': 278, 'bull_use_sma': True, 'bull_use_ema': False, 'bull_use_atr': False, 'bull_use_adx': True, 'bull_use_spike': False, 'bull_rsi_required': True, 'bear_strategy': 'breakout', 'bear_bb_std_mult': 3.4258318572709605, 'bear_rsi_os': 34, 'bear_rsi_ob': 60, 'bear_adx_thresh': 12.806913361094287, 'bear_atr_min_pct': 0.020307522648933766, 'bear_atr_max_pct': 0.03927290547911132, 'bear_tp_mult': 2.74809734541159, 'bear_tsl_mult': 0.10793048569778518, 'bear_time_stop': 197, 'bear_use_sma': False, 'bear_use_ema': False, 'bear_use_atr': False, 'bear_use_adx': False, 'bear_use_spike': False, 'bear_rsi_required': True, 'sideways_strategy': 'breakout', 'sideways_bb_std_mult': 3.556382836646306, 'sideways_rsi_os': 19, 'sideways_rsi_ob': 65, 'sideways_adx_thresh': 15.3884221072222, 'sideways_atr_min_pct': 0.003902324593669836, 'sideways_atr_max_pct': 0.07379647438482125, 'sideways_tp_mult': 2.744769953997371, 'sideways_tsl_mult': 0.2412402588688199, 'sideways_time_stop': 185, 'sideways_use_sma': True, 'sideways_use_ema': False, 'sideways_use_atr': True, 'sideways_use_adx': True, 'sideways_use_spike': False, 'sideways_rsi_required': True}.
[I 2025-09-01 14:23:21,927] Trial 539 finished with values: [-1000000000.0, 1000000000.0] and parameters: {'p_sma': 35, 'p_std': 28, 'p_atr': 23, 'p_adx': 12, 'rsi_period': 65, 'ema1': 21, 'ema2': 51, 'slip_atr_k': 0.028038086350302888, 'slip_spread_k': 0.06755535022966623, 'spread_hl_frac': 0.015305578046104286, 'bb_std_mult': 1.6482759257956625, 'rsi_os': 16, 'rsi_ob': 71, 'vol_spike': 0.21509365004785216, 'adx_thresh': 31.11478208541989, 'atr_min_pct': 0.027904848426516988, 'atr_max_pct': 0.131685072832364, 'tp_mult': 1.9435471072265342, 'tsl_mult': 0.5872988385691661, 'strategy': 'mean_reversion', 'time_stop': 217, 'use_sma': True, 'use_atr': False, 'use_adx': False, 'use_ema': True, 'use_spike': True, 'rsi_required': True, 'edge_k': 0.8463443161297618, 'edge_cap': 0.28321306668817325, 'bull_strategy': 'mean_reversion', 'bull_bb_std_mult': 3.4270254075032742, 'bull_rsi_os': 32, 'bull_rsi_ob': 53, 'bull_adx_thresh': 30.83679857060217, 'bull_atr_min_pct': 0.00607259880374318, 'bull_atr_max_pct': 0.13979985995094232, 'bull_tp_mult': 2.8204609366771525, 'bull_tsl_mult': 0.026805251449172396, 'bull_time_stop': 92, 'bull_use_sma': True, 'bull_use_ema': False, 'bull_use_atr': True, 'bull_use_adx': True, 'bull_use_spike': False, 'bull_rsi_required': True, 'bear_strategy': 'breakout', 'bear_bb_std_mult': 1.4542705705343644, 'bear_rsi_os': 32, 'bear_rsi_ob': 88, 'bear_adx_thresh': 32.76661497785969, 'bear_atr_min_pct': 0.0021463515015982737, 'bear_atr_max_pct': 0.03888568695316285, 'bear_tp_mult': 2.2193699002782896, 'bear_tsl_mult': 0.13599851503891025, 'bear_time_stop': 227, 'bear_use_sma': False, 'bear_use_ema': False, 'bear_use_atr': True, 'bear_use_adx': True, 'bear_use_spike': False, 'bear_rsi_required': True, 'sideways_strategy': 'breakout', 'sideways_bb_std_mult': 1.6473477028789079, 'sideways_rsi_os': 19, 'sideways_rsi_ob': 65, 'sideways_adx_thresh': 30.588415698212458, 'sideways_atr_min_pct': 0.0197365986727074, 'sideways_atr_max_pct': 0.012346724202923182, 'sideways_tp_mult': 2.7424731696414963, 'sideways_tsl_mult': 0.26038057238825796, 'sideways_time_stop': 186, 'sideways_use_sma': True, 'sideways_use_ema': False, 'sideways_use_atr': True, 'sideways_use_adx': True, 'sideways_use_spike': False, 'sideways_rsi_required': True}.
