[I 2025-09-01 13:51:08,862] Trial 316 finished with values: [-0.01826429498818738, 0.017637325338381405] and parameters: {'p_sma': 33, 'p_std': 38, 'p_atr': 8, 'p_adx': 11, 'rsi_period': 51, 'ema1': 13, 'ema2': 11, 'slip_atr_k': 0.01803783856298382, 'slip_spread_k': 0.07241507585379586, 'spread_hl_frac': 0.0075626711707440794, 'bb_std_mult': 1.319480210935493, 'rsi_os': 41, 'rsi_ob': 84, 'vol_spike': 0.23307114518966957, 'adx_thresh': 7.730677854508841, 'atr_min_pct': 0.026528127499410064, 'atr_max_pct': 0.08678968699397152, 'tp_mult': 1.0916932877453422, 'tsl_mult': 0.733489273733876, 'strategy': 'mean_reversion', 'time_stop': 215, 'use_sma': True, 'use_atr': False, 'use_adx': True, 'use_ema': True, 'use_spike': True, 'rsi_required': False, 'edge_k': 1.2970411040396281, 'edge_cap': 0.33506633985072554, 'bull_strategy': 'mean_reversion', 'bull_bb_std_mult': 3.3115859950362574, 'bull_rsi_os': 33, 'bull_rsi_ob': 91, 'bull_adx_thresh': 33.75139405168509, 'bull_atr_min_pct': 0.014417576533959963, 'bull_atr_max_pct': 0.0842097679692567, 'bull_tp_mult': 2.792825056133156, 'bull_tsl_mult': 0.45104321797339275, 'bull_time_stop': 79, 'bull_use_sma': True, 'bull_use_ema': True, 'bull_use_atr': True, 'bull_use_adx': True, 'bull_use_spike': False, 'bull_rsi_required': True, 'bear_strategy': 'breakout', 'bear_bb_std_mult': 3.598957533468756, 'bear_rsi_os': 36, 'bear_rsi_ob': 62, 'bear_adx_thresh': 14.804802596873134, 'bear_atr_min_pct': 0.003726912975970369, 'bear_atr_max_pct': 0.12997371991549994, 'bear_tp_mult': 2.2740579609933946, 'bear_tsl_mult': 0.15047898980219662, 'bear_time_stop': 97, 'bear_use_sma': True, 'bear_use_ema': True, 'bear_use_atr': True, 'bear_use_adx': True, 'bear_use_spike': False, 'bear_rsi_required': True, 'sideways_strategy': 'breakout', 'sideways_bb_std_mult': 1.109213015078601, 'sideways_rsi_os': 51, 'sideways_rsi_ob': 45, 'sideways_adx_thresh': 17.80722515310233, 'sideways_atr_min_pct': 0.019563466172798846, 'sideways_atr_max_pct': 0.06762493436643344, 'sideways_tp_mult': 2.746526500874078, 'sideways_tsl_mult': 0.27729185491905173, 'sideways_time_stop': 63, 'sideways_use_sma': True, 'sideways_use_ema': False, 'sideways_use_atr': True, 'sideways_use_adx': True, 'sideways_use_spike': False, 'sideways_rsi_required': True}.
[I 2025-09-01 13:51:09,202] Trial 315 finished with values: [-1000000000.0, 1000000000.0] and parameters: {'p_sma': 33, 'p_std': 31, 'p_atr': 8, 'p_adx': 11, 'rsi_period': 51, 'ema1': 29, 'ema2': 15, 'slip_atr_k': 0.15243108567833843, 'slip_spread_k': 0.13611729949916324, 'spread_hl_frac': 0.03976988875303321, 'bb_std_mult': 1.3317193836879675, 'rsi_os': 41, 'rsi_ob': 84, 'vol_spike': 0.23293072305288096, 'adx_thresh': 19.606443187807265, 'atr_min_pct': 0.026346539330244226, 'atr_max_pct': 0.08703401047147714, 'tp_mult': 1.096185552072826, 'tsl_mult': 0.661499452822107, 'strategy': 'mean_reversion', 'time_stop': 250, 'use_sma': True, 'use_atr': False, 'use_adx': True, 'use_ema': True, 'use_spike': True, 'rsi_required': False, 'edge_k': 0.7873268404772409, 'edge_cap': 0.32917016896714424, 'bull_strategy': 'mean_reversion', 'bull_bb_std_mult': 3.3063136859234685, 'bull_rsi_os': 35, 'bull_rsi_ob': 53, 'bull_adx_thresh': 31.30540100986, 'bull_atr_min_pct': 0.0053634532507107315, 'bull_atr_max_pct': 0.0836951403293957, 'bull_tp_mult': 2.998525841758365, 'bull_tsl_mult': 0.4437762359378774, 'bull_time_stop': 269, 'bull_use_sma': False, 'bull_use_ema': True, 'bull_use_atr': True, 'bull_use_adx': True, 'bull_use_spike': True, 'bull_rsi_required': True, 'bear_strategy': 'breakout', 'bear_bb_std_mult': 2.0306714873762135, 'bear_rsi_os': 36, 'bear_rsi_ob': 87, 'bear_adx_thresh': 16.227152489175836, 'bear_atr_min_pct': 0.01713541021153852, 'bear_atr_max_pct': 0.13841496042273016, 'bear_tp_mult': 2.297991752339018, 'bear_tsl_mult': 0.1487260419121827, 'bear_time_stop': 238, 'bear_use_sma': True, 'bear_use_ema': True, 'bear_use_atr': False, 'bear_use_adx': True, 'bear_use_spike': False, 'bear_rsi_required': True, 'sideways_strategy': 'breakout', 'sideways_bb_std_mult': 1.4900253087213493, 'sideways_rsi_os': 51, 'sideways_rsi_ob': 54, 'sideways_adx_thresh': 7.899446472389524, 'sideways_atr_min_pct': 0.01987531138384314, 'sideways_atr_max_pct': 0.06927473700846999, 'sideways_tp_mult': 2.7154149326632564, 'sideways_tsl_mult': 0.19530944564672914, 'sideways_time_stop': 64, 'sideways_use_sma': True, 'sideways_use_ema': False, 'sideways_use_atr': True, 'sideways_use_adx': True, 'sideways_use_spike': False, 'sideways_rsi_required': True}.
[I 2025-09-01 13:51:09,767] Trial 317 finished with values: [-0.24722010141516493, 0.24708928567916988] and parameters: {'p_sma': 39, 'p_std': 52, 'p_atr': 14, 'p_adx': 11, 'rsi_period': 41, 'ema1': 21, 'ema2': 13, 'slip_atr_k': 0.03051665033487433, 'slip_spread_k': 0.13722648702974782, 'spread_hl_frac': 0.008256217614150718, 'bb_std_mult': 1.856925860958735, 'rsi_os': 38, 'rsi_ob': 84, 'vol_spike': 0.15138801994195847, 'adx_thresh': 24.578695403611086, 'atr_min_pct': 0.020748039739790086, 'atr_max_pct': 0.08646136750551818, 'tp_mult': 1.1030589447377002, 'tsl_mult': 0.6651114508982094, 'strategy': 'mean_reversion', 'time_stop': 175, 'use_sma': True, 'use_atr': False, 'use_adx': True, 'use_ema': True, 'use_spike': True, 'rsi_required': False, 'edge_k': 1.9217653054129173, 'edge_cap': 0.3271842764350338, 'bull_strategy': 'mean_reversion', 'bull_bb_std_mult': 3.303998097794772, 'bull_rsi_os': 20, 'bull_rsi_ob': 91, 'bull_adx_thresh': 32.57980461311062, 'bull_atr_min_pct': 0.003651007013425752, 'bull_atr_max_pct': 0.023257792089453062, 'bull_tp_mult': 2.461811538213583, 'bull_tsl_mult': 0.30391097980947474, 'bull_time_stop': 77, 'bull_use_sma': True, 'bull_use_ema': True, 'bull_use_atr': True, 'bull_use_adx': True, 'bull_use_spike': False, 'bull_rsi_required': True, 'bear_strategy': 'breakout', 'bear_bb_std_mult': 2.615381601946836, 'bear_rsi_os': 54, 'bear_rsi_ob': 58, 'bear_adx_thresh': 24.144976033940043, 'bear_atr_min_pct': 0.0036586563300059593, 'bear_atr_max_pct': 0.053256660583315074, 'bear_tp_mult': 2.280811407319307, 'bear_tsl_mult': 0.15225769255926283, 'bear_time_stop': 143, 'bear_use_sma': True, 'bear_use_ema': True, 'bear_use_atr': True, 'bear_use_adx': True, 'bear_use_spike': False, 'bear_rsi_required': True, 'sideways_strategy': 'breakout', 'sideways_bb_std_mult': 1.412494983599026, 'sideways_rsi_os': 51, 'sideways_rsi_ob': 68, 'sideways_adx_thresh': 17.637831049954524, 'sideways_atr_min_pct': 0.000822505199193942, 'sideways_atr_max_pct': 0.06875622474366475, 'sideways_tp_mult': 2.7368314360778863, 'sideways_tsl_mult': 0.2708592075591419, 'sideways_time_stop': 175, 'sideways_use_sma': True, 'sideways_use_ema': False, 'sideways_use_atr': True, 'sideways_use_adx': True, 'sideways_use_spike': False, 'sideways_rsi_required': True}.
[I 2025-09-01 13:51:44,907] Trial 318 finished with values: [-0.34339031445927903, 0.3432780668233811] and parameters: {'p_sma': 23, 'p_std': 7, 'p_atr': 14, 'p_adx': 11, 'rsi_period': 51, 'ema1': 27, 'ema2': 32, 'slip_atr_k': 0.016270163830548412, 'slip_spread_k': 0.13748367593259608, 'spread_hl_frac': 0.0082161954592711, 'bb_std_mult': 1.8520581676933776, 'rsi_os': 38, 'rsi_ob': 84, 'vol_spike': 0.2924570416667235, 'adx_thresh': 19.528526495040296, 'atr_min_pct': 0.013247498885847291, 'atr_max_pct': 0.06909852691326701, 'tp_mult': 1.998099684460436, 'tsl_mult': 0.9408503071352196, 'strategy': 'mean_reversion', 'time_stop': 173, 'use_sma': True, 'use_atr': False, 'use_adx': True, 'use_ema': True, 'use_spike': True, 'rsi_required': False, 'edge_k': 0.9262607637051985, 'edge_cap': 0.3287023282132567, 'bull_strategy': 'mean_reversion', 'bull_bb_std_mult': 1.2434258699912628, 'bull_rsi_os': 19, 'bull_rsi_ob': 57, 'bull_adx_thresh': 33.65611364822572, 'bull_atr_min_pct': 0.013991881452132286, 'bull_atr_max_pct': 0.12173391671609482, 'bull_tp_mult': 2.475199980911016, 'bull_tsl_mult': 0.10252086983022785, 'bull_time_stop': 75, 'bull_use_sma': True, 'bull_use_ema': True, 'bull_use_atr': True, 'bull_use_adx': True, 'bull_use_spike': False, 'bull_rsi_required': True, 'bear_strategy': 'breakout', 'bear_bb_std_mult': 2.6000970454823733, 'bear_rsi_os': 36, 'bear_rsi_ob': 87, 'bear_adx_thresh': 13.704717601143356, 'bear_atr_min_pct': 0.01899993003003459, 'bear_atr_max_pct': 0.1297181979070886, 'bear_tp_mult': 1.3217969011209498, 'bear_tsl_mult': 0.14120654653507783, 'bear_time_stop': 219, 'bear_use_sma': True, 'bear_use_ema': True, 'bear_use_atr': True, 'bear_use_adx': True, 'bear_use_spike': False, 'bear_rsi_required': True, 'sideways_strategy': 'breakout', 'sideways_bb_std_mult': 1.5487137360306606, 'sideways_rsi_os': 51, 'sideways_rsi_ob': 68, 'sideways_adx_thresh': 6.71023640218578, 'sideways_atr_min_pct': 0.0007127375034992819, 'sideways_atr_max_pct': 0.06775237531213193, 'sideways_tp_mult': 2.6774418291291675, 'sideways_tsl_mult': 0.20628589082966964, 'sideways_time_stop': 173, 'sideways_use_sma': True, 'sideways_use_ema': False, 'sideways_use_atr': True, 'sideways_use_adx': True, 'sideways_use_spike': False, 'sideways_rsi_required': True}.
[I 2025-09-01 13:51:45,147] Trial 320 finished with values: [-1000000000.0, 1000000000.0] and parameters: {'p_sma': 5, 'p_std': 7, 'p_atr': 22, 'p_adx': 27, 'rsi_period': 42, 'ema1': 11, 'ema2': 18, 'slip_atr_k': 0.03203372967987569, 'slip_spread_k': 0.8197872340290384, 'spread_hl_frac': 0.007910545733746168, 'bb_std_mult': 2.780214659469819, 'rsi_os': 6, 'rsi_ob': 80, 'vol_spike': 0.24703416157445232, 'adx_thresh': 24.287703860247127, 'atr_min_pct': 0.025113024371407958, 'atr_max_pct': 0.07452561860355297, 'tp_mult': 2.0050695394065383, 'tsl_mult': 0.8369917308031476, 'strategy': 'mean_reversion', 'time_stop': 172, 'use_sma': True, 'use_atr': False, 'use_adx': True, 'use_ema': True, 'use_spike': True, 'rsi_required': False, 'edge_k': 0.7046465752529486, 'edge_cap': 0.4491563164464455, 'bull_strategy': 'mean_reversion', 'bull_bb_std_mult': 3.1988725414005246, 'bull_rsi_os': 18, 'bull_rsi_ob': 57, 'bull_adx_thresh': 33.69519825733958, 'bull_atr_min_pct': 0.0030376541447286933, 'bull_atr_max_pct': 0.022308071763506604, 'bull_tp_mult': 2.525119637980238, 'bull_tsl_mult': 0.40319777131099227, 'bull_time_stop': 80, 'bull_use_sma': True, 'bull_use_ema': True, 'bull_use_atr': True, 'bull_use_adx': True, 'bull_use_spike': False, 'bull_rsi_required': True, 'bear_strategy': 'breakout', 'bear_bb_std_mult': 3.5974134158549815, 'bear_rsi_os': 54, 'bear_rsi_ob': 80, 'bear_adx_thresh': 13.987697901141196, 'bear_atr_min_pct': 0.01907962988208704, 'bear_atr_max_pct': 0.1460071054676997, 'bear_tp_mult': 1.2122796673205245, 'bear_tsl_mult': 0.12507909298962286, 'bear_time_stop': 113, 'bear_use_sma': True, 'bear_use_ema': True, 'bear_use_atr': True, 'bear_use_adx': True, 'bear_use_spike': False, 'bear_rsi_required': True, 'sideways_strategy': 'breakout', 'sideways_bb_std_mult': 1.7230255153264882, 'sideways_rsi_os': 52, 'sideways_rsi_ob': 68, 'sideways_adx_thresh': 6.721255532075047, 'sideways_atr_min_pct': 0.01928949739631156, 'sideways_atr_max_pct': 0.019567622012954602, 'sideways_tp_mult': 2.6603566326376105, 'sideways_tsl_mult': 0.944377832375437, 'sideways_time_stop': 172, 'sideways_use_sma': True, 'sideways_use_ema': False, 'sideways_use_atr': True, 'sideways_use_adx': True, 'sideways_use_spike': False, 'sideways_rsi_required': True}.
[I 2025-09-01 13:51:45,429] Trial 319 finished with values: [-1000000000.0, 1000000000.0] and parameters: {'p_sma': 6, 'p_std': 7, 'p_atr': 8, 'p_adx': 11, 'rsi_period': 66, 'ema1': 10, 'ema2': 18, 'slip_atr_k': 0.01679520805031334, 'slip_spread_k': 0.07032821179928445, 'spread_hl_frac': 0.04585512962320103, 'bb_std_mult': 2.230199869747599, 'rsi_os': 38, 'rsi_ob': 85, 'vol_spike': 0.2327273892897412, 'adx_thresh': 7.693288049992109, 'atr_min_pct': 0.014691273922553276, 'atr_max_pct': 0.13273820856487248, 'tp_mult': 1.1105544880092826, 'tsl_mult': 0.6702566140500251, 'strategy': 'mean_reversion', 'time_stop': 126, 'use_sma': True, 'use_atr': False, 'use_adx': True, 'use_ema': True, 'use_spike': True, 'rsi_required': False, 'edge_k': 1.2683292061110563, 'edge_cap': 0.6315204403603187, 'bull_strategy': 'mean_reversion', 'bull_bb_std_mult': 3.315615239816894, 'bull_rsi_os': 30, 'bull_rsi_ob': 57, 'bull_adx_thresh': 33.68970347031451, 'bull_atr_min_pct': 0.013547271524303016, 'bull_atr_max_pct': 0.02289139778307014, 'bull_tp_mult': 2.4960659025006473, 'bull_tsl_mult': 0.700556434645218, 'bull_time_stop': 267, 'bull_use_sma': True, 'bull_use_ema': True, 'bull_use_atr': True, 'bull_use_adx': True, 'bull_use_spike': False, 'bull_rsi_required': True, 'bear_strategy': 'breakout', 'bear_bb_std_mult': 3.5930720625249313, 'bear_rsi_os': 36, 'bear_rsi_ob': 87, 'bear_adx_thresh': 19.210645878773295, 'bear_atr_min_pct': 0.016111764013937893, 'bear_atr_max_pct': 0.1379347212694091, 'bear_tp_mult': 1.72575833062529, 'bear_tsl_mult': 0.6823110537344648, 'bear_time_stop': 144, 'bear_use_sma': True, 'bear_use_ema': True, 'bear_use_atr': True, 'bear_use_adx': True, 'bear_use_spike': False, 'bear_rsi_required': True, 'sideways_strategy': 'breakout', 'sideways_bb_std_mult': 1.3632150584079716, 'sideways_rsi_os': 51, 'sideways_rsi_ob': 56, 'sideways_adx_thresh': 32.135544564055, 'sideways_atr_min_pct': 0.01959190380350972, 'sideways_atr_max_pct': 0.068379629638823, 'sideways_tp_mult': 2.670575950195754, 'sideways_tsl_mult': 0.22059865356350572, 'sideways_time_stop': 211, 'sideways_use_sma': True, 'sideways_use_ema': False, 'sideways_use_atr': True, 'sideways_use_adx': True, 'sideways_use_spike': False, 'sideways_rsi_required': True}.
[I 2025-09-01 13:51:45,768] Trial 321 finished with values: [-1000000000.0, 1000000000.0] and parameters: {'p_sma': 17, 'p_std': 50, 'p_atr': 25, 'p_adx': 12, 'rsi_period': 65, 'ema1': 21, 'ema2': 17, 'slip_atr_k': 0.017615905466200853, 'slip_spread_k': 0.07023159318354107, 'spread_hl_frac': 0.03599534295966151, 'bb_std_mult': 2.252916165905763, 'rsi_os': 39, 'rsi_ob': 85, 'vol_spike': 0.12570405733422918, 'adx_thresh': 25.824967184513568, 'atr_min_pct': 0.014798983588737978, 'atr_max_pct': 0.06306495252295018, 'tp_mult': 1.0557724028186612, 'tsl_mult': 0.7334734777799361, 'strategy': 'mean_reversion', 'time_stop': 134, 'use_sma': True, 'use_atr': False, 'use_adx': False, 'use_ema': True, 'use_spike': True, 'rsi_required': False, 'edge_k': 0.700006913380942, 'edge_cap': 0.3841294820821454, 'bull_strategy': 'breakout', 'bull_bb_std_mult': 2.676034201780251, 'bull_rsi_os': 32, 'bull_rsi_ob': 56, 'bull_adx_thresh': 33.419658592863286, 'bull_atr_min_pct': 0.0028700318643552283, 'bull_atr_max_pct': 0.02150707762912162, 'bull_tp_mult': 2.7932925305563177, 'bull_tsl_mult': 0.4060672881392975, 'bull_time_stop': 249, 'bull_use_sma': True, 'bull_use_ema': True, 'bull_use_atr': True, 'bull_use_adx': True, 'bull_use_spike': False, 'bull_rsi_required': True, 'bear_strategy': 'breakout', 'bear_bb_std_mult': 3.3286615469131733, 'bear_rsi_os': 31, 'bear_rsi_ob': 88, 'bear_adx_thresh': 26.75395230700048, 'bear_atr_min_pct': 0.009357444638995738, 'bear_atr_max_pct': 0.04431298425044579, 'bear_tp_mult': 1.740340684085312, 'bear_tsl_mult': 0.11981096095697172, 'bear_time_stop': 223, 'bear_use_sma': True, 'bear_use_ema': True, 'bear_use_atr': True, 'bear_use_adx': True, 'bear_use_spike': False, 'bear_rsi_required': True, 'sideways_strategy': 'breakout', 'sideways_bb_std_mult': 1.7338123890158605, 'sideways_rsi_os': 52, 'sideways_rsi_ob': 74, 'sideways_adx_thresh': 6.7277017710921845, 'sideways_atr_min_pct': 0.01613186351852536, 'sideways_atr_max_pct': 0.0798637927601762, 'sideways_tp_mult': 2.8055346934840677, 'sideways_tsl_mult': 0.2805883235959067, 'sideways_time_stop': 246, 'sideways_use_sma': True, 'sideways_use_ema': False, 'sideways_use_atr': True, 'sideways_use_adx': True, 'sideways_use_spike': False, 'sideways_rsi_required': True}.
[I 2025-09-01 13:52:23,018] Trial 325 finished with values: [-1000000000.0, 1000000000.0] and parameters: {'p_sma': 34, 'p_std': 48, 'p_atr': 25, 'p_adx': 12, 'rsi_period': 69, 'ema1': 26, 'ema2': 17, 'slip_atr_k': 0.025334789441178618, 'slip_spread_k': 0.11189641273087561, 'spread_hl_frac': 0.044366748510629536, 'bb_std_mult': 1.4971118104513836, 'rsi_os': 29, 'rsi_ob': 81, 'vol_spike': 0.25276210016208783, 'adx_thresh': 25.408397205568978, 'atr_min_pct': 0.02714729601901143, 'atr_max_pct': 0.11164099625341446, 'tp_mult': 1.1496904023084273, 'tsl_mult': 0.7618885528599278, 'strategy': 'mean_reversion', 'time_stop': 224, 'use_sma': True, 'use_atr': False, 'use_adx': False, 'use_ema': False, 'use_spike': True, 'rsi_required': False, 'edge_k': 1.0303031783648766, 'edge_cap': 0.26857199601377046, 'bull_strategy': 'breakout', 'bull_bb_std_mult': 3.1755548246893657, 'bull_rsi_os': 33, 'bull_rsi_ob': 55, 'bull_adx_thresh': 29.98981336536072, 'bull_atr_min_pct': 0.0045079073890633824, 'bull_atr_max_pct': 0.03134567492344946, 'bull_tp_mult': 2.648227111250855, 'bull_tsl_mult': 0.46163923218376707, 'bull_time_stop': 242, 'bull_use_sma': True, 'bull_use_ema': False, 'bull_use_atr': True, 'bull_use_adx': False, 'bull_use_spike': False, 'bull_rsi_required': False, 'bear_strategy': 'breakout', 'bear_bb_std_mult': 1.3841626745500415, 'bear_rsi_os': 6, 'bear_rsi_ob': 90, 'bear_adx_thresh': 27.54880630555032, 'bear_atr_min_pct': 0.0009528240101020348, 'bear_atr_max_pct': 0.03781813134177548, 'bear_tp_mult': 2.3414307915953105, 'bear_tsl_mult': 0.19227061906202936, 'bear_time_stop': 98, 'bear_use_sma': True, 'bear_use_ema': True, 'bear_use_atr': True, 'bear_use_adx': True, 'bear_use_spike': True, 'bear_rsi_required': True, 'sideways_strategy': 'breakout', 'sideways_bb_std_mult': 1.627239138222133, 'sideways_rsi_os': 48, 'sideways_rsi_ob': 65, 'sideways_adx_thresh': 6.250611787684965, 'sideways_atr_min_pct': 0.021123325198042248, 'sideways_atr_max_pct': 0.14727578438651234, 'sideways_tp_mult': 2.7871198777798587, 'sideways_tsl_mult': 0.044357017790237596, 'sideways_time_stop': 48, 'sideways_use_sma': True, 'sideways_use_ema': True, 'sideways_use_atr': False, 'sideways_use_adx': True, 'sideways_use_spike': False, 'sideways_rsi_required': False}.
[I 2025-09-01 13:52:23,390] Trial 323 finished with values: [-1000000000.0, 1000000000.0] and parameters: {'p_sma': 18, 'p_std': 50, 'p_atr': 25, 'p_adx': 16, 'rsi_period': 66, 'ema1': 21, 'ema2': 17, 'slip_atr_k': 0.022093548392446004, 'slip_spread_k': 0.07029500737948441, 'spread_hl_frac': 0.045888395609366084, 'bb_std_mult': 1.5050278764539349, 'rsi_os': 10, 'rsi_ob': 81, 'vol_spike': 0.23123612500548896, 'adx_thresh': 6.46400273993317, 'atr_min_pct': 0.014414610953276225, 'atr_max_pct': 0.1496763942081079, 'tp_mult': 1.0492740427179854, 'tsl_mult': 0.7556686588584761, 'strategy': 'mean_reversion', 'time_stop': 130, 'use_sma': True, 'use_atr': False, 'use_adx': False, 'use_ema': False, 'use_spike': True, 'rsi_required': False, 'edge_k': 0.9142973004689132, 'edge_cap': 0.2917995757815718, 'bull_strategy': 'breakout', 'bull_bb_std_mult': 2.693725208133782, 'bull_rsi_os': 32, 'bull_rsi_ob': 50, 'bull_adx_thresh': 29.96024370464928, 'bull_atr_min_pct': 0.014733421080966317, 'bull_atr_max_pct': 0.08862286105988383, 'bull_tp_mult': 2.7959672232738773, 'bull_tsl_mult': 0.58750070335189, 'bull_time_stop': 107, 'bull_use_sma': True, 'bull_use_ema': True, 'bull_use_atr': True, 'bull_use_adx': True, 'bull_use_spike': False, 'bull_rsi_required': False, 'bear_strategy': 'breakout', 'bear_bb_std_mult': 3.4913247938726575, 'bear_rsi_os': 38, 'bear_rsi_ob': 88, 'bear_adx_thresh': 27.415295574185542, 'bear_atr_min_pct': 0.015914677046766426, 'bear_atr_max_pct': 0.038257179116262384, 'bear_tp_mult': 2.3279357697537915, 'bear_tsl_mult': 0.9512716473873606, 'bear_time_stop': 227, 'bear_use_sma': True, 'bear_use_ema': True, 'bear_use_atr': True, 'bear_use_adx': True, 'bear_use_spike': False, 'bear_rsi_required': True, 'sideways_strategy': 'breakout', 'sideways_bb_std_mult': 1.0906496549845406, 'sideways_rsi_os': 50, 'sideways_rsi_ob': 83, 'sideways_adx_thresh': 5.009417513443619, 'sideways_atr_min_pct': 0.025998114607449066, 'sideways_atr_max_pct': 0.0635708665319806, 'sideways_tp_mult': 2.792547760853543, 'sideways_tsl_mult': 0.0008102506576697088, 'sideways_time_stop': 242, 'sideways_use_sma': True, 'sideways_use_ema': True, 'sideways_use_atr': True, 'sideways_use_adx': True, 'sideways_use_spike': False, 'sideways_rsi_required': False}.
