[I 2025-09-01 13:29:25,767] Trial 180 finished with values: [-1000000000.0, 1000000000.0] and parameters: {'p_sma': 52, 'p_std': 44, 'p_atr': 18, 'p_adx': 20, 'rsi_period': 53, 'ema1': 27, 'ema2': 14, 'slip_atr_k': 0.10057718454081825, 'slip_spread_k': 0.942203955156987, 'spread_hl_frac': 0.02930315195894868, 'bb_std_mult': 1.0459164056286696, 'rsi_os': 19, 'rsi_ob': 92, 'vol_spike': 0.2356373914410242, 'adx_thresh': 10.108891302739988, 'atr_min_pct': 0.02479343449598244, 'atr_max_pct': 0.013745953076719067, 'tp_mult': 1.6260083939509862, 'tsl_mult': 0.9163630438014512, 'strategy': 'breakout', 'time_stop': 99, 'use_sma': True, 'use_atr': False, 'use_adx': False, 'use_ema': True, 'use_spike': True, 'rsi_required': True, 'edge_k': 0.31234210532261947, 'edge_cap': 0.80339046009721, 'bull_strategy': 'mean_reversion', 'bull_bb_std_mult': 3.214455441765661, 'bull_rsi_os': 40, 'bull_rsi_ob': 59, 'bull_adx_thresh': 19.209542665173274, 'bull_atr_min_pct': 0.029087096318607147, 'bull_atr_max_pct': 0.1363776621103937, 'bull_tp_mult': 1.0746916157107151, 'bull_tsl_mult': 0.34754025570043423, 'bull_time_stop': 18, 'bull_use_sma': True, 'bull_use_ema': True, 'bull_use_atr': True, 'bull_use_adx': True, 'bull_use_spike': False, 'bull_rsi_required': True, 'bear_strategy': 'mean_reversion', 'bear_bb_std_mult': 3.467545075814863, 'bear_rsi_os': 13, 'bear_rsi_ob': 66, 'bear_adx_thresh': 7.15736600316346, 'bear_atr_min_pct': 0.020643052818019633, 'bear_atr_max_pct': 0.08148880902671349, 'bear_tp_mult': 2.5084988368952064, 'bear_tsl_mult': 0.09769325114822291, 'bear_time_stop': 276, 'bear_use_sma': True, 'bear_use_ema': False, 'bear_use_atr': True, 'bear_use_adx': True, 'bear_use_spike': False, 'bear_rsi_required': True, 'sideways_strategy': 'mean_reversion', 'sideways_bb_std_mult': 2.236377074572293, 'sideways_rsi_os': 31, 'sideways_rsi_ob': 93, 'sideways_adx_thresh': 19.455499147975324, 'sideways_atr_min_pct': 0.01860065335738087, 'sideways_atr_max_pct': 0.024324713164310605, 'sideways_tp_mult': 1.2858043429991952, 'sideways_tsl_mult': 0.17150990171057678, 'sideways_time_stop': 12, 'sideways_use_sma': True, 'sideways_use_ema': False, 'sideways_use_atr': True, 'sideways_use_adx': False, 'sideways_use_spike': False, 'sideways_rsi_required': True}.
[I 2025-09-01 13:30:02,199] Trial 183 finished with values: [-1000000000.0, 1000000000.0] and parameters: {'p_sma': 51, 'p_std': 20, 'p_atr': 22, 'p_adx': 19, 'rsi_period': 77, 'ema1': 21, 'ema2': 37, 'slip_atr_k': 0.21341233544216656, 'slip_spread_k': 0.3883758783858438, 'spread_hl_frac': 0.010711779137185618, 'bb_std_mult': 1.453712837140096, 'rsi_os': 38, 'rsi_ob': 59, 'vol_spike': 0.25492283981589503, 'adx_thresh': 8.109446263401814, 'atr_min_pct': 0.003953688927097246, 'atr_max_pct': 0.014842356301325826, 'tp_mult': 1.5941126143368325, 'tsl_mult': 0.6297885364804935, 'strategy': 'breakout', 'time_stop': 276, 'use_sma': True, 'use_atr': False, 'use_adx': True, 'use_ema': True, 'use_spike': True, 'rsi_required': False, 'edge_k': 1.373329703966152, 'edge_cap': 0.8393811684491077, 'bull_strategy': 'breakout', 'bull_bb_std_mult': 3.191167277604716, 'bull_rsi_os': 50, 'bull_rsi_ob': 88, 'bull_adx_thresh': 14.226917624748328, 'bull_atr_min_pct': 0.010351897196687266, 'bull_atr_max_pct': 0.14591259254002406, 'bull_tp_mult': 1.2292896246533402, 'bull_tsl_mult': 0.8067575268180859, 'bull_time_stop': 61, 'bull_use_sma': True, 'bull_use_ema': True, 'bull_use_atr': True, 'bull_use_adx': True, 'bull_use_spike': True, 'bull_rsi_required': True, 'bear_strategy': 'breakout', 'bear_bb_std_mult': 2.142776815490089, 'bear_rsi_os': 12, 'bear_rsi_ob': 65, 'bear_adx_thresh': 9.276157657437079, 'bear_atr_min_pct': 0.01749570946448088, 'bear_atr_max_pct': 0.08408455474030448, 'bear_tp_mult': 2.503955712045826, 'bear_tsl_mult': 0.5993900569582713, 'bear_time_stop': 271, 'bear_use_sma': True, 'bear_use_ema': False, 'bear_use_atr': True, 'bear_use_adx': True, 'bear_use_spike': False, 'bear_rsi_required': True, 'sideways_strategy': 'mean_reversion', 'sideways_bb_std_mult': 2.229764373576331, 'sideways_rsi_os': 7, 'sideways_rsi_ob': 65, 'sideways_adx_thresh': 12.276482493080403, 'sideways_atr_min_pct': 0.008684617924710761, 'sideways_atr_max_pct': 0.027808897787905268, 'sideways_tp_mult': 2.64811208609542, 'sideways_tsl_mult': 0.1593561232912083, 'sideways_time_stop': 14, 'sideways_use_sma': True, 'sideways_use_ema': False, 'sideways_use_atr': True, 'sideways_use_adx': False, 'sideways_use_spike': False, 'sideways_rsi_required': True}.
[I 2025-09-01 13:30:02,201] Trial 181 finished with values: [-1000000000.0, 1000000000.0] and parameters: {'p_sma': 52, 'p_std': 41, 'p_atr': 7, 'p_adx': 19, 'rsi_period': 71, 'ema1': 21, 'ema2': 38, 'slip_atr_k': 0.21673809933507088, 'slip_spread_k': 0.38505627985729307, 'spread_hl_frac': 0.024731355562337357, 'bb_std_mult': 2.440317961874853, 'rsi_os': 38, 'rsi_ob': 65, 'vol_spike': 0.0979049174757656, 'adx_thresh': 10.037477069086147, 'atr_min_pct': 0.0037684171185881424, 'atr_max_pct': 0.013945694290987312, 'tp_mult': 1.484569609811952, 'tsl_mult': 0.6243229592423091, 'strategy': 'breakout', 'time_stop': 101, 'use_sma': True, 'use_atr': False, 'use_adx': True, 'use_ema': True, 'use_spike': True, 'rsi_required': True, 'edge_k': 1.3819555622065256, 'edge_cap': 0.8637689178890616, 'bull_strategy': 'breakout', 'bull_bb_std_mult': 3.107643468818359, 'bull_rsi_os': 34, 'bull_rsi_ob': 62, 'bull_adx_thresh': 13.783889064925148, 'bull_atr_min_pct': 0.014824511070500498, 'bull_atr_max_pct': 0.019452196983953292, 'bull_tp_mult': 2.9957389622535944, 'bull_tsl_mult': 0.7958050762938326, 'bull_time_stop': 187, 'bull_use_sma': True, 'bull_use_ema': True, 'bull_use_atr': True, 'bull_use_adx': True, 'bull_use_spike': True, 'bull_rsi_required': True, 'bear_strategy': 'breakout', 'bear_bb_std_mult': 1.9356294283615627, 'bear_rsi_os': 12, 'bear_rsi_ob': 73, 'bear_adx_thresh': 20.7167303785839, 'bear_atr_min_pct': 0.02173698807589403, 'bear_atr_max_pct': 0.043593314383883905, 'bear_tp_mult': 1.1048181267569137, 'bear_tsl_mult': 0.9079482568705188, 'bear_time_stop': 222, 'bear_use_sma': True, 'bear_use_ema': False, 'bear_use_atr': True, 'bear_use_adx': True, 'bear_use_spike': False, 'bear_rsi_required': True, 'sideways_strategy': 'mean_reversion', 'sideways_bb_std_mult': 2.4891854864954, 'sideways_rsi_os': 38, 'sideways_rsi_ob': 95, 'sideways_adx_thresh': 29.45265046942482, 'sideways_atr_min_pct': 0.012783422613344402, 'sideways_atr_max_pct': 0.11399793825703088, 'sideways_tp_mult': 2.2700608466039762, 'sideways_tsl_mult': 0.4901186872914075, 'sideways_time_stop': 12, 'sideways_use_sma': True, 'sideways_use_ema': False, 'sideways_use_atr': True, 'sideways_use_adx': False, 'sideways_use_spike': False, 'sideways_rsi_required': True}.
[I 2025-09-01 13:30:02,667] Trial 184 finished with values: [-1000000000.0, 1000000000.0] and parameters: {'p_sma': 53, 'p_std': 48, 'p_atr': 7, 'p_adx': 26, 'rsi_period': 70, 'ema1': 21, 'ema2': 19, 'slip_atr_k': 0.11582487089890339, 'slip_spread_k': 0.39444557560634713, 'spread_hl_frac': 0.01069682812438171, 'bb_std_mult': 1.4065915135020843, 'rsi_os': 38, 'rsi_ob': 89, 'vol_spike': 0.2692564481013529, 'adx_thresh': 28.531146090883247, 'atr_min_pct': 0.003773305904886619, 'atr_max_pct': 0.041618367328359156, 'tp_mult': 1.484090474392822, 'tsl_mult': 0.6227584563385293, 'strategy': 'breakout', 'time_stop': 79, 'use_sma': True, 'use_atr': True, 'use_adx': True, 'use_ema': True, 'use_spike': True, 'rsi_required': True, 'edge_k': 0.4904786526169065, 'edge_cap': 0.8395326210218059, 'bull_strategy': 'breakout', 'bull_bb_std_mult': 3.13009888344368, 'bull_rsi_os': 50, 'bull_rsi_ob': 57, 'bull_adx_thresh': 13.58675380758709, 'bull_atr_min_pct': 0.010152454706088469, 'bull_atr_max_pct': 0.01846874561052561, 'bull_tp_mult': 1.847665384737724, 'bull_tsl_mult': 0.796752023845082, 'bull_time_stop': 60, 'bull_use_sma': True, 'bull_use_ema': True, 'bull_use_atr': True, 'bull_use_adx': True, 'bull_use_spike': True, 'bull_rsi_required': True, 'bear_strategy': 'breakout', 'bear_bb_std_mult': 1.1890608925119768, 'bear_rsi_os': 12, 'bear_rsi_ob': 95, 'bear_adx_thresh': 11.777745040109046, 'bear_atr_min_pct': 0.021674831702665515, 'bear_atr_max_pct': 0.08460908344063732, 'bear_tp_mult': 1.1061643148858642, 'bear_tsl_mult': 0.16110953294840646, 'bear_time_stop': 271, 'bear_use_sma': True, 'bear_use_ema': False, 'bear_use_atr': True, 'bear_use_adx': True, 'bear_use_spike': True, 'bear_rsi_required': True, 'sideways_strategy': 'breakout', 'sideways_bb_std_mult': 3.168989029283697, 'sideways_rsi_os': 7, 'sideways_rsi_ob': 65, 'sideways_adx_thresh': 22.311032525433067, 'sideways_atr_min_pct': 0.010922317059386016, 'sideways_atr_max_pct': 0.03246889457814595, 'sideways_tp_mult': 2.2824534374310255, 'sideways_tsl_mult': 0.4955823988354443, 'sideways_time_stop': 10, 'sideways_use_sma': True, 'sideways_use_ema': False, 'sideways_use_atr': False, 'sideways_use_adx': False, 'sideways_use_spike': False, 'sideways_rsi_required': True}.
[I 2025-09-01 13:30:03,049] Trial 182 finished with values: [-1000000000.0, 1000000000.0] and parameters: {'p_sma': 52, 'p_std': 41, 'p_atr': 29, 'p_adx': 19, 'rsi_period': 71, 'ema1': 21, 'ema2': 38, 'slip_atr_k': 0.11644431666178662, 'slip_spread_k': 0.3957551958765089, 'spread_hl_frac': 0.02429462180710297, 'bb_std_mult': 0.6687020645981645, 'rsi_os': 38, 'rsi_ob': 79, 'vol_spike': 0.2755829865910418, 'adx_thresh': 11.766723660241194, 'atr_min_pct': 0.0023672215525603274, 'atr_max_pct': 0.13718418337990282, 'tp_mult': 1.500493108878518, 'tsl_mult': 0.3166318187591428, 'strategy': 'breakout', 'time_stop': 276, 'use_sma': True, 'use_atr': False, 'use_adx': True, 'use_ema': True, 'use_spike': True, 'rsi_required': True, 'edge_k': 1.9743179624587008, 'edge_cap': 0.8386879778052312, 'bull_strategy': 'breakout', 'bull_bb_std_mult': 3.1016888726851346, 'bull_rsi_os': 50, 'bull_rsi_ob': 62, 'bull_adx_thresh': 13.78914669424585, 'bull_atr_min_pct': 0.002327734477371314, 'bull_atr_max_pct': 0.018653576428437083, 'bull_tp_mult': 1.5128450626585246, 'bull_tsl_mult': 0.36319045807026074, 'bull_time_stop': 60, 'bull_use_sma': True, 'bull_use_ema': True, 'bull_use_atr': True, 'bull_use_adx': True, 'bull_use_spike': True, 'bull_rsi_required': True, 'bear_strategy': 'breakout', 'bear_bb_std_mult': 1.9275601909881672, 'bear_rsi_os': 12, 'bear_rsi_ob': 73, 'bear_adx_thresh': 9.15594941628845, 'bear_atr_min_pct': 0.02189547023196413, 'bear_atr_max_pct': 0.08979549921753847, 'bear_tp_mult': 2.4947079759238253, 'bear_tsl_mult': 0.10281331167870517, 'bear_time_stop': 282, 'bear_use_sma': True, 'bear_use_ema': False, 'bear_use_atr': True, 'bear_use_adx': True, 'bear_use_spike': False, 'bear_rsi_required': True, 'sideways_strategy': 'mean_reversion', 'sideways_bb_std_mult': 2.471552428465632, 'sideways_rsi_os': 29, 'sideways_rsi_ob': 95, 'sideways_adx_thresh': 6.698237857788033, 'sideways_atr_min_pct': 0.008670493877573566, 'sideways_atr_max_pct': 0.1152144090523808, 'sideways_tp_mult': 2.0470625502813595, 'sideways_tsl_mult': 0.1592005289684949, 'sideways_time_stop': 278, 'sideways_use_sma': True, 'sideways_use_ema': False, 'sideways_use_atr': True, 'sideways_use_adx': False, 'sideways_use_spike': False, 'sideways_rsi_required': True}.
[I 2025-09-01 13:30:41,943] Trial 186 finished with values: [-1000000000.0, 1000000000.0] and parameters: {'p_sma': 53, 'p_std': 48, 'p_atr': 30, 'p_adx': 30, 'rsi_period': 69, 'ema1': 19, 'ema2': 59, 'slip_atr_k': 0.10994531843181031, 'slip_spread_k': 0.35620188267594405, 'spread_hl_frac': 7.822296246859373e-05, 'bb_std_mult': 2.0001635686390014, 'rsi_os': 13, 'rsi_ob': 53, 'vol_spike': 0.2675407949597405, 'adx_thresh': 9.378819110406749, 'atr_min_pct': 0.0013820273375894185, 'atr_max_pct': 0.04137478631494111, 'tp_mult': 1.511028703315148, 'tsl_mult': 0.11981070749620193, 'strategy': 'breakout', 'time_stop': 90, 'use_sma': True, 'use_atr': True, 'use_adx': False, 'use_ema': True, 'use_spike': False, 'rsi_required': True, 'edge_k': 1.7162335193760017, 'edge_cap': 0.7805826897240554, 'bull_strategy': 'breakout', 'bull_bb_std_mult': 1.2723652730727861, 'bull_rsi_os': 18, 'bull_rsi_ob': 57, 'bull_adx_thresh': 16.303612561913038, 'bull_atr_min_pct': 0.0025348449434907504, 'bull_atr_max_pct': 0.01619217639043937, 'bull_tp_mult': 1.8486634793527659, 'bull_tsl_mult': 0.4219527192395413, 'bull_time_stop': 9, 'bull_use_sma': True, 'bull_use_ema': True, 'bull_use_atr': True, 'bull_use_adx': True, 'bull_use_spike': False, 'bull_rsi_required': False, 'bear_strategy': 'mean_reversion', 'bear_bb_std_mult': 2.8414638983571896, 'bear_rsi_os': 10, 'bear_rsi_ob': 69, 'bear_adx_thresh': 12.06551336610565, 'bear_atr_min_pct': 0.023060445552521264, 'bear_atr_max_pct': 0.0890714649770361, 'bear_tp_mult': 2.5886520483477558, 'bear_tsl_mult': 0.16201813738939602, 'bear_time_stop': 202, 'bear_use_sma': True, 'bear_use_ema': False, 'bear_use_atr': True, 'bear_use_adx': True, 'bear_use_spike': True, 'bear_rsi_required': False, 'sideways_strategy': 'breakout', 'sideways_bb_std_mult': 0.7748077599272924, 'sideways_rsi_os': 29, 'sideways_rsi_ob': 94, 'sideways_adx_thresh': 13.814508567253018, 'sideways_atr_min_pct': 0.011070977549820692, 'sideways_atr_max_pct': 0.057735188766885256, 'sideways_tp_mult': 2.043527215437887, 'sideways_tsl_mult': 0.24944298865443432, 'sideways_time_stop': 268, 'sideways_use_sma': False, 'sideways_use_ema': True, 'sideways_use_atr': False, 'sideways_use_adx': True, 'sideways_use_spike': False, 'sideways_rsi_required': True}.
[I 2025-09-01 13:30:42,304] Trial 188 finished with values: [-1000000000.0, 1000000000.0] and parameters: {'p_sma': 31, 'p_std': 46, 'p_atr': 30, 'p_adx': 18, 'rsi_period': 73, 'ema1': 11, 'ema2': 59, 'slip_atr_k': 0.10859536312650041, 'slip_spread_k': 0.06745177304698846, 'spread_hl_frac': 0.012668895550165949, 'bb_std_mult': 1.9821466770314549, 'rsi_os': 9, 'rsi_ob': 93, 'vol_spike': 0.1607810156406903, 'adx_thresh': 23.49764297773746, 'atr_min_pct': 0.0014457389483525287, 'atr_max_pct': 0.043695606167497444, 'tp_mult': 1.54448791960698, 'tsl_mult': 0.5463886144946313, 'strategy': 'breakout', 'time_stop': 59, 'use_sma': False, 'use_atr': True, 'use_adx': False, 'use_ema': False, 'use_spike': False, 'rsi_required': False, 'edge_k': 0.47058556397682333, 'edge_cap': 0.7709220870940848, 'bull_strategy': 'breakout', 'bull_bb_std_mult': 3.3166768797200166, 'bull_rsi_os': 31, 'bull_rsi_ob': 79, 'bull_adx_thresh': 5.672405014577267, 'bull_atr_min_pct': 0.018272828803579274, 'bull_atr_max_pct': 0.015696010762121487, 'bull_tp_mult': 1.9494553467366573, 'bull_tsl_mult': 0.42129282672955387, 'bull_time_stop': 5, 'bull_use_sma': False, 'bull_use_ema': True, 'bull_use_atr': False, 'bull_use_adx': True, 'bull_use_spike': False, 'bull_rsi_required': False, 'bear_strategy': 'mean_reversion', 'bear_bb_std_mult': 1.360550544634135, 'bear_rsi_os': 49, 'bear_rsi_ob': 69, 'bear_adx_thresh': 30.164630688525225, 'bear_atr_min_pct': 0.023169042864098956, 'bear_atr_max_pct': 0.061183847364118166, 'bear_tp_mult': 1.4515606876353588, 'bear_tsl_mult': 0.6969086551884585, 'bear_time_stop': 201, 'bear_use_sma': False, 'bear_use_ema': False, 'bear_use_atr': False, 'bear_use_adx': True, 'bear_use_spike': True, 'bear_rsi_required': False, 'sideways_strategy': 'breakout', 'sideways_bb_std_mult': 1.601480426643513, 'sideways_rsi_os': 29, 'sideways_rsi_ob': 73, 'sideways_adx_thresh': 23.783259827079146, 'sideways_atr_min_pct': 0.00783109358395947, 'sideways_atr_max_pct': 0.08002500617776039, 'sideways_tp_mult': 2.7613664922254113, 'sideways_tsl_mult': 0.06426574002648006, 'sideways_time_stop': 27, 'sideways_use_sma': False, 'sideways_use_ema': True, 'sideways_use_atr': False, 'sideways_use_adx': True, 'sideways_use_spike': False, 'sideways_rsi_required': False}.
[I 2025-09-01 13:30:42,835] Trial 185 finished with values: [-0.029737563631665798, 0.029534771271423756] and parameters: {'p_sma': 53, 'p_std': 32, 'p_atr': 30, 'p_adx': 11, 'rsi_period': 69, 'ema1': 19, 'ema2': 59, 'slip_atr_k': 0.11642083308441448, 'slip_spread_k': 0.3591282246470622, 'spread_hl_frac': 0.00017208436558788578, 'bb_std_mult': 1.3947905913560124, 'rsi_os': 41, 'rsi_ob': 89, 'vol_spike': 0.1624768545749184, 'adx_thresh': 29.58508282804906, 'atr_min_pct': 0.020370700163850772, 'atr_max_pct': 0.1386334541889374, 'tp_mult': 1.523314418000778, 'tsl_mult': 0.11560134716889756, 'strategy': 'breakout', 'time_stop': 88, 'use_sma': True, 'use_atr': True, 'use_adx': False, 'use_ema': True, 'use_spike': False, 'rsi_required': True, 'edge_k': 0.48457235697734063, 'edge_cap': 0.78004830218046, 'bull_strategy': 'breakout', 'bull_bb_std_mult': 3.316741876560158, 'bull_rsi_os': 30, 'bull_rsi_ob': 57, 'bull_adx_thresh': 16.330066855932863, 'bull_atr_min_pct': 0.0007258245464960371, 'bull_atr_max_pct': 0.017741350537135964, 'bull_tp_mult': 1.9353224345566051, 'bull_tsl_mult': 0.12964442576605845, 'bull_time_stop': 7, 'bull_use_sma': True, 'bull_use_ema': True, 'bull_use_atr': True, 'bull_use_adx': True, 'bull_use_spike': False, 'bull_rsi_required': False, 'bear_strategy': 'mean_reversion', 'bear_bb_std_mult': 0.8686593880129821, 'bear_rsi_os': 55, 'bear_rsi_ob': 69, 'bear_adx_thresh': 11.583562396786435, 'bear_atr_min_pct': 0.022999052377878238, 'bear_atr_max_pct': 0.08981510531135321, 'bear_tp_mult': 2.040587111387366, 'bear_tsl_mult': 0.7684285349038305, 'bear_time_stop': 284, 'bear_use_sma': True, 'bear_use_ema': False, 'bear_use_atr': True, 'bear_use_adx': True, 'bear_use_spike': True, 'bear_rsi_required': False, 'sideways_strategy': 'breakout', 'sideways_bb_std_mult': 0.7739108592186679, 'sideways_rsi_os': 29, 'sideways_rsi_ob': 94, 'sideways_adx_thresh': 13.901569997332619, 'sideways_atr_min_pct': 0.010742291852042566, 'sideways_atr_max_pct': 0.11909306863867086, 'sideways_tp_mult': 1.017574525588134, 'sideways_tsl_mult': 0.5023569596765207, 'sideways_time_stop': 280, 'sideways_use_sma': False, 'sideways_use_ema': True, 'sideways_use_atr': False, 'sideways_use_adx': True, 'sideways_use_spike': False, 'sideways_rsi_required': True}.
[I 2025-09-01 13:30:43,186] Trial 187 finished with values: [-0.022631197386015045, 0.022457208453658024] and parameters: {'p_sma': 31, 'p_std': 33, 'p_atr': 30, 'p_adx': 9, 'rsi_period': 68, 'ema1': 19, 'ema2': 59, 'slip_atr_k': 0.11085131880442865, 'slip_spread_k': 0.3506703428299194, 'spread_hl_frac': 0.04851182440650805, 'bb_std_mult': 1.9820057577754553, 'rsi_os': 41, 'rsi_ob': 51, 'vol_spike': 0.2772382959819778, 'adx_thresh': 11.792540271546649, 'atr_min_pct': 0.020233038697314538, 'atr_max_pct': 0.0445453795340004, 'tp_mult': 2.949088039674096, 'tsl_mult': 0.13256984344501377, 'strategy': 'breakout', 'time_stop': 89, 'use_sma': False, 'use_atr': True, 'use_adx': False, 'use_ema': False, 'use_spike': False, 'rsi_required': True, 'edge_k': 0.43904839542690566, 'edge_cap': 0.2612082290353983, 'bull_strategy': 'breakout', 'bull_bb_std_mult': 3.05542115745262, 'bull_rsi_os': 30, 'bull_rsi_ob': 79, 'bull_adx_thresh': 5.529240531884648, 'bull_atr_min_pct': 0.0007278549494051064, 'bull_atr_max_pct': 0.10206971922928967, 'bull_tp_mult': 1.9163479210914198, 'bull_tsl_mult': 0.42079634912594066, 'bull_time_stop': 5, 'bull_use_sma': False, 'bull_use_ema': True, 'bull_use_atr': False, 'bull_use_adx': True, 'bull_use_spike': False, 'bull_rsi_required': False, 'bear_strategy': 'mean_reversion', 'bear_bb_std_mult': 0.8701271884862743, 'bear_rsi_os': 49, 'bear_rsi_ob': 68, 'bear_adx_thresh': 12.070329543752182, 'bear_atr_min_pct': 0.015816819441533313, 'bear_atr_max_pct': 0.08964178109937783, 'bear_tp_mult': 2.031359121413676, 'bear_tsl_mult': 0.7740008538163472, 'bear_time_stop': 264, 'bear_use_sma': False, 'bear_use_ema': False, 'bear_use_atr': False, 'bear_use_adx': True, 'bear_use_spike': True, 'bear_rsi_required': False, 'sideways_strategy': 'breakout', 'sideways_bb_std_mult': 0.772777658959491, 'sideways_rsi_os': 29, 'sideways_rsi_ob': 94, 'sideways_adx_thresh': 14.112898432960918, 'sideways_atr_min_pct': 0.007876691969899268, 'sideways_atr_max_pct': 0.08149808001730202, 'sideways_tp_mult': 2.0200435584893714, 'sideways_tsl_mult': 0.07190478458896088, 'sideways_time_stop': 5, 'sideways_use_sma': False, 'sideways_use_ema': True, 'sideways_use_atr': False, 'sideways_use_adx': True, 'sideways_use_spike': False, 'sideways_rsi_required': True}.
