[I 2025-09-01 13:26:38,561] Trial 160 finished with values: [-1000000000.0, 1000000000.0] and parameters: {'p_sma': 60, 'p_std': 46, 'p_atr': 28, 'p_adx': 19, 'rsi_period': 63, 'ema1': 20, 'ema2': 58, 'slip_atr_k': 0.1130464306087934, 'slip_spread_k': 0.7591157397952413, 'spread_hl_frac': 0.030968251423005744, 'bb_std_mult': 2.0395008294638286, 'rsi_os': 35, 'rsi_ob': 48, 'vol_spike': 0.23437041024913186, 'adx_thresh': 10.293770049249572, 'atr_min_pct': 0.0017005348748876054, 'atr_max_pct': 0.05426194972038152, 'tp_mult': 1.5865006280959983, 'tsl_mult': 0.21740135335826505, 'strategy': 'breakout', 'time_stop': 290, 'use_sma': False, 'use_atr': True, 'use_adx': False, 'use_ema': False, 'use_spike': True, 'rsi_required': True, 'edge_k': 1.4501730848098118, 'edge_cap': 0.9297634777323047, 'bull_strategy': 'mean_reversion', 'bull_bb_std_mult': 3.1448538888197417, 'bull_rsi_os': 6, 'bull_rsi_ob': 57, 'bull_adx_thresh': 15.198129799133486, 'bull_atr_min_pct': 7.424279152898772e-05, 'bull_atr_max_pct': 0.012414846765791358, 'bull_tp_mult': 2.5052017056467912, 'bull_tsl_mult': 0.40826289649627767, 'bull_time_stop': 16, 'bull_use_sma': False, 'bull_use_ema': True, 'bull_use_atr': True, 'bull_use_adx': True, 'bull_use_spike': True, 'bull_rsi_required': True, 'bear_strategy': 'mean_reversion', 'bear_bb_std_mult': 3.307987123606228, 'bear_rsi_os': 8, 'bear_rsi_ob': 73, 'bear_adx_thresh': 24.504392301437164, 'bear_atr_min_pct': 0.02827148614401558, 'bear_atr_max_pct': 0.03665334007484111, 'bear_tp_mult': 2.4901864695867055, 'bear_tsl_mult': 0.5759647037822848, 'bear_time_stop': 293, 'bear_use_sma': False, 'bear_use_ema': False, 'bear_use_atr': True, 'bear_use_adx': True, 'bear_use_spike': True, 'bear_rsi_required': True, 'sideways_strategy': 'mean_reversion', 'sideways_bb_std_mult': 1.0201679614846468, 'sideways_rsi_os': 16, 'sideways_rsi_ob': 94, 'sideways_adx_thresh': 27.71959664225195, 'sideways_atr_min_pct': 0.010979468462182089, 'sideways_atr_max_pct': 0.06708272936563531, 'sideways_tp_mult': 2.707557101018228, 'sideways_tsl_mult': 0.5020841993659044, 'sideways_time_stop': 210, 'sideways_use_sma': True, 'sideways_use_ema': False, 'sideways_use_atr': False, 'sideways_use_adx': False, 'sideways_use_spike': True, 'sideways_rsi_required': False}.
[I 2025-09-01 13:27:20,543] Trial 164 finished with values: [-1000000000.0, 1000000000.0] and parameters: {'p_sma': 60, 'p_std': 46, 'p_atr': 30, 'p_adx': 8, 'rsi_period': 7, 'ema1': 24, 'ema2': 60, 'slip_atr_k': 0.09181751408767788, 'slip_spread_k': 0.4383329003875217, 'spread_hl_frac': 0.03127598223700899, 'bb_std_mult': 1.9174555767927712, 'rsi_os': 36, 'rsi_ob': 94, 'vol_spike': 0.23547855535808287, 'adx_thresh': 20.636720968738583, 'atr_min_pct': 0.004538290508930799, 'atr_max_pct': 0.03354407216077619, 'tp_mult': 1.525492423079979, 'tsl_mult': 0.40838629981549684, 'strategy': 'breakout', 'time_stop': 103, 'use_sma': True, 'use_atr': False, 'use_adx': False, 'use_ema': True, 'use_spike': False, 'rsi_required': True, 'edge_k': 1.1454975259019826, 'edge_cap': 0.8028271013821594, 'bull_strategy': 'breakout', 'bull_bb_std_mult': 3.253432304333386, 'bull_rsi_os': 16, 'bull_rsi_ob': 75, 'bull_adx_thresh': 6.07704006395664, 'bull_atr_min_pct': 0.009649986198300558, 'bull_atr_max_pct': 0.08130335043146254, 'bull_tp_mult': 2.851123442294542, 'bull_tsl_mult': 0.40337771364152675, 'bull_time_stop': 10, 'bull_use_sma': True, 'bull_use_ema': True, 'bull_use_atr': True, 'bull_use_adx': True, 'bull_use_spike': False, 'bull_rsi_required': True, 'bear_strategy': 'breakout', 'bear_bb_std_mult': 0.9975703017299475, 'bear_rsi_os': 7, 'bear_rsi_ob': 70, 'bear_adx_thresh': 11.192725264105988, 'bear_atr_min_pct': 0.022103875007039746, 'bear_atr_max_pct': 0.14451731365938242, 'bear_tp_mult': 2.579475685468538, 'bear_tsl_mult': 0.4952051320220355, 'bear_time_stop': 267, 'bear_use_sma': True, 'bear_use_ema': False, 'bear_use_atr': False, 'bear_use_adx': True, 'bear_use_spike': False, 'bear_rsi_required': False, 'sideways_strategy': 'breakout', 'sideways_bb_std_mult': 0.9320537623391676, 'sideways_rsi_os': 54, 'sideways_rsi_ob': 91, 'sideways_adx_thresh': 27.59763243370789, 'sideways_atr_min_pct': 0.0093172430763172, 'sideways_atr_max_pct': 0.11966197461952728, 'sideways_tp_mult': 2.7395364246491742, 'sideways_tsl_mult': 0.5074146561774717, 'sideways_time_stop': 208, 'sideways_use_sma': False, 'sideways_use_ema': False, 'sideways_use_atr': True, 'sideways_use_adx': False, 'sideways_use_spike': False, 'sideways_rsi_required': True}.
[I 2025-09-01 13:27:21,414] Trial 163 finished with values: [-1000000000.0, 1000000000.0] and parameters: {'p_sma': 60, 'p_std': 42, 'p_atr': 29, 'p_adx': 16, 'rsi_period': 7, 'ema1': 20, 'ema2': 60, 'slip_atr_k': 0.09327881983131381, 'slip_spread_k': 0.29102806459804914, 'spread_hl_frac': 0.037369812459773305, 'bb_std_mult': 2.204818384533512, 'rsi_os': 35, 'rsi_ob': 94, 'vol_spike': 0.22565351215483653, 'adx_thresh': 22.545996762978493, 'atr_min_pct': 0.004784273825628101, 'atr_max_pct': 0.027074447476870163, 'tp_mult': 2.185822697052481, 'tsl_mult': 0.399642775118124, 'strategy': 'breakout', 'time_stop': 90, 'use_sma': True, 'use_atr': False, 'use_adx': True, 'use_ema': True, 'use_spike': True, 'rsi_required': True, 'edge_k': 0.9381597168871277, 'edge_cap': 0.12808179634701022, 'bull_strategy': 'breakout', 'bull_bb_std_mult': 2.10574092207901, 'bull_rsi_os': 28, 'bull_rsi_ob': 90, 'bull_adx_thresh': 6.063959100279649, 'bull_atr_min_pct': 0.0047161699603929606, 'bull_atr_max_pct': 0.02144326474419286, 'bull_tp_mult': 2.0703448425450195, 'bull_tsl_mult': 0.275134514851324, 'bull_time_stop': 45, 'bull_use_sma': True, 'bull_use_ema': True, 'bull_use_atr': True, 'bull_use_adx': True, 'bull_use_spike': False, 'bull_rsi_required': True, 'bear_strategy': 'mean_reversion', 'bear_bb_std_mult': 2.355318378265009, 'bear_rsi_os': 7, 'bear_rsi_ob': 68, 'bear_adx_thresh': 11.082382123315083, 'bear_atr_min_pct': 0.022610219279498252, 'bear_atr_max_pct': 0.03634614632785688, 'bear_tp_mult': 2.3648417431960436, 'bear_tsl_mult': 0.6182880940642441, 'bear_time_stop': 103, 'bear_use_sma': True, 'bear_use_ema': False, 'bear_use_atr': True, 'bear_use_adx': True, 'bear_use_spike': False, 'bear_rsi_required': True, 'sideways_strategy': 'mean_reversion', 'sideways_bb_std_mult': 0.5593321469584799, 'sideways_rsi_os': 12, 'sideways_rsi_ob': 83, 'sideways_adx_thresh': 13.765570455473343, 'sideways_atr_min_pct': 0.011431549930263865, 'sideways_atr_max_pct': 0.11173625354783813, 'sideways_tp_mult': 2.741542547020799, 'sideways_tsl_mult': 0.5140856463290797, 'sideways_time_stop': 153, 'sideways_use_sma': True, 'sideways_use_ema': False, 'sideways_use_atr': True, 'sideways_use_adx': False, 'sideways_use_spike': False, 'sideways_rsi_required': False}.
[I 2025-09-01 13:27:23,710] Trial 165 finished with values: [-1000000000.0, 1000000000.0] and parameters: {'p_sma': 14, 'p_std': 46, 'p_atr': 30, 'p_adx': 29, 'rsi_period': 75, 'ema1': 23, 'ema2': 60, 'slip_atr_k': 0.09245372250213188, 'slip_spread_k': 0.4179073872538141, 'spread_hl_frac': 0.011508859686611932, 'bb_std_mult': 2.1925515381541265, 'rsi_os': 39, 'rsi_ob': 74, 'vol_spike': 0.2263869188515334, 'adx_thresh': 12.28917923287387, 'atr_min_pct': 0.0029379794281794236, 'atr_max_pct': 0.049855971622870116, 'tp_mult': 1.596079104998401, 'tsl_mult': 0.07327010050432589, 'strategy': 'breakout', 'time_stop': 111, 'use_sma': True, 'use_atr': False, 'use_adx': True, 'use_ema': True, 'use_spike': False, 'rsi_required': True, 'edge_k': 0.43261264960203255, 'edge_cap': 0.1318538207677541, 'bull_strategy': 'breakout', 'bull_bb_std_mult': 2.107507860800797, 'bull_rsi_os': 49, 'bull_rsi_ob': 74, 'bull_adx_thresh': 6.039509864973348, 'bull_atr_min_pct': 0.028402272953392566, 'bull_atr_max_pct': 0.021340762607204636, 'bull_tp_mult': 2.9236858992648522, 'bull_tsl_mult': 0.29326428766735374, 'bull_time_stop': 13, 'bull_use_sma': True, 'bull_use_ema': True, 'bull_use_atr': True, 'bull_use_adx': True, 'bull_use_spike': False, 'bull_rsi_required': True, 'bear_strategy': 'mean_reversion', 'bear_bb_std_mult': 0.9843099092041364, 'bear_rsi_os': 11, 'bear_rsi_ob': 70, 'bear_adx_thresh': 11.218204155436732, 'bear_atr_min_pct': 0.02274087316738887, 'bear_atr_max_pct': 0.0788710561759298, 'bear_tp_mult': 2.349570489285382, 'bear_tsl_mult': 0.5100269587042042, 'bear_time_stop': 265, 'bear_use_sma': True, 'bear_use_ema': False, 'bear_use_atr': False, 'bear_use_adx': True, 'bear_use_spike': False, 'bear_rsi_required': False, 'sideways_strategy': 'breakout', 'sideways_bb_std_mult': 0.9346489863033568, 'sideways_rsi_os': 28, 'sideways_rsi_ob': 77, 'sideways_adx_thresh': 8.778627195663717, 'sideways_atr_min_pct': 0.009254731168389218, 'sideways_atr_max_pct': 0.13807191699690946, 'sideways_tp_mult': 2.868213929598185, 'sideways_tsl_mult': 0.005654296969478112, 'sideways_time_stop': 5, 'sideways_use_sma': False, 'sideways_use_ema': True, 'sideways_use_atr': True, 'sideways_use_adx': False, 'sideways_use_spike': False, 'sideways_rsi_required': True}.
[I 2025-09-01 13:27:24,220] Trial 166 finished with values: [-1000000000.0, 1000000000.0] and parameters: {'p_sma': 50, 'p_std': 42, 'p_atr': 30, 'p_adx': 18, 'rsi_period': 74, 'ema1': 16, 'ema2': 60, 'slip_atr_k': 0.09183753550517135, 'slip_spread_k': 0.4227233045878047, 'spread_hl_frac': 0.011709246866989929, 'bb_std_mult': 2.1432156273049072, 'rsi_os': 39, 'rsi_ob': 93, 'vol_spike': 0.22488893093040752, 'adx_thresh': 12.508852512894823, 'atr_min_pct': 0.0030212373422861235, 'atr_max_pct': 0.02214527131482645, 'tp_mult': 1.512251923798429, 'tsl_mult': 0.1404821396654288, 'strategy': 'breakout', 'time_stop': 103, 'use_sma': True, 'use_atr': False, 'use_adx': True, 'use_ema': True, 'use_spike': False, 'rsi_required': True, 'edge_k': 1.144871102050107, 'edge_cap': 0.1368770753678054, 'bull_strategy': 'breakout', 'bull_bb_std_mult': 3.0362387690115265, 'bull_rsi_os': 16, 'bull_rsi_ob': 55, 'bull_adx_thresh': 5.5932264319818525, 'bull_atr_min_pct': 0.007351662197987322, 'bull_atr_max_pct': 0.08220809401033138, 'bull_tp_mult': 1.8268144487423552, 'bull_tsl_mult': 0.8490517052551219, 'bull_time_stop': 8, 'bull_use_sma': True, 'bull_use_ema': True, 'bull_use_atr': True, 'bull_use_adx': True, 'bull_use_spike': False, 'bull_rsi_required': True, 'bear_strategy': 'mean_reversion', 'bear_bb_std_mult': 2.996504424752367, 'bear_rsi_os': 39, 'bear_rsi_ob': 70, 'bear_adx_thresh': 27.31691366792346, 'bear_atr_min_pct': 0.022158824969977477, 'bear_atr_max_pct': 0.07831434585367171, 'bear_tp_mult': 2.139650224580443, 'bear_tsl_mult': 0.625212860474752, 'bear_time_stop': 266, 'bear_use_sma': True, 'bear_use_ema': False, 'bear_use_atr': False, 'bear_use_adx': True, 'bear_use_spike': False, 'bear_rsi_required': False, 'sideways_strategy': 'breakout', 'sideways_bb_std_mult': 0.9191320470998765, 'sideways_rsi_os': 28, 'sideways_rsi_ob': 77, 'sideways_adx_thresh': 8.934758075148363, 'sideways_atr_min_pct': 0.009325504918474725, 'sideways_atr_max_pct': 0.1380119357188057, 'sideways_tp_mult': 1.8125666929072657, 'sideways_tsl_mult': 0.5013628123189753, 'sideways_time_stop': 136, 'sideways_use_sma': False, 'sideways_use_ema': True, 'sideways_use_atr': True, 'sideways_use_adx': True, 'sideways_use_spike': False, 'sideways_rsi_required': True}.
[I 2025-09-01 13:27:24,951] Trial 170 finished with values: [-1000000000.0, 1000000000.0] and parameters: {'p_sma': 46, 'p_std': 50, 'p_atr': 29, 'p_adx': 21, 'rsi_period': 67, 'ema1': 22, 'ema2': 27, 'slip_atr_k': 0.12611901378106904, 'slip_spread_k': 0.3721456193175783, 'spread_hl_frac': 0.026689976265351363, 'bb_std_mult': 1.197839091514602, 'rsi_os': 27, 'rsi_ob': 88, 'vol_spike': 0.21721546568047992, 'adx_thresh': 5.882628379527755, 'atr_min_pct': 0.018484575308296072, 'atr_max_pct': 0.01049168376486255, 'tp_mult': 1.4369244352675008, 'tsl_mult': 0.10489729057176833, 'strategy': 'breakout', 'time_stop': 77, 'use_sma': True, 'use_atr': True, 'use_adx': False, 'use_ema': True, 'use_spike': False, 'rsi_required': False, 'edge_k': 0.4510178848730869, 'edge_cap': 0.6196236526799752, 'bull_strategy': 'breakout', 'bull_bb_std_mult': 1.537895427971498, 'bull_rsi_os': 21, 'bull_rsi_ob': 51, 'bull_adx_thresh': 31.389189186678994, 'bull_atr_min_pct': 0.0030263368680799874, 'bull_atr_max_pct': 0.13156831755887005, 'bull_tp_mult': 1.7993652545921022, 'bull_tsl_mult': 0.7388306169679615, 'bull_time_stop': 30, 'bull_use_sma': True, 'bull_use_ema': True, 'bull_use_atr': True, 'bull_use_adx': True, 'bull_use_spike': False, 'bull_rsi_required': False, 'bear_strategy': 'breakout', 'bear_bb_std_mult': 0.7965791720453608, 'bear_rsi_os': 15, 'bear_rsi_ob': 72, 'bear_adx_thresh': 12.891185973424822, 'bear_atr_min_pct': 0.01976551731034603, 'bear_atr_max_pct': 0.07442583172398684, 'bear_tp_mult': 1.015319643243448, 'bear_tsl_mult': 0.5376563162621494, 'bear_time_stop': 246, 'bear_use_sma': True, 'bear_use_ema': False, 'bear_use_atr': True, 'bear_use_adx': True, 'bear_use_spike': False, 'bear_rsi_required': False, 'sideways_strategy': 'mean_reversion', 'sideways_bb_std_mult': 3.520393375892766, 'sideways_rsi_os': 32, 'sideways_rsi_ob': 92, 'sideways_adx_thresh': 13.805641401325344, 'sideways_atr_min_pct': 0.010024274918069044, 'sideways_atr_max_pct': 0.14459531373864076, 'sideways_tp_mult': 1.963025981921182, 'sideways_tsl_mult': 0.5573353352608238, 'sideways_time_stop': 175, 'sideways_use_sma': False, 'sideways_use_ema': False, 'sideways_use_atr': True, 'sideways_use_adx': True, 'sideways_use_spike': False, 'sideways_rsi_required': True}.
[I 2025-09-01 13:28:01,913] Trial 169 finished with values: [-1000000000.0, 1000000000.0] and parameters: {'p_sma': 50, 'p_std': 52, 'p_atr': 9, 'p_adx': 18, 'rsi_period': 74, 'ema1': 17, 'ema2': 54, 'slip_atr_k': 0.1215486157827051, 'slip_spread_k': 0.13806836328127797, 'spread_hl_frac': 0.012288565840608588, 'bb_std_mult': 1.1834474215920876, 'rsi_os': 27, 'rsi_ob': 88, 'vol_spike': 0.21921991375100683, 'adx_thresh': 5.947629038873682, 'atr_min_pct': 0.018146818102611637, 'atr_max_pct': 0.020730526172054606, 'tp_mult': 1.5167803553280081, 'tsl_mult': 0.1505372461128845, 'strategy': 'breakout', 'time_stop': 154, 'use_sma': True, 'use_atr': True, 'use_adx': False, 'use_ema': True, 'use_spike': False, 'rsi_required': False, 'edge_k': 0.8595624731872382, 'edge_cap': 0.6192648298460997, 'bull_strategy': 'breakout', 'bull_bb_std_mult': 3.0384356172468383, 'bull_rsi_os': 10, 'bull_rsi_ob': 55, 'bull_adx_thresh': 30.68868009005602, 'bull_atr_min_pct': 0.007264051958171471, 'bull_atr_max_pct': 0.04296815366478993, 'bull_tp_mult': 2.7230892154969992, 'bull_tsl_mult': 0.9256114837306283, 'bull_time_stop': 28, 'bull_use_sma': True, 'bull_use_ema': True, 'bull_use_atr': True, 'bull_use_adx': True, 'bull_use_spike': False, 'bull_rsi_required': False, 'bear_strategy': 'mean_reversion', 'bear_bb_std_mult': 2.038500837755281, 'bear_rsi_os': 41, 'bear_rsi_ob': 72, 'bear_adx_thresh': 12.845427617219304, 'bear_atr_min_pct': 0.019790141874035473, 'bear_atr_max_pct': 0.07439287507505976, 'bear_tp_mult': 2.169060591624809, 'bear_tsl_mult': 0.5305060492549846, 'bear_time_stop': 248, 'bear_use_sma': True, 'bear_use_ema': False, 'bear_use_atr': False, 'bear_use_adx': True, 'bear_use_spike': False, 'bear_rsi_required': False, 'sideways_strategy': 'mean_reversion', 'sideways_bb_std_mult': 0.8078620082034264, 'sideways_rsi_os': 27, 'sideways_rsi_ob': 92, 'sideways_adx_thresh': 14.305426764267244, 'sideways_atr_min_pct': 0.009642259520375215, 'sideways_atr_max_pct': 0.14507971906713596, 'sideways_tp_mult': 1.9465881582308406, 'sideways_tsl_mult': 0.5488566390861359, 'sideways_time_stop': 133, 'sideways_use_sma': False, 'sideways_use_ema': True, 'sideways_use_atr': True, 'sideways_use_adx': True, 'sideways_use_spike': False, 'sideways_rsi_required': True}.
[I 2025-09-01 13:28:02,454] Trial 168 finished with values: [-1000000000.0, 1000000000.0] and parameters: {'p_sma': 48, 'p_std': 52, 'p_atr': 30, 'p_adx': 18, 'rsi_period': 47, 'ema1': 23, 'ema2': 57, 'slip_atr_k': 0.07242033854745857, 'slip_spread_k': 0.41485527227869046, 'spread_hl_frac': 0.00106851693566987, 'bb_std_mult': 1.7409633982446233, 'rsi_os': 39, 'rsi_ob': 88, 'vol_spike': 0.21791363977061612, 'adx_thresh': 12.333738039517785, 'atr_min_pct': 0.0030960861480045137, 'atr_max_pct': 0.04959941243163934, 'tp_mult': 1.4548753597643655, 'tsl_mult': 0.7326094836160256, 'strategy': 'breakout', 'time_stop': 111, 'use_sma': True, 'use_atr': True, 'use_adx': False, 'use_ema': True, 'use_spike': False, 'rsi_required': False, 'edge_k': 1.0581845869226993, 'edge_cap': 0.780551956576788, 'bull_strategy': 'breakout', 'bull_bb_std_mult': 2.5214797538716285, 'bull_rsi_os': 49, 'bull_rsi_ob': 55, 'bull_adx_thresh': 21.784860248946572, 'bull_atr_min_pct': 0.002823522908657907, 'bull_atr_max_pct': 0.05689030801127146, 'bull_tp_mult': 2.9243979774207514, 'bull_tsl_mult': 0.9341387739568365, 'bull_time_stop': 30, 'bull_use_sma': True, 'bull_use_ema': True, 'bull_use_atr': True, 'bull_use_adx': True, 'bull_use_spike': False, 'bull_rsi_required': False, 'bear_strategy': 'mean_reversion', 'bear_bb_std_mult': 1.1090274789300212, 'bear_rsi_os': 11, 'bear_rsi_ob': 70, 'bear_adx_thresh': 23.3761687439723, 'bear_atr_min_pct': 0.0006565662262225953, 'bear_atr_max_pct': 0.07359212414697727, 'bear_tp_mult': 2.171496024118753, 'bear_tsl_mult': 0.5322570987778368, 'bear_time_stop': 40, 'bear_use_sma': True, 'bear_use_ema': False, 'bear_use_atr': False, 'bear_use_adx': True, 'bear_use_spike': False, 'bear_rsi_required': False, 'sideways_strategy': 'breakout', 'sideways_bb_std_mult': 3.315226928479503, 'sideways_rsi_os': 28, 'sideways_rsi_ob': 91, 'sideways_adx_thresh': 8.801964495232905, 'sideways_atr_min_pct': 0.010329093081799747, 'sideways_atr_max_pct': 0.12694443126075491, 'sideways_tp_mult': 2.859055262327906, 'sideways_tsl_mult': 0.46550540359154424, 'sideways_time_stop': 5, 'sideways_use_sma': False, 'sideways_use_ema': True, 'sideways_use_atr': True, 'sideways_use_adx': True, 'sideways_use_spike': False, 'sideways_rsi_required': True}.
[I 2025-09-01 13:28:02,857] Trial 167 finished with values: [-1000000000.0, 1000000000.0] and parameters: {'p_sma': 48, 'p_std': 42, 'p_atr': 29, 'p_adx': 29, 'rsi_period': 75, 'ema1': 22, 'ema2': 57, 'slip_atr_k': 0.08647624348046049, 'slip_spread_k': 0.37839271108062467, 'spread_hl_frac': 0.012084650087448603, 'bb_std_mult': 3.0574222920574687, 'rsi_os': 39, 'rsi_ob': 88, 'vol_spike': 0.22213971024747597, 'adx_thresh': 12.394294549337033, 'atr_min_pct': 0.026336497444480654, 'atr_max_pct': 0.0446729772976911, 'tp_mult': 2.365069911534052, 'tsl_mult': 0.14790423083116488, 'strategy': 'breakout', 'time_stop': 268, 'use_sma': True, 'use_atr': True, 'use_adx': True, 'use_ema': True, 'use_spike': False, 'rsi_required': True, 'edge_k': 0.43200704451520294, 'edge_cap': 0.17581788188259917, 'bull_strategy': 'breakout', 'bull_bb_std_mult': 1.4640600090554408, 'bull_rsi_os': 21, 'bull_rsi_ob': 55, 'bull_adx_thresh': 31.32465690568836, 'bull_atr_min_pct': 0.0029927451174564, 'bull_atr_max_pct': 0.021723314925075995, 'bull_tp_mult': 1.7785903654814261, 'bull_tsl_mult': 0.5027165825266829, 'bull_time_stop': 216, 'bull_use_sma': True, 'bull_use_ema': True, 'bull_use_atr': True, 'bull_use_adx': True, 'bull_use_spike': False, 'bull_rsi_required': True, 'bear_strategy': 'mean_reversion', 'bear_bb_std_mult': 2.9462408307555767, 'bear_rsi_os': 11, 'bear_rsi_ob': 70, 'bear_adx_thresh': 12.38920552942205, 'bear_atr_min_pct': 0.019763035030763133, 'bear_atr_max_pct': 0.07806716998545672, 'bear_tp_mult': 1.2203137731309073, 'bear_tsl_mult': 0.5251371699210912, 'bear_time_stop': 40, 'bear_use_sma': True, 'bear_use_ema': False, 'bear_use_atr': False, 'bear_use_adx': True, 'bear_use_spike': False, 'bear_rsi_required': False, 'sideways_strategy': 'breakout', 'sideways_bb_std_mult': 0.840848595514033, 'sideways_rsi_os': 28, 'sideways_rsi_ob': 92, 'sideways_adx_thresh': 8.962385524210106, 'sideways_atr_min_pct': 0.010148244252827074, 'sideways_atr_max_pct': 0.11135298267723891, 'sideways_tp_mult': 2.8785849265415187, 'sideways_tsl_mult': 0.5426376356739105, 'sideways_time_stop': 150, 'sideways_use_sma': False, 'sideways_use_ema': True, 'sideways_use_atr': True, 'sideways_use_adx': True, 'sideways_use_spike': False, 'sideways_rsi_required': True}.
