[I 2025-09-01 13:34:08,963] Trial 209 finished with values: [-1000000000.0, 1000000000.0] and parameters: {'p_sma': 35, 'p_std': 50, 'p_atr': 30, 'p_adx': 12, 'rsi_period': 64, 'ema1': 22, 'ema2': 60, 'slip_atr_k': 0.01138008709158859, 'slip_spread_k': 0.34816717673709374, 'spread_hl_frac': 0.006422463436312475, 'bb_std_mult': 1.9798798906367159, 'rsi_os': 36, 'rsi_ob': 95, 'vol_spike': 0.2484775780455384, 'adx_thresh': 13.836418404616454, 'atr_min_pct': 0.023287046647991274, 'atr_max_pct': 0.04707550651423492, 'tp_mult': 1.315669465700149, 'tsl_mult': 0.25954947150552987, 'strategy': 'mean_reversion', 'time_stop': 245, 'use_sma': True, 'use_atr': False, 'use_adx': False, 'use_ema': True, 'use_spike': True, 'rsi_required': False, 'edge_k': 0.5448210760776598, 'edge_cap': 0.3155843449176128, 'bull_strategy': 'breakout', 'bull_bb_std_mult': 3.462993292410269, 'bull_rsi_os': 54, 'bull_rsi_ob': 55, 'bull_adx_thresh': 5.612024970763922, 'bull_atr_min_pct': 0.004305750181839348, 'bull_atr_max_pct': 0.022773985276110926, 'bull_tp_mult': 1.6635810455885474, 'bull_tsl_mult': 0.4635866470857196, 'bull_time_stop': 78, 'bull_use_sma': True, 'bull_use_ema': False, 'bull_use_atr': False, 'bull_use_adx': True, 'bull_use_spike': False, 'bull_rsi_required': True, 'bear_strategy': 'breakout', 'bear_bb_std_mult': 2.264010467517263, 'bear_rsi_os': 33, 'bear_rsi_ob': 92, 'bear_adx_thresh': 9.660491287367678, 'bear_atr_min_pct': 0.004743715622295123, 'bear_atr_max_pct': 0.09032426703505861, 'bear_tp_mult': 2.24234418907095, 'bear_tsl_mult': 0.13158589024082787, 'bear_time_stop': 214, 'bear_use_sma': True, 'bear_use_ema': False, 'bear_use_atr': True, 'bear_use_adx': True, 'bear_use_spike': False, 'bear_rsi_required': True, 'sideways_strategy': 'breakout', 'sideways_bb_std_mult': 1.8012004004841424, 'sideways_rsi_os': 47, 'sideways_rsi_ob': 95, 'sideways_adx_thresh': 7.680194565547741, 'sideways_atr_min_pct': 0.007635133051026831, 'sideways_atr_max_pct': 0.1290230325816103, 'sideways_tp_mult': 2.6629440536075957, 'sideways_tsl_mult': 0.36271721709238836, 'sideways_time_stop': 23, 'sideways_use_sma': True, 'sideways_use_ema': True, 'sideways_use_atr': True, 'sideways_use_adx': True, 'sideways_use_spike': False, 'sideways_rsi_required': True}.
[I 2025-09-01 13:34:09,382] Trial 206 finished with values: [-1000000000.0, 1000000000.0] and parameters: {'p_sma': 53, 'p_std': 47, 'p_atr': 30, 'p_adx': 18, 'rsi_period': 69, 'ema1': 21, 'ema2': 59, 'slip_atr_k': 0.1170763743318143, 'slip_spread_k': 0.35730037280493276, 'spread_hl_frac': 0.00973572224275051, 'bb_std_mult': 2.694279372588216, 'rsi_os': 37, 'rsi_ob': 69, 'vol_spike': 0.21532685958630027, 'adx_thresh': 9.382410034785497, 'atr_min_pct': 0.002388937107851266, 'atr_max_pct': 0.043361279440834274, 'tp_mult': 1.4707228174143796, 'tsl_mult': 0.9958291916773958, 'strategy': 'breakout', 'time_stop': 285, 'use_sma': True, 'use_atr': False, 'use_adx': False, 'use_ema': True, 'use_spike': True, 'rsi_required': False, 'edge_k': 0.0589658230807506, 'edge_cap': 0.7940341818506209, 'bull_strategy': 'breakout', 'bull_bb_std_mult': 3.0830777021882043, 'bull_rsi_os': 51, 'bull_rsi_ob': 55, 'bull_adx_thresh': 6.720543746656247, 'bull_atr_min_pct': 0.020033938256864482, 'bull_atr_max_pct': 0.0658618802200186, 'bull_tp_mult': 1.881796364763091, 'bull_tsl_mult': 0.3657190739459744, 'bull_time_stop': 18, 'bull_use_sma': True, 'bull_use_ema': True, 'bull_use_atr': False, 'bull_use_adx': True, 'bull_use_spike': False, 'bull_rsi_required': False, 'bear_strategy': 'mean_reversion', 'bear_bb_std_mult': 0.9406456769028746, 'bear_rsi_os': 11, 'bear_rsi_ob': 89, 'bear_adx_thresh': 26.179407187059773, 'bear_atr_min_pct': 0.004765246129092562, 'bear_atr_max_pct': 0.08658561570754554, 'bear_tp_mult': 2.2763039672337584, 'bear_tsl_mult': 0.47960689059659645, 'bear_time_stop': 275, 'bear_use_sma': True, 'bear_use_ema': False, 'bear_use_atr': True, 'bear_use_adx': True, 'bear_use_spike': True, 'bear_rsi_required': True, 'sideways_strategy': 'mean_reversion', 'sideways_bb_std_mult': 0.818220212974218, 'sideways_rsi_os': 46, 'sideways_rsi_ob': 91, 'sideways_adx_thresh': 12.700125153031946, 'sideways_atr_min_pct': 0.008033630024862324, 'sideways_atr_max_pct': 0.08447919260394939, 'sideways_tp_mult': 2.7446489383571024, 'sideways_tsl_mult': 0.9512612762347152, 'sideways_time_stop': 11, 'sideways_use_sma': True, 'sideways_use_ema': True, 'sideways_use_atr': False, 'sideways_use_adx': True, 'sideways_use_spike': False, 'sideways_rsi_required': True}.
[I 2025-09-01 13:34:09,697] Trial 207 finished with values: [-1000000000.0, 1000000000.0] and parameters: {'p_sma': 54, 'p_std': 47, 'p_atr': 30, 'p_adx': 18, 'rsi_period': 68, 'ema1': 8, 'ema2': 59, 'slip_atr_k': 0.17760456750216896, 'slip_spread_k': 0.7259869426106729, 'spread_hl_frac': 0.041154982348780636, 'bb_std_mult': 2.5147400545397325, 'rsi_os': 36, 'rsi_ob': 93, 'vol_spike': 0.2995386645336177, 'adx_thresh': 13.481090603777531, 'atr_min_pct': 0.022031598586910024, 'atr_max_pct': 0.044964570244874574, 'tp_mult': 1.4497661465213523, 'tsl_mult': 0.9948570499219169, 'strategy': 'breakout', 'time_stop': 102, 'use_sma': True, 'use_atr': True, 'use_adx': False, 'use_ema': True, 'use_spike': False, 'rsi_required': False, 'edge_k': 0.06153172460445122, 'edge_cap': 0.31524667615006674, 'bull_strategy': 'breakout', 'bull_bb_std_mult': 0.9456838131476504, 'bull_rsi_os': 51, 'bull_rsi_ob': 56, 'bull_adx_thresh': 26.567640216625755, 'bull_atr_min_pct': 0.0031311393094648468, 'bull_atr_max_pct': 0.06480511774089752, 'bull_tp_mult': 1.8783023331325341, 'bull_tsl_mult': 0.3579513267624142, 'bull_time_stop': 73, 'bull_use_sma': True, 'bull_use_ema': True, 'bull_use_atr': False, 'bull_use_adx': True, 'bull_use_spike': False, 'bull_rsi_required': True, 'bear_strategy': 'mean_reversion', 'bear_bb_std_mult': 0.9396374708389106, 'bear_rsi_os': 11, 'bear_rsi_ob': 88, 'bear_adx_thresh': 12.33567185357028, 'bear_atr_min_pct': 0.024742614171745773, 'bear_atr_max_pct': 0.08271654550443351, 'bear_tp_mult': 2.2846250087912625, 'bear_tsl_mult': 0.5347701752862507, 'bear_time_stop': 26, 'bear_use_sma': True, 'bear_use_ema': False, 'bear_use_atr': True, 'bear_use_adx': True, 'bear_use_spike': False, 'bear_rsi_required': False, 'sideways_strategy': 'mean_reversion', 'sideways_bb_std_mult': 0.6896054253318316, 'sideways_rsi_os': 30, 'sideways_rsi_ob': 91, 'sideways_adx_thresh': 30.098480252931665, 'sideways_atr_min_pct': 0.010431919182851778, 'sideways_atr_max_pct': 0.12165994464353883, 'sideways_tp_mult': 2.7343383535426917, 'sideways_tsl_mult': 0.5350114971614081, 'sideways_time_stop': 11, 'sideways_use_sma': False, 'sideways_use_ema': True, 'sideways_use_atr': True, 'sideways_use_adx': False, 'sideways_use_spike': False, 'sideways_rsi_required': True}.
[I 2025-09-01 13:34:54,510] Trial 213 finished with values: [-1000000000.0, 1000000000.0] and parameters: {'p_sma': 37, 'p_std': 50, 'p_atr': 10, 'p_adx': 14, 'rsi_period': 66, 'ema1': 22, 'ema2': 60, 'slip_atr_k': 0.039420929313517934, 'slip_spread_k': 0.34093070308186674, 'spread_hl_frac': 0.006984481615384027, 'bb_std_mult': 2.3792299130801275, 'rsi_os': 11, 'rsi_ob': 95, 'vol_spike': 0.24204697545469706, 'adx_thresh': 16.529378088214774, 'atr_min_pct': 0.027066233296025248, 'atr_max_pct': 0.050634163089301486, 'tp_mult': 1.3845267896389222, 'tsl_mult': 0.19540637377310735, 'strategy': 'breakout', 'time_stop': 252, 'use_sma': True, 'use_atr': False, 'use_adx': False, 'use_ema': True, 'use_spike': True, 'rsi_required': False, 'edge_k': 0.5725167149024637, 'edge_cap': 0.2868882196598677, 'bull_strategy': 'breakout', 'bull_bb_std_mult': 3.368832349372573, 'bull_rsi_os': 54, 'bull_rsi_ob': 94, 'bull_adx_thresh': 11.199173295982161, 'bull_atr_min_pct': 0.02364832697047687, 'bull_atr_max_pct': 0.027236329510788485, 'bull_tp_mult': 1.6217548169300184, 'bull_tsl_mult': 0.4447928117969314, 'bull_time_stop': 86, 'bull_use_sma': True, 'bull_use_ema': True, 'bull_use_atr': True, 'bull_use_adx': False, 'bull_use_spike': False, 'bull_rsi_required': True, 'bear_strategy': 'breakout', 'bear_bb_std_mult': 0.7673595542551879, 'bear_rsi_os': 30, 'bear_rsi_ob': 91, 'bear_adx_thresh': 10.434843214759752, 'bear_atr_min_pct': 0.00333742835712093, 'bear_atr_max_pct': 0.0884466275738269, 'bear_tp_mult': 2.185984888544177, 'bear_tsl_mult': 0.08214563573027364, 'bear_time_stop': 211, 'bear_use_sma': True, 'bear_use_ema': True, 'bear_use_atr': True, 'bear_use_adx': False, 'bear_use_spike': True, 'bear_rsi_required': True, 'sideways_strategy': 'breakout', 'sideways_bb_std_mult': 2.079368805675191, 'sideways_rsi_os': 45, 'sideways_rsi_ob': 95, 'sideways_adx_thresh': 7.057119646100739, 'sideways_atr_min_pct': 0.007213548680799751, 'sideways_atr_max_pct': 0.13184588918474555, 'sideways_tp_mult': 2.621910247079176, 'sideways_tsl_mult': 0.24741400519583628, 'sideways_time_stop': 201, 'sideways_use_sma': True, 'sideways_use_ema': False, 'sideways_use_atr': False, 'sideways_use_adx': True, 'sideways_use_spike': True, 'sideways_rsi_required': True}.
[I 2025-09-01 13:34:54,512] Trial 211 finished with values: [-1000000000.0, 1000000000.0] and parameters: {'p_sma': 39, 'p_std': 50, 'p_atr': 10, 'p_adx': 14, 'rsi_period': 66, 'ema1': 22, 'ema2': 60, 'slip_atr_k': 0.031719071248291444, 'slip_spread_k': 0.3554235634201967, 'spread_hl_frac': 0.006993973331600831, 'bb_std_mult': 3.264710255296152, 'rsi_os': 37, 'rsi_ob': 95, 'vol_spike': 0.25337218449004956, 'adx_thresh': 16.049626730808647, 'atr_min_pct': 0.02287068811282103, 'atr_max_pct': 0.050365118464660213, 'tp_mult': 1.3844958636730311, 'tsl_mult': 0.19347815463836632, 'strategy': 'breakout', 'time_stop': 252, 'use_sma': True, 'use_atr': False, 'use_adx': False, 'use_ema': True, 'use_spike': True, 'rsi_required': False, 'edge_k': 1.256948143237757, 'edge_cap': 0.3361288328768927, 'bull_strategy': 'breakout', 'bull_bb_std_mult': 3.366954346886586, 'bull_rsi_os': 54, 'bull_rsi_ob': 94, 'bull_adx_thresh': 34.02290764332232, 'bull_atr_min_pct': 0.0028999565395446403, 'bull_atr_max_pct': 0.02526612211933517, 'bull_tp_mult': 2.2784812244621118, 'bull_tsl_mult': 0.446118075241557, 'bull_time_stop': 89, 'bull_use_sma': True, 'bull_use_ema': True, 'bull_use_atr': True, 'bull_use_adx': False, 'bull_use_spike': False, 'bull_rsi_required': False, 'bear_strategy': 'breakout', 'bear_bb_std_mult': 1.080907251650373, 'bear_rsi_os': 30, 'bear_rsi_ob': 91, 'bear_adx_thresh': 17.731029974295005, 'bear_atr_min_pct': 0.0032820533671800503, 'bear_atr_max_pct': 0.08949791189252045, 'bear_tp_mult': 2.299194519463988, 'bear_tsl_mult': 0.1346367998077446, 'bear_time_stop': 212, 'bear_use_sma': True, 'bear_use_ema': False, 'bear_use_atr': True, 'bear_use_adx': False, 'bear_use_spike': True, 'bear_rsi_required': True, 'sideways_strategy': 'breakout', 'sideways_bb_std_mult': 1.9733592912510463, 'sideways_rsi_os': 45, 'sideways_rsi_ob': 95, 'sideways_adx_thresh': 6.761138236045529, 'sideways_atr_min_pct': 0.008284463722137267, 'sideways_atr_max_pct': 0.1349102881085625, 'sideways_tp_mult': 2.6052624520093284, 'sideways_tsl_mult': 0.23447308550129972, 'sideways_time_stop': 27, 'sideways_use_sma': True, 'sideways_use_ema': False, 'sideways_use_atr': False, 'sideways_use_adx': True, 'sideways_use_spike': True, 'sideways_rsi_required': True}.
[I 2025-09-01 13:34:54,897] Trial 212 finished with values: [-1000000000.0, 1000000000.0] and parameters: {'p_sma': 37, 'p_std': 49, 'p_atr': 30, 'p_adx': 9, 'rsi_period': 66, 'ema1': 22, 'ema2': 60, 'slip_atr_k': 0.03559779838201658, 'slip_spread_k': 0.019944707549542584, 'spread_hl_frac': 0.0061834426158414064, 'bb_std_mult': 2.510637609849887, 'rsi_os': 40, 'rsi_ob': 95, 'vol_spike': 0.2601343491771034, 'adx_thresh': 16.916599266590463, 'atr_min_pct': 0.01288147480339635, 'atr_max_pct': 0.050991797001926, 'tp_mult': 1.3974853435608268, 'tsl_mult': 0.20595309752764773, 'strategy': 'breakout', 'time_stop': 253, 'use_sma': True, 'use_atr': False, 'use_adx': False, 'use_ema': True, 'use_spike': True, 'rsi_required': False, 'edge_k': 0.5803596400276811, 'edge_cap': 0.33995963613722124, 'bull_strategy': 'breakout', 'bull_bb_std_mult': 3.417888410853866, 'bull_rsi_os': 53, 'bull_rsi_ob': 53, 'bull_adx_thresh': 26.448637942997905, 'bull_atr_min_pct': 0.014036993778121535, 'bull_atr_max_pct': 0.02590174240040928, 'bull_tp_mult': 1.7107942202414421, 'bull_tsl_mult': 0.4491946068405238, 'bull_time_stop': 91, 'bull_use_sma': True, 'bull_use_ema': True, 'bull_use_atr': True, 'bull_use_adx': False, 'bull_use_spike': False, 'bull_rsi_required': True, 'bear_strategy': 'breakout', 'bear_bb_std_mult': 1.4608108867848233, 'bear_rsi_os': 30, 'bear_rsi_ob': 91, 'bear_adx_thresh': 10.433853048931859, 'bear_atr_min_pct': 0.0034659516321492593, 'bear_atr_max_pct': 0.08859938407208381, 'bear_tp_mult': 2.207851606327819, 'bear_tsl_mult': 0.19923218016418437, 'bear_time_stop': 212, 'bear_use_sma': True, 'bear_use_ema': False, 'bear_use_atr': True, 'bear_use_adx': False, 'bear_use_spike': False, 'bear_rsi_required': True, 'sideways_strategy': 'breakout', 'sideways_bb_std_mult': 1.9859902405669716, 'sideways_rsi_os': 49, 'sideways_rsi_ob': 82, 'sideways_adx_thresh': 6.690004678246372, 'sideways_atr_min_pct': 0.007301629396875065, 'sideways_atr_max_pct': 0.13535925131138024, 'sideways_tp_mult': 2.642452016260233, 'sideways_tsl_mult': 0.24459797076668305, 'sideways_time_stop': 200, 'sideways_use_sma': True, 'sideways_use_ema': False, 'sideways_use_atr': True, 'sideways_use_adx': True, 'sideways_use_spike': True, 'sideways_rsi_required': True}.
[I 2025-09-01 13:34:55,149] Trial 210 finished with values: [-1000000000.0, 1000000000.0] and parameters: {'p_sma': 37, 'p_std': 50, 'p_atr': 30, 'p_adx': 9, 'rsi_period': 65, 'ema1': 22, 'ema2': 60, 'slip_atr_k': 0.010670525668428459, 'slip_spread_k': 0.3395953615650824, 'spread_hl_frac': 0.006555046948088713, 'bb_std_mult': 3.270112439952289, 'rsi_os': 37, 'rsi_ob': 95, 'vol_spike': 0.2582085543559958, 'adx_thresh': 16.675136799082566, 'atr_min_pct': 0.0166863524620807, 'atr_max_pct': 0.04895622215548284, 'tp_mult': 1.3910961197593101, 'tsl_mult': 0.2547096268270821, 'strategy': 'breakout', 'time_stop': 254, 'use_sma': True, 'use_atr': False, 'use_adx': False, 'use_ema': True, 'use_spike': True, 'rsi_required': False, 'edge_k': 0.5669103667084672, 'edge_cap': 0.3351458874615584, 'bull_strategy': 'breakout', 'bull_bb_std_mult': 3.4109876348323755, 'bull_rsi_os': 54, 'bull_rsi_ob': 77, 'bull_adx_thresh': 5.006051050592615, 'bull_atr_min_pct': 0.019974046251120956, 'bull_atr_max_pct': 0.02642990823507531, 'bull_tp_mult': 2.4485530404659284, 'bull_tsl_mult': 0.46764056476589866, 'bull_time_stop': 79, 'bull_use_sma': True, 'bull_use_ema': True, 'bull_use_atr': False, 'bull_use_adx': False, 'bull_use_spike': False, 'bull_rsi_required': False, 'bear_strategy': 'breakout', 'bear_bb_std_mult': 0.7693485758696581, 'bear_rsi_os': 30, 'bear_rsi_ob': 91, 'bear_adx_thresh': 10.456607548858221, 'bear_atr_min_pct': 0.004715446732244284, 'bear_atr_max_pct': 0.08964818795944857, 'bear_tp_mult': 2.282035098409496, 'bear_tsl_mult': 0.13652299236260818, 'bear_time_stop': 215, 'bear_use_sma': True, 'bear_use_ema': False, 'bear_use_atr': True, 'bear_use_adx': False, 'bear_use_spike': True, 'bear_rsi_required': True, 'sideways_strategy': 'breakout', 'sideways_bb_std_mult': 1.801613341560242, 'sideways_rsi_os': 45, 'sideways_rsi_ob': 95, 'sideways_adx_thresh': 7.0076946990853095, 'sideways_atr_min_pct': 0.008056959811487385, 'sideways_atr_max_pct': 0.1323849875573393, 'sideways_tp_mult': 2.6045986540376957, 'sideways_tsl_mult': 0.229963990342389, 'sideways_time_stop': 41, 'sideways_use_sma': True, 'sideways_use_ema': True, 'sideways_use_atr': False, 'sideways_use_adx': True, 'sideways_use_spike': False, 'sideways_rsi_required': True}.
[I 2025-09-01 13:35:34,149] Trial 217 finished with values: [-1000000000.0, 1000000000.0] and parameters: {'p_sma': 32, 'p_std': 48, 'p_atr': 20, 'p_adx': 12, 'rsi_period': 67, 'ema1': 21, 'ema2': 45, 'slip_atr_k': 0.01823825740673027, 'slip_spread_k': 0.10096281561697978, 'spread_hl_frac': 0.0047622733469655995, 'bb_std_mult': 1.8406316745665874, 'rsi_os': 32, 'rsi_ob': 93, 'vol_spike': 0.2505195021097872, 'adx_thresh': 14.349455043006387, 'atr_min_pct': 0.02898215085394245, 'atr_max_pct': 0.10062195448373888, 'tp_mult': 1.4209321732472784, 'tsl_mult': 0.22719333007802178, 'strategy': 'mean_reversion', 'time_stop': 236, 'use_sma': False, 'use_atr': False, 'use_adx': False, 'use_ema': False, 'use_spike': True, 'rsi_required': False, 'edge_k': 0.4595413392325797, 'edge_cap': 0.3781201694716968, 'bull_strategy': 'breakout', 'bull_bb_std_mult': 3.317957402363671, 'bull_rsi_os': 52, 'bull_rsi_ob': 47, 'bull_adx_thresh': 6.044315938482234, 'bull_atr_min_pct': 0.022045450465309698, 'bull_atr_max_pct': 0.09176806346857565, 'bull_tp_mult': 1.7220545942318104, 'bull_tsl_mult': 0.7612398060767183, 'bull_time_stop': 104, 'bull_use_sma': False, 'bull_use_ema': False, 'bull_use_atr': True, 'bull_use_adx': True, 'bull_use_spike': False, 'bull_rsi_required': True, 'bear_strategy': 'breakout', 'bear_bb_std_mult': 3.091548921253758, 'bear_rsi_os': 34, 'bear_rsi_ob': 86, 'bear_adx_thresh': 9.112293328816468, 'bear_atr_min_pct': 0.00590228441777588, 'bear_atr_max_pct': 0.0925834000455537, 'bear_tp_mult': 2.121432021649522, 'bear_tsl_mult': 0.17640869585585728, 'bear_time_stop': 185, 'bear_use_sma': False, 'bear_use_ema': False, 'bear_use_atr': False, 'bear_use_adx': True, 'bear_use_spike': False, 'bear_rsi_required': True, 'sideways_strategy': 'breakout', 'sideways_bb_std_mult': 2.172638883376272, 'sideways_rsi_os': 43, 'sideways_rsi_ob': 68, 'sideways_adx_thresh': 8.270577708931333, 'sideways_atr_min_pct': 0.00885970522142564, 'sideways_atr_max_pct': 0.1273005538277785, 'sideways_tp_mult': 2.6804019023358863, 'sideways_tsl_mult': 0.07951154670038743, 'sideways_time_stop': 21, 'sideways_use_sma': True, 'sideways_use_ema': False, 'sideways_use_atr': True, 'sideways_use_adx': True, 'sideways_use_spike': False, 'sideways_rsi_required': False}.
[I 2025-09-01 13:35:35,100] Trial 214 finished with values: [-1000000000.0, 1000000000.0] and parameters: {'p_sma': 32, 'p_std': 49, 'p_atr': 29, 'p_adx': 9, 'rsi_period': 65, 'ema1': 21, 'ema2': 44, 'slip_atr_k': 0.000814327508242875, 'slip_spread_k': 0.3824854781816116, 'spread_hl_frac': 0.005606642427898404, 'bb_std_mult': 1.7823719006889536, 'rsi_os': 40, 'rsi_ob': 94, 'vol_spike': 0.2598840728260683, 'adx_thresh': 15.292051631546329, 'atr_min_pct': 0.016262546536484478, 'atr_max_pct': 0.10386316000365914, 'tp_mult': 1.4131781682737241, 'tsl_mult': 0.24403837672709877, 'strategy': 'breakout', 'time_stop': 236, 'use_sma': True, 'use_atr': False, 'use_adx': False, 'use_ema': True, 'use_spike': True, 'rsi_required': False, 'edge_k': 1.9137331430516356, 'edge_cap': 0.3647616951676268, 'bull_strategy': 'breakout', 'bull_bb_std_mult': 1.0393960692003283, 'bull_rsi_os': 52, 'bull_rsi_ob': 85, 'bull_adx_thresh': 5.05738033738084, 'bull_atr_min_pct': 0.0213121717978907, 'bull_atr_max_pct': 0.02097367451518468, 'bull_tp_mult': 1.745848436473104, 'bull_tsl_mult': 0.4721852071265409, 'bull_time_stop': 101, 'bull_use_sma': True, 'bull_use_ema': True, 'bull_use_atr': True, 'bull_use_adx': True, 'bull_use_spike': False, 'bull_rsi_required': True, 'bear_strategy': 'breakout', 'bear_bb_std_mult': 0.8264307282325654, 'bear_rsi_os': 32, 'bear_rsi_ob': 86, 'bear_adx_thresh': 15.698367131761621, 'bear_atr_min_pct': 0.005448553253500368, 'bear_atr_max_pct': 0.05544268932429131, 'bear_tp_mult': 2.2412265784496155, 'bear_tsl_mult': 0.18085664852445893, 'bear_time_stop': 188, 'bear_use_sma': True, 'bear_use_ema': False, 'bear_use_atr': True, 'bear_use_adx': True, 'bear_use_spike': False, 'bear_rsi_required': True, 'sideways_strategy': 'breakout', 'sideways_bb_std_mult': 1.6967038717029292, 'sideways_rsi_os': 49, 'sideways_rsi_ob': 94, 'sideways_adx_thresh': 8.139167403821126, 'sideways_atr_min_pct': 0.008315562870130005, 'sideways_atr_max_pct': 0.12682842904513952, 'sideways_tp_mult': 2.677735359785561, 'sideways_tsl_mult': 0.3107144924934963, 'sideways_time_stop': 121, 'sideways_use_sma': True, 'sideways_use_ema': False, 'sideways_use_atr': True, 'sideways_use_adx': True, 'sideways_use_spike': False, 'sideways_rsi_required': True}.
