[I 2025-09-01 13:22:35,785] Trial 135 finished with values: [-1000000000.0, 1000000000.0] and parameters: {'p_sma': 52, 'p_std': 43, 'p_atr': 11, 'p_adx': 18, 'rsi_period': 69, 'ema1': 19, 'ema2': 29, 'slip_atr_k': 0.04873150221335479, 'slip_spread_k': 0.40856848338310614, 'spread_hl_frac': 0.042502091467002595, 'bb_std_mult': 1.8107123448740792, 'rsi_os': 43, 'rsi_ob': 89, 'vol_spike': 0.21188969139593192, 'adx_thresh': 11.832207647190357, 'atr_min_pct': 0.005555696682433692, 'atr_max_pct': 0.029787750144420918, 'tp_mult': 1.4146855896414774, 'tsl_mult': 0.10234949805031353, 'strategy': 'breakout', 'time_stop': 83, 'use_sma': True, 'use_atr': True, 'use_adx': True, 'use_ema': False, 'use_spike': True, 'rsi_required': True, 'edge_k': 0.28524464850856446, 'edge_cap': 0.9129494854987421, 'bull_strategy': 'mean_reversion', 'bull_bb_std_mult': 3.1093876896094743, 'bull_rsi_os': 52, 'bull_rsi_ob': 57, 'bull_adx_thresh': 6.364437524137648, 'bull_atr_min_pct': 0.02301455685938132, 'bull_atr_max_pct': 0.016901672816160982, 'bull_tp_mult': 1.0269834659023713, 'bull_tsl_mult': 0.03083453168388356, 'bull_time_stop': 19, 'bull_use_sma': False, 'bull_use_ema': True, 'bull_use_atr': True, 'bull_use_adx': True, 'bull_use_spike': True, 'bull_rsi_required': True, 'bear_strategy': 'mean_reversion', 'bear_bb_std_mult': 1.0498891305396525, 'bear_rsi_os': 37, 'bear_rsi_ob': 69, 'bear_adx_thresh': 11.907329668030464, 'bear_atr_min_pct': 0.020526238887044516, 'bear_atr_max_pct': 0.0915786093505756, 'bear_tp_mult': 2.709549026409107, 'bear_tsl_mult': 0.5165101998484574, 'bear_time_stop': 83, 'bear_use_sma': False, 'bear_use_ema': False, 'bear_use_atr': True, 'bear_use_adx': True, 'bear_use_spike': False, 'bear_rsi_required': True, 'sideways_strategy': 'mean_reversion', 'sideways_bb_std_mult': 3.0746439738906712, 'sideways_rsi_os': 30, 'sideways_rsi_ob': 93, 'sideways_adx_thresh': 29.560584868375244, 'sideways_atr_min_pct': 0.009907168591059978, 'sideways_atr_max_pct': 0.11457120315976883, 'sideways_tp_mult': 1.8484742206837863, 'sideways_tsl_mult': 0.5688429046360879, 'sideways_time_stop': 19, 'sideways_use_sma': True, 'sideways_use_ema': False, 'sideways_use_atr': True, 'sideways_use_adx': False, 'sideways_use_spike': True, 'sideways_rsi_required': False}.
[I 2025-09-01 13:22:35,804] Trial 137 finished with values: [-1000000000.0, 1000000000.0] and parameters: {'p_sma': 56, 'p_std': 44, 'p_atr': 29, 'p_adx': 18, 'rsi_period': 69, 'ema1': 5, 'ema2': 59, 'slip_atr_k': 0.1859217426264105, 'slip_spread_k': 0.4421388079801582, 'spread_hl_frac': 0.010841206920802239, 'bb_std_mult': 1.931510788132795, 'rsi_os': 23, 'rsi_ob': 55, 'vol_spike': 0.21521298178831072, 'adx_thresh': 11.566366085380617, 'atr_min_pct': 0.005820732812951474, 'atr_max_pct': 0.030497457128990397, 'tp_mult': 1.5785466824104548, 'tsl_mult': 0.07985873578936357, 'strategy': 'breakout', 'time_stop': 71, 'use_sma': True, 'use_atr': True, 'use_adx': False, 'use_ema': False, 'use_spike': True, 'rsi_required': True, 'edge_k': 0.29092921306918273, 'edge_cap': 0.8288136359002205, 'bull_strategy': 'mean_reversion', 'bull_bb_std_mult': 1.768253376201796, 'bull_rsi_os': 48, 'bull_rsi_ob': 78, 'bull_adx_thresh': 6.521695876398798, 'bull_atr_min_pct': 0.022943150046310222, 'bull_atr_max_pct': 0.018153754584297167, 'bull_tp_mult': 2.068791540419662, 'bull_tsl_mult': 0.3425559230517643, 'bull_time_stop': 19, 'bull_use_sma': False, 'bull_use_ema': True, 'bull_use_atr': True, 'bull_use_adx': True, 'bull_use_spike': True, 'bull_rsi_required': True, 'bear_strategy': 'breakout', 'bear_bb_std_mult': 1.0943993133691967, 'bear_rsi_os': 38, 'bear_rsi_ob': 94, 'bear_adx_thresh': 13.785377043297373, 'bear_atr_min_pct': 0.020453682230114657, 'bear_atr_max_pct': 0.055432722835181074, 'bear_tp_mult': 1.7050275398115025, 'bear_tsl_mult': 0.7925815208739928, 'bear_time_stop': 79, 'bear_use_sma': False, 'bear_use_ema': False, 'bear_use_atr': True, 'bear_use_adx': True, 'bear_use_spike': False, 'bear_rsi_required': True, 'sideways_strategy': 'mean_reversion', 'sideways_bb_std_mult': 0.7926595554768743, 'sideways_rsi_os': 28, 'sideways_rsi_ob': 93, 'sideways_adx_thresh': 15.38532683665312, 'sideways_atr_min_pct': 0.012461194282844153, 'sideways_atr_max_pct': 0.14187348764220012, 'sideways_tp_mult': 2.584237260510329, 'sideways_tsl_mult': 0.6730548589283929, 'sideways_time_stop': 192, 'sideways_use_sma': True, 'sideways_use_ema': False, 'sideways_use_atr': True, 'sideways_use_adx': False, 'sideways_use_spike': True, 'sideways_rsi_required': False}.
[I 2025-09-01 13:22:36,053] Trial 136 finished with values: [-1000000000.0, 1000000000.0] and parameters: {'p_sma': 5, 'p_std': 43, 'p_atr': 15, 'p_adx': 18, 'rsi_period': 69, 'ema1': 19, 'ema2': 59, 'slip_atr_k': 0.187814974800173, 'slip_spread_k': 0.400351731125636, 'spread_hl_frac': 0.01115810425688114, 'bb_std_mult': 1.8063352783715365, 'rsi_os': 43, 'rsi_ob': 55, 'vol_spike': 0.23772934559399034, 'adx_thresh': 11.898987822626168, 'atr_min_pct': 0.029328991307912965, 'atr_max_pct': 0.12306199591036632, 'tp_mult': 1.572496794109775, 'tsl_mult': 0.1118575402499736, 'strategy': 'breakout', 'time_stop': 85, 'use_sma': True, 'use_atr': True, 'use_adx': True, 'use_ema': False, 'use_spike': True, 'rsi_required': True, 'edge_k': 0.28187773223619184, 'edge_cap': 0.8241103747864927, 'bull_strategy': 'mean_reversion', 'bull_bb_std_mult': 3.2285699057592474, 'bull_rsi_os': 52, 'bull_rsi_ob': 54, 'bull_adx_thresh': 6.570337349334276, 'bull_atr_min_pct': 0.004201120293541354, 'bull_atr_max_pct': 0.017905229410540426, 'bull_tp_mult': 1.8216574843624345, 'bull_tsl_mult': 0.47550685760366335, 'bull_time_stop': 43, 'bull_use_sma': False, 'bull_use_ema': True, 'bull_use_atr': True, 'bull_use_adx': True, 'bull_use_spike': True, 'bull_rsi_required': True, 'bear_strategy': 'mean_reversion', 'bear_bb_std_mult': 0.8727112338001549, 'bear_rsi_os': 9, 'bear_rsi_ob': 69, 'bear_adx_thresh': 28.082394559396683, 'bear_atr_min_pct': 0.022296901048157302, 'bear_atr_max_pct': 0.09108462226951103, 'bear_tp_mult': 2.6605643445240434, 'bear_tsl_mult': 0.5161613022675584, 'bear_time_stop': 262, 'bear_use_sma': False, 'bear_use_ema': False, 'bear_use_atr': True, 'bear_use_adx': True, 'bear_use_spike': False, 'bear_rsi_required': True, 'sideways_strategy': 'mean_reversion', 'sideways_bb_std_mult': 0.7947899552575145, 'sideways_rsi_os': 30, 'sideways_rsi_ob': 93, 'sideways_adx_thresh': 33.83934241125677, 'sideways_atr_min_pct': 0.016003208079716648, 'sideways_atr_max_pct': 0.12984116043471952, 'sideways_tp_mult': 2.5803986804927264, 'sideways_tsl_mult': 0.5667953240999246, 'sideways_time_stop': 19, 'sideways_use_sma': True, 'sideways_use_ema': False, 'sideways_use_atr': True, 'sideways_use_adx': False, 'sideways_use_spike': True, 'sideways_rsi_required': False}.
[I 2025-09-01 13:23:13,755] Trial 140 finished with values: [-0.03508900636517631, 0.03486535118707246] and parameters: {'p_sma': 56, 'p_std': 35, 'p_atr': 30, 'p_adx': 27, 'rsi_period': 67, 'ema1': 9, 'ema2': 55, 'slip_atr_k': 0.09713670123808787, 'slip_spread_k': 0.3173968898452193, 'spread_hl_frac': 0.0134973562856978, 'bb_std_mult': 1.6887610367615407, 'rsi_os': 29, 'rsi_ob': 90, 'vol_spike': 0.19340896246685452, 'adx_thresh': 27.849782750919466, 'atr_min_pct': 0.015425717038171501, 'atr_max_pct': 0.024443194830502203, 'tp_mult': 1.0787250884931143, 'tsl_mult': 0.17092674577569614, 'strategy': 'breakout', 'time_stop': 160, 'use_sma': True, 'use_atr': True, 'use_adx': False, 'use_ema': True, 'use_spike': False, 'rsi_required': True, 'edge_k': 1.80273420703654, 'edge_cap': 0.6807735003608159, 'bull_strategy': 'breakout', 'bull_bb_std_mult': 2.742651738413877, 'bull_rsi_os': 29, 'bull_rsi_ob': 81, 'bull_adx_thresh': 5.023184887535166, 'bull_atr_min_pct': 0.001109707546715356, 'bull_atr_max_pct': 0.08645622474926754, 'bull_tp_mult': 2.305378736114836, 'bull_tsl_mult': 0.14765506846299142, 'bull_time_stop': 276, 'bull_use_sma': True, 'bull_use_ema': True, 'bull_use_atr': True, 'bull_use_adx': True, 'bull_use_spike': False, 'bull_rsi_required': True, 'bear_strategy': 'breakout', 'bear_bb_std_mult': 1.2720474473860799, 'bear_rsi_os': 29, 'bear_rsi_ob': 50, 'bear_adx_thresh': 8.646515966253684, 'bear_atr_min_pct': 0.01816930373593199, 'bear_atr_max_pct': 0.048317781545312216, 'bear_tp_mult': 1.6590719113581605, 'bear_tsl_mult': 0.7527073268198397, 'bear_time_stop': 246, 'bear_use_sma': True, 'bear_use_ema': False, 'bear_use_atr': False, 'bear_use_adx': True, 'bear_use_spike': True, 'bear_rsi_required': False, 'sideways_strategy': 'breakout', 'sideways_bb_std_mult': 0.8853440642872062, 'sideways_rsi_os': 18, 'sideways_rsi_ob': 87, 'sideways_adx_thresh': 14.922290913946192, 'sideways_atr_min_pct': 0.006898876406318153, 'sideways_atr_max_pct': 0.1206874613166456, 'sideways_tp_mult': 1.1060104373491906, 'sideways_tsl_mult': 0.521859887435661, 'sideways_time_stop': 164, 'sideways_use_sma': False, 'sideways_use_ema': True, 'sideways_use_atr': False, 'sideways_use_adx': True, 'sideways_use_spike': False, 'sideways_rsi_required': True}.
[I 2025-09-01 13:23:14,832] Trial 138 finished with values: [-1000000000.0, 1000000000.0] and parameters: {'p_sma': 56, 'p_std': 18, 'p_atr': 18, 'p_adx': 23, 'rsi_period': 68, 'ema1': 5, 'ema2': 30, 'slip_atr_k': 0.1870280917832245, 'slip_spread_k': 0.31895764276087113, 'spread_hl_frac': 0.010950776577957734, 'bb_std_mult': 1.8277756136647998, 'rsi_os': 42, 'rsi_ob': 57, 'vol_spike': 0.2862795037725698, 'adx_thresh': 29.24845349600183, 'atr_min_pct': 0.005753900765706213, 'atr_max_pct': 0.03097172015051054, 'tp_mult': 1.0164055230382714, 'tsl_mult': 0.07707688318417352, 'strategy': 'breakout', 'time_stop': 70, 'use_sma': True, 'use_atr': True, 'use_adx': False, 'use_ema': False, 'use_spike': True, 'rsi_required': True, 'edge_k': 1.8133650481332801, 'edge_cap': 0.8247066314598334, 'bull_strategy': 'breakout', 'bull_bb_std_mult': 1.7186492036654841, 'bull_rsi_os': 48, 'bull_rsi_ob': 74, 'bull_adx_thresh': 5.285121050838815, 'bull_atr_min_pct': 0.022710122225738576, 'bull_atr_max_pct': 0.01804682302493598, 'bull_tp_mult': 1.817417827588468, 'bull_tsl_mult': 0.4754699972381498, 'bull_time_stop': 19, 'bull_use_sma': True, 'bull_use_ema': True, 'bull_use_atr': True, 'bull_use_adx': True, 'bull_use_spike': True, 'bull_rsi_required': True, 'bear_strategy': 'breakout', 'bear_bb_std_mult': 0.8968480832030353, 'bear_rsi_os': 9, 'bear_rsi_ob': 78, 'bear_adx_thresh': 32.156053364809665, 'bear_atr_min_pct': 0.02042009807832931, 'bear_atr_max_pct': 0.047603532985765036, 'bear_tp_mult': 1.0561708130361014, 'bear_tsl_mult': 0.518457342229829, 'bear_time_stop': 86, 'bear_use_sma': True, 'bear_use_ema': False, 'bear_use_atr': True, 'bear_use_adx': True, 'bear_use_spike': True, 'bear_rsi_required': True, 'sideways_strategy': 'mean_reversion', 'sideways_bb_std_mult': 0.9148035676593027, 'sideways_rsi_os': 30, 'sideways_rsi_ob': 87, 'sideways_adx_thresh': 33.83306445119328, 'sideways_atr_min_pct': 0.009859377366312597, 'sideways_atr_max_pct': 0.11367207980785207, 'sideways_tp_mult': 1.8672653666187762, 'sideways_tsl_mult': 0.4592729090385976, 'sideways_time_stop': 19, 'sideways_use_sma': True, 'sideways_use_ema': True, 'sideways_use_atr': False, 'sideways_use_adx': False, 'sideways_use_spike': True, 'sideways_rsi_required': True}.
[I 2025-09-01 13:23:15,077] Trial 141 finished with values: [-0.0307984559918707, 0.031121076478346485] and parameters: {'p_sma': 56, 'p_std': 48, 'p_atr': 30, 'p_adx': 19, 'rsi_period': 56, 'ema1': 21, 'ema2': 56, 'slip_atr_k': 0.1320967583744102, 'slip_spread_k': 0.3333076680251033, 'spread_hl_frac': 0.014514526663287362, 'bb_std_mult': 1.6705977134940508, 'rsi_os': 5, 'rsi_ob': 90, 'vol_spike': 0.2282316423943699, 'adx_thresh': 9.780045649477028, 'atr_min_pct': 0.013495005273023546, 'atr_max_pct': 0.03912251933103426, 'tp_mult': 1.1024922191788016, 'tsl_mult': 0.9571284029868788, 'strategy': 'breakout', 'time_stop': 241, 'use_sma': True, 'use_atr': True, 'use_adx': False, 'use_ema': True, 'use_spike': False, 'rsi_required': True, 'edge_k': 0.42136833496432835, 'edge_cap': 0.646644012833841, 'bull_strategy': 'breakout', 'bull_bb_std_mult': 2.5334030748631005, 'bull_rsi_os': 46, 'bull_rsi_ob': 53, 'bull_adx_thresh': 5.261584502511834, 'bull_atr_min_pct': 0.0011903304794650647, 'bull_atr_max_pct': 0.06262087592026443, 'bull_tp_mult': 1.898337065684164, 'bull_tsl_mult': 0.4417063778124963, 'bull_time_stop': 11, 'bull_use_sma': True, 'bull_use_ema': True, 'bull_use_atr': True, 'bull_use_adx': True, 'bull_use_spike': False, 'bull_rsi_required': True, 'bear_strategy': 'breakout', 'bear_bb_std_mult': 1.2779404659268692, 'bear_rsi_os': 29, 'bear_rsi_ob': 50, 'bear_adx_thresh': 10.242507558497135, 'bear_atr_min_pct': 0.028195196757515716, 'bear_atr_max_pct': 0.06372375869100438, 'bear_tp_mult': 1.0703318859713145, 'bear_tsl_mult': 0.5340879400978442, 'bear_time_stop': 59, 'bear_use_sma': True, 'bear_use_ema': False, 'bear_use_atr': False, 'bear_use_adx': True, 'bear_use_spike': True, 'bear_rsi_required': False, 'sideways_strategy': 'breakout', 'sideways_bb_std_mult': 0.93721292783549, 'sideways_rsi_os': 29, 'sideways_rsi_ob': 87, 'sideways_adx_thresh': 14.677700528818901, 'sideways_atr_min_pct': 0.0012703049645631358, 'sideways_atr_max_pct': 0.10797765481949645, 'sideways_tp_mult': 2.8308970430681972, 'sideways_tsl_mult': 0.4276583380705453, 'sideways_time_stop': 27, 'sideways_use_sma': False, 'sideways_use_ema': True, 'sideways_use_atr': False, 'sideways_use_adx': True, 'sideways_use_spike': False, 'sideways_rsi_required': True}.
[I 2025-09-01 13:23:15,362] Trial 139 finished with values: [-0.03320581848033599, 0.0329567929992834] and parameters: {'p_sma': 56, 'p_std': 48, 'p_atr': 30, 'p_adx': 27, 'rsi_period': 67, 'ema1': 9, 'ema2': 56, 'slip_atr_k': 0.197378078864188, 'slip_spread_k': 0.3220823227561003, 'spread_hl_frac': 0.035669064557747376, 'bb_std_mult': 1.6214486577472842, 'rsi_os': 27, 'rsi_ob': 90, 'vol_spike': 0.14039630186564253, 'adx_thresh': 29.34278052843095, 'atr_min_pct': 0.015737228691598937, 'atr_max_pct': 0.03964196772354726, 'tp_mult': 1.2219150098609732, 'tsl_mult': 0.17604892201826797, 'strategy': 'breakout', 'time_stop': 199, 'use_sma': True, 'use_atr': True, 'use_adx': False, 'use_ema': True, 'use_spike': False, 'rsi_required': True, 'edge_k': 0.4828046301418852, 'edge_cap': 0.9726663220154448, 'bull_strategy': 'breakout', 'bull_bb_std_mult': 3.0395643852831276, 'bull_rsi_os': 46, 'bull_rsi_ob': 75, 'bull_adx_thresh': 5.247798795042193, 'bull_atr_min_pct': 0.0011311620263914051, 'bull_atr_max_pct': 0.09822314942508305, 'bull_tp_mult': 2.3853683395851366, 'bull_tsl_mult': 0.14865357258543416, 'bull_time_stop': 11, 'bull_use_sma': True, 'bull_use_ema': True, 'bull_use_atr': True, 'bull_use_adx': True, 'bull_use_spike': False, 'bull_rsi_required': True, 'bear_strategy': 'breakout', 'bear_bb_std_mult': 0.9172435577996442, 'bear_rsi_os': 14, 'bear_rsi_ob': 50, 'bear_adx_thresh': 9.984395344891706, 'bear_atr_min_pct': 0.023375766958070934, 'bear_atr_max_pct': 0.048820048368031874, 'bear_tp_mult': 1.6371671266149852, 'bear_tsl_mult': 0.05511897350532524, 'bear_time_stop': 246, 'bear_use_sma': True, 'bear_use_ema': False, 'bear_use_atr': False, 'bear_use_adx': True, 'bear_use_spike': True, 'bear_rsi_required': False, 'sideways_strategy': 'breakout', 'sideways_bb_std_mult': 0.8991056132722196, 'sideways_rsi_os': 19, 'sideways_rsi_ob': 75, 'sideways_adx_thresh': 14.85287154067169, 'sideways_atr_min_pct': 0.005701914362387126, 'sideways_atr_max_pct': 0.1203298633547702, 'sideways_tp_mult': 1.1171848362848658, 'sideways_tsl_mult': 0.5319077163198338, 'sideways_time_stop': 26, 'sideways_use_sma': False, 'sideways_use_ema': True, 'sideways_use_atr': False, 'sideways_use_adx': True, 'sideways_use_spike': False, 'sideways_rsi_required': True}.
[I 2025-09-01 13:23:15,968] Trial 145 finished with values: [-1000000000.0, 1000000000.0] and parameters: {'p_sma': 55, 'p_std': 48, 'p_atr': 20, 'p_adx': 27, 'rsi_period': 74, 'ema1': 10, 'ema2': 55, 'slip_atr_k': 0.09627519154525083, 'slip_spread_k': 0.4598007749105628, 'spread_hl_frac': 0.013307430439508309, 'bb_std_mult': 2.0957574979181333, 'rsi_os': 5, 'rsi_ob': 90, 'vol_spike': 0.22842979850836975, 'adx_thresh': 25.288499274313118, 'atr_min_pct': 0.02402732256093125, 'atr_max_pct': 0.019426138044959296, 'tp_mult': 1.3514914948957695, 'tsl_mult': 0.16400788889825588, 'strategy': 'breakout', 'time_stop': 241, 'use_sma': False, 'use_atr': True, 'use_adx': False, 'use_ema': True, 'use_spike': False, 'rsi_required': True, 'edge_k': 1.3156463932870852, 'edge_cap': 0.769078420038265, 'bull_strategy': 'breakout', 'bull_bb_std_mult': 3.215763777172267, 'bull_rsi_os': 46, 'bull_rsi_ob': 56, 'bull_adx_thresh': 5.046464301352896, 'bull_atr_min_pct': 0.0010626021707027472, 'bull_atr_max_pct': 0.01029546167152254, 'bull_tp_mult': 1.9125870008463515, 'bull_tsl_mult': 0.151313860171702, 'bull_time_stop': 10, 'bull_use_sma': True, 'bull_use_ema': True, 'bull_use_atr': True, 'bull_use_adx': True, 'bull_use_spike': False, 'bull_rsi_required': True, 'bear_strategy': 'mean_reversion', 'bear_bb_std_mult': 3.4736954331738437, 'bear_rsi_os': 29, 'bear_rsi_ob': 72, 'bear_adx_thresh': 10.849876744646606, 'bear_atr_min_pct': 0.022915973223823854, 'bear_atr_max_pct': 0.024560921358927963, 'bear_tp_mult': 2.5945265331347422, 'bear_tsl_mult': 0.02975884062574513, 'bear_time_stop': 57, 'bear_use_sma': True, 'bear_use_ema': False, 'bear_use_atr': False, 'bear_use_adx': True, 'bear_use_spike': True, 'bear_rsi_required': False, 'sideways_strategy': 'breakout', 'sideways_bb_std_mult': 0.7310230407551154, 'sideways_rsi_os': 5, 'sideways_rsi_ob': 75, 'sideways_adx_thresh': 14.83928312479592, 'sideways_atr_min_pct': 0.011365626820902829, 'sideways_atr_max_pct': 0.10669205111902066, 'sideways_tp_mult': 2.6745036895554013, 'sideways_tsl_mult': 0.5231172384974602, 'sideways_time_stop': 260, 'sideways_use_sma': False, 'sideways_use_ema': True, 'sideways_use_atr': False, 'sideways_use_adx': True, 'sideways_use_spike': False, 'sideways_rsi_required': True}.
[I 2025-09-01 13:23:53,463] Trial 146 finished with values: [-1000000000.0, 1000000000.0] and parameters: {'p_sma': 43, 'p_std': 11, 'p_atr': 30, 'p_adx': 19, 'rsi_period': 55, 'ema1': 24, 'ema2': 57, 'slip_atr_k': 0.10738517603160998, 'slip_spread_k': 0.03614583481116873, 'spread_hl_frac': 0.014147570488312368, 'bb_std_mult': 1.3065480696436864, 'rsi_os': 40, 'rsi_ob': 95, 'vol_spike': 0.2804696467083744, 'adx_thresh': 10.237141679668401, 'atr_min_pct': 0.004481963300762429, 'atr_max_pct': 0.02604897528895258, 'tp_mult': 1.4923977075604857, 'tsl_mult': 0.595514662064664, 'strategy': 'breakout', 'time_stop': 100, 'use_sma': True, 'use_atr': True, 'use_adx': False, 'use_ema': True, 'use_spike': False, 'rsi_required': True, 'edge_k': 0.4150897522199008, 'edge_cap': 0.7952567793594779, 'bull_strategy': 'breakout', 'bull_bb_std_mult': 3.0242741489485017, 'bull_rsi_os': 49, 'bull_rsi_ob': 60, 'bull_adx_thresh': 7.277643462957009, 'bull_atr_min_pct': 0.002908682577583966, 'bull_atr_max_pct': 0.026961414791036448, 'bull_tp_mult': 1.8891997098532158, 'bull_tsl_mult': 0.44172572182084, 'bull_time_stop': 272, 'bull_use_sma': True, 'bull_use_ema': True, 'bull_use_atr': True, 'bull_use_adx': True, 'bull_use_spike': False, 'bull_rsi_required': False, 'bear_strategy': 'mean_reversion', 'bear_bb_std_mult': 0.8209907790749558, 'bear_rsi_os': 14, 'bear_rsi_ob': 50, 'bear_adx_thresh': 9.992851215791296, 'bear_atr_min_pct': 0.019436192196504814, 'bear_atr_max_pct': 0.014501936149236297, 'bear_tp_mult': 1.6639217307865946, 'bear_tsl_mult': 0.49933652568857895, 'bear_time_stop': 241, 'bear_use_sma': True, 'bear_use_ema': False, 'bear_use_atr': True, 'bear_use_adx': True, 'bear_use_spike': False, 'bear_rsi_required': False, 'sideways_strategy': 'breakout', 'sideways_bb_std_mult': 1.9481213468907865, 'sideways_rsi_os': 18, 'sideways_rsi_ob': 94, 'sideways_adx_thresh': 12.076231755711689, 'sideways_atr_min_pct': 0.006995580445121188, 'sideways_atr_max_pct': 0.059530905409145074, 'sideways_tp_mult': 2.8368373290920617, 'sideways_tsl_mult': 0.5099554072234478, 'sideways_time_stop': 275, 'sideways_use_sma': False, 'sideways_use_ema': False, 'sideways_use_atr': True, 'sideways_use_adx': True, 'sideways_use_spike': False, 'sideways_rsi_required': True}.
