[I 2025-09-01 13:53:45,480] Trial 332 finished with values: [-1000000000.0, 1000000000.0] and parameters: {'p_sma': 38, 'p_std': 49, 'p_atr': 7, 'p_adx': 12, 'rsi_period': 68, 'ema1': 20, 'ema2': 18, 'slip_atr_k': 0.00011000194203661731, 'slip_spread_k': 0.9297300808367357, 'spread_hl_frac': 0.006704391583762313, 'bb_std_mult': 1.7355680717469237, 'rsi_os': 48, 'rsi_ob': 64, 'vol_spike': 0.06422396156930726, 'adx_thresh': 26.21769299126671, 'atr_min_pct': 0.029267179832414628, 'atr_max_pct': 0.06556611633035472, 'tp_mult': 2.804931282112801, 'tsl_mult': 0.72024444510365, 'strategy': 'mean_reversion', 'time_stop': 237, 'use_sma': True, 'use_atr': False, 'use_adx': False, 'use_ema': True, 'use_spike': True, 'rsi_required': False, 'edge_k': 0.8343333435182626, 'edge_cap': 0.7108443920457193, 'bull_strategy': 'breakout', 'bull_bb_std_mult': 3.280363493170003, 'bull_rsi_os': 36, 'bull_rsi_ob': 55, 'bull_adx_thresh': 20.583589216612243, 'bull_atr_min_pct': 0.00754025267688115, 'bull_atr_max_pct': 0.0149394873877598, 'bull_tp_mult': 2.788758721165387, 'bull_tsl_mult': 0.38171593892007466, 'bull_time_stop': 169, 'bull_use_sma': True, 'bull_use_ema': True, 'bull_use_atr': True, 'bull_use_adx': True, 'bull_use_spike': False, 'bull_rsi_required': True, 'bear_strategy': 'breakout', 'bear_bb_std_mult': 1.4930094363432937, 'bear_rsi_os': 34, 'bear_rsi_ob': 65, 'bear_adx_thresh': 18.516458293363698, 'bear_atr_min_pct': 0.0043082610672434875, 'bear_atr_max_pct': 0.0504825025740455, 'bear_tp_mult': 1.1440653784436736, 'bear_tsl_mult': 0.30017384120498286, 'bear_time_stop': 220, 'bear_use_sma': True, 'bear_use_ema': True, 'bear_use_atr': True, 'bear_use_adx': True, 'bear_use_spike': True, 'bear_rsi_required': True, 'sideways_strategy': 'breakout', 'sideways_bb_std_mult': 2.7395280157780024, 'sideways_rsi_os': 38, 'sideways_rsi_ob': 51, 'sideways_adx_thresh': 7.477080638405414, 'sideways_atr_min_pct': 0.01327781733864965, 'sideways_atr_max_pct': 0.07280041159424909, 'sideways_tp_mult': 2.1569305047495484, 'sideways_tsl_mult': 0.2629953640774536, 'sideways_time_stop': 168, 'sideways_use_sma': True, 'sideways_use_ema': False, 'sideways_use_atr': False, 'sideways_use_adx': True, 'sideways_use_spike': True, 'sideways_rsi_required': True}.
[I 2025-09-01 13:53:46,075] Trial 334 finished with values: [-1000000000.0, 1000000000.0] and parameters: {'p_sma': 25, 'p_std': 51, 'p_atr': 23, 'p_adx': 12, 'rsi_period': 34, 'ema1': 20, 'ema2': 18, 'slip_atr_k': 0.014421639757090524, 'slip_spread_k': 0.09493130287114104, 'spread_hl_frac': 0.024975909646460983, 'bb_std_mult': 1.7369590173800291, 'rsi_os': 26, 'rsi_ob': 64, 'vol_spike': 0.039576017683401174, 'adx_thresh': 31.5405894898095, 'atr_min_pct': 0.015512168929977619, 'atr_max_pct': 0.08137633303307465, 'tp_mult': 1.1240411511568773, 'tsl_mult': 0.7208313257615954, 'strategy': 'mean_reversion', 'time_stop': 215, 'use_sma': True, 'use_atr': False, 'use_adx': False, 'use_ema': True, 'use_spike': True, 'rsi_required': False, 'edge_k': 0.8994838029996861, 'edge_cap': 0.3414930152280768, 'bull_strategy': 'mean_reversion', 'bull_bb_std_mult': 3.275640042425705, 'bull_rsi_os': 37, 'bull_rsi_ob': 55, 'bull_adx_thresh': 32.718595814771525, 'bull_atr_min_pct': 0.0029613373675755317, 'bull_atr_max_pct': 0.10616820729741439, 'bull_tp_mult': 2.9353003805981874, 'bull_tsl_mult': 0.38505625664597953, 'bull_time_stop': 91, 'bull_use_sma': False, 'bull_use_ema': True, 'bull_use_atr': True, 'bull_use_adx': True, 'bull_use_spike': False, 'bull_rsi_required': True, 'bear_strategy': 'breakout', 'bear_bb_std_mult': 1.4923091642225388, 'bear_rsi_os': 32, 'bear_rsi_ob': 95, 'bear_adx_thresh': 22.31897335501646, 'bear_atr_min_pct': 0.0031744474241662394, 'bear_atr_max_pct': 0.017805595417453697, 'bear_tp_mult': 2.821595936445101, 'bear_tsl_mult': 0.1969713486244523, 'bear_time_stop': 213, 'bear_use_sma': True, 'bear_use_ema': True, 'bear_use_atr': False, 'bear_use_adx': False, 'bear_use_spike': False, 'bear_rsi_required': True, 'sideways_strategy': 'breakout', 'sideways_bb_std_mult': 1.6458105234295444, 'sideways_rsi_os': 52, 'sideways_rsi_ob': 70, 'sideways_adx_thresh': 6.137093202598676, 'sideways_atr_min_pct': 0.013155812390178994, 'sideways_atr_max_pct': 0.0652522029120433, 'sideways_tp_mult': 2.739726345783453, 'sideways_tsl_mult': 0.980000883730434, 'sideways_time_stop': 77, 'sideways_use_sma': True, 'sideways_use_ema': False, 'sideways_use_atr': True, 'sideways_use_adx': True, 'sideways_use_spike': False, 'sideways_rsi_required': True}.
[I 2025-09-01 13:53:46,484] Trial 335 finished with values: [-1000000000.0, 1000000000.0] and parameters: {'p_sma': 41, 'p_std': 51, 'p_atr': 19, 'p_adx': 7, 'rsi_period': 65, 'ema1': 20, 'ema2': 16, 'slip_atr_k': 0.014865726186833593, 'slip_spread_k': 0.9329030036349049, 'spread_hl_frac': 0.007402601300346158, 'bb_std_mult': 0.7599247053181679, 'rsi_os': 24, 'rsi_ob': 75, 'vol_spike': 0.24582254292438438, 'adx_thresh': 24.92446807883377, 'atr_min_pct': 0.02186611089475237, 'atr_max_pct': 0.13056613100789766, 'tp_mult': 2.7069063839315115, 'tsl_mult': 0.7410243898481301, 'strategy': 'mean_reversion', 'time_stop': 149, 'use_sma': True, 'use_atr': False, 'use_adx': True, 'use_ema': True, 'use_spike': True, 'rsi_required': False, 'edge_k': 1.5494717839374643, 'edge_cap': 0.3026442620393048, 'bull_strategy': 'mean_reversion', 'bull_bb_std_mult': 2.5679335111592327, 'bull_rsi_os': 26, 'bull_rsi_ob': 55, 'bull_adx_thresh': 25.737454590455048, 'bull_atr_min_pct': 0.028312572850371327, 'bull_atr_max_pct': 0.0807996220894412, 'bull_tp_mult': 1.3671609614178808, 'bull_tsl_mult': 0.4382335869347451, 'bull_time_stop': 224, 'bull_use_sma': False, 'bull_use_ema': False, 'bull_use_atr': True, 'bull_use_adx': False, 'bull_use_spike': False, 'bull_rsi_required': True, 'bear_strategy': 'breakout', 'bear_bb_std_mult': 2.504700248904838, 'bear_rsi_os': 32, 'bear_rsi_ob': 65, 'bear_adx_thresh': 20.012195226877743, 'bear_atr_min_pct': 0.010345795926993084, 'bear_atr_max_pct': 0.05034296493642032, 'bear_tp_mult': 2.2222354898390013, 'bear_tsl_mult': 0.14234973129231607, 'bear_time_stop': 213, 'bear_use_sma': True, 'bear_use_ema': True, 'bear_use_atr': False, 'bear_use_adx': False, 'bear_use_spike': False, 'bear_rsi_required': True, 'sideways_strategy': 'breakout', 'sideways_bb_std_mult': 1.6607759677627278, 'sideways_rsi_os': 54, 'sideways_rsi_ob': 86, 'sideways_adx_thresh': 18.098162502781943, 'sideways_atr_min_pct': 0.02009233243558889, 'sideways_atr_max_pct': 0.062216884938651906, 'sideways_tp_mult': 2.7446168671405555, 'sideways_tsl_mult': 0.28998617435175716, 'sideways_time_stop': 168, 'sideways_use_sma': True, 'sideways_use_ema': False, 'sideways_use_atr': True, 'sideways_use_adx': True, 'sideways_use_spike': True, 'sideways_rsi_required': True}.
[I 2025-09-01 13:54:24,577] Trial 337 finished with values: [-1000000000.0, 1000000000.0] and parameters: {'p_sma': 44, 'p_std': 45, 'p_atr': 21, 'p_adx': 22, 'rsi_period': 54, 'ema1': 22, 'ema2': 16, 'slip_atr_k': 0.01466980571888413, 'slip_spread_k': 0.6897885570096469, 'spread_hl_frac': 0.01859307374891931, 'bb_std_mult': 0.742008450299624, 'rsi_os': 39, 'rsi_ob': 83, 'vol_spike': 0.2391626016542379, 'adx_thresh': 24.832414631262544, 'atr_min_pct': 0.022219746998066208, 'atr_max_pct': 0.08124289624949509, 'tp_mult': 1.13821617470898, 'tsl_mult': 0.45991314495345403, 'strategy': 'mean_reversion', 'time_stop': 217, 'use_sma': True, 'use_atr': False, 'use_adx': True, 'use_ema': True, 'use_spike': True, 'rsi_required': False, 'edge_k': 0.9050378996940823, 'edge_cap': 0.2960587003719892, 'bull_strategy': 'mean_reversion', 'bull_bb_std_mult': 1.998488432711493, 'bull_rsi_os': 34, 'bull_rsi_ob': 87, 'bull_adx_thresh': 15.773394115393005, 'bull_atr_min_pct': 0.0028074855895599774, 'bull_atr_max_pct': 0.07634775130159303, 'bull_tp_mult': 2.933776948299201, 'bull_tsl_mult': 0.8534917991492095, 'bull_time_stop': 91, 'bull_use_sma': False, 'bull_use_ema': False, 'bull_use_atr': True, 'bull_use_adx': False, 'bull_use_spike': False, 'bull_rsi_required': False, 'bear_strategy': 'breakout', 'bear_bb_std_mult': 2.7272282575499487, 'bear_rsi_os': 32, 'bear_rsi_ob': 90, 'bear_adx_thresh': 20.08462814203636, 'bear_atr_min_pct': 0.010096700723981318, 'bear_atr_max_pct': 0.054032826740232597, 'bear_tp_mult': 2.0688692597992264, 'bear_tsl_mult': 0.6368591101316916, 'bear_time_stop': 132, 'bear_use_sma': True, 'bear_use_ema': True, 'bear_use_atr': False, 'bear_use_adx': False, 'bear_use_spike': False, 'bear_rsi_required': True, 'sideways_strategy': 'breakout', 'sideways_bb_std_mult': 1.6740711406535451, 'sideways_rsi_os': 36, 'sideways_rsi_ob': 88, 'sideways_adx_thresh': 6.043540794599823, 'sideways_atr_min_pct': 0.020256443526303656, 'sideways_atr_max_pct': 0.06230481792216859, 'sideways_tp_mult': 1.772752351906219, 'sideways_tsl_mult': 0.2920014295920349, 'sideways_time_stop': 200, 'sideways_use_sma': True, 'sideways_use_ema': False, 'sideways_use_atr': True, 'sideways_use_adx': True, 'sideways_use_spike': False, 'sideways_rsi_required': True}.
[I 2025-09-01 13:54:26,054] Trial 338 finished with values: [-0.04880407879224602, 0.048503885851397185] and parameters: {'p_sma': 34, 'p_std': 16, 'p_atr': 21, 'p_adx': 30, 'rsi_period': 65, 'ema1': 22, 'ema2': 16, 'slip_atr_k': 0.2095099719146281, 'slip_spread_k': 0.4892672829243545, 'spread_hl_frac': 0.009389642044079077, 'bb_std_mult': 1.6258791981895047, 'rsi_os': 24, 'rsi_ob': 78, 'vol_spike': 0.239242462004831, 'adx_thresh': 24.92505163124396, 'atr_min_pct': 0.022383377671962763, 'atr_max_pct': 0.13117991621883404, 'tp_mult': 1.798616549779167, 'tsl_mult': 0.4775652243860928, 'strategy': 'mean_reversion', 'time_stop': 232, 'use_sma': False, 'use_atr': False, 'use_adx': True, 'use_ema': True, 'use_spike': True, 'rsi_required': False, 'edge_k': 0.944602388942845, 'edge_cap': 0.9048456613955631, 'bull_strategy': 'mean_reversion', 'bull_bb_std_mult': 2.0004247870274634, 'bull_rsi_os': 34, 'bull_rsi_ob': 52, 'bull_adx_thresh': 12.942886265342649, 'bull_atr_min_pct': 0.00447375974015224, 'bull_atr_max_pct': 0.025129793794008367, 'bull_tp_mult': 2.821734160327368, 'bull_tsl_mult': 0.4391933825081934, 'bull_time_stop': 256, 'bull_use_sma': True, 'bull_use_ema': False, 'bull_use_atr': False, 'bull_use_adx': False, 'bull_use_spike': False, 'bull_rsi_required': False, 'bear_strategy': 'breakout', 'bear_bb_std_mult': 2.494270352371254, 'bear_rsi_os': 29, 'bear_rsi_ob': 88, 'bear_adx_thresh': 12.862621642400587, 'bear_atr_min_pct': 0.010412852719137864, 'bear_atr_max_pct': 0.050631516573538725, 'bear_tp_mult': 2.2838418638560998, 'bear_tsl_mult': 0.1420819593388391, 'bear_time_stop': 132, 'bear_use_sma': False, 'bear_use_ema': True, 'bear_use_atr': True, 'bear_use_adx': True, 'bear_use_spike': False, 'bear_rsi_required': True, 'sideways_strategy': 'breakout', 'sideways_bb_std_mult': 1.508556286627859, 'sideways_rsi_os': 52, 'sideways_rsi_ob': 68, 'sideways_adx_thresh': 23.39328517117014, 'sideways_atr_min_pct': 0.0031235265726730944, 'sideways_atr_max_pct': 0.06183790713882943, 'sideways_tp_mult': 2.718693322272274, 'sideways_tsl_mult': 0.2919410085788318, 'sideways_time_stop': 192, 'sideways_use_sma': True, 'sideways_use_ema': True, 'sideways_use_atr': True, 'sideways_use_adx': True, 'sideways_use_spike': False, 'sideways_rsi_required': True}.
[I 2025-09-01 13:54:27,165] Trial 336 finished with values: [-1000000000.0, 1000000000.0] and parameters: {'p_sma': 26, 'p_std': 50, 'p_atr': 21, 'p_adx': 22, 'rsi_period': 54, 'ema1': 9, 'ema2': 16, 'slip_atr_k': 0.014791392154025437, 'slip_spread_k': 0.8893161693549843, 'spread_hl_frac': 0.018882354648422944, 'bb_std_mult': 1.82395341526679, 'rsi_os': 24, 'rsi_ob': 83, 'vol_spike': 0.06172207652369617, 'adx_thresh': 24.792981901253654, 'atr_min_pct': 0.025990632529211917, 'atr_max_pct': 0.1309403131598289, 'tp_mult': 2.704625526336874, 'tsl_mult': 0.7374577478554352, 'strategy': 'mean_reversion', 'time_stop': 149, 'use_sma': True, 'use_atr': False, 'use_adx': True, 'use_ema': True, 'use_spike': True, 'rsi_required': False, 'edge_k': 0.8981420278924267, 'edge_cap': 0.16055493494757744, 'bull_strategy': 'mean_reversion', 'bull_bb_std_mult': 3.2587974721252144, 'bull_rsi_os': 12, 'bull_rsi_ob': 56, 'bull_adx_thresh': 32.81150965727521, 'bull_atr_min_pct': 0.003181994923257471, 'bull_atr_max_pct': 0.10800427326347023, 'bull_tp_mult': 2.91704504652143, 'bull_tsl_mult': 0.37798569678942784, 'bull_time_stop': 91, 'bull_use_sma': True, 'bull_use_ema': False, 'bull_use_atr': True, 'bull_use_adx': False, 'bull_use_spike': False, 'bull_rsi_required': True, 'bear_strategy': 'breakout', 'bear_bb_std_mult': 3.4852142368847527, 'bear_rsi_os': 45, 'bear_rsi_ob': 76, 'bear_adx_thresh': 12.638987915740021, 'bear_atr_min_pct': 0.004431373051260351, 'bear_atr_max_pct': 0.048848020567477904, 'bear_tp_mult': 1.4225861400687938, 'bear_tsl_mult': 0.19781181507040668, 'bear_time_stop': 63, 'bear_use_sma': True, 'bear_use_ema': True, 'bear_use_atr': True, 'bear_use_adx': True, 'bear_use_spike': False, 'bear_rsi_required': True, 'sideways_strategy': 'breakout', 'sideways_bb_std_mult': 1.6519484437736787, 'sideways_rsi_os': 36, 'sideways_rsi_ob': 51, 'sideways_adx_thresh': 5.871354919493487, 'sideways_atr_min_pct': 0.020293876076583412, 'sideways_atr_max_pct': 0.06586621349077984, 'sideways_tp_mult': 2.7367068554852954, 'sideways_tsl_mult': 0.29230529238070074, 'sideways_time_stop': 190, 'sideways_use_sma': True, 'sideways_use_ema': False, 'sideways_use_atr': True, 'sideways_use_adx': True, 'sideways_use_spike': True, 'sideways_rsi_required': True}.
[I 2025-09-01 13:54:27,456] Trial 339 finished with values: [-0.10196364612171749, 0.10157743122548038] and parameters: {'p_sma': 32, 'p_std': 49, 'p_atr': 27, 'p_adx': 11, 'rsi_period': 66, 'ema1': 22, 'ema2': 16, 'slip_atr_k': 0.21333210921821882, 'slip_spread_k': 0.8937776096017102, 'spread_hl_frac': 0.03145590127919271, 'bb_std_mult': 1.631376039661136, 'rsi_os': 37, 'rsi_ob': 83, 'vol_spike': 0.23812964329904043, 'adx_thresh': 24.380805846219605, 'atr_min_pct': 0.028087100084775874, 'atr_max_pct': 0.1376276067708116, 'tp_mult': 1.0667017849272427, 'tsl_mult': 0.470445574989144, 'strategy': 'mean_reversion', 'time_stop': 228, 'use_sma': False, 'use_atr': False, 'use_adx': True, 'use_ema': True, 'use_spike': True, 'rsi_required': False, 'edge_k': 1.0863185150969588, 'edge_cap': 0.9032597977080936, 'bull_strategy': 'breakout', 'bull_bb_std_mult': 2.7786493830288124, 'bull_rsi_os': 34, 'bull_rsi_ob': 52, 'bull_adx_thresh': 26.54774391978397, 'bull_atr_min_pct': 0.0035716513502801607, 'bull_atr_max_pct': 0.07611329219565101, 'bull_tp_mult': 2.8361291661200503, 'bull_tsl_mult': 0.4593261536047632, 'bull_time_stop': 291, 'bull_use_sma': True, 'bull_use_ema': False, 'bull_use_atr': False, 'bull_use_adx': False, 'bull_use_spike': False, 'bull_rsi_required': False, 'bear_strategy': 'breakout', 'bear_bb_std_mult': 3.477825320974538, 'bear_rsi_os': 47, 'bear_rsi_ob': 88, 'bear_adx_thresh': 13.137109206391608, 'bear_atr_min_pct': 0.0025467028479947643, 'bear_atr_max_pct': 0.042442299506134824, 'bear_tp_mult': 2.9601883807738107, 'bear_tsl_mult': 0.9207773234704067, 'bear_time_stop': 243, 'bear_use_sma': False, 'bear_use_ema': True, 'bear_use_atr': True, 'bear_use_adx': True, 'bear_use_spike': False, 'bear_rsi_required': True, 'sideways_strategy': 'breakout', 'sideways_bb_std_mult': 3.387872775459863, 'sideways_rsi_os': 20, 'sideways_rsi_ob': 88, 'sideways_adx_thresh': 7.005346269625565, 'sideways_atr_min_pct': 0.01909872884561363, 'sideways_atr_max_pct': 0.0945816689569557, 'sideways_tp_mult': 2.2535919262493493, 'sideways_tsl_mult': 0.22601928724254627, 'sideways_time_stop': 203, 'sideways_use_sma': True, 'sideways_use_ema': True, 'sideways_use_atr': True, 'sideways_use_adx': True, 'sideways_use_spike': False, 'sideways_rsi_required': True}.
[I 2025-09-01 13:55:04,144] Trial 343 finished with values: [-1000000000.0, 1000000000.0] and parameters: {'p_sma': 36, 'p_std': 48, 'p_atr': 25, 'p_adx': 12, 'rsi_period': 67, 'ema1': 24, 'ema2': 19, 'slip_atr_k': 0.043861052764302785, 'slip_spread_k': 0.08245527547870157, 'spread_hl_frac': 0.004936123450210585, 'bb_std_mult': 1.0494232294120538, 'rsi_os': 36, 'rsi_ob': 85, 'vol_spike': 0.25652506995631874, 'adx_thresh': 25.584483905344175, 'atr_min_pct': 0.010910820610935035, 'atr_max_pct': 0.10612163168249186, 'tp_mult': 1.110841666878326, 'tsl_mult': 0.6965400232456774, 'strategy': 'mean_reversion', 'time_stop': 31, 'use_sma': True, 'use_atr': False, 'use_adx': False, 'use_ema': False, 'use_spike': True, 'rsi_required': False, 'edge_k': 0.8552488097122455, 'edge_cap': 0.359763896990981, 'bull_strategy': 'breakout', 'bull_bb_std_mult': 3.362324688366533, 'bull_rsi_os': 35, 'bull_rsi_ob': 84, 'bull_adx_thresh': 30.6641561279294, 'bull_atr_min_pct': 0.004651312936364402, 'bull_atr_max_pct': 0.018163924357625243, 'bull_tp_mult': 2.796647345450444, 'bull_tsl_mult': 0.3964375004982238, 'bull_time_stop': 82, 'bull_use_sma': True, 'bull_use_ema': True, 'bull_use_atr': True, 'bull_use_adx': True, 'bull_use_spike': False, 'bull_rsi_required': True, 'bear_strategy': 'breakout', 'bear_bb_std_mult': 1.7611964952750996, 'bear_rsi_os': 18, 'bear_rsi_ob': 86, 'bear_adx_thresh': 11.331471478282948, 'bear_atr_min_pct': 0.0025678366231588414, 'bear_atr_max_pct': 0.040981828385714264, 'bear_tp_mult': 2.1174996809406372, 'bear_tsl_mult': 0.175009609707361, 'bear_time_stop': 125, 'bear_use_sma': True, 'bear_use_ema': True, 'bear_use_atr': True, 'bear_use_adx': True, 'bear_use_spike': False, 'bear_rsi_required': True, 'sideways_strategy': 'breakout', 'sideways_bb_std_mult': 2.9191461342225216, 'sideways_rsi_os': 17, 'sideways_rsi_ob': 67, 'sideways_adx_thresh': 6.757474736896378, 'sideways_atr_min_pct': 0.0018729256489281917, 'sideways_atr_max_pct': 0.10126535390005861, 'sideways_tp_mult': 1.9369576958541248, 'sideways_tsl_mult': 0.7368981934334861, 'sideways_time_stop': 258, 'sideways_use_sma': True, 'sideways_use_ema': False, 'sideways_use_atr': True, 'sideways_use_adx': True, 'sideways_use_spike': False, 'sideways_rsi_required': False}.
[I 2025-09-01 13:55:05,211] Trial 342 finished with values: [-1000000000.0, 1000000000.0] and parameters: {'p_sma': 32, 'p_std': 48, 'p_atr': 12, 'p_adx': 12, 'rsi_period': 21, 'ema1': 14, 'ema2': 20, 'slip_atr_k': 0.024601388289979452, 'slip_spread_k': 0.6442377983393455, 'spread_hl_frac': 0.022758896700014238, 'bb_std_mult': 3.022314296435871, 'rsi_os': 37, 'rsi_ob': 80, 'vol_spike': 0.22507767635403858, 'adx_thresh': 25.49700606724914, 'atr_min_pct': 0.027973586193920316, 'atr_max_pct': 0.13717861955111288, 'tp_mult': 1.068758809416783, 'tsl_mult': 0.0037898520636477917, 'strategy': 'mean_reversion', 'time_stop': 157, 'use_sma': False, 'use_atr': False, 'use_adx': False, 'use_ema': False, 'use_spike': True, 'rsi_required': False, 'edge_k': 1.3541425958400737, 'edge_cap': 0.31709590529629184, 'bull_strategy': 'breakout', 'bull_bb_std_mult': 3.193172974436375, 'bull_rsi_os': 35, 'bull_rsi_ob': 53, 'bull_adx_thresh': 26.5474547817765, 'bull_atr_min_pct': 0.003973919853834483, 'bull_atr_max_pct': 0.05130755508767785, 'bull_tp_mult': 2.829185532907545, 'bull_tsl_mult': 0.4555983285544203, 'bull_time_stop': 86, 'bull_use_sma': True, 'bull_use_ema': True, 'bull_use_atr': False, 'bull_use_adx': True, 'bull_use_spike': False, 'bull_rsi_required': True, 'bear_strategy': 'breakout', 'bear_bb_std_mult': 0.5597998580697576, 'bear_rsi_os': 16, 'bear_rsi_ob': 86, 'bear_adx_thresh': 11.515206981779862, 'bear_atr_min_pct': 0.0026703665785680107, 'bear_atr_max_pct': 0.01246715932793635, 'bear_tp_mult': 2.123685926238038, 'bear_tsl_mult': 0.9236432733177835, 'bear_time_stop': 243, 'bear_use_sma': False, 'bear_use_ema': True, 'bear_use_atr': True, 'bear_use_adx': True, 'bear_use_spike': False, 'bear_rsi_required': True, 'sideways_strategy': 'breakout', 'sideways_bb_std_mult': 3.3833166664191054, 'sideways_rsi_os': 7, 'sideways_rsi_ob': 67, 'sideways_adx_thresh': 6.940718199565826, 'sideways_atr_min_pct': 0.0018888736505069028, 'sideways_atr_max_pct': 0.0461202706887487, 'sideways_tp_mult': 1.6679608431374513, 'sideways_tsl_mult': 0.22286221236351028, 'sideways_time_stop': 177, 'sideways_use_sma': True, 'sideways_use_ema': True, 'sideways_use_atr': True, 'sideways_use_adx': True, 'sideways_use_spike': False, 'sideways_rsi_required': False}.
