[I 2025-09-01 15:07:02,868] Trial 827 finished with values: [-1000000000.0, 1000000000.0] and parameters: {'p_sma': 44, 'p_std': 24, 'p_atr': 8, 'p_adx': 12, 'rsi_period': 66, 'ema1': 21, 'ema2': 43, 'slip_atr_k': 0.1266354739989335, 'slip_spread_k': 0.04503328666944727, 'spread_hl_frac': 0.03194037980199896, 'bb_std_mult': 1.9629827448237513, 'rsi_os': 19, 'rsi_ob': 60, 'vol_spike': 0.24935427642740238, 'adx_thresh': 25.74591216686189, 'atr_min_pct': 0.02007177872591977, 'atr_max_pct': 0.03794140534600483, 'tp_mult': 1.1035231682006819, 'tsl_mult': 0.7387338551361516, 'strategy': 'mean_reversion', 'time_stop': 245, 'use_sma': False, 'use_atr': False, 'use_adx': True, 'use_ema': False, 'use_spike': True, 'rsi_required': True, 'edge_k': 1.4740490620517077, 'edge_cap': 0.2854125295392362, 'bull_strategy': 'breakout', 'bull_bb_std_mult': 3.10315199574589, 'bull_rsi_os': 34, 'bull_rsi_ob': 54, 'bull_adx_thresh': 30.17185122533083, 'bull_atr_min_pct': 0.010773471012600865, 'bull_atr_max_pct': 0.0186741194162226, 'bull_tp_mult': 2.85477783903656, 'bull_tsl_mult': 0.4253761967098076, 'bull_time_stop': 97, 'bull_use_sma': False, 'bull_use_ema': False, 'bull_use_atr': True, 'bull_use_adx': False, 'bull_use_spike': True, 'bull_rsi_required': True, 'bear_strategy': 'breakout', 'bear_bb_std_mult': 1.7328243515371513, 'bear_rsi_os': 35, 'bear_rsi_ob': 89, 'bear_adx_thresh': 12.92936111921481, 'bear_atr_min_pct': 0.004975916418790545, 'bear_atr_max_pct': 0.11476536990874958, 'bear_tp_mult': 1.07135198057234, 'bear_tsl_mult': 0.20639600016251902, 'bear_time_stop': 214, 'bear_use_sma': True, 'bear_use_ema': True, 'bear_use_atr': True, 'bear_use_adx': True, 'bear_use_spike': False, 'bear_rsi_required': True, 'sideways_strategy': 'breakout', 'sideways_bb_std_mult': 2.063424504569789, 'sideways_rsi_os': 51, 'sideways_rsi_ob': 69, 'sideways_adx_thresh': 10.52179382014144, 'sideways_atr_min_pct': 0.01896234334887005, 'sideways_atr_max_pct': 0.051490949174154095, 'sideways_tp_mult': 1.4520889087049675, 'sideways_tsl_mult': 0.21813955473868873, 'sideways_time_stop': 61, 'sideways_use_sma': True, 'sideways_use_ema': True, 'sideways_use_atr': True, 'sideways_use_adx': True, 'sideways_use_spike': False, 'sideways_rsi_required': False}.
[I 2025-09-01 15:07:50,157] Trial 829 finished with values: [-1000000000.0, 1000000000.0] and parameters: {'p_sma': 35, 'p_std': 48, 'p_atr': 28, 'p_adx': 12, 'rsi_period': 65, 'ema1': 23, 'ema2': 37, 'slip_atr_k': 0.00996303506652623, 'slip_spread_k': 0.07223418725597075, 'spread_hl_frac': 0.03425219397270625, 'bb_std_mult': 2.5270261455262206, 'rsi_os': 19, 'rsi_ob': 77, 'vol_spike': 0.24766929704513585, 'adx_thresh': 22.702194179549863, 'atr_min_pct': 0.020186897184192757, 'atr_max_pct': 0.14122185364883472, 'tp_mult': 2.4329274165331496, 'tsl_mult': 0.737123575034518, 'strategy': 'mean_reversion', 'time_stop': 242, 'use_sma': True, 'use_atr': False, 'use_adx': False, 'use_ema': False, 'use_spike': True, 'rsi_required': True, 'edge_k': 0.04021154893345247, 'edge_cap': 0.7711437552546923, 'bull_strategy': 'mean_reversion', 'bull_bb_std_mult': 0.9370362812443112, 'bull_rsi_os': 33, 'bull_rsi_ob': 93, 'bull_adx_thresh': 29.320918928552576, 'bull_atr_min_pct': 0.003271325067448781, 'bull_atr_max_pct': 0.02176885504047034, 'bull_tp_mult': 2.7455674713624623, 'bull_tsl_mult': 0.8301934460711821, 'bull_time_stop': 97, 'bull_use_sma': True, 'bull_use_ema': False, 'bull_use_atr': True, 'bull_use_adx': True, 'bull_use_spike': False, 'bull_rsi_required': False, 'bear_strategy': 'breakout', 'bear_bb_std_mult': 2.8148668419005105, 'bear_rsi_os': 27, 'bear_rsi_ob': 50, 'bear_adx_thresh': 27.595471929261386, 'bear_atr_min_pct': 0.0023897908952740217, 'bear_atr_max_pct': 0.041086517915921765, 'bear_tp_mult': 2.2501612462918383, 'bear_tsl_mult': 0.20036157437560742, 'bear_time_stop': 238, 'bear_use_sma': True, 'bear_use_ema': False, 'bear_use_atr': True, 'bear_use_adx': True, 'bear_use_spike': False, 'bear_rsi_required': True, 'sideways_strategy': 'breakout', 'sideways_bb_std_mult': 1.451897793352895, 'sideways_rsi_os': 51, 'sideways_rsi_ob': 69, 'sideways_adx_thresh': 8.311113027866867, 'sideways_atr_min_pct': 0.0186884089524486, 'sideways_atr_max_pct': 0.09131857934039576, 'sideways_tp_mult': 2.60741182175846, 'sideways_tsl_mult': 0.22821792134256313, 'sideways_time_stop': 91, 'sideways_use_sma': True, 'sideways_use_ema': False, 'sideways_use_atr': True, 'sideways_use_adx': True, 'sideways_use_spike': False, 'sideways_rsi_required': True}.
[I 2025-09-01 15:07:51,758] Trial 832 finished with values: [-0.045955142611966426, 0.04570417206634548] and parameters: {'p_sma': 27, 'p_std': 29, 'p_atr': 25, 'p_adx': 10, 'rsi_period': 26, 'ema1': 14, 'ema2': 17, 'slip_atr_k': 0.05851659219389149, 'slip_spread_k': 0.8146175358035401, 'spread_hl_frac': 0.014031990107717442, 'bb_std_mult': 1.6543402054321803, 'rsi_os': 43, 'rsi_ob': 90, 'vol_spike': 0.23358821372779787, 'adx_thresh': 25.32427188375355, 'atr_min_pct': 0.025476176889686498, 'atr_max_pct': 0.13980509570732996, 'tp_mult': 1.6130419805159935, 'tsl_mult': 0.6945276790718653, 'strategy': 'mean_reversion', 'time_stop': 93, 'use_sma': True, 'use_atr': False, 'use_adx': False, 'use_ema': True, 'use_spike': True, 'rsi_required': False, 'edge_k': 1.136031723054262, 'edge_cap': 0.5682559039013438, 'bull_strategy': 'mean_reversion', 'bull_bb_std_mult': 3.4037478606614666, 'bull_rsi_os': 36, 'bull_rsi_ob': 46, 'bull_adx_thresh': 29.271084321912408, 'bull_atr_min_pct': 0.02087543567452811, 'bull_atr_max_pct': 0.022651168288719235, 'bull_tp_mult': 1.8343400446245153, 'bull_tsl_mult': 0.44326815777063844, 'bull_time_stop': 63, 'bull_use_sma': True, 'bull_use_ema': True, 'bull_use_atr': False, 'bull_use_adx': True, 'bull_use_spike': False, 'bull_rsi_required': False, 'bear_strategy': 'breakout', 'bear_bb_std_mult': 2.982608507750894, 'bear_rsi_os': 45, 'bear_rsi_ob': 81, 'bear_adx_thresh': 12.17053684610649, 'bear_atr_min_pct': 0.0033317511176396536, 'bear_atr_max_pct': 0.12792839245038962, 'bear_tp_mult': 2.0876452739680724, 'bear_tsl_mult': 0.25154519934334074, 'bear_time_stop': 223, 'bear_use_sma': True, 'bear_use_ema': False, 'bear_use_atr': True, 'bear_use_adx': True, 'bear_use_spike': False, 'bear_rsi_required': True, 'sideways_strategy': 'breakout', 'sideways_bb_std_mult': 3.307311788352443, 'sideways_rsi_os': 50, 'sideways_rsi_ob': 90, 'sideways_adx_thresh': 29.920572656992423, 'sideways_atr_min_pct': 0.021418886142911844, 'sideways_atr_max_pct': 0.062101499798092576, 'sideways_tp_mult': 2.6061090216342486, 'sideways_tsl_mult': 0.8655642613694285, 'sideways_time_stop': 203, 'sideways_use_sma': True, 'sideways_use_ema': False, 'sideways_use_atr': True, 'sideways_use_adx': False, 'sideways_use_spike': False, 'sideways_rsi_required': True}.
[I 2025-09-01 15:07:52,187] Trial 830 finished with values: [-1000000000.0, 1000000000.0] and parameters: {'p_sma': 13, 'p_std': 48, 'p_atr': 14, 'p_adx': 10, 'rsi_period': 26, 'ema1': 21, 'ema2': 46, 'slip_atr_k': 0.009304489959669433, 'slip_spread_k': 0.0847521713115583, 'spread_hl_frac': 0.020463291064948652, 'bb_std_mult': 2.293323963632521, 'rsi_os': 45, 'rsi_ob': 83, 'vol_spike': 0.24961224805967147, 'adx_thresh': 29.15271405293403, 'atr_min_pct': 0.012437019543308404, 'atr_max_pct': 0.09901611086698317, 'tp_mult': 1.1291879465760866, 'tsl_mult': 0.7400334977324283, 'strategy': 'mean_reversion', 'time_stop': 141, 'use_sma': True, 'use_atr': False, 'use_adx': True, 'use_ema': True, 'use_spike': True, 'rsi_required': False, 'edge_k': 1.1407197035149197, 'edge_cap': 0.6766506269818282, 'bull_strategy': 'mean_reversion', 'bull_bb_std_mult': 0.9352652234984276, 'bull_rsi_os': 6, 'bull_rsi_ob': 56, 'bull_adx_thresh': 23.445543935289614, 'bull_atr_min_pct': 0.020502229242679134, 'bull_atr_max_pct': 0.02161850907884469, 'bull_tp_mult': 1.2535156125977558, 'bull_tsl_mult': 0.44596228914083486, 'bull_time_stop': 59, 'bull_use_sma': True, 'bull_use_ema': True, 'bull_use_atr': True, 'bull_use_adx': True, 'bull_use_spike': False, 'bull_rsi_required': False, 'bear_strategy': 'breakout', 'bear_bb_std_mult': 3.478124834971757, 'bear_rsi_os': 31, 'bear_rsi_ob': 85, 'bear_adx_thresh': 9.483155258565837, 'bear_atr_min_pct': 0.003268913384033161, 'bear_atr_max_pct': 0.1132203086703187, 'bear_tp_mult': 2.1144799200853783, 'bear_tsl_mult': 0.295840388798822, 'bear_time_stop': 60, 'bear_use_sma': True, 'bear_use_ema': False, 'bear_use_atr': True, 'bear_use_adx': True, 'bear_use_spike': False, 'bear_rsi_required': True, 'sideways_strategy': 'breakout', 'sideways_bb_std_mult': 1.7620485781387187, 'sideways_rsi_os': 51, 'sideways_rsi_ob': 75, 'sideways_adx_thresh': 23.00839334828549, 'sideways_atr_min_pct': 0.018165883136413864, 'sideways_atr_max_pct': 0.05245394922666009, 'sideways_tp_mult': 2.6996607128637193, 'sideways_tsl_mult': 0.22761207900465102, 'sideways_time_stop': 90, 'sideways_use_sma': True, 'sideways_use_ema': False, 'sideways_use_atr': True, 'sideways_use_adx': True, 'sideways_use_spike': False, 'sideways_rsi_required': True}.
[I 2025-09-01 15:07:52,547] Trial 831 finished with values: [-1000000000.0, 1000000000.0] and parameters: {'p_sma': 13, 'p_std': 48, 'p_atr': 25, 'p_adx': 12, 'rsi_period': 64, 'ema1': 23, 'ema2': 16, 'slip_atr_k': 0.05944933217589708, 'slip_spread_k': 0.07719982659956964, 'spread_hl_frac': 0.013786893507077997, 'bb_std_mult': 1.6424447031007714, 'rsi_os': 45, 'rsi_ob': 83, 'vol_spike': 0.24827312644639732, 'adx_thresh': 25.834830191092948, 'atr_min_pct': 0.027870874139509588, 'atr_max_pct': 0.14016406112126134, 'tp_mult': 1.0981872915964037, 'tsl_mult': 0.7431021360627874, 'strategy': 'mean_reversion', 'time_stop': 227, 'use_sma': True, 'use_atr': False, 'use_adx': True, 'use_ema': True, 'use_spike': True, 'rsi_required': False, 'edge_k': 0.9520070117184656, 'edge_cap': 0.8718329217493912, 'bull_strategy': 'mean_reversion', 'bull_bb_std_mult': 3.368672874092326, 'bull_rsi_os': 36, 'bull_rsi_ob': 46, 'bull_adx_thresh': 23.504690150547667, 'bull_atr_min_pct': 0.02067273108838653, 'bull_atr_max_pct': 0.022685839158511537, 'bull_tp_mult': 2.852204219993992, 'bull_tsl_mult': 0.4357827500308561, 'bull_time_stop': 229, 'bull_use_sma': True, 'bull_use_ema': True, 'bull_use_atr': True, 'bull_use_adx': True, 'bull_use_spike': False, 'bull_rsi_required': False, 'bear_strategy': 'breakout', 'bear_bb_std_mult': 2.944911712968048, 'bear_rsi_os': 6, 'bear_rsi_ob': 64, 'bear_adx_thresh': 32.73044997728285, 'bear_atr_min_pct': 0.019667521978690712, 'bear_atr_max_pct': 0.041727212054459915, 'bear_tp_mult': 2.099492800013142, 'bear_tsl_mult': 0.5625651333622836, 'bear_time_stop': 30, 'bear_use_sma': True, 'bear_use_ema': False, 'bear_use_atr': True, 'bear_use_adx': True, 'bear_use_spike': False, 'bear_rsi_required': True, 'sideways_strategy': 'breakout', 'sideways_bb_std_mult': 2.0369895791567774, 'sideways_rsi_os': 51, 'sideways_rsi_ob': 82, 'sideways_adx_thresh': 17.351690974996824, 'sideways_atr_min_pct': 0.021429025672377172, 'sideways_atr_max_pct': 0.0608926515990312, 'sideways_tp_mult': 2.6111866779806028, 'sideways_tsl_mult': 0.2923725105467106, 'sideways_time_stop': 25, 'sideways_use_sma': True, 'sideways_use_ema': False, 'sideways_use_atr': True, 'sideways_use_adx': True, 'sideways_use_spike': False, 'sideways_rsi_required': True}.
[I 2025-09-01 15:08:38,526] Trial 836 finished with values: [-1000000000.0, 1000000000.0] and parameters: {'p_sma': 22, 'p_std': 45, 'p_atr': 16, 'p_adx': 30, 'rsi_period': 17, 'ema1': 13, 'ema2': 57, 'slip_atr_k': 0.1944487423895941, 'slip_spread_k': 0.1067347422762816, 'spread_hl_frac': 0.007147372770656596, 'bb_std_mult': 1.7184134801243454, 'rsi_os': 51, 'rsi_ob': 81, 'vol_spike': 0.2712855890046053, 'adx_thresh': 25.03505406438365, 'atr_min_pct': 0.011086471156345864, 'atr_max_pct': 0.13464855253638988, 'tp_mult': 1.0455692144433588, 'tsl_mult': 0.996330790581648, 'strategy': 'breakout', 'time_stop': 115, 'use_sma': True, 'use_atr': False, 'use_adx': False, 'use_ema': True, 'use_spike': True, 'rsi_required': False, 'edge_k': 0.8375883840176764, 'edge_cap': 0.31198138910915824, 'bull_strategy': 'breakout', 'bull_bb_std_mult': 3.250063088044638, 'bull_rsi_os': 35, 'bull_rsi_ob': 58, 'bull_adx_thresh': 20.632082056234925, 'bull_atr_min_pct': 0.02996447720822382, 'bull_atr_max_pct': 0.025145451656128973, 'bull_tp_mult': 2.8153517869264433, 'bull_tsl_mult': 0.7432275481836123, 'bull_time_stop': 248, 'bull_use_sma': True, 'bull_use_ema': True, 'bull_use_atr': False, 'bull_use_adx': True, 'bull_use_spike': False, 'bull_rsi_required': True, 'bear_strategy': 'mean_reversion', 'bear_bb_std_mult': 0.659076417047042, 'bear_rsi_os': 33, 'bear_rsi_ob': 71, 'bear_adx_thresh': 30.783726395003097, 'bear_atr_min_pct': 0.0021491658732432934, 'bear_atr_max_pct': 0.04550946164291951, 'bear_tp_mult': 1.470736974429661, 'bear_tsl_mult': 0.15641143151069944, 'bear_time_stop': 224, 'bear_use_sma': True, 'bear_use_ema': True, 'bear_use_atr': False, 'bear_use_adx': False, 'bear_use_spike': False, 'bear_rsi_required': True, 'sideways_strategy': 'mean_reversion', 'sideways_bb_std_mult': 1.661449561114377, 'sideways_rsi_os': 44, 'sideways_rsi_ob': 71, 'sideways_adx_thresh': 11.382067227600482, 'sideways_atr_min_pct': 0.004712704442687208, 'sideways_atr_max_pct': 0.06462151138985689, 'sideways_tp_mult': 1.3245914269032142, 'sideways_tsl_mult': 0.5538862481160352, 'sideways_time_stop': 170, 'sideways_use_sma': True, 'sideways_use_ema': False, 'sideways_use_atr': True, 'sideways_use_adx': False, 'sideways_use_spike': False, 'sideways_rsi_required': True}.
[I 2025-09-01 15:08:38,558] Trial 834 finished with values: [-1000000000.0, 1000000000.0] and parameters: {'p_sma': 13, 'p_std': 15, 'p_atr': 25, 'p_adx': 30, 'rsi_period': 64, 'ema1': 27, 'ema2': 39, 'slip_atr_k': 0.006859115680063153, 'slip_spread_k': 0.09953413149144703, 'spread_hl_frac': 0.005752201320976179, 'bb_std_mult': 1.7202339531010162, 'rsi_os': 29, 'rsi_ob': 83, 'vol_spike': 0.1142307252911205, 'adx_thresh': 23.91894076399778, 'atr_min_pct': 0.027481846327522392, 'atr_max_pct': 0.12474736528804048, 'tp_mult': 1.0433821402469432, 'tsl_mult': 0.8019696828754922, 'strategy': 'mean_reversion', 'time_stop': 77, 'use_sma': True, 'use_atr': False, 'use_adx': False, 'use_ema': True, 'use_spike': True, 'rsi_required': False, 'edge_k': 1.8519098400322407, 'edge_cap': 0.7987561285966698, 'bull_strategy': 'breakout', 'bull_bb_std_mult': 0.7427547621212902, 'bull_rsi_os': 35, 'bull_rsi_ob': 59, 'bull_adx_thresh': 20.61802472342567, 'bull_atr_min_pct': 0.003946138432508804, 'bull_atr_max_pct': 0.026270515605745566, 'bull_tp_mult': 1.9044898508511685, 'bull_tsl_mult': 0.34957640204110296, 'bull_time_stop': 229, 'bull_use_sma': True, 'bull_use_ema': True, 'bull_use_atr': True, 'bull_use_adx': True, 'bull_use_spike': False, 'bull_rsi_required': True, 'bear_strategy': 'mean_reversion', 'bear_bb_std_mult': 2.446735796085367, 'bear_rsi_os': 6, 'bear_rsi_ob': 92, 'bear_adx_thresh': 26.031252124089566, 'bear_atr_min_pct': 0.019522669533107252, 'bear_atr_max_pct': 0.04480490254180949, 'bear_tp_mult': 2.289523834393114, 'bear_tsl_mult': 0.6825467356328815, 'bear_time_stop': 280, 'bear_use_sma': True, 'bear_use_ema': True, 'bear_use_atr': False, 'bear_use_adx': False, 'bear_use_spike': False, 'bear_rsi_required': True, 'sideways_strategy': 'breakout', 'sideways_bb_std_mult': 1.3411004927015928, 'sideways_rsi_os': 52, 'sideways_rsi_ob': 64, 'sideways_adx_thresh': 17.306648226977625, 'sideways_atr_min_pct': 0.00473749741656662, 'sideways_atr_max_pct': 0.06503675125972036, 'sideways_tp_mult': 1.774412112205876, 'sideways_tsl_mult': 0.2956110221927656, 'sideways_time_stop': 128, 'sideways_use_sma': True, 'sideways_use_ema': False, 'sideways_use_atr': True, 'sideways_use_adx': True, 'sideways_use_spike': False, 'sideways_rsi_required': True}.
[I 2025-09-01 15:08:38,926] Trial 835 finished with values: [-1000000000.0, 1000000000.0] and parameters: {'p_sma': 38, 'p_std': 11, 'p_atr': 25, 'p_adx': 11, 'rsi_period': 63, 'ema1': 16, 'ema2': 42, 'slip_atr_k': 0.004903624334822061, 'slip_spread_k': 0.10716468969324229, 'spread_hl_frac': 0.01144277484006307, 'bb_std_mult': 1.7437030772743567, 'rsi_os': 40, 'rsi_ob': 81, 'vol_spike': 0.11353148031769177, 'adx_thresh': 34.97642628110603, 'atr_min_pct': 0.024682054134352403, 'atr_max_pct': 0.12391934674856764, 'tp_mult': 1.0432145735947074, 'tsl_mult': 0.800113385673743, 'strategy': 'breakout', 'time_stop': 68, 'use_sma': True, 'use_atr': False, 'use_adx': False, 'use_ema': True, 'use_spike': True, 'rsi_required': False, 'edge_k': 0.8070740517100453, 'edge_cap': 0.11442734305775992, 'bull_strategy': 'breakout', 'bull_bb_std_mult': 3.2497003622814464, 'bull_rsi_os': 35, 'bull_rsi_ob': 58, 'bull_adx_thresh': 31.151386247067695, 'bull_atr_min_pct': 0.003894796786199038, 'bull_atr_max_pct': 0.026572027888073495, 'bull_tp_mult': 2.8219823863609603, 'bull_tsl_mult': 0.263568646718074, 'bull_time_stop': 250, 'bull_use_sma': True, 'bull_use_ema': True, 'bull_use_atr': False, 'bull_use_adx': True, 'bull_use_spike': False, 'bull_rsi_required': True, 'bear_strategy': 'mean_reversion', 'bear_bb_std_mult': 2.4399857176789337, 'bear_rsi_os': 33, 'bear_rsi_ob': 89, 'bear_adx_thresh': 6.014095675886129, 'bear_atr_min_pct': 0.009686057899634747, 'bear_atr_max_pct': 0.045248282174138475, 'bear_tp_mult': 2.3773100182545353, 'bear_tsl_mult': 0.15097087929535807, 'bear_time_stop': 280, 'bear_use_sma': True, 'bear_use_ema': True, 'bear_use_atr': False, 'bear_use_adx': False, 'bear_use_spike': False, 'bear_rsi_required': True, 'sideways_strategy': 'mean_reversion', 'sideways_bb_std_mult': 0.6891678576475742, 'sideways_rsi_os': 55, 'sideways_rsi_ob': 71, 'sideways_adx_thresh': 5.568642912836191, 'sideways_atr_min_pct': 0.020072002523551884, 'sideways_atr_max_pct': 0.06506728721127295, 'sideways_tp_mult': 2.9742197743920915, 'sideways_tsl_mult': 0.39954308459625454, 'sideways_time_stop': 121, 'sideways_use_sma': True, 'sideways_use_ema': False, 'sideways_use_atr': True, 'sideways_use_adx': False, 'sideways_use_spike': False, 'sideways_rsi_required': True}.
[I 2025-09-01 15:08:39,238] Trial 833 finished with values: [-1000000000.0, 1000000000.0] and parameters: {'p_sma': 36, 'p_std': 31, 'p_atr': 25, 'p_adx': 30, 'rsi_period': 26, 'ema1': 7, 'ema2': 47, 'slip_atr_k': 0.057148182861312374, 'slip_spread_k': 0.31086600396131914, 'spread_hl_frac': 0.005808269916076553, 'bb_std_mult': 2.638717267741409, 'rsi_os': 45, 'rsi_ob': 90, 'vol_spike': 0.23308703939856676, 'adx_thresh': 25.032679828314894, 'atr_min_pct': 0.025385785453105776, 'atr_max_pct': 0.09921056530599272, 'tp_mult': 1.4906991706542203, 'tsl_mult': 0.908720907431801, 'strategy': 'mean_reversion', 'time_stop': 82, 'use_sma': True, 'use_atr': False, 'use_adx': False, 'use_ema': True, 'use_spike': True, 'rsi_required': False, 'edge_k': 1.9467985460839605, 'edge_cap': 0.3328973217285398, 'bull_strategy': 'breakout', 'bull_bb_std_mult': 2.3117684079094367, 'bull_rsi_os': 13, 'bull_rsi_ob': 56, 'bull_adx_thresh': 20.67318050072939, 'bull_atr_min_pct': 0.0038817709263680527, 'bull_atr_max_pct': 0.14273723967322471, 'bull_tp_mult': 2.84322101716229, 'bull_tsl_mult': 0.7502781113626913, 'bull_time_stop': 249, 'bull_use_sma': True, 'bull_use_ema': True, 'bull_use_atr': False, 'bull_use_adx': True, 'bull_use_spike': False, 'bull_rsi_required': True, 'bear_strategy': 'mean_reversion', 'bear_bb_std_mult': 3.493374496532986, 'bear_rsi_os': 6, 'bear_rsi_ob': 86, 'bear_adx_thresh': 9.429191459207928, 'bear_atr_min_pct': 0.0034029543218013804, 'bear_atr_max_pct': 0.09819485956468374, 'bear_tp_mult': 2.378302428389921, 'bear_tsl_mult': 0.1544567064164923, 'bear_time_stop': 224, 'bear_use_sma': True, 'bear_use_ema': True, 'bear_use_atr': False, 'bear_use_adx': False, 'bear_use_spike': False, 'bear_rsi_required': True, 'sideways_strategy': 'breakout', 'sideways_bb_std_mult': 3.3188704117718713, 'sideways_rsi_os': 46, 'sideways_rsi_ob': 52, 'sideways_adx_thresh': 22.94111021775101, 'sideways_atr_min_pct': 0.005018673244837473, 'sideways_atr_max_pct': 0.06129952059333474, 'sideways_tp_mult': 2.671410693424396, 'sideways_tsl_mult': 0.04577602225755739, 'sideways_time_stop': 203, 'sideways_use_sma': True, 'sideways_use_ema': False, 'sideways_use_atr': True, 'sideways_use_adx': False, 'sideways_use_spike': False, 'sideways_rsi_required': True}.
