[I 2025-09-01 13:17:52,937] Trial 109 finished with values: [-1000000000.0, 1000000000.0] and parameters: {'p_sma': 53, 'p_std': 45, 'p_atr': 30, 'p_adx': 19, 'rsi_period': 75, 'ema1': 19, 'ema2': 60, 'slip_atr_k': 0.03489723284296811, 'slip_spread_k': 0.2421773047059122, 'spread_hl_frac': 0.00885398632717859, 'bb_std_mult': 0.6784253176881987, 'rsi_os': 38, 'rsi_ob': 89, 'vol_spike': 0.21321055815431827, 'adx_thresh': 10.847978462889303, 'atr_min_pct': 0.02018469249236728, 'atr_max_pct': 0.0401574921502314, 'tp_mult': 1.4968357401754835, 'tsl_mult': 0.5288777759725459, 'strategy': 'breakout', 'time_stop': 99, 'use_sma': True, 'use_atr': True, 'use_adx': False, 'use_ema': True, 'use_spike': False, 'rsi_required': True, 'edge_k': 0.6784915408683074, 'edge_cap': 0.7492812355177824, 'bull_strategy': 'mean_reversion', 'bull_bb_std_mult': 2.8080399503951994, 'bull_rsi_os': 45, 'bull_rsi_ob': 52, 'bull_adx_thresh': 6.946777739375876, 'bull_atr_min_pct': 0.0004358996554638117, 'bull_atr_max_pct': 0.07623074149772076, 'bull_tp_mult': 1.9297814719064097, 'bull_tsl_mult': 0.36191581220087266, 'bull_time_stop': 16, 'bull_use_sma': True, 'bull_use_ema': True, 'bull_use_atr': True, 'bull_use_adx': True, 'bull_use_spike': False, 'bull_rsi_required': False, 'bear_strategy': 'mean_reversion', 'bear_bb_std_mult': 0.8601660588938849, 'bear_rsi_os': 11, 'bear_rsi_ob': 82, 'bear_adx_thresh': 12.421815087789879, 'bear_atr_min_pct': 0.021515890076563574, 'bear_atr_max_pct': 0.08012154482489404, 'bear_tp_mult': 2.3244931135721583, 'bear_tsl_mult': 0.5644489215726938, 'bear_time_stop': 256, 'bear_use_sma': True, 'bear_use_ema': False, 'bear_use_atr': True, 'bear_use_adx': True, 'bear_use_spike': False, 'bear_rsi_required': False, 'sideways_strategy': 'breakout', 'sideways_bb_std_mult': 0.7480033415529235, 'sideways_rsi_os': 26, 'sideways_rsi_ob': 93, 'sideways_adx_thresh': 10.640455745713481, 'sideways_atr_min_pct': 0.010013271697703807, 'sideways_atr_max_pct': 0.14870659284695925, 'sideways_tp_mult': 2.763584803902966, 'sideways_tsl_mult': 0.05506753660223107, 'sideways_time_stop': 5, 'sideways_use_sma': False, 'sideways_use_ema': False, 'sideways_use_atr': True, 'sideways_use_adx': True, 'sideways_use_spike': False, 'sideways_rsi_required': True}.
[I 2025-09-01 13:17:52,950] Trial 106 finished with values: [-1000000000.0, 1000000000.0] and parameters: {'p_sma': 53, 'p_std': 45, 'p_atr': 27, 'p_adx': 19, 'rsi_period': 47, 'ema1': 22, 'ema2': 50, 'slip_atr_k': 0.16591466724795764, 'slip_spread_k': 0.9593798389932785, 'spread_hl_frac': 0.013921044156366916, 'bb_std_mult': 2.1388698207379333, 'rsi_os': 49, 'rsi_ob': 80, 'vol_spike': 0.11666628399758357, 'adx_thresh': 15.663600850648562, 'atr_min_pct': 0.0036044154255429253, 'atr_max_pct': 0.0894450315512153, 'tp_mult': 1.7808068726501003, 'tsl_mult': 0.23432669723758537, 'strategy': 'mean_reversion', 'time_stop': 13, 'use_sma': True, 'use_atr': True, 'use_adx': False, 'use_ema': True, 'use_spike': False, 'rsi_required': True, 'edge_k': 0.22383399729341663, 'edge_cap': 0.40373955678208606, 'bull_strategy': 'breakout', 'bull_bb_std_mult': 3.158111309595816, 'bull_rsi_os': 50, 'bull_rsi_ob': 56, 'bull_adx_thresh': 6.896425003113982, 'bull_atr_min_pct': 0.009000691325844409, 'bull_atr_max_pct': 0.07820585033291183, 'bull_tp_mult': 2.1307828181341204, 'bull_tsl_mult': 0.5205293718583499, 'bull_time_stop': 17, 'bull_use_sma': True, 'bull_use_ema': False, 'bull_use_atr': True, 'bull_use_adx': False, 'bull_use_spike': False, 'bull_rsi_required': False, 'bear_strategy': 'mean_reversion', 'bear_bb_std_mult': 0.5768762935782887, 'bear_rsi_os': 21, 'bear_rsi_ob': 81, 'bear_adx_thresh': 29.48513120029236, 'bear_atr_min_pct': 0.014755102814779939, 'bear_atr_max_pct': 0.10921812151156753, 'bear_tp_mult': 2.789875464181905, 'bear_tsl_mult': 0.13801049042002478, 'bear_time_stop': 149, 'bear_use_sma': True, 'bear_use_ema': True, 'bear_use_atr': True, 'bear_use_adx': True, 'bear_use_spike': False, 'bear_rsi_required': False, 'sideways_strategy': 'mean_reversion', 'sideways_bb_std_mult': 0.6440929485860835, 'sideways_rsi_os': 46, 'sideways_rsi_ob': 49, 'sideways_adx_thresh': 14.13292585775963, 'sideways_atr_min_pct': 0.02893772834887283, 'sideways_atr_max_pct': 0.08910935232565015, 'sideways_tp_mult': 2.791924970399447, 'sideways_tsl_mult': 0.04541987115345192, 'sideways_time_stop': 73, 'sideways_use_sma': False, 'sideways_use_ema': False, 'sideways_use_atr': True, 'sideways_use_adx': False, 'sideways_use_spike': False, 'sideways_rsi_required': True}.
[I 2025-09-01 13:18:33,797] Trial 111 finished with values: [-0.023550531118051166, 0.023300027063808414] and parameters: {'p_sma': 50, 'p_std': 41, 'p_atr': 20, 'p_adx': 18, 'rsi_period': 72, 'ema1': 22, 'ema2': 58, 'slip_atr_k': 0.05616348415458294, 'slip_spread_k': 0.38906213067537293, 'spread_hl_frac': 0.005444869330026334, 'bb_std_mult': 1.7886808021236966, 'rsi_os': 38, 'rsi_ob': 77, 'vol_spike': 0.24026351447089725, 'adx_thresh': 9.001863658258815, 'atr_min_pct': 0.014332063516763676, 'atr_max_pct': 0.03261803478743787, 'tp_mult': 1.5259428503330257, 'tsl_mult': 0.0025800829936637876, 'strategy': 'breakout', 'time_stop': 99, 'use_sma': True, 'use_atr': True, 'use_adx': True, 'use_ema': True, 'use_spike': False, 'rsi_required': True, 'edge_k': 0.6971788776925764, 'edge_cap': 0.8167346511539328, 'bull_strategy': 'breakout', 'bull_bb_std_mult': 3.149504224162454, 'bull_rsi_os': 48, 'bull_rsi_ob': 53, 'bull_adx_thresh': 5.883310268148112, 'bull_atr_min_pct': 0.00043645515172434585, 'bull_atr_max_pct': 0.10525615671775372, 'bull_tp_mult': 2.0249301310704757, 'bull_tsl_mult': 0.3066673976245826, 'bull_time_stop': 38, 'bull_use_sma': True, 'bull_use_ema': True, 'bull_use_atr': True, 'bull_use_adx': True, 'bull_use_spike': False, 'bull_rsi_required': True, 'bear_strategy': 'breakout', 'bear_bb_std_mult': 0.9622453635023192, 'bear_rsi_os': 8, 'bear_rsi_ob': 71, 'bear_adx_thresh': 32.65685082377455, 'bear_atr_min_pct': 0.01997613052474254, 'bear_atr_max_pct': 0.0811705709900416, 'bear_tp_mult': 2.3286429892299996, 'bear_tsl_mult': 0.4844038993090208, 'bear_time_stop': 270, 'bear_use_sma': False, 'bear_use_ema': False, 'bear_use_atr': False, 'bear_use_adx': True, 'bear_use_spike': False, 'bear_rsi_required': False, 'sideways_strategy': 'mean_reversion', 'sideways_bb_std_mult': 1.0115309583349548, 'sideways_rsi_os': 25, 'sideways_rsi_ob': 92, 'sideways_adx_thresh': 12.617888677869736, 'sideways_atr_min_pct': 0.010365572353781922, 'sideways_atr_max_pct': 0.1324306465507135, 'sideways_tp_mult': 2.75838484638187, 'sideways_tsl_mult': 0.40281258122812397, 'sideways_time_stop': 5, 'sideways_use_sma': False, 'sideways_use_ema': False, 'sideways_use_atr': True, 'sideways_use_adx': False, 'sideways_use_spike': True, 'sideways_rsi_required': True}.
[I 2025-09-01 13:18:35,790] Trial 110 finished with values: [-1000000000.0, 1000000000.0] and parameters: {'p_sma': 50, 'p_std': 41, 'p_atr': 30, 'p_adx': 18, 'rsi_period': 72, 'ema1': 20, 'ema2': 59, 'slip_atr_k': 0.05551048096556178, 'slip_spread_k': 0.3823519699612635, 'spread_hl_frac': 0.010219402489291665, 'bb_std_mult': 0.7068936138359161, 'rsi_os': 38, 'rsi_ob': 58, 'vol_spike': 0.23164458981635713, 'adx_thresh': 9.42743332778756, 'atr_min_pct': 0.014282925192082753, 'atr_max_pct': 0.03484195628804856, 'tp_mult': 1.5168580329433252, 'tsl_mult': 0.2735476583918663, 'strategy': 'breakout', 'time_stop': 99, 'use_sma': True, 'use_atr': True, 'use_adx': True, 'use_ema': True, 'use_spike': False, 'rsi_required': True, 'edge_k': 0.7028395380018295, 'edge_cap': 0.8023775926839828, 'bull_strategy': 'breakout', 'bull_bb_std_mult': 2.97742006356619, 'bull_rsi_os': 48, 'bull_rsi_ob': 53, 'bull_adx_thresh': 28.642321153307368, 'bull_atr_min_pct': 0.001480275158032228, 'bull_atr_max_pct': 0.10539892195392996, 'bull_tp_mult': 2.027009778430812, 'bull_tsl_mult': 0.3029881815953789, 'bull_time_stop': 39, 'bull_use_sma': True, 'bull_use_ema': True, 'bull_use_atr': True, 'bull_use_adx': True, 'bull_use_spike': False, 'bull_rsi_required': True, 'bear_strategy': 'breakout', 'bear_bb_std_mult': 0.9740524230346916, 'bear_rsi_os': 8, 'bear_rsi_ob': 71, 'bear_adx_thresh': 12.503125483469159, 'bear_atr_min_pct': 0.022674028399892004, 'bear_atr_max_pct': 0.08966185390256097, 'bear_tp_mult': 2.637156991998486, 'bear_tsl_mult': 0.48732827212801294, 'bear_time_stop': 270, 'bear_use_sma': False, 'bear_use_ema': False, 'bear_use_atr': False, 'bear_use_adx': True, 'bear_use_spike': False, 'bear_rsi_required': False, 'sideways_strategy': 'mean_reversion', 'sideways_bb_std_mult': 0.9951905666004612, 'sideways_rsi_os': 26, 'sideways_rsi_ob': 92, 'sideways_adx_thresh': 10.14982849325732, 'sideways_atr_min_pct': 0.010377085435575962, 'sideways_atr_max_pct': 0.13291219257968206, 'sideways_tp_mult': 2.7172474501007695, 'sideways_tsl_mult': 0.3756379728721656, 'sideways_time_stop': 6, 'sideways_use_sma': False, 'sideways_use_ema': False, 'sideways_use_atr': True, 'sideways_use_adx': False, 'sideways_use_spike': True, 'sideways_rsi_required': True}.
[I 2025-09-01 13:18:35,797] Trial 113 finished with values: [-1000000000.0, 1000000000.0] and parameters: {'p_sma': 51, 'p_std': 41, 'p_atr': 14, 'p_adx': 20, 'rsi_period': 70, 'ema1': 28, 'ema2': 58, 'slip_atr_k': 0.058563700854324954, 'slip_spread_k': 0.3962669590627387, 'spread_hl_frac': 0.01080280639684539, 'bb_std_mult': 1.1230812321538575, 'rsi_os': 36, 'rsi_ob': 77, 'vol_spike': 0.22906059601037368, 'adx_thresh': 8.988188243072992, 'atr_min_pct': 0.008666774986048948, 'atr_max_pct': 0.0329694433894277, 'tp_mult': 1.3942079226570718, 'tsl_mult': 0.5642205330091197, 'strategy': 'breakout', 'time_stop': 134, 'use_sma': True, 'use_atr': True, 'use_adx': True, 'use_ema': True, 'use_spike': True, 'rsi_required': False, 'edge_k': 0.5054793436717947, 'edge_cap': 0.8075820242613898, 'bull_strategy': 'breakout', 'bull_bb_std_mult': 3.0924481489116347, 'bull_rsi_os': 48, 'bull_rsi_ob': 48, 'bull_adx_thresh': 29.9010966551811, 'bull_atr_min_pct': 0.0014664698242387417, 'bull_atr_max_pct': 0.10527780155700127, 'bull_tp_mult': 2.0311230369047046, 'bull_tsl_mult': 0.32325563013303704, 'bull_time_stop': 40, 'bull_use_sma': False, 'bull_use_ema': True, 'bull_use_atr': True, 'bull_use_adx': True, 'bull_use_spike': False, 'bull_rsi_required': True, 'bear_strategy': 'breakout', 'bear_bb_std_mult': 0.7571392075684833, 'bear_rsi_os': 7, 'bear_rsi_ob': 74, 'bear_adx_thresh': 25.053002492597724, 'bear_atr_min_pct': 0.020343098368474033, 'bear_atr_max_pct': 0.08881271617261975, 'bear_tp_mult': 2.6101842961563007, 'bear_tsl_mult': 0.48529916493090863, 'bear_time_stop': 269, 'bear_use_sma': False, 'bear_use_ema': False, 'bear_use_atr': False, 'bear_use_adx': True, 'bear_use_spike': False, 'bear_rsi_required': True, 'sideways_strategy': 'mean_reversion', 'sideways_bb_std_mult': 0.9738445736800032, 'sideways_rsi_os': 29, 'sideways_rsi_ob': 88, 'sideways_adx_thresh': 8.129445386444738, 'sideways_atr_min_pct': 0.008359184387326598, 'sideways_atr_max_pct': 0.13266463673816029, 'sideways_tp_mult': 2.730474395015701, 'sideways_tsl_mult': 0.3760564321986471, 'sideways_time_stop': 12, 'sideways_use_sma': True, 'sideways_use_ema': False, 'sideways_use_atr': True, 'sideways_use_adx': False, 'sideways_use_spike': True, 'sideways_rsi_required': False}.
[I 2025-09-01 13:18:36,152] Trial 112 finished with values: [-0.02351412858732871, 0.02329754639120968] and parameters: {'p_sma': 50, 'p_std': 58, 'p_atr': 30, 'p_adx': 18, 'rsi_period': 71, 'ema1': 7, 'ema2': 57, 'slip_atr_k': 0.05614874657345314, 'slip_spread_k': 0.3848039241362521, 'spread_hl_frac': 0.01055272766560837, 'bb_std_mult': 1.4804944363962373, 'rsi_os': 36, 'rsi_ob': 58, 'vol_spike': 0.23288479097439377, 'adx_thresh': 9.873120542694803, 'atr_min_pct': 0.008777505377296931, 'atr_max_pct': 0.030822134412826656, 'tp_mult': 1.5449481221597248, 'tsl_mult': 0.13072870023220493, 'strategy': 'breakout', 'time_stop': 106, 'use_sma': True, 'use_atr': True, 'use_adx': True, 'use_ema': True, 'use_spike': True, 'rsi_required': False, 'edge_k': 0.5018503660925261, 'edge_cap': 0.7968159883644532, 'bull_strategy': 'breakout', 'bull_bb_std_mult': 2.979857928206926, 'bull_rsi_os': 48, 'bull_rsi_ob': 48, 'bull_adx_thresh': 6.001129838894115, 'bull_atr_min_pct': 0.0016228003275733489, 'bull_atr_max_pct': 0.017158087101035596, 'bull_tp_mult': 2.0183884934763356, 'bull_tsl_mult': 0.327715900160207, 'bull_time_stop': 36, 'bull_use_sma': False, 'bull_use_ema': True, 'bull_use_atr': True, 'bull_use_adx': True, 'bull_use_spike': False, 'bull_rsi_required': True, 'bear_strategy': 'breakout', 'bear_bb_std_mult': 0.9834087584411837, 'bear_rsi_os': 7, 'bear_rsi_ob': 73, 'bear_adx_thresh': 25.472466760332978, 'bear_atr_min_pct': 0.019678860583671676, 'bear_atr_max_pct': 0.0882539123698832, 'bear_tp_mult': 2.6113041592093165, 'bear_tsl_mult': 0.485984494963763, 'bear_time_stop': 286, 'bear_use_sma': False, 'bear_use_ema': False, 'bear_use_atr': False, 'bear_use_adx': True, 'bear_use_spike': False, 'bear_rsi_required': True, 'sideways_strategy': 'mean_reversion', 'sideways_bb_std_mult': 0.9810337247242927, 'sideways_rsi_os': 29, 'sideways_rsi_ob': 88, 'sideways_adx_thresh': 8.179880148394634, 'sideways_atr_min_pct': 0.008408529948123312, 'sideways_atr_max_pct': 0.11813122444638278, 'sideways_tp_mult': 1.7431319006620885, 'sideways_tsl_mult': 0.45252255434460537, 'sideways_time_stop': 9, 'sideways_use_sma': True, 'sideways_use_ema': False, 'sideways_use_atr': True, 'sideways_use_adx': False, 'sideways_use_spike': True, 'sideways_rsi_required': False}.
[I 2025-09-01 13:19:14,313] Trial 116 finished with values: [-1000000000.0, 1000000000.0] and parameters: {'p_sma': 55, 'p_std': 27, 'p_atr': 10, 'p_adx': 9, 'rsi_period': 68, 'ema1': 22, 'ema2': 58, 'slip_atr_k': 0.10346815890710889, 'slip_spread_k': 0.35342635846702375, 'spread_hl_frac': 0.005356792501901582, 'bb_std_mult': 1.8984983420328272, 'rsi_os': 41, 'rsi_ob': 91, 'vol_spike': 0.24099496762541758, 'adx_thresh': 9.97080241676084, 'atr_min_pct': 0.010736594958649048, 'atr_max_pct': 0.04494436670991207, 'tp_mult': 1.3490955934656417, 'tsl_mult': 0.12272855916742319, 'strategy': 'breakout', 'time_stop': 103, 'use_sma': True, 'use_atr': True, 'use_adx': False, 'use_ema': False, 'use_spike': False, 'rsi_required': True, 'edge_k': 0.4537975057415917, 'edge_cap': 0.8717955170085284, 'bull_strategy': 'breakout', 'bull_bb_std_mult': 2.6244806887719156, 'bull_rsi_os': 46, 'bull_rsi_ob': 54, 'bull_adx_thresh': 5.860687560384032, 'bull_atr_min_pct': 0.0028334171935159753, 'bull_atr_max_pct': 0.015713380129149, 'bull_tp_mult': 2.2245487657678966, 'bull_tsl_mult': 0.425937399755158, 'bull_time_stop': 5, 'bull_use_sma': True, 'bull_use_ema': True, 'bull_use_atr': True, 'bull_use_adx': True, 'bull_use_spike': True, 'bull_rsi_required': True, 'bear_strategy': 'mean_reversion', 'bear_bb_std_mult': 0.9765664500155621, 'bear_rsi_os': 11, 'bear_rsi_ob': 76, 'bear_adx_thresh': 32.96502763255079, 'bear_atr_min_pct': 0.02411722800511356, 'bear_atr_max_pct': 0.08251990699289045, 'bear_tp_mult': 2.7092009995983135, 'bear_tsl_mult': 0.5185654030460441, 'bear_time_stop': 214, 'bear_use_sma': True, 'bear_use_ema': False, 'bear_use_atr': False, 'bear_use_adx': True, 'bear_use_spike': False, 'bear_rsi_required': False, 'sideways_strategy': 'mean_reversion', 'sideways_bb_std_mult': 0.8940917403315898, 'sideways_rsi_os': 31, 'sideways_rsi_ob': 95, 'sideways_adx_thresh': 12.469789647979864, 'sideways_atr_min_pct': 0.007572364621552518, 'sideways_atr_max_pct': 0.1201802959590874, 'sideways_tp_mult': 1.9137746246271445, 'sideways_tsl_mult': 0.2988873432476242, 'sideways_time_stop': 23, 'sideways_use_sma': False, 'sideways_use_ema': False, 'sideways_use_atr': True, 'sideways_use_adx': False, 'sideways_use_spike': False, 'sideways_rsi_required': True}.
[I 2025-09-01 13:19:14,831] Trial 117 finished with values: [-1000000000.0, 1000000000.0] and parameters: {'p_sma': 55, 'p_std': 28, 'p_atr': 10, 'p_adx': 9, 'rsi_period': 67, 'ema1': 22, 'ema2': 58, 'slip_atr_k': 0.10348040309716788, 'slip_spread_k': 0.33734283808564397, 'spread_hl_frac': 0.005555935822199362, 'bb_std_mult': 1.8857694708196306, 'rsi_os': 33, 'rsi_ob': 92, 'vol_spike': 0.25322477964675705, 'adx_thresh': 13.373427310999013, 'atr_min_pct': 0.010561265515749742, 'atr_max_pct': 0.030457184127448966, 'tp_mult': 1.5511040696384302, 'tsl_mult': 0.12116635346449746, 'strategy': 'breakout', 'time_stop': 96, 'use_sma': True, 'use_atr': True, 'use_adx': False, 'use_ema': False, 'use_spike': False, 'rsi_required': True, 'edge_k': 0.43507527583167516, 'edge_cap': 0.8362885439350752, 'bull_strategy': 'breakout', 'bull_bb_std_mult': 3.079122141284821, 'bull_rsi_os': 43, 'bull_rsi_ob': 55, 'bull_adx_thresh': 5.961430005301355, 'bull_atr_min_pct': 0.027649232093318765, 'bull_atr_max_pct': 0.015996688148298206, 'bull_tp_mult': 2.8748324942422494, 'bull_tsl_mult': 0.4273445273923849, 'bull_time_stop': 5, 'bull_use_sma': True, 'bull_use_ema': True, 'bull_use_atr': True, 'bull_use_adx': True, 'bull_use_spike': False, 'bull_rsi_required': True, 'bear_strategy': 'mean_reversion', 'bear_bb_std_mult': 0.950920136786438, 'bear_rsi_os': 10, 'bear_rsi_ob': 76, 'bear_adx_thresh': 34.96971566603735, 'bear_atr_min_pct': 0.01986363829398607, 'bear_atr_max_pct': 0.0832798488223705, 'bear_tp_mult': 2.5371794647459924, 'bear_tsl_mult': 0.5463022235300885, 'bear_time_stop': 238, 'bear_use_sma': True, 'bear_use_ema': False, 'bear_use_atr': True, 'bear_use_adx': True, 'bear_use_spike': False, 'bear_rsi_required': False, 'sideways_strategy': 'mean_reversion', 'sideways_bb_std_mult': 1.1288624208914082, 'sideways_rsi_os': 29, 'sideways_rsi_ob': 95, 'sideways_adx_thresh': 12.345206991558793, 'sideways_atr_min_pct': 0.007496668415640959, 'sideways_atr_max_pct': 0.1224499475434298, 'sideways_tp_mult': 1.7548399653045634, 'sideways_tsl_mult': 0.4439071963824814, 'sideways_time_stop': 24, 'sideways_use_sma': False, 'sideways_use_ema': False, 'sideways_use_atr': True, 'sideways_use_adx': False, 'sideways_use_spike': False, 'sideways_rsi_required': True}.
[I 2025-09-01 13:19:15,117] Trial 115 finished with values: [-1000000000.0, 1000000000.0] and parameters: {'p_sma': 57, 'p_std': 15, 'p_atr': 29, 'p_adx': 18, 'rsi_period': 73, 'ema1': 22, 'ema2': 58, 'slip_atr_k': 0.10923243234665247, 'slip_spread_k': 0.342642562245212, 'spread_hl_frac': 0.006303949915264111, 'bb_std_mult': 1.8989165501033387, 'rsi_os': 41, 'rsi_ob': 91, 'vol_spike': 0.24446345777280998, 'adx_thresh': 12.36789558804655, 'atr_min_pct': 0.010632410458361628, 'atr_max_pct': 0.04618046197642858, 'tp_mult': 1.4303690641786184, 'tsl_mult': 0.8414395833810111, 'strategy': 'breakout', 'time_stop': 93, 'use_sma': True, 'use_atr': True, 'use_adx': False, 'use_ema': False, 'use_spike': False, 'rsi_required': True, 'edge_k': 0.4607879970006671, 'edge_cap': 0.8735378459123224, 'bull_strategy': 'breakout', 'bull_bb_std_mult': 2.660200979578029, 'bull_rsi_os': 5, 'bull_rsi_ob': 55, 'bull_adx_thresh': 5.782645890933764, 'bull_atr_min_pct': 0.029647601429627357, 'bull_atr_max_pct': 0.015614108247442728, 'bull_tp_mult': 1.7006941382554719, 'bull_tsl_mult': 0.41802345243992783, 'bull_time_stop': 5, 'bull_use_sma': True, 'bull_use_ema': True, 'bull_use_atr': True, 'bull_use_adx': True, 'bull_use_spike': True, 'bull_rsi_required': True, 'bear_strategy': 'mean_reversion', 'bear_bb_std_mult': 0.9674587098962895, 'bear_rsi_os': 11, 'bear_rsi_ob': 75, 'bear_adx_thresh': 27.07338429535125, 'bear_atr_min_pct': 0.019818375268288925, 'bear_atr_max_pct': 0.08313931125539098, 'bear_tp_mult': 2.5259084716042586, 'bear_tsl_mult': 0.5432464534528564, 'bear_time_stop': 289, 'bear_use_sma': True, 'bear_use_ema': False, 'bear_use_atr': False, 'bear_use_adx': True, 'bear_use_spike': False, 'bear_rsi_required': False, 'sideways_strategy': 'mean_reversion', 'sideways_bb_std_mult': 0.8635656949035668, 'sideways_rsi_os': 31, 'sideways_rsi_ob': 95, 'sideways_adx_thresh': 12.835667869287342, 'sideways_atr_min_pct': 0.010831483216723059, 'sideways_atr_max_pct': 0.12243164835427794, 'sideways_tp_mult': 2.0688460718518082, 'sideways_tsl_mult': 0.2935005639094969, 'sideways_time_stop': 13, 'sideways_use_sma': False, 'sideways_use_ema': False, 'sideways_use_atr': True, 'sideways_use_adx': False, 'sideways_use_spike': False, 'sideways_rsi_required': True}.
