[I 2025-09-01 13:23:54,681] Trial 143 finished with values: [-0.03472017138272654, 0.03449477245400106] and parameters: {'p_sma': 53, 'p_std': 35, 'p_atr': 30, 'p_adx': 19, 'rsi_period': 55, 'ema1': 10, 'ema2': 56, 'slip_atr_k': 0.10742445603843802, 'slip_spread_k': 0.02769547508488579, 'spread_hl_frac': 0.013668126795328923, 'bb_std_mult': 1.690132541728941, 'rsi_os': 40, 'rsi_ob': 90, 'vol_spike': 0.2482450013747285, 'adx_thresh': 25.367475368791812, 'atr_min_pct': 0.0037474444286006913, 'atr_max_pct': 0.039099989205932016, 'tp_mult': 1.4843435674778764, 'tsl_mult': 0.1716821787067483, 'strategy': 'breakout', 'time_stop': 241, 'use_sma': True, 'use_atr': True, 'use_adx': False, 'use_ema': True, 'use_spike': False, 'rsi_required': True, 'edge_k': 0.40912860642131554, 'edge_cap': 0.7746351478060569, 'bull_strategy': 'breakout', 'bull_bb_std_mult': 2.7322448253707057, 'bull_rsi_os': 50, 'bull_rsi_ob': 56, 'bull_adx_thresh': 5.013380477245592, 'bull_atr_min_pct': 0.0010425593768616857, 'bull_atr_max_pct': 0.026804326889559908, 'bull_tp_mult': 1.8903135811700231, 'bull_tsl_mult': 0.44631509401127056, 'bull_time_stop': 11, 'bull_use_sma': True, 'bull_use_ema': True, 'bull_use_atr': True, 'bull_use_adx': True, 'bull_use_spike': False, 'bull_rsi_required': True, 'bear_strategy': 'mean_reversion', 'bear_bb_std_mult': 0.8178147439586861, 'bear_rsi_os': 13, 'bear_rsi_ob': 58, 'bear_adx_thresh': 9.98759479046373, 'bear_atr_min_pct': 0.02589219868795435, 'bear_atr_max_pct': 0.08449719491491017, 'bear_tp_mult': 1.6517395365781657, 'bear_tsl_mult': 0.4361956562211299, 'bear_time_stop': 239, 'bear_use_sma': True, 'bear_use_ema': False, 'bear_use_atr': True, 'bear_use_adx': True, 'bear_use_spike': False, 'bear_rsi_required': False, 'sideways_strategy': 'breakout', 'sideways_bb_std_mult': 0.8560617545573587, 'sideways_rsi_os': 19, 'sideways_rsi_ob': 75, 'sideways_adx_thresh': 12.232919756038562, 'sideways_atr_min_pct': 0.007006926866319742, 'sideways_atr_max_pct': 0.12083805164745247, 'sideways_tp_mult': 1.4865725885346803, 'sideways_tsl_mult': 0.5224089101979957, 'sideways_time_stop': 26, 'sideways_use_sma': False, 'sideways_use_ema': True, 'sideways_use_atr': True, 'sideways_use_adx': True, 'sideways_use_spike': False, 'sideways_rsi_required': True}.
[I 2025-09-01 13:23:55,457] Trial 142 finished with values: [-0.032483141686643235, 0.03223597843117773] and parameters: {'p_sma': 56, 'p_std': 34, 'p_atr': 18, 'p_adx': 19, 'rsi_period': 74, 'ema1': 18, 'ema2': 56, 'slip_atr_k': 0.10709925487106593, 'slip_spread_k': 0.32681284658096815, 'spread_hl_frac': 0.013669029790746188, 'bb_std_mult': 1.680505157590201, 'rsi_os': 40, 'rsi_ob': 90, 'vol_spike': 0.22778225673222996, 'adx_thresh': 10.193726700164312, 'atr_min_pct': 0.015412650213950174, 'atr_max_pct': 0.03887545313094277, 'tp_mult': 1.0179457044520506, 'tsl_mult': 0.1678594185587981, 'strategy': 'breakout', 'time_stop': 200, 'use_sma': True, 'use_atr': True, 'use_adx': False, 'use_ema': True, 'use_spike': False, 'rsi_required': True, 'edge_k': 1.8026806803248192, 'edge_cap': 0.6456122787594107, 'bull_strategy': 'breakout', 'bull_bb_std_mult': 0.8745012840043209, 'bull_rsi_os': 46, 'bull_rsi_ob': 75, 'bull_adx_thresh': 5.240953311361631, 'bull_atr_min_pct': 0.0011296176830434012, 'bull_atr_max_pct': 0.01100224408670045, 'bull_tp_mult': 1.8925530978694307, 'bull_tsl_mult': 0.4387414774512843, 'bull_time_stop': 47, 'bull_use_sma': True, 'bull_use_ema': True, 'bull_use_atr': True, 'bull_use_adx': True, 'bull_use_spike': False, 'bull_rsi_required': True, 'bear_strategy': 'breakout', 'bear_bb_std_mult': 1.2701052108527908, 'bear_rsi_os': 29, 'bear_rsi_ob': 78, 'bear_adx_thresh': 32.41677370140374, 'bear_atr_min_pct': 0.02339470463256489, 'bear_atr_max_pct': 0.015895356301717414, 'bear_tp_mult': 2.518785558642687, 'bear_tsl_mult': 0.4357859396115732, 'bear_time_stop': 247, 'bear_use_sma': True, 'bear_use_ema': False, 'bear_use_atr': True, 'bear_use_adx': True, 'bear_use_spike': True, 'bear_rsi_required': False, 'sideways_strategy': 'breakout', 'sideways_bb_std_mult': 0.9119664857280148, 'sideways_rsi_os': 19, 'sideways_rsi_ob': 87, 'sideways_adx_thresh': 15.121566875300118, 'sideways_atr_min_pct': 0.005765092098163659, 'sideways_atr_max_pct': 0.11999786193092989, 'sideways_tp_mult': 1.3813946859691266, 'sideways_tsl_mult': 0.5279962663371855, 'sideways_time_stop': 167, 'sideways_use_sma': False, 'sideways_use_ema': True, 'sideways_use_atr': False, 'sideways_use_adx': True, 'sideways_use_spike': False, 'sideways_rsi_required': True}.
[I 2025-09-01 13:23:55,740] Trial 144 finished with values: [-0.033338910692421786, 0.03318585644823777] and parameters: {'p_sma': 53, 'p_std': 12, 'p_atr': 30, 'p_adx': 19, 'rsi_period': 83, 'ema1': 9, 'ema2': 56, 'slip_atr_k': 0.0974999661468888, 'slip_spread_k': 0.46018062055362213, 'spread_hl_frac': 0.013350977501767381, 'bb_std_mult': 1.6360799759013078, 'rsi_os': 40, 'rsi_ob': 90, 'vol_spike': 0.24797555242961467, 'adx_thresh': 33.33467422871206, 'atr_min_pct': 0.013632555633174032, 'atr_max_pct': 0.0389439661696318, 'tp_mult': 1.3447145764499395, 'tsl_mult': 0.1719231714845257, 'strategy': 'breakout', 'time_stop': 241, 'use_sma': True, 'use_atr': True, 'use_adx': False, 'use_ema': True, 'use_spike': False, 'rsi_required': True, 'edge_k': 0.4068624984149719, 'edge_cap': 0.971441488338598, 'bull_strategy': 'breakout', 'bull_bb_std_mult': 3.248754971981965, 'bull_rsi_os': 44, 'bull_rsi_ob': 56, 'bull_adx_thresh': 5.64851028518498, 'bull_atr_min_pct': 0.001939714998209425, 'bull_atr_max_pct': 0.0875263689448535, 'bull_tp_mult': 1.8997221342580761, 'bull_tsl_mult': 0.44182305371981545, 'bull_time_stop': 215, 'bull_use_sma': True, 'bull_use_ema': True, 'bull_use_atr': True, 'bull_use_adx': True, 'bull_use_spike': False, 'bull_rsi_required': True, 'bear_strategy': 'mean_reversion', 'bear_bb_std_mult': 1.293743370900199, 'bear_rsi_os': 13, 'bear_rsi_ob': 50, 'bear_adx_thresh': 9.955528626586474, 'bear_atr_min_pct': 0.025895161393509662, 'bear_atr_max_pct': 0.06472629515318605, 'bear_tp_mult': 2.6240954372589407, 'bear_tsl_mult': 0.49727791712381575, 'bear_time_stop': 61, 'bear_use_sma': True, 'bear_use_ema': False, 'bear_use_atr': True, 'bear_use_adx': True, 'bear_use_spike': False, 'bear_rsi_required': False, 'sideways_strategy': 'breakout', 'sideways_bb_std_mult': 2.614201793320896, 'sideways_rsi_os': 18, 'sideways_rsi_ob': 75, 'sideways_adx_thresh': 14.718193468365985, 'sideways_atr_min_pct': 0.0010875218811225006, 'sideways_atr_max_pct': 0.10802935710395715, 'sideways_tp_mult': 1.1968587808979732, 'sideways_tsl_mult': 0.5245421266743009, 'sideways_time_stop': 165, 'sideways_use_sma': False, 'sideways_use_ema': True, 'sideways_use_atr': True, 'sideways_use_adx': True, 'sideways_use_spike': False, 'sideways_rsi_required': True}.
[I 2025-09-01 13:24:33,264] Trial 148 finished with values: [-0.03242988214429354, 0.03215543438695234] and parameters: {'p_sma': 53, 'p_std': 16, 'p_atr': 29, 'p_adx': 20, 'rsi_period': 83, 'ema1': 18, 'ema2': 25, 'slip_atr_k': 0.07257896009900408, 'slip_spread_k': 0.11840940868708494, 'spread_hl_frac': 0.003359440942048049, 'bb_std_mult': 0.9148489789281169, 'rsi_os': 14, 'rsi_ob': 63, 'vol_spike': 0.250624564583551, 'adx_thresh': 33.826641905517285, 'atr_min_pct': 0.002810313025353154, 'atr_max_pct': 0.05916376119390024, 'tp_mult': 2.576518981624179, 'tsl_mult': 0.274960605329466, 'strategy': 'breakout', 'time_stop': 91, 'use_sma': True, 'use_atr': False, 'use_adx': False, 'use_ema': True, 'use_spike': False, 'rsi_required': False, 'edge_k': 0.766566080852848, 'edge_cap': 0.8919195934820499, 'bull_strategy': 'breakout', 'bull_bb_std_mult': 1.3002767864488736, 'bull_rsi_os': 50, 'bull_rsi_ob': 56, 'bull_adx_thresh': 5.677155635659347, 'bull_atr_min_pct': 0.0018969804961801826, 'bull_atr_max_pct': 0.05941611126908339, 'bull_tp_mult': 1.8971087076826703, 'bull_tsl_mult': 0.8484219108286036, 'bull_time_stop': 239, 'bull_use_sma': True, 'bull_use_ema': True, 'bull_use_atr': True, 'bull_use_adx': True, 'bull_use_spike': False, 'bull_rsi_required': True, 'bear_strategy': 'mean_reversion', 'bear_bb_std_mult': 0.9275370875342207, 'bear_rsi_os': 45, 'bear_rsi_ob': 67, 'bear_adx_thresh': 26.09951692940088, 'bear_atr_min_pct': 0.025273188523683585, 'bear_atr_max_pct': 0.06455464309392804, 'bear_tp_mult': 2.630454554381841, 'bear_tsl_mult': 0.5440423962618567, 'bear_time_stop': 268, 'bear_use_sma': True, 'bear_use_ema': False, 'bear_use_atr': True, 'bear_use_adx': True, 'bear_use_spike': False, 'bear_rsi_required': False, 'sideways_strategy': 'mean_reversion', 'sideways_bb_std_mult': 0.8429305216668666, 'sideways_rsi_os': 12, 'sideways_rsi_ob': 90, 'sideways_adx_thresh': 13.953166204880752, 'sideways_atr_min_pct': 0.01417332485864272, 'sideways_atr_max_pct': 0.05070770679306906, 'sideways_tp_mult': 1.2520615340571575, 'sideways_tsl_mult': 0.48211519829946714, 'sideways_time_stop': 11, 'sideways_use_sma': False, 'sideways_use_ema': False, 'sideways_use_atr': True, 'sideways_use_adx': False, 'sideways_use_spike': False, 'sideways_rsi_required': True}.
[I 2025-09-01 13:24:33,620] Trial 149 finished with values: [-1000000000.0, 1000000000.0] and parameters: {'p_sma': 7, 'p_std': 45, 'p_atr': 21, 'p_adx': 13, 'rsi_period': 72, 'ema1': 18, 'ema2': 25, 'slip_atr_k': 0.13300250969639504, 'slip_spread_k': 0.10527870052553562, 'spread_hl_frac': 0.012478762023403454, 'bb_std_mult': 1.4324164107661181, 'rsi_os': 15, 'rsi_ob': 92, 'vol_spike': 0.14524697264129396, 'adx_thresh': 33.82712112043147, 'atr_min_pct': 0.000643671271594475, 'atr_max_pct': 0.11315198838633508, 'tp_mult': 2.553576418170258, 'tsl_mult': 0.5631568370760957, 'strategy': 'breakout', 'time_stop': 257, 'use_sma': False, 'use_atr': False, 'use_adx': False, 'use_ema': True, 'use_spike': False, 'rsi_required': False, 'edge_k': 0.3367807108213504, 'edge_cap': 0.8937982750549079, 'bull_strategy': 'breakout', 'bull_bb_std_mult': 0.8926711908390577, 'bull_rsi_os': 44, 'bull_rsi_ob': 53, 'bull_adx_thresh': 20.207120145363348, 'bull_atr_min_pct': 0.027264100208396556, 'bull_atr_max_pct': 0.11811284699785468, 'bull_tp_mult': 1.8515968362954407, 'bull_tsl_mult': 0.4033519394557854, 'bull_time_stop': 27, 'bull_use_sma': True, 'bull_use_ema': True, 'bull_use_atr': True, 'bull_use_adx': True, 'bull_use_spike': False, 'bull_rsi_required': True, 'bear_strategy': 'mean_reversion', 'bear_bb_std_mult': 0.7172925932980312, 'bear_rsi_os': 44, 'bear_rsi_ob': 67, 'bear_adx_thresh': 11.54384440005077, 'bear_atr_min_pct': 0.027635183743630658, 'bear_atr_max_pct': 0.08086051200846016, 'bear_tp_mult': 2.6338185509692558, 'bear_tsl_mult': 0.5362166996360229, 'bear_time_stop': 17, 'bear_use_sma': True, 'bear_use_ema': False, 'bear_use_atr': True, 'bear_use_adx': True, 'bear_use_spike': False, 'bear_rsi_required': False, 'sideways_strategy': 'mean_reversion', 'sideways_bb_std_mult': 0.6772310282706013, 'sideways_rsi_os': 12, 'sideways_rsi_ob': 90, 'sideways_adx_thresh': 13.194861269855696, 'sideways_atr_min_pct': 0.013853183773526052, 'sideways_atr_max_pct': 0.0492893473760385, 'sideways_tp_mult': 1.2535305271167332, 'sideways_tsl_mult': 0.48721088927103007, 'sideways_time_stop': 11, 'sideways_use_sma': False, 'sideways_use_ema': False, 'sideways_use_atr': True, 'sideways_use_adx': False, 'sideways_use_spike': False, 'sideways_rsi_required': True}.
[I 2025-09-01 13:24:33,831] Trial 147 finished with values: [-1000000000.0, 1000000000.0] and parameters: {'p_sma': 53, 'p_std': 45, 'p_atr': 21, 'p_adx': 20, 'rsi_period': 83, 'ema1': 18, 'ema2': 59, 'slip_atr_k': 0.10050773260858917, 'slip_spread_k': 0.343671530829691, 'spread_hl_frac': 0.003938459860370412, 'bb_std_mult': 0.9348788821550107, 'rsi_os': 15, 'rsi_ob': 91, 'vol_spike': 0.1383661073210817, 'adx_thresh': 33.22309265227625, 'atr_min_pct': 0.0037531643722917385, 'atr_max_pct': 0.0609816286251343, 'tp_mult': 1.2256177792490193, 'tsl_mult': 0.1682208154301868, 'strategy': 'breakout', 'time_stop': 260, 'use_sma': True, 'use_atr': False, 'use_adx': False, 'use_ema': True, 'use_spike': False, 'rsi_required': False, 'edge_k': 0.47642191073253093, 'edge_cap': 0.6712103479079634, 'bull_strategy': 'breakout', 'bull_bb_std_mult': 2.4192675903602225, 'bull_rsi_os': 50, 'bull_rsi_ob': 53, 'bull_adx_thresh': 16.83413027039441, 'bull_atr_min_pct': 0.027022571348566282, 'bull_atr_max_pct': 0.060220993245124886, 'bull_tp_mult': 1.892866146338273, 'bull_tsl_mult': 0.3577738057805848, 'bull_time_stop': 73, 'bull_use_sma': True, 'bull_use_ema': True, 'bull_use_atr': True, 'bull_use_adx': True, 'bull_use_spike': False, 'bull_rsi_required': True, 'bear_strategy': 'breakout', 'bear_bb_std_mult': 0.708973287934858, 'bear_rsi_os': 13, 'bear_rsi_ob': 67, 'bear_adx_thresh': 11.77079756947151, 'bear_atr_min_pct': 0.025824408540546195, 'bear_atr_max_pct': 0.08190557169813564, 'bear_tp_mult': 2.4338327752949143, 'bear_tsl_mult': 0.5410373860281843, 'bear_time_stop': 11, 'bear_use_sma': True, 'bear_use_ema': False, 'bear_use_atr': True, 'bear_use_adx': True, 'bear_use_spike': False, 'bear_rsi_required': False, 'sideways_strategy': 'mean_reversion', 'sideways_bb_std_mult': 0.8301434185621778, 'sideways_rsi_os': 29, 'sideways_rsi_ob': 90, 'sideways_adx_thresh': 14.099821339747466, 'sideways_atr_min_pct': 0.014856114174087479, 'sideways_atr_max_pct': 0.12146184615103588, 'sideways_tp_mult': 1.3925588283985029, 'sideways_tsl_mult': 0.48420040107136153, 'sideways_time_stop': 27, 'sideways_use_sma': False, 'sideways_use_ema': False, 'sideways_use_atr': True, 'sideways_use_adx': False, 'sideways_use_spike': False, 'sideways_rsi_required': True}.
[I 2025-09-01 13:24:34,053] Trial 150 finished with values: [-1000000000.0, 1000000000.0] and parameters: {'p_sma': 8, 'p_std': 30, 'p_atr': 29, 'p_adx': 20, 'rsi_period': 72, 'ema1': 21, 'ema2': 15, 'slip_atr_k': 0.11581117708488409, 'slip_spread_k': 0.3437470484708054, 'spread_hl_frac': 0.046445743776813916, 'bb_std_mult': 3.4172356225669684, 'rsi_os': 12, 'rsi_ob': 92, 'vol_spike': 0.17198094863052565, 'adx_thresh': 13.80432723065855, 'atr_min_pct': 0.013996827056055533, 'atr_max_pct': 0.058768389986733505, 'tp_mult': 2.5740733770380704, 'tsl_mult': 0.2934949658445583, 'strategy': 'breakout', 'time_stop': 256, 'use_sma': True, 'use_atr': True, 'use_adx': False, 'use_ema': True, 'use_spike': False, 'rsi_required': False, 'edge_k': 0.4829755132892448, 'edge_cap': 0.654019738832022, 'bull_strategy': 'breakout', 'bull_bb_std_mult': 1.329943892281676, 'bull_rsi_os': 33, 'bull_rsi_ob': 54, 'bull_adx_thresh': 5.851236345666206, 'bull_atr_min_pct': 0.019668901580733828, 'bull_atr_max_pct': 0.06198389993971745, 'bull_tp_mult': 1.862179735121861, 'bull_tsl_mult': 0.0819305565663957, 'bull_time_stop': 233, 'bull_use_sma': True, 'bull_use_ema': True, 'bull_use_atr': True, 'bull_use_adx': True, 'bull_use_spike': False, 'bull_rsi_required': False, 'bear_strategy': 'mean_reversion', 'bear_bb_std_mult': 0.7077519619473849, 'bear_rsi_os': 10, 'bear_rsi_ob': 67, 'bear_adx_thresh': 13.707621329591325, 'bear_atr_min_pct': 0.023398823900641397, 'bear_atr_max_pct': 0.08337005184859675, 'bear_tp_mult': 2.6230943756710827, 'bear_tsl_mult': 0.8270606101434936, 'bear_time_stop': 17, 'bear_use_sma': True, 'bear_use_ema': False, 'bear_use_atr': True, 'bear_use_adx': True, 'bear_use_spike': False, 'bear_rsi_required': False, 'sideways_strategy': 'mean_reversion', 'sideways_bb_std_mult': 0.6634575406837058, 'sideways_rsi_os': 28, 'sideways_rsi_ob': 90, 'sideways_adx_thresh': 13.977489926102903, 'sideways_atr_min_pct': 0.009465774807045932, 'sideways_atr_max_pct': 0.05312592719507778, 'sideways_tp_mult': 2.8836279806246137, 'sideways_tsl_mult': 0.48117381221748656, 'sideways_time_stop': 12, 'sideways_use_sma': False, 'sideways_use_ema': False, 'sideways_use_atr': True, 'sideways_use_adx': False, 'sideways_use_spike': False, 'sideways_rsi_required': True}.
[I 2025-09-01 13:25:10,882] Trial 153 finished with values: [-1000000000.0, 1000000000.0] and parameters: {'p_sma': 12, 'p_std': 30, 'p_atr': 13, 'p_adx': 11, 'rsi_period': 73, 'ema1': 21, 'ema2': 21, 'slip_atr_k': 0.24968533865441317, 'slip_spread_k': 0.4248982563848147, 'spread_hl_frac': 0.009696206857413585, 'bb_std_mult': 3.4392723752477012, 'rsi_os': 18, 'rsi_ob': 88, 'vol_spike': 0.21892909760270596, 'adx_thresh': 32.160567536616526, 'atr_min_pct': 0.0027076424429469848, 'atr_max_pct': 0.13038302961005932, 'tp_mult': 1.6727145769178322, 'tsl_mult': 0.2797542972152598, 'strategy': 'breakout', 'time_stop': 100, 'use_sma': True, 'use_atr': True, 'use_adx': True, 'use_ema': True, 'use_spike': False, 'rsi_required': True, 'edge_k': 0.766153474666569, 'edge_cap': 0.7342413171609035, 'bull_strategy': 'breakout', 'bull_bb_std_mult': 2.9046527732202247, 'bull_rsi_os': 47, 'bull_rsi_ob': 58, 'bull_adx_thresh': 27.983085997968583, 'bull_atr_min_pct': 0.016913894718266063, 'bull_atr_max_pct': 0.020932795293220775, 'bull_tp_mult': 1.9603091100723056, 'bull_tsl_mult': 0.06756137403553397, 'bull_time_stop': 238, 'bull_use_sma': True, 'bull_use_ema': True, 'bull_use_atr': True, 'bull_use_adx': True, 'bull_use_spike': False, 'bull_rsi_required': False, 'bear_strategy': 'mean_reversion', 'bear_bb_std_mult': 0.9309593865597839, 'bear_rsi_os': 10, 'bear_rsi_ob': 70, 'bear_adx_thresh': 13.033501666366025, 'bear_atr_min_pct': 0.023525971596918053, 'bear_atr_max_pct': 0.06949170414760841, 'bear_tp_mult': 2.5183428434444672, 'bear_tsl_mult': 0.4714646502876117, 'bear_time_stop': 268, 'bear_use_sma': True, 'bear_use_ema': False, 'bear_use_atr': False, 'bear_use_adx': True, 'bear_use_spike': False, 'bear_rsi_required': False, 'sideways_strategy': 'mean_reversion', 'sideways_bb_std_mult': 1.5655833889612103, 'sideways_rsi_os': 51, 'sideways_rsi_ob': 66, 'sideways_adx_thresh': 23.596222362732394, 'sideways_atr_min_pct': 0.006129553918861849, 'sideways_atr_max_pct': 0.03271148458329775, 'sideways_tp_mult': 2.8095639351393076, 'sideways_tsl_mult': 0.5410744148491983, 'sideways_time_stop': 16, 'sideways_use_sma': False, 'sideways_use_ema': False, 'sideways_use_atr': True, 'sideways_use_adx': False, 'sideways_use_spike': False, 'sideways_rsi_required': True}.
[I 2025-09-01 13:25:11,128] Trial 151 finished with values: [-1000000000.0, 1000000000.0] and parameters: {'p_sma': 9, 'p_std': 16, 'p_atr': 19, 'p_adx': 20, 'rsi_period': 72, 'ema1': 18, 'ema2': 58, 'slip_atr_k': 0.08696124683273464, 'slip_spread_k': 0.805325510722372, 'spread_hl_frac': 0.035107167581284265, 'bb_std_mult': 0.9267057213914922, 'rsi_os': 15, 'rsi_ob': 92, 'vol_spike': 0.23009947594828797, 'adx_thresh': 13.731325946772547, 'atr_min_pct': 0.0027786075609756637, 'atr_max_pct': 0.06070506591395926, 'tp_mult': 2.583964486637102, 'tsl_mult': 0.8512516583404239, 'strategy': 'breakout', 'time_stop': 112, 'use_sma': True, 'use_atr': False, 'use_adx': True, 'use_ema': True, 'use_spike': False, 'rsi_required': False, 'edge_k': 0.7997311627933494, 'edge_cap': 0.8819211161853846, 'bull_strategy': 'breakout', 'bull_bb_std_mult': 2.8869716616582326, 'bull_rsi_os': 47, 'bull_rsi_ob': 53, 'bull_adx_thresh': 28.24225021932942, 'bull_atr_min_pct': 0.0036202308291280565, 'bull_atr_max_pct': 0.06935971977512093, 'bull_tp_mult': 1.8680998936516384, 'bull_tsl_mult': 0.06524690492123358, 'bull_time_stop': 195, 'bull_use_sma': True, 'bull_use_ema': True, 'bull_use_atr': True, 'bull_use_adx': True, 'bull_use_spike': False, 'bull_rsi_required': False, 'bear_strategy': 'mean_reversion', 'bear_bb_std_mult': 0.724937813834678, 'bear_rsi_os': 10, 'bear_rsi_ob': 71, 'bear_adx_thresh': 21.871011877855562, 'bear_atr_min_pct': 0.021961299034399525, 'bear_atr_max_pct': 0.0813471316010652, 'bear_tp_mult': 2.52449598297139, 'bear_tsl_mult': 0.5306919781060543, 'bear_time_stop': 7, 'bear_use_sma': True, 'bear_use_ema': False, 'bear_use_atr': True, 'bear_use_adx': True, 'bear_use_spike': False, 'bear_rsi_required': False, 'sideways_strategy': 'mean_reversion', 'sideways_bb_std_mult': 0.6575467076206462, 'sideways_rsi_os': 29, 'sideways_rsi_ob': 90, 'sideways_adx_thresh': 13.26018697265436, 'sideways_atr_min_pct': 0.014318917620501945, 'sideways_atr_max_pct': 0.11237301880970915, 'sideways_tp_mult': 1.3992382503095298, 'sideways_tsl_mult': 0.48516232813688137, 'sideways_time_stop': 13, 'sideways_use_sma': False, 'sideways_use_ema': False, 'sideways_use_atr': True, 'sideways_use_adx': False, 'sideways_use_spike': False, 'sideways_rsi_required': True}.
