[I 2025-09-01 14:24:41,559] Trial 547 finished with values: [-1000000000.0, 1000000000.0] and parameters: {'p_sma': 36, 'p_std': 49, 'p_atr': 11, 'p_adx': 25, 'rsi_period': 76, 'ema1': 26, 'ema2': 30, 'slip_atr_k': 0.01866640400203954, 'slip_spread_k': 0.08988068875669256, 'spread_hl_frac': 0.01015799909529455, 'bb_std_mult': 1.8802668168105152, 'rsi_os': 39, 'rsi_ob': 82, 'vol_spike': 0.24731869117704697, 'adx_thresh': 25.447194580195262, 'atr_min_pct': 0.025296487283832637, 'atr_max_pct': 0.14132701834810732, 'tp_mult': 1.047565935572525, 'tsl_mult': 0.7342932326387671, 'strategy': 'mean_reversion', 'time_stop': 245, 'use_sma': True, 'use_atr': False, 'use_adx': False, 'use_ema': False, 'use_spike': True, 'rsi_required': False, 'edge_k': 1.3554751215505325, 'edge_cap': 0.446433461855014, 'bull_strategy': 'breakout', 'bull_bb_std_mult': 2.1347749225092745, 'bull_rsi_os': 36, 'bull_rsi_ob': 66, 'bull_adx_thresh': 29.442868831692998, 'bull_atr_min_pct': 0.005255814397363757, 'bull_atr_max_pct': 0.025665086861261836, 'bull_tp_mult': 2.7510296192763426, 'bull_tsl_mult': 0.40800939298466965, 'bull_time_stop': 82, 'bull_use_sma': True, 'bull_use_ema': True, 'bull_use_atr': True, 'bull_use_adx': True, 'bull_use_spike': True, 'bull_rsi_required': True, 'bear_strategy': 'mean_reversion', 'bear_bb_std_mult': 2.6276319914034882, 'bear_rsi_os': 23, 'bear_rsi_ob': 89, 'bear_adx_thresh': 11.871987504581904, 'bear_atr_min_pct': 0.02475454496259358, 'bear_atr_max_pct': 0.05386770922917036, 'bear_tp_mult': 2.299979388424426, 'bear_tsl_mult': 0.15198314667226157, 'bear_time_stop': 20, 'bear_use_sma': True, 'bear_use_ema': True, 'bear_use_atr': False, 'bear_use_adx': False, 'bear_use_spike': True, 'bear_rsi_required': True, 'sideways_strategy': 'breakout', 'sideways_bb_std_mult': 1.7588198091723874, 'sideways_rsi_os': 52, 'sideways_rsi_ob': 67, 'sideways_adx_thresh': 7.735603000482342, 'sideways_atr_min_pct': 0.006006165556460944, 'sideways_atr_max_pct': 0.06525950159629638, 'sideways_tp_mult': 1.370163619605842, 'sideways_tsl_mult': 0.28826251991029295, 'sideways_time_stop': 234, 'sideways_use_sma': True, 'sideways_use_ema': False, 'sideways_use_atr': False, 'sideways_use_adx': True, 'sideways_use_spike': True, 'sideways_rsi_required': False}.
[I 2025-09-01 14:24:42,906] Trial 549 finished with values: [-1000000000.0, 1000000000.0] and parameters: {'p_sma': 36, 'p_std': 47, 'p_atr': 24, 'p_adx': 14, 'rsi_period': 52, 'ema1': 5, 'ema2': 41, 'slip_atr_k': 0.019326593639607446, 'slip_spread_k': 0.09087405563332307, 'spread_hl_frac': 0.010685350290570892, 'bb_std_mult': 1.1219821059641855, 'rsi_os': 40, 'rsi_ob': 82, 'vol_spike': 0.1326583989164744, 'adx_thresh': 24.753401541203818, 'atr_min_pct': 0.026108549126875782, 'atr_max_pct': 0.13335243601112076, 'tp_mult': 1.0669193855080912, 'tsl_mult': 0.4527336738312801, 'strategy': 'mean_reversion', 'time_stop': 77, 'use_sma': True, 'use_atr': False, 'use_adx': True, 'use_ema': False, 'use_spike': True, 'rsi_required': False, 'edge_k': 1.7459018447157835, 'edge_cap': 0.3666791193643118, 'bull_strategy': 'breakout', 'bull_bb_std_mult': 3.1597092671205376, 'bull_rsi_os': 35, 'bull_rsi_ob': 56, 'bull_adx_thresh': 22.4271327373111, 'bull_atr_min_pct': 0.016797312037498905, 'bull_atr_max_pct': 0.05331365469417101, 'bull_tp_mult': 2.949011434168377, 'bull_tsl_mult': 0.7444344059216073, 'bull_time_stop': 107, 'bull_use_sma': False, 'bull_use_ema': True, 'bull_use_atr': False, 'bull_use_adx': True, 'bull_use_spike': False, 'bull_rsi_required': False, 'bear_strategy': 'mean_reversion', 'bear_bb_std_mult': 3.5405070253001676, 'bear_rsi_os': 23, 'bear_rsi_ob': 85, 'bear_adx_thresh': 11.631129015007724, 'bear_atr_min_pct': 0.006123380603110691, 'bear_atr_max_pct': 0.05174329384185349, 'bear_tp_mult': 2.331298216760153, 'bear_tsl_mult': 0.1533602502681188, 'bear_time_stop': 211, 'bear_use_sma': True, 'bear_use_ema': True, 'bear_use_atr': True, 'bear_use_adx': True, 'bear_use_spike': False, 'bear_rsi_required': True, 'sideways_strategy': 'breakout', 'sideways_bb_std_mult': 1.7351998795878856, 'sideways_rsi_os': 52, 'sideways_rsi_ob': 85, 'sideways_adx_thresh': 6.46704817460044, 'sideways_atr_min_pct': 0.01891562470060595, 'sideways_atr_max_pct': 0.02200919377734533, 'sideways_tp_mult': 2.8321064360826274, 'sideways_tsl_mult': 0.22168134777182494, 'sideways_time_stop': 94, 'sideways_use_sma': True, 'sideways_use_ema': True, 'sideways_use_atr': True, 'sideways_use_adx': True, 'sideways_use_spike': False, 'sideways_rsi_required': True}.
[I 2025-09-01 14:24:45,397] Trial 551 finished with values: [-1000000000.0, 1000000000.0] and parameters: {'p_sma': 22, 'p_std': 21, 'p_atr': 14, 'p_adx': 20, 'rsi_period': 52, 'ema1': 20, 'ema2': 33, 'slip_atr_k': 0.2051302430276363, 'slip_spread_k': 0.047487862022169196, 'spread_hl_frac': 0.00775716351725639, 'bb_std_mult': 2.267041400799123, 'rsi_os': 22, 'rsi_ob': 85, 'vol_spike': 0.23049967023725138, 'adx_thresh': 26.27036881079101, 'atr_min_pct': 0.013219900559332004, 'atr_max_pct': 0.09628954606995566, 'tp_mult': 1.0644671058182436, 'tsl_mult': 0.7393707120122053, 'strategy': 'mean_reversion', 'time_stop': 77, 'use_sma': True, 'use_atr': False, 'use_adx': True, 'use_ema': True, 'use_spike': True, 'rsi_required': True, 'edge_k': 0.9006394382301386, 'edge_cap': 0.35725848814832084, 'bull_strategy': 'mean_reversion', 'bull_bb_std_mult': 3.3215281795354032, 'bull_rsi_os': 17, 'bull_rsi_ob': 54, 'bull_adx_thresh': 29.67331545478805, 'bull_atr_min_pct': 0.01656189655992303, 'bull_atr_max_pct': 0.14699366996496765, 'bull_tp_mult': 2.9456785482728707, 'bull_tsl_mult': 0.46254551236592395, 'bull_time_stop': 107, 'bull_use_sma': True, 'bull_use_ema': False, 'bull_use_atr': False, 'bull_use_adx': True, 'bull_use_spike': False, 'bull_rsi_required': True, 'bear_strategy': 'breakout', 'bear_bb_std_mult': 3.5403659075863114, 'bear_rsi_os': 34, 'bear_rsi_ob': 83, 'bear_adx_thresh': 6.663406866063742, 'bear_atr_min_pct': 0.005912883004949321, 'bear_atr_max_pct': 0.12309239570119244, 'bear_tp_mult': 1.6753178593859865, 'bear_tsl_mult': 0.1550448782378306, 'bear_time_stop': 242, 'bear_use_sma': False, 'bear_use_ema': False, 'bear_use_atr': False, 'bear_use_adx': False, 'bear_use_spike': False, 'bear_rsi_required': True, 'sideways_strategy': 'breakout', 'sideways_bb_std_mult': 1.7610896860193639, 'sideways_rsi_os': 36, 'sideways_rsi_ob': 51, 'sideways_adx_thresh': 24.444509355372805, 'sideways_atr_min_pct': 0.019954090040020148, 'sideways_atr_max_pct': 0.06949188132572516, 'sideways_tp_mult': 1.7516036106558261, 'sideways_tsl_mult': 0.22251656566666803, 'sideways_time_stop': 152, 'sideways_use_sma': True, 'sideways_use_ema': False, 'sideways_use_atr': True, 'sideways_use_adx': True, 'sideways_use_spike': False, 'sideways_rsi_required': True}.
[I 2025-09-01 14:24:45,775] Trial 552 finished with values: [-1000000000.0, 1000000000.0] and parameters: {'p_sma': 9, 'p_std': 48, 'p_atr': 25, 'p_adx': 12, 'rsi_period': 68, 'ema1': 12, 'ema2': 19, 'slip_atr_k': 0.009591359638323665, 'slip_spread_k': 0.7779598294630745, 'spread_hl_frac': 0.01976172365325432, 'bb_std_mult': 1.492730599576288, 'rsi_os': 41, 'rsi_ob': 62, 'vol_spike': 0.2996703986570808, 'adx_thresh': 26.415354222683924, 'atr_min_pct': 0.005294541940600582, 'atr_max_pct': 0.09846221931019326, 'tp_mult': 1.1625978530502044, 'tsl_mult': 0.7365910828353482, 'strategy': 'mean_reversion', 'time_stop': 236, 'use_sma': True, 'use_atr': False, 'use_adx': False, 'use_ema': True, 'use_spike': False, 'rsi_required': False, 'edge_k': 1.4625234077797096, 'edge_cap': 0.3654932614800158, 'bull_strategy': 'breakout', 'bull_bb_std_mult': 3.326606537887502, 'bull_rsi_os': 37, 'bull_rsi_ob': 55, 'bull_adx_thresh': 29.765716506077645, 'bull_atr_min_pct': 0.0039058531542159576, 'bull_atr_max_pct': 0.14735775473981463, 'bull_tp_mult': 1.587762886808519, 'bull_tsl_mult': 0.42543379214246574, 'bull_time_stop': 103, 'bull_use_sma': True, 'bull_use_ema': False, 'bull_use_atr': True, 'bull_use_adx': True, 'bull_use_spike': False, 'bull_rsi_required': True, 'bear_strategy': 'breakout', 'bear_bb_std_mult': 3.1201809595737613, 'bear_rsi_os': 34, 'bear_rsi_ob': 90, 'bear_adx_thresh': 13.161902395282986, 'bear_atr_min_pct': 0.012927465304302858, 'bear_atr_max_pct': 0.12350390854306875, 'bear_tp_mult': 1.667989659763999, 'bear_tsl_mult': 0.15727072845305815, 'bear_time_stop': 128, 'bear_use_sma': True, 'bear_use_ema': False, 'bear_use_atr': False, 'bear_use_adx': False, 'bear_use_spike': False, 'bear_rsi_required': False, 'sideways_strategy': 'breakout', 'sideways_bb_std_mult': 1.4676045929972876, 'sideways_rsi_os': 36, 'sideways_rsi_ob': 81, 'sideways_adx_thresh': 28.949998533079384, 'sideways_atr_min_pct': 0.02015146682049535, 'sideways_atr_max_pct': 0.08517596855605147, 'sideways_tp_mult': 1.235495784268882, 'sideways_tsl_mult': 0.5892298498261106, 'sideways_time_stop': 153, 'sideways_use_sma': False, 'sideways_use_ema': False, 'sideways_use_atr': True, 'sideways_use_adx': True, 'sideways_use_spike': False, 'sideways_rsi_required': True}.
[I 2025-09-01 14:25:25,436] Trial 554 finished with values: [-1000000000.0, 1000000000.0] and parameters: {'p_sma': 32, 'p_std': 48, 'p_atr': 25, 'p_adx': 10, 'rsi_period': 72, 'ema1': 12, 'ema2': 19, 'slip_atr_k': 0.20524397494611824, 'slip_spread_k': 0.21034358319876806, 'spread_hl_frac': 0.005395964630434285, 'bb_std_mult': 2.278600659442881, 'rsi_os': 14, 'rsi_ob': 64, 'vol_spike': 0.04250008353617396, 'adx_thresh': 26.401000669859673, 'atr_min_pct': 0.026908382268534693, 'atr_max_pct': 0.06876641539689414, 'tp_mult': 2.667996314636799, 'tsl_mult': 0.7710389116718801, 'strategy': 'mean_reversion', 'time_stop': 235, 'use_sma': True, 'use_atr': False, 'use_adx': False, 'use_ema': True, 'use_spike': False, 'rsi_required': True, 'edge_k': 0.9555936371415222, 'edge_cap': 0.3536090392725349, 'bull_strategy': 'mean_reversion', 'bull_bb_std_mult': 2.7146441779184087, 'bull_rsi_os': 37, 'bull_rsi_ob': 49, 'bull_adx_thresh': 19.951626470962633, 'bull_atr_min_pct': 0.0037389922290992778, 'bull_atr_max_pct': 0.1471394828278545, 'bull_tp_mult': 2.834096922998289, 'bull_tsl_mult': 0.8246926701077568, 'bull_time_stop': 102, 'bull_use_sma': True, 'bull_use_ema': False, 'bull_use_atr': True, 'bull_use_adx': True, 'bull_use_spike': False, 'bull_rsi_required': True, 'bear_strategy': 'breakout', 'bear_bb_std_mult': 2.327903535776048, 'bear_rsi_os': 30, 'bear_rsi_ob': 92, 'bear_adx_thresh': 13.400859173165887, 'bear_atr_min_pct': 0.0017892848890456116, 'bear_atr_max_pct': 0.043500429894863094, 'bear_tp_mult': 1.6500099904356262, 'bear_tsl_mult': 0.933699634768408, 'bear_time_stop': 121, 'bear_use_sma': False, 'bear_use_ema': False, 'bear_use_atr': True, 'bear_use_adx': True, 'bear_use_spike': False, 'bear_rsi_required': False, 'sideways_strategy': 'breakout', 'sideways_bb_std_mult': 0.6121059594816993, 'sideways_rsi_os': 37, 'sideways_rsi_ob': 66, 'sideways_adx_thresh': 7.392107709090111, 'sideways_atr_min_pct': 0.02014484248636426, 'sideways_atr_max_pct': 0.06928077748741658, 'sideways_tp_mult': 2.764582245949334, 'sideways_tsl_mult': 0.7237894250836482, 'sideways_time_stop': 206, 'sideways_use_sma': False, 'sideways_use_ema': False, 'sideways_use_atr': True, 'sideways_use_adx': True, 'sideways_use_spike': False, 'sideways_rsi_required': True}.
[I 2025-09-01 14:25:26,103] Trial 553 finished with values: [-1000000000.0, 1000000000.0] and parameters: {'p_sma': 32, 'p_std': 48, 'p_atr': 14, 'p_adx': 20, 'rsi_period': 68, 'ema1': 12, 'ema2': 19, 'slip_atr_k': 0.20486378318448978, 'slip_spread_k': 0.20062462049936625, 'spread_hl_frac': 0.04656880698999315, 'bb_std_mult': 1.499609292954324, 'rsi_os': 41, 'rsi_ob': 63, 'vol_spike': 0.23054645450717945, 'adx_thresh': 26.234318999575056, 'atr_min_pct': 0.02691423523279505, 'atr_max_pct': 0.1342926274753635, 'tp_mult': 1.1854641865024234, 'tsl_mult': 0.6109548115062383, 'strategy': 'mean_reversion', 'time_stop': 236, 'use_sma': True, 'use_atr': False, 'use_adx': False, 'use_ema': True, 'use_spike': False, 'rsi_required': False, 'edge_k': 1.4299054033761571, 'edge_cap': 0.3683611537793564, 'bull_strategy': 'breakout', 'bull_bb_std_mult': 1.5903713402304627, 'bull_rsi_os': 18, 'bull_rsi_ob': 55, 'bull_adx_thresh': 20.202542990324027, 'bull_atr_min_pct': 0.013080189290457431, 'bull_atr_max_pct': 0.019341764057989437, 'bull_tp_mult': 2.84992110475266, 'bull_tsl_mult': 0.4647725665896837, 'bull_time_stop': 106, 'bull_use_sma': True, 'bull_use_ema': False, 'bull_use_atr': True, 'bull_use_adx': True, 'bull_use_spike': False, 'bull_rsi_required': True, 'bear_strategy': 'breakout', 'bear_bb_std_mult': 2.3252395116614277, 'bear_rsi_os': 30, 'bear_rsi_ob': 91, 'bear_adx_thresh': 13.259769071362943, 'bear_atr_min_pct': 0.0031479265656363365, 'bear_atr_max_pct': 0.04322285212885547, 'bear_tp_mult': 2.228589186326965, 'bear_tsl_mult': 0.3091683459778335, 'bear_time_stop': 205, 'bear_use_sma': True, 'bear_use_ema': False, 'bear_use_atr': True, 'bear_use_adx': True, 'bear_use_spike': False, 'bear_rsi_required': False, 'sideways_strategy': 'breakout', 'sideways_bb_std_mult': 0.6002347631087073, 'sideways_rsi_os': 51, 'sideways_rsi_ob': 69, 'sideways_adx_thresh': 7.267946098213472, 'sideways_atr_min_pct': 0.01715038004769747, 'sideways_atr_max_pct': 0.08517444572220365, 'sideways_tp_mult': 2.8090726495171148, 'sideways_tsl_mult': 0.913523319306182, 'sideways_time_stop': 193, 'sideways_use_sma': False, 'sideways_use_ema': False, 'sideways_use_atr': True, 'sideways_use_adx': True, 'sideways_use_spike': False, 'sideways_rsi_required': True}.
[I 2025-09-01 14:25:26,484] Trial 556 finished with values: [-0.02255142060910731, 0.022238220375847214] and parameters: {'p_sma': 38, 'p_std': 10, 'p_atr': 25, 'p_adx': 11, 'rsi_period': 65, 'ema1': 10, 'ema2': 17, 'slip_atr_k': 0.005802618410612911, 'slip_spread_k': 0.12208330463254424, 'spread_hl_frac': 0.04692539266968036, 'bb_std_mult': 2.1104305339396943, 'rsi_os': 38, 'rsi_ob': 79, 'vol_spike': 0.24041554424548223, 'adx_thresh': 21.192223667484956, 'atr_min_pct': 0.027233616671359567, 'atr_max_pct': 0.12927373340150095, 'tp_mult': 2.4723235250896862, 'tsl_mult': 0.7715196782419175, 'strategy': 'mean_reversion', 'time_stop': 226, 'use_sma': False, 'use_atr': True, 'use_adx': False, 'use_ema': True, 'use_spike': False, 'rsi_required': False, 'edge_k': 1.9983179661673618, 'edge_cap': 0.3210615409727548, 'bull_strategy': 'breakout', 'bull_bb_std_mult': 2.2236625550805686, 'bull_rsi_os': 23, 'bull_rsi_ob': 48, 'bull_adx_thresh': 20.00892188821473, 'bull_atr_min_pct': 0.0027655244902281707, 'bull_atr_max_pct': 0.03033898971699736, 'bull_tp_mult': 2.6464006604377306, 'bull_tsl_mult': 0.42929741998085225, 'bull_time_stop': 32, 'bull_use_sma': True, 'bull_use_ema': True, 'bull_use_atr': True, 'bull_use_adx': False, 'bull_use_spike': False, 'bull_rsi_required': True, 'bear_strategy': 'breakout', 'bear_bb_std_mult': 3.463647215261868, 'bear_rsi_os': 30, 'bear_rsi_ob': 91, 'bear_adx_thresh': 10.014142364630352, 'bear_atr_min_pct': 0.007910977495456136, 'bear_atr_max_pct': 0.043227732983556005, 'bear_tp_mult': 2.225452544564741, 'bear_tsl_mult': 0.07465175960947472, 'bear_time_stop': 83, 'bear_use_sma': True, 'bear_use_ema': True, 'bear_use_atr': True, 'bear_use_adx': True, 'bear_use_spike': False, 'bear_rsi_required': False, 'sideways_strategy': 'mean_reversion', 'sideways_bb_std_mult': 1.5537828455063678, 'sideways_rsi_os': 54, 'sideways_rsi_ob': 69, 'sideways_adx_thresh': 25.362683348968204, 'sideways_atr_min_pct': 0.011417870361714343, 'sideways_atr_max_pct': 0.07313514137435588, 'sideways_tp_mult': 2.430411849236681, 'sideways_tsl_mult': 0.8288272063660882, 'sideways_time_stop': 193, 'sideways_use_sma': False, 'sideways_use_ema': False, 'sideways_use_atr': True, 'sideways_use_adx': True, 'sideways_use_spike': False, 'sideways_rsi_required': True}.
[I 2025-09-01 14:25:26,825] Trial 555 finished with values: [-0.01365355193345752, 0.013438651004347199] and parameters: {'p_sma': 38, 'p_std': 48, 'p_atr': 21, 'p_adx': 13, 'rsi_period': 68, 'ema1': 23, 'ema2': 55, 'slip_atr_k': 0.00919802797033903, 'slip_spread_k': 0.12617905999313195, 'spread_hl_frac': 0.005532334326079233, 'bb_std_mult': 1.5231124993885523, 'rsi_os': 49, 'rsi_ob': 80, 'vol_spike': 0.24095304977216295, 'adx_thresh': 23.93642527718091, 'atr_min_pct': 0.026697745357593665, 'atr_max_pct': 0.06717184732364115, 'tp_mult': 1.1558013962782638, 'tsl_mult': 0.6063628327346294, 'strategy': 'mean_reversion', 'time_stop': 236, 'use_sma': False, 'use_atr': True, 'use_adx': False, 'use_ema': True, 'use_spike': False, 'rsi_required': False, 'edge_k': 0.6331253097314189, 'edge_cap': 0.3907631779142976, 'bull_strategy': 'breakout', 'bull_bb_std_mult': 1.9546303037077322, 'bull_rsi_os': 33, 'bull_rsi_ob': 51, 'bull_adx_thresh': 23.67489941215905, 'bull_atr_min_pct': 0.002703046900111393, 'bull_atr_max_pct': 0.022405127519909116, 'bull_tp_mult': 2.836679663310211, 'bull_tsl_mult': 0.9783966669684051, 'bull_time_stop': 35, 'bull_use_sma': True, 'bull_use_ema': False, 'bull_use_atr': True, 'bull_use_adx': False, 'bull_use_spike': False, 'bull_rsi_required': True, 'bear_strategy': 'breakout', 'bear_bb_std_mult': 3.4332147256628702, 'bear_rsi_os': 30, 'bear_rsi_ob': 92, 'bear_adx_thresh': 10.049900222687388, 'bear_atr_min_pct': 0.003255268630448374, 'bear_atr_max_pct': 0.04292776155381276, 'bear_tp_mult': 2.2185051152363586, 'bear_tsl_mult': 0.07473717247495594, 'bear_time_stop': 62, 'bear_use_sma': True, 'bear_use_ema': False, 'bear_use_atr': True, 'bear_use_adx': True, 'bear_use_spike': False, 'bear_rsi_required': False, 'sideways_strategy': 'mean_reversion', 'sideways_bb_std_mult': 1.249017942978634, 'sideways_rsi_os': 51, 'sideways_rsi_ob': 81, 'sideways_adx_thresh': 23.20685997357051, 'sideways_atr_min_pct': 0.017201052966001093, 'sideways_atr_max_pct': 0.0853570999272413, 'sideways_tp_mult': 2.76360707423627, 'sideways_tsl_mult': 0.7283548770765339, 'sideways_time_stop': 159, 'sideways_use_sma': False, 'sideways_use_ema': False, 'sideways_use_atr': True, 'sideways_use_adx': True, 'sideways_use_spike': False, 'sideways_rsi_required': True}.
[I 2025-09-01 14:25:27,694] Trial 559 finished with values: [-1000000000.0, 1000000000.0] and parameters: {'p_sma': 34, 'p_std': 35, 'p_atr': 21, 'p_adx': 13, 'rsi_period': 62, 'ema1': 8, 'ema2': 18, 'slip_atr_k': 0.033438457775269465, 'slip_spread_k': 0.06992671564966291, 'spread_hl_frac': 0.03804362551985023, 'bb_std_mult': 0.8216843567063912, 'rsi_os': 51, 'rsi_ob': 80, 'vol_spike': 0.22279744978670762, 'adx_thresh': 22.877891720666387, 'atr_min_pct': 0.010519343925615612, 'atr_max_pct': 0.1398157169463671, 'tp_mult': 2.404222676985718, 'tsl_mult': 0.27853033043857667, 'strategy': 'mean_reversion', 'time_stop': 272, 'use_sma': False, 'use_atr': True, 'use_adx': False, 'use_ema': True, 'use_spike': True, 'rsi_required': False, 'edge_k': 0.7249277556662228, 'edge_cap': 0.39533723267720877, 'bull_strategy': 'breakout', 'bull_bb_std_mult': 2.9846175198449445, 'bull_rsi_os': 33, 'bull_rsi_ob': 45, 'bull_adx_thresh': 8.83449146413799, 'bull_atr_min_pct': 0.0288065185816275, 'bull_atr_max_pct': 0.021991080061036606, 'bull_tp_mult': 1.6964025241617748, 'bull_tsl_mult': 0.2594408041040941, 'bull_time_stop': 299, 'bull_use_sma': True, 'bull_use_ema': True, 'bull_use_atr': True, 'bull_use_adx': False, 'bull_use_spike': False, 'bull_rsi_required': True, 'bear_strategy': 'breakout', 'bear_bb_std_mult': 3.4651240685853506, 'bear_rsi_os': 35, 'bear_rsi_ob': 59, 'bear_adx_thresh': 24.548572468669796, 'bear_atr_min_pct': 0.012069712239574794, 'bear_atr_max_pct': 0.06752950433220323, 'bear_tp_mult': 2.139684658413566, 'bear_tsl_mult': 0.44336689110298066, 'bear_time_stop': 62, 'bear_use_sma': True, 'bear_use_ema': True, 'bear_use_atr': True, 'bear_use_adx': True, 'bear_use_spike': True, 'bear_rsi_required': True, 'sideways_strategy': 'mean_reversion', 'sideways_bb_std_mult': 1.6459521468519314, 'sideways_rsi_os': 50, 'sideways_rsi_ob': 66, 'sideways_adx_thresh': 8.181817925180125, 'sideways_atr_min_pct': 0.021055808151289608, 'sideways_atr_max_pct': 0.06745766403449391, 'sideways_tp_mult': 2.5298950082602945, 'sideways_tsl_mult': 0.32795203773329445, 'sideways_time_stop': 177, 'sideways_use_sma': True, 'sideways_use_ema': True, 'sideways_use_atr': False, 'sideways_use_adx': True, 'sideways_use_spike': True, 'sideways_rsi_required': False}.
