[I 2025-09-01 14:58:15,104] Trial 774 finished with values: [-1000000000.0, 1000000000.0] and parameters: {'p_sma': 51, 'p_std': 30, 'p_atr': 25, 'p_adx': 12, 'rsi_period': 66, 'ema1': 21, 'ema2': 22, 'slip_atr_k': 0.01667608867348842, 'slip_spread_k': 0.19456287545728196, 'spread_hl_frac': 0.006709954793847244, 'bb_std_mult': 1.6177777074582633, 'rsi_os': 36, 'rsi_ob': 63, 'vol_spike': 0.22422193284788577, 'adx_thresh': 7.400844763266303, 'atr_min_pct': 0.025687276566073905, 'atr_max_pct': 0.13665333165909974, 'tp_mult': 1.422827907837447, 'tsl_mult': 0.7543484498208075, 'strategy': 'mean_reversion', 'time_stop': 228, 'use_sma': True, 'use_atr': False, 'use_adx': False, 'use_ema': True, 'use_spike': True, 'rsi_required': False, 'edge_k': 0.6204621461631101, 'edge_cap': 0.3742629543499503, 'bull_strategy': 'breakout', 'bull_bb_std_mult': 3.2742227073902797, 'bull_rsi_os': 35, 'bull_rsi_ob': 54, 'bull_adx_thresh': 11.778243255056552, 'bull_atr_min_pct': 0.009496852378265766, 'bull_atr_max_pct': 0.05952092292591843, 'bull_tp_mult': 2.8009726530569945, 'bull_tsl_mult': 0.9247142419859571, 'bull_time_stop': 284, 'bull_use_sma': True, 'bull_use_ema': True, 'bull_use_atr': True, 'bull_use_adx': True, 'bull_use_spike': False, 'bull_rsi_required': True, 'bear_strategy': 'breakout', 'bear_bb_std_mult': 2.909484937470876, 'bear_rsi_os': 19, 'bear_rsi_ob': 89, 'bear_adx_thresh': 11.10563137996406, 'bear_atr_min_pct': 0.0132537279055822, 'bear_atr_max_pct': 0.02014809342506753, 'bear_tp_mult': 2.719143955739211, 'bear_tsl_mult': 0.673525544074465, 'bear_time_stop': 93, 'bear_use_sma': True, 'bear_use_ema': True, 'bear_use_atr': True, 'bear_use_adx': True, 'bear_use_spike': False, 'bear_rsi_required': True, 'sideways_strategy': 'breakout', 'sideways_bb_std_mult': 0.5739709583358044, 'sideways_rsi_os': 32, 'sideways_rsi_ob': 69, 'sideways_adx_thresh': 31.913602085848044, 'sideways_atr_min_pct': 0.00763688467428069, 'sideways_atr_max_pct': 0.11761636777871506, 'sideways_tp_mult': 2.18181642871563, 'sideways_tsl_mult': 0.30508320421186985, 'sideways_time_stop': 164, 'sideways_use_sma': True, 'sideways_use_ema': False, 'sideways_use_atr': True, 'sideways_use_adx': True, 'sideways_use_spike': False, 'sideways_rsi_required': True}.
[I 2025-09-01 14:58:15,445] Trial 773 finished with values: [-1000000000.0, 1000000000.0] and parameters: {'p_sma': 37, 'p_std': 28, 'p_atr': 21, 'p_adx': 12, 'rsi_period': 66, 'ema1': 21, 'ema2': 38, 'slip_atr_k': 0.19679568990997628, 'slip_spread_k': 0.035994488787314295, 'spread_hl_frac': 0.006543536055809839, 'bb_std_mult': 1.645785888436276, 'rsi_os': 37, 'rsi_ob': 63, 'vol_spike': 0.10537472441270143, 'adx_thresh': 7.01022487467395, 'atr_min_pct': 0.025772591592625918, 'atr_max_pct': 0.1354958020756117, 'tp_mult': 1.449885113613926, 'tsl_mult': 0.752461500961211, 'strategy': 'mean_reversion', 'time_stop': 28, 'use_sma': True, 'use_atr': False, 'use_adx': False, 'use_ema': True, 'use_spike': True, 'rsi_required': False, 'edge_k': 0.6225879086743864, 'edge_cap': 0.37064121192214283, 'bull_strategy': 'breakout', 'bull_bb_std_mult': 3.2830792855294106, 'bull_rsi_os': 35, 'bull_rsi_ob': 54, 'bull_adx_thresh': 26.626853302088186, 'bull_atr_min_pct': 0.011586397541329025, 'bull_atr_max_pct': 0.0951351966923141, 'bull_tp_mult': 2.790104500005226, 'bull_tsl_mult': 0.2178966390659181, 'bull_time_stop': 172, 'bull_use_sma': True, 'bull_use_ema': True, 'bull_use_atr': True, 'bull_use_adx': True, 'bull_use_spike': False, 'bull_rsi_required': True, 'bear_strategy': 'breakout', 'bear_bb_std_mult': 2.8599954572350654, 'bear_rsi_os': 33, 'bear_rsi_ob': 94, 'bear_adx_thresh': 10.78047765912429, 'bear_atr_min_pct': 0.014249193453646246, 'bear_atr_max_pct': 0.049536249160375995, 'bear_tp_mult': 2.190804326303525, 'bear_tsl_mult': 0.15008782286742262, 'bear_time_stop': 183, 'bear_use_sma': True, 'bear_use_ema': True, 'bear_use_atr': True, 'bear_use_adx': True, 'bear_use_spike': False, 'bear_rsi_required': True, 'sideways_strategy': 'breakout', 'sideways_bb_std_mult': 1.4861874909322366, 'sideways_rsi_os': 52, 'sideways_rsi_ob': 69, 'sideways_adx_thresh': 34.62239408170495, 'sideways_atr_min_pct': 0.0209049380660353, 'sideways_atr_max_pct': 0.07250917138260847, 'sideways_tp_mult': 2.1734043009586093, 'sideways_tsl_mult': 0.3047890366143842, 'sideways_time_stop': 166, 'sideways_use_sma': True, 'sideways_use_ema': False, 'sideways_use_atr': True, 'sideways_use_adx': True, 'sideways_use_spike': False, 'sideways_rsi_required': True}.
[I 2025-09-01 14:58:16,302] Trial 776 finished with values: [-1000000000.0, 1000000000.0] and parameters: {'p_sma': 37, 'p_std': 13, 'p_atr': 25, 'p_adx': 22, 'rsi_period': 69, 'ema1': 29, 'ema2': 38, 'slip_atr_k': 0.008329608666293625, 'slip_spread_k': 0.037715474706978634, 'spread_hl_frac': 0.04820439622790791, 'bb_std_mult': 1.6083257124642119, 'rsi_os': 28, 'rsi_ob': 71, 'vol_spike': 0.2131647516269894, 'adx_thresh': 22.225430207774444, 'atr_min_pct': 0.027052457267682014, 'atr_max_pct': 0.12797385410340348, 'tp_mult': 2.2106843356315666, 'tsl_mult': 0.7082716273791656, 'strategy': 'mean_reversion', 'time_stop': 30, 'use_sma': True, 'use_atr': False, 'use_adx': False, 'use_ema': True, 'use_spike': True, 'rsi_required': False, 'edge_k': 0.9040336117848495, 'edge_cap': 0.3741249571470131, 'bull_strategy': 'breakout', 'bull_bb_std_mult': 0.6147178741695853, 'bull_rsi_os': 35, 'bull_rsi_ob': 56, 'bull_adx_thresh': 29.997116466729583, 'bull_atr_min_pct': 0.005443790980928368, 'bull_atr_max_pct': 0.1394651910153285, 'bull_tp_mult': 2.8099734394219333, 'bull_tsl_mult': 0.6332899289233543, 'bull_time_stop': 87, 'bull_use_sma': True, 'bull_use_ema': True, 'bull_use_atr': True, 'bull_use_adx': True, 'bull_use_spike': False, 'bull_rsi_required': True, 'bear_strategy': 'breakout', 'bear_bb_std_mult': 0.570438408647675, 'bear_rsi_os': 17, 'bear_rsi_ob': 53, 'bear_adx_thresh': 11.669960670564777, 'bear_atr_min_pct': 0.02124289284384751, 'bear_atr_max_pct': 0.12335825822162345, 'bear_tp_mult': 2.175101152240352, 'bear_tsl_mult': 0.5060342795198581, 'bear_time_stop': 84, 'bear_use_sma': True, 'bear_use_ema': True, 'bear_use_atr': True, 'bear_use_adx': True, 'bear_use_spike': False, 'bear_rsi_required': True, 'sideways_strategy': 'breakout', 'sideways_bb_std_mult': 0.5499312605319138, 'sideways_rsi_os': 13, 'sideways_rsi_ob': 78, 'sideways_adx_thresh': 24.432630205533833, 'sideways_atr_min_pct': 0.020760512693458504, 'sideways_atr_max_pct': 0.0714960872276459, 'sideways_tp_mult': 2.661948261160241, 'sideways_tsl_mult': 0.30591104763658294, 'sideways_time_stop': 274, 'sideways_use_sma': True, 'sideways_use_ema': False, 'sideways_use_atr': True, 'sideways_use_adx': True, 'sideways_use_spike': False, 'sideways_rsi_required': True}.
[I 2025-09-01 14:58:54,716] Trial 777 finished with values: [-1000000000.0, 1000000000.0] and parameters: {'p_sma': 48, 'p_std': 50, 'p_atr': 25, 'p_adx': 22, 'rsi_period': 64, 'ema1': 21, 'ema2': 18, 'slip_atr_k': 0.02513621591348944, 'slip_spread_k': 0.359918899511784, 'spread_hl_frac': 0.032388989116865864, 'bb_std_mult': 1.587279157241336, 'rsi_os': 24, 'rsi_ob': 71, 'vol_spike': 0.24334179740604234, 'adx_thresh': 25.683369934516612, 'atr_min_pct': 0.02698940865454232, 'atr_max_pct': 0.12870620362331153, 'tp_mult': 2.002159928294696, 'tsl_mult': 0.7002235540600427, 'strategy': 'mean_reversion', 'time_stop': 229, 'use_sma': True, 'use_atr': False, 'use_adx': False, 'use_ema': True, 'use_spike': True, 'rsi_required': False, 'edge_k': 0.7703420723423098, 'edge_cap': 0.3712780095267124, 'bull_strategy': 'breakout', 'bull_bb_std_mult': 3.284903810424256, 'bull_rsi_os': 35, 'bull_rsi_ob': 56, 'bull_adx_thresh': 22.789466806599737, 'bull_atr_min_pct': 0.0057212004129738175, 'bull_atr_max_pct': 0.055449824988470495, 'bull_tp_mult': 1.1287567909729108, 'bull_tsl_mult': 0.21857146431857555, 'bull_time_stop': 86, 'bull_use_sma': True, 'bull_use_ema': True, 'bull_use_atr': True, 'bull_use_adx': True, 'bull_use_spike': False, 'bull_rsi_required': True, 'bear_strategy': 'breakout', 'bear_bb_std_mult': 3.0567839005217063, 'bear_rsi_os': 31, 'bear_rsi_ob': 95, 'bear_adx_thresh': 33.22001861847988, 'bear_atr_min_pct': 0.028297991394995226, 'bear_atr_max_pct': 0.13105555515770112, 'bear_tp_mult': 2.23782759510228, 'bear_tsl_mult': 0.14594596248306152, 'bear_time_stop': 274, 'bear_use_sma': True, 'bear_use_ema': True, 'bear_use_atr': True, 'bear_use_adx': True, 'bear_use_spike': False, 'bear_rsi_required': True, 'sideways_strategy': 'breakout', 'sideways_bb_std_mult': 1.6056063055787295, 'sideways_rsi_os': 52, 'sideways_rsi_ob': 67, 'sideways_adx_thresh': 24.290206673481514, 'sideways_atr_min_pct': 0.017908607734173593, 'sideways_atr_max_pct': 0.03084107103550609, 'sideways_tp_mult': 2.638597001392968, 'sideways_tsl_mult': 0.13040891498740126, 'sideways_time_stop': 270, 'sideways_use_sma': True, 'sideways_use_ema': False, 'sideways_use_atr': True, 'sideways_use_adx': True, 'sideways_use_spike': False, 'sideways_rsi_required': True}.
[I 2025-09-01 14:58:55,137] Trial 779 finished with values: [-1000000000.0, 1000000000.0] and parameters: {'p_sma': 32, 'p_std': 50, 'p_atr': 25, 'p_adx': 23, 'rsi_period': 69, 'ema1': 25, 'ema2': 17, 'slip_atr_k': 0.24957951792562583, 'slip_spread_k': 0.06579274263302559, 'spread_hl_frac': 0.012429194050734078, 'bb_std_mult': 2.8224432908665493, 'rsi_os': 39, 'rsi_ob': 83, 'vol_spike': 0.21377383590083082, 'adx_thresh': 24.445632180397123, 'atr_min_pct': 0.011879934535373572, 'atr_max_pct': 0.12834740422687402, 'tp_mult': 1.088816869065762, 'tsl_mult': 0.7073349032184915, 'strategy': 'mean_reversion', 'time_stop': 248, 'use_sma': True, 'use_atr': False, 'use_adx': False, 'use_ema': False, 'use_spike': True, 'rsi_required': False, 'edge_k': 0.7714937481521237, 'edge_cap': 0.06339297179157027, 'bull_strategy': 'breakout', 'bull_bb_std_mult': 3.346128399263449, 'bull_rsi_os': 37, 'bull_rsi_ob': 56, 'bull_adx_thresh': 32.09750032905597, 'bull_atr_min_pct': 0.0026894783056860974, 'bull_atr_max_pct': 0.07756754607740349, 'bull_tp_mult': 2.582659573153092, 'bull_tsl_mult': 0.39316343144626736, 'bull_time_stop': 87, 'bull_use_sma': True, 'bull_use_ema': True, 'bull_use_atr': True, 'bull_use_adx': True, 'bull_use_spike': False, 'bull_rsi_required': True, 'bear_strategy': 'breakout', 'bear_bb_std_mult': 3.4806913718054875, 'bear_rsi_os': 31, 'bear_rsi_ob': 53, 'bear_adx_thresh': 33.58770921779803, 'bear_atr_min_pct': 0.0028334198340592013, 'bear_atr_max_pct': 0.04551557381092878, 'bear_tp_mult': 2.2521228125491435, 'bear_tsl_mult': 0.5059098829570845, 'bear_time_stop': 217, 'bear_use_sma': True, 'bear_use_ema': True, 'bear_use_atr': False, 'bear_use_adx': True, 'bear_use_spike': False, 'bear_rsi_required': True, 'sideways_strategy': 'breakout', 'sideways_bb_std_mult': 1.6099879892077682, 'sideways_rsi_os': 14, 'sideways_rsi_ob': 67, 'sideways_adx_thresh': 33.29477696353541, 'sideways_atr_min_pct': 0.01933712423660034, 'sideways_atr_max_pct': 0.07884296544864136, 'sideways_tp_mult': 2.8865472815466546, 'sideways_tsl_mult': 0.3514657470172501, 'sideways_time_stop': 124, 'sideways_use_sma': True, 'sideways_use_ema': False, 'sideways_use_atr': True, 'sideways_use_adx': True, 'sideways_use_spike': False, 'sideways_rsi_required': True}.
[I 2025-09-01 14:58:55,366] Trial 778 finished with values: [-0.044756923788392355, 0.044609673477882555] and parameters: {'p_sma': 36, 'p_std': 13, 'p_atr': 25, 'p_adx': 14, 'rsi_period': 64, 'ema1': 21, 'ema2': 17, 'slip_atr_k': 0.027947857434730584, 'slip_spread_k': 0.3606895374502641, 'spread_hl_frac': 0.01246176434063564, 'bb_std_mult': 2.8257297662560106, 'rsi_os': 37, 'rsi_ob': 83, 'vol_spike': 0.07894507791903177, 'adx_thresh': 24.590357643172077, 'atr_min_pct': 0.027178614650473595, 'atr_max_pct': 0.12824063683619663, 'tp_mult': 1.083048386843908, 'tsl_mult': 0.698073274647272, 'strategy': 'mean_reversion', 'time_stop': 27, 'use_sma': True, 'use_atr': False, 'use_adx': False, 'use_ema': False, 'use_spike': True, 'rsi_required': False, 'edge_k': 1.2892857289156483, 'edge_cap': 0.2717348389654806, 'bull_strategy': 'breakout', 'bull_bb_std_mult': 2.2587208109047134, 'bull_rsi_os': 37, 'bull_rsi_ob': 56, 'bull_adx_thresh': 28.402361182914895, 'bull_atr_min_pct': 9.097267541393304e-05, 'bull_atr_max_pct': 0.0777521517529021, 'bull_tp_mult': 2.8900533134699087, 'bull_tsl_mult': 0.4690411037842498, 'bull_time_stop': 86, 'bull_use_sma': True, 'bull_use_ema': True, 'bull_use_atr': True, 'bull_use_adx': True, 'bull_use_spike': False, 'bull_rsi_required': True, 'bear_strategy': 'breakout', 'bear_bb_std_mult': 3.473349025986147, 'bear_rsi_os': 31, 'bear_rsi_ob': 94, 'bear_adx_thresh': 9.8320651167903, 'bear_atr_min_pct': 0.009976785859529855, 'bear_atr_max_pct': 0.046304484135210336, 'bear_tp_mult': 2.8680527408979657, 'bear_tsl_mult': 0.5274303107578064, 'bear_time_stop': 216, 'bear_use_sma': True, 'bear_use_ema': True, 'bear_use_atr': False, 'bear_use_adx': True, 'bear_use_spike': False, 'bear_rsi_required': True, 'sideways_strategy': 'breakout', 'sideways_bb_std_mult': 2.574567786634672, 'sideways_rsi_os': 52, 'sideways_rsi_ob': 78, 'sideways_adx_thresh': 26.25393392830191, 'sideways_atr_min_pct': 0.011574072190378438, 'sideways_atr_max_pct': 0.07813790897142013, 'sideways_tp_mult': 2.6619702825024767, 'sideways_tsl_mult': 0.35516284678200805, 'sideways_time_stop': 188, 'sideways_use_sma': True, 'sideways_use_ema': False, 'sideways_use_atr': True, 'sideways_use_adx': True, 'sideways_use_spike': False, 'sideways_rsi_required': True}.
[I 2025-09-01 14:58:55,768] Trial 780 finished with values: [-0.0730732459432053, 0.07240618237567335] and parameters: {'p_sma': 55, 'p_std': 50, 'p_atr': 20, 'p_adx': 11, 'rsi_period': 69, 'ema1': 24, 'ema2': 14, 'slip_atr_k': 0.15790835278403087, 'slip_spread_k': 0.8310581524263574, 'spread_hl_frac': 0.03354901487091427, 'bb_std_mult': 1.8636149172248186, 'rsi_os': 39, 'rsi_ob': 83, 'vol_spike': 0.18584248527158198, 'adx_thresh': 12.016527284155988, 'atr_min_pct': 0.011880340064235375, 'atr_max_pct': 0.1374705793010297, 'tp_mult': 2.1552445405697016, 'tsl_mult': 0.6858107712662028, 'strategy': 'mean_reversion', 'time_stop': 238, 'use_sma': True, 'use_atr': False, 'use_adx': False, 'use_ema': False, 'use_spike': True, 'rsi_required': False, 'edge_k': 1.3007826491153298, 'edge_cap': 0.2232662307126695, 'bull_strategy': 'breakout', 'bull_bb_std_mult': 0.9707456235232377, 'bull_rsi_os': 37, 'bull_rsi_ob': 56, 'bull_adx_thresh': 32.06201593524752, 'bull_atr_min_pct': 0.002818795007858267, 'bull_atr_max_pct': 0.11470995050870803, 'bull_tp_mult': 2.8908000464038075, 'bull_tsl_mult': 0.47466913728696136, 'bull_time_stop': 243, 'bull_use_sma': True, 'bull_use_ema': True, 'bull_use_atr': True, 'bull_use_adx': False, 'bull_use_spike': True, 'bull_rsi_required': True, 'bear_strategy': 'breakout', 'bear_bb_std_mult': 0.8155162906066362, 'bear_rsi_os': 37, 'bear_rsi_ob': 57, 'bear_adx_thresh': 5.061488096520364, 'bear_atr_min_pct': 0.002538339942620845, 'bear_atr_max_pct': 0.04568887646499683, 'bear_tp_mult': 2.8142619226539662, 'bear_tsl_mult': 0.1970401534505288, 'bear_time_stop': 217, 'bear_use_sma': True, 'bear_use_ema': True, 'bear_use_atr': False, 'bear_use_adx': True, 'bear_use_spike': False, 'bear_rsi_required': True, 'sideways_strategy': 'breakout', 'sideways_bb_std_mult': 1.6130095058318816, 'sideways_rsi_os': 52, 'sideways_rsi_ob': 67, 'sideways_adx_thresh': 6.700429318039224, 'sideways_atr_min_pct': 0.01776084501523151, 'sideways_atr_max_pct': 0.0581213318959129, 'sideways_tp_mult': 2.737084497568351, 'sideways_tsl_mult': 0.24927013138207824, 'sideways_time_stop': 187, 'sideways_use_sma': True, 'sideways_use_ema': False, 'sideways_use_atr': True, 'sideways_use_adx': False, 'sideways_use_spike': False, 'sideways_rsi_required': True}.
[I 2025-09-01 14:59:36,270] Trial 783 finished with values: [-1000000000.0, 1000000000.0] and parameters: {'p_sma': 55, 'p_std': 48, 'p_atr': 24, 'p_adx': 12, 'rsi_period': 68, 'ema1': 23, 'ema2': 31, 'slip_atr_k': 0.17510821150695763, 'slip_spread_k': 0.08990590524796549, 'spread_hl_frac': 0.004648243465194061, 'bb_std_mult': 2.6571677506438878, 'rsi_os': 39, 'rsi_ob': 85, 'vol_spike': 0.2285488577067145, 'adx_thresh': 26.608941582785615, 'atr_min_pct': 0.028047055749539192, 'atr_max_pct': 0.06845734503561018, 'tp_mult': 1.1315253507505425, 'tsl_mult': 0.7752577122805828, 'strategy': 'breakout', 'time_stop': 209, 'use_sma': False, 'use_atr': True, 'use_adx': False, 'use_ema': True, 'use_spike': False, 'rsi_required': True, 'edge_k': 0.9752118949162509, 'edge_cap': 0.2303350999749455, 'bull_strategy': 'mean_reversion', 'bull_bb_std_mult': 3.0886517946755996, 'bull_rsi_os': 24, 'bull_rsi_ob': 53, 'bull_adx_thresh': 31.053616316921868, 'bull_atr_min_pct': 0.0047574356242300955, 'bull_atr_max_pct': 0.1182826935579698, 'bull_tp_mult': 1.3786083363332249, 'bull_tsl_mult': 0.48751796713970114, 'bull_time_stop': 105, 'bull_use_sma': False, 'bull_use_ema': False, 'bull_use_atr': True, 'bull_use_adx': False, 'bull_use_spike': True, 'bull_rsi_required': False, 'bear_strategy': 'breakout', 'bear_bb_std_mult': 3.2016319610182915, 'bear_rsi_os': 34, 'bear_rsi_ob': 57, 'bear_adx_thresh': 12.305278411917921, 'bear_atr_min_pct': 0.017206224548160735, 'bear_atr_max_pct': 0.10160978886055479, 'bear_tp_mult': 1.5826505115039575, 'bear_tsl_mult': 0.08375326011319639, 'bear_time_stop': 258, 'bear_use_sma': False, 'bear_use_ema': False, 'bear_use_atr': True, 'bear_use_adx': False, 'bear_use_spike': False, 'bear_rsi_required': False, 'sideways_strategy': 'mean_reversion', 'sideways_bb_std_mult': 1.6732621265480114, 'sideways_rsi_os': 51, 'sideways_rsi_ob': 65, 'sideways_adx_thresh': 15.377812909616754, 'sideways_atr_min_pct': 0.005935819936949662, 'sideways_atr_max_pct': 0.13398243697703155, 'sideways_tp_mult': 2.738848143953362, 'sideways_tsl_mult': 0.7611337187978856, 'sideways_time_stop': 153, 'sideways_use_sma': False, 'sideways_use_ema': False, 'sideways_use_atr': True, 'sideways_use_adx': False, 'sideways_use_spike': False, 'sideways_rsi_required': False}.
[I 2025-09-01 14:59:37,082] Trial 782 finished with values: [-1000000000.0, 1000000000.0] and parameters: {'p_sma': 34, 'p_std': 48, 'p_atr': 20, 'p_adx': 12, 'rsi_period': 68, 'ema1': 23, 'ema2': 56, 'slip_atr_k': 0.004138467072740818, 'slip_spread_k': 0.08526865169701808, 'spread_hl_frac': 0.0052031016816782615, 'bb_std_mult': 1.3960036055064016, 'rsi_os': 52, 'rsi_ob': 85, 'vol_spike': 0.2294897981188187, 'adx_thresh': 12.051401901282967, 'atr_min_pct': 0.02814366078319829, 'atr_max_pct': 0.06828931310108449, 'tp_mult': 2.1584838603010663, 'tsl_mult': 0.77040231593966, 'strategy': 'breakout', 'time_stop': 235, 'use_sma': False, 'use_atr': True, 'use_adx': False, 'use_ema': True, 'use_spike': False, 'rsi_required': True, 'edge_k': 0.9002065087825305, 'edge_cap': 0.22881480534026222, 'bull_strategy': 'mean_reversion', 'bull_bb_std_mult': 3.0958247217334103, 'bull_rsi_os': 36, 'bull_rsi_ob': 58, 'bull_adx_thresh': 30.935359127306402, 'bull_atr_min_pct': 0.004838476939174089, 'bull_atr_max_pct': 0.021706252970173905, 'bull_tp_mult': 2.2372836899995447, 'bull_tsl_mult': 0.5903126561041916, 'bull_time_stop': 119, 'bull_use_sma': False, 'bull_use_ema': False, 'bull_use_atr': True, 'bull_use_adx': False, 'bull_use_spike': True, 'bull_rsi_required': False, 'bear_strategy': 'breakout', 'bear_bb_std_mult': 2.7162888542980053, 'bear_rsi_os': 11, 'bear_rsi_ob': 90, 'bear_adx_thresh': 8.882120806447315, 'bear_atr_min_pct': 0.0021443272070773072, 'bear_atr_max_pct': 0.03755334278699425, 'bear_tp_mult': 2.290371887980603, 'bear_tsl_mult': 0.1939199669362957, 'bear_time_stop': 244, 'bear_use_sma': False, 'bear_use_ema': False, 'bear_use_atr': True, 'bear_use_adx': False, 'bear_use_spike': False, 'bear_rsi_required': False, 'sideways_strategy': 'mean_reversion', 'sideways_bb_std_mult': 1.6789238812117282, 'sideways_rsi_os': 55, 'sideways_rsi_ob': 61, 'sideways_adx_thresh': 6.710158853109865, 'sideways_atr_min_pct': 0.012930856819258936, 'sideways_atr_max_pct': 0.057811446324819216, 'sideways_tp_mult': 2.75282767925793, 'sideways_tsl_mult': 0.7717114442325677, 'sideways_time_stop': 173, 'sideways_use_sma': False, 'sideways_use_ema': False, 'sideways_use_atr': True, 'sideways_use_adx': False, 'sideways_use_spike': False, 'sideways_rsi_required': False}.
