[I 2025-09-01 13:16:27,741] Trial 99 finished with values: [-1000000000.0, 1000000000.0] and parameters: {'p_sma': 26, 'p_std': 49, 'p_atr': 17, 'p_adx': 25, 'rsi_period': 26, 'ema1': 29, 'ema2': 42, 'slip_atr_k': 0.11987643790669511, 'slip_spread_k': 0.30164046601684913, 'spread_hl_frac': 0.01576592835287171, 'bb_std_mult': 3.219902343445881, 'rsi_os': 52, 'rsi_ob': 46, 'vol_spike': 0.2232055201530146, 'adx_thresh': 26.856394422641266, 'atr_min_pct': 0.021893109007602357, 'atr_max_pct': 0.08354897702351193, 'tp_mult': 1.889339167009875, 'tsl_mult': 0.1634749524540811, 'strategy': 'breakout', 'time_stop': 76, 'use_sma': True, 'use_atr': True, 'use_adx': True, 'use_ema': True, 'use_spike': True, 'rsi_required': False, 'edge_k': 0.48449045431047344, 'edge_cap': 0.2073598352477006, 'bull_strategy': 'breakout', 'bull_bb_std_mult': 2.045384689544053, 'bull_rsi_os': 31, 'bull_rsi_ob': 61, 'bull_adx_thresh': 5.065261777057732, 'bull_atr_min_pct': 0.003356117748478227, 'bull_atr_max_pct': 0.0836526756687514, 'bull_tp_mult': 2.5001886609230666, 'bull_tsl_mult': 0.8215392280579202, 'bull_time_stop': 153, 'bull_use_sma': True, 'bull_use_ema': True, 'bull_use_atr': False, 'bull_use_adx': False, 'bull_use_spike': False, 'bull_rsi_required': True, 'bear_strategy': 'mean_reversion', 'bear_bb_std_mult': 1.1316414693082701, 'bear_rsi_os': 49, 'bear_rsi_ob': 77, 'bear_adx_thresh': 10.3096991396247, 'bear_atr_min_pct': 0.008774924239557313, 'bear_atr_max_pct': 0.12114426636371378, 'bear_tp_mult': 1.411806758421025, 'bear_tsl_mult': 0.18597806332970473, 'bear_time_stop': 31, 'bear_use_sma': True, 'bear_use_ema': False, 'bear_use_atr': True, 'bear_use_adx': False, 'bear_use_spike': False, 'bear_rsi_required': True, 'sideways_strategy': 'breakout', 'sideways_bb_std_mult': 0.8440498879502839, 'sideways_rsi_os': 17, 'sideways_rsi_ob': 79, 'sideways_adx_thresh': 14.74281849771421, 'sideways_atr_min_pct': 0.0201658593591513, 'sideways_atr_max_pct': 0.10864624577715762, 'sideways_tp_mult': 2.889157511838957, 'sideways_tsl_mult': 0.1435071192306906, 'sideways_time_stop': 144, 'sideways_use_sma': True, 'sideways_use_ema': False, 'sideways_use_atr': True, 'sideways_use_adx': False, 'sideways_use_spike': False, 'sideways_rsi_required': True}.
[I 2025-09-01 13:16:28,138] Trial 101 finished with values: [-0.024114814302963583, 0.02384535758524502] and parameters: {'p_sma': 52, 'p_std': 38, 'p_atr': 30, 'p_adx': 25, 'rsi_period': 72, 'ema1': 20, 'ema2': 46, 'slip_atr_k': 0.16677934915256518, 'slip_spread_k': 0.38206426576037494, 'spread_hl_frac': 0.014538318497786765, 'bb_std_mult': 2.8678295197805443, 'rsi_os': 49, 'rsi_ob': 91, 'vol_spike': 0.2112067911231134, 'adx_thresh': 20.507961046530866, 'atr_min_pct': 0.001794840769011027, 'atr_max_pct': 0.12243443641070256, 'tp_mult': 1.737872943496275, 'tsl_mult': 0.5292698981079813, 'strategy': 'breakout', 'time_stop': 30, 'use_sma': True, 'use_atr': True, 'use_adx': True, 'use_ema': True, 'use_spike': True, 'rsi_required': False, 'edge_k': 0.3909631850628899, 'edge_cap': 0.4059732356981237, 'bull_strategy': 'breakout', 'bull_bb_std_mult': 3.142321067071963, 'bull_rsi_os': 32, 'bull_rsi_ob': 57, 'bull_adx_thresh': 7.0160086541439615, 'bull_atr_min_pct': 0.0017950141938710474, 'bull_atr_max_pct': 0.08438259657670649, 'bull_tp_mult': 2.3450181228316134, 'bull_tsl_mult': 0.5084326832048255, 'bull_time_stop': 216, 'bull_use_sma': True, 'bull_use_ema': True, 'bull_use_atr': True, 'bull_use_adx': False, 'bull_use_spike': False, 'bull_rsi_required': True, 'bear_strategy': 'mean_reversion', 'bear_bb_std_mult': 2.572472520055726, 'bear_rsi_os': 21, 'bear_rsi_ob': 55, 'bear_adx_thresh': 11.621553147467974, 'bear_atr_min_pct': 0.014750724505014908, 'bear_atr_max_pct': 0.08881637517200254, 'bear_tp_mult': 2.2341861878351414, 'bear_tsl_mult': 0.24521471689300778, 'bear_time_stop': 147, 'bear_use_sma': True, 'bear_use_ema': False, 'bear_use_atr': True, 'bear_use_adx': False, 'bear_use_spike': False, 'bear_rsi_required': True, 'sideways_strategy': 'mean_reversion', 'sideways_bb_std_mult': 1.14903024170143, 'sideways_rsi_os': 17, 'sideways_rsi_ob': 62, 'sideways_adx_thresh': 13.87690958020794, 'sideways_atr_min_pct': 0.019863703466676742, 'sideways_atr_max_pct': 0.09399939959295595, 'sideways_tp_mult': 2.688999052867515, 'sideways_tsl_mult': 0.7601249946190503, 'sideways_time_stop': 5, 'sideways_use_sma': True, 'sideways_use_ema': False, 'sideways_use_atr': True, 'sideways_use_adx': False, 'sideways_use_spike': False, 'sideways_rsi_required': True}.
[I 2025-09-01 13:16:28,487] Trial 100 finished with values: [-0.023894219122039484, 0.023964594227815154] and parameters: {'p_sma': 26, 'p_std': 49, 'p_atr': 30, 'p_adx': 25, 'rsi_period': 18, 'ema1': 20, 'ema2': 50, 'slip_atr_k': 0.12087900890697416, 'slip_spread_k': 0.10767020603580302, 'spread_hl_frac': 0.015069388361626891, 'bb_std_mult': 3.1203208318344817, 'rsi_os': 49, 'rsi_ob': 91, 'vol_spike': 0.2247272590348547, 'adx_thresh': 26.89945720207302, 'atr_min_pct': 0.020202439249309593, 'atr_max_pct': 0.08378287755857045, 'tp_mult': 1.900916586841001, 'tsl_mult': 0.5270641039040611, 'strategy': 'breakout', 'time_stop': 75, 'use_sma': True, 'use_atr': True, 'use_adx': True, 'use_ema': True, 'use_spike': True, 'rsi_required': False, 'edge_k': 0.4225543681429943, 'edge_cap': 0.29030842210633445, 'bull_strategy': 'breakout', 'bull_bb_std_mult': 1.9657255008293988, 'bull_rsi_os': 42, 'bull_rsi_ob': 58, 'bull_adx_thresh': 6.0035542395703665, 'bull_atr_min_pct': 0.001854726897757689, 'bull_atr_max_pct': 0.06793430905036968, 'bull_tp_mult': 1.708370685316079, 'bull_tsl_mult': 0.39883130920850446, 'bull_time_stop': 116, 'bull_use_sma': True, 'bull_use_ema': True, 'bull_use_atr': True, 'bull_use_adx': False, 'bull_use_spike': False, 'bull_rsi_required': True, 'bear_strategy': 'mean_reversion', 'bear_bb_std_mult': 1.137754261006302, 'bear_rsi_os': 11, 'bear_rsi_ob': 72, 'bear_adx_thresh': 28.743748404892393, 'bear_atr_min_pct': 0.0048042605049757325, 'bear_atr_max_pct': 0.1219289733483875, 'bear_tp_mult': 2.772667669849402, 'bear_tsl_mult': 0.5294179123712824, 'bear_time_stop': 175, 'bear_use_sma': True, 'bear_use_ema': False, 'bear_use_atr': True, 'bear_use_adx': False, 'bear_use_spike': False, 'bear_rsi_required': True, 'sideways_strategy': 'breakout', 'sideways_bb_std_mult': 0.7838200967086888, 'sideways_rsi_os': 28, 'sideways_rsi_ob': 46, 'sideways_adx_thresh': 15.069914790748777, 'sideways_atr_min_pct': 0.019737880512566888, 'sideways_atr_max_pct': 0.11665713786186625, 'sideways_tp_mult': 2.6925293583958267, 'sideways_tsl_mult': 0.03860220995588193, 'sideways_time_stop': 43, 'sideways_use_sma': True, 'sideways_use_ema': False, 'sideways_use_atr': True, 'sideways_use_adx': False, 'sideways_use_spike': False, 'sideways_rsi_required': True}.
[I 2025-09-01 13:17:08,667] Trial 102 finished with values: [-1000000000.0, 1000000000.0] and parameters: {'p_sma': 29, 'p_std': 49, 'p_atr': 30, 'p_adx': 19, 'rsi_period': 43, 'ema1': 20, 'ema2': 46, 'slip_atr_k': 0.218378486513185, 'slip_spread_k': 0.36786596532445515, 'spread_hl_frac': 0.012375130991438776, 'bb_std_mult': 0.8895618262509859, 'rsi_os': 39, 'rsi_ob': 91, 'vol_spike': 0.18313408260230923, 'adx_thresh': 26.240904052555695, 'atr_min_pct': 0.0019850787639746543, 'atr_max_pct': 0.08367583178090165, 'tp_mult': 1.7138586053645941, 'tsl_mult': 0.08117045672954522, 'strategy': 'breakout', 'time_stop': 31, 'use_sma': True, 'use_atr': True, 'use_adx': True, 'use_ema': True, 'use_spike': True, 'rsi_required': False, 'edge_k': 0.39710451725116125, 'edge_cap': 0.8064588688376997, 'bull_strategy': 'breakout', 'bull_bb_std_mult': 3.4176048586211967, 'bull_rsi_os': 32, 'bull_rsi_ob': 57, 'bull_adx_thresh': 5.857972749339867, 'bull_atr_min_pct': 0.004223831488094748, 'bull_atr_max_pct': 0.01939826167909992, 'bull_tp_mult': 1.2315859984703794, 'bull_tsl_mult': 0.4017295778363432, 'bull_time_stop': 92, 'bull_use_sma': True, 'bull_use_ema': True, 'bull_use_atr': True, 'bull_use_adx': False, 'bull_use_spike': False, 'bull_rsi_required': True, 'bear_strategy': 'mean_reversion', 'bear_bb_std_mult': 2.5351398815237296, 'bear_rsi_os': 50, 'bear_rsi_ob': 55, 'bear_adx_thresh': 11.444554882106086, 'bear_atr_min_pct': 0.008777417719689247, 'bear_atr_max_pct': 0.12228315567650767, 'bear_tp_mult': 2.5716129539937933, 'bear_tsl_mult': 0.5262902173829442, 'bear_time_stop': 173, 'bear_use_sma': True, 'bear_use_ema': False, 'bear_use_atr': True, 'bear_use_adx': False, 'bear_use_spike': False, 'bear_rsi_required': True, 'sideways_strategy': 'mean_reversion', 'sideways_bb_std_mult': 0.8249331437167062, 'sideways_rsi_os': 28, 'sideways_rsi_ob': 62, 'sideways_adx_thresh': 12.903595322606678, 'sideways_atr_min_pct': 0.012086155138777973, 'sideways_atr_max_pct': 0.09393271703177843, 'sideways_tp_mult': 2.685989192066759, 'sideways_tsl_mult': 0.1658881723570526, 'sideways_time_stop': 139, 'sideways_use_sma': True, 'sideways_use_ema': False, 'sideways_use_atr': True, 'sideways_use_adx': False, 'sideways_use_spike': False, 'sideways_rsi_required': True}.
[I 2025-09-01 13:17:09,621] Trial 105 finished with values: [-1000000000.0, 1000000000.0] and parameters: {'p_sma': 22, 'p_std': 47, 'p_atr': 30, 'p_adx': 19, 'rsi_period': 43, 'ema1': 20, 'ema2': 47, 'slip_atr_k': 0.01803830123212985, 'slip_spread_k': 0.6332143633449617, 'spread_hl_frac': 0.011578805620389652, 'bb_std_mult': 1.7450755796596005, 'rsi_os': 49, 'rsi_ob': 91, 'vol_spike': 0.23441221952992422, 'adx_thresh': 11.502521124223431, 'atr_min_pct': 0.002029426847035093, 'atr_max_pct': 0.08862002155824149, 'tp_mult': 1.7118380086383609, 'tsl_mult': 0.08400588220522086, 'strategy': 'breakout', 'time_stop': 25, 'use_sma': True, 'use_atr': True, 'use_adx': False, 'use_ema': True, 'use_spike': False, 'rsi_required': True, 'edge_k': 0.35231970648231953, 'edge_cap': 0.3937705259653166, 'bull_strategy': 'breakout', 'bull_bb_std_mult': 3.398159507167304, 'bull_rsi_os': 50, 'bull_rsi_ob': 56, 'bull_adx_thresh': 6.06304361093841, 'bull_atr_min_pct': 0.00889865527053272, 'bull_atr_max_pct': 0.0555964619621804, 'bull_tp_mult': 2.3338579023312316, 'bull_tsl_mult': 0.39562231321822794, 'bull_time_stop': 27, 'bull_use_sma': True, 'bull_use_ema': True, 'bull_use_atr': True, 'bull_use_adx': False, 'bull_use_spike': False, 'bull_rsi_required': True, 'bear_strategy': 'mean_reversion', 'bear_bb_std_mult': 1.8957379954690434, 'bear_rsi_os': 21, 'bear_rsi_ob': 55, 'bear_adx_thresh': 28.927167005867602, 'bear_atr_min_pct': 0.014240607526530596, 'bear_atr_max_pct': 0.10794489073794511, 'bear_tp_mult': 2.762333734539667, 'bear_tsl_mult': 0.5365736724259363, 'bear_time_stop': 173, 'bear_use_sma': True, 'bear_use_ema': False, 'bear_use_atr': True, 'bear_use_adx': False, 'bear_use_spike': False, 'bear_rsi_required': False, 'sideways_strategy': 'mean_reversion', 'sideways_bb_std_mult': 0.774120196381232, 'sideways_rsi_os': 28, 'sideways_rsi_ob': 49, 'sideways_adx_thresh': 13.713253093371458, 'sideways_atr_min_pct': 0.012239005369539155, 'sideways_atr_max_pct': 0.08920402697440366, 'sideways_tp_mult': 2.8054448251167914, 'sideways_tsl_mult': 0.712104847734697, 'sideways_time_stop': 75, 'sideways_use_sma': False, 'sideways_use_ema': False, 'sideways_use_atr': True, 'sideways_use_adx': False, 'sideways_use_spike': False, 'sideways_rsi_required': True}.
[I 2025-09-01 13:17:10,585] Trial 104 finished with values: [-0.019107616755401957, 0.018953539396296258] and parameters: {'p_sma': 53, 'p_std': 47, 'p_atr': 30, 'p_adx': 19, 'rsi_period': 44, 'ema1': 20, 'ema2': 50, 'slip_atr_k': 0.03466897338456672, 'slip_spread_k': 0.5679804427619067, 'spread_hl_frac': 0.022059925036399936, 'bb_std_mult': 0.9158367204261402, 'rsi_os': 49, 'rsi_ob': 91, 'vol_spike': 0.18167877915969372, 'adx_thresh': 16.6379970056828, 'atr_min_pct': 0.001833954709964543, 'atr_max_pct': 0.04046757780525028, 'tp_mult': 1.717439996698551, 'tsl_mult': 0.23522973062974217, 'strategy': 'breakout', 'time_stop': 28, 'use_sma': True, 'use_atr': True, 'use_adx': False, 'use_ema': True, 'use_spike': False, 'rsi_required': True, 'edge_k': 0.3728992511026998, 'edge_cap': 0.3972200852170097, 'bull_strategy': 'breakout', 'bull_bb_std_mult': 1.7447472115348357, 'bull_rsi_os': 42, 'bull_rsi_ob': 56, 'bull_adx_thresh': 6.004515844748032, 'bull_atr_min_pct': 0.001903954953450111, 'bull_atr_max_pct': 0.0782734860344115, 'bull_tp_mult': 2.3421739885137254, 'bull_tsl_mult': 0.39089452464225305, 'bull_time_stop': 25, 'bull_use_sma': True, 'bull_use_ema': True, 'bull_use_atr': True, 'bull_use_adx': False, 'bull_use_spike': False, 'bull_rsi_required': True, 'bear_strategy': 'mean_reversion', 'bear_bb_std_mult': 2.5471268947785832, 'bear_rsi_os': 21, 'bear_rsi_ob': 56, 'bear_adx_thresh': 11.838158895480449, 'bear_atr_min_pct': 0.017907875743249257, 'bear_atr_max_pct': 0.08707939981120019, 'bear_tp_mult': 2.2607312451238313, 'bear_tsl_mult': 0.538434990147637, 'bear_time_stop': 158, 'bear_use_sma': True, 'bear_use_ema': False, 'bear_use_atr': True, 'bear_use_adx': True, 'bear_use_spike': False, 'bear_rsi_required': False, 'sideways_strategy': 'mean_reversion', 'sideways_bb_std_mult': 0.7494166326254399, 'sideways_rsi_os': 28, 'sideways_rsi_ob': 62, 'sideways_adx_thresh': 14.040590631170165, 'sideways_atr_min_pct': 0.012251492741997145, 'sideways_atr_max_pct': 0.09374587234895627, 'sideways_tp_mult': 2.694208103152438, 'sideways_tsl_mult': 0.7073690791470036, 'sideways_time_stop': 5, 'sideways_use_sma': False, 'sideways_use_ema': False, 'sideways_use_atr': True, 'sideways_use_adx': False, 'sideways_use_spike': False, 'sideways_rsi_required': True}.
[I 2025-09-01 13:17:10,596] Trial 103 finished with values: [-0.018337636075516417, 0.018168914992602748] and parameters: {'p_sma': 53, 'p_std': 45, 'p_atr': 30, 'p_adx': 19, 'rsi_period': 72, 'ema1': 20, 'ema2': 59, 'slip_atr_k': 0.10521244491729886, 'slip_spread_k': 0.38730764446060056, 'spread_hl_frac': 0.011655454060032567, 'bb_std_mult': 1.8085073117040587, 'rsi_os': 39, 'rsi_ob': 91, 'vol_spike': 0.23054157548004922, 'adx_thresh': 11.246549069704114, 'atr_min_pct': 0.0027124022392740936, 'atr_max_pct': 0.040705069713536685, 'tp_mult': 1.527813290047548, 'tsl_mult': 0.12195879984897105, 'strategy': 'breakout', 'time_stop': 97, 'use_sma': True, 'use_atr': True, 'use_adx': False, 'use_ema': True, 'use_spike': False, 'rsi_required': True, 'edge_k': 0.39818250269629774, 'edge_cap': 0.8038670469305274, 'bull_strategy': 'breakout', 'bull_bb_std_mult': 3.1680648991439075, 'bull_rsi_os': 49, 'bull_rsi_ob': 56, 'bull_adx_thresh': 5.952055725122183, 'bull_atr_min_pct': 0.0019165808807683814, 'bull_atr_max_pct': 0.018270785049073743, 'bull_tp_mult': 1.9177084402969355, 'bull_tsl_mult': 0.39324213245801076, 'bull_time_stop': 17, 'bull_use_sma': True, 'bull_use_ema': True, 'bull_use_atr': True, 'bull_use_adx': True, 'bull_use_spike': False, 'bull_rsi_required': True, 'bear_strategy': 'mean_reversion', 'bear_bb_std_mult': 0.9077394632648534, 'bear_rsi_os': 11, 'bear_rsi_ob': 70, 'bear_adx_thresh': 11.449709635842293, 'bear_atr_min_pct': 0.022035329655997075, 'bear_atr_max_pct': 0.08186305547226441, 'bear_tp_mult': 2.5629221912921585, 'bear_tsl_mult': 0.5299112770621548, 'bear_time_stop': 265, 'bear_use_sma': True, 'bear_use_ema': False, 'bear_use_atr': True, 'bear_use_adx': True, 'bear_use_spike': False, 'bear_rsi_required': False, 'sideways_strategy': 'mean_reversion', 'sideways_bb_std_mult': 0.7768206360407202, 'sideways_rsi_os': 28, 'sideways_rsi_ob': 93, 'sideways_adx_thresh': 13.835559786475413, 'sideways_atr_min_pct': 0.00996839883718223, 'sideways_atr_max_pct': 0.11718995595408335, 'sideways_tp_mult': 2.801859716668972, 'sideways_tsl_mult': 0.5067207259115692, 'sideways_time_stop': 6, 'sideways_use_sma': False, 'sideways_use_ema': False, 'sideways_use_atr': True, 'sideways_use_adx': False, 'sideways_use_spike': False, 'sideways_rsi_required': True}.
[I 2025-09-01 13:17:51,945] Trial 108 finished with values: [-1000000000.0, 1000000000.0] and parameters: {'p_sma': 53, 'p_std': 38, 'p_atr': 30, 'p_adx': 19, 'rsi_period': 75, 'ema1': 19, 'ema2': 59, 'slip_atr_k': 0.036355728991582084, 'slip_spread_k': 0.24131174390657972, 'spread_hl_frac': 0.007643933052060448, 'bb_std_mult': 1.612147736709881, 'rsi_os': 38, 'rsi_ob': 89, 'vol_spike': 0.2092382551518303, 'adx_thresh': 10.980043104063075, 'atr_min_pct': 0.020122908522434417, 'atr_max_pct': 0.04128728792958552, 'tp_mult': 1.4581870085319875, 'tsl_mult': 0.2375035815963828, 'strategy': 'breakout', 'time_stop': 116, 'use_sma': True, 'use_atr': True, 'use_adx': False, 'use_ema': True, 'use_spike': False, 'rsi_required': True, 'edge_k': 0.6047318849036738, 'edge_cap': 0.7453439972186972, 'bull_strategy': 'mean_reversion', 'bull_bb_std_mult': 2.845480626600687, 'bull_rsi_os': 45, 'bull_rsi_ob': 52, 'bull_adx_thresh': 6.788305319552528, 'bull_atr_min_pct': 0.02483915259125092, 'bull_atr_max_pct': 0.09558461519642811, 'bull_tp_mult': 1.9239546993445484, 'bull_tsl_mult': 0.3619680954711663, 'bull_time_stop': 15, 'bull_use_sma': True, 'bull_use_ema': True, 'bull_use_atr': True, 'bull_use_adx': True, 'bull_use_spike': False, 'bull_rsi_required': False, 'bear_strategy': 'mean_reversion', 'bear_bb_std_mult': 0.8931747413521305, 'bear_rsi_os': 11, 'bear_rsi_ob': 82, 'bear_adx_thresh': 12.13205323176749, 'bear_atr_min_pct': 0.02227383460851649, 'bear_atr_max_pct': 0.08104045918596564, 'bear_tp_mult': 2.273698956339068, 'bear_tsl_mult': 0.5771385380785969, 'bear_time_stop': 260, 'bear_use_sma': True, 'bear_use_ema': False, 'bear_use_atr': True, 'bear_use_adx': True, 'bear_use_spike': False, 'bear_rsi_required': False, 'sideways_strategy': 'breakout', 'sideways_bb_std_mult': 0.7452465049346203, 'sideways_rsi_os': 26, 'sideways_rsi_ob': 93, 'sideways_adx_thresh': 10.718547054077167, 'sideways_atr_min_pct': 0.009869992920706158, 'sideways_atr_max_pct': 0.1490538016255601, 'sideways_tp_mult': 2.5177599984797165, 'sideways_tsl_mult': 0.5121787444873103, 'sideways_time_stop': 8, 'sideways_use_sma': False, 'sideways_use_ema': False, 'sideways_use_atr': True, 'sideways_use_adx': True, 'sideways_use_spike': False, 'sideways_rsi_required': True}.
[I 2025-09-01 13:17:51,959] Trial 107 finished with values: [-1000000000.0, 1000000000.0] and parameters: {'p_sma': 23, 'p_std': 45, 'p_atr': 27, 'p_adx': 20, 'rsi_period': 79, 'ema1': 17, 'ema2': 50, 'slip_atr_k': 0.14232305564189726, 'slip_spread_k': 0.06692741426578341, 'spread_hl_frac': 0.028931538825391588, 'bb_std_mult': 2.158661865320193, 'rsi_os': 47, 'rsi_ob': 80, 'vol_spike': 0.2625844303065404, 'adx_thresh': 15.6066206880585, 'atr_min_pct': 0.000760583890285023, 'atr_max_pct': 0.04122554353279854, 'tp_mult': 1.810717072283829, 'tsl_mult': 0.23332533510264844, 'strategy': 'mean_reversion', 'time_stop': 14, 'use_sma': True, 'use_atr': True, 'use_adx': False, 'use_ema': True, 'use_spike': False, 'rsi_required': True, 'edge_k': 1.4480120154412084, 'edge_cap': 0.2940554813791002, 'bull_strategy': 'mean_reversion', 'bull_bb_std_mult': 1.7062014537813124, 'bull_rsi_os': 42, 'bull_rsi_ob': 72, 'bull_adx_thresh': 7.054849130097221, 'bull_atr_min_pct': 0.013674794957448512, 'bull_atr_max_pct': 0.06823805388215876, 'bull_tp_mult': 1.9284094495395445, 'bull_tsl_mult': 0.4968618496247782, 'bull_time_stop': 112, 'bull_use_sma': True, 'bull_use_ema': False, 'bull_use_atr': False, 'bull_use_adx': True, 'bull_use_spike': False, 'bull_rsi_required': False, 'bear_strategy': 'mean_reversion', 'bear_bb_std_mult': 0.8744476986628058, 'bear_rsi_os': 12, 'bear_rsi_ob': 70, 'bear_adx_thresh': 30.236528166924543, 'bear_atr_min_pct': 0.015155202665310313, 'bear_atr_max_pct': 0.10234321580040398, 'bear_tp_mult': 2.8010834207340656, 'bear_tsl_mult': 0.07979575734016048, 'bear_time_stop': 149, 'bear_use_sma': True, 'bear_use_ema': True, 'bear_use_atr': True, 'bear_use_adx': True, 'bear_use_spike': False, 'bear_rsi_required': False, 'sideways_strategy': 'mean_reversion', 'sideways_bb_std_mult': 0.7365029431915167, 'sideways_rsi_os': 45, 'sideways_rsi_ob': 53, 'sideways_adx_thresh': 18.30365301789835, 'sideways_atr_min_pct': 0.027477282019334526, 'sideways_atr_max_pct': 0.09415603497831362, 'sideways_tp_mult': 2.832055032166609, 'sideways_tsl_mult': 0.03724440502829468, 'sideways_time_stop': 98, 'sideways_use_sma': False, 'sideways_use_ema': False, 'sideways_use_atr': True, 'sideways_use_adx': False, 'sideways_use_spike': False, 'sideways_rsi_required': True}.
