[I 2025-09-01 13:57:08,344] Trial 360 finished with values: [-1000000000.0, 1000000000.0] and parameters: {'p_sma': 39, 'p_std': 45, 'p_atr': 26, 'p_adx': 23, 'rsi_period': 69, 'ema1': 26, 'ema2': 19, 'slip_atr_k': 0.14354516744022072, 'slip_spread_k': 0.002565885848014149, 'spread_hl_frac': 0.00523838997600568, 'bb_std_mult': 3.258774196862701, 'rsi_os': 38, 'rsi_ob': 60, 'vol_spike': 0.2473437291224944, 'adx_thresh': 26.624180550908886, 'atr_min_pct': 0.012029513633563605, 'atr_max_pct': 0.13815717368861488, 'tp_mult': 1.0439748547250094, 'tsl_mult': 0.693431544063386, 'strategy': 'mean_reversion', 'time_stop': 229, 'use_sma': False, 'use_atr': False, 'use_adx': False, 'use_ema': True, 'use_spike': True, 'rsi_required': False, 'edge_k': 0.879423809946308, 'edge_cap': 0.37517645010341005, 'bull_strategy': 'breakout', 'bull_bb_std_mult': 3.22684055427635, 'bull_rsi_os': 8, 'bull_rsi_ob': 56, 'bull_adx_thresh': 31.018600088670876, 'bull_atr_min_pct': 0.004978211298305721, 'bull_atr_max_pct': 0.11667969220302386, 'bull_tp_mult': 1.335501039242093, 'bull_tsl_mult': 0.47659032932686773, 'bull_time_stop': 91, 'bull_use_sma': True, 'bull_use_ema': True, 'bull_use_atr': False, 'bull_use_adx': True, 'bull_use_spike': False, 'bull_rsi_required': True, 'bear_strategy': 'mean_reversion', 'bear_bb_std_mult': 3.5985540603394424, 'bear_rsi_os': 50, 'bear_rsi_ob': 83, 'bear_adx_thresh': 15.139981076272456, 'bear_atr_min_pct': 0.004907379713215303, 'bear_atr_max_pct': 0.035851226689199336, 'bear_tp_mult': 2.3723579294336674, 'bear_tsl_mult': 0.18026006042389486, 'bear_time_stop': 42, 'bear_use_sma': False, 'bear_use_ema': True, 'bear_use_atr': True, 'bear_use_adx': True, 'bear_use_spike': False, 'bear_rsi_required': True, 'sideways_strategy': 'breakout', 'sideways_bb_std_mult': 1.5197326245504659, 'sideways_rsi_os': 48, 'sideways_rsi_ob': 72, 'sideways_adx_thresh': 7.190243190304091, 'sideways_atr_min_pct': 0.0170852631571869, 'sideways_atr_max_pct': 0.07724843958196453, 'sideways_tp_mult': 1.1912273114791612, 'sideways_tsl_mult': 0.7959852290804451, 'sideways_time_stop': 171, 'sideways_use_sma': True, 'sideways_use_ema': False, 'sideways_use_atr': True, 'sideways_use_adx': True, 'sideways_use_spike': False, 'sideways_rsi_required': True}.
[I 2025-09-01 13:57:41,196] Trial 361 finished with values: [-1000000000.0, 1000000000.0] and parameters: {'p_sma': 11, 'p_std': 49, 'p_atr': 26, 'p_adx': 23, 'rsi_period': 70, 'ema1': 26, 'ema2': 19, 'slip_atr_k': 0.14578458052896653, 'slip_spread_k': 0.5344410135559319, 'spread_hl_frac': 0.026772537949426897, 'bb_std_mult': 3.246921308087109, 'rsi_os': 12, 'rsi_ob': 85, 'vol_spike': 0.29795178993442073, 'adx_thresh': 5.876146304908552, 'atr_min_pct': 0.027323558525727615, 'atr_max_pct': 0.14582678729700374, 'tp_mult': 2.8450506531585296, 'tsl_mult': 0.7389255909471045, 'strategy': 'mean_reversion', 'time_stop': 179, 'use_sma': False, 'use_atr': False, 'use_adx': False, 'use_ema': True, 'use_spike': True, 'rsi_required': False, 'edge_k': 0.03275479041986784, 'edge_cap': 0.28664807693519584, 'bull_strategy': 'breakout', 'bull_bb_std_mult': 1.7329244759618223, 'bull_rsi_os': 31, 'bull_rsi_ob': 56, 'bull_adx_thresh': 18.768396322096706, 'bull_atr_min_pct': 0.0031963916070849975, 'bull_atr_max_pct': 0.05386632459180517, 'bull_tp_mult': 1.29416438417122, 'bull_tsl_mult': 0.7377990373683119, 'bull_time_stop': 74, 'bull_use_sma': True, 'bull_use_ema': True, 'bull_use_atr': False, 'bull_use_adx': True, 'bull_use_spike': False, 'bull_rsi_required': True, 'bear_strategy': 'mean_reversion', 'bear_bb_std_mult': 3.5507376621610054, 'bear_rsi_os': 34, 'bear_rsi_ob': 87, 'bear_adx_thresh': 26.293038879094276, 'bear_atr_min_pct': 0.005025081277238006, 'bear_atr_max_pct': 0.03846578084650916, 'bear_tp_mult': 1.0137426188572844, 'bear_tsl_mult': 0.36550448448143164, 'bear_time_stop': 224, 'bear_use_sma': False, 'bear_use_ema': True, 'bear_use_atr': True, 'bear_use_adx': True, 'bear_use_spike': False, 'bear_rsi_required': True, 'sideways_strategy': 'breakout', 'sideways_bb_std_mult': 1.532790055303584, 'sideways_rsi_os': 48, 'sideways_rsi_ob': 57, 'sideways_adx_thresh': 7.280978013619959, 'sideways_atr_min_pct': 0.02037705058957316, 'sideways_atr_max_pct': 0.029670143707102442, 'sideways_tp_mult': 2.7028667784165896, 'sideways_tsl_mult': 0.2801442799570575, 'sideways_time_stop': 137, 'sideways_use_sma': True, 'sideways_use_ema': False, 'sideways_use_atr': True, 'sideways_use_adx': True, 'sideways_use_spike': False, 'sideways_rsi_required': True}.
[I 2025-09-01 13:57:42,919] Trial 362 finished with values: [-1000000000.0, 1000000000.0] and parameters: {'p_sma': 11, 'p_std': 49, 'p_atr': 26, 'p_adx': 13, 'rsi_period': 64, 'ema1': 23, 'ema2': 17, 'slip_atr_k': 0.2445188703101669, 'slip_spread_k': 0.9755554990050725, 'spread_hl_frac': 0.0018848975213795237, 'bb_std_mult': 1.8438934519233423, 'rsi_os': 38, 'rsi_ob': 82, 'vol_spike': 0.23312128837229945, 'adx_thresh': 25.16948601806606, 'atr_min_pct': 0.011959977786533984, 'atr_max_pct': 0.024037423285161022, 'tp_mult': 1.0101473978148492, 'tsl_mult': 0.7355180051911699, 'strategy': 'mean_reversion', 'time_stop': 226, 'use_sma': True, 'use_atr': False, 'use_adx': False, 'use_ema': False, 'use_spike': True, 'rsi_required': False, 'edge_k': 1.293964490760323, 'edge_cap': 0.3861067085496571, 'bull_strategy': 'breakout', 'bull_bb_std_mult': 3.260885094446915, 'bull_rsi_os': 8, 'bull_rsi_ob': 82, 'bull_adx_thresh': 31.028574881891537, 'bull_atr_min_pct': 0.004838500318754634, 'bull_atr_max_pct': 0.017084800689597918, 'bull_tp_mult': 2.8994728774352905, 'bull_tsl_mult': 0.44735205035083286, 'bull_time_stop': 72, 'bull_use_sma': True, 'bull_use_ema': True, 'bull_use_atr': True, 'bull_use_adx': True, 'bull_use_spike': False, 'bull_rsi_required': True, 'bear_strategy': 'breakout', 'bear_bb_std_mult': 3.598344228952421, 'bear_rsi_os': 29, 'bear_rsi_ob': 75, 'bear_adx_thresh': 17.96882144754019, 'bear_atr_min_pct': 0.01330388033477437, 'bear_atr_max_pct': 0.0399071419081686, 'bear_tp_mult': 2.3724281954403814, 'bear_tsl_mult': 0.22376525413992182, 'bear_time_stop': 165, 'bear_use_sma': True, 'bear_use_ema': True, 'bear_use_atr': True, 'bear_use_adx': True, 'bear_use_spike': False, 'bear_rsi_required': True, 'sideways_strategy': 'breakout', 'sideways_bb_std_mult': 1.513248998565424, 'sideways_rsi_os': 52, 'sideways_rsi_ob': 65, 'sideways_adx_thresh': 29.074070205023602, 'sideways_atr_min_pct': 0.018468527061960095, 'sideways_atr_max_pct': 0.06422892775258954, 'sideways_tp_mult': 2.716800445495917, 'sideways_tsl_mult': 0.3735811675786659, 'sideways_time_stop': 147, 'sideways_use_sma': True, 'sideways_use_ema': False, 'sideways_use_atr': True, 'sideways_use_adx': True, 'sideways_use_spike': False, 'sideways_rsi_required': False}.
[I 2025-09-01 13:57:43,342] Trial 363 finished with values: [-1000000000.0, 1000000000.0] and parameters: {'p_sma': 12, 'p_std': 20, 'p_atr': 26, 'p_adx': 13, 'rsi_period': 66, 'ema1': 23, 'ema2': 17, 'slip_atr_k': 0.028141230659376473, 'slip_spread_k': 0.9839347684762048, 'spread_hl_frac': 0.033446920898236025, 'bb_std_mult': 1.8775940849585677, 'rsi_os': 12, 'rsi_ob': 82, 'vol_spike': 0.15581788553942802, 'adx_thresh': 25.16612684683451, 'atr_min_pct': 0.011794504733601717, 'atr_max_pct': 0.07219260065405182, 'tp_mult': 2.430493379147127, 'tsl_mult': 0.7918328985901768, 'strategy': 'mean_reversion', 'time_stop': 244, 'use_sma': True, 'use_atr': False, 'use_adx': False, 'use_ema': False, 'use_spike': True, 'rsi_required': False, 'edge_k': 1.6615559755431288, 'edge_cap': 0.11550371811004684, 'bull_strategy': 'breakout', 'bull_bb_std_mult': 1.3922245547805363, 'bull_rsi_os': 41, 'bull_rsi_ob': 73, 'bull_adx_thresh': 17.626077457961486, 'bull_atr_min_pct': 0.005063768302968607, 'bull_atr_max_pct': 0.1326161582422278, 'bull_tp_mult': 2.895103985616214, 'bull_tsl_mult': 0.29967730716533864, 'bull_time_stop': 90, 'bull_use_sma': True, 'bull_use_ema': True, 'bull_use_atr': True, 'bull_use_adx': True, 'bull_use_spike': False, 'bull_rsi_required': True, 'bear_strategy': 'breakout', 'bear_bb_std_mult': 1.900030495250893, 'bear_rsi_os': 34, 'bear_rsi_ob': 75, 'bear_adx_thresh': 23.328167461898225, 'bear_atr_min_pct': 0.00467165083496846, 'bear_atr_max_pct': 0.052667816386521266, 'bear_tp_mult': 2.3791871899303842, 'bear_tsl_mult': 0.39986369898379914, 'bear_time_stop': 164, 'bear_use_sma': True, 'bear_use_ema': True, 'bear_use_atr': True, 'bear_use_adx': True, 'bear_use_spike': False, 'bear_rsi_required': True, 'sideways_strategy': 'breakout', 'sideways_bb_std_mult': 1.5326570240589334, 'sideways_rsi_os': 15, 'sideways_rsi_ob': 57, 'sideways_adx_thresh': 7.310711057701282, 'sideways_atr_min_pct': 0.018647664481951837, 'sideways_atr_max_pct': 0.07847981696485032, 'sideways_tp_mult': 2.693764097753541, 'sideways_tsl_mult': 0.3727348450763829, 'sideways_time_stop': 147, 'sideways_use_sma': True, 'sideways_use_ema': False, 'sideways_use_atr': True, 'sideways_use_adx': True, 'sideways_use_spike': False, 'sideways_rsi_required': False}.
[I 2025-09-01 13:57:44,581] Trial 364 finished with values: [-0.03262004175412514, 0.033016329778368644] and parameters: {'p_sma': 11, 'p_std': 28, 'p_atr': 17, 'p_adx': 13, 'rsi_period': 64, 'ema1': 23, 'ema2': 37, 'slip_atr_k': 0.03287069218031212, 'slip_spread_k': 0.6046948713221897, 'spread_hl_frac': 0.033804363711227726, 'bb_std_mult': 1.8579404576182303, 'rsi_os': 47, 'rsi_ob': 57, 'vol_spike': 0.29837333445393266, 'adx_thresh': 25.750875639823235, 'atr_min_pct': 0.013926766101358633, 'atr_max_pct': 0.1374885570686024, 'tp_mult': 1.099770561886376, 'tsl_mult': 0.7315867284073386, 'strategy': 'mean_reversion', 'time_stop': 223, 'use_sma': True, 'use_atr': False, 'use_adx': False, 'use_ema': False, 'use_spike': True, 'rsi_required': True, 'edge_k': 1.2903053908345445, 'edge_cap': 0.29172624277987447, 'bull_strategy': 'breakout', 'bull_bb_std_mult': 3.2965013684456865, 'bull_rsi_os': 32, 'bull_rsi_ob': 55, 'bull_adx_thresh': 17.653994131286943, 'bull_atr_min_pct': 0.01780153274228166, 'bull_atr_max_pct': 0.018176669905132233, 'bull_tp_mult': 2.315675167311712, 'bull_tsl_mult': 0.3019350757067366, 'bull_time_stop': 242, 'bull_use_sma': False, 'bull_use_ema': True, 'bull_use_atr': True, 'bull_use_adx': True, 'bull_use_spike': False, 'bull_rsi_required': True, 'bear_strategy': 'breakout', 'bear_bb_std_mult': 3.538983522988109, 'bear_rsi_os': 53, 'bear_rsi_ob': 87, 'bear_adx_thresh': 12.646275532506413, 'bear_atr_min_pct': 0.0030070841134724985, 'bear_atr_max_pct': 0.053681433106678195, 'bear_tp_mult': 1.2459004625848429, 'bear_tsl_mult': 0.14416294228429616, 'bear_time_stop': 226, 'bear_use_sma': True, 'bear_use_ema': True, 'bear_use_atr': True, 'bear_use_adx': True, 'bear_use_spike': False, 'bear_rsi_required': True, 'sideways_strategy': 'breakout', 'sideways_bb_std_mult': 3.5238598373928824, 'sideways_rsi_os': 52, 'sideways_rsi_ob': 78, 'sideways_adx_thresh': 8.931997526859007, 'sideways_atr_min_pct': 0.025825641508319654, 'sideways_atr_max_pct': 0.017453016338233665, 'sideways_tp_mult': 2.6996167658309984, 'sideways_tsl_mult': 0.37244426221530735, 'sideways_time_stop': 138, 'sideways_use_sma': True, 'sideways_use_ema': False, 'sideways_use_atr': True, 'sideways_use_adx': False, 'sideways_use_spike': False, 'sideways_rsi_required': False}.
[I 2025-09-01 13:57:45,150] Trial 365 finished with values: [-1000000000.0, 1000000000.0] and parameters: {'p_sma': 36, 'p_std': 48, 'p_atr': 17, 'p_adx': 13, 'rsi_period': 18, 'ema1': 21, 'ema2': 51, 'slip_atr_k': 0.03546215161055424, 'slip_spread_k': 0.9790507715561312, 'spread_hl_frac': 0.034552454568925, 'bb_std_mult': 1.877695234450832, 'rsi_os': 41, 'rsi_ob': 57, 'vol_spike': 0.11844775337672492, 'adx_thresh': 25.14114292277083, 'atr_min_pct': 0.025583026572858054, 'atr_max_pct': 0.024310020858406278, 'tp_mult': 1.1011259015043113, 'tsl_mult': 0.7991217283971864, 'strategy': 'mean_reversion', 'time_stop': 225, 'use_sma': True, 'use_atr': False, 'use_adx': False, 'use_ema': False, 'use_spike': True, 'rsi_required': True, 'edge_k': 1.0226930143532227, 'edge_cap': 0.3346004864938468, 'bull_strategy': 'breakout', 'bull_bb_std_mult': 3.269890707232885, 'bull_rsi_os': 21, 'bull_rsi_ob': 55, 'bull_adx_thresh': 27.291302947757654, 'bull_atr_min_pct': 0.01746970937724466, 'bull_atr_max_pct': 0.017022093461924175, 'bull_tp_mult': 2.3091804805307934, 'bull_tsl_mult': 0.44799271089733655, 'bull_time_stop': 285, 'bull_use_sma': False, 'bull_use_ema': True, 'bull_use_atr': True, 'bull_use_adx': True, 'bull_use_spike': True, 'bull_rsi_required': True, 'bear_strategy': 'breakout', 'bear_bb_std_mult': 1.912536071708566, 'bear_rsi_os': 33, 'bear_rsi_ob': 88, 'bear_adx_thresh': 12.769711060393012, 'bear_atr_min_pct': 0.003173105765905556, 'bear_atr_max_pct': 0.05353244317798855, 'bear_tp_mult': 2.266472599548607, 'bear_tsl_mult': 0.392292061787361, 'bear_time_stop': 194, 'bear_use_sma': True, 'bear_use_ema': True, 'bear_use_atr': True, 'bear_use_adx': True, 'bear_use_spike': False, 'bear_rsi_required': True, 'sideways_strategy': 'breakout', 'sideways_bb_std_mult': 1.4288797966322937, 'sideways_rsi_os': 19, 'sideways_rsi_ob': 61, 'sideways_adx_thresh': 9.108007091006153, 'sideways_atr_min_pct': 0.018498838889424205, 'sideways_atr_max_pct': 0.06988180393286633, 'sideways_tp_mult': 2.1984683351059737, 'sideways_tsl_mult': 0.31978807072604326, 'sideways_time_stop': 149, 'sideways_use_sma': True, 'sideways_use_ema': False, 'sideways_use_atr': True, 'sideways_use_adx': False, 'sideways_use_spike': False, 'sideways_rsi_required': False}.
[I 2025-09-01 13:57:45,724] Trial 369 finished with values: [-1000000000.0, 1000000000.0] and parameters: {'p_sma': 22, 'p_std': 40, 'p_atr': 12, 'p_adx': 26, 'rsi_period': 67, 'ema1': 22, 'ema2': 21, 'slip_atr_k': 0.01102908178164598, 'slip_spread_k': 0.06981733678726382, 'spread_hl_frac': 0.0059285643439689895, 'bb_std_mult': 2.5973080864670277, 'rsi_os': 54, 'rsi_ob': 83, 'vol_spike': 0.05586870855893432, 'adx_thresh': 32.038727870254796, 'atr_min_pct': 0.020417397567785194, 'atr_max_pct': 0.13946119246978395, 'tp_mult': 1.9674576748635644, 'tsl_mult': 0.7474731544689013, 'strategy': 'mean_reversion', 'time_stop': 164, 'use_sma': True, 'use_atr': True, 'use_adx': True, 'use_ema': True, 'use_spike': True, 'rsi_required': False, 'edge_k': 0.8900409929978094, 'edge_cap': 0.3406902093331411, 'bull_strategy': 'breakout', 'bull_bb_std_mult': 2.9912865698569036, 'bull_rsi_os': 43, 'bull_rsi_ob': 46, 'bull_adx_thresh': 30.235836554944356, 'bull_atr_min_pct': 0.0025595799684193133, 'bull_atr_max_pct': 0.021644427700352752, 'bull_tp_mult': 2.8113672411764785, 'bull_tsl_mult': 0.5354334200992938, 'bull_time_stop': 138, 'bull_use_sma': True, 'bull_use_ema': False, 'bull_use_atr': True, 'bull_use_adx': False, 'bull_use_spike': True, 'bull_rsi_required': False, 'bear_strategy': 'breakout', 'bear_bb_std_mult': 1.2381017592176171, 'bear_rsi_os': 34, 'bear_rsi_ob': 84, 'bear_adx_thresh': 10.22474608506501, 'bear_atr_min_pct': 0.0016964081208393543, 'bear_atr_max_pct': 0.04624402116074027, 'bear_tp_mult': 2.324409840465805, 'bear_tsl_mult': 0.11107873600529361, 'bear_time_stop': 222, 'bear_use_sma': True, 'bear_use_ema': True, 'bear_use_atr': False, 'bear_use_adx': False, 'bear_use_spike': True, 'bear_rsi_required': True, 'sideways_strategy': 'breakout', 'sideways_bb_std_mult': 1.6861049838848454, 'sideways_rsi_os': 51, 'sideways_rsi_ob': 81, 'sideways_adx_thresh': 10.488283453744389, 'sideways_atr_min_pct': 0.005819444270456543, 'sideways_atr_max_pct': 0.04258040952757322, 'sideways_tp_mult': 2.559541358554971, 'sideways_tsl_mult': 0.30631484785179386, 'sideways_time_stop': 93, 'sideways_use_sma': True, 'sideways_use_ema': False, 'sideways_use_atr': False, 'sideways_use_adx': True, 'sideways_use_spike': True, 'sideways_rsi_required': True}.
[I 2025-09-01 13:58:23,744] Trial 368 finished with values: [-1000000000.0, 1000000000.0] and parameters: {'p_sma': 22, 'p_std': 47, 'p_atr': 25, 'p_adx': 12, 'rsi_period': 67, 'ema1': 12, 'ema2': 21, 'slip_atr_k': 0.013601685398808046, 'slip_spread_k': 0.05618888258999229, 'spread_hl_frac': 0.005633182458059469, 'bb_std_mult': 1.701879843789175, 'rsi_os': 41, 'rsi_ob': 83, 'vol_spike': 0.11198058600530239, 'adx_thresh': 18.88242113162154, 'atr_min_pct': 0.02581023553897348, 'atr_max_pct': 0.13966366336282265, 'tp_mult': 1.1470703986440942, 'tsl_mult': 0.8834630449256087, 'strategy': 'mean_reversion', 'time_stop': 254, 'use_sma': True, 'use_atr': True, 'use_adx': True, 'use_ema': True, 'use_spike': True, 'rsi_required': True, 'edge_k': 0.7449647754656292, 'edge_cap': 0.3421635123115783, 'bull_strategy': 'breakout', 'bull_bb_std_mult': 3.3749824336412866, 'bull_rsi_os': 43, 'bull_rsi_ob': 47, 'bull_adx_thresh': 11.544470772977947, 'bull_atr_min_pct': 0.0027346313869198767, 'bull_atr_max_pct': 0.011686794633657058, 'bull_tp_mult': 2.7997627899057917, 'bull_tsl_mult': 0.6724957689697033, 'bull_time_stop': 111, 'bull_use_sma': False, 'bull_use_ema': True, 'bull_use_atr': True, 'bull_use_adx': False, 'bull_use_spike': True, 'bull_rsi_required': False, 'bear_strategy': 'breakout', 'bear_bb_std_mult': 1.233347965010318, 'bear_rsi_os': 27, 'bear_rsi_ob': 77, 'bear_adx_thresh': 11.131956565510603, 'bear_atr_min_pct': 0.0022831498948681157, 'bear_atr_max_pct': 0.04691096776311516, 'bear_tp_mult': 2.248981578490722, 'bear_tsl_mult': 0.11341767982012443, 'bear_time_stop': 50, 'bear_use_sma': True, 'bear_use_ema': True, 'bear_use_atr': False, 'bear_use_adx': False, 'bear_use_spike': True, 'bear_rsi_required': True, 'sideways_strategy': 'breakout', 'sideways_bb_std_mult': 1.7217760305123118, 'sideways_rsi_os': 51, 'sideways_rsi_ob': 70, 'sideways_adx_thresh': 10.25663721405723, 'sideways_atr_min_pct': 0.019841097614850943, 'sideways_atr_max_pct': 0.07086463375994304, 'sideways_tp_mult': 2.557409809298762, 'sideways_tsl_mult': 0.3187725914306581, 'sideways_time_stop': 165, 'sideways_use_sma': True, 'sideways_use_ema': False, 'sideways_use_atr': False, 'sideways_use_adx': False, 'sideways_use_spike': True, 'sideways_rsi_required': True}.
[I 2025-09-01 13:58:23,748] Trial 367 finished with values: [-0.011507504071448071, 0.016463105344336135] and parameters: {'p_sma': 33, 'p_std': 47, 'p_atr': 19, 'p_adx': 12, 'rsi_period': 19, 'ema1': 29, 'ema2': 49, 'slip_atr_k': 0.019149436859339557, 'slip_spread_k': 0.05888107517148493, 'spread_hl_frac': 0.005795480403723755, 'bb_std_mult': 1.6936669318770432, 'rsi_os': 40, 'rsi_ob': 83, 'vol_spike': 0.1096090227699408, 'adx_thresh': 32.038278140294295, 'atr_min_pct': 0.007027666816211234, 'atr_max_pct': 0.13895769831503246, 'tp_mult': 1.098003960178017, 'tsl_mult': 0.8691462913236736, 'strategy': 'mean_reversion', 'time_stop': 141, 'use_sma': True, 'use_atr': True, 'use_adx': True, 'use_ema': True, 'use_spike': True, 'rsi_required': True, 'edge_k': 0.6687561902841233, 'edge_cap': 0.3389623842670915, 'bull_strategy': 'breakout', 'bull_bb_std_mult': 3.340680963248343, 'bull_rsi_os': 13, 'bull_rsi_ob': 55, 'bull_adx_thresh': 30.21053024052191, 'bull_atr_min_pct': 0.017754924469912958, 'bull_atr_max_pct': 0.020518614737701942, 'bull_tp_mult': 2.2098979469571534, 'bull_tsl_mult': 0.35929683829436593, 'bull_time_stop': 160, 'bull_use_sma': False, 'bull_use_ema': True, 'bull_use_atr': True, 'bull_use_adx': False, 'bull_use_spike': True, 'bull_rsi_required': True, 'bear_strategy': 'breakout', 'bear_bb_std_mult': 3.4564290489679554, 'bear_rsi_os': 27, 'bear_rsi_ob': 88, 'bear_adx_thresh': 28.278039180748777, 'bear_atr_min_pct': 0.003087048145033452, 'bear_atr_max_pct': 0.04696584166022802, 'bear_tp_mult': 2.2599842826003, 'bear_tsl_mult': 0.13997416742846658, 'bear_time_stop': 198, 'bear_use_sma': True, 'bear_use_ema': True, 'bear_use_atr': False, 'bear_use_adx': True, 'bear_use_spike': True, 'bear_rsi_required': True, 'sideways_strategy': 'breakout', 'sideways_bb_std_mult': 1.7310397767809802, 'sideways_rsi_os': 19, 'sideways_rsi_ob': 66, 'sideways_adx_thresh': 9.978919651904619, 'sideways_atr_min_pct': 0.005949617605777221, 'sideways_atr_max_pct': 0.06676354457062907, 'sideways_tp_mult': 2.8212427755338854, 'sideways_tsl_mult': 0.3197851030120879, 'sideways_time_stop': 195, 'sideways_use_sma': True, 'sideways_use_ema': False, 'sideways_use_atr': False, 'sideways_use_adx': False, 'sideways_use_spike': True, 'sideways_rsi_required': True}.
