[I 2025-09-01 13:48:29,373] Trial 296 finished with values: [-1000000000.0, 1000000000.0] and parameters: {'p_sma': 35, 'p_std': 55, 'p_atr': 26, 'p_adx': 12, 'rsi_period': 46, 'ema1': 22, 'ema2': 15, 'slip_atr_k': 0.24870220083441857, 'slip_spread_k': 0.05433078514678475, 'spread_hl_frac': 0.0033318958204166895, 'bb_std_mult': 1.8190091826088617, 'rsi_os': 39, 'rsi_ob': 82, 'vol_spike': 0.22809475620130276, 'adx_thresh': 24.273812922242566, 'atr_min_pct': 0.024230377859441696, 'atr_max_pct': 0.14498949043353393, 'tp_mult': 1.017310913399248, 'tsl_mult': 0.37117870820961124, 'strategy': 'mean_reversion', 'time_stop': 6, 'use_sma': True, 'use_atr': False, 'use_adx': True, 'use_ema': False, 'use_spike': True, 'rsi_required': False, 'edge_k': 1.2099212130801145, 'edge_cap': 0.5968884353641569, 'bull_strategy': 'breakout', 'bull_bb_std_mult': 2.4851098722021048, 'bull_rsi_os': 36, 'bull_rsi_ob': 90, 'bull_adx_thresh': 22.726426240261233, 'bull_atr_min_pct': 0.020591638043616, 'bull_atr_max_pct': 0.12802782251884703, 'bull_tp_mult': 1.1606542695150681, 'bull_tsl_mult': 0.08494204185285642, 'bull_time_stop': 189, 'bull_use_sma': False, 'bull_use_ema': True, 'bull_use_atr': True, 'bull_use_adx': True, 'bull_use_spike': True, 'bull_rsi_required': True, 'bear_strategy': 'breakout', 'bear_bb_std_mult': 3.264162761301752, 'bear_rsi_os': 32, 'bear_rsi_ob': 52, 'bear_adx_thresh': 11.826382747116549, 'bear_atr_min_pct': 0.003979334450591418, 'bear_atr_max_pct': 0.11841603508358219, 'bear_tp_mult': 2.1212724612260336, 'bear_tsl_mult': 0.1598116461173532, 'bear_time_stop': 216, 'bear_use_sma': True, 'bear_use_ema': True, 'bear_use_atr': False, 'bear_use_adx': False, 'bear_use_spike': True, 'bear_rsi_required': True, 'sideways_strategy': 'breakout', 'sideways_bb_std_mult': 1.6791903150429501, 'sideways_rsi_os': 36, 'sideways_rsi_ob': 66, 'sideways_adx_thresh': 6.28329913415171, 'sideways_atr_min_pct': 0.025180408020346566, 'sideways_atr_max_pct': 0.02410209981777882, 'sideways_tp_mult': 2.767628840705218, 'sideways_tsl_mult': 0.23325893843998613, 'sideways_time_stop': 55, 'sideways_use_sma': True, 'sideways_use_ema': False, 'sideways_use_atr': False, 'sideways_use_adx': True, 'sideways_use_spike': True, 'sideways_rsi_required': False}.
[I 2025-09-01 13:48:30,948] Trial 298 finished with values: [-1000000000.0, 1000000000.0] and parameters: {'p_sma': 21, 'p_std': 10, 'p_atr': 25, 'p_adx': 13, 'rsi_period': 36, 'ema1': 15, 'ema2': 21, 'slip_atr_k': 0.024321989947589953, 'slip_spread_k': 0.12003950972549657, 'spread_hl_frac': 0.023775336128135333, 'bb_std_mult': 1.7919135049066444, 'rsi_os': 39, 'rsi_ob': 82, 'vol_spike': 0.26381582197565867, 'adx_thresh': 22.82759789474299, 'atr_min_pct': 0.02899238061467139, 'atr_max_pct': 0.11633804990818614, 'tp_mult': 1.0764413009766918, 'tsl_mult': 0.7358470238128696, 'strategy': 'mean_reversion', 'time_stop': 247, 'use_sma': False, 'use_atr': False, 'use_adx': False, 'use_ema': True, 'use_spike': True, 'rsi_required': False, 'edge_k': 1.8563778214444135, 'edge_cap': 0.28117273988737734, 'bull_strategy': 'breakout', 'bull_bb_std_mult': 3.2168926821345445, 'bull_rsi_os': 36, 'bull_rsi_ob': 53, 'bull_adx_thresh': 22.715260491799953, 'bull_atr_min_pct': 0.02439662942632876, 'bull_atr_max_pct': 0.04532184945686824, 'bull_tp_mult': 1.1641767487026806, 'bull_tsl_mult': 0.44150869409408827, 'bull_time_stop': 276, 'bull_use_sma': True, 'bull_use_ema': True, 'bull_use_atr': False, 'bull_use_adx': False, 'bull_use_spike': False, 'bull_rsi_required': True, 'bear_strategy': 'breakout', 'bear_bb_std_mult': 2.3304332684340605, 'bear_rsi_os': 37, 'bear_rsi_ob': 51, 'bear_adx_thresh': 21.308356627042308, 'bear_atr_min_pct': 0.008549364208232171, 'bear_atr_max_pct': 0.04762994373756545, 'bear_tp_mult': 1.478770714425918, 'bear_tsl_mult': 0.15609142578709953, 'bear_time_stop': 240, 'bear_use_sma': False, 'bear_use_ema': True, 'bear_use_atr': True, 'bear_use_adx': True, 'bear_use_spike': False, 'bear_rsi_required': True, 'sideways_strategy': 'breakout', 'sideways_bb_std_mult': 1.6603479639610186, 'sideways_rsi_os': 53, 'sideways_rsi_ob': 66, 'sideways_adx_thresh': 21.62040586658119, 'sideways_atr_min_pct': 0.021427163197044553, 'sideways_atr_max_pct': 0.02469370695918338, 'sideways_tp_mult': 2.1128970674641536, 'sideways_tsl_mult': 0.02494950961857678, 'sideways_time_stop': 177, 'sideways_use_sma': True, 'sideways_use_ema': False, 'sideways_use_atr': True, 'sideways_use_adx': True, 'sideways_use_spike': False, 'sideways_rsi_required': True}.
[I 2025-09-01 13:48:31,428] Trial 302 finished with values: [-1000000000.0, 1000000000.0] and parameters: {'p_sma': 37, 'p_std': 48, 'p_atr': 25, 'p_adx': 22, 'rsi_period': 63, 'ema1': 21, 'ema2': 22, 'slip_atr_k': 0.05984126824412529, 'slip_spread_k': 0.5972242955604574, 'spread_hl_frac': 0.004616491426644647, 'bb_std_mult': 1.8897721993594827, 'rsi_os': 36, 'rsi_ob': 50, 'vol_spike': 0.07299926760231845, 'adx_thresh': 25.276783646850156, 'atr_min_pct': 0.026612218673088443, 'atr_max_pct': 0.09674507547072017, 'tp_mult': 1.2239968950521734, 'tsl_mult': 0.7618539409493009, 'strategy': 'mean_reversion', 'time_stop': 239, 'use_sma': True, 'use_atr': False, 'use_adx': False, 'use_ema': True, 'use_spike': True, 'rsi_required': False, 'edge_k': 0.8788651673067068, 'edge_cap': 0.3093324551492332, 'bull_strategy': 'mean_reversion', 'bull_bb_std_mult': 3.406655349237295, 'bull_rsi_os': 22, 'bull_rsi_ob': 80, 'bull_adx_thresh': 23.888739608883686, 'bull_atr_min_pct': 0.004145431993251937, 'bull_atr_max_pct': 0.14284079324746657, 'bull_tp_mult': 2.4066923098800745, 'bull_tsl_mult': 0.4773599415541424, 'bull_time_stop': 97, 'bull_use_sma': True, 'bull_use_ema': True, 'bull_use_atr': True, 'bull_use_adx': True, 'bull_use_spike': False, 'bull_rsi_required': True, 'bear_strategy': 'breakout', 'bear_bb_std_mult': 3.5078279002886843, 'bear_rsi_os': 51, 'bear_rsi_ob': 60, 'bear_adx_thresh': 11.237212807210526, 'bear_atr_min_pct': 0.003139747444201554, 'bear_atr_max_pct': 0.051804735354173445, 'bear_tp_mult': 1.9991507992109028, 'bear_tsl_mult': 0.12961053121531027, 'bear_time_stop': 9, 'bear_use_sma': True, 'bear_use_ema': True, 'bear_use_atr': True, 'bear_use_adx': True, 'bear_use_spike': False, 'bear_rsi_required': True, 'sideways_strategy': 'breakout', 'sideways_bb_std_mult': 1.5293242285318307, 'sideways_rsi_os': 5, 'sideways_rsi_ob': 76, 'sideways_adx_thresh': 6.792992901509246, 'sideways_atr_min_pct': 0.023259758366756547, 'sideways_atr_max_pct': 0.05487461071584129, 'sideways_tp_mult': 2.7011381586387877, 'sideways_tsl_mult': 0.3056955581892692, 'sideways_time_stop': 225, 'sideways_use_sma': True, 'sideways_use_ema': False, 'sideways_use_atr': True, 'sideways_use_adx': True, 'sideways_use_spike': False, 'sideways_rsi_required': True}.
[I 2025-09-01 13:49:08,955] Trial 303 finished with values: [-1000000000.0, 1000000000.0] and parameters: {'p_sma': 16, 'p_std': 47, 'p_atr': 27, 'p_adx': 13, 'rsi_period': 81, 'ema1': 21, 'ema2': 43, 'slip_atr_k': 0.015583406641710455, 'slip_spread_k': 0.09299135937504485, 'spread_hl_frac': 0.04175791630535278, 'bb_std_mult': 2.669371553401507, 'rsi_os': 40, 'rsi_ob': 84, 'vol_spike': 0.24146581032881695, 'adx_thresh': 21.171652625669974, 'atr_min_pct': 0.02275420207971279, 'atr_max_pct': 0.07825171120266759, 'tp_mult': 1.1377660229769049, 'tsl_mult': 0.7600212655556159, 'strategy': 'mean_reversion', 'time_stop': 224, 'use_sma': True, 'use_atr': False, 'use_adx': False, 'use_ema': True, 'use_spike': True, 'rsi_required': False, 'edge_k': 0.9578475216908352, 'edge_cap': 0.38385227038598096, 'bull_strategy': 'mean_reversion', 'bull_bb_std_mult': 3.2841212462986986, 'bull_rsi_os': 32, 'bull_rsi_ob': 71, 'bull_adx_thresh': 30.209916294508282, 'bull_atr_min_pct': 0.025055626822889615, 'bull_atr_max_pct': 0.01981699613292896, 'bull_tp_mult': 2.8964526477806207, 'bull_tsl_mult': 0.1635597158043146, 'bull_time_stop': 144, 'bull_use_sma': True, 'bull_use_ema': True, 'bull_use_atr': True, 'bull_use_adx': True, 'bull_use_spike': False, 'bull_rsi_required': False, 'bear_strategy': 'breakout', 'bear_bb_std_mult': 3.144594923895613, 'bear_rsi_os': 16, 'bear_rsi_ob': 87, 'bear_adx_thresh': 13.401537601466014, 'bear_atr_min_pct': 0.012338828757679757, 'bear_atr_max_pct': 0.03575663154502789, 'bear_tp_mult': 1.383935666477403, 'bear_tsl_mult': 0.10040778273132034, 'bear_time_stop': 231, 'bear_use_sma': True, 'bear_use_ema': True, 'bear_use_atr': True, 'bear_use_adx': True, 'bear_use_spike': False, 'bear_rsi_required': True, 'sideways_strategy': 'breakout', 'sideways_bb_std_mult': 1.5966019023419833, 'sideways_rsi_os': 54, 'sideways_rsi_ob': 62, 'sideways_adx_thresh': 30.114710728028783, 'sideways_atr_min_pct': 0.01966010709032002, 'sideways_atr_max_pct': 0.07178545781787068, 'sideways_tp_mult': 1.4189863516748695, 'sideways_tsl_mult': 0.783979847743276, 'sideways_time_stop': 183, 'sideways_use_sma': True, 'sideways_use_ema': False, 'sideways_use_atr': True, 'sideways_use_adx': True, 'sideways_use_spike': False, 'sideways_rsi_required': True}.
[I 2025-09-01 13:49:09,514] Trial 300 finished with values: [-1000000000.0, 1000000000.0] and parameters: {'p_sma': 21, 'p_std': 47, 'p_atr': 27, 'p_adx': 13, 'rsi_period': 47, 'ema1': 21, 'ema2': 23, 'slip_atr_k': 0.06057448763246147, 'slip_spread_k': 0.7506032822486419, 'spread_hl_frac': 0.004252204397232624, 'bb_std_mult': 1.9253307767906884, 'rsi_os': 38, 'rsi_ob': 78, 'vol_spike': 0.1436388021058789, 'adx_thresh': 22.933395834793114, 'atr_min_pct': 0.02874134851443438, 'atr_max_pct': 0.14591487575799822, 'tp_mult': 1.1256181159288643, 'tsl_mult': 0.7969064434082058, 'strategy': 'mean_reversion', 'time_stop': 237, 'use_sma': True, 'use_atr': False, 'use_adx': True, 'use_ema': True, 'use_spike': True, 'rsi_required': False, 'edge_k': 0.9565839984861971, 'edge_cap': 0.19860811252564875, 'bull_strategy': 'mean_reversion', 'bull_bb_std_mult': 3.2234171481164338, 'bull_rsi_os': 34, 'bull_rsi_ob': 93, 'bull_adx_thresh': 22.763324052010855, 'bull_atr_min_pct': 0.00859017147430427, 'bull_atr_max_pct': 0.12876065064138856, 'bull_tp_mult': 1.0626978597871735, 'bull_tsl_mult': 0.4731260201446438, 'bull_time_stop': 163, 'bull_use_sma': True, 'bull_use_ema': True, 'bull_use_atr': True, 'bull_use_adx': True, 'bull_use_spike': False, 'bull_rsi_required': True, 'bear_strategy': 'breakout', 'bear_bb_std_mult': 3.5999114409197657, 'bear_rsi_os': 28, 'bear_rsi_ob': 88, 'bear_adx_thresh': 21.164006259208385, 'bear_atr_min_pct': 0.012337623320451557, 'bear_atr_max_pct': 0.048149348291216615, 'bear_tp_mult': 2.341042648564792, 'bear_tsl_mult': 0.13248368056129634, 'bear_time_stop': 229, 'bear_use_sma': True, 'bear_use_ema': True, 'bear_use_atr': True, 'bear_use_adx': True, 'bear_use_spike': False, 'bear_rsi_required': True, 'sideways_strategy': 'breakout', 'sideways_bb_std_mult': 1.6663372725105539, 'sideways_rsi_os': 53, 'sideways_rsi_ob': 68, 'sideways_adx_thresh': 27.103603947304855, 'sideways_atr_min_pct': 0.029168031978419183, 'sideways_atr_max_pct': 0.055940307793227353, 'sideways_tp_mult': 2.7722402438923415, 'sideways_tsl_mult': 0.3034019435723593, 'sideways_time_stop': 177, 'sideways_use_sma': True, 'sideways_use_ema': False, 'sideways_use_atr': True, 'sideways_use_adx': True, 'sideways_use_spike': False, 'sideways_rsi_required': True}.
[I 2025-09-01 13:49:09,864] Trial 299 finished with values: [-1000000000.0, 1000000000.0] and parameters: {'p_sma': 20, 'p_std': 19, 'p_atr': 25, 'p_adx': 13, 'rsi_period': 36, 'ema1': 21, 'ema2': 43, 'slip_atr_k': 0.053511161505560206, 'slip_spread_k': 0.09097161911876123, 'spread_hl_frac': 0.004349620489330193, 'bb_std_mult': 1.896959407119332, 'rsi_os': 49, 'rsi_ob': 82, 'vol_spike': 0.2500936583036542, 'adx_thresh': 24.398826620624412, 'atr_min_pct': 0.022753927310167642, 'atr_max_pct': 0.1452385499768104, 'tp_mult': 1.1243799538544634, 'tsl_mult': 0.8049579822472724, 'strategy': 'mean_reversion', 'time_stop': 239, 'use_sma': True, 'use_atr': False, 'use_adx': False, 'use_ema': True, 'use_spike': True, 'rsi_required': False, 'edge_k': 0.8728582439607375, 'edge_cap': 0.19014619456576265, 'bull_strategy': 'breakout', 'bull_bb_std_mult': 3.2326381740314263, 'bull_rsi_os': 22, 'bull_rsi_ob': 80, 'bull_adx_thresh': 29.564162029634083, 'bull_atr_min_pct': 0.004054270743288465, 'bull_atr_max_pct': 0.046243159204442746, 'bull_tp_mult': 2.4156293482530673, 'bull_tsl_mult': 0.4796313380932984, 'bull_time_stop': 283, 'bull_use_sma': True, 'bull_use_ema': True, 'bull_use_atr': True, 'bull_use_adx': True, 'bull_use_spike': False, 'bull_rsi_required': True, 'bear_strategy': 'breakout', 'bear_bb_std_mult': 2.192150421088304, 'bear_rsi_os': 30, 'bear_rsi_ob': 87, 'bear_adx_thresh': 17.450689285411645, 'bear_atr_min_pct': 0.012245554664873128, 'bear_atr_max_pct': 0.051242749232481406, 'bear_tp_mult': 1.4918923748196602, 'bear_tsl_mult': 0.15527709897808514, 'bear_time_stop': 5, 'bear_use_sma': True, 'bear_use_ema': True, 'bear_use_atr': True, 'bear_use_adx': True, 'bear_use_spike': False, 'bear_rsi_required': True, 'sideways_strategy': 'breakout', 'sideways_bb_std_mult': 3.45471281790308, 'sideways_rsi_os': 54, 'sideways_rsi_ob': 53, 'sideways_adx_thresh': 27.236789018743952, 'sideways_atr_min_pct': 0.021475592796693022, 'sideways_atr_max_pct': 0.05324911494658048, 'sideways_tp_mult': 2.764131340938243, 'sideways_tsl_mult': 0.30819250062296605, 'sideways_time_stop': 293, 'sideways_use_sma': True, 'sideways_use_ema': False, 'sideways_use_atr': True, 'sideways_use_adx': True, 'sideways_use_spike': False, 'sideways_rsi_required': True}.
[I 2025-09-01 13:49:10,163] Trial 301 finished with values: [-1000000000.0, 1000000000.0] and parameters: {'p_sma': 36, 'p_std': 48, 'p_atr': 25, 'p_adx': 13, 'rsi_period': 62, 'ema1': 21, 'ema2': 43, 'slip_atr_k': 0.21962176927116528, 'slip_spread_k': 0.09461385532665616, 'spread_hl_frac': 0.004412120336703998, 'bb_std_mult': 1.919337916971443, 'rsi_os': 38, 'rsi_ob': 51, 'vol_spike': 0.2699486289703237, 'adx_thresh': 25.08568991114556, 'atr_min_pct': 0.022729812445877302, 'atr_max_pct': 0.11691278992807883, 'tp_mult': 2.9024715078064904, 'tsl_mult': 0.7975949562356296, 'strategy': 'mean_reversion', 'time_stop': 239, 'use_sma': True, 'use_atr': False, 'use_adx': False, 'use_ema': True, 'use_spike': True, 'rsi_required': False, 'edge_k': 0.8689817402452746, 'edge_cap': 0.31620376914444104, 'bull_strategy': 'mean_reversion', 'bull_bb_std_mult': 3.2506042907571064, 'bull_rsi_os': 27, 'bull_rsi_ob': 71, 'bull_adx_thresh': 23.69647683537136, 'bull_atr_min_pct': 0.027815501526096603, 'bull_atr_max_pct': 0.01835848921052833, 'bull_tp_mult': 2.8309444955101433, 'bull_tsl_mult': 0.3865425088531767, 'bull_time_stop': 276, 'bull_use_sma': True, 'bull_use_ema': True, 'bull_use_atr': True, 'bull_use_adx': True, 'bull_use_spike': False, 'bull_rsi_required': True, 'bear_strategy': 'breakout', 'bear_bb_std_mult': 2.2049908261109197, 'bear_rsi_os': 28, 'bear_rsi_ob': 60, 'bear_adx_thresh': 17.36999068975744, 'bear_atr_min_pct': 0.012487072087457321, 'bear_atr_max_pct': 0.03616124955857613, 'bear_tp_mult': 1.5043362589825118, 'bear_tsl_mult': 0.13332162800576125, 'bear_time_stop': 11, 'bear_use_sma': True, 'bear_use_ema': True, 'bear_use_atr': True, 'bear_use_adx': True, 'bear_use_spike': False, 'bear_rsi_required': True, 'sideways_strategy': 'breakout', 'sideways_bb_std_mult': 1.5267717061223163, 'sideways_rsi_os': 53, 'sideways_rsi_ob': 62, 'sideways_adx_thresh': 7.053304144491428, 'sideways_atr_min_pct': 0.003967438139209866, 'sideways_atr_max_pct': 0.05588751530269085, 'sideways_tp_mult': 2.114850712652255, 'sideways_tsl_mult': 0.3067168169749281, 'sideways_time_stop': 100, 'sideways_use_sma': True, 'sideways_use_ema': False, 'sideways_use_atr': True, 'sideways_use_adx': True, 'sideways_use_spike': False, 'sideways_rsi_required': True}.
[I 2025-09-01 13:49:10,783] Trial 306 finished with values: [-1000000000.0, 1000000000.0] and parameters: {'p_sma': 35, 'p_std': 60, 'p_atr': 17, 'p_adx': 27, 'rsi_period': 31, 'ema1': 22, 'ema2': 25, 'slip_atr_k': 0.22147658841290158, 'slip_spread_k': 0.0682151583223808, 'spread_hl_frac': 0.03781270718091189, 'bb_std_mult': 3.1772605952768744, 'rsi_os': 55, 'rsi_ob': 84, 'vol_spike': 0.001482096885535522, 'adx_thresh': 25.108921441847023, 'atr_min_pct': 0.027807394785537384, 'atr_max_pct': 0.13635528582396753, 'tp_mult': 2.142002714091003, 'tsl_mult': 0.7347511477899153, 'strategy': 'mean_reversion', 'time_stop': 283, 'use_sma': False, 'use_atr': False, 'use_adx': False, 'use_ema': False, 'use_spike': True, 'rsi_required': False, 'edge_k': 0.9095909391437498, 'edge_cap': 0.315202177948761, 'bull_strategy': 'breakout', 'bull_bb_std_mult': 3.348528582600916, 'bull_rsi_os': 16, 'bull_rsi_ob': 73, 'bull_adx_thresh': 24.729460786989122, 'bull_atr_min_pct': 0.022434660673505833, 'bull_atr_max_pct': 0.027404557505743127, 'bull_tp_mult': 2.8160039016483833, 'bull_tsl_mult': 0.670564917424892, 'bull_time_stop': 88, 'bull_use_sma': True, 'bull_use_ema': False, 'bull_use_atr': False, 'bull_use_adx': False, 'bull_use_spike': False, 'bull_rsi_required': False, 'bear_strategy': 'breakout', 'bear_bb_std_mult': 1.8476274465527984, 'bear_rsi_os': 32, 'bear_rsi_ob': 54, 'bear_adx_thresh': 11.123340808315929, 'bear_atr_min_pct': 0.011412824291875423, 'bear_atr_max_pct': 0.04079301795040669, 'bear_tp_mult': 2.2156718817027796, 'bear_tsl_mult': 0.21153117611594813, 'bear_time_stop': 52, 'bear_use_sma': False, 'bear_use_ema': True, 'bear_use_atr': True, 'bear_use_adx': True, 'bear_use_spike': True, 'bear_rsi_required': True, 'sideways_strategy': 'breakout', 'sideways_bb_std_mult': 1.7801366211473684, 'sideways_rsi_os': 49, 'sideways_rsi_ob': 80, 'sideways_adx_thresh': 8.81483045287371, 'sideways_atr_min_pct': 0.026757149300599907, 'sideways_atr_max_pct': 0.013551399588916116, 'sideways_tp_mult': 2.711048746778804, 'sideways_tsl_mult': 0.24236831127356917, 'sideways_time_stop': 163, 'sideways_use_sma': True, 'sideways_use_ema': True, 'sideways_use_atr': False, 'sideways_use_adx': True, 'sideways_use_spike': False, 'sideways_rsi_required': False}.
[I 2025-09-01 13:49:10,973] Trial 308 finished with values: [-1000000000.0, 1000000000.0] and parameters: {'p_sma': 12, 'p_std': 12, 'p_atr': 9, 'p_adx': 12, 'rsi_period': 24, 'ema1': 22, 'ema2': 48, 'slip_atr_k': 0.18346540966544517, 'slip_spread_k': 0.5717341754957382, 'spread_hl_frac': 0.03269254908343556, 'bb_std_mult': 3.485928226909765, 'rsi_os': 34, 'rsi_ob': 46, 'vol_spike': 0.17950571154256278, 'adx_thresh': 25.91331436911003, 'atr_min_pct': 0.024962557783113386, 'atr_max_pct': 0.13570257657253687, 'tp_mult': 2.623299012100901, 'tsl_mult': 0.6917236505431217, 'strategy': 'mean_reversion', 'time_stop': 230, 'use_sma': True, 'use_atr': False, 'use_adx': True, 'use_ema': True, 'use_spike': True, 'rsi_required': False, 'edge_k': 0.13856824014731173, 'edge_cap': 0.5726057546673421, 'bull_strategy': 'breakout', 'bull_bb_std_mult': 3.124418933245728, 'bull_rsi_os': 9, 'bull_rsi_ob': 55, 'bull_adx_thresh': 27.771008748917495, 'bull_atr_min_pct': 0.01164344195554508, 'bull_atr_max_pct': 0.021553759505469908, 'bull_tp_mult': 2.873221593835179, 'bull_tsl_mult': 0.4158842775239089, 'bull_time_stop': 104, 'bull_use_sma': True, 'bull_use_ema': True, 'bull_use_atr': True, 'bull_use_adx': True, 'bull_use_spike': False, 'bull_rsi_required': True, 'bear_strategy': 'breakout', 'bear_bb_std_mult': 3.5103107601862367, 'bear_rsi_os': 48, 'bear_rsi_ob': 91, 'bear_adx_thresh': 12.147200801686825, 'bear_atr_min_pct': 0.014110649623212665, 'bear_atr_max_pct': 0.04774661118113197, 'bear_tp_mult': 2.7711679733993337, 'bear_tsl_mult': 0.17687662052950065, 'bear_time_stop': 208, 'bear_use_sma': True, 'bear_use_ema': True, 'bear_use_atr': True, 'bear_use_adx': True, 'bear_use_spike': False, 'bear_rsi_required': True, 'sideways_strategy': 'breakout', 'sideways_bb_std_mult': 3.120711777832707, 'sideways_rsi_os': 51, 'sideways_rsi_ob': 78, 'sideways_adx_thresh': 25.36280426684121, 'sideways_atr_min_pct': 0.019716358382997373, 'sideways_atr_max_pct': 0.06527774843296366, 'sideways_tp_mult': 2.6542909477782906, 'sideways_tsl_mult': 0.2869189249776069, 'sideways_time_stop': 168, 'sideways_use_sma': True, 'sideways_use_ema': True, 'sideways_use_atr': True, 'sideways_use_adx': True, 'sideways_use_spike': False, 'sideways_rsi_required': True}.
