[I 2025-09-01 15:14:22,125] Trial 875 finished with values: [-1000000000.0, 1000000000.0] and parameters: {'p_sma': 32, 'p_std': 50, 'p_atr': 25, 'p_adx': 13, 'rsi_period': 62, 'ema1': 13, 'ema2': 27, 'slip_atr_k': 0.0966615344042361, 'slip_spread_k': 0.12380590533763107, 'spread_hl_frac': 0.015872177081856034, 'bb_std_mult': 1.8161850940820194, 'rsi_os': 52, 'rsi_ob': 82, 'vol_spike': 0.22405636231808937, 'adx_thresh': 25.320622369640184, 'atr_min_pct': 0.025903434144488906, 'atr_max_pct': 0.14190874717539592, 'tp_mult': 1.1196175212823132, 'tsl_mult': 0.785704712177292, 'strategy': 'mean_reversion', 'time_stop': 246, 'use_sma': False, 'use_atr': True, 'use_adx': True, 'use_ema': True, 'use_spike': False, 'rsi_required': False, 'edge_k': 1.898411616534693, 'edge_cap': 0.32481140840886713, 'bull_strategy': 'breakout', 'bull_bb_std_mult': 3.2822697031476626, 'bull_rsi_os': 41, 'bull_rsi_ob': 58, 'bull_adx_thresh': 26.52671525550057, 'bull_atr_min_pct': 0.006014115178268073, 'bull_atr_max_pct': 0.03264764661864313, 'bull_tp_mult': 2.9365292578858444, 'bull_tsl_mult': 0.28628859041014854, 'bull_time_stop': 97, 'bull_use_sma': False, 'bull_use_ema': True, 'bull_use_atr': False, 'bull_use_adx': False, 'bull_use_spike': True, 'bull_rsi_required': True, 'bear_strategy': 'breakout', 'bear_bb_std_mult': 3.4328590652150446, 'bear_rsi_os': 36, 'bear_rsi_ob': 92, 'bear_adx_thresh': 12.893813887659865, 'bear_atr_min_pct': 2.3962977747968295e-05, 'bear_atr_max_pct': 0.04915492320102137, 'bear_tp_mult': 1.5040707101953918, 'bear_tsl_mult': 0.1253275937603104, 'bear_time_stop': 197, 'bear_use_sma': True, 'bear_use_ema': True, 'bear_use_atr': True, 'bear_use_adx': True, 'bear_use_spike': True, 'bear_rsi_required': False, 'sideways_strategy': 'breakout', 'sideways_bb_std_mult': 1.440118696506052, 'sideways_rsi_os': 14, 'sideways_rsi_ob': 65, 'sideways_adx_thresh': 7.321518065632274, 'sideways_atr_min_pct': 0.020644864901016607, 'sideways_atr_max_pct': 0.06312603712178294, 'sideways_tp_mult': 2.3838523981012845, 'sideways_tsl_mult': 0.26557360530314433, 'sideways_time_stop': 169, 'sideways_use_sma': False, 'sideways_use_ema': True, 'sideways_use_atr': False, 'sideways_use_adx': False, 'sideways_use_spike': True, 'sideways_rsi_required': False}.
[I 2025-09-01 15:14:58,758] Trial 873 finished with values: [-1000000000.0, 1000000000.0] and parameters: {'p_sma': 27, 'p_std': 47, 'p_atr': 25, 'p_adx': 13, 'rsi_period': 55, 'ema1': 22, 'ema2': 17, 'slip_atr_k': 0.1030682339657523, 'slip_spread_k': 0.12548070040552978, 'spread_hl_frac': 0.021264769651053846, 'bb_std_mult': 1.584433492899542, 'rsi_os': 37, 'rsi_ob': 83, 'vol_spike': 0.27577166912441176, 'adx_thresh': 18.446795750578406, 'atr_min_pct': 0.008098826369355872, 'atr_max_pct': 0.14112956068246146, 'tp_mult': 1.1172974177439665, 'tsl_mult': 0.7793294712122621, 'strategy': 'mean_reversion', 'time_stop': 282, 'use_sma': False, 'use_atr': False, 'use_adx': True, 'use_ema': True, 'use_spike': True, 'rsi_required': False, 'edge_k': 1.6480200526718929, 'edge_cap': 0.5562413840034317, 'bull_strategy': 'breakout', 'bull_bb_std_mult': 3.312744973300279, 'bull_rsi_os': 37, 'bull_rsi_ob': 68, 'bull_adx_thresh': 33.75851125028754, 'bull_atr_min_pct': 0.0029613629023106584, 'bull_atr_max_pct': 0.02802964396166097, 'bull_tp_mult': 1.5377355226224458, 'bull_tsl_mult': 0.449662834515455, 'bull_time_stop': 101, 'bull_use_sma': True, 'bull_use_ema': True, 'bull_use_atr': False, 'bull_use_adx': True, 'bull_use_spike': False, 'bull_rsi_required': True, 'bear_strategy': 'breakout', 'bear_bb_std_mult': 3.504605086974458, 'bear_rsi_os': 33, 'bear_rsi_ob': 62, 'bear_adx_thresh': 14.503998946372143, 'bear_atr_min_pct': 0.021854410514056982, 'bear_atr_max_pct': 0.04865403406653018, 'bear_tp_mult': 2.431675801113179, 'bear_tsl_mult': 0.2844846820065721, 'bear_time_stop': 214, 'bear_use_sma': True, 'bear_use_ema': True, 'bear_use_atr': True, 'bear_use_adx': True, 'bear_use_spike': False, 'bear_rsi_required': True, 'sideways_strategy': 'breakout', 'sideways_bb_std_mult': 1.6217210033414082, 'sideways_rsi_os': 14, 'sideways_rsi_ob': 65, 'sideways_adx_thresh': 7.3223584759070155, 'sideways_atr_min_pct': 0.013134643350454146, 'sideways_atr_max_pct': 0.06259355146404887, 'sideways_tp_mult': 2.6936183777708838, 'sideways_tsl_mult': 0.23391930150006357, 'sideways_time_stop': 233, 'sideways_use_sma': True, 'sideways_use_ema': False, 'sideways_use_atr': True, 'sideways_use_adx': False, 'sideways_use_spike': True, 'sideways_rsi_required': True}.
[I 2025-09-01 15:14:58,760] Trial 874 finished with values: [-1000000000.0, 1000000000.0] and parameters: {'p_sma': 31, 'p_std': 50, 'p_atr': 25, 'p_adx': 9, 'rsi_period': 69, 'ema1': 8, 'ema2': 17, 'slip_atr_k': 0.2295858399534481, 'slip_spread_k': 0.3935502628361998, 'spread_hl_frac': 0.02392211905762652, 'bb_std_mult': 1.8980161364523565, 'rsi_os': 6, 'rsi_ob': 82, 'vol_spike': 0.22264468009343938, 'adx_thresh': 14.822549312411857, 'atr_min_pct': 0.02683659921457874, 'atr_max_pct': 0.0795742619807166, 'tp_mult': 1.1207560297043102, 'tsl_mult': 0.16489574030457393, 'strategy': 'mean_reversion', 'time_stop': 244, 'use_sma': False, 'use_atr': False, 'use_adx': True, 'use_ema': True, 'use_spike': True, 'rsi_required': False, 'edge_k': 1.0313884808772928, 'edge_cap': 0.32351673139067505, 'bull_strategy': 'breakout', 'bull_bb_std_mult': 2.14025760347213, 'bull_rsi_os': 6, 'bull_rsi_ob': 56, 'bull_adx_thresh': 26.41369512636507, 'bull_atr_min_pct': 0.004331865973981135, 'bull_atr_max_pct': 0.021403577775007905, 'bull_tp_mult': 1.5343997805101541, 'bull_tsl_mult': 0.28339339484744447, 'bull_time_stop': 100, 'bull_use_sma': True, 'bull_use_ema': True, 'bull_use_atr': False, 'bull_use_adx': False, 'bull_use_spike': False, 'bull_rsi_required': True, 'bear_strategy': 'breakout', 'bear_bb_std_mult': 3.52202661477663, 'bear_rsi_os': 36, 'bear_rsi_ob': 85, 'bear_adx_thresh': 12.518927910247573, 'bear_atr_min_pct': 0.021345424997266837, 'bear_atr_max_pct': 0.07932210186533323, 'bear_tp_mult': 1.491799604716899, 'bear_tsl_mult': 0.0983328116321544, 'bear_time_stop': 200, 'bear_use_sma': True, 'bear_use_ema': True, 'bear_use_atr': True, 'bear_use_adx': True, 'bear_use_spike': False, 'bear_rsi_required': True, 'sideways_strategy': 'breakout', 'sideways_bb_std_mult': 2.795233881682288, 'sideways_rsi_os': 54, 'sideways_rsi_ob': 65, 'sideways_adx_thresh': 7.392996251549296, 'sideways_atr_min_pct': 0.019272577845245255, 'sideways_atr_max_pct': 0.061752189369670106, 'sideways_tp_mult': 2.6906160820964597, 'sideways_tsl_mult': 0.23384562032635112, 'sideways_time_stop': 170, 'sideways_use_sma': True, 'sideways_use_ema': False, 'sideways_use_atr': True, 'sideways_use_adx': False, 'sideways_use_spike': True, 'sideways_rsi_required': True}.
[I 2025-09-01 15:15:02,556] Trial 877 finished with values: [-1000000000.0, 1000000000.0] and parameters: {'p_sma': 37, 'p_std': 49, 'p_atr': 24, 'p_adx': 10, 'rsi_period': 66, 'ema1': 22, 'ema2': 48, 'slip_atr_k': 0.21086570563005896, 'slip_spread_k': 0.036512079927248815, 'spread_hl_frac': 0.023959341180288227, 'bb_std_mult': 1.8356806416496143, 'rsi_os': 30, 'rsi_ob': 83, 'vol_spike': 0.253595297884598, 'adx_thresh': 28.67899244432126, 'atr_min_pct': 0.005551153331163383, 'atr_max_pct': 0.13079324620593544, 'tp_mult': 1.0455209917632895, 'tsl_mult': 0.5555132689395739, 'strategy': 'mean_reversion', 'time_stop': 242, 'use_sma': False, 'use_atr': False, 'use_adx': False, 'use_ema': True, 'use_spike': True, 'rsi_required': False, 'edge_k': 0.9300432098161769, 'edge_cap': 0.6611986746896406, 'bull_strategy': 'breakout', 'bull_bb_std_mult': 1.5053522256965033, 'bull_rsi_os': 36, 'bull_rsi_ob': 80, 'bull_adx_thresh': 33.554631683785765, 'bull_atr_min_pct': 0.018055335932287236, 'bull_atr_max_pct': 0.04164853985902022, 'bull_tp_mult': 2.846490266572554, 'bull_tsl_mult': 0.1810490977470519, 'bull_time_stop': 33, 'bull_use_sma': True, 'bull_use_ema': True, 'bull_use_atr': False, 'bull_use_adx': False, 'bull_use_spike': False, 'bull_rsi_required': True, 'bear_strategy': 'breakout', 'bear_bb_std_mult': 3.5134350758609503, 'bear_rsi_os': 32, 'bear_rsi_ob': 87, 'bear_adx_thresh': 11.156135530948438, 'bear_atr_min_pct': 0.0012625790043053688, 'bear_atr_max_pct': 0.0403973537505296, 'bear_tp_mult': 2.420869941972719, 'bear_tsl_mult': 0.10567144141453488, 'bear_time_stop': 219, 'bear_use_sma': False, 'bear_use_ema': True, 'bear_use_atr': True, 'bear_use_adx': True, 'bear_use_spike': False, 'bear_rsi_required': True, 'sideways_strategy': 'breakout', 'sideways_bb_std_mult': 1.5955691230697744, 'sideways_rsi_os': 54, 'sideways_rsi_ob': 69, 'sideways_adx_thresh': 29.61219917591316, 'sideways_atr_min_pct': 0.01984977765904854, 'sideways_atr_max_pct': 0.06580980974425635, 'sideways_tp_mult': 2.8927267354415744, 'sideways_tsl_mult': 0.22851102213172075, 'sideways_time_stop': 223, 'sideways_use_sma': True, 'sideways_use_ema': False, 'sideways_use_atr': True, 'sideways_use_adx': False, 'sideways_use_spike': True, 'sideways_rsi_required': True}.
[I 2025-09-01 15:15:02,993] Trial 876 finished with values: [-1000000000.0, 1000000000.0] and parameters: {'p_sma': 27, 'p_std': 50, 'p_atr': 24, 'p_adx': 9, 'rsi_period': 62, 'ema1': 21, 'ema2': 44, 'slip_atr_k': 0.20944328197561296, 'slip_spread_k': 0.12663648921218962, 'spread_hl_frac': 0.048048574587228055, 'bb_std_mult': 0.8435828545129183, 'rsi_os': 37, 'rsi_ob': 82, 'vol_spike': 0.05437848116336673, 'adx_thresh': 25.30556147181562, 'atr_min_pct': 0.025868987763555347, 'atr_max_pct': 0.12997738477267318, 'tp_mult': 1.051769555383941, 'tsl_mult': 0.9591271044535035, 'strategy': 'mean_reversion', 'time_stop': 242, 'use_sma': False, 'use_atr': True, 'use_adx': True, 'use_ema': True, 'use_spike': False, 'rsi_required': False, 'edge_k': 1.8205017339109144, 'edge_cap': 0.6580238848242033, 'bull_strategy': 'breakout', 'bull_bb_std_mult': 1.3494128725968269, 'bull_rsi_os': 6, 'bull_rsi_ob': 80, 'bull_adx_thresh': 26.59931759788605, 'bull_atr_min_pct': 0.018076718065890663, 'bull_atr_max_pct': 0.04383827768445209, 'bull_tp_mult': 2.7233889807869165, 'bull_tsl_mult': 0.2804965780465644, 'bull_time_stop': 47, 'bull_use_sma': False, 'bull_use_ema': True, 'bull_use_atr': False, 'bull_use_adx': False, 'bull_use_spike': True, 'bull_rsi_required': True, 'bear_strategy': 'breakout', 'bear_bb_std_mult': 3.498738870749077, 'bear_rsi_os': 20, 'bear_rsi_ob': 86, 'bear_adx_thresh': 13.035658136496197, 'bear_atr_min_pct': 0.0012959315609769647, 'bear_atr_max_pct': 0.10283319726345605, 'bear_tp_mult': 1.90182335298498, 'bear_tsl_mult': 0.13066728695113622, 'bear_time_stop': 215, 'bear_use_sma': False, 'bear_use_ema': True, 'bear_use_atr': True, 'bear_use_adx': True, 'bear_use_spike': True, 'bear_rsi_required': False, 'sideways_strategy': 'breakout', 'sideways_bb_std_mult': 1.4507173341186876, 'sideways_rsi_os': 54, 'sideways_rsi_ob': 69, 'sideways_adx_thresh': 21.97722302392459, 'sideways_atr_min_pct': 0.02320723798699162, 'sideways_atr_max_pct': 0.06628168259963883, 'sideways_tp_mult': 2.807550330719921, 'sideways_tsl_mult': 0.26370760207157373, 'sideways_time_stop': 277, 'sideways_use_sma': False, 'sideways_use_ema': True, 'sideways_use_atr': False, 'sideways_use_adx': False, 'sideways_use_spike': True, 'sideways_rsi_required': False}.
[I 2025-09-01 15:15:38,768] Trial 881 finished with values: [-1000000000.0, 1000000000.0] and parameters: {'p_sma': 56, 'p_std': 10, 'p_atr': 26, 'p_adx': 26, 'rsi_period': 67, 'ema1': 14, 'ema2': 13, 'slip_atr_k': 0.14671432937484397, 'slip_spread_k': 0.26892816108549744, 'spread_hl_frac': 0.029760894023463998, 'bb_std_mult': 1.7560888215298265, 'rsi_os': 8, 'rsi_ob': 81, 'vol_spike': 0.23836108327857386, 'adx_thresh': 34.27375993695871, 'atr_min_pct': 0.027675350634894617, 'atr_max_pct': 0.12011593839835821, 'tp_mult': 1.7998353894044954, 'tsl_mult': 0.05154075316602863, 'strategy': 'breakout', 'time_stop': 177, 'use_sma': True, 'use_atr': False, 'use_adx': False, 'use_ema': True, 'use_spike': True, 'rsi_required': True, 'edge_k': 0.5609638523225264, 'edge_cap': 0.4031088575972338, 'bull_strategy': 'mean_reversion', 'bull_bb_std_mult': 1.009616791549406, 'bull_rsi_os': 28, 'bull_rsi_ob': 69, 'bull_adx_thresh': 29.930663281806567, 'bull_atr_min_pct': 0.004121284801710385, 'bull_atr_max_pct': 0.019990577978049706, 'bull_tp_mult': 2.7471317916461, 'bull_tsl_mult': 0.09094100156990853, 'bull_time_stop': 113, 'bull_use_sma': True, 'bull_use_ema': False, 'bull_use_atr': True, 'bull_use_adx': True, 'bull_use_spike': False, 'bull_rsi_required': False, 'bear_strategy': 'mean_reversion', 'bear_bb_std_mult': 3.597964836330095, 'bear_rsi_os': 29, 'bear_rsi_ob': 89, 'bear_adx_thresh': 12.037532956510063, 'bear_atr_min_pct': 0.0027279777273057993, 'bear_atr_max_pct': 0.12487691635737093, 'bear_tp_mult': 1.1499968695704899, 'bear_tsl_mult': 0.1694390398732717, 'bear_time_stop': 142, 'bear_use_sma': True, 'bear_use_ema': False, 'bear_use_atr': False, 'bear_use_adx': False, 'bear_use_spike': False, 'bear_rsi_required': True, 'sideways_strategy': 'mean_reversion', 'sideways_bb_std_mult': 1.7706960010549049, 'sideways_rsi_os': 51, 'sideways_rsi_ob': 64, 'sideways_adx_thresh': 19.99006465193877, 'sideways_atr_min_pct': 0.016355169850931515, 'sideways_atr_max_pct': 0.058464136245125545, 'sideways_tp_mult': 1.9486743314233341, 'sideways_tsl_mult': 0.3194974076861077, 'sideways_time_stop': 177, 'sideways_use_sma': True, 'sideways_use_ema': False, 'sideways_use_atr': True, 'sideways_use_adx': True, 'sideways_use_spike': False, 'sideways_rsi_required': True}.
[I 2025-09-01 15:15:39,919] Trial 880 finished with values: [-1000000000.0, 1000000000.0] and parameters: {'p_sma': 35, 'p_std': 10, 'p_atr': 10, 'p_adx': 12, 'rsi_period': 63, 'ema1': 12, 'ema2': 45, 'slip_atr_k': 0.1609326692383036, 'slip_spread_k': 0.09816116876089262, 'spread_hl_frac': 0.03346006648843511, 'bb_std_mult': 1.606367929987141, 'rsi_os': 38, 'rsi_ob': 81, 'vol_spike': 0.21188667259845229, 'adx_thresh': 26.34475468874483, 'atr_min_pct': 0.022815332403531525, 'atr_max_pct': 0.13545287561426092, 'tp_mult': 1.7884783250266711, 'tsl_mult': 0.7522088771284198, 'strategy': 'breakout', 'time_stop': 158, 'use_sma': True, 'use_atr': True, 'use_adx': False, 'use_ema': True, 'use_spike': False, 'rsi_required': True, 'edge_k': 0.5514877419256974, 'edge_cap': 0.4028380000611269, 'bull_strategy': 'mean_reversion', 'bull_bb_std_mult': 3.3627532562785785, 'bull_rsi_os': 29, 'bull_rsi_ob': 76, 'bull_adx_thresh': 13.875750042173417, 'bull_atr_min_pct': 0.00433237173785661, 'bull_atr_max_pct': 0.11274324807892089, 'bull_tp_mult': 2.7258642859767876, 'bull_tsl_mult': 0.048114569200595425, 'bull_time_stop': 145, 'bull_use_sma': False, 'bull_use_ema': False, 'bull_use_atr': True, 'bull_use_adx': True, 'bull_use_spike': True, 'bull_rsi_required': False, 'bear_strategy': 'breakout', 'bear_bb_std_mult': 3.59814396795814, 'bear_rsi_os': 20, 'bear_rsi_ob': 89, 'bear_adx_thresh': 8.00128243185665, 'bear_atr_min_pct': 0.00271716502177611, 'bear_atr_max_pct': 0.04657199796615322, 'bear_tp_mult': 2.219814636648609, 'bear_tsl_mult': 0.16973853583571147, 'bear_time_stop': 233, 'bear_use_sma': False, 'bear_use_ema': False, 'bear_use_atr': False, 'bear_use_adx': True, 'bear_use_spike': True, 'bear_rsi_required': False, 'sideways_strategy': 'mean_reversion', 'sideways_bb_std_mult': 1.8051859343108005, 'sideways_rsi_os': 35, 'sideways_rsi_ob': 68, 'sideways_adx_thresh': 13.432013739038178, 'sideways_atr_min_pct': 0.02330080237350995, 'sideways_atr_max_pct': 0.06659505285887131, 'sideways_tp_mult': 2.7996565104507467, 'sideways_tsl_mult': 0.31226410885452227, 'sideways_time_stop': 177, 'sideways_use_sma': False, 'sideways_use_ema': True, 'sideways_use_atr': False, 'sideways_use_adx': True, 'sideways_use_spike': False, 'sideways_rsi_required': False}.
[I 2025-09-01 15:15:40,104] Trial 878 finished with values: [-0.0892878882494319, 0.08912326558106314] and parameters: {'p_sma': 56, 'p_std': 12, 'p_atr': 24, 'p_adx': 26, 'rsi_period': 31, 'ema1': 23, 'ema2': 52, 'slip_atr_k': 0.013603170159208014, 'slip_spread_k': 0.03639493482196932, 'spread_hl_frac': 0.040613221924524726, 'bb_std_mult': 3.596105482721039, 'rsi_os': 39, 'rsi_ob': 95, 'vol_spike': 0.2537316193100158, 'adx_thresh': 26.523463213762486, 'atr_min_pct': 0.027390678614707398, 'atr_max_pct': 0.13027202777831068, 'tp_mult': 1.0407705902871425, 'tsl_mult': 0.9687125765817299, 'strategy': 'breakout', 'time_stop': 156, 'use_sma': True, 'use_atr': True, 'use_adx': False, 'use_ema': True, 'use_spike': False, 'rsi_required': True, 'edge_k': 1.5955441253647837, 'edge_cap': 0.7605612872772283, 'bull_strategy': 'mean_reversion', 'bull_bb_std_mult': 1.3707322623177385, 'bull_rsi_os': 29, 'bull_rsi_ob': 57, 'bull_adx_thresh': 29.573264514145713, 'bull_atr_min_pct': 0.000545945746984286, 'bull_atr_max_pct': 0.017161683353102947, 'bull_tp_mult': 2.729477251187546, 'bull_tsl_mult': 0.18050329253788855, 'bull_time_stop': 108, 'bull_use_sma': False, 'bull_use_ema': False, 'bull_use_atr': True, 'bull_use_adx': True, 'bull_use_spike': True, 'bull_rsi_required': False, 'bear_strategy': 'breakout', 'bear_bb_std_mult': 3.5497298735524607, 'bear_rsi_os': 32, 'bear_rsi_ob': 93, 'bear_adx_thresh': 11.235040123801028, 'bear_atr_min_pct': 0.0014035152313367357, 'bear_atr_max_pct': 0.019136370614338635, 'bear_tp_mult': 2.189912651027923, 'bear_tsl_mult': 0.5623679157378652, 'bear_time_stop': 214, 'bear_use_sma': False, 'bear_use_ema': False, 'bear_use_atr': False, 'bear_use_adx': True, 'bear_use_spike': True, 'bear_rsi_required': False, 'sideways_strategy': 'breakout', 'sideways_bb_std_mult': 1.7755416490194076, 'sideways_rsi_os': 32, 'sideways_rsi_ob': 69, 'sideways_adx_thresh': 22.039717319407615, 'sideways_atr_min_pct': 0.008217130115861608, 'sideways_atr_max_pct': 0.06641916022504361, 'sideways_tp_mult': 2.892607527284815, 'sideways_tsl_mult': 0.32569189111301, 'sideways_time_stop': 177, 'sideways_use_sma': False, 'sideways_use_ema': True, 'sideways_use_atr': False, 'sideways_use_adx': True, 'sideways_use_spike': False, 'sideways_rsi_required': False}.
