[I 2025-09-01 13:52:23,784] Trial 324 finished with values: [-1000000000.0, 1000000000.0] and parameters: {'p_sma': 36, 'p_std': 48, 'p_atr': 13, 'p_adx': 28, 'rsi_period': 63, 'ema1': 17, 'ema2': 17, 'slip_atr_k': 0.07492645385633637, 'slip_spread_k': 0.23150841195100447, 'spread_hl_frac': 0.035736915664726865, 'bb_std_mult': 1.7590298560265938, 'rsi_os': 29, 'rsi_ob': 81, 'vol_spike': 0.12608664002663397, 'adx_thresh': 18.522768681086617, 'atr_min_pct': 0.02719636926421594, 'atr_max_pct': 0.11156551412556277, 'tp_mult': 1.0504292097373442, 'tsl_mult': 0.7633246989307049, 'strategy': 'mean_reversion', 'time_stop': 224, 'use_sma': True, 'use_atr': False, 'use_adx': False, 'use_ema': False, 'use_spike': True, 'rsi_required': False, 'edge_k': 1.0144977444528898, 'edge_cap': 0.3814719432447571, 'bull_strategy': 'breakout', 'bull_bb_std_mult': 3.2085838516723455, 'bull_rsi_os': 33, 'bull_rsi_ob': 84, 'bull_adx_thresh': 19.76633472994727, 'bull_atr_min_pct': 0.004412144899143275, 'bull_atr_max_pct': 0.03126403274941886, 'bull_tp_mult': 2.6597250241689636, 'bull_tsl_mult': 0.4166225019783036, 'bull_time_stop': 106, 'bull_use_sma': True, 'bull_use_ema': False, 'bull_use_atr': True, 'bull_use_adx': False, 'bull_use_spike': False, 'bull_rsi_required': False, 'bear_strategy': 'breakout', 'bear_bb_std_mult': 1.3882000620097386, 'bear_rsi_os': 25, 'bear_rsi_ob': 47, 'bear_adx_thresh': 13.027211721235878, 'bear_atr_min_pct': 0.0008092735715718919, 'bear_atr_max_pct': 0.038907202225742295, 'bear_tp_mult': 2.3399909749712364, 'bear_tsl_mult': 0.06714776320924028, 'bear_time_stop': 227, 'bear_use_sma': True, 'bear_use_ema': True, 'bear_use_atr': True, 'bear_use_adx': True, 'bear_use_spike': True, 'bear_rsi_required': True, 'sideways_strategy': 'breakout', 'sideways_bb_std_mult': 1.6132292941681827, 'sideways_rsi_os': 48, 'sideways_rsi_ob': 45, 'sideways_adx_thresh': 23.998820973329778, 'sideways_atr_min_pct': 0.019831462234347463, 'sideways_atr_max_pct': 0.06427809482910718, 'sideways_tp_mult': 2.791650681513972, 'sideways_tsl_mult': 0.28394608634998564, 'sideways_time_stop': 131, 'sideways_use_sma': True, 'sideways_use_ema': True, 'sideways_use_atr': False, 'sideways_use_adx': True, 'sideways_use_spike': False, 'sideways_rsi_required': False}.
[I 2025-09-01 13:52:23,930] Trial 322 finished with values: [-0.014620183880734272, 0.015387701830812619] and parameters: {'p_sma': 36, 'p_std': 39, 'p_atr': 25, 'p_adx': 12, 'rsi_period': 65, 'ema1': 21, 'ema2': 17, 'slip_atr_k': 6.806408237711864e-05, 'slip_spread_k': 0.07375119601173556, 'spread_hl_frac': 0.005148973994838081, 'bb_std_mult': 1.5372869990770985, 'rsi_os': 29, 'rsi_ob': 81, 'vol_spike': 0.12647293712828186, 'adx_thresh': 31.55009142396512, 'atr_min_pct': 0.02698877605452739, 'atr_max_pct': 0.0657278027206072, 'tp_mult': 2.7176163784696996, 'tsl_mult': 0.7622071683831936, 'strategy': 'mean_reversion', 'time_stop': 224, 'use_sma': True, 'use_atr': False, 'use_adx': False, 'use_ema': False, 'use_spike': True, 'rsi_required': False, 'edge_k': 1.0144301878533142, 'edge_cap': 0.37399330745396503, 'bull_strategy': 'breakout', 'bull_bb_std_mult': 3.1853751303836066, 'bull_rsi_os': 32, 'bull_rsi_ob': 84, 'bull_adx_thresh': 13.241035201913967, 'bull_atr_min_pct': 0.003784605322301376, 'bull_atr_max_pct': 0.023007487001795626, 'bull_tp_mult': 2.7932764576019338, 'bull_tsl_mult': 0.7154522946332987, 'bull_time_stop': 103, 'bull_use_sma': True, 'bull_use_ema': True, 'bull_use_atr': True, 'bull_use_adx': True, 'bull_use_spike': False, 'bull_rsi_required': False, 'bear_strategy': 'breakout', 'bear_bb_std_mult': 3.3293016730480613, 'bear_rsi_os': 6, 'bear_rsi_ob': 62, 'bear_adx_thresh': 13.159527852661821, 'bear_atr_min_pct': 0.016136567991517945, 'bear_atr_max_pct': 0.03860070721717259, 'bear_tp_mult': 1.8357534428312627, 'bear_tsl_mult': 0.7168104323740442, 'bear_time_stop': 229, 'bear_use_sma': True, 'bear_use_ema': True, 'bear_use_atr': True, 'bear_use_adx': True, 'bear_use_spike': False, 'bear_rsi_required': True, 'sideways_strategy': 'breakout', 'sideways_bb_std_mult': 1.625413115426164, 'sideways_rsi_os': 48, 'sideways_rsi_ob': 56, 'sideways_adx_thresh': 32.30779222825241, 'sideways_atr_min_pct': 0.003391358482260515, 'sideways_atr_max_pct': 0.06435642708150827, 'sideways_tp_mult': 2.861311697867537, 'sideways_tsl_mult': 0.28554837048724435, 'sideways_time_stop': 81, 'sideways_use_sma': True, 'sideways_use_ema': True, 'sideways_use_atr': True, 'sideways_use_adx': True, 'sideways_use_spike': False, 'sideways_rsi_required': False}.
[I 2025-09-01 13:52:24,563] Trial 328 finished with values: [-1000000000.0, 1000000000.0] and parameters: {'p_sma': 36, 'p_std': 47, 'p_atr': 24, 'p_adx': 13, 'rsi_period': 58, 'ema1': 15, 'ema2': 19, 'slip_atr_k': 0.005966293226286457, 'slip_spread_k': 0.04808273703401625, 'spread_hl_frac': 0.005209119046532255, 'bb_std_mult': 3.33839131528343, 'rsi_os': 51, 'rsi_ob': 45, 'vol_spike': 0.23787359734778643, 'adx_thresh': 27.15649998589751, 'atr_min_pct': 0.025598920295177116, 'atr_max_pct': 0.09888544305419962, 'tp_mult': 2.457800302781999, 'tsl_mult': 0.31791266014498476, 'strategy': 'mean_reversion', 'time_stop': 189, 'use_sma': False, 'use_atr': False, 'use_adx': False, 'use_ema': True, 'use_spike': True, 'rsi_required': False, 'edge_k': 0.9666854309440314, 'edge_cap': 0.3443409576006872, 'bull_strategy': 'breakout', 'bull_bb_std_mult': 3.24280094580166, 'bull_rsi_os': 40, 'bull_rsi_ob': 76, 'bull_adx_thresh': 17.018911713131715, 'bull_atr_min_pct': 0.0036674235922226975, 'bull_atr_max_pct': 0.061069525343052385, 'bull_tp_mult': 2.8799493011208086, 'bull_tsl_mult': 0.056032442315609665, 'bull_time_stop': 84, 'bull_use_sma': True, 'bull_use_ema': True, 'bull_use_atr': False, 'bull_use_adx': True, 'bull_use_spike': True, 'bull_rsi_required': True, 'bear_strategy': 'breakout', 'bear_bb_std_mult': 2.3953263195053656, 'bear_rsi_os': 50, 'bear_rsi_ob': 85, 'bear_adx_thresh': 11.905956920407764, 'bear_atr_min_pct': 0.0019099825588934794, 'bear_atr_max_pct': 0.12412993056003395, 'bear_tp_mult': 1.8467316148626247, 'bear_tsl_mult': 0.16690817162080965, 'bear_time_stop': 215, 'bear_use_sma': False, 'bear_use_ema': True, 'bear_use_atr': True, 'bear_use_adx': True, 'bear_use_spike': False, 'bear_rsi_required': True, 'sideways_strategy': 'breakout', 'sideways_bb_std_mult': 1.847377843261241, 'sideways_rsi_os': 53, 'sideways_rsi_ob': 59, 'sideways_adx_thresh': 8.689108922024083, 'sideways_atr_min_pct': 0.014840611794173678, 'sideways_atr_max_pct': 0.09066085750313378, 'sideways_tp_mult': 1.5953494466824774, 'sideways_tsl_mult': 0.32442258314773187, 'sideways_time_stop': 231, 'sideways_use_sma': True, 'sideways_use_ema': False, 'sideways_use_atr': True, 'sideways_use_adx': True, 'sideways_use_spike': True, 'sideways_rsi_required': True}.
[I 2025-09-01 13:52:24,564] Trial 326 finished with values: [-1000000000.0, 1000000000.0] and parameters: {'p_sma': 31, 'p_std': 47, 'p_atr': 26, 'p_adx': 28, 'rsi_period': 58, 'ema1': 21, 'ema2': 19, 'slip_atr_k': 0.1685011976732678, 'slip_spread_k': 0.7841336441958523, 'spread_hl_frac': 0.005574912152609766, 'bb_std_mult': 2.121825377632897, 'rsi_os': 51, 'rsi_ob': 82, 'vol_spike': 0.22743586290152445, 'adx_thresh': 27.20630192658451, 'atr_min_pct': 0.024083950156316696, 'atr_max_pct': 0.14325292559079028, 'tp_mult': 2.2126579962533652, 'tsl_mult': 0.3012857600285652, 'strategy': 'mean_reversion', 'time_stop': 69, 'use_sma': True, 'use_atr': False, 'use_adx': False, 'use_ema': False, 'use_spike': True, 'rsi_required': False, 'edge_k': 1.6285589531157103, 'edge_cap': 0.680769784182607, 'bull_strategy': 'breakout', 'bull_bb_std_mult': 0.9311129180328344, 'bull_rsi_os': 43, 'bull_rsi_ob': 49, 'bull_adx_thresh': 31.724951324244685, 'bull_atr_min_pct': 0.003847866285403636, 'bull_atr_max_pct': 0.03650283966294337, 'bull_tp_mult': 2.8806928528277487, 'bull_tsl_mult': 0.4237618244193822, 'bull_time_stop': 105, 'bull_use_sma': True, 'bull_use_ema': True, 'bull_use_atr': True, 'bull_use_adx': True, 'bull_use_spike': False, 'bull_rsi_required': False, 'bear_strategy': 'breakout', 'bear_bb_std_mult': 3.488524586845831, 'bear_rsi_os': 25, 'bear_rsi_ob': 85, 'bear_adx_thresh': 14.655835698812261, 'bear_atr_min_pct': 0.0019278764494020369, 'bear_atr_max_pct': 0.12302034388101046, 'bear_tp_mult': 1.8533407686373937, 'bear_tsl_mult': 0.7377638732130739, 'bear_time_stop': 228, 'bear_use_sma': True, 'bear_use_ema': True, 'bear_use_atr': True, 'bear_use_adx': True, 'bear_use_spike': False, 'bear_rsi_required': True, 'sideways_strategy': 'breakout', 'sideways_bb_std_mult': 1.1663126010238034, 'sideways_rsi_os': 15, 'sideways_rsi_ob': 46, 'sideways_adx_thresh': 8.519865364218514, 'sideways_atr_min_pct': 0.014651471563352123, 'sideways_atr_max_pct': 0.0910726428790676, 'sideways_tp_mult': 2.523174388799675, 'sideways_tsl_mult': 0.32097837910346716, 'sideways_time_stop': 160, 'sideways_use_sma': True, 'sideways_use_ema': True, 'sideways_use_atr': True, 'sideways_use_adx': True, 'sideways_use_spike': False, 'sideways_rsi_required': False}.
[I 2025-09-01 13:52:59,956] Trial 327 finished with values: [-1000000000.0, 1000000000.0] and parameters: {'p_sma': 28, 'p_std': 47, 'p_atr': 24, 'p_adx': 13, 'rsi_period': 63, 'ema1': 17, 'ema2': 19, 'slip_atr_k': 0.19103501075224577, 'slip_spread_k': 0.05160677274596235, 'spread_hl_frac': 0.0034343855841597708, 'bb_std_mult': 0.5892051829802707, 'rsi_os': 35, 'rsi_ob': 70, 'vol_spike': 0.17345872400348072, 'adx_thresh': 27.27422843421568, 'atr_min_pct': 0.023994085015800394, 'atr_max_pct': 0.1431381770325311, 'tp_mult': 1.2339523064473543, 'tsl_mult': 0.7795630085325198, 'strategy': 'mean_reversion', 'time_stop': 243, 'use_sma': False, 'use_atr': False, 'use_adx': False, 'use_ema': True, 'use_spike': True, 'rsi_required': False, 'edge_k': 0.974839211409613, 'edge_cap': 0.543623370613618, 'bull_strategy': 'breakout', 'bull_bb_std_mult': 3.0588758333092034, 'bull_rsi_os': 40, 'bull_rsi_ob': 68, 'bull_adx_thresh': 31.78527963659241, 'bull_atr_min_pct': 0.0037984694424899688, 'bull_atr_max_pct': 0.12523972516556772, 'bull_tp_mult': 2.8699088695131993, 'bull_tsl_mult': 0.42711673648589826, 'bull_time_stop': 300, 'bull_use_sma': True, 'bull_use_ema': True, 'bull_use_atr': False, 'bull_use_adx': True, 'bull_use_spike': True, 'bull_rsi_required': True, 'bear_strategy': 'breakout', 'bear_bb_std_mult': 2.9627545779390165, 'bear_rsi_os': 25, 'bear_rsi_ob': 62, 'bear_adx_thresh': 32.24219105915793, 'bear_atr_min_pct': 0.0019411620220266, 'bear_atr_max_pct': 0.04630674224648916, 'bear_tp_mult': 2.239634215173971, 'bear_tsl_mult': 0.899367798821289, 'bear_time_stop': 230, 'bear_use_sma': False, 'bear_use_ema': True, 'bear_use_atr': True, 'bear_use_adx': True, 'bear_use_spike': False, 'bear_rsi_required': True, 'sideways_strategy': 'breakout', 'sideways_bb_std_mult': 1.571276182057103, 'sideways_rsi_os': 42, 'sideways_rsi_ob': 45, 'sideways_adx_thresh': 34.166985297976424, 'sideways_atr_min_pct': 0.014525819978214453, 'sideways_atr_max_pct': 0.05867051931072736, 'sideways_tp_mult': 2.847698102978676, 'sideways_tsl_mult': 0.2567800796783244, 'sideways_time_stop': 231, 'sideways_use_sma': True, 'sideways_use_ema': False, 'sideways_use_atr': True, 'sideways_use_adx': True, 'sideways_use_spike': False, 'sideways_rsi_required': True}.
[I 2025-09-01 13:53:00,947] Trial 329 finished with values: [-1000000000.0, 1000000000.0] and parameters: {'p_sma': 28, 'p_std': 47, 'p_atr': 24, 'p_adx': 13, 'rsi_period': 68, 'ema1': 7, 'ema2': 19, 'slip_atr_k': 1.1938424775828627e-05, 'slip_spread_k': 0.05371448930698615, 'spread_hl_frac': 0.04309763160774834, 'bb_std_mult': 2.0113201452270606, 'rsi_os': 22, 'rsi_ob': 83, 'vol_spike': 0.012886818310501008, 'adx_thresh': 27.47468356055642, 'atr_min_pct': 0.0254897606940127, 'atr_max_pct': 0.0903436006618487, 'tp_mult': 1.2041518131956699, 'tsl_mult': 0.9704776330351489, 'strategy': 'mean_reversion', 'time_stop': 243, 'use_sma': True, 'use_atr': False, 'use_adx': False, 'use_ema': True, 'use_spike': True, 'rsi_required': False, 'edge_k': 0.9707209033479668, 'edge_cap': 0.6785244312919643, 'bull_strategy': 'breakout', 'bull_bb_std_mult': 3.0698061146943845, 'bull_rsi_os': 36, 'bull_rsi_ob': 55, 'bull_adx_thresh': 31.5474339219766, 'bull_atr_min_pct': 0.007553971956478653, 'bull_atr_max_pct': 0.09508982681757829, 'bull_tp_mult': 2.869680941804865, 'bull_tsl_mult': 0.49493014756117526, 'bull_time_stop': 100, 'bull_use_sma': True, 'bull_use_ema': True, 'bull_use_atr': True, 'bull_use_adx': True, 'bull_use_spike': True, 'bull_rsi_required': True, 'bear_strategy': 'breakout', 'bear_bb_std_mult': 3.0446845920657366, 'bear_rsi_os': 34, 'bear_rsi_ob': 82, 'bear_adx_thresh': 11.850495088011018, 'bear_atr_min_pct': 0.0020493533487084513, 'bear_atr_max_pct': 0.04541710599955482, 'bear_tp_mult': 1.8449500917902686, 'bear_tsl_mult': 0.17078712024375065, 'bear_time_stop': 222, 'bear_use_sma': True, 'bear_use_ema': True, 'bear_use_atr': True, 'bear_use_adx': True, 'bear_use_spike': False, 'bear_rsi_required': True, 'sideways_strategy': 'breakout', 'sideways_bb_std_mult': 1.5615608970704722, 'sideways_rsi_os': 38, 'sideways_rsi_ob': 64, 'sideways_adx_thresh': 7.3666579533374374, 'sideways_atr_min_pct': 0.014425462401689005, 'sideways_atr_max_pct': 0.06644852062856178, 'sideways_tp_mult': 2.8449805983273504, 'sideways_tsl_mult': 0.32206288892348456, 'sideways_time_stop': 232, 'sideways_use_sma': True, 'sideways_use_ema': False, 'sideways_use_atr': True, 'sideways_use_adx': True, 'sideways_use_spike': True, 'sideways_rsi_required': True}.
[I 2025-09-01 13:53:03,335] Trial 331 finished with values: [-1000000000.0, 1000000000.0] and parameters: {'p_sma': 47, 'p_std': 38, 'p_atr': 7, 'p_adx': 14, 'rsi_period': 68, 'ema1': 7, 'ema2': 18, 'slip_atr_k': 0.23839303490680902, 'slip_spread_k': 0.27383666342451607, 'spread_hl_frac': 0.029105372757732027, 'bb_std_mult': 2.0139246679561342, 'rsi_os': 21, 'rsi_ob': 62, 'vol_spike': 0.2846344589939688, 'adx_thresh': 26.28504209728676, 'atr_min_pct': 0.029173185111248758, 'atr_max_pct': 0.06479009039048625, 'tp_mult': 2.8011578426892596, 'tsl_mult': 0.42424701008657006, 'strategy': 'mean_reversion', 'time_stop': 243, 'use_sma': True, 'use_atr': False, 'use_adx': False, 'use_ema': True, 'use_spike': True, 'rsi_required': False, 'edge_k': 0.8309799529153215, 'edge_cap': 0.36712181869835203, 'bull_strategy': 'breakout', 'bull_bb_std_mult': 3.0707768559110438, 'bull_rsi_os': 36, 'bull_rsi_ob': 59, 'bull_adx_thresh': 20.75685493229346, 'bull_atr_min_pct': 0.010080760235852089, 'bull_atr_max_pct': 0.023834694944328282, 'bull_tp_mult': 2.360566204887546, 'bull_tsl_mult': 0.4573846038933485, 'bull_time_stop': 99, 'bull_use_sma': True, 'bull_use_ema': True, 'bull_use_atr': True, 'bull_use_adx': True, 'bull_use_spike': True, 'bull_rsi_required': True, 'bear_strategy': 'breakout', 'bear_bb_std_mult': 2.8470746303278984, 'bear_rsi_os': 34, 'bear_rsi_ob': 56, 'bear_adx_thresh': 10.883271470899638, 'bear_atr_min_pct': 0.02891567410579051, 'bear_atr_max_pct': 0.04574148669209869, 'bear_tp_mult': 2.2532816628835475, 'bear_tsl_mult': 0.04431005997078606, 'bear_time_stop': 219, 'bear_use_sma': True, 'bear_use_ema': True, 'bear_use_atr': True, 'bear_use_adx': True, 'bear_use_spike': True, 'bear_rsi_required': True, 'sideways_strategy': 'breakout', 'sideways_bb_std_mult': 1.584337363578757, 'sideways_rsi_os': 50, 'sideways_rsi_ob': 66, 'sideways_adx_thresh': 28.314438559407037, 'sideways_atr_min_pct': 0.028657290196384477, 'sideways_atr_max_pct': 0.07323265761071128, 'sideways_tp_mult': 2.847587800874886, 'sideways_tsl_mult': 0.2607720622886467, 'sideways_time_stop': 153, 'sideways_use_sma': True, 'sideways_use_ema': False, 'sideways_use_atr': False, 'sideways_use_adx': True, 'sideways_use_spike': False, 'sideways_rsi_required': True}.
[I 2025-09-01 13:53:03,706] Trial 330 finished with values: [-0.05575224390575073, 0.054866804885191925] and parameters: {'p_sma': 38, 'p_std': 39, 'p_atr': 23, 'p_adx': 12, 'rsi_period': 11, 'ema1': 25, 'ema2': 18, 'slip_atr_k': 0.1888568849452452, 'slip_spread_k': 0.2780991673336084, 'spread_hl_frac': 0.028981978188829034, 'bb_std_mult': 1.7335031484443644, 'rsi_os': 8, 'rsi_ob': 62, 'vol_spike': 0.039218701426223815, 'adx_thresh': 26.255118267241667, 'atr_min_pct': 0.006244846998988019, 'atr_max_pct': 0.090432581367782, 'tp_mult': 2.5291701922652097, 'tsl_mult': 0.7180925606970631, 'strategy': 'mean_reversion', 'time_stop': 291, 'use_sma': True, 'use_atr': False, 'use_adx': False, 'use_ema': True, 'use_spike': True, 'rsi_required': False, 'edge_k': 0.18689982279264938, 'edge_cap': 0.09601617347144226, 'bull_strategy': 'breakout', 'bull_bb_std_mult': 0.7880996514863579, 'bull_rsi_os': 37, 'bull_rsi_ob': 78, 'bull_adx_thresh': 14.518989569571755, 'bull_atr_min_pct': 0.007890242599340453, 'bull_atr_max_pct': 0.1260336531606561, 'bull_tp_mult': 1.5079693535015177, 'bull_tsl_mult': 0.49622473050386967, 'bull_time_stop': 100, 'bull_use_sma': True, 'bull_use_ema': True, 'bull_use_atr': True, 'bull_use_adx': True, 'bull_use_spike': True, 'bull_rsi_required': True, 'bear_strategy': 'breakout', 'bear_bb_std_mult': 3.5387018400034176, 'bear_rsi_os': 34, 'bear_rsi_ob': 62, 'bear_adx_thresh': 33.36545893049538, 'bear_atr_min_pct': 0.003259884639220054, 'bear_atr_max_pct': 0.04579950452041837, 'bear_tp_mult': 2.247253751152355, 'bear_tsl_mult': 0.2963371520529853, 'bear_time_stop': 220, 'bear_use_sma': True, 'bear_use_ema': True, 'bear_use_atr': True, 'bear_use_adx': True, 'bear_use_spike': True, 'bear_rsi_required': True, 'sideways_strategy': 'breakout', 'sideways_bb_std_mult': 1.5594610921242509, 'sideways_rsi_os': 50, 'sideways_rsi_ob': 66, 'sideways_adx_thresh': 28.335428784413025, 'sideways_atr_min_pct': 0.0187356422257904, 'sideways_atr_max_pct': 0.07258809331747237, 'sideways_tp_mult': 2.871516139742638, 'sideways_tsl_mult': 0.9656125252791601, 'sideways_time_stop': 76, 'sideways_use_sma': True, 'sideways_use_ema': False, 'sideways_use_atr': False, 'sideways_use_adx': True, 'sideways_use_spike': False, 'sideways_rsi_required': True}.
[I 2025-09-01 13:53:44,485] Trial 333 finished with values: [-1000000000.0, 1000000000.0] and parameters: {'p_sma': 36, 'p_std': 49, 'p_atr': 23, 'p_adx': 12, 'rsi_period': 79, 'ema1': 20, 'ema2': 18, 'slip_atr_k': 0.0825150234577147, 'slip_spread_k': 0.10291004266111922, 'spread_hl_frac': 0.007173068647173981, 'bb_std_mult': 2.391850459521102, 'rsi_os': 26, 'rsi_ob': 58, 'vol_spike': 0.2027184674681041, 'adx_thresh': 26.038328081705174, 'atr_min_pct': 0.02899580397624711, 'atr_max_pct': 0.06486440319282355, 'tp_mult': 2.5121030862506784, 'tsl_mult': 0.7201715155855676, 'strategy': 'mean_reversion', 'time_stop': 196, 'use_sma': True, 'use_atr': False, 'use_adx': False, 'use_ema': True, 'use_spike': True, 'rsi_required': False, 'edge_k': 0.8990092699351414, 'edge_cap': 0.09337925995566232, 'bull_strategy': 'breakout', 'bull_bb_std_mult': 1.0134938140468972, 'bull_rsi_os': 37, 'bull_rsi_ob': 78, 'bull_adx_thresh': 25.413670920290777, 'bull_atr_min_pct': 0.02617071645795021, 'bull_atr_max_pct': 0.014820891756371496, 'bull_tp_mult': 2.2558877604502445, 'bull_tsl_mult': 0.9697764079617466, 'bull_time_stop': 94, 'bull_use_sma': False, 'bull_use_ema': True, 'bull_use_atr': True, 'bull_use_adx': True, 'bull_use_spike': False, 'bull_rsi_required': True, 'bear_strategy': 'breakout', 'bear_bb_std_mult': 3.5961360650383307, 'bear_rsi_os': 33, 'bear_rsi_ob': 56, 'bear_adx_thresh': 34.30109548893847, 'bear_atr_min_pct': 0.0038860190190171933, 'bear_atr_max_pct': 0.042183926290965394, 'bear_tp_mult': 1.1293994885218317, 'bear_tsl_mult': 0.3027429254353432, 'bear_time_stop': 212, 'bear_use_sma': True, 'bear_use_ema': True, 'bear_use_atr': False, 'bear_use_adx': False, 'bear_use_spike': True, 'bear_rsi_required': True, 'sideways_strategy': 'breakout', 'sideways_bb_std_mult': 2.7590437875872444, 'sideways_rsi_os': 50, 'sideways_rsi_ob': 66, 'sideways_adx_thresh': 7.341106620860355, 'sideways_atr_min_pct': 0.027887488375408928, 'sideways_atr_max_pct': 0.07274063665250821, 'sideways_tp_mult': 2.065720424783248, 'sideways_tsl_mult': 0.6619240751864761, 'sideways_time_stop': 168, 'sideways_use_sma': True, 'sideways_use_ema': False, 'sideways_use_atr': False, 'sideways_use_adx': True, 'sideways_use_spike': False, 'sideways_rsi_required': True}.
