[I 2025-09-01 13:03:33,734] Trial 8 finished with values: [-1000000000.0, 1000000000.0] and parameters: {'p_sma': 34, 'p_std': 13, 'p_atr': 19, 'p_adx': 14, 'rsi_period': 34, 'ema1': 24, 'ema2': 40, 'slip_atr_k': 0.0704387112145766, 'slip_spread_k': 0.4780363653110934, 'spread_hl_frac': 0.019116897043950188, 'bb_std_mult': 0.7546283742000318, 'rsi_os': 22, 'rsi_ob': 65, 'vol_spike': 0.19034997846223553, 'adx_thresh': 15.46357563279486, 'atr_min_pct': 0.0015475401247476105, 'atr_max_pct': 0.12741541761007116, 'tp_mult': 1.0483123792645879, 'tsl_mult': 0.8637185653977235, 'strategy': 'breakout', 'time_stop': 109, 'use_sma': False, 'use_atr': True, 'use_adx': True, 'use_ema': False, 'use_spike': False, 'rsi_required': False, 'edge_k': 1.0586061739878885, 'edge_cap': 0.4171133595183507, 'bull_strategy': 'breakout', 'bull_bb_std_mult': 3.507806465905751, 'bull_rsi_os': 44, 'bull_rsi_ob': 89, 'bull_adx_thresh': 5.541895043389998, 'bull_atr_min_pct': 0.01083984403551595, 'bull_atr_max_pct': 0.0750843983806787, 'bull_tp_mult': 1.0155365283363065, 'bull_tsl_mult': 0.5600458977194941, 'bull_time_stop': 67, 'bull_use_sma': True, 'bull_use_ema': True, 'bull_use_atr': False, 'bull_use_adx': False, 'bull_use_spike': True, 'bull_rsi_required': True, 'bear_strategy': 'mean_reversion', 'bear_bb_std_mult': 2.863942665538707, 'bear_rsi_os': 12, 'bear_rsi_ob': 71, 'bear_adx_thresh': 18.033652543650643, 'bear_atr_min_pct': 0.021288779894616326, 'bear_atr_max_pct': 0.11671079881150262, 'bear_tp_mult': 2.767243221468063, 'bear_tsl_mult': 0.756841832849681, 'bear_time_stop': 150, 'bear_use_sma': True, 'bear_use_ema': False, 'bear_use_atr': False, 'bear_use_adx': True, 'bear_use_spike': False, 'bear_rsi_required': False, 'sideways_strategy': 'breakout', 'sideways_bb_std_mult': 0.8805743487962423, 'sideways_rsi_os': 40, 'sideways_rsi_ob': 51, 'sideways_adx_thresh': 12.483060311474617, 'sideways_atr_min_pct': 0.01490703175424063, 'sideways_atr_max_pct': 0.03334603946595461, 'sideways_tp_mult': 2.497595558330193, 'sideways_tsl_mult': 0.3615853789550726, 'sideways_time_stop': 286, 'sideways_use_sma': False, 'sideways_use_ema': False, 'sideways_use_atr': False, 'sideways_use_adx': True, 'sideways_use_spike': False, 'sideways_rsi_required': True}.
[I 2025-09-01 13:03:34,040] Trial 13 finished with values: [-1000000000.0, 1000000000.0] and parameters: {'p_sma': 25, 'p_std': 5, 'p_atr': 29, 'p_adx': 29, 'rsi_period': 83, 'ema1': 21, 'ema2': 47, 'slip_atr_k': 0.0693048172816361, 'slip_spread_k': 0.704108399998067, 'spread_hl_frac': 0.008938847563450307, 'bb_std_mult': 1.4334945373027619, 'rsi_os': 51, 'rsi_ob': 95, 'vol_spike': 0.2964144643080465, 'adx_thresh': 25.938136201807417, 'atr_min_pct': 0.01950020061937347, 'atr_max_pct': 0.10305150551323906, 'tp_mult': 1.1357055637603115, 'tsl_mult': 0.4155094997477018, 'strategy': 'mean_reversion', 'time_stop': 5, 'use_sma': False, 'use_atr': False, 'use_adx': True, 'use_ema': True, 'use_spike': True, 'rsi_required': False, 'edge_k': 0.5047180538110325, 'edge_cap': 0.708819046663101, 'bull_strategy': 'mean_reversion', 'bull_bb_std_mult': 0.5629005623163346, 'bull_rsi_os': 24, 'bull_rsi_ob': 76, 'bull_adx_thresh': 8.147980844484016, 'bull_atr_min_pct': 0.027278463613669125, 'bull_atr_max_pct': 0.08153960195572511, 'bull_tp_mult': 2.5532679856617455, 'bull_tsl_mult': 0.948786231554822, 'bull_time_stop': 191, 'bull_use_sma': False, 'bull_use_ema': False, 'bull_use_atr': True, 'bull_use_adx': True, 'bull_use_spike': True, 'bull_rsi_required': False, 'bear_strategy': 'mean_reversion', 'bear_bb_std_mult': 1.6384189423891333, 'bear_rsi_os': 35, 'bear_rsi_ob': 93, 'bear_adx_thresh': 13.675236691065091, 'bear_atr_min_pct': 0.00010065617059301624, 'bear_atr_max_pct': 0.018383585809092766, 'bear_tp_mult': 1.764353245758493, 'bear_tsl_mult': 0.8912930258529614, 'bear_time_stop': 7, 'bear_use_sma': False, 'bear_use_ema': False, 'bear_use_atr': True, 'bear_use_adx': False, 'bear_use_spike': True, 'bear_rsi_required': True, 'sideways_strategy': 'mean_reversion', 'sideways_bb_std_mult': 2.299218302439533, 'sideways_rsi_os': 30, 'sideways_rsi_ob': 61, 'sideways_adx_thresh': 5.117096626845683, 'sideways_atr_min_pct': 0.02095202009419545, 'sideways_atr_max_pct': 0.08765579988722375, 'sideways_tp_mult': 2.981176207456759, 'sideways_tsl_mult': 0.9761474960180092, 'sideways_time_stop': 228, 'sideways_use_sma': True, 'sideways_use_ema': True, 'sideways_use_atr': False, 'sideways_use_adx': False, 'sideways_use_spike': False, 'sideways_rsi_required': False}.
[I 2025-09-01 13:04:13,679] Trial 12 finished with values: [-1000000000.0, 1000000000.0] and parameters: {'p_sma': 9, 'p_std': 20, 'p_atr': 19, 'p_adx': 29, 'rsi_period': 63, 'ema1': 23, 'ema2': 52, 'slip_atr_k': 0.24988926499919528, 'slip_spread_k': 0.08322435470845324, 'spread_hl_frac': 0.024426062777948277, 'bb_std_mult': 0.7198438874636794, 'rsi_os': 12, 'rsi_ob': 50, 'vol_spike': 0.027197824247863277, 'adx_thresh': 12.419960739963766, 'atr_min_pct': 0.02995013892169991, 'atr_max_pct': 0.11475595400300638, 'tp_mult': 1.9562387138407442, 'tsl_mult': 0.06768693694253991, 'strategy': 'breakout', 'time_stop': 152, 'use_sma': False, 'use_atr': False, 'use_adx': True, 'use_ema': True, 'use_spike': True, 'rsi_required': True, 'edge_k': 0.7436387711289152, 'edge_cap': 0.4078855126863378, 'bull_strategy': 'mean_reversion', 'bull_bb_std_mult': 1.5290339164166422, 'bull_rsi_os': 17, 'bull_rsi_ob': 50, 'bull_adx_thresh': 8.775729040424343, 'bull_atr_min_pct': 0.013733303069134005, 'bull_atr_max_pct': 0.08084147591216397, 'bull_tp_mult': 1.879954018020434, 'bull_tsl_mult': 0.51588068251798, 'bull_time_stop': 166, 'bull_use_sma': True, 'bull_use_ema': False, 'bull_use_atr': False, 'bull_use_adx': False, 'bull_use_spike': True, 'bull_rsi_required': True, 'bear_strategy': 'breakout', 'bear_bb_std_mult': 1.6950860494542646, 'bear_rsi_os': 54, 'bear_rsi_ob': 64, 'bear_adx_thresh': 22.997551165905364, 'bear_atr_min_pct': 0.020619221721685666, 'bear_atr_max_pct': 0.13086870818085092, 'bear_tp_mult': 2.3259677590539742, 'bear_tsl_mult': 0.2245907467962185, 'bear_time_stop': 245, 'bear_use_sma': False, 'bear_use_ema': False, 'bear_use_atr': True, 'bear_use_adx': True, 'bear_use_spike': True, 'bear_rsi_required': False, 'sideways_strategy': 'breakout', 'sideways_bb_std_mult': 2.0924194805493905, 'sideways_rsi_os': 44, 'sideways_rsi_ob': 92, 'sideways_adx_thresh': 24.42304277927495, 'sideways_atr_min_pct': 0.024949620458467967, 'sideways_atr_max_pct': 0.07834824079150228, 'sideways_tp_mult': 2.94505269160174, 'sideways_tsl_mult': 0.08384309047702465, 'sideways_time_stop': 13, 'sideways_use_sma': False, 'sideways_use_ema': False, 'sideways_use_atr': True, 'sideways_use_adx': False, 'sideways_use_spike': True, 'sideways_rsi_required': True}.
[I 2025-09-01 13:04:14,058] Trial 11 finished with values: [-0.13265417733592944, 0.13242465656916017] and parameters: {'p_sma': 13, 'p_std': 50, 'p_atr': 12, 'p_adx': 21, 'rsi_period': 17, 'ema1': 11, 'ema2': 53, 'slip_atr_k': 0.14326048181902293, 'slip_spread_k': 0.009295145682578942, 'spread_hl_frac': 0.034827949119240115, 'bb_std_mult': 0.6038391468653895, 'rsi_os': 24, 'rsi_ob': 89, 'vol_spike': 0.28311216550295715, 'adx_thresh': 18.10871491357786, 'atr_min_pct': 0.010883665473631544, 'atr_max_pct': 0.060659663488849457, 'tp_mult': 1.9017585746539463, 'tsl_mult': 0.9477191464664968, 'strategy': 'mean_reversion', 'time_stop': 93, 'use_sma': False, 'use_atr': False, 'use_adx': False, 'use_ema': True, 'use_spike': False, 'rsi_required': False, 'edge_k': 1.162629338602729, 'edge_cap': 0.8136648393508075, 'bull_strategy': 'breakout', 'bull_bb_std_mult': 1.0120967303641064, 'bull_rsi_os': 21, 'bull_rsi_ob': 56, 'bull_adx_thresh': 33.24706193241575, 'bull_atr_min_pct': 0.009640972882656274, 'bull_atr_max_pct': 0.03488022085409753, 'bull_tp_mult': 1.5192503110348403, 'bull_tsl_mult': 0.6480172254479435, 'bull_time_stop': 270, 'bull_use_sma': True, 'bull_use_ema': True, 'bull_use_atr': True, 'bull_use_adx': True, 'bull_use_spike': False, 'bull_rsi_required': False, 'bear_strategy': 'breakout', 'bear_bb_std_mult': 1.9914900211781514, 'bear_rsi_os': 49, 'bear_rsi_ob': 45, 'bear_adx_thresh': 12.57779772900985, 'bear_atr_min_pct': 0.028475381113065013, 'bear_atr_max_pct': 0.08513587785106241, 'bear_tp_mult': 1.4066710910772486, 'bear_tsl_mult': 0.5435648563186322, 'bear_time_stop': 222, 'bear_use_sma': True, 'bear_use_ema': True, 'bear_use_atr': False, 'bear_use_adx': False, 'bear_use_spike': True, 'bear_rsi_required': False, 'sideways_strategy': 'mean_reversion', 'sideways_bb_std_mult': 3.2174075508243964, 'sideways_rsi_os': 7, 'sideways_rsi_ob': 66, 'sideways_adx_thresh': 11.844058931050691, 'sideways_atr_min_pct': 0.0009566108936802331, 'sideways_atr_max_pct': 0.08071704206295241, 'sideways_tp_mult': 2.768220661527078, 'sideways_tsl_mult': 0.8131984664538039, 'sideways_time_stop': 74, 'sideways_use_sma': True, 'sideways_use_ema': False, 'sideways_use_atr': False, 'sideways_use_adx': True, 'sideways_use_spike': False, 'sideways_rsi_required': False}.
[I 2025-09-01 13:04:15,328] Trial 10 finished with values: [-1000000000.0, 1000000000.0] and parameters: {'p_sma': 22, 'p_std': 58, 'p_atr': 13, 'p_adx': 18, 'rsi_period': 57, 'ema1': 29, 'ema2': 36, 'slip_atr_k': 0.03295734526664748, 'slip_spread_k': 0.735060046882264, 'spread_hl_frac': 0.03095691370442219, 'bb_std_mult': 2.751530815723232, 'rsi_os': 24, 'rsi_ob': 51, 'vol_spike': 0.26337780087640245, 'adx_thresh': 16.35828110825162, 'atr_min_pct': 0.017882913254719718, 'atr_max_pct': 0.08099931447145353, 'tp_mult': 2.363537340019031, 'tsl_mult': 0.8323963448220261, 'strategy': 'breakout', 'time_stop': 287, 'use_sma': False, 'use_atr': False, 'use_adx': True, 'use_ema': False, 'use_spike': False, 'rsi_required': True, 'edge_k': 0.48638244464273517, 'edge_cap': 0.6409700396751168, 'bull_strategy': 'mean_reversion', 'bull_bb_std_mult': 2.799404160058327, 'bull_rsi_os': 38, 'bull_rsi_ob': 76, 'bull_adx_thresh': 5.693100911311087, 'bull_atr_min_pct': 0.024595211801707345, 'bull_atr_max_pct': 0.12022763034902918, 'bull_tp_mult': 1.1895552028828982, 'bull_tsl_mult': 0.3932261488824864, 'bull_time_stop': 229, 'bull_use_sma': True, 'bull_use_ema': True, 'bull_use_atr': False, 'bull_use_adx': False, 'bull_use_spike': False, 'bull_rsi_required': False, 'bear_strategy': 'breakout', 'bear_bb_std_mult': 2.0366791128224886, 'bear_rsi_os': 44, 'bear_rsi_ob': 52, 'bear_adx_thresh': 10.539452082412415, 'bear_atr_min_pct': 0.028727002846354082, 'bear_atr_max_pct': 0.032989559909223726, 'bear_tp_mult': 2.575484483473314, 'bear_tsl_mult': 0.6814168101004888, 'bear_time_stop': 7, 'bear_use_sma': True, 'bear_use_ema': True, 'bear_use_atr': True, 'bear_use_adx': True, 'bear_use_spike': True, 'bear_rsi_required': True, 'sideways_strategy': 'breakout', 'sideways_bb_std_mult': 1.4828986464022615, 'sideways_rsi_os': 11, 'sideways_rsi_ob': 46, 'sideways_adx_thresh': 21.027017833370035, 'sideways_atr_min_pct': 0.019374896069410032, 'sideways_atr_max_pct': 0.07407066006139605, 'sideways_tp_mult': 1.3270636210319382, 'sideways_tsl_mult': 0.5309835740785106, 'sideways_time_stop': 175, 'sideways_use_sma': True, 'sideways_use_ema': True, 'sideways_use_atr': True, 'sideways_use_adx': True, 'sideways_use_spike': True, 'sideways_rsi_required': True}.
[I 2025-09-01 13:04:15,653] Trial 14 finished with values: [-1000000000.0, 1000000000.0] and parameters: {'p_sma': 41, 'p_std': 59, 'p_atr': 20, 'p_adx': 21, 'rsi_period': 84, 'ema1': 20, 'ema2': 29, 'slip_atr_k': 0.23899147151136668, 'slip_spread_k': 0.23291000329679473, 'spread_hl_frac': 0.011098715153393116, 'bb_std_mult': 3.336037085381431, 'rsi_os': 5, 'rsi_ob': 88, 'vol_spike': 0.06509769256051176, 'adx_thresh': 32.770838923234244, 'atr_min_pct': 0.017472843830080485, 'atr_max_pct': 0.03640575119454498, 'tp_mult': 1.4937077459455217, 'tsl_mult': 0.5390087902942718, 'strategy': 'mean_reversion', 'time_stop': 237, 'use_sma': False, 'use_atr': False, 'use_adx': True, 'use_ema': True, 'use_spike': True, 'rsi_required': False, 'edge_k': 0.4507736076305949, 'edge_cap': 0.05152746306162592, 'bull_strategy': 'mean_reversion', 'bull_bb_std_mult': 1.6270070324358143, 'bull_rsi_os': 5, 'bull_rsi_ob': 94, 'bull_adx_thresh': 28.731997640824645, 'bull_atr_min_pct': 0.009836913581401867, 'bull_atr_max_pct': 0.012809148221657116, 'bull_tp_mult': 1.7116864351065946, 'bull_tsl_mult': 0.21248529796806126, 'bull_time_stop': 8, 'bull_use_sma': False, 'bull_use_ema': False, 'bull_use_atr': True, 'bull_use_adx': False, 'bull_use_spike': True, 'bull_rsi_required': False, 'bear_strategy': 'mean_reversion', 'bear_bb_std_mult': 1.3255036961702436, 'bear_rsi_os': 37, 'bear_rsi_ob': 82, 'bear_adx_thresh': 5.7629250656669, 'bear_atr_min_pct': 0.027035200360307234, 'bear_atr_max_pct': 0.1087072694159394, 'bear_tp_mult': 2.998487628834887, 'bear_tsl_mult': 0.33506788054393444, 'bear_time_stop': 112, 'bear_use_sma': False, 'bear_use_ema': False, 'bear_use_atr': True, 'bear_use_adx': False, 'bear_use_spike': True, 'bear_rsi_required': True, 'sideways_strategy': 'mean_reversion', 'sideways_bb_std_mult': 1.4407825227022715, 'sideways_rsi_os': 33, 'sideways_rsi_ob': 72, 'sideways_adx_thresh': 24.542240751087235, 'sideways_atr_min_pct': 0.019855235404750184, 'sideways_atr_max_pct': 0.1480840330726041, 'sideways_tp_mult': 1.6783008958560244, 'sideways_tsl_mult': 0.7325371121490621, 'sideways_time_stop': 283, 'sideways_use_sma': True, 'sideways_use_ema': True, 'sideways_use_atr': False, 'sideways_use_adx': False, 'sideways_use_spike': False, 'sideways_rsi_required': True}.
[I 2025-09-01 13:04:54,780] Trial 15 finished with values: [-1000000000.0, 1000000000.0] and parameters: {'p_sma': 45, 'p_std': 7, 'p_atr': 23, 'p_adx': 20, 'rsi_period': 80, 'ema1': 19, 'ema2': 25, 'slip_atr_k': 0.06322947857406447, 'slip_spread_k': 0.26615489942992093, 'spread_hl_frac': 0.00018736294397714293, 'bb_std_mult': 3.209898133628288, 'rsi_os': 5, 'rsi_ob': 86, 'vol_spike': 0.07945832749607185, 'adx_thresh': 31.083805519133655, 'atr_min_pct': 0.016044531404544943, 'atr_max_pct': 0.037077686028085706, 'tp_mult': 1.4239111947486491, 'tsl_mult': 0.5165763704811928, 'strategy': 'mean_reversion', 'time_stop': 299, 'use_sma': False, 'use_atr': False, 'use_adx': True, 'use_ema': True, 'use_spike': True, 'rsi_required': False, 'edge_k': 0.4791341541522315, 'edge_cap': 0.05071303187665266, 'bull_strategy': 'mean_reversion', 'bull_bb_std_mult': 2.796661802071099, 'bull_rsi_os': 5, 'bull_rsi_ob': 95, 'bull_adx_thresh': 26.598525373500575, 'bull_atr_min_pct': 0.029799499232544525, 'bull_atr_max_pct': 0.11012344444907214, 'bull_tp_mult': 1.5483514080359198, 'bull_tsl_mult': 0.22443316101344718, 'bull_time_stop': 7, 'bull_use_sma': False, 'bull_use_ema': False, 'bull_use_atr': True, 'bull_use_adx': True, 'bull_use_spike': True, 'bull_rsi_required': False, 'bear_strategy': 'mean_reversion', 'bear_bb_std_mult': 1.2058561337683664, 'bear_rsi_os': 35, 'bear_rsi_ob': 85, 'bear_adx_thresh': 8.30168054048831, 'bear_atr_min_pct': 0.029947151853538096, 'bear_atr_max_pct': 0.10599428407165587, 'bear_tp_mult': 2.9853801257874815, 'bear_tsl_mult': 0.42223171679995564, 'bear_time_stop': 127, 'bear_use_sma': False, 'bear_use_ema': False, 'bear_use_atr': True, 'bear_use_adx': False, 'bear_use_spike': True, 'bear_rsi_required': True, 'sideways_strategy': 'mean_reversion', 'sideways_bb_std_mult': 1.378909857505543, 'sideways_rsi_os': 32, 'sideways_rsi_ob': 72, 'sideways_adx_thresh': 5.703452775363613, 'sideways_atr_min_pct': 0.018267225875327774, 'sideways_atr_max_pct': 0.14557519134874747, 'sideways_tp_mult': 1.6615976961114602, 'sideways_tsl_mult': 0.7321849793778236, 'sideways_time_stop': 280, 'sideways_use_sma': True, 'sideways_use_ema': True, 'sideways_use_atr': False, 'sideways_use_adx': False, 'sideways_use_spike': False, 'sideways_rsi_required': False}.
[I 2025-09-01 13:04:55,004] Trial 17 finished with values: [-1000000000.0, 1000000000.0] and parameters: {'p_sma': 45, 'p_std': 7, 'p_atr': 24, 'p_adx': 8, 'rsi_period': 84, 'ema1': 19, 'ema2': 24, 'slip_atr_k': 0.08914322653206377, 'slip_spread_k': 0.28133773097284775, 'spread_hl_frac': 0.014723116068382383, 'bb_std_mult': 3.278926505866437, 'rsi_os': 44, 'rsi_ob': 85, 'vol_spike': 0.06847511354525213, 'adx_thresh': 30.094346919174104, 'atr_min_pct': 0.02340979108737235, 'atr_max_pct': 0.025927773234759165, 'tp_mult': 1.441412490883657, 'tsl_mult': 0.5691907557056808, 'strategy': 'mean_reversion', 'time_stop': 6, 'use_sma': False, 'use_atr': False, 'use_adx': True, 'use_ema': True, 'use_spike': True, 'rsi_required': False, 'edge_k': 0.35926328447762046, 'edge_cap': 0.30708214896768865, 'bull_strategy': 'mean_reversion', 'bull_bb_std_mult': 0.5133312014611111, 'bull_rsi_os': 6, 'bull_rsi_ob': 95, 'bull_adx_thresh': 27.2143264276743, 'bull_atr_min_pct': 0.02929108861363549, 'bull_atr_max_pct': 0.10061955356027118, 'bull_tp_mult': 1.536126017531732, 'bull_tsl_mult': 0.9713644368147492, 'bull_time_stop': 11, 'bull_use_sma': False, 'bull_use_ema': False, 'bull_use_atr': True, 'bull_use_adx': False, 'bull_use_spike': True, 'bull_rsi_required': False, 'bear_strategy': 'mean_reversion', 'bear_bb_std_mult': 1.1128361268603129, 'bear_rsi_os': 35, 'bear_rsi_ob': 80, 'bear_adx_thresh': 5.2365318156050265, 'bear_atr_min_pct': 0.0008452706128218145, 'bear_atr_max_pct': 0.09248896524462621, 'bear_tp_mult': 1.7006943225200215, 'bear_tsl_mult': 0.3728116329160869, 'bear_time_stop': 126, 'bear_use_sma': False, 'bear_use_ema': False, 'bear_use_atr': True, 'bear_use_adx': False, 'bear_use_spike': True, 'bear_rsi_required': True, 'sideways_strategy': 'mean_reversion', 'sideways_bb_std_mult': 1.0687412023283547, 'sideways_rsi_os': 33, 'sideways_rsi_ob': 61, 'sideways_adx_thresh': 6.921825887133224, 'sideways_atr_min_pct': 0.014091757922843213, 'sideways_atr_max_pct': 0.1442670813856169, 'sideways_tp_mult': 1.7622234824625802, 'sideways_tsl_mult': 0.7492491383437868, 'sideways_time_stop': 276, 'sideways_use_sma': True, 'sideways_use_ema': True, 'sideways_use_atr': False, 'sideways_use_adx': False, 'sideways_use_spike': False, 'sideways_rsi_required': False}.
[I 2025-09-01 13:04:55,149] Trial 16 finished with values: [-1000000000.0, 1000000000.0] and parameters: {'p_sma': 47, 'p_std': 58, 'p_atr': 30, 'p_adx': 7, 'rsi_period': 77, 'ema1': 20, 'ema2': 27, 'slip_atr_k': 0.056530715173651394, 'slip_spread_k': 0.26998909053388703, 'spread_hl_frac': 0.01146328270769303, 'bb_std_mult': 3.253777036195305, 'rsi_os': 23, 'rsi_ob': 86, 'vol_spike': 0.06746643698273788, 'adx_thresh': 31.702292347840935, 'atr_min_pct': 0.018854581727437, 'atr_max_pct': 0.03396455133739329, 'tp_mult': 1.3854391764368528, 'tsl_mult': 0.5050812705076099, 'strategy': 'mean_reversion', 'time_stop': 102, 'use_sma': False, 'use_atr': False, 'use_adx': True, 'use_ema': True, 'use_spike': True, 'rsi_required': False, 'edge_k': 0.30047937719182205, 'edge_cap': 0.7607510749593879, 'bull_strategy': 'mean_reversion', 'bull_bb_std_mult': 0.562434219946082, 'bull_rsi_os': 7, 'bull_rsi_ob': 95, 'bull_adx_thresh': 24.22288796261163, 'bull_atr_min_pct': 0.02840923306089057, 'bull_atr_max_pct': 0.10794323570667864, 'bull_tp_mult': 1.4300071344457796, 'bull_tsl_mult': 0.28639946404539585, 'bull_time_stop': 5, 'bull_use_sma': False, 'bull_use_ema': False, 'bull_use_atr': True, 'bull_use_adx': False, 'bull_use_spike': True, 'bull_rsi_required': False, 'bear_strategy': 'mean_reversion', 'bear_bb_std_mult': 1.159059572172355, 'bear_rsi_os': 36, 'bear_rsi_ob': 45, 'bear_adx_thresh': 6.844781846592031, 'bear_atr_min_pct': 0.02728283226482768, 'bear_atr_max_pct': 0.09522154672398038, 'bear_tp_mult': 2.988438315347619, 'bear_tsl_mult': 0.37852527986772305, 'bear_time_stop': 119, 'bear_use_sma': False, 'bear_use_ema': False, 'bear_use_atr': True, 'bear_use_adx': False, 'bear_use_spike': True, 'bear_rsi_required': True, 'sideways_strategy': 'mean_reversion', 'sideways_bb_std_mult': 1.1957241953737856, 'sideways_rsi_os': 32, 'sideways_rsi_ob': 61, 'sideways_adx_thresh': 5.656411868768263, 'sideways_atr_min_pct': 0.019221858299562074, 'sideways_atr_max_pct': 0.14185801771716564, 'sideways_tp_mult': 1.6483325650416598, 'sideways_tsl_mult': 0.742264449366295, 'sideways_time_stop': 296, 'sideways_use_sma': True, 'sideways_use_ema': True, 'sideways_use_atr': False, 'sideways_use_adx': False, 'sideways_use_spike': False, 'sideways_rsi_required': False}.
