[I 2025-09-01 14:35:24,481] Trial 622 finished with values: [-1000000000.0, 1000000000.0] and parameters: {'p_sma': 38, 'p_std': 12, 'p_atr': 27, 'p_adx': 13, 'rsi_period': 84, 'ema1': 22, 'ema2': 44, 'slip_atr_k': 0.2188684422160071, 'slip_spread_k': 0.023487831518877345, 'spread_hl_frac': 0.009635915079891765, 'bb_std_mult': 2.0650298296831155, 'rsi_os': 36, 'rsi_ob': 81, 'vol_spike': 0.08928353902266123, 'adx_thresh': 25.925218556143903, 'atr_min_pct': 0.006948847633944282, 'atr_max_pct': 0.024585581440790705, 'tp_mult': 1.1718342717644001, 'tsl_mult': 0.08772603033416615, 'strategy': 'mean_reversion', 'time_stop': 240, 'use_sma': False, 'use_atr': False, 'use_adx': False, 'use_ema': False, 'use_spike': False, 'rsi_required': True, 'edge_k': 0.8200262322863727, 'edge_cap': 0.44025326238894086, 'bull_strategy': 'mean_reversion', 'bull_bb_std_mult': 3.245168114220706, 'bull_rsi_os': 37, 'bull_rsi_ob': 55, 'bull_adx_thresh': 31.542859250524998, 'bull_atr_min_pct': 0.026653855030438683, 'bull_atr_max_pct': 0.027093449666945848, 'bull_tp_mult': 2.287493604978332, 'bull_tsl_mult': 0.7280931096355481, 'bull_time_stop': 155, 'bull_use_sma': True, 'bull_use_ema': False, 'bull_use_atr': True, 'bull_use_adx': True, 'bull_use_spike': False, 'bull_rsi_required': True, 'bear_strategy': 'breakout', 'bear_bb_std_mult': 0.7319990757684722, 'bear_rsi_os': 32, 'bear_rsi_ob': 87, 'bear_adx_thresh': 9.30267483729603, 'bear_atr_min_pct': 0.0015581889085942435, 'bear_atr_max_pct': 0.044612959063712695, 'bear_tp_mult': 2.5188803800767388, 'bear_tsl_mult': 0.16099356061927617, 'bear_time_stop': 300, 'bear_use_sma': True, 'bear_use_ema': False, 'bear_use_atr': False, 'bear_use_adx': False, 'bear_use_spike': False, 'bear_rsi_required': False, 'sideways_strategy': 'breakout', 'sideways_bb_std_mult': 2.641445423831087, 'sideways_rsi_os': 47, 'sideways_rsi_ob': 64, 'sideways_adx_thresh': 6.094931071914781, 'sideways_atr_min_pct': 0.01976491191890278, 'sideways_atr_max_pct': 0.07331490029291492, 'sideways_tp_mult': 1.380920751191036, 'sideways_tsl_mult': 0.9058629495472936, 'sideways_time_stop': 190, 'sideways_use_sma': False, 'sideways_use_ema': False, 'sideways_use_atr': True, 'sideways_use_adx': True, 'sideways_use_spike': False, 'sideways_rsi_required': True}.
[I 2025-09-01 14:35:24,910] Trial 621 finished with values: [-1000000000.0, 1000000000.0] and parameters: {'p_sma': 36, 'p_std': 48, 'p_atr': 27, 'p_adx': 13, 'rsi_period': 55, 'ema1': 15, 'ema2': 19, 'slip_atr_k': 0.18016407108341986, 'slip_spread_k': 0.10617460337434374, 'spread_hl_frac': 0.009670850302360109, 'bb_std_mult': 0.7456040250765326, 'rsi_os': 37, 'rsi_ob': 80, 'vol_spike': 0.22472707861774563, 'adx_thresh': 29.77411537029781, 'atr_min_pct': 0.006859914248706512, 'atr_max_pct': 0.14550038255642656, 'tp_mult': 1.1759158744945766, 'tsl_mult': 0.7263950932010196, 'strategy': 'mean_reversion', 'time_stop': 155, 'use_sma': False, 'use_atr': False, 'use_adx': False, 'use_ema': False, 'use_spike': False, 'rsi_required': True, 'edge_k': 0.16906069985365246, 'edge_cap': 0.5396532960171263, 'bull_strategy': 'breakout', 'bull_bb_std_mult': 3.1507471345030083, 'bull_rsi_os': 35, 'bull_rsi_ob': 85, 'bull_adx_thresh': 30.617879895369853, 'bull_atr_min_pct': 0.016206123528175513, 'bull_atr_max_pct': 0.12440137767267821, 'bull_tp_mult': 1.9951938619288232, 'bull_tsl_mult': 0.39076476426064294, 'bull_time_stop': 57, 'bull_use_sma': True, 'bull_use_ema': True, 'bull_use_atr': True, 'bull_use_adx': True, 'bull_use_spike': False, 'bull_rsi_required': True, 'bear_strategy': 'breakout', 'bear_bb_std_mult': 1.8278024918747025, 'bear_rsi_os': 6, 'bear_rsi_ob': 62, 'bear_adx_thresh': 28.51797550645371, 'bear_atr_min_pct': 0.0016899324366576745, 'bear_atr_max_pct': 0.12096917718909521, 'bear_tp_mult': 1.755429602464621, 'bear_tsl_mult': 0.09183476040595356, 'bear_time_stop': 80, 'bear_use_sma': True, 'bear_use_ema': False, 'bear_use_atr': False, 'bear_use_adx': False, 'bear_use_spike': False, 'bear_rsi_required': False, 'sideways_strategy': 'breakout', 'sideways_bb_std_mult': 2.1626326038632184, 'sideways_rsi_os': 51, 'sideways_rsi_ob': 69, 'sideways_adx_thresh': 11.278626881606874, 'sideways_atr_min_pct': 0.019875207609593937, 'sideways_atr_max_pct': 0.07231269028679463, 'sideways_tp_mult': 2.7530816305583525, 'sideways_tsl_mult': 0.22262746310902287, 'sideways_time_stop': 174, 'sideways_use_sma': False, 'sideways_use_ema': False, 'sideways_use_atr': True, 'sideways_use_adx': True, 'sideways_use_spike': False, 'sideways_rsi_required': True}.
[I 2025-09-01 14:35:27,392] Trial 623 finished with values: [-0.021386102731478562, 0.02127368458473188] and parameters: {'p_sma': 12, 'p_std': 21, 'p_atr': 26, 'p_adx': 11, 'rsi_period': 55, 'ema1': 22, 'ema2': 24, 'slip_atr_k': 0.1360047542175817, 'slip_spread_k': 0.5282236977821018, 'spread_hl_frac': 0.006869769910391662, 'bb_std_mult': 1.8512871883369848, 'rsi_os': 36, 'rsi_ob': 81, 'vol_spike': 0.08651659119412608, 'adx_thresh': 5.003869230479882, 'atr_min_pct': 0.007719777469784516, 'atr_max_pct': 0.14740183737170715, 'tp_mult': 1.0860750941055202, 'tsl_mult': 0.7504956082762836, 'strategy': 'mean_reversion', 'time_stop': 33, 'use_sma': False, 'use_atr': False, 'use_adx': False, 'use_ema': False, 'use_spike': False, 'rsi_required': True, 'edge_k': 1.263734529513665, 'edge_cap': 0.3041594795302359, 'bull_strategy': 'mean_reversion', 'bull_bb_std_mult': 2.477674548218928, 'bull_rsi_os': 22, 'bull_rsi_ob': 55, 'bull_adx_thresh': 33.949303010952164, 'bull_atr_min_pct': 0.001621778436270321, 'bull_atr_max_pct': 0.1236280283778008, 'bull_tp_mult': 1.9905832171712392, 'bull_tsl_mult': 0.8115964569316665, 'bull_time_stop': 100, 'bull_use_sma': True, 'bull_use_ema': False, 'bull_use_atr': True, 'bull_use_adx': True, 'bull_use_spike': False, 'bull_rsi_required': True, 'bear_strategy': 'breakout', 'bear_bb_std_mult': 2.5889443388361064, 'bear_rsi_os': 35, 'bear_rsi_ob': 88, 'bear_adx_thresh': 12.672824688336847, 'bear_atr_min_pct': 0.023185797370480116, 'bear_atr_max_pct': 0.04539381979922954, 'bear_tp_mult': 2.321949858709278, 'bear_tsl_mult': 0.16006820215249618, 'bear_time_stop': 214, 'bear_use_sma': True, 'bear_use_ema': False, 'bear_use_atr': False, 'bear_use_adx': False, 'bear_use_spike': False, 'bear_rsi_required': False, 'sideways_strategy': 'breakout', 'sideways_bb_std_mult': 2.1944837604359186, 'sideways_rsi_os': 47, 'sideways_rsi_ob': 58, 'sideways_adx_thresh': 7.646714986449462, 'sideways_atr_min_pct': 0.018950898385391574, 'sideways_atr_max_pct': 0.020291415720485054, 'sideways_tp_mult': 2.626448862681981, 'sideways_tsl_mult': 0.5951244043508865, 'sideways_time_stop': 38, 'sideways_use_sma': False, 'sideways_use_ema': False, 'sideways_use_atr': True, 'sideways_use_adx': True, 'sideways_use_spike': False, 'sideways_rsi_required': True}.
[I 2025-09-01 14:35:27,690] Trial 624 finished with values: [-1000000000.0, 1000000000.0] and parameters: {'p_sma': 12, 'p_std': 49, 'p_atr': 26, 'p_adx': 24, 'rsi_period': 84, 'ema1': 21, 'ema2': 24, 'slip_atr_k': 0.02656975315502311, 'slip_spread_k': 0.9889172063767907, 'spread_hl_frac': 0.04253951679188185, 'bb_std_mult': 1.856256636269144, 'rsi_os': 37, 'rsi_ob': 84, 'vol_spike': 0.08198452663401007, 'adx_thresh': 26.439576953662364, 'atr_min_pct': 0.024602143362987154, 'atr_max_pct': 0.07457972896149989, 'tp_mult': 1.0568749876811439, 'tsl_mult': 0.7548739583199003, 'strategy': 'breakout', 'time_stop': 239, 'use_sma': False, 'use_atr': False, 'use_adx': False, 'use_ema': True, 'use_spike': True, 'rsi_required': True, 'edge_k': 0.8675907269407462, 'edge_cap': 0.5888875265610244, 'bull_strategy': 'mean_reversion', 'bull_bb_std_mult': 3.2887977581524033, 'bull_rsi_os': 35, 'bull_rsi_ob': 56, 'bull_adx_thresh': 31.826810237553286, 'bull_atr_min_pct': 0.02661943817219954, 'bull_atr_max_pct': 0.10458054514614583, 'bull_tp_mult': 1.7843196383693212, 'bull_tsl_mult': 0.45599903474368486, 'bull_time_stop': 99, 'bull_use_sma': True, 'bull_use_ema': False, 'bull_use_atr': True, 'bull_use_adx': True, 'bull_use_spike': False, 'bull_rsi_required': True, 'bear_strategy': 'breakout', 'bear_bb_std_mult': 3.5161792911154417, 'bear_rsi_os': 6, 'bear_rsi_ob': 87, 'bear_adx_thresh': 6.820414670256932, 'bear_atr_min_pct': 0.002413716779865881, 'bear_atr_max_pct': 0.04498815747716103, 'bear_tp_mult': 1.9538165366935563, 'bear_tsl_mult': 0.03459862853168333, 'bear_time_stop': 131, 'bear_use_sma': True, 'bear_use_ema': True, 'bear_use_atr': True, 'bear_use_adx': False, 'bear_use_spike': False, 'bear_rsi_required': True, 'sideways_strategy': 'breakout', 'sideways_bb_std_mult': 1.688954184236997, 'sideways_rsi_os': 53, 'sideways_rsi_ob': 64, 'sideways_adx_thresh': 7.7465747559610145, 'sideways_atr_min_pct': 0.005598010861740763, 'sideways_atr_max_pct': 0.0974422206709899, 'sideways_tp_mult': 1.4067582396702893, 'sideways_tsl_mult': 0.31740879689217993, 'sideways_time_stop': 182, 'sideways_use_sma': True, 'sideways_use_ema': False, 'sideways_use_atr': True, 'sideways_use_adx': True, 'sideways_use_spike': False, 'sideways_rsi_required': True}.
[I 2025-09-01 14:35:28,663] Trial 627 finished with values: [-1000000000.0, 1000000000.0] and parameters: {'p_sma': 17, 'p_std': 49, 'p_atr': 25, 'p_adx': 20, 'rsi_period': 66, 'ema1': 10, 'ema2': 17, 'slip_atr_k': 0.12693484867016394, 'slip_spread_k': 0.8309244934764362, 'spread_hl_frac': 0.04244637772751726, 'bb_std_mult': 3.1914872607120666, 'rsi_os': 41, 'rsi_ob': 84, 'vol_spike': 0.24013337878645988, 'adx_thresh': 22.026079662726328, 'atr_min_pct': 0.02476850471417919, 'atr_max_pct': 0.012766377529888823, 'tp_mult': 1.0457074459747098, 'tsl_mult': 0.7529273259879317, 'strategy': 'breakout', 'time_stop': 238, 'use_sma': True, 'use_atr': True, 'use_adx': False, 'use_ema': True, 'use_spike': True, 'rsi_required': False, 'edge_k': 0.8668618168296588, 'edge_cap': 0.36906807354494875, 'bull_strategy': 'breakout', 'bull_bb_std_mult': 3.265443471955032, 'bull_rsi_os': 36, 'bull_rsi_ob': 51, 'bull_adx_thresh': 30.006249986997226, 'bull_atr_min_pct': 0.004954990410670249, 'bull_atr_max_pct': 0.01246468928193259, 'bull_tp_mult': 1.8290279391483648, 'bull_tsl_mult': 0.4726645448582121, 'bull_time_stop': 88, 'bull_use_sma': False, 'bull_use_ema': True, 'bull_use_atr': True, 'bull_use_adx': False, 'bull_use_spike': False, 'bull_rsi_required': False, 'bear_strategy': 'breakout', 'bear_bb_std_mult': 3.546706016209882, 'bear_rsi_os': 35, 'bear_rsi_ob': 90, 'bear_adx_thresh': 7.286818876782473, 'bear_atr_min_pct': 0.0034492018440764926, 'bear_atr_max_pct': 0.03791279432492929, 'bear_tp_mult': 2.1289790737994987, 'bear_tsl_mult': 0.40359552890883565, 'bear_time_stop': 92, 'bear_use_sma': False, 'bear_use_ema': True, 'bear_use_atr': True, 'bear_use_adx': True, 'bear_use_spike': True, 'bear_rsi_required': True, 'sideways_strategy': 'mean_reversion', 'sideways_bb_std_mult': 3.3971662569256043, 'sideways_rsi_os': 53, 'sideways_rsi_ob': 80, 'sideways_adx_thresh': 7.559351799326591, 'sideways_atr_min_pct': 0.009925366026356647, 'sideways_atr_max_pct': 0.06502403249855783, 'sideways_tp_mult': 2.695853244496196, 'sideways_tsl_mult': 0.7735162968288521, 'sideways_time_stop': 160, 'sideways_use_sma': True, 'sideways_use_ema': False, 'sideways_use_atr': False, 'sideways_use_adx': True, 'sideways_use_spike': False, 'sideways_rsi_required': False}.
[I 2025-09-01 14:36:11,711] Trial 626 finished with values: [-1000000000.0, 1000000000.0] and parameters: {'p_sma': 34, 'p_std': 49, 'p_atr': 15, 'p_adx': 11, 'rsi_period': 66, 'ema1': 10, 'ema2': 17, 'slip_atr_k': 0.0262987105278025, 'slip_spread_k': 0.1290720997739995, 'spread_hl_frac': 0.005980908891854841, 'bb_std_mult': 1.8543975993270703, 'rsi_os': 32, 'rsi_ob': 84, 'vol_spike': 0.23602944381694765, 'adx_thresh': 31.422878536611158, 'atr_min_pct': 0.005072602823342593, 'atr_max_pct': 0.13514498895598187, 'tp_mult': 1.0701535876302726, 'tsl_mult': 0.7546495246523514, 'strategy': 'breakout', 'time_stop': 36, 'use_sma': True, 'use_atr': True, 'use_adx': False, 'use_ema': True, 'use_spike': True, 'rsi_required': False, 'edge_k': 0.9799645221802844, 'edge_cap': 0.5923565931887594, 'bull_strategy': 'mean_reversion', 'bull_bb_std_mult': 3.462968968352835, 'bull_rsi_os': 36, 'bull_rsi_ob': 57, 'bull_adx_thresh': 34.25033349659117, 'bull_atr_min_pct': 0.00497657693635609, 'bull_atr_max_pct': 0.022852682374057263, 'bull_tp_mult': 1.7292954468901456, 'bull_tsl_mult': 0.17941502882431398, 'bull_time_stop': 99, 'bull_use_sma': False, 'bull_use_ema': False, 'bull_use_atr': True, 'bull_use_adx': True, 'bull_use_spike': False, 'bull_rsi_required': False, 'bear_strategy': 'breakout', 'bear_bb_std_mult': 2.5905283671663004, 'bear_rsi_os': 35, 'bear_rsi_ob': 88, 'bear_adx_thresh': 6.962333380023342, 'bear_atr_min_pct': 0.012708569446420183, 'bear_atr_max_pct': 0.04740513241843838, 'bear_tp_mult': 2.32251434299499, 'bear_tsl_mult': 0.12551831391019252, 'bear_time_stop': 93, 'bear_use_sma': False, 'bear_use_ema': True, 'bear_use_atr': True, 'bear_use_adx': True, 'bear_use_spike': True, 'bear_rsi_required': True, 'sideways_strategy': 'mean_reversion', 'sideways_bb_std_mult': 1.4191018494269843, 'sideways_rsi_os': 14, 'sideways_rsi_ob': 68, 'sideways_adx_thresh': 25.902648724622562, 'sideways_atr_min_pct': 0.014460412163222821, 'sideways_atr_max_pct': 0.06527136939745423, 'sideways_tp_mult': 2.2488050693528, 'sideways_tsl_mult': 0.3149241105741575, 'sideways_time_stop': 163, 'sideways_use_sma': True, 'sideways_use_ema': False, 'sideways_use_atr': False, 'sideways_use_adx': True, 'sideways_use_spike': False, 'sideways_rsi_required': False}.
[I 2025-09-01 14:36:11,727] Trial 628 finished with values: [-1000000000.0, 1000000000.0] and parameters: {'p_sma': 32, 'p_std': 45, 'p_atr': 25, 'p_adx': 20, 'rsi_period': 61, 'ema1': 10, 'ema2': 17, 'slip_atr_k': 0.018756343696069194, 'slip_spread_k': 0.1876202712888811, 'spread_hl_frac': 0.006007137494762053, 'bb_std_mult': 1.7315362192763581, 'rsi_os': 40, 'rsi_ob': 76, 'vol_spike': 0.2387083593250348, 'adx_thresh': 22.24068735599671, 'atr_min_pct': 0.02830408161288296, 'atr_max_pct': 0.13489283282790276, 'tp_mult': 2.0620602194035746, 'tsl_mult': 0.9504899494631018, 'strategy': 'breakout', 'time_stop': 235, 'use_sma': True, 'use_atr': True, 'use_adx': False, 'use_ema': True, 'use_spike': True, 'rsi_required': False, 'edge_k': 1.922413514540501, 'edge_cap': 0.3716315630363552, 'bull_strategy': 'breakout', 'bull_bb_std_mult': 3.490308658257419, 'bull_rsi_os': 34, 'bull_rsi_ob': 51, 'bull_adx_thresh': 15.630489140434145, 'bull_atr_min_pct': 0.005069010811956671, 'bull_atr_max_pct': 0.07132784946364965, 'bull_tp_mult': 2.9079614072195032, 'bull_tsl_mult': 0.4699198091839814, 'bull_time_stop': 87, 'bull_use_sma': False, 'bull_use_ema': True, 'bull_use_atr': True, 'bull_use_adx': False, 'bull_use_spike': False, 'bull_rsi_required': False, 'bear_strategy': 'breakout', 'bear_bb_std_mult': 3.54025459250991, 'bear_rsi_os': 44, 'bear_rsi_ob': 90, 'bear_adx_thresh': 14.412822650802125, 'bear_atr_min_pct': 0.025696342715518232, 'bear_atr_max_pct': 0.10568403970769052, 'bear_tp_mult': 2.18633423325348, 'bear_tsl_mult': 0.7629439101740014, 'bear_time_stop': 257, 'bear_use_sma': False, 'bear_use_ema': True, 'bear_use_atr': True, 'bear_use_adx': True, 'bear_use_spike': True, 'bear_rsi_required': True, 'sideways_strategy': 'mean_reversion', 'sideways_bb_std_mult': 3.2931916334672993, 'sideways_rsi_os': 39, 'sideways_rsi_ob': 73, 'sideways_adx_thresh': 30.52540659840585, 'sideways_atr_min_pct': 0.02160557959827347, 'sideways_atr_max_pct': 0.06525804095341255, 'sideways_tp_mult': 2.719740309978694, 'sideways_tsl_mult': 0.25350578267551915, 'sideways_time_stop': 163, 'sideways_use_sma': True, 'sideways_use_ema': False, 'sideways_use_atr': False, 'sideways_use_adx': True, 'sideways_use_spike': False, 'sideways_rsi_required': False}.
[I 2025-09-01 14:36:11,989] Trial 625 finished with values: [-1000000000.0, 1000000000.0] and parameters: {'p_sma': 16, 'p_std': 33, 'p_atr': 26, 'p_adx': 11, 'rsi_period': 10, 'ema1': 21, 'ema2': 17, 'slip_atr_k': 1.2402206288952833e-05, 'slip_spread_k': 0.1282525008357654, 'spread_hl_frac': 0.007392992737457176, 'bb_std_mult': 3.0929059872337414, 'rsi_os': 38, 'rsi_ob': 84, 'vol_spike': 0.08235915862195226, 'adx_thresh': 29.615231644030764, 'atr_min_pct': 0.02749049594130774, 'atr_max_pct': 0.13521370894576581, 'tp_mult': 1.0505005377773162, 'tsl_mult': 0.7557447503734233, 'strategy': 'breakout', 'time_stop': 35, 'use_sma': True, 'use_atr': True, 'use_adx': False, 'use_ema': True, 'use_spike': True, 'rsi_required': False, 'edge_k': 1.9017921811750127, 'edge_cap': 0.3634266466460433, 'bull_strategy': 'mean_reversion', 'bull_bb_std_mult': 3.471074541250179, 'bull_rsi_os': 34, 'bull_rsi_ob': 56, 'bull_adx_thresh': 29.983522578939926, 'bull_atr_min_pct': 0.00529482514973749, 'bull_atr_max_pct': 0.023500941945733576, 'bull_tp_mult': 1.8186767007884337, 'bull_tsl_mult': 0.47108388457969924, 'bull_time_stop': 89, 'bull_use_sma': False, 'bull_use_ema': False, 'bull_use_atr': True, 'bull_use_adx': True, 'bull_use_spike': False, 'bull_rsi_required': True, 'bear_strategy': 'breakout', 'bear_bb_std_mult': 2.5876561490801593, 'bear_rsi_os': 19, 'bear_rsi_ob': 88, 'bear_adx_thresh': 16.319610358674538, 'bear_atr_min_pct': 0.005578574643992251, 'bear_atr_max_pct': 0.14795695557905197, 'bear_tp_mult': 1.9503860554895538, 'bear_tsl_mult': 0.18482101123663955, 'bear_time_stop': 211, 'bear_use_sma': True, 'bear_use_ema': True, 'bear_use_atr': True, 'bear_use_adx': True, 'bear_use_spike': False, 'bear_rsi_required': True, 'sideways_strategy': 'breakout', 'sideways_bb_std_mult': 3.2901735813590003, 'sideways_rsi_os': 49, 'sideways_rsi_ob': 79, 'sideways_adx_thresh': 24.908933714400636, 'sideways_atr_min_pct': 0.02942845792708057, 'sideways_atr_max_pct': 0.01060344023271756, 'sideways_tp_mult': 2.2570019940934993, 'sideways_tsl_mult': 0.3136960549941937, 'sideways_time_stop': 165, 'sideways_use_sma': True, 'sideways_use_ema': False, 'sideways_use_atr': True, 'sideways_use_adx': True, 'sideways_use_spike': False, 'sideways_rsi_required': False}.
[I 2025-09-01 14:36:12,615] Trial 629 finished with values: [-1000000000.0, 1000000000.0] and parameters: {'p_sma': 33, 'p_std': 23, 'p_atr': 15, 'p_adx': 12, 'rsi_period': 16, 'ema1': 21, 'ema2': 14, 'slip_atr_k': 0.017134005668636477, 'slip_spread_k': 0.04405682692294542, 'spread_hl_frac': 0.00569822576040474, 'bb_std_mult': 1.7513253189945472, 'rsi_os': 38, 'rsi_ob': 83, 'vol_spike': 0.24707888888619037, 'adx_thresh': 25.260914663694294, 'atr_min_pct': 0.027488261547145135, 'atr_max_pct': 0.13506036263670912, 'tp_mult': 1.1055002905585392, 'tsl_mult': 0.694869168322328, 'strategy': 'mean_reversion', 'time_stop': 275, 'use_sma': True, 'use_atr': True, 'use_adx': False, 'use_ema': True, 'use_spike': True, 'rsi_required': False, 'edge_k': 1.912650634377034, 'edge_cap': 0.35968851882618175, 'bull_strategy': 'breakout', 'bull_bb_std_mult': 3.393813788362874, 'bull_rsi_os': 11, 'bull_rsi_ob': 57, 'bull_adx_thresh': 24.36106319433788, 'bull_atr_min_pct': 0.0039195814818459756, 'bull_atr_max_pct': 0.022743621454783328, 'bull_tp_mult': 2.90766615629076, 'bull_tsl_mult': 0.44050817434009354, 'bull_time_stop': 52, 'bull_use_sma': False, 'bull_use_ema': True, 'bull_use_atr': True, 'bull_use_adx': True, 'bull_use_spike': False, 'bull_rsi_required': False, 'bear_strategy': 'breakout', 'bear_bb_std_mult': 3.431304404596979, 'bear_rsi_os': 37, 'bear_rsi_ob': 88, 'bear_adx_thresh': 11.406881243824989, 'bear_atr_min_pct': 0.012702398175356778, 'bear_atr_max_pct': 0.10345429254391236, 'bear_tp_mult': 2.1798622609898604, 'bear_tsl_mult': 0.1913371502411136, 'bear_time_stop': 55, 'bear_use_sma': False, 'bear_use_ema': True, 'bear_use_atr': True, 'bear_use_adx': True, 'bear_use_spike': False, 'bear_rsi_required': True, 'sideways_strategy': 'mean_reversion', 'sideways_bb_std_mult': 1.4018914324086291, 'sideways_rsi_os': 20, 'sideways_rsi_ob': 46, 'sideways_adx_thresh': 15.967817454701388, 'sideways_atr_min_pct': 0.02184261838323174, 'sideways_atr_max_pct': 0.060809941268652135, 'sideways_tp_mult': 2.737840442738644, 'sideways_tsl_mult': 0.25061136644132487, 'sideways_time_stop': 59, 'sideways_use_sma': True, 'sideways_use_ema': False, 'sideways_use_atr': True, 'sideways_use_adx': True, 'sideways_use_spike': False, 'sideways_rsi_required': False}.
