[I 2025-09-01 13:40:18,799] Trial 246 finished with values: [-1000000000.0, 1000000000.0] and parameters: {'p_sma': 35, 'p_std': 49, 'p_atr': 25, 'p_adx': 12, 'rsi_period': 58, 'ema1': 21, 'ema2': 15, 'slip_atr_k': 0.012019286844454913, 'slip_spread_k': 0.08680634529186981, 'spread_hl_frac': 0.007141443767008201, 'bb_std_mult': 1.702260851253808, 'rsi_os': 38, 'rsi_ob': 84, 'vol_spike': 0.23582085220052498, 'adx_thresh': 24.995151334395228, 'atr_min_pct': 0.026888684583349243, 'atr_max_pct': 0.1426848212182723, 'tp_mult': 1.1209926919600814, 'tsl_mult': 0.6060613431685576, 'strategy': 'mean_reversion', 'time_stop': 222, 'use_sma': True, 'use_atr': False, 'use_adx': False, 'use_ema': True, 'use_spike': True, 'rsi_required': False, 'edge_k': 0.8723339094255825, 'edge_cap': 0.3537416808203974, 'bull_strategy': 'breakout', 'bull_bb_std_mult': 3.2080680948223086, 'bull_rsi_os': 33, 'bull_rsi_ob': 51, 'bull_adx_thresh': 28.644331864285213, 'bull_atr_min_pct': 0.006735384178674772, 'bull_atr_max_pct': 0.027369927084005152, 'bull_tp_mult': 2.961227800979175, 'bull_tsl_mult': 0.46265758132671225, 'bull_time_stop': 100, 'bull_use_sma': True, 'bull_use_ema': True, 'bull_use_atr': True, 'bull_use_adx': True, 'bull_use_spike': False, 'bull_rsi_required': True, 'bear_strategy': 'breakout', 'bear_bb_std_mult': 3.511548915923395, 'bear_rsi_os': 34, 'bear_rsi_ob': 88, 'bear_adx_thresh': 12.597959449321621, 'bear_atr_min_pct': 0.0027072752014071074, 'bear_atr_max_pct': 0.044979153382237895, 'bear_tp_mult': 2.382956916116236, 'bear_tsl_mult': 0.16647016335522563, 'bear_time_stop': 218, 'bear_use_sma': True, 'bear_use_ema': True, 'bear_use_atr': True, 'bear_use_adx': True, 'bear_use_spike': False, 'bear_rsi_required': True, 'sideways_strategy': 'breakout', 'sideways_bb_std_mult': 1.6135997791302015, 'sideways_rsi_os': 52, 'sideways_rsi_ob': 66, 'sideways_adx_thresh': 6.614509423669807, 'sideways_atr_min_pct': 0.020196862707393043, 'sideways_atr_max_pct': 0.08639887490637788, 'sideways_tp_mult': 1.899075718938022, 'sideways_tsl_mult': 0.2652588068300657, 'sideways_time_stop': 179, 'sideways_use_sma': True, 'sideways_use_ema': False, 'sideways_use_atr': True, 'sideways_use_adx': True, 'sideways_use_spike': False, 'sideways_rsi_required': True}.
[I 2025-09-01 13:40:19,140] Trial 243 finished with values: [-0.029570607019941075, 0.029149602783252928] and parameters: {'p_sma': 35, 'p_std': 50, 'p_atr': 25, 'p_adx': 12, 'rsi_period': 62, 'ema1': 11, 'ema2': 17, 'slip_atr_k': 0.013115027729397316, 'slip_spread_k': 0.06848140433075325, 'spread_hl_frac': 0.005739251532781794, 'bb_std_mult': 1.7136666386357053, 'rsi_os': 38, 'rsi_ob': 83, 'vol_spike': 0.23382600914211027, 'adx_thresh': 23.97287225150044, 'atr_min_pct': 0.026287720906976675, 'atr_max_pct': 0.1322616305598951, 'tp_mult': 1.052757740253826, 'tsl_mult': 0.6040535049960873, 'strategy': 'mean_reversion', 'time_stop': 221, 'use_sma': True, 'use_atr': False, 'use_adx': True, 'use_ema': True, 'use_spike': True, 'rsi_required': False, 'edge_k': 0.9159094621333198, 'edge_cap': 0.3508397492901002, 'bull_strategy': 'breakout', 'bull_bb_std_mult': 3.1972422108111815, 'bull_rsi_os': 35, 'bull_rsi_ob': 52, 'bull_adx_thresh': 29.162908790230745, 'bull_atr_min_pct': 0.009321307046417104, 'bull_atr_max_pct': 0.03168104860851514, 'bull_tp_mult': 2.813985832579979, 'bull_tsl_mult': 0.45785354493590685, 'bull_time_stop': 95, 'bull_use_sma': True, 'bull_use_ema': True, 'bull_use_atr': True, 'bull_use_adx': True, 'bull_use_spike': True, 'bull_rsi_required': True, 'bear_strategy': 'breakout', 'bear_bb_std_mult': 3.5875509957195963, 'bear_rsi_os': 36, 'bear_rsi_ob': 88, 'bear_adx_thresh': 12.54846770987045, 'bear_atr_min_pct': 0.0017848710352256192, 'bear_atr_max_pct': 0.03321321341775674, 'bear_tp_mult': 2.3011969492546425, 'bear_tsl_mult': 0.16870955609149874, 'bear_time_stop': 218, 'bear_use_sma': True, 'bear_use_ema': True, 'bear_use_atr': True, 'bear_use_adx': True, 'bear_use_spike': False, 'bear_rsi_required': True, 'sideways_strategy': 'breakout', 'sideways_bb_std_mult': 1.4630097821058445, 'sideways_rsi_os': 51, 'sideways_rsi_ob': 67, 'sideways_adx_thresh': 6.453748482377368, 'sideways_atr_min_pct': 0.019857096511281768, 'sideways_atr_max_pct': 0.06810844295070534, 'sideways_tp_mult': 2.7708499662807116, 'sideways_tsl_mult': 0.26625557069738875, 'sideways_time_stop': 171, 'sideways_use_sma': True, 'sideways_use_ema': False, 'sideways_use_atr': True, 'sideways_use_adx': True, 'sideways_use_spike': True, 'sideways_rsi_required': True}.
[I 2025-09-01 13:40:19,705] Trial 242 finished with values: [-0.036322859941235186, 0.03590447813283318] and parameters: {'p_sma': 35, 'p_std': 49, 'p_atr': 25, 'p_adx': 8, 'rsi_period': 63, 'ema1': 21, 'ema2': 17, 'slip_atr_k': 0.014102606730575734, 'slip_spread_k': 0.08268622025205263, 'spread_hl_frac': 0.0054314343177787935, 'bb_std_mult': 1.7358620374264968, 'rsi_os': 29, 'rsi_ob': 83, 'vol_spike': 0.014002122849472054, 'adx_thresh': 24.200767703712504, 'atr_min_pct': 0.02692685044694858, 'atr_max_pct': 0.1331813020706512, 'tp_mult': 1.190475201491982, 'tsl_mult': 0.7595743314260698, 'strategy': 'mean_reversion', 'time_stop': 223, 'use_sma': True, 'use_atr': False, 'use_adx': True, 'use_ema': True, 'use_spike': True, 'rsi_required': False, 'edge_k': 0.8616767329635631, 'edge_cap': 0.3502846009845927, 'bull_strategy': 'breakout', 'bull_bb_std_mult': 3.226250907204221, 'bull_rsi_os': 35, 'bull_rsi_ob': 53, 'bull_adx_thresh': 29.013347552804817, 'bull_atr_min_pct': 0.009345346603543338, 'bull_atr_max_pct': 0.028471483950837023, 'bull_tp_mult': 2.9633966676822237, 'bull_tsl_mult': 0.4604779215694013, 'bull_time_stop': 92, 'bull_use_sma': True, 'bull_use_ema': True, 'bull_use_atr': True, 'bull_use_adx': True, 'bull_use_spike': True, 'bull_rsi_required': True, 'bear_strategy': 'breakout', 'bear_bb_std_mult': 3.5876375411038772, 'bear_rsi_os': 36, 'bear_rsi_ob': 88, 'bear_adx_thresh': 13.225156945759677, 'bear_atr_min_pct': 0.001566956434609883, 'bear_atr_max_pct': 0.033339593654179475, 'bear_tp_mult': 2.295529176585054, 'bear_tsl_mult': 0.16240617404601745, 'bear_time_stop': 218, 'bear_use_sma': True, 'bear_use_ema': True, 'bear_use_atr': True, 'bear_use_adx': True, 'bear_use_spike': False, 'bear_rsi_required': True, 'sideways_strategy': 'breakout', 'sideways_bb_std_mult': 1.4520777670043037, 'sideways_rsi_os': 52, 'sideways_rsi_ob': 67, 'sideways_adx_thresh': 6.354672724361207, 'sideways_atr_min_pct': 0.019801111118823173, 'sideways_atr_max_pct': 0.06938075470852927, 'sideways_tp_mult': 2.7520599004047237, 'sideways_tsl_mult': 0.2673046905622148, 'sideways_time_stop': 170, 'sideways_use_sma': True, 'sideways_use_ema': False, 'sideways_use_atr': True, 'sideways_use_adx': True, 'sideways_use_spike': True, 'sideways_rsi_required': True}.
[I 2025-09-01 13:40:19,705] Trial 244 finished with values: [-0.027518289322314926, 0.026941500655165717] and parameters: {'p_sma': 36, 'p_std': 51, 'p_atr': 26, 'p_adx': 12, 'rsi_period': 62, 'ema1': 21, 'ema2': 17, 'slip_atr_k': 0.012135879329372073, 'slip_spread_k': 0.06650515069453897, 'spread_hl_frac': 0.0056148522890134035, 'bb_std_mult': 1.7517516994714986, 'rsi_os': 38, 'rsi_ob': 84, 'vol_spike': 0.23196809588643547, 'adx_thresh': 24.07149303376877, 'atr_min_pct': 0.0263887860782862, 'atr_max_pct': 0.13274351905203613, 'tp_mult': 1.0551258144537028, 'tsl_mult': 0.7506827331969619, 'strategy': 'mean_reversion', 'time_stop': 220, 'use_sma': True, 'use_atr': False, 'use_adx': True, 'use_ema': True, 'use_spike': True, 'rsi_required': False, 'edge_k': 1.0008443466915593, 'edge_cap': 0.3511913904809298, 'bull_strategy': 'breakout', 'bull_bb_std_mult': 3.204408587899986, 'bull_rsi_os': 35, 'bull_rsi_ob': 53, 'bull_adx_thresh': 30.465484742991624, 'bull_atr_min_pct': 0.006752718180334615, 'bull_atr_max_pct': 0.029256125290931766, 'bull_tp_mult': 2.820112051768913, 'bull_tsl_mult': 0.45130495617441757, 'bull_time_stop': 93, 'bull_use_sma': True, 'bull_use_ema': True, 'bull_use_atr': True, 'bull_use_adx': True, 'bull_use_spike': True, 'bull_rsi_required': True, 'bear_strategy': 'breakout', 'bear_bb_std_mult': 3.477202077606158, 'bear_rsi_os': 36, 'bear_rsi_ob': 88, 'bear_adx_thresh': 13.145498069164649, 'bear_atr_min_pct': 0.002029874513454751, 'bear_atr_max_pct': 0.031817672771907814, 'bear_tp_mult': 2.2857416141458704, 'bear_tsl_mult': 0.1693001204810289, 'bear_time_stop': 218, 'bear_use_sma': True, 'bear_use_ema': True, 'bear_use_atr': True, 'bear_use_adx': True, 'bear_use_spike': False, 'bear_rsi_required': True, 'sideways_strategy': 'breakout', 'sideways_bb_std_mult': 1.471546200139541, 'sideways_rsi_os': 52, 'sideways_rsi_ob': 69, 'sideways_adx_thresh': 6.839626324707819, 'sideways_atr_min_pct': 0.019900849921020588, 'sideways_atr_max_pct': 0.06085823640993605, 'sideways_tp_mult': 2.774676959173355, 'sideways_tsl_mult': 0.26752678458647716, 'sideways_time_stop': 170, 'sideways_use_sma': True, 'sideways_use_ema': False, 'sideways_use_atr': True, 'sideways_use_adx': True, 'sideways_use_spike': True, 'sideways_rsi_required': True}.
[I 2025-09-01 13:40:57,439] Trial 250 finished with values: [-0.03382736362502725, 0.03327832407844958] and parameters: {'p_sma': 37, 'p_std': 14, 'p_atr': 24, 'p_adx': 12, 'rsi_period': 63, 'ema1': 7, 'ema2': 19, 'slip_atr_k': 0.018493299265690214, 'slip_spread_k': 0.03771072212439427, 'spread_hl_frac': 0.006900013906201286, 'bb_std_mult': 2.8571244777400793, 'rsi_os': 18, 'rsi_ob': 81, 'vol_spike': 0.278257389015846, 'adx_thresh': 25.996703597065856, 'atr_min_pct': 0.028625247417359032, 'atr_max_pct': 0.14058481596475317, 'tp_mult': 1.100438278446661, 'tsl_mult': 0.876656797378542, 'strategy': 'mean_reversion', 'time_stop': 234, 'use_sma': False, 'use_atr': False, 'use_adx': False, 'use_ema': False, 'use_spike': True, 'rsi_required': False, 'edge_k': 0.9897497058648613, 'edge_cap': 0.3311150591046076, 'bull_strategy': 'mean_reversion', 'bull_bb_std_mult': 1.2083539545619193, 'bull_rsi_os': 33, 'bull_rsi_ob': 54, 'bull_adx_thresh': 27.226388230083558, 'bull_atr_min_pct': 0.00470267680986615, 'bull_atr_max_pct': 0.035921148572021645, 'bull_tp_mult': 2.6791780687062308, 'bull_tsl_mult': 0.17530820823627757, 'bull_time_stop': 108, 'bull_use_sma': False, 'bull_use_ema': True, 'bull_use_atr': True, 'bull_use_adx': False, 'bull_use_spike': False, 'bull_rsi_required': True, 'bear_strategy': 'breakout', 'bear_bb_std_mult': 3.428139533986423, 'bear_rsi_os': 34, 'bear_rsi_ob': 86, 'bear_adx_thresh': 12.130559748512084, 'bear_atr_min_pct': 0.0003242674078165683, 'bear_atr_max_pct': 0.03920877132229212, 'bear_tp_mult': 1.8130254906214565, 'bear_tsl_mult': 0.12745132755984181, 'bear_time_stop': 231, 'bear_use_sma': False, 'bear_use_ema': True, 'bear_use_atr': True, 'bear_use_adx': False, 'bear_use_spike': False, 'bear_rsi_required': True, 'sideways_strategy': 'breakout', 'sideways_bb_std_mult': 1.379688614371405, 'sideways_rsi_os': 50, 'sideways_rsi_ob': 65, 'sideways_adx_thresh': 7.308136601780905, 'sideways_atr_min_pct': 0.02092347248376751, 'sideways_atr_max_pct': 0.03874005043423592, 'sideways_tp_mult': 1.0823296417779251, 'sideways_tsl_mult': 0.2946693480039407, 'sideways_time_stop': 180, 'sideways_use_sma': True, 'sideways_use_ema': False, 'sideways_use_atr': True, 'sideways_use_adx': True, 'sideways_use_spike': False, 'sideways_rsi_required': False}.
[I 2025-09-01 13:40:57,986] Trial 247 finished with values: [-0.022862052822665957, 0.022340631715064802] and parameters: {'p_sma': 36, 'p_std': 50, 'p_atr': 25, 'p_adx': 12, 'rsi_period': 63, 'ema1': 11, 'ema2': 11, 'slip_atr_k': 0.01913896040148572, 'slip_spread_k': 0.05148587258292254, 'spread_hl_frac': 0.005845000321269397, 'bb_std_mult': 1.726652074300403, 'rsi_os': 39, 'rsi_ob': 82, 'vol_spike': 0.06479301756394995, 'adx_thresh': 25.92961658819113, 'atr_min_pct': 0.023464417966678627, 'atr_max_pct': 0.14718349327875205, 'tp_mult': 1.1801317787644925, 'tsl_mult': 0.6502624934692999, 'strategy': 'mean_reversion', 'time_stop': 226, 'use_sma': True, 'use_atr': False, 'use_adx': True, 'use_ema': True, 'use_spike': True, 'rsi_required': False, 'edge_k': 1.0119021529072578, 'edge_cap': 0.34089894505660795, 'bull_strategy': 'breakout', 'bull_bb_std_mult': 3.2443517100491785, 'bull_rsi_os': 36, 'bull_rsi_ob': 52, 'bull_adx_thresh': 27.478070888475777, 'bull_atr_min_pct': 0.005754657817863384, 'bull_atr_max_pct': 0.02828742392689694, 'bull_tp_mult': 2.8089334272860325, 'bull_tsl_mult': 0.45930742653949347, 'bull_time_stop': 86, 'bull_use_sma': True, 'bull_use_ema': True, 'bull_use_atr': True, 'bull_use_adx': False, 'bull_use_spike': True, 'bull_rsi_required': True, 'bear_strategy': 'breakout', 'bear_bb_std_mult': 3.5954523358472312, 'bear_rsi_os': 34, 'bear_rsi_ob': 88, 'bear_adx_thresh': 12.991505273473615, 'bear_atr_min_pct': 0.0020422667356070285, 'bear_atr_max_pct': 0.026044158910981902, 'bear_tp_mult': 2.2868070567139025, 'bear_tsl_mult': 0.1641614959455203, 'bear_time_stop': 231, 'bear_use_sma': True, 'bear_use_ema': True, 'bear_use_atr': True, 'bear_use_adx': True, 'bear_use_spike': False, 'bear_rsi_required': True, 'sideways_strategy': 'breakout', 'sideways_bb_std_mult': 1.384786680581478, 'sideways_rsi_os': 53, 'sideways_rsi_ob': 68, 'sideways_adx_thresh': 6.188687609494805, 'sideways_atr_min_pct': 0.020961785536329255, 'sideways_atr_max_pct': 0.06168536451492866, 'sideways_tp_mult': 2.0917354976438087, 'sideways_tsl_mult': 0.256988037419467, 'sideways_time_stop': 177, 'sideways_use_sma': True, 'sideways_use_ema': False, 'sideways_use_atr': True, 'sideways_use_adx': True, 'sideways_use_spike': False, 'sideways_rsi_required': True}.
[I 2025-09-01 13:40:58,786] Trial 249 finished with values: [-1000000000.0, 1000000000.0] and parameters: {'p_sma': 37, 'p_std': 49, 'p_atr': 24, 'p_adx': 12, 'rsi_period': 61, 'ema1': 23, 'ema2': 11, 'slip_atr_k': 0.02007260834304152, 'slip_spread_k': 0.04263262659258843, 'spread_hl_frac': 0.008493664945894434, 'bb_std_mult': 2.8468386395747123, 'rsi_os': 8, 'rsi_ob': 81, 'vol_spike': 0.060475672413082715, 'adx_thresh': 26.207770922034946, 'atr_min_pct': 0.028277070836122534, 'atr_max_pct': 0.146703994941802, 'tp_mult': 1.096974107570198, 'tsl_mult': 0.7068619667064479, 'strategy': 'mean_reversion', 'time_stop': 235, 'use_sma': False, 'use_atr': False, 'use_adx': False, 'use_ema': False, 'use_spike': True, 'rsi_required': False, 'edge_k': 0.9705265738129443, 'edge_cap': 0.3325470612510107, 'bull_strategy': 'mean_reversion', 'bull_bb_std_mult': 2.257089580647927, 'bull_rsi_os': 33, 'bull_rsi_ob': 54, 'bull_adx_thresh': 27.8164687385782, 'bull_atr_min_pct': 0.0055563670901503295, 'bull_atr_max_pct': 0.024947898552551768, 'bull_tp_mult': 2.8926804353733053, 'bull_tsl_mult': 0.4919241944538455, 'bull_time_stop': 106, 'bull_use_sma': False, 'bull_use_ema': True, 'bull_use_atr': True, 'bull_use_adx': False, 'bull_use_spike': False, 'bull_rsi_required': True, 'bear_strategy': 'breakout', 'bear_bb_std_mult': 3.4043617889191053, 'bear_rsi_os': 33, 'bear_rsi_ob': 86, 'bear_adx_thresh': 12.126389380543666, 'bear_atr_min_pct': 0.0001535163851985764, 'bear_atr_max_pct': 0.05725416849270181, 'bear_tp_mult': 2.1987235102477167, 'bear_tsl_mult': 0.12894789813317253, 'bear_time_stop': 233, 'bear_use_sma': False, 'bear_use_ema': True, 'bear_use_atr': True, 'bear_use_adx': False, 'bear_use_spike': False, 'bear_rsi_required': True, 'sideways_strategy': 'breakout', 'sideways_bb_std_mult': 1.6803938785912844, 'sideways_rsi_os': 50, 'sideways_rsi_ob': 65, 'sideways_adx_thresh': 7.263522726720869, 'sideways_atr_min_pct': 0.020939828972854693, 'sideways_atr_max_pct': 0.04824345756859904, 'sideways_tp_mult': 2.0083809073084056, 'sideways_tsl_mult': 0.28613037484968723, 'sideways_time_stop': 179, 'sideways_use_sma': True, 'sideways_use_ema': False, 'sideways_use_atr': True, 'sideways_use_adx': True, 'sideways_use_spike': False, 'sideways_rsi_required': False}.
[I 2025-09-01 13:40:59,381] Trial 248 finished with values: [-0.025921754696068833, 0.025340350533675372] and parameters: {'p_sma': 37, 'p_std': 49, 'p_atr': 25, 'p_adx': 12, 'rsi_period': 63, 'ema1': 21, 'ema2': 19, 'slip_atr_k': 0.02044579874464207, 'slip_spread_k': 0.04921346857952372, 'spread_hl_frac': 0.006279604025493273, 'bb_std_mult': 1.7933122555085603, 'rsi_os': 7, 'rsi_ob': 82, 'vol_spike': 0.2288373574692211, 'adx_thresh': 26.203244665451074, 'atr_min_pct': 0.02789886905668334, 'atr_max_pct': 0.14674408635892716, 'tp_mult': 1.1919042614450084, 'tsl_mult': 0.710054857334166, 'strategy': 'mean_reversion', 'time_stop': 208, 'use_sma': False, 'use_atr': False, 'use_adx': False, 'use_ema': True, 'use_spike': True, 'rsi_required': False, 'edge_k': 1.0079059268322867, 'edge_cap': 0.3356867286774863, 'bull_strategy': 'breakout', 'bull_bb_std_mult': 0.7390050335969087, 'bull_rsi_os': 34, 'bull_rsi_ob': 54, 'bull_adx_thresh': 27.422134462673665, 'bull_atr_min_pct': 0.005386303305512508, 'bull_atr_max_pct': 0.029867904589328465, 'bull_tp_mult': 2.7393979573874248, 'bull_tsl_mult': 0.4835594280125242, 'bull_time_stop': 85, 'bull_use_sma': False, 'bull_use_ema': True, 'bull_use_atr': True, 'bull_use_adx': False, 'bull_use_spike': False, 'bull_rsi_required': True, 'bear_strategy': 'breakout', 'bear_bb_std_mult': 3.5050916394162615, 'bear_rsi_os': 34, 'bear_rsi_ob': 88, 'bear_adx_thresh': 13.257240185577874, 'bear_atr_min_pct': 0.00037913933136039194, 'bear_atr_max_pct': 0.03748458355643064, 'bear_tp_mult': 2.203118013324837, 'bear_tsl_mult': 0.13326613241116883, 'bear_time_stop': 232, 'bear_use_sma': False, 'bear_use_ema': True, 'bear_use_atr': True, 'bear_use_adx': True, 'bear_use_spike': False, 'bear_rsi_required': True, 'sideways_strategy': 'breakout', 'sideways_bb_std_mult': 1.6783930790919108, 'sideways_rsi_os': 53, 'sideways_rsi_ob': 68, 'sideways_adx_thresh': 6.856148254154055, 'sideways_atr_min_pct': 0.020952485198928932, 'sideways_atr_max_pct': 0.04746441912786553, 'sideways_tp_mult': 2.7738680164308755, 'sideways_tsl_mult': 0.29109372910742676, 'sideways_time_stop': 179, 'sideways_use_sma': True, 'sideways_use_ema': False, 'sideways_use_atr': True, 'sideways_use_adx': True, 'sideways_use_spike': False, 'sideways_rsi_required': True}.
[I 2025-09-01 13:41:40,066] Trial 251 finished with values: [-1000000000.0, 1000000000.0] and parameters: {'p_sma': 33, 'p_std': 49, 'p_atr': 25, 'p_adx': 12, 'rsi_period': 60, 'ema1': 20, 'ema2': 20, 'slip_atr_k': 0.008170345295722036, 'slip_spread_k': 0.04866542555827859, 'spread_hl_frac': 0.008368426833761015, 'bb_std_mult': 1.8174435641598605, 'rsi_os': 39, 'rsi_ob': 82, 'vol_spike': 0.22873055853296143, 'adx_thresh': 24.97368329939554, 'atr_min_pct': 0.02474532236528566, 'atr_max_pct': 0.12933966199215008, 'tp_mult': 1.1457050045251815, 'tsl_mult': 0.7038190511239536, 'strategy': 'mean_reversion', 'time_stop': 208, 'use_sma': True, 'use_atr': False, 'use_adx': False, 'use_ema': True, 'use_spike': True, 'rsi_required': False, 'edge_k': 0.8289965795279115, 'edge_cap': 0.305905584353537, 'bull_strategy': 'breakout', 'bull_bb_std_mult': 0.7095363142404387, 'bull_rsi_os': 38, 'bull_rsi_ob': 54, 'bull_adx_thresh': 23.49415001280984, 'bull_atr_min_pct': 0.005592287880552988, 'bull_atr_max_pct': 0.02553758192707921, 'bull_tp_mult': 2.7327106417951397, 'bull_tsl_mult': 0.4897910041637894, 'bull_time_stop': 87, 'bull_use_sma': True, 'bull_use_ema': True, 'bull_use_atr': False, 'bull_use_adx': False, 'bull_use_spike': False, 'bull_rsi_required': True, 'bear_strategy': 'breakout', 'bear_bb_std_mult': 3.5069952504923414, 'bear_rsi_os': 34, 'bear_rsi_ob': 85, 'bear_adx_thresh': 14.415980686293844, 'bear_atr_min_pct': 0.002777095399363729, 'bear_atr_max_pct': 0.02697294907635838, 'bear_tp_mult': 2.251336105041172, 'bear_tsl_mult': 0.1520250248368871, 'bear_time_stop': 207, 'bear_use_sma': True, 'bear_use_ema': True, 'bear_use_atr': True, 'bear_use_adx': True, 'bear_use_spike': True, 'bear_rsi_required': True, 'sideways_strategy': 'breakout', 'sideways_bb_std_mult': 1.6793446514107273, 'sideways_rsi_os': 53, 'sideways_rsi_ob': 68, 'sideways_adx_thresh': 34.859816431319196, 'sideways_atr_min_pct': 0.01892520623036576, 'sideways_atr_max_pct': 0.06601991581520747, 'sideways_tp_mult': 2.685601552484325, 'sideways_tsl_mult': 0.30116017027669173, 'sideways_time_stop': 162, 'sideways_use_sma': True, 'sideways_use_ema': True, 'sideways_use_atr': False, 'sideways_use_adx': True, 'sideways_use_spike': False, 'sideways_rsi_required': True}.
