[I 2025-09-01 14:40:53,518] Trial 656 finished with values: [-0.094024996493133, 0.0941777152950161] and parameters: {'p_sma': 38, 'p_std': 42, 'p_atr': 23, 'p_adx': 11, 'rsi_period': 67, 'ema1': 26, 'ema2': 20, 'slip_atr_k': 0.01845099861158669, 'slip_spread_k': 0.09809886256607239, 'spread_hl_frac': 0.008909266829344314, 'bb_std_mult': 1.9957894916796, 'rsi_os': 39, 'rsi_ob': 56, 'vol_spike': 0.05198573475896419, 'adx_thresh': 9.140049974112078, 'atr_min_pct': 0.025820210720337026, 'atr_max_pct': 0.08721397350138377, 'tp_mult': 1.1922632839022287, 'tsl_mult': 0.7151708519054714, 'strategy': 'mean_reversion', 'time_stop': 250, 'use_sma': True, 'use_atr': False, 'use_adx': False, 'use_ema': True, 'use_spike': True, 'rsi_required': False, 'edge_k': 0.595104664082243, 'edge_cap': 0.06629426188012932, 'bull_strategy': 'mean_reversion', 'bull_bb_std_mult': 3.277684399449993, 'bull_rsi_os': 36, 'bull_rsi_ob': 55, 'bull_adx_thresh': 30.672964243570487, 'bull_atr_min_pct': 0.01705979382822967, 'bull_atr_max_pct': 0.06580205865917962, 'bull_tp_mult': 2.904151041829232, 'bull_tsl_mult': 0.4304976107513309, 'bull_time_stop': 101, 'bull_use_sma': True, 'bull_use_ema': False, 'bull_use_atr': True, 'bull_use_adx': True, 'bull_use_spike': False, 'bull_rsi_required': False, 'bear_strategy': 'breakout', 'bear_bb_std_mult': 2.3910519502761587, 'bear_rsi_os': 52, 'bear_rsi_ob': 77, 'bear_adx_thresh': 11.450304550927486, 'bear_atr_min_pct': 0.0020000748107080867, 'bear_atr_max_pct': 0.06617458179589814, 'bear_tp_mult': 1.792100318109398, 'bear_tsl_mult': 0.23788214789646633, 'bear_time_stop': 219, 'bear_use_sma': False, 'bear_use_ema': True, 'bear_use_atr': True, 'bear_use_adx': True, 'bear_use_spike': True, 'bear_rsi_required': True, 'sideways_strategy': 'mean_reversion', 'sideways_bb_std_mult': 1.4877707314018003, 'sideways_rsi_os': 48, 'sideways_rsi_ob': 89, 'sideways_adx_thresh': 5.351656704441773, 'sideways_atr_min_pct': 0.0024132294212560364, 'sideways_atr_max_pct': 0.015093598654532775, 'sideways_tp_mult': 1.5827538732234767, 'sideways_tsl_mult': 0.41951483420666946, 'sideways_time_stop': 180, 'sideways_use_sma': True, 'sideways_use_ema': False, 'sideways_use_atr': False, 'sideways_use_adx': False, 'sideways_use_spike': False, 'sideways_rsi_required': True}.
[I 2025-09-01 14:40:54,182] Trial 658 finished with values: [-1000000000.0, 1000000000.0] and parameters: {'p_sma': 38, 'p_std': 49, 'p_atr': 20, 'p_adx': 13, 'rsi_period': 30, 'ema1': 9, 'ema2': 20, 'slip_atr_k': 0.0006879226961018503, 'slip_spread_k': 0.09668974497367991, 'spread_hl_frac': 0.008666525119709542, 'bb_std_mult': 1.8950886476239328, 'rsi_os': 38, 'rsi_ob': 65, 'vol_spike': 0.25314902302916664, 'adx_thresh': 23.43015804253947, 'atr_min_pct': 0.026563316285706465, 'atr_max_pct': 0.13183408293020438, 'tp_mult': 1.1046272004891688, 'tsl_mult': 0.22850526777261704, 'strategy': 'mean_reversion', 'time_stop': 186, 'use_sma': False, 'use_atr': False, 'use_adx': False, 'use_ema': True, 'use_spike': True, 'rsi_required': True, 'edge_k': 0.8075600761697839, 'edge_cap': 0.4811615499889541, 'bull_strategy': 'breakout', 'bull_bb_std_mult': 2.623207818815938, 'bull_rsi_os': 34, 'bull_rsi_ob': 79, 'bull_adx_thresh': 22.108894682746048, 'bull_atr_min_pct': 0.0033230089242720557, 'bull_atr_max_pct': 0.013422940729077307, 'bull_tp_mult': 2.8994754946714276, 'bull_tsl_mult': 0.2910228263195187, 'bull_time_stop': 82, 'bull_use_sma': True, 'bull_use_ema': True, 'bull_use_atr': True, 'bull_use_adx': True, 'bull_use_spike': False, 'bull_rsi_required': True, 'bear_strategy': 'breakout', 'bear_bb_std_mult': 1.6698546184749932, 'bear_rsi_os': 35, 'bear_rsi_ob': 77, 'bear_adx_thresh': 11.688854228583647, 'bear_atr_min_pct': 0.018510130958268207, 'bear_atr_max_pct': 0.0558703950940262, 'bear_tp_mult': 2.177380733368868, 'bear_tsl_mult': 0.20273388798502184, 'bear_time_stop': 230, 'bear_use_sma': True, 'bear_use_ema': True, 'bear_use_atr': True, 'bear_use_adx': False, 'bear_use_spike': True, 'bear_rsi_required': True, 'sideways_strategy': 'breakout', 'sideways_bb_std_mult': 1.6063032667881492, 'sideways_rsi_os': 48, 'sideways_rsi_ob': 69, 'sideways_adx_thresh': 5.32914142697541, 'sideways_atr_min_pct': 0.01788263676687664, 'sideways_atr_max_pct': 0.12251706844502545, 'sideways_tp_mult': 2.770199460516255, 'sideways_tsl_mult': 0.26884783395793477, 'sideways_time_stop': 42, 'sideways_use_sma': True, 'sideways_use_ema': False, 'sideways_use_atr': False, 'sideways_use_adx': True, 'sideways_use_spike': False, 'sideways_rsi_required': True}.
[I 2025-09-01 14:40:54,420] Trial 659 finished with values: [-0.0760135927796668, 0.0756613604175805] and parameters: {'p_sma': 33, 'p_std': 42, 'p_atr': 26, 'p_adx': 12, 'rsi_period': 7, 'ema1': 24, 'ema2': 22, 'slip_atr_k': 0.026707321516411253, 'slip_spread_k': 0.03517120008676354, 'spread_hl_frac': 0.00880465181217773, 'bb_std_mult': 1.8841492518523077, 'rsi_os': 39, 'rsi_ob': 84, 'vol_spike': 0.23576563679895465, 'adx_thresh': 25.054871632033716, 'atr_min_pct': 0.025613451974382483, 'atr_max_pct': 0.13210904016274744, 'tp_mult': 2.7670977644076156, 'tsl_mult': 0.710391110503225, 'strategy': 'mean_reversion', 'time_stop': 251, 'use_sma': False, 'use_atr': False, 'use_adx': False, 'use_ema': True, 'use_spike': True, 'rsi_required': True, 'edge_k': 0.11784932001521198, 'edge_cap': 0.3843356849176207, 'bull_strategy': 'breakout', 'bull_bb_std_mult': 3.1342074750240587, 'bull_rsi_os': 36, 'bull_rsi_ob': 65, 'bull_adx_thresh': 29.677102689994097, 'bull_atr_min_pct': 0.008584344006331113, 'bull_atr_max_pct': 0.04270278308619474, 'bull_tp_mult': 2.822098947546686, 'bull_tsl_mult': 0.39448123270494784, 'bull_time_stop': 101, 'bull_use_sma': True, 'bull_use_ema': True, 'bull_use_atr': True, 'bull_use_adx': True, 'bull_use_spike': False, 'bull_rsi_required': False, 'bear_strategy': 'breakout', 'bear_bb_std_mult': 3.0279024738482705, 'bear_rsi_os': 35, 'bear_rsi_ob': 77, 'bear_adx_thresh': 8.586357307301306, 'bear_atr_min_pct': 0.0018811254349900748, 'bear_atr_max_pct': 0.05619580842078758, 'bear_tp_mult': 1.4087635442358308, 'bear_tsl_mult': 0.9796397351125707, 'bear_time_stop': 204, 'bear_use_sma': True, 'bear_use_ema': True, 'bear_use_atr': True, 'bear_use_adx': False, 'bear_use_spike': True, 'bear_rsi_required': True, 'sideways_strategy': 'breakout', 'sideways_bb_std_mult': 1.6031521096129868, 'sideways_rsi_os': 53, 'sideways_rsi_ob': 52, 'sideways_adx_thresh': 7.571095893377333, 'sideways_atr_min_pct': 0.01797568608344148, 'sideways_atr_max_pct': 0.14010619978855776, 'sideways_tp_mult': 2.8026841850527457, 'sideways_tsl_mult': 0.2570498560702031, 'sideways_time_stop': 292, 'sideways_use_sma': True, 'sideways_use_ema': False, 'sideways_use_atr': False, 'sideways_use_adx': True, 'sideways_use_spike': False, 'sideways_rsi_required': True}.
[I 2025-09-01 14:41:29,396] Trial 663 finished with values: [-1000000000.0, 1000000000.0] and parameters: {'p_sma': 36, 'p_std': 18, 'p_atr': 11, 'p_adx': 17, 'rsi_period': 64, 'ema1': 8, 'ema2': 16, 'slip_atr_k': 0.030555235636473586, 'slip_spread_k': 0.14632792256279015, 'spread_hl_frac': 0.00601897182505055, 'bb_std_mult': 1.7983769997696764, 'rsi_os': 42, 'rsi_ob': 95, 'vol_spike': 0.09689289761341108, 'adx_thresh': 26.450264552695813, 'atr_min_pct': 0.026662173021763703, 'atr_max_pct': 0.04837470302946523, 'tp_mult': 1.0733668602684079, 'tsl_mult': 0.680286700904747, 'strategy': 'breakout', 'time_stop': 236, 'use_sma': True, 'use_atr': True, 'use_adx': True, 'use_ema': False, 'use_spike': False, 'rsi_required': False, 'edge_k': 0.861368178800261, 'edge_cap': 0.09072156041795892, 'bull_strategy': 'breakout', 'bull_bb_std_mult': 3.19562839146533, 'bull_rsi_os': 35, 'bull_rsi_ob': 72, 'bull_adx_thresh': 31.175914355315548, 'bull_atr_min_pct': 0.010249241973057583, 'bull_atr_max_pct': 0.021084625996305346, 'bull_tp_mult': 2.8197098186672713, 'bull_tsl_mult': 0.48537487282827024, 'bull_time_stop': 295, 'bull_use_sma': False, 'bull_use_ema': True, 'bull_use_atr': False, 'bull_use_adx': True, 'bull_use_spike': True, 'bull_rsi_required': True, 'bear_strategy': 'breakout', 'bear_bb_std_mult': 3.4575698064661076, 'bear_rsi_os': 42, 'bear_rsi_ob': 88, 'bear_adx_thresh': 33.341031092944746, 'bear_atr_min_pct': 0.02207729363126187, 'bear_atr_max_pct': 0.053115181649503206, 'bear_tp_mult': 2.3844235551561948, 'bear_tsl_mult': 0.161278197294379, 'bear_time_stop': 239, 'bear_use_sma': True, 'bear_use_ema': False, 'bear_use_atr': False, 'bear_use_adx': True, 'bear_use_spike': False, 'bear_rsi_required': False, 'sideways_strategy': 'breakout', 'sideways_bb_std_mult': 2.7403241903952216, 'sideways_rsi_os': 53, 'sideways_rsi_ob': 74, 'sideways_adx_thresh': 6.5352039274588885, 'sideways_atr_min_pct': 0.01979599186637546, 'sideways_atr_max_pct': 0.03554662653160081, 'sideways_tp_mult': 1.9105500682915104, 'sideways_tsl_mult': 0.025446144114383673, 'sideways_time_stop': 161, 'sideways_use_sma': False, 'sideways_use_ema': True, 'sideways_use_atr': True, 'sideways_use_adx': True, 'sideways_use_spike': False, 'sideways_rsi_required': False}.
[I 2025-09-01 14:41:29,870] Trial 662 finished with values: [-0.03207956712215132, 0.03269631258955115] and parameters: {'p_sma': 27, 'p_std': 17, 'p_atr': 17, 'p_adx': 12, 'rsi_period': 7, 'ema1': 24, 'ema2': 22, 'slip_atr_k': 0.027869047245357468, 'slip_spread_k': 0.048501481635032026, 'spread_hl_frac': 0.006044526966476067, 'bb_std_mult': 1.6877728681979842, 'rsi_os': 41, 'rsi_ob': 84, 'vol_spike': 0.23381567812874535, 'adx_thresh': 24.801750071038175, 'atr_min_pct': 0.02648366316014171, 'atr_max_pct': 0.1284061070944813, 'tp_mult': 2.9288513399923057, 'tsl_mult': 0.5564643340722779, 'strategy': 'breakout', 'time_stop': 234, 'use_sma': True, 'use_atr': False, 'use_adx': True, 'use_ema': False, 'use_spike': False, 'rsi_required': True, 'edge_k': 0.8466289514989742, 'edge_cap': 0.3901035860619706, 'bull_strategy': 'breakout', 'bull_bb_std_mult': 3.1402371312909128, 'bull_rsi_os': 20, 'bull_rsi_ob': 65, 'bull_adx_thresh': 31.41066666346849, 'bull_atr_min_pct': 0.00860729879708565, 'bull_atr_max_pct': 0.02121171385972353, 'bull_tp_mult': 2.819446193607359, 'bull_tsl_mult': 0.018729851267498432, 'bull_time_stop': 111, 'bull_use_sma': False, 'bull_use_ema': True, 'bull_use_atr': False, 'bull_use_adx': True, 'bull_use_spike': False, 'bull_rsi_required': True, 'bear_strategy': 'breakout', 'bear_bb_std_mult': 3.299171053681003, 'bear_rsi_os': 37, 'bear_rsi_ob': 87, 'bear_adx_thresh': 33.88667320607888, 'bear_atr_min_pct': 0.0035511275725179526, 'bear_atr_max_pct': 0.1361615334039048, 'bear_tp_mult': 2.2024042713992498, 'bear_tsl_mult': 0.153402629693982, 'bear_time_stop': 205, 'bear_use_sma': True, 'bear_use_ema': False, 'bear_use_atr': False, 'bear_use_adx': False, 'bear_use_spike': False, 'bear_rsi_required': False, 'sideways_strategy': 'breakout', 'sideways_bb_std_mult': 3.0749391865473226, 'sideways_rsi_os': 17, 'sideways_rsi_ob': 68, 'sideways_adx_thresh': 20.738328554589263, 'sideways_atr_min_pct': 0.0202460627115614, 'sideways_atr_max_pct': 0.10099901557122434, 'sideways_tp_mult': 2.8091037764621403, 'sideways_tsl_mult': 0.8049527146266754, 'sideways_time_stop': 195, 'sideways_use_sma': False, 'sideways_use_ema': True, 'sideways_use_atr': True, 'sideways_use_adx': True, 'sideways_use_spike': False, 'sideways_rsi_required': False}.
[I 2025-09-01 14:41:30,083] Trial 661 finished with values: [-1000000000.0, 1000000000.0] and parameters: {'p_sma': 33, 'p_std': 18, 'p_atr': 11, 'p_adx': 26, 'rsi_period': 66, 'ema1': 24, 'ema2': 22, 'slip_atr_k': 0.02959065746773523, 'slip_spread_k': 0.14226180788193463, 'spread_hl_frac': 0.005676324194268621, 'bb_std_mult': 1.8940711398772616, 'rsi_os': 41, 'rsi_ob': 84, 'vol_spike': 0.09725275845327255, 'adx_thresh': 26.562385171536405, 'atr_min_pct': 0.026687371727651534, 'atr_max_pct': 0.13189900439065463, 'tp_mult': 2.9375112940740395, 'tsl_mult': 0.3450148563572476, 'strategy': 'breakout', 'time_stop': 234, 'use_sma': False, 'use_atr': False, 'use_adx': True, 'use_ema': True, 'use_spike': True, 'rsi_required': True, 'edge_k': 0.8309742680209977, 'edge_cap': 0.3887445854219834, 'bull_strategy': 'breakout', 'bull_bb_std_mult': 3.131930423388245, 'bull_rsi_os': 34, 'bull_rsi_ob': 52, 'bull_adx_thresh': 8.63507469329009, 'bull_atr_min_pct': 0.029958106137350685, 'bull_atr_max_pct': 0.04282655558602783, 'bull_tp_mult': 2.8134626643045473, 'bull_tsl_mult': 0.01968090057435229, 'bull_time_stop': 206, 'bull_use_sma': True, 'bull_use_ema': True, 'bull_use_atr': False, 'bull_use_adx': True, 'bull_use_spike': False, 'bull_rsi_required': True, 'bear_strategy': 'breakout', 'bear_bb_std_mult': 3.3873001849508086, 'bear_rsi_os': 23, 'bear_rsi_ob': 94, 'bear_adx_thresh': 8.139158645338146, 'bear_atr_min_pct': 0.0036850639078677264, 'bear_atr_max_pct': 0.13807669587861415, 'bear_tp_mult': 2.1990379501844552, 'bear_tsl_mult': 0.18201050357997067, 'bear_time_stop': 235, 'bear_use_sma': True, 'bear_use_ema': True, 'bear_use_atr': True, 'bear_use_adx': False, 'bear_use_spike': False, 'bear_rsi_required': True, 'sideways_strategy': 'breakout', 'sideways_bb_std_mult': 1.5579588945212903, 'sideways_rsi_os': 53, 'sideways_rsi_ob': 69, 'sideways_adx_thresh': 7.731684838825104, 'sideways_atr_min_pct': 0.01981689712075498, 'sideways_atr_max_pct': 0.10017575415189134, 'sideways_tp_mult': 2.7691116267034754, 'sideways_tsl_mult': 0.2997839342948656, 'sideways_time_stop': 161, 'sideways_use_sma': True, 'sideways_use_ema': True, 'sideways_use_atr': True, 'sideways_use_adx': True, 'sideways_use_spike': False, 'sideways_rsi_required': True}.
[I 2025-09-01 14:41:30,461] Trial 660 finished with values: [-0.033429281652241793, 0.033553196729038566] and parameters: {'p_sma': 33, 'p_std': 49, 'p_atr': 13, 'p_adx': 12, 'rsi_period': 64, 'ema1': 9, 'ema2': 17, 'slip_atr_k': 0.0007417100194440519, 'slip_spread_k': 0.03401800233432528, 'spread_hl_frac': 0.006041161288896199, 'bb_std_mult': 1.8875802323498645, 'rsi_os': 42, 'rsi_ob': 52, 'vol_spike': 0.25423552848620407, 'adx_thresh': 9.436068637450722, 'atr_min_pct': 0.017649890818554878, 'atr_max_pct': 0.12859571234953718, 'tp_mult': 1.1967827071889359, 'tsl_mult': 0.6887596408471595, 'strategy': 'mean_reversion', 'time_stop': 186, 'use_sma': True, 'use_atr': False, 'use_adx': True, 'use_ema': True, 'use_spike': True, 'rsi_required': True, 'edge_k': 0.8372143589369436, 'edge_cap': 0.39007595698321135, 'bull_strategy': 'breakout', 'bull_bb_std_mult': 3.1856804626259314, 'bull_rsi_os': 34, 'bull_rsi_ob': 52, 'bull_adx_thresh': 29.902703677290624, 'bull_atr_min_pct': 0.010260174593287007, 'bull_atr_max_pct': 0.020641764907396963, 'bull_tp_mult': 2.6605722003192427, 'bull_tsl_mult': 0.10098786636572715, 'bull_time_stop': 206, 'bull_use_sma': True, 'bull_use_ema': True, 'bull_use_atr': False, 'bull_use_adx': True, 'bull_use_spike': False, 'bull_rsi_required': True, 'bear_strategy': 'breakout', 'bear_bb_std_mult': 3.358243670274008, 'bear_rsi_os': 37, 'bear_rsi_ob': 87, 'bear_adx_thresh': 8.378585694714927, 'bear_atr_min_pct': 0.0018455833239099072, 'bear_atr_max_pct': 0.13894247915300834, 'bear_tp_mult': 2.2002734207255754, 'bear_tsl_mult': 0.20409507400207008, 'bear_time_stop': 102, 'bear_use_sma': True, 'bear_use_ema': True, 'bear_use_atr': True, 'bear_use_adx': False, 'bear_use_spike': True, 'bear_rsi_required': True, 'sideways_strategy': 'breakout', 'sideways_bb_std_mult': 3.1903311514680492, 'sideways_rsi_os': 53, 'sideways_rsi_ob': 69, 'sideways_adx_thresh': 7.550515224215944, 'sideways_atr_min_pct': 0.01994586571871225, 'sideways_atr_max_pct': 0.07644153585185708, 'sideways_tp_mult': 2.807056749814429, 'sideways_tsl_mult': 0.02801344306590514, 'sideways_time_stop': 195, 'sideways_use_sma': True, 'sideways_use_ema': True, 'sideways_use_atr': False, 'sideways_use_adx': True, 'sideways_use_spike': False, 'sideways_rsi_required': True}.
[I 2025-09-01 14:41:31,368] Trial 666 finished with values: [-1000000000.0, 1000000000.0] and parameters: {'p_sma': 34, 'p_std': 48, 'p_atr': 24, 'p_adx': 12, 'rsi_period': 12, 'ema1': 21, 'ema2': 18, 'slip_atr_k': 0.015278633555186726, 'slip_spread_k': 0.07001007927679152, 'spread_hl_frac': 0.04790585052057911, 'bb_std_mult': 3.4942204201626996, 'rsi_os': 51, 'rsi_ob': 87, 'vol_spike': 0.2268960194340248, 'adx_thresh': 33.55917857529204, 'atr_min_pct': 7.73611876293892e-05, 'atr_max_pct': 0.14816238804603482, 'tp_mult': 1.6629779957793656, 'tsl_mult': 0.41544726083987904, 'strategy': 'mean_reversion', 'time_stop': 221, 'use_sma': True, 'use_atr': True, 'use_adx': False, 'use_ema': True, 'use_spike': True, 'rsi_required': False, 'edge_k': 0.6960120245151032, 'edge_cap': 0.3201756363778231, 'bull_strategy': 'breakout', 'bull_bb_std_mult': 1.701755833937973, 'bull_rsi_os': 31, 'bull_rsi_ob': 57, 'bull_adx_thresh': 28.09391044750177, 'bull_atr_min_pct': 0.004162541327771088, 'bull_atr_max_pct': 0.07783997735027533, 'bull_tp_mult': 2.855924180504452, 'bull_tsl_mult': 0.09997193269826748, 'bull_time_stop': 92, 'bull_use_sma': True, 'bull_use_ema': True, 'bull_use_atr': True, 'bull_use_adx': False, 'bull_use_spike': False, 'bull_rsi_required': True, 'bear_strategy': 'mean_reversion', 'bear_bb_std_mult': 3.5948144253883325, 'bear_rsi_os': 31, 'bear_rsi_ob': 90, 'bear_adx_thresh': 13.36454640423932, 'bear_atr_min_pct': 0.027811421561844067, 'bear_atr_max_pct': 0.03321805509717394, 'bear_tp_mult': 1.292351862726105, 'bear_tsl_mult': 0.1334459239242815, 'bear_time_stop': 216, 'bear_use_sma': True, 'bear_use_ema': True, 'bear_use_atr': True, 'bear_use_adx': True, 'bear_use_spike': False, 'bear_rsi_required': True, 'sideways_strategy': 'breakout', 'sideways_bb_std_mult': 1.807666967990205, 'sideways_rsi_os': 52, 'sideways_rsi_ob': 67, 'sideways_adx_thresh': 6.800639531034248, 'sideways_atr_min_pct': 0.021849401925680852, 'sideways_atr_max_pct': 0.019306749472077306, 'sideways_tp_mult': 2.7169519841291465, 'sideways_tsl_mult': 0.97021932994056, 'sideways_time_stop': 117, 'sideways_use_sma': True, 'sideways_use_ema': False, 'sideways_use_atr': True, 'sideways_use_adx': True, 'sideways_use_spike': True, 'sideways_rsi_required': True}.
[I 2025-09-01 14:42:02,721] Trial 667 finished with values: [-1000000000.0, 1000000000.0] and parameters: {'p_sma': 37, 'p_std': 55, 'p_atr': 26, 'p_adx': 12, 'rsi_period': 69, 'ema1': 21, 'ema2': 46, 'slip_atr_k': 0.015483687757404881, 'slip_spread_k': 0.07392797864034506, 'spread_hl_frac': 0.007321112976733939, 'bb_std_mult': 1.7672738491307856, 'rsi_os': 16, 'rsi_ob': 87, 'vol_spike': 0.24170862445378663, 'adx_thresh': 24.10703828773346, 'atr_min_pct': 0.013643783942215517, 'atr_max_pct': 0.1367308385139476, 'tp_mult': 1.0529321808877592, 'tsl_mult': 0.6345508280972818, 'strategy': 'mean_reversion', 'time_stop': 257, 'use_sma': True, 'use_atr': True, 'use_adx': False, 'use_ema': True, 'use_spike': True, 'rsi_required': False, 'edge_k': 0.927974216390973, 'edge_cap': 0.3190528155951243, 'bull_strategy': 'breakout', 'bull_bb_std_mult': 3.4141826245029137, 'bull_rsi_os': 43, 'bull_rsi_ob': 57, 'bull_adx_thresh': 16.943590773386077, 'bull_atr_min_pct': 0.004366595058573709, 'bull_atr_max_pct': 0.025458028624474913, 'bull_tp_mult': 2.8655684511556294, 'bull_tsl_mult': 0.4090732230923017, 'bull_time_stop': 239, 'bull_use_sma': True, 'bull_use_ema': True, 'bull_use_atr': True, 'bull_use_adx': False, 'bull_use_spike': True, 'bull_rsi_required': True, 'bear_strategy': 'mean_reversion', 'bear_bb_std_mult': 3.5499569953884964, 'bear_rsi_os': 33, 'bear_rsi_ob': 90, 'bear_adx_thresh': 13.330923816781068, 'bear_atr_min_pct': 0.004498358608676583, 'bear_atr_max_pct': 0.049430041505279756, 'bear_tp_mult': 2.0427777429488003, 'bear_tsl_mult': 0.14416506346350208, 'bear_time_stop': 217, 'bear_use_sma': True, 'bear_use_ema': True, 'bear_use_atr': True, 'bear_use_adx': True, 'bear_use_spike': False, 'bear_rsi_required': True, 'sideways_strategy': 'breakout', 'sideways_bb_std_mult': 1.8154714591513887, 'sideways_rsi_os': 14, 'sideways_rsi_ob': 71, 'sideways_adx_thresh': 9.144327700499922, 'sideways_atr_min_pct': 0.010266200645190484, 'sideways_atr_max_pct': 0.10434747684391289, 'sideways_tp_mult': 2.719613327040475, 'sideways_tsl_mult': 0.195545341506219, 'sideways_time_stop': 174, 'sideways_use_sma': True, 'sideways_use_ema': False, 'sideways_use_atr': True, 'sideways_use_adx': True, 'sideways_use_spike': True, 'sideways_rsi_required': True}.
