[I 2025-09-01 14:17:33,466] Trial 498 finished with values: [-1000000000.0, 1000000000.0] and parameters: {'p_sma': 38, 'p_std': 49, 'p_atr': 12, 'p_adx': 12, 'rsi_period': 65, 'ema1': 20, 'ema2': 40, 'slip_atr_k': 0.020087562754074664, 'slip_spread_k': 0.07284236688294644, 'spread_hl_frac': 0.012944520803890646, 'bb_std_mult': 1.5839450813278926, 'rsi_os': 38, 'rsi_ob': 82, 'vol_spike': 0.22084560815274595, 'adx_thresh': 25.709896926370686, 'atr_min_pct': 0.026645127168753623, 'atr_max_pct': 0.13570916141713907, 'tp_mult': 1.1227634817589545, 'tsl_mult': 0.7917067374943154, 'strategy': 'breakout', 'time_stop': 214, 'use_sma': True, 'use_atr': False, 'use_adx': True, 'use_ema': True, 'use_spike': True, 'rsi_required': False, 'edge_k': 0.9152019759649311, 'edge_cap': 0.32116901384176294, 'bull_strategy': 'breakout', 'bull_bb_std_mult': 2.8398662769582, 'bull_rsi_os': 32, 'bull_rsi_ob': 91, 'bull_adx_thresh': 30.52557982577986, 'bull_atr_min_pct': 0.023958550340179727, 'bull_atr_max_pct': 0.019004413631478236, 'bull_tp_mult': 2.0518530133712414, 'bull_tsl_mult': 0.41715510420871094, 'bull_time_stop': 80, 'bull_use_sma': False, 'bull_use_ema': True, 'bull_use_atr': False, 'bull_use_adx': True, 'bull_use_spike': False, 'bull_rsi_required': False, 'bear_strategy': 'mean_reversion', 'bear_bb_std_mult': 3.4796074758133915, 'bear_rsi_os': 34, 'bear_rsi_ob': 88, 'bear_adx_thresh': 10.76478056981695, 'bear_atr_min_pct': 0.0017643945427811092, 'bear_atr_max_pct': 0.12935895774751718, 'bear_tp_mult': 1.0500064030370155, 'bear_tsl_mult': 0.08568104224415668, 'bear_time_stop': 89, 'bear_use_sma': True, 'bear_use_ema': False, 'bear_use_atr': True, 'bear_use_adx': True, 'bear_use_spike': False, 'bear_rsi_required': True, 'sideways_strategy': 'breakout', 'sideways_bb_std_mult': 2.8718049875263105, 'sideways_rsi_os': 53, 'sideways_rsi_ob': 70, 'sideways_adx_thresh': 17.448471188432677, 'sideways_atr_min_pct': 0.02091449960725515, 'sideways_atr_max_pct': 0.07583257738710908, 'sideways_tp_mult': 2.2832370212047883, 'sideways_tsl_mult': 0.6720870072326248, 'sideways_time_stop': 258, 'sideways_use_sma': True, 'sideways_use_ema': True, 'sideways_use_atr': True, 'sideways_use_adx': False, 'sideways_use_spike': True, 'sideways_rsi_required': False}.
[I 2025-09-01 14:17:33,645] Trial 497 finished with values: [-1000000000.0, 1000000000.0] and parameters: {'p_sma': 42, 'p_std': 49, 'p_atr': 25, 'p_adx': 12, 'rsi_period': 70, 'ema1': 20, 'ema2': 18, 'slip_atr_k': 0.010128171162414917, 'slip_spread_k': 0.07170766993113854, 'spread_hl_frac': 0.025096363007643223, 'bb_std_mult': 3.459592652805065, 'rsi_os': 40, 'rsi_ob': 82, 'vol_spike': 0.22361017141747336, 'adx_thresh': 25.68630997312898, 'atr_min_pct': 0.02646667230459713, 'atr_max_pct': 0.13511264966368905, 'tp_mult': 1.0832725996876142, 'tsl_mult': 0.7876969001768729, 'strategy': 'breakout', 'time_stop': 20, 'use_sma': True, 'use_atr': False, 'use_adx': False, 'use_ema': True, 'use_spike': True, 'rsi_required': False, 'edge_k': 1.0584870641626782, 'edge_cap': 0.32086770304376583, 'bull_strategy': 'breakout', 'bull_bb_std_mult': 0.7680836669555853, 'bull_rsi_os': 11, 'bull_rsi_ob': 88, 'bull_adx_thresh': 13.671832487805872, 'bull_atr_min_pct': 0.012836225963235227, 'bull_atr_max_pct': 0.06033599839824451, 'bull_tp_mult': 2.5261523613218904, 'bull_tsl_mult': 0.45405889876458516, 'bull_time_stop': 73, 'bull_use_sma': False, 'bull_use_ema': True, 'bull_use_atr': True, 'bull_use_adx': True, 'bull_use_spike': False, 'bull_rsi_required': False, 'bear_strategy': 'mean_reversion', 'bear_bb_std_mult': 3.4843709323655663, 'bear_rsi_os': 34, 'bear_rsi_ob': 83, 'bear_adx_thresh': 33.18446315451805, 'bear_atr_min_pct': 0.028025394253422462, 'bear_atr_max_pct': 0.04725944850366315, 'bear_tp_mult': 1.1152074732255657, 'bear_tsl_mult': 0.09319552829656032, 'bear_time_stop': 225, 'bear_use_sma': True, 'bear_use_ema': False, 'bear_use_atr': True, 'bear_use_adx': True, 'bear_use_spike': False, 'bear_rsi_required': True, 'sideways_strategy': 'breakout', 'sideways_bb_std_mult': 1.9121491531032473, 'sideways_rsi_os': 52, 'sideways_rsi_ob': 70, 'sideways_adx_thresh': 6.590612878945584, 'sideways_atr_min_pct': 0.020855889666783367, 'sideways_atr_max_pct': 0.07156698804070723, 'sideways_tp_mult': 2.645962547668791, 'sideways_tsl_mult': 0.29110443977021316, 'sideways_time_stop': 176, 'sideways_use_sma': True, 'sideways_use_ema': True, 'sideways_use_atr': True, 'sideways_use_adx': False, 'sideways_use_spike': True, 'sideways_rsi_required': False}.
[I 2025-09-01 14:17:33,652] Trial 495 finished with values: [-1000000000.0, 1000000000.0] and parameters: {'p_sma': 5, 'p_std': 49, 'p_atr': 12, 'p_adx': 12, 'rsi_period': 54, 'ema1': 26, 'ema2': 18, 'slip_atr_k': 0.23520262269593217, 'slip_spread_k': 0.7049783287202874, 'spread_hl_frac': 0.019291849321210967, 'bb_std_mult': 2.4896842990598778, 'rsi_os': 40, 'rsi_ob': 82, 'vol_spike': 0.22202479565740535, 'adx_thresh': 26.89385886522994, 'atr_min_pct': 0.02622108977733243, 'atr_max_pct': 0.13507746058889528, 'tp_mult': 1.9877966136306953, 'tsl_mult': 0.36152246159799706, 'strategy': 'breakout', 'time_stop': 20, 'use_sma': True, 'use_atr': False, 'use_adx': False, 'use_ema': True, 'use_spike': True, 'rsi_required': False, 'edge_k': 1.1865878749363643, 'edge_cap': 0.32124408189256526, 'bull_strategy': 'breakout', 'bull_bb_std_mult': 0.506354056957363, 'bull_rsi_os': 16, 'bull_rsi_ob': 52, 'bull_adx_thresh': 28.843818338060682, 'bull_atr_min_pct': 0.004894771397504686, 'bull_atr_max_pct': 0.019591913864462324, 'bull_tp_mult': 2.347266877452598, 'bull_tsl_mult': 0.17717549366255314, 'bull_time_stop': 283, 'bull_use_sma': False, 'bull_use_ema': True, 'bull_use_atr': True, 'bull_use_adx': True, 'bull_use_spike': False, 'bull_rsi_required': False, 'bear_strategy': 'mean_reversion', 'bear_bb_std_mult': 3.482606188088301, 'bear_rsi_os': 38, 'bear_rsi_ob': 88, 'bear_adx_thresh': 24.298442182423248, 'bear_atr_min_pct': 0.028034430228709897, 'bear_atr_max_pct': 0.04699806248036934, 'bear_tp_mult': 2.1618475540269246, 'bear_tsl_mult': 0.09564301120977856, 'bear_time_stop': 225, 'bear_use_sma': True, 'bear_use_ema': False, 'bear_use_atr': True, 'bear_use_adx': True, 'bear_use_spike': False, 'bear_rsi_required': True, 'sideways_strategy': 'breakout', 'sideways_bb_std_mult': 1.5375498860202212, 'sideways_rsi_os': 6, 'sideways_rsi_ob': 70, 'sideways_adx_thresh': 6.028272502647348, 'sideways_atr_min_pct': 0.02091545396175763, 'sideways_atr_max_pct': 0.07431593049437511, 'sideways_tp_mult': 2.0324538741033833, 'sideways_tsl_mult': 0.8669863420407172, 'sideways_time_stop': 177, 'sideways_use_sma': True, 'sideways_use_ema': True, 'sideways_use_atr': True, 'sideways_use_adx': False, 'sideways_use_spike': True, 'sideways_rsi_required': False}.
[I 2025-09-01 14:17:33,936] Trial 496 finished with values: [-1000000000.0, 1000000000.0] and parameters: {'p_sma': 5, 'p_std': 49, 'p_atr': 12, 'p_adx': 12, 'rsi_period': 65, 'ema1': 20, 'ema2': 23, 'slip_atr_k': 0.009598344125212191, 'slip_spread_k': 0.7080680341668035, 'spread_hl_frac': 0.03846755907664728, 'bb_std_mult': 3.4776885917324787, 'rsi_os': 40, 'rsi_ob': 82, 'vol_spike': 0.25417907789254846, 'adx_thresh': 25.755683118793797, 'atr_min_pct': 0.026246890633765205, 'atr_max_pct': 0.13426744784735625, 'tp_mult': 1.0916671126625355, 'tsl_mult': 0.9638911606633236, 'strategy': 'breakout', 'time_stop': 192, 'use_sma': True, 'use_atr': False, 'use_adx': False, 'use_ema': True, 'use_spike': True, 'rsi_required': False, 'edge_k': 1.0654911283109385, 'edge_cap': 0.3202057498362159, 'bull_strategy': 'breakout', 'bull_bb_std_mult': 3.0191639821368614, 'bull_rsi_os': 32, 'bull_rsi_ob': 88, 'bull_adx_thresh': 31.92871482951189, 'bull_atr_min_pct': 0.004854275931583999, 'bull_atr_max_pct': 0.01940548423480063, 'bull_tp_mult': 2.8139078347518645, 'bull_tsl_mult': 0.5809441972202269, 'bull_time_stop': 93, 'bull_use_sma': False, 'bull_use_ema': True, 'bull_use_atr': True, 'bull_use_adx': True, 'bull_use_spike': False, 'bull_rsi_required': False, 'bear_strategy': 'mean_reversion', 'bear_bb_std_mult': 3.479519348128974, 'bear_rsi_os': 38, 'bear_rsi_ob': 88, 'bear_adx_thresh': 12.048238462978226, 'bear_atr_min_pct': 0.02930913976328489, 'bear_atr_max_pct': 0.04695205352265694, 'bear_tp_mult': 2.155918369400765, 'bear_tsl_mult': 0.09155830584844707, 'bear_time_stop': 13, 'bear_use_sma': True, 'bear_use_ema': False, 'bear_use_atr': True, 'bear_use_adx': True, 'bear_use_spike': False, 'bear_rsi_required': True, 'sideways_strategy': 'breakout', 'sideways_bb_std_mult': 1.679827961048471, 'sideways_rsi_os': 6, 'sideways_rsi_ob': 70, 'sideways_adx_thresh': 17.33446111007103, 'sideways_atr_min_pct': 0.02080548046303308, 'sideways_atr_max_pct': 0.0986902648815269, 'sideways_tp_mult': 2.2892201852540306, 'sideways_tsl_mult': 0.2872372123244351, 'sideways_time_stop': 179, 'sideways_use_sma': True, 'sideways_use_ema': True, 'sideways_use_atr': True, 'sideways_use_adx': False, 'sideways_use_spike': True, 'sideways_rsi_required': False}.
[I 2025-09-01 14:17:34,677] Trial 499 finished with values: [-1000000000.0, 1000000000.0] and parameters: {'p_sma': 37, 'p_std': 54, 'p_atr': 18, 'p_adx': 11, 'rsi_period': 62, 'ema1': 10, 'ema2': 14, 'slip_atr_k': 0.01580061977742045, 'slip_spread_k': 0.9997385919859285, 'spread_hl_frac': 0.005961785284039494, 'bb_std_mult': 3.035304008067781, 'rsi_os': 53, 'rsi_ob': 83, 'vol_spike': 0.1935609255825292, 'adx_thresh': 25.132722816378323, 'atr_min_pct': 0.02727094154594767, 'atr_max_pct': 0.12225724938453042, 'tp_mult': 1.1328063120421978, 'tsl_mult': 0.24403455879887498, 'strategy': 'mean_reversion', 'time_stop': 270, 'use_sma': False, 'use_atr': False, 'use_adx': False, 'use_ema': False, 'use_spike': True, 'rsi_required': True, 'edge_k': 0.9894003729178656, 'edge_cap': 0.34623922111756283, 'bull_strategy': 'breakout', 'bull_bb_std_mult': 3.2766227722259598, 'bull_rsi_os': 27, 'bull_rsi_ob': 56, 'bull_adx_thresh': 12.784065087025597, 'bull_atr_min_pct': 0.026972116623880445, 'bull_atr_max_pct': 0.015184315548462182, 'bull_tp_mult': 2.802014566999955, 'bull_tsl_mult': 0.3880106430543811, 'bull_time_stop': 109, 'bull_use_sma': True, 'bull_use_ema': False, 'bull_use_atr': True, 'bull_use_adx': True, 'bull_use_spike': True, 'bull_rsi_required': True, 'bear_strategy': 'breakout', 'bear_bb_std_mult': 3.597884031916918, 'bear_rsi_os': 31, 'bear_rsi_ob': 86, 'bear_adx_thresh': 11.985653451621891, 'bear_atr_min_pct': 0.023683068869365824, 'bear_atr_max_pct': 0.1468911800488414, 'bear_tp_mult': 2.4651052247908116, 'bear_tsl_mult': 0.0018937025567762888, 'bear_time_stop': 211, 'bear_use_sma': True, 'bear_use_ema': True, 'bear_use_atr': True, 'bear_use_adx': True, 'bear_use_spike': True, 'bear_rsi_required': True, 'sideways_strategy': 'mean_reversion', 'sideways_bb_std_mult': 0.9642614717208282, 'sideways_rsi_os': 21, 'sideways_rsi_ob': 67, 'sideways_adx_thresh': 7.18088049746277, 'sideways_atr_min_pct': 0.0012589606473625663, 'sideways_atr_max_pct': 0.09928677003203887, 'sideways_tp_mult': 1.5655084069514056, 'sideways_tsl_mult': 0.2497349477647113, 'sideways_time_stop': 287, 'sideways_use_sma': True, 'sideways_use_ema': False, 'sideways_use_atr': False, 'sideways_use_adx': True, 'sideways_use_spike': False, 'sideways_rsi_required': True}.
[I 2025-09-01 14:18:10,936] Trial 500 finished with values: [-1000000000.0, 1000000000.0] and parameters: {'p_sma': 37, 'p_std': 54, 'p_atr': 23, 'p_adx': 11, 'rsi_period': 38, 'ema1': 21, 'ema2': 20, 'slip_atr_k': 0.2187052809775497, 'slip_spread_k': 0.10689842357240079, 'spread_hl_frac': 0.005701624113791895, 'bb_std_mult': 3.0740910297566897, 'rsi_os': 30, 'rsi_ob': 78, 'vol_spike': 0.2327028228928754, 'adx_thresh': 24.977823007978017, 'atr_min_pct': 0.0272882788127086, 'atr_max_pct': 0.12853478504275218, 'tp_mult': 1.1470086136562998, 'tsl_mult': 0.5389123784457612, 'strategy': 'mean_reversion', 'time_stop': 281, 'use_sma': False, 'use_atr': False, 'use_adx': False, 'use_ema': False, 'use_spike': True, 'rsi_required': True, 'edge_k': 0.9720639701411524, 'edge_cap': 0.6391409770951272, 'bull_strategy': 'breakout', 'bull_bb_std_mult': 3.238428146484355, 'bull_rsi_os': 37, 'bull_rsi_ob': 50, 'bull_adx_thresh': 12.693870648148708, 'bull_atr_min_pct': 0.019267734226678747, 'bull_atr_max_pct': 0.14398398608021673, 'bull_tp_mult': 2.8162979245377424, 'bull_tsl_mult': 0.3336749842896226, 'bull_time_stop': 108, 'bull_use_sma': True, 'bull_use_ema': False, 'bull_use_atr': True, 'bull_use_adx': True, 'bull_use_spike': True, 'bull_rsi_required': True, 'bear_strategy': 'breakout', 'bear_bb_std_mult': 3.5318906358046847, 'bear_rsi_os': 32, 'bear_rsi_ob': 89, 'bear_adx_thresh': 17.777030681144364, 'bear_atr_min_pct': 0.02366382635985277, 'bear_atr_max_pct': 0.043944757107058106, 'bear_tp_mult': 1.9473128056198012, 'bear_tsl_mult': 0.2110482323370167, 'bear_time_stop': 210, 'bear_use_sma': True, 'bear_use_ema': True, 'bear_use_atr': True, 'bear_use_adx': True, 'bear_use_spike': True, 'bear_rsi_required': True, 'sideways_strategy': 'mean_reversion', 'sideways_bb_std_mult': 1.6742914747878694, 'sideways_rsi_os': 38, 'sideways_rsi_ob': 67, 'sideways_adx_thresh': 22.854213533543284, 'sideways_atr_min_pct': 0.023716534297348834, 'sideways_atr_max_pct': 0.06762982017990643, 'sideways_tp_mult': 1.5502036645106054, 'sideways_tsl_mult': 0.30987956607232503, 'sideways_time_stop': 286, 'sideways_use_sma': True, 'sideways_use_ema': False, 'sideways_use_atr': False, 'sideways_use_adx': True, 'sideways_use_spike': False, 'sideways_rsi_required': True}.
[I 2025-09-01 14:18:11,644] Trial 501 finished with values: [-1000000000.0, 1000000000.0] and parameters: {'p_sma': 37, 'p_std': 47, 'p_atr': 18, 'p_adx': 11, 'rsi_period': 62, 'ema1': 21, 'ema2': 20, 'slip_atr_k': 0.015522900340979305, 'slip_spread_k': 0.9177369327831099, 'spread_hl_frac': 0.0058572622235325625, 'bb_std_mult': 1.9678128399906811, 'rsi_os': 37, 'rsi_ob': 63, 'vol_spike': 0.04741117402393087, 'adx_thresh': 25.024177281915716, 'atr_min_pct': 0.02730837768006323, 'atr_max_pct': 0.13067542910910984, 'tp_mult': 1.13570138275166, 'tsl_mult': 0.2615184277182855, 'strategy': 'mean_reversion', 'time_stop': 159, 'use_sma': False, 'use_atr': False, 'use_adx': False, 'use_ema': False, 'use_spike': True, 'rsi_required': True, 'edge_k': 0.990008234569399, 'edge_cap': 0.3451764038908248, 'bull_strategy': 'breakout', 'bull_bb_std_mult': 3.238587172825218, 'bull_rsi_os': 37, 'bull_rsi_ob': 67, 'bull_adx_thresh': 20.736517637634677, 'bull_atr_min_pct': 0.027018427202377994, 'bull_atr_max_pct': 0.023647520623558873, 'bull_tp_mult': 2.8158108327331433, 'bull_tsl_mult': 0.3456046223559488, 'bull_time_stop': 61, 'bull_use_sma': True, 'bull_use_ema': False, 'bull_use_atr': True, 'bull_use_adx': True, 'bull_use_spike': True, 'bull_rsi_required': True, 'bear_strategy': 'breakout', 'bear_bb_std_mult': 3.5371082901997375, 'bear_rsi_os': 32, 'bear_rsi_ob': 89, 'bear_adx_thresh': 13.965520213946409, 'bear_atr_min_pct': 7.778062424841116e-05, 'bear_atr_max_pct': 0.03897259223717962, 'bear_tp_mult': 2.0899238490709826, 'bear_tsl_mult': 0.22197719451571957, 'bear_time_stop': 203, 'bear_use_sma': True, 'bear_use_ema': True, 'bear_use_atr': True, 'bear_use_adx': True, 'bear_use_spike': True, 'bear_rsi_required': True, 'sideways_strategy': 'mean_reversion', 'sideways_bb_std_mult': 1.3597358561817399, 'sideways_rsi_os': 38, 'sideways_rsi_ob': 67, 'sideways_adx_thresh': 7.082477670978844, 'sideways_atr_min_pct': 0.020266134616411753, 'sideways_atr_max_pct': 0.06813213437314564, 'sideways_tp_mult': 2.850170854501368, 'sideways_tsl_mult': 0.24774127638931906, 'sideways_time_stop': 289, 'sideways_use_sma': True, 'sideways_use_ema': False, 'sideways_use_atr': False, 'sideways_use_adx': True, 'sideways_use_spike': False, 'sideways_rsi_required': True}.
[I 2025-09-01 14:18:11,664] Trial 502 finished with values: [-0.01075459965593728, 0.011662513988283942] and parameters: {'p_sma': 37, 'p_std': 39, 'p_atr': 21, 'p_adx': 13, 'rsi_period': 63, 'ema1': 19, 'ema2': 13, 'slip_atr_k': 0.015140761067069007, 'slip_spread_k': 0.9922773502601581, 'spread_hl_frac': 0.005541845195594548, 'bb_std_mult': 0.969546758637664, 'rsi_os': 31, 'rsi_ob': 62, 'vol_spike': 0.23125918663736278, 'adx_thresh': 24.990984207982134, 'atr_min_pct': 0.026838783277029318, 'atr_max_pct': 0.1291233447929256, 'tp_mult': 1.1412498587106852, 'tsl_mult': 0.6988413707763732, 'strategy': 'mean_reversion', 'time_stop': 283, 'use_sma': False, 'use_atr': False, 'use_adx': True, 'use_ema': False, 'use_spike': False, 'rsi_required': True, 'edge_k': 1.3494673304995708, 'edge_cap': 0.3497446957429103, 'bull_strategy': 'breakout', 'bull_bb_std_mult': 0.874069449163605, 'bull_rsi_os': 37, 'bull_rsi_ob': 56, 'bull_adx_thresh': 20.97372533101215, 'bull_atr_min_pct': 0.0032149775290329623, 'bull_atr_max_pct': 0.1267433071252643, 'bull_tp_mult': 2.235632539430774, 'bull_tsl_mult': 0.7528943192587596, 'bull_time_stop': 58, 'bull_use_sma': True, 'bull_use_ema': False, 'bull_use_atr': False, 'bull_use_adx': True, 'bull_use_spike': True, 'bull_rsi_required': True, 'bear_strategy': 'breakout', 'bear_bb_std_mult': 3.5997823170122074, 'bear_rsi_os': 32, 'bear_rsi_ob': 94, 'bear_adx_thresh': 13.795217925291038, 'bear_atr_min_pct': 0.0036669760871299046, 'bear_atr_max_pct': 0.0435828095284839, 'bear_tp_mult': 1.2979940536408234, 'bear_tsl_mult': 0.26096511640145265, 'bear_time_stop': 210, 'bear_use_sma': True, 'bear_use_ema': True, 'bear_use_atr': False, 'bear_use_adx': False, 'bear_use_spike': True, 'bear_rsi_required': False, 'sideways_strategy': 'mean_reversion', 'sideways_bb_std_mult': 1.4972962950544093, 'sideways_rsi_os': 18, 'sideways_rsi_ob': 67, 'sideways_adx_thresh': 6.970854976441297, 'sideways_atr_min_pct': 0.020099650078395974, 'sideways_atr_max_pct': 0.06766307767055639, 'sideways_tp_mult': 2.8504069091635755, 'sideways_tsl_mult': 0.24621643943734384, 'sideways_time_stop': 46, 'sideways_use_sma': False, 'sideways_use_ema': False, 'sideways_use_atr': False, 'sideways_use_adx': True, 'sideways_use_spike': False, 'sideways_rsi_required': True}.
[I 2025-09-01 14:18:12,381] Trial 503 finished with values: [-0.051483561697117874, 0.0508383913406317] and parameters: {'p_sma': 36, 'p_std': 22, 'p_atr': 28, 'p_adx': 13, 'rsi_period': 63, 'ema1': 13, 'ema2': 24, 'slip_atr_k': 0.15533752043872312, 'slip_spread_k': 0.10614763444261359, 'spread_hl_frac': 0.006625345350035991, 'bb_std_mult': 1.9737174283787762, 'rsi_os': 35, 'rsi_ob': 80, 'vol_spike': 0.29142233577373466, 'adx_thresh': 25.043154649382803, 'atr_min_pct': 0.02715105811371745, 'atr_max_pct': 0.13061878301642355, 'tp_mult': 1.7479963987224933, 'tsl_mult': 0.7040512583353773, 'strategy': 'mean_reversion', 'time_stop': 281, 'use_sma': False, 'use_atr': False, 'use_adx': True, 'use_ema': True, 'use_spike': False, 'rsi_required': False, 'edge_k': 0.8566061489669275, 'edge_cap': 0.27928804313868294, 'bull_strategy': 'breakout', 'bull_bb_std_mult': 3.2333198321572745, 'bull_rsi_os': 38, 'bull_rsi_ob': 55, 'bull_adx_thresh': 24.21375424967611, 'bull_atr_min_pct': 0.002299189802564816, 'bull_atr_max_pct': 0.0246079788043697, 'bull_tp_mult': 1.6900680920313689, 'bull_tsl_mult': 0.0006290317084244323, 'bull_time_stop': 87, 'bull_use_sma': True, 'bull_use_ema': True, 'bull_use_atr': False, 'bull_use_adx': True, 'bull_use_spike': False, 'bull_rsi_required': True, 'bear_strategy': 'breakout', 'bear_bb_std_mult': 3.3808747937206016, 'bear_rsi_os': 32, 'bear_rsi_ob': 49, 'bear_adx_thresh': 13.685189144114323, 'bear_atr_min_pct': 0.00010171731415458069, 'bear_atr_max_pct': 0.06229779560321319, 'bear_tp_mult': 1.291530497882373, 'bear_tsl_mult': 0.2656214405547288, 'bear_time_stop': 200, 'bear_use_sma': True, 'bear_use_ema': True, 'bear_use_atr': False, 'bear_use_adx': False, 'bear_use_spike': False, 'bear_rsi_required': False, 'sideways_strategy': 'breakout', 'sideways_bb_std_mult': 3.002780230400272, 'sideways_rsi_os': 54, 'sideways_rsi_ob': 68, 'sideways_adx_thresh': 6.751072770786486, 'sideways_atr_min_pct': 0.01989021078926759, 'sideways_atr_max_pct': 0.06895926621749235, 'sideways_tp_mult': 2.823609170236258, 'sideways_tsl_mult': 0.3060221206569779, 'sideways_time_stop': 74, 'sideways_use_sma': False, 'sideways_use_ema': False, 'sideways_use_atr': True, 'sideways_use_adx': True, 'sideways_use_spike': False, 'sideways_rsi_required': True}.
