[I 2025-09-01 14:18:13,218] Trial 506 finished with values: [-1000000000.0, 1000000000.0] and parameters: {'p_sma': 48, 'p_std': 50, 'p_atr': 27, 'p_adx': 13, 'rsi_period': 24, 'ema1': 13, 'ema2': 10, 'slip_atr_k': 0.029456061175972575, 'slip_spread_k': 0.750925761562284, 'spread_hl_frac': 0.006934627053412006, 'bb_std_mult': 3.361623272440034, 'rsi_os': 35, 'rsi_ob': 46, 'vol_spike': 0.17074619604507651, 'adx_thresh': 26.772672796612085, 'atr_min_pct': 0.025893662197233245, 'atr_max_pct': 0.1401155875362547, 'tp_mult': 1.8277480977440976, 'tsl_mult': 0.6976286483748294, 'strategy': 'mean_reversion', 'time_stop': 225, 'use_sma': True, 'use_atr': False, 'use_adx': True, 'use_ema': True, 'use_spike': False, 'rsi_required': False, 'edge_k': 1.6230031062390444, 'edge_cap': 0.7174910227056194, 'bull_strategy': 'breakout', 'bull_bb_std_mult': 0.8417914187048059, 'bull_rsi_os': 31, 'bull_rsi_ob': 55, 'bull_adx_thresh': 29.79054286886905, 'bull_atr_min_pct': 0.003328705300344843, 'bull_atr_max_pct': 0.02794146971174629, 'bull_tp_mult': 2.2336444828513216, 'bull_tsl_mult': 0.8985111172390461, 'bull_time_stop': 52, 'bull_use_sma': True, 'bull_use_ema': True, 'bull_use_atr': False, 'bull_use_adx': True, 'bull_use_spike': False, 'bull_rsi_required': True, 'bear_strategy': 'breakout', 'bear_bb_std_mult': 1.641321127785917, 'bear_rsi_os': 30, 'bear_rsi_ob': 87, 'bear_adx_thresh': 7.780244884080945, 'bear_atr_min_pct': 0.002385608162394132, 'bear_atr_max_pct': 0.03179710592046418, 'bear_tp_mult': 2.284217688412208, 'bear_tsl_mult': 0.46601462946169425, 'bear_time_stop': 68, 'bear_use_sma': True, 'bear_use_ema': True, 'bear_use_atr': False, 'bear_use_adx': False, 'bear_use_spike': False, 'bear_rsi_required': False, 'sideways_strategy': 'breakout', 'sideways_bb_std_mult': 1.5037417836441014, 'sideways_rsi_os': 49, 'sideways_rsi_ob': 49, 'sideways_adx_thresh': 31.04724107526811, 'sideways_atr_min_pct': 0.02161857967616368, 'sideways_atr_max_pct': 0.06319797967292952, 'sideways_tp_mult': 2.6838590906646993, 'sideways_tsl_mult': 0.6459346513687279, 'sideways_time_stop': 76, 'sideways_use_sma': False, 'sideways_use_ema': False, 'sideways_use_atr': True, 'sideways_use_adx': True, 'sideways_use_spike': False, 'sideways_rsi_required': True}.
[I 2025-09-01 14:18:13,219] Trial 504 finished with values: [-1000000000.0, 1000000000.0] and parameters: {'p_sma': 35, 'p_std': 47, 'p_atr': 11, 'p_adx': 13, 'rsi_period': 64, 'ema1': 19, 'ema2': 46, 'slip_atr_k': 0.02751399431795365, 'slip_spread_k': 0.9200475862154964, 'spread_hl_frac': 0.007147744485073262, 'bb_std_mult': 1.7326679729378636, 'rsi_os': 39, 'rsi_ob': 47, 'vol_spike': 0.1848179502748029, 'adx_thresh': 34.172284622788716, 'atr_min_pct': 0.025589869469541473, 'atr_max_pct': 0.14052108023542698, 'tp_mult': 1.0547792322755818, 'tsl_mult': 0.6989660907453347, 'strategy': 'mean_reversion', 'time_stop': 225, 'use_sma': True, 'use_atr': False, 'use_adx': True, 'use_ema': True, 'use_spike': False, 'rsi_required': False, 'edge_k': 0.2855453421295907, 'edge_cap': 0.10084095996737574, 'bull_strategy': 'breakout', 'bull_bb_std_mult': 2.1658184500615505, 'bull_rsi_os': 37, 'bull_rsi_ob': 85, 'bull_adx_thresh': 24.18891124143427, 'bull_atr_min_pct': 0.0021847744609017, 'bull_atr_max_pct': 0.034471664571275255, 'bull_tp_mult': 2.1008807669357448, 'bull_tsl_mult': 0.2310600907372411, 'bull_time_stop': 60, 'bull_use_sma': True, 'bull_use_ema': True, 'bull_use_atr': False, 'bull_use_adx': True, 'bull_use_spike': False, 'bull_rsi_required': True, 'bear_strategy': 'breakout', 'bear_bb_std_mult': 1.6290291270932218, 'bear_rsi_os': 40, 'bear_rsi_ob': 87, 'bear_adx_thresh': 25.342151231344715, 'bear_atr_min_pct': 0.002388475602876897, 'bear_atr_max_pct': 0.06158575025537756, 'bear_tp_mult': 2.3948661633720456, 'bear_tsl_mult': 0.17356203877503215, 'bear_time_stop': 202, 'bear_use_sma': True, 'bear_use_ema': True, 'bear_use_atr': False, 'bear_use_adx': False, 'bear_use_spike': False, 'bear_rsi_required': False, 'sideways_strategy': 'breakout', 'sideways_bb_std_mult': 2.5923021486522875, 'sideways_rsi_os': 23, 'sideways_rsi_ob': 68, 'sideways_adx_thresh': 6.734801070113304, 'sideways_atr_min_pct': 0.02995172256701563, 'sideways_atr_max_pct': 0.06936849389016264, 'sideways_tp_mult': 1.434329201522706, 'sideways_tsl_mult': 0.15125860246893325, 'sideways_time_stop': 186, 'sideways_use_sma': False, 'sideways_use_ema': False, 'sideways_use_atr': True, 'sideways_use_adx': True, 'sideways_use_spike': False, 'sideways_rsi_required': True}.
[I 2025-09-01 14:18:13,247] Trial 505 finished with values: [-1000000000.0, 1000000000.0] and parameters: {'p_sma': 35, 'p_std': 35, 'p_atr': 27, 'p_adx': 17, 'rsi_period': 64, 'ema1': 22, 'ema2': 43, 'slip_atr_k': 0.007082390546663268, 'slip_spread_k': 0.8254882061415422, 'spread_hl_frac': 0.006963849521908936, 'bb_std_mult': 0.9519209316801787, 'rsi_os': 50, 'rsi_ob': 80, 'vol_spike': 0.29184702951600855, 'adx_thresh': 26.836913018167, 'atr_min_pct': 0.025682276924266455, 'atr_max_pct': 0.010431288412751732, 'tp_mult': 2.0805358121926423, 'tsl_mult': 0.6952240537810942, 'strategy': 'mean_reversion', 'time_stop': 300, 'use_sma': True, 'use_atr': False, 'use_adx': True, 'use_ema': True, 'use_spike': False, 'rsi_required': False, 'edge_k': 1.8828988175396069, 'edge_cap': 0.27286592812350424, 'bull_strategy': 'breakout', 'bull_bb_std_mult': 3.0834998990997, 'bull_rsi_os': 31, 'bull_rsi_ob': 55, 'bull_adx_thresh': 30.52298361322831, 'bull_atr_min_pct': 0.029188159040007475, 'bull_atr_max_pct': 0.02811290357643071, 'bull_tp_mult': 2.107147213808272, 'bull_tsl_mult': 0.8952405987400424, 'bull_time_stop': 96, 'bull_use_sma': True, 'bull_use_ema': True, 'bull_use_atr': False, 'bull_use_adx': True, 'bull_use_spike': False, 'bull_rsi_required': True, 'bear_strategy': 'breakout', 'bear_bb_std_mult': 3.383575072099091, 'bear_rsi_os': 30, 'bear_rsi_ob': 87, 'bear_adx_thresh': 27.657544145016843, 'bear_atr_min_pct': 0.019410964153014472, 'bear_atr_max_pct': 0.10794453770484998, 'bear_tp_mult': 2.2852011273181914, 'bear_tsl_mult': 0.16424764742589482, 'bear_time_stop': 216, 'bear_use_sma': True, 'bear_use_ema': True, 'bear_use_atr': False, 'bear_use_adx': False, 'bear_use_spike': False, 'bear_rsi_required': False, 'sideways_strategy': 'breakout', 'sideways_bb_std_mult': 1.524905059663385, 'sideways_rsi_os': 8, 'sideways_rsi_ob': 49, 'sideways_adx_thresh': 29.368235590595077, 'sideways_atr_min_pct': 0.01987580758405441, 'sideways_atr_max_pct': 0.06378245247674394, 'sideways_tp_mult': 2.7539514078067615, 'sideways_tsl_mult': 0.26754924887964504, 'sideways_time_stop': 74, 'sideways_use_sma': False, 'sideways_use_ema': False, 'sideways_use_atr': True, 'sideways_use_adx': True, 'sideways_use_spike': False, 'sideways_rsi_required': True}.
[I 2025-09-01 14:18:14,106] Trial 508 finished with values: [-1000000000.0, 1000000000.0] and parameters: {'p_sma': 32, 'p_std': 52, 'p_atr': 13, 'p_adx': 17, 'rsi_period': 47, 'ema1': 6, 'ema2': 43, 'slip_atr_k': 0.2087565047399107, 'slip_spread_k': 0.8033597671853434, 'spread_hl_frac': 0.002236203019007583, 'bb_std_mult': 1.8418460222770268, 'rsi_os': 43, 'rsi_ob': 84, 'vol_spike': 0.07418711821559539, 'adx_thresh': 26.201968379403887, 'atr_min_pct': 0.02686049814300577, 'atr_max_pct': 0.022412346992314723, 'tp_mult': 2.607199270738999, 'tsl_mult': 0.7441838744825284, 'strategy': 'mean_reversion', 'time_stop': 291, 'use_sma': True, 'use_atr': False, 'use_adx': False, 'use_ema': True, 'use_spike': True, 'rsi_required': False, 'edge_k': 0.9261659193915449, 'edge_cap': 0.3672183254703102, 'bull_strategy': 'mean_reversion', 'bull_bb_std_mult': 2.376186163879146, 'bull_rsi_os': 55, 'bull_rsi_ob': 61, 'bull_adx_thresh': 30.599664570655946, 'bull_atr_min_pct': 0.0043330007268419304, 'bull_atr_max_pct': 0.08770014299855972, 'bull_tp_mult': 2.7527058240443565, 'bull_tsl_mult': 0.45302078490602293, 'bull_time_stop': 94, 'bull_use_sma': True, 'bull_use_ema': True, 'bull_use_atr': True, 'bull_use_adx': False, 'bull_use_spike': False, 'bull_rsi_required': True, 'bear_strategy': 'breakout', 'bear_bb_std_mult': 1.1064629874694627, 'bear_rsi_os': 35, 'bear_rsi_ob': 93, 'bear_adx_thresh': 5.043470389315502, 'bear_atr_min_pct': 0.02571034748604533, 'bear_atr_max_pct': 0.03779257352032238, 'bear_tp_mult': 1.2031369551299513, 'bear_tsl_mult': 0.15236510229120637, 'bear_time_stop': 217, 'bear_use_sma': False, 'bear_use_ema': True, 'bear_use_atr': True, 'bear_use_adx': True, 'bear_use_spike': False, 'bear_rsi_required': True, 'sideways_strategy': 'breakout', 'sideways_bb_std_mult': 0.5039627600097834, 'sideways_rsi_os': 51, 'sideways_rsi_ob': 64, 'sideways_adx_thresh': 7.735542299063878, 'sideways_atr_min_pct': 0.018733029374875865, 'sideways_atr_max_pct': 0.06530539073883192, 'sideways_tp_mult': 1.8305295142712044, 'sideways_tsl_mult': 0.0945553937031745, 'sideways_time_stop': 171, 'sideways_use_sma': True, 'sideways_use_ema': False, 'sideways_use_atr': True, 'sideways_use_adx': True, 'sideways_use_spike': False, 'sideways_rsi_required': True}.
[I 2025-09-01 14:18:39,873] Trial 507 finished with values: [-0.0695965142405146, 0.06901862293376475] and parameters: {'p_sma': 48, 'p_std': 52, 'p_atr': 21, 'p_adx': 12, 'rsi_period': 24, 'ema1': 6, 'ema2': 43, 'slip_atr_k': 0.005288662187184838, 'slip_spread_k': 0.04323633819752673, 'spread_hl_frac': 0.01022755660415594, 'bb_std_mult': 3.305043854958848, 'rsi_os': 43, 'rsi_ob': 84, 'vol_spike': 0.1664986087401475, 'adx_thresh': 9.112633919606154, 'atr_min_pct': 0.025325063939872324, 'atr_max_pct': 0.14962243624064298, 'tp_mult': 1.0481256367900884, 'tsl_mult': 0.7473384431029907, 'strategy': 'mean_reversion', 'time_stop': 227, 'use_sma': True, 'use_atr': False, 'use_adx': True, 'use_ema': True, 'use_spike': False, 'rsi_required': False, 'edge_k': 0.9225203501530335, 'edge_cap': 0.9789255918941517, 'bull_strategy': 'breakout', 'bull_bb_std_mult': 3.3624627685847277, 'bull_rsi_os': 38, 'bull_rsi_ob': 61, 'bull_adx_thresh': 29.604186861810742, 'bull_atr_min_pct': 0.0037839320507347513, 'bull_atr_max_pct': 0.026693072817054273, 'bull_tp_mult': 2.0978956280501957, 'bull_tsl_mult': 0.4445436108975664, 'bull_time_stop': 96, 'bull_use_sma': True, 'bull_use_ema': True, 'bull_use_atr': False, 'bull_use_adx': False, 'bull_use_spike': False, 'bull_rsi_required': True, 'bear_strategy': 'breakout', 'bear_bb_std_mult': 3.4177161931777302, 'bear_rsi_os': 40, 'bear_rsi_ob': 94, 'bear_adx_thresh': 16.779383334732426, 'bear_atr_min_pct': 0.0023777053359875407, 'bear_atr_max_pct': 0.04399205935576245, 'bear_tp_mult': 2.2866827764127398, 'bear_tsl_mult': 0.17825204442516104, 'bear_time_stop': 239, 'bear_use_sma': True, 'bear_use_ema': True, 'bear_use_atr': False, 'bear_use_adx': False, 'bear_use_spike': False, 'bear_rsi_required': False, 'sideways_strategy': 'breakout', 'sideways_bb_std_mult': 2.5746322171704588, 'sideways_rsi_os': 12, 'sideways_rsi_ob': 49, 'sideways_adx_thresh': 5.921435444037808, 'sideways_atr_min_pct': 0.01998429697689953, 'sideways_atr_max_pct': 0.06365765609786593, 'sideways_tp_mult': 1.4251976717303316, 'sideways_tsl_mult': 0.34445545196585037, 'sideways_time_stop': 171, 'sideways_use_sma': False, 'sideways_use_ema': False, 'sideways_use_atr': True, 'sideways_use_adx': True, 'sideways_use_spike': False, 'sideways_rsi_required': True}.
[I 2025-09-01 14:18:45,823] Trial 509 finished with values: [-1000000000.0, 1000000000.0] and parameters: {'p_sma': 16, 'p_std': 39, 'p_atr': 8, 'p_adx': 12, 'rsi_period': 58, 'ema1': 22, 'ema2': 17, 'slip_atr_k': 0.06548626197767479, 'slip_spread_k': 0.043964718017000276, 'spread_hl_frac': 0.017950260482324763, 'bb_std_mult': 0.9521857956930868, 'rsi_os': 38, 'rsi_ob': 57, 'vol_spike': 0.07450128918098471, 'adx_thresh': 26.200792682065234, 'atr_min_pct': 0.02659520110150822, 'atr_max_pct': 0.08808370607376041, 'tp_mult': 1.8705206389351374, 'tsl_mult': 0.7514989137154913, 'strategy': 'mean_reversion', 'time_stop': 231, 'use_sma': True, 'use_atr': False, 'use_adx': False, 'use_ema': True, 'use_spike': True, 'rsi_required': False, 'edge_k': 1.682262477027043, 'edge_cap': 0.36200937759902807, 'bull_strategy': 'mean_reversion', 'bull_bb_std_mult': 3.1088342132142315, 'bull_rsi_os': 33, 'bull_rsi_ob': 57, 'bull_adx_thresh': 30.56501714251192, 'bull_atr_min_pct': 0.0040634310375588616, 'bull_atr_max_pct': 0.12574008738218542, 'bull_tp_mult': 2.753333319899276, 'bull_tsl_mult': 0.45385375823517893, 'bull_time_stop': 96, 'bull_use_sma': True, 'bull_use_ema': True, 'bull_use_atr': True, 'bull_use_adx': False, 'bull_use_spike': False, 'bull_rsi_required': True, 'bear_strategy': 'breakout', 'bear_bb_std_mult': 2.028306795087666, 'bear_rsi_os': 49, 'bear_rsi_ob': 58, 'bear_adx_thresh': 11.256179676058153, 'bear_atr_min_pct': 0.010624628694435059, 'bear_atr_max_pct': 0.10766900523482062, 'bear_tp_mult': 2.261570613521831, 'bear_tsl_mult': 0.40976917971653304, 'bear_time_stop': 216, 'bear_use_sma': False, 'bear_use_ema': True, 'bear_use_atr': True, 'bear_use_adx': True, 'bear_use_spike': False, 'bear_rsi_required': True, 'sideways_strategy': 'breakout', 'sideways_bb_std_mult': 1.6276048388078337, 'sideways_rsi_os': 51, 'sideways_rsi_ob': 64, 'sideways_adx_thresh': 5.834802704327537, 'sideways_atr_min_pct': 0.02644400455495355, 'sideways_atr_max_pct': 0.04767778927901891, 'sideways_tp_mult': 2.760140681601881, 'sideways_tsl_mult': 0.2651303340546683, 'sideways_time_stop': 170, 'sideways_use_sma': True, 'sideways_use_ema': False, 'sideways_use_atr': True, 'sideways_use_adx': True, 'sideways_use_spike': False, 'sideways_rsi_required': True}.
[I 2025-09-01 14:18:46,081] Trial 510 finished with values: [-1000000000.0, 1000000000.0] and parameters: {'p_sma': 39, 'p_std': 6, 'p_atr': 8, 'p_adx': 12, 'rsi_period': 47, 'ema1': 6, 'ema2': 29, 'slip_atr_k': 0.09174824026584946, 'slip_spread_k': 0.8034596265643941, 'spread_hl_frac': 0.01797830223791544, 'bb_std_mult': 1.8204454539652304, 'rsi_os': 43, 'rsi_ob': 85, 'vol_spike': 0.2141730627482239, 'adx_thresh': 25.991999840662658, 'atr_min_pct': 0.026777468565227787, 'atr_max_pct': 0.14952450616239718, 'tp_mult': 2.5280503086207196, 'tsl_mult': 0.7458362694373661, 'strategy': 'mean_reversion', 'time_stop': 206, 'use_sma': True, 'use_atr': False, 'use_adx': False, 'use_ema': True, 'use_spike': True, 'rsi_required': False, 'edge_k': 0.8151354622251665, 'edge_cap': 0.4915316127668156, 'bull_strategy': 'mean_reversion', 'bull_bb_std_mult': 3.3066569513109063, 'bull_rsi_os': 55, 'bull_rsi_ob': 57, 'bull_adx_thresh': 28.570443699493573, 'bull_atr_min_pct': 0.004023981641093446, 'bull_atr_max_pct': 0.022459251023925576, 'bull_tp_mult': 2.7535518361463414, 'bull_tsl_mult': 0.4191226307338276, 'bull_time_stop': 261, 'bull_use_sma': True, 'bull_use_ema': True, 'bull_use_atr': True, 'bull_use_adx': False, 'bull_use_spike': False, 'bull_rsi_required': True, 'bear_strategy': 'breakout', 'bear_bb_std_mult': 1.7750378390155686, 'bear_rsi_os': 34, 'bear_rsi_ob': 46, 'bear_adx_thresh': 20.606710897280013, 'bear_atr_min_pct': 0.0038125367922548017, 'bear_atr_max_pct': 0.03666364576397702, 'bear_tp_mult': 2.2279087342228374, 'bear_tsl_mult': 0.4231401803984083, 'bear_time_stop': 76, 'bear_use_sma': False, 'bear_use_ema': True, 'bear_use_atr': True, 'bear_use_adx': True, 'bear_use_spike': False, 'bear_rsi_required': True, 'sideways_strategy': 'breakout', 'sideways_bb_std_mult': 1.6276430480395816, 'sideways_rsi_os': 51, 'sideways_rsi_ob': 54, 'sideways_adx_thresh': 5.888293847709394, 'sideways_atr_min_pct': 0.01500359774879327, 'sideways_atr_max_pct': 0.07252115224328229, 'sideways_tp_mult': 2.5840233676087743, 'sideways_tsl_mult': 0.09225916461203276, 'sideways_time_stop': 133, 'sideways_use_sma': True, 'sideways_use_ema': False, 'sideways_use_atr': True, 'sideways_use_adx': True, 'sideways_use_spike': False, 'sideways_rsi_required': True}.
[I 2025-09-01 14:18:51,194] Trial 511 finished with values: [-1000000000.0, 1000000000.0] and parameters: {'p_sma': 15, 'p_std': 60, 'p_atr': 8, 'p_adx': 21, 'rsi_period': 69, 'ema1': 24, 'ema2': 17, 'slip_atr_k': 0.07114118799210406, 'slip_spread_k': 0.04499703574739879, 'spread_hl_frac': 0.005556692455583006, 'bb_std_mult': 1.6756244228822095, 'rsi_os': 31, 'rsi_ob': 83, 'vol_spike': 0.23033381848293125, 'adx_thresh': 25.76368410505832, 'atr_min_pct': 0.026568834500420732, 'atr_max_pct': 0.13780230237201638, 'tp_mult': 1.072485071544091, 'tsl_mult': 0.7237767760094416, 'strategy': 'mean_reversion', 'time_stop': 112, 'use_sma': True, 'use_atr': True, 'use_adx': False, 'use_ema': True, 'use_spike': True, 'rsi_required': False, 'edge_k': 0.7956074459785274, 'edge_cap': 0.30584029407362845, 'bull_strategy': 'breakout', 'bull_bb_std_mult': 2.541944863739639, 'bull_rsi_os': 33, 'bull_rsi_ob': 69, 'bull_adx_thresh': 18.17733596598795, 'bull_atr_min_pct': 0.0038865222217515307, 'bull_atr_max_pct': 0.11671672592030514, 'bull_tp_mult': 2.8688758207586647, 'bull_tsl_mult': 0.42057661500225785, 'bull_time_stop': 42, 'bull_use_sma': False, 'bull_use_ema': True, 'bull_use_atr': True, 'bull_use_adx': False, 'bull_use_spike': False, 'bull_rsi_required': True, 'bear_strategy': 'breakout', 'bear_bb_std_mult': 1.5606424974187836, 'bear_rsi_os': 44, 'bear_rsi_ob': 94, 'bear_adx_thresh': 6.105279391688953, 'bear_atr_min_pct': 0.026510921535410722, 'bear_atr_max_pct': 0.015552999110599125, 'bear_tp_mult': 1.627710833008169, 'bear_tsl_mult': 0.96225155162036, 'bear_time_stop': 140, 'bear_use_sma': True, 'bear_use_ema': True, 'bear_use_atr': True, 'bear_use_adx': True, 'bear_use_spike': False, 'bear_rsi_required': True, 'sideways_strategy': 'breakout', 'sideways_bb_std_mult': 1.6009977575252643, 'sideways_rsi_os': 17, 'sideways_rsi_ob': 66, 'sideways_adx_thresh': 5.630737909306907, 'sideways_atr_min_pct': 0.02023742600963697, 'sideways_atr_max_pct': 0.051848998259182204, 'sideways_tp_mult': 2.733965208061615, 'sideways_tsl_mult': 0.3408698127388514, 'sideways_time_stop': 269, 'sideways_use_sma': True, 'sideways_use_ema': True, 'sideways_use_atr': True, 'sideways_use_adx': True, 'sideways_use_spike': False, 'sideways_rsi_required': True}.
[I 2025-09-01 14:19:29,233] Trial 514 finished with values: [-1000000000.0, 1000000000.0] and parameters: {'p_sma': 40, 'p_std': 48, 'p_atr': 25, 'p_adx': 11, 'rsi_period': 69, 'ema1': 20, 'ema2': 15, 'slip_atr_k': 0.02036682457475738, 'slip_spread_k': 0.5409509949834399, 'spread_hl_frac': 0.0047423736715745705, 'bb_std_mult': 1.6889447028976743, 'rsi_os': 33, 'rsi_ob': 81, 'vol_spike': 0.11607634114537975, 'adx_thresh': 24.23587416211897, 'atr_min_pct': 0.02615782999487332, 'atr_max_pct': 0.028400970649344826, 'tp_mult': 1.08099190250353, 'tsl_mult': 0.7197084097422761, 'strategy': 'breakout', 'time_stop': 57, 'use_sma': False, 'use_atr': True, 'use_adx': False, 'use_ema': False, 'use_spike': True, 'rsi_required': True, 'edge_k': 0.8885075190519933, 'edge_cap': 0.3098871528344721, 'bull_strategy': 'breakout', 'bull_bb_std_mult': 2.540182840907575, 'bull_rsi_os': 34, 'bull_rsi_ob': 56, 'bull_adx_thresh': 9.278712661579698, 'bull_atr_min_pct': 0.0034354093597670486, 'bull_atr_max_pct': 0.11795330721261693, 'bull_tp_mult': 1.1855860737186323, 'bull_tsl_mult': 0.5276860516933485, 'bull_time_stop': 81, 'bull_use_sma': False, 'bull_use_ema': False, 'bull_use_atr': True, 'bull_use_adx': True, 'bull_use_spike': True, 'bull_rsi_required': False, 'bear_strategy': 'mean_reversion', 'bear_bb_std_mult': 1.5539461850137717, 'bear_rsi_os': 33, 'bear_rsi_ob': 88, 'bear_adx_thresh': 5.847906374910853, 'bear_atr_min_pct': 0.0032172069465086534, 'bear_atr_max_pct': 0.0413425064615958, 'bear_tp_mult': 1.810456849486719, 'bear_tsl_mult': 0.5880644322919182, 'bear_time_stop': 249, 'bear_use_sma': True, 'bear_use_ema': False, 'bear_use_atr': True, 'bear_use_adx': True, 'bear_use_spike': True, 'bear_rsi_required': True, 'sideways_strategy': 'mean_reversion', 'sideways_bb_std_mult': 1.5610878808858681, 'sideways_rsi_os': 18, 'sideways_rsi_ob': 66, 'sideways_adx_thresh': 32.84188951782256, 'sideways_atr_min_pct': 0.019057512721740225, 'sideways_atr_max_pct': 0.1378780622535692, 'sideways_tp_mult': 2.709266271953633, 'sideways_tsl_mult': 0.2196888554441001, 'sideways_time_stop': 269, 'sideways_use_sma': True, 'sideways_use_ema': True, 'sideways_use_atr': False, 'sideways_use_adx': False, 'sideways_use_spike': True, 'sideways_rsi_required': False}.
