[I 2025-09-01 13:30:43,922] Trial 192 finished with values: [-1000000000.0, 1000000000.0] and parameters: {'p_sma': 54, 'p_std': 32, 'p_atr': 9, 'p_adx': 17, 'rsi_period': 11, 'ema1': 19, 'ema2': 58, 'slip_atr_k': 0.004729141895659414, 'slip_spread_k': 0.9985374487042407, 'spread_hl_frac': 0.01462089968815903, 'bb_std_mult': 1.846623440321011, 'rsi_os': 42, 'rsi_ob': 47, 'vol_spike': 0.23935527281333246, 'adx_thresh': 29.91910827986743, 'atr_min_pct': 0.02379547937395092, 'atr_max_pct': 0.044364711886305475, 'tp_mult': 2.9446570696441676, 'tsl_mult': 0.4325558109064446, 'strategy': 'mean_reversion', 'time_stop': 108, 'use_sma': False, 'use_atr': True, 'use_adx': False, 'use_ema': False, 'use_spike': False, 'rsi_required': False, 'edge_k': 0.3887531730882852, 'edge_cap': 0.7869207165860407, 'bull_strategy': 'breakout', 'bull_bb_std_mult': 3.399922837059304, 'bull_rsi_os': 48, 'bull_rsi_ob': 56, 'bull_adx_thresh': 6.6550491325022705, 'bull_atr_min_pct': 0.026448139862863124, 'bull_atr_max_pct': 0.023368436041627937, 'bull_tp_mult': 2.1281449305670304, 'bull_tsl_mult': 0.11554764275729973, 'bull_time_stop': 38, 'bull_use_sma': False, 'bull_use_ema': False, 'bull_use_atr': False, 'bull_use_adx': False, 'bull_use_spike': False, 'bull_rsi_required': False, 'bear_strategy': 'mean_reversion', 'bear_bb_std_mult': 0.8794320675023513, 'bear_rsi_os': 11, 'bear_rsi_ob': 56, 'bear_adx_thresh': 28.259673325985354, 'bear_atr_min_pct': 0.015746623165753152, 'bear_atr_max_pct': 0.13702476817709022, 'bear_tp_mult': 1.8733911329944615, 'bear_tsl_mult': 0.25394423161860247, 'bear_time_stop': 265, 'bear_use_sma': False, 'bear_use_ema': True, 'bear_use_atr': True, 'bear_use_adx': False, 'bear_use_spike': False, 'bear_rsi_required': False, 'sideways_strategy': 'mean_reversion', 'sideways_bb_std_mult': 2.3190417723459005, 'sideways_rsi_os': 26, 'sideways_rsi_ob': 92, 'sideways_adx_thresh': 12.636933114573464, 'sideways_atr_min_pct': 0.002748482138662668, 'sideways_atr_max_pct': 0.04400631056266638, 'sideways_tp_mult': 1.0197434411798354, 'sideways_tsl_mult': 0.45680707222696343, 'sideways_time_stop': 105, 'sideways_use_sma': False, 'sideways_use_ema': False, 'sideways_use_atr': True, 'sideways_use_adx': False, 'sideways_use_spike': False, 'sideways_rsi_required': False}.
[I 2025-09-01 13:31:21,141] Trial 190 finished with values: [-0.024968900174759612, 0.02478821102844559] and parameters: {'p_sma': 39, 'p_std': 33, 'p_atr': 24, 'p_adx': 18, 'rsi_period': 66, 'ema1': 20, 'ema2': 58, 'slip_atr_k': 0.0970907350841544, 'slip_spread_k': 0.17282888255686202, 'spread_hl_frac': 0.048204827809950196, 'bb_std_mult': 2.872927540769935, 'rsi_os': 41, 'rsi_ob': 90, 'vol_spike': 0.1503464832300905, 'adx_thresh': 10.647984660012883, 'atr_min_pct': 0.0032116343213102454, 'atr_max_pct': 0.05283355382641869, 'tp_mult': 2.1304492327295024, 'tsl_mult': 0.11324378250116846, 'strategy': 'breakout', 'time_stop': 201, 'use_sma': False, 'use_atr': True, 'use_adx': False, 'use_ema': True, 'use_spike': False, 'rsi_required': True, 'edge_k': 0.3740145294203243, 'edge_cap': 0.4835256386592435, 'bull_strategy': 'breakout', 'bull_bb_std_mult': 3.3920760474872913, 'bull_rsi_os': 47, 'bull_rsi_ob': 54, 'bull_adx_thresh': 6.481862949313457, 'bull_atr_min_pct': 0.0006671438919223958, 'bull_atr_max_pct': 0.06486152600474399, 'bull_tp_mult': 1.9167027498609621, 'bull_tsl_mult': 0.11895493300859594, 'bull_time_stop': 13, 'bull_use_sma': True, 'bull_use_ema': True, 'bull_use_atr': False, 'bull_use_adx': True, 'bull_use_spike': False, 'bull_rsi_required': True, 'bear_strategy': 'mean_reversion', 'bear_bb_std_mult': 0.9354145687598658, 'bear_rsi_os': 30, 'bear_rsi_ob': 85, 'bear_adx_thresh': 28.520162532882892, 'bear_atr_min_pct': 0.022476322045421816, 'bear_atr_max_pct': 0.07938289851279413, 'bear_tp_mult': 2.637585013386633, 'bear_tsl_mult': 0.2516233527036964, 'bear_time_stop': 263, 'bear_use_sma': False, 'bear_use_ema': True, 'bear_use_atr': True, 'bear_use_adx': False, 'bear_use_spike': False, 'bear_rsi_required': False, 'sideways_strategy': 'mean_reversion', 'sideways_bb_std_mult': 0.7686668883321484, 'sideways_rsi_os': 10, 'sideways_rsi_ob': 91, 'sideways_adx_thresh': 7.709561936888338, 'sideways_atr_min_pct': 0.021453120662679286, 'sideways_atr_max_pct': 0.11905954080171388, 'sideways_tp_mult': 2.9041940112392752, 'sideways_tsl_mult': 0.46484256557915066, 'sideways_time_stop': 21, 'sideways_use_sma': False, 'sideways_use_ema': False, 'sideways_use_atr': True, 'sideways_use_adx': False, 'sideways_use_spike': False, 'sideways_rsi_required': True}.
[I 2025-09-01 13:31:21,872] Trial 191 finished with values: [-0.01933068199881871, 0.019243529685686492] and parameters: {'p_sma': 17, 'p_std': 26, 'p_atr': 29, 'p_adx': 11, 'rsi_period': 40, 'ema1': 19, 'ema2': 58, 'slip_atr_k': 0.09892500587898702, 'slip_spread_k': 0.8487952836315058, 'spread_hl_frac': 0.009469043576228166, 'bb_std_mult': 2.8544905037414257, 'rsi_os': 40, 'rsi_ob': 89, 'vol_spike': 0.238425727582974, 'adx_thresh': 29.96154151481948, 'atr_min_pct': 0.0031408368785737144, 'atr_max_pct': 0.12778395376334695, 'tp_mult': 1.416070738584128, 'tsl_mult': 0.1107041536961438, 'strategy': 'breakout', 'time_stop': 90, 'use_sma': False, 'use_atr': True, 'use_adx': False, 'use_ema': False, 'use_spike': False, 'rsi_required': True, 'edge_k': 0.36148992936623053, 'edge_cap': 0.7199103883279233, 'bull_strategy': 'breakout', 'bull_bb_std_mult': 1.0261571655592576, 'bull_rsi_os': 54, 'bull_rsi_ob': 54, 'bull_adx_thresh': 6.438048070024481, 'bull_atr_min_pct': 0.00042661364100633715, 'bull_atr_max_pct': 0.011322042256301451, 'bull_tp_mult': 2.1288207208145122, 'bull_tsl_mult': 0.11357488301483937, 'bull_time_stop': 24, 'bull_use_sma': False, 'bull_use_ema': True, 'bull_use_atr': False, 'bull_use_adx': False, 'bull_use_spike': False, 'bull_rsi_required': True, 'bear_strategy': 'mean_reversion', 'bear_bb_std_mult': 0.8772770294948982, 'bear_rsi_os': 10, 'bear_rsi_ob': 45, 'bear_adx_thresh': 16.58826854047102, 'bear_atr_min_pct': 0.02250291478927716, 'bear_atr_max_pct': 0.09297166863642066, 'bear_tp_mult': 2.557799918195581, 'bear_tsl_mult': 0.23892193756619545, 'bear_time_stop': 263, 'bear_use_sma': False, 'bear_use_ema': True, 'bear_use_atr': True, 'bear_use_adx': False, 'bear_use_spike': False, 'bear_rsi_required': False, 'sideways_strategy': 'mean_reversion', 'sideways_bb_std_mult': 0.7528099367585819, 'sideways_rsi_os': 27, 'sideways_rsi_ob': 92, 'sideways_adx_thresh': 14.182794632070614, 'sideways_atr_min_pct': 0.022710119209774556, 'sideways_atr_max_pct': 0.11696874042577513, 'sideways_tp_mult': 2.907057620311754, 'sideways_tsl_mult': 0.4514879594522123, 'sideways_time_stop': 106, 'sideways_use_sma': False, 'sideways_use_ema': False, 'sideways_use_atr': True, 'sideways_use_adx': False, 'sideways_use_spike': False, 'sideways_rsi_required': False}.
[I 2025-09-01 13:31:22,665] Trial 189 finished with values: [-0.03311588407004218, 0.03293898141117398] and parameters: {'p_sma': 56, 'p_std': 33, 'p_atr': 30, 'p_adx': 11, 'rsi_period': 10, 'ema1': 20, 'ema2': 28, 'slip_atr_k': 0.006261597819067433, 'slip_spread_k': 0.33910399436477234, 'spread_hl_frac': 0.014329600190855576, 'bb_std_mult': 1.7271270709526187, 'rsi_os': 9, 'rsi_ob': 89, 'vol_spike': 0.16667380646375166, 'adx_thresh': 29.575290305274052, 'atr_min_pct': 0.003389655475504725, 'atr_max_pct': 0.12730381106781996, 'tp_mult': 2.9579387950968647, 'tsl_mult': 0.018381851624955037, 'strategy': 'breakout', 'time_stop': 89, 'use_sma': False, 'use_atr': True, 'use_adx': False, 'use_ema': False, 'use_spike': False, 'rsi_required': False, 'edge_k': 0.37767186387920243, 'edge_cap': 0.49950797799290014, 'bull_strategy': 'breakout', 'bull_bb_std_mult': 3.371333929631323, 'bull_rsi_os': 48, 'bull_rsi_ob': 54, 'bull_adx_thresh': 6.520200760663836, 'bull_atr_min_pct': 0.0007720771531104769, 'bull_atr_max_pct': 0.04834229320149414, 'bull_tp_mult': 1.9192731217197887, 'bull_tsl_mult': 0.10622235998605523, 'bull_time_stop': 14, 'bull_use_sma': False, 'bull_use_ema': True, 'bull_use_atr': False, 'bull_use_adx': True, 'bull_use_spike': False, 'bull_rsi_required': False, 'bear_strategy': 'mean_reversion', 'bear_bb_std_mult': 0.8468884310515284, 'bear_rsi_os': 49, 'bear_rsi_ob': 68, 'bear_adx_thresh': 30.05205359456179, 'bear_atr_min_pct': 0.022567183277053655, 'bear_atr_max_pct': 0.015660680205011088, 'bear_tp_mult': 2.5406492986044102, 'bear_tsl_mult': 0.6967098530757808, 'bear_time_stop': 263, 'bear_use_sma': False, 'bear_use_ema': False, 'bear_use_atr': False, 'bear_use_adx': True, 'bear_use_spike': False, 'bear_rsi_required': False, 'sideways_strategy': 'mean_reversion', 'sideways_bb_std_mult': 2.3130156856733333, 'sideways_rsi_os': 41, 'sideways_rsi_ob': 73, 'sideways_adx_thresh': 14.54132687326006, 'sideways_atr_min_pct': 0.010541855602916287, 'sideways_atr_max_pct': 0.11930420520971968, 'sideways_tp_mult': 2.166530481577811, 'sideways_tsl_mult': 0.45520759707306424, 'sideways_time_stop': 5, 'sideways_use_sma': False, 'sideways_use_ema': True, 'sideways_use_atr': True, 'sideways_use_adx': False, 'sideways_use_spike': False, 'sideways_rsi_required': False}.
[I 2025-09-01 13:31:23,027] Trial 193 finished with values: [-1000000000.0, 1000000000.0] and parameters: {'p_sma': 17, 'p_std': 45, 'p_atr': 13, 'p_adx': 18, 'rsi_period': 17, 'ema1': 20, 'ema2': 24, 'slip_atr_k': 0.0983273873676293, 'slip_spread_k': 0.4424282738211227, 'spread_hl_frac': 0.009129094808234994, 'bb_std_mult': 1.7212520218896812, 'rsi_os': 55, 'rsi_ob': 72, 'vol_spike': 0.12850179475423362, 'adx_thresh': 10.852568298658943, 'atr_min_pct': 0.0032221189850015577, 'atr_max_pct': 0.045650322779572615, 'tp_mult': 2.1199600162417807, 'tsl_mult': 0.11641540064106912, 'strategy': 'breakout', 'time_stop': 95, 'use_sma': True, 'use_atr': True, 'use_adx': False, 'use_ema': True, 'use_spike': False, 'rsi_required': True, 'edge_k': 0.3754799362516675, 'edge_cap': 0.26702870508571, 'bull_strategy': 'breakout', 'bull_bb_std_mult': 2.943998433576979, 'bull_rsi_os': 53, 'bull_rsi_ob': 54, 'bull_adx_thresh': 20.31467368496524, 'bull_atr_min_pct': 0.02529027177045705, 'bull_atr_max_pct': 0.025586854409735155, 'bull_tp_mult': 1.9201864614759407, 'bull_tsl_mult': 0.34187169542792056, 'bull_time_stop': 24, 'bull_use_sma': True, 'bull_use_ema': True, 'bull_use_atr': False, 'bull_use_adx': True, 'bull_use_spike': False, 'bull_rsi_required': True, 'bear_strategy': 'mean_reversion', 'bear_bb_std_mult': 0.9979192084472424, 'bear_rsi_os': 9, 'bear_rsi_ob': 46, 'bear_adx_thresh': 13.70461483269817, 'bear_atr_min_pct': 0.013364220716911429, 'bear_atr_max_pct': 0.09361043548038206, 'bear_tp_mult': 2.553936558442024, 'bear_tsl_mult': 0.5092788424104993, 'bear_time_stop': 262, 'bear_use_sma': True, 'bear_use_ema': True, 'bear_use_atr': True, 'bear_use_adx': True, 'bear_use_spike': False, 'bear_rsi_required': False, 'sideways_strategy': 'mean_reversion', 'sideways_bb_std_mult': 0.7712220192463937, 'sideways_rsi_os': 27, 'sideways_rsi_ob': 62, 'sideways_adx_thresh': 14.16301015739662, 'sideways_atr_min_pct': 0.00459499400285562, 'sideways_atr_max_pct': 0.10192270824181862, 'sideways_tp_mult': 2.186175422672671, 'sideways_tsl_mult': 0.47800139937218994, 'sideways_time_stop': 5, 'sideways_use_sma': False, 'sideways_use_ema': False, 'sideways_use_atr': True, 'sideways_use_adx': False, 'sideways_use_spike': False, 'sideways_rsi_required': True}.
[I 2025-09-01 13:32:03,208] Trial 194 finished with values: [-1000000000.0, 1000000000.0] and parameters: {'p_sma': 51, 'p_std': 45, 'p_atr': 16, 'p_adx': 13, 'rsi_period': 72, 'ema1': 20, 'ema2': 24, 'slip_atr_k': 0.09513333156444555, 'slip_spread_k': 0.17287857653415334, 'spread_hl_frac': 0.04846054122094652, 'bb_std_mult': 1.7386636759116598, 'rsi_os': 6, 'rsi_ob': 92, 'vol_spike': 0.12066775420240719, 'adx_thresh': 11.925013848267977, 'atr_min_pct': 0.003309165521861289, 'atr_max_pct': 0.03521602427635124, 'tp_mult': 1.4288696717463203, 'tsl_mult': 0.12039306958064624, 'strategy': 'breakout', 'time_stop': 95, 'use_sma': True, 'use_atr': True, 'use_adx': False, 'use_ema': True, 'use_spike': False, 'rsi_required': True, 'edge_k': 0.3850101741411587, 'edge_cap': 0.4980872739724291, 'bull_strategy': 'breakout', 'bull_bb_std_mult': 0.6578495785956597, 'bull_rsi_os': 53, 'bull_rsi_ob': 81, 'bull_adx_thresh': 5.785356562315717, 'bull_atr_min_pct': 0.012199913255705875, 'bull_atr_max_pct': 0.022968669509813272, 'bull_tp_mult': 1.9188654756101993, 'bull_tsl_mult': 0.8989276553747748, 'bull_time_stop': 23, 'bull_use_sma': True, 'bull_use_ema': True, 'bull_use_atr': True, 'bull_use_adx': True, 'bull_use_spike': False, 'bull_rsi_required': True, 'bear_strategy': 'mean_reversion', 'bear_bb_std_mult': 1.0068067083293688, 'bear_rsi_os': 55, 'bear_rsi_ob': 84, 'bear_adx_thresh': 33.790995779373524, 'bear_atr_min_pct': 0.02236882328446783, 'bear_atr_max_pct': 0.07673320730553163, 'bear_tp_mult': 2.5547646111701514, 'bear_tsl_mult': 0.5156153599552253, 'bear_time_stop': 263, 'bear_use_sma': True, 'bear_use_ema': True, 'bear_use_atr': True, 'bear_use_adx': True, 'bear_use_spike': False, 'bear_rsi_required': False, 'sideways_strategy': 'mean_reversion', 'sideways_bb_std_mult': 0.755963918072997, 'sideways_rsi_os': 27, 'sideways_rsi_ob': 57, 'sideways_adx_thresh': 20.92716292148709, 'sideways_atr_min_pct': 0.004518991555130067, 'sideways_atr_max_pct': 0.1172720285813234, 'sideways_tp_mult': 2.129177411111174, 'sideways_tsl_mult': 0.4740917839970796, 'sideways_time_stop': 5, 'sideways_use_sma': False, 'sideways_use_ema': False, 'sideways_use_atr': True, 'sideways_use_adx': False, 'sideways_use_spike': False, 'sideways_rsi_required': True}.
[I 2025-09-01 13:32:04,029] Trial 196 finished with values: [-0.05377220507084146, 0.05394156877335721] and parameters: {'p_sma': 51, 'p_std': 45, 'p_atr': 13, 'p_adx': 8, 'rsi_period': 73, 'ema1': 20, 'ema2': 58, 'slip_atr_k': 0.09837332696792848, 'slip_spread_k': 0.8442095331657673, 'spread_hl_frac': 0.0077570300172965095, 'bb_std_mult': 1.7620163109213667, 'rsi_os': 24, 'rsi_ob': 92, 'vol_spike': 0.13342350811161338, 'adx_thresh': 11.93253823066323, 'atr_min_pct': 0.025497389538608327, 'atr_max_pct': 0.03616165354348085, 'tp_mult': 2.0061366754949153, 'tsl_mult': 0.11966987263036384, 'strategy': 'mean_reversion', 'time_stop': 97, 'use_sma': True, 'use_atr': True, 'use_adx': False, 'use_ema': True, 'use_spike': False, 'rsi_required': True, 'edge_k': 0.43957792151504615, 'edge_cap': 0.271173465935586, 'bull_strategy': 'breakout', 'bull_bb_std_mult': 2.3277555916697565, 'bull_rsi_os': 37, 'bull_rsi_ob': 83, 'bull_adx_thresh': 20.222112364586668, 'bull_atr_min_pct': 0.003577603023776533, 'bull_atr_max_pct': 0.11920732705732695, 'bull_tp_mult': 1.9735320039877702, 'bull_tsl_mult': 0.3828404169326266, 'bull_time_stop': 266, 'bull_use_sma': True, 'bull_use_ema': False, 'bull_use_atr': True, 'bull_use_adx': False, 'bull_use_spike': False, 'bull_rsi_required': True, 'bear_strategy': 'mean_reversion', 'bear_bb_std_mult': 1.024447896042694, 'bear_rsi_os': 9, 'bear_rsi_ob': 46, 'bear_adx_thresh': 16.807584417181953, 'bear_atr_min_pct': 0.002097497662413324, 'bear_atr_max_pct': 0.07681118883873327, 'bear_tp_mult': 2.568795494044607, 'bear_tsl_mult': 0.5090767170303039, 'bear_time_stop': 253, 'bear_use_sma': True, 'bear_use_ema': True, 'bear_use_atr': True, 'bear_use_adx': False, 'bear_use_spike': False, 'bear_rsi_required': False, 'sideways_strategy': 'mean_reversion', 'sideways_bb_std_mult': 0.7466020782733472, 'sideways_rsi_os': 27, 'sideways_rsi_ob': 79, 'sideways_adx_thresh': 20.895047996991376, 'sideways_atr_min_pct': 0.0014525441263553637, 'sideways_atr_max_pct': 0.11016452610004991, 'sideways_tp_mult': 2.8426293665479143, 'sideways_tsl_mult': 0.5125354895994864, 'sideways_time_stop': 18, 'sideways_use_sma': False, 'sideways_use_ema': False, 'sideways_use_atr': True, 'sideways_use_adx': False, 'sideways_use_spike': True, 'sideways_rsi_required': True}.
[I 2025-09-01 13:32:04,173] Trial 197 finished with values: [-1000000000.0, 1000000000.0] and parameters: {'p_sma': 51, 'p_std': 26, 'p_atr': 30, 'p_adx': 10, 'rsi_period': 61, 'ema1': 15, 'ema2': 31, 'slip_atr_k': 0.11086540501010707, 'slip_spread_k': 0.17546271325769974, 'spread_hl_frac': 0.04353688876279101, 'bb_std_mult': 1.776920881904743, 'rsi_os': 41, 'rsi_ob': 66, 'vol_spike': 0.2250180368644673, 'adx_thresh': 11.942387887252767, 'atr_min_pct': 0.025311056973146437, 'atr_max_pct': 0.035503238666157184, 'tp_mult': 2.5000219235983767, 'tsl_mult': 0.1330325341425701, 'strategy': 'mean_reversion', 'time_stop': 104, 'use_sma': True, 'use_atr': True, 'use_adx': False, 'use_ema': True, 'use_spike': False, 'rsi_required': True, 'edge_k': 1.488175466668108, 'edge_cap': 0.8189060490522405, 'bull_strategy': 'breakout', 'bull_bb_std_mult': 3.194198378229283, 'bull_rsi_os': 49, 'bull_rsi_ob': 83, 'bull_adx_thresh': 29.915558913444386, 'bull_atr_min_pct': 0.012288841693679197, 'bull_atr_max_pct': 0.12039185938464705, 'bull_tp_mult': 1.991382620961906, 'bull_tsl_mult': 0.4604490165543944, 'bull_time_stop': 14, 'bull_use_sma': True, 'bull_use_ema': False, 'bull_use_atr': True, 'bull_use_adx': False, 'bull_use_spike': False, 'bull_rsi_required': True, 'bear_strategy': 'mean_reversion', 'bear_bb_std_mult': 0.7957887102269862, 'bear_rsi_os': 53, 'bear_rsi_ob': 85, 'bear_adx_thresh': 16.988874378990296, 'bear_atr_min_pct': 0.021577773740038903, 'bear_atr_max_pct': 0.07729186540030522, 'bear_tp_mult': 2.4542404703200638, 'bear_tsl_mult': 0.7746668761676343, 'bear_time_stop': 253, 'bear_use_sma': True, 'bear_use_ema': True, 'bear_use_atr': True, 'bear_use_adx': False, 'bear_use_spike': False, 'bear_rsi_required': False, 'sideways_strategy': 'mean_reversion', 'sideways_bb_std_mult': 0.6203829717239207, 'sideways_rsi_os': 34, 'sideways_rsi_ob': 79, 'sideways_adx_thresh': 20.955535421075417, 'sideways_atr_min_pct': 0.00964584598046002, 'sideways_atr_max_pct': 0.07319209796446141, 'sideways_tp_mult': 2.904002292141817, 'sideways_tsl_mult': 0.5038069447354552, 'sideways_time_stop': 18, 'sideways_use_sma': False, 'sideways_use_ema': False, 'sideways_use_atr': True, 'sideways_use_adx': False, 'sideways_use_spike': True, 'sideways_rsi_required': True}.
[I 2025-09-01 13:32:04,361] Trial 195 finished with values: [-0.037566636114651164, 0.037384149848509574] and parameters: {'p_sma': 44, 'p_std': 28, 'p_atr': 16, 'p_adx': 13, 'rsi_period': 73, 'ema1': 20, 'ema2': 58, 'slip_atr_k': 0.11056056287991031, 'slip_spread_k': 0.4432955060431136, 'spread_hl_frac': 0.04349463543493562, 'bb_std_mult': 2.8800704978838505, 'rsi_os': 6, 'rsi_ob': 91, 'vol_spike': 0.12378002763504657, 'adx_thresh': 11.956227631982138, 'atr_min_pct': 0.025234068779330432, 'atr_max_pct': 0.047026442820232876, 'tp_mult': 1.5611523441840396, 'tsl_mult': 0.1128666624071465, 'strategy': 'breakout', 'time_stop': 96, 'use_sma': True, 'use_atr': True, 'use_adx': False, 'use_ema': True, 'use_spike': False, 'rsi_required': True, 'edge_k': 1.4785932674969748, 'edge_cap': 0.5818901075518339, 'bull_strategy': 'breakout', 'bull_bb_std_mult': 2.9458901344846136, 'bull_rsi_os': 48, 'bull_rsi_ob': 54, 'bull_adx_thresh': 6.184640825204699, 'bull_atr_min_pct': 0.0005549125272445614, 'bull_atr_max_pct': 0.10043609558485182, 'bull_tp_mult': 1.9359148990230137, 'bull_tsl_mult': 0.8970296567209852, 'bull_time_stop': 23, 'bull_use_sma': True, 'bull_use_ema': True, 'bull_use_atr': False, 'bull_use_adx': False, 'bull_use_spike': False, 'bull_rsi_required': True, 'bear_strategy': 'mean_reversion', 'bear_bb_std_mult': 1.0022744775408532, 'bear_rsi_os': 9, 'bear_rsi_ob': 71, 'bear_adx_thresh': 11.558382170385247, 'bear_atr_min_pct': 0.02244998313782519, 'bear_atr_max_pct': 0.05220183253081355, 'bear_tp_mult': 2.0277823257734107, 'bear_tsl_mult': 0.5088056807233827, 'bear_time_stop': 262, 'bear_use_sma': True, 'bear_use_ema': True, 'bear_use_atr': True, 'bear_use_adx': False, 'bear_use_spike': False, 'bear_rsi_required': False, 'sideways_strategy': 'mean_reversion', 'sideways_bb_std_mult': 0.7538126263417688, 'sideways_rsi_os': 41, 'sideways_rsi_ob': 85, 'sideways_adx_thresh': 14.433630518643765, 'sideways_atr_min_pct': 0.009738251895675704, 'sideways_atr_max_pct': 0.11617420793238269, 'sideways_tp_mult': 2.831134152296756, 'sideways_tsl_mult': 0.5059557679311005, 'sideways_time_stop': 5, 'sideways_use_sma': False, 'sideways_use_ema': False, 'sideways_use_atr': True, 'sideways_use_adx': False, 'sideways_use_spike': True, 'sideways_rsi_required': True}.
