[I 2025-09-01 14:46:18,733] Trial 701 finished with values: [-1000000000.0, 1000000000.0] and parameters: {'p_sma': 37, 'p_std': 48, 'p_atr': 10, 'p_adx': 17, 'rsi_period': 64, 'ema1': 22, 'ema2': 27, 'slip_atr_k': 0.18350725870340656, 'slip_spread_k': 0.7825922955845922, 'spread_hl_frac': 0.006366436815235341, 'bb_std_mult': 1.7619436743121955, 'rsi_os': 39, 'rsi_ob': 53, 'vol_spike': 0.18931350442341843, 'adx_thresh': 25.575491423202983, 'atr_min_pct': 0.025990962826253603, 'atr_max_pct': 0.13659631797738006, 'tp_mult': 1.1300650949252447, 'tsl_mult': 0.05185245990003129, 'strategy': 'mean_reversion', 'time_stop': 166, 'use_sma': True, 'use_atr': False, 'use_adx': False, 'use_ema': False, 'use_spike': True, 'rsi_required': False, 'edge_k': 0.35457291848332695, 'edge_cap': 0.3261292338013708, 'bull_strategy': 'breakout', 'bull_bb_std_mult': 3.344205520400431, 'bull_rsi_os': 35, 'bull_rsi_ob': 54, 'bull_adx_thresh': 32.52013657007383, 'bull_atr_min_pct': 0.00782340099338205, 'bull_atr_max_pct': 0.0701966270276023, 'bull_tp_mult': 2.7569130397252954, 'bull_tsl_mult': 0.4570941823561601, 'bull_time_stop': 101, 'bull_use_sma': True, 'bull_use_ema': True, 'bull_use_atr': True, 'bull_use_adx': False, 'bull_use_spike': True, 'bull_rsi_required': False, 'bear_strategy': 'breakout', 'bear_bb_std_mult': 1.7988011657329666, 'bear_rsi_os': 34, 'bear_rsi_ob': 87, 'bear_adx_thresh': 9.470967488324987, 'bear_atr_min_pct': 0.0027300461851488067, 'bear_atr_max_pct': 0.059385978458479226, 'bear_tp_mult': 2.2849467305015376, 'bear_tsl_mult': 0.30642379588454294, 'bear_time_stop': 241, 'bear_use_sma': True, 'bear_use_ema': True, 'bear_use_atr': False, 'bear_use_adx': True, 'bear_use_spike': False, 'bear_rsi_required': True, 'sideways_strategy': 'breakout', 'sideways_bb_std_mult': 1.1657350926668033, 'sideways_rsi_os': 38, 'sideways_rsi_ob': 54, 'sideways_adx_thresh': 11.86881741146684, 'sideways_atr_min_pct': 0.01967854685979857, 'sideways_atr_max_pct': 0.06502999700147093, 'sideways_tp_mult': 2.6717933493507524, 'sideways_tsl_mult': 0.2586973297584832, 'sideways_time_stop': 175, 'sideways_use_sma': True, 'sideways_use_ema': True, 'sideways_use_atr': True, 'sideways_use_adx': False, 'sideways_use_spike': False, 'sideways_rsi_required': True}.
[I 2025-09-01 14:46:55,038] Trial 705 finished with values: [-1000000000.0, 1000000000.0] and parameters: {'p_sma': 34, 'p_std': 49, 'p_atr': 26, 'p_adx': 14, 'rsi_period': 64, 'ema1': 21, 'ema2': 30, 'slip_atr_k': 0.01712172152907454, 'slip_spread_k': 0.667397004510232, 'spread_hl_frac': 0.005311433668127377, 'bb_std_mult': 1.7821386507514676, 'rsi_os': 40, 'rsi_ob': 46, 'vol_spike': 0.21226465556580873, 'adx_thresh': 26.003288327718288, 'atr_min_pct': 0.01073371633387199, 'atr_max_pct': 0.08567234098918346, 'tp_mult': 1.140681397241326, 'tsl_mult': 0.05302362413877865, 'strategy': 'breakout', 'time_stop': 239, 'use_sma': False, 'use_atr': False, 'use_adx': False, 'use_ema': True, 'use_spike': False, 'rsi_required': False, 'edge_k': 1.7495511502152876, 'edge_cap': 0.3262504067143615, 'bull_strategy': 'mean_reversion', 'bull_bb_std_mult': 0.6837149476444562, 'bull_rsi_os': 14, 'bull_rsi_ob': 54, 'bull_adx_thresh': 29.964709849485207, 'bull_atr_min_pct': 0.002394135315566853, 'bull_atr_max_pct': 0.050043050635326, 'bull_tp_mult': 2.999049446149027, 'bull_tsl_mult': 0.5862115655693777, 'bull_time_stop': 192, 'bull_use_sma': False, 'bull_use_ema': False, 'bull_use_atr': False, 'bull_use_adx': False, 'bull_use_spike': False, 'bull_rsi_required': True, 'bear_strategy': 'breakout', 'bear_bb_std_mult': 2.5326645466813744, 'bear_rsi_os': 33, 'bear_rsi_ob': 87, 'bear_adx_thresh': 13.916611754497175, 'bear_atr_min_pct': 0.02148925585959907, 'bear_atr_max_pct': 0.059917455999164856, 'bear_tp_mult': 1.4529313075399934, 'bear_tsl_mult': 0.3965338323116623, 'bear_time_stop': 276, 'bear_use_sma': False, 'bear_use_ema': False, 'bear_use_atr': True, 'bear_use_adx': True, 'bear_use_spike': False, 'bear_rsi_required': False, 'sideways_strategy': 'mean_reversion', 'sideways_bb_std_mult': 1.7048405703074776, 'sideways_rsi_os': 28, 'sideways_rsi_ob': 61, 'sideways_adx_thresh': 20.505924473881254, 'sideways_atr_min_pct': 0.01121029556662435, 'sideways_atr_max_pct': 0.061433606993418044, 'sideways_tp_mult': 2.6840684061086755, 'sideways_tsl_mult': 0.20689347280509635, 'sideways_time_stop': 175, 'sideways_use_sma': False, 'sideways_use_ema': False, 'sideways_use_atr': True, 'sideways_use_adx': False, 'sideways_use_spike': False, 'sideways_rsi_required': False}.
[I 2025-09-01 14:46:55,413] Trial 704 finished with values: [-1000000000.0, 1000000000.0] and parameters: {'p_sma': 38, 'p_std': 46, 'p_atr': 26, 'p_adx': 29, 'rsi_period': 64, 'ema1': 21, 'ema2': 57, 'slip_atr_k': 0.03462380318843347, 'slip_spread_k': 0.0009932623135463087, 'spread_hl_frac': 0.00531268501274908, 'bb_std_mult': 1.7771971565440223, 'rsi_os': 51, 'rsi_ob': 90, 'vol_spike': 0.2739043969053768, 'adx_thresh': 26.134561507177256, 'atr_min_pct': 0.01818424443333864, 'atr_max_pct': 0.13693448673144673, 'tp_mult': 1.1515749104403488, 'tsl_mult': 0.37164500619371116, 'strategy': 'breakout', 'time_stop': 242, 'use_sma': False, 'use_atr': False, 'use_adx': False, 'use_ema': True, 'use_spike': False, 'rsi_required': False, 'edge_k': 1.8557249546760142, 'edge_cap': 0.3189433396909726, 'bull_strategy': 'mean_reversion', 'bull_bb_std_mult': 2.6646213371848773, 'bull_rsi_os': 48, 'bull_rsi_ob': 45, 'bull_adx_thresh': 30.016092259068017, 'bull_atr_min_pct': 0.00766040606458486, 'bull_atr_max_pct': 0.015174106562914295, 'bull_tp_mult': 2.0903080344420935, 'bull_tsl_mult': 0.30647391353483433, 'bull_time_stop': 194, 'bull_use_sma': False, 'bull_use_ema': False, 'bull_use_atr': False, 'bull_use_adx': False, 'bull_use_spike': False, 'bull_rsi_required': True, 'bear_strategy': 'breakout', 'bear_bb_std_mult': 1.7959130335098707, 'bear_rsi_os': 33, 'bear_rsi_ob': 87, 'bear_adx_thresh': 16.487465835699812, 'bear_atr_min_pct': 0.0035784250959085846, 'bear_atr_max_pct': 0.02138603020942778, 'bear_tp_mult': 1.4420646555729364, 'bear_tsl_mult': 0.7363213391842107, 'bear_time_stop': 254, 'bear_use_sma': False, 'bear_use_ema': False, 'bear_use_atr': True, 'bear_use_adx': True, 'bear_use_spike': False, 'bear_rsi_required': False, 'sideways_strategy': 'mean_reversion', 'sideways_bb_std_mult': 1.6999760140637432, 'sideways_rsi_os': 26, 'sideways_rsi_ob': 69, 'sideways_adx_thresh': 24.0853635253323, 'sideways_atr_min_pct': 0.022068662181887196, 'sideways_atr_max_pct': 0.059081157578837626, 'sideways_tp_mult': 2.8213399734654816, 'sideways_tsl_mult': 0.9785319485753219, 'sideways_time_stop': 174, 'sideways_use_sma': False, 'sideways_use_ema': False, 'sideways_use_atr': True, 'sideways_use_adx': False, 'sideways_use_spike': False, 'sideways_rsi_required': False}.
[I 2025-09-01 14:46:56,159] Trial 703 finished with values: [-0.06585664011306203, 0.06624981252673381] and parameters: {'p_sma': 37, 'p_std': 15, 'p_atr': 26, 'p_adx': 13, 'rsi_period': 64, 'ema1': 19, 'ema2': 31, 'slip_atr_k': 0.1829856274482376, 'slip_spread_k': 0.0012557882456271652, 'spread_hl_frac': 0.006811434265514905, 'bb_std_mult': 0.8485703250505312, 'rsi_os': 23, 'rsi_ob': 62, 'vol_spike': 0.00012168977438950512, 'adx_thresh': 25.614065082668922, 'atr_min_pct': 0.026016788995394887, 'atr_max_pct': 0.08084913704559762, 'tp_mult': 1.334349591100903, 'tsl_mult': 0.7747984963280388, 'strategy': 'breakout', 'time_stop': 202, 'use_sma': True, 'use_atr': False, 'use_adx': False, 'use_ema': False, 'use_spike': False, 'rsi_required': False, 'edge_k': 0.8137190742783305, 'edge_cap': 0.1582283445301163, 'bull_strategy': 'breakout', 'bull_bb_std_mult': 1.2812752871504793, 'bull_rsi_os': 14, 'bull_rsi_ob': 45, 'bull_adx_thresh': 30.654982112492192, 'bull_atr_min_pct': 0.0025358819244274385, 'bull_atr_max_pct': 0.020810445521860985, 'bull_tp_mult': 2.7698156637083584, 'bull_tsl_mult': 0.3940447710239918, 'bull_time_stop': 89, 'bull_use_sma': True, 'bull_use_ema': True, 'bull_use_atr': True, 'bull_use_adx': False, 'bull_use_spike': False, 'bull_rsi_required': True, 'bear_strategy': 'breakout', 'bear_bb_std_mult': 1.4252812606853684, 'bear_rsi_os': 38, 'bear_rsi_ob': 88, 'bear_adx_thresh': 9.262433777391088, 'bear_atr_min_pct': 0.0035431762323444183, 'bear_atr_max_pct': 0.058873340350759334, 'bear_tp_mult': 2.294859040536399, 'bear_tsl_mult': 0.30495432041436854, 'bear_time_stop': 269, 'bear_use_sma': True, 'bear_use_ema': False, 'bear_use_atr': False, 'bear_use_adx': True, 'bear_use_spike': False, 'bear_rsi_required': False, 'sideways_strategy': 'breakout', 'sideways_bb_std_mult': 2.9587218329953267, 'sideways_rsi_os': 49, 'sideways_rsi_ob': 75, 'sideways_adx_thresh': 26.10468486145057, 'sideways_atr_min_pct': 0.01968248163624709, 'sideways_atr_max_pct': 0.05942908312983737, 'sideways_tp_mult': 1.4855232795835287, 'sideways_tsl_mult': 0.2589441228974377, 'sideways_time_stop': 284, 'sideways_use_sma': False, 'sideways_use_ema': False, 'sideways_use_atr': True, 'sideways_use_adx': False, 'sideways_use_spike': False, 'sideways_rsi_required': False}.
[I 2025-09-01 14:46:56,328] Trial 706 finished with values: [-1000000000.0, 1000000000.0] and parameters: {'p_sma': 18, 'p_std': 14, 'p_atr': 26, 'p_adx': 14, 'rsi_period': 66, 'ema1': 21, 'ema2': 19, 'slip_atr_k': 0.03355945983700963, 'slip_spread_k': 0.5558924401539348, 'spread_hl_frac': 0.03309467655079718, 'bb_std_mult': 2.771097568224531, 'rsi_os': 8, 'rsi_ob': 86, 'vol_spike': 0.14294420840264152, 'adx_thresh': 26.1505317155761, 'atr_min_pct': 0.02789407700509466, 'atr_max_pct': 0.1404783858475145, 'tp_mult': 1.1780142098374804, 'tsl_mult': 0.7605947114240108, 'strategy': 'breakout', 'time_stop': 240, 'use_sma': False, 'use_atr': False, 'use_adx': False, 'use_ema': True, 'use_spike': False, 'rsi_required': False, 'edge_k': 1.7474415263614391, 'edge_cap': 0.681899282904858, 'bull_strategy': 'mean_reversion', 'bull_bb_std_mult': 3.142354895326026, 'bull_rsi_os': 33, 'bull_rsi_ob': 55, 'bull_adx_thresh': 29.9509168077958, 'bull_atr_min_pct': 0.0197528073690435, 'bull_atr_max_pct': 0.07549707687376223, 'bull_tp_mult': 2.3777302882479203, 'bull_tsl_mult': 0.22188911792903487, 'bull_time_stop': 87, 'bull_use_sma': False, 'bull_use_ema': False, 'bull_use_atr': False, 'bull_use_adx': True, 'bull_use_spike': False, 'bull_rsi_required': True, 'bear_strategy': 'breakout', 'bear_bb_std_mult': 3.433647244812131, 'bear_rsi_os': 38, 'bear_rsi_ob': 87, 'bear_adx_thresh': 11.728385785369344, 'bear_atr_min_pct': 0.0036963430306600495, 'bear_atr_max_pct': 0.044711508200482676, 'bear_tp_mult': 2.3477417096221194, 'bear_tsl_mult': 0.16156345500175262, 'bear_time_stop': 25, 'bear_use_sma': False, 'bear_use_ema': False, 'bear_use_atr': True, 'bear_use_adx': True, 'bear_use_spike': False, 'bear_rsi_required': False, 'sideways_strategy': 'mean_reversion', 'sideways_bb_std_mult': 1.7007433223775046, 'sideways_rsi_os': 26, 'sideways_rsi_ob': 81, 'sideways_adx_thresh': 8.076272866447866, 'sideways_atr_min_pct': 0.02201306480066807, 'sideways_atr_max_pct': 0.059297874665875355, 'sideways_tp_mult': 2.820668872757445, 'sideways_tsl_mult': 0.22758035637729637, 'sideways_time_stop': 161, 'sideways_use_sma': False, 'sideways_use_ema': False, 'sideways_use_atr': True, 'sideways_use_adx': True, 'sideways_use_spike': False, 'sideways_rsi_required': False}.
[I 2025-09-01 14:47:32,037] Trial 707 finished with values: [-1000000000.0, 1000000000.0] and parameters: {'p_sma': 38, 'p_std': 14, 'p_atr': 25, 'p_adx': 12, 'rsi_period': 66, 'ema1': 21, 'ema2': 46, 'slip_atr_k': 0.08992416610038473, 'slip_spread_k': 0.013304751630212053, 'spread_hl_frac': 0.00733163482281219, 'bb_std_mult': 1.668715216915776, 'rsi_os': 9, 'rsi_ob': 83, 'vol_spike': 0.2368367216749774, 'adx_thresh': 24.8874531699149, 'atr_min_pct': 0.027708592378523987, 'atr_max_pct': 0.0923681916209089, 'tp_mult': 1.1872243798825617, 'tsl_mult': 0.7583089171438864, 'strategy': 'breakout', 'time_stop': 287, 'use_sma': True, 'use_atr': False, 'use_adx': False, 'use_ema': True, 'use_spike': False, 'rsi_required': False, 'edge_k': 0.008284123473790483, 'edge_cap': 0.6739141038398954, 'bull_strategy': 'breakout', 'bull_bb_std_mult': 3.1417621471967347, 'bull_rsi_os': 48, 'bull_rsi_ob': 58, 'bull_adx_thresh': 28.85075517874104, 'bull_atr_min_pct': 0.012678628187178857, 'bull_atr_max_pct': 0.08741001008276504, 'bull_tp_mult': 1.2909409714048758, 'bull_tsl_mult': 0.4347317327267128, 'bull_time_stop': 62, 'bull_use_sma': False, 'bull_use_ema': False, 'bull_use_atr': True, 'bull_use_adx': True, 'bull_use_spike': False, 'bull_rsi_required': True, 'bear_strategy': 'breakout', 'bear_bb_std_mult': 1.632965520472468, 'bear_rsi_os': 30, 'bear_rsi_ob': 65, 'bear_adx_thresh': 16.008014755084147, 'bear_atr_min_pct': 0.003505538863636492, 'bear_atr_max_pct': 0.04446940617788376, 'bear_tp_mult': 2.3437181489654213, 'bear_tsl_mult': 0.5148936683826352, 'bear_time_stop': 200, 'bear_use_sma': True, 'bear_use_ema': False, 'bear_use_atr': True, 'bear_use_adx': True, 'bear_use_spike': False, 'bear_rsi_required': False, 'sideways_strategy': 'breakout', 'sideways_bb_std_mult': 1.5891763890418027, 'sideways_rsi_os': 26, 'sideways_rsi_ob': 71, 'sideways_adx_thresh': 7.910576974500654, 'sideways_atr_min_pct': 0.02210007125516753, 'sideways_atr_max_pct': 0.05003649794914656, 'sideways_tp_mult': 2.801177442452, 'sideways_tsl_mult': 0.34540020983957764, 'sideways_time_stop': 282, 'sideways_use_sma': False, 'sideways_use_ema': False, 'sideways_use_atr': True, 'sideways_use_adx': True, 'sideways_use_spike': False, 'sideways_rsi_required': False}.
[I 2025-09-01 14:47:32,037] Trial 708 finished with values: [-0.14274960674570625, 0.14243896996183208] and parameters: {'p_sma': 54, 'p_std': 14, 'p_atr': 25, 'p_adx': 27, 'rsi_period': 66, 'ema1': 20, 'ema2': 19, 'slip_atr_k': 0.0029145540494668, 'slip_spread_k': 0.04343335271070087, 'spread_hl_frac': 0.007345716939568143, 'bb_std_mult': 1.654655495356541, 'rsi_os': 9, 'rsi_ob': 83, 'vol_spike': 0.2367488952503856, 'adx_thresh': 27.570251450068866, 'atr_min_pct': 0.014188488958266767, 'atr_max_pct': 0.11720203602896104, 'tp_mult': 1.0133708083108575, 'tsl_mult': 0.7614496360438916, 'strategy': 'mean_reversion', 'time_stop': 227, 'use_sma': True, 'use_atr': False, 'use_adx': False, 'use_ema': True, 'use_spike': True, 'rsi_required': False, 'edge_k': 0.8175214762358708, 'edge_cap': 0.35167087621866583, 'bull_strategy': 'breakout', 'bull_bb_std_mult': 2.2789309497054853, 'bull_rsi_os': 33, 'bull_rsi_ob': 70, 'bull_adx_thresh': 28.709989180741317, 'bull_atr_min_pct': 0.0030903035297279954, 'bull_atr_max_pct': 0.02045722118623538, 'bull_tp_mult': 2.613501313430746, 'bull_tsl_mult': 0.3951968778748071, 'bull_time_stop': 47, 'bull_use_sma': True, 'bull_use_ema': True, 'bull_use_atr': True, 'bull_use_adx': True, 'bull_use_spike': False, 'bull_rsi_required': True, 'bear_strategy': 'breakout', 'bear_bb_std_mult': 3.526443223666772, 'bear_rsi_os': 55, 'bear_rsi_ob': 88, 'bear_adx_thresh': 11.420347607834321, 'bear_atr_min_pct': 0.0017189875206338305, 'bear_atr_max_pct': 0.11174043607788733, 'bear_tp_mult': 2.8395462397446884, 'bear_tsl_mult': 0.08414174119159218, 'bear_time_stop': 25, 'bear_use_sma': True, 'bear_use_ema': True, 'bear_use_atr': True, 'bear_use_adx': True, 'bear_use_spike': True, 'bear_rsi_required': True, 'sideways_strategy': 'breakout', 'sideways_bb_std_mult': 1.5975943731784588, 'sideways_rsi_os': 49, 'sideways_rsi_ob': 66, 'sideways_adx_thresh': 7.8600572193969676, 'sideways_atr_min_pct': 0.019580902610612304, 'sideways_atr_max_pct': 0.05038156036579172, 'sideways_tp_mult': 2.7652906679742526, 'sideways_tsl_mult': 0.6038132427271713, 'sideways_time_stop': 78, 'sideways_use_sma': True, 'sideways_use_ema': False, 'sideways_use_atr': False, 'sideways_use_adx': True, 'sideways_use_spike': False, 'sideways_rsi_required': True}.
[I 2025-09-01 14:47:32,868] Trial 709 finished with values: [-1000000000.0, 1000000000.0] and parameters: {'p_sma': 30, 'p_std': 34, 'p_atr': 25, 'p_adx': 12, 'rsi_period': 59, 'ema1': 20, 'ema2': 17, 'slip_atr_k': 0.14342793224269068, 'slip_spread_k': 0.0416964465991743, 'spread_hl_frac': 0.007470139026930157, 'bb_std_mult': 1.649474875581997, 'rsi_os': 9, 'rsi_ob': 83, 'vol_spike': 0.23796950309653847, 'adx_thresh': 24.709787721822497, 'atr_min_pct': 0.013959153610146715, 'atr_max_pct': 0.11709548971276894, 'tp_mult': 2.086194931851895, 'tsl_mult': 0.7582103891889709, 'strategy': 'mean_reversion', 'time_stop': 17, 'use_sma': True, 'use_atr': False, 'use_adx': True, 'use_ema': True, 'use_spike': True, 'rsi_required': True, 'edge_k': 0.911247332386036, 'edge_cap': 0.28269675345773637, 'bull_strategy': 'breakout', 'bull_bb_std_mult': 1.7804896181648333, 'bull_rsi_os': 35, 'bull_rsi_ob': 58, 'bull_adx_thresh': 31.587156908002342, 'bull_atr_min_pct': 0.01178319514249944, 'bull_atr_max_pct': 0.024393559179079843, 'bull_tp_mult': 1.284481011603377, 'bull_tsl_mult': 0.8038280376750613, 'bull_time_stop': 79, 'bull_use_sma': True, 'bull_use_ema': True, 'bull_use_atr': True, 'bull_use_adx': True, 'bull_use_spike': False, 'bull_rsi_required': True, 'bear_strategy': 'breakout', 'bear_bb_std_mult': 1.207080158583325, 'bear_rsi_os': 30, 'bear_rsi_ob': 65, 'bear_adx_thresh': 30.091557235108752, 'bear_atr_min_pct': 0.0016910806887457386, 'bear_atr_max_pct': 0.10880987684412395, 'bear_tp_mult': 2.1423643377076136, 'bear_tsl_mult': 0.09150888435874549, 'bear_time_stop': 202, 'bear_use_sma': True, 'bear_use_ema': True, 'bear_use_atr': True, 'bear_use_adx': False, 'bear_use_spike': True, 'bear_rsi_required': True, 'sideways_strategy': 'breakout', 'sideways_bb_std_mult': 1.5647495186351048, 'sideways_rsi_os': 50, 'sideways_rsi_ob': 66, 'sideways_adx_thresh': 6.783214648550313, 'sideways_atr_min_pct': 0.007501922625410156, 'sideways_atr_max_pct': 0.07342420620700535, 'sideways_tp_mult': 2.7720009912968866, 'sideways_tsl_mult': 0.2814782793503983, 'sideways_time_stop': 148, 'sideways_use_sma': True, 'sideways_use_ema': False, 'sideways_use_atr': False, 'sideways_use_adx': True, 'sideways_use_spike': False, 'sideways_rsi_required': True}.
[I 2025-09-01 14:47:33,286] Trial 710 finished with values: [-0.15596565339216273, 0.1558813054157416] and parameters: {'p_sma': 40, 'p_std': 44, 'p_atr': 17, 'p_adx': 27, 'rsi_period': 11, 'ema1': 20, 'ema2': 37, 'slip_atr_k': 0.002471031071939446, 'slip_spread_k': 0.046443818602944484, 'spread_hl_frac': 0.021352735404180975, 'bb_std_mult': 1.6636064131927397, 'rsi_os': 47, 'rsi_ob': 83, 'vol_spike': 0.07529308675162569, 'adx_thresh': 27.36887426133965, 'atr_min_pct': 0.027216147452810167, 'atr_max_pct': 0.09658899955538472, 'tp_mult': 1.882421563998411, 'tsl_mult': 0.211644929795813, 'strategy': 'mean_reversion', 'time_stop': 18, 'use_sma': True, 'use_atr': False, 'use_adx': True, 'use_ema': True, 'use_spike': True, 'rsi_required': True, 'edge_k': 0.9292558916591389, 'edge_cap': 0.2715787024401136, 'bull_strategy': 'breakout', 'bull_bb_std_mult': 1.7554823585137296, 'bull_rsi_os': 35, 'bull_rsi_ob': 58, 'bull_adx_thresh': 29.00175925405489, 'bull_atr_min_pct': 0.02196960035353247, 'bull_atr_max_pct': 0.08722718297095489, 'bull_tp_mult': 2.8693214917738286, 'bull_tsl_mult': 0.42862140257508496, 'bull_time_stop': 167, 'bull_use_sma': True, 'bull_use_ema': True, 'bull_use_atr': True, 'bull_use_adx': True, 'bull_use_spike': False, 'bull_rsi_required': True, 'bear_strategy': 'breakout', 'bear_bb_std_mult': 0.8025546949706714, 'bear_rsi_os': 55, 'bear_rsi_ob': 90, 'bear_adx_thresh': 11.044828985647092, 'bear_atr_min_pct': 0.0016139109675124153, 'bear_atr_max_pct': 0.014657541137312213, 'bear_tp_mult': 2.148097341359403, 'bear_tsl_mult': 0.07912410848418465, 'bear_time_stop': 57, 'bear_use_sma': True, 'bear_use_ema': True, 'bear_use_atr': True, 'bear_use_adx': False, 'bear_use_spike': True, 'bear_rsi_required': True, 'sideways_strategy': 'breakout', 'sideways_bb_std_mult': 1.5807143496605118, 'sideways_rsi_os': 50, 'sideways_rsi_ob': 66, 'sideways_adx_thresh': 7.023796613345425, 'sideways_atr_min_pct': 0.0017736475957506447, 'sideways_atr_max_pct': 0.07483809379411545, 'sideways_tp_mult': 2.058972578311202, 'sideways_tsl_mult': 0.34930614526328174, 'sideways_time_stop': 149, 'sideways_use_sma': True, 'sideways_use_ema': False, 'sideways_use_atr': False, 'sideways_use_adx': True, 'sideways_use_spike': False, 'sideways_rsi_required': True}.
