[I 2025-09-01 14:31:26,289] Trial 594 finished with values: [-1000000000.0, 1000000000.0] and parameters: {'p_sma': 36, 'p_std': 47, 'p_atr': 19, 'p_adx': 18, 'rsi_period': 67, 'ema1': 20, 'ema2': 17, 'slip_atr_k': 0.011041076687505277, 'slip_spread_k': 0.09939852278078656, 'spread_hl_frac': 0.024814714992583867, 'bb_std_mult': 1.962683992525964, 'rsi_os': 31, 'rsi_ob': 71, 'vol_spike': 0.2395246736090622, 'adx_thresh': 8.55701303801876, 'atr_min_pct': 0.027505047163002887, 'atr_max_pct': 0.06335992861414513, 'tp_mult': 2.6297369975240263, 'tsl_mult': 0.7090386321045042, 'strategy': 'mean_reversion', 'time_stop': 243, 'use_sma': True, 'use_atr': False, 'use_adx': True, 'use_ema': True, 'use_spike': True, 'rsi_required': False, 'edge_k': 1.1242943916250325, 'edge_cap': 0.9683941599569577, 'bull_strategy': 'breakout', 'bull_bb_std_mult': 3.108800857701924, 'bull_rsi_os': 32, 'bull_rsi_ob': 67, 'bull_adx_thresh': 31.904561307653147, 'bull_atr_min_pct': 0.027577169042673468, 'bull_atr_max_pct': 0.09571711585981602, 'bull_tp_mult': 2.7248563707880598, 'bull_tsl_mult': 0.23254991911297324, 'bull_time_stop': 91, 'bull_use_sma': True, 'bull_use_ema': True, 'bull_use_atr': False, 'bull_use_adx': True, 'bull_use_spike': True, 'bull_rsi_required': True, 'bear_strategy': 'breakout', 'bear_bb_std_mult': 1.065279700719279, 'bear_rsi_os': 32, 'bear_rsi_ob': 90, 'bear_adx_thresh': 30.377788792346337, 'bear_atr_min_pct': 0.0032330286887610913, 'bear_atr_max_pct': 0.036488746968831705, 'bear_tp_mult': 2.197443756078367, 'bear_tsl_mult': 0.9970358043247927, 'bear_time_stop': 87, 'bear_use_sma': True, 'bear_use_ema': True, 'bear_use_atr': True, 'bear_use_adx': True, 'bear_use_spike': False, 'bear_rsi_required': True, 'sideways_strategy': 'breakout', 'sideways_bb_std_mult': 1.7017180905232439, 'sideways_rsi_os': 32, 'sideways_rsi_ob': 69, 'sideways_adx_thresh': 7.354009195384838, 'sideways_atr_min_pct': 0.01880342881636991, 'sideways_atr_max_pct': 0.13232799978095816, 'sideways_tp_mult': 1.1592003309181529, 'sideways_tsl_mult': 0.21059522470518552, 'sideways_time_stop': 200, 'sideways_use_sma': True, 'sideways_use_ema': False, 'sideways_use_atr': True, 'sideways_use_adx': False, 'sideways_use_spike': True, 'sideways_rsi_required': True}.
[I 2025-09-01 14:31:26,643] Trial 595 finished with values: [-1000000000.0, 1000000000.0] and parameters: {'p_sma': 36, 'p_std': 55, 'p_atr': 19, 'p_adx': 11, 'rsi_period': 67, 'ema1': 20, 'ema2': 12, 'slip_atr_k': 0.1705735404279824, 'slip_spread_k': 0.761480938516349, 'spread_hl_frac': 0.024786410319179237, 'bb_std_mult': 1.7320008411936163, 'rsi_os': 39, 'rsi_ob': 71, 'vol_spike': 0.2405864125701424, 'adx_thresh': 17.64167889841008, 'atr_min_pct': 0.02758351006166556, 'atr_max_pct': 0.10791436623235602, 'tp_mult': 2.6417517435093396, 'tsl_mult': 0.7103926256231621, 'strategy': 'mean_reversion', 'time_stop': 246, 'use_sma': True, 'use_atr': False, 'use_adx': True, 'use_ema': True, 'use_spike': True, 'rsi_required': False, 'edge_k': 0.906309480797353, 'edge_cap': 0.8976973465878906, 'bull_strategy': 'breakout', 'bull_bb_std_mult': 0.5877225465778055, 'bull_rsi_os': 28, 'bull_rsi_ob': 91, 'bull_adx_thresh': 31.843024184529845, 'bull_atr_min_pct': 0.0033377705332258067, 'bull_atr_max_pct': 0.043992398822124475, 'bull_tp_mult': 1.3527809748222175, 'bull_tsl_mult': 0.9991664232443107, 'bull_time_stop': 256, 'bull_use_sma': False, 'bull_use_ema': True, 'bull_use_atr': False, 'bull_use_adx': True, 'bull_use_spike': True, 'bull_rsi_required': True, 'bear_strategy': 'breakout', 'bear_bb_std_mult': 3.5994719075554116, 'bear_rsi_os': 32, 'bear_rsi_ob': 86, 'bear_adx_thresh': 17.1489796797999, 'bear_atr_min_pct': 0.0032222635428812915, 'bear_atr_max_pct': 0.0363958890416775, 'bear_tp_mult': 2.1564142207368016, 'bear_tsl_mult': 0.10284975062721233, 'bear_time_stop': 217, 'bear_use_sma': False, 'bear_use_ema': True, 'bear_use_atr': True, 'bear_use_adx': True, 'bear_use_spike': False, 'bear_rsi_required': True, 'sideways_strategy': 'breakout', 'sideways_bb_std_mult': 1.8664735301907678, 'sideways_rsi_os': 32, 'sideways_rsi_ob': 67, 'sideways_adx_thresh': 5.451531786558018, 'sideways_atr_min_pct': 0.013283546112841282, 'sideways_atr_max_pct': 0.06843524142918313, 'sideways_tp_mult': 1.3247979586704575, 'sideways_tsl_mult': 0.29945243944430255, 'sideways_time_stop': 200, 'sideways_use_sma': True, 'sideways_use_ema': False, 'sideways_use_atr': True, 'sideways_use_adx': False, 'sideways_use_spike': True, 'sideways_rsi_required': False}.
[I 2025-09-01 14:31:27,794] Trial 599 finished with values: [-1000000000.0, 1000000000.0] and parameters: {'p_sma': 57, 'p_std': 15, 'p_atr': 10, 'p_adx': 12, 'rsi_period': 48, 'ema1': 13, 'ema2': 26, 'slip_atr_k': 0.013838782900278053, 'slip_spread_k': 0.08106542303061928, 'spread_hl_frac': 0.003049225893883168, 'bb_std_mult': 3.293497372467268, 'rsi_os': 19, 'rsi_ob': 48, 'vol_spike': 0.2333776798267241, 'adx_thresh': 24.803802433467364, 'atr_min_pct': 0.026787674872536655, 'atr_max_pct': 0.0939252409499048, 'tp_mult': 1.0689910569109573, 'tsl_mult': 0.7377802682977703, 'strategy': 'mean_reversion', 'time_stop': 239, 'use_sma': True, 'use_atr': False, 'use_adx': False, 'use_ema': True, 'use_spike': False, 'rsi_required': False, 'edge_k': 0.9245431864382697, 'edge_cap': 0.9423167401116384, 'bull_strategy': 'mean_reversion', 'bull_bb_std_mult': 1.9922795062082823, 'bull_rsi_os': 34, 'bull_rsi_ob': 55, 'bull_adx_thresh': 27.752746889861243, 'bull_atr_min_pct': 0.0041620897133079135, 'bull_atr_max_pct': 0.14360683730493257, 'bull_tp_mult': 2.6708838745826418, 'bull_tsl_mult': 0.40331850902136007, 'bull_time_stop': 97, 'bull_use_sma': False, 'bull_use_ema': True, 'bull_use_atr': True, 'bull_use_adx': True, 'bull_use_spike': False, 'bull_rsi_required': True, 'bear_strategy': 'mean_reversion', 'bear_bb_std_mult': 3.366650448344423, 'bear_rsi_os': 48, 'bear_rsi_ob': 85, 'bear_adx_thresh': 31.67414587581902, 'bear_atr_min_pct': 0.0021282584903043076, 'bear_atr_max_pct': 0.04806968637354388, 'bear_tp_mult': 2.0822681639003098, 'bear_tsl_mult': 0.1165534570473421, 'bear_time_stop': 49, 'bear_use_sma': False, 'bear_use_ema': False, 'bear_use_atr': False, 'bear_use_adx': True, 'bear_use_spike': False, 'bear_rsi_required': False, 'sideways_strategy': 'breakout', 'sideways_bb_std_mult': 1.559115640517061, 'sideways_rsi_os': 52, 'sideways_rsi_ob': 53, 'sideways_adx_thresh': 27.33517176963633, 'sideways_atr_min_pct': 0.02110010836594848, 'sideways_atr_max_pct': 0.06691234213812888, 'sideways_tp_mult': 1.896272024306994, 'sideways_tsl_mult': 0.38487646544155146, 'sideways_time_stop': 166, 'sideways_use_sma': False, 'sideways_use_ema': False, 'sideways_use_atr': True, 'sideways_use_adx': True, 'sideways_use_spike': False, 'sideways_rsi_required': False}.
[I 2025-09-01 14:32:04,771] Trial 597 finished with values: [-1000000000.0, 1000000000.0] and parameters: {'p_sma': 36, 'p_std': 32, 'p_atr': 24, 'p_adx': 28, 'rsi_period': 46, 'ema1': 21, 'ema2': 31, 'slip_atr_k': 0.1701583241168207, 'slip_spread_k': 0.09321592159522452, 'spread_hl_frac': 0.016877764193186276, 'bb_std_mult': 1.7310801199390888, 'rsi_os': 26, 'rsi_ob': 82, 'vol_spike': 0.24369563734187685, 'adx_thresh': 17.24000396484442, 'atr_min_pct': 0.02736282938310606, 'atr_max_pct': 0.09452461589240788, 'tp_mult': 1.9722808059191403, 'tsl_mult': 0.35935082038709687, 'strategy': 'mean_reversion', 'time_stop': 246, 'use_sma': True, 'use_atr': False, 'use_adx': True, 'use_ema': True, 'use_spike': True, 'rsi_required': False, 'edge_k': 0.9115364110035752, 'edge_cap': 0.3829122358719781, 'bull_strategy': 'breakout', 'bull_bb_std_mult': 3.1244020281705565, 'bull_rsi_os': 34, 'bull_rsi_ob': 55, 'bull_adx_thresh': 29.044358367893818, 'bull_atr_min_pct': 0.008828800161663106, 'bull_atr_max_pct': 0.09996687826158213, 'bull_tp_mult': 2.7895613522642666, 'bull_tsl_mult': 0.4862719584778795, 'bull_time_stop': 37, 'bull_use_sma': False, 'bull_use_ema': True, 'bull_use_atr': False, 'bull_use_adx': True, 'bull_use_spike': True, 'bull_rsi_required': True, 'bear_strategy': 'breakout', 'bear_bb_std_mult': 1.3994802304455702, 'bear_rsi_os': 32, 'bear_rsi_ob': 89, 'bear_adx_thresh': 23.96122289599592, 'bear_atr_min_pct': 0.0028305047680471256, 'bear_atr_max_pct': 0.04769180087720986, 'bear_tp_mult': 2.3044278666649967, 'bear_tsl_mult': 0.11759258674322866, 'bear_time_stop': 209, 'bear_use_sma': False, 'bear_use_ema': True, 'bear_use_atr': True, 'bear_use_adx': True, 'bear_use_spike': False, 'bear_rsi_required': True, 'sideways_strategy': 'breakout', 'sideways_bb_std_mult': 1.5935130016957804, 'sideways_rsi_os': 53, 'sideways_rsi_ob': 82, 'sideways_adx_thresh': 7.348079223035407, 'sideways_atr_min_pct': 0.013563230325216714, 'sideways_atr_max_pct': 0.06705638509544909, 'sideways_tp_mult': 2.667999784357942, 'sideways_tsl_mult': 0.38310597295242554, 'sideways_time_stop': 200, 'sideways_use_sma': True, 'sideways_use_ema': False, 'sideways_use_atr': True, 'sideways_use_adx': False, 'sideways_use_spike': True, 'sideways_rsi_required': False}.
[I 2025-09-01 14:32:06,005] Trial 598 finished with values: [-1000000000.0, 1000000000.0] and parameters: {'p_sma': 7, 'p_std': 30, 'p_atr': 24, 'p_adx': 13, 'rsi_period': 46, 'ema1': 21, 'ema2': 13, 'slip_atr_k': 0.06301446255561098, 'slip_spread_k': 0.07086451021004589, 'spread_hl_frac': 0.017112304052342757, 'bb_std_mult': 0.5032688717187543, 'rsi_os': 39, 'rsi_ob': 83, 'vol_spike': 0.2339216199686925, 'adx_thresh': 17.63616633778298, 'atr_min_pct': 0.001539892498194766, 'atr_max_pct': 0.1391610225350534, 'tp_mult': 2.275857147379828, 'tsl_mult': 0.7412659755930203, 'strategy': 'mean_reversion', 'time_stop': 249, 'use_sma': True, 'use_atr': False, 'use_adx': True, 'use_ema': True, 'use_spike': True, 'rsi_required': False, 'edge_k': 0.8977270795873667, 'edge_cap': 0.947585265059492, 'bull_strategy': 'breakout', 'bull_bb_std_mult': 3.2126481090865227, 'bull_rsi_os': 34, 'bull_rsi_ob': 55, 'bull_adx_thresh': 14.624929157061889, 'bull_atr_min_pct': 0.0029497284215485014, 'bull_atr_max_pct': 0.14395060812505456, 'bull_tp_mult': 2.061421653084655, 'bull_tsl_mult': 0.3825517246870068, 'bull_time_stop': 98, 'bull_use_sma': False, 'bull_use_ema': True, 'bull_use_atr': False, 'bull_use_adx': True, 'bull_use_spike': False, 'bull_rsi_required': True, 'bear_strategy': 'mean_reversion', 'bear_bb_std_mult': 2.7302772390607726, 'bear_rsi_os': 39, 'bear_rsi_ob': 86, 'bear_adx_thresh': 31.85277101485494, 'bear_atr_min_pct': 0.02122454910691767, 'bear_atr_max_pct': 0.04668493120559656, 'bear_tp_mult': 2.0807825612217035, 'bear_tsl_mult': 0.10800763970887445, 'bear_time_stop': 48, 'bear_use_sma': False, 'bear_use_ema': True, 'bear_use_atr': True, 'bear_use_adx': True, 'bear_use_spike': False, 'bear_rsi_required': True, 'sideways_strategy': 'breakout', 'sideways_bb_std_mult': 1.5570968869457746, 'sideways_rsi_os': 53, 'sideways_rsi_ob': 82, 'sideways_adx_thresh': 5.488627251125975, 'sideways_atr_min_pct': 0.02154708922039286, 'sideways_atr_max_pct': 0.0661670171760355, 'sideways_tp_mult': 2.670747537735526, 'sideways_tsl_mult': 0.7487887264201676, 'sideways_time_stop': 299, 'sideways_use_sma': True, 'sideways_use_ema': False, 'sideways_use_atr': True, 'sideways_use_adx': False, 'sideways_use_spike': True, 'sideways_rsi_required': False}.
[I 2025-09-01 14:32:06,707] Trial 596 finished with values: [-0.048465082880090216, 0.0482883857089579] and parameters: {'p_sma': 21, 'p_std': 44, 'p_atr': 24, 'p_adx': 13, 'rsi_period': 34, 'ema1': 13, 'ema2': 52, 'slip_atr_k': 0.1744015795778728, 'slip_spread_k': 0.0968707416120002, 'spread_hl_frac': 0.00520827744460226, 'bb_std_mult': 1.7239988471183252, 'rsi_os': 46, 'rsi_ob': 83, 'vol_spike': 0.24188070451464638, 'adx_thresh': 25.125135407329886, 'atr_min_pct': 0.026947140513828564, 'atr_max_pct': 0.14133855106680387, 'tp_mult': 1.0590538510750958, 'tsl_mult': 0.7104013277369671, 'strategy': 'mean_reversion', 'time_stop': 241, 'use_sma': True, 'use_atr': False, 'use_adx': True, 'use_ema': True, 'use_spike': True, 'rsi_required': False, 'edge_k': 0.9053263900677133, 'edge_cap': 0.9522524568825913, 'bull_strategy': 'breakout', 'bull_bb_std_mult': 2.9152550545443576, 'bull_rsi_os': 37, 'bull_rsi_ob': 68, 'bull_adx_thresh': 28.104547875272495, 'bull_atr_min_pct': 0.002969531621249103, 'bull_atr_max_pct': 0.024765449052724372, 'bull_tp_mult': 2.795945948571624, 'bull_tsl_mult': 0.9968938461413901, 'bull_time_stop': 241, 'bull_use_sma': False, 'bull_use_ema': True, 'bull_use_atr': False, 'bull_use_adx': True, 'bull_use_spike': True, 'bull_rsi_required': True, 'bear_strategy': 'breakout', 'bear_bb_std_mult': 1.0547982557031133, 'bear_rsi_os': 34, 'bear_rsi_ob': 89, 'bear_adx_thresh': 12.64564809467733, 'bear_atr_min_pct': 0.002232808702315603, 'bear_atr_max_pct': 0.04837244786780429, 'bear_tp_mult': 2.201316460712266, 'bear_tsl_mult': 0.6806649877760462, 'bear_time_stop': 216, 'bear_use_sma': False, 'bear_use_ema': True, 'bear_use_atr': True, 'bear_use_adx': True, 'bear_use_spike': False, 'bear_rsi_required': True, 'sideways_strategy': 'breakout', 'sideways_bb_std_mult': 1.9072298998773685, 'sideways_rsi_os': 46, 'sideways_rsi_ob': 53, 'sideways_adx_thresh': 7.4021483753939, 'sideways_atr_min_pct': 0.016308101423497742, 'sideways_atr_max_pct': 0.13301846406826429, 'sideways_tp_mult': 2.9908623138304975, 'sideways_tsl_mult': 0.290688999901083, 'sideways_time_stop': 274, 'sideways_use_sma': True, 'sideways_use_ema': False, 'sideways_use_atr': True, 'sideways_use_adx': False, 'sideways_use_spike': True, 'sideways_rsi_required': False}.
[I 2025-09-01 14:32:07,143] Trial 600 finished with values: [-0.020431454493795687, 0.02069849124910209] and parameters: {'p_sma': 34, 'p_std': 18, 'p_atr': 18, 'p_adx': 13, 'rsi_period': 71, 'ema1': 21, 'ema2': 52, 'slip_atr_k': 0.06145986038175755, 'slip_spread_k': 0.05578287208523742, 'spread_hl_frac': 0.04902553444270674, 'bb_std_mult': 1.802375269877504, 'rsi_os': 41, 'rsi_ob': 59, 'vol_spike': 0.24331368461668304, 'adx_thresh': 25.31307875971804, 'atr_min_pct': 0.001471924945236609, 'atr_max_pct': 0.020764066756627564, 'tp_mult': 1.717230436575328, 'tsl_mult': 0.7468641484037203, 'strategy': 'mean_reversion', 'time_stop': 196, 'use_sma': True, 'use_atr': False, 'use_adx': False, 'use_ema': True, 'use_spike': True, 'rsi_required': False, 'edge_k': 0.6750934807218907, 'edge_cap': 0.1378180391487871, 'bull_strategy': 'breakout', 'bull_bb_std_mult': 3.2260274175314896, 'bull_rsi_os': 35, 'bull_rsi_ob': 53, 'bull_adx_thresh': 30.165919853366496, 'bull_atr_min_pct': 0.002716036222632574, 'bull_atr_max_pct': 0.025690247989200176, 'bull_tp_mult': 2.799871000323911, 'bull_tsl_mult': 0.3769834929056052, 'bull_time_stop': 38, 'bull_use_sma': True, 'bull_use_ema': True, 'bull_use_atr': True, 'bull_use_adx': True, 'bull_use_spike': False, 'bull_rsi_required': True, 'bear_strategy': 'breakout', 'bear_bb_std_mult': 2.695472625470419, 'bear_rsi_os': 34, 'bear_rsi_ob': 89, 'bear_adx_thresh': 12.369664033230173, 'bear_atr_min_pct': 0.004927718356288061, 'bear_atr_max_pct': 0.06415122121130912, 'bear_tp_mult': 2.6536893856761723, 'bear_tsl_mult': 0.12757732138431024, 'bear_time_stop': 294, 'bear_use_sma': True, 'bear_use_ema': True, 'bear_use_atr': True, 'bear_use_adx': True, 'bear_use_spike': False, 'bear_rsi_required': True, 'sideways_strategy': 'breakout', 'sideways_bb_std_mult': 1.5447933941861791, 'sideways_rsi_os': 54, 'sideways_rsi_ob': 87, 'sideways_adx_thresh': 8.555653348362343, 'sideways_atr_min_pct': 0.01816695946618642, 'sideways_atr_max_pct': 0.01368892620460746, 'sideways_tp_mult': 2.662141743505639, 'sideways_tsl_mult': 0.23601427079258758, 'sideways_time_stop': 158, 'sideways_use_sma': True, 'sideways_use_ema': False, 'sideways_use_atr': True, 'sideways_use_adx': False, 'sideways_use_spike': False, 'sideways_rsi_required': True}.
[I 2025-09-01 14:32:08,644] Trial 603 finished with values: [-1000000000.0, 1000000000.0] and parameters: {'p_sma': 10, 'p_std': 48, 'p_atr': 18, 'p_adx': 12, 'rsi_period': 58, 'ema1': 14, 'ema2': 18, 'slip_atr_k': 0.2350217962137904, 'slip_spread_k': 0.9359249008052242, 'spread_hl_frac': 0.0066851758932076205, 'bb_std_mult': 1.7943396852919344, 'rsi_os': 41, 'rsi_ob': 68, 'vol_spike': 0.21226602095187685, 'adx_thresh': 23.128772289963738, 'atr_min_pct': 0.02582406854147187, 'atr_max_pct': 0.020046249966491382, 'tp_mult': 1.1307418273323142, 'tsl_mult': 0.7696285345022977, 'strategy': 'mean_reversion', 'time_stop': 198, 'use_sma': False, 'use_atr': False, 'use_adx': False, 'use_ema': False, 'use_spike': False, 'rsi_required': True, 'edge_k': 1.0307765455947462, 'edge_cap': 0.31659717895329703, 'bull_strategy': 'mean_reversion', 'bull_bb_std_mult': 2.584517754332856, 'bull_rsi_os': 5, 'bull_rsi_ob': 64, 'bull_adx_thresh': 26.028218905691837, 'bull_atr_min_pct': 0.004383846451889254, 'bull_atr_max_pct': 0.07556407709689845, 'bull_tp_mult': 2.919537172368774, 'bull_tsl_mult': 0.6996041539805906, 'bull_time_stop': 116, 'bull_use_sma': True, 'bull_use_ema': False, 'bull_use_atr': True, 'bull_use_adx': True, 'bull_use_spike': False, 'bull_rsi_required': True, 'bear_strategy': 'breakout', 'bear_bb_std_mult': 1.137575774357379, 'bear_rsi_os': 35, 'bear_rsi_ob': 72, 'bear_adx_thresh': 11.454353521834701, 'bear_atr_min_pct': 0.019805326900571196, 'bear_atr_max_pct': 0.014374712873608364, 'bear_tp_mult': 2.4337083179473784, 'bear_tsl_mult': 0.9104320089853404, 'bear_time_stop': 238, 'bear_use_sma': True, 'bear_use_ema': False, 'bear_use_atr': False, 'bear_use_adx': True, 'bear_use_spike': False, 'bear_rsi_required': False, 'sideways_strategy': 'breakout', 'sideways_bb_std_mult': 2.9847187912704065, 'sideways_rsi_os': 51, 'sideways_rsi_ob': 70, 'sideways_adx_thresh': 8.682411446218582, 'sideways_atr_min_pct': 0.020766441908629446, 'sideways_atr_max_pct': 0.05355058645441668, 'sideways_tp_mult': 1.7782764064661785, 'sideways_tsl_mult': 0.23989185473758898, 'sideways_time_stop': 174, 'sideways_use_sma': False, 'sideways_use_ema': False, 'sideways_use_atr': True, 'sideways_use_adx': True, 'sideways_use_spike': False, 'sideways_rsi_required': True}.
[I 2025-09-01 14:32:08,878] Trial 605 finished with values: [-1000000000.0, 1000000000.0] and parameters: {'p_sma': 39, 'p_std': 26, 'p_atr': 26, 'p_adx': 12, 'rsi_period': 25, 'ema1': 22, 'ema2': 19, 'slip_atr_k': 0.02043476837652959, 'slip_spread_k': 0.6836843354392056, 'spread_hl_frac': 0.04042444293174232, 'bb_std_mult': 1.0436853638033443, 'rsi_os': 38, 'rsi_ob': 89, 'vol_spike': 0.2716190866489454, 'adx_thresh': 14.10703123272446, 'atr_min_pct': 0.026244702123314586, 'atr_max_pct': 0.01007977144309627, 'tp_mult': 1.0361085288235172, 'tsl_mult': 0.2504416458305639, 'strategy': 'mean_reversion', 'time_stop': 5, 'use_sma': False, 'use_atr': False, 'use_adx': False, 'use_ema': True, 'use_spike': True, 'rsi_required': False, 'edge_k': 1.2143000117344642, 'edge_cap': 0.2795274370078557, 'bull_strategy': 'breakout', 'bull_bb_std_mult': 2.6785017151071804, 'bull_rsi_os': 20, 'bull_rsi_ob': 56, 'bull_adx_thresh': 9.87182073260413, 'bull_atr_min_pct': 0.001979028655813274, 'bull_atr_max_pct': 0.07990623048305627, 'bull_tp_mult': 2.8597195903726678, 'bull_tsl_mult': 0.4613700423620054, 'bull_time_stop': 87, 'bull_use_sma': True, 'bull_use_ema': True, 'bull_use_atr': True, 'bull_use_adx': False, 'bull_use_spike': False, 'bull_rsi_required': True, 'bear_strategy': 'mean_reversion', 'bear_bb_std_mult': 3.518647049160429, 'bear_rsi_os': 31, 'bear_rsi_ob': 87, 'bear_adx_thresh': 11.35955933545984, 'bear_atr_min_pct': 0.0014104833614997055, 'bear_atr_max_pct': 0.07057164946069042, 'bear_tp_mult': 2.2378755276516307, 'bear_tsl_mult': 0.7150678180758157, 'bear_time_stop': 276, 'bear_use_sma': True, 'bear_use_ema': True, 'bear_use_atr': True, 'bear_use_adx': False, 'bear_use_spike': True, 'bear_rsi_required': True, 'sideways_strategy': 'breakout', 'sideways_bb_std_mult': 1.6656037666153471, 'sideways_rsi_os': 49, 'sideways_rsi_ob': 68, 'sideways_adx_thresh': 21.15167545790383, 'sideways_atr_min_pct': 0.0008034041176938466, 'sideways_atr_max_pct': 0.07273076839533665, 'sideways_tp_mult': 2.730223220044769, 'sideways_tsl_mult': 0.2679569234821162, 'sideways_time_stop': 261, 'sideways_use_sma': True, 'sideways_use_ema': True, 'sideways_use_atr': False, 'sideways_use_adx': True, 'sideways_use_spike': False, 'sideways_rsi_required': True}.
