[I 2025-09-01 13:28:03,237] Trial 171 finished with values: [-0.045958591942688476, 0.04620911448488647] and parameters: {'p_sma': 34, 'p_std': 57, 'p_atr': 11, 'p_adx': 24, 'rsi_period': 71, 'ema1': 17, 'ema2': 32, 'slip_atr_k': 0.19907495907123068, 'slip_spread_k': 0.8866346911489613, 'spread_hl_frac': 0.0013581311579485694, 'bb_std_mult': 3.0977441378198485, 'rsi_os': 37, 'rsi_ob': 45, 'vol_spike': 0.2450516265858049, 'adx_thresh': 11.206910186899487, 'atr_min_pct': 0.026165971098152854, 'atr_max_pct': 0.1198262068920376, 'tp_mult': 1.4521684697707757, 'tsl_mult': 0.11914841675156307, 'strategy': 'breakout', 'time_stop': 153, 'use_sma': True, 'use_atr': True, 'use_adx': False, 'use_ema': True, 'use_spike': False, 'rsi_required': False, 'edge_k': 1.0624596159690334, 'edge_cap': 0.05028256261588726, 'bull_strategy': 'breakout', 'bull_bb_std_mult': 2.9869268842573864, 'bull_rsi_os': 46, 'bull_rsi_ob': 55, 'bull_adx_thresh': 6.640371081280868, 'bull_atr_min_pct': 0.0006305558320901417, 'bull_atr_max_pct': 0.017158686665668475, 'bull_tp_mult': 1.1830553060016955, 'bull_tsl_mult': 0.9397184616529852, 'bull_time_stop': 299, 'bull_use_sma': True, 'bull_use_ema': True, 'bull_use_atr': True, 'bull_use_adx': True, 'bull_use_spike': False, 'bull_rsi_required': False, 'bear_strategy': 'mean_reversion', 'bear_bb_std_mult': 1.1272905577903716, 'bear_rsi_os': 14, 'bear_rsi_ob': 69, 'bear_adx_thresh': 12.040536959059994, 'bear_atr_min_pct': 0.021359361099301023, 'bear_atr_max_pct': 0.02914242121753382, 'bear_tp_mult': 1.1982957032562425, 'bear_tsl_mult': 0.4533944624812771, 'bear_time_stop': 71, 'bear_use_sma': True, 'bear_use_ema': False, 'bear_use_atr': True, 'bear_use_adx': True, 'bear_use_spike': False, 'bear_rsi_required': False, 'sideways_strategy': 'mean_reversion', 'sideways_bb_std_mult': 0.8392823493910684, 'sideways_rsi_os': 27, 'sideways_rsi_ob': 60, 'sideways_adx_thresh': 14.381521888569072, 'sideways_atr_min_pct': 0.003343934424391506, 'sideways_atr_max_pct': 0.01062346585057948, 'sideways_tp_mult': 2.998881327948861, 'sideways_tsl_mult': 0.5818675005847244, 'sideways_time_stop': 17, 'sideways_use_sma': False, 'sideways_use_ema': False, 'sideways_use_atr': True, 'sideways_use_adx': False, 'sideways_use_spike': False, 'sideways_rsi_required': True}.
[I 2025-09-01 13:28:42,452] Trial 175 finished with values: [-1000000000.0, 1000000000.0] and parameters: {'p_sma': 52, 'p_std': 48, 'p_atr': 17, 'p_adx': 19, 'rsi_period': 79, 'ema1': 19, 'ema2': 59, 'slip_atr_k': 0.22382450675840707, 'slip_spread_k': 0.4939299300016242, 'spread_hl_frac': 0.0067420464635870436, 'bb_std_mult': 1.6362363011201975, 'rsi_os': 40, 'rsi_ob': 90, 'vol_spike': 0.24240766317106058, 'adx_thresh': 27.064705861216822, 'atr_min_pct': 0.0012925900761756863, 'atr_max_pct': 0.03746063522489561, 'tp_mult': 1.5597882450957934, 'tsl_mult': 0.06121043732531657, 'strategy': 'breakout', 'time_stop': 96, 'use_sma': True, 'use_atr': True, 'use_adx': False, 'use_ema': True, 'use_spike': False, 'rsi_required': True, 'edge_k': 0.40435544190386685, 'edge_cap': 0.8386456354579416, 'bull_strategy': 'breakout', 'bull_bb_std_mult': 3.225294403478602, 'bull_rsi_os': 51, 'bull_rsi_ob': 66, 'bull_adx_thresh': 23.187843597840764, 'bull_atr_min_pct': 0.001704479115581123, 'bull_atr_max_pct': 0.028783121823391475, 'bull_tp_mult': 1.8928101903352936, 'bull_tsl_mult': 0.4358090377269729, 'bull_time_stop': 23, 'bull_use_sma': False, 'bull_use_ema': True, 'bull_use_atr': True, 'bull_use_adx': True, 'bull_use_spike': True, 'bull_rsi_required': True, 'bear_strategy': 'breakout', 'bear_bb_std_mult': 2.754662699290329, 'bear_rsi_os': 13, 'bear_rsi_ob': 71, 'bear_adx_thresh': 31.03994289852201, 'bear_atr_min_pct': 0.004447696424887387, 'bear_atr_max_pct': 0.0844133016804286, 'bear_tp_mult': 2.603501709762176, 'bear_tsl_mult': 0.9566548755688037, 'bear_time_stop': 93, 'bear_use_sma': True, 'bear_use_ema': False, 'bear_use_atr': True, 'bear_use_adx': True, 'bear_use_spike': True, 'bear_rsi_required': False, 'sideways_strategy': 'mean_reversion', 'sideways_bb_std_mult': 1.8397618489938365, 'sideways_rsi_os': 25, 'sideways_rsi_ob': 81, 'sideways_adx_thresh': 15.573577672593338, 'sideways_atr_min_pct': 0.016541375166092286, 'sideways_atr_max_pct': 0.10769681926027225, 'sideways_tp_mult': 2.373126253932902, 'sideways_tsl_mult': 0.5245842505409735, 'sideways_time_stop': 226, 'sideways_use_sma': False, 'sideways_use_ema': False, 'sideways_use_atr': False, 'sideways_use_adx': False, 'sideways_use_spike': False, 'sideways_rsi_required': True}.
[I 2025-09-01 13:28:42,478] Trial 172 finished with values: [-1000000000.0, 1000000000.0] and parameters: {'p_sma': 34, 'p_std': 56, 'p_atr': 14, 'p_adx': 22, 'rsi_period': 47, 'ema1': 30, 'ema2': 57, 'slip_atr_k': 0.22564539277567158, 'slip_spread_k': 0.2559008490669649, 'spread_hl_frac': 0.0012809601844145056, 'bb_std_mult': 3.038240646463584, 'rsi_os': 42, 'rsi_ob': 91, 'vol_spike': 0.24359543665538028, 'adx_thresh': 11.574508676528804, 'atr_min_pct': 0.0009052058666348811, 'atr_max_pct': 0.036376309489940764, 'tp_mult': 1.5583709814708613, 'tsl_mult': 0.6682476345923462, 'strategy': 'breakout', 'time_stop': 182, 'use_sma': True, 'use_atr': True, 'use_adx': False, 'use_ema': True, 'use_spike': False, 'rsi_required': True, 'edge_k': 1.0664976053461197, 'edge_cap': 0.17687371421050185, 'bull_strategy': 'breakout', 'bull_bb_std_mult': 3.329541164542881, 'bull_rsi_os': 51, 'bull_rsi_ob': 66, 'bull_adx_thresh': 6.919107327030853, 'bull_atr_min_pct': 0.011617772986294824, 'bull_atr_max_pct': 0.1135270454587327, 'bull_tp_mult': 1.9468394386247552, 'bull_tsl_mult': 0.1856195014982076, 'bull_time_stop': 215, 'bull_use_sma': True, 'bull_use_ema': True, 'bull_use_atr': True, 'bull_use_adx': True, 'bull_use_spike': True, 'bull_rsi_required': True, 'bear_strategy': 'mean_reversion', 'bear_bb_std_mult': 2.5835058894450453, 'bear_rsi_os': 11, 'bear_rsi_ob': 69, 'bear_adx_thresh': 23.226555450923364, 'bear_atr_min_pct': 0.021309139347422075, 'bear_atr_max_pct': 0.030802861027525025, 'bear_tp_mult': 1.588775953361045, 'bear_tsl_mult': 0.45250995717685094, 'bear_time_stop': 67, 'bear_use_sma': True, 'bear_use_ema': False, 'bear_use_atr': True, 'bear_use_adx': True, 'bear_use_spike': True, 'bear_rsi_required': False, 'sideways_strategy': 'mean_reversion', 'sideways_bb_std_mult': 1.7123773945366125, 'sideways_rsi_os': 24, 'sideways_rsi_ob': 91, 'sideways_adx_thresh': 16.535993802145548, 'sideways_atr_min_pct': 0.010369265009582554, 'sideways_atr_max_pct': 0.01665853864424406, 'sideways_tp_mult': 2.4036484266286675, 'sideways_tsl_mult': 0.5903275961670863, 'sideways_time_stop': 19, 'sideways_use_sma': False, 'sideways_use_ema': False, 'sideways_use_atr': False, 'sideways_use_adx': False, 'sideways_use_spike': False, 'sideways_rsi_required': True}.
[I 2025-09-01 13:28:43,084] Trial 173 finished with values: [-0.020762731928736677, 0.020532587153645185] and parameters: {'p_sma': 52, 'p_std': 48, 'p_atr': 25, 'p_adx': 19, 'rsi_period': 71, 'ema1': 19, 'ema2': 39, 'slip_atr_k': 0.09946023900396361, 'slip_spread_k': 0.4817798683937057, 'spread_hl_frac': 0.008551971037609015, 'bb_std_mult': 1.642524535623619, 'rsi_os': 41, 'rsi_ob': 91, 'vol_spike': 0.2387724405206913, 'adx_thresh': 11.28514442054462, 'atr_min_pct': 0.0009730672408547157, 'atr_max_pct': 0.12014639668491536, 'tp_mult': 1.5654513892375748, 'tsl_mult': 0.896116164270933, 'strategy': 'breakout', 'time_stop': 121, 'use_sma': True, 'use_atr': True, 'use_adx': False, 'use_ema': True, 'use_spike': False, 'rsi_required': True, 'edge_k': 1.3659169841986913, 'edge_cap': 0.8099887879534642, 'bull_strategy': 'breakout', 'bull_bb_std_mult': 3.240936995996728, 'bull_rsi_os': 40, 'bull_rsi_ob': 58, 'bull_adx_thresh': 23.022135737813663, 'bull_atr_min_pct': 0.0017235166542218868, 'bull_atr_max_pct': 0.01721978615786922, 'bull_tp_mult': 1.898017146477703, 'bull_tsl_mult': 0.38878365515575397, 'bull_time_stop': 22, 'bull_use_sma': True, 'bull_use_ema': True, 'bull_use_atr': True, 'bull_use_adx': True, 'bull_use_spike': True, 'bull_rsi_required': True, 'bear_strategy': 'mean_reversion', 'bear_bb_std_mult': 2.776807235760191, 'bear_rsi_os': 25, 'bear_rsi_ob': 69, 'bear_adx_thresh': 11.919584181779802, 'bear_atr_min_pct': 0.02162602029009672, 'bear_atr_max_pct': 0.020317664585245587, 'bear_tp_mult': 1.9757278736012764, 'bear_tsl_mult': 0.4989549913141843, 'bear_time_stop': 59, 'bear_use_sma': True, 'bear_use_ema': False, 'bear_use_atr': True, 'bear_use_adx': True, 'bear_use_spike': True, 'bear_rsi_required': False, 'sideways_strategy': 'mean_reversion', 'sideways_bb_std_mult': 3.166857352270296, 'sideways_rsi_os': 29, 'sideways_rsi_ob': 81, 'sideways_adx_thresh': 14.52054525774434, 'sideways_atr_min_pct': 0.0031183176405282786, 'sideways_atr_max_pct': 0.023790899491662937, 'sideways_tp_mult': 1.2067906064613778, 'sideways_tsl_mult': 0.5287604216202455, 'sideways_time_stop': 17, 'sideways_use_sma': False, 'sideways_use_ema': False, 'sideways_use_atr': False, 'sideways_use_adx': False, 'sideways_use_spike': False, 'sideways_rsi_required': True}.
[I 2025-09-01 13:28:43,085] Trial 174 finished with values: [-0.026063014030844878, 0.026317794540444642] and parameters: {'p_sma': 52, 'p_std': 48, 'p_atr': 11, 'p_adx': 19, 'rsi_period': 72, 'ema1': 19, 'ema2': 59, 'slip_atr_k': 0.10169655377617434, 'slip_spread_k': 0.7231181155609281, 'spread_hl_frac': 7.294616260008699e-05, 'bb_std_mult': 1.6256299257613607, 'rsi_os': 41, 'rsi_ob': 91, 'vol_spike': 0.24479167948976988, 'adx_thresh': 11.539026533882097, 'atr_min_pct': 0.001370198309822526, 'atr_max_pct': 0.03968361059680293, 'tp_mult': 2.7270776068986446, 'tsl_mult': 0.11527103158776515, 'strategy': 'breakout', 'time_stop': 99, 'use_sma': True, 'use_atr': True, 'use_adx': False, 'use_ema': True, 'use_spike': False, 'rsi_required': True, 'edge_k': 0.3430198381684637, 'edge_cap': 0.8433977472597384, 'bull_strategy': 'breakout', 'bull_bb_std_mult': 3.2485713070811135, 'bull_rsi_os': 48, 'bull_rsi_ob': 57, 'bull_adx_thresh': 7.101302433446069, 'bull_atr_min_pct': 0.0013987615528493632, 'bull_atr_max_pct': 0.01756625094897688, 'bull_tp_mult': 1.909519034745866, 'bull_tsl_mult': 0.4336990095049279, 'bull_time_stop': 18, 'bull_use_sma': True, 'bull_use_ema': True, 'bull_use_atr': True, 'bull_use_adx': True, 'bull_use_spike': True, 'bull_rsi_required': True, 'bear_strategy': 'mean_reversion', 'bear_bb_std_mult': 1.7067776368817156, 'bear_rsi_os': 13, 'bear_rsi_ob': 69, 'bear_adx_thresh': 18.154523911179293, 'bear_atr_min_pct': 0.02090445781693962, 'bear_atr_max_pct': 0.021705772894207914, 'bear_tp_mult': 2.598660572396562, 'bear_tsl_mult': 0.5000083298927267, 'bear_time_stop': 257, 'bear_use_sma': True, 'bear_use_ema': False, 'bear_use_atr': True, 'bear_use_adx': True, 'bear_use_spike': True, 'bear_rsi_required': False, 'sideways_strategy': 'mean_reversion', 'sideways_bb_std_mult': 0.7352514929672023, 'sideways_rsi_os': 24, 'sideways_rsi_ob': 93, 'sideways_adx_thresh': 14.640683540781241, 'sideways_atr_min_pct': 0.011054534481797785, 'sideways_atr_max_pct': 0.10796504881451027, 'sideways_tp_mult': 1.1956570756445282, 'sideways_tsl_mult': 0.5310998745146595, 'sideways_time_stop': 16, 'sideways_use_sma': False, 'sideways_use_ema': False, 'sideways_use_atr': False, 'sideways_use_adx': False, 'sideways_use_spike': False, 'sideways_rsi_required': True}.
[I 2025-09-01 13:29:23,357] Trial 178 finished with values: [-1000000000.0, 1000000000.0] and parameters: {'p_sma': 36, 'p_std': 44, 'p_atr': 8, 'p_adx': 20, 'rsi_period': 38, 'ema1': 6, 'ema2': 40, 'slip_atr_k': 0.10217877160672309, 'slip_spread_k': 0.3616492020604962, 'spread_hl_frac': 0.002829892942059334, 'bb_std_mult': 1.5016163164863594, 'rsi_os': 22, 'rsi_ob': 82, 'vol_spike': 0.17717332797741972, 'adx_thresh': 11.17007078602898, 'atr_min_pct': 0.0024462005290009107, 'atr_max_pct': 0.05650105697211537, 'tp_mult': 2.8479665086497885, 'tsl_mult': 0.08955786018695715, 'strategy': 'breakout', 'time_stop': 119, 'use_sma': False, 'use_atr': True, 'use_adx': False, 'use_ema': False, 'use_spike': False, 'rsi_required': True, 'edge_k': 0.3448289167208364, 'edge_cap': 0.7616081833976645, 'bull_strategy': 'mean_reversion', 'bull_bb_std_mult': 0.5091253943311824, 'bull_rsi_os': 48, 'bull_rsi_ob': 45, 'bull_adx_thresh': 7.166759438809491, 'bull_atr_min_pct': 0.0016515866199592957, 'bull_atr_max_pct': 0.12553317642941628, 'bull_tp_mult': 1.380731171179226, 'bull_tsl_mult': 0.3885408624008697, 'bull_time_stop': 88, 'bull_use_sma': False, 'bull_use_ema': True, 'bull_use_atr': True, 'bull_use_adx': True, 'bull_use_spike': False, 'bull_rsi_required': True, 'bear_strategy': 'mean_reversion', 'bear_bb_std_mult': 1.681320704095854, 'bear_rsi_os': 9, 'bear_rsi_ob': 72, 'bear_adx_thresh': 18.248507353693277, 'bear_atr_min_pct': 0.0031141547252948355, 'bear_atr_max_pct': 0.13294570227365676, 'bear_tp_mult': 1.2666859312820191, 'bear_tsl_mult': 0.5565750320805126, 'bear_time_stop': 259, 'bear_use_sma': False, 'bear_use_ema': False, 'bear_use_atr': True, 'bear_use_adx': True, 'bear_use_spike': False, 'bear_rsi_required': False, 'sideways_strategy': 'mean_reversion', 'sideways_bb_std_mult': 0.716317826054564, 'sideways_rsi_os': 50, 'sideways_rsi_ob': 70, 'sideways_adx_thresh': 13.355700397388006, 'sideways_atr_min_pct': 0.011812466697047613, 'sideways_atr_max_pct': 0.1228140976802242, 'sideways_tp_mult': 2.8013329142979995, 'sideways_tsl_mult': 0.13025889132507007, 'sideways_time_stop': 240, 'sideways_use_sma': False, 'sideways_use_ema': False, 'sideways_use_atr': True, 'sideways_use_adx': False, 'sideways_use_spike': True, 'sideways_rsi_required': False}.
[I 2025-09-01 13:29:24,602] Trial 179 finished with values: [-1000000000.0, 1000000000.0] and parameters: {'p_sma': 55, 'p_std': 45, 'p_atr': 8, 'p_adx': 20, 'rsi_period': 53, 'ema1': 6, 'ema2': 59, 'slip_atr_k': 0.10279162426869978, 'slip_spread_k': 0.7082040988830056, 'spread_hl_frac': 0.029699200634809606, 'bb_std_mult': 1.865334278873167, 'rsi_os': 20, 'rsi_ob': 92, 'vol_spike': 0.23181386871979032, 'adx_thresh': 31.321304938622745, 'atr_min_pct': 0.017082345717372334, 'atr_max_pct': 0.14729588364200796, 'tp_mult': 1.3773429718297365, 'tsl_mult': 0.09197233431597474, 'strategy': 'breakout', 'time_stop': 120, 'use_sma': False, 'use_atr': True, 'use_adx': False, 'use_ema': False, 'use_spike': False, 'rsi_required': True, 'edge_k': 0.3228577607222656, 'edge_cap': 0.7993114221706507, 'bull_strategy': 'mean_reversion', 'bull_bb_std_mult': 2.229814170135399, 'bull_rsi_os': 48, 'bull_rsi_ob': 58, 'bull_adx_thresh': 32.434663829509354, 'bull_atr_min_pct': 0.001544537088823069, 'bull_atr_max_pct': 0.13945132260542129, 'bull_tp_mult': 1.0903870171960173, 'bull_tsl_mult': 0.3862502872567039, 'bull_time_stop': 19, 'bull_use_sma': False, 'bull_use_ema': True, 'bull_use_atr': True, 'bull_use_adx': True, 'bull_use_spike': False, 'bull_rsi_required': True, 'bear_strategy': 'mean_reversion', 'bear_bb_std_mult': 1.5337141979145783, 'bear_rsi_os': 26, 'bear_rsi_ob': 53, 'bear_adx_thresh': 10.58902858355123, 'bear_atr_min_pct': 0.020733036485575906, 'bear_atr_max_pct': 0.0817847184235422, 'bear_tp_mult': 2.6645044701958183, 'bear_tsl_mult': 0.41069538429198144, 'bear_time_stop': 257, 'bear_use_sma': False, 'bear_use_ema': False, 'bear_use_atr': True, 'bear_use_adx': True, 'bear_use_spike': False, 'bear_rsi_required': False, 'sideways_strategy': 'mean_reversion', 'sideways_bb_std_mult': 2.9245748005570382, 'sideways_rsi_os': 31, 'sideways_rsi_ob': 93, 'sideways_adx_thresh': 13.22249188754464, 'sideways_atr_min_pct': 0.018895589942016254, 'sideways_atr_max_pct': 0.12299260561190908, 'sideways_tp_mult': 1.6173493097919875, 'sideways_tsl_mult': 0.19338086780041708, 'sideways_time_stop': 13, 'sideways_use_sma': False, 'sideways_use_ema': False, 'sideways_use_atr': True, 'sideways_use_adx': False, 'sideways_use_spike': True, 'sideways_rsi_required': False}.
[I 2025-09-01 13:29:24,629] Trial 176 finished with values: [-1000000000.0, 1000000000.0] and parameters: {'p_sma': 55, 'p_std': 44, 'p_atr': 25, 'p_adx': 20, 'rsi_period': 37, 'ema1': 27, 'ema2': 13, 'slip_atr_k': 0.10089425865868773, 'slip_spread_k': 0.4659340024675968, 'spread_hl_frac': 0.0031555421410571285, 'bb_std_mult': 0.7912640612769974, 'rsi_os': 41, 'rsi_ob': 91, 'vol_spike': 0.23230489136583687, 'adx_thresh': 11.316638590597428, 'atr_min_pct': 0.02758080292773576, 'atr_max_pct': 0.057493913304404835, 'tp_mult': 1.623389729283383, 'tsl_mult': 0.36154323109694503, 'strategy': 'breakout', 'time_stop': 118, 'use_sma': True, 'use_atr': True, 'use_adx': False, 'use_ema': True, 'use_spike': False, 'rsi_required': True, 'edge_k': 0.3308158414347874, 'edge_cap': 0.8101448720432675, 'bull_strategy': 'mean_reversion', 'bull_bb_std_mult': 3.249025908897486, 'bull_rsi_os': 26, 'bull_rsi_ob': 59, 'bull_adx_thresh': 32.51494195660356, 'bull_atr_min_pct': 0.0015000866814690013, 'bull_atr_max_pct': 0.13944554958949423, 'bull_tp_mult': 1.9919447952640017, 'bull_tsl_mult': 0.39716507833620146, 'bull_time_stop': 20, 'bull_use_sma': True, 'bull_use_ema': True, 'bull_use_atr': True, 'bull_use_adx': True, 'bull_use_spike': False, 'bull_rsi_required': True, 'bear_strategy': 'mean_reversion', 'bear_bb_std_mult': 1.653213974789634, 'bear_rsi_os': 9, 'bear_rsi_ob': 71, 'bear_adx_thresh': 10.546580985142707, 'bear_atr_min_pct': 0.0208821147345901, 'bear_atr_max_pct': 0.02262404848277884, 'bear_tp_mult': 1.9760906728902732, 'bear_tsl_mult': 0.48998200390970786, 'bear_time_stop': 277, 'bear_use_sma': True, 'bear_use_ema': False, 'bear_use_atr': True, 'bear_use_adx': True, 'bear_use_spike': False, 'bear_rsi_required': False, 'sideways_strategy': 'mean_reversion', 'sideways_bb_std_mult': 2.923587785773094, 'sideways_rsi_os': 31, 'sideways_rsi_ob': 93, 'sideways_adx_thresh': 19.436492744322628, 'sideways_atr_min_pct': 0.011837496259202267, 'sideways_atr_max_pct': 0.11827634116365511, 'sideways_tp_mult': 2.805023714920037, 'sideways_tsl_mult': 0.19477384535847503, 'sideways_time_stop': 256, 'sideways_use_sma': False, 'sideways_use_ema': False, 'sideways_use_atr': True, 'sideways_use_adx': False, 'sideways_use_spike': True, 'sideways_rsi_required': True}.
[I 2025-09-01 13:29:25,178] Trial 177 finished with values: [-1000000000.0, 1000000000.0] and parameters: {'p_sma': 55, 'p_std': 44, 'p_atr': 30, 'p_adx': 20, 'rsi_period': 71, 'ema1': 27, 'ema2': 13, 'slip_atr_k': 0.10530386280874517, 'slip_spread_k': 0.32900659602334426, 'spread_hl_frac': 0.008800499948132012, 'bb_std_mult': 0.7973732157365438, 'rsi_os': 20, 'rsi_ob': 91, 'vol_spike': 0.23038637377215632, 'adx_thresh': 11.325392701838808, 'atr_min_pct': 0.002391221348619237, 'atr_max_pct': 0.05683429053359687, 'tp_mult': 2.747342766905577, 'tsl_mult': 0.32272727095478015, 'strategy': 'breakout', 'time_stop': 225, 'use_sma': True, 'use_atr': True, 'use_adx': False, 'use_ema': True, 'use_spike': False, 'rsi_required': True, 'edge_k': 1.973644788499806, 'edge_cap': 0.8082773924475317, 'bull_strategy': 'mean_reversion', 'bull_bb_std_mult': 3.0821449653169117, 'bull_rsi_os': 49, 'bull_rsi_ob': 95, 'bull_adx_thresh': 19.097975866563253, 'bull_atr_min_pct': 0.0015231250421658914, 'bull_atr_max_pct': 0.08838755318942304, 'bull_tp_mult': 2.653537355811313, 'bull_tsl_mult': 0.37375942983990984, 'bull_time_stop': 18, 'bull_use_sma': True, 'bull_use_ema': True, 'bull_use_atr': True, 'bull_use_adx': True, 'bull_use_spike': False, 'bull_rsi_required': True, 'bear_strategy': 'mean_reversion', 'bear_bb_std_mult': 2.4954237083551547, 'bear_rsi_os': 25, 'bear_rsi_ob': 66, 'bear_adx_thresh': 10.340945638730195, 'bear_atr_min_pct': 0.020829306515579057, 'bear_atr_max_pct': 0.02114037202499723, 'bear_tp_mult': 1.9590456383292851, 'bear_tsl_mult': 0.8892720131302261, 'bear_time_stop': 258, 'bear_use_sma': True, 'bear_use_ema': False, 'bear_use_atr': True, 'bear_use_adx': True, 'bear_use_spike': False, 'bear_rsi_required': False, 'sideways_strategy': 'mean_reversion', 'sideways_bb_std_mult': 0.6975972844896637, 'sideways_rsi_os': 30, 'sideways_rsi_ob': 93, 'sideways_adx_thresh': 15.064687098681311, 'sideways_atr_min_pct': 0.01189894876818903, 'sideways_atr_max_pct': 0.12349556003357225, 'sideways_tp_mult': 1.632716575806807, 'sideways_tsl_mult': 0.5321853212261568, 'sideways_time_stop': 238, 'sideways_use_sma': False, 'sideways_use_ema': False, 'sideways_use_atr': True, 'sideways_use_adx': False, 'sideways_use_spike': True, 'sideways_rsi_required': True}.
