[I 2025-09-01 15:12:20,448] Trial 853 finished with values: [-1000000000.0, 1000000000.0] and parameters: {'p_sma': 48, 'p_std': 59, 'p_atr': 11, 'p_adx': 14, 'rsi_period': 65, 'ema1': 20, 'ema2': 19, 'slip_atr_k': 0.013298568414323904, 'slip_spread_k': 0.08922816903262674, 'spread_hl_frac': 0.006510859826196665, 'bb_std_mult': 3.2082729251625066, 'rsi_os': 17, 'rsi_ob': 83, 'vol_spike': 0.12791783679291635, 'adx_thresh': 30.837621252292053, 'atr_min_pct': 0.017905816374459843, 'atr_max_pct': 0.05267797490258072, 'tp_mult': 1.131104477317741, 'tsl_mult': 0.213025256127236, 'strategy': 'mean_reversion', 'time_stop': 135, 'use_sma': True, 'use_atr': False, 'use_adx': True, 'use_ema': True, 'use_spike': True, 'rsi_required': False, 'edge_k': 0.8732876541240535, 'edge_cap': 0.5875856272342189, 'bull_strategy': 'breakout', 'bull_bb_std_mult': 2.2079000724922184, 'bull_rsi_os': 25, 'bull_rsi_ob': 55, 'bull_adx_thresh': 30.60157400431237, 'bull_atr_min_pct': 0.0022616799547237124, 'bull_atr_max_pct': 0.05342183816424957, 'bull_tp_mult': 2.8594660351071646, 'bull_tsl_mult': 0.5179541697259659, 'bull_time_stop': 17, 'bull_use_sma': True, 'bull_use_ema': True, 'bull_use_atr': True, 'bull_use_adx': True, 'bull_use_spike': False, 'bull_rsi_required': True, 'bear_strategy': 'breakout', 'bear_bb_std_mult': 3.3691420035291735, 'bear_rsi_os': 22, 'bear_rsi_ob': 70, 'bear_adx_thresh': 31.58133446779695, 'bear_atr_min_pct': 0.008259028421602607, 'bear_atr_max_pct': 0.024969766929700238, 'bear_tp_mult': 2.8315421628545963, 'bear_tsl_mult': 0.16299380500267135, 'bear_time_stop': 272, 'bear_use_sma': True, 'bear_use_ema': True, 'bear_use_atr': True, 'bear_use_adx': True, 'bear_use_spike': False, 'bear_rsi_required': True, 'sideways_strategy': 'breakout', 'sideways_bb_std_mult': 2.392413862217587, 'sideways_rsi_os': 55, 'sideways_rsi_ob': 66, 'sideways_adx_thresh': 9.808295478179247, 'sideways_atr_min_pct': 0.020138643641839565, 'sideways_atr_max_pct': 0.06368345626319459, 'sideways_tp_mult': 2.827623209248102, 'sideways_tsl_mult': 0.3023820724823148, 'sideways_time_stop': 245, 'sideways_use_sma': True, 'sideways_use_ema': False, 'sideways_use_atr': True, 'sideways_use_adx': True, 'sideways_use_spike': True, 'sideways_rsi_required': True}.
[I 2025-09-01 15:12:20,863] Trial 854 finished with values: [-1000000000.0, 1000000000.0] and parameters: {'p_sma': 20, 'p_std': 60, 'p_atr': 25, 'p_adx': 15, 'rsi_period': 33, 'ema1': 29, 'ema2': 19, 'slip_atr_k': 0.0780567350906477, 'slip_spread_k': 0.04416550804920508, 'spread_hl_frac': 0.006505959924384065, 'bb_std_mult': 2.4388012143395583, 'rsi_os': 17, 'rsi_ob': 70, 'vol_spike': 0.07517029102883462, 'adx_thresh': 19.31672438134861, 'atr_min_pct': 0.025537686696485838, 'atr_max_pct': 0.14330166027683344, 'tp_mult': 1.8310891038107957, 'tsl_mult': 0.7601502179769666, 'strategy': 'mean_reversion', 'time_stop': 239, 'use_sma': True, 'use_atr': False, 'use_adx': True, 'use_ema': True, 'use_spike': True, 'rsi_required': False, 'edge_k': 0.8862685700644524, 'edge_cap': 0.29769103646863126, 'bull_strategy': 'breakout', 'bull_bb_std_mult': 3.3826184953548912, 'bull_rsi_os': 34, 'bull_rsi_ob': 55, 'bull_adx_thresh': 29.118018237304934, 'bull_atr_min_pct': 0.002057334794251741, 'bull_atr_max_pct': 0.052444432985755754, 'bull_tp_mult': 2.863940847991245, 'bull_tsl_mult': 0.3607048319126099, 'bull_time_stop': 15, 'bull_use_sma': True, 'bull_use_ema': True, 'bull_use_atr': True, 'bull_use_adx': True, 'bull_use_spike': False, 'bull_rsi_required': True, 'bear_strategy': 'breakout', 'bear_bb_std_mult': 2.009156392137888, 'bear_rsi_os': 12, 'bear_rsi_ob': 60, 'bear_adx_thresh': 12.081604364450444, 'bear_atr_min_pct': 0.0028910113364298533, 'bear_atr_max_pct': 0.04125307108258104, 'bear_tp_mult': 2.337408508565784, 'bear_tsl_mult': 0.16201718743332158, 'bear_time_stop': 136, 'bear_use_sma': True, 'bear_use_ema': True, 'bear_use_atr': True, 'bear_use_adx': True, 'bear_use_spike': False, 'bear_rsi_required': True, 'sideways_strategy': 'breakout', 'sideways_bb_std_mult': 1.6136110105321861, 'sideways_rsi_os': 55, 'sideways_rsi_ob': 61, 'sideways_adx_thresh': 6.907736229448134, 'sideways_atr_min_pct': 0.026308041080334847, 'sideways_atr_max_pct': 0.05619942770023431, 'sideways_tp_mult': 2.3132573355398436, 'sideways_tsl_mult': 0.1521422909413433, 'sideways_time_stop': 165, 'sideways_use_sma': True, 'sideways_use_ema': False, 'sideways_use_atr': True, 'sideways_use_adx': True, 'sideways_use_spike': True, 'sideways_rsi_required': True}.
[I 2025-09-01 15:12:22,194] Trial 860 finished with values: [-1000000000.0, 1000000000.0] and parameters: {'p_sma': 37, 'p_std': 50, 'p_atr': 24, 'p_adx': 12, 'rsi_period': 63, 'ema1': 21, 'ema2': 17, 'slip_atr_k': 0.00768958976693698, 'slip_spread_k': 0.001783571555877328, 'spread_hl_frac': 0.004245948284606677, 'bb_std_mult': 0.9936564630245559, 'rsi_os': 50, 'rsi_ob': 88, 'vol_spike': 0.1413246391341753, 'adx_thresh': 24.18304692539265, 'atr_min_pct': 0.010358910377915469, 'atr_max_pct': 0.14763738842392365, 'tp_mult': 2.7691989979227705, 'tsl_mult': 0.6824888524197179, 'strategy': 'mean_reversion', 'time_stop': 250, 'use_sma': False, 'use_atr': True, 'use_adx': False, 'use_ema': False, 'use_spike': False, 'rsi_required': True, 'edge_k': 0.8258183210510962, 'edge_cap': 0.1461324484377206, 'bull_strategy': 'breakout', 'bull_bb_std_mult': 3.2223182582873333, 'bull_rsi_os': 11, 'bull_rsi_ob': 57, 'bull_adx_thresh': 31.405309464731577, 'bull_atr_min_pct': 0.028138291463527747, 'bull_atr_max_pct': 0.010144378353330027, 'bull_tp_mult': 2.79549309499993, 'bull_tsl_mult': 0.4704268412628354, 'bull_time_stop': 100, 'bull_use_sma': False, 'bull_use_ema': False, 'bull_use_atr': False, 'bull_use_adx': False, 'bull_use_spike': True, 'bull_rsi_required': True, 'bear_strategy': 'breakout', 'bear_bb_std_mult': 3.47835438004929, 'bear_rsi_os': 14, 'bear_rsi_ob': 80, 'bear_adx_thresh': 10.811044717599968, 'bear_atr_min_pct': 0.0019995472299411694, 'bear_atr_max_pct': 0.05806453505664863, 'bear_tp_mult': 2.2405808006233623, 'bear_tsl_mult': 0.14115078263944483, 'bear_time_stop': 151, 'bear_use_sma': False, 'bear_use_ema': True, 'bear_use_atr': True, 'bear_use_adx': True, 'bear_use_spike': True, 'bear_rsi_required': False, 'sideways_strategy': 'breakout', 'sideways_bb_std_mult': 2.1432972675240523, 'sideways_rsi_os': 28, 'sideways_rsi_ob': 93, 'sideways_adx_thresh': 7.840435971980077, 'sideways_atr_min_pct': 0.003785588930212431, 'sideways_atr_max_pct': 0.05985503300347104, 'sideways_tp_mult': 2.7853671711023305, 'sideways_tsl_mult': 0.25501069204596744, 'sideways_time_stop': 187, 'sideways_use_sma': False, 'sideways_use_ema': True, 'sideways_use_atr': False, 'sideways_use_adx': False, 'sideways_use_spike': False, 'sideways_rsi_required': False}.
[I 2025-09-01 15:12:56,158] Trial 857 finished with values: [-1000000000.0, 1000000000.0] and parameters: {'p_sma': 33, 'p_std': 45, 'p_atr': 24, 'p_adx': 24, 'rsi_period': 66, 'ema1': 29, 'ema2': 35, 'slip_atr_k': 0.013931104540620737, 'slip_spread_k': 0.7918934254970346, 'spread_hl_frac': 0.004414617507091269, 'bb_std_mult': 2.4435072125630874, 'rsi_os': 22, 'rsi_ob': 80, 'vol_spike': 0.07204915668592074, 'adx_thresh': 8.843011095907404, 'atr_min_pct': 0.027801442248347234, 'atr_max_pct': 0.13548617937271787, 'tp_mult': 1.0120300675579907, 'tsl_mult': 0.6600049210235797, 'strategy': 'mean_reversion', 'time_stop': 60, 'use_sma': True, 'use_atr': True, 'use_adx': True, 'use_ema': True, 'use_spike': False, 'rsi_required': False, 'edge_k': 0.8861274790576859, 'edge_cap': 0.5254879418966097, 'bull_strategy': 'breakout', 'bull_bb_std_mult': 3.3812206810071554, 'bull_rsi_os': 17, 'bull_rsi_ob': 50, 'bull_adx_thresh': 28.04001550326051, 'bull_atr_min_pct': 0.001974358713408189, 'bull_atr_max_pct': 0.02008403479980614, 'bull_tp_mult': 2.855467803904444, 'bull_tsl_mult': 0.47990835614479077, 'bull_time_stop': 18, 'bull_use_sma': False, 'bull_use_ema': True, 'bull_use_atr': True, 'bull_use_adx': True, 'bull_use_spike': True, 'bull_rsi_required': True, 'bear_strategy': 'breakout', 'bear_bb_std_mult': 3.4685598180862516, 'bear_rsi_os': 14, 'bear_rsi_ob': 80, 'bear_adx_thresh': 16.900471327353664, 'bear_atr_min_pct': 0.01756232620168705, 'bear_atr_max_pct': 0.09385431379636794, 'bear_tp_mult': 2.3519244606566123, 'bear_tsl_mult': 0.15731574886269215, 'bear_time_stop': 154, 'bear_use_sma': False, 'bear_use_ema': True, 'bear_use_atr': True, 'bear_use_adx': True, 'bear_use_spike': True, 'bear_rsi_required': False, 'sideways_strategy': 'breakout', 'sideways_bb_std_mult': 2.540368702633322, 'sideways_rsi_os': 11, 'sideways_rsi_ob': 66, 'sideways_adx_thresh': 6.80233446102739, 'sideways_atr_min_pct': 0.02659152215102739, 'sideways_atr_max_pct': 0.06446247115953063, 'sideways_tp_mult': 2.0921874071191935, 'sideways_tsl_mult': 0.2520976521647453, 'sideways_time_stop': 41, 'sideways_use_sma': False, 'sideways_use_ema': True, 'sideways_use_atr': False, 'sideways_use_adx': True, 'sideways_use_spike': False, 'sideways_rsi_required': False}.
[I 2025-09-01 15:12:56,481] Trial 859 finished with values: [-1000000000.0, 1000000000.0] and parameters: {'p_sma': 34, 'p_std': 45, 'p_atr': 25, 'p_adx': 12, 'rsi_period': 13, 'ema1': 5, 'ema2': 17, 'slip_atr_k': 0.00048710694268550014, 'slip_spread_k': 0.9274425411132106, 'spread_hl_frac': 0.03661525492227948, 'bb_std_mult': 2.0187947428596162, 'rsi_os': 39, 'rsi_ob': 80, 'vol_spike': 0.07866482743061734, 'adx_thresh': 24.060789608595393, 'atr_min_pct': 0.025595753194605452, 'atr_max_pct': 0.1306274160655936, 'tp_mult': 1.668214669891938, 'tsl_mult': 0.019705302156667825, 'strategy': 'mean_reversion', 'time_stop': 12, 'use_sma': False, 'use_atr': True, 'use_adx': False, 'use_ema': True, 'use_spike': False, 'rsi_required': False, 'edge_k': 0.8208581366197564, 'edge_cap': 0.3451899644944868, 'bull_strategy': 'breakout', 'bull_bb_std_mult': 2.9572454780969792, 'bull_rsi_os': 35, 'bull_rsi_ob': 57, 'bull_adx_thresh': 31.361673936695215, 'bull_atr_min_pct': 0.028319989900237943, 'bull_atr_max_pct': 0.01916456145779566, 'bull_tp_mult': 2.786889499172028, 'bull_tsl_mult': 0.46921260117338615, 'bull_time_stop': 70, 'bull_use_sma': False, 'bull_use_ema': True, 'bull_use_atr': False, 'bull_use_adx': False, 'bull_use_spike': True, 'bull_rsi_required': True, 'bear_strategy': 'breakout', 'bear_bb_std_mult': 0.7866071638681784, 'bear_rsi_os': 14, 'bear_rsi_ob': 80, 'bear_adx_thresh': 16.80954180187442, 'bear_atr_min_pct': 0.0016917962298619283, 'bear_atr_max_pct': 0.043878928376254955, 'bear_tp_mult': 2.237329124391542, 'bear_tsl_mult': 0.13797149627742766, 'bear_time_stop': 153, 'bear_use_sma': False, 'bear_use_ema': True, 'bear_use_atr': True, 'bear_use_adx': True, 'bear_use_spike': True, 'bear_rsi_required': False, 'sideways_strategy': 'breakout', 'sideways_bb_std_mult': 1.613311193486313, 'sideways_rsi_os': 50, 'sideways_rsi_ob': 67, 'sideways_adx_thresh': 7.740337229729556, 'sideways_atr_min_pct': 0.01541629262507691, 'sideways_atr_max_pct': 0.0771192318635365, 'sideways_tp_mult': 1.9107917919096176, 'sideways_tsl_mult': 0.24328867789890293, 'sideways_time_stop': 42, 'sideways_use_sma': False, 'sideways_use_ema': True, 'sideways_use_atr': False, 'sideways_use_adx': False, 'sideways_use_spike': False, 'sideways_rsi_required': False}.
[I 2025-09-01 15:12:56,836] Trial 858 finished with values: [-1000000000.0, 1000000000.0] and parameters: {'p_sma': 34, 'p_std': 8, 'p_atr': 24, 'p_adx': 15, 'rsi_period': 19, 'ema1': 21, 'ema2': 33, 'slip_atr_k': 0.01810313974613513, 'slip_spread_k': 0.11728374286059703, 'spread_hl_frac': 0.0038193524144869598, 'bb_std_mult': 1.8529526526360787, 'rsi_os': 39, 'rsi_ob': 80, 'vol_spike': 0.14111830379672463, 'adx_thresh': 23.952789064761753, 'atr_min_pct': 0.010268509564930098, 'atr_max_pct': 0.13634950692096975, 'tp_mult': 2.76781693617957, 'tsl_mult': 0.6613053570110182, 'strategy': 'mean_reversion', 'time_stop': 247, 'use_sma': False, 'use_atr': True, 'use_adx': False, 'use_ema': True, 'use_spike': False, 'rsi_required': False, 'edge_k': 0.8167538237351079, 'edge_cap': 0.3466916462416192, 'bull_strategy': 'breakout', 'bull_bb_std_mult': 2.9418865204837212, 'bull_rsi_os': 35, 'bull_rsi_ob': 57, 'bull_adx_thresh': 28.049713292379206, 'bull_atr_min_pct': 0.005046271685167051, 'bull_atr_max_pct': 0.02094587621965672, 'bull_tp_mult': 2.799208146230081, 'bull_tsl_mult': 0.4789757414652223, 'bull_time_stop': 262, 'bull_use_sma': False, 'bull_use_ema': True, 'bull_use_atr': False, 'bull_use_adx': False, 'bull_use_spike': True, 'bull_rsi_required': True, 'bear_strategy': 'breakout', 'bear_bb_std_mult': 3.479416160738302, 'bear_rsi_os': 30, 'bear_rsi_ob': 80, 'bear_adx_thresh': 10.713307444682686, 'bear_atr_min_pct': 0.017484280735115664, 'bear_atr_max_pct': 0.043567931429344134, 'bear_tp_mult': 2.0098483687520865, 'bear_tsl_mult': 0.1389555962281233, 'bear_time_stop': 218, 'bear_use_sma': False, 'bear_use_ema': True, 'bear_use_atr': True, 'bear_use_adx': True, 'bear_use_spike': True, 'bear_rsi_required': False, 'sideways_strategy': 'breakout', 'sideways_bb_std_mult': 0.633870840670165, 'sideways_rsi_os': 48, 'sideways_rsi_ob': 67, 'sideways_adx_thresh': 7.948216364758893, 'sideways_atr_min_pct': 0.006177980352878667, 'sideways_atr_max_pct': 0.11505532181220574, 'sideways_tp_mult': 2.7784044837485067, 'sideways_tsl_mult': 0.8368466261697276, 'sideways_time_stop': 164, 'sideways_use_sma': False, 'sideways_use_ema': True, 'sideways_use_atr': False, 'sideways_use_adx': False, 'sideways_use_spike': False, 'sideways_rsi_required': False}.
[I 2025-09-01 15:12:57,371] Trial 861 finished with values: [-1000000000.0, 1000000000.0] and parameters: {'p_sma': 33, 'p_std': 45, 'p_atr': 24, 'p_adx': 12, 'rsi_period': 72, 'ema1': 5, 'ema2': 20, 'slip_atr_k': 0.18779341476180766, 'slip_spread_k': 0.6927708293849786, 'spread_hl_frac': 0.044603453973703175, 'bb_std_mult': 2.1654980095468845, 'rsi_os': 38, 'rsi_ob': 53, 'vol_spike': 0.03554365586564395, 'adx_thresh': 26.94191913599962, 'atr_min_pct': 0.004466831187401363, 'atr_max_pct': 0.13572785599768528, 'tp_mult': 1.016989033025481, 'tsl_mult': 0.6660873303743485, 'strategy': 'breakout', 'time_stop': 10, 'use_sma': True, 'use_atr': True, 'use_adx': False, 'use_ema': True, 'use_spike': False, 'rsi_required': False, 'edge_k': 0.9586569316221327, 'edge_cap': 0.345034407785856, 'bull_strategy': 'breakout', 'bull_bb_std_mult': 3.130646960917274, 'bull_rsi_os': 44, 'bull_rsi_ob': 87, 'bull_adx_thresh': 11.35131889703243, 'bull_atr_min_pct': 0.019730595711485072, 'bull_atr_max_pct': 0.14510732853165087, 'bull_tp_mult': 2.7701196524194716, 'bull_tsl_mult': 0.4021449009069782, 'bull_time_stop': 180, 'bull_use_sma': False, 'bull_use_ema': True, 'bull_use_atr': True, 'bull_use_adx': True, 'bull_use_spike': True, 'bull_rsi_required': True, 'bear_strategy': 'breakout', 'bear_bb_std_mult': 2.701677863188742, 'bear_rsi_os': 33, 'bear_rsi_ob': 76, 'bear_adx_thresh': 16.554541993306845, 'bear_atr_min_pct': 0.02773492480031269, 'bear_atr_max_pct': 0.044565422820738824, 'bear_tp_mult': 2.1596090746372907, 'bear_tsl_mult': 0.09796893247170768, 'bear_time_stop': 218, 'bear_use_sma': False, 'bear_use_ema': True, 'bear_use_atr': True, 'bear_use_adx': True, 'bear_use_spike': True, 'bear_rsi_required': False, 'sideways_strategy': 'mean_reversion', 'sideways_bb_std_mult': 2.502360963273044, 'sideways_rsi_os': 48, 'sideways_rsi_ob': 67, 'sideways_adx_thresh': 6.2912695311860904, 'sideways_atr_min_pct': 0.021138661933868663, 'sideways_atr_max_pct': 0.07675737426440489, 'sideways_tp_mult': 2.088097827020202, 'sideways_tsl_mult': 0.28433442341741677, 'sideways_time_stop': 42, 'sideways_use_sma': False, 'sideways_use_ema': True, 'sideways_use_atr': False, 'sideways_use_adx': True, 'sideways_use_spike': False, 'sideways_rsi_required': False}.
[I 2025-09-01 15:13:39,363] Trial 863 finished with values: [-1000000000.0, 1000000000.0] and parameters: {'p_sma': 37, 'p_std': 55, 'p_atr': 9, 'p_adx': 13, 'rsi_period': 72, 'ema1': 21, 'ema2': 34, 'slip_atr_k': 0.016931475438242853, 'slip_spread_k': 0.9797248867647007, 'spread_hl_frac': 0.008182996449083177, 'bb_std_mult': 1.844772843423132, 'rsi_os': 36, 'rsi_ob': 56, 'vol_spike': 0.03625314630884385, 'adx_thresh': 26.917911763875995, 'atr_min_pct': 0.015855751528949826, 'atr_max_pct': 0.13821751377705405, 'tp_mult': 2.5052574030597063, 'tsl_mult': 0.936484137114192, 'strategy': 'breakout', 'time_stop': 261, 'use_sma': True, 'use_atr': False, 'use_adx': False, 'use_ema': True, 'use_spike': True, 'rsi_required': True, 'edge_k': 0.9560300332797035, 'edge_cap': 0.405412883403064, 'bull_strategy': 'mean_reversion', 'bull_bb_std_mult': 0.8365543001320312, 'bull_rsi_os': 36, 'bull_rsi_ob': 53, 'bull_adx_thresh': 11.701814393647961, 'bull_atr_min_pct': 0.011404446487325427, 'bull_atr_max_pct': 0.02997077150669558, 'bull_tp_mult': 1.773124274954054, 'bull_tsl_mult': 0.6894312601567938, 'bull_time_stop': 89, 'bull_use_sma': True, 'bull_use_ema': False, 'bull_use_atr': True, 'bull_use_adx': True, 'bull_use_spike': False, 'bull_rsi_required': False, 'bear_strategy': 'mean_reversion', 'bear_bb_std_mult': 2.75930524232634, 'bear_rsi_os': 30, 'bear_rsi_ob': 91, 'bear_adx_thresh': 10.161375100274713, 'bear_atr_min_pct': 0.027291985169863746, 'bear_atr_max_pct': 0.08494196374891005, 'bear_tp_mult': 2.1485429386950026, 'bear_tsl_mult': 0.06097418454958403, 'bear_time_stop': 222, 'bear_use_sma': True, 'bear_use_ema': False, 'bear_use_atr': False, 'bear_use_adx': False, 'bear_use_spike': False, 'bear_rsi_required': True, 'sideways_strategy': 'mean_reversion', 'sideways_bb_std_mult': 0.6286471577408697, 'sideways_rsi_os': 40, 'sideways_rsi_ob': 76, 'sideways_adx_thresh': 30.81657107707341, 'sideways_atr_min_pct': 0.021583261577928923, 'sideways_atr_max_pct': 0.07240240936151396, 'sideways_tp_mult': 2.6727338867280612, 'sideways_tsl_mult': 0.21074400815851302, 'sideways_time_stop': 21, 'sideways_use_sma': True, 'sideways_use_ema': False, 'sideways_use_atr': True, 'sideways_use_adx': True, 'sideways_use_spike': False, 'sideways_rsi_required': True}.
[I 2025-09-01 15:13:40,376] Trial 862 finished with values: [-1000000000.0, 1000000000.0] and parameters: {'p_sma': 34, 'p_std': 48, 'p_atr': 25, 'p_adx': 27, 'rsi_period': 71, 'ema1': 21, 'ema2': 20, 'slip_atr_k': 0.11944035679074204, 'slip_spread_k': 0.6858703773628503, 'spread_hl_frac': 0.008297205605063827, 'bb_std_mult': 1.6718929922901704, 'rsi_os': 38, 'rsi_ob': 53, 'vol_spike': 0.24224108523457005, 'adx_thresh': 29.897049268978233, 'atr_min_pct': 0.024949267518150894, 'atr_max_pct': 0.1383550946429977, 'tp_mult': 1.1530855305424854, 'tsl_mult': 0.820704935213047, 'strategy': 'breakout', 'time_stop': 227, 'use_sma': False, 'use_atr': False, 'use_adx': False, 'use_ema': True, 'use_spike': True, 'rsi_required': False, 'edge_k': 0.9962443201101978, 'edge_cap': 0.3424255813992599, 'bull_strategy': 'breakout', 'bull_bb_std_mult': 2.9781570588838076, 'bull_rsi_os': 9, 'bull_rsi_ob': 87, 'bull_adx_thresh': 29.893378513147372, 'bull_atr_min_pct': 0.004949863387089314, 'bull_atr_max_pct': 0.1369469326067061, 'bull_tp_mult': 2.77575323068938, 'bull_tsl_mult': 0.4084035248804557, 'bull_time_stop': 91, 'bull_use_sma': True, 'bull_use_ema': True, 'bull_use_atr': False, 'bull_use_adx': False, 'bull_use_spike': False, 'bull_rsi_required': True, 'bear_strategy': 'breakout', 'bear_bb_std_mult': 3.5974411939856097, 'bear_rsi_os': 34, 'bear_rsi_ob': 54, 'bear_adx_thresh': 11.626225745732341, 'bear_atr_min_pct': 0.012052964642615504, 'bear_atr_max_pct': 0.04426536105380234, 'bear_tp_mult': 2.130043366915753, 'bear_tsl_mult': 0.7366200923859605, 'bear_time_stop': 253, 'bear_use_sma': True, 'bear_use_ema': True, 'bear_use_atr': True, 'bear_use_adx': True, 'bear_use_spike': False, 'bear_rsi_required': True, 'sideways_strategy': 'mean_reversion', 'sideways_bb_std_mult': 1.429425206463648, 'sideways_rsi_os': 41, 'sideways_rsi_ob': 67, 'sideways_adx_thresh': 27.357513312164322, 'sideways_atr_min_pct': 0.021168735330129314, 'sideways_atr_max_pct': 0.07939971233266299, 'sideways_tp_mult': 2.1375735832206724, 'sideways_tsl_mult': 0.2811953866210218, 'sideways_time_stop': 173, 'sideways_use_sma': True, 'sideways_use_ema': False, 'sideways_use_atr': True, 'sideways_use_adx': False, 'sideways_use_spike': False, 'sideways_rsi_required': True}.
