[I 2025-09-01 13:25:11,563] Trial 152 finished with values: [-1000000000.0, 1000000000.0] and parameters: {'p_sma': 52, 'p_std': 15, 'p_atr': 29, 'p_adx': 20, 'rsi_period': 73, 'ema1': 21, 'ema2': 21, 'slip_atr_k': 0.1274014178462727, 'slip_spread_k': 0.7976875524289984, 'spread_hl_frac': 0.046353661919565074, 'bb_std_mult': 3.4391913705164416, 'rsi_os': 26, 'rsi_ob': 71, 'vol_spike': 0.22882900488169505, 'adx_thresh': 31.8822487332559, 'atr_min_pct': 0.0027928507362988205, 'atr_max_pct': 0.10625346346167666, 'tp_mult': 1.6862906440571699, 'tsl_mult': 0.8591039354167389, 'strategy': 'breakout', 'time_stop': 199, 'use_sma': True, 'use_atr': True, 'use_adx': True, 'use_ema': True, 'use_spike': False, 'rsi_required': True, 'edge_k': 0.8189003885658817, 'edge_cap': 0.6509191278919576, 'bull_strategy': 'breakout', 'bull_bb_std_mult': 3.3317782686875383, 'bull_rsi_os': 47, 'bull_rsi_ob': 58, 'bull_adx_thresh': 33.641164532432725, 'bull_atr_min_pct': 0.003752485921621347, 'bull_atr_max_pct': 0.051857106802247796, 'bull_tp_mult': 1.967329326712465, 'bull_tsl_mult': 0.8813042476029034, 'bull_time_stop': 196, 'bull_use_sma': True, 'bull_use_ema': True, 'bull_use_atr': True, 'bull_use_adx': True, 'bull_use_spike': False, 'bull_rsi_required': False, 'bear_strategy': 'mean_reversion', 'bear_bb_std_mult': 0.934907176825555, 'bear_rsi_os': 10, 'bear_rsi_ob': 71, 'bear_adx_thresh': 19.6267322600813, 'bear_atr_min_pct': 0.023384280735786467, 'bear_atr_max_pct': 0.0700684923360499, 'bear_tp_mult': 2.4509187075861596, 'bear_tsl_mult': 0.4692671191598637, 'bear_time_stop': 271, 'bear_use_sma': True, 'bear_use_ema': False, 'bear_use_atr': False, 'bear_use_adx': True, 'bear_use_spike': False, 'bear_rsi_required': False, 'sideways_strategy': 'mean_reversion', 'sideways_bb_std_mult': 0.6165760802479603, 'sideways_rsi_os': 29, 'sideways_rsi_ob': 67, 'sideways_adx_thresh': 5.876995743114355, 'sideways_atr_min_pct': 0.015286417120020872, 'sideways_atr_max_pct': 0.054708042428050455, 'sideways_tp_mult': 2.823313957239869, 'sideways_tsl_mult': 0.544446235144854, 'sideways_time_stop': 247, 'sideways_use_sma': False, 'sideways_use_ema': False, 'sideways_use_atr': True, 'sideways_use_adx': False, 'sideways_use_spike': False, 'sideways_rsi_required': True}.
[I 2025-09-01 13:25:11,974] Trial 154 finished with values: [-0.021620518075573858, 0.021388146745295593] and parameters: {'p_sma': 54, 'p_std': 46, 'p_atr': 13, 'p_adx': 19, 'rsi_period': 7, 'ema1': 14, 'ema2': 59, 'slip_atr_k': 0.08871217816963675, 'slip_spread_k': 0.42588374299646137, 'spread_hl_frac': 0.0006535407558757589, 'bb_std_mult': 2.052500138199626, 'rsi_os': 19, 'rsi_ob': 88, 'vol_spike': 0.2278618681406225, 'adx_thresh': 31.732447958262973, 'atr_min_pct': 0.0027600327249745755, 'atr_max_pct': 0.03450217858972142, 'tp_mult': 2.6740548342934156, 'tsl_mult': 0.9706948700218463, 'strategy': 'breakout', 'time_stop': 91, 'use_sma': True, 'use_atr': True, 'use_adx': True, 'use_ema': True, 'use_spike': False, 'rsi_required': True, 'edge_k': 1.1547933662115077, 'edge_cap': 0.7341035509966902, 'bull_strategy': 'breakout', 'bull_bb_std_mult': 3.252262905448547, 'bull_rsi_os': 7, 'bull_rsi_ob': 57, 'bull_adx_thresh': 15.373475366041701, 'bull_atr_min_pct': 0.002080923155838318, 'bull_atr_max_pct': 0.09753346004590425, 'bull_tp_mult': 1.9441071134648902, 'bull_tsl_mult': 0.32070703060963895, 'bull_time_stop': 214, 'bull_use_sma': True, 'bull_use_ema': True, 'bull_use_atr': True, 'bull_use_adx': True, 'bull_use_spike': False, 'bull_rsi_required': True, 'bear_strategy': 'mean_reversion', 'bear_bb_std_mult': 0.6089297051431468, 'bear_rsi_os': 45, 'bear_rsi_ob': 70, 'bear_adx_thresh': 24.815278286837238, 'bear_atr_min_pct': 0.020997356500746703, 'bear_atr_max_pct': 0.09563437304330401, 'bear_tp_mult': 1.5015394332538228, 'bear_tsl_mult': 0.49494387780245835, 'bear_time_stop': 268, 'bear_use_sma': True, 'bear_use_ema': False, 'bear_use_atr': False, 'bear_use_adx': True, 'bear_use_spike': False, 'bear_rsi_required': False, 'sideways_strategy': 'mean_reversion', 'sideways_bb_std_mult': 1.5646496247382997, 'sideways_rsi_os': 26, 'sideways_rsi_ob': 67, 'sideways_adx_thresh': 23.85355696741857, 'sideways_atr_min_pct': 0.010968183197720794, 'sideways_atr_max_pct': 0.11458420447669078, 'sideways_tp_mult': 2.819959156267492, 'sideways_tsl_mult': 0.540402371908723, 'sideways_time_stop': 131, 'sideways_use_sma': False, 'sideways_use_ema': False, 'sideways_use_atr': True, 'sideways_use_adx': False, 'sideways_use_spike': False, 'sideways_rsi_required': True}.
[I 2025-09-01 13:25:49,433] Trial 156 finished with values: [-1000000000.0, 1000000000.0] and parameters: {'p_sma': 39, 'p_std': 60, 'p_atr': 29, 'p_adx': 19, 'rsi_period': 51, 'ema1': 14, 'ema2': 35, 'slip_atr_k': 0.10521625009479968, 'slip_spread_k': 0.38858339277250475, 'spread_hl_frac': 0.014694489628030221, 'bb_std_mult': 1.571721789194809, 'rsi_os': 38, 'rsi_ob': 61, 'vol_spike': 0.23488361861790838, 'adx_thresh': 9.6782499410341, 'atr_min_pct': 0.0019243945929459192, 'atr_max_pct': 0.12193194387288231, 'tp_mult': 2.683529027598683, 'tsl_mult': 0.9653615459499352, 'strategy': 'breakout', 'time_stop': 94, 'use_sma': True, 'use_atr': True, 'use_adx': False, 'use_ema': True, 'use_spike': False, 'rsi_required': True, 'edge_k': 1.591533843334135, 'edge_cap': 0.9685863594059364, 'bull_strategy': 'mean_reversion', 'bull_bb_std_mult': 1.192557316756977, 'bull_rsi_os': 14, 'bull_rsi_ob': 56, 'bull_adx_thresh': 7.880889206946544, 'bull_atr_min_pct': 0.0020363806789995107, 'bull_atr_max_pct': 0.09720193277845374, 'bull_tp_mult': 1.997433240683125, 'bull_tsl_mult': 0.3176439336071023, 'bull_time_stop': 22, 'bull_use_sma': True, 'bull_use_ema': True, 'bull_use_atr': True, 'bull_use_adx': True, 'bull_use_spike': False, 'bull_rsi_required': True, 'bear_strategy': 'mean_reversion', 'bear_bb_std_mult': 0.6223709411347166, 'bear_rsi_os': 54, 'bear_rsi_ob': 70, 'bear_adx_thresh': 10.763866649262074, 'bear_atr_min_pct': 0.021155955879523087, 'bear_atr_max_pct': 0.06520272844947732, 'bear_tp_mult': 1.5169922651002468, 'bear_tsl_mult': 0.060776706229990984, 'bear_time_stop': 254, 'bear_use_sma': True, 'bear_use_ema': False, 'bear_use_atr': True, 'bear_use_adx': True, 'bear_use_spike': False, 'bear_rsi_required': False, 'sideways_strategy': 'mean_reversion', 'sideways_bb_std_mult': 2.629128972806822, 'sideways_rsi_os': 27, 'sideways_rsi_ob': 71, 'sideways_adx_thresh': 6.052591840155031, 'sideways_atr_min_pct': 0.017636273733608255, 'sideways_atr_max_pct': 0.04227548292319511, 'sideways_tp_mult': 2.842477409416767, 'sideways_tsl_mult': 0.4585886364449908, 'sideways_time_stop': 294, 'sideways_use_sma': False, 'sideways_use_ema': False, 'sideways_use_atr': True, 'sideways_use_adx': False, 'sideways_use_spike': False, 'sideways_rsi_required': True}.
[I 2025-09-01 13:25:50,343] Trial 155 finished with values: [-0.02503093100067255, 0.024772016344326422] and parameters: {'p_sma': 52, 'p_std': 46, 'p_atr': 29, 'p_adx': 19, 'rsi_period': 52, 'ema1': 14, 'ema2': 58, 'slip_atr_k': 0.12454975280380014, 'slip_spread_k': 0.38998414249972135, 'spread_hl_frac': 0.0001433934327937439, 'bb_std_mult': 1.5822346362052313, 'rsi_os': 38, 'rsi_ob': 69, 'vol_spike': 0.2298148666099497, 'adx_thresh': 9.755202320840839, 'atr_min_pct': 0.002830470248783405, 'atr_max_pct': 0.14635435172237737, 'tp_mult': 1.5148670558328532, 'tsl_mult': 0.2133519248019037, 'strategy': 'breakout', 'time_stop': 92, 'use_sma': True, 'use_atr': True, 'use_adx': False, 'use_ema': True, 'use_spike': False, 'rsi_required': True, 'edge_k': 1.1266360389148207, 'edge_cap': 0.6156795265692587, 'bull_strategy': 'breakout', 'bull_bb_std_mult': 1.163212669553312, 'bull_rsi_os': 47, 'bull_rsi_ob': 57, 'bull_adx_thresh': 7.743958294879064, 'bull_atr_min_pct': 0.0017404561313412118, 'bull_atr_max_pct': 0.06937519099629133, 'bull_tp_mult': 1.9983037272265245, 'bull_tsl_mult': 0.32053065773308764, 'bull_time_stop': 14, 'bull_use_sma': True, 'bull_use_ema': True, 'bull_use_atr': True, 'bull_use_adx': True, 'bull_use_spike': False, 'bull_rsi_required': True, 'bear_strategy': 'mean_reversion', 'bear_bb_std_mult': 2.9996895542041995, 'bear_rsi_os': 34, 'bear_rsi_ob': 71, 'bear_adx_thresh': 33.583911112048085, 'bear_atr_min_pct': 0.02844996444368337, 'bear_atr_max_pct': 0.09474510951975114, 'bear_tp_mult': 2.5382580721660775, 'bear_tsl_mult': 0.5056360470767007, 'bear_time_stop': 105, 'bear_use_sma': True, 'bear_use_ema': False, 'bear_use_atr': True, 'bear_use_adx': True, 'bear_use_spike': False, 'bear_rsi_required': False, 'sideways_strategy': 'mean_reversion', 'sideways_bb_std_mult': 2.6080182917026953, 'sideways_rsi_os': 26, 'sideways_rsi_ob': 95, 'sideways_adx_thresh': 12.923765617013943, 'sideways_atr_min_pct': 0.010573174633640001, 'sideways_atr_max_pct': 0.11475122349107658, 'sideways_tp_mult': 1.6320644725716063, 'sideways_tsl_mult': 0.4356916025870603, 'sideways_time_stop': 174, 'sideways_use_sma': False, 'sideways_use_ema': False, 'sideways_use_atr': True, 'sideways_use_adx': False, 'sideways_use_spike': False, 'sideways_rsi_required': True}.
[I 2025-09-01 13:25:50,878] Trial 158 finished with values: [-1000000000.0, 1000000000.0] and parameters: {'p_sma': 57, 'p_std': 47, 'p_atr': 23, 'p_adx': 19, 'rsi_period': 59, 'ema1': 20, 'ema2': 58, 'slip_atr_k': 0.11298264446817083, 'slip_spread_k': 0.39297785981402955, 'spread_hl_frac': 0.0335452853674123, 'bb_std_mult': 2.066247188973671, 'rsi_os': 37, 'rsi_ob': 78, 'vol_spike': 0.1631307112991796, 'adx_thresh': 24.02445760663793, 'atr_min_pct': 0.0019898205716116003, 'atr_max_pct': 0.14445945773155347, 'tp_mult': 2.997318695269626, 'tsl_mult': 0.0916172741322343, 'strategy': 'breakout', 'time_stop': 93, 'use_sma': False, 'use_atr': True, 'use_adx': False, 'use_ema': False, 'use_spike': False, 'rsi_required': True, 'edge_k': 0.6481627276418925, 'edge_cap': 0.8119508786730943, 'bull_strategy': 'mean_reversion', 'bull_bb_std_mult': 3.106084763943984, 'bull_rsi_os': 50, 'bull_rsi_ob': 69, 'bull_adx_thresh': 7.684331965222123, 'bull_atr_min_pct': 0.002020734328070104, 'bull_atr_max_pct': 0.09425969376836581, 'bull_tp_mult': 2.3753149893192025, 'bull_tsl_mult': 0.4096191290461521, 'bull_time_stop': 284, 'bull_use_sma': False, 'bull_use_ema': True, 'bull_use_atr': True, 'bull_use_adx': True, 'bull_use_spike': False, 'bull_rsi_required': True, 'bear_strategy': 'breakout', 'bear_bb_std_mult': 3.1774423386588695, 'bear_rsi_os': 34, 'bear_rsi_ob': 73, 'bear_adx_thresh': 12.307720481914982, 'bear_atr_min_pct': 0.02830122921997412, 'bear_atr_max_pct': 0.08617217754530164, 'bear_tp_mult': 2.5486250185392962, 'bear_tsl_mult': 0.859449223132005, 'bear_time_stop': 280, 'bear_use_sma': False, 'bear_use_ema': False, 'bear_use_atr': True, 'bear_use_adx': True, 'bear_use_spike': True, 'bear_rsi_required': False, 'sideways_strategy': 'mean_reversion', 'sideways_bb_std_mult': 0.7300486670656816, 'sideways_rsi_os': 26, 'sideways_rsi_ob': 63, 'sideways_adx_thresh': 25.81782759223002, 'sideways_atr_min_pct': 0.017975427090949386, 'sideways_atr_max_pct': 0.11772955803273244, 'sideways_tp_mult': 2.7086558543951793, 'sideways_tsl_mult': 0.4670215691810793, 'sideways_time_stop': 21, 'sideways_use_sma': False, 'sideways_use_ema': False, 'sideways_use_atr': False, 'sideways_use_adx': False, 'sideways_use_spike': True, 'sideways_rsi_required': True}.
[I 2025-09-01 13:25:51,547] Trial 157 finished with values: [-1000000000.0, 1000000000.0] and parameters: {'p_sma': 54, 'p_std': 13, 'p_atr': 30, 'p_adx': 19, 'rsi_period': 59, 'ema1': 12, 'ema2': 56, 'slip_atr_k': 0.10612598302802327, 'slip_spread_k': 0.7648355128706753, 'spread_hl_frac': 0.03308066767010383, 'bb_std_mult': 1.5724496507930008, 'rsi_os': 38, 'rsi_ob': 69, 'vol_spike': 0.24995449688731347, 'adx_thresh': 9.662019774755612, 'atr_min_pct': 0.002033742943002624, 'atr_max_pct': 0.1414438580301784, 'tp_mult': 1.5441691429739235, 'tsl_mult': 0.7803030986036197, 'strategy': 'breakout', 'time_stop': 127, 'use_sma': False, 'use_atr': True, 'use_adx': False, 'use_ema': False, 'use_spike': False, 'rsi_required': True, 'edge_k': 1.226756275649179, 'edge_cap': 0.6957830035975281, 'bull_strategy': 'mean_reversion', 'bull_bb_std_mult': 3.281188571094291, 'bull_rsi_os': 13, 'bull_rsi_ob': 56, 'bull_adx_thresh': 14.8377605364029, 'bull_atr_min_pct': 0.002237439611545082, 'bull_atr_max_pct': 0.0964343923379605, 'bull_tp_mult': 2.0028938005779806, 'bull_tsl_mult': 0.32709977881037255, 'bull_time_stop': 261, 'bull_use_sma': True, 'bull_use_ema': True, 'bull_use_atr': True, 'bull_use_adx': True, 'bull_use_spike': False, 'bull_rsi_required': True, 'bear_strategy': 'mean_reversion', 'bear_bb_std_mult': 0.6147234822183987, 'bear_rsi_os': 34, 'bear_rsi_ob': 68, 'bear_adx_thresh': 26.114998543855382, 'bear_atr_min_pct': 0.020942641333524702, 'bear_atr_max_pct': 0.0874668119130057, 'bear_tp_mult': 1.7537070289136614, 'bear_tsl_mult': 0.5833311537555188, 'bear_time_stop': 294, 'bear_use_sma': True, 'bear_use_ema': False, 'bear_use_atr': True, 'bear_use_adx': True, 'bear_use_spike': True, 'bear_rsi_required': False, 'sideways_strategy': 'mean_reversion', 'sideways_bb_std_mult': 2.597153285397787, 'sideways_rsi_os': 26, 'sideways_rsi_ob': 95, 'sideways_adx_thresh': 25.9380480841105, 'sideways_atr_min_pct': 0.01077610702798206, 'sideways_atr_max_pct': 0.11553275398386731, 'sideways_tp_mult': 1.6442024770547317, 'sideways_tsl_mult': 0.43065242848296564, 'sideways_time_stop': 127, 'sideways_use_sma': False, 'sideways_use_ema': True, 'sideways_use_atr': False, 'sideways_use_adx': False, 'sideways_use_spike': True, 'sideways_rsi_required': True}.
[I 2025-09-01 13:26:35,900] Trial 162 finished with values: [-1000000000.0, 1000000000.0] and parameters: {'p_sma': 52, 'p_std': 6, 'p_atr': 28, 'p_adx': 15, 'rsi_period': 70, 'ema1': 20, 'ema2': 18, 'slip_atr_k': 0.11999344045634758, 'slip_spread_k': 0.35996053342387774, 'spread_hl_frac': 0.009976603237468453, 'bb_std_mult': 1.9464135702329044, 'rsi_os': 41, 'rsi_ob': 63, 'vol_spike': 0.2058467856778718, 'adx_thresh': 11.034341241536232, 'atr_min_pct': 0.0033739981159632004, 'atr_max_pct': 0.018192058572891735, 'tp_mult': 2.270632612342185, 'tsl_mult': 0.21848482348231535, 'strategy': 'breakout', 'time_stop': 226, 'use_sma': True, 'use_atr': True, 'use_adx': False, 'use_ema': True, 'use_spike': True, 'rsi_required': True, 'edge_k': 0.3535291750002502, 'edge_cap': 0.7605321267264119, 'bull_strategy': 'breakout', 'bull_bb_std_mult': 3.159202460498957, 'bull_rsi_os': 7, 'bull_rsi_ob': 84, 'bull_adx_thresh': 7.023539442340503, 'bull_atr_min_pct': 0.015769366863872324, 'bull_atr_max_pct': 0.013825815022336433, 'bull_tp_mult': 1.9375531635725813, 'bull_tsl_mult': 0.36383515466268346, 'bull_time_stop': 35, 'bull_use_sma': False, 'bull_use_ema': True, 'bull_use_atr': True, 'bull_use_adx': True, 'bull_use_spike': True, 'bull_rsi_required': True, 'bear_strategy': 'mean_reversion', 'bear_bb_std_mult': 0.5058569966052368, 'bear_rsi_os': 45, 'bear_rsi_ob': 71, 'bear_adx_thresh': 24.56757404680792, 'bear_atr_min_pct': 0.001738425898833204, 'bear_atr_max_pct': 0.09615871661524525, 'bear_tp_mult': 1.3549563766486385, 'bear_tsl_mult': 0.9935552686948266, 'bear_time_stop': 112, 'bear_use_sma': False, 'bear_use_ema': False, 'bear_use_atr': True, 'bear_use_adx': True, 'bear_use_spike': False, 'bear_rsi_required': True, 'sideways_strategy': 'mean_reversion', 'sideways_bb_std_mult': 2.760946554735286, 'sideways_rsi_os': 31, 'sideways_rsi_ob': 94, 'sideways_adx_thresh': 12.727907163993102, 'sideways_atr_min_pct': 0.008011463295235343, 'sideways_atr_max_pct': 0.11471012649507405, 'sideways_tp_mult': 2.7879950611393727, 'sideways_tsl_mult': 0.4363508204599055, 'sideways_time_stop': 9, 'sideways_use_sma': True, 'sideways_use_ema': False, 'sideways_use_atr': True, 'sideways_use_adx': False, 'sideways_use_spike': False, 'sideways_rsi_required': False}.
[I 2025-09-01 13:26:37,277] Trial 161 finished with values: [-1000000000.0, 1000000000.0] and parameters: {'p_sma': 54, 'p_std': 44, 'p_atr': 28, 'p_adx': 16, 'rsi_period': 11, 'ema1': 20, 'ema2': 59, 'slip_atr_k': 0.23526925937272714, 'slip_spread_k': 0.9693626895051499, 'spread_hl_frac': 0.03748732704405569, 'bb_std_mult': 2.3109163959557373, 'rsi_os': 32, 'rsi_ob': 50, 'vol_spike': 0.20815541454381067, 'adx_thresh': 10.423267634160958, 'atr_min_pct': 0.0038416340204151384, 'atr_max_pct': 0.015888555787662212, 'tp_mult': 2.4431150332323988, 'tsl_mult': 0.21863003241793877, 'strategy': 'breakout', 'time_stop': 89, 'use_sma': False, 'use_atr': True, 'use_adx': False, 'use_ema': False, 'use_spike': True, 'rsi_required': True, 'edge_k': 0.9532086138024604, 'edge_cap': 0.8583524445762512, 'bull_strategy': 'breakout', 'bull_bb_std_mult': 3.183151664406405, 'bull_rsi_os': 7, 'bull_rsi_ob': 60, 'bull_adx_thresh': 25.15925583431862, 'bull_atr_min_pct': 0.015727009454214454, 'bull_atr_max_pct': 0.01416854634852775, 'bull_tp_mult': 2.052624815838719, 'bull_tsl_mult': 0.365919932837966, 'bull_time_stop': 43, 'bull_use_sma': True, 'bull_use_ema': True, 'bull_use_atr': True, 'bull_use_adx': True, 'bull_use_spike': True, 'bull_rsi_required': True, 'bear_strategy': 'mean_reversion', 'bear_bb_std_mult': 3.280791138494145, 'bear_rsi_os': 8, 'bear_rsi_ob': 68, 'bear_adx_thresh': 33.865894288854165, 'bear_atr_min_pct': 0.02166681712274313, 'bear_atr_max_pct': 0.09644671968040727, 'bear_tp_mult': 2.080040876589003, 'bear_tsl_mult': 0.5769344213274303, 'bear_time_stop': 257, 'bear_use_sma': False, 'bear_use_ema': False, 'bear_use_atr': True, 'bear_use_adx': True, 'bear_use_spike': False, 'bear_rsi_required': True, 'sideways_strategy': 'mean_reversion', 'sideways_bb_std_mult': 0.536832924721472, 'sideways_rsi_os': 16, 'sideways_rsi_ob': 95, 'sideways_adx_thresh': 12.857710504747507, 'sideways_atr_min_pct': 0.019461539239501575, 'sideways_atr_max_pct': 0.11562329509050748, 'sideways_tp_mult': 2.781037910644311, 'sideways_tsl_mult': 0.4249315745090708, 'sideways_time_stop': 10, 'sideways_use_sma': True, 'sideways_use_ema': False, 'sideways_use_atr': True, 'sideways_use_adx': False, 'sideways_use_spike': True, 'sideways_rsi_required': False}.
[I 2025-09-01 13:26:37,932] Trial 159 finished with values: [-1000000000.0, 1000000000.0] and parameters: {'p_sma': 54, 'p_std': 47, 'p_atr': 28, 'p_adx': 15, 'rsi_period': 70, 'ema1': 12, 'ema2': 58, 'slip_atr_k': 0.11164473749916552, 'slip_spread_k': 0.28474502700924964, 'spread_hl_frac': 0.010136604385212238, 'bb_std_mult': 2.045581162721353, 'rsi_os': 36, 'rsi_ob': 94, 'vol_spike': 0.20973898694419985, 'adx_thresh': 10.69424261054941, 'atr_min_pct': 0.004730476330597173, 'atr_max_pct': 0.034508390961308325, 'tp_mult': 2.1893787224683536, 'tsl_mult': 0.39466733443709207, 'strategy': 'breakout', 'time_stop': 130, 'use_sma': False, 'use_atr': True, 'use_adx': False, 'use_ema': False, 'use_spike': True, 'rsi_required': True, 'edge_k': 0.9460275584185069, 'edge_cap': 0.6954504981339178, 'bull_strategy': 'mean_reversion', 'bull_bb_std_mult': 3.1292909854079802, 'bull_rsi_os': 7, 'bull_rsi_ob': 57, 'bull_adx_thresh': 15.047092832685793, 'bull_atr_min_pct': 0.0029214390252435417, 'bull_atr_max_pct': 0.013634745508694916, 'bull_tp_mult': 1.9266717932056987, 'bull_tsl_mult': 0.4061304367215153, 'bull_time_stop': 289, 'bull_use_sma': False, 'bull_use_ema': True, 'bull_use_atr': True, 'bull_use_adx': True, 'bull_use_spike': False, 'bull_rsi_required': True, 'bear_strategy': 'breakout', 'bear_bb_std_mult': 2.423844187731271, 'bear_rsi_os': 46, 'bear_rsi_ob': 68, 'bear_adx_thresh': 25.322548974785928, 'bear_atr_min_pct': 0.022585874109865123, 'bear_atr_max_pct': 0.040443920121719046, 'bear_tp_mult': 2.552571103060214, 'bear_tsl_mult': 0.5593470277776005, 'bear_time_stop': 110, 'bear_use_sma': False, 'bear_use_ema': False, 'bear_use_atr': True, 'bear_use_adx': True, 'bear_use_spike': True, 'bear_rsi_required': True, 'sideways_strategy': 'mean_reversion', 'sideways_bb_std_mult': 0.751841581087712, 'sideways_rsi_os': 26, 'sideways_rsi_ob': 94, 'sideways_adx_thresh': 27.610643817736282, 'sideways_atr_min_pct': 0.019592143457408916, 'sideways_atr_max_pct': 0.11845525446198027, 'sideways_tp_mult': 1.7025154630851582, 'sideways_tsl_mult': 0.4266742682701852, 'sideways_time_stop': 23, 'sideways_use_sma': True, 'sideways_use_ema': False, 'sideways_use_atr': False, 'sideways_use_adx': False, 'sideways_use_spike': True, 'sideways_rsi_required': False}.
