[I 2025-09-01 14:12:29,784] Trial 468 finished with values: [-1000000000.0, 1000000000.0] and parameters: {'p_sma': 24, 'p_std': 51, 'p_atr': 26, 'p_adx': 26, 'rsi_period': 68, 'ema1': 14, 'ema2': 17, 'slip_atr_k': 0.050938587363755394, 'slip_spread_k': 0.11879649050520735, 'spread_hl_frac': 0.004027712369004754, 'bb_std_mult': 1.7070892348030688, 'rsi_os': 11, 'rsi_ob': 86, 'vol_spike': 0.24517788080700556, 'adx_thresh': 26.039107482396055, 'atr_min_pct': 0.02369768462297147, 'atr_max_pct': 0.08378033687884258, 'tp_mult': 1.0974786434729578, 'tsl_mult': 0.7360203884804052, 'strategy': 'mean_reversion', 'time_stop': 243, 'use_sma': False, 'use_atr': False, 'use_adx': False, 'use_ema': True, 'use_spike': True, 'rsi_required': False, 'edge_k': 0.8330686221123942, 'edge_cap': 0.5837202322355789, 'bull_strategy': 'breakout', 'bull_bb_std_mult': 3.402938021173209, 'bull_rsi_os': 37, 'bull_rsi_ob': 51, 'bull_adx_thresh': 30.226914042132435, 'bull_atr_min_pct': 0.003104395703042264, 'bull_atr_max_pct': 0.010399995845588247, 'bull_tp_mult': 2.8400890932321072, 'bull_tsl_mult': 0.2459981571999763, 'bull_time_stop': 126, 'bull_use_sma': True, 'bull_use_ema': False, 'bull_use_atr': True, 'bull_use_adx': True, 'bull_use_spike': False, 'bull_rsi_required': True, 'bear_strategy': 'breakout', 'bear_bb_std_mult': 1.7061713680792046, 'bear_rsi_os': 36, 'bear_rsi_ob': 88, 'bear_adx_thresh': 12.430362008334466, 'bear_atr_min_pct': 0.0024512715800846375, 'bear_atr_max_pct': 0.14995700243665275, 'bear_tp_mult': 2.2845861891495396, 'bear_tsl_mult': 0.9976864106408636, 'bear_time_stop': 287, 'bear_use_sma': True, 'bear_use_ema': True, 'bear_use_atr': True, 'bear_use_adx': True, 'bear_use_spike': False, 'bear_rsi_required': True, 'sideways_strategy': 'breakout', 'sideways_bb_std_mult': 1.639081748140067, 'sideways_rsi_os': 35, 'sideways_rsi_ob': 69, 'sideways_adx_thresh': 5.47486208381113, 'sideways_atr_min_pct': 0.021320551089134346, 'sideways_atr_max_pct': 0.10601671461734556, 'sideways_tp_mult': 2.7793583155509562, 'sideways_tsl_mult': 0.11919947101339845, 'sideways_time_stop': 276, 'sideways_use_sma': True, 'sideways_use_ema': False, 'sideways_use_atr': True, 'sideways_use_adx': True, 'sideways_use_spike': False, 'sideways_rsi_required': True}.
[I 2025-09-01 14:12:30,792] Trial 469 finished with values: [-1000000000.0, 1000000000.0] and parameters: {'p_sma': 36, 'p_std': 47, 'p_atr': 25, 'p_adx': 23, 'rsi_period': 68, 'ema1': 20, 'ema2': 14, 'slip_atr_k': 0.007302848092712494, 'slip_spread_k': 0.11636819802217896, 'spread_hl_frac': 0.009501017107206087, 'bb_std_mult': 1.521025379730047, 'rsi_os': 40, 'rsi_ob': 59, 'vol_spike': 0.23984090722917836, 'adx_thresh': 25.178570450690216, 'atr_min_pct': 0.023728503157211606, 'atr_max_pct': 0.07945310704166147, 'tp_mult': 2.2414242595620695, 'tsl_mult': 0.7347456153539219, 'strategy': 'mean_reversion', 'time_stop': 34, 'use_sma': False, 'use_atr': False, 'use_adx': False, 'use_ema': True, 'use_spike': True, 'rsi_required': False, 'edge_k': 0.8498354634785361, 'edge_cap': 0.5506359188664531, 'bull_strategy': 'breakout', 'bull_bb_std_mult': 3.3685455587775457, 'bull_rsi_os': 37, 'bull_rsi_ob': 55, 'bull_adx_thresh': 30.193061300260656, 'bull_atr_min_pct': 0.003927359644962947, 'bull_atr_max_pct': 0.06367196012955506, 'bull_tp_mult': 2.8233418135521138, 'bull_tsl_mult': 0.07783778182738288, 'bull_time_stop': 104, 'bull_use_sma': True, 'bull_use_ema': True, 'bull_use_atr': True, 'bull_use_adx': True, 'bull_use_spike': True, 'bull_rsi_required': True, 'bear_strategy': 'breakout', 'bear_bb_std_mult': 3.431274030733842, 'bear_rsi_os': 22, 'bear_rsi_ob': 53, 'bear_adx_thresh': 25.87348429803428, 'bear_atr_min_pct': 0.01730696882634919, 'bear_atr_max_pct': 0.02517644992869896, 'bear_tp_mult': 2.1922121311798364, 'bear_tsl_mult': 0.6152801527248375, 'bear_time_stop': 198, 'bear_use_sma': True, 'bear_use_ema': True, 'bear_use_atr': True, 'bear_use_adx': True, 'bear_use_spike': False, 'bear_rsi_required': True, 'sideways_strategy': 'breakout', 'sideways_bb_std_mult': 1.6559373066828806, 'sideways_rsi_os': 15, 'sideways_rsi_ob': 87, 'sideways_adx_thresh': 33.55704572687185, 'sideways_atr_min_pct': 0.01950103522352614, 'sideways_atr_max_pct': 0.014250563610180678, 'sideways_tp_mult': 1.6276047787798746, 'sideways_tsl_mult': 0.29838613710235357, 'sideways_time_stop': 179, 'sideways_use_sma': True, 'sideways_use_ema': False, 'sideways_use_atr': True, 'sideways_use_adx': True, 'sideways_use_spike': False, 'sideways_rsi_required': True}.
[I 2025-09-01 14:13:11,260] Trial 471 finished with values: [-1000000000.0, 1000000000.0] and parameters: {'p_sma': 28, 'p_std': 51, 'p_atr': 25, 'p_adx': 13, 'rsi_period': 16, 'ema1': 21, 'ema2': 55, 'slip_atr_k': 0.12069490757835721, 'slip_spread_k': 0.5835318315837354, 'spread_hl_frac': 0.005773069216476379, 'bb_std_mult': 1.8397210601100336, 'rsi_os': 38, 'rsi_ob': 83, 'vol_spike': 0.10166570761649033, 'adx_thresh': 25.045312901358834, 'atr_min_pct': 0.028693513773203602, 'atr_max_pct': 0.09705732898705051, 'tp_mult': 2.234259027076175, 'tsl_mult': 0.8046204894233181, 'strategy': 'breakout', 'time_stop': 255, 'use_sma': False, 'use_atr': False, 'use_adx': True, 'use_ema': False, 'use_spike': False, 'rsi_required': False, 'edge_k': 0.8560962843054829, 'edge_cap': 0.31209930370354994, 'bull_strategy': 'mean_reversion', 'bull_bb_std_mult': 2.599808003829188, 'bull_rsi_os': 36, 'bull_rsi_ob': 59, 'bull_adx_thresh': 30.20346903296558, 'bull_atr_min_pct': 0.021942688209269107, 'bull_atr_max_pct': 0.010834558940518574, 'bull_tp_mult': 1.011834681926218, 'bull_tsl_mult': 0.06462070317480656, 'bull_time_stop': 103, 'bull_use_sma': True, 'bull_use_ema': False, 'bull_use_atr': False, 'bull_use_adx': True, 'bull_use_spike': True, 'bull_rsi_required': True, 'bear_strategy': 'mean_reversion', 'bear_bb_std_mult': 3.4530872035066404, 'bear_rsi_os': 32, 'bear_rsi_ob': 53, 'bear_adx_thresh': 12.403911618177737, 'bear_atr_min_pct': 0.0031219363361131673, 'bear_atr_max_pct': 0.03942947795239816, 'bear_tp_mult': 2.1907897406071735, 'bear_tsl_mult': 0.19559834960350153, 'bear_time_stop': 300, 'bear_use_sma': False, 'bear_use_ema': True, 'bear_use_atr': False, 'bear_use_adx': False, 'bear_use_spike': False, 'bear_rsi_required': False, 'sideways_strategy': 'breakout', 'sideways_bb_std_mult': 0.5699874692631954, 'sideways_rsi_os': 51, 'sideways_rsi_ob': 85, 'sideways_adx_thresh': 7.8276009566319775, 'sideways_atr_min_pct': 0.027400028696395858, 'sideways_atr_max_pct': 0.04535367499734008, 'sideways_tp_mult': 2.4478354737173658, 'sideways_tsl_mult': 0.7813629979847438, 'sideways_time_stop': 168, 'sideways_use_sma': False, 'sideways_use_ema': False, 'sideways_use_atr': True, 'sideways_use_adx': True, 'sideways_use_spike': False, 'sideways_rsi_required': True}.
[I 2025-09-01 14:13:13,011] Trial 470 finished with values: [-1000000000.0, 1000000000.0] and parameters: {'p_sma': 36, 'p_std': 51, 'p_atr': 25, 'p_adx': 12, 'rsi_period': 15, 'ema1': 30, 'ema2': 50, 'slip_atr_k': 0.12279084489666163, 'slip_spread_k': 0.09636759346036793, 'spread_hl_frac': 0.005400460389418426, 'bb_std_mult': 1.5195761672080295, 'rsi_os': 46, 'rsi_ob': 81, 'vol_spike': 0.10143639995806845, 'adx_thresh': 23.109324441531133, 'atr_min_pct': 0.024608769988606807, 'atr_max_pct': 0.07962926250074992, 'tp_mult': 2.2585627109585213, 'tsl_mult': 0.7372693298560267, 'strategy': 'mean_reversion', 'time_stop': 241, 'use_sma': False, 'use_atr': False, 'use_adx': False, 'use_ema': False, 'use_spike': True, 'rsi_required': False, 'edge_k': 0.8272597470321088, 'edge_cap': 0.3756496450904606, 'bull_strategy': 'mean_reversion', 'bull_bb_std_mult': 3.40869453476367, 'bull_rsi_os': 26, 'bull_rsi_ob': 51, 'bull_adx_thresh': 30.110264757539134, 'bull_atr_min_pct': 0.02598312480270534, 'bull_atr_max_pct': 0.010348640557592301, 'bull_tp_mult': 2.8415114035737012, 'bull_tsl_mult': 0.960345878927438, 'bull_time_stop': 105, 'bull_use_sma': True, 'bull_use_ema': True, 'bull_use_atr': True, 'bull_use_adx': True, 'bull_use_spike': True, 'bull_rsi_required': True, 'bear_strategy': 'breakout', 'bear_bb_std_mult': 3.440796467043302, 'bear_rsi_os': 21, 'bear_rsi_ob': 84, 'bear_adx_thresh': 12.728882313306881, 'bear_atr_min_pct': 0.004245512812227774, 'bear_atr_max_pct': 0.03961809634998709, 'bear_tp_mult': 2.2876341365511426, 'bear_tsl_mult': 0.024653896520885357, 'bear_time_stop': 227, 'bear_use_sma': False, 'bear_use_ema': True, 'bear_use_atr': True, 'bear_use_adx': True, 'bear_use_spike': False, 'bear_rsi_required': True, 'sideways_strategy': 'breakout', 'sideways_bb_std_mult': 3.314808931719333, 'sideways_rsi_os': 15, 'sideways_rsi_ob': 69, 'sideways_adx_thresh': 6.55185674564273, 'sideways_atr_min_pct': 0.019642299474815824, 'sideways_atr_max_pct': 0.08748918553562539, 'sideways_tp_mult': 2.7745433056782387, 'sideways_tsl_mult': 0.29997613253444927, 'sideways_time_stop': 170, 'sideways_use_sma': True, 'sideways_use_ema': False, 'sideways_use_atr': True, 'sideways_use_adx': True, 'sideways_use_spike': False, 'sideways_rsi_required': True}.
[I 2025-09-01 14:13:15,497] Trial 473 finished with values: [-1000000000.0, 1000000000.0] and parameters: {'p_sma': 35, 'p_std': 44, 'p_atr': 10, 'p_adx': 8, 'rsi_period': 65, 'ema1': 11, 'ema2': 30, 'slip_atr_k': 0.015372458358274105, 'slip_spread_k': 0.0914450844425944, 'spread_hl_frac': 0.005674886719581815, 'bb_std_mult': 2.84235454702306, 'rsi_os': 38, 'rsi_ob': 70, 'vol_spike': 0.2265580799617984, 'adx_thresh': 30.824924697523436, 'atr_min_pct': 0.0269660991733954, 'atr_max_pct': 0.14210361775463187, 'tp_mult': 2.120149610012407, 'tsl_mult': 0.30296711929003783, 'strategy': 'breakout', 'time_stop': 197, 'use_sma': True, 'use_atr': True, 'use_adx': True, 'use_ema': False, 'use_spike': False, 'rsi_required': False, 'edge_k': 0.9174744303779108, 'edge_cap': 0.2871933947599078, 'bull_strategy': 'mean_reversion', 'bull_bb_std_mult': 3.210870911383831, 'bull_rsi_os': 41, 'bull_rsi_ob': 58, 'bull_adx_thresh': 29.593094688385378, 'bull_atr_min_pct': 0.004369599739617083, 'bull_atr_max_pct': 0.12883966756887713, 'bull_tp_mult': 1.735861939864079, 'bull_tsl_mult': 0.9626783416744914, 'bull_time_stop': 90, 'bull_use_sma': True, 'bull_use_ema': True, 'bull_use_atr': False, 'bull_use_adx': False, 'bull_use_spike': True, 'bull_rsi_required': True, 'bear_strategy': 'mean_reversion', 'bear_bb_std_mult': 3.5210953577453767, 'bear_rsi_os': 33, 'bear_rsi_ob': 57, 'bear_adx_thresh': 11.782975610782335, 'bear_atr_min_pct': 0.009160671316892778, 'bear_atr_max_pct': 0.020069397913029065, 'bear_tp_mult': 2.1468448030773932, 'bear_tsl_mult': 0.19504732107495837, 'bear_time_stop': 100, 'bear_use_sma': False, 'bear_use_ema': True, 'bear_use_atr': False, 'bear_use_adx': False, 'bear_use_spike': True, 'bear_rsi_required': False, 'sideways_strategy': 'breakout', 'sideways_bb_std_mult': 2.9511928133869874, 'sideways_rsi_os': 12, 'sideways_rsi_ob': 68, 'sideways_adx_thresh': 7.919791099715816, 'sideways_atr_min_pct': 0.019998914861913977, 'sideways_atr_max_pct': 0.07896612941622304, 'sideways_tp_mult': 2.1599625992201563, 'sideways_tsl_mult': 0.4419675837228781, 'sideways_time_stop': 169, 'sideways_use_sma': False, 'sideways_use_ema': False, 'sideways_use_atr': False, 'sideways_use_adx': True, 'sideways_use_spike': False, 'sideways_rsi_required': True}.
[I 2025-09-01 14:13:15,755] Trial 472 finished with values: [-1000000000.0, 1000000000.0] and parameters: {'p_sma': 35, 'p_std': 45, 'p_atr': 10, 'p_adx': 8, 'rsi_period': 77, 'ema1': 18, 'ema2': 19, 'slip_atr_k': 0.12241802616252807, 'slip_spread_k': 0.08547048303045132, 'spread_hl_frac': 0.033020752007514434, 'bb_std_mult': 1.8370632144705996, 'rsi_os': 40, 'rsi_ob': 81, 'vol_spike': 0.10106233149713609, 'adx_thresh': 25.125247834544226, 'atr_min_pct': 0.027136924774565165, 'atr_max_pct': 0.07930854058301232, 'tp_mult': 2.4922072460086535, 'tsl_mult': 0.8101811339891436, 'strategy': 'breakout', 'time_stop': 257, 'use_sma': False, 'use_atr': False, 'use_adx': True, 'use_ema': False, 'use_spike': False, 'rsi_required': False, 'edge_k': 0.8690932471140997, 'edge_cap': 0.8593138387784611, 'bull_strategy': 'mean_reversion', 'bull_bb_std_mult': 3.2142544357769673, 'bull_rsi_os': 31, 'bull_rsi_ob': 58, 'bull_adx_thresh': 20.04813116091736, 'bull_atr_min_pct': 0.021746926006516922, 'bull_atr_max_pct': 0.06458714897829049, 'bull_tp_mult': 2.830211597143158, 'bull_tsl_mult': 0.079867999971519, 'bull_time_stop': 90, 'bull_use_sma': True, 'bull_use_ema': True, 'bull_use_atr': False, 'bull_use_adx': False, 'bull_use_spike': True, 'bull_rsi_required': True, 'bear_strategy': 'mean_reversion', 'bear_bb_std_mult': 3.544787606004918, 'bear_rsi_os': 51, 'bear_rsi_ob': 90, 'bear_adx_thresh': 14.397226079923016, 'bear_atr_min_pct': 0.01474280402998435, 'bear_atr_max_pct': 0.024190686968842495, 'bear_tp_mult': 2.2036802220246807, 'bear_tsl_mult': 0.024688531334338293, 'bear_time_stop': 209, 'bear_use_sma': False, 'bear_use_ema': True, 'bear_use_atr': False, 'bear_use_adx': False, 'bear_use_spike': False, 'bear_rsi_required': False, 'sideways_strategy': 'breakout', 'sideways_bb_std_mult': 3.469108581357248, 'sideways_rsi_os': 49, 'sideways_rsi_ob': 89, 'sideways_adx_thresh': 6.419849645930374, 'sideways_atr_min_pct': 0.02734363522119404, 'sideways_atr_max_pct': 0.06518816715984611, 'sideways_tp_mult': 2.5958768259731575, 'sideways_tsl_mult': 0.4398893848581761, 'sideways_time_stop': 180, 'sideways_use_sma': False, 'sideways_use_ema': False, 'sideways_use_atr': True, 'sideways_use_adx': True, 'sideways_use_spike': False, 'sideways_rsi_required': True}.
[I 2025-09-01 14:13:58,332] Trial 474 finished with values: [-1000000000.0, 1000000000.0] and parameters: {'p_sma': 21, 'p_std': 45, 'p_atr': 10, 'p_adx': 28, 'rsi_period': 66, 'ema1': 11, 'ema2': 19, 'slip_atr_k': 0.01385648488292239, 'slip_spread_k': 0.09184988361927841, 'spread_hl_frac': 0.023870989643808835, 'bb_std_mult': 2.2371568801908386, 'rsi_os': 41, 'rsi_ob': 70, 'vol_spike': 0.22700944489376487, 'adx_thresh': 16.631941892954487, 'atr_min_pct': 0.026932743222283166, 'atr_max_pct': 0.13672554925051136, 'tp_mult': 1.037362434192861, 'tsl_mult': 0.6683998996008195, 'strategy': 'mean_reversion', 'time_stop': 45, 'use_sma': True, 'use_atr': True, 'use_adx': False, 'use_ema': False, 'use_spike': False, 'rsi_required': False, 'edge_k': 0.9401402013972567, 'edge_cap': 0.27358628195774537, 'bull_strategy': 'mean_reversion', 'bull_bb_std_mult': 3.2399064883899125, 'bull_rsi_os': 34, 'bull_rsi_ob': 58, 'bull_adx_thresh': 29.74127208295658, 'bull_atr_min_pct': 0.004466765283054322, 'bull_atr_max_pct': 0.02157522494571163, 'bull_tp_mult': 2.8609738846077626, 'bull_tsl_mult': 0.40514953564612943, 'bull_time_stop': 90, 'bull_use_sma': True, 'bull_use_ema': True, 'bull_use_atr': True, 'bull_use_adx': False, 'bull_use_spike': False, 'bull_rsi_required': True, 'bear_strategy': 'breakout', 'bear_bb_std_mult': 3.549129296406601, 'bear_rsi_os': 19, 'bear_rsi_ob': 90, 'bear_adx_thresh': 11.78863264707559, 'bear_atr_min_pct': 0.011912142727940164, 'bear_atr_max_pct': 0.046300246935127194, 'bear_tp_mult': 2.2479638354424747, 'bear_tsl_mult': 0.11907633467113438, 'bear_time_stop': 160, 'bear_use_sma': False, 'bear_use_ema': True, 'bear_use_atr': True, 'bear_use_adx': True, 'bear_use_spike': True, 'bear_rsi_required': False, 'sideways_strategy': 'breakout', 'sideways_bb_std_mult': 2.2258952785804476, 'sideways_rsi_os': 45, 'sideways_rsi_ob': 68, 'sideways_adx_thresh': 6.199717474066132, 'sideways_atr_min_pct': 0.01993172990970695, 'sideways_atr_max_pct': 0.06524046112280597, 'sideways_tp_mult': 2.1746995597175136, 'sideways_tsl_mult': 0.44148024692690657, 'sideways_time_stop': 172, 'sideways_use_sma': False, 'sideways_use_ema': False, 'sideways_use_atr': False, 'sideways_use_adx': True, 'sideways_use_spike': True, 'sideways_rsi_required': True}.
[I 2025-09-01 14:13:59,630] Trial 475 finished with values: [-1000000000.0, 1000000000.0] and parameters: {'p_sma': 35, 'p_std': 44, 'p_atr': 20, 'p_adx': 22, 'rsi_period': 22, 'ema1': 11, 'ema2': 19, 'slip_atr_k': 0.01248397340146655, 'slip_spread_k': 0.15994617273860412, 'spread_hl_frac': 0.007149430214045653, 'bb_std_mult': 1.8858668748645262, 'rsi_os': 38, 'rsi_ob': 70, 'vol_spike': 0.22729575393258208, 'adx_thresh': 13.857543072637654, 'atr_min_pct': 0.02708313968814435, 'atr_max_pct': 0.13721442672430703, 'tp_mult': 1.7107637684154042, 'tsl_mult': 0.6735741493984825, 'strategy': 'breakout', 'time_stop': 151, 'use_sma': True, 'use_atr': True, 'use_adx': True, 'use_ema': True, 'use_spike': False, 'rsi_required': False, 'edge_k': 0.9248961271704771, 'edge_cap': 0.3547279079454085, 'bull_strategy': 'breakout', 'bull_bb_std_mult': 0.9848416024277611, 'bull_rsi_os': 28, 'bull_rsi_ob': 54, 'bull_adx_thresh': 11.921646732769632, 'bull_atr_min_pct': 0.004456701876633695, 'bull_atr_max_pct': 0.022516639538936976, 'bull_tp_mult': 1.5519899104891552, 'bull_tsl_mult': 0.410076992982899, 'bull_time_stop': 91, 'bull_use_sma': True, 'bull_use_ema': True, 'bull_use_atr': False, 'bull_use_adx': False, 'bull_use_spike': False, 'bull_rsi_required': True, 'bear_strategy': 'mean_reversion', 'bear_bb_std_mult': 3.5416486294308354, 'bear_rsi_os': 33, 'bear_rsi_ob': 90, 'bear_adx_thresh': 11.647780760547791, 'bear_atr_min_pct': 0.007695558679320111, 'bear_atr_max_pct': 0.055781202008118855, 'bear_tp_mult': 2.4096541849085593, 'bear_tsl_mult': 0.9437020953423525, 'bear_time_stop': 158, 'bear_use_sma': True, 'bear_use_ema': True, 'bear_use_atr': False, 'bear_use_adx': False, 'bear_use_spike': True, 'bear_rsi_required': False, 'sideways_strategy': 'breakout', 'sideways_bb_std_mult': 2.2363762960250244, 'sideways_rsi_os': 49, 'sideways_rsi_ob': 68, 'sideways_adx_thresh': 6.4028482369986, 'sideways_atr_min_pct': 0.00681068162819887, 'sideways_atr_max_pct': 0.0652289633181966, 'sideways_tp_mult': 1.345720001719902, 'sideways_tsl_mult': 0.4426876096168517, 'sideways_time_stop': 175, 'sideways_use_sma': False, 'sideways_use_ema': False, 'sideways_use_atr': False, 'sideways_use_adx': True, 'sideways_use_spike': True, 'sideways_rsi_required': True}.
[I 2025-09-01 14:14:00,066] Trial 476 finished with values: [-1000000000.0, 1000000000.0] and parameters: {'p_sma': 18, 'p_std': 5, 'p_atr': 25, 'p_adx': 28, 'rsi_period': 66, 'ema1': 12, 'ema2': 19, 'slip_atr_k': 0.16545165304936474, 'slip_spread_k': 0.16423524437811732, 'spread_hl_frac': 0.021934726538356222, 'bb_std_mult': 1.8865799681223165, 'rsi_os': 41, 'rsi_ob': 84, 'vol_spike': 0.23304790231360753, 'adx_thresh': 24.850159231039317, 'atr_min_pct': 0.02871903327228094, 'atr_max_pct': 0.13785692174962877, 'tp_mult': 2.941357079296355, 'tsl_mult': 0.6705606783184936, 'strategy': 'mean_reversion', 'time_stop': 153, 'use_sma': True, 'use_atr': False, 'use_adx': False, 'use_ema': True, 'use_spike': True, 'rsi_required': True, 'edge_k': 0.9476901291831784, 'edge_cap': 0.319562906207755, 'bull_strategy': 'breakout', 'bull_bb_std_mult': 1.9297274548805539, 'bull_rsi_os': 34, 'bull_rsi_ob': 54, 'bull_adx_thresh': 30.86886550908089, 'bull_atr_min_pct': 0.02041061314838409, 'bull_atr_max_pct': 0.09302217980304789, 'bull_tp_mult': 1.5316191486644566, 'bull_tsl_mult': 0.6581801659285975, 'bull_time_stop': 95, 'bull_use_sma': False, 'bull_use_ema': True, 'bull_use_atr': True, 'bull_use_adx': False, 'bull_use_spike': False, 'bull_rsi_required': False, 'bear_strategy': 'breakout', 'bear_bb_std_mult': 3.544581569584134, 'bear_rsi_os': 33, 'bear_rsi_ob': 51, 'bear_adx_thresh': 32.10752003799206, 'bear_atr_min_pct': 0.014827584632090487, 'bear_atr_max_pct': 0.04633121542622287, 'bear_tp_mult': 2.2433437204060156, 'bear_tsl_mult': 0.11445857114452503, 'bear_time_stop': 214, 'bear_use_sma': True, 'bear_use_ema': False, 'bear_use_atr': True, 'bear_use_adx': True, 'bear_use_spike': False, 'bear_rsi_required': True, 'sideways_strategy': 'breakout', 'sideways_bb_std_mult': 3.1255984796277025, 'sideways_rsi_os': 49, 'sideways_rsi_ob': 66, 'sideways_adx_thresh': 27.024672989653432, 'sideways_atr_min_pct': 0.018317996700032032, 'sideways_atr_max_pct': 0.07146552247254839, 'sideways_tp_mult': 1.2987273804483261, 'sideways_tsl_mult': 0.18829516995037693, 'sideways_time_stop': 121, 'sideways_use_sma': True, 'sideways_use_ema': True, 'sideways_use_atr': True, 'sideways_use_adx': False, 'sideways_use_spike': True, 'sideways_rsi_required': True}.
