[I 2025-09-01 13:19:15,468] Trial 114 finished with values: [-1000000000.0, 1000000000.0] and parameters: {'p_sma': 50, 'p_std': 47, 'p_atr': 20, 'p_adx': 18, 'rsi_period': 71, 'ema1': 28, 'ema2': 58, 'slip_atr_k': 0.05896138107869374, 'slip_spread_k': 0.38675167645741343, 'spread_hl_frac': 0.01028452093753525, 'bb_std_mult': 1.8645034836197258, 'rsi_os': 35, 'rsi_ob': 92, 'vol_spike': 0.2322730571530779, 'adx_thresh': 9.768179130911024, 'atr_min_pct': 0.008865398016502974, 'atr_max_pct': 0.028450306763128, 'tp_mult': 1.3815257429566643, 'tsl_mult': 0.18911739358044352, 'strategy': 'breakout', 'time_stop': 105, 'use_sma': True, 'use_atr': True, 'use_adx': True, 'use_ema': True, 'use_spike': False, 'rsi_required': False, 'edge_k': 0.42832201973762396, 'edge_cap': 0.8027694437879704, 'bull_strategy': 'breakout', 'bull_bb_std_mult': 2.972593047276033, 'bull_rsi_os': 48, 'bull_rsi_ob': 55, 'bull_adx_thresh': 29.479940422534057, 'bull_atr_min_pct': 0.0016650872626980222, 'bull_atr_max_pct': 0.10402524180988798, 'bull_tp_mult': 2.020653607536894, 'bull_tsl_mult': 0.4242755434025064, 'bull_time_stop': 39, 'bull_use_sma': False, 'bull_use_ema': True, 'bull_use_atr': True, 'bull_use_adx': True, 'bull_use_spike': False, 'bull_rsi_required': True, 'bear_strategy': 'breakout', 'bear_bb_std_mult': 0.9667913969938191, 'bear_rsi_os': 7, 'bear_rsi_ob': 74, 'bear_adx_thresh': 34.928774367559775, 'bear_atr_min_pct': 0.022514303395154835, 'bear_atr_max_pct': 0.08872516501053598, 'bear_tp_mult': 2.538262116391781, 'bear_tsl_mult': 0.4825523038195384, 'bear_time_stop': 266, 'bear_use_sma': False, 'bear_use_ema': False, 'bear_use_atr': False, 'bear_use_adx': True, 'bear_use_spike': False, 'bear_rsi_required': False, 'sideways_strategy': 'mean_reversion', 'sideways_bb_std_mult': 0.984505643163875, 'sideways_rsi_os': 29, 'sideways_rsi_ob': 91, 'sideways_adx_thresh': 12.722794692742141, 'sideways_atr_min_pct': 0.010892686126243443, 'sideways_atr_max_pct': 0.13383686239798254, 'sideways_tp_mult': 1.7584140198313076, 'sideways_tsl_mult': 0.44993356392875805, 'sideways_time_stop': 13, 'sideways_use_sma': False, 'sideways_use_ema': False, 'sideways_use_atr': True, 'sideways_use_adx': False, 'sideways_use_spike': True, 'sideways_rsi_required': False}.
[I 2025-09-01 13:19:55,459] Trial 118 finished with values: [-0.021559488601650578, 0.02130297661999098] and parameters: {'p_sma': 58, 'p_std': 47, 'p_atr': 29, 'p_adx': 18, 'rsi_period': 73, 'ema1': 20, 'ema2': 60, 'slip_atr_k': 0.1062531749366699, 'slip_spread_k': 0.44557604116890964, 'spread_hl_frac': 0.0072172476016918955, 'bb_std_mult': 1.7627208153955125, 'rsi_os': 39, 'rsi_ob': 87, 'vol_spike': 0.25559176420657376, 'adx_thresh': 12.07969171744636, 'atr_min_pct': 0.011648958372544916, 'atr_max_pct': 0.0532871893145295, 'tp_mult': 1.4414468034083343, 'tsl_mult': 0.040861252619609545, 'strategy': 'breakout', 'time_stop': 93, 'use_sma': True, 'use_atr': True, 'use_adx': False, 'use_ema': True, 'use_spike': False, 'rsi_required': True, 'edge_k': 0.4057476033051199, 'edge_cap': 0.8306180292590644, 'bull_strategy': 'breakout', 'bull_bb_std_mult': 3.0872222973408867, 'bull_rsi_os': 43, 'bull_rsi_ob': 55, 'bull_adx_thresh': 24.158680233819883, 'bull_atr_min_pct': 0.0004007383110754745, 'bull_atr_max_pct': 0.01855542666455301, 'bull_tp_mult': 1.975235500658389, 'bull_tsl_mult': 0.255325774940242, 'bull_time_stop': 25, 'bull_use_sma': True, 'bull_use_ema': True, 'bull_use_atr': True, 'bull_use_adx': True, 'bull_use_spike': False, 'bull_rsi_required': True, 'bear_strategy': 'mean_reversion', 'bear_bb_std_mult': 1.0495702148919595, 'bear_rsi_os': 10, 'bear_rsi_ob': 73, 'bear_adx_thresh': 11.110219918289008, 'bear_atr_min_pct': 0.01881829644602468, 'bear_atr_max_pct': 0.08738510251641154, 'bear_tp_mult': 2.549195810209299, 'bear_tsl_mult': 0.6686520253155297, 'bear_time_stop': 237, 'bear_use_sma': True, 'bear_use_ema': False, 'bear_use_atr': True, 'bear_use_adx': True, 'bear_use_spike': True, 'bear_rsi_required': False, 'sideways_strategy': 'breakout', 'sideways_bb_std_mult': 1.016775313134112, 'sideways_rsi_os': 29, 'sideways_rsi_ob': 90, 'sideways_adx_thresh': 15.357825926146672, 'sideways_atr_min_pct': 0.011183425467165794, 'sideways_atr_max_pct': 0.11718372422588831, 'sideways_tp_mult': 1.7783035319041307, 'sideways_tsl_mult': 0.490543316103294, 'sideways_time_stop': 14, 'sideways_use_sma': False, 'sideways_use_ema': False, 'sideways_use_atr': False, 'sideways_use_adx': True, 'sideways_use_spike': True, 'sideways_rsi_required': False}.
[I 2025-09-01 13:19:57,814] Trial 121 finished with values: [-1000000000.0, 1000000000.0] and parameters: {'p_sma': 47, 'p_std': 42, 'p_atr': 13, 'p_adx': 21, 'rsi_period': 81, 'ema1': 20, 'ema2': 60, 'slip_atr_k': 0.07879945937454035, 'slip_spread_k': 0.4339359681332966, 'spread_hl_frac': 0.012161394266386148, 'bb_std_mult': 1.746316856247574, 'rsi_os': 31, 'rsi_ob': 87, 'vol_spike': 0.20438554087950264, 'adx_thresh': 7.00992452014191, 'atr_min_pct': 0.011574450884758183, 'atr_max_pct': 0.02344838751066705, 'tp_mult': 1.6157374111292662, 'tsl_mult': 0.0008860770010593044, 'strategy': 'breakout', 'time_stop': 107, 'use_sma': False, 'use_atr': False, 'use_adx': False, 'use_ema': True, 'use_spike': True, 'rsi_required': True, 'edge_k': 0.3682838396335707, 'edge_cap': 0.7853494894191019, 'bull_strategy': 'mean_reversion', 'bull_bb_std_mult': 0.9636165306845461, 'bull_rsi_os': 24, 'bull_rsi_ob': 93, 'bull_adx_thresh': 33.72763104908115, 'bull_atr_min_pct': 0.024045790916218272, 'bull_atr_max_pct': 0.019372029836379638, 'bull_tp_mult': 1.8323701558245424, 'bull_tsl_mult': 0.3839083312566012, 'bull_time_stop': 23, 'bull_use_sma': True, 'bull_use_ema': True, 'bull_use_atr': True, 'bull_use_adx': True, 'bull_use_spike': False, 'bull_rsi_required': True, 'bear_strategy': 'mean_reversion', 'bear_bb_std_mult': 0.7906325828077382, 'bear_rsi_os': 14, 'bear_rsi_ob': 69, 'bear_adx_thresh': 15.296387744835402, 'bear_atr_min_pct': 0.018523311066384267, 'bear_atr_max_pct': 0.058579533961243664, 'bear_tp_mult': 2.4726968019580475, 'bear_tsl_mult': 0.6631813303038232, 'bear_time_stop': 285, 'bear_use_sma': True, 'bear_use_ema': False, 'bear_use_atr': True, 'bear_use_adx': True, 'bear_use_spike': True, 'bear_rsi_required': True, 'sideways_strategy': 'breakout', 'sideways_bb_std_mult': 0.6374973226777719, 'sideways_rsi_os': 27, 'sideways_rsi_ob': 90, 'sideways_adx_thresh': 15.272423442233555, 'sideways_atr_min_pct': 0.00940999626109768, 'sideways_atr_max_pct': 0.1168984330833586, 'sideways_tp_mult': 2.8748325207671868, 'sideways_tsl_mult': 0.22416246921052208, 'sideways_time_stop': 15, 'sideways_use_sma': True, 'sideways_use_ema': True, 'sideways_use_atr': False, 'sideways_use_adx': True, 'sideways_use_spike': True, 'sideways_rsi_required': True}.
[I 2025-09-01 13:19:58,195] Trial 120 finished with values: [-1000000000.0, 1000000000.0] and parameters: {'p_sma': 46, 'p_std': 47, 'p_atr': 29, 'p_adx': 21, 'rsi_period': 78, 'ema1': 7, 'ema2': 60, 'slip_atr_k': 0.08111830638876684, 'slip_spread_k': 0.39663029839561387, 'spread_hl_frac': 0.011792028935398935, 'bb_std_mult': 1.7231724124967742, 'rsi_os': 39, 'rsi_ob': 87, 'vol_spike': 0.20204135195153367, 'adx_thresh': 8.218276366641652, 'atr_min_pct': 0.008118477515779349, 'atr_max_pct': 0.05167278767229888, 'tp_mult': 1.5254618667389175, 'tsl_mult': 0.1965665802311992, 'strategy': 'breakout', 'time_stop': 109, 'use_sma': False, 'use_atr': False, 'use_adx': True, 'use_ema': True, 'use_spike': True, 'rsi_required': False, 'edge_k': 0.36797090323573156, 'edge_cap': 0.7856549531456397, 'bull_strategy': 'mean_reversion', 'bull_bb_std_mult': 2.971759034204789, 'bull_rsi_os': 49, 'bull_rsi_ob': 57, 'bull_adx_thresh': 24.170362859976823, 'bull_atr_min_pct': 0.024196319431761516, 'bull_atr_max_pct': 0.14229976613900372, 'bull_tp_mult': 1.9526233905257546, 'bull_tsl_mult': 0.24780785733263, 'bull_time_stop': 27, 'bull_use_sma': False, 'bull_use_ema': True, 'bull_use_atr': True, 'bull_use_adx': True, 'bull_use_spike': False, 'bull_rsi_required': True, 'bear_strategy': 'breakout', 'bear_bb_std_mult': 1.0465450016754945, 'bear_rsi_os': 8, 'bear_rsi_ob': 71, 'bear_adx_thresh': 11.020582757286252, 'bear_atr_min_pct': 0.021241948810634476, 'bear_atr_max_pct': 0.08670007727913556, 'bear_tp_mult': 2.4725064844231466, 'bear_tsl_mult': 0.6015107341396055, 'bear_time_stop': 284, 'bear_use_sma': False, 'bear_use_ema': False, 'bear_use_atr': True, 'bear_use_adx': True, 'bear_use_spike': True, 'bear_rsi_required': True, 'sideways_strategy': 'breakout', 'sideways_bb_std_mult': 0.5614919935053204, 'sideways_rsi_os': 27, 'sideways_rsi_ob': 91, 'sideways_adx_thresh': 15.266633167606523, 'sideways_atr_min_pct': 0.009538385523801205, 'sideways_atr_max_pct': 0.116681621632802, 'sideways_tp_mult': 1.6882686805921665, 'sideways_tsl_mult': 0.6045159849071519, 'sideways_time_stop': 14, 'sideways_use_sma': True, 'sideways_use_ema': True, 'sideways_use_atr': False, 'sideways_use_adx': True, 'sideways_use_spike': True, 'sideways_rsi_required': False}.
[I 2025-09-01 13:19:58,502] Trial 119 finished with values: [-1000000000.0, 1000000000.0] and parameters: {'p_sma': 59, 'p_std': 58, 'p_atr': 29, 'p_adx': 19, 'rsi_period': 73, 'ema1': 20, 'ema2': 59, 'slip_atr_k': 0.07854651080264972, 'slip_spread_k': 0.44113407746416217, 'spread_hl_frac': 0.007439616705986748, 'bb_std_mult': 1.8109673842923784, 'rsi_os': 36, 'rsi_ob': 87, 'vol_spike': 0.20056909933389802, 'adx_thresh': 12.292106214335956, 'atr_min_pct': 0.011813104539459673, 'atr_max_pct': 0.04343428678216053, 'tp_mult': 1.4515070502439837, 'tsl_mult': 0.18565842204248195, 'strategy': 'breakout', 'time_stop': 107, 'use_sma': True, 'use_atr': True, 'use_adx': False, 'use_ema': True, 'use_spike': False, 'rsi_required': True, 'edge_k': 0.38162832610141156, 'edge_cap': 0.787814129622243, 'bull_strategy': 'breakout', 'bull_bb_std_mult': 3.1619214809305762, 'bull_rsi_os': 24, 'bull_rsi_ob': 51, 'bull_adx_thresh': 24.042403279976828, 'bull_atr_min_pct': 0.01881099125034547, 'bull_atr_max_pct': 0.14168472480923172, 'bull_tp_mult': 1.9876737047804482, 'bull_tsl_mult': 0.4066352228571638, 'bull_time_stop': 25, 'bull_use_sma': False, 'bull_use_ema': True, 'bull_use_atr': True, 'bull_use_adx': True, 'bull_use_spike': False, 'bull_rsi_required': True, 'bear_strategy': 'breakout', 'bear_bb_std_mult': 1.0558386840303662, 'bear_rsi_os': 8, 'bear_rsi_ob': 73, 'bear_adx_thresh': 15.011545907527179, 'bear_atr_min_pct': 0.021150827507370615, 'bear_atr_max_pct': 0.0773258281196658, 'bear_tp_mult': 2.487547654495616, 'bear_tsl_mult': 0.6638461183729646, 'bear_time_stop': 288, 'bear_use_sma': False, 'bear_use_ema': False, 'bear_use_atr': True, 'bear_use_adx': True, 'bear_use_spike': True, 'bear_rsi_required': False, 'sideways_strategy': 'breakout', 'sideways_bb_std_mult': 0.8694601362974097, 'sideways_rsi_os': 27, 'sideways_rsi_ob': 91, 'sideways_adx_thresh': 13.529896854752097, 'sideways_atr_min_pct': 0.010904258136168656, 'sideways_atr_max_pct': 0.11651535415292158, 'sideways_tp_mult': 2.863376522584177, 'sideways_tsl_mult': 0.22167382343182324, 'sideways_time_stop': 13, 'sideways_use_sma': False, 'sideways_use_ema': True, 'sideways_use_atr': False, 'sideways_use_adx': True, 'sideways_use_spike': True, 'sideways_rsi_required': False}.
[I 2025-09-01 13:20:39,314] Trial 125 finished with values: [-1000000000.0, 1000000000.0] and parameters: {'p_sma': 54, 'p_std': 46, 'p_atr': 30, 'p_adx': 20, 'rsi_period': 62, 'ema1': 19, 'ema2': 57, 'slip_atr_k': 0.09335021318602287, 'slip_spread_k': 0.2738365122058012, 'spread_hl_frac': 0.013568182387413506, 'bb_std_mult': 1.6427198346922751, 'rsi_os': 43, 'rsi_ob': 90, 'vol_spike': 0.22045312969816516, 'adx_thresh': 10.67572712888914, 'atr_min_pct': 0.009884895134388536, 'atr_max_pct': 0.037873067299261653, 'tp_mult': 1.4764101710654836, 'tsl_mult': 0.7821142498661866, 'strategy': 'breakout', 'time_stop': 116, 'use_sma': True, 'use_atr': True, 'use_adx': False, 'use_ema': True, 'use_spike': False, 'rsi_required': True, 'edge_k': 1.9175378250193773, 'edge_cap': 0.7116186464138272, 'bull_strategy': 'breakout', 'bull_bb_std_mult': 1.531963196499313, 'bull_rsi_os': 18, 'bull_rsi_ob': 58, 'bull_adx_thresh': 25.928169183282044, 'bull_atr_min_pct': 0.020582198768226048, 'bull_atr_max_pct': 0.012925760436009598, 'bull_tp_mult': 2.108457608947308, 'bull_tsl_mult': 0.3330264106237046, 'bull_time_stop': 33, 'bull_use_sma': True, 'bull_use_ema': True, 'bull_use_atr': True, 'bull_use_adx': True, 'bull_use_spike': False, 'bull_rsi_required': False, 'bear_strategy': 'mean_reversion', 'bear_bb_std_mult': 0.7038101506745463, 'bear_rsi_os': 10, 'bear_rsi_ob': 66, 'bear_adx_thresh': 11.80060735528092, 'bear_atr_min_pct': 0.023172013926917236, 'bear_atr_max_pct': 0.07245768410682543, 'bear_tp_mult': 1.9653666150532123, 'bear_tsl_mult': 0.5027253230884411, 'bear_time_stop': 251, 'bear_use_sma': True, 'bear_use_ema': False, 'bear_use_atr': True, 'bear_use_adx': True, 'bear_use_spike': False, 'bear_rsi_required': False, 'sideways_strategy': 'mean_reversion', 'sideways_bb_std_mult': 1.0193624192695883, 'sideways_rsi_os': 25, 'sideways_rsi_ob': 94, 'sideways_adx_thresh': 14.184457579184912, 'sideways_atr_min_pct': 0.013734584278703317, 'sideways_atr_max_pct': 0.11283613854342309, 'sideways_tp_mult': 1.5789282284481223, 'sideways_tsl_mult': 0.4115378848750728, 'sideways_time_stop': 23, 'sideways_use_sma': False, 'sideways_use_ema': False, 'sideways_use_atr': True, 'sideways_use_adx': False, 'sideways_use_spike': False, 'sideways_rsi_required': True}.
[I 2025-09-01 13:20:39,279] Trial 124 finished with values: [-0.02341617516659522, 0.023179378564334833] and parameters: {'p_sma': 58, 'p_std': 46, 'p_atr': 30, 'p_adx': 19, 'rsi_period': 74, 'ema1': 21, 'ema2': 57, 'slip_atr_k': 0.008068947316535346, 'slip_spread_k': 0.3706308330671841, 'spread_hl_frac': 0.007416802877718783, 'bb_std_mult': 1.6433933068007993, 'rsi_os': 39, 'rsi_ob': 90, 'vol_spike': 0.22024289790353732, 'adx_thresh': 10.720493378583107, 'atr_min_pct': 0.009931570552623632, 'atr_max_pct': 0.03770458216975521, 'tp_mult': 1.4608454538022582, 'tsl_mult': 0.04437365810386397, 'strategy': 'breakout', 'time_stop': 91, 'use_sma': True, 'use_atr': True, 'use_adx': False, 'use_ema': True, 'use_spike': False, 'rsi_required': True, 'edge_k': 1.8863277866718138, 'edge_cap': 0.7179383944378005, 'bull_strategy': 'breakout', 'bull_bb_std_mult': 3.1460440254699913, 'bull_rsi_os': 49, 'bull_rsi_ob': 51, 'bull_adx_thresh': 8.612421702542022, 'bull_atr_min_pct': 0.0004423176878014664, 'bull_atr_max_pct': 0.026062282313319748, 'bull_tp_mult': 2.20612531333269, 'bull_tsl_mult': 0.37408203071335766, 'bull_time_stop': 50, 'bull_use_sma': True, 'bull_use_ema': True, 'bull_use_atr': True, 'bull_use_adx': True, 'bull_use_spike': False, 'bull_rsi_required': False, 'bear_strategy': 'mean_reversion', 'bear_bb_std_mult': 0.7234091815600636, 'bear_rsi_os': 10, 'bear_rsi_ob': 73, 'bear_adx_thresh': 11.711253798591526, 'bear_atr_min_pct': 0.023064837327345607, 'bear_atr_max_pct': 0.0771140346317617, 'bear_tp_mult': 1.0132977472593558, 'bear_tsl_mult': 0.5581394617492884, 'bear_time_stop': 251, 'bear_use_sma': True, 'bear_use_ema': False, 'bear_use_atr': True, 'bear_use_adx': True, 'bear_use_spike': False, 'bear_rsi_required': False, 'sideways_strategy': 'mean_reversion', 'sideways_bb_std_mult': 3.4567531363019977, 'sideways_rsi_os': 25, 'sideways_rsi_ob': 94, 'sideways_adx_thresh': 13.430030663344374, 'sideways_atr_min_pct': 0.008540259586543775, 'sideways_atr_max_pct': 0.11178276583139515, 'sideways_tp_mult': 2.9395686506534697, 'sideways_tsl_mult': 0.4912196912870191, 'sideways_time_stop': 219, 'sideways_use_sma': False, 'sideways_use_ema': False, 'sideways_use_atr': True, 'sideways_use_adx': False, 'sideways_use_spike': False, 'sideways_rsi_required': True}.
[I 2025-09-01 13:20:39,842] Trial 122 finished with values: [-1000000000.0, 1000000000.0] and parameters: {'p_sma': 58, 'p_std': 8, 'p_atr': 29, 'p_adx': 21, 'rsi_period': 81, 'ema1': 7, 'ema2': 60, 'slip_atr_k': 0.08100022131345269, 'slip_spread_k': 0.11211852638151254, 'spread_hl_frac': 0.011655594622948648, 'bb_std_mult': 1.6432128107420207, 'rsi_os': 39, 'rsi_ob': 49, 'vol_spike': 0.19875904304517672, 'adx_thresh': 11.942270378986398, 'atr_min_pct': 0.007955242826425356, 'atr_max_pct': 0.037295882193297006, 'tp_mult': 1.6223122824263883, 'tsl_mult': 0.7231479036821797, 'strategy': 'breakout', 'time_stop': 107, 'use_sma': False, 'use_atr': False, 'use_adx': False, 'use_ema': True, 'use_spike': True, 'rsi_required': True, 'edge_k': 0.3720572634729337, 'edge_cap': 0.786560264893222, 'bull_strategy': 'mean_reversion', 'bull_bb_std_mult': 3.1769888579682606, 'bull_rsi_os': 23, 'bull_rsi_ob': 93, 'bull_adx_thresh': 26.175540980755073, 'bull_atr_min_pct': 0.0002772518712425647, 'bull_atr_max_pct': 0.019866714060383546, 'bull_tp_mult': 1.9764575201912773, 'bull_tsl_mult': 0.3876730954696239, 'bull_time_stop': 25, 'bull_use_sma': True, 'bull_use_ema': True, 'bull_use_atr': True, 'bull_use_adx': True, 'bull_use_spike': False, 'bull_rsi_required': True, 'bear_strategy': 'mean_reversion', 'bear_bb_std_mult': 0.7945506494163951, 'bear_rsi_os': 14, 'bear_rsi_ob': 73, 'bear_adx_thresh': 11.433818953600689, 'bear_atr_min_pct': 0.018807500555434134, 'bear_atr_max_pct': 0.07606700313471645, 'bear_tp_mult': 2.4968771176845035, 'bear_tsl_mult': 0.5953050876251101, 'bear_time_stop': 265, 'bear_use_sma': True, 'bear_use_ema': False, 'bear_use_atr': True, 'bear_use_adx': True, 'bear_use_spike': True, 'bear_rsi_required': True, 'sideways_strategy': 'breakout', 'sideways_bb_std_mult': 3.501987732675061, 'sideways_rsi_os': 25, 'sideways_rsi_ob': 92, 'sideways_adx_thresh': 32.49061220392788, 'sideways_atr_min_pct': 0.00851583422240062, 'sideways_atr_max_pct': 0.11798455351934946, 'sideways_tp_mult': 1.5322885662336576, 'sideways_tsl_mult': 0.40863490806678304, 'sideways_time_stop': 35, 'sideways_use_sma': True, 'sideways_use_ema': True, 'sideways_use_atr': False, 'sideways_use_adx': True, 'sideways_use_spike': False, 'sideways_rsi_required': True}.
[I 2025-09-01 13:20:40,269] Trial 123 finished with values: [-1000000000.0, 1000000000.0] and parameters: {'p_sma': 58, 'p_std': 46, 'p_atr': 29, 'p_adx': 19, 'rsi_period': 78, 'ema1': 21, 'ema2': 60, 'slip_atr_k': 0.00832498046906413, 'slip_spread_k': 0.37358287862190076, 'spread_hl_frac': 0.008139289162849239, 'bb_std_mult': 1.774166129345242, 'rsi_os': 38, 'rsi_ob': 84, 'vol_spike': 0.2214790527597817, 'adx_thresh': 10.659010752594309, 'atr_min_pct': 0.009906933291036767, 'atr_max_pct': 0.05214915079464054, 'tp_mult': 1.4667470059410213, 'tsl_mult': 0.04719996226325125, 'strategy': 'breakout', 'time_stop': 117, 'use_sma': True, 'use_atr': True, 'use_adx': False, 'use_ema': True, 'use_spike': False, 'rsi_required': True, 'edge_k': 1.8799084983463348, 'edge_cap': 0.7107541313526838, 'bull_strategy': 'breakout', 'bull_bb_std_mult': 3.1646304252895887, 'bull_rsi_os': 36, 'bull_rsi_ob': 87, 'bull_adx_thresh': 24.261353236942004, 'bull_atr_min_pct': 0.018955446617711633, 'bull_atr_max_pct': 0.012735207118097974, 'bull_tp_mult': 1.9671514269282586, 'bull_tsl_mult': 0.2519281239780964, 'bull_time_stop': 50, 'bull_use_sma': True, 'bull_use_ema': True, 'bull_use_atr': True, 'bull_use_adx': True, 'bull_use_spike': False, 'bull_rsi_required': False, 'bear_strategy': 'breakout', 'bear_bb_std_mult': 0.7533489695516427, 'bear_rsi_os': 10, 'bear_rsi_ob': 66, 'bear_adx_thresh': 11.061422798763235, 'bear_atr_min_pct': 0.021322344399064407, 'bear_atr_max_pct': 0.07719766782545852, 'bear_tp_mult': 2.577090764587461, 'bear_tsl_mult': 0.5564001987159782, 'bear_time_stop': 281, 'bear_use_sma': False, 'bear_use_ema': False, 'bear_use_atr': True, 'bear_use_adx': True, 'bear_use_spike': True, 'bear_rsi_required': False, 'sideways_strategy': 'breakout', 'sideways_bb_std_mult': 3.388946863056753, 'sideways_rsi_os': 27, 'sideways_rsi_ob': 92, 'sideways_adx_thresh': 13.40253998132571, 'sideways_atr_min_pct': 0.0084259666984669, 'sideways_atr_max_pct': 0.12454237227482529, 'sideways_tp_mult': 1.5537204634587347, 'sideways_tsl_mult': 0.610952121457277, 'sideways_time_stop': 34, 'sideways_use_sma': False, 'sideways_use_ema': True, 'sideways_use_atr': False, 'sideways_use_adx': True, 'sideways_use_spike': False, 'sideways_rsi_required': False}.
