[I 2025-09-01 13:44:30,618] Trial 270 finished with values: [-1000000000.0, 1000000000.0] and parameters: {'p_sma': 35, 'p_std': 47, 'p_atr': 25, 'p_adx': 12, 'rsi_period': 66, 'ema1': 7, 'ema2': 13, 'slip_atr_k': 0.012534648633100541, 'slip_spread_k': 0.09470838855426206, 'spread_hl_frac': 0.004204258603000785, 'bb_std_mult': 0.5736146197902405, 'rsi_os': 42, 'rsi_ob': 82, 'vol_spike': 0.09039574936954214, 'adx_thresh': 26.19574091641089, 'atr_min_pct': 0.022753466710478402, 'atr_max_pct': 0.14181410226950994, 'tp_mult': 1.1341450788891696, 'tsl_mult': 0.795346671757736, 'strategy': 'mean_reversion', 'time_stop': 234, 'use_sma': True, 'use_atr': False, 'use_adx': False, 'use_ema': True, 'use_spike': True, 'rsi_required': False, 'edge_k': 0.9642016590674019, 'edge_cap': 0.3505735390274286, 'bull_strategy': 'breakout', 'bull_bb_std_mult': 3.166896884793842, 'bull_rsi_os': 36, 'bull_rsi_ob': 55, 'bull_adx_thresh': 28.397284240565444, 'bull_atr_min_pct': 0.004592658538031618, 'bull_atr_max_pct': 0.022232997617822266, 'bull_tp_mult': 2.8155949432954803, 'bull_tsl_mult': 0.40510175951605143, 'bull_time_stop': 176, 'bull_use_sma': True, 'bull_use_ema': True, 'bull_use_atr': True, 'bull_use_adx': True, 'bull_use_spike': False, 'bull_rsi_required': True, 'bear_strategy': 'breakout', 'bear_bb_std_mult': 3.3457088202528853, 'bear_rsi_os': 31, 'bear_rsi_ob': 90, 'bear_adx_thresh': 34.43103852627796, 'bear_atr_min_pct': 0.0038303749319956275, 'bear_atr_max_pct': 0.029737333033676164, 'bear_tp_mult': 2.229555915840409, 'bear_tsl_mult': 0.9707855690287162, 'bear_time_stop': 103, 'bear_use_sma': True, 'bear_use_ema': True, 'bear_use_atr': True, 'bear_use_adx': True, 'bear_use_spike': False, 'bear_rsi_required': True, 'sideways_strategy': 'breakout', 'sideways_bb_std_mult': 1.6486045549168689, 'sideways_rsi_os': 52, 'sideways_rsi_ob': 68, 'sideways_adx_thresh': 6.9938488994487065, 'sideways_atr_min_pct': 0.01839252958305752, 'sideways_atr_max_pct': 0.05700730116260871, 'sideways_tp_mult': 2.738326028634707, 'sideways_tsl_mult': 0.3054054815588423, 'sideways_time_stop': 195, 'sideways_use_sma': True, 'sideways_use_ema': True, 'sideways_use_atr': True, 'sideways_use_adx': True, 'sideways_use_spike': False, 'sideways_rsi_required': True}.
[I 2025-09-01 13:44:31,493] Trial 272 finished with values: [-1000000000.0, 1000000000.0] and parameters: {'p_sma': 35, 'p_std': 47, 'p_atr': 25, 'p_adx': 11, 'rsi_period': 16, 'ema1': 12, 'ema2': 13, 'slip_atr_k': 0.013265502361682259, 'slip_spread_k': 0.11163958690527212, 'spread_hl_frac': 0.004013670873588904, 'bb_std_mult': 1.7198927144903389, 'rsi_os': 51, 'rsi_ob': 84, 'vol_spike': 0.22375644442263357, 'adx_thresh': 25.08151031292081, 'atr_min_pct': 0.027498442185491214, 'atr_max_pct': 0.14022929708314266, 'tp_mult': 1.117120277156185, 'tsl_mult': 0.8171269124459477, 'strategy': 'mean_reversion', 'time_stop': 233, 'use_sma': True, 'use_atr': False, 'use_adx': False, 'use_ema': True, 'use_spike': True, 'rsi_required': False, 'edge_k': 0.837442744427129, 'edge_cap': 0.4397966105273535, 'bull_strategy': 'mean_reversion', 'bull_bb_std_mult': 2.3818991802568186, 'bull_rsi_os': 36, 'bull_rsi_ob': 45, 'bull_adx_thresh': 30.91752178292078, 'bull_atr_min_pct': 0.004373874940649012, 'bull_atr_max_pct': 0.022281939779354307, 'bull_tp_mult': 2.8793142863181123, 'bull_tsl_mult': 0.06554755794172412, 'bull_time_stop': 91, 'bull_use_sma': True, 'bull_use_ema': False, 'bull_use_atr': True, 'bull_use_adx': True, 'bull_use_spike': False, 'bull_rsi_required': False, 'bear_strategy': 'breakout', 'bear_bb_std_mult': 3.5189439920489654, 'bear_rsi_os': 19, 'bear_rsi_ob': 88, 'bear_adx_thresh': 13.194432443014165, 'bear_atr_min_pct': 0.0013087952058736252, 'bear_atr_max_pct': 0.041873340070316, 'bear_tp_mult': 2.232867903185356, 'bear_tsl_mult': 0.1683016061466501, 'bear_time_stop': 235, 'bear_use_sma': True, 'bear_use_ema': True, 'bear_use_atr': True, 'bear_use_adx': True, 'bear_use_spike': False, 'bear_rsi_required': True, 'sideways_strategy': 'breakout', 'sideways_bb_std_mult': 3.346261962769365, 'sideways_rsi_os': 49, 'sideways_rsi_ob': 65, 'sideways_adx_thresh': 24.28683883479791, 'sideways_atr_min_pct': 0.02123581172004686, 'sideways_atr_max_pct': 0.06338268670558436, 'sideways_tp_mult': 1.5781481516925138, 'sideways_tsl_mult': 0.25409191841506745, 'sideways_time_stop': 158, 'sideways_use_sma': True, 'sideways_use_ema': True, 'sideways_use_atr': True, 'sideways_use_adx': True, 'sideways_use_spike': False, 'sideways_rsi_required': True}.
[I 2025-09-01 13:45:09,558] Trial 274 finished with values: [-0.08586792565132273, 0.08534503237437217] and parameters: {'p_sma': 37, 'p_std': 27, 'p_atr': 26, 'p_adx': 11, 'rsi_period': 13, 'ema1': 12, 'ema2': 21, 'slip_atr_k': 0.012882525738943626, 'slip_spread_k': 0.15401303939348093, 'spread_hl_frac': 0.049770260289842654, 'bb_std_mult': 3.5965470235404884, 'rsi_os': 21, 'rsi_ob': 84, 'vol_spike': 0.2403191235367707, 'adx_thresh': 25.092140513348493, 'atr_min_pct': 0.027358310571471863, 'atr_max_pct': 0.13809549160871834, 'tp_mult': 1.1027217744802933, 'tsl_mult': 0.6783255212444249, 'strategy': 'mean_reversion', 'time_stop': 294, 'use_sma': True, 'use_atr': False, 'use_adx': False, 'use_ema': True, 'use_spike': True, 'rsi_required': False, 'edge_k': 0.8693686066536945, 'edge_cap': 0.2892735845705089, 'bull_strategy': 'mean_reversion', 'bull_bb_std_mult': 1.0854447469173234, 'bull_rsi_os': 35, 'bull_rsi_ob': 50, 'bull_adx_thresh': 33.32496890712572, 'bull_atr_min_pct': 0.003222745254603754, 'bull_atr_max_pct': 0.038620248181642565, 'bull_tp_mult': 2.87635302322199, 'bull_tsl_mult': 0.6569882894453767, 'bull_time_stop': 98, 'bull_use_sma': True, 'bull_use_ema': False, 'bull_use_atr': True, 'bull_use_adx': True, 'bull_use_spike': False, 'bull_rsi_required': False, 'bear_strategy': 'breakout', 'bear_bb_std_mult': 3.5223564102038707, 'bear_rsi_os': 27, 'bear_rsi_ob': 86, 'bear_adx_thresh': 20.478495149522054, 'bear_atr_min_pct': 0.0013812692776386608, 'bear_atr_max_pct': 0.04025606530640412, 'bear_tp_mult': 2.209736830852489, 'bear_tsl_mult': 0.16761752136675892, 'bear_time_stop': 235, 'bear_use_sma': True, 'bear_use_ema': True, 'bear_use_atr': False, 'bear_use_adx': True, 'bear_use_spike': False, 'bear_rsi_required': True, 'sideways_strategy': 'breakout', 'sideways_bb_std_mult': 1.7344773558134436, 'sideways_rsi_os': 49, 'sideways_rsi_ob': 66, 'sideways_adx_thresh': 7.4487867900072375, 'sideways_atr_min_pct': 0.019853694650713745, 'sideways_atr_max_pct': 0.062284888550179045, 'sideways_tp_mult': 2.329968023528865, 'sideways_tsl_mult': 0.26453168230376334, 'sideways_time_stop': 155, 'sideways_use_sma': True, 'sideways_use_ema': True, 'sideways_use_atr': True, 'sideways_use_adx': True, 'sideways_use_spike': False, 'sideways_rsi_required': True}.
[I 2025-09-01 13:45:10,141] Trial 273 finished with values: [-1000000000.0, 1000000000.0] and parameters: {'p_sma': 35, 'p_std': 47, 'p_atr': 25, 'p_adx': 26, 'rsi_period': 17, 'ema1': 16, 'ema2': 21, 'slip_atr_k': 0.011322274338822831, 'slip_spread_k': 0.15906404727689433, 'spread_hl_frac': 0.04850876559760769, 'bb_std_mult': 3.5835803246391826, 'rsi_os': 40, 'rsi_ob': 84, 'vol_spike': 0.21958675429076546, 'adx_thresh': 27.75660207736951, 'atr_min_pct': 0.0275142834206004, 'atr_max_pct': 0.1400035786600878, 'tp_mult': 1.1040212228546014, 'tsl_mult': 0.8193479028548117, 'strategy': 'mean_reversion', 'time_stop': 137, 'use_sma': True, 'use_atr': False, 'use_adx': False, 'use_ema': True, 'use_spike': True, 'rsi_required': False, 'edge_k': 0.9421808059859874, 'edge_cap': 0.15755149923883544, 'bull_strategy': 'mean_reversion', 'bull_bb_std_mult': 2.3793937869117325, 'bull_rsi_os': 36, 'bull_rsi_ob': 45, 'bull_adx_thresh': 28.286325542090747, 'bull_atr_min_pct': 0.004561414729715154, 'bull_atr_max_pct': 0.10260087915367677, 'bull_tp_mult': 2.8897479730072035, 'bull_tsl_mult': 0.9996759678586083, 'bull_time_stop': 90, 'bull_use_sma': True, 'bull_use_ema': False, 'bull_use_atr': True, 'bull_use_adx': True, 'bull_use_spike': False, 'bull_rsi_required': False, 'bear_strategy': 'breakout', 'bear_bb_std_mult': 3.5262672378084434, 'bear_rsi_os': 19, 'bear_rsi_ob': 88, 'bear_adx_thresh': 27.693943346173015, 'bear_atr_min_pct': 0.001445081392684901, 'bear_atr_max_pct': 0.04227083582778752, 'bear_tp_mult': 1.1658290845250723, 'bear_tsl_mult': 0.16970720510052348, 'bear_time_stop': 66, 'bear_use_sma': True, 'bear_use_ema': True, 'bear_use_atr': True, 'bear_use_adx': True, 'bear_use_spike': False, 'bear_rsi_required': True, 'sideways_strategy': 'breakout', 'sideways_bb_std_mult': 1.6457869071750173, 'sideways_rsi_os': 49, 'sideways_rsi_ob': 68, 'sideways_adx_thresh': 23.09552943449963, 'sideways_atr_min_pct': 0.02130966243153032, 'sideways_atr_max_pct': 0.06227845885838011, 'sideways_tp_mult': 2.391570751550228, 'sideways_tsl_mult': 0.25660375913106415, 'sideways_time_stop': 160, 'sideways_use_sma': True, 'sideways_use_ema': True, 'sideways_use_atr': True, 'sideways_use_adx': True, 'sideways_use_spike': False, 'sideways_rsi_required': True}.
[I 2025-09-01 13:45:11,078] Trial 275 finished with values: [-1000000000.0, 1000000000.0] and parameters: {'p_sma': 37, 'p_std': 26, 'p_atr': 26, 'p_adx': 28, 'rsi_period': 84, 'ema1': 20, 'ema2': 24, 'slip_atr_k': 0.022004352237644402, 'slip_spread_k': 0.15459329398725005, 'spread_hl_frac': 0.04862299421238816, 'bb_std_mult': 3.5842291717101205, 'rsi_os': 40, 'rsi_ob': 84, 'vol_spike': 0.24017209906606862, 'adx_thresh': 27.49279495571061, 'atr_min_pct': 0.024446991713690195, 'atr_max_pct': 0.1369780247478383, 'tp_mult': 1.0528377543208143, 'tsl_mult': 0.7447344795148814, 'strategy': 'mean_reversion', 'time_stop': 43, 'use_sma': True, 'use_atr': False, 'use_adx': False, 'use_ema': True, 'use_spike': True, 'rsi_required': False, 'edge_k': 0.9381059703588542, 'edge_cap': 0.11498465447273298, 'bull_strategy': 'breakout', 'bull_bb_std_mult': 2.171274602282998, 'bull_rsi_os': 35, 'bull_rsi_ob': 82, 'bull_adx_thresh': 32.2606434230993, 'bull_atr_min_pct': 0.0032841294768496355, 'bull_atr_max_pct': 0.05171849957733751, 'bull_tp_mult': 2.753525124308377, 'bull_tsl_mult': 0.7722844291463657, 'bull_time_stop': 98, 'bull_use_sma': True, 'bull_use_ema': False, 'bull_use_atr': True, 'bull_use_adx': False, 'bull_use_spike': False, 'bull_rsi_required': True, 'bear_strategy': 'breakout', 'bear_bb_std_mult': 3.540661559237953, 'bear_rsi_os': 30, 'bear_rsi_ob': 86, 'bear_adx_thresh': 6.458488999766452, 'bear_atr_min_pct': 0.0012856309300967072, 'bear_atr_max_pct': 0.04420425832299159, 'bear_tp_mult': 1.7179226562940069, 'bear_tsl_mult': 0.18826421785220296, 'bear_time_stop': 222, 'bear_use_sma': True, 'bear_use_ema': True, 'bear_use_atr': False, 'bear_use_adx': False, 'bear_use_spike': False, 'bear_rsi_required': True, 'sideways_strategy': 'breakout', 'sideways_bb_std_mult': 1.4822826518266203, 'sideways_rsi_os': 50, 'sideways_rsi_ob': 67, 'sideways_adx_thresh': 33.93566896249382, 'sideways_atr_min_pct': 0.019974656301526332, 'sideways_atr_max_pct': 0.07070169970892366, 'sideways_tp_mult': 2.7402359524213127, 'sideways_tsl_mult': 0.9949554107446298, 'sideways_time_stop': 165, 'sideways_use_sma': True, 'sideways_use_ema': False, 'sideways_use_atr': True, 'sideways_use_adx': True, 'sideways_use_spike': True, 'sideways_rsi_required': True}.
[I 2025-09-01 13:45:11,088] Trial 271 finished with values: [-0.08946071109879195, 0.08891250483838876] and parameters: {'p_sma': 35, 'p_std': 27, 'p_atr': 25, 'p_adx': 12, 'rsi_period': 16, 'ema1': 22, 'ema2': 18, 'slip_atr_k': 0.01095954837508007, 'slip_spread_k': 0.15051798989778759, 'spread_hl_frac': 0.04553618276088096, 'bb_std_mult': 1.7632082777261007, 'rsi_os': 39, 'rsi_ob': 82, 'vol_spike': 0.2215978923745929, 'adx_thresh': 26.338747056696704, 'atr_min_pct': 0.027698169215805292, 'atr_max_pct': 0.1393667253732835, 'tp_mult': 1.1280461998416886, 'tsl_mult': 0.6917230358057803, 'strategy': 'mean_reversion', 'time_stop': 245, 'use_sma': True, 'use_atr': False, 'use_adx': False, 'use_ema': True, 'use_spike': True, 'rsi_required': False, 'edge_k': 0.9691269712480114, 'edge_cap': 0.560860581218842, 'bull_strategy': 'breakout', 'bull_bb_std_mult': 2.366689479846467, 'bull_rsi_os': 36, 'bull_rsi_ob': 55, 'bull_adx_thresh': 28.358782146246234, 'bull_atr_min_pct': 0.00465625217497472, 'bull_atr_max_pct': 0.021223943740933938, 'bull_tp_mult': 2.8061170615387843, 'bull_tsl_mult': 0.037690226412795014, 'bull_time_stop': 91, 'bull_use_sma': True, 'bull_use_ema': True, 'bull_use_atr': True, 'bull_use_adx': True, 'bull_use_spike': False, 'bull_rsi_required': True, 'bear_strategy': 'breakout', 'bear_bb_std_mult': 3.510007363756298, 'bear_rsi_os': 31, 'bear_rsi_ob': 90, 'bear_adx_thresh': 22.803348443275247, 'bear_atr_min_pct': 0.0013377249223348135, 'bear_atr_max_pct': 0.041637977162959736, 'bear_tp_mult': 2.266701611052426, 'bear_tsl_mult': 0.1701919671738662, 'bear_time_stop': 92, 'bear_use_sma': True, 'bear_use_ema': True, 'bear_use_atr': True, 'bear_use_adx': True, 'bear_use_spike': False, 'bear_rsi_required': True, 'sideways_strategy': 'breakout', 'sideways_bb_std_mult': 1.6386837917580714, 'sideways_rsi_os': 52, 'sideways_rsi_ob': 68, 'sideways_adx_thresh': 7.136741670643638, 'sideways_atr_min_pct': 0.01826771759278909, 'sideways_atr_max_pct': 0.07093268443072326, 'sideways_tp_mult': 2.743444244443718, 'sideways_tsl_mult': 0.3056637602310907, 'sideways_time_stop': 157, 'sideways_use_sma': True, 'sideways_use_ema': True, 'sideways_use_atr': True, 'sideways_use_adx': True, 'sideways_use_spike': False, 'sideways_rsi_required': True}.
[I 2025-09-01 13:45:48,414] Trial 278 finished with values: [-1000000000.0, 1000000000.0] and parameters: {'p_sma': 7, 'p_std': 57, 'p_atr': 23, 'p_adx': 23, 'rsi_period': 28, 'ema1': 9, 'ema2': 30, 'slip_atr_k': 0.019692522760930496, 'slip_spread_k': 0.0629510760984262, 'spread_hl_frac': 0.008068627844697845, 'bb_std_mult': 1.8019217714699667, 'rsi_os': 38, 'rsi_ob': 86, 'vol_spike': 0.10805033005021658, 'adx_thresh': 23.706421745567756, 'atr_min_pct': 0.028253734567041316, 'atr_max_pct': 0.13435406608126912, 'tp_mult': 1.0492584586344658, 'tsl_mult': 0.7763195471123692, 'strategy': 'mean_reversion', 'time_stop': 241, 'use_sma': False, 'use_atr': False, 'use_adx': True, 'use_ema': False, 'use_spike': True, 'rsi_required': False, 'edge_k': 0.8937940977964564, 'edge_cap': 0.327488250739735, 'bull_strategy': 'breakout', 'bull_bb_std_mult': 3.2283682769962403, 'bull_rsi_os': 34, 'bull_rsi_ob': 63, 'bull_adx_thresh': 29.082787141018045, 'bull_atr_min_pct': 0.013116522982517167, 'bull_atr_max_pct': 0.14639625607991158, 'bull_tp_mult': 2.9254822708983297, 'bull_tsl_mult': 0.45360238921855317, 'bull_time_stop': 101, 'bull_use_sma': True, 'bull_use_ema': True, 'bull_use_atr': False, 'bull_use_adx': False, 'bull_use_spike': False, 'bull_rsi_required': True, 'bear_strategy': 'breakout', 'bear_bb_std_mult': 3.57972536280289, 'bear_rsi_os': 25, 'bear_rsi_ob': 58, 'bear_adx_thresh': 24.955309701532567, 'bear_atr_min_pct': 0.0037706914855325075, 'bear_atr_max_pct': 0.046917270157307664, 'bear_tp_mult': 1.445383511771122, 'bear_tsl_mult': 0.8377308230886341, 'bear_time_stop': 214, 'bear_use_sma': False, 'bear_use_ema': True, 'bear_use_atr': True, 'bear_use_adx': False, 'bear_use_spike': True, 'bear_rsi_required': True, 'sideways_strategy': 'breakout', 'sideways_bb_std_mult': 3.4822337774277417, 'sideways_rsi_os': 37, 'sideways_rsi_ob': 70, 'sideways_adx_thresh': 33.01994195482375, 'sideways_atr_min_pct': 0.02084592599688866, 'sideways_atr_max_pct': 0.06673616123821455, 'sideways_tp_mult': 1.9191984733294722, 'sideways_tsl_mult': 0.22489559323732827, 'sideways_time_stop': 182, 'sideways_use_sma': True, 'sideways_use_ema': False, 'sideways_use_atr': False, 'sideways_use_adx': True, 'sideways_use_spike': True, 'sideways_rsi_required': False}.
[I 2025-09-01 13:45:49,666] Trial 276 finished with values: [-1000000000.0, 1000000000.0] and parameters: {'p_sma': 18, 'p_std': 53, 'p_atr': 25, 'p_adx': 26, 'rsi_period': 64, 'ema1': 21, 'ema2': 24, 'slip_atr_k': 0.19244172109347268, 'slip_spread_k': 0.035151461181183244, 'spread_hl_frac': 0.04727428958615584, 'bb_std_mult': 1.750568110039658, 'rsi_os': 40, 'rsi_ob': 83, 'vol_spike': 0.03268673552261653, 'adx_thresh': 27.96068215745298, 'atr_min_pct': 0.02827162868760193, 'atr_max_pct': 0.13496665362137195, 'tp_mult': 1.0360113672099116, 'tsl_mult': 0.6918416505485355, 'strategy': 'mean_reversion', 'time_stop': 52, 'use_sma': False, 'use_atr': False, 'use_adx': False, 'use_ema': False, 'use_spike': True, 'rsi_required': False, 'edge_k': 0.9297179923243313, 'edge_cap': 0.334834625130678, 'bull_strategy': 'breakout', 'bull_bb_std_mult': 2.196896297082235, 'bull_rsi_os': 34, 'bull_rsi_ob': 82, 'bull_adx_thresh': 29.00158103599576, 'bull_atr_min_pct': 0.003386486068551615, 'bull_atr_max_pct': 0.14491044175663065, 'bull_tp_mult': 2.7082194165295617, 'bull_tsl_mult': 0.4512282331707303, 'bull_time_stop': 89, 'bull_use_sma': True, 'bull_use_ema': True, 'bull_use_atr': False, 'bull_use_adx': False, 'bull_use_spike': False, 'bull_rsi_required': True, 'bear_strategy': 'breakout', 'bear_bb_std_mult': 3.591452607707457, 'bear_rsi_os': 37, 'bear_rsi_ob': 88, 'bear_adx_thresh': 19.999216485657907, 'bear_atr_min_pct': 0.003595736359479202, 'bear_atr_max_pct': 0.046929243968151325, 'bear_tp_mult': 1.2900426790683999, 'bear_tsl_mult': 0.18858187949715502, 'bear_time_stop': 77, 'bear_use_sma': False, 'bear_use_ema': True, 'bear_use_atr': True, 'bear_use_adx': False, 'bear_use_spike': False, 'bear_rsi_required': True, 'sideways_strategy': 'breakout', 'sideways_bb_std_mult': 1.4673691564668139, 'sideways_rsi_os': 50, 'sideways_rsi_ob': 67, 'sideways_adx_thresh': 33.14579921533494, 'sideways_atr_min_pct': 0.021043524676796075, 'sideways_atr_max_pct': 0.07116617680683893, 'sideways_tp_mult': 1.219534941468736, 'sideways_tsl_mult': 0.2550689250489739, 'sideways_time_stop': 168, 'sideways_use_sma': True, 'sideways_use_ema': False, 'sideways_use_atr': True, 'sideways_use_adx': True, 'sideways_use_spike': True, 'sideways_rsi_required': False}.
[I 2025-09-01 13:45:49,986] Trial 279 finished with values: [-0.0283980548950461, 0.028235276045105135] and parameters: {'p_sma': 37, 'p_std': 31, 'p_atr': 23, 'p_adx': 23, 'rsi_period': 27, 'ema1': 21, 'ema2': 30, 'slip_atr_k': 0.02051805921762244, 'slip_spread_k': 0.038097752010871455, 'spread_hl_frac': 0.008272606561322497, 'bb_std_mult': 1.8305987823254364, 'rsi_os': 38, 'rsi_ob': 79, 'vol_spike': 0.18807018257973798, 'adx_thresh': 28.413525353476714, 'atr_min_pct': 0.02853556793980411, 'atr_max_pct': 0.13367780526890952, 'tp_mult': 1.0494284397398181, 'tsl_mult': 0.7747939254747085, 'strategy': 'mean_reversion', 'time_stop': 243, 'use_sma': False, 'use_atr': False, 'use_adx': True, 'use_ema': False, 'use_spike': True, 'rsi_required': False, 'edge_k': 0.8981105236251197, 'edge_cap': 0.32683127266260803, 'bull_strategy': 'breakout', 'bull_bb_std_mult': 3.4294988975123974, 'bull_rsi_os': 34, 'bull_rsi_ob': 54, 'bull_adx_thresh': 26.84612075194281, 'bull_atr_min_pct': 0.02583573832552001, 'bull_atr_max_pct': 0.026672117332249397, 'bull_tp_mult': 2.7019395952427985, 'bull_tsl_mult': 0.470595109618746, 'bull_time_stop': 85, 'bull_use_sma': True, 'bull_use_ema': True, 'bull_use_atr': False, 'bull_use_adx': False, 'bull_use_spike': False, 'bull_rsi_required': True, 'bear_strategy': 'breakout', 'bear_bb_std_mult': 3.5803963438409734, 'bear_rsi_os': 40, 'bear_rsi_ob': 88, 'bear_adx_thresh': 14.04397516905152, 'bear_atr_min_pct': 0.00357740345283587, 'bear_atr_max_pct': 0.04599260542987517, 'bear_tp_mult': 2.3237815906869734, 'bear_tsl_mult': 0.32142156524172805, 'bear_time_stop': 216, 'bear_use_sma': False, 'bear_use_ema': True, 'bear_use_atr': True, 'bear_use_adx': False, 'bear_use_spike': True, 'bear_rsi_required': True, 'sideways_strategy': 'breakout', 'sideways_bb_std_mult': 1.5523069105287817, 'sideways_rsi_os': 51, 'sideways_rsi_ob': 70, 'sideways_adx_thresh': 33.10705887025843, 'sideways_atr_min_pct': 0.020799005858346348, 'sideways_atr_max_pct': 0.06599514603916948, 'sideways_tp_mult': 1.2308526142798673, 'sideways_tsl_mult': 0.7166537124153702, 'sideways_time_stop': 171, 'sideways_use_sma': True, 'sideways_use_ema': False, 'sideways_use_atr': False, 'sideways_use_adx': True, 'sideways_use_spike': True, 'sideways_rsi_required': False}.
