[I 2025-09-01 14:42:03,286] Trial 664 finished with values: [-1000000000.0, 1000000000.0] and parameters: {'p_sma': 34, 'p_std': 48, 'p_atr': 24, 'p_adx': 24, 'rsi_period': 14, 'ema1': 21, 'ema2': 17, 'slip_atr_k': 0.041198665146784094, 'slip_spread_k': 0.06488676840195652, 'spread_hl_frac': 0.00711775037070158, 'bb_std_mult': 1.7029967744811476, 'rsi_os': 41, 'rsi_ob': 87, 'vol_spike': 0.23029493365980636, 'adx_thresh': 14.882636236549619, 'atr_min_pct': 0.012846536740183483, 'atr_max_pct': 0.1475863615126454, 'tp_mult': 1.0527388577771988, 'tsl_mult': 0.6668321896269009, 'strategy': 'mean_reversion', 'time_stop': 256, 'use_sma': True, 'use_atr': False, 'use_adx': True, 'use_ema': True, 'use_spike': True, 'rsi_required': False, 'edge_k': 0.9243187359363374, 'edge_cap': 0.326367750077066, 'bull_strategy': 'breakout', 'bull_bb_std_mult': 3.400720200794423, 'bull_rsi_os': 33, 'bull_rsi_ob': 57, 'bull_adx_thresh': 29.850327098600413, 'bull_atr_min_pct': 0.015378096096328125, 'bull_atr_max_pct': 0.02580481067437131, 'bull_tp_mult': 2.3255115302030136, 'bull_tsl_mult': 0.020119897322325664, 'bull_time_stop': 247, 'bull_use_sma': True, 'bull_use_ema': True, 'bull_use_atr': False, 'bull_use_adx': False, 'bull_use_spike': False, 'bull_rsi_required': True, 'bear_strategy': 'breakout', 'bear_bb_std_mult': 3.5972563564641353, 'bear_rsi_os': 10, 'bear_rsi_ob': 90, 'bear_adx_thresh': 13.395010523052807, 'bear_atr_min_pct': 0.0038940655163897187, 'bear_atr_max_pct': 0.045436362459248744, 'bear_tp_mult': 2.262202567834379, 'bear_tsl_mult': 0.14522076613737483, 'bear_time_stop': 216, 'bear_use_sma': True, 'bear_use_ema': True, 'bear_use_atr': True, 'bear_use_adx': True, 'bear_use_spike': False, 'bear_rsi_required': True, 'sideways_strategy': 'breakout', 'sideways_bb_std_mult': 3.0648869677284662, 'sideways_rsi_os': 33, 'sideways_rsi_ob': 87, 'sideways_adx_thresh': 9.099902524227058, 'sideways_atr_min_pct': 0.02186180639489671, 'sideways_atr_max_pct': 0.062447864677129206, 'sideways_tp_mult': 2.479660588842252, 'sideways_tsl_mult': 0.296187777660425, 'sideways_time_stop': 134, 'sideways_use_sma': True, 'sideways_use_ema': True, 'sideways_use_atr': True, 'sideways_use_adx': True, 'sideways_use_spike': False, 'sideways_rsi_required': True}.
[I 2025-09-01 14:42:04,054] Trial 665 finished with values: [-1000000000.0, 1000000000.0] and parameters: {'p_sma': 34, 'p_std': 11, 'p_atr': 24, 'p_adx': 12, 'rsi_period': 82, 'ema1': 21, 'ema2': 56, 'slip_atr_k': 0.040073672754458375, 'slip_spread_k': 0.9993812903001216, 'spread_hl_frac': 0.0066790213300776235, 'bb_std_mult': 1.7683646464909681, 'rsi_os': 38, 'rsi_ob': 87, 'vol_spike': 0.17699898772597508, 'adx_thresh': 24.36946019556492, 'atr_min_pct': 0.027336654342760575, 'atr_max_pct': 0.13685413349494027, 'tp_mult': 2.2419887960547915, 'tsl_mult': 0.7482031743769104, 'strategy': 'mean_reversion', 'time_stop': 255, 'use_sma': True, 'use_atr': False, 'use_adx': False, 'use_ema': True, 'use_spike': True, 'rsi_required': False, 'edge_k': 1.7901862603792709, 'edge_cap': 0.3231131501220854, 'bull_strategy': 'breakout', 'bull_bb_std_mult': 3.3967270816797326, 'bull_rsi_os': 33, 'bull_rsi_ob': 57, 'bull_adx_thresh': 30.08112502630209, 'bull_atr_min_pct': 0.004148794704497112, 'bull_atr_max_pct': 0.025896435392194255, 'bull_tp_mult': 2.43427004795824, 'bull_tsl_mult': 0.10442999862998764, 'bull_time_stop': 141, 'bull_use_sma': True, 'bull_use_ema': True, 'bull_use_atr': True, 'bull_use_adx': False, 'bull_use_spike': False, 'bull_rsi_required': True, 'bear_strategy': 'mean_reversion', 'bear_bb_std_mult': 3.554004043441255, 'bear_rsi_os': 33, 'bear_rsi_ob': 89, 'bear_adx_thresh': 12.39905739261797, 'bear_atr_min_pct': 0.014832886632464933, 'bear_atr_max_pct': 0.033343513809349516, 'bear_tp_mult': 1.6144063513028237, 'bear_tsl_mult': 0.1813185351257098, 'bear_time_stop': 217, 'bear_use_sma': True, 'bear_use_ema': True, 'bear_use_atr': True, 'bear_use_adx': True, 'bear_use_spike': False, 'bear_rsi_required': True, 'sideways_strategy': 'breakout', 'sideways_bb_std_mult': 1.5525581913039472, 'sideways_rsi_os': 50, 'sideways_rsi_ob': 67, 'sideways_adx_thresh': 6.916029279466352, 'sideways_atr_min_pct': 0.02704918472072992, 'sideways_atr_max_pct': 0.07672948742781366, 'sideways_tp_mult': 2.721742169008554, 'sideways_tsl_mult': 0.2972484241136786, 'sideways_time_stop': 155, 'sideways_use_sma': True, 'sideways_use_ema': False, 'sideways_use_atr': True, 'sideways_use_adx': True, 'sideways_use_spike': True, 'sideways_rsi_required': True}.
[I 2025-09-01 14:42:05,093] Trial 668 finished with values: [-1000000000.0, 1000000000.0] and parameters: {'p_sma': 37, 'p_std': 47, 'p_atr': 25, 'p_adx': 11, 'rsi_period': 69, 'ema1': 17, 'ema2': 25, 'slip_atr_k': 0.022181896579328994, 'slip_spread_k': 0.11570679970794756, 'spread_hl_frac': 0.007103108703077985, 'bb_std_mult': 2.915282493495544, 'rsi_os': 16, 'rsi_ob': 81, 'vol_spike': 0.23936208010263763, 'adx_thresh': 24.36069787867343, 'atr_min_pct': 0.003944051632577378, 'atr_max_pct': 0.10332166556458838, 'tp_mult': 1.0486598360527792, 'tsl_mult': 0.7428440668290963, 'strategy': 'mean_reversion', 'time_stop': 257, 'use_sma': True, 'use_atr': False, 'use_adx': False, 'use_ema': True, 'use_spike': True, 'rsi_required': False, 'edge_k': 0.919858912673458, 'edge_cap': 0.3353555486940997, 'bull_strategy': 'breakout', 'bull_bb_std_mult': 3.400635660809579, 'bull_rsi_os': 45, 'bull_rsi_ob': 61, 'bull_adx_thresh': 28.945077558411818, 'bull_atr_min_pct': 0.002846102024219189, 'bull_atr_max_pct': 0.03719891983754043, 'bull_tp_mult': 2.438128284145649, 'bull_tsl_mult': 0.4124539465212627, 'bull_time_stop': 215, 'bull_use_sma': True, 'bull_use_ema': True, 'bull_use_atr': True, 'bull_use_adx': False, 'bull_use_spike': True, 'bull_rsi_required': True, 'bear_strategy': 'breakout', 'bear_bb_std_mult': 3.597680554405605, 'bear_rsi_os': 10, 'bear_rsi_ob': 49, 'bear_adx_thresh': 12.365997474095746, 'bear_atr_min_pct': 0.010180897271955933, 'bear_atr_max_pct': 0.045873152452933046, 'bear_tp_mult': 2.051581280926736, 'bear_tsl_mult': 0.5706097325888102, 'bear_time_stop': 73, 'bear_use_sma': True, 'bear_use_ema': True, 'bear_use_atr': True, 'bear_use_adx': True, 'bear_use_spike': False, 'bear_rsi_required': True, 'sideways_strategy': 'breakout', 'sideways_bb_std_mult': 2.8933310945948114, 'sideways_rsi_os': 50, 'sideways_rsi_ob': 63, 'sideways_adx_thresh': 9.212139172391554, 'sideways_atr_min_pct': 0.027269379526291666, 'sideways_atr_max_pct': 0.06217215567844396, 'sideways_tp_mult': 2.4735777707980215, 'sideways_tsl_mult': 0.9221652616469507, 'sideways_time_stop': 174, 'sideways_use_sma': True, 'sideways_use_ema': False, 'sideways_use_atr': True, 'sideways_use_adx': True, 'sideways_use_spike': False, 'sideways_rsi_required': True}.
[I 2025-09-01 14:42:39,348] Trial 670 finished with values: [-0.031658954653774884, 0.03133642522463306] and parameters: {'p_sma': 31, 'p_std': 39, 'p_atr': 25, 'p_adx': 11, 'rsi_period': 45, 'ema1': 23, 'ema2': 50, 'slip_atr_k': 0.11002588593980032, 'slip_spread_k': 0.5136540390069559, 'spread_hl_frac': 0.004439194353717035, 'bb_std_mult': 2.179889776649245, 'rsi_os': 38, 'rsi_ob': 81, 'vol_spike': 0.1502336962110756, 'adx_thresh': 25.456930224185086, 'atr_min_pct': 0.004310959369715607, 'atr_max_pct': 0.13961479084873427, 'tp_mult': 1.1104213986705938, 'tsl_mult': 0.7461855933721807, 'strategy': 'mean_reversion', 'time_stop': 246, 'use_sma': True, 'use_atr': False, 'use_adx': False, 'use_ema': False, 'use_spike': False, 'rsi_required': False, 'edge_k': 0.8991008971367436, 'edge_cap': 0.984974288912227, 'bull_strategy': 'mean_reversion', 'bull_bb_std_mult': 1.9294039176604092, 'bull_rsi_os': 55, 'bull_rsi_ob': 62, 'bull_adx_thresh': 33.163745771758954, 'bull_atr_min_pct': 0.0030501086484969924, 'bull_atr_max_pct': 0.1497863886082324, 'bull_tp_mult': 2.7353431644159345, 'bull_tsl_mult': 0.8855565677624747, 'bull_time_stop': 164, 'bull_use_sma': False, 'bull_use_ema': False, 'bull_use_atr': True, 'bull_use_adx': True, 'bull_use_spike': False, 'bull_rsi_required': False, 'bear_strategy': 'breakout', 'bear_bb_std_mult': 3.48112450331325, 'bear_rsi_os': 33, 'bear_rsi_ob': 49, 'bear_adx_thresh': 17.680203317073676, 'bear_atr_min_pct': 0.002909469530699039, 'bear_atr_max_pct': 0.04611271384335022, 'bear_tp_mult': 1.6059702632979926, 'bear_tsl_mult': 0.5746907368095829, 'bear_time_stop': 228, 'bear_use_sma': False, 'bear_use_ema': False, 'bear_use_atr': False, 'bear_use_adx': True, 'bear_use_spike': False, 'bear_rsi_required': False, 'sideways_strategy': 'mean_reversion', 'sideways_bb_std_mult': 1.6793722451034492, 'sideways_rsi_os': 50, 'sideways_rsi_ob': 91, 'sideways_adx_thresh': 19.434775491664166, 'sideways_atr_min_pct': 0.026849952824821197, 'sideways_atr_max_pct': 0.06816711817505042, 'sideways_tp_mult': 2.692582806553613, 'sideways_tsl_mult': 0.6344179475371778, 'sideways_time_stop': 155, 'sideways_use_sma': False, 'sideways_use_ema': False, 'sideways_use_atr': True, 'sideways_use_adx': True, 'sideways_use_spike': False, 'sideways_rsi_required': False}.
[I 2025-09-01 14:42:40,483] Trial 672 finished with values: [-1000000000.0, 1000000000.0] and parameters: {'p_sma': 39, 'p_std': 44, 'p_atr': 25, 'p_adx': 14, 'rsi_period': 65, 'ema1': 20, 'ema2': 53, 'slip_atr_k': 0.08358951993557223, 'slip_spread_k': 0.17830269145850436, 'spread_hl_frac': 0.005147680955948718, 'bb_std_mult': 2.173151430445585, 'rsi_os': 18, 'rsi_ob': 74, 'vol_spike': 0.1064851775470183, 'adx_thresh': 27.410751085088787, 'atr_min_pct': 0.0243769468151487, 'atr_max_pct': 0.0665715599395432, 'tp_mult': 1.1126910992387953, 'tsl_mult': 0.48972631561489505, 'strategy': 'mean_reversion', 'time_stop': 102, 'use_sma': False, 'use_atr': False, 'use_adx': False, 'use_ema': False, 'use_spike': False, 'rsi_required': False, 'edge_k': 0.8858305000646594, 'edge_cap': 0.35699799842582836, 'bull_strategy': 'mean_reversion', 'bull_bb_std_mult': 3.3325048465459624, 'bull_rsi_os': 46, 'bull_rsi_ob': 54, 'bull_adx_thresh': 12.511445936276235, 'bull_atr_min_pct': 0.02739342766156689, 'bull_atr_max_pct': 0.01762060152865349, 'bull_tp_mult': 2.7422692950532097, 'bull_tsl_mult': 0.45911264548999675, 'bull_time_stop': 84, 'bull_use_sma': False, 'bull_use_ema': False, 'bull_use_atr': True, 'bull_use_adx': True, 'bull_use_spike': False, 'bull_rsi_required': False, 'bear_strategy': 'breakout', 'bear_bb_std_mult': 3.4877688032009173, 'bear_rsi_os': 36, 'bear_rsi_ob': 88, 'bear_adx_thresh': 10.73234209137856, 'bear_atr_min_pct': 0.002669579393609707, 'bear_atr_max_pct': 0.016916349384817383, 'bear_tp_mult': 2.33846428780844, 'bear_tsl_mult': 0.08816961948363325, 'bear_time_stop': 221, 'bear_use_sma': False, 'bear_use_ema': False, 'bear_use_atr': False, 'bear_use_adx': True, 'bear_use_spike': False, 'bear_rsi_required': False, 'sideways_strategy': 'mean_reversion', 'sideways_bb_std_mult': 0.920434002315144, 'sideways_rsi_os': 30, 'sideways_rsi_ob': 64, 'sideways_adx_thresh': 16.819762323141653, 'sideways_atr_min_pct': 0.0235555377016532, 'sideways_atr_max_pct': 0.07102970268062314, 'sideways_tp_mult': 2.597447295874463, 'sideways_tsl_mult': 0.6446393508625219, 'sideways_time_stop': 187, 'sideways_use_sma': False, 'sideways_use_ema': False, 'sideways_use_atr': True, 'sideways_use_adx': False, 'sideways_use_spike': False, 'sideways_rsi_required': False}.
[I 2025-09-01 14:42:41,191] Trial 671 finished with values: [-1000000000.0, 1000000000.0] and parameters: {'p_sma': 39, 'p_std': 47, 'p_atr': 25, 'p_adx': 11, 'rsi_period': 45, 'ema1': 22, 'ema2': 41, 'slip_atr_k': 0.006860633501685022, 'slip_spread_k': 0.11871878838587024, 'spread_hl_frac': 0.013664751654907423, 'bb_std_mult': 0.5651933784465801, 'rsi_os': 26, 'rsi_ob': 83, 'vol_spike': 0.10903004535644664, 'adx_thresh': 25.139047296612716, 'atr_min_pct': 0.02442977361874204, 'atr_max_pct': 0.1400313899212573, 'tp_mult': 1.1138203577326347, 'tsl_mult': 0.25387301016876956, 'strategy': 'mean_reversion', 'time_stop': 246, 'use_sma': True, 'use_atr': False, 'use_adx': False, 'use_ema': False, 'use_spike': False, 'rsi_required': False, 'edge_k': 0.8863599237360886, 'edge_cap': 0.3438243831463568, 'bull_strategy': 'mean_reversion', 'bull_bb_std_mult': 0.8771440413871399, 'bull_rsi_os': 35, 'bull_rsi_ob': 62, 'bull_adx_thresh': 29.115021848756864, 'bull_atr_min_pct': 0.002913117770978727, 'bull_atr_max_pct': 0.016905870628081913, 'bull_tp_mult': 2.048609977614052, 'bull_tsl_mult': 0.94118084525344, 'bull_time_stop': 96, 'bull_use_sma': False, 'bull_use_ema': False, 'bull_use_atr': True, 'bull_use_adx': True, 'bull_use_spike': True, 'bull_rsi_required': False, 'bear_strategy': 'breakout', 'bear_bb_std_mult': 3.472609460907831, 'bear_rsi_os': 8, 'bear_rsi_ob': 60, 'bear_adx_thresh': 9.713762260663483, 'bear_atr_min_pct': 0.010535673722744773, 'bear_atr_max_pct': 0.14992631262002748, 'bear_tp_mult': 2.339394674210069, 'bear_tsl_mult': 0.2663396843586675, 'bear_time_stop': 224, 'bear_use_sma': False, 'bear_use_ema': False, 'bear_use_atr': False, 'bear_use_adx': True, 'bear_use_spike': False, 'bear_rsi_required': False, 'sideways_strategy': 'mean_reversion', 'sideways_bb_std_mult': 1.6681894242153832, 'sideways_rsi_os': 44, 'sideways_rsi_ob': 68, 'sideways_adx_thresh': 25.31351332493632, 'sideways_atr_min_pct': 0.028434963554764013, 'sideways_atr_max_pct': 0.11365018534940856, 'sideways_tp_mult': 2.6829385760352285, 'sideways_tsl_mult': 0.270485613729424, 'sideways_time_stop': 51, 'sideways_use_sma': False, 'sideways_use_ema': False, 'sideways_use_atr': True, 'sideways_use_adx': False, 'sideways_use_spike': False, 'sideways_rsi_required': False}.
[I 2025-09-01 14:42:41,519] Trial 669 finished with values: [-1000000000.0, 1000000000.0] and parameters: {'p_sma': 5, 'p_std': 47, 'p_atr': 25, 'p_adx': 11, 'rsi_period': 65, 'ema1': 21, 'ema2': 50, 'slip_atr_k': 0.12102423651567579, 'slip_spread_k': 0.1230994937326169, 'spread_hl_frac': 0.004393535888277093, 'bb_std_mult': 1.7150656333648078, 'rsi_os': 38, 'rsi_ob': 81, 'vol_spike': 0.2095117865053578, 'adx_thresh': 25.298382495992264, 'atr_min_pct': 0.02452666744941453, 'atr_max_pct': 0.13972762908820255, 'tp_mult': 1.108089484360026, 'tsl_mult': 0.4722969595998786, 'strategy': 'mean_reversion', 'time_stop': 71, 'use_sma': True, 'use_atr': False, 'use_adx': False, 'use_ema': False, 'use_spike': True, 'rsi_required': False, 'edge_k': 0.901159581433217, 'edge_cap': 0.5216033020289679, 'bull_strategy': 'breakout', 'bull_bb_std_mult': 3.362068387887102, 'bull_rsi_os': 33, 'bull_rsi_ob': 61, 'bull_adx_thresh': 12.323891872377487, 'bull_atr_min_pct': 0.002946065337231951, 'bull_atr_max_pct': 0.037723939461097186, 'bull_tp_mult': 2.447000818171648, 'bull_tsl_mult': 0.47012993325442903, 'bull_time_stop': 141, 'bull_use_sma': True, 'bull_use_ema': True, 'bull_use_atr': True, 'bull_use_adx': True, 'bull_use_spike': False, 'bull_rsi_required': True, 'bear_strategy': 'breakout', 'bear_bb_std_mult': 0.5047125940799229, 'bear_rsi_os': 53, 'bear_rsi_ob': 75, 'bear_adx_thresh': 17.913147481977614, 'bear_atr_min_pct': 0.01468822539237244, 'bear_atr_max_pct': 0.04631492927605406, 'bear_tp_mult': 2.259503317607717, 'bear_tsl_mult': 0.17595840055410666, 'bear_time_stop': 227, 'bear_use_sma': True, 'bear_use_ema': True, 'bear_use_atr': False, 'bear_use_adx': True, 'bear_use_spike': False, 'bear_rsi_required': True, 'sideways_strategy': 'breakout', 'sideways_bb_std_mult': 1.6456358638078368, 'sideways_rsi_os': 23, 'sideways_rsi_ob': 91, 'sideways_adx_thresh': 19.274131182189993, 'sideways_atr_min_pct': 0.02070579613898066, 'sideways_atr_max_pct': 0.062280600446226, 'sideways_tp_mult': 2.6772551164840337, 'sideways_tsl_mult': 0.2934095171475064, 'sideways_time_stop': 155, 'sideways_use_sma': True, 'sideways_use_ema': False, 'sideways_use_atr': True, 'sideways_use_adx': True, 'sideways_use_spike': False, 'sideways_rsi_required': True}.
[I 2025-09-01 14:43:21,053] Trial 674 finished with values: [-0.04304873554246391, 0.04412199166245264] and parameters: {'p_sma': 50, 'p_std': 30, 'p_atr': 26, 'p_adx': 30, 'rsi_period': 72, 'ema1': 12, 'ema2': 19, 'slip_atr_k': 0.007423173528078782, 'slip_spread_k': 0.11688027930389258, 'spread_hl_frac': 0.012276902896254549, 'bb_std_mult': 1.6108677332017498, 'rsi_os': 27, 'rsi_ob': 83, 'vol_spike': 0.24685772430659353, 'adx_thresh': 18.332745556452345, 'atr_min_pct': 0.026166515815401362, 'atr_max_pct': 0.1434129158506696, 'tp_mult': 1.0104091028800422, 'tsl_mult': 0.7180781537143335, 'strategy': 'breakout', 'time_stop': 109, 'use_sma': True, 'use_atr': True, 'use_adx': False, 'use_ema': True, 'use_spike': True, 'rsi_required': False, 'edge_k': 0.7829423920337911, 'edge_cap': 0.25930479919050503, 'bull_strategy': 'breakout', 'bull_bb_std_mult': 3.240803806083629, 'bull_rsi_os': 38, 'bull_rsi_ob': 77, 'bull_adx_thresh': 30.620025902138753, 'bull_atr_min_pct': 0.0035153000619256468, 'bull_atr_max_pct': 0.09719721961263475, 'bull_tp_mult': 2.923629818750471, 'bull_tsl_mult': 0.331111291706483, 'bull_time_stop': 107, 'bull_use_sma': True, 'bull_use_ema': True, 'bull_use_atr': True, 'bull_use_adx': True, 'bull_use_spike': False, 'bull_rsi_required': True, 'bear_strategy': 'breakout', 'bear_bb_std_mult': 2.7730016808318987, 'bear_rsi_os': 48, 'bear_rsi_ob': 46, 'bear_adx_thresh': 11.833877188096944, 'bear_atr_min_pct': 0.0032853931995161026, 'bear_atr_max_pct': 0.050516870577908844, 'bear_tp_mult': 2.272079703006876, 'bear_tsl_mult': 0.6931030687698503, 'bear_time_stop': 127, 'bear_use_sma': True, 'bear_use_ema': True, 'bear_use_atr': True, 'bear_use_adx': True, 'bear_use_spike': False, 'bear_rsi_required': True, 'sideways_strategy': 'breakout', 'sideways_bb_std_mult': 1.649261641820312, 'sideways_rsi_os': 21, 'sideways_rsi_ob': 68, 'sideways_adx_thresh': 33.011135017658944, 'sideways_atr_min_pct': 0.012703436480018954, 'sideways_atr_max_pct': 0.06725981532609497, 'sideways_tp_mult': 1.745899407534162, 'sideways_tsl_mult': 0.318280520973363, 'sideways_time_stop': 182, 'sideways_use_sma': True, 'sideways_use_ema': False, 'sideways_use_atr': True, 'sideways_use_adx': True, 'sideways_use_spike': False, 'sideways_rsi_required': True}.
[I 2025-09-01 14:43:22,979] Trial 673 finished with values: [-1000000000.0, 1000000000.0] and parameters: {'p_sma': 39, 'p_std': 59, 'p_atr': 26, 'p_adx': 10, 'rsi_period': 65, 'ema1': 20, 'ema2': 39, 'slip_atr_k': 0.1946985849827071, 'slip_spread_k': 0.16771733566448987, 'spread_hl_frac': 0.013810196475580131, 'bb_std_mult': 1.6142970820693379, 'rsi_os': 39, 'rsi_ob': 83, 'vol_spike': 0.24822005902246175, 'adx_thresh': 28.926045973099356, 'atr_min_pct': 0.024722122306064725, 'atr_max_pct': 0.14369396839483387, 'tp_mult': 1.0976798419305906, 'tsl_mult': 0.7239543642508325, 'strategy': 'breakout', 'time_stop': 111, 'use_sma': False, 'use_atr': False, 'use_adx': False, 'use_ema': False, 'use_spike': True, 'rsi_required': False, 'edge_k': 0.949564710314037, 'edge_cap': 0.5243703028601499, 'bull_strategy': 'breakout', 'bull_bb_std_mult': 0.8839373941480215, 'bull_rsi_os': 38, 'bull_rsi_ob': 54, 'bull_adx_thresh': 30.526572627851962, 'bull_atr_min_pct': 0.0035009044552139585, 'bull_atr_max_pct': 0.09392660784348014, 'bull_tp_mult': 2.8638638707553703, 'bull_tsl_mult': 0.46798781151325475, 'bull_time_stop': 96, 'bull_use_sma': True, 'bull_use_ema': True, 'bull_use_atr': True, 'bull_use_adx': True, 'bull_use_spike': False, 'bull_rsi_required': True, 'bear_strategy': 'breakout', 'bear_bb_std_mult': 3.4930238141247547, 'bear_rsi_os': 8, 'bear_rsi_ob': 88, 'bear_adx_thresh': 10.786688520646518, 'bear_atr_min_pct': 0.002437368376685849, 'bear_atr_max_pct': 0.01729064451262312, 'bear_tp_mult': 2.3238795835662525, 'bear_tsl_mult': 0.12921520355495072, 'bear_time_stop': 12, 'bear_use_sma': True, 'bear_use_ema': True, 'bear_use_atr': False, 'bear_use_adx': True, 'bear_use_spike': False, 'bear_rsi_required': True, 'sideways_strategy': 'breakout', 'sideways_bb_std_mult': 1.41166217550164, 'sideways_rsi_os': 40, 'sideways_rsi_ob': 64, 'sideways_adx_thresh': 16.65417387154456, 'sideways_atr_min_pct': 0.020708411351161506, 'sideways_atr_max_pct': 0.07145676968188544, 'sideways_tp_mult': 2.0044187520610364, 'sideways_tsl_mult': 0.3181701619045566, 'sideways_time_stop': 237, 'sideways_use_sma': True, 'sideways_use_ema': False, 'sideways_use_atr': True, 'sideways_use_adx': False, 'sideways_use_spike': False, 'sideways_rsi_required': True}.
