[I 2025-09-01 14:56:46,590] Trial 765 finished with values: [-1000000000.0, 1000000000.0] and parameters: {'p_sma': 41, 'p_std': 35, 'p_atr': 24, 'p_adx': 11, 'rsi_period': 51, 'ema1': 22, 'ema2': 33, 'slip_atr_k': 0.049510053743084814, 'slip_spread_k': 0.5781121526802983, 'spread_hl_frac': 0.003400816355793012, 'bb_std_mult': 0.7916790483083318, 'rsi_os': 40, 'rsi_ob': 82, 'vol_spike': 0.27684598233806007, 'adx_thresh': 24.85357058217733, 'atr_min_pct': 0.007397893470208938, 'atr_max_pct': 0.11946870500645473, 'tp_mult': 1.1547184493584075, 'tsl_mult': 0.7960339061587965, 'strategy': 'breakout', 'time_stop': 56, 'use_sma': False, 'use_atr': True, 'use_adx': True, 'use_ema': False, 'use_spike': False, 'rsi_required': True, 'edge_k': 0.8503294352118189, 'edge_cap': 0.33942667983716024, 'bull_strategy': 'mean_reversion', 'bull_bb_std_mult': 1.3022724701565926, 'bull_rsi_os': 38, 'bull_rsi_ob': 57, 'bull_adx_thresh': 31.47232857416778, 'bull_atr_min_pct': 0.025699598942190535, 'bull_atr_max_pct': 0.1047420880427607, 'bull_tp_mult': 1.7229397969159288, 'bull_tsl_mult': 0.40037499428497336, 'bull_time_stop': 108, 'bull_use_sma': False, 'bull_use_ema': False, 'bull_use_atr': False, 'bull_use_adx': False, 'bull_use_spike': True, 'bull_rsi_required': False, 'bear_strategy': 'breakout', 'bear_bb_std_mult': 1.6114718095355551, 'bear_rsi_os': 50, 'bear_rsi_ob': 82, 'bear_adx_thresh': 18.376995105665316, 'bear_atr_min_pct': 0.011017930074558265, 'bear_atr_max_pct': 0.14207072297264428, 'bear_tp_mult': 1.878212238303215, 'bear_tsl_mult': 0.1749168291748884, 'bear_time_stop': 44, 'bear_use_sma': False, 'bear_use_ema': False, 'bear_use_atr': False, 'bear_use_adx': False, 'bear_use_spike': True, 'bear_rsi_required': False, 'sideways_strategy': 'mean_reversion', 'sideways_bb_std_mult': 1.7072454705418858, 'sideways_rsi_os': 50, 'sideways_rsi_ob': 87, 'sideways_adx_thresh': 6.5338833533197045, 'sideways_atr_min_pct': 0.016840895940261207, 'sideways_atr_max_pct': 0.0649072670968229, 'sideways_tp_mult': 1.6532426974936039, 'sideways_tsl_mult': 0.5608284691414158, 'sideways_time_stop': 108, 'sideways_use_sma': False, 'sideways_use_ema': True, 'sideways_use_atr': False, 'sideways_use_adx': False, 'sideways_use_spike': False, 'sideways_rsi_required': False}.
[I 2025-09-01 14:56:47,442] Trial 767 finished with values: [-0.03308249532818186, 0.0339612835435396] and parameters: {'p_sma': 34, 'p_std': 35, 'p_atr': 18, 'p_adx': 13, 'rsi_period': 72, 'ema1': 20, 'ema2': 10, 'slip_atr_k': 0.010106438335800121, 'slip_spread_k': 0.5789459877702384, 'spread_hl_frac': 0.0179883024064513, 'bb_std_mult': 1.6826387188935803, 'rsi_os': 40, 'rsi_ob': 84, 'vol_spike': 0.23300394147877626, 'adx_thresh': 26.27987633363218, 'atr_min_pct': 0.01068380084162909, 'atr_max_pct': 0.13956980020947593, 'tp_mult': 1.1948878792221496, 'tsl_mult': 0.8073712538205504, 'strategy': 'breakout', 'time_stop': 54, 'use_sma': True, 'use_atr': True, 'use_adx': True, 'use_ema': False, 'use_spike': False, 'rsi_required': True, 'edge_k': 0.716420600706471, 'edge_cap': 0.33419535907694664, 'bull_strategy': 'mean_reversion', 'bull_bb_std_mult': 3.1848950285479956, 'bull_rsi_os': 7, 'bull_rsi_ob': 94, 'bull_adx_thresh': 29.53405721697498, 'bull_atr_min_pct': 0.004139711617415972, 'bull_atr_max_pct': 0.029341214454578015, 'bull_tp_mult': 1.875817674412512, 'bull_tsl_mult': 0.24985529620972258, 'bull_time_stop': 266, 'bull_use_sma': False, 'bull_use_ema': False, 'bull_use_atr': False, 'bull_use_adx': True, 'bull_use_spike': False, 'bull_rsi_required': False, 'bear_strategy': 'mean_reversion', 'bear_bb_std_mult': 0.6850715329616239, 'bear_rsi_os': 32, 'bear_rsi_ob': 47, 'bear_adx_thresh': 23.131641076695374, 'bear_atr_min_pct': 0.0034301537137959907, 'bear_atr_max_pct': 0.04958228645031894, 'bear_tp_mult': 2.5412492489943723, 'bear_tsl_mult': 0.17227027882692567, 'bear_time_stop': 283, 'bear_use_sma': False, 'bear_use_ema': False, 'bear_use_atr': False, 'bear_use_adx': False, 'bear_use_spike': True, 'bear_rsi_required': False, 'sideways_strategy': 'mean_reversion', 'sideways_bb_std_mult': 3.03598005219437, 'sideways_rsi_os': 51, 'sideways_rsi_ob': 85, 'sideways_adx_thresh': 7.436915892930403, 'sideways_atr_min_pct': 0.015481738649997365, 'sideways_atr_max_pct': 0.06592215557476383, 'sideways_tp_mult': 2.7843946737839698, 'sideways_tsl_mult': 0.2775409471742695, 'sideways_time_stop': 107, 'sideways_use_sma': False, 'sideways_use_ema': True, 'sideways_use_atr': False, 'sideways_use_adx': True, 'sideways_use_spike': True, 'sideways_rsi_required': False}.
[I 2025-09-01 14:56:47,900] Trial 766 finished with values: [-1000000000.0, 1000000000.0] and parameters: {'p_sma': 38, 'p_std': 35, 'p_atr': 15, 'p_adx': 13, 'rsi_period': 13, 'ema1': 13, 'ema2': 33, 'slip_atr_k': 0.1397789605389869, 'slip_spread_k': 0.08923349837350761, 'spread_hl_frac': 0.004327528084799047, 'bb_std_mult': 0.8887973250171244, 'rsi_os': 22, 'rsi_ob': 84, 'vol_spike': 0.2333463330094566, 'adx_thresh': 26.147491044389817, 'atr_min_pct': 0.010871398727977752, 'atr_max_pct': 0.012867226405951726, 'tp_mult': 1.1584437341478029, 'tsl_mult': 0.2962025815135543, 'strategy': 'breakout', 'time_stop': 150, 'use_sma': False, 'use_atr': True, 'use_adx': True, 'use_ema': True, 'use_spike': False, 'rsi_required': True, 'edge_k': 0.8748938583638997, 'edge_cap': 0.3272377069825564, 'bull_strategy': 'mean_reversion', 'bull_bb_std_mult': 3.4164374215007234, 'bull_rsi_os': 44, 'bull_rsi_ob': 57, 'bull_adx_thresh': 30.395882950795617, 'bull_atr_min_pct': 0.004480214266831352, 'bull_atr_max_pct': 0.016406445283188954, 'bull_tp_mult': 2.6943578224522238, 'bull_tsl_mult': 0.13527285302736097, 'bull_time_stop': 226, 'bull_use_sma': False, 'bull_use_ema': False, 'bull_use_atr': False, 'bull_use_adx': False, 'bull_use_spike': False, 'bull_rsi_required': False, 'bear_strategy': 'mean_reversion', 'bear_bb_std_mult': 1.6008214914530676, 'bear_rsi_os': 5, 'bear_rsi_ob': 88, 'bear_adx_thresh': 30.424634015366085, 'bear_atr_min_pct': 0.0033936565891234333, 'bear_atr_max_pct': 0.04290163556892989, 'bear_tp_mult': 2.3548998654502, 'bear_tsl_mult': 0.17810638604157464, 'bear_time_stop': 300, 'bear_use_sma': False, 'bear_use_ema': False, 'bear_use_atr': True, 'bear_use_adx': False, 'bear_use_spike': True, 'bear_rsi_required': False, 'sideways_strategy': 'mean_reversion', 'sideways_bb_std_mult': 1.4587596865038934, 'sideways_rsi_os': 50, 'sideways_rsi_ob': 64, 'sideways_adx_thresh': 20.172143232752326, 'sideways_atr_min_pct': 0.016695443389749976, 'sideways_atr_max_pct': 0.06559566308108507, 'sideways_tp_mult': 1.673873621272366, 'sideways_tsl_mult': 0.17692239611345495, 'sideways_time_stop': 238, 'sideways_use_sma': False, 'sideways_use_ema': True, 'sideways_use_atr': False, 'sideways_use_adx': True, 'sideways_use_spike': True, 'sideways_rsi_required': False}.
[I 2025-09-01 14:57:34,603] Trial 771 finished with values: [-1000000000.0, 1000000000.0] and parameters: {'p_sma': 35, 'p_std': 52, 'p_atr': 26, 'p_adx': 12, 'rsi_period': 68, 'ema1': 12, 'ema2': 17, 'slip_atr_k': 0.009413965790300516, 'slip_spread_k': 0.8643905504945145, 'spread_hl_frac': 0.009488733418784126, 'bb_std_mult': 2.4109993581454328, 'rsi_os': 20, 'rsi_ob': 53, 'vol_spike': 0.2402112628341387, 'adx_thresh': 23.076219834208665, 'atr_min_pct': 0.01592036120685339, 'atr_max_pct': 0.14125344607144397, 'tp_mult': 1.0899269588136806, 'tsl_mult': 0.6719890866937666, 'strategy': 'mean_reversion', 'time_stop': 249, 'use_sma': True, 'use_atr': False, 'use_adx': False, 'use_ema': True, 'use_spike': True, 'rsi_required': False, 'edge_k': 0.07288197905470661, 'edge_cap': 0.30891711868294347, 'bull_strategy': 'breakout', 'bull_bb_std_mult': 1.4497933084003964, 'bull_rsi_os': 34, 'bull_rsi_ob': 53, 'bull_adx_thresh': 34.407180658826405, 'bull_atr_min_pct': 0.021498657422573907, 'bull_atr_max_pct': 0.06752583644307475, 'bull_tp_mult': 2.7517043514939132, 'bull_tsl_mult': 0.8915239391697809, 'bull_time_stop': 74, 'bull_use_sma': True, 'bull_use_ema': True, 'bull_use_atr': True, 'bull_use_adx': True, 'bull_use_spike': False, 'bull_rsi_required': True, 'bear_strategy': 'breakout', 'bear_bb_std_mult': 3.3402871136246897, 'bear_rsi_os': 9, 'bear_rsi_ob': 60, 'bear_adx_thresh': 6.447156067186986, 'bear_atr_min_pct': 0.004285913514104674, 'bear_atr_max_pct': 0.04623456734951647, 'bear_tp_mult': 2.9365594396210195, 'bear_tsl_mult': 0.7844177730100261, 'bear_time_stop': 225, 'bear_use_sma': True, 'bear_use_ema': True, 'bear_use_atr': True, 'bear_use_adx': True, 'bear_use_spike': False, 'bear_rsi_required': True, 'sideways_strategy': 'breakout', 'sideways_bb_std_mult': 2.6932961385572955, 'sideways_rsi_os': 53, 'sideways_rsi_ob': 70, 'sideways_adx_thresh': 7.421150323278825, 'sideways_atr_min_pct': 0.005260131772240459, 'sideways_atr_max_pct': 0.06867631103326596, 'sideways_tp_mult': 1.5490740119207125, 'sideways_tsl_mult': 0.6207537645091531, 'sideways_time_stop': 178, 'sideways_use_sma': True, 'sideways_use_ema': False, 'sideways_use_atr': True, 'sideways_use_adx': True, 'sideways_use_spike': False, 'sideways_rsi_required': True}.
[I 2025-09-01 14:57:35,917] Trial 770 finished with values: [-1000000000.0, 1000000000.0] and parameters: {'p_sma': 35, 'p_std': 47, 'p_atr': 26, 'p_adx': 29, 'rsi_period': 80, 'ema1': 12, 'ema2': 49, 'slip_atr_k': 0.00016776970012226562, 'slip_spread_k': 0.8005882695993243, 'spread_hl_frac': 0.008250889916240425, 'bb_std_mult': 0.8909298942681736, 'rsi_os': 12, 'rsi_ob': 81, 'vol_spike': 0.02190837527790257, 'adx_thresh': 9.051051069539044, 'atr_min_pct': 0.02640004251759021, 'atr_max_pct': 0.14165553500046418, 'tp_mult': 1.0835955237652535, 'tsl_mult': 0.896337421060944, 'strategy': 'mean_reversion', 'time_stop': 41, 'use_sma': True, 'use_atr': False, 'use_adx': False, 'use_ema': True, 'use_spike': True, 'rsi_required': False, 'edge_k': 0.35239264816484817, 'edge_cap': 0.30647628217932116, 'bull_strategy': 'breakout', 'bull_bb_std_mult': 1.4479961083042423, 'bull_rsi_os': 33, 'bull_rsi_ob': 86, 'bull_adx_thresh': 30.35633168707024, 'bull_atr_min_pct': 0.015668719065916048, 'bull_atr_max_pct': 0.016117685705536844, 'bull_tp_mult': 2.693641803554584, 'bull_tsl_mult': 0.5066023703063063, 'bull_time_stop': 74, 'bull_use_sma': True, 'bull_use_ema': True, 'bull_use_atr': True, 'bull_use_adx': True, 'bull_use_spike': False, 'bull_rsi_required': True, 'bear_strategy': 'mean_reversion', 'bear_bb_std_mult': 1.8691025130156473, 'bear_rsi_os': 5, 'bear_rsi_ob': 88, 'bear_adx_thresh': 31.53707564869282, 'bear_atr_min_pct': 0.0025239185136487793, 'bear_atr_max_pct': 0.04208917731732305, 'bear_tp_mult': 2.6075836188740205, 'bear_tsl_mult': 0.2758809390363691, 'bear_time_stop': 224, 'bear_use_sma': True, 'bear_use_ema': True, 'bear_use_atr': True, 'bear_use_adx': True, 'bear_use_spike': False, 'bear_rsi_required': True, 'sideways_strategy': 'breakout', 'sideways_bb_std_mult': 3.5989590008421715, 'sideways_rsi_os': 23, 'sideways_rsi_ob': 64, 'sideways_adx_thresh': 7.28565927438224, 'sideways_atr_min_pct': 0.020061237604396612, 'sideways_atr_max_pct': 0.06916112644656587, 'sideways_tp_mult': 2.7518041836739777, 'sideways_tsl_mult': 0.28156747308849855, 'sideways_time_stop': 53, 'sideways_use_sma': True, 'sideways_use_ema': False, 'sideways_use_atr': True, 'sideways_use_adx': True, 'sideways_use_spike': True, 'sideways_rsi_required': True}.
[I 2025-09-01 14:57:36,169] Trial 769 finished with values: [-1000000000.0, 1000000000.0] and parameters: {'p_sma': 26, 'p_std': 47, 'p_atr': 26, 'p_adx': 9, 'rsi_period': 71, 'ema1': 27, 'ema2': 25, 'slip_atr_k': 0.06604675631320657, 'slip_spread_k': 0.08374982452841852, 'spread_hl_frac': 0.008280189258781004, 'bb_std_mult': 3.2095980322403586, 'rsi_os': 12, 'rsi_ob': 84, 'vol_spike': 0.23563452139971156, 'adx_thresh': 19.298194446183043, 'atr_min_pct': 0.026513737169246314, 'atr_max_pct': 0.14030708489472746, 'tp_mult': 1.6371487012116714, 'tsl_mult': 0.2373135238588589, 'strategy': 'mean_reversion', 'time_stop': 41, 'use_sma': True, 'use_atr': False, 'use_adx': True, 'use_ema': True, 'use_spike': True, 'rsi_required': False, 'edge_k': 0.3524237701544679, 'edge_cap': 0.8312565757314325, 'bull_strategy': 'breakout', 'bull_bb_std_mult': 2.9371170231146952, 'bull_rsi_os': 34, 'bull_rsi_ob': 94, 'bull_adx_thresh': 34.43864282751992, 'bull_atr_min_pct': 0.021397848173020796, 'bull_atr_max_pct': 0.02921432454399104, 'bull_tp_mult': 1.4459574005466118, 'bull_tsl_mult': 0.8486096639219299, 'bull_time_stop': 100, 'bull_use_sma': True, 'bull_use_ema': True, 'bull_use_atr': False, 'bull_use_adx': True, 'bull_use_spike': False, 'bull_rsi_required': True, 'bear_strategy': 'mean_reversion', 'bear_bb_std_mult': 3.5152649114914456, 'bear_rsi_os': 32, 'bear_rsi_ob': 88, 'bear_adx_thresh': 23.362160141652826, 'bear_atr_min_pct': 0.004217261606158536, 'bear_atr_max_pct': 0.07213174763522648, 'bear_tp_mult': 2.550774202535253, 'bear_tsl_mult': 0.34770909551016416, 'bear_time_stop': 134, 'bear_use_sma': True, 'bear_use_ema': True, 'bear_use_atr': True, 'bear_use_adx': True, 'bear_use_spike': True, 'bear_rsi_required': True, 'sideways_strategy': 'breakout', 'sideways_bb_std_mult': 3.5921625307560783, 'sideways_rsi_os': 53, 'sideways_rsi_ob': 76, 'sideways_adx_thresh': 7.240754894052797, 'sideways_atr_min_pct': 0.020025174832951423, 'sideways_atr_max_pct': 0.06842027696542428, 'sideways_tp_mult': 2.7813981216819177, 'sideways_tsl_mult': 0.27218760234043327, 'sideways_time_stop': 239, 'sideways_use_sma': True, 'sideways_use_ema': True, 'sideways_use_atr': False, 'sideways_use_adx': True, 'sideways_use_spike': True, 'sideways_rsi_required': True}.
[I 2025-09-01 14:57:36,512] Trial 768 finished with values: [-1000000000.0, 1000000000.0] and parameters: {'p_sma': 35, 'p_std': 49, 'p_atr': 26, 'p_adx': 13, 'rsi_period': 72, 'ema1': 20, 'ema2': 25, 'slip_atr_k': 0.13934049311666052, 'slip_spread_k': 0.09589219986274777, 'spread_hl_frac': 0.00855096141717779, 'bb_std_mult': 1.6352107805179386, 'rsi_os': 13, 'rsi_ob': 84, 'vol_spike': 0.020261148171878213, 'adx_thresh': 23.52073621503441, 'atr_min_pct': 0.02642529582899749, 'atr_max_pct': 0.14090776721460022, 'tp_mult': 1.4388485783351679, 'tsl_mult': 0.23234159496817908, 'strategy': 'breakout', 'time_stop': 54, 'use_sma': True, 'use_atr': True, 'use_adx': True, 'use_ema': True, 'use_spike': False, 'rsi_required': True, 'edge_k': 0.8469860237384459, 'edge_cap': 0.3057411811136378, 'bull_strategy': 'mean_reversion', 'bull_bb_std_mult': 3.2090130058019826, 'bull_rsi_os': 34, 'bull_rsi_ob': 57, 'bull_adx_thresh': 29.54183092492607, 'bull_atr_min_pct': 0.009463965620113252, 'bull_atr_max_pct': 0.017021485038225433, 'bull_tp_mult': 1.4359884117110964, 'bull_tsl_mult': 0.27247775376408584, 'bull_time_stop': 285, 'bull_use_sma': False, 'bull_use_ema': False, 'bull_use_atr': False, 'bull_use_adx': True, 'bull_use_spike': False, 'bull_rsi_required': False, 'bear_strategy': 'mean_reversion', 'bear_bb_std_mult': 1.5583767404862856, 'bear_rsi_os': 33, 'bear_rsi_ob': 88, 'bear_adx_thresh': 10.67533931508341, 'bear_atr_min_pct': 0.011139419642883319, 'bear_atr_max_pct': 0.04206171101933417, 'bear_tp_mult': 2.6114223508036005, 'bear_tsl_mult': 0.14716463297297916, 'bear_time_stop': 225, 'bear_use_sma': False, 'bear_use_ema': False, 'bear_use_atr': True, 'bear_use_adx': True, 'bear_use_spike': True, 'bear_rsi_required': False, 'sideways_strategy': 'mean_reversion', 'sideways_bb_std_mult': 3.044714288215138, 'sideways_rsi_os': 45, 'sideways_rsi_ob': 69, 'sideways_adx_thresh': 11.178523036982954, 'sideways_atr_min_pct': 0.020838635301273202, 'sideways_atr_max_pct': 0.06453925852467776, 'sideways_tp_mult': 2.7915773125942973, 'sideways_tsl_mult': 0.279107902383148, 'sideways_time_stop': 177, 'sideways_use_sma': False, 'sideways_use_ema': True, 'sideways_use_atr': False, 'sideways_use_adx': True, 'sideways_use_spike': True, 'sideways_rsi_required': False}.
[I 2025-09-01 14:57:37,701] Trial 775 finished with values: [-1000000000.0, 1000000000.0] and parameters: {'p_sma': 43, 'p_std': 17, 'p_atr': 21, 'p_adx': 16, 'rsi_period': 66, 'ema1': 10, 'ema2': 21, 'slip_atr_k': 0.015885546911914794, 'slip_spread_k': 0.044425444644351476, 'spread_hl_frac': 0.0067874215014228365, 'bb_std_mult': 1.8376353725472918, 'rsi_os': 53, 'rsi_ob': 77, 'vol_spike': 0.26204715610180707, 'adx_thresh': 7.245416938969278, 'atr_min_pct': 0.025562206598891052, 'atr_max_pct': 0.04572340246772127, 'tp_mult': 2.3991592729835847, 'tsl_mult': 0.749266057928323, 'strategy': 'mean_reversion', 'time_stop': 5, 'use_sma': True, 'use_atr': False, 'use_adx': False, 'use_ema': True, 'use_spike': True, 'rsi_required': False, 'edge_k': 1.875409121757856, 'edge_cap': 0.12364529795399876, 'bull_strategy': 'breakout', 'bull_bb_std_mult': 2.167708413915083, 'bull_rsi_os': 18, 'bull_rsi_ob': 54, 'bull_adx_thresh': 30.843437428042446, 'bull_atr_min_pct': 0.012253869359698943, 'bull_atr_max_pct': 0.1280011373447523, 'bull_tp_mult': 2.1285148110232277, 'bull_tsl_mult': 0.4235664316643675, 'bull_time_stop': 175, 'bull_use_sma': True, 'bull_use_ema': True, 'bull_use_atr': True, 'bull_use_adx': True, 'bull_use_spike': False, 'bull_rsi_required': True, 'bear_strategy': 'breakout', 'bear_bb_std_mult': 3.5388511270185443, 'bear_rsi_os': 19, 'bear_rsi_ob': 51, 'bear_adx_thresh': 11.363117803039161, 'bear_atr_min_pct': 0.014038108156813878, 'bear_atr_max_pct': 0.04949654711700917, 'bear_tp_mult': 1.9805320598864746, 'bear_tsl_mult': 0.10423353913878527, 'bear_time_stop': 190, 'bear_use_sma': True, 'bear_use_ema': True, 'bear_use_atr': True, 'bear_use_adx': True, 'bear_use_spike': False, 'bear_rsi_required': True, 'sideways_strategy': 'breakout', 'sideways_bb_std_mult': 1.498374640868764, 'sideways_rsi_os': 33, 'sideways_rsi_ob': 65, 'sideways_adx_thresh': 6.056821503005091, 'sideways_atr_min_pct': 0.01883632862468992, 'sideways_atr_max_pct': 0.07158045718774347, 'sideways_tp_mult': 2.180094990055574, 'sideways_tsl_mult': 0.0005090777420337922, 'sideways_time_stop': 163, 'sideways_use_sma': True, 'sideways_use_ema': False, 'sideways_use_atr': True, 'sideways_use_adx': True, 'sideways_use_spike': False, 'sideways_rsi_required': True}.
[I 2025-09-01 14:58:14,412] Trial 772 finished with values: [-1000000000.0, 1000000000.0] and parameters: {'p_sma': 37, 'p_std': 16, 'p_atr': 26, 'p_adx': 29, 'rsi_period': 66, 'ema1': 28, 'ema2': 49, 'slip_atr_k': 0.06651834425857395, 'slip_spread_k': 0.03821256076381235, 'spread_hl_frac': 0.008638556415918904, 'bb_std_mult': 2.9446133885354726, 'rsi_os': 7, 'rsi_ob': 81, 'vol_spike': 0.10338365496820823, 'adx_thresh': 7.222053044602651, 'atr_min_pct': 0.026453991919834448, 'atr_max_pct': 0.09691369000364572, 'tp_mult': 2.208863627364803, 'tsl_mult': 0.2356913663843288, 'strategy': 'mean_reversion', 'time_stop': 241, 'use_sma': True, 'use_atr': False, 'use_adx': False, 'use_ema': True, 'use_spike': True, 'rsi_required': False, 'edge_k': 1.046344353811623, 'edge_cap': 0.9827339597694857, 'bull_strategy': 'breakout', 'bull_bb_std_mult': 0.5829547646155089, 'bull_rsi_os': 49, 'bull_rsi_ob': 54, 'bull_adx_thresh': 30.308929370174653, 'bull_atr_min_pct': 0.014322127184894881, 'bull_atr_max_pct': 0.1392806504088612, 'bull_tp_mult': 2.1339147937460448, 'bull_tsl_mult': 0.4224609414705352, 'bull_time_stop': 64, 'bull_use_sma': True, 'bull_use_ema': True, 'bull_use_atr': True, 'bull_use_adx': True, 'bull_use_spike': False, 'bull_rsi_required': True, 'bear_strategy': 'breakout', 'bear_bb_std_mult': 1.892823496435259, 'bear_rsi_os': 33, 'bear_rsi_ob': 87, 'bear_adx_thresh': 11.55614674735992, 'bear_atr_min_pct': 0.01353370390135511, 'bear_atr_max_pct': 0.0421647040651657, 'bear_tp_mult': 2.183017275995781, 'bear_tsl_mult': 0.10735321794571562, 'bear_time_stop': 155, 'bear_use_sma': True, 'bear_use_ema': True, 'bear_use_atr': True, 'bear_use_adx': True, 'bear_use_spike': False, 'bear_rsi_required': True, 'sideways_strategy': 'breakout', 'sideways_bb_std_mult': 1.5007178338711342, 'sideways_rsi_os': 23, 'sideways_rsi_ob': 69, 'sideways_adx_thresh': 5.981996375991131, 'sideways_atr_min_pct': 0.02000819787356439, 'sideways_atr_max_pct': 0.07008244968104145, 'sideways_tp_mult': 2.779691837094448, 'sideways_tsl_mult': 0.8818102918872972, 'sideways_time_stop': 55, 'sideways_use_sma': True, 'sideways_use_ema': False, 'sideways_use_atr': True, 'sideways_use_adx': True, 'sideways_use_spike': False, 'sideways_rsi_required': True}.
