[I 2025-09-01 15:11:00,477] Trial 846 finished with values: [-1000000000.0, 1000000000.0] and parameters: {'p_sma': 35, 'p_std': 53, 'p_atr': 24, 'p_adx': 12, 'rsi_period': 61, 'ema1': 22, 'ema2': 14, 'slip_atr_k': 0.01273039823444358, 'slip_spread_k': 0.07077201895033956, 'spread_hl_frac': 0.007408638189151178, 'bb_std_mult': 2.923156432342887, 'rsi_os': 35, 'rsi_ob': 84, 'vol_spike': 0.048136636171246625, 'adx_thresh': 11.317154956452974, 'atr_min_pct': 0.026309265326254383, 'atr_max_pct': 0.14416525336299787, 'tp_mult': 1.0796677572629525, 'tsl_mult': 0.7143234165718497, 'strategy': 'mean_reversion', 'time_stop': 243, 'use_sma': True, 'use_atr': False, 'use_adx': False, 'use_ema': True, 'use_spike': True, 'rsi_required': False, 'edge_k': 0.3186536577196918, 'edge_cap': 0.9913545942383268, 'bull_strategy': 'mean_reversion', 'bull_bb_std_mult': 3.3115694795713657, 'bull_rsi_os': 37, 'bull_rsi_ob': 79, 'bull_adx_thresh': 21.974056605154903, 'bull_atr_min_pct': 0.004427410298607642, 'bull_atr_max_pct': 0.0931006098569113, 'bull_tp_mult': 2.8964992060465, 'bull_tsl_mult': 0.44751185404726135, 'bull_time_stop': 84, 'bull_use_sma': True, 'bull_use_ema': True, 'bull_use_atr': False, 'bull_use_adx': True, 'bull_use_spike': False, 'bull_rsi_required': False, 'bear_strategy': 'breakout', 'bear_bb_std_mult': 3.547742222017827, 'bear_rsi_os': 18, 'bear_rsi_ob': 83, 'bear_adx_thresh': 13.454717678323162, 'bear_atr_min_pct': 0.007221862991341334, 'bear_atr_max_pct': 0.06522206450253232, 'bear_tp_mult': 2.2744809047462575, 'bear_tsl_mult': 0.4317280193314167, 'bear_time_stop': 229, 'bear_use_sma': True, 'bear_use_ema': False, 'bear_use_atr': True, 'bear_use_adx': True, 'bear_use_spike': False, 'bear_rsi_required': True, 'sideways_strategy': 'breakout', 'sideways_bb_std_mult': 1.8454316407038576, 'sideways_rsi_os': 53, 'sideways_rsi_ob': 63, 'sideways_adx_thresh': 34.937831003537845, 'sideways_atr_min_pct': 0.020715572875839812, 'sideways_atr_max_pct': 0.04823478441126268, 'sideways_tp_mult': 2.7244390381085126, 'sideways_tsl_mult': 0.18626756880536677, 'sideways_time_stop': 170, 'sideways_use_sma': True, 'sideways_use_ema': False, 'sideways_use_atr': True, 'sideways_use_adx': False, 'sideways_use_spike': False, 'sideways_rsi_required': True}.
[I 2025-09-01 15:11:00,822] Trial 845 finished with values: [-1000000000.0, 1000000000.0] and parameters: {'p_sma': 16, 'p_std': 46, 'p_atr': 25, 'p_adx': 12, 'rsi_period': 44, 'ema1': 22, 'ema2': 55, 'slip_atr_k': 0.08582641312542899, 'slip_spread_k': 0.12883991015760893, 'spread_hl_frac': 0.0029420365044801047, 'bb_std_mult': 0.5065186129703729, 'rsi_os': 21, 'rsi_ob': 84, 'vol_spike': 0.21628644935651398, 'adx_thresh': 20.547899010892365, 'atr_min_pct': 0.0011719451813416194, 'atr_max_pct': 0.09491814090592278, 'tp_mult': 1.1033412519847043, 'tsl_mult': 0.7101231465380164, 'strategy': 'mean_reversion', 'time_stop': 204, 'use_sma': True, 'use_atr': False, 'use_adx': False, 'use_ema': False, 'use_spike': True, 'rsi_required': True, 'edge_k': 1.0823854028358741, 'edge_cap': 0.42762168499870296, 'bull_strategy': 'mean_reversion', 'bull_bb_std_mult': 3.3094826273854534, 'bull_rsi_os': 21, 'bull_rsi_ob': 55, 'bull_adx_thresh': 30.010583324853584, 'bull_atr_min_pct': 0.004369541133297714, 'bull_atr_max_pct': 0.10757301976661868, 'bull_tp_mult': 2.4776029744977435, 'bull_tsl_mult': 0.5931663892082653, 'bull_time_stop': 78, 'bull_use_sma': True, 'bull_use_ema': False, 'bull_use_atr': True, 'bull_use_adx': True, 'bull_use_spike': False, 'bull_rsi_required': False, 'bear_strategy': 'breakout', 'bear_bb_std_mult': 3.5473489798900437, 'bear_rsi_os': 18, 'bear_rsi_ob': 90, 'bear_adx_thresh': 13.482595706952276, 'bear_atr_min_pct': 0.0027213669121275955, 'bear_atr_max_pct': 0.14739229488987182, 'bear_tp_mult': 2.294823240298166, 'bear_tsl_mult': 0.7910597394017014, 'bear_time_stop': 240, 'bear_use_sma': True, 'bear_use_ema': False, 'bear_use_atr': True, 'bear_use_adx': True, 'bear_use_spike': False, 'bear_rsi_required': True, 'sideways_strategy': 'breakout', 'sideways_bb_std_mult': 2.728916842095144, 'sideways_rsi_os': 53, 'sideways_rsi_ob': 48, 'sideways_adx_thresh': 16.60720353723133, 'sideways_atr_min_pct': 0.019542103785641803, 'sideways_atr_max_pct': 0.027290777972850316, 'sideways_tp_mult': 2.720034520103515, 'sideways_tsl_mult': 0.3327058855057209, 'sideways_time_stop': 179, 'sideways_use_sma': True, 'sideways_use_ema': False, 'sideways_use_atr': True, 'sideways_use_adx': True, 'sideways_use_spike': False, 'sideways_rsi_required': True}.
[I 2025-09-01 15:11:02,156] Trial 847 finished with values: [-0.23084553202033808, 0.23075297703833864] and parameters: {'p_sma': 8, 'p_std': 49, 'p_atr': 13, 'p_adx': 7, 'rsi_period': 77, 'ema1': 22, 'ema2': 14, 'slip_atr_k': 0.11174331773253555, 'slip_spread_k': 0.0657312821945294, 'spread_hl_frac': 0.007437529650087375, 'bb_std_mult': 3.494692691246948, 'rsi_os': 39, 'rsi_ob': 84, 'vol_spike': 0.21660295767331145, 'adx_thresh': 25.909259467210884, 'atr_min_pct': 0.0259603076065633, 'atr_max_pct': 0.13402732977032863, 'tp_mult': 1.0842231073664863, 'tsl_mult': 0.7068251869558977, 'strategy': 'mean_reversion', 'time_stop': 245, 'use_sma': True, 'use_atr': False, 'use_adx': False, 'use_ema': True, 'use_spike': True, 'rsi_required': False, 'edge_k': 1.0830843380318491, 'edge_cap': 0.33460822016392033, 'bull_strategy': 'mean_reversion', 'bull_bb_std_mult': 3.1808272543613034, 'bull_rsi_os': 21, 'bull_rsi_ob': 71, 'bull_adx_thresh': 29.960858803623417, 'bull_atr_min_pct': 0.004506190730577377, 'bull_atr_max_pct': 0.06855829509716069, 'bull_tp_mult': 2.9112500022571854, 'bull_tsl_mult': 0.873272480585816, 'bull_time_stop': 212, 'bull_use_sma': True, 'bull_use_ema': True, 'bull_use_atr': False, 'bull_use_adx': True, 'bull_use_spike': False, 'bull_rsi_required': False, 'bear_strategy': 'breakout', 'bear_bb_std_mult': 3.598859240304683, 'bear_rsi_os': 32, 'bear_rsi_ob': 90, 'bear_adx_thresh': 13.655095320510389, 'bear_atr_min_pct': 0.023908400280843532, 'bear_atr_max_pct': 0.046619312676180275, 'bear_tp_mult': 1.217922184230943, 'bear_tsl_mult': 0.18514764145115753, 'bear_time_stop': 228, 'bear_use_sma': True, 'bear_use_ema': False, 'bear_use_atr': True, 'bear_use_adx': True, 'bear_use_spike': False, 'bear_rsi_required': True, 'sideways_strategy': 'breakout', 'sideways_bb_std_mult': 1.7161629196883157, 'sideways_rsi_os': 53, 'sideways_rsi_ob': 63, 'sideways_adx_thresh': 8.567554059384705, 'sideways_atr_min_pct': 1.622947868226178e-05, 'sideways_atr_max_pct': 0.06730955663347046, 'sideways_tp_mult': 2.727714597409921, 'sideways_tsl_mult': 0.8031926866753083, 'sideways_time_stop': 179, 'sideways_use_sma': True, 'sideways_use_ema': False, 'sideways_use_atr': True, 'sideways_use_adx': False, 'sideways_use_spike': False, 'sideways_rsi_required': True}.
[I 2025-09-01 15:11:40,230] Trial 852 finished with values: [-1000000000.0, 1000000000.0] and parameters: {'p_sma': 59, 'p_std': 47, 'p_atr': 26, 'p_adx': 11, 'rsi_period': 23, 'ema1': 19, 'ema2': 19, 'slip_atr_k': 0.01078663362326333, 'slip_spread_k': 0.6001583130850314, 'spread_hl_frac': 0.009475908984057209, 'bb_std_mult': 1.9212314743211925, 'rsi_os': 48, 'rsi_ob': 67, 'vol_spike': 0.2334076753459574, 'adx_thresh': 25.447029142724144, 'atr_min_pct': 0.024032381208655463, 'atr_max_pct': 0.1384904346338549, 'tp_mult': 1.076090052276843, 'tsl_mult': 0.7620407136623331, 'strategy': 'breakout', 'time_stop': 224, 'use_sma': True, 'use_atr': False, 'use_adx': False, 'use_ema': True, 'use_spike': True, 'rsi_required': False, 'edge_k': 1.2324045439352456, 'edge_cap': 0.6944165212443603, 'bull_strategy': 'breakout', 'bull_bb_std_mult': 2.6142659601013656, 'bull_rsi_os': 39, 'bull_rsi_ob': 54, 'bull_adx_thresh': 29.31181314640547, 'bull_atr_min_pct': 0.003279314846559216, 'bull_atr_max_pct': 0.13134688715869816, 'bull_tp_mult': 2.7278505651815426, 'bull_tsl_mult': 0.4363527964265703, 'bull_time_stop': 93, 'bull_use_sma': True, 'bull_use_ema': True, 'bull_use_atr': True, 'bull_use_adx': True, 'bull_use_spike': False, 'bull_rsi_required': True, 'bear_strategy': 'mean_reversion', 'bear_bb_std_mult': 3.442240612478442, 'bear_rsi_os': 52, 'bear_rsi_ob': 51, 'bear_adx_thresh': 15.033220098196832, 'bear_atr_min_pct': 0.004187063778017688, 'bear_atr_max_pct': 0.04298990617299913, 'bear_tp_mult': 2.2494585784832726, 'bear_tsl_mult': 0.13808879460837967, 'bear_time_stop': 210, 'bear_use_sma': True, 'bear_use_ema': True, 'bear_use_atr': False, 'bear_use_adx': False, 'bear_use_spike': False, 'bear_rsi_required': True, 'sideways_strategy': 'mean_reversion', 'sideways_bb_std_mult': 1.5848900068013458, 'sideways_rsi_os': 52, 'sideways_rsi_ob': 68, 'sideways_adx_thresh': 7.283131476182744, 'sideways_atr_min_pct': 0.01156493326980826, 'sideways_atr_max_pct': 0.06780134810796305, 'sideways_tp_mult': 1.8652910896325894, 'sideways_tsl_mult': 0.24551682571918082, 'sideways_time_stop': 187, 'sideways_use_sma': True, 'sideways_use_ema': False, 'sideways_use_atr': True, 'sideways_use_adx': True, 'sideways_use_spike': False, 'sideways_rsi_required': True}.
[I 2025-09-01 15:11:40,233] Trial 851 finished with values: [-1000000000.0, 1000000000.0] and parameters: {'p_sma': 40, 'p_std': 49, 'p_atr': 26, 'p_adx': 25, 'rsi_period': 23, 'ema1': 18, 'ema2': 15, 'slip_atr_k': 0.15630007167092794, 'slip_spread_k': 0.09527218097981974, 'spread_hl_frac': 0.009261773926997053, 'bb_std_mult': 1.544600100522684, 'rsi_os': 42, 'rsi_ob': 72, 'vol_spike': 0.09922215514644936, 'adx_thresh': 25.486052640108905, 'atr_min_pct': 0.027049320328670894, 'atr_max_pct': 0.13319401755055946, 'tp_mult': 1.0770696749364292, 'tsl_mult': 0.4226269352479484, 'strategy': 'breakout', 'time_stop': 271, 'use_sma': True, 'use_atr': False, 'use_adx': False, 'use_ema': True, 'use_spike': True, 'rsi_required': False, 'edge_k': 1.1772246624564482, 'edge_cap': 0.3799632586526188, 'bull_strategy': 'breakout', 'bull_bb_std_mult': 1.168528122292798, 'bull_rsi_os': 36, 'bull_rsi_ob': 77, 'bull_adx_thresh': 10.394319853845214, 'bull_atr_min_pct': 0.016067980983976667, 'bull_atr_max_pct': 0.06906687681341252, 'bull_tp_mult': 2.9881771852485683, 'bull_tsl_mult': 0.4408462864474092, 'bull_time_stop': 95, 'bull_use_sma': True, 'bull_use_ema': True, 'bull_use_atr': True, 'bull_use_adx': True, 'bull_use_spike': False, 'bull_rsi_required': True, 'bear_strategy': 'breakout', 'bear_bb_std_mult': 2.235985727260312, 'bear_rsi_os': 32, 'bear_rsi_ob': 89, 'bear_adx_thresh': 12.546247224825574, 'bear_atr_min_pct': 0.004206498581377954, 'bear_atr_max_pct': 0.04709205940540571, 'bear_tp_mult': 2.8912945008372817, 'bear_tsl_mult': 0.18185772768837657, 'bear_time_stop': 207, 'bear_use_sma': True, 'bear_use_ema': True, 'bear_use_atr': True, 'bear_use_adx': True, 'bear_use_spike': False, 'bear_rsi_required': True, 'sideways_strategy': 'mean_reversion', 'sideways_bb_std_mult': 1.5618631468968072, 'sideways_rsi_os': 52, 'sideways_rsi_ob': 68, 'sideways_adx_thresh': 25.39396152568002, 'sideways_atr_min_pct': 0.019472014519597267, 'sideways_atr_max_pct': 0.13295535063833452, 'sideways_tp_mult': 2.6665320017378646, 'sideways_tsl_mult': 0.7953301257968735, 'sideways_time_stop': 137, 'sideways_use_sma': True, 'sideways_use_ema': False, 'sideways_use_atr': True, 'sideways_use_adx': True, 'sideways_use_spike': False, 'sideways_rsi_required': True}.
[I 2025-09-01 15:11:40,569] Trial 849 finished with values: [-1000000000.0, 1000000000.0] and parameters: {'p_sma': 35, 'p_std': 47, 'p_atr': 15, 'p_adx': 14, 'rsi_period': 61, 'ema1': 22, 'ema2': 19, 'slip_atr_k': 0.08708943058307284, 'slip_spread_k': 0.34111207176111613, 'spread_hl_frac': 0.006687895377488285, 'bb_std_mult': 1.5535239173900177, 'rsi_os': 39, 'rsi_ob': 84, 'vol_spike': 0.0982174584827978, 'adx_thresh': 30.942851635005468, 'atr_min_pct': 0.026690932190716554, 'atr_max_pct': 0.14470367701491638, 'tp_mult': 1.0834186857863228, 'tsl_mult': 0.32923594546867585, 'strategy': 'mean_reversion', 'time_stop': 207, 'use_sma': True, 'use_atr': False, 'use_adx': False, 'use_ema': True, 'use_spike': True, 'rsi_required': False, 'edge_k': 1.185091285653118, 'edge_cap': 0.9984740575041026, 'bull_strategy': 'mean_reversion', 'bull_bb_std_mult': 3.3119677436701784, 'bull_rsi_os': 37, 'bull_rsi_ob': 55, 'bull_adx_thresh': 29.12540409830959, 'bull_atr_min_pct': 0.02203439605685079, 'bull_atr_max_pct': 0.091878935191386, 'bull_tp_mult': 1.616454472092431, 'bull_tsl_mult': 0.9354670996302537, 'bull_time_stop': 211, 'bull_use_sma': True, 'bull_use_ema': True, 'bull_use_atr': True, 'bull_use_adx': True, 'bull_use_spike': False, 'bull_rsi_required': False, 'bear_strategy': 'breakout', 'bear_bb_std_mult': 3.5993208457549914, 'bear_rsi_os': 32, 'bear_rsi_ob': 89, 'bear_adx_thresh': 21.871009719394195, 'bear_atr_min_pct': 0.02835519556225722, 'bear_atr_max_pct': 0.04717003681273507, 'bear_tp_mult': 2.2883776905929176, 'bear_tsl_mult': 0.1810393672996046, 'bear_time_stop': 136, 'bear_use_sma': True, 'bear_use_ema': False, 'bear_use_atr': True, 'bear_use_adx': True, 'bear_use_spike': False, 'bear_rsi_required': True, 'sideways_strategy': 'breakout', 'sideways_bb_std_mult': 1.7363499886988387, 'sideways_rsi_os': 52, 'sideways_rsi_ob': 61, 'sideways_adx_thresh': 34.98423494590415, 'sideways_atr_min_pct': 0.019380907633778616, 'sideways_atr_max_pct': 0.132248078334046, 'sideways_tp_mult': 2.447887097640269, 'sideways_tsl_mult': 0.1925364893591317, 'sideways_time_stop': 169, 'sideways_use_sma': True, 'sideways_use_ema': False, 'sideways_use_atr': True, 'sideways_use_adx': True, 'sideways_use_spike': False, 'sideways_rsi_required': True}.
[I 2025-09-01 15:11:40,764] Trial 850 finished with values: [-0.029856062233289182, 0.029953429334963158] and parameters: {'p_sma': 38, 'p_std': 47, 'p_atr': 26, 'p_adx': 14, 'rsi_period': 65, 'ema1': 18, 'ema2': 15, 'slip_atr_k': 0.1099495136636378, 'slip_spread_k': 0.09122807191243272, 'spread_hl_frac': 0.006587666878026747, 'bb_std_mult': 1.9433687227832113, 'rsi_os': 42, 'rsi_ob': 83, 'vol_spike': 0.23501187743288723, 'adx_thresh': 25.704473615964936, 'atr_min_pct': 0.027068229737798696, 'atr_max_pct': 0.05325388704595256, 'tp_mult': 1.0917777993469895, 'tsl_mult': 0.12600346305111015, 'strategy': 'breakout', 'time_stop': 207, 'use_sma': True, 'use_atr': False, 'use_adx': False, 'use_ema': True, 'use_spike': True, 'rsi_required': False, 'edge_k': 0.42086455489358454, 'edge_cap': 0.6986909540141186, 'bull_strategy': 'breakout', 'bull_bb_std_mult': 2.617013171277361, 'bull_rsi_os': 39, 'bull_rsi_ob': 54, 'bull_adx_thresh': 29.10555731878924, 'bull_atr_min_pct': 0.0035062525243235772, 'bull_atr_max_pct': 0.05799674056358467, 'bull_tp_mult': 2.9913010716947563, 'bull_tsl_mult': 0.4336825474046791, 'bull_time_stop': 79, 'bull_use_sma': True, 'bull_use_ema': True, 'bull_use_atr': True, 'bull_use_adx': True, 'bull_use_spike': False, 'bull_rsi_required': True, 'bear_strategy': 'breakout', 'bear_bb_std_mult': 3.4244811054719135, 'bear_rsi_os': 43, 'bear_rsi_ob': 69, 'bear_adx_thresh': 12.675282622724115, 'bear_atr_min_pct': 0.004191241049492075, 'bear_atr_max_pct': 0.04764563818196249, 'bear_tp_mult': 2.2987994054272556, 'bear_tsl_mult': 0.18621810546404816, 'bear_time_stop': 210, 'bear_use_sma': True, 'bear_use_ema': True, 'bear_use_atr': True, 'bear_use_adx': True, 'bear_use_spike': False, 'bear_rsi_required': True, 'sideways_strategy': 'mean_reversion', 'sideways_bb_std_mult': 1.7264539229865947, 'sideways_rsi_os': 52, 'sideways_rsi_ob': 91, 'sideways_adx_thresh': 8.511320398812918, 'sideways_atr_min_pct': 0.01946591487130559, 'sideways_atr_max_pct': 0.06771037117551715, 'sideways_tp_mult': 2.301465583942557, 'sideways_tsl_mult': 0.30326270942199696, 'sideways_time_stop': 248, 'sideways_use_sma': True, 'sideways_use_ema': False, 'sideways_use_atr': True, 'sideways_use_adx': True, 'sideways_use_spike': False, 'sideways_rsi_required': True}.
[I 2025-09-01 15:12:19,343] Trial 856 finished with values: [-1000000000.0, 1000000000.0] and parameters: {'p_sma': 19, 'p_std': 42, 'p_atr': 25, 'p_adx': 29, 'rsi_period': 8, 'ema1': 11, 'ema2': 16, 'slip_atr_k': 0.0040817557818089, 'slip_spread_k': 0.04676451032562712, 'spread_hl_frac': 0.005571788693901046, 'bb_std_mult': 1.7983640992814909, 'rsi_os': 41, 'rsi_ob': 82, 'vol_spike': 0.15183547837562572, 'adx_thresh': 21.791953835247284, 'atr_min_pct': 0.02937572056669211, 'atr_max_pct': 0.14122385662138695, 'tp_mult': 1.38802217154102, 'tsl_mult': 0.5010985069482226, 'strategy': 'mean_reversion', 'time_stop': 240, 'use_sma': True, 'use_atr': False, 'use_adx': True, 'use_ema': True, 'use_spike': True, 'rsi_required': False, 'edge_k': 0.8675409074225938, 'edge_cap': 0.29945802872583555, 'bull_strategy': 'breakout', 'bull_bb_std_mult': 2.246341243227078, 'bull_rsi_os': 34, 'bull_rsi_ob': 84, 'bull_adx_thresh': 30.620054678256107, 'bull_atr_min_pct': 0.008976215206769073, 'bull_atr_max_pct': 0.05404933157602817, 'bull_tp_mult': 1.1112607527862908, 'bull_tsl_mult': 0.5177333461085387, 'bull_time_stop': 189, 'bull_use_sma': True, 'bull_use_ema': True, 'bull_use_atr': True, 'bull_use_adx': True, 'bull_use_spike': False, 'bull_rsi_required': True, 'bear_strategy': 'mean_reversion', 'bear_bb_std_mult': 2.569376836936485, 'bear_rsi_os': 34, 'bear_rsi_ob': 87, 'bear_adx_thresh': 20.387137986195654, 'bear_atr_min_pct': 0.0030909967537452823, 'bear_atr_max_pct': 0.0405723994915831, 'bear_tp_mult': 1.653902330285488, 'bear_tsl_mult': 0.40648647385738973, 'bear_time_stop': 107, 'bear_use_sma': True, 'bear_use_ema': True, 'bear_use_atr': False, 'bear_use_adx': False, 'bear_use_spike': False, 'bear_rsi_required': True, 'sideways_strategy': 'breakout', 'sideways_bb_std_mult': 1.5208536118901619, 'sideways_rsi_os': 25, 'sideways_rsi_ob': 65, 'sideways_adx_thresh': 15.31539599438047, 'sideways_atr_min_pct': 0.020508396071401664, 'sideways_atr_max_pct': 0.07498283747162932, 'sideways_tp_mult': 1.7054029632963896, 'sideways_tsl_mult': 0.09950078276231766, 'sideways_time_stop': 195, 'sideways_use_sma': True, 'sideways_use_ema': False, 'sideways_use_atr': True, 'sideways_use_adx': True, 'sideways_use_spike': True, 'sideways_rsi_required': True}.
[I 2025-09-01 15:12:20,430] Trial 855 finished with values: [-1000000000.0, 1000000000.0] and parameters: {'p_sma': 20, 'p_std': 27, 'p_atr': 25, 'p_adx': 29, 'rsi_period': 80, 'ema1': 6, 'ema2': 18, 'slip_atr_k': 0.01460746778218234, 'slip_spread_k': 0.7937165802033983, 'spread_hl_frac': 0.026736526899028147, 'bb_std_mult': 1.7977110515901598, 'rsi_os': 24, 'rsi_ob': 82, 'vol_spike': 0.15313551061653766, 'adx_thresh': 8.787348457317869, 'atr_min_pct': 0.027877007086612917, 'atr_max_pct': 0.08642503757709137, 'tp_mult': 2.0135985558886857, 'tsl_mult': 0.7569447082906506, 'strategy': 'mean_reversion', 'time_stop': 61, 'use_sma': True, 'use_atr': False, 'use_adx': True, 'use_ema': True, 'use_spike': True, 'rsi_required': False, 'edge_k': 0.868240581370295, 'edge_cap': 0.30070230072150406, 'bull_strategy': 'breakout', 'bull_bb_std_mult': 1.7082555884092314, 'bull_rsi_os': 34, 'bull_rsi_ob': 85, 'bull_adx_thresh': 30.44332563528866, 'bull_atr_min_pct': 0.027107379553438504, 'bull_atr_max_pct': 0.12002618466820159, 'bull_tp_mult': 1.1104004362825592, 'bull_tsl_mult': 0.4091784994150673, 'bull_time_stop': 87, 'bull_use_sma': True, 'bull_use_ema': True, 'bull_use_atr': True, 'bull_use_adx': True, 'bull_use_spike': False, 'bull_rsi_required': True, 'bear_strategy': 'mean_reversion', 'bear_bb_std_mult': 3.3565935297956133, 'bear_rsi_os': 22, 'bear_rsi_ob': 70, 'bear_adx_thresh': 20.391473851315073, 'bear_atr_min_pct': 0.003073438978751888, 'bear_atr_max_pct': 0.04054210267083429, 'bear_tp_mult': 2.3441553646914763, 'bear_tsl_mult': 0.15926067071240474, 'bear_time_stop': 202, 'bear_use_sma': True, 'bear_use_ema': True, 'bear_use_atr': False, 'bear_use_adx': False, 'bear_use_spike': False, 'bear_rsi_required': True, 'sideways_strategy': 'breakout', 'sideways_bb_std_mult': 2.979698578299245, 'sideways_rsi_os': 11, 'sideways_rsi_ob': 57, 'sideways_adx_thresh': 6.831884405321404, 'sideways_atr_min_pct': 0.02040684450755722, 'sideways_atr_max_pct': 0.05682073600377653, 'sideways_tp_mult': 2.8275183221431766, 'sideways_tsl_mult': 0.29885540811948197, 'sideways_time_stop': 172, 'sideways_use_sma': True, 'sideways_use_ema': False, 'sideways_use_atr': True, 'sideways_use_adx': True, 'sideways_use_spike': True, 'sideways_rsi_required': True}.
