[I 2025-09-01 13:41:40,097] Trial 252 finished with values: [-0.014728459558521867, 0.016853677628505422] and parameters: {'p_sma': 37, 'p_std': 49, 'p_atr': 25, 'p_adx': 12, 'rsi_period': 65, 'ema1': 23, 'ema2': 11, 'slip_atr_k': 0.020020580590619882, 'slip_spread_k': 0.05429507584368607, 'spread_hl_frac': 0.021703185261680545, 'bb_std_mult': 2.6004183281222435, 'rsi_os': 39, 'rsi_ob': 82, 'vol_spike': 0.06148344649249074, 'adx_thresh': 26.330399900165535, 'atr_min_pct': 0.027672916303634384, 'atr_max_pct': 0.14680184624211062, 'tp_mult': 1.010056317566344, 'tsl_mult': 0.7226347813455529, 'strategy': 'mean_reversion', 'time_stop': 237, 'use_sma': False, 'use_atr': False, 'use_adx': False, 'use_ema': True, 'use_spike': True, 'rsi_required': False, 'edge_k': 0.8247588511987216, 'edge_cap': 0.30382017467360767, 'bull_strategy': 'breakout', 'bull_bb_std_mult': 1.4813880737913203, 'bull_rsi_os': 36, 'bull_rsi_ob': 55, 'bull_adx_thresh': 27.519704636078966, 'bull_atr_min_pct': 0.00439675376788844, 'bull_atr_max_pct': 0.025292906973610932, 'bull_tp_mult': 2.872039751598682, 'bull_tsl_mult': 0.49148360110097816, 'bull_time_stop': 86, 'bull_use_sma': False, 'bull_use_ema': False, 'bull_use_atr': False, 'bull_use_adx': False, 'bull_use_spike': False, 'bull_rsi_required': True, 'bear_strategy': 'breakout', 'bear_bb_std_mult': 3.516408040603432, 'bear_rsi_os': 34, 'bear_rsi_ob': 85, 'bear_adx_thresh': 14.190193026955981, 'bear_atr_min_pct': 0.002886772664809285, 'bear_atr_max_pct': 0.055854369245385505, 'bear_tp_mult': 2.196511216345724, 'bear_tsl_mult': 0.13946958062762196, 'bear_time_stop': 225, 'bear_use_sma': False, 'bear_use_ema': True, 'bear_use_atr': True, 'bear_use_adx': True, 'bear_use_spike': False, 'bear_rsi_required': True, 'sideways_strategy': 'breakout', 'sideways_bb_std_mult': 1.7123007375530264, 'sideways_rsi_os': 54, 'sideways_rsi_ob': 68, 'sideways_adx_thresh': 7.899687336904931, 'sideways_atr_min_pct': 0.01925253972342073, 'sideways_atr_max_pct': 0.06521529732451878, 'sideways_tp_mult': 2.7252805952307173, 'sideways_tsl_mult': 0.2956747691231894, 'sideways_time_stop': 162, 'sideways_use_sma': True, 'sideways_use_ema': True, 'sideways_use_atr': True, 'sideways_use_adx': True, 'sideways_use_spike': False, 'sideways_rsi_required': True}.
[I 2025-09-01 13:41:40,763] Trial 253 finished with values: [-1000000000.0, 1000000000.0] and parameters: {'p_sma': 33, 'p_std': 51, 'p_atr': 25, 'p_adx': 12, 'rsi_period': 65, 'ema1': 20, 'ema2': 20, 'slip_atr_k': 0.007012644379919177, 'slip_spread_k': 0.09580448599683161, 'spread_hl_frac': 0.02809492545873029, 'bb_std_mult': 1.8075638961876759, 'rsi_os': 39, 'rsi_ob': 82, 'vol_spike': 0.1769812854720749, 'adx_thresh': 24.88617029398948, 'atr_min_pct': 0.02755376812136532, 'atr_max_pct': 0.12984140322802953, 'tp_mult': 1.0151651831167423, 'tsl_mult': 0.7373098184047934, 'strategy': 'mean_reversion', 'time_stop': 227, 'use_sma': True, 'use_atr': False, 'use_adx': False, 'use_ema': True, 'use_spike': True, 'rsi_required': False, 'edge_k': 0.8020074258587645, 'edge_cap': 0.3037415536512853, 'bull_strategy': 'breakout', 'bull_bb_std_mult': 1.3946075788404, 'bull_rsi_os': 36, 'bull_rsi_ob': 55, 'bull_adx_thresh': 31.026587026882446, 'bull_atr_min_pct': 0.00423075075070092, 'bull_atr_max_pct': 0.11341679237982556, 'bull_tp_mult': 2.7667736823342337, 'bull_tsl_mult': 0.8734510952348206, 'bull_time_stop': 86, 'bull_use_sma': True, 'bull_use_ema': False, 'bull_use_atr': False, 'bull_use_adx': True, 'bull_use_spike': False, 'bull_rsi_required': True, 'bear_strategy': 'breakout', 'bear_bb_std_mult': 3.518526335037502, 'bear_rsi_os': 34, 'bear_rsi_ob': 85, 'bear_adx_thresh': 14.461509599522598, 'bear_atr_min_pct': 0.003619379611992815, 'bear_atr_max_pct': 0.02653361661262766, 'bear_tp_mult': 2.2565777734071597, 'bear_tsl_mult': 0.14669800369950528, 'bear_time_stop': 209, 'bear_use_sma': True, 'bear_use_ema': True, 'bear_use_atr': True, 'bear_use_adx': True, 'bear_use_spike': False, 'bear_rsi_required': True, 'sideways_strategy': 'breakout', 'sideways_bb_std_mult': 1.5622298878254943, 'sideways_rsi_os': 53, 'sideways_rsi_ob': 68, 'sideways_adx_thresh': 7.8755543361642015, 'sideways_atr_min_pct': 0.02188607200987789, 'sideways_atr_max_pct': 0.06671408915513075, 'sideways_tp_mult': 2.712856441051037, 'sideways_tsl_mult': 0.29837988151113215, 'sideways_time_stop': 188, 'sideways_use_sma': True, 'sideways_use_ema': True, 'sideways_use_atr': True, 'sideways_use_adx': True, 'sideways_use_spike': False, 'sideways_rsi_required': True}.
[I 2025-09-01 13:41:41,496] Trial 254 finished with values: [-1000000000.0, 1000000000.0] and parameters: {'p_sma': 33, 'p_std': 51, 'p_atr': 24, 'p_adx': 12, 'rsi_period': 65, 'ema1': 20, 'ema2': 14, 'slip_atr_k': 0.007719629843858458, 'slip_spread_k': 0.09844262637364307, 'spread_hl_frac': 0.028054260434207938, 'bb_std_mult': 1.6815623398378186, 'rsi_os': 39, 'rsi_ob': 85, 'vol_spike': 0.23847584596551463, 'adx_thresh': 24.979504073790302, 'atr_min_pct': 0.023711832355646098, 'atr_max_pct': 0.128890387822971, 'tp_mult': 1.0111589911745327, 'tsl_mult': 0.6526761577835477, 'strategy': 'mean_reversion', 'time_stop': 229, 'use_sma': True, 'use_atr': False, 'use_adx': False, 'use_ema': True, 'use_spike': True, 'rsi_required': False, 'edge_k': 0.8271343917651162, 'edge_cap': 0.39606330691767844, 'bull_strategy': 'breakout', 'bull_bb_std_mult': 1.4661449760831156, 'bull_rsi_os': 36, 'bull_rsi_ob': 55, 'bull_adx_thresh': 31.647871375453228, 'bull_atr_min_pct': 0.004233566554358786, 'bull_atr_max_pct': 0.025963389395522868, 'bull_tp_mult': 2.7800970121251782, 'bull_tsl_mult': 0.42731384512991616, 'bull_time_stop': 99, 'bull_use_sma': True, 'bull_use_ema': False, 'bull_use_atr': False, 'bull_use_adx': True, 'bull_use_spike': False, 'bull_rsi_required': False, 'bear_strategy': 'breakout', 'bear_bb_std_mult': 3.5363717780377626, 'bear_rsi_os': 34, 'bear_rsi_ob': 85, 'bear_adx_thresh': 12.6832888269741, 'bear_atr_min_pct': 0.00367220345067688, 'bear_atr_max_pct': 0.01829676056619696, 'bear_tp_mult': 2.2410974941326685, 'bear_tsl_mult': 0.14922071494046263, 'bear_time_stop': 225, 'bear_use_sma': True, 'bear_use_ema': True, 'bear_use_atr': True, 'bear_use_adx': True, 'bear_use_spike': True, 'bear_rsi_required': True, 'sideways_strategy': 'breakout', 'sideways_bb_std_mult': 1.5793183174957657, 'sideways_rsi_os': 55, 'sideways_rsi_ob': 66, 'sideways_adx_thresh': 34.823690016922676, 'sideways_atr_min_pct': 0.019077388028254632, 'sideways_atr_max_pct': 0.06608320661747373, 'sideways_tp_mult': 2.085499144217561, 'sideways_tsl_mult': 0.24683758869971184, 'sideways_time_stop': 161, 'sideways_use_sma': True, 'sideways_use_ema': True, 'sideways_use_atr': False, 'sideways_use_adx': True, 'sideways_use_spike': False, 'sideways_rsi_required': True}.
[I 2025-09-01 13:42:23,429] Trial 257 finished with values: [-0.045480301330035, 0.04517543564604356] and parameters: {'p_sma': 36, 'p_std': 17, 'p_atr': 26, 'p_adx': 13, 'rsi_period': 65, 'ema1': 30, 'ema2': 14, 'slip_atr_k': 0.007583972425400303, 'slip_spread_k': 0.07857924113347277, 'spread_hl_frac': 0.006378458406770217, 'bb_std_mult': 1.5380009941110244, 'rsi_os': 37, 'rsi_ob': 85, 'vol_spike': 0.1463118695196021, 'adx_thresh': 25.59311764219257, 'atr_min_pct': 0.023563732586728878, 'atr_max_pct': 0.13919477305038438, 'tp_mult': 1.136614535493876, 'tsl_mult': 0.7294764113496165, 'strategy': 'mean_reversion', 'time_stop': 237, 'use_sma': True, 'use_atr': False, 'use_adx': False, 'use_ema': False, 'use_spike': True, 'rsi_required': False, 'edge_k': 0.9074461687051437, 'edge_cap': 0.3931745679747156, 'bull_strategy': 'breakout', 'bull_bb_std_mult': 1.4672146085362314, 'bull_rsi_os': 32, 'bull_rsi_ob': 92, 'bull_adx_thresh': 31.49848485668072, 'bull_atr_min_pct': 0.0042808011264000734, 'bull_atr_max_pct': 0.026513914949165735, 'bull_tp_mult': 2.8647087071428134, 'bull_tsl_mult': 0.7187642476259045, 'bull_time_stop': 124, 'bull_use_sma': True, 'bull_use_ema': False, 'bull_use_atr': True, 'bull_use_adx': True, 'bull_use_spike': False, 'bull_rsi_required': False, 'bear_strategy': 'breakout', 'bear_bb_std_mult': 3.555190315502784, 'bear_rsi_os': 38, 'bear_rsi_ob': 89, 'bear_adx_thresh': 12.70818774926059, 'bear_atr_min_pct': 0.0028369707661449212, 'bear_atr_max_pct': 0.04503892089809981, 'bear_tp_mult': 2.3559478715534454, 'bear_tsl_mult': 0.18667693342785666, 'bear_time_stop': 225, 'bear_use_sma': True, 'bear_use_ema': True, 'bear_use_atr': False, 'bear_use_adx': True, 'bear_use_spike': False, 'bear_rsi_required': True, 'sideways_strategy': 'breakout', 'sideways_bb_std_mult': 1.623521004223361, 'sideways_rsi_os': 55, 'sideways_rsi_ob': 66, 'sideways_adx_thresh': 5.931027089611607, 'sideways_atr_min_pct': 0.01912172836054917, 'sideways_atr_max_pct': 0.06431221846393627, 'sideways_tp_mult': 1.4471327228383428, 'sideways_tsl_mult': 0.25608876610850784, 'sideways_time_stop': 186, 'sideways_use_sma': True, 'sideways_use_ema': False, 'sideways_use_atr': True, 'sideways_use_adx': True, 'sideways_use_spike': False, 'sideways_rsi_required': False}.
[I 2025-09-01 13:42:24,783] Trial 255 finished with values: [-1000000000.0, 1000000000.0] and parameters: {'p_sma': 36, 'p_std': 17, 'p_atr': 26, 'p_adx': 13, 'rsi_period': 65, 'ema1': 22, 'ema2': 15, 'slip_atr_k': 0.007226364013850304, 'slip_spread_k': 0.10040547158281532, 'spread_hl_frac': 0.022925709978392245, 'bb_std_mult': 1.0839780281097409, 'rsi_os': 16, 'rsi_ob': 85, 'vol_spike': 0.09791360680283692, 'adx_thresh': 25.389393798454385, 'atr_min_pct': 0.023701476837370283, 'atr_max_pct': 0.13631546529208524, 'tp_mult': 1.0111589177235887, 'tsl_mult': 0.7454586161739722, 'strategy': 'mean_reversion', 'time_stop': 238, 'use_sma': True, 'use_atr': False, 'use_adx': False, 'use_ema': True, 'use_spike': True, 'rsi_required': False, 'edge_k': 0.9177021251706221, 'edge_cap': 0.3912794096064651, 'bull_strategy': 'breakout', 'bull_bb_std_mult': 2.692957493344454, 'bull_rsi_os': 39, 'bull_rsi_ob': 52, 'bull_adx_thresh': 31.39706658174936, 'bull_atr_min_pct': 0.004230026500469935, 'bull_atr_max_pct': 0.11350288126995359, 'bull_tp_mult': 2.782094156221268, 'bull_tsl_mult': 0.8740423921325189, 'bull_time_stop': 120, 'bull_use_sma': True, 'bull_use_ema': False, 'bull_use_atr': True, 'bull_use_adx': True, 'bull_use_spike': False, 'bull_rsi_required': False, 'bear_strategy': 'breakout', 'bear_bb_std_mult': 3.5475709855981163, 'bear_rsi_os': 33, 'bear_rsi_ob': 89, 'bear_adx_thresh': 12.692938360413654, 'bear_atr_min_pct': 0.003258565544529481, 'bear_atr_max_pct': 0.04593542550185369, 'bear_tp_mult': 2.359054519872579, 'bear_tsl_mult': 0.15008046255635926, 'bear_time_stop': 227, 'bear_use_sma': True, 'bear_use_ema': True, 'bear_use_atr': False, 'bear_use_adx': True, 'bear_use_spike': False, 'bear_rsi_required': True, 'sideways_strategy': 'breakout', 'sideways_bb_std_mult': 1.5609880312893725, 'sideways_rsi_os': 55, 'sideways_rsi_ob': 66, 'sideways_adx_thresh': 25.176344432703946, 'sideways_atr_min_pct': 0.021610022669276873, 'sideways_atr_max_pct': 0.06397117466648124, 'sideways_tp_mult': 2.735088148945442, 'sideways_tsl_mult': 0.25332485512587594, 'sideways_time_stop': 187, 'sideways_use_sma': True, 'sideways_use_ema': True, 'sideways_use_atr': True, 'sideways_use_adx': True, 'sideways_use_spike': False, 'sideways_rsi_required': True}.
[I 2025-09-01 13:42:26,248] Trial 258 finished with values: [-1000000000.0, 1000000000.0] and parameters: {'p_sma': 36, 'p_std': 29, 'p_atr': 26, 'p_adx': 13, 'rsi_period': 64, 'ema1': 26, 'ema2': 22, 'slip_atr_k': 0.01601133600912688, 'slip_spread_k': 0.12335005208607464, 'spread_hl_frac': 0.03422530838747324, 'bb_std_mult': 1.7202241388771684, 'rsi_os': 37, 'rsi_ob': 84, 'vol_spike': 0.23745968945352025, 'adx_thresh': 25.556372440977974, 'atr_min_pct': 0.025785215984329646, 'atr_max_pct': 0.1391993515965099, 'tp_mult': 1.127675888297446, 'tsl_mult': 0.7730855964201954, 'strategy': 'mean_reversion', 'time_stop': 238, 'use_sma': True, 'use_atr': False, 'use_adx': False, 'use_ema': False, 'use_spike': True, 'rsi_required': False, 'edge_k': 0.9217111799324855, 'edge_cap': 0.3655017027197779, 'bull_strategy': 'mean_reversion', 'bull_bb_std_mult': 2.7832961796961806, 'bull_rsi_os': 32, 'bull_rsi_ob': 67, 'bull_adx_thresh': 34.098628150139234, 'bull_atr_min_pct': 0.004074298405656067, 'bull_atr_max_pct': 0.023600634177545696, 'bull_tp_mult': 2.8900493430843706, 'bull_tsl_mult': 0.5427260458888532, 'bull_time_stop': 121, 'bull_use_sma': True, 'bull_use_ema': True, 'bull_use_atr': True, 'bull_use_adx': True, 'bull_use_spike': False, 'bull_rsi_required': False, 'bear_strategy': 'breakout', 'bear_bb_std_mult': 3.5810781884260736, 'bear_rsi_os': 33, 'bear_rsi_ob': 89, 'bear_adx_thresh': 12.123001519075235, 'bear_atr_min_pct': 0.0029888096256995757, 'bear_atr_max_pct': 0.046736442817724266, 'bear_tp_mult': 2.3584671757374434, 'bear_tsl_mult': 0.18264513052645817, 'bear_time_stop': 224, 'bear_use_sma': True, 'bear_use_ema': True, 'bear_use_atr': False, 'bear_use_adx': True, 'bear_use_spike': False, 'bear_rsi_required': True, 'sideways_strategy': 'breakout', 'sideways_bb_std_mult': 1.6021048211807905, 'sideways_rsi_os': 51, 'sideways_rsi_ob': 69, 'sideways_adx_thresh': 8.114790318804644, 'sideways_atr_min_pct': 0.021464431604140726, 'sideways_atr_max_pct': 0.06329613061425317, 'sideways_tp_mult': 2.715172507256402, 'sideways_tsl_mult': 0.32862241887080496, 'sideways_time_stop': 185, 'sideways_use_sma': True, 'sideways_use_ema': False, 'sideways_use_atr': True, 'sideways_use_adx': True, 'sideways_use_spike': False, 'sideways_rsi_required': False}.
[I 2025-09-01 13:42:27,175] Trial 256 finished with values: [-1000000000.0, 1000000000.0] and parameters: {'p_sma': 34, 'p_std': 51, 'p_atr': 26, 'p_adx': 13, 'rsi_period': 65, 'ema1': 26, 'ema2': 22, 'slip_atr_k': 0.006377136506692891, 'slip_spread_k': 0.09581232230862982, 'spread_hl_frac': 0.027310140437958756, 'bb_std_mult': 1.6779970264105877, 'rsi_os': 16, 'rsi_ob': 85, 'vol_spike': 0.23978946065408774, 'adx_thresh': 25.527952403755208, 'atr_min_pct': 0.023666649717973526, 'atr_max_pct': 0.1385281836237807, 'tp_mult': 1.0232982742070837, 'tsl_mult': 0.733401782500347, 'strategy': 'mean_reversion', 'time_stop': 229, 'use_sma': True, 'use_atr': False, 'use_adx': False, 'use_ema': True, 'use_spike': True, 'rsi_required': False, 'edge_k': 0.8956928158207798, 'edge_cap': 0.38876195283559195, 'bull_strategy': 'breakout', 'bull_bb_std_mult': 3.1476878774248753, 'bull_rsi_os': 39, 'bull_rsi_ob': 55, 'bull_adx_thresh': 31.921364076576406, 'bull_atr_min_pct': 0.004347153851509085, 'bull_atr_max_pct': 0.11494119149423826, 'bull_tp_mult': 2.789514110279094, 'bull_tsl_mult': 0.4275186245624979, 'bull_time_stop': 123, 'bull_use_sma': True, 'bull_use_ema': False, 'bull_use_atr': True, 'bull_use_adx': True, 'bull_use_spike': False, 'bull_rsi_required': False, 'bear_strategy': 'breakout', 'bear_bb_std_mult': 3.5456464728852373, 'bear_rsi_os': 33, 'bear_rsi_ob': 89, 'bear_adx_thresh': 12.558848445166081, 'bear_atr_min_pct': 0.0035248927965287513, 'bear_atr_max_pct': 0.05011913826647717, 'bear_tp_mult': 1.764572332741138, 'bear_tsl_mult': 0.14386612703687304, 'bear_time_stop': 227, 'bear_use_sma': True, 'bear_use_ema': True, 'bear_use_atr': False, 'bear_use_adx': True, 'bear_use_spike': False, 'bear_rsi_required': True, 'sideways_strategy': 'breakout', 'sideways_bb_std_mult': 1.5913040955535913, 'sideways_rsi_os': 51, 'sideways_rsi_ob': 66, 'sideways_adx_thresh': 8.046754117015174, 'sideways_atr_min_pct': 0.020550589227624164, 'sideways_atr_max_pct': 0.06466151875916495, 'sideways_tp_mult': 2.705027904700813, 'sideways_tsl_mult': 0.32755410622653325, 'sideways_time_stop': 187, 'sideways_use_sma': True, 'sideways_use_ema': True, 'sideways_use_atr': True, 'sideways_use_adx': True, 'sideways_use_spike': False, 'sideways_rsi_required': True}.
[I 2025-09-01 13:43:09,465] Trial 259 finished with values: [-1000000000.0, 1000000000.0] and parameters: {'p_sma': 34, 'p_std': 8, 'p_atr': 25, 'p_adx': 13, 'rsi_period': 66, 'ema1': 22, 'ema2': 23, 'slip_atr_k': 0.016500681037718287, 'slip_spread_k': 0.12820967763055413, 'spread_hl_frac': 0.005244950773839865, 'bb_std_mult': 1.0000633157965613, 'rsi_os': 16, 'rsi_ob': 83, 'vol_spike': 0.0681169494769981, 'adx_thresh': 26.90405336282046, 'atr_min_pct': 0.025818231932170952, 'atr_max_pct': 0.13617500636358534, 'tp_mult': 1.068727255851159, 'tsl_mult': 0.7494366624254818, 'strategy': 'mean_reversion', 'time_stop': 238, 'use_sma': True, 'use_atr': False, 'use_adx': True, 'use_ema': True, 'use_spike': True, 'rsi_required': False, 'edge_k': 0.9409917390241238, 'edge_cap': 0.3657297190622333, 'bull_strategy': 'mean_reversion', 'bull_bb_std_mult': 3.3466394362608423, 'bull_rsi_os': 39, 'bull_rsi_ob': 67, 'bull_adx_thresh': 25.558115090501218, 'bull_atr_min_pct': 0.003917636984295484, 'bull_atr_max_pct': 0.023461495783984085, 'bull_tp_mult': 2.8546096801804426, 'bull_tsl_mult': 0.5391520979596305, 'bull_time_stop': 170, 'bull_use_sma': True, 'bull_use_ema': True, 'bull_use_atr': True, 'bull_use_adx': True, 'bull_use_spike': False, 'bull_rsi_required': True, 'bear_strategy': 'breakout', 'bear_bb_std_mult': 3.594533490467448, 'bear_rsi_os': 33, 'bear_rsi_ob': 87, 'bear_adx_thresh': 12.059628284264189, 'bear_atr_min_pct': 0.002384915729668611, 'bear_atr_max_pct': 0.053667097244634636, 'bear_tp_mult': 1.5362550973990992, 'bear_tsl_mult': 0.8121671377831268, 'bear_time_stop': 224, 'bear_use_sma': True, 'bear_use_ema': True, 'bear_use_atr': False, 'bear_use_adx': True, 'bear_use_spike': False, 'bear_rsi_required': True, 'sideways_strategy': 'breakout', 'sideways_bb_std_mult': 1.5215059238634403, 'sideways_rsi_os': 51, 'sideways_rsi_ob': 69, 'sideways_adx_thresh': 7.859141504172566, 'sideways_atr_min_pct': 0.020329398786785125, 'sideways_atr_max_pct': 0.06988937029959398, 'sideways_tp_mult': 2.795800163177365, 'sideways_tsl_mult': 0.3273891579736256, 'sideways_time_stop': 174, 'sideways_use_sma': True, 'sideways_use_ema': False, 'sideways_use_atr': True, 'sideways_use_adx': True, 'sideways_use_spike': False, 'sideways_rsi_required': True}.
[I 2025-09-01 13:43:11,127] Trial 261 finished with values: [-1000000000.0, 1000000000.0] and parameters: {'p_sma': 34, 'p_std': 8, 'p_atr': 25, 'p_adx': 11, 'rsi_period': 64, 'ema1': 5, 'ema2': 16, 'slip_atr_k': 0.023809331763623244, 'slip_spread_k': 0.05252507424268273, 'spread_hl_frac': 0.004973934578057858, 'bb_std_mult': 0.735593329945035, 'rsi_os': 12, 'rsi_ob': 83, 'vol_spike': 0.04778336570643957, 'adx_thresh': 23.183797580917542, 'atr_min_pct': 0.025540095240935534, 'atr_max_pct': 0.14364782332581963, 'tp_mult': 1.0868658699623397, 'tsl_mult': 0.7662031485662907, 'strategy': 'mean_reversion', 'time_stop': 232, 'use_sma': False, 'use_atr': False, 'use_adx': True, 'use_ema': True, 'use_spike': True, 'rsi_required': False, 'edge_k': 0.8580083106195154, 'edge_cap': 0.323519247730098, 'bull_strategy': 'breakout', 'bull_bb_std_mult': 3.3320320252801787, 'bull_rsi_os': 34, 'bull_rsi_ob': 77, 'bull_adx_thresh': 29.50951949289709, 'bull_atr_min_pct': 0.004947233960749088, 'bull_atr_max_pct': 0.12396866375470347, 'bull_tp_mult': 2.84812313100132, 'bull_tsl_mult': 0.43139328134177457, 'bull_time_stop': 208, 'bull_use_sma': True, 'bull_use_ema': True, 'bull_use_atr': True, 'bull_use_adx': True, 'bull_use_spike': False, 'bull_rsi_required': True, 'bear_strategy': 'breakout', 'bear_bb_std_mult': 3.596382364949152, 'bear_rsi_os': 23, 'bear_rsi_ob': 87, 'bear_adx_thresh': 12.107836740742478, 'bear_atr_min_pct': 0.002222814617522795, 'bear_atr_max_pct': 0.061223847517012805, 'bear_tp_mult': 1.5463383260374666, 'bear_tsl_mult': 0.11416406615329502, 'bear_time_stop': 213, 'bear_use_sma': False, 'bear_use_ema': True, 'bear_use_atr': True, 'bear_use_adx': False, 'bear_use_spike': False, 'bear_rsi_required': True, 'sideways_strategy': 'breakout', 'sideways_bb_std_mult': 1.5188543410481943, 'sideways_rsi_os': 51, 'sideways_rsi_ob': 69, 'sideways_adx_thresh': 6.129188544316255, 'sideways_atr_min_pct': 0.020359273130777154, 'sideways_atr_max_pct': 0.07234718037528708, 'sideways_tp_mult': 2.789559348892777, 'sideways_tsl_mult': 0.23521496770891395, 'sideways_time_stop': 175, 'sideways_use_sma': True, 'sideways_use_ema': False, 'sideways_use_atr': True, 'sideways_use_adx': True, 'sideways_use_spike': True, 'sideways_rsi_required': True}.
