[I 2025-09-01 14:39:37,144] Trial 651 finished with values: [-0.05132539976561423, 0.05163011922767155] and parameters: {'p_sma': 23, 'p_std': 35, 'p_atr': 25, 'p_adx': 10, 'rsi_period': 19, 'ema1': 14, 'ema2': 16, 'slip_atr_k': 0.01169049933111876, 'slip_spread_k': 0.42948219000018417, 'spread_hl_frac': 0.04401772484092788, 'bb_std_mult': 2.8193350972603346, 'rsi_os': 35, 'rsi_ob': 77, 'vol_spike': 0.23737104463176908, 'adx_thresh': 24.377481035505973, 'atr_min_pct': 0.026962397720730245, 'atr_max_pct': 0.14244119962297758, 'tp_mult': 1.0506443333243372, 'tsl_mult': 0.7716888952638631, 'strategy': 'mean_reversion', 'time_stop': 299, 'use_sma': True, 'use_atr': False, 'use_adx': False, 'use_ema': True, 'use_spike': True, 'rsi_required': False, 'edge_k': 1.0099447308686185, 'edge_cap': 0.7489052315835056, 'bull_strategy': 'breakout', 'bull_bb_std_mult': 1.882105072069741, 'bull_rsi_os': 29, 'bull_rsi_ob': 82, 'bull_adx_thresh': 29.65801087041102, 'bull_atr_min_pct': 0.021538695146056306, 'bull_atr_max_pct': 0.08142022448421496, 'bull_tp_mult': 1.1648840332206742, 'bull_tsl_mult': 0.4082854505131467, 'bull_time_stop': 91, 'bull_use_sma': True, 'bull_use_ema': True, 'bull_use_atr': True, 'bull_use_adx': True, 'bull_use_spike': False, 'bull_rsi_required': True, 'bear_strategy': 'breakout', 'bear_bb_std_mult': 3.5536110450398217, 'bear_rsi_os': 32, 'bear_rsi_ob': 88, 'bear_adx_thresh': 12.031771924518935, 'bear_atr_min_pct': 0.002152521640829971, 'bear_atr_max_pct': 0.03933365179599066, 'bear_tp_mult': 2.1539218785832372, 'bear_tsl_mult': 0.06072607232301669, 'bear_time_stop': 219, 'bear_use_sma': True, 'bear_use_ema': True, 'bear_use_atr': True, 'bear_use_adx': True, 'bear_use_spike': False, 'bear_rsi_required': True, 'sideways_strategy': 'breakout', 'sideways_bb_std_mult': 1.3467603257780956, 'sideways_rsi_os': 12, 'sideways_rsi_ob': 68, 'sideways_adx_thresh': 23.264168061176456, 'sideways_atr_min_pct': 0.019610892136883558, 'sideways_atr_max_pct': 0.06640693845041763, 'sideways_tp_mult': 2.320540713364524, 'sideways_tsl_mult': 0.8474744611453682, 'sideways_time_stop': 168, 'sideways_use_sma': True, 'sideways_use_ema': False, 'sideways_use_atr': True, 'sideways_use_adx': True, 'sideways_use_spike': False, 'sideways_rsi_required': True}.
[I 2025-09-01 14:39:38,068] Trial 648 finished with values: [-0.040226732362458106, 0.040328525125009264] and parameters: {'p_sma': 35, 'p_std': 57, 'p_atr': 25, 'p_adx': 15, 'rsi_period': 20, 'ema1': 14, 'ema2': 36, 'slip_atr_k': 0.00897453361165639, 'slip_spread_k': 0.08780504665452604, 'spread_hl_frac': 0.025722043083273687, 'bb_std_mult': 2.461449993460678, 'rsi_os': 13, 'rsi_ob': 83, 'vol_spike': 0.038181864819407954, 'adx_thresh': 25.844744525331706, 'atr_min_pct': 0.008654908015462318, 'atr_max_pct': 0.08284267573205022, 'tp_mult': 1.8605393757666657, 'tsl_mult': 0.7383085730543597, 'strategy': 'mean_reversion', 'time_stop': 294, 'use_sma': True, 'use_atr': True, 'use_adx': False, 'use_ema': True, 'use_spike': False, 'rsi_required': False, 'edge_k': 1.0001842387586137, 'edge_cap': 0.7589961050056535, 'bull_strategy': 'breakout', 'bull_bb_std_mult': 0.5043063146930993, 'bull_rsi_os': 40, 'bull_rsi_ob': 74, 'bull_adx_thresh': 30.148413914244717, 'bull_atr_min_pct': 0.002474775128955822, 'bull_atr_max_pct': 0.023068192714288113, 'bull_tp_mult': 2.772604649165815, 'bull_tsl_mult': 0.4404517734122542, 'bull_time_stop': 91, 'bull_use_sma': False, 'bull_use_ema': True, 'bull_use_atr': True, 'bull_use_adx': True, 'bull_use_spike': True, 'bull_rsi_required': True, 'bear_strategy': 'mean_reversion', 'bear_bb_std_mult': 3.548844988260968, 'bear_rsi_os': 34, 'bear_rsi_ob': 52, 'bear_adx_thresh': 29.792232563136203, 'bear_atr_min_pct': 0.0028176944078180323, 'bear_atr_max_pct': 0.04359419718029841, 'bear_tp_mult': 2.1417094826571805, 'bear_tsl_mult': 0.0643964266609493, 'bear_time_stop': 40, 'bear_use_sma': True, 'bear_use_ema': False, 'bear_use_atr': True, 'bear_use_adx': True, 'bear_use_spike': False, 'bear_rsi_required': False, 'sideways_strategy': 'breakout', 'sideways_bb_std_mult': 1.5225719732589116, 'sideways_rsi_os': 50, 'sideways_rsi_ob': 66, 'sideways_adx_thresh': 7.177057175592592, 'sideways_atr_min_pct': 0.02622443076670171, 'sideways_atr_max_pct': 0.06475186701239471, 'sideways_tp_mult': 1.207632011585854, 'sideways_tsl_mult': 0.4639652035975238, 'sideways_time_stop': 185, 'sideways_use_sma': False, 'sideways_use_ema': False, 'sideways_use_atr': True, 'sideways_use_adx': True, 'sideways_use_spike': True, 'sideways_rsi_required': False}.
[I 2025-09-01 14:39:38,739] Trial 650 finished with values: [-1000000000.0, 1000000000.0] and parameters: {'p_sma': 46, 'p_std': 50, 'p_atr': 26, 'p_adx': 15, 'rsi_period': 60, 'ema1': 23, 'ema2': 16, 'slip_atr_k': 0.012334104001975335, 'slip_spread_k': 0.3184950638151827, 'spread_hl_frac': 0.003489538757042554, 'bb_std_mult': 0.6768437721960645, 'rsi_os': 35, 'rsi_ob': 82, 'vol_spike': 0.2934664005887282, 'adx_thresh': 27.1203009830969, 'atr_min_pct': 0.0020254093533698357, 'atr_max_pct': 0.1423584010850234, 'tp_mult': 2.675891502459258, 'tsl_mult': 0.3910141321620471, 'strategy': 'mean_reversion', 'time_stop': 264, 'use_sma': True, 'use_atr': False, 'use_adx': False, 'use_ema': True, 'use_spike': True, 'rsi_required': False, 'edge_k': 0.9804535841858754, 'edge_cap': 0.7595595956770547, 'bull_strategy': 'breakout', 'bull_bb_std_mult': 2.2020330927575023, 'bull_rsi_os': 23, 'bull_rsi_ob': 53, 'bull_adx_thresh': 32.09330738813865, 'bull_atr_min_pct': 0.028098842016688802, 'bull_atr_max_pct': 0.023565096466804717, 'bull_tp_mult': 2.777287480230317, 'bull_tsl_mult': 0.7597428646029734, 'bull_time_stop': 92, 'bull_use_sma': True, 'bull_use_ema': True, 'bull_use_atr': True, 'bull_use_adx': True, 'bull_use_spike': False, 'bull_rsi_required': True, 'bear_strategy': 'mean_reversion', 'bear_bb_std_mult': 3.5274680219254364, 'bear_rsi_os': 32, 'bear_rsi_ob': 86, 'bear_adx_thresh': 15.543990995212582, 'bear_atr_min_pct': 0.0034344967462878358, 'bear_atr_max_pct': 0.03970737742827157, 'bear_tp_mult': 1.096461098180594, 'bear_tsl_mult': 0.06254865294798721, 'bear_time_stop': 169, 'bear_use_sma': True, 'bear_use_ema': True, 'bear_use_atr': True, 'bear_use_adx': True, 'bear_use_spike': False, 'bear_rsi_required': True, 'sideways_strategy': 'breakout', 'sideways_bb_std_mult': 1.3502899293077846, 'sideways_rsi_os': 51, 'sideways_rsi_ob': 66, 'sideways_adx_thresh': 23.569168409298136, 'sideways_atr_min_pct': 0.021320105841264526, 'sideways_atr_max_pct': 0.12984141924705078, 'sideways_tp_mult': 1.194260934838585, 'sideways_tsl_mult': 0.10149756799196924, 'sideways_time_stop': 169, 'sideways_use_sma': True, 'sideways_use_ema': False, 'sideways_use_atr': True, 'sideways_use_adx': True, 'sideways_use_spike': True, 'sideways_rsi_required': True}.
[I 2025-09-01 14:39:39,251] Trial 649 finished with values: [-1000000000.0, 1000000000.0] and parameters: {'p_sma': 35, 'p_std': 7, 'p_atr': 25, 'p_adx': 13, 'rsi_period': 61, 'ema1': 14, 'ema2': 19, 'slip_atr_k': 0.012556750002492258, 'slip_spread_k': 0.3231362226713265, 'spread_hl_frac': 0.0031197128155258727, 'bb_std_mult': 1.2613065822469176, 'rsi_os': 28, 'rsi_ob': 82, 'vol_spike': 0.19682518403389507, 'adx_thresh': 16.912637707480236, 'atr_min_pct': 0.008596932687949168, 'atr_max_pct': 0.1377211448295998, 'tp_mult': 2.677663193753772, 'tsl_mult': 0.5242903043654007, 'strategy': 'mean_reversion', 'time_stop': 239, 'use_sma': True, 'use_atr': False, 'use_adx': False, 'use_ema': True, 'use_spike': True, 'rsi_required': False, 'edge_k': 0.9909432533409193, 'edge_cap': 0.17163931532849203, 'bull_strategy': 'breakout', 'bull_bb_std_mult': 3.312492679280668, 'bull_rsi_os': 16, 'bull_rsi_ob': 82, 'bull_adx_thresh': 32.145128119261344, 'bull_atr_min_pct': 0.0057523984138081515, 'bull_atr_max_pct': 0.023959776050097678, 'bull_tp_mult': 2.7755259472297777, 'bull_tsl_mult': 0.057032735903540466, 'bull_time_stop': 86, 'bull_use_sma': True, 'bull_use_ema': True, 'bull_use_atr': True, 'bull_use_adx': True, 'bull_use_spike': False, 'bull_rsi_required': True, 'bear_strategy': 'mean_reversion', 'bear_bb_std_mult': 1.9142953693176488, 'bear_rsi_os': 29, 'bear_rsi_ob': 81, 'bear_adx_thresh': 19.457708229115156, 'bear_atr_min_pct': 0.0026850686474260434, 'bear_atr_max_pct': 0.039708864979426384, 'bear_tp_mult': 2.9957098736960575, 'bear_tsl_mult': 0.10630233056023708, 'bear_time_stop': 31, 'bear_use_sma': True, 'bear_use_ema': True, 'bear_use_atr': True, 'bear_use_adx': True, 'bear_use_spike': False, 'bear_rsi_required': True, 'sideways_strategy': 'breakout', 'sideways_bb_std_mult': 1.9413962677820933, 'sideways_rsi_os': 51, 'sideways_rsi_ob': 66, 'sideways_adx_thresh': 23.45113553190335, 'sideways_atr_min_pct': 0.01859500863043409, 'sideways_atr_max_pct': 0.0649978665360924, 'sideways_tp_mult': 2.3105617852377685, 'sideways_tsl_mult': 0.300852013091794, 'sideways_time_stop': 189, 'sideways_use_sma': True, 'sideways_use_ema': False, 'sideways_use_atr': True, 'sideways_use_adx': True, 'sideways_use_spike': True, 'sideways_rsi_required': True}.
[I 2025-09-01 14:40:15,902] Trial 653 finished with values: [-1000000000.0, 1000000000.0] and parameters: {'p_sma': 8, 'p_std': 50, 'p_atr': 28, 'p_adx': 14, 'rsi_period': 61, 'ema1': 28, 'ema2': 32, 'slip_atr_k': 0.18640575470273205, 'slip_spread_k': 0.11570784937901438, 'spread_hl_frac': 0.03122261411329543, 'bb_std_mult': 1.743198278132055, 'rsi_os': 37, 'rsi_ob': 82, 'vol_spike': 0.19322673230359547, 'adx_thresh': 13.119418555344408, 'atr_min_pct': 0.014694099928458259, 'atr_max_pct': 0.14284837798531932, 'tp_mult': 1.5910087305321008, 'tsl_mult': 0.7653556661149599, 'strategy': 'mean_reversion', 'time_stop': 241, 'use_sma': True, 'use_atr': False, 'use_adx': False, 'use_ema': True, 'use_spike': True, 'rsi_required': False, 'edge_k': 1.3414880413988985, 'edge_cap': 0.3508503865726012, 'bull_strategy': 'mean_reversion', 'bull_bb_std_mult': 2.1981787295491118, 'bull_rsi_os': 44, 'bull_rsi_ob': 48, 'bull_adx_thresh': 31.945402901629564, 'bull_atr_min_pct': 0.004577118217538167, 'bull_atr_max_pct': 0.051882086896796666, 'bull_tp_mult': 1.5804344793470175, 'bull_tsl_mult': 0.9053942248661359, 'bull_time_stop': 68, 'bull_use_sma': True, 'bull_use_ema': False, 'bull_use_atr': True, 'bull_use_adx': False, 'bull_use_spike': False, 'bull_rsi_required': True, 'bear_strategy': 'breakout', 'bear_bb_std_mult': 3.5227381699961255, 'bear_rsi_os': 15, 'bear_rsi_ob': 84, 'bear_adx_thresh': 13.914126921150583, 'bear_atr_min_pct': 0.0011357258229410874, 'bear_atr_max_pct': 0.13078617496910916, 'bear_tp_mult': 2.3098173401735544, 'bear_tsl_mult': 0.12040068386161265, 'bear_time_stop': 140, 'bear_use_sma': False, 'bear_use_ema': True, 'bear_use_atr': True, 'bear_use_adx': True, 'bear_use_spike': False, 'bear_rsi_required': True, 'sideways_strategy': 'mean_reversion', 'sideways_bb_std_mult': 1.6670542599281655, 'sideways_rsi_os': 16, 'sideways_rsi_ob': 67, 'sideways_adx_thresh': 28.03263891375577, 'sideways_atr_min_pct': 0.02103277670797347, 'sideways_atr_max_pct': 0.05663879079671329, 'sideways_tp_mult': 2.698856684271248, 'sideways_tsl_mult': 0.33481135128684936, 'sideways_time_stop': 170, 'sideways_use_sma': True, 'sideways_use_ema': False, 'sideways_use_atr': True, 'sideways_use_adx': False, 'sideways_use_spike': False, 'sideways_rsi_required': True}.
[I 2025-09-01 14:40:16,564] Trial 654 finished with values: [-0.15695184695995046, 0.1564209939023684] and parameters: {'p_sma': 59, 'p_std': 16, 'p_atr': 23, 'p_adx': 11, 'rsi_period': 67, 'ema1': 21, 'ema2': 32, 'slip_atr_k': 0.018797742162996477, 'slip_spread_k': 0.9053619722917758, 'spread_hl_frac': 0.02100403217656244, 'bb_std_mult': 1.2569356846220954, 'rsi_os': 49, 'rsi_ob': 89, 'vol_spike': 0.010556853275964756, 'adx_thresh': 13.321099071643816, 'atr_min_pct': 0.010107125855605435, 'atr_max_pct': 0.12234170984712306, 'tp_mult': 2.8669401855437853, 'tsl_mult': 0.5199282615767191, 'strategy': 'mean_reversion', 'time_stop': 63, 'use_sma': True, 'use_atr': False, 'use_adx': False, 'use_ema': True, 'use_spike': True, 'rsi_required': False, 'edge_k': 1.3225750438632726, 'edge_cap': 0.6483216173397868, 'bull_strategy': 'mean_reversion', 'bull_bb_std_mult': 3.2972131410875614, 'bull_rsi_os': 37, 'bull_rsi_ob': 48, 'bull_adx_thresh': 30.65615509862325, 'bull_atr_min_pct': 0.005730327190067257, 'bull_atr_max_pct': 0.0328496674987615, 'bull_tp_mult': 2.887079653664425, 'bull_tsl_mult': 0.059532678421503116, 'bull_time_stop': 68, 'bull_use_sma': True, 'bull_use_ema': False, 'bull_use_atr': True, 'bull_use_adx': False, 'bull_use_spike': False, 'bull_rsi_required': True, 'bear_strategy': 'breakout', 'bear_bb_std_mult': 3.487342883354596, 'bear_rsi_os': 47, 'bear_rsi_ob': 84, 'bear_adx_thresh': 31.11334329735227, 'bear_atr_min_pct': 0.0005238172508878034, 'bear_atr_max_pct': 0.09270377509791154, 'bear_tp_mult': 2.799210516661499, 'bear_tsl_mult': 0.23566765976599852, 'bear_time_stop': 66, 'bear_use_sma': False, 'bear_use_ema': True, 'bear_use_atr': True, 'bear_use_adx': True, 'bear_use_spike': False, 'bear_rsi_required': True, 'sideways_strategy': 'mean_reversion', 'sideways_bb_std_mult': 2.278076087663838, 'sideways_rsi_os': 37, 'sideways_rsi_ob': 51, 'sideways_adx_thresh': 26.84981665510159, 'sideways_atr_min_pct': 0.019111458857919705, 'sideways_atr_max_pct': 0.07377878007157808, 'sideways_tp_mult': 2.6956880651722632, 'sideways_tsl_mult': 0.7365725473319897, 'sideways_time_stop': 176, 'sideways_use_sma': True, 'sideways_use_ema': False, 'sideways_use_atr': True, 'sideways_use_adx': False, 'sideways_use_spike': False, 'sideways_rsi_required': True}.
[I 2025-09-01 14:40:16,884] Trial 655 finished with values: [-1000000000.0, 1000000000.0] and parameters: {'p_sma': 14, 'p_std': 45, 'p_atr': 23, 'p_adx': 27, 'rsi_period': 68, 'ema1': 26, 'ema2': 32, 'slip_atr_k': 0.019288157356254318, 'slip_spread_k': 0.9132901017189423, 'spread_hl_frac': 0.03124504215843225, 'bb_std_mult': 1.7455849172360889, 'rsi_os': 37, 'rsi_ob': 80, 'vol_spike': 0.24111297655645275, 'adx_thresh': 27.97961333421217, 'atr_min_pct': 0.010019002210628371, 'atr_max_pct': 0.12175464783274528, 'tp_mult': 1.6148994617457946, 'tsl_mult': 0.7660988843003033, 'strategy': 'mean_reversion', 'time_stop': 127, 'use_sma': True, 'use_atr': False, 'use_adx': False, 'use_ema': True, 'use_spike': True, 'rsi_required': False, 'edge_k': 1.8318725849194994, 'edge_cap': 0.07162117988416661, 'bull_strategy': 'mean_reversion', 'bull_bb_std_mult': 2.9515980771400496, 'bull_rsi_os': 7, 'bull_rsi_ob': 55, 'bull_adx_thresh': 19.501945387694008, 'bull_atr_min_pct': 0.004574205848682157, 'bull_atr_max_pct': 0.06624883235496784, 'bull_tp_mult': 1.3328384799084128, 'bull_tsl_mult': 0.4243465256919375, 'bull_time_stop': 102, 'bull_use_sma': True, 'bull_use_ema': False, 'bull_use_atr': True, 'bull_use_adx': False, 'bull_use_spike': False, 'bull_rsi_required': False, 'bear_strategy': 'breakout', 'bear_bb_std_mult': 1.3430744134268031, 'bear_rsi_os': 16, 'bear_rsi_ob': 84, 'bear_adx_thresh': 34.94124952054024, 'bear_atr_min_pct': 0.020799553673918048, 'bear_atr_max_pct': 0.09261183987090468, 'bear_tp_mult': 1.8000105436161589, 'bear_tsl_mult': 0.23974298484931866, 'bear_time_stop': 219, 'bear_use_sma': False, 'bear_use_ema': True, 'bear_use_atr': True, 'bear_use_adx': True, 'bear_use_spike': False, 'bear_rsi_required': True, 'sideways_strategy': 'mean_reversion', 'sideways_bb_std_mult': 1.4924177762265896, 'sideways_rsi_os': 45, 'sideways_rsi_ob': 67, 'sideways_adx_thresh': 6.289071661434032, 'sideways_atr_min_pct': 0.019246196337647476, 'sideways_atr_max_pct': 0.07360581750732922, 'sideways_tp_mult': 1.518156606084922, 'sideways_tsl_mult': 0.8675407656954153, 'sideways_time_stop': 179, 'sideways_use_sma': True, 'sideways_use_ema': False, 'sideways_use_atr': True, 'sideways_use_adx': False, 'sideways_use_spike': False, 'sideways_rsi_required': True}.
[I 2025-09-01 14:40:17,084] Trial 652 finished with values: [-1000000000.0, 1000000000.0] and parameters: {'p_sma': 35, 'p_std': 50, 'p_atr': 28, 'p_adx': 13, 'rsi_period': 61, 'ema1': 26, 'ema2': 55, 'slip_atr_k': 0.01319047755979871, 'slip_spread_k': 0.09289622022052638, 'spread_hl_frac': 0.003343668221682433, 'bb_std_mult': 2.3311930979901163, 'rsi_os': 13, 'rsi_ob': 80, 'vol_spike': 0.05179673274098512, 'adx_thresh': 23.354450143594722, 'atr_min_pct': 0.016495191128990134, 'atr_max_pct': 0.13243346510710002, 'tp_mult': 1.589469984340309, 'tsl_mult': 0.763543488469279, 'strategy': 'mean_reversion', 'time_stop': 241, 'use_sma': True, 'use_atr': False, 'use_adx': False, 'use_ema': True, 'use_spike': True, 'rsi_required': False, 'edge_k': 0.6065355085908744, 'edge_cap': 0.35162132167652044, 'bull_strategy': 'mean_reversion', 'bull_bb_std_mult': 3.2625572210748994, 'bull_rsi_os': 37, 'bull_rsi_ob': 48, 'bull_adx_thresh': 22.01398213382452, 'bull_atr_min_pct': 0.0023316098407199816, 'bull_atr_max_pct': 0.033160639538129484, 'bull_tp_mult': 2.774461982349474, 'bull_tsl_mult': 0.06173999200830976, 'bull_time_stop': 83, 'bull_use_sma': True, 'bull_use_ema': False, 'bull_use_atr': True, 'bull_use_adx': True, 'bull_use_spike': False, 'bull_rsi_required': True, 'bear_strategy': 'breakout', 'bear_bb_std_mult': 3.5421606362353226, 'bear_rsi_os': 50, 'bear_rsi_ob': 66, 'bear_adx_thresh': 15.375123273372349, 'bear_atr_min_pct': 0.020694379349258805, 'bear_atr_max_pct': 0.025411580302454564, 'bear_tp_mult': 2.709283548069351, 'bear_tsl_mult': 0.12334967175740269, 'bear_time_stop': 141, 'bear_use_sma': False, 'bear_use_ema': True, 'bear_use_atr': True, 'bear_use_adx': True, 'bear_use_spike': False, 'bear_rsi_required': True, 'sideways_strategy': 'mean_reversion', 'sideways_bb_std_mult': 1.6695909557318251, 'sideways_rsi_os': 48, 'sideways_rsi_ob': 50, 'sideways_adx_thresh': 5.53401768264789, 'sideways_atr_min_pct': 0.0213948246039276, 'sideways_atr_max_pct': 0.015208315948431486, 'sideways_tp_mult': 1.5447921052615312, 'sideways_tsl_mult': 0.7327477668578432, 'sideways_time_stop': 169, 'sideways_use_sma': True, 'sideways_use_ema': False, 'sideways_use_atr': True, 'sideways_use_adx': False, 'sideways_use_spike': False, 'sideways_rsi_required': True}.
[I 2025-09-01 14:40:52,879] Trial 657 finished with values: [-1000000000.0, 1000000000.0] and parameters: {'p_sma': 36, 'p_std': 47, 'p_atr': 20, 'p_adx': 25, 'rsi_period': 68, 'ema1': 20, 'ema2': 20, 'slip_atr_k': 0.10529157841694542, 'slip_spread_k': 0.09606684065299823, 'spread_hl_frac': 0.008885704437252642, 'bb_std_mult': 2.023595633809547, 'rsi_os': 11, 'rsi_ob': 62, 'vol_spike': 0.05167954973406788, 'adx_thresh': 23.274704878087537, 'atr_min_pct': 0.025473337176019847, 'atr_max_pct': 0.133988804134293, 'tp_mult': 2.541485722381145, 'tsl_mult': 0.717963266225383, 'strategy': 'mean_reversion', 'time_stop': 127, 'use_sma': False, 'use_atr': False, 'use_adx': False, 'use_ema': True, 'use_spike': True, 'rsi_required': False, 'edge_k': 0.9453289315028833, 'edge_cap': 0.46719545275134877, 'bull_strategy': 'breakout', 'bull_bb_std_mult': 2.3283608792252672, 'bull_rsi_os': 36, 'bull_rsi_ob': 55, 'bull_adx_thresh': 15.081077637734463, 'bull_atr_min_pct': 0.0032879449283546008, 'bull_atr_max_pct': 0.013635953710751741, 'bull_tp_mult': 1.383495407046532, 'bull_tsl_mult': 0.42885909854278215, 'bull_time_stop': 98, 'bull_use_sma': True, 'bull_use_ema': True, 'bull_use_atr': True, 'bull_use_adx': True, 'bull_use_spike': False, 'bull_rsi_required': False, 'bear_strategy': 'breakout', 'bear_bb_std_mult': 1.5829355585137774, 'bear_rsi_os': 17, 'bear_rsi_ob': 77, 'bear_adx_thresh': 23.405284147501213, 'bear_atr_min_pct': 0.018765760119287465, 'bear_atr_max_pct': 0.04641850597657005, 'bear_tp_mult': 1.7173329191208002, 'bear_tsl_mult': 0.1496378087727226, 'bear_time_stop': 281, 'bear_use_sma': True, 'bear_use_ema': True, 'bear_use_atr': True, 'bear_use_adx': True, 'bear_use_spike': True, 'bear_rsi_required': True, 'sideways_strategy': 'breakout', 'sideways_bb_std_mult': 1.5075949838083302, 'sideways_rsi_os': 48, 'sideways_rsi_ob': 85, 'sideways_adx_thresh': 5.213329133855691, 'sideways_atr_min_pct': 0.017513508119191307, 'sideways_atr_max_pct': 0.14641836050598406, 'sideways_tp_mult': 2.763350985805975, 'sideways_tsl_mult': 0.2554885984522671, 'sideways_time_stop': 182, 'sideways_use_sma': True, 'sideways_use_ema': False, 'sideways_use_atr': False, 'sideways_use_adx': True, 'sideways_use_spike': False, 'sideways_rsi_required': True}.
