[I 2025-09-01 14:26:03,975] Trial 557 finished with values: [-0.027237763262680903, 0.026753823859668093] and parameters: {'p_sma': 38, 'p_std': 10, 'p_atr': 25, 'p_adx': 11, 'rsi_period': 30, 'ema1': 21, 'ema2': 18, 'slip_atr_k': 0.03348181702982492, 'slip_spread_k': 0.06939233715833337, 'spread_hl_frac': 0.007031922883029306, 'bb_std_mult': 1.7118977368061647, 'rsi_os': 36, 'rsi_ob': 80, 'vol_spike': 0.23942695765591868, 'adx_thresh': 24.124760892609764, 'atr_min_pct': 0.007147464612161767, 'atr_max_pct': 0.13808363428875373, 'tp_mult': 2.4239856829783384, 'tsl_mult': 0.6815519993763278, 'strategy': 'mean_reversion', 'time_stop': 225, 'use_sma': False, 'use_atr': True, 'use_adx': False, 'use_ema': True, 'use_spike': True, 'rsi_required': False, 'edge_k': 0.9493833951346181, 'edge_cap': 0.3929142621622077, 'bull_strategy': 'breakout', 'bull_bb_std_mult': 1.579189226087896, 'bull_rsi_os': 33, 'bull_rsi_ob': 84, 'bull_adx_thresh': 15.333609296112023, 'bull_atr_min_pct': 0.002688165946805855, 'bull_atr_max_pct': 0.017504139208822943, 'bull_tp_mult': 1.0624245825055874, 'bull_tsl_mult': 0.4275677931935491, 'bull_time_stop': 94, 'bull_use_sma': True, 'bull_use_ema': True, 'bull_use_atr': True, 'bull_use_adx': False, 'bull_use_spike': False, 'bull_rsi_required': True, 'bear_strategy': 'breakout', 'bear_bb_std_mult': 3.437203478325034, 'bear_rsi_os': 26, 'bear_rsi_ob': 91, 'bear_adx_thresh': 10.354422526829564, 'bear_atr_min_pct': 0.003014703272071638, 'bear_atr_max_pct': 0.0469672425602931, 'bear_tp_mult': 2.234419784525405, 'bear_tsl_mult': 0.7839646936100136, 'bear_time_stop': 216, 'bear_use_sma': True, 'bear_use_ema': True, 'bear_use_atr': True, 'bear_use_adx': True, 'bear_use_spike': False, 'bear_rsi_required': True, 'sideways_strategy': 'mean_reversion', 'sideways_bb_std_mult': 1.5276012667097267, 'sideways_rsi_os': 16, 'sideways_rsi_ob': 69, 'sideways_adx_thresh': 33.485822165433305, 'sideways_atr_min_pct': 0.004716559691315363, 'sideways_atr_max_pct': 0.07285162943493381, 'sideways_tp_mult': 2.7922184447615632, 'sideways_tsl_mult': 0.8261290922872346, 'sideways_time_stop': 194, 'sideways_use_sma': True, 'sideways_use_ema': False, 'sideways_use_atr': True, 'sideways_use_adx': True, 'sideways_use_spike': False, 'sideways_rsi_required': False}.
[I 2025-09-01 14:26:06,006] Trial 560 finished with values: [-1000000000.0, 1000000000.0] and parameters: {'p_sma': 37, 'p_std': 50, 'p_atr': 21, 'p_adx': 13, 'rsi_period': 28, 'ema1': 21, 'ema2': 18, 'slip_atr_k': 0.012004717699363862, 'slip_spread_k': 0.07394048136766318, 'spread_hl_frac': 0.022978274185802835, 'bb_std_mult': 1.7085114000038963, 'rsi_os': 49, 'rsi_ob': 52, 'vol_spike': 0.22097605740779672, 'adx_thresh': 23.76134331472656, 'atr_min_pct': 0.014237893111867, 'atr_max_pct': 0.13873485901907745, 'tp_mult': 2.0199335369874647, 'tsl_mult': 0.822797534701459, 'strategy': 'mean_reversion', 'time_stop': 243, 'use_sma': False, 'use_atr': True, 'use_adx': False, 'use_ema': True, 'use_spike': True, 'rsi_required': False, 'edge_k': 0.7358323290621646, 'edge_cap': 0.1838412526187324, 'bull_strategy': 'breakout', 'bull_bb_std_mult': 1.9531790437972445, 'bull_rsi_os': 33, 'bull_rsi_ob': 86, 'bull_adx_thresh': 11.813862763298717, 'bull_atr_min_pct': 0.004466009703233722, 'bull_atr_max_pct': 0.10364887349166957, 'bull_tp_mult': 2.0239559397585287, 'bull_tsl_mult': 0.2672879425521755, 'bull_time_stop': 289, 'bull_use_sma': True, 'bull_use_ema': True, 'bull_use_atr': True, 'bull_use_adx': False, 'bull_use_spike': False, 'bull_rsi_required': True, 'bear_strategy': 'breakout', 'bear_bb_std_mult': 3.425735487701932, 'bear_rsi_os': 43, 'bear_rsi_ob': 73, 'bear_adx_thresh': 30.944586761107164, 'bear_atr_min_pct': 0.011815615996445802, 'bear_atr_max_pct': 0.04625807642703288, 'bear_tp_mult': 1.5003385996391345, 'bear_tsl_mult': 0.1039422217737456, 'bear_time_stop': 60, 'bear_use_sma': True, 'bear_use_ema': True, 'bear_use_atr': True, 'bear_use_adx': True, 'bear_use_spike': True, 'bear_rsi_required': True, 'sideways_strategy': 'mean_reversion', 'sideways_bb_std_mult': 1.657812675582051, 'sideways_rsi_os': 47, 'sideways_rsi_ob': 66, 'sideways_adx_thresh': 8.502733692986702, 'sideways_atr_min_pct': 0.004928661987116202, 'sideways_atr_max_pct': 0.06698731327210862, 'sideways_tp_mult': 1.6890950471731474, 'sideways_tsl_mult': 0.3302889939940738, 'sideways_time_stop': 177, 'sideways_use_sma': True, 'sideways_use_ema': False, 'sideways_use_atr': False, 'sideways_use_adx': True, 'sideways_use_spike': True, 'sideways_rsi_required': False}.
[I 2025-09-01 14:26:06,451] Trial 558 finished with values: [-1000000000.0, 1000000000.0] and parameters: {'p_sma': 34, 'p_std': 13, 'p_atr': 25, 'p_adx': 13, 'rsi_period': 62, 'ema1': 8, 'ema2': 16, 'slip_atr_k': 0.012303186236251673, 'slip_spread_k': 0.07446791370748235, 'spread_hl_frac': 0.0028262999510394213, 'bb_std_mult': 3.4071529190398975, 'rsi_os': 36, 'rsi_ob': 80, 'vol_spike': 0.22096664821544754, 'adx_thresh': 23.72293802191999, 'atr_min_pct': 0.007494095840282271, 'atr_max_pct': 0.032560792413838927, 'tp_mult': 1.6898254283922962, 'tsl_mult': 0.5500482920441879, 'strategy': 'mean_reversion', 'time_stop': 244, 'use_sma': False, 'use_atr': True, 'use_adx': False, 'use_ema': True, 'use_spike': True, 'rsi_required': False, 'edge_k': 1.0313999448663056, 'edge_cap': 0.3934671511364366, 'bull_strategy': 'breakout', 'bull_bb_std_mult': 1.8834079450731198, 'bull_rsi_os': 33, 'bull_rsi_ob': 52, 'bull_adx_thresh': 31.626745529875933, 'bull_atr_min_pct': 0.010662695261189802, 'bull_atr_max_pct': 0.02238407170129635, 'bull_tp_mult': 2.8927374761198044, 'bull_tsl_mult': 0.9817552303081112, 'bull_time_stop': 290, 'bull_use_sma': True, 'bull_use_ema': True, 'bull_use_atr': True, 'bull_use_adx': False, 'bull_use_spike': False, 'bull_rsi_required': True, 'bear_strategy': 'breakout', 'bear_bb_std_mult': 3.439904638433421, 'bear_rsi_os': 26, 'bear_rsi_ob': 50, 'bear_adx_thresh': 10.765639733061299, 'bear_atr_min_pct': 0.003066914010795515, 'bear_atr_max_pct': 0.03133652277692768, 'bear_tp_mult': 2.1388150745155388, 'bear_tsl_mult': 0.1112748160664816, 'bear_time_stop': 214, 'bear_use_sma': True, 'bear_use_ema': True, 'bear_use_atr': True, 'bear_use_adx': True, 'bear_use_spike': True, 'bear_rsi_required': True, 'sideways_strategy': 'mean_reversion', 'sideways_bb_std_mult': 3.5988190239486135, 'sideways_rsi_os': 16, 'sideways_rsi_ob': 90, 'sideways_adx_thresh': 32.3406185823299, 'sideways_atr_min_pct': 0.020772554045393563, 'sideways_atr_max_pct': 0.06689848053670241, 'sideways_tp_mult': 2.7618379422305916, 'sideways_tsl_mult': 0.33058105971725216, 'sideways_time_stop': 82, 'sideways_use_sma': True, 'sideways_use_ema': True, 'sideways_use_atr': False, 'sideways_use_adx': True, 'sideways_use_spike': True, 'sideways_rsi_required': False}.
[I 2025-09-01 14:26:06,775] Trial 561 finished with values: [-0.09259124030185106, 0.09205039966158793] and parameters: {'p_sma': 37, 'p_std': 46, 'p_atr': 26, 'p_adx': 11, 'rsi_period': 7, 'ema1': 20, 'ema2': 25, 'slip_atr_k': 0.011613772239977171, 'slip_spread_k': 0.5189058558912479, 'spread_hl_frac': 0.0069609613812779796, 'bb_std_mult': 1.7083177297645078, 'rsi_os': 36, 'rsi_ob': 51, 'vol_spike': 0.240536317647984, 'adx_thresh': 19.273052390474046, 'atr_min_pct': 0.01419228433978362, 'atr_max_pct': 0.11080344759695203, 'tp_mult': 1.1390516811945608, 'tsl_mult': 0.010781131755202678, 'strategy': 'mean_reversion', 'time_stop': 243, 'use_sma': True, 'use_atr': False, 'use_adx': False, 'use_ema': True, 'use_spike': True, 'rsi_required': False, 'edge_k': 1.9220676780082293, 'edge_cap': 0.7009616058953061, 'bull_strategy': 'mean_reversion', 'bull_bb_std_mult': 2.776751156218044, 'bull_rsi_os': 34, 'bull_rsi_ob': 52, 'bull_adx_thresh': 11.993560218276611, 'bull_atr_min_pct': 0.009755235947127693, 'bull_atr_max_pct': 0.03400543452413159, 'bull_tp_mult': 2.8874051859339183, 'bull_tsl_mult': 0.05067725897985148, 'bull_time_stop': 232, 'bull_use_sma': True, 'bull_use_ema': True, 'bull_use_atr': True, 'bull_use_adx': True, 'bull_use_spike': False, 'bull_rsi_required': True, 'bear_strategy': 'breakout', 'bear_bb_std_mult': 3.4219904897979583, 'bear_rsi_os': 33, 'bear_rsi_ob': 66, 'bear_adx_thresh': 11.02248934861882, 'bear_atr_min_pct': 0.0007938020077403935, 'bear_atr_max_pct': 0.03055245790926469, 'bear_tp_mult': 1.314107923292421, 'bear_tsl_mult': 0.17690529796983584, 'bear_time_stop': 153, 'bear_use_sma': False, 'bear_use_ema': True, 'bear_use_atr': True, 'bear_use_adx': True, 'bear_use_spike': False, 'bear_rsi_required': True, 'sideways_strategy': 'breakout', 'sideways_bb_std_mult': 2.4947788883297872, 'sideways_rsi_os': 44, 'sideways_rsi_ob': 68, 'sideways_adx_thresh': 32.47511654003267, 'sideways_atr_min_pct': 0.0046284034007042455, 'sideways_atr_max_pct': 0.016781806579554734, 'sideways_tp_mult': 2.8393433554771543, 'sideways_tsl_mult': 0.23913213978359985, 'sideways_time_stop': 160, 'sideways_use_sma': True, 'sideways_use_ema': False, 'sideways_use_atr': True, 'sideways_use_adx': True, 'sideways_use_spike': True, 'sideways_rsi_required': False}.
[I 2025-09-01 14:26:43,144] Trial 565 finished with values: [-0.05625546103753387, 0.055949902419557246] and parameters: {'p_sma': 35, 'p_std': 46, 'p_atr': 27, 'p_adx': 12, 'rsi_period': 66, 'ema1': 23, 'ema2': 17, 'slip_atr_k': 0.22220308619692786, 'slip_spread_k': 0.12811437947559817, 'spread_hl_frac': 0.02820447880463147, 'bb_std_mult': 1.8308332297515206, 'rsi_os': 20, 'rsi_ob': 69, 'vol_spike': 0.2323840217822422, 'adx_thresh': 25.198034600168434, 'atr_min_pct': 0.02648752341540368, 'atr_max_pct': 0.1436106978621402, 'tp_mult': 1.3566078648313589, 'tsl_mult': 0.7585437041256283, 'strategy': 'breakout', 'time_stop': 252, 'use_sma': True, 'use_atr': False, 'use_adx': True, 'use_ema': False, 'use_spike': True, 'rsi_required': True, 'edge_k': 0.9091313059252443, 'edge_cap': 0.7320228281645828, 'bull_strategy': 'mean_reversion', 'bull_bb_std_mult': 2.4271324276593287, 'bull_rsi_os': 35, 'bull_rsi_ob': 80, 'bull_adx_thresh': 30.86363473687994, 'bull_atr_min_pct': 0.0033924169849155754, 'bull_atr_max_pct': 0.023046979068546927, 'bull_tp_mult': 2.411533086309765, 'bull_tsl_mult': 0.38971045935241744, 'bull_time_stop': 48, 'bull_use_sma': False, 'bull_use_ema': True, 'bull_use_atr': False, 'bull_use_adx': True, 'bull_use_spike': True, 'bull_rsi_required': False, 'bear_strategy': 'breakout', 'bear_bb_std_mult': 3.523216385135962, 'bear_rsi_os': 32, 'bear_rsi_ob': 89, 'bear_adx_thresh': 11.228877265142659, 'bear_atr_min_pct': 0.004207602766579279, 'bear_atr_max_pct': 0.14523597715607864, 'bear_tp_mult': 1.9876695394669177, 'bear_tsl_mult': 0.13292357466597118, 'bear_time_stop': 226, 'bear_use_sma': False, 'bear_use_ema': True, 'bear_use_atr': False, 'bear_use_adx': False, 'bear_use_spike': False, 'bear_rsi_required': True, 'sideways_strategy': 'breakout', 'sideways_bb_std_mult': 1.5837345790118367, 'sideways_rsi_os': 49, 'sideways_rsi_ob': 86, 'sideways_adx_thresh': 12.263092709140096, 'sideways_atr_min_pct': 0.002341444099886191, 'sideways_atr_max_pct': 0.05040167995386437, 'sideways_tp_mult': 1.2772420928944834, 'sideways_tsl_mult': 0.28115834448744326, 'sideways_time_stop': 172, 'sideways_use_sma': True, 'sideways_use_ema': False, 'sideways_use_atr': True, 'sideways_use_adx': False, 'sideways_use_spike': False, 'sideways_rsi_required': True}.
[I 2025-09-01 14:26:44,041] Trial 564 finished with values: [-0.020637858323728886, 0.02037496324295784] and parameters: {'p_sma': 59, 'p_std': 17, 'p_atr': 26, 'p_adx': 22, 'rsi_period': 66, 'ema1': 23, 'ema2': 14, 'slip_atr_k': 0.02573160238683172, 'slip_spread_k': 0.03328996862772515, 'spread_hl_frac': 0.005775693133701605, 'bb_std_mult': 3.536768458949302, 'rsi_os': 24, 'rsi_ob': 83, 'vol_spike': 0.23384755811612404, 'adx_thresh': 32.01293917326813, 'atr_min_pct': 0.02636972842561842, 'atr_max_pct': 0.14365678883604946, 'tp_mult': 1.1112486503838694, 'tsl_mult': 0.6556716357689532, 'strategy': 'breakout', 'time_stop': 189, 'use_sma': True, 'use_atr': False, 'use_adx': True, 'use_ema': False, 'use_spike': True, 'rsi_required': True, 'edge_k': 0.9111110980401478, 'edge_cap': 0.2937020013145113, 'bull_strategy': 'mean_reversion', 'bull_bb_std_mult': 2.8079765913207475, 'bull_rsi_os': 34, 'bull_rsi_ob': 89, 'bull_adx_thresh': 30.571596532198736, 'bull_atr_min_pct': 0.009708842189958341, 'bull_atr_max_pct': 0.024449829409257624, 'bull_tp_mult': 2.324217319256755, 'bull_tsl_mult': 0.515913125878617, 'bull_time_stop': 218, 'bull_use_sma': False, 'bull_use_ema': True, 'bull_use_atr': False, 'bull_use_adx': True, 'bull_use_spike': True, 'bull_rsi_required': False, 'bear_strategy': 'breakout', 'bear_bb_std_mult': 1.7038578145919643, 'bear_rsi_os': 33, 'bear_rsi_ob': 89, 'bear_adx_thresh': 11.117682612844998, 'bear_atr_min_pct': 0.0007227696905173467, 'bear_atr_max_pct': 0.14501310350204008, 'bear_tp_mult': 2.6940092311647588, 'bear_tsl_mult': 0.17753239341686566, 'bear_time_stop': 284, 'bear_use_sma': False, 'bear_use_ema': True, 'bear_use_atr': False, 'bear_use_adx': True, 'bear_use_spike': False, 'bear_rsi_required': True, 'sideways_strategy': 'breakout', 'sideways_bb_std_mult': 2.4055207625642656, 'sideways_rsi_os': 49, 'sideways_rsi_ob': 86, 'sideways_adx_thresh': 5.746316826740488, 'sideways_atr_min_pct': 0.021760157858123522, 'sideways_atr_max_pct': 0.14270804687106287, 'sideways_tp_mult': 2.671698219272208, 'sideways_tsl_mult': 0.41797133240117446, 'sideways_time_stop': 172, 'sideways_use_sma': True, 'sideways_use_ema': False, 'sideways_use_atr': True, 'sideways_use_adx': False, 'sideways_use_spike': False, 'sideways_rsi_required': True}.
[I 2025-09-01 14:26:44,968] Trial 563 finished with values: [-0.1568010161598069, 0.15624126025813428] and parameters: {'p_sma': 35, 'p_std': 46, 'p_atr': 26, 'p_adx': 12, 'rsi_period': 65, 'ema1': 23, 'ema2': 16, 'slip_atr_k': 0.18716748034852493, 'slip_spread_k': 0.03884597529970423, 'spread_hl_frac': 0.005968247828923126, 'bb_std_mult': 1.8344426567491556, 'rsi_os': 39, 'rsi_ob': 83, 'vol_spike': 0.2330015639853507, 'adx_thresh': 25.299103232833794, 'atr_min_pct': 0.025773899364033244, 'atr_max_pct': 0.032387570429966615, 'tp_mult': 2.1189234592260453, 'tsl_mult': 0.6598070563178493, 'strategy': 'mean_reversion', 'time_stop': 213, 'use_sma': True, 'use_atr': False, 'use_adx': True, 'use_ema': True, 'use_spike': True, 'rsi_required': True, 'edge_k': 0.13778702925606578, 'edge_cap': 0.29058767107958317, 'bull_strategy': 'mean_reversion', 'bull_bb_std_mult': 3.4906324349561606, 'bull_rsi_os': 35, 'bull_rsi_ob': 89, 'bull_adx_thresh': 31.582901463904236, 'bull_atr_min_pct': 0.009667888916350828, 'bull_atr_max_pct': 0.02307743539027087, 'bull_tp_mult': 2.379346280504024, 'bull_tsl_mult': 0.3876248095333633, 'bull_time_stop': 230, 'bull_use_sma': False, 'bull_use_ema': True, 'bull_use_atr': False, 'bull_use_adx': True, 'bull_use_spike': True, 'bull_rsi_required': False, 'bear_strategy': 'breakout', 'bear_bb_std_mult': 3.5366415578698427, 'bear_rsi_os': 54, 'bear_rsi_ob': 50, 'bear_adx_thresh': 11.060907206887682, 'bear_atr_min_pct': 0.0008602196870213868, 'bear_atr_max_pct': 0.040649431769061425, 'bear_tp_mult': 1.7406950313889462, 'bear_tsl_mult': 0.17450661092312583, 'bear_time_stop': 226, 'bear_use_sma': False, 'bear_use_ema': True, 'bear_use_atr': False, 'bear_use_adx': True, 'bear_use_spike': False, 'bear_rsi_required': True, 'sideways_strategy': 'breakout', 'sideways_bb_std_mult': 3.078578564169502, 'sideways_rsi_os': 13, 'sideways_rsi_ob': 90, 'sideways_adx_thresh': 12.316439780921613, 'sideways_atr_min_pct': 0.024203722694054568, 'sideways_atr_max_pct': 0.05937198765859026, 'sideways_tp_mult': 1.5159314182469155, 'sideways_tsl_mult': 0.2360844627588365, 'sideways_time_stop': 253, 'sideways_use_sma': True, 'sideways_use_ema': False, 'sideways_use_atr': True, 'sideways_use_adx': True, 'sideways_use_spike': False, 'sideways_rsi_required': True}.
[I 2025-09-01 14:26:45,444] Trial 562 finished with values: [-0.17281975009584616, 0.17290752956203773] and parameters: {'p_sma': 37, 'p_std': 7, 'p_atr': 26, 'p_adx': 12, 'rsi_period': 17, 'ema1': 23, 'ema2': 17, 'slip_atr_k': 0.02389377141799902, 'slip_spread_k': 0.029828151746517373, 'spread_hl_frac': 0.021289356022895663, 'bb_std_mult': 2.3928177897635705, 'rsi_os': 24, 'rsi_ob': 53, 'vol_spike': 0.21680629542638108, 'adx_thresh': 31.90342243684092, 'atr_min_pct': 0.0262283920893935, 'atr_max_pct': 0.11055116709616022, 'tp_mult': 2.202408611369036, 'tsl_mult': 0.002219735032453929, 'strategy': 'mean_reversion', 'time_stop': 212, 'use_sma': True, 'use_atr': False, 'use_adx': False, 'use_ema': True, 'use_spike': True, 'rsi_required': True, 'edge_k': 0.88021040841, 'edge_cap': 0.7002964066707017, 'bull_strategy': 'mean_reversion', 'bull_bb_std_mult': 3.357581591933915, 'bull_rsi_os': 35, 'bull_rsi_ob': 87, 'bull_adx_thresh': 31.46699789002627, 'bull_atr_min_pct': 0.004339874135957322, 'bull_atr_max_pct': 0.023552924063805204, 'bull_tp_mult': 2.368596580979222, 'bull_tsl_mult': 0.780432967287174, 'bull_time_stop': 232, 'bull_use_sma': True, 'bull_use_ema': True, 'bull_use_atr': True, 'bull_use_adx': True, 'bull_use_spike': True, 'bull_rsi_required': True, 'bear_strategy': 'breakout', 'bear_bb_std_mult': 3.599640515200899, 'bear_rsi_os': 54, 'bear_rsi_ob': 50, 'bear_adx_thresh': 10.959982753514652, 'bear_atr_min_pct': 0.0008274227333299046, 'bear_atr_max_pct': 0.032673325780836926, 'bear_tp_mult': 2.261619015948587, 'bear_tsl_mult': 0.10516343570302841, 'bear_time_stop': 227, 'bear_use_sma': False, 'bear_use_ema': True, 'bear_use_atr': False, 'bear_use_adx': True, 'bear_use_spike': True, 'bear_rsi_required': True, 'sideways_strategy': 'breakout', 'sideways_bb_std_mult': 1.5856379305271209, 'sideways_rsi_os': 13, 'sideways_rsi_ob': 64, 'sideways_adx_thresh': 6.99651850712669, 'sideways_atr_min_pct': 0.021868550504125842, 'sideways_atr_max_pct': 0.05942648068749904, 'sideways_tp_mult': 2.675663114665026, 'sideways_tsl_mult': 0.24167179373621067, 'sideways_time_stop': 253, 'sideways_use_sma': True, 'sideways_use_ema': False, 'sideways_use_atr': False, 'sideways_use_adx': True, 'sideways_use_spike': True, 'sideways_rsi_required': True}.
[I 2025-09-01 14:26:46,562] Trial 568 finished with values: [-1000000000.0, 1000000000.0] and parameters: {'p_sma': 40, 'p_std': 50, 'p_atr': 24, 'p_adx': 12, 'rsi_period': 14, 'ema1': 20, 'ema2': 56, 'slip_atr_k': 0.15834425991636117, 'slip_spread_k': 0.15896403850926172, 'spread_hl_frac': 0.004286100501796966, 'bb_std_mult': 1.9329321950245628, 'rsi_os': 38, 'rsi_ob': 85, 'vol_spike': 0.2453244135019591, 'adx_thresh': 24.579290664138902, 'atr_min_pct': 0.027225764587448773, 'atr_max_pct': 0.014181834505491014, 'tp_mult': 2.328198034190854, 'tsl_mult': 0.7492458122703874, 'strategy': 'mean_reversion', 'time_stop': 237, 'use_sma': True, 'use_atr': False, 'use_adx': False, 'use_ema': True, 'use_spike': True, 'rsi_required': False, 'edge_k': 0.9680596269540543, 'edge_cap': 0.062091707387725736, 'bull_strategy': 'breakout', 'bull_bb_std_mult': 3.182249605486246, 'bull_rsi_os': 27, 'bull_rsi_ob': 58, 'bull_adx_thresh': 28.770712482107854, 'bull_atr_min_pct': 0.01486159844469363, 'bull_atr_max_pct': 0.02882885092538911, 'bull_tp_mult': 2.800717439190684, 'bull_tsl_mult': 0.7957021761395834, 'bull_time_stop': 87, 'bull_use_sma': True, 'bull_use_ema': False, 'bull_use_atr': True, 'bull_use_adx': True, 'bull_use_spike': False, 'bull_rsi_required': True, 'bear_strategy': 'mean_reversion', 'bear_bb_std_mult': 1.1862540645594843, 'bear_rsi_os': 49, 'bear_rsi_ob': 88, 'bear_adx_thresh': 17.89034522288545, 'bear_atr_min_pct': 0.0017559094194253514, 'bear_atr_max_pct': 0.017799758948744845, 'bear_tp_mult': 2.2753691639347338, 'bear_tsl_mult': 0.6039167030474554, 'bear_time_stop': 206, 'bear_use_sma': True, 'bear_use_ema': True, 'bear_use_atr': True, 'bear_use_adx': True, 'bear_use_spike': False, 'bear_rsi_required': True, 'sideways_strategy': 'breakout', 'sideways_bb_std_mult': 1.2606979132754872, 'sideways_rsi_os': 51, 'sideways_rsi_ob': 68, 'sideways_adx_thresh': 6.865178785332906, 'sideways_atr_min_pct': 0.017830304269306593, 'sideways_atr_max_pct': 0.06340356542699753, 'sideways_tp_mult': 2.7495373291301752, 'sideways_tsl_mult': 0.6891686962607051, 'sideways_time_stop': 110, 'sideways_use_sma': True, 'sideways_use_ema': False, 'sideways_use_atr': True, 'sideways_use_adx': True, 'sideways_use_spike': False, 'sideways_rsi_required': True}.
