[I 2025-09-01 14:23:23,464] Trial 541 finished with values: [-1000000000.0, 1000000000.0] and parameters: {'p_sma': 20, 'p_std': 28, 'p_atr': 13, 'p_adx': 12, 'rsi_period': 66, 'ema1': 21, 'ema2': 35, 'slip_atr_k': 0.026965443232175, 'slip_spread_k': 0.6088700326525277, 'spread_hl_frac': 0.007024738462241114, 'bb_std_mult': 1.6436075510475106, 'rsi_os': 39, 'rsi_ob': 84, 'vol_spike': 0.16027341381262047, 'adx_thresh': 30.188578632668726, 'atr_min_pct': 0.027693258978313484, 'atr_max_pct': 0.13637730142333596, 'tp_mult': 1.1270743078813314, 'tsl_mult': 0.7148141496638258, 'strategy': 'mean_reversion', 'time_stop': 39, 'use_sma': True, 'use_atr': False, 'use_adx': True, 'use_ema': True, 'use_spike': False, 'rsi_required': True, 'edge_k': 1.5801070575974177, 'edge_cap': 0.21148994122030346, 'bull_strategy': 'mean_reversion', 'bull_bb_std_mult': 3.409293577151388, 'bull_rsi_os': 34, 'bull_rsi_ob': 70, 'bull_adx_thresh': 24.99453216156447, 'bull_atr_min_pct': 0.013819679639634548, 'bull_atr_max_pct': 0.13113302783356198, 'bull_tp_mult': 2.841735621526611, 'bull_tsl_mult': 0.4386536616458221, 'bull_time_stop': 123, 'bull_use_sma': True, 'bull_use_ema': False, 'bull_use_atr': False, 'bull_use_adx': True, 'bull_use_spike': False, 'bull_rsi_required': True, 'bear_strategy': 'breakout', 'bear_bb_std_mult': 2.2461408486602266, 'bear_rsi_os': 20, 'bear_rsi_ob': 88, 'bear_adx_thresh': 13.881582463679836, 'bear_atr_min_pct': 0.02031728074618285, 'bear_atr_max_pct': 0.03860596613056054, 'bear_tp_mult': 2.3914258466037177, 'bear_tsl_mult': 0.8527770322146531, 'bear_time_stop': 234, 'bear_use_sma': False, 'bear_use_ema': False, 'bear_use_atr': False, 'bear_use_adx': False, 'bear_use_spike': False, 'bear_rsi_required': False, 'sideways_strategy': 'breakout', 'sideways_bb_std_mult': 3.2516640280284737, 'sideways_rsi_os': 19, 'sideways_rsi_ob': 65, 'sideways_adx_thresh': 7.848108849603513, 'sideways_atr_min_pct': 0.003941519147861077, 'sideways_atr_max_pct': 0.0750492309760404, 'sideways_tp_mult': 2.7410270540923625, 'sideways_tsl_mult': 0.9994544472971606, 'sideways_time_stop': 186, 'sideways_use_sma': False, 'sideways_use_ema': False, 'sideways_use_atr': True, 'sideways_use_adx': True, 'sideways_use_spike': False, 'sideways_rsi_required': True}.
[I 2025-09-01 14:23:24,569] Trial 538 finished with values: [-1000000000.0, 1000000000.0] and parameters: {'p_sma': 12, 'p_std': 51, 'p_atr': 7, 'p_adx': 13, 'rsi_period': 66, 'ema1': 21, 'ema2': 51, 'slip_atr_k': 0.14967054175406444, 'slip_spread_k': 0.5988198953387837, 'spread_hl_frac': 0.007201277913352738, 'bb_std_mult': 1.6342112736969192, 'rsi_os': 12, 'rsi_ob': 84, 'vol_spike': 0.005937259003171963, 'adx_thresh': 15.762441775002838, 'atr_min_pct': 0.027749162855085656, 'atr_max_pct': 0.13856145549959098, 'tp_mult': 1.9185073524386314, 'tsl_mult': 0.714061911107805, 'strategy': 'mean_reversion', 'time_stop': 173, 'use_sma': True, 'use_atr': False, 'use_adx': False, 'use_ema': True, 'use_spike': True, 'rsi_required': False, 'edge_k': 0.8404314787334771, 'edge_cap': 0.28270637432215295, 'bull_strategy': 'breakout', 'bull_bb_std_mult': 3.4236730240514066, 'bull_rsi_os': 32, 'bull_rsi_ob': 71, 'bull_adx_thresh': 32.24845404299745, 'bull_atr_min_pct': 0.004344985006774758, 'bull_atr_max_pct': 0.027715229399448812, 'bull_tp_mult': 2.793789736527708, 'bull_tsl_mult': 0.4853619034015766, 'bull_time_stop': 212, 'bull_use_sma': True, 'bull_use_ema': True, 'bull_use_atr': True, 'bull_use_adx': True, 'bull_use_spike': False, 'bull_rsi_required': True, 'bear_strategy': 'breakout', 'bear_bb_std_mult': 1.4609921875774177, 'bear_rsi_os': 32, 'bear_rsi_ob': 78, 'bear_adx_thresh': 12.42184499868212, 'bear_atr_min_pct': 0.0036125244665454327, 'bear_atr_max_pct': 0.03879798474659679, 'bear_tp_mult': 2.7807079042526044, 'bear_tsl_mult': 0.10455271442050044, 'bear_time_stop': 226, 'bear_use_sma': True, 'bear_use_ema': True, 'bear_use_atr': True, 'bear_use_adx': True, 'bear_use_spike': False, 'bear_rsi_required': True, 'sideways_strategy': 'breakout', 'sideways_bb_std_mult': 3.2146229203579484, 'sideways_rsi_os': 9, 'sideways_rsi_ob': 78, 'sideways_adx_thresh': 16.005239534836853, 'sideways_atr_min_pct': 0.0028892721333558385, 'sideways_atr_max_pct': 0.08781789231825461, 'sideways_tp_mult': 2.6958007729939024, 'sideways_tsl_mult': 0.5656398891726029, 'sideways_time_stop': 46, 'sideways_use_sma': True, 'sideways_use_ema': False, 'sideways_use_atr': True, 'sideways_use_adx': True, 'sideways_use_spike': False, 'sideways_rsi_required': True}.
[I 2025-09-01 14:23:24,573] Trial 542 finished with values: [-0.057387935089254105, 0.056763392559831906] and parameters: {'p_sma': 35, 'p_std': 27, 'p_atr': 13, 'p_adx': 12, 'rsi_period': 44, 'ema1': 21, 'ema2': 18, 'slip_atr_k': 0.05651881843046949, 'slip_spread_k': 0.14456722863141694, 'spread_hl_frac': 0.0015504680460606858, 'bb_std_mult': 1.7432935166302426, 'rsi_os': 41, 'rsi_ob': 76, 'vol_spike': 0.06469751110308487, 'adx_thresh': 13.177321778601092, 'atr_min_pct': 0.02614267586995422, 'atr_max_pct': 0.05807566191059818, 'tp_mult': 1.117411746793366, 'tsl_mult': 0.7136883636959708, 'strategy': 'breakout', 'time_stop': 255, 'use_sma': True, 'use_atr': False, 'use_adx': False, 'use_ema': True, 'use_spike': False, 'rsi_required': False, 'edge_k': 0.8567418301876042, 'edge_cap': 0.2320997314916799, 'bull_strategy': 'breakout', 'bull_bb_std_mult': 3.422505842616732, 'bull_rsi_os': 34, 'bull_rsi_ob': 55, 'bull_adx_thresh': 25.123314640958377, 'bull_atr_min_pct': 0.0024566231113334717, 'bull_atr_max_pct': 0.1075499500104647, 'bull_tp_mult': 2.8783939036826505, 'bull_tsl_mult': 0.4484026566088795, 'bull_time_stop': 122, 'bull_use_sma': True, 'bull_use_ema': True, 'bull_use_atr': True, 'bull_use_adx': True, 'bull_use_spike': False, 'bull_rsi_required': True, 'bear_strategy': 'breakout', 'bear_bb_std_mult': 1.3556572233809319, 'bear_rsi_os': 32, 'bear_rsi_ob': 65, 'bear_adx_thresh': 14.257106014600089, 'bear_atr_min_pct': 0.002279707491559562, 'bear_atr_max_pct': 0.0460945217036663, 'bear_tp_mult': 2.3926159866663745, 'bear_tsl_mult': 0.1346530879507156, 'bear_time_stop': 166, 'bear_use_sma': True, 'bear_use_ema': True, 'bear_use_atr': True, 'bear_use_adx': True, 'bear_use_spike': False, 'bear_rsi_required': False, 'sideways_strategy': 'breakout', 'sideways_bb_std_mult': 2.936981924099146, 'sideways_rsi_os': 43, 'sideways_rsi_ob': 67, 'sideways_adx_thresh': 28.28236019910444, 'sideways_atr_min_pct': 0.02296566237126034, 'sideways_atr_max_pct': 0.0689935505035672, 'sideways_tp_mult': 2.6997007616664535, 'sideways_tsl_mult': 0.9836410104494892, 'sideways_time_stop': 280, 'sideways_use_sma': False, 'sideways_use_ema': False, 'sideways_use_atr': True, 'sideways_use_adx': False, 'sideways_use_spike': False, 'sideways_rsi_required': True}.
[I 2025-09-01 14:24:03,985] Trial 544 finished with values: [-0.042995399235358445, 0.0427785648216505] and parameters: {'p_sma': 50, 'p_std': 51, 'p_atr': 25, 'p_adx': 7, 'rsi_period': 69, 'ema1': 22, 'ema2': 18, 'slip_atr_k': 0.05569839249519444, 'slip_spread_k': 0.6740491746663027, 'spread_hl_frac': 0.025832784845917358, 'bb_std_mult': 1.7685516475798928, 'rsi_os': 12, 'rsi_ob': 77, 'vol_spike': 0.059223280132338116, 'adx_thresh': 21.909041612679633, 'atr_min_pct': 0.008393117890910991, 'atr_max_pct': 0.06432331767516786, 'tp_mult': 1.0111078659383819, 'tsl_mult': 0.753636429395266, 'strategy': 'breakout', 'time_stop': 254, 'use_sma': False, 'use_atr': True, 'use_adx': False, 'use_ema': True, 'use_spike': True, 'rsi_required': False, 'edge_k': 0.04939463075286343, 'edge_cap': 0.3676736794438347, 'bull_strategy': 'breakout', 'bull_bb_std_mult': 3.2477705758751148, 'bull_rsi_os': 36, 'bull_rsi_ob': 64, 'bull_adx_thresh': 32.08414186728513, 'bull_atr_min_pct': 5.568444970901858e-05, 'bull_atr_max_pct': 0.01378733055867729, 'bull_tp_mult': 2.1589225157761445, 'bull_tsl_mult': 0.16314082617267328, 'bull_time_stop': 211, 'bull_use_sma': True, 'bull_use_ema': True, 'bull_use_atr': True, 'bull_use_adx': False, 'bull_use_spike': True, 'bull_rsi_required': True, 'bear_strategy': 'breakout', 'bear_bb_std_mult': 0.715151864493061, 'bear_rsi_os': 33, 'bear_rsi_ob': 87, 'bear_adx_thresh': 10.960430241277965, 'bear_atr_min_pct': 0.002377993048262281, 'bear_atr_max_pct': 0.04686990148686002, 'bear_tp_mult': 2.060107227644284, 'bear_tsl_mult': 0.12888672100558546, 'bear_time_stop': 166, 'bear_use_sma': True, 'bear_use_ema': True, 'bear_use_atr': True, 'bear_use_adx': True, 'bear_use_spike': True, 'bear_rsi_required': True, 'sideways_strategy': 'mean_reversion', 'sideways_bb_std_mult': 2.7030312632535765, 'sideways_rsi_os': 50, 'sideways_rsi_ob': 67, 'sideways_adx_thresh': 6.367984064987185, 'sideways_atr_min_pct': 0.02096513405595294, 'sideways_atr_max_pct': 0.06547774416590371, 'sideways_tp_mult': 2.702257382033918, 'sideways_tsl_mult': 0.2581457726895601, 'sideways_time_stop': 167, 'sideways_use_sma': True, 'sideways_use_ema': False, 'sideways_use_atr': False, 'sideways_use_adx': False, 'sideways_use_spike': False, 'sideways_rsi_required': True}.
[I 2025-09-01 14:24:04,653] Trial 543 finished with values: [-1000000000.0, 1000000000.0] and parameters: {'p_sma': 39, 'p_std': 49, 'p_atr': 9, 'p_adx': 25, 'rsi_period': 43, 'ema1': 22, 'ema2': 35, 'slip_atr_k': 0.08560027924327625, 'slip_spread_k': 0.8856005878750535, 'spread_hl_frac': 0.01632763478781222, 'bb_std_mult': 1.7386190815267977, 'rsi_os': 45, 'rsi_ob': 82, 'vol_spike': 0.06597028014282984, 'adx_thresh': 25.522408347129556, 'atr_min_pct': 0.015038459895384384, 'atr_max_pct': 0.13938543730915925, 'tp_mult': 1.011289961054235, 'tsl_mult': 0.7193927158647141, 'strategy': 'breakout', 'time_stop': 201, 'use_sma': True, 'use_atr': False, 'use_adx': False, 'use_ema': True, 'use_spike': False, 'rsi_required': False, 'edge_k': 0.07058941966297161, 'edge_cap': 0.3089007630427726, 'bull_strategy': 'breakout', 'bull_bb_std_mult': 3.2746372591920405, 'bull_rsi_os': 34, 'bull_rsi_ob': 71, 'bull_adx_thresh': 28.513802784093393, 'bull_atr_min_pct': 0.026190356989965857, 'bull_atr_max_pct': 0.014243862184208209, 'bull_tp_mult': 2.879753731169503, 'bull_tsl_mult': 0.44267585633905804, 'bull_time_stop': 83, 'bull_use_sma': True, 'bull_use_ema': True, 'bull_use_atr': True, 'bull_use_adx': True, 'bull_use_spike': True, 'bull_rsi_required': True, 'bear_strategy': 'breakout', 'bear_bb_std_mult': 2.6453261203229057, 'bear_rsi_os': 47, 'bear_rsi_ob': 87, 'bear_adx_thresh': 13.962878253526029, 'bear_atr_min_pct': 0.01679977190591182, 'bear_atr_max_pct': 0.045524065984129586, 'bear_tp_mult': 2.303742302197012, 'bear_tsl_mult': 0.13097086257282323, 'bear_time_stop': 234, 'bear_use_sma': True, 'bear_use_ema': True, 'bear_use_atr': False, 'bear_use_adx': False, 'bear_use_spike': False, 'bear_rsi_required': False, 'sideways_strategy': 'breakout', 'sideways_bb_std_mult': 1.5176460645474985, 'sideways_rsi_os': 50, 'sideways_rsi_ob': 67, 'sideways_adx_thresh': 7.829902076031877, 'sideways_atr_min_pct': 0.02328758290852135, 'sideways_atr_max_pct': 0.06865955512001805, 'sideways_tp_mult': 2.704069644202672, 'sideways_tsl_mult': 0.5643992172903358, 'sideways_time_stop': 167, 'sideways_use_sma': False, 'sideways_use_ema': False, 'sideways_use_atr': True, 'sideways_use_adx': False, 'sideways_use_spike': False, 'sideways_rsi_required': True}.
[I 2025-09-01 14:24:04,868] Trial 546 finished with values: [-1000000000.0, 1000000000.0] and parameters: {'p_sma': 39, 'p_std': 56, 'p_atr': 11, 'p_adx': 7, 'rsi_period': 62, 'ema1': 22, 'ema2': 30, 'slip_atr_k': 0.2498784133674464, 'slip_spread_k': 0.7349618661824692, 'spread_hl_frac': 0.0038661428970083456, 'bb_std_mult': 1.7384301464010223, 'rsi_os': 34, 'rsi_ob': 82, 'vol_spike': 0.24809362420123876, 'adx_thresh': 23.554878182771514, 'atr_min_pct': 0.008309495765943729, 'atr_max_pct': 0.14187104145949073, 'tp_mult': 1.0137790671925706, 'tsl_mult': 0.9832443277611211, 'strategy': 'breakout', 'time_stop': 246, 'use_sma': False, 'use_atr': True, 'use_adx': False, 'use_ema': False, 'use_spike': True, 'rsi_required': False, 'edge_k': 0.9408267266718081, 'edge_cap': 0.30444252527635174, 'bull_strategy': 'breakout', 'bull_bb_std_mult': 1.434302903218329, 'bull_rsi_os': 36, 'bull_rsi_ob': 54, 'bull_adx_thresh': 14.120200201267739, 'bull_atr_min_pct': 0.025729570354988855, 'bull_atr_max_pct': 0.013809965565444263, 'bull_tp_mult': 1.4997163301402736, 'bull_tsl_mult': 0.36320978407333765, 'bull_time_stop': 76, 'bull_use_sma': True, 'bull_use_ema': True, 'bull_use_atr': True, 'bull_use_adx': False, 'bull_use_spike': True, 'bull_rsi_required': True, 'bear_strategy': 'mean_reversion', 'bear_bb_std_mult': 3.229969326287282, 'bear_rsi_os': 33, 'bear_rsi_ob': 87, 'bear_adx_thresh': 16.256197222778724, 'bear_atr_min_pct': 0.0024613401243787254, 'bear_atr_max_pct': 0.05299911167243726, 'bear_tp_mult': 1.5651665499449248, 'bear_tsl_mult': 0.18726257106402633, 'bear_time_stop': 147, 'bear_use_sma': True, 'bear_use_ema': True, 'bear_use_atr': True, 'bear_use_adx': True, 'bear_use_spike': True, 'bear_rsi_required': True, 'sideways_strategy': 'mean_reversion', 'sideways_bb_std_mult': 1.9584569939952456, 'sideways_rsi_os': 52, 'sideways_rsi_ob': 75, 'sideways_adx_thresh': 20.65805160003395, 'sideways_atr_min_pct': 0.014235763366942817, 'sideways_atr_max_pct': 0.06499745539041396, 'sideways_tp_mult': 2.962036052431574, 'sideways_tsl_mult': 0.26171711366095723, 'sideways_time_stop': 166, 'sideways_use_sma': True, 'sideways_use_ema': False, 'sideways_use_atr': False, 'sideways_use_adx': False, 'sideways_use_spike': True, 'sideways_rsi_required': False}.
[I 2025-09-01 14:24:05,134] Trial 545 finished with values: [-0.03808942032282503, 0.03784374938296124] and parameters: {'p_sma': 42, 'p_std': 49, 'p_atr': 15, 'p_adx': 7, 'rsi_period': 76, 'ema1': 22, 'ema2': 20, 'slip_atr_k': 0.16591698687405093, 'slip_spread_k': 0.09711012629949571, 'spread_hl_frac': 0.0035843436903731803, 'bb_std_mult': 1.1319791869740086, 'rsi_os': 40, 'rsi_ob': 82, 'vol_spike': 0.08780609167081746, 'adx_thresh': 25.511816148380234, 'atr_min_pct': 0.026020975986550763, 'atr_max_pct': 0.07556161841731757, 'tp_mult': 1.0120769680863366, 'tsl_mult': 0.7545376458418016, 'strategy': 'breakout', 'time_stop': 260, 'use_sma': False, 'use_atr': True, 'use_adx': False, 'use_ema': False, 'use_spike': True, 'rsi_required': False, 'edge_k': 0.05280414821586943, 'edge_cap': 0.7510309759867998, 'bull_strategy': 'breakout', 'bull_bb_std_mult': 3.258921381133299, 'bull_rsi_os': 10, 'bull_rsi_ob': 92, 'bull_adx_thresh': 28.253195072086083, 'bull_atr_min_pct': 8.87279678211221e-05, 'bull_atr_max_pct': 0.05420959044337465, 'bull_tp_mult': 2.760224311315833, 'bull_tsl_mult': 0.36738848455097817, 'bull_time_stop': 80, 'bull_use_sma': True, 'bull_use_ema': True, 'bull_use_atr': True, 'bull_use_adx': False, 'bull_use_spike': True, 'bull_rsi_required': True, 'bear_strategy': 'mean_reversion', 'bear_bb_std_mult': 3.514745260721588, 'bear_rsi_os': 35, 'bear_rsi_ob': 87, 'bear_adx_thresh': 11.617707750933407, 'bear_atr_min_pct': 0.002495816677761799, 'bear_atr_max_pct': 0.10435208657926387, 'bear_tp_mult': 2.3066102734325646, 'bear_tsl_mult': 0.19281748018119102, 'bear_time_stop': 25, 'bear_use_sma': True, 'bear_use_ema': True, 'bear_use_atr': True, 'bear_use_adx': True, 'bear_use_spike': True, 'bear_rsi_required': True, 'sideways_strategy': 'mean_reversion', 'sideways_bb_std_mult': 2.7110451101915722, 'sideways_rsi_os': 50, 'sideways_rsi_ob': 75, 'sideways_adx_thresh': 6.343671563913851, 'sideways_atr_min_pct': 0.0011950147249091252, 'sideways_atr_max_pct': 0.06421802263222978, 'sideways_tp_mult': 2.6228849449534164, 'sideways_tsl_mult': 0.2702099438974146, 'sideways_time_stop': 234, 'sideways_use_sma': True, 'sideways_use_ema': False, 'sideways_use_atr': False, 'sideways_use_adx': False, 'sideways_use_spike': True, 'sideways_rsi_required': False}.
[I 2025-09-01 14:24:06,078] Trial 548 finished with values: [-1000000000.0, 1000000000.0] and parameters: {'p_sma': 36, 'p_std': 47, 'p_atr': 24, 'p_adx': 12, 'rsi_period': 76, 'ema1': 5, 'ema2': 17, 'slip_atr_k': 0.00012688228842352642, 'slip_spread_k': 0.09498487581538248, 'spread_hl_frac': 0.008462316243066658, 'bb_std_mult': 1.8697896404098098, 'rsi_os': 40, 'rsi_ob': 45, 'vol_spike': 0.12126548603902192, 'adx_thresh': 24.65406425839237, 'atr_min_pct': 0.02504975870381254, 'atr_max_pct': 0.02574992542818505, 'tp_mult': 1.770582919447301, 'tsl_mult': 0.8973693575511336, 'strategy': 'mean_reversion', 'time_stop': 125, 'use_sma': True, 'use_atr': False, 'use_adx': True, 'use_ema': False, 'use_spike': True, 'rsi_required': False, 'edge_k': 1.238820141232892, 'edge_cap': 0.322375545857702, 'bull_strategy': 'breakout', 'bull_bb_std_mult': 3.1472109785634723, 'bull_rsi_os': 35, 'bull_rsi_ob': 56, 'bull_adx_thresh': 22.242947706154624, 'bull_atr_min_pct': 0.004273202262226319, 'bull_atr_max_pct': 0.039990451426167, 'bull_tp_mult': 2.74395722238517, 'bull_tsl_mult': 0.40736097953252226, 'bull_time_stop': 135, 'bull_use_sma': False, 'bull_use_ema': True, 'bull_use_atr': False, 'bull_use_adx': True, 'bull_use_spike': False, 'bull_rsi_required': False, 'bear_strategy': 'mean_reversion', 'bear_bb_std_mult': 2.8080088330616992, 'bear_rsi_os': 37, 'bear_rsi_ob': 85, 'bear_adx_thresh': 11.694654499193385, 'bear_atr_min_pct': 0.01545471254027189, 'bear_atr_max_pct': 0.050942301706520886, 'bear_tp_mult': 1.1817972003177895, 'bear_tsl_mult': 0.23004700692137053, 'bear_time_stop': 212, 'bear_use_sma': True, 'bear_use_ema': True, 'bear_use_atr': True, 'bear_use_adx': True, 'bear_use_spike': False, 'bear_rsi_required': True, 'sideways_strategy': 'breakout', 'sideways_bb_std_mult': 2.179994869577826, 'sideways_rsi_os': 52, 'sideways_rsi_ob': 84, 'sideways_adx_thresh': 6.439828315056813, 'sideways_atr_min_pct': 0.018982865501048482, 'sideways_atr_max_pct': 0.10906562364021999, 'sideways_tp_mult': 2.62900344867532, 'sideways_tsl_mult': 0.3590679088895822, 'sideways_time_stop': 90, 'sideways_use_sma': True, 'sideways_use_ema': True, 'sideways_use_atr': True, 'sideways_use_adx': True, 'sideways_use_spike': False, 'sideways_rsi_required': True}.
[I 2025-09-01 14:24:06,100] Trial 550 finished with values: [-1000000000.0, 1000000000.0] and parameters: {'p_sma': 25, 'p_std': 47, 'p_atr': 24, 'p_adx': 14, 'rsi_period': 56, 'ema1': 20, 'ema2': 37, 'slip_atr_k': 0.018895884766666426, 'slip_spread_k': 0.051828926310330245, 'spread_hl_frac': 0.010396261826197708, 'bb_std_mult': 2.813209521186673, 'rsi_os': 38, 'rsi_ob': 45, 'vol_spike': 0.13979301492801774, 'adx_thresh': 24.53800245822047, 'atr_min_pct': 0.02508634240929245, 'atr_max_pct': 0.1335955490808949, 'tp_mult': 1.069255876929002, 'tsl_mult': 0.475535282881737, 'strategy': 'mean_reversion', 'time_stop': 79, 'use_sma': True, 'use_atr': False, 'use_adx': True, 'use_ema': True, 'use_spike': True, 'rsi_required': True, 'edge_k': 0.893723346831435, 'edge_cap': 0.14490611517325563, 'bull_strategy': 'mean_reversion', 'bull_bb_std_mult': 2.084527768440243, 'bull_rsi_os': 30, 'bull_rsi_ob': 76, 'bull_adx_thresh': 30.103565185168925, 'bull_atr_min_pct': 0.005246956887757981, 'bull_atr_max_pct': 0.026128549902036995, 'bull_tp_mult': 2.9513898217573247, 'bull_tsl_mult': 0.4033384025939736, 'bull_time_stop': 91, 'bull_use_sma': False, 'bull_use_ema': True, 'bull_use_atr': False, 'bull_use_adx': True, 'bull_use_spike': False, 'bull_rsi_required': False, 'bear_strategy': 'breakout', 'bear_bb_std_mult': 3.54511123595839, 'bear_rsi_os': 27, 'bear_rsi_ob': 89, 'bear_adx_thresh': 26.297584474971316, 'bear_atr_min_pct': 0.003999708453348069, 'bear_atr_max_pct': 0.1316467602907521, 'bear_tp_mult': 2.351272832189722, 'bear_tsl_mult': 0.22803741354930035, 'bear_time_stop': 242, 'bear_use_sma': False, 'bear_use_ema': True, 'bear_use_atr': True, 'bear_use_adx': True, 'bear_use_spike': False, 'bear_rsi_required': True, 'sideways_strategy': 'breakout', 'sideways_bb_std_mult': 1.7374982276931654, 'sideways_rsi_os': 23, 'sideways_rsi_ob': 51, 'sideways_adx_thresh': 24.07814282824575, 'sideways_atr_min_pct': 0.018864230315291265, 'sideways_atr_max_pct': 0.05725158141610107, 'sideways_tp_mult': 2.076130207473583, 'sideways_tsl_mult': 0.292066713240527, 'sideways_time_stop': 92, 'sideways_use_sma': True, 'sideways_use_ema': True, 'sideways_use_atr': True, 'sideways_use_adx': True, 'sideways_use_spike': False, 'sideways_rsi_required': True}.
