[I 2025-09-01 14:10:05,275] Trial 450 finished with values: [-1000000000.0, 1000000000.0] and parameters: {'p_sma': 39, 'p_std': 49, 'p_atr': 26, 'p_adx': 11, 'rsi_period': 70, 'ema1': 21, 'ema2': 46, 'slip_atr_k': 0.017937029353436315, 'slip_spread_k': 0.0972306728068841, 'spread_hl_frac': 0.03724876443859425, 'bb_std_mult': 1.6397354444165506, 'rsi_os': 9, 'rsi_ob': 84, 'vol_spike': 0.23959091705590393, 'adx_thresh': 22.322136915319483, 'atr_min_pct': 0.02418217169277198, 'atr_max_pct': 0.12471555477726366, 'tp_mult': 1.8959287625481918, 'tsl_mult': 0.23331591322441048, 'strategy': 'mean_reversion', 'time_stop': 145, 'use_sma': False, 'use_atr': False, 'use_adx': False, 'use_ema': True, 'use_spike': True, 'rsi_required': True, 'edge_k': 0.9410933061228149, 'edge_cap': 0.0789307897175131, 'bull_strategy': 'breakout', 'bull_bb_std_mult': 2.48055518580831, 'bull_rsi_os': 7, 'bull_rsi_ob': 55, 'bull_adx_thresh': 29.466527389189327, 'bull_atr_min_pct': 0.01650975307144245, 'bull_atr_max_pct': 0.027952609891511323, 'bull_tp_mult': 1.3123562482513167, 'bull_tsl_mult': 0.6916621279774182, 'bull_time_stop': 76, 'bull_use_sma': True, 'bull_use_ema': True, 'bull_use_atr': False, 'bull_use_adx': True, 'bull_use_spike': True, 'bull_rsi_required': True, 'bear_strategy': 'breakout', 'bear_bb_std_mult': 3.3875986869960872, 'bear_rsi_os': 33, 'bear_rsi_ob': 60, 'bear_adx_thresh': 11.107542693664216, 'bear_atr_min_pct': 0.0026055594214977776, 'bear_atr_max_pct': 0.05246936655367573, 'bear_tp_mult': 2.243233429232506, 'bear_tsl_mult': 0.1706365429253748, 'bear_time_stop': 175, 'bear_use_sma': True, 'bear_use_ema': True, 'bear_use_atr': True, 'bear_use_adx': True, 'bear_use_spike': False, 'bear_rsi_required': True, 'sideways_strategy': 'mean_reversion', 'sideways_bb_std_mult': 1.8571431400431677, 'sideways_rsi_os': 52, 'sideways_rsi_ob': 67, 'sideways_adx_thresh': 10.829941788178775, 'sideways_atr_min_pct': 0.021020568601730145, 'sideways_atr_max_pct': 0.07170891140668526, 'sideways_tp_mult': 1.3833440997216746, 'sideways_tsl_mult': 0.21250271640878393, 'sideways_time_stop': 181, 'sideways_use_sma': True, 'sideways_use_ema': False, 'sideways_use_atr': True, 'sideways_use_adx': True, 'sideways_use_spike': False, 'sideways_rsi_required': False}.
[I 2025-09-01 14:10:06,981] Trial 451 finished with values: [-1000000000.0, 1000000000.0] and parameters: {'p_sma': 10, 'p_std': 49, 'p_atr': 24, 'p_adx': 13, 'rsi_period': 63, 'ema1': 24, 'ema2': 20, 'slip_atr_k': 0.15829300251146444, 'slip_spread_k': 0.04375621641738762, 'spread_hl_frac': 0.04301458605853025, 'bb_std_mult': 1.678909899808378, 'rsi_os': 41, 'rsi_ob': 84, 'vol_spike': 0.04428751113698472, 'adx_thresh': 28.510349729191198, 'atr_min_pct': 0.004785225279134669, 'atr_max_pct': 0.12933479043005935, 'tp_mult': 1.0580042445607052, 'tsl_mult': 0.8275801891085225, 'strategy': 'mean_reversion', 'time_stop': 235, 'use_sma': False, 'use_atr': False, 'use_adx': False, 'use_ema': False, 'use_spike': True, 'rsi_required': False, 'edge_k': 1.332881757427185, 'edge_cap': 0.9962993702947291, 'bull_strategy': 'mean_reversion', 'bull_bb_std_mult': 2.9554128125258683, 'bull_rsi_os': 11, 'bull_rsi_ob': 93, 'bull_adx_thresh': 18.161296673684195, 'bull_atr_min_pct': 0.011227487371310997, 'bull_atr_max_pct': 0.12359622878961524, 'bull_tp_mult': 1.3152033227450748, 'bull_tsl_mult': 0.8750777683427872, 'bull_time_stop': 87, 'bull_use_sma': True, 'bull_use_ema': False, 'bull_use_atr': True, 'bull_use_adx': True, 'bull_use_spike': True, 'bull_rsi_required': True, 'bear_strategy': 'breakout', 'bear_bb_std_mult': 3.5392248223411653, 'bear_rsi_os': 31, 'bear_rsi_ob': 93, 'bear_adx_thresh': 11.052856247623247, 'bear_atr_min_pct': 0.002630287729139912, 'bear_atr_max_pct': 0.028015858861647897, 'bear_tp_mult': 2.8454464385009253, 'bear_tsl_mult': 0.14150298788439364, 'bear_time_stop': 292, 'bear_use_sma': False, 'bear_use_ema': True, 'bear_use_atr': True, 'bear_use_adx': True, 'bear_use_spike': False, 'bear_rsi_required': True, 'sideways_strategy': 'mean_reversion', 'sideways_bb_std_mult': 1.1332605779553893, 'sideways_rsi_os': 52, 'sideways_rsi_ob': 80, 'sideways_adx_thresh': 28.828076042051613, 'sideways_atr_min_pct': 0.002656019136210561, 'sideways_atr_max_pct': 0.06674222525284783, 'sideways_tp_mult': 2.6331800951049464, 'sideways_tsl_mult': 0.24091526037470917, 'sideways_time_stop': 142, 'sideways_use_sma': True, 'sideways_use_ema': False, 'sideways_use_atr': True, 'sideways_use_adx': True, 'sideways_use_spike': False, 'sideways_rsi_required': False}.
[I 2025-09-01 14:10:08,181] Trial 454 finished with values: [-1000000000.0, 1000000000.0] and parameters: {'p_sma': 36, 'p_std': 49, 'p_atr': 23, 'p_adx': 13, 'rsi_period': 63, 'ema1': 21, 'ema2': 41, 'slip_atr_k': 0.00018720188617560828, 'slip_spread_k': 0.049696242554033064, 'spread_hl_frac': 0.005148187526285801, 'bb_std_mult': 1.791090611835686, 'rsi_os': 20, 'rsi_ob': 72, 'vol_spike': 0.24502126094227253, 'adx_thresh': 25.58766984698134, 'atr_min_pct': 0.027495231872173474, 'atr_max_pct': 0.026486810696469708, 'tp_mult': 1.0687616463767307, 'tsl_mult': 0.8278367954000989, 'strategy': 'mean_reversion', 'time_stop': 27, 'use_sma': True, 'use_atr': False, 'use_adx': False, 'use_ema': False, 'use_spike': True, 'rsi_required': False, 'edge_k': 1.5852811686538306, 'edge_cap': 0.30251861078067144, 'bull_strategy': 'mean_reversion', 'bull_bb_std_mult': 3.5943401193064437, 'bull_rsi_os': 35, 'bull_rsi_ob': 59, 'bull_adx_thresh': 22.269799268798764, 'bull_atr_min_pct': 0.004109935367604, 'bull_atr_max_pct': 0.02515237730496424, 'bull_tp_mult': 2.8023650150635055, 'bull_tsl_mult': 0.3609218303395413, 'bull_time_stop': 87, 'bull_use_sma': True, 'bull_use_ema': False, 'bull_use_atr': True, 'bull_use_adx': True, 'bull_use_spike': True, 'bull_rsi_required': True, 'bear_strategy': 'breakout', 'bear_bb_std_mult': 2.5424367713216047, 'bear_rsi_os': 31, 'bear_rsi_ob': 89, 'bear_adx_thresh': 13.38983377520868, 'bear_atr_min_pct': 0.0030748082793300656, 'bear_atr_max_pct': 0.10118850323718333, 'bear_tp_mult': 1.8818046919996543, 'bear_tsl_mult': 0.6637308780633386, 'bear_time_stop': 46, 'bear_use_sma': False, 'bear_use_ema': True, 'bear_use_atr': True, 'bear_use_adx': True, 'bear_use_spike': False, 'bear_rsi_required': True, 'sideways_strategy': 'breakout', 'sideways_bb_std_mult': 3.539561613415957, 'sideways_rsi_os': 50, 'sideways_rsi_ob': 69, 'sideways_adx_thresh': 7.4875385948833575, 'sideways_atr_min_pct': 0.01865806415871494, 'sideways_atr_max_pct': 0.09220861474329553, 'sideways_tp_mult': 2.2351693494561804, 'sideways_tsl_mult': 0.7211347872229601, 'sideways_time_stop': 191, 'sideways_use_sma': True, 'sideways_use_ema': False, 'sideways_use_atr': True, 'sideways_use_adx': True, 'sideways_use_spike': False, 'sideways_rsi_required': True}.
[I 2025-09-01 14:10:56,390] Trial 455 finished with values: [-1000000000.0, 1000000000.0] and parameters: {'p_sma': 23, 'p_std': 58, 'p_atr': 23, 'p_adx': 25, 'rsi_period': 66, 'ema1': 29, 'ema2': 42, 'slip_atr_k': 0.009179606781350415, 'slip_spread_k': 0.18128870811533185, 'spread_hl_frac': 0.00463020368103101, 'bb_std_mult': 1.7377933717919634, 'rsi_os': 39, 'rsi_ob': 80, 'vol_spike': 0.25674005940956834, 'adx_thresh': 27.73527259761385, 'atr_min_pct': 0.011227183553873867, 'atr_max_pct': 0.14788032763458336, 'tp_mult': 1.108160629716296, 'tsl_mult': 0.7865695478418153, 'strategy': 'mean_reversion', 'time_stop': 242, 'use_sma': True, 'use_atr': False, 'use_adx': False, 'use_ema': False, 'use_spike': True, 'rsi_required': False, 'edge_k': 1.0030932394162084, 'edge_cap': 0.29488438828061986, 'bull_strategy': 'mean_reversion', 'bull_bb_std_mult': 3.301179473680927, 'bull_rsi_os': 35, 'bull_rsi_ob': 53, 'bull_adx_thresh': 30.176135223950475, 'bull_atr_min_pct': 0.02357413810069202, 'bull_atr_max_pct': 0.024074761346534895, 'bull_tp_mult': 2.907324518056353, 'bull_tsl_mult': 0.7294136607695305, 'bull_time_stop': 259, 'bull_use_sma': True, 'bull_use_ema': True, 'bull_use_atr': True, 'bull_use_adx': True, 'bull_use_spike': False, 'bull_rsi_required': True, 'bear_strategy': 'breakout', 'bear_bb_std_mult': 3.5353323247461725, 'bear_rsi_os': 30, 'bear_rsi_ob': 89, 'bear_adx_thresh': 23.694507199856258, 'bear_atr_min_pct': 0.003247169910546377, 'bear_atr_max_pct': 0.13122152310183177, 'bear_tp_mult': 1.4253751164251431, 'bear_tsl_mult': 0.6645345451186919, 'bear_time_stop': 81, 'bear_use_sma': False, 'bear_use_ema': True, 'bear_use_atr': True, 'bear_use_adx': True, 'bear_use_spike': False, 'bear_rsi_required': True, 'sideways_strategy': 'breakout', 'sideways_bb_std_mult': 1.808089921735775, 'sideways_rsi_os': 51, 'sideways_rsi_ob': 82, 'sideways_adx_thresh': 7.494891887504572, 'sideways_atr_min_pct': 0.01914624067693742, 'sideways_atr_max_pct': 0.09291357211546908, 'sideways_tp_mult': 2.2351031298313724, 'sideways_tsl_mult': 0.042769928185802386, 'sideways_time_stop': 177, 'sideways_use_sma': True, 'sideways_use_ema': False, 'sideways_use_atr': True, 'sideways_use_adx': True, 'sideways_use_spike': False, 'sideways_rsi_required': True}.
[I 2025-09-01 14:10:56,375] Trial 453 finished with values: [-1000000000.0, 1000000000.0] and parameters: {'p_sma': 39, 'p_std': 49, 'p_atr': 21, 'p_adx': 11, 'rsi_period': 66, 'ema1': 21, 'ema2': 19, 'slip_atr_k': 0.010996759787430692, 'slip_spread_k': 0.041816092549012696, 'spread_hl_frac': 0.004726281554794624, 'bb_std_mult': 1.6794358841325099, 'rsi_os': 38, 'rsi_ob': 80, 'vol_spike': 0.25907559852265605, 'adx_thresh': 17.655215014074262, 'atr_min_pct': 0.02087315170875101, 'atr_max_pct': 0.12456229387529771, 'tp_mult': 1.0673910751243745, 'tsl_mult': 0.8366651532445997, 'strategy': 'mean_reversion', 'time_stop': 243, 'use_sma': False, 'use_atr': False, 'use_adx': False, 'use_ema': False, 'use_spike': True, 'rsi_required': False, 'edge_k': 0.8255467857826992, 'edge_cap': 0.9327039597930158, 'bull_strategy': 'mean_reversion', 'bull_bb_std_mult': 3.090601385176889, 'bull_rsi_os': 35, 'bull_rsi_ob': 55, 'bull_adx_thresh': 21.670138089896753, 'bull_atr_min_pct': 0.0040165724580514305, 'bull_atr_max_pct': 0.025185725335044068, 'bull_tp_mult': 2.798164758581724, 'bull_tsl_mult': 0.49523247693252814, 'bull_time_stop': 165, 'bull_use_sma': True, 'bull_use_ema': False, 'bull_use_atr': True, 'bull_use_adx': True, 'bull_use_spike': True, 'bull_rsi_required': True, 'bear_strategy': 'breakout', 'bear_bb_std_mult': 3.5361087413038335, 'bear_rsi_os': 16, 'bear_rsi_ob': 85, 'bear_adx_thresh': 10.853172001302022, 'bear_atr_min_pct': 0.002785254770199443, 'bear_atr_max_pct': 0.07042067498330448, 'bear_tp_mult': 2.2283614796152564, 'bear_tsl_mult': 0.13735679375521503, 'bear_time_stop': 228, 'bear_use_sma': False, 'bear_use_ema': True, 'bear_use_atr': True, 'bear_use_adx': True, 'bear_use_spike': False, 'bear_rsi_required': True, 'sideways_strategy': 'breakout', 'sideways_bb_std_mult': 1.7984654701872755, 'sideways_rsi_os': 51, 'sideways_rsi_ob': 68, 'sideways_adx_thresh': 10.76276986483838, 'sideways_atr_min_pct': 0.01890080629053131, 'sideways_atr_max_pct': 0.06996099678474507, 'sideways_tp_mult': 2.207718222566961, 'sideways_tsl_mult': 0.04602378090566417, 'sideways_time_stop': 178, 'sideways_use_sma': True, 'sideways_use_ema': False, 'sideways_use_atr': True, 'sideways_use_adx': True, 'sideways_use_spike': False, 'sideways_rsi_required': False}.
[I 2025-09-01 14:10:57,051] Trial 456 finished with values: [-0.009015301975324519, 0.013362376205235322] and parameters: {'p_sma': 41, 'p_std': 57, 'p_atr': 25, 'p_adx': 25, 'rsi_period': 18, 'ema1': 27, 'ema2': 18, 'slip_atr_k': 0.010122630037177383, 'slip_spread_k': 0.0747572918013808, 'spread_hl_frac': 0.003645839866505414, 'bb_std_mult': 3.535161849157948, 'rsi_os': 11, 'rsi_ob': 82, 'vol_spike': 0.1207836963068656, 'adx_thresh': 25.121073756177037, 'atr_min_pct': 0.022397745120226124, 'atr_max_pct': 0.13825337671965474, 'tp_mult': 1.0987486881393502, 'tsl_mult': 0.7847177307679717, 'strategy': 'mean_reversion', 'time_stop': 243, 'use_sma': True, 'use_atr': False, 'use_adx': False, 'use_ema': True, 'use_spike': True, 'rsi_required': False, 'edge_k': 0.8419731641090661, 'edge_cap': 0.9408378696727719, 'bull_strategy': 'breakout', 'bull_bb_std_mult': 3.3007115685954105, 'bull_rsi_os': 33, 'bull_rsi_ob': 53, 'bull_adx_thresh': 29.67701627475953, 'bull_atr_min_pct': 0.010356275151145991, 'bull_atr_max_pct': 0.0530076848940821, 'bull_tp_mult': 2.906612221475734, 'bull_tsl_mult': 0.41741147771006626, 'bull_time_stop': 94, 'bull_use_sma': True, 'bull_use_ema': True, 'bull_use_atr': True, 'bull_use_adx': True, 'bull_use_spike': False, 'bull_rsi_required': True, 'bear_strategy': 'breakout', 'bear_bb_std_mult': 3.196672586653683, 'bear_rsi_os': 29, 'bear_rsi_ob': 86, 'bear_adx_thresh': 12.135320629012059, 'bear_atr_min_pct': 0.003377805797902775, 'bear_atr_max_pct': 0.0412374151799652, 'bear_tp_mult': 2.23326421245674, 'bear_tsl_mult': 0.13690261166818798, 'bear_time_stop': 228, 'bear_use_sma': True, 'bear_use_ema': True, 'bear_use_atr': False, 'bear_use_adx': True, 'bear_use_spike': False, 'bear_rsi_required': True, 'sideways_strategy': 'breakout', 'sideways_bb_std_mult': 1.7382384458717988, 'sideways_rsi_os': 12, 'sideways_rsi_ob': 89, 'sideways_adx_thresh': 19.191496707979677, 'sideways_atr_min_pct': 0.017823855920197678, 'sideways_atr_max_pct': 0.060351816949173305, 'sideways_tp_mult': 1.507429018832259, 'sideways_tsl_mult': 0.6099165131449856, 'sideways_time_stop': 113, 'sideways_use_sma': True, 'sideways_use_ema': False, 'sideways_use_atr': True, 'sideways_use_adx': True, 'sideways_use_spike': False, 'sideways_rsi_required': True}.
[I 2025-09-01 14:10:57,517] Trial 452 finished with values: [-0.2360237649280692, 0.2358990720436663] and parameters: {'p_sma': 39, 'p_std': 46, 'p_atr': 16, 'p_adx': 11, 'rsi_period': 63, 'ema1': 21, 'ema2': 19, 'slip_atr_k': 0.009433468843824545, 'slip_spread_k': 0.03677624224443137, 'spread_hl_frac': 0.004717190175728841, 'bb_std_mult': 1.7964383900776861, 'rsi_os': 35, 'rsi_ob': 84, 'vol_spike': 0.12134877554373004, 'adx_thresh': 25.415564209640934, 'atr_min_pct': 0.024234466018807774, 'atr_max_pct': 0.12817324666924024, 'tp_mult': 1.057703621743058, 'tsl_mult': 0.7839645869737232, 'strategy': 'mean_reversion', 'time_stop': 235, 'use_sma': False, 'use_atr': False, 'use_adx': False, 'use_ema': False, 'use_spike': True, 'rsi_required': False, 'edge_k': 1.0392396586602182, 'edge_cap': 0.36221551674521724, 'bull_strategy': 'mean_reversion', 'bull_bb_std_mult': 2.9527212060473187, 'bull_rsi_os': 35, 'bull_rsi_ob': 57, 'bull_adx_thresh': 21.685876596676643, 'bull_atr_min_pct': 0.011286677962717678, 'bull_atr_max_pct': 0.024243996523817677, 'bull_tp_mult': 2.806892999319179, 'bull_tsl_mult': 0.995284279574137, 'bull_time_stop': 76, 'bull_use_sma': True, 'bull_use_ema': False, 'bull_use_atr': True, 'bull_use_adx': True, 'bull_use_spike': True, 'bull_rsi_required': True, 'bear_strategy': 'breakout', 'bear_bb_std_mult': 2.8328521378289153, 'bear_rsi_os': 31, 'bear_rsi_ob': 89, 'bear_adx_thresh': 23.55923293773278, 'bear_atr_min_pct': 0.002587603641741253, 'bear_atr_max_pct': 0.02888684827142364, 'bear_tp_mult': 2.845274420238365, 'bear_tsl_mult': 0.13532358403399045, 'bear_time_stop': 46, 'bear_use_sma': False, 'bear_use_ema': True, 'bear_use_atr': True, 'bear_use_adx': True, 'bear_use_spike': False, 'bear_rsi_required': True, 'sideways_strategy': 'breakout', 'sideways_bb_std_mult': 1.13025265162974, 'sideways_rsi_os': 51, 'sideways_rsi_ob': 67, 'sideways_adx_thresh': 19.144171454158542, 'sideways_atr_min_pct': 0.0007172116898271526, 'sideways_atr_max_pct': 0.059871057615350776, 'sideways_tp_mult': 1.5090535695694087, 'sideways_tsl_mult': 0.9684627792981793, 'sideways_time_stop': 141, 'sideways_use_sma': True, 'sideways_use_ema': False, 'sideways_use_atr': True, 'sideways_use_adx': True, 'sideways_use_spike': False, 'sideways_rsi_required': False}.
[I 2025-09-01 14:11:45,132] Trial 459 finished with values: [-1000000000.0, 1000000000.0] and parameters: {'p_sma': 8, 'p_std': 47, 'p_atr': 25, 'p_adx': 12, 'rsi_period': 18, 'ema1': 22, 'ema2': 18, 'slip_atr_k': 0.014874961150733237, 'slip_spread_k': 0.2921191899431287, 'spread_hl_frac': 0.006657808063667388, 'bb_std_mult': 1.9433448524523587, 'rsi_os': 36, 'rsi_ob': 82, 'vol_spike': 0.12808375993437984, 'adx_thresh': 24.4163336401698, 'atr_min_pct': 0.02627878424200843, 'atr_max_pct': 0.13819009750419173, 'tp_mult': 2.882490166672315, 'tsl_mult': 0.5647616025246418, 'strategy': 'breakout', 'time_stop': 263, 'use_sma': True, 'use_atr': True, 'use_adx': True, 'use_ema': True, 'use_spike': False, 'rsi_required': False, 'edge_k': 1.8511762046413986, 'edge_cap': 0.3199587230464936, 'bull_strategy': 'breakout', 'bull_bb_std_mult': 2.301966750426479, 'bull_rsi_os': 33, 'bull_rsi_ob': 53, 'bull_adx_thresh': 29.19882825463834, 'bull_atr_min_pct': 0.015031541123708957, 'bull_atr_max_pct': 0.05098624359443066, 'bull_tp_mult': 2.8666165533844485, 'bull_tsl_mult': 0.4159051604990406, 'bull_time_stop': 288, 'bull_use_sma': True, 'bull_use_ema': True, 'bull_use_atr': False, 'bull_use_adx': False, 'bull_use_spike': False, 'bull_rsi_required': True, 'bear_strategy': 'mean_reversion', 'bear_bb_std_mult': 3.5997062019957706, 'bear_rsi_os': 32, 'bear_rsi_ob': 86, 'bear_adx_thresh': 12.177482015151899, 'bear_atr_min_pct': 0.020106824501153073, 'bear_atr_max_pct': 0.042724672853591564, 'bear_tp_mult': 1.7808183521746574, 'bear_tsl_mult': 0.08941810255187088, 'bear_time_stop': 245, 'bear_use_sma': True, 'bear_use_ema': True, 'bear_use_atr': False, 'bear_use_adx': False, 'bear_use_spike': True, 'bear_rsi_required': False, 'sideways_strategy': 'breakout', 'sideways_bb_std_mult': 1.4115074032876815, 'sideways_rsi_os': 7, 'sideways_rsi_ob': 76, 'sideways_adx_thresh': 8.86835054057324, 'sideways_atr_min_pct': 0.004289585172249125, 'sideways_atr_max_pct': 0.07539574750228041, 'sideways_tp_mult': 2.520025405277754, 'sideways_tsl_mult': 0.6115249323453742, 'sideways_time_stop': 156, 'sideways_use_sma': False, 'sideways_use_ema': False, 'sideways_use_atr': False, 'sideways_use_adx': True, 'sideways_use_spike': True, 'sideways_rsi_required': True}.
[I 2025-09-01 14:11:45,135] Trial 457 finished with values: [-1000000000.0, 1000000000.0] and parameters: {'p_sma': 41, 'p_std': 46, 'p_atr': 28, 'p_adx': 12, 'rsi_period': 64, 'ema1': 22, 'ema2': 17, 'slip_atr_k': 0.015847182026093067, 'slip_spread_k': 0.07621629800554806, 'spread_hl_frac': 0.006642449906973557, 'bb_std_mult': 0.6882494777439325, 'rsi_os': 33, 'rsi_ob': 82, 'vol_spike': 0.2361409488782799, 'adx_thresh': 8.08539526274191, 'atr_min_pct': 0.026139481524170168, 'atr_max_pct': 0.13886819340958123, 'tp_mult': 2.171530958836211, 'tsl_mult': 0.5703471529642602, 'strategy': 'mean_reversion', 'time_stop': 235, 'use_sma': True, 'use_atr': True, 'use_adx': False, 'use_ema': True, 'use_spike': True, 'rsi_required': False, 'edge_k': 1.242537134156197, 'edge_cap': 0.5090907179388582, 'bull_strategy': 'breakout', 'bull_bb_std_mult': 2.2093645303918694, 'bull_rsi_os': 33, 'bull_rsi_ob': 45, 'bull_adx_thresh': 14.706093173191023, 'bull_atr_min_pct': 0.010231542859217055, 'bull_atr_max_pct': 0.05011529123397633, 'bull_tp_mult': 2.6155287185513423, 'bull_tsl_mult': 0.4203204611439824, 'bull_time_stop': 237, 'bull_use_sma': True, 'bull_use_ema': True, 'bull_use_atr': True, 'bull_use_adx': False, 'bull_use_spike': False, 'bull_rsi_required': True, 'bear_strategy': 'breakout', 'bear_bb_std_mult': 2.9158593118143723, 'bear_rsi_os': 34, 'bear_rsi_ob': 88, 'bear_adx_thresh': 12.231685435584279, 'bear_atr_min_pct': 0.004690485951611369, 'bear_atr_max_pct': 0.034746526919878715, 'bear_tp_mult': 2.21661595671157, 'bear_tsl_mult': 0.20656667430062126, 'bear_time_stop': 244, 'bear_use_sma': True, 'bear_use_ema': True, 'bear_use_atr': False, 'bear_use_adx': True, 'bear_use_spike': True, 'bear_rsi_required': True, 'sideways_strategy': 'breakout', 'sideways_bb_std_mult': 2.5943416795552303, 'sideways_rsi_os': 32, 'sideways_rsi_ob': 66, 'sideways_adx_thresh': 8.699559276421649, 'sideways_atr_min_pct': 0.0200998536610735, 'sideways_atr_max_pct': 0.06365420728236727, 'sideways_tp_mult': 2.3586162579973347, 'sideways_tsl_mult': 0.9630044294974796, 'sideways_time_stop': 159, 'sideways_use_sma': True, 'sideways_use_ema': False, 'sideways_use_atr': False, 'sideways_use_adx': True, 'sideways_use_spike': True, 'sideways_rsi_required': True}.
