[I 2025-09-01 14:27:20,437] Trial 569 finished with values: [-1000000000.0, 1000000000.0] and parameters: {'p_sma': 40, 'p_std': 50, 'p_atr': 24, 'p_adx': 11, 'rsi_period': 70, 'ema1': 7, 'ema2': 10, 'slip_atr_k': 0.19751650221762623, 'slip_spread_k': 0.051063927422636685, 'spread_hl_frac': 0.004360621416108008, 'bb_std_mult': 2.019509799300289, 'rsi_os': 42, 'rsi_ob': 85, 'vol_spike': 0.24617638532586697, 'adx_thresh': 26.88083225809411, 'atr_min_pct': 0.026998065617933664, 'atr_max_pct': 0.13039801100595277, 'tp_mult': 1.5949065419730988, 'tsl_mult': 0.3320977541850086, 'strategy': 'mean_reversion', 'time_stop': 239, 'use_sma': True, 'use_atr': False, 'use_adx': False, 'use_ema': True, 'use_spike': True, 'rsi_required': False, 'edge_k': 1.8582164873905183, 'edge_cap': 0.4252375728097503, 'bull_strategy': 'breakout', 'bull_bb_std_mult': 3.0875128514456556, 'bull_rsi_os': 27, 'bull_rsi_ob': 58, 'bull_adx_thresh': 28.813590490907334, 'bull_atr_min_pct': 0.01206587410851007, 'bull_atr_max_pct': 0.029268279847917838, 'bull_tp_mult': 2.8075827551078016, 'bull_tsl_mult': 0.44923740831889425, 'bull_time_stop': 87, 'bull_use_sma': True, 'bull_use_ema': False, 'bull_use_atr': True, 'bull_use_adx': True, 'bull_use_spike': False, 'bull_rsi_required': True, 'bear_strategy': 'mean_reversion', 'bear_bb_std_mult': 3.546832522978899, 'bear_rsi_os': 37, 'bear_rsi_ob': 88, 'bear_adx_thresh': 12.626372218100643, 'bear_atr_min_pct': 0.001838715795820023, 'bear_atr_max_pct': 0.04739229515290508, 'bear_tp_mult': 2.873517364463064, 'bear_tsl_mult': 0.5938464764597827, 'bear_time_stop': 206, 'bear_use_sma': True, 'bear_use_ema': False, 'bear_use_atr': True, 'bear_use_adx': False, 'bear_use_spike': False, 'bear_rsi_required': True, 'sideways_strategy': 'breakout', 'sideways_bb_std_mult': 3.497602638096579, 'sideways_rsi_os': 51, 'sideways_rsi_ob': 67, 'sideways_adx_thresh': 6.98589105430758, 'sideways_atr_min_pct': 0.007171378715789729, 'sideways_atr_max_pct': 0.11155267755942361, 'sideways_tp_mult': 2.132583258444944, 'sideways_tsl_mult': 0.029870640569187812, 'sideways_time_stop': 182, 'sideways_use_sma': True, 'sideways_use_ema': False, 'sideways_use_atr': True, 'sideways_use_adx': True, 'sideways_use_spike': False, 'sideways_rsi_required': True}.
[I 2025-09-01 14:27:21,686] Trial 567 finished with values: [-1000000000.0, 1000000000.0] and parameters: {'p_sma': 55, 'p_std': 38, 'p_atr': 24, 'p_adx': 12, 'rsi_period': 37, 'ema1': 28, 'ema2': 20, 'slip_atr_k': 0.024402276555587035, 'slip_spread_k': 0.5698582753707188, 'spread_hl_frac': 0.004328213152904259, 'bb_std_mult': 2.3939196316524347, 'rsi_os': 39, 'rsi_ob': 84, 'vol_spike': 0.2467015956365458, 'adx_thresh': 26.86214778667333, 'atr_min_pct': 0.025905066669287654, 'atr_max_pct': 0.13071024723369307, 'tp_mult': 2.112741807538309, 'tsl_mult': 0.748172673132373, 'strategy': 'mean_reversion', 'time_stop': 266, 'use_sma': True, 'use_atr': False, 'use_adx': False, 'use_ema': True, 'use_spike': True, 'rsi_required': False, 'edge_k': 0.3006991035912846, 'edge_cap': 0.9989831828004121, 'bull_strategy': 'breakout', 'bull_bb_std_mult': 1.203326312454002, 'bull_rsi_os': 36, 'bull_rsi_ob': 58, 'bull_adx_thresh': 18.61788197569569, 'bull_atr_min_pct': 0.014795941085073074, 'bull_atr_max_pct': 0.03012435609207594, 'bull_tp_mult': 2.2423454714147497, 'bull_tsl_mult': 0.7844206496220936, 'bull_time_stop': 86, 'bull_use_sma': True, 'bull_use_ema': False, 'bull_use_atr': True, 'bull_use_adx': True, 'bull_use_spike': False, 'bull_rsi_required': True, 'bear_strategy': 'mean_reversion', 'bear_bb_std_mult': 3.550773304617923, 'bear_rsi_os': 35, 'bear_rsi_ob': 86, 'bear_adx_thresh': 27.393393191326798, 'bear_atr_min_pct': 0.0016723037987833702, 'bear_atr_max_pct': 0.09552128290932263, 'bear_tp_mult': 2.8755217130450283, 'bear_tsl_mult': 0.12457112042777711, 'bear_time_stop': 219, 'bear_use_sma': True, 'bear_use_ema': True, 'bear_use_atr': True, 'bear_use_adx': True, 'bear_use_spike': False, 'bear_rsi_required': True, 'sideways_strategy': 'breakout', 'sideways_bb_std_mult': 3.475416880118667, 'sideways_rsi_os': 25, 'sideways_rsi_ob': 64, 'sideways_adx_thresh': 19.863831723546582, 'sideways_atr_min_pct': 0.007393389770413826, 'sideways_atr_max_pct': 0.058603377425219434, 'sideways_tp_mult': 2.729496144312308, 'sideways_tsl_mult': 0.20463843574720408, 'sideways_time_stop': 102, 'sideways_use_sma': True, 'sideways_use_ema': False, 'sideways_use_atr': True, 'sideways_use_adx': True, 'sideways_use_spike': False, 'sideways_rsi_required': True}.
[I 2025-09-01 14:27:22,240] Trial 566 finished with values: [-1000000000.0, 1000000000.0] and parameters: {'p_sma': 40, 'p_std': 8, 'p_atr': 26, 'p_adx': 12, 'rsi_period': 18, 'ema1': 20, 'ema2': 20, 'slip_atr_k': 0.21251901168622653, 'slip_spread_k': 0.038708558159929136, 'spread_hl_frac': 0.04985921254287935, 'bb_std_mult': 2.577801208934435, 'rsi_os': 39, 'rsi_ob': 83, 'vol_spike': 0.19574222629915888, 'adx_thresh': 9.550385289383835, 'atr_min_pct': 0.025540671778516762, 'atr_max_pct': 0.13022381120516333, 'tp_mult': 1.126019613180915, 'tsl_mult': 0.0001249345601109786, 'strategy': 'mean_reversion', 'time_stop': 238, 'use_sma': True, 'use_atr': False, 'use_adx': True, 'use_ema': True, 'use_spike': True, 'rsi_required': True, 'edge_k': 0.6468725107736251, 'edge_cap': 0.6327676385747176, 'bull_strategy': 'breakout', 'bull_bb_std_mult': 3.0935563378827164, 'bull_rsi_os': 36, 'bull_rsi_ob': 58, 'bull_adx_thresh': 30.392627795114965, 'bull_atr_min_pct': 0.011738540087626785, 'bull_atr_max_pct': 0.029067841616213924, 'bull_tp_mult': 2.809595819672335, 'bull_tsl_mult': 0.5158947129421901, 'bull_time_stop': 89, 'bull_use_sma': False, 'bull_use_ema': False, 'bull_use_atr': False, 'bull_use_adx': True, 'bull_use_spike': True, 'bull_rsi_required': True, 'bear_strategy': 'breakout', 'bear_bb_std_mult': 3.5404164109617957, 'bear_rsi_os': 41, 'bear_rsi_ob': 54, 'bear_adx_thresh': 29.490235947510925, 'bear_atr_min_pct': 0.010949052092081486, 'bear_atr_max_pct': 0.04049885272401969, 'bear_tp_mult': 1.4349911025191557, 'bear_tsl_mult': 0.6060531103413431, 'bear_time_stop': 223, 'bear_use_sma': True, 'bear_use_ema': True, 'bear_use_atr': False, 'bear_use_adx': True, 'bear_use_spike': False, 'bear_rsi_required': True, 'sideways_strategy': 'breakout', 'sideways_bb_std_mult': 2.4065909546990665, 'sideways_rsi_os': 51, 'sideways_rsi_ob': 57, 'sideways_adx_thresh': 18.043581779079567, 'sideways_atr_min_pct': 0.02393556365991114, 'sideways_atr_max_pct': 0.06282814395212367, 'sideways_tp_mult': 2.921526797374668, 'sideways_tsl_mult': 0.2641020505218416, 'sideways_time_stop': 33, 'sideways_use_sma': True, 'sideways_use_ema': False, 'sideways_use_atr': True, 'sideways_use_adx': True, 'sideways_use_spike': False, 'sideways_rsi_required': True}.
[I 2025-09-01 14:27:23,069] Trial 570 finished with values: [-1000000000.0, 1000000000.0] and parameters: {'p_sma': 43, 'p_std': 53, 'p_atr': 25, 'p_adx': 27, 'rsi_period': 64, 'ema1': 28, 'ema2': 28, 'slip_atr_k': 0.12931717591733558, 'slip_spread_k': 0.10372811549173018, 'spread_hl_frac': 0.009154867348545058, 'bb_std_mult': 1.389702857554434, 'rsi_os': 42, 'rsi_ob': 84, 'vol_spike': 0.1083808863520179, 'adx_thresh': 27.108050929741882, 'atr_min_pct': 0.02559873502034046, 'atr_max_pct': 0.13561629474696377, 'tp_mult': 2.9154748064997853, 'tsl_mult': 0.6994035932774516, 'strategy': 'mean_reversion', 'time_stop': 289, 'use_sma': True, 'use_atr': False, 'use_adx': False, 'use_ema': True, 'use_spike': False, 'rsi_required': False, 'edge_k': 0.8143476635008354, 'edge_cap': 0.6050957905354629, 'bull_strategy': 'breakout', 'bull_bb_std_mult': 1.2246596761859156, 'bull_rsi_os': 36, 'bull_rsi_ob': 50, 'bull_adx_thresh': 23.477830693451537, 'bull_atr_min_pct': 0.0018234688434189002, 'bull_atr_max_pct': 0.016643963450229313, 'bull_tp_mult': 2.2543145681627323, 'bull_tsl_mult': 0.45504689450546454, 'bull_time_stop': 91, 'bull_use_sma': True, 'bull_use_ema': False, 'bull_use_atr': True, 'bull_use_adx': True, 'bull_use_spike': False, 'bull_rsi_required': True, 'bear_strategy': 'breakout', 'bear_bb_std_mult': 3.5507548594691687, 'bear_rsi_os': 35, 'bear_rsi_ob': 86, 'bear_adx_thresh': 12.54318309183952, 'bear_atr_min_pct': 0.0069342196079580365, 'bear_atr_max_pct': 0.049186562581442786, 'bear_tp_mult': 2.2800763720211257, 'bear_tsl_mult': 0.14219953129605586, 'bear_time_stop': 218, 'bear_use_sma': True, 'bear_use_ema': False, 'bear_use_atr': True, 'bear_use_adx': False, 'bear_use_spike': False, 'bear_rsi_required': False, 'sideways_strategy': 'breakout', 'sideways_bb_std_mult': 1.4824990370315616, 'sideways_rsi_os': 54, 'sideways_rsi_ob': 62, 'sideways_adx_thresh': 7.305980970211825, 'sideways_atr_min_pct': 0.019403383552698335, 'sideways_atr_max_pct': 0.11096936107451466, 'sideways_tp_mult': 2.1268663064748177, 'sideways_tsl_mult': 0.2931320273450333, 'sideways_time_stop': 215, 'sideways_use_sma': False, 'sideways_use_ema': True, 'sideways_use_atr': True, 'sideways_use_adx': True, 'sideways_use_spike': False, 'sideways_rsi_required': True}.
[I 2025-09-01 14:27:58,786] Trial 572 finished with values: [-1000000000.0, 1000000000.0] and parameters: {'p_sma': 46, 'p_std': 44, 'p_atr': 25, 'p_adx': 29, 'rsi_period': 54, 'ema1': 21, 'ema2': 22, 'slip_atr_k': 0.00570469299074002, 'slip_spread_k': 0.11206169004652453, 'spread_hl_frac': 0.03284497109536247, 'bb_std_mult': 2.620498935747427, 'rsi_os': 53, 'rsi_ob': 83, 'vol_spike': 0.2575098989402147, 'adx_thresh': 25.879313320086524, 'atr_min_pct': 0.02557365281438277, 'atr_max_pct': 0.05555388029610101, 'tp_mult': 2.7532881271393728, 'tsl_mult': 0.7011032825740909, 'strategy': 'breakout', 'time_stop': 286, 'use_sma': True, 'use_atr': False, 'use_adx': False, 'use_ema': False, 'use_spike': False, 'rsi_required': False, 'edge_k': 1.0749844699812656, 'edge_cap': 0.6312991762029969, 'bull_strategy': 'breakout', 'bull_bb_std_mult': 1.329076115127585, 'bull_rsi_os': 36, 'bull_rsi_ob': 54, 'bull_adx_thresh': 30.867341375951792, 'bull_atr_min_pct': 0.019228626119798517, 'bull_atr_max_pct': 0.0735710310648784, 'bull_tp_mult': 2.844649190435216, 'bull_tsl_mult': 0.13604559083086415, 'bull_time_stop': 158, 'bull_use_sma': True, 'bull_use_ema': True, 'bull_use_atr': True, 'bull_use_adx': True, 'bull_use_spike': False, 'bull_rsi_required': True, 'bear_strategy': 'breakout', 'bear_bb_std_mult': 3.5987904064859095, 'bear_rsi_os': 51, 'bear_rsi_ob': 79, 'bear_adx_thresh': 28.031452703276834, 'bear_atr_min_pct': 0.026212505939317447, 'bear_atr_max_pct': 0.05615151057969629, 'bear_tp_mult': 2.478995967572122, 'bear_tsl_mult': 0.20756687967383863, 'bear_time_stop': 71, 'bear_use_sma': True, 'bear_use_ema': False, 'bear_use_atr': True, 'bear_use_adx': True, 'bear_use_spike': False, 'bear_rsi_required': False, 'sideways_strategy': 'breakout', 'sideways_bb_std_mult': 1.486394156974237, 'sideways_rsi_os': 39, 'sideways_rsi_ob': 55, 'sideways_adx_thresh': 23.46604666160382, 'sideways_atr_min_pct': 0.0193487060205609, 'sideways_atr_max_pct': 0.028547473548934, 'sideways_tp_mult': 1.817574467896123, 'sideways_tsl_mult': 0.26486852931884874, 'sideways_time_stop': 161, 'sideways_use_sma': False, 'sideways_use_ema': True, 'sideways_use_atr': True, 'sideways_use_adx': False, 'sideways_use_spike': False, 'sideways_rsi_required': True}.
[I 2025-09-01 14:27:59,729] Trial 574 finished with values: [-1000000000.0, 1000000000.0] and parameters: {'p_sma': 17, 'p_std': 48, 'p_atr': 25, 'p_adx': 11, 'rsi_period': 81, 'ema1': 9, 'ema2': 19, 'slip_atr_k': 0.1157350079739727, 'slip_spread_k': 0.1206121455897411, 'spread_hl_frac': 0.007936155782638298, 'bb_std_mult': 2.983152606495904, 'rsi_os': 29, 'rsi_ob': 81, 'vol_spike': 0.022964380803644574, 'adx_thresh': 25.5234050506386, 'atr_min_pct': 0.026464193647645996, 'atr_max_pct': 0.08238512501088394, 'tp_mult': 1.0956096430027942, 'tsl_mult': 0.7377971414365093, 'strategy': 'breakout', 'time_stop': 48, 'use_sma': False, 'use_atr': True, 'use_adx': False, 'use_ema': False, 'use_spike': False, 'rsi_required': False, 'edge_k': 0.8714398144497315, 'edge_cap': 0.32223062495849947, 'bull_strategy': 'breakout', 'bull_bb_std_mult': 3.2796342299571974, 'bull_rsi_os': 34, 'bull_rsi_ob': 54, 'bull_adx_thresh': 34.918564959039344, 'bull_atr_min_pct': 0.003732412166352759, 'bull_atr_max_pct': 0.09081044720751577, 'bull_tp_mult': 2.859626405869942, 'bull_tsl_mult': 0.4760191834502452, 'bull_time_stop': 114, 'bull_use_sma': True, 'bull_use_ema': True, 'bull_use_atr': True, 'bull_use_adx': False, 'bull_use_spike': False, 'bull_rsi_required': False, 'bear_strategy': 'breakout', 'bear_bb_std_mult': 3.3631406311201455, 'bear_rsi_os': 32, 'bear_rsi_ob': 90, 'bear_adx_thresh': 11.987488038428088, 'bear_atr_min_pct': 0.0035548773659828366, 'bear_atr_max_pct': 0.11600502614367952, 'bear_tp_mult': 2.480468189142997, 'bear_tsl_mult': 0.19114461967923677, 'bear_time_stop': 178, 'bear_use_sma': True, 'bear_use_ema': True, 'bear_use_atr': True, 'bear_use_adx': True, 'bear_use_spike': True, 'bear_rsi_required': False, 'sideways_strategy': 'mean_reversion', 'sideways_bb_std_mult': 1.5155494818292667, 'sideways_rsi_os': 52, 'sideways_rsi_ob': 67, 'sideways_adx_thresh': 5.936587611729184, 'sideways_atr_min_pct': 0.020472980093158018, 'sideways_atr_max_pct': 0.04683067526213872, 'sideways_tp_mult': 1.0467430616936237, 'sideways_tsl_mult': 0.05626505896907741, 'sideways_time_stop': 162, 'sideways_use_sma': False, 'sideways_use_ema': True, 'sideways_use_atr': False, 'sideways_use_adx': False, 'sideways_use_spike': False, 'sideways_rsi_required': True}.
[I 2025-09-01 14:28:00,189] Trial 571 finished with values: [-1000000000.0, 1000000000.0] and parameters: {'p_sma': 55, 'p_std': 36, 'p_atr': 25, 'p_adx': 8, 'rsi_period': 64, 'ema1': 21, 'ema2': 20, 'slip_atr_k': 0.2119529500208841, 'slip_spread_k': 0.11528965624875392, 'spread_hl_frac': 0.009154868892448972, 'bb_std_mult': 1.773887817789597, 'rsi_os': 17, 'rsi_ob': 84, 'vol_spike': 0.02401453158938907, 'adx_thresh': 7.208762252153502, 'atr_min_pct': 0.009731121473639807, 'atr_max_pct': 0.050344418474784505, 'tp_mult': 1.8220856017109606, 'tsl_mult': 0.7866343983050034, 'strategy': 'mean_reversion', 'time_stop': 44, 'use_sma': True, 'use_atr': False, 'use_adx': False, 'use_ema': True, 'use_spike': False, 'rsi_required': False, 'edge_k': 0.8515292434484241, 'edge_cap': 0.3246081095660267, 'bull_strategy': 'breakout', 'bull_bb_std_mult': 1.2072707200559911, 'bull_rsi_os': 36, 'bull_rsi_ob': 54, 'bull_adx_thresh': 19.011880955680375, 'bull_atr_min_pct': 0.02090473400784076, 'bull_atr_max_pct': 0.016578379206476333, 'bull_tp_mult': 1.756770498403479, 'bull_tsl_mult': 0.47125019870628265, 'bull_time_stop': 94, 'bull_use_sma': True, 'bull_use_ema': True, 'bull_use_atr': True, 'bull_use_adx': True, 'bull_use_spike': False, 'bull_rsi_required': True, 'bear_strategy': 'breakout', 'bear_bb_std_mult': 3.5980597022609686, 'bear_rsi_os': 51, 'bear_rsi_ob': 54, 'bear_adx_thresh': 12.147202960618548, 'bear_atr_min_pct': 0.026258095926869583, 'bear_atr_max_pct': 0.05882783780656171, 'bear_tp_mult': 1.3829299181664902, 'bear_tsl_mult': 0.5746747527749199, 'bear_time_stop': 219, 'bear_use_sma': True, 'bear_use_ema': True, 'bear_use_atr': True, 'bear_use_adx': True, 'bear_use_spike': False, 'bear_rsi_required': False, 'sideways_strategy': 'breakout', 'sideways_bb_std_mult': 1.4913901462598496, 'sideways_rsi_os': 25, 'sideways_rsi_ob': 65, 'sideways_adx_thresh': 19.92361119325585, 'sideways_atr_min_pct': 0.01946941852494251, 'sideways_atr_max_pct': 0.06948067996148147, 'sideways_tp_mult': 2.3800328344458346, 'sideways_tsl_mult': 0.26740686588004103, 'sideways_time_stop': 129, 'sideways_use_sma': False, 'sideways_use_ema': True, 'sideways_use_atr': True, 'sideways_use_adx': False, 'sideways_use_spike': False, 'sideways_rsi_required': True}.
[I 2025-09-01 14:28:00,398] Trial 573 finished with values: [-0.020706477530375356, 0.02120343571418339] and parameters: {'p_sma': 33, 'p_std': 48, 'p_atr': 25, 'p_adx': 8, 'rsi_period': 60, 'ema1': 19, 'ema2': 19, 'slip_atr_k': 0.007010469247692271, 'slip_spread_k': 0.11023115715913011, 'spread_hl_frac': 0.032513257910829874, 'bb_std_mult': 3.1325554086857483, 'rsi_os': 38, 'rsi_ob': 81, 'vol_spike': 0.25829828568987867, 'adx_thresh': 7.096679299411413, 'atr_min_pct': 0.028072698436528896, 'atr_max_pct': 0.0862793421468826, 'tp_mult': 1.8272824894878996, 'tsl_mult': 0.786334295456283, 'strategy': 'breakout', 'time_stop': 162, 'use_sma': True, 'use_atr': False, 'use_adx': False, 'use_ema': False, 'use_spike': False, 'rsi_required': False, 'edge_k': 0.8462477687042421, 'edge_cap': 0.3327875903289473, 'bull_strategy': 'breakout', 'bull_bb_std_mult': 1.727290954286515, 'bull_rsi_os': 37, 'bull_rsi_ob': 54, 'bull_adx_thresh': 23.477338858548457, 'bull_atr_min_pct': 0.01919184048569285, 'bull_atr_max_pct': 0.016828874784127486, 'bull_tp_mult': 2.5488699070035117, 'bull_tsl_mult': 0.6667782997240219, 'bull_time_stop': 96, 'bull_use_sma': True, 'bull_use_ema': True, 'bull_use_atr': True, 'bull_use_adx': True, 'bull_use_spike': False, 'bull_rsi_required': True, 'bear_strategy': 'breakout', 'bear_bb_std_mult': 0.5650918756260557, 'bear_rsi_os': 45, 'bear_rsi_ob': 79, 'bear_adx_thresh': 33.446306835958815, 'bear_atr_min_pct': 0.0037061137245271852, 'bear_atr_max_pct': 0.11594866181214733, 'bear_tp_mult': 1.0349108820981985, 'bear_tsl_mult': 0.19808067694945364, 'bear_time_stop': 254, 'bear_use_sma': True, 'bear_use_ema': False, 'bear_use_atr': True, 'bear_use_adx': False, 'bear_use_spike': False, 'bear_rsi_required': False, 'sideways_strategy': 'breakout', 'sideways_bb_std_mult': 3.339894297322994, 'sideways_rsi_os': 34, 'sideways_rsi_ob': 62, 'sideways_adx_thresh': 5.882634951199564, 'sideways_atr_min_pct': 0.019567523426986397, 'sideways_atr_max_pct': 0.09577831236724493, 'sideways_tp_mult': 2.3712687867751963, 'sideways_tsl_mult': 0.4677788772658787, 'sideways_time_stop': 219, 'sideways_use_sma': False, 'sideways_use_ema': True, 'sideways_use_atr': True, 'sideways_use_adx': False, 'sideways_use_spike': False, 'sideways_rsi_required': True}.
[I 2025-09-01 14:28:39,748] Trial 578 finished with values: [-0.009509614276718148, 0.011017491454933134] and parameters: {'p_sma': 36, 'p_std': 58, 'p_atr': 27, 'p_adx': 13, 'rsi_period': 69, 'ema1': 22, 'ema2': 55, 'slip_atr_k': 0.01726942347659357, 'slip_spread_k': 0.07962172829246575, 'spread_hl_frac': 0.024805139018113587, 'bb_std_mult': 1.8878249346859548, 'rsi_os': 40, 'rsi_ob': 86, 'vol_spike': 0.03380693516584206, 'adx_thresh': 24.77594334099407, 'atr_min_pct': 0.024875345249464925, 'atr_max_pct': 0.14113755938506214, 'tp_mult': 2.817768866525454, 'tsl_mult': 0.7266595596935961, 'strategy': 'mean_reversion', 'time_stop': 230, 'use_sma': False, 'use_atr': True, 'use_adx': True, 'use_ema': True, 'use_spike': True, 'rsi_required': False, 'edge_k': 1.6428527572792886, 'edge_cap': 0.3505370676079503, 'bull_strategy': 'breakout', 'bull_bb_std_mult': 3.2285695171539666, 'bull_rsi_os': 46, 'bull_rsi_ob': 56, 'bull_adx_thresh': 30.177753775479637, 'bull_atr_min_pct': 0.003116418096063154, 'bull_atr_max_pct': 0.020572781518059736, 'bull_tp_mult': 1.6604822845703222, 'bull_tsl_mult': 0.41925021037714727, 'bull_time_stop': 70, 'bull_use_sma': False, 'bull_use_ema': True, 'bull_use_atr': False, 'bull_use_adx': False, 'bull_use_spike': False, 'bull_rsi_required': False, 'bear_strategy': 'breakout', 'bear_bb_std_mult': 3.493200204846213, 'bear_rsi_os': 33, 'bear_rsi_ob': 64, 'bear_adx_thresh': 12.867495903205223, 'bear_atr_min_pct': 0.002609502512835795, 'bear_atr_max_pct': 0.04524442155697935, 'bear_tp_mult': 2.18034393047814, 'bear_tsl_mult': 0.1442397837266742, 'bear_time_stop': 213, 'bear_use_sma': True, 'bear_use_ema': True, 'bear_use_atr': True, 'bear_use_adx': True, 'bear_use_spike': True, 'bear_rsi_required': True, 'sideways_strategy': 'mean_reversion', 'sideways_bb_std_mult': 1.67548246116634, 'sideways_rsi_os': 32, 'sideways_rsi_ob': 68, 'sideways_adx_thresh': 7.896911103559854, 'sideways_atr_min_pct': 0.012393247289070864, 'sideways_atr_max_pct': 0.07988222432825014, 'sideways_tp_mult': 2.61828309971693, 'sideways_tsl_mult': 0.7811235242496737, 'sideways_time_stop': 176, 'sideways_use_sma': True, 'sideways_use_ema': False, 'sideways_use_atr': False, 'sideways_use_adx': True, 'sideways_use_spike': True, 'sideways_rsi_required': False}.
