[I 2025-09-01 13:15:05,509] Trial 90 finished with values: [-1000000000.0, 1000000000.0] and parameters: {'p_sma': 20, 'p_std': 40, 'p_atr': 8, 'p_adx': 14, 'rsi_period': 30, 'ema1': 23, 'ema2': 54, 'slip_atr_k': 0.15948964337154475, 'slip_spread_k': 0.4262224954660866, 'spread_hl_frac': 0.020446548029505053, 'bb_std_mult': 1.9806134455350768, 'rsi_os': 45, 'rsi_ob': 53, 'vol_spike': 0.07223457364035661, 'adx_thresh': 30.89835880480146, 'atr_min_pct': 0.01929478863022297, 'atr_max_pct': 0.07543659858242918, 'tp_mult': 1.7791523626614079, 'tsl_mult': 0.3515721065426487, 'strategy': 'mean_reversion', 'time_stop': 66, 'use_sma': True, 'use_atr': True, 'use_adx': False, 'use_ema': True, 'use_spike': False, 'rsi_required': True, 'edge_k': 0.1930152080352498, 'edge_cap': 0.9403180968640382, 'bull_strategy': 'mean_reversion', 'bull_bb_std_mult': 3.5115707644340692, 'bull_rsi_os': 26, 'bull_rsi_ob': 50, 'bull_adx_thresh': 8.232786118962363, 'bull_atr_min_pct': 0.0052568727668071205, 'bull_atr_max_pct': 0.030794831205383892, 'bull_tp_mult': 2.1666198260116367, 'bull_tsl_mult': 0.6422279976769205, 'bull_time_stop': 160, 'bull_use_sma': True, 'bull_use_ema': False, 'bull_use_atr': False, 'bull_use_adx': False, 'bull_use_spike': False, 'bull_rsi_required': False, 'bear_strategy': 'mean_reversion', 'bear_bb_std_mult': 2.693756944213204, 'bear_rsi_os': 42, 'bear_rsi_ob': 68, 'bear_adx_thresh': 14.074525578032928, 'bear_atr_min_pct': 5.3531347831699966e-05, 'bear_atr_max_pct': 0.09810500259831169, 'bear_tp_mult': 2.1568928715386977, 'bear_tsl_mult': 0.7839588456218367, 'bear_time_stop': 123, 'bear_use_sma': True, 'bear_use_ema': True, 'bear_use_atr': True, 'bear_use_adx': False, 'bear_use_spike': False, 'bear_rsi_required': False, 'sideways_strategy': 'mean_reversion', 'sideways_bb_std_mult': 1.3908456152511355, 'sideways_rsi_os': 43, 'sideways_rsi_ob': 85, 'sideways_adx_thresh': 6.1329613039719675, 'sideways_atr_min_pct': 0.02380751183998399, 'sideways_atr_max_pct': 0.09896573526732969, 'sideways_tp_mult': 2.6546556075532357, 'sideways_tsl_mult': 0.7996286354641244, 'sideways_time_stop': 205, 'sideways_use_sma': False, 'sideways_use_ema': True, 'sideways_use_atr': True, 'sideways_use_adx': False, 'sideways_use_spike': False, 'sideways_rsi_required': True}.
[I 2025-09-01 13:15:05,949] Trial 91 finished with values: [-1000000000.0, 1000000000.0] and parameters: {'p_sma': 19, 'p_std': 40, 'p_atr': 27, 'p_adx': 14, 'rsi_period': 15, 'ema1': 18, 'ema2': 56, 'slip_atr_k': 0.15953526259917253, 'slip_spread_k': 0.41741857279552885, 'spread_hl_frac': 0.01994634146412111, 'bb_std_mult': 1.9922395886751763, 'rsi_os': 43, 'rsi_ob': 53, 'vol_spike': 0.08680434044265681, 'adx_thresh': 13.296350271796005, 'atr_min_pct': 0.018903179612863346, 'atr_max_pct': 0.14418597456367355, 'tp_mult': 2.09133359401224, 'tsl_mult': 0.46848391653398214, 'strategy': 'mean_reversion', 'time_stop': 123, 'use_sma': True, 'use_atr': True, 'use_adx': False, 'use_ema': True, 'use_spike': False, 'rsi_required': True, 'edge_k': 0.18465555482665869, 'edge_cap': 0.9481541401076119, 'bull_strategy': 'mean_reversion', 'bull_bb_std_mult': 3.303643530544132, 'bull_rsi_os': 27, 'bull_rsi_ob': 92, 'bull_adx_thresh': 7.970948886786955, 'bull_atr_min_pct': 0.0038490706424779337, 'bull_atr_max_pct': 0.03160090794055196, 'bull_tp_mult': 1.5797224268655263, 'bull_tsl_mult': 0.6003411892443653, 'bull_time_stop': 139, 'bull_use_sma': False, 'bull_use_ema': False, 'bull_use_atr': False, 'bull_use_adx': False, 'bull_use_spike': False, 'bull_rsi_required': False, 'bear_strategy': 'mean_reversion', 'bear_bb_std_mult': 2.2424594716620225, 'bear_rsi_os': 42, 'bear_rsi_ob': 61, 'bear_adx_thresh': 14.762748831360463, 'bear_atr_min_pct': 0.010915426903184701, 'bear_atr_max_pct': 0.09819342256133023, 'bear_tp_mult': 2.4631335190591286, 'bear_tsl_mult': 0.7036713996452699, 'bear_time_stop': 162, 'bear_use_sma': True, 'bear_use_ema': True, 'bear_use_atr': True, 'bear_use_adx': False, 'bear_use_spike': False, 'bear_rsi_required': False, 'sideways_strategy': 'mean_reversion', 'sideways_bb_std_mult': 1.4281552733740859, 'sideways_rsi_os': 55, 'sideways_rsi_ob': 73, 'sideways_adx_thresh': 30.261674322445508, 'sideways_atr_min_pct': 0.023834751357615865, 'sideways_atr_max_pct': 0.08891649317415616, 'sideways_tp_mult': 2.6279951393654466, 'sideways_tsl_mult': 0.8006469044736496, 'sideways_time_stop': 65, 'sideways_use_sma': False, 'sideways_use_ema': True, 'sideways_use_atr': True, 'sideways_use_adx': False, 'sideways_use_spike': False, 'sideways_rsi_required': True}.
[I 2025-09-01 13:15:43,530] Trial 94 finished with values: [-0.054815538875399916, 0.05458827010943003] and parameters: {'p_sma': 29, 'p_std': 21, 'p_atr': 24, 'p_adx': 21, 'rsi_period': 23, 'ema1': 19, 'ema2': 49, 'slip_atr_k': 0.1298343726630532, 'slip_spread_k': 0.5374894504217921, 'spread_hl_frac': 0.0224715980229126, 'bb_std_mult': 2.7317670095289484, 'rsi_os': 17, 'rsi_ob': 91, 'vol_spike': 0.08331733463445333, 'adx_thresh': 14.492814467085013, 'atr_min_pct': 0.017750736951870502, 'atr_max_pct': 0.11731512632972257, 'tp_mult': 2.083012875672633, 'tsl_mult': 0.4320360543711977, 'strategy': 'mean_reversion', 'time_stop': 10, 'use_sma': False, 'use_atr': False, 'use_adx': False, 'use_ema': True, 'use_spike': True, 'rsi_required': False, 'edge_k': 1.740017803993458, 'edge_cap': 0.34472825400843343, 'bull_strategy': 'breakout', 'bull_bb_std_mult': 3.315602791393871, 'bull_rsi_os': 52, 'bull_rsi_ob': 64, 'bull_adx_thresh': 7.48665776754746, 'bull_atr_min_pct': 0.0015775112529883457, 'bull_atr_max_pct': 0.037383388725296826, 'bull_tp_mult': 1.5806918663742298, 'bull_tsl_mult': 0.6963195257110585, 'bull_time_stop': 175, 'bull_use_sma': False, 'bull_use_ema': False, 'bull_use_atr': True, 'bull_use_adx': False, 'bull_use_spike': True, 'bull_rsi_required': True, 'bear_strategy': 'breakout', 'bear_bb_std_mult': 2.3033608024825507, 'bear_rsi_os': 17, 'bear_rsi_ob': 61, 'bear_adx_thresh': 11.517910752332575, 'bear_atr_min_pct': 0.007179048107144039, 'bear_atr_max_pct': 0.10607609141574392, 'bear_tp_mult': 2.441037565567992, 'bear_tsl_mult': 0.30364747697844224, 'bear_time_stop': 172, 'bear_use_sma': False, 'bear_use_ema': True, 'bear_use_atr': True, 'bear_use_adx': False, 'bear_use_spike': True, 'bear_rsi_required': True, 'sideways_strategy': 'mean_reversion', 'sideways_bb_std_mult': 3.1590521038585715, 'sideways_rsi_os': 21, 'sideways_rsi_ob': 48, 'sideways_adx_thresh': 30.7376779463223, 'sideways_atr_min_pct': 0.013009607116049753, 'sideways_atr_max_pct': 0.11364173903471686, 'sideways_tp_mult': 2.7954362205471766, 'sideways_tsl_mult': 0.7573563678849815, 'sideways_time_stop': 116, 'sideways_use_sma': True, 'sideways_use_ema': False, 'sideways_use_atr': False, 'sideways_use_adx': True, 'sideways_use_spike': False, 'sideways_rsi_required': False}.
[I 2025-09-01 13:15:43,982] Trial 95 finished with values: [-0.03391752374237045, 0.03367990356000034] and parameters: {'p_sma': 26, 'p_std': 49, 'p_atr': 30, 'p_adx': 25, 'rsi_period': 19, 'ema1': 20, 'ema2': 49, 'slip_atr_k': 0.14957157188071465, 'slip_spread_k': 0.5208739138494103, 'spread_hl_frac': 0.022097266106698724, 'bb_std_mult': 2.6289105572476803, 'rsi_os': 39, 'rsi_ob': 91, 'vol_spike': 0.18402964534206084, 'adx_thresh': 14.788618729301165, 'atr_min_pct': 0.021851340854975053, 'atr_max_pct': 0.11536764395090035, 'tp_mult': 1.8878415427624584, 'tsl_mult': 0.13283617919881688, 'strategy': 'mean_reversion', 'time_stop': 83, 'use_sma': False, 'use_atr': False, 'use_adx': False, 'use_ema': True, 'use_spike': True, 'rsi_required': False, 'edge_k': 0.39165232778081627, 'edge_cap': 0.3536828872541013, 'bull_strategy': 'breakout', 'bull_bb_std_mult': 1.7249412248249405, 'bull_rsi_os': 52, 'bull_rsi_ob': 64, 'bull_adx_thresh': 9.761621070148474, 'bull_atr_min_pct': 0.001399785385094507, 'bull_atr_max_pct': 0.03758868168757891, 'bull_tp_mult': 2.0261576193763586, 'bull_tsl_mult': 0.6977486654950513, 'bull_time_stop': 109, 'bull_use_sma': False, 'bull_use_ema': False, 'bull_use_atr': True, 'bull_use_adx': False, 'bull_use_spike': True, 'bull_rsi_required': True, 'bear_strategy': 'breakout', 'bear_bb_std_mult': 0.8764874111173784, 'bear_rsi_os': 17, 'bear_rsi_ob': 72, 'bear_adx_thresh': 11.607880932196533, 'bear_atr_min_pct': 0.016841489026752372, 'bear_atr_max_pct': 0.10765937010324425, 'bear_tp_mult': 1.3391969496805973, 'bear_tsl_mult': 0.30832549784609775, 'bear_time_stop': 169, 'bear_use_sma': False, 'bear_use_ema': True, 'bear_use_atr': True, 'bear_use_adx': False, 'bear_use_spike': True, 'bear_rsi_required': True, 'sideways_strategy': 'mean_reversion', 'sideways_bb_std_mult': 1.2964872418438063, 'sideways_rsi_os': 8, 'sideways_rsi_ob': 48, 'sideways_adx_thresh': 14.643649557114287, 'sideways_atr_min_pct': 0.02055994974658321, 'sideways_atr_max_pct': 0.1494720741241763, 'sideways_tp_mult': 2.734027467584918, 'sideways_tsl_mult': 0.9003042991067876, 'sideways_time_stop': 83, 'sideways_use_sma': True, 'sideways_use_ema': False, 'sideways_use_atr': False, 'sideways_use_adx': True, 'sideways_use_spike': False, 'sideways_rsi_required': False}.
[I 2025-09-01 13:15:44,947] Trial 93 finished with values: [-1000000000.0, 1000000000.0] and parameters: {'p_sma': 20, 'p_std': 5, 'p_atr': 19, 'p_adx': 21, 'rsi_period': 22, 'ema1': 18, 'ema2': 56, 'slip_atr_k': 0.14562253055869753, 'slip_spread_k': 0.7305480521402808, 'spread_hl_frac': 0.02012151734249992, 'bb_std_mult': 1.405178872676246, 'rsi_os': 7, 'rsi_ob': 94, 'vol_spike': 0.1863970504171445, 'adx_thresh': 14.230466106826995, 'atr_min_pct': 0.007064837858038926, 'atr_max_pct': 0.09796566963976377, 'tp_mult': 2.0516068784123984, 'tsl_mult': 0.4519522756106278, 'strategy': 'mean_reversion', 'time_stop': 121, 'use_sma': False, 'use_atr': False, 'use_adx': False, 'use_ema': True, 'use_spike': False, 'rsi_required': True, 'edge_k': 0.8370596164054356, 'edge_cap': 0.3654016464100056, 'bull_strategy': 'mean_reversion', 'bull_bb_std_mult': 3.2872506904243552, 'bull_rsi_os': 35, 'bull_rsi_ob': 64, 'bull_adx_thresh': 7.815796995665318, 'bull_atr_min_pct': 0.017527770422359687, 'bull_atr_max_pct': 0.030676800673988567, 'bull_tp_mult': 1.5882916112951553, 'bull_tsl_mult': 0.5933315038970564, 'bull_time_stop': 104, 'bull_use_sma': False, 'bull_use_ema': False, 'bull_use_atr': False, 'bull_use_adx': False, 'bull_use_spike': True, 'bull_rsi_required': False, 'bear_strategy': 'breakout', 'bear_bb_std_mult': 2.70107743829556, 'bear_rsi_os': 7, 'bear_rsi_ob': 68, 'bear_adx_thresh': 17.11752551117983, 'bear_atr_min_pct': 0.0011950330229897003, 'bear_atr_max_pct': 0.010301184712001851, 'bear_tp_mult': 1.3146967068423567, 'bear_tsl_mult': 0.7109912214885797, 'bear_time_stop': 165, 'bear_use_sma': False, 'bear_use_ema': True, 'bear_use_atr': True, 'bear_use_adx': False, 'bear_use_spike': True, 'bear_rsi_required': False, 'sideways_strategy': 'mean_reversion', 'sideways_bb_std_mult': 2.70292561868732, 'sideways_rsi_os': 53, 'sideways_rsi_ob': 85, 'sideways_adx_thresh': 34.7193877624525, 'sideways_atr_min_pct': 0.018660083765567125, 'sideways_atr_max_pct': 0.036664643858872414, 'sideways_tp_mult': 2.644678806509906, 'sideways_tsl_mult': 0.9057717917501638, 'sideways_time_stop': 200, 'sideways_use_sma': False, 'sideways_use_ema': True, 'sideways_use_atr': False, 'sideways_use_adx': True, 'sideways_use_spike': False, 'sideways_rsi_required': False}.
[I 2025-09-01 13:15:45,274] Trial 92 finished with values: [-1000000000.0, 1000000000.0] and parameters: {'p_sma': 20, 'p_std': 21, 'p_atr': 24, 'p_adx': 14, 'rsi_period': 29, 'ema1': 18, 'ema2': 56, 'slip_atr_k': 0.15820112474131065, 'slip_spread_k': 0.5358251947831045, 'spread_hl_frac': 0.020314289390260934, 'bb_std_mult': 1.3579630879678761, 'rsi_os': 7, 'rsi_ob': 52, 'vol_spike': 0.00793377493568806, 'adx_thresh': 30.395554309128265, 'atr_min_pct': 0.019124064620513023, 'atr_max_pct': 0.07489271619408072, 'tp_mult': 1.1111647245223617, 'tsl_mult': 0.47070438542003845, 'strategy': 'mean_reversion', 'time_stop': 281, 'use_sma': False, 'use_atr': False, 'use_adx': False, 'use_ema': True, 'use_spike': False, 'rsi_required': True, 'edge_k': 1.7457724117095892, 'edge_cap': 0.4485215729460826, 'bull_strategy': 'mean_reversion', 'bull_bb_std_mult': 3.283799283396957, 'bull_rsi_os': 11, 'bull_rsi_ob': 64, 'bull_adx_thresh': 8.290923285825386, 'bull_atr_min_pct': 0.017398051710694716, 'bull_atr_max_pct': 0.03389115969064435, 'bull_tp_mult': 2.6853995016463346, 'bull_tsl_mult': 0.6913405647221185, 'bull_time_stop': 137, 'bull_use_sma': False, 'bull_use_ema': False, 'bull_use_atr': False, 'bull_use_adx': False, 'bull_use_spike': True, 'bull_rsi_required': False, 'bear_strategy': 'breakout', 'bear_bb_std_mult': 2.697727742107664, 'bear_rsi_os': 52, 'bear_rsi_ob': 86, 'bear_adx_thresh': 8.725704181823893, 'bear_atr_min_pct': 0.0073415318410256615, 'bear_atr_max_pct': 0.12711694798030884, 'bear_tp_mult': 1.8293677355749633, 'bear_tsl_mult': 0.7212614096473715, 'bear_time_stop': 289, 'bear_use_sma': True, 'bear_use_ema': True, 'bear_use_atr': True, 'bear_use_adx': False, 'bear_use_spike': True, 'bear_rsi_required': False, 'sideways_strategy': 'mean_reversion', 'sideways_bb_std_mult': 1.2454150495133247, 'sideways_rsi_os': 31, 'sideways_rsi_ob': 72, 'sideways_adx_thresh': 31.0084162730928, 'sideways_atr_min_pct': 0.02395397534798957, 'sideways_atr_max_pct': 0.038382688193279085, 'sideways_tp_mult': 2.6211777805747425, 'sideways_tsl_mult': 0.8489108592925928, 'sideways_time_stop': 82, 'sideways_use_sma': False, 'sideways_use_ema': True, 'sideways_use_atr': False, 'sideways_use_adx': True, 'sideways_use_spike': False, 'sideways_rsi_required': False}.
[I 2025-09-01 13:15:45,700] Trial 97 finished with values: [-1000000000.0, 1000000000.0] and parameters: {'p_sma': 56, 'p_std': 45, 'p_atr': 22, 'p_adx': 12, 'rsi_period': 25, 'ema1': 29, 'ema2': 51, 'slip_atr_k': 0.14865583229491602, 'slip_spread_k': 0.3009197526164241, 'spread_hl_frac': 0.009690267359867522, 'bb_std_mult': 1.361592725315853, 'rsi_os': 52, 'rsi_ob': 69, 'vol_spike': 0.009800492588510443, 'adx_thresh': 17.413716798913, 'atr_min_pct': 0.016404361598919847, 'atr_max_pct': 0.0669152544874924, 'tp_mult': 1.8718463748299115, 'tsl_mult': 0.1645798955206848, 'strategy': 'mean_reversion', 'time_stop': 277, 'use_sma': False, 'use_atr': False, 'use_adx': False, 'use_ema': True, 'use_spike': False, 'rsi_required': True, 'edge_k': 0.526004619862005, 'edge_cap': 0.22506609475995315, 'bull_strategy': 'breakout', 'bull_bb_std_mult': 2.1712850662092222, 'bull_rsi_os': 15, 'bull_rsi_ob': 61, 'bull_adx_thresh': 5.001059110718922, 'bull_atr_min_pct': 0.0033191567261296887, 'bull_atr_max_pct': 0.035570514810726775, 'bull_tp_mult': 2.031999991222112, 'bull_tsl_mult': 0.5947723331376933, 'bull_time_stop': 152, 'bull_use_sma': True, 'bull_use_ema': False, 'bull_use_atr': False, 'bull_use_adx': False, 'bull_use_spike': True, 'bull_rsi_required': True, 'bear_strategy': 'breakout', 'bear_bb_std_mult': 0.7296505321727667, 'bear_rsi_os': 17, 'bear_rsi_ob': 77, 'bear_adx_thresh': 10.400672039878993, 'bear_atr_min_pct': 0.016462407554206086, 'bear_atr_max_pct': 0.12823984454779142, 'bear_tp_mult': 1.4118147509567234, 'bear_tsl_mult': 0.8832230629930554, 'bear_time_stop': 233, 'bear_use_sma': False, 'bear_use_ema': True, 'bear_use_atr': True, 'bear_use_adx': False, 'bear_use_spike': True, 'bear_rsi_required': False, 'sideways_strategy': 'breakout', 'sideways_bb_std_mult': 0.9077087042063942, 'sideways_rsi_os': 8, 'sideways_rsi_ob': 79, 'sideways_adx_thresh': 14.448971333241566, 'sideways_atr_min_pct': 0.02616448393385482, 'sideways_atr_max_pct': 0.1092589914413003, 'sideways_tp_mult': 2.914147587249221, 'sideways_tsl_mult': 0.9018379690413179, 'sideways_time_stop': 288, 'sideways_use_sma': False, 'sideways_use_ema': False, 'sideways_use_atr': False, 'sideways_use_adx': True, 'sideways_use_spike': False, 'sideways_rsi_required': False}.
[I 2025-09-01 13:15:45,886] Trial 98 finished with values: [-1000000000.0, 1000000000.0] and parameters: {'p_sma': 25, 'p_std': 50, 'p_atr': 17, 'p_adx': 12, 'rsi_period': 19, 'ema1': 14, 'ema2': 42, 'slip_atr_k': 0.14872210941495553, 'slip_spread_k': 0.3048180256716646, 'spread_hl_frac': 0.015452788542981426, 'bb_std_mult': 3.1775939150010917, 'rsi_os': 53, 'rsi_ob': 46, 'vol_spike': 0.05826099619148463, 'adx_thresh': 16.226065026653533, 'atr_min_pct': 0.01152060635071052, 'atr_max_pct': 0.06722406333813333, 'tp_mult': 1.8740880628513534, 'tsl_mult': 0.03351589421398307, 'strategy': 'mean_reversion', 'time_stop': 79, 'use_sma': True, 'use_atr': True, 'use_adx': True, 'use_ema': True, 'use_spike': False, 'rsi_required': True, 'edge_k': 0.28930966481645276, 'edge_cap': 0.45586320777783296, 'bull_strategy': 'breakout', 'bull_bb_std_mult': 2.1486460848493736, 'bull_rsi_os': 51, 'bull_rsi_ob': 58, 'bull_adx_thresh': 34.721844652916715, 'bull_atr_min_pct': 0.003395425256681274, 'bull_atr_max_pct': 0.013803858133778397, 'bull_tp_mult': 2.68464154327252, 'bull_tsl_mult': 0.9937298865644004, 'bull_time_stop': 153, 'bull_use_sma': True, 'bull_use_ema': False, 'bull_use_atr': False, 'bull_use_adx': False, 'bull_use_spike': False, 'bull_rsi_required': True, 'bear_strategy': 'mean_reversion', 'bear_bb_std_mult': 1.1155121585139922, 'bear_rsi_os': 17, 'bear_rsi_ob': 72, 'bear_adx_thresh': 10.293488556878952, 'bear_atr_min_pct': 0.01628298852145995, 'bear_atr_max_pct': 0.12881655046762008, 'bear_tp_mult': 1.484190547245431, 'bear_tsl_mult': 0.1947523973364845, 'bear_time_stop': 31, 'bear_use_sma': True, 'bear_use_ema': True, 'bear_use_atr': True, 'bear_use_adx': False, 'bear_use_spike': False, 'bear_rsi_required': False, 'sideways_strategy': 'breakout', 'sideways_bb_std_mult': 1.2328683918872412, 'sideways_rsi_os': 9, 'sideways_rsi_ob': 46, 'sideways_adx_thresh': 14.873550876795264, 'sideways_atr_min_pct': 0.02618649124173421, 'sideways_atr_max_pct': 0.0453946903065023, 'sideways_tp_mult': 2.9186770090688907, 'sideways_tsl_mult': 0.8405674909589529, 'sideways_time_stop': 44, 'sideways_use_sma': False, 'sideways_use_ema': False, 'sideways_use_atr': True, 'sideways_use_adx': False, 'sideways_use_spike': False, 'sideways_rsi_required': True}.
[I 2025-09-01 13:16:26,994] Trial 96 finished with values: [-0.0249740728721225, 0.02522548522264876] and parameters: {'p_sma': 25, 'p_std': 45, 'p_atr': 12, 'p_adx': 21, 'rsi_period': 19, 'ema1': 28, 'ema2': 42, 'slip_atr_k': 0.14374671056382404, 'slip_spread_k': 0.7318512200615419, 'spread_hl_frac': 0.010149083125113052, 'bb_std_mult': 0.5109587828320672, 'rsi_os': 25, 'rsi_ob': 94, 'vol_spike': 0.18219776504234414, 'adx_thresh': 16.129146894887107, 'atr_min_pct': 0.011683908516435589, 'atr_max_pct': 0.06857859317630181, 'tp_mult': 1.7032527787805958, 'tsl_mult': 0.1292657508148989, 'strategy': 'breakout', 'time_stop': 79, 'use_sma': True, 'use_atr': True, 'use_adx': False, 'use_ema': True, 'use_spike': True, 'rsi_required': False, 'edge_k': 0.3879732323984179, 'edge_cap': 0.7378105955870882, 'bull_strategy': 'breakout', 'bull_bb_std_mult': 3.026510634983236, 'bull_rsi_os': 36, 'bull_rsi_ob': 60, 'bull_adx_thresh': 9.88258874171121, 'bull_atr_min_pct': 0.0006284251921558816, 'bull_atr_max_pct': 0.06788155035088922, 'bull_tp_mult': 1.2319660819017944, 'bull_tsl_mult': 0.741340505020154, 'bull_time_stop': 104, 'bull_use_sma': False, 'bull_use_ema': True, 'bull_use_atr': False, 'bull_use_adx': False, 'bull_use_spike': True, 'bull_rsi_required': True, 'bear_strategy': 'mean_reversion', 'bear_bb_std_mult': 3.4532420501784, 'bear_rsi_os': 14, 'bear_rsi_ob': 71, 'bear_adx_thresh': 8.798652289109574, 'bear_atr_min_pct': 0.01642724384646835, 'bear_atr_max_pct': 0.1260030071638959, 'bear_tp_mult': 2.9922088556671653, 'bear_tsl_mult': 0.20217528422614262, 'bear_time_stop': 160, 'bear_use_sma': True, 'bear_use_ema': False, 'bear_use_atr': True, 'bear_use_adx': False, 'bear_use_spike': True, 'bear_rsi_required': True, 'sideways_strategy': 'breakout', 'sideways_bb_std_mult': 2.6260620052297314, 'sideways_rsi_os': 9, 'sideways_rsi_ob': 46, 'sideways_adx_thresh': 33.052691584843544, 'sideways_atr_min_pct': 0.0206292633766489, 'sideways_atr_max_pct': 0.10871781590919523, 'sideways_tp_mult': 2.921584069380197, 'sideways_tsl_mult': 0.8404955356458751, 'sideways_time_stop': 137, 'sideways_use_sma': True, 'sideways_use_ema': False, 'sideways_use_atr': False, 'sideways_use_adx': True, 'sideways_use_spike': False, 'sideways_rsi_required': True}.
