[I 2025-09-01 14:14:00,372] Trial 477 finished with values: [-1000000000.0, 1000000000.0] and parameters: {'p_sma': 49, 'p_std': 15, 'p_atr': 20, 'p_adx': 28, 'rsi_period': 66, 'ema1': 21, 'ema2': 16, 'slip_atr_k': 0.17813583011166612, 'slip_spread_k': 0.7698411737489266, 'spread_hl_frac': 0.007246126910035299, 'bb_std_mult': 1.8972117013176255, 'rsi_os': 41, 'rsi_ob': 79, 'vol_spike': 0.07934524720104232, 'adx_thresh': 16.49297134922295, 'atr_min_pct': 0.02497005468632789, 'atr_max_pct': 0.11404516922799976, 'tp_mult': 1.042295589586908, 'tsl_mult': 0.7638021349080878, 'strategy': 'mean_reversion', 'time_stop': 65, 'use_sma': True, 'use_atr': True, 'use_adx': False, 'use_ema': True, 'use_spike': True, 'rsi_required': True, 'edge_k': 0.9499835088377325, 'edge_cap': 0.35411689241899746, 'bull_strategy': 'breakout', 'bull_bb_std_mult': 3.326352138827549, 'bull_rsi_os': 34, 'bull_rsi_ob': 86, 'bull_adx_thresh': 30.89499342687621, 'bull_atr_min_pct': 0.0027441411579946697, 'bull_atr_max_pct': 0.022606334842972836, 'bull_tp_mult': 1.5358483792239574, 'bull_tsl_mult': 0.40414823494560287, 'bull_time_stop': 297, 'bull_use_sma': False, 'bull_use_ema': True, 'bull_use_atr': True, 'bull_use_adx': True, 'bull_use_spike': False, 'bull_rsi_required': False, 'bear_strategy': 'breakout', 'bear_bb_std_mult': 3.545372477233647, 'bear_rsi_os': 33, 'bear_rsi_ob': 51, 'bear_adx_thresh': 11.587634784021239, 'bear_atr_min_pct': 0.012809475563398977, 'bear_atr_max_pct': 0.05553357344178028, 'bear_tp_mult': 2.2412270313298794, 'bear_tsl_mult': 0.11386729199884701, 'bear_time_stop': 160, 'bear_use_sma': True, 'bear_use_ema': False, 'bear_use_atr': True, 'bear_use_adx': True, 'bear_use_spike': True, 'bear_rsi_required': True, 'sideways_strategy': 'breakout', 'sideways_bb_std_mult': 2.7517816109761912, 'sideways_rsi_os': 53, 'sideways_rsi_ob': 66, 'sideways_adx_thresh': 27.068467409113513, 'sideways_atr_min_pct': 0.0068576665815051185, 'sideways_atr_max_pct': 0.07079526801528499, 'sideways_tp_mult': 2.7539488451813594, 'sideways_tsl_mult': 0.5762488144669418, 'sideways_time_stop': 120, 'sideways_use_sma': True, 'sideways_use_ema': True, 'sideways_use_atr': False, 'sideways_use_adx': False, 'sideways_use_spike': True, 'sideways_rsi_required': False}.
[I 2025-09-01 14:14:42,711] Trial 481 finished with values: [-0.009007701273904933, 0.011957611357829443] and parameters: {'p_sma': 38, 'p_std': 49, 'p_atr': 27, 'p_adx': 11, 'rsi_period': 40, 'ema1': 20, 'ema2': 43, 'slip_atr_k': 0.006063888737384451, 'slip_spread_k': 0.05667824121720242, 'spread_hl_frac': 0.0286190480367373, 'bb_std_mult': 1.760727201695018, 'rsi_os': 37, 'rsi_ob': 83, 'vol_spike': 0.15710347100837957, 'adx_thresh': 31.50636193099724, 'atr_min_pct': 0.025649651552728296, 'atr_max_pct': 0.10550853963741971, 'tp_mult': 1.1598083010609923, 'tsl_mult': 0.3955337582385966, 'strategy': 'mean_reversion', 'time_stop': 234, 'use_sma': True, 'use_atr': False, 'use_adx': False, 'use_ema': True, 'use_spike': True, 'rsi_required': False, 'edge_k': 1.794630623777509, 'edge_cap': 0.9078401464369239, 'bull_strategy': 'breakout', 'bull_bb_std_mult': 3.1755260139008006, 'bull_rsi_os': 36, 'bull_rsi_ob': 72, 'bull_adx_thresh': 19.298234329697937, 'bull_atr_min_pct': 0.003613688458627621, 'bull_atr_max_pct': 0.025283351864086923, 'bull_tp_mult': 2.534729164261858, 'bull_tsl_mult': 0.4347974985519642, 'bull_time_stop': 149, 'bull_use_sma': True, 'bull_use_ema': False, 'bull_use_atr': True, 'bull_use_adx': True, 'bull_use_spike': False, 'bull_rsi_required': True, 'bear_strategy': 'breakout', 'bear_bb_std_mult': 3.5972113684779687, 'bear_rsi_os': 34, 'bear_rsi_ob': 87, 'bear_adx_thresh': 34.98010054698282, 'bear_atr_min_pct': 0.0035660803787185835, 'bear_atr_max_pct': 0.09778056748074648, 'bear_tp_mult': 1.821474259207459, 'bear_tsl_mult': 0.1628262106099315, 'bear_time_stop': 218, 'bear_use_sma': True, 'bear_use_ema': True, 'bear_use_atr': True, 'bear_use_adx': True, 'bear_use_spike': False, 'bear_rsi_required': True, 'sideways_strategy': 'mean_reversion', 'sideways_bb_std_mult': 1.542995109087376, 'sideways_rsi_os': 51, 'sideways_rsi_ob': 63, 'sideways_adx_thresh': 7.311045509615645, 'sideways_atr_min_pct': 0.019099566054506342, 'sideways_atr_max_pct': 0.05943636754789818, 'sideways_tp_mult': 2.7208696194832798, 'sideways_tsl_mult': 0.23037638731570056, 'sideways_time_stop': 163, 'sideways_use_sma': True, 'sideways_use_ema': False, 'sideways_use_atr': True, 'sideways_use_adx': True, 'sideways_use_spike': False, 'sideways_rsi_required': False}.
[I 2025-09-01 14:14:43,535] Trial 479 finished with values: [-1000000000.0, 1000000000.0] and parameters: {'p_sma': 38, 'p_std': 17, 'p_atr': 12, 'p_adx': 11, 'rsi_period': 64, 'ema1': 21, 'ema2': 16, 'slip_atr_k': 0.17901255780680642, 'slip_spread_k': 0.058405693246713505, 'spread_hl_frac': 0.01583279960121299, 'bb_std_mult': 2.052577277780441, 'rsi_os': 14, 'rsi_ob': 56, 'vol_spike': 0.15310805929975813, 'adx_thresh': 23.34984126701567, 'atr_min_pct': 0.000911862580140952, 'atr_max_pct': 0.14655444886558575, 'tp_mult': 2.7198018226030705, 'tsl_mult': 0.7715057911082409, 'strategy': 'mean_reversion', 'time_stop': 63, 'use_sma': True, 'use_atr': False, 'use_adx': False, 'use_ema': True, 'use_spike': True, 'rsi_required': True, 'edge_k': 1.801146897502739, 'edge_cap': 0.3174175087468982, 'bull_strategy': 'breakout', 'bull_bb_std_mult': 3.3545716819236384, 'bull_rsi_os': 32, 'bull_rsi_ob': 54, 'bull_adx_thresh': 30.88723759814462, 'bull_atr_min_pct': 0.020305896595706984, 'bull_atr_max_pct': 0.0935918855492209, 'bull_tp_mult': 2.9442421934589245, 'bull_tsl_mult': 0.43061688679085497, 'bull_time_stop': 111, 'bull_use_sma': False, 'bull_use_ema': False, 'bull_use_atr': True, 'bull_use_adx': True, 'bull_use_spike': False, 'bull_rsi_required': False, 'bear_strategy': 'breakout', 'bear_bb_std_mult': 2.307655396128535, 'bear_rsi_os': 15, 'bear_rsi_ob': 87, 'bear_adx_thresh': 31.83323884625098, 'bear_atr_min_pct': 0.003559581605630871, 'bear_atr_max_pct': 0.04378236598961877, 'bear_tp_mult': 2.2353795784495367, 'bear_tsl_mult': 0.11939867155555772, 'bear_time_stop': 214, 'bear_use_sma': True, 'bear_use_ema': False, 'bear_use_atr': True, 'bear_use_adx': True, 'bear_use_spike': False, 'bear_rsi_required': True, 'sideways_strategy': 'mean_reversion', 'sideways_bb_std_mult': 3.1751195805715393, 'sideways_rsi_os': 40, 'sideways_rsi_ob': 66, 'sideways_adx_thresh': 7.70388370744575, 'sideways_atr_min_pct': 0.01843544867973716, 'sideways_atr_max_pct': 0.03197782753912016, 'sideways_tp_mult': 2.8715251533495585, 'sideways_tsl_mult': 0.23297015173572433, 'sideways_time_stop': 120, 'sideways_use_sma': True, 'sideways_use_ema': True, 'sideways_use_atr': True, 'sideways_use_adx': False, 'sideways_use_spike': False, 'sideways_rsi_required': False}.
[I 2025-09-01 14:14:44,354] Trial 480 finished with values: [-1000000000.0, 1000000000.0] and parameters: {'p_sma': 27, 'p_std': 49, 'p_atr': 26, 'p_adx': 11, 'rsi_period': 50, 'ema1': 17, 'ema2': 16, 'slip_atr_k': 0.007470003940479538, 'slip_spread_k': 0.05834384795960961, 'spread_hl_frac': 0.04659866089912041, 'bb_std_mult': 2.0408836376285584, 'rsi_os': 29, 'rsi_ob': 83, 'vol_spike': 0.24958192310714378, 'adx_thresh': 23.753792858909968, 'atr_min_pct': 0.006076746195619851, 'atr_max_pct': 0.11338923332858696, 'tp_mult': 2.7123453398193917, 'tsl_mult': 0.7630848205442079, 'strategy': 'mean_reversion', 'time_stop': 236, 'use_sma': True, 'use_atr': False, 'use_adx': False, 'use_ema': True, 'use_spike': True, 'rsi_required': True, 'edge_k': 1.4320196255368038, 'edge_cap': 0.2476027505255478, 'bull_strategy': 'breakout', 'bull_bb_std_mult': 3.5298385929157723, 'bull_rsi_os': 36, 'bull_rsi_ob': 56, 'bull_adx_thresh': 19.19052977528966, 'bull_atr_min_pct': 0.0172304939013143, 'bull_atr_max_pct': 0.026340440949735568, 'bull_tp_mult': 2.9394204519515412, 'bull_tsl_mult': 0.4358562082100069, 'bull_time_stop': 78, 'bull_use_sma': False, 'bull_use_ema': False, 'bull_use_atr': True, 'bull_use_adx': True, 'bull_use_spike': False, 'bull_rsi_required': False, 'bear_strategy': 'breakout', 'bear_bb_std_mult': 3.510938539424873, 'bear_rsi_os': 53, 'bear_rsi_ob': 61, 'bear_adx_thresh': 23.03865478913423, 'bear_atr_min_pct': 0.025159225789644635, 'bear_atr_max_pct': 0.09663006776122159, 'bear_tp_mult': 2.234357647812748, 'bear_tsl_mult': 0.163279458398591, 'bear_time_stop': 215, 'bear_use_sma': True, 'bear_use_ema': False, 'bear_use_atr': True, 'bear_use_adx': True, 'bear_use_spike': False, 'bear_rsi_required': True, 'sideways_strategy': 'mean_reversion', 'sideways_bb_std_mult': 1.5414399118612672, 'sideways_rsi_os': 40, 'sideways_rsi_ob': 75, 'sideways_adx_thresh': 7.2711367137574525, 'sideways_atr_min_pct': 0.02158258347628191, 'sideways_atr_max_pct': 0.08243933321161329, 'sideways_tp_mult': 2.929921810296375, 'sideways_tsl_mult': 0.23353533053614633, 'sideways_time_stop': 182, 'sideways_use_sma': True, 'sideways_use_ema': True, 'sideways_use_atr': True, 'sideways_use_adx': False, 'sideways_use_spike': False, 'sideways_rsi_required': False}.
[I 2025-09-01 14:14:45,731] Trial 478 finished with values: [-0.05687972912453354, 0.056218676728209134] and parameters: {'p_sma': 37, 'p_std': 47, 'p_atr': 20, 'p_adx': 11, 'rsi_period': 64, 'ema1': 21, 'ema2': 17, 'slip_atr_k': 0.1998092290942869, 'slip_spread_k': 0.05409906944397454, 'spread_hl_frac': 0.04917163571332149, 'bb_std_mult': 1.6825010252088466, 'rsi_os': 16, 'rsi_ob': 79, 'vol_spike': 0.23490244876070826, 'adx_thresh': 13.800050528113474, 'atr_min_pct': 0.029974575653232367, 'atr_max_pct': 0.13813610125434755, 'tp_mult': 1.2780703844930212, 'tsl_mult': 0.7655382725537478, 'strategy': 'mean_reversion', 'time_stop': 233, 'use_sma': True, 'use_atr': False, 'use_adx': False, 'use_ema': True, 'use_spike': True, 'rsi_required': True, 'edge_k': 1.0226467116243545, 'edge_cap': 0.3606816209088168, 'bull_strategy': 'breakout', 'bull_bb_std_mult': 3.3343829377944543, 'bull_rsi_os': 36, 'bull_rsi_ob': 54, 'bull_adx_thresh': 30.8007868663695, 'bull_atr_min_pct': 0.020024708176153747, 'bull_atr_max_pct': 0.014664821730688756, 'bull_tp_mult': 1.6446853414268094, 'bull_tsl_mult': 0.4327169622246166, 'bull_time_stop': 96, 'bull_use_sma': False, 'bull_use_ema': False, 'bull_use_atr': True, 'bull_use_adx': True, 'bull_use_spike': False, 'bull_rsi_required': False, 'bear_strategy': 'breakout', 'bear_bb_std_mult': 1.436065227099457, 'bear_rsi_os': 46, 'bear_rsi_ob': 87, 'bear_adx_thresh': 34.3445822698301, 'bear_atr_min_pct': 0.0034970385791419528, 'bear_atr_max_pct': 0.04371910086090907, 'bear_tp_mult': 2.2472504179552724, 'bear_tsl_mult': 0.1641161446808074, 'bear_time_stop': 30, 'bear_use_sma': True, 'bear_use_ema': False, 'bear_use_atr': True, 'bear_use_adx': True, 'bear_use_spike': False, 'bear_rsi_required': True, 'sideways_strategy': 'breakout', 'sideways_bb_std_mult': 1.543939983762768, 'sideways_rsi_os': 53, 'sideways_rsi_ob': 62, 'sideways_adx_thresh': 7.489606637029413, 'sideways_atr_min_pct': 0.016682110893163123, 'sideways_atr_max_pct': 0.08284339324028532, 'sideways_tp_mult': 1.251426477461755, 'sideways_tsl_mult': 0.8295320145173133, 'sideways_time_stop': 175, 'sideways_use_sma': True, 'sideways_use_ema': True, 'sideways_use_atr': True, 'sideways_use_adx': False, 'sideways_use_spike': True, 'sideways_rsi_required': False}.
[I 2025-09-01 14:15:26,874] Trial 483 finished with values: [-0.019652251633659024, 0.019065606995307217] and parameters: {'p_sma': 30, 'p_std': 49, 'p_atr': 17, 'p_adx': 11, 'rsi_period': 62, 'ema1': 27, 'ema2': 17, 'slip_atr_k': 0.0063355627603952774, 'slip_spread_k': 0.851750532833191, 'spread_hl_frac': 0.03573342181713379, 'bb_std_mult': 2.6265841811444126, 'rsi_os': 44, 'rsi_ob': 63, 'vol_spike': 0.05885675714827171, 'adx_thresh': 25.674159215877452, 'atr_min_pct': 0.026538022491708814, 'atr_max_pct': 0.14304246704050214, 'tp_mult': 1.1616514897182535, 'tsl_mult': 0.9675323423822539, 'strategy': 'mean_reversion', 'time_stop': 234, 'use_sma': True, 'use_atr': False, 'use_adx': False, 'use_ema': True, 'use_spike': True, 'rsi_required': False, 'edge_k': 0.9963858116714414, 'edge_cap': 0.30509459620736806, 'bull_strategy': 'breakout', 'bull_bb_std_mult': 3.065436543985914, 'bull_rsi_os': 36, 'bull_rsi_ob': 57, 'bull_adx_thresh': 29.363908298979766, 'bull_atr_min_pct': 0.0054315131005133535, 'bull_atr_max_pct': 0.02928531847885507, 'bull_tp_mult': 1.6711380710349992, 'bull_tsl_mult': 0.03269932312105811, 'bull_time_stop': 147, 'bull_use_sma': True, 'bull_use_ema': False, 'bull_use_atr': True, 'bull_use_adx': True, 'bull_use_spike': False, 'bull_rsi_required': True, 'bear_strategy': 'breakout', 'bear_bb_std_mult': 3.5955212464710953, 'bear_rsi_os': 34, 'bear_rsi_ob': 61, 'bear_adx_thresh': 28.88342375435738, 'bear_atr_min_pct': 0.002268906182551838, 'bear_atr_max_pct': 0.11350092461232442, 'bear_tp_mult': 1.5874880601776193, 'bear_tsl_mult': 0.1460378807869322, 'bear_time_stop': 13, 'bear_use_sma': True, 'bear_use_ema': True, 'bear_use_atr': True, 'bear_use_adx': True, 'bear_use_spike': False, 'bear_rsi_required': True, 'sideways_strategy': 'breakout', 'sideways_bb_std_mult': 1.532047512282377, 'sideways_rsi_os': 51, 'sideways_rsi_ob': 62, 'sideways_adx_thresh': 7.18546554420762, 'sideways_atr_min_pct': 0.01749552812870592, 'sideways_atr_max_pct': 0.05915810600707588, 'sideways_tp_mult': 1.2473829704288777, 'sideways_tsl_mult': 0.2756657004510222, 'sideways_time_stop': 226, 'sideways_use_sma': True, 'sideways_use_ema': False, 'sideways_use_atr': True, 'sideways_use_adx': True, 'sideways_use_spike': False, 'sideways_rsi_required': True}.
[I 2025-09-01 14:15:27,784] Trial 484 finished with values: [-1000000000.0, 1000000000.0] and parameters: {'p_sma': 37, 'p_std': 47, 'p_atr': 27, 'p_adx': 29, 'rsi_period': 40, 'ema1': 16, 'ema2': 17, 'slip_atr_k': 0.017205960607914957, 'slip_spread_k': 0.4753710295188094, 'spread_hl_frac': 0.02908314911054642, 'bb_std_mult': 2.628490834368494, 'rsi_os': 44, 'rsi_ob': 85, 'vol_spike': 0.23417981145578595, 'adx_thresh': 6.858476206644422, 'atr_min_pct': 0.02651419138058312, 'atr_max_pct': 0.10598045729005917, 'tp_mult': 1.1671706787100302, 'tsl_mult': 0.7139468862210065, 'strategy': 'mean_reversion', 'time_stop': 232, 'use_sma': True, 'use_atr': False, 'use_adx': False, 'use_ema': True, 'use_spike': True, 'rsi_required': False, 'edge_k': 1.0240291350778423, 'edge_cap': 0.9127023940878041, 'bull_strategy': 'breakout', 'bull_bb_std_mult': 3.1974966841934287, 'bull_rsi_os': 39, 'bull_rsi_ob': 55, 'bull_adx_thresh': 29.328335564016363, 'bull_atr_min_pct': 0.012045247926835988, 'bull_atr_max_pct': 0.029523552575722513, 'bull_tp_mult': 2.4236281314722143, 'bull_tsl_mult': 0.38396679332917155, 'bull_time_stop': 66, 'bull_use_sma': True, 'bull_use_ema': True, 'bull_use_atr': True, 'bull_use_adx': True, 'bull_use_spike': False, 'bull_rsi_required': True, 'bear_strategy': 'breakout', 'bear_bb_std_mult': 1.2037141207319193, 'bear_rsi_os': 7, 'bear_rsi_ob': 87, 'bear_adx_thresh': 13.038822052792309, 'bear_atr_min_pct': 0.002073430677669799, 'bear_atr_max_pct': 0.11338260127501093, 'bear_tp_mult': 2.315248142808101, 'bear_tsl_mult': 0.15331378519965808, 'bear_time_stop': 130, 'bear_use_sma': True, 'bear_use_ema': True, 'bear_use_atr': True, 'bear_use_adx': True, 'bear_use_spike': False, 'bear_rsi_required': True, 'sideways_strategy': 'breakout', 'sideways_bb_std_mult': 1.5749661868707012, 'sideways_rsi_os': 51, 'sideways_rsi_ob': 71, 'sideways_adx_thresh': 23.833485975556755, 'sideways_atr_min_pct': 0.020180841685689836, 'sideways_atr_max_pct': 0.021037060738107995, 'sideways_tp_mult': 2.709016186297392, 'sideways_tsl_mult': 0.27519912383869466, 'sideways_time_stop': 87, 'sideways_use_sma': True, 'sideways_use_ema': False, 'sideways_use_atr': True, 'sideways_use_adx': True, 'sideways_use_spike': False, 'sideways_rsi_required': True}.
[I 2025-09-01 14:15:28,122] Trial 485 finished with values: [-1000000000.0, 1000000000.0] and parameters: {'p_sma': 34, 'p_std': 49, 'p_atr': 26, 'p_adx': 13, 'rsi_period': 40, 'ema1': 16, 'ema2': 20, 'slip_atr_k': 0.020227501031856974, 'slip_spread_k': 0.872319352190601, 'spread_hl_frac': 0.028680546882912075, 'bb_std_mult': 1.7797046096892424, 'rsi_os': 25, 'rsi_ob': 64, 'vol_spike': 0.03621933305294264, 'adx_thresh': 27.347193037485475, 'atr_min_pct': 0.026389219783082184, 'atr_max_pct': 0.14264816880174536, 'tp_mult': 1.1779833904118109, 'tsl_mult': 0.7099444480238558, 'strategy': 'mean_reversion', 'time_stop': 238, 'use_sma': True, 'use_atr': False, 'use_adx': False, 'use_ema': True, 'use_spike': True, 'rsi_required': False, 'edge_k': 0.7694769158982737, 'edge_cap': 0.30387719895726667, 'bull_strategy': 'breakout', 'bull_bb_std_mult': 1.079443697892234, 'bull_rsi_os': 39, 'bull_rsi_ob': 73, 'bull_adx_thresh': 29.464951673514445, 'bull_atr_min_pct': 0.0035954433510420646, 'bull_atr_max_pct': 0.047096717796660595, 'bull_tp_mult': 2.781762157960159, 'bull_tsl_mult': 0.36435348245500243, 'bull_time_stop': 150, 'bull_use_sma': True, 'bull_use_ema': True, 'bull_use_atr': True, 'bull_use_adx': True, 'bull_use_spike': False, 'bull_rsi_required': True, 'bear_strategy': 'breakout', 'bear_bb_std_mult': 3.5898712072896237, 'bear_rsi_os': 7, 'bear_rsi_ob': 65, 'bear_adx_thresh': 13.268984470688457, 'bear_atr_min_pct': 0.0022060963068219197, 'bear_atr_max_pct': 0.04182313427906061, 'bear_tp_mult': 1.7292860596873065, 'bear_tsl_mult': 0.1418074243047092, 'bear_time_stop': 36, 'bear_use_sma': True, 'bear_use_ema': True, 'bear_use_atr': True, 'bear_use_adx': True, 'bear_use_spike': False, 'bear_rsi_required': True, 'sideways_strategy': 'breakout', 'sideways_bb_std_mult': 1.6072621295995568, 'sideways_rsi_os': 51, 'sideways_rsi_ob': 58, 'sideways_adx_thresh': 6.873533795859936, 'sideways_atr_min_pct': 0.020430959310475894, 'sideways_atr_max_pct': 0.057230222703695946, 'sideways_tp_mult': 2.717595724745279, 'sideways_tsl_mult': 0.35273931939813663, 'sideways_time_stop': 97, 'sideways_use_sma': True, 'sideways_use_ema': False, 'sideways_use_atr': True, 'sideways_use_adx': True, 'sideways_use_spike': False, 'sideways_rsi_required': True}.
[I 2025-09-01 14:15:28,397] Trial 482 finished with values: [-1000000000.0, 1000000000.0] and parameters: {'p_sma': 27, 'p_std': 42, 'p_atr': 26, 'p_adx': 11, 'rsi_period': 40, 'ema1': 27, 'ema2': 17, 'slip_atr_k': 0.006203714825191832, 'slip_spread_k': 0.06442950616311455, 'spread_hl_frac': 0.03559274095873376, 'bb_std_mult': 1.768343903800694, 'rsi_os': 37, 'rsi_ob': 83, 'vol_spike': 0.15525619974097402, 'adx_thresh': 23.69516524170721, 'atr_min_pct': 0.026582237160177827, 'atr_max_pct': 0.1445203339473109, 'tp_mult': 2.7175651053263636, 'tsl_mult': 0.4648283116724108, 'strategy': 'mean_reversion', 'time_stop': 235, 'use_sma': True, 'use_atr': False, 'use_adx': False, 'use_ema': True, 'use_spike': True, 'rsi_required': False, 'edge_k': 0.7600869165047688, 'edge_cap': 0.7591778995506646, 'bull_strategy': 'breakout', 'bull_bb_std_mult': 3.526752192003981, 'bull_rsi_os': 36, 'bull_rsi_ob': 72, 'bull_adx_thresh': 29.15525377074625, 'bull_atr_min_pct': 0.0059343787539231745, 'bull_atr_max_pct': 0.029364982724244048, 'bull_tp_mult': 2.7977725029899743, 'bull_tsl_mult': 0.4322208215734397, 'bull_time_stop': 152, 'bull_use_sma': True, 'bull_use_ema': False, 'bull_use_atr': True, 'bull_use_adx': True, 'bull_use_spike': False, 'bull_rsi_required': True, 'bear_strategy': 'breakout', 'bear_bb_std_mult': 3.5930785002889594, 'bear_rsi_os': 34, 'bear_rsi_ob': 87, 'bear_adx_thresh': 22.965824846494165, 'bear_atr_min_pct': 0.0034969376282585284, 'bear_atr_max_pct': 0.04439783683973055, 'bear_tp_mult': 2.2989001409193954, 'bear_tsl_mult': 0.16375889551130185, 'bear_time_stop': 216, 'bear_use_sma': True, 'bear_use_ema': True, 'bear_use_atr': True, 'bear_use_adx': True, 'bear_use_spike': False, 'bear_rsi_required': True, 'sideways_strategy': 'mean_reversion', 'sideways_bb_std_mult': 1.5478027828811596, 'sideways_rsi_os': 5, 'sideways_rsi_ob': 71, 'sideways_adx_thresh': 34.93185295551332, 'sideways_atr_min_pct': 0.021365008671710307, 'sideways_atr_max_pct': 0.05846651696027602, 'sideways_tp_mult': 2.79279226908346, 'sideways_tsl_mult': 0.23750241092930385, 'sideways_time_stop': 164, 'sideways_use_sma': True, 'sideways_use_ema': False, 'sideways_use_atr': True, 'sideways_use_adx': True, 'sideways_use_spike': False, 'sideways_rsi_required': True}.
