[I 2025-09-01 13:13:42,805] Trial 78 finished with values: [-0.043371162425268284, 0.04313143725982173] and parameters: {'p_sma': 48, 'p_std': 43, 'p_atr': 28, 'p_adx': 8, 'rsi_period': 32, 'ema1': 16, 'ema2': 42, 'slip_atr_k': 0.15942269529401693, 'slip_spread_k': 0.6787891257843084, 'spread_hl_frac': 0.015437760807766966, 'bb_std_mult': 2.9235357107733404, 'rsi_os': 46, 'rsi_ob': 85, 'vol_spike': 0.05382825941732926, 'adx_thresh': 15.179609508899885, 'atr_min_pct': 0.0013981204709674182, 'atr_max_pct': 0.07214100875757595, 'tp_mult': 1.3299671152278485, 'tsl_mult': 0.14734859437423475, 'strategy': 'mean_reversion', 'time_stop': 85, 'use_sma': False, 'use_atr': False, 'use_adx': False, 'use_ema': True, 'use_spike': True, 'rsi_required': False, 'edge_k': 0.3258704888204289, 'edge_cap': 0.5485698255741263, 'bull_strategy': 'breakout', 'bull_bb_std_mult': 1.1135120599001604, 'bull_rsi_os': 15, 'bull_rsi_ob': 59, 'bull_adx_thresh': 12.135198525037762, 'bull_atr_min_pct': 0.0008111211715448876, 'bull_atr_max_pct': 0.03292397856869837, 'bull_tp_mult': 1.3057900717937696, 'bull_tsl_mult': 0.5551197999691061, 'bull_time_stop': 260, 'bull_use_sma': False, 'bull_use_ema': False, 'bull_use_atr': False, 'bull_use_adx': False, 'bull_use_spike': True, 'bull_rsi_required': True, 'bear_strategy': 'mean_reversion', 'bear_bb_std_mult': 3.572224114676156, 'bear_rsi_os': 15, 'bear_rsi_ob': 59, 'bear_adx_thresh': 5.967704269528227, 'bear_atr_min_pct': 0.02531651798922438, 'bear_atr_max_pct': 0.11158184678736155, 'bear_tp_mult': 1.1127907838687652, 'bear_tsl_mult': 0.21539003815236424, 'bear_time_stop': 227, 'bear_use_sma': False, 'bear_use_ema': True, 'bear_use_atr': True, 'bear_use_adx': False, 'bear_use_spike': True, 'bear_rsi_required': True, 'sideways_strategy': 'mean_reversion', 'sideways_bb_std_mult': 1.7626034115246874, 'sideways_rsi_os': 33, 'sideways_rsi_ob': 55, 'sideways_adx_thresh': 17.399081878698386, 'sideways_atr_min_pct': 0.02186821180665899, 'sideways_atr_max_pct': 0.06234011917163179, 'sideways_tp_mult': 2.9846299239850147, 'sideways_tsl_mult': 0.7687395429975413, 'sideways_time_stop': 117, 'sideways_use_sma': True, 'sideways_use_ema': True, 'sideways_use_atr': False, 'sideways_use_adx': False, 'sideways_use_spike': False, 'sideways_rsi_required': True}.
[I 2025-09-01 13:14:21,248] Trial 85 finished with values: [-0.05040260885867742, 0.05047674137526996] and parameters: {'p_sma': 31, 'p_std': 48, 'p_atr': 28, 'p_adx': 18, 'rsi_period': 25, 'ema1': 20, 'ema2': 50, 'slip_atr_k': 0.16157298848261928, 'slip_spread_k': 0.00025274197927432906, 'spread_hl_frac': 0.013212794738905248, 'bb_std_mult': 3.312792529105271, 'rsi_os': 34, 'rsi_ob': 90, 'vol_spike': 0.1534285130415877, 'adx_thresh': 14.256123010863703, 'atr_min_pct': 0.00327846900594103, 'atr_max_pct': 0.13425881878450496, 'tp_mult': 1.2757716140813804, 'tsl_mult': 0.08743166661099228, 'strategy': 'mean_reversion', 'time_stop': 39, 'use_sma': True, 'use_atr': True, 'use_adx': True, 'use_ema': True, 'use_spike': False, 'rsi_required': True, 'edge_k': 1.4101789838302154, 'edge_cap': 0.6637003746541079, 'bull_strategy': 'breakout', 'bull_bb_std_mult': 3.460513340332035, 'bull_rsi_os': 55, 'bull_rsi_ob': 55, 'bull_adx_thresh': 14.050353207512902, 'bull_atr_min_pct': 0.0020088210364222064, 'bull_atr_max_pct': 0.016026366391659275, 'bull_tp_mult': 2.897636747570159, 'bull_tsl_mult': 0.5743955059417561, 'bull_time_stop': 165, 'bull_use_sma': True, 'bull_use_ema': False, 'bull_use_atr': False, 'bull_use_adx': False, 'bull_use_spike': False, 'bull_rsi_required': True, 'bear_strategy': 'mean_reversion', 'bear_bb_std_mult': 1.7711511570260512, 'bear_rsi_os': 33, 'bear_rsi_ob': 52, 'bear_adx_thresh': 5.047629393267569, 'bear_atr_min_pct': 0.004012749206147489, 'bear_atr_max_pct': 0.1224399438364851, 'bear_tp_mult': 1.5741875131585799, 'bear_tsl_mult': 0.3913229590537905, 'bear_time_stop': 260, 'bear_use_sma': True, 'bear_use_ema': True, 'bear_use_atr': True, 'bear_use_adx': False, 'bear_use_spike': False, 'bear_rsi_required': False, 'sideways_strategy': 'mean_reversion', 'sideways_bb_std_mult': 2.8698175572910243, 'sideways_rsi_os': 14, 'sideways_rsi_ob': 52, 'sideways_adx_thresh': 9.442643207372669, 'sideways_atr_min_pct': 0.02809935012005697, 'sideways_atr_max_pct': 0.10464072518500253, 'sideways_tp_mult': 2.508476054175438, 'sideways_tsl_mult': 0.8552623188750783, 'sideways_time_stop': 239, 'sideways_use_sma': False, 'sideways_use_ema': False, 'sideways_use_atr': True, 'sideways_use_adx': False, 'sideways_use_spike': False, 'sideways_rsi_required': False}.
[I 2025-09-01 13:14:21,918] Trial 84 finished with values: [-0.062153283942642856, 0.061921323075890614] and parameters: {'p_sma': 27, 'p_std': 48, 'p_atr': 28, 'p_adx': 18, 'rsi_period': 13, 'ema1': 9, 'ema2': 53, 'slip_atr_k': 0.15032561425350965, 'slip_spread_k': 0.21103445575501834, 'spread_hl_frac': 0.026288607537642297, 'bb_std_mult': 2.450571951023133, 'rsi_os': 25, 'rsi_ob': 90, 'vol_spike': 0.04547543608026908, 'adx_thresh': 18.09223437343149, 'atr_min_pct': 0.00014281049951398936, 'atr_max_pct': 0.13677172032711443, 'tp_mult': 1.492754518305488, 'tsl_mult': 0.09912129258608478, 'strategy': 'breakout', 'time_stop': 299, 'use_sma': True, 'use_atr': True, 'use_adx': True, 'use_ema': True, 'use_spike': False, 'rsi_required': True, 'edge_k': 0.9878191373593477, 'edge_cap': 0.0935809474957463, 'bull_strategy': 'breakout', 'bull_bb_std_mult': 3.4364094475433813, 'bull_rsi_os': 55, 'bull_rsi_ob': 54, 'bull_adx_thresh': 27.567166888346236, 'bull_atr_min_pct': 1.8646281242634417e-05, 'bull_atr_max_pct': 0.014479849129231653, 'bull_tp_mult': 1.8545059146622964, 'bull_tsl_mult': 0.5712450550684129, 'bull_time_stop': 280, 'bull_use_sma': True, 'bull_use_ema': True, 'bull_use_atr': True, 'bull_use_adx': False, 'bull_use_spike': False, 'bull_rsi_required': True, 'bear_strategy': 'mean_reversion', 'bear_bb_std_mult': 1.567794140583057, 'bear_rsi_os': 20, 'bear_rsi_ob': 47, 'bear_adx_thresh': 5.002386875248306, 'bear_atr_min_pct': 0.0039025496225247383, 'bear_atr_max_pct': 0.026858299248347962, 'bear_tp_mult': 2.9623755105854914, 'bear_tsl_mult': 0.37297814409946106, 'bear_time_stop': 184, 'bear_use_sma': True, 'bear_use_ema': False, 'bear_use_atr': True, 'bear_use_adx': False, 'bear_use_spike': False, 'bear_rsi_required': False, 'sideways_strategy': 'mean_reversion', 'sideways_bb_std_mult': 2.840370012167993, 'sideways_rsi_os': 14, 'sideways_rsi_ob': 52, 'sideways_adx_thresh': 25.28961247840636, 'sideways_atr_min_pct': 0.027935093410017344, 'sideways_atr_max_pct': 0.10437054357137224, 'sideways_tp_mult': 2.7721774874522516, 'sideways_tsl_mult': 0.645450933458051, 'sideways_time_stop': 60, 'sideways_use_sma': False, 'sideways_use_ema': False, 'sideways_use_atr': True, 'sideways_use_adx': False, 'sideways_use_spike': False, 'sideways_rsi_required': True}.
[I 2025-09-01 13:14:22,501] Trial 83 finished with values: [-1000000000.0, 1000000000.0] and parameters: {'p_sma': 27, 'p_std': 43, 'p_atr': 28, 'p_adx': 18, 'rsi_period': 24, 'ema1': 10, 'ema2': 10, 'slip_atr_k': 0.054568871331258234, 'slip_spread_k': 0.4755467571049676, 'spread_hl_frac': 0.025762724088786666, 'bb_std_mult': 3.3680686459714555, 'rsi_os': 46, 'rsi_ob': 64, 'vol_spike': 0.04460224872622437, 'adx_thresh': 18.093747063525626, 'atr_min_pct': 0.003359621399925951, 'atr_max_pct': 0.13251275141775778, 'tp_mult': 1.9805759241684708, 'tsl_mult': 0.10435465027116149, 'strategy': 'breakout', 'time_stop': 38, 'use_sma': True, 'use_atr': True, 'use_adx': True, 'use_ema': True, 'use_spike': False, 'rsi_required': True, 'edge_k': 1.8662815082075834, 'edge_cap': 0.09886187120643825, 'bull_strategy': 'breakout', 'bull_bb_std_mult': 3.033256563131936, 'bull_rsi_os': 22, 'bull_rsi_ob': 55, 'bull_adx_thresh': 27.245318237133784, 'bull_atr_min_pct': 0.0065536024747151825, 'bull_atr_max_pct': 0.010040772683296001, 'bull_tp_mult': 1.8748454362236744, 'bull_tsl_mult': 0.5387698568104761, 'bull_time_stop': 141, 'bull_use_sma': True, 'bull_use_ema': True, 'bull_use_atr': True, 'bull_use_adx': False, 'bull_use_spike': False, 'bull_rsi_required': True, 'bear_strategy': 'mean_reversion', 'bear_bb_std_mult': 1.7662807982973363, 'bear_rsi_os': 20, 'bear_rsi_ob': 52, 'bear_adx_thresh': 6.590710968521089, 'bear_atr_min_pct': 0.02498660138634253, 'bear_atr_max_pct': 0.1457337611915012, 'bear_tp_mult': 2.9466897867351345, 'bear_tsl_mult': 0.38610778523994366, 'bear_time_stop': 58, 'bear_use_sma': True, 'bear_use_ema': False, 'bear_use_atr': True, 'bear_use_adx': False, 'bear_use_spike': False, 'bear_rsi_required': False, 'sideways_strategy': 'mean_reversion', 'sideways_bb_std_mult': 2.406757401745195, 'sideways_rsi_os': 49, 'sideways_rsi_ob': 52, 'sideways_adx_thresh': 24.72872835068838, 'sideways_atr_min_pct': 0.028245936622093425, 'sideways_atr_max_pct': 0.10426148922073454, 'sideways_tp_mult': 2.7350150743932717, 'sideways_tsl_mult': 0.2649650721083394, 'sideways_time_stop': 237, 'sideways_use_sma': False, 'sideways_use_ema': False, 'sideways_use_atr': True, 'sideways_use_adx': False, 'sideways_use_spike': False, 'sideways_rsi_required': True}.
[I 2025-09-01 13:14:22,748] Trial 82 finished with values: [-1000000000.0, 1000000000.0] and parameters: {'p_sma': 41, 'p_std': 43, 'p_atr': 28, 'p_adx': 16, 'rsi_period': 35, 'ema1': 25, 'ema2': 10, 'slip_atr_k': 0.20386012745599258, 'slip_spread_k': 0.34654834704416904, 'spread_hl_frac': 0.0017424817558601112, 'bb_std_mult': 1.580017086180751, 'rsi_os': 35, 'rsi_ob': 65, 'vol_spike': 0.15652797199587923, 'adx_thresh': 18.49568128950366, 'atr_min_pct': 0.005236366342353329, 'atr_max_pct': 0.06345561892338317, 'tp_mult': 1.2773419271363406, 'tsl_mult': 0.14945026491222574, 'strategy': 'breakout', 'time_stop': 105, 'use_sma': True, 'use_atr': True, 'use_adx': True, 'use_ema': True, 'use_spike': False, 'rsi_required': True, 'edge_k': 1.211871945741464, 'edge_cap': 0.5809267512622496, 'bull_strategy': 'breakout', 'bull_bb_std_mult': 1.0664310088316051, 'bull_rsi_os': 8, 'bull_rsi_ob': 83, 'bull_adx_thresh': 10.640119273426805, 'bull_atr_min_pct': 0.006599542966530323, 'bull_atr_max_pct': 0.014152390374506694, 'bull_tp_mult': 1.879868672664104, 'bull_tsl_mult': 0.5743134035985877, 'bull_time_stop': 242, 'bull_use_sma': True, 'bull_use_ema': True, 'bull_use_atr': True, 'bull_use_adx': False, 'bull_use_spike': True, 'bull_rsi_required': True, 'bear_strategy': 'mean_reversion', 'bear_bb_std_mult': 1.8137529452755516, 'bear_rsi_os': 40, 'bear_rsi_ob': 64, 'bear_adx_thresh': 33.09947419916264, 'bear_atr_min_pct': 0.003861402418588589, 'bear_atr_max_pct': 0.11398919018157873, 'bear_tp_mult': 1.1662714602300568, 'bear_tsl_mult': 0.38527469713066664, 'bear_time_stop': 189, 'bear_use_sma': True, 'bear_use_ema': False, 'bear_use_atr': True, 'bear_use_adx': False, 'bear_use_spike': True, 'bear_rsi_required': False, 'sideways_strategy': 'mean_reversion', 'sideways_bb_std_mult': 2.8597530921924923, 'sideways_rsi_os': 14, 'sideways_rsi_ob': 50, 'sideways_adx_thresh': 21.69785345410564, 'sideways_atr_min_pct': 0.028275102948192285, 'sideways_atr_max_pct': 0.10406823603609408, 'sideways_tp_mult': 2.3076813498519577, 'sideways_tsl_mult': 0.271217688603979, 'sideways_time_stop': 30, 'sideways_use_sma': False, 'sideways_use_ema': False, 'sideways_use_atr': False, 'sideways_use_adx': False, 'sideways_use_spike': False, 'sideways_rsi_required': True}.
[I 2025-09-01 13:14:23,095] Trial 89 finished with values: [-1000000000.0, 1000000000.0] and parameters: {'p_sma': 36, 'p_std': 9, 'p_atr': 15, 'p_adx': 28, 'rsi_period': 40, 'ema1': 22, 'ema2': 29, 'slip_atr_k': 0.17136392837599718, 'slip_spread_k': 0.5835071119858163, 'spread_hl_frac': 0.01825675031855727, 'bb_std_mult': 0.595378082723252, 'rsi_os': 50, 'rsi_ob': 94, 'vol_spike': 0.03684757285031032, 'adx_thresh': 19.707457857544686, 'atr_min_pct': 0.015198706149235906, 'atr_max_pct': 0.0803458406877996, 'tp_mult': 2.1708940343640175, 'tsl_mult': 0.028171564080595166, 'strategy': 'mean_reversion', 'time_stop': 250, 'use_sma': True, 'use_atr': True, 'use_adx': False, 'use_ema': True, 'use_spike': True, 'rsi_required': False, 'edge_k': 0.10238991170187975, 'edge_cap': 0.49500773577216606, 'bull_strategy': 'breakout', 'bull_bb_std_mult': 2.3498564696370345, 'bull_rsi_os': 47, 'bull_rsi_ob': 76, 'bull_adx_thresh': 11.531570337659488, 'bull_atr_min_pct': 0.028511211057665575, 'bull_atr_max_pct': 0.022973283812991678, 'bull_tp_mult': 1.7336072356692545, 'bull_tsl_mult': 0.6422388676223417, 'bull_time_stop': 130, 'bull_use_sma': True, 'bull_use_ema': False, 'bull_use_atr': False, 'bull_use_adx': False, 'bull_use_spike': False, 'bull_rsi_required': True, 'bear_strategy': 'breakout', 'bear_bb_std_mult': 1.4030288404603142, 'bear_rsi_os': 23, 'bear_rsi_ob': 54, 'bear_adx_thresh': 13.146197962853346, 'bear_atr_min_pct': 0.020544113393902448, 'bear_atr_max_pct': 0.1165775876561729, 'bear_tp_mult': 2.5094327121307716, 'bear_tsl_mult': 0.6027799064725021, 'bear_time_stop': 138, 'bear_use_sma': False, 'bear_use_ema': True, 'bear_use_atr': True, 'bear_use_adx': False, 'bear_use_spike': False, 'bear_rsi_required': True, 'sideways_strategy': 'breakout', 'sideways_bb_std_mult': 0.5953871937316394, 'sideways_rsi_os': 38, 'sideways_rsi_ob': 45, 'sideways_adx_thresh': 17.095997394809284, 'sideways_atr_min_pct': 0.029999180084832648, 'sideways_atr_max_pct': 0.0966797885104098, 'sideways_tp_mult': 2.910840518592445, 'sideways_tsl_mult': 0.745601576003583, 'sideways_time_stop': 41, 'sideways_use_sma': True, 'sideways_use_ema': False, 'sideways_use_atr': True, 'sideways_use_adx': True, 'sideways_use_spike': False, 'sideways_rsi_required': False}.
[I 2025-09-01 13:14:23,102] Trial 88 finished with values: [-1000000000.0, 1000000000.0] and parameters: {'p_sma': 36, 'p_std': 32, 'p_atr': 9, 'p_adx': 28, 'rsi_period': 35, 'ema1': 12, 'ema2': 23, 'slip_atr_k': 0.17302690492433742, 'slip_spread_k': 0.8826225022068557, 'spread_hl_frac': 0.017845588078113643, 'bb_std_mult': 2.93455461199575, 'rsi_os': 50, 'rsi_ob': 93, 'vol_spike': 0.03545773857260738, 'adx_thresh': 19.113036370190393, 'atr_min_pct': 0.005098729778106813, 'atr_max_pct': 0.08092699864660306, 'tp_mult': 1.2932934451129827, 'tsl_mult': 0.33946963137826275, 'strategy': 'mean_reversion', 'time_stop': 63, 'use_sma': True, 'use_atr': True, 'use_adx': False, 'use_ema': True, 'use_spike': True, 'rsi_required': False, 'edge_k': 0.11236458936973659, 'edge_cap': 0.4408404942315336, 'bull_strategy': 'breakout', 'bull_bb_std_mult': 1.3683586525853788, 'bull_rsi_os': 47, 'bull_rsi_ob': 77, 'bull_adx_thresh': 31.96569538371989, 'bull_atr_min_pct': 0.005377081220586221, 'bull_atr_max_pct': 0.021944438645185232, 'bull_tp_mult': 1.4985066250155679, 'bull_tsl_mult': 0.6430914919788278, 'bull_time_stop': 126, 'bull_use_sma': True, 'bull_use_ema': False, 'bull_use_atr': False, 'bull_use_adx': False, 'bull_use_spike': False, 'bull_rsi_required': True, 'bear_strategy': 'mean_reversion', 'bear_bb_std_mult': 2.931723267757639, 'bear_rsi_os': 37, 'bear_rsi_ob': 64, 'bear_adx_thresh': 13.136748333670656, 'bear_atr_min_pct': 0.027427049971291223, 'bear_atr_max_pct': 0.11440494662468886, 'bear_tp_mult': 1.645575072929788, 'bear_tsl_mult': 0.6119090150169922, 'bear_time_stop': 124, 'bear_use_sma': True, 'bear_use_ema': True, 'bear_use_atr': True, 'bear_use_adx': False, 'bear_use_spike': False, 'bear_rsi_required': True, 'sideways_strategy': 'breakout', 'sideways_bb_std_mult': 0.6072023757071059, 'sideways_rsi_os': 43, 'sideways_rsi_ob': 46, 'sideways_adx_thresh': 16.678931213994854, 'sideways_atr_min_pct': 0.014801645713249158, 'sideways_atr_max_pct': 0.0986057875068173, 'sideways_tp_mult': 2.1873166448050974, 'sideways_tsl_mult': 0.7351692663942136, 'sideways_time_stop': 171, 'sideways_use_sma': True, 'sideways_use_ema': False, 'sideways_use_atr': True, 'sideways_use_adx': False, 'sideways_use_spike': False, 'sideways_rsi_required': True}.
[I 2025-09-01 13:15:02,660] Trial 86 finished with values: [-1000000000.0, 1000000000.0] and parameters: {'p_sma': 41, 'p_std': 33, 'p_atr': 28, 'p_adx': 28, 'rsi_period': 14, 'ema1': 25, 'ema2': 53, 'slip_atr_k': 0.17134576828978987, 'slip_spread_k': 0.47989645794590796, 'spread_hl_frac': 0.018006284942056375, 'bb_std_mult': 1.964759887294202, 'rsi_os': 46, 'rsi_ob': 93, 'vol_spike': 0.03269215247357404, 'adx_thresh': 18.204626878987547, 'atr_min_pct': 4.315314536253211e-05, 'atr_max_pct': 0.07824959039115173, 'tp_mult': 1.9638367884809664, 'tsl_mult': 0.09881027558450785, 'strategy': 'mean_reversion', 'time_stop': 295, 'use_sma': True, 'use_atr': True, 'use_adx': False, 'use_ema': True, 'use_spike': False, 'rsi_required': True, 'edge_k': 0.1825076630119545, 'edge_cap': 0.0797397205508566, 'bull_strategy': 'breakout', 'bull_bb_std_mult': 1.394796214335949, 'bull_rsi_os': 8, 'bull_rsi_ob': 76, 'bull_adx_thresh': 26.99321984627816, 'bull_atr_min_pct': 0.006577994654208358, 'bull_atr_max_pct': 0.023524442366443795, 'bull_tp_mult': 1.8576576730252534, 'bull_tsl_mult': 0.6427697378391005, 'bull_time_stop': 290, 'bull_use_sma': True, 'bull_use_ema': False, 'bull_use_atr': False, 'bull_use_adx': False, 'bull_use_spike': False, 'bull_rsi_required': True, 'bear_strategy': 'mean_reversion', 'bear_bb_std_mult': 2.915688106572528, 'bear_rsi_os': 19, 'bear_rsi_ob': 47, 'bear_adx_thresh': 13.32460705190869, 'bear_atr_min_pct': 0.012791843216545532, 'bear_atr_max_pct': 0.11538510968494069, 'bear_tp_mult': 2.02837104829757, 'bear_tsl_mult': 0.37095865835149733, 'bear_time_stop': 138, 'bear_use_sma': True, 'bear_use_ema': False, 'bear_use_atr': True, 'bear_use_adx': False, 'bear_use_spike': False, 'bear_rsi_required': False, 'sideways_strategy': 'mean_reversion', 'sideways_bb_std_mult': 2.4031662166897347, 'sideways_rsi_os': 48, 'sideways_rsi_ob': 50, 'sideways_adx_thresh': 24.399060935992832, 'sideways_atr_min_pct': 0.0296367558656251, 'sideways_atr_max_pct': 0.09640592315684161, 'sideways_tp_mult': 2.354648968078407, 'sideways_tsl_mult': 0.8085434173795822, 'sideways_time_stop': 61, 'sideways_use_sma': False, 'sideways_use_ema': False, 'sideways_use_atr': True, 'sideways_use_adx': False, 'sideways_use_spike': False, 'sideways_rsi_required': True}.
[I 2025-09-01 13:15:04,319] Trial 87 finished with values: [-1000000000.0, 1000000000.0] and parameters: {'p_sma': 42, 'p_std': 42, 'p_atr': 8, 'p_adx': 29, 'rsi_period': 41, 'ema1': 23, 'ema2': 23, 'slip_atr_k': 0.16043786337578092, 'slip_spread_k': 0.5874506433881559, 'spread_hl_frac': 0.0180330992058576, 'bb_std_mult': 1.9706825960866206, 'rsi_os': 46, 'rsi_ob': 65, 'vol_spike': 0.11978691679223717, 'adx_thresh': 19.41135025491974, 'atr_min_pct': 0.005145057834839355, 'atr_max_pct': 0.06301371958664095, 'tp_mult': 1.9684962361596865, 'tsl_mult': 0.3371832998966223, 'strategy': 'mean_reversion', 'time_stop': 252, 'use_sma': True, 'use_atr': True, 'use_adx': False, 'use_ema': True, 'use_spike': False, 'rsi_required': True, 'edge_k': 0.08448594132628612, 'edge_cap': 0.28040710829599863, 'bull_strategy': 'breakout', 'bull_bb_std_mult': 1.4435221384082777, 'bull_rsi_os': 47, 'bull_rsi_ob': 85, 'bull_adx_thresh': 32.09377428227518, 'bull_atr_min_pct': 0.020103812703282153, 'bull_atr_max_pct': 0.022522146014780697, 'bull_tp_mult': 1.745486677029275, 'bull_tsl_mult': 0.5495643792809614, 'bull_time_stop': 127, 'bull_use_sma': True, 'bull_use_ema': False, 'bull_use_atr': False, 'bull_use_adx': False, 'bull_use_spike': False, 'bull_rsi_required': True, 'bear_strategy': 'mean_reversion', 'bear_bb_std_mult': 1.40308507855809, 'bear_rsi_os': 52, 'bear_rsi_ob': 64, 'bear_adx_thresh': 13.419404655124248, 'bear_atr_min_pct': 0.012693806342630488, 'bear_atr_max_pct': 0.11172068173251554, 'bear_tp_mult': 1.795519524281251, 'bear_tsl_mult': 0.5709535374135197, 'bear_time_stop': 139, 'bear_use_sma': True, 'bear_use_ema': True, 'bear_use_atr': True, 'bear_use_adx': False, 'bear_use_spike': False, 'bear_rsi_required': False, 'sideways_strategy': 'mean_reversion', 'sideways_bb_std_mult': 1.8825293117674158, 'sideways_rsi_os': 47, 'sideways_rsi_ob': 49, 'sideways_adx_thresh': 17.12122980654845, 'sideways_atr_min_pct': 0.029566336343681367, 'sideways_atr_max_pct': 0.08423987311575151, 'sideways_tp_mult': 2.319816282023672, 'sideways_tsl_mult': 0.7163728186294667, 'sideways_time_stop': 29, 'sideways_use_sma': False, 'sideways_use_ema': False, 'sideways_use_atr': True, 'sideways_use_adx': False, 'sideways_use_spike': False, 'sideways_rsi_required': True}.
