[I 2025-09-01 14:03:27,795] Trial 405 finished with values: [-0.05756179087631608, 0.05691564873679705] and parameters: {'p_sma': 37, 'p_std': 46, 'p_atr': 25, 'p_adx': 10, 'rsi_period': 9, 'ema1': 15, 'ema2': 33, 'slip_atr_k': 0.2044155549790589, 'slip_spread_k': 0.303363882518352, 'spread_hl_frac': 0.005452795986471626, 'bb_std_mult': 3.07347915940096, 'rsi_os': 15, 'rsi_ob': 84, 'vol_spike': 0.23571456903177523, 'adx_thresh': 18.285470315861204, 'atr_min_pct': 0.020857343955071307, 'atr_max_pct': 0.13122698426797277, 'tp_mult': 2.2256108336061393, 'tsl_mult': 0.7686047290783382, 'strategy': 'mean_reversion', 'time_stop': 235, 'use_sma': False, 'use_atr': False, 'use_adx': False, 'use_ema': False, 'use_spike': False, 'rsi_required': False, 'edge_k': 0.9333922401947264, 'edge_cap': 0.17700852838828807, 'bull_strategy': 'mean_reversion', 'bull_bb_std_mult': 3.26361320964058, 'bull_rsi_os': 32, 'bull_rsi_ob': 88, 'bull_adx_thresh': 30.319748318218345, 'bull_atr_min_pct': 0.01170102558423021, 'bull_atr_max_pct': 0.018088702098260884, 'bull_tp_mult': 2.8697819891196605, 'bull_tsl_mult': 0.43305993022173234, 'bull_time_stop': 100, 'bull_use_sma': False, 'bull_use_ema': False, 'bull_use_atr': True, 'bull_use_adx': True, 'bull_use_spike': False, 'bull_rsi_required': True, 'bear_strategy': 'breakout', 'bear_bb_std_mult': 1.4291376097533965, 'bear_rsi_os': 48, 'bear_rsi_ob': 86, 'bear_adx_thresh': 10.833980948727179, 'bear_atr_min_pct': 0.0034730422854255248, 'bear_atr_max_pct': 0.02113832650977817, 'bear_tp_mult': 1.0868258152986292, 'bear_tsl_mult': 0.778726874320613, 'bear_time_stop': 137, 'bear_use_sma': True, 'bear_use_ema': True, 'bear_use_atr': True, 'bear_use_adx': False, 'bear_use_spike': True, 'bear_rsi_required': False, 'sideways_strategy': 'breakout', 'sideways_bb_std_mult': 1.6203329808277207, 'sideways_rsi_os': 37, 'sideways_rsi_ob': 52, 'sideways_adx_thresh': 7.011815682144148, 'sideways_atr_min_pct': 0.01877300741610975, 'sideways_atr_max_pct': 0.07292551469451386, 'sideways_tp_mult': 2.6034498047127834, 'sideways_tsl_mult': 0.4129640270389867, 'sideways_time_stop': 61, 'sideways_use_sma': False, 'sideways_use_ema': True, 'sideways_use_atr': False, 'sideways_use_adx': False, 'sideways_use_spike': True, 'sideways_rsi_required': False}.
[I 2025-09-01 14:03:28,163] Trial 406 finished with values: [-1000000000.0, 1000000000.0] and parameters: {'p_sma': 17, 'p_std': 52, 'p_atr': 25, 'p_adx': 15, 'rsi_period': 70, 'ema1': 21, 'ema2': 21, 'slip_atr_k': 0.012203829481540364, 'slip_spread_k': 0.9087846721850603, 'spread_hl_frac': 0.0024564831183431233, 'bb_std_mult': 1.9040041280855335, 'rsi_os': 37, 'rsi_ob': 71, 'vol_spike': 0.010321029989449004, 'adx_thresh': 27.051608905843803, 'atr_min_pct': 0.017200222826500355, 'atr_max_pct': 0.13791085214619248, 'tp_mult': 1.0454265863778616, 'tsl_mult': 0.7101600543436546, 'strategy': 'mean_reversion', 'time_stop': 73, 'use_sma': False, 'use_atr': False, 'use_adx': False, 'use_ema': False, 'use_spike': False, 'rsi_required': False, 'edge_k': 0.6092077821792032, 'edge_cap': 0.35434526864830884, 'bull_strategy': 'mean_reversion', 'bull_bb_std_mult': 3.183961711077731, 'bull_rsi_os': 32, 'bull_rsi_ob': 55, 'bull_adx_thresh': 30.880935375331372, 'bull_atr_min_pct': 0.0033816195796817486, 'bull_atr_max_pct': 0.023709601657123477, 'bull_tp_mult': 1.6692510725590362, 'bull_tsl_mult': 0.21708952213171528, 'bull_time_stop': 100, 'bull_use_sma': False, 'bull_use_ema': False, 'bull_use_atr': True, 'bull_use_adx': False, 'bull_use_spike': False, 'bull_rsi_required': False, 'bear_strategy': 'mean_reversion', 'bear_bb_std_mult': 0.5029420539990337, 'bear_rsi_os': 31, 'bear_rsi_ob': 86, 'bear_adx_thresh': 10.668414439685874, 'bear_atr_min_pct': 0.003559355191095883, 'bear_atr_max_pct': 0.03175399726332755, 'bear_tp_mult': 2.7962126066453306, 'bear_tsl_mult': 0.18111731573718653, 'bear_time_stop': 170, 'bear_use_sma': True, 'bear_use_ema': True, 'bear_use_atr': True, 'bear_use_adx': False, 'bear_use_spike': True, 'bear_rsi_required': False, 'sideways_strategy': 'breakout', 'sideways_bb_std_mult': 1.6300395308241895, 'sideways_rsi_os': 8, 'sideways_rsi_ob': 69, 'sideways_adx_thresh': 9.761055646013933, 'sideways_atr_min_pct': 0.01809207268642841, 'sideways_atr_max_pct': 0.05935269507588365, 'sideways_tp_mult': 2.855464965379756, 'sideways_tsl_mult': 0.41400564156705827, 'sideways_time_stop': 170, 'sideways_use_sma': False, 'sideways_use_ema': True, 'sideways_use_atr': False, 'sideways_use_adx': False, 'sideways_use_spike': False, 'sideways_rsi_required': False}.
[I 2025-09-01 14:03:30,159] Trial 407 finished with values: [-1000000000.0, 1000000000.0] and parameters: {'p_sma': 32, 'p_std': 52, 'p_atr': 24, 'p_adx': 9, 'rsi_period': 67, 'ema1': 21, 'ema2': 36, 'slip_atr_k': 0.01300471091204286, 'slip_spread_k': 0.24717243627299312, 'spread_hl_frac': 0.04993252528509373, 'bb_std_mult': 1.8440522248482372, 'rsi_os': 37, 'rsi_ob': 86, 'vol_spike': 0.20802579272530863, 'adx_thresh': 29.077365598862663, 'atr_min_pct': 0.020691350751549688, 'atr_max_pct': 0.1375457748559452, 'tp_mult': 1.2543862896278315, 'tsl_mult': 0.9442916640996424, 'strategy': 'mean_reversion', 'time_stop': 234, 'use_sma': False, 'use_atr': False, 'use_adx': False, 'use_ema': False, 'use_spike': False, 'rsi_required': True, 'edge_k': 0.9377290987852857, 'edge_cap': 0.3489871967501469, 'bull_strategy': 'mean_reversion', 'bull_bb_std_mult': 2.6431736589045425, 'bull_rsi_os': 37, 'bull_rsi_ob': 55, 'bull_adx_thresh': 29.81170993619323, 'bull_atr_min_pct': 0.009094855666716598, 'bull_atr_max_pct': 0.018946626608162376, 'bull_tp_mult': 1.4713933638992192, 'bull_tsl_mult': 0.43630849104100483, 'bull_time_stop': 188, 'bull_use_sma': False, 'bull_use_ema': False, 'bull_use_atr': False, 'bull_use_adx': True, 'bull_use_spike': False, 'bull_rsi_required': False, 'bear_strategy': 'mean_reversion', 'bear_bb_std_mult': 1.8009641889706423, 'bear_rsi_os': 26, 'bear_rsi_ob': 80, 'bear_adx_thresh': 10.698104480952539, 'bear_atr_min_pct': 0.00431439727031974, 'bear_atr_max_pct': 0.03318934811814711, 'bear_tp_mult': 2.2360201464938374, 'bear_tsl_mult': 0.1802694322285036, 'bear_time_stop': 137, 'bear_use_sma': True, 'bear_use_ema': True, 'bear_use_atr': True, 'bear_use_adx': False, 'bear_use_spike': False, 'bear_rsi_required': False, 'sideways_strategy': 'mean_reversion', 'sideways_bb_std_mult': 1.5256204084752418, 'sideways_rsi_os': 49, 'sideways_rsi_ob': 67, 'sideways_adx_thresh': 6.716448155702343, 'sideways_atr_min_pct': 0.023564149045133015, 'sideways_atr_max_pct': 0.02772298505511838, 'sideways_tp_mult': 1.8502381245163322, 'sideways_tsl_mult': 0.7033987961449242, 'sideways_time_stop': 170, 'sideways_use_sma': False, 'sideways_use_ema': True, 'sideways_use_atr': True, 'sideways_use_adx': False, 'sideways_use_spike': False, 'sideways_rsi_required': False}.
[I 2025-09-01 14:03:30,327] Trial 408 finished with values: [-1000000000.0, 1000000000.0] and parameters: {'p_sma': 33, 'p_std': 48, 'p_atr': 24, 'p_adx': 9, 'rsi_period': 20, 'ema1': 15, 'ema2': 31, 'slip_atr_k': 0.20765375536246392, 'slip_spread_k': 0.6719736981417143, 'spread_hl_frac': 0.02802031581317085, 'bb_std_mult': 3.3762507115032028, 'rsi_os': 15, 'rsi_ob': 84, 'vol_spike': 0.23542999799540895, 'adx_thresh': 29.957148887850927, 'atr_min_pct': 0.020005567811955588, 'atr_max_pct': 0.13786605965030382, 'tp_mult': 2.184949959079476, 'tsl_mult': 0.9284314474818905, 'strategy': 'mean_reversion', 'time_stop': 74, 'use_sma': False, 'use_atr': False, 'use_adx': False, 'use_ema': True, 'use_spike': False, 'rsi_required': True, 'edge_k': 0.934873497341225, 'edge_cap': 0.538126699321875, 'bull_strategy': 'mean_reversion', 'bull_bb_std_mult': 3.1538593473420464, 'bull_rsi_os': 35, 'bull_rsi_ob': 54, 'bull_adx_thresh': 31.02803829461816, 'bull_atr_min_pct': 0.0032044440996643244, 'bull_atr_max_pct': 0.023949235302747115, 'bull_tp_mult': 2.869553292008996, 'bull_tsl_mult': 0.4153012821433402, 'bull_time_stop': 185, 'bull_use_sma': False, 'bull_use_ema': False, 'bull_use_atr': False, 'bull_use_adx': True, 'bull_use_spike': False, 'bull_rsi_required': False, 'bear_strategy': 'mean_reversion', 'bear_bb_std_mult': 3.5043733699953434, 'bear_rsi_os': 32, 'bear_rsi_ob': 85, 'bear_adx_thresh': 33.806064331525974, 'bear_atr_min_pct': 0.001224790620586976, 'bear_atr_max_pct': 0.11715114799916189, 'bear_tp_mult': 2.3558997809688007, 'bear_tsl_mult': 0.17402048405071974, 'bear_time_stop': 211, 'bear_use_sma': True, 'bear_use_ema': False, 'bear_use_atr': True, 'bear_use_adx': False, 'bear_use_spike': False, 'bear_rsi_required': False, 'sideways_strategy': 'mean_reversion', 'sideways_bb_std_mult': 1.5868146192301056, 'sideways_rsi_os': 37, 'sideways_rsi_ob': 67, 'sideways_adx_thresh': 7.729561470797574, 'sideways_atr_min_pct': 0.02201118162317308, 'sideways_atr_max_pct': 0.07144540967237352, 'sideways_tp_mult': 1.867882581545642, 'sideways_tsl_mult': 0.5858763107351098, 'sideways_time_stop': 167, 'sideways_use_sma': False, 'sideways_use_ema': True, 'sideways_use_atr': True, 'sideways_use_adx': False, 'sideways_use_spike': False, 'sideways_rsi_required': False}.
[I 2025-09-01 14:04:08,197] Trial 412 finished with values: [-1000000000.0, 1000000000.0] and parameters: {'p_sma': 19, 'p_std': 47, 'p_atr': 25, 'p_adx': 14, 'rsi_period': 65, 'ema1': 23, 'ema2': 17, 'slip_atr_k': 0.016948891636441213, 'slip_spread_k': 0.09448134809901398, 'spread_hl_frac': 0.016072950404929533, 'bb_std_mult': 1.7567711581311483, 'rsi_os': 41, 'rsi_ob': 83, 'vol_spike': 0.22015849393177234, 'adx_thresh': 25.026936128805307, 'atr_min_pct': 0.018197131131967043, 'atr_max_pct': 0.06885123323760671, 'tp_mult': 1.0130942969907641, 'tsl_mult': 0.8481641078179976, 'strategy': 'breakout', 'time_stop': 252, 'use_sma': True, 'use_atr': True, 'use_adx': False, 'use_ema': True, 'use_spike': True, 'rsi_required': False, 'edge_k': 1.6278264739055683, 'edge_cap': 0.29478043261317854, 'bull_strategy': 'breakout', 'bull_bb_std_mult': 2.156681922633527, 'bull_rsi_os': 20, 'bull_rsi_ob': 58, 'bull_adx_thresh': 29.381537803472423, 'bull_atr_min_pct': 0.004814920541307259, 'bull_atr_max_pct': 0.1311362229450491, 'bull_tp_mult': 2.8430029515567368, 'bull_tsl_mult': 0.2620850202106777, 'bull_time_stop': 170, 'bull_use_sma': True, 'bull_use_ema': True, 'bull_use_atr': True, 'bull_use_adx': True, 'bull_use_spike': False, 'bull_rsi_required': True, 'bear_strategy': 'breakout', 'bear_bb_std_mult': 2.9789453176419785, 'bear_rsi_os': 36, 'bear_rsi_ob': 88, 'bear_adx_thresh': 11.69394115417442, 'bear_atr_min_pct': 0.029994816604023394, 'bear_atr_max_pct': 0.04535051672742152, 'bear_tp_mult': 2.189787693616178, 'bear_tsl_mult': 0.8264336432530432, 'bear_time_stop': 205, 'bear_use_sma': False, 'bear_use_ema': False, 'bear_use_atr': True, 'bear_use_adx': True, 'bear_use_spike': False, 'bear_rsi_required': True, 'sideways_strategy': 'breakout', 'sideways_bb_std_mult': 2.804691248366433, 'sideways_rsi_os': 51, 'sideways_rsi_ob': 64, 'sideways_adx_thresh': 17.723064964470876, 'sideways_atr_min_pct': 0.028142569465726828, 'sideways_atr_max_pct': 0.06735275948435646, 'sideways_tp_mult': 1.0592243960710763, 'sideways_tsl_mult': 0.24004046693997763, 'sideways_time_stop': 189, 'sideways_use_sma': True, 'sideways_use_ema': False, 'sideways_use_atr': True, 'sideways_use_adx': True, 'sideways_use_spike': False, 'sideways_rsi_required': True}.
[I 2025-09-01 14:04:08,205] Trial 410 finished with values: [-1000000000.0, 1000000000.0] and parameters: {'p_sma': 32, 'p_std': 48, 'p_atr': 24, 'p_adx': 9, 'rsi_period': 20, 'ema1': 6, 'ema2': 31, 'slip_atr_k': 0.014957177501875125, 'slip_spread_k': 0.08874900837584354, 'spread_hl_frac': 0.004336030718922017, 'bb_std_mult': 1.844128143328735, 'rsi_os': 39, 'rsi_ob': 86, 'vol_spike': 0.25018330505604225, 'adx_thresh': 29.314286446622248, 'atr_min_pct': 0.01753598506332993, 'atr_max_pct': 0.07052859830038734, 'tp_mult': 1.0862704559581506, 'tsl_mult': 0.742077320214668, 'strategy': 'mean_reversion', 'time_stop': 288, 'use_sma': True, 'use_atr': False, 'use_adx': False, 'use_ema': True, 'use_spike': True, 'rsi_required': True, 'edge_k': 0.9515507325501954, 'edge_cap': 0.28990849841598926, 'bull_strategy': 'breakout', 'bull_bb_std_mult': 1.0461075489980127, 'bull_rsi_os': 35, 'bull_rsi_ob': 79, 'bull_adx_thresh': 31.040102828050422, 'bull_atr_min_pct': 0.027635319580996756, 'bull_atr_max_pct': 0.02303222389706489, 'bull_tp_mult': 1.4818576294893857, 'bull_tsl_mult': 0.004150642102539459, 'bull_time_stop': 186, 'bull_use_sma': True, 'bull_use_ema': True, 'bull_use_atr': False, 'bull_use_adx': True, 'bull_use_spike': False, 'bull_rsi_required': False, 'bear_strategy': 'mean_reversion', 'bear_bb_std_mult': 3.5017687522656527, 'bear_rsi_os': 32, 'bear_rsi_ob': 89, 'bear_adx_thresh': 33.82825616077092, 'bear_atr_min_pct': 0.013011441438608965, 'bear_atr_max_pct': 0.046054151399373945, 'bear_tp_mult': 2.249140598168545, 'bear_tsl_mult': 0.8276778030371328, 'bear_time_stop': 83, 'bear_use_sma': False, 'bear_use_ema': False, 'bear_use_atr': True, 'bear_use_adx': True, 'bear_use_spike': False, 'bear_rsi_required': True, 'sideways_strategy': 'mean_reversion', 'sideways_bb_std_mult': 1.54463593190684, 'sideways_rsi_os': 49, 'sideways_rsi_ob': 68, 'sideways_adx_thresh': 7.919813660814283, 'sideways_atr_min_pct': 0.02043759327776118, 'sideways_atr_max_pct': 0.06817385674045356, 'sideways_tp_mult': 2.6931175179793816, 'sideways_tsl_mult': 0.31165016372739907, 'sideways_time_stop': 190, 'sideways_use_sma': True, 'sideways_use_ema': False, 'sideways_use_atr': True, 'sideways_use_adx': True, 'sideways_use_spike': False, 'sideways_rsi_required': True}.
[I 2025-09-01 14:04:08,648] Trial 411 finished with values: [-1000000000.0, 1000000000.0] and parameters: {'p_sma': 6, 'p_std': 45, 'p_atr': 14, 'p_adx': 9, 'rsi_period': 15, 'ema1': 6, 'ema2': 17, 'slip_atr_k': 0.009542791940013002, 'slip_spread_k': 0.08428876953968664, 'spread_hl_frac': 0.00840374361426205, 'bb_std_mult': 3.4464675682393997, 'rsi_os': 41, 'rsi_ob': 83, 'vol_spike': 0.24396746193795654, 'adx_thresh': 6.578776961413567, 'atr_min_pct': 0.01767090621881782, 'atr_max_pct': 0.1264000145268734, 'tp_mult': 1.0897991065213457, 'tsl_mult': 0.802478915063353, 'strategy': 'breakout', 'time_stop': 8, 'use_sma': True, 'use_atr': True, 'use_adx': False, 'use_ema': True, 'use_spike': True, 'rsi_required': False, 'edge_k': 1.1009399802149615, 'edge_cap': 0.9578065356300467, 'bull_strategy': 'breakout', 'bull_bb_std_mult': 3.0297330409252687, 'bull_rsi_os': 20, 'bull_rsi_ob': 58, 'bull_adx_thresh': 29.49978116549706, 'bull_atr_min_pct': 0.004702600603383699, 'bull_atr_max_pct': 0.02241381419751624, 'bull_tp_mult': 2.837610468907693, 'bull_tsl_mult': 0.5727219933935194, 'bull_time_stop': 252, 'bull_use_sma': True, 'bull_use_ema': True, 'bull_use_atr': True, 'bull_use_adx': True, 'bull_use_spike': False, 'bull_rsi_required': True, 'bear_strategy': 'breakout', 'bear_bb_std_mult': 3.597322164686479, 'bear_rsi_os': 33, 'bear_rsi_ob': 88, 'bear_adx_thresh': 5.632108118523073, 'bear_atr_min_pct': 0.0025108661320152976, 'bear_atr_max_pct': 0.04624311997467316, 'bear_tp_mult': 2.949390760183613, 'bear_tsl_mult': 0.3363466445386599, 'bear_time_stop': 215, 'bear_use_sma': False, 'bear_use_ema': False, 'bear_use_atr': True, 'bear_use_adx': True, 'bear_use_spike': False, 'bear_rsi_required': True, 'sideways_strategy': 'breakout', 'sideways_bb_std_mult': 1.5327199738154775, 'sideways_rsi_os': 51, 'sideways_rsi_ob': 68, 'sideways_adx_thresh': 7.719594324897865, 'sideways_atr_min_pct': 0.02034176753516153, 'sideways_atr_max_pct': 0.04450279333121662, 'sideways_tp_mult': 2.143254626445756, 'sideways_tsl_mult': 0.31456634423476765, 'sideways_time_stop': 182, 'sideways_use_sma': True, 'sideways_use_ema': False, 'sideways_use_atr': True, 'sideways_use_adx': True, 'sideways_use_spike': False, 'sideways_rsi_required': True}.
[I 2025-09-01 14:04:09,022] Trial 409 finished with values: [-1000000000.0, 1000000000.0] and parameters: {'p_sma': 6, 'p_std': 52, 'p_atr': 24, 'p_adx': 9, 'rsi_period': 39, 'ema1': 21, 'ema2': 17, 'slip_atr_k': 0.013308503130753723, 'slip_spread_k': 0.08493741999319196, 'spread_hl_frac': 0.008344932861856023, 'bb_std_mult': 2.7979335336528823, 'rsi_os': 7, 'rsi_ob': 65, 'vol_spike': 0.008759066691638562, 'adx_thresh': 30.021351500157436, 'atr_min_pct': 0.017182210530816835, 'atr_max_pct': 0.1369182867357706, 'tp_mult': 1.051439139927144, 'tsl_mult': 0.282420936910628, 'strategy': 'mean_reversion', 'time_stop': 231, 'use_sma': True, 'use_atr': False, 'use_adx': False, 'use_ema': True, 'use_spike': False, 'rsi_required': True, 'edge_k': 0.6128602771402104, 'edge_cap': 0.9598192034501167, 'bull_strategy': 'breakout', 'bull_bb_std_mult': 3.14381272617775, 'bull_rsi_os': 35, 'bull_rsi_ob': 55, 'bull_adx_thresh': 30.980605488085338, 'bull_atr_min_pct': 0.027626500014198828, 'bull_atr_max_pct': 0.02550471325254516, 'bull_tp_mult': 2.6368299356650984, 'bull_tsl_mult': 0.6453685732058394, 'bull_time_stop': 95, 'bull_use_sma': False, 'bull_use_ema': True, 'bull_use_atr': False, 'bull_use_adx': True, 'bull_use_spike': False, 'bull_rsi_required': False, 'bear_strategy': 'mean_reversion', 'bear_bb_std_mult': 3.513653373370653, 'bear_rsi_os': 31, 'bear_rsi_ob': 89, 'bear_adx_thresh': 14.125004210543189, 'bear_atr_min_pct': 0.014519265465977054, 'bear_atr_max_pct': 0.11707792892595001, 'bear_tp_mult': 2.8029809428749513, 'bear_tsl_mult': 0.1753473376485133, 'bear_time_stop': 209, 'bear_use_sma': True, 'bear_use_ema': False, 'bear_use_atr': True, 'bear_use_adx': False, 'bear_use_spike': False, 'bear_rsi_required': False, 'sideways_strategy': 'mean_reversion', 'sideways_bb_std_mult': 1.541597517569483, 'sideways_rsi_os': 51, 'sideways_rsi_ob': 67, 'sideways_adx_thresh': 27.86859731862543, 'sideways_atr_min_pct': 0.02769961640529001, 'sideways_atr_max_pct': 0.05846567679031213, 'sideways_tp_mult': 2.697079836338001, 'sideways_tsl_mult': 0.3081618682784728, 'sideways_time_stop': 300, 'sideways_use_sma': False, 'sideways_use_ema': True, 'sideways_use_atr': True, 'sideways_use_adx': False, 'sideways_use_spike': False, 'sideways_rsi_required': True}.
[I 2025-09-01 14:04:45,946] Trial 414 finished with values: [-1000000000.0, 1000000000.0] and parameters: {'p_sma': 35, 'p_std': 45, 'p_atr': 25, 'p_adx': 10, 'rsi_period': 69, 'ema1': 22, 'ema2': 51, 'slip_atr_k': 0.009680058790825766, 'slip_spread_k': 0.041450592616101886, 'spread_hl_frac': 0.006949006134335616, 'bb_std_mult': 2.9916166974848952, 'rsi_os': 7, 'rsi_ob': 65, 'vol_spike': 0.24288442848192063, 'adx_thresh': 24.587426036881453, 'atr_min_pct': 0.021387640921020808, 'atr_max_pct': 0.09958573942349871, 'tp_mult': 2.644263040228775, 'tsl_mult': 0.7953236653147505, 'strategy': 'breakout', 'time_stop': 122, 'use_sma': True, 'use_atr': False, 'use_adx': False, 'use_ema': True, 'use_spike': True, 'rsi_required': False, 'edge_k': 0.8871157519805078, 'edge_cap': 0.3160560787148212, 'bull_strategy': 'breakout', 'bull_bb_std_mult': 3.3963678179581405, 'bull_rsi_os': 36, 'bull_rsi_ob': 56, 'bull_adx_thresh': 29.842627315581282, 'bull_atr_min_pct': 0.009708490131143482, 'bull_atr_max_pct': 0.02042754188940012, 'bull_tp_mult': 2.771923570160187, 'bull_tsl_mult': 0.5279843032607419, 'bull_time_stop': 294, 'bull_use_sma': True, 'bull_use_ema': True, 'bull_use_atr': True, 'bull_use_adx': True, 'bull_use_spike': False, 'bull_rsi_required': True, 'bear_strategy': 'breakout', 'bear_bb_std_mult': 3.3449240438019294, 'bear_rsi_os': 33, 'bear_rsi_ob': 90, 'bear_adx_thresh': 8.293945189729536, 'bear_atr_min_pct': 0.025415592409835625, 'bear_atr_max_pct': 0.047369221330053154, 'bear_tp_mult': 2.116654974638376, 'bear_tsl_mult': 0.14067417095281426, 'bear_time_stop': 213, 'bear_use_sma': True, 'bear_use_ema': True, 'bear_use_atr': False, 'bear_use_adx': True, 'bear_use_spike': False, 'bear_rsi_required': True, 'sideways_strategy': 'breakout', 'sideways_bb_std_mult': 1.6966867175060891, 'sideways_rsi_os': 47, 'sideways_rsi_ob': 68, 'sideways_adx_thresh': 26.49226057007702, 'sideways_atr_min_pct': 0.015286167004909854, 'sideways_atr_max_pct': 0.09623850649107293, 'sideways_tp_mult': 2.9986757233928003, 'sideways_tsl_mult': 0.27378550821250364, 'sideways_time_stop': 289, 'sideways_use_sma': True, 'sideways_use_ema': False, 'sideways_use_atr': True, 'sideways_use_adx': True, 'sideways_use_spike': False, 'sideways_rsi_required': True}.
