[I 2025-09-01 13:11:34,194] Trial 61 finished with values: [-1000000000.0, 1000000000.0] and parameters: {'p_sma': 28, 'p_std': 26, 'p_atr': 28, 'p_adx': 17, 'rsi_period': 37, 'ema1': 23, 'ema2': 48, 'slip_atr_k': 0.09787478862936937, 'slip_spread_k': 0.4559601870324188, 'spread_hl_frac': 0.028083104334392307, 'bb_std_mult': 2.518152452788044, 'rsi_os': 40, 'rsi_ob': 93, 'vol_spike': 0.13860343366312006, 'adx_thresh': 5.098751949426719, 'atr_min_pct': 0.025819335103206154, 'atr_max_pct': 0.14977968344800374, 'tp_mult': 2.301455761248265, 'tsl_mult': 0.9299795526905439, 'strategy': 'breakout', 'time_stop': 176, 'use_sma': True, 'use_atr': True, 'use_adx': True, 'use_ema': False, 'use_spike': False, 'rsi_required': True, 'edge_k': 0.24020673533758427, 'edge_cap': 0.23901541242651192, 'bull_strategy': 'breakout', 'bull_bb_std_mult': 3.137715049640398, 'bull_rsi_os': 49, 'bull_rsi_ob': 68, 'bull_adx_thresh': 24.99779755239973, 'bull_atr_min_pct': 0.004849772477572959, 'bull_atr_max_pct': 0.09641397736354788, 'bull_tp_mult': 1.6257851763846967, 'bull_tsl_mult': 0.340434820796893, 'bull_time_stop': 74, 'bull_use_sma': True, 'bull_use_ema': True, 'bull_use_atr': False, 'bull_use_adx': True, 'bull_use_spike': False, 'bull_rsi_required': True, 'bear_strategy': 'mean_reversion', 'bear_bb_std_mult': 2.3800037078548617, 'bear_rsi_os': 18, 'bear_rsi_ob': 65, 'bear_adx_thresh': 11.059685881632046, 'bear_atr_min_pct': 0.011665718368101555, 'bear_atr_max_pct': 0.07328643757726114, 'bear_tp_mult': 2.54146631663799, 'bear_tsl_mult': 0.0010220741694717539, 'bear_time_stop': 18, 'bear_use_sma': True, 'bear_use_ema': True, 'bear_use_atr': False, 'bear_use_adx': False, 'bear_use_spike': False, 'bear_rsi_required': False, 'sideways_strategy': 'mean_reversion', 'sideways_bb_std_mult': 3.0977241864396152, 'sideways_rsi_os': 35, 'sideways_rsi_ob': 48, 'sideways_adx_thresh': 15.813206087541671, 'sideways_atr_min_pct': 0.007669883093927208, 'sideways_atr_max_pct': 0.09191324666509204, 'sideways_tp_mult': 2.716660234236724, 'sideways_tsl_mult': 0.3883296206419728, 'sideways_time_stop': 146, 'sideways_use_sma': False, 'sideways_use_ema': True, 'sideways_use_atr': True, 'sideways_use_adx': False, 'sideways_use_spike': False, 'sideways_rsi_required': True}.
[I 2025-09-01 13:11:34,484] Trial 62 finished with values: [-1000000000.0, 1000000000.0] and parameters: {'p_sma': 28, 'p_std': 25, 'p_atr': 28, 'p_adx': 20, 'rsi_period': 27, 'ema1': 23, 'ema2': 47, 'slip_atr_k': 0.01639013551418965, 'slip_spread_k': 0.742263317995254, 'spread_hl_frac': 0.006917168404080666, 'bb_std_mult': 3.0415516680903183, 'rsi_os': 40, 'rsi_ob': 95, 'vol_spike': 0.07842632036543502, 'adx_thresh': 5.067039820150585, 'atr_min_pct': 0.00958627847492181, 'atr_max_pct': 0.02127703800771507, 'tp_mult': 2.6841166114797925, 'tsl_mult': 0.9249596614359589, 'strategy': 'breakout', 'time_stop': 181, 'use_sma': False, 'use_atr': False, 'use_adx': True, 'use_ema': False, 'use_spike': False, 'rsi_required': True, 'edge_k': 0.23140703144939687, 'edge_cap': 0.39624063572794344, 'bull_strategy': 'breakout', 'bull_bb_std_mult': 1.8442244202072375, 'bull_rsi_os': 48, 'bull_rsi_ob': 68, 'bull_adx_thresh': 9.585040206704994, 'bull_atr_min_pct': 0.01582856482826927, 'bull_atr_max_pct': 0.13433175744323736, 'bull_tp_mult': 1.67297126308527, 'bull_tsl_mult': 0.04498455705740073, 'bull_time_stop': 24, 'bull_use_sma': True, 'bull_use_ema': True, 'bull_use_atr': False, 'bull_use_adx': False, 'bull_use_spike': False, 'bull_rsi_required': True, 'bear_strategy': 'mean_reversion', 'bear_bb_std_mult': 1.008177170276318, 'bear_rsi_os': 17, 'bear_rsi_ob': 52, 'bear_adx_thresh': 9.607594157398866, 'bear_atr_min_pct': 0.011704881444179102, 'bear_atr_max_pct': 0.07804839077706192, 'bear_tp_mult': 2.525727443443877, 'bear_tsl_mult': 0.4117456976670667, 'bear_time_stop': 48, 'bear_use_sma': False, 'bear_use_ema': True, 'bear_use_atr': True, 'bear_use_adx': False, 'bear_use_spike': False, 'bear_rsi_required': False, 'sideways_strategy': 'mean_reversion', 'sideways_bb_std_mult': 1.3366565106027704, 'sideways_rsi_os': 36, 'sideways_rsi_ob': 45, 'sideways_adx_thresh': 15.852230964755757, 'sideways_atr_min_pct': 0.005161491335851613, 'sideways_atr_max_pct': 0.1388093125544272, 'sideways_tp_mult': 1.3472445455196902, 'sideways_tsl_mult': 0.9556134605138974, 'sideways_time_stop': 68, 'sideways_use_sma': False, 'sideways_use_ema': True, 'sideways_use_atr': True, 'sideways_use_adx': False, 'sideways_use_spike': True, 'sideways_rsi_required': True}.
[I 2025-09-01 13:11:34,761] Trial 66 finished with values: [-1000000000.0, 1000000000.0] and parameters: {'p_sma': 23, 'p_std': 25, 'p_atr': 30, 'p_adx': 20, 'rsi_period': 24, 'ema1': 18, 'ema2': 60, 'slip_atr_k': 0.1820247034222069, 'slip_spread_k': 0.5733071461909209, 'spread_hl_frac': 0.008679014116459936, 'bb_std_mult': 3.485468770689006, 'rsi_os': 51, 'rsi_ob': 92, 'vol_spike': 0.015570242099161996, 'adx_thresh': 21.34713587453453, 'atr_min_pct': 0.00218786502681405, 'atr_max_pct': 0.10449379664421962, 'tp_mult': 1.8415843716156526, 'tsl_mult': 0.005036548583060935, 'strategy': 'mean_reversion', 'time_stop': 17, 'use_sma': False, 'use_atr': False, 'use_adx': False, 'use_ema': True, 'use_spike': False, 'rsi_required': True, 'edge_k': 0.2225231765116108, 'edge_cap': 0.24315106011744075, 'bull_strategy': 'breakout', 'bull_bb_std_mult': 3.361874586013365, 'bull_rsi_os': 47, 'bull_rsi_ob': 53, 'bull_adx_thresh': 6.3655298693589035, 'bull_atr_min_pct': 0.011831767400058382, 'bull_atr_max_pct': 0.01793998944442698, 'bull_tp_mult': 1.6704905058156607, 'bull_tsl_mult': 0.6154363368166696, 'bull_time_stop': 178, 'bull_use_sma': True, 'bull_use_ema': False, 'bull_use_atr': False, 'bull_use_adx': False, 'bull_use_spike': False, 'bull_rsi_required': True, 'bear_strategy': 'mean_reversion', 'bear_bb_std_mult': 1.3131772584908037, 'bear_rsi_os': 24, 'bear_rsi_ob': 83, 'bear_adx_thresh': 9.438033207000359, 'bear_atr_min_pct': 0.0258224471895786, 'bear_atr_max_pct': 0.1250273373365713, 'bear_tp_mult': 2.9237699082827433, 'bear_tsl_mult': 0.3495844735441107, 'bear_time_stop': 117, 'bear_use_sma': True, 'bear_use_ema': True, 'bear_use_atr': True, 'bear_use_adx': False, 'bear_use_spike': False, 'bear_rsi_required': False, 'sideways_strategy': 'mean_reversion', 'sideways_bb_std_mult': 0.8094933185534803, 'sideways_rsi_os': 29, 'sideways_rsi_ob': 48, 'sideways_adx_thresh': 13.451962551028569, 'sideways_atr_min_pct': 0.027197627658732636, 'sideways_atr_max_pct': 0.08256512089584249, 'sideways_tp_mult': 2.679291449198725, 'sideways_tsl_mult': 0.4720589680906681, 'sideways_time_stop': 71, 'sideways_use_sma': False, 'sideways_use_ema': True, 'sideways_use_atr': True, 'sideways_use_adx': False, 'sideways_use_spike': False, 'sideways_rsi_required': True}.
[I 2025-09-01 13:11:34,781] Trial 65 finished with values: [-1000000000.0, 1000000000.0] and parameters: {'p_sma': 23, 'p_std': 24, 'p_atr': 30, 'p_adx': 20, 'rsi_period': 20, 'ema1': 19, 'ema2': 51, 'slip_atr_k': 0.153935643529826, 'slip_spread_k': 0.45884040511658575, 'spread_hl_frac': 0.017589217335493477, 'bb_std_mult': 3.4872463751262894, 'rsi_os': 50, 'rsi_ob': 92, 'vol_spike': 0.020319484428866497, 'adx_thresh': 24.500559556386808, 'atr_min_pct': 0.0025822437960657855, 'atr_max_pct': 0.10186283972564383, 'tp_mult': 1.8366519546647004, 'tsl_mult': 0.115450746755547, 'strategy': 'mean_reversion', 'time_stop': 27, 'use_sma': True, 'use_atr': True, 'use_adx': True, 'use_ema': True, 'use_spike': False, 'rsi_required': True, 'edge_k': 0.2670850237971349, 'edge_cap': 0.25394241406181933, 'bull_strategy': 'breakout', 'bull_bb_std_mult': 3.3740909113291915, 'bull_rsi_os': 49, 'bull_rsi_ob': 54, 'bull_adx_thresh': 6.401164068466676, 'bull_atr_min_pct': 0.016404884354667443, 'bull_atr_max_pct': 0.020308060581108275, 'bull_tp_mult': 1.6445627089052868, 'bull_tsl_mult': 0.6598857092433451, 'bull_time_stop': 171, 'bull_use_sma': True, 'bull_use_ema': False, 'bull_use_atr': False, 'bull_use_adx': False, 'bull_use_spike': False, 'bull_rsi_required': True, 'bear_strategy': 'mean_reversion', 'bear_bb_std_mult': 2.3815618561007135, 'bear_rsi_os': 18, 'bear_rsi_ob': 66, 'bear_adx_thresh': 10.827961714988788, 'bear_atr_min_pct': 0.012036235031029192, 'bear_atr_max_pct': 0.07160558592178434, 'bear_tp_mult': 2.8931797170681604, 'bear_tsl_mult': 0.2929770990699362, 'bear_time_stop': 132, 'bear_use_sma': True, 'bear_use_ema': True, 'bear_use_atr': True, 'bear_use_adx': False, 'bear_use_spike': False, 'bear_rsi_required': False, 'sideways_strategy': 'mean_reversion', 'sideways_bb_std_mult': 0.9444438161922258, 'sideways_rsi_os': 35, 'sideways_rsi_ob': 49, 'sideways_adx_thresh': 12.987554412633191, 'sideways_atr_min_pct': 0.02720185844992343, 'sideways_atr_max_pct': 0.09093515088916691, 'sideways_tp_mult': 2.856709200049007, 'sideways_tsl_mult': 0.40083275129749124, 'sideways_time_stop': 74, 'sideways_use_sma': False, 'sideways_use_ema': False, 'sideways_use_atr': True, 'sideways_use_adx': False, 'sideways_use_spike': False, 'sideways_rsi_required': True}.
[I 2025-09-01 13:11:34,796] Trial 67 finished with values: [-1000000000.0, 1000000000.0] and parameters: {'p_sma': 21, 'p_std': 51, 'p_atr': 30, 'p_adx': 20, 'rsi_period': 22, 'ema1': 18, 'ema2': 52, 'slip_atr_k': 0.12407512206733319, 'slip_spread_k': 0.6062467447820377, 'spread_hl_frac': 0.010694830788405975, 'bb_std_mult': 3.577575528924827, 'rsi_os': 51, 'rsi_ob': 89, 'vol_spike': 0.024585003341592575, 'adx_thresh': 21.369914701410888, 'atr_min_pct': 0.00245780665007967, 'atr_max_pct': 0.07589430052626726, 'tp_mult': 1.8260204865531322, 'tsl_mult': 0.22016381499284532, 'strategy': 'mean_reversion', 'time_stop': 20, 'use_sma': False, 'use_atr': False, 'use_adx': False, 'use_ema': True, 'use_spike': False, 'rsi_required': True, 'edge_k': 0.45503845956951683, 'edge_cap': 0.42457622923464144, 'bull_strategy': 'breakout', 'bull_bb_std_mult': 3.352930268546673, 'bull_rsi_os': 52, 'bull_rsi_ob': 52, 'bull_adx_thresh': 6.943483384516635, 'bull_atr_min_pct': 0.012179443936728096, 'bull_atr_max_pct': 0.017000213353339885, 'bull_tp_mult': 1.6393734614928548, 'bull_tsl_mult': 0.6107830612187908, 'bull_time_stop': 182, 'bull_use_sma': True, 'bull_use_ema': False, 'bull_use_atr': False, 'bull_use_adx': False, 'bull_use_spike': False, 'bull_rsi_required': True, 'bear_strategy': 'mean_reversion', 'bear_bb_std_mult': 1.2233830124897795, 'bear_rsi_os': 24, 'bear_rsi_ob': 74, 'bear_adx_thresh': 8.368021918214966, 'bear_atr_min_pct': 0.008110426227181944, 'bear_atr_max_pct': 0.14136242730069618, 'bear_tp_mult': 2.929424769239347, 'bear_tsl_mult': 0.412365923811539, 'bear_time_stop': 153, 'bear_use_sma': True, 'bear_use_ema': True, 'bear_use_atr': True, 'bear_use_adx': False, 'bear_use_spike': False, 'bear_rsi_required': False, 'sideways_strategy': 'mean_reversion', 'sideways_bb_std_mult': 0.8001444724538154, 'sideways_rsi_os': 30, 'sideways_rsi_ob': 54, 'sideways_adx_thresh': 20.659618432725736, 'sideways_atr_min_pct': 0.023053373190017976, 'sideways_atr_max_pct': 0.07244175365281111, 'sideways_tp_mult': 2.8467527752585444, 'sideways_tsl_mult': 0.6838554437009667, 'sideways_time_stop': 78, 'sideways_use_sma': False, 'sideways_use_ema': False, 'sideways_use_atr': True, 'sideways_use_adx': False, 'sideways_use_spike': False, 'sideways_rsi_required': True}.
[I 2025-09-01 13:12:13,307] Trial 68 finished with values: [-1000000000.0, 1000000000.0] and parameters: {'p_sma': 21, 'p_std': 51, 'p_atr': 30, 'p_adx': 22, 'rsi_period': 21, 'ema1': 19, 'ema2': 52, 'slip_atr_k': 0.18103682557502745, 'slip_spread_k': 0.6060953821530731, 'spread_hl_frac': 0.015072390054319063, 'bb_std_mult': 3.5837667147028416, 'rsi_os': 21, 'rsi_ob': 88, 'vol_spike': 0.018166118522335212, 'adx_thresh': 21.960260526081914, 'atr_min_pct': 0.0019451971016688032, 'atr_max_pct': 0.10076932593572555, 'tp_mult': 1.8510489001219448, 'tsl_mult': 0.18320334710130598, 'strategy': 'mean_reversion', 'time_stop': 19, 'use_sma': True, 'use_atr': True, 'use_adx': False, 'use_ema': True, 'use_spike': False, 'rsi_required': True, 'edge_k': 0.08442523091738097, 'edge_cap': 0.3616412578845838, 'bull_strategy': 'mean_reversion', 'bull_bb_std_mult': 3.3572583557404934, 'bull_rsi_os': 53, 'bull_rsi_ob': 52, 'bull_adx_thresh': 6.363143835857152, 'bull_atr_min_pct': 0.011282597755651293, 'bull_atr_max_pct': 0.018727615369982402, 'bull_tp_mult': 1.791531773011911, 'bull_tsl_mult': 0.612355450705263, 'bull_time_stop': 183, 'bull_use_sma': True, 'bull_use_ema': False, 'bull_use_atr': False, 'bull_use_adx': False, 'bull_use_spike': False, 'bull_rsi_required': False, 'bear_strategy': 'mean_reversion', 'bear_bb_std_mult': 1.2546974212331279, 'bear_rsi_os': 27, 'bear_rsi_ob': 67, 'bear_adx_thresh': 7.507198480886446, 'bear_atr_min_pct': 0.007955172166682789, 'bear_atr_max_pct': 0.14154588538474921, 'bear_tp_mult': 2.884143723676738, 'bear_tsl_mult': 0.5046086246680858, 'bear_time_stop': 156, 'bear_use_sma': True, 'bear_use_ema': True, 'bear_use_atr': True, 'bear_use_adx': False, 'bear_use_spike': False, 'bear_rsi_required': False, 'sideways_strategy': 'breakout', 'sideways_bb_std_mult': 1.0569553055255436, 'sideways_rsi_os': 31, 'sideways_rsi_ob': 50, 'sideways_adx_thresh': 18.70338401923931, 'sideways_atr_min_pct': 0.02723322326242244, 'sideways_atr_max_pct': 0.08360151339241816, 'sideways_tp_mult': 2.858839107504824, 'sideways_tsl_mult': 0.47229838010165703, 'sideways_time_stop': 52, 'sideways_use_sma': False, 'sideways_use_ema': False, 'sideways_use_atr': True, 'sideways_use_adx': False, 'sideways_use_spike': False, 'sideways_rsi_required': True}.
[I 2025-09-01 13:12:13,896] Trial 71 finished with values: [-1000000000.0, 1000000000.0] and parameters: {'p_sma': 52, 'p_std': 10, 'p_atr': 26, 'p_adx': 22, 'rsi_period': 15, 'ema1': 21, 'ema2': 27, 'slip_atr_k': 0.17999877455396746, 'slip_spread_k': 0.49993069860885225, 'spread_hl_frac': 0.014508127504168286, 'bb_std_mult': 2.7956613175621525, 'rsi_os': 21, 'rsi_ob': 87, 'vol_spike': 0.061075412587004864, 'adx_thresh': 32.28347988543162, 'atr_min_pct': 0.004165093898519261, 'atr_max_pct': 0.08533640461709048, 'tp_mult': 1.585562694973523, 'tsl_mult': 0.1728782561869739, 'strategy': 'mean_reversion', 'time_stop': 50, 'use_sma': True, 'use_atr': True, 'use_adx': False, 'use_ema': True, 'use_spike': False, 'rsi_required': True, 'edge_k': 1.5211786077763816, 'edge_cap': 0.35625363733352433, 'bull_strategy': 'mean_reversion', 'bull_bb_std_mult': 3.4730178462065933, 'bull_rsi_os': 54, 'bull_rsi_ob': 48, 'bull_adx_thresh': 10.02426284861275, 'bull_atr_min_pct': 0.010950627815699429, 'bull_atr_max_pct': 0.044773577488528116, 'bull_tp_mult': 1.4415249200578928, 'bull_tsl_mult': 0.7861825794464451, 'bull_time_stop': 201, 'bull_use_sma': True, 'bull_use_ema': False, 'bull_use_atr': False, 'bull_use_adx': False, 'bull_use_spike': False, 'bull_rsi_required': False, 'bear_strategy': 'breakout', 'bear_bb_std_mult': 2.5913423335789805, 'bear_rsi_os': 27, 'bear_rsi_ob': 95, 'bear_adx_thresh': 7.126773012582085, 'bear_atr_min_pct': 0.009902757497559202, 'bear_atr_max_pct': 0.09023860315672061, 'bear_tp_mult': 2.709269733061485, 'bear_tsl_mult': 0.49339171048132463, 'bear_time_stop': 206, 'bear_use_sma': True, 'bear_use_ema': True, 'bear_use_atr': True, 'bear_use_adx': False, 'bear_use_spike': False, 'bear_rsi_required': False, 'sideways_strategy': 'breakout', 'sideways_bb_std_mult': 1.5272313211785018, 'sideways_rsi_os': 14, 'sideways_rsi_ob': 51, 'sideways_adx_thresh': 19.61746191504316, 'sideways_atr_min_pct': 0.028556345299041122, 'sideways_atr_max_pct': 0.012759489648821537, 'sideways_tp_mult': 2.564139469443972, 'sideways_tsl_mult': 0.0885805481599593, 'sideways_time_stop': 47, 'sideways_use_sma': False, 'sideways_use_ema': False, 'sideways_use_atr': True, 'sideways_use_adx': False, 'sideways_use_spike': False, 'sideways_rsi_required': False}.
[I 2025-09-01 13:12:14,261] Trial 69 finished with values: [-1000000000.0, 1000000000.0] and parameters: {'p_sma': 32, 'p_std': 51, 'p_atr': 30, 'p_adx': 24, 'rsi_period': 18, 'ema1': 20, 'ema2': 52, 'slip_atr_k': 0.14618556161840823, 'slip_spread_k': 0.6201458137585545, 'spread_hl_frac': 0.014342919614908857, 'bb_std_mult': 2.678260345507613, 'rsi_os': 20, 'rsi_ob': 88, 'vol_spike': 0.02657348754517487, 'adx_thresh': 24.4196436789322, 'atr_min_pct': 0.004252668785108153, 'atr_max_pct': 0.08562281391922273, 'tp_mult': 1.936376197038099, 'tsl_mult': 0.19840358210039502, 'strategy': 'mean_reversion', 'time_stop': 45, 'use_sma': True, 'use_atr': True, 'use_adx': False, 'use_ema': True, 'use_spike': False, 'rsi_required': True, 'edge_k': 1.5380278121007525, 'edge_cap': 0.42668911322887526, 'bull_strategy': 'mean_reversion', 'bull_bb_std_mult': 0.7003885810448798, 'bull_rsi_os': 53, 'bull_rsi_ob': 47, 'bull_adx_thresh': 7.422922855318504, 'bull_atr_min_pct': 0.014140629421738816, 'bull_atr_max_pct': 0.045269792214117074, 'bull_tp_mult': 1.78889864830169, 'bull_tsl_mult': 0.7840322105548428, 'bull_time_stop': 156, 'bull_use_sma': True, 'bull_use_ema': False, 'bull_use_atr': False, 'bull_use_adx': False, 'bull_use_spike': False, 'bull_rsi_required': False, 'bear_strategy': 'mean_reversion', 'bear_bb_std_mult': 1.2215342989113434, 'bear_rsi_os': 28, 'bear_rsi_ob': 74, 'bear_adx_thresh': 7.730842714440412, 'bear_atr_min_pct': 0.008141059297799479, 'bear_atr_max_pct': 0.13635391920190762, 'bear_tp_mult': 2.6672620629788026, 'bear_tsl_mult': 0.275274915992887, 'bear_time_stop': 151, 'bear_use_sma': True, 'bear_use_ema': True, 'bear_use_atr': True, 'bear_use_adx': False, 'bear_use_spike': False, 'bear_rsi_required': False, 'sideways_strategy': 'breakout', 'sideways_bb_std_mult': 1.101168624205617, 'sideways_rsi_os': 23, 'sideways_rsi_ob': 54, 'sideways_adx_thresh': 20.077638293765062, 'sideways_atr_min_pct': 0.023273485731595506, 'sideways_atr_max_pct': 0.07099200904484745, 'sideways_tp_mult': 2.8180955695853265, 'sideways_tsl_mult': 0.10425235323287141, 'sideways_time_stop': 51, 'sideways_use_sma': False, 'sideways_use_ema': False, 'sideways_use_atr': True, 'sideways_use_adx': False, 'sideways_use_spike': False, 'sideways_rsi_required': False}.
[I 2025-09-01 13:12:15,057] Trial 70 finished with values: [-1000000000.0, 1000000000.0] and parameters: {'p_sma': 21, 'p_std': 51, 'p_atr': 26, 'p_adx': 22, 'rsi_period': 21, 'ema1': 21, 'ema2': 45, 'slip_atr_k': 0.12197540999414405, 'slip_spread_k': 0.6108947487132906, 'spread_hl_frac': 0.012542398863040451, 'bb_std_mult': 2.8181144587593034, 'rsi_os': 44, 'rsi_ob': 89, 'vol_spike': 0.06729078247139869, 'adx_thresh': 12.467154250682551, 'atr_min_pct': 0.004163751467336222, 'atr_max_pct': 0.07700247045395675, 'tp_mult': 1.9345517396834724, 'tsl_mult': 0.2044364113349444, 'strategy': 'mean_reversion', 'time_stop': 47, 'use_sma': True, 'use_atr': True, 'use_adx': False, 'use_ema': True, 'use_spike': False, 'rsi_required': True, 'edge_k': 0.44735937611888343, 'edge_cap': 0.14696141149057368, 'bull_strategy': 'mean_reversion', 'bull_bb_std_mult': 1.6725212960828544, 'bull_rsi_os': 53, 'bull_rsi_ob': 57, 'bull_adx_thresh': 5.32687570054249, 'bull_atr_min_pct': 0.010762334887430938, 'bull_atr_max_pct': 0.04725553692845284, 'bull_tp_mult': 1.8098175704181458, 'bull_tsl_mult': 0.7543851939137688, 'bull_time_stop': 208, 'bull_use_sma': True, 'bull_use_ema': False, 'bull_use_atr': False, 'bull_use_adx': False, 'bull_use_spike': False, 'bull_rsi_required': False, 'bear_strategy': 'breakout', 'bear_bb_std_mult': 1.6009902448999331, 'bear_rsi_os': 26, 'bear_rsi_ob': 92, 'bear_adx_thresh': 8.19700567247811, 'bear_atr_min_pct': 0.010031728903193792, 'bear_atr_max_pct': 0.14062397163235144, 'bear_tp_mult': 2.6827967246501894, 'bear_tsl_mult': 0.4264974097638591, 'bear_time_stop': 150, 'bear_use_sma': True, 'bear_use_ema': True, 'bear_use_atr': True, 'bear_use_adx': False, 'bear_use_spike': False, 'bear_rsi_required': False, 'sideways_strategy': 'breakout', 'sideways_bb_std_mult': 1.0671119415757073, 'sideways_rsi_os': 23, 'sideways_rsi_ob': 51, 'sideways_adx_thresh': 20.24911154958427, 'sideways_atr_min_pct': 0.022694657905947876, 'sideways_atr_max_pct': 0.06989449807119696, 'sideways_tp_mult': 2.612607738197321, 'sideways_tsl_mult': 0.6722968734477004, 'sideways_time_stop': 50, 'sideways_use_sma': False, 'sideways_use_ema': False, 'sideways_use_atr': True, 'sideways_use_adx': False, 'sideways_use_spike': False, 'sideways_rsi_required': False}.
