[I 2025-09-01 15:01:05,283] Trial 789 finished with values: [-1000000000.0, 1000000000.0] and parameters: {'p_sma': 39, 'p_std': 56, 'p_atr': 9, 'p_adx': 8, 'rsi_period': 64, 'ema1': 16, 'ema2': 35, 'slip_atr_k': 0.012230035434078005, 'slip_spread_k': 0.7159351714034979, 'spread_hl_frac': 0.025117199771300395, 'bb_std_mult': 1.7163176307238286, 'rsi_os': 38, 'rsi_ob': 57, 'vol_spike': 0.2369716524073642, 'adx_thresh': 33.41177330155784, 'atr_min_pct': 0.003900086393486173, 'atr_max_pct': 0.13764135553019327, 'tp_mult': 2.726245932667843, 'tsl_mult': 0.7392023634455196, 'strategy': 'mean_reversion', 'time_stop': 195, 'use_sma': True, 'use_atr': False, 'use_adx': False, 'use_ema': True, 'use_spike': True, 'rsi_required': False, 'edge_k': 0.9429298612396435, 'edge_cap': 0.509427423189303, 'bull_strategy': 'breakout', 'bull_bb_std_mult': 3.1971410857333993, 'bull_rsi_os': 25, 'bull_rsi_ob': 69, 'bull_adx_thresh': 29.77213551012955, 'bull_atr_min_pct': 0.003793415195225979, 'bull_atr_max_pct': 0.026538504917622177, 'bull_tp_mult': 2.851502400509059, 'bull_tsl_mult': 0.4320722448354993, 'bull_time_stop': 138, 'bull_use_sma': True, 'bull_use_ema': True, 'bull_use_atr': True, 'bull_use_adx': True, 'bull_use_spike': False, 'bull_rsi_required': True, 'bear_strategy': 'breakout', 'bear_bb_std_mult': 3.5979788771099934, 'bear_rsi_os': 35, 'bear_rsi_ob': 87, 'bear_adx_thresh': 13.03075609495134, 'bear_atr_min_pct': 0.02532142183227386, 'bear_atr_max_pct': 0.13512969641869374, 'bear_tp_mult': 2.2196833919440433, 'bear_tsl_mult': 0.13826610647285875, 'bear_time_stop': 229, 'bear_use_sma': True, 'bear_use_ema': True, 'bear_use_atr': True, 'bear_use_adx': True, 'bear_use_spike': False, 'bear_rsi_required': True, 'sideways_strategy': 'breakout', 'sideways_bb_std_mult': 1.5389379264492167, 'sideways_rsi_os': 48, 'sideways_rsi_ob': 58, 'sideways_adx_thresh': 17.931195914916994, 'sideways_atr_min_pct': 0.02031871180122144, 'sideways_atr_max_pct': 0.06499654388086606, 'sideways_tp_mult': 2.035779667983406, 'sideways_tsl_mult': 0.42452098866679133, 'sideways_time_stop': 183, 'sideways_use_sma': True, 'sideways_use_ema': False, 'sideways_use_atr': True, 'sideways_use_adx': True, 'sideways_use_spike': True, 'sideways_rsi_required': True}.
[I 2025-09-01 15:01:44,499] Trial 795 finished with values: [-1000000000.0, 1000000000.0] and parameters: {'p_sma': 14, 'p_std': 40, 'p_atr': 23, 'p_adx': 19, 'rsi_period': 70, 'ema1': 5, 'ema2': 18, 'slip_atr_k': 0.07998613350861003, 'slip_spread_k': 0.11795579156540206, 'spread_hl_frac': 0.007168717179975552, 'bb_std_mult': 1.814602977178507, 'rsi_os': 42, 'rsi_ob': 61, 'vol_spike': 0.2213155649338719, 'adx_thresh': 18.647726215068683, 'atr_min_pct': 0.02746219045162255, 'atr_max_pct': 0.13812015666098948, 'tp_mult': 1.1454575851931645, 'tsl_mult': 0.4858818346894689, 'strategy': 'mean_reversion', 'time_stop': 233, 'use_sma': True, 'use_atr': False, 'use_adx': False, 'use_ema': True, 'use_spike': True, 'rsi_required': False, 'edge_k': 0.8746579204249444, 'edge_cap': 0.31870393026708727, 'bull_strategy': 'breakout', 'bull_bb_std_mult': 2.663269699609387, 'bull_rsi_os': 27, 'bull_rsi_ob': 49, 'bull_adx_thresh': 21.382161943027693, 'bull_atr_min_pct': 0.003973001241852937, 'bull_atr_max_pct': 0.022190696254748843, 'bull_tp_mult': 2.821707985557264, 'bull_tsl_mult': 0.33014859960366083, 'bull_time_stop': 103, 'bull_use_sma': True, 'bull_use_ema': False, 'bull_use_atr': True, 'bull_use_adx': True, 'bull_use_spike': False, 'bull_rsi_required': True, 'bear_strategy': 'breakout', 'bear_bb_std_mult': 3.595296464271753, 'bear_rsi_os': 33, 'bear_rsi_ob': 87, 'bear_adx_thresh': 17.524020445578408, 'bear_atr_min_pct': 0.00200946774024689, 'bear_atr_max_pct': 0.04767931735147928, 'bear_tp_mult': 2.215316664164002, 'bear_tsl_mult': 0.6158438094777126, 'bear_time_stop': 222, 'bear_use_sma': True, 'bear_use_ema': True, 'bear_use_atr': True, 'bear_use_adx': True, 'bear_use_spike': False, 'bear_rsi_required': True, 'sideways_strategy': 'breakout', 'sideways_bb_std_mult': 2.8305699721724156, 'sideways_rsi_os': 49, 'sideways_rsi_ob': 71, 'sideways_adx_thresh': 21.177872740584384, 'sideways_atr_min_pct': 0.020573674912325274, 'sideways_atr_max_pct': 0.14596681416337887, 'sideways_tp_mult': 1.7231800616398614, 'sideways_tsl_mult': 0.4236620040959856, 'sideways_time_stop': 179, 'sideways_use_sma': True, 'sideways_use_ema': False, 'sideways_use_atr': True, 'sideways_use_adx': True, 'sideways_use_spike': False, 'sideways_rsi_required': True}.
[I 2025-09-01 15:01:44,932] Trial 796 finished with values: [-0.05529236426655604, 0.05481811627672597] and parameters: {'p_sma': 36, 'p_std': 20, 'p_atr': 23, 'p_adx': 14, 'rsi_period': 49, 'ema1': 18, 'ema2': 30, 'slip_atr_k': 0.18815885646588787, 'slip_spread_k': 0.11994019827879271, 'spread_hl_frac': 0.007177240870401251, 'bb_std_mult': 1.8159044332401222, 'rsi_os': 35, 'rsi_ob': 81, 'vol_spike': 0.12134535814214041, 'adx_thresh': 9.818702960491708, 'atr_min_pct': 0.015136954196084828, 'atr_max_pct': 0.025259246416911796, 'tp_mult': 2.474780011166331, 'tsl_mult': 0.15618738567455237, 'strategy': 'mean_reversion', 'time_stop': 98, 'use_sma': True, 'use_atr': False, 'use_adx': False, 'use_ema': True, 'use_spike': True, 'rsi_required': False, 'edge_k': 0.8633749819585843, 'edge_cap': 0.3203962767946196, 'bull_strategy': 'mean_reversion', 'bull_bb_std_mult': 3.311725426479952, 'bull_rsi_os': 17, 'bull_rsi_ob': 67, 'bull_adx_thresh': 30.388422457875958, 'bull_atr_min_pct': 0.008190407885320064, 'bull_atr_max_pct': 0.05045052865573707, 'bull_tp_mult': 2.5204677239712243, 'bull_tsl_mult': 0.6988418803480183, 'bull_time_stop': 237, 'bull_use_sma': False, 'bull_use_ema': False, 'bull_use_atr': True, 'bull_use_adx': True, 'bull_use_spike': True, 'bull_rsi_required': False, 'bear_strategy': 'breakout', 'bear_bb_std_mult': 3.3733844908145816, 'bear_rsi_os': 33, 'bear_rsi_ob': 61, 'bear_adx_thresh': 11.713006113280938, 'bear_atr_min_pct': 0.002125316656287759, 'bear_atr_max_pct': 0.04303898596724809, 'bear_tp_mult': 1.522500348432913, 'bear_tsl_mult': 0.15487962577302786, 'bear_time_stop': 162, 'bear_use_sma': True, 'bear_use_ema': False, 'bear_use_atr': True, 'bear_use_adx': True, 'bear_use_spike': False, 'bear_rsi_required': True, 'sideways_strategy': 'breakout', 'sideways_bb_std_mult': 2.152383412690645, 'sideways_rsi_os': 49, 'sideways_rsi_ob': 68, 'sideways_adx_thresh': 31.12127155922746, 'sideways_atr_min_pct': 0.029987358802479925, 'sideways_atr_max_pct': 0.01323506145507905, 'sideways_tp_mult': 2.705086166641326, 'sideways_tsl_mult': 0.3824346777753128, 'sideways_time_stop': 177, 'sideways_use_sma': True, 'sideways_use_ema': False, 'sideways_use_atr': True, 'sideways_use_adx': True, 'sideways_use_spike': False, 'sideways_rsi_required': False}.
[I 2025-09-01 15:01:45,197] Trial 794 finished with values: [-1000000000.0, 1000000000.0] and parameters: {'p_sma': 38, 'p_std': 49, 'p_atr': 23, 'p_adx': 14, 'rsi_period': 55, 'ema1': 21, 'ema2': 19, 'slip_atr_k': 0.01585623667072434, 'slip_spread_k': 0.71621730558984, 'spread_hl_frac': 0.00737464331955549, 'bb_std_mult': 1.6908772392302993, 'rsi_os': 40, 'rsi_ob': 68, 'vol_spike': 0.23822716818946282, 'adx_thresh': 25.69102912997707, 'atr_min_pct': 0.003779165999622981, 'atr_max_pct': 0.02713578844376805, 'tp_mult': 2.7397115612382943, 'tsl_mult': 0.737067351079518, 'strategy': 'mean_reversion', 'time_stop': 233, 'use_sma': True, 'use_atr': False, 'use_adx': False, 'use_ema': True, 'use_spike': True, 'rsi_required': False, 'edge_k': 0.892140028714895, 'edge_cap': 0.5402081894444396, 'bull_strategy': 'breakout', 'bull_bb_std_mult': 3.227098594876701, 'bull_rsi_os': 40, 'bull_rsi_ob': 49, 'bull_adx_thresh': 30.056270690354474, 'bull_atr_min_pct': 0.02240691146051675, 'bull_atr_max_pct': 0.03404960516870464, 'bull_tp_mult': 1.80457110188343, 'bull_tsl_mult': 0.4275494068804108, 'bull_time_stop': 136, 'bull_use_sma': True, 'bull_use_ema': True, 'bull_use_atr': True, 'bull_use_adx': True, 'bull_use_spike': False, 'bull_rsi_required': True, 'bear_strategy': 'breakout', 'bear_bb_std_mult': 1.675574783637272, 'bear_rsi_os': 15, 'bear_rsi_ob': 86, 'bear_adx_thresh': 11.863139125365054, 'bear_atr_min_pct': 0.00247575969761785, 'bear_atr_max_pct': 0.04388842020794625, 'bear_tp_mult': 2.2345055114755126, 'bear_tsl_mult': 0.8667020126879208, 'bear_time_stop': 165, 'bear_use_sma': True, 'bear_use_ema': True, 'bear_use_atr': True, 'bear_use_adx': True, 'bear_use_spike': False, 'bear_rsi_required': True, 'sideways_strategy': 'breakout', 'sideways_bb_std_mult': 1.631709700918951, 'sideways_rsi_os': 50, 'sideways_rsi_ob': 45, 'sideways_adx_thresh': 5.722250721260476, 'sideways_atr_min_pct': 0.01853398298941044, 'sideways_atr_max_pct': 0.013710862714204075, 'sideways_tp_mult': 2.0465108175018654, 'sideways_tsl_mult': 0.2575601671004454, 'sideways_time_stop': 77, 'sideways_use_sma': True, 'sideways_use_ema': False, 'sideways_use_atr': True, 'sideways_use_adx': True, 'sideways_use_spike': False, 'sideways_rsi_required': True}.
[I 2025-09-01 15:01:45,477] Trial 793 finished with values: [-0.028164194677311016, 0.028462482033769755] and parameters: {'p_sma': 39, 'p_std': 19, 'p_atr': 23, 'p_adx': 17, 'rsi_period': 21, 'ema1': 14, 'ema2': 27, 'slip_atr_k': 0.20224114281542732, 'slip_spread_k': 0.1210682804767608, 'spread_hl_frac': 0.0073149551841815, 'bb_std_mult': 1.8169386868819886, 'rsi_os': 31, 'rsi_ob': 86, 'vol_spike': 0.23648423594915255, 'adx_thresh': 31.131297507409066, 'atr_min_pct': 0.00387788757154609, 'atr_max_pct': 0.1366026588689638, 'tp_mult': 2.1011981746793293, 'tsl_mult': 0.7410343773788411, 'strategy': 'mean_reversion', 'time_stop': 256, 'use_sma': True, 'use_atr': False, 'use_adx': False, 'use_ema': False, 'use_spike': True, 'rsi_required': False, 'edge_k': 0.8880654370461581, 'edge_cap': 0.6010004733764914, 'bull_strategy': 'breakout', 'bull_bb_std_mult': 3.2417814565547025, 'bull_rsi_os': 51, 'bull_rsi_ob': 53, 'bull_adx_thresh': 29.629618347314086, 'bull_atr_min_pct': 0.0030700760697003897, 'bull_atr_max_pct': 0.013164183205927452, 'bull_tp_mult': 2.7475784194098183, 'bull_tsl_mult': 0.4304746634660014, 'bull_time_stop': 92, 'bull_use_sma': True, 'bull_use_ema': True, 'bull_use_atr': True, 'bull_use_adx': True, 'bull_use_spike': False, 'bull_rsi_required': True, 'bear_strategy': 'breakout', 'bear_bb_std_mult': 2.6410201675272926, 'bear_rsi_os': 21, 'bear_rsi_ob': 89, 'bear_adx_thresh': 12.76095785188369, 'bear_atr_min_pct': 0.003367788941465415, 'bear_atr_max_pct': 0.05149819366810503, 'bear_tp_mult': 2.219723518736865, 'bear_tsl_mult': 0.6219600648582004, 'bear_time_stop': 208, 'bear_use_sma': True, 'bear_use_ema': True, 'bear_use_atr': False, 'bear_use_adx': True, 'bear_use_spike': False, 'bear_rsi_required': True, 'sideways_strategy': 'breakout', 'sideways_bb_std_mult': 1.5417162918604472, 'sideways_rsi_os': 51, 'sideways_rsi_ob': 45, 'sideways_adx_thresh': 5.597429807459368, 'sideways_atr_min_pct': 0.021128564079502372, 'sideways_atr_max_pct': 0.14554367172389926, 'sideways_tp_mult': 2.5184933656119552, 'sideways_tsl_mult': 0.25168991245581634, 'sideways_time_stop': 179, 'sideways_use_sma': True, 'sideways_use_ema': False, 'sideways_use_atr': True, 'sideways_use_adx': True, 'sideways_use_spike': False, 'sideways_rsi_required': True}.
[I 2025-09-01 15:01:46,881] Trial 797 finished with values: [-1000000000.0, 1000000000.0] and parameters: {'p_sma': 23, 'p_std': 50, 'p_atr': 27, 'p_adx': 25, 'rsi_period': 75, 'ema1': 20, 'ema2': 26, 'slip_atr_k': 0.019488375959201523, 'slip_spread_k': 0.9177034588870836, 'spread_hl_frac': 0.003830758664975539, 'bb_std_mult': 2.0137035346755607, 'rsi_os': 40, 'rsi_ob': 83, 'vol_spike': 0.12280626906295722, 'adx_thresh': 25.061122206742592, 'atr_min_pct': 0.02593359342940524, 'atr_max_pct': 0.010172394837549587, 'tp_mult': 2.4713562136491114, 'tsl_mult': 0.1988577545895745, 'strategy': 'breakout', 'time_stop': 131, 'use_sma': True, 'use_atr': True, 'use_adx': False, 'use_ema': True, 'use_spike': False, 'rsi_required': False, 'edge_k': 0.798296703322587, 'edge_cap': 0.08442158703668001, 'bull_strategy': 'mean_reversion', 'bull_bb_std_mult': 1.5566745147899335, 'bull_rsi_os': 19, 'bull_rsi_ob': 55, 'bull_adx_thresh': 30.528339374138053, 'bull_atr_min_pct': 0.0031375819848424905, 'bull_atr_max_pct': 0.03430239154855403, 'bull_tp_mult': 2.5223833632634345, 'bull_tsl_mult': 0.7920015483364173, 'bull_time_stop': 82, 'bull_use_sma': False, 'bull_use_ema': True, 'bull_use_atr': True, 'bull_use_adx': True, 'bull_use_spike': True, 'bull_rsi_required': False, 'bear_strategy': 'breakout', 'bear_bb_std_mult': 3.3806601019893336, 'bear_rsi_os': 40, 'bear_rsi_ob': 61, 'bear_adx_thresh': 11.701071631065112, 'bear_atr_min_pct': 0.0026843366026404413, 'bear_atr_max_pct': 0.043728929660152537, 'bear_tp_mult': 2.2853930006388383, 'bear_tsl_mult': 0.15535401932299223, 'bear_time_stop': 289, 'bear_use_sma': False, 'bear_use_ema': False, 'bear_use_atr': True, 'bear_use_adx': True, 'bear_use_spike': False, 'bear_rsi_required': False, 'sideways_strategy': 'mean_reversion', 'sideways_bb_std_mult': 1.2438334782559086, 'sideways_rsi_os': 8, 'sideways_rsi_ob': 68, 'sideways_adx_thresh': 22.412964604010902, 'sideways_atr_min_pct': 0.02959262897135612, 'sideways_atr_max_pct': 0.017362579181982155, 'sideways_tp_mult': 2.6950326316008684, 'sideways_tsl_mult': 0.25804361444673496, 'sideways_time_stop': 167, 'sideways_use_sma': False, 'sideways_use_ema': False, 'sideways_use_atr': True, 'sideways_use_adx': True, 'sideways_use_spike': False, 'sideways_rsi_required': False}.
[I 2025-09-01 15:02:26,633] Trial 800 finished with values: [-1000000000.0, 1000000000.0] and parameters: {'p_sma': 5, 'p_std': 47, 'p_atr': 27, 'p_adx': 12, 'rsi_period': 9, 'ema1': 6, 'ema2': 17, 'slip_atr_k': 0.017864647868473867, 'slip_spread_k': 0.388239391790384, 'spread_hl_frac': 0.003988126194739337, 'bb_std_mult': 1.8959750967977647, 'rsi_os': 48, 'rsi_ob': 83, 'vol_spike': 0.29889660473497415, 'adx_thresh': 25.008629618947072, 'atr_min_pct': 0.025206080559482466, 'atr_max_pct': 0.10283382161179401, 'tp_mult': 1.7649144154090388, 'tsl_mult': 0.6632223211976521, 'strategy': 'breakout', 'time_stop': 224, 'use_sma': False, 'use_atr': True, 'use_adx': True, 'use_ema': True, 'use_spike': False, 'rsi_required': True, 'edge_k': 0.8010959785104896, 'edge_cap': 0.09026467832115725, 'bull_strategy': 'mean_reversion', 'bull_bb_std_mult': 0.6887996802943974, 'bull_rsi_os': 19, 'bull_rsi_ob': 78, 'bull_adx_thresh': 33.88319137088508, 'bull_atr_min_pct': 0.0043111043834080385, 'bull_atr_max_pct': 0.10131596964434492, 'bull_tp_mult': 2.9438467689651553, 'bull_tsl_mult': 0.7941142029087331, 'bull_time_stop': 53, 'bull_use_sma': False, 'bull_use_ema': True, 'bull_use_atr': False, 'bull_use_adx': False, 'bull_use_spike': True, 'bull_rsi_required': False, 'bear_strategy': 'breakout', 'bear_bb_std_mult': 3.441747525653071, 'bear_rsi_os': 32, 'bear_rsi_ob': 55, 'bear_adx_thresh': 10.377952595227898, 'bear_atr_min_pct': 0.0038774499567884833, 'bear_atr_max_pct': 0.10944065399997138, 'bear_tp_mult': 1.809851938809904, 'bear_tsl_mult': 0.22502157197498668, 'bear_time_stop': 112, 'bear_use_sma': False, 'bear_use_ema': False, 'bear_use_atr': True, 'bear_use_adx': False, 'bear_use_spike': False, 'bear_rsi_required': False, 'sideways_strategy': 'mean_reversion', 'sideways_bb_std_mult': 1.4154055162036814, 'sideways_rsi_os': 53, 'sideways_rsi_ob': 66, 'sideways_adx_thresh': 13.309369317867823, 'sideways_atr_min_pct': 0.01981825905874696, 'sideways_atr_max_pct': 0.10215122346464027, 'sideways_tp_mult': 2.765156282322567, 'sideways_tsl_mult': 0.28440186320034716, 'sideways_time_stop': 167, 'sideways_use_sma': False, 'sideways_use_ema': False, 'sideways_use_atr': True, 'sideways_use_adx': False, 'sideways_use_spike': False, 'sideways_rsi_required': False}.
[I 2025-09-01 15:02:26,682] Trial 798 finished with values: [-1000000000.0, 1000000000.0] and parameters: {'p_sma': 12, 'p_std': 49, 'p_atr': 26, 'p_adx': 17, 'rsi_period': 53, 'ema1': 21, 'ema2': 19, 'slip_atr_k': 0.019082790559090457, 'slip_spread_k': 0.638146408090553, 'spread_hl_frac': 0.04590161387840736, 'bb_std_mult': 1.9197841502544633, 'rsi_os': 40, 'rsi_ob': 88, 'vol_spike': 0.19331568040996397, 'adx_thresh': 25.23540724110139, 'atr_min_pct': 0.026053759862097636, 'atr_max_pct': 0.07498549678645328, 'tp_mult': 1.04523219126707, 'tsl_mult': 0.7179461643607868, 'strategy': 'breakout', 'time_stop': 260, 'use_sma': False, 'use_atr': True, 'use_adx': False, 'use_ema': True, 'use_spike': False, 'rsi_required': False, 'edge_k': 0.8199025574930268, 'edge_cap': 0.3510071394727605, 'bull_strategy': 'breakout', 'bull_bb_std_mult': 3.3852304748089246, 'bull_rsi_os': 40, 'bull_rsi_ob': 47, 'bull_adx_thresh': 30.360796751491335, 'bull_atr_min_pct': 0.01292698852955432, 'bull_atr_max_pct': 0.03996983422263176, 'bull_tp_mult': 2.94047527224814, 'bull_tsl_mult': 0.4543554266197666, 'bull_time_stop': 82, 'bull_use_sma': True, 'bull_use_ema': True, 'bull_use_atr': False, 'bull_use_adx': False, 'bull_use_spike': False, 'bull_rsi_required': True, 'bear_strategy': 'breakout', 'bear_bb_std_mult': 3.448791422464742, 'bear_rsi_os': 40, 'bear_rsi_ob': 55, 'bear_adx_thresh': 10.40855515378862, 'bear_atr_min_pct': 0.00389482791902784, 'bear_atr_max_pct': 0.045169514257750565, 'bear_tp_mult': 2.3739203194446867, 'bear_tsl_mult': 0.8497005649980403, 'bear_time_stop': 116, 'bear_use_sma': False, 'bear_use_ema': True, 'bear_use_atr': True, 'bear_use_adx': True, 'bear_use_spike': False, 'bear_rsi_required': False, 'sideways_strategy': 'mean_reversion', 'sideways_bb_std_mult': 1.2578204244957876, 'sideways_rsi_os': 53, 'sideways_rsi_ob': 63, 'sideways_adx_thresh': 5.9972475941864865, 'sideways_atr_min_pct': 0.01859081882562892, 'sideways_atr_max_pct': 0.07432546959040331, 'sideways_tp_mult': 2.460358255869373, 'sideways_tsl_mult': 0.6943305379136634, 'sideways_time_stop': 168, 'sideways_use_sma': False, 'sideways_use_ema': False, 'sideways_use_atr': True, 'sideways_use_adx': False, 'sideways_use_spike': False, 'sideways_rsi_required': True}.
[I 2025-09-01 15:02:27,176] Trial 801 finished with values: [-1000000000.0, 1000000000.0] and parameters: {'p_sma': 35, 'p_std': 10, 'p_atr': 19, 'p_adx': 12, 'rsi_period': 66, 'ema1': 22, 'ema2': 17, 'slip_atr_k': 0.007790219516963487, 'slip_spread_k': 0.26791939708597107, 'spread_hl_frac': 0.010181974507376935, 'bb_std_mult': 1.8785658590352146, 'rsi_os': 5, 'rsi_ob': 83, 'vol_spike': 0.13582476038808242, 'adx_thresh': 26.23635030155635, 'atr_min_pct': 0.00517641014840573, 'atr_max_pct': 0.14317494091624286, 'tp_mult': 1.0515840052088767, 'tsl_mult': 0.44051860990219854, 'strategy': 'breakout', 'time_stop': 224, 'use_sma': False, 'use_atr': True, 'use_adx': True, 'use_ema': True, 'use_spike': False, 'rsi_required': True, 'edge_k': 1.35535373005748, 'edge_cap': 0.3472961063666764, 'bull_strategy': 'breakout', 'bull_bb_std_mult': 3.3853131184410614, 'bull_rsi_os': 35, 'bull_rsi_ob': 79, 'bull_adx_thresh': 7.817037192192812, 'bull_atr_min_pct': 0.004305463827782348, 'bull_atr_max_pct': 0.019553812837272536, 'bull_tp_mult': 2.9737194440384687, 'bull_tsl_mult': 0.3774440404560546, 'bull_time_stop': 52, 'bull_use_sma': True, 'bull_use_ema': True, 'bull_use_atr': False, 'bull_use_adx': False, 'bull_use_spike': False, 'bull_rsi_required': True, 'bear_strategy': 'breakout', 'bear_bb_std_mult': 3.5395444157134226, 'bear_rsi_os': 32, 'bear_rsi_ob': 78, 'bear_adx_thresh': 10.154765172831976, 'bear_atr_min_pct': 0.026568253075272996, 'bear_atr_max_pct': 0.10799735368156635, 'bear_tp_mult': 2.3422839873524017, 'bear_tsl_mult': 0.22089770689774169, 'bear_time_stop': 211, 'bear_use_sma': False, 'bear_use_ema': True, 'bear_use_atr': True, 'bear_use_adx': False, 'bear_use_spike': False, 'bear_rsi_required': False, 'sideways_strategy': 'mean_reversion', 'sideways_bb_std_mult': 1.3965714238896973, 'sideways_rsi_os': 53, 'sideways_rsi_ob': 67, 'sideways_adx_thresh': 6.599425211990882, 'sideways_atr_min_pct': 0.019876816496167675, 'sideways_atr_max_pct': 0.07553317119325725, 'sideways_tp_mult': 1.5133571099122558, 'sideways_tsl_mult': 0.2829614757710283, 'sideways_time_stop': 132, 'sideways_use_sma': False, 'sideways_use_ema': False, 'sideways_use_atr': True, 'sideways_use_adx': False, 'sideways_use_spike': False, 'sideways_rsi_required': True}.
