[I 2025-09-01 14:34:02,968] Trial 614 finished with values: [-1000000000.0, 1000000000.0] and parameters: {'p_sma': 41, 'p_std': 47, 'p_atr': 24, 'p_adx': 26, 'rsi_period': 68, 'ema1': 21, 'ema2': 16, 'slip_atr_k': 0.24584672208884017, 'slip_spread_k': 0.07387719546665081, 'spread_hl_frac': 0.002313412110286135, 'bb_std_mult': 2.952012795821, 'rsi_os': 39, 'rsi_ob': 79, 'vol_spike': 0.2347831169374145, 'adx_thresh': 26.88303094228694, 'atr_min_pct': 0.012114011685746103, 'atr_max_pct': 0.13509797819906957, 'tp_mult': 2.149455461084549, 'tsl_mult': 0.7805935489451594, 'strategy': 'mean_reversion', 'time_stop': 13, 'use_sma': True, 'use_atr': False, 'use_adx': True, 'use_ema': True, 'use_spike': True, 'rsi_required': False, 'edge_k': 0.8836715825071565, 'edge_cap': 0.336750362062314, 'bull_strategy': 'breakout', 'bull_bb_std_mult': 3.531569290641964, 'bull_rsi_os': 33, 'bull_rsi_ob': 54, 'bull_adx_thresh': 29.22744008554317, 'bull_atr_min_pct': 0.014187792062765802, 'bull_atr_max_pct': 0.02157459921063767, 'bull_tp_mult': 1.6148369439521297, 'bull_tsl_mult': 0.44328891386095887, 'bull_time_stop': 102, 'bull_use_sma': False, 'bull_use_ema': True, 'bull_use_atr': False, 'bull_use_adx': True, 'bull_use_spike': True, 'bull_rsi_required': True, 'bear_strategy': 'mean_reversion', 'bear_bb_std_mult': 3.400951096306542, 'bear_rsi_os': 33, 'bear_rsi_ob': 67, 'bear_adx_thresh': 22.625562193279137, 'bear_atr_min_pct': 0.024101262089486514, 'bear_atr_max_pct': 0.04530941264026902, 'bear_tp_mult': 2.239493702012225, 'bear_tsl_mult': 0.13958916511378047, 'bear_time_stop': 145, 'bear_use_sma': False, 'bear_use_ema': True, 'bear_use_atr': True, 'bear_use_adx': True, 'bear_use_spike': False, 'bear_rsi_required': True, 'sideways_strategy': 'breakout', 'sideways_bb_std_mult': 0.6756742718951625, 'sideways_rsi_os': 50, 'sideways_rsi_ob': 68, 'sideways_adx_thresh': 9.980855440633043, 'sideways_atr_min_pct': 0.02070267723373803, 'sideways_atr_max_pct': 0.09050263313732138, 'sideways_tp_mult': 2.709987562472656, 'sideways_tsl_mult': 0.3467642801916436, 'sideways_time_stop': 113, 'sideways_use_sma': True, 'sideways_use_ema': False, 'sideways_use_atr': True, 'sideways_use_adx': True, 'sideways_use_spike': True, 'sideways_rsi_required': False}.
[I 2025-09-01 14:34:03,755] Trial 612 finished with values: [-1000000000.0, 1000000000.0] and parameters: {'p_sma': 41, 'p_std': 50, 'p_atr': 23, 'p_adx': 27, 'rsi_period': 38, 'ema1': 20, 'ema2': 33, 'slip_atr_k': 0.05232663132800819, 'slip_spread_k': 0.8829900104970333, 'spread_hl_frac': 0.0025395607563670616, 'bb_std_mult': 1.5498917530775767, 'rsi_os': 39, 'rsi_ob': 54, 'vol_spike': 0.2520358660994364, 'adx_thresh': 23.62883496551699, 'atr_min_pct': 0.02814013687173551, 'atr_max_pct': 0.06730731949511268, 'tp_mult': 2.9858126568199888, 'tsl_mult': 0.7728092408194143, 'strategy': 'mean_reversion', 'time_stop': 234, 'use_sma': True, 'use_atr': False, 'use_adx': True, 'use_ema': True, 'use_spike': True, 'rsi_required': False, 'edge_k': 0.8680987715650704, 'edge_cap': 0.3404842306549058, 'bull_strategy': 'breakout', 'bull_bb_std_mult': 0.8051675047187601, 'bull_rsi_os': 8, 'bull_rsi_ob': 56, 'bull_adx_thresh': 26.910126826788783, 'bull_atr_min_pct': 0.0141576215762033, 'bull_atr_max_pct': 0.02052734692896518, 'bull_tp_mult': 1.6319768689274068, 'bull_tsl_mult': 0.42920009774308376, 'bull_time_stop': 78, 'bull_use_sma': True, 'bull_use_ema': True, 'bull_use_atr': False, 'bull_use_adx': False, 'bull_use_spike': True, 'bull_rsi_required': True, 'bear_strategy': 'breakout', 'bear_bb_std_mult': 2.8625058342448284, 'bear_rsi_os': 13, 'bear_rsi_ob': 83, 'bear_adx_thresh': 22.882743723760424, 'bear_atr_min_pct': 0.003558685524100909, 'bear_atr_max_pct': 0.04057611602707775, 'bear_tp_mult': 2.264370393102574, 'bear_tsl_mult': 0.1451129493330601, 'bear_time_stop': 224, 'bear_use_sma': True, 'bear_use_ema': True, 'bear_use_atr': True, 'bear_use_adx': True, 'bear_use_spike': True, 'bear_rsi_required': True, 'sideways_strategy': 'breakout', 'sideways_bb_std_mult': 2.87632229148669, 'sideways_rsi_os': 5, 'sideways_rsi_ob': 84, 'sideways_adx_thresh': 10.140877898942634, 'sideways_atr_min_pct': 0.020565930280098364, 'sideways_atr_max_pct': 0.06948172962214401, 'sideways_tp_mult': 2.792328495899763, 'sideways_tsl_mult': 0.26732347345125984, 'sideways_time_stop': 210, 'sideways_use_sma': True, 'sideways_use_ema': True, 'sideways_use_atr': False, 'sideways_use_adx': True, 'sideways_use_spike': False, 'sideways_rsi_required': True}.
[I 2025-09-01 14:34:04,007] Trial 613 finished with values: [-1000000000.0, 1000000000.0] and parameters: {'p_sma': 35, 'p_std': 47, 'p_atr': 24, 'p_adx': 12, 'rsi_period': 74, 'ema1': 20, 'ema2': 42, 'slip_atr_k': 0.013019408520787921, 'slip_spread_k': 0.16542802972414955, 'spread_hl_frac': 0.018968168879921775, 'bb_std_mult': 1.6967511469759857, 'rsi_os': 15, 'rsi_ob': 82, 'vol_spike': 0.23148519358853797, 'adx_thresh': 6.263873897252454, 'atr_min_pct': 0.026639152205798603, 'atr_max_pct': 0.13227188286437538, 'tp_mult': 1.289969591105016, 'tsl_mult': 0.06560166714828886, 'strategy': 'mean_reversion', 'time_stop': 14, 'use_sma': True, 'use_atr': False, 'use_adx': True, 'use_ema': True, 'use_spike': True, 'rsi_required': False, 'edge_k': 1.7217183372126685, 'edge_cap': 0.3370241399160562, 'bull_strategy': 'breakout', 'bull_bb_std_mult': 3.3080386415263114, 'bull_rsi_os': 43, 'bull_rsi_ob': 46, 'bull_adx_thresh': 28.780344887706626, 'bull_atr_min_pct': 0.01750600708063267, 'bull_atr_max_pct': 0.021301686625286104, 'bull_tp_mult': 2.7631935530177465, 'bull_tsl_mult': 0.4468703151053385, 'bull_time_stop': 246, 'bull_use_sma': True, 'bull_use_ema': True, 'bull_use_atr': False, 'bull_use_adx': False, 'bull_use_spike': True, 'bull_rsi_required': True, 'bear_strategy': 'mean_reversion', 'bear_bb_std_mult': 2.2295659932183702, 'bear_rsi_os': 30, 'bear_rsi_ob': 67, 'bear_adx_thresh': 11.91879539165301, 'bear_atr_min_pct': 0.008937754625843635, 'bear_atr_max_pct': 0.05122557640099139, 'bear_tp_mult': 2.3013570026055152, 'bear_tsl_mult': 0.28510606965766083, 'bear_time_stop': 223, 'bear_use_sma': True, 'bear_use_ema': True, 'bear_use_atr': True, 'bear_use_adx': True, 'bear_use_spike': True, 'bear_rsi_required': True, 'sideways_strategy': 'breakout', 'sideways_bb_std_mult': 1.5205109928883318, 'sideways_rsi_os': 50, 'sideways_rsi_ob': 67, 'sideways_adx_thresh': 9.553606309234127, 'sideways_atr_min_pct': 0.02060765722146352, 'sideways_atr_max_pct': 0.06884640302026192, 'sideways_tp_mult': 2.7076886456790628, 'sideways_tsl_mult': 0.2754875388908907, 'sideways_time_stop': 179, 'sideways_use_sma': True, 'sideways_use_ema': True, 'sideways_use_atr': False, 'sideways_use_adx': True, 'sideways_use_spike': True, 'sideways_rsi_required': True}.
[I 2025-09-01 14:34:40,101] Trial 618 finished with values: [-1000000000.0, 1000000000.0] and parameters: {'p_sma': 6, 'p_std': 60, 'p_atr': 25, 'p_adx': 12, 'rsi_period': 42, 'ema1': 17, 'ema2': 18, 'slip_atr_k': 0.004661645625005468, 'slip_spread_k': 0.057541838277020904, 'spread_hl_frac': 0.004093219548143263, 'bb_std_mult': 1.8189021645474077, 'rsi_os': 8, 'rsi_ob': 73, 'vol_spike': 0.1619442360438938, 'adx_thresh': 19.654319097553795, 'atr_min_pct': 0.025429234211261594, 'atr_max_pct': 0.1420192240808702, 'tp_mult': 1.0142296569985263, 'tsl_mult': 0.3152599810820013, 'strategy': 'mean_reversion', 'time_stop': 255, 'use_sma': True, 'use_atr': False, 'use_adx': False, 'use_ema': True, 'use_spike': True, 'rsi_required': False, 'edge_k': 1.6112401409392758, 'edge_cap': 0.49689198303744786, 'bull_strategy': 'mean_reversion', 'bull_bb_std_mult': 3.1776761102449584, 'bull_rsi_os': 34, 'bull_rsi_ob': 72, 'bull_adx_thresh': 9.112348245069965, 'bull_atr_min_pct': 0.0025672361833825033, 'bull_atr_max_pct': 0.03212482292952537, 'bull_tp_mult': 1.2818814728258912, 'bull_tsl_mult': 0.48213478912646224, 'bull_time_stop': 85, 'bull_use_sma': False, 'bull_use_ema': True, 'bull_use_atr': True, 'bull_use_adx': True, 'bull_use_spike': False, 'bull_rsi_required': True, 'bear_strategy': 'breakout', 'bear_bb_std_mult': 3.5981315654836026, 'bear_rsi_os': 33, 'bear_rsi_ob': 90, 'bear_adx_thresh': 10.460406380482032, 'bear_atr_min_pct': 0.002798952384975288, 'bear_atr_max_pct': 0.0427391593707149, 'bear_tp_mult': 2.0134173196241125, 'bear_tsl_mult': 0.13223443179964464, 'bear_time_stop': 215, 'bear_use_sma': False, 'bear_use_ema': True, 'bear_use_atr': True, 'bear_use_adx': True, 'bear_use_spike': False, 'bear_rsi_required': True, 'sideways_strategy': 'breakout', 'sideways_bb_std_mult': 1.4989060998250505, 'sideways_rsi_os': 24, 'sideways_rsi_ob': 67, 'sideways_adx_thresh': 6.785133225269562, 'sideways_atr_min_pct': 0.011938024624391566, 'sideways_atr_max_pct': 0.05627460450459787, 'sideways_tp_mult': 2.8610571318981, 'sideways_tsl_mult': 0.7101822016867857, 'sideways_time_stop': 171, 'sideways_use_sma': True, 'sideways_use_ema': False, 'sideways_use_atr': True, 'sideways_use_adx': False, 'sideways_use_spike': False, 'sideways_rsi_required': False}.
[I 2025-09-01 14:34:41,328] Trial 615 finished with values: [-1000000000.0, 1000000000.0] and parameters: {'p_sma': 42, 'p_std': 47, 'p_atr': 14, 'p_adx': 10, 'rsi_period': 68, 'ema1': 11, 'ema2': 18, 'slip_atr_k': 0.052005381735732464, 'slip_spread_k': 0.07485464008116205, 'spread_hl_frac': 0.004075730684868448, 'bb_std_mult': 1.6752864725897025, 'rsi_os': 39, 'rsi_ob': 82, 'vol_spike': 0.23519596872499052, 'adx_thresh': 26.938346046966693, 'atr_min_pct': 0.02561628526185214, 'atr_max_pct': 0.0703116035951455, 'tp_mult': 1.0370203084226235, 'tsl_mult': 0.7733785981937686, 'strategy': 'mean_reversion', 'time_stop': 253, 'use_sma': True, 'use_atr': False, 'use_adx': True, 'use_ema': True, 'use_spike': True, 'rsi_required': False, 'edge_k': 1.715767166740648, 'edge_cap': 0.2712609568393922, 'bull_strategy': 'breakout', 'bull_bb_std_mult': 0.8037494088735722, 'bull_rsi_os': 33, 'bull_rsi_ob': 54, 'bull_adx_thresh': 28.67349895729389, 'bull_atr_min_pct': 0.013194727319559667, 'bull_atr_max_pct': 0.13772351885675493, 'bull_tp_mult': 2.6188493788448577, 'bull_tsl_mult': 0.49716259822833686, 'bull_time_stop': 104, 'bull_use_sma': False, 'bull_use_ema': True, 'bull_use_atr': False, 'bull_use_adx': True, 'bull_use_spike': True, 'bull_rsi_required': True, 'bear_strategy': 'mean_reversion', 'bear_bb_std_mult': 2.2369889603097355, 'bear_rsi_os': 33, 'bear_rsi_ob': 92, 'bear_adx_thresh': 11.91278743997401, 'bear_atr_min_pct': 0.002850838716531522, 'bear_atr_max_pct': 0.050358789680735004, 'bear_tp_mult': 1.0159043741657448, 'bear_tsl_mult': 0.2874870131867653, 'bear_time_stop': 220, 'bear_use_sma': False, 'bear_use_ema': True, 'bear_use_atr': True, 'bear_use_adx': True, 'bear_use_spike': False, 'bear_rsi_required': True, 'sideways_strategy': 'breakout', 'sideways_bb_std_mult': 1.277785174857117, 'sideways_rsi_os': 5, 'sideways_rsi_ob': 67, 'sideways_adx_thresh': 6.699541439608616, 'sideways_atr_min_pct': 0.0016854140089055652, 'sideways_atr_max_pct': 0.06685863301841315, 'sideways_tp_mult': 2.7785806810500913, 'sideways_tsl_mult': 0.7046137958444726, 'sideways_time_stop': 246, 'sideways_use_sma': True, 'sideways_use_ema': True, 'sideways_use_atr': True, 'sideways_use_adx': False, 'sideways_use_spike': True, 'sideways_rsi_required': False}.
[I 2025-09-01 14:34:41,556] Trial 617 finished with values: [-1000000000.0, 1000000000.0] and parameters: {'p_sma': 37, 'p_std': 46, 'p_atr': 25, 'p_adx': 12, 'rsi_period': 42, 'ema1': 25, 'ema2': 47, 'slip_atr_k': 0.01288257334785847, 'slip_spread_k': 0.06548695044052813, 'spread_hl_frac': 0.03178878004054654, 'bb_std_mult': 1.932962214456055, 'rsi_os': 25, 'rsi_ob': 82, 'vol_spike': 0.23219208795875257, 'adx_thresh': 24.398233833656796, 'atr_min_pct': 0.026400781296428023, 'atr_max_pct': 0.03587021476719637, 'tp_mult': 1.1394243925363847, 'tsl_mult': 0.319510661558692, 'strategy': 'mean_reversion', 'time_stop': 253, 'use_sma': True, 'use_atr': False, 'use_adx': False, 'use_ema': True, 'use_spike': True, 'rsi_required': False, 'edge_k': 1.3961575804597006, 'edge_cap': 0.2739110476475644, 'bull_strategy': 'breakout', 'bull_bb_std_mult': 1.7882032661992273, 'bull_rsi_os': 33, 'bull_rsi_ob': 74, 'bull_adx_thresh': 32.53423702730838, 'bull_atr_min_pct': 0.019851702035274137, 'bull_atr_max_pct': 0.03889613744157731, 'bull_tp_mult': 2.203554377202434, 'bull_tsl_mult': 0.5353383698391507, 'bull_time_stop': 94, 'bull_use_sma': True, 'bull_use_ema': True, 'bull_use_atr': True, 'bull_use_adx': True, 'bull_use_spike': False, 'bull_rsi_required': True, 'bear_strategy': 'mean_reversion', 'bear_bb_std_mult': 3.481570556941398, 'bear_rsi_os': 30, 'bear_rsi_ob': 85, 'bear_adx_thresh': 18.501733124281234, 'bear_atr_min_pct': 0.019364378534420867, 'bear_atr_max_pct': 0.051126438309789746, 'bear_tp_mult': 1.462831164393734, 'bear_tsl_mult': 0.15939067433747298, 'bear_time_stop': 217, 'bear_use_sma': True, 'bear_use_ema': True, 'bear_use_atr': True, 'bear_use_adx': True, 'bear_use_spike': False, 'bear_rsi_required': True, 'sideways_strategy': 'breakout', 'sideways_bb_std_mult': 1.0908486554756736, 'sideways_rsi_os': 24, 'sideways_rsi_ob': 67, 'sideways_adx_thresh': 6.874030734883499, 'sideways_atr_min_pct': 0.019733887487589554, 'sideways_atr_max_pct': 0.022946609054634547, 'sideways_tp_mult': 1.7162285608830818, 'sideways_tsl_mult': 0.2796535095429121, 'sideways_time_stop': 247, 'sideways_use_sma': True, 'sideways_use_ema': False, 'sideways_use_atr': True, 'sideways_use_adx': False, 'sideways_use_spike': True, 'sideways_rsi_required': True}.
[I 2025-09-01 14:34:42,041] Trial 616 finished with values: [-1000000000.0, 1000000000.0] and parameters: {'p_sma': 36, 'p_std': 47, 'p_atr': 25, 'p_adx': 29, 'rsi_period': 69, 'ema1': 20, 'ema2': 18, 'slip_atr_k': 0.012760992041336211, 'slip_spread_k': 0.5862565022237722, 'spread_hl_frac': 0.00421099230948806, 'bb_std_mult': 0.9976130019841016, 'rsi_os': 6, 'rsi_ob': 82, 'vol_spike': 0.22995718252859948, 'adx_thresh': 24.65772419864608, 'atr_min_pct': 0.025605068459160024, 'atr_max_pct': 0.07003618734949937, 'tp_mult': 2.9854765758337165, 'tsl_mult': 0.7320673034458963, 'strategy': 'mean_reversion', 'time_stop': 233, 'use_sma': True, 'use_atr': False, 'use_adx': True, 'use_ema': True, 'use_spike': True, 'rsi_required': False, 'edge_k': 0.9386559746570527, 'edge_cap': 0.5436551818939106, 'bull_strategy': 'breakout', 'bull_bb_std_mult': 3.176112642463728, 'bull_rsi_os': 33, 'bull_rsi_ob': 46, 'bull_adx_thresh': 11.509693909349307, 'bull_atr_min_pct': 0.0026050795336586656, 'bull_atr_max_pct': 0.017425902079795517, 'bull_tp_mult': 2.7556834799773533, 'bull_tsl_mult': 0.3959455842590618, 'bull_time_stop': 264, 'bull_use_sma': True, 'bull_use_ema': True, 'bull_use_atr': False, 'bull_use_adx': False, 'bull_use_spike': False, 'bull_rsi_required': True, 'bear_strategy': 'mean_reversion', 'bear_bb_std_mult': 2.83832608375316, 'bear_rsi_os': 31, 'bear_rsi_ob': 47, 'bear_adx_thresh': 10.540138723535854, 'bear_atr_min_pct': 0.019304340577785503, 'bear_atr_max_pct': 0.05170291597152475, 'bear_tp_mult': 2.236299328004955, 'bear_tsl_mult': 0.8533344904306361, 'bear_time_stop': 224, 'bear_use_sma': True, 'bear_use_ema': True, 'bear_use_atr': True, 'bear_use_adx': True, 'bear_use_spike': False, 'bear_rsi_required': True, 'sideways_strategy': 'breakout', 'sideways_bb_std_mult': 1.278693734713256, 'sideways_rsi_os': 51, 'sideways_rsi_ob': 67, 'sideways_adx_thresh': 6.767381436793057, 'sideways_atr_min_pct': 0.01188341067425593, 'sideways_atr_max_pct': 0.025370181218914663, 'sideways_tp_mult': 1.6535694082845818, 'sideways_tsl_mult': 0.20247869764189658, 'sideways_time_stop': 173, 'sideways_use_sma': True, 'sideways_use_ema': True, 'sideways_use_atr': True, 'sideways_use_adx': False, 'sideways_use_spike': True, 'sideways_rsi_required': True}.
[I 2025-09-01 14:34:43,049] Trial 619 finished with values: [-1000000000.0, 1000000000.0] and parameters: {'p_sma': 51, 'p_std': 14, 'p_atr': 27, 'p_adx': 13, 'rsi_period': 68, 'ema1': 11, 'ema2': 19, 'slip_atr_k': 0.19084303583811643, 'slip_spread_k': 0.1048706310701446, 'spread_hl_frac': 0.03951291866904419, 'bb_std_mult': 0.7577459451779494, 'rsi_os': 30, 'rsi_ob': 50, 'vol_spike': 0.27944224191852857, 'adx_thresh': 24.39975755644308, 'atr_min_pct': 0.006652797454041886, 'atr_max_pct': 0.10572605247929512, 'tp_mult': 1.1380082403349943, 'tsl_mult': 0.7327949687037929, 'strategy': 'mean_reversion', 'time_stop': 221, 'use_sma': True, 'use_atr': False, 'use_adx': False, 'use_ema': True, 'use_spike': True, 'rsi_required': False, 'edge_k': 1.3977247189719937, 'edge_cap': 0.2766315170248615, 'bull_strategy': 'breakout', 'bull_bb_std_mult': 1.480452517744914, 'bull_rsi_os': 36, 'bull_rsi_ob': 54, 'bull_adx_thresh': 30.50411954077764, 'bull_atr_min_pct': 0.003218851227483969, 'bull_atr_max_pct': 0.1372128266527694, 'bull_tp_mult': 1.486342804092585, 'bull_tsl_mult': 0.39752864543171207, 'bull_time_stop': 68, 'bull_use_sma': True, 'bull_use_ema': True, 'bull_use_atr': True, 'bull_use_adx': True, 'bull_use_spike': False, 'bull_rsi_required': True, 'bear_strategy': 'breakout', 'bear_bb_std_mult': 0.7446802595151256, 'bear_rsi_os': 42, 'bear_rsi_ob': 85, 'bear_adx_thresh': 21.53115722340607, 'bear_atr_min_pct': 0.001702469174516736, 'bear_atr_max_pct': 0.11934592829770932, 'bear_tp_mult': 2.3671099571671332, 'bear_tsl_mult': 0.54739415367353, 'bear_time_stop': 218, 'bear_use_sma': True, 'bear_use_ema': True, 'bear_use_atr': True, 'bear_use_adx': True, 'bear_use_spike': False, 'bear_rsi_required': True, 'sideways_strategy': 'breakout', 'sideways_bb_std_mult': 1.1671485793632064, 'sideways_rsi_os': 18, 'sideways_rsi_ob': 69, 'sideways_adx_thresh': 10.941460985929996, 'sideways_atr_min_pct': 0.01980064205729775, 'sideways_atr_max_pct': 0.06659047800927324, 'sideways_tp_mult': 2.7730563202541427, 'sideways_tsl_mult': 0.21189311054656806, 'sideways_time_stop': 173, 'sideways_use_sma': True, 'sideways_use_ema': False, 'sideways_use_atr': True, 'sideways_use_adx': False, 'sideways_use_spike': False, 'sideways_rsi_required': True}.
[I 2025-09-01 14:34:43,081] Trial 620 finished with values: [-1000000000.0, 1000000000.0] and parameters: {'p_sma': 36, 'p_std': 12, 'p_atr': 26, 'p_adx': 29, 'rsi_period': 56, 'ema1': 15, 'ema2': 19, 'slip_atr_k': 0.005590995698829964, 'slip_spread_k': 0.10488687590787459, 'spread_hl_frac': 0.006584249402844624, 'bb_std_mult': 0.7502500237839906, 'rsi_os': 54, 'rsi_ob': 81, 'vol_spike': 0.22440896372314204, 'adx_thresh': 27.763018319903455, 'atr_min_pct': 0.016114372990303875, 'atr_max_pct': 0.1449074856710657, 'tp_mult': 1.0911303087972577, 'tsl_mult': 0.7303398944247966, 'strategy': 'mean_reversion', 'time_stop': 154, 'use_sma': False, 'use_atr': False, 'use_adx': False, 'use_ema': False, 'use_spike': False, 'rsi_required': True, 'edge_k': 0.9433542751381225, 'edge_cap': 0.5572338744942176, 'bull_strategy': 'breakout', 'bull_bb_std_mult': 1.4976552862427974, 'bull_rsi_os': 14, 'bull_rsi_ob': 55, 'bull_adx_thresh': 32.92396667954787, 'bull_atr_min_pct': 0.0016469366511804627, 'bull_atr_max_pct': 0.02737446249593722, 'bull_tp_mult': 1.9715794020902644, 'bull_tsl_mult': 0.4027255564974603, 'bull_time_stop': 262, 'bull_use_sma': True, 'bull_use_ema': True, 'bull_use_atr': True, 'bull_use_adx': True, 'bull_use_spike': False, 'bull_rsi_required': True, 'bear_strategy': 'breakout', 'bear_bb_std_mult': 0.7592577097753765, 'bear_rsi_os': 32, 'bear_rsi_ob': 62, 'bear_adx_thresh': 32.48029974824988, 'bear_atr_min_pct': 0.0015598809588559612, 'bear_atr_max_pct': 0.04428707136355276, 'bear_tp_mult': 2.5144881350149184, 'bear_tsl_mult': 0.09372306812061218, 'bear_time_stop': 79, 'bear_use_sma': True, 'bear_use_ema': False, 'bear_use_atr': False, 'bear_use_adx': False, 'bear_use_spike': False, 'bear_rsi_required': False, 'sideways_strategy': 'breakout', 'sideways_bb_std_mult': 2.1979474622003985, 'sideways_rsi_os': 51, 'sideways_rsi_ob': 55, 'sideways_adx_thresh': 6.198046637023836, 'sideways_atr_min_pct': 0.019956316617389853, 'sideways_atr_max_pct': 0.030336378886440342, 'sideways_tp_mult': 1.846218840356698, 'sideways_tsl_mult': 0.16178355515221438, 'sideways_time_stop': 172, 'sideways_use_sma': False, 'sideways_use_ema': False, 'sideways_use_atr': True, 'sideways_use_adx': True, 'sideways_use_spike': False, 'sideways_rsi_required': True}.
