[I 2025-09-01 13:38:57,817] Trial 236 finished with values: [-0.019056199330480528, 0.019946110346238086] and parameters: {'p_sma': 33, 'p_std': 48, 'p_atr': 21, 'p_adx': 7, 'rsi_period': 67, 'ema1': 21, 'ema2': 19, 'slip_atr_k': 0.028832684890583535, 'slip_spread_k': 0.6223300044091502, 'spread_hl_frac': 0.006536587333790731, 'bb_std_mult': 1.777809455958518, 'rsi_os': 38, 'rsi_ob': 74, 'vol_spike': 0.06080226735311796, 'adx_thresh': 33.946390613211676, 'atr_min_pct': 0.026900444760807912, 'atr_max_pct': 0.042514760529944386, 'tp_mult': 2.2607431756050396, 'tsl_mult': 0.18159985661421252, 'strategy': 'breakout', 'time_stop': 251, 'use_sma': True, 'use_atr': False, 'use_adx': False, 'use_ema': True, 'use_spike': True, 'rsi_required': False, 'edge_k': 0.45683217170975854, 'edge_cap': 0.343707833955542, 'bull_strategy': 'breakout', 'bull_bb_std_mult': 3.2388186588480847, 'bull_rsi_os': 41, 'bull_rsi_ob': 56, 'bull_adx_thresh': 22.68677063247293, 'bull_atr_min_pct': 0.0035180060091642208, 'bull_atr_max_pct': 0.11241728051431524, 'bull_tp_mult': 1.8471498722747042, 'bull_tsl_mult': 0.43106574965118954, 'bull_time_stop': 53, 'bull_use_sma': True, 'bull_use_ema': True, 'bull_use_atr': True, 'bull_use_adx': True, 'bull_use_spike': False, 'bull_rsi_required': True, 'bear_strategy': 'breakout', 'bear_bb_std_mult': 2.7622765548383654, 'bear_rsi_os': 33, 'bear_rsi_ob': 88, 'bear_adx_thresh': 11.864850314608992, 'bear_atr_min_pct': 0.00094900138040796, 'bear_atr_max_pct': 0.11896174173682564, 'bear_tp_mult': 2.289738319231075, 'bear_tsl_mult': 0.16181832716707792, 'bear_time_stop': 119, 'bear_use_sma': True, 'bear_use_ema': True, 'bear_use_atr': True, 'bear_use_adx': True, 'bear_use_spike': False, 'bear_rsi_required': True, 'sideways_strategy': 'breakout', 'sideways_bb_std_mult': 1.7197673015415564, 'sideways_rsi_os': 52, 'sideways_rsi_ob': 67, 'sideways_adx_thresh': 7.202735209314188, 'sideways_atr_min_pct': 0.008541313374709699, 'sideways_atr_max_pct': 0.13983460918168764, 'sideways_tp_mult': 2.2293311467774353, 'sideways_tsl_mult': 0.07666588492410026, 'sideways_time_stop': 15, 'sideways_use_sma': True, 'sideways_use_ema': False, 'sideways_use_atr': True, 'sideways_use_adx': True, 'sideways_use_spike': False, 'sideways_rsi_required': True}.
[I 2025-09-01 13:38:57,853] Trial 235 finished with values: [-1000000000.0, 1000000000.0] and parameters: {'p_sma': 30, 'p_std': 48, 'p_atr': 15, 'p_adx': 15, 'rsi_period': 67, 'ema1': 21, 'ema2': 58, 'slip_atr_k': 0.027381772479730174, 'slip_spread_k': 0.37698112814293067, 'spread_hl_frac': 0.006315126513440903, 'bb_std_mult': 1.7839699330276562, 'rsi_os': 38, 'rsi_ob': 92, 'vol_spike': 0.29098118510130555, 'adx_thresh': 26.568283127394107, 'atr_min_pct': 0.011125820848685703, 'atr_max_pct': 0.1366200845536816, 'tp_mult': 2.220497945195379, 'tsl_mult': 0.8963968929193604, 'strategy': 'breakout', 'time_stop': 250, 'use_sma': True, 'use_atr': False, 'use_adx': False, 'use_ema': True, 'use_spike': True, 'rsi_required': False, 'edge_k': 1.6910315850379931, 'edge_cap': 0.3460901195159788, 'bull_strategy': 'breakout', 'bull_bb_std_mult': 1.8928711464389067, 'bull_rsi_os': 51, 'bull_rsi_ob': 56, 'bull_adx_thresh': 15.869770932787866, 'bull_atr_min_pct': 0.029739138937999753, 'bull_atr_max_pct': 0.07042827677139318, 'bull_tp_mult': 2.537822074108312, 'bull_tsl_mult': 0.4347982430038482, 'bull_time_stop': 96, 'bull_use_sma': True, 'bull_use_ema': True, 'bull_use_atr': True, 'bull_use_adx': True, 'bull_use_spike': False, 'bull_rsi_required': True, 'bear_strategy': 'breakout', 'bear_bb_std_mult': 2.892172581511017, 'bear_rsi_os': 33, 'bear_rsi_ob': 88, 'bear_adx_thresh': 11.781498989721747, 'bear_atr_min_pct': 0.001657508247974438, 'bear_atr_max_pct': 0.04264610458288695, 'bear_tp_mult': 2.247479120384909, 'bear_tsl_mult': 0.15323417556933977, 'bear_time_stop': 53, 'bear_use_sma': True, 'bear_use_ema': True, 'bear_use_atr': True, 'bear_use_adx': True, 'bear_use_spike': False, 'bear_rsi_required': True, 'sideways_strategy': 'breakout', 'sideways_bb_std_mult': 1.5452415096902627, 'sideways_rsi_os': 49, 'sideways_rsi_ob': 94, 'sideways_adx_thresh': 7.342900828383037, 'sideways_atr_min_pct': 0.020478346863795002, 'sideways_atr_max_pct': 0.1318894340014212, 'sideways_tp_mult': 2.474778416074148, 'sideways_tsl_mult': 0.07075293407346434, 'sideways_time_stop': 181, 'sideways_use_sma': True, 'sideways_use_ema': False, 'sideways_use_atr': True, 'sideways_use_adx': True, 'sideways_use_spike': False, 'sideways_rsi_required': True}.
[I 2025-09-01 13:38:58,133] Trial 234 finished with values: [-0.017018376057710727, 0.01805491398809196] and parameters: {'p_sma': 33, 'p_std': 48, 'p_atr': 25, 'p_adx': 7, 'rsi_period': 67, 'ema1': 21, 'ema2': 43, 'slip_atr_k': 0.011960029190818079, 'slip_spread_k': 0.3532389470074615, 'spread_hl_frac': 0.006606707059854844, 'bb_std_mult': 1.7508277136355725, 'rsi_os': 14, 'rsi_ob': 83, 'vol_spike': 0.2881059299290014, 'adx_thresh': 25.52601257391779, 'atr_min_pct': 0.018088041083015514, 'atr_max_pct': 0.11789441970894417, 'tp_mult': 1.505775775207573, 'tsl_mult': 0.13120768443951247, 'strategy': 'breakout', 'time_stop': 248, 'use_sma': True, 'use_atr': False, 'use_adx': False, 'use_ema': True, 'use_spike': True, 'rsi_required': False, 'edge_k': 1.1754120239144827, 'edge_cap': 0.33923168485526084, 'bull_strategy': 'breakout', 'bull_bb_std_mult': 3.2656340916601034, 'bull_rsi_os': 19, 'bull_rsi_ob': 87, 'bull_adx_thresh': 22.94032849575709, 'bull_atr_min_pct': 0.003320786288372197, 'bull_atr_max_pct': 0.06923008229159545, 'bull_tp_mult': 1.1553997753800906, 'bull_tsl_mult': 0.18526860302952525, 'bull_time_stop': 55, 'bull_use_sma': True, 'bull_use_ema': True, 'bull_use_atr': True, 'bull_use_adx': True, 'bull_use_spike': False, 'bull_rsi_required': True, 'bear_strategy': 'breakout', 'bear_bb_std_mult': 2.4400945161300864, 'bear_rsi_os': 33, 'bear_rsi_ob': 88, 'bear_adx_thresh': 11.805934000809618, 'bear_atr_min_pct': 0.001153700060566928, 'bear_atr_max_pct': 0.045745617579575626, 'bear_tp_mult': 2.2493130064633, 'bear_tsl_mult': 0.1397011525185367, 'bear_time_stop': 119, 'bear_use_sma': True, 'bear_use_ema': True, 'bear_use_atr': True, 'bear_use_adx': True, 'bear_use_spike': False, 'bear_rsi_required': True, 'sideways_strategy': 'breakout', 'sideways_bb_std_mult': 1.3671814515993588, 'sideways_rsi_os': 51, 'sideways_rsi_ob': 94, 'sideways_adx_thresh': 7.0925927481680935, 'sideways_atr_min_pct': 0.008558578040147754, 'sideways_atr_max_pct': 0.1317363665983855, 'sideways_tp_mult': 1.086037767960087, 'sideways_tsl_mult': 0.2688697775094118, 'sideways_time_stop': 180, 'sideways_use_sma': True, 'sideways_use_ema': False, 'sideways_use_atr': True, 'sideways_use_adx': True, 'sideways_use_spike': False, 'sideways_rsi_required': True}.
[I 2025-09-01 13:38:58,544] Trial 237 finished with values: [-0.005098312835331464, 0.007294938853204024] and parameters: {'p_sma': 36, 'p_std': 48, 'p_atr': 25, 'p_adx': 12, 'rsi_period': 66, 'ema1': 21, 'ema2': 18, 'slip_atr_k': 0.013019544169229152, 'slip_spread_k': 0.07702518462955671, 'spread_hl_frac': 0.006293534999762711, 'bb_std_mult': 1.7704347552700619, 'rsi_os': 39, 'rsi_ob': 83, 'vol_spike': 0.23589445072531426, 'adx_thresh': 25.32093885985236, 'atr_min_pct': 0.02649348882473908, 'atr_max_pct': 0.13789521457926335, 'tp_mult': 1.0741662656925959, 'tsl_mult': 0.7450409706348091, 'strategy': 'mean_reversion', 'time_stop': 239, 'use_sma': True, 'use_atr': False, 'use_adx': False, 'use_ema': True, 'use_spike': True, 'rsi_required': False, 'edge_k': 0.9027686556703394, 'edge_cap': 0.3334487439380311, 'bull_strategy': 'breakout', 'bull_bb_std_mult': 3.254237490043045, 'bull_rsi_os': 35, 'bull_rsi_ob': 55, 'bull_adx_thresh': 30.292169842364572, 'bull_atr_min_pct': 0.0038082019101921003, 'bull_atr_max_pct': 0.023150650821080063, 'bull_tp_mult': 2.8327028683158266, 'bull_tsl_mult': 0.4322510643505918, 'bull_time_stop': 92, 'bull_use_sma': True, 'bull_use_ema': True, 'bull_use_atr': True, 'bull_use_adx': True, 'bull_use_spike': False, 'bull_rsi_required': True, 'bear_strategy': 'breakout', 'bear_bb_std_mult': 3.5801683622379756, 'bear_rsi_os': 33, 'bear_rsi_ob': 88, 'bear_adx_thresh': 11.943647080489706, 'bear_atr_min_pct': 0.0028093052565134015, 'bear_atr_max_pct': 0.0447376106149427, 'bear_tp_mult': 2.2535150643706685, 'bear_tsl_mult': 0.14758221590933532, 'bear_time_stop': 220, 'bear_use_sma': True, 'bear_use_ema': True, 'bear_use_atr': True, 'bear_use_adx': True, 'bear_use_spike': False, 'bear_rsi_required': True, 'sideways_strategy': 'breakout', 'sideways_bb_std_mult': 1.5805256318382783, 'sideways_rsi_os': 51, 'sideways_rsi_ob': 67, 'sideways_adx_thresh': 7.131512528059885, 'sideways_atr_min_pct': 0.020094649547808652, 'sideways_atr_max_pct': 0.06697757311519242, 'sideways_tp_mult': 2.7423716900888175, 'sideways_tsl_mult': 0.2747840554438884, 'sideways_time_stop': 175, 'sideways_use_sma': True, 'sideways_use_ema': False, 'sideways_use_atr': True, 'sideways_use_adx': True, 'sideways_use_spike': False, 'sideways_rsi_required': True}.
[I 2025-09-01 13:39:37,198] Trial 239 finished with values: [-1000000000.0, 1000000000.0] and parameters: {'p_sma': 36, 'p_std': 22, 'p_atr': 25, 'p_adx': 14, 'rsi_period': 66, 'ema1': 24, 'ema2': 19, 'slip_atr_k': 0.011799717123640294, 'slip_spread_k': 0.34401521241473704, 'spread_hl_frac': 0.00231948225476283, 'bb_std_mult': 1.946065062933902, 'rsi_os': 39, 'rsi_ob': 80, 'vol_spike': 0.02679276214548948, 'adx_thresh': 25.467136560339753, 'atr_min_pct': 0.017960225815883638, 'atr_max_pct': 0.04200297510952076, 'tp_mult': 1.4165516446653275, 'tsl_mult': 0.13756549847418242, 'strategy': 'mean_reversion', 'time_stop': 208, 'use_sma': True, 'use_atr': False, 'use_adx': False, 'use_ema': True, 'use_spike': True, 'rsi_required': False, 'edge_k': 0.4614293374299469, 'edge_cap': 0.28028642800687764, 'bull_strategy': 'mean_reversion', 'bull_bb_std_mult': 3.258379551872928, 'bull_rsi_os': 19, 'bull_rsi_ob': 58, 'bull_adx_thresh': 34.90102139534282, 'bull_atr_min_pct': 0.0034499962956760135, 'bull_atr_max_pct': 0.023437595814603557, 'bull_tp_mult': 1.8409123356778538, 'bull_tsl_mult': 0.1931395907917668, 'bull_time_stop': 55, 'bull_use_sma': True, 'bull_use_ema': True, 'bull_use_atr': True, 'bull_use_adx': True, 'bull_use_spike': False, 'bull_rsi_required': False, 'bear_strategy': 'breakout', 'bear_bb_std_mult': 3.543234159608695, 'bear_rsi_os': 32, 'bear_rsi_ob': 90, 'bear_adx_thresh': 26.983648658539792, 'bear_atr_min_pct': 0.001003394824613926, 'bear_atr_max_pct': 0.08337323685972112, 'bear_tp_mult': 2.268570386526732, 'bear_tsl_mult': 0.14336393924317847, 'bear_time_stop': 196, 'bear_use_sma': True, 'bear_use_ema': True, 'bear_use_atr': True, 'bear_use_adx': True, 'bear_use_spike': False, 'bear_rsi_required': True, 'sideways_strategy': 'breakout', 'sideways_bb_std_mult': 2.0133897459154495, 'sideways_rsi_os': 51, 'sideways_rsi_ob': 71, 'sideways_adx_thresh': 7.2398918117430915, 'sideways_atr_min_pct': 0.015513719794762536, 'sideways_atr_max_pct': 0.13036909057351181, 'sideways_tp_mult': 2.755417573730674, 'sideways_tsl_mult': 0.2849050658567903, 'sideways_time_stop': 16, 'sideways_use_sma': True, 'sideways_use_ema': False, 'sideways_use_atr': True, 'sideways_use_adx': True, 'sideways_use_spike': False, 'sideways_rsi_required': True}.
[I 2025-09-01 13:39:38,334] Trial 238 finished with values: [-0.017323658980867407, 0.0185305481883771] and parameters: {'p_sma': 35, 'p_std': 48, 'p_atr': 29, 'p_adx': 8, 'rsi_period': 69, 'ema1': 21, 'ema2': 30, 'slip_atr_k': 0.0130853079611296, 'slip_spread_k': 0.6338253292197719, 'spread_hl_frac': 0.005795338096373629, 'bb_std_mult': 1.7337709883860195, 'rsi_os': 39, 'rsi_ob': 94, 'vol_spike': 0.2377889854774845, 'adx_thresh': 25.626391687789976, 'atr_min_pct': 0.018089545654762184, 'atr_max_pct': 0.11500837990841571, 'tp_mult': 1.5036594807240204, 'tsl_mult': 0.13645258231685933, 'strategy': 'mean_reversion', 'time_stop': 221, 'use_sma': True, 'use_atr': False, 'use_adx': False, 'use_ema': True, 'use_spike': True, 'rsi_required': False, 'edge_k': 0.3621131848531276, 'edge_cap': 0.2782192667806553, 'bull_strategy': 'breakout', 'bull_bb_std_mult': 3.226103418285189, 'bull_rsi_os': 53, 'bull_rsi_ob': 67, 'bull_adx_thresh': 23.491317001621283, 'bull_atr_min_pct': 0.00252790820614422, 'bull_atr_max_pct': 0.1137660011308782, 'bull_tp_mult': 1.8407164501434714, 'bull_tsl_mult': 0.19330093621725386, 'bull_time_stop': 54, 'bull_use_sma': True, 'bull_use_ema': True, 'bull_use_atr': True, 'bull_use_adx': True, 'bull_use_spike': False, 'bull_rsi_required': True, 'bear_strategy': 'breakout', 'bear_bb_std_mult': 2.6511106205657655, 'bear_rsi_os': 33, 'bear_rsi_ob': 90, 'bear_adx_thresh': 20.083091375361576, 'bear_atr_min_pct': 0.0009204504166223093, 'bear_atr_max_pct': 0.11891733744934191, 'bear_tp_mult': 2.268774818189256, 'bear_tsl_mult': 0.14909377265135992, 'bear_time_stop': 217, 'bear_use_sma': True, 'bear_use_ema': True, 'bear_use_atr': True, 'bear_use_adx': True, 'bear_use_spike': False, 'bear_rsi_required': True, 'sideways_strategy': 'breakout', 'sideways_bb_std_mult': 2.0089150118048456, 'sideways_rsi_os': 52, 'sideways_rsi_ob': 67, 'sideways_adx_thresh': 7.200926176583215, 'sideways_atr_min_pct': 0.008578453970484715, 'sideways_atr_max_pct': 0.14018573208279797, 'sideways_tp_mult': 2.747438155500991, 'sideways_tsl_mult': 0.27845348727459274, 'sideways_time_stop': 221, 'sideways_use_sma': True, 'sideways_use_ema': False, 'sideways_use_atr': True, 'sideways_use_adx': True, 'sideways_use_spike': False, 'sideways_rsi_required': True}.
[I 2025-09-01 13:39:38,964] Trial 240 finished with values: [-1000000000.0, 1000000000.0] and parameters: {'p_sma': 36, 'p_std': 48, 'p_atr': 29, 'p_adx': 24, 'rsi_period': 66, 'ema1': 24, 'ema2': 31, 'slip_atr_k': 0.014510810606710922, 'slip_spread_k': 0.3549633121152761, 'spread_hl_frac': 0.00246184513876075, 'bb_std_mult': 2.9872737747377243, 'rsi_os': 25, 'rsi_ob': 94, 'vol_spike': 0.018210201671942622, 'adx_thresh': 25.763507398773896, 'atr_min_pct': 0.01804756907948482, 'atr_max_pct': 0.04264328762255143, 'tp_mult': 1.407886174156819, 'tsl_mult': 0.6795801346318902, 'strategy': 'mean_reversion', 'time_stop': 219, 'use_sma': True, 'use_atr': False, 'use_adx': False, 'use_ema': True, 'use_spike': True, 'rsi_required': False, 'edge_k': 0.3514903613973273, 'edge_cap': 0.27473794054053946, 'bull_strategy': 'mean_reversion', 'bull_bb_std_mult': 3.2410775688595086, 'bull_rsi_os': 41, 'bull_rsi_ob': 55, 'bull_adx_thresh': 6.7216031996331855, 'bull_atr_min_pct': 0.01104560395085805, 'bull_atr_max_pct': 0.02370782900966562, 'bull_tp_mult': 2.6215592421372422, 'bull_tsl_mult': 0.4141615801467587, 'bull_time_stop': 122, 'bull_use_sma': True, 'bull_use_ema': True, 'bull_use_atr': True, 'bull_use_adx': True, 'bull_use_spike': False, 'bull_rsi_required': False, 'bear_strategy': 'breakout', 'bear_bb_std_mult': 3.5967579292387146, 'bear_rsi_os': 32, 'bear_rsi_ob': 90, 'bear_adx_thresh': 10.706509943921095, 'bear_atr_min_pct': 0.0007944776758399431, 'bear_atr_max_pct': 0.1427777833595421, 'bear_tp_mult': 2.261685465653535, 'bear_tsl_mult': 0.1456672759183064, 'bear_time_stop': 118, 'bear_use_sma': True, 'bear_use_ema': True, 'bear_use_atr': True, 'bear_use_adx': True, 'bear_use_spike': False, 'bear_rsi_required': True, 'sideways_strategy': 'breakout', 'sideways_bb_std_mult': 1.9848512251523773, 'sideways_rsi_os': 52, 'sideways_rsi_ob': 67, 'sideways_adx_thresh': 7.149811546390298, 'sideways_atr_min_pct': 0.015610762601914486, 'sideways_atr_max_pct': 0.015912314477679115, 'sideways_tp_mult': 2.7495359131159356, 'sideways_tsl_mult': 0.2724044917034149, 'sideways_time_stop': 16, 'sideways_use_sma': True, 'sideways_use_ema': False, 'sideways_use_atr': True, 'sideways_use_adx': True, 'sideways_use_spike': False, 'sideways_rsi_required': True}.
[I 2025-09-01 13:39:39,633] Trial 241 finished with values: [-0.019082189360674184, 0.018500565263071797] and parameters: {'p_sma': 36, 'p_std': 51, 'p_atr': 26, 'p_adx': 14, 'rsi_period': 62, 'ema1': 24, 'ema2': 19, 'slip_atr_k': 0.01412438250909723, 'slip_spread_k': 0.07782158839883238, 'spread_hl_frac': 0.005724040776850496, 'bb_std_mult': 1.7260242108618296, 'rsi_os': 39, 'rsi_ob': 81, 'vol_spike': 0.020111808277537085, 'adx_thresh': 25.135277063534705, 'atr_min_pct': 0.026829734355163396, 'atr_max_pct': 0.133430104356009, 'tp_mult': 1.1774921104420348, 'tsl_mult': 0.7610123917512948, 'strategy': 'mean_reversion', 'time_stop': 218, 'use_sma': True, 'use_atr': False, 'use_adx': True, 'use_ema': True, 'use_spike': True, 'rsi_required': False, 'edge_k': 0.8736622278627014, 'edge_cap': 0.3568561989647215, 'bull_strategy': 'mean_reversion', 'bull_bb_std_mult': 3.192942877707753, 'bull_rsi_os': 35, 'bull_rsi_ob': 53, 'bull_adx_thresh': 34.34098378654889, 'bull_atr_min_pct': 0.006847723615833684, 'bull_atr_max_pct': 0.029169503318103182, 'bull_tp_mult': 2.8370121720635098, 'bull_tsl_mult': 0.465987448459945, 'bull_time_stop': 122, 'bull_use_sma': True, 'bull_use_ema': True, 'bull_use_atr': True, 'bull_use_adx': True, 'bull_use_spike': True, 'bull_rsi_required': True, 'bear_strategy': 'breakout', 'bear_bb_std_mult': 3.58124272357408, 'bear_rsi_os': 34, 'bear_rsi_ob': 88, 'bear_adx_thresh': 13.357178970055374, 'bear_atr_min_pct': 0.0006133452351620981, 'bear_atr_max_pct': 0.02525359919854893, 'bear_tp_mult': 2.2689983879354454, 'bear_tsl_mult': 0.14495740498932042, 'bear_time_stop': 217, 'bear_use_sma': True, 'bear_use_ema': True, 'bear_use_atr': True, 'bear_use_adx': True, 'bear_use_spike': False, 'bear_rsi_required': True, 'sideways_strategy': 'breakout', 'sideways_bb_std_mult': 1.4601223529342091, 'sideways_rsi_os': 52, 'sideways_rsi_ob': 67, 'sideways_adx_thresh': 6.525715771770022, 'sideways_atr_min_pct': 0.020011429586922043, 'sideways_atr_max_pct': 0.06894245704575619, 'sideways_tp_mult': 2.770068564880295, 'sideways_tsl_mult': 0.2674564092648819, 'sideways_time_stop': 171, 'sideways_use_sma': True, 'sideways_use_ema': False, 'sideways_use_atr': True, 'sideways_use_adx': True, 'sideways_use_spike': True, 'sideways_rsi_required': True}.
[I 2025-09-01 13:39:40,358] Trial 245 finished with values: [-1000000000.0, 1000000000.0] and parameters: {'p_sma': 35, 'p_std': 51, 'p_atr': 26, 'p_adx': 12, 'rsi_period': 61, 'ema1': 21, 'ema2': 17, 'slip_atr_k': 0.01221375587521791, 'slip_spread_k': 0.06877404652530583, 'spread_hl_frac': 0.005820756292428008, 'bb_std_mult': 1.7507901014803835, 'rsi_os': 54, 'rsi_ob': 83, 'vol_spike': 0.23256616063550165, 'adx_thresh': 24.629411584520547, 'atr_min_pct': 0.026389782666715624, 'atr_max_pct': 0.13297854181088722, 'tp_mult': 1.0638659824440715, 'tsl_mult': 0.7602495588899116, 'strategy': 'mean_reversion', 'time_stop': 215, 'use_sma': True, 'use_atr': False, 'use_adx': True, 'use_ema': True, 'use_spike': True, 'rsi_required': False, 'edge_k': 0.8993723687752037, 'edge_cap': 0.3477775353585904, 'bull_strategy': 'breakout', 'bull_bb_std_mult': 3.198990078016741, 'bull_rsi_os': 35, 'bull_rsi_ob': 53, 'bull_adx_thresh': 30.018514517775042, 'bull_atr_min_pct': 0.005123262062484105, 'bull_atr_max_pct': 0.03266937641411169, 'bull_tp_mult': 2.838822956996376, 'bull_tsl_mult': 0.4569711055534148, 'bull_time_stop': 93, 'bull_use_sma': True, 'bull_use_ema': True, 'bull_use_atr': True, 'bull_use_adx': True, 'bull_use_spike': True, 'bull_rsi_required': True, 'bear_strategy': 'breakout', 'bear_bb_std_mult': 3.4521373681397365, 'bear_rsi_os': 36, 'bear_rsi_ob': 87, 'bear_adx_thresh': 13.249636969274125, 'bear_atr_min_pct': 0.0017898871359873835, 'bear_atr_max_pct': 0.033625713753813694, 'bear_tp_mult': 2.3019411522398068, 'bear_tsl_mult': 0.17954370026993466, 'bear_time_stop': 219, 'bear_use_sma': True, 'bear_use_ema': True, 'bear_use_atr': True, 'bear_use_adx': True, 'bear_use_spike': False, 'bear_rsi_required': True, 'sideways_strategy': 'breakout', 'sideways_bb_std_mult': 1.4906408211961801, 'sideways_rsi_os': 51, 'sideways_rsi_ob': 67, 'sideways_adx_thresh': 6.37528398067539, 'sideways_atr_min_pct': 0.019916071298456385, 'sideways_atr_max_pct': 0.059378560369406405, 'sideways_tp_mult': 2.2209601601514843, 'sideways_tsl_mult': 0.2642182793526874, 'sideways_time_stop': 170, 'sideways_use_sma': True, 'sideways_use_ema': False, 'sideways_use_atr': True, 'sideways_use_adx': True, 'sideways_use_spike': True, 'sideways_rsi_required': True}.
