[I 2025-09-01 14:08:38,475] Trial 441 finished with values: [-1000000000.0, 1000000000.0] and parameters: {'p_sma': 13, 'p_std': 50, 'p_atr': 24, 'p_adx': 21, 'rsi_period': 31, 'ema1': 8, 'ema2': 34, 'slip_atr_k': 0.025700101989818067, 'slip_spread_k': 0.1367152440746551, 'spread_hl_frac': 0.018332608488218133, 'bb_std_mult': 1.1896474559327606, 'rsi_os': 37, 'rsi_ob': 61, 'vol_spike': 0.1636841367960283, 'adx_thresh': 5.602903449925359, 'atr_min_pct': 0.029251315824235156, 'atr_max_pct': 0.11859548221235541, 'tp_mult': 1.2255201328153607, 'tsl_mult': 0.7575319183703506, 'strategy': 'breakout', 'time_stop': 51, 'use_sma': False, 'use_atr': True, 'use_adx': True, 'use_ema': True, 'use_spike': True, 'rsi_required': True, 'edge_k': 0.7779324222266838, 'edge_cap': 0.12349656250180391, 'bull_strategy': 'breakout', 'bull_bb_std_mult': 1.307695037993922, 'bull_rsi_os': 31, 'bull_rsi_ob': 70, 'bull_adx_thresh': 30.889057103075984, 'bull_atr_min_pct': 0.005246122269741645, 'bull_atr_max_pct': 0.015988034592472535, 'bull_tp_mult': 2.3626324110851002, 'bull_tsl_mult': 0.40280290293567284, 'bull_time_stop': 106, 'bull_use_sma': True, 'bull_use_ema': True, 'bull_use_atr': False, 'bull_use_adx': False, 'bull_use_spike': False, 'bull_rsi_required': True, 'bear_strategy': 'breakout', 'bear_bb_std_mult': 2.457991830537937, 'bear_rsi_os': 20, 'bear_rsi_ob': 52, 'bear_adx_thresh': 15.678510934827676, 'bear_atr_min_pct': 0.0019326555114722273, 'bear_atr_max_pct': 0.044890480822131755, 'bear_tp_mult': 2.4402978781603695, 'bear_tsl_mult': 0.1525527770958075, 'bear_time_stop': 207, 'bear_use_sma': True, 'bear_use_ema': False, 'bear_use_atr': True, 'bear_use_adx': False, 'bear_use_spike': True, 'bear_rsi_required': True, 'sideways_strategy': 'breakout', 'sideways_bb_std_mult': 1.5181028821684286, 'sideways_rsi_os': 24, 'sideways_rsi_ob': 65, 'sideways_adx_thresh': 18.399103399836385, 'sideways_atr_min_pct': 0.005636762307758775, 'sideways_atr_max_pct': 0.06281777138972812, 'sideways_tp_mult': 2.722042319331328, 'sideways_tsl_mult': 0.6546664075780139, 'sideways_time_stop': 69, 'sideways_use_sma': True, 'sideways_use_ema': False, 'sideways_use_atr': False, 'sideways_use_adx': False, 'sideways_use_spike': True, 'sideways_rsi_required': True}.
[I 2025-09-01 14:08:38,942] Trial 442 finished with values: [-0.03923302388704797, 0.038903647712205225] and parameters: {'p_sma': 37, 'p_std': 30, 'p_atr': 25, 'p_adx': 21, 'rsi_period': 65, 'ema1': 28, 'ema2': 38, 'slip_atr_k': 0.010966276257814761, 'slip_spread_k': 0.0644058063216928, 'spread_hl_frac': 0.00786293360973453, 'bb_std_mult': 1.7311197456052332, 'rsi_os': 23, 'rsi_ob': 85, 'vol_spike': 0.27106772588293876, 'adx_thresh': 5.833498818764367, 'atr_min_pct': 0.015788104547456112, 'atr_max_pct': 0.060175109307726224, 'tp_mult': 1.2180044483241332, 'tsl_mult': 0.756420456333761, 'strategy': 'breakout', 'time_stop': 186, 'use_sma': True, 'use_atr': True, 'use_adx': True, 'use_ema': True, 'use_spike': True, 'rsi_required': False, 'edge_k': 0.8767574219054379, 'edge_cap': 0.3375440451252148, 'bull_strategy': 'breakout', 'bull_bb_std_mult': 2.088220688138587, 'bull_rsi_os': 5, 'bull_rsi_ob': 54, 'bull_adx_thresh': 31.565419711727234, 'bull_atr_min_pct': 0.003966962217455828, 'bull_atr_max_pct': 0.017665314489404657, 'bull_tp_mult': 2.1399897138138892, 'bull_tsl_mult': 0.45998742462148673, 'bull_time_stop': 173, 'bull_use_sma': False, 'bull_use_ema': True, 'bull_use_atr': True, 'bull_use_adx': False, 'bull_use_spike': False, 'bull_rsi_required': False, 'bear_strategy': 'breakout', 'bear_bb_std_mult': 3.59512272929309, 'bear_rsi_os': 35, 'bear_rsi_ob': 55, 'bear_adx_thresh': 24.90656001695853, 'bear_atr_min_pct': 0.0017102796654513595, 'bear_atr_max_pct': 0.04561671428223427, 'bear_tp_mult': 1.346257776502568, 'bear_tsl_mult': 0.8703024618542154, 'bear_time_stop': 214, 'bear_use_sma': True, 'bear_use_ema': False, 'bear_use_atr': True, 'bear_use_adx': False, 'bear_use_spike': True, 'bear_rsi_required': True, 'sideways_strategy': 'breakout', 'sideways_bb_std_mult': 2.0315667925922334, 'sideways_rsi_os': 53, 'sideways_rsi_ob': 65, 'sideways_adx_thresh': 6.004114465035031, 'sideways_atr_min_pct': 0.02000446723698774, 'sideways_atr_max_pct': 0.10011985928628109, 'sideways_tp_mult': 2.8814372956103647, 'sideways_tsl_mult': 0.35892357245945605, 'sideways_time_stop': 168, 'sideways_use_sma': True, 'sideways_use_ema': True, 'sideways_use_atr': False, 'sideways_use_adx': False, 'sideways_use_spike': True, 'sideways_rsi_required': True}.
[I 2025-09-01 14:09:18,274] Trial 446 finished with values: [-1000000000.0, 1000000000.0] and parameters: {'p_sma': 45, 'p_std': 54, 'p_atr': 25, 'p_adx': 26, 'rsi_period': 46, 'ema1': 23, 'ema2': 18, 'slip_atr_k': 0.04115287309209943, 'slip_spread_k': 0.5075713390984133, 'spread_hl_frac': 0.0054313481510820695, 'bb_std_mult': 1.385111113238508, 'rsi_os': 39, 'rsi_ob': 75, 'vol_spike': 0.2302065029605633, 'adx_thresh': 26.80213338593147, 'atr_min_pct': 0.02319113028244133, 'atr_max_pct': 0.14108343154937458, 'tp_mult': 2.292237124067295, 'tsl_mult': 0.7006142922211488, 'strategy': 'mean_reversion', 'time_stop': 229, 'use_sma': True, 'use_atr': False, 'use_adx': False, 'use_ema': True, 'use_spike': False, 'rsi_required': False, 'edge_k': 1.6603930241055167, 'edge_cap': 0.31377277406431836, 'bull_strategy': 'breakout', 'bull_bb_std_mult': 1.4135067236922123, 'bull_rsi_os': 40, 'bull_rsi_ob': 81, 'bull_adx_thresh': 28.870413103280995, 'bull_atr_min_pct': 0.0033765369197453847, 'bull_atr_max_pct': 0.021196760653801227, 'bull_tp_mult': 1.1469599725623634, 'bull_tsl_mult': 0.4379582867572998, 'bull_time_stop': 98, 'bull_use_sma': False, 'bull_use_ema': True, 'bull_use_atr': True, 'bull_use_adx': True, 'bull_use_spike': True, 'bull_rsi_required': False, 'bear_strategy': 'mean_reversion', 'bear_bb_std_mult': 1.9654092424681147, 'bear_rsi_os': 31, 'bear_rsi_ob': 87, 'bear_adx_thresh': 18.365978151371184, 'bear_atr_min_pct': 0.00312518249498858, 'bear_atr_max_pct': 0.0393919948716463, 'bear_tp_mult': 2.2823379958725307, 'bear_tsl_mult': 0.12955467305441734, 'bear_time_stop': 218, 'bear_use_sma': True, 'bear_use_ema': True, 'bear_use_atr': True, 'bear_use_adx': True, 'bear_use_spike': False, 'bear_rsi_required': False, 'sideways_strategy': 'breakout', 'sideways_bb_std_mult': 3.261332270679711, 'sideways_rsi_os': 18, 'sideways_rsi_ob': 68, 'sideways_adx_thresh': 6.282263388968116, 'sideways_atr_min_pct': 0.019546289506062728, 'sideways_atr_max_pct': 0.0187561606407848, 'sideways_tp_mult': 2.064576895637098, 'sideways_tsl_mult': 0.281696609714413, 'sideways_time_stop': 173, 'sideways_use_sma': False, 'sideways_use_ema': True, 'sideways_use_atr': True, 'sideways_use_adx': True, 'sideways_use_spike': False, 'sideways_rsi_required': False}.
[I 2025-09-01 14:09:18,280] Trial 445 finished with values: [-1000000000.0, 1000000000.0] and parameters: {'p_sma': 57, 'p_std': 47, 'p_atr': 25, 'p_adx': 11, 'rsi_period': 67, 'ema1': 23, 'ema2': 38, 'slip_atr_k': 0.24317469512468295, 'slip_spread_k': 0.5326117238043666, 'spread_hl_frac': 0.007666678230265429, 'bb_std_mult': 1.746086522605692, 'rsi_os': 40, 'rsi_ob': 68, 'vol_spike': 0.23064171562104024, 'adx_thresh': 21.28417775320427, 'atr_min_pct': 0.00715579145192367, 'atr_max_pct': 0.06101394914039825, 'tp_mult': 1.1158953717722924, 'tsl_mult': 0.016033656327539114, 'strategy': 'mean_reversion', 'time_stop': 115, 'use_sma': True, 'use_atr': False, 'use_adx': False, 'use_ema': True, 'use_spike': False, 'rsi_required': False, 'edge_k': 0.8777775280796567, 'edge_cap': 0.337509335223402, 'bull_strategy': 'breakout', 'bull_bb_std_mult': 3.4130372824520268, 'bull_rsi_os': 5, 'bull_rsi_ob': 54, 'bull_adx_thresh': 31.616929379792573, 'bull_atr_min_pct': 0.0035076167405158998, 'bull_atr_max_pct': 0.1123654013272973, 'bull_tp_mult': 2.923637565555898, 'bull_tsl_mult': 0.4628177617232605, 'bull_time_stop': 44, 'bull_use_sma': False, 'bull_use_ema': True, 'bull_use_atr': True, 'bull_use_adx': True, 'bull_use_spike': False, 'bull_rsi_required': False, 'bear_strategy': 'mean_reversion', 'bear_bb_std_mult': 3.5324888295416708, 'bear_rsi_os': 47, 'bear_rsi_ob': 87, 'bear_adx_thresh': 18.43270561680412, 'bear_atr_min_pct': 0.00857703752674379, 'bear_atr_max_pct': 0.03775956937847012, 'bear_tp_mult': 2.2795296909995013, 'bear_tsl_mult': 0.9794955709459785, 'bear_time_stop': 216, 'bear_use_sma': True, 'bear_use_ema': True, 'bear_use_atr': True, 'bear_use_adx': False, 'bear_use_spike': False, 'bear_rsi_required': False, 'sideways_strategy': 'breakout', 'sideways_bb_std_mult': 1.5926590336389055, 'sideways_rsi_os': 49, 'sideways_rsi_ob': 71, 'sideways_adx_thresh': 6.389765604941218, 'sideways_atr_min_pct': 0.019632840464146928, 'sideways_atr_max_pct': 0.01677544466555822, 'sideways_tp_mult': 2.7829906276359866, 'sideways_tsl_mult': 0.2971026818778764, 'sideways_time_stop': 171, 'sideways_use_sma': False, 'sideways_use_ema': True, 'sideways_use_atr': True, 'sideways_use_adx': False, 'sideways_use_spike': False, 'sideways_rsi_required': True}.
[I 2025-09-01 14:09:18,810] Trial 443 finished with values: [-1000000000.0, 1000000000.0] and parameters: {'p_sma': 20, 'p_std': 44, 'p_atr': 25, 'p_adx': 12, 'rsi_period': 31, 'ema1': 20, 'ema2': 34, 'slip_atr_k': 0.04075662536459869, 'slip_spread_k': 0.6833117673492857, 'spread_hl_frac': 0.007877537735624423, 'bb_std_mult': 1.191734768814159, 'rsi_os': 23, 'rsi_ob': 62, 'vol_spike': 0.2727689517213566, 'adx_thresh': 26.858302620395236, 'atr_min_pct': 0.0291802097652425, 'atr_max_pct': 0.08892554384897043, 'tp_mult': 1.2102050830990296, 'tsl_mult': 0.7022728663048758, 'strategy': 'breakout', 'time_stop': 185, 'use_sma': True, 'use_atr': False, 'use_adx': True, 'use_ema': True, 'use_spike': False, 'rsi_required': False, 'edge_k': 0.8872733338978095, 'edge_cap': 0.21784804657460194, 'bull_strategy': 'breakout', 'bull_bb_std_mult': 1.8117925783012114, 'bull_rsi_os': 18, 'bull_rsi_ob': 90, 'bull_adx_thresh': 31.760051208410246, 'bull_atr_min_pct': 0.005128307974283565, 'bull_atr_max_pct': 0.018020871727709525, 'bull_tp_mult': 2.8238381264369496, 'bull_tsl_mult': 0.46609959319596606, 'bull_time_stop': 271, 'bull_use_sma': False, 'bull_use_ema': True, 'bull_use_atr': True, 'bull_use_adx': True, 'bull_use_spike': False, 'bull_rsi_required': False, 'bear_strategy': 'mean_reversion', 'bear_bb_std_mult': 3.599223611242504, 'bear_rsi_os': 36, 'bear_rsi_ob': 87, 'bear_adx_thresh': 12.804442525880857, 'bear_atr_min_pct': 0.0005837068236087626, 'bear_atr_max_pct': 0.043629516586396994, 'bear_tp_mult': 1.3570457368464126, 'bear_tsl_mult': 0.24242542718479443, 'bear_time_stop': 213, 'bear_use_sma': True, 'bear_use_ema': False, 'bear_use_atr': True, 'bear_use_adx': False, 'bear_use_spike': True, 'bear_rsi_required': False, 'sideways_strategy': 'breakout', 'sideways_bb_std_mult': 1.5808186861215516, 'sideways_rsi_os': 22, 'sideways_rsi_ob': 66, 'sideways_adx_thresh': 18.311546132857774, 'sideways_atr_min_pct': 0.02874706109432986, 'sideways_atr_max_pct': 0.07286691845750604, 'sideways_tp_mult': 2.7338918888881323, 'sideways_tsl_mult': 0.8536276809536524, 'sideways_time_stop': 169, 'sideways_use_sma': False, 'sideways_use_ema': True, 'sideways_use_atr': False, 'sideways_use_adx': False, 'sideways_use_spike': True, 'sideways_rsi_required': True}.
[I 2025-09-01 14:09:19,555] Trial 444 finished with values: [-1000000000.0, 1000000000.0] and parameters: {'p_sma': 37, 'p_std': 47, 'p_atr': 25, 'p_adx': 27, 'rsi_period': 68, 'ema1': 20, 'ema2': 34, 'slip_atr_k': 0.03743319805106415, 'slip_spread_k': 0.062018774959567084, 'spread_hl_frac': 0.00785621080312583, 'bb_std_mult': 1.7380329761095406, 'rsi_os': 25, 'rsi_ob': 74, 'vol_spike': 0.23162232215269077, 'adx_thresh': 5.811117050524839, 'atr_min_pct': 0.015564769312987536, 'atr_max_pct': 0.061721123303041914, 'tp_mult': 1.1165663340665017, 'tsl_mult': 0.7039534398435089, 'strategy': 'mean_reversion', 'time_stop': 130, 'use_sma': True, 'use_atr': False, 'use_adx': True, 'use_ema': True, 'use_spike': False, 'rsi_required': False, 'edge_k': 1.751616930928027, 'edge_cap': 0.8837326085321764, 'bull_strategy': 'breakout', 'bull_bb_std_mult': 3.2471343964257158, 'bull_rsi_os': 25, 'bull_rsi_ob': 54, 'bull_adx_thresh': 31.583746051688834, 'bull_atr_min_pct': 0.005221239624799045, 'bull_atr_max_pct': 0.021175098566677878, 'bull_tp_mult': 2.1875098165914206, 'bull_tsl_mult': 0.4635021403497799, 'bull_time_stop': 107, 'bull_use_sma': False, 'bull_use_ema': True, 'bull_use_atr': True, 'bull_use_adx': True, 'bull_use_spike': False, 'bull_rsi_required': False, 'bear_strategy': 'mean_reversion', 'bear_bb_std_mult': 1.5351043002989788, 'bear_rsi_os': 33, 'bear_rsi_ob': 55, 'bear_adx_thresh': 19.694258739959636, 'bear_atr_min_pct': 0.018719415772184847, 'bear_atr_max_pct': 0.04535539671762118, 'bear_tp_mult': 2.270066797841278, 'bear_tsl_mult': 0.8743593232876476, 'bear_time_stop': 110, 'bear_use_sma': True, 'bear_use_ema': False, 'bear_use_atr': True, 'bear_use_adx': False, 'bear_use_spike': False, 'bear_rsi_required': False, 'sideways_strategy': 'breakout', 'sideways_bb_std_mult': 1.5697937033945035, 'sideways_rsi_os': 49, 'sideways_rsi_ob': 79, 'sideways_adx_thresh': 31.876369603536098, 'sideways_atr_min_pct': 0.01225636909713365, 'sideways_atr_max_pct': 0.06710120385491691, 'sideways_tp_mult': 2.7481338572452043, 'sideways_tsl_mult': 0.26671670704676353, 'sideways_time_stop': 172, 'sideways_use_sma': False, 'sideways_use_ema': True, 'sideways_use_atr': True, 'sideways_use_adx': False, 'sideways_use_spike': True, 'sideways_rsi_required': True}.
[I 2025-09-01 14:09:20,530] Trial 447 finished with values: [-1000000000.0, 1000000000.0] and parameters: {'p_sma': 36, 'p_std': 23, 'p_atr': 26, 'p_adx': 12, 'rsi_period': 69, 'ema1': 20, 'ema2': 16, 'slip_atr_k': 0.1703769325002708, 'slip_spread_k': 0.10134336658669381, 'spread_hl_frac': 0.006452185945425264, 'bb_std_mult': 3.1359853390844155, 'rsi_os': 9, 'rsi_ob': 47, 'vol_spike': 0.10623229936605608, 'adx_thresh': 22.407664797939916, 'atr_min_pct': 0.02177523001377959, 'atr_max_pct': 0.03042189382434829, 'tp_mult': 1.1467200703995832, 'tsl_mult': 0.06557047654532439, 'strategy': 'mean_reversion', 'time_stop': 223, 'use_sma': True, 'use_atr': False, 'use_adx': False, 'use_ema': True, 'use_spike': True, 'rsi_required': True, 'edge_k': 0.9428665139801551, 'edge_cap': 0.2649171037655778, 'bull_strategy': 'breakout', 'bull_bb_std_mult': 1.8821258624523722, 'bull_rsi_os': 15, 'bull_rsi_ob': 56, 'bull_adx_thresh': 30.056368191107897, 'bull_atr_min_pct': 0.0046678268978258, 'bull_atr_max_pct': 0.027929898306212432, 'bull_tp_mult': 2.193246773044025, 'bull_tsl_mult': 0.6898992103445033, 'bull_time_stop': 272, 'bull_use_sma': True, 'bull_use_ema': True, 'bull_use_atr': False, 'bull_use_adx': True, 'bull_use_spike': False, 'bull_rsi_required': True, 'bear_strategy': 'breakout', 'bear_bb_std_mult': 3.4093776012258123, 'bear_rsi_os': 33, 'bear_rsi_ob': 77, 'bear_adx_thresh': 11.419232760234026, 'bear_atr_min_pct': 0.026908615720140954, 'bear_atr_max_pct': 0.05222283091438529, 'bear_tp_mult': 1.2306646190032215, 'bear_tsl_mult': 0.1783264638913572, 'bear_time_stop': 172, 'bear_use_sma': True, 'bear_use_ema': True, 'bear_use_atr': True, 'bear_use_adx': True, 'bear_use_spike': False, 'bear_rsi_required': True, 'sideways_strategy': 'mean_reversion', 'sideways_bb_std_mult': 2.6673910309094966, 'sideways_rsi_os': 54, 'sideways_rsi_ob': 73, 'sideways_adx_thresh': 33.73794598767934, 'sideways_atr_min_pct': 0.021230394810906043, 'sideways_atr_max_pct': 0.07238607167415939, 'sideways_tp_mult': 2.7441846198536775, 'sideways_tsl_mult': 0.21148417984408174, 'sideways_time_stop': 161, 'sideways_use_sma': True, 'sideways_use_ema': False, 'sideways_use_atr': True, 'sideways_use_adx': True, 'sideways_use_spike': False, 'sideways_rsi_required': True}.
[I 2025-09-01 14:10:01,916] Trial 449 finished with values: [-1000000000.0, 1000000000.0] and parameters: {'p_sma': 31, 'p_std': 13, 'p_atr': 11, 'p_adx': 22, 'rsi_period': 69, 'ema1': 22, 'ema2': 29, 'slip_atr_k': 0.2491953151354736, 'slip_spread_k': 0.10997741330558036, 'spread_hl_frac': 0.037175157759164745, 'bb_std_mult': 1.9121771948110349, 'rsi_os': 40, 'rsi_ob': 74, 'vol_spike': 0.2372047322008536, 'adx_thresh': 25.989120980854338, 'atr_min_pct': 0.021767646416714907, 'atr_max_pct': 0.13288559315075385, 'tp_mult': 2.588144115625403, 'tsl_mult': 0.42211126829330836, 'strategy': 'mean_reversion', 'time_stop': 131, 'use_sma': False, 'use_atr': False, 'use_adx': False, 'use_ema': True, 'use_spike': True, 'rsi_required': True, 'edge_k': 0.9376347145799434, 'edge_cap': 0.07580833736325171, 'bull_strategy': 'breakout', 'bull_bb_std_mult': 1.6976810612979463, 'bull_rsi_os': 37, 'bull_rsi_ob': 78, 'bull_adx_thresh': 15.61909091411082, 'bull_atr_min_pct': 0.004622696733942967, 'bull_atr_max_pct': 0.027393838632887843, 'bull_tp_mult': 1.303171291493531, 'bull_tsl_mult': 0.4292195506495555, 'bull_time_stop': 70, 'bull_use_sma': True, 'bull_use_ema': True, 'bull_use_atr': False, 'bull_use_adx': True, 'bull_use_spike': False, 'bull_rsi_required': True, 'bear_strategy': 'breakout', 'bear_bb_std_mult': 3.3981141367012335, 'bear_rsi_os': 33, 'bear_rsi_ob': 66, 'bear_adx_thresh': 19.637374750985376, 'bear_atr_min_pct': 0.01912789923882268, 'bear_atr_max_pct': 0.14394340189501376, 'bear_tp_mult': 1.2350760542417238, 'bear_tsl_mult': 0.1768685711312378, 'bear_time_stop': 174, 'bear_use_sma': True, 'bear_use_ema': True, 'bear_use_atr': True, 'bear_use_adx': True, 'bear_use_spike': False, 'bear_rsi_required': True, 'sideways_strategy': 'mean_reversion', 'sideways_bb_std_mult': 2.664073959732685, 'sideways_rsi_os': 52, 'sideways_rsi_ob': 67, 'sideways_adx_thresh': 7.042172473640221, 'sideways_atr_min_pct': 0.026232565382744665, 'sideways_atr_max_pct': 0.049329512904544306, 'sideways_tp_mult': 2.635682537500738, 'sideways_tsl_mult': 0.21321132588791575, 'sideways_time_stop': 126, 'sideways_use_sma': True, 'sideways_use_ema': False, 'sideways_use_atr': True, 'sideways_use_adx': True, 'sideways_use_spike': False, 'sideways_rsi_required': True}.
[I 2025-09-01 14:10:04,124] Trial 448 finished with values: [-0.018026146498517526, 0.01887999442252201] and parameters: {'p_sma': 36, 'p_std': 49, 'p_atr': 11, 'p_adx': 12, 'rsi_period': 68, 'ema1': 20, 'ema2': 30, 'slip_atr_k': 0.00943042258543484, 'slip_spread_k': 0.1036692401835263, 'spread_hl_frac': 0.006660163355567351, 'bb_std_mult': 1.69261838093514, 'rsi_os': 35, 'rsi_ob': 84, 'vol_spike': 0.10633346151829204, 'adx_thresh': 22.19513575321712, 'atr_min_pct': 0.020896197430284327, 'atr_max_pct': 0.12808089861554517, 'tp_mult': 1.1341379957217166, 'tsl_mult': 0.06704294636898522, 'strategy': 'mean_reversion', 'time_stop': 224, 'use_sma': True, 'use_atr': False, 'use_adx': False, 'use_ema': True, 'use_spike': True, 'rsi_required': True, 'edge_k': 0.8266102813184061, 'edge_cap': 0.8813555106201713, 'bull_strategy': 'breakout', 'bull_bb_std_mult': 3.2904272700470223, 'bull_rsi_os': 8, 'bull_rsi_ob': 56, 'bull_adx_thresh': 22.089838420246856, 'bull_atr_min_pct': 0.004712410914993834, 'bull_atr_max_pct': 0.025432088064322168, 'bull_tp_mult': 2.8156776305758604, 'bull_tsl_mult': 0.49030426026471974, 'bull_time_stop': 166, 'bull_use_sma': True, 'bull_use_ema': True, 'bull_use_atr': False, 'bull_use_adx': True, 'bull_use_spike': False, 'bull_rsi_required': True, 'bear_strategy': 'breakout', 'bear_bb_std_mult': 3.2286974932717456, 'bear_rsi_os': 33, 'bear_rsi_ob': 66, 'bear_adx_thresh': 23.61672093770317, 'bear_atr_min_pct': 0.0005182670620954132, 'bear_atr_max_pct': 0.1309943820243237, 'bear_tp_mult': 2.2044708212109367, 'bear_tsl_mult': 0.13830027478754495, 'bear_time_stop': 48, 'bear_use_sma': True, 'bear_use_ema': True, 'bear_use_atr': True, 'bear_use_adx': True, 'bear_use_spike': False, 'bear_rsi_required': True, 'sideways_strategy': 'mean_reversion', 'sideways_bb_std_mult': 2.668120454187366, 'sideways_rsi_os': 22, 'sideways_rsi_ob': 80, 'sideways_adx_thresh': 7.266388356399311, 'sideways_atr_min_pct': 0.0026937758236176557, 'sideways_atr_max_pct': 0.07120254068557262, 'sideways_tp_mult': 2.225558334297585, 'sideways_tsl_mult': 0.9629194054571145, 'sideways_time_stop': 260, 'sideways_use_sma': True, 'sideways_use_ema': False, 'sideways_use_atr': True, 'sideways_use_adx': True, 'sideways_use_spike': False, 'sideways_rsi_required': True}.
