[I 2025-09-01 13:58:24,182] Trial 366 finished with values: [-1000000000.0, 1000000000.0] and parameters: {'p_sma': 24, 'p_std': 47, 'p_atr': 17, 'p_adx': 12, 'rsi_period': 66, 'ema1': 21, 'ema2': 37, 'slip_atr_k': 0.1368194747256802, 'slip_spread_k': 0.12392265242865978, 'spread_hl_frac': 0.03504166340679093, 'bb_std_mult': 2.9051480214001417, 'rsi_os': 41, 'rsi_ob': 56, 'vol_spike': 0.15969273035022638, 'adx_thresh': 25.730569787634966, 'atr_min_pct': 0.019452046555413056, 'atr_max_pct': 0.027968052901151765, 'tp_mult': 2.421022044198202, 'tsl_mult': 0.8807835206774908, 'strategy': 'mean_reversion', 'time_stop': 140, 'use_sma': True, 'use_atr': False, 'use_adx': True, 'use_ema': False, 'use_spike': True, 'rsi_required': True, 'edge_k': 0.7363466822873793, 'edge_cap': 0.3440769853130642, 'bull_strategy': 'breakout', 'bull_bb_std_mult': 3.3040442876041425, 'bull_rsi_os': 42, 'bull_rsi_ob': 55, 'bull_adx_thresh': 11.132621299995888, 'bull_atr_min_pct': 0.017739417825423175, 'bull_atr_max_pct': 0.012633470791132459, 'bull_tp_mult': 2.2024474296459267, 'bull_tsl_mult': 0.34288262042254103, 'bull_time_stop': 245, 'bull_use_sma': False, 'bull_use_ema': True, 'bull_use_atr': True, 'bull_use_adx': False, 'bull_use_spike': True, 'bull_rsi_required': True, 'bear_strategy': 'breakout', 'bear_bb_std_mult': 3.4401269219909114, 'bear_rsi_os': 35, 'bear_rsi_ob': 59, 'bear_adx_thresh': 10.3991442591141, 'bear_atr_min_pct': 0.0032646199820493367, 'bear_atr_max_pct': 0.05361128026781811, 'bear_tp_mult': 2.2651337234254063, 'bear_tsl_mult': 0.1326508712812272, 'bear_time_stop': 225, 'bear_use_sma': True, 'bear_use_ema': True, 'bear_use_atr': True, 'bear_use_adx': True, 'bear_use_spike': True, 'bear_rsi_required': True, 'sideways_strategy': 'breakout', 'sideways_bb_std_mult': 1.398625356445543, 'sideways_rsi_os': 19, 'sideways_rsi_ob': 66, 'sideways_adx_thresh': 8.864073323274196, 'sideways_atr_min_pct': 0.01966392327770102, 'sideways_atr_max_pct': 0.07081022264472281, 'sideways_tp_mult': 2.5611891191892173, 'sideways_tsl_mult': 0.3175713852235655, 'sideways_time_stop': 154, 'sideways_use_sma': True, 'sideways_use_ema': False, 'sideways_use_atr': False, 'sideways_use_adx': False, 'sideways_use_spike': True, 'sideways_rsi_required': False}.
[I 2025-09-01 13:58:25,635] Trial 370 finished with values: [-1000000000.0, 1000000000.0] and parameters: {'p_sma': 33, 'p_std': 34, 'p_atr': 25, 'p_adx': 12, 'rsi_period': 65, 'ema1': 20, 'ema2': 20, 'slip_atr_k': 0.018298776326170864, 'slip_spread_k': 0.7438036152561703, 'spread_hl_frac': 0.004765485612454994, 'bb_std_mult': 1.7090114763119943, 'rsi_os': 40, 'rsi_ob': 84, 'vol_spike': 0.11170617319229717, 'adx_thresh': 23.99329639203708, 'atr_min_pct': 0.019175544390630583, 'atr_max_pct': 0.128655235418528, 'tp_mult': 2.7695649010425765, 'tsl_mult': 0.8735881459956183, 'strategy': 'mean_reversion', 'time_stop': 255, 'use_sma': True, 'use_atr': True, 'use_adx': True, 'use_ema': True, 'use_spike': False, 'rsi_required': False, 'edge_k': 0.6567375620022242, 'edge_cap': 0.9281843949997863, 'bull_strategy': 'breakout', 'bull_bb_std_mult': 3.391594371933775, 'bull_rsi_os': 34, 'bull_rsi_ob': 85, 'bull_adx_thresh': 10.950901291557638, 'bull_atr_min_pct': 0.026934066265039983, 'bull_atr_max_pct': 0.05858974570946804, 'bull_tp_mult': 2.8033227956329783, 'bull_tsl_mult': 0.9218007594686481, 'bull_time_stop': 160, 'bull_use_sma': True, 'bull_use_ema': True, 'bull_use_atr': True, 'bull_use_adx': False, 'bull_use_spike': False, 'bull_rsi_required': True, 'bear_strategy': 'breakout', 'bear_bb_std_mult': 2.120673030131603, 'bear_rsi_os': 30, 'bear_rsi_ob': 46, 'bear_adx_thresh': 11.677680176348552, 'bear_atr_min_pct': 0.0008775873711030953, 'bear_atr_max_pct': 0.04086584739420593, 'bear_tp_mult': 2.2628760942020394, 'bear_tsl_mult': 0.1412864697809464, 'bear_time_stop': 293, 'bear_use_sma': True, 'bear_use_ema': True, 'bear_use_atr': True, 'bear_use_adx': True, 'bear_use_spike': True, 'bear_rsi_required': False, 'sideways_strategy': 'breakout', 'sideways_bb_std_mult': 1.7388289022113343, 'sideways_rsi_os': 53, 'sideways_rsi_ob': 66, 'sideways_adx_thresh': 5.821216331440652, 'sideways_atr_min_pct': 0.01988983772310221, 'sideways_atr_max_pct': 0.06590589990658684, 'sideways_tp_mult': 2.8176213921046607, 'sideways_tsl_mult': 0.27026989208891533, 'sideways_time_stop': 108, 'sideways_use_sma': False, 'sideways_use_ema': False, 'sideways_use_atr': False, 'sideways_use_adx': True, 'sideways_use_spike': True, 'sideways_rsi_required': True}.
[I 2025-09-01 13:59:02,227] Trial 371 finished with values: [-1000000000.0, 1000000000.0] and parameters: {'p_sma': 9, 'p_std': 34, 'p_atr': 27, 'p_adx': 12, 'rsi_period': 62, 'ema1': 29, 'ema2': 15, 'slip_atr_k': 0.020860956849557858, 'slip_spread_k': 0.5619143394832611, 'spread_hl_frac': 0.004722017458379427, 'bb_std_mult': 1.6379876949763745, 'rsi_os': 40, 'rsi_ob': 84, 'vol_spike': 0.23083790561647483, 'adx_thresh': 23.77349002390453, 'atr_min_pct': 0.019422478227351356, 'atr_max_pct': 0.1284462811715219, 'tp_mult': 2.765453375076068, 'tsl_mult': 0.40861249965564483, 'strategy': 'mean_reversion', 'time_stop': 241, 'use_sma': True, 'use_atr': False, 'use_adx': False, 'use_ema': True, 'use_spike': False, 'rsi_required': False, 'edge_k': 0.8569832588929154, 'edge_cap': 0.36351080423739685, 'bull_strategy': 'breakout', 'bull_bb_std_mult': 3.2175635690181505, 'bull_rsi_os': 34, 'bull_rsi_ob': 53, 'bull_adx_thresh': 32.445110752317404, 'bull_atr_min_pct': 0.0037609021325145835, 'bull_atr_max_pct': 0.02075668788334624, 'bull_tp_mult': 2.849283236063369, 'bull_tsl_mult': 0.3501405365997021, 'bull_time_stop': 81, 'bull_use_sma': True, 'bull_use_ema': True, 'bull_use_atr': True, 'bull_use_adx': True, 'bull_use_spike': False, 'bull_rsi_required': True, 'bear_strategy': 'breakout', 'bear_bb_std_mult': 1.6191838126813407, 'bear_rsi_os': 30, 'bear_rsi_ob': 46, 'bear_adx_thresh': 11.746592043262229, 'bear_atr_min_pct': 0.029375065673317945, 'bear_atr_max_pct': 0.040418548019360755, 'bear_tp_mult': 1.1850893788198498, 'bear_tsl_mult': 0.13844598973162842, 'bear_time_stop': 217, 'bear_use_sma': True, 'bear_use_ema': True, 'bear_use_atr': True, 'bear_use_adx': True, 'bear_use_spike': False, 'bear_rsi_required': False, 'sideways_strategy': 'mean_reversion', 'sideways_bb_std_mult': 1.6320994831792333, 'sideways_rsi_os': 54, 'sideways_rsi_ob': 68, 'sideways_adx_thresh': 7.979383285879461, 'sideways_atr_min_pct': 0.0037728660875257693, 'sideways_atr_max_pct': 0.06657050520424507, 'sideways_tp_mult': 1.5351130482227944, 'sideways_tsl_mult': 0.2734162169747875, 'sideways_time_stop': 195, 'sideways_use_sma': False, 'sideways_use_ema': False, 'sideways_use_atr': True, 'sideways_use_adx': True, 'sideways_use_spike': False, 'sideways_rsi_required': True}.
[I 2025-09-01 13:59:02,846] Trial 373 finished with values: [-1000000000.0, 1000000000.0] and parameters: {'p_sma': 45, 'p_std': 34, 'p_atr': 24, 'p_adx': 11, 'rsi_period': 23, 'ema1': 29, 'ema2': 15, 'slip_atr_k': 0.19751480949349307, 'slip_spread_k': 0.5638385289437949, 'spread_hl_frac': 0.006991393717178983, 'bb_std_mult': 2.709632652214206, 'rsi_os': 34, 'rsi_ob': 84, 'vol_spike': 0.22956606458237272, 'adx_thresh': 30.482814508996093, 'atr_min_pct': 0.005260512191978196, 'atr_max_pct': 0.10828591795874831, 'tp_mult': 1.280324358001788, 'tsl_mult': 0.7169825422102396, 'strategy': 'mean_reversion', 'time_stop': 203, 'use_sma': True, 'use_atr': False, 'use_adx': False, 'use_ema': True, 'use_spike': False, 'rsi_required': False, 'edge_k': 0.8496141904350378, 'edge_cap': 0.874656713520441, 'bull_strategy': 'mean_reversion', 'bull_bb_std_mult': 3.208177149770792, 'bull_rsi_os': 14, 'bull_rsi_ob': 57, 'bull_adx_thresh': 12.434094243627715, 'bull_atr_min_pct': 0.003564543864719248, 'bull_atr_max_pct': 0.0269639380864086, 'bull_tp_mult': 2.85246109845462, 'bull_tsl_mult': 0.37106816653267616, 'bull_time_stop': 157, 'bull_use_sma': True, 'bull_use_ema': False, 'bull_use_atr': True, 'bull_use_adx': True, 'bull_use_spike': False, 'bull_rsi_required': True, 'bear_strategy': 'breakout', 'bear_bb_std_mult': 2.7934480367024457, 'bear_rsi_os': 6, 'bear_rsi_ob': 89, 'bear_adx_thresh': 11.909693429624742, 'bear_atr_min_pct': 0.0008159051577510301, 'bear_atr_max_pct': 0.04026945670199139, 'bear_tp_mult': 2.874799909199318, 'bear_tsl_mult': 0.6778645176102962, 'bear_time_stop': 215, 'bear_use_sma': True, 'bear_use_ema': True, 'bear_use_atr': True, 'bear_use_adx': True, 'bear_use_spike': False, 'bear_rsi_required': False, 'sideways_strategy': 'mean_reversion', 'sideways_bb_std_mult': 3.2103489568267483, 'sideways_rsi_os': 13, 'sideways_rsi_ob': 68, 'sideways_adx_thresh': 11.480140433020969, 'sideways_atr_min_pct': 0.021625215830957594, 'sideways_atr_max_pct': 0.06682601510307662, 'sideways_tp_mult': 2.813915758322316, 'sideways_tsl_mult': 0.2808326192709774, 'sideways_time_stop': 195, 'sideways_use_sma': False, 'sideways_use_ema': True, 'sideways_use_atr': True, 'sideways_use_adx': True, 'sideways_use_spike': False, 'sideways_rsi_required': True}.
[I 2025-09-01 13:59:02,858] Trial 372 finished with values: [-1000000000.0, 1000000000.0] and parameters: {'p_sma': 33, 'p_std': 34, 'p_atr': 24, 'p_adx': 12, 'rsi_period': 63, 'ema1': 21, 'ema2': 47, 'slip_atr_k': 0.1282272964720986, 'slip_spread_k': 0.07571325321944061, 'spread_hl_frac': 0.03707703099418158, 'bb_std_mult': 2.725715376691811, 'rsi_os': 34, 'rsi_ob': 84, 'vol_spike': 0.08297749614299049, 'adx_thresh': 23.944231740873686, 'atr_min_pct': 0.018540324064790475, 'atr_max_pct': 0.09556813338309592, 'tp_mult': 2.0509072994448316, 'tsl_mult': 0.03055089105465475, 'strategy': 'mean_reversion', 'time_stop': 241, 'use_sma': True, 'use_atr': False, 'use_adx': False, 'use_ema': True, 'use_spike': False, 'rsi_required': False, 'edge_k': 0.8653425780573123, 'edge_cap': 0.3070470222278401, 'bull_strategy': 'breakout', 'bull_bb_std_mult': 3.205685473669899, 'bull_rsi_os': 34, 'bull_rsi_ob': 61, 'bull_adx_thresh': 32.63577873710097, 'bull_atr_min_pct': 0.003440784983513869, 'bull_atr_max_pct': 0.026762334654835077, 'bull_tp_mult': 2.9762169957933127, 'bull_tsl_mult': 0.3276547197593723, 'bull_time_stop': 160, 'bull_use_sma': True, 'bull_use_ema': True, 'bull_use_atr': True, 'bull_use_adx': True, 'bull_use_spike': False, 'bull_rsi_required': True, 'bear_strategy': 'breakout', 'bear_bb_std_mult': 1.6070219273184425, 'bear_rsi_os': 52, 'bear_rsi_ob': 59, 'bear_adx_thresh': 28.209397463657634, 'bear_atr_min_pct': 0.011559624435124554, 'bear_atr_max_pct': 0.04395680496881269, 'bear_tp_mult': 2.210292075008733, 'bear_tsl_mult': 0.13670981446222952, 'bear_time_stop': 215, 'bear_use_sma': True, 'bear_use_ema': True, 'bear_use_atr': True, 'bear_use_adx': True, 'bear_use_spike': False, 'bear_rsi_required': False, 'sideways_strategy': 'mean_reversion', 'sideways_bb_std_mult': 2.6690267177862985, 'sideways_rsi_os': 53, 'sideways_rsi_ob': 84, 'sideways_adx_thresh': 5.580159813319716, 'sideways_atr_min_pct': 0.021516216827830906, 'sideways_atr_max_pct': 0.06601244328280109, 'sideways_tp_mult': 2.8135186044461897, 'sideways_tsl_mult': 0.27039048866109333, 'sideways_time_stop': 182, 'sideways_use_sma': False, 'sideways_use_ema': False, 'sideways_use_atr': True, 'sideways_use_adx': True, 'sideways_use_spike': False, 'sideways_rsi_required': True}.
[I 2025-09-01 13:59:03,407] Trial 374 finished with values: [-1000000000.0, 1000000000.0] and parameters: {'p_sma': 36, 'p_std': 51, 'p_atr': 27, 'p_adx': 15, 'rsi_period': 62, 'ema1': 22, 'ema2': 47, 'slip_atr_k': 0.18153812788494222, 'slip_spread_k': 0.5569597658981085, 'spread_hl_frac': 0.04707445337553895, 'bb_std_mult': 1.6360285094006783, 'rsi_os': 37, 'rsi_ob': 80, 'vol_spike': 0.2648123532017827, 'adx_thresh': 24.410871550968793, 'atr_min_pct': 0.026338317116673424, 'atr_max_pct': 0.09447361080260895, 'tp_mult': 2.612652981595365, 'tsl_mult': 0.4044485625573221, 'strategy': 'mean_reversion', 'time_stop': 205, 'use_sma': True, 'use_atr': False, 'use_adx': False, 'use_ema': True, 'use_spike': True, 'rsi_required': False, 'edge_k': 1.9758891156631337, 'edge_cap': 0.30411795696824107, 'bull_strategy': 'mean_reversion', 'bull_bb_std_mult': 3.16242291126167, 'bull_rsi_os': 14, 'bull_rsi_ob': 53, 'bull_adx_thresh': 12.262094786241516, 'bull_atr_min_pct': 0.0034355861311572353, 'bull_atr_max_pct': 0.07198162527359299, 'bull_tp_mult': 2.9690494977245954, 'bull_tsl_mult': 0.4958473968043409, 'bull_time_stop': 87, 'bull_use_sma': True, 'bull_use_ema': False, 'bull_use_atr': True, 'bull_use_adx': True, 'bull_use_spike': False, 'bull_rsi_required': True, 'bear_strategy': 'breakout', 'bear_bb_std_mult': 3.4684872327288105, 'bear_rsi_os': 6, 'bear_rsi_ob': 89, 'bear_adx_thresh': 14.363314208074046, 'bear_atr_min_pct': 2.8783770786864997e-05, 'bear_atr_max_pct': 0.04423752314765923, 'bear_tp_mult': 2.1910227828070328, 'bear_tsl_mult': 0.20437262913530171, 'bear_time_stop': 200, 'bear_use_sma': True, 'bear_use_ema': True, 'bear_use_atr': True, 'bear_use_adx': True, 'bear_use_spike': False, 'bear_rsi_required': True, 'sideways_strategy': 'mean_reversion', 'sideways_bb_std_mult': 3.1470708019951115, 'sideways_rsi_os': 50, 'sideways_rsi_ob': 50, 'sideways_adx_thresh': 25.821936804121066, 'sideways_atr_min_pct': 0.021814321903064864, 'sideways_atr_max_pct': 0.06179225892041509, 'sideways_tp_mult': 2.7480364662821573, 'sideways_tsl_mult': 0.6812234910093532, 'sideways_time_stop': 182, 'sideways_use_sma': True, 'sideways_use_ema': True, 'sideways_use_atr': True, 'sideways_use_adx': True, 'sideways_use_spike': False, 'sideways_rsi_required': True}.
[I 2025-09-01 13:59:36,656] Trial 378 finished with values: [-1000000000.0, 1000000000.0] and parameters: {'p_sma': 43, 'p_std': 18, 'p_atr': 23, 'p_adx': 17, 'rsi_period': 33, 'ema1': 20, 'ema2': 18, 'slip_atr_k': 0.003790323781234938, 'slip_spread_k': 0.08921965636889227, 'spread_hl_frac': 0.024167852827574606, 'bb_std_mult': 1.765325884944197, 'rsi_os': 38, 'rsi_ob': 81, 'vol_spike': 0.23694782802305273, 'adx_thresh': 26.136311931587027, 'atr_min_pct': 0.02365546511353859, 'atr_max_pct': 0.13417165901020617, 'tp_mult': 1.0693983285611617, 'tsl_mult': 0.7681478586604165, 'strategy': 'mean_reversion', 'time_stop': 234, 'use_sma': False, 'use_atr': False, 'use_adx': False, 'use_ema': True, 'use_spike': True, 'rsi_required': False, 'edge_k': 0.9372249124166336, 'edge_cap': 0.3247126051961434, 'bull_strategy': 'breakout', 'bull_bb_std_mult': 2.8967865633917222, 'bull_rsi_os': 36, 'bull_rsi_ob': 60, 'bull_adx_thresh': 30.170892275073474, 'bull_atr_min_pct': 0.0042565542564265285, 'bull_atr_max_pct': 0.11082427961809896, 'bull_tp_mult': 2.775155607690172, 'bull_tsl_mult': 0.40576207133211034, 'bull_time_stop': 94, 'bull_use_sma': True, 'bull_use_ema': True, 'bull_use_atr': False, 'bull_use_adx': True, 'bull_use_spike': False, 'bull_rsi_required': False, 'bear_strategy': 'mean_reversion', 'bear_bb_std_mult': 3.5985081824330343, 'bear_rsi_os': 33, 'bear_rsi_ob': 86, 'bear_adx_thresh': 30.548197841907733, 'bear_atr_min_pct': 0.004064609281299783, 'bear_atr_max_pct': 0.04744352953924108, 'bear_tp_mult': 1.9736731182999754, 'bear_tsl_mult': 0.15798840658207744, 'bear_time_stop': 232, 'bear_use_sma': False, 'bear_use_ema': True, 'bear_use_atr': False, 'bear_use_adx': False, 'bear_use_spike': False, 'bear_rsi_required': True, 'sideways_strategy': 'breakout', 'sideways_bb_std_mult': 1.5586279110114347, 'sideways_rsi_os': 42, 'sideways_rsi_ob': 65, 'sideways_adx_thresh': 6.693842686622578, 'sideways_atr_min_pct': 0.029912500198550677, 'sideways_atr_max_pct': 0.0741391736174047, 'sideways_tp_mult': 2.0228873352889094, 'sideways_tsl_mult': 0.9332801128752537, 'sideways_time_stop': 169, 'sideways_use_sma': True, 'sideways_use_ema': False, 'sideways_use_atr': True, 'sideways_use_adx': True, 'sideways_use_spike': False, 'sideways_rsi_required': True}.
[I 2025-09-01 13:59:37,615] Trial 377 finished with values: [-1000000000.0, 1000000000.0] and parameters: {'p_sma': 19, 'p_std': 51, 'p_atr': 9, 'p_adx': 11, 'rsi_period': 33, 'ema1': 24, 'ema2': 17, 'slip_atr_k': 0.003245803059128749, 'slip_spread_k': 0.09805870196697974, 'spread_hl_frac': 0.03031834476479464, 'bb_std_mult': 0.9796566299706195, 'rsi_os': 38, 'rsi_ob': 80, 'vol_spike': 0.23761118567628278, 'adx_thresh': 24.635458766537436, 'atr_min_pct': 0.028604646279119655, 'atr_max_pct': 0.07709832234966943, 'tp_mult': 1.2175784911159844, 'tsl_mult': 0.7639786344983881, 'strategy': 'mean_reversion', 'time_stop': 234, 'use_sma': False, 'use_atr': False, 'use_adx': False, 'use_ema': True, 'use_spike': True, 'rsi_required': False, 'edge_k': 0.9169799945465485, 'edge_cap': 0.5109529143576691, 'bull_strategy': 'mean_reversion', 'bull_bb_std_mult': 1.2540826921761998, 'bull_rsi_os': 36, 'bull_rsi_ob': 56, 'bull_adx_thresh': 27.746355385393947, 'bull_atr_min_pct': 0.020622868795135155, 'bull_atr_max_pct': 0.03845176588853794, 'bull_tp_mult': 2.9538226388515865, 'bull_tsl_mult': 0.4905023378754012, 'bull_time_stop': 94, 'bull_use_sma': True, 'bull_use_ema': False, 'bull_use_atr': False, 'bull_use_adx': True, 'bull_use_spike': False, 'bull_rsi_required': False, 'bear_strategy': 'mean_reversion', 'bear_bb_std_mult': 3.4860752135890287, 'bear_rsi_os': 33, 'bear_rsi_ob': 91, 'bear_adx_thresh': 12.457160114883918, 'bear_atr_min_pct': 0.0019607863357460975, 'bear_atr_max_pct': 0.048118207617626356, 'bear_tp_mult': 2.3286857605367954, 'bear_tsl_mult': 0.07669383444474477, 'bear_time_stop': 116, 'bear_use_sma': False, 'bear_use_ema': True, 'bear_use_atr': False, 'bear_use_adx': False, 'bear_use_spike': False, 'bear_rsi_required': True, 'sideways_strategy': 'breakout', 'sideways_bb_std_mult': 1.5723862939939168, 'sideways_rsi_os': 33, 'sideways_rsi_ob': 65, 'sideways_adx_thresh': 24.510285772954376, 'sideways_atr_min_pct': 0.02053780729269491, 'sideways_atr_max_pct': 0.06129802102059952, 'sideways_tp_mult': 2.754785312304982, 'sideways_tsl_mult': 0.6819642484800073, 'sideways_time_stop': 82, 'sideways_use_sma': True, 'sideways_use_ema': True, 'sideways_use_atr': True, 'sideways_use_adx': True, 'sideways_use_spike': False, 'sideways_rsi_required': True}.
[I 2025-09-01 13:59:37,964] Trial 375 finished with values: [-1000000000.0, 1000000000.0] and parameters: {'p_sma': 41, 'p_std': 18, 'p_atr': 9, 'p_adx': 17, 'rsi_period': 61, 'ema1': 24, 'ema2': 17, 'slip_atr_k': 0.1724432931833609, 'slip_spread_k': 0.09816372904052731, 'spread_hl_frac': 0.006286311671028016, 'bb_std_mult': 0.8180530505926371, 'rsi_os': 38, 'rsi_ob': 70, 'vol_spike': 0.2631682938812899, 'adx_thresh': 24.459389757774584, 'atr_min_pct': 0.028615450132541433, 'atr_max_pct': 0.06082639408622183, 'tp_mult': 1.0703457387825637, 'tsl_mult': 0.7594750034787512, 'strategy': 'mean_reversion', 'time_stop': 232, 'use_sma': False, 'use_atr': False, 'use_adx': False, 'use_ema': True, 'use_spike': True, 'rsi_required': False, 'edge_k': 1.482149405716916, 'edge_cap': 0.40204384599124493, 'bull_strategy': 'mean_reversion', 'bull_bb_std_mult': 3.5445424381065633, 'bull_rsi_os': 36, 'bull_rsi_ob': 60, 'bull_adx_thresh': 30.10167321238184, 'bull_atr_min_pct': 0.020863458647383863, 'bull_atr_max_pct': 0.034524742446364685, 'bull_tp_mult': 2.772200520844342, 'bull_tsl_mult': 0.6001417639327947, 'bull_time_stop': 93, 'bull_use_sma': True, 'bull_use_ema': False, 'bull_use_atr': False, 'bull_use_adx': True, 'bull_use_spike': False, 'bull_rsi_required': False, 'bear_strategy': 'mean_reversion', 'bear_bb_std_mult': 3.2843457963882443, 'bear_rsi_os': 33, 'bear_rsi_ob': 91, 'bear_adx_thresh': 31.660317417151667, 'bear_atr_min_pct': 0.008984504647604969, 'bear_atr_max_pct': 0.04895852412759677, 'bear_tp_mult': 2.3258044054112257, 'bear_tsl_mult': 0.15868963289034285, 'bear_time_stop': 234, 'bear_use_sma': False, 'bear_use_ema': True, 'bear_use_atr': False, 'bear_use_adx': False, 'bear_use_spike': False, 'bear_rsi_required': True, 'sideways_strategy': 'breakout', 'sideways_bb_std_mult': 1.5528193045478287, 'sideways_rsi_os': 50, 'sideways_rsi_ob': 65, 'sideways_adx_thresh': 24.47474948282754, 'sideways_atr_min_pct': 0.020530686644288195, 'sideways_atr_max_pct': 0.06221046997073204, 'sideways_tp_mult': 2.763488044035679, 'sideways_tsl_mult': 0.3495993333130444, 'sideways_time_stop': 294, 'sideways_use_sma': True, 'sideways_use_ema': True, 'sideways_use_atr': True, 'sideways_use_adx': True, 'sideways_use_spike': False, 'sideways_rsi_required': True}.
