[I 2025-09-01 14:51:00,216] Trial 728 finished with values: [-0.1478991835939163, 0.14774752734914953] and parameters: {'p_sma': 35, 'p_std': 51, 'p_atr': 15, 'p_adx': 19, 'rsi_period': 18, 'ema1': 30, 'ema2': 42, 'slip_atr_k': 0.006313012946800598, 'slip_spread_k': 0.6116931553924486, 'spread_hl_frac': 0.043379450115320274, 'bb_std_mult': 2.9929872922281766, 'rsi_os': 36, 'rsi_ob': 59, 'vol_spike': 0.25600599513631483, 'adx_thresh': 20.74720808299278, 'atr_min_pct': 0.0010065435969841968, 'atr_max_pct': 0.12792293153298034, 'tp_mult': 1.085743435843664, 'tsl_mult': 0.5475589659776676, 'strategy': 'breakout', 'time_stop': 254, 'use_sma': True, 'use_atr': True, 'use_adx': True, 'use_ema': True, 'use_spike': True, 'rsi_required': False, 'edge_k': 1.0087840326365427, 'edge_cap': 0.3477587863175131, 'bull_strategy': 'breakout', 'bull_bb_std_mult': 1.428665219769403, 'bull_rsi_os': 20, 'bull_rsi_ob': 53, 'bull_adx_thresh': 29.588975634010517, 'bull_atr_min_pct': 0.029286071612117725, 'bull_atr_max_pct': 0.02623908308979891, 'bull_tp_mult': 2.722424687116587, 'bull_tsl_mult': 0.45574181019978327, 'bull_time_stop': 90, 'bull_use_sma': True, 'bull_use_ema': True, 'bull_use_atr': True, 'bull_use_adx': True, 'bull_use_spike': False, 'bull_rsi_required': False, 'bear_strategy': 'mean_reversion', 'bear_bb_std_mult': 3.5231364619390106, 'bear_rsi_os': 36, 'bear_rsi_ob': 75, 'bear_adx_thresh': 11.479061652927617, 'bear_atr_min_pct': 0.02245031687904428, 'bear_atr_max_pct': 0.02429954662633791, 'bear_tp_mult': 2.316708042782444, 'bear_tsl_mult': 0.3632274506708649, 'bear_time_stop': 235, 'bear_use_sma': True, 'bear_use_ema': True, 'bear_use_atr': True, 'bear_use_adx': False, 'bear_use_spike': True, 'bear_rsi_required': True, 'sideways_strategy': 'breakout', 'sideways_bb_std_mult': 3.4708794473651885, 'sideways_rsi_os': 50, 'sideways_rsi_ob': 64, 'sideways_adx_thresh': 16.081494579098237, 'sideways_atr_min_pct': 0.0013197005740288488, 'sideways_atr_max_pct': 0.07053082900989945, 'sideways_tp_mult': 2.673942155397964, 'sideways_tsl_mult': 0.40231839013867066, 'sideways_time_stop': 177, 'sideways_use_sma': True, 'sideways_use_ema': False, 'sideways_use_atr': False, 'sideways_use_adx': True, 'sideways_use_spike': True, 'sideways_rsi_required': True}.
[I 2025-09-01 14:51:00,605] Trial 729 finished with values: [-1000000000.0, 1000000000.0] and parameters: {'p_sma': 35, 'p_std': 52, 'p_atr': 26, 'p_adx': 30, 'rsi_period': 82, 'ema1': 21, 'ema2': 20, 'slip_atr_k': 0.006940217507773039, 'slip_spread_k': 0.6118934112973872, 'spread_hl_frac': 0.043434176419742364, 'bb_std_mult': 1.96301215344849, 'rsi_os': 49, 'rsi_ob': 82, 'vol_spike': 0.21833027900635568, 'adx_thresh': 8.24005437724249, 'atr_min_pct': 0.028225362652224077, 'atr_max_pct': 0.0479085704526627, 'tp_mult': 1.0838128132580607, 'tsl_mult': 0.726218111625936, 'strategy': 'breakout', 'time_stop': 254, 'use_sma': True, 'use_atr': True, 'use_adx': True, 'use_ema': True, 'use_spike': True, 'rsi_required': False, 'edge_k': 1.0470432371205431, 'edge_cap': 0.648151910658975, 'bull_strategy': 'breakout', 'bull_bb_std_mult': 3.3519228348938346, 'bull_rsi_os': 36, 'bull_rsi_ob': 83, 'bull_adx_thresh': 32.36090748680553, 'bull_atr_min_pct': 0.029298894157405428, 'bull_atr_max_pct': 0.1344557740072254, 'bull_tp_mult': 2.8432675613875875, 'bull_tsl_mult': 0.4577321674349744, 'bull_time_stop': 90, 'bull_use_sma': True, 'bull_use_ema': True, 'bull_use_atr': True, 'bull_use_adx': True, 'bull_use_spike': False, 'bull_rsi_required': False, 'bear_strategy': 'mean_reversion', 'bear_bb_std_mult': 3.542589703056118, 'bear_rsi_os': 36, 'bear_rsi_ob': 88, 'bear_adx_thresh': 13.861752467930632, 'bear_atr_min_pct': 0.0270491432744391, 'bear_atr_max_pct': 0.04651734168400805, 'bear_tp_mult': 1.847497934155803, 'bear_tsl_mult': 0.15880549374007216, 'bear_time_stop': 220, 'bear_use_sma': True, 'bear_use_ema': True, 'bear_use_atr': True, 'bear_use_adx': False, 'bear_use_spike': True, 'bear_rsi_required': True, 'sideways_strategy': 'breakout', 'sideways_bb_std_mult': 3.458515877808183, 'sideways_rsi_os': 9, 'sideways_rsi_ob': 64, 'sideways_adx_thresh': 5.009379486126315, 'sideways_atr_min_pct': 0.019029194988012584, 'sideways_atr_max_pct': 0.018476189539289485, 'sideways_tp_mult': 2.6865622333237025, 'sideways_tsl_mult': 0.9984805277505382, 'sideways_time_stop': 177, 'sideways_use_sma': True, 'sideways_use_ema': False, 'sideways_use_atr': False, 'sideways_use_adx': True, 'sideways_use_spike': True, 'sideways_rsi_required': True}.
[I 2025-09-01 14:51:39,869] Trial 734 finished with values: [-1000000000.0, 1000000000.0] and parameters: {'p_sma': 38, 'p_std': 48, 'p_atr': 13, 'p_adx': 13, 'rsi_period': 66, 'ema1': 22, 'ema2': 23, 'slip_atr_k': 0.16692113030559777, 'slip_spread_k': 0.08255323092733968, 'spread_hl_frac': 0.028672057068915714, 'bb_std_mult': 1.1832635349590834, 'rsi_os': 5, 'rsi_ob': 83, 'vol_spike': 0.23536395192401205, 'adx_thresh': 15.730124988375309, 'atr_min_pct': 0.009340417830869193, 'atr_max_pct': 0.14557656115907583, 'tp_mult': 2.5360025868403824, 'tsl_mult': 0.7424582102573674, 'strategy': 'mean_reversion', 'time_stop': 121, 'use_sma': True, 'use_atr': False, 'use_adx': False, 'use_ema': True, 'use_spike': False, 'rsi_required': False, 'edge_k': 0.21687409292698134, 'edge_cap': 0.2947290061302986, 'bull_strategy': 'mean_reversion', 'bull_bb_std_mult': 3.1827944612846513, 'bull_rsi_os': 39, 'bull_rsi_ob': 56, 'bull_adx_thresh': 9.847674005711214, 'bull_atr_min_pct': 0.003986765370771531, 'bull_atr_max_pct': 0.12112659404724271, 'bull_tp_mult': 2.7888578904049157, 'bull_tsl_mult': 0.4207391357892302, 'bull_time_stop': 41, 'bull_use_sma': True, 'bull_use_ema': True, 'bull_use_atr': True, 'bull_use_adx': False, 'bull_use_spike': True, 'bull_rsi_required': True, 'bear_strategy': 'breakout', 'bear_bb_std_mult': 3.44382352122099, 'bear_rsi_os': 34, 'bear_rsi_ob': 61, 'bear_adx_thresh': 10.713430828468407, 'bear_atr_min_pct': 0.002215580458658462, 'bear_atr_max_pct': 0.04405321120571533, 'bear_tp_mult': 1.3150935794348326, 'bear_tsl_mult': 0.42001902196777485, 'bear_time_stop': 227, 'bear_use_sma': False, 'bear_use_ema': False, 'bear_use_atr': True, 'bear_use_adx': True, 'bear_use_spike': False, 'bear_rsi_required': False, 'sideways_strategy': 'mean_reversion', 'sideways_bb_std_mult': 0.7230120157107203, 'sideways_rsi_os': 51, 'sideways_rsi_ob': 82, 'sideways_adx_thresh': 13.661898845038998, 'sideways_atr_min_pct': 0.020100536226900414, 'sideways_atr_max_pct': 0.06925000602074154, 'sideways_tp_mult': 2.277373983514827, 'sideways_tsl_mult': 0.25419251013756555, 'sideways_time_stop': 231, 'sideways_use_sma': False, 'sideways_use_ema': False, 'sideways_use_atr': True, 'sideways_use_adx': True, 'sideways_use_spike': False, 'sideways_rsi_required': False}.
[I 2025-09-01 14:51:40,426] Trial 733 finished with values: [-0.21096693315936343, 0.21040033574043038] and parameters: {'p_sma': 36, 'p_std': 29, 'p_atr': 26, 'p_adx': 13, 'rsi_period': 9, 'ema1': 27, 'ema2': 19, 'slip_atr_k': 0.24121565271787587, 'slip_spread_k': 0.08587948140608093, 'spread_hl_frac': 0.005280909840489893, 'bb_std_mult': 1.9829433614219778, 'rsi_os': 49, 'rsi_ob': 84, 'vol_spike': 0.17291664043399405, 'adx_thresh': 33.99957893724597, 'atr_min_pct': 0.026787372333103826, 'atr_max_pct': 0.06565923386377766, 'tp_mult': 1.138952851536866, 'tsl_mult': 0.745772962467752, 'strategy': 'mean_reversion', 'time_stop': 244, 'use_sma': True, 'use_atr': False, 'use_adx': False, 'use_ema': True, 'use_spike': False, 'rsi_required': False, 'edge_k': 0.9454026404624597, 'edge_cap': 0.9674924912676607, 'bull_strategy': 'breakout', 'bull_bb_std_mult': 3.1511937821613887, 'bull_rsi_os': 52, 'bull_rsi_ob': 56, 'bull_adx_thresh': 9.880248806911505, 'bull_atr_min_pct': 0.02511314523667924, 'bull_atr_max_pct': 0.04093908176313006, 'bull_tp_mult': 1.0112564194136562, 'bull_tsl_mult': 0.3241250798322992, 'bull_time_stop': 218, 'bull_use_sma': True, 'bull_use_ema': True, 'bull_use_atr': True, 'bull_use_adx': False, 'bull_use_spike': False, 'bull_rsi_required': True, 'bear_strategy': 'breakout', 'bear_bb_std_mult': 1.372455105236803, 'bear_rsi_os': 51, 'bear_rsi_ob': 86, 'bear_adx_thresh': 10.558479936842282, 'bear_atr_min_pct': 0.001175646032808321, 'bear_atr_max_pct': 0.04394597613030853, 'bear_tp_mult': 2.372266917815457, 'bear_tsl_mult': 0.7556300579581037, 'bear_time_stop': 68, 'bear_use_sma': True, 'bear_use_ema': False, 'bear_use_atr': True, 'bear_use_adx': True, 'bear_use_spike': False, 'bear_rsi_required': False, 'sideways_strategy': 'breakout', 'sideways_bb_std_mult': 3.205066134229991, 'sideways_rsi_os': 49, 'sideways_rsi_ob': 86, 'sideways_adx_thresh': 25.560935321725882, 'sideways_atr_min_pct': 0.02030269550683152, 'sideways_atr_max_pct': 0.0693232834406698, 'sideways_tp_mult': 2.2804072726249847, 'sideways_tsl_mult': 0.19455476262744037, 'sideways_time_stop': 141, 'sideways_use_sma': False, 'sideways_use_ema': False, 'sideways_use_atr': True, 'sideways_use_adx': True, 'sideways_use_spike': False, 'sideways_rsi_required': False}.
[I 2025-09-01 14:51:40,796] Trial 731 finished with values: [-1000000000.0, 1000000000.0] and parameters: {'p_sma': 38, 'p_std': 51, 'p_atr': 13, 'p_adx': 30, 'rsi_period': 43, 'ema1': 22, 'ema2': 57, 'slip_atr_k': 0.056100012055955537, 'slip_spread_k': 0.0279442425598345, 'spread_hl_frac': 0.04325105276287483, 'bb_std_mult': 1.96645139921607, 'rsi_os': 50, 'rsi_ob': 59, 'vol_spike': 0.256978104814604, 'adx_thresh': 22.814317286075855, 'atr_min_pct': 0.020329550607865787, 'atr_max_pct': 0.10535937720654184, 'tp_mult': 1.2132679474345527, 'tsl_mult': 0.7493480754351955, 'strategy': 'breakout', 'time_stop': 242, 'use_sma': True, 'use_atr': True, 'use_adx': True, 'use_ema': True, 'use_spike': True, 'rsi_required': False, 'edge_k': 0.23404785338685052, 'edge_cap': 0.40689744676538997, 'bull_strategy': 'breakout', 'bull_bb_std_mult': 3.3647571844604225, 'bull_rsi_os': 37, 'bull_rsi_ob': 57, 'bull_adx_thresh': 13.647534726792664, 'bull_atr_min_pct': 0.018595466276689992, 'bull_atr_max_pct': 0.12256363447098073, 'bull_tp_mult': 2.739275111751928, 'bull_tsl_mult': 0.4700607104073108, 'bull_time_stop': 218, 'bull_use_sma': True, 'bull_use_ema': True, 'bull_use_atr': True, 'bull_use_adx': False, 'bull_use_spike': False, 'bull_rsi_required': False, 'bear_strategy': 'mean_reversion', 'bear_bb_std_mult': 1.727586006235612, 'bear_rsi_os': 12, 'bear_rsi_ob': 74, 'bear_adx_thresh': 13.94844510670702, 'bear_atr_min_pct': 0.0009073292441322308, 'bear_atr_max_pct': 0.04632649584896732, 'bear_tp_mult': 1.4920208271527224, 'bear_tsl_mult': 0.13631564606058688, 'bear_time_stop': 70, 'bear_use_sma': True, 'bear_use_ema': True, 'bear_use_atr': True, 'bear_use_adx': False, 'bear_use_spike': True, 'bear_rsi_required': True, 'sideways_strategy': 'breakout', 'sideways_bb_std_mult': 2.52490352080991, 'sideways_rsi_os': 49, 'sideways_rsi_ob': 67, 'sideways_adx_thresh': 14.34283188795552, 'sideways_atr_min_pct': 0.01901236702132203, 'sideways_atr_max_pct': 0.09010454315286419, 'sideways_tp_mult': 2.679870247862375, 'sideways_tsl_mult': 0.01408206181908489, 'sideways_time_stop': 176, 'sideways_use_sma': True, 'sideways_use_ema': False, 'sideways_use_atr': False, 'sideways_use_adx': True, 'sideways_use_spike': True, 'sideways_rsi_required': True}.
[I 2025-09-01 14:51:41,159] Trial 732 finished with values: [-1000000000.0, 1000000000.0] and parameters: {'p_sma': 36, 'p_std': 51, 'p_atr': 26, 'p_adx': 13, 'rsi_period': 18, 'ema1': 30, 'ema2': 23, 'slip_atr_k': 0.007784171069209991, 'slip_spread_k': 0.024241434042948352, 'spread_hl_frac': 0.020326685061015294, 'bb_std_mult': 0.6620200015526312, 'rsi_os': 38, 'rsi_ob': 84, 'vol_spike': 0.21730107266971657, 'adx_thresh': 25.645010707088264, 'atr_min_pct': 0.006117551970562447, 'atr_max_pct': 0.13544157360219528, 'tp_mult': 2.5290032630284482, 'tsl_mult': 0.7271405485362522, 'strategy': 'breakout', 'time_stop': 241, 'use_sma': True, 'use_atr': False, 'use_adx': False, 'use_ema': True, 'use_spike': True, 'rsi_required': False, 'edge_k': 0.7933055940907343, 'edge_cap': 0.36102330972952446, 'bull_strategy': 'breakout', 'bull_bb_std_mult': 3.1772645933152477, 'bull_rsi_os': 41, 'bull_rsi_ob': 53, 'bull_adx_thresh': 32.20424599628347, 'bull_atr_min_pct': 0.018528763279564733, 'bull_atr_max_pct': 0.10937113158826083, 'bull_tp_mult': 2.7173893776909477, 'bull_tsl_mult': 0.4516274515035355, 'bull_time_stop': 90, 'bull_use_sma': True, 'bull_use_ema': True, 'bull_use_atr': True, 'bull_use_adx': False, 'bull_use_spike': False, 'bull_rsi_required': True, 'bear_strategy': 'mean_reversion', 'bear_bb_std_mult': 3.5999122827207084, 'bear_rsi_os': 35, 'bear_rsi_ob': 86, 'bear_adx_thresh': 20.03278697475545, 'bear_atr_min_pct': 0.003912004252293546, 'bear_atr_max_pct': 0.04537026972154008, 'bear_tp_mult': 1.1694002001808368, 'bear_tsl_mult': 0.13465353821340642, 'bear_time_stop': 230, 'bear_use_sma': True, 'bear_use_ema': True, 'bear_use_atr': True, 'bear_use_adx': False, 'bear_use_spike': False, 'bear_rsi_required': True, 'sideways_strategy': 'breakout', 'sideways_bb_std_mult': 0.8824088411854825, 'sideways_rsi_os': 50, 'sideways_rsi_ob': 67, 'sideways_adx_thresh': 6.542046909415664, 'sideways_atr_min_pct': 0.012269610976064525, 'sideways_atr_max_pct': 0.07113434381089724, 'sideways_tp_mult': 2.676716468246231, 'sideways_tsl_mult': 0.295646685599889, 'sideways_time_stop': 186, 'sideways_use_sma': True, 'sideways_use_ema': False, 'sideways_use_atr': True, 'sideways_use_adx': True, 'sideways_use_spike': True, 'sideways_rsi_required': True}.
[I 2025-09-01 14:51:42,212] Trial 737 finished with values: [-1000000000.0, 1000000000.0] and parameters: {'p_sma': 36, 'p_std': 45, 'p_atr': 8, 'p_adx': 28, 'rsi_period': 65, 'ema1': 5, 'ema2': 51, 'slip_atr_k': 0.07401917524468157, 'slip_spread_k': 0.057823584824383004, 'spread_hl_frac': 0.01961840609363873, 'bb_std_mult': 1.797490786682028, 'rsi_os': 40, 'rsi_ob': 48, 'vol_spike': 0.16475833787958996, 'adx_thresh': 25.355083140781343, 'atr_min_pct': 0.005723179642854523, 'atr_max_pct': 0.13634103862357325, 'tp_mult': 1.0135228894239026, 'tsl_mult': 0.8668140462346695, 'strategy': 'mean_reversion', 'time_stop': 235, 'use_sma': False, 'use_atr': False, 'use_adx': False, 'use_ema': False, 'use_spike': True, 'rsi_required': True, 'edge_k': 1.1204906298438393, 'edge_cap': 0.3151632596073039, 'bull_strategy': 'mean_reversion', 'bull_bb_std_mult': 1.019859331727215, 'bull_rsi_os': 31, 'bull_rsi_ob': 54, 'bull_adx_thresh': 21.68948903785981, 'bull_atr_min_pct': 0.02718768690483153, 'bull_atr_max_pct': 0.018974541036935553, 'bull_tp_mult': 2.890889937639444, 'bull_tsl_mult': 0.37944347601310824, 'bull_time_stop': 84, 'bull_use_sma': False, 'bull_use_ema': False, 'bull_use_atr': False, 'bull_use_adx': True, 'bull_use_spike': False, 'bull_rsi_required': True, 'bear_strategy': 'breakout', 'bear_bb_std_mult': 3.479833649918303, 'bear_rsi_os': 16, 'bear_rsi_ob': 90, 'bear_adx_thresh': 28.293573587104113, 'bear_atr_min_pct': 0.002498052749154867, 'bear_atr_max_pct': 0.03549547028659456, 'bear_tp_mult': 1.3803898970980613, 'bear_tsl_mult': 0.18704880834207213, 'bear_time_stop': 33, 'bear_use_sma': False, 'bear_use_ema': True, 'bear_use_atr': False, 'bear_use_adx': True, 'bear_use_spike': False, 'bear_rsi_required': True, 'sideways_strategy': 'mean_reversion', 'sideways_bb_std_mult': 1.3507577126502395, 'sideways_rsi_os': 52, 'sideways_rsi_ob': 57, 'sideways_adx_thresh': 6.542682826645169, 'sideways_atr_min_pct': 0.029136557830980785, 'sideways_atr_max_pct': 0.0639716304067717, 'sideways_tp_mult': 2.2152669100513336, 'sideways_tsl_mult': 0.295063544272055, 'sideways_time_stop': 186, 'sideways_use_sma': True, 'sideways_use_ema': True, 'sideways_use_atr': True, 'sideways_use_adx': True, 'sideways_use_spike': False, 'sideways_rsi_required': True}.
[I 2025-09-01 14:52:22,329] Trial 738 finished with values: [-1000000000.0, 1000000000.0] and parameters: {'p_sma': 33, 'p_std': 45, 'p_atr': 12, 'p_adx': 22, 'rsi_period': 39, 'ema1': 18, 'ema2': 39, 'slip_atr_k': 0.01411262675015762, 'slip_spread_k': 0.05935985793679152, 'spread_hl_frac': 0.006650302551466789, 'bb_std_mult': 1.7940743546465392, 'rsi_os': 40, 'rsi_ob': 67, 'vol_spike': 0.2381420745953414, 'adx_thresh': 24.15481521329019, 'atr_min_pct': 0.026706939507331055, 'atr_max_pct': 0.05546993793723515, 'tp_mult': 1.1227639710052049, 'tsl_mult': 0.2592125883488866, 'strategy': 'mean_reversion', 'time_stop': 235, 'use_sma': False, 'use_atr': False, 'use_adx': False, 'use_ema': False, 'use_spike': True, 'rsi_required': True, 'edge_k': 1.4663550995319985, 'edge_cap': 0.785846373909354, 'bull_strategy': 'mean_reversion', 'bull_bb_std_mult': 3.264660407029852, 'bull_rsi_os': 47, 'bull_rsi_ob': 55, 'bull_adx_thresh': 8.589188250480653, 'bull_atr_min_pct': 0.00903531420431922, 'bull_atr_max_pct': 0.09298163022232099, 'bull_tp_mult': 1.3404644426015764, 'bull_tsl_mult': 0.3747229952365539, 'bull_time_stop': 101, 'bull_use_sma': False, 'bull_use_ema': False, 'bull_use_atr': False, 'bull_use_adx': True, 'bull_use_spike': True, 'bull_rsi_required': True, 'bear_strategy': 'breakout', 'bear_bb_std_mult': 2.997879701357496, 'bear_rsi_os': 18, 'bear_rsi_ob': 90, 'bear_adx_thresh': 7.485243472184358, 'bear_atr_min_pct': 0.0023597318452903775, 'bear_atr_max_pct': 0.105868725457085, 'bear_tp_mult': 1.3837120273041736, 'bear_tsl_mult': 0.4533930663386901, 'bear_time_stop': 212, 'bear_use_sma': False, 'bear_use_ema': True, 'bear_use_atr': False, 'bear_use_adx': True, 'bear_use_spike': False, 'bear_rsi_required': True, 'sideways_strategy': 'mean_reversion', 'sideways_bb_std_mult': 1.5656037306708894, 'sideways_rsi_os': 33, 'sideways_rsi_ob': 66, 'sideways_adx_thresh': 32.59282159365013, 'sideways_atr_min_pct': 0.021070770174843392, 'sideways_atr_max_pct': 0.10388100546720784, 'sideways_tp_mult': 2.7933240391689376, 'sideways_tsl_mult': 0.2951440997441049, 'sideways_time_stop': 170, 'sideways_use_sma': True, 'sideways_use_ema': True, 'sideways_use_atr': True, 'sideways_use_adx': False, 'sideways_use_spike': False, 'sideways_rsi_required': True}.
[I 2025-09-01 14:52:22,352] Trial 736 finished with values: [-1000000000.0, 1000000000.0] and parameters: {'p_sma': 33, 'p_std': 45, 'p_atr': 22, 'p_adx': 23, 'rsi_period': 65, 'ema1': 21, 'ema2': 43, 'slip_atr_k': 0.07252778348532882, 'slip_spread_k': 0.7333028770777348, 'spread_hl_frac': 0.011006279939841697, 'bb_std_mult': 1.8208854554064349, 'rsi_os': 38, 'rsi_ob': 55, 'vol_spike': 0.23782464260066025, 'adx_thresh': 25.610033323866855, 'atr_min_pct': 0.016564980175246418, 'atr_max_pct': 0.10573695275701882, 'tp_mult': 2.6126577587740663, 'tsl_mult': 0.7147391868266308, 'strategy': 'mean_reversion', 'time_stop': 237, 'use_sma': False, 'use_atr': False, 'use_adx': False, 'use_ema': True, 'use_spike': True, 'rsi_required': True, 'edge_k': 0.8985752709807417, 'edge_cap': 0.78323481149498, 'bull_strategy': 'breakout', 'bull_bb_std_mult': 3.530986133614853, 'bull_rsi_os': 47, 'bull_rsi_ob': 55, 'bull_adx_thresh': 8.306667131921058, 'bull_atr_min_pct': 0.005087751841472458, 'bull_atr_max_pct': 0.018531963724879558, 'bull_tp_mult': 2.038145599605402, 'bull_tsl_mult': 0.3762002602837769, 'bull_time_stop': 19, 'bull_use_sma': True, 'bull_use_ema': True, 'bull_use_atr': False, 'bull_use_adx': True, 'bull_use_spike': False, 'bull_rsi_required': True, 'bear_strategy': 'breakout', 'bear_bb_std_mult': 2.4604615887044496, 'bear_rsi_os': 33, 'bear_rsi_ob': 74, 'bear_adx_thresh': 28.327136778400153, 'bear_atr_min_pct': 0.02924994192990288, 'bear_atr_max_pct': 0.03852729313866669, 'bear_tp_mult': 1.1903695185927967, 'bear_tsl_mult': 0.13692582252402785, 'bear_time_stop': 75, 'bear_use_sma': True, 'bear_use_ema': True, 'bear_use_atr': True, 'bear_use_adx': True, 'bear_use_spike': False, 'bear_rsi_required': True, 'sideways_strategy': 'breakout', 'sideways_bb_std_mult': 1.0169012044258126, 'sideways_rsi_os': 39, 'sideways_rsi_ob': 67, 'sideways_adx_thresh': 32.7795520170844, 'sideways_atr_min_pct': 0.021163453824887667, 'sideways_atr_max_pct': 0.06414056907037027, 'sideways_tp_mult': 2.7870865230491653, 'sideways_tsl_mult': 0.29078435724187357, 'sideways_time_stop': 182, 'sideways_use_sma': True, 'sideways_use_ema': True, 'sideways_use_atr': True, 'sideways_use_adx': True, 'sideways_use_spike': False, 'sideways_rsi_required': True}.
