[I 2025-09-01 14:15:29,246] Trial 489 finished with values: [-1000000000.0, 1000000000.0] and parameters: {'p_sma': 46, 'p_std': 50, 'p_atr': 17, 'p_adx': 25, 'rsi_period': 61, 'ema1': 23, 'ema2': 44, 'slip_atr_k': 0.00013875936646584597, 'slip_spread_k': 0.018028429176640597, 'spread_hl_frac': 0.0038072788959959414, 'bb_std_mult': 1.3493149469760874, 'rsi_os': 18, 'rsi_ob': 81, 'vol_spike': 0.056600851450521586, 'adx_thresh': 25.4797844554087, 'atr_min_pct': 0.025728175658754415, 'atr_max_pct': 0.02001131372470516, 'tp_mult': 1.0438673478610572, 'tsl_mult': 0.38557364752517925, 'strategy': 'breakout', 'time_stop': 251, 'use_sma': False, 'use_atr': False, 'use_adx': True, 'use_ema': True, 'use_spike': True, 'rsi_required': False, 'edge_k': 0.8860955249913915, 'edge_cap': 0.375133422767304, 'bull_strategy': 'breakout', 'bull_bb_std_mult': 3.262184681371345, 'bull_rsi_os': 35, 'bull_rsi_ob': 80, 'bull_adx_thresh': 8.226107638128557, 'bull_atr_min_pct': 0.005516111105513091, 'bull_atr_max_pct': 0.06958383530331146, 'bull_tp_mult': 2.886203207996698, 'bull_tsl_mult': 0.4736936853974166, 'bull_time_stop': 85, 'bull_use_sma': True, 'bull_use_ema': True, 'bull_use_atr': False, 'bull_use_adx': True, 'bull_use_spike': True, 'bull_rsi_required': True, 'bear_strategy': 'mean_reversion', 'bear_bb_std_mult': 3.4766460646877615, 'bear_rsi_os': 29, 'bear_rsi_ob': 47, 'bear_adx_thresh': 12.449558039600788, 'bear_atr_min_pct': 0.0028596045689153935, 'bear_atr_max_pct': 0.034766312590837144, 'bear_tp_mult': 2.686676575095416, 'bear_tsl_mult': 0.1872128741943378, 'bear_time_stop': 207, 'bear_use_sma': True, 'bear_use_ema': True, 'bear_use_atr': False, 'bear_use_adx': False, 'bear_use_spike': False, 'bear_rsi_required': True, 'sideways_strategy': 'breakout', 'sideways_bb_std_mult': 1.629493623902185, 'sideways_rsi_os': 22, 'sideways_rsi_ob': 67, 'sideways_adx_thresh': 9.51856337143792, 'sideways_atr_min_pct': 0.029358251774818777, 'sideways_atr_max_pct': 0.06889604358845182, 'sideways_tp_mult': 2.1066251420705924, 'sideways_tsl_mult': 0.2784876545289674, 'sideways_time_stop': 60, 'sideways_use_sma': True, 'sideways_use_ema': False, 'sideways_use_atr': True, 'sideways_use_adx': True, 'sideways_use_spike': False, 'sideways_rsi_required': True}.
[I 2025-09-01 14:16:09,984] Trial 487 finished with values: [-1000000000.0, 1000000000.0] and parameters: {'p_sma': 45, 'p_std': 27, 'p_atr': 26, 'p_adx': 13, 'rsi_period': 44, 'ema1': 28, 'ema2': 45, 'slip_atr_k': 0.00021703571956173742, 'slip_spread_k': 0.8529414582650727, 'spread_hl_frac': 0.00313415612760419, 'bb_std_mult': 1.7699579964276138, 'rsi_os': 37, 'rsi_ob': 82, 'vol_spike': 0.016275967484014026, 'adx_thresh': 20.728963995660024, 'atr_min_pct': 0.02654742392371244, 'atr_max_pct': 0.14333001383506858, 'tp_mult': 1.0430064840115592, 'tsl_mult': 0.9483560660809633, 'strategy': 'mean_reversion', 'time_stop': 179, 'use_sma': False, 'use_atr': False, 'use_adx': True, 'use_ema': True, 'use_spike': True, 'rsi_required': False, 'edge_k': 0.8891103424449586, 'edge_cap': 0.29420251258252395, 'bull_strategy': 'breakout', 'bull_bb_std_mult': 1.2130126149016225, 'bull_rsi_os': 35, 'bull_rsi_ob': 75, 'bull_adx_thresh': 8.349873059276074, 'bull_atr_min_pct': 0.005544257419836042, 'bull_atr_max_pct': 0.04748304407071501, 'bull_tp_mult': 2.7811487762072296, 'bull_tsl_mult': 0.9271590500508006, 'bull_time_stop': 148, 'bull_use_sma': True, 'bull_use_ema': True, 'bull_use_atr': False, 'bull_use_adx': True, 'bull_use_spike': False, 'bull_rsi_required': True, 'bear_strategy': 'breakout', 'bear_bb_std_mult': 2.4247017827437505, 'bear_rsi_os': 17, 'bear_rsi_ob': 85, 'bear_adx_thresh': 10.965450707093273, 'bear_atr_min_pct': 0.002927133649763229, 'bear_atr_max_pct': 0.041033307141508206, 'bear_tp_mult': 2.3443536872120454, 'bear_tsl_mult': 0.7465947122844434, 'bear_time_stop': 37, 'bear_use_sma': True, 'bear_use_ema': True, 'bear_use_atr': False, 'bear_use_adx': False, 'bear_use_spike': False, 'bear_rsi_required': True, 'sideways_strategy': 'breakout', 'sideways_bb_std_mult': 1.6256950488980277, 'sideways_rsi_os': 42, 'sideways_rsi_ob': 65, 'sideways_adx_thresh': 22.060772148834342, 'sideways_atr_min_pct': 0.01769301133777138, 'sideways_atr_max_pct': 0.05811741040129373, 'sideways_tp_mult': 2.7896756646359395, 'sideways_tsl_mult': 0.013570340187415986, 'sideways_time_stop': 164, 'sideways_use_sma': True, 'sideways_use_ema': False, 'sideways_use_atr': True, 'sideways_use_adx': True, 'sideways_use_spike': False, 'sideways_rsi_required': True}.
[I 2025-09-01 14:16:10,388] Trial 488 finished with values: [-1000000000.0, 1000000000.0] and parameters: {'p_sma': 44, 'p_std': 25, 'p_atr': 24, 'p_adx': 7, 'rsi_period': 60, 'ema1': 23, 'ema2': 48, 'slip_atr_k': 0.0029485180600541203, 'slip_spread_k': 0.018554518970281653, 'spread_hl_frac': 0.0037103592633120747, 'bb_std_mult': 1.2860752119607004, 'rsi_os': 18, 'rsi_ob': 76, 'vol_spike': 0.24787895107023894, 'adx_thresh': 18.155694601838782, 'atr_min_pct': 0.025770477549863568, 'atr_max_pct': 0.1101330747827072, 'tp_mult': 1.0117408373301129, 'tsl_mult': 0.39622370567110243, 'strategy': 'breakout', 'time_stop': 251, 'use_sma': False, 'use_atr': False, 'use_adx': True, 'use_ema': True, 'use_spike': True, 'rsi_required': False, 'edge_k': 0.8797569531487714, 'edge_cap': 0.3847663261114157, 'bull_strategy': 'breakout', 'bull_bb_std_mult': 3.067088672181533, 'bull_rsi_os': 35, 'bull_rsi_ob': 57, 'bull_adx_thresh': 9.714813695116607, 'bull_atr_min_pct': 0.022746974688999833, 'bull_atr_max_pct': 0.0415044114193965, 'bull_tp_mult': 2.669197917093591, 'bull_tsl_mult': 0.4854568667775505, 'bull_time_stop': 251, 'bull_use_sma': True, 'bull_use_ema': True, 'bull_use_atr': False, 'bull_use_adx': True, 'bull_use_spike': False, 'bull_rsi_required': True, 'bear_strategy': 'mean_reversion', 'bear_bb_std_mult': 1.8588325489898356, 'bear_rsi_os': 29, 'bear_rsi_ob': 85, 'bear_adx_thresh': 12.097959063093738, 'bear_atr_min_pct': 0.002967990539966261, 'bear_atr_max_pct': 0.07282905482644554, 'bear_tp_mult': 2.3290614921705832, 'bear_tsl_mult': 0.7418271856901307, 'bear_time_stop': 6, 'bear_use_sma': True, 'bear_use_ema': True, 'bear_use_atr': False, 'bear_use_adx': False, 'bear_use_spike': False, 'bear_rsi_required': True, 'sideways_strategy': 'breakout', 'sideways_bb_std_mult': 1.528428994816835, 'sideways_rsi_os': 42, 'sideways_rsi_ob': 61, 'sideways_adx_thresh': 22.032814167834232, 'sideways_atr_min_pct': 0.004895304292659677, 'sideways_atr_max_pct': 0.06923810455340279, 'sideways_tp_mult': 2.798312563167374, 'sideways_tsl_mult': 0.2727274107690139, 'sideways_time_stop': 152, 'sideways_use_sma': True, 'sideways_use_ema': False, 'sideways_use_atr': True, 'sideways_use_adx': True, 'sideways_use_spike': False, 'sideways_rsi_required': True}.
[I 2025-09-01 14:16:11,056] Trial 486 finished with values: [-1000000000.0, 1000000000.0] and parameters: {'p_sma': 44, 'p_std': 11, 'p_atr': 26, 'p_adx': 13, 'rsi_period': 61, 'ema1': 22, 'ema2': 20, 'slip_atr_k': 0.017571778988011013, 'slip_spread_k': 0.47675173931426756, 'spread_hl_frac': 0.0036787645186914936, 'bb_std_mult': 1.3091045879112553, 'rsi_os': 44, 'rsi_ob': 85, 'vol_spike': 0.23882251200739982, 'adx_thresh': 27.609969179141245, 'atr_min_pct': 0.026564207568121043, 'atr_max_pct': 0.07308107986567867, 'tp_mult': 1.1770418338816906, 'tsl_mult': 0.502437595649721, 'strategy': 'mean_reversion', 'time_stop': 179, 'use_sma': True, 'use_atr': False, 'use_adx': False, 'use_ema': True, 'use_spike': True, 'rsi_required': False, 'edge_k': 0.7549753479147293, 'edge_cap': 0.9152173787568578, 'bull_strategy': 'breakout', 'bull_bb_std_mult': 3.179568900938625, 'bull_rsi_os': 35, 'bull_rsi_ob': 73, 'bull_adx_thresh': 29.556624193467165, 'bull_atr_min_pct': 0.005571971614929496, 'bull_atr_max_pct': 0.07072565229486094, 'bull_tp_mult': 2.489504991552202, 'bull_tsl_mult': 0.03368372981724482, 'bull_time_stop': 85, 'bull_use_sma': True, 'bull_use_ema': True, 'bull_use_atr': True, 'bull_use_adx': True, 'bull_use_spike': False, 'bull_rsi_required': True, 'bear_strategy': 'breakout', 'bear_bb_std_mult': 3.597925315149666, 'bear_rsi_os': 26, 'bear_rsi_ob': 78, 'bear_adx_thresh': 12.997443130724594, 'bear_atr_min_pct': 0.0026829574517195634, 'bear_atr_max_pct': 0.041240035352618304, 'bear_tp_mult': 2.999437816146724, 'bear_tsl_mult': 0.14340888635796495, 'bear_time_stop': 38, 'bear_use_sma': True, 'bear_use_ema': True, 'bear_use_atr': True, 'bear_use_adx': True, 'bear_use_spike': False, 'bear_rsi_required': True, 'sideways_strategy': 'breakout', 'sideways_bb_std_mult': 1.6063038636346663, 'sideways_rsi_os': 51, 'sideways_rsi_ob': 65, 'sideways_adx_thresh': 9.349366388349646, 'sideways_atr_min_pct': 0.017653865508477168, 'sideways_atr_max_pct': 0.06087343869251451, 'sideways_tp_mult': 2.7121728881706177, 'sideways_tsl_mult': 0.27861463742067394, 'sideways_time_stop': 164, 'sideways_use_sma': True, 'sideways_use_ema': False, 'sideways_use_atr': True, 'sideways_use_adx': True, 'sideways_use_spike': False, 'sideways_rsi_required': True}.
[I 2025-09-01 14:16:11,224] Trial 490 finished with values: [-1000000000.0, 1000000000.0] and parameters: {'p_sma': 33, 'p_std': 25, 'p_atr': 24, 'p_adx': 12, 'rsi_period': 84, 'ema1': 22, 'ema2': 18, 'slip_atr_k': 0.010975528152390664, 'slip_spread_k': 0.13838894253063083, 'spread_hl_frac': 0.00863727722644866, 'bb_std_mult': 1.8134962384326754, 'rsi_os': 39, 'rsi_ob': 84, 'vol_spike': 0.014840509453327294, 'adx_thresh': 18.086959062771005, 'atr_min_pct': 0.025801796549667237, 'atr_max_pct': 0.14045601163601662, 'tp_mult': 1.011722803049503, 'tsl_mult': 0.508250459102584, 'strategy': 'mean_reversion', 'time_stop': 221, 'use_sma': True, 'use_atr': True, 'use_adx': False, 'use_ema': True, 'use_spike': True, 'rsi_required': False, 'edge_k': 0.8934639800649452, 'edge_cap': 0.4330662720559683, 'bull_strategy': 'mean_reversion', 'bull_bb_std_mult': 3.165966855258203, 'bull_rsi_os': 35, 'bull_rsi_ob': 83, 'bull_adx_thresh': 30.136934919236875, 'bull_atr_min_pct': 0.003598528340595807, 'bull_atr_max_pct': 0.10552751970963016, 'bull_tp_mult': 2.8787483474222997, 'bull_tsl_mult': 0.47830726551879427, 'bull_time_stop': 253, 'bull_use_sma': True, 'bull_use_ema': True, 'bull_use_atr': True, 'bull_use_adx': True, 'bull_use_spike': False, 'bull_rsi_required': True, 'bear_strategy': 'breakout', 'bear_bb_std_mult': 2.443932753298107, 'bear_rsi_os': 32, 'bear_rsi_ob': 67, 'bear_adx_thresh': 28.757480141339855, 'bear_atr_min_pct': 0.0012237468876965616, 'bear_atr_max_pct': 0.04747010010653471, 'bear_tp_mult': 2.186369324637343, 'bear_tsl_mult': 0.7427273765127654, 'bear_time_stop': 223, 'bear_use_sma': False, 'bear_use_ema': True, 'bear_use_atr': False, 'bear_use_adx': False, 'bear_use_spike': False, 'bear_rsi_required': True, 'sideways_strategy': 'breakout', 'sideways_bb_std_mult': 1.7173840606736555, 'sideways_rsi_os': 50, 'sideways_rsi_ob': 65, 'sideways_adx_thresh': 7.1929517291163085, 'sideways_atr_min_pct': 0.012814661093090932, 'sideways_atr_max_pct': 0.03788280652146567, 'sideways_tp_mult': 1.9125065802119154, 'sideways_tsl_mult': 0.254660120085565, 'sideways_time_stop': 35, 'sideways_use_sma': True, 'sideways_use_ema': False, 'sideways_use_atr': True, 'sideways_use_adx': True, 'sideways_use_spike': False, 'sideways_rsi_required': True}.
[I 2025-09-01 14:16:53,335] Trial 493 finished with values: [-1000000000.0, 1000000000.0] and parameters: {'p_sma': 30, 'p_std': 59, 'p_atr': 22, 'p_adx': 30, 'rsi_period': 68, 'ema1': 15, 'ema2': 52, 'slip_atr_k': 0.13562086899622397, 'slip_spread_k': 0.9011856456441936, 'spread_hl_frac': 0.04383146410369012, 'bb_std_mult': 3.197964856103333, 'rsi_os': 48, 'rsi_ob': 84, 'vol_spike': 0.09251870912757043, 'adx_thresh': 24.399645711542725, 'atr_min_pct': 0.02712764718284194, 'atr_max_pct': 0.032937856060466036, 'tp_mult': 1.0891994493066386, 'tsl_mult': 0.7483487619609462, 'strategy': 'mean_reversion', 'time_stop': 243, 'use_sma': True, 'use_atr': True, 'use_adx': False, 'use_ema': False, 'use_spike': False, 'rsi_required': False, 'edge_k': 1.2668060121759457, 'edge_cap': 0.34554102305992374, 'bull_strategy': 'mean_reversion', 'bull_bb_std_mult': 3.299328902872005, 'bull_rsi_os': 21, 'bull_rsi_ob': 53, 'bull_adx_thresh': 31.391688425362332, 'bull_atr_min_pct': 0.0027700879034410855, 'bull_atr_max_pct': 0.025289420445013266, 'bull_tp_mult': 1.2553660217438194, 'bull_tsl_mult': 0.28055164013821693, 'bull_time_stop': 101, 'bull_use_sma': True, 'bull_use_ema': False, 'bull_use_atr': True, 'bull_use_adx': False, 'bull_use_spike': True, 'bull_rsi_required': True, 'bear_strategy': 'breakout', 'bear_bb_std_mult': 3.34657077331477, 'bear_rsi_os': 36, 'bear_rsi_ob': 63, 'bear_adx_thresh': 34.96537397497091, 'bear_atr_min_pct': 0.0042473550923785896, 'bear_atr_max_pct': 0.05224077688483321, 'bear_tp_mult': 2.2687400738274635, 'bear_tsl_mult': 0.7930750057530654, 'bear_time_stop': 234, 'bear_use_sma': False, 'bear_use_ema': True, 'bear_use_atr': True, 'bear_use_adx': True, 'bear_use_spike': True, 'bear_rsi_required': False, 'sideways_strategy': 'mean_reversion', 'sideways_bb_std_mult': 2.467891330832454, 'sideways_rsi_os': 55, 'sideways_rsi_ob': 83, 'sideways_adx_thresh': 8.05932142602031, 'sideways_atr_min_pct': 0.019262613483302514, 'sideways_atr_max_pct': 0.06408620007833246, 'sideways_tp_mult': 2.3980268310870194, 'sideways_tsl_mult': 0.3114857574116074, 'sideways_time_stop': 228, 'sideways_use_sma': False, 'sideways_use_ema': False, 'sideways_use_atr': False, 'sideways_use_adx': True, 'sideways_use_spike': False, 'sideways_rsi_required': True}.
[I 2025-09-01 14:16:53,365] Trial 494 finished with values: [-1000000000.0, 1000000000.0] and parameters: {'p_sma': 57, 'p_std': 48, 'p_atr': 25, 'p_adx': 30, 'rsi_period': 68, 'ema1': 15, 'ema2': 27, 'slip_atr_k': 0.0598206919177469, 'slip_spread_k': 0.08624230277836772, 'spread_hl_frac': 0.040196831916532214, 'bb_std_mult': 0.7668060165372812, 'rsi_os': 48, 'rsi_ob': 84, 'vol_spike': 0.02547919159772885, 'adx_thresh': 24.468104980751292, 'atr_min_pct': 0.027012835383016055, 'atr_max_pct': 0.1312463937463473, 'tp_mult': 1.1305859982679916, 'tsl_mult': 0.8647886074314386, 'strategy': 'mean_reversion', 'time_stop': 242, 'use_sma': True, 'use_atr': True, 'use_adx': False, 'use_ema': False, 'use_spike': False, 'rsi_required': False, 'edge_k': 0.9762545924852081, 'edge_cap': 0.19608146234685248, 'bull_strategy': 'mean_reversion', 'bull_bb_std_mult': 3.4438444993668873, 'bull_rsi_os': 34, 'bull_rsi_ob': 77, 'bull_adx_thresh': 31.467268401307123, 'bull_atr_min_pct': 0.0028827020829910385, 'bull_atr_max_pct': 0.02514831120044876, 'bull_tp_mult': 1.2591765750729107, 'bull_tsl_mult': 0.5083612821715898, 'bull_time_stop': 118, 'bull_use_sma': True, 'bull_use_ema': False, 'bull_use_atr': True, 'bull_use_adx': False, 'bull_use_spike': True, 'bull_rsi_required': True, 'bear_strategy': 'breakout', 'bear_bb_std_mult': 2.0955255769314935, 'bear_rsi_os': 36, 'bear_rsi_ob': 89, 'bear_adx_thresh': 11.253697235900884, 'bear_atr_min_pct': 0.013997842577997984, 'bear_atr_max_pct': 0.051693795367932865, 'bear_tp_mult': 2.2013960548572955, 'bear_tsl_mult': 0.13111857446484743, 'bear_time_stop': 232, 'bear_use_sma': False, 'bear_use_ema': True, 'bear_use_atr': True, 'bear_use_adx': True, 'bear_use_spike': True, 'bear_rsi_required': False, 'sideways_strategy': 'mean_reversion', 'sideways_bb_std_mult': 2.1351637174139344, 'sideways_rsi_os': 55, 'sideways_rsi_ob': 45, 'sideways_adx_thresh': 20.22186566856959, 'sideways_atr_min_pct': 0.019402419655804286, 'sideways_atr_max_pct': 0.06615842939784719, 'sideways_tp_mult': 2.7548427291530833, 'sideways_tsl_mult': 0.9444954135083814, 'sideways_time_stop': 192, 'sideways_use_sma': False, 'sideways_use_ema': False, 'sideways_use_atr': False, 'sideways_use_adx': True, 'sideways_use_spike': False, 'sideways_rsi_required': True}.
[I 2025-09-01 14:16:53,622] Trial 491 finished with values: [-1000000000.0, 1000000000.0] and parameters: {'p_sma': 33, 'p_std': 46, 'p_atr': 24, 'p_adx': 12, 'rsi_period': 67, 'ema1': 15, 'ema2': 27, 'slip_atr_k': 0.1325345390170552, 'slip_spread_k': 0.13380278787058178, 'spread_hl_frac': 0.008132080312794845, 'bb_std_mult': 1.6574561438955895, 'rsi_os': 47, 'rsi_ob': 67, 'vol_spike': 0.23868577670870533, 'adx_thresh': 24.40838285150927, 'atr_min_pct': 0.02588090781122131, 'atr_max_pct': 0.06712373368281108, 'tp_mult': 2.8247644046709603, 'tsl_mult': 0.7411008593034261, 'strategy': 'mean_reversion', 'time_stop': 241, 'use_sma': True, 'use_atr': True, 'use_adx': False, 'use_ema': True, 'use_spike': True, 'rsi_required': False, 'edge_k': 0.5479377455910213, 'edge_cap': 0.33110032026914166, 'bull_strategy': 'mean_reversion', 'bull_bb_std_mult': 3.4507533117972637, 'bull_rsi_os': 21, 'bull_rsi_ob': 57, 'bull_adx_thresh': 30.296059014995926, 'bull_atr_min_pct': 0.0037847067060913023, 'bull_atr_max_pct': 0.037166303908851464, 'bull_tp_mult': 2.872583982876123, 'bull_tsl_mult': 0.4787359903585227, 'bull_time_stop': 99, 'bull_use_sma': True, 'bull_use_ema': True, 'bull_use_atr': True, 'bull_use_adx': False, 'bull_use_spike': False, 'bull_rsi_required': True, 'bear_strategy': 'breakout', 'bear_bb_std_mult': 3.5981071995283482, 'bear_rsi_os': 36, 'bear_rsi_ob': 67, 'bear_adx_thresh': 14.836644217884626, 'bear_atr_min_pct': 0.0041513971652326, 'bear_atr_max_pct': 0.0520328033259785, 'bear_tp_mult': 1.5911339869704242, 'bear_tsl_mult': 0.1379187526858895, 'bear_time_stop': 221, 'bear_use_sma': False, 'bear_use_ema': True, 'bear_use_atr': True, 'bear_use_adx': True, 'bear_use_spike': False, 'bear_rsi_required': True, 'sideways_strategy': 'breakout', 'sideways_bb_std_mult': 1.7381718620692679, 'sideways_rsi_os': 50, 'sideways_rsi_ob': 63, 'sideways_adx_thresh': 8.162154871748657, 'sideways_atr_min_pct': 0.01934550219619973, 'sideways_atr_max_pct': 0.061504367560810395, 'sideways_tp_mult': 1.9839531762718845, 'sideways_tsl_mult': 0.25337348884231153, 'sideways_time_stop': 198, 'sideways_use_sma': True, 'sideways_use_ema': False, 'sideways_use_atr': True, 'sideways_use_adx': True, 'sideways_use_spike': False, 'sideways_rsi_required': True}.
[I 2025-09-01 14:16:53,964] Trial 492 finished with values: [-1000000000.0, 1000000000.0] and parameters: {'p_sma': 30, 'p_std': 46, 'p_atr': 25, 'p_adx': 24, 'rsi_period': 67, 'ema1': 8, 'ema2': 18, 'slip_atr_k': 0.010756354647484992, 'slip_spread_k': 0.7041848840423843, 'spread_hl_frac': 0.04105768343262857, 'bb_std_mult': 2.7607294266791986, 'rsi_os': 39, 'rsi_ob': 67, 'vol_spike': 0.2406926044197009, 'adx_thresh': 31.622701660289295, 'atr_min_pct': 0.02598615127333484, 'atr_max_pct': 0.0721253370318753, 'tp_mult': 1.0914999685349338, 'tsl_mult': 0.5054791775322064, 'strategy': 'mean_reversion', 'time_stop': 242, 'use_sma': True, 'use_atr': True, 'use_adx': False, 'use_ema': True, 'use_spike': True, 'rsi_required': False, 'edge_k': 0.796991741468233, 'edge_cap': 0.6006281054726761, 'bull_strategy': 'mean_reversion', 'bull_bb_std_mult': 3.16869709359908, 'bull_rsi_os': 21, 'bull_rsi_ob': 53, 'bull_adx_thresh': 31.89582695265376, 'bull_atr_min_pct': 0.016197444627692764, 'bull_atr_max_pct': 0.07412450786605546, 'bull_tp_mult': 2.482388634913974, 'bull_tsl_mult': 0.5846406147290031, 'bull_time_stop': 220, 'bull_use_sma': True, 'bull_use_ema': True, 'bull_use_atr': True, 'bull_use_adx': False, 'bull_use_spike': False, 'bull_rsi_required': True, 'bear_strategy': 'breakout', 'bear_bb_std_mult': 3.256747780019754, 'bear_rsi_os': 38, 'bear_rsi_ob': 89, 'bear_adx_thresh': 29.1304318788866, 'bear_atr_min_pct': 0.016273071291777762, 'bear_atr_max_pct': 0.048325521582254484, 'bear_tp_mult': 2.1868297382262973, 'bear_tsl_mult': 0.13403935528393834, 'bear_time_stop': 224, 'bear_use_sma': False, 'bear_use_ema': True, 'bear_use_atr': True, 'bear_use_adx': True, 'bear_use_spike': False, 'bear_rsi_required': True, 'sideways_strategy': 'breakout', 'sideways_bb_std_mult': 2.4278716456094918, 'sideways_rsi_os': 50, 'sideways_rsi_ob': 83, 'sideways_adx_thresh': 24.875360557369966, 'sideways_atr_min_pct': 0.01285160470713157, 'sideways_atr_max_pct': 0.026653909386096547, 'sideways_tp_mult': 1.0427152864147509, 'sideways_tsl_mult': 0.9180980740249567, 'sideways_time_stop': 200, 'sideways_use_sma': True, 'sideways_use_ema': False, 'sideways_use_atr': True, 'sideways_use_adx': True, 'sideways_use_spike': False, 'sideways_rsi_required': True}.
