[I 2025-09-01 13:59:38,154] Trial 376 finished with values: [-1000000000.0, 1000000000.0] and parameters: {'p_sma': 43, 'p_std': 45, 'p_atr': 9, 'p_adx': 15, 'rsi_period': 60, 'ema1': 22, 'ema2': 17, 'slip_atr_k': 0.010424032821952601, 'slip_spread_k': 0.09117801848439507, 'spread_hl_frac': 0.00612191217094208, 'bb_std_mult': 1.432587523535045, 'rsi_os': 38, 'rsi_ob': 80, 'vol_spike': 0.10360083242539439, 'adx_thresh': 26.00260558042256, 'atr_min_pct': 0.0066818188189052274, 'atr_max_pct': 0.0773781470311647, 'tp_mult': 1.0785190969191158, 'tsl_mult': 0.7523395873883993, 'strategy': 'mean_reversion', 'time_stop': 231, 'use_sma': False, 'use_atr': False, 'use_adx': False, 'use_ema': True, 'use_spike': True, 'rsi_required': False, 'edge_k': 1.9580305969547045, 'edge_cap': 0.6386377592484415, 'bull_strategy': 'mean_reversion', 'bull_bb_std_mult': 2.856272595183781, 'bull_rsi_os': 36, 'bull_rsi_ob': 63, 'bull_adx_thresh': 34.36158950549773, 'bull_atr_min_pct': 0.004301169458814637, 'bull_atr_max_pct': 0.07172080612929131, 'bull_tp_mult': 1.2090902142171327, 'bull_tsl_mult': 0.5009954687518857, 'bull_time_stop': 93, 'bull_use_sma': True, 'bull_use_ema': False, 'bull_use_atr': False, 'bull_use_adx': True, 'bull_use_spike': False, 'bull_rsi_required': False, 'bear_strategy': 'mean_reversion', 'bear_bb_std_mult': 3.4668326363156563, 'bear_rsi_os': 33, 'bear_rsi_ob': 91, 'bear_adx_thresh': 30.493443788616343, 'bear_atr_min_pct': 0.016614115457300474, 'bear_atr_max_pct': 0.04810521020470694, 'bear_tp_mult': 1.9854076904773172, 'bear_tsl_mult': 0.08786686362944084, 'bear_time_stop': 23, 'bear_use_sma': False, 'bear_use_ema': True, 'bear_use_atr': False, 'bear_use_adx': False, 'bear_use_spike': False, 'bear_rsi_required': True, 'sideways_strategy': 'breakout', 'sideways_bb_std_mult': 1.568311412618658, 'sideways_rsi_os': 33, 'sideways_rsi_ob': 65, 'sideways_adx_thresh': 25.785376641934242, 'sideways_atr_min_pct': 0.012642234941964169, 'sideways_atr_max_pct': 0.061624329051777775, 'sideways_tp_mult': 2.755711093713827, 'sideways_tsl_mult': 0.9274802378763102, 'sideways_time_stop': 82, 'sideways_use_sma': True, 'sideways_use_ema': True, 'sideways_use_atr': True, 'sideways_use_adx': True, 'sideways_use_spike': False, 'sideways_rsi_required': True}.
[I 2025-09-01 13:59:38,850] Trial 382 finished with values: [-1000000000.0, 1000000000.0] and parameters: {'p_sma': 8, 'p_std': 48, 'p_atr': 22, 'p_adx': 28, 'rsi_period': 29, 'ema1': 18, 'ema2': 19, 'slip_atr_k': 0.01230412432602033, 'slip_spread_k': 0.06048878144645538, 'spread_hl_frac': 0.04241432806391769, 'bb_std_mult': 1.7798790739737358, 'rsi_os': 50, 'rsi_ob': 86, 'vol_spike': 0.21240179617080027, 'adx_thresh': 20.19784280718686, 'atr_min_pct': 0.02690137462598169, 'atr_max_pct': 0.1357703199098676, 'tp_mult': 1.1403494330276656, 'tsl_mult': 0.6806928254095466, 'strategy': 'mean_reversion', 'time_stop': 248, 'use_sma': True, 'use_atr': True, 'use_adx': False, 'use_ema': False, 'use_spike': True, 'rsi_required': True, 'edge_k': 0.9853862796608972, 'edge_cap': 0.36846695094694737, 'bull_strategy': 'breakout', 'bull_bb_std_mult': 0.8561715928344205, 'bull_rsi_os': 37, 'bull_rsi_ob': 67, 'bull_adx_thresh': 19.64766247582365, 'bull_atr_min_pct': 0.01563063976950403, 'bull_atr_max_pct': 0.02471955494930695, 'bull_tp_mult': 2.872684801708415, 'bull_tsl_mult': 0.05100259755321401, 'bull_time_stop': 104, 'bull_use_sma': False, 'bull_use_ema': True, 'bull_use_atr': True, 'bull_use_adx': True, 'bull_use_spike': True, 'bull_rsi_required': True, 'bear_strategy': 'breakout', 'bear_bb_std_mult': 3.5420576343095505, 'bear_rsi_os': 35, 'bear_rsi_ob': 81, 'bear_adx_thresh': 13.35762845103789, 'bear_atr_min_pct': 0.002554276031703855, 'bear_atr_max_pct': 0.12782573842770692, 'bear_tp_mult': 1.907817059251644, 'bear_tsl_mult': 0.8894022886429451, 'bear_time_stop': 210, 'bear_use_sma': True, 'bear_use_ema': True, 'bear_use_atr': True, 'bear_use_adx': True, 'bear_use_spike': True, 'bear_rsi_required': True, 'sideways_strategy': 'breakout', 'sideways_bb_std_mult': 1.6573685900537034, 'sideways_rsi_os': 49, 'sideways_rsi_ob': 67, 'sideways_adx_thresh': 7.523926012864466, 'sideways_atr_min_pct': 0.019173039358947902, 'sideways_atr_max_pct': 0.14296361234287291, 'sideways_tp_mult': 1.0908178622511993, 'sideways_tsl_mult': 0.11242755153726447, 'sideways_time_stop': 174, 'sideways_use_sma': True, 'sideways_use_ema': False, 'sideways_use_atr': False, 'sideways_use_adx': False, 'sideways_use_spike': True, 'sideways_rsi_required': False}.
[I 2025-09-01 14:00:16,638] Trial 381 finished with values: [-0.01705332461951059, 0.018445943921271205] and parameters: {'p_sma': 34, 'p_std': 45, 'p_atr': 27, 'p_adx': 12, 'rsi_period': 56, 'ema1': 21, 'ema2': 49, 'slip_atr_k': 0.07830484972888974, 'slip_spread_k': 0.05605423208421006, 'spread_hl_frac': 0.016874200370881675, 'bb_std_mult': 2.1012867193376485, 'rsi_os': 43, 'rsi_ob': 82, 'vol_spike': 0.20875034339256232, 'adx_thresh': 25.93092059048073, 'atr_min_pct': 0.026696875281473856, 'atr_max_pct': 0.13614666439878484, 'tp_mult': 1.8492723821184178, 'tsl_mult': 0.7306520697203644, 'strategy': 'mean_reversion', 'time_stop': 41, 'use_sma': True, 'use_atr': True, 'use_adx': False, 'use_ema': True, 'use_spike': True, 'rsi_required': True, 'edge_k': 0.9944191536865125, 'edge_cap': 0.3656724549279106, 'bull_strategy': 'breakout', 'bull_bb_std_mult': 1.8388326963575676, 'bull_rsi_os': 23, 'bull_rsi_ob': 54, 'bull_adx_thresh': 15.240961923049287, 'bull_atr_min_pct': 0.01890275191700452, 'bull_atr_max_pct': 0.024701571394794616, 'bull_tp_mult': 2.8821440658310338, 'bull_tsl_mult': 0.42713955114311813, 'bull_time_stop': 108, 'bull_use_sma': False, 'bull_use_ema': True, 'bull_use_atr': True, 'bull_use_adx': True, 'bull_use_spike': True, 'bull_rsi_required': True, 'bear_strategy': 'breakout', 'bear_bb_std_mult': 1.8274176361351546, 'bear_rsi_os': 35, 'bear_rsi_ob': 87, 'bear_adx_thresh': 16.487868323043962, 'bear_atr_min_pct': 0.0026752907092343825, 'bear_atr_max_pct': 0.14001271040437976, 'bear_tp_mult': 2.0187468396796664, 'bear_tsl_mult': 0.2648669781912394, 'bear_time_stop': 209, 'bear_use_sma': True, 'bear_use_ema': True, 'bear_use_atr': True, 'bear_use_adx': True, 'bear_use_spike': True, 'bear_rsi_required': True, 'sideways_strategy': 'breakout', 'sideways_bb_std_mult': 1.6644476527625636, 'sideways_rsi_os': 49, 'sideways_rsi_ob': 80, 'sideways_adx_thresh': 29.858263061799278, 'sideways_atr_min_pct': 0.0044343668635860815, 'sideways_atr_max_pct': 0.06917421294098741, 'sideways_tp_mult': 2.4577879075279747, 'sideways_tsl_mult': 0.24721994817738266, 'sideways_time_stop': 174, 'sideways_use_sma': True, 'sideways_use_ema': False, 'sideways_use_atr': False, 'sideways_use_adx': False, 'sideways_use_spike': False, 'sideways_rsi_required': True}.
[I 2025-09-01 14:00:16,637] Trial 380 finished with values: [-1000000000.0, 1000000000.0] and parameters: {'p_sma': 34, 'p_std': 46, 'p_atr': 26, 'p_adx': 8, 'rsi_period': 68, 'ema1': 18, 'ema2': 49, 'slip_atr_k': 0.08589607606502439, 'slip_spread_k': 0.8009087828747614, 'spread_hl_frac': 0.017294263190591352, 'bb_std_mult': 1.447013563635779, 'rsi_os': 20, 'rsi_ob': 75, 'vol_spike': 0.21656978947559272, 'adx_thresh': 22.75763754393796, 'atr_min_pct': 0.006536695912337125, 'atr_max_pct': 0.10285793311307469, 'tp_mult': 1.1346056945302978, 'tsl_mult': 0.5574290711186564, 'strategy': 'mean_reversion', 'time_stop': 279, 'use_sma': True, 'use_atr': True, 'use_adx': False, 'use_ema': True, 'use_spike': True, 'rsi_required': True, 'edge_k': 1.2255518694933123, 'edge_cap': 0.37155325630888203, 'bull_strategy': 'breakout', 'bull_bb_std_mult': 2.235101265356733, 'bull_rsi_os': 23, 'bull_rsi_ob': 54, 'bull_adx_thresh': 15.215570764744605, 'bull_atr_min_pct': 0.015395105550778514, 'bull_atr_max_pct': 0.03365349791413731, 'bull_tp_mult': 2.884419216327107, 'bull_tsl_mult': 0.6032465166499327, 'bull_time_stop': 104, 'bull_use_sma': False, 'bull_use_ema': True, 'bull_use_atr': True, 'bull_use_adx': True, 'bull_use_spike': False, 'bull_rsi_required': True, 'bear_strategy': 'breakout', 'bear_bb_std_mult': 3.53906137271812, 'bear_rsi_os': 36, 'bear_rsi_ob': 85, 'bear_adx_thresh': 29.218208430265065, 'bear_atr_min_pct': 0.0026860499191784207, 'bear_atr_max_pct': 0.05769029005023494, 'bear_tp_mult': 2.2915896478316635, 'bear_tsl_mult': 0.19274490178849554, 'bear_time_stop': 211, 'bear_use_sma': True, 'bear_use_ema': True, 'bear_use_atr': True, 'bear_use_adx': True, 'bear_use_spike': False, 'bear_rsi_required': True, 'sideways_strategy': 'breakout', 'sideways_bb_std_mult': 1.647917791685105, 'sideways_rsi_os': 49, 'sideways_rsi_ob': 67, 'sideways_adx_thresh': 7.737086234874974, 'sideways_atr_min_pct': 0.020596334413890867, 'sideways_atr_max_pct': 0.0644427114844437, 'sideways_tp_mult': 2.631268377464924, 'sideways_tsl_mult': 0.7703789527101241, 'sideways_time_stop': 172, 'sideways_use_sma': True, 'sideways_use_ema': False, 'sideways_use_atr': True, 'sideways_use_adx': False, 'sideways_use_spike': False, 'sideways_rsi_required': True}.
[I 2025-09-01 14:00:17,188] Trial 383 finished with values: [-1000000000.0, 1000000000.0] and parameters: {'p_sma': 37, 'p_std': 50, 'p_atr': 26, 'p_adx': 11, 'rsi_period': 65, 'ema1': 21, 'ema2': 35, 'slip_atr_k': 0.07568022527638968, 'slip_spread_k': 0.12920364360876213, 'spread_hl_frac': 0.017008854940522504, 'bb_std_mult': 0.5524002376261439, 'rsi_os': 8, 'rsi_ob': 82, 'vol_spike': 0.2549724319789215, 'adx_thresh': 25.177461114245368, 'atr_min_pct': 0.029336882741197688, 'atr_max_pct': 0.14206349381830008, 'tp_mult': 1.1133340067788131, 'tsl_mult': 0.7278047543458775, 'strategy': 'mean_reversion', 'time_stop': 240, 'use_sma': True, 'use_atr': True, 'use_adx': True, 'use_ema': True, 'use_spike': True, 'rsi_required': False, 'edge_k': 0.9022732328712146, 'edge_cap': 0.6609907456870645, 'bull_strategy': 'breakout', 'bull_bb_std_mult': 3.316112518331297, 'bull_rsi_os': 12, 'bull_rsi_ob': 81, 'bull_adx_thresh': 13.161884234683956, 'bull_atr_min_pct': 0.016792687093429393, 'bull_atr_max_pct': 0.14145710928878358, 'bull_tp_mult': 1.531947317346446, 'bull_tsl_mult': 0.08523771932269619, 'bull_time_stop': 62, 'bull_use_sma': False, 'bull_use_ema': True, 'bull_use_atr': True, 'bull_use_adx': False, 'bull_use_spike': False, 'bull_rsi_required': True, 'bear_strategy': 'breakout', 'bear_bb_std_mult': 3.555668957483697, 'bear_rsi_os': 35, 'bear_rsi_ob': 88, 'bear_adx_thresh': 16.843879228300185, 'bear_atr_min_pct': 0.01530052291323117, 'bear_atr_max_pct': 0.07168599614726517, 'bear_tp_mult': 1.783898801057935, 'bear_tsl_mult': 0.19294679389451025, 'bear_time_stop': 222, 'bear_use_sma': True, 'bear_use_ema': True, 'bear_use_atr': True, 'bear_use_adx': True, 'bear_use_spike': False, 'bear_rsi_required': True, 'sideways_strategy': 'breakout', 'sideways_bb_std_mult': 1.0692075373517536, 'sideways_rsi_os': 39, 'sideways_rsi_ob': 59, 'sideways_adx_thresh': 16.065859628654184, 'sideways_atr_min_pct': 0.016250981404624498, 'sideways_atr_max_pct': 0.033434602482621194, 'sideways_tp_mult': 2.640963822409235, 'sideways_tsl_mult': 0.24918620820439372, 'sideways_time_stop': 172, 'sideways_use_sma': True, 'sideways_use_ema': False, 'sideways_use_atr': True, 'sideways_use_adx': True, 'sideways_use_spike': False, 'sideways_rsi_required': True}.
[I 2025-09-01 14:00:17,198] Trial 379 finished with values: [-1000000000.0, 1000000000.0] and parameters: {'p_sma': 34, 'p_std': 48, 'p_atr': 9, 'p_adx': 16, 'rsi_period': 56, 'ema1': 25, 'ema2': 49, 'slip_atr_k': 0.011345958710126417, 'slip_spread_k': 0.024466700028956803, 'spread_hl_frac': 0.0300841619490938, 'bb_std_mult': 1.0999790423148141, 'rsi_os': 43, 'rsi_ob': 52, 'vol_spike': 0.25695517031583776, 'adx_thresh': 22.783518373178836, 'atr_min_pct': 0.02881703150775937, 'atr_max_pct': 0.13643426364887226, 'tp_mult': 1.1956784163668648, 'tsl_mult': 0.7455414446998608, 'strategy': 'mean_reversion', 'time_stop': 37, 'use_sma': True, 'use_atr': False, 'use_adx': False, 'use_ema': True, 'use_spike': True, 'rsi_required': False, 'edge_k': 0.9124924215998899, 'edge_cap': 0.6574045011964019, 'bull_strategy': 'breakout', 'bull_bb_std_mult': 2.3250160907220625, 'bull_rsi_os': 36, 'bull_rsi_ob': 59, 'bull_adx_thresh': 28.04313352004754, 'bull_atr_min_pct': 0.02538550396548893, 'bull_atr_max_pct': 0.03569725371428146, 'bull_tp_mult': 1.206284999790681, 'bull_tsl_mult': 0.03621363168414082, 'bull_time_stop': 106, 'bull_use_sma': False, 'bull_use_ema': True, 'bull_use_atr': False, 'bull_use_adx': True, 'bull_use_spike': False, 'bull_rsi_required': True, 'bear_strategy': 'breakout', 'bear_bb_std_mult': 3.2950103297081172, 'bear_rsi_os': 35, 'bear_rsi_ob': 94, 'bear_adx_thresh': 32.84887285240223, 'bear_atr_min_pct': 0.016636117649087522, 'bear_atr_max_pct': 0.05808026010594313, 'bear_tp_mult': 2.324754504508963, 'bear_tsl_mult': 0.26984483284845423, 'bear_time_stop': 117, 'bear_use_sma': True, 'bear_use_ema': True, 'bear_use_atr': False, 'bear_use_adx': True, 'bear_use_spike': False, 'bear_rsi_required': True, 'sideways_strategy': 'breakout', 'sideways_bb_std_mult': 1.66464934370856, 'sideways_rsi_os': 6, 'sideways_rsi_ob': 67, 'sideways_adx_thresh': 17.175739876732614, 'sideways_atr_min_pct': 0.020476678010802996, 'sideways_atr_max_pct': 0.10307389057942047, 'sideways_tp_mult': 2.7599790722532984, 'sideways_tsl_mult': 0.29375737063376073, 'sideways_time_stop': 172, 'sideways_use_sma': True, 'sideways_use_ema': False, 'sideways_use_atr': True, 'sideways_use_adx': True, 'sideways_use_spike': False, 'sideways_rsi_required': True}.
[I 2025-09-01 14:00:17,985] Trial 384 finished with values: [-1000000000.0, 1000000000.0] and parameters: {'p_sma': 38, 'p_std': 50, 'p_atr': 25, 'p_adx': 11, 'rsi_period': 56, 'ema1': 21, 'ema2': 16, 'slip_atr_k': 0.07025313424485861, 'slip_spread_k': 0.023022666167563738, 'spread_hl_frac': 0.009653113602483148, 'bb_std_mult': 0.5392379499320048, 'rsi_os': 52, 'rsi_ob': 85, 'vol_spike': 0.24165295734433165, 'adx_thresh': 25.389606618100682, 'atr_min_pct': 0.02534854753643711, 'atr_max_pct': 0.14236102370331458, 'tp_mult': 1.041974390270797, 'tsl_mult': 0.7291395126336015, 'strategy': 'mean_reversion', 'time_stop': 40, 'use_sma': True, 'use_atr': False, 'use_adx': True, 'use_ema': True, 'use_spike': True, 'rsi_required': False, 'edge_k': 0.9076208194016518, 'edge_cap': 0.27583729057112827, 'bull_strategy': 'breakout', 'bull_bb_std_mult': 2.5314236926957476, 'bull_rsi_os': 35, 'bull_rsi_ob': 51, 'bull_adx_thresh': 13.346477290937035, 'bull_atr_min_pct': 0.025555711900372285, 'bull_atr_max_pct': 0.14262698520824885, 'bull_tp_mult': 1.1113713030099128, 'bull_tsl_mult': 0.4282493498211191, 'bull_time_stop': 81, 'bull_use_sma': True, 'bull_use_ema': True, 'bull_use_atr': True, 'bull_use_adx': False, 'bull_use_spike': True, 'bull_rsi_required': True, 'bear_strategy': 'breakout', 'bear_bb_std_mult': 3.596716972692283, 'bear_rsi_os': 38, 'bear_rsi_ob': 88, 'bear_adx_thresh': 16.411610062443224, 'bear_atr_min_pct': 0.003486697147642084, 'bear_atr_max_pct': 0.04374544141538693, 'bear_tp_mult': 2.2235828838041924, 'bear_tsl_mult': 0.6116901843062261, 'bear_time_stop': 223, 'bear_use_sma': True, 'bear_use_ema': True, 'bear_use_atr': True, 'bear_use_adx': True, 'bear_use_spike': False, 'bear_rsi_required': True, 'sideways_strategy': 'breakout', 'sideways_bb_std_mult': 2.989128958155113, 'sideways_rsi_os': 47, 'sideways_rsi_ob': 63, 'sideways_adx_thresh': 6.947576609105017, 'sideways_atr_min_pct': 0.01779287711321062, 'sideways_atr_max_pct': 0.0690958500636804, 'sideways_tp_mult': 2.672077438099412, 'sideways_tsl_mult': 0.25316313656723444, 'sideways_time_stop': 167, 'sideways_use_sma': True, 'sideways_use_ema': False, 'sideways_use_atr': True, 'sideways_use_adx': True, 'sideways_use_spike': False, 'sideways_rsi_required': True}.
[I 2025-09-01 14:00:53,729] Trial 385 finished with values: [-1000000000.0, 1000000000.0] and parameters: {'p_sma': 30, 'p_std': 50, 'p_atr': 16, 'p_adx': 11, 'rsi_period': 7, 'ema1': 21, 'ema2': 20, 'slip_atr_k': 0.07804939655094523, 'slip_spread_k': 0.03116218485065153, 'spread_hl_frac': 0.009567356906818952, 'bb_std_mult': 1.1076835286609668, 'rsi_os': 28, 'rsi_ob': 73, 'vol_spike': 0.16862293604110284, 'adx_thresh': 25.26346655309819, 'atr_min_pct': 0.025312722863686996, 'atr_max_pct': 0.123497628255875, 'tp_mult': 1.011844891621089, 'tsl_mult': 0.7258542815717645, 'strategy': 'mean_reversion', 'time_stop': 243, 'use_sma': True, 'use_atr': False, 'use_adx': True, 'use_ema': True, 'use_spike': True, 'rsi_required': False, 'edge_k': 1.043363553612754, 'edge_cap': 0.6651750097703704, 'bull_strategy': 'breakout', 'bull_bb_std_mult': 3.3212168876822843, 'bull_rsi_os': 35, 'bull_rsi_ob': 48, 'bull_adx_thresh': 28.545437798508114, 'bull_atr_min_pct': 0.019042461505714255, 'bull_atr_max_pct': 0.14069424159723043, 'bull_tp_mult': 2.8381469662842456, 'bull_tsl_mult': 0.4272628876394867, 'bull_time_stop': 82, 'bull_use_sma': True, 'bull_use_ema': True, 'bull_use_atr': True, 'bull_use_adx': False, 'bull_use_spike': True, 'bull_rsi_required': True, 'bear_strategy': 'breakout', 'bear_bb_std_mult': 3.5456530374515136, 'bear_rsi_os': 31, 'bear_rsi_ob': 88, 'bear_adx_thresh': 34.9204517462988, 'bear_atr_min_pct': 0.01557384540428135, 'bear_atr_max_pct': 0.044870335111685186, 'bear_tp_mult': 2.221475610646411, 'bear_tsl_mult': 0.1621389775781556, 'bear_time_stop': 152, 'bear_use_sma': True, 'bear_use_ema': True, 'bear_use_atr': True, 'bear_use_adx': True, 'bear_use_spike': False, 'bear_rsi_required': True, 'sideways_strategy': 'breakout', 'sideways_bb_std_mult': 1.8207574074293285, 'sideways_rsi_os': 55, 'sideways_rsi_ob': 63, 'sideways_adx_thresh': 6.8656054292312385, 'sideways_atr_min_pct': 0.004479066281852465, 'sideways_atr_max_pct': 0.10462747929964472, 'sideways_tp_mult': 1.608892428819071, 'sideways_tsl_mult': 0.2541468879892991, 'sideways_time_stop': 164, 'sideways_use_sma': True, 'sideways_use_ema': False, 'sideways_use_atr': True, 'sideways_use_adx': True, 'sideways_use_spike': False, 'sideways_rsi_required': True}.
[I 2025-09-01 14:00:54,368] Trial 388 finished with values: [-1000000000.0, 1000000000.0] and parameters: {'p_sma': 36, 'p_std': 32, 'p_atr': 25, 'p_adx': 12, 'rsi_period': 68, 'ema1': 20, 'ema2': 53, 'slip_atr_k': 0.026403494120082097, 'slip_spread_k': 0.21874060708406312, 'spread_hl_frac': 0.01965488614377056, 'bb_std_mult': 1.930406518789735, 'rsi_os': 39, 'rsi_ob': 73, 'vol_spike': 0.022884351056726593, 'adx_thresh': 26.559537442410814, 'atr_min_pct': 0.027652796626357595, 'atr_max_pct': 0.13211502226361246, 'tp_mult': 2.349722970814327, 'tsl_mult': 0.980814117344194, 'strategy': 'mean_reversion', 'time_stop': 220, 'use_sma': True, 'use_atr': False, 'use_adx': False, 'use_ema': False, 'use_spike': False, 'rsi_required': False, 'edge_k': 1.395474116131139, 'edge_cap': 0.5782753200210489, 'bull_strategy': 'breakout', 'bull_bb_std_mult': 3.4301653858996866, 'bull_rsi_os': 33, 'bull_rsi_ob': 55, 'bull_adx_thresh': 33.12015216632338, 'bull_atr_min_pct': 0.018868091154681514, 'bull_atr_max_pct': 0.020096796591963798, 'bull_tp_mult': 1.058763838452832, 'bull_tsl_mult': 0.45624039098234076, 'bull_time_stop': 86, 'bull_use_sma': True, 'bull_use_ema': True, 'bull_use_atr': True, 'bull_use_adx': True, 'bull_use_spike': False, 'bull_rsi_required': True, 'bear_strategy': 'breakout', 'bear_bb_std_mult': 3.4254201042546275, 'bear_rsi_os': 24, 'bear_rsi_ob': 87, 'bear_adx_thresh': 21.887554941994, 'bear_atr_min_pct': 0.0016152283199746971, 'bear_atr_max_pct': 0.06821738589107643, 'bear_tp_mult': 2.2081596978337723, 'bear_tsl_mult': 0.04954716418666827, 'bear_time_stop': 33, 'bear_use_sma': True, 'bear_use_ema': True, 'bear_use_atr': True, 'bear_use_adx': True, 'bear_use_spike': True, 'bear_rsi_required': False, 'sideways_strategy': 'breakout', 'sideways_bb_std_mult': 1.4912669550166069, 'sideways_rsi_os': 51, 'sideways_rsi_ob': 54, 'sideways_adx_thresh': 32.62767874884365, 'sideways_atr_min_pct': 0.01989519567177895, 'sideways_atr_max_pct': 0.021830074275773326, 'sideways_tp_mult': 2.8851711474856145, 'sideways_tsl_mult': 0.20252480195460845, 'sideways_time_stop': 187, 'sideways_use_sma': False, 'sideways_use_ema': False, 'sideways_use_atr': False, 'sideways_use_adx': True, 'sideways_use_spike': True, 'sideways_rsi_required': False}.
