[I 2025-09-01 13:08:12,813] Trial 39 finished with values: [-0.063966673633858, 0.06403066737719394] and parameters: {'p_sma': 38, 'p_std': 40, 'p_atr': 14, 'p_adx': 23, 'rsi_period': 52, 'ema1': 17, 'ema2': 39, 'slip_atr_k': 0.1657611035026496, 'slip_spread_k': 0.9083635288927266, 'spread_hl_frac': 0.04669612755910171, 'bb_std_mult': 0.7977202650093229, 'rsi_os': 42, 'rsi_ob': 71, 'vol_spike': 0.26999900112203945, 'adx_thresh': 5.497978447097001, 'atr_min_pct': 0.01613346293611037, 'atr_max_pct': 0.07468751279196346, 'tp_mult': 2.247411746524166, 'tsl_mult': 0.9266272265611357, 'strategy': 'breakout', 'time_stop': 263, 'use_sma': True, 'use_atr': True, 'use_adx': False, 'use_ema': False, 'use_spike': True, 'rsi_required': False, 'edge_k': 0.9305815078463279, 'edge_cap': 0.6212512632066495, 'bull_strategy': 'breakout', 'bull_bb_std_mult': 3.0338874361273898, 'bull_rsi_os': 30, 'bull_rsi_ob': 45, 'bull_adx_thresh': 19.741100056184212, 'bull_atr_min_pct': 0.007761749393473014, 'bull_atr_max_pct': 0.04775655986473526, 'bull_tp_mult': 2.6040252241374766, 'bull_tsl_mult': 0.34827886127549346, 'bull_time_stop': 42, 'bull_use_sma': False, 'bull_use_ema': True, 'bull_use_atr': False, 'bull_use_adx': True, 'bull_use_spike': True, 'bull_rsi_required': True, 'bear_strategy': 'mean_reversion', 'bear_bb_std_mult': 2.219955353744875, 'bear_rsi_os': 11, 'bear_rsi_ob': 50, 'bear_adx_thresh': 15.331110418762599, 'bear_atr_min_pct': 0.0028778831890691027, 'bear_atr_max_pct': 0.11954641744952403, 'bear_tp_mult': 2.1011955658642862, 'bear_tsl_mult': 0.7383307517863266, 'bear_time_stop': 242, 'bear_use_sma': True, 'bear_use_ema': False, 'bear_use_atr': False, 'bear_use_adx': False, 'bear_use_spike': True, 'bear_rsi_required': True, 'sideways_strategy': 'breakout', 'sideways_bb_std_mult': 2.9601643364903225, 'sideways_rsi_os': 37, 'sideways_rsi_ob': 76, 'sideways_adx_thresh': 28.318570330242743, 'sideways_atr_min_pct': 0.017437136211820383, 'sideways_atr_max_pct': 0.13085234210673122, 'sideways_tp_mult': 1.4710787583535634, 'sideways_tsl_mult': 0.8132072725903395, 'sideways_time_stop': 155, 'sideways_use_sma': True, 'sideways_use_ema': False, 'sideways_use_atr': True, 'sideways_use_adx': False, 'sideways_use_spike': True, 'sideways_rsi_required': False}.
[I 2025-09-01 13:08:13,003] Trial 36 finished with values: [-1000000000.0, 1000000000.0] and parameters: {'p_sma': 38, 'p_std': 40, 'p_atr': 21, 'p_adx': 28, 'rsi_period': 76, 'ema1': 13, 'ema2': 40, 'slip_atr_k': 0.17060136277940513, 'slip_spread_k': 0.9321574530086055, 'spread_hl_frac': 0.04778114085232473, 'bb_std_mult': 1.247554473024028, 'rsi_os': 28, 'rsi_ob': 79, 'vol_spike': 0.27235370037934786, 'adx_thresh': 28.995869257251538, 'atr_min_pct': 0.0005547593509658017, 'atr_max_pct': 0.1404198265027644, 'tp_mult': 2.2290059810168246, 'tsl_mult': 0.6315325807913746, 'strategy': 'breakout', 'time_stop': 268, 'use_sma': True, 'use_atr': True, 'use_adx': False, 'use_ema': False, 'use_spike': True, 'rsi_required': False, 'edge_k': 0.8976551982779566, 'edge_cap': 0.6023312390654855, 'bull_strategy': 'breakout', 'bull_bb_std_mult': 2.476636793373171, 'bull_rsi_os': 25, 'bull_rsi_ob': 50, 'bull_adx_thresh': 15.327751221423277, 'bull_atr_min_pct': 0.012608589207280339, 'bull_atr_max_pct': 0.07228301362651292, 'bull_tp_mult': 2.8106211971133184, 'bull_tsl_mult': 0.31108333572198815, 'bull_time_stop': 84, 'bull_use_sma': False, 'bull_use_ema': True, 'bull_use_atr': True, 'bull_use_adx': True, 'bull_use_spike': True, 'bull_rsi_required': True, 'bear_strategy': 'breakout', 'bear_bb_std_mult': 2.2417600279953107, 'bear_rsi_os': 20, 'bear_rsi_ob': 88, 'bear_adx_thresh': 16.673749034544652, 'bear_atr_min_pct': 0.0028956270118017102, 'bear_atr_max_pct': 0.12051838100649202, 'bear_tp_mult': 2.1055916504495165, 'bear_tsl_mult': 0.6648299832837007, 'bear_time_stop': 245, 'bear_use_sma': True, 'bear_use_ema': False, 'bear_use_atr': True, 'bear_use_adx': False, 'bear_use_spike': True, 'bear_rsi_required': True, 'sideways_strategy': 'breakout', 'sideways_bb_std_mult': 2.9691197856026745, 'sideways_rsi_os': 37, 'sideways_rsi_ob': 76, 'sideways_adx_thresh': 28.837218672970202, 'sideways_atr_min_pct': 0.017543318050513734, 'sideways_atr_max_pct': 0.051552574252691885, 'sideways_tp_mult': 1.4249132340997708, 'sideways_tsl_mult': 0.8318519953190999, 'sideways_time_stop': 182, 'sideways_use_sma': True, 'sideways_use_ema': True, 'sideways_use_atr': False, 'sideways_use_adx': True, 'sideways_use_spike': True, 'sideways_rsi_required': False}.
[I 2025-09-01 13:08:13,016] Trial 37 finished with values: [-1000000000.0, 1000000000.0] and parameters: {'p_sma': 39, 'p_std': 42, 'p_atr': 21, 'p_adx': 30, 'rsi_period': 77, 'ema1': 13, 'ema2': 40, 'slip_atr_k': 0.16246478595483882, 'slip_spread_k': 0.9210319296751954, 'spread_hl_frac': 0.04758977300990827, 'bb_std_mult': 1.1923557337971942, 'rsi_os': 28, 'rsi_ob': 72, 'vol_spike': 0.14518567787767317, 'adx_thresh': 28.61022373081273, 'atr_min_pct': 0.0002069340462259768, 'atr_max_pct': 0.07244323894809679, 'tp_mult': 2.233671136679096, 'tsl_mult': 0.6053415130620329, 'strategy': 'breakout', 'time_stop': 269, 'use_sma': True, 'use_atr': True, 'use_adx': False, 'use_ema': False, 'use_spike': True, 'rsi_required': False, 'edge_k': 0.8992827086496571, 'edge_cap': 0.1452397928754321, 'bull_strategy': 'breakout', 'bull_bb_std_mult': 2.5496998859765996, 'bull_rsi_os': 29, 'bull_rsi_ob': 47, 'bull_adx_thresh': 19.375942103858655, 'bull_atr_min_pct': 0.009049382921639496, 'bull_atr_max_pct': 0.07351787624790408, 'bull_tp_mult': 2.7881327512342313, 'bull_tsl_mult': 0.10996597427832079, 'bull_time_stop': 85, 'bull_use_sma': False, 'bull_use_ema': True, 'bull_use_atr': True, 'bull_use_adx': True, 'bull_use_spike': True, 'bull_rsi_required': True, 'bear_strategy': 'breakout', 'bear_bb_std_mult': 1.6868154290928778, 'bear_rsi_os': 21, 'bear_rsi_ob': 88, 'bear_adx_thresh': 16.01591986018527, 'bear_atr_min_pct': 0.002996004270654702, 'bear_atr_max_pct': 0.11585591928464233, 'bear_tp_mult': 2.1034769167921614, 'bear_tsl_mult': 0.6429805240749973, 'bear_time_stop': 245, 'bear_use_sma': True, 'bear_use_ema': False, 'bear_use_atr': True, 'bear_use_adx': False, 'bear_use_spike': True, 'bear_rsi_required': True, 'sideways_strategy': 'breakout', 'sideways_bb_std_mult': 3.588834183879719, 'sideways_rsi_os': 51, 'sideways_rsi_ob': 82, 'sideways_adx_thresh': 28.82740847200975, 'sideways_atr_min_pct': 0.0168691577520931, 'sideways_atr_max_pct': 0.055537493007820626, 'sideways_tp_mult': 1.4404354295106216, 'sideways_tsl_mult': 0.19766613103084507, 'sideways_time_stop': 158, 'sideways_use_sma': True, 'sideways_use_ema': True, 'sideways_use_atr': False, 'sideways_use_adx': True, 'sideways_use_spike': True, 'sideways_rsi_required': False}.
[I 2025-09-01 13:08:13,195] Trial 38 finished with values: [-0.06641037287864093, 0.06601791019989599] and parameters: {'p_sma': 38, 'p_std': 41, 'p_atr': 14, 'p_adx': 23, 'rsi_period': 73, 'ema1': 17, 'ema2': 40, 'slip_atr_k': 0.16609861371411314, 'slip_spread_k': 0.9363531656335449, 'spread_hl_frac': 0.047333863537912316, 'bb_std_mult': 1.255436120539286, 'rsi_os': 28, 'rsi_ob': 82, 'vol_spike': 0.2739318852092963, 'adx_thresh': 28.786969494908938, 'atr_min_pct': 0.02715629212564946, 'atr_max_pct': 0.09795315478189882, 'tp_mult': 2.3558265253251722, 'tsl_mult': 0.6532880838048265, 'strategy': 'breakout', 'time_stop': 218, 'use_sma': True, 'use_atr': True, 'use_adx': False, 'use_ema': False, 'use_spike': True, 'rsi_required': False, 'edge_k': 1.558634546946322, 'edge_cap': 0.6345557956597695, 'bull_strategy': 'breakout', 'bull_bb_std_mult': 2.379207198749094, 'bull_rsi_os': 27, 'bull_rsi_ob': 51, 'bull_adx_thresh': 8.34532329861172, 'bull_atr_min_pct': 0.013506636124378676, 'bull_atr_max_pct': 0.0712500415992475, 'bull_tp_mult': 1.9833353730540564, 'bull_tsl_mult': 0.2909818746059842, 'bull_time_stop': 34, 'bull_use_sma': False, 'bull_use_ema': True, 'bull_use_atr': False, 'bull_use_adx': True, 'bull_use_spike': True, 'bull_rsi_required': True, 'bear_strategy': 'mean_reversion', 'bear_bb_std_mult': 1.6904109640240983, 'bear_rsi_os': 31, 'bear_rsi_ob': 50, 'bear_adx_thresh': 15.84883212454649, 'bear_atr_min_pct': 0.0022639572516252437, 'bear_atr_max_pct': 0.11829838475887636, 'bear_tp_mult': 1.5903867380207308, 'bear_tsl_mult': 0.6382769187895824, 'bear_time_stop': 243, 'bear_use_sma': True, 'bear_use_ema': False, 'bear_use_atr': True, 'bear_use_adx': False, 'bear_use_spike': True, 'bear_rsi_required': True, 'sideways_strategy': 'breakout', 'sideways_bb_std_mult': 3.5619145311949962, 'sideways_rsi_os': 38, 'sideways_rsi_ob': 83, 'sideways_adx_thresh': 28.680564080895493, 'sideways_atr_min_pct': 0.01657578798358702, 'sideways_atr_max_pct': 0.058465994424141896, 'sideways_tp_mult': 1.4497747646776307, 'sideways_tsl_mult': 0.8251135214778054, 'sideways_time_stop': 181, 'sideways_use_sma': True, 'sideways_use_ema': True, 'sideways_use_atr': False, 'sideways_use_adx': False, 'sideways_use_spike': True, 'sideways_rsi_required': False}.
[I 2025-09-01 13:08:13,516] Trial 42 finished with values: [-1000000000.0, 1000000000.0] and parameters: {'p_sma': 25, 'p_std': 49, 'p_atr': 11, 'p_adx': 19, 'rsi_period': 64, 'ema1': 22, 'ema2': 50, 'slip_atr_k': 0.13796033721479675, 'slip_spread_k': 0.3964968344061343, 'spread_hl_frac': 0.004260116129117527, 'bb_std_mult': 1.8744593235770108, 'rsi_os': 47, 'rsi_ob': 45, 'vol_spike': 0.11057524038515525, 'adx_thresh': 10.008409213690827, 'atr_min_pct': 0.004782020737832321, 'atr_max_pct': 0.0666110441421966, 'tp_mult': 2.4911741907226697, 'tsl_mult': 0.46700884571734763, 'strategy': 'mean_reversion', 'time_stop': 151, 'use_sma': True, 'use_atr': True, 'use_adx': False, 'use_ema': False, 'use_spike': False, 'rsi_required': True, 'edge_k': 0.12938479845218664, 'edge_cap': 0.7693893126152966, 'bull_strategy': 'breakout', 'bull_bb_std_mult': 3.229991785572741, 'bull_rsi_os': 47, 'bull_rsi_ob': 70, 'bull_adx_thresh': 12.808041689503685, 'bull_atr_min_pct': 0.0016332757128009086, 'bull_atr_max_pct': 0.13930164056146013, 'bull_tp_mult': 2.2670547344296956, 'bull_tsl_mult': 0.4356918999843392, 'bull_time_stop': 171, 'bull_use_sma': True, 'bull_use_ema': False, 'bull_use_atr': False, 'bull_use_adx': True, 'bull_use_spike': False, 'bull_rsi_required': True, 'bear_strategy': 'mean_reversion', 'bear_bb_std_mult': 0.8398349100597097, 'bear_rsi_os': 9, 'bear_rsi_ob': 62, 'bear_adx_thresh': 21.3248054998886, 'bear_atr_min_pct': 0.012313699557313637, 'bear_atr_max_pct': 0.04715478839854333, 'bear_tp_mult': 2.485452779008049, 'bear_tsl_mult': 0.25154158638586754, 'bear_time_stop': 168, 'bear_use_sma': True, 'bear_use_ema': True, 'bear_use_atr': False, 'bear_use_adx': True, 'bear_use_spike': False, 'bear_rsi_required': False, 'sideways_strategy': 'mean_reversion', 'sideways_bb_std_mult': 1.636929784631119, 'sideways_rsi_os': 45, 'sideways_rsi_ob': 69, 'sideways_adx_thresh': 17.630463415488016, 'sideways_atr_min_pct': 0.009110045903183265, 'sideways_atr_max_pct': 0.028370719235269647, 'sideways_tp_mult': 1.115345196756548, 'sideways_tsl_mult': 0.938926048774136, 'sideways_time_stop': 47, 'sideways_use_sma': False, 'sideways_use_ema': False, 'sideways_use_atr': True, 'sideways_use_adx': False, 'sideways_use_spike': True, 'sideways_rsi_required': True}.
[I 2025-09-01 13:08:50,158] Trial 43 finished with values: [-0.02818090915970206, 0.027941285943412067] and parameters: {'p_sma': 24, 'p_std': 50, 'p_atr': 27, 'p_adx': 19, 'rsi_period': 64, 'ema1': 22, 'ema2': 50, 'slip_atr_k': 0.1287343525677059, 'slip_spread_k': 0.6371482466712299, 'spread_hl_frac': 0.0364068677858999, 'bb_std_mult': 2.0531502093697367, 'rsi_os': 47, 'rsi_ob': 93, 'vol_spike': 0.09314960100653376, 'adx_thresh': 9.577206253859643, 'atr_min_pct': 0.028427482555989838, 'atr_max_pct': 0.06651880129514894, 'tp_mult': 2.4861906845087005, 'tsl_mult': 0.8124549143426666, 'strategy': 'mean_reversion', 'time_stop': 156, 'use_sma': True, 'use_atr': True, 'use_adx': False, 'use_ema': False, 'use_spike': False, 'rsi_required': True, 'edge_k': 0.15302966451473232, 'edge_cap': 0.7697950441362855, 'bull_strategy': 'breakout', 'bull_bb_std_mult': 3.2974430697785175, 'bull_rsi_os': 47, 'bull_rsi_ob': 62, 'bull_adx_thresh': 15.944544914676797, 'bull_atr_min_pct': 0.00163815636162016, 'bull_atr_max_pct': 0.12748488456088802, 'bull_tp_mult': 2.2763728195931168, 'bull_tsl_mult': 0.21649543736052948, 'bull_time_stop': 107, 'bull_use_sma': True, 'bull_use_ema': False, 'bull_use_atr': False, 'bull_use_adx': True, 'bull_use_spike': False, 'bull_rsi_required': True, 'bear_strategy': 'mean_reversion', 'bear_bb_std_mult': 0.9223021054773459, 'bear_rsi_os': 15, 'bear_rsi_ob': 61, 'bear_adx_thresh': 21.376561852900373, 'bear_atr_min_pct': 0.011937231828457781, 'bear_atr_max_pct': 0.10577065133471172, 'bear_tp_mult': 2.4831024260100807, 'bear_tsl_mult': 0.11927097758336613, 'bear_time_stop': 167, 'bear_use_sma': True, 'bear_use_ema': True, 'bear_use_atr': False, 'bear_use_adx': True, 'bear_use_spike': False, 'bear_rsi_required': False, 'sideways_strategy': 'mean_reversion', 'sideways_bb_std_mult': 1.6464210221651743, 'sideways_rsi_os': 44, 'sideways_rsi_ob': 69, 'sideways_adx_thresh': 17.24053548298497, 'sideways_atr_min_pct': 0.002897300198222279, 'sideways_atr_max_pct': 0.10027628129763887, 'sideways_tp_mult': 1.1308234582594527, 'sideways_tsl_mult': 0.9308704821560072, 'sideways_time_stop': 37, 'sideways_use_sma': False, 'sideways_use_ema': False, 'sideways_use_atr': True, 'sideways_use_adx': False, 'sideways_use_spike': True, 'sideways_rsi_required': True}.
[I 2025-09-01 13:08:50,165] Trial 40 finished with values: [-1000000000.0, 1000000000.0] and parameters: {'p_sma': 5, 'p_std': 48, 'p_atr': 27, 'p_adx': 19, 'rsi_period': 66, 'ema1': 22, 'ema2': 50, 'slip_atr_k': 0.12894693554972314, 'slip_spread_k': 0.6418843084848302, 'spread_hl_frac': 0.0036913714216229507, 'bb_std_mult': 2.2001700894895952, 'rsi_os': 48, 'rsi_ob': 94, 'vol_spike': 0.09837004720909354, 'adx_thresh': 13.996814628671359, 'atr_min_pct': 0.02828983422773583, 'atr_max_pct': 0.06424297100607429, 'tp_mult': 2.471790584318386, 'tsl_mult': 0.8949056489783946, 'strategy': 'mean_reversion', 'time_stop': 73, 'use_sma': True, 'use_atr': True, 'use_adx': False, 'use_ema': False, 'use_spike': False, 'rsi_required': True, 'edge_k': 1.0923413069367893, 'edge_cap': 0.7759290659007612, 'bull_strategy': 'breakout', 'bull_bb_std_mult': 3.256733545892565, 'bull_rsi_os': 48, 'bull_rsi_ob': 70, 'bull_adx_thresh': 21.33243673782011, 'bull_atr_min_pct': 0.0012139750219901688, 'bull_atr_max_pct': 0.13541317451660045, 'bull_tp_mult': 2.2590282521887266, 'bull_tsl_mult': 0.5833494195680184, 'bull_time_stop': 107, 'bull_use_sma': True, 'bull_use_ema': False, 'bull_use_atr': False, 'bull_use_adx': True, 'bull_use_spike': False, 'bull_rsi_required': True, 'bear_strategy': 'mean_reversion', 'bear_bb_std_mult': 0.9197335376666171, 'bear_rsi_os': 15, 'bear_rsi_ob': 62, 'bear_adx_thresh': 21.346769057307306, 'bear_atr_min_pct': 0.0067190540243768915, 'bear_atr_max_pct': 0.1022138260556643, 'bear_tp_mult': 2.4519773759072647, 'bear_tsl_mult': 0.5786510764736925, 'bear_time_stop': 166, 'bear_use_sma': True, 'bear_use_ema': True, 'bear_use_atr': False, 'bear_use_adx': True, 'bear_use_spike': False, 'bear_rsi_required': False, 'sideways_strategy': 'mean_reversion', 'sideways_bb_std_mult': 2.676893152621231, 'sideways_rsi_os': 44, 'sideways_rsi_ob': 91, 'sideways_adx_thresh': 19.215708385259976, 'sideways_atr_min_pct': 0.009090440236025264, 'sideways_atr_max_pct': 0.10041241625705301, 'sideways_tp_mult': 1.134202598855548, 'sideways_tsl_mult': 0.933164849548211, 'sideways_time_stop': 61, 'sideways_use_sma': False, 'sideways_use_ema': False, 'sideways_use_atr': True, 'sideways_use_adx': False, 'sideways_use_spike': True, 'sideways_rsi_required': True}.
[I 2025-09-01 13:08:50,346] Trial 44 finished with values: [-0.050724736904370515, 0.050473495993214275] and parameters: {'p_sma': 33, 'p_std': 37, 'p_atr': 17, 'p_adx': 25, 'rsi_period': 69, 'ema1': 15, 'ema2': 44, 'slip_atr_k': 0.19303597537547504, 'slip_spread_k': 0.9936482986731942, 'spread_hl_frac': 0.042448086592734316, 'bb_std_mult': 2.190485075345706, 'rsi_os': 33, 'rsi_ob': 75, 'vol_spike': 0.18875023355412812, 'adx_thresh': 26.09502191735075, 'atr_min_pct': 0.020972861719654345, 'atr_max_pct': 0.08939420320554667, 'tp_mult': 2.1110877180746423, 'tsl_mult': 0.3013566213334703, 'strategy': 'mean_reversion', 'time_stop': 76, 'use_sma': True, 'use_atr': True, 'use_adx': False, 'use_ema': False, 'use_spike': True, 'rsi_required': False, 'edge_k': 1.1059901503764666, 'edge_cap': 0.8442395553649104, 'bull_strategy': 'breakout', 'bull_bb_std_mult': 2.2462069802041116, 'bull_rsi_os': 20, 'bull_rsi_ob': 61, 'bull_adx_thresh': 15.940258094807826, 'bull_atr_min_pct': 9.91196656338917e-05, 'bull_atr_max_pct': 0.1297253039044498, 'bull_tp_mult': 2.495653903424991, 'bull_tsl_mult': 0.5808261260242584, 'bull_time_stop': 109, 'bull_use_sma': False, 'bull_use_ema': False, 'bull_use_atr': True, 'bull_use_adx': True, 'bull_use_spike': False, 'bull_rsi_required': True, 'bear_strategy': 'mean_reversion', 'bear_bb_std_mult': 1.5163369931611415, 'bear_rsi_os': 24, 'bear_rsi_ob': 68, 'bear_adx_thresh': 31.068394283113072, 'bear_atr_min_pct': 0.01048987877628164, 'bear_atr_max_pct': 0.10183052199206272, 'bear_tp_mult': 1.8523336702474464, 'bear_tsl_mult': 0.9389223383769211, 'bear_time_stop': 278, 'bear_use_sma': True, 'bear_use_ema': False, 'bear_use_atr': False, 'bear_use_adx': True, 'bear_use_spike': False, 'bear_rsi_required': True, 'sideways_strategy': 'mean_reversion', 'sideways_bb_std_mult': 2.5100458676188717, 'sideways_rsi_os': 42, 'sideways_rsi_ob': 90, 'sideways_adx_thresh': 10.945268877288228, 'sideways_atr_min_pct': 0.012874983911016852, 'sideways_atr_max_pct': 0.10208716765697817, 'sideways_tp_mult': 1.0119747643919388, 'sideways_tsl_mult': 0.9219812759166817, 'sideways_time_stop': 230, 'sideways_use_sma': True, 'sideways_use_ema': False, 'sideways_use_atr': False, 'sideways_use_adx': False, 'sideways_use_spike': True, 'sideways_rsi_required': True}.
[I 2025-09-01 13:08:50,575] Trial 41 finished with values: [-1000000000.0, 1000000000.0] and parameters: {'p_sma': 59, 'p_std': 49, 'p_atr': 27, 'p_adx': 19, 'rsi_period': 65, 'ema1': 15, 'ema2': 49, 'slip_atr_k': 0.12998210772639116, 'slip_spread_k': 0.9959972201351961, 'spread_hl_frac': 0.03669750665441514, 'bb_std_mult': 2.9334982205358036, 'rsi_os': 49, 'rsi_ob': 94, 'vol_spike': 0.09409844257844338, 'adx_thresh': 10.259954741189498, 'atr_min_pct': 0.005611545778763497, 'atr_max_pct': 0.06634125940830445, 'tp_mult': 2.4888536092791655, 'tsl_mult': 0.2982792011357026, 'strategy': 'mean_reversion', 'time_stop': 153, 'use_sma': True, 'use_atr': True, 'use_adx': False, 'use_ema': False, 'use_spike': False, 'rsi_required': True, 'edge_k': 1.113705694948992, 'edge_cap': 0.7725855417322592, 'bull_strategy': 'breakout', 'bull_bb_std_mult': 3.235902533499649, 'bull_rsi_os': 32, 'bull_rsi_ob': 62, 'bull_adx_thresh': 30.751701041924417, 'bull_atr_min_pct': 0.007726314328813595, 'bull_atr_max_pct': 0.12753339818868245, 'bull_tp_mult': 2.3002131103004433, 'bull_tsl_mult': 0.2222836042065799, 'bull_time_stop': 116, 'bull_use_sma': True, 'bull_use_ema': False, 'bull_use_atr': False, 'bull_use_adx': True, 'bull_use_spike': False, 'bull_rsi_required': True, 'bear_strategy': 'mean_reversion', 'bear_bb_std_mult': 0.934137662751376, 'bear_rsi_os': 16, 'bear_rsi_ob': 61, 'bear_adx_thresh': 21.39022976490269, 'bear_atr_min_pct': 0.006951913997076529, 'bear_atr_max_pct': 0.10055285559866642, 'bear_tp_mult': 2.419640669736179, 'bear_tsl_mult': 0.24953749446033868, 'bear_time_stop': 277, 'bear_use_sma': True, 'bear_use_ema': True, 'bear_use_atr': False, 'bear_use_adx': True, 'bear_use_spike': False, 'bear_rsi_required': False, 'sideways_strategy': 'mean_reversion', 'sideways_bb_std_mult': 2.5180128546508067, 'sideways_rsi_os': 44, 'sideways_rsi_ob': 91, 'sideways_adx_thresh': 18.991054525698985, 'sideways_atr_min_pct': 0.009217341081947121, 'sideways_atr_max_pct': 0.09673529612212675, 'sideways_tp_mult': 1.569765632086293, 'sideways_tsl_mult': 0.9166072462362851, 'sideways_time_stop': 26, 'sideways_use_sma': False, 'sideways_use_ema': False, 'sideways_use_atr': True, 'sideways_use_adx': False, 'sideways_use_spike': True, 'sideways_rsi_required': True}.
