[I 2025-09-01 14:00:55,147] Trial 387 finished with values: [-1000000000.0, 1000000000.0] and parameters: {'p_sma': 36, 'p_std': 47, 'p_atr': 25, 'p_adx': 27, 'rsi_period': 68, 'ema1': 19, 'ema2': 54, 'slip_atr_k': 0.026825663820192677, 'slip_spread_k': 0.05111407411744226, 'spread_hl_frac': 0.009217684248411498, 'bb_std_mult': 1.5481125317614322, 'rsi_os': 18, 'rsi_ob': 85, 'vol_spike': 0.24153360263679513, 'adx_thresh': 26.522324244759616, 'atr_min_pct': 0.02537265617085786, 'atr_max_pct': 0.13900230117161846, 'tp_mult': 1.8403274866008186, 'tsl_mult': 0.7826902425738502, 'strategy': 'mean_reversion', 'time_stop': 212, 'use_sma': True, 'use_atr': False, 'use_adx': False, 'use_ema': False, 'use_spike': True, 'rsi_required': False, 'edge_k': 1.384846850674732, 'edge_cap': 0.26909285598838323, 'bull_strategy': 'breakout', 'bull_bb_std_mult': 0.5163297551733086, 'bull_rsi_os': 35, 'bull_rsi_ob': 72, 'bull_adx_thresh': 25.86852757623586, 'bull_atr_min_pct': 0.029104129608883506, 'bull_atr_max_pct': 0.02212219785136122, 'bull_tp_mult': 1.60827293060616, 'bull_tsl_mult': 0.4235776420644745, 'bull_time_stop': 263, 'bull_use_sma': True, 'bull_use_ema': True, 'bull_use_atr': True, 'bull_use_adx': False, 'bull_use_spike': True, 'bull_rsi_required': True, 'bear_strategy': 'breakout', 'bear_bb_std_mult': 3.5481179757456958, 'bear_rsi_os': 24, 'bear_rsi_ob': 87, 'bear_adx_thresh': 19.009650487463347, 'bear_atr_min_pct': 0.0015431333736642204, 'bear_atr_max_pct': 0.0441561809478668, 'bear_tp_mult': 1.390528511414147, 'bear_tsl_mult': 0.10882412081713028, 'bear_time_stop': 151, 'bear_use_sma': True, 'bear_use_ema': True, 'bear_use_atr': True, 'bear_use_adx': True, 'bear_use_spike': True, 'bear_rsi_required': True, 'sideways_strategy': 'breakout', 'sideways_bb_std_mult': 1.3323782113277276, 'sideways_rsi_os': 52, 'sideways_rsi_ob': 80, 'sideways_adx_thresh': 18.752286578733738, 'sideways_atr_min_pct': 0.019041834045159696, 'sideways_atr_max_pct': 0.07425461048566206, 'sideways_tp_mult': 1.2634496452939175, 'sideways_tsl_mult': 0.24870644431623282, 'sideways_time_stop': 164, 'sideways_use_sma': True, 'sideways_use_ema': False, 'sideways_use_atr': False, 'sideways_use_adx': True, 'sideways_use_spike': True, 'sideways_rsi_required': False}.
[I 2025-09-01 14:00:55,147] Trial 386 finished with values: [-0.03615424746745266, 0.03637194515548089] and parameters: {'p_sma': 36, 'p_std': 32, 'p_atr': 25, 'p_adx': 7, 'rsi_period': 68, 'ema1': 21, 'ema2': 54, 'slip_atr_k': 0.06912681486049599, 'slip_spread_k': 0.21087391619519436, 'spread_hl_frac': 0.009855397941022618, 'bb_std_mult': 2.1853626268032, 'rsi_os': 39, 'rsi_ob': 85, 'vol_spike': 0.018936545905734875, 'adx_thresh': 25.4752822182539, 'atr_min_pct': 0.025217334616220305, 'atr_max_pct': 0.14991786524858247, 'tp_mult': 1.8595393316425208, 'tsl_mult': 0.7074063454032444, 'strategy': 'mean_reversion', 'time_stop': 211, 'use_sma': True, 'use_atr': False, 'use_adx': False, 'use_ema': False, 'use_spike': True, 'rsi_required': False, 'edge_k': 0.7842683392347849, 'edge_cap': 0.7227772635203634, 'bull_strategy': 'breakout', 'bull_bb_std_mult': 1.3462857572199671, 'bull_rsi_os': 35, 'bull_rsi_ob': 57, 'bull_adx_thresh': 28.521932458323196, 'bull_atr_min_pct': 0.01452893184634071, 'bull_atr_max_pct': 0.021084254342224426, 'bull_tp_mult': 1.0407239692396923, 'bull_tsl_mult': 0.4195777381657684, 'bull_time_stop': 81, 'bull_use_sma': True, 'bull_use_ema': True, 'bull_use_atr': True, 'bull_use_adx': False, 'bull_use_spike': True, 'bull_rsi_required': True, 'bear_strategy': 'breakout', 'bear_bb_std_mult': 3.5253098768094335, 'bear_rsi_os': 32, 'bear_rsi_ob': 87, 'bear_adx_thresh': 7.270421438573676, 'bear_atr_min_pct': 0.027847951699351482, 'bear_atr_max_pct': 0.043533030773194994, 'bear_tp_mult': 2.213431849493722, 'bear_tsl_mult': 0.09893731680665495, 'bear_time_stop': 57, 'bear_use_sma': True, 'bear_use_ema': True, 'bear_use_atr': True, 'bear_use_adx': True, 'bear_use_spike': True, 'bear_rsi_required': True, 'sideways_strategy': 'breakout', 'sideways_bb_std_mult': 3.5955362398659982, 'sideways_rsi_os': 52, 'sideways_rsi_ob': 69, 'sideways_adx_thresh': 32.40719057770156, 'sideways_atr_min_pct': 0.0025624602145054663, 'sideways_atr_max_pct': 0.06877365795173251, 'sideways_tp_mult': 2.4927842222974106, 'sideways_tsl_mult': 0.20102472849394848, 'sideways_time_stop': 209, 'sideways_use_sma': True, 'sideways_use_ema': False, 'sideways_use_atr': False, 'sideways_use_adx': True, 'sideways_use_spike': True, 'sideways_rsi_required': False}.
[I 2025-09-01 14:01:32,930] Trial 390 finished with values: [-1000000000.0, 1000000000.0] and parameters: {'p_sma': 47, 'p_std': 47, 'p_atr': 25, 'p_adx': 7, 'rsi_period': 66, 'ema1': 22, 'ema2': 18, 'slip_atr_k': 0.01621198465243701, 'slip_spread_k': 0.05933598032838025, 'spread_hl_frac': 0.044376104378156714, 'bb_std_mult': 1.7064474720294955, 'rsi_os': 46, 'rsi_ob': 83, 'vol_spike': 0.14106836678243215, 'adx_thresh': 7.5634636360800425, 'atr_min_pct': 0.026041059048270986, 'atr_max_pct': 0.13918892001279978, 'tp_mult': 1.7358486639414128, 'tsl_mult': 0.7871771607868829, 'strategy': 'mean_reversion', 'time_stop': 251, 'use_sma': True, 'use_atr': False, 'use_adx': False, 'use_ema': False, 'use_spike': True, 'rsi_required': True, 'edge_k': 0.7884349406084794, 'edge_cap': 0.3308385685705381, 'bull_strategy': 'breakout', 'bull_bb_std_mult': 1.844668669405671, 'bull_rsi_os': 34, 'bull_rsi_ob': 69, 'bull_adx_thresh': 31.7381103220945, 'bull_atr_min_pct': 0.006896691658463272, 'bull_atr_max_pct': 0.021789100150186737, 'bull_tp_mult': 2.2507118270707425, 'bull_tsl_mult': 0.17002308289615942, 'bull_time_stop': 98, 'bull_use_sma': True, 'bull_use_ema': True, 'bull_use_atr': True, 'bull_use_adx': True, 'bull_use_spike': False, 'bull_rsi_required': True, 'bear_strategy': 'breakout', 'bear_bb_std_mult': 2.889188312454329, 'bear_rsi_os': 32, 'bear_rsi_ob': 90, 'bear_adx_thresh': 6.893741378365842, 'bear_atr_min_pct': 0.0275296233870682, 'bear_atr_max_pct': 0.14685001368869527, 'bear_tp_mult': 2.086230379161907, 'bear_tsl_mult': 0.012078226280382576, 'bear_time_stop': 186, 'bear_use_sma': True, 'bear_use_ema': True, 'bear_use_atr': True, 'bear_use_adx': True, 'bear_use_spike': True, 'bear_rsi_required': True, 'sideways_strategy': 'mean_reversion', 'sideways_bb_std_mult': 1.4452633386094584, 'sideways_rsi_os': 52, 'sideways_rsi_ob': 76, 'sideways_adx_thresh': 8.310970634761526, 'sideways_atr_min_pct': 0.029241681985345307, 'sideways_atr_max_pct': 0.08197846276287846, 'sideways_tp_mult': 2.7232258038987145, 'sideways_tsl_mult': 0.06459510967492976, 'sideways_time_stop': 178, 'sideways_use_sma': True, 'sideways_use_ema': False, 'sideways_use_atr': False, 'sideways_use_adx': False, 'sideways_use_spike': False, 'sideways_rsi_required': False}.
[I 2025-09-01 14:01:33,339] Trial 391 finished with values: [-1000000000.0, 1000000000.0] and parameters: {'p_sma': 47, 'p_std': 49, 'p_atr': 24, 'p_adx': 13, 'rsi_period': 84, 'ema1': 22, 'ema2': 18, 'slip_atr_k': 0.017315558718349115, 'slip_spread_k': 0.06379675425166052, 'spread_hl_frac': 0.007490460391649583, 'bb_std_mult': 1.714727209391966, 'rsi_os': 36, 'rsi_ob': 83, 'vol_spike': 0.18171873636221492, 'adx_thresh': 7.30043046189142, 'atr_min_pct': 0.010392863896757809, 'atr_max_pct': 0.08434742842492784, 'tp_mult': 1.6925132512483314, 'tsl_mult': 0.8261693377029168, 'strategy': 'mean_reversion', 'time_stop': 66, 'use_sma': False, 'use_atr': False, 'use_adx': False, 'use_ema': True, 'use_spike': False, 'rsi_required': True, 'edge_k': 1.9999168065768638, 'edge_cap': 0.3295050977232049, 'bull_strategy': 'mean_reversion', 'bull_bb_std_mult': 3.2448167122317613, 'bull_rsi_os': 26, 'bull_rsi_ob': 92, 'bull_adx_thresh': 32.2908121528744, 'bull_atr_min_pct': 0.007052669717539083, 'bull_atr_max_pct': 0.12142295416357245, 'bull_tp_mult': 2.73079400072464, 'bull_tsl_mult': 0.38886803034636347, 'bull_time_stop': 99, 'bull_use_sma': True, 'bull_use_ema': False, 'bull_use_atr': True, 'bull_use_adx': True, 'bull_use_spike': False, 'bull_rsi_required': False, 'bear_strategy': 'mean_reversion', 'bear_bb_std_mult': 3.148978643989431, 'bear_rsi_os': 20, 'bear_rsi_ob': 64, 'bear_adx_thresh': 11.149648507858581, 'bear_atr_min_pct': 0.003066071666747112, 'bear_atr_max_pct': 0.10706049789296686, 'bear_tp_mult': 2.1484930526365353, 'bear_tsl_mult': 0.12917645660033297, 'bear_time_stop': 205, 'bear_use_sma': True, 'bear_use_ema': True, 'bear_use_atr': True, 'bear_use_adx': False, 'bear_use_spike': False, 'bear_rsi_required': False, 'sideways_strategy': 'mean_reversion', 'sideways_bb_std_mult': 1.8996709269023595, 'sideways_rsi_os': 35, 'sideways_rsi_ob': 82, 'sideways_adx_thresh': 8.345431957334704, 'sideways_atr_min_pct': 0.02100858124816842, 'sideways_atr_max_pct': 0.039452082487344914, 'sideways_tp_mult': 1.7270881333466244, 'sideways_tsl_mult': 0.2991737036745743, 'sideways_time_stop': 180, 'sideways_use_sma': False, 'sideways_use_ema': True, 'sideways_use_atr': True, 'sideways_use_adx': False, 'sideways_use_spike': False, 'sideways_rsi_required': True}.
[I 2025-09-01 14:01:33,587] Trial 392 finished with values: [-1000000000.0, 1000000000.0] and parameters: {'p_sma': 47, 'p_std': 49, 'p_atr': 24, 'p_adx': 13, 'rsi_period': 80, 'ema1': 22, 'ema2': 18, 'slip_atr_k': 0.019272613711620555, 'slip_spread_k': 0.4813926313295843, 'spread_hl_frac': 0.007584781850294788, 'bb_std_mult': 2.1047089991148313, 'rsi_os': 45, 'rsi_ob': 83, 'vol_spike': 0.18427704771213238, 'adx_thresh': 24.46332087386849, 'atr_min_pct': 0.015984419256495536, 'atr_max_pct': 0.138835210399067, 'tp_mult': 1.096996848562122, 'tsl_mult': 0.5893902293619072, 'strategy': 'mean_reversion', 'time_stop': 247, 'use_sma': False, 'use_atr': False, 'use_adx': False, 'use_ema': True, 'use_spike': False, 'rsi_required': True, 'edge_k': 0.9671828814139316, 'edge_cap': 0.13694587190860924, 'bull_strategy': 'mean_reversion', 'bull_bb_std_mult': 3.098043370774556, 'bull_rsi_os': 27, 'bull_rsi_ob': 92, 'bull_adx_thresh': 31.34735740124283, 'bull_atr_min_pct': 0.0026413065720207515, 'bull_atr_max_pct': 0.028185094392275116, 'bull_tp_mult': 2.741627284481379, 'bull_tsl_mult': 0.3972090409965182, 'bull_time_stop': 148, 'bull_use_sma': True, 'bull_use_ema': False, 'bull_use_atr': True, 'bull_use_adx': True, 'bull_use_spike': False, 'bull_rsi_required': False, 'bear_strategy': 'mean_reversion', 'bear_bb_std_mult': 1.9926810395653747, 'bear_rsi_os': 17, 'bear_rsi_ob': 51, 'bear_adx_thresh': 11.296366786772282, 'bear_atr_min_pct': 0.0030275718613838438, 'bear_atr_max_pct': 0.10244590588952637, 'bear_tp_mult': 2.146902529638598, 'bear_tsl_mult': 0.12654751025344124, 'bear_time_stop': 96, 'bear_use_sma': True, 'bear_use_ema': True, 'bear_use_atr': True, 'bear_use_adx': False, 'bear_use_spike': False, 'bear_rsi_required': False, 'sideways_strategy': 'mean_reversion', 'sideways_bb_std_mult': 1.457641552633236, 'sideways_rsi_os': 23, 'sideways_rsi_ob': 86, 'sideways_adx_thresh': 8.2514312863219, 'sideways_atr_min_pct': 0.022968371115018333, 'sideways_atr_max_pct': 0.14973786235452827, 'sideways_tp_mult': 1.0123328987960765, 'sideways_tsl_mult': 0.2999771876608467, 'sideways_time_stop': 129, 'sideways_use_sma': False, 'sideways_use_ema': True, 'sideways_use_atr': True, 'sideways_use_adx': False, 'sideways_use_spike': False, 'sideways_rsi_required': True}.
[I 2025-09-01 14:01:33,953] Trial 389 finished with values: [-0.02179739045328244, 0.02121004588774869] and parameters: {'p_sma': 36, 'p_std': 48, 'p_atr': 25, 'p_adx': 12, 'rsi_period': 49, 'ema1': 20, 'ema2': 54, 'slip_atr_k': 0.024432587415047162, 'slip_spread_k': 0.05260847908985782, 'spread_hl_frac': 0.021978199836979885, 'bb_std_mult': 1.7138069734283474, 'rsi_os': 39, 'rsi_ob': 83, 'vol_spike': 0.282094038967747, 'adx_thresh': 21.620286841202436, 'atr_min_pct': 0.027891744539054707, 'atr_max_pct': 0.13902245459480944, 'tp_mult': 2.557599560336735, 'tsl_mult': 0.7864373560584118, 'strategy': 'mean_reversion', 'time_stop': 218, 'use_sma': True, 'use_atr': False, 'use_adx': False, 'use_ema': False, 'use_spike': False, 'rsi_required': True, 'edge_k': 1.3974474070642726, 'edge_cap': 0.5530567716772681, 'bull_strategy': 'breakout', 'bull_bb_std_mult': 2.4286893562326743, 'bull_rsi_os': 33, 'bull_rsi_ob': 93, 'bull_adx_thresh': 31.997879463576282, 'bull_atr_min_pct': 0.014365955578720984, 'bull_atr_max_pct': 0.021253339818392152, 'bull_tp_mult': 2.9285565351800806, 'bull_tsl_mult': 0.4512635523904053, 'bull_time_stop': 99, 'bull_use_sma': True, 'bull_use_ema': True, 'bull_use_atr': True, 'bull_use_adx': True, 'bull_use_spike': False, 'bull_rsi_required': True, 'bear_strategy': 'breakout', 'bear_bb_std_mult': 3.4342500376463425, 'bear_rsi_os': 32, 'bear_rsi_ob': 90, 'bear_adx_thresh': 7.104842232822332, 'bear_atr_min_pct': 0.0016260219534198603, 'bear_atr_max_pct': 0.06865701991256147, 'bear_tp_mult': 2.1433865570585486, 'bear_tsl_mult': 0.8281908984001698, 'bear_time_stop': 229, 'bear_use_sma': True, 'bear_use_ema': True, 'bear_use_atr': True, 'bear_use_adx': True, 'bear_use_spike': True, 'bear_rsi_required': False, 'sideways_strategy': 'mean_reversion', 'sideways_bb_std_mult': 1.2156138978740652, 'sideways_rsi_os': 52, 'sideways_rsi_ob': 80, 'sideways_adx_thresh': 29.984968169831934, 'sideways_atr_min_pct': 0.019018408595496417, 'sideways_atr_max_pct': 0.07472180681325277, 'sideways_tp_mult': 1.7382867855430197, 'sideways_tsl_mult': 0.29919580265226997, 'sideways_time_stop': 183, 'sideways_use_sma': False, 'sideways_use_ema': False, 'sideways_use_atr': False, 'sideways_use_adx': True, 'sideways_use_spike': True, 'sideways_rsi_required': False}.
[I 2025-09-01 14:01:34,611] Trial 395 finished with values: [-1000000000.0, 1000000000.0] and parameters: {'p_sma': 38, 'p_std': 10, 'p_atr': 26, 'p_adx': 9, 'rsi_period': 49, 'ema1': 28, 'ema2': 44, 'slip_atr_k': 0.217002252477707, 'slip_spread_k': 0.1213737565658139, 'spread_hl_frac': 0.004856389502563987, 'bb_std_mult': 1.811828282331157, 'rsi_os': 40, 'rsi_ob': 81, 'vol_spike': 0.22929393059100986, 'adx_thresh': 25.9219118976667, 'atr_min_pct': 0.023177068406569648, 'atr_max_pct': 0.021334751634155873, 'tp_mult': 2.5510722359384834, 'tsl_mult': 0.6484233031423597, 'strategy': 'mean_reversion', 'time_stop': 193, 'use_sma': True, 'use_atr': True, 'use_adx': False, 'use_ema': True, 'use_spike': True, 'rsi_required': False, 'edge_k': 0.8327443283281643, 'edge_cap': 0.2043155621837558, 'bull_strategy': 'breakout', 'bull_bb_std_mult': 0.7262866254637033, 'bull_rsi_os': 39, 'bull_rsi_ob': 52, 'bull_adx_thresh': 16.47727387373684, 'bull_atr_min_pct': 0.005806798549828512, 'bull_atr_max_pct': 0.025012284825978278, 'bull_tp_mult': 2.921812672677437, 'bull_tsl_mult': 0.9820308552051014, 'bull_time_stop': 220, 'bull_use_sma': False, 'bull_use_ema': True, 'bull_use_atr': False, 'bull_use_adx': True, 'bull_use_spike': False, 'bull_rsi_required': True, 'bear_strategy': 'breakout', 'bear_bb_std_mult': 1.3297922447264896, 'bear_rsi_os': 55, 'bear_rsi_ob': 49, 'bear_adx_thresh': 24.115364799138018, 'bear_atr_min_pct': 0.017637309165415213, 'bear_atr_max_pct': 0.05058211323226866, 'bear_tp_mult': 2.29381546272551, 'bear_tsl_mult': 0.8561524485620382, 'bear_time_stop': 228, 'bear_use_sma': False, 'bear_use_ema': True, 'bear_use_atr': True, 'bear_use_adx': True, 'bear_use_spike': False, 'bear_rsi_required': True, 'sideways_strategy': 'breakout', 'sideways_bb_std_mult': 1.205508734626799, 'sideways_rsi_os': 54, 'sideways_rsi_ob': 70, 'sideways_adx_thresh': 6.185483388141128, 'sideways_atr_min_pct': 0.019592332631059025, 'sideways_atr_max_pct': 0.06392096727352484, 'sideways_tp_mult': 2.6677460264368715, 'sideways_tsl_mult': 0.33717137813624276, 'sideways_time_stop': 159, 'sideways_use_sma': True, 'sideways_use_ema': False, 'sideways_use_atr': True, 'sideways_use_adx': True, 'sideways_use_spike': False, 'sideways_rsi_required': True}.
[I 2025-09-01 14:02:09,056] Trial 394 finished with values: [-1000000000.0, 1000000000.0] and parameters: {'p_sma': 27, 'p_std': 56, 'p_atr': 26, 'p_adx': 30, 'rsi_period': 45, 'ema1': 11, 'ema2': 19, 'slip_atr_k': 0.23664577313812035, 'slip_spread_k': 0.11817522771207452, 'spread_hl_frac': 0.00419115884651749, 'bb_std_mult': 1.796721807356347, 'rsi_os': 31, 'rsi_ob': 81, 'vol_spike': 0.22947084847264546, 'adx_thresh': 25.837088935223672, 'atr_min_pct': 0.02296843417108128, 'atr_max_pct': 0.13454445331272916, 'tp_mult': 1.043838271110363, 'tsl_mult': 0.35860022915360407, 'strategy': 'mean_reversion', 'time_stop': 239, 'use_sma': True, 'use_atr': True, 'use_adx': False, 'use_ema': True, 'use_spike': True, 'rsi_required': False, 'edge_k': 0.8530402996794245, 'edge_cap': 0.3531870471980896, 'bull_strategy': 'breakout', 'bull_bb_std_mult': 0.7000788551277293, 'bull_rsi_os': 37, 'bull_rsi_ob': 52, 'bull_adx_thresh': 21.117583392695046, 'bull_atr_min_pct': 0.005541682416312362, 'bull_atr_max_pct': 0.025360113021805557, 'bull_tp_mult': 2.9263372738683873, 'bull_tsl_mult': 0.4523805562682258, 'bull_time_stop': 88, 'bull_use_sma': False, 'bull_use_ema': True, 'bull_use_atr': False, 'bull_use_adx': True, 'bull_use_spike': False, 'bull_rsi_required': True, 'bear_strategy': 'breakout', 'bear_bb_std_mult': 3.5981939809743606, 'bear_rsi_os': 55, 'bear_rsi_ob': 61, 'bear_adx_thresh': 12.440643126290832, 'bear_atr_min_pct': 0.004026378771562061, 'bear_atr_max_pct': 0.05025025005439892, 'bear_tp_mult': 2.2860690978331646, 'bear_tsl_mult': 0.8444001545983728, 'bear_time_stop': 229, 'bear_use_sma': False, 'bear_use_ema': True, 'bear_use_atr': True, 'bear_use_adx': True, 'bear_use_spike': False, 'bear_rsi_required': True, 'sideways_strategy': 'breakout', 'sideways_bb_std_mult': 1.6170619649859908, 'sideways_rsi_os': 50, 'sideways_rsi_ob': 68, 'sideways_adx_thresh': 5.995135901028493, 'sideways_atr_min_pct': 0.019486870432648302, 'sideways_atr_max_pct': 0.06431874747606545, 'sideways_tp_mult': 2.460578379180183, 'sideways_tsl_mult': 0.3392756304954656, 'sideways_time_stop': 189, 'sideways_use_sma': True, 'sideways_use_ema': False, 'sideways_use_atr': True, 'sideways_use_adx': True, 'sideways_use_spike': False, 'sideways_rsi_required': True}.
[I 2025-09-01 14:02:09,829] Trial 393 finished with values: [-1000000000.0, 1000000000.0] and parameters: {'p_sma': 13, 'p_std': 49, 'p_atr': 20, 'p_adx': 13, 'rsi_period': 64, 'ema1': 20, 'ema2': 19, 'slip_atr_k': 0.04656574273471184, 'slip_spread_k': 0.1220524413527354, 'spread_hl_frac': 0.007450864242003296, 'bb_std_mult': 2.0806445734576564, 'rsi_os': 36, 'rsi_ob': 83, 'vol_spike': 0.22956655394439882, 'adx_thresh': 21.674193001438773, 'atr_min_pct': 0.007492716373406601, 'atr_max_pct': 0.135202032688452, 'tp_mult': 1.0793809529661251, 'tsl_mult': 0.7463786246310069, 'strategy': 'mean_reversion', 'time_stop': 238, 'use_sma': False, 'use_atr': True, 'use_adx': False, 'use_ema': True, 'use_spike': False, 'rsi_required': True, 'edge_k': 0.9624944979408334, 'edge_cap': 0.4562956226456982, 'bull_strategy': 'mean_reversion', 'bull_bb_std_mult': 2.4246209315266194, 'bull_rsi_os': 45, 'bull_rsi_ob': 52, 'bull_adx_thresh': 29.70499510025128, 'bull_atr_min_pct': 0.0025843476430623307, 'bull_atr_max_pct': 0.14881878333273588, 'bull_tp_mult': 2.729983672196967, 'bull_tsl_mult': 0.3942525209434267, 'bull_time_stop': 90, 'bull_use_sma': True, 'bull_use_ema': False, 'bull_use_atr': True, 'bull_use_adx': True, 'bull_use_spike': False, 'bull_rsi_required': False, 'bear_strategy': 'mean_reversion', 'bear_bb_std_mult': 1.3303997675137995, 'bear_rsi_os': 55, 'bear_rsi_ob': 64, 'bear_adx_thresh': 11.201441812413183, 'bear_atr_min_pct': 0.002846473482742103, 'bear_atr_max_pct': 0.0507106767673691, 'bear_tp_mult': 1.3251075587532761, 'bear_tsl_mult': 0.12226996020645, 'bear_time_stop': 229, 'bear_use_sma': False, 'bear_use_ema': True, 'bear_use_atr': True, 'bear_use_adx': False, 'bear_use_spike': False, 'bear_rsi_required': False, 'sideways_strategy': 'mean_reversion', 'sideways_bb_std_mult': 1.212872430637935, 'sideways_rsi_os': 11, 'sideways_rsi_ob': 71, 'sideways_adx_thresh': 5.952002250224502, 'sideways_atr_min_pct': 0.024284838496544676, 'sideways_atr_max_pct': 0.07117466748903854, 'sideways_tp_mult': 1.4124516998170957, 'sideways_tsl_mult': 0.2970067489914152, 'sideways_time_stop': 184, 'sideways_use_sma': False, 'sideways_use_ema': True, 'sideways_use_atr': True, 'sideways_use_adx': True, 'sideways_use_spike': False, 'sideways_rsi_required': True}.
