[I 2025-09-01 14:11:45,146] Trial 458 finished with values: [-1000000000.0, 1000000000.0] and parameters: {'p_sma': 41, 'p_std': 38, 'p_atr': 25, 'p_adx': 12, 'rsi_period': 11, 'ema1': 22, 'ema2': 18, 'slip_atr_k': 0.14888470264208553, 'slip_spread_k': 0.07432569374140494, 'spread_hl_frac': 0.006236124013710637, 'bb_std_mult': 3.533700942258556, 'rsi_os': 36, 'rsi_ob': 82, 'vol_spike': 0.23591654276478866, 'adx_thresh': 24.366567009289284, 'atr_min_pct': 0.02600755280132514, 'atr_max_pct': 0.14018168093002367, 'tp_mult': 2.164864626904534, 'tsl_mult': 0.5964464974704015, 'strategy': 'breakout', 'time_stop': 276, 'use_sma': True, 'use_atr': True, 'use_adx': True, 'use_ema': True, 'use_spike': False, 'rsi_required': False, 'edge_k': 0.8971392457823212, 'edge_cap': 0.45713453889774236, 'bull_strategy': 'breakout', 'bull_bb_std_mult': 3.3454386035178176, 'bull_rsi_os': 33, 'bull_rsi_ob': 84, 'bull_adx_thresh': 14.798721506670617, 'bull_atr_min_pct': 0.0031391849828870024, 'bull_atr_max_pct': 0.05421284878191271, 'bull_tp_mult': 2.8535849970221197, 'bull_tsl_mult': 0.19279862903344297, 'bull_time_stop': 236, 'bull_use_sma': True, 'bull_use_ema': True, 'bull_use_atr': False, 'bull_use_adx': False, 'bull_use_spike': False, 'bull_rsi_required': True, 'bear_strategy': 'mean_reversion', 'bear_bb_std_mult': 3.595472242095719, 'bear_rsi_os': 34, 'bear_rsi_ob': 86, 'bear_adx_thresh': 28.142251908635835, 'bear_atr_min_pct': 0.005306021370865726, 'bear_atr_max_pct': 0.04383743721457028, 'bear_tp_mult': 1.774736962376869, 'bear_tsl_mult': 0.4541152132582892, 'bear_time_stop': 56, 'bear_use_sma': True, 'bear_use_ema': True, 'bear_use_atr': False, 'bear_use_adx': False, 'bear_use_spike': True, 'bear_rsi_required': False, 'sideways_strategy': 'breakout', 'sideways_bb_std_mult': 1.7012585906280642, 'sideways_rsi_os': 53, 'sideways_rsi_ob': 66, 'sideways_adx_thresh': 8.655073224939443, 'sideways_atr_min_pct': 0.02007375723121212, 'sideways_atr_max_pct': 0.06321847822089038, 'sideways_tp_mult': 1.2046373839013387, 'sideways_tsl_mult': 0.30443442669273885, 'sideways_time_stop': 163, 'sideways_use_sma': False, 'sideways_use_ema': False, 'sideways_use_atr': False, 'sideways_use_adx': True, 'sideways_use_spike': True, 'sideways_rsi_required': True}.
[I 2025-09-01 14:11:45,599] Trial 460 finished with values: [-1000000000.0, 1000000000.0] and parameters: {'p_sma': 8, 'p_std': 31, 'p_atr': 25, 'p_adx': 12, 'rsi_period': 12, 'ema1': 22, 'ema2': 18, 'slip_atr_k': 0.018983636078289342, 'slip_spread_k': 0.07365333120515125, 'spread_hl_frac': 0.006530028142488795, 'bb_std_mult': 1.9445886617806432, 'rsi_os': 36, 'rsi_ob': 82, 'vol_spike': 0.12972501575417728, 'adx_thresh': 24.40116898395322, 'atr_min_pct': 0.02622742516681098, 'atr_max_pct': 0.13997440914693907, 'tp_mult': 1.1517178139342819, 'tsl_mult': 0.564306575339562, 'strategy': 'breakout', 'time_stop': 264, 'use_sma': True, 'use_atr': True, 'use_adx': True, 'use_ema': True, 'use_spike': False, 'rsi_required': False, 'edge_k': 0.9080289030024111, 'edge_cap': 0.5197820837567808, 'bull_strategy': 'breakout', 'bull_bb_std_mult': 2.29464684290798, 'bull_rsi_os': 34, 'bull_rsi_ob': 53, 'bull_adx_thresh': 10.503820736618547, 'bull_atr_min_pct': 0.01042303515787547, 'bull_atr_max_pct': 0.022484514442142667, 'bull_tp_mult': 2.622251150118442, 'bull_tsl_mult': 0.4195998802510548, 'bull_time_stop': 225, 'bull_use_sma': True, 'bull_use_ema': True, 'bull_use_atr': False, 'bull_use_adx': False, 'bull_use_spike': False, 'bull_rsi_required': True, 'bear_strategy': 'mean_reversion', 'bear_bb_std_mult': 2.9347444356537955, 'bear_rsi_os': 28, 'bear_rsi_ob': 86, 'bear_adx_thresh': 10.114578483732386, 'bear_atr_min_pct': 0.0048361513568470765, 'bear_atr_max_pct': 0.04135992062370318, 'bear_tp_mult': 2.2269500469920156, 'bear_tsl_mult': 0.08423825741234006, 'bear_time_stop': 208, 'bear_use_sma': True, 'bear_use_ema': True, 'bear_use_atr': False, 'bear_use_adx': False, 'bear_use_spike': True, 'bear_rsi_required': False, 'sideways_strategy': 'breakout', 'sideways_bb_std_mult': 1.7052910778197894, 'sideways_rsi_os': 10, 'sideways_rsi_ob': 53, 'sideways_adx_thresh': 8.444387649457914, 'sideways_atr_min_pct': 0.017944564011441032, 'sideways_atr_max_pct': 0.06300027468146284, 'sideways_tp_mult': 2.829673813135673, 'sideways_tsl_mult': 0.6037947734152739, 'sideways_time_stop': 262, 'sideways_use_sma': False, 'sideways_use_ema': False, 'sideways_use_atr': False, 'sideways_use_adx': True, 'sideways_use_spike': True, 'sideways_rsi_required': True}.
[I 2025-09-01 14:11:46,729] Trial 462 finished with values: [-1000000000.0, 1000000000.0] and parameters: {'p_sma': 34, 'p_std': 56, 'p_atr': 24, 'p_adx': 13, 'rsi_period': 57, 'ema1': 19, 'ema2': 21, 'slip_atr_k': 0.024912646590161423, 'slip_spread_k': 0.6449606012400413, 'spread_hl_frac': 0.0030576838873484203, 'bb_std_mult': 1.6212871956200448, 'rsi_os': 52, 'rsi_ob': 85, 'vol_spike': 0.22543425983338572, 'adx_thresh': 26.303717276369973, 'atr_min_pct': 0.028254594129337132, 'atr_max_pct': 0.057148164129785614, 'tp_mult': 2.382584273531942, 'tsl_mult': 0.3346458907362045, 'strategy': 'mean_reversion', 'time_stop': 228, 'use_sma': True, 'use_atr': False, 'use_adx': False, 'use_ema': True, 'use_spike': True, 'rsi_required': True, 'edge_k': 0.9758606866265047, 'edge_cap': 0.3351617947153891, 'bull_strategy': 'breakout', 'bull_bb_std_mult': 0.5699173061224081, 'bull_rsi_os': 29, 'bull_rsi_ob': 64, 'bull_adx_thresh': 16.96498998592279, 'bull_atr_min_pct': 0.0033990393358623553, 'bull_atr_max_pct': 0.109121789334784, 'bull_tp_mult': 1.0858735871658025, 'bull_tsl_mult': 0.44349571664881005, 'bull_time_stop': 97, 'bull_use_sma': False, 'bull_use_ema': True, 'bull_use_atr': True, 'bull_use_adx': True, 'bull_use_spike': False, 'bull_rsi_required': False, 'bear_strategy': 'breakout', 'bear_bb_std_mult': 3.4678599608697023, 'bear_rsi_os': 28, 'bear_rsi_ob': 80, 'bear_adx_thresh': 10.37437418689216, 'bear_atr_min_pct': 0.003536552156578667, 'bear_atr_max_pct': 0.10585944565890822, 'bear_tp_mult': 2.740244912751704, 'bear_tsl_mult': 0.3811303618732325, 'bear_time_stop': 221, 'bear_use_sma': True, 'bear_use_ema': False, 'bear_use_atr': True, 'bear_use_adx': True, 'bear_use_spike': False, 'bear_rsi_required': True, 'sideways_strategy': 'breakout', 'sideways_bb_std_mult': 1.2817160284642777, 'sideways_rsi_os': 50, 'sideways_rsi_ob': 56, 'sideways_adx_thresh': 15.743475733658993, 'sideways_atr_min_pct': 0.02302042234888345, 'sideways_atr_max_pct': 0.06722911502315337, 'sideways_tp_mult': 1.1231715494510683, 'sideways_tsl_mult': 0.26213117810540587, 'sideways_time_stop': 249, 'sideways_use_sma': True, 'sideways_use_ema': True, 'sideways_use_atr': True, 'sideways_use_adx': False, 'sideways_use_spike': False, 'sideways_rsi_required': True}.
[I 2025-09-01 14:11:46,730] Trial 461 finished with values: [-1000000000.0, 1000000000.0] and parameters: {'p_sma': 37, 'p_std': 31, 'p_atr': 15, 'p_adx': 17, 'rsi_period': 13, 'ema1': 10, 'ema2': 16, 'slip_atr_k': 0.21449234582298554, 'slip_spread_k': 0.655940994856453, 'spread_hl_frac': 0.0018027692163182542, 'bb_std_mult': 1.6117178126541045, 'rsi_os': 39, 'rsi_ob': 50, 'vol_spike': 0.2181826817190535, 'adx_thresh': 20.112228402645243, 'atr_min_pct': 0.027976565898059327, 'atr_max_pct': 0.1425464896762576, 'tp_mult': 1.1509477874357241, 'tsl_mult': 0.7620168302634747, 'strategy': 'mean_reversion', 'time_stop': 227, 'use_sma': True, 'use_atr': False, 'use_adx': False, 'use_ema': True, 'use_spike': True, 'rsi_required': True, 'edge_k': 0.9770236749839493, 'edge_cap': 0.3342506294560847, 'bull_strategy': 'breakout', 'bull_bb_std_mult': 3.2775591848627217, 'bull_rsi_os': 9, 'bull_rsi_ob': 62, 'bull_adx_thresh': 16.60237047863219, 'bull_atr_min_pct': 0.014356660128110245, 'bull_atr_max_pct': 0.08938025297452107, 'bull_tp_mult': 2.90438523970616, 'bull_tsl_mult': 0.4499583273280922, 'bull_time_stop': 97, 'bull_use_sma': False, 'bull_use_ema': True, 'bull_use_atr': True, 'bull_use_adx': True, 'bull_use_spike': False, 'bull_rsi_required': False, 'bear_strategy': 'breakout', 'bear_bb_std_mult': 2.756809460604621, 'bear_rsi_os': 42, 'bear_rsi_ob': 91, 'bear_adx_thresh': 17.326169122123925, 'bear_atr_min_pct': 0.001158261972499056, 'bear_atr_max_pct': 0.01283295644756556, 'bear_tp_mult': 2.328021622356984, 'bear_tsl_mult': 0.7268450117279972, 'bear_time_stop': 221, 'bear_use_sma': True, 'bear_use_ema': False, 'bear_use_atr': True, 'bear_use_adx': True, 'bear_use_spike': False, 'bear_rsi_required': True, 'sideways_strategy': 'breakout', 'sideways_bb_std_mult': 1.633861408522088, 'sideways_rsi_os': 41, 'sideways_rsi_ob': 53, 'sideways_adx_thresh': 21.10026120777184, 'sideways_atr_min_pct': 0.013688341960580741, 'sideways_atr_max_pct': 0.06760604638105969, 'sideways_tp_mult': 2.829669535066111, 'sideways_tsl_mult': 0.26035065963106857, 'sideways_time_stop': 188, 'sideways_use_sma': True, 'sideways_use_ema': True, 'sideways_use_atr': True, 'sideways_use_adx': False, 'sideways_use_spike': False, 'sideways_rsi_required': True}.
[I 2025-09-01 14:11:46,830] Trial 464 finished with values: [-1000000000.0, 1000000000.0] and parameters: {'p_sma': 33, 'p_std': 48, 'p_atr': 15, 'p_adx': 13, 'rsi_period': 29, 'ema1': 19, 'ema2': 21, 'slip_atr_k': 0.024128982909907934, 'slip_spread_k': 0.6513645162505683, 'spread_hl_frac': 0.045275688845604414, 'bb_std_mult': 1.7821011045931245, 'rsi_os': 52, 'rsi_ob': 50, 'vol_spike': 0.21871815016133234, 'adx_thresh': 15.108065721223037, 'atr_min_pct': 0.027686886231160366, 'atr_max_pct': 0.13336075117931684, 'tp_mult': 1.1163986404136141, 'tsl_mult': 0.7664379184038925, 'strategy': 'mean_reversion', 'time_stop': 226, 'use_sma': True, 'use_atr': False, 'use_adx': False, 'use_ema': True, 'use_spike': True, 'rsi_required': True, 'edge_k': 1.116469228722685, 'edge_cap': 0.34158247221139143, 'bull_strategy': 'breakout', 'bull_bb_std_mult': 3.275129224046599, 'bull_rsi_os': 38, 'bull_rsi_ob': 63, 'bull_adx_thresh': 31.017520702503905, 'bull_atr_min_pct': 0.01819941204854485, 'bull_atr_max_pct': 0.07783548123198981, 'bull_tp_mult': 2.900028129105065, 'bull_tsl_mult': 0.4423935390397755, 'bull_time_stop': 138, 'bull_use_sma': False, 'bull_use_ema': True, 'bull_use_atr': True, 'bull_use_adx': True, 'bull_use_spike': False, 'bull_rsi_required': False, 'bear_strategy': 'breakout', 'bear_bb_std_mult': 2.216133696633465, 'bear_rsi_os': 43, 'bear_rsi_ob': 91, 'bear_adx_thresh': 11.647348823050839, 'bear_atr_min_pct': 0.006367331457567146, 'bear_atr_max_pct': 0.049416345406888496, 'bear_tp_mult': 2.329998466800414, 'bear_tsl_mult': 0.15550144271101435, 'bear_time_stop': 22, 'bear_use_sma': True, 'bear_use_ema': False, 'bear_use_atr': True, 'bear_use_adx': True, 'bear_use_spike': False, 'bear_rsi_required': True, 'sideways_strategy': 'mean_reversion', 'sideways_bb_std_mult': 1.4808885346416838, 'sideways_rsi_os': 50, 'sideways_rsi_ob': 56, 'sideways_adx_thresh': 21.30456821129133, 'sideways_atr_min_pct': 0.013747742633880185, 'sideways_atr_max_pct': 0.0676796937253792, 'sideways_tp_mult': 2.6901106387244464, 'sideways_tsl_mult': 0.2581103986577154, 'sideways_time_stop': 186, 'sideways_use_sma': True, 'sideways_use_ema': True, 'sideways_use_atr': True, 'sideways_use_adx': False, 'sideways_use_spike': False, 'sideways_rsi_required': True}.
[I 2025-09-01 14:11:48,093] Trial 466 finished with values: [-1000000000.0, 1000000000.0] and parameters: {'p_sma': 29, 'p_std': 48, 'p_atr': 24, 'p_adx': 12, 'rsi_period': 80, 'ema1': 7, 'ema2': 36, 'slip_atr_k': 0.19181088952276526, 'slip_spread_k': 0.020650681446517903, 'spread_hl_frac': 0.04479316050632617, 'bb_std_mult': 0.8294039538692479, 'rsi_os': 50, 'rsi_ob': 77, 'vol_spike': 0.20838574149111255, 'adx_thresh': 26.41268202042215, 'atr_min_pct': 0.022502589144262182, 'atr_max_pct': 0.13344777719026102, 'tp_mult': 1.0126156106088562, 'tsl_mult': 0.632293339277789, 'strategy': 'mean_reversion', 'time_stop': 247, 'use_sma': True, 'use_atr': False, 'use_adx': False, 'use_ema': True, 'use_spike': True, 'rsi_required': False, 'edge_k': 0.050226753429417625, 'edge_cap': 0.40292619590291767, 'bull_strategy': 'breakout', 'bull_bb_std_mult': 3.1455457020094095, 'bull_rsi_os': 45, 'bull_rsi_ob': 56, 'bull_adx_thresh': 28.92580672436035, 'bull_atr_min_pct': 0.0046510001610167336, 'bull_atr_max_pct': 0.07778236921665939, 'bull_tp_mult': 2.735188131124581, 'bull_tsl_mult': 0.48896437481366123, 'bull_time_stop': 82, 'bull_use_sma': True, 'bull_use_ema': True, 'bull_use_atr': True, 'bull_use_adx': True, 'bull_use_spike': False, 'bull_rsi_required': True, 'bear_strategy': 'breakout', 'bear_bb_std_mult': 2.6485218188314064, 'bear_rsi_os': 35, 'bear_rsi_ob': 76, 'bear_adx_thresh': 21.424097954725287, 'bear_atr_min_pct': 0.006612167160730693, 'bear_atr_max_pct': 0.14124003316175576, 'bear_tp_mult': 1.1563798512621934, 'bear_tsl_mult': 0.9077264794567734, 'bear_time_stop': 146, 'bear_use_sma': True, 'bear_use_ema': True, 'bear_use_atr': True, 'bear_use_adx': True, 'bear_use_spike': False, 'bear_rsi_required': True, 'sideways_strategy': 'mean_reversion', 'sideways_bb_std_mult': 1.4880150336582254, 'sideways_rsi_os': 52, 'sideways_rsi_ob': 64, 'sideways_adx_thresh': 7.08509179669176, 'sideways_atr_min_pct': 0.02069009395115906, 'sideways_atr_max_pct': 0.07006302406682476, 'sideways_tp_mult': 2.687045662450454, 'sideways_tsl_mult': 0.28415664188212086, 'sideways_time_stop': 109, 'sideways_use_sma': True, 'sideways_use_ema': False, 'sideways_use_atr': True, 'sideways_use_adx': True, 'sideways_use_spike': False, 'sideways_rsi_required': False}.
[I 2025-09-01 14:11:48,102] Trial 467 finished with values: [-1000000000.0, 1000000000.0] and parameters: {'p_sma': 38, 'p_std': 36, 'p_atr': 26, 'p_adx': 11, 'rsi_period': 71, 'ema1': 14, 'ema2': 36, 'slip_atr_k': 0.19272430251310385, 'slip_spread_k': 0.22872523249731097, 'spread_hl_frac': 0.010866845751680211, 'bb_std_mult': 1.7210280546105634, 'rsi_os': 54, 'rsi_ob': 86, 'vol_spike': 0.24374487365838776, 'adx_thresh': 26.235751094715237, 'atr_min_pct': 0.02289927773015464, 'atr_max_pct': 0.08465516014900151, 'tp_mult': 1.098545710784675, 'tsl_mult': 0.7238973050351675, 'strategy': 'mean_reversion', 'time_stop': 246, 'use_sma': True, 'use_atr': False, 'use_adx': False, 'use_ema': True, 'use_spike': True, 'rsi_required': False, 'edge_k': 0.7254784825764242, 'edge_cap': 0.15073500499552756, 'bull_strategy': 'breakout', 'bull_bb_std_mult': 3.131210850144841, 'bull_rsi_os': 45, 'bull_rsi_ob': 56, 'bull_adx_thresh': 28.86078710161876, 'bull_atr_min_pct': 0.008088048961278967, 'bull_atr_max_pct': 0.14993149825441088, 'bull_tp_mult': 2.751206065339922, 'bull_tsl_mult': 0.6190038933942682, 'bull_time_stop': 84, 'bull_use_sma': True, 'bull_use_ema': False, 'bull_use_atr': True, 'bull_use_adx': True, 'bull_use_spike': False, 'bull_rsi_required': True, 'bear_strategy': 'breakout', 'bear_bb_std_mult': 3.32867940647384, 'bear_rsi_os': 35, 'bear_rsi_ob': 88, 'bear_adx_thresh': 13.58486986294304, 'bear_atr_min_pct': 0.0022590568751970786, 'bear_atr_max_pct': 0.1413193219271584, 'bear_tp_mult': 2.9013383434319087, 'bear_tsl_mult': 0.31873828586185593, 'bear_time_stop': 231, 'bear_use_sma': True, 'bear_use_ema': True, 'bear_use_atr': True, 'bear_use_adx': True, 'bear_use_spike': False, 'bear_rsi_required': True, 'sideways_strategy': 'mean_reversion', 'sideways_bb_std_mult': 1.4254903054878119, 'sideways_rsi_os': 35, 'sideways_rsi_ob': 78, 'sideways_adx_thresh': 5.551089381469292, 'sideways_atr_min_pct': 0.020645049116588526, 'sideways_atr_max_pct': 0.10559944123972163, 'sideways_tp_mult': 1.706175608719974, 'sideways_tsl_mult': 0.12207934594905584, 'sideways_time_stop': 195, 'sideways_use_sma': True, 'sideways_use_ema': False, 'sideways_use_atr': True, 'sideways_use_adx': True, 'sideways_use_spike': False, 'sideways_rsi_required': False}.
[I 2025-09-01 14:12:16,006] Trial 463 finished with values: [-0.16709402396582396, 0.16690818218863335] and parameters: {'p_sma': 34, 'p_std': 31, 'p_atr': 24, 'p_adx': 23, 'rsi_period': 28, 'ema1': 20, 'ema2': 21, 'slip_atr_k': 0.023354568615420335, 'slip_spread_k': 0.6453276477913312, 'spread_hl_frac': 0.008815259421801967, 'bb_std_mult': 2.1473072503670463, 'rsi_os': 39, 'rsi_ob': 86, 'vol_spike': 0.20830184185074088, 'adx_thresh': 26.527529115931884, 'atr_min_pct': 0.027811566186814404, 'atr_max_pct': 0.13297771238719297, 'tp_mult': 2.3771435640239202, 'tsl_mult': 0.0465284710624983, 'strategy': 'mean_reversion', 'time_stop': 5, 'use_sma': True, 'use_atr': False, 'use_adx': False, 'use_ema': True, 'use_spike': True, 'rsi_required': True, 'edge_k': 0.15607002189766028, 'edge_cap': 0.3341241655245953, 'bull_strategy': 'breakout', 'bull_bb_std_mult': 3.2761476942644663, 'bull_rsi_os': 9, 'bull_rsi_ob': 46, 'bull_adx_thresh': 23.406911846053706, 'bull_atr_min_pct': 0.008226657643762042, 'bull_atr_max_pct': 0.13421398037080773, 'bull_tp_mult': 2.7236740674476163, 'bull_tsl_mult': 0.7724222281735534, 'bull_time_stop': 93, 'bull_use_sma': False, 'bull_use_ema': True, 'bull_use_atr': True, 'bull_use_adx': True, 'bull_use_spike': False, 'bull_rsi_required': False, 'bear_strategy': 'breakout', 'bear_bb_std_mult': 3.187696325823511, 'bear_rsi_os': 28, 'bear_rsi_ob': 91, 'bear_adx_thresh': 10.263306223196224, 'bear_atr_min_pct': 0.0007338478629410243, 'bear_atr_max_pct': 0.049629435739324636, 'bear_tp_mult': 2.071518828540681, 'bear_tsl_mult': 0.15529728266894102, 'bear_time_stop': 220, 'bear_use_sma': True, 'bear_use_ema': False, 'bear_use_atr': True, 'bear_use_adx': True, 'bear_use_spike': False, 'bear_rsi_required': True, 'sideways_strategy': 'breakout', 'sideways_bb_std_mult': 1.4641758156487328, 'sideways_rsi_os': 35, 'sideways_rsi_ob': 56, 'sideways_adx_thresh': 5.567209545137996, 'sideways_atr_min_pct': 0.00011146929176944834, 'sideways_atr_max_pct': 0.1449288026939308, 'sideways_tp_mult': 1.625375089230804, 'sideways_tsl_mult': 0.3869642143334538, 'sideways_time_stop': 185, 'sideways_use_sma': True, 'sideways_use_ema': True, 'sideways_use_atr': True, 'sideways_use_adx': False, 'sideways_use_spike': False, 'sideways_rsi_required': True}.
[I 2025-09-01 14:12:21,124] Trial 465 finished with values: [-1000000000.0, 1000000000.0] and parameters: {'p_sma': 36, 'p_std': 48, 'p_atr': 24, 'p_adx': 12, 'rsi_period': 71, 'ema1': 14, 'ema2': 32, 'slip_atr_k': 0.08236939036296334, 'slip_spread_k': 0.11654558912096169, 'spread_hl_frac': 0.008953772223754933, 'bb_std_mult': 1.7882627612666877, 'rsi_os': 21, 'rsi_ob': 59, 'vol_spike': 0.2430212084285301, 'adx_thresh': 26.0568514445159, 'atr_min_pct': 0.024756107276976316, 'atr_max_pct': 0.13273816733651117, 'tp_mult': 1.1049124585573435, 'tsl_mult': 0.7370672888289264, 'strategy': 'mean_reversion', 'time_stop': 248, 'use_sma': True, 'use_atr': False, 'use_adx': False, 'use_ema': True, 'use_spike': True, 'rsi_required': False, 'edge_k': 0.8280789476163275, 'edge_cap': 0.39710304111661615, 'bull_strategy': 'breakout', 'bull_bb_std_mult': 3.129936876571425, 'bull_rsi_os': 37, 'bull_rsi_ob': 56, 'bull_adx_thresh': 31.11336217464834, 'bull_atr_min_pct': 0.008118872839158707, 'bull_atr_max_pct': 0.019007419034338037, 'bull_tp_mult': 2.718602104041154, 'bull_tsl_mult': 0.382577374863268, 'bull_time_stop': 83, 'bull_use_sma': True, 'bull_use_ema': True, 'bull_use_atr': True, 'bull_use_adx': True, 'bull_use_spike': False, 'bull_rsi_required': True, 'bear_strategy': 'breakout', 'bear_bb_std_mult': 3.178467226746607, 'bear_rsi_os': 22, 'bear_rsi_ob': 88, 'bear_adx_thresh': 21.34703156931069, 'bear_atr_min_pct': 0.017675464448832178, 'bear_atr_max_pct': 0.04933339106086705, 'bear_tp_mult': 2.2823975281535374, 'bear_tsl_mult': 0.628254011394402, 'bear_time_stop': 226, 'bear_use_sma': True, 'bear_use_ema': True, 'bear_use_atr': True, 'bear_use_adx': True, 'bear_use_spike': False, 'bear_rsi_required': True, 'sideways_strategy': 'mean_reversion', 'sideways_bb_std_mult': 1.4562023120725751, 'sideways_rsi_os': 52, 'sideways_rsi_ob': 69, 'sideways_adx_thresh': 7.0101387956362595, 'sideways_atr_min_pct': 0.02063416374955347, 'sideways_atr_max_pct': 0.10616774756762365, 'sideways_tp_mult': 2.6806815808200675, 'sideways_tsl_mult': 0.1176630577797631, 'sideways_time_stop': 113, 'sideways_use_sma': True, 'sideways_use_ema': False, 'sideways_use_atr': True, 'sideways_use_adx': True, 'sideways_use_spike': False, 'sideways_rsi_required': False}.
