[I 2025-09-01 15:04:02,921] Trial 810 finished with values: [-1000000000.0, 1000000000.0] and parameters: {'p_sma': 36, 'p_std': 49, 'p_atr': 24, 'p_adx': 11, 'rsi_period': 46, 'ema1': 20, 'ema2': 21, 'slip_atr_k': 9.646425430504153e-05, 'slip_spread_k': 0.21392579059315864, 'spread_hl_frac': 0.005015903510813968, 'bb_std_mult': 1.6785739324492772, 'rsi_os': 14, 'rsi_ob': 56, 'vol_spike': 0.2449988485675255, 'adx_thresh': 24.43948230610819, 'atr_min_pct': 0.028596254782102426, 'atr_max_pct': 0.060923127206806676, 'tp_mult': 1.0118126590741676, 'tsl_mult': 0.7619521811417134, 'strategy': 'mean_reversion', 'time_stop': 276, 'use_sma': True, 'use_atr': False, 'use_adx': True, 'use_ema': True, 'use_spike': True, 'rsi_required': False, 'edge_k': 1.0481132899098977, 'edge_cap': 0.3248333407862193, 'bull_strategy': 'breakout', 'bull_bb_std_mult': 1.9106617424329582, 'bull_rsi_os': 34, 'bull_rsi_ob': 90, 'bull_adx_thresh': 26.123902157741167, 'bull_atr_min_pct': 0.003765862656389323, 'bull_atr_max_pct': 0.02332401552983676, 'bull_tp_mult': 2.806887081243933, 'bull_tsl_mult': 0.40880638295495364, 'bull_time_stop': 198, 'bull_use_sma': False, 'bull_use_ema': True, 'bull_use_atr': True, 'bull_use_adx': True, 'bull_use_spike': True, 'bull_rsi_required': True, 'bear_strategy': 'breakout', 'bear_bb_std_mult': 3.4959851705803993, 'bear_rsi_os': 42, 'bear_rsi_ob': 86, 'bear_adx_thresh': 29.703179092710627, 'bear_atr_min_pct': 0.01657003935681861, 'bear_atr_max_pct': 0.04876262970118336, 'bear_tp_mult': 2.162352926361321, 'bear_tsl_mult': 0.16978993714185445, 'bear_time_stop': 175, 'bear_use_sma': True, 'bear_use_ema': True, 'bear_use_atr': True, 'bear_use_adx': True, 'bear_use_spike': False, 'bear_rsi_required': True, 'sideways_strategy': 'breakout', 'sideways_bb_std_mult': 1.9634930039150278, 'sideways_rsi_os': 12, 'sideways_rsi_ob': 84, 'sideways_adx_thresh': 19.06632071650423, 'sideways_atr_min_pct': 0.028806124002703756, 'sideways_atr_max_pct': 0.06333783717374959, 'sideways_tp_mult': 1.2693690314072184, 'sideways_tsl_mult': 0.26518887850510736, 'sideways_time_stop': 155, 'sideways_use_sma': True, 'sideways_use_ema': False, 'sideways_use_atr': True, 'sideways_use_adx': True, 'sideways_use_spike': False, 'sideways_rsi_required': False}.
[I 2025-09-01 15:04:04,379] Trial 811 finished with values: [-0.1460056522929506, 0.14553894013224225] and parameters: {'p_sma': 36, 'p_std': 49, 'p_atr': 24, 'p_adx': 11, 'rsi_period': 47, 'ema1': 20, 'ema2': 22, 'slip_atr_k': 0.1479876644462605, 'slip_spread_k': 0.48140947061294137, 'spread_hl_frac': 0.002606076159415781, 'bb_std_mult': 1.6799253450008127, 'rsi_os': 14, 'rsi_ob': 81, 'vol_spike': 0.23169124885405323, 'adx_thresh': 27.639609313157187, 'atr_min_pct': 0.025169796944782007, 'atr_max_pct': 0.13248017316858707, 'tp_mult': 2.5818767369517097, 'tsl_mult': 0.6037711330463124, 'strategy': 'mean_reversion', 'time_stop': 159, 'use_sma': True, 'use_atr': False, 'use_adx': True, 'use_ema': True, 'use_spike': True, 'rsi_required': False, 'edge_k': 1.5264010796475098, 'edge_cap': 0.6320009281917627, 'bull_strategy': 'mean_reversion', 'bull_bb_std_mult': 1.236295787546984, 'bull_rsi_os': 45, 'bull_rsi_ob': 83, 'bull_adx_thresh': 31.755019082810573, 'bull_atr_min_pct': 0.016982024538532352, 'bull_atr_max_pct': 0.07270028295989035, 'bull_tp_mult': 2.7855318790643446, 'bull_tsl_mult': 0.470536226452344, 'bull_time_stop': 112, 'bull_use_sma': False, 'bull_use_ema': True, 'bull_use_atr': True, 'bull_use_adx': True, 'bull_use_spike': True, 'bull_rsi_required': False, 'bear_strategy': 'breakout', 'bear_bb_std_mult': 3.2959182085593115, 'bear_rsi_os': 53, 'bear_rsi_ob': 90, 'bear_adx_thresh': 14.152630995421948, 'bear_atr_min_pct': 0.0004719573104942881, 'bear_atr_max_pct': 0.047860737547272325, 'bear_tp_mult': 2.408454825222676, 'bear_tsl_mult': 0.7604607309046204, 'bear_time_stop': 174, 'bear_use_sma': True, 'bear_use_ema': False, 'bear_use_atr': True, 'bear_use_adx': True, 'bear_use_spike': False, 'bear_rsi_required': True, 'sideways_strategy': 'breakout', 'sideways_bb_std_mult': 1.6750841977608175, 'sideways_rsi_os': 7, 'sideways_rsi_ob': 85, 'sideways_adx_thresh': 19.368169270879076, 'sideways_atr_min_pct': 0.02855840655463954, 'sideways_atr_max_pct': 0.12152465570790019, 'sideways_tp_mult': 2.688694206301206, 'sideways_tsl_mult': 0.8167737749959896, 'sideways_time_stop': 254, 'sideways_use_sma': True, 'sideways_use_ema': False, 'sideways_use_atr': True, 'sideways_use_adx': True, 'sideways_use_spike': False, 'sideways_rsi_required': False}.
[I 2025-09-01 15:04:44,790] Trial 815 finished with values: [-1000000000.0, 1000000000.0] and parameters: {'p_sma': 33, 'p_std': 46, 'p_atr': 26, 'p_adx': 12, 'rsi_period': 70, 'ema1': 26, 'ema2': 19, 'slip_atr_k': 0.01454156019187947, 'slip_spread_k': 0.07504988448597977, 'spread_hl_frac': 0.023564905129686786, 'bb_std_mult': 1.2183727891689196, 'rsi_os': 38, 'rsi_ob': 82, 'vol_spike': 0.23170994359476282, 'adx_thresh': 25.371718903893317, 'atr_min_pct': 0.02665310562418322, 'atr_max_pct': 0.1366317976073752, 'tp_mult': 1.0699924757266965, 'tsl_mult': 0.7588423717852228, 'strategy': 'breakout', 'time_stop': 218, 'use_sma': False, 'use_atr': True, 'use_adx': False, 'use_ema': True, 'use_spike': False, 'rsi_required': False, 'edge_k': 0.9114144168474064, 'edge_cap': 0.934271103221576, 'bull_strategy': 'mean_reversion', 'bull_bb_std_mult': 2.0996940811036153, 'bull_rsi_os': 22, 'bull_rsi_ob': 55, 'bull_adx_thresh': 17.190640456247177, 'bull_atr_min_pct': 0.0052406661353795285, 'bull_atr_max_pct': 0.017285248842370083, 'bull_tp_mult': 2.2135133186327125, 'bull_tsl_mult': 0.4573271453131291, 'bull_time_stop': 259, 'bull_use_sma': True, 'bull_use_ema': True, 'bull_use_atr': False, 'bull_use_adx': False, 'bull_use_spike': False, 'bull_rsi_required': False, 'bear_strategy': 'breakout', 'bear_bb_std_mult': 3.5027963837259852, 'bear_rsi_os': 37, 'bear_rsi_ob': 49, 'bear_adx_thresh': 13.148376573177387, 'bear_atr_min_pct': 0.0032525613072180736, 'bear_atr_max_pct': 0.04190346003190446, 'bear_tp_mult': 1.7462279291881018, 'bear_tsl_mult': 0.3285891381156469, 'bear_time_stop': 219, 'bear_use_sma': False, 'bear_use_ema': False, 'bear_use_atr': False, 'bear_use_adx': True, 'bear_use_spike': False, 'bear_rsi_required': False, 'sideways_strategy': 'breakout', 'sideways_bb_std_mult': 1.6184181704986658, 'sideways_rsi_os': 31, 'sideways_rsi_ob': 66, 'sideways_adx_thresh': 7.989988377281037, 'sideways_atr_min_pct': 0.019597462906953567, 'sideways_atr_max_pct': 0.06745406249035692, 'sideways_tp_mult': 1.9941223486253459, 'sideways_tsl_mult': 0.9708409878355422, 'sideways_time_stop': 228, 'sideways_use_sma': False, 'sideways_use_ema': False, 'sideways_use_atr': True, 'sideways_use_adx': False, 'sideways_use_spike': False, 'sideways_rsi_required': True}.
[I 2025-09-01 15:04:45,611] Trial 813 finished with values: [-0.2405205796820583, 0.24040421493731776] and parameters: {'p_sma': 52, 'p_std': 43, 'p_atr': 26, 'p_adx': 13, 'rsi_period': 73, 'ema1': 26, 'ema2': 18, 'slip_atr_k': 0.010029671301260808, 'slip_spread_k': 0.10240512518670532, 'spread_hl_frac': 0.028439476437875904, 'bb_std_mult': 3.0153777567352487, 'rsi_os': 42, 'rsi_ob': 69, 'vol_spike': 0.11037280817157549, 'adx_thresh': 24.566187511837303, 'atr_min_pct': 0.02113624546748932, 'atr_max_pct': 0.06120567571673508, 'tp_mult': 1.1765619923002373, 'tsl_mult': 0.7636539428587303, 'strategy': 'mean_reversion', 'time_stop': 217, 'use_sma': False, 'use_atr': False, 'use_adx': False, 'use_ema': True, 'use_spike': True, 'rsi_required': False, 'edge_k': 1.0339327966075245, 'edge_cap': 0.3171817833571006, 'bull_strategy': 'mean_reversion', 'bull_bb_std_mult': 3.208354547848651, 'bull_rsi_os': 55, 'bull_rsi_ob': 76, 'bull_adx_thresh': 25.106249748568025, 'bull_atr_min_pct': 0.005182627609359823, 'bull_atr_max_pct': 0.02255954403209417, 'bull_tp_mult': 2.78043829263145, 'bull_tsl_mult': 0.46075466230636036, 'bull_time_stop': 89, 'bull_use_sma': True, 'bull_use_ema': True, 'bull_use_atr': False, 'bull_use_adx': False, 'bull_use_spike': False, 'bull_rsi_required': False, 'bear_strategy': 'breakout', 'bear_bb_std_mult': 3.4950227738217197, 'bear_rsi_os': 30, 'bear_rsi_ob': 90, 'bear_adx_thresh': 13.62192011915273, 'bear_atr_min_pct': 0.0005859080823076204, 'bear_atr_max_pct': 0.012817912396083528, 'bear_tp_mult': 2.6747987336967975, 'bear_tsl_mult': 0.7655417249727221, 'bear_time_stop': 126, 'bear_use_sma': True, 'bear_use_ema': False, 'bear_use_atr': True, 'bear_use_adx': True, 'bear_use_spike': False, 'bear_rsi_required': True, 'sideways_strategy': 'breakout', 'sideways_bb_std_mult': 1.9760921781647585, 'sideways_rsi_os': 52, 'sideways_rsi_ob': 51, 'sideways_adx_thresh': 6.1420762954815915, 'sideways_atr_min_pct': 0.0007896414126621898, 'sideways_atr_max_pct': 0.0970266623209999, 'sideways_tp_mult': 2.7453913953299893, 'sideways_tsl_mult': 0.9818090869473363, 'sideways_time_stop': 228, 'sideways_use_sma': True, 'sideways_use_ema': False, 'sideways_use_atr': True, 'sideways_use_adx': False, 'sideways_use_spike': False, 'sideways_rsi_required': True}.
[I 2025-09-01 15:04:46,000] Trial 812 finished with values: [-1000000000.0, 1000000000.0] and parameters: {'p_sma': 52, 'p_std': 46, 'p_atr': 26, 'p_adx': 13, 'rsi_period': 46, 'ema1': 20, 'ema2': 18, 'slip_atr_k': 0.023059451223063753, 'slip_spread_k': 0.556125869930604, 'spread_hl_frac': 0.004782731339745251, 'bb_std_mult': 1.8099278305119553, 'rsi_os': 41, 'rsi_ob': 80, 'vol_spike': 0.23142281922093394, 'adx_thresh': 24.443140497369996, 'atr_min_pct': 0.026534619304642522, 'atr_max_pct': 0.13201099582470605, 'tp_mult': 1.181626496637458, 'tsl_mult': 0.7625399417020485, 'strategy': 'mean_reversion', 'time_stop': 218, 'use_sma': True, 'use_atr': False, 'use_adx': True, 'use_ema': True, 'use_spike': True, 'rsi_required': False, 'edge_k': 0.8563010471195984, 'edge_cap': 0.17071139189628765, 'bull_strategy': 'mean_reversion', 'bull_bb_std_mult': 1.9086373670377168, 'bull_rsi_os': 32, 'bull_rsi_ob': 55, 'bull_adx_thresh': 32.752380673089725, 'bull_atr_min_pct': 0.005467516691401449, 'bull_atr_max_pct': 0.04659450112401759, 'bull_tp_mult': 2.3441158509603093, 'bull_tsl_mult': 0.45601119456477957, 'bull_time_stop': 90, 'bull_use_sma': True, 'bull_use_ema': True, 'bull_use_atr': True, 'bull_use_adx': True, 'bull_use_spike': False, 'bull_rsi_required': False, 'bear_strategy': 'breakout', 'bear_bb_std_mult': 2.277960745321581, 'bear_rsi_os': 30, 'bear_rsi_ob': 85, 'bear_adx_thresh': 14.225656832721144, 'bear_atr_min_pct': 0.02188717060014871, 'bear_atr_max_pct': 0.048322999559908854, 'bear_tp_mult': 2.243437024594412, 'bear_tsl_mult': 0.19279485686778125, 'bear_time_stop': 175, 'bear_use_sma': True, 'bear_use_ema': False, 'bear_use_atr': True, 'bear_use_adx': True, 'bear_use_spike': False, 'bear_rsi_required': True, 'sideways_strategy': 'breakout', 'sideways_bb_std_mult': 1.6029630988102026, 'sideways_rsi_os': 12, 'sideways_rsi_ob': 70, 'sideways_adx_thresh': 24.912361251761315, 'sideways_atr_min_pct': 0.0007698303895688225, 'sideways_atr_max_pct': 0.09757511529079747, 'sideways_tp_mult': 1.2575416902006449, 'sideways_tsl_mult': 0.26845236955273244, 'sideways_time_stop': 174, 'sideways_use_sma': True, 'sideways_use_ema': False, 'sideways_use_atr': True, 'sideways_use_adx': False, 'sideways_use_spike': False, 'sideways_rsi_required': True}.
[I 2025-09-01 15:04:46,443] Trial 814 finished with values: [-0.032157569932194874, 0.03214677657209022] and parameters: {'p_sma': 52, 'p_std': 44, 'p_atr': 26, 'p_adx': 13, 'rsi_period': 70, 'ema1': 20, 'ema2': 36, 'slip_atr_k': 0.00910983946281953, 'slip_spread_k': 0.5487149583394906, 'spread_hl_frac': 0.039748587800581686, 'bb_std_mult': 1.15909708555602, 'rsi_os': 41, 'rsi_ob': 82, 'vol_spike': 0.06808710753291145, 'adx_thresh': 25.567251732512766, 'atr_min_pct': 0.02640954834838112, 'atr_max_pct': 0.14746726153836398, 'tp_mult': 1.9399546609002163, 'tsl_mult': 0.6107479585743093, 'strategy': 'mean_reversion', 'time_stop': 230, 'use_sma': False, 'use_atr': False, 'use_adx': False, 'use_ema': True, 'use_spike': True, 'rsi_required': False, 'edge_k': 0.9323775555241883, 'edge_cap': 0.3632370481989348, 'bull_strategy': 'mean_reversion', 'bull_bb_std_mult': 3.190339121920873, 'bull_rsi_os': 32, 'bull_rsi_ob': 55, 'bull_adx_thresh': 32.95286735549023, 'bull_atr_min_pct': 0.005506756942472168, 'bull_atr_max_pct': 0.14957302921354282, 'bull_tp_mult': 1.1825474120160653, 'bull_tsl_mult': 0.4651741058045525, 'bull_time_stop': 89, 'bull_use_sma': True, 'bull_use_ema': True, 'bull_use_atr': False, 'bull_use_adx': False, 'bull_use_spike': False, 'bull_rsi_required': False, 'bear_strategy': 'breakout', 'bear_bb_std_mult': 3.30346924380346, 'bear_rsi_os': 37, 'bear_rsi_ob': 93, 'bear_adx_thresh': 19.09035507840895, 'bear_atr_min_pct': 0.0029245895435060895, 'bear_atr_max_pct': 0.0694844411043049, 'bear_tp_mult': 1.2755687958323632, 'bear_tsl_mult': 0.8274790461395793, 'bear_time_stop': 231, 'bear_use_sma': True, 'bear_use_ema': False, 'bear_use_atr': False, 'bear_use_adx': True, 'bear_use_spike': False, 'bear_rsi_required': True, 'sideways_strategy': 'breakout', 'sideways_bb_std_mult': 1.6411326162988507, 'sideways_rsi_os': 25, 'sideways_rsi_ob': 66, 'sideways_adx_thresh': 6.359376860763836, 'sideways_atr_min_pct': 0.0196904590528118, 'sideways_atr_max_pct': 0.13690258117259013, 'sideways_tp_mult': 2.6370992987525863, 'sideways_tsl_mult': 0.26472850860050956, 'sideways_time_stop': 174, 'sideways_use_sma': True, 'sideways_use_ema': False, 'sideways_use_atr': True, 'sideways_use_adx': False, 'sideways_use_spike': False, 'sideways_rsi_required': True}.
[I 2025-09-01 15:05:25,233] Trial 818 finished with values: [-1000000000.0, 1000000000.0] and parameters: {'p_sma': 34, 'p_std': 41, 'p_atr': 26, 'p_adx': 12, 'rsi_period': 84, 'ema1': 28, 'ema2': 54, 'slip_atr_k': 0.0321318617225798, 'slip_spread_k': 0.17836789445053314, 'spread_hl_frac': 0.03783501377863313, 'bb_std_mult': 1.783492337304431, 'rsi_os': 37, 'rsi_ob': 66, 'vol_spike': 0.2648985694264894, 'adx_thresh': 10.50629831273697, 'atr_min_pct': 0.026329268542746555, 'atr_max_pct': 0.11576505081038817, 'tp_mult': 1.9294651866876678, 'tsl_mult': 0.7171170277672658, 'strategy': 'mean_reversion', 'time_stop': 125, 'use_sma': True, 'use_atr': False, 'use_adx': False, 'use_ema': False, 'use_spike': True, 'rsi_required': True, 'edge_k': 1.7724971643187155, 'edge_cap': 0.38524611983523166, 'bull_strategy': 'breakout', 'bull_bb_std_mult': 3.3293998210605844, 'bull_rsi_os': 38, 'bull_rsi_ob': 68, 'bull_adx_thresh': 14.544600699909417, 'bull_atr_min_pct': 0.014817853292678602, 'bull_atr_max_pct': 0.027690171529383287, 'bull_tp_mult': 2.7186266240517756, 'bull_tsl_mult': 0.9107976622553104, 'bull_time_stop': 76, 'bull_use_sma': True, 'bull_use_ema': False, 'bull_use_atr': True, 'bull_use_adx': True, 'bull_use_spike': False, 'bull_rsi_required': True, 'bear_strategy': 'breakout', 'bear_bb_std_mult': 3.4213140243229123, 'bear_rsi_os': 33, 'bear_rsi_ob': 67, 'bear_adx_thresh': 16.08251251913209, 'bear_atr_min_pct': 0.0027946355700831007, 'bear_atr_max_pct': 0.02274436932058419, 'bear_tp_mult': 1.9482474037966042, 'bear_tsl_mult': 0.13946392915663125, 'bear_time_stop': 232, 'bear_use_sma': True, 'bear_use_ema': True, 'bear_use_atr': False, 'bear_use_adx': False, 'bear_use_spike': False, 'bear_rsi_required': True, 'sideways_strategy': 'mean_reversion', 'sideways_bb_std_mult': 1.521343330916373, 'sideways_rsi_os': 51, 'sideways_rsi_ob': 68, 'sideways_adx_thresh': 6.459341084512806, 'sideways_atr_min_pct': 0.020123606179510842, 'sideways_atr_max_pct': 0.0709982628045437, 'sideways_tp_mult': 2.729532007194186, 'sideways_tsl_mult': 0.2986307421956894, 'sideways_time_stop': 175, 'sideways_use_sma': True, 'sideways_use_ema': False, 'sideways_use_atr': True, 'sideways_use_adx': True, 'sideways_use_spike': False, 'sideways_rsi_required': True}.
[I 2025-09-01 15:05:25,725] Trial 819 finished with values: [-0.03763486584202724, 0.03800800718489825] and parameters: {'p_sma': 34, 'p_std': 48, 'p_atr': 18, 'p_adx': 12, 'rsi_period': 28, 'ema1': 28, 'ema2': 20, 'slip_atr_k': 0.003828607977067938, 'slip_spread_k': 0.1766482141935555, 'spread_hl_frac': 0.03085334695872055, 'bb_std_mult': 1.555729822581541, 'rsi_os': 26, 'rsi_ob': 66, 'vol_spike': 0.23968078595337267, 'adx_thresh': 23.421405312632988, 'atr_min_pct': 0.02520348697547314, 'atr_max_pct': 0.031210133879587855, 'tp_mult': 1.079634351026923, 'tsl_mult': 0.5767085986909296, 'strategy': 'breakout', 'time_stop': 243, 'use_sma': True, 'use_atr': True, 'use_adx': False, 'use_ema': False, 'use_spike': False, 'rsi_required': True, 'edge_k': 0.8493652540607106, 'edge_cap': 0.3890339164090418, 'bull_strategy': 'breakout', 'bull_bb_std_mult': 3.337007177351334, 'bull_rsi_os': 38, 'bull_rsi_ob': 52, 'bull_adx_thresh': 6.868165796726261, 'bull_atr_min_pct': 0.0150319856496512, 'bull_atr_max_pct': 0.014251852318978936, 'bull_tp_mult': 2.8591725081741157, 'bull_tsl_mult': 0.5352653126387716, 'bull_time_stop': 149, 'bull_use_sma': True, 'bull_use_ema': False, 'bull_use_atr': True, 'bull_use_adx': True, 'bull_use_spike': False, 'bull_rsi_required': True, 'bear_strategy': 'breakout', 'bear_bb_std_mult': 3.596573670773186, 'bear_rsi_os': 33, 'bear_rsi_ob': 84, 'bear_adx_thresh': 11.390389522058525, 'bear_atr_min_pct': 0.002014259595903345, 'bear_atr_max_pct': 0.14469287308955148, 'bear_tp_mult': 1.4127648175246628, 'bear_tsl_mult': 0.04713494468135998, 'bear_time_stop': 225, 'bear_use_sma': False, 'bear_use_ema': True, 'bear_use_atr': True, 'bear_use_adx': False, 'bear_use_spike': False, 'bear_rsi_required': False, 'sideways_strategy': 'mean_reversion', 'sideways_bb_std_mult': 1.4942614409304535, 'sideways_rsi_os': 28, 'sideways_rsi_ob': 68, 'sideways_adx_thresh': 12.35439676863961, 'sideways_atr_min_pct': 0.02041907286575346, 'sideways_atr_max_pct': 0.14975590662242255, 'sideways_tp_mult': 2.740038295592766, 'sideways_tsl_mult': 0.48156938689882933, 'sideways_time_stop': 163, 'sideways_use_sma': False, 'sideways_use_ema': False, 'sideways_use_atr': True, 'sideways_use_adx': True, 'sideways_use_spike': False, 'sideways_rsi_required': True}.
[I 2025-09-01 15:05:27,642] Trial 817 finished with values: [-1000000000.0, 1000000000.0] and parameters: {'p_sma': 34, 'p_std': 39, 'p_atr': 13, 'p_adx': 12, 'rsi_period': 28, 'ema1': 8, 'ema2': 12, 'slip_atr_k': 0.02256601376864114, 'slip_spread_k': 0.07423377148195315, 'spread_hl_frac': 0.038676255619907104, 'bb_std_mult': 1.7965698720907581, 'rsi_os': 41, 'rsi_ob': 52, 'vol_spike': 0.0139679366401039, 'adx_thresh': 16.074261027850458, 'atr_min_pct': 0.026518615539407563, 'atr_max_pct': 0.03142309390463419, 'tp_mult': 1.0684792272360808, 'tsl_mult': 0.07928380126534146, 'strategy': 'mean_reversion', 'time_stop': 106, 'use_sma': True, 'use_atr': False, 'use_adx': False, 'use_ema': True, 'use_spike': True, 'rsi_required': False, 'edge_k': 0.8584344667860269, 'edge_cap': 0.36078104769516145, 'bull_strategy': 'breakout', 'bull_bb_std_mult': 3.4435330383112204, 'bull_rsi_os': 32, 'bull_rsi_ob': 53, 'bull_adx_thresh': 32.915344904100834, 'bull_atr_min_pct': 0.01375010168361156, 'bull_atr_max_pct': 0.031428172979867844, 'bull_tp_mult': 1.0522128674699347, 'bull_tsl_mult': 0.5464056895375149, 'bull_time_stop': 78, 'bull_use_sma': True, 'bull_use_ema': True, 'bull_use_atr': True, 'bull_use_adx': True, 'bull_use_spike': False, 'bull_rsi_required': True, 'bear_strategy': 'breakout', 'bear_bb_std_mult': 3.408798828995665, 'bear_rsi_os': 23, 'bear_rsi_ob': 84, 'bear_adx_thresh': 11.219955962247841, 'bear_atr_min_pct': 0.029007044314401577, 'bear_atr_max_pct': 0.04499349689751714, 'bear_tp_mult': 1.288470743556937, 'bear_tsl_mult': 0.5882665032384226, 'bear_time_stop': 232, 'bear_use_sma': True, 'bear_use_ema': True, 'bear_use_atr': False, 'bear_use_adx': False, 'bear_use_spike': False, 'bear_rsi_required': True, 'sideways_strategy': 'mean_reversion', 'sideways_bb_std_mult': 3.1297155568416835, 'sideways_rsi_os': 42, 'sideways_rsi_ob': 67, 'sideways_adx_thresh': 9.163414928521417, 'sideways_atr_min_pct': 0.0029889418936368834, 'sideways_atr_max_pct': 0.07360035701973637, 'sideways_tp_mult': 2.6477596727659067, 'sideways_tsl_mult': 0.4812123086793356, 'sideways_time_stop': 175, 'sideways_use_sma': True, 'sideways_use_ema': False, 'sideways_use_atr': True, 'sideways_use_adx': True, 'sideways_use_spike': False, 'sideways_rsi_required': True}.
