[I 2025-09-01 13:09:32,158] Trial 46 finished with values: [-1000000000.0, 1000000000.0] and parameters: {'p_sma': 57, 'p_std': 55, 'p_atr': 27, 'p_adx': 12, 'rsi_period': 44, 'ema1': 26, 'ema2': 55, 'slip_atr_k': 0.11082803873958133, 'slip_spread_k': 0.16807857405046983, 'spread_hl_frac': 0.029784237405547163, 'bb_std_mult': 2.3665322920095635, 'rsi_os': 55, 'rsi_ob': 92, 'vol_spike': 0.08562254548636838, 'adx_thresh': 9.398398388682715, 'atr_min_pct': 0.02877872025240326, 'atr_max_pct': 0.07944034123970606, 'tp_mult': 2.886874997026944, 'tsl_mult': 0.80271127819043, 'strategy': 'breakout', 'time_stop': 190, 'use_sma': True, 'use_atr': True, 'use_adx': True, 'use_ema': False, 'use_spike': False, 'rsi_required': True, 'edge_k': 0.14139008368259032, 'edge_cap': 0.4695139575352355, 'bull_strategy': 'mean_reversion', 'bull_bb_std_mult': 3.436129726445456, 'bull_rsi_os': 51, 'bull_rsi_ob': 63, 'bull_adx_thresh': 34.59571851925194, 'bull_atr_min_pct': 0.008115031653093048, 'bull_atr_max_pct': 0.12795337827239356, 'bull_tp_mult': 2.0708393166806425, 'bull_tsl_mult': 0.20194781914198362, 'bull_time_stop': 95, 'bull_use_sma': True, 'bull_use_ema': True, 'bull_use_atr': False, 'bull_use_adx': False, 'bull_use_spike': False, 'bull_rsi_required': True, 'bear_strategy': 'mean_reversion', 'bear_bb_std_mult': 1.8706938056314817, 'bear_rsi_os': 9, 'bear_rsi_ob': 72, 'bear_adx_thresh': 23.942100529856226, 'bear_atr_min_pct': 0.017190067231629802, 'bear_atr_max_pct': 0.03820640961010692, 'bear_tp_mult': 2.7990411884488733, 'bear_tsl_mult': 0.11348331472033057, 'bear_time_stop': 146, 'bear_use_sma': True, 'bear_use_ema': True, 'bear_use_atr': False, 'bear_use_adx': True, 'bear_use_spike': False, 'bear_rsi_required': False, 'sideways_strategy': 'breakout', 'sideways_bb_std_mult': 1.6748224407986514, 'sideways_rsi_os': 20, 'sideways_rsi_ob': 69, 'sideways_adx_thresh': 22.854822224944378, 'sideways_atr_min_pct': 0.0025481982659498613, 'sideways_atr_max_pct': 0.06790787024847965, 'sideways_tp_mult': 1.8548736526943628, 'sideways_tsl_mult': 0.4267168755754237, 'sideways_time_stop': 31, 'sideways_use_sma': False, 'sideways_use_ema': False, 'sideways_use_atr': True, 'sideways_use_adx': False, 'sideways_use_spike': True, 'sideways_rsi_required': True}.
[I 2025-09-01 13:09:32,169] Trial 45 finished with values: [-1000000000.0, 1000000000.0] and parameters: {'p_sma': 22, 'p_std': 53, 'p_atr': 27, 'p_adx': 13, 'rsi_period': 53, 'ema1': 27, 'ema2': 55, 'slip_atr_k': 0.1132200721890585, 'slip_spread_k': 0.43275670745598227, 'spread_hl_frac': 0.03545844939611569, 'bb_std_mult': 2.3325654221782415, 'rsi_os': 55, 'rsi_ob': 91, 'vol_spike': 0.03897413569819899, 'adx_thresh': 8.670866988693804, 'atr_min_pct': 0.028565192287200197, 'atr_max_pct': 0.048923484327137896, 'tp_mult': 2.626797818833358, 'tsl_mult': 0.8108235738872679, 'strategy': 'breakout', 'time_stop': 189, 'use_sma': True, 'use_atr': True, 'use_adx': True, 'use_ema': False, 'use_spike': False, 'rsi_required': True, 'edge_k': 0.16438797634323266, 'edge_cap': 0.46797402300737456, 'bull_strategy': 'mean_reversion', 'bull_bb_std_mult': 3.3250360653787716, 'bull_rsi_os': 45, 'bull_rsi_ob': 63, 'bull_adx_thresh': 22.475382362514615, 'bull_atr_min_pct': 0.007598117340094251, 'bull_atr_max_pct': 0.12801999318595797, 'bull_tp_mult': 2.094610999984533, 'bull_tsl_mult': 0.2153400236250618, 'bull_time_stop': 65, 'bull_use_sma': True, 'bull_use_ema': True, 'bull_use_atr': False, 'bull_use_adx': False, 'bull_use_spike': False, 'bull_rsi_required': True, 'bear_strategy': 'mean_reversion', 'bear_bb_std_mult': 1.827286973038006, 'bear_rsi_os': 9, 'bear_rsi_ob': 70, 'bear_adx_thresh': 25.564571823755152, 'bear_atr_min_pct': 0.016805779494931797, 'bear_atr_max_pct': 0.029845460193964064, 'bear_tp_mult': 2.7357313595683257, 'bear_tsl_mult': 0.05081337738052234, 'bear_time_stop': 100, 'bear_use_sma': True, 'bear_use_ema': True, 'bear_use_atr': False, 'bear_use_adx': True, 'bear_use_spike': False, 'bear_rsi_required': False, 'sideways_strategy': 'breakout', 'sideways_bb_std_mult': 1.65780019116089, 'sideways_rsi_os': 20, 'sideways_rsi_ob': 68, 'sideways_adx_thresh': 22.971839443681798, 'sideways_atr_min_pct': 0.0021306363437304564, 'sideways_atr_max_pct': 0.11198819667047705, 'sideways_tp_mult': 2.104667345108766, 'sideways_tsl_mult': 0.6828866813566894, 'sideways_time_stop': 35, 'sideways_use_sma': False, 'sideways_use_ema': False, 'sideways_use_atr': True, 'sideways_use_adx': False, 'sideways_use_spike': True, 'sideways_rsi_required': True}.
[I 2025-09-01 13:09:32,639] Trial 48 finished with values: [-1000000000.0, 1000000000.0] and parameters: {'p_sma': 55, 'p_std': 53, 'p_atr': 25, 'p_adx': 11, 'rsi_period': 45, 'ema1': 27, 'ema2': 55, 'slip_atr_k': 0.11299543346562496, 'slip_spread_k': 0.14109771692909712, 'spread_hl_frac': 0.02794904715314336, 'bb_std_mult': 2.343148592473365, 'rsi_os': 53, 'rsi_ob': 90, 'vol_spike': 0.028946407429447374, 'adx_thresh': 14.928605106846419, 'atr_min_pct': 0.028314141289955554, 'atr_max_pct': 0.045820052961188996, 'tp_mult': 2.591174036836524, 'tsl_mult': 0.8180783544729998, 'strategy': 'breakout', 'time_stop': 193, 'use_sma': True, 'use_atr': True, 'use_adx': True, 'use_ema': False, 'use_spike': False, 'rsi_required': True, 'edge_k': 0.15476469633172307, 'edge_cap': 0.4712399719832003, 'bull_strategy': 'mean_reversion', 'bull_bb_std_mult': 3.5853206658225747, 'bull_rsi_os': 45, 'bull_rsi_ob': 68, 'bull_adx_thresh': 21.06997197615739, 'bull_atr_min_pct': 0.02610504411314099, 'bull_atr_max_pct': 0.14786886080973116, 'bull_tp_mult': 2.0999694897779415, 'bull_tsl_mult': 0.17047111722262714, 'bull_time_stop': 61, 'bull_use_sma': True, 'bull_use_ema': True, 'bull_use_atr': False, 'bull_use_adx': False, 'bull_use_spike': False, 'bull_rsi_required': False, 'bear_strategy': 'breakout', 'bear_bb_std_mult': 1.8523048132836473, 'bear_rsi_os': 9, 'bear_rsi_ob': 69, 'bear_adx_thresh': 24.29086557757373, 'bear_atr_min_pct': 0.01339489056513153, 'bear_atr_max_pct': 0.043883224565918984, 'bear_tp_mult': 2.751542679539005, 'bear_tsl_mult': 0.08120409320978489, 'bear_time_stop': 96, 'bear_use_sma': False, 'bear_use_ema': True, 'bear_use_atr': False, 'bear_use_adx': True, 'bear_use_spike': False, 'bear_rsi_required': False, 'sideways_strategy': 'breakout', 'sideways_bb_std_mult': 1.1966119363409684, 'sideways_rsi_os': 18, 'sideways_rsi_ob': 69, 'sideways_adx_thresh': 16.45081514913681, 'sideways_atr_min_pct': 0.00232629034255836, 'sideways_atr_max_pct': 0.11651731815026302, 'sideways_tp_mult': 2.1406294896717686, 'sideways_tsl_mult': 0.3418449440168677, 'sideways_time_stop': 84, 'sideways_use_sma': False, 'sideways_use_ema': False, 'sideways_use_atr': True, 'sideways_use_adx': True, 'sideways_use_spike': True, 'sideways_rsi_required': True}.
[I 2025-09-01 13:09:32,962] Trial 47 finished with values: [-1000000000.0, 1000000000.0] and parameters: {'p_sma': 60, 'p_std': 54, 'p_atr': 27, 'p_adx': 11, 'rsi_period': 49, 'ema1': 27, 'ema2': 55, 'slip_atr_k': 0.11324582213749193, 'slip_spread_k': 0.1531414499601515, 'spread_hl_frac': 0.030455865348790124, 'bb_std_mult': 2.419641267202311, 'rsi_os': 54, 'rsi_ob': 90, 'vol_spike': 0.037073209413859796, 'adx_thresh': 8.243934302459628, 'atr_min_pct': 0.027754126558723693, 'atr_max_pct': 0.04981911415831601, 'tp_mult': 2.9969301823805354, 'tsl_mult': 0.806279145672565, 'strategy': 'breakout', 'time_stop': 205, 'use_sma': True, 'use_atr': True, 'use_adx': True, 'use_ema': False, 'use_spike': False, 'rsi_required': True, 'edge_k': 0.052686924980381855, 'edge_cap': 0.47061787677241534, 'bull_strategy': 'mean_reversion', 'bull_bb_std_mult': 3.526226742004584, 'bull_rsi_os': 44, 'bull_rsi_ob': 62, 'bull_adx_thresh': 31.245200249646388, 'bull_atr_min_pct': 0.026190398013275155, 'bull_atr_max_pct': 0.1475059202976248, 'bull_tp_mult': 2.0757532963808276, 'bull_tsl_mult': 0.19943431907008985, 'bull_time_stop': 66, 'bull_use_sma': True, 'bull_use_ema': True, 'bull_use_atr': False, 'bull_use_adx': False, 'bull_use_spike': False, 'bull_rsi_required': True, 'bear_strategy': 'mean_reversion', 'bear_bb_std_mult': 1.4445838818071066, 'bear_rsi_os': 10, 'bear_rsi_ob': 72, 'bear_adx_thresh': 23.86438000807621, 'bear_atr_min_pct': 0.01272764111763252, 'bear_atr_max_pct': 0.04119965462270196, 'bear_tp_mult': 2.766953369051921, 'bear_tsl_mult': 0.107673397335951, 'bear_time_stop': 98, 'bear_use_sma': True, 'bear_use_ema': True, 'bear_use_atr': False, 'bear_use_adx': True, 'bear_use_spike': False, 'bear_rsi_required': False, 'sideways_strategy': 'breakout', 'sideways_bb_std_mult': 1.6410801192187032, 'sideways_rsi_os': 20, 'sideways_rsi_ob': 68, 'sideways_adx_thresh': 22.839488633377766, 'sideways_atr_min_pct': 0.002238367104412751, 'sideways_atr_max_pct': 0.11515283889124595, 'sideways_tp_mult': 2.118714884426521, 'sideways_tsl_mult': 0.6838790134101425, 'sideways_time_stop': 41, 'sideways_use_sma': False, 'sideways_use_ema': False, 'sideways_use_atr': True, 'sideways_use_adx': False, 'sideways_use_spike': True, 'sideways_rsi_required': True}.
[I 2025-09-01 13:09:33,287] Trial 49 finished with values: [-1000000000.0, 1000000000.0] and parameters: {'p_sma': 22, 'p_std': 56, 'p_atr': 25, 'p_adx': 15, 'rsi_period': 49, 'ema1': 24, 'ema2': 32, 'slip_atr_k': 0.0432050045674994, 'slip_spread_k': 0.6431532624175638, 'spread_hl_frac': 0.03196660530790528, 'bb_std_mult': 2.066609348519932, 'rsi_os': 52, 'rsi_ob': 84, 'vol_spike': 0.04241013862858512, 'adx_thresh': 7.529783291283557, 'atr_min_pct': 0.026741559554187725, 'atr_max_pct': 0.05064294397013608, 'tp_mult': 2.616882629874283, 'tsl_mult': 0.8773560238242466, 'strategy': 'mean_reversion', 'time_stop': 167, 'use_sma': True, 'use_atr': True, 'use_adx': True, 'use_ema': False, 'use_spike': False, 'rsi_required': True, 'edge_k': 1.762325626681108, 'edge_cap': 0.3323685415941488, 'bull_strategy': 'mean_reversion', 'bull_bb_std_mult': 3.592592854712832, 'bull_rsi_os': 43, 'bull_rsi_ob': 73, 'bull_adx_thresh': 20.725674831511196, 'bull_atr_min_pct': 0.024837132006831693, 'bull_atr_max_pct': 0.1480560980889698, 'bull_tp_mult': 1.9263705712646888, 'bull_tsl_mult': 0.5006440996266965, 'bull_time_stop': 253, 'bull_use_sma': True, 'bull_use_ema': False, 'bull_use_atr': False, 'bull_use_adx': True, 'bull_use_spike': False, 'bull_rsi_required': False, 'bear_strategy': 'breakout', 'bear_bb_std_mult': 1.47313602310222, 'bear_rsi_os': 13, 'bear_rsi_ob': 57, 'bear_adx_thresh': 23.95798646797935, 'bear_atr_min_pct': 0.013620693546057425, 'bear_atr_max_pct': 0.08515419037065819, 'bear_tp_mult': 2.6227398594648372, 'bear_tsl_mult': 0.12353191371228846, 'bear_time_stop': 178, 'bear_use_sma': False, 'bear_use_ema': True, 'bear_use_atr': False, 'bear_use_adx': True, 'bear_use_spike': False, 'bear_rsi_required': False, 'sideways_strategy': 'breakout', 'sideways_bb_std_mult': 3.40660315324976, 'sideways_rsi_os': 27, 'sideways_rsi_ob': 74, 'sideways_adx_thresh': 26.772299192804475, 'sideways_atr_min_pct': 0.004998425806394565, 'sideways_atr_max_pct': 0.03944849020830712, 'sideways_tp_mult': 1.9751068580837188, 'sideways_tsl_mult': 0.3188773442466928, 'sideways_time_stop': 89, 'sideways_use_sma': False, 'sideways_use_ema': False, 'sideways_use_atr': True, 'sideways_use_adx': True, 'sideways_use_spike': True, 'sideways_rsi_required': True}.
[I 2025-09-01 13:09:33,322] Trial 51 finished with values: [-1000000000.0, 1000000000.0] and parameters: {'p_sma': 15, 'p_std': 56, 'p_atr': 23, 'p_adx': 21, 'rsi_period': 9, 'ema1': 30, 'ema2': 32, 'slip_atr_k': 0.001689123908621984, 'slip_spread_k': 0.646862011252007, 'spread_hl_frac': 0.03293000096972998, 'bb_std_mult': 2.100039366211396, 'rsi_os': 46, 'rsi_ob': 83, 'vol_spike': 0.0014066701619029065, 'adx_thresh': 7.636079988684347, 'atr_min_pct': 0.022831047006963288, 'atr_max_pct': 0.017649547093117245, 'tp_mult': 2.943212447687386, 'tsl_mult': 0.883041403045137, 'strategy': 'mean_reversion', 'time_stop': 113, 'use_sma': False, 'use_atr': False, 'use_adx': False, 'use_ema': False, 'use_spike': False, 'rsi_required': True, 'edge_k': 0.02514794242807028, 'edge_cap': 0.3242273471369178, 'bull_strategy': 'breakout', 'bull_bb_std_mult': 2.969201929094459, 'bull_rsi_os': 38, 'bull_rsi_ob': 73, 'bull_adx_thresh': 15.970151931619425, 'bull_atr_min_pct': 0.021640162428433453, 'bull_atr_max_pct': 0.1159139617358229, 'bull_tp_mult': 1.9796059495985627, 'bull_tsl_mult': 0.4196967562578289, 'bull_time_stop': 122, 'bull_use_sma': True, 'bull_use_ema': False, 'bull_use_atr': False, 'bull_use_adx': True, 'bull_use_spike': False, 'bull_rsi_required': False, 'bear_strategy': 'breakout', 'bear_bb_std_mult': 1.4968295286928943, 'bear_rsi_os': 12, 'bear_rsi_ob': 57, 'bear_adx_thresh': 34.48241684994959, 'bear_atr_min_pct': 0.023653462182513484, 'bear_atr_max_pct': 0.1337600550275619, 'bear_tp_mult': 2.5896184758819496, 'bear_tsl_mult': 0.1786161952016928, 'bear_time_stop': 179, 'bear_use_sma': False, 'bear_use_ema': True, 'bear_use_atr': False, 'bear_use_adx': True, 'bear_use_spike': False, 'bear_rsi_required': False, 'sideways_strategy': 'mean_reversion', 'sideways_bb_std_mult': 3.4004199249743294, 'sideways_rsi_os': 28, 'sideways_rsi_ob': 64, 'sideways_adx_thresh': 31.537399790624896, 'sideways_atr_min_pct': 0.0002245415283777981, 'sideways_atr_max_pct': 0.1265355870106205, 'sideways_tp_mult': 2.0219498750059945, 'sideways_tsl_mult': 0.2556915044698618, 'sideways_time_stop': 8, 'sideways_use_sma': False, 'sideways_use_ema': False, 'sideways_use_atr': True, 'sideways_use_adx': True, 'sideways_use_spike': True, 'sideways_rsi_required': True}.
[I 2025-09-01 13:09:33,341] Trial 50 finished with values: [-1000000000.0, 1000000000.0] and parameters: {'p_sma': 14, 'p_std': 55, 'p_atr': 25, 'p_adx': 15, 'rsi_period': 50, 'ema1': 24, 'ema2': 33, 'slip_atr_k': 0.04582089825466315, 'slip_spread_k': 0.6518300192850827, 'spread_hl_frac': 0.03213204661005902, 'bb_std_mult': 2.076987678996149, 'rsi_os': 52, 'rsi_ob': 82, 'vol_spike': 0.048106367604707094, 'adx_thresh': 6.491306492062394, 'atr_min_pct': 0.027271331402767544, 'atr_max_pct': 0.04920216846947069, 'tp_mult': 2.4058689875067256, 'tsl_mult': 0.8839156095924616, 'strategy': 'mean_reversion', 'time_stop': 144, 'use_sma': True, 'use_atr': True, 'use_adx': True, 'use_ema': False, 'use_spike': False, 'rsi_required': True, 'edge_k': 0.007450272236735944, 'edge_cap': 0.3039741552407236, 'bull_strategy': 'mean_reversion', 'bull_bb_std_mult': 3.5624627082802762, 'bull_rsi_os': 44, 'bull_rsi_ob': 79, 'bull_adx_thresh': 21.009567106767754, 'bull_atr_min_pct': 0.023156806299628983, 'bull_atr_max_pct': 0.14915707207842827, 'bull_tp_mult': 1.9242385017641417, 'bull_tsl_mult': 0.15582840173557, 'bull_time_stop': 50, 'bull_use_sma': True, 'bull_use_ema': False, 'bull_use_atr': False, 'bull_use_adx': True, 'bull_use_spike': False, 'bull_rsi_required': False, 'bear_strategy': 'breakout', 'bear_bb_std_mult': 3.0767946199088447, 'bear_rsi_os': 13, 'bear_rsi_ob': 57, 'bear_adx_thresh': 23.499208765135844, 'bear_atr_min_pct': 0.01391279252132651, 'bear_atr_max_pct': 0.08420474043039072, 'bear_tp_mult': 2.611018224547749, 'bear_tsl_mult': 0.15570242277736174, 'bear_time_stop': 184, 'bear_use_sma': False, 'bear_use_ema': True, 'bear_use_atr': False, 'bear_use_adx': True, 'bear_use_spike': False, 'bear_rsi_required': False, 'sideways_strategy': 'breakout', 'sideways_bb_std_mult': 1.2097865629347377, 'sideways_rsi_os': 27, 'sideways_rsi_ob': 64, 'sideways_adx_thresh': 26.835543797373884, 'sideways_atr_min_pct': 0.0003859126734372222, 'sideways_atr_max_pct': 0.12804576111040522, 'sideways_tp_mult': 1.9767222802880688, 'sideways_tsl_mult': 0.3434919538814454, 'sideways_time_stop': 80, 'sideways_use_sma': False, 'sideways_use_ema': False, 'sideways_use_atr': True, 'sideways_use_adx': True, 'sideways_use_spike': True, 'sideways_rsi_required': True}.
[I 2025-09-01 13:10:11,899] Trial 52 finished with values: [-1000000000.0, 1000000000.0] and parameters: {'p_sma': 10, 'p_std': 12, 'p_atr': 24, 'p_adx': 15, 'rsi_period': 8, 'ema1': 30, 'ema2': 14, 'slip_atr_k': 0.08461893939228207, 'slip_spread_k': 0.36630452791638196, 'spread_hl_frac': 0.020962820570142367, 'bb_std_mult': 2.050534530972038, 'rsi_os': 46, 'rsi_ob': 83, 'vol_spike': 0.13014261487656364, 'adx_thresh': 6.357225604460386, 'atr_min_pct': 0.023202884784884838, 'atr_max_pct': 0.057595966249119813, 'tp_mult': 2.4054187413319292, 'tsl_mult': 0.6967111686196296, 'strategy': 'mean_reversion', 'time_stop': 142, 'use_sma': False, 'use_atr': False, 'use_adx': False, 'use_ema': False, 'use_spike': False, 'rsi_required': True, 'edge_k': 0.32796829702085084, 'edge_cap': 0.32280140347915975, 'bull_strategy': 'breakout', 'bull_bb_std_mult': 2.9108347987288923, 'bull_rsi_os': 39, 'bull_rsi_ob': 79, 'bull_adx_thresh': 16.06713659524294, 'bull_atr_min_pct': 0.01921989945490405, 'bull_atr_max_pct': 0.03465163814978217, 'bull_tp_mult': 1.029750976658638, 'bull_tsl_mult': 0.5226119812386626, 'bull_time_stop': 122, 'bull_use_sma': True, 'bull_use_ema': False, 'bull_use_atr': False, 'bull_use_adx': True, 'bull_use_spike': False, 'bull_rsi_required': False, 'bear_strategy': 'breakout', 'bear_bb_std_mult': 3.114077244343742, 'bear_rsi_os': 13, 'bear_rsi_ob': 57, 'bear_adx_thresh': 31.334227287324403, 'bear_atr_min_pct': 0.011000549346236985, 'bear_atr_max_pct': 0.12828067386915065, 'bear_tp_mult': 2.2239571817583594, 'bear_tsl_mult': 0.20171689611105714, 'bear_time_stop': 176, 'bear_use_sma': False, 'bear_use_ema': True, 'bear_use_atr': False, 'bear_use_adx': True, 'bear_use_spike': False, 'bear_rsi_required': False, 'sideways_strategy': 'mean_reversion', 'sideways_bb_std_mult': 2.3772273496600738, 'sideways_rsi_os': 9, 'sideways_rsi_ob': 58, 'sideways_adx_thresh': 26.970400159871456, 'sideways_atr_min_pct': 0.0298354072327811, 'sideways_atr_max_pct': 0.127009821952983, 'sideways_tp_mult': 1.9945006733050974, 'sideways_tsl_mult': 0.47637466917579596, 'sideways_time_stop': 103, 'sideways_use_sma': False, 'sideways_use_ema': True, 'sideways_use_atr': True, 'sideways_use_adx': True, 'sideways_use_spike': True, 'sideways_rsi_required': True}.
[I 2025-09-01 13:10:13,174] Trial 53 finished with values: [-1000000000.0, 1000000000.0] and parameters: {'p_sma': 16, 'p_std': 15, 'p_atr': 29, 'p_adx': 22, 'rsi_period': 11, 'ema1': 30, 'ema2': 20, 'slip_atr_k': 0.0006304528926342617, 'slip_spread_k': 0.40983263289832117, 'spread_hl_frac': 0.021755732664569483, 'bb_std_mult': 2.8137851121053488, 'rsi_os': 45, 'rsi_ob': 88, 'vol_spike': 9.888481273190308e-05, 'adx_thresh': 6.7780419601687925, 'atr_min_pct': 0.022753736987368336, 'atr_max_pct': 0.06931151752105814, 'tp_mult': 2.039632955897502, 'tsl_mult': 0.6922217137001591, 'strategy': 'mean_reversion', 'time_stop': 112, 'use_sma': False, 'use_atr': False, 'use_adx': False, 'use_ema': False, 'use_spike': False, 'rsi_required': True, 'edge_k': 0.3830867302159051, 'edge_cap': 0.5651656014278931, 'bull_strategy': 'breakout', 'bull_bb_std_mult': 2.8984420890922085, 'bull_rsi_os': 38, 'bull_rsi_ob': 80, 'bull_adx_thresh': 18.257675728026104, 'bull_atr_min_pct': 0.022308079894974134, 'bull_atr_max_pct': 0.11568370964681435, 'bull_tp_mult': 1.7587923353002521, 'bull_tsl_mult': 0.7485440191204592, 'bull_time_stop': 117, 'bull_use_sma': True, 'bull_use_ema': False, 'bull_use_atr': False, 'bull_use_adx': True, 'bull_use_spike': False, 'bull_rsi_required': False, 'bear_strategy': 'mean_reversion', 'bear_bb_std_mult': 3.0193561441768555, 'bear_rsi_os': 31, 'bear_rsi_ob': 57, 'bear_adx_thresh': 29.336122837011217, 'bear_atr_min_pct': 0.0235870709753195, 'bear_atr_max_pct': 0.053428831115728444, 'bear_tp_mult': 1.0211702063607933, 'bear_tsl_mult': 0.15749390254830126, 'bear_time_stop': 142, 'bear_use_sma': False, 'bear_use_ema': True, 'bear_use_atr': True, 'bear_use_adx': True, 'bear_use_spike': False, 'bear_rsi_required': False, 'sideways_strategy': 'mean_reversion', 'sideways_bb_std_mult': 2.0243969845370025, 'sideways_rsi_os': 11, 'sideways_rsi_ob': 57, 'sideways_adx_thresh': 33.202630850214625, 'sideways_atr_min_pct': 0.003600691113067828, 'sideways_atr_max_pct': 0.12807414599840677, 'sideways_tp_mult': 2.2423675399221112, 'sideways_tsl_mult': 0.19197686029361194, 'sideways_time_stop': 107, 'sideways_use_sma': False, 'sideways_use_ema': True, 'sideways_use_atr': True, 'sideways_use_adx': True, 'sideways_use_spike': True, 'sideways_rsi_required': False}.
