[I 2025-09-01 15:09:27,401] Trial 837 finished with values: [-1000000000.0, 1000000000.0] and parameters: {'p_sma': 36, 'p_std': 21, 'p_atr': 25, 'p_adx': 11, 'rsi_period': 36, 'ema1': 25, 'ema2': 29, 'slip_atr_k': 0.24343205689485561, 'slip_spread_k': 0.896721095599797, 'spread_hl_frac': 0.04650044116936487, 'bb_std_mult': 2.61627009600406, 'rsi_os': 40, 'rsi_ob': 82, 'vol_spike': 0.23843435899739335, 'adx_thresh': 23.828289608279608, 'atr_min_pct': 0.01442845564697455, 'atr_max_pct': 0.12551514029157126, 'tp_mult': 1.0495564901205094, 'tsl_mult': 0.7846568190227301, 'strategy': 'mean_reversion', 'time_stop': 82, 'use_sma': True, 'use_atr': False, 'use_adx': False, 'use_ema': True, 'use_spike': True, 'rsi_required': False, 'edge_k': 0.20031222138783178, 'edge_cap': 0.3588975282149724, 'bull_strategy': 'breakout', 'bull_bb_std_mult': 2.353098591019617, 'bull_rsi_os': 37, 'bull_rsi_ob': 56, 'bull_adx_thresh': 31.0796661084693, 'bull_atr_min_pct': 0.003896838730215591, 'bull_atr_max_pct': 0.11562526120902139, 'bull_tp_mult': 2.7569769754883477, 'bull_tsl_mult': 0.4843964259365992, 'bull_time_stop': 72, 'bull_use_sma': True, 'bull_use_ema': True, 'bull_use_atr': True, 'bull_use_adx': True, 'bull_use_spike': False, 'bull_rsi_required': True, 'bear_strategy': 'mean_reversion', 'bear_bb_std_mult': 2.435825222597401, 'bear_rsi_os': 34, 'bear_rsi_ob': 58, 'bear_adx_thresh': 6.017480622885746, 'bear_atr_min_pct': 0.00922833318665334, 'bear_atr_max_pct': 0.09756971361651079, 'bear_tp_mult': 1.858339908896479, 'bear_tsl_mult': 0.6841693342012506, 'bear_time_stop': 192, 'bear_use_sma': True, 'bear_use_ema': True, 'bear_use_atr': False, 'bear_use_adx': False, 'bear_use_spike': False, 'bear_rsi_required': True, 'sideways_strategy': 'breakout', 'sideways_bb_std_mult': 1.3460679647748526, 'sideways_rsi_os': 30, 'sideways_rsi_ob': 58, 'sideways_adx_thresh': 5.421085465770292, 'sideways_atr_min_pct': 0.02015122188074882, 'sideways_atr_max_pct': 0.0708380745591633, 'sideways_tp_mult': 2.966577165903834, 'sideways_tsl_mult': 0.26923953760261465, 'sideways_time_stop': 118, 'sideways_use_sma': True, 'sideways_use_ema': False, 'sideways_use_atr': True, 'sideways_use_adx': True, 'sideways_use_spike': False, 'sideways_rsi_required': True}.
[I 2025-09-01 15:09:28,991] Trial 839 finished with values: [-0.03573362804180635, 0.03533497415379284] and parameters: {'p_sma': 36, 'p_std': 50, 'p_atr': 25, 'p_adx': 19, 'rsi_period': 68, 'ema1': 20, 'ema2': 11, 'slip_atr_k': 0.02356694734146894, 'slip_spread_k': 0.8477200119879617, 'spread_hl_frac': 0.049165317319795426, 'bb_std_mult': 1.2979593559199565, 'rsi_os': 11, 'rsi_ob': 64, 'vol_spike': 0.22703265510492204, 'adx_thresh': 24.795382107029297, 'atr_min_pct': 0.02702137612365184, 'atr_max_pct': 0.1368470934720413, 'tp_mult': 1.7264782294553134, 'tsl_mult': 0.9131867424099673, 'strategy': 'mean_reversion', 'time_stop': 251, 'use_sma': True, 'use_atr': True, 'use_adx': False, 'use_ema': True, 'use_spike': False, 'rsi_required': False, 'edge_k': 0.9679527701380215, 'edge_cap': 0.33685346788497295, 'bull_strategy': 'breakout', 'bull_bb_std_mult': 3.0286407468022745, 'bull_rsi_os': 50, 'bull_rsi_ob': 56, 'bull_adx_thresh': 30.766224139255947, 'bull_atr_min_pct': 0.024223534440829968, 'bull_atr_max_pct': 0.017743044974673158, 'bull_tp_mult': 2.411088516428417, 'bull_tsl_mult': 0.9551059085358171, 'bull_time_stop': 157, 'bull_use_sma': False, 'bull_use_ema': True, 'bull_use_atr': True, 'bull_use_adx': True, 'bull_use_spike': True, 'bull_rsi_required': True, 'bear_strategy': 'breakout', 'bear_bb_std_mult': 3.496341810508434, 'bear_rsi_os': 35, 'bear_rsi_ob': 90, 'bear_adx_thresh': 11.757449139928587, 'bear_atr_min_pct': 0.001664388155353518, 'bear_atr_max_pct': 0.05125550376907254, 'bear_tp_mult': 2.7370725799904982, 'bear_tsl_mult': 0.18675363826313132, 'bear_time_stop': 221, 'bear_use_sma': False, 'bear_use_ema': True, 'bear_use_atr': True, 'bear_use_adx': True, 'bear_use_spike': True, 'bear_rsi_required': False, 'sideways_strategy': 'breakout', 'sideways_bb_std_mult': 1.4869487377727026, 'sideways_rsi_os': 22, 'sideways_rsi_ob': 66, 'sideways_adx_thresh': 7.98919324435867, 'sideways_atr_min_pct': 0.012519067252073466, 'sideways_atr_max_pct': 0.0708670833990014, 'sideways_tp_mult': 2.773662209676835, 'sideways_tsl_mult': 0.26957261544835, 'sideways_time_stop': 178, 'sideways_use_sma': False, 'sideways_use_ema': True, 'sideways_use_atr': False, 'sideways_use_adx': True, 'sideways_use_spike': True, 'sideways_rsi_required': False}.
[I 2025-09-01 15:09:29,653] Trial 838 finished with values: [-0.03265988163126332, 0.032448737275212344] and parameters: {'p_sma': 30, 'p_std': 37, 'p_atr': 25, 'p_adx': 11, 'rsi_period': 68, 'ema1': 30, 'ema2': 17, 'slip_atr_k': 0.2327436488915484, 'slip_spread_k': 0.3026820420032804, 'spread_hl_frac': 0.011615644529544299, 'bb_std_mult': 1.7893737548673367, 'rsi_os': 40, 'rsi_ob': 86, 'vol_spike': 0.22564127934984804, 'adx_thresh': 24.84496049182008, 'atr_min_pct': 0.006684976942646815, 'atr_max_pct': 0.1214753374029911, 'tp_mult': 1.564037600034945, 'tsl_mult': 0.39215822464835143, 'strategy': 'breakout', 'time_stop': 236, 'use_sma': True, 'use_atr': True, 'use_adx': False, 'use_ema': True, 'use_spike': False, 'rsi_required': False, 'edge_k': 0.17454463754839633, 'edge_cap': 0.3534870725145537, 'bull_strategy': 'breakout', 'bull_bb_std_mult': 3.041447358371748, 'bull_rsi_os': 16, 'bull_rsi_ob': 56, 'bull_adx_thresh': 15.966230711433992, 'bull_atr_min_pct': 0.0011183439212939707, 'bull_atr_max_pct': 0.028444783724510547, 'bull_tp_mult': 2.7782291249865216, 'bull_tsl_mult': 0.4869000182731804, 'bull_time_stop': 156, 'bull_use_sma': False, 'bull_use_ema': True, 'bull_use_atr': True, 'bull_use_adx': True, 'bull_use_spike': True, 'bull_rsi_required': True, 'bear_strategy': 'breakout', 'bear_bb_std_mult': 1.0383495206648734, 'bear_rsi_os': 36, 'bear_rsi_ob': 86, 'bear_adx_thresh': 11.925578553645106, 'bear_atr_min_pct': 0.015117949811534291, 'bear_atr_max_pct': 0.050284214447733726, 'bear_tp_mult': 1.8596435574276893, 'bear_tsl_mult': 0.9684399142032012, 'bear_time_stop': 218, 'bear_use_sma': False, 'bear_use_ema': True, 'bear_use_atr': True, 'bear_use_adx': True, 'bear_use_spike': True, 'bear_rsi_required': False, 'sideways_strategy': 'mean_reversion', 'sideways_bb_std_mult': 1.5829737228823866, 'sideways_rsi_os': 30, 'sideways_rsi_ob': 66, 'sideways_adx_thresh': 5.433253110605432, 'sideways_atr_min_pct': 0.007153477560462987, 'sideways_atr_max_pct': 0.07030198406553081, 'sideways_tp_mult': 2.7734438848880476, 'sideways_tsl_mult': 0.27243258459354275, 'sideways_time_stop': 101, 'sideways_use_sma': False, 'sideways_use_ema': True, 'sideways_use_atr': False, 'sideways_use_adx': True, 'sideways_use_spike': False, 'sideways_rsi_required': False}.
[I 2025-09-01 15:09:29,935] Trial 840 finished with values: [-0.025327779558960706, 0.025113038693133947] and parameters: {'p_sma': 54, 'p_std': 50, 'p_atr': 25, 'p_adx': 13, 'rsi_period': 69, 'ema1': 20, 'ema2': 17, 'slip_atr_k': 0.020313875925108107, 'slip_spread_k': 0.7423029230749902, 'spread_hl_frac': 0.04176902965159253, 'bb_std_mult': 0.5710649246404218, 'rsi_os': 39, 'rsi_ob': 82, 'vol_spike': 0.2281220217311941, 'adx_thresh': 26.38281183735659, 'atr_min_pct': 0.014479063356594768, 'atr_max_pct': 0.13666010600508424, 'tp_mult': 2.843526611628162, 'tsl_mult': 0.7764689943924851, 'strategy': 'mean_reversion', 'time_stop': 252, 'use_sma': False, 'use_atr': True, 'use_adx': False, 'use_ema': True, 'use_spike': False, 'rsi_required': False, 'edge_k': 0.1791989032438086, 'edge_cap': 0.35751503069607987, 'bull_strategy': 'breakout', 'bull_bb_std_mult': 3.5242288175750707, 'bull_rsi_os': 27, 'bull_rsi_ob': 65, 'bull_adx_thresh': 30.779456747425346, 'bull_atr_min_pct': 0.0009939151923572453, 'bull_atr_max_pct': 0.11555713689122082, 'bull_tp_mult': 1.4984173894808803, 'bull_tsl_mult': 0.31041669357504614, 'bull_time_stop': 93, 'bull_use_sma': False, 'bull_use_ema': True, 'bull_use_atr': True, 'bull_use_adx': False, 'bull_use_spike': True, 'bull_rsi_required': True, 'bear_strategy': 'breakout', 'bear_bb_std_mult': 1.0742487115431294, 'bear_rsi_os': 29, 'bear_rsi_ob': 87, 'bear_adx_thresh': 24.768655778010967, 'bear_atr_min_pct': 0.0015885336132117588, 'bear_atr_max_pct': 0.04239784693704633, 'bear_tp_mult': 2.193000862126136, 'bear_tsl_mult': 0.6477561396960596, 'bear_time_stop': 90, 'bear_use_sma': False, 'bear_use_ema': True, 'bear_use_atr': True, 'bear_use_adx': True, 'bear_use_spike': True, 'bear_rsi_required': False, 'sideways_strategy': 'breakout', 'sideways_bb_std_mult': 1.476076458724212, 'sideways_rsi_os': 49, 'sideways_rsi_ob': 92, 'sideways_adx_thresh': 7.698521101562516, 'sideways_atr_min_pct': 0.009338423323804487, 'sideways_atr_max_pct': 0.02190377110393016, 'sideways_tp_mult': 1.5796199368471193, 'sideways_tsl_mult': 0.26659070330788937, 'sideways_time_stop': 101, 'sideways_use_sma': False, 'sideways_use_ema': True, 'sideways_use_atr': False, 'sideways_use_adx': True, 'sideways_use_spike': True, 'sideways_rsi_required': False}.
[I 2025-09-01 15:10:17,588] Trial 844 finished with values: [-0.0806671674384517, 0.0800728955311759] and parameters: {'p_sma': 24, 'p_std': 22, 'p_atr': 9, 'p_adx': 16, 'rsi_period': 66, 'ema1': 21, 'ema2': 21, 'slip_atr_k': 0.13256097395321342, 'slip_spread_k': 0.4308130123159446, 'spread_hl_frac': 0.004777180130283943, 'bb_std_mult': 3.2757552150362024, 'rsi_os': 38, 'rsi_ob': 55, 'vol_spike': 0.2400238507034101, 'adx_thresh': 16.89896575978493, 'atr_min_pct': 0.01645779141018373, 'atr_max_pct': 0.13113701785237986, 'tp_mult': 1.1598885121529205, 'tsl_mult': 0.2740998232121357, 'strategy': 'mean_reversion', 'time_stop': 230, 'use_sma': False, 'use_atr': False, 'use_adx': True, 'use_ema': False, 'use_spike': True, 'rsi_required': True, 'edge_k': 0.9206829047986443, 'edge_cap': 0.30409396177438786, 'bull_strategy': 'breakout', 'bull_bb_std_mult': 1.611362248614516, 'bull_rsi_os': 33, 'bull_rsi_ob': 53, 'bull_adx_thresh': 31.931809606054053, 'bull_atr_min_pct': 0.002889386334367073, 'bull_atr_max_pct': 0.014575036006798187, 'bull_tp_mult': 2.6895143379877897, 'bull_tsl_mult': 0.4205150390475792, 'bull_time_stop': 106, 'bull_use_sma': True, 'bull_use_ema': False, 'bull_use_atr': True, 'bull_use_adx': False, 'bull_use_spike': False, 'bull_rsi_required': True, 'bear_strategy': 'breakout', 'bear_bb_std_mult': 1.362309791665338, 'bear_rsi_os': 38, 'bear_rsi_ob': 88, 'bear_adx_thresh': 28.775069728088614, 'bear_atr_min_pct': 0.002605276573410509, 'bear_atr_max_pct': 0.037963299968522705, 'bear_tp_mult': 2.239042348139961, 'bear_tsl_mult': 0.11586722586406173, 'bear_time_stop': 211, 'bear_use_sma': True, 'bear_use_ema': True, 'bear_use_atr': True, 'bear_use_adx': True, 'bear_use_spike': False, 'bear_rsi_required': True, 'sideways_strategy': 'breakout', 'sideways_bb_std_mult': 1.647743138311325, 'sideways_rsi_os': 50, 'sideways_rsi_ob': 86, 'sideways_adx_thresh': 6.834562538927401, 'sideways_atr_min_pct': 0.020872507911475074, 'sideways_atr_max_pct': 0.11003971184168004, 'sideways_tp_mult': 2.8163844599881465, 'sideways_tsl_mult': 0.713196912835203, 'sideways_time_stop': 259, 'sideways_use_sma': True, 'sideways_use_ema': False, 'sideways_use_atr': True, 'sideways_use_adx': True, 'sideways_use_spike': False, 'sideways_rsi_required': True}.
[I 2025-09-01 15:10:18,457] Trial 842 finished with values: [-1000000000.0, 1000000000.0] and parameters: {'p_sma': 42, 'p_std': 22, 'p_atr': 25, 'p_adx': 13, 'rsi_period': 50, 'ema1': 21, 'ema2': 21, 'slip_atr_k': 0.02033726498657029, 'slip_spread_k': 0.7415350504343493, 'spread_hl_frac': 0.004420785323952889, 'bb_std_mult': 1.101167454449554, 'rsi_os': 37, 'rsi_ob': 62, 'vol_spike': 0.2223586628015647, 'adx_thresh': 26.260474002341205, 'atr_min_pct': 0.006871049030416292, 'atr_max_pct': 0.09490881780787225, 'tp_mult': 1.306149337512596, 'tsl_mult': 0.3818963584228621, 'strategy': 'breakout', 'time_stop': 236, 'use_sma': False, 'use_atr': True, 'use_adx': True, 'use_ema': False, 'use_spike': False, 'rsi_required': True, 'edge_k': 0.9326305108946908, 'edge_cap': 0.31180418025392853, 'bull_strategy': 'breakout', 'bull_bb_std_mult': 2.6951678503968095, 'bull_rsi_os': 46, 'bull_rsi_ob': 88, 'bull_adx_thresh': 31.982975995126825, 'bull_atr_min_pct': 0.002960796832105133, 'bull_atr_max_pct': 0.013950743540986967, 'bull_tp_mult': 2.6780958634075906, 'bull_tsl_mult': 0.41439241021632855, 'bull_time_stop': 106, 'bull_use_sma': False, 'bull_use_ema': False, 'bull_use_atr': True, 'bull_use_adx': False, 'bull_use_spike': True, 'bull_rsi_required': True, 'bear_strategy': 'breakout', 'bear_bb_std_mult': 3.551135727624224, 'bear_rsi_os': 9, 'bear_rsi_ob': 87, 'bear_adx_thresh': 28.63983763503736, 'bear_atr_min_pct': 0.00245046772541937, 'bear_atr_max_pct': 0.038498112828859433, 'bear_tp_mult': 2.190665586935038, 'bear_tsl_mult': 0.11856601401769448, 'bear_time_stop': 239, 'bear_use_sma': False, 'bear_use_ema': True, 'bear_use_atr': True, 'bear_use_adx': True, 'bear_use_spike': True, 'bear_rsi_required': False, 'sideways_strategy': 'mean_reversion', 'sideways_bb_std_mult': 0.5021134483262808, 'sideways_rsi_os': 49, 'sideways_rsi_ob': 81, 'sideways_adx_thresh': 26.552373845803118, 'sideways_atr_min_pct': 0.022224633844538332, 'sideways_atr_max_pct': 0.02132670788198019, 'sideways_tp_mult': 1.577463898233767, 'sideways_tsl_mult': 0.34632834695055015, 'sideways_time_stop': 259, 'sideways_use_sma': False, 'sideways_use_ema': True, 'sideways_use_atr': False, 'sideways_use_adx': True, 'sideways_use_spike': False, 'sideways_rsi_required': False}.
[I 2025-09-01 15:10:18,474] Trial 843 finished with values: [-1000000000.0, 1000000000.0] and parameters: {'p_sma': 54, 'p_std': 46, 'p_atr': 25, 'p_adx': 28, 'rsi_period': 70, 'ema1': 21, 'ema2': 21, 'slip_atr_k': 0.019705951251671863, 'slip_spread_k': 0.13813208733201068, 'spread_hl_frac': 0.002807206428283835, 'bb_std_mult': 0.5073028503610897, 'rsi_os': 15, 'rsi_ob': 76, 'vol_spike': 0.24086435050401334, 'adx_thresh': 6.030897920964371, 'atr_min_pct': 0.0011132204309508547, 'atr_max_pct': 0.11131675169457136, 'tp_mult': 1.2225218865738503, 'tsl_mult': 0.4675491650730288, 'strategy': 'mean_reversion', 'time_stop': 230, 'use_sma': False, 'use_atr': False, 'use_adx': True, 'use_ema': False, 'use_spike': True, 'rsi_required': True, 'edge_k': 1.0079495485066579, 'edge_cap': 0.32313151351245384, 'bull_strategy': 'breakout', 'bull_bb_std_mult': 3.2867954244294775, 'bull_rsi_os': 27, 'bull_rsi_ob': 62, 'bull_adx_thresh': 29.914176476486773, 'bull_atr_min_pct': 0.004771541153282972, 'bull_atr_max_pct': 0.09717246036275513, 'bull_tp_mult': 1.4837314013445186, 'bull_tsl_mult': 0.3109823930843373, 'bull_time_stop': 293, 'bull_use_sma': True, 'bull_use_ema': False, 'bull_use_atr': True, 'bull_use_adx': False, 'bull_use_spike': False, 'bull_rsi_required': True, 'bear_strategy': 'breakout', 'bear_bb_std_mult': 1.8415106763879239, 'bear_rsi_os': 31, 'bear_rsi_ob': 88, 'bear_adx_thresh': 10.73069467237175, 'bear_atr_min_pct': 0.0024575150615445437, 'bear_atr_max_pct': 0.03654532886677621, 'bear_tp_mult': 2.2094260842765276, 'bear_tsl_mult': 0.11887262692901861, 'bear_time_stop': 294, 'bear_use_sma': True, 'bear_use_ema': True, 'bear_use_atr': True, 'bear_use_adx': True, 'bear_use_spike': False, 'bear_rsi_required': True, 'sideways_strategy': 'breakout', 'sideways_bb_std_mult': 1.6754242473821481, 'sideways_rsi_os': 50, 'sideways_rsi_ob': 48, 'sideways_adx_thresh': 16.421368649406887, 'sideways_atr_min_pct': 0.00983188758800857, 'sideways_atr_max_pct': 0.021076897393771887, 'sideways_tp_mult': 2.230062360019089, 'sideways_tsl_mult': 0.5760832894618029, 'sideways_time_stop': 259, 'sideways_use_sma': True, 'sideways_use_ema': False, 'sideways_use_atr': True, 'sideways_use_adx': True, 'sideways_use_spike': True, 'sideways_rsi_required': True}.
[I 2025-09-01 15:10:19,107] Trial 841 finished with values: [-1000000000.0, 1000000000.0] and parameters: {'p_sma': 33, 'p_std': 37, 'p_atr': 25, 'p_adx': 13, 'rsi_period': 68, 'ema1': 20, 'ema2': 21, 'slip_atr_k': 0.023137255753969573, 'slip_spread_k': 0.42749910366920035, 'spread_hl_frac': 0.041482146425063496, 'bb_std_mult': 2.8948898753651213, 'rsi_os': 37, 'rsi_ob': 84, 'vol_spike': 0.22842729424488561, 'adx_thresh': 20.689033577541565, 'atr_min_pct': 0.02618042286359286, 'atr_max_pct': 0.1121875527343921, 'tp_mult': 1.152033772137972, 'tsl_mult': 0.27788090364002094, 'strategy': 'mean_reversion', 'time_stop': 236, 'use_sma': False, 'use_atr': True, 'use_adx': False, 'use_ema': False, 'use_spike': False, 'rsi_required': True, 'edge_k': 0.3178165889337501, 'edge_cap': 0.4258643499602581, 'bull_strategy': 'breakout', 'bull_bb_std_mult': 3.274774330464205, 'bull_rsi_os': 33, 'bull_rsi_ob': 53, 'bull_adx_thresh': 31.83912732964111, 'bull_atr_min_pct': 0.002967180446646517, 'bull_atr_max_pct': 0.0751293008147589, 'bull_tp_mult': 2.9131774292503514, 'bull_tsl_mult': 0.7190390019184569, 'bull_time_stop': 105, 'bull_use_sma': False, 'bull_use_ema': False, 'bull_use_atr': True, 'bull_use_adx': False, 'bull_use_spike': True, 'bull_rsi_required': True, 'bear_strategy': 'breakout', 'bear_bb_std_mult': 3.5313873654140973, 'bear_rsi_os': 39, 'bear_rsi_ob': 90, 'bear_adx_thresh': 11.585710421425995, 'bear_atr_min_pct': 0.010553743349629042, 'bear_atr_max_pct': 0.03584997098709747, 'bear_tp_mult': 2.1965648939042985, 'bear_tsl_mult': 0.9529125230796642, 'bear_time_stop': 218, 'bear_use_sma': False, 'bear_use_ema': True, 'bear_use_atr': True, 'bear_use_adx': True, 'bear_use_spike': True, 'bear_rsi_required': False, 'sideways_strategy': 'breakout', 'sideways_bb_std_mult': 1.493584618809168, 'sideways_rsi_os': 49, 'sideways_rsi_ob': 77, 'sideways_adx_thresh': 23.821697778798026, 'sideways_atr_min_pct': 0.0222819476621839, 'sideways_atr_max_pct': 0.02030778904724878, 'sideways_tp_mult': 2.764761085257488, 'sideways_tsl_mult': 0.33996852444449865, 'sideways_time_stop': 179, 'sideways_use_sma': False, 'sideways_use_ema': True, 'sideways_use_atr': False, 'sideways_use_adx': True, 'sideways_use_spike': True, 'sideways_rsi_required': False}.
[I 2025-09-01 15:10:59,775] Trial 848 finished with values: [-1000000000.0, 1000000000.0] and parameters: {'p_sma': 37, 'p_std': 53, 'p_atr': 24, 'p_adx': 12, 'rsi_period': 76, 'ema1': 22, 'ema2': 18, 'slip_atr_k': 0.02981662218284277, 'slip_spread_k': 0.0643541789898279, 'spread_hl_frac': 0.007824225189962754, 'bb_std_mult': 1.4499100866271535, 'rsi_os': 27, 'rsi_ob': 85, 'vol_spike': 0.004524735793139056, 'adx_thresh': 23.21883177451163, 'atr_min_pct': 0.02339695208166051, 'atr_max_pct': 0.04278396697106493, 'tp_mult': 2.327783144216345, 'tsl_mult': 0.7219977286065745, 'strategy': 'mean_reversion', 'time_stop': 149, 'use_sma': True, 'use_atr': False, 'use_adx': False, 'use_ema': True, 'use_spike': True, 'rsi_required': False, 'edge_k': 0.001872053220446035, 'edge_cap': 0.8217573119284378, 'bull_strategy': 'mean_reversion', 'bull_bb_std_mult': 3.1914818219620478, 'bull_rsi_os': 49, 'bull_rsi_ob': 51, 'bull_adx_thresh': 24.16004949643075, 'bull_atr_min_pct': 0.0074207485341337715, 'bull_atr_max_pct': 0.0246997555643219, 'bull_tp_mult': 2.6078304605492173, 'bull_tsl_mult': 0.5700706092837193, 'bull_time_stop': 88, 'bull_use_sma': True, 'bull_use_ema': True, 'bull_use_atr': False, 'bull_use_adx': True, 'bull_use_spike': False, 'bull_rsi_required': False, 'bear_strategy': 'breakout', 'bear_bb_std_mult': 3.5479108874543774, 'bear_rsi_os': 18, 'bear_rsi_ob': 56, 'bear_adx_thresh': 13.485843290332209, 'bear_atr_min_pct': 0.003712794465503385, 'bear_atr_max_pct': 0.12235417843876448, 'bear_tp_mult': 1.2111526349057615, 'bear_tsl_mult': 0.09149541024886845, 'bear_time_stop': 13, 'bear_use_sma': True, 'bear_use_ema': False, 'bear_use_atr': True, 'bear_use_adx': True, 'bear_use_spike': False, 'bear_rsi_required': True, 'sideways_strategy': 'breakout', 'sideways_bb_std_mult': 1.0587062450229991, 'sideways_rsi_os': 51, 'sideways_rsi_ob': 67, 'sideways_adx_thresh': 6.318134789881607, 'sideways_atr_min_pct': 0.017364162606292602, 'sideways_atr_max_pct': 0.02816338873960879, 'sideways_tp_mult': 2.716243205353563, 'sideways_tsl_mult': 0.3022273767490968, 'sideways_time_stop': 160, 'sideways_use_sma': True, 'sideways_use_ema': False, 'sideways_use_atr': True, 'sideways_use_adx': False, 'sideways_use_spike': False, 'sideways_rsi_required': True}.
