[I 2025-09-01 13:12:54,808] Trial 73 finished with values: [-1000000000.0, 1000000000.0] and parameters: {'p_sma': 7, 'p_std': 46, 'p_atr': 29, 'p_adx': 10, 'rsi_period': 27, 'ema1': 21, 'ema2': 45, 'slip_atr_k': 0.21197032371607527, 'slip_spread_k': 0.5569070975512116, 'spread_hl_frac': 0.018939600125424564, 'bb_std_mult': 2.530103090521015, 'rsi_os': 48, 'rsi_ob': 60, 'vol_spike': 0.09016342469423093, 'adx_thresh': 17.693927084617503, 'atr_min_pct': 0.0063893079044304085, 'atr_max_pct': 0.09153830475715702, 'tp_mult': 1.601607717707954, 'tsl_mult': 0.051076405676192566, 'strategy': 'mean_reversion', 'time_stop': 65, 'use_sma': True, 'use_atr': True, 'use_adx': False, 'use_ema': True, 'use_spike': False, 'rsi_required': True, 'edge_k': 1.376768130751721, 'edge_cap': 0.19251957008621376, 'bull_strategy': 'breakout', 'bull_bb_std_mult': 1.6089867288162436, 'bull_rsi_os': 51, 'bull_rsi_ob': 58, 'bull_adx_thresh': 5.450793945592056, 'bull_atr_min_pct': 0.0031224478136083387, 'bull_atr_max_pct': 0.02612384362310474, 'bull_tp_mult': 1.1043463375172489, 'bull_tsl_mult': 0.6748917844677085, 'bull_time_stop': 148, 'bull_use_sma': True, 'bull_use_ema': False, 'bull_use_atr': False, 'bull_use_adx': False, 'bull_use_spike': False, 'bull_rsi_required': True, 'bear_strategy': 'breakout', 'bear_bb_std_mult': 0.6525922170073803, 'bear_rsi_os': 21, 'bear_rsi_ob': 70, 'bear_adx_thresh': 12.19014227504855, 'bear_atr_min_pct': 0.01453125966039681, 'bear_atr_max_pct': 0.09784596880546122, 'bear_tp_mult': 2.3772815326797203, 'bear_tsl_mult': 0.332307355247805, 'bear_time_stop': 168, 'bear_use_sma': True, 'bear_use_ema': True, 'bear_use_atr': True, 'bear_use_adx': False, 'bear_use_spike': False, 'bear_rsi_required': False, 'sideways_strategy': 'mean_reversion', 'sideways_bb_std_mult': 0.6978816496056222, 'sideways_rsi_os': 42, 'sideways_rsi_ob': 47, 'sideways_adx_thresh': 11.884088456560459, 'sideways_atr_min_pct': 0.024659990410834165, 'sideways_atr_max_pct': 0.07579491292802996, 'sideways_tp_mult': 2.4466140307342368, 'sideways_tsl_mult': 0.7115242347909416, 'sideways_time_stop': 38, 'sideways_use_sma': False, 'sideways_use_ema': False, 'sideways_use_atr': True, 'sideways_use_adx': True, 'sideways_use_spike': False, 'sideways_rsi_required': True}.
[I 2025-09-01 13:12:55,265] Trial 72 finished with values: [-1000000000.0, 1000000000.0] and parameters: {'p_sma': 33, 'p_std': 31, 'p_atr': 29, 'p_adx': 24, 'rsi_period': 27, 'ema1': 21, 'ema2': 12, 'slip_atr_k': 0.13849247758600086, 'slip_spread_k': 0.5034581110513208, 'spread_hl_frac': 0.023337059088567803, 'bb_std_mult': 2.7726681743043238, 'rsi_os': 48, 'rsi_ob': 59, 'vol_spike': 0.29735585687484295, 'adx_thresh': 33.00056028683568, 'atr_min_pct': 0.004201543893136445, 'atr_max_pct': 0.08576888516715389, 'tp_mult': 1.5625874271451623, 'tsl_mult': 0.06159876592872565, 'strategy': 'mean_reversion', 'time_stop': 45, 'use_sma': True, 'use_atr': True, 'use_adx': False, 'use_ema': True, 'use_spike': False, 'rsi_required': True, 'edge_k': 1.5641026978609336, 'edge_cap': 0.16342122407333004, 'bull_strategy': 'mean_reversion', 'bull_bb_std_mult': 0.692532636223461, 'bull_rsi_os': 54, 'bull_rsi_ob': 88, 'bull_adx_thresh': 7.622287512530372, 'bull_atr_min_pct': 0.010390426058334495, 'bull_atr_max_pct': 0.05058936571821042, 'bull_tp_mult': 1.4669308164829131, 'bull_tsl_mult': 0.7775043731957839, 'bull_time_stop': 203, 'bull_use_sma': True, 'bull_use_ema': False, 'bull_use_atr': False, 'bull_use_adx': False, 'bull_use_spike': False, 'bull_rsi_required': False, 'bear_strategy': 'breakout', 'bear_bb_std_mult': 1.9621715714431112, 'bear_rsi_os': 47, 'bear_rsi_ob': 91, 'bear_adx_thresh': 12.11582621183364, 'bear_atr_min_pct': 0.010008996611773792, 'bear_atr_max_pct': 0.1344656904051047, 'bear_tp_mult': 2.360717647383764, 'bear_tsl_mult': 0.26543719187808446, 'bear_time_stop': 207, 'bear_use_sma': True, 'bear_use_ema': True, 'bear_use_atr': True, 'bear_use_adx': False, 'bear_use_spike': False, 'bear_rsi_required': False, 'sideways_strategy': 'breakout', 'sideways_bb_std_mult': 1.506000533440913, 'sideways_rsi_os': 23, 'sideways_rsi_ob': 53, 'sideways_adx_thresh': 11.79672254865686, 'sideways_atr_min_pct': 0.025519349140694963, 'sideways_atr_max_pct': 0.015310198002663769, 'sideways_tp_mult': 2.616802959936466, 'sideways_tsl_mult': 0.1038865743043847, 'sideways_time_stop': 90, 'sideways_use_sma': False, 'sideways_use_ema': False, 'sideways_use_atr': True, 'sideways_use_adx': True, 'sideways_use_spike': False, 'sideways_rsi_required': False}.
[I 2025-09-01 13:12:55,632] Trial 74 finished with values: [-1000000000.0, 1000000000.0] and parameters: {'p_sma': 44, 'p_std': 46, 'p_atr': 29, 'p_adx': 10, 'rsi_period': 28, 'ema1': 21, 'ema2': 44, 'slip_atr_k': 0.24005000295340276, 'slip_spread_k': 0.5487755309576063, 'spread_hl_frac': 0.020084824841726395, 'bb_std_mult': 2.5629007252406826, 'rsi_os': 44, 'rsi_ob': 62, 'vol_spike': 0.09154326371453184, 'adx_thresh': 16.302081857415352, 'atr_min_pct': 0.00620756983447097, 'atr_max_pct': 0.09191311600634576, 'tp_mult': 1.7624419899972157, 'tsl_mult': 0.06551905768083102, 'strategy': 'mean_reversion', 'time_stop': 56, 'use_sma': True, 'use_atr': True, 'use_adx': False, 'use_ema': True, 'use_spike': False, 'rsi_required': True, 'edge_k': 0.41826320637241854, 'edge_cap': 0.1981169765984227, 'bull_strategy': 'breakout', 'bull_bb_std_mult': 2.7379287263761176, 'bull_rsi_os': 50, 'bull_rsi_ob': 57, 'bull_adx_thresh': 5.432523430241233, 'bull_atr_min_pct': 0.0027158515507363463, 'bull_atr_max_pct': 0.028561363886515936, 'bull_tp_mult': 1.1744838987795228, 'bull_tsl_mult': 0.47618715113516064, 'bull_time_stop': 147, 'bull_use_sma': True, 'bull_use_ema': False, 'bull_use_atr': False, 'bull_use_adx': False, 'bull_use_spike': False, 'bull_rsi_required': True, 'bear_strategy': 'breakout', 'bear_bb_std_mult': 0.65528734681094, 'bear_rsi_os': 22, 'bear_rsi_ob': 79, 'bear_adx_thresh': 14.404795928248667, 'bear_atr_min_pct': 0.0060943003784458445, 'bear_atr_max_pct': 0.06833962233562166, 'bear_tp_mult': 2.369323703862062, 'bear_tsl_mult': 0.3543224273916243, 'bear_time_stop': 162, 'bear_use_sma': True, 'bear_use_ema': True, 'bear_use_atr': True, 'bear_use_adx': False, 'bear_use_spike': False, 'bear_rsi_required': False, 'sideways_strategy': 'mean_reversion', 'sideways_bb_std_mult': 0.5968163696950173, 'sideways_rsi_os': 41, 'sideways_rsi_ob': 47, 'sideways_adx_thresh': 11.619914052748644, 'sideways_atr_min_pct': 0.02548564321177916, 'sideways_atr_max_pct': 0.07682048592713284, 'sideways_tp_mult': 2.4745548044360492, 'sideways_tsl_mult': 0.5547855531963154, 'sideways_time_stop': 268, 'sideways_use_sma': False, 'sideways_use_ema': False, 'sideways_use_atr': True, 'sideways_use_adx': True, 'sideways_use_spike': False, 'sideways_rsi_required': True}.
[I 2025-09-01 13:12:55,632] Trial 75 finished with values: [-1000000000.0, 1000000000.0] and parameters: {'p_sma': 17, 'p_std': 47, 'p_atr': 29, 'p_adx': 10, 'rsi_period': 29, 'ema1': 11, 'ema2': 36, 'slip_atr_k': 0.1358422298654596, 'slip_spread_k': 0.5600803823316297, 'spread_hl_frac': 0.018813604223543858, 'bb_std_mult': 2.5928415599078085, 'rsi_os': 48, 'rsi_ob': 61, 'vol_spike': 0.29489936998329047, 'adx_thresh': 17.279454632779526, 'atr_min_pct': 0.006326760433769691, 'atr_max_pct': 0.09526043157914266, 'tp_mult': 1.7516591195728692, 'tsl_mult': 0.06401593721802566, 'strategy': 'mean_reversion', 'time_stop': 57, 'use_sma': False, 'use_atr': False, 'use_adx': False, 'use_ema': True, 'use_spike': False, 'rsi_required': True, 'edge_k': 1.6305700433160069, 'edge_cap': 0.27631507763178237, 'bull_strategy': 'breakout', 'bull_bb_std_mult': 3.2678038747960056, 'bull_rsi_os': 51, 'bull_rsi_ob': 56, 'bull_adx_thresh': 9.168427282140556, 'bull_atr_min_pct': 0.002627211547157064, 'bull_atr_max_pct': 0.02815035169221245, 'bull_tp_mult': 1.1225190585115068, 'bull_tsl_mult': 0.6815708572137494, 'bull_time_stop': 145, 'bull_use_sma': True, 'bull_use_ema': False, 'bull_use_atr': False, 'bull_use_adx': False, 'bull_use_spike': False, 'bull_rsi_required': True, 'bear_strategy': 'mean_reversion', 'bear_bb_std_mult': 0.6571562973059307, 'bear_rsi_os': 47, 'bear_rsi_ob': 85, 'bear_adx_thresh': 11.594081659632472, 'bear_atr_min_pct': 0.0062087167892194445, 'bear_atr_max_pct': 0.0671527165287059, 'bear_tp_mult': 2.8195921898165754, 'bear_tsl_mult': 0.3342997878877696, 'bear_time_stop': 169, 'bear_use_sma': True, 'bear_use_ema': True, 'bear_use_atr': True, 'bear_use_adx': False, 'bear_use_spike': False, 'bear_rsi_required': False, 'sideways_strategy': 'mean_reversion', 'sideways_bb_std_mult': 0.6904662405802882, 'sideways_rsi_os': 39, 'sideways_rsi_ob': 47, 'sideways_adx_thresh': 11.83198932145612, 'sideways_atr_min_pct': 0.0247390235535744, 'sideways_atr_max_pct': 0.07643848119048, 'sideways_tp_mult': 2.426396370376058, 'sideways_tsl_mult': 0.5343434526100841, 'sideways_time_stop': 92, 'sideways_use_sma': False, 'sideways_use_ema': True, 'sideways_use_atr': True, 'sideways_use_adx': True, 'sideways_use_spike': False, 'sideways_rsi_required': True}.
[I 2025-09-01 13:12:55,976] Trial 76 finished with values: [-1000000000.0, 1000000000.0] and parameters: {'p_sma': 16, 'p_std': 42, 'p_atr': 29, 'p_adx': 25, 'rsi_period': 29, 'ema1': 17, 'ema2': 37, 'slip_atr_k': 0.1385547678145918, 'slip_spread_k': 0.5188070785560965, 'spread_hl_frac': 0.023573589563795995, 'bb_std_mult': 2.937058833723202, 'rsi_os': 15, 'rsi_ob': 49, 'vol_spike': 0.2908840986320852, 'adx_thresh': 16.789095994852335, 'atr_min_pct': 0.005801959022609405, 'atr_max_pct': 0.011939743340109582, 'tp_mult': 1.7781828474209362, 'tsl_mult': 0.24849667053164526, 'strategy': 'mean_reversion', 'time_stop': 85, 'use_sma': False, 'use_atr': False, 'use_adx': False, 'use_ema': True, 'use_spike': False, 'rsi_required': True, 'edge_k': 0.32874914180922615, 'edge_cap': 0.5018097503864525, 'bull_strategy': 'breakout', 'bull_bb_std_mult': 3.2279293040701718, 'bull_rsi_os': 50, 'bull_rsi_ob': 89, 'bull_adx_thresh': 9.115988191401499, 'bull_atr_min_pct': 0.002527544710907598, 'bull_atr_max_pct': 0.026099446828157527, 'bull_tp_mult': 1.3137731969418613, 'bull_tsl_mult': 0.47694957292167817, 'bull_time_stop': 131, 'bull_use_sma': True, 'bull_use_ema': False, 'bull_use_atr': False, 'bull_use_adx': False, 'bull_use_spike': False, 'bull_rsi_required': True, 'bear_strategy': 'mean_reversion', 'bear_bb_std_mult': 2.07475044841458, 'bear_rsi_os': 47, 'bear_rsi_ob': 80, 'bear_adx_thresh': 14.384749607767432, 'bear_atr_min_pct': 0.006367986945404896, 'bear_atr_max_pct': 0.06619855248913051, 'bear_tp_mult': 2.8276080591145862, 'bear_tsl_mult': 0.4493715078343474, 'bear_time_stop': 229, 'bear_use_sma': False, 'bear_use_ema': True, 'bear_use_atr': True, 'bear_use_adx': False, 'bear_use_spike': False, 'bear_rsi_required': False, 'sideways_strategy': 'mean_reversion', 'sideways_bb_std_mult': 1.517416816674627, 'sideways_rsi_os': 40, 'sideways_rsi_ob': 55, 'sideways_adx_thresh': 17.95831495419785, 'sideways_atr_min_pct': 0.02543356333845095, 'sideways_atr_max_pct': 0.04756936728660415, 'sideways_tp_mult': 2.981534235895172, 'sideways_tsl_mult': 0.5463744173293948, 'sideways_time_stop': 263, 'sideways_use_sma': False, 'sideways_use_ema': True, 'sideways_use_atr': True, 'sideways_use_adx': False, 'sideways_use_spike': False, 'sideways_rsi_required': True}.
[I 2025-09-01 13:12:55,997] Trial 77 finished with values: [-1000000000.0, 1000000000.0] and parameters: {'p_sma': 24, 'p_std': 44, 'p_atr': 28, 'p_adx': 13, 'rsi_period': 31, 'ema1': 6, 'ema2': 57, 'slip_atr_k': 0.07513719819700782, 'slip_spread_k': 0.6706572632181537, 'spread_hl_frac': 0.01591547016463138, 'bb_std_mult': 2.267667138483386, 'rsi_os': 53, 'rsi_ob': 86, 'vol_spike': 0.051692593005417155, 'adx_thresh': 15.22889923050995, 'atr_min_pct': 0.0013390179098679812, 'atr_max_pct': 0.012414168900488853, 'tp_mult': 1.6557627557321652, 'tsl_mult': 0.25012461665972435, 'strategy': 'mean_reversion', 'time_stop': 87, 'use_sma': False, 'use_atr': False, 'use_adx': False, 'use_ema': True, 'use_spike': True, 'rsi_required': False, 'edge_k': 0.3190734026465507, 'edge_cap': 0.5404675529425077, 'bull_strategy': 'breakout', 'bull_bb_std_mult': 3.2023541578587396, 'bull_rsi_os': 19, 'bull_rsi_ob': 59, 'bull_adx_thresh': 12.258677883509707, 'bull_atr_min_pct': 0.0010586060458759967, 'bull_atr_max_pct': 0.032201017142838996, 'bull_tp_mult': 1.2902878397587152, 'bull_tsl_mult': 0.45539064366476645, 'bull_time_stop': 253, 'bull_use_sma': False, 'bull_use_ema': False, 'bull_use_atr': False, 'bull_use_adx': False, 'bull_use_spike': True, 'bull_rsi_required': True, 'bear_strategy': 'mean_reversion', 'bear_bb_std_mult': 2.085441102818989, 'bear_rsi_os': 15, 'bear_rsi_ob': 60, 'bear_adx_thresh': 6.272674746740203, 'bear_atr_min_pct': 0.029444355264452573, 'bear_atr_max_pct': 0.10493871933800628, 'bear_tp_mult': 2.653107703127067, 'bear_tsl_mult': 0.440574538553873, 'bear_time_stop': 195, 'bear_use_sma': False, 'bear_use_ema': True, 'bear_use_atr': True, 'bear_use_adx': False, 'bear_use_spike': True, 'bear_rsi_required': True, 'sideways_strategy': 'mean_reversion', 'sideways_bb_std_mult': 1.7530287448782689, 'sideways_rsi_os': 33, 'sideways_rsi_ob': 56, 'sideways_adx_thresh': 7.205827685147446, 'sideways_atr_min_pct': 0.026145925989365337, 'sideways_atr_max_pct': 0.025751353887831882, 'sideways_tp_mult': 2.982764551067889, 'sideways_tsl_mult': 0.5885947047357429, 'sideways_time_stop': 299, 'sideways_use_sma': True, 'sideways_use_ema': True, 'sideways_use_atr': False, 'sideways_use_adx': False, 'sideways_use_spike': False, 'sideways_rsi_required': True}.
[I 2025-09-01 13:13:39,221] Trial 79 finished with values: [-0.0682852084410468, 0.06807389120352113] and parameters: {'p_sma': 24, 'p_std': 17, 'p_atr': 12, 'p_adx': 8, 'rsi_period': 33, 'ema1': 16, 'ema2': 42, 'slip_atr_k': 0.0686958612831068, 'slip_spread_k': 0.6750899331194753, 'spread_hl_frac': 0.016368849939363574, 'bb_std_mult': 2.259467699520631, 'rsi_os': 9, 'rsi_ob': 86, 'vol_spike': 0.10237043303069404, 'adx_thresh': 15.56285275887258, 'atr_min_pct': 0.0012516028051589596, 'atr_max_pct': 0.07130557061436955, 'tp_mult': 1.6543177390975556, 'tsl_mult': 0.1451630892837226, 'strategy': 'mean_reversion', 'time_stop': 6, 'use_sma': False, 'use_atr': False, 'use_adx': False, 'use_ema': True, 'use_spike': True, 'rsi_required': False, 'edge_k': 0.3217555894666317, 'edge_cap': 0.5225886380741269, 'bull_strategy': 'breakout', 'bull_bb_std_mult': 3.1952610505330443, 'bull_rsi_os': 46, 'bull_rsi_ob': 59, 'bull_adx_thresh': 12.238253499293666, 'bull_atr_min_pct': 0.0009927472608230188, 'bull_atr_max_pct': 0.024408113267475003, 'bull_tp_mult': 1.3431354260052724, 'bull_tsl_mult': 0.7191549264063604, 'bull_time_stop': 252, 'bull_use_sma': False, 'bull_use_ema': False, 'bull_use_atr': False, 'bull_use_adx': False, 'bull_use_spike': True, 'bull_rsi_required': True, 'bear_strategy': 'mean_reversion', 'bear_bb_std_mult': 0.8160582562787349, 'bear_rsi_os': 15, 'bear_rsi_ob': 59, 'bear_adx_thresh': 9.791935781161737, 'bear_atr_min_pct': 0.02961868983330959, 'bear_atr_max_pct': 0.10647089871486945, 'bear_tp_mult': 1.30288875382878, 'bear_tsl_mult': 0.22173723172989107, 'bear_time_stop': 85, 'bear_use_sma': False, 'bear_use_ema': True, 'bear_use_atr': True, 'bear_use_adx': False, 'bear_use_spike': True, 'bear_rsi_required': True, 'sideways_strategy': 'mean_reversion', 'sideways_bb_std_mult': 2.0198171321345058, 'sideways_rsi_os': 33, 'sideways_rsi_ob': 55, 'sideways_adx_thresh': 7.27076915341198, 'sideways_atr_min_pct': 0.02134904702208139, 'sideways_atr_max_pct': 0.06403424948584682, 'sideways_tp_mult': 2.96353971503798, 'sideways_tsl_mult': 0.778159882189995, 'sideways_time_stop': 19, 'sideways_use_sma': True, 'sideways_use_ema': True, 'sideways_use_atr': False, 'sideways_use_adx': False, 'sideways_use_spike': False, 'sideways_rsi_required': True}.
[I 2025-09-01 13:13:41,066] Trial 81 finished with values: [-1000000000.0, 1000000000.0] and parameters: {'p_sma': 48, 'p_std': 36, 'p_atr': 26, 'p_adx': 16, 'rsi_period': 35, 'ema1': 16, 'ema2': 17, 'slip_atr_k': 0.09218283167056397, 'slip_spread_k': 0.04134721904734079, 'spread_hl_frac': 0.0017403073303638508, 'bb_std_mult': 0.8281956623070668, 'rsi_os': 30, 'rsi_ob': 93, 'vol_spike': 0.06869741931622277, 'adx_thresh': 18.99937861609289, 'atr_min_pct': 0.001264783817301504, 'atr_max_pct': 0.0706990436939158, 'tp_mult': 1.8822346429906125, 'tsl_mult': 0.14751882012711043, 'strategy': 'breakout', 'time_stop': 13, 'use_sma': True, 'use_atr': True, 'use_adx': False, 'use_ema': True, 'use_spike': False, 'rsi_required': True, 'edge_k': 1.1890358971113326, 'edge_cap': 0.5949466674276698, 'bull_strategy': 'breakout', 'bull_bb_std_mult': 1.114170007939813, 'bull_rsi_os': 13, 'bull_rsi_ob': 82, 'bull_adx_thresh': 10.564228033069416, 'bull_atr_min_pct': 0.003864671186701933, 'bull_atr_max_pct': 0.03930743406369742, 'bull_tp_mult': 1.5629421568939939, 'bull_tsl_mult': 0.9257433816144924, 'bull_time_stop': 158, 'bull_use_sma': False, 'bull_use_ema': True, 'bull_use_atr': True, 'bull_use_adx': False, 'bull_use_spike': True, 'bull_rsi_required': True, 'bear_strategy': 'mean_reversion', 'bear_bb_std_mult': 1.7850175987399903, 'bear_rsi_os': 55, 'bear_rsi_ob': 63, 'bear_adx_thresh': 9.847750047781945, 'bear_atr_min_pct': 0.009090192275200871, 'bear_atr_max_pct': 0.1125311191227534, 'bear_tp_mult': 1.1558506045079298, 'bear_tsl_mult': 0.22573106674860818, 'bear_time_stop': 109, 'bear_use_sma': True, 'bear_use_ema': False, 'bear_use_atr': True, 'bear_use_adx': False, 'bear_use_spike': True, 'bear_rsi_required': False, 'sideways_strategy': 'mean_reversion', 'sideways_bb_std_mult': 2.0308281747889714, 'sideways_rsi_os': 25, 'sideways_rsi_ob': 59, 'sideways_adx_thresh': 21.977805139502355, 'sideways_atr_min_pct': 0.022078238358916355, 'sideways_atr_max_pct': 0.06384050427469662, 'sideways_tp_mult': 2.356558196138162, 'sideways_tsl_mult': 0.7816482613328393, 'sideways_time_stop': 18, 'sideways_use_sma': False, 'sideways_use_ema': False, 'sideways_use_atr': False, 'sideways_use_adx': False, 'sideways_use_spike': False, 'sideways_rsi_required': True}.
[I 2025-09-01 13:13:41,655] Trial 80 finished with values: [-0.04346142381406792, 0.04320550418825526] and parameters: {'p_sma': 24, 'p_std': 44, 'p_atr': 12, 'p_adx': 16, 'rsi_period': 31, 'ema1': 6, 'ema2': 17, 'slip_atr_k': 0.15658915094592965, 'slip_spread_k': 0.6744658154643377, 'spread_hl_frac': 0.02563322947790518, 'bb_std_mult': 2.2462635454936155, 'rsi_os': 25, 'rsi_ob': 86, 'vol_spike': 0.10397645180163184, 'adx_thresh': 15.204911175154374, 'atr_min_pct': 0.0012158112768270734, 'atr_max_pct': 0.07155813211752451, 'tp_mult': 1.654468223449322, 'tsl_mult': 0.14419299371151675, 'strategy': 'breakout', 'time_stop': 85, 'use_sma': True, 'use_atr': True, 'use_adx': False, 'use_ema': True, 'use_spike': True, 'rsi_required': False, 'edge_k': 0.9846050999289958, 'edge_cap': 0.5551558433770782, 'bull_strategy': 'breakout', 'bull_bb_std_mult': 3.0183426912114304, 'bull_rsi_os': 20, 'bull_rsi_ob': 60, 'bull_adx_thresh': 12.297826489256511, 'bull_atr_min_pct': 0.000916031872321121, 'bull_atr_max_pct': 0.010281491111733257, 'bull_tp_mult': 1.2905054203792161, 'bull_tsl_mult': 0.8983080464528919, 'bull_time_stop': 248, 'bull_use_sma': False, 'bull_use_ema': True, 'bull_use_atr': True, 'bull_use_adx': False, 'bull_use_spike': True, 'bull_rsi_required': True, 'bear_strategy': 'mean_reversion', 'bear_bb_std_mult': 3.516027283186511, 'bear_rsi_os': 14, 'bear_rsi_ob': 60, 'bear_adx_thresh': 8.995908922586525, 'bear_atr_min_pct': 0.029344935563020612, 'bear_atr_max_pct': 0.1056659304213959, 'bear_tp_mult': 2.990077377856718, 'bear_tsl_mult': 0.21765093832580013, 'bear_time_stop': 194, 'bear_use_sma': True, 'bear_use_ema': False, 'bear_use_atr': True, 'bear_use_adx': False, 'bear_use_spike': True, 'bear_rsi_required': True, 'sideways_strategy': 'mean_reversion', 'sideways_bb_std_mult': 2.0525841262117255, 'sideways_rsi_os': 34, 'sideways_rsi_ob': 59, 'sideways_adx_thresh': 21.80584281673901, 'sideways_atr_min_pct': 0.02086005170041591, 'sideways_atr_max_pct': 0.028859192608460142, 'sideways_tp_mult': 2.7534392344372645, 'sideways_tsl_mult': 0.5802578999367801, 'sideways_time_stop': 116, 'sideways_use_sma': True, 'sideways_use_ema': False, 'sideways_use_atr': False, 'sideways_use_adx': False, 'sideways_use_spike': False, 'sideways_rsi_required': True}.
