[I 2025-09-01 15:02:27,450] Trial 799 finished with values: [-1000000000.0, 1000000000.0] and parameters: {'p_sma': 35, 'p_std': 33, 'p_atr': 27, 'p_adx': 7, 'rsi_period': 52, 'ema1': 20, 'ema2': 17, 'slip_atr_k': 0.10534242625629181, 'slip_spread_k': 0.094243716625434, 'spread_hl_frac': 0.0037445735829064975, 'bb_std_mult': 1.7518552344464897, 'rsi_os': 39, 'rsi_ob': 83, 'vol_spike': 0.16493730932556872, 'adx_thresh': 24.95683051144493, 'atr_min_pct': 0.025943893451378715, 'atr_max_pct': 0.07477278016135257, 'tp_mult': 1.0540799716327887, 'tsl_mult': 0.8643069725076735, 'strategy': 'breakout', 'time_stop': 261, 'use_sma': False, 'use_atr': True, 'use_adx': False, 'use_ema': True, 'use_spike': False, 'rsi_required': True, 'edge_k': 1.3872325876936324, 'edge_cap': 0.34733416027833036, 'bull_strategy': 'mean_reversion', 'bull_bb_std_mult': 1.5400547573220575, 'bull_rsi_os': 51, 'bull_rsi_ob': 55, 'bull_adx_thresh': 13.02823745345016, 'bull_atr_min_pct': 0.0032316473828451348, 'bull_atr_max_pct': 0.10105806969631584, 'bull_tp_mult': 2.950494739277964, 'bull_tsl_mult': 0.3653553999028938, 'bull_time_stop': 93, 'bull_use_sma': True, 'bull_use_ema': True, 'bull_use_atr': False, 'bull_use_adx': False, 'bull_use_spike': False, 'bull_rsi_required': False, 'bear_strategy': 'breakout', 'bear_bb_std_mult': 3.4484578218352344, 'bear_rsi_os': 32, 'bear_rsi_ob': 90, 'bear_adx_thresh': 20.636372530688142, 'bear_atr_min_pct': 0.012393796670223662, 'bear_atr_max_pct': 0.04016249857119179, 'bear_tp_mult': 1.0150943468358307, 'bear_tsl_mult': 0.46147615861425, 'bear_time_stop': 211, 'bear_use_sma': False, 'bear_use_ema': False, 'bear_use_atr': False, 'bear_use_adx': False, 'bear_use_spike': False, 'bear_rsi_required': False, 'sideways_strategy': 'mean_reversion', 'sideways_bb_std_mult': 1.4357716045542992, 'sideways_rsi_os': 53, 'sideways_rsi_ob': 67, 'sideways_adx_thresh': 8.37249457649357, 'sideways_atr_min_pct': 0.0223653638215858, 'sideways_atr_max_pct': 0.08843680768576671, 'sideways_tp_mult': 2.756660126491527, 'sideways_tsl_mult': 0.28593160732766837, 'sideways_time_stop': 168, 'sideways_use_sma': False, 'sideways_use_ema': False, 'sideways_use_atr': True, 'sideways_use_adx': False, 'sideways_use_spike': False, 'sideways_rsi_required': True}.
[I 2025-09-01 15:02:29,198] Trial 802 finished with values: [-1000000000.0, 1000000000.0] and parameters: {'p_sma': 31, 'p_std': 33, 'p_atr': 19, 'p_adx': 12, 'rsi_period': 67, 'ema1': 22, 'ema2': 24, 'slip_atr_k': 0.2211405075642651, 'slip_spread_k': 0.5076680852713633, 'spread_hl_frac': 0.010501960666585652, 'bb_std_mult': 1.7396735333796847, 'rsi_os': 39, 'rsi_ob': 50, 'vol_spike': 0.02755390345743644, 'adx_thresh': 26.33535152307848, 'atr_min_pct': 0.02749862238493791, 'atr_max_pct': 0.14314846768972128, 'tp_mult': 1.8494918676853127, 'tsl_mult': 0.9513761662253754, 'strategy': 'mean_reversion', 'time_stop': 239, 'use_sma': True, 'use_atr': False, 'use_adx': False, 'use_ema': False, 'use_spike': True, 'rsi_required': True, 'edge_k': 1.375870543720019, 'edge_cap': 0.9138974866704802, 'bull_strategy': 'breakout', 'bull_bb_std_mult': 3.1436606783950447, 'bull_rsi_os': 36, 'bull_rsi_ob': 58, 'bull_adx_thresh': 31.240469244390273, 'bull_atr_min_pct': 0.006612746018739306, 'bull_atr_max_pct': 0.020648465320133837, 'bull_tp_mult': 1.5972015878299264, 'bull_tsl_mult': 0.37296020971358257, 'bull_time_stop': 126, 'bull_use_sma': True, 'bull_use_ema': False, 'bull_use_atr': True, 'bull_use_adx': True, 'bull_use_spike': False, 'bull_rsi_required': True, 'bear_strategy': 'mean_reversion', 'bear_bb_std_mult': 3.526819798266639, 'bear_rsi_os': 32, 'bear_rsi_ob': 59, 'bear_adx_thresh': 15.399437029896484, 'bear_atr_min_pct': 0.02612015378003229, 'bear_atr_max_pct': 0.03757763526572559, 'bear_tp_mult': 1.6299822985220134, 'bear_tsl_mult': 0.07869611653128088, 'bear_time_stop': 144, 'bear_use_sma': True, 'bear_use_ema': True, 'bear_use_atr': False, 'bear_use_adx': False, 'bear_use_spike': False, 'bear_rsi_required': True, 'sideways_strategy': 'breakout', 'sideways_bb_std_mult': 1.1127713993533837, 'sideways_rsi_os': 50, 'sideways_rsi_ob': 73, 'sideways_adx_thresh': 8.581747326690998, 'sideways_atr_min_pct': 0.025282866321606975, 'sideways_atr_max_pct': 0.054666570090786334, 'sideways_tp_mult': 1.5068271833633413, 'sideways_tsl_mult': 0.2844976587410775, 'sideways_time_stop': 193, 'sideways_use_sma': True, 'sideways_use_ema': False, 'sideways_use_atr': True, 'sideways_use_adx': True, 'sideways_use_spike': False, 'sideways_rsi_required': True}.
[I 2025-09-01 15:03:16,294] Trial 803 finished with values: [-1000000000.0, 1000000000.0] and parameters: {'p_sma': 35, 'p_std': 32, 'p_atr': 10, 'p_adx': 21, 'rsi_period': 67, 'ema1': 22, 'ema2': 16, 'slip_atr_k': 0.23898083666022896, 'slip_spread_k': 0.08784219271074584, 'spread_hl_frac': 0.022626385996083263, 'bb_std_mult': 3.0918872248092217, 'rsi_os': 5, 'rsi_ob': 84, 'vol_spike': 0.16553044191618166, 'adx_thresh': 5.033865094380721, 'atr_min_pct': 0.027401435708763192, 'atr_max_pct': 0.1424522765856968, 'tp_mult': 1.125507782223572, 'tsl_mult': 0.7910980752001685, 'strategy': 'mean_reversion', 'time_stop': 238, 'use_sma': True, 'use_atr': False, 'use_adx': False, 'use_ema': False, 'use_spike': True, 'rsi_required': True, 'edge_k': 0.9762833391919999, 'edge_cap': 0.34372670888271945, 'bull_strategy': 'breakout', 'bull_bb_std_mult': 3.471726611926458, 'bull_rsi_os': 15, 'bull_rsi_ob': 60, 'bull_adx_thresh': 31.219110872846375, 'bull_atr_min_pct': 0.006071399540106093, 'bull_atr_max_pct': 0.019812068457500727, 'bull_tp_mult': 2.8789092358933552, 'bull_tsl_mult': 0.2959159207005411, 'bull_time_stop': 126, 'bull_use_sma': True, 'bull_use_ema': False, 'bull_use_atr': True, 'bull_use_adx': True, 'bull_use_spike': False, 'bull_rsi_required': True, 'bear_strategy': 'mean_reversion', 'bear_bb_std_mult': 3.5350373704316773, 'bear_rsi_os': 32, 'bear_rsi_ob': 79, 'bear_adx_thresh': 7.717230321656288, 'bear_atr_min_pct': 0.002994349873725001, 'bear_atr_max_pct': 0.037761914209956705, 'bear_tp_mult': 2.276739672234605, 'bear_tsl_mult': 0.11349656378013039, 'bear_time_stop': 212, 'bear_use_sma': True, 'bear_use_ema': True, 'bear_use_atr': False, 'bear_use_adx': False, 'bear_use_spike': False, 'bear_rsi_required': True, 'sideways_strategy': 'breakout', 'sideways_bb_std_mult': 1.6050855733246299, 'sideways_rsi_os': 50, 'sideways_rsi_ob': 73, 'sideways_adx_thresh': 7.664135779871074, 'sideways_atr_min_pct': 0.025141467237204784, 'sideways_atr_max_pct': 0.0696001408525936, 'sideways_tp_mult': 2.7938358077617615, 'sideways_tsl_mult': 0.28549897161590193, 'sideways_time_stop': 64, 'sideways_use_sma': True, 'sideways_use_ema': False, 'sideways_use_atr': True, 'sideways_use_adx': True, 'sideways_use_spike': False, 'sideways_rsi_required': True}.
[I 2025-09-01 15:03:17,940] Trial 804 finished with values: [-1000000000.0, 1000000000.0] and parameters: {'p_sma': 18, 'p_std': 47, 'p_atr': 12, 'p_adx': 21, 'rsi_period': 78, 'ema1': 21, 'ema2': 24, 'slip_atr_k': 0.1794475036168285, 'slip_spread_k': 0.02226192758270054, 'spread_hl_frac': 0.006355593675760002, 'bb_std_mult': 1.7382023507133737, 'rsi_os': 16, 'rsi_ob': 94, 'vol_spike': 0.2255756477434444, 'adx_thresh': 26.10882404778943, 'atr_min_pct': 6.476939583048222e-05, 'atr_max_pct': 0.13915092310980678, 'tp_mult': 1.1363931952185815, 'tsl_mult': 0.7862578177870869, 'strategy': 'mean_reversion', 'time_stop': 240, 'use_sma': True, 'use_atr': False, 'use_adx': False, 'use_ema': False, 'use_spike': True, 'rsi_required': False, 'edge_k': 0.9934046188295086, 'edge_cap': 0.29422400752148903, 'bull_strategy': 'breakout', 'bull_bb_std_mult': 3.325962702508734, 'bull_rsi_os': 36, 'bull_rsi_ob': 70, 'bull_adx_thresh': 9.34197482001099, 'bull_atr_min_pct': 0.0023799772877343695, 'bull_atr_max_pct': 0.11029115618620597, 'bull_tp_mult': 2.8201866379431, 'bull_tsl_mult': 0.6548009406942175, 'bull_time_stop': 98, 'bull_use_sma': True, 'bull_use_ema': False, 'bull_use_atr': True, 'bull_use_adx': True, 'bull_use_spike': False, 'bull_rsi_required': True, 'bear_strategy': 'mean_reversion', 'bear_bb_std_mult': 1.4108100036618527, 'bear_rsi_os': 28, 'bear_rsi_ob': 88, 'bear_adx_thresh': 34.46614763033639, 'bear_atr_min_pct': 0.004621854491255319, 'bear_atr_max_pct': 0.02735927355773686, 'bear_tp_mult': 2.2754475631509505, 'bear_tsl_mult': 0.11233589008727207, 'bear_time_stop': 221, 'bear_use_sma': True, 'bear_use_ema': True, 'bear_use_atr': True, 'bear_use_adx': True, 'bear_use_spike': True, 'bear_rsi_required': True, 'sideways_strategy': 'breakout', 'sideways_bb_std_mult': 2.891008491297247, 'sideways_rsi_os': 17, 'sideways_rsi_ob': 73, 'sideways_adx_thresh': 14.605702327551114, 'sideways_atr_min_pct': 0.023727364138340673, 'sideways_atr_max_pct': 0.14182768807392526, 'sideways_tp_mult': 2.811220941399173, 'sideways_tsl_mult': 0.6044622658822387, 'sideways_time_stop': 300, 'sideways_use_sma': True, 'sideways_use_ema': True, 'sideways_use_atr': False, 'sideways_use_adx': True, 'sideways_use_spike': True, 'sideways_rsi_required': True}.
[I 2025-09-01 15:03:18,543] Trial 805 finished with values: [-1000000000.0, 1000000000.0] and parameters: {'p_sma': 57, 'p_std': 8, 'p_atr': 22, 'p_adx': 20, 'rsi_period': 11, 'ema1': 21, 'ema2': 14, 'slip_atr_k': 0.1630690441997673, 'slip_spread_k': 0.14262046802631625, 'spread_hl_frac': 0.018817749857298297, 'bb_std_mult': 0.621705326802866, 'rsi_os': 39, 'rsi_ob': 84, 'vol_spike': 0.22498583848222098, 'adx_thresh': 26.111874980895692, 'atr_min_pct': 0.027352186812388074, 'atr_max_pct': 0.13928809227467906, 'tp_mult': 1.1057329395609734, 'tsl_mult': 0.5253921897252015, 'strategy': 'mean_reversion', 'time_stop': 240, 'use_sma': True, 'use_atr': False, 'use_adx': False, 'use_ema': False, 'use_spike': True, 'rsi_required': False, 'edge_k': 0.5713986606544387, 'edge_cap': 0.29896657922736836, 'bull_strategy': 'breakout', 'bull_bb_std_mult': 3.1444245760137903, 'bull_rsi_os': 36, 'bull_rsi_ob': 57, 'bull_adx_thresh': 19.796716802729303, 'bull_atr_min_pct': 0.006636860493157591, 'bull_atr_max_pct': 0.023657937699092663, 'bull_tp_mult': 2.885015595175287, 'bull_tsl_mult': 0.6529985342311562, 'bull_time_stop': 101, 'bull_use_sma': True, 'bull_use_ema': False, 'bull_use_atr': True, 'bull_use_adx': True, 'bull_use_spike': False, 'bull_rsi_required': True, 'bear_strategy': 'mean_reversion', 'bear_bb_std_mult': 2.0747244631224744, 'bear_rsi_os': 44, 'bear_rsi_ob': 88, 'bear_adx_thresh': 34.60389091877124, 'bear_atr_min_pct': 0.0012779154890930344, 'bear_atr_max_pct': 0.0891624167880095, 'bear_tp_mult': 2.0598029023399937, 'bear_tsl_mult': 0.07137666489504414, 'bear_time_stop': 100, 'bear_use_sma': True, 'bear_use_ema': True, 'bear_use_atr': True, 'bear_use_adx': True, 'bear_use_spike': True, 'bear_rsi_required': True, 'sideways_strategy': 'breakout', 'sideways_bb_std_mult': 2.897168140730495, 'sideways_rsi_os': 17, 'sideways_rsi_ob': 47, 'sideways_adx_thresh': 7.631949868857887, 'sideways_atr_min_pct': 0.02386066830562864, 'sideways_atr_max_pct': 0.0694274461260257, 'sideways_tp_mult': 2.8078936867373843, 'sideways_tsl_mult': 0.3199045939993194, 'sideways_time_stop': 191, 'sideways_use_sma': True, 'sideways_use_ema': True, 'sideways_use_atr': False, 'sideways_use_adx': True, 'sideways_use_spike': True, 'sideways_rsi_required': True}.
[I 2025-09-01 15:03:19,629] Trial 806 finished with values: [-1000000000.0, 1000000000.0] and parameters: {'p_sma': 37, 'p_std': 52, 'p_atr': 10, 'p_adx': 15, 'rsi_period': 63, 'ema1': 21, 'ema2': 16, 'slip_atr_k': 0.16809662558815477, 'slip_spread_k': 0.058508209801306554, 'spread_hl_frac': 0.005987814636461957, 'bb_std_mult': 3.341997604789956, 'rsi_os': 36, 'rsi_ob': 94, 'vol_spike': 0.058286780693242876, 'adx_thresh': 32.698951013366795, 'atr_min_pct': 0.008725758809553464, 'atr_max_pct': 0.13977793036060362, 'tp_mult': 1.1085953663166592, 'tsl_mult': 0.7774689602786515, 'strategy': 'mean_reversion', 'time_stop': 251, 'use_sma': True, 'use_atr': False, 'use_adx': False, 'use_ema': True, 'use_spike': True, 'rsi_required': False, 'edge_k': 0.9786585805410977, 'edge_cap': 0.258102988894082, 'bull_strategy': 'breakout', 'bull_bb_std_mult': 3.5959336692548405, 'bull_rsi_os': 36, 'bull_rsi_ob': 91, 'bull_adx_thresh': 28.728377803015682, 'bull_atr_min_pct': 0.0025973627485778917, 'bull_atr_max_pct': 0.0895414280521854, 'bull_tp_mult': 2.887740975281147, 'bull_tsl_mult': 0.5041061442522959, 'bull_time_stop': 36, 'bull_use_sma': True, 'bull_use_ema': True, 'bull_use_atr': True, 'bull_use_adx': True, 'bull_use_spike': False, 'bull_rsi_required': True, 'bear_strategy': 'mean_reversion', 'bear_bb_std_mult': 3.545815709333719, 'bear_rsi_os': 28, 'bear_rsi_ob': 88, 'bear_adx_thresh': 11.03174466657938, 'bear_atr_min_pct': 0.0011919880388180113, 'bear_atr_max_pct': 0.07590758861504251, 'bear_tp_mult': 2.282142196478717, 'bear_tsl_mult': 0.11489501882339313, 'bear_time_stop': 265, 'bear_use_sma': True, 'bear_use_ema': True, 'bear_use_atr': True, 'bear_use_adx': True, 'bear_use_spike': True, 'bear_rsi_required': True, 'sideways_strategy': 'breakout', 'sideways_bb_std_mult': 1.747390385979309, 'sideways_rsi_os': 36, 'sideways_rsi_ob': 65, 'sideways_adx_thresh': 7.133173811166337, 'sideways_atr_min_pct': 0.020715648897756345, 'sideways_atr_max_pct': 0.12667692287691917, 'sideways_tp_mult': 2.804676691471086, 'sideways_tsl_mult': 0.31696893193407155, 'sideways_time_stop': 37, 'sideways_use_sma': True, 'sideways_use_ema': True, 'sideways_use_atr': False, 'sideways_use_adx': True, 'sideways_use_spike': True, 'sideways_rsi_required': True}.
[I 2025-09-01 15:03:20,944] Trial 807 finished with values: [-1000000000.0, 1000000000.0] and parameters: {'p_sma': 37, 'p_std': 58, 'p_atr': 12, 'p_adx': 27, 'rsi_period': 65, 'ema1': 21, 'ema2': 45, 'slip_atr_k': 0.16932097521223305, 'slip_spread_k': 0.05469639646390455, 'spread_hl_frac': 0.006153738969616606, 'bb_std_mult': 0.699201062269653, 'rsi_os': 54, 'rsi_ob': 54, 'vol_spike': 0.24705084204132288, 'adx_thresh': 32.67303090298068, 'atr_min_pct': 0.027158620841452902, 'atr_max_pct': 0.13490900291681532, 'tp_mult': 1.0105484558522084, 'tsl_mult': 0.8197116899272272, 'strategy': 'mean_reversion', 'time_stop': 250, 'use_sma': True, 'use_atr': False, 'use_adx': False, 'use_ema': True, 'use_spike': True, 'rsi_required': False, 'edge_k': 1.6401291353523715, 'edge_cap': 0.2550384579752215, 'bull_strategy': 'breakout', 'bull_bb_std_mult': 3.3246316346428486, 'bull_rsi_os': 43, 'bull_rsi_ob': 85, 'bull_adx_thresh': 9.174239386779611, 'bull_atr_min_pct': 0.002410431987678174, 'bull_atr_max_pct': 0.08958308394249218, 'bull_tp_mult': 2.816670856764914, 'bull_tsl_mult': 0.40677254515496303, 'bull_time_stop': 98, 'bull_use_sma': False, 'bull_use_ema': True, 'bull_use_atr': True, 'bull_use_adx': True, 'bull_use_spike': True, 'bull_rsi_required': True, 'bear_strategy': 'breakout', 'bear_bb_std_mult': 1.154632216212253, 'bear_rsi_os': 34, 'bear_rsi_ob': 88, 'bear_adx_thresh': 12.263767815269432, 'bear_atr_min_pct': 0.00115015382957058, 'bear_atr_max_pct': 0.08810978148031628, 'bear_tp_mult': 2.1610953371800523, 'bear_tsl_mult': 0.17255896914603439, 'bear_time_stop': 222, 'bear_use_sma': True, 'bear_use_ema': True, 'bear_use_atr': True, 'bear_use_adx': True, 'bear_use_spike': True, 'bear_rsi_required': True, 'sideways_strategy': 'breakout', 'sideways_bb_std_mult': 2.4567120774308906, 'sideways_rsi_os': 36, 'sideways_rsi_ob': 54, 'sideways_adx_thresh': 14.628710717133991, 'sideways_atr_min_pct': 0.01916886111745871, 'sideways_atr_max_pct': 0.033922734016106085, 'sideways_tp_mult': 1.6133613412552579, 'sideways_tsl_mult': 0.317256839046248, 'sideways_time_stop': 190, 'sideways_use_sma': True, 'sideways_use_ema': True, 'sideways_use_atr': False, 'sideways_use_adx': True, 'sideways_use_spike': True, 'sideways_rsi_required': False}.
[I 2025-09-01 15:04:01,989] Trial 809 finished with values: [-1000000000.0, 1000000000.0] and parameters: {'p_sma': 37, 'p_std': 49, 'p_atr': 24, 'p_adx': 11, 'rsi_period': 62, 'ema1': 10, 'ema2': 51, 'slip_atr_k': 0.026249802355208268, 'slip_spread_k': 0.4818035212295928, 'spread_hl_frac': 0.005853031134542898, 'bb_std_mult': 1.6786393423000368, 'rsi_os': 36, 'rsi_ob': 81, 'vol_spike': 0.1984467653301013, 'adx_thresh': 27.521815070602862, 'atr_min_pct': 0.02856214266692836, 'atr_max_pct': 0.07863430731113785, 'tp_mult': 2.86880685136128, 'tsl_mult': 0.717318472637664, 'strategy': 'mean_reversion', 'time_stop': 182, 'use_sma': True, 'use_atr': False, 'use_adx': True, 'use_ema': True, 'use_spike': True, 'rsi_required': False, 'edge_k': 1.5270866140071888, 'edge_cap': 0.3294137576766146, 'bull_strategy': 'breakout', 'bull_bb_std_mult': 3.2651482123825293, 'bull_rsi_os': 8, 'bull_rsi_ob': 54, 'bull_adx_thresh': 28.377154837117125, 'bull_atr_min_pct': 0.01762853924833503, 'bull_atr_max_pct': 0.02945131076709441, 'bull_tp_mult': 2.808008472552332, 'bull_tsl_mult': 0.4077114681430017, 'bull_time_stop': 109, 'bull_use_sma': False, 'bull_use_ema': True, 'bull_use_atr': True, 'bull_use_adx': True, 'bull_use_spike': True, 'bull_rsi_required': True, 'bear_strategy': 'breakout', 'bear_bb_std_mult': 3.545413406548638, 'bear_rsi_os': 34, 'bear_rsi_ob': 86, 'bear_adx_thresh': 29.544062076725076, 'bear_atr_min_pct': 0.01653161325163426, 'bear_atr_max_pct': 0.11796103086714224, 'bear_tp_mult': 1.3339569418603037, 'bear_tsl_mult': 0.16709662846053658, 'bear_time_stop': 39, 'bear_use_sma': True, 'bear_use_ema': True, 'bear_use_atr': True, 'bear_use_adx': True, 'bear_use_spike': False, 'bear_rsi_required': True, 'sideways_strategy': 'breakout', 'sideways_bb_std_mult': 0.9895921880934262, 'sideways_rsi_os': 5, 'sideways_rsi_ob': 55, 'sideways_adx_thresh': 7.1137063176248505, 'sideways_atr_min_pct': 0.02867273533642061, 'sideways_atr_max_pct': 0.06262504861221661, 'sideways_tp_mult': 2.6864807761368756, 'sideways_tsl_mult': 0.23846938503014806, 'sideways_time_stop': 158, 'sideways_use_sma': True, 'sideways_use_ema': False, 'sideways_use_atr': True, 'sideways_use_adx': True, 'sideways_use_spike': False, 'sideways_rsi_required': False}.
[I 2025-09-01 15:04:02,331] Trial 808 finished with values: [-1000000000.0, 1000000000.0] and parameters: {'p_sma': 45, 'p_std': 52, 'p_atr': 24, 'p_adx': 20, 'rsi_period': 62, 'ema1': 10, 'ema2': 51, 'slip_atr_k': 0.025808539098344928, 'slip_spread_k': 0.14551022152878568, 'spread_hl_frac': 0.005056119172889752, 'bb_std_mult': 0.7061267945051204, 'rsi_os': 33, 'rsi_ob': 79, 'vol_spike': 0.25338793443189184, 'adx_thresh': 27.93294039829764, 'atr_min_pct': 0.028462495453235384, 'atr_max_pct': 0.13499134860906944, 'tp_mult': 1.0995170964589507, 'tsl_mult': 0.5318553224780108, 'strategy': 'mean_reversion', 'time_stop': 252, 'use_sma': True, 'use_atr': False, 'use_adx': True, 'use_ema': True, 'use_spike': True, 'rsi_required': False, 'edge_k': 1.53146168436955, 'edge_cap': 0.25334187501454475, 'bull_strategy': 'breakout', 'bull_bb_std_mult': 3.2601256055430032, 'bull_rsi_os': 53, 'bull_rsi_ob': 57, 'bull_adx_thresh': 28.558585375779742, 'bull_atr_min_pct': 0.024987388753032684, 'bull_atr_max_pct': 0.024358191452052275, 'bull_tp_mult': 2.8489440806086392, 'bull_tsl_mult': 0.4978954684678177, 'bull_time_stop': 112, 'bull_use_sma': False, 'bull_use_ema': True, 'bull_use_atr': True, 'bull_use_adx': True, 'bull_use_spike': True, 'bull_rsi_required': True, 'bear_strategy': 'breakout', 'bear_bb_std_mult': 3.5463593770135624, 'bear_rsi_os': 34, 'bear_rsi_ob': 88, 'bear_adx_thresh': 12.265549610455034, 'bear_atr_min_pct': 0.016656503801727212, 'bear_atr_max_pct': 0.04834858168678701, 'bear_tp_mult': 2.149962504510227, 'bear_tsl_mult': 0.1678486496295426, 'bear_time_stop': 101, 'bear_use_sma': True, 'bear_use_ema': True, 'bear_use_atr': True, 'bear_use_adx': True, 'bear_use_spike': True, 'bear_rsi_required': True, 'sideways_strategy': 'breakout', 'sideways_bb_std_mult': 1.7074760086764804, 'sideways_rsi_os': 36, 'sideways_rsi_ob': 70, 'sideways_adx_thresh': 6.639059202815655, 'sideways_atr_min_pct': 0.028653547206097293, 'sideways_atr_max_pct': 0.12122602165069157, 'sideways_tp_mult': 1.8501155275436105, 'sideways_tsl_mult': 0.3216205388017683, 'sideways_time_stop': 143, 'sideways_use_sma': True, 'sideways_use_ema': True, 'sideways_use_atr': False, 'sideways_use_adx': True, 'sideways_use_spike': False, 'sideways_rsi_required': False}.
