[I 2025-09-01 14:53:46,823] Trial 748 finished with values: [-1000000000.0, 1000000000.0] and parameters: {'p_sma': 37, 'p_std': 50, 'p_atr': 25, 'p_adx': 11, 'rsi_period': 67, 'ema1': 9, 'ema2': 18, 'slip_atr_k': 0.012080425945056608, 'slip_spread_k': 0.08242865096809449, 'spread_hl_frac': 0.003998910582233447, 'bb_std_mult': 1.0969105601584581, 'rsi_os': 41, 'rsi_ob': 92, 'vol_spike': 0.2319678654411143, 'adx_thresh': 25.951876258475078, 'atr_min_pct': 0.025114329983025555, 'atr_max_pct': 0.08920364232996805, 'tp_mult': 2.2338003653704357, 'tsl_mult': 0.32870713468368445, 'strategy': 'mean_reversion', 'time_stop': 248, 'use_sma': True, 'use_atr': True, 'use_adx': True, 'use_ema': False, 'use_spike': True, 'rsi_required': True, 'edge_k': 0.7667122755424636, 'edge_cap': 0.7378638759042969, 'bull_strategy': 'mean_reversion', 'bull_bb_std_mult': 3.314339479683561, 'bull_rsi_os': 34, 'bull_rsi_ob': 66, 'bull_adx_thresh': 31.042241141326823, 'bull_atr_min_pct': 0.003970443398581134, 'bull_atr_max_pct': 0.02949287846646395, 'bull_tp_mult': 2.644764988436385, 'bull_tsl_mult': 0.40853582794278703, 'bull_time_stop': 110, 'bull_use_sma': False, 'bull_use_ema': False, 'bull_use_atr': True, 'bull_use_adx': True, 'bull_use_spike': False, 'bull_rsi_required': False, 'bear_strategy': 'mean_reversion', 'bear_bb_std_mult': 1.495615819493669, 'bear_rsi_os': 34, 'bear_rsi_ob': 54, 'bear_adx_thresh': 10.743575642869134, 'bear_atr_min_pct': 0.005044389785875564, 'bear_atr_max_pct': 0.039425424265666364, 'bear_tp_mult': 1.2607479389015324, 'bear_tsl_mult': 0.1801202172724749, 'bear_time_stop': 216, 'bear_use_sma': False, 'bear_use_ema': True, 'bear_use_atr': False, 'bear_use_adx': False, 'bear_use_spike': True, 'bear_rsi_required': True, 'sideways_strategy': 'mean_reversion', 'sideways_bb_std_mult': 1.648603958660832, 'sideways_rsi_os': 52, 'sideways_rsi_ob': 92, 'sideways_adx_thresh': 30.057132464550627, 'sideways_atr_min_pct': 0.0182198803447344, 'sideways_atr_max_pct': 0.12894352654475794, 'sideways_tp_mult': 1.980070362881515, 'sideways_tsl_mult': 0.26259796134718977, 'sideways_time_stop': 249, 'sideways_use_sma': True, 'sideways_use_ema': False, 'sideways_use_atr': False, 'sideways_use_adx': True, 'sideways_use_spike': True, 'sideways_rsi_required': True}.
[I 2025-09-01 14:53:47,903] Trial 749 finished with values: [-1000000000.0, 1000000000.0] and parameters: {'p_sma': 29, 'p_std': 50, 'p_atr': 25, 'p_adx': 20, 'rsi_period': 68, 'ema1': 22, 'ema2': 41, 'slip_atr_k': 0.2336672273505831, 'slip_spread_k': 0.5233207480815654, 'spread_hl_frac': 0.005949589483002381, 'bb_std_mult': 3.5323333911295385, 'rsi_os': 14, 'rsi_ob': 73, 'vol_spike': 0.14871903738665246, 'adx_thresh': 25.88968139883876, 'atr_min_pct': 0.017454925758335692, 'atr_max_pct': 0.14227177717400724, 'tp_mult': 2.05174432892436, 'tsl_mult': 0.43003447789902816, 'strategy': 'breakout', 'time_stop': 232, 'use_sma': True, 'use_atr': True, 'use_adx': True, 'use_ema': False, 'use_spike': True, 'rsi_required': True, 'edge_k': 1.9503119013489143, 'edge_cap': 0.355079081539522, 'bull_strategy': 'mean_reversion', 'bull_bb_std_mult': 3.2358228466247403, 'bull_rsi_os': 33, 'bull_rsi_ob': 75, 'bull_adx_thresh': 16.465808791165035, 'bull_atr_min_pct': 0.004658835879472751, 'bull_atr_max_pct': 0.026305904951253043, 'bull_tp_mult': 2.8899735564829987, 'bull_tsl_mult': 0.4132928846282905, 'bull_time_stop': 83, 'bull_use_sma': False, 'bull_use_ema': False, 'bull_use_atr': True, 'bull_use_adx': True, 'bull_use_spike': False, 'bull_rsi_required': False, 'bear_strategy': 'mean_reversion', 'bear_bb_std_mult': 3.4299749048685544, 'bear_rsi_os': 34, 'bear_rsi_ob': 66, 'bear_adx_thresh': 22.55788877829648, 'bear_atr_min_pct': 0.0029024632540515355, 'bear_atr_max_pct': 0.03971720635826684, 'bear_tp_mult': 2.2532436794441417, 'bear_tsl_mult': 0.5926711457176401, 'bear_time_stop': 52, 'bear_use_sma': False, 'bear_use_ema': True, 'bear_use_atr': False, 'bear_use_adx': False, 'bear_use_spike': True, 'bear_rsi_required': True, 'sideways_strategy': 'mean_reversion', 'sideways_bb_std_mult': 1.387997757188872, 'sideways_rsi_os': 52, 'sideways_rsi_ob': 89, 'sideways_adx_thresh': 17.30937765944312, 'sideways_atr_min_pct': 0.02030509598944971, 'sideways_atr_max_pct': 0.06709965588102403, 'sideways_tp_mult': 2.8421167352409986, 'sideways_tsl_mult': 0.8577069148032113, 'sideways_time_stop': 170, 'sideways_use_sma': True, 'sideways_use_ema': False, 'sideways_use_atr': False, 'sideways_use_adx': True, 'sideways_use_spike': True, 'sideways_rsi_required': True}.
[I 2025-09-01 14:53:48,618] Trial 747 finished with values: [-1000000000.0, 1000000000.0] and parameters: {'p_sma': 28, 'p_std': 7, 'p_atr': 25, 'p_adx': 14, 'rsi_period': 69, 'ema1': 9, 'ema2': 18, 'slip_atr_k': 0.1088726240415091, 'slip_spread_k': 0.5340971663197961, 'spread_hl_frac': 0.03036108702574065, 'bb_std_mult': 2.096602895189955, 'rsi_os': 41, 'rsi_ob': 86, 'vol_spike': 0.28931878695525143, 'adx_thresh': 29.37028519276239, 'atr_min_pct': 0.004703282576882014, 'atr_max_pct': 0.11105996239676147, 'tp_mult': 1.0670498614317803, 'tsl_mult': 0.6969336616815789, 'strategy': 'mean_reversion', 'time_stop': 173, 'use_sma': True, 'use_atr': True, 'use_adx': True, 'use_ema': False, 'use_spike': True, 'rsi_required': False, 'edge_k': 0.896101850831996, 'edge_cap': 0.32532442042053733, 'bull_strategy': 'mean_reversion', 'bull_bb_std_mult': 3.311738504901847, 'bull_rsi_os': 33, 'bull_rsi_ob': 54, 'bull_adx_thresh': 16.579147720997476, 'bull_atr_min_pct': 0.004281362862174138, 'bull_atr_max_pct': 0.02704754467085787, 'bull_tp_mult': 2.7705770093540987, 'bull_tsl_mult': 0.40857184777475447, 'bull_time_stop': 12, 'bull_use_sma': False, 'bull_use_ema': False, 'bull_use_atr': True, 'bull_use_adx': True, 'bull_use_spike': False, 'bull_rsi_required': False, 'bear_strategy': 'mean_reversion', 'bear_bb_std_mult': 3.418769620792404, 'bear_rsi_os': 28, 'bear_rsi_ob': 87, 'bear_adx_thresh': 22.135063430468044, 'bear_atr_min_pct': 0.0050795231448399255, 'bear_atr_max_pct': 0.013503813979428403, 'bear_tp_mult': 2.2473441352722134, 'bear_tsl_mult': 0.999973067400482, 'bear_time_stop': 215, 'bear_use_sma': False, 'bear_use_ema': True, 'bear_use_atr': False, 'bear_use_adx': True, 'bear_use_spike': True, 'bear_rsi_required': True, 'sideways_strategy': 'mean_reversion', 'sideways_bb_std_mult': 1.6340001173548424, 'sideways_rsi_os': 41, 'sideways_rsi_ob': 89, 'sideways_adx_thresh': 10.447339401487957, 'sideways_atr_min_pct': 0.020611567906478934, 'sideways_atr_max_pct': 0.02759609882132627, 'sideways_tp_mult': 2.9526843973799872, 'sideways_tsl_mult': 0.8394879967759696, 'sideways_time_stop': 292, 'sideways_use_sma': True, 'sideways_use_ema': False, 'sideways_use_atr': False, 'sideways_use_adx': True, 'sideways_use_spike': True, 'sideways_rsi_required': True}.
[I 2025-09-01 14:54:31,322] Trial 753 finished with values: [-0.062224521190397675, 0.062216317407981836] and parameters: {'p_sma': 34, 'p_std': 22, 'p_atr': 25, 'p_adx': 13, 'rsi_period': 60, 'ema1': 8, 'ema2': 20, 'slip_atr_k': 0.004566259464431906, 'slip_spread_k': 0.43279180978913134, 'spread_hl_frac': 0.001998250855648233, 'bb_std_mult': 1.612669568792052, 'rsi_os': 39, 'rsi_ob': 65, 'vol_spike': 0.24340802847817614, 'adx_thresh': 13.604673100721415, 'atr_min_pct': 0.025980081259668716, 'atr_max_pct': 0.1382213011442676, 'tp_mult': 2.696481319119588, 'tsl_mult': 0.7503350682916837, 'strategy': 'breakout', 'time_stop': 239, 'use_sma': False, 'use_atr': False, 'use_adx': False, 'use_ema': True, 'use_spike': True, 'rsi_required': False, 'edge_k': 0.5077271665566392, 'edge_cap': 0.2899384302999275, 'bull_strategy': 'breakout', 'bull_bb_std_mult': 3.0117632808507873, 'bull_rsi_os': 35, 'bull_rsi_ob': 87, 'bull_adx_thresh': 10.883464338098365, 'bull_atr_min_pct': 0.02815982691441963, 'bull_atr_max_pct': 0.03535340342621861, 'bull_tp_mult': 2.80047063931026, 'bull_tsl_mult': 0.0765324872297724, 'bull_time_stop': 77, 'bull_use_sma': True, 'bull_use_ema': True, 'bull_use_atr': False, 'bull_use_adx': False, 'bull_use_spike': False, 'bull_rsi_required': True, 'bear_strategy': 'breakout', 'bear_bb_std_mult': 3.2800511038373155, 'bear_rsi_os': 39, 'bear_rsi_ob': 89, 'bear_adx_thresh': 32.14542957519026, 'bear_atr_min_pct': 0.001964617895315298, 'bear_atr_max_pct': 0.044560431661620846, 'bear_tp_mult': 2.3175501816437234, 'bear_tsl_mult': 0.1681688900953723, 'bear_time_stop': 204, 'bear_use_sma': True, 'bear_use_ema': True, 'bear_use_atr': True, 'bear_use_adx': True, 'bear_use_spike': False, 'bear_rsi_required': True, 'sideways_strategy': 'breakout', 'sideways_bb_std_mult': 1.7636337884708726, 'sideways_rsi_os': 50, 'sideways_rsi_ob': 68, 'sideways_adx_thresh': 7.194122772299276, 'sideways_atr_min_pct': 0.02278394263940386, 'sideways_atr_max_pct': 0.05500428309559073, 'sideways_tp_mult': 1.766929841288429, 'sideways_tsl_mult': 0.452235214042537, 'sideways_time_stop': 180, 'sideways_use_sma': True, 'sideways_use_ema': True, 'sideways_use_atr': True, 'sideways_use_adx': True, 'sideways_use_spike': False, 'sideways_rsi_required': True}.
[I 2025-09-01 14:54:31,343] Trial 751 finished with values: [-1000000000.0, 1000000000.0] and parameters: {'p_sma': 35, 'p_std': 7, 'p_atr': 25, 'p_adx': 10, 'rsi_period': 69, 'ema1': 22, 'ema2': 29, 'slip_atr_k': 0.007961388163268086, 'slip_spread_k': 0.050464988388966986, 'spread_hl_frac': 0.0014404943798241518, 'bb_std_mult': 1.3133532143042619, 'rsi_os': 44, 'rsi_ob': 79, 'vol_spike': 0.1555525259591511, 'adx_thresh': 27.09986908336, 'atr_min_pct': 0.02596124352136324, 'atr_max_pct': 0.13901243228277194, 'tp_mult': 2.050150489055916, 'tsl_mult': 0.5012851924884791, 'strategy': 'breakout', 'time_stop': 221, 'use_sma': False, 'use_atr': False, 'use_adx': True, 'use_ema': True, 'use_spike': True, 'rsi_required': True, 'edge_k': 0.0993785824905482, 'edge_cap': 0.2871081604712103, 'bull_strategy': 'breakout', 'bull_bb_std_mult': 3.2244967530237822, 'bull_rsi_os': 35, 'bull_rsi_ob': 75, 'bull_adx_thresh': 20.56183580061228, 'bull_atr_min_pct': 0.024026727957293603, 'bull_atr_max_pct': 0.027260623495617694, 'bull_tp_mult': 2.879068701868206, 'bull_tsl_mult': 0.771923721133552, 'bull_time_stop': 84, 'bull_use_sma': True, 'bull_use_ema': True, 'bull_use_atr': False, 'bull_use_adx': False, 'bull_use_spike': False, 'bull_rsi_required': True, 'bear_strategy': 'mean_reversion', 'bear_bb_std_mult': 3.4240286964542275, 'bear_rsi_os': 33, 'bear_rsi_ob': 89, 'bear_adx_thresh': 11.18284525286302, 'bear_atr_min_pct': 0.003054651501489757, 'bear_atr_max_pct': 0.12600413056966348, 'bear_tp_mult': 2.3045335303338383, 'bear_tsl_mult': 0.1579872483676116, 'bear_time_stop': 203, 'bear_use_sma': True, 'bear_use_ema': True, 'bear_use_atr': True, 'bear_use_adx': False, 'bear_use_spike': False, 'bear_rsi_required': True, 'sideways_strategy': 'breakout', 'sideways_bb_std_mult': 1.74675968767189, 'sideways_rsi_os': 21, 'sideways_rsi_ob': 90, 'sideways_adx_thresh': 7.152326163621842, 'sideways_atr_min_pct': 0.020340475420793095, 'sideways_atr_max_pct': 0.1074408844623346, 'sideways_tp_mult': 2.8234082894768893, 'sideways_tsl_mult': 0.45132375332313324, 'sideways_time_stop': 167, 'sideways_use_sma': True, 'sideways_use_ema': True, 'sideways_use_atr': True, 'sideways_use_adx': True, 'sideways_use_spike': True, 'sideways_rsi_required': True}.
[I 2025-09-01 14:54:32,032] Trial 752 finished with values: [-0.025068106859811645, 0.025057878190517052] and parameters: {'p_sma': 36, 'p_std': 49, 'p_atr': 25, 'p_adx': 13, 'rsi_period': 48, 'ema1': 21, 'ema2': 19, 'slip_atr_k': 0.0042056733486072456, 'slip_spread_k': 0.11186747595161192, 'spread_hl_frac': 0.0011889976287723543, 'bb_std_mult': 0.5509671962395373, 'rsi_os': 18, 'rsi_ob': 65, 'vol_spike': 0.12888609615926014, 'adx_thresh': 27.27551561588464, 'atr_min_pct': 0.026511595230162686, 'atr_max_pct': 0.13889763090189844, 'tp_mult': 1.119089202368395, 'tsl_mult': 0.7472373454272008, 'strategy': 'mean_reversion', 'time_stop': 223, 'use_sma': False, 'use_atr': False, 'use_adx': False, 'use_ema': True, 'use_spike': True, 'rsi_required': False, 'edge_k': 0.5237172765389473, 'edge_cap': 0.2860379328137008, 'bull_strategy': 'breakout', 'bull_bb_std_mult': 3.0045752743318803, 'bull_rsi_os': 36, 'bull_rsi_ob': 53, 'bull_adx_thresh': 11.001381056035767, 'bull_atr_min_pct': 0.01649160131913879, 'bull_atr_max_pct': 0.13081919525514432, 'bull_tp_mult': 2.8047882839558356, 'bull_tsl_mult': 0.18808678833960113, 'bull_time_stop': 104, 'bull_use_sma': True, 'bull_use_ema': True, 'bull_use_atr': False, 'bull_use_adx': False, 'bull_use_spike': False, 'bull_rsi_required': True, 'bear_strategy': 'breakout', 'bear_bb_std_mult': 3.45987923067237, 'bear_rsi_os': 33, 'bear_rsi_ob': 72, 'bear_adx_thresh': 13.527065823886169, 'bear_atr_min_pct': 0.0021556166588055084, 'bear_atr_max_pct': 0.043262146304904985, 'bear_tp_mult': 2.314632616687498, 'bear_tsl_mult': 0.3770343926312594, 'bear_time_stop': 234, 'bear_use_sma': True, 'bear_use_ema': True, 'bear_use_atr': True, 'bear_use_adx': True, 'bear_use_spike': False, 'bear_rsi_required': True, 'sideways_strategy': 'breakout', 'sideways_bb_std_mult': 1.571301430321533, 'sideways_rsi_os': 44, 'sideways_rsi_ob': 68, 'sideways_adx_thresh': 6.944524120610186, 'sideways_atr_min_pct': 0.02297406271714284, 'sideways_atr_max_pct': 0.11293933592615843, 'sideways_tp_mult': 2.764559050858072, 'sideways_tsl_mult': 0.3334871755390982, 'sideways_time_stop': 180, 'sideways_use_sma': True, 'sideways_use_ema': True, 'sideways_use_atr': True, 'sideways_use_adx': True, 'sideways_use_spike': False, 'sideways_rsi_required': True}.
[I 2025-09-01 14:54:32,515] Trial 750 finished with values: [-1000000000.0, 1000000000.0] and parameters: {'p_sma': 53, 'p_std': 60, 'p_atr': 25, 'p_adx': 18, 'rsi_period': 20, 'ema1': 22, 'ema2': 44, 'slip_atr_k': 0.12314924500979213, 'slip_spread_k': 0.5285366676285289, 'spread_hl_frac': 0.0010833425311632915, 'bb_std_mult': 1.9105546557385409, 'rsi_os': 44, 'rsi_ob': 92, 'vol_spike': 0.24225876697910312, 'adx_thresh': 15.148022394300158, 'atr_min_pct': 0.02593886706189335, 'atr_max_pct': 0.1420323362912263, 'tp_mult': 1.1154547866413316, 'tsl_mult': 0.7505168774067859, 'strategy': 'breakout', 'time_stop': 231, 'use_sma': True, 'use_atr': False, 'use_adx': True, 'use_ema': True, 'use_spike': True, 'rsi_required': True, 'edge_k': 0.5103370321486839, 'edge_cap': 0.3546217603727838, 'bull_strategy': 'mean_reversion', 'bull_bb_std_mult': 3.2419360505201626, 'bull_rsi_os': 35, 'bull_rsi_ob': 75, 'bull_adx_thresh': 18.15387306855426, 'bull_atr_min_pct': 0.005066424820370352, 'bull_atr_max_pct': 0.08018887747292218, 'bull_tp_mult': 2.642544635512579, 'bull_tsl_mult': 0.07771421734947903, 'bull_time_stop': 82, 'bull_use_sma': True, 'bull_use_ema': True, 'bull_use_atr': False, 'bull_use_adx': True, 'bull_use_spike': False, 'bull_rsi_required': False, 'bear_strategy': 'mean_reversion', 'bear_bb_std_mult': 1.4825336918935763, 'bear_rsi_os': 35, 'bear_rsi_ob': 72, 'bear_adx_thresh': 32.26091530767333, 'bear_atr_min_pct': 0.0030220159813833924, 'bear_atr_max_pct': 0.03909074480630306, 'bear_tp_mult': 2.2948364108552433, 'bear_tsl_mult': 0.9804496433606269, 'bear_time_stop': 235, 'bear_use_sma': False, 'bear_use_ema': True, 'bear_use_atr': True, 'bear_use_adx': False, 'bear_use_spike': True, 'bear_rsi_required': True, 'sideways_strategy': 'breakout', 'sideways_bb_std_mult': 1.3863597391576954, 'sideways_rsi_os': 21, 'sideways_rsi_ob': 68, 'sideways_adx_thresh': 18.530187199828664, 'sideways_atr_min_pct': 0.02047290219708292, 'sideways_atr_max_pct': 0.1122225650228863, 'sideways_tp_mult': 2.8788947426204614, 'sideways_tsl_mult': 0.26769793719288026, 'sideways_time_stop': 170, 'sideways_use_sma': True, 'sideways_use_ema': True, 'sideways_use_atr': False, 'sideways_use_adx': True, 'sideways_use_spike': True, 'sideways_rsi_required': True}.
[I 2025-09-01 14:55:12,848] Trial 757 finished with values: [-1000000000.0, 1000000000.0] and parameters: {'p_sma': 6, 'p_std': 46, 'p_atr': 26, 'p_adx': 12, 'rsi_period': 66, 'ema1': 21, 'ema2': 55, 'slip_atr_k': 0.014449934544253976, 'slip_spread_k': 0.1106183111498273, 'spread_hl_frac': 0.035712179100891535, 'bb_std_mult': 1.8320562864081138, 'rsi_os': 27, 'rsi_ob': 83, 'vol_spike': 0.23009669801132332, 'adx_thresh': 30.381673336473895, 'atr_min_pct': 0.027012244375083497, 'atr_max_pct': 0.13371100686023357, 'tp_mult': 1.2574670489509625, 'tsl_mult': 0.7238095851606036, 'strategy': 'mean_reversion', 'time_stop': 88, 'use_sma': True, 'use_atr': False, 'use_adx': False, 'use_ema': True, 'use_spike': False, 'rsi_required': False, 'edge_k': 1.0045679699560952, 'edge_cap': 0.3101698277108649, 'bull_strategy': 'breakout', 'bull_bb_std_mult': 3.1528121229762753, 'bull_rsi_os': 26, 'bull_rsi_ob': 59, 'bull_adx_thresh': 30.747188023785995, 'bull_atr_min_pct': 0.0021163184791079337, 'bull_atr_max_pct': 0.01251268925489854, 'bull_tp_mult': 2.8467408280026545, 'bull_tsl_mult': 0.4906374115939521, 'bull_time_stop': 160, 'bull_use_sma': True, 'bull_use_ema': True, 'bull_use_atr': True, 'bull_use_adx': True, 'bull_use_spike': True, 'bull_rsi_required': True, 'bear_strategy': 'breakout', 'bear_bb_std_mult': 3.532017395746096, 'bear_rsi_os': 45, 'bear_rsi_ob': 80, 'bear_adx_thresh': 11.281018384873603, 'bear_atr_min_pct': 0.0025651512179441236, 'bear_atr_max_pct': 0.08623986733264304, 'bear_tp_mult': 2.2136328108578884, 'bear_tsl_mult': 0.12677285739993246, 'bear_time_stop': 228, 'bear_use_sma': True, 'bear_use_ema': False, 'bear_use_atr': True, 'bear_use_adx': True, 'bear_use_spike': False, 'bear_rsi_required': False, 'sideways_strategy': 'breakout', 'sideways_bb_std_mult': 1.5338248147438107, 'sideways_rsi_os': 51, 'sideways_rsi_ob': 66, 'sideways_adx_thresh': 7.956116598472398, 'sideways_atr_min_pct': 0.01937058159150364, 'sideways_atr_max_pct': 0.03651973014595471, 'sideways_tp_mult': 2.6258764220376896, 'sideways_tsl_mult': 0.720571242135728, 'sideways_time_stop': 86, 'sideways_use_sma': False, 'sideways_use_ema': False, 'sideways_use_atr': True, 'sideways_use_adx': False, 'sideways_use_spike': False, 'sideways_rsi_required': False}.
[I 2025-09-01 14:55:13,136] Trial 754 finished with values: [-1000000000.0, 1000000000.0] and parameters: {'p_sma': 36, 'p_std': 24, 'p_atr': 25, 'p_adx': 17, 'rsi_period': 30, 'ema1': 21, 'ema2': 15, 'slip_atr_k': 0.13266229206926214, 'slip_spread_k': 0.11069667049292782, 'spread_hl_frac': 0.0355956564382562, 'bb_std_mult': 1.8436355231442376, 'rsi_os': 35, 'rsi_ob': 95, 'vol_spike': 0.23912944595756605, 'adx_thresh': 24.29789707919625, 'atr_min_pct': 0.014730564078686363, 'atr_max_pct': 0.14509436748666488, 'tp_mult': 1.117690929065723, 'tsl_mult': 0.721909700841141, 'strategy': 'mean_reversion', 'time_stop': 234, 'use_sma': True, 'use_atr': False, 'use_adx': False, 'use_ema': True, 'use_spike': True, 'rsi_required': False, 'edge_k': 1.2528472803531132, 'edge_cap': 0.3571882032731354, 'bull_strategy': 'breakout', 'bull_bb_std_mult': 2.3450507439115946, 'bull_rsi_os': 36, 'bull_rsi_ob': 59, 'bull_adx_thresh': 30.86350836466343, 'bull_atr_min_pct': 0.00311644522127002, 'bull_atr_max_pct': 0.020251613708711362, 'bull_tp_mult': 2.851979027783286, 'bull_tsl_mult': 0.44691818519110305, 'bull_time_stop': 97, 'bull_use_sma': True, 'bull_use_ema': True, 'bull_use_atr': True, 'bull_use_adx': True, 'bull_use_spike': False, 'bull_rsi_required': True, 'bear_strategy': 'breakout', 'bear_bb_std_mult': 3.4873226410706337, 'bear_rsi_os': 54, 'bear_rsi_ob': 72, 'bear_adx_thresh': 16.943628687811287, 'bear_atr_min_pct': 0.016166849311941237, 'bear_atr_max_pct': 0.09861967929340168, 'bear_tp_mult': 2.210121389223825, 'bear_tsl_mult': 0.12286230766969912, 'bear_time_stop': 236, 'bear_use_sma': True, 'bear_use_ema': True, 'bear_use_atr': True, 'bear_use_adx': True, 'bear_use_spike': False, 'bear_rsi_required': True, 'sideways_strategy': 'breakout', 'sideways_bb_std_mult': 1.557776094316157, 'sideways_rsi_os': 29, 'sideways_rsi_ob': 50, 'sideways_adx_thresh': 18.50184784766479, 'sideways_atr_min_pct': 0.026456873573440128, 'sideways_atr_max_pct': 0.010164067300380969, 'sideways_tp_mult': 1.9348970490205157, 'sideways_tsl_mult': 0.266096944457951, 'sideways_time_stop': 71, 'sideways_use_sma': True, 'sideways_use_ema': False, 'sideways_use_atr': True, 'sideways_use_adx': True, 'sideways_use_spike': False, 'sideways_rsi_required': True}.
