[I 2025-09-01 14:29:58,216] Trial 584 finished with values: [-1000000000.0, 1000000000.0] and parameters: {'p_sma': 35, 'p_std': 52, 'p_atr': 27, 'p_adx': 17, 'rsi_period': 73, 'ema1': 21, 'ema2': 45, 'slip_atr_k': 0.002603530170508477, 'slip_spread_k': 0.4909524477889281, 'spread_hl_frac': 0.013338933853658459, 'bb_std_mult': 2.500911949857072, 'rsi_os': 40, 'rsi_ob': 83, 'vol_spike': 0.20438978071613398, 'adx_thresh': 20.531286187884874, 'atr_min_pct': 0.005847484999571061, 'atr_max_pct': 0.13606153254295908, 'tp_mult': 1.0547850067283744, 'tsl_mult': 0.22778288879175573, 'strategy': 'mean_reversion', 'time_stop': 144, 'use_sma': True, 'use_atr': False, 'use_adx': False, 'use_ema': False, 'use_spike': True, 'rsi_required': True, 'edge_k': 1.8049754944796295, 'edge_cap': 0.2982207014145872, 'bull_strategy': 'mean_reversion', 'bull_bb_std_mult': 3.354099827473081, 'bull_rsi_os': 39, 'bull_rsi_ob': 95, 'bull_adx_thresh': 31.126767094150264, 'bull_atr_min_pct': 0.024007729068488026, 'bull_atr_max_pct': 0.06121799304272765, 'bull_tp_mult': 2.453348048217805, 'bull_tsl_mult': 0.4426570096895674, 'bull_time_stop': 182, 'bull_use_sma': False, 'bull_use_ema': True, 'bull_use_atr': True, 'bull_use_adx': True, 'bull_use_spike': False, 'bull_rsi_required': True, 'bear_strategy': 'breakout', 'bear_bb_std_mult': 3.481075095897448, 'bear_rsi_os': 31, 'bear_rsi_ob': 87, 'bear_adx_thresh': 25.84927261880946, 'bear_atr_min_pct': 0.0031827794006134336, 'bear_atr_max_pct': 0.13968013144948216, 'bear_tp_mult': 2.3444090226978647, 'bear_tsl_mult': 0.3824482934093645, 'bear_time_stop': 137, 'bear_use_sma': False, 'bear_use_ema': False, 'bear_use_atr': False, 'bear_use_adx': True, 'bear_use_spike': False, 'bear_rsi_required': True, 'sideways_strategy': 'breakout', 'sideways_bb_std_mult': 2.076601654237627, 'sideways_rsi_os': 7, 'sideways_rsi_ob': 66, 'sideways_adx_thresh': 6.439730363983676, 'sideways_atr_min_pct': 0.020543469527410436, 'sideways_atr_max_pct': 0.06568497223415046, 'sideways_tp_mult': 2.808266272814816, 'sideways_tsl_mult': 0.2820485064911367, 'sideways_time_stop': 183, 'sideways_use_sma': True, 'sideways_use_ema': False, 'sideways_use_atr': True, 'sideways_use_adx': True, 'sideways_use_spike': False, 'sideways_rsi_required': True}.
[I 2025-09-01 14:29:58,461] Trial 586 finished with values: [-1000000000.0, 1000000000.0] and parameters: {'p_sma': 35, 'p_std': 51, 'p_atr': 28, 'p_adx': 26, 'rsi_period': 63, 'ema1': 20, 'ema2': 15, 'slip_atr_k': 0.009423528608441319, 'slip_spread_k': 0.4925192476741388, 'spread_hl_frac': 0.012567389742140686, 'bb_std_mult': 1.2352881902501993, 'rsi_os': 5, 'rsi_ob': 57, 'vol_spike': 0.03463442149683511, 'adx_thresh': 28.157324278889668, 'atr_min_pct': 0.0007066156717873816, 'atr_max_pct': 0.13697657065436677, 'tp_mult': 2.8238338674912233, 'tsl_mult': 0.1861468345491576, 'strategy': 'mean_reversion', 'time_stop': 229, 'use_sma': True, 'use_atr': False, 'use_adx': False, 'use_ema': False, 'use_spike': True, 'rsi_required': True, 'edge_k': 0.788901923444786, 'edge_cap': 0.8709507136401735, 'bull_strategy': 'breakout', 'bull_bb_std_mult': 3.335859644324859, 'bull_rsi_os': 12, 'bull_rsi_ob': 55, 'bull_adx_thresh': 29.876923371360988, 'bull_atr_min_pct': 0.004253742714142668, 'bull_atr_max_pct': 0.06110560301254654, 'bull_tp_mult': 2.822463748307095, 'bull_tsl_mult': 0.40322869025032276, 'bull_time_stop': 182, 'bull_use_sma': True, 'bull_use_ema': False, 'bull_use_atr': True, 'bull_use_adx': True, 'bull_use_spike': False, 'bull_rsi_required': True, 'bear_strategy': 'breakout', 'bear_bb_std_mult': 2.068755527519836, 'bear_rsi_os': 8, 'bear_rsi_ob': 48, 'bear_adx_thresh': 11.736972111961954, 'bear_atr_min_pct': 0.029442337260661554, 'bear_atr_max_pct': 0.043810263969741456, 'bear_tp_mult': 2.3361518083344968, 'bear_tsl_mult': 0.9647242743515285, 'bear_time_stop': 201, 'bear_use_sma': True, 'bear_use_ema': False, 'bear_use_atr': False, 'bear_use_adx': True, 'bear_use_spike': False, 'bear_rsi_required': True, 'sideways_strategy': 'breakout', 'sideways_bb_std_mult': 1.5838833218531223, 'sideways_rsi_os': 10, 'sideways_rsi_ob': 66, 'sideways_adx_thresh': 6.356467334698069, 'sideways_atr_min_pct': 0.020030050613915152, 'sideways_atr_max_pct': 0.038660964506264085, 'sideways_tp_mult': 2.703877112261217, 'sideways_tsl_mult': 0.28051876181085705, 'sideways_time_stop': 186, 'sideways_use_sma': True, 'sideways_use_ema': False, 'sideways_use_atr': True, 'sideways_use_adx': True, 'sideways_use_spike': False, 'sideways_rsi_required': True}.
[I 2025-09-01 14:29:58,701] Trial 587 finished with values: [-1000000000.0, 1000000000.0] and parameters: {'p_sma': 35, 'p_std': 49, 'p_atr': 9, 'p_adx': 30, 'rsi_period': 22, 'ema1': 19, 'ema2': 15, 'slip_atr_k': 0.00212605477806797, 'slip_spread_k': 0.08485033784752004, 'spread_hl_frac': 0.00729543053843253, 'bb_std_mult': 1.5970748573246885, 'rsi_os': 41, 'rsi_ob': 73, 'vol_spike': 0.22528121625091163, 'adx_thresh': 24.21981780191056, 'atr_min_pct': 0.0057671206711134345, 'atr_max_pct': 0.1356134655964733, 'tp_mult': 2.8242757142185075, 'tsl_mult': 0.7620544537793909, 'strategy': 'breakout', 'time_stop': 229, 'use_sma': True, 'use_atr': False, 'use_adx': False, 'use_ema': False, 'use_spike': True, 'rsi_required': True, 'edge_k': 0.7808946659082215, 'edge_cap': 0.3003431558416335, 'bull_strategy': 'breakout', 'bull_bb_std_mult': 3.344149294344145, 'bull_rsi_os': 25, 'bull_rsi_ob': 94, 'bull_adx_thresh': 29.760990070246343, 'bull_atr_min_pct': 0.004070593491006643, 'bull_atr_max_pct': 0.02179873364732427, 'bull_tp_mult': 2.8351729667950396, 'bull_tsl_mult': 0.2931991471646531, 'bull_time_stop': 81, 'bull_use_sma': True, 'bull_use_ema': False, 'bull_use_atr': True, 'bull_use_adx': True, 'bull_use_spike': False, 'bull_rsi_required': True, 'bear_strategy': 'breakout', 'bear_bb_std_mult': 2.041482152370267, 'bear_rsi_os': 5, 'bear_rsi_ob': 52, 'bear_adx_thresh': 11.872668656050942, 'bear_atr_min_pct': 0.029975523996617123, 'bear_atr_max_pct': 0.04196458619332675, 'bear_tp_mult': 2.268293933657415, 'bear_tsl_mult': 0.34237952935112725, 'bear_time_stop': 228, 'bear_use_sma': True, 'bear_use_ema': False, 'bear_use_atr': False, 'bear_use_adx': False, 'bear_use_spike': False, 'bear_rsi_required': True, 'sideways_strategy': 'breakout', 'sideways_bb_std_mult': 1.6660735469412877, 'sideways_rsi_os': 11, 'sideways_rsi_ob': 69, 'sideways_adx_thresh': 26.441376131700626, 'sideways_atr_min_pct': 0.024923156009953606, 'sideways_atr_max_pct': 0.06158109697218606, 'sideways_tp_mult': 2.7886310745229617, 'sideways_tsl_mult': 0.14430873723172416, 'sideways_time_stop': 187, 'sideways_use_sma': True, 'sideways_use_ema': False, 'sideways_use_atr': True, 'sideways_use_adx': True, 'sideways_use_spike': False, 'sideways_rsi_required': True}.
[I 2025-09-01 14:30:44,164] Trial 591 finished with values: [-1000000000.0, 1000000000.0] and parameters: {'p_sma': 29, 'p_std': 22, 'p_atr': 15, 'p_adx': 12, 'rsi_period': 65, 'ema1': 18, 'ema2': 18, 'slip_atr_k': 0.021096986566002663, 'slip_spread_k': 0.06176144554240665, 'spread_hl_frac': 0.0362253784192268, 'bb_std_mult': 1.6805447596630578, 'rsi_os': 47, 'rsi_ob': 75, 'vol_spike': 0.22926335388962613, 'adx_thresh': 25.959518286300455, 'atr_min_pct': 0.026067246028287794, 'atr_max_pct': 0.13318404437241038, 'tp_mult': 1.100979026908791, 'tsl_mult': 0.6860509737690086, 'strategy': 'breakout', 'time_stop': 260, 'use_sma': False, 'use_atr': True, 'use_adx': False, 'use_ema': True, 'use_spike': False, 'rsi_required': False, 'edge_k': 0.8955954245027619, 'edge_cap': 0.3497570254795749, 'bull_strategy': 'breakout', 'bull_bb_std_mult': 2.261063733845548, 'bull_rsi_os': 53, 'bull_rsi_ob': 53, 'bull_adx_thresh': 30.84209186707669, 'bull_atr_min_pct': 0.006705919920440369, 'bull_atr_max_pct': 0.035209907573795184, 'bull_tp_mult': 2.883224278356572, 'bull_tsl_mult': 0.34467743743716345, 'bull_time_stop': 100, 'bull_use_sma': True, 'bull_use_ema': True, 'bull_use_atr': True, 'bull_use_adx': False, 'bull_use_spike': False, 'bull_rsi_required': False, 'bear_strategy': 'breakout', 'bear_bb_std_mult': 2.4125029026007825, 'bear_rsi_os': 29, 'bear_rsi_ob': 89, 'bear_adx_thresh': 10.09781489628555, 'bear_atr_min_pct': 0.004353753135979052, 'bear_atr_max_pct': 0.04657776791661541, 'bear_tp_mult': 2.2697367014422927, 'bear_tsl_mult': 0.47437071616552384, 'bear_time_stop': 221, 'bear_use_sma': True, 'bear_use_ema': True, 'bear_use_atr': True, 'bear_use_adx': False, 'bear_use_spike': True, 'bear_rsi_required': False, 'sideways_strategy': 'mean_reversion', 'sideways_bb_std_mult': 2.2924237683461657, 'sideways_rsi_os': 41, 'sideways_rsi_ob': 68, 'sideways_adx_thresh': 29.6064931028291, 'sideways_atr_min_pct': 0.02000748583701083, 'sideways_atr_max_pct': 0.14763634857405017, 'sideways_tp_mult': 2.7429166770466096, 'sideways_tsl_mult': 0.3598457024595483, 'sideways_time_stop': 52, 'sideways_use_sma': False, 'sideways_use_ema': True, 'sideways_use_atr': False, 'sideways_use_adx': True, 'sideways_use_spike': False, 'sideways_rsi_required': True}.
[I 2025-09-01 14:30:44,792] Trial 588 finished with values: [-1000000000.0, 1000000000.0] and parameters: {'p_sma': 49, 'p_std': 24, 'p_atr': 24, 'p_adx': 30, 'rsi_period': 22, 'ema1': 29, 'ema2': 42, 'slip_atr_k': 0.01031318624174049, 'slip_spread_k': 0.146049815674556, 'spread_hl_frac': 0.00787797239060041, 'bb_std_mult': 2.870982810913861, 'rsi_os': 37, 'rsi_ob': 87, 'vol_spike': 0.2276215686543601, 'adx_thresh': 24.086190617434006, 'atr_min_pct': 0.000509600636873362, 'atr_max_pct': 0.14372767134770276, 'tp_mult': 2.8412561732430257, 'tsl_mult': 0.5311045761009712, 'strategy': 'breakout', 'time_stop': 231, 'use_sma': True, 'use_atr': True, 'use_adx': False, 'use_ema': True, 'use_spike': True, 'rsi_required': False, 'edge_k': 0.7935036011539078, 'edge_cap': 0.3513374894352754, 'bull_strategy': 'breakout', 'bull_bb_std_mult': 3.2894731387110414, 'bull_rsi_os': 25, 'bull_rsi_ob': 93, 'bull_adx_thresh': 29.906060270540323, 'bull_atr_min_pct': 0.003962609088797007, 'bull_atr_max_pct': 0.03500301508348752, 'bull_tp_mult': 2.8727491487471575, 'bull_tsl_mult': 0.09519028344423236, 'bull_time_stop': 171, 'bull_use_sma': True, 'bull_use_ema': False, 'bull_use_atr': True, 'bull_use_adx': False, 'bull_use_spike': False, 'bull_rsi_required': False, 'bear_strategy': 'breakout', 'bear_bb_std_mult': 2.501879450358106, 'bear_rsi_os': 14, 'bear_rsi_ob': 48, 'bear_adx_thresh': 9.928918623887395, 'bear_atr_min_pct': 0.029558758158030312, 'bear_atr_max_pct': 0.04224590084498885, 'bear_tp_mult': 2.2605541098566406, 'bear_tsl_mult': 0.343114105039092, 'bear_time_stop': 231, 'bear_use_sma': True, 'bear_use_ema': True, 'bear_use_atr': True, 'bear_use_adx': False, 'bear_use_spike': True, 'bear_rsi_required': True, 'sideways_strategy': 'mean_reversion', 'sideways_bb_std_mult': 1.6398808120996204, 'sideways_rsi_os': 48, 'sideways_rsi_ob': 89, 'sideways_adx_thresh': 29.834380752177168, 'sideways_atr_min_pct': 0.020025004347141124, 'sideways_atr_max_pct': 0.09318957603660909, 'sideways_tp_mult': 2.7570818866898, 'sideways_tsl_mult': 0.13733052805567436, 'sideways_time_stop': 178, 'sideways_use_sma': True, 'sideways_use_ema': True, 'sideways_use_atr': False, 'sideways_use_adx': True, 'sideways_use_spike': False, 'sideways_rsi_required': True}.
[I 2025-09-01 14:30:45,356] Trial 590 finished with values: [-0.03294475373051953, 0.032671591036610506] and parameters: {'p_sma': 38, 'p_std': 5, 'p_atr': 22, 'p_adx': 14, 'rsi_period': 65, 'ema1': 20, 'ema2': 18, 'slip_atr_k': 0.022449509478341255, 'slip_spread_k': 0.6279529333444902, 'spread_hl_frac': 0.0058752195271068956, 'bb_std_mult': 1.6632890784171492, 'rsi_os': 37, 'rsi_ob': 85, 'vol_spike': 0.0007988333893523547, 'adx_thresh': 26.075319692095192, 'atr_min_pct': 0.026117033757054906, 'atr_max_pct': 0.1329403563143083, 'tp_mult': 1.1016901448532024, 'tsl_mult': 0.6813358601478257, 'strategy': 'breakout', 'time_stop': 259, 'use_sma': False, 'use_atr': True, 'use_adx': False, 'use_ema': True, 'use_spike': False, 'rsi_required': False, 'edge_k': 0.9580157259677079, 'edge_cap': 0.34679875194466003, 'bull_strategy': 'breakout', 'bull_bb_std_mult': 1.1197369210657744, 'bull_rsi_os': 19, 'bull_rsi_ob': 79, 'bull_adx_thresh': 30.625813015207417, 'bull_atr_min_pct': 0.0022101465693850474, 'bull_atr_max_pct': 0.0675463197839667, 'bull_tp_mult': 2.882285131585457, 'bull_tsl_mult': 0.34879974968113736, 'bull_time_stop': 64, 'bull_use_sma': True, 'bull_use_ema': True, 'bull_use_atr': True, 'bull_use_adx': False, 'bull_use_spike': False, 'bull_rsi_required': False, 'bear_strategy': 'breakout', 'bear_bb_std_mult': 2.4842577279357387, 'bear_rsi_os': 15, 'bear_rsi_ob': 84, 'bear_adx_thresh': 8.854620297757268, 'bear_atr_min_pct': 0.016086866477091413, 'bear_atr_max_pct': 0.04541161557251321, 'bear_tp_mult': 1.8976821970118702, 'bear_tsl_mult': 0.16699439604532848, 'bear_time_stop': 29, 'bear_use_sma': True, 'bear_use_ema': True, 'bear_use_atr': True, 'bear_use_adx': False, 'bear_use_spike': True, 'bear_rsi_required': False, 'sideways_strategy': 'mean_reversion', 'sideways_bb_std_mult': 1.4532294254342375, 'sideways_rsi_os': 41, 'sideways_rsi_ob': 45, 'sideways_adx_thresh': 9.12407362784597, 'sideways_atr_min_pct': 0.006302290364425181, 'sideways_atr_max_pct': 0.06494994293233794, 'sideways_tp_mult': 2.0155429040299304, 'sideways_tsl_mult': 0.25025735627314316, 'sideways_time_stop': 227, 'sideways_use_sma': False, 'sideways_use_ema': True, 'sideways_use_atr': False, 'sideways_use_adx': True, 'sideways_use_spike': False, 'sideways_rsi_required': True}.
[I 2025-09-01 14:30:45,833] Trial 589 finished with values: [-1000000000.0, 1000000000.0] and parameters: {'p_sma': 37, 'p_std': 5, 'p_atr': 9, 'p_adx': 14, 'rsi_period': 22, 'ema1': 16, 'ema2': 55, 'slip_atr_k': 0.02186284788804188, 'slip_spread_k': 0.1414083190882308, 'spread_hl_frac': 0.007591590285214323, 'bb_std_mult': 0.8599744270316769, 'rsi_os': 14, 'rsi_ob': 84, 'vol_spike': 0.227139003221151, 'adx_thresh': 25.91314442846542, 'atr_min_pct': 0.026038616686563144, 'atr_max_pct': 0.12320811962304479, 'tp_mult': 1.1173456872618122, 'tsl_mult': 0.7613948039424463, 'strategy': 'breakout', 'time_stop': 230, 'use_sma': False, 'use_atr': True, 'use_adx': False, 'use_ema': True, 'use_spike': True, 'rsi_required': False, 'edge_k': 0.9545445283213524, 'edge_cap': 0.3531271152886838, 'bull_strategy': 'breakout', 'bull_bb_std_mult': 3.283216565693775, 'bull_rsi_os': 53, 'bull_rsi_ob': 93, 'bull_adx_thresh': 30.993948754689423, 'bull_atr_min_pct': 0.0067702070340529795, 'bull_atr_max_pct': 0.12038550371240123, 'bull_tp_mult': 2.8837196618899945, 'bull_tsl_mult': 0.3456844010943583, 'bull_time_stop': 204, 'bull_use_sma': True, 'bull_use_ema': True, 'bull_use_atr': True, 'bull_use_adx': False, 'bull_use_spike': False, 'bull_rsi_required': False, 'bear_strategy': 'breakout', 'bear_bb_std_mult': 3.550611675532274, 'bear_rsi_os': 29, 'bear_rsi_ob': 90, 'bear_adx_thresh': 10.020533003572968, 'bear_atr_min_pct': 0.004357477523827435, 'bear_atr_max_pct': 0.0419911141044181, 'bear_tp_mult': 1.8982945122750807, 'bear_tsl_mult': 0.16768218461665718, 'bear_time_stop': 223, 'bear_use_sma': True, 'bear_use_ema': True, 'bear_use_atr': True, 'bear_use_adx': False, 'bear_use_spike': True, 'bear_rsi_required': True, 'sideways_strategy': 'mean_reversion', 'sideways_bb_std_mult': 1.4320219629721425, 'sideways_rsi_os': 48, 'sideways_rsi_ob': 47, 'sideways_adx_thresh': 18.772336299571002, 'sideways_atr_min_pct': 0.01995562435581173, 'sideways_atr_max_pct': 0.06301819309322236, 'sideways_tp_mult': 2.769049794297319, 'sideways_tsl_mult': 0.13534286058882544, 'sideways_time_stop': 176, 'sideways_use_sma': True, 'sideways_use_ema': True, 'sideways_use_atr': False, 'sideways_use_adx': True, 'sideways_use_spike': False, 'sideways_rsi_required': True}.
[I 2025-09-01 14:31:24,415] Trial 592 finished with values: [-1000000000.0, 1000000000.0] and parameters: {'p_sma': 38, 'p_std': 49, 'p_atr': 19, 'p_adx': 14, 'rsi_period': 67, 'ema1': 27, 'ema2': 16, 'slip_atr_k': 0.010108910886826621, 'slip_spread_k': 0.6237569500024968, 'spread_hl_frac': 0.007774860272595657, 'bb_std_mult': 1.995012279553171, 'rsi_os': 28, 'rsi_ob': 85, 'vol_spike': 0.25160280715054223, 'adx_thresh': 8.62717232529485, 'atr_min_pct': 0.02821227566037854, 'atr_max_pct': 0.14407891371699846, 'tp_mult': 1.641364367921186, 'tsl_mult': 0.4886617856660533, 'strategy': 'mean_reversion', 'time_stop': 244, 'use_sma': True, 'use_atr': True, 'use_adx': False, 'use_ema': True, 'use_spike': True, 'rsi_required': False, 'edge_k': 0.24555005172216937, 'edge_cap': 0.5117450784469904, 'bull_strategy': 'breakout', 'bull_bb_std_mult': 1.076618521247537, 'bull_rsi_os': 31, 'bull_rsi_ob': 51, 'bull_adx_thresh': 17.78173354858064, 'bull_atr_min_pct': 0.0035616864068442515, 'bull_atr_max_pct': 0.11972669992830731, 'bull_tp_mult': 2.722042978247845, 'bull_tsl_mult': 0.23457712993855856, 'bull_time_stop': 173, 'bull_use_sma': True, 'bull_use_ema': True, 'bull_use_atr': True, 'bull_use_adx': True, 'bull_use_spike': True, 'bull_rsi_required': False, 'bear_strategy': 'breakout', 'bear_bb_std_mult': 3.5933470655631523, 'bear_rsi_os': 32, 'bear_rsi_ob': 86, 'bear_adx_thresh': 17.068960953558033, 'bear_atr_min_pct': 0.01617617888542015, 'bear_atr_max_pct': 0.03634662772461665, 'bear_tp_mult': 2.165094832438192, 'bear_tsl_mult': 0.16585610257820793, 'bear_time_stop': 221, 'bear_use_sma': True, 'bear_use_ema': True, 'bear_use_atr': True, 'bear_use_adx': True, 'bear_use_spike': False, 'bear_rsi_required': True, 'sideways_strategy': 'mean_reversion', 'sideways_bb_std_mult': 1.4422727756208473, 'sideways_rsi_os': 51, 'sideways_rsi_ob': 68, 'sideways_adx_thresh': 18.665071616918762, 'sideways_atr_min_pct': 0.01884364607684844, 'sideways_atr_max_pct': 0.0807804390836413, 'sideways_tp_mult': 1.3284651855583136, 'sideways_tsl_mult': 0.25666736326447936, 'sideways_time_stop': 226, 'sideways_use_sma': True, 'sideways_use_ema': False, 'sideways_use_atr': True, 'sideways_use_adx': True, 'sideways_use_spike': False, 'sideways_rsi_required': True}.
[I 2025-09-01 14:31:25,787] Trial 593 finished with values: [-0.010901918289446977, 0.011980788412928114] and parameters: {'p_sma': 38, 'p_std': 30, 'p_atr': 24, 'p_adx': 14, 'rsi_period': 34, 'ema1': 16, 'ema2': 55, 'slip_atr_k': 0.02230437515469543, 'slip_spread_k': 0.09850217965753952, 'spread_hl_frac': 0.0028988711159372224, 'bb_std_mult': 0.884537509893923, 'rsi_os': 45, 'rsi_ob': 86, 'vol_spike': 0.24166372583960466, 'adx_thresh': 17.54001876457794, 'atr_min_pct': 0.027694852200923766, 'atr_max_pct': 0.10734877405991611, 'tp_mult': 1.096019300524956, 'tsl_mult': 0.7393444127556338, 'strategy': 'mean_reversion', 'time_stop': 118, 'use_sma': False, 'use_atr': False, 'use_adx': True, 'use_ema': True, 'use_spike': True, 'rsi_required': False, 'edge_k': 0.9790263775725163, 'edge_cap': 0.9651637498206319, 'bull_strategy': 'breakout', 'bull_bb_std_mult': 1.0787483470962638, 'bull_rsi_os': 28, 'bull_rsi_ob': 79, 'bull_adx_thresh': 28.102714375596307, 'bull_atr_min_pct': 0.002162720751616284, 'bull_atr_max_pct': 0.09928305510065011, 'bull_tp_mult': 2.67229995546484, 'bull_tsl_mult': 0.38246682344106353, 'bull_time_stop': 91, 'bull_use_sma': True, 'bull_use_ema': True, 'bull_use_atr': False, 'bull_use_adx': True, 'bull_use_spike': True, 'bull_rsi_required': True, 'bear_strategy': 'breakout', 'bear_bb_std_mult': 3.5532632122145946, 'bear_rsi_os': 21, 'bear_rsi_ob': 90, 'bear_adx_thresh': 28.52817292965195, 'bear_atr_min_pct': 0.0030626429110813067, 'bear_atr_max_pct': 0.04551144723994781, 'bear_tp_mult': 2.158671744828038, 'bear_tsl_mult': 0.11549056297817917, 'bear_time_stop': 43, 'bear_use_sma': True, 'bear_use_ema': True, 'bear_use_atr': True, 'bear_use_adx': True, 'bear_use_spike': False, 'bear_rsi_required': True, 'sideways_strategy': 'breakout', 'sideways_bb_std_mult': 1.4504089450732367, 'sideways_rsi_os': 55, 'sideways_rsi_ob': 68, 'sideways_adx_thresh': 9.369280171509468, 'sideways_atr_min_pct': 0.00645649627414914, 'sideways_atr_max_pct': 0.06678678627187537, 'sideways_tp_mult': 1.320564291176297, 'sideways_tsl_mult': 0.25610183642215023, 'sideways_time_stop': 260, 'sideways_use_sma': True, 'sideways_use_ema': False, 'sideways_use_atr': True, 'sideways_use_adx': False, 'sideways_use_spike': False, 'sideways_rsi_required': True}.
