[I 2025-09-01 13:32:44,224] Trial 198 finished with values: [-1000000000.0, 1000000000.0] and parameters: {'p_sma': 5, 'p_std': 46, 'p_atr': 29, 'p_adx': 8, 'rsi_period': 75, 'ema1': 15, 'ema2': 58, 'slip_atr_k': 0.11067664250829994, 'slip_spread_k': 0.9070671902008712, 'spread_hl_frac': 0.04423779598271732, 'bb_std_mult': 1.9224021433056304, 'rsi_os': 41, 'rsi_ob': 91, 'vol_spike': 0.22343965480025874, 'adx_thresh': 11.81366112856552, 'atr_min_pct': 0.019771692892860595, 'atr_max_pct': 0.039857284710693476, 'tp_mult': 1.5702845738723221, 'tsl_mult': 0.9525282919496003, 'strategy': 'mean_reversion', 'time_stop': 105, 'use_sma': True, 'use_atr': True, 'use_adx': True, 'use_ema': True, 'use_spike': False, 'rsi_required': True, 'edge_k': 0.25396728063969687, 'edge_cap': 0.8218425155934714, 'bull_strategy': 'mean_reversion', 'bull_bb_std_mult': 1.1441252898843393, 'bull_rsi_os': 37, 'bull_rsi_ob': 58, 'bull_adx_thresh': 7.3877670508394715, 'bull_atr_min_pct': 0.0004346179824549351, 'bull_atr_max_pct': 0.10103817663338932, 'bull_tp_mult': 2.0056956999788302, 'bull_tsl_mult': 0.3919936625063422, 'bull_time_stop': 14, 'bull_use_sma': True, 'bull_use_ema': False, 'bull_use_atr': True, 'bull_use_adx': False, 'bull_use_spike': True, 'bull_rsi_required': True, 'bear_strategy': 'mean_reversion', 'bear_bb_std_mult': 0.781885000328506, 'bear_rsi_os': 53, 'bear_rsi_ob': 71, 'bear_adx_thresh': 16.474283915045227, 'bear_atr_min_pct': 0.021728740996712896, 'bear_atr_max_pct': 0.07935943806983906, 'bear_tp_mult': 2.4534827517057938, 'bear_tsl_mult': 0.5633215094937779, 'bear_time_stop': 281, 'bear_use_sma': True, 'bear_use_ema': False, 'bear_use_atr': True, 'bear_use_adx': False, 'bear_use_spike': False, 'bear_rsi_required': False, 'sideways_strategy': 'mean_reversion', 'sideways_bb_std_mult': 0.6192573123098756, 'sideways_rsi_os': 53, 'sideways_rsi_ob': 85, 'sideways_adx_thresh': 13.572491089048867, 'sideways_atr_min_pct': 0.009645659372907943, 'sideways_atr_max_pct': 0.10975917336360026, 'sideways_tp_mult': 2.897618231666243, 'sideways_tsl_mult': 0.49901938485242886, 'sideways_time_stop': 19, 'sideways_use_sma': False, 'sideways_use_ema': False, 'sideways_use_atr': True, 'sideways_use_adx': False, 'sideways_use_spike': True, 'sideways_rsi_required': True}.
[I 2025-09-01 13:32:44,601] Trial 201 finished with values: [-1000000000.0, 1000000000.0] and parameters: {'p_sma': 49, 'p_std': 43, 'p_atr': 29, 'p_adx': 19, 'rsi_period': 75, 'ema1': 19, 'ema2': 16, 'slip_atr_k': 0.023108405377380653, 'slip_spread_k': 0.9141719640349542, 'spread_hl_frac': 0.015907390422417903, 'bb_std_mult': 1.9139034822860128, 'rsi_os': 40, 'rsi_ob': 76, 'vol_spike': 0.23421447470454504, 'adx_thresh': 10.511398178798085, 'atr_min_pct': 0.020683548475559012, 'atr_max_pct': 0.04110993360045817, 'tp_mult': 1.5247287590653207, 'tsl_mult': 0.510903458018247, 'strategy': 'breakout', 'time_stop': 81, 'use_sma': False, 'use_atr': False, 'use_adx': True, 'use_ema': False, 'use_spike': True, 'rsi_required': True, 'edge_k': 0.24382581147680574, 'edge_cap': 0.7283754194616189, 'bull_strategy': 'mean_reversion', 'bull_bb_std_mult': 1.6323869780786682, 'bull_rsi_os': 47, 'bull_rsi_ob': 57, 'bull_adx_thresh': 7.390786278005488, 'bull_atr_min_pct': 0.00837134528363689, 'bull_atr_max_pct': 0.07574193693411747, 'bull_tp_mult': 1.4728029818200987, 'bull_tsl_mult': 0.3938924679520405, 'bull_time_stop': 5, 'bull_use_sma': False, 'bull_use_ema': True, 'bull_use_atr': True, 'bull_use_adx': True, 'bull_use_spike': True, 'bull_rsi_required': False, 'bear_strategy': 'mean_reversion', 'bear_bb_std_mult': 0.8414006759005784, 'bear_rsi_os': 10, 'bear_rsi_ob': 71, 'bear_adx_thresh': 18.86626820768853, 'bear_atr_min_pct': 0.023919528247284598, 'bear_atr_max_pct': 0.0798661536059588, 'bear_tp_mult': 2.674073310361429, 'bear_tsl_mult': 0.7320117514754502, 'bear_time_stop': 272, 'bear_use_sma': False, 'bear_use_ema': False, 'bear_use_atr': False, 'bear_use_adx': True, 'bear_use_spike': True, 'bear_rsi_required': True, 'sideways_strategy': 'mean_reversion', 'sideways_bb_std_mult': 2.1209576288245704, 'sideways_rsi_os': 25, 'sideways_rsi_ob': 92, 'sideways_adx_thresh': 13.305823028579983, 'sideways_atr_min_pct': 0.013458258086772017, 'sideways_atr_max_pct': 0.11346773505042737, 'sideways_tp_mult': 2.776321040482739, 'sideways_tsl_mult': 0.025235778976242407, 'sideways_time_stop': 288, 'sideways_use_sma': True, 'sideways_use_ema': False, 'sideways_use_atr': False, 'sideways_use_adx': False, 'sideways_use_spike': False, 'sideways_rsi_required': False}.
[I 2025-09-01 13:32:44,904] Trial 199 finished with values: [-1000000000.0, 1000000000.0] and parameters: {'p_sma': 58, 'p_std': 43, 'p_atr': 24, 'p_adx': 21, 'rsi_period': 40, 'ema1': 25, 'ema2': 34, 'slip_atr_k': 0.02564258919589027, 'slip_spread_k': 0.4137279910005722, 'spread_hl_frac': 0.015299881836088363, 'bb_std_mult': 1.8910614880646925, 'rsi_os': 30, 'rsi_ob': 76, 'vol_spike': 0.15052651697043146, 'adx_thresh': 20.70509706219202, 'atr_min_pct': 0.0019026034635017618, 'atr_max_pct': 0.039464314718231926, 'tp_mult': 1.1538920342598835, 'tsl_mult': 0.7102175753360449, 'strategy': 'breakout', 'time_stop': 84, 'use_sma': False, 'use_atr': True, 'use_adx': True, 'use_ema': False, 'use_spike': False, 'rsi_required': True, 'edge_k': 0.2608152284970191, 'edge_cap': 0.8208080482330037, 'bull_strategy': 'mean_reversion', 'bull_bb_std_mult': 1.5965817294912723, 'bull_rsi_os': 47, 'bull_rsi_ob': 91, 'bull_adx_thresh': 6.18076853243692, 'bull_atr_min_pct': 0.0024304839725711475, 'bull_atr_max_pct': 0.01589523791090657, 'bull_tp_mult': 2.7614156974024926, 'bull_tsl_mult': 0.39316325859728357, 'bull_time_stop': 27, 'bull_use_sma': False, 'bull_use_ema': True, 'bull_use_atr': True, 'bull_use_adx': True, 'bull_use_spike': True, 'bull_rsi_required': True, 'bear_strategy': 'mean_reversion', 'bear_bb_std_mult': 0.8601378270421253, 'bear_rsi_os': 43, 'bear_rsi_ob': 71, 'bear_adx_thresh': 11.488802180018924, 'bear_atr_min_pct': 0.022310742522585622, 'bear_atr_max_pct': 0.08055880082524995, 'bear_tp_mult': 2.0497607873115706, 'bear_tsl_mult': 0.5594038399718352, 'bear_time_stop': 236, 'bear_use_sma': False, 'bear_use_ema': False, 'bear_use_atr': False, 'bear_use_adx': True, 'bear_use_spike': False, 'bear_rsi_required': False, 'sideways_strategy': 'mean_reversion', 'sideways_bb_std_mult': 3.057824872577913, 'sideways_rsi_os': 9, 'sideways_rsi_ob': 92, 'sideways_adx_thresh': 13.237782158928468, 'sideways_atr_min_pct': 0.02124437140117911, 'sideways_atr_max_pct': 0.1142999178132412, 'sideways_tp_mult': 2.525762587639106, 'sideways_tsl_mult': 0.5660502804090092, 'sideways_time_stop': 186, 'sideways_use_sma': False, 'sideways_use_ema': False, 'sideways_use_atr': True, 'sideways_use_adx': False, 'sideways_use_spike': False, 'sideways_rsi_required': False}.
[I 2025-09-01 13:32:45,054] Trial 200 finished with values: [-1000000000.0, 1000000000.0] and parameters: {'p_sma': 40, 'p_std': 43, 'p_atr': 29, 'p_adx': 21, 'rsi_period': 76, 'ema1': 19, 'ema2': 34, 'slip_atr_k': 0.10605508823716814, 'slip_spread_k': 0.41294427373717657, 'spread_hl_frac': 0.004915749915798068, 'bb_std_mult': 1.9332541001564572, 'rsi_os': 37, 'rsi_ob': 91, 'vol_spike': 0.1930966997659712, 'adx_thresh': 10.735699892026648, 'atr_min_pct': 0.020346837429429263, 'atr_max_pct': 0.040774500520145876, 'tp_mult': 1.5676641533461395, 'tsl_mult': 0.09635276134668179, 'strategy': 'breakout', 'time_stop': 82, 'use_sma': False, 'use_atr': True, 'use_adx': True, 'use_ema': False, 'use_spike': False, 'rsi_required': True, 'edge_k': 0.2613205042937954, 'edge_cap': 0.5274639689958439, 'bull_strategy': 'mean_reversion', 'bull_bb_std_mult': 2.4355590658432864, 'bull_rsi_os': 47, 'bull_rsi_ob': 57, 'bull_adx_thresh': 8.420236241851587, 'bull_atr_min_pct': 0.0024556855835754, 'bull_atr_max_pct': 0.01577067859523023, 'bull_tp_mult': 2.039477891979008, 'bull_tsl_mult': 0.23035579911335524, 'bull_time_stop': 118, 'bull_use_sma': False, 'bull_use_ema': True, 'bull_use_atr': True, 'bull_use_adx': True, 'bull_use_spike': True, 'bull_rsi_required': True, 'bear_strategy': 'mean_reversion', 'bear_bb_std_mult': 0.9170898394182396, 'bear_rsi_os': 42, 'bear_rsi_ob': 71, 'bear_adx_thresh': 11.398953722981762, 'bear_atr_min_pct': 0.005673822373241965, 'bear_atr_max_pct': 0.05155543363534032, 'bear_tp_mult': 2.666092937216269, 'bear_tsl_mult': 0.5640672348206731, 'bear_time_stop': 190, 'bear_use_sma': False, 'bear_use_ema': False, 'bear_use_atr': False, 'bear_use_adx': True, 'bear_use_spike': False, 'bear_rsi_required': False, 'sideways_strategy': 'mean_reversion', 'sideways_bb_std_mult': 1.450848527666738, 'sideways_rsi_os': 52, 'sideways_rsi_ob': 93, 'sideways_adx_thresh': 31.765724911386712, 'sideways_atr_min_pct': 0.009969325068814018, 'sideways_atr_max_pct': 0.03646039742910293, 'sideways_tp_mult': 2.8232425383401303, 'sideways_tsl_mult': 0.5596320075289318, 'sideways_time_stop': 287, 'sideways_use_sma': False, 'sideways_use_ema': False, 'sideways_use_atr': True, 'sideways_use_adx': False, 'sideways_use_spike': False, 'sideways_rsi_required': False}.
[I 2025-09-01 13:33:22,952] Trial 203 finished with values: [-1000000000.0, 1000000000.0] and parameters: {'p_sma': 40, 'p_std': 37, 'p_atr': 19, 'p_adx': 19, 'rsi_period': 66, 'ema1': 19, 'ema2': 60, 'slip_atr_k': 0.10468742818755172, 'slip_spread_k': 0.3696100034885865, 'spread_hl_frac': 0.008288797655981863, 'bb_std_mult': 1.8432605947366127, 'rsi_os': 39, 'rsi_ob': 63, 'vol_spike': 0.2378541247877658, 'adx_thresh': 10.988769468145518, 'atr_min_pct': 0.002803953914793477, 'atr_max_pct': 0.1102469253605555, 'tp_mult': 2.745496622113035, 'tsl_mult': 0.14477872154300864, 'strategy': 'breakout', 'time_stop': 88, 'use_sma': True, 'use_atr': False, 'use_adx': False, 'use_ema': True, 'use_spike': False, 'rsi_required': False, 'edge_k': 0.41832618714449243, 'edge_cap': 0.06924235882652646, 'bull_strategy': 'breakout', 'bull_bb_std_mult': 3.1763219708163617, 'bull_rsi_os': 9, 'bull_rsi_ob': 56, 'bull_adx_thresh': 5.5909055131685665, 'bull_atr_min_pct': 0.0022206434067782305, 'bull_atr_max_pct': 0.02021782428367787, 'bull_tp_mult': 1.848849074247381, 'bull_tsl_mult': 0.4177368801786676, 'bull_time_stop': 36, 'bull_use_sma': True, 'bull_use_ema': True, 'bull_use_atr': True, 'bull_use_adx': True, 'bull_use_spike': False, 'bull_rsi_required': True, 'bear_strategy': 'breakout', 'bear_bb_std_mult': 0.8964971738979045, 'bear_rsi_os': 31, 'bear_rsi_ob': 81, 'bear_adx_thresh': 10.800152338083716, 'bear_atr_min_pct': 0.026470536583925154, 'bear_atr_max_pct': 0.08444481196594862, 'bear_tp_mult': 2.6005568636992296, 'bear_tsl_mult': 0.5446148939479347, 'bear_time_stop': 269, 'bear_use_sma': True, 'bear_use_ema': False, 'bear_use_atr': True, 'bear_use_adx': True, 'bear_use_spike': False, 'bear_rsi_required': False, 'sideways_strategy': 'breakout', 'sideways_bb_std_mult': 0.8446838727843687, 'sideways_rsi_os': 28, 'sideways_rsi_ob': 94, 'sideways_adx_thresh': 18.47931000156523, 'sideways_atr_min_pct': 0.009159274563879334, 'sideways_atr_max_pct': 0.11797015994071647, 'sideways_tp_mult': 2.704704703382678, 'sideways_tsl_mult': 0.2800295561759152, 'sideways_time_stop': 158, 'sideways_use_sma': False, 'sideways_use_ema': False, 'sideways_use_atr': True, 'sideways_use_adx': True, 'sideways_use_spike': False, 'sideways_rsi_required': True}.
[I 2025-09-01 13:33:23,435] Trial 202 finished with values: [-1000000000.0, 1000000000.0] and parameters: {'p_sma': 58, 'p_std': 43, 'p_atr': 23, 'p_adx': 23, 'rsi_period': 57, 'ema1': 25, 'ema2': 41, 'slip_atr_k': 0.02722656262202744, 'slip_spread_k': 0.4138925909090445, 'spread_hl_frac': 0.00577391629641372, 'bb_std_mult': 1.8657101955180637, 'rsi_os': 30, 'rsi_ob': 76, 'vol_spike': 0.23653686462153212, 'adx_thresh': 7.031986409655154, 'atr_min_pct': 0.02105718089256692, 'atr_max_pct': 0.04298899230274256, 'tp_mult': 2.3465966012740345, 'tsl_mult': 0.1499410087858683, 'strategy': 'breakout', 'time_stop': 82, 'use_sma': False, 'use_atr': False, 'use_adx': True, 'use_ema': False, 'use_spike': True, 'rsi_required': True, 'edge_k': 0.4200153718208578, 'edge_cap': 0.5306438176477523, 'bull_strategy': 'mean_reversion', 'bull_bb_std_mult': 3.293885759824288, 'bull_rsi_os': 12, 'bull_rsi_ob': 57, 'bull_adx_thresh': 8.461924740414084, 'bull_atr_min_pct': 0.008188125582702214, 'bull_atr_max_pct': 0.0786038030697884, 'bull_tp_mult': 1.4563553130366613, 'bull_tsl_mult': 0.41895773439464795, 'bull_time_stop': 35, 'bull_use_sma': False, 'bull_use_ema': True, 'bull_use_atr': True, 'bull_use_adx': True, 'bull_use_spike': True, 'bull_rsi_required': False, 'bear_strategy': 'mean_reversion', 'bear_bb_std_mult': 0.8679192252140107, 'bear_rsi_os': 32, 'bear_rsi_ob': 81, 'bear_adx_thresh': 10.986494514399588, 'bear_atr_min_pct': 0.02232566400174731, 'bear_atr_max_pct': 0.08639488554715181, 'bear_tp_mult': 2.647191148755756, 'bear_tsl_mult': 0.4848308324225689, 'bear_time_stop': 236, 'bear_use_sma': False, 'bear_use_ema': False, 'bear_use_atr': False, 'bear_use_adx': True, 'bear_use_spike': True, 'bear_rsi_required': True, 'sideways_strategy': 'mean_reversion', 'sideways_bb_std_mult': 2.7947729101308685, 'sideways_rsi_os': 25, 'sideways_rsi_ob': 94, 'sideways_adx_thresh': 31.481183078735334, 'sideways_atr_min_pct': 0.008991327461659877, 'sideways_atr_max_pct': 0.12600098079727876, 'sideways_tp_mult': 2.7716513258639153, 'sideways_tsl_mult': 0.27982082330159175, 'sideways_time_stop': 95, 'sideways_use_sma': True, 'sideways_use_ema': False, 'sideways_use_atr': False, 'sideways_use_adx': True, 'sideways_use_spike': False, 'sideways_rsi_required': False}.
[I 2025-09-01 13:33:23,905] Trial 204 finished with values: [-0.009188763523378274, 0.01010230316244829] and parameters: {'p_sma': 37, 'p_std': 47, 'p_atr': 30, 'p_adx': 12, 'rsi_period': 68, 'ema1': 21, 'ema2': 60, 'slip_atr_k': 0.014566764611904273, 'slip_spread_k': 0.37765388811284467, 'spread_hl_frac': 0.006492029920416657, 'bb_std_mult': 1.823416680383787, 'rsi_os': 39, 'rsi_ob': 93, 'vol_spike': 0.23864489842048853, 'adx_thresh': 13.37628953815175, 'atr_min_pct': 0.02139556156053255, 'atr_max_pct': 0.04338146415438776, 'tp_mult': 1.4615655882876006, 'tsl_mult': 0.14670777880077052, 'strategy': 'breakout', 'time_stop': 248, 'use_sma': True, 'use_atr': False, 'use_adx': False, 'use_ema': True, 'use_spike': True, 'rsi_required': False, 'edge_k': 0.4217775927590869, 'edge_cap': 0.31456175314884993, 'bull_strategy': 'breakout', 'bull_bb_std_mult': 3.284997499865828, 'bull_rsi_os': 51, 'bull_rsi_ob': 56, 'bull_adx_thresh': 5.604342629820073, 'bull_atr_min_pct': 0.0020645586551884944, 'bull_atr_max_pct': 0.020337246963931282, 'bull_tp_mult': 1.8886124472463843, 'bull_tsl_mult': 0.4174256668954467, 'bull_time_stop': 73, 'bull_use_sma': True, 'bull_use_ema': True, 'bull_use_atr': True, 'bull_use_adx': True, 'bull_use_spike': False, 'bull_rsi_required': True, 'bear_strategy': 'breakout', 'bear_bb_std_mult': 0.9064423801861813, 'bear_rsi_os': 32, 'bear_rsi_ob': 89, 'bear_adx_thresh': 10.950152752806929, 'bear_atr_min_pct': 0.004743567923512033, 'bear_atr_max_pct': 0.08543819724192751, 'bear_tp_mult': 2.24209950247181, 'bear_tsl_mult': 0.13329656105751136, 'bear_time_stop': 212, 'bear_use_sma': True, 'bear_use_ema': False, 'bear_use_atr': True, 'bear_use_adx': True, 'bear_use_spike': False, 'bear_rsi_required': True, 'sideways_strategy': 'breakout', 'sideways_bb_std_mult': 1.949811197469849, 'sideways_rsi_os': 47, 'sideways_rsi_ob': 94, 'sideways_adx_thresh': 7.803292563470148, 'sideways_atr_min_pct': 0.008904247956083917, 'sideways_atr_max_pct': 0.12608883870287976, 'sideways_tp_mult': 2.7240854864048396, 'sideways_tsl_mult': 0.2852446879553207, 'sideways_time_stop': 12, 'sideways_use_sma': True, 'sideways_use_ema': False, 'sideways_use_atr': True, 'sideways_use_adx': True, 'sideways_use_spike': False, 'sideways_rsi_required': True}.
[I 2025-09-01 13:33:24,452] Trial 205 finished with values: [-0.037621669367333355, 0.03749924494896906] and parameters: {'p_sma': 54, 'p_std': 10, 'p_atr': 19, 'p_adx': 19, 'rsi_period': 69, 'ema1': 8, 'ema2': 60, 'slip_atr_k': 0.11711397148812097, 'slip_spread_k': 0.36979310484294153, 'spread_hl_frac': 0.04110164780902864, 'bb_std_mult': 1.812279662963888, 'rsi_os': 39, 'rsi_ob': 63, 'vol_spike': 0.23758525255747112, 'adx_thresh': 7.1450208769432155, 'atr_min_pct': 0.002535298624016704, 'atr_max_pct': 0.04350646084007758, 'tp_mult': 1.4545666689268173, 'tsl_mult': 0.4902140699092243, 'strategy': 'breakout', 'time_stop': 249, 'use_sma': True, 'use_atr': False, 'use_adx': False, 'use_ema': True, 'use_spike': True, 'rsi_required': False, 'edge_k': 0.7203878915867807, 'edge_cap': 0.08200213204617851, 'bull_strategy': 'breakout', 'bull_bb_std_mult': 3.265827543065176, 'bull_rsi_os': 51, 'bull_rsi_ob': 56, 'bull_adx_thresh': 5.52930227281307, 'bull_atr_min_pct': 0.0018917435905461764, 'bull_atr_max_pct': 0.06376941466190102, 'bull_tp_mult': 1.8671955277527057, 'bull_tsl_mult': 0.42371119988139816, 'bull_time_stop': 73, 'bull_use_sma': True, 'bull_use_ema': True, 'bull_use_atr': True, 'bull_use_adx': True, 'bull_use_spike': False, 'bull_rsi_required': True, 'bear_strategy': 'breakout', 'bear_bb_std_mult': 0.9343465903113833, 'bear_rsi_os': 13, 'bear_rsi_ob': 89, 'bear_adx_thresh': 5.772765369160121, 'bear_atr_min_pct': 0.02482961950386177, 'bear_atr_max_pct': 0.08609342995618166, 'bear_tp_mult': 2.618500048380713, 'bear_tsl_mult': 0.4847647753184144, 'bear_time_stop': 269, 'bear_use_sma': True, 'bear_use_ema': False, 'bear_use_atr': True, 'bear_use_adx': True, 'bear_use_spike': False, 'bear_rsi_required': True, 'sideways_strategy': 'breakout', 'sideways_bb_std_mult': 0.8435721374212934, 'sideways_rsi_os': 28, 'sideways_rsi_ob': 94, 'sideways_adx_thresh': 7.718352514937786, 'sideways_atr_min_pct': 0.02286862851175163, 'sideways_atr_max_pct': 0.11778176137167551, 'sideways_tp_mult': 2.7269331311434706, 'sideways_tsl_mult': 0.9730046429147301, 'sideways_time_stop': 11, 'sideways_use_sma': True, 'sideways_use_ema': False, 'sideways_use_atr': True, 'sideways_use_adx': True, 'sideways_use_spike': False, 'sideways_rsi_required': True}.
[I 2025-09-01 13:34:08,456] Trial 208 finished with values: [-1000000000.0, 1000000000.0] and parameters: {'p_sma': 37, 'p_std': 49, 'p_atr': 30, 'p_adx': 11, 'rsi_period': 64, 'ema1': 22, 'ema2': 60, 'slip_atr_k': 0.01430949392834573, 'slip_spread_k': 0.36282445616206654, 'spread_hl_frac': 0.004644639661428411, 'bb_std_mult': 3.5208853147095027, 'rsi_os': 17, 'rsi_ob': 95, 'vol_spike': 0.2477787902289851, 'adx_thresh': 14.757339877577486, 'atr_min_pct': 0.02194382206191063, 'atr_max_pct': 0.04824628816228618, 'tp_mult': 1.3042355674399064, 'tsl_mult': 0.1987461551888576, 'strategy': 'mean_reversion', 'time_stop': 247, 'use_sma': True, 'use_atr': False, 'use_adx': False, 'use_ema': True, 'use_spike': True, 'rsi_required': False, 'edge_k': 0.49371975469519386, 'edge_cap': 0.3118526265485721, 'bull_strategy': 'breakout', 'bull_bb_std_mult': 3.499806179488421, 'bull_rsi_os': 53, 'bull_rsi_ob': 55, 'bull_adx_thresh': 5.252498992836864, 'bull_atr_min_pct': 0.0034329907442306458, 'bull_atr_max_pct': 0.029487763951567453, 'bull_tp_mult': 1.6496578756530098, 'bull_tsl_mult': 0.49356643105281167, 'bull_time_stop': 73, 'bull_use_sma': True, 'bull_use_ema': False, 'bull_use_atr': False, 'bull_use_adx': True, 'bull_use_spike': False, 'bull_rsi_required': True, 'bear_strategy': 'breakout', 'bear_bb_std_mult': 0.949919173867473, 'bear_rsi_os': 33, 'bear_rsi_ob': 88, 'bear_adx_thresh': 9.676396119166926, 'bear_atr_min_pct': 0.004765861064383746, 'bear_atr_max_pct': 0.09260940709618494, 'bear_tp_mult': 2.243780987483501, 'bear_tsl_mult': 0.12307993274728264, 'bear_time_stop': 228, 'bear_use_sma': True, 'bear_use_ema': False, 'bear_use_atr': True, 'bear_use_adx': True, 'bear_use_spike': False, 'bear_rsi_required': True, 'sideways_strategy': 'breakout', 'sideways_bb_std_mult': 1.9232878058375276, 'sideways_rsi_os': 47, 'sideways_rsi_ob': 95, 'sideways_adx_thresh': 7.638454368910416, 'sideways_atr_min_pct': 0.007707289422938574, 'sideways_atr_max_pct': 0.1307304868366734, 'sideways_tp_mult': 2.6812675611681884, 'sideways_tsl_mult': 0.3683070322930757, 'sideways_time_stop': 31, 'sideways_use_sma': True, 'sideways_use_ema': True, 'sideways_use_atr': True, 'sideways_use_adx': True, 'sideways_use_spike': False, 'sideways_rsi_required': True}.
