[I 2025-08-29 22:13:59,107] Trial 324 finished with values: [-1000000000.0, 1000000000.0] and parameters: {'p_sma': 6, 'p_std': 23, 'p_atr': 22, 'p_adx': 18, 'rsi_period': 16, 'ema1': 26, 'ema2': 44, 'slip_atr_k': 0.007383656505720858, 'slip_spread_k': 0.0807291792981708, 'spread_hl_frac': 0.01808656290637056, 'bb_std_mult': 1.5367213017510215, 'rsi_os': 35, 'rsi_ob': 57, 'vol_spike': 0.19156763656868211, 'adx_thresh': 25.632923266552673, 'atr_min_pct': 0.010888188956115433, 'atr_max_pct': 0.09943367684504524, 'tp_mult': 1.0677715188325827, 'tsl_mult': 0.7366723572237937, 'strategy': 'breakout', 'time_stop': 104, 'use_sma': False, 'use_atr': False, 'use_adx': False, 'use_ema': False, 'use_spike': False, 'rsi_required': False, 'edge_k': 0.597572876519137, 'edge_cap': 0.9751584176728465}.
[I 2025-08-29 22:14:26,265] Trial 328 finished with values: [-0.008059939194724364, 0.008102149359806242] and parameters: {'p_sma': 8, 'p_std': 45, 'p_atr': 23, 'p_adx': 15, 'rsi_period': 18, 'ema1': 8, 'ema2': 57, 'slip_atr_k': 0.030537501091290442, 'slip_spread_k': 0.7753362494160466, 'spread_hl_frac': 0.016829225044435823, 'bb_std_mult': 1.9529329016998898, 'rsi_os': 27, 'rsi_ob': 60, 'vol_spike': 0.18424219893855795, 'adx_thresh': 15.292924404266, 'atr_min_pct': 0.002333273648892446, 'atr_max_pct': 0.09292660995141182, 'tp_mult': 2.5793206175202927, 'tsl_mult': 0.74819229441542, 'strategy': 'mean_reversion', 'time_stop': 229, 'use_sma': False, 'use_atr': False, 'use_adx': False, 'use_ema': False, 'use_spike': False, 'rsi_required': False, 'edge_k': 1.3932185147890421, 'edge_cap': 0.7008386685283624}.
[I 2025-08-29 22:14:26,411] Trial 327 finished with values: [-1000000000.0, 1000000000.0] and parameters: {'p_sma': 8, 'p_std': 48, 'p_atr': 23, 'p_adx': 13, 'rsi_period': 18, 'ema1': 8, 'ema2': 25, 'slip_atr_k': 0.039573435822119696, 'slip_spread_k': 0.7830271825819448, 'spread_hl_frac': 0.016563462648926355, 'bb_std_mult': 1.9646016827926684, 'rsi_os': 27, 'rsi_ob': 60, 'vol_spike': 0.1807124847665545, 'adx_thresh': 26.35633302118426, 'atr_min_pct': 0.025303563562320035, 'atr_max_pct': 0.09571676728137232, 'tp_mult': 1.1707491665239156, 'tsl_mult': 0.7628086169682251, 'strategy': 'mean_reversion', 'time_stop': 109, 'use_sma': False, 'use_atr': False, 'use_adx': False, 'use_ema': False, 'use_spike': False, 'rsi_required': False, 'edge_k': 0.5262418964911066, 'edge_cap': 0.7463539998083338}.
[I 2025-08-29 22:14:26,712] Trial 325 finished with values: [-1000000000.0, 1000000000.0] and parameters: {'p_sma': 6, 'p_std': 29, 'p_atr': 23, 'p_adx': 18, 'rsi_period': 35, 'ema1': 26, 'ema2': 57, 'slip_atr_k': 0.010137527920239824, 'slip_spread_k': 0.7830880553492526, 'spread_hl_frac': 0.01179560543107957, 'bb_std_mult': 2.905053113082377, 'rsi_os': 31, 'rsi_ob': 60, 'vol_spike': 0.18314045767765755, 'adx_thresh': 15.413756795687217, 'atr_min_pct': 0.002271072754105796, 'atr_max_pct': 0.0921760052751314, 'tp_mult': 2.5681429101995312, 'tsl_mult': 0.7331663675476411, 'strategy': 'mean_reversion', 'time_stop': 101, 'use_sma': False, 'use_atr': False, 'use_adx': False, 'use_ema': False, 'use_spike': False, 'rsi_required': False, 'edge_k': 0.5305405691400011, 'edge_cap': 0.20452593332996366}.
[I 2025-08-29 22:14:26,725] Trial 326 finished with values: [-0.021435355037874748, 0.021353335389005735] and parameters: {'p_sma': 20, 'p_std': 23, 'p_atr': 23, 'p_adx': 18, 'rsi_period': 16, 'ema1': 23, 'ema2': 57, 'slip_atr_k': 0.03149949469369312, 'slip_spread_k': 0.08025136523469761, 'spread_hl_frac': 0.03432285371257912, 'bb_std_mult': 1.9375039828391243, 'rsi_os': 27, 'rsi_ob': 59, 'vol_spike': 0.18315011994021885, 'adx_thresh': 25.6318944529523, 'atr_min_pct': 0.002348771523752445, 'atr_max_pct': 0.032368949259781496, 'tp_mult': 2.854141201458026, 'tsl_mult': 0.768367934410051, 'strategy': 'mean_reversion', 'time_stop': 103, 'use_sma': False, 'use_atr': False, 'use_adx': False, 'use_ema': False, 'use_spike': False, 'rsi_required': False, 'edge_k': 1.4105639354597543, 'edge_cap': 0.3441897287892457}.
[I 2025-08-29 22:14:26,882] Trial 329 finished with values: [-1000000000.0, 1000000000.0] and parameters: {'p_sma': 20, 'p_std': 59, 'p_atr': 24, 'p_adx': 12, 'rsi_period': 19, 'ema1': 23, 'ema2': 24, 'slip_atr_k': 0.15978219072141597, 'slip_spread_k': 0.45656363225849605, 'spread_hl_frac': 0.011614491961974874, 'bb_std_mult': 1.9807956693124404, 'rsi_os': 52, 'rsi_ob': 78, 'vol_spike': 0.17623372286481293, 'adx_thresh': 26.148868582366408, 'atr_min_pct': 0.02532876948026986, 'atr_max_pct': 0.03322828751883219, 'tp_mult': 1.176819215685245, 'tsl_mult': 0.7712701141022695, 'strategy': 'mean_reversion', 'time_stop': 279, 'use_sma': False, 'use_atr': False, 'use_adx': False, 'use_ema': False, 'use_spike': False, 'rsi_required': False, 'edge_k': 0.5151558619676251, 'edge_cap': 0.7864246506841268}.
[I 2025-08-29 22:14:53,673] Trial 332 finished with values: [-1000000000.0, 1000000000.0] and parameters: {'p_sma': 43, 'p_std': 17, 'p_atr': 24, 'p_adx': 12, 'rsi_period': 23, 'ema1': 24, 'ema2': 55, 'slip_atr_k': 0.13835279185783586, 'slip_spread_k': 0.9127959157194127, 'spread_hl_frac': 0.01892156645951106, 'bb_std_mult': 2.034763421903116, 'rsi_os': 29, 'rsi_ob': 78, 'vol_spike': 0.1160281059014101, 'adx_thresh': 24.23933211764942, 'atr_min_pct': 0.012494171863689353, 'atr_max_pct': 0.12095517234748689, 'tp_mult': 1.2224747540756353, 'tsl_mult': 0.6670397698606709, 'strategy': 'breakout', 'time_stop': 283, 'use_sma': False, 'use_atr': False, 'use_adx': False, 'use_ema': False, 'use_spike': False, 'rsi_required': False, 'edge_k': 1.614993837792301, 'edge_cap': 0.7836977509417001}.
[I 2025-08-29 22:14:54,045] Trial 330 finished with values: [-1000000000.0, 1000000000.0] and parameters: {'p_sma': 50, 'p_std': 24, 'p_atr': 24, 'p_adx': 15, 'rsi_period': 23, 'ema1': 23, 'ema2': 54, 'slip_atr_k': 0.19080012417681122, 'slip_spread_k': 0.8941779916350957, 'spread_hl_frac': 0.01207562727987838, 'bb_std_mult': 1.7686717447154496, 'rsi_os': 53, 'rsi_ob': 61, 'vol_spike': 0.11634294304768299, 'adx_thresh': 24.099345656164996, 'atr_min_pct': 0.026320389441932386, 'atr_max_pct': 0.03252681764183836, 'tp_mult': 1.2261023646352136, 'tsl_mult': 0.6719559171245034, 'strategy': 'breakout', 'time_stop': 101, 'use_sma': False, 'use_atr': False, 'use_adx': False, 'use_ema': False, 'use_spike': False, 'rsi_required': False, 'edge_k': 0.4774504001246683, 'edge_cap': 0.7894747450256585}.
[I 2025-08-29 22:14:54,165] Trial 333 finished with values: [-1000000000.0, 1000000000.0] and parameters: {'p_sma': 43, 'p_std': 43, 'p_atr': 24, 'p_adx': 15, 'rsi_period': 53, 'ema1': 24, 'ema2': 42, 'slip_atr_k': 0.1359200368931336, 'slip_spread_k': 0.8866347733285309, 'spread_hl_frac': 0.04010202190734594, 'bb_std_mult': 2.369684299288639, 'rsi_os': 29, 'rsi_ob': 65, 'vol_spike': 0.11621602249971641, 'adx_thresh': 23.45724401406279, 'atr_min_pct': 0.008856611969790817, 'atr_max_pct': 0.10535319861192696, 'tp_mult': 1.0916255395469436, 'tsl_mult': 0.7116664344150021, 'strategy': 'breakout', 'time_stop': 109, 'use_sma': False, 'use_atr': False, 'use_adx': False, 'use_ema': False, 'use_spike': False, 'rsi_required': False, 'edge_k': 0.9856664232930223, 'edge_cap': 0.810314714001542}.
[I 2025-08-29 22:14:54,275] Trial 331 finished with values: [-1000000000.0, 1000000000.0] and parameters: {'p_sma': 10, 'p_std': 59, 'p_atr': 24, 'p_adx': 12, 'rsi_period': 19, 'ema1': 24, 'ema2': 55, 'slip_atr_k': 0.1606753547721996, 'slip_spread_k': 0.546466644983374, 'spread_hl_frac': 0.018902453852438057, 'bb_std_mult': 1.7653235492749138, 'rsi_os': 52, 'rsi_ob': 76, 'vol_spike': 0.17547196918366328, 'adx_thresh': 27.486125848988745, 'atr_min_pct': 0.022395910164166696, 'atr_max_pct': 0.0966040889624352, 'tp_mult': 1.0879182353636232, 'tsl_mult': 0.7754122903592613, 'strategy': 'breakout', 'time_stop': 218, 'use_sma': False, 'use_atr': False, 'use_adx': False, 'use_ema': False, 'use_spike': False, 'rsi_required': False, 'edge_k': 1.8434060096749048, 'edge_cap': 0.35492636578040637}.
[I 2025-08-29 22:15:21,358] Trial 335 finished with values: [-1000000000.0, 1000000000.0] and parameters: {'p_sma': 7, 'p_std': 25, 'p_atr': 23, 'p_adx': 16, 'rsi_period': 78, 'ema1': 24, 'ema2': 53, 'slip_atr_k': 0.1755159928114454, 'slip_spread_k': 0.8124895659338341, 'spread_hl_frac': 0.02030613963822637, 'bb_std_mult': 2.376761966286543, 'rsi_os': 37, 'rsi_ob': 62, 'vol_spike': 0.17436498780226634, 'adx_thresh': 5.172349770169442, 'atr_min_pct': 0.003912891127442281, 'atr_max_pct': 0.10312298928668617, 'tp_mult': 1.0949898476887445, 'tsl_mult': 0.7075919693081019, 'strategy': 'breakout', 'time_stop': 177, 'use_sma': False, 'use_atr': False, 'use_adx': False, 'use_ema': False, 'use_spike': False, 'rsi_required': False, 'edge_k': 0.3673057599421676, 'edge_cap': 0.8090499434658133}.
[I 2025-08-29 22:15:21,495] Trial 337 finished with values: [-1000000000.0, 1000000000.0] and parameters: {'p_sma': 6, 'p_std': 25, 'p_atr': 7, 'p_adx': 20, 'rsi_period': 78, 'ema1': 10, 'ema2': 33, 'slip_atr_k': 0.17702271376653853, 'slip_spread_k': 0.4897871525965635, 'spread_hl_frac': 0.020652240672574405, 'bb_std_mult': 3.286384332830279, 'rsi_os': 25, 'rsi_ob': 55, 'vol_spike': 0.27632835479143797, 'adx_thresh': 24.83961010073261, 'atr_min_pct': 0.007009729756852403, 'atr_max_pct': 0.04945400768161829, 'tp_mult': 2.5326968647748025, 'tsl_mult': 0.712418933988878, 'strategy': 'breakout', 'time_stop': 112, 'use_sma': False, 'use_atr': False, 'use_adx': False, 'use_ema': False, 'use_spike': False, 'rsi_required': False, 'edge_k': 0.1521590746738326, 'edge_cap': 0.8213695188186176}.
[I 2025-08-29 22:15:21,612] Trial 336 finished with values: [-0.0029404156670093107, 0.0029451385238716083] and parameters: {'p_sma': 10, 'p_std': 25, 'p_atr': 23, 'p_adx': 24, 'rsi_period': 79, 'ema1': 5, 'ema2': 53, 'slip_atr_k': 0.015502259267274837, 'slip_spread_k': 0.48235908198328503, 'spread_hl_frac': 0.020210531780962195, 'bb_std_mult': 2.078065658766301, 'rsi_os': 25, 'rsi_ob': 58, 'vol_spike': 0.17404985375704843, 'adx_thresh': 24.949725070783334, 'atr_min_pct': 0.0007907046069309711, 'atr_max_pct': 0.10205540437736506, 'tp_mult': 1.1300194662159944, 'tsl_mult': 0.6999089680102513, 'strategy': 'breakout', 'time_stop': 141, 'use_sma': False, 'use_atr': False, 'use_adx': False, 'use_ema': False, 'use_spike': False, 'rsi_required': False, 'edge_k': 1.1931282893132178, 'edge_cap': 0.821433512632197}.
[I 2025-08-29 22:15:21,678] Trial 334 finished with values: [-0.03163102234815085, 0.0316467428116818] and parameters: {'p_sma': 54, 'p_std': 25, 'p_atr': 7, 'p_adx': 15, 'rsi_period': 20, 'ema1': 24, 'ema2': 42, 'slip_atr_k': 0.013002308670031857, 'slip_spread_k': 0.8146840652372221, 'spread_hl_frac': 0.020064386932696476, 'bb_std_mult': 3.59485328550965, 'rsi_os': 37, 'rsi_ob': 76, 'vol_spike': 0.027125915594194888, 'adx_thresh': 5.088567209713879, 'atr_min_pct': 0.003013326242643291, 'atr_max_pct': 0.10240748171754305, 'tp_mult': 1.0921552079516124, 'tsl_mult': 0.6800201719883273, 'strategy': 'breakout', 'time_stop': 240, 'use_sma': False, 'use_atr': False, 'use_adx': False, 'use_ema': False, 'use_spike': False, 'rsi_required': False, 'edge_k': 0.9959375404038948, 'edge_cap': 0.8128092199713158}.
[I 2025-08-29 22:15:47,745] Trial 340 finished with values: [-0.008377012764094971, 0.00834949845917803] and parameters: {'p_sma': 22, 'p_std': 27, 'p_atr': 23, 'p_adx': 16, 'rsi_period': 41, 'ema1': 16, 'ema2': 54, 'slip_atr_k': 0.013407183629526712, 'slip_spread_k': 0.11211915285384932, 'spread_hl_frac': 0.025504261461616013, 'bb_std_mult': 2.0672906291589883, 'rsi_os': 26, 'rsi_ob': 59, 'vol_spike': 0.29369582142948564, 'adx_thresh': 24.982517386744206, 'atr_min_pct': 0.0007641640120122359, 'atr_max_pct': 0.08327763245842348, 'tp_mult': 1.0578863989370746, 'tsl_mult': 0.6832107307000306, 'strategy': 'breakout', 'time_stop': 183, 'use_sma': False, 'use_atr': False, 'use_adx': False, 'use_ema': False, 'use_spike': False, 'rsi_required': False, 'edge_k': 0.22742668397266463, 'edge_cap': 0.7606337024276749}.
[I 2025-08-29 22:15:48,453] Trial 339 finished with values: [-1000000000.0, 1000000000.0] and parameters: {'p_sma': 7, 'p_std': 27, 'p_atr': 23, 'p_adx': 24, 'rsi_period': 32, 'ema1': 24, 'ema2': 40, 'slip_atr_k': 0.005576661655175397, 'slip_spread_k': 0.1194390624036486, 'spread_hl_frac': 0.015800340128564197, 'bb_std_mult': 2.0824659365770706, 'rsi_os': 12, 'rsi_ob': 61, 'vol_spike': 0.20263936273216093, 'adx_thresh': 18.763759763747316, 'atr_min_pct': 0.0006795032144470163, 'atr_max_pct': 0.0828522246587118, 'tp_mult': 1.5876617879464088, 'tsl_mult': 0.024762674516386085, 'strategy': 'breakout', 'time_stop': 89, 'use_sma': False, 'use_atr': False, 'use_adx': False, 'use_ema': False, 'use_spike': False, 'rsi_required': False, 'edge_k': 0.22816208362299828, 'edge_cap': 0.8903938123085657}.
[I 2025-08-29 22:15:48,593] Trial 338 finished with values: [-0.003003068202117376, 0.0032922746762678095] and parameters: {'p_sma': 22, 'p_std': 27, 'p_atr': 7, 'p_adx': 24, 'rsi_period': 47, 'ema1': 5, 'ema2': 29, 'slip_atr_k': 0.0053255876801517835, 'slip_spread_k': 0.11585820037519984, 'spread_hl_frac': 0.026941684590509506, 'bb_std_mult': 2.077979354526197, 'rsi_os': 25, 'rsi_ob': 66, 'vol_spike': 0.012053746288672645, 'adx_thresh': 24.837649036322205, 'atr_min_pct': 0.0028463383476999265, 'atr_max_pct': 0.07413314010465956, 'tp_mult': 1.5864865655010985, 'tsl_mult': 0.6944731803821603, 'strategy': 'breakout', 'time_stop': 195, 'use_sma': False, 'use_atr': False, 'use_adx': False, 'use_ema': False, 'use_spike': False, 'rsi_required': False, 'edge_k': 0.16274952448871127, 'edge_cap': 0.7628503499540737}.
[I 2025-08-29 22:15:48,715] Trial 341 finished with values: [-0.007197399887893696, 0.0071719999855274835] and parameters: {'p_sma': 41, 'p_std': 33, 'p_atr': 23, 'p_adx': 16, 'rsi_period': 65, 'ema1': 14, 'ema2': 54, 'slip_atr_k': 0.0054541168295132916, 'slip_spread_k': 0.8438930648487448, 'spread_hl_frac': 0.025129658940458148, 'bb_std_mult': 2.6777702209130485, 'rsi_os': 12, 'rsi_ob': 59, 'vol_spike': 0.21371679646209557, 'adx_thresh': 24.802358468068718, 'atr_min_pct': 0.0009892939386817459, 'atr_max_pct': 0.14205517695288442, 'tp_mult': 1.1727743838151254, 'tsl_mult': 0.7238040161544901, 'strategy': 'breakout', 'time_stop': 183, 'use_sma': False, 'use_atr': False, 'use_adx': False, 'use_ema': False, 'use_spike': False, 'rsi_required': False, 'edge_k': 0.41715944324638937, 'edge_cap': 0.7500060501763282}.
[I 2025-08-29 22:16:15,649] Trial 344 finished with values: [-1000000000.0, 1000000000.0] and parameters: {'p_sma': 5, 'p_std': 55, 'p_atr': 22, 'p_adx': 8, 'rsi_period': 17, 'ema1': 5, 'ema2': 53, 'slip_atr_k': 0.02420687819781853, 'slip_spread_k': 0.8476556088537652, 'spread_hl_frac': 0.03159775549477596, 'bb_std_mult': 2.1282299941246094, 'rsi_os': 24, 'rsi_ob': 95, 'vol_spike': 0.18846006266154774, 'adx_thresh': 22.739030273563117, 'atr_min_pct': 0.003468736508495218, 'atr_max_pct': 0.09433908485117792, 'tp_mult': 1.150857691511506, 'tsl_mult': 0.7336076215354161, 'strategy': 'breakout', 'time_stop': 26, 'use_sma': False, 'use_atr': False, 'use_adx': False, 'use_ema': False, 'use_spike': False, 'rsi_required': False, 'edge_k': 1.157397892692011, 'edge_cap': 0.9232189104506351}.
[I 2025-08-29 22:16:15,697] Trial 343 finished with values: [-0.010791720046292919, 0.010962250622463345] and parameters: {'p_sma': 38, 'p_std': 55, 'p_atr': 22, 'p_adx': 17, 'rsi_period': 15, 'ema1': 23, 'ema2': 53, 'slip_atr_k': 0.05165565556497635, 'slip_spread_k': 0.8689797814085609, 'spread_hl_frac': 0.017262768913809175, 'bb_std_mult': 2.7141751083867782, 'rsi_os': 24, 'rsi_ob': 58, 'vol_spike': 0.19348074364111265, 'adx_thresh': 21.626447518889453, 'atr_min_pct': 0.002722789044342672, 'atr_max_pct': 0.0879658461301818, 'tp_mult': 1.4013520834462367, 'tsl_mult': 0.2070799890665112, 'strategy': 'breakout', 'time_stop': 140, 'use_sma': False, 'use_atr': False, 'use_adx': False, 'use_ema': False, 'use_spike': False, 'rsi_required': False, 'edge_k': 0.43331311073561074, 'edge_cap': 0.7816780363306267}.
[I 2025-08-29 22:16:15,775] Trial 345 finished with values: [-1000000000.0, 1000000000.0] and parameters: {'p_sma': 5, 'p_std': 55, 'p_atr': 22, 'p_adx': 22, 'rsi_period': 50, 'ema1': 30, 'ema2': 55, 'slip_atr_k': 0.05065306114534451, 'slip_spread_k': 0.8582850852489331, 'spread_hl_frac': 0.03106512086107916, 'bb_std_mult': 3.458047114146635, 'rsi_os': 24, 'rsi_ob': 46, 'vol_spike': 0.1924624913602776, 'adx_thresh': 26.31486822448431, 'atr_min_pct': 0.002820367748813943, 'atr_max_pct': 0.07297701618024911, 'tp_mult': 1.7473363105603772, 'tsl_mult': 0.742173519579676, 'strategy': 'breakout', 'time_stop': 140, 'use_sma': False, 'use_atr': False, 'use_adx': False, 'use_ema': False, 'use_spike': False, 'rsi_required': False, 'edge_k': 1.1729319502899083, 'edge_cap': 0.7624666461757023}.
[I 2025-08-29 22:16:15,886] Trial 342 finished with values: [-0.003494148232363714, 0.003942868386609321] and parameters: {'p_sma': 13, 'p_std': 33, 'p_atr': 23, 'p_adx': 9, 'rsi_period': 20, 'ema1': 24, 'ema2': 31, 'slip_atr_k': 0.007445185460932282, 'slip_spread_k': 0.8450787960523187, 'spread_hl_frac': 0.015819567721627036, 'bb_std_mult': 2.6968963700289645, 'rsi_os': 25, 'rsi_ob': 61, 'vol_spike': 0.20424278073409646, 'adx_thresh': 22.784418225252203, 'atr_min_pct': 0.0028992610030306055, 'atr_max_pct': 0.056353381598651574, 'tp_mult': 1.1533797506054122, 'tsl_mult': 0.06456327605075896, 'strategy': 'breakout', 'time_stop': 38, 'use_sma': False, 'use_atr': False, 'use_adx': False, 'use_ema': False, 'use_spike': False, 'rsi_required': False, 'edge_k': 0.42624624703174085, 'edge_cap': 0.8914557872072215}.
[I 2025-08-29 22:16:16,055] Trial 348 finished with values: [-1000000000.0, 1000000000.0] and parameters: {'p_sma': 9, 'p_std': 23, 'p_atr': 24, 'p_adx': 13, 'rsi_period': 72, 'ema1': 25, 'ema2': 54, 'slip_atr_k': 0.026869919786059154, 'slip_spread_k': 0.7914463282207049, 'spread_hl_frac': 0.049629544695619435, 'bb_std_mult': 2.075269423008958, 'rsi_os': 55, 'rsi_ob': 82, 'vol_spike': 0.17837629777544267, 'adx_thresh': 28.691500891385257, 'atr_min_pct': 0.001999677389293281, 'atr_max_pct': 0.0985280169804044, 'tp_mult': 1.2956100893855653, 'tsl_mult': 0.6945740815023658, 'strategy': 'mean_reversion', 'time_stop': 195, 'use_sma': False, 'use_atr': False, 'use_adx': False, 'use_ema': False, 'use_spike': False, 'rsi_required': False, 'edge_k': 0.4823789140723486, 'edge_cap': 0.797595715050254}.
[I 2025-08-29 22:16:42,647] Trial 347 finished with values: [-1000000000.0, 1000000000.0] and parameters: {'p_sma': 7, 'p_std': 23, 'p_atr': 13, 'p_adx': 13, 'rsi_period': 20, 'ema1': 25, 'ema2': 56, 'slip_atr_k': 0.1216203189283623, 'slip_spread_k': 0.6874261674542483, 'spread_hl_frac': 0.015827039912958404, 'bb_std_mult': 2.276760650053877, 'rsi_os': 19, 'rsi_ob': 68, 'vol_spike': 0.01029346187553512, 'adx_thresh': 26.251201692241622, 'atr_min_pct': 0.0030765649192126964, 'atr_max_pct': 0.0736137810284468, 'tp_mult': 1.1321302309634131, 'tsl_mult': 0.06265236431693966, 'strategy': 'mean_reversion', 'time_stop': 119, 'use_sma': False, 'use_atr': False, 'use_adx': False, 'use_ema': False, 'use_spike': False, 'rsi_required': False, 'edge_k': 1.4723909428430886, 'edge_cap': 0.6774011213770104}.
[I 2025-08-29 22:16:42,828] Trial 346 finished with values: [-1000000000.0, 1000000000.0] and parameters: {'p_sma': 10, 'p_std': 23, 'p_atr': 13, 'p_adx': 13, 'rsi_period': 14, 'ema1': 7, 'ema2': 56, 'slip_atr_k': 0.05074476861467844, 'slip_spread_k': 0.4145629188403286, 'spread_hl_frac': 0.017759483151590576, 'bb_std_mult': 3.4197915075864924, 'rsi_os': 43, 'rsi_ob': 58, 'vol_spike': 0.012049903442683307, 'adx_thresh': 6.365655359545155, 'atr_min_pct': 0.014110403308737796, 'atr_max_pct': 0.09801942116044914, 'tp_mult': 1.385661825282719, 'tsl_mult': 0.08429068603755785, 'strategy': 'mean_reversion', 'time_stop': 121, 'use_sma': False, 'use_atr': False, 'use_adx': False, 'use_ema': False, 'use_spike': False, 'rsi_required': False, 'edge_k': 0.4924080113405962, 'edge_cap': 0.6835720194894166}.
[I 2025-08-29 22:16:42,905] Trial 349 finished with values: [-1000000000.0, 1000000000.0] and parameters: {'p_sma': 10, 'p_std': 23, 'p_atr': 23, 'p_adx': 13, 'rsi_period': 47, 'ema1': 25, 'ema2': 27, 'slip_atr_k': 0.1233616125707521, 'slip_spread_k': 0.4312307713600538, 'spread_hl_frac': 0.01748343702624579, 'bb_std_mult': 1.6034973524421783, 'rsi_os': 26, 'rsi_ob': 53, 'vol_spike': 0.00965641042678031, 'adx_thresh': 25.65998619456648, 'atr_min_pct': 0.018911294513932055, 'atr_max_pct': 0.09906907836696228, 'tp_mult': 1.134057452520066, 'tsl_mult': 0.05885115997196072, 'strategy': 'mean_reversion', 'time_stop': 195, 'use_sma': False, 'use_atr': False, 'use_adx': False, 'use_ema': False, 'use_spike': False, 'rsi_required': False, 'edge_k': 0.4801956309898081, 'edge_cap': 0.5298125895158422}.
[I 2025-08-29 22:16:43,016] Trial 350 finished with values: [-1000000000.0, 1000000000.0] and parameters: {'p_sma': 48, 'p_std': 28, 'p_atr': 23, 'p_adx': 19, 'rsi_period': 55, 'ema1': 7, 'ema2': 31, 'slip_atr_k': 0.12306697407226701, 'slip_spread_k': 0.3493789612303006, 'spread_hl_frac': 0.04645390560759495, 'bb_std_mult': 1.9978841071102462, 'rsi_os': 26, 'rsi_ob': 71, 'vol_spike': 0.2996736013073184, 'adx_thresh': 34.1435236791018, 'atr_min_pct': 0.01409794965511843, 'atr_max_pct': 0.06464501315654665, 'tp_mult': 1.1228130276752046, 'tsl_mult': 0.08328918430564503, 'strategy': 'mean_reversion', 'time_stop': 38, 'use_sma': False, 'use_atr': False, 'use_adx': False, 'use_ema': False, 'use_spike': False, 'rsi_required': False, 'edge_k': 0.5895897148615445, 'edge_cap': 0.3222502499231614}.
