[I 2025-08-30 00:03:24,068] Trial 1324 finished with values: [-1000000000.0, 1000000000.0] and parameters: {'p_sma': 5, 'p_std': 26, 'p_atr': 23, 'p_adx': 20, 'rsi_period': 22, 'ema1': 23, 'ema2': 55, 'slip_atr_k': 0.09625064740456837, 'slip_spread_k': 0.29649283612530364, 'spread_hl_frac': 0.026870001891067287, 'bb_std_mult': 2.910116958101927, 'rsi_os': 27, 'rsi_ob': 61, 'vol_spike': 0.19111709648430503, 'adx_thresh': 24.285599917441345, 'atr_min_pct': 0.016830047065524566, 'atr_max_pct': 0.09896117221788092, 'tp_mult': 2.588582037109659, 'tsl_mult': 0.4787561026424408, 'strategy': 'mean_reversion', 'time_stop': 109, 'use_sma': False, 'use_atr': False, 'use_adx': False, 'use_ema': False, 'use_spike': False, 'rsi_required': False, 'edge_k': 1.3019345911485103, 'edge_cap': 0.46768433346556615}.
[I 2025-08-30 00:03:24,531] Trial 1323 finished with values: [-1000000000.0, 1000000000.0] and parameters: {'p_sma': 11, 'p_std': 58, 'p_atr': 11, 'p_adx': 28, 'rsi_period': 21, 'ema1': 23, 'ema2': 55, 'slip_atr_k': 0.012098151588990372, 'slip_spread_k': 0.30572735289131375, 'spread_hl_frac': 0.002053543735355337, 'bb_std_mult': 2.905866057340752, 'rsi_os': 29, 'rsi_ob': 60, 'vol_spike': 0.1912698309017689, 'adx_thresh': 24.22821083457045, 'atr_min_pct': 0.013849380065797248, 'atr_max_pct': 0.09839479519450166, 'tp_mult': 2.830272971875991, 'tsl_mult': 0.7163879340980095, 'strategy': 'mean_reversion', 'time_stop': 124, 'use_sma': False, 'use_atr': False, 'use_adx': False, 'use_ema': False, 'use_spike': False, 'rsi_required': False, 'edge_k': 0.37023828861247987, 'edge_cap': 0.8538739122719151}.
[I 2025-08-30 00:03:24,600] Trial 1326 finished with values: [-0.024077155181183474, 0.024080071743758882] and parameters: {'p_sma': 57, 'p_std': 12, 'p_atr': 23, 'p_adx': 16, 'rsi_period': 9, 'ema1': 24, 'ema2': 56, 'slip_atr_k': 0.024232195350507385, 'slip_spread_k': 0.23637707009896902, 'spread_hl_frac': 0.0167590050610988, 'bb_std_mult': 1.0368495343793627, 'rsi_os': 35, 'rsi_ob': 60, 'vol_spike': 0.09423359460063849, 'adx_thresh': 12.146026047636948, 'atr_min_pct': 0.0030260008364986937, 'atr_max_pct': 0.09889300211147815, 'tp_mult': 1.1035750662105956, 'tsl_mult': 0.5164503773129412, 'strategy': 'breakout', 'time_stop': 39, 'use_sma': False, 'use_atr': False, 'use_adx': False, 'use_ema': False, 'use_spike': False, 'rsi_required': False, 'edge_k': 0.37415655811937687, 'edge_cap': 0.8232305690737118}.
[I 2025-08-30 00:03:24,683] Trial 1325 finished with values: [-1000000000.0, 1000000000.0] and parameters: {'p_sma': 5, 'p_std': 26, 'p_atr': 23, 'p_adx': 18, 'rsi_period': 22, 'ema1': 24, 'ema2': 56, 'slip_atr_k': 0.012409051158391884, 'slip_spread_k': 0.18424078694303692, 'spread_hl_frac': 0.03239395765967279, 'bb_std_mult': 2.8926402473839654, 'rsi_os': 27, 'rsi_ob': 61, 'vol_spike': 0.29051042541462413, 'adx_thresh': 11.942536665154835, 'atr_min_pct': 0.003324756070007189, 'atr_max_pct': 0.09918641436648548, 'tp_mult': 1.7076932770606679, 'tsl_mult': 0.4825739321837422, 'strategy': 'mean_reversion', 'time_stop': 111, 'use_sma': False, 'use_atr': False, 'use_adx': False, 'use_ema': False, 'use_spike': False, 'rsi_required': False, 'edge_k': 1.2953712270485624, 'edge_cap': 0.8275486291620727}.
[I 2025-08-30 00:03:50,654] Trial 1328 finished with values: [-0.018434977887581083, 0.018536564272581803] and parameters: {'p_sma': 22, 'p_std': 12, 'p_atr': 23, 'p_adx': 16, 'rsi_period': 9, 'ema1': 24, 'ema2': 56, 'slip_atr_k': 0.024187377538198933, 'slip_spread_k': 0.6775306195398165, 'spread_hl_frac': 0.01672802405192228, 'bb_std_mult': 2.214667668401622, 'rsi_os': 26, 'rsi_ob': 82, 'vol_spike': 0.22112698100956657, 'adx_thresh': 20.82460606333653, 'atr_min_pct': 0.0030308118349011573, 'atr_max_pct': 0.08125267632083108, 'tp_mult': 1.9588482029531795, 'tsl_mult': 0.7392676834387315, 'strategy': 'breakout', 'time_stop': 99, 'use_sma': False, 'use_atr': False, 'use_adx': False, 'use_ema': False, 'use_spike': False, 'rsi_required': False, 'edge_k': 0.4948038108942615, 'edge_cap': 0.8274559035387461}.
[I 2025-08-30 00:03:50,851] Trial 1327 finished with values: [-1000000000.0, 1000000000.0] and parameters: {'p_sma': 7, 'p_std': 18, 'p_atr': 23, 'p_adx': 16, 'rsi_period': 21, 'ema1': 21, 'ema2': 56, 'slip_atr_k': 0.027475882107373884, 'slip_spread_k': 0.8142863792307644, 'spread_hl_frac': 0.01688976434664448, 'bb_std_mult': 2.1674466399517525, 'rsi_os': 26, 'rsi_ob': 83, 'vol_spike': 0.2886216844058099, 'adx_thresh': 26.001783804030474, 'atr_min_pct': 0.003073713602763418, 'atr_max_pct': 0.1285792171643684, 'tp_mult': 1.9343835885881953, 'tsl_mult': 0.7425798885790531, 'strategy': 'breakout', 'time_stop': 109, 'use_sma': False, 'use_atr': False, 'use_adx': False, 'use_ema': False, 'use_spike': False, 'rsi_required': False, 'edge_k': 0.48203027538900967, 'edge_cap': 0.8310133312905723}.
[I 2025-08-30 00:03:51,155] Trial 1330 finished with values: [-0.010935274425014407, 0.010913925789361683] and parameters: {'p_sma': 30, 'p_std': 27, 'p_atr': 22, 'p_adx': 16, 'rsi_period': 19, 'ema1': 25, 'ema2': 53, 'slip_atr_k': 0.06274454095126977, 'slip_spread_k': 0.5250103677837806, 'spread_hl_frac': 0.01633483726941307, 'bb_std_mult': 2.2048477919540277, 'rsi_os': 12, 'rsi_ob': 62, 'vol_spike': 0.11922324006238733, 'adx_thresh': 24.99322317820467, 'atr_min_pct': 9.468600867691733e-05, 'atr_max_pct': 0.09507941782041009, 'tp_mult': 2.052801161622658, 'tsl_mult': 0.7378613323348956, 'strategy': 'breakout', 'time_stop': 98, 'use_sma': False, 'use_atr': False, 'use_adx': False, 'use_ema': False, 'use_spike': False, 'rsi_required': False, 'edge_k': 0.48830398309002543, 'edge_cap': 0.5085529639907338}.
[I 2025-08-30 00:03:51,206] Trial 1329 finished with values: [-1000000000.0, 1000000000.0] and parameters: {'p_sma': 7, 'p_std': 25, 'p_atr': 23, 'p_adx': 11, 'rsi_period': 50, 'ema1': 18, 'ema2': 48, 'slip_atr_k': 0.061633394793582416, 'slip_spread_k': 0.52158675465582, 'spread_hl_frac': 0.013908202095308068, 'bb_std_mult': 2.0976327423623173, 'rsi_os': 12, 'rsi_ob': 63, 'vol_spike': 0.11917425088112119, 'adx_thresh': 7.600781740084253, 'atr_min_pct': 0.021308056109751512, 'atr_max_pct': 0.09499836461358997, 'tp_mult': 2.0568556051409588, 'tsl_mult': 0.4044934597655349, 'strategy': 'breakout', 'time_stop': 98, 'use_sma': False, 'use_atr': False, 'use_adx': False, 'use_ema': False, 'use_spike': False, 'rsi_required': False, 'edge_k': 0.477105913516382, 'edge_cap': 0.7635953806064979}.
[I 2025-08-30 00:04:17,394] Trial 1331 finished with values: [-1000000000.0, 1000000000.0] and parameters: {'p_sma': 7, 'p_std': 27, 'p_atr': 25, 'p_adx': 26, 'rsi_period': 82, 'ema1': 14, 'ema2': 48, 'slip_atr_k': 0.24953782369199345, 'slip_spread_k': 0.8191839466780285, 'spread_hl_frac': 0.014407501767798273, 'bb_std_mult': 2.1101613189357287, 'rsi_os': 22, 'rsi_ob': 63, 'vol_spike': 0.11965707242267806, 'adx_thresh': 24.804371840323213, 'atr_min_pct': 0.029866823075651167, 'atr_max_pct': 0.09518705090345127, 'tp_mult': 1.060250150065751, 'tsl_mult': 0.8131775974917954, 'strategy': 'breakout', 'time_stop': 116, 'use_sma': False, 'use_atr': False, 'use_adx': False, 'use_ema': False, 'use_spike': False, 'rsi_required': False, 'edge_k': 1.4195597080923523, 'edge_cap': 0.191304687015165}.
[I 2025-08-30 00:04:17,623] Trial 1334 finished with values: [-1000000000.0, 1000000000.0] and parameters: {'p_sma': 8, 'p_std': 41, 'p_atr': 24, 'p_adx': 17, 'rsi_period': 58, 'ema1': 25, 'ema2': 21, 'slip_atr_k': 0.10755898242745458, 'slip_spread_k': 0.8247039533833171, 'spread_hl_frac': 0.019171862005437218, 'bb_std_mult': 2.0213352321425644, 'rsi_os': 23, 'rsi_ob': 59, 'vol_spike': 0.05477161876770319, 'adx_thresh': 26.074001975415218, 'atr_min_pct': 0.0016490676528663924, 'atr_max_pct': 0.09007743659801083, 'tp_mult': 1.061614837941188, 'tsl_mult': 0.8166850822632616, 'strategy': 'breakout', 'time_stop': 118, 'use_sma': False, 'use_atr': False, 'use_adx': False, 'use_ema': False, 'use_spike': False, 'rsi_required': False, 'edge_k': 0.5960020098837879, 'edge_cap': 0.24138775020695324}.
[I 2025-08-30 00:04:17,629] Trial 1333 finished with values: [-0.0029015115928993085, 0.003377333361361518] and parameters: {'p_sma': 8, 'p_std': 25, 'p_atr': 19, 'p_adx': 17, 'rsi_period': 45, 'ema1': 14, 'ema2': 39, 'slip_atr_k': 0.01729380595119664, 'slip_spread_k': 0.4142879031905239, 'spread_hl_frac': 0.01897531945494061, 'bb_std_mult': 3.1990203411866673, 'rsi_os': 22, 'rsi_ob': 59, 'vol_spike': 0.1799603501919582, 'adx_thresh': 19.476400507762126, 'atr_min_pct': 0.0015708883143324588, 'atr_max_pct': 0.1395868914648646, 'tp_mult': 1.0696985906233403, 'tsl_mult': 0.6920682756307414, 'strategy': 'breakout', 'time_stop': 115, 'use_sma': False, 'use_atr': False, 'use_adx': False, 'use_ema': False, 'use_spike': False, 'rsi_required': False, 'edge_k': 1.4746316901396905, 'edge_cap': 0.3419127263265858}.
[I 2025-08-30 00:04:17,753] Trial 1332 finished with values: [-1000000000.0, 1000000000.0] and parameters: {'p_sma': 7, 'p_std': 34, 'p_atr': 19, 'p_adx': 11, 'rsi_period': 50, 'ema1': 25, 'ema2': 30, 'slip_atr_k': 0.06222415939069145, 'slip_spread_k': 0.8244446443285549, 'spread_hl_frac': 0.01468920127271166, 'bb_std_mult': 3.2277214368053926, 'rsi_os': 15, 'rsi_ob': 62, 'vol_spike': 0.12099771234090373, 'adx_thresh': 25.03830459318194, 'atr_min_pct': 5.227524275892284e-05, 'atr_max_pct': 0.09475679175273496, 'tp_mult': 1.0666320785993593, 'tsl_mult': 0.6978727672876492, 'strategy': 'breakout', 'time_stop': 29, 'use_sma': False, 'use_atr': False, 'use_adx': False, 'use_ema': False, 'use_spike': False, 'rsi_required': False, 'edge_k': 0.11735028042231654, 'edge_cap': 0.23476152389378951}.
[I 2025-08-30 00:04:44,056] Trial 1338 finished with values: [-0.013082819973804338, 0.013065037492192205] and parameters: {'p_sma': 52, 'p_std': 24, 'p_atr': 28, 'p_adx': 15, 'rsi_period': 18, 'ema1': 23, 'ema2': 59, 'slip_atr_k': 0.003565896723675058, 'slip_spread_k': 0.8541446959585568, 'spread_hl_frac': 0.01784225548054737, 'bb_std_mult': 1.4915600416582868, 'rsi_os': 28, 'rsi_ob': 45, 'vol_spike': 0.012094026541496938, 'adx_thresh': 27.013271387910507, 'atr_min_pct': 0.002421387729912604, 'atr_max_pct': 0.09203814589565662, 'tp_mult': 1.2374305211682115, 'tsl_mult': 0.7825061013178749, 'strategy': 'breakout', 'time_stop': 87, 'use_sma': False, 'use_atr': False, 'use_adx': False, 'use_ema': False, 'use_spike': False, 'rsi_required': False, 'edge_k': 0.5335617087424808, 'edge_cap': 0.7911457512144842}.
[I 2025-08-30 00:04:44,251] Trial 1336 finished with values: [-1000000000.0, 1000000000.0] and parameters: {'p_sma': 53, 'p_std': 51, 'p_atr': 22, 'p_adx': 8, 'rsi_period': 54, 'ema1': 24, 'ema2': 19, 'slip_atr_k': 0.004490817740726755, 'slip_spread_k': 0.8556530048726823, 'spread_hl_frac': 0.015585445095677749, 'bb_std_mult': 1.9158592209301224, 'rsi_os': 15, 'rsi_ob': 75, 'vol_spike': 0.012710232542282346, 'adx_thresh': 15.597156474030278, 'atr_min_pct': 0.005132980803494213, 'atr_max_pct': 0.0926319680585998, 'tp_mult': 2.2142295217961867, 'tsl_mult': 0.7863136230723289, 'strategy': 'breakout', 'time_stop': 136, 'use_sma': False, 'use_atr': False, 'use_adx': False, 'use_ema': False, 'use_spike': False, 'rsi_required': False, 'edge_k': 0.15126452489443443, 'edge_cap': 0.7960438921116733}.
[I 2025-08-30 00:04:44,314] Trial 1335 finished with values: [-1000000000.0, 1000000000.0] and parameters: {'p_sma': 6, 'p_std': 54, 'p_atr': 28, 'p_adx': 24, 'rsi_period': 45, 'ema1': 24, 'ema2': 42, 'slip_atr_k': 0.01786302033714497, 'slip_spread_k': 0.854404087199367, 'spread_hl_frac': 0.019087712829733355, 'bb_std_mult': 2.0191363892552094, 'rsi_os': 23, 'rsi_ob': 66, 'vol_spike': 0.012370278351734737, 'adx_thresh': 25.970715003370916, 'atr_min_pct': 0.0016237209408632976, 'atr_max_pct': 0.11675185607786999, 'tp_mult': 2.8779562232577183, 'tsl_mult': 0.059936080656779356, 'strategy': 'breakout', 'time_stop': 279, 'use_sma': False, 'use_atr': False, 'use_adx': False, 'use_ema': False, 'use_spike': False, 'rsi_required': False, 'edge_k': 0.529721478436643, 'edge_cap': 0.7931828402288399}.
[I 2025-08-30 00:04:44,325] Trial 1337 finished with values: [-1000000000.0, 1000000000.0] and parameters: {'p_sma': 6, 'p_std': 50, 'p_atr': 27, 'p_adx': 15, 'rsi_period': 66, 'ema1': 24, 'ema2': 54, 'slip_atr_k': 0.007349971445200507, 'slip_spread_k': 0.026160141390765335, 'spread_hl_frac': 0.015443001722775436, 'bb_std_mult': 2.547650356294958, 'rsi_os': 24, 'rsi_ob': 74, 'vol_spike': 0.14642095967814817, 'adx_thresh': 15.831889953543044, 'atr_min_pct': 0.0021671220950482332, 'atr_max_pct': 0.12204973718516487, 'tp_mult': 1.115732449282976, 'tsl_mult': 0.6433735367328405, 'strategy': 'breakout', 'time_stop': 137, 'use_sma': False, 'use_atr': False, 'use_adx': False, 'use_ema': False, 'use_spike': False, 'rsi_required': False, 'edge_k': 0.5310641816341266, 'edge_cap': 0.7968079755316386}.
[I 2025-08-30 00:05:10,527] Trial 1339 finished with values: [-1000000000.0, 1000000000.0] and parameters: {'p_sma': 6, 'p_std': 29, 'p_atr': 22, 'p_adx': 12, 'rsi_period': 66, 'ema1': 24, 'ema2': 54, 'slip_atr_k': 0.018316522152437426, 'slip_spread_k': 0.9504257372110805, 'spread_hl_frac': 0.015561097580462927, 'bb_std_mult': 3.327931881048762, 'rsi_os': 24, 'rsi_ob': 60, 'vol_spike': 0.17250659958417267, 'adx_thresh': 16.178465829913222, 'atr_min_pct': 0.013151797345667501, 'atr_max_pct': 0.09230661289353818, 'tp_mult': 1.1166089857622392, 'tsl_mult': 0.6224296199478944, 'strategy': 'mean_reversion', 'time_stop': 105, 'use_sma': False, 'use_atr': False, 'use_adx': False, 'use_ema': False, 'use_spike': False, 'rsi_required': False, 'edge_k': 0.4230358250090766, 'edge_cap': 0.7975800461353321}.
[I 2025-08-30 00:05:10,715] Trial 1340 finished with values: [-0.0068055033990062075, 0.006814376745086409] and parameters: {'p_sma': 13, 'p_std': 38, 'p_atr': 27, 'p_adx': 10, 'rsi_period': 38, 'ema1': 20, 'ema2': 46, 'slip_atr_k': 0.017591551214669432, 'slip_spread_k': 0.778729070867671, 'spread_hl_frac': 0.020949962883378102, 'bb_std_mult': 2.0831588913078685, 'rsi_os': 24, 'rsi_ob': 60, 'vol_spike': 0.17006204885818188, 'adx_thresh': 6.856704586161534, 'atr_min_pct': 0.002442985002190003, 'atr_max_pct': 0.08793698221978447, 'tp_mult': 1.1158484309080758, 'tsl_mult': 0.2025342208191946, 'strategy': 'mean_reversion', 'time_stop': 55, 'use_sma': False, 'use_atr': False, 'use_adx': False, 'use_ema': False, 'use_spike': False, 'rsi_required': False, 'edge_k': 1.6862461153779795, 'edge_cap': 0.7635358298331162}.
[I 2025-08-30 00:05:10,882] Trial 1341 finished with values: [-1000000000.0, 1000000000.0] and parameters: {'p_sma': 10, 'p_std': 28, 'p_atr': 15, 'p_adx': 19, 'rsi_period': 20, 'ema1': 23, 'ema2': 26, 'slip_atr_k': 0.047809058042612734, 'slip_spread_k': 0.27418663651279207, 'spread_hl_frac': 0.045228699796914025, 'bb_std_mult': 2.098260333138355, 'rsi_os': 26, 'rsi_ob': 51, 'vol_spike': 0.16907595647939183, 'adx_thresh': 25.363502705726237, 'atr_min_pct': 0.0037443610592145338, 'atr_max_pct': 0.10335650662806148, 'tp_mult': 1.1105927912775684, 'tsl_mult': 0.2360444218749187, 'strategy': 'mean_reversion', 'time_stop': 104, 'use_sma': False, 'use_atr': False, 'use_adx': False, 'use_ema': False, 'use_spike': False, 'rsi_required': False, 'edge_k': 0.42556070711616795, 'edge_cap': 0.9598355736795783}.
[I 2025-08-30 00:05:10,884] Trial 1342 finished with values: [-0.003658746962192483, 0.0036606728255809077] and parameters: {'p_sma': 10, 'p_std': 28, 'p_atr': 23, 'p_adx': 16, 'rsi_period': 20, 'ema1': 27, 'ema2': 53, 'slip_atr_k': 0.032250292704640394, 'slip_spread_k': 0.788402854628205, 'spread_hl_frac': 0.020601986920144186, 'bb_std_mult': 2.098013758097159, 'rsi_os': 26, 'rsi_ob': 85, 'vol_spike': 0.1977756696470464, 'adx_thresh': 28.197026358107358, 'atr_min_pct': 0.0008245644258750601, 'atr_max_pct': 0.10269912735871128, 'tp_mult': 1.11865119994064, 'tsl_mult': 0.20332684332172984, 'strategy': 'mean_reversion', 'time_stop': 103, 'use_sma': False, 'use_atr': False, 'use_adx': False, 'use_ema': False, 'use_spike': False, 'rsi_required': False, 'edge_k': 0.42091949401079964, 'edge_cap': 0.7690044717232762}.
[I 2025-08-30 00:05:36,502] Trial 1346 finished with values: [-1000000000.0, 1000000000.0] and parameters: {'p_sma': 8, 'p_std': 6, 'p_atr': 24, 'p_adx': 14, 'rsi_period': 13, 'ema1': 26, 'ema2': 17, 'slip_atr_k': 0.026394790049053297, 'slip_spread_k': 0.4739493421364434, 'spread_hl_frac': 0.017610227808785937, 'bb_std_mult': 1.983352373677811, 'rsi_os': 27, 'rsi_ob': 55, 'vol_spike': 0.18207129391819457, 'adx_thresh': 26.402892893344493, 'atr_min_pct': 0.027633545633868942, 'atr_max_pct': 0.09668213808694164, 'tp_mult': 1.1848210138329065, 'tsl_mult': 0.5663465247811053, 'strategy': 'breakout', 'time_stop': 130, 'use_sma': False, 'use_atr': False, 'use_adx': False, 'use_ema': False, 'use_spike': False, 'rsi_required': False, 'edge_k': 0.6183023420181716, 'edge_cap': 0.9323766024474007}.
[I 2025-08-30 00:05:36,859] Trial 1344 finished with values: [-0.00673312961790784, 0.0067364710620965345] and parameters: {'p_sma': 39, 'p_std': 15, 'p_atr': 29, 'p_adx': 14, 'rsi_period': 13, 'ema1': 30, 'ema2': 51, 'slip_atr_k': 0.034549232578480506, 'slip_spread_k': 0.7781877469041627, 'spread_hl_frac': 0.01234100812096626, 'bb_std_mult': 2.145741746194502, 'rsi_os': 26, 'rsi_ob': 61, 'vol_spike': 0.19669200550912122, 'adx_thresh': 25.401806831943933, 'atr_min_pct': 0.003806348290816072, 'atr_max_pct': 0.1094793088238861, 'tp_mult': 1.181910670165491, 'tsl_mult': 0.9213268335707551, 'strategy': 'breakout', 'time_stop': 200, 'use_sma': False, 'use_atr': False, 'use_adx': False, 'use_ema': False, 'use_spike': False, 'rsi_required': False, 'edge_k': 1.8007048030847956, 'edge_cap': 0.8590784226139533}.
[I 2025-08-30 00:05:37,012] Trial 1343 finished with values: [-1000000000.0, 1000000000.0] and parameters: {'p_sma': 17, 'p_std': 46, 'p_atr': 23, 'p_adx': 14, 'rsi_period': 20, 'ema1': 27, 'ema2': 12, 'slip_atr_k': 0.030725882634991396, 'slip_spread_k': 0.7825492102317533, 'spread_hl_frac': 0.020044087859964945, 'bb_std_mult': 0.572072945879051, 'rsi_os': 26, 'rsi_ob': 51, 'vol_spike': 0.19595320185367848, 'adx_thresh': 25.51422836234428, 'atr_min_pct': 0.003655424346869998, 'atr_max_pct': 0.10332002825187864, 'tp_mult': 2.1467106833107157, 'tsl_mult': 0.1721063384323105, 'strategy': 'mean_reversion', 'time_stop': 54, 'use_sma': False, 'use_atr': False, 'use_adx': False, 'use_ema': False, 'use_spike': False, 'rsi_required': False, 'edge_k': 0.4420248732444643, 'edge_cap': 0.15616457831096003}.
[I 2025-08-30 00:05:37,089] Trial 1345 finished with values: [-0.022672173729460843, 0.022653198628878296] and parameters: {'p_sma': 8, 'p_std': 6, 'p_atr': 17, 'p_adx': 28, 'rsi_period': 20, 'ema1': 26, 'ema2': 53, 'slip_atr_k': 0.034340331773438176, 'slip_spread_k': 0.3306840268404825, 'spread_hl_frac': 0.004363025379896839, 'bb_std_mult': 0.5662255096752795, 'rsi_os': 28, 'rsi_ob': 58, 'vol_spike': 0.1970366224592474, 'adx_thresh': 26.400034350092206, 'atr_min_pct': 0.0008453493435703011, 'atr_max_pct': 0.022733830101918234, 'tp_mult': 1.1607912578740915, 'tsl_mult': 0.8493075788917857, 'strategy': 'breakout', 'time_stop': 5, 'use_sma': False, 'use_atr': False, 'use_adx': False, 'use_ema': False, 'use_spike': False, 'rsi_required': False, 'edge_k': 0.6128599717921074, 'edge_cap': 0.9259083422910968}.
[I 2025-08-30 00:06:03,689] Trial 1350 finished with values: [-1000000000.0, 1000000000.0] and parameters: {'p_sma': 6, 'p_std': 24, 'p_atr': 26, 'p_adx': 16, 'rsi_period': 40, 'ema1': 25, 'ema2': 44, 'slip_atr_k': 0.009198728612838568, 'slip_spread_k': 0.3575646621115505, 'spread_hl_frac': 0.007392303431339779, 'bb_std_mult': 3.4181497106905883, 'rsi_os': 25, 'rsi_ob': 80, 'vol_spike': 0.1545741216655533, 'adx_thresh': 24.4651959862071, 'atr_min_pct': 0.011491945680780628, 'atr_max_pct': 0.033733009789450236, 'tp_mult': 1.2756849139666269, 'tsl_mult': 0.6932737924637951, 'strategy': 'breakout', 'time_stop': 110, 'use_sma': False, 'use_atr': False, 'use_adx': False, 'use_ema': False, 'use_spike': False, 'rsi_required': False, 'edge_k': 0.6535322440051227, 'edge_cap': 0.6984495056300528}.
[I 2025-08-30 00:06:03,786] Trial 1347 finished with values: [-1000000000.0, 1000000000.0] and parameters: {'p_sma': 5, 'p_std': 24, 'p_atr': 29, 'p_adx': 30, 'rsi_period': 15, 'ema1': 22, 'ema2': 52, 'slip_atr_k': 0.009429631281533792, 'slip_spread_k': 0.8381227962126199, 'spread_hl_frac': 0.004429527593425308, 'bb_std_mult': 2.4365652540049623, 'rsi_os': 38, 'rsi_ob': 58, 'vol_spike': 0.17733171660073446, 'adx_thresh': 18.899363670320167, 'atr_min_pct': 0.011643980129669945, 'atr_max_pct': 0.035697251422170916, 'tp_mult': 1.2662585629170342, 'tsl_mult': 0.7095619561297347, 'strategy': 'breakout', 'time_stop': 49, 'use_sma': False, 'use_atr': False, 'use_adx': False, 'use_ema': False, 'use_spike': False, 'rsi_required': False, 'edge_k': 0.6451181251161522, 'edge_cap': 0.6020156334859563}.
[I 2025-08-30 00:06:03,896] Trial 1349 finished with values: [-0.005642631403676157, 0.00580331433359525] and parameters: {'p_sma': 5, 'p_std': 21, 'p_atr': 24, 'p_adx': 16, 'rsi_period': 17, 'ema1': 8, 'ema2': 44, 'slip_atr_k': 0.00958961753172359, 'slip_spread_k': 0.8419390067667838, 'spread_hl_frac': 0.028558104116929724, 'bb_std_mult': 1.786827129694922, 'rsi_os': 38, 'rsi_ob': 72, 'vol_spike': 0.1780899013979613, 'adx_thresh': 6.006052649358029, 'atr_min_pct': 0.00272683183431604, 'atr_max_pct': 0.03829832745719641, 'tp_mult': 1.1589753418369788, 'tsl_mult': 0.7091357967785525, 'strategy': 'breakout', 'time_stop': 247, 'use_sma': False, 'use_atr': False, 'use_adx': False, 'use_ema': False, 'use_spike': False, 'rsi_required': False, 'edge_k': 0.5890375680969452, 'edge_cap': 0.38853407476516516}.
