[I 2025-08-29 22:34:38,445] Trial 511 finished with values: [-0.01171979283261404, 0.011744324696071838] and parameters: {'p_sma': 9, 'p_std': 21, 'p_atr': 22, 'p_adx': 17, 'rsi_period': 17, 'ema1': 24, 'ema2': 54, 'slip_atr_k': 0.183938617806515, 'slip_spread_k': 0.3447145678673612, 'spread_hl_frac': 0.02214345361201086, 'bb_std_mult': 2.2040653112548263, 'rsi_os': 29, 'rsi_ob': 64, 'vol_spike': 0.15675791209182488, 'adx_thresh': 27.093038117849947, 'atr_min_pct': 0.002253290296592143, 'atr_max_pct': 0.12450688534240778, 'tp_mult': 2.0600397899515372, 'tsl_mult': 0.7421366722299227, 'strategy': 'mean_reversion', 'time_stop': 295, 'use_sma': False, 'use_atr': False, 'use_adx': False, 'use_ema': False, 'use_spike': False, 'rsi_required': False, 'edge_k': 1.7178191295268097, 'edge_cap': 0.8180654556039332}.
[I 2025-08-29 22:34:38,636] Trial 514 finished with values: [-1000000000.0, 1000000000.0] and parameters: {'p_sma': 6, 'p_std': 22, 'p_atr': 28, 'p_adx': 16, 'rsi_period': 20, 'ema1': 23, 'ema2': 51, 'slip_atr_k': 0.13441147416254584, 'slip_spread_k': 0.3372631645800058, 'spread_hl_frac': 0.018359032970429845, 'bb_std_mult': 3.2704011505082997, 'rsi_os': 24, 'rsi_ob': 50, 'vol_spike': 0.1889753537024638, 'adx_thresh': 26.95076515104867, 'atr_min_pct': 0.0021349036842089374, 'atr_max_pct': 0.09785260364010902, 'tp_mult': 1.2733960244458036, 'tsl_mult': 0.7391759701003313, 'strategy': 'mean_reversion', 'time_stop': 107, 'use_sma': False, 'use_atr': False, 'use_adx': False, 'use_ema': False, 'use_spike': False, 'rsi_required': False, 'edge_k': 0.5354151296517403, 'edge_cap': 0.7178223806247822}.
[I 2025-08-29 22:35:04,589] Trial 515 finished with values: [-0.01260708154926704, 0.012624000394569589] and parameters: {'p_sma': 10, 'p_std': 21, 'p_atr': 15, 'p_adx': 16, 'rsi_period': 22, 'ema1': 23, 'ema2': 22, 'slip_atr_k': 0.013502853480031989, 'slip_spread_k': 0.7753907288861787, 'spread_hl_frac': 0.022122214798574673, 'bb_std_mult': 2.0458503217328476, 'rsi_os': 24, 'rsi_ob': 60, 'vol_spike': 0.18812977647610554, 'adx_thresh': 23.814221657029208, 'atr_min_pct': 0.002199748628785451, 'atr_max_pct': 0.015940142976756944, 'tp_mult': 2.097803006576662, 'tsl_mult': 0.740281798989615, 'strategy': 'mean_reversion', 'time_stop': 107, 'use_sma': False, 'use_atr': False, 'use_adx': False, 'use_ema': False, 'use_spike': False, 'rsi_required': False, 'edge_k': 0.49428076766176876, 'edge_cap': 0.7531504210753889}.
[I 2025-08-29 22:35:05,029] Trial 516 finished with values: [-1000000000.0, 1000000000.0] and parameters: {'p_sma': 10, 'p_std': 27, 'p_atr': 28, 'p_adx': 24, 'rsi_period': 22, 'ema1': 26, 'ema2': 22, 'slip_atr_k': 0.047089462455322736, 'slip_spread_k': 0.8001942635089502, 'spread_hl_frac': 0.018172744249927653, 'bb_std_mult': 1.6883359899775543, 'rsi_os': 20, 'rsi_ob': 64, 'vol_spike': 0.1875005985334521, 'adx_thresh': 23.685938105111074, 'atr_min_pct': 0.024119548312340044, 'atr_max_pct': 0.12403867278730661, 'tp_mult': 1.1131492865538708, 'tsl_mult': 0.7368984284905967, 'strategy': 'breakout', 'time_stop': 54, 'use_sma': False, 'use_atr': False, 'use_adx': False, 'use_ema': False, 'use_spike': False, 'rsi_required': False, 'edge_k': 0.006876207553510816, 'edge_cap': 0.7280612586916987}.
[I 2025-08-29 22:35:05,445] Trial 517 finished with values: [-0.013642157037062175, 0.013650198881919132] and parameters: {'p_sma': 43, 'p_std': 27, 'p_atr': 23, 'p_adx': 12, 'rsi_period': 38, 'ema1': 23, 'ema2': 19, 'slip_atr_k': 0.011381752548785186, 'slip_spread_k': 0.8062117047252413, 'spread_hl_frac': 0.03077466992000759, 'bb_std_mult': 1.1843632933551387, 'rsi_os': 24, 'rsi_ob': 60, 'vol_spike': 0.1717467142708356, 'adx_thresh': 23.790943588345574, 'atr_min_pct': 0.0001881435550394727, 'atr_max_pct': 0.05782149849109433, 'tp_mult': 1.2784985667654003, 'tsl_mult': 0.688378520064376, 'strategy': 'breakout', 'time_stop': 107, 'use_sma': False, 'use_atr': False, 'use_adx': False, 'use_ema': False, 'use_spike': False, 'rsi_required': False, 'edge_k': 0.4728158995446631, 'edge_cap': 0.7263241059348784}.
[I 2025-08-29 22:35:05,608] Trial 518 finished with values: [-0.06046726095246724, 0.060458862379569975] and parameters: {'p_sma': 10, 'p_std': 27, 'p_atr': 23, 'p_adx': 16, 'rsi_period': 22, 'ema1': 30, 'ema2': 53, 'slip_atr_k': 0.21259183380058388, 'slip_spread_k': 0.0474150181283195, 'spread_hl_frac': 0.02017253413043755, 'bb_std_mult': 1.6873165047467535, 'rsi_os': 38, 'rsi_ob': 73, 'vol_spike': 0.12966347889274554, 'adx_thresh': 23.689849896248482, 'atr_min_pct': 0.0004015493608718133, 'atr_max_pct': 0.021325520315737423, 'tp_mult': 1.1119579756733398, 'tsl_mult': 0.5916881739835396, 'strategy': 'breakout', 'time_stop': 105, 'use_sma': False, 'use_atr': False, 'use_adx': False, 'use_ema': False, 'use_spike': False, 'rsi_required': False, 'edge_k': 1.3528501807496758, 'edge_cap': 0.24404246677484326}.
[I 2025-08-29 22:35:32,107] Trial 520 finished with values: [-1000000000.0, 1000000000.0] and parameters: {'p_sma': 49, 'p_std': 52, 'p_atr': 20, 'p_adx': 20, 'rsi_period': 29, 'ema1': 13, 'ema2': 53, 'slip_atr_k': 0.2125794335853785, 'slip_spread_k': 0.3782203955015185, 'spread_hl_frac': 0.02013144029176748, 'bb_std_mult': 1.989918130524703, 'rsi_os': 47, 'rsi_ob': 78, 'vol_spike': 0.17066926416232384, 'adx_thresh': 5.451738334012829, 'atr_min_pct': 0.01756858893755694, 'atr_max_pct': 0.09452378599665653, 'tp_mult': 1.0171620088821993, 'tsl_mult': 0.6855750289762456, 'strategy': 'breakout', 'time_stop': 98, 'use_sma': False, 'use_atr': False, 'use_adx': False, 'use_ema': False, 'use_spike': False, 'rsi_required': False, 'edge_k': 0.47006265970637884, 'edge_cap': 0.30991393895270036}.
[I 2025-08-29 22:35:32,523] Trial 519 finished with values: [-0.03955145669893534, 0.039533278772928615] and parameters: {'p_sma': 51, 'p_std': 35, 'p_atr': 23, 'p_adx': 24, 'rsi_period': 19, 'ema1': 27, 'ema2': 53, 'slip_atr_k': 0.02050460886583984, 'slip_spread_k': 0.8060418062659027, 'spread_hl_frac': 0.020089829973891922, 'bb_std_mult': 1.8896594769404926, 'rsi_os': 35, 'rsi_ob': 63, 'vol_spike': 0.27734927259653197, 'adx_thresh': 34.84685202084977, 'atr_min_pct': 0.000513752915855126, 'atr_max_pct': 0.09521341508189188, 'tp_mult': 1.107676386891915, 'tsl_mult': 0.3645122488894488, 'strategy': 'breakout', 'time_stop': 120, 'use_sma': False, 'use_atr': False, 'use_adx': False, 'use_ema': False, 'use_spike': False, 'rsi_required': False, 'edge_k': 0.25763500212974133, 'edge_cap': 0.3052511535733485}.
[I 2025-08-29 22:35:32,730] Trial 521 finished with values: [-1000000000.0, 1000000000.0] and parameters: {'p_sma': 55, 'p_std': 25, 'p_atr': 23, 'p_adx': 20, 'rsi_period': 19, 'ema1': 15, 'ema2': 41, 'slip_atr_k': 0.17253899903870634, 'slip_spread_k': 0.8484513923223218, 'spread_hl_frac': 0.019897227084403807, 'bb_std_mult': 1.875884487026747, 'rsi_os': 27, 'rsi_ob': 85, 'vol_spike': 0.29612013344857446, 'adx_thresh': 25.158780839778647, 'atr_min_pct': 0.010877312656846584, 'atr_max_pct': 0.09511756269040911, 'tp_mult': 1.0115424311700285, 'tsl_mult': 0.3074672554150655, 'strategy': 'breakout', 'time_stop': 152, 'use_sma': False, 'use_atr': False, 'use_adx': False, 'use_ema': False, 'use_spike': False, 'rsi_required': False, 'edge_k': 0.5587402347911105, 'edge_cap': 0.24459575729386807}.
[I 2025-08-29 22:35:32,891] Trial 522 finished with values: [-0.004372507579128104, 0.004975482540465649] and parameters: {'p_sma': 8, 'p_std': 56, 'p_atr': 20, 'p_adx': 11, 'rsi_period': 15, 'ema1': 24, 'ema2': 32, 'slip_atr_k': 0.02219941581987529, 'slip_spread_k': 0.8412824315914273, 'spread_hl_frac': 0.01684817756126766, 'bb_std_mult': 0.7869523722182425, 'rsi_os': 52, 'rsi_ob': 69, 'vol_spike': 0.059072126480456164, 'adx_thresh': 25.98489181887247, 'atr_min_pct': 0.0028767679314159918, 'atr_max_pct': 0.07009080774412516, 'tp_mult': 2.2132397305801432, 'tsl_mult': 0.43409604845001215, 'strategy': 'breakout', 'time_stop': 150, 'use_sma': False, 'use_atr': False, 'use_adx': False, 'use_ema': False, 'use_spike': False, 'rsi_required': False, 'edge_k': 0.3907328741440164, 'edge_cap': 0.31452025997813315}.
[I 2025-08-29 22:35:59,189] Trial 523 finished with values: [-1000000000.0, 1000000000.0] and parameters: {'p_sma': 7, 'p_std': 29, 'p_atr': 21, 'p_adx': 11, 'rsi_period': 19, 'ema1': 28, 'ema2': 24, 'slip_atr_k': 0.17113720530144705, 'slip_spread_k': 0.8473900201779709, 'spread_hl_frac': 0.01727146457558841, 'bb_std_mult': 0.7015701779597885, 'rsi_os': 26, 'rsi_ob': 68, 'vol_spike': 0.20069099711409616, 'adx_thresh': 25.98309627756015, 'atr_min_pct': 0.010880479922020079, 'atr_max_pct': 0.048998945275739905, 'tp_mult': 1.146288114565872, 'tsl_mult': 0.31405774292032185, 'strategy': 'breakout', 'time_stop': 118, 'use_sma': False, 'use_atr': False, 'use_adx': False, 'use_ema': False, 'use_spike': False, 'rsi_required': False, 'edge_k': 0.11281647354759972, 'edge_cap': 0.7821645022404657}.
[I 2025-08-29 22:35:59,470] Trial 524 finished with values: [-1000000000.0, 1000000000.0] and parameters: {'p_sma': 7, 'p_std': 25, 'p_atr': 21, 'p_adx': 7, 'rsi_period': 25, 'ema1': 14, 'ema2': 56, 'slip_atr_k': 0.17249564728733857, 'slip_spread_k': 0.905083800151821, 'spread_hl_frac': 0.01693451463148397, 'bb_std_mult': 0.8806935073448114, 'rsi_os': 28, 'rsi_ob': 69, 'vol_spike': 0.07251177256812315, 'adx_thresh': 19.59272485258221, 'atr_min_pct': 0.0045310020730944985, 'atr_max_pct': 0.09049391892594165, 'tp_mult': 1.14629836461057, 'tsl_mult': 0.3075351724025416, 'strategy': 'breakout', 'time_stop': 149, 'use_sma': False, 'use_atr': False, 'use_adx': False, 'use_ema': False, 'use_spike': False, 'rsi_required': False, 'edge_k': 1.1866433021002343, 'edge_cap': 0.6239463081330652}.
[I 2025-08-29 22:35:59,780] Trial 526 finished with values: [-1000000000.0, 1000000000.0] and parameters: {'p_sma': 12, 'p_std': 29, 'p_atr': 24, 'p_adx': 14, 'rsi_period': 43, 'ema1': 14, 'ema2': 10, 'slip_atr_k': 0.2280945100373594, 'slip_spread_k': 0.8757474439280746, 'spread_hl_frac': 0.039180387422963314, 'bb_std_mult': 0.8694254839754512, 'rsi_os': 34, 'rsi_ob': 61, 'vol_spike': 0.17704654214480797, 'adx_thresh': 26.23874238735501, 'atr_min_pct': 0.00496416042586546, 'atr_max_pct': 0.08947561447106744, 'tp_mult': 1.158153346834163, 'tsl_mult': 0.6537467849902685, 'strategy': 'breakout', 'time_stop': 273, 'use_sma': False, 'use_atr': False, 'use_adx': False, 'use_ema': False, 'use_spike': False, 'rsi_required': False, 'edge_k': 0.4456545528115783, 'edge_cap': 0.8057360991129974}.
[I 2025-08-29 22:35:59,899] Trial 525 finished with values: [-1000000000.0, 1000000000.0] and parameters: {'p_sma': 7, 'p_std': 25, 'p_atr': 21, 'p_adx': 14, 'rsi_period': 20, 'ema1': 5, 'ema2': 13, 'slip_atr_k': 0.017269656221216553, 'slip_spread_k': 0.8807823858606693, 'spread_hl_frac': 0.005565484512277542, 'bb_std_mult': 2.1026185934966897, 'rsi_os': 34, 'rsi_ob': 69, 'vol_spike': 0.09633083139390464, 'adx_thresh': 25.921190833176603, 'atr_min_pct': 0.004669853052958307, 'atr_max_pct': 0.10040297225272676, 'tp_mult': 2.5219945253795766, 'tsl_mult': 0.763560409204247, 'strategy': 'breakout', 'time_stop': 276, 'use_sma': False, 'use_atr': False, 'use_adx': False, 'use_ema': False, 'use_spike': False, 'rsi_required': False, 'edge_k': 0.11516589069951133, 'edge_cap': 0.7830452163943656}.
[I 2025-08-29 22:36:26,938] Trial 530 finished with values: [-0.04762366537147922, 0.047598881840209044] and parameters: {'p_sma': 31, 'p_std': 13, 'p_atr': 19, 'p_adx': 15, 'rsi_period': 75, 'ema1': 24, 'ema2': 33, 'slip_atr_k': 0.23616323377081433, 'slip_spread_k': 0.7058888382543757, 'spread_hl_frac': 0.014191198932467211, 'bb_std_mult': 0.5106062591180887, 'rsi_os': 22, 'rsi_ob': 55, 'vol_spike': 0.140636075091067, 'adx_thresh': 10.163315293475993, 'atr_min_pct': 0.0016513241180454294, 'atr_max_pct': 0.041539081865946605, 'tp_mult': 2.4304360444300497, 'tsl_mult': 0.701910151550179, 'strategy': 'mean_reversion', 'time_stop': 95, 'use_sma': False, 'use_atr': False, 'use_adx': False, 'use_ema': False, 'use_spike': False, 'rsi_required': False, 'edge_k': 1.5573350880217685, 'edge_cap': 0.0845766258199766}.
[I 2025-08-29 22:36:27,045] Trial 529 finished with values: [-0.004699924300810343, 0.004712148031401039] and parameters: {'p_sma': 8, 'p_std': 32, 'p_atr': 16, 'p_adx': 18, 'rsi_period': 62, 'ema1': 25, 'ema2': 30, 'slip_atr_k': 0.23624154197482547, 'slip_spread_k': 0.4055873973201841, 'spread_hl_frac': 0.013664272861460068, 'bb_std_mult': 0.5096091560902984, 'rsi_os': 22, 'rsi_ob': 92, 'vol_spike': 0.1843008850270429, 'adx_thresh': 15.603418034104992, 'atr_min_pct': 0.0014265080228125257, 'atr_max_pct': 0.0991941828678509, 'tp_mult': 1.2092407198106694, 'tsl_mult': 0.1346622061723694, 'strategy': 'breakout', 'time_stop': 28, 'use_sma': False, 'use_atr': False, 'use_adx': False, 'use_ema': False, 'use_spike': False, 'rsi_required': False, 'edge_k': 0.5251160924980285, 'edge_cap': 0.7556893087825515}.
[I 2025-08-29 22:36:27,130] Trial 527 finished with values: [-1000000000.0, 1000000000.0] and parameters: {'p_sma': 8, 'p_std': 25, 'p_atr': 24, 'p_adx': 18, 'rsi_period': 62, 'ema1': 22, 'ema2': 57, 'slip_atr_k': 0.015980763855984622, 'slip_spread_k': 0.8817639546944114, 'spread_hl_frac': 0.014473715096096147, 'bb_std_mult': 2.085976027417328, 'rsi_os': 28, 'rsi_ob': 92, 'vol_spike': 0.10030691123139351, 'adx_thresh': 21.944871668871844, 'atr_min_pct': 0.004655322492063706, 'atr_max_pct': 0.09978454424767581, 'tp_mult': 1.226040084744272, 'tsl_mult': 0.7041437531360843, 'strategy': 'breakout', 'time_stop': 259, 'use_sma': False, 'use_atr': False, 'use_adx': False, 'use_ema': False, 'use_spike': False, 'rsi_required': False, 'edge_k': 1.9957220353308782, 'edge_cap': 0.7990816510208576}.
[I 2025-08-29 22:36:27,297] Trial 528 finished with values: [-0.03105450197235371, 0.03102738561438524] and parameters: {'p_sma': 12, 'p_std': 13, 'p_atr': 24, 'p_adx': 14, 'rsi_period': 21, 'ema1': 11, 'ema2': 26, 'slip_atr_k': 0.017025866452803178, 'slip_spread_k': 0.13817472450847806, 'spread_hl_frac': 0.0140831256378373, 'bb_std_mult': 2.277359123216522, 'rsi_os': 33, 'rsi_ob': 92, 'vol_spike': 0.17604988541660072, 'adx_thresh': 9.963672362358954, 'atr_min_pct': 0.001676918587126249, 'atr_max_pct': 0.08932746428845514, 'tp_mult': 1.2383625683472195, 'tsl_mult': 0.70542470826046, 'strategy': 'breakout', 'time_stop': 96, 'use_sma': False, 'use_atr': False, 'use_adx': False, 'use_ema': False, 'use_spike': False, 'rsi_required': False, 'edge_k': 0.4494278308973809, 'edge_cap': 0.8858654641555748}.
[I 2025-08-29 22:36:54,750] Trial 531 finished with values: [-1000000000.0, 1000000000.0] and parameters: {'p_sma': 8, 'p_std': 24, 'p_atr': 25, 'p_adx': 18, 'rsi_period': 21, 'ema1': 24, 'ema2': 26, 'slip_atr_k': 0.056921607252121725, 'slip_spread_k': 0.3987727186851263, 'spread_hl_frac': 0.0023727274407106466, 'bb_std_mult': 1.9933987616404274, 'rsi_os': 26, 'rsi_ob': 91, 'vol_spike': 0.2589965275560184, 'adx_thresh': 21.87029523332507, 'atr_min_pct': 0.0030575010753781033, 'atr_max_pct': 0.06427917490553349, 'tp_mult': 1.0911412273439949, 'tsl_mult': 0.13411518166819603, 'strategy': 'breakout', 'time_stop': 227, 'use_sma': False, 'use_atr': False, 'use_adx': False, 'use_ema': False, 'use_spike': False, 'rsi_required': False, 'edge_k': 0.5727717556228855, 'edge_cap': 0.884097162220422}.
[I 2025-08-29 22:36:54,907] Trial 533 finished with values: [-1000000000.0, 1000000000.0] and parameters: {'p_sma': 6, 'p_std': 23, 'p_atr': 26, 'p_adx': 28, 'rsi_period': 84, 'ema1': 11, 'ema2': 54, 'slip_atr_k': 0.009445413304055043, 'slip_spread_k': 0.7571392736700129, 'spread_hl_frac': 0.036049066171523036, 'bb_std_mult': 1.9781890095882488, 'rsi_os': 26, 'rsi_ob': 59, 'vol_spike': 0.2595247409707103, 'adx_thresh': 22.96756387458684, 'atr_min_pct': 0.002876812893852603, 'atr_max_pct': 0.0639006867978639, 'tp_mult': 1.4844849228506247, 'tsl_mult': 0.5357939523944403, 'strategy': 'mean_reversion', 'time_stop': 111, 'use_sma': False, 'use_atr': False, 'use_adx': False, 'use_ema': False, 'use_spike': False, 'rsi_required': False, 'edge_k': 0.573752333339512, 'edge_cap': 0.5811611258962263}.
[I 2025-08-29 22:36:55,102] Trial 532 finished with values: [-1000000000.0, 1000000000.0] and parameters: {'p_sma': 6, 'p_std': 37, 'p_atr': 24, 'p_adx': 16, 'rsi_period': 7, 'ema1': 21, 'ema2': 54, 'slip_atr_k': 0.011155984503531207, 'slip_spread_k': 0.7698766847773783, 'spread_hl_frac': 0.01833400871184682, 'bb_std_mult': 0.6023447794804908, 'rsi_os': 12, 'rsi_ob': 75, 'vol_spike': 0.2609378906773707, 'adx_thresh': 21.78468984775209, 'atr_min_pct': 0.003173160176384071, 'atr_max_pct': 0.09204393869529981, 'tp_mult': 1.0922690623700366, 'tsl_mult': 0.03771882409195526, 'strategy': 'breakout', 'time_stop': 112, 'use_sma': False, 'use_atr': False, 'use_adx': False, 'use_ema': False, 'use_spike': False, 'rsi_required': False, 'edge_k': 0.5620375095819394, 'edge_cap': 0.8001661147849287}.
[I 2025-08-29 22:36:55,180] Trial 534 finished with values: [-0.005162997908827127, 0.005360485973954442] and parameters: {'p_sma': 6, 'p_std': 24, 'p_atr': 25, 'p_adx': 16, 'rsi_period': 8, 'ema1': 24, 'ema2': 44, 'slip_atr_k': 0.010357541631683717, 'slip_spread_k': 0.7526521610747519, 'spread_hl_frac': 0.01824560142683974, 'bb_std_mult': 2.014617121442546, 'rsi_os': 37, 'rsi_ob': 59, 'vol_spike': 0.2714833691128127, 'adx_thresh': 25.32715168015422, 'atr_min_pct': 0.0030382011634739227, 'atr_max_pct': 0.09210232004233228, 'tp_mult': 1.0905440870581062, 'tsl_mult': 0.5478588283566426, 'strategy': 'mean_reversion', 'time_stop': 226, 'use_sma': False, 'use_atr': False, 'use_adx': False, 'use_ema': False, 'use_spike': False, 'rsi_required': False, 'edge_k': 0.5713336825026202, 'edge_cap': 0.5729742096862944}.
[I 2025-08-29 22:37:22,442] Trial 538 finished with values: [-1000000000.0, 1000000000.0] and parameters: {'p_sma': 40, 'p_std': 5, 'p_atr': 10, 'p_adx': 8, 'rsi_period': 66, 'ema1': 16, 'ema2': 15, 'slip_atr_k': 0.022317262756038125, 'slip_spread_k': 0.5242476581155844, 'spread_hl_frac': 0.016249758281312168, 'bb_std_mult': 1.0658557582168886, 'rsi_os': 54, 'rsi_ob': 48, 'vol_spike': 0.11307101548427201, 'adx_thresh': 24.521522822920495, 'atr_min_pct': 0.029019426562269527, 'atr_max_pct': 0.09731619824662205, 'tp_mult': 1.3061409449799684, 'tsl_mult': 0.7605952224788465, 'strategy': 'breakout', 'time_stop': 45, 'use_sma': False, 'use_atr': False, 'use_adx': False, 'use_ema': False, 'use_spike': False, 'rsi_required': False, 'edge_k': 1.0783906440730011, 'edge_cap': 0.8243367996224751}.
[I 2025-08-29 22:37:22,459] Trial 535 finished with values: [-1000000000.0, 1000000000.0] and parameters: {'p_sma': 6, 'p_std': 48, 'p_atr': 10, 'p_adx': 16, 'rsi_period': 70, 'ema1': 12, 'ema2': 52, 'slip_atr_k': 0.02364987152915922, 'slip_spread_k': 0.7537454187316166, 'spread_hl_frac': 0.018366878488711588, 'bb_std_mult': 0.5977902844331358, 'rsi_os': 27, 'rsi_ob': 53, 'vol_spike': 0.10899941694558866, 'adx_thresh': 14.503172130198294, 'atr_min_pct': 0.0027397740626297173, 'atr_max_pct': 0.09224584816627951, 'tp_mult': 1.4928255640131252, 'tsl_mult': 0.04591618490099286, 'strategy': 'mean_reversion', 'time_stop': 112, 'use_sma': False, 'use_atr': False, 'use_adx': False, 'use_ema': False, 'use_spike': False, 'rsi_required': False, 'edge_k': 0.5007484654398876, 'edge_cap': 0.15188348691378195}.
[I 2025-08-29 22:37:22,608] Trial 537 finished with values: [-1000000000.0, 1000000000.0] and parameters: {'p_sma': 15, 'p_std': 40, 'p_atr': 23, 'p_adx': 16, 'rsi_period': 70, 'ema1': 16, 'ema2': 52, 'slip_atr_k': 0.03260330489561493, 'slip_spread_k': 0.8126320196520754, 'spread_hl_frac': 0.015840701739351138, 'bb_std_mult': 3.162656289599846, 'rsi_os': 31, 'rsi_ob': 89, 'vol_spike': 0.23692500051914034, 'adx_thresh': 6.3710457321679215, 'atr_min_pct': 0.0023930880057078173, 'atr_max_pct': 0.0867454347412698, 'tp_mult': 1.1782443290333924, 'tsl_mult': 0.8390641703407506, 'strategy': 'mean_reversion', 'time_stop': 44, 'use_sma': False, 'use_atr': False, 'use_adx': False, 'use_ema': False, 'use_spike': False, 'rsi_required': False, 'edge_k': 0.4953874996265127, 'edge_cap': 0.1254074885464867}.
[I 2025-08-29 22:37:22,716] Trial 536 finished with values: [-1000000000.0, 1000000000.0] and parameters: {'p_sma': 46, 'p_std': 47, 'p_atr': 23, 'p_adx': 16, 'rsi_period': 8, 'ema1': 23, 'ema2': 52, 'slip_atr_k': 0.023342204256295185, 'slip_spread_k': 0.7825520489056936, 'spread_hl_frac': 0.023594989818985043, 'bb_std_mult': 2.0534826064863267, 'rsi_os': 25, 'rsi_ob': 89, 'vol_spike': 0.16758923530234024, 'adx_thresh': 25.17036019498642, 'atr_min_pct': 0.02345561717377421, 'atr_max_pct': 0.11703430879680783, 'tp_mult': 1.0739736458356597, 'tsl_mult': 0.759239448093273, 'strategy': 'breakout', 'time_stop': 213, 'use_sma': False, 'use_atr': False, 'use_adx': False, 'use_ema': False, 'use_spike': False, 'rsi_required': False, 'edge_k': 0.6246027586297798, 'edge_cap': 0.1629943888572004}.
[I 2025-08-29 22:37:50,108] Trial 542 finished with values: [-1000000000.0, 1000000000.0] and parameters: {'p_sma': 9, 'p_std': 44, 'p_atr': 22, 'p_adx': 15, 'rsi_period': 78, 'ema1': 25, 'ema2': 55, 'slip_atr_k': 0.028743824637155503, 'slip_spread_k': 0.3013103210068875, 'spread_hl_frac': 0.025535540777842196, 'bb_std_mult': 2.14076531740519, 'rsi_os': 25, 'rsi_ob': 82, 'vol_spike': 0.1929296484454731, 'adx_thresh': 26.544839978684134, 'atr_min_pct': 0.01679693826846378, 'atr_max_pct': 0.1027227618071618, 'tp_mult': 2.799502992387122, 'tsl_mult': 0.18090208072883018, 'strategy': 'breakout', 'time_stop': 84, 'use_sma': False, 'use_atr': False, 'use_adx': False, 'use_ema': False, 'use_spike': False, 'rsi_required': False, 'edge_k': 0.39305543325750514, 'edge_cap': 0.7755848743834044}.
