[I 2025-08-29 23:39:37,600] Trial 1106 finished with values: [-1000000000.0, 1000000000.0] and parameters: {'p_sma': 25, 'p_std': 31, 'p_atr': 27, 'p_adx': 17, 'rsi_period': 18, 'ema1': 13, 'ema2': 56, 'slip_atr_k': 0.09303676507432157, 'slip_spread_k': 0.9357111564202355, 'spread_hl_frac': 0.0009852324699962806, 'bb_std_mult': 1.5370188396890447, 'rsi_os': 29, 'rsi_ob': 61, 'vol_spike': 0.17675181965068684, 'adx_thresh': 16.639971672425148, 'atr_min_pct': 0.00742746943184051, 'atr_max_pct': 0.1060868426092908, 'tp_mult': 1.2277421171723708, 'tsl_mult': 0.8186537898272171, 'strategy': 'breakout', 'time_stop': 103, 'use_sma': False, 'use_atr': False, 'use_adx': False, 'use_ema': False, 'use_spike': False, 'rsi_required': False, 'edge_k': 1.155915125449619, 'edge_cap': 0.8145109312416755}.
[I 2025-08-29 23:39:38,147] Trial 1108 finished with values: [-1000000000.0, 1000000000.0] and parameters: {'p_sma': 25, 'p_std': 12, 'p_atr': 27, 'p_adx': 17, 'rsi_period': 20, 'ema1': 12, 'ema2': 52, 'slip_atr_k': 0.09259155641568823, 'slip_spread_k': 0.8301226821242091, 'spread_hl_frac': 4.355832417388128e-05, 'bb_std_mult': 1.6622376960968301, 'rsi_os': 28, 'rsi_ob': 57, 'vol_spike': 0.16127942685767915, 'adx_thresh': 25.379167008183888, 'atr_min_pct': 0.0072315092927450015, 'atr_max_pct': 0.1072031068467584, 'tp_mult': 1.227095054403485, 'tsl_mult': 0.5955401551901901, 'strategy': 'breakout', 'time_stop': 12, 'use_sma': False, 'use_atr': False, 'use_adx': False, 'use_ema': False, 'use_spike': False, 'rsi_required': False, 'edge_k': 0.5049339450606434, 'edge_cap': 0.8573783616211152}.
[I 2025-08-29 23:40:05,566] Trial 1110 finished with values: [-1000000000.0, 1000000000.0] and parameters: {'p_sma': 16, 'p_std': 53, 'p_atr': 25, 'p_adx': 28, 'rsi_period': 21, 'ema1': 5, 'ema2': 25, 'slip_atr_k': 0.0139969071425034, 'slip_spread_k': 0.42964812575748623, 'spread_hl_frac': 0.021888333919307525, 'bb_std_mult': 2.2168300071486953, 'rsi_os': 29, 'rsi_ob': 59, 'vol_spike': 0.19887283767916494, 'adx_thresh': 16.84866326686946, 'atr_min_pct': 0.013043520486807476, 'atr_max_pct': 0.0889658658447823, 'tp_mult': 2.058868110577875, 'tsl_mult': 0.5893039542513512, 'strategy': 'breakout', 'time_stop': 91, 'use_sma': False, 'use_atr': False, 'use_adx': False, 'use_ema': False, 'use_spike': False, 'rsi_required': False, 'edge_k': 0.6034201644252262, 'edge_cap': 0.7712745757303308}.
[I 2025-08-29 23:40:05,820] Trial 1109 finished with values: [-1000000000.0, 1000000000.0] and parameters: {'p_sma': 36, 'p_std': 28, 'p_atr': 25, 'p_adx': 17, 'rsi_period': 21, 'ema1': 24, 'ema2': 20, 'slip_atr_k': 0.09185978723380459, 'slip_spread_k': 0.9258993522930696, 'spread_hl_frac': 0.021668049147510592, 'bb_std_mult': 2.2164595366373367, 'rsi_os': 28, 'rsi_ob': 58, 'vol_spike': 0.1997373627969637, 'adx_thresh': 16.748359460561836, 'atr_min_pct': 0.007188707706213803, 'atr_max_pct': 0.010332558806872658, 'tp_mult': 1.164717587275611, 'tsl_mult': 0.46315480198766273, 'strategy': 'breakout', 'time_stop': 100, 'use_sma': False, 'use_atr': False, 'use_adx': False, 'use_ema': False, 'use_spike': False, 'rsi_required': False, 'edge_k': 0.503359396043824, 'edge_cap': 0.7867158571249767}.
[I 2025-08-29 23:40:06,124] Trial 1112 finished with values: [-0.006586049079715162, 0.006538566124503465] and parameters: {'p_sma': 7, 'p_std': 26, 'p_atr': 25, 'p_adx': 29, 'rsi_period': 80, 'ema1': 24, 'ema2': 20, 'slip_atr_k': 0.014739084296301195, 'slip_spread_k': 0.8301437700057894, 'spread_hl_frac': 0.012513362249454714, 'bb_std_mult': 2.1402801442528623, 'rsi_os': 53, 'rsi_ob': 58, 'vol_spike': 0.19771298564366144, 'adx_thresh': 20.65054236225209, 'atr_min_pct': 0.002931445707725324, 'atr_max_pct': 0.14249056359723147, 'tp_mult': 1.1604305445478977, 'tsl_mult': 0.6639737342258627, 'strategy': 'breakout', 'time_stop': 112, 'use_sma': False, 'use_atr': False, 'use_adx': False, 'use_ema': False, 'use_spike': False, 'rsi_required': False, 'edge_k': 1.0681598798218632, 'edge_cap': 0.7693870878127764}.
[I 2025-08-29 23:40:06,473] Trial 1111 finished with values: [-1000000000.0, 1000000000.0] and parameters: {'p_sma': 53, 'p_std': 56, 'p_atr': 8, 'p_adx': 15, 'rsi_period': 80, 'ema1': 10, 'ema2': 52, 'slip_atr_k': 0.012346010422458089, 'slip_spread_k': 0.827966408899107, 'spread_hl_frac': 0.017410886651627745, 'bb_std_mult': 2.1580916331720035, 'rsi_os': 49, 'rsi_ob': 49, 'vol_spike': 0.09873155524625411, 'adx_thresh': 26.66361865673179, 'atr_min_pct': 0.013039024619760472, 'atr_max_pct': 0.08877650101484688, 'tp_mult': 1.1572885770591264, 'tsl_mult': 0.24044320844590727, 'strategy': 'breakout', 'time_stop': 140, 'use_sma': False, 'use_atr': False, 'use_adx': False, 'use_ema': False, 'use_spike': False, 'rsi_required': False, 'edge_k': 1.068700691668977, 'edge_cap': 0.771277648429703}.
[I 2025-08-29 23:40:34,095] Trial 1113 finished with values: [-0.003026700536059246, 0.003747220185663141] and parameters: {'p_sma': 7, 'p_std': 9, 'p_atr': 8, 'p_adx': 15, 'rsi_period': 23, 'ema1': 24, 'ema2': 53, 'slip_atr_k': 0.013162063202151022, 'slip_spread_k': 0.13766151057014991, 'spread_hl_frac': 0.017461948934114097, 'bb_std_mult': 2.1552001255680806, 'rsi_os': 21, 'rsi_ob': 90, 'vol_spike': 0.18763711552993825, 'adx_thresh': 20.292685359326747, 'atr_min_pct': 0.0026943686807571936, 'atr_max_pct': 0.1239188999743, 'tp_mult': 1.1765578387682276, 'tsl_mult': 0.9104618551974553, 'strategy': 'breakout', 'time_stop': 111, 'use_sma': False, 'use_atr': False, 'use_adx': False, 'use_ema': False, 'use_spike': False, 'rsi_required': False, 'edge_k': 0.22892625081827256, 'edge_cap': 0.7900775629905147}.
[I 2025-08-29 23:40:34,269] Trial 1115 finished with values: [-0.01279350959809944, 0.01276418000502536] and parameters: {'p_sma': 53, 'p_std': 5, 'p_atr': 11, 'p_adx': 15, 'rsi_period': 24, 'ema1': 17, 'ema2': 53, 'slip_atr_k': 0.004230969047941256, 'slip_spread_k': 0.8707057048305821, 'spread_hl_frac': 0.02792848231971379, 'bb_std_mult': 3.267526678713221, 'rsi_os': 21, 'rsi_ob': 86, 'vol_spike': 0.1872618535082282, 'adx_thresh': 24.065774638534215, 'atr_min_pct': 0.0021841653085272854, 'atr_max_pct': 0.12416531360882876, 'tp_mult': 2.5910328473424062, 'tsl_mult': 0.7336787378791875, 'strategy': 'breakout', 'time_stop': 147, 'use_sma': False, 'use_atr': False, 'use_adx': False, 'use_ema': False, 'use_spike': False, 'rsi_required': False, 'edge_k': 1.2351333346089095, 'edge_cap': 0.996544546717794}.
[I 2025-08-29 23:40:34,771] Trial 1114 finished with values: [-1000000000.0, 1000000000.0] and parameters: {'p_sma': 7, 'p_std': 26, 'p_atr': 23, 'p_adx': 15, 'rsi_period': 24, 'ema1': 15, 'ema2': 53, 'slip_atr_k': 0.013191930917468406, 'slip_spread_k': 0.7299465863823515, 'spread_hl_frac': 0.01749181308552939, 'bb_std_mult': 2.8713125606146046, 'rsi_os': 31, 'rsi_ob': 62, 'vol_spike': 0.1860997373803463, 'adx_thresh': 26.67964266781231, 'atr_min_pct': 0.0028617237700584164, 'atr_max_pct': 0.06980454301712874, 'tp_mult': 1.1823010322958976, 'tsl_mult': 0.6654264806743198, 'strategy': 'breakout', 'time_stop': 138, 'use_sma': False, 'use_atr': False, 'use_adx': False, 'use_ema': False, 'use_spike': False, 'rsi_required': False, 'edge_k': 0.5579646233105119, 'edge_cap': 0.5886470537403301}.
[I 2025-08-29 23:40:34,856] Trial 1116 finished with values: [-0.050485186465903054, 0.050465186408164595] and parameters: {'p_sma': 9, 'p_std': 7, 'p_atr': 23, 'p_adx': 16, 'rsi_period': 27, 'ema1': 24, 'ema2': 17, 'slip_atr_k': 0.019910330807478352, 'slip_spread_k': 0.46763743593229146, 'spread_hl_frac': 0.016050080774872737, 'bb_std_mult': 2.061006499705921, 'rsi_os': 51, 'rsi_ob': 62, 'vol_spike': 0.18770238359621688, 'adx_thresh': 11.222552809842668, 'atr_min_pct': 0.002078429220042995, 'atr_max_pct': 0.03749692469484115, 'tp_mult': 1.8943869018946848, 'tsl_mult': 0.7371732010807449, 'strategy': 'breakout', 'time_stop': 149, 'use_sma': False, 'use_atr': False, 'use_adx': False, 'use_ema': False, 'use_spike': False, 'rsi_required': False, 'edge_k': 0.5636362661409214, 'edge_cap': 0.6608027792698603}.
[I 2025-08-29 23:40:35,154] Trial 1118 finished with values: [-1000000000.0, 1000000000.0] and parameters: {'p_sma': 23, 'p_std': 26, 'p_atr': 23, 'p_adx': 18, 'rsi_period': 68, 'ema1': 25, 'ema2': 51, 'slip_atr_k': 0.2244688084389425, 'slip_spread_k': 0.791371045538808, 'spread_hl_frac': 0.016279552886659103, 'bb_std_mult': 2.0810235215675776, 'rsi_os': 35, 'rsi_ob': 62, 'vol_spike': 0.22364650267441827, 'adx_thresh': 11.27002818162124, 'atr_min_pct': 0.02435266503577324, 'atr_max_pct': 0.016957717541110667, 'tp_mult': 1.3023953109072153, 'tsl_mult': 0.7727096149110871, 'strategy': 'mean_reversion', 'time_stop': 20, 'use_sma': False, 'use_atr': False, 'use_adx': False, 'use_ema': False, 'use_spike': False, 'rsi_required': False, 'edge_k': 0.31830813483620835, 'edge_cap': 0.5844522160237993}.
[I 2025-08-29 23:41:02,765] Trial 1117 finished with values: [-0.0041847880649665825, 0.004160737306058327] and parameters: {'p_sma': 9, 'p_std': 7, 'p_atr': 18, 'p_adx': 24, 'rsi_period': 65, 'ema1': 15, 'ema2': 43, 'slip_atr_k': 0.019615755213213237, 'slip_spread_k': 0.8705721485092656, 'spread_hl_frac': 0.015850497551098484, 'bb_std_mult': 2.079245750929373, 'rsi_os': 25, 'rsi_ob': 71, 'vol_spike': 0.1873051330376787, 'adx_thresh': 23.683568286596245, 'atr_min_pct': 0.0022736117080939633, 'atr_max_pct': 0.0959366709900067, 'tp_mult': 1.298696869707324, 'tsl_mult': 0.7373842758278488, 'strategy': 'breakout', 'time_stop': 148, 'use_sma': False, 'use_atr': False, 'use_adx': False, 'use_ema': False, 'use_spike': False, 'rsi_required': False, 'edge_k': 0.5745826115929353, 'edge_cap': 0.13461900596153642}.
[I 2025-08-29 23:41:02,947] Trial 1120 finished with values: [-1000000000.0, 1000000000.0] and parameters: {'p_sma': 27, 'p_std': 50, 'p_atr': 22, 'p_adx': 18, 'rsi_period': 68, 'ema1': 23, 'ema2': 54, 'slip_atr_k': 0.14391854021982062, 'slip_spread_k': 0.7894598561619762, 'spread_hl_frac': 0.020087698881386732, 'bb_std_mult': 3.441203031595286, 'rsi_os': 25, 'rsi_ob': 54, 'vol_spike': 0.17320391376757394, 'adx_thresh': 24.76765032907533, 'atr_min_pct': 0.003713378212580984, 'atr_max_pct': 0.09600024349105021, 'tp_mult': 1.1016713220815344, 'tsl_mult': 0.2801128465842203, 'strategy': 'mean_reversion', 'time_stop': 165, 'use_sma': False, 'use_atr': False, 'use_adx': False, 'use_ema': False, 'use_spike': False, 'rsi_required': False, 'edge_k': 0.39328845150258, 'edge_cap': 0.7062058110199777}.
[I 2025-08-29 23:41:03,077] Trial 1119 finished with values: [-0.005208671909297302, 0.005201815013348105] and parameters: {'p_sma': 29, 'p_std': 50, 'p_atr': 24, 'p_adx': 16, 'rsi_period': 26, 'ema1': 23, 'ema2': 51, 'slip_atr_k': 0.021431968338962996, 'slip_spread_k': 0.46268581681475723, 'spread_hl_frac': 0.019823001021206713, 'bb_std_mult': 2.084884514871229, 'rsi_os': 12, 'rsi_ob': 54, 'vol_spike': 0.07961785175666901, 'adx_thresh': 25.79446859234302, 'atr_min_pct': 0.0037385979546338825, 'atr_max_pct': 0.09535168228733994, 'tp_mult': 1.111923674257689, 'tsl_mult': 0.11096252559174458, 'strategy': 'mean_reversion', 'time_stop': 211, 'use_sma': False, 'use_atr': False, 'use_adx': False, 'use_ema': False, 'use_spike': False, 'rsi_required': False, 'edge_k': 0.4627447656791515, 'edge_cap': 0.147605432017768}.
[I 2025-08-29 23:41:03,514] Trial 1121 finished with values: [-1000000000.0, 1000000000.0] and parameters: {'p_sma': 6, 'p_std': 22, 'p_atr': 22, 'p_adx': 23, 'rsi_period': 35, 'ema1': 23, 'ema2': 54, 'slip_atr_k': 0.022977427502363618, 'slip_spread_k': 0.16528397435688497, 'spread_hl_frac': 0.03551981959440279, 'bb_std_mult': 0.5656512804604459, 'rsi_os': 25, 'rsi_ob': 59, 'vol_spike': 0.1748416174072591, 'adx_thresh': 34.95741474050756, 'atr_min_pct': 0.0037762965438140356, 'atr_max_pct': 0.09598059650135905, 'tp_mult': 2.142217818036867, 'tsl_mult': 0.11027335598143823, 'strategy': 'breakout', 'time_stop': 125, 'use_sma': False, 'use_atr': False, 'use_adx': False, 'use_ema': False, 'use_spike': False, 'rsi_required': False, 'edge_k': 0.44996570357617616, 'edge_cap': 0.7436616020335086}.
[I 2025-08-29 23:41:30,657] Trial 1124 finished with values: [-1000000000.0, 1000000000.0] and parameters: {'p_sma': 6, 'p_std': 19, 'p_atr': 28, 'p_adx': 23, 'rsi_period': 71, 'ema1': 24, 'ema2': 54, 'slip_atr_k': 0.04843785830076752, 'slip_spread_k': 0.8489579052155699, 'spread_hl_frac': 0.02935086038911807, 'bb_std_mult': 1.9645820965000171, 'rsi_os': 16, 'rsi_ob': 60, 'vol_spike': 0.15294593751328692, 'adx_thresh': 14.027625726311433, 'atr_min_pct': 0.004469095981588101, 'atr_max_pct': 0.098827985888203, 'tp_mult': 2.2816940859803108, 'tsl_mult': 0.7118197097938215, 'strategy': 'breakout', 'time_stop': 116, 'use_sma': False, 'use_atr': False, 'use_adx': False, 'use_ema': False, 'use_spike': False, 'rsi_required': False, 'edge_k': 0.5157602843155489, 'edge_cap': 0.8823303785870021}.
[I 2025-08-29 23:41:30,983] Trial 1123 finished with values: [-1000000000.0, 1000000000.0] and parameters: {'p_sma': 15, 'p_std': 24, 'p_atr': 26, 'p_adx': 23, 'rsi_period': 71, 'ema1': 22, 'ema2': 56, 'slip_atr_k': 0.02519834868335838, 'slip_spread_k': 0.8456505357703206, 'spread_hl_frac': 0.025664101120980064, 'bb_std_mult': 0.5767153061090509, 'rsi_os': 26, 'rsi_ob': 73, 'vol_spike': 0.07923417631724648, 'adx_thresh': 13.554359997911861, 'atr_min_pct': 0.003236407953458948, 'atr_max_pct': 0.0941342537042784, 'tp_mult': 1.490701680796001, 'tsl_mult': 0.706861016829551, 'strategy': 'breakout', 'time_stop': 280, 'use_sma': False, 'use_atr': False, 'use_adx': False, 'use_ema': False, 'use_spike': False, 'rsi_required': False, 'edge_k': 0.45826452361255293, 'edge_cap': 0.7453950792024827}.
[I 2025-08-29 23:41:31,296] Trial 1125 finished with values: [-1000000000.0, 1000000000.0] and parameters: {'p_sma': 57, 'p_std': 24, 'p_atr': 24, 'p_adx': 14, 'rsi_period': 59, 'ema1': 30, 'ema2': 36, 'slip_atr_k': 0.02628310598711312, 'slip_spread_k': 0.9646326389061426, 'spread_hl_frac': 0.018199757427960848, 'bb_std_mult': 1.8876257083518093, 'rsi_os': 26, 'rsi_ob': 51, 'vol_spike': 0.17986746696391281, 'adx_thresh': 24.90648622033112, 'atr_min_pct': 0.02051326292147794, 'atr_max_pct': 0.05107600295365042, 'tp_mult': 1.04796143984379, 'tsl_mult': 0.7085455050345907, 'strategy': 'breakout', 'time_stop': 118, 'use_sma': False, 'use_atr': False, 'use_adx': False, 'use_ema': False, 'use_spike': False, 'rsi_required': False, 'edge_k': 0.5195613194010841, 'edge_cap': 0.8927120518604008}.
[I 2025-08-29 23:41:31,389] Trial 1122 finished with values: [-1000000000.0, 1000000000.0] and parameters: {'p_sma': 6, 'p_std': 50, 'p_atr': 24, 'p_adx': 12, 'rsi_period': 17, 'ema1': 23, 'ema2': 54, 'slip_atr_k': 0.024798308457032597, 'slip_spread_k': 0.369421259112958, 'spread_hl_frac': 0.01973713897890894, 'bb_std_mult': 1.8901259471375411, 'rsi_os': 26, 'rsi_ob': 73, 'vol_spike': 0.17321225908215, 'adx_thresh': 24.864887040761978, 'atr_min_pct': 0.0037209097466991484, 'atr_max_pct': 0.0955548030037654, 'tp_mult': 1.1140791912225592, 'tsl_mult': 0.27480427920349987, 'strategy': 'mean_reversion', 'time_stop': 165, 'use_sma': False, 'use_atr': False, 'use_adx': False, 'use_ema': False, 'use_spike': False, 'rsi_required': False, 'edge_k': 0.4639528419845534, 'edge_cap': 0.7417950738286887}.
[I 2025-08-29 23:41:58,957] Trial 1129 finished with values: [-1000000000.0, 1000000000.0] and parameters: {'p_sma': 9, 'p_std': 27, 'p_atr': 12, 'p_adx': 16, 'rsi_period': 21, 'ema1': 25, 'ema2': 32, 'slip_atr_k': 0.040048025344259684, 'slip_spread_k': 0.9083692791874547, 'spread_hl_frac': 0.018775760772532422, 'bb_std_mult': 0.9730204355250216, 'rsi_os': 13, 'rsi_ob': 65, 'vol_spike': 0.010628923963594189, 'adx_thresh': 28.588233562402987, 'atr_min_pct': 0.016140614722417828, 'atr_max_pct': 0.09034856497754443, 'tp_mult': 2.8999057068413956, 'tsl_mult': 0.7522979417943733, 'strategy': 'breakout', 'time_stop': 84, 'use_sma': False, 'use_atr': False, 'use_adx': False, 'use_ema': False, 'use_spike': False, 'rsi_required': False, 'edge_k': 0.6066091242875072, 'edge_cap': 0.9647186860366149}.
[I 2025-08-29 23:41:59,231] Trial 1127 finished with values: [-1000000000.0, 1000000000.0] and parameters: {'p_sma': 41, 'p_std': 33, 'p_atr': 19, 'p_adx': 14, 'rsi_period': 17, 'ema1': 9, 'ema2': 55, 'slip_atr_k': 0.04112565098631053, 'slip_spread_k': 0.9614137804595457, 'spread_hl_frac': 0.018667858090263854, 'bb_std_mult': 1.8774252121191657, 'rsi_os': 43, 'rsi_ob': 64, 'vol_spike': 0.17760715252494896, 'adx_thresh': 12.760585443325017, 'atr_min_pct': 0.013788735124427522, 'atr_max_pct': 0.05673243395653282, 'tp_mult': 1.1274956231576918, 'tsl_mult': 0.32581142481601166, 'strategy': 'breakout', 'time_stop': 108, 'use_sma': False, 'use_atr': False, 'use_adx': False, 'use_ema': False, 'use_spike': False, 'rsi_required': False, 'edge_k': 1.4509868466144564, 'edge_cap': 0.8462335810803688}.
[I 2025-08-29 23:41:59,318] Trial 1126 finished with values: [-1000000000.0, 1000000000.0] and parameters: {'p_sma': 8, 'p_std': 24, 'p_atr': 12, 'p_adx': 14, 'rsi_period': 17, 'ema1': 25, 'ema2': 56, 'slip_atr_k': 0.026798221825936955, 'slip_spread_k': 0.554127591106756, 'spread_hl_frac': 0.018692592861134755, 'bb_std_mult': 1.8718676568348762, 'rsi_os': 13, 'rsi_ob': 73, 'vol_spike': 0.17545933094821176, 'adx_thresh': 24.9573174073858, 'atr_min_pct': 0.025292692763930355, 'atr_max_pct': 0.0926111172432559, 'tp_mult': 1.1254605327299463, 'tsl_mult': 0.71201035453849, 'strategy': 'breakout', 'time_stop': 84, 'use_sma': False, 'use_atr': False, 'use_adx': False, 'use_ema': False, 'use_spike': False, 'rsi_required': False, 'edge_k': 0.6147843147609722, 'edge_cap': 0.404774347373663}.
[I 2025-08-29 23:41:59,402] Trial 1128 finished with values: [-0.0026590721122420335, 0.0031823375443110285] and parameters: {'p_sma': 8, 'p_std': 40, 'p_atr': 23, 'p_adx': 16, 'rsi_period': 48, 'ema1': 25, 'ema2': 48, 'slip_atr_k': 0.005909289439162104, 'slip_spread_k': 0.02415696541475143, 'spread_hl_frac': 0.018660366461361093, 'bb_std_mult': 1.1125993066009405, 'rsi_os': 23, 'rsi_ob': 59, 'vol_spike': 0.17933462464319205, 'adx_thresh': 12.859577758715194, 'atr_min_pct': 0.0007321914291517065, 'atr_max_pct': 0.06012697863476367, 'tp_mult': 1.1135683828012313, 'tsl_mult': 0.40809367996921386, 'strategy': 'breakout', 'time_stop': 109, 'use_sma': False, 'use_atr': False, 'use_adx': False, 'use_ema': False, 'use_spike': False, 'rsi_required': False, 'edge_k': 0.9028060574318544, 'edge_cap': 0.795133521471375}.
[I 2025-08-29 23:42:26,202] Trial 1131 finished with values: [-0.018391925457644343, 0.018388289091797277] and parameters: {'p_sma': 20, 'p_std': 37, 'p_atr': 23, 'p_adx': 16, 'rsi_period': 19, 'ema1': 7, 'ema2': 56, 'slip_atr_k': 0.0043356747670486705, 'slip_spread_k': 0.7483181622747, 'spread_hl_frac': 0.014593132005824266, 'bb_std_mult': 2.324864778859948, 'rsi_os': 23, 'rsi_ob': 59, 'vol_spike': 0.1678075600803875, 'adx_thresh': 25.76190749083406, 'atr_min_pct': 0.0007767100418369025, 'atr_max_pct': 0.07924056629926171, 'tp_mult': 1.0423896256107086, 'tsl_mult': 0.4069177092120233, 'strategy': 'breakout', 'time_stop': 241, 'use_sma': False, 'use_atr': False, 'use_adx': False, 'use_ema': False, 'use_spike': False, 'rsi_required': False, 'edge_k': 0.5437905370343297, 'edge_cap': 0.8036140048869822}.
[I 2025-08-29 23:42:26,338] Trial 1133 finished with values: [-1000000000.0, 1000000000.0] and parameters: {'p_sma': 51, 'p_std': 40, 'p_atr': 23, 'p_adx': 16, 'rsi_period': 20, 'ema1': 11, 'ema2': 27, 'slip_atr_k': 0.005738142495308865, 'slip_spread_k': 0.7418691565856665, 'spread_hl_frac': 0.01683027746231807, 'bb_std_mult': 2.6569036788553095, 'rsi_os': 47, 'rsi_ob': 59, 'vol_spike': 0.23197024195823962, 'adx_thresh': 26.543436911724285, 'atr_min_pct': 0.022114303834190455, 'atr_max_pct': 0.10354191584555235, 'tp_mult': 1.4184231817454163, 'tsl_mult': 0.210202470885326, 'strategy': 'breakout', 'time_stop': 94, 'use_sma': False, 'use_atr': False, 'use_adx': False, 'use_ema': False, 'use_spike': False, 'rsi_required': False, 'edge_k': 1.6247712139880583, 'edge_cap': 0.7974909908453746}.
[I 2025-08-29 23:42:26,896] Trial 1130 finished with values: [-0.005689034907158885, 0.005667886564428328] and parameters: {'p_sma': 19, 'p_std': 33, 'p_atr': 23, 'p_adx': 21, 'rsi_period': 19, 'ema1': 7, 'ema2': 23, 'slip_atr_k': 0.005356968023483283, 'slip_spread_k': 0.8270885884596756, 'spread_hl_frac': 0.01838094125238367, 'bb_std_mult': 0.8749257507553276, 'rsi_os': 5, 'rsi_ob': 64, 'vol_spike': 0.16975614243943618, 'adx_thresh': 7.291545783246603, 'atr_min_pct': 0.0018170949927524918, 'atr_max_pct': 0.14714416107749978, 'tp_mult': 1.0956705695494409, 'tsl_mult': 0.5471275429712803, 'strategy': 'breakout', 'time_stop': 108, 'use_sma': False, 'use_atr': False, 'use_adx': False, 'use_ema': False, 'use_spike': False, 'rsi_required': False, 'edge_k': 0.8552402839931346, 'edge_cap': 0.46197224002632153}.
[I 2025-08-29 23:42:26,905] Trial 1132 finished with values: [-0.05066742567220772, 0.05066055582190586] and parameters: {'p_sma': 12, 'p_std': 40, 'p_atr': 23, 'p_adx': 26, 'rsi_period': 48, 'ema1': 24, 'ema2': 23, 'slip_atr_k': 0.004385963224613376, 'slip_spread_k': 0.8240836822972869, 'spread_hl_frac': 0.01671202139672049, 'bb_std_mult': 0.5008244575314262, 'rsi_os': 46, 'rsi_ob': 59, 'vol_spike': 0.24433270614873406, 'adx_thresh': 15.890694600725315, 'atr_min_pct': 0.0006360174599736622, 'atr_max_pct': 0.10379281978436267, 'tp_mult': 1.0784885053632145, 'tsl_mult': 0.6856130998368442, 'strategy': 'breakout', 'time_stop': 97, 'use_sma': False, 'use_atr': False, 'use_adx': False, 'use_ema': False, 'use_spike': False, 'rsi_required': False, 'edge_k': 0.8474089944678731, 'edge_cap': 0.7889864053961212}.
