[I 2025-08-30 00:08:44,158] Trial 1379 finished with values: [-1000000000.0, 1000000000.0] and parameters: {'p_sma': 6, 'p_std': 20, 'p_atr': 23, 'p_adx': 24, 'rsi_period': 18, 'ema1': 23, 'ema2': 41, 'slip_atr_k': 0.014525607196199275, 'slip_spread_k': 0.654020194859315, 'spread_hl_frac': 0.003033520160725809, 'bb_std_mult': 2.102607050494478, 'rsi_os': 50, 'rsi_ob': 58, 'vol_spike': 0.17880504509716857, 'adx_thresh': 10.828604874664153, 'atr_min_pct': 0.0031889718394543243, 'atr_max_pct': 0.041827090348546606, 'tp_mult': 2.383967981008285, 'tsl_mult': 0.019802783982256766, 'strategy': 'mean_reversion', 'time_stop': 101, 'use_sma': False, 'use_atr': False, 'use_adx': False, 'use_ema': False, 'use_spike': False, 'rsi_required': False, 'edge_k': 0.506257336682303, 'edge_cap': 0.791998889205466}.
[I 2025-08-30 00:09:09,691] Trial 1377 finished with values: [-1000000000.0, 1000000000.0] and parameters: {'p_sma': 15, 'p_std': 52, 'p_atr': 18, 'p_adx': 16, 'rsi_period': 18, 'ema1': 24, 'ema2': 40, 'slip_atr_k': 0.015134184753547136, 'slip_spread_k': 0.06978646142754968, 'spread_hl_frac': 0.042541380053055994, 'bb_std_mult': 1.9738180197606752, 'rsi_os': 24, 'rsi_ob': 61, 'vol_spike': 0.17919731721534146, 'adx_thresh': 17.50766934297471, 'atr_min_pct': 0.02376691783761365, 'atr_max_pct': 0.0865160332524603, 'tp_mult': 2.4329635159460365, 'tsl_mult': 0.6890069879168468, 'strategy': 'mean_reversion', 'time_stop': 118, 'use_sma': False, 'use_atr': False, 'use_adx': False, 'use_ema': False, 'use_spike': False, 'rsi_required': False, 'edge_k': 0.3964561081522808, 'edge_cap': 0.7912742748586787}.
[I 2025-08-30 00:09:09,703] Trial 1378 finished with values: [-1000000000.0, 1000000000.0] and parameters: {'p_sma': 51, 'p_std': 53, 'p_atr': 23, 'p_adx': 16, 'rsi_period': 16, 'ema1': 12, 'ema2': 57, 'slip_atr_k': 0.01666901226873524, 'slip_spread_k': 0.6544783306874007, 'spread_hl_frac': 0.03335166601175649, 'bb_std_mult': 1.9801763940100159, 'rsi_os': 24, 'rsi_ob': 93, 'vol_spike': 0.17909747521426414, 'adx_thresh': 11.461412492384863, 'atr_min_pct': 0.003205289522875127, 'atr_max_pct': 0.08698465207312962, 'tp_mult': 1.2101990438270571, 'tsl_mult': 0.6986990610243049, 'strategy': 'mean_reversion', 'time_stop': 167, 'use_sma': False, 'use_atr': False, 'use_adx': False, 'use_ema': False, 'use_spike': False, 'rsi_required': False, 'edge_k': 0.5146788413041995, 'edge_cap': 0.36667888306629737}.
[I 2025-08-30 00:09:10,048] Trial 1380 finished with values: [-0.01602018174805142, 0.015947857181459232] and parameters: {'p_sma': 51, 'p_std': 20, 'p_atr': 23, 'p_adx': 22, 'rsi_period': 16, 'ema1': 23, 'ema2': 55, 'slip_atr_k': 0.014112080012342735, 'slip_spread_k': 0.8073839175717193, 'spread_hl_frac': 0.018893656024816238, 'bb_std_mult': 2.093907715097095, 'rsi_os': 48, 'rsi_ob': 59, 'vol_spike': 0.16916529189553559, 'adx_thresh': 11.441456614732857, 'atr_min_pct': 0.003275530468483599, 'atr_max_pct': 0.05367704450984752, 'tp_mult': 1.2034689223358228, 'tsl_mult': 0.5245262366859171, 'strategy': 'mean_reversion', 'time_stop': 100, 'use_sma': False, 'use_atr': False, 'use_adx': False, 'use_ema': False, 'use_spike': False, 'rsi_required': False, 'edge_k': 0.509580730698663, 'edge_cap': 0.8698145956512224}.
[I 2025-08-30 00:09:10,374] Trial 1381 finished with values: [-1000000000.0, 1000000000.0] and parameters: {'p_sma': 51, 'p_std': 41, 'p_atr': 23, 'p_adx': 16, 'rsi_period': 16, 'ema1': 26, 'ema2': 55, 'slip_atr_k': 0.09155675467711927, 'slip_spread_k': 0.7624913250072485, 'spread_hl_frac': 0.010613758435749472, 'bb_std_mult': 2.6793089220660757, 'rsi_os': 21, 'rsi_ob': 93, 'vol_spike': 0.1706619108679265, 'adx_thresh': 11.424667572663736, 'atr_min_pct': 0.02102822455933569, 'atr_max_pct': 0.09461213960626033, 'tp_mult': 1.202752859628146, 'tsl_mult': 0.1590019938270824, 'strategy': 'mean_reversion', 'time_stop': 117, 'use_sma': False, 'use_atr': False, 'use_adx': False, 'use_ema': False, 'use_spike': False, 'rsi_required': False, 'edge_k': 1.6482884803255753, 'edge_cap': 0.8668051724419217}.
[I 2025-08-30 00:09:36,287] Trial 1385 finished with values: [-1000000000.0, 1000000000.0] and parameters: {'p_sma': 8, 'p_std': 8, 'p_atr': 22, 'p_adx': 17, 'rsi_period': 64, 'ema1': 25, 'ema2': 53, 'slip_atr_k': 0.028429923930544006, 'slip_spread_k': 0.6882405627944846, 'spread_hl_frac': 0.015092171337055076, 'bb_std_mult': 3.483487469118245, 'rsi_os': 27, 'rsi_ob': 69, 'vol_spike': 0.18960212508491703, 'adx_thresh': 25.311401334521108, 'atr_min_pct': 0.029988718744182997, 'atr_max_pct': 0.11206084360540208, 'tp_mult': 1.4459127991680436, 'tsl_mult': 0.45772843352810766, 'strategy': 'breakout', 'time_stop': 108, 'use_sma': False, 'use_atr': False, 'use_adx': False, 'use_ema': False, 'use_spike': False, 'rsi_required': False, 'edge_k': 1.0643426569445698, 'edge_cap': 0.7581746248670179}.
[I 2025-08-30 00:09:36,515] Trial 1383 finished with values: [-0.0031372775793772067, 0.0032628904699916633] and parameters: {'p_sma': 27, 'p_std': 25, 'p_atr': 22, 'p_adx': 22, 'rsi_period': 70, 'ema1': 22, 'ema2': 55, 'slip_atr_k': 0.027429432909906598, 'slip_spread_k': 0.8053294194748016, 'spread_hl_frac': 0.010562835358117577, 'bb_std_mult': 1.0747284181177457, 'rsi_os': 27, 'rsi_ob': 59, 'vol_spike': 0.17111945738919485, 'adx_thresh': 24.368397287804726, 'atr_min_pct': 0.0023753569237385933, 'atr_max_pct': 0.09470608286507573, 'tp_mult': 1.1294761777602478, 'tsl_mult': 0.6534006941348635, 'strategy': 'breakout', 'time_stop': 108, 'use_sma': False, 'use_atr': False, 'use_adx': False, 'use_ema': False, 'use_spike': False, 'rsi_required': False, 'edge_k': 0.44731292754102725, 'edge_cap': 0.8632144029525569}.
[I 2025-08-30 00:09:36,862] Trial 1382 finished with values: [-1000000000.0, 1000000000.0] and parameters: {'p_sma': 5, 'p_std': 33, 'p_atr': 22, 'p_adx': 22, 'rsi_period': 16, 'ema1': 7, 'ema2': 55, 'slip_atr_k': 0.026845917801876083, 'slip_spread_k': 0.8054721951538182, 'spread_hl_frac': 0.018504396096377072, 'bb_std_mult': 2.726226158166705, 'rsi_os': 27, 'rsi_ob': 85, 'vol_spike': 0.17006004238127695, 'adx_thresh': 24.406259226209954, 'atr_min_pct': 0.002429400843020377, 'atr_max_pct': 0.0945446276049372, 'tp_mult': 1.142343145890393, 'tsl_mult': 0.5323171908796981, 'strategy': 'breakout', 'time_stop': 108, 'use_sma': False, 'use_atr': False, 'use_adx': False, 'use_ema': False, 'use_spike': False, 'rsi_required': False, 'edge_k': 1.644451710168428, 'edge_cap': 0.8652317082901954}.
[I 2025-08-30 00:09:36,966] Trial 1384 finished with values: [-0.021646737066122634, 0.02164205358005536] and parameters: {'p_sma': 29, 'p_std': 8, 'p_atr': 22, 'p_adx': 27, 'rsi_period': 14, 'ema1': 25, 'ema2': 53, 'slip_atr_k': 0.09426725607887723, 'slip_spread_k': 0.7668532439186655, 'spread_hl_frac': 0.01595518271597781, 'bb_std_mult': 1.889711200511982, 'rsi_os': 27, 'rsi_ob': 63, 'vol_spike': 0.23817402652102987, 'adx_thresh': 25.115565789956523, 'atr_min_pct': 0.0023941685127642767, 'atr_max_pct': 0.09339299389161335, 'tp_mult': 1.1344597149444244, 'tsl_mult': 0.15890247723369694, 'strategy': 'breakout', 'time_stop': 109, 'use_sma': False, 'use_atr': False, 'use_adx': False, 'use_ema': False, 'use_spike': False, 'rsi_required': False, 'edge_k': 0.4499784979187276, 'edge_cap': 0.6223566718776823}.
[I 2025-08-30 00:10:03,244] Trial 1387 finished with values: [-0.00742013569853206, 0.007391567365427202] and parameters: {'p_sma': 18, 'p_std': 34, 'p_atr': 23, 'p_adx': 21, 'rsi_period': 29, 'ema1': 24, 'ema2': 54, 'slip_atr_k': 0.005740600074743557, 'slip_spread_k': 0.8624843772264317, 'spread_hl_frac': 0.04021212170621041, 'bb_std_mult': 1.8713345464471693, 'rsi_os': 25, 'rsi_ob': 62, 'vol_spike': 0.23595989254781569, 'adx_thresh': 27.948880695572434, 'atr_min_pct': 0.0010278331548703341, 'atr_max_pct': 0.09123787467313639, 'tp_mult': 1.8807450841897209, 'tsl_mult': 0.7102563660165777, 'strategy': 'breakout', 'time_stop': 143, 'use_sma': False, 'use_atr': False, 'use_adx': False, 'use_ema': False, 'use_spike': False, 'rsi_required': False, 'edge_k': 0.5855056848493826, 'edge_cap': 0.8118823429924749}.
[I 2025-08-30 00:10:03,253] Trial 1386 finished with values: [-1000000000.0, 1000000000.0] and parameters: {'p_sma': 47, 'p_std': 25, 'p_atr': 9, 'p_adx': 26, 'rsi_period': 19, 'ema1': 24, 'ema2': 54, 'slip_atr_k': 0.007102563839321592, 'slip_spread_k': 0.8560931700981955, 'spread_hl_frac': 0.03912803033050723, 'bb_std_mult': 1.8907416741708531, 'rsi_os': 45, 'rsi_ob': 60, 'vol_spike': 0.18991377802755124, 'adx_thresh': 8.768097217506735, 'atr_min_pct': 0.016514742356160794, 'atr_max_pct': 0.0709624150362997, 'tp_mult': 1.1447049093046686, 'tsl_mult': 0.663889018372311, 'strategy': 'breakout', 'time_stop': 144, 'use_sma': False, 'use_atr': False, 'use_adx': False, 'use_ema': False, 'use_spike': False, 'rsi_required': False, 'edge_k': 0.4591710748707726, 'edge_cap': 0.21348958886086578}.
[I 2025-08-30 00:10:03,659] Trial 1389 finished with values: [-1000000000.0, 1000000000.0] and parameters: {'p_sma': 10, 'p_std': 58, 'p_atr': 23, 'p_adx': 26, 'rsi_period': 19, 'ema1': 24, 'ema2': 59, 'slip_atr_k': 0.007323814741570343, 'slip_spread_k': 0.04288940382624645, 'spread_hl_frac': 0.03993070256798177, 'bb_std_mult': 2.052951576773617, 'rsi_os': 25, 'rsi_ob': 60, 'vol_spike': 0.15675771653189893, 'adx_thresh': 26.48953476652745, 'atr_min_pct': 0.016490681401430386, 'atr_max_pct': 0.07881553689708753, 'tp_mult': 2.8264249146548286, 'tsl_mult': 0.5998233565155147, 'strategy': 'breakout', 'time_stop': 128, 'use_sma': False, 'use_atr': False, 'use_adx': False, 'use_ema': False, 'use_spike': False, 'rsi_required': False, 'edge_k': 0.2318617173458034, 'edge_cap': 0.8138320059348715}.
[I 2025-08-30 00:10:03,742] Trial 1388 finished with values: [-1000000000.0, 1000000000.0] and parameters: {'p_sma': 36, 'p_std': 25, 'p_atr': 23, 'p_adx': 23, 'rsi_period': 14, 'ema1': 20, 'ema2': 53, 'slip_atr_k': 0.0004098237190665148, 'slip_spread_k': 0.04560971079784221, 'spread_hl_frac': 0.03996134455581048, 'bb_std_mult': 2.0687876238738934, 'rsi_os': 25, 'rsi_ob': 61, 'vol_spike': 0.18824438886430728, 'adx_thresh': 26.633690418033243, 'atr_min_pct': 0.02690788891693039, 'atr_max_pct': 0.09138204189097915, 'tp_mult': 2.9664285628556852, 'tsl_mult': 0.07663619500843377, 'strategy': 'breakout', 'time_stop': 90, 'use_sma': False, 'use_atr': False, 'use_adx': False, 'use_ema': False, 'use_spike': False, 'rsi_required': False, 'edge_k': 0.5577006864136181, 'edge_cap': 0.8143499343827967}.
[I 2025-08-30 00:10:29,902] Trial 1391 finished with values: [-1000000000.0, 1000000000.0] and parameters: {'p_sma': 10, 'p_std': 11, 'p_atr': 23, 'p_adx': 23, 'rsi_period': 43, 'ema1': 23, 'ema2': 51, 'slip_atr_k': 0.021325709324023303, 'slip_spread_k': 0.8256983486301124, 'spread_hl_frac': 0.021026059738261077, 'bb_std_mult': 3.1107701499297598, 'rsi_os': 26, 'rsi_ob': 60, 'vol_spike': 0.09926621433943117, 'adx_thresh': 26.444065568259678, 'atr_min_pct': 0.003984399209511283, 'atr_max_pct': 0.010376566188282352, 'tp_mult': 1.6068679385170803, 'tsl_mult': 0.30968261124410656, 'strategy': 'breakout', 'time_stop': 129, 'use_sma': False, 'use_atr': False, 'use_adx': False, 'use_ema': False, 'use_spike': False, 'rsi_required': False, 'edge_k': 0.5488515166868163, 'edge_cap': 0.5188971004531854}.
[I 2025-08-30 00:10:30,098] Trial 1393 finished with values: [-0.007061496578576909, 0.007224712177699487] and parameters: {'p_sma': 60, 'p_std': 47, 'p_atr': 24, 'p_adx': 17, 'rsi_period': 21, 'ema1': 23, 'ema2': 47, 'slip_atr_k': 0.02113150804841927, 'slip_spread_k': 0.8240131317039385, 'spread_hl_frac': 0.04360848188038613, 'bb_std_mult': 0.7139187206424122, 'rsi_os': 29, 'rsi_ob': 58, 'vol_spike': 0.28037632438223825, 'adx_thresh': 14.008092377548957, 'atr_min_pct': 0.0038958685520420616, 'atr_max_pct': 0.12419376422759804, 'tp_mult': 1.3023734598025123, 'tsl_mult': 0.3846579830814012, 'strategy': 'breakout', 'time_stop': 115, 'use_sma': False, 'use_atr': False, 'use_adx': False, 'use_ema': False, 'use_spike': False, 'rsi_required': False, 'edge_k': 0.536897392020917, 'edge_cap': 0.973894121865843}.
[I 2025-08-30 00:10:30,439] Trial 1392 finished with values: [-0.011573113205928354, 0.011564899846864395] and parameters: {'p_sma': 57, 'p_std': 57, 'p_atr': 30, 'p_adx': 9, 'rsi_period': 21, 'ema1': 23, 'ema2': 25, 'slip_atr_k': 0.02042639491125984, 'slip_spread_k': 0.9794127516028077, 'spread_hl_frac': 0.03758567761706083, 'bb_std_mult': 2.083730419093521, 'rsi_os': 49, 'rsi_ob': 58, 'vol_spike': 0.2516032114400689, 'adx_thresh': 23.080273370632742, 'atr_min_pct': 0.004135094797233858, 'atr_max_pct': 0.14149392285812298, 'tp_mult': 2.6320164866874336, 'tsl_mult': 0.07242430848167081, 'strategy': 'breakout', 'time_stop': 217, 'use_sma': False, 'use_atr': False, 'use_adx': False, 'use_ema': False, 'use_spike': False, 'rsi_required': False, 'edge_k': 0.542547478520456, 'edge_cap': 0.7736481876350391}.
[I 2025-08-30 00:10:30,525] Trial 1390 finished with values: [-1000000000.0, 1000000000.0] and parameters: {'p_sma': 36, 'p_std': 24, 'p_atr': 23, 'p_adx': 23, 'rsi_period': 34, 'ema1': 20, 'ema2': 59, 'slip_atr_k': 0.019367076347592882, 'slip_spread_k': 0.83006197227693, 'spread_hl_frac': 0.04899618380232841, 'bb_std_mult': 2.066716131468595, 'rsi_os': 26, 'rsi_ob': 81, 'vol_spike': 0.15708046113879137, 'adx_thresh': 26.59020859882552, 'atr_min_pct': 0.026394417911438033, 'atr_max_pct': 0.12704990501442476, 'tp_mult': 2.7415420710152723, 'tsl_mult': 0.7437651422293001, 'strategy': 'breakout', 'time_stop': 93, 'use_sma': False, 'use_atr': False, 'use_adx': False, 'use_ema': False, 'use_spike': False, 'rsi_required': False, 'edge_k': 0.5647177279154791, 'edge_cap': 0.7707448676922819}.
[I 2025-08-30 00:10:56,470] Trial 1397 finished with values: [-1000000000.0, 1000000000.0] and parameters: {'p_sma': 7, 'p_std': 27, 'p_atr': 20, 'p_adx': 8, 'rsi_period': 82, 'ema1': 29, 'ema2': 56, 'slip_atr_k': 0.01111457346332909, 'slip_spread_k': 0.25262449595428793, 'spread_hl_frac': 0.01661967972013245, 'bb_std_mult': 2.235152087665471, 'rsi_os': 32, 'rsi_ob': 62, 'vol_spike': 0.2175600357078676, 'adx_thresh': 32.685405275162424, 'atr_min_pct': 0.0015164125797183779, 'atr_max_pct': 0.09750687797918627, 'tp_mult': 2.2288695555114604, 'tsl_mult': 0.7121358044491217, 'strategy': 'mean_reversion', 'time_stop': 274, 'use_sma': False, 'use_atr': False, 'use_adx': False, 'use_ema': False, 'use_spike': False, 'rsi_required': False, 'edge_k': 0.48695081846698374, 'edge_cap': 0.9062796364684361}.
[I 2025-08-30 00:10:56,479] Trial 1396 finished with values: [-1000000000.0, 1000000000.0] and parameters: {'p_sma': 7, 'p_std': 27, 'p_atr': 15, 'p_adx': 16, 'rsi_period': 79, 'ema1': 25, 'ema2': 43, 'slip_atr_k': 0.03988724792610726, 'slip_spread_k': 0.7886821904536868, 'spread_hl_frac': 0.017175275926031377, 'bb_std_mult': 1.9615965028564075, 'rsi_os': 32, 'rsi_ob': 62, 'vol_spike': 0.1829073413230453, 'adx_thresh': 25.42755526710548, 'atr_min_pct': 0.001773294961771381, 'atr_max_pct': 0.04749115565124835, 'tp_mult': 1.0563704558764697, 'tsl_mult': 0.7501050111900338, 'strategy': 'mean_reversion', 'time_stop': 185, 'use_sma': False, 'use_atr': False, 'use_adx': False, 'use_ema': False, 'use_spike': False, 'rsi_required': False, 'edge_k': 0.49885055574256204, 'edge_cap': 0.7801929882250969}.
[I 2025-08-30 00:10:56,772] Trial 1394 finished with values: [-0.03738928295129007, 0.03736820168881565] and parameters: {'p_sma': 7, 'p_std': 23, 'p_atr': 30, 'p_adx': 25, 'rsi_period': 21, 'ema1': 25, 'ema2': 46, 'slip_atr_k': 0.019760832724485897, 'slip_spread_k': 0.9766840513165023, 'spread_hl_frac': 0.016894348819669718, 'bb_std_mult': 2.2342168040501433, 'rsi_os': 41, 'rsi_ob': 58, 'vol_spike': 0.18339901642866435, 'adx_thresh': 12.644260610551724, 'atr_min_pct': 0.0011786465646142132, 'atr_max_pct': 0.0625104755487789, 'tp_mult': 2.4732235607040756, 'tsl_mult': 0.9429538899680949, 'strategy': 'breakout', 'time_stop': 114, 'use_sma': False, 'use_atr': False, 'use_adx': False, 'use_ema': False, 'use_spike': False, 'rsi_required': False, 'edge_k': 0.07847430018975687, 'edge_cap': 0.9040989897649792}.
[I 2025-08-30 00:10:56,867] Trial 1395 finished with values: [-0.0552681082422547, 0.055245976837616284] and parameters: {'p_sma': 25, 'p_std': 23, 'p_atr': 15, 'p_adx': 29, 'rsi_period': 33, 'ema1': 25, 'ema2': 25, 'slip_atr_k': 0.019625949062184612, 'slip_spread_k': 0.19036198166366336, 'spread_hl_frac': 0.02925867718128409, 'bb_std_mult': 0.7969225053935796, 'rsi_os': 43, 'rsi_ob': 68, 'vol_spike': 0.18272172291476002, 'adx_thresh': 12.61965044559214, 'atr_min_pct': 0.0014683084262719411, 'atr_max_pct': 0.06244202689523337, 'tp_mult': 1.0470263461406133, 'tsl_mult': 0.7543603010491348, 'strategy': 'breakout', 'time_stop': 100, 'use_sma': False, 'use_atr': False, 'use_adx': False, 'use_ema': False, 'use_spike': False, 'rsi_required': False, 'edge_k': 0.07573548946450304, 'edge_cap': 0.7699970298231132}.
[I 2025-08-30 00:11:22,854] Trial 1400 finished with values: [-1000000000.0, 1000000000.0] and parameters: {'p_sma': 9, 'p_std': 45, 'p_atr': 26, 'p_adx': 15, 'rsi_period': 25, 'ema1': 18, 'ema2': 20, 'slip_atr_k': 0.18302687280126925, 'slip_spread_k': 0.14098780215729212, 'spread_hl_frac': 0.014291550292819677, 'bb_std_mult': 1.2813624887699837, 'rsi_os': 23, 'rsi_ob': 59, 'vol_spike': 0.17638851477743991, 'adx_thresh': 20.030788611286777, 'atr_min_pct': 0.008036783516468197, 'atr_max_pct': 0.029120834953416372, 'tp_mult': 1.6503715889914468, 'tsl_mult': 0.7592654849020789, 'strategy': 'breakout', 'time_stop': 227, 'use_sma': False, 'use_atr': False, 'use_adx': False, 'use_ema': False, 'use_spike': False, 'rsi_required': False, 'edge_k': 1.8068836130736947, 'edge_cap': 0.5729164401988036}.
[I 2025-08-30 00:11:23,087] Trial 1398 finished with values: [-0.04267621590430348, 0.0426246452333957] and parameters: {'p_sma': 25, 'p_std': 23, 'p_atr': 26, 'p_adx': 15, 'rsi_period': 20, 'ema1': 6, 'ema2': 11, 'slip_atr_k': 0.21246175847009857, 'slip_spread_k': 0.8530619479201125, 'spread_hl_frac': 0.018635027611749844, 'bb_std_mult': 2.8210422568766846, 'rsi_os': 54, 'rsi_ob': 59, 'vol_spike': 0.2012736593761484, 'adx_thresh': 20.349367941701246, 'atr_min_pct': 0.0028071825269112335, 'atr_max_pct': 0.06211728553817297, 'tp_mult': 2.483584968595465, 'tsl_mult': 0.5042092085442551, 'strategy': 'breakout', 'time_stop': 42, 'use_sma': False, 'use_atr': False, 'use_adx': False, 'use_ema': False, 'use_spike': False, 'rsi_required': False, 'edge_k': 1.7778364989369657, 'edge_cap': 0.8050192823966297}.
[I 2025-08-30 00:11:23,087] Trial 1399 finished with values: [-1000000000.0, 1000000000.0] and parameters: {'p_sma': 5, 'p_std': 23, 'p_atr': 26, 'p_adx': 15, 'rsi_period': 26, 'ema1': 18, 'ema2': 11, 'slip_atr_k': 0.12519917386677837, 'slip_spread_k': 0.8454253401450572, 'spread_hl_frac': 0.018635722117035087, 'bb_std_mult': 1.2818354711756283, 'rsi_os': 43, 'rsi_ob': 55, 'vol_spike': 0.1754835250231406, 'adx_thresh': 20.23412704041747, 'atr_min_pct': 0.015513836074344034, 'atr_max_pct': 0.029711186182228913, 'tp_mult': 2.5592896895909107, 'tsl_mult': 0.7567460291078709, 'strategy': 'breakout', 'time_stop': 101, 'use_sma': False, 'use_atr': False, 'use_adx': False, 'use_ema': False, 'use_spike': False, 'rsi_required': False, 'edge_k': 0.7704010196712066, 'edge_cap': 0.8002044982079646}.
[I 2025-08-30 00:11:23,268] Trial 1401 finished with values: [-1000000000.0, 1000000000.0] and parameters: {'p_sma': 34, 'p_std': 26, 'p_atr': 24, 'p_adx': 15, 'rsi_period': 26, 'ema1': 18, 'ema2': 54, 'slip_atr_k': 0.13219061427272796, 'slip_spread_k': 0.8471805099028217, 'spread_hl_frac': 0.01847843396210537, 'bb_std_mult': 1.5545721964398684, 'rsi_os': 46, 'rsi_ob': 88, 'vol_spike': 0.17687391716257508, 'adx_thresh': 25.822579909465095, 'atr_min_pct': 0.007960718486733187, 'atr_max_pct': 0.1175834194763891, 'tp_mult': 2.564007545580441, 'tsl_mult': 0.7286462382611046, 'strategy': 'breakout', 'time_stop': 177, 'use_sma': False, 'use_atr': False, 'use_adx': False, 'use_ema': False, 'use_spike': False, 'rsi_required': False, 'edge_k': 1.7390168436154436, 'edge_cap': 0.05009987652055686}.
[I 2025-08-30 00:11:23,605] Trial 1404 finished with values: [-1000000000.0, 1000000000.0] and parameters: {'p_sma': 32, 'p_std': 31, 'p_atr': 24, 'p_adx': 16, 'rsi_period': 23, 'ema1': 9, 'ema2': 54, 'slip_atr_k': 0.10116575499342674, 'slip_spread_k': 0.7860849057249231, 'spread_hl_frac': 0.006422258990778175, 'bb_std_mult': 2.014325001413455, 'rsi_os': 51, 'rsi_ob': 79, 'vol_spike': 0.10891417939460868, 'adx_thresh': 25.757204548848133, 'atr_min_pct': 0.0020751026066907208, 'atr_max_pct': 0.09619123230802962, 'tp_mult': 1.0919029480057378, 'tsl_mult': 0.7298518573572693, 'strategy': 'mean_reversion', 'time_stop': 212, 'use_sma': False, 'use_atr': False, 'use_adx': False, 'use_ema': False, 'use_spike': False, 'rsi_required': False, 'edge_k': 0.4346321358164379, 'edge_cap': 0.8288442304030637}.
[I 2025-08-30 00:11:48,739] Trial 1405 finished with values: [-0.008310250197633429, 0.00830266088720782] and parameters: {'p_sma': 22, 'p_std': 25, 'p_atr': 8, 'p_adx': 20, 'rsi_period': 76, 'ema1': 16, 'ema2': 53, 'slip_atr_k': 0.013965567112718862, 'slip_spread_k': 0.21488235302100872, 'spread_hl_frac': 0.020273637227910965, 'bb_std_mult': 0.6491305911437208, 'rsi_os': 28, 'rsi_ob': 60, 'vol_spike': 0.1908843275455068, 'adx_thresh': 24.77148774275636, 'atr_min_pct': 0.0020712797958751176, 'atr_max_pct': 0.09579625399691004, 'tp_mult': 1.172550409262791, 'tsl_mult': 0.8049936952144388, 'strategy': 'mean_reversion', 'time_stop': 120, 'use_sma': False, 'use_atr': False, 'use_adx': False, 'use_ema': False, 'use_spike': False, 'rsi_required': False, 'edge_k': 0.6246392822228874, 'edge_cap': 0.8346072552687509}.
