[I 2025-08-30 00:11:48,947] Trial 1403 finished with values: [-1000000000.0, 1000000000.0] and parameters: {'p_sma': 6, 'p_std': 31, 'p_atr': 24, 'p_adx': 20, 'rsi_period': 39, 'ema1': 24, 'ema2': 54, 'slip_atr_k': 0.10236103809013854, 'slip_spread_k': 0.7903756784127199, 'spread_hl_frac': 0.015610661311861687, 'bb_std_mult': 0.8951211529217935, 'rsi_os': 28, 'rsi_ob': 73, 'vol_spike': 0.2631025912139124, 'adx_thresh': 25.813235285526815, 'atr_min_pct': 0.0023643628684438356, 'atr_max_pct': 0.09672744048072414, 'tp_mult': 1.7184649464115473, 'tsl_mult': 0.23758202904169767, 'strategy': 'mean_reversion', 'time_stop': 212, 'use_sma': False, 'use_atr': False, 'use_adx': False, 'use_ema': False, 'use_spike': False, 'rsi_required': False, 'edge_k': 0.6094564309158631, 'edge_cap': 0.8332753953556592}.
[I 2025-08-30 00:11:49,043] Trial 1402 finished with values: [-0.00568658161545299, 0.005686002906179786] and parameters: {'p_sma': 34, 'p_std': 30, 'p_atr': 24, 'p_adx': 16, 'rsi_period': 19, 'ema1': 11, 'ema2': 54, 'slip_atr_k': 0.13538989986907093, 'slip_spread_k': 0.8466299372399954, 'spread_hl_frac': 0.018455407429804026, 'bb_std_mult': 2.800065519113807, 'rsi_os': 16, 'rsi_ob': 61, 'vol_spike': 0.20080866811211145, 'adx_thresh': 25.0272106432574, 'atr_min_pct': 0.002866252426333207, 'atr_max_pct': 0.09641468560119931, 'tp_mult': 2.5615605985623384, 'tsl_mult': 0.7314550346574863, 'strategy': 'breakout', 'time_stop': 103, 'use_sma': False, 'use_atr': False, 'use_adx': False, 'use_ema': False, 'use_spike': False, 'rsi_required': False, 'edge_k': 1.7321133556079198, 'edge_cap': 0.833049125715577}.
[I 2025-08-30 00:11:49,694] Trial 1406 finished with values: [-1000000000.0, 1000000000.0] and parameters: {'p_sma': 6, 'p_std': 28, 'p_atr': 9, 'p_adx': 17, 'rsi_period': 76, 'ema1': 24, 'ema2': 23, 'slip_atr_k': 0.012365841991991332, 'slip_spread_k': 0.23022847891763293, 'spread_hl_frac': 0.027922378089450185, 'bb_std_mult': 2.135146146367465, 'rsi_os': 28, 'rsi_ob': 61, 'vol_spike': 0.1938333210038933, 'adx_thresh': 24.83972196842026, 'atr_min_pct': 0.005444297854842585, 'atr_max_pct': 0.10787417164081126, 'tp_mult': 1.6988586847326512, 'tsl_mult': 0.8061272550825729, 'strategy': 'breakout', 'time_stop': 105, 'use_sma': False, 'use_atr': False, 'use_adx': False, 'use_ema': False, 'use_spike': False, 'rsi_required': False, 'edge_k': 1.570727256289433, 'edge_cap': 0.7542526877392888}.
[I 2025-08-30 00:12:15,471] Trial 1407 finished with values: [-1000000000.0, 1000000000.0] and parameters: {'p_sma': 6, 'p_std': 37, 'p_atr': 13, 'p_adx': 17, 'rsi_period': 19, 'ema1': 24, 'ema2': 28, 'slip_atr_k': 0.23914018803250464, 'slip_spread_k': 0.4842068859880254, 'spread_hl_frac': 0.015585991911135333, 'bb_std_mult': 1.956152094895009, 'rsi_os': 17, 'rsi_ob': 54, 'vol_spike': 0.08424623544782238, 'adx_thresh': 24.365044658914204, 'atr_min_pct': 0.0029115412115655707, 'atr_max_pct': 0.01642576651887888, 'tp_mult': 1.7136937090310098, 'tsl_mult': 0.621862769794634, 'strategy': 'breakout', 'time_stop': 106, 'use_sma': False, 'use_atr': False, 'use_adx': False, 'use_ema': False, 'use_spike': False, 'rsi_required': False, 'edge_k': 1.8402700517391135, 'edge_cap': 0.7523306742983333}.
[I 2025-08-30 00:12:16,022] Trial 1408 finished with values: [-1000000000.0, 1000000000.0] and parameters: {'p_sma': 8, 'p_std': 16, 'p_atr': 23, 'p_adx': 10, 'rsi_period': 48, 'ema1': 24, 'ema2': 56, 'slip_atr_k': 0.1378882326451271, 'slip_spread_k': 0.48542655207921137, 'spread_hl_frac': 0.017865282951239857, 'bb_std_mult': 1.4667586026476962, 'rsi_os': 16, 'rsi_ob': 64, 'vol_spike': 0.08478043631212903, 'adx_thresh': 9.648209497197804, 'atr_min_pct': 0.009774251852166124, 'atr_max_pct': 0.10721546890975518, 'tp_mult': 1.1083197567969587, 'tsl_mult': 0.5641390369318993, 'strategy': 'breakout', 'time_stop': 152, 'use_sma': False, 'use_atr': False, 'use_adx': False, 'use_ema': False, 'use_spike': False, 'rsi_required': False, 'edge_k': 1.5806102346543036, 'edge_cap': 0.7474040295519705}.
[I 2025-08-30 00:12:16,164] Trial 1410 finished with values: [-1000000000.0, 1000000000.0] and parameters: {'p_sma': 8, 'p_std': 43, 'p_atr': 23, 'p_adx': 17, 'rsi_period': 19, 'ema1': 24, 'ema2': 28, 'slip_atr_k': 0.02505259782518639, 'slip_spread_k': 0.5477958717514458, 'spread_hl_frac': 0.009528456555850849, 'bb_std_mult': 1.431312403785282, 'rsi_os': 8, 'rsi_ob': 86, 'vol_spike': 0.02760511943003205, 'adx_thresh': 24.071065106362354, 'atr_min_pct': 0.0007688292577428379, 'atr_max_pct': 0.08899172393663651, 'tp_mult': 1.4812133510542833, 'tsl_mult': 0.7128835008200073, 'strategy': 'breakout', 'time_stop': 152, 'use_sma': False, 'use_atr': False, 'use_adx': False, 'use_ema': False, 'use_spike': False, 'rsi_required': False, 'edge_k': 0.5075027336860982, 'edge_cap': 0.7876139628029087}.
[I 2025-08-30 00:12:16,218] Trial 1409 finished with values: [-1000000000.0, 1000000000.0] and parameters: {'p_sma': 8, 'p_std': 43, 'p_atr': 22, 'p_adx': 17, 'rsi_period': 57, 'ema1': 5, 'ema2': 28, 'slip_atr_k': 0.2035052381611031, 'slip_spread_k': 0.8797808011706679, 'spread_hl_frac': 0.021626967952637126, 'bb_std_mult': 2.1400259302417775, 'rsi_os': 26, 'rsi_ob': 52, 'vol_spike': 0.14377772256175342, 'adx_thresh': 24.188501692758468, 'atr_min_pct': 0.0005365688966589097, 'atr_max_pct': 0.10804346057292936, 'tp_mult': 1.4938911218276627, 'tsl_mult': 0.7079691587830416, 'strategy': 'breakout', 'time_stop': 112, 'use_sma': False, 'use_atr': False, 'use_adx': False, 'use_ema': False, 'use_spike': False, 'rsi_required': False, 'edge_k': 1.5832357135897352, 'edge_cap': 0.7529958708583995}.
[I 2025-08-30 00:12:42,761] Trial 1412 finished with values: [-1000000000.0, 1000000000.0] and parameters: {'p_sma': 49, 'p_std': 18, 'p_atr': 22, 'p_adx': 16, 'rsi_period': 21, 'ema1': 26, 'ema2': 51, 'slip_atr_k': 0.02557197701022586, 'slip_spread_k': 0.8869086499221942, 'spread_hl_frac': 0.0318035135069337, 'bb_std_mult': 3.3018068489826184, 'rsi_os': 22, 'rsi_ob': 59, 'vol_spike': 0.018830566165091545, 'adx_thresh': 26.196942181358285, 'atr_min_pct': 0.012166350368152837, 'atr_max_pct': 0.0902216359737361, 'tp_mult': 1.4775733218653557, 'tsl_mult': 0.28745155018310964, 'strategy': 'breakout', 'time_stop': 240, 'use_sma': False, 'use_atr': False, 'use_adx': False, 'use_ema': False, 'use_spike': False, 'rsi_required': False, 'edge_k': 0.50568371018324, 'edge_cap': 0.2544270783584774}.
[I 2025-08-30 00:12:42,768] Trial 1414 finished with values: [-1000000000.0, 1000000000.0] and parameters: {'p_sma': 16, 'p_std': 60, 'p_atr': 18, 'p_adx': 16, 'rsi_period': 37, 'ema1': 22, 'ema2': 30, 'slip_atr_k': 0.1544437781823916, 'slip_spread_k': 0.8139589837814232, 'spread_hl_frac': 0.019908422439086, 'bb_std_mult': 2.0247302209142948, 'rsi_os': 25, 'rsi_ob': 63, 'vol_spike': 0.02066920925627691, 'adx_thresh': 25.323265767045328, 'atr_min_pct': 0.0031260307578838426, 'atr_max_pct': 0.09049652093684213, 'tp_mult': 1.2398899987768988, 'tsl_mult': 0.0007111294960239212, 'strategy': 'breakout', 'time_stop': 95, 'use_sma': False, 'use_atr': False, 'use_adx': False, 'use_ema': False, 'use_spike': False, 'rsi_required': False, 'edge_k': 0.45549828804515746, 'edge_cap': 0.2994090694891347}.
[I 2025-08-30 00:12:42,798] Trial 1413 finished with values: [-1000000000.0, 1000000000.0] and parameters: {'p_sma': 16, 'p_std': 24, 'p_atr': 28, 'p_adx': 16, 'rsi_period': 58, 'ema1': 26, 'ema2': 30, 'slip_atr_k': 0.03215987153205879, 'slip_spread_k': 0.809283415520266, 'spread_hl_frac': 0.016951043980625947, 'bb_std_mult': 2.0164109832462107, 'rsi_os': 11, 'rsi_ob': 63, 'vol_spike': 0.14386504023335436, 'adx_thresh': 14.59114875208762, 'atr_min_pct': 0.01258228305779733, 'atr_max_pct': 0.10037139142806467, 'tp_mult': 1.1670407108558252, 'tsl_mult': 0.9130374709272513, 'strategy': 'breakout', 'time_stop': 111, 'use_sma': False, 'use_atr': False, 'use_adx': False, 'use_ema': False, 'use_spike': False, 'rsi_required': False, 'edge_k': 0.4575292472708554, 'edge_cap': 0.2889744335522352}.
[I 2025-08-30 00:12:42,934] Trial 1411 finished with values: [-1000000000.0, 1000000000.0] and parameters: {'p_sma': 8, 'p_std': 25, 'p_atr': 11, 'p_adx': 16, 'rsi_period': 22, 'ema1': 26, 'ema2': 56, 'slip_atr_k': 0.029367969902620965, 'slip_spread_k': 0.8002386880856279, 'spread_hl_frac': 0.017109918446435515, 'bb_std_mult': 3.3326387117479546, 'rsi_os': 26, 'rsi_ob': 63, 'vol_spike': 0.16412590266510188, 'adx_thresh': 24.05972137626312, 'atr_min_pct': 0.012735226232070487, 'atr_max_pct': 0.0899918145892515, 'tp_mult': 2.1206407470481166, 'tsl_mult': 0.8639558571856776, 'strategy': 'breakout', 'time_stop': 112, 'use_sma': False, 'use_atr': False, 'use_adx': False, 'use_ema': False, 'use_spike': False, 'rsi_required': False, 'edge_k': 0.4992510214154616, 'edge_cap': 0.2536029828184844}.
[I 2025-08-30 00:13:09,281] Trial 1416 finished with values: [-1000000000.0, 1000000000.0] and parameters: {'p_sma': 12, 'p_std': 25, 'p_atr': 23, 'p_adx': 11, 'rsi_period': 41, 'ema1': 23, 'ema2': 55, 'slip_atr_k': 0.016666307824103103, 'slip_spread_k': 0.8221153899433291, 'spread_hl_frac': 0.016605852890320846, 'bb_std_mult': 2.481672655203203, 'rsi_os': 26, 'rsi_ob': 61, 'vol_spike': 0.16323967158305366, 'adx_thresh': 27.44715775453919, 'atr_min_pct': 0.0035006272189692248, 'atr_max_pct': 0.06879287322659057, 'tp_mult': 1.5681769131702632, 'tsl_mult': 0.8746331613621028, 'strategy': 'mean_reversion', 'time_stop': 82, 'use_sma': False, 'use_atr': False, 'use_adx': False, 'use_ema': False, 'use_spike': False, 'rsi_required': False, 'edge_k': 0.30514181881207414, 'edge_cap': 0.7971215923440113}.
[I 2025-08-30 00:13:09,303] Trial 1415 finished with values: [-0.005025194564082791, 0.00507399047915028] and parameters: {'p_sma': 41, 'p_std': 29, 'p_atr': 14, 'p_adx': 11, 'rsi_period': 73, 'ema1': 10, 'ema2': 58, 'slip_atr_k': 0.14657235358078918, 'slip_spread_k': 0.7051483681886884, 'spread_hl_frac': 0.016456836121457916, 'bb_std_mult': 1.8326744090002849, 'rsi_os': 23, 'rsi_ob': 61, 'vol_spike': 0.16606103922967996, 'adx_thresh': 27.99019757947387, 'atr_min_pct': 0.0036701341013423627, 'atr_max_pct': 0.10328131874888251, 'tp_mult': 2.1607622249453105, 'tsl_mult': 0.6783569170785867, 'strategy': 'mean_reversion', 'time_stop': 63, 'use_sma': False, 'use_atr': False, 'use_adx': False, 'use_ema': False, 'use_spike': False, 'rsi_required': False, 'edge_k': 1.4733627321509188, 'edge_cap': 0.7902117633001945}.
[I 2025-08-30 00:13:09,398] Trial 1417 finished with values: [-1000000000.0, 1000000000.0] and parameters: {'p_sma': 12, 'p_std': 29, 'p_atr': 23, 'p_adx': 16, 'rsi_period': 73, 'ema1': 14, 'ema2': 58, 'slip_atr_k': 0.04704319265844671, 'slip_spread_k': 0.7261909680581181, 'spread_hl_frac': 0.016507359912192536, 'bb_std_mult': 2.4920125661499695, 'rsi_os': 23, 'rsi_ob': 61, 'vol_spike': 0.18626324694415916, 'adx_thresh': 27.72236231910467, 'atr_min_pct': 0.003474258817401944, 'atr_max_pct': 0.09278238026697287, 'tp_mult': 1.110980598274923, 'tsl_mult': 0.8719136762877184, 'strategy': 'mean_reversion', 'time_stop': 198, 'use_sma': False, 'use_atr': False, 'use_adx': False, 'use_ema': False, 'use_spike': False, 'rsi_required': False, 'edge_k': 0.3039655472007333, 'edge_cap': 0.18681832519700664}.
[I 2025-08-30 00:13:09,558] Trial 1418 finished with values: [-1000000000.0, 1000000000.0] and parameters: {'p_sma': 38, 'p_std': 55, 'p_atr': 23, 'p_adx': 28, 'rsi_period': 67, 'ema1': 23, 'ema2': 55, 'slip_atr_k': 0.22915426033520025, 'slip_spread_k': 0.015160200619854125, 'spread_hl_frac': 0.014748627398985312, 'bb_std_mult': 1.825203310730803, 'rsi_os': 13, 'rsi_ob': 56, 'vol_spike': 0.05091918984422912, 'adx_thresh': 25.26632421062466, 'atr_min_pct': 0.003474794251258706, 'atr_max_pct': 0.09321870275629617, 'tp_mult': 2.881277275391199, 'tsl_mult': 0.676789581571827, 'strategy': 'mean_reversion', 'time_stop': 123, 'use_sma': False, 'use_atr': False, 'use_adx': False, 'use_ema': False, 'use_spike': False, 'rsi_required': False, 'edge_k': 1.443845322081843, 'edge_cap': 0.7968452099487515}.
[I 2025-08-30 00:13:35,818] Trial 1419 finished with values: [-1000000000.0, 1000000000.0] and parameters: {'p_sma': 46, 'p_std': 26, 'p_atr': 23, 'p_adx': 24, 'rsi_period': 17, 'ema1': 25, 'ema2': 53, 'slip_atr_k': 0.013537540395784777, 'slip_spread_k': 0.44915149613680627, 'spread_hl_frac': 0.04124916801107001, 'bb_std_mult': 2.118075755052065, 'rsi_os': 24, 'rsi_ob': 57, 'vol_spike': 0.18620023843554298, 'adx_thresh': 25.13064022602407, 'atr_min_pct': 0.02780608164591373, 'atr_max_pct': 0.092924510228697, 'tp_mult': 1.0117182072949469, 'tsl_mult': 0.03399834101569382, 'strategy': 'breakout', 'time_stop': 259, 'use_sma': False, 'use_atr': False, 'use_adx': False, 'use_ema': False, 'use_spike': False, 'rsi_required': False, 'edge_k': 0.40570388425111603, 'edge_cap': 0.19295719149792934}.
[I 2025-08-30 00:13:35,843] Trial 1420 finished with values: [-1000000000.0, 1000000000.0] and parameters: {'p_sma': 54, 'p_std': 14, 'p_atr': 23, 'p_adx': 12, 'rsi_period': 12, 'ema1': 25, 'ema2': 49, 'slip_atr_k': 0.009887550852936633, 'slip_spread_k': 0.4592192178952094, 'spread_hl_frac': 0.01788435156612017, 'bb_std_mult': 1.9539226760854784, 'rsi_os': 5, 'rsi_ob': 57, 'vol_spike': 0.004279081641329202, 'adx_thresh': 18.489579945209947, 'atr_min_pct': 0.027623803166401117, 'atr_max_pct': 0.09240110334907946, 'tp_mult': 1.9347202519903786, 'tsl_mult': 0.7016579508401095, 'strategy': 'breakout', 'time_stop': 121, 'use_sma': False, 'use_atr': False, 'use_adx': False, 'use_ema': False, 'use_spike': False, 'rsi_required': False, 'edge_k': 0.9261645493954844, 'edge_cap': 0.7243514594425142}.
[I 2025-08-30 00:13:36,057] Trial 1422 finished with values: [-1000000000.0, 1000000000.0] and parameters: {'p_sma': 54, 'p_std': 26, 'p_atr': 12, 'p_adx': 15, 'rsi_period': 23, 'ema1': 24, 'ema2': 53, 'slip_atr_k': 0.01463435803149847, 'slip_spread_k': 0.44621428062904106, 'spread_hl_frac': 0.04651528613772009, 'bb_std_mult': 2.113627897228531, 'rsi_os': 30, 'rsi_ob': 66, 'vol_spike': 0.057656353878875174, 'adx_thresh': 7.325350409092717, 'atr_min_pct': 0.028044418880678566, 'atr_max_pct': 0.0988082322329166, 'tp_mult': 1.1670614197482405, 'tsl_mult': 0.03793098753407792, 'strategy': 'breakout', 'time_stop': 99, 'use_sma': False, 'use_atr': False, 'use_adx': False, 'use_ema': False, 'use_spike': False, 'rsi_required': False, 'edge_k': 0.6721086948809492, 'edge_cap': 0.7233926528422941}.
[I 2025-08-30 00:13:36,132] Trial 1421 finished with values: [-1000000000.0, 1000000000.0] and parameters: {'p_sma': 38, 'p_std': 27, 'p_atr': 22, 'p_adx': 27, 'rsi_period': 67, 'ema1': 8, 'ema2': 53, 'slip_atr_k': 0.010542848936179468, 'slip_spread_k': 0.7544374798052451, 'spread_hl_frac': 0.026102379435806213, 'bb_std_mult': 2.1147845804455083, 'rsi_os': 14, 'rsi_ob': 94, 'vol_spike': 0.05274289251640171, 'adx_thresh': 25.356073133180626, 'atr_min_pct': 0.020318078219775635, 'atr_max_pct': 0.0989113548451854, 'tp_mult': 2.663520552948577, 'tsl_mult': 0.4068858581745285, 'strategy': 'breakout', 'time_stop': 10, 'use_sma': False, 'use_atr': False, 'use_adx': False, 'use_ema': False, 'use_spike': False, 'rsi_required': False, 'edge_k': 0.5941825776206904, 'edge_cap': 0.7040268189745783}.
[I 2025-08-30 00:14:02,364] Trial 1426 finished with values: [-1000000000.0, 1000000000.0] and parameters: {'p_sma': 58, 'p_std': 24, 'p_atr': 24, 'p_adx': 21, 'rsi_period': 21, 'ema1': 21, 'ema2': 51, 'slip_atr_k': 0.023156962346582752, 'slip_spread_k': 0.9082573467414642, 'spread_hl_frac': 0.008290321298910878, 'bb_std_mult': 2.1977642295869657, 'rsi_os': 25, 'rsi_ob': 60, 'vol_spike': 0.17733629772029838, 'adx_thresh': 26.2175825118554, 'atr_min_pct': 0.01752877121234275, 'atr_max_pct': 0.13781758868124994, 'tp_mult': 1.1001157917949957, 'tsl_mult': 0.7733073789009439, 'strategy': 'breakout', 'time_stop': 161, 'use_sma': False, 'use_atr': False, 'use_adx': False, 'use_ema': False, 'use_spike': False, 'rsi_required': False, 'edge_k': 0.5423932029345508, 'edge_cap': 0.8143881997161582}.
[I 2025-08-30 00:14:02,384] Trial 1423 finished with values: [-1000000000.0, 1000000000.0] and parameters: {'p_sma': 58, 'p_std': 27, 'p_atr': 22, 'p_adx': 16, 'rsi_period': 54, 'ema1': 15, 'ema2': 52, 'slip_atr_k': 0.0043547933734165295, 'slip_spread_k': 0.1716786562921368, 'spread_hl_frac': 0.019631905596825316, 'bb_std_mult': 2.189092609820336, 'rsi_os': 27, 'rsi_ob': 66, 'vol_spike': 0.17552442027121937, 'adx_thresh': 16.462081753629406, 'atr_min_pct': 0.02529980205354386, 'atr_max_pct': 0.09898230578721709, 'tp_mult': 1.1723032744971595, 'tsl_mult': 0.8339802733315402, 'strategy': 'breakout', 'time_stop': 101, 'use_sma': False, 'use_atr': False, 'use_adx': False, 'use_ema': False, 'use_spike': False, 'rsi_required': False, 'edge_k': 0.5860362709265025, 'edge_cap': 0.42783577864873135}.
[I 2025-08-30 00:14:02,388] Trial 1425 finished with values: [-1000000000.0, 1000000000.0] and parameters: {'p_sma': 9, 'p_std': 24, 'p_atr': 22, 'p_adx': 16, 'rsi_period': 21, 'ema1': 15, 'ema2': 14, 'slip_atr_k': 0.02382746565785406, 'slip_spread_k': 0.7535514565360506, 'spread_hl_frac': 0.019560763180425943, 'bb_std_mult': 2.201042971505651, 'rsi_os': 25, 'rsi_ob': 82, 'vol_spike': 0.17276663081344723, 'adx_thresh': 22.106295391009255, 'atr_min_pct': 0.01816315841191631, 'atr_max_pct': 0.09852941698067745, 'tp_mult': 1.0831431783249366, 'tsl_mult': 0.18703231272373932, 'strategy': 'breakout', 'time_stop': 116, 'use_sma': False, 'use_atr': False, 'use_adx': False, 'use_ema': False, 'use_spike': False, 'rsi_required': False, 'edge_k': 0.5831989618937525, 'edge_cap': 0.6991525783554247}.
[I 2025-08-30 00:14:02,565] Trial 1424 finished with values: [-0.00932707200510663, 0.009466196623356335] and parameters: {'p_sma': 21, 'p_std': 27, 'p_atr': 22, 'p_adx': 16, 'rsi_period': 23, 'ema1': 8, 'ema2': 51, 'slip_atr_k': 0.02288358541182201, 'slip_spread_k': 0.9120180881277825, 'spread_hl_frac': 0.0019029212176942083, 'bb_std_mult': 2.0578717813016545, 'rsi_os': 27, 'rsi_ob': 60, 'vol_spike': 0.1725744029529008, 'adx_thresh': 6.749378307272707, 'atr_min_pct': 0.0023235285899308204, 'atr_max_pct': 0.09889951523675689, 'tp_mult': 1.0971129045417396, 'tsl_mult': 0.4116689182295715, 'strategy': 'breakout', 'time_stop': 189, 'use_sma': False, 'use_atr': False, 'use_adx': False, 'use_ema': False, 'use_spike': False, 'rsi_required': False, 'edge_k': 0.5974044385465804, 'edge_cap': 0.38641434974003463}.
[I 2025-08-30 00:14:28,939] Trial 1427 finished with values: [-0.013251556882511784, 0.013170049935794065] and parameters: {'p_sma': 5, 'p_std': 24, 'p_atr': 24, 'p_adx': 30, 'rsi_period': 18, 'ema1': 27, 'ema2': 55, 'slip_atr_k': 0.2227665756575936, 'slip_spread_k': 0.957205973566841, 'spread_hl_frac': 0.002023507521744697, 'bb_std_mult': 2.047421062818625, 'rsi_os': 53, 'rsi_ob': 60, 'vol_spike': 0.19543275417315162, 'adx_thresh': 22.29362616387892, 'atr_min_pct': 0.0024131146315929538, 'atr_max_pct': 0.10153141379215642, 'tp_mult': 1.2538863483343878, 'tsl_mult': 0.7277843269724924, 'strategy': 'breakout', 'time_stop': 190, 'use_sma': False, 'use_atr': False, 'use_adx': False, 'use_ema': False, 'use_spike': False, 'rsi_required': False, 'edge_k': 0.476053901707803, 'edge_cap': 0.354283190873506}.
[I 2025-08-30 00:14:29,292] Trial 1428 finished with values: [-0.002014593457871472, 0.002648701754622123] and parameters: {'p_sma': 5, 'p_std': 25, 'p_atr': 29, 'p_adx': 17, 'rsi_period': 18, 'ema1': 22, 'ema2': 55, 'slip_atr_k': 0.01811023263617634, 'slip_spread_k': 0.7766581290083365, 'spread_hl_frac': 0.0019609986221693493, 'bb_std_mult': 2.0339264560542545, 'rsi_os': 35, 'rsi_ob': 84, 'vol_spike': 0.192545343170908, 'adx_thresh': 26.036699598867674, 'atr_min_pct': 0.002450909005517484, 'atr_max_pct': 0.07334883359166386, 'tp_mult': 1.2494316136661943, 'tsl_mult': 0.7377968713666554, 'strategy': 'breakout', 'time_stop': 107, 'use_sma': False, 'use_atr': False, 'use_adx': False, 'use_ema': False, 'use_spike': False, 'rsi_required': False, 'edge_k': 1.9992285050079237, 'edge_cap': 0.5976495112249763}.
[I 2025-08-30 00:14:29,368] Trial 1429 finished with values: [-1000000000.0, 1000000000.0] and parameters: {'p_sma': 5, 'p_std': 21, 'p_atr': 21, 'p_adx': 17, 'rsi_period': 18, 'ema1': 22, 'ema2': 35, 'slip_atr_k': 0.2218971177819305, 'slip_spread_k': 0.9526565155728877, 'spread_hl_frac': 0.018171614579597088, 'bb_std_mult': 2.045401033791303, 'rsi_os': 7, 'rsi_ob': 70, 'vol_spike': 0.19434131359270504, 'adx_thresh': 27.006699905862813, 'atr_min_pct': 0.013554043110342489, 'atr_max_pct': 0.03919325242260153, 'tp_mult': 1.81931280854218, 'tsl_mult': 0.7404414819741251, 'strategy': 'breakout', 'time_stop': 234, 'use_sma': False, 'use_atr': False, 'use_adx': False, 'use_ema': False, 'use_spike': False, 'rsi_required': False, 'edge_k': 1.042696803862068, 'edge_cap': 0.5959862269895511}.
[I 2025-08-30 00:14:29,517] Trial 1430 finished with values: [-1000000000.0, 1000000000.0] and parameters: {'p_sma': 5, 'p_std': 25, 'p_atr': 16, 'p_adx': 30, 'rsi_period': 18, 'ema1': 24, 'ema2': 35, 'slip_atr_k': 0.2228395940852043, 'slip_spread_k': 0.0006165967351867696, 'spread_hl_frac': 0.012946147406680084, 'bb_std_mult': 0.9924220052019064, 'rsi_os': 29, 'rsi_ob': 76, 'vol_spike': 0.18216139360587175, 'adx_thresh': 26.056371671214464, 'atr_min_pct': 0.0018171487757086763, 'atr_max_pct': 0.02300413783539445, 'tp_mult': 1.345913714031227, 'tsl_mult': 0.7331311148944041, 'strategy': 'mean_reversion', 'time_stop': 91, 'use_sma': False, 'use_atr': False, 'use_adx': False, 'use_ema': False, 'use_spike': False, 'rsi_required': False, 'edge_k': 1.0189745240801504, 'edge_cap': 0.5949476401089064}.
