[I 2025-08-29 21:48:02,822] Trial 82 finished with values: [-1000000000.0, 1000000000.0] and parameters: {'p_sma': 11, 'p_std': 39, 'p_atr': 10, 'p_adx': 15, 'rsi_period': 42, 'ema1': 28, 'ema2': 13, 'slip_atr_k': 0.1573025862683899, 'slip_spread_k': 0.9859497579928768, 'spread_hl_frac': 0.0016192970561214534, 'bb_std_mult': 0.727825532518027, 'rsi_os': 8, 'rsi_ob': 71, 'vol_spike': 0.22552636658140168, 'adx_thresh': 30.4975304534995, 'atr_min_pct': 0.009225082189909983, 'atr_max_pct': 0.08884603038734393, 'tp_mult': 1.328510597805121, 'tsl_mult': 0.09984210850330782, 'strategy': 'breakout', 'time_stop': 82, 'use_sma': False, 'use_atr': False, 'use_adx': False, 'use_ema': False, 'use_spike': False, 'rsi_required': False, 'edge_k': 0.6620464560061796, 'edge_cap': 0.9437450374630351}.
[I 2025-08-29 21:48:02,895] Trial 81 finished with values: [-1000000000.0, 1000000000.0] and parameters: {'p_sma': 22, 'p_std': 39, 'p_atr': 30, 'p_adx': 15, 'rsi_period': 17, 'ema1': 28, 'ema2': 37, 'slip_atr_k': 0.024218265018615584, 'slip_spread_k': 0.7110567026599732, 'spread_hl_frac': 0.0019471660273517703, 'bb_std_mult': 2.351022405586612, 'rsi_os': 8, 'rsi_ob': 83, 'vol_spike': 0.05312600467178878, 'adx_thresh': 17.60447415264766, 'atr_min_pct': 0.008941866122449437, 'atr_max_pct': 0.08691551985947762, 'tp_mult': 1.3461219863196627, 'tsl_mult': 0.9121132802248936, 'strategy': 'breakout', 'time_stop': 195, 'use_sma': False, 'use_atr': False, 'use_adx': False, 'use_ema': False, 'use_spike': False, 'rsi_required': False, 'edge_k': 0.7079329837245556, 'edge_cap': 0.6264423769751088}.
[I 2025-08-29 21:48:29,101] Trial 83 finished with values: [-1000000000.0, 1000000000.0] and parameters: {'p_sma': 30, 'p_std': 40, 'p_atr': 30, 'p_adx': 27, 'rsi_period': 7, 'ema1': 29, 'ema2': 37, 'slip_atr_k': 0.02260648802148186, 'slip_spread_k': 0.995494151286533, 'spread_hl_frac': 0.04646176281271601, 'bb_std_mult': 1.726949543676137, 'rsi_os': 21, 'rsi_ob': 81, 'vol_spike': 0.05388641947257046, 'adx_thresh': 17.245158266254442, 'atr_min_pct': 0.009220601599839204, 'atr_max_pct': 0.11686225770605532, 'tp_mult': 1.3117326973031729, 'tsl_mult': 0.7705805153553832, 'strategy': 'breakout', 'time_stop': 191, 'use_sma': False, 'use_atr': False, 'use_adx': False, 'use_ema': False, 'use_spike': False, 'rsi_required': False, 'edge_k': 0.8877837415098264, 'edge_cap': 0.9847853764914637}.
[I 2025-08-29 21:48:30,088] Trial 86 finished with values: [-0.002269917795846177, 0.0026206392791537866] and parameters: {'p_sma': 8, 'p_std': 57, 'p_atr': 29, 'p_adx': 29, 'rsi_period': 22, 'ema1': 27, 'ema2': 55, 'slip_atr_k': 0.008983305534546066, 'slip_spread_k': 0.8384514990225312, 'spread_hl_frac': 0.004519717427105958, 'bb_std_mult': 0.5575988591354025, 'rsi_os': 26, 'rsi_ob': 60, 'vol_spike': 0.1761613834269548, 'adx_thresh': 27.68577077669736, 'atr_min_pct': 0.0007425789297068476, 'atr_max_pct': 0.12678131071373921, 'tp_mult': 2.491104783447933, 'tsl_mult': 0.8074822934242649, 'strategy': 'breakout', 'time_stop': 116, 'use_sma': False, 'use_atr': False, 'use_adx': False, 'use_ema': False, 'use_spike': False, 'rsi_required': False, 'edge_k': 0.3656339504375781, 'edge_cap': 0.8172732910924155}.
[I 2025-08-29 21:48:30,273] Trial 84 finished with values: [-0.01108946514724718, 0.0110619477538865] and parameters: {'p_sma': 10, 'p_std': 21, 'p_atr': 30, 'p_adx': 30, 'rsi_period': 22, 'ema1': 27, 'ema2': 12, 'slip_atr_k': 0.01129033671891128, 'slip_spread_k': 0.8293225457000768, 'spread_hl_frac': 0.04591526297400304, 'bb_std_mult': 0.510242584297518, 'rsi_os': 26, 'rsi_ob': 60, 'vol_spike': 0.05418330984094334, 'adx_thresh': 21.18044238721226, 'atr_min_pct': 0.0009606594204192957, 'atr_max_pct': 0.08110312061007507, 'tp_mult': 1.1381417476707172, 'tsl_mult': 0.7837986366305594, 'strategy': 'breakout', 'time_stop': 256, 'use_sma': False, 'use_atr': False, 'use_adx': False, 'use_ema': False, 'use_spike': False, 'rsi_required': False, 'edge_k': 0.6935782801321876, 'edge_cap': 0.930944101390417}.
[I 2025-08-29 21:48:30,274] Trial 85 finished with values: [-0.006870658286022069, 0.006856611642917813] and parameters: {'p_sma': 9, 'p_std': 29, 'p_atr': 30, 'p_adx': 29, 'rsi_period': 18, 'ema1': 27, 'ema2': 23, 'slip_atr_k': 0.01113820510447322, 'slip_spread_k': 0.830310743910756, 'spread_hl_frac': 0.04697036892742912, 'bb_std_mult': 0.565893622729787, 'rsi_os': 26, 'rsi_ob': 82, 'vol_spike': 0.046388538381521516, 'adx_thresh': 27.04484963959972, 'atr_min_pct': 0.0008096413843570311, 'atr_max_pct': 0.08096370700812136, 'tp_mult': 1.0855046732298805, 'tsl_mult': 0.7859517963652642, 'strategy': 'breakout', 'time_stop': 119, 'use_sma': False, 'use_atr': False, 'use_adx': False, 'use_ema': False, 'use_spike': False, 'rsi_required': False, 'edge_k': 0.3652210413243836, 'edge_cap': 0.8128049951122106}.
[I 2025-08-29 21:48:57,739] Trial 90 finished with values: [-1000000000.0, 1000000000.0] and parameters: {'p_sma': 26, 'p_std': 33, 'p_atr': 29, 'p_adx': 23, 'rsi_period': 81, 'ema1': 14, 'ema2': 16, 'slip_atr_k': 0.033251962997346174, 'slip_spread_k': 0.8813816708634632, 'spread_hl_frac': 0.0172338919327746, 'bb_std_mult': 1.0429941420868334, 'rsi_os': 29, 'rsi_ob': 63, 'vol_spike': 0.16086707666152777, 'adx_thresh': 31.98026788242919, 'atr_min_pct': 0.010311950678140166, 'atr_max_pct': 0.10007658804081478, 'tp_mult': 2.6014220501705774, 'tsl_mult': 0.8208199628184761, 'strategy': 'mean_reversion', 'time_stop': 5, 'use_sma': False, 'use_atr': False, 'use_adx': False, 'use_ema': False, 'use_spike': False, 'rsi_required': False, 'edge_k': 1.0313834007561233, 'edge_cap': 0.875233529381449}.
[I 2025-08-29 21:48:57,739] Trial 89 finished with values: [-0.015942876249318783, 0.015918874616605946] and parameters: {'p_sma': 26, 'p_std': 34, 'p_atr': 29, 'p_adx': 7, 'rsi_period': 15, 'ema1': 21, 'ema2': 52, 'slip_atr_k': 0.03502033333079887, 'slip_spread_k': 0.08866482935617742, 'spread_hl_frac': 0.004515954094874408, 'bb_std_mult': 1.2567348710940054, 'rsi_os': 28, 'rsi_ob': 52, 'vol_spike': 0.18009197942752644, 'adx_thresh': 31.915011889504896, 'atr_min_pct': 0.0030534156804344894, 'atr_max_pct': 0.12696429227331046, 'tp_mult': 2.4864925731238716, 'tsl_mult': 0.530643232930969, 'strategy': 'mean_reversion', 'time_stop': 140, 'use_sma': False, 'use_atr': False, 'use_adx': False, 'use_ema': False, 'use_spike': False, 'rsi_required': False, 'edge_k': 0.10357604315550273, 'edge_cap': 0.8922587415897869}.
[I 2025-08-29 21:48:57,931] Trial 87 finished with values: [-0.0037448711657412925, 0.004016831724186207] and parameters: {'p_sma': 9, 'p_std': 21, 'p_atr': 22, 'p_adx': 29, 'rsi_period': 18, 'ema1': 18, 'ema2': 23, 'slip_atr_k': 0.011312614260567688, 'slip_spread_k': 0.11871126164229517, 'spread_hl_frac': 0.00440766157258548, 'bb_std_mult': 0.5636304937617036, 'rsi_os': 26, 'rsi_ob': 61, 'vol_spike': 0.13416829817260797, 'adx_thresh': 30.663872930497618, 'atr_min_pct': 0.001372617280791503, 'atr_max_pct': 0.10167867164822884, 'tp_mult': 1.1453635471830148, 'tsl_mult': 0.8124644979377234, 'strategy': 'breakout', 'time_stop': 119, 'use_sma': False, 'use_atr': False, 'use_adx': False, 'use_ema': False, 'use_spike': False, 'rsi_required': False, 'edge_k': 0.4959212295347312, 'edge_cap': 0.38197717022563293}.
[I 2025-08-29 21:48:58,056] Trial 88 finished with values: [-0.004533193898451082, 0.004502838298331926] and parameters: {'p_sma': 26, 'p_std': 21, 'p_atr': 8, 'p_adx': 29, 'rsi_period': 80, 'ema1': 27, 'ema2': 52, 'slip_atr_k': 0.03226621583937196, 'slip_spread_k': 0.13128189231508708, 'spread_hl_frac': 0.017809717462022392, 'bb_std_mult': 2.0972385463582417, 'rsi_os': 26, 'rsi_ob': 60, 'vol_spike': 0.2090878996820485, 'adx_thresh': 27.216126448569756, 'atr_min_pct': 0.0008211380792961889, 'atr_max_pct': 0.10139630224936053, 'tp_mult': 1.1471512459431634, 'tsl_mult': 0.5410258361587629, 'strategy': 'breakout', 'time_stop': 68, 'use_sma': False, 'use_atr': False, 'use_adx': False, 'use_ema': False, 'use_spike': False, 'rsi_required': False, 'edge_k': 1.007615854235992, 'edge_cap': 0.8157242041229084}.
[I 2025-08-29 21:48:58,151] Trial 92 finished with values: [-1000000000.0, 1000000000.0] and parameters: {'p_sma': 53, 'p_std': 51, 'p_atr': 26, 'p_adx': 29, 'rsi_period': 21, 'ema1': 17, 'ema2': 56, 'slip_atr_k': 0.049245083748167495, 'slip_spread_k': 0.2082422423141499, 'spread_hl_frac': 0.013684760236392287, 'bb_std_mult': 2.1200963140236575, 'rsi_os': 20, 'rsi_ob': 67, 'vol_spike': 0.016544316968510248, 'adx_thresh': 33.14106982110505, 'atr_min_pct': 0.022651994819508643, 'atr_max_pct': 0.01606756036134868, 'tp_mult': 2.81935501791902, 'tsl_mult': 0.44215838062866764, 'strategy': 'breakout', 'time_stop': 68, 'use_sma': False, 'use_atr': False, 'use_adx': False, 'use_ema': False, 'use_spike': False, 'rsi_required': False, 'edge_k': 0.4753240000220885, 'edge_cap': 0.6803700484465804}.
[I 2025-08-29 21:49:25,351] Trial 93 finished with values: [-1000000000.0, 1000000000.0] and parameters: {'p_sma': 7, 'p_std': 58, 'p_atr': 8, 'p_adx': 11, 'rsi_period': 33, 'ema1': 25, 'ema2': 56, 'slip_atr_k': 0.04417034649494875, 'slip_spread_k': 0.21086893137361906, 'spread_hl_frac': 0.04407546602439947, 'bb_std_mult': 2.070474426903388, 'rsi_os': 20, 'rsi_ob': 58, 'vol_spike': 0.21040448791212482, 'adx_thresh': 27.682468785430103, 'atr_min_pct': 0.02011940071887547, 'atr_max_pct': 0.02015659099337344, 'tp_mult': 1.0739944477001244, 'tsl_mult': 0.44564781561198596, 'strategy': 'breakout', 'time_stop': 65, 'use_sma': False, 'use_atr': False, 'use_adx': False, 'use_ema': False, 'use_spike': False, 'rsi_required': False, 'edge_k': 1.9044273936013902, 'edge_cap': 0.6849474790763466}.
[I 2025-08-29 21:49:25,376] Trial 95 finished with values: [-1000000000.0, 1000000000.0] and parameters: {'p_sma': 7, 'p_std': 26, 'p_atr': 22, 'p_adx': 25, 'rsi_period': 26, 'ema1': 25, 'ema2': 18, 'slip_atr_k': 0.22971575691507934, 'slip_spread_k': 0.6228319551373447, 'spread_hl_frac': 0.03810462982229105, 'bb_std_mult': 1.561936367977986, 'rsi_os': 22, 'rsi_ob': 79, 'vol_spike': 0.1946364265506971, 'adx_thresh': 30.672743031539834, 'atr_min_pct': 0.02965791354330321, 'atr_max_pct': 0.0346935357836203, 'tp_mult': 1.238670087786273, 'tsl_mult': 0.8196265551792115, 'strategy': 'breakout', 'time_stop': 21, 'use_sma': False, 'use_atr': False, 'use_adx': False, 'use_ema': False, 'use_spike': False, 'rsi_required': False, 'edge_k': 0.2709498567240085, 'edge_cap': 0.8547800966861864}.
[I 2025-08-29 21:49:25,451] Trial 91 finished with values: [-1000000000.0, 1000000000.0] and parameters: {'p_sma': 7, 'p_std': 58, 'p_atr': 26, 'p_adx': 29, 'rsi_period': 21, 'ema1': 17, 'ema2': 57, 'slip_atr_k': 0.04109255624773498, 'slip_spread_k': 0.2019681230908697, 'spread_hl_frac': 0.026404473246996244, 'bb_std_mult': 1.5684652283395675, 'rsi_os': 20, 'rsi_ob': 58, 'vol_spike': 0.2110716126046729, 'adx_thresh': 30.811331210902477, 'atr_min_pct': 0.023461599709286414, 'atr_max_pct': 0.13817909870376777, 'tp_mult': 2.030052497439387, 'tsl_mult': 0.44011757941523266, 'strategy': 'breakout', 'time_stop': 159, 'use_sma': False, 'use_atr': False, 'use_adx': False, 'use_ema': False, 'use_spike': False, 'rsi_required': False, 'edge_k': 1.896992740485327, 'edge_cap': 0.6718278729285105}.
[I 2025-08-29 21:49:25,567] Trial 94 finished with values: [-0.04274745191740226, 0.042740225342028815] and parameters: {'p_sma': 8, 'p_std': 51, 'p_atr': 22, 'p_adx': 11, 'rsi_period': 21, 'ema1': 18, 'ema2': 18, 'slip_atr_k': 0.07333475850815707, 'slip_spread_k': 0.19835867984722366, 'spread_hl_frac': 0.013584598879141164, 'bb_std_mult': 0.9027061456617962, 'rsi_os': 42, 'rsi_ob': 78, 'vol_spike': 0.19402700647839913, 'adx_thresh': 30.791253404010742, 'atr_min_pct': 4.36641554431615e-05, 'atr_max_pct': 0.05840310857484575, 'tp_mult': 2.043756996960212, 'tsl_mult': 0.2810720170402037, 'strategy': 'breakout', 'time_stop': 105, 'use_sma': False, 'use_atr': False, 'use_adx': False, 'use_ema': False, 'use_spike': False, 'rsi_required': False, 'edge_k': 0.49285397450937873, 'edge_cap': 0.7770180278010003}.
[I 2025-08-29 21:49:52,265] Trial 98 finished with values: [-1000000000.0, 1000000000.0] and parameters: {'p_sma': 12, 'p_std': 27, 'p_atr': 29, 'p_adx': 26, 'rsi_period': 14, 'ema1': 24, 'ema2': 29, 'slip_atr_k': 0.006833493338096224, 'slip_spread_k': 0.8962183086066497, 'spread_hl_frac': 0.004729398881871964, 'bb_std_mult': 1.2159769076350782, 'rsi_os': 24, 'rsi_ob': 75, 'vol_spike': 0.18585568342702904, 'adx_thresh': 5.000810557409297, 'atr_min_pct': 0.017610175211220238, 'atr_max_pct': 0.05785561075849163, 'tp_mult': 1.6576175628279275, 'tsl_mult': 0.2074805320329155, 'strategy': 'mean_reversion', 'time_stop': 104, 'use_sma': False, 'use_atr': False, 'use_adx': False, 'use_ema': False, 'use_spike': False, 'rsi_required': False, 'edge_k': 0.49303959428114613, 'edge_cap': 0.7765860422074922}.
[I 2025-08-29 21:49:52,799] Trial 99 finished with values: [-1000000000.0, 1000000000.0] and parameters: {'p_sma': 13, 'p_std': 27, 'p_atr': 29, 'p_adx': 24, 'rsi_period': 14, 'ema1': 24, 'ema2': 40, 'slip_atr_k': 0.005683076972810111, 'slip_spread_k': 0.6555117638949747, 'spread_hl_frac': 0.010079397213007492, 'bb_std_mult': 3.087484739495555, 'rsi_os': 23, 'rsi_ob': 92, 'vol_spike': 0.13553549475140003, 'adx_thresh': 29.42623604077193, 'atr_min_pct': 0.003421230858890992, 'atr_max_pct': 0.09170161741932592, 'tp_mult': 1.2185866190787844, 'tsl_mult': 0.21818514314182103, 'strategy': 'mean_reversion', 'time_stop': 94, 'use_sma': False, 'use_atr': False, 'use_adx': False, 'use_ema': False, 'use_spike': False, 'rsi_required': False, 'edge_k': 1.083178194048432, 'edge_cap': 0.3797678353640592}.
[I 2025-08-29 21:49:52,805] Trial 97 finished with values: [-0.006941116292607186, 0.006919800970515814] and parameters: {'p_sma': 12, 'p_std': 27, 'p_atr': 29, 'p_adx': 26, 'rsi_period': 22, 'ema1': 24, 'ema2': 40, 'slip_atr_k': 0.07540865724012841, 'slip_spread_k': 0.8800952996878569, 'spread_hl_frac': 0.00985287314230374, 'bb_std_mult': 0.9040193360138893, 'rsi_os': 23, 'rsi_ob': 64, 'vol_spike': 0.1751883508213816, 'adx_thresh': 29.596320272167205, 'atr_min_pct': 3.1685180126900204e-05, 'atr_max_pct': 0.11443269422067677, 'tp_mult': 1.2371884119036551, 'tsl_mult': 0.9717223570169565, 'strategy': 'breakout', 'time_stop': 107, 'use_sma': False, 'use_atr': False, 'use_adx': False, 'use_ema': False, 'use_spike': False, 'rsi_required': False, 'edge_k': 1.6484862752449025, 'edge_cap': 0.7706797949451528}.
[I 2025-08-29 21:49:52,897] Trial 96 finished with values: [-1000000000.0, 1000000000.0] and parameters: {'p_sma': 14, 'p_std': 27, 'p_atr': 13, 'p_adx': 26, 'rsi_period': 37, 'ema1': 24, 'ema2': 30, 'slip_atr_k': 0.07620798077398544, 'slip_spread_k': 0.7850652450674906, 'spread_hl_frac': 0.02679126891732685, 'bb_std_mult': 0.920518313236264, 'rsi_os': 24, 'rsi_ob': 64, 'vol_spike': 0.17301336121955171, 'adx_thresh': 5.0981816185345785, 'atr_min_pct': 0.0034420062314174287, 'atr_max_pct': 0.09181597597198947, 'tp_mult': 1.6309910517461583, 'tsl_mult': 0.7592039110329, 'strategy': 'breakout', 'time_stop': 105, 'use_sma': False, 'use_atr': False, 'use_adx': False, 'use_ema': False, 'use_spike': False, 'rsi_required': False, 'edge_k': 0.5137296064333936, 'edge_cap': 0.4773868484669149}.
[I 2025-08-29 21:50:20,260] Trial 102 finished with values: [-1000000000.0, 1000000000.0] and parameters: {'p_sma': 5, 'p_std': 36, 'p_atr': 14, 'p_adx': 30, 'rsi_period': 38, 'ema1': 6, 'ema2': 15, 'slip_atr_k': 0.13593948928355445, 'slip_spread_k': 0.43418078085457595, 'spread_hl_frac': 0.03942953028888718, 'bb_std_mult': 1.7209181295225684, 'rsi_os': 30, 'rsi_ob': 66, 'vol_spike': 0.1617315306034618, 'adx_thresh': 19.436779769030984, 'atr_min_pct': 0.004603964204669496, 'atr_max_pct': 0.08371244695735611, 'tp_mult': 1.160619518977747, 'tsl_mult': 0.7601764488751638, 'strategy': 'breakout', 'time_stop': 218, 'use_sma': False, 'use_atr': False, 'use_adx': False, 'use_ema': False, 'use_spike': False, 'rsi_required': False, 'edge_k': 1.8218983668505713, 'edge_cap': 0.5037057551087023}.
[I 2025-08-29 21:50:20,349] Trial 100 finished with values: [-0.02107202326837776, 0.02106848849559019] and parameters: {'p_sma': 12, 'p_std': 7, 'p_atr': 15, 'p_adx': 24, 'rsi_period': 10, 'ema1': 22, 'ema2': 22, 'slip_atr_k': 0.020393811446263788, 'slip_spread_k': 0.7897853586619519, 'spread_hl_frac': 0.039515917991148036, 'bb_std_mult': 0.9065604158008829, 'rsi_os': 30, 'rsi_ob': 64, 'vol_spike': 0.13585073604699055, 'adx_thresh': 19.576366736513524, 'atr_min_pct': 0.003244999843992208, 'atr_max_pct': 0.11417248468254855, 'tp_mult': 1.2095433087492546, 'tsl_mult': 0.7537328668484401, 'strategy': 'breakout', 'time_stop': 113, 'use_sma': False, 'use_atr': False, 'use_adx': False, 'use_ema': False, 'use_spike': False, 'rsi_required': False, 'edge_k': 0.35318933529897767, 'edge_cap': 0.7353894406108231}.
[I 2025-08-29 21:50:20,512] Trial 101 finished with values: [-0.015895593550538045, 0.015877159107321664] and parameters: {'p_sma': 6, 'p_std': 8, 'p_atr': 14, 'p_adx': 21, 'rsi_period': 25, 'ema1': 21, 'ema2': 15, 'slip_atr_k': 0.022261420991510246, 'slip_spread_k': 0.3158283668320413, 'spread_hl_frac': 0.020227728561268143, 'bb_std_mult': 1.6781979322781084, 'rsi_os': 30, 'rsi_ob': 60, 'vol_spike': 0.1572336836386211, 'adx_thresh': 11.387920577983905, 'atr_min_pct': 0.001443248879939948, 'atr_max_pct': 0.08332164386060925, 'tp_mult': 2.953161163782212, 'tsl_mult': 0.7319077286609245, 'strategy': 'breakout', 'time_stop': 114, 'use_sma': False, 'use_atr': False, 'use_adx': False, 'use_ema': False, 'use_spike': False, 'rsi_required': False, 'edge_k': 0.3701371893594868, 'edge_cap': 0.7336988677306515}.
[I 2025-08-29 21:50:20,705] Trial 103 finished with values: [-0.0648515280792864, 0.06482752795328707] and parameters: {'p_sma': 11, 'p_std': 19, 'p_atr': 15, 'p_adx': 30, 'rsi_period': 18, 'ema1': 15, 'ema2': 15, 'slip_atr_k': 0.020683754536474218, 'slip_spread_k': 0.8324195728517894, 'spread_hl_frac': 0.01970404121441792, 'bb_std_mult': 1.7062467254120135, 'rsi_os': 47, 'rsi_ob': 60, 'vol_spike': 0.14965586092833666, 'adx_thresh': 11.797243455058098, 'atr_min_pct': 0.0013665791827347634, 'atr_max_pct': 0.04556940863293012, 'tp_mult': 2.919216296615393, 'tsl_mult': 0.6517772598510776, 'strategy': 'breakout', 'time_stop': 226, 'use_sma': False, 'use_atr': False, 'use_adx': False, 'use_ema': False, 'use_spike': False, 'rsi_required': False, 'edge_k': 0.3564360170966546, 'edge_cap': 0.7374656983160812}.
[I 2025-08-29 21:50:47,533] Trial 107 finished with values: [-1000000000.0, 1000000000.0] and parameters: {'p_sma': 9, 'p_std': 22, 'p_atr': 30, 'p_adx': 28, 'rsi_period': 79, 'ema1': 25, 'ema2': 24, 'slip_atr_k': 0.030764299761982295, 'slip_spread_k': 0.5891016295625777, 'spread_hl_frac': 0.01711923160629275, 'bb_std_mult': 1.4130775954960693, 'rsi_os': 27, 'rsi_ob': 62, 'vol_spike': 0.18388683863005129, 'adx_thresh': 14.862851887258604, 'atr_min_pct': 0.01142890912695916, 'atr_max_pct': 0.10910730291382334, 'tp_mult': 1.8989855332926846, 'tsl_mult': 0.8414327968976143, 'strategy': 'mean_reversion', 'time_stop': 130, 'use_sma': False, 'use_atr': False, 'use_adx': False, 'use_ema': False, 'use_spike': False, 'rsi_required': False, 'edge_k': 0.6057296768384327, 'edge_cap': 0.8226967259996362}.
[I 2025-08-29 21:50:47,626] Trial 106 finished with values: [-0.08451280694828633, 0.08448740225758317] and parameters: {'p_sma': 9, 'p_std': 22, 'p_atr': 10, 'p_adx': 12, 'rsi_period': 18, 'ema1': 15, 'ema2': 60, 'slip_atr_k': 0.15858359928514426, 'slip_spread_k': 0.8228809496014918, 'spread_hl_frac': 0.03239275494830544, 'bb_std_mult': 2.6416495346570636, 'rsi_os': 47, 'rsi_ob': 60, 'vol_spike': 0.18553357711182705, 'adx_thresh': 14.791230668818166, 'atr_min_pct': 0.0013368483509690959, 'atr_max_pct': 0.10466133666395834, 'tp_mult': 1.1442836841051311, 'tsl_mult': 0.6880523350014, 'strategy': 'breakout', 'time_stop': 126, 'use_sma': False, 'use_atr': False, 'use_adx': False, 'use_ema': False, 'use_spike': False, 'rsi_required': False, 'edge_k': 0.5858204949079975, 'edge_cap': 0.8201458186362918}.
[I 2025-08-29 21:50:47,785] Trial 105 finished with values: [-0.007891377625072526, 0.0078625442417465] and parameters: {'p_sma': 9, 'p_std': 21, 'p_atr': 30, 'p_adx': 21, 'rsi_period': 19, 'ema1': 25, 'ema2': 24, 'slip_atr_k': 0.15198465547712176, 'slip_spread_k': 0.1006308867878416, 'spread_hl_frac': 0.01726307626654409, 'bb_std_mult': 2.341702980951136, 'rsi_os': 25, 'rsi_ob': 60, 'vol_spike': 0.15436030308806353, 'adx_thresh': 33.003380385259796, 'atr_min_pct': 0.0011738795632154568, 'atr_max_pct': 0.10527092289039336, 'tp_mult': 1.1433976335563694, 'tsl_mult': 0.8469410145672148, 'strategy': 'breakout', 'time_stop': 127, 'use_sma': False, 'use_atr': False, 'use_adx': False, 'use_ema': False, 'use_spike': False, 'rsi_required': False, 'edge_k': 0.5953502584630093, 'edge_cap': 0.8194800047815679}.
[I 2025-08-29 21:50:47,796] Trial 104 finished with values: [-0.09301974028165783, 0.09299801722729988] and parameters: {'p_sma': 9, 'p_std': 9, 'p_atr': 30, 'p_adx': 21, 'rsi_period': 79, 'ema1': 15, 'ema2': 22, 'slip_atr_k': 0.020363838821321534, 'slip_spread_k': 0.8205829886868656, 'spread_hl_frac': 0.020045790154980644, 'bb_std_mult': 1.93620244135183, 'rsi_os': 48, 'rsi_ob': 60, 'vol_spike': 0.28313516804596217, 'adx_thresh': 11.402767852759611, 'atr_min_pct': 0.001001986215524572, 'atr_max_pct': 0.10527220338869464, 'tp_mult': 1.135641626444798, 'tsl_mult': 0.6796975774929802, 'strategy': 'breakout', 'time_stop': 121, 'use_sma': False, 'use_atr': False, 'use_adx': False, 'use_ema': False, 'use_spike': False, 'rsi_required': False, 'edge_k': 0.3575888443442157, 'edge_cap': 0.8215709040587726}.
