[I 2025-08-29 23:27:56,997] Trial 1000 finished with values: [-0.014238318983090137, 0.014280152381421626] and parameters: {'p_sma': 59, 'p_std': 18, 'p_atr': 17, 'p_adx': 11, 'rsi_period': 49, 'ema1': 25, 'ema2': 45, 'slip_atr_k': 0.004832315038099883, 'slip_spread_k': 0.8458893946264209, 'spread_hl_frac': 0.014333445004801841, 'bb_std_mult': 3.487121185878582, 'rsi_os': 30, 'rsi_ob': 62, 'vol_spike': 0.1702708743169691, 'adx_thresh': 14.558307791721285, 'atr_min_pct': 0.002721785356011101, 'atr_max_pct': 0.043352047214842905, 'tp_mult': 1.165604134218689, 'tsl_mult': 0.7052498037196774, 'strategy': 'mean_reversion', 'time_stop': 245, 'use_sma': False, 'use_atr': False, 'use_adx': False, 'use_ema': False, 'use_spike': False, 'rsi_required': False, 'edge_k': 0.49006665599676913, 'edge_cap': 0.6906811741564635}.
[I 2025-08-29 23:27:57,259] Trial 1001 finished with values: [-0.009340429253070548, 0.009270316507773798] and parameters: {'p_sma': 7, 'p_std': 13, 'p_atr': 23, 'p_adx': 17, 'rsi_period': 23, 'ema1': 19, 'ema2': 20, 'slip_atr_k': 0.0198715481827378, 'slip_spread_k': 0.31875601029184564, 'spread_hl_frac': 0.017554368671215858, 'bb_std_mult': 2.1315229560145648, 'rsi_os': 23, 'rsi_ob': 62, 'vol_spike': 0.1722921429922066, 'adx_thresh': 14.853251751911749, 'atr_min_pct': 0.0026617241746357463, 'atr_max_pct': 0.10055519295908932, 'tp_mult': 1.2046010954944224, 'tsl_mult': 0.7057594738468824, 'strategy': 'mean_reversion', 'time_stop': 108, 'use_sma': False, 'use_atr': False, 'use_adx': False, 'use_ema': False, 'use_spike': False, 'rsi_required': False, 'edge_k': 0.48583279667033735, 'edge_cap': 0.5964362308441731}.
[I 2025-08-29 23:27:57,269] Trial 999 finished with values: [-0.0021709012985591247, 0.0025032414216486134] and parameters: {'p_sma': 6, 'p_std': 25, 'p_atr': 17, 'p_adx': 12, 'rsi_period': 76, 'ema1': 11, 'ema2': 45, 'slip_atr_k': 0.020526856112949604, 'slip_spread_k': 0.7599680520957444, 'spread_hl_frac': 0.026433765816597524, 'bb_std_mult': 2.5005060599954736, 'rsi_os': 29, 'rsi_ob': 62, 'vol_spike': 0.17290472938458587, 'adx_thresh': 25.204128644890712, 'atr_min_pct': 1.2252250265435468e-05, 'atr_max_pct': 0.1480942685392093, 'tp_mult': 1.45024208804365, 'tsl_mult': 0.12259634952867354, 'strategy': 'breakout', 'time_stop': 108, 'use_sma': False, 'use_atr': False, 'use_adx': False, 'use_ema': False, 'use_spike': False, 'rsi_required': False, 'edge_k': 0.46220612373455017, 'edge_cap': 0.8174254406028623}.
[I 2025-08-29 23:28:24,383] Trial 1004 finished with values: [-1000000000.0, 1000000000.0] and parameters: {'p_sma': 6, 'p_std': 23, 'p_atr': 23, 'p_adx': 16, 'rsi_period': 19, 'ema1': 23, 'ema2': 53, 'slip_atr_k': 0.023910325666568394, 'slip_spread_k': 0.9153502355482885, 'spread_hl_frac': 0.008291314614622024, 'bb_std_mult': 2.2165409136232745, 'rsi_os': 26, 'rsi_ob': 92, 'vol_spike': 0.22911247155985653, 'adx_thresh': 24.425899011898785, 'atr_min_pct': 0.014045033015963722, 'atr_max_pct': 0.1335738808675309, 'tp_mult': 1.1924217283404255, 'tsl_mult': 0.6782832976368807, 'strategy': 'breakout', 'time_stop': 237, 'use_sma': False, 'use_atr': False, 'use_adx': False, 'use_ema': False, 'use_spike': False, 'rsi_required': False, 'edge_k': 0.039996496280394145, 'edge_cap': 0.8182610231646256}.
[I 2025-08-29 23:28:24,858] Trial 1003 finished with values: [-1000000000.0, 1000000000.0] and parameters: {'p_sma': 7, 'p_std': 13, 'p_atr': 23, 'p_adx': 16, 'rsi_period': 23, 'ema1': 23, 'ema2': 47, 'slip_atr_k': 0.019601494702623103, 'slip_spread_k': 0.9181219072653212, 'spread_hl_frac': 0.02973820607466109, 'bb_std_mult': 2.5067047496576023, 'rsi_os': 23, 'rsi_ob': 60, 'vol_spike': 0.19368793343987636, 'adx_thresh': 25.1788362535331, 'atr_min_pct': 0.014214022478092518, 'atr_max_pct': 0.1011209136610274, 'tp_mult': 1.2202356497766436, 'tsl_mult': 0.6795241363225861, 'strategy': 'breakout', 'time_stop': 112, 'use_sma': False, 'use_atr': False, 'use_adx': False, 'use_ema': False, 'use_spike': False, 'rsi_required': False, 'edge_k': 0.5485064519747935, 'edge_cap': 0.585727877357055}.
[I 2025-08-29 23:28:24,886] Trial 1005 finished with values: [-0.0034837992632740233, 0.0034709981419469827] and parameters: {'p_sma': 6, 'p_std': 25, 'p_atr': 27, 'p_adx': 12, 'rsi_period': 79, 'ema1': 23, 'ema2': 53, 'slip_atr_k': 0.20473554799342808, 'slip_spread_k': 0.4304064675981423, 'spread_hl_frac': 0.018800765723856982, 'bb_std_mult': 1.9804210048788717, 'rsi_os': 26, 'rsi_ob': 93, 'vol_spike': 0.16248793414825513, 'adx_thresh': 25.008485114628716, 'atr_min_pct': 0.0005044738162098164, 'atr_max_pct': 0.13455274993690614, 'tp_mult': 1.4402038708096083, 'tsl_mult': 0.2793480513847706, 'strategy': 'breakout', 'time_stop': 113, 'use_sma': False, 'use_atr': False, 'use_adx': False, 'use_ema': False, 'use_spike': False, 'rsi_required': False, 'edge_k': 0.5494061007166486, 'edge_cap': 0.33616773784138343}.
[I 2025-08-29 23:28:25,049] Trial 1002 finished with values: [-1000000000.0, 1000000000.0] and parameters: {'p_sma': 7, 'p_std': 25, 'p_atr': 23, 'p_adx': 13, 'rsi_period': 23, 'ema1': 23, 'ema2': 45, 'slip_atr_k': 0.005867845444214977, 'slip_spread_k': 0.8591977771499544, 'spread_hl_frac': 0.01401469382087045, 'bb_std_mult': 2.215586113005281, 'rsi_os': 26, 'rsi_ob': 92, 'vol_spike': 0.22587653400777588, 'adx_thresh': 14.746546720908876, 'atr_min_pct': 0.002611242648899304, 'atr_max_pct': 0.09936983929400033, 'tp_mult': 1.4538510289687916, 'tsl_mult': 0.2638258077345139, 'strategy': 'mean_reversion', 'time_stop': 113, 'use_sma': False, 'use_atr': False, 'use_adx': False, 'use_ema': False, 'use_spike': False, 'rsi_required': False, 'edge_k': 0.5017575022731219, 'edge_cap': 0.32075580110397484}.
[I 2025-08-29 23:28:51,901] Trial 1006 finished with values: [-1000000000.0, 1000000000.0] and parameters: {'p_sma': 5, 'p_std': 25, 'p_atr': 23, 'p_adx': 14, 'rsi_period': 79, 'ema1': 13, 'ema2': 57, 'slip_atr_k': 0.23292174547240013, 'slip_spread_k': 0.810145965944712, 'spread_hl_frac': 0.02637225406680966, 'bb_std_mult': 2.5033727383281246, 'rsi_os': 26, 'rsi_ob': 58, 'vol_spike': 0.1290740879921579, 'adx_thresh': 26.909147283054008, 'atr_min_pct': 0.0005009166625163251, 'atr_max_pct': 0.09651118516348624, 'tp_mult': 1.90688883776008, 'tsl_mult': 0.2514213137941742, 'strategy': 'breakout', 'time_stop': 30, 'use_sma': False, 'use_atr': False, 'use_adx': False, 'use_ema': False, 'use_spike': False, 'rsi_required': False, 'edge_k': 0.5483661264883907, 'edge_cap': 0.32442310752320846}.
[I 2025-08-29 23:28:52,392] Trial 1008 finished with values: [-1000000000.0, 1000000000.0] and parameters: {'p_sma': 9, 'p_std': 25, 'p_atr': 24, 'p_adx': 14, 'rsi_period': 62, 'ema1': 9, 'ema2': 56, 'slip_atr_k': 0.03677993202686709, 'slip_spread_k': 0.7567104951063137, 'spread_hl_frac': 0.017012133459328865, 'bb_std_mult': 2.096435793583693, 'rsi_os': 25, 'rsi_ob': 73, 'vol_spike': 0.17801485827808483, 'adx_thresh': 22.229373453346465, 'atr_min_pct': 0.00214477797538568, 'atr_max_pct': 0.09652349992067197, 'tp_mult': 1.1254484542269987, 'tsl_mult': 0.1953078079709749, 'strategy': 'mean_reversion', 'time_stop': 101, 'use_sma': False, 'use_atr': False, 'use_adx': False, 'use_ema': False, 'use_spike': False, 'rsi_required': False, 'edge_k': 1.4787008929263445, 'edge_cap': 0.22926229148960714}.
[I 2025-08-29 23:28:52,535] Trial 1007 finished with values: [-1000000000.0, 1000000000.0] and parameters: {'p_sma': 5, 'p_std': 24, 'p_atr': 24, 'p_adx': 12, 'rsi_period': 8, 'ema1': 13, 'ema2': 56, 'slip_atr_k': 0.03817751353200159, 'slip_spread_k': 0.19908085257884517, 'spread_hl_frac': 0.018636852011222366, 'bb_std_mult': 1.963400404365536, 'rsi_os': 25, 'rsi_ob': 58, 'vol_spike': 0.07280847617286801, 'adx_thresh': 26.815370942044854, 'atr_min_pct': 0.02643635919945018, 'atr_max_pct': 0.14814889584077168, 'tp_mult': 1.4592863974536, 'tsl_mult': 0.127414165431937, 'strategy': 'breakout', 'time_stop': 78, 'use_sma': False, 'use_atr': False, 'use_adx': False, 'use_ema': False, 'use_spike': False, 'rsi_required': False, 'edge_k': 1.5390482490804764, 'edge_cap': 0.3297122943665804}.
[I 2025-08-29 23:28:52,730] Trial 1009 finished with values: [-0.012231244141390873, 0.012203263693454619] and parameters: {'p_sma': 27, 'p_std': 6, 'p_atr': 14, 'p_adx': 15, 'rsi_period': 21, 'ema1': 11, 'ema2': 56, 'slip_atr_k': 0.014267431783491663, 'slip_spread_k': 0.8202774037016172, 'spread_hl_frac': 0.02081001045447888, 'bb_std_mult': 2.097942207067282, 'rsi_os': 17, 'rsi_ob': 58, 'vol_spike': 0.12896095583772726, 'adx_thresh': 33.189527414902756, 'atr_min_pct': 0.0019700034909337556, 'atr_max_pct': 0.09648388691092098, 'tp_mult': 2.474657736090781, 'tsl_mult': 0.18614485498123196, 'strategy': 'breakout', 'time_stop': 101, 'use_sma': False, 'use_atr': False, 'use_adx': False, 'use_ema': False, 'use_spike': False, 'rsi_required': False, 'edge_k': 1.1452877617179236, 'edge_cap': 0.22810269408728912}.
[I 2025-08-29 23:29:19,625] Trial 1010 finished with values: [-0.033314491817167946, 0.03340673875245214] and parameters: {'p_sma': 9, 'p_std': 24, 'p_atr': 24, 'p_adx': 15, 'rsi_period': 8, 'ema1': 24, 'ema2': 55, 'slip_atr_k': 0.038634186082127, 'slip_spread_k': 0.8368508743059806, 'spread_hl_frac': 0.020651214921373257, 'bb_std_mult': 2.0885998372632213, 'rsi_os': 50, 'rsi_ob': 70, 'vol_spike': 0.17680315816649766, 'adx_thresh': 23.43290251604346, 'atr_min_pct': 0.001724352435123903, 'atr_max_pct': 0.09219317193844893, 'tp_mult': 1.6378262627104228, 'tsl_mult': 0.046874783475241766, 'strategy': 'breakout', 'time_stop': 102, 'use_sma': False, 'use_atr': False, 'use_adx': False, 'use_ema': False, 'use_spike': False, 'rsi_required': False, 'edge_k': 1.538473749471152, 'edge_cap': 0.7504010972205407}.
[I 2025-08-29 23:29:20,029] Trial 1012 finished with values: [-1000000000.0, 1000000000.0] and parameters: {'p_sma': 8, 'p_std': 27, 'p_atr': 22, 'p_adx': 15, 'rsi_period': 67, 'ema1': 15, 'ema2': 30, 'slip_atr_k': 0.014444671622379973, 'slip_spread_k': 0.6215034039803924, 'spread_hl_frac': 0.0208170480219934, 'bb_std_mult': 1.7759934752326039, 'rsi_os': 50, 'rsi_ob': 70, 'vol_spike': 0.18385867373133602, 'adx_thresh': 23.545197125829457, 'atr_min_pct': 0.007220019104842343, 'atr_max_pct': 0.0650572473697606, 'tp_mult': 1.027861168553024, 'tsl_mult': 0.7449546883828987, 'strategy': 'breakout', 'time_stop': 130, 'use_sma': False, 'use_atr': False, 'use_adx': False, 'use_ema': False, 'use_spike': False, 'rsi_required': False, 'edge_k': 0.6129320031311186, 'edge_cap': 0.05029265317962711}.
[I 2025-08-29 23:29:20,256] Trial 1013 finished with values: [-0.009013346173380676, 0.008973141551548483] and parameters: {'p_sma': 9, 'p_std': 39, 'p_atr': 21, 'p_adx': 17, 'rsi_period': 20, 'ema1': 15, 'ema2': 55, 'slip_atr_k': 0.24964736310842833, 'slip_spread_k': 0.8327681928123631, 'spread_hl_frac': 0.04347956918351069, 'bb_std_mult': 1.604160876163502, 'rsi_os': 53, 'rsi_ob': 67, 'vol_spike': 0.1954894648986837, 'adx_thresh': 23.327706140665565, 'atr_min_pct': 0.003503152123752103, 'atr_max_pct': 0.0916140473363453, 'tp_mult': 1.2801350589425422, 'tsl_mult': 0.7865821561814993, 'strategy': 'breakout', 'time_stop': 129, 'use_sma': False, 'use_atr': False, 'use_adx': False, 'use_ema': False, 'use_spike': False, 'rsi_required': False, 'edge_k': 0.4423985040318016, 'edge_cap': 0.7441417625104392}.
[I 2025-08-29 23:29:20,463] Trial 1011 finished with values: [-0.019351040268454023, 0.019324982400097952] and parameters: {'p_sma': 9, 'p_std': 6, 'p_atr': 24, 'p_adx': 15, 'rsi_period': 20, 'ema1': 24, 'ema2': 55, 'slip_atr_k': 0.07247435685315107, 'slip_spread_k': 0.1973008526407785, 'spread_hl_frac': 0.020729554569847434, 'bb_std_mult': 2.01752522588138, 'rsi_os': 50, 'rsi_ob': 60, 'vol_spike': 0.21480215588866902, 'adx_thresh': 26.540100725004567, 'atr_min_pct': 0.0033753709771151474, 'atr_max_pct': 0.07709710516346092, 'tp_mult': 1.1316733617438959, 'tsl_mult': 0.7468320822050816, 'strategy': 'breakout', 'time_stop': 129, 'use_sma': False, 'use_atr': False, 'use_adx': False, 'use_ema': False, 'use_spike': False, 'rsi_required': False, 'edge_k': 0.9777751394277406, 'edge_cap': 0.7423470589821616}.
[I 2025-08-29 23:29:47,660] Trial 1017 finished with values: [-1000000000.0, 1000000000.0] and parameters: {'p_sma': 33, 'p_std': 57, 'p_atr': 18, 'p_adx': 16, 'rsi_period': 16, 'ema1': 16, 'ema2': 14, 'slip_atr_k': 0.15500325804325601, 'slip_spread_k': 0.9632346323882499, 'spread_hl_frac': 0.0344871441003913, 'bb_std_mult': 2.153097609356747, 'rsi_os': 37, 'rsi_ob': 61, 'vol_spike': 0.15866128772124358, 'adx_thresh': 29.97022304648059, 'atr_min_pct': 0.004698093074444663, 'atr_max_pct': 0.11304062238725211, 'tp_mult': 1.0637636583455936, 'tsl_mult': 0.7235190050992941, 'strategy': 'mean_reversion', 'time_stop': 92, 'use_sma': False, 'use_atr': False, 'use_adx': False, 'use_ema': False, 'use_spike': False, 'rsi_required': False, 'edge_k': 0.5070189833825789, 'edge_cap': 0.8133274666364814}.
[I 2025-08-29 23:29:47,946] Trial 1016 finished with values: [-1000000000.0, 1000000000.0] and parameters: {'p_sma': 32, 'p_std': 42, 'p_atr': 23, 'p_adx': 25, 'rsi_period': 18, 'ema1': 25, 'ema2': 53, 'slip_atr_k': 0.02422464160480924, 'slip_spread_k': 0.516489963080485, 'spread_hl_frac': 0.01758580921574578, 'bb_std_mult': 1.373949908394224, 'rsi_os': 28, 'rsi_ob': 60, 'vol_spike': 0.18488193724092702, 'adx_thresh': 29.828926824171006, 'atr_min_pct': 0.0033396107634356925, 'atr_max_pct': 0.08524819605049465, 'tp_mult': 1.748805355823913, 'tsl_mult': 0.7261091670377361, 'strategy': 'mean_reversion', 'time_stop': 187, 'use_sma': False, 'use_atr': False, 'use_adx': False, 'use_ema': False, 'use_spike': False, 'rsi_required': False, 'edge_k': 0.5146154453225501, 'edge_cap': 0.8407157891483823}.
[I 2025-08-29 23:29:48,031] Trial 1014 finished with values: [-1000000000.0, 1000000000.0] and parameters: {'p_sma': 30, 'p_std': 41, 'p_atr': 18, 'p_adx': 17, 'rsi_period': 67, 'ema1': 25, 'ema2': 51, 'slip_atr_k': 0.24981630304429248, 'slip_spread_k': 0.7975088861479062, 'spread_hl_frac': 0.017544192358323333, 'bb_std_mult': 1.7905848121929275, 'rsi_os': 37, 'rsi_ob': 66, 'vol_spike': 0.18474103603538378, 'adx_thresh': 25.65776582645716, 'atr_min_pct': 0.01929379179154503, 'atr_max_pct': 0.11696891052967114, 'tp_mult': 1.0105881245108859, 'tsl_mult': 0.7452149126197996, 'strategy': 'breakout', 'time_stop': 128, 'use_sma': False, 'use_atr': False, 'use_adx': False, 'use_ema': False, 'use_spike': False, 'rsi_required': False, 'edge_k': 0.43940817573848723, 'edge_cap': 0.8317197678931568}.
[I 2025-08-29 23:29:48,169] Trial 1015 finished with values: [-0.015016116996380169, 0.015016860625948774] and parameters: {'p_sma': 30, 'p_std': 26, 'p_atr': 19, 'p_adx': 17, 'rsi_period': 20, 'ema1': 24, 'ema2': 51, 'slip_atr_k': 0.1560809881686679, 'slip_spread_k': 0.8046963283329288, 'spread_hl_frac': 0.01747674636413855, 'bb_std_mult': 2.000992368096764, 'rsi_os': 29, 'rsi_ob': 60, 'vol_spike': 0.19603237190865552, 'adx_thresh': 29.897013913616874, 'atr_min_pct': 0.003187147490145476, 'atr_max_pct': 0.07810790760332843, 'tp_mult': 1.2668304011490052, 'tsl_mult': 0.7926069792963533, 'strategy': 'breakout', 'time_stop': 18, 'use_sma': False, 'use_atr': False, 'use_adx': False, 'use_ema': False, 'use_spike': False, 'rsi_required': False, 'edge_k': 1.8864911566320108, 'edge_cap': 0.8154085521452877}.
[I 2025-08-29 23:30:14,660] Trial 1018 finished with values: [-1000000000.0, 1000000000.0] and parameters: {'p_sma': 30, 'p_std': 26, 'p_atr': 23, 'p_adx': 25, 'rsi_period': 18, 'ema1': 24, 'ema2': 26, 'slip_atr_k': 0.024374612629814163, 'slip_spread_k': 0.8050538161144708, 'spread_hl_frac': 0.01598340476379885, 'bb_std_mult': 2.3961888030076004, 'rsi_os': 29, 'rsi_ob': 56, 'vol_spike': 0.02471644994012523, 'adx_thresh': 25.54019742714372, 'atr_min_pct': 0.019604000062936992, 'atr_max_pct': 0.10813836993821097, 'tp_mult': 1.7621016340372384, 'tsl_mult': 0.4491871144849556, 'strategy': 'breakout', 'time_stop': 120, 'use_sma': False, 'use_atr': False, 'use_adx': False, 'use_ema': False, 'use_spike': False, 'rsi_required': False, 'edge_k': 0.45112181320885975, 'edge_cap': 0.7966581723975317}.
[I 2025-08-29 23:30:15,551] Trial 1021 finished with values: [-0.022951947430652986, 0.022963287775719675] and parameters: {'p_sma': 8, 'p_std': 23, 'p_atr': 23, 'p_adx': 16, 'rsi_period': 41, 'ema1': 24, 'ema2': 54, 'slip_atr_k': 0.14442191317054398, 'slip_spread_k': 0.5449872811322356, 'spread_hl_frac': 0.004829695832124996, 'bb_std_mult': 1.9382292485137829, 'rsi_os': 47, 'rsi_ob': 54, 'vol_spike': 0.10214701547273647, 'adx_thresh': 25.09606935173877, 'atr_min_pct': 0.001984656504478677, 'atr_max_pct': 0.08889518345305028, 'tp_mult': 1.1573898582538904, 'tsl_mult': 0.44480203874273105, 'strategy': 'breakout', 'time_stop': 117, 'use_sma': False, 'use_atr': False, 'use_adx': False, 'use_ema': False, 'use_spike': False, 'rsi_required': False, 'edge_k': 0.656411519458765, 'edge_cap': 0.7880591905003203}.
[I 2025-08-29 23:30:15,551] Trial 1020 finished with values: [-0.02478853662834901, 0.024761129319142892] and parameters: {'p_sma': 17, 'p_std': 26, 'p_atr': 25, 'p_adx': 16, 'rsi_period': 11, 'ema1': 24, 'ema2': 52, 'slip_atr_k': 0.018325654177628527, 'slip_spread_k': 0.8483335822882151, 'spread_hl_frac': 0.016196733338275857, 'bb_std_mult': 2.368686321613103, 'rsi_os': 24, 'rsi_ob': 77, 'vol_spike': 0.01959885104642356, 'adx_thresh': 16.45738204314414, 'atr_min_pct': 0.0018879539145186738, 'atr_max_pct': 0.1081088730513585, 'tp_mult': 2.8267959091734514, 'tsl_mult': 0.8773286345783493, 'strategy': 'breakout', 'time_stop': 5, 'use_sma': False, 'use_atr': False, 'use_adx': False, 'use_ema': False, 'use_spike': False, 'rsi_required': False, 'edge_k': 0.5708284003834473, 'edge_cap': 0.4464800821883464}.
[I 2025-08-29 23:30:15,634] Trial 1019 finished with values: [-0.0061051741107285284, 0.006082125334455274] and parameters: {'p_sma': 14, 'p_std': 26, 'p_atr': 22, 'p_adx': 16, 'rsi_period': 21, 'ema1': 24, 'ema2': 54, 'slip_atr_k': 0.01771156629553366, 'slip_spread_k': 0.8024189731197449, 'spread_hl_frac': 0.0008732178187553959, 'bb_std_mult': 1.9750546734295211, 'rsi_os': 24, 'rsi_ob': 63, 'vol_spike': 0.14724177873953465, 'adx_thresh': 25.550802478078342, 'atr_min_pct': 0.00196747274812681, 'atr_max_pct': 0.10361998938425816, 'tp_mult': 1.1517432642349488, 'tsl_mult': 0.614001518391376, 'strategy': 'breakout', 'time_stop': 119, 'use_sma': False, 'use_atr': False, 'use_adx': False, 'use_ema': False, 'use_spike': False, 'rsi_required': False, 'edge_k': 1.8903149523667988, 'edge_cap': 0.44626099848999023}.
[I 2025-08-29 23:30:43,063] Trial 1024 finished with values: [-1000000000.0, 1000000000.0] and parameters: {'p_sma': 56, 'p_std': 21, 'p_atr': 22, 'p_adx': 29, 'rsi_period': 22, 'ema1': 5, 'ema2': 36, 'slip_atr_k': 0.0127021793993168, 'slip_spread_k': 0.1417215943854222, 'spread_hl_frac': 0.032730228284865596, 'bb_std_mult': 2.0467674416437416, 'rsi_os': 27, 'rsi_ob': 62, 'vol_spike': 0.17638080549063348, 'adx_thresh': 28.585988822329703, 'atr_min_pct': 0.010463891728838114, 'atr_max_pct': 0.10281862603704915, 'tp_mult': 1.132260817789817, 'tsl_mult': 0.9667129006895904, 'strategy': 'mean_reversion', 'time_stop': 109, 'use_sma': False, 'use_atr': False, 'use_adx': False, 'use_ema': False, 'use_spike': False, 'rsi_required': False, 'edge_k': 1.9677138857005085, 'edge_cap': 0.8002513255892179}.
[I 2025-08-29 23:30:43,373] Trial 1022 finished with values: [-0.014468037317220683, 0.014442303354589013] and parameters: {'p_sma': 56, 'p_std': 23, 'p_atr': 29, 'p_adx': 16, 'rsi_period': 21, 'ema1': 25, 'ema2': 38, 'slip_atr_k': 0.017672165278180045, 'slip_spread_k': 0.852057291172251, 'spread_hl_frac': 0.02314587635249964, 'bb_std_mult': 3.415190080322859, 'rsi_os': 24, 'rsi_ob': 62, 'vol_spike': 0.1703587439493541, 'adx_thresh': 9.629747503358937, 'atr_min_pct': 0.0019098679736703368, 'atr_max_pct': 0.0724383710992801, 'tp_mult': 1.157710701775324, 'tsl_mult': 0.10391503168140215, 'strategy': 'breakout', 'time_stop': 215, 'use_sma': False, 'use_atr': False, 'use_adx': False, 'use_ema': False, 'use_spike': False, 'rsi_required': False, 'edge_k': 1.742151120017801, 'edge_cap': 0.4341878034778593}.
[I 2025-08-29 23:30:43,373] Trial 1025 finished with values: [-0.021910364624231127, 0.021889237253404824] and parameters: {'p_sma': 12, 'p_std': 28, 'p_atr': 21, 'p_adx': 17, 'rsi_period': 37, 'ema1': 12, 'ema2': 53, 'slip_atr_k': 0.21958429988493186, 'slip_spread_k': 0.7701096137064727, 'spread_hl_frac': 0.023748608970858315, 'bb_std_mult': 3.139359937581851, 'rsi_os': 27, 'rsi_ob': 62, 'vol_spike': 0.255373755741252, 'adx_thresh': 24.467329784366633, 'atr_min_pct': 0.001098169385222353, 'atr_max_pct': 0.09495718796537178, 'tp_mult': 1.108089270339342, 'tsl_mult': 0.7084560701511128, 'strategy': 'mean_reversion', 'time_stop': 107, 'use_sma': False, 'use_atr': False, 'use_adx': False, 'use_ema': False, 'use_spike': False, 'rsi_required': False, 'edge_k': 0.49032457196281914, 'edge_cap': 0.25540470776471624}.
[I 2025-08-29 23:30:43,491] Trial 1023 finished with values: [-0.020242219526643734, 0.020221005293393244] and parameters: {'p_sma': 7, 'p_std': 22, 'p_atr': 22, 'p_adx': 24, 'rsi_period': 22, 'ema1': 12, 'ema2': 38, 'slip_atr_k': 0.1871100764438518, 'slip_spread_k': 0.6957690804877446, 'spread_hl_frac': 0.022580450021971385, 'bb_std_mult': 3.38217955441318, 'rsi_os': 27, 'rsi_ob': 62, 'vol_spike': 0.25577118002360505, 'adx_thresh': 26.257632290432884, 'atr_min_pct': 0.0009461610701643956, 'atr_max_pct': 0.13933354393137176, 'tp_mult': 2.234578393107611, 'tsl_mult': 0.6213037358741005, 'strategy': 'mean_reversion', 'time_stop': 169, 'use_sma': False, 'use_atr': False, 'use_adx': False, 'use_ema': False, 'use_spike': False, 'rsi_required': False, 'edge_k': 0.49470203494750814, 'edge_cap': 0.928024613846608}.
