[I 2025-08-29 23:01:33,410] Trial 756 finished with values: [-1000000000.0, 1000000000.0] and parameters: {'p_sma': 52, 'p_std': 28, 'p_atr': 19, 'p_adx': 17, 'rsi_period': 20, 'ema1': 15, 'ema2': 34, 'slip_atr_k': 0.021307134791467387, 'slip_spread_k': 0.15088735512217977, 'spread_hl_frac': 0.015251807330175154, 'bb_std_mult': 1.9488208487590826, 'rsi_os': 24, 'rsi_ob': 63, 'vol_spike': 0.08493043831015218, 'adx_thresh': 25.574732368502332, 'atr_min_pct': 0.021249907277447556, 'atr_max_pct': 0.08775892982075532, 'tp_mult': 1.3213669358147455, 'tsl_mult': 0.708700599821766, 'strategy': 'mean_reversion', 'time_stop': 109, 'use_sma': False, 'use_atr': False, 'use_adx': False, 'use_ema': False, 'use_spike': False, 'rsi_required': False, 'edge_k': 0.5289259261521609, 'edge_cap': 0.4940679843357407}.
[I 2025-08-29 23:01:33,516] Trial 757 finished with values: [-1000000000.0, 1000000000.0] and parameters: {'p_sma': 22, 'p_std': 25, 'p_atr': 12, 'p_adx': 12, 'rsi_period': 24, 'ema1': 15, 'ema2': 26, 'slip_atr_k': 0.06909240314221243, 'slip_spread_k': 0.3463049947405614, 'spread_hl_frac': 0.02029291488960117, 'bb_std_mult': 2.4183355149023327, 'rsi_os': 27, 'rsi_ob': 62, 'vol_spike': 0.036804508903387295, 'adx_thresh': 25.54094271750689, 'atr_min_pct': 0.02092240990284068, 'atr_max_pct': 0.08758265650878654, 'tp_mult': 1.3294075499353348, 'tsl_mult': 0.5765552666824477, 'strategy': 'mean_reversion', 'time_stop': 111, 'use_sma': False, 'use_atr': False, 'use_adx': False, 'use_ema': False, 'use_spike': False, 'rsi_required': False, 'edge_k': 0.663277404489922, 'edge_cap': 0.3412937385355745}.
[I 2025-08-29 23:01:33,649] Trial 759 finished with values: [-1000000000.0, 1000000000.0] and parameters: {'p_sma': 6, 'p_std': 42, 'p_atr': 23, 'p_adx': 12, 'rsi_period': 21, 'ema1': 12, 'ema2': 34, 'slip_atr_k': 0.23222847371409994, 'slip_spread_k': 0.8548769337865731, 'spread_hl_frac': 0.015452222249330669, 'bb_std_mult': 3.115638285391257, 'rsi_os': 27, 'rsi_ob': 63, 'vol_spike': 0.16399754631861843, 'adx_thresh': 29.398865610800307, 'atr_min_pct': 0.0029723631597921344, 'atr_max_pct': 0.03866762377058917, 'tp_mult': 1.1473405798113663, 'tsl_mult': 0.5951891805954463, 'strategy': 'mean_reversion', 'time_stop': 187, 'use_sma': False, 'use_atr': False, 'use_adx': False, 'use_ema': False, 'use_spike': False, 'rsi_required': False, 'edge_k': 0.6888359443934566, 'edge_cap': 0.09625449990161289}.
[I 2025-08-29 23:01:33,649] Trial 758 finished with values: [-0.006784190601142659, 0.006852720229864048] and parameters: {'p_sma': 8, 'p_std': 25, 'p_atr': 23, 'p_adx': 17, 'rsi_period': 11, 'ema1': 12, 'ema2': 53, 'slip_atr_k': 0.00480477607166982, 'slip_spread_k': 0.8476454790984751, 'spread_hl_frac': 0.0037625649891831897, 'bb_std_mult': 1.9294085180351892, 'rsi_os': 27, 'rsi_ob': 63, 'vol_spike': 0.0002844953908666126, 'adx_thresh': 7.861588167497079, 'atr_min_pct': 0.00327730367215576, 'atr_max_pct': 0.09027436841948033, 'tp_mult': 1.314829841831092, 'tsl_mult': 0.7115294941154041, 'strategy': 'mean_reversion', 'time_stop': 300, 'use_sma': False, 'use_atr': False, 'use_adx': False, 'use_ema': False, 'use_spike': False, 'rsi_required': False, 'edge_k': 1.9131547082273581, 'edge_cap': 0.09103493908897192}.
[I 2025-08-29 23:02:01,009] Trial 760 finished with values: [-0.04964844259978962, 0.04964216587604887] and parameters: {'p_sma': 60, 'p_std': 30, 'p_atr': 23, 'p_adx': 18, 'rsi_period': 24, 'ema1': 5, 'ema2': 26, 'slip_atr_k': 0.24997554699995433, 'slip_spread_k': 0.11041869768449225, 'spread_hl_frac': 0.02031139454514353, 'bb_std_mult': 2.1328735116670776, 'rsi_os': 43, 'rsi_ob': 62, 'vol_spike': 0.0005160250739494054, 'adx_thresh': 5.0207431334467305, 'atr_min_pct': 0.0028321713841180122, 'atr_max_pct': 0.09101354355307556, 'tp_mult': 2.4552628165878936, 'tsl_mult': 0.7230383573806153, 'strategy': 'breakout', 'time_stop': 127, 'use_sma': False, 'use_atr': False, 'use_adx': False, 'use_ema': False, 'use_spike': False, 'rsi_required': False, 'edge_k': 1.0834994611847562, 'edge_cap': 0.05243388439885749}.
[I 2025-08-29 23:02:01,158] Trial 761 finished with values: [-0.006052328108851368, 0.006020615831376996] and parameters: {'p_sma': 60, 'p_std': 26, 'p_atr': 23, 'p_adx': 9, 'rsi_period': 28, 'ema1': 18, 'ema2': 52, 'slip_atr_k': 0.23421068751531127, 'slip_spread_k': 0.10886998550240895, 'spread_hl_frac': 0.01821161829505874, 'bb_std_mult': 2.0595102264425442, 'rsi_os': 15, 'rsi_ob': 61, 'vol_spike': 0.18209236988769203, 'adx_thresh': 10.523104745210542, 'atr_min_pct': 0.002790489451881986, 'atr_max_pct': 0.08281482752482063, 'tp_mult': 2.445802233815126, 'tsl_mult': 0.4566446007826589, 'strategy': 'breakout', 'time_stop': 60, 'use_sma': False, 'use_atr': False, 'use_adx': False, 'use_ema': False, 'use_spike': False, 'rsi_required': False, 'edge_k': 0.4642581676493294, 'edge_cap': 0.09665205338598082}.
[I 2025-08-29 23:02:01,158] Trial 763 finished with values: [-1000000000.0, 1000000000.0] and parameters: {'p_sma': 6, 'p_std': 23, 'p_atr': 23, 'p_adx': 18, 'rsi_period': 76, 'ema1': 25, 'ema2': 54, 'slip_atr_k': 0.016388236871515905, 'slip_spread_k': 0.24910838835028087, 'spread_hl_frac': 0.018145262169421958, 'bb_std_mult': 2.602906270257117, 'rsi_os': 22, 'rsi_ob': 59, 'vol_spike': 0.18176964254364517, 'adx_thresh': 24.935405516787213, 'atr_min_pct': 0.004637417211105568, 'atr_max_pct': 0.09715338754496142, 'tp_mult': 2.467419459736177, 'tsl_mult': 0.7297059508882164, 'strategy': 'breakout', 'time_stop': 211, 'use_sma': False, 'use_atr': False, 'use_adx': False, 'use_ema': False, 'use_spike': False, 'rsi_required': False, 'edge_k': 1.113831752605381, 'edge_cap': 0.998529337556515}.
[I 2025-08-29 23:02:01,232] Trial 762 finished with values: [-0.024992062060762876, 0.024975499283149894] and parameters: {'p_sma': 60, 'p_std': 23, 'p_atr': 23, 'p_adx': 18, 'rsi_period': 26, 'ema1': 25, 'ema2': 54, 'slip_atr_k': 0.015780227424347117, 'slip_spread_k': 0.827000705676461, 'spread_hl_frac': 0.018034602503514224, 'bb_std_mult': 2.1193068904243004, 'rsi_os': 30, 'rsi_ob': 93, 'vol_spike': 0.17998932523190914, 'adx_thresh': 24.777325491500616, 'atr_min_pct': 0.0014385598398063302, 'atr_max_pct': 0.01318642814416858, 'tp_mult': 1.2003963593094873, 'tsl_mult': 0.25892692328861744, 'strategy': 'breakout', 'time_stop': 136, 'use_sma': False, 'use_atr': False, 'use_adx': False, 'use_ema': False, 'use_spike': False, 'rsi_required': False, 'edge_k': 0.17506337883866396, 'edge_cap': 0.8481530305511866}.
[I 2025-08-29 23:02:28,664] Trial 765 finished with values: [-0.02039681300985574, 0.020364896669632176] and parameters: {'p_sma': 10, 'p_std': 48, 'p_atr': 14, 'p_adx': 15, 'rsi_period': 20, 'ema1': 14, 'ema2': 57, 'slip_atr_k': 0.16136766163093386, 'slip_spread_k': 0.9208710515786683, 'spread_hl_frac': 0.0326519320998161, 'bb_std_mult': 0.9893507733845976, 'rsi_os': 29, 'rsi_ob': 58, 'vol_spike': 0.2339449526793987, 'adx_thresh': 9.213965585452243, 'atr_min_pct': 0.001478147598803681, 'atr_max_pct': 0.06464108186126291, 'tp_mult': 2.2412886633767397, 'tsl_mult': 0.816550438521854, 'strategy': 'breakout', 'time_stop': 99, 'use_sma': False, 'use_atr': False, 'use_adx': False, 'use_ema': False, 'use_spike': False, 'rsi_required': False, 'edge_k': 0.5188933762102433, 'edge_cap': 0.8296536662446885}.
[I 2025-08-29 23:02:28,826] Trial 766 finished with values: [-0.03299845665204593, 0.03297979172935646] and parameters: {'p_sma': 10, 'p_std': 5, 'p_atr': 30, 'p_adx': 15, 'rsi_period': 20, 'ema1': 27, 'ema2': 13, 'slip_atr_k': 0.02101340300636193, 'slip_spread_k': 0.9339505995335108, 'spread_hl_frac': 0.027556231420562197, 'bb_std_mult': 2.507506832608812, 'rsi_os': 29, 'rsi_ob': 94, 'vol_spike': 0.019780622110006363, 'adx_thresh': 23.698625259092548, 'atr_min_pct': 0.001655254118070204, 'atr_max_pct': 0.13634819625890177, 'tp_mult': 1.188939987367128, 'tsl_mult': 0.3786734564284202, 'strategy': 'breakout', 'time_stop': 138, 'use_sma': False, 'use_atr': False, 'use_adx': False, 'use_ema': False, 'use_spike': False, 'rsi_required': False, 'edge_k': 0.765995660803513, 'edge_cap': 0.8235286570877224}.
[I 2025-08-29 23:02:28,954] Trial 764 finished with values: [-0.015046371469734532, 0.01502128114798822] and parameters: {'p_sma': 8, 'p_std': 24, 'p_atr': 24, 'p_adx': 15, 'rsi_period': 16, 'ema1': 14, 'ema2': 57, 'slip_atr_k': 0.01474492640368499, 'slip_spread_k': 0.8299659273614215, 'spread_hl_frac': 0.01766433379236715, 'bb_std_mult': 2.285957523354767, 'rsi_os': 29, 'rsi_ob': 61, 'vol_spike': 0.17645480294459967, 'adx_thresh': 6.403388423129863, 'atr_min_pct': 0.0014783767422288483, 'atr_max_pct': 0.06578562409557076, 'tp_mult': 1.178896554645361, 'tsl_mult': 0.10638865981054452, 'strategy': 'breakout', 'time_stop': 98, 'use_sma': False, 'use_atr': False, 'use_adx': False, 'use_ema': False, 'use_spike': False, 'rsi_required': False, 'edge_k': 1.2636732539789677, 'edge_cap': 0.8233740537233558}.
[I 2025-08-29 23:02:29,161] Trial 767 finished with values: [-0.007856329736926404, 0.007941204522258062] and parameters: {'p_sma': 10, 'p_std': 27, 'p_atr': 14, 'p_adx': 15, 'rsi_period': 20, 'ema1': 14, 'ema2': 53, 'slip_atr_k': 0.03396831553670677, 'slip_spread_k': 0.9803227114991806, 'spread_hl_frac': 0.03309934712037062, 'bb_std_mult': 3.004406572876171, 'rsi_os': 26, 'rsi_ob': 91, 'vol_spike': 0.07526657932824427, 'adx_thresh': 6.36732847897559, 'atr_min_pct': 0.0022598362561236473, 'atr_max_pct': 0.06215501197088498, 'tp_mult': 1.132575970486077, 'tsl_mult': 0.8231524562112871, 'strategy': 'breakout', 'time_stop': 219, 'use_sma': False, 'use_atr': False, 'use_adx': False, 'use_ema': False, 'use_spike': False, 'rsi_required': False, 'edge_k': 0.5187702230817838, 'edge_cap': 0.7819524943173992}.
[I 2025-08-29 23:02:57,599] Trial 771 finished with values: [-1000000000.0, 1000000000.0] and parameters: {'p_sma': 6, 'p_std': 20, 'p_atr': 24, 'p_adx': 16, 'rsi_period': 23, 'ema1': 24, 'ema2': 29, 'slip_atr_k': 0.14739358921533957, 'slip_spread_k': 0.8913195738852272, 'spread_hl_frac': 0.01608583061082474, 'bb_std_mult': 2.0522759719948533, 'rsi_os': 19, 'rsi_ob': 55, 'vol_spike': 0.24444199164452873, 'adx_thresh': 20.760622261188917, 'atr_min_pct': 0.006626710791307347, 'atr_max_pct': 0.12295181915878976, 'tp_mult': 2.9462945598838237, 'tsl_mult': 0.1440610692101456, 'strategy': 'breakout', 'time_stop': 115, 'use_sma': False, 'use_atr': False, 'use_adx': False, 'use_ema': False, 'use_spike': False, 'rsi_required': False, 'edge_k': 0.07264296873689413, 'edge_cap': 0.7774667544496993}.
[I 2025-08-29 23:02:57,962] Trial 768 finished with values: [-1000000000.0, 1000000000.0] and parameters: {'p_sma': 33, 'p_std': 33, 'p_atr': 24, 'p_adx': 16, 'rsi_period': 81, 'ema1': 24, 'ema2': 53, 'slip_atr_k': 0.08620486699397503, 'slip_spread_k': 0.8901396898953448, 'spread_hl_frac': 0.001446927064099466, 'bb_std_mult': 2.513232486957687, 'rsi_os': 25, 'rsi_ob': 95, 'vol_spike': 0.1914937571926238, 'adx_thresh': 23.955453071400672, 'atr_min_pct': 0.017111469181564695, 'atr_max_pct': 0.14710164573910917, 'tp_mult': 1.1386996321349747, 'tsl_mult': 0.15706076746712838, 'strategy': 'breakout', 'time_stop': 114, 'use_sma': False, 'use_atr': False, 'use_adx': False, 'use_ema': False, 'use_spike': False, 'rsi_required': False, 'edge_k': 1.2734429823581723, 'edge_cap': 0.8206515251567782}.
[I 2025-08-29 23:02:58,280] Trial 770 finished with values: [-1000000000.0, 1000000000.0] and parameters: {'p_sma': 6, 'p_std': 25, 'p_atr': 24, 'p_adx': 16, 'rsi_period': 73, 'ema1': 20, 'ema2': 14, 'slip_atr_k': 0.0854211088012777, 'slip_spread_k': 0.8947274522972012, 'spread_hl_frac': 0.015890066918047487, 'bb_std_mult': 2.0389908784757935, 'rsi_os': 6, 'rsi_ob': 55, 'vol_spike': 0.18971538948443933, 'adx_thresh': 20.55927939955635, 'atr_min_pct': 0.020367665114641213, 'atr_max_pct': 0.14788486086990946, 'tp_mult': 2.578808365870415, 'tsl_mult': 0.15533754212043205, 'strategy': 'breakout', 'time_stop': 117, 'use_sma': False, 'use_atr': False, 'use_adx': False, 'use_ema': False, 'use_spike': False, 'rsi_required': False, 'edge_k': 0.001581631337151168, 'edge_cap': 0.7716299167729568}.
[I 2025-08-29 23:02:58,364] Trial 769 finished with values: [-1000000000.0, 1000000000.0] and parameters: {'p_sma': 8, 'p_std': 34, 'p_atr': 24, 'p_adx': 19, 'rsi_period': 71, 'ema1': 20, 'ema2': 51, 'slip_atr_k': 0.03997038899941818, 'slip_spread_k': 0.8852337879277952, 'spread_hl_frac': 0.017158822803170232, 'bb_std_mult': 3.596283319475009, 'rsi_os': 11, 'rsi_ob': 66, 'vol_spike': 0.13612848378765263, 'adx_thresh': 13.893487505139671, 'atr_min_pct': 0.011334254407845114, 'atr_max_pct': 0.0969328181412124, 'tp_mult': 1.1313091818542067, 'tsl_mult': 0.747156383769405, 'strategy': 'breakout', 'time_stop': 96, 'use_sma': False, 'use_atr': False, 'use_adx': False, 'use_ema': False, 'use_spike': False, 'rsi_required': False, 'edge_k': 1.751991251982629, 'edge_cap': 0.7840841434665718}.
[I 2025-08-29 23:03:26,077] Trial 774 finished with values: [-1000000000.0, 1000000000.0] and parameters: {'p_sma': 8, 'p_std': 24, 'p_atr': 29, 'p_adx': 19, 'rsi_period': 48, 'ema1': 24, 'ema2': 42, 'slip_atr_k': 0.02114698169768322, 'slip_spread_k': 0.793873260086946, 'spread_hl_frac': 0.04670155946279414, 'bb_std_mult': 1.1090686534905254, 'rsi_os': 25, 'rsi_ob': 59, 'vol_spike': 0.13894746464066493, 'adx_thresh': 13.963577136961394, 'atr_min_pct': 0.011206632561310152, 'atr_max_pct': 0.09751883633632914, 'tp_mult': 1.667480771795136, 'tsl_mult': 0.6690428926680045, 'strategy': 'mean_reversion', 'time_stop': 91, 'use_sma': False, 'use_atr': False, 'use_adx': False, 'use_ema': False, 'use_spike': False, 'rsi_required': False, 'edge_k': 0.47887701351161893, 'edge_cap': 0.8007492947330249}.
[I 2025-08-29 23:03:26,532] Trial 772 finished with values: [-1000000000.0, 1000000000.0] and parameters: {'p_sma': 8, 'p_std': 45, 'p_atr': 22, 'p_adx': 16, 'rsi_period': 73, 'ema1': 24, 'ema2': 30, 'slip_atr_k': 0.011789819126233244, 'slip_spread_k': 0.795529316723814, 'spread_hl_frac': 0.01338287399958681, 'bb_std_mult': 2.0403961730382254, 'rsi_os': 25, 'rsi_ob': 59, 'vol_spike': 0.19052511603634656, 'adx_thresh': 26.785018709115842, 'atr_min_pct': 0.02270259480203901, 'atr_max_pct': 0.09519104339380488, 'tp_mult': 2.566456616424036, 'tsl_mult': 0.6740608236331749, 'strategy': 'breakout', 'time_stop': 92, 'use_sma': False, 'use_atr': False, 'use_adx': False, 'use_ema': False, 'use_spike': False, 'rsi_required': False, 'edge_k': 1.7695726750831318, 'edge_cap': 0.8014222682214648}.
[I 2025-08-29 23:03:26,701] Trial 775 finished with values: [-1000000000.0, 1000000000.0] and parameters: {'p_sma': 7, 'p_std': 24, 'p_atr': 13, 'p_adx': 17, 'rsi_period': 47, 'ema1': 25, 'ema2': 54, 'slip_atr_k': 0.009778342627998085, 'slip_spread_k': 0.7976351487937403, 'spread_hl_frac': 5.052103181381329e-05, 'bb_std_mult': 2.15085889339706, 'rsi_os': 40, 'rsi_ob': 59, 'vol_spike': 0.17249435890387863, 'adx_thresh': 12.507008741606434, 'atr_min_pct': 0.005764549952400626, 'atr_max_pct': 0.110172066308882, 'tp_mult': 1.254177531746226, 'tsl_mult': 0.6631215964343784, 'strategy': 'mean_reversion', 'time_stop': 89, 'use_sma': False, 'use_atr': False, 'use_adx': False, 'use_ema': False, 'use_spike': False, 'rsi_required': False, 'edge_k': 0.4840582550941805, 'edge_cap': 0.8015134972912167}.
[I 2025-08-29 23:03:26,835] Trial 773 finished with values: [-1000000000.0, 1000000000.0] and parameters: {'p_sma': 8, 'p_std': 26, 'p_atr': 22, 'p_adx': 17, 'rsi_period': 17, 'ema1': 10, 'ema2': 30, 'slip_atr_k': 0.042133499881149575, 'slip_spread_k': 0.7954390232349768, 'spread_hl_frac': 0.038030923213778794, 'bb_std_mult': 1.8808617010397042, 'rsi_os': 11, 'rsi_ob': 66, 'vol_spike': 0.16994834482599352, 'adx_thresh': 12.77925118016591, 'atr_min_pct': 0.011470506192358131, 'atr_max_pct': 0.09781364484364008, 'tp_mult': 1.4563221424814197, 'tsl_mult': 0.1812420280437228, 'strategy': 'mean_reversion', 'time_stop': 93, 'use_sma': False, 'use_atr': False, 'use_adx': False, 'use_ema': False, 'use_spike': False, 'rsi_required': False, 'edge_k': 0.4761197146155115, 'edge_cap': 0.79876323473879}.
[I 2025-08-29 23:03:54,601] Trial 777 finished with values: [-1000000000.0, 1000000000.0] and parameters: {'p_sma': 49, 'p_std': 26, 'p_atr': 22, 'p_adx': 29, 'rsi_period': 42, 'ema1': 25, 'ema2': 54, 'slip_atr_k': 0.1005658562603666, 'slip_spread_k': 0.8641935836793863, 'spread_hl_frac': 0.019024341575328247, 'bb_std_mult': 1.9002607914347105, 'rsi_os': 27, 'rsi_ob': 61, 'vol_spike': 0.17177455861164967, 'adx_thresh': 12.527908351077038, 'atr_min_pct': 0.005660891451698458, 'atr_max_pct': 0.03358862759902236, 'tp_mult': 1.4463474421018614, 'tsl_mult': 0.7641508238404939, 'strategy': 'mean_reversion', 'time_stop': 104, 'use_sma': False, 'use_atr': False, 'use_adx': False, 'use_ema': False, 'use_spike': False, 'rsi_required': False, 'edge_k': 0.5656248393636064, 'edge_cap': 0.3926632069590136}.
[I 2025-08-29 23:03:55,080] Trial 776 finished with values: [-1000000000.0, 1000000000.0] and parameters: {'p_sma': 7, 'p_std': 56, 'p_atr': 22, 'p_adx': 23, 'rsi_period': 42, 'ema1': 28, 'ema2': 46, 'slip_atr_k': 0.01021462575265825, 'slip_spread_k': 0.800306150010406, 'spread_hl_frac': 0.012712322495835836, 'bb_std_mult': 0.500610591176158, 'rsi_os': 27, 'rsi_ob': 60, 'vol_spike': 0.16407062854950857, 'adx_thresh': 34.225315702130686, 'atr_min_pct': 0.003741185071785649, 'atr_max_pct': 0.09279063213854408, 'tp_mult': 1.2407638614023737, 'tsl_mult': 0.7671306254352527, 'strategy': 'breakout', 'time_stop': 102, 'use_sma': False, 'use_atr': False, 'use_adx': False, 'use_ema': False, 'use_spike': False, 'rsi_required': False, 'edge_k': 1.1918380560370432, 'edge_cap': 0.3837454287822505}.
[I 2025-08-29 23:03:55,093] Trial 779 finished with values: [-1000000000.0, 1000000000.0] and parameters: {'p_sma': 48, 'p_std': 26, 'p_atr': 23, 'p_adx': 29, 'rsi_period': 22, 'ema1': 22, 'ema2': 55, 'slip_atr_k': 0.17422224308041045, 'slip_spread_k': 0.7745047171488504, 'spread_hl_frac': 0.019497609438245776, 'bb_std_mult': 2.6564391302570014, 'rsi_os': 27, 'rsi_ob': 61, 'vol_spike': 0.2196785453433091, 'adx_thresh': 33.676011640061425, 'atr_min_pct': 0.003996493835321562, 'atr_max_pct': 0.09260301261585313, 'tp_mult': 1.9388577713626047, 'tsl_mult': 0.7665156325415629, 'strategy': 'breakout', 'time_stop': 103, 'use_sma': False, 'use_atr': False, 'use_adx': False, 'use_ema': False, 'use_spike': False, 'rsi_required': False, 'edge_k': 0.5634354956563232, 'edge_cap': 0.3813814145041118}.
[I 2025-08-29 23:03:55,210] Trial 778 finished with values: [-0.0072741720184700265, 0.007266762683179987] and parameters: {'p_sma': 48, 'p_std': 26, 'p_atr': 26, 'p_adx': 23, 'rsi_period': 17, 'ema1': 6, 'ema2': 52, 'slip_atr_k': 0.15473752283703515, 'slip_spread_k': 0.7734320383794018, 'spread_hl_frac': 0.019270631523497273, 'bb_std_mult': 1.9133018451028365, 'rsi_os': 27, 'rsi_ob': 61, 'vol_spike': 0.1685233930319331, 'adx_thresh': 25.155764257772045, 'atr_min_pct': 0.0042134136034839035, 'atr_max_pct': 0.10330042117144717, 'tp_mult': 1.1064248482630723, 'tsl_mult': 0.18442156923337732, 'strategy': 'breakout', 'time_stop': 105, 'use_sma': False, 'use_atr': False, 'use_adx': False, 'use_ema': False, 'use_spike': False, 'rsi_required': False, 'edge_k': 0.5743299012888217, 'edge_cap': 0.7442088264911958}.
[I 2025-08-29 23:04:22,919] Trial 783 finished with values: [-1000000000.0, 1000000000.0] and parameters: {'p_sma': 5, 'p_std': 21, 'p_atr': 20, 'p_adx': 16, 'rsi_period': 35, 'ema1': 29, 'ema2': 37, 'slip_atr_k': 0.13509753492706306, 'slip_spread_k': 0.7135520245497378, 'spread_hl_frac': 0.017080344646783048, 'bb_std_mult': 2.0982700212312833, 'rsi_os': 25, 'rsi_ob': 57, 'vol_spike': 0.11583629517490372, 'adx_thresh': 25.785485230140857, 'atr_min_pct': 0.01845706574935366, 'atr_max_pct': 0.10098259828381345, 'tp_mult': 1.1637249107679426, 'tsl_mult': 0.06627161558163408, 'strategy': 'breakout', 'time_stop': 172, 'use_sma': False, 'use_atr': False, 'use_adx': False, 'use_ema': False, 'use_spike': False, 'rsi_required': False, 'edge_k': 0.426682343568616, 'edge_cap': 0.7299280070895182}.
[I 2025-08-29 23:04:22,919] Trial 780 finished with values: [-1000000000.0, 1000000000.0] and parameters: {'p_sma': 31, 'p_std': 57, 'p_atr': 27, 'p_adx': 16, 'rsi_period': 19, 'ema1': 30, 'ema2': 52, 'slip_atr_k': 0.019805970813227797, 'slip_spread_k': 0.8230329719239462, 'spread_hl_frac': 0.017430750610608784, 'bb_std_mult': 3.3192692270673083, 'rsi_os': 26, 'rsi_ob': 52, 'vol_spike': 0.18275636185822292, 'adx_thresh': 33.75318540510034, 'atr_min_pct': 0.017999512810568614, 'atr_max_pct': 0.09230631888876172, 'tp_mult': 1.1054062405358185, 'tsl_mult': 0.6983063651107898, 'strategy': 'breakout', 'time_stop': 104, 'use_sma': False, 'use_atr': False, 'use_adx': False, 'use_ema': False, 'use_spike': False, 'rsi_required': False, 'edge_k': 0.2711228374284116, 'edge_cap': 0.7490481586373747}.
[I 2025-08-29 23:04:22,999] Trial 782 finished with values: [-1000000000.0, 1000000000.0] and parameters: {'p_sma': 5, 'p_std': 22, 'p_atr': 26, 'p_adx': 17, 'rsi_period': 19, 'ema1': 19, 'ema2': 56, 'slip_atr_k': 0.15540139734335706, 'slip_spread_k': 0.7129533222810425, 'spread_hl_frac': 0.017058233947525255, 'bb_std_mult': 2.082345908407491, 'rsi_os': 25, 'rsi_ob': 57, 'vol_spike': 0.11661858555260689, 'adx_thresh': 24.986954890187864, 'atr_min_pct': 0.014903207180666008, 'atr_max_pct': 0.10192835463831304, 'tp_mult': 1.0931220270119564, 'tsl_mult': 0.29648512744486133, 'strategy': 'breakout', 'time_stop': 54, 'use_sma': False, 'use_atr': False, 'use_adx': False, 'use_ema': False, 'use_spike': False, 'rsi_required': False, 'edge_k': 0.4320151252636927, 'edge_cap': 0.7467324150049129}.
