[I 2025-08-29 22:37:50,578] Trial 539 finished with values: [-1000000000.0, 1000000000.0] and parameters: {'p_sma': 24, 'p_std': 44, 'p_atr': 23, 'p_adx': 27, 'rsi_period': 27, 'ema1': 29, 'ema2': 56, 'slip_atr_k': 0.0314624948364652, 'slip_spread_k': 0.813850113785666, 'spread_hl_frac': 0.01578644160172576, 'bb_std_mult': 3.1535446381664496, 'rsi_os': 48, 'rsi_ob': 66, 'vol_spike': 0.16697589588314932, 'adx_thresh': 24.940497577879125, 'atr_min_pct': 0.009710959266035874, 'atr_max_pct': 0.0871233248832905, 'tp_mult': 1.1833016929264517, 'tsl_mult': 0.7301011554874239, 'strategy': 'breakout', 'time_stop': 103, 'use_sma': False, 'use_atr': False, 'use_adx': False, 'use_ema': False, 'use_spike': False, 'rsi_required': False, 'edge_k': 0.6190582737894005, 'edge_cap': 0.12547689490857344}.
[I 2025-08-29 22:37:50,675] Trial 541 finished with values: [-1000000000.0, 1000000000.0] and parameters: {'p_sma': 9, 'p_std': 26, 'p_atr': 22, 'p_adx': 17, 'rsi_period': 46, 'ema1': 29, 'ema2': 56, 'slip_atr_k': 0.22283152911256066, 'slip_spread_k': 0.2178872123187025, 'spread_hl_frac': 0.018919023552967776, 'bb_std_mult': 2.9202512475601154, 'rsi_os': 25, 'rsi_ob': 72, 'vol_spike': 0.006742069255178534, 'adx_thresh': 26.504661674222817, 'atr_min_pct': 0.016639239258294688, 'atr_max_pct': 0.09660555844384214, 'tp_mult': 1.1281085881097148, 'tsl_mult': 0.7329156465840199, 'strategy': 'breakout', 'time_stop': 119, 'use_sma': False, 'use_atr': False, 'use_adx': False, 'use_ema': False, 'use_spike': False, 'rsi_required': False, 'edge_k': 0.42763476888145685, 'edge_cap': 0.7812076497385331}.
[I 2025-08-29 22:37:50,792] Trial 540 finished with values: [-1000000000.0, 1000000000.0] and parameters: {'p_sma': 60, 'p_std': 16, 'p_atr': 23, 'p_adx': 22, 'rsi_period': 27, 'ema1': 25, 'ema2': 50, 'slip_atr_k': 0.2016882742135434, 'slip_spread_k': 0.7859054608772803, 'spread_hl_frac': 0.010792592001368546, 'bb_std_mult': 2.0781873971965896, 'rsi_os': 25, 'rsi_ob': 61, 'vol_spike': 0.16691512834968814, 'adx_thresh': 26.586337429314927, 'atr_min_pct': 0.02224416346126821, 'atr_max_pct': 0.11744203616879603, 'tp_mult': 1.7333513085815033, 'tsl_mult': 0.8250891265018794, 'strategy': 'breakout', 'time_stop': 86, 'use_sma': False, 'use_atr': False, 'use_adx': False, 'use_ema': False, 'use_spike': False, 'rsi_required': False, 'edge_k': 0.4008463341789097, 'edge_cap': 0.12640849664947218}.
[I 2025-08-29 22:38:18,101] Trial 546 finished with values: [-1000000000.0, 1000000000.0] and parameters: {'p_sma': 5, 'p_std': 28, 'p_atr': 17, 'p_adx': 15, 'rsi_period': 23, 'ema1': 26, 'ema2': 54, 'slip_atr_k': 0.06206653847895453, 'slip_spread_k': 0.8353375707674027, 'spread_hl_frac': 0.0171886429935199, 'bb_std_mult': 2.4075650484461835, 'rsi_os': 23, 'rsi_ob': 60, 'vol_spike': 0.18435819561598815, 'adx_thresh': 24.284768201729083, 'atr_min_pct': 0.003799796871112692, 'atr_max_pct': 0.09591213460694394, 'tp_mult': 2.9083555605185785, 'tsl_mult': 0.6790874859241047, 'strategy': 'breakout', 'time_stop': 246, 'use_sma': False, 'use_atr': False, 'use_adx': False, 'use_ema': False, 'use_spike': False, 'rsi_required': False, 'edge_k': 0.5107714081876855, 'edge_cap': 0.44330445268366686}.
[I 2025-08-29 22:38:18,552] Trial 544 finished with values: [-1000000000.0, 1000000000.0] and parameters: {'p_sma': 59, 'p_std': 26, 'p_atr': 22, 'p_adx': 22, 'rsi_period': 15, 'ema1': 25, 'ema2': 56, 'slip_atr_k': 0.09192774339661589, 'slip_spread_k': 0.8253144407641487, 'spread_hl_frac': 0.008617742925633106, 'bb_std_mult': 1.9211332292536605, 'rsi_os': 27, 'rsi_ob': 60, 'vol_spike': 0.004795649857403245, 'adx_thresh': 25.607953566081797, 'atr_min_pct': 0.005592320701079885, 'atr_max_pct': 0.09607953237058582, 'tp_mult': 1.1340493191968772, 'tsl_mult': 0.7227006359236561, 'strategy': 'breakout', 'time_stop': 117, 'use_sma': False, 'use_atr': False, 'use_adx': False, 'use_ema': False, 'use_spike': False, 'rsi_required': False, 'edge_k': 0.42842395942234623, 'edge_cap': 0.434832738309507}.
[I 2025-08-29 22:38:18,580] Trial 545 finished with values: [-1000000000.0, 1000000000.0] and parameters: {'p_sma': 5, 'p_std': 16, 'p_atr': 24, 'p_adx': 22, 'rsi_period': 24, 'ema1': 25, 'ema2': 54, 'slip_atr_k': 0.20255417165666328, 'slip_spread_k': 0.8364019955276867, 'spread_hl_frac': 0.008202359856640053, 'bb_std_mult': 1.9244741051880703, 'rsi_os': 27, 'rsi_ob': 60, 'vol_spike': 0.18175042573311762, 'adx_thresh': 24.35042957246477, 'atr_min_pct': 0.022048555523169755, 'atr_max_pct': 0.03389868196496608, 'tp_mult': 1.0535868024419082, 'tsl_mult': 0.6779779731457316, 'strategy': 'breakout', 'time_stop': 245, 'use_sma': False, 'use_atr': False, 'use_adx': False, 'use_ema': False, 'use_spike': False, 'rsi_required': False, 'edge_k': 0.9385021280056303, 'edge_cap': 0.8504187848495068}.
[I 2025-08-29 22:38:18,738] Trial 543 finished with values: [-0.024462018722182566, 0.02443271183510204] and parameters: {'p_sma': 57, 'p_std': 26, 'p_atr': 22, 'p_adx': 17, 'rsi_period': 27, 'ema1': 22, 'ema2': 50, 'slip_atr_k': 0.09072785097731183, 'slip_spread_k': 0.8327584571055332, 'spread_hl_frac': 0.01707051357374968, 'bb_std_mult': 1.922667024954715, 'rsi_os': 30, 'rsi_ob': 66, 'vol_spike': 0.18238530670910752, 'adx_thresh': 25.085960658696294, 'atr_min_pct': 0.0018005485463607508, 'atr_max_pct': 0.034083937621033816, 'tp_mult': 2.935173485861295, 'tsl_mult': 0.7254197581671955, 'strategy': 'breakout', 'time_stop': 246, 'use_sma': False, 'use_atr': False, 'use_adx': False, 'use_ema': False, 'use_spike': False, 'rsi_required': False, 'edge_k': 0.5229859651392786, 'edge_cap': 0.49127836806404007}.
[I 2025-08-29 22:38:46,251] Trial 550 finished with values: [-1000000000.0, 1000000000.0] and parameters: {'p_sma': 7, 'p_std': 24, 'p_atr': 23, 'p_adx': 25, 'rsi_period': 18, 'ema1': 23, 'ema2': 38, 'slip_atr_k': 0.016190822917221067, 'slip_spread_k': 0.8578093608754704, 'spread_hl_frac': 0.02868657492254685, 'bb_std_mult': 2.177770320816047, 'rsi_os': 26, 'rsi_ob': 84, 'vol_spike': 0.17370467186299363, 'adx_thresh': 12.303596997476447, 'atr_min_pct': 0.011678284326295776, 'atr_max_pct': 0.09318402251041402, 'tp_mult': 2.1535475978094047, 'tsl_mult': 0.15359761847156322, 'strategy': 'mean_reversion', 'time_stop': 101, 'use_sma': False, 'use_atr': False, 'use_adx': False, 'use_ema': False, 'use_spike': False, 'rsi_required': False, 'edge_k': 1.4441730763594192, 'edge_cap': 0.6849566080399508}.
[I 2025-08-29 22:38:46,977] Trial 549 finished with values: [-1000000000.0, 1000000000.0] and parameters: {'p_sma': 7, 'p_std': 24, 'p_atr': 23, 'p_adx': 30, 'rsi_period': 18, 'ema1': 23, 'ema2': 38, 'slip_atr_k': 0.04236515240126412, 'slip_spread_k': 0.8622837598847786, 'spread_hl_frac': 0.04629164180551859, 'bb_std_mult': 2.16578962379592, 'rsi_os': 30, 'rsi_ob': 63, 'vol_spike': 0.05008824722625577, 'adx_thresh': 28.596053561221332, 'atr_min_pct': 0.011737489652081427, 'atr_max_pct': 0.09821749453105276, 'tp_mult': 2.133727579773323, 'tsl_mult': 0.573855033159443, 'strategy': 'mean_reversion', 'time_stop': 102, 'use_sma': False, 'use_atr': False, 'use_adx': False, 'use_ema': False, 'use_spike': False, 'rsi_required': False, 'edge_k': 1.0045127920605477, 'edge_cap': 0.8203244257953115}.
[I 2025-08-29 22:38:47,099] Trial 548 finished with values: [-0.06511858390028724, 0.06510037547971201] and parameters: {'p_sma': 19, 'p_std': 23, 'p_atr': 24, 'p_adx': 30, 'rsi_period': 18, 'ema1': 6, 'ema2': 38, 'slip_atr_k': 0.004632913444318529, 'slip_spread_k': 0.7943149637563969, 'spread_hl_frac': 0.02850603601966371, 'bb_std_mult': 0.983682145591168, 'rsi_os': 26, 'rsi_ob': 63, 'vol_spike': 0.17981136520946, 'adx_thresh': 12.133218586723457, 'atr_min_pct': 0.0011066572574291243, 'atr_max_pct': 0.04547517274377916, 'tp_mult': 1.0693285102746375, 'tsl_mult': 0.7090308271460743, 'strategy': 'mean_reversion', 'time_stop': 202, 'use_sma': False, 'use_atr': False, 'use_adx': False, 'use_ema': False, 'use_spike': False, 'rsi_required': False, 'edge_k': 1.4157336902098017, 'edge_cap': 0.8543764129600364}.
[I 2025-08-29 22:38:47,257] Trial 547 finished with values: [-0.012999407969912169, 0.012980139375509231] and parameters: {'p_sma': 29, 'p_std': 26, 'p_atr': 7, 'p_adx': 9, 'rsi_period': 15, 'ema1': 23, 'ema2': 58, 'slip_atr_k': 0.015259426099309803, 'slip_spread_k': 0.8566238913159165, 'spread_hl_frac': 0.04064104313018305, 'bb_std_mult': 1.9136352850423861, 'rsi_os': 6, 'rsi_ob': 57, 'vol_spike': 0.18004646523447065, 'adx_thresh': 16.882373774229332, 'atr_min_pct': 0.0010350588939019272, 'atr_max_pct': 0.0450390207811743, 'tp_mult': 1.036981339518535, 'tsl_mult': 0.715258623209007, 'strategy': 'breakout', 'time_stop': 201, 'use_sma': False, 'use_atr': False, 'use_adx': False, 'use_ema': False, 'use_spike': False, 'rsi_required': False, 'edge_k': 0.04968855371447245, 'edge_cap': 0.6884929597283971}.
[I 2025-08-29 22:39:13,733] Trial 551 finished with values: [-1000000000.0, 1000000000.0] and parameters: {'p_sma': 8, 'p_std': 9, 'p_atr': 24, 'p_adx': 9, 'rsi_period': 20, 'ema1': 24, 'ema2': 21, 'slip_atr_k': 0.005248021863052276, 'slip_spread_k': 0.8015888407506967, 'spread_hl_frac': 0.0210755079865006, 'bb_std_mult': 0.9618440656953398, 'rsi_os': 28, 'rsi_ob': 57, 'vol_spike': 0.15034571811545133, 'adx_thresh': 28.678224310281387, 'atr_min_pct': 0.02760374485382463, 'atr_max_pct': 0.07826583759843152, 'tp_mult': 1.17573881201498, 'tsl_mult': 0.7122768833333619, 'strategy': 'breakout', 'time_stop': 267, 'use_sma': False, 'use_atr': False, 'use_adx': False, 'use_ema': False, 'use_spike': False, 'rsi_required': False, 'edge_k': 0.33494990662466245, 'edge_cap': 0.8181814347574298}.
[I 2025-08-29 22:39:14,408] Trial 552 finished with values: [-1000000000.0, 1000000000.0] and parameters: {'p_sma': 44, 'p_std': 23, 'p_atr': 15, 'p_adx': 15, 'rsi_period': 13, 'ema1': 24, 'ema2': 53, 'slip_atr_k': 0.006405230523438126, 'slip_spread_k': 0.8054640076433284, 'spread_hl_frac': 0.045071122222934856, 'bb_std_mult': 3.4403794049762277, 'rsi_os': 9, 'rsi_ob': 62, 'vol_spike': 0.1927053826021911, 'adx_thresh': 25.63978653181508, 'atr_min_pct': 0.014815197649612208, 'atr_max_pct': 0.128945267189815, 'tp_mult': 1.7923092800381168, 'tsl_mult': 0.49516710211710563, 'strategy': 'breakout', 'time_stop': 125, 'use_sma': False, 'use_atr': False, 'use_adx': False, 'use_ema': False, 'use_spike': False, 'rsi_required': False, 'edge_k': 0.3375506389683378, 'edge_cap': 0.9838287132473292}.
[I 2025-08-29 22:39:14,613] Trial 554 finished with values: [-1000000000.0, 1000000000.0] and parameters: {'p_sma': 41, 'p_std': 34, 'p_atr': 25, 'p_adx': 15, 'rsi_period': 54, 'ema1': 24, 'ema2': 53, 'slip_atr_k': 0.02567972610604398, 'slip_spread_k': 0.4514301285906208, 'spread_hl_frac': 0.03320511661496469, 'bb_std_mult': 2.0299312305279402, 'rsi_os': 28, 'rsi_ob': 59, 'vol_spike': 0.19117736545310174, 'adx_thresh': 25.67757770961035, 'atr_min_pct': 0.014103386309531323, 'atr_max_pct': 0.06067825564298045, 'tp_mult': 2.3691539713893834, 'tsl_mult': 0.7521773984533434, 'strategy': 'breakout', 'time_stop': 92, 'use_sma': False, 'use_atr': False, 'use_adx': False, 'use_ema': False, 'use_spike': False, 'rsi_required': False, 'edge_k': 0.4812686922128774, 'edge_cap': 0.7459771983981073}.
[I 2025-08-29 22:39:14,782] Trial 553 finished with values: [-1000000000.0, 1000000000.0] and parameters: {'p_sma': 21, 'p_std': 30, 'p_atr': 23, 'p_adx': 15, 'rsi_period': 12, 'ema1': 24, 'ema2': 48, 'slip_atr_k': 0.018372417204001398, 'slip_spread_k': 0.18981199598553872, 'spread_hl_frac': 0.020937601805157496, 'bb_std_mult': 2.029986839648975, 'rsi_os': 28, 'rsi_ob': 71, 'vol_spike': 0.2850164227389085, 'adx_thresh': 29.737392185133224, 'atr_min_pct': 0.02090695988832889, 'atr_max_pct': 0.10153873674382549, 'tp_mult': 2.579443437132677, 'tsl_mult': 0.6562384489291089, 'strategy': 'breakout', 'time_stop': 38, 'use_sma': False, 'use_atr': False, 'use_adx': False, 'use_ema': False, 'use_spike': False, 'rsi_required': False, 'edge_k': 0.4576239497388701, 'edge_cap': 0.8108157699490726}.
[I 2025-08-29 22:39:41,628] Trial 557 finished with values: [-1000000000.0, 1000000000.0] and parameters: {'p_sma': 38, 'p_std': 25, 'p_atr': 27, 'p_adx': 17, 'rsi_period': 22, 'ema1': 20, 'ema2': 34, 'slip_atr_k': 0.019803948385101525, 'slip_spread_k': 0.6027103041398837, 'spread_hl_frac': 0.01783768521124758, 'bb_std_mult': 1.7880637560214259, 'rsi_os': 24, 'rsi_ob': 61, 'vol_spike': 0.15760963102649284, 'adx_thresh': 29.717835243916873, 'atr_min_pct': 0.029896332746560027, 'atr_max_pct': 0.11170674646992709, 'tp_mult': 1.6707506456477916, 'tsl_mult': 0.7854173511517615, 'strategy': 'breakout', 'time_stop': 111, 'use_sma': False, 'use_atr': False, 'use_adx': False, 'use_ema': False, 'use_spike': False, 'rsi_required': False, 'edge_k': 0.5450827536795806, 'edge_cap': 0.764806933724337}.
[I 2025-08-29 22:39:41,655] Trial 558 finished with values: [-1000000000.0, 1000000000.0] and parameters: {'p_sma': 9, 'p_std': 27, 'p_atr': 22, 'p_adx': 16, 'rsi_period': 21, 'ema1': 8, 'ema2': 34, 'slip_atr_k': 0.020751009345346245, 'slip_spread_k': 0.3196978879884929, 'spread_hl_frac': 0.017600937533508523, 'bb_std_mult': 1.405434660015909, 'rsi_os': 24, 'rsi_ob': 77, 'vol_spike': 0.199187863526615, 'adx_thresh': 25.045760725928933, 'atr_min_pct': 0.026487663393300588, 'atr_max_pct': 0.11235162328811957, 'tp_mult': 1.1240592840069452, 'tsl_mult': 0.7802254739994039, 'strategy': 'breakout', 'time_stop': 110, 'use_sma': False, 'use_atr': False, 'use_adx': False, 'use_ema': False, 'use_spike': False, 'rsi_required': False, 'edge_k': 0.5328416231538433, 'edge_cap': 0.7688194587438517}.
[I 2025-08-29 22:39:41,840] Trial 556 finished with values: [-0.009908043114625453, 0.009882758291360332] and parameters: {'p_sma': 21, 'p_std': 30, 'p_atr': 27, 'p_adx': 17, 'rsi_period': 22, 'ema1': 24, 'ema2': 55, 'slip_atr_k': 0.026249056985299203, 'slip_spread_k': 0.6020710998791923, 'spread_hl_frac': 0.03312119711237784, 'bb_std_mult': 2.016294603169803, 'rsi_os': 24, 'rsi_ob': 59, 'vol_spike': 0.2858815870384208, 'adx_thresh': 20.903847066866227, 'atr_min_pct': 0.002052609266669763, 'atr_max_pct': 0.1029310450683784, 'tp_mult': 1.1240510975783218, 'tsl_mult': 0.6548269069065036, 'strategy': 'breakout', 'time_stop': 108, 'use_sma': False, 'use_atr': False, 'use_adx': False, 'use_ema': False, 'use_spike': False, 'rsi_required': False, 'edge_k': 0.4799361399832022, 'edge_cap': 0.7598883486039948}.
[I 2025-08-29 22:39:41,913] Trial 555 finished with values: [-1000000000.0, 1000000000.0] and parameters: {'p_sma': 47, 'p_std': 27, 'p_atr': 23, 'p_adx': 15, 'rsi_period': 22, 'ema1': 24, 'ema2': 53, 'slip_atr_k': 0.14294871650200158, 'slip_spread_k': 0.4554300888853966, 'spread_hl_frac': 0.017838778569667802, 'bb_std_mult': 1.768753229043832, 'rsi_os': 41, 'rsi_ob': 71, 'vol_spike': 0.1923085439875676, 'adx_thresh': 25.697750797509993, 'atr_min_pct': 0.02982897817655137, 'atr_max_pct': 0.10169470623437249, 'tp_mult': 1.1242399748049612, 'tsl_mult': 0.7818952760219846, 'strategy': 'breakout', 'time_stop': 125, 'use_sma': False, 'use_atr': False, 'use_adx': False, 'use_ema': False, 'use_spike': False, 'rsi_required': False, 'edge_k': 0.47581536397900875, 'edge_cap': 0.7984204337111105}.
[I 2025-08-29 22:39:42,127] Trial 562 finished with values: [-1000000000.0, 1000000000.0] and parameters: {'p_sma': 26, 'p_std': 36, 'p_atr': 24, 'p_adx': 26, 'rsi_period': 82, 'ema1': 22, 'ema2': 55, 'slip_atr_k': 0.014476199602939074, 'slip_spread_k': 0.491485917860501, 'spread_hl_frac': 0.042744099467328156, 'bb_std_mult': 2.093100265263742, 'rsi_os': 50, 'rsi_ob': 80, 'vol_spike': 0.17400622531253662, 'adx_thresh': 31.944902686186232, 'atr_min_pct': 0.003598711889022863, 'atr_max_pct': 0.09383291266464547, 'tp_mult': 1.2087648535202669, 'tsl_mult': 0.6915096969922168, 'strategy': 'mean_reversion', 'time_stop': 183, 'use_sma': False, 'use_atr': False, 'use_adx': False, 'use_ema': False, 'use_spike': False, 'rsi_required': False, 'edge_k': 0.16561462166469076, 'edge_cap': 0.9085486365538864}.
[I 2025-08-29 22:39:42,132] Trial 559 finished with values: [-1000000000.0, 1000000000.0] and parameters: {'p_sma': 7, 'p_std': 42, 'p_atr': 23, 'p_adx': 17, 'rsi_period': 30, 'ema1': 24, 'ema2': 55, 'slip_atr_k': 0.14241285650475632, 'slip_spread_k': 0.49827681424004994, 'spread_hl_frac': 0.01918705237524137, 'bb_std_mult': 2.085345885818364, 'rsi_os': 50, 'rsi_ob': 59, 'vol_spike': 0.2098501610428756, 'adx_thresh': 20.003805368765356, 'atr_min_pct': 0.002020329429443268, 'atr_max_pct': 0.09376216354975397, 'tp_mult': 2.0144764509298017, 'tsl_mult': 0.6116268045798549, 'strategy': 'mean_reversion', 'time_stop': 236, 'use_sma': False, 'use_atr': False, 'use_adx': False, 'use_ema': False, 'use_spike': False, 'rsi_required': False, 'edge_k': 0.697948407357964, 'edge_cap': 0.79678762170051}.
[I 2025-08-29 22:39:42,132] Trial 560 finished with values: [-1000000000.0, 1000000000.0] and parameters: {'p_sma': 7, 'p_std': 28, 'p_atr': 23, 'p_adx': 12, 'rsi_period': 20, 'ema1': 26, 'ema2': 55, 'slip_atr_k': 0.012129313335558972, 'slip_spread_k': 0.7190735458058505, 'spread_hl_frac': 0.01909578588293401, 'bb_std_mult': 1.3019725092633045, 'rsi_os': 50, 'rsi_ob': 59, 'vol_spike': 0.08123119780265926, 'adx_thresh': 17.77005691304225, 'atr_min_pct': 0.0019897395169246037, 'atr_max_pct': 0.09343659344981084, 'tp_mult': 1.920957291239605, 'tsl_mult': 0.6854824876402862, 'strategy': 'mean_reversion', 'time_stop': 106, 'use_sma': False, 'use_atr': False, 'use_adx': False, 'use_ema': False, 'use_spike': False, 'rsi_required': False, 'edge_k': 1.6030722371744304, 'edge_cap': 0.40422617891267165}.
[I 2025-08-29 22:40:07,215] Trial 561 finished with values: [-1000000000.0, 1000000000.0] and parameters: {'p_sma': 7, 'p_std': 28, 'p_atr': 11, 'p_adx': 26, 'rsi_period': 39, 'ema1': 26, 'ema2': 54, 'slip_atr_k': 0.01149147107143245, 'slip_spread_k': 0.9200395093524114, 'spread_hl_frac': 0.015459198449318638, 'bb_std_mult': 2.8294949213296623, 'rsi_os': 45, 'rsi_ob': 61, 'vol_spike': 0.20576370947512496, 'adx_thresh': 26.57451753766831, 'atr_min_pct': 0.0034369609721791416, 'atr_max_pct': 0.09302682524617445, 'tp_mult': 1.6002454583248527, 'tsl_mult': 0.9785402849837614, 'strategy': 'mean_reversion', 'time_stop': 117, 'use_sma': False, 'use_atr': False, 'use_adx': False, 'use_ema': False, 'use_spike': False, 'rsi_required': False, 'edge_k': 0.5358365207480269, 'edge_cap': 0.7943876215556531}.
[I 2025-08-29 22:40:09,478] Trial 565 finished with values: [-1000000000.0, 1000000000.0] and parameters: {'p_sma': 11, 'p_std': 25, 'p_atr': 22, 'p_adx': 16, 'rsi_period': 72, 'ema1': 23, 'ema2': 18, 'slip_atr_k': 0.033965308347792704, 'slip_spread_k': 0.02901137497642281, 'spread_hl_frac': 0.015174416064666327, 'bb_std_mult': 1.1117698038323316, 'rsi_os': 26, 'rsi_ob': 58, 'vol_spike': 0.18648180240270512, 'adx_thresh': 7.160979560063485, 'atr_min_pct': 0.0025998084830350025, 'atr_max_pct': 0.09894625380798179, 'tp_mult': 1.1646445767878513, 'tsl_mult': 0.7458266197080676, 'strategy': 'breakout', 'time_stop': 117, 'use_sma': False, 'use_atr': False, 'use_adx': False, 'use_ema': False, 'use_spike': False, 'rsi_required': False, 'edge_k': 1.1332291591155677, 'edge_cap': 0.8336844333459612}.
[I 2025-08-29 22:40:09,844] Trial 563 finished with values: [-0.03151415808530911, 0.03147103568083072] and parameters: {'p_sma': 36, 'p_std': 28, 'p_atr': 23, 'p_adx': 10, 'rsi_period': 20, 'ema1': 25, 'ema2': 54, 'slip_atr_k': 0.12004622614722626, 'slip_spread_k': 0.030745602303635988, 'spread_hl_frac': 0.03478470141295897, 'bb_std_mult': 1.585672564570671, 'rsi_os': 26, 'rsi_ob': 61, 'vol_spike': 0.21380518479851457, 'adx_thresh': 17.807534682892562, 'atr_min_pct': 0.0023975208451108994, 'atr_max_pct': 0.13481160137204842, 'tp_mult': 1.1644191535102248, 'tsl_mult': 0.7501167738713643, 'strategy': 'mean_reversion', 'time_stop': 234, 'use_sma': False, 'use_atr': False, 'use_adx': False, 'use_ema': False, 'use_spike': False, 'rsi_required': False, 'edge_k': 0.6997852003521647, 'edge_cap': 0.7859432467465376}.
[I 2025-08-29 22:40:09,855] Trial 564 finished with values: [-1000000000.0, 1000000000.0] and parameters: {'p_sma': 35, 'p_std': 25, 'p_atr': 22, 'p_adx': 16, 'rsi_period': 72, 'ema1': 25, 'ema2': 51, 'slip_atr_k': 0.023822066103745355, 'slip_spread_k': 0.820915877540442, 'spread_hl_frac': 0.009850069252623817, 'bb_std_mult': 2.8427284849932057, 'rsi_os': 39, 'rsi_ob': 58, 'vol_spike': 0.12471694501635033, 'adx_thresh': 26.5797248894229, 'atr_min_pct': 0.007198235985328593, 'atr_max_pct': 0.1342767038529027, 'tp_mult': 1.1752547972058374, 'tsl_mult': 0.7468261194243269, 'strategy': 'breakout', 'time_stop': 117, 'use_sma': False, 'use_atr': False, 'use_adx': False, 'use_ema': False, 'use_spike': False, 'rsi_required': False, 'edge_k': 0.7473688062279847, 'edge_cap': 0.7871525812267843}.
[I 2025-08-29 22:40:36,659] Trial 566 finished with values: [-1000000000.0, 1000000000.0] and parameters: {'p_sma': 11, 'p_std': 25, 'p_atr': 22, 'p_adx': 16, 'rsi_period': 19, 'ema1': 23, 'ema2': 51, 'slip_atr_k': 0.02274806952838468, 'slip_spread_k': 0.8243187629231666, 'spread_hl_frac': 0.049022156141671186, 'bb_std_mult': 1.1375569701845274, 'rsi_os': 11, 'rsi_ob': 58, 'vol_spike': 0.18522582101619584, 'adx_thresh': 24.546508732631988, 'atr_min_pct': 0.02565882981231278, 'atr_max_pct': 0.09964795877229078, 'tp_mult': 1.1678443752933454, 'tsl_mult': 0.7446740259729884, 'strategy': 'breakout', 'time_stop': 300, 'use_sma': False, 'use_atr': False, 'use_adx': False, 'use_ema': False, 'use_spike': False, 'rsi_required': False, 'edge_k': 1.311300946361741, 'edge_cap': 0.8296586154304925}.
