[I 2025-08-29 21:53:57,607] Trial 134 finished with values: [-1000000000.0, 1000000000.0] and parameters: {'p_sma': 47, 'p_std': 24, 'p_atr': 29, 'p_adx': 29, 'rsi_period': 47, 'ema1': 25, 'ema2': 21, 'slip_atr_k': 0.18551246512721786, 'slip_spread_k': 0.7999048079922445, 'spread_hl_frac': 0.010452459168156864, 'bb_std_mult': 0.8649313563887451, 'rsi_os': 24, 'rsi_ob': 61, 'vol_spike': 0.09322497055954254, 'adx_thresh': 5.948590205343686, 'atr_min_pct': 0.012435812211855642, 'atr_max_pct': 0.09413744263833757, 'tp_mult': 1.0366057670045556, 'tsl_mult': 0.5569968179370121, 'strategy': 'breakout', 'time_stop': 101, 'use_sma': False, 'use_atr': False, 'use_adx': False, 'use_ema': False, 'use_spike': False, 'rsi_required': False, 'edge_k': 1.428954319999919, 'edge_cap': 0.8101865066296845}.
[I 2025-08-29 21:53:57,768] Trial 136 finished with values: [-1000000000.0, 1000000000.0] and parameters: {'p_sma': 55, 'p_std': 24, 'p_atr': 29, 'p_adx': 17, 'rsi_period': 19, 'ema1': 24, 'ema2': 21, 'slip_atr_k': 0.016871730483013395, 'slip_spread_k': 0.7124933810069625, 'spread_hl_frac': 0.025562526612993356, 'bb_std_mult': 0.8500950696595031, 'rsi_os': 24, 'rsi_ob': 61, 'vol_spike': 0.17860212514429488, 'adx_thresh': 6.513108161134008, 'atr_min_pct': 0.008364520554906402, 'atr_max_pct': 0.010693525607134172, 'tp_mult': 1.7163497880545968, 'tsl_mult': 0.5940448035020209, 'strategy': 'breakout', 'time_stop': 153, 'use_sma': False, 'use_atr': False, 'use_adx': False, 'use_ema': False, 'use_spike': False, 'rsi_required': False, 'edge_k': 0.7371641869289993, 'edge_cap': 0.5501075439351087}.
[I 2025-08-29 21:53:58,122] Trial 135 finished with values: [-0.014633492339164, 0.014614752521454373] and parameters: {'p_sma': 5, 'p_std': 24, 'p_atr': 29, 'p_adx': 10, 'rsi_period': 69, 'ema1': 12, 'ema2': 12, 'slip_atr_k': 0.017437005190735495, 'slip_spread_k': 0.8369604299048216, 'spread_hl_frac': 0.025669416787717517, 'bb_std_mult': 0.8678186167084359, 'rsi_os': 40, 'rsi_ob': 59, 'vol_spike': 0.23135631675699408, 'adx_thresh': 21.433162804899702, 'atr_min_pct': 0.0006260409809406181, 'atr_max_pct': 0.09247090539360646, 'tp_mult': 1.6983927218454278, 'tsl_mult': 0.2868990358783811, 'strategy': 'breakout', 'time_stop': 244, 'use_sma': False, 'use_atr': False, 'use_adx': False, 'use_ema': False, 'use_spike': False, 'rsi_required': False, 'edge_k': 1.666075161783105, 'edge_cap': 0.9886443035304209}.
[I 2025-08-29 21:53:58,253] Trial 138 finished with values: [-0.07630952700504645, 0.07629985498998736] and parameters: {'p_sma': 47, 'p_std': 23, 'p_atr': 30, 'p_adx': 14, 'rsi_period': 69, 'ema1': 19, 'ema2': 42, 'slip_atr_k': 0.21521893433320688, 'slip_spread_k': 0.7538759739190194, 'spread_hl_frac': 0.025832435068172295, 'bb_std_mult': 2.862219325841105, 'rsi_os': 40, 'rsi_ob': 52, 'vol_spike': 0.2401274560077281, 'adx_thresh': 9.467537900798094, 'atr_min_pct': 0.0006105246716183886, 'atr_max_pct': 0.08471365730909892, 'tp_mult': 1.1636917591306237, 'tsl_mult': 0.799439485648083, 'strategy': 'breakout', 'time_stop': 244, 'use_sma': False, 'use_atr': False, 'use_adx': False, 'use_ema': False, 'use_spike': False, 'rsi_required': False, 'edge_k': 0.47560075338946833, 'edge_cap': 0.8687897902176486}.
[I 2025-08-29 21:54:24,665] Trial 140 finished with values: [-0.0792705638437412, 0.0792531248288621] and parameters: {'p_sma': 13, 'p_std': 28, 'p_atr': 30, 'p_adx': 12, 'rsi_period': 13, 'ema1': 12, 'ema2': 19, 'slip_atr_k': 0.2246555666907722, 'slip_spread_k': 0.26299816860436886, 'spread_hl_frac': 0.028248049859816333, 'bb_std_mult': 3.0409755299754053, 'rsi_os': 36, 'rsi_ob': 65, 'vol_spike': 0.1808605047756691, 'adx_thresh': 31.542225992634336, 'atr_min_pct': 0.0005397830319699689, 'atr_max_pct': 0.05320578932339637, 'tp_mult': 1.1729987183968134, 'tsl_mult': 0.6438540531997938, 'strategy': 'mean_reversion', 'time_stop': 239, 'use_sma': False, 'use_atr': False, 'use_adx': False, 'use_ema': False, 'use_spike': False, 'rsi_required': False, 'edge_k': 0.48395790208489053, 'edge_cap': 0.8374603124819997}.
[I 2025-08-29 21:54:24,891] Trial 141 finished with values: [-1000000000.0, 1000000000.0] and parameters: {'p_sma': 37, 'p_std': 30, 'p_atr': 30, 'p_adx': 8, 'rsi_period': 17, 'ema1': 18, 'ema2': 19, 'slip_atr_k': 0.22682809276669205, 'slip_spread_k': 0.7614935036648431, 'spread_hl_frac': 0.03470825881374829, 'bb_std_mult': 2.600549261348707, 'rsi_os': 36, 'rsi_ob': 65, 'vol_spike': 0.24106596544113035, 'adx_thresh': 33.47879977825242, 'atr_min_pct': 0.022321646621405313, 'atr_max_pct': 0.09846350719264592, 'tp_mult': 1.1683476650434617, 'tsl_mult': 0.330373930596665, 'strategy': 'mean_reversion', 'time_stop': 107, 'use_sma': False, 'use_atr': False, 'use_adx': False, 'use_ema': False, 'use_spike': False, 'rsi_required': False, 'edge_k': 0.39904420057978807, 'edge_cap': 0.8643741710535204}.
[I 2025-08-29 21:54:25,007] Trial 142 finished with values: [-1000000000.0, 1000000000.0] and parameters: {'p_sma': 37, 'p_std': 28, 'p_atr': 19, 'p_adx': 28, 'rsi_period': 16, 'ema1': 18, 'ema2': 18, 'slip_atr_k': 0.19424183865210398, 'slip_spread_k': 0.3810530882737704, 'spread_hl_frac': 0.04401917770310605, 'bb_std_mult': 0.9556656988446198, 'rsi_os': 22, 'rsi_ob': 95, 'vol_spike': 0.12582491134352022, 'adx_thresh': 31.580693622129402, 'atr_min_pct': 0.02240746169565047, 'atr_max_pct': 0.12380842251756033, 'tp_mult': 2.542413311925595, 'tsl_mult': 0.8537676823331284, 'strategy': 'mean_reversion', 'time_stop': 106, 'use_sma': False, 'use_atr': False, 'use_adx': False, 'use_ema': False, 'use_spike': False, 'rsi_required': False, 'edge_k': 0.5499435169420416, 'edge_cap': 0.8367374886822123}.
[I 2025-08-29 21:54:25,088] Trial 139 finished with values: [-0.028470594364426005, 0.028462003651860312] and parameters: {'p_sma': 37, 'p_std': 24, 'p_atr': 30, 'p_adx': 12, 'rsi_period': 19, 'ema1': 18, 'ema2': 42, 'slip_atr_k': 0.22578575082158897, 'slip_spread_k': 0.27920307842116365, 'spread_hl_frac': 0.008306069831420036, 'bb_std_mult': 0.9575958465060058, 'rsi_os': 21, 'rsi_ob': 59, 'vol_spike': 0.17732819815757483, 'adx_thresh': 33.50110853365884, 'atr_min_pct': 0.00045565616244335426, 'atr_max_pct': 0.09839233475306129, 'tp_mult': 2.5669995685731757, 'tsl_mult': 0.6392954209998875, 'strategy': 'breakout', 'time_stop': 240, 'use_sma': False, 'use_atr': False, 'use_adx': False, 'use_ema': False, 'use_spike': False, 'rsi_required': False, 'edge_k': 0.7273936501560823, 'edge_cap': 0.9895662220937202}.
[I 2025-08-29 21:54:51,492] Trial 145 finished with values: [-1000000000.0, 1000000000.0] and parameters: {'p_sma': 10, 'p_std': 37, 'p_atr': 10, 'p_adx': 30, 'rsi_period': 26, 'ema1': 23, 'ema2': 10, 'slip_atr_k': 0.16518342801866864, 'slip_spread_k': 0.4382201803759351, 'spread_hl_frac': 0.008413072986341957, 'bb_std_mult': 1.0581709809753148, 'rsi_os': 25, 'rsi_ob': 84, 'vol_spike': 0.19129862438664802, 'adx_thresh': 22.71625727111588, 'atr_min_pct': 0.010042403054070583, 'atr_max_pct': 0.023834417359278853, 'tp_mult': 2.8718539556350136, 'tsl_mult': 0.8015183574448848, 'strategy': 'breakout', 'time_stop': 14, 'use_sma': False, 'use_atr': False, 'use_adx': False, 'use_ema': False, 'use_spike': False, 'rsi_required': False, 'edge_k': 0.6289772146311106, 'edge_cap': 0.7630346454138944}.
[I 2025-08-29 21:54:51,882] Trial 143 finished with values: [-1000000000.0, 1000000000.0] and parameters: {'p_sma': 37, 'p_std': 31, 'p_atr': 19, 'p_adx': 27, 'rsi_period': 17, 'ema1': 26, 'ema2': 39, 'slip_atr_k': 0.007738593339232372, 'slip_spread_k': 0.5590970792674188, 'spread_hl_frac': 0.04335937304078525, 'bb_std_mult': 0.5066159529520192, 'rsi_os': 22, 'rsi_ob': 95, 'vol_spike': 0.1991355686410956, 'adx_thresh': 33.50070093341751, 'atr_min_pct': 0.004243025729506924, 'atr_max_pct': 0.09857784064328202, 'tp_mult': 2.8781612359039217, 'tsl_mult': 0.32821336808938123, 'strategy': 'breakout', 'time_stop': 107, 'use_sma': False, 'use_atr': False, 'use_adx': False, 'use_ema': False, 'use_spike': False, 'rsi_required': False, 'edge_k': 0.691853054094772, 'edge_cap': 0.9593580680428273}.
[I 2025-08-29 21:54:52,108] Trial 146 finished with values: [-1000000000.0, 1000000000.0] and parameters: {'p_sma': 10, 'p_std': 56, 'p_atr': 10, 'p_adx': 30, 'rsi_period': 26, 'ema1': 26, 'ema2': 15, 'slip_atr_k': 0.010725757295677995, 'slip_spread_k': 0.5702779641894689, 'spread_hl_frac': 0.031298901555249684, 'bb_std_mult': 0.5008398768980313, 'rsi_os': 25, 'rsi_ob': 79, 'vol_spike': 0.06600977712267965, 'adx_thresh': 18.545300785287623, 'atr_min_pct': 0.004281975502400356, 'atr_max_pct': 0.0471596504033351, 'tp_mult': 1.1114509484543786, 'tsl_mult': 0.8094805341235688, 'strategy': 'breakout', 'time_stop': 120, 'use_sma': False, 'use_atr': False, 'use_adx': False, 'use_ema': False, 'use_spike': False, 'rsi_required': False, 'edge_k': 0.5104161826266874, 'edge_cap': 0.7605110833359733}.
[I 2025-08-29 21:54:52,109] Trial 144 finished with values: [-1000000000.0, 1000000000.0] and parameters: {'p_sma': 10, 'p_std': 6, 'p_atr': 19, 'p_adx': 30, 'rsi_period': 26, 'ema1': 23, 'ema2': 10, 'slip_atr_k': 0.009266958282341333, 'slip_spread_k': 0.391308674637464, 'spread_hl_frac': 0.008079371168858849, 'bb_std_mult': 0.9600616946100134, 'rsi_os': 21, 'rsi_ob': 59, 'vol_spike': 0.19117219136000713, 'adx_thresh': 13.94504599316561, 'atr_min_pct': 0.029253499707175987, 'atr_max_pct': 0.04318656695091984, 'tp_mult': 2.8593252256021393, 'tsl_mult': 0.8044080754928107, 'strategy': 'breakout', 'time_stop': 121, 'use_sma': False, 'use_atr': False, 'use_adx': False, 'use_ema': False, 'use_spike': False, 'rsi_required': False, 'edge_k': 0.628209778309452, 'edge_cap': 0.6379062464811505}.
[I 2025-08-29 21:55:19,236] Trial 150 finished with values: [-1000000000.0, 1000000000.0] and parameters: {'p_sma': 7, 'p_std': 27, 'p_atr': 27, 'p_adx': 25, 'rsi_period': 21, 'ema1': 27, 'ema2': 14, 'slip_atr_k': 0.024804074417191426, 'slip_spread_k': 0.18071814920918688, 'spread_hl_frac': 0.011874303623372821, 'bb_std_mult': 3.3417692046100798, 'rsi_os': 26, 'rsi_ob': 91, 'vol_spike': 0.040245543899864705, 'adx_thresh': 29.10397223445904, 'atr_min_pct': 0.006655911081046632, 'atr_max_pct': 0.07630653959847675, 'tp_mult': 2.4721064871259815, 'tsl_mult': 0.7648596135762384, 'strategy': 'breakout', 'time_stop': 205, 'use_sma': False, 'use_atr': False, 'use_adx': False, 'use_ema': False, 'use_spike': False, 'rsi_required': False, 'edge_k': 0.57151455196678, 'edge_cap': 0.7778700856484995}.
[I 2025-08-29 21:55:19,502] Trial 148 finished with values: [-0.006690719722321825, 0.0069047263962726734] and parameters: {'p_sma': 10, 'p_std': 60, 'p_atr': 28, 'p_adx': 15, 'rsi_period': 65, 'ema1': 24, 'ema2': 23, 'slip_atr_k': 0.011403133182281647, 'slip_spread_k': 0.4716297471818552, 'spread_hl_frac': 0.005995792560091322, 'bb_std_mult': 2.6934953164339026, 'rsi_os': 52, 'rsi_ob': 49, 'vol_spike': 0.18406775464871794, 'adx_thresh': 29.810828572353532, 'atr_min_pct': 0.00213535766318621, 'atr_max_pct': 0.0762307482909527, 'tp_mult': 1.3979361344029964, 'tsl_mult': 0.46664498122840203, 'strategy': 'breakout', 'time_stop': 118, 'use_sma': False, 'use_atr': False, 'use_adx': False, 'use_ema': False, 'use_spike': False, 'rsi_required': False, 'edge_k': 0.5856400042278861, 'edge_cap': 0.6390151491360729}.
[I 2025-08-29 21:55:19,923] Trial 147 finished with values: [-1000000000.0, 1000000000.0] and parameters: {'p_sma': 52, 'p_std': 60, 'p_atr': 27, 'p_adx': 27, 'rsi_period': 66, 'ema1': 26, 'ema2': 14, 'slip_atr_k': 0.009255664021164886, 'slip_spread_k': 0.8453348348909401, 'spread_hl_frac': 0.012564084561686737, 'bb_std_mult': 2.725193807731003, 'rsi_os': 27, 'rsi_ob': 62, 'vol_spike': 0.20355587133136727, 'adx_thresh': 10.4867128004138, 'atr_min_pct': 0.004050675316319509, 'atr_max_pct': 0.04343613414167578, 'tp_mult': 1.1133995108621555, 'tsl_mult': 0.7646491881172606, 'strategy': 'breakout', 'time_stop': 122, 'use_sma': False, 'use_atr': False, 'use_adx': False, 'use_ema': False, 'use_spike': False, 'rsi_required': False, 'edge_k': 1.0741686462222289, 'edge_cap': 0.640743165783485}.
[I 2025-08-29 21:55:19,932] Trial 149 finished with values: [-0.008473180690211635, 0.008450783429295608] and parameters: {'p_sma': 52, 'p_std': 27, 'p_atr': 27, 'p_adx': 18, 'rsi_period': 24, 'ema1': 27, 'ema2': 14, 'slip_atr_k': 0.0690145836783056, 'slip_spread_k': 0.8456521033763321, 'spread_hl_frac': 0.006179750565401469, 'bb_std_mult': 3.4985740442384596, 'rsi_os': 26, 'rsi_ob': 62, 'vol_spike': 0.039493024974511876, 'adx_thresh': 29.671185735630317, 'atr_min_pct': 0.0029608405537646897, 'atr_max_pct': 0.11632127720609228, 'tp_mult': 2.191738059081003, 'tsl_mult': 0.7557835202450683, 'strategy': 'breakout', 'time_stop': 31, 'use_sma': False, 'use_atr': False, 'use_adx': False, 'use_ema': False, 'use_spike': False, 'rsi_required': False, 'edge_k': 0.5888977389245076, 'edge_cap': 0.7366372473083269}.
[I 2025-08-29 21:55:46,312] Trial 151 finished with values: [-1000000000.0, 1000000000.0] and parameters: {'p_sma': 51, 'p_std': 60, 'p_atr': 28, 'p_adx': 15, 'rsi_period': 36, 'ema1': 10, 'ema2': 23, 'slip_atr_k': 0.06804171734740141, 'slip_spread_k': 0.8498733581784985, 'spread_hl_frac': 0.006017589581212325, 'bb_std_mult': 2.283037095571753, 'rsi_os': 18, 'rsi_ob': 62, 'vol_spike': 0.20576181649245662, 'adx_thresh': 29.617468698222453, 'atr_min_pct': 0.002915788985827601, 'atr_max_pct': 0.03606617411624934, 'tp_mult': 1.2139850956791962, 'tsl_mult': 0.7409613329910535, 'strategy': 'breakout', 'time_stop': 70, 'use_sma': False, 'use_atr': False, 'use_adx': False, 'use_ema': False, 'use_spike': False, 'rsi_required': False, 'edge_k': 0.4279523834185526, 'edge_cap': 0.8059739183534902}.
[I 2025-08-29 21:55:46,615] Trial 154 finished with values: [-1000000000.0, 1000000000.0] and parameters: {'p_sma': 8, 'p_std': 25, 'p_atr': 30, 'p_adx': 28, 'rsi_period': 21, 'ema1': 14, 'ema2': 17, 'slip_atr_k': 0.03534367059635973, 'slip_spread_k': 0.8876763022572451, 'spread_hl_frac': 0.001843040397379831, 'bb_std_mult': 2.4241058247161438, 'rsi_os': 28, 'rsi_ob': 61, 'vol_spike': 0.26278714710526435, 'adx_thresh': 30.98115624638126, 'atr_min_pct': 0.02372186123274504, 'atr_max_pct': 0.03526422140281818, 'tp_mult': 1.220613725796113, 'tsl_mult': 0.08737836614072059, 'strategy': 'mean_reversion', 'time_stop': 93, 'use_sma': False, 'use_atr': False, 'use_adx': False, 'use_ema': False, 'use_spike': False, 'rsi_required': False, 'edge_k': 1.9387544931384155, 'edge_cap': 0.12036982064680035}.
[I 2025-08-29 21:55:46,736] Trial 153 finished with values: [-0.015615259893461353, 0.01559579669486178] and parameters: {'p_sma': 28, 'p_std': 11, 'p_atr': 30, 'p_adx': 28, 'rsi_period': 83, 'ema1': 14, 'ema2': 16, 'slip_atr_k': 0.09569789281074938, 'slip_spread_k': 0.823208546015112, 'spread_hl_frac': 0.03833660721392158, 'bb_std_mult': 1.5088240024222324, 'rsi_os': 28, 'rsi_ob': 61, 'vol_spike': 0.16984286559343334, 'adx_thresh': 26.28278071348834, 'atr_min_pct': 0.0013244808408919703, 'atr_max_pct': 0.03503137430767209, 'tp_mult': 1.243612366961119, 'tsl_mult': 0.11360836951073389, 'strategy': 'mean_reversion', 'time_stop': 86, 'use_sma': False, 'use_atr': False, 'use_adx': False, 'use_ema': False, 'use_spike': False, 'rsi_required': False, 'edge_k': 0.4445791695965321, 'edge_cap': 0.8111103089870789}.
[I 2025-08-29 21:55:46,842] Trial 152 finished with values: [-1000000000.0, 1000000000.0] and parameters: {'p_sma': 12, 'p_std': 20, 'p_atr': 30, 'p_adx': 18, 'rsi_period': 36, 'ema1': 14, 'ema2': 54, 'slip_atr_k': 0.09662864799435074, 'slip_spread_k': 0.8861900270011933, 'spread_hl_frac': 0.012899226722917378, 'bb_std_mult': 2.317359164737995, 'rsi_os': 6, 'rsi_ob': 63, 'vol_spike': 0.20215126653814708, 'adx_thresh': 30.5667255891104, 'atr_min_pct': 0.0030480939621555583, 'atr_max_pct': 0.11398398088071791, 'tp_mult': 1.2046569468669894, 'tsl_mult': 0.7432365457902235, 'strategy': 'mean_reversion', 'time_stop': 166, 'use_sma': False, 'use_atr': False, 'use_adx': False, 'use_ema': False, 'use_spike': False, 'rsi_required': False, 'edge_k': 0.446417554109177, 'edge_cap': 0.4880234757412728}.
[I 2025-08-29 21:56:13,683] Trial 155 finished with values: [-1000000000.0, 1000000000.0] and parameters: {'p_sma': 8, 'p_std': 11, 'p_atr': 30, 'p_adx': 28, 'rsi_period': 20, 'ema1': 14, 'ema2': 17, 'slip_atr_k': 0.035882588983960836, 'slip_spread_k': 0.8816299930261452, 'spread_hl_frac': 0.038315132379771445, 'bb_std_mult': 0.6555858811184949, 'rsi_os': 38, 'rsi_ob': 60, 'vol_spike': 0.1701691880221334, 'adx_thresh': 30.790981974860276, 'atr_min_pct': 0.011269655675643052, 'atr_max_pct': 0.11327240257409282, 'tp_mult': 1.2671334692425202, 'tsl_mult': 0.07655277845511271, 'strategy': 'mean_reversion', 'time_stop': 92, 'use_sma': False, 'use_atr': False, 'use_adx': False, 'use_ema': False, 'use_spike': False, 'rsi_required': False, 'edge_k': 0.510190031459572, 'edge_cap': 0.4775845007973721}.
[I 2025-08-29 21:56:13,982] Trial 156 finished with values: [-1000000000.0, 1000000000.0] and parameters: {'p_sma': 9, 'p_std': 51, 'p_atr': 23, 'p_adx': 26, 'rsi_period': 56, 'ema1': 24, 'ema2': 16, 'slip_atr_k': 0.005081059745178024, 'slip_spread_k': 0.9270771755675833, 'spread_hl_frac': 0.009529927060787924, 'bb_std_mult': 0.6306315758494965, 'rsi_os': 38, 'rsi_ob': 64, 'vol_spike': 0.18555573380174686, 'adx_thresh': 26.36043729905365, 'atr_min_pct': 0.011192421069200952, 'atr_max_pct': 0.1476121119302109, 'tp_mult': 1.7883529755139507, 'tsl_mult': 0.8528993303054743, 'strategy': 'mean_reversion', 'time_stop': 170, 'use_sma': False, 'use_atr': False, 'use_adx': False, 'use_ema': False, 'use_spike': False, 'rsi_required': False, 'edge_k': 0.9292045770337498, 'edge_cap': 0.47926851809509574}.
[I 2025-08-29 21:56:14,110] Trial 157 finished with values: [-1000000000.0, 1000000000.0] and parameters: {'p_sma': 30, 'p_std': 42, 'p_atr': 21, 'p_adx': 26, 'rsi_period': 54, 'ema1': 16, 'ema2': 18, 'slip_atr_k': 0.2352231479443476, 'slip_spread_k': 0.9172303673477736, 'spread_hl_frac': 0.00946138756300315, 'bb_std_mult': 0.6562143928849974, 'rsi_os': 7, 'rsi_ob': 64, 'vol_spike': 0.18576869225693973, 'adx_thresh': 27.315065840038336, 'atr_min_pct': 0.0010814481878804114, 'atr_max_pct': 0.08064561740069338, 'tp_mult': 2.658617257170895, 'tsl_mult': 0.9981250031689188, 'strategy': 'breakout', 'time_stop': 170, 'use_sma': False, 'use_atr': False, 'use_adx': False, 'use_ema': False, 'use_spike': False, 'rsi_required': False, 'edge_k': 1.5537823454520305, 'edge_cap': 0.46889211086679305}.
[I 2025-08-29 21:56:14,226] Trial 158 finished with values: [-1000000000.0, 1000000000.0] and parameters: {'p_sma': 9, 'p_std': 25, 'p_atr': 29, 'p_adx': 26, 'rsi_period': 56, 'ema1': 24, 'ema2': 18, 'slip_atr_k': 0.10963578695656866, 'slip_spread_k': 0.05370793697730725, 'spread_hl_frac': 0.009516109011616314, 'bb_std_mult': 0.6238925212065634, 'rsi_os': 23, 'rsi_ob': 73, 'vol_spike': 0.19565746859232597, 'adx_thresh': 27.401233300914015, 'atr_min_pct': 0.0009796825697075016, 'atr_max_pct': 0.017902814075762413, 'tp_mult': 2.6666473275978495, 'tsl_mult': 0.8473424961335245, 'strategy': 'breakout', 'time_stop': 93, 'use_sma': False, 'use_atr': False, 'use_adx': False, 'use_ema': False, 'use_spike': False, 'rsi_required': False, 'edge_k': 0.5083614582529368, 'edge_cap': 0.697552295468988}.
[I 2025-08-29 21:56:40,958] Trial 160 finished with values: [-0.012263592666526879, 0.012234462881470272] and parameters: {'p_sma': 7, 'p_std': 42, 'p_atr': 16, 'p_adx': 29, 'rsi_period': 18, 'ema1': 25, 'ema2': 18, 'slip_atr_k': 0.23608661140383172, 'slip_spread_k': 0.6377047492594438, 'spread_hl_frac': 0.005059683963123148, 'bb_std_mult': 0.7695232252443585, 'rsi_os': 25, 'rsi_ob': 74, 'vol_spike': 0.19231700719461903, 'adx_thresh': 15.943128437633858, 'atr_min_pct': 0.0010490088441457632, 'atr_max_pct': 0.10290605236559124, 'tp_mult': 2.3742062123764063, 'tsl_mult': 0.3822047152930401, 'strategy': 'breakout', 'time_stop': 226, 'use_sma': False, 'use_atr': False, 'use_adx': False, 'use_ema': False, 'use_spike': False, 'rsi_required': False, 'edge_k': 0.5555762985437958, 'edge_cap': 0.8466545642730894}.
[I 2025-08-29 21:56:41,031] Trial 162 finished with values: [-0.0033160117209476425, 0.003289889511495804] and parameters: {'p_sma': 34, 'p_std': 22, 'p_atr': 29, 'p_adx': 30, 'rsi_period': 18, 'ema1': 25, 'ema2': 16, 'slip_atr_k': 0.022926604585202737, 'slip_spread_k': 0.8631087825252979, 'spread_hl_frac': 0.015229730764371237, 'bb_std_mult': 3.331935463948744, 'rsi_os': 9, 'rsi_ob': 59, 'vol_spike': 0.006469756849742575, 'adx_thresh': 32.037254065056636, 'atr_min_pct': 1.756438189099807e-05, 'atr_max_pct': 0.10271713070738632, 'tp_mult': 1.8662468137780386, 'tsl_mult': 0.7900689198242953, 'strategy': 'breakout', 'time_stop': 131, 'use_sma': False, 'use_atr': False, 'use_adx': False, 'use_ema': False, 'use_spike': False, 'rsi_required': False, 'edge_k': 0.0731730760130328, 'edge_cap': 0.21480153923478046}.
[I 2025-08-29 21:56:41,171] Trial 161 finished with values: [-0.07185924071642347, 0.07185194629004427] and parameters: {'p_sma': 22, 'p_std': 25, 'p_atr': 29, 'p_adx': 20, 'rsi_period': 23, 'ema1': 24, 'ema2': 20, 'slip_atr_k': 0.11200372216422057, 'slip_spread_k': 0.7839995948385146, 'spread_hl_frac': 0.0049887611217491225, 'bb_std_mult': 0.7610040483590572, 'rsi_os': 42, 'rsi_ob': 60, 'vol_spike': 0.011374701466029147, 'adx_thresh': 32.05909208265849, 'atr_min_pct': 6.900193540229551e-05, 'atr_max_pct': 0.058584573507641645, 'tp_mult': 1.0782859505691378, 'tsl_mult': 0.37847727544456555, 'strategy': 'breakout', 'time_stop': 225, 'use_sma': False, 'use_atr': False, 'use_adx': False, 'use_ema': False, 'use_spike': False, 'rsi_required': False, 'edge_k': 0.3140329407194028, 'edge_cap': 0.3280080007303094}.
