[I 2025-08-30 00:00:19,479] Trial 1296 finished with values: [-1000000000.0, 1000000000.0] and parameters: {'p_sma': 5, 'p_std': 24, 'p_atr': 24, 'p_adx': 17, 'rsi_period': 31, 'ema1': 12, 'ema2': 52, 'slip_atr_k': 0.02168978367784581, 'slip_spread_k': 0.775341044461574, 'spread_hl_frac': 0.01784521149275259, 'bb_std_mult': 2.019378041840852, 'rsi_os': 26, 'rsi_ob': 58, 'vol_spike': 0.20220794515684512, 'adx_thresh': 27.453445075753233, 'atr_min_pct': 0.0155383455515211, 'atr_max_pct': 0.09831785246378502, 'tp_mult': 1.2057442412770503, 'tsl_mult': 0.31397662380187075, 'strategy': 'breakout', 'time_stop': 142, 'use_sma': False, 'use_atr': False, 'use_adx': False, 'use_ema': False, 'use_spike': False, 'rsi_required': False, 'edge_k': 0.7894051316085331, 'edge_cap': 0.8098004529684166}.
[I 2025-08-30 00:00:19,573] Trial 1297 finished with values: [-1000000000.0, 1000000000.0] and parameters: {'p_sma': 6, 'p_std': 24, 'p_atr': 25, 'p_adx': 17, 'rsi_period': 18, 'ema1': 10, 'ema2': 23, 'slip_atr_k': 0.02250958287417758, 'slip_spread_k': 0.7727242250207088, 'spread_hl_frac': 0.017786299223203655, 'bb_std_mult': 1.3535585154703142, 'rsi_os': 27, 'rsi_ob': 81, 'vol_spike': 0.18326042711285548, 'adx_thresh': 27.432755858310813, 'atr_min_pct': 0.02659968019192581, 'atr_max_pct': 0.1448336262768718, 'tp_mult': 1.208711009025824, 'tsl_mult': 0.8293892212632853, 'strategy': 'mean_reversion', 'time_stop': 112, 'use_sma': False, 'use_atr': False, 'use_adx': False, 'use_ema': False, 'use_spike': False, 'rsi_required': False, 'edge_k': 1.9316055494440536, 'edge_cap': 0.9134744767773721}.
[I 2025-08-30 00:00:19,654] Trial 1295 finished with values: [-1000000000.0, 1000000000.0] and parameters: {'p_sma': 54, 'p_std': 24, 'p_atr': 24, 'p_adx': 25, 'rsi_period': 30, 'ema1': 16, 'ema2': 24, 'slip_atr_k': 0.02274465461999378, 'slip_spread_k': 0.9756369962409404, 'spread_hl_frac': 0.014250583596304756, 'bb_std_mult': 0.5000725896127747, 'rsi_os': 8, 'rsi_ob': 60, 'vol_spike': 0.025110060316747868, 'adx_thresh': 26.712781105590963, 'atr_min_pct': 0.007611464649904303, 'atr_max_pct': 0.10674267355344862, 'tp_mult': 1.1362777771735624, 'tsl_mult': 0.3785054068699295, 'strategy': 'breakout', 'time_stop': 18, 'use_sma': False, 'use_atr': False, 'use_adx': False, 'use_ema': False, 'use_spike': False, 'rsi_required': False, 'edge_k': 0.7834450317643673, 'edge_cap': 0.8083848856609416}.
[I 2025-08-30 00:00:45,984] Trial 1299 finished with values: [-0.04970567068794329, 0.04969646360257614] and parameters: {'p_sma': 45, 'p_std': 39, 'p_atr': 7, 'p_adx': 16, 'rsi_period': 18, 'ema1': 16, 'ema2': 28, 'slip_atr_k': 0.020255103541361247, 'slip_spread_k': 0.7784513910986419, 'spread_hl_frac': 0.016133206724359535, 'bb_std_mult': 0.6696316090114147, 'rsi_os': 30, 'rsi_ob': 61, 'vol_spike': 0.1851145734165976, 'adx_thresh': 27.510547344046042, 'atr_min_pct': 0.0009535070428076044, 'atr_max_pct': 0.14378190213208664, 'tp_mult': 1.2113715808473842, 'tsl_mult': 0.704466153462178, 'strategy': 'breakout', 'time_stop': 129, 'use_sma': False, 'use_atr': False, 'use_adx': False, 'use_ema': False, 'use_spike': False, 'rsi_required': False, 'edge_k': 0.4631276389153669, 'edge_cap': 0.37042677869368784}.
[I 2025-08-30 00:00:46,149] Trial 1301 finished with values: [-1000000000.0, 1000000000.0] and parameters: {'p_sma': 9, 'p_std': 39, 'p_atr': 29, 'p_adx': 16, 'rsi_period': 20, 'ema1': 24, 'ema2': 58, 'slip_atr_k': 0.01088539936513009, 'slip_spread_k': 0.8304058136483969, 'spread_hl_frac': 0.00011929009508231808, 'bb_std_mult': 2.8388365401049636, 'rsi_os': 9, 'rsi_ob': 60, 'vol_spike': 0.2562350344653354, 'adx_thresh': 33.25340210394296, 'atr_min_pct': 0.02857140903959965, 'atr_max_pct': 0.08540451550337107, 'tp_mult': 1.061159272872507, 'tsl_mult': 0.7051273500890436, 'strategy': 'breakout', 'time_stop': 19, 'use_sma': False, 'use_atr': False, 'use_adx': False, 'use_ema': False, 'use_spike': False, 'rsi_required': False, 'edge_k': 1.60876401679868, 'edge_cap': 0.4393771156909877}.
[I 2025-08-30 00:00:46,231] Trial 1302 finished with values: [-0.0031180439819185057, 0.0031778936682127835] and parameters: {'p_sma': 9, 'p_std': 19, 'p_atr': 15, 'p_adx': 22, 'rsi_period': 20, 'ema1': 24, 'ema2': 56, 'slip_atr_k': 0.057618030292315436, 'slip_spread_k': 0.6481500245321867, 'spread_hl_frac': 0.022149213629519122, 'bb_std_mult': 2.1983101037857673, 'rsi_os': 16, 'rsi_ob': 61, 'vol_spike': 0.187556372587162, 'adx_thresh': 33.19211730716339, 'atr_min_pct': 0.001227357323712937, 'atr_max_pct': 0.0851121382429054, 'tp_mult': 1.0750180696133467, 'tsl_mult': 0.6957607012342626, 'strategy': 'breakout', 'time_stop': 102, 'use_sma': False, 'use_atr': False, 'use_adx': False, 'use_ema': False, 'use_spike': False, 'rsi_required': False, 'edge_k': 0.43428728536776273, 'edge_cap': 0.8364070061805537}.
[I 2025-08-30 00:00:46,303] Trial 1300 finished with values: [-1000000000.0, 1000000000.0] and parameters: {'p_sma': 58, 'p_std': 27, 'p_atr': 14, 'p_adx': 23, 'rsi_period': 18, 'ema1': 24, 'ema2': 57, 'slip_atr_k': 0.05677388650955567, 'slip_spread_k': 0.21783043568708982, 'spread_hl_frac': 0.022078770313769928, 'bb_std_mult': 1.3172923026667078, 'rsi_os': 20, 'rsi_ob': 60, 'vol_spike': 0.18399464217100195, 'adx_thresh': 14.999553733198407, 'atr_min_pct': 0.028458718339630408, 'atr_max_pct': 0.0852574514987721, 'tp_mult': 1.0866636615976824, 'tsl_mult': 0.6974479410966528, 'strategy': 'breakout', 'time_stop': 103, 'use_sma': False, 'use_atr': False, 'use_adx': False, 'use_ema': False, 'use_spike': False, 'rsi_required': False, 'edge_k': 0.4362519083961075, 'edge_cap': 0.8312238612779738}.
[I 2025-08-30 00:01:12,292] Trial 1306 finished with values: [-0.006781786440251736, 0.006750447798384092] and parameters: {'p_sma': 7, 'p_std': 22, 'p_atr': 23, 'p_adx': 30, 'rsi_period': 22, 'ema1': 23, 'ema2': 38, 'slip_atr_k': 0.20335174454239213, 'slip_spread_k': 0.39487702420407556, 'spread_hl_frac': 0.0057884085673412695, 'bb_std_mult': 1.6446018742364643, 'rsi_os': 28, 'rsi_ob': 62, 'vol_spike': 0.2773255419246947, 'adx_thresh': 25.57496253863734, 'atr_min_pct': 0.0020795572921364974, 'atr_max_pct': 0.07008157767506701, 'tp_mult': 1.4438887396181594, 'tsl_mult': 0.7921933041788243, 'strategy': 'mean_reversion', 'time_stop': 109, 'use_sma': False, 'use_atr': False, 'use_adx': False, 'use_ema': False, 'use_spike': False, 'rsi_required': False, 'edge_k': 0.7232161875975917, 'edge_cap': 0.7896250924761086}.
[I 2025-08-30 00:01:12,873] Trial 1303 finished with values: [-0.007174306331745872, 0.007461751117852346] and parameters: {'p_sma': 8, 'p_std': 60, 'p_atr': 23, 'p_adx': 23, 'rsi_period': 20, 'ema1': 24, 'ema2': 57, 'slip_atr_k': 0.01136855197150843, 'slip_spread_k': 0.832830731985549, 'spread_hl_frac': 0.005700116663894729, 'bb_std_mult': 1.6571779517232292, 'rsi_os': 50, 'rsi_ob': 54, 'vol_spike': 0.2582043219760304, 'adx_thresh': 15.029218479580894, 'atr_min_pct': 0.0021193726481784562, 'atr_max_pct': 0.09287753384146535, 'tp_mult': 1.0841391499873816, 'tsl_mult': 0.7248086623172854, 'strategy': 'breakout', 'time_stop': 102, 'use_sma': False, 'use_atr': False, 'use_adx': False, 'use_ema': False, 'use_spike': False, 'rsi_required': False, 'edge_k': 1.6110987997499127, 'edge_cap': 0.7469584273106792}.
[I 2025-08-30 00:01:12,874] Trial 1304 finished with values: [-0.019790935337722138, 0.01981991051100818] and parameters: {'p_sma': 8, 'p_std': 27, 'p_atr': 12, 'p_adx': 16, 'rsi_period': 22, 'ema1': 24, 'ema2': 56, 'slip_atr_k': 0.02946073401966086, 'slip_spread_k': 0.3932165342095456, 'spread_hl_frac': 0.04881747637819217, 'bb_std_mult': 1.6516346747196695, 'rsi_os': 44, 'rsi_ob': 61, 'vol_spike': 0.07786561861679787, 'adx_thresh': 22.08893291565015, 'atr_min_pct': 0.002086623068296697, 'atr_max_pct': 0.09217441005186656, 'tp_mult': 1.5541628437442236, 'tsl_mult': 0.7883578728368001, 'strategy': 'breakout', 'time_stop': 103, 'use_sma': False, 'use_atr': False, 'use_adx': False, 'use_ema': False, 'use_spike': False, 'rsi_required': False, 'edge_k': 0.4406637451467932, 'edge_cap': 0.8337435175773875}.
[I 2025-08-30 00:01:12,957] Trial 1305 finished with values: [-1000000000.0, 1000000000.0] and parameters: {'p_sma': 6, 'p_std': 36, 'p_atr': 23, 'p_adx': 16, 'rsi_period': 23, 'ema1': 8, 'ema2': 54, 'slip_atr_k': 0.029879043882955914, 'slip_spread_k': 0.8683457209174894, 'spread_hl_frac': 0.018913804673353025, 'bb_std_mult': 3.0911960376219643, 'rsi_os': 20, 'rsi_ob': 56, 'vol_spike': 0.13300367158760854, 'adx_thresh': 25.283452911401493, 'atr_min_pct': 0.00213669970670032, 'atr_max_pct': 0.014134731942263667, 'tp_mult': 2.4562466119534667, 'tsl_mult': 0.7345987883438441, 'strategy': 'breakout', 'time_stop': 106, 'use_sma': False, 'use_atr': False, 'use_adx': False, 'use_ema': False, 'use_spike': False, 'rsi_required': False, 'edge_k': 1.715322551772209, 'edge_cap': 0.7708937274610268}.
[I 2025-08-30 00:01:38,566] Trial 1310 finished with values: [-1000000000.0, 1000000000.0] and parameters: {'p_sma': 6, 'p_std': 22, 'p_atr': 24, 'p_adx': 12, 'rsi_period': 80, 'ema1': 30, 'ema2': 54, 'slip_atr_k': 0.03732555678810072, 'slip_spread_k': 0.9254702172657534, 'spread_hl_frac': 0.016394473989879126, 'bb_std_mult': 2.7344820540795833, 'rsi_os': 24, 'rsi_ob': 76, 'vol_spike': 0.17697226380318906, 'adx_thresh': 24.51499532271581, 'atr_min_pct': 0.0037594449675845912, 'atr_max_pct': 0.03197090330217735, 'tp_mult': 2.919903438490752, 'tsl_mult': 0.8706496411319617, 'strategy': 'mean_reversion', 'time_stop': 75, 'use_sma': False, 'use_atr': False, 'use_adx': False, 'use_ema': False, 'use_spike': False, 'rsi_required': False, 'edge_k': 1.2078980299277697, 'edge_cap': 0.8008964270258236}.
[I 2025-08-30 00:01:38,890] Trial 1308 finished with values: [-1000000000.0, 1000000000.0] and parameters: {'p_sma': 26, 'p_std': 32, 'p_atr': 22, 'p_adx': 19, 'rsi_period': 48, 'ema1': 9, 'ema2': 54, 'slip_atr_k': 0.21940089189134723, 'slip_spread_k': 0.8017676521089763, 'spread_hl_frac': 0.04110085627703612, 'bb_std_mult': 1.2575329984362587, 'rsi_os': 5, 'rsi_ob': 78, 'vol_spike': 0.17460665045673143, 'adx_thresh': 24.666771194934356, 'atr_min_pct': 0.004087489149890723, 'atr_max_pct': 0.09702557350113504, 'tp_mult': 2.928116895775137, 'tsl_mult': 0.7507885396754056, 'strategy': 'mean_reversion', 'time_stop': 75, 'use_sma': False, 'use_atr': False, 'use_adx': False, 'use_ema': False, 'use_spike': False, 'rsi_required': False, 'edge_k': 1.2111140593382443, 'edge_cap': 0.11043361416719644}.
[I 2025-08-30 00:01:38,986] Trial 1307 finished with values: [-1000000000.0, 1000000000.0] and parameters: {'p_sma': 19, 'p_std': 36, 'p_atr': 23, 'p_adx': 9, 'rsi_period': 43, 'ema1': 24, 'ema2': 54, 'slip_atr_k': 0.17558585147988662, 'slip_spread_k': 0.8613655616011244, 'spread_hl_frac': 0.042863735198738276, 'bb_std_mult': 2.124078628182092, 'rsi_os': 44, 'rsi_ob': 58, 'vol_spike': 0.17352902365959524, 'adx_thresh': 11.160113808593513, 'atr_min_pct': 0.022120988144331173, 'atr_max_pct': 0.09141110482950086, 'tp_mult': 2.1102333049611697, 'tsl_mult': 0.732141723615692, 'strategy': 'breakout', 'time_stop': 117, 'use_sma': False, 'use_atr': False, 'use_adx': False, 'use_ema': False, 'use_spike': False, 'rsi_required': False, 'edge_k': 0.48887168683928506, 'edge_cap': 0.7423534759934131}.
[I 2025-08-30 00:01:39,073] Trial 1309 finished with values: [-1000000000.0, 1000000000.0] and parameters: {'p_sma': 6, 'p_std': 25, 'p_atr': 22, 'p_adx': 16, 'rsi_period': 74, 'ema1': 23, 'ema2': 54, 'slip_atr_k': 0.037322829494264506, 'slip_spread_k': 0.8698610149218112, 'spread_hl_frac': 0.0366388829227126, 'bb_std_mult': 3.4095220879090022, 'rsi_os': 24, 'rsi_ob': 78, 'vol_spike': 0.04626875433642558, 'adx_thresh': 9.235356914259093, 'atr_min_pct': 0.02224482950752909, 'atr_max_pct': 0.0963568579389537, 'tp_mult': 1.2540753129832036, 'tsl_mult': 0.757861529041498, 'strategy': 'mean_reversion', 'time_stop': 94, 'use_sma': False, 'use_atr': False, 'use_adx': False, 'use_ema': False, 'use_spike': False, 'rsi_required': False, 'edge_k': 0.49903198282025074, 'edge_cap': 0.06751286399908762}.
[I 2025-08-30 00:02:05,250] Trial 1312 finished with values: [-1000000000.0, 1000000000.0] and parameters: {'p_sma': 7, 'p_std': 25, 'p_atr': 26, 'p_adx': 16, 'rsi_period': 17, 'ema1': 6, 'ema2': 27, 'slip_atr_k': 0.004000111811730074, 'slip_spread_k': 0.896747587341719, 'spread_hl_frac': 0.025287968385137076, 'bb_std_mult': 1.8640083243666652, 'rsi_os': 53, 'rsi_ob': 87, 'vol_spike': 0.16825471060512145, 'adx_thresh': 31.536661341659748, 'atr_min_pct': 0.006860798451458535, 'atr_max_pct': 0.10181662821439233, 'tp_mult': 1.6279856402862478, 'tsl_mult': 0.5931231009149444, 'strategy': 'breakout', 'time_stop': 116, 'use_sma': False, 'use_atr': False, 'use_adx': False, 'use_ema': False, 'use_spike': False, 'rsi_required': False, 'edge_k': 0.49268973169322483, 'edge_cap': 0.751477961107205}.
[I 2025-08-30 00:02:05,527] Trial 1311 finished with values: [-1000000000.0, 1000000000.0] and parameters: {'p_sma': 27, 'p_std': 32, 'p_atr': 22, 'p_adx': 9, 'rsi_period': 16, 'ema1': 25, 'ema2': 15, 'slip_atr_k': 0.21779270575919213, 'slip_spread_k': 0.8956904276750473, 'spread_hl_frac': 0.03809269145270606, 'bb_std_mult': 2.11948946244595, 'rsi_os': 25, 'rsi_ob': 94, 'vol_spike': 0.045804710527467415, 'adx_thresh': 25.74333461808468, 'atr_min_pct': 0.006937110261304424, 'atr_max_pct': 0.09726571353479999, 'tp_mult': 1.5951119601888493, 'tsl_mult': 0.7599690225601279, 'strategy': 'breakout', 'time_stop': 93, 'use_sma': False, 'use_atr': False, 'use_adx': False, 'use_ema': False, 'use_spike': False, 'rsi_required': False, 'edge_k': 0.8843651885450793, 'edge_cap': 0.7510571985730381}.
[I 2025-08-30 00:02:05,833] Trial 1313 finished with values: [-1000000000.0, 1000000000.0] and parameters: {'p_sma': 33, 'p_std': 16, 'p_atr': 20, 'p_adx': 16, 'rsi_period': 75, 'ema1': 6, 'ema2': 51, 'slip_atr_k': 0.23411772820380625, 'slip_spread_k': 0.7346783746449101, 'spread_hl_frac': 0.025583756670194344, 'bb_std_mult': 1.8609456101761852, 'rsi_os': 25, 'rsi_ob': 87, 'vol_spike': 0.29993191418993215, 'adx_thresh': 25.61363923730884, 'atr_min_pct': 0.015051305262936288, 'atr_max_pct': 0.10171887477050713, 'tp_mult': 1.1489816569440705, 'tsl_mult': 0.7578255208852159, 'strategy': 'breakout', 'time_stop': 94, 'use_sma': False, 'use_atr': False, 'use_adx': False, 'use_ema': False, 'use_spike': False, 'rsi_required': False, 'edge_k': 0.8702475887569092, 'edge_cap': 0.07399700263095788}.
[I 2025-08-30 00:02:05,844] Trial 1314 finished with values: [-1000000000.0, 1000000000.0] and parameters: {'p_sma': 50, 'p_std': 23, 'p_atr': 21, 'p_adx': 15, 'rsi_period': 17, 'ema1': 25, 'ema2': 33, 'slip_atr_k': 0.23494850289803287, 'slip_spread_k': 0.8970581979758391, 'spread_hl_frac': 0.039383990590937196, 'bb_std_mult': 1.8488566237352613, 'rsi_os': 25, 'rsi_ob': 64, 'vol_spike': 0.005170317634012683, 'adx_thresh': 13.16771812975949, 'atr_min_pct': 0.008288226468569193, 'atr_max_pct': 0.08829121569630269, 'tp_mult': 1.1636817119726186, 'tsl_mult': 0.647380330137264, 'strategy': 'breakout', 'time_stop': 63, 'use_sma': False, 'use_atr': False, 'use_adx': False, 'use_ema': False, 'use_spike': False, 'rsi_required': False, 'edge_k': 0.5578982135828034, 'edge_cap': 0.8085776689955422}.
[I 2025-08-30 00:02:31,714] Trial 1315 finished with values: [-1000000000.0, 1000000000.0] and parameters: {'p_sma': 8, 'p_std': 23, 'p_atr': 20, 'p_adx': 15, 'rsi_period': 26, 'ema1': 19, 'ema2': 50, 'slip_atr_k': 0.06950130956824471, 'slip_spread_k': 0.8377947955621952, 'spread_hl_frac': 0.04443027944440831, 'bb_std_mult': 1.9638321873191267, 'rsi_os': 48, 'rsi_ob': 91, 'vol_spike': 0.22829724856483224, 'adx_thresh': 25.67929436913979, 'atr_min_pct': 0.024395553502331732, 'atr_max_pct': 0.08963062652856525, 'tp_mult': 1.1486641592463054, 'tsl_mult': 0.7642018729376227, 'strategy': 'breakout', 'time_stop': 255, 'use_sma': False, 'use_atr': False, 'use_adx': False, 'use_ema': False, 'use_spike': False, 'rsi_required': False, 'edge_k': 0.8670179272703916, 'edge_cap': 0.7792038538409443}.
[I 2025-08-30 00:02:31,830] Trial 1316 finished with values: [-0.03685096016572986, 0.0368235311178641] and parameters: {'p_sma': 33, 'p_std': 23, 'p_atr': 9, 'p_adx': 15, 'rsi_period': 19, 'ema1': 19, 'ema2': 34, 'slip_atr_k': 0.0716610049019253, 'slip_spread_k': 0.8368005085323162, 'spread_hl_frac': 0.015635716546202712, 'bb_std_mult': 1.9523608493826732, 'rsi_os': 26, 'rsi_ob': 59, 'vol_spike': 0.2285497537436459, 'adx_thresh': 13.728766629147003, 'atr_min_pct': 0.0014235941055634471, 'atr_max_pct': 0.018576361047506283, 'tp_mult': 1.1421762523082268, 'tsl_mult': 0.6773476841242649, 'strategy': 'breakout', 'time_stop': 254, 'use_sma': False, 'use_atr': False, 'use_adx': False, 'use_ema': False, 'use_spike': False, 'rsi_required': False, 'edge_k': 0.5711457850070242, 'edge_cap': 0.8082349700428423}.
[I 2025-08-30 00:02:31,965] Trial 1318 finished with values: [-1000000000.0, 1000000000.0] and parameters: {'p_sma': 7, 'p_std': 28, 'p_atr': 25, 'p_adx': 17, 'rsi_period': 19, 'ema1': 17, 'ema2': 53, 'slip_atr_k': 0.06978253108623794, 'slip_spread_k': 0.4984458678394373, 'spread_hl_frac': 0.01787457642389011, 'bb_std_mult': 1.9695797200151788, 'rsi_os': 47, 'rsi_ob': 70, 'vol_spike': 0.24577022512993535, 'adx_thresh': 25.063176499685035, 'atr_min_pct': 0.02466378861959661, 'atr_max_pct': 0.09353128187707124, 'tp_mult': 1.1156341433743031, 'tsl_mult': 0.6712201659567057, 'strategy': 'breakout', 'time_stop': 111, 'use_sma': False, 'use_atr': False, 'use_adx': False, 'use_ema': False, 'use_spike': False, 'rsi_required': False, 'edge_k': 0.6336156178404795, 'edge_cap': 0.7764869943711579}.
[I 2025-08-30 00:02:31,970] Trial 1317 finished with values: [-0.012719989209653115, 0.012695639075118241] and parameters: {'p_sma': 50, 'p_std': 23, 'p_atr': 21, 'p_adx': 15, 'rsi_period': 36, 'ema1': 26, 'ema2': 34, 'slip_atr_k': 0.018644149084648245, 'slip_spread_k': 0.8351216268397474, 'spread_hl_frac': 0.0177505343931006, 'bb_std_mult': 1.9792518399928234, 'rsi_os': 32, 'rsi_ob': 91, 'vol_spike': 0.23360672620145634, 'adx_thresh': 13.269144042571629, 'atr_min_pct': 0.002738920832481633, 'atr_max_pct': 0.026618671658843802, 'tp_mult': 1.0109670176752983, 'tsl_mult': 0.6730844783340025, 'strategy': 'breakout', 'time_stop': 271, 'use_sma': False, 'use_atr': False, 'use_adx': False, 'use_ema': False, 'use_spike': False, 'rsi_required': False, 'edge_k': 0.5605740061277452, 'edge_cap': 0.8111151380520956}.
[I 2025-08-30 00:02:58,084] Trial 1320 finished with values: [-1000000000.0, 1000000000.0] and parameters: {'p_sma': 38, 'p_std': 55, 'p_atr': 24, 'p_adx': 17, 'rsi_period': 78, 'ema1': 22, 'ema2': 36, 'slip_atr_k': 0.1363677882061941, 'slip_spread_k': 0.7972360014140304, 'spread_hl_frac': 0.01813717547053485, 'bb_std_mult': 2.0469585145079523, 'rsi_os': 7, 'rsi_ob': 57, 'vol_spike': 0.24336965515155623, 'adx_thresh': 23.355823229966212, 'atr_min_pct': 0.002740874672992991, 'atr_max_pct': 0.05799215357114405, 'tp_mult': 2.515183037769833, 'tsl_mult': 0.7227681092123945, 'strategy': 'breakout', 'time_stop': 171, 'use_sma': False, 'use_atr': False, 'use_adx': False, 'use_ema': False, 'use_spike': False, 'rsi_required': False, 'edge_k': 1.8752093190642896, 'edge_cap': 0.7836931493660957}.
[I 2025-08-30 00:02:58,130] Trial 1319 finished with values: [-0.013599733222475319, 0.013547242940354094] and parameters: {'p_sma': 9, 'p_std': 56, 'p_atr': 24, 'p_adx': 17, 'rsi_period': 69, 'ema1': 28, 'ema2': 53, 'slip_atr_k': 0.01882663922719918, 'slip_spread_k': 0.7984271943482432, 'spread_hl_frac': 0.020941057410649583, 'bb_std_mult': 0.7505462484926266, 'rsi_os': 46, 'rsi_ob': 57, 'vol_spike': 0.2458134781318539, 'adx_thresh': 23.730075502697275, 'atr_min_pct': 0.0014200073947721339, 'atr_max_pct': 0.0260515055213279, 'tp_mult': 2.5259456942132386, 'tsl_mult': 0.715165565757568, 'strategy': 'breakout', 'time_stop': 124, 'use_sma': False, 'use_atr': False, 'use_adx': False, 'use_ema': False, 'use_spike': False, 'rsi_required': False, 'edge_k': 0.548615838257628, 'edge_cap': 0.7848945719112822}.
[I 2025-08-30 00:02:58,339] Trial 1321 finished with values: [-1000000000.0, 1000000000.0] and parameters: {'p_sma': 9, 'p_std': 26, 'p_atr': 11, 'p_adx': 27, 'rsi_period': 24, 'ema1': 28, 'ema2': 52, 'slip_atr_k': 0.1468345959068662, 'slip_spread_k': 0.8015656705598898, 'spread_hl_frac': 0.018941872671442296, 'bb_std_mult': 2.3253315698141384, 'rsi_os': 29, 'rsi_ob': 88, 'vol_spike': 0.18007394217813236, 'adx_thresh': 29.12731340047234, 'atr_min_pct': 0.01734192660535655, 'atr_max_pct': 0.044046534289733395, 'tp_mult': 1.1835943059777414, 'tsl_mult': 0.7201601657909626, 'strategy': 'mean_reversion', 'time_stop': 121, 'use_sma': False, 'use_atr': False, 'use_adx': False, 'use_ema': False, 'use_spike': False, 'rsi_required': False, 'edge_k': 1.8799575468014276, 'edge_cap': 0.4625222077085893}.
[I 2025-08-30 00:02:58,347] Trial 1322 finished with values: [-1000000000.0, 1000000000.0] and parameters: {'p_sma': 9, 'p_std': 20, 'p_atr': 24, 'p_adx': 18, 'rsi_period': 24, 'ema1': 28, 'ema2': 52, 'slip_atr_k': 0.01211736245801349, 'slip_spread_k': 0.800543843930531, 'spread_hl_frac': 0.026961179502548005, 'bb_std_mult': 2.0476302906700585, 'rsi_os': 29, 'rsi_ob': 58, 'vol_spike': 0.19046797049337155, 'adx_thresh': 23.482682632516354, 'atr_min_pct': 0.014113431202965543, 'atr_max_pct': 0.0591510672011895, 'tp_mult': 1.1792087314836366, 'tsl_mult': 0.7234722216293838, 'strategy': 'mean_reversion', 'time_stop': 181, 'use_sma': False, 'use_atr': False, 'use_adx': False, 'use_ema': False, 'use_spike': False, 'rsi_required': False, 'edge_k': 0.23875572397290423, 'edge_cap': 0.7192576844910459}.
