[I 2025-08-29 23:24:42,156] Trial 972 finished with values: [-1000000000.0, 1000000000.0] and parameters: {'p_sma': 8, 'p_std': 47, 'p_atr': 30, 'p_adx': 15, 'rsi_period': 20, 'ema1': 12, 'ema2': 54, 'slip_atr_k': 0.16150531250591502, 'slip_spread_k': 0.035969517098469406, 'spread_hl_frac': 0.03703345430342459, 'bb_std_mult': 3.179015344298746, 'rsi_os': 24, 'rsi_ob': 60, 'vol_spike': 0.153083254575413, 'adx_thresh': 26.82705232448204, 'atr_min_pct': 0.022564113902919625, 'atr_max_pct': 0.03622927733632554, 'tp_mult': 1.042979464609477, 'tsl_mult': 0.4202611012293599, 'strategy': 'breakout', 'time_stop': 179, 'use_sma': False, 'use_atr': False, 'use_adx': False, 'use_ema': False, 'use_spike': False, 'rsi_required': False, 'edge_k': 0.48614387252359753, 'edge_cap': 0.8026346556628934}.
[I 2025-08-29 23:24:42,406] Trial 973 finished with values: [-1000000000.0, 1000000000.0] and parameters: {'p_sma': 8, 'p_std': 22, 'p_atr': 23, 'p_adx': 16, 'rsi_period': 19, 'ema1': 23, 'ema2': 54, 'slip_atr_k': 0.18246831773763025, 'slip_spread_k': 0.8032175843508821, 'spread_hl_frac': 0.01716666869210855, 'bb_std_mult': 2.0675350369107295, 'rsi_os': 24, 'rsi_ob': 61, 'vol_spike': 0.16248520648124987, 'adx_thresh': 31.8869255980201, 'atr_min_pct': 0.02248048496029323, 'atr_max_pct': 0.09600533130248655, 'tp_mult': 1.1737394617607004, 'tsl_mult': 0.7580978262254925, 'strategy': 'breakout', 'time_stop': 116, 'use_sma': False, 'use_atr': False, 'use_adx': False, 'use_ema': False, 'use_spike': False, 'rsi_required': False, 'edge_k': 1.8270828204660319, 'edge_cap': 0.7111627340436447}.
[I 2025-08-29 23:25:09,428] Trial 976 finished with values: [-1000000000.0, 1000000000.0] and parameters: {'p_sma': 7, 'p_std': 23, 'p_atr': 12, 'p_adx': 9, 'rsi_period': 19, 'ema1': 23, 'ema2': 56, 'slip_atr_k': 0.18202289233629457, 'slip_spread_k': 0.8073743424207644, 'spread_hl_frac': 0.01723766727070677, 'bb_std_mult': 2.0597053542559967, 'rsi_os': 12, 'rsi_ob': 80, 'vol_spike': 0.1816225013188955, 'adx_thresh': 25.318602743219046, 'atr_min_pct': 0.0021270583088751588, 'atr_max_pct': 0.1106267070286492, 'tp_mult': 1.168475083637483, 'tsl_mult': 0.7580697959378968, 'strategy': 'breakout', 'time_stop': 224, 'use_sma': False, 'use_atr': False, 'use_adx': False, 'use_ema': False, 'use_spike': False, 'rsi_required': False, 'edge_k': 0.0036849108599259495, 'edge_cap': 0.7578667203991086}.
[I 2025-08-29 23:25:09,561] Trial 977 finished with values: [-0.01839882505178081, 0.018393004833637448] and parameters: {'p_sma': 6, 'p_std': 24, 'p_atr': 12, 'p_adx': 9, 'rsi_period': 16, 'ema1': 17, 'ema2': 56, 'slip_atr_k': 0.10388212251361267, 'slip_spread_k': 0.630417132078272, 'spread_hl_frac': 0.018516264693311912, 'bb_std_mult': 1.527742905782608, 'rsi_os': 41, 'rsi_ob': 49, 'vol_spike': 0.18088728149340796, 'adx_thresh': 25.716322979649973, 'atr_min_pct': 0.002250790389947999, 'atr_max_pct': 0.0940802933067461, 'tp_mult': 1.5160100126747504, 'tsl_mult': 0.7198195678414503, 'strategy': 'breakout', 'time_stop': 126, 'use_sma': False, 'use_atr': False, 'use_adx': False, 'use_ema': False, 'use_spike': False, 'rsi_required': False, 'edge_k': 0.41518369895253915, 'edge_cap': 0.7601115690803187}.
[I 2025-08-29 23:25:09,871] Trial 974 finished with values: [-1000000000.0, 1000000000.0] and parameters: {'p_sma': 8, 'p_std': 22, 'p_atr': 23, 'p_adx': 9, 'rsi_period': 29, 'ema1': 17, 'ema2': 55, 'slip_atr_k': 0.08358050134966293, 'slip_spread_k': 0.02740157720546388, 'spread_hl_frac': 0.045313795500341536, 'bb_std_mult': 2.9973895552112384, 'rsi_os': 12, 'rsi_ob': 88, 'vol_spike': 0.18266761315479246, 'adx_thresh': 32.12138847752685, 'atr_min_pct': 0.01334658810864575, 'atr_max_pct': 0.05154151286007243, 'tp_mult': 1.1545621711064005, 'tsl_mult': 0.7651627836167273, 'strategy': 'breakout', 'time_stop': 114, 'use_sma': False, 'use_atr': False, 'use_adx': False, 'use_ema': False, 'use_spike': False, 'rsi_required': False, 'edge_k': 0.09320850167700911, 'edge_cap': 0.35952760465430705}.
[I 2025-08-29 23:25:10,013] Trial 975 finished with values: [-0.010142471742068837, 0.010140786045264565] and parameters: {'p_sma': 55, 'p_std': 54, 'p_atr': 23, 'p_adx': 16, 'rsi_period': 19, 'ema1': 17, 'ema2': 50, 'slip_atr_k': 0.021431097988123985, 'slip_spread_k': 0.8079031708484303, 'spread_hl_frac': 0.016956736520169047, 'bb_std_mult': 2.0486891360775994, 'rsi_os': 24, 'rsi_ob': 60, 'vol_spike': 0.18117966862234586, 'adx_thresh': 26.736055734069332, 'atr_min_pct': 0.002175333350554903, 'atr_max_pct': 0.058712446067903136, 'tp_mult': 1.5266702398086929, 'tsl_mult': 0.7624689538347615, 'strategy': 'breakout', 'time_stop': 12, 'use_sma': False, 'use_atr': False, 'use_adx': False, 'use_ema': False, 'use_spike': False, 'rsi_required': False, 'edge_k': 0.43625637364622, 'edge_cap': 0.6477786108143572}.
[I 2025-08-29 23:25:37,528] Trial 981 finished with values: [-1000000000.0, 1000000000.0] and parameters: {'p_sma': 41, 'p_std': 10, 'p_atr': 19, 'p_adx': 17, 'rsi_period': 26, 'ema1': 9, 'ema2': 34, 'slip_atr_k': 0.009332637338385845, 'slip_spread_k': 0.8261988383862365, 'spread_hl_frac': 0.015490936009063792, 'bb_std_mult': 3.26342259374268, 'rsi_os': 21, 'rsi_ob': 57, 'vol_spike': 0.20643171052500875, 'adx_thresh': 22.91166132572206, 'atr_min_pct': 0.029079825953712383, 'atr_max_pct': 0.08580204967162289, 'tp_mult': 1.0946960365536276, 'tsl_mult': 0.6862953844446407, 'strategy': 'mean_reversion', 'time_stop': 91, 'use_sma': False, 'use_atr': False, 'use_adx': False, 'use_ema': False, 'use_spike': False, 'rsi_required': False, 'edge_k': 0.8754404493112242, 'edge_cap': 0.07051056360746416}.
[I 2025-08-29 23:25:37,759] Trial 978 finished with values: [-1000000000.0, 1000000000.0] and parameters: {'p_sma': 9, 'p_std': 5, 'p_atr': 23, 'p_adx': 30, 'rsi_period': 26, 'ema1': 11, 'ema2': 50, 'slip_atr_k': 0.021778238055709054, 'slip_spread_k': 0.7564491375092769, 'spread_hl_frac': 0.0406898395525791, 'bb_std_mult': 1.9505399029932624, 'rsi_os': 14, 'rsi_ob': 57, 'vol_spike': 0.17861871646627778, 'adx_thresh': 12.277208259316975, 'atr_min_pct': 0.013287984723863496, 'atr_max_pct': 0.061622001238491174, 'tp_mult': 1.53466415293361, 'tsl_mult': 0.3762703269089491, 'strategy': 'breakout', 'time_stop': 109, 'use_sma': False, 'use_atr': False, 'use_adx': False, 'use_ema': False, 'use_spike': False, 'rsi_required': False, 'edge_k': 0.4105268565936663, 'edge_cap': 0.7633810381201861}.
[I 2025-08-29 23:25:37,944] Trial 979 finished with values: [-1000000000.0, 1000000000.0] and parameters: {'p_sma': 54, 'p_std': 45, 'p_atr': 23, 'p_adx': 27, 'rsi_period': 26, 'ema1': 24, 'ema2': 54, 'slip_atr_k': 0.0839264832253056, 'slip_spread_k': 0.18124470061036674, 'spread_hl_frac': 0.015346213965984179, 'bb_std_mult': 0.5292633267129834, 'rsi_os': 26, 'rsi_ob': 58, 'vol_spike': 0.20382954897923272, 'adx_thresh': 24.766839953405682, 'atr_min_pct': 0.0239187132888087, 'atr_max_pct': 0.08711082516595567, 'tp_mult': 1.0905342121086452, 'tsl_mult': 0.7072896738940735, 'strategy': 'breakout', 'time_stop': 164, 'use_sma': False, 'use_atr': False, 'use_adx': False, 'use_ema': False, 'use_spike': False, 'rsi_required': False, 'edge_k': 0.8734920160778634, 'edge_cap': 0.8457037690786045}.
[I 2025-08-29 23:25:38,066] Trial 980 finished with values: [-1000000000.0, 1000000000.0] and parameters: {'p_sma': 25, 'p_std': 25, 'p_atr': 25, 'p_adx': 17, 'rsi_period': 26, 'ema1': 24, 'ema2': 12, 'slip_atr_k': 0.021560548704572007, 'slip_spread_k': 0.08418859923623023, 'spread_hl_frac': 0.01521702084329854, 'bb_std_mult': 1.9475853387786042, 'rsi_os': 21, 'rsi_ob': 58, 'vol_spike': 0.20059628260167556, 'adx_thresh': 24.96964192260292, 'atr_min_pct': 0.02393499232981773, 'atr_max_pct': 0.10215076825678998, 'tp_mult': 1.8090291932738847, 'tsl_mult': 0.6866410350461521, 'strategy': 'breakout', 'time_stop': 42, 'use_sma': False, 'use_atr': False, 'use_adx': False, 'use_ema': False, 'use_spike': False, 'rsi_required': False, 'edge_k': 0.7276178750318771, 'edge_cap': 0.8138722724992897}.
[I 2025-08-29 23:26:04,987] Trial 983 finished with values: [-1000000000.0, 1000000000.0] and parameters: {'p_sma': 6, 'p_std': 51, 'p_atr': 26, 'p_adx': 17, 'rsi_period': 21, 'ema1': 24, 'ema2': 33, 'slip_atr_k': 0.01609295870434653, 'slip_spread_k': 0.9797473331400259, 'spread_hl_frac': 0.019850781106473415, 'bb_std_mult': 0.5224936328930971, 'rsi_os': 44, 'rsi_ob': 59, 'vol_spike': 0.17470117034851348, 'adx_thresh': 24.83044048500945, 'atr_min_pct': 0.003096466791147566, 'atr_max_pct': 0.02561018686278753, 'tp_mult': 2.358131849471391, 'tsl_mult': 0.08428814554893493, 'strategy': 'breakout', 'time_stop': 288, 'use_sma': False, 'use_atr': False, 'use_adx': False, 'use_ema': False, 'use_spike': False, 'rsi_required': False, 'edge_k': 0.5287071868245351, 'edge_cap': 0.9628826533726732}.
[I 2025-08-29 23:26:05,108] Trial 985 finished with values: [-1000000000.0, 1000000000.0] and parameters: {'p_sma': 50, 'p_std': 51, 'p_atr': 24, 'p_adx': 16, 'rsi_period': 55, 'ema1': 23, 'ema2': 33, 'slip_atr_k': 0.015609223876724698, 'slip_spread_k': 0.8539241027966734, 'spread_hl_frac': 0.01942756102846054, 'bb_std_mult': 2.1222728229468553, 'rsi_os': 45, 'rsi_ob': 78, 'vol_spike': 0.18787856378993853, 'adx_thresh': 8.525906623799823, 'atr_min_pct': 0.003172291751677535, 'atr_max_pct': 0.09709754191944166, 'tp_mult': 1.217034896628546, 'tsl_mult': 0.9294550083759686, 'strategy': 'mean_reversion', 'time_stop': 266, 'use_sma': False, 'use_atr': False, 'use_adx': False, 'use_ema': False, 'use_spike': False, 'rsi_required': False, 'edge_k': 1.6731773803307701, 'edge_cap': 0.11555274097114582}.
[I 2025-08-29 23:26:05,361] Trial 984 finished with values: [-0.011965913274693762, 0.01196797931874486] and parameters: {'p_sma': 21, 'p_std': 51, 'p_atr': 25, 'p_adx': 8, 'rsi_period': 21, 'ema1': 23, 'ema2': 55, 'slip_atr_k': 0.00019690385230265728, 'slip_spread_k': 0.6775337599998117, 'spread_hl_frac': 0.01981387518420892, 'bb_std_mult': 2.1275359984187157, 'rsi_os': 45, 'rsi_ob': 50, 'vol_spike': 0.09091954279766867, 'adx_thresh': 24.135125084349305, 'atr_min_pct': 0.0030841436048896958, 'atr_max_pct': 0.09770050762132962, 'tp_mult': 1.2448672814381245, 'tsl_mult': 0.9356789872570266, 'strategy': 'breakout', 'time_stop': 45, 'use_sma': False, 'use_atr': False, 'use_adx': False, 'use_ema': False, 'use_spike': False, 'rsi_required': False, 'edge_k': 0.5234341510916596, 'edge_cap': 0.3953811324585152}.
[I 2025-08-29 23:26:05,567] Trial 982 finished with values: [-1000000000.0, 1000000000.0] and parameters: {'p_sma': 9, 'p_std': 26, 'p_atr': 26, 'p_adx': 8, 'rsi_period': 56, 'ema1': 7, 'ema2': 16, 'slip_atr_k': 0.017230969294875893, 'slip_spread_k': 0.8520240224370429, 'spread_hl_frac': 0.019102762426197368, 'bb_std_mult': 1.9404035101250066, 'rsi_os': 45, 'rsi_ob': 78, 'vol_spike': 0.17598886995840918, 'adx_thresh': 12.229409666080349, 'atr_min_pct': 0.004637967289184239, 'atr_max_pct': 0.10165264274989619, 'tp_mult': 2.766042829816447, 'tsl_mult': 0.9317488605268729, 'strategy': 'breakout', 'time_stop': 109, 'use_sma': False, 'use_atr': False, 'use_adx': False, 'use_ema': False, 'use_spike': False, 'rsi_required': False, 'edge_k': 0.7216140303933194, 'edge_cap': 0.39949790546443376}.
[I 2025-08-29 23:26:33,446] Trial 987 finished with values: [-1000000000.0, 1000000000.0] and parameters: {'p_sma': 26, 'p_std': 28, 'p_atr': 11, 'p_adx': 15, 'rsi_period': 22, 'ema1': 25, 'ema2': 16, 'slip_atr_k': 0.010119111572322079, 'slip_spread_k': 0.12020277896785236, 'spread_hl_frac': 0.03528573694743995, 'bb_std_mult': 0.6671566353610578, 'rsi_os': 26, 'rsi_ob': 61, 'vol_spike': 0.2890592699357788, 'adx_thresh': 21.696400734464024, 'atr_min_pct': 0.02141164504369463, 'atr_max_pct': 0.08136737080380602, 'tp_mult': 2.7621866748308816, 'tsl_mult': 0.7232410495421684, 'strategy': 'breakout', 'time_stop': 59, 'use_sma': False, 'use_atr': False, 'use_adx': False, 'use_ema': False, 'use_spike': False, 'rsi_required': False, 'edge_k': 0.2594083684609505, 'edge_cap': 0.7953235788258253}.
[I 2025-08-29 23:26:33,622] Trial 989 finished with values: [-0.05852222788192374, 0.05849733314461134] and parameters: {'p_sma': 38, 'p_std': 26, 'p_atr': 11, 'p_adx': 10, 'rsi_period': 16, 'ema1': 25, 'ema2': 53, 'slip_atr_k': 0.010733029030240971, 'slip_spread_k': 0.7922020167087624, 'spread_hl_frac': 0.016382277456082693, 'bb_std_mult': 2.7421360240568147, 'rsi_os': 10, 'rsi_ob': 61, 'vol_spike': 0.2896467817671633, 'adx_thresh': 26.119580518235566, 'atr_min_pct': 0.0015186673976559885, 'atr_max_pct': 0.12167107237531338, 'tp_mult': 2.6729175203387685, 'tsl_mult': 0.7316660245285362, 'strategy': 'mean_reversion', 'time_stop': 96, 'use_sma': False, 'use_atr': False, 'use_adx': False, 'use_ema': False, 'use_spike': False, 'rsi_required': False, 'edge_k': 0.7823172479290168, 'edge_cap': 0.7920493583057187}.
[I 2025-08-29 23:26:33,774] Trial 986 finished with values: [-1000000000.0, 1000000000.0] and parameters: {'p_sma': 5, 'p_std': 49, 'p_atr': 11, 'p_adx': 16, 'rsi_period': 13, 'ema1': 23, 'ema2': 55, 'slip_atr_k': 0.01087037622382989, 'slip_spread_k': 0.7883255203527821, 'spread_hl_frac': 0.022025583905664874, 'bb_std_mult': 1.4337643546336727, 'rsi_os': 10, 'rsi_ob': 60, 'vol_spike': 0.08972264384149617, 'adx_thresh': 24.019141864068253, 'atr_min_pct': 0.008360961537602896, 'atr_max_pct': 0.0816398879624833, 'tp_mult': 2.1476224404327313, 'tsl_mult': 0.9335505765061671, 'strategy': 'mean_reversion', 'time_stop': 96, 'use_sma': False, 'use_atr': False, 'use_adx': False, 'use_ema': False, 'use_spike': False, 'rsi_required': False, 'edge_k': 0.4886797489732935, 'edge_cap': 0.7918328024626583}.
[I 2025-08-29 23:26:34,003] Trial 988 finished with values: [-0.014930049704917292, 0.01490709539162538] and parameters: {'p_sma': 39, 'p_std': 26, 'p_atr': 22, 'p_adx': 16, 'rsi_period': 35, 'ema1': 6, 'ema2': 39, 'slip_atr_k': 0.050302819313208305, 'slip_spread_k': 0.789499095420618, 'spread_hl_frac': 0.018540972918389704, 'bb_std_mult': 1.868721558951512, 'rsi_os': 27, 'rsi_ob': 61, 'vol_spike': 0.046001556524583403, 'adx_thresh': 25.96023458678809, 'atr_min_pct': 0.0012726190641392271, 'atr_max_pct': 0.09412562087610453, 'tp_mult': 2.743457218086397, 'tsl_mult': 0.7288105876317452, 'strategy': 'breakout', 'time_stop': 108, 'use_sma': False, 'use_atr': False, 'use_adx': False, 'use_ema': False, 'use_spike': False, 'rsi_required': False, 'edge_k': 0.26697160287210703, 'edge_cap': 0.7921250451446048}.
[I 2025-08-29 23:27:01,352] Trial 992 finished with values: [-1000000000.0, 1000000000.0] and parameters: {'p_sma': 7, 'p_std': 24, 'p_atr': 22, 'p_adx': 20, 'rsi_period': 60, 'ema1': 24, 'ema2': 60, 'slip_atr_k': 0.11453041768413652, 'slip_spread_k': 0.835453961155587, 'spread_hl_frac': 0.04672151097100041, 'bb_std_mult': 1.8680511340279065, 'rsi_os': 27, 'rsi_ob': 69, 'vol_spike': 0.03402361566784273, 'adx_thresh': 10.374809858025658, 'atr_min_pct': 0.003864624640733255, 'atr_max_pct': 0.09398933583442069, 'tp_mult': 1.146503486060053, 'tsl_mult': 0.7837885030490898, 'strategy': 'breakout', 'time_stop': 121, 'use_sma': False, 'use_atr': False, 'use_adx': False, 'use_ema': False, 'use_spike': False, 'rsi_required': False, 'edge_k': 0.5879661876751652, 'edge_cap': 0.8183276290930751}.
[I 2025-08-29 23:27:01,912] Trial 991 finished with values: [-0.009166872360923506, 0.009150336919063815] and parameters: {'p_sma': 10, 'p_std': 48, 'p_atr': 22, 'p_adx': 18, 'rsi_period': 20, 'ema1': 24, 'ema2': 52, 'slip_atr_k': 0.030692748233399226, 'slip_spread_k': 0.8231335835781356, 'spread_hl_frac': 0.01801619767744139, 'bb_std_mult': 1.8806883407832053, 'rsi_os': 27, 'rsi_ob': 52, 'vol_spike': 0.04660946834772252, 'adx_thresh': 25.762686317722522, 'atr_min_pct': 0.0012263213816421953, 'atr_max_pct': 0.09343367836861348, 'tp_mult': 2.5494464096972185, 'tsl_mult': 0.8319323255450306, 'strategy': 'breakout', 'time_stop': 120, 'use_sma': False, 'use_atr': False, 'use_adx': False, 'use_ema': False, 'use_spike': False, 'rsi_required': False, 'edge_k': 0.5947783611333209, 'edge_cap': 0.8877750984147024}.
[I 2025-08-29 23:27:01,934] Trial 990 finished with values: [-0.028807842491171853, 0.028792231830255234] and parameters: {'p_sma': 37, 'p_std': 24, 'p_atr': 13, 'p_adx': 18, 'rsi_period': 52, 'ema1': 24, 'ema2': 22, 'slip_atr_k': 0.02783023877805192, 'slip_spread_k': 0.785415619781423, 'spread_hl_frac': 0.01815444007870898, 'bb_std_mult': 2.00216890306723, 'rsi_os': 27, 'rsi_ob': 60, 'vol_spike': 0.006331242356060002, 'adx_thresh': 26.100047582285796, 'atr_min_pct': 0.0013319826477615174, 'atr_max_pct': 0.09378922383281552, 'tp_mult': 1.1332195421356708, 'tsl_mult': 0.7314177253854515, 'strategy': 'mean_reversion', 'time_stop': 96, 'use_sma': False, 'use_atr': False, 'use_adx': False, 'use_ema': False, 'use_spike': False, 'rsi_required': False, 'edge_k': 0.7932409377779134, 'edge_cap': 0.8869238172328432}.
[I 2025-08-29 23:27:02,035] Trial 993 finished with values: [-1000000000.0, 1000000000.0] and parameters: {'p_sma': 19, 'p_std': 30, 'p_atr': 22, 'p_adx': 15, 'rsi_period': 60, 'ema1': 24, 'ema2': 52, 'slip_atr_k': 0.05950167731899125, 'slip_spread_k': 0.3485650396412012, 'spread_hl_frac': 0.017565139438992503, 'bb_std_mult': 1.6926867793477585, 'rsi_os': 25, 'rsi_ob': 52, 'vol_spike': 0.18834675674086407, 'adx_thresh': 17.393297133204, 'atr_min_pct': 0.004041631460472384, 'atr_max_pct': 0.017719875843931428, 'tp_mult': 2.554997503358858, 'tsl_mult': 0.0027051622446939705, 'strategy': 'breakout', 'time_stop': 70, 'use_sma': False, 'use_atr': False, 'use_adx': False, 'use_ema': False, 'use_spike': False, 'rsi_required': False, 'edge_k': 0.5534203587129738, 'edge_cap': 0.7683172284107094}.
[I 2025-08-29 23:27:28,870] Trial 997 finished with values: [-1000000000.0, 1000000000.0] and parameters: {'p_sma': 47, 'p_std': 27, 'p_atr': 10, 'p_adx': 19, 'rsi_period': 70, 'ema1': 8, 'ema2': 43, 'slip_atr_k': 0.025992213299200817, 'slip_spread_k': 0.8135394928740822, 'spread_hl_frac': 0.016320606128998102, 'bb_std_mult': 2.0381903462872253, 'rsi_os': 25, 'rsi_ob': 75, 'vol_spike': 0.08432930001426789, 'adx_thresh': 6.3374543210340075, 'atr_min_pct': 0.024774930644316948, 'atr_max_pct': 0.09860548174337831, 'tp_mult': 1.6903512300944388, 'tsl_mult': 0.5221060062489145, 'strategy': 'breakout', 'time_stop': 274, 'use_sma': False, 'use_atr': False, 'use_adx': False, 'use_ema': False, 'use_spike': False, 'rsi_required': False, 'edge_k': 1.0936146313516124, 'edge_cap': 0.8500710479283076}.
[I 2025-08-29 23:27:29,063] Trial 996 finished with values: [-1000000000.0, 1000000000.0] and parameters: {'p_sma': 19, 'p_std': 29, 'p_atr': 24, 'p_adx': 21, 'rsi_period': 18, 'ema1': 30, 'ema2': 54, 'slip_atr_k': 0.10947346763756809, 'slip_spread_k': 0.8870852023460885, 'spread_hl_frac': 0.002025369947193007, 'bb_std_mult': 2.033933573363733, 'rsi_os': 36, 'rsi_ob': 59, 'vol_spike': 0.11185575905601174, 'adx_thresh': 15.950269145357264, 'atr_min_pct': 0.024857451588362882, 'atr_max_pct': 0.08924806485736377, 'tp_mult': 1.0865163932328081, 'tsl_mult': 0.7050714526609912, 'strategy': 'breakout', 'time_stop': 104, 'use_sma': False, 'use_atr': False, 'use_adx': False, 'use_ema': False, 'use_spike': False, 'rsi_required': False, 'edge_k': 0.3836335408571428, 'edge_cap': 0.775068299775125}.
[I 2025-08-29 23:27:29,506] Trial 994 finished with values: [-1000000000.0, 1000000000.0] and parameters: {'p_sma': 10, 'p_std': 9, 'p_atr': 13, 'p_adx': 23, 'rsi_period': 76, 'ema1': 24, 'ema2': 41, 'slip_atr_k': 0.030186207360363232, 'slip_spread_k': 0.8223823375668583, 'spread_hl_frac': 0.03928807887493113, 'bb_std_mult': 1.699990806626382, 'rsi_os': 34, 'rsi_ob': 82, 'vol_spike': 0.18809838093976877, 'adx_thresh': 25.41416973465102, 'atr_min_pct': 0.028007878099687848, 'atr_max_pct': 0.05437681164021435, 'tp_mult': 1.0834889614746486, 'tsl_mult': 0.7457779644279874, 'strategy': 'breakout', 'time_stop': 155, 'use_sma': False, 'use_atr': False, 'use_adx': False, 'use_ema': False, 'use_spike': False, 'rsi_required': False, 'edge_k': 0.45728102965486417, 'edge_cap': 0.7699968342247988}.
[I 2025-08-29 23:27:29,599] Trial 995 finished with values: [-1000000000.0, 1000000000.0] and parameters: {'p_sma': 49, 'p_std': 29, 'p_atr': 29, 'p_adx': 21, 'rsi_period': 17, 'ema1': 18, 'ema2': 54, 'slip_atr_k': 0.06679209181956572, 'slip_spread_k': 0.8844854878571443, 'spread_hl_frac': 0.01639671391311279, 'bb_std_mult': 2.029928140321648, 'rsi_os': 29, 'rsi_ob': 59, 'vol_spike': 0.18537735707672987, 'adx_thresh': 6.255778586310052, 'atr_min_pct': 0.011130880159649985, 'atr_max_pct': 0.09020371724866268, 'tp_mult': 1.9864249516335275, 'tsl_mult': 0.7419361123843901, 'strategy': 'breakout', 'time_stop': 244, 'use_sma': False, 'use_atr': False, 'use_adx': False, 'use_ema': False, 'use_spike': False, 'rsi_required': False, 'edge_k': 0.3714894493870716, 'edge_cap': 0.7710290263539575}.
[I 2025-08-29 23:27:56,881] Trial 998 finished with values: [-1000000000.0, 1000000000.0] and parameters: {'p_sma': 6, 'p_std': 18, 'p_atr': 24, 'p_adx': 11, 'rsi_period': 76, 'ema1': 25, 'ema2': 28, 'slip_atr_k': 0.1340544433228196, 'slip_spread_k': 0.7687197802170095, 'spread_hl_frac': 0.0017168502508601788, 'bb_std_mult': 2.1197260281621, 'rsi_os': 5, 'rsi_ob': 59, 'vol_spike': 0.17313371452336265, 'adx_thresh': 8.97449888634619, 'atr_min_pct': 0.0026509642539961505, 'atr_max_pct': 0.05412759143393736, 'tp_mult': 1.084238718720439, 'tsl_mult': 0.7000381372618111, 'strategy': 'breakout', 'time_stop': 104, 'use_sma': False, 'use_atr': False, 'use_adx': False, 'use_ema': False, 'use_spike': False, 'rsi_required': False, 'edge_k': 0.459048450115912, 'edge_cap': 0.693904141205473}.
