[I 2025-08-29 22:49:29,123] Trial 647 finished with values: [-0.0342212298797927, 0.034217417503859156] and parameters: {'p_sma': 39, 'p_std': 25, 'p_atr': 28, 'p_adx': 30, 'rsi_period': 19, 'ema1': 13, 'ema2': 32, 'slip_atr_k': 0.02314257971695146, 'slip_spread_k': 0.8344761546096572, 'spread_hl_frac': 0.016046021600919044, 'bb_std_mult': 1.9201576845403376, 'rsi_os': 27, 'rsi_ob': 57, 'vol_spike': 0.16399146009964607, 'adx_thresh': 20.415104484167554, 'atr_min_pct': 0.000560625668757947, 'atr_max_pct': 0.12138553078050124, 'tp_mult': 1.0430140161071906, 'tsl_mult': 0.7111625914793387, 'strategy': 'breakout', 'time_stop': 75, 'use_sma': False, 'use_atr': False, 'use_adx': False, 'use_ema': False, 'use_spike': False, 'rsi_required': False, 'edge_k': 0.5994295802290422, 'edge_cap': 0.7795599154568111}.
[I 2025-08-29 22:49:29,207] Trial 649 finished with values: [-1000000000.0, 1000000000.0] and parameters: {'p_sma': 6, 'p_std': 26, 'p_atr': 22, 'p_adx': 19, 'rsi_period': 26, 'ema1': 23, 'ema2': 54, 'slip_atr_k': 0.16804436492970226, 'slip_spread_k': 0.31803987006288637, 'spread_hl_frac': 0.04808875449775278, 'bb_std_mult': 2.0983529445639335, 'rsi_os': 12, 'rsi_ob': 58, 'vol_spike': 0.18581484443516622, 'adx_thresh': 25.194259732516134, 'atr_min_pct': 0.0004619265262725402, 'atr_max_pct': 0.10454558160072752, 'tp_mult': 1.1110919742207124, 'tsl_mult': 0.7142804734375555, 'strategy': 'breakout', 'time_stop': 140, 'use_sma': False, 'use_atr': False, 'use_adx': False, 'use_ema': False, 'use_spike': False, 'rsi_required': False, 'edge_k': 1.5812836047039969, 'edge_cap': 0.795144128333888}.
[I 2025-08-29 22:49:56,406] Trial 652 finished with values: [-0.008458650567532144, 0.008435205247678611] and parameters: {'p_sma': 7, 'p_std': 26, 'p_atr': 22, 'p_adx': 14, 'rsi_period': 26, 'ema1': 25, 'ema2': 54, 'slip_atr_k': 0.14973386588454296, 'slip_spread_k': 0.42283603235073386, 'spread_hl_frac': 0.018823851695855348, 'bb_std_mult': 1.174573480324384, 'rsi_os': 31, 'rsi_ob': 62, 'vol_spike': 0.20023180101782895, 'adx_thresh': 5.946407370592253, 'atr_min_pct': 0.001955576098413029, 'atr_max_pct': 0.1465110699686612, 'tp_mult': 1.4609313074785968, 'tsl_mult': 0.7169928963890828, 'strategy': 'breakout', 'time_stop': 35, 'use_sma': False, 'use_atr': False, 'use_adx': False, 'use_ema': False, 'use_spike': False, 'rsi_required': False, 'edge_k': 0.43381362909368415, 'edge_cap': 0.7950355777524056}.
[I 2025-08-29 22:49:56,598] Trial 651 finished with values: [-0.009075571325186882, 0.009075549439220478] and parameters: {'p_sma': 7, 'p_std': 27, 'p_atr': 22, 'p_adx': 17, 'rsi_period': 20, 'ema1': 22, 'ema2': 17, 'slip_atr_k': 0.01797188316429877, 'slip_spread_k': 0.929203223878386, 'spread_hl_frac': 0.019353614717334724, 'bb_std_mult': 2.894948211409372, 'rsi_os': 42, 'rsi_ob': 85, 'vol_spike': 0.20416473750862868, 'adx_thresh': 25.233460836022743, 'atr_min_pct': 0.002147711895402601, 'atr_max_pct': 0.10584568882946072, 'tp_mult': 1.6581591715199009, 'tsl_mult': 0.7089540633930386, 'strategy': 'breakout', 'time_stop': 114, 'use_sma': False, 'use_atr': False, 'use_adx': False, 'use_ema': False, 'use_spike': False, 'rsi_required': False, 'edge_k': 0.43070312180551074, 'edge_cap': 0.7998589075104512}.
[I 2025-08-29 22:49:56,609] Trial 653 finished with values: [-1000000000.0, 1000000000.0] and parameters: {'p_sma': 58, 'p_std': 27, 'p_atr': 18, 'p_adx': 14, 'rsi_period': 20, 'ema1': 25, 'ema2': 39, 'slip_atr_k': 0.016066749183944327, 'slip_spread_k': 0.34968381886082633, 'spread_hl_frac': 0.018270115555946036, 'bb_std_mult': 1.1827418280982411, 'rsi_os': 6, 'rsi_ob': 62, 'vol_spike': 0.023127457761081133, 'adx_thresh': 27.384597367635234, 'atr_min_pct': 0.013376537629126389, 'atr_max_pct': 0.08014348531014945, 'tp_mult': 1.5748676926674223, 'tsl_mult': 0.20755859050394038, 'strategy': 'breakout', 'time_stop': 113, 'use_sma': False, 'use_atr': False, 'use_adx': False, 'use_ema': False, 'use_spike': False, 'rsi_required': False, 'edge_k': 0.42196676568607, 'edge_cap': 0.6668146455390934}.
[I 2025-08-29 22:49:56,675] Trial 650 finished with values: [-0.019344704834883264, 0.019314623252010353] and parameters: {'p_sma': 58, 'p_std': 34, 'p_atr': 28, 'p_adx': 18, 'rsi_period': 20, 'ema1': 13, 'ema2': 54, 'slip_atr_k': 0.15266468179865175, 'slip_spread_k': 0.8448371007892133, 'spread_hl_frac': 0.019160694116068713, 'bb_std_mult': 3.0828386842938853, 'rsi_os': 27, 'rsi_ob': 86, 'vol_spike': 0.2938897354044404, 'adx_thresh': 22.428496724358236, 'atr_min_pct': 0.0022168236733823275, 'atr_max_pct': 0.0728164693394201, 'tp_mult': 1.566400010009469, 'tsl_mult': 0.7259234132224477, 'strategy': 'breakout', 'time_stop': 114, 'use_sma': False, 'use_atr': False, 'use_adx': False, 'use_ema': False, 'use_spike': False, 'rsi_required': False, 'edge_k': 0.5931609134554151, 'edge_cap': 0.7859611423151952}.
[I 2025-08-29 22:49:56,927] Trial 657 finished with values: [-1000000000.0, 1000000000.0] and parameters: {'p_sma': 8, 'p_std': 49, 'p_atr': 21, 'p_adx': 10, 'rsi_period': 67, 'ema1': 11, 'ema2': 23, 'slip_atr_k': 0.010217987394149234, 'slip_spread_k': 0.6243873311151178, 'spread_hl_frac': 0.012174539943212676, 'bb_std_mult': 0.9300823191653012, 'rsi_os': 25, 'rsi_ob': 48, 'vol_spike': 0.17724106240346016, 'adx_thresh': 26.259500351312454, 'atr_min_pct': 0.0036926034365167082, 'atr_max_pct': 0.09820686334603579, 'tp_mult': 2.5727253954142695, 'tsl_mult': 0.755798072309674, 'strategy': 'mean_reversion', 'time_stop': 104, 'use_sma': False, 'use_atr': False, 'use_adx': False, 'use_ema': False, 'use_spike': False, 'rsi_required': False, 'edge_k': 0.509146057229782, 'edge_cap': 0.8142242676263467}.
[I 2025-08-29 22:50:23,371] Trial 656 finished with values: [-1000000000.0, 1000000000.0] and parameters: {'p_sma': 8, 'p_std': 23, 'p_atr': 14, 'p_adx': 16, 'rsi_period': 67, 'ema1': 24, 'ema2': 52, 'slip_atr_k': 0.029804569948330487, 'slip_spread_k': 0.18344422123450205, 'spread_hl_frac': 0.01338545566862387, 'bb_std_mult': 2.02171401410021, 'rsi_os': 36, 'rsi_ob': 86, 'vol_spike': 0.21710127984522629, 'adx_thresh': 22.381169474585572, 'atr_min_pct': 0.001210143330184216, 'atr_max_pct': 0.053442591057814195, 'tp_mult': 1.1747513899669193, 'tsl_mult': 0.4980936968110196, 'strategy': 'mean_reversion', 'time_stop': 103, 'use_sma': False, 'use_atr': False, 'use_adx': False, 'use_ema': False, 'use_spike': False, 'rsi_required': False, 'edge_k': 1.1473977446165575, 'edge_cap': 0.2971942357266356}.
[I 2025-08-29 22:50:23,691] Trial 654 finished with values: [-0.008191019205528005, 0.008150423578148212] and parameters: {'p_sma': 7, 'p_std': 33, 'p_atr': 23, 'p_adx': 18, 'rsi_period': 20, 'ema1': 22, 'ema2': 27, 'slip_atr_k': 0.13812215103404726, 'slip_spread_k': 0.18413968778090617, 'spread_hl_frac': 0.011902633967685417, 'bb_std_mult': 0.9135823772940685, 'rsi_os': 24, 'rsi_ob': 62, 'vol_spike': 0.17624732712363161, 'adx_thresh': 13.515099206535822, 'atr_min_pct': 0.0023602141656348767, 'atr_max_pct': 0.0978047318943143, 'tp_mult': 1.5709504613157095, 'tsl_mult': 0.9703594414402472, 'strategy': 'mean_reversion', 'time_stop': 114, 'use_sma': False, 'use_atr': False, 'use_adx': False, 'use_ema': False, 'use_spike': False, 'rsi_required': False, 'edge_k': 1.1177833394962073, 'edge_cap': 0.33694247074826333}.
[I 2025-08-29 22:50:23,936] Trial 655 finished with values: [-0.011207833280717394, 0.011190460493906942] and parameters: {'p_sma': 8, 'p_std': 31, 'p_atr': 21, 'p_adx': 13, 'rsi_period': 11, 'ema1': 20, 'ema2': 23, 'slip_atr_k': 0.03057504150207365, 'slip_spread_k': 0.014794962592165062, 'spread_hl_frac': 0.013904158187474414, 'bb_std_mult': 2.0164293501813004, 'rsi_os': 39, 'rsi_ob': 81, 'vol_spike': 0.2277744016110223, 'adx_thresh': 26.054051597836597, 'atr_min_pct': 0.0011794643394954021, 'atr_max_pct': 0.05311570612144844, 'tp_mult': 1.1679433876728749, 'tsl_mult': 0.7529621099956173, 'strategy': 'mean_reversion', 'time_stop': 103, 'use_sma': False, 'use_atr': False, 'use_adx': False, 'use_ema': False, 'use_spike': False, 'rsi_required': False, 'edge_k': 1.2991061955107015, 'edge_cap': 0.8367365320720854}.
[I 2025-08-29 22:50:24,364] Trial 658 finished with values: [-0.027948496224064923, 0.02792387653121603] and parameters: {'p_sma': 49, 'p_std': 24, 'p_atr': 11, 'p_adx': 22, 'rsi_period': 18, 'ema1': 24, 'ema2': 27, 'slip_atr_k': 0.1959311608868251, 'slip_spread_k': 0.5809219131641133, 'spread_hl_frac': 0.013344093844086037, 'bb_std_mult': 2.0315559144174036, 'rsi_os': 24, 'rsi_ob': 77, 'vol_spike': 0.2137639265457676, 'adx_thresh': 25.725983896546794, 'atr_min_pct': 0.001323357186384715, 'atr_max_pct': 0.09443818941775131, 'tp_mult': 1.1753309593517716, 'tsl_mult': 0.7487774215652322, 'strategy': 'mean_reversion', 'time_stop': 47, 'use_sma': False, 'use_atr': False, 'use_adx': False, 'use_ema': False, 'use_spike': False, 'rsi_required': False, 'edge_k': 1.2771675258129471, 'edge_cap': 0.8380429075797186}.
[I 2025-08-29 22:50:51,428] Trial 660 finished with values: [-1000000000.0, 1000000000.0] and parameters: {'p_sma': 27, 'p_std': 12, 'p_atr': 16, 'p_adx': 13, 'rsi_period': 73, 'ema1': 24, 'ema2': 55, 'slip_atr_k': 0.19656997185062122, 'slip_spread_k': 0.8045836394820431, 'spread_hl_frac': 0.015012160173619154, 'bb_std_mult': 3.263997767348764, 'rsi_os': 51, 'rsi_ob': 70, 'vol_spike': 0.00994257245611907, 'adx_thresh': 25.78709619509267, 'atr_min_pct': 0.006611271781914079, 'atr_max_pct': 0.09294374831272807, 'tp_mult': 1.741508206619573, 'tsl_mult': 0.6881185181771573, 'strategy': 'breakout', 'time_stop': 97, 'use_sma': False, 'use_atr': False, 'use_adx': False, 'use_ema': False, 'use_spike': False, 'rsi_required': False, 'edge_k': 0.3506633126163353, 'edge_cap': 0.8293623057735757}.
[I 2025-08-29 22:50:51,630] Trial 662 finished with values: [-1000000000.0, 1000000000.0] and parameters: {'p_sma': 27, 'p_std': 5, 'p_atr': 7, 'p_adx': 26, 'rsi_period': 22, 'ema1': 23, 'ema2': 57, 'slip_atr_k': 0.23225394758782236, 'slip_spread_k': 0.8209510903366529, 'spread_hl_frac': 0.007888852290026463, 'bb_std_mult': 2.1194157804026252, 'rsi_os': 26, 'rsi_ob': 59, 'vol_spike': 0.10176131565668262, 'adx_thresh': 24.85714029527558, 'atr_min_pct': 0.011183170016851752, 'atr_max_pct': 0.09311508300175216, 'tp_mult': 1.0693092653881515, 'tsl_mult': 0.6809505195218528, 'strategy': 'breakout', 'time_stop': 252, 'use_sma': False, 'use_atr': False, 'use_adx': False, 'use_ema': False, 'use_spike': False, 'rsi_required': False, 'edge_k': 0.4715671533533937, 'edge_cap': 0.8098682021653213}.
[I 2025-08-29 22:50:51,895] Trial 661 finished with values: [-1000000000.0, 1000000000.0] and parameters: {'p_sma': 6, 'p_std': 25, 'p_atr': 11, 'p_adx': 15, 'rsi_period': 18, 'ema1': 24, 'ema2': 35, 'slip_atr_k': 0.19920321971909125, 'slip_spread_k': 0.5851717108476606, 'spread_hl_frac': 0.021625474149474383, 'bb_std_mult': 3.2523337496509415, 'rsi_os': 33, 'rsi_ob': 59, 'vol_spike': 0.08627218752238353, 'adx_thresh': 33.70914844999054, 'atr_min_pct': 0.004422898078899453, 'atr_max_pct': 0.0937469536890503, 'tp_mult': 1.1163253043973664, 'tsl_mult': 0.6814978013400759, 'strategy': 'breakout', 'time_stop': 50, 'use_sma': False, 'use_atr': False, 'use_adx': False, 'use_ema': False, 'use_spike': False, 'rsi_required': False, 'edge_k': 1.0333877434188827, 'edge_cap': 0.827637518947538}.
[I 2025-08-29 22:50:52,005] Trial 659 finished with values: [-1000000000.0, 1000000000.0] and parameters: {'p_sma': 6, 'p_std': 10, 'p_atr': 11, 'p_adx': 13, 'rsi_period': 56, 'ema1': 24, 'ema2': 55, 'slip_atr_k': 0.005976864862338144, 'slip_spread_k': 0.8197214695984383, 'spread_hl_frac': 0.021547826306827802, 'bb_std_mult': 3.241669296760059, 'rsi_os': 24, 'rsi_ob': 60, 'vol_spike': 0.2294565438006015, 'adx_thresh': 24.81949874186485, 'atr_min_pct': 0.004280399840713331, 'atr_max_pct': 0.09373495647038939, 'tp_mult': 1.1396267529198614, 'tsl_mult': 0.6809484293573601, 'strategy': 'breakout', 'time_stop': 255, 'use_sma': False, 'use_atr': False, 'use_adx': False, 'use_ema': False, 'use_spike': False, 'rsi_required': False, 'edge_k': 1.0340064041342685, 'edge_cap': 0.834442278164452}.
[I 2025-08-29 22:51:19,177] Trial 665 finished with values: [-1000000000.0, 1000000000.0] and parameters: {'p_sma': 56, 'p_std': 8, 'p_atr': 23, 'p_adx': 17, 'rsi_period': 22, 'ema1': 25, 'ema2': 53, 'slip_atr_k': 0.08811375856671308, 'slip_spread_k': 0.8836992332778923, 'spread_hl_frac': 0.04084633771158079, 'bb_std_mult': 2.1573334768656656, 'rsi_os': 28, 'rsi_ob': 68, 'vol_spike': 0.18894826857646035, 'adx_thresh': 23.99972224545749, 'atr_min_pct': 0.017678007782425512, 'atr_max_pct': 0.030985258052118186, 'tp_mult': 1.2479542666259311, 'tsl_mult': 0.7756502989387757, 'strategy': 'breakout', 'time_stop': 198, 'use_sma': False, 'use_atr': False, 'use_adx': False, 'use_ema': False, 'use_spike': False, 'rsi_required': False, 'edge_k': 1.7707306337508593, 'edge_cap': 0.739290793811478}.
[I 2025-08-29 22:51:19,409] Trial 664 finished with values: [-1000000000.0, 1000000000.0] and parameters: {'p_sma': 10, 'p_std': 23, 'p_atr': 10, 'p_adx': 17, 'rsi_period': 46, 'ema1': 15, 'ema2': 45, 'slip_atr_k': 0.004296608013169898, 'slip_spread_k': 0.7478688724226041, 'spread_hl_frac': 0.02111889411791401, 'bb_std_mult': 1.581923096319987, 'rsi_os': 30, 'rsi_ob': 64, 'vol_spike': 0.1209556960853419, 'adx_thresh': 23.97771682792309, 'atr_min_pct': 0.004220519740162246, 'atr_max_pct': 0.1375811249311668, 'tp_mult': 1.1296588513928325, 'tsl_mult': 0.5825342475147104, 'strategy': 'breakout', 'time_stop': 90, 'use_sma': False, 'use_atr': False, 'use_adx': False, 'use_ema': False, 'use_spike': False, 'rsi_required': False, 'edge_k': 0.7238036882121097, 'edge_cap': 0.7711702900316784}.
[I 2025-08-29 22:51:19,574] Trial 666 finished with values: [-0.002809861226522159, 0.0032665696387296946] and parameters: {'p_sma': 10, 'p_std': 23, 'p_atr': 17, 'p_adx': 17, 'rsi_period': 69, 'ema1': 27, 'ema2': 53, 'slip_atr_k': 0.018669592173838775, 'slip_spread_k': 0.7626049718337891, 'spread_hl_frac': 0.03404968818926735, 'bb_std_mult': 1.2807286764075092, 'rsi_os': 30, 'rsi_ob': 61, 'vol_spike': 0.1862148755638897, 'adx_thresh': 17.235538180313327, 'atr_min_pct': 0.002710554181651944, 'atr_max_pct': 0.02639844575575289, 'tp_mult': 2.3101639487383205, 'tsl_mult': 0.6390892187796535, 'strategy': 'breakout', 'time_stop': 91, 'use_sma': False, 'use_atr': False, 'use_adx': False, 'use_ema': False, 'use_spike': False, 'rsi_required': False, 'edge_k': 0.7338322902891563, 'edge_cap': 0.26439096854398225}.
[I 2025-08-29 22:51:19,641] Trial 663 finished with values: [-1000000000.0, 1000000000.0] and parameters: {'p_sma': 10, 'p_std': 21, 'p_atr': 23, 'p_adx': 23, 'rsi_period': 69, 'ema1': 15, 'ema2': 57, 'slip_atr_k': 0.01970627235002309, 'slip_spread_k': 0.8228046541191879, 'spread_hl_frac': 0.021461273205212045, 'bb_std_mult': 2.1213411097907877, 'rsi_os': 14, 'rsi_ob': 59, 'vol_spike': 0.18862517856477268, 'adx_thresh': 25.036614726081563, 'atr_min_pct': 0.017717056217575324, 'atr_max_pct': 0.02991586599678503, 'tp_mult': 2.8341249029681927, 'tsl_mult': 0.6435637277665776, 'strategy': 'breakout', 'time_stop': 254, 'use_sma': False, 'use_atr': False, 'use_adx': False, 'use_ema': False, 'use_spike': False, 'rsi_required': False, 'edge_k': 1.4287155666687628, 'edge_cap': 0.9075767547053457}.
[I 2025-08-29 22:51:46,293] Trial 667 finished with values: [-1000000000.0, 1000000000.0] and parameters: {'p_sma': 10, 'p_std': 21, 'p_atr': 24, 'p_adx': 16, 'rsi_period': 46, 'ema1': 23, 'ema2': 53, 'slip_atr_k': 0.16218999150062854, 'slip_spread_k': 0.766010987095382, 'spread_hl_frac': 0.016370936622240574, 'bb_std_mult': 1.2593891208192698, 'rsi_os': 26, 'rsi_ob': 61, 'vol_spike': 0.1216917727167535, 'adx_thresh': 27.128421190926872, 'atr_min_pct': 0.002788842713903351, 'atr_max_pct': 0.09904784351380111, 'tp_mult': 1.0606184362995892, 'tsl_mult': 0.6465383705570973, 'strategy': 'breakout', 'time_stop': 65, 'use_sma': False, 'use_atr': False, 'use_adx': False, 'use_ema': False, 'use_spike': False, 'rsi_required': False, 'edge_k': 0.23253812623704906, 'edge_cap': 0.20794366689931465}.
[I 2025-08-29 22:51:46,629] Trial 669 finished with values: [-0.016701652552777668, 0.0166669309573941] and parameters: {'p_sma': 47, 'p_std': 26, 'p_atr': 24, 'p_adx': 16, 'rsi_period': 16, 'ema1': 23, 'ema2': 53, 'slip_atr_k': 0.11673452289908975, 'slip_spread_k': 0.7713056200409779, 'spread_hl_frac': 0.016220072992556678, 'bb_std_mult': 2.0497757088408144, 'rsi_os': 26, 'rsi_ob': 61, 'vol_spike': 0.16745459681964386, 'adx_thresh': 17.13832619933028, 'atr_min_pct': 0.002724562017463565, 'atr_max_pct': 0.0999004777143603, 'tp_mult': 1.0669290440651615, 'tsl_mult': 0.8265373631606483, 'strategy': 'breakout', 'time_stop': 122, 'use_sma': False, 'use_atr': False, 'use_adx': False, 'use_ema': False, 'use_spike': False, 'rsi_required': False, 'edge_k': 0.010442617451930758, 'edge_cap': 0.8054617525876203}.
[I 2025-08-29 22:51:46,808] Trial 668 finished with values: [-1000000000.0, 1000000000.0] and parameters: {'p_sma': 9, 'p_std': 26, 'p_atr': 24, 'p_adx': 16, 'rsi_period': 17, 'ema1': 23, 'ema2': 60, 'slip_atr_k': 0.07205610339166232, 'slip_spread_k': 0.7687265833747254, 'spread_hl_frac': 0.03423682510171812, 'bb_std_mult': 2.069140400770153, 'rsi_os': 53, 'rsi_ob': 74, 'vol_spike': 0.1667771604065167, 'adx_thresh': 26.72107687519194, 'atr_min_pct': 0.023697804551588063, 'atr_max_pct': 0.1423160277695301, 'tp_mult': 1.0690753854618527, 'tsl_mult': 0.7323529927458361, 'strategy': 'breakout', 'time_stop': 65, 'use_sma': False, 'use_atr': False, 'use_adx': False, 'use_ema': False, 'use_spike': False, 'rsi_required': False, 'edge_k': 0.5445323474755549, 'edge_cap': 0.2727016665325293}.
[I 2025-08-29 22:51:47,103] Trial 670 finished with values: [-1000000000.0, 1000000000.0] and parameters: {'p_sma': 6, 'p_std': 26, 'p_atr': 24, 'p_adx': 16, 'rsi_period': 16, 'ema1': 23, 'ema2': 51, 'slip_atr_k': 0.012964045179698229, 'slip_spread_k': 0.851488720871965, 'spread_hl_frac': 0.00196884915127276, 'bb_std_mult': 2.282691574285515, 'rsi_os': 26, 'rsi_ob': 74, 'vol_spike': 0.18238584489668672, 'adx_thresh': 26.91980274964667, 'atr_min_pct': 0.0026035196745838904, 'atr_max_pct': 0.08846688008804487, 'tp_mult': 1.056647017389409, 'tsl_mult': 0.05639000555021023, 'strategy': 'breakout', 'time_stop': 109, 'use_sma': False, 'use_atr': False, 'use_adx': False, 'use_ema': False, 'use_spike': False, 'rsi_required': False, 'edge_k': 0.03433627649456461, 'edge_cap': 0.25605850894871357}.
[I 2025-08-29 22:51:47,441] Trial 673 finished with values: [-1000000000.0, 1000000000.0] and parameters: {'p_sma': 60, 'p_std': 27, 'p_atr': 30, 'p_adx': 15, 'rsi_period': 31, 'ema1': 30, 'ema2': 49, 'slip_atr_k': 0.012956840055798415, 'slip_spread_k': 0.8440230345049444, 'spread_hl_frac': 0.0173992295633607, 'bb_std_mult': 1.8252412926868211, 'rsi_os': 41, 'rsi_ob': 58, 'vol_spike': 0.1958083901993043, 'adx_thresh': 28.04067264245286, 'atr_min_pct': 0.026743533382541405, 'atr_max_pct': 0.026712619508213548, 'tp_mult': 2.5300521164973517, 'tsl_mult': 0.09536122773748634, 'strategy': 'mean_reversion', 'time_stop': 109, 'use_sma': False, 'use_atr': False, 'use_adx': False, 'use_ema': False, 'use_spike': False, 'rsi_required': False, 'edge_k': 0.5098382159779151, 'edge_cap': 0.4789775118540697}.
[I 2025-08-29 22:52:14,639] Trial 675 finished with values: [-0.015483337653633189, 0.015455524053047696] and parameters: {'p_sma': 36, 'p_std': 23, 'p_atr': 25, 'p_adx': 17, 'rsi_period': 34, 'ema1': 28, 'ema2': 55, 'slip_atr_k': 0.03637187720118994, 'slip_spread_k': 0.5333734339678771, 'spread_hl_frac': 0.018080957579421412, 'bb_std_mult': 2.736525392048219, 'rsi_os': 28, 'rsi_ob': 50, 'vol_spike': 0.25543027337516866, 'adx_thresh': 18.25403623021497, 'atr_min_pct': 0.0016934671609498, 'atr_max_pct': 0.09666929564576254, 'tp_mult': 2.9271736379347777, 'tsl_mult': 0.3595880135697995, 'strategy': 'breakout', 'time_stop': 291, 'use_sma': False, 'use_atr': False, 'use_adx': False, 'use_ema': False, 'use_spike': False, 'rsi_required': False, 'edge_k': 0.5560665288910075, 'edge_cap': 0.7786537973362444}.
[I 2025-08-29 22:52:14,742] Trial 672 finished with values: [-1000000000.0, 1000000000.0] and parameters: {'p_sma': 53, 'p_std': 27, 'p_atr': 17, 'p_adx': 16, 'rsi_period': 18, 'ema1': 25, 'ema2': 60, 'slip_atr_k': 0.0378705367606277, 'slip_spread_k': 0.15808859988842183, 'spread_hl_frac': 0.03394655296875371, 'bb_std_mult': 2.263143583079801, 'rsi_os': 47, 'rsi_ob': 60, 'vol_spike': 0.1959934393103615, 'adx_thresh': 18.339962700385307, 'atr_min_pct': 0.021573011791175826, 'atr_max_pct': 0.14192327444245584, 'tp_mult': 1.3669677175528605, 'tsl_mult': 0.7359935487889647, 'strategy': 'breakout', 'time_stop': 289, 'use_sma': False, 'use_atr': False, 'use_adx': False, 'use_ema': False, 'use_spike': False, 'rsi_required': False, 'edge_k': 1.5272803598850402, 'edge_cap': 0.7773255709474187}.
[I 2025-08-29 22:52:14,742] Trial 674 finished with values: [-0.013603302786581839, 0.013585452249305081] and parameters: {'p_sma': 38, 'p_std': 23, 'p_atr': 25, 'p_adx': 15, 'rsi_period': 30, 'ema1': 25, 'ema2': 42, 'slip_atr_k': 0.0378894155185846, 'slip_spread_k': 0.27942969902352, 'spread_hl_frac': 0.017425784707225864, 'bb_std_mult': 1.8382365819892745, 'rsi_os': 44, 'rsi_ob': 91, 'vol_spike': 0.07260673883653214, 'adx_thresh': 8.810514129407467, 'atr_min_pct': 0.0015715994585084585, 'atr_max_pct': 0.12697846645561361, 'tp_mult': 2.90129810418777, 'tsl_mult': 0.36061999075767753, 'strategy': 'mean_reversion', 'time_stop': 238, 'use_sma': False, 'use_atr': False, 'use_adx': False, 'use_ema': False, 'use_spike': False, 'rsi_required': False, 'edge_k': 1.5253007355371881, 'edge_cap': 0.7773037347409332}.
