[I 2025-08-30 00:14:55,578] Trial 1433 finished with values: [-0.029160981859557067, 0.02917123878457626] and parameters: {'p_sma': 7, 'p_std': 25, 'p_atr': 19, 'p_adx': 13, 'rsi_period': 20, 'ema1': 30, 'ema2': 55, 'slip_atr_k': 0.01795119480836008, 'slip_spread_k': 0.7807830123698224, 'spread_hl_frac': 0.03278758719685414, 'bb_std_mult': 1.934468431909833, 'rsi_os': 26, 'rsi_ob': 59, 'vol_spike': 0.18199915567414235, 'adx_thresh': 5.477718244947166, 'atr_min_pct': 0.0014490699891410142, 'atr_max_pct': 0.09500465549842906, 'tp_mult': 1.1343647643030526, 'tsl_mult': 0.7090458719868937, 'strategy': 'mean_reversion', 'time_stop': 107, 'use_sma': False, 'use_atr': False, 'use_adx': False, 'use_ema': False, 'use_spike': False, 'rsi_required': False, 'edge_k': 0.4217588724389989, 'edge_cap': 0.7756577769595205}.
[I 2025-08-30 00:14:55,732] Trial 1434 finished with values: [-0.015402547050704207, 0.015449310152590951] and parameters: {'p_sma': 7, 'p_std': 25, 'p_atr': 21, 'p_adx': 29, 'rsi_period': 20, 'ema1': 23, 'ema2': 56, 'slip_atr_k': 0.01613695318156165, 'slip_spread_k': 0.8260818238219197, 'spread_hl_frac': 0.017487083331596636, 'bb_std_mult': 1.9427907719449553, 'rsi_os': 26, 'rsi_ob': 59, 'vol_spike': 0.13210425329540892, 'adx_thresh': 23.63121023702025, 'atr_min_pct': 0.001322067144436901, 'atr_max_pct': 0.04501025268838167, 'tp_mult': 1.126639467681859, 'tsl_mult': 0.6996432212195075, 'strategy': 'mean_reversion', 'time_stop': 107, 'use_sma': False, 'use_atr': False, 'use_adx': False, 'use_ema': False, 'use_spike': False, 'rsi_required': False, 'edge_k': 0.536690209864172, 'edge_cap': 0.780610280574451}.
[I 2025-08-30 00:14:55,740] Trial 1431 finished with values: [-0.04239212471085829, 0.04237485110065634] and parameters: {'p_sma': 44, 'p_std': 21, 'p_atr': 23, 'p_adx': 29, 'rsi_period': 19, 'ema1': 24, 'ema2': 35, 'slip_atr_k': 0.018825039651509414, 'slip_spread_k': 0.8234133848479036, 'spread_hl_frac': 0.013283826228825164, 'bb_std_mult': 1.0105658027014726, 'rsi_os': 26, 'rsi_ob': 70, 'vol_spike': 0.18243311432541268, 'adx_thresh': 5.45925195497569, 'atr_min_pct': 0.0013563970940142767, 'atr_max_pct': 0.04417345180813582, 'tp_mult': 1.0486081904818547, 'tsl_mult': 0.7068555044958259, 'strategy': 'mean_reversion', 'time_stop': 233, 'use_sma': False, 'use_atr': False, 'use_adx': False, 'use_ema': False, 'use_spike': False, 'rsi_required': False, 'edge_k': 1.9929610564360591, 'edge_cap': 0.7827765487371027}.
[I 2025-08-30 00:14:55,846] Trial 1432 finished with values: [-0.005649705148478512, 0.00566970841459215] and parameters: {'p_sma': 7, 'p_std': 21, 'p_atr': 20, 'p_adx': 17, 'rsi_period': 20, 'ema1': 23, 'ema2': 36, 'slip_atr_k': 0.0157447720105085, 'slip_spread_k': 0.8250636169649627, 'spread_hl_frac': 0.044319276018009696, 'bb_std_mult': 1.9375202136341416, 'rsi_os': 37, 'rsi_ob': 74, 'vol_spike': 0.18166756335994333, 'adx_thresh': 26.99326333269163, 'atr_min_pct': 0.0012977068300966997, 'atr_max_pct': 0.04627210098692797, 'tp_mult': 1.3759343275629419, 'tsl_mult': 0.7408568279041783, 'strategy': 'mean_reversion', 'time_stop': 91, 'use_sma': False, 'use_atr': False, 'use_adx': False, 'use_ema': False, 'use_spike': False, 'rsi_required': False, 'edge_k': 1.0141176919541686, 'edge_cap': 0.7792385654769931}.
[I 2025-08-30 00:15:22,237] Trial 1436 finished with values: [-1000000000.0, 1000000000.0] and parameters: {'p_sma': 9, 'p_std': 36, 'p_atr': 25, 'p_adx': 15, 'rsi_period': 21, 'ema1': 25, 'ema2': 38, 'slip_atr_k': 0.10902016679763597, 'slip_spread_k': 0.33273970849310736, 'spread_hl_frac': 0.044204713644989964, 'bb_std_mult': 1.9897236042176096, 'rsi_os': 28, 'rsi_ob': 89, 'vol_spike': 0.1879346598150355, 'adx_thresh': 24.648289707566306, 'atr_min_pct': 0.021565667086536122, 'atr_max_pct': 0.09590742951118969, 'tp_mult': 2.082967608641771, 'tsl_mult': 0.6536720286296505, 'strategy': 'breakout', 'time_stop': 112, 'use_sma': False, 'use_atr': False, 'use_adx': False, 'use_ema': False, 'use_spike': False, 'rsi_required': False, 'edge_k': 1.1857053113212412, 'edge_cap': 0.49461232259528853}.
[I 2025-08-30 00:15:22,370] Trial 1435 finished with values: [-1000000000.0, 1000000000.0] and parameters: {'p_sma': 9, 'p_std': 26, 'p_atr': 21, 'p_adx': 15, 'rsi_period': 20, 'ema1': 23, 'ema2': 18, 'slip_atr_k': 0.029182344485351133, 'slip_spread_k': 0.8355722165063431, 'spread_hl_frac': 0.04476466016243504, 'bb_std_mult': 1.9988656834116432, 'rsi_os': 28, 'rsi_ob': 62, 'vol_spike': 0.15012062147797145, 'adx_thresh': 23.49277115260479, 'atr_min_pct': 0.00447339644591375, 'atr_max_pct': 0.09520370593352839, 'tp_mult': 1.1937418106181652, 'tsl_mult': 0.10654968521178865, 'strategy': 'breakout', 'time_stop': 118, 'use_sma': False, 'use_atr': False, 'use_adx': False, 'use_ema': False, 'use_spike': False, 'rsi_required': False, 'edge_k': 1.9921812265735057, 'edge_cap': 0.8153662990836249}.
[I 2025-08-30 00:15:22,578] Trial 1437 finished with values: [-0.01873995154861985, 0.018732730480378896] and parameters: {'p_sma': 9, 'p_std': 26, 'p_atr': 25, 'p_adx': 15, 'rsi_period': 21, 'ema1': 25, 'ema2': 53, 'slip_atr_k': 0.0002731318861682111, 'slip_spread_k': 0.8648986076113696, 'spread_hl_frac': 0.02080179459827787, 'bb_std_mult': 1.7224095943485205, 'rsi_os': 28, 'rsi_ob': 58, 'vol_spike': 0.18896783530514819, 'adx_thresh': 24.629337524075193, 'atr_min_pct': 1.4049739753448087e-06, 'atr_max_pct': 0.13239612840483528, 'tp_mult': 1.1833610621543253, 'tsl_mult': 0.13608180797271313, 'strategy': 'breakout', 'time_stop': 117, 'use_sma': False, 'use_atr': False, 'use_adx': False, 'use_ema': False, 'use_spike': False, 'rsi_required': False, 'edge_k': 1.517622599524887, 'edge_cap': 0.8202305935800979}.
[I 2025-08-30 00:15:22,581] Trial 1438 finished with values: [-1000000000.0, 1000000000.0] and parameters: {'p_sma': 9, 'p_std': 51, 'p_atr': 25, 'p_adx': 15, 'rsi_period': 22, 'ema1': 25, 'ema2': 53, 'slip_atr_k': 0.02857892841034592, 'slip_spread_k': 0.3357904861369483, 'spread_hl_frac': 0.02305861782726059, 'bb_std_mult': 1.3665609984295406, 'rsi_os': 35, 'rsi_ob': 58, 'vol_spike': 0.22416294409437254, 'adx_thresh': 28.637428564769383, 'atr_min_pct': 0.0047203864065070295, 'atr_max_pct': 0.07521270203532948, 'tp_mult': 1.1967765710056584, 'tsl_mult': 0.13711055359885588, 'strategy': 'breakout', 'time_stop': 115, 'use_sma': False, 'use_atr': False, 'use_adx': False, 'use_ema': False, 'use_spike': False, 'rsi_required': False, 'edge_k': 1.5131493349859362, 'edge_cap': 0.8163445257359175}.
[I 2025-08-30 00:15:48,567] Trial 1440 finished with values: [-0.004103089634499901, 0.004321456109903631] and parameters: {'p_sma': 19, 'p_std': 54, 'p_atr': 25, 'p_adx': 16, 'rsi_period': 84, 'ema1': 24, 'ema2': 54, 'slip_atr_k': 0.14222176418489305, 'slip_spread_k': 0.8588601088314005, 'spread_hl_frac': 0.020762981306452558, 'bb_std_mult': 1.3490378813061514, 'rsi_os': 35, 'rsi_ob': 58, 'vol_spike': 0.18995768441160155, 'adx_thresh': 25.873178627162098, 'atr_min_pct': 0.0026766321091464284, 'atr_max_pct': 0.1320274391012843, 'tp_mult': 1.058835886476465, 'tsl_mult': 0.7812778976043276, 'strategy': 'breakout', 'time_stop': 97, 'use_sma': False, 'use_atr': False, 'use_adx': False, 'use_ema': False, 'use_spike': False, 'rsi_required': False, 'edge_k': 1.3282461480521792, 'edge_cap': 0.9534977918757188}.
[I 2025-08-30 00:15:48,922] Trial 1439 finished with values: [-1000000000.0, 1000000000.0] and parameters: {'p_sma': 6, 'p_std': 19, 'p_atr': 25, 'p_adx': 15, 'rsi_period': 83, 'ema1': 19, 'ema2': 53, 'slip_atr_k': 0.03942129915212052, 'slip_spread_k': 0.8690803488987192, 'spread_hl_frac': 0.015742189211419337, 'bb_std_mult': 2.0925441695624047, 'rsi_os': 9, 'rsi_ob': 47, 'vol_spike': 0.18937036430455412, 'adx_thresh': 28.960296896321566, 'atr_min_pct': 0.0027643751694330703, 'atr_max_pct': 0.13220171011140314, 'tp_mult': 1.1984726614638492, 'tsl_mult': 0.778012233167612, 'strategy': 'breakout', 'time_stop': 118, 'use_sma': False, 'use_atr': False, 'use_adx': False, 'use_ema': False, 'use_spike': False, 'rsi_required': False, 'edge_k': 0.48172440168841574, 'edge_cap': 0.11315807292675012}.
[I 2025-08-30 00:15:49,079] Trial 1441 finished with values: [-0.018202923675611826, 0.01817793032638749] and parameters: {'p_sma': 19, 'p_std': 23, 'p_atr': 20, 'p_adx': 16, 'rsi_period': 22, 'ema1': 24, 'ema2': 42, 'slip_atr_k': 0.03668281953374617, 'slip_spread_k': 0.7902803783006853, 'spread_hl_frac': 0.0245399655360097, 'bb_std_mult': 2.0859352682548065, 'rsi_os': 35, 'rsi_ob': 84, 'vol_spike': 0.06477486095332514, 'adx_thresh': 19.376874458030247, 'atr_min_pct': 0.0026707447819783714, 'atr_max_pct': 0.1449487175441303, 'tp_mult': 1.066527427544342, 'tsl_mult': 0.785787662996094, 'strategy': 'breakout', 'time_stop': 98, 'use_sma': False, 'use_atr': False, 'use_adx': False, 'use_ema': False, 'use_spike': False, 'rsi_required': False, 'edge_k': 0.7310670670963042, 'edge_cap': 0.32489917321237427}.
[I 2025-08-30 00:15:49,131] Trial 1442 finished with values: [-1000000000.0, 1000000000.0] and parameters: {'p_sma': 6, 'p_std': 23, 'p_atr': 21, 'p_adx': 16, 'rsi_period': 84, 'ema1': 19, 'ema2': 21, 'slip_atr_k': 0.03536264160780546, 'slip_spread_k': 0.7981584791578004, 'spread_hl_frac': 0.019053299386543807, 'bb_std_mult': 2.0995791921386457, 'rsi_os': 20, 'rsi_ob': 60, 'vol_spike': 0.16923701915794578, 'adx_thresh': 25.90866099653419, 'atr_min_pct': 0.0027697295701269104, 'atr_max_pct': 0.052546958501984486, 'tp_mult': 1.0580102557672824, 'tsl_mult': 0.7777287398511578, 'strategy': 'breakout', 'time_stop': 99, 'use_sma': False, 'use_atr': False, 'use_adx': False, 'use_ema': False, 'use_spike': False, 'rsi_required': False, 'edge_k': 0.48343170414146663, 'edge_cap': 0.1629240927854722}.
[I 2025-08-30 00:16:15,723] Trial 1443 finished with values: [-0.0029927131120044415, 0.0030082019161074996] and parameters: {'p_sma': 6, 'p_std': 23, 'p_atr': 21, 'p_adx': 8, 'rsi_period': 19, 'ema1': 16, 'ema2': 42, 'slip_atr_k': 0.18692957289285195, 'slip_spread_k': 0.7935913344523315, 'spread_hl_frac': 0.019082269388452786, 'bb_std_mult': 3.0631365697240387, 'rsi_os': 21, 'rsi_ob': 60, 'vol_spike': 0.21317182434353216, 'adx_thresh': 31.95807629920081, 'atr_min_pct': 0.002092725541484464, 'atr_max_pct': 0.10422745466905485, 'tp_mult': 1.1392943183795345, 'tsl_mult': 0.7548483669723851, 'strategy': 'breakout', 'time_stop': 133, 'use_sma': False, 'use_atr': False, 'use_adx': False, 'use_ema': False, 'use_spike': False, 'rsi_required': False, 'edge_k': 0.48424299872702503, 'edge_cap': 0.3251092263076554}.
[I 2025-08-30 00:16:15,753] Trial 1446 finished with values: [-0.025393341128596703, 0.025387406267897084] and parameters: {'p_sma': 23, 'p_std': 5, 'p_atr': 25, 'p_adx': 17, 'rsi_period': 19, 'ema1': 7, 'ema2': 57, 'slip_atr_k': 0.07690281706472607, 'slip_spread_k': 0.5754041964271456, 'spread_hl_frac': 1.0377925344549899e-05, 'bb_std_mult': 3.1526785810490656, 'rsi_os': 24, 'rsi_ob': 83, 'vol_spike': 0.10828360217360303, 'adx_thresh': 21.09959518532309, 'atr_min_pct': 0.0018735980008408818, 'atr_max_pct': 0.1038888520712977, 'tp_mult': 2.998942309800042, 'tsl_mult': 0.5919030085633803, 'strategy': 'breakout', 'time_stop': 130, 'use_sma': False, 'use_atr': False, 'use_adx': False, 'use_ema': False, 'use_spike': False, 'rsi_required': False, 'edge_k': 1.2394625546792244, 'edge_cap': 0.7646222493264361}.
[I 2025-08-30 00:16:15,947] Trial 1445 finished with values: [-1000000000.0, 1000000000.0] and parameters: {'p_sma': 7, 'p_std': 28, 'p_atr': 21, 'p_adx': 17, 'rsi_period': 32, 'ema1': 13, 'ema2': 54, 'slip_atr_k': 0.008941078479113181, 'slip_spread_k': 0.5726468944774095, 'spread_hl_frac': 0.01789285990878825, 'bb_std_mult': 2.307533609108932, 'rsi_os': 24, 'rsi_ob': 62, 'vol_spike': 0.2839666403041067, 'adx_thresh': 25.407213794435208, 'atr_min_pct': 0.0019556956042591197, 'atr_max_pct': 0.10306245699416232, 'tp_mult': 1.1335408985062596, 'tsl_mult': 0.6721215182808716, 'strategy': 'breakout', 'time_stop': 48, 'use_sma': False, 'use_atr': False, 'use_adx': False, 'use_ema': False, 'use_spike': False, 'rsi_required': False, 'edge_k': 0.8332914419495825, 'edge_cap': 0.7636838912245314}.
[I 2025-08-30 00:16:15,955] Trial 1444 finished with values: [-1000000000.0, 1000000000.0] and parameters: {'p_sma': 7, 'p_std': 23, 'p_atr': 21, 'p_adx': 17, 'rsi_period': 69, 'ema1': 24, 'ema2': 33, 'slip_atr_k': 0.18782200232136048, 'slip_spread_k': 0.580340151593376, 'spread_hl_frac': 0.018785881736655116, 'bb_std_mult': 2.4170967934645353, 'rsi_os': 24, 'rsi_ob': 83, 'vol_spike': 0.16914366802515834, 'adx_thresh': 19.190580924331982, 'atr_min_pct': 0.001934838313666606, 'atr_max_pct': 0.10283438117838821, 'tp_mult': 2.411414897982743, 'tsl_mult': 0.6801032871317811, 'strategy': 'breakout', 'time_stop': 132, 'use_sma': False, 'use_atr': False, 'use_adx': False, 'use_ema': False, 'use_spike': False, 'rsi_required': False, 'edge_k': 0.7486808879085228, 'edge_cap': 0.8112435268772455}.
[I 2025-08-30 00:16:41,622] Trial 1447 finished with values: [-1000000000.0, 1000000000.0] and parameters: {'p_sma': 7, 'p_std': 28, 'p_atr': 25, 'p_adx': 16, 'rsi_period': 46, 'ema1': 24, 'ema2': 19, 'slip_atr_k': 0.2073107877596554, 'slip_spread_k': 0.8098988400258846, 'spread_hl_frac': 0.017815624210942693, 'bb_std_mult': 3.520988561031002, 'rsi_os': 21, 'rsi_ob': 72, 'vol_spike': 0.09420688581186841, 'adx_thresh': 9.130890140147395, 'atr_min_pct': 0.002319474121482413, 'atr_max_pct': 0.08661731558385231, 'tp_mult': 1.1095166667384486, 'tsl_mult': 0.7556658421278306, 'strategy': 'breakout', 'time_stop': 105, 'use_sma': False, 'use_atr': False, 'use_adx': False, 'use_ema': False, 'use_spike': False, 'rsi_required': False, 'edge_k': 0.5299968041565544, 'edge_cap': 0.8476358713828361}.
[I 2025-08-30 00:16:41,720] Trial 1450 finished with values: [-0.008944647861683919, 0.00892581087067726] and parameters: {'p_sma': 10, 'p_std': 24, 'p_atr': 27, 'p_adx': 16, 'rsi_period': 80, 'ema1': 23, 'ema2': 26, 'slip_atr_k': 0.02181954869674163, 'slip_spread_k': 0.8122063171303389, 'spread_hl_frac': 0.015618608798109354, 'bb_std_mult': 2.014853169135488, 'rsi_os': 27, 'rsi_ob': 59, 'vol_spike': 0.04096474132298995, 'adx_thresh': 26.37571268175023, 'atr_min_pct': 0.0007438350021320012, 'atr_max_pct': 0.12182039575085164, 'tp_mult': 2.608559410309569, 'tsl_mult': 0.7239245873077873, 'strategy': 'mean_reversion', 'time_stop': 106, 'use_sma': False, 'use_atr': False, 'use_adx': False, 'use_ema': False, 'use_spike': False, 'rsi_required': False, 'edge_k': 0.5385675111227591, 'edge_cap': 0.08045557215154031}.
[I 2025-08-30 00:16:42,000] Trial 1449 finished with values: [-1000000000.0, 1000000000.0] and parameters: {'p_sma': 10, 'p_std': 40, 'p_atr': 27, 'p_adx': 16, 'rsi_period': 19, 'ema1': 17, 'ema2': 55, 'slip_atr_k': 0.023165226156020756, 'slip_spread_k': 0.2878604326646865, 'spread_hl_frac': 0.015561085463265375, 'bb_std_mult': 2.0174281158000653, 'rsi_os': 27, 'rsi_ob': 59, 'vol_spike': 0.0775408947558177, 'adx_thresh': 26.286337171881716, 'atr_min_pct': 0.00737265253701463, 'atr_max_pct': 0.12216784210881843, 'tp_mult': 1.4281330208483956, 'tsl_mult': 0.7182690347033668, 'strategy': 'mean_reversion', 'time_stop': 106, 'use_sma': False, 'use_atr': False, 'use_adx': False, 'use_ema': False, 'use_spike': False, 'rsi_required': False, 'edge_k': 0.14861621544066295, 'edge_cap': 0.7957870648107523}.
[I 2025-08-30 00:16:42,048] Trial 1448 finished with values: [-1000000000.0, 1000000000.0] and parameters: {'p_sma': 7, 'p_std': 28, 'p_atr': 21, 'p_adx': 16, 'rsi_period': 32, 'ema1': 11, 'ema2': 19, 'slip_atr_k': 0.18864594659507605, 'slip_spread_k': 0.811460554013471, 'spread_hl_frac': 0.018092876065286274, 'bb_std_mult': 2.2653199529460255, 'rsi_os': 25, 'rsi_ob': 62, 'vol_spike': 0.20752942058657603, 'adx_thresh': 25.447707674899753, 'atr_min_pct': 0.00200145421430146, 'atr_max_pct': 0.057031979725740825, 'tp_mult': 1.1188649056269848, 'tsl_mult': 0.7556583809393296, 'strategy': 'breakout', 'time_stop': 206, 'use_sma': False, 'use_atr': False, 'use_adx': False, 'use_ema': False, 'use_spike': False, 'rsi_required': False, 'edge_k': 0.5241151567818417, 'edge_cap': 0.08491563744525654}.
[I 2025-08-30 00:17:08,606] Trial 1452 finished with values: [-1000000000.0, 1000000000.0] and parameters: {'p_sma': 31, 'p_std': 48, 'p_atr': 29, 'p_adx': 10, 'rsi_period': 18, 'ema1': 22, 'ema2': 31, 'slip_atr_k': 0.08863016727432288, 'slip_spread_k': 0.6732682234316537, 'spread_hl_frac': 0.01692222909574614, 'bb_std_mult': 1.8897560360093464, 'rsi_os': 25, 'rsi_ob': 60, 'vol_spike': 0.1256553913599199, 'adx_thresh': 34.617050435179046, 'atr_min_pct': 0.008830236117366327, 'atr_max_pct': 0.03244732273391966, 'tp_mult': 1.2403928760876035, 'tsl_mult': 0.7056673853842147, 'strategy': 'breakout', 'time_stop': 220, 'use_sma': False, 'use_atr': False, 'use_adx': False, 'use_ema': False, 'use_spike': False, 'rsi_required': False, 'edge_k': 0.4312453793031488, 'edge_cap': 0.7989821876232802}.
[I 2025-08-30 00:17:08,637] Trial 1451 finished with values: [-1000000000.0, 1000000000.0] and parameters: {'p_sma': 10, 'p_std': 47, 'p_atr': 21, 'p_adx': 19, 'rsi_period': 19, 'ema1': 16, 'ema2': 55, 'slip_atr_k': 0.023371087411651427, 'slip_spread_k': 0.8491111758824718, 'spread_hl_frac': 0.0384850770119083, 'bb_std_mult': 1.883910041430049, 'rsi_os': 27, 'rsi_ob': 59, 'vol_spike': 0.1766438836965815, 'adx_thresh': 31.868064276304153, 'atr_min_pct': 0.0032684389730780502, 'atr_max_pct': 0.055903288299254464, 'tp_mult': 1.2511762966588715, 'tsl_mult': 0.7182687343521963, 'strategy': 'mean_reversion', 'time_stop': 85, 'use_sma': False, 'use_atr': False, 'use_adx': False, 'use_ema': False, 'use_spike': False, 'rsi_required': False, 'edge_k': 0.4001694757940956, 'edge_cap': 0.8482138010952494}.
[I 2025-08-30 00:17:08,796] Trial 1453 finished with values: [-1000000000.0, 1000000000.0] and parameters: {'p_sma': 13, 'p_std': 56, 'p_atr': 21, 'p_adx': 9, 'rsi_period': 7, 'ema1': 16, 'ema2': 56, 'slip_atr_k': 0.010248100921999098, 'slip_spread_k': 0.8451989096718353, 'spread_hl_frac': 0.016767333266767086, 'bb_std_mult': 2.6201414438719515, 'rsi_os': 55, 'rsi_ob': 61, 'vol_spike': 0.20527359324743655, 'adx_thresh': 22.998928325379538, 'atr_min_pct': 0.024483364296493428, 'atr_max_pct': 0.05808727147043097, 'tp_mult': 1.1558644728831395, 'tsl_mult': 0.753274777270502, 'strategy': 'breakout', 'time_stop': 112, 'use_sma': False, 'use_atr': False, 'use_adx': False, 'use_ema': False, 'use_spike': False, 'rsi_required': False, 'edge_k': 1.1115203897037655, 'edge_cap': 0.796366197711303}.
[I 2025-08-30 00:17:08,958] Trial 1454 finished with values: [-0.014579375104597059, 0.01453675692406136] and parameters: {'p_sma': 26, 'p_std': 10, 'p_atr': 24, 'p_adx': 25, 'rsi_period': 7, 'ema1': 16, 'ema2': 17, 'slip_atr_k': 0.008663807650898595, 'slip_spread_k': 0.41354979833296335, 'spread_hl_frac': 0.012035721088507352, 'bb_std_mult': 1.8793945620793888, 'rsi_os': 55, 'rsi_ob': 60, 'vol_spike': 0.17427772659403512, 'adx_thresh': 31.855409833301813, 'atr_min_pct': 0.003271088494673901, 'atr_max_pct': 0.08886951766615259, 'tp_mult': 1.2799439844356728, 'tsl_mult': 0.26854017254270834, 'strategy': 'breakout', 'time_stop': 111, 'use_sma': False, 'use_atr': False, 'use_adx': False, 'use_ema': False, 'use_spike': False, 'rsi_required': False, 'edge_k': 1.1112855554155634, 'edge_cap': 0.45465010436442027}.
[I 2025-08-30 00:17:34,931] Trial 1455 finished with values: [-0.05875437355188895, 0.05873427629261791] and parameters: {'p_sma': 8, 'p_std': 26, 'p_atr': 24, 'p_adx': 8, 'rsi_period': 64, 'ema1': 25, 'ema2': 52, 'slip_atr_k': 0.010676690581630628, 'slip_spread_k': 0.7738473401758834, 'spread_hl_frac': 0.04822910185955379, 'bb_std_mult': 2.1503268163141698, 'rsi_os': 47, 'rsi_ob': 79, 'vol_spike': 0.17718011201744432, 'adx_thresh': 24.796834916426057, 'atr_min_pct': 0.0008271158136981122, 'atr_max_pct': 0.09088332090160825, 'tp_mult': 1.148355913145526, 'tsl_mult': 0.7449049479618288, 'strategy': 'breakout', 'time_stop': 125, 'use_sma': False, 'use_atr': False, 'use_adx': False, 'use_ema': False, 'use_spike': False, 'rsi_required': False, 'edge_k': 0.033039162573092806, 'edge_cap': 0.657051905670962}.
[I 2025-08-30 00:17:34,938] Trial 1457 finished with values: [-0.05673816497665063, 0.05671951187553045] and parameters: {'p_sma': 8, 'p_std': 10, 'p_atr': 8, 'p_adx': 25, 'rsi_period': 49, 'ema1': 9, 'ema2': 52, 'slip_atr_k': 0.013506428335054402, 'slip_spread_k': 0.11370291854480369, 'spread_hl_frac': 0.014066900210530767, 'bb_std_mult': 2.139467214951976, 'rsi_os': 47, 'rsi_ob': 78, 'vol_spike': 0.17502052759960848, 'adx_thresh': 24.928825652207273, 'atr_min_pct': 0.0008589811911337711, 'atr_max_pct': 0.09215327019665007, 'tp_mult': 1.1511335757349372, 'tsl_mult': 0.4552677314056824, 'strategy': 'breakout', 'time_stop': 243, 'use_sma': False, 'use_atr': False, 'use_adx': False, 'use_ema': False, 'use_spike': False, 'rsi_required': False, 'edge_k': 0.6556506700068658, 'edge_cap': 0.22194626438560305}.
[I 2025-08-30 00:17:35,064] Trial 1456 finished with values: [-1000000000.0, 1000000000.0] and parameters: {'p_sma': 14, 'p_std': 26, 'p_atr': 24, 'p_adx': 8, 'rsi_period': 21, 'ema1': 25, 'ema2': 52, 'slip_atr_k': 0.01137448531037795, 'slip_spread_k': 0.7742522813787939, 'spread_hl_frac': 0.01942827573672617, 'bb_std_mult': 2.625763173186974, 'rsi_os': 52, 'rsi_ob': 95, 'vol_spike': 0.21354259913966372, 'adx_thresh': 22.963398447301486, 'atr_min_pct': 0.024478810797887305, 'atr_max_pct': 0.09152387949075821, 'tp_mult': 1.1516568343706888, 'tsl_mult': 0.3322063049563767, 'strategy': 'breakout', 'time_stop': 125, 'use_sma': False, 'use_atr': False, 'use_adx': False, 'use_ema': False, 'use_spike': False, 'rsi_required': False, 'edge_k': 0.6353348058469712, 'edge_cap': 0.6278490576790007}.
