[I 2025-08-29 23:57:13,460] Trial 1269 finished with values: [-0.05522943254923918, 0.05521176808118155] and parameters: {'p_sma': 32, 'p_std': 48, 'p_atr': 11, 'p_adx': 27, 'rsi_period': 22, 'ema1': 23, 'ema2': 54, 'slip_atr_k': 0.019606187951216866, 'slip_spread_k': 0.7953608664931877, 'spread_hl_frac': 0.00888975657499846, 'bb_std_mult': 2.01528253815816, 'rsi_os': 26, 'rsi_ob': 59, 'vol_spike': 0.18267540261346207, 'adx_thresh': 24.176380519121167, 'atr_min_pct': 0.0003980974936819649, 'atr_max_pct': 0.0986953323818313, 'tp_mult': 1.0991036248067259, 'tsl_mult': 0.7580407246457626, 'strategy': 'mean_reversion', 'time_stop': 115, 'use_sma': False, 'use_atr': False, 'use_adx': False, 'use_ema': False, 'use_spike': False, 'rsi_required': False, 'edge_k': 0.629124244927652, 'edge_cap': 0.6730885417373942}.
[I 2025-08-29 23:57:39,087] Trial 1270 finished with values: [-0.04955041897914614, 0.049526073315080084] and parameters: {'p_sma': 6, 'p_std': 23, 'p_atr': 13, 'p_adx': 17, 'rsi_period': 21, 'ema1': 14, 'ema2': 58, 'slip_atr_k': 0.23835170477839546, 'slip_spread_k': 0.5424814963637778, 'spread_hl_frac': 0.011424043402577714, 'bb_std_mult': 2.015388865100118, 'rsi_os': 49, 'rsi_ob': 84, 'vol_spike': 0.18085224920362844, 'adx_thresh': 32.21027240179322, 'atr_min_pct': 0.0004144902298935623, 'atr_max_pct': 0.08362619129998117, 'tp_mult': 1.3553062563672829, 'tsl_mult': 0.787062169790396, 'strategy': 'breakout', 'time_stop': 113, 'use_sma': False, 'use_atr': False, 'use_adx': False, 'use_ema': False, 'use_spike': False, 'rsi_required': False, 'edge_k': 1.8377761338830596, 'edge_cap': 0.5324350620023103}.
[I 2025-08-29 23:57:39,211] Trial 1273 finished with values: [-0.013550212898598923, 0.013532221810860284] and parameters: {'p_sma': 52, 'p_std': 21, 'p_atr': 13, 'p_adx': 18, 'rsi_period': 27, 'ema1': 15, 'ema2': 60, 'slip_atr_k': 0.013161993014165388, 'slip_spread_k': 0.8324422936536509, 'spread_hl_frac': 0.011379942871028094, 'bb_std_mult': 1.878330295900595, 'rsi_os': 26, 'rsi_ob': 61, 'vol_spike': 0.1775759572730941, 'adx_thresh': 25.7861005136423, 'atr_min_pct': 0.0019335319120836565, 'atr_max_pct': 0.028335720453080027, 'tp_mult': 1.7392196837184337, 'tsl_mult': 0.18842615899632925, 'strategy': 'breakout', 'time_stop': 97, 'use_sma': False, 'use_atr': False, 'use_adx': False, 'use_ema': False, 'use_spike': False, 'rsi_required': False, 'edge_k': 0.4037865900447588, 'edge_cap': 0.8154332928111273}.
[I 2025-08-29 23:57:39,286] Trial 1272 finished with values: [-0.004260562248272981, 0.004234356565696216] and parameters: {'p_sma': 8, 'p_std': 29, 'p_atr': 14, 'p_adx': 8, 'rsi_period': 67, 'ema1': 28, 'ema2': 45, 'slip_atr_k': 0.04249186418872114, 'slip_spread_k': 0.8277050161106553, 'spread_hl_frac': 0.018446753372972385, 'bb_std_mult': 2.0047700546028335, 'rsi_os': 26, 'rsi_ob': 61, 'vol_spike': 0.1860409463477362, 'adx_thresh': 30.05545585038795, 'atr_min_pct': 0.0004339407054884611, 'atr_max_pct': 0.0912410738353283, 'tp_mult': 1.0822388932386557, 'tsl_mult': 0.7450812042773036, 'strategy': 'breakout', 'time_stop': 99, 'use_sma': False, 'use_atr': False, 'use_adx': False, 'use_ema': False, 'use_spike': False, 'rsi_required': False, 'edge_k': 0.39731290643074113, 'edge_cap': 0.8259097194497673}.
[I 2025-08-29 23:57:39,354] Trial 1271 finished with values: [-1000000000.0, 1000000000.0] and parameters: {'p_sma': 43, 'p_std': 21, 'p_atr': 24, 'p_adx': 17, 'rsi_period': 21, 'ema1': 18, 'ema2': 60, 'slip_atr_k': 0.07564723272130747, 'slip_spread_k': 0.5509059970972261, 'spread_hl_frac': 0.018558216120930872, 'bb_std_mult': 1.983945071247403, 'rsi_os': 45, 'rsi_ob': 90, 'vol_spike': 0.1775880205807232, 'adx_thresh': 24.034345377476615, 'atr_min_pct': 0.02727255378658917, 'atr_max_pct': 0.06674317926279329, 'tp_mult': 1.3935073187509663, 'tsl_mult': 0.9250027114074645, 'strategy': 'breakout', 'time_stop': 97, 'use_sma': False, 'use_atr': False, 'use_adx': False, 'use_ema': False, 'use_spike': False, 'rsi_required': False, 'edge_k': 0.3778109571804814, 'edge_cap': 0.8225237541391037}.
[I 2025-08-29 23:58:05,507] Trial 1275 finished with values: [-1000000000.0, 1000000000.0] and parameters: {'p_sma': 14, 'p_std': 28, 'p_atr': 24, 'p_adx': 24, 'rsi_period': 24, 'ema1': 25, 'ema2': 39, 'slip_atr_k': 0.04376465826849345, 'slip_spread_k': 0.15744427139079797, 'spread_hl_frac': 0.01846177715668535, 'bb_std_mult': 2.2037223798116874, 'rsi_os': 41, 'rsi_ob': 60, 'vol_spike': 0.2837432853997414, 'adx_thresh': 34.09304489316814, 'atr_min_pct': 0.023477224096196916, 'atr_max_pct': 0.09140276921381678, 'tp_mult': 1.0986992708395977, 'tsl_mult': 0.09876549322626549, 'strategy': 'breakout', 'time_stop': 104, 'use_sma': False, 'use_atr': False, 'use_adx': False, 'use_ema': False, 'use_spike': False, 'rsi_required': False, 'edge_k': 0.5536875888680671, 'edge_cap': 0.7478804440800639}.
[I 2025-08-29 23:58:05,568] Trial 1277 finished with values: [-1000000000.0, 1000000000.0] and parameters: {'p_sma': 14, 'p_std': 27, 'p_atr': 23, 'p_adx': 17, 'rsi_period': 20, 'ema1': 25, 'ema2': 55, 'slip_atr_k': 0.18866006366082932, 'slip_spread_k': 0.1560863575710451, 'spread_hl_frac': 0.020391061431238904, 'bb_std_mult': 2.157209285718365, 'rsi_os': 11, 'rsi_ob': 57, 'vol_spike': 0.10353551638310442, 'adx_thresh': 16.222524739333664, 'atr_min_pct': 0.0027521925816516805, 'atr_max_pct': 0.10152473020702502, 'tp_mult': 1.129540601088657, 'tsl_mult': 0.7059249473728518, 'strategy': 'breakout', 'time_stop': 223, 'use_sma': False, 'use_atr': False, 'use_adx': False, 'use_ema': False, 'use_spike': False, 'rsi_required': False, 'edge_k': 0.5671011263048561, 'edge_cap': 0.7637460231576594}.
[I 2025-08-29 23:58:05,654] Trial 1276 finished with values: [-1000000000.0, 1000000000.0] and parameters: {'p_sma': 7, 'p_std': 28, 'p_atr': 24, 'p_adx': 10, 'rsi_period': 25, 'ema1': 20, 'ema2': 53, 'slip_atr_k': 0.18626743934645168, 'slip_spread_k': 0.9102955551230908, 'spread_hl_frac': 0.018608393613544546, 'bb_std_mult': 1.1859098148614144, 'rsi_os': 10, 'rsi_ob': 57, 'vol_spike': 0.10503577373685055, 'adx_thresh': 26.27022903912197, 'atr_min_pct': 0.00421735025192471, 'atr_max_pct': 0.05039567227565199, 'tp_mult': 1.202338430704378, 'tsl_mult': 0.09443189653926021, 'strategy': 'breakout', 'time_stop': 223, 'use_sma': False, 'use_atr': False, 'use_adx': False, 'use_ema': False, 'use_spike': False, 'rsi_required': False, 'edge_k': 0.5627102830443725, 'edge_cap': 0.7601692351698361}.
[I 2025-08-29 23:58:05,729] Trial 1274 finished with values: [-0.01310537557786462, 0.013083000459450104] and parameters: {'p_sma': 37, 'p_std': 29, 'p_atr': 9, 'p_adx': 18, 'rsi_period': 28, 'ema1': 15, 'ema2': 45, 'slip_atr_k': 0.16533997997898467, 'slip_spread_k': 0.1554762930092995, 'spread_hl_frac': 0.01849712146004868, 'bb_std_mult': 1.9130207411903972, 'rsi_os': 25, 'rsi_ob': 61, 'vol_spike': 0.17550937097334862, 'adx_thresh': 33.898043674066976, 'atr_min_pct': 0.0019162129917954865, 'atr_max_pct': 0.10129275229403932, 'tp_mult': 1.090311139449369, 'tsl_mult': 0.7562394153315866, 'strategy': 'breakout', 'time_stop': 300, 'use_sma': False, 'use_atr': False, 'use_adx': False, 'use_ema': False, 'use_spike': False, 'rsi_required': False, 'edge_k': 0.40445512335773764, 'edge_cap': 0.8169340847638958}.
[I 2025-08-29 23:58:31,322] Trial 1279 finished with values: [-1000000000.0, 1000000000.0] and parameters: {'p_sma': 37, 'p_std': 25, 'p_atr': 18, 'p_adx': 17, 'rsi_period': 19, 'ema1': 24, 'ema2': 52, 'slip_atr_k': 0.16882372812624197, 'slip_spread_k': 0.8542367129980198, 'spread_hl_frac': 0.012654206514659202, 'bb_std_mult': 3.03963743741555, 'rsi_os': 28, 'rsi_ob': 59, 'vol_spike': 0.19250198285395545, 'adx_thresh': 27.31417492239243, 'atr_min_pct': 0.009518777208357039, 'atr_max_pct': 0.11984924755603274, 'tp_mult': 1.0106506826657402, 'tsl_mult': 0.89401754612277, 'strategy': 'breakout', 'time_stop': 300, 'use_sma': False, 'use_atr': False, 'use_adx': False, 'use_ema': False, 'use_spike': False, 'rsi_required': False, 'edge_k': 0.049264044474581214, 'edge_cap': 0.7848194874503989}.
[I 2025-08-29 23:58:31,829] Trial 1280 finished with values: [-1000000000.0, 1000000000.0] and parameters: {'p_sma': 5, 'p_std': 45, 'p_atr': 18, 'p_adx': 18, 'rsi_period': 77, 'ema1': 24, 'ema2': 20, 'slip_atr_k': 0.16562493055219898, 'slip_spread_k': 0.8476095197664776, 'spread_hl_frac': 0.016070154918064107, 'bb_std_mult': 1.9592060511092158, 'rsi_os': 28, 'rsi_ob': 62, 'vol_spike': 0.19350644897481795, 'adx_thresh': 6.455836158152328, 'atr_min_pct': 0.0017339269371828812, 'atr_max_pct': 0.11434474916542617, 'tp_mult': 1.782198400212368, 'tsl_mult': 0.6699884521701917, 'strategy': 'breakout', 'time_stop': 88, 'use_sma': False, 'use_atr': False, 'use_adx': False, 'use_ema': False, 'use_spike': False, 'rsi_required': False, 'edge_k': 0.463389670993871, 'edge_cap': 0.5007006023877907}.
[I 2025-08-29 23:58:32,190] Trial 1281 finished with values: [-1000000000.0, 1000000000.0] and parameters: {'p_sma': 21, 'p_std': 25, 'p_atr': 23, 'p_adx': 29, 'rsi_period': 15, 'ema1': 24, 'ema2': 57, 'slip_atr_k': 0.007605283002775359, 'slip_spread_k': 0.8449833521881217, 'spread_hl_frac': 0.007814240590025626, 'bb_std_mult': 0.9768756778835959, 'rsi_os': 28, 'rsi_ob': 47, 'vol_spike': 0.1939374447344787, 'adx_thresh': 14.474253064067593, 'atr_min_pct': 0.009320066137165978, 'atr_max_pct': 0.11969223667023618, 'tp_mult': 1.2668407717265036, 'tsl_mult': 0.8974250743878778, 'strategy': 'breakout', 'time_stop': 84, 'use_sma': False, 'use_atr': False, 'use_adx': False, 'use_ema': False, 'use_spike': False, 'rsi_required': False, 'edge_k': 0.4914652773184153, 'edge_cap': 0.9968385807437574}.
[I 2025-08-29 23:58:32,191] Trial 1278 finished with values: [-0.012775221303705453, 0.012747647788285835] and parameters: {'p_sma': 8, 'p_std': 25, 'p_atr': 23, 'p_adx': 17, 'rsi_period': 11, 'ema1': 24, 'ema2': 53, 'slip_atr_k': 0.007292507812912749, 'slip_spread_k': 0.8489233121229233, 'spread_hl_frac': 0.015040449687792688, 'bb_std_mult': 2.780450460647486, 'rsi_os': 21, 'rsi_ob': 50, 'vol_spike': 0.06359414047245725, 'adx_thresh': 10.206262669432196, 'atr_min_pct': 0.0017058018648318353, 'atr_max_pct': 0.0509669938796546, 'tp_mult': 2.2655841224373092, 'tsl_mult': 0.7621910741298044, 'strategy': 'breakout', 'time_stop': 204, 'use_sma': False, 'use_atr': False, 'use_adx': False, 'use_ema': False, 'use_spike': False, 'rsi_required': False, 'edge_k': 0.47462561822049987, 'edge_cap': 0.9967759996503371}.
[I 2025-08-29 23:58:32,489] Trial 1283 finished with values: [-1000000000.0, 1000000000.0] and parameters: {'p_sma': 11, 'p_std': 25, 'p_atr': 23, 'p_adx': 15, 'rsi_period': 15, 'ema1': 11, 'ema2': 56, 'slip_atr_k': 0.02365726437507696, 'slip_spread_k': 0.7548804557283789, 'spread_hl_frac': 0.015000487575192603, 'bb_std_mult': 2.074492324154236, 'rsi_os': 24, 'rsi_ob': 50, 'vol_spike': 0.16270861809227308, 'adx_thresh': 10.231596170927771, 'atr_min_pct': 0.0027730365631530927, 'atr_max_pct': 0.09495802279833429, 'tp_mult': 2.258946377024418, 'tsl_mult': 0.7023713868258531, 'strategy': 'mean_reversion', 'time_stop': 205, 'use_sma': False, 'use_atr': False, 'use_adx': False, 'use_ema': False, 'use_spike': False, 'rsi_required': False, 'edge_k': 1.4465612421812954, 'edge_cap': 0.31005185791381074}.
[I 2025-08-29 23:58:57,394] Trial 1282 finished with values: [-0.006695352873783977, 0.006803171656414788] and parameters: {'p_sma': 8, 'p_std': 23, 'p_atr': 30, 'p_adx': 29, 'rsi_period': 22, 'ema1': 24, 'ema2': 55, 'slip_atr_k': 0.007677229716903969, 'slip_spread_k': 0.8217691041451938, 'spread_hl_frac': 0.01607411065617394, 'bb_std_mult': 0.9427640140231497, 'rsi_os': 24, 'rsi_ob': 68, 'vol_spike': 0.06219628956890197, 'adx_thresh': 5.0159488500138245, 'atr_min_pct': 0.0015516464472849893, 'atr_max_pct': 0.09416050964133414, 'tp_mult': 2.615799764694364, 'tsl_mult': 0.6665242221305044, 'strategy': 'breakout', 'time_stop': 44, 'use_sma': False, 'use_atr': False, 'use_adx': False, 'use_ema': False, 'use_spike': False, 'rsi_required': False, 'edge_k': 0.4546928901335451, 'edge_cap': 0.3079812055215689}.
[I 2025-08-29 23:58:57,599] Trial 1284 finished with values: [-1000000000.0, 1000000000.0] and parameters: {'p_sma': 7, 'p_std': 23, 'p_atr': 30, 'p_adx': 14, 'rsi_period': 21, 'ema1': 11, 'ema2': 55, 'slip_atr_k': 0.030230449192509706, 'slip_spread_k': 0.7628698812149304, 'spread_hl_frac': 0.024314512184755388, 'bb_std_mult': 2.072601463703183, 'rsi_os': 25, 'rsi_ob': 63, 'vol_spike': 0.16348372450651497, 'adx_thresh': 21.556083845289663, 'atr_min_pct': 0.002740357599395244, 'atr_max_pct': 0.09535887753558626, 'tp_mult': 1.1645177771806243, 'tsl_mult': 0.42171308113012734, 'strategy': 'mean_reversion', 'time_stop': 107, 'use_sma': False, 'use_atr': False, 'use_adx': False, 'use_ema': False, 'use_spike': False, 'rsi_required': False, 'edge_k': 1.1349775002353, 'edge_cap': 0.7929685587556397}.
[I 2025-08-29 23:58:57,704] Trial 1285 finished with values: [-1000000000.0, 1000000000.0] and parameters: {'p_sma': 60, 'p_std': 42, 'p_atr': 22, 'p_adx': 28, 'rsi_period': 72, 'ema1': 23, 'ema2': 55, 'slip_atr_k': 0.02312225973801909, 'slip_spread_k': 0.7548162011524663, 'spread_hl_frac': 0.02003796094498506, 'bb_std_mult': 2.0706794165797864, 'rsi_os': 25, 'rsi_ob': 93, 'vol_spike': 0.1629163275166433, 'adx_thresh': 24.83376111572814, 'atr_min_pct': 0.010595141199156255, 'atr_max_pct': 0.09452299490264443, 'tp_mult': 2.6876064618181976, 'tsl_mult': 0.72876390637561, 'strategy': 'mean_reversion', 'time_stop': 238, 'use_sma': False, 'use_atr': False, 'use_adx': False, 'use_ema': False, 'use_spike': False, 'rsi_required': False, 'edge_k': 0.5288626987392074, 'edge_cap': 0.7924864404110203}.
[I 2025-08-29 23:58:58,476] Trial 1286 finished with values: [-1000000000.0, 1000000000.0] and parameters: {'p_sma': 7, 'p_std': 42, 'p_atr': 22, 'p_adx': 21, 'rsi_period': 72, 'ema1': 23, 'ema2': 55, 'slip_atr_k': 0.030297989788946586, 'slip_spread_k': 0.0608694060568476, 'spread_hl_frac': 0.019787978016121425, 'bb_std_mult': 2.4737591609988954, 'rsi_os': 25, 'rsi_ob': 74, 'vol_spike': 0.18661218235645866, 'adx_thresh': 5.577042281904557, 'atr_min_pct': 0.0022971432807041003, 'atr_max_pct': 0.09880460400067176, 'tp_mult': 1.168727161532536, 'tsl_mult': 0.725238359133428, 'strategy': 'breakout', 'time_stop': 154, 'use_sma': False, 'use_atr': False, 'use_adx': False, 'use_ema': False, 'use_spike': False, 'rsi_required': False, 'edge_k': 0.5224707530530938, 'edge_cap': 0.7934111692131292}.
[I 2025-08-29 23:59:24,598] Trial 1287 finished with values: [-1000000000.0, 1000000000.0] and parameters: {'p_sma': 59, 'p_std': 26, 'p_atr': 22, 'p_adx': 14, 'rsi_period': 34, 'ema1': 13, 'ema2': 53, 'slip_atr_k': 0.015439735101424237, 'slip_spread_k': 0.8087912397369944, 'spread_hl_frac': 0.019814022597352994, 'bb_std_mult': 2.138346958191723, 'rsi_os': 26, 'rsi_ob': 63, 'vol_spike': 0.1703969226610601, 'adx_thresh': 24.914828425116873, 'atr_min_pct': 0.02576573668508112, 'atr_max_pct': 0.13717993346358726, 'tp_mult': 2.6841793296179257, 'tsl_mult': 0.5011255201929664, 'strategy': 'mean_reversion', 'time_stop': 105, 'use_sma': False, 'use_atr': False, 'use_adx': False, 'use_ema': False, 'use_spike': False, 'rsi_required': False, 'edge_k': 0.5261308813788939, 'edge_cap': 0.6948491172323168}.
[I 2025-08-29 23:59:24,667] Trial 1289 finished with values: [-0.009047503011399227, 0.00901668843106853] and parameters: {'p_sma': 10, 'p_std': 26, 'p_atr': 8, 'p_adx': 21, 'rsi_period': 20, 'ema1': 29, 'ema2': 53, 'slip_atr_k': 0.15930762186246947, 'slip_spread_k': 0.8164101208874105, 'spread_hl_frac': 0.030229646197902665, 'bb_std_mult': 2.2683898736837946, 'rsi_os': 26, 'rsi_ob': 67, 'vol_spike': 0.18637055173072709, 'adx_thresh': 25.617395030572197, 'atr_min_pct': 0.002387008295393651, 'atr_max_pct': 0.09977230538677558, 'tp_mult': 1.8655976774162388, 'tsl_mult': 0.45095424504690107, 'strategy': 'breakout', 'time_stop': 119, 'use_sma': False, 'use_atr': False, 'use_adx': False, 'use_ema': False, 'use_spike': False, 'rsi_required': False, 'edge_k': 0.5113751969693462, 'edge_cap': 0.7760701609154244}.
[I 2025-08-29 23:59:24,839] Trial 1290 finished with values: [-1000000000.0, 1000000000.0] and parameters: {'p_sma': 10, 'p_std': 26, 'p_atr': 23, 'p_adx': 14, 'rsi_period': 64, 'ema1': 25, 'ema2': 54, 'slip_atr_k': 0.014574430511694342, 'slip_spread_k': 0.8102153384407017, 'spread_hl_frac': 0.029531106134094706, 'bb_std_mult': 2.158843958105869, 'rsi_os': 27, 'rsi_ob': 58, 'vol_spike': 0.16924878487446535, 'adx_thresh': 25.522779634662292, 'atr_min_pct': 0.025739060633370836, 'atr_max_pct': 0.09064427394167975, 'tp_mult': 2.311823584464264, 'tsl_mult': 0.9732866563016191, 'strategy': 'breakout', 'time_stop': 121, 'use_sma': False, 'use_atr': False, 'use_adx': False, 'use_ema': False, 'use_spike': False, 'rsi_required': False, 'edge_k': 1.5445821826654562, 'edge_cap': 0.7729219741968522}.
[I 2025-08-29 23:59:24,881] Trial 1288 finished with values: [-1000000000.0, 1000000000.0] and parameters: {'p_sma': 35, 'p_std': 26, 'p_atr': 22, 'p_adx': 15, 'rsi_period': 55, 'ema1': 23, 'ema2': 14, 'slip_atr_k': 0.015963431358527874, 'slip_spread_k': 0.8144155521214579, 'spread_hl_frac': 0.019653889088781632, 'bb_std_mult': 2.263829800280484, 'rsi_os': 42, 'rsi_ob': 59, 'vol_spike': 0.03486470220188903, 'adx_thresh': 24.817572384704736, 'atr_min_pct': 0.00573538415123279, 'atr_max_pct': 0.1495736354687569, 'tp_mult': 2.770324450654321, 'tsl_mult': 0.34860747660136854, 'strategy': 'breakout', 'time_stop': 154, 'use_sma': False, 'use_atr': False, 'use_adx': False, 'use_ema': False, 'use_spike': False, 'rsi_required': False, 'edge_k': 0.5196966750240168, 'edge_cap': 0.8723791636488218}.
[I 2025-08-29 23:59:51,082] Trial 1291 finished with values: [-0.006349692257241024, 0.0063223588659528885] and parameters: {'p_sma': 46, 'p_std': 44, 'p_atr': 23, 'p_adx': 11, 'rsi_period': 23, 'ema1': 25, 'ema2': 13, 'slip_atr_k': 0.014688195475424123, 'slip_spread_k': 0.1065617407064941, 'spread_hl_frac': 0.017568891028891104, 'bb_std_mult': 1.9076524619865385, 'rsi_os': 27, 'rsi_ob': 52, 'vol_spike': 0.17785999716492013, 'adx_thresh': 26.20435910300644, 'atr_min_pct': 0.0031760920502087683, 'atr_max_pct': 0.1493803518249826, 'tp_mult': 2.7862684806460702, 'tsl_mult': 0.3553158809333733, 'strategy': 'breakout', 'time_stop': 193, 'use_sma': False, 'use_atr': False, 'use_adx': False, 'use_ema': False, 'use_spike': False, 'rsi_required': False, 'edge_k': 0.5962480762274891, 'edge_cap': 0.6204579252538998}.
[I 2025-08-29 23:59:51,323] Trial 1294 finished with values: [-0.006396592259519607, 0.0063141109649018385] and parameters: {'p_sma': 16, 'p_std': 31, 'p_atr': 24, 'p_adx': 25, 'rsi_period': 60, 'ema1': 21, 'ema2': 24, 'slip_atr_k': 0.19664164914929727, 'slip_spread_k': 0.10412339487936273, 'spread_hl_frac': 0.03374680836412937, 'bb_std_mult': 1.7627138177304744, 'rsi_os': 36, 'rsi_ob': 60, 'vol_spike': 0.0839129653132023, 'adx_thresh': 26.615732406150947, 'atr_min_pct': 0.002988280773162555, 'atr_max_pct': 0.10460051473750454, 'tp_mult': 1.1407691684314394, 'tsl_mult': 0.14958142681218878, 'strategy': 'breakout', 'time_stop': 92, 'use_sma': False, 'use_atr': False, 'use_adx': False, 'use_ema': False, 'use_spike': False, 'rsi_required': False, 'edge_k': 0.5887994479115365, 'edge_cap': 0.565148057179703}.
[I 2025-08-29 23:59:51,466] Trial 1293 finished with values: [-1000000000.0, 1000000000.0] and parameters: {'p_sma': 5, 'p_std': 24, 'p_atr': 17, 'p_adx': 15, 'rsi_period': 13, 'ema1': 25, 'ema2': 13, 'slip_atr_k': 0.10287849906353647, 'slip_spread_k': 0.7161568627413275, 'spread_hl_frac': 0.017172834018080133, 'bb_std_mult': 1.9322955258454728, 'rsi_os': 42, 'rsi_ob': 59, 'vol_spike': 0.022916241489802647, 'adx_thresh': 26.426182589080014, 'atr_min_pct': 0.003272781925671415, 'atr_max_pct': 0.1062669064124134, 'tp_mult': 1.115268123446856, 'tsl_mult': 0.12317546388617856, 'strategy': 'breakout', 'time_stop': 291, 'use_sma': False, 'use_atr': False, 'use_adx': False, 'use_ema': False, 'use_spike': False, 'rsi_required': False, 'edge_k': 0.672926659800476, 'edge_cap': 0.8738293198895366}.
[I 2025-08-29 23:59:51,467] Trial 1292 finished with values: [-0.006285534819073124, 0.006425861039457992] and parameters: {'p_sma': 35, 'p_std': 44, 'p_atr': 23, 'p_adx': 15, 'rsi_period': 60, 'ema1': 25, 'ema2': 31, 'slip_atr_k': 0.016058528963958034, 'slip_spread_k': 0.6994765199897167, 'spread_hl_frac': 0.017312500434157517, 'bb_std_mult': 2.0094476571491064, 'rsi_os': 42, 'rsi_ob': 59, 'vol_spike': 0.21363939629483067, 'adx_thresh': 26.416539407460167, 'atr_min_pct': 0.004115353614043257, 'atr_max_pct': 0.10498057323350797, 'tp_mult': 2.773903131198044, 'tsl_mult': 0.36530652074434317, 'strategy': 'breakout', 'time_stop': 194, 'use_sma': False, 'use_atr': False, 'use_adx': False, 'use_ema': False, 'use_spike': False, 'rsi_required': False, 'edge_k': 1.5365299972791644, 'edge_cap': 0.5805713906596506}.
[I 2025-08-30 00:00:19,137] Trial 1298 finished with values: [-1000000000.0, 1000000000.0] and parameters: {'p_sma': 24, 'p_std': 5, 'p_atr': 19, 'p_adx': 17, 'rsi_period': 31, 'ema1': 10, 'ema2': 52, 'slip_atr_k': 0.022672244711029813, 'slip_spread_k': 0.3458829491164115, 'spread_hl_frac': 0.003536758987347708, 'bb_std_mult': 2.0421660894042053, 'rsi_os': 27, 'rsi_ob': 62, 'vol_spike': 0.20021518764880847, 'adx_thresh': 24.174058581656062, 'atr_min_pct': 0.01202956365391456, 'atr_max_pct': 0.06194425512209667, 'tp_mult': 2.996559388773391, 'tsl_mult': 0.0336491439543099, 'strategy': 'mean_reversion', 'time_stop': 112, 'use_sma': False, 'use_atr': False, 'use_adx': False, 'use_ema': False, 'use_spike': False, 'rsi_required': False, 'edge_k': 1.9239442555097825, 'edge_cap': 0.21128801817245652}.
