[I 2025-08-29 23:07:07,533] Trial 807 finished with values: [-0.01657570713921963, 0.01655462440324425] and parameters: {'p_sma': 7, 'p_std': 27, 'p_atr': 25, 'p_adx': 16, 'rsi_period': 69, 'ema1': 24, 'ema2': 51, 'slip_atr_k': 0.23866211434667517, 'slip_spread_k': 0.16717742870869134, 'spread_hl_frac': 0.019883975987751695, 'bb_std_mult': 0.8940237085244378, 'rsi_os': 22, 'rsi_ob': 59, 'vol_spike': 0.1857733704551231, 'adx_thresh': 15.752341971700735, 'atr_min_pct': 0.00039379019378134534, 'atr_max_pct': 0.09323774121869344, 'tp_mult': 1.1195220771662868, 'tsl_mult': 0.6877134512990156, 'strategy': 'mean_reversion', 'time_stop': 148, 'use_sma': False, 'use_atr': False, 'use_adx': False, 'use_ema': False, 'use_spike': False, 'rsi_required': False, 'edge_k': 0.8204152104429296, 'edge_cap': 0.1864264863692371}.
[I 2025-08-29 23:07:09,362] Trial 811 finished with values: [-1000000000.0, 1000000000.0] and parameters: {'p_sma': 11, 'p_std': 22, 'p_atr': 22, 'p_adx': 16, 'rsi_period': 20, 'ema1': 24, 'ema2': 54, 'slip_atr_k': 0.025236650184868866, 'slip_spread_k': 0.26348665904030893, 'spread_hl_frac': 0.016600838500540557, 'bb_std_mult': 2.746215877024274, 'rsi_os': 34, 'rsi_ob': 77, 'vol_spike': 0.18015145394809678, 'adx_thresh': 26.127579919335577, 'atr_min_pct': 0.02681666802296502, 'atr_max_pct': 0.0812146203884607, 'tp_mult': 1.1192389045402902, 'tsl_mult': 0.08968688458571122, 'strategy': 'breakout', 'time_stop': 68, 'use_sma': False, 'use_atr': False, 'use_adx': False, 'use_ema': False, 'use_spike': False, 'rsi_required': False, 'edge_k': 0.5042632869006495, 'edge_cap': 0.36399819760198426}.
[I 2025-08-29 23:07:09,969] Trial 812 finished with values: [-0.01729218199088267, 0.017303034619950194] and parameters: {'p_sma': 7, 'p_std': 28, 'p_atr': 22, 'p_adx': 16, 'rsi_period': 21, 'ema1': 23, 'ema2': 54, 'slip_atr_k': 0.12096823380687212, 'slip_spread_k': 0.7371393590252925, 'spread_hl_frac': 0.04347789767777971, 'bb_std_mult': 2.1404648912018125, 'rsi_os': 41, 'rsi_ob': 60, 'vol_spike': 0.07201252824604273, 'adx_thresh': 15.846609470811526, 'atr_min_pct': 0.0022325289712127635, 'atr_max_pct': 0.09750793473455001, 'tp_mult': 2.257639795794629, 'tsl_mult': 0.2362952017621745, 'strategy': 'breakout', 'time_stop': 111, 'use_sma': False, 'use_atr': False, 'use_adx': False, 'use_ema': False, 'use_spike': False, 'rsi_required': False, 'edge_k': 0.3695675304004173, 'edge_cap': 0.8541036282703154}.
[I 2025-08-29 23:07:37,669] Trial 815 finished with values: [-1000000000.0, 1000000000.0] and parameters: {'p_sma': 7, 'p_std': 49, 'p_atr': 22, 'p_adx': 13, 'rsi_period': 78, 'ema1': 27, 'ema2': 23, 'slip_atr_k': 0.1801443438873827, 'slip_spread_k': 0.762888399951265, 'spread_hl_frac': 0.017642564366000927, 'bb_std_mult': 2.149364367217959, 'rsi_os': 25, 'rsi_ob': 92, 'vol_spike': 0.08208929122651472, 'adx_thresh': 24.061350739430747, 'atr_min_pct': 0.0024566245304878114, 'atr_max_pct': 0.09770444818350717, 'tp_mult': 1.5140794163519429, 'tsl_mult': 0.7188832867863577, 'strategy': 'breakout', 'time_stop': 109, 'use_sma': False, 'use_atr': False, 'use_adx': False, 'use_ema': False, 'use_spike': False, 'rsi_required': False, 'edge_k': 0.585970483301332, 'edge_cap': 0.7685933786808}.
[I 2025-08-29 23:07:38,104] Trial 814 finished with values: [-0.006436022911823769, 0.006535300597047013] and parameters: {'p_sma': 11, 'p_std': 58, 'p_atr': 22, 'p_adx': 15, 'rsi_period': 77, 'ema1': 27, 'ema2': 54, 'slip_atr_k': 0.12969659851598303, 'slip_spread_k': 0.7708671875404763, 'spread_hl_frac': 0.017093047469763405, 'bb_std_mult': 2.8666872730736963, 'rsi_os': 41, 'rsi_ob': 58, 'vol_spike': 0.19324993047034023, 'adx_thresh': 8.15228174999689, 'atr_min_pct': 0.002591853543089529, 'atr_max_pct': 0.10361602071364023, 'tp_mult': 1.1874216462085083, 'tsl_mult': 0.5524536690591416, 'strategy': 'breakout', 'time_stop': 33, 'use_sma': False, 'use_atr': False, 'use_adx': False, 'use_ema': False, 'use_spike': False, 'rsi_required': False, 'edge_k': 1.9287824998836667, 'edge_cap': 0.7626939614281294}.
[I 2025-08-29 23:07:38,140] Trial 813 finished with values: [-0.003755495340840076, 0.003903663208967249] and parameters: {'p_sma': 7, 'p_std': 22, 'p_atr': 22, 'p_adx': 16, 'rsi_period': 20, 'ema1': 27, 'ema2': 54, 'slip_atr_k': 0.018478790765365048, 'slip_spread_k': 0.7603045255770198, 'spread_hl_frac': 0.016667020537924876, 'bb_std_mult': 2.84147291323847, 'rsi_os': 21, 'rsi_ob': 88, 'vol_spike': 0.06913315854331135, 'adx_thresh': 25.91949400569005, 'atr_min_pct': 0.0012145508372028348, 'atr_max_pct': 0.10298502451214335, 'tp_mult': 2.3022453725926026, 'tsl_mult': 0.7211763831075647, 'strategy': 'breakout', 'time_stop': 110, 'use_sma': False, 'use_atr': False, 'use_adx': False, 'use_ema': False, 'use_spike': False, 'rsi_required': False, 'edge_k': 0.5555843541979013, 'edge_cap': 0.868240342412718}.
[I 2025-08-29 23:07:38,298] Trial 816 finished with values: [-0.01003704890385193, 0.009995611502779247] and parameters: {'p_sma': 8, 'p_std': 9, 'p_atr': 23, 'p_adx': 15, 'rsi_period': 24, 'ema1': 22, 'ema2': 19, 'slip_atr_k': 0.019146820873239614, 'slip_spread_k': 0.8334550240024576, 'spread_hl_frac': 0.017951683800341654, 'bb_std_mult': 1.935215513507802, 'rsi_os': 30, 'rsi_ob': 87, 'vol_spike': 0.05170199509682462, 'adx_thresh': 25.564645156436185, 'atr_min_pct': 0.0025183527047527112, 'atr_max_pct': 0.10365055836795666, 'tp_mult': 1.5051245073472936, 'tsl_mult': 0.7325334443275875, 'strategy': 'breakout', 'time_stop': 215, 'use_sma': False, 'use_atr': False, 'use_adx': False, 'use_ema': False, 'use_spike': False, 'rsi_required': False, 'edge_k': 1.9356867636117714, 'edge_cap': 0.7630260887430157}.
[I 2025-08-29 23:07:38,567] Trial 819 finished with values: [-1000000000.0, 1000000000.0] and parameters: {'p_sma': 8, 'p_std': 51, 'p_atr': 30, 'p_adx': 22, 'rsi_period': 64, 'ema1': 21, 'ema2': 11, 'slip_atr_k': 0.032159448157309506, 'slip_spread_k': 0.020509138440104102, 'spread_hl_frac': 0.0341214603231279, 'bb_std_mult': 1.9421537137341138, 'rsi_os': 55, 'rsi_ob': 90, 'vol_spike': 0.1669878762145928, 'adx_thresh': 7.103369448150493, 'atr_min_pct': 0.023231299890518982, 'atr_max_pct': 0.1398712249569974, 'tp_mult': 1.2584585353690507, 'tsl_mult': 0.7395833634051134, 'strategy': 'mean_reversion', 'time_stop': 183, 'use_sma': False, 'use_atr': False, 'use_adx': False, 'use_ema': False, 'use_spike': False, 'rsi_required': False, 'edge_k': 0.40369234433886836, 'edge_cap': 0.7987787549340181}.
[I 2025-08-29 23:08:04,371] Trial 817 finished with values: [-1000000000.0, 1000000000.0] and parameters: {'p_sma': 8, 'p_std': 9, 'p_atr': 23, 'p_adx': 22, 'rsi_period': 19, 'ema1': 27, 'ema2': 53, 'slip_atr_k': 0.01587567965829857, 'slip_spread_k': 0.46087466971837, 'spread_hl_frac': 0.03503115204813575, 'bb_std_mult': 2.253848314536324, 'rsi_os': 27, 'rsi_ob': 58, 'vol_spike': 0.19242229128229577, 'adx_thresh': 7.0569077455214355, 'atr_min_pct': 0.02331218876320871, 'atr_max_pct': 0.1027899148787323, 'tp_mult': 1.1802092599868674, 'tsl_mult': 0.7427709164873365, 'strategy': 'breakout', 'time_stop': 117, 'use_sma': False, 'use_atr': False, 'use_adx': False, 'use_ema': False, 'use_spike': False, 'rsi_required': False, 'edge_k': 0.3968110556488209, 'edge_cap': 0.6332462971354312}.
[I 2025-08-29 23:08:04,678] Trial 820 finished with values: [-1000000000.0, 1000000000.0] and parameters: {'p_sma': 6, 'p_std': 10, 'p_atr': 30, 'p_adx': 22, 'rsi_period': 51, 'ema1': 21, 'ema2': 40, 'slip_atr_k': 0.013677843214066395, 'slip_spread_k': 0.8001757142642931, 'spread_hl_frac': 0.01893094652208093, 'bb_std_mult': 2.2442347425979774, 'rsi_os': 43, 'rsi_ob': 61, 'vol_spike': 0.1670241122517542, 'adx_thresh': 11.891718130939873, 'atr_min_pct': 0.01952121028302064, 'atr_max_pct': 0.09225300926031586, 'tp_mult': 2.416103273657651, 'tsl_mult': 0.7488455042634048, 'strategy': 'mean_reversion', 'time_stop': 118, 'use_sma': False, 'use_atr': False, 'use_adx': False, 'use_ema': False, 'use_spike': False, 'rsi_required': False, 'edge_k': 1.8745190489640646, 'edge_cap': 0.4820359963446108}.
[I 2025-08-29 23:08:04,988] Trial 818 finished with values: [-1000000000.0, 1000000000.0] and parameters: {'p_sma': 8, 'p_std': 13, 'p_atr': 23, 'p_adx': 14, 'rsi_period': 64, 'ema1': 27, 'ema2': 52, 'slip_atr_k': 0.017839797744124676, 'slip_spread_k': 0.8309091314180928, 'spread_hl_frac': 0.034950656210486576, 'bb_std_mult': 0.5699125731426455, 'rsi_os': 17, 'rsi_ob': 61, 'vol_spike': 0.054262573607174444, 'adx_thresh': 25.554969669040528, 'atr_min_pct': 0.0038587211869484856, 'atr_max_pct': 0.08676699923455843, 'tp_mult': 1.0105250244650734, 'tsl_mult': 0.7367966384931127, 'strategy': 'breakout', 'time_stop': 120, 'use_sma': False, 'use_atr': False, 'use_adx': False, 'use_ema': False, 'use_spike': False, 'rsi_required': False, 'edge_k': 0.5462928220574399, 'edge_cap': 0.7986870007839032}.
[I 2025-08-29 23:08:05,587] Trial 821 finished with values: [-1000000000.0, 1000000000.0] and parameters: {'p_sma': 5, 'p_std': 41, 'p_atr': 23, 'p_adx': 17, 'rsi_period': 51, 'ema1': 27, 'ema2': 52, 'slip_atr_k': 0.01021816407705997, 'slip_spread_k': 0.8517486165042845, 'spread_hl_frac': 0.018509384734789556, 'bb_std_mult': 2.955050027231315, 'rsi_os': 17, 'rsi_ob': 60, 'vol_spike': 0.10000687331528196, 'adx_thresh': 25.38307086163244, 'atr_min_pct': 0.003963496436706214, 'atr_max_pct': 0.12483852599624132, 'tp_mult': 2.807887561165152, 'tsl_mult': 0.7661828871260968, 'strategy': 'breakout', 'time_stop': 278, 'use_sma': False, 'use_atr': False, 'use_adx': False, 'use_ema': False, 'use_spike': False, 'rsi_required': False, 'edge_k': 0.5511802711295244, 'edge_cap': 0.7267880713798845}.
[I 2025-08-29 23:08:33,056] Trial 824 finished with values: [-0.044384843268419516, 0.04436567507830618] and parameters: {'p_sma': 10, 'p_std': 14, 'p_atr': 7, 'p_adx': 18, 'rsi_period': 17, 'ema1': 21, 'ema2': 47, 'slip_atr_k': 0.00982702079335165, 'slip_spread_k': 0.3131402529611841, 'spread_hl_frac': 0.007901956026058168, 'bb_std_mult': 2.06036190301307, 'rsi_os': 37, 'rsi_ob': 56, 'vol_spike': 0.23926995671862245, 'adx_thresh': 17.954245512325564, 'atr_min_pct': 0.0015541040587105006, 'atr_max_pct': 0.09978105681385306, 'tp_mult': 1.7058297998702263, 'tsl_mult': 0.7814260815081961, 'strategy': 'breakout', 'time_stop': 141, 'use_sma': False, 'use_atr': False, 'use_adx': False, 'use_ema': False, 'use_spike': False, 'rsi_required': False, 'edge_k': 0.5055160969614516, 'edge_cap': 0.8266400759368465}.
[I 2025-08-29 23:08:33,342] Trial 823 finished with values: [-1000000000.0, 1000000000.0] and parameters: {'p_sma': 10, 'p_std': 29, 'p_atr': 24, 'p_adx': 17, 'rsi_period': 22, 'ema1': 28, 'ema2': 58, 'slip_atr_k': 0.22869857821758893, 'slip_spread_k': 0.8552158782300665, 'spread_hl_frac': 0.0077932099403247405, 'bb_std_mult': 2.0456668936875797, 'rsi_os': 26, 'rsi_ob': 61, 'vol_spike': 0.12595009737549018, 'adx_thresh': 25.18621998123891, 'atr_min_pct': 0.010167107464483627, 'atr_max_pct': 0.08629620295486173, 'tp_mult': 1.7108174651088808, 'tsl_mult': 0.27381137633885133, 'strategy': 'breakout', 'time_stop': 102, 'use_sma': False, 'use_atr': False, 'use_adx': False, 'use_ema': False, 'use_spike': False, 'rsi_required': False, 'edge_k': 0.5597761430664088, 'edge_cap': 0.827973060648882}.
[I 2025-08-29 23:08:33,417] Trial 825 finished with values: [-0.0070102681708335, 0.006983977186973637] and parameters: {'p_sma': 10, 'p_std': 29, 'p_atr': 24, 'p_adx': 18, 'rsi_period': 60, 'ema1': 26, 'ema2': 57, 'slip_atr_k': 0.22942393671221228, 'slip_spread_k': 0.8106528944725747, 'spread_hl_frac': 0.023707443701012746, 'bb_std_mult': 2.0577035816197373, 'rsi_os': 15, 'rsi_ob': 45, 'vol_spike': 0.26459392626889966, 'adx_thresh': 5.735225735582471, 'atr_min_pct': 0.001501642387890658, 'atr_max_pct': 0.05257815984614089, 'tp_mult': 1.7187771161024807, 'tsl_mult': 0.7027615497030577, 'strategy': 'breakout', 'time_stop': 165, 'use_sma': False, 'use_atr': False, 'use_adx': False, 'use_ema': False, 'use_spike': False, 'rsi_required': False, 'edge_k': 0.5077975218342854, 'edge_cap': 0.8344727366384811}.
[I 2025-08-29 23:08:33,648] Trial 822 finished with values: [-0.024750422266622607, 0.024747646928391362] and parameters: {'p_sma': 32, 'p_std': 26, 'p_atr': 24, 'p_adx': 18, 'rsi_period': 51, 'ema1': 21, 'ema2': 47, 'slip_atr_k': 0.20851292555371465, 'slip_spread_k': 0.8545987376541064, 'spread_hl_frac': 0.01844002624143434, 'bb_std_mult': 2.9605270422994643, 'rsi_os': 45, 'rsi_ob': 56, 'vol_spike': 0.17385412612883624, 'adx_thresh': 5.809553577410817, 'atr_min_pct': 0.00375150940930639, 'atr_max_pct': 0.08688668249276597, 'tp_mult': 1.0377103749763226, 'tsl_mult': 0.39536949585565834, 'strategy': 'breakout', 'time_stop': 159, 'use_sma': False, 'use_atr': False, 'use_adx': False, 'use_ema': False, 'use_spike': False, 'rsi_required': False, 'edge_k': 0.5504765318172082, 'edge_cap': 0.7255581878045104}.
[I 2025-08-29 23:08:33,909] Trial 829 finished with values: [-1000000000.0, 1000000000.0] and parameters: {'p_sma': 44, 'p_std': 25, 'p_atr': 23, 'p_adx': 24, 'rsi_period': 19, 'ema1': 26, 'ema2': 53, 'slip_atr_k': 0.05200121285064377, 'slip_spread_k': 0.35463027014102266, 'spread_hl_frac': 0.015690725292767955, 'bb_std_mult': 2.0162748287528687, 'rsi_os': 24, 'rsi_ob': 47, 'vol_spike': 0.18004867415549733, 'adx_thresh': 24.23646378578449, 'atr_min_pct': 0.0018615564353230533, 'atr_max_pct': 0.09564564451350106, 'tp_mult': 1.082341430376995, 'tsl_mult': 0.7128686231494976, 'strategy': 'mean_reversion', 'time_stop': 105, 'use_sma': False, 'use_atr': False, 'use_adx': False, 'use_ema': False, 'use_spike': False, 'rsi_required': False, 'edge_k': 0.4451288991040454, 'edge_cap': 0.7888250339441707}.
[I 2025-08-29 23:09:00,341] Trial 827 finished with values: [-0.036125791343780134, 0.03610067202789207] and parameters: {'p_sma': 34, 'p_std': 24, 'p_atr': 29, 'p_adx': 15, 'rsi_period': 19, 'ema1': 26, 'ema2': 25, 'slip_atr_k': 0.0005860903005068668, 'slip_spread_k': 0.814418721406584, 'spread_hl_frac': 0.016475346559722666, 'bb_std_mult': 1.4706382764219663, 'rsi_os': 25, 'rsi_ob': 59, 'vol_spike': 0.1774939022456793, 'adx_thresh': 27.589492087200036, 'atr_min_pct': 0.0018098808092647193, 'atr_max_pct': 0.0960522707108106, 'tp_mult': 1.0838894327854212, 'tsl_mult': 0.6987769997194102, 'strategy': 'mean_reversion', 'time_stop': 49, 'use_sma': False, 'use_atr': False, 'use_adx': False, 'use_ema': False, 'use_spike': False, 'rsi_required': False, 'edge_k': 1.6178689434127191, 'edge_cap': 0.7875840360451748}.
[I 2025-08-29 23:09:00,528] Trial 826 finished with values: [-0.006764822323646835, 0.006736694808046059] and parameters: {'p_sma': 21, 'p_std': 25, 'p_atr': 24, 'p_adx': 17, 'rsi_period': 22, 'ema1': 26, 'ema2': 55, 'slip_atr_k': 0.0014752320072892906, 'slip_spread_k': 0.8169896306218917, 'spread_hl_frac': 0.040334159957095564, 'bb_std_mult': 1.4826832439325393, 'rsi_os': 6, 'rsi_ob': 54, 'vol_spike': 0.12492761692921787, 'adx_thresh': 5.6366326198290135, 'atr_min_pct': 0.0019012449841562498, 'atr_max_pct': 0.09533901712326975, 'tp_mult': 1.990183078734107, 'tsl_mult': 0.4854826571153107, 'strategy': 'breakout', 'time_stop': 166, 'use_sma': False, 'use_atr': False, 'use_adx': False, 'use_ema': False, 'use_spike': False, 'rsi_required': False, 'edge_k': 0.44700283489287934, 'edge_cap': 0.34822386988922405}.
[I 2025-08-29 23:09:00,646] Trial 828 finished with values: [-1000000000.0, 1000000000.0] and parameters: {'p_sma': 6, 'p_std': 26, 'p_atr': 10, 'p_adx': 28, 'rsi_period': 19, 'ema1': 22, 'ema2': 56, 'slip_atr_k': 0.0010892516284544684, 'slip_spread_k': 0.7899875098009247, 'spread_hl_frac': 0.01573786468842913, 'bb_std_mult': 1.4780595983317129, 'rsi_os': 7, 'rsi_ob': 60, 'vol_spike': 0.20195819634090167, 'adx_thresh': 27.308778662067414, 'atr_min_pct': 0.02205329430167105, 'atr_max_pct': 0.09430197554453515, 'tp_mult': 1.0816276779884977, 'tsl_mult': 0.8711309292936908, 'strategy': 'mean_reversion', 'time_stop': 105, 'use_sma': False, 'use_atr': False, 'use_adx': False, 'use_ema': False, 'use_spike': False, 'rsi_required': False, 'edge_k': 0.4503268944102769, 'edge_cap': 0.7893471783633115}.
[I 2025-08-29 23:09:01,167] Trial 830 finished with values: [-1000000000.0, 1000000000.0] and parameters: {'p_sma': 6, 'p_std': 24, 'p_atr': 9, 'p_adx': 17, 'rsi_period': 44, 'ema1': 22, 'ema2': 56, 'slip_atr_k': 0.0019666580240664706, 'slip_spread_k': 0.8289241917264069, 'spread_hl_frac': 0.016359344177511545, 'bb_std_mult': 1.1421394086926875, 'rsi_os': 28, 'rsi_ob': 63, 'vol_spike': 0.20461333360902448, 'adx_thresh': 26.265784873932557, 'atr_min_pct': 0.0029472077034687094, 'atr_max_pct': 0.02413240656583302, 'tp_mult': 2.020330743384477, 'tsl_mult': 0.4835938863107316, 'strategy': 'breakout', 'time_stop': 97, 'use_sma': False, 'use_atr': False, 'use_adx': False, 'use_ema': False, 'use_spike': False, 'rsi_required': False, 'edge_k': 0.6009691693540629, 'edge_cap': 0.8078681831836751}.
[I 2025-08-29 23:09:28,434] Trial 833 finished with values: [-1000000000.0, 1000000000.0] and parameters: {'p_sma': 5, 'p_std': 16, 'p_atr': 19, 'p_adx': 16, 'rsi_period': 33, 'ema1': 22, 'ema2': 33, 'slip_atr_k': 0.028419353895392255, 'slip_spread_k': 0.6279430532732093, 'spread_hl_frac': 0.017592729132591706, 'bb_std_mult': 3.375873655895883, 'rsi_os': 28, 'rsi_ob': 61, 'vol_spike': 0.023435506246949123, 'adx_thresh': 26.157860875513528, 'atr_min_pct': 0.0027842388471526498, 'atr_max_pct': 0.03199471012137401, 'tp_mult': 1.9033572027677106, 'tsl_mult': 0.6526952008474911, 'strategy': 'breakout', 'time_stop': 98, 'use_sma': False, 'use_atr': False, 'use_adx': False, 'use_ema': False, 'use_spike': False, 'rsi_required': False, 'edge_k': 1.704115669928366, 'edge_cap': 0.2739866469445178}.
[I 2025-08-29 23:09:28,931] Trial 831 finished with values: [-1000000000.0, 1000000000.0] and parameters: {'p_sma': 6, 'p_std': 26, 'p_atr': 19, 'p_adx': 16, 'rsi_period': 21, 'ema1': 22, 'ema2': 55, 'slip_atr_k': 0.02760295139014655, 'slip_spread_k': 0.6532828769266341, 'spread_hl_frac': 0.005702254985699214, 'bb_std_mult': 0.786184261598943, 'rsi_os': 28, 'rsi_ob': 60, 'vol_spike': 0.1770513130886235, 'adx_thresh': 32.884845237886694, 'atr_min_pct': 0.002804635247304097, 'atr_max_pct': 0.09285509602924133, 'tp_mult': 1.1657777876915871, 'tsl_mult': 0.6610819180265515, 'strategy': 'breakout', 'time_stop': 248, 'use_sma': False, 'use_atr': False, 'use_adx': False, 'use_ema': False, 'use_spike': False, 'rsi_required': False, 'edge_k': 1.7217368759325442, 'edge_cap': 0.21878705541583848}.
[I 2025-08-29 23:09:29,039] Trial 834 finished with values: [-0.010924396963863936, 0.010899590616773704] and parameters: {'p_sma': 56, 'p_std': 27, 'p_atr': 19, 'p_adx': 16, 'rsi_period': 21, 'ema1': 22, 'ema2': 43, 'slip_atr_k': 0.028120192382215782, 'slip_spread_k': 0.09274840539512924, 'spread_hl_frac': 0.027773872649136166, 'bb_std_mult': 1.9659910734225563, 'rsi_os': 26, 'rsi_ob': 83, 'vol_spike': 0.021707167588081944, 'adx_thresh': 23.758522799837113, 'atr_min_pct': 0.002623704899045151, 'atr_max_pct': 0.09020947658871038, 'tp_mult': 2.891170390011799, 'tsl_mult': 0.6703168450689213, 'strategy': 'breakout', 'time_stop': 19, 'use_sma': False, 'use_atr': False, 'use_adx': False, 'use_ema': False, 'use_spike': False, 'rsi_required': False, 'edge_k': 1.6990220911303537, 'edge_cap': 0.9485909173868363}.
[I 2025-08-29 23:09:29,164] Trial 832 finished with values: [-1000000000.0, 1000000000.0] and parameters: {'p_sma': 56, 'p_std': 20, 'p_atr': 10, 'p_adx': 28, 'rsi_period': 53, 'ema1': 22, 'ema2': 56, 'slip_atr_k': 0.023649619251545132, 'slip_spread_k': 0.909165542242925, 'spread_hl_frac': 0.021019968261936105, 'bb_std_mult': 2.382243581526201, 'rsi_os': 28, 'rsi_ob': 65, 'vol_spike': 0.007131135506213693, 'adx_thresh': 28.899932488727075, 'atr_min_pct': 0.022284131934170906, 'atr_max_pct': 0.09028223705603339, 'tp_mult': 2.631937099696305, 'tsl_mult': 0.8797406721225319, 'strategy': 'breakout', 'time_stop': 96, 'use_sma': False, 'use_atr': False, 'use_adx': False, 'use_ema': False, 'use_spike': False, 'rsi_required': False, 'edge_k': 0.5884494133414413, 'edge_cap': 0.22001843602567206}.
[I 2025-08-29 23:09:56,522] Trial 835 finished with values: [-1000000000.0, 1000000000.0] and parameters: {'p_sma': 9, 'p_std': 19, 'p_atr': 18, 'p_adx': 16, 'rsi_period': 53, 'ema1': 20, 'ema2': 37, 'slip_atr_k': 0.09370232674573721, 'slip_spread_k': 0.5631064665095611, 'spread_hl_frac': 0.019612207448020183, 'bb_std_mult': 2.107811280163009, 'rsi_os': 26, 'rsi_ob': 67, 'vol_spike': 0.007543729160057688, 'adx_thresh': 23.7558771744028, 'atr_min_pct': 0.00448740576324155, 'atr_max_pct': 0.14352149671962552, 'tp_mult': 2.2059759809436628, 'tsl_mult': 0.7739084796255555, 'strategy': 'breakout', 'time_stop': 249, 'use_sma': False, 'use_atr': False, 'use_adx': False, 'use_ema': False, 'use_spike': False, 'rsi_required': False, 'edge_k': 0.4872077439621184, 'edge_cap': 0.8175871742400254}.
[I 2025-08-29 23:09:56,534] Trial 837 finished with values: [-0.008441984390740842, 0.008482880329178105] and parameters: {'p_sma': 9, 'p_std': 44, 'p_atr': 22, 'p_adx': 15, 'rsi_period': 23, 'ema1': 21, 'ema2': 36, 'slip_atr_k': 0.0219254139759234, 'slip_spread_k': 0.7881937402807927, 'spread_hl_frac': 0.025723591394754844, 'bb_std_mult': 1.0360737857868971, 'rsi_os': 27, 'rsi_ob': 58, 'vol_spike': 0.039071163787484195, 'adx_thresh': 24.66709079923656, 'atr_min_pct': 0.000955897831545597, 'atr_max_pct': 0.10062192273542614, 'tp_mult': 2.336066929489274, 'tsl_mult': 0.806844969906191, 'strategy': 'breakout', 'time_stop': 7, 'use_sma': False, 'use_atr': False, 'use_adx': False, 'use_ema': False, 'use_spike': False, 'rsi_required': False, 'edge_k': 0.49599814848509804, 'edge_cap': 0.8123860422628393}.
