[I 2025-08-29 22:40:37,029] Trial 569 finished with values: [-1000000000.0, 1000000000.0] and parameters: {'p_sma': 8, 'p_std': 7, 'p_atr': 9, 'p_adx': 7, 'rsi_period': 25, 'ema1': 23, 'ema2': 11, 'slip_atr_k': 0.0976516641450735, 'slip_spread_k': 0.5494359952624285, 'spread_hl_frac': 0.016657946826817704, 'bb_std_mult': 2.250497434952027, 'rsi_os': 8, 'rsi_ob': 86, 'vol_spike': 0.250506145104388, 'adx_thresh': 24.501383349494393, 'atr_min_pct': 0.01281336707072786, 'atr_max_pct': 0.07170778354720864, 'tp_mult': 1.4279626826682565, 'tsl_mult': 0.9558613235853723, 'strategy': 'breakout', 'time_stop': 100, 'use_sma': False, 'use_atr': False, 'use_adx': False, 'use_ema': False, 'use_spike': False, 'rsi_required': False, 'edge_k': 0.784498474004276, 'edge_cap': 0.9423589637339748}.
[I 2025-08-29 22:40:37,299] Trial 568 finished with values: [-1000000000.0, 1000000000.0] and parameters: {'p_sma': 8, 'p_std': 23, 'p_atr': 16, 'p_adx': 7, 'rsi_period': 19, 'ema1': 23, 'ema2': 57, 'slip_atr_k': 0.09801325513480184, 'slip_spread_k': 0.15718906063671179, 'spread_hl_frac': 0.01661518435140058, 'bb_std_mult': 2.2909227696827617, 'rsi_os': 27, 'rsi_ob': 60, 'vol_spike': 0.25018719060802586, 'adx_thresh': 24.28350633379091, 'atr_min_pct': 0.016018480286449317, 'atr_max_pct': 0.0559807680416318, 'tp_mult': 1.0907570902654595, 'tsl_mult': 0.7010198801211958, 'strategy': 'breakout', 'time_stop': 97, 'use_sma': False, 'use_atr': False, 'use_adx': False, 'use_ema': False, 'use_spike': False, 'rsi_required': False, 'edge_k': 0.44437312547571156, 'edge_cap': 0.6528422657256499}.
[I 2025-08-29 22:40:37,463] Trial 567 finished with values: [-1000000000.0, 1000000000.0] and parameters: {'p_sma': 35, 'p_std': 22, 'p_atr': 24, 'p_adx': 16, 'rsi_period': 64, 'ema1': 25, 'ema2': 51, 'slip_atr_k': 0.09831117693313136, 'slip_spread_k': 0.822940672871744, 'spread_hl_frac': 0.016416574448607557, 'bb_std_mult': 2.235004825344828, 'rsi_os': 36, 'rsi_ob': 62, 'vol_spike': 0.06874943728726485, 'adx_thresh': 28.08572888758312, 'atr_min_pct': 0.02567439032754693, 'atr_max_pct': 0.1343327849342852, 'tp_mult': 1.089983770694068, 'tsl_mult': 0.20600823599452966, 'strategy': 'breakout', 'time_stop': 98, 'use_sma': False, 'use_atr': False, 'use_adx': False, 'use_ema': False, 'use_spike': False, 'rsi_required': False, 'edge_k': 1.8745111858501642, 'edge_cap': 0.058208156890110996}.
[I 2025-08-29 22:41:05,005] Trial 570 finished with values: [-1000000000.0, 1000000000.0] and parameters: {'p_sma': 57, 'p_std': 22, 'p_atr': 19, 'p_adx': 16, 'rsi_period': 64, 'ema1': 15, 'ema2': 59, 'slip_atr_k': 0.19126929043786856, 'slip_spread_k': 0.5539332295469259, 'spread_hl_frac': 0.027081185824464196, 'bb_std_mult': 2.2441859062513876, 'rsi_os': 27, 'rsi_ob': 95, 'vol_spike': 0.17397473420847026, 'adx_thresh': 9.20554412686616, 'atr_min_pct': 0.01588942208017093, 'atr_max_pct': 0.10805664362357267, 'tp_mult': 1.4346837348697927, 'tsl_mult': 0.0768412362676652, 'strategy': 'breakout', 'time_stop': 97, 'use_sma': False, 'use_atr': False, 'use_adx': False, 'use_ema': False, 'use_spike': False, 'rsi_required': False, 'edge_k': 0.7932453944977955, 'edge_cap': 0.06066410081226281}.
[I 2025-08-29 22:41:05,224] Trial 571 finished with values: [-0.004427779054627212, 0.0047966094145335605] and parameters: {'p_sma': 6, 'p_std': 22, 'p_atr': 19, 'p_adx': 17, 'rsi_period': 34, 'ema1': 24, 'ema2': 60, 'slip_atr_k': 0.0175018305069067, 'slip_spread_k': 0.26187796594761337, 'spread_hl_frac': 0.001277022995923853, 'bb_std_mult': 1.9761343859409077, 'rsi_os': 27, 'rsi_ob': 60, 'vol_spike': 0.17280372144942266, 'adx_thresh': 8.456667303583528, 'atr_min_pct': 0.0011593971426652524, 'atr_max_pct': 0.12085147357803158, 'tp_mult': 2.82680024594004, 'tsl_mult': 0.004592467800923039, 'strategy': 'breakout', 'time_stop': 95, 'use_sma': False, 'use_atr': False, 'use_adx': False, 'use_ema': False, 'use_spike': False, 'rsi_required': False, 'edge_k': 0.5970150371205911, 'edge_cap': 0.32923854727476637}.
[I 2025-08-29 22:41:05,689] Trial 573 finished with values: [-0.01595967912813745, 0.015943602861437072] and parameters: {'p_sma': 6, 'p_std': 56, 'p_atr': 26, 'p_adx': 17, 'rsi_period': 50, 'ema1': 17, 'ema2': 40, 'slip_atr_k': 0.0179213698986654, 'slip_spread_k': 0.7852917537879244, 'spread_hl_frac': 0.01835512346642555, 'bb_std_mult': 1.9843468810266718, 'rsi_os': 53, 'rsi_ob': 95, 'vol_spike': 0.17248171918890304, 'adx_thresh': 10.80802916054668, 'atr_min_pct': 0.0013941407312418942, 'atr_max_pct': 0.10796577120327573, 'tp_mult': 1.0340400200883269, 'tsl_mult': 0.3699090822546416, 'strategy': 'breakout', 'time_stop': 137, 'use_sma': False, 'use_atr': False, 'use_adx': False, 'use_ema': False, 'use_spike': False, 'rsi_required': False, 'edge_k': 0.28949182662784034, 'edge_cap': 0.7388031974161114}.
[I 2025-08-29 22:41:05,702] Trial 572 finished with values: [-0.007657428021975665, 0.007630528320665768] and parameters: {'p_sma': 49, 'p_std': 51, 'p_atr': 24, 'p_adx': 23, 'rsi_period': 51, 'ema1': 30, 'ema2': 40, 'slip_atr_k': 0.19251752592861576, 'slip_spread_k': 0.7821778530393246, 'spread_hl_frac': 0.026945388653269776, 'bb_std_mult': 1.9817445879492737, 'rsi_os': 14, 'rsi_ob': 56, 'vol_spike': 0.17386434684628013, 'adx_thresh': 9.492090514952613, 'atr_min_pct': 0.0015053352371389433, 'atr_max_pct': 0.10854583341603218, 'tp_mult': 1.036291327480279, 'tsl_mult': 0.38082306935466215, 'strategy': 'breakout', 'time_stop': 289, 'use_sma': False, 'use_atr': False, 'use_adx': False, 'use_ema': False, 'use_spike': False, 'rsi_required': False, 'edge_k': 0.5890201270071227, 'edge_cap': 0.8125361983921452}.
[I 2025-08-29 22:41:32,548] Trial 575 finished with values: [-0.029213212904808605, 0.02920461743384189] and parameters: {'p_sma': 9, 'p_std': 20, 'p_atr': 12, 'p_adx': 14, 'rsi_period': 17, 'ema1': 24, 'ema2': 53, 'slip_atr_k': 0.08536378492505156, 'slip_spread_k': 0.7819604131856754, 'spread_hl_frac': 0.01850284399020995, 'bb_std_mult': 2.091194117960416, 'rsi_os': 25, 'rsi_ob': 62, 'vol_spike': 0.028025473317469643, 'adx_thresh': 25.15641745854065, 'atr_min_pct': 2.093636798964141e-06, 'atr_max_pct': 0.08129655176677943, 'tp_mult': 2.9929360798821376, 'tsl_mult': 0.7272195406409019, 'strategy': 'breakout', 'time_stop': 142, 'use_sma': False, 'use_atr': False, 'use_adx': False, 'use_ema': False, 'use_spike': False, 'rsi_required': False, 'edge_k': 0.5125476088754957, 'edge_cap': 0.10255138889795035}.
[I 2025-08-29 22:41:32,870] Trial 574 finished with values: [-0.0026763389184824016, 0.0029637844064877693] and parameters: {'p_sma': 5, 'p_std': 24, 'p_atr': 24, 'p_adx': 17, 'rsi_period': 17, 'ema1': 27, 'ema2': 40, 'slip_atr_k': 0.01780059148555207, 'slip_spread_k': 0.7852849019831271, 'spread_hl_frac': 0.018497885698092253, 'bb_std_mult': 1.9744735604541261, 'rsi_os': 23, 'rsi_ob': 62, 'vol_spike': 0.030206336012030516, 'adx_thresh': 25.393076037738854, 'atr_min_pct': 0.0012560777282076315, 'atr_max_pct': 0.09001070307243625, 'tp_mult': 1.0423439393568878, 'tsl_mult': 0.7286993141778173, 'strategy': 'breakout', 'time_stop': 142, 'use_sma': False, 'use_atr': False, 'use_adx': False, 'use_ema': False, 'use_spike': False, 'rsi_required': False, 'edge_k': 0.5091153389929158, 'edge_cap': 0.7421813271598797}.
[I 2025-08-29 22:41:33,123] Trial 577 finished with values: [-0.0016950812538752968, 0.002337494172640878] and parameters: {'p_sma': 16, 'p_std': 24, 'p_atr': 21, 'p_adx': 14, 'rsi_period': 17, 'ema1': 10, 'ema2': 52, 'slip_atr_k': 0.009383033588643916, 'slip_spread_k': 0.10291484698183334, 'spread_hl_frac': 0.01745674806415944, 'bb_std_mult': 3.3093154534542073, 'rsi_os': 25, 'rsi_ob': 61, 'vol_spike': 0.03772750283065614, 'adx_thresh': 25.10746561956366, 'atr_min_pct': 0.004034794016485304, 'atr_max_pct': 0.1497728514737816, 'tp_mult': 1.1223863451320133, 'tsl_mult': 0.7274463529978146, 'strategy': 'breakout', 'time_stop': 8, 'use_sma': False, 'use_atr': False, 'use_adx': False, 'use_ema': False, 'use_spike': False, 'rsi_required': False, 'edge_k': 0.5181912676091527, 'edge_cap': 0.7760715828177532}.
[I 2025-08-29 22:41:33,134] Trial 576 finished with values: [-1000000000.0, 1000000000.0] and parameters: {'p_sma': 9, 'p_std': 20, 'p_atr': 21, 'p_adx': 15, 'rsi_period': 17, 'ema1': 30, 'ema2': 53, 'slip_atr_k': 0.028450021336235663, 'slip_spread_k': 0.8451596629760957, 'spread_hl_frac': 0.031320038323497494, 'bb_std_mult': 3.328057371240366, 'rsi_os': 25, 'rsi_ob': 56, 'vol_spike': 0.0896915952479782, 'adx_thresh': 25.11326081800524, 'atr_min_pct': 0.0039323566896108325, 'atr_max_pct': 0.09675326336243457, 'tp_mult': 1.2582176361712962, 'tsl_mult': 0.766096180994575, 'strategy': 'breakout', 'time_stop': 11, 'use_sma': False, 'use_atr': False, 'use_adx': False, 'use_ema': False, 'use_spike': False, 'rsi_required': False, 'edge_k': 0.8501284892344847, 'edge_cap': 0.81361633632277}.
[I 2025-08-29 22:41:33,397] Trial 578 finished with values: [-1000000000.0, 1000000000.0] and parameters: {'p_sma': 52, 'p_std': 24, 'p_atr': 21, 'p_adx': 29, 'rsi_period': 23, 'ema1': 25, 'ema2': 52, 'slip_atr_k': 0.009599607572196385, 'slip_spread_k': 0.08542012426977375, 'spread_hl_frac': 0.03151658510478876, 'bb_std_mult': 3.53579337987654, 'rsi_os': 55, 'rsi_ob': 52, 'vol_spike': 0.2306358563645284, 'adx_thresh': 25.91225713619619, 'atr_min_pct': 0.0028716592413908144, 'atr_max_pct': 0.1499397478104681, 'tp_mult': 1.5446124164009798, 'tsl_mult': 0.42224951687924583, 'strategy': 'mean_reversion', 'time_stop': 105, 'use_sma': False, 'use_atr': False, 'use_adx': False, 'use_ema': False, 'use_spike': False, 'rsi_required': False, 'edge_k': 1.2140169743944653, 'edge_cap': 0.21794654358658205}.
[I 2025-08-29 22:42:00,438] Trial 579 finished with values: [-1000000000.0, 1000000000.0] and parameters: {'p_sma': 30, 'p_std': 24, 'p_atr': 23, 'p_adx': 28, 'rsi_period': 56, 'ema1': 28, 'ema2': 52, 'slip_atr_k': 0.16112037123155565, 'slip_spread_k': 0.8419045934246034, 'spread_hl_frac': 0.017555781626392434, 'bb_std_mult': 2.135810249565026, 'rsi_os': 23, 'rsi_ob': 75, 'vol_spike': 0.1606173708701576, 'adx_thresh': 25.941773602129246, 'atr_min_pct': 0.004151569511697508, 'atr_max_pct': 0.08958491204923476, 'tp_mult': 1.2481410046115067, 'tsl_mult': 0.7656782331966893, 'strategy': 'mean_reversion', 'time_stop': 167, 'use_sma': False, 'use_atr': False, 'use_adx': False, 'use_ema': False, 'use_spike': False, 'rsi_required': False, 'edge_k': 0.5473932594964772, 'edge_cap': 0.7732692776631953}.
[I 2025-08-29 22:42:00,592] Trial 580 finished with values: [-0.014531325449492538, 0.014478700282007036] and parameters: {'p_sma': 33, 'p_std': 14, 'p_atr': 21, 'p_adx': 15, 'rsi_period': 23, 'ema1': 25, 'ema2': 49, 'slip_atr_k': 0.1504377645748092, 'slip_spread_k': 0.8952291079677717, 'spread_hl_frac': 0.01936990200804934, 'bb_std_mult': 3.3123181403667834, 'rsi_os': 32, 'rsi_ob': 52, 'vol_spike': 0.16015068363092597, 'adx_thresh': 26.214217560484297, 'atr_min_pct': 0.004085797373400528, 'atr_max_pct': 0.08746175175916218, 'tp_mult': 1.2261430458084028, 'tsl_mult': 0.7278408763351194, 'strategy': 'mean_reversion', 'time_stop': 176, 'use_sma': False, 'use_atr': False, 'use_adx': False, 'use_ema': False, 'use_spike': False, 'rsi_required': False, 'edge_k': 1.2148614158256437, 'edge_cap': 0.7696313420561971}.
[I 2025-08-29 22:42:00,917] Trial 581 finished with values: [-0.01873824442305927, 0.0187177705372832] and parameters: {'p_sma': 16, 'p_std': 10, 'p_atr': 23, 'p_adx': 8, 'rsi_period': 23, 'ema1': 10, 'ema2': 56, 'slip_atr_k': 0.13397299583036928, 'slip_spread_k': 0.6338244164240475, 'spread_hl_frac': 0.01758540296344129, 'bb_std_mult': 2.1462458266798365, 'rsi_os': 22, 'rsi_ob': 74, 'vol_spike': 0.13612045626554886, 'adx_thresh': 16.29661530740189, 'atr_min_pct': 0.0021975939434136973, 'atr_max_pct': 0.08941619219185001, 'tp_mult': 2.277371884949227, 'tsl_mult': 0.7271364589967992, 'strategy': 'mean_reversion', 'time_stop': 176, 'use_sma': False, 'use_atr': False, 'use_adx': False, 'use_ema': False, 'use_spike': False, 'rsi_required': False, 'edge_k': 1.805072935658173, 'edge_cap': 0.47433147249166213}.
[I 2025-08-29 22:42:01,161] Trial 582 finished with values: [-1000000000.0, 1000000000.0] and parameters: {'p_sma': 16, 'p_std': 26, 'p_atr': 23, 'p_adx': 25, 'rsi_period': 21, 'ema1': 22, 'ema2': 56, 'slip_atr_k': 0.15710145504938314, 'slip_spread_k': 0.8093136117637111, 'spread_hl_frac': 0.019607451390691883, 'bb_std_mult': 2.174244773767214, 'rsi_os': 23, 'rsi_ob': 60, 'vol_spike': 0.16093340212026386, 'adx_thresh': 18.507463304764094, 'atr_min_pct': 0.019906953552574727, 'atr_max_pct': 0.08787597928780455, 'tp_mult': 1.1107394076860901, 'tsl_mult': 0.7268711304608113, 'strategy': 'mean_reversion', 'time_stop': 254, 'use_sma': False, 'use_atr': False, 'use_adx': False, 'use_ema': False, 'use_spike': False, 'rsi_required': False, 'edge_k': 0.5568209102532804, 'edge_cap': 0.7724702411553791}.
[I 2025-08-29 22:42:28,789] Trial 584 finished with values: [-0.005908281227222534, 0.006275321610823118] and parameters: {'p_sma': 16, 'p_std': 26, 'p_atr': 29, 'p_adx': 16, 'rsi_period': 21, 'ema1': 22, 'ema2': 56, 'slip_atr_k': 0.013974657311676426, 'slip_spread_k': 0.981942282660025, 'spread_hl_frac': 0.012313503489538736, 'bb_std_mult': 1.86127338285477, 'rsi_os': 21, 'rsi_ob': 60, 'vol_spike': 0.18602291143053307, 'adx_thresh': 23.148734463899014, 'atr_min_pct': 0.002017265043886187, 'atr_max_pct': 0.09656026176682922, 'tp_mult': 2.252836666300505, 'tsl_mult': 0.6941843560395797, 'strategy': 'breakout', 'time_stop': 111, 'use_sma': False, 'use_atr': False, 'use_adx': False, 'use_ema': False, 'use_spike': False, 'rsi_required': False, 'edge_k': 1.7291636159457817, 'edge_cap': 0.8631907286027753}.
[I 2025-08-29 22:42:29,048] Trial 583 finished with values: [-1000000000.0, 1000000000.0] and parameters: {'p_sma': 5, 'p_std': 26, 'p_atr': 29, 'p_adx': 16, 'rsi_period': 21, 'ema1': 7, 'ema2': 56, 'slip_atr_k': 0.1329938574726202, 'slip_spread_k': 0.8060793842583553, 'spread_hl_frac': 0.0194982664657298, 'bb_std_mult': 1.8302055875471095, 'rsi_os': 26, 'rsi_ob': 60, 'vol_spike': 0.188675542507882, 'adx_thresh': 23.100124134804982, 'atr_min_pct': 0.002033102126156419, 'atr_max_pct': 0.09685565991453504, 'tp_mult': 1.1193032444334488, 'tsl_mult': 0.694753801373386, 'strategy': 'breakout', 'time_stop': 159, 'use_sma': False, 'use_atr': False, 'use_adx': False, 'use_ema': False, 'use_spike': False, 'rsi_required': False, 'edge_k': 0.4821856675856714, 'edge_cap': 0.8434019079078274}.
[I 2025-08-29 22:42:29,443] Trial 586 finished with values: [-1000000000.0, 1000000000.0] and parameters: {'p_sma': 5, 'p_std': 49, 'p_atr': 29, 'p_adx': 16, 'rsi_period': 60, 'ema1': 12, 'ema2': 54, 'slip_atr_k': 0.01198459712331516, 'slip_spread_k': 0.8630435283659068, 'spread_hl_frac': 0.00581558383289749, 'bb_std_mult': 2.4475829718401707, 'rsi_os': 26, 'rsi_ob': 49, 'vol_spike': 0.299541893178493, 'adx_thresh': 30.459296584049987, 'atr_min_pct': 0.0018221151328458468, 'atr_max_pct': 0.037839519516600625, 'tp_mult': 1.0760464679525459, 'tsl_mult': 0.6313477557183745, 'strategy': 'breakout', 'time_stop': 112, 'use_sma': False, 'use_atr': False, 'use_adx': False, 'use_ema': False, 'use_spike': False, 'rsi_required': False, 'edge_k': 0.48369591441939336, 'edge_cap': 0.8063654067216459}.
[I 2025-08-29 22:42:29,443] Trial 585 finished with values: [-1000000000.0, 1000000000.0] and parameters: {'p_sma': 5, 'p_std': 26, 'p_atr': 28, 'p_adx': 16, 'rsi_period': 21, 'ema1': 22, 'ema2': 54, 'slip_atr_k': 0.014370621325721773, 'slip_spread_k': 0.9720928636397115, 'spread_hl_frac': 0.01989829783438248, 'bb_std_mult': 2.0629443306714466, 'rsi_os': 5, 'rsi_ob': 60, 'vol_spike': 0.17982692358834568, 'adx_thresh': 25.167628381754994, 'atr_min_pct': 0.0008188892788955284, 'atr_max_pct': 0.09648900260302008, 'tp_mult': 1.1161803175926488, 'tsl_mult': 0.2634799543181547, 'strategy': 'breakout', 'time_stop': 111, 'use_sma': False, 'use_atr': False, 'use_adx': False, 'use_ema': False, 'use_spike': False, 'rsi_required': False, 'edge_k': 0.4963138676360016, 'edge_cap': 0.9991678664711018}.
[I 2025-08-29 22:42:56,621] Trial 590 finished with values: [-1000000000.0, 1000000000.0] and parameters: {'p_sma': 7, 'p_std': 53, 'p_atr': 24, 'p_adx': 17, 'rsi_period': 18, 'ema1': 8, 'ema2': 15, 'slip_atr_k': 0.049488046936881, 'slip_spread_k': 0.8121511751053883, 'spread_hl_frac': 0.037032954654256614, 'bb_std_mult': 2.0353541616723536, 'rsi_os': 28, 'rsi_ob': 47, 'vol_spike': 0.19716946791916523, 'adx_thresh': 25.582535572564286, 'atr_min_pct': 0.00328047654691032, 'atr_max_pct': 0.09159593355536834, 'tp_mult': 1.368595788301523, 'tsl_mult': 0.2274756085038479, 'strategy': 'breakout', 'time_stop': 104, 'use_sma': False, 'use_atr': False, 'use_adx': False, 'use_ema': False, 'use_spike': False, 'rsi_required': False, 'edge_k': 0.6243310112827017, 'edge_cap': 0.6154585626768674}.
[I 2025-08-29 22:42:56,842] Trial 588 finished with values: [-0.003916324698168716, 0.003857940152420524] and parameters: {'p_sma': 23, 'p_std': 24, 'p_atr': 25, 'p_adx': 17, 'rsi_period': 44, 'ema1': 13, 'ema2': 54, 'slip_atr_k': 0.022377181996759875, 'slip_spread_k': 0.8743635963238569, 'spread_hl_frac': 0.024677896671942184, 'bb_std_mult': 2.0600649825249264, 'rsi_os': 29, 'rsi_ob': 81, 'vol_spike': 0.19729327003026004, 'adx_thresh': 25.26196617829378, 'atr_min_pct': 0.003145873856445472, 'atr_max_pct': 0.02751468680894492, 'tp_mult': 2.719637599047809, 'tsl_mult': 0.6269958875008261, 'strategy': 'breakout', 'time_stop': 104, 'use_sma': False, 'use_atr': False, 'use_adx': False, 'use_ema': False, 'use_spike': False, 'rsi_required': False, 'edge_k': 0.5118051579851831, 'edge_cap': 0.6052152003330665}.
[I 2025-08-29 22:42:56,970] Trial 589 finished with values: [-1000000000.0, 1000000000.0] and parameters: {'p_sma': 7, 'p_std': 24, 'p_atr': 25, 'p_adx': 27, 'rsi_period': 18, 'ema1': 19, 'ema2': 29, 'slip_atr_k': 0.02249194665395932, 'slip_spread_k': 0.5728957126433787, 'spread_hl_frac': 0.015352088513874195, 'bb_std_mult': 2.0171833168015976, 'rsi_os': 44, 'rsi_ob': 63, 'vol_spike': 0.04207952020722891, 'adx_thresh': 34.12372385717185, 'atr_min_pct': 0.02851425524169323, 'atr_max_pct': 0.09218542845894799, 'tp_mult': 2.495412265263781, 'tsl_mult': 0.5159184534594836, 'strategy': 'breakout', 'time_stop': 105, 'use_sma': False, 'use_atr': False, 'use_adx': False, 'use_ema': False, 'use_spike': False, 'rsi_required': False, 'edge_k': 1.4790513493595991, 'edge_cap': 0.19806036912942643}.
[I 2025-08-29 22:42:57,043] Trial 587 finished with values: [-0.010849427879396578, 0.01092691978707266] and parameters: {'p_sma': 5, 'p_std': 11, 'p_atr': 25, 'p_adx': 16, 'rsi_period': 18, 'ema1': 24, 'ema2': 15, 'slip_atr_k': 0.019778387489496542, 'slip_spread_k': 0.8742722557245759, 'spread_hl_frac': 0.015088320656629302, 'bb_std_mult': 2.4477602662813007, 'rsi_os': 42, 'rsi_ob': 61, 'vol_spike': 0.17996534112274737, 'adx_thresh': 25.452897594865867, 'atr_min_pct': 0.002620774965490104, 'atr_max_pct': 0.037757292032416005, 'tp_mult': 1.0708914701200785, 'tsl_mult': 0.6698840589526849, 'strategy': 'breakout', 'time_stop': 105, 'use_sma': False, 'use_atr': False, 'use_adx': False, 'use_ema': False, 'use_spike': False, 'rsi_required': False, 'edge_k': 0.485344547554754, 'edge_cap': 0.8023367206813076}.
[I 2025-08-29 22:42:57,307] Trial 594 finished with values: [-1000000000.0, 1000000000.0] and parameters: {'p_sma': 8, 'p_std': 40, 'p_atr': 22, 'p_adx': 14, 'rsi_period': 75, 'ema1': 23, 'ema2': 43, 'slip_atr_k': 0.02889340520149364, 'slip_spread_k': 0.835858999561831, 'spread_hl_frac': 0.016763632583606143, 'bb_std_mult': 2.756241272337256, 'rsi_os': 24, 'rsi_ob': 79, 'vol_spike': 0.17888602214261407, 'adx_thresh': 27.060824986395087, 'atr_min_pct': 0.02137531681320475, 'atr_max_pct': 0.020162854168235517, 'tp_mult': 1.1956433369730959, 'tsl_mult': 0.937650828077343, 'strategy': 'breakout', 'time_stop': 123, 'use_sma': False, 'use_atr': False, 'use_adx': False, 'use_ema': False, 'use_spike': False, 'rsi_required': False, 'edge_k': 0.9146971572142717, 'edge_cap': 0.7877532038209506}.
[I 2025-08-29 22:43:25,304] Trial 593 finished with values: [-1000000000.0, 1000000000.0] and parameters: {'p_sma': 8, 'p_std': 39, 'p_atr': 22, 'p_adx': 10, 'rsi_period': 19, 'ema1': 24, 'ema2': 45, 'slip_atr_k': 0.028840829123614804, 'slip_spread_k': 0.2858498477240926, 'spread_hl_frac': 0.01644945428440742, 'bb_std_mult': 2.3466703722722047, 'rsi_os': 19, 'rsi_ob': 61, 'vol_spike': 1.878112716674485e-05, 'adx_thresh': 27.036362960548846, 'atr_min_pct': 0.002525866986216596, 'atr_max_pct': 0.09930050492875485, 'tp_mult': 1.1467259920351447, 'tsl_mult': 0.7172359903790315, 'strategy': 'breakout', 'time_stop': 86, 'use_sma': False, 'use_atr': False, 'use_adx': False, 'use_ema': False, 'use_spike': False, 'rsi_required': False, 'edge_k': 0.39193529055244564, 'edge_cap': 0.7928873489018512}.
[I 2025-08-29 22:43:25,785] Trial 591 finished with values: [-1000000000.0, 1000000000.0] and parameters: {'p_sma': 10, 'p_std': 24, 'p_atr': 25, 'p_adx': 14, 'rsi_period': 25, 'ema1': 19, 'ema2': 20, 'slip_atr_k': 0.03495155385296253, 'slip_spread_k': 0.836503724360348, 'spread_hl_frac': 0.01547158738335399, 'bb_std_mult': 1.2349067362456676, 'rsi_os': 7, 'rsi_ob': 62, 'vol_spike': 0.17757568094590168, 'adx_thresh': 27.084772034735373, 'atr_min_pct': 0.002731686151918067, 'atr_max_pct': 0.08517324580287225, 'tp_mult': 1.7024979064781176, 'tsl_mult': 0.6686517750293768, 'strategy': 'breakout', 'time_stop': 209, 'use_sma': False, 'use_atr': False, 'use_adx': False, 'use_ema': False, 'use_spike': False, 'rsi_required': False, 'edge_k': 0.3926024348912702, 'edge_cap': 0.7913583283146656}.
