[I 2025-08-29 22:25:53,712] Trial 432 finished with values: [-1000000000.0, 1000000000.0] and parameters: {'p_sma': 7, 'p_std': 25, 'p_atr': 25, 'p_adx': 16, 'rsi_period': 14, 'ema1': 8, 'ema2': 52, 'slip_atr_k': 0.20654203267088447, 'slip_spread_k': 0.8662713978549008, 'spread_hl_frac': 0.018938265990478566, 'bb_std_mult': 2.0894421513093775, 'rsi_os': 26, 'rsi_ob': 52, 'vol_spike': 0.04950441512159337, 'adx_thresh': 10.665817140656886, 'atr_min_pct': 0.007023788707155872, 'atr_max_pct': 0.025160765618525135, 'tp_mult': 2.7427805663633493, 'tsl_mult': 0.6828536205068405, 'strategy': 'mean_reversion', 'time_stop': 96, 'use_sma': False, 'use_atr': False, 'use_adx': False, 'use_ema': False, 'use_spike': False, 'rsi_required': False, 'edge_k': 0.9605450077228678, 'edge_cap': 0.6424829163045276}.
[I 2025-08-29 22:25:53,805] Trial 433 finished with values: [-1000000000.0, 1000000000.0] and parameters: {'p_sma': 8, 'p_std': 49, 'p_atr': 17, 'p_adx': 16, 'rsi_period': 22, 'ema1': 8, 'ema2': 52, 'slip_atr_k': 0.20585397830651359, 'slip_spread_k': 0.48768423636613106, 'spread_hl_frac': 0.030750670711469634, 'bb_std_mult': 2.109379306484116, 'rsi_os': 26, 'rsi_ob': 95, 'vol_spike': 0.29281041923102735, 'adx_thresh': 8.792638239215254, 'atr_min_pct': 0.0033624159774405553, 'atr_max_pct': 0.024394132718415035, 'tp_mult': 1.2200888496958255, 'tsl_mult': 0.6797486662641695, 'strategy': 'breakout', 'time_stop': 18, 'use_sma': False, 'use_atr': False, 'use_adx': False, 'use_ema': False, 'use_spike': False, 'rsi_required': False, 'edge_k': 0.5539845085855211, 'edge_cap': 0.8060647943935458}.
[I 2025-08-29 22:26:21,093] Trial 435 finished with values: [-0.003839299356827919, 0.004230986605515501] and parameters: {'p_sma': 5, 'p_std': 29, 'p_atr': 15, 'p_adx': 17, 'rsi_period': 22, 'ema1': 22, 'ema2': 56, 'slip_atr_k': 0.01738956727632602, 'slip_spread_k': 0.23660346311108404, 'spread_hl_frac': 0.021123405153070995, 'bb_std_mult': 2.1547621137388395, 'rsi_os': 44, 'rsi_ob': 65, 'vol_spike': 0.17075538548766167, 'adx_thresh': 9.587705783810852, 'atr_min_pct': 0.003103604355358127, 'atr_max_pct': 0.10673544492017595, 'tp_mult': 1.642853223532192, 'tsl_mult': 0.722365822740377, 'strategy': 'breakout', 'time_stop': 39, 'use_sma': False, 'use_atr': False, 'use_adx': False, 'use_ema': False, 'use_spike': False, 'rsi_required': False, 'edge_k': 0.5438215769231853, 'edge_cap': 0.33388013973143865}.
[I 2025-08-29 22:26:21,289] Trial 434 finished with values: [-1000000000.0, 1000000000.0] and parameters: {'p_sma': 11, 'p_std': 60, 'p_atr': 22, 'p_adx': 17, 'rsi_period': 14, 'ema1': 9, 'ema2': 54, 'slip_atr_k': 0.21480836564249056, 'slip_spread_k': 0.5220959108352111, 'spread_hl_frac': 0.02122189715393216, 'bb_std_mult': 2.107934232735423, 'rsi_os': 26, 'rsi_ob': 69, 'vol_spike': 0.16806501649657224, 'adx_thresh': 26.750844102263084, 'atr_min_pct': 0.0032897891887742345, 'atr_max_pct': 0.0553497422514872, 'tp_mult': 1.7427625722732587, 'tsl_mult': 0.5711931663356429, 'strategy': 'breakout', 'time_stop': 115, 'use_sma': False, 'use_atr': False, 'use_adx': False, 'use_ema': False, 'use_spike': False, 'rsi_required': False, 'edge_k': 0.030792390353775234, 'edge_cap': 0.7661497018606361}.
[I 2025-08-29 22:26:21,454] Trial 436 finished with values: [-1000000000.0, 1000000000.0] and parameters: {'p_sma': 5, 'p_std': 28, 'p_atr': 12, 'p_adx': 17, 'rsi_period': 76, 'ema1': 22, 'ema2': 56, 'slip_atr_k': 0.05674816405592384, 'slip_spread_k': 0.5634759328096342, 'spread_hl_frac': 0.013990889276519659, 'bb_std_mult': 2.1221303452783853, 'rsi_os': 23, 'rsi_ob': 58, 'vol_spike': 0.1792139416592666, 'adx_thresh': 34.60470503541642, 'atr_min_pct': 0.0272971176523375, 'atr_max_pct': 0.09319832179340773, 'tp_mult': 1.150597133985932, 'tsl_mult': 0.9580399291814259, 'strategy': 'breakout', 'time_stop': 292, 'use_sma': False, 'use_atr': False, 'use_adx': False, 'use_ema': False, 'use_spike': False, 'rsi_required': False, 'edge_k': 0.7768239155704462, 'edge_cap': 0.7693146567965664}.
[I 2025-08-29 22:26:21,530] Trial 437 finished with values: [-1000000000.0, 1000000000.0] and parameters: {'p_sma': 24, 'p_std': 45, 'p_atr': 15, 'p_adx': 17, 'rsi_period': 19, 'ema1': 21, 'ema2': 30, 'slip_atr_k': 0.1784929229670251, 'slip_spread_k': 0.003638504955536581, 'spread_hl_frac': 0.021703853499539814, 'bb_std_mult': 1.9479594677144845, 'rsi_os': 23, 'rsi_ob': 65, 'vol_spike': 0.15290758044846545, 'adx_thresh': 26.752321310664996, 'atr_min_pct': 0.02708203156784495, 'atr_max_pct': 0.10536317300026868, 'tp_mult': 1.6578614383756574, 'tsl_mult': 0.9445658221855795, 'strategy': 'breakout', 'time_stop': 201, 'use_sma': False, 'use_atr': False, 'use_adx': False, 'use_ema': False, 'use_spike': False, 'rsi_required': False, 'edge_k': 0.6731046621389908, 'edge_cap': 0.16091135706635512}.
[I 2025-08-29 22:26:48,526] Trial 440 finished with values: [-0.043310481628291875, 0.04330448522233808] and parameters: {'p_sma': 52, 'p_std': 19, 'p_atr': 20, 'p_adx': 15, 'rsi_period': 18, 'ema1': 23, 'ema2': 13, 'slip_atr_k': 0.004863176244607061, 'slip_spread_k': 0.0007917620867672892, 'spread_hl_frac': 0.00258670491319931, 'bb_std_mult': 1.8938675850448998, 'rsi_os': 28, 'rsi_ob': 62, 'vol_spike': 0.04230194023823369, 'adx_thresh': 20.676817986661053, 'atr_min_pct': 0.0008159217153851507, 'atr_max_pct': 0.10096010841603034, 'tp_mult': 1.1315029065214954, 'tsl_mult': 0.7022095763732459, 'strategy': 'breakout', 'time_stop': 277, 'use_sma': False, 'use_atr': False, 'use_adx': False, 'use_ema': False, 'use_spike': False, 'rsi_required': False, 'edge_k': 1.065977969845809, 'edge_cap': 0.8278048189157577}.
[I 2025-08-29 22:26:48,912] Trial 438 finished with values: [-0.007189821414465003, 0.0072213446141258355] and parameters: {'p_sma': 55, 'p_std': 51, 'p_atr': 22, 'p_adx': 15, 'rsi_period': 59, 'ema1': 5, 'ema2': 54, 'slip_atr_k': 0.17880399253161441, 'slip_spread_k': 0.8196725455502134, 'spread_hl_frac': 0.014076392526857585, 'bb_std_mult': 1.9954204589961486, 'rsi_os': 21, 'rsi_ob': 58, 'vol_spike': 0.15434802724242358, 'adx_thresh': 25.808790798242512, 'atr_min_pct': 0.0007579941111389319, 'atr_max_pct': 0.058905130005792394, 'tp_mult': 1.1463347702772577, 'tsl_mult': 0.1447038234542855, 'strategy': 'breakout', 'time_stop': 114, 'use_sma': False, 'use_atr': False, 'use_adx': False, 'use_ema': False, 'use_spike': False, 'rsi_required': False, 'edge_k': 0.4908682611994907, 'edge_cap': 0.7596853815641949}.
[I 2025-08-29 22:26:49,058] Trial 439 finished with values: [-0.009200546384275365, 0.009339085460982133] and parameters: {'p_sma': 12, 'p_std': 19, 'p_atr': 16, 'p_adx': 15, 'rsi_period': 19, 'ema1': 23, 'ema2': 55, 'slip_atr_k': 0.012357608072204554, 'slip_spread_k': 0.5620045346330479, 'spread_hl_frac': 0.01529699089473407, 'bb_std_mult': 2.058979384369808, 'rsi_os': 21, 'rsi_ob': 58, 'vol_spike': 0.17942900296540426, 'adx_thresh': 25.7064732498322, 'atr_min_pct': 0.001476244761890782, 'atr_max_pct': 0.09228703991318374, 'tp_mult': 1.575876480387153, 'tsl_mult': 0.7419804850197382, 'strategy': 'breakout', 'time_stop': 104, 'use_sma': False, 'use_atr': False, 'use_adx': False, 'use_ema': False, 'use_spike': False, 'rsi_required': False, 'edge_k': 1.7580452510007611, 'edge_cap': 0.8275379499706998}.
[I 2025-08-29 22:26:49,161] Trial 441 finished with values: [-0.007349869486868554, 0.007653460574915152] and parameters: {'p_sma': 32, 'p_std': 36, 'p_atr': 21, 'p_adx': 15, 'rsi_period': 60, 'ema1': 26, 'ema2': 54, 'slip_atr_k': 0.012951709735215776, 'slip_spread_k': 0.39898339219317425, 'spread_hl_frac': 0.015459358659661068, 'bb_std_mult': 3.4888292771009226, 'rsi_os': 28, 'rsi_ob': 60, 'vol_spike': 0.18573449255210106, 'adx_thresh': 14.908765384106035, 'atr_min_pct': 0.0015516937147124722, 'atr_max_pct': 0.08230217053761753, 'tp_mult': 1.1353699238145851, 'tsl_mult': 0.7062939605205674, 'strategy': 'breakout', 'time_stop': 229, 'use_sma': False, 'use_atr': False, 'use_adx': False, 'use_ema': False, 'use_spike': False, 'rsi_required': False, 'edge_k': 0.5048735603294152, 'edge_cap': 0.825574610173977}.
[I 2025-08-29 22:27:16,071] Trial 444 finished with values: [-0.00956812979817645, 0.0095638336469288] and parameters: {'p_sma': 32, 'p_std': 26, 'p_atr': 26, 'p_adx': 16, 'rsi_period': 62, 'ema1': 6, 'ema2': 53, 'slip_atr_k': 0.147848302267566, 'slip_spread_k': 0.1592844121508199, 'spread_hl_frac': 0.01740743597598128, 'bb_std_mult': 2.6264789162882627, 'rsi_os': 29, 'rsi_ob': 60, 'vol_spike': 0.1860595093181643, 'adx_thresh': 24.781086308959345, 'atr_min_pct': 0.0024783010944195503, 'atr_max_pct': 0.07731784457671291, 'tp_mult': 1.0826678647962638, 'tsl_mult': 0.7173851866464905, 'strategy': 'mean_reversion', 'time_stop': 89, 'use_sma': False, 'use_atr': False, 'use_adx': False, 'use_ema': False, 'use_spike': False, 'rsi_required': False, 'edge_k': 0.5092511318412425, 'edge_cap': 0.7986535996609949}.
[I 2025-08-29 22:27:16,239] Trial 442 finished with values: [-0.032049184468628145, 0.03202507460476615] and parameters: {'p_sma': 32, 'p_std': 12, 'p_atr': 21, 'p_adx': 7, 'rsi_period': 59, 'ema1': 5, 'ema2': 55, 'slip_atr_k': 0.14648265440247107, 'slip_spread_k': 0.820966089625232, 'spread_hl_frac': 0.0063545169507123155, 'bb_std_mult': 2.774540408380664, 'rsi_os': 38, 'rsi_ob': 59, 'vol_spike': 0.1869977689243617, 'adx_thresh': 25.602054134355622, 'atr_min_pct': 0.0017441638168246131, 'atr_max_pct': 0.035971190345977774, 'tp_mult': 1.0912510875158061, 'tsl_mult': 0.7469902623716352, 'strategy': 'mean_reversion', 'time_stop': 104, 'use_sma': False, 'use_atr': False, 'use_adx': False, 'use_ema': False, 'use_spike': False, 'rsi_required': False, 'edge_k': 1.7762393924903166, 'edge_cap': 0.8191736908452475}.
[I 2025-08-29 22:27:16,453] Trial 443 finished with values: [-0.044866327627307134, 0.04484483962529139] and parameters: {'p_sma': 13, 'p_std': 12, 'p_atr': 21, 'p_adx': 16, 'rsi_period': 24, 'ema1': 24, 'ema2': 55, 'slip_atr_k': 0.020250229131966505, 'slip_spread_k': 0.839741514173575, 'spread_hl_frac': 0.017321774066604446, 'bb_std_mult': 2.5856624687749674, 'rsi_os': 13, 'rsi_ob': 60, 'vol_spike': 0.2078387762734905, 'adx_thresh': 14.923647177248235, 'atr_min_pct': 0.0015714109549664007, 'atr_max_pct': 0.08312625168590845, 'tp_mult': 1.0715711034767328, 'tsl_mult': 0.7422999374085252, 'strategy': 'mean_reversion', 'time_stop': 214, 'use_sma': False, 'use_atr': False, 'use_adx': False, 'use_ema': False, 'use_spike': False, 'rsi_required': False, 'edge_k': 1.7574142779834023, 'edge_cap': 0.7926311915116484}.
[I 2025-08-29 22:27:16,519] Trial 445 finished with values: [-1000000000.0, 1000000000.0] and parameters: {'p_sma': 42, 'p_std': 46, 'p_atr': 24, 'p_adx': 16, 'rsi_period': 24, 'ema1': 24, 'ema2': 53, 'slip_atr_k': 0.10281055641782355, 'slip_spread_k': 0.33757871419928903, 'spread_hl_frac': 0.017054855461254813, 'bb_std_mult': 2.7798768601284842, 'rsi_os': 47, 'rsi_ob': 84, 'vol_spike': 0.206323342430995, 'adx_thresh': 25.0070938967677, 'atr_min_pct': 0.009498732591330907, 'atr_max_pct': 0.036222814995987736, 'tp_mult': 1.0779615792190136, 'tsl_mult': 0.7256598995687368, 'strategy': 'mean_reversion', 'time_stop': 110, 'use_sma': False, 'use_atr': False, 'use_adx': False, 'use_ema': False, 'use_spike': False, 'rsi_required': False, 'edge_k': 0.42486452717560574, 'edge_cap': 0.7810053603752627}.
[I 2025-08-29 22:27:43,539] Trial 446 finished with values: [-1000000000.0, 1000000000.0] and parameters: {'p_sma': 42, 'p_std': 39, 'p_atr': 24, 'p_adx': 26, 'rsi_period': 24, 'ema1': 14, 'ema2': 40, 'slip_atr_k': 0.10267963726028334, 'slip_spread_k': 0.8423197560769728, 'spread_hl_frac': 0.01276701184714568, 'bb_std_mult': 1.7729709631717998, 'rsi_os': 13, 'rsi_ob': 59, 'vol_spike': 0.12186058495960435, 'adx_thresh': 17.01231010872458, 'atr_min_pct': 0.02893235139880823, 'atr_max_pct': 0.14663235147400872, 'tp_mult': 2.4148815267610217, 'tsl_mult': 0.7558455328723214, 'strategy': 'mean_reversion', 'time_stop': 188, 'use_sma': False, 'use_atr': False, 'use_adx': False, 'use_ema': False, 'use_spike': False, 'rsi_required': False, 'edge_k': 0.42547828978500735, 'edge_cap': 0.6971948101397025}.
[I 2025-08-29 22:27:43,902] Trial 448 finished with values: [-1000000000.0, 1000000000.0] and parameters: {'p_sma': 6, 'p_std': 25, 'p_atr': 23, 'p_adx': 16, 'rsi_period': 21, 'ema1': 24, 'ema2': 12, 'slip_atr_k': 0.025916351701242547, 'slip_spread_k': 0.7757868293831929, 'spread_hl_frac': 0.01822823013468566, 'bb_std_mult': 2.0103604966668067, 'rsi_os': 42, 'rsi_ob': 55, 'vol_spike': 0.08925410426945235, 'adx_thresh': 28.340442665182177, 'atr_min_pct': 0.023583999466595104, 'atr_max_pct': 0.0436894521624803, 'tp_mult': 1.011052070126802, 'tsl_mult': 0.7669472833450677, 'strategy': 'breakout', 'time_stop': 97, 'use_sma': False, 'use_atr': False, 'use_adx': False, 'use_ema': False, 'use_spike': False, 'rsi_required': False, 'edge_k': 0.554422775526467, 'edge_cap': 0.9741343431335192}.
[I 2025-08-29 22:27:43,924] Trial 449 finished with values: [-1000000000.0, 1000000000.0] and parameters: {'p_sma': 8, 'p_std': 25, 'p_atr': 23, 'p_adx': 23, 'rsi_period': 30, 'ema1': 24, 'ema2': 40, 'slip_atr_k': 0.07673834839985745, 'slip_spread_k': 0.6995991665005834, 'spread_hl_frac': 0.012872156181857901, 'bb_std_mult': 1.7290420725458446, 'rsi_os': 24, 'rsi_ob': 62, 'vol_spike': 0.16163645122150783, 'adx_thresh': 23.63341605402916, 'atr_min_pct': 0.015365170221726884, 'atr_max_pct': 0.14728431011264465, 'tp_mult': 2.3938079690880856, 'tsl_mult': 0.768980282494239, 'strategy': 'breakout', 'time_stop': 187, 'use_sma': False, 'use_atr': False, 'use_adx': False, 'use_ema': False, 'use_spike': False, 'rsi_required': False, 'edge_k': 0.14969505850356846, 'edge_cap': 0.7015161981392183}.
[I 2025-08-29 22:27:44,069] Trial 447 finished with values: [-1000000000.0, 1000000000.0] and parameters: {'p_sma': 8, 'p_std': 32, 'p_atr': 24, 'p_adx': 24, 'rsi_period': 24, 'ema1': 24, 'ema2': 53, 'slip_atr_k': 0.1653337697345174, 'slip_spread_k': 0.8403437883433309, 'spread_hl_frac': 0.017238158084869268, 'bb_std_mult': 2.304283284873029, 'rsi_os': 15, 'rsi_ob': 61, 'vol_spike': 0.1218918662750841, 'adx_thresh': 24.801441250042945, 'atr_min_pct': 0.015547079075224488, 'atr_max_pct': 0.043551844918543636, 'tp_mult': 2.8212310854311844, 'tsl_mult': 0.7737839933920994, 'strategy': 'breakout', 'time_stop': 111, 'use_sma': False, 'use_atr': False, 'use_adx': False, 'use_ema': False, 'use_spike': False, 'rsi_required': False, 'edge_k': 0.4438432343890024, 'edge_cap': 0.791437829115933}.
[I 2025-08-29 22:28:11,208] Trial 452 finished with values: [-1000000000.0, 1000000000.0] and parameters: {'p_sma': 8, 'p_std': 58, 'p_atr': 22, 'p_adx': 24, 'rsi_period': 17, 'ema1': 16, 'ema2': 54, 'slip_atr_k': 0.1647098699744216, 'slip_spread_k': 0.7525372040822645, 'spread_hl_frac': 0.036651694959725124, 'bb_std_mult': 1.0943278081303291, 'rsi_os': 25, 'rsi_ob': 76, 'vol_spike': 0.19425357545328908, 'adx_thresh': 24.581048886938277, 'atr_min_pct': 0.004270076017205526, 'atr_max_pct': 0.09846212494636558, 'tp_mult': 1.1922369988993973, 'tsl_mult': 0.4448171594551639, 'strategy': 'breakout', 'time_stop': 45, 'use_sma': False, 'use_atr': False, 'use_adx': False, 'use_ema': False, 'use_spike': False, 'rsi_required': False, 'edge_k': 0.5992878310936169, 'edge_cap': 0.7478773068142962}.
[I 2025-08-29 22:28:11,328] Trial 453 finished with values: [-0.0037808471445225367, 0.0037759784341265716] and parameters: {'p_sma': 20, 'p_std': 58, 'p_atr': 22, 'p_adx': 16, 'rsi_period': 16, 'ema1': 23, 'ema2': 56, 'slip_atr_k': 0.00836779610510742, 'slip_spread_k': 0.7887002508860922, 'spread_hl_frac': 0.037537029513888334, 'bb_std_mult': 2.2333207769258627, 'rsi_os': 51, 'rsi_ob': 62, 'vol_spike': 0.19318830157237496, 'adx_thresh': 26.392355171179975, 'atr_min_pct': 0.004351157825621423, 'atr_max_pct': 0.012265915965720131, 'tp_mult': 1.1809841187589298, 'tsl_mult': 0.6924523175139313, 'strategy': 'breakout', 'time_stop': 284, 'use_sma': False, 'use_atr': False, 'use_adx': False, 'use_ema': False, 'use_spike': False, 'rsi_required': False, 'edge_k': 0.3131778617285065, 'edge_cap': 0.7433046190139454}.
[I 2025-08-29 22:28:11,486] Trial 451 finished with values: [-1000000000.0, 1000000000.0] and parameters: {'p_sma': 20, 'p_std': 58, 'p_atr': 22, 'p_adx': 16, 'rsi_period': 20, 'ema1': 16, 'ema2': 54, 'slip_atr_k': 0.16512637564158594, 'slip_spread_k': 0.8097834034540862, 'spread_hl_frac': 0.03557553176878524, 'bb_std_mult': 3.39885994471783, 'rsi_os': 25, 'rsi_ob': 76, 'vol_spike': 0.19549560822333112, 'adx_thresh': 26.230784813850068, 'atr_min_pct': 0.008153536666898005, 'atr_max_pct': 0.09504383998081968, 'tp_mult': 1.1805480080442106, 'tsl_mult': 0.6932525426893017, 'strategy': 'breakout', 'time_stop': 5, 'use_sma': False, 'use_atr': False, 'use_adx': False, 'use_ema': False, 'use_spike': False, 'rsi_required': False, 'edge_k': 0.6111035921546755, 'edge_cap': 0.7458473393984206}.
[I 2025-08-29 22:28:11,602] Trial 450 finished with values: [-1000000000.0, 1000000000.0] and parameters: {'p_sma': 8, 'p_std': 25, 'p_atr': 23, 'p_adx': 16, 'rsi_period': 48, 'ema1': 24, 'ema2': 57, 'slip_atr_k': 0.07655994796117255, 'slip_spread_k': 0.7775503910087007, 'spread_hl_frac': 0.018267093338201534, 'bb_std_mult': 2.003644452760089, 'rsi_os': 24, 'rsi_ob': 50, 'vol_spike': 0.16288240314258953, 'adx_thresh': 24.150140525721348, 'atr_min_pct': 0.029750530449772383, 'atr_max_pct': 0.09937288895037723, 'tp_mult': 1.1849073121761342, 'tsl_mult': 0.7707493287790506, 'strategy': 'breakout', 'time_stop': 99, 'use_sma': False, 'use_atr': False, 'use_adx': False, 'use_ema': False, 'use_spike': False, 'rsi_required': False, 'edge_k': 0.5861294063770774, 'edge_cap': 0.38999813336655015}.
[I 2025-08-29 22:28:39,032] Trial 456 finished with values: [-1000000000.0, 1000000000.0] and parameters: {'p_sma': 6, 'p_std': 27, 'p_atr': 23, 'p_adx': 17, 'rsi_period': 16, 'ema1': 23, 'ema2': 56, 'slip_atr_k': 0.14074104907088036, 'slip_spread_k': 0.27241853106588937, 'spread_hl_frac': 0.03335517965569035, 'bb_std_mult': 1.911861660156206, 'rsi_os': 27, 'rsi_ob': 56, 'vol_spike': 0.17816824843061857, 'adx_thresh': 26.20745903965564, 'atr_min_pct': 0.002614488822958255, 'atr_max_pct': 0.10254781474017882, 'tp_mult': 2.140924945710791, 'tsl_mult': 0.6278701052513905, 'strategy': 'breakout', 'time_stop': 284, 'use_sma': False, 'use_atr': False, 'use_adx': False, 'use_ema': False, 'use_spike': False, 'rsi_required': False, 'edge_k': 1.26821444256263, 'edge_cap': 0.4402038307894457}.
[I 2025-08-29 22:28:39,198] Trial 454 finished with values: [-1000000000.0, 1000000000.0] and parameters: {'p_sma': 6, 'p_std': 21, 'p_atr': 23, 'p_adx': 16, 'rsi_period': 70, 'ema1': 17, 'ema2': 56, 'slip_atr_k': 0.13842315640077485, 'slip_spread_k': 0.30796020221142106, 'spread_hl_frac': 0.018091969601818542, 'bb_std_mult': 2.2151978699598427, 'rsi_os': 19, 'rsi_ob': 93, 'vol_spike': 0.1771693840956641, 'adx_thresh': 26.205892969576237, 'atr_min_pct': 0.008139090682346015, 'atr_max_pct': 0.09507585765493703, 'tp_mult': 1.1828874696656402, 'tsl_mult': 0.04075087787149023, 'strategy': 'breakout', 'time_stop': 117, 'use_sma': False, 'use_atr': False, 'use_adx': False, 'use_ema': False, 'use_spike': False, 'rsi_required': False, 'edge_k': 0.48678681401721163, 'edge_cap': 0.6088412733672544}.
[I 2025-08-29 22:28:39,302] Trial 457 finished with values: [-1000000000.0, 1000000000.0] and parameters: {'p_sma': 59, 'p_std': 27, 'p_atr': 23, 'p_adx': 17, 'rsi_period': 21, 'ema1': 23, 'ema2': 28, 'slip_atr_k': 0.02167672423841716, 'slip_spread_k': 0.7963976722980659, 'spread_hl_frac': 0.016664790098097345, 'bb_std_mult': 2.2318912880629065, 'rsi_os': 27, 'rsi_ob': 82, 'vol_spike': 0.17815838319655444, 'adx_thresh': 16.41812742044523, 'atr_min_pct': 0.00602099577587973, 'atr_max_pct': 0.10270193400654848, 'tp_mult': 2.4849850462058174, 'tsl_mult': 0.4891033772064857, 'strategy': 'breakout', 'time_stop': 104, 'use_sma': False, 'use_atr': False, 'use_adx': False, 'use_ema': False, 'use_spike': False, 'rsi_required': False, 'edge_k': 0.31179211374441884, 'edge_cap': 0.8072932478114027}.
[I 2025-08-29 22:28:39,443] Trial 455 finished with values: [-1000000000.0, 1000000000.0] and parameters: {'p_sma': 48, 'p_std': 24, 'p_atr': 23, 'p_adx': 25, 'rsi_period': 21, 'ema1': 23, 'ema2': 57, 'slip_atr_k': 0.02237721488711029, 'slip_spread_k': 0.2802737879762397, 'spread_hl_frac': 0.018545886545101555, 'bb_std_mult': 3.2337013551878684, 'rsi_os': 25, 'rsi_ob': 62, 'vol_spike': 0.17672281888025757, 'adx_thresh': 26.037515271729518, 'atr_min_pct': 0.008107537202437374, 'atr_max_pct': 0.09548408529049508, 'tp_mult': 2.4653035798054033, 'tsl_mult': 0.6953968947954646, 'strategy': 'breakout', 'time_stop': 102, 'use_sma': False, 'use_atr': False, 'use_adx': False, 'use_ema': False, 'use_spike': False, 'rsi_required': False, 'edge_k': 1.2902477276608388, 'edge_cap': 0.3861441605658673}.
[I 2025-08-29 22:29:06,948] Trial 461 finished with values: [-1000000000.0, 1000000000.0] and parameters: {'p_sma': 11, 'p_std': 23, 'p_atr': 9, 'p_adx': 22, 'rsi_period': 27, 'ema1': 25, 'ema2': 55, 'slip_atr_k': 0.01575824977958238, 'slip_spread_k': 0.9620868034209182, 'spread_hl_frac': 0.015824571374480484, 'bb_std_mult': 1.5703106927985555, 'rsi_os': 29, 'rsi_ob': 57, 'vol_spike': 0.05408409965534318, 'adx_thresh': 25.313863143417585, 'atr_min_pct': 0.011645376477174198, 'atr_max_pct': 0.09142766078673999, 'tp_mult': 1.1129197085754567, 'tsl_mult': 0.7268013847343132, 'strategy': 'breakout', 'time_stop': 126, 'use_sma': False, 'use_atr': False, 'use_adx': False, 'use_ema': False, 'use_spike': False, 'rsi_required': False, 'edge_k': 0.36407702645753925, 'edge_cap': 0.8719930086073233}.
