[I 2025-08-29 22:52:14,920] Trial 671 finished with values: [-1000000000.0, 1000000000.0] and parameters: {'p_sma': 23, 'p_std': 26, 'p_atr': 30, 'p_adx': 16, 'rsi_period': 31, 'ema1': 18, 'ema2': 51, 'slip_atr_k': 0.11794361100860062, 'slip_spread_k': 0.2673760279982959, 'spread_hl_frac': 0.028143737251436613, 'bb_std_mult': 2.0774615743066556, 'rsi_os': 22, 'rsi_ob': 90, 'vol_spike': 0.18289139894245016, 'adx_thresh': 26.364087687128105, 'atr_min_pct': 0.02625393515678214, 'atr_max_pct': 0.08889205190481103, 'tp_mult': 1.379697939750706, 'tsl_mult': 0.07935294416694838, 'strategy': 'breakout', 'time_stop': 224, 'use_sma': False, 'use_atr': False, 'use_adx': False, 'use_ema': False, 'use_spike': False, 'rsi_required': False, 'edge_k': 0.5299640420632921, 'edge_cap': 0.2591349435280603}.
[I 2025-08-29 22:52:43,254] Trial 678 finished with values: [-1000000000.0, 1000000000.0] and parameters: {'p_sma': 7, 'p_std': 19, 'p_atr': 23, 'p_adx': 24, 'rsi_period': 63, 'ema1': 14, 'ema2': 54, 'slip_atr_k': 0.02783772101787002, 'slip_spread_k': 0.8018849342263875, 'spread_hl_frac': 0.04686266661858401, 'bb_std_mult': 1.988159674407392, 'rsi_os': 29, 'rsi_ob': 63, 'vol_spike': 0.17451912411306691, 'adx_thresh': 12.596057170655051, 'atr_min_pct': 0.0197884513906629, 'atr_max_pct': 0.10248489407004593, 'tp_mult': 1.1103438167441475, 'tsl_mult': 0.6992425670378604, 'strategy': 'breakout', 'time_stop': 205, 'use_sma': False, 'use_atr': False, 'use_adx': False, 'use_ema': False, 'use_spike': False, 'rsi_required': False, 'edge_k': 0.45848215262266423, 'edge_cap': 0.5668438747903065}.
[I 2025-08-29 22:52:43,265] Trial 676 finished with values: [-0.006339614573808272, 0.006357811045831412] and parameters: {'p_sma': 53, 'p_std': 24, 'p_atr': 23, 'p_adx': 9, 'rsi_period': 22, 'ema1': 25, 'ema2': 54, 'slip_atr_k': 0.04596110678704503, 'slip_spread_k': 0.793183120918585, 'spread_hl_frac': 0.028449574152618083, 'bb_std_mult': 1.9967069487814453, 'rsi_os': 23, 'rsi_ob': 88, 'vol_spike': 0.1753120400360869, 'adx_thresh': 8.668758095271691, 'atr_min_pct': 0.0032020778519938134, 'atr_max_pct': 0.08918540771271422, 'tp_mult': 1.1164476195011057, 'tsl_mult': 0.2725022014806881, 'strategy': 'mean_reversion', 'time_stop': 96, 'use_sma': False, 'use_atr': False, 'use_adx': False, 'use_ema': False, 'use_spike': False, 'rsi_required': False, 'edge_k': 1.9429500520690808, 'edge_cap': 0.7511740165454966}.
[I 2025-08-29 22:52:43,513] Trial 679 finished with values: [-1000000000.0, 1000000000.0] and parameters: {'p_sma': 7, 'p_std': 24, 'p_atr': 23, 'p_adx': 29, 'rsi_period': 79, 'ema1': 27, 'ema2': 54, 'slip_atr_k': 0.04650855702966218, 'slip_spread_k': 0.687516505975756, 'spread_hl_frac': 0.03768183946576603, 'bb_std_mult': 1.9900038827205748, 'rsi_os': 10, 'rsi_ob': 88, 'vol_spike': 0.1781521484844096, 'adx_thresh': 16.144749581796738, 'atr_min_pct': 0.0199623858839219, 'atr_max_pct': 0.10421586728314723, 'tp_mult': 1.906182295839045, 'tsl_mult': 0.7013985945257077, 'strategy': 'breakout', 'time_stop': 134, 'use_sma': False, 'use_atr': False, 'use_adx': False, 'use_ema': False, 'use_spike': False, 'rsi_required': False, 'edge_k': 0.47165536089338156, 'edge_cap': 0.16961764040383775}.
[I 2025-08-29 22:52:43,890] Trial 677 finished with values: [-1000000000.0, 1000000000.0] and parameters: {'p_sma': 7, 'p_std': 30, 'p_atr': 23, 'p_adx': 24, 'rsi_period': 22, 'ema1': 19, 'ema2': 54, 'slip_atr_k': 0.046969875868361835, 'slip_spread_k': 0.7981936685269364, 'spread_hl_frac': 0.03021656754704015, 'bb_std_mult': 1.9902319879025023, 'rsi_os': 10, 'rsi_ob': 56, 'vol_spike': 0.17506891810458514, 'adx_thresh': 23.281018446496677, 'atr_min_pct': 0.003616874468219478, 'atr_max_pct': 0.0964830112500715, 'tp_mult': 1.2231371629544037, 'tsl_mult': 0.7119915500086436, 'strategy': 'breakout', 'time_stop': 134, 'use_sma': False, 'use_atr': False, 'use_adx': False, 'use_ema': False, 'use_spike': False, 'rsi_required': False, 'edge_k': 0.5154595947562952, 'edge_cap': 0.17322439504013576}.
[I 2025-08-29 22:53:11,203] Trial 683 finished with values: [-1000000000.0, 1000000000.0] and parameters: {'p_sma': 5, 'p_std': 48, 'p_atr': 22, 'p_adx': 17, 'rsi_period': 50, 'ema1': 24, 'ema2': 20, 'slip_atr_k': 0.016678743903793883, 'slip_spread_k': 0.6416695943850852, 'spread_hl_frac': 0.019563794415255624, 'bb_std_mult': 2.1775164781289504, 'rsi_os': 25, 'rsi_ob': 58, 'vol_spike': 0.1359639879404394, 'adx_thresh': 25.617103652222905, 'atr_min_pct': 0.020820249163826722, 'atr_max_pct': 0.06328971025009618, 'tp_mult': 2.286878602517806, 'tsl_mult': 0.1190344101453028, 'strategy': 'breakout', 'time_stop': 106, 'use_sma': False, 'use_atr': False, 'use_adx': False, 'use_ema': False, 'use_spike': False, 'rsi_required': False, 'edge_k': 0.39639627068168254, 'edge_cap': 0.8042814789326985}.
[I 2025-08-29 22:53:12,165] Trial 680 finished with values: [-1000000000.0, 1000000000.0] and parameters: {'p_sma': 12, 'p_std': 29, 'p_atr': 22, 'p_adx': 29, 'rsi_period': 79, 'ema1': 24, 'ema2': 52, 'slip_atr_k': 0.017155168578288544, 'slip_spread_k': 0.5045621299684427, 'spread_hl_frac': 0.019696970935729183, 'bb_std_mult': 2.3826970958174947, 'rsi_os': 8, 'rsi_ob': 56, 'vol_spike': 0.11136424944295573, 'adx_thresh': 25.456522321497577, 'atr_min_pct': 0.002086896478080264, 'atr_max_pct': 0.09560695034572672, 'tp_mult': 2.301582277373572, 'tsl_mult': 0.5446383639591992, 'strategy': 'breakout', 'time_stop': 106, 'use_sma': False, 'use_atr': False, 'use_adx': False, 'use_ema': False, 'use_spike': False, 'rsi_required': False, 'edge_k': 0.19326969751527256, 'edge_cap': 0.7996344548445152}.
[I 2025-08-29 22:53:12,349] Trial 682 finished with values: [-0.017622788040242865, 0.017563400000854486] and parameters: {'p_sma': 5, 'p_std': 14, 'p_atr': 22, 'p_adx': 7, 'rsi_period': 20, 'ema1': 21, 'ema2': 25, 'slip_atr_k': 0.23838993308404488, 'slip_spread_k': 0.6419260471293899, 'spread_hl_frac': 0.043810571053954014, 'bb_std_mult': 2.1503183056939763, 'rsi_os': 55, 'rsi_ob': 58, 'vol_spike': 0.18763849018974574, 'adx_thresh': 25.416217803327733, 'atr_min_pct': 0.0036145936050825155, 'atr_max_pct': 0.09681131805699754, 'tp_mult': 2.3371580002767067, 'tsl_mult': 0.43753021683729804, 'strategy': 'breakout', 'time_stop': 107, 'use_sma': False, 'use_atr': False, 'use_adx': False, 'use_ema': False, 'use_spike': False, 'rsi_required': False, 'edge_k': 1.9985541707675507, 'edge_cap': 0.8065081466363543}.
[I 2025-08-29 22:53:12,496] Trial 681 finished with values: [-1000000000.0, 1000000000.0] and parameters: {'p_sma': 5, 'p_std': 29, 'p_atr': 22, 'p_adx': 17, 'rsi_period': 84, 'ema1': 24, 'ema2': 52, 'slip_atr_k': 0.01829544152200994, 'slip_spread_k': 0.46429941154811133, 'spread_hl_frac': 0.020093554416849478, 'bb_std_mult': 1.6979222234530433, 'rsi_os': 27, 'rsi_ob': 56, 'vol_spike': 0.18430378101151304, 'adx_thresh': 25.51700550360499, 'atr_min_pct': 0.024499537481936978, 'atr_max_pct': 0.09665171176165256, 'tp_mult': 2.1181383916969847, 'tsl_mult': 0.9450189348040385, 'strategy': 'breakout', 'time_stop': 106, 'use_sma': False, 'use_atr': False, 'use_adx': False, 'use_ema': False, 'use_spike': False, 'rsi_required': False, 'edge_k': 1.9983475871341219, 'edge_cap': 0.8061361507648739}.
[I 2025-08-29 22:53:12,832] Trial 687 finished with values: [-1000000000.0, 1000000000.0] and parameters: {'p_sma': 51, 'p_std': 36, 'p_atr': 23, 'p_adx': 15, 'rsi_period': 19, 'ema1': 22, 'ema2': 56, 'slip_atr_k': 0.025504008623591035, 'slip_spread_k': 0.8305878907081578, 'spread_hl_frac': 0.004776302595059231, 'bb_std_mult': 1.8921084439481957, 'rsi_os': 17, 'rsi_ob': 46, 'vol_spike': 0.272646830723411, 'adx_thresh': 10.344859553798983, 'atr_min_pct': 0.002654117485042469, 'atr_max_pct': 0.09947528218903226, 'tp_mult': 2.038944557169208, 'tsl_mult': 0.749529523373004, 'strategy': 'mean_reversion', 'time_stop': 121, 'use_sma': False, 'use_atr': False, 'use_adx': False, 'use_ema': False, 'use_spike': False, 'rsi_required': False, 'edge_k': 0.563398257317182, 'edge_cap': 0.8753585465624111}.
[I 2025-08-29 22:53:38,843] Trial 686 finished with values: [-1000000000.0, 1000000000.0] and parameters: {'p_sma': 8, 'p_std': 38, 'p_atr': 21, 'p_adx': 26, 'rsi_period': 74, 'ema1': 22, 'ema2': 47, 'slip_atr_k': 0.02652085612228348, 'slip_spread_k': 0.8304833429878523, 'spread_hl_frac': 0.005361079100186444, 'bb_std_mult': 1.8910287170958116, 'rsi_os': 27, 'rsi_ob': 78, 'vol_spike': 0.1558714168065137, 'adx_thresh': 11.234543341850365, 'atr_min_pct': 0.012557366787604548, 'atr_max_pct': 0.11012378362618577, 'tp_mult': 2.1240753285951994, 'tsl_mult': 0.9408121395504225, 'strategy': 'mean_reversion', 'time_stop': 125, 'use_sma': False, 'use_atr': False, 'use_adx': False, 'use_ema': False, 'use_spike': False, 'rsi_required': False, 'edge_k': 0.5726300770788745, 'edge_cap': 0.8765179926167858}.
[I 2025-08-29 22:53:39,433] Trial 684 finished with values: [-0.03497857205471233, 0.034956298872319734] and parameters: {'p_sma': 51, 'p_std': 25, 'p_atr': 22, 'p_adx': 7, 'rsi_period': 20, 'ema1': 8, 'ema2': 52, 'slip_atr_k': 0.021556054111995467, 'slip_spread_k': 0.5114523333122704, 'spread_hl_frac': 0.00490277208500042, 'bb_std_mult': 2.088683937395915, 'rsi_os': 27, 'rsi_ob': 60, 'vol_spike': 0.18696568801151342, 'adx_thresh': 25.337070161816108, 'atr_min_pct': 0.002087730048002925, 'atr_max_pct': 0.11960905277829732, 'tp_mult': 1.1457118877526704, 'tsl_mult': 0.7530816180964012, 'strategy': 'mean_reversion', 'time_stop': 101, 'use_sma': False, 'use_atr': False, 'use_adx': False, 'use_ema': False, 'use_spike': False, 'rsi_required': False, 'edge_k': 0.5814362586745031, 'edge_cap': 0.8068911330042565}.
[I 2025-08-29 22:53:39,684] Trial 685 finished with values: [-0.019646585363008673, 0.01960168771429149] and parameters: {'p_sma': 20, 'p_std': 25, 'p_atr': 20, 'p_adx': 15, 'rsi_period': 20, 'ema1': 5, 'ema2': 56, 'slip_atr_k': 0.10417234428266454, 'slip_spread_k': 0.829909980901869, 'spread_hl_frac': 0.04434944452109829, 'bb_std_mult': 1.7365202502622075, 'rsi_os': 27, 'rsi_ob': 60, 'vol_spike': 0.28236617669891784, 'adx_thresh': 24.492426293583577, 'atr_min_pct': 0.0026886088585410697, 'atr_max_pct': 0.02240891676582199, 'tp_mult': 2.136859099390166, 'tsl_mult': 0.4334093174638314, 'strategy': 'mean_reversion', 'time_stop': 121, 'use_sma': False, 'use_atr': False, 'use_adx': False, 'use_ema': False, 'use_spike': False, 'rsi_required': False, 'edge_k': 0.5844034092799235, 'edge_cap': 0.758682028017013}.
[I 2025-08-29 22:53:40,119] Trial 688 finished with values: [-1000000000.0, 1000000000.0] and parameters: {'p_sma': 14, 'p_std': 25, 'p_atr': 17, 'p_adx': 18, 'rsi_period': 23, 'ema1': 8, 'ema2': 55, 'slip_atr_k': 0.009124910743955213, 'slip_spread_k': 0.8863902692941441, 'spread_hl_frac': 0.01546414679481506, 'bb_std_mult': 0.56435351700694, 'rsi_os': 28, 'rsi_ob': 93, 'vol_spike': 0.19199535715905466, 'adx_thresh': 24.581161790658527, 'atr_min_pct': 0.01693603537416626, 'atr_max_pct': 0.11857417409479816, 'tp_mult': 1.1509047673773356, 'tsl_mult': 0.7277624791693884, 'strategy': 'mean_reversion', 'time_stop': 145, 'use_sma': False, 'use_atr': False, 'use_adx': False, 'use_ema': False, 'use_spike': False, 'rsi_required': False, 'edge_k': 0.493402997144703, 'edge_cap': 0.8580138805676358}.
[I 2025-08-29 22:54:07,595] Trial 690 finished with values: [-1000000000.0, 1000000000.0] and parameters: {'p_sma': 6, 'p_std': 59, 'p_atr': 24, 'p_adx': 16, 'rsi_period': 24, 'ema1': 24, 'ema2': 48, 'slip_atr_k': 0.10633116701988733, 'slip_spread_k': 0.8571436231255383, 'spread_hl_frac': 0.016577061116215486, 'bb_std_mult': 1.3658743649281078, 'rsi_os': 26, 'rsi_ob': 62, 'vol_spike': 0.16999940832901975, 'adx_thresh': 24.569237676150912, 'atr_min_pct': 0.003098441392051514, 'atr_max_pct': 0.12346023931168426, 'tp_mult': 2.657460529409809, 'tsl_mult': 0.7706542216291394, 'strategy': 'breakout', 'time_stop': 147, 'use_sma': False, 'use_atr': False, 'use_adx': False, 'use_ema': False, 'use_spike': False, 'rsi_required': False, 'edge_k': 0.2685634874434284, 'edge_cap': 0.8567633476984718}.
[I 2025-08-29 22:54:07,878] Trial 689 finished with values: [-0.006241026446852094, 0.0062165576182709095] and parameters: {'p_sma': 9, 'p_std': 25, 'p_atr': 17, 'p_adx': 27, 'rsi_period': 24, 'ema1': 10, 'ema2': 55, 'slip_atr_k': 0.009792486823061088, 'slip_spread_k': 0.8788796158155827, 'spread_hl_frac': 0.032344613131215214, 'bb_std_mult': 2.0855155104757372, 'rsi_os': 25, 'rsi_ob': 61, 'vol_spike': 0.16893941876502838, 'adx_thresh': 14.71054160069233, 'atr_min_pct': 0.0018404981811299087, 'atr_max_pct': 0.11500548809967376, 'tp_mult': 1.6949082646977909, 'tsl_mult': 0.7697829680744885, 'strategy': 'breakout', 'time_stop': 86, 'use_sma': False, 'use_atr': False, 'use_adx': False, 'use_ema': False, 'use_spike': False, 'rsi_required': False, 'edge_k': 0.489450462545329, 'edge_cap': 0.8493625396468811}.
[I 2025-08-29 22:54:07,970] Trial 692 finished with values: [-1000000000.0, 1000000000.0] and parameters: {'p_sma': 17, 'p_std': 55, 'p_atr': 19, 'p_adx': 12, 'rsi_period': 60, 'ema1': 29, 'ema2': 48, 'slip_atr_k': 0.06427635091721545, 'slip_spread_k': 0.37795499415047185, 'spread_hl_frac': 0.017014155836347505, 'bb_std_mult': 1.390123032291823, 'rsi_os': 25, 'rsi_ob': 62, 'vol_spike': 0.16954453719187582, 'adx_thresh': 26.211575804774622, 'atr_min_pct': 0.02303406560842524, 'atr_max_pct': 0.09102903358737907, 'tp_mult': 1.2098490007015164, 'tsl_mult': 0.15580253387879667, 'strategy': 'breakout', 'time_stop': 94, 'use_sma': False, 'use_atr': False, 'use_adx': False, 'use_ema': False, 'use_spike': False, 'rsi_required': False, 'edge_k': 0.7515817832027226, 'edge_cap': 0.7052757242144102}.
[I 2025-08-29 22:54:08,142] Trial 691 finished with values: [-0.003757550613723515, 0.0037363428363408483] and parameters: {'p_sma': 6, 'p_std': 18, 'p_atr': 23, 'p_adx': 27, 'rsi_period': 71, 'ema1': 20, 'ema2': 55, 'slip_atr_k': 0.06461490976797091, 'slip_spread_k': 0.8818280857392721, 'spread_hl_frac': 0.01689239903109668, 'bb_std_mult': 1.02279499782967, 'rsi_os': 25, 'rsi_ob': 71, 'vol_spike': 0.17118750490073167, 'adx_thresh': 14.763963136389377, 'atr_min_pct': 0.0014560182308405556, 'atr_max_pct': 0.04315305385390494, 'tp_mult': 1.201903162204757, 'tsl_mult': 0.7727078239689609, 'strategy': 'breakout', 'time_stop': 92, 'use_sma': False, 'use_atr': False, 'use_adx': False, 'use_ema': False, 'use_spike': False, 'rsi_required': False, 'edge_k': 1.6701666887140911, 'edge_cap': 0.7096681497310257}.
[I 2025-08-29 22:54:34,843] Trial 694 finished with values: [-1000000000.0, 1000000000.0] and parameters: {'p_sma': 26, 'p_std': 55, 'p_atr': 15, 'p_adx': 17, 'rsi_period': 18, 'ema1': 25, 'ema2': 53, 'slip_atr_k': 0.08365566049415282, 'slip_spread_k': 0.3787641500092738, 'spread_hl_frac': 0.02518879040918266, 'bb_std_mult': 0.8352163087867128, 'rsi_os': 5, 'rsi_ob': 63, 'vol_spike': 0.18048257751468666, 'adx_thresh': 26.301955449730098, 'atr_min_pct': 0.010461616698123602, 'atr_max_pct': 0.016704250758824812, 'tp_mult': 2.60505529045472, 'tsl_mult': 0.718505492608982, 'strategy': 'breakout', 'time_stop': 190, 'use_sma': False, 'use_atr': False, 'use_adx': False, 'use_ema': False, 'use_spike': False, 'rsi_required': False, 'edge_k': 1.6274354289915227, 'edge_cap': 0.7072817564340091}.
[I 2025-08-29 22:54:35,025] Trial 696 finished with values: [-1000000000.0, 1000000000.0] and parameters: {'p_sma': 8, 'p_std': 40, 'p_atr': 13, 'p_adx': 10, 'rsi_period': 18, 'ema1': 25, 'ema2': 53, 'slip_atr_k': 0.014414292214748372, 'slip_spread_k': 0.44189171801572646, 'spread_hl_frac': 0.003150494250421694, 'bb_std_mult': 2.0472858946322896, 'rsi_os': 23, 'rsi_ob': 59, 'vol_spike': 0.18095887300591362, 'adx_thresh': 27.631589973635567, 'atr_min_pct': 0.010750494888869196, 'atr_max_pct': 0.0928521405364781, 'tp_mult': 1.0946632239082843, 'tsl_mult': 0.6642883321570585, 'strategy': 'breakout', 'time_stop': 114, 'use_sma': False, 'use_atr': False, 'use_adx': False, 'use_ema': False, 'use_spike': False, 'rsi_required': False, 'edge_k': 0.09132008259743063, 'edge_cap': 0.35909373180997617}.
[I 2025-08-29 22:54:35,174] Trial 695 finished with values: [-0.010821668265413975, 0.010811110616988969] and parameters: {'p_sma': 8, 'p_std': 27, 'p_atr': 23, 'p_adx': 25, 'rsi_period': 18, 'ema1': 25, 'ema2': 53, 'slip_atr_k': 0.01820478150962627, 'slip_spread_k': 0.43776729039145074, 'spread_hl_frac': 0.0187361901228283, 'bb_std_mult': 3.3809707012058525, 'rsi_os': 30, 'rsi_ob': 59, 'vol_spike': 0.18145394751095867, 'adx_thresh': 9.692605112431282, 'atr_min_pct': 0.0017606370448432964, 'atr_max_pct': 0.07640370229910318, 'tp_mult': 1.2813049375630619, 'tsl_mult': 0.3894161666034254, 'strategy': 'breakout', 'time_stop': 232, 'use_sma': False, 'use_atr': False, 'use_adx': False, 'use_ema': False, 'use_spike': False, 'rsi_required': False, 'edge_k': 0.6632054757639887, 'edge_cap': 0.4281483785964111}.
[I 2025-08-29 22:54:35,345] Trial 693 finished with values: [-0.008754065833716629, 0.008817051367865904] and parameters: {'p_sma': 9, 'p_std': 55, 'p_atr': 15, 'p_adx': 25, 'rsi_period': 18, 'ema1': 25, 'ema2': 22, 'slip_atr_k': 0.012210707494265862, 'slip_spread_k': 0.36893322596764344, 'spread_hl_frac': 0.018461905518887732, 'bb_std_mult': 0.8513077432786571, 'rsi_os': 25, 'rsi_ob': 80, 'vol_spike': 0.18058096486098724, 'adx_thresh': 6.8418942009707475, 'atr_min_pct': 0.001309207072077549, 'atr_max_pct': 0.08273390651306622, 'tp_mult': 1.1841225530026933, 'tsl_mult': 0.838975376905899, 'strategy': 'breakout', 'time_stop': 180, 'use_sma': False, 'use_atr': False, 'use_adx': False, 'use_ema': False, 'use_spike': False, 'rsi_required': False, 'edge_k': 1.6397089635149737, 'edge_cap': 0.7200735717634074}.
[I 2025-08-29 22:55:02,873] Trial 699 finished with values: [-0.006958012981965966, 0.0070006944779984134] and parameters: {'p_sma': 7, 'p_std': 24, 'p_atr': 24, 'p_adx': 16, 'rsi_period': 9, 'ema1': 23, 'ema2': 22, 'slip_atr_k': 0.001424686204362785, 'slip_spread_k': 0.851644106266195, 'spread_hl_frac': 0.018183963268386817, 'bb_std_mult': 1.9456425276985383, 'rsi_os': 24, 'rsi_ob': 61, 'vol_spike': 0.20593961367893152, 'adx_thresh': 25.06354768046693, 'atr_min_pct': 0.0022786987863479516, 'atr_max_pct': 0.049317468502003206, 'tp_mult': 2.4911507462399793, 'tsl_mult': 0.696203432563957, 'strategy': 'breakout', 'time_stop': 180, 'use_sma': False, 'use_atr': False, 'use_adx': False, 'use_ema': False, 'use_spike': False, 'rsi_required': False, 'edge_k': 0.8356628802095033, 'edge_cap': 0.7884180783430231}.
[I 2025-08-29 22:55:03,041] Trial 698 finished with values: [-0.02636374494329463, 0.02639325202715413] and parameters: {'p_sma': 44, 'p_std': 17, 'p_atr': 23, 'p_adx': 16, 'rsi_period': 9, 'ema1': 12, 'ema2': 43, 'slip_atr_k': 0.020720694278932292, 'slip_spread_k': 0.8465476027074113, 'spread_hl_frac': 0.018574127149337163, 'bb_std_mult': 1.942493728897128, 'rsi_os': 24, 'rsi_ob': 59, 'vol_spike': 0.03209429240664584, 'adx_thresh': 7.489006464512016, 'atr_min_pct': 0.0024144133601786237, 'atr_max_pct': 0.050219967721743294, 'tp_mult': 1.2795624149940554, 'tsl_mult': 0.8397075089110364, 'strategy': 'breakout', 'time_stop': 100, 'use_sma': False, 'use_atr': False, 'use_adx': False, 'use_ema': False, 'use_spike': False, 'rsi_required': False, 'edge_k': 0.4515011925726623, 'edge_cap': 0.5947263609202609}.
[I 2025-08-29 22:55:03,152] Trial 697 finished with values: [-1000000000.0, 1000000000.0] and parameters: {'p_sma': 42, 'p_std': 24, 'p_atr': 13, 'p_adx': 14, 'rsi_period': 21, 'ema1': 24, 'ema2': 59, 'slip_atr_k': 0.013607706466616503, 'slip_spread_k': 0.8514923015173037, 'spread_hl_frac': 0.01841898027235322, 'bb_std_mult': 1.9342022944132344, 'rsi_os': 38, 'rsi_ob': 60, 'vol_spike': 0.1801806559388544, 'adx_thresh': 27.572463518686835, 'atr_min_pct': 0.0275202292277772, 'atr_max_pct': 0.09367263948394075, 'tp_mult': 1.2734483303343989, 'tsl_mult': 0.19402209923799263, 'strategy': 'breakout', 'time_stop': 112, 'use_sma': False, 'use_atr': False, 'use_adx': False, 'use_ema': False, 'use_spike': False, 'rsi_required': False, 'edge_k': 0.6445539717384623, 'edge_cap': 0.7869858436825161}.
[I 2025-08-29 22:55:03,280] Trial 700 finished with values: [-1000000000.0, 1000000000.0] and parameters: {'p_sma': 6, 'p_std': 46, 'p_atr': 24, 'p_adx': 16, 'rsi_period': 21, 'ema1': 18, 'ema2': 58, 'slip_atr_k': 0.18819583698981135, 'slip_spread_k': 0.8456369729391621, 'spread_hl_frac': 0.017806340446447577, 'bb_std_mult': 1.9420092110989091, 'rsi_os': 34, 'rsi_ob': 49, 'vol_spike': 0.23966777800442784, 'adx_thresh': 23.36080354596204, 'atr_min_pct': 0.02736263954744618, 'atr_max_pct': 0.07091076161894475, 'tp_mult': 2.7207157483152073, 'tsl_mult': 0.31559507535799575, 'strategy': 'breakout', 'time_stop': 100, 'use_sma': False, 'use_atr': False, 'use_adx': False, 'use_ema': False, 'use_spike': False, 'rsi_required': False, 'edge_k': 0.40816311843446973, 'edge_cap': 0.39701518376550793}.
[I 2025-08-29 22:55:30,203] Trial 701 finished with values: [-0.027149224230389346, 0.02713023148738141] and parameters: {'p_sma': 11, 'p_std': 6, 'p_atr': 23, 'p_adx': 14, 'rsi_period': 21, 'ema1': 24, 'ema2': 58, 'slip_atr_k': 0.024477474518943013, 'slip_spread_k': 0.295662987322877, 'spread_hl_frac': 0.014658512257764275, 'bb_std_mult': 2.4857061791786474, 'rsi_os': 40, 'rsi_ob': 83, 'vol_spike': 0.16124189476050188, 'adx_thresh': 5.578434784827257, 'atr_min_pct': 0.0028061229160073623, 'atr_max_pct': 0.03507171416207015, 'tp_mult': 2.7183737596869184, 'tsl_mult': 0.7255773466368259, 'strategy': 'breakout', 'time_stop': 112, 'use_sma': False, 'use_atr': False, 'use_adx': False, 'use_ema': False, 'use_spike': False, 'rsi_required': False, 'edge_k': 0.3692004568339967, 'edge_cap': 0.6790305322234158}.
