[I 2025-08-29 23:31:10,967] Trial 1027 finished with values: [-1000000000.0, 1000000000.0] and parameters: {'p_sma': 43, 'p_std': 56, 'p_atr': 23, 'p_adx': 7, 'rsi_period': 54, 'ema1': 23, 'ema2': 54, 'slip_atr_k': 0.007965163535657726, 'slip_spread_k': 0.28029207982240334, 'spread_hl_frac': 0.041998606849976916, 'bb_std_mult': 2.058221469620465, 'rsi_os': 26, 'rsi_ob': 57, 'vol_spike': 0.2807554980798401, 'adx_thresh': 26.2257384470503, 'atr_min_pct': 0.005679974827484613, 'atr_max_pct': 0.13904901903243083, 'tp_mult': 2.075816386776692, 'tsl_mult': 0.7712165193325422, 'strategy': 'breakout', 'time_stop': 282, 'use_sma': False, 'use_atr': False, 'use_adx': False, 'use_ema': False, 'use_spike': False, 'rsi_required': False, 'edge_k': 0.18282465961247996, 'edge_cap': 0.09217495574566986}.
[I 2025-08-29 23:31:11,501] Trial 1026 finished with values: [-0.0061414501715267855, 0.006109271921099141] and parameters: {'p_sma': 22, 'p_std': 23, 'p_atr': 17, 'p_adx': 17, 'rsi_period': 37, 'ema1': 23, 'ema2': 53, 'slip_atr_k': 0.2194005285160474, 'slip_spread_k': 0.7736182104278542, 'spread_hl_frac': 0.023862953806896563, 'bb_std_mult': 2.166534321089601, 'rsi_os': 20, 'rsi_ob': 89, 'vol_spike': 0.28155724891593614, 'adx_thresh': 26.24556950778143, 'atr_min_pct': 0.0026599090506628413, 'atr_max_pct': 0.09483621692560244, 'tp_mult': 1.3509063295318158, 'tsl_mult': 0.7713779699852958, 'strategy': 'breakout', 'time_stop': 199, 'use_sma': False, 'use_atr': False, 'use_adx': False, 'use_ema': False, 'use_spike': False, 'rsi_required': False, 'edge_k': 0.4929948787500735, 'edge_cap': 0.7801363244241883}.
[I 2025-08-29 23:31:11,628] Trial 1028 finished with values: [-0.006199621746464601, 0.006340891526815476] and parameters: {'p_sma': 7, 'p_std': 27, 'p_atr': 28, 'p_adx': 27, 'rsi_period': 14, 'ema1': 23, 'ema2': 54, 'slip_atr_k': 0.18866806331108446, 'slip_spread_k': 0.2809444964849306, 'spread_hl_frac': 0.028544963450434443, 'bb_std_mult': 2.064327169808125, 'rsi_os': 35, 'rsi_ob': 85, 'vol_spike': 0.276989284744036, 'adx_thresh': 26.358742903924103, 'atr_min_pct': 0.0026656603321290003, 'atr_max_pct': 0.09854670052337063, 'tp_mult': 1.0688428960842882, 'tsl_mult': 0.7705363240181776, 'strategy': 'breakout', 'time_stop': 87, 'use_sma': False, 'use_atr': False, 'use_adx': False, 'use_ema': False, 'use_spike': False, 'rsi_required': False, 'edge_k': 0.125645179177574, 'edge_cap': 0.5063356799872929}.
[I 2025-08-29 23:31:11,703] Trial 1029 finished with values: [-0.014345102236042462, 0.01440526455734223] and parameters: {'p_sma': 23, 'p_std': 34, 'p_atr': 28, 'p_adx': 27, 'rsi_period': 31, 'ema1': 23, 'ema2': 52, 'slip_atr_k': 0.0058970451961060655, 'slip_spread_k': 0.5849626838583232, 'spread_hl_frac': 0.049969424798088524, 'bb_std_mult': 2.1712211347702297, 'rsi_os': 40, 'rsi_ob': 90, 'vol_spike': 0.19050376541513542, 'adx_thresh': 20.706997734103737, 'atr_min_pct': 0.00251201547586201, 'atr_max_pct': 0.04053902957942648, 'tp_mult': 2.609190481455878, 'tsl_mult': 0.658910990195661, 'strategy': 'breakout', 'time_stop': 87, 'use_sma': False, 'use_atr': False, 'use_adx': False, 'use_ema': False, 'use_spike': False, 'rsi_required': False, 'edge_k': 1.3584787214191452, 'edge_cap': 0.569012554913092}.
[I 2025-08-29 23:31:39,277] Trial 1032 finished with values: [-1000000000.0, 1000000000.0] and parameters: {'p_sma': 6, 'p_std': 24, 'p_atr': 23, 'p_adx': 18, 'rsi_period': 24, 'ema1': 25, 'ema2': 19, 'slip_atr_k': 0.025063860694368466, 'slip_spread_k': 0.47698212929428396, 'spread_hl_frac': 0.019092512645939846, 'bb_std_mult': 0.7933781739820414, 'rsi_os': 8, 'rsi_ob': 59, 'vol_spike': 0.17937175901940292, 'adx_thresh': 24.964666059778757, 'atr_min_pct': 0.020537332721109882, 'atr_max_pct': 0.02451797914028133, 'tp_mult': 2.3240330225050934, 'tsl_mult': 0.5666790734276166, 'strategy': 'breakout', 'time_stop': 97, 'use_sma': False, 'use_atr': False, 'use_adx': False, 'use_ema': False, 'use_spike': False, 'rsi_required': False, 'edge_k': 0.581334091876077, 'edge_cap': 0.8627233937162946}.
[I 2025-08-29 23:31:39,621] Trial 1030 finished with values: [-1000000000.0, 1000000000.0] and parameters: {'p_sma': 6, 'p_std': 27, 'p_atr': 14, 'p_adx': 27, 'rsi_period': 18, 'ema1': 23, 'ema2': 52, 'slip_atr_k': 0.032437934346154884, 'slip_spread_k': 0.8313295443280656, 'spread_hl_frac': 0.01891328648757332, 'bb_std_mult': 0.79108510531648, 'rsi_os': 16, 'rsi_ob': 53, 'vol_spike': 0.19099216869128816, 'adx_thresh': 24.264651460360877, 'atr_min_pct': 0.00420119270571973, 'atr_max_pct': 0.0977365788368833, 'tp_mult': 1.0698315226476056, 'tsl_mult': 0.6872206232469223, 'strategy': 'breakout', 'time_stop': 160, 'use_sma': False, 'use_atr': False, 'use_adx': False, 'use_ema': False, 'use_spike': False, 'rsi_required': False, 'edge_k': 0.3954492616453239, 'edge_cap': 0.5148248240903133}.
[I 2025-08-29 23:31:39,698] Trial 1033 finished with values: [-1000000000.0, 1000000000.0] and parameters: {'p_sma': 15, 'p_std': 25, 'p_atr': 23, 'p_adx': 18, 'rsi_period': 58, 'ema1': 30, 'ema2': 57, 'slip_atr_k': 0.03190213440700697, 'slip_spread_k': 0.8301240011373618, 'spread_hl_frac': 0.019077193067971333, 'bb_std_mult': 2.8202579354135997, 'rsi_os': 25, 'rsi_ob': 59, 'vol_spike': 0.17934861524511445, 'adx_thresh': 27.772287072252098, 'atr_min_pct': 0.004235234767695101, 'atr_max_pct': 0.023518601023774545, 'tp_mult': 2.3232453352753013, 'tsl_mult': 0.6962784119633287, 'strategy': 'breakout', 'time_stop': 98, 'use_sma': False, 'use_atr': False, 'use_adx': False, 'use_ema': False, 'use_spike': False, 'rsi_required': False, 'edge_k': 0.5784329284520625, 'edge_cap': 0.5342584188815176}.
[I 2025-08-29 23:31:39,820] Trial 1031 finished with values: [-1000000000.0, 1000000000.0] and parameters: {'p_sma': 7, 'p_std': 27, 'p_atr': 27, 'p_adx': 28, 'rsi_period': 34, 'ema1': 25, 'ema2': 49, 'slip_atr_k': 0.0321064340275191, 'slip_spread_k': 0.5872032760592364, 'spread_hl_frac': 0.01919147083732815, 'bb_std_mult': 1.0526975172287418, 'rsi_os': 32, 'rsi_ob': 85, 'vol_spike': 0.1883870966125042, 'adx_thresh': 19.277979232194618, 'atr_min_pct': 0.003922977645985163, 'atr_max_pct': 0.0392100866137416, 'tp_mult': 1.0743914506863803, 'tsl_mult': 0.5613773782207259, 'strategy': 'breakout', 'time_stop': 90, 'use_sma': False, 'use_atr': False, 'use_adx': False, 'use_ema': False, 'use_spike': False, 'rsi_required': False, 'edge_k': 0.5777336895286925, 'edge_cap': 0.5355234531658776}.
[I 2025-08-29 23:31:40,139] Trial 1035 finished with values: [-1000000000.0, 1000000000.0] and parameters: {'p_sma': 8, 'p_std': 19, 'p_atr': 15, 'p_adx': 15, 'rsi_period': 34, 'ema1': 30, 'ema2': 55, 'slip_atr_k': 0.01414151551248297, 'slip_spread_k': 0.8731779775324008, 'spread_hl_frac': 0.014963813800879917, 'bb_std_mult': 2.8200635613143934, 'rsi_os': 32, 'rsi_ob': 45, 'vol_spike': 0.1670202057263711, 'adx_thresh': 27.73161696568852, 'atr_min_pct': 0.02940350847894914, 'atr_max_pct': 0.09176347102984814, 'tp_mult': 1.196357252785856, 'tsl_mult': 0.7181297385695871, 'strategy': 'mean_reversion', 'time_stop': 139, 'use_sma': False, 'use_atr': False, 'use_adx': False, 'use_ema': False, 'use_spike': False, 'rsi_required': False, 'edge_k': 0.5421024502524153, 'edge_cap': 0.8233506640417599}.
[I 2025-08-29 23:31:40,152] Trial 1036 finished with values: [-1000000000.0, 1000000000.0] and parameters: {'p_sma': 8, 'p_std': 36, 'p_atr': 15, 'p_adx': 15, 'rsi_period': 19, 'ema1': 11, 'ema2': 23, 'slip_atr_k': 0.12016913741626786, 'slip_spread_k': 0.003004032927508782, 'spread_hl_frac': 0.01689189137534333, 'bb_std_mult': 1.9013728081908108, 'rsi_os': 31, 'rsi_ob': 48, 'vol_spike': 0.16715091586764416, 'adx_thresh': 19.338599757463204, 'atr_min_pct': 0.017228940542420496, 'atr_max_pct': 0.0915918822555756, 'tp_mult': 2.9333259063801846, 'tsl_mult': 0.7185491130958785, 'strategy': 'mean_reversion', 'time_stop': 104, 'use_sma': False, 'use_atr': False, 'use_adx': False, 'use_ema': False, 'use_spike': False, 'rsi_required': False, 'edge_k': 0.5334488628184202, 'edge_cap': 0.9783293245503892}.
[I 2025-08-29 23:31:40,601] Trial 1038 finished with values: [-1000000000.0, 1000000000.0] and parameters: {'p_sma': 52, 'p_std': 16, 'p_atr': 24, 'p_adx': 16, 'rsi_period': 15, 'ema1': 14, 'ema2': 42, 'slip_atr_k': 0.02075902202457518, 'slip_spread_k': 0.8199258741486992, 'spread_hl_frac': 0.016379773778501677, 'bb_std_mult': 1.8781314690644482, 'rsi_os': 26, 'rsi_ob': 48, 'vol_spike': 0.23662511674132986, 'adx_thresh': 12.990139074422673, 'atr_min_pct': 0.017408155080042485, 'atr_max_pct': 0.08690783369962238, 'tp_mult': 1.8316331238669905, 'tsl_mult': 0.8165490738803147, 'strategy': 'mean_reversion', 'time_stop': 107, 'use_sma': False, 'use_atr': False, 'use_adx': False, 'use_ema': False, 'use_spike': False, 'rsi_required': False, 'edge_k': 1.4517390270642143, 'edge_cap': 0.6314238784211272}.
[I 2025-08-29 23:32:04,938] Trial 1034 finished with values: [-1000000000.0, 1000000000.0] and parameters: {'p_sma': 5, 'p_std': 46, 'p_atr': 24, 'p_adx': 16, 'rsi_period': 19, 'ema1': 24, 'ema2': 57, 'slip_atr_k': 0.08991213454895758, 'slip_spread_k': 0.8277971713233292, 'spread_hl_frac': 0.018030457950133107, 'bb_std_mult': 1.9433447747980497, 'rsi_os': 22, 'rsi_ob': 59, 'vol_spike': 0.16679977707310328, 'adx_thresh': 13.585152491751208, 'atr_min_pct': 0.004107776042457911, 'atr_max_pct': 0.04885454557715761, 'tp_mult': 1.209402961790912, 'tsl_mult': 0.6886112709697958, 'strategy': 'mean_reversion', 'time_stop': 295, 'use_sma': False, 'use_atr': False, 'use_adx': False, 'use_ema': False, 'use_spike': False, 'rsi_required': False, 'edge_k': 0.5291473258359907, 'edge_cap': 0.18213754540132693}.
[I 2025-08-29 23:32:05,914] Trial 1037 finished with values: [-1000000000.0, 1000000000.0] and parameters: {'p_sma': 5, 'p_std': 46, 'p_atr': 15, 'p_adx': 15, 'rsi_period': 16, 'ema1': 11, 'ema2': 10, 'slip_atr_k': 0.012617747657472339, 'slip_spread_k': 0.8641776588489787, 'spread_hl_frac': 0.014921828449737785, 'bb_std_mult': 1.8508592609168912, 'rsi_os': 22, 'rsi_ob': 87, 'vol_spike': 0.16623718821217856, 'adx_thresh': 31.194251375641358, 'atr_min_pct': 0.012527137889518558, 'atr_max_pct': 0.08795637996760983, 'tp_mult': 1.199232826879115, 'tsl_mult': 0.7344569951326447, 'strategy': 'mean_reversion', 'time_stop': 107, 'use_sma': False, 'use_atr': False, 'use_adx': False, 'use_ema': False, 'use_spike': False, 'rsi_required': False, 'edge_k': 0.5377935070205864, 'edge_cap': 0.37041400830521504}.
[I 2025-08-29 23:32:07,890] Trial 1039 finished with values: [-1000000000.0, 1000000000.0] and parameters: {'p_sma': 5, 'p_std': 45, 'p_atr': 24, 'p_adx': 16, 'rsi_period': 15, 'ema1': 14, 'ema2': 59, 'slip_atr_k': 0.22617867994047564, 'slip_spread_k': 0.8540869440586749, 'spread_hl_frac': 0.010849088866550541, 'bb_std_mult': 3.5479289985368023, 'rsi_os': 26, 'rsi_ob': 61, 'vol_spike': 0.23678772557023164, 'adx_thresh': 34.2502712180585, 'atr_min_pct': 0.009185604888710747, 'atr_max_pct': 0.04868188052473323, 'tp_mult': 1.1109414119321466, 'tsl_mult': 0.38789154630605355, 'strategy': 'breakout', 'time_stop': 109, 'use_sma': False, 'use_atr': False, 'use_adx': False, 'use_ema': False, 'use_spike': False, 'rsi_required': False, 'edge_k': 1.1997897181846455, 'edge_cap': 0.18495816483293476}.
[I 2025-08-29 23:32:08,269] Trial 1040 finished with values: [-1000000000.0, 1000000000.0] and parameters: {'p_sma': 11, 'p_std': 24, 'p_atr': 22, 'p_adx': 22, 'rsi_period': 65, 'ema1': 24, 'ema2': 28, 'slip_atr_k': 0.012249878248238893, 'slip_spread_k': 0.8620429353287501, 'spread_hl_frac': 0.01845675208813493, 'bb_std_mult': 0.931291329268032, 'rsi_os': 28, 'rsi_ob': 87, 'vol_spike': 0.2007135793945733, 'adx_thresh': 31.205956968064495, 'atr_min_pct': 0.0012979413208790904, 'atr_max_pct': 0.04850320817141324, 'tp_mult': 1.109625688685692, 'tsl_mult': 0.39338071501352245, 'strategy': 'breakout', 'time_stop': 115, 'use_sma': False, 'use_atr': False, 'use_adx': False, 'use_ema': False, 'use_spike': False, 'rsi_required': False, 'edge_k': 0.4240615605077839, 'edge_cap': 0.803040517405026}.
[I 2025-08-29 23:32:35,751] Trial 1041 finished with values: [-0.009877920089669034, 0.009853831426436224] and parameters: {'p_sma': 60, 'p_std': 24, 'p_atr': 22, 'p_adx': 23, 'rsi_period': 16, 'ema1': 24, 'ema2': 55, 'slip_atr_k': 0.009623740659514306, 'slip_spread_k': 0.8615783257067413, 'spread_hl_frac': 0.011325777008123546, 'bb_std_mult': 2.114179653139835, 'rsi_os': 13, 'rsi_ob': 60, 'vol_spike': 0.17523056118210067, 'adx_thresh': 10.96178944150481, 'atr_min_pct': 0.0015551699227489418, 'atr_max_pct': 0.09949934978340823, 'tp_mult': 1.5695768983020626, 'tsl_mult': 0.38160357084579516, 'strategy': 'breakout', 'time_stop': 207, 'use_sma': False, 'use_atr': False, 'use_adx': False, 'use_ema': False, 'use_spike': False, 'rsi_required': False, 'edge_k': 0.618851415508653, 'edge_cap': 0.46789320413180735}.
[I 2025-08-29 23:32:36,083] Trial 1044 finished with values: [-1000000000.0, 1000000000.0] and parameters: {'p_sma': 10, 'p_std': 22, 'p_atr': 23, 'p_adx': 28, 'rsi_period': 50, 'ema1': 25, 'ema2': 54, 'slip_atr_k': 0.021166725540072987, 'slip_spread_k': 0.7918285663209027, 'spread_hl_frac': 0.020038482753006508, 'bb_std_mult': 2.268944661072921, 'rsi_os': 52, 'rsi_ob': 72, 'vol_spike': 0.17398392746475835, 'adx_thresh': 25.305889826826622, 'atr_min_pct': 0.015256942748704067, 'atr_max_pct': 0.057479489576720416, 'tp_mult': 1.167453087278107, 'tsl_mult': 0.3295589114235862, 'strategy': 'breakout', 'time_stop': 123, 'use_sma': False, 'use_atr': False, 'use_adx': False, 'use_ema': False, 'use_spike': False, 'rsi_required': False, 'edge_k': 0.6303179782286608, 'edge_cap': 0.7731645717750307}.
[I 2025-08-29 23:32:36,092] Trial 1042 finished with values: [-1000000000.0, 1000000000.0] and parameters: {'p_sma': 7, 'p_std': 8, 'p_atr': 22, 'p_adx': 17, 'rsi_period': 24, 'ema1': 25, 'ema2': 55, 'slip_atr_k': 0.24132992531771524, 'slip_spread_k': 0.78658290862942, 'spread_hl_frac': 0.01800996628476065, 'bb_std_mult': 2.103427247427393, 'rsi_os': 28, 'rsi_ob': 71, 'vol_spike': 0.1822721584131604, 'adx_thresh': 25.67502457336982, 'atr_min_pct': 0.01538743493998915, 'atr_max_pct': 0.09394013119921153, 'tp_mult': 1.098789917848294, 'tsl_mult': 0.47353928652538646, 'strategy': 'breakout', 'time_stop': 116, 'use_sma': False, 'use_atr': False, 'use_adx': False, 'use_ema': False, 'use_spike': False, 'rsi_required': False, 'edge_k': 0.435749435253354, 'edge_cap': 0.8059887525358225}.
[I 2025-08-29 23:32:36,222] Trial 1043 finished with values: [-1000000000.0, 1000000000.0] and parameters: {'p_sma': 10, 'p_std': 25, 'p_atr': 22, 'p_adx': 26, 'rsi_period': 24, 'ema1': 9, 'ema2': 55, 'slip_atr_k': 0.12966450599111004, 'slip_spread_k': 0.10945075034198082, 'spread_hl_frac': 0.01814577252205218, 'bb_std_mult': 2.257007804077249, 'rsi_os': 28, 'rsi_ob': 61, 'vol_spike': 0.20019838159051961, 'adx_thresh': 17.911016315741524, 'atr_min_pct': 0.015169680427780214, 'atr_max_pct': 0.09974881700620489, 'tp_mult': 1.5851872184680882, 'tsl_mult': 0.7460965436464144, 'strategy': 'breakout', 'time_stop': 119, 'use_sma': False, 'use_atr': False, 'use_adx': False, 'use_ema': False, 'use_spike': False, 'rsi_required': False, 'edge_k': 0.6348725294043969, 'edge_cap': 0.8025507484271738}.
[I 2025-08-29 23:32:36,546] Trial 1046 finished with values: [-1000000000.0, 1000000000.0] and parameters: {'p_sma': 8, 'p_std': 60, 'p_atr': 23, 'p_adx': 16, 'rsi_period': 20, 'ema1': 7, 'ema2': 53, 'slip_atr_k': 0.02516608733017235, 'slip_spread_k': 0.16930342791945935, 'spread_hl_frac': 0.039636278010229384, 'bb_std_mult': 3.210634350668549, 'rsi_os': 25, 'rsi_ob': 61, 'vol_spike': 0.11515130060799597, 'adx_thresh': 24.02346369763195, 'atr_min_pct': 0.025510878360430107, 'atr_max_pct': 0.012759522460607256, 'tp_mult': 2.113659504790134, 'tsl_mult': 0.7509079515753595, 'strategy': 'breakout', 'time_stop': 38, 'use_sma': False, 'use_atr': False, 'use_adx': False, 'use_ema': False, 'use_spike': False, 'rsi_required': False, 'edge_k': 0.46794091691098744, 'edge_cap': 0.7823778389095069}.
[I 2025-08-29 23:33:02,428] Trial 1048 finished with values: [-1000000000.0, 1000000000.0] and parameters: {'p_sma': 45, 'p_std': 26, 'p_atr': 23, 'p_adx': 16, 'rsi_period': 20, 'ema1': 7, 'ema2': 53, 'slip_atr_k': 0.02602487109708733, 'slip_spread_k': 0.07597580664826104, 'spread_hl_frac': 0.015791473654872528, 'bb_std_mult': 2.9414386325709136, 'rsi_os': 6, 'rsi_ob': 64, 'vol_spike': 0.11641886701627972, 'adx_thresh': 24.060308276591112, 'atr_min_pct': 0.0029912351944165003, 'atr_max_pct': 0.012497043667736893, 'tp_mult': 2.4430498046504807, 'tsl_mult': 0.07064342086575853, 'strategy': 'breakout', 'time_stop': 99, 'use_sma': False, 'use_atr': False, 'use_adx': False, 'use_ema': False, 'use_spike': False, 'rsi_required': False, 'edge_k': 0.47533123991399695, 'edge_cap': 0.7215188766747667}.
[I 2025-08-29 23:33:03,022] Trial 1045 finished with values: [-0.0020700135856838164, 0.0024089496830116282] and parameters: {'p_sma': 10, 'p_std': 25, 'p_atr': 9, 'p_adx': 26, 'rsi_period': 24, 'ema1': 25, 'ema2': 54, 'slip_atr_k': 0.01962805325138094, 'slip_spread_k': 0.2448075602907348, 'spread_hl_frac': 0.0369985645653695, 'bb_std_mult': 2.26271057723152, 'rsi_os': 25, 'rsi_ob': 72, 'vol_spike': 0.1203560248054343, 'adx_thresh': 25.30255943649484, 'atr_min_pct': 0.002996292437115626, 'atr_max_pct': 0.09406943202760118, 'tp_mult': 2.008712227253761, 'tsl_mult': 0.7434811079999866, 'strategy': 'breakout', 'time_stop': 120, 'use_sma': False, 'use_atr': False, 'use_adx': False, 'use_ema': False, 'use_spike': False, 'rsi_required': False, 'edge_k': 0.46392528102949815, 'edge_cap': 0.7740872821813526}.
[I 2025-08-29 23:33:03,374] Trial 1047 finished with values: [-1000000000.0, 1000000000.0] and parameters: {'p_sma': 42, 'p_std': 52, 'p_atr': 9, 'p_adx': 16, 'rsi_period': 20, 'ema1': 24, 'ema2': 54, 'slip_atr_k': 0.12878970834347186, 'slip_spread_k': 0.815810981179376, 'spread_hl_frac': 0.01707948684932962, 'bb_std_mult': 3.205468353172138, 'rsi_os': 6, 'rsi_ob': 61, 'vol_spike': 0.22047865497275876, 'adx_thresh': 24.47216994552732, 'atr_min_pct': 0.0027887025185980704, 'atr_max_pct': 0.09594551799000246, 'tp_mult': 2.450231244057763, 'tsl_mult': 0.7505203657727701, 'strategy': 'breakout', 'time_stop': 37, 'use_sma': False, 'use_atr': False, 'use_adx': False, 'use_ema': False, 'use_spike': False, 'rsi_required': False, 'edge_k': 0.4663488962932549, 'edge_cap': 0.7233094128273518}.
[I 2025-08-29 23:33:04,179] Trial 1049 finished with values: [-0.008218530508199873, 0.008191786842768107] and parameters: {'p_sma': 48, 'p_std': 38, 'p_atr': 9, 'p_adx': 14, 'rsi_period': 74, 'ema1': 18, 'ema2': 44, 'slip_atr_k': 0.018070021045990377, 'slip_spread_k': 0.8114723709985029, 'spread_hl_frac': 0.0169139234336585, 'bb_std_mult': 2.9667729588494764, 'rsi_os': 11, 'rsi_ob': 58, 'vol_spike': 0.0981828332446488, 'adx_thresh': 24.84652654095215, 'atr_min_pct': 1.9048466378925304e-05, 'atr_max_pct': 0.0201839338373409, 'tp_mult': 1.1456317851451487, 'tsl_mult': 0.07157608114073721, 'strategy': 'breakout', 'time_stop': 101, 'use_sma': False, 'use_atr': False, 'use_adx': False, 'use_ema': False, 'use_spike': False, 'rsi_required': False, 'edge_k': 1.9980293693167437, 'edge_cap': 0.8490168007155854}.
[I 2025-08-29 23:33:31,662] Trial 1052 finished with values: [-0.004807499576504393, 0.005155410814479134] and parameters: {'p_sma': 13, 'p_std': 21, 'p_atr': 24, 'p_adx': 14, 'rsi_period': 17, 'ema1': 18, 'ema2': 35, 'slip_atr_k': 0.018635183850835416, 'slip_spread_k': 0.310626431406109, 'spread_hl_frac': 0.006734738413291516, 'bb_std_mult': 1.9802063436882653, 'rsi_os': 19, 'rsi_ob': 57, 'vol_spike': 0.18346810423316254, 'adx_thresh': 25.78839477663617, 'atr_min_pct': 0.0023319606069084104, 'atr_max_pct': 0.02813832094323434, 'tp_mult': 1.9975355700411541, 'tsl_mult': 0.2172424785261311, 'strategy': 'breakout', 'time_stop': 111, 'use_sma': False, 'use_atr': False, 'use_adx': False, 'use_ema': False, 'use_spike': False, 'rsi_required': False, 'edge_k': 1.2850304213362234, 'edge_cap': 0.758045108483284}.
[I 2025-08-29 23:33:31,961] Trial 1050 finished with values: [-1000000000.0, 1000000000.0] and parameters: {'p_sma': 6, 'p_std': 32, 'p_atr': 21, 'p_adx': 14, 'rsi_period': 74, 'ema1': 29, 'ema2': 56, 'slip_atr_k': 0.019667517041859848, 'slip_spread_k': 0.8140620508123256, 'spread_hl_frac': 0.006861386536848545, 'bb_std_mult': 1.9885776970468103, 'rsi_os': 41, 'rsi_ob': 50, 'vol_spike': 0.05938297671372704, 'adx_thresh': 24.8548332106829, 'atr_min_pct': 0.02190522771714294, 'atr_max_pct': 0.09617199164683293, 'tp_mult': 1.3935658694959665, 'tsl_mult': 0.5371847566375394, 'strategy': 'breakout', 'time_stop': 145, 'use_sma': False, 'use_atr': False, 'use_adx': False, 'use_ema': False, 'use_spike': False, 'rsi_required': False, 'edge_k': 0.7019344745162275, 'edge_cap': 0.8418747141101335}.
[I 2025-08-29 23:33:32,231] Trial 1051 finished with values: [-1000000000.0, 1000000000.0] and parameters: {'p_sma': 6, 'p_std': 38, 'p_atr': 19, 'p_adx': 17, 'rsi_period': 28, 'ema1': 18, 'ema2': 44, 'slip_atr_k': 0.015446181150010941, 'slip_spread_k': 0.7307062379757803, 'spread_hl_frac': 0.017024151120071034, 'bb_std_mult': 1.9951136935212672, 'rsi_os': 25, 'rsi_ob': 50, 'vol_spike': 0.18040185806479375, 'adx_thresh': 27.128205889629115, 'atr_min_pct': 0.0022752808883480047, 'atr_max_pct': 0.08918553983049043, 'tp_mult': 1.1437731166581986, 'tsl_mult': 0.6723527469894447, 'strategy': 'breakout', 'time_stop': 114, 'use_sma': False, 'use_atr': False, 'use_adx': False, 'use_ema': False, 'use_spike': False, 'rsi_required': False, 'edge_k': 0.35450086868365066, 'edge_cap': 0.8272020772270089}.
