[I 2025-08-29 22:31:52,009] Trial 486 finished with values: [-1000000000.0, 1000000000.0] and parameters: {'p_sma': 8, 'p_std': 25, 'p_atr': 22, 'p_adx': 17, 'rsi_period': 16, 'ema1': 25, 'ema2': 46, 'slip_atr_k': 0.0255370619354311, 'slip_spread_k': 0.7574172014641398, 'spread_hl_frac': 0.04323092287498537, 'bb_std_mult': 2.1133504432409085, 'rsi_os': 53, 'rsi_ob': 94, 'vol_spike': 0.18171009010293612, 'adx_thresh': 26.412626575316605, 'atr_min_pct': 0.019365674844429734, 'atr_max_pct': 0.10164820525169437, 'tp_mult': 1.7795753625847428, 'tsl_mult': 0.5156305086349393, 'strategy': 'breakout', 'time_stop': 33, 'use_sma': False, 'use_atr': False, 'use_adx': False, 'use_ema': False, 'use_spike': False, 'rsi_required': False, 'edge_k': 1.9181301106088213, 'edge_cap': 0.2811157820048499}.
[I 2025-08-29 22:31:52,097] Trial 484 finished with values: [-0.004439404901525279, 0.004870241466951717] and parameters: {'p_sma': 19, 'p_std': 50, 'p_atr': 18, 'p_adx': 7, 'rsi_period': 20, 'ema1': 21, 'ema2': 46, 'slip_atr_k': 0.024965243146898318, 'slip_spread_k': 0.8036660475253818, 'spread_hl_frac': 0.019295436693443954, 'bb_std_mult': 2.1304811957314587, 'rsi_os': 24, 'rsi_ob': 60, 'vol_spike': 0.18338106537944251, 'adx_thresh': 26.45642596480684, 'atr_min_pct': 0.0032850534350539547, 'atr_max_pct': 0.08508813761136208, 'tp_mult': 1.0861851624594072, 'tsl_mult': 0.8044786444472889, 'strategy': 'breakout', 'time_stop': 125, 'use_sma': False, 'use_atr': False, 'use_adx': False, 'use_ema': False, 'use_spike': False, 'rsi_required': False, 'edge_k': 0.6657057432025241, 'edge_cap': 0.9573477126867345}.
[I 2025-08-29 22:32:19,229] Trial 491 finished with values: [-1000000000.0, 1000000000.0] and parameters: {'p_sma': 5, 'p_std': 26, 'p_atr': 13, 'p_adx': 8, 'rsi_period': 32, 'ema1': 27, 'ema2': 31, 'slip_atr_k': 0.11189084895267871, 'slip_spread_k': 0.8656699719638974, 'spread_hl_frac': 0.041600809421529245, 'bb_std_mult': 2.3244360643129705, 'rsi_os': 55, 'rsi_ob': 83, 'vol_spike': 0.17500004429245797, 'adx_thresh': 25.280131649647963, 'atr_min_pct': 0.022622051082695962, 'atr_max_pct': 0.09757762806521332, 'tp_mult': 2.6016828720282947, 'tsl_mult': 0.29394431598326065, 'strategy': 'breakout', 'time_stop': 179, 'use_sma': False, 'use_atr': False, 'use_adx': False, 'use_ema': False, 'use_spike': False, 'rsi_required': False, 'edge_k': 0.5109628468099608, 'edge_cap': 0.8036502745165136}.
[I 2025-08-29 22:32:19,230] Trial 489 finished with values: [-0.019614415497621884, 0.01958736971541348] and parameters: {'p_sma': 46, 'p_std': 44, 'p_atr': 13, 'p_adx': 17, 'rsi_period': 20, 'ema1': 13, 'ema2': 46, 'slip_atr_k': 0.1099515641736124, 'slip_spread_k': 0.7684715786244609, 'spread_hl_frac': 0.01894445024928986, 'bb_std_mult': 2.115649796268744, 'rsi_os': 31, 'rsi_ob': 94, 'vol_spike': 0.20242308674421144, 'adx_thresh': 25.2724942708533, 'atr_min_pct': 0.0030316877219728512, 'atr_max_pct': 0.08501421799994843, 'tp_mult': 1.0852766743307336, 'tsl_mult': 0.09641747549967561, 'strategy': 'breakout', 'time_stop': 110, 'use_sma': False, 'use_atr': False, 'use_adx': False, 'use_ema': False, 'use_spike': False, 'rsi_required': False, 'edge_k': 1.9117754088673111, 'edge_cap': 0.7993762537598923}.
[I 2025-08-29 22:32:19,402] Trial 488 finished with values: [-1000000000.0, 1000000000.0] and parameters: {'p_sma': 8, 'p_std': 50, 'p_atr': 13, 'p_adx': 17, 'rsi_period': 32, 'ema1': 23, 'ema2': 53, 'slip_atr_k': 0.1088093453236741, 'slip_spread_k': 0.8009900836315718, 'spread_hl_frac': 0.0415732876410446, 'bb_std_mult': 2.1317824614638208, 'rsi_os': 43, 'rsi_ob': 81, 'vol_spike': 0.19848401359080786, 'adx_thresh': 26.076290474553478, 'atr_min_pct': 0.022813588846546752, 'atr_max_pct': 0.10031674972586088, 'tp_mult': 1.9374411826360656, 'tsl_mult': 0.8054715001597916, 'strategy': 'breakout', 'time_stop': 110, 'use_sma': False, 'use_atr': False, 'use_adx': False, 'use_ema': False, 'use_spike': False, 'rsi_required': False, 'edge_k': 1.9062832307351063, 'edge_cap': 0.8021710572377638}.
[I 2025-08-29 22:32:19,538] Trial 490 finished with values: [-0.020451699927314104, 0.02048417612672546] and parameters: {'p_sma': 8, 'p_std': 7, 'p_atr': 24, 'p_adx': 17, 'rsi_period': 32, 'ema1': 18, 'ema2': 20, 'slip_atr_k': 0.11153330435513867, 'slip_spread_k': 0.8079577725790725, 'spread_hl_frac': 0.007139799193052479, 'bb_std_mult': 2.138005929890321, 'rsi_os': 43, 'rsi_ob': 45, 'vol_spike': 0.18542394600058162, 'adx_thresh': 25.317613152872088, 'atr_min_pct': 0.002983758464641271, 'atr_max_pct': 0.09836084323404744, 'tp_mult': 1.8532299862701695, 'tsl_mult': 0.09614222001701833, 'strategy': 'breakout', 'time_stop': 110, 'use_sma': False, 'use_atr': False, 'use_adx': False, 'use_ema': False, 'use_spike': False, 'rsi_required': False, 'edge_k': 0.5011609661957461, 'edge_cap': 0.9150946059281965}.
[I 2025-08-29 22:32:19,721] Trial 492 finished with values: [-1000000000.0, 1000000000.0] and parameters: {'p_sma': 8, 'p_std': 25, 'p_atr': 24, 'p_adx': 16, 'rsi_period': 23, 'ema1': 23, 'ema2': 53, 'slip_atr_k': 0.0030257492308341117, 'slip_spread_k': 0.6739576137922452, 'spread_hl_frac': 0.007257288057747134, 'bb_std_mult': 1.9901405050234993, 'rsi_os': 43, 'rsi_ob': 46, 'vol_spike': 0.1645657863526366, 'adx_thresh': 24.403986158646248, 'atr_min_pct': 0.025804461757752042, 'atr_max_pct': 0.09380004876765824, 'tp_mult': 1.8424488351242805, 'tsl_mult': 0.8756494115166211, 'strategy': 'mean_reversion', 'time_stop': 90, 'use_sma': False, 'use_atr': False, 'use_adx': False, 'use_ema': False, 'use_spike': False, 'rsi_required': False, 'edge_k': 1.2211101396794222, 'edge_cap': 0.7690520068783636}.
[I 2025-08-29 22:32:19,740] Trial 494 finished with values: [-1000000000.0, 1000000000.0] and parameters: {'p_sma': 23, 'p_std': 33, 'p_atr': 24, 'p_adx': 16, 'rsi_period': 23, 'ema1': 18, 'ema2': 52, 'slip_atr_k': 0.1183646198783584, 'slip_spread_k': 0.47325496999683353, 'spread_hl_frac': 0.01773535797512604, 'bb_std_mult': 1.9637733986411072, 'rsi_os': 27, 'rsi_ob': 46, 'vol_spike': 0.2894260447304333, 'adx_thresh': 24.2686622945376, 'atr_min_pct': 0.0022819700282344997, 'atr_max_pct': 0.09422054190665424, 'tp_mult': 1.152541362039199, 'tsl_mult': 0.8738389993049362, 'strategy': 'mean_reversion', 'time_stop': 89, 'use_sma': False, 'use_atr': False, 'use_adx': False, 'use_ema': False, 'use_spike': False, 'rsi_required': False, 'edge_k': 0.4959400966201835, 'edge_cap': 0.7709777777619573}.
[I 2025-08-29 22:32:45,071] Trial 495 finished with values: [-0.007131089777048016, 0.007179202465923389] and parameters: {'p_sma': 6, 'p_std': 25, 'p_atr': 26, 'p_adx': 16, 'rsi_period': 23, 'ema1': 17, 'ema2': 52, 'slip_atr_k': 0.002269370783197812, 'slip_spread_k': 0.06677537240619125, 'spread_hl_frac': 0.009163199196939247, 'bb_std_mult': 1.9613064815953036, 'rsi_os': 41, 'rsi_ob': 56, 'vol_spike': 0.16437178010082254, 'adx_thresh': 20.40288026557624, 'atr_min_pct': 0.0022517204131818538, 'atr_max_pct': 0.13179266957664443, 'tp_mult': 2.774113966336597, 'tsl_mult': 0.7543955278514023, 'strategy': 'mean_reversion', 'time_stop': 102, 'use_sma': False, 'use_atr': False, 'use_adx': False, 'use_ema': False, 'use_spike': False, 'rsi_required': False, 'edge_k': 0.20249340752680112, 'edge_cap': 0.7697181108551118}.
[I 2025-08-29 22:32:45,329] Trial 493 finished with values: [-1000000000.0, 1000000000.0] and parameters: {'p_sma': 6, 'p_std': 39, 'p_atr': 24, 'p_adx': 16, 'rsi_period': 26, 'ema1': 18, 'ema2': 53, 'slip_atr_k': 5.3191980532649175e-05, 'slip_spread_k': 0.6745168413801153, 'spread_hl_frac': 0.01759609273673049, 'bb_std_mult': 1.9290492905767043, 'rsi_os': 45, 'rsi_ob': 67, 'vol_spike': 0.1634564465361755, 'adx_thresh': 28.833162494832948, 'atr_min_pct': 0.028270191590553082, 'atr_max_pct': 0.09347413035520565, 'tp_mult': 1.8501617651626403, 'tsl_mult': 0.4062889733134435, 'strategy': 'mean_reversion', 'time_stop': 195, 'use_sma': False, 'use_atr': False, 'use_adx': False, 'use_ema': False, 'use_spike': False, 'rsi_required': False, 'edge_k': 0.20045886881438013, 'edge_cap': 0.7750850268171611}.
[I 2025-08-29 22:32:46,725] Trial 496 finished with values: [-1000000000.0, 1000000000.0] and parameters: {'p_sma': 28, 'p_std': 27, 'p_atr': 23, 'p_adx': 16, 'rsi_period': 25, 'ema1': 17, 'ema2': 55, 'slip_atr_k': 0.01894933606502916, 'slip_spread_k': 0.8246051120236954, 'spread_hl_frac': 0.017665503006494013, 'bb_std_mult': 1.9503675069529742, 'rsi_os': 27, 'rsi_ob': 57, 'vol_spike': 0.2662901192621608, 'adx_thresh': 11.395844164425137, 'atr_min_pct': 0.008960298292194838, 'atr_max_pct': 0.10537270026244885, 'tp_mult': 1.153340922579791, 'tsl_mult': 0.7545057313309048, 'strategy': 'mean_reversion', 'time_stop': 232, 'use_sma': False, 'use_atr': False, 'use_adx': False, 'use_ema': False, 'use_spike': False, 'rsi_required': False, 'edge_k': 0.08074731040541272, 'edge_cap': 0.8357135862811996}.
[I 2025-08-29 22:32:46,844] Trial 497 finished with values: [-1000000000.0, 1000000000.0] and parameters: {'p_sma': 38, 'p_std': 10, 'p_atr': 21, 'p_adx': 15, 'rsi_period': 18, 'ema1': 25, 'ema2': 11, 'slip_atr_k': 0.013175582348095268, 'slip_spread_k': 0.883980401189252, 'spread_hl_frac': 0.017358612626735978, 'bb_std_mult': 3.058239589964124, 'rsi_os': 9, 'rsi_ob': 57, 'vol_spike': 0.17635079773049833, 'adx_thresh': 13.791277265409875, 'atr_min_pct': 0.02032976358916578, 'atr_max_pct': 0.10522953779108463, 'tp_mult': 1.1268085534856525, 'tsl_mult': 0.6713635678840855, 'strategy': 'breakout', 'time_stop': 206, 'use_sma': False, 'use_atr': False, 'use_adx': False, 'use_ema': False, 'use_spike': False, 'rsi_required': False, 'edge_k': 0.4173778759874006, 'edge_cap': 0.8373391260214353}.
[I 2025-08-29 22:33:14,005] Trial 498 finished with values: [-1000000000.0, 1000000000.0] and parameters: {'p_sma': 28, 'p_std': 23, 'p_atr': 14, 'p_adx': 23, 'rsi_period': 51, 'ema1': 7, 'ema2': 36, 'slip_atr_k': 0.15267346265667145, 'slip_spread_k': 0.8249872217172181, 'spread_hl_frac': 0.017428596182095416, 'bb_std_mult': 2.0419158615007555, 'rsi_os': 27, 'rsi_ob': 58, 'vol_spike': 0.23106825750996401, 'adx_thresh': 25.776568119452506, 'atr_min_pct': 0.010345679853670693, 'atr_max_pct': 0.10658087673495303, 'tp_mult': 1.107579462698191, 'tsl_mult': 0.4008676071010722, 'strategy': 'breakout', 'time_stop': 194, 'use_sma': False, 'use_atr': False, 'use_adx': False, 'use_ema': False, 'use_spike': False, 'rsi_required': False, 'edge_k': 1.0310028806090321, 'edge_cap': 0.8396327270827167}.
[I 2025-08-29 22:33:14,330] Trial 500 finished with values: [-1000000000.0, 1000000000.0] and parameters: {'p_sma': 25, 'p_std': 46, 'p_atr': 14, 'p_adx': 22, 'rsi_period': 18, 'ema1': 19, 'ema2': 54, 'slip_atr_k': 0.15753161124154116, 'slip_spread_k': 0.8233164362995657, 'spread_hl_frac': 0.034246173870039226, 'bb_std_mult': 3.0333226170149907, 'rsi_os': 39, 'rsi_ob': 58, 'vol_spike': 0.21865322819014343, 'adx_thresh': 25.606751717259712, 'atr_min_pct': 0.016345482123675047, 'atr_max_pct': 0.08026694085312774, 'tp_mult': 1.5559326204941848, 'tsl_mult': 0.6725124940564235, 'strategy': 'breakout', 'time_stop': 64, 'use_sma': False, 'use_atr': False, 'use_adx': False, 'use_ema': False, 'use_spike': False, 'rsi_required': False, 'edge_k': 0.41476086168560766, 'edge_cap': 0.5492812648295088}.
[I 2025-08-29 22:33:14,446] Trial 501 finished with values: [-1000000000.0, 1000000000.0] and parameters: {'p_sma': 53, 'p_std': 6, 'p_atr': 14, 'p_adx': 15, 'rsi_period': 21, 'ema1': 19, 'ema2': 36, 'slip_atr_k': 0.12739299656823427, 'slip_spread_k': 0.8293747727419956, 'spread_hl_frac': 0.04435615842287587, 'bb_std_mult': 2.0480380290012086, 'rsi_os': 25, 'rsi_ob': 58, 'vol_spike': 0.18721818977073923, 'adx_thresh': 30.020354981317233, 'atr_min_pct': 0.007359618471784375, 'atr_max_pct': 0.0963032308114534, 'tp_mult': 1.0650650225726899, 'tsl_mult': 0.7156704854828995, 'strategy': 'breakout', 'time_stop': 94, 'use_sma': False, 'use_atr': False, 'use_adx': False, 'use_ema': False, 'use_spike': False, 'rsi_required': False, 'edge_k': 1.658587578108786, 'edge_cap': 0.8121865237793415}.
[I 2025-08-29 22:33:14,579] Trial 499 finished with values: [-1000000000.0, 1000000000.0] and parameters: {'p_sma': 34, 'p_std': 23, 'p_atr': 17, 'p_adx': 23, 'rsi_period': 49, 'ema1': 7, 'ema2': 36, 'slip_atr_k': 0.02040851905731124, 'slip_spread_k': 0.8274331252639793, 'spread_hl_frac': 0.018637874421802404, 'bb_std_mult': 1.3764993888861312, 'rsi_os': 27, 'rsi_ob': 58, 'vol_spike': 0.17459574637747194, 'adx_thresh': 13.75804487595207, 'atr_min_pct': 0.00891983755447412, 'atr_max_pct': 0.10384463435223834, 'tp_mult': 1.6097886874833391, 'tsl_mult': 0.7187903779732591, 'strategy': 'breakout', 'time_stop': 119, 'use_sma': False, 'use_atr': False, 'use_adx': False, 'use_ema': False, 'use_spike': False, 'rsi_required': False, 'edge_k': 1.67066047789219, 'edge_cap': 0.8377938905076256}.
[I 2025-08-29 22:33:42,192] Trial 503 finished with values: [-1000000000.0, 1000000000.0] and parameters: {'p_sma': 53, 'p_std': 24, 'p_atr': 23, 'p_adx': 15, 'rsi_period': 21, 'ema1': 22, 'ema2': 29, 'slip_atr_k': 0.02017875693694134, 'slip_spread_k': 0.7349114099188632, 'spread_hl_frac': 0.019502777409165725, 'bb_std_mult': 1.8572810353383682, 'rsi_os': 25, 'rsi_ob': 59, 'vol_spike': 0.02630411101310756, 'adx_thresh': 8.92341275577034, 'atr_min_pct': 0.021435322270196972, 'atr_max_pct': 0.09116607445972623, 'tp_mult': 1.0617896519305112, 'tsl_mult': 0.7164830023966431, 'strategy': 'breakout', 'time_stop': 20, 'use_sma': False, 'use_atr': False, 'use_adx': False, 'use_ema': False, 'use_spike': False, 'rsi_required': False, 'edge_k': 1.8129506453584447, 'edge_cap': 0.3421391950608257}.
[I 2025-08-29 22:33:42,288] Trial 504 finished with values: [-1000000000.0, 1000000000.0] and parameters: {'p_sma': 17, 'p_std': 24, 'p_atr': 23, 'p_adx': 15, 'rsi_period': 41, 'ema1': 25, 'ema2': 27, 'slip_atr_k': 0.019421355953219147, 'slip_spread_k': 0.9431702581341952, 'spread_hl_frac': 0.011394525495363673, 'bb_std_mult': 1.8080107174515063, 'rsi_os': 25, 'rsi_ob': 59, 'vol_spike': 0.2244550993029648, 'adx_thresh': 12.883497895159422, 'atr_min_pct': 0.0038144419830663722, 'atr_max_pct': 0.09133272705854338, 'tp_mult': 1.1748930654227938, 'tsl_mult': 0.4587275976652959, 'strategy': 'breakout', 'time_stop': 14, 'use_sma': False, 'use_atr': False, 'use_adx': False, 'use_ema': False, 'use_spike': False, 'rsi_required': False, 'edge_k': 0.46928647951746544, 'edge_cap': 0.7942231454409551}.
[I 2025-08-29 22:33:42,385] Trial 502 finished with values: [-1000000000.0, 1000000000.0] and parameters: {'p_sma': 34, 'p_std': 24, 'p_atr': 17, 'p_adx': 15, 'rsi_period': 48, 'ema1': 25, 'ema2': 48, 'slip_atr_k': 0.12746274881713365, 'slip_spread_k': 0.9799536369555947, 'spread_hl_frac': 0.018824866759379267, 'bb_std_mult': 1.5061986360554793, 'rsi_os': 25, 'rsi_ob': 59, 'vol_spike': 0.17675646531337127, 'adx_thresh': 24.765880569981906, 'atr_min_pct': 0.0038449287883487596, 'atr_max_pct': 0.13796493800192944, 'tp_mult': 1.0611942112879953, 'tsl_mult': 0.7161003507698185, 'strategy': 'breakout', 'time_stop': 65, 'use_sma': False, 'use_atr': False, 'use_adx': False, 'use_ema': False, 'use_spike': False, 'rsi_required': False, 'edge_k': 0.717277901029075, 'edge_cap': 0.547621762785061}.
[I 2025-08-29 22:33:42,554] Trial 505 finished with values: [-1000000000.0, 1000000000.0] and parameters: {'p_sma': 17, 'p_std': 26, 'p_atr': 12, 'p_adx': 10, 'rsi_period': 41, 'ema1': 20, 'ema2': 28, 'slip_atr_k': 0.012906469776327863, 'slip_spread_k': 0.5844057877806718, 'spread_hl_frac': 0.01918715729455223, 'bb_std_mult': 1.515069242523865, 'rsi_os': 7, 'rsi_ob': 60, 'vol_spike': 0.18389190596202346, 'adx_thresh': 24.700885545775495, 'atr_min_pct': 0.012923747848002584, 'atr_max_pct': 0.08763494794253383, 'tp_mult': 2.258710721674555, 'tsl_mult': 0.46852748346494105, 'strategy': 'breakout', 'time_stop': 101, 'use_sma': False, 'use_atr': False, 'use_adx': False, 'use_ema': False, 'use_spike': False, 'rsi_required': False, 'edge_k': 0.5977946972111282, 'edge_cap': 0.5259663244674556}.
[I 2025-08-29 22:34:10,617] Trial 509 finished with values: [-1000000000.0, 1000000000.0] and parameters: {'p_sma': 7, 'p_std': 26, 'p_atr': 25, 'p_adx': 25, 'rsi_period': 68, 'ema1': 9, 'ema2': 55, 'slip_atr_k': 0.24319369938345994, 'slip_spread_k': 0.8619605798381987, 'spread_hl_frac': 0.015827339204694174, 'bb_std_mult': 2.540500978384011, 'rsi_os': 23, 'rsi_ob': 61, 'vol_spike': 0.19513408152433045, 'adx_thresh': 18.725244791217953, 'atr_min_pct': 0.001362520256400926, 'atr_max_pct': 0.09667101790438307, 'tp_mult': 1.220001400433111, 'tsl_mult': 0.7357455362956341, 'strategy': 'breakout', 'time_stop': 131, 'use_sma': False, 'use_atr': False, 'use_adx': False, 'use_ema': False, 'use_spike': False, 'rsi_required': False, 'edge_k': 1.3887572293348875, 'edge_cap': 0.7538565882340249}.
[I 2025-08-29 22:34:10,899] Trial 506 finished with values: [-1000000000.0, 1000000000.0] and parameters: {'p_sma': 44, 'p_std': 26, 'p_atr': 23, 'p_adx': 21, 'rsi_period': 68, 'ema1': 25, 'ema2': 55, 'slip_atr_k': 0.07069269745115156, 'slip_spread_k': 0.9455934970366622, 'spread_hl_frac': 0.015740726358867287, 'bb_std_mult': 1.5288242573851631, 'rsi_os': 26, 'rsi_ob': 61, 'vol_spike': 0.18225655158642612, 'adx_thresh': 24.67041246878128, 'atr_min_pct': 0.003551520137126901, 'atr_max_pct': 0.0738628533959758, 'tp_mult': 1.1673913361402493, 'tsl_mult': 0.4644300111294962, 'strategy': 'breakout', 'time_stop': 128, 'use_sma': False, 'use_atr': False, 'use_adx': False, 'use_ema': False, 'use_spike': False, 'rsi_required': False, 'edge_k': 0.47111723319271726, 'edge_cap': 0.5232453566601033}.
[I 2025-08-29 22:34:11,190] Trial 507 finished with values: [-1000000000.0, 1000000000.0] and parameters: {'p_sma': 9, 'p_std': 60, 'p_atr': 22, 'p_adx': 21, 'rsi_period': 17, 'ema1': 9, 'ema2': 55, 'slip_atr_k': 0.014818608846484855, 'slip_spread_k': 0.24031516058402802, 'spread_hl_frac': 0.015211389622689928, 'bb_std_mult': 2.5419217052397243, 'rsi_os': 26, 'rsi_ob': 61, 'vol_spike': 0.1792261782292881, 'adx_thresh': 34.10574421145601, 'atr_min_pct': 0.002869722309526007, 'atr_max_pct': 0.13935858771300305, 'tp_mult': 2.0413097855652658, 'tsl_mult': 0.9265919241440481, 'strategy': 'breakout', 'time_stop': 101, 'use_sma': False, 'use_atr': False, 'use_adx': False, 'use_ema': False, 'use_spike': False, 'rsi_required': False, 'edge_k': 0.585962513829317, 'edge_cap': 0.3638929472795147}.
[I 2025-08-29 22:34:11,290] Trial 508 finished with values: [-1000000000.0, 1000000000.0] and parameters: {'p_sma': 7, 'p_std': 60, 'p_atr': 22, 'p_adx': 17, 'rsi_period': 17, 'ema1': 24, 'ema2': 55, 'slip_atr_k': 0.18434146621211084, 'slip_spread_k': 0.09342616029494888, 'spread_hl_frac': 0.0167461713990081, 'bb_std_mult': 2.1785863168316104, 'rsi_os': 15, 'rsi_ob': 62, 'vol_spike': 0.1955619044222529, 'adx_thresh': 25.816457741036157, 'atr_min_pct': 0.0012711992106277184, 'atr_max_pct': 0.1432518440190476, 'tp_mult': 2.348142582410882, 'tsl_mult': 0.7822402912225761, 'strategy': 'breakout', 'time_stop': 131, 'use_sma': False, 'use_atr': False, 'use_adx': False, 'use_ema': False, 'use_spike': False, 'rsi_required': False, 'edge_k': 0.6077285334142948, 'edge_cap': 0.8183736024536762}.
[I 2025-08-29 22:34:37,811] Trial 510 finished with values: [-1000000000.0, 1000000000.0] and parameters: {'p_sma': 5, 'p_std': 17, 'p_atr': 22, 'p_adx': 17, 'rsi_period': 17, 'ema1': 24, 'ema2': 54, 'slip_atr_k': 0.06983866194671512, 'slip_spread_k': 0.8547228078598845, 'spread_hl_frac': 0.02744168066429428, 'bb_std_mult': 2.200053109799308, 'rsi_os': 29, 'rsi_ob': 62, 'vol_spike': 0.17963863912386815, 'adx_thresh': 27.464594000040538, 'atr_min_pct': 0.006463613716368841, 'atr_max_pct': 0.0751446317558553, 'tp_mult': 2.667353808441371, 'tsl_mult': 0.26767150556954195, 'strategy': 'breakout', 'time_stop': 114, 'use_sma': False, 'use_atr': False, 'use_adx': False, 'use_ema': False, 'use_spike': False, 'rsi_required': False, 'edge_k': 0.5243796256498394, 'edge_cap': 0.7895283783184801}.
[I 2025-08-29 22:34:38,243] Trial 512 finished with values: [-1000000000.0, 1000000000.0] and parameters: {'p_sma': 5, 'p_std': 20, 'p_atr': 11, 'p_adx': 17, 'rsi_period': 20, 'ema1': 24, 'ema2': 57, 'slip_atr_k': 0.02695382837332004, 'slip_spread_k': 0.12193899853415374, 'spread_hl_frac': 0.047261247042903035, 'bb_std_mult': 3.5056582202878745, 'rsi_os': 16, 'rsi_ob': 62, 'vol_spike': 0.08666432795468863, 'adx_thresh': 27.257373292234107, 'atr_min_pct': 0.006395845303496616, 'atr_max_pct': 0.14416987452967417, 'tp_mult': 2.6779561084131474, 'tsl_mult': 0.7814418674954299, 'strategy': 'mean_reversion', 'time_stop': 114, 'use_sma': False, 'use_atr': False, 'use_adx': False, 'use_ema': False, 'use_spike': False, 'rsi_required': False, 'edge_k': 0.5406923415246588, 'edge_cap': 0.8182725621989152}.
[I 2025-08-29 22:34:38,347] Trial 513 finished with values: [-1000000000.0, 1000000000.0] and parameters: {'p_sma': 5, 'p_std': 22, 'p_atr': 7, 'p_adx': 16, 'rsi_period': 34, 'ema1': 10, 'ema2': 51, 'slip_atr_k': 0.027431034749095834, 'slip_spread_k': 0.6224986111621644, 'spread_hl_frac': 0.004854071640093126, 'bb_std_mult': 2.0670540351155844, 'rsi_os': 29, 'rsi_ob': 60, 'vol_spike': 0.04008221951715535, 'adx_thresh': 27.62359681620986, 'atr_min_pct': 0.002360395893136171, 'atr_max_pct': 0.10146683249118864, 'tp_mult': 2.67351922779993, 'tsl_mult': 0.23354714951844985, 'strategy': 'mean_reversion', 'time_stop': 295, 'use_sma': False, 'use_atr': False, 'use_adx': False, 'use_ema': False, 'use_spike': False, 'rsi_required': False, 'edge_k': 0.5075435687159661, 'edge_cap': 0.7911581729213757}.
