[I 2025-08-29 21:59:51,443] Trial 191 finished with values: [-1000000000.0, 1000000000.0] and parameters: {'p_sma': 6, 'p_std': 57, 'p_atr': 23, 'p_adx': 16, 'rsi_period': 17, 'ema1': 22, 'ema2': 55, 'slip_atr_k': 0.02598681881033721, 'slip_spread_k': 0.7305902214293023, 'spread_hl_frac': 0.017106877680707795, 'bb_std_mult': 2.033215005179044, 'rsi_os': 28, 'rsi_ob': 58, 'vol_spike': 0.1688156164054173, 'adx_thresh': 24.684165155316116, 'atr_min_pct': 0.0031329241289843766, 'atr_max_pct': 0.02803410992890469, 'tp_mult': 1.0891382937641538, 'tsl_mult': 0.6622959342772438, 'strategy': 'breakout', 'time_stop': 251, 'use_sma': False, 'use_atr': False, 'use_adx': False, 'use_ema': False, 'use_spike': False, 'rsi_required': False, 'edge_k': 0.43456841554136494, 'edge_cap': 0.7302894989741208}.
[I 2025-08-29 21:59:51,813] Trial 190 finished with values: [-1000000000.0, 1000000000.0] and parameters: {'p_sma': 6, 'p_std': 49, 'p_atr': 23, 'p_adx': 16, 'rsi_period': 16, 'ema1': 22, 'ema2': 54, 'slip_atr_k': 0.02752752664623514, 'slip_spread_k': 0.7269677618674841, 'spread_hl_frac': 0.017840017848635974, 'bb_std_mult': 2.0247055046337445, 'rsi_os': 27, 'rsi_ob': 58, 'vol_spike': 0.16224678713314505, 'adx_thresh': 25.609643365114124, 'atr_min_pct': 0.0036053709687547627, 'atr_max_pct': 0.10179824296788337, 'tp_mult': 1.1902133983017658, 'tsl_mult': 0.5822003369757082, 'strategy': 'breakout', 'time_stop': 124, 'use_sma': False, 'use_atr': False, 'use_adx': False, 'use_ema': False, 'use_spike': False, 'rsi_required': False, 'edge_k': 0.48256535945001316, 'edge_cap': 0.7176560852681639}.
[I 2025-08-29 21:59:51,999] Trial 192 finished with values: [-1000000000.0, 1000000000.0] and parameters: {'p_sma': 5, 'p_std': 58, 'p_atr': 22, 'p_adx': 16, 'rsi_period': 19, 'ema1': 22, 'ema2': 55, 'slip_atr_k': 0.028735248514060827, 'slip_spread_k': 0.7720650381165601, 'spread_hl_frac': 0.01792770369226846, 'bb_std_mult': 2.0227943401660173, 'rsi_os': 28, 'rsi_ob': 58, 'vol_spike': 0.16802952496930132, 'adx_thresh': 24.49234609488152, 'atr_min_pct': 0.0034306920266255264, 'atr_max_pct': 0.0503692959382145, 'tp_mult': 1.0569296229584488, 'tsl_mult': 0.4840658761450076, 'strategy': 'breakout', 'time_stop': 96, 'use_sma': False, 'use_atr': False, 'use_adx': False, 'use_ema': False, 'use_spike': False, 'rsi_required': False, 'edge_k': 1.5886809183514794, 'edge_cap': 0.7852173331169281}.
[I 2025-08-29 21:59:52,082] Trial 189 finished with values: [-1000000000.0, 1000000000.0] and parameters: {'p_sma': 8, 'p_std': 32, 'p_atr': 15, 'p_adx': 16, 'rsi_period': 28, 'ema1': 5, 'ema2': 15, 'slip_atr_k': 0.08014863014036919, 'slip_spread_k': 0.821813831594077, 'spread_hl_frac': 0.042118418339552224, 'bb_std_mult': 1.3040407641859089, 'rsi_os': 26, 'rsi_ob': 90, 'vol_spike': 0.1814727608282831, 'adx_thresh': 24.42041187677256, 'atr_min_pct': 0.024374404713589884, 'atr_max_pct': 0.10427836602035938, 'tp_mult': 1.1930721562334794, 'tsl_mult': 0.16053410026491288, 'strategy': 'breakout', 'time_stop': 96, 'use_sma': False, 'use_atr': False, 'use_adx': False, 'use_ema': False, 'use_spike': False, 'rsi_required': False, 'edge_k': 0.8576562247912477, 'edge_cap': 0.662809072525617}.
[I 2025-08-29 22:00:19,941] Trial 193 finished with values: [-1000000000.0, 1000000000.0] and parameters: {'p_sma': 6, 'p_std': 29, 'p_atr': 22, 'p_adx': 14, 'rsi_period': 13, 'ema1': 23, 'ema2': 53, 'slip_atr_k': 0.04668369426104485, 'slip_spread_k': 0.7728112174553617, 'spread_hl_frac': 0.01921114179217704, 'bb_std_mult': 1.9995782436257206, 'rsi_os': 26, 'rsi_ob': 58, 'vol_spike': 0.14470508816140695, 'adx_thresh': 24.380652673079407, 'atr_min_pct': 0.0036527332694743803, 'atr_max_pct': 0.09397003428126376, 'tp_mult': 2.8037548926939673, 'tsl_mult': 0.5572893464926786, 'strategy': 'mean_reversion', 'time_stop': 292, 'use_sma': False, 'use_atr': False, 'use_adx': False, 'use_ema': False, 'use_spike': False, 'rsi_required': False, 'edge_k': 1.6026132468493937, 'edge_cap': 0.6662732531940014}.
[I 2025-08-29 22:00:19,978] Trial 194 finished with values: [-1000000000.0, 1000000000.0] and parameters: {'p_sma': 5, 'p_std': 25, 'p_atr': 21, 'p_adx': 14, 'rsi_period': 71, 'ema1': 23, 'ema2': 53, 'slip_atr_k': 0.021914789463669957, 'slip_spread_k': 0.7728607409840395, 'spread_hl_frac': 0.018905762266664027, 'bb_std_mult': 2.2018964756064716, 'rsi_os': 26, 'rsi_ob': 58, 'vol_spike': 0.15327924799983156, 'adx_thresh': 24.19717750946002, 'atr_min_pct': 0.0036196333299350313, 'atr_max_pct': 0.09451446911852136, 'tp_mult': 1.0493851897776345, 'tsl_mult': 0.5357380858235412, 'strategy': 'mean_reversion', 'time_stop': 14, 'use_sma': False, 'use_atr': False, 'use_adx': False, 'use_ema': False, 'use_spike': False, 'rsi_required': False, 'edge_k': 1.7728624032561708, 'edge_cap': 0.7964489402340122}.
[I 2025-08-29 22:00:20,113] Trial 196 finished with values: [-1000000000.0, 1000000000.0] and parameters: {'p_sma': 5, 'p_std': 25, 'p_atr': 22, 'p_adx': 14, 'rsi_period': 71, 'ema1': 23, 'ema2': 52, 'slip_atr_k': 0.04853472335156929, 'slip_spread_k': 0.7852707858928092, 'spread_hl_frac': 0.019279335947259932, 'bb_std_mult': 2.148025678963996, 'rsi_os': 26, 'rsi_ob': 56, 'vol_spike': 0.1556476857275391, 'adx_thresh': 25.05526088755037, 'atr_min_pct': 0.0038787948651863554, 'atr_max_pct': 0.09540888502712085, 'tp_mult': 2.4226556955168665, 'tsl_mult': 0.4276706634399042, 'strategy': 'mean_reversion', 'time_stop': 105, 'use_sma': False, 'use_atr': False, 'use_adx': False, 'use_ema': False, 'use_spike': False, 'rsi_required': False, 'edge_k': 0.5259592114917402, 'edge_cap': 0.7949490480035583}.
[I 2025-08-29 22:00:20,196] Trial 195 finished with values: [-1000000000.0, 1000000000.0] and parameters: {'p_sma': 5, 'p_std': 25, 'p_atr': 21, 'p_adx': 19, 'rsi_period': 71, 'ema1': 23, 'ema2': 52, 'slip_atr_k': 0.04570323342772807, 'slip_spread_k': 0.7710868252648738, 'spread_hl_frac': 0.019449830797390412, 'bb_std_mult': 2.184002326811325, 'rsi_os': 26, 'rsi_ob': 59, 'vol_spike': 0.1499979530585287, 'adx_thresh': 23.976409751948474, 'atr_min_pct': 0.0035256057686435835, 'atr_max_pct': 0.09375430722699807, 'tp_mult': 1.508808170599988, 'tsl_mult': 0.6216650041564025, 'strategy': 'mean_reversion', 'time_stop': 105, 'use_sma': False, 'use_atr': False, 'use_adx': False, 'use_ema': False, 'use_spike': False, 'rsi_required': False, 'edge_k': 0.554581381761334, 'edge_cap': 0.8008820808444513}.
[I 2025-08-29 22:00:46,711] Trial 197 finished with values: [-1000000000.0, 1000000000.0] and parameters: {'p_sma': 7, 'p_std': 22, 'p_atr': 24, 'p_adx': 19, 'rsi_period': 18, 'ema1': 24, 'ema2': 56, 'slip_atr_k': 0.1576984890078186, 'slip_spread_k': 0.7929750307752297, 'spread_hl_frac': 0.016358498093735165, 'bb_std_mult': 2.160979878540198, 'rsi_os': 31, 'rsi_ob': 56, 'vol_spike': 0.2690389598575762, 'adx_thresh': 25.1792433569017, 'atr_min_pct': 0.0046318131281598415, 'atr_max_pct': 0.11105490617735056, 'tp_mult': 1.4318795873115455, 'tsl_mult': 0.4094791889983916, 'strategy': 'breakout', 'time_stop': 105, 'use_sma': False, 'use_atr': False, 'use_adx': False, 'use_ema': False, 'use_spike': False, 'rsi_required': False, 'edge_k': 0.5382126709835322, 'edge_cap': 0.7663390318129313}.
[I 2025-08-29 22:00:47,016] Trial 200 finished with values: [-0.007931148659162002, 0.00795916101658946] and parameters: {'p_sma': 7, 'p_std': 22, 'p_atr': 24, 'p_adx': 17, 'rsi_period': 17, 'ema1': 24, 'ema2': 55, 'slip_atr_k': 0.032751823164511334, 'slip_spread_k': 0.8087616028620629, 'spread_hl_frac': 0.01721737527009738, 'bb_std_mult': 1.8205816045710321, 'rsi_os': 43, 'rsi_ob': 84, 'vol_spike': 0.06504136112918264, 'adx_thresh': 25.800596868754972, 'atr_min_pct': 0.0027596618909231686, 'atr_max_pct': 0.11101383241338934, 'tp_mult': 1.9224163511873142, 'tsl_mult': 0.47880688607247357, 'strategy': 'breakout', 'time_stop': 231, 'use_sma': False, 'use_atr': False, 'use_adx': False, 'use_ema': False, 'use_spike': False, 'rsi_required': False, 'edge_k': 0.6108672821346529, 'edge_cap': 0.7731765077592914}.
[I 2025-08-29 22:00:47,257] Trial 199 finished with values: [-1000000000.0, 1000000000.0] and parameters: {'p_sma': 7, 'p_std': 5, 'p_atr': 24, 'p_adx': 19, 'rsi_period': 18, 'ema1': 24, 'ema2': 55, 'slip_atr_k': 0.1544134905031212, 'slip_spread_k': 0.8128722534242782, 'spread_hl_frac': 0.016101773009043363, 'bb_std_mult': 2.402378291708638, 'rsi_os': 35, 'rsi_ob': 59, 'vol_spike': 0.0472885833355607, 'adx_thresh': 25.972311488031945, 'atr_min_pct': 0.004797453238329858, 'atr_max_pct': 0.1173178743888321, 'tp_mult': 2.9394296130952684, 'tsl_mult': 0.9600490797841409, 'strategy': 'breakout', 'time_stop': 267, 'use_sma': False, 'use_atr': False, 'use_adx': False, 'use_ema': False, 'use_spike': False, 'rsi_required': False, 'edge_k': 1.0711157057798726, 'edge_cap': 0.7639452815199188}.
[I 2025-08-29 22:00:47,257] Trial 198 finished with values: [-1000000000.0, 1000000000.0] and parameters: {'p_sma': 6, 'p_std': 45, 'p_atr': 24, 'p_adx': 19, 'rsi_period': 18, 'ema1': 24, 'ema2': 52, 'slip_atr_k': 0.15674408210724172, 'slip_spread_k': 0.8157619000119307, 'spread_hl_frac': 0.016336633401684966, 'bb_std_mult': 2.1433405345742536, 'rsi_os': 31, 'rsi_ob': 56, 'vol_spike': 0.17323489577370027, 'adx_thresh': 25.19701612082205, 'atr_min_pct': 0.0027841441248968035, 'atr_max_pct': 0.10718387649203896, 'tp_mult': 2.398640922825875, 'tsl_mult': 0.9698085412838235, 'strategy': 'breakout', 'time_stop': 103, 'use_sma': False, 'use_atr': False, 'use_adx': False, 'use_ema': False, 'use_spike': False, 'rsi_required': False, 'edge_k': 1.0950466239264427, 'edge_cap': 0.3558795558807818}.
[I 2025-08-29 22:01:14,066] Trial 204 finished with values: [-1000000000.0, 1000000000.0] and parameters: {'p_sma': 19, 'p_std': 17, 'p_atr': 25, 'p_adx': 20, 'rsi_period': 20, 'ema1': 7, 'ema2': 50, 'slip_atr_k': 0.013843268789521952, 'slip_spread_k': 0.12747979945525484, 'spread_hl_frac': 0.018084097036785637, 'bb_std_mult': 2.250104770517576, 'rsi_os': 28, 'rsi_ob': 60, 'vol_spike': 0.08100644216730309, 'adx_thresh': 26.949719348071163, 'atr_min_pct': 0.013049000481881408, 'atr_max_pct': 0.07934223479006405, 'tp_mult': 1.0106557314119535, 'tsl_mult': 0.678827604177384, 'strategy': 'breakout', 'time_stop': 119, 'use_sma': False, 'use_atr': False, 'use_adx': False, 'use_ema': False, 'use_spike': False, 'rsi_required': False, 'edge_k': 0.497765318893961, 'edge_cap': 0.8139172895408647}.
[I 2025-08-29 22:01:14,443] Trial 202 finished with values: [-1000000000.0, 1000000000.0] and parameters: {'p_sma': 7, 'p_std': 27, 'p_atr': 26, 'p_adx': 20, 'rsi_period': 63, 'ema1': 7, 'ema2': 50, 'slip_atr_k': 0.012925889506350263, 'slip_spread_k': 0.02705383333478395, 'spread_hl_frac': 0.02072283659329247, 'bb_std_mult': 2.388704085089012, 'rsi_os': 27, 'rsi_ob': 46, 'vol_spike': 0.1709856809457394, 'adx_thresh': 26.823591153795505, 'atr_min_pct': 0.008233617250461683, 'atr_max_pct': 0.11792932889693873, 'tp_mult': 2.944228642020588, 'tsl_mult': 0.6813900208926081, 'strategy': 'breakout', 'time_stop': 210, 'use_sma': False, 'use_atr': False, 'use_adx': False, 'use_ema': False, 'use_spike': False, 'rsi_required': False, 'edge_k': 0.9571657863897312, 'edge_cap': 0.17119011395442585}.
[I 2025-08-29 22:01:14,644] Trial 203 finished with values: [-1000000000.0, 1000000000.0] and parameters: {'p_sma': 60, 'p_std': 17, 'p_atr': 25, 'p_adx': 20, 'rsi_period': 20, 'ema1': 7, 'ema2': 53, 'slip_atr_k': 0.019038151472212935, 'slip_spread_k': 0.03366953930269584, 'spread_hl_frac': 0.018123788699033694, 'bb_std_mult': 1.75818975145868, 'rsi_os': 27, 'rsi_ob': 60, 'vol_spike': 0.11628148555682208, 'adx_thresh': 26.580620984253645, 'atr_min_pct': 0.008399925338647186, 'atr_max_pct': 0.07888240107937045, 'tp_mult': 2.3360033037682806, 'tsl_mult': 0.6060871493393257, 'strategy': 'breakout', 'time_stop': 48, 'use_sma': False, 'use_atr': False, 'use_adx': False, 'use_ema': False, 'use_spike': False, 'rsi_required': False, 'edge_k': 0.46548332546371773, 'edge_cap': 0.8137491686240318}.
[I 2025-08-29 22:01:14,751] Trial 201 finished with values: [-0.020688458716112135, 0.020820317542417924] and parameters: {'p_sma': 7, 'p_std': 5, 'p_atr': 25, 'p_adx': 17, 'rsi_period': 63, 'ema1': 24, 'ema2': 55, 'slip_atr_k': 0.018548860452794722, 'slip_spread_k': 0.8039017931037192, 'spread_hl_frac': 0.016409557244177562, 'bb_std_mult': 1.8320722235075417, 'rsi_os': 43, 'rsi_ob': 85, 'vol_spike': 0.11587319730033536, 'adx_thresh': 26.00279551207974, 'atr_min_pct': 0.002490949007763189, 'atr_max_pct': 0.07926149792458673, 'tp_mult': 1.9390722413442987, 'tsl_mult': 0.6773707034021683, 'strategy': 'breakout', 'time_stop': 43, 'use_sma': False, 'use_atr': False, 'use_adx': False, 'use_ema': False, 'use_spike': False, 'rsi_required': False, 'edge_k': 0.632567499310176, 'edge_cap': 0.7553779193525307}.
[I 2025-08-29 22:01:41,348] Trial 205 finished with values: [-1000000000.0, 1000000000.0] and parameters: {'p_sma': 7, 'p_std': 23, 'p_atr': 26, 'p_adx': 15, 'rsi_period': 64, 'ema1': 24, 'ema2': 53, 'slip_atr_k': 0.019819838085409724, 'slip_spread_k': 0.4595810175558804, 'spread_hl_frac': 0.020483883862990566, 'bb_std_mult': 1.7561362893424444, 'rsi_os': 15, 'rsi_ob': 68, 'vol_spike': 0.13059246259376922, 'adx_thresh': 26.57433751524008, 'atr_min_pct': 0.00842508684005051, 'atr_max_pct': 0.08274152938930553, 'tp_mult': 2.333425600109597, 'tsl_mult': 0.6300833217013793, 'strategy': 'breakout', 'time_stop': 43, 'use_sma': False, 'use_atr': False, 'use_adx': False, 'use_ema': False, 'use_spike': False, 'rsi_required': False, 'edge_k': 0.4597489718227765, 'edge_cap': 0.0664979730778123}.
[I 2025-08-29 22:01:41,514] Trial 206 finished with values: [-1000000000.0, 1000000000.0] and parameters: {'p_sma': 60, 'p_std': 24, 'p_atr': 25, 'p_adx': 15, 'rsi_period': 78, 'ema1': 24, 'ema2': 53, 'slip_atr_k': 0.018464423596136398, 'slip_spread_k': 0.8375035532099097, 'spread_hl_frac': 0.014733298174345925, 'bb_std_mult': 1.8782293842099476, 'rsi_os': 15, 'rsi_ob': 62, 'vol_spike': 0.1303058163061861, 'adx_thresh': 26.198720305299123, 'atr_min_pct': 0.006563356571369448, 'atr_max_pct': 0.13009247617369896, 'tp_mult': 2.3260980779871883, 'tsl_mult': 0.19664697051978913, 'strategy': 'breakout', 'time_stop': 43, 'use_sma': False, 'use_atr': False, 'use_adx': False, 'use_ema': False, 'use_spike': False, 'rsi_required': False, 'edge_k': 0.4615787416963454, 'edge_cap': 0.21941146906908232}.
[I 2025-08-29 22:01:41,598] Trial 207 finished with values: [-1000000000.0, 1000000000.0] and parameters: {'p_sma': 21, 'p_std': 9, 'p_atr': 23, 'p_adx': 18, 'rsi_period': 74, 'ema1': 24, 'ema2': 56, 'slip_atr_k': 0.24967866162758645, 'slip_spread_k': 0.5114035415186375, 'spread_hl_frac': 0.014926364832033799, 'bb_std_mult': 1.9089371224179636, 'rsi_os': 25, 'rsi_ob': 61, 'vol_spike': 0.1805612331375066, 'adx_thresh': 22.996209014486663, 'atr_min_pct': 0.012097430332981777, 'atr_max_pct': 0.1296643956772743, 'tp_mult': 1.6099922241981777, 'tsl_mult': 0.6348024083686691, 'strategy': 'breakout', 'time_stop': 116, 'use_sma': False, 'use_atr': False, 'use_adx': False, 'use_ema': False, 'use_spike': False, 'rsi_required': False, 'edge_k': 0.43882712066823837, 'edge_cap': 0.2236709067891694}.
[I 2025-08-29 22:01:41,782] Trial 208 finished with values: [-1000000000.0, 1000000000.0] and parameters: {'p_sma': 31, 'p_std': 9, 'p_atr': 23, 'p_adx': 13, 'rsi_period': 78, 'ema1': 16, 'ema2': 54, 'slip_atr_k': 0.24561846970710868, 'slip_spread_k': 0.515784368935223, 'spread_hl_frac': 0.01998229191757476, 'bb_std_mult': 2.0735957836212777, 'rsi_os': 25, 'rsi_ob': 61, 'vol_spike': 0.12976832209088401, 'adx_thresh': 23.232277084913903, 'atr_min_pct': 0.02182018345013099, 'atr_max_pct': 0.12805456005437843, 'tp_mult': 1.1113981947844296, 'tsl_mult': 0.6480769930245762, 'strategy': 'breakout', 'time_stop': 89, 'use_sma': False, 'use_atr': False, 'use_adx': False, 'use_ema': False, 'use_spike': False, 'rsi_required': False, 'edge_k': 0.42281823183296285, 'edge_cap': 0.788868610196321}.
[I 2025-08-29 22:01:41,917] Trial 211 finished with values: [-1000000000.0, 1000000000.0] and parameters: {'p_sma': 40, 'p_std': 26, 'p_atr': 16, 'p_adx': 13, 'rsi_period': 22, 'ema1': 16, 'ema2': 58, 'slip_atr_k': 0.0255479909207503, 'slip_spread_k': 0.17014324893561766, 'spread_hl_frac': 0.01716003744094931, 'bb_std_mult': 2.0687242822665644, 'rsi_os': 52, 'rsi_ob': 59, 'vol_spike': 0.16479391254493442, 'adx_thresh': 25.605029033520392, 'atr_min_pct': 0.02192170780511286, 'atr_max_pct': 0.08782354157641756, 'tp_mult': 1.093707530903328, 'tsl_mult': 0.9030973813987081, 'strategy': 'mean_reversion', 'time_stop': 90, 'use_sma': False, 'use_atr': False, 'use_adx': False, 'use_ema': False, 'use_spike': False, 'rsi_required': False, 'edge_k': 1.4340103364320798, 'edge_cap': 0.7782469639970248}.
[I 2025-08-29 22:01:41,967] Trial 213 finished with values: [-1000000000.0, 1000000000.0] and parameters: {'p_sma': 28, 'p_std': 26, 'p_atr': 21, 'p_adx': 22, 'rsi_period': 48, 'ema1': 23, 'ema2': 51, 'slip_atr_k': 0.06032423726626218, 'slip_spread_k': 0.7477748469336781, 'spread_hl_frac': 0.018676313328107024, 'bb_std_mult': 2.482443674959826, 'rsi_os': 27, 'rsi_ob': 94, 'vol_spike': 0.18035814097340752, 'adx_thresh': 25.11264454071909, 'atr_min_pct': 0.02933201696210052, 'atr_max_pct': 0.02081268922342308, 'tp_mult': 1.154867862277941, 'tsl_mult': 0.5405834808107247, 'strategy': 'mean_reversion', 'time_stop': 109, 'use_sma': False, 'use_atr': False, 'use_adx': False, 'use_ema': False, 'use_spike': False, 'rsi_required': False, 'edge_k': 0.5826113282567483, 'edge_cap': 0.7328711163710074}.
[I 2025-08-29 22:02:08,266] Trial 210 finished with values: [-0.05414202063770612, 0.054125307058131504] and parameters: {'p_sma': 27, 'p_std': 9, 'p_atr': 18, 'p_adx': 13, 'rsi_period': 22, 'ema1': 16, 'ema2': 56, 'slip_atr_k': 0.24373227787954782, 'slip_spread_k': 0.5063563993257395, 'spread_hl_frac': 0.017481233028574208, 'bb_std_mult': 2.073241253073326, 'rsi_os': 25, 'rsi_ob': 61, 'vol_spike': 0.058208141113035475, 'adx_thresh': 23.346521608952862, 'atr_min_pct': 0.0022209063755381456, 'atr_max_pct': 0.03911246570795592, 'tp_mult': 2.605773884841852, 'tsl_mult': 0.34536619504038657, 'strategy': 'mean_reversion', 'time_stop': 89, 'use_sma': False, 'use_atr': False, 'use_adx': False, 'use_ema': False, 'use_spike': False, 'rsi_required': False, 'edge_k': 0.039137497693146894, 'edge_cap': 0.7785728250920868}.
[I 2025-08-29 22:02:08,401] Trial 209 finished with values: [-1000000000.0, 1000000000.0] and parameters: {'p_sma': 40, 'p_std': 9, 'p_atr': 23, 'p_adx': 10, 'rsi_period': 22, 'ema1': 23, 'ema2': 56, 'slip_atr_k': 0.058400203638573414, 'slip_spread_k': 0.510483417714123, 'spread_hl_frac': 0.015052979006518969, 'bb_std_mult': 1.9094051350840793, 'rsi_os': 25, 'rsi_ob': 61, 'vol_spike': 0.18171471613183343, 'adx_thresh': 23.14854154714723, 'atr_min_pct': 0.011944198394965841, 'atr_max_pct': 0.020581697952138767, 'tp_mult': 1.608719394147786, 'tsl_mult': 0.35236538055642297, 'strategy': 'breakout', 'time_stop': 115, 'use_sma': False, 'use_atr': False, 'use_adx': False, 'use_ema': False, 'use_spike': False, 'rsi_required': False, 'edge_k': 0.040527754358381296, 'edge_cap': 0.7818897540650555}.
[I 2025-08-29 22:02:08,991] Trial 212 finished with values: [-0.012632350017075966, 0.012603705830150008] and parameters: {'p_sma': 6, 'p_std': 26, 'p_atr': 16, 'p_adx': 10, 'rsi_period': 22, 'ema1': 23, 'ema2': 58, 'slip_atr_k': 0.024537816840221868, 'slip_spread_k': 0.7499602904286669, 'spread_hl_frac': 0.01725709338266392, 'bb_std_mult': 1.973380655012187, 'rsi_os': 28, 'rsi_ob': 57, 'vol_spike': 0.2885373102484858, 'adx_thresh': 25.27682171832287, 'atr_min_pct': 0.0019823255050989107, 'atr_max_pct': 0.0242977919805048, 'tp_mult': 1.1612687144825409, 'tsl_mult': 0.5126174536150354, 'strategy': 'mean_reversion', 'time_stop': 6, 'use_sma': False, 'use_atr': False, 'use_adx': False, 'use_ema': False, 'use_spike': False, 'rsi_required': False, 'edge_k': 0.11241807192571662, 'edge_cap': 0.838588444092477}.
[I 2025-08-29 22:02:09,107] Trial 214 finished with values: [-1000000000.0, 1000000000.0] and parameters: {'p_sma': 6, 'p_std': 28, 'p_atr': 18, 'p_adx': 11, 'rsi_period': 84, 'ema1': 13, 'ema2': 56, 'slip_atr_k': 0.16433370134166697, 'slip_spread_k': 0.6107999908142323, 'spread_hl_frac': 0.049744865921138394, 'bb_std_mult': 2.3271430187299096, 'rsi_os': 28, 'rsi_ob': 72, 'vol_spike': 0.2884160297755634, 'adx_thresh': 25.27815869875908, 'atr_min_pct': 0.009730258837242368, 'atr_max_pct': 0.09755731151043921, 'tp_mult': 1.7659732570815498, 'tsl_mult': 0.56551139324282, 'strategy': 'breakout', 'time_stop': 113, 'use_sma': False, 'use_atr': False, 'use_adx': False, 'use_ema': False, 'use_spike': False, 'rsi_required': False, 'edge_k': 0.5146463409192432, 'edge_cap': 0.8378714475559876}.
[I 2025-08-29 22:02:35,864] Trial 215 finished with values: [-1000000000.0, 1000000000.0] and parameters: {'p_sma': 8, 'p_std': 24, 'p_atr': 19, 'p_adx': 10, 'rsi_period': 58, 'ema1': 23, 'ema2': 54, 'slip_atr_k': 0.19405576868543284, 'slip_spread_k': 0.3033487369535256, 'spread_hl_frac': 0.023136138868880482, 'bb_std_mult': 1.961858643406806, 'rsi_os': 28, 'rsi_ob': 53, 'vol_spike': 0.18356592862536683, 'adx_thresh': 25.626279592078056, 'atr_min_pct': 0.0029062674866324524, 'atr_max_pct': 0.09311391190076419, 'tp_mult': 2.1347708785097703, 'tsl_mult': 0.5098421548369019, 'strategy': 'breakout', 'time_stop': 57, 'use_sma': False, 'use_atr': False, 'use_adx': False, 'use_ema': False, 'use_spike': False, 'rsi_required': False, 'edge_k': 0.5080427269713422, 'edge_cap': 0.8350700435520857}.
