[I 2025-08-29 22:46:39,823] Trial 622 finished with values: [-0.00817294581249639, 0.008150269931219326] and parameters: {'p_sma': 6, 'p_std': 42, 'p_atr': 23, 'p_adx': 17, 'rsi_period': 18, 'ema1': 23, 'ema2': 49, 'slip_atr_k': 0.1261278453716579, 'slip_spread_k': 0.816464401537211, 'spread_hl_frac': 0.023050588478969083, 'bb_std_mult': 1.0379345109512432, 'rsi_os': 27, 'rsi_ob': 62, 'vol_spike': 0.10591745934710746, 'adx_thresh': 24.92247066142778, 'atr_min_pct': 0.0010805359134869793, 'atr_max_pct': 0.11558468430060306, 'tp_mult': 1.0814568564488978, 'tsl_mult': 0.7318155352684523, 'strategy': 'breakout', 'time_stop': 108, 'use_sma': False, 'use_atr': False, 'use_adx': False, 'use_ema': False, 'use_spike': False, 'rsi_required': False, 'edge_k': 0.6212051093497264, 'edge_cap': 0.6417864362329777}.
[I 2025-08-29 22:46:39,942] Trial 620 finished with values: [-1000000000.0, 1000000000.0] and parameters: {'p_sma': 7, 'p_std': 57, 'p_atr': 26, 'p_adx': 17, 'rsi_period': 17, 'ema1': 23, 'ema2': 44, 'slip_atr_k': 0.060225322117484145, 'slip_spread_k': 0.21084596806553535, 'spread_hl_frac': 0.01859905434412814, 'bb_std_mult': 2.064496270711984, 'rsi_os': 27, 'rsi_ob': 60, 'vol_spike': 0.14349895505967072, 'adx_thresh': 23.696529260861528, 'atr_min_pct': 0.01512732136447295, 'atr_max_pct': 0.0928024280760169, 'tp_mult': 1.1710372446408905, 'tsl_mult': 0.7310754493880465, 'strategy': 'breakout', 'time_stop': 107, 'use_sma': False, 'use_atr': False, 'use_adx': False, 'use_ema': False, 'use_spike': False, 'rsi_required': False, 'edge_k': 0.3639377645598886, 'edge_cap': 0.4568521116539651}.
[I 2025-08-29 22:46:40,056] Trial 621 finished with values: [-0.012838298827145822, 0.012816220738913876] and parameters: {'p_sma': 6, 'p_std': 43, 'p_atr': 26, 'p_adx': 17, 'rsi_period': 17, 'ema1': 23, 'ema2': 21, 'slip_atr_k': 0.1256845026121282, 'slip_spread_k': 0.7633565803659498, 'spread_hl_frac': 0.02375273425057649, 'bb_std_mult': 2.080970800380127, 'rsi_os': 29, 'rsi_ob': 58, 'vol_spike': 0.14511575937770688, 'adx_thresh': 23.66331107767965, 'atr_min_pct': 0.0008321231926249864, 'atr_max_pct': 0.09226447740063638, 'tp_mult': 2.0783119690278298, 'tsl_mult': 0.7319635706519019, 'strategy': 'breakout', 'time_stop': 104, 'use_sma': False, 'use_atr': False, 'use_adx': False, 'use_ema': False, 'use_spike': False, 'rsi_required': False, 'edge_k': 0.62761729280159, 'edge_cap': 0.6361214489430213}.
[I 2025-08-29 22:46:40,304] Trial 624 finished with values: [-1000000000.0, 1000000000.0] and parameters: {'p_sma': 7, 'p_std': 43, 'p_atr': 23, 'p_adx': 17, 'rsi_period': 17, 'ema1': 24, 'ema2': 47, 'slip_atr_k': 0.019518785709676318, 'slip_spread_k': 0.20169209928946202, 'spread_hl_frac': 0.018447981493276335, 'bb_std_mult': 2.0725512755085735, 'rsi_os': 23, 'rsi_ob': 45, 'vol_spike': 0.14458516793304477, 'adx_thresh': 25.70592634379591, 'atr_min_pct': 0.02044933417604156, 'atr_max_pct': 0.0979941818238917, 'tp_mult': 1.0878290601384393, 'tsl_mult': 0.73421991256095, 'strategy': 'mean_reversion', 'time_stop': 192, 'use_sma': False, 'use_atr': False, 'use_adx': False, 'use_ema': False, 'use_spike': False, 'rsi_required': False, 'edge_k': 0.47248698045775805, 'edge_cap': 0.7790602557609739}.
[I 2025-08-29 22:47:07,370] Trial 628 finished with values: [-0.02955927767164923, 0.02954381736395348] and parameters: {'p_sma': 55, 'p_std': 6, 'p_atr': 14, 'p_adx': 16, 'rsi_period': 22, 'ema1': 24, 'ema2': 31, 'slip_atr_k': 0.0009717415768927228, 'slip_spread_k': 0.38719170228746325, 'spread_hl_frac': 0.015758703502177063, 'bb_std_mult': 1.332339255350458, 'rsi_os': 35, 'rsi_ob': 59, 'vol_spike': 0.26704580438552095, 'adx_thresh': 25.990976304950543, 'atr_min_pct': 0.0024269482651766167, 'atr_max_pct': 0.10128624609458309, 'tp_mult': 1.80787033827865, 'tsl_mult': 0.6517042199588706, 'strategy': 'mean_reversion', 'time_stop': 92, 'use_sma': False, 'use_atr': False, 'use_adx': False, 'use_ema': False, 'use_spike': False, 'rsi_required': False, 'edge_k': 0.14687626711323065, 'edge_cap': 0.8432666804984533}.
[I 2025-08-29 22:47:07,525] Trial 627 finished with values: [-1000000000.0, 1000000000.0] and parameters: {'p_sma': 11, 'p_std': 23, 'p_atr': 23, 'p_adx': 16, 'rsi_period': 21, 'ema1': 12, 'ema2': 55, 'slip_atr_k': 0.005527279382477306, 'slip_spread_k': 0.8393066386582454, 'spread_hl_frac': 0.016041203318531167, 'bb_std_mult': 2.200103674462015, 'rsi_os': 26, 'rsi_ob': 59, 'vol_spike': 0.20135876041178255, 'adx_thresh': 25.893578619906833, 'atr_min_pct': 0.005243526066619302, 'atr_max_pct': 0.10150472107797841, 'tp_mult': 1.1014410483696444, 'tsl_mult': 0.24234138571731612, 'strategy': 'mean_reversion', 'time_stop': 92, 'use_sma': False, 'use_atr': False, 'use_adx': False, 'use_ema': False, 'use_spike': False, 'rsi_required': False, 'edge_k': 0.47665328614478525, 'edge_cap': 0.17826969435129603}.
[I 2025-08-29 22:47:07,667] Trial 626 finished with values: [-1000000000.0, 1000000000.0] and parameters: {'p_sma': 10, 'p_std': 17, 'p_atr': 24, 'p_adx': 16, 'rsi_period': 21, 'ema1': 28, 'ema2': 14, 'slip_atr_k': 0.020262275002341054, 'slip_spread_k': 0.8356738886618557, 'spread_hl_frac': 0.01810766650368903, 'bb_std_mult': 1.6358283521117816, 'rsi_os': 40, 'rsi_ob': 73, 'vol_spike': 0.06479167244899375, 'adx_thresh': 7.364993520476876, 'atr_min_pct': 0.00529305295072806, 'atr_max_pct': 0.10117591130888275, 'tp_mult': 1.1013957238189445, 'tsl_mult': 0.7502164401279227, 'strategy': 'mean_reversion', 'time_stop': 281, 'use_sma': False, 'use_atr': False, 'use_adx': False, 'use_ema': False, 'use_spike': False, 'rsi_required': False, 'edge_k': 0.4093855215347133, 'edge_cap': 0.8368847275993034}.
[I 2025-08-29 22:47:07,820] Trial 625 finished with values: [-0.007094506217366181, 0.007150868542944712] and parameters: {'p_sma': 19, 'p_std': 37, 'p_atr': 26, 'p_adx': 16, 'rsi_period': 21, 'ema1': 21, 'ema2': 55, 'slip_atr_k': 0.019209240498160442, 'slip_spread_k': 0.6870105884152322, 'spread_hl_frac': 0.01859678117527535, 'bb_std_mult': 1.9751878261483327, 'rsi_os': 23, 'rsi_ob': 67, 'vol_spike': 0.1426075213336821, 'adx_thresh': 25.78766395017514, 'atr_min_pct': 0.0026052573552118193, 'atr_max_pct': 0.10023447460412632, 'tp_mult': 1.1593544654587427, 'tsl_mult': 0.7439119797656618, 'strategy': 'mean_reversion', 'time_stop': 5, 'use_sma': False, 'use_atr': False, 'use_adx': False, 'use_ema': False, 'use_spike': False, 'rsi_required': False, 'edge_k': 0.4656795974697685, 'edge_cap': 0.865288031415403}.
[I 2025-08-29 22:47:34,915] Trial 629 finished with values: [-1000000000.0, 1000000000.0] and parameters: {'p_sma': 11, 'p_std': 47, 'p_atr': 22, 'p_adx': 29, 'rsi_period': 21, 'ema1': 10, 'ema2': 53, 'slip_atr_k': 0.008556523088884577, 'slip_spread_k': 0.8371861006403984, 'spread_hl_frac': 0.04990731423939511, 'bb_std_mult': 1.9683287093899282, 'rsi_os': 24, 'rsi_ob': 72, 'vol_spike': 0.13062283459496205, 'adx_thresh': 25.39529216376805, 'atr_min_pct': 0.027862331514332088, 'atr_max_pct': 0.047728471389521805, 'tp_mult': 1.0553562374125816, 'tsl_mult': 0.6714508766908132, 'strategy': 'breakout', 'time_stop': 283, 'use_sma': False, 'use_atr': False, 'use_adx': False, 'use_ema': False, 'use_spike': False, 'rsi_required': False, 'edge_k': 0.4769032210414037, 'edge_cap': 0.7564742367104683}.
[I 2025-08-29 22:47:35,472] Trial 630 finished with values: [-1000000000.0, 1000000000.0] and parameters: {'p_sma': 24, 'p_std': 24, 'p_atr': 22, 'p_adx': 25, 'rsi_period': 10, 'ema1': 11, 'ema2': 14, 'slip_atr_k': 0.20701665992033097, 'slip_spread_k': 0.6629303924726336, 'spread_hl_frac': 0.01793219208007903, 'bb_std_mult': 1.9829733184909444, 'rsi_os': 48, 'rsi_ob': 67, 'vol_spike': 0.184430816906463, 'adx_thresh': 30.984524930726145, 'atr_min_pct': 0.008722379870254366, 'atr_max_pct': 0.018189968941992464, 'tp_mult': 2.3941018731467336, 'tsl_mult': 0.7072431451350001, 'strategy': 'breakout', 'time_stop': 116, 'use_sma': False, 'use_atr': False, 'use_adx': False, 'use_ema': False, 'use_spike': False, 'rsi_required': False, 'edge_k': 1.3758816015182638, 'edge_cap': 0.8139679615460013}.
[I 2025-08-29 22:47:35,789] Trial 632 finished with values: [-1000000000.0, 1000000000.0] and parameters: {'p_sma': 8, 'p_std': 52, 'p_atr': 11, 'p_adx': 18, 'rsi_period': 52, 'ema1': 26, 'ema2': 18, 'slip_atr_k': 0.20881973640839616, 'slip_spread_k': 0.8003169489078951, 'spread_hl_frac': 0.019845327834260632, 'bb_std_mult': 2.6044908918711784, 'rsi_os': 9, 'rsi_ob': 82, 'vol_spike': 0.09444667607528692, 'adx_thresh': 33.28417460009493, 'atr_min_pct': 0.008571592154576363, 'atr_max_pct': 0.08885596893061518, 'tp_mult': 1.054809874968919, 'tsl_mult': 0.7065693185826076, 'strategy': 'breakout', 'time_stop': 117, 'use_sma': False, 'use_atr': False, 'use_adx': False, 'use_ema': False, 'use_spike': False, 'rsi_required': False, 'edge_k': 0.5480127713885303, 'edge_cap': 0.8103663925370429}.
[I 2025-08-29 22:47:35,888] Trial 631 finished with values: [-1000000000.0, 1000000000.0] and parameters: {'p_sma': 22, 'p_std': 24, 'p_atr': 22, 'p_adx': 28, 'rsi_period': 81, 'ema1': 25, 'ema2': 53, 'slip_atr_k': 0.015148890743053686, 'slip_spread_k': 0.8629658976760497, 'spread_hl_frac': 0.01960500236065625, 'bb_std_mult': 1.983686533839912, 'rsi_os': 24, 'rsi_ob': 60, 'vol_spike': 0.18215885737965912, 'adx_thresh': 30.841638720054217, 'atr_min_pct': 0.008575960994381241, 'atr_max_pct': 0.09629532911230305, 'tp_mult': 1.6199524701693326, 'tsl_mult': 0.6742534640916112, 'strategy': 'breakout', 'time_stop': 117, 'use_sma': False, 'use_atr': False, 'use_adx': False, 'use_ema': False, 'use_spike': False, 'rsi_required': False, 'edge_k': 0.5404317965372742, 'edge_cap': 0.8662062955946493}.
[I 2025-08-29 22:48:03,832] Trial 635 finished with values: [-0.008031747612943785, 0.007951812491882015] and parameters: {'p_sma': 13, 'p_std': 26, 'p_atr': 24, 'p_adx': 8, 'rsi_period': 43, 'ema1': 16, 'ema2': 51, 'slip_atr_k': 0.18632288453148835, 'slip_spread_k': 0.8600618499554314, 'spread_hl_frac': 0.045900755007296436, 'bb_std_mult': 2.140185778094562, 'rsi_os': 32, 'rsi_ob': 60, 'vol_spike': 0.17835544433587353, 'adx_thresh': 24.46288052972434, 'atr_min_pct': 0.003089268957863827, 'atr_max_pct': 0.13138300839841183, 'tp_mult': 2.965305951850914, 'tsl_mult': 0.7994781530805088, 'strategy': 'breakout', 'time_stop': 100, 'use_sma': False, 'use_atr': False, 'use_adx': False, 'use_ema': False, 'use_spike': False, 'rsi_required': False, 'edge_k': 1.7015311179789236, 'edge_cap': 0.7891815120446153}.
[I 2025-08-29 22:48:03,833] Trial 633 finished with values: [-1000000000.0, 1000000000.0] and parameters: {'p_sma': 8, 'p_std': 51, 'p_atr': 22, 'p_adx': 28, 'rsi_period': 43, 'ema1': 14, 'ema2': 50, 'slip_atr_k': 0.027024672805274375, 'slip_spread_k': 0.8653303104895401, 'spread_hl_frac': 0.04509944504080187, 'bb_std_mult': 2.1266356513132982, 'rsi_os': 46, 'rsi_ob': 60, 'vol_spike': 0.18145471818044098, 'adx_thresh': 18.938862932711384, 'atr_min_pct': 0.003248610316323381, 'atr_max_pct': 0.060149438403589384, 'tp_mult': 1.5235525881832623, 'tsl_mult': 0.5986588722333109, 'strategy': 'breakout', 'time_stop': 120, 'use_sma': False, 'use_atr': False, 'use_adx': False, 'use_ema': False, 'use_spike': False, 'rsi_required': False, 'edge_k': 0.5762362913553374, 'edge_cap': 0.53510024788101}.
[I 2025-08-29 22:48:03,988] Trial 634 finished with values: [-1000000000.0, 1000000000.0] and parameters: {'p_sma': 8, 'p_std': 19, 'p_atr': 23, 'p_adx': 8, 'rsi_period': 83, 'ema1': 16, 'ema2': 37, 'slip_atr_k': 0.014220059349932083, 'slip_spread_k': 0.8725364509485308, 'spread_hl_frac': 0.0025735920646408894, 'bb_std_mult': 2.6274774826347844, 'rsi_os': 26, 'rsi_ob': 60, 'vol_spike': 0.18060368223357923, 'adx_thresh': 24.455120437662885, 'atr_min_pct': 0.0030644850958732165, 'atr_max_pct': 0.09588959422259778, 'tp_mult': 2.2240028474796563, 'tsl_mult': 0.6079963201824601, 'strategy': 'breakout', 'time_stop': 129, 'use_sma': False, 'use_atr': False, 'use_adx': False, 'use_ema': False, 'use_spike': False, 'rsi_required': False, 'edge_k': 0.5450353998594115, 'edge_cap': 0.7257928276250052}.
[I 2025-08-29 22:48:04,124] Trial 636 finished with values: [-1000000000.0, 1000000000.0] and parameters: {'p_sma': 5, 'p_std': 26, 'p_atr': 24, 'p_adx': 15, 'rsi_period': 23, 'ema1': 29, 'ema2': 37, 'slip_atr_k': 0.029080548665679204, 'slip_spread_k': 0.1361942463372975, 'spread_hl_frac': 0.02086095750091605, 'bb_std_mult': 0.65836099513831, 'rsi_os': 26, 'rsi_ob': 51, 'vol_spike': 0.17705587916970078, 'adx_thresh': 24.56196936155479, 'atr_min_pct': 0.0030950788710291176, 'atr_max_pct': 0.13096663579290946, 'tp_mult': 1.1546609181886822, 'tsl_mult': 0.7943567315260909, 'strategy': 'breakout', 'time_stop': 97, 'use_sma': False, 'use_atr': False, 'use_adx': False, 'use_ema': False, 'use_spike': False, 'rsi_required': False, 'edge_k': 1.848006745133181, 'edge_cap': 0.7291965622173755}.
[I 2025-08-29 22:48:32,241] Trial 637 finished with values: [-1000000000.0, 1000000000.0] and parameters: {'p_sma': 5, 'p_std': 28, 'p_atr': 27, 'p_adx': 15, 'rsi_period': 23, 'ema1': 24, 'ema2': 55, 'slip_atr_k': 0.01385587416585226, 'slip_spread_k': 0.7824657900618324, 'spread_hl_frac': 0.014486233447973135, 'bb_std_mult': 3.5882727034981285, 'rsi_os': 20, 'rsi_ob': 83, 'vol_spike': 0.1714958720513499, 'adx_thresh': 31.65550566631535, 'atr_min_pct': 0.00409579114610139, 'atr_max_pct': 0.09515821437217424, 'tp_mult': 1.1469949594372624, 'tsl_mult': 0.775032307397738, 'strategy': 'breakout', 'time_stop': 130, 'use_sma': False, 'use_atr': False, 'use_adx': False, 'use_ema': False, 'use_spike': False, 'rsi_required': False, 'edge_k': 0.45116579599208567, 'edge_cap': 0.559611129104756}.
[I 2025-08-29 22:48:32,651] Trial 638 finished with values: [-1000000000.0, 1000000000.0] and parameters: {'p_sma': 5, 'p_std': 28, 'p_atr': 27, 'p_adx': 15, 'rsi_period': 24, 'ema1': 24, 'ema2': 56, 'slip_atr_k': 0.01337313605356184, 'slip_spread_k': 0.24692099955514435, 'spread_hl_frac': 0.006600388030014413, 'bb_std_mult': 2.0379738669651153, 'rsi_os': 25, 'rsi_ob': 61, 'vol_spike': 0.17253872927812514, 'adx_thresh': 31.57520528899041, 'atr_min_pct': 0.0017399864273851713, 'atr_max_pct': 0.095146709856308, 'tp_mult': 2.2160862050588386, 'tsl_mult': 0.99878177565575, 'strategy': 'breakout', 'time_stop': 15, 'use_sma': False, 'use_atr': False, 'use_adx': False, 'use_ema': False, 'use_spike': False, 'rsi_required': False, 'edge_k': 0.06516440244560429, 'edge_cap': 0.2288947066791599}.
[I 2025-08-29 22:48:32,653] Trial 640 finished with values: [-1000000000.0, 1000000000.0] and parameters: {'p_sma': 46, 'p_std': 28, 'p_atr': 21, 'p_adx': 23, 'rsi_period': 19, 'ema1': 24, 'ema2': 56, 'slip_atr_k': 0.04083891567764024, 'slip_spread_k': 0.7854570705304731, 'spread_hl_frac': 0.017405749684003092, 'bb_std_mult': 1.7554807280579732, 'rsi_os': 25, 'rsi_ob': 61, 'vol_spike': 0.19495896973967614, 'adx_thresh': 29.24819556947982, 'atr_min_pct': 0.014426726641842726, 'atr_max_pct': 0.09058957934825046, 'tp_mult': 2.005666178947755, 'tsl_mult': 0.995805926291008, 'strategy': 'breakout', 'time_stop': 108, 'use_sma': False, 'use_atr': False, 'use_adx': False, 'use_ema': False, 'use_spike': False, 'rsi_required': False, 'edge_k': 0.8878988383042346, 'edge_cap': 0.08783506467554869}.
[I 2025-08-29 22:48:32,905] Trial 639 finished with values: [-1000000000.0, 1000000000.0] and parameters: {'p_sma': 5, 'p_std': 45, 'p_atr': 23, 'p_adx': 15, 'rsi_period': 24, 'ema1': 24, 'ema2': 56, 'slip_atr_k': 0.24171160283167648, 'slip_spread_k': 0.7848617277607336, 'spread_hl_frac': 0.00017603459003579305, 'bb_std_mult': 0.6737437646586295, 'rsi_os': 26, 'rsi_ob': 64, 'vol_spike': 0.17171417786068882, 'adx_thresh': 10.920123384008994, 'atr_min_pct': 0.014248089571212525, 'atr_max_pct': 0.09167026795539107, 'tp_mult': 1.1485616099708713, 'tsl_mult': 0.0011177641429622187, 'strategy': 'breakout', 'time_stop': 100, 'use_sma': False, 'use_atr': False, 'use_adx': False, 'use_ema': False, 'use_spike': False, 'rsi_required': False, 'edge_k': 1.841579157398311, 'edge_cap': 0.9354032454945422}.
[I 2025-08-29 22:49:00,395] Trial 644 finished with values: [-0.01415797634036442, 0.014182780951826561] and parameters: {'p_sma': 7, 'p_std': 22, 'p_atr': 23, 'p_adx': 16, 'rsi_period': 15, 'ema1': 8, 'ema2': 19, 'slip_atr_k': 0.17792180403085728, 'slip_spread_k': 0.8141106112261162, 'spread_hl_frac': 0.009373413110115268, 'bb_std_mult': 1.8170264103889193, 'rsi_os': 45, 'rsi_ob': 59, 'vol_spike': 0.047536678671510804, 'adx_thresh': 26.660709596819174, 'atr_min_pct': 0.002335290734449962, 'atr_max_pct': 0.09813520966145116, 'tp_mult': 1.191694559390577, 'tsl_mult': 0.6899755035016194, 'strategy': 'mean_reversion', 'time_stop': 271, 'use_sma': False, 'use_atr': False, 'use_adx': False, 'use_ema': False, 'use_spike': False, 'rsi_required': False, 'edge_k': 0.39500152012388856, 'edge_cap': 0.49666081672141565}.
[I 2025-08-29 22:49:00,784] Trial 642 finished with values: [-1000000000.0, 1000000000.0] and parameters: {'p_sma': 7, 'p_std': 25, 'p_atr': 23, 'p_adx': 16, 'rsi_period': 38, 'ema1': 26, 'ema2': 12, 'slip_atr_k': 0.2235324615635352, 'slip_spread_k': 0.8109986327453871, 'spread_hl_frac': 0.017011001557645886, 'bb_std_mult': 3.4798814339698376, 'rsi_os': 21, 'rsi_ob': 59, 'vol_spike': 0.24199879646739914, 'adx_thresh': 34.84921646374504, 'atr_min_pct': 0.014506103343975762, 'atr_max_pct': 0.0914038067413397, 'tp_mult': 1.2103036776679912, 'tsl_mult': 0.8827528645526779, 'strategy': 'mean_reversion', 'time_stop': 109, 'use_sma': False, 'use_atr': False, 'use_adx': False, 'use_ema': False, 'use_spike': False, 'rsi_required': False, 'edge_k': 0.6764988734104518, 'edge_cap': 0.9678163370622566}.
[I 2025-08-29 22:49:01,033] Trial 641 finished with values: [-0.02907025064747626, 0.029065841024467787] and parameters: {'p_sma': 29, 'p_std': 22, 'p_atr': 23, 'p_adx': 16, 'rsi_period': 14, 'ema1': 26, 'ema2': 58, 'slip_atr_k': 0.023094989600818835, 'slip_spread_k': 0.8075873644324087, 'spread_hl_frac': 0.017542436218380898, 'bb_std_mult': 2.515310866633051, 'rsi_os': 25, 'rsi_ob': 61, 'vol_spike': 0.19215931582705123, 'adx_thresh': 8.234494052576633, 'atr_min_pct': 0.0016707256415744952, 'atr_max_pct': 0.09143296303811502, 'tp_mult': 1.227683886719206, 'tsl_mult': 0.7527353023362883, 'strategy': 'breakout', 'time_stop': 16, 'use_sma': False, 'use_atr': False, 'use_adx': False, 'use_ema': False, 'use_spike': False, 'rsi_required': False, 'edge_k': 0.8562265609485484, 'edge_cap': 0.7565887161207474}.
[I 2025-08-29 22:49:01,130] Trial 643 finished with values: [-1000000000.0, 1000000000.0] and parameters: {'p_sma': 33, 'p_std': 22, 'p_atr': 15, 'p_adx': 21, 'rsi_period': 15, 'ema1': 25, 'ema2': 33, 'slip_atr_k': 0.022823604106701645, 'slip_spread_k': 0.7304770099842004, 'spread_hl_frac': 0.042042276260136166, 'bb_std_mult': 1.9272516428273492, 'rsi_os': 27, 'rsi_ob': 79, 'vol_spike': 0.16305632456473307, 'adx_thresh': 26.643140967262006, 'atr_min_pct': 0.02510396070996173, 'atr_max_pct': 0.08671541674032875, 'tp_mult': 1.0108995051112224, 'tsl_mult': 0.8887716123575677, 'strategy': 'mean_reversion', 'time_stop': 168, 'use_sma': False, 'use_atr': False, 'use_adx': False, 'use_ema': False, 'use_spike': False, 'rsi_required': False, 'edge_k': 0.9538393140048564, 'edge_cap': 0.7663588396953989}.
[I 2025-08-29 22:49:01,411] Trial 648 finished with values: [-1000000000.0, 1000000000.0] and parameters: {'p_sma': 9, 'p_std': 24, 'p_atr': 24, 'p_adx': 30, 'rsi_period': 19, 'ema1': 9, 'ema2': 53, 'slip_atr_k': 0.008276814205197451, 'slip_spread_k': 0.9510867980966322, 'spread_hl_frac': 0.01618301393647792, 'bb_std_mult': 2.2048390618461395, 'rsi_os': 28, 'rsi_ob': 57, 'vol_spike': 0.03752702624555057, 'adx_thresh': 25.22946504061473, 'atr_min_pct': 0.02926176287529926, 'atr_max_pct': 0.010129087224498803, 'tp_mult': 1.1000480458950301, 'tsl_mult': 0.529683913421794, 'strategy': 'breakout', 'time_stop': 123, 'use_sma': False, 'use_atr': False, 'use_adx': False, 'use_ema': False, 'use_spike': False, 'rsi_required': False, 'edge_k': 0.48715961580713385, 'edge_cap': 0.1436462902770863}.
[I 2025-08-29 22:49:27,966] Trial 646 finished with values: [-0.007878977343041882, 0.00785041436939124] and parameters: {'p_sma': 9, 'p_std': 24, 'p_atr': 19, 'p_adx': 19, 'rsi_period': 61, 'ema1': 17, 'ema2': 52, 'slip_atr_k': 0.24985612425308132, 'slip_spread_k': 0.32198735887746066, 'spread_hl_frac': 0.01774915770681766, 'bb_std_mult': 2.178374549368381, 'rsi_os': 12, 'rsi_ob': 76, 'vol_spike': 0.18834528998016434, 'adx_thresh': 16.76649082198773, 'atr_min_pct': 0.0005596218105532247, 'atr_max_pct': 0.08498125032903542, 'tp_mult': 1.0996196661244098, 'tsl_mult': 0.4021111309081979, 'strategy': 'breakout', 'time_stop': 81, 'use_sma': False, 'use_atr': False, 'use_adx': False, 'use_ema': False, 'use_spike': False, 'rsi_required': False, 'edge_k': 0.5059352355739334, 'edge_cap': 0.7597172342502623}.
[I 2025-08-29 22:49:28,940] Trial 645 finished with values: [-0.004635805677367211, 0.004838458711106363] and parameters: {'p_sma': 9, 'p_std': 25, 'p_atr': 24, 'p_adx': 21, 'rsi_period': 38, 'ema1': 26, 'ema2': 12, 'slip_atr_k': 0.022956443614457964, 'slip_spread_k': 0.8326187318850864, 'spread_hl_frac': 0.04794599460172191, 'bb_std_mult': 1.9265157206444892, 'rsi_os': 21, 'rsi_ob': 54, 'vol_spike': 0.2925823417020614, 'adx_thresh': 20.2403376549991, 'atr_min_pct': 0.0005303928994724971, 'atr_max_pct': 0.08545811434692428, 'tp_mult': 1.011922771861491, 'tsl_mult': 0.03043194003802474, 'strategy': 'breakout', 'time_stop': 156, 'use_sma': False, 'use_atr': False, 'use_adx': False, 'use_ema': False, 'use_spike': False, 'rsi_required': False, 'edge_k': 0.5938332732923297, 'edge_cap': 0.7832043938870549}.
