[I 2025-08-29 22:43:25,804] Trial 595 finished with values: [-1000000000.0, 1000000000.0] and parameters: {'p_sma': 9, 'p_std': 46, 'p_atr': 10, 'p_adx': 15, 'rsi_period': 25, 'ema1': 24, 'ema2': 53, 'slip_atr_k': 0.033704292207266874, 'slip_spread_k': 0.7646252895919646, 'spread_hl_frac': 0.017639891424506348, 'bb_std_mult': 3.2155007012567944, 'rsi_os': 19, 'rsi_ob': 59, 'vol_spike': 0.18544768914861268, 'adx_thresh': 26.230946623924726, 'atr_min_pct': 0.01737668852375831, 'atr_max_pct': 0.09989523478724588, 'tp_mult': 1.1466622529778734, 'tsl_mult': 0.7052199019305384, 'strategy': 'breakout', 'time_stop': 89, 'use_sma': False, 'use_atr': False, 'use_adx': False, 'use_ema': False, 'use_spike': False, 'rsi_required': False, 'edge_k': 0.5370027296021923, 'edge_cap': 0.827905480464235}.
[I 2025-08-29 22:43:25,804] Trial 592 finished with values: [-1000000000.0, 1000000000.0] and parameters: {'p_sma': 8, 'p_std': 38, 'p_atr': 22, 'p_adx': 14, 'rsi_period': 16, 'ema1': 24, 'ema2': 53, 'slip_atr_k': 0.03454541049112189, 'slip_spread_k': 0.41932255202072594, 'spread_hl_frac': 0.01482533366388745, 'bb_std_mult': 2.3250337036279793, 'rsi_os': 17, 'rsi_ob': 61, 'vol_spike': 0.17935105062997653, 'adx_thresh': 11.60610406038089, 'atr_min_pct': 0.028376794003047434, 'atr_max_pct': 0.0994290913203152, 'tp_mult': 1.2043973890455169, 'tsl_mult': 0.8557789904301518, 'strategy': 'breakout', 'time_stop': 117, 'use_sma': False, 'use_atr': False, 'use_adx': False, 'use_ema': False, 'use_spike': False, 'rsi_required': False, 'edge_k': 1.4741762465167372, 'edge_cap': 0.7931035057566611}.
[I 2025-08-29 22:43:53,019] Trial 598 finished with values: [-1000000000.0, 1000000000.0] and parameters: {'p_sma': 27, 'p_std': 27, 'p_atr': 24, 'p_adx': 18, 'rsi_period': 79, 'ema1': 25, 'ema2': 55, 'slip_atr_k': 0.08064022196011408, 'slip_spread_k': 0.23221067719878657, 'spread_hl_frac': 0.043685911146984946, 'bb_std_mult': 1.9532113221485345, 'rsi_os': 27, 'rsi_ob': 58, 'vol_spike': 0.16663881874174255, 'adx_thresh': 24.104304327608247, 'atr_min_pct': 0.023127589571933796, 'atr_max_pct': 0.09469620039524317, 'tp_mult': 2.5463943545939705, 'tsl_mult': 0.7966613628076267, 'strategy': 'mean_reversion', 'time_stop': 71, 'use_sma': False, 'use_atr': False, 'use_adx': False, 'use_ema': False, 'use_spike': False, 'rsi_required': False, 'edge_k': 1.254903733535664, 'edge_cap': 0.5116917690448176}.
[I 2025-08-29 22:43:53,518] Trial 599 finished with values: [-1000000000.0, 1000000000.0] and parameters: {'p_sma': 14, 'p_std': 27, 'p_atr': 24, 'p_adx': 20, 'rsi_period': 15, 'ema1': 21, 'ema2': 55, 'slip_atr_k': 0.24578747700338507, 'slip_spread_k': 0.36424482830319216, 'spread_hl_frac': 0.047468795777164265, 'bb_std_mult': 2.1261553266192976, 'rsi_os': 26, 'rsi_ob': 57, 'vol_spike': 0.16967950539491927, 'adx_thresh': 24.18449353447737, 'atr_min_pct': 0.024165809433973354, 'atr_max_pct': 0.03148756361752666, 'tp_mult': 1.0106305860406017, 'tsl_mult': 0.8156469765141914, 'strategy': 'mean_reversion', 'time_stop': 53, 'use_sma': False, 'use_atr': False, 'use_adx': False, 'use_ema': False, 'use_spike': False, 'rsi_required': False, 'edge_k': 0.4415002065799256, 'edge_cap': 0.70865734710216}.
[I 2025-08-29 22:43:53,780] Trial 597 finished with values: [-0.022908466258303783, 0.02289043980034053] and parameters: {'p_sma': 6, 'p_std': 27, 'p_atr': 24, 'p_adx': 20, 'rsi_period': 35, 'ema1': 27, 'ema2': 55, 'slip_atr_k': 0.07867910117850521, 'slip_spread_k': 0.10248731615847778, 'spread_hl_frac': 0.018586019190304663, 'bb_std_mult': 1.9484626622917862, 'rsi_os': 47, 'rsi_ob': 59, 'vol_spike': 0.16992007983982124, 'adx_thresh': 15.321538959958382, 'atr_min_pct': 0.0007903760272871473, 'atr_max_pct': 0.06787352797406326, 'tp_mult': 2.184566411132539, 'tsl_mult': 0.3378576089799619, 'strategy': 'mean_reversion', 'time_stop': 57, 'use_sma': False, 'use_atr': False, 'use_adx': False, 'use_ema': False, 'use_spike': False, 'rsi_required': False, 'edge_k': 0.4388556668325967, 'edge_cap': 0.744741671308406}.
[I 2025-08-29 22:43:53,886] Trial 596 finished with values: [-1000000000.0, 1000000000.0] and parameters: {'p_sma': 10, 'p_std': 27, 'p_atr': 24, 'p_adx': 18, 'rsi_period': 16, 'ema1': 27, 'ema2': 53, 'slip_atr_k': 0.0749996967485609, 'slip_spread_k': 0.7957482818399939, 'spread_hl_frac': 0.03856802431148807, 'bb_std_mult': 1.9642407126371335, 'rsi_os': 26, 'rsi_ob': 84, 'vol_spike': 0.1669472933942713, 'adx_thresh': 15.390019843219594, 'atr_min_pct': 0.018330988087546962, 'atr_max_pct': 0.0945908874034225, 'tp_mult': 1.0499080277601294, 'tsl_mult': 0.858354493594434, 'strategy': 'breakout', 'time_stop': 58, 'use_sma': False, 'use_atr': False, 'use_adx': False, 'use_ema': False, 'use_spike': False, 'rsi_required': False, 'edge_k': 0.4421414818563002, 'edge_cap': 0.27419913489834924}.
[I 2025-08-29 22:44:20,810] Trial 603 finished with values: [-0.0028809584142778233, 0.0031408492351890013] and parameters: {'p_sma': 7, 'p_std': 25, 'p_atr': 23, 'p_adx': 21, 'rsi_period': 20, 'ema1': 5, 'ema2': 12, 'slip_atr_k': 0.00623078224670099, 'slip_spread_k': 0.8105064302472808, 'spread_hl_frac': 0.01826544539481253, 'bb_std_mult': 2.0942998159611745, 'rsi_os': 27, 'rsi_ob': 65, 'vol_spike': 0.18857941922668858, 'adx_thresh': 24.939973647731783, 'atr_min_pct': 0.001632147810281033, 'atr_max_pct': 0.10307987139356861, 'tp_mult': 1.8855979297433667, 'tsl_mult': 0.7427375701578921, 'strategy': 'breakout', 'time_stop': 123, 'use_sma': False, 'use_atr': False, 'use_adx': False, 'use_ema': False, 'use_spike': False, 'rsi_required': False, 'edge_k': 0.22536671261355912, 'edge_cap': 0.757233671122398}.
[I 2025-08-29 22:44:21,275] Trial 601 finished with values: [-0.026453864801878058, 0.026434761410001294] and parameters: {'p_sma': 54, 'p_std': 25, 'p_atr': 8, 'p_adx': 24, 'rsi_period': 20, 'ema1': 5, 'ema2': 24, 'slip_atr_k': 0.004008759582830122, 'slip_spread_k': 0.11118710416131339, 'spread_hl_frac': 0.01884098153475013, 'bb_std_mult': 3.109201529323561, 'rsi_os': 25, 'rsi_ob': 65, 'vol_spike': 0.22239131768959847, 'adx_thresh': 5.040014711706155, 'atr_min_pct': 0.0013779125474901966, 'atr_max_pct': 0.06836432905304965, 'tp_mult': 1.882700290970058, 'tsl_mult': 0.7407243483229774, 'strategy': 'breakout', 'time_stop': 114, 'use_sma': False, 'use_atr': False, 'use_adx': False, 'use_ema': False, 'use_spike': False, 'rsi_required': False, 'edge_k': 0.5866466143638147, 'edge_cap': 0.35266705579841057}.
[I 2025-08-29 22:44:21,276] Trial 602 finished with values: [-1000000000.0, 1000000000.0] and parameters: {'p_sma': 7, 'p_std': 25, 'p_atr': 23, 'p_adx': 21, 'rsi_period': 20, 'ema1': 5, 'ema2': 58, 'slip_atr_k': 0.00813875402873639, 'slip_spread_k': 0.7964046891718456, 'spread_hl_frac': 0.013034421221809263, 'bb_std_mult': 2.969057782917934, 'rsi_os': 25, 'rsi_ob': 65, 'vol_spike': 0.01685730820878717, 'adx_thresh': 24.706296684325512, 'atr_min_pct': 0.003472173803691964, 'atr_max_pct': 0.050432278133717395, 'tp_mult': 1.0790243764179814, 'tsl_mult': 0.7389478780916674, 'strategy': 'breakout', 'time_stop': 123, 'use_sma': False, 'use_atr': False, 'use_adx': False, 'use_ema': False, 'use_spike': False, 'rsi_required': False, 'edge_k': 0.5585781758376256, 'edge_cap': 0.7560855766168866}.
[I 2025-08-29 22:44:21,474] Trial 600 finished with values: [-1000000000.0, 1000000000.0] and parameters: {'p_sma': 6, 'p_std': 23, 'p_atr': 8, 'p_adx': 15, 'rsi_period': 58, 'ema1': 26, 'ema2': 24, 'slip_atr_k': 0.06592507605489659, 'slip_spread_k': 0.7986003525058297, 'spread_hl_frac': 0.03858827020196588, 'bb_std_mult': 2.1086537765523454, 'rsi_os': 26, 'rsi_ob': 57, 'vol_spike': 0.18957000140050823, 'adx_thresh': 15.435129967106874, 'atr_min_pct': 0.018382682782949935, 'atr_max_pct': 0.09476302075614076, 'tp_mult': 1.7672478021753, 'tsl_mult': 0.11354654637132078, 'strategy': 'breakout', 'time_stop': 113, 'use_sma': False, 'use_atr': False, 'use_adx': False, 'use_ema': False, 'use_spike': False, 'rsi_required': False, 'edge_k': 0.4437059229216067, 'edge_cap': 0.7033400742376997}.
[I 2025-08-29 22:44:48,621] Trial 606 finished with values: [-1000000000.0, 1000000000.0] and parameters: {'p_sma': 41, 'p_std': 23, 'p_atr': 15, 'p_adx': 17, 'rsi_period': 47, 'ema1': 23, 'ema2': 35, 'slip_atr_k': 0.01675687319049069, 'slip_spread_k': 0.8223684790354825, 'spread_hl_frac': 0.030263504712449506, 'bb_std_mult': 2.085114856431268, 'rsi_os': 27, 'rsi_ob': 59, 'vol_spike': 0.19011816869054393, 'adx_thresh': 26.071566316740842, 'atr_min_pct': 0.010180056207801123, 'atr_max_pct': 0.14096423170211242, 'tp_mult': 1.9429585796425695, 'tsl_mult': 0.7654208684908803, 'strategy': 'breakout', 'time_stop': 110, 'use_sma': False, 'use_atr': False, 'use_adx': False, 'use_ema': False, 'use_spike': False, 'rsi_required': False, 'edge_k': 0.2398232616980681, 'edge_cap': 0.8211498910449306}.
[I 2025-08-29 22:44:48,884] Trial 607 finished with values: [-1000000000.0, 1000000000.0] and parameters: {'p_sma': 51, 'p_std': 59, 'p_atr': 20, 'p_adx': 13, 'rsi_period': 13, 'ema1': 23, 'ema2': 57, 'slip_atr_k': 0.017123787485523078, 'slip_spread_k': 0.7408787196967995, 'spread_hl_frac': 0.01768181941210724, 'bb_std_mult': 1.4603388672575162, 'rsi_os': 28, 'rsi_ob': 50, 'vol_spike': 0.05685767267960577, 'adx_thresh': 19.384270453666968, 'atr_min_pct': 0.005882706772722058, 'atr_max_pct': 0.10347590971144098, 'tp_mult': 2.4545414928202045, 'tsl_mult': 0.7664337288998335, 'strategy': 'breakout', 'time_stop': 101, 'use_sma': False, 'use_atr': False, 'use_adx': False, 'use_ema': False, 'use_spike': False, 'rsi_required': False, 'edge_k': 0.5270482972532793, 'edge_cap': 0.8211264494534787}.
[I 2025-08-29 22:44:49,134] Trial 605 finished with values: [-0.008144551569732927, 0.008120339217403091] and parameters: {'p_sma': 41, 'p_std': 15, 'p_atr': 20, 'p_adx': 17, 'rsi_period': 58, 'ema1': 20, 'ema2': 57, 'slip_atr_k': 0.017317661397392575, 'slip_spread_k': 0.06472964842124312, 'spread_hl_frac': 0.004147912186755691, 'bb_std_mult': 1.4349048040457886, 'rsi_os': 27, 'rsi_ob': 59, 'vol_spike': 0.05623314855417587, 'adx_thresh': 26.172948468714146, 'atr_min_pct': 0.0019102355315923046, 'atr_max_pct': 0.10324766189330503, 'tp_mult': 1.9528176772051797, 'tsl_mult': 0.7615332376625279, 'strategy': 'breakout', 'time_stop': 109, 'use_sma': False, 'use_atr': False, 'use_adx': False, 'use_ema': False, 'use_spike': False, 'rsi_required': False, 'edge_k': 1.3453369979065846, 'edge_cap': 0.8237055209525799}.
[I 2025-08-29 22:44:49,248] Trial 604 finished with values: [-1000000000.0, 1000000000.0] and parameters: {'p_sma': 7, 'p_std': 15, 'p_atr': 8, 'p_adx': 24, 'rsi_period': 48, 'ema1': 23, 'ema2': 24, 'slip_atr_k': 0.21671991995349188, 'slip_spread_k': 0.8207311635536174, 'spread_hl_frac': 0.018344589096905242, 'bb_std_mult': 2.9839601484194875, 'rsi_os': 15, 'rsi_ob': 87, 'vol_spike': 0.0172406422327068, 'adx_thresh': 24.690705463363393, 'atr_min_pct': 0.010014305569743684, 'atr_max_pct': 0.12679967904212291, 'tp_mult': 2.4436429218661826, 'tsl_mult': 0.913629752133015, 'strategy': 'breakout', 'time_stop': 113, 'use_sma': False, 'use_atr': False, 'use_adx': False, 'use_ema': False, 'use_spike': False, 'rsi_required': False, 'edge_k': 1.539484061959234, 'edge_cap': 0.8210300160510282}.
[I 2025-08-29 22:45:16,202] Trial 609 finished with values: [-1000000000.0, 1000000000.0] and parameters: {'p_sma': 37, 'p_std': 32, 'p_atr': 9, 'p_adx': 16, 'rsi_period': 77, 'ema1': 24, 'ema2': 30, 'slip_atr_k': 0.2177674098654959, 'slip_spread_k': 0.8554144409648748, 'spread_hl_frac': 0.03998744534519194, 'bb_std_mult': 2.0283909244349836, 'rsi_os': 13, 'rsi_ob': 55, 'vol_spike': 0.18388494960350524, 'adx_thresh': 24.96355919424808, 'atr_min_pct': 0.00950400302467744, 'atr_max_pct': 0.013742037435936258, 'tp_mult': 2.6258208414596362, 'tsl_mult': 0.9201453023480783, 'strategy': 'mean_reversion', 'time_stop': 120, 'use_sma': False, 'use_atr': False, 'use_adx': False, 'use_ema': False, 'use_spike': False, 'rsi_required': False, 'edge_k': 0.653916578450879, 'edge_cap': 0.8454379942392645}.
[I 2025-08-29 22:45:16,214] Trial 608 finished with values: [-0.0472618710523699, 0.04724698085990732] and parameters: {'p_sma': 39, 'p_std': 25, 'p_atr': 9, 'p_adx': 16, 'rsi_period': 24, 'ema1': 24, 'ema2': 52, 'slip_atr_k': 0.026260617605170622, 'slip_spread_k': 0.059687336689343506, 'spread_hl_frac': 0.02209836481351923, 'bb_std_mult': 1.8957772367866723, 'rsi_os': 24, 'rsi_ob': 61, 'vol_spike': 0.18268758251026743, 'adx_thresh': 21.1012078025234, 'atr_min_pct': 0.0016364880856059687, 'atr_max_pct': 0.014681564801169195, 'tp_mult': 2.3342811056464043, 'tsl_mult': 0.7114078154476721, 'strategy': 'mean_reversion', 'time_stop': 93, 'use_sma': False, 'use_atr': False, 'use_adx': False, 'use_ema': False, 'use_spike': False, 'rsi_required': False, 'edge_k': 0.9882509303572075, 'edge_cap': 0.7703677342125825}.
[I 2025-08-29 22:45:16,520] Trial 611 finished with values: [-0.02378231576333678, 0.023763054816309834] and parameters: {'p_sma': 25, 'p_std': 25, 'p_atr': 7, 'p_adx': 16, 'rsi_period': 77, 'ema1': 6, 'ema2': 54, 'slip_atr_k': 0.02389809554332147, 'slip_spread_k': 0.8555893052761708, 'spread_hl_frac': 0.020860881482476005, 'bb_std_mult': 1.8818516262634555, 'rsi_os': 37, 'rsi_ob': 55, 'vol_spike': 0.15137850861524985, 'adx_thresh': 25.568620237972844, 'atr_min_pct': 0.0016953798059574012, 'atr_max_pct': 0.09790871126865673, 'tp_mult': 2.8684104471163785, 'tsl_mult': 0.6940948589082873, 'strategy': 'mean_reversion', 'time_stop': 26, 'use_sma': False, 'use_atr': False, 'use_adx': False, 'use_ema': False, 'use_spike': False, 'rsi_required': False, 'edge_k': 1.0893302091953034, 'edge_cap': 0.41709869325312043}.
[I 2025-08-29 22:45:16,521] Trial 610 finished with values: [-1000000000.0, 1000000000.0] and parameters: {'p_sma': 8, 'p_std': 29, 'p_atr': 9, 'p_adx': 16, 'rsi_period': 23, 'ema1': 25, 'ema2': 52, 'slip_atr_k': 0.02605892985521257, 'slip_spread_k': 0.8222756447171349, 'spread_hl_frac': 0.03995522274654783, 'bb_std_mult': 1.8844295204214505, 'rsi_os': 30, 'rsi_ob': 61, 'vol_spike': 0.15233811893339091, 'adx_thresh': 21.027372076649684, 'atr_min_pct': 0.003490408788996917, 'atr_max_pct': 0.08357725557158077, 'tp_mult': 1.1315689466316465, 'tsl_mult': 0.48279370340240646, 'strategy': 'mean_reversion', 'time_stop': 28, 'use_sma': False, 'use_atr': False, 'use_adx': False, 'use_ema': False, 'use_spike': False, 'rsi_required': False, 'edge_k': 1.6368220119256183, 'edge_cap': 0.7669395278612641}.
[I 2025-08-29 22:45:42,813] Trial 612 finished with values: [-0.009452188652774529, 0.009553654881755132] and parameters: {'p_sma': 45, 'p_std': 25, 'p_atr': 17, 'p_adx': 12, 'rsi_period': 22, 'ema1': 24, 'ema2': 54, 'slip_atr_k': 0.10420501398645746, 'slip_spread_k': 0.8483432100540687, 'spread_hl_frac': 0.017114392713065633, 'bb_std_mult': 2.1750619561541025, 'rsi_os': 25, 'rsi_ob': 90, 'vol_spike': 0.07904222840570643, 'adx_thresh': 25.63605913727649, 'atr_min_pct': 0.003459425298997903, 'atr_max_pct': 0.023275955238475303, 'tp_mult': 1.1253447156532705, 'tsl_mult': 0.6841845514638664, 'strategy': 'breakout', 'time_stop': 28, 'use_sma': False, 'use_atr': False, 'use_adx': False, 'use_ema': False, 'use_spike': False, 'rsi_required': False, 'edge_k': 1.9648437701238104, 'edge_cap': 0.41030493061726464}.
[I 2025-08-29 22:45:43,561] Trial 615 finished with values: [-1000000000.0, 1000000000.0] and parameters: {'p_sma': 31, 'p_std': 35, 'p_atr': 13, 'p_adx': 11, 'rsi_period': 20, 'ema1': 7, 'ema2': 41, 'slip_atr_k': 0.1157431791229847, 'slip_spread_k': 0.8995481673337176, 'spread_hl_frac': 0.01689561993035044, 'bb_std_mult': 0.7783496828123406, 'rsi_os': 25, 'rsi_ob': 63, 'vol_spike': 0.17518145718177855, 'adx_thresh': 26.640318681667512, 'atr_min_pct': 0.026964574159281857, 'atr_max_pct': 0.08964354972007368, 'tp_mult': 1.3118311402712899, 'tsl_mult': 0.7131897806719306, 'strategy': 'breakout', 'time_stop': 99, 'use_sma': False, 'use_atr': False, 'use_adx': False, 'use_ema': False, 'use_spike': False, 'rsi_required': False, 'edge_k': 0.5108691097085605, 'edge_cap': 0.8046069373774517}.
[I 2025-08-29 22:45:43,806] Trial 613 finished with values: [-1000000000.0, 1000000000.0] and parameters: {'p_sma': 48, 'p_std': 29, 'p_atr': 12, 'p_adx': 12, 'rsi_period': 66, 'ema1': 6, 'ema2': 54, 'slip_atr_k': 0.22867921855405432, 'slip_spread_k': 0.9008213565822667, 'spread_hl_frac': 0.016666884316689636, 'bb_std_mult': 0.7364203700361467, 'rsi_os': 16, 'rsi_ob': 63, 'vol_spike': 0.11761228128202525, 'adx_thresh': 14.408810044867673, 'atr_min_pct': 0.019051738782347404, 'atr_max_pct': 0.09772030588000065, 'tp_mult': 1.1283928957792548, 'tsl_mult': 0.6956570994856728, 'strategy': 'breakout', 'time_stop': 79, 'use_sma': False, 'use_atr': False, 'use_adx': False, 'use_ema': False, 'use_spike': False, 'rsi_required': False, 'edge_k': 0.5182491190233465, 'edge_cap': 0.7392126988601984}.
[I 2025-08-29 22:45:44,006] Trial 614 finished with values: [-1000000000.0, 1000000000.0] and parameters: {'p_sma': 9, 'p_std': 8, 'p_atr': 13, 'p_adx': 11, 'rsi_period': 19, 'ema1': 7, 'ema2': 54, 'slip_atr_k': 0.011645719280248022, 'slip_spread_k': 0.9972779248892786, 'spread_hl_frac': 0.016866753214074867, 'bb_std_mult': 0.7989024898509367, 'rsi_os': 38, 'rsi_ob': 93, 'vol_spike': 0.07786170631432596, 'adx_thresh': 27.763059937776116, 'atr_min_pct': 0.012346103132209966, 'atr_max_pct': 0.040269313773902124, 'tp_mult': 1.2985627709377663, 'tsl_mult': 0.17618627258286318, 'strategy': 'breakout', 'time_stop': 216, 'use_sma': False, 'use_atr': False, 'use_adx': False, 'use_ema': False, 'use_spike': False, 'rsi_required': False, 'edge_k': 0.5171025904002409, 'edge_cap': 0.801932971085619}.
[I 2025-08-29 22:46:11,476] Trial 618 finished with values: [-1000000000.0, 1000000000.0] and parameters: {'p_sma': 9, 'p_std': 54, 'p_atr': 23, 'p_adx': 15, 'rsi_period': 54, 'ema1': 25, 'ema2': 10, 'slip_atr_k': 0.010787516459572873, 'slip_spread_k': 0.4750961628675277, 'spread_hl_frac': 0.03553426929000297, 'bb_std_mult': 3.387688717825253, 'rsi_os': 28, 'rsi_ob': 53, 'vol_spike': 0.033483793857382455, 'adx_thresh': 12.875888764364369, 'atr_min_pct': 0.0024966364348894296, 'atr_max_pct': 0.07705107177769774, 'tp_mult': 1.2043261612568774, 'tsl_mult': 0.2847150596251131, 'strategy': 'breakout', 'time_stop': 127, 'use_sma': False, 'use_atr': False, 'use_adx': False, 'use_ema': False, 'use_spike': False, 'rsi_required': False, 'edge_k': 0.557580011799757, 'edge_cap': 0.3777047802781163}.
[I 2025-08-29 22:46:11,965] Trial 619 finished with values: [-1000000000.0, 1000000000.0] and parameters: {'p_sma': 18, 'p_std': 21, 'p_atr': 22, 'p_adx': 15, 'rsi_period': 40, 'ema1': 9, 'ema2': 12, 'slip_atr_k': 0.18159916668572978, 'slip_spread_k': 0.5213502895100983, 'spread_hl_frac': 0.025826920216808484, 'bb_std_mult': 2.028328782292626, 'rsi_os': 11, 'rsi_ob': 60, 'vol_spike': 0.1931156024678704, 'adx_thresh': 6.390532414546419, 'atr_min_pct': 0.007630541281332576, 'atr_max_pct': 0.09455667498989247, 'tp_mult': 2.752315126373481, 'tsl_mult': 0.44422271672939456, 'strategy': 'breakout', 'time_stop': 185, 'use_sma': False, 'use_atr': False, 'use_adx': False, 'use_ema': False, 'use_spike': False, 'rsi_required': False, 'edge_k': 1.1741893176204088, 'edge_cap': 0.7802529142676757}.
[I 2025-08-29 22:46:12,109] Trial 617 finished with values: [-1000000000.0, 1000000000.0] and parameters: {'p_sma': 43, 'p_std': 57, 'p_atr': 12, 'p_adx': 15, 'rsi_period': 29, 'ema1': 25, 'ema2': 16, 'slip_atr_k': 0.055527648340537486, 'slip_spread_k': 0.7733840810301045, 'spread_hl_frac': 0.035795871669304175, 'bb_std_mult': 2.6583173022491566, 'rsi_os': 28, 'rsi_ob': 58, 'vol_spike': 0.18703912209392037, 'adx_thresh': 23.920223767593104, 'atr_min_pct': 0.007601865367308468, 'atr_max_pct': 0.041243656477475944, 'tp_mult': 2.768194423479944, 'tsl_mult': 0.16733362908365818, 'strategy': 'breakout', 'time_stop': 262, 'use_sma': False, 'use_atr': False, 'use_adx': False, 'use_ema': False, 'use_spike': False, 'rsi_required': False, 'edge_k': 0.5738840645115864, 'edge_cap': 0.45403220740213845}.
[I 2025-08-29 22:46:12,213] Trial 616 finished with values: [-1000000000.0, 1000000000.0] and parameters: {'p_sma': 43, 'p_std': 41, 'p_atr': 23, 'p_adx': 27, 'rsi_period': 40, 'ema1': 15, 'ema2': 54, 'slip_atr_k': 0.053126259554340596, 'slip_spread_k': 0.9016561984996356, 'spread_hl_frac': 0.023280665928084126, 'bb_std_mult': 2.0281250886727866, 'rsi_os': 29, 'rsi_ob': 77, 'vol_spike': 0.27603536682167595, 'adx_thresh': 26.477924158232295, 'atr_min_pct': 0.007630061065293183, 'atr_max_pct': 0.0910452301502356, 'tp_mult': 1.199321532369372, 'tsl_mult': 0.7268904894685932, 'strategy': 'breakout', 'time_stop': 218, 'use_sma': False, 'use_atr': False, 'use_adx': False, 'use_ema': False, 'use_spike': False, 'rsi_required': False, 'edge_k': 0.5138791061387152, 'edge_cap': 0.3764561852235182}.
[I 2025-08-29 22:46:39,490] Trial 623 finished with values: [-1000000000.0, 1000000000.0] and parameters: {'p_sma': 6, 'p_std': 26, 'p_atr': 16, 'p_adx': 17, 'rsi_period': 19, 'ema1': 23, 'ema2': 52, 'slip_atr_k': 0.12458117366665888, 'slip_spread_k': 0.8142678814026476, 'spread_hl_frac': 0.010914661398591104, 'bb_std_mult': 2.1121124028083162, 'rsi_os': 52, 'rsi_ob': 62, 'vol_spike': 0.17616414999645402, 'adx_thresh': 24.945474467264297, 'atr_min_pct': 0.015242087053896338, 'atr_max_pct': 0.09522907978181075, 'tp_mult': 2.087786889469961, 'tsl_mult': 0.5656985614167006, 'strategy': 'breakout', 'time_stop': 104, 'use_sma': False, 'use_atr': False, 'use_adx': False, 'use_ema': False, 'use_spike': False, 'rsi_required': False, 'edge_k': 0.6322405151283572, 'edge_cap': 0.5913440382651476}.
