[I 2025-08-29 22:29:07,130] Trial 458 finished with values: [-0.0035556564543578473, 0.003557343810029134] and parameters: {'p_sma': 59, 'p_std': 23, 'p_atr': 23, 'p_adx': 15, 'rsi_period': 36, 'ema1': 25, 'ema2': 28, 'slip_atr_k': 0.021174665212822043, 'slip_spread_k': 0.7910281942467133, 'spread_hl_frac': 0.02024423146695587, 'bb_std_mult': 2.2234361497991566, 'rsi_os': 18, 'rsi_ob': 62, 'vol_spike': 0.245414951498823, 'adx_thresh': 32.79537889906896, 'atr_min_pct': 0.0024501288663782506, 'atr_max_pct': 0.09118878199432488, 'tp_mult': 1.2551081098871615, 'tsl_mult': 0.343038487742132, 'strategy': 'breakout', 'time_stop': 247, 'use_sma': False, 'use_atr': False, 'use_adx': False, 'use_ema': False, 'use_spike': False, 'rsi_required': False, 'edge_k': 0.3006069290652881, 'edge_cap': 0.9191221506870508}.
[I 2025-08-29 22:29:07,158] Trial 459 finished with values: [-0.013243845363163587, 0.013219615303538435] and parameters: {'p_sma': 58, 'p_std': 23, 'p_atr': 23, 'p_adx': 15, 'rsi_period': 21, 'ema1': 25, 'ema2': 52, 'slip_atr_k': 0.02241347168873016, 'slip_spread_k': 0.7276643245692779, 'spread_hl_frac': 0.020367892987211998, 'bb_std_mult': 2.0674485162623055, 'rsi_os': 27, 'rsi_ob': 79, 'vol_spike': 0.17342837453059481, 'adx_thresh': 25.52238099092788, 'atr_min_pct': 0.0025040418960258636, 'atr_max_pct': 0.14048100695513854, 'tp_mult': 1.2470520271018661, 'tsl_mult': 0.7206147712473372, 'strategy': 'breakout', 'time_stop': 58, 'use_sma': False, 'use_atr': False, 'use_adx': False, 'use_ema': False, 'use_spike': False, 'rsi_required': False, 'edge_k': 0.3624016569090318, 'edge_cap': 0.8682742968663131}.
[I 2025-08-29 22:29:07,324] Trial 460 finished with values: [-0.006277094306327724, 0.006247277658622819] and parameters: {'p_sma': 11, 'p_std': 23, 'p_atr': 9, 'p_adx': 15, 'rsi_period': 36, 'ema1': 25, 'ema2': 24, 'slip_atr_k': 0.015018376609644692, 'slip_spread_k': 0.8245266685109591, 'spread_hl_frac': 0.020277105908778997, 'bb_std_mult': 2.0944289416630473, 'rsi_os': 29, 'rsi_ob': 62, 'vol_spike': 0.004707128586367071, 'adx_thresh': 25.281270537723305, 'atr_min_pct': 0.002472338130999017, 'atr_max_pct': 0.06739114443007162, 'tp_mult': 1.2581466035454294, 'tsl_mult': 0.7258562097161763, 'strategy': 'breakout', 'time_stop': 134, 'use_sma': False, 'use_atr': False, 'use_adx': False, 'use_ema': False, 'use_spike': False, 'rsi_required': False, 'edge_k': 0.37513746945369464, 'edge_cap': 0.8644737426235609}.
[I 2025-08-29 22:29:07,534] Trial 462 finished with values: [-1000000000.0, 1000000000.0] and parameters: {'p_sma': 5, 'p_std': 24, 'p_atr': 23, 'p_adx': 15, 'rsi_period': 53, 'ema1': 25, 'ema2': 45, 'slip_atr_k': 0.007913181113016482, 'slip_spread_k': 0.817757280664747, 'spread_hl_frac': 0.02045245709574698, 'bb_std_mult': 2.078457540407066, 'rsi_os': 51, 'rsi_ob': 60, 'vol_spike': 0.01679357360909875, 'adx_thresh': 27.03035224652806, 'atr_min_pct': 0.002593902282023794, 'atr_max_pct': 0.09092686405960115, 'tp_mult': 1.2336879075097291, 'tsl_mult': 0.7161199309135637, 'strategy': 'mean_reversion', 'time_stop': 108, 'use_sma': False, 'use_atr': False, 'use_adx': False, 'use_ema': False, 'use_spike': False, 'rsi_required': False, 'edge_k': 0.7396359587181146, 'edge_cap': 0.19178772949516892}.
[I 2025-08-29 22:29:34,564] Trial 464 finished with values: [-0.009803739290427105, 0.009842143630434648] and parameters: {'p_sma': 37, 'p_std': 53, 'p_atr': 25, 'p_adx': 16, 'rsi_period': 36, 'ema1': 12, 'ema2': 53, 'slip_atr_k': 0.006784827781301791, 'slip_spread_k': 0.8181689423030971, 'spread_hl_frac': 0.0458714470021414, 'bb_std_mult': 1.893658476648457, 'rsi_os': 34, 'rsi_ob': 59, 'vol_spike': 0.01515158490697549, 'adx_thresh': 27.02943324431599, 'atr_min_pct': 0.0026521720500588693, 'atr_max_pct': 0.12848056612940656, 'tp_mult': 1.1284627965382412, 'tsl_mult': 0.6741841106107318, 'strategy': 'mean_reversion', 'time_stop': 136, 'use_sma': False, 'use_atr': False, 'use_adx': False, 'use_ema': False, 'use_spike': False, 'rsi_required': False, 'edge_k': 0.5275051222660597, 'edge_cap': 0.5877235527821347}.
[I 2025-08-29 22:29:34,582] Trial 465 finished with values: [-1000000000.0, 1000000000.0] and parameters: {'p_sma': 7, 'p_std': 54, 'p_atr': 11, 'p_adx': 16, 'rsi_period': 18, 'ema1': 30, 'ema2': 49, 'slip_atr_k': 0.007663897150072681, 'slip_spread_k': 0.8454801282226984, 'spread_hl_frac': 0.01912616791777349, 'bb_std_mult': 0.6734077628258504, 'rsi_os': 25, 'rsi_ob': 72, 'vol_spike': 0.24638567615416385, 'adx_thresh': 19.235330129287274, 'atr_min_pct': 0.003103405963946917, 'atr_max_pct': 0.12161916201266389, 'tp_mult': 2.5479095251478996, 'tsl_mult': 0.3368507897405023, 'strategy': 'mean_reversion', 'time_stop': 91, 'use_sma': False, 'use_atr': False, 'use_adx': False, 'use_ema': False, 'use_spike': False, 'rsi_required': False, 'edge_k': 1.5847281744648507, 'edge_cap': 0.7776426722058399}.
[I 2025-08-29 22:29:34,665] Trial 463 finished with values: [-1000000000.0, 1000000000.0] and parameters: {'p_sma': 5, 'p_std': 54, 'p_atr': 25, 'p_adx': 16, 'rsi_period': 53, 'ema1': 14, 'ema2': 34, 'slip_atr_k': 0.007841486836651363, 'slip_spread_k': 0.8158988702181564, 'spread_hl_frac': 0.02949171558449448, 'bb_std_mult': 0.8263744327791656, 'rsi_os': 25, 'rsi_ob': 59, 'vol_spike': 0.2453539151247125, 'adx_thresh': 26.889730998378646, 'atr_min_pct': 0.002672800149669994, 'atr_max_pct': 0.0662618071375095, 'tp_mult': 1.033635705583945, 'tsl_mult': 0.3440467150489749, 'strategy': 'mean_reversion', 'time_stop': 247, 'use_sma': False, 'use_atr': False, 'use_adx': False, 'use_ema': False, 'use_spike': False, 'rsi_required': False, 'edge_k': 1.4964504973812203, 'edge_cap': 0.18690479980198949}.
[I 2025-08-29 22:29:34,847] Trial 466 finished with values: [-1000000000.0, 1000000000.0] and parameters: {'p_sma': 7, 'p_std': 26, 'p_atr': 16, 'p_adx': 8, 'rsi_period': 17, 'ema1': 12, 'ema2': 53, 'slip_atr_k': 0.06327183300433274, 'slip_spread_k': 0.03064691369413386, 'spread_hl_frac': 0.029555529162334077, 'bb_std_mult': 1.9234131108775114, 'rsi_os': 26, 'rsi_ob': 59, 'vol_spike': 0.11176592287364202, 'adx_thresh': 10.490367561964714, 'atr_min_pct': 0.026429522950525475, 'atr_max_pct': 0.09899691732855984, 'tp_mult': 1.4491906972214008, 'tsl_mult': 0.679540773974119, 'strategy': 'mean_reversion', 'time_stop': 114, 'use_sma': False, 'use_atr': False, 'use_adx': False, 'use_ema': False, 'use_spike': False, 'rsi_required': False, 'edge_k': 0.5428533297578956, 'edge_cap': 0.7832770825609316}.
[I 2025-08-29 22:29:35,021] Trial 468 finished with values: [-1000000000.0, 1000000000.0] and parameters: {'p_sma': 9, 'p_std': 26, 'p_atr': 20, 'p_adx': 17, 'rsi_period': 42, 'ema1': 23, 'ema2': 14, 'slip_atr_k': 0.030686196515773468, 'slip_spread_k': 0.4361500127143887, 'spread_hl_frac': 0.024870648168984662, 'bb_std_mult': 2.1579519825399864, 'rsi_os': 17, 'rsi_ob': 87, 'vol_spike': 0.16830938826213318, 'adx_thresh': 33.092658831387936, 'atr_min_pct': 0.024877016161107966, 'atr_max_pct': 0.01904332627605044, 'tp_mult': 1.0440939125827573, 'tsl_mult': 0.16918261561359454, 'strategy': 'breakout', 'time_stop': 114, 'use_sma': False, 'use_atr': False, 'use_adx': False, 'use_ema': False, 'use_spike': False, 'rsi_required': False, 'edge_k': 0.4686774433303691, 'edge_cap': 0.9301095040517015}.
[I 2025-08-29 22:30:01,391] Trial 467 finished with values: [-1000000000.0, 1000000000.0] and parameters: {'p_sma': 36, 'p_std': 37, 'p_atr': 27, 'p_adx': 17, 'rsi_period': 19, 'ema1': 22, 'ema2': 32, 'slip_atr_k': 0.028185962882865838, 'slip_spread_k': 0.4365810961418694, 'spread_hl_frac': 0.029193405193701904, 'bb_std_mult': 1.9607571292536956, 'rsi_os': 18, 'rsi_ob': 61, 'vol_spike': 0.09756076918244619, 'adx_thresh': 32.58175994116377, 'atr_min_pct': 0.01856498929996795, 'atr_max_pct': 0.09206748423474828, 'tp_mult': 1.049491527662841, 'tsl_mult': 0.745542222125863, 'strategy': 'breakout', 'time_stop': 155, 'use_sma': False, 'use_atr': False, 'use_adx': False, 'use_ema': False, 'use_spike': False, 'rsi_required': False, 'edge_k': 1.4973681986539427, 'edge_cap': 0.11455309304771744}.
[I 2025-08-29 22:30:01,685] Trial 469 finished with values: [-0.003646906359528801, 0.004117650763759947] and parameters: {'p_sma': 9, 'p_std': 56, 'p_atr': 27, 'p_adx': 17, 'rsi_period': 19, 'ema1': 26, 'ema2': 55, 'slip_atr_k': 0.02988843155746773, 'slip_spread_k': 0.787140786955076, 'spread_hl_frac': 0.02405860673345307, 'bb_std_mult': 2.9880657214525463, 'rsi_os': 18, 'rsi_ob': 88, 'vol_spike': 0.2366818397917732, 'adx_thresh': 32.66661251404223, 'atr_min_pct': 0.00013337785383746694, 'atr_max_pct': 0.09898789756050638, 'tp_mult': 1.103308390719854, 'tsl_mult': 0.555765481210818, 'strategy': 'breakout', 'time_stop': 115, 'use_sma': False, 'use_atr': False, 'use_adx': False, 'use_ema': False, 'use_spike': False, 'rsi_required': False, 'edge_k': 1.1403226543398348, 'edge_cap': 0.6690435772240673}.
[I 2025-08-29 22:30:02,064] Trial 470 finished with values: [-1000000000.0, 1000000000.0] and parameters: {'p_sma': 9, 'p_std': 13, 'p_atr': 12, 'p_adx': 15, 'rsi_period': 19, 'ema1': 26, 'ema2': 54, 'slip_atr_k': 0.03138962415925316, 'slip_spread_k': 0.7881906783522565, 'spread_hl_frac': 0.016280113659966334, 'bb_std_mult': 2.153932749504685, 'rsi_os': 23, 'rsi_ob': 88, 'vol_spike': 0.18995772080221507, 'adx_thresh': 24.925431688871075, 'atr_min_pct': 0.025018411613462088, 'atr_max_pct': 0.09747262757034901, 'tp_mult': 1.0524299885811392, 'tsl_mult': 0.7476465502206152, 'strategy': 'breakout', 'time_stop': 77, 'use_sma': False, 'use_atr': False, 'use_adx': False, 'use_ema': False, 'use_spike': False, 'rsi_required': False, 'edge_k': 0.4780042211005281, 'edge_cap': 0.8093418928597832}.
[I 2025-08-29 22:30:02,149] Trial 471 finished with values: [-1000000000.0, 1000000000.0] and parameters: {'p_sma': 26, 'p_std': 28, 'p_atr': 24, 'p_adx': 27, 'rsi_period': 19, 'ema1': 26, 'ema2': 55, 'slip_atr_k': 0.01691545355231075, 'slip_spread_k': 0.6473699927365663, 'spread_hl_frac': 0.01634977011361996, 'bb_std_mult': 1.9837573419302728, 'rsi_os': 49, 'rsi_ob': 61, 'vol_spike': 0.1898533907913954, 'adx_thresh': 32.46030466214693, 'atr_min_pct': 0.018658536017481492, 'atr_max_pct': 0.09221711988194019, 'tp_mult': 1.1001401085922702, 'tsl_mult': 0.6439625807921427, 'strategy': 'breakout', 'time_stop': 76, 'use_sma': False, 'use_atr': False, 'use_adx': False, 'use_ema': False, 'use_spike': False, 'rsi_required': False, 'edge_k': 0.8718025597363311, 'edge_cap': 0.6667999498289048}.
[I 2025-08-29 22:30:29,039] Trial 475 finished with values: [-1000000000.0, 1000000000.0] and parameters: {'p_sma': 7, 'p_std': 25, 'p_atr': 22, 'p_adx': 16, 'rsi_period': 22, 'ema1': 20, 'ema2': 50, 'slip_atr_k': 0.08805251276825321, 'slip_spread_k': 0.8768184427324943, 'spread_hl_frac': 0.038052646065790494, 'bb_std_mult': 2.7011840661149016, 'rsi_os': 11, 'rsi_ob': 58, 'vol_spike': 0.07650182650481853, 'adx_thresh': 24.04652126392021, 'atr_min_pct': 0.003973636815623552, 'atr_max_pct': 0.11867814339079136, 'tp_mult': 1.1308914255902198, 'tsl_mult': 0.704311006090108, 'strategy': 'breakout', 'time_stop': 220, 'use_sma': False, 'use_atr': False, 'use_adx': False, 'use_ema': False, 'use_spike': False, 'rsi_required': False, 'edge_k': 0.5160616855221847, 'edge_cap': 0.14100602060304818}.
[I 2025-08-29 22:30:29,216] Trial 474 finished with values: [-1000000000.0, 1000000000.0] and parameters: {'p_sma': 7, 'p_std': 22, 'p_atr': 24, 'p_adx': 16, 'rsi_period': 57, 'ema1': 22, 'ema2': 52, 'slip_atr_k': 0.01742387194621378, 'slip_spread_k': 0.8563029823906547, 'spread_hl_frac': 0.026240343590801945, 'bb_std_mult': 2.0186060273834214, 'rsi_os': 49, 'rsi_ob': 74, 'vol_spike': 0.1820464981815144, 'adx_thresh': 23.7388850407888, 'atr_min_pct': 0.014675355863061072, 'atr_max_pct': 0.09469060681212674, 'tp_mult': 1.1392022324336348, 'tsl_mult': 0.635786107367518, 'strategy': 'breakout', 'time_stop': 221, 'use_sma': False, 'use_atr': False, 'use_adx': False, 'use_ema': False, 'use_spike': False, 'rsi_required': False, 'edge_k': 0.8858640364164427, 'edge_cap': 0.761472306893612}.
[I 2025-08-29 22:30:29,216] Trial 473 finished with values: [-0.010606403358956906, 0.010641543394920076] and parameters: {'p_sma': 7, 'p_std': 28, 'p_atr': 19, 'p_adx': 16, 'rsi_period': 57, 'ema1': 9, 'ema2': 38, 'slip_atr_k': 0.017561994016712153, 'slip_spread_k': 0.6469547707784424, 'spread_hl_frac': 0.016345533938190028, 'bb_std_mult': 2.6815830521659643, 'rsi_os': 49, 'rsi_ob': 61, 'vol_spike': 0.19081922417388728, 'adx_thresh': 24.703157647527544, 'atr_min_pct': 0.0021389646318849586, 'atr_max_pct': 0.01128978569581117, 'tp_mult': 1.1374239125941674, 'tsl_mult': 0.8513862377643057, 'strategy': 'breakout', 'time_stop': 98, 'use_sma': False, 'use_atr': False, 'use_adx': False, 'use_ema': False, 'use_spike': False, 'rsi_required': False, 'edge_k': 0.8127836024299788, 'edge_cap': 0.7287996493722874}.
[I 2025-08-29 22:30:29,295] Trial 472 finished with values: [-1000000000.0, 1000000000.0] and parameters: {'p_sma': 10, 'p_std': 42, 'p_atr': 24, 'p_adx': 27, 'rsi_period': 22, 'ema1': 29, 'ema2': 54, 'slip_atr_k': 0.2489886984529811, 'slip_spread_k': 0.7923528169030215, 'spread_hl_frac': 0.016583164852789406, 'bb_std_mult': 2.014227169288126, 'rsi_os': 22, 'rsi_ob': 70, 'vol_spike': 0.18971388260888597, 'adx_thresh': 24.90149870468533, 'atr_min_pct': 0.0050857821484569625, 'atr_max_pct': 0.011167378958024304, 'tp_mult': 1.712600952283608, 'tsl_mult': 0.9025306594512347, 'strategy': 'breakout', 'time_stop': 265, 'use_sma': False, 'use_atr': False, 'use_adx': False, 'use_ema': False, 'use_spike': False, 'rsi_required': False, 'edge_k': 1.1091396236923723, 'edge_cap': 0.8139620324088213}.
[I 2025-08-29 22:30:56,343] Trial 477 finished with values: [-0.018855933972594774, 0.01882741532839463] and parameters: {'p_sma': 22, 'p_std': 15, 'p_atr': 8, 'p_adx': 26, 'rsi_period': 22, 'ema1': 11, 'ema2': 60, 'slip_atr_k': 0.0941282336576296, 'slip_spread_k': 0.17506980112374637, 'spread_hl_frac': 0.01454370708362863, 'bb_std_mult': 2.0465373524834396, 'rsi_os': 26, 'rsi_ob': 63, 'vol_spike': 0.17069017494458355, 'adx_thresh': 27.990074062410955, 'atr_min_pct': 0.0016511652203254111, 'atr_max_pct': 0.13562457236731623, 'tp_mult': 1.196894880674442, 'tsl_mult': 0.8962614162253707, 'strategy': 'breakout', 'time_stop': 107, 'use_sma': False, 'use_atr': False, 'use_adx': False, 'use_ema': False, 'use_spike': False, 'rsi_required': False, 'edge_k': 1.6192087967800517, 'edge_cap': 0.2195268994149311}.
[I 2025-08-29 22:30:56,583] Trial 476 finished with values: [-0.0572720270294973, 0.05725912129473056] and parameters: {'p_sma': 40, 'p_std': 22, 'p_atr': 8, 'p_adx': 26, 'rsi_period': 16, 'ema1': 23, 'ema2': 51, 'slip_atr_k': 0.1983906546584037, 'slip_spread_k': 0.1720776356765144, 'spread_hl_frac': 0.04995640567140568, 'bb_std_mult': 2.4117296133926693, 'rsi_os': 36, 'rsi_ob': 70, 'vol_spike': 0.1695222074846133, 'adx_thresh': 25.542473441302608, 'atr_min_pct': 0.0017480021408599177, 'atr_max_pct': 0.09385060030010073, 'tp_mult': 2.1781212876668077, 'tsl_mult': 0.254345215331785, 'strategy': 'breakout', 'time_stop': 98, 'use_sma': False, 'use_atr': False, 'use_adx': False, 'use_ema': False, 'use_spike': False, 'rsi_required': False, 'edge_k': 0.8169381036629475, 'edge_cap': 0.5043775156949788}.
[I 2025-08-29 22:30:56,601] Trial 478 finished with values: [-1000000000.0, 1000000000.0] and parameters: {'p_sma': 10, 'p_std': 41, 'p_atr': 8, 'p_adx': 15, 'rsi_period': 72, 'ema1': 6, 'ema2': 54, 'slip_atr_k': 0.19623229177802748, 'slip_spread_k': 0.8445219225930264, 'spread_hl_frac': 0.01493672089940776, 'bb_std_mult': 2.052690833949474, 'rsi_os': 26, 'rsi_ob': 52, 'vol_spike': 0.16967780986332737, 'adx_thresh': 25.784648708108577, 'atr_min_pct': 0.0018224646873725957, 'atr_max_pct': 0.09607190127538501, 'tp_mult': 1.2039654924675283, 'tsl_mult': 0.7010070979747889, 'strategy': 'breakout', 'time_stop': 105, 'use_sma': False, 'use_atr': False, 'use_adx': False, 'use_ema': False, 'use_spike': False, 'rsi_required': False, 'edge_k': 0.5733963051114894, 'edge_cap': 0.0729130821922443}.
[I 2025-08-29 22:30:56,666] Trial 479 finished with values: [-0.005555089079002595, 0.005527954161838613] and parameters: {'p_sma': 14, 'p_std': 24, 'p_atr': 10, 'p_adx': 15, 'rsi_period': 74, 'ema1': 24, 'ema2': 56, 'slip_atr_k': 0.03744158679804355, 'slip_spread_k': 0.832787595339071, 'spread_hl_frac': 0.03973062431123566, 'bb_std_mult': 1.843740409893662, 'rsi_os': 26, 'rsi_ob': 64, 'vol_spike': 0.17175298460307648, 'adx_thresh': 21.288828952567123, 'atr_min_pct': 0.001957942328273088, 'atr_max_pct': 0.06239289388815, 'tp_mult': 2.9499310670775216, 'tsl_mult': 0.7285372806836998, 'strategy': 'breakout', 'time_stop': 105, 'use_sma': False, 'use_atr': False, 'use_adx': False, 'use_ema': False, 'use_spike': False, 'rsi_required': False, 'edge_k': 0.5561622715821085, 'edge_cap': 0.7893142823028337}.
[I 2025-08-29 22:31:23,748] Trial 482 finished with values: [-0.04161940127959096, 0.041615387873438346] and parameters: {'p_sma': 56, 'p_std': 18, 'p_atr': 22, 'p_adx': 11, 'rsi_period': 10, 'ema1': 24, 'ema2': 42, 'slip_atr_k': 0.038537000373048816, 'slip_spread_k': 0.9167644609990911, 'spread_hl_frac': 0.01783478314214898, 'bb_std_mult': 3.3520497871611026, 'rsi_os': 28, 'rsi_ob': 86, 'vol_spike': 0.14063226955263086, 'adx_thresh': 15.975224096221474, 'atr_min_pct': 0.0010074878229584768, 'atr_max_pct': 0.08963648859926483, 'tp_mult': 1.9843547919322575, 'tsl_mult': 0.7339990683142313, 'strategy': 'mean_reversion', 'time_stop': 120, 'use_sma': False, 'use_atr': False, 'use_adx': False, 'use_ema': False, 'use_spike': False, 'rsi_required': False, 'edge_k': 0.4400734115183103, 'edge_cap': 0.7794044072070188}.
[I 2025-08-29 22:31:24,112] Trial 483 finished with values: [-0.005711626533522196, 0.005690898411440061] and parameters: {'p_sma': 6, 'p_std': 29, 'p_atr': 18, 'p_adx': 17, 'rsi_period': 20, 'ema1': 24, 'ema2': 42, 'slip_atr_k': 0.23213693386816114, 'slip_spread_k': 0.5016273367997356, 'spread_hl_frac': 0.03230494590217338, 'bb_std_mult': 2.8516899123915858, 'rsi_os': 5, 'rsi_ob': 78, 'vol_spike': 0.2798784121520281, 'adx_thresh': 17.51605551715379, 'atr_min_pct': 0.0011004832048839806, 'atr_max_pct': 0.11166074927322552, 'tp_mult': 1.9842187861078964, 'tsl_mult': 0.06831483621134726, 'strategy': 'mean_reversion', 'time_stop': 145, 'use_sma': False, 'use_atr': False, 'use_adx': False, 'use_ema': False, 'use_spike': False, 'rsi_required': False, 'edge_k': 0.4443879676447467, 'edge_cap': 0.836108206252909}.
[I 2025-08-29 22:31:24,126] Trial 481 finished with values: [-1000000000.0, 1000000000.0] and parameters: {'p_sma': 15, 'p_std': 18, 'p_atr': 18, 'p_adx': 21, 'rsi_period': 82, 'ema1': 24, 'ema2': 59, 'slip_atr_k': 0.03821002511826359, 'slip_spread_k': 0.8469268448143337, 'spread_hl_frac': 0.003760962537826734, 'bb_std_mult': 1.6369216269814288, 'rsi_os': 28, 'rsi_ob': 60, 'vol_spike': 0.21327564951907368, 'adx_thresh': 7.906531570295858, 'atr_min_pct': 0.003407427685577281, 'atr_max_pct': 0.052891299080248505, 'tp_mult': 1.3998079103569898, 'tsl_mult': 0.7004336842980823, 'strategy': 'mean_reversion', 'time_stop': 165, 'use_sma': False, 'use_atr': False, 'use_adx': False, 'use_ema': False, 'use_spike': False, 'rsi_required': False, 'edge_k': 0.6536373122096155, 'edge_cap': 0.41663426544675275}.
[I 2025-08-29 22:31:24,207] Trial 480 finished with values: [-0.04273304883356688, 0.04271471386057475] and parameters: {'p_sma': 6, 'p_std': 24, 'p_atr': 18, 'p_adx': 15, 'rsi_period': 10, 'ema1': 24, 'ema2': 43, 'slip_atr_k': 0.024456404668612697, 'slip_spread_k': 0.8404531897232363, 'spread_hl_frac': 0.03215978558330857, 'bb_std_mult': 3.5922255447541946, 'rsi_os': 28, 'rsi_ob': 60, 'vol_spike': 0.18265996104734789, 'adx_thresh': 7.779981351326574, 'atr_min_pct': 0.0008497418893084097, 'atr_max_pct': 0.0897248647061123, 'tp_mult': 2.892586651196021, 'tsl_mult': 0.9753052489257554, 'strategy': 'breakout', 'time_stop': 122, 'use_sma': False, 'use_atr': False, 'use_adx': False, 'use_ema': False, 'use_spike': False, 'rsi_required': False, 'edge_k': 0.5526210196212898, 'edge_cap': 0.2903012185512456}.
[I 2025-08-29 22:31:51,258] Trial 485 finished with values: [-1000000000.0, 1000000000.0] and parameters: {'p_sma': 30, 'p_std': 27, 'p_atr': 22, 'p_adx': 9, 'rsi_period': 77, 'ema1': 25, 'ema2': 58, 'slip_atr_k': 0.011646621223770588, 'slip_spread_k': 0.5402389169614991, 'spread_hl_frac': 0.0034844332454603347, 'bb_std_mult': 1.2365093756138301, 'rsi_os': 24, 'rsi_ob': 48, 'vol_spike': 0.1817716105266002, 'adx_thresh': 23.24157578936427, 'atr_min_pct': 0.019521838354821068, 'atr_max_pct': 0.05311989531211658, 'tp_mult': 1.4055293356137968, 'tsl_mult': 0.19635267550726865, 'strategy': 'breakout', 'time_stop': 163, 'use_sma': False, 'use_atr': False, 'use_adx': False, 'use_ema': False, 'use_spike': False, 'rsi_required': False, 'edge_k': 0.6471990988947548, 'edge_cap': 0.9612636609868024}.
[I 2025-08-29 22:31:51,631] Trial 487 finished with values: [-0.0018679000445901428, 0.002478829587895102] and parameters: {'p_sma': 8, 'p_std': 25, 'p_atr': 22, 'p_adx': 7, 'rsi_period': 17, 'ema1': 25, 'ema2': 53, 'slip_atr_k': 0.011719492539662642, 'slip_spread_k': 0.8067483818599405, 'spread_hl_frac': 0.010986999978448512, 'bb_std_mult': 2.1268393109703663, 'rsi_os': 24, 'rsi_ob': 57, 'vol_spike': 0.1837546153149663, 'adx_thresh': 26.41754053082899, 'atr_min_pct': 0.0030497882720453683, 'atr_max_pct': 0.10270709893382855, 'tp_mult': 1.1591599203706382, 'tsl_mult': 0.6776417901134376, 'strategy': 'breakout', 'time_stop': 195, 'use_sma': False, 'use_atr': False, 'use_adx': False, 'use_ema': False, 'use_spike': False, 'rsi_required': False, 'edge_k': 0.48689427812994523, 'edge_cap': 0.7950236566774429}.
