[I 2025-08-29 23:33:32,243] Trial 1053 finished with values: [-0.01901701292096203, 0.018987823935071906] and parameters: {'p_sma': 35, 'p_std': 25, 'p_atr': 25, 'p_adx': 10, 'rsi_period': 17, 'ema1': 22, 'ema2': 56, 'slip_atr_k': 0.16758732744453247, 'slip_spread_k': 0.30953822763673167, 'spread_hl_frac': 0.027347354310105744, 'bb_std_mult': 1.5240363190237218, 'rsi_os': 24, 'rsi_ob': 60, 'vol_spike': 0.24586246619534002, 'adx_thresh': 25.640195714095093, 'atr_min_pct': 0.002377314616074571, 'atr_max_pct': 0.02795443716537844, 'tp_mult': 1.0520895647409705, 'tsl_mult': 0.6509389451942157, 'strategy': 'breakout', 'time_stop': 112, 'use_sma': False, 'use_atr': False, 'use_adx': False, 'use_ema': False, 'use_spike': False, 'rsi_required': False, 'edge_k': 0.3667380832418798, 'edge_cap': 0.7590052548082489}.
[I 2025-08-29 23:33:58,927] Trial 1056 finished with values: [-1000000000.0, 1000000000.0] and parameters: {'p_sma': 8, 'p_std': 15, 'p_atr': 23, 'p_adx': 15, 'rsi_period': 12, 'ema1': 26, 'ema2': 31, 'slip_atr_k': 0.006989606920449002, 'slip_spread_k': 0.8432414278915078, 'spread_hl_frac': 0.0373283390624375, 'bb_std_mult': 2.0557957800671436, 'rsi_os': 46, 'rsi_ob': 59, 'vol_spike': 0.03680059219955868, 'adx_thresh': 22.609526306288828, 'atr_min_pct': 0.0299369935644654, 'atr_max_pct': 0.09357223454068779, 'tp_mult': 1.099327412044768, 'tsl_mult': 0.9815156032105535, 'strategy': 'mean_reversion', 'time_stop': 82, 'use_sma': False, 'use_atr': False, 'use_adx': False, 'use_ema': False, 'use_spike': False, 'rsi_required': False, 'edge_k': 0.29612471574519494, 'edge_cap': 0.7854310470442758}.
[I 2025-08-29 23:33:59,201] Trial 1054 finished with values: [-1000000000.0, 1000000000.0] and parameters: {'p_sma': 6, 'p_std': 28, 'p_atr': 23, 'p_adx': 10, 'rsi_period': 28, 'ema1': 22, 'ema2': 27, 'slip_atr_k': 0.047476023036058315, 'slip_spread_k': 0.7545214394035603, 'spread_hl_frac': 0.03004205038786415, 'bb_std_mult': 2.044280067141668, 'rsi_os': 41, 'rsi_ob': 60, 'vol_spike': 0.0001433392672945677, 'adx_thresh': 26.723480971401145, 'atr_min_pct': 0.023378863998943282, 'atr_max_pct': 0.14427323462333969, 'tp_mult': 2.64439238402423, 'tsl_mult': 0.6697364507738424, 'strategy': 'mean_reversion', 'time_stop': 227, 'use_sma': False, 'use_atr': False, 'use_adx': False, 'use_ema': False, 'use_spike': False, 'rsi_required': False, 'edge_k': 0.3640359706117192, 'edge_cap': 0.8273084047785105}.
[I 2025-08-29 23:33:59,301] Trial 1057 finished with values: [-0.011361969405649708, 0.011306847916850266] and parameters: {'p_sma': 9, 'p_std': 15, 'p_atr': 23, 'p_adx': 19, 'rsi_period': 12, 'ema1': 26, 'ema2': 51, 'slip_atr_k': 0.07818014079065402, 'slip_spread_k': 0.7555767306132609, 'spread_hl_frac': 0.02593682988143612, 'bb_std_mult': 0.7105752945112478, 'rsi_os': 38, 'rsi_ob': 59, 'vol_spike': 0.00012828069364906325, 'adx_thresh': 26.496362444590016, 'atr_min_pct': 0.003367620105098821, 'atr_max_pct': 0.09261606473631688, 'tp_mult': 1.2403885041751468, 'tsl_mult': 0.7175961901267077, 'strategy': 'mean_reversion', 'time_stop': 262, 'use_sma': False, 'use_atr': False, 'use_adx': False, 'use_ema': False, 'use_spike': False, 'rsi_required': False, 'edge_k': 1.5750038895398477, 'edge_cap': 0.6719241750266958}.
[I 2025-08-29 23:33:59,494] Trial 1055 finished with values: [-1000000000.0, 1000000000.0] and parameters: {'p_sma': 36, 'p_std': 28, 'p_atr': 23, 'p_adx': 30, 'rsi_period': 13, 'ema1': 23, 'ema2': 48, 'slip_atr_k': 0.10120639783713749, 'slip_spread_k': 0.8881221748027139, 'spread_hl_frac': 0.04506330804722967, 'bb_std_mult': 2.0417100325180173, 'rsi_os': 25, 'rsi_ob': 59, 'vol_spike': 0.1527315358143994, 'adx_thresh': 27.053289078102416, 'atr_min_pct': 0.023146608403569954, 'atr_max_pct': 0.08999467800525211, 'tp_mult': 1.1782629028464877, 'tsl_mult': 0.983699361817405, 'strategy': 'mean_reversion', 'time_stop': 69, 'use_sma': False, 'use_atr': False, 'use_adx': False, 'use_ema': False, 'use_spike': False, 'rsi_required': False, 'edge_k': 1.5911205491138718, 'edge_cap': 0.7816920230119143}.
[I 2025-08-29 23:34:25,343] Trial 1058 finished with values: [-1000000000.0, 1000000000.0] and parameters: {'p_sma': 26, 'p_std': 40, 'p_atr': 24, 'p_adx': 30, 'rsi_period': 23, 'ema1': 16, 'ema2': 39, 'slip_atr_k': 0.10826555986415809, 'slip_spread_k': 0.6624897582780864, 'spread_hl_frac': 0.04846253570307698, 'bb_std_mult': 2.1843466953283723, 'rsi_os': 27, 'rsi_ob': 94, 'vol_spike': 0.2999785651287228, 'adx_thresh': 26.573836673242738, 'atr_min_pct': 0.023153652435886855, 'atr_max_pct': 0.0831037412979553, 'tp_mult': 2.878489611990233, 'tsl_mult': 0.7116631633139934, 'strategy': 'mean_reversion', 'time_stop': 105, 'use_sma': False, 'use_atr': False, 'use_adx': False, 'use_ema': False, 'use_spike': False, 'rsi_required': False, 'edge_k': 1.6507021584277835, 'edge_cap': 0.8178257524585864}.
[I 2025-08-29 23:34:26,691] Trial 1061 finished with values: [-1000000000.0, 1000000000.0] and parameters: {'p_sma': 40, 'p_std': 24, 'p_atr': 24, 'p_adx': 17, 'rsi_period': 22, 'ema1': 8, 'ema2': 11, 'slip_atr_k': 0.13708482541971642, 'slip_spread_k': 0.6697572699335104, 'spread_hl_frac': 0.015809286710817542, 'bb_std_mult': 2.1748968973686003, 'rsi_os': 48, 'rsi_ob': 94, 'vol_spike': 0.18968020808168765, 'adx_thresh': 25.15415842990817, 'atr_min_pct': 0.007829646445382522, 'atr_max_pct': 0.09724838644296653, 'tp_mult': 1.0427113251041535, 'tsl_mult': 0.728349732985065, 'strategy': 'breakout', 'time_stop': 105, 'use_sma': False, 'use_atr': False, 'use_adx': False, 'use_ema': False, 'use_spike': False, 'rsi_required': False, 'edge_k': 1.684969423821686, 'edge_cap': 0.7994119352646543}.
[I 2025-08-29 23:34:26,839] Trial 1059 finished with values: [-0.010137821004744696, 0.010121369845590478] and parameters: {'p_sma': 40, 'p_std': 58, 'p_atr': 24, 'p_adx': 17, 'rsi_period': 13, 'ema1': 8, 'ema2': 52, 'slip_atr_k': 0.09980693408470108, 'slip_spread_k': 0.2612512759938789, 'spread_hl_frac': 0.04516379787336954, 'bb_std_mult': 2.694695740956164, 'rsi_os': 27, 'rsi_ob': 83, 'vol_spike': 0.18957785479574887, 'adx_thresh': 25.117008360727553, 'atr_min_pct': 0.0034985805056490194, 'atr_max_pct': 0.09777861148727782, 'tp_mult': 1.870728519270022, 'tsl_mult': 0.7250789326296269, 'strategy': 'breakout', 'time_stop': 104, 'use_sma': False, 'use_atr': False, 'use_adx': False, 'use_ema': False, 'use_spike': False, 'rsi_required': False, 'edge_k': 0.5096843038334335, 'edge_cap': 0.8124627462306272}.
[I 2025-08-29 23:34:26,971] Trial 1060 finished with values: [-0.020791516904378304, 0.02077322268243281] and parameters: {'p_sma': 54, 'p_std': 58, 'p_atr': 24, 'p_adx': 20, 'rsi_period': 25, 'ema1': 29, 'ema2': 25, 'slip_atr_k': 0.09996919988247234, 'slip_spread_k': 0.8432845978341333, 'spread_hl_frac': 0.04083823053315609, 'bb_std_mult': 2.182762308539877, 'rsi_os': 27, 'rsi_ob': 81, 'vol_spike': 0.08182210534606578, 'adx_thresh': 25.184789847856884, 'atr_min_pct': 0.0013589992278909518, 'atr_max_pct': 0.09800324139227784, 'tp_mult': 1.0481091003518144, 'tsl_mult': 0.7092285679740533, 'strategy': 'breakout', 'time_stop': 153, 'use_sma': False, 'use_atr': False, 'use_adx': False, 'use_ema': False, 'use_spike': False, 'rsi_required': False, 'edge_k': 0.5249073744140443, 'edge_cap': 0.7920028982599702}.
[I 2025-08-29 23:34:54,892] Trial 1064 finished with values: [-1000000000.0, 1000000000.0] and parameters: {'p_sma': 7, 'p_std': 30, 'p_atr': 17, 'p_adx': 13, 'rsi_period': 25, 'ema1': 6, 'ema2': 60, 'slip_atr_k': 0.19799982123201093, 'slip_spread_k': 0.34737161265633076, 'spread_hl_frac': 0.04107018440995752, 'bb_std_mult': 3.043965742554823, 'rsi_os': 23, 'rsi_ob': 80, 'vol_spike': 0.1728337863598772, 'adx_thresh': 25.794887930058337, 'atr_min_pct': 0.016583898468264715, 'atr_max_pct': 0.10279967629099107, 'tp_mult': 1.1249511627715598, 'tsl_mult': 0.4272744629815063, 'strategy': 'breakout', 'time_stop': 95, 'use_sma': False, 'use_atr': False, 'use_adx': False, 'use_ema': False, 'use_spike': False, 'rsi_required': False, 'edge_k': 0.5218404459428756, 'edge_cap': 0.7553760581362032}.
[I 2025-08-29 23:34:55,606] Trial 1063 finished with values: [-0.010657961317244058, 0.010629058325249227] and parameters: {'p_sma': 58, 'p_std': 30, 'p_atr': 17, 'p_adx': 15, 'rsi_period': 63, 'ema1': 6, 'ema2': 52, 'slip_atr_k': 0.14821180874486795, 'slip_spread_k': 0.8375804089465324, 'spread_hl_frac': 0.021728321978955797, 'bb_std_mult': 1.242886332561989, 'rsi_os': 27, 'rsi_ob': 57, 'vol_spike': 0.014705407377469865, 'adx_thresh': 25.895250267814234, 'atr_min_pct': 0.0008097642560698926, 'atr_max_pct': 0.1032096917914653, 'tp_mult': 1.11533408327961, 'tsl_mult': 0.6983826806868328, 'strategy': 'breakout', 'time_stop': 95, 'use_sma': False, 'use_atr': False, 'use_adx': False, 'use_ema': False, 'use_spike': False, 'rsi_required': False, 'edge_k': 0.5227697371784078, 'edge_cap': 0.27088489279212624}.
[I 2025-08-29 23:34:55,607] Trial 1065 finished with values: [-1000000000.0, 1000000000.0] and parameters: {'p_sma': 58, 'p_std': 10, 'p_atr': 10, 'p_adx': 15, 'rsi_period': 18, 'ema1': 23, 'ema2': 54, 'slip_atr_k': 0.02324959517279411, 'slip_spread_k': 0.3401454897489373, 'spread_hl_frac': 0.013960326738423028, 'bb_std_mult': 1.099911898896026, 'rsi_os': 23, 'rsi_ob': 74, 'vol_spike': 0.1770534519069556, 'adx_thresh': 29.07691105910708, 'atr_min_pct': 0.02677429664081729, 'atr_max_pct': 0.10518018827735207, 'tp_mult': 1.1144632573495912, 'tsl_mult': 0.691908164104749, 'strategy': 'breakout', 'time_stop': 93, 'use_sma': False, 'use_atr': False, 'use_adx': False, 'use_ema': False, 'use_spike': False, 'rsi_required': False, 'edge_k': 1.8445916730804095, 'edge_cap': 0.8711821460341184}.
[I 2025-08-29 23:34:55,623] Trial 1062 finished with values: [-0.016336142218976835, 0.016309812050386008] and parameters: {'p_sma': 40, 'p_std': 20, 'p_atr': 17, 'p_adx': 17, 'rsi_period': 63, 'ema1': 25, 'ema2': 52, 'slip_atr_k': 0.13742686045517707, 'slip_spread_k': 0.3391202300517, 'spread_hl_frac': 0.014058007518008167, 'bb_std_mult': 2.149516070298981, 'rsi_os': 23, 'rsi_ob': 75, 'vol_spike': 0.1590784361646062, 'adx_thresh': 8.136399723745894, 'atr_min_pct': 0.0007676921905350707, 'atr_max_pct': 0.14989139979729138, 'tp_mult': 1.0434783255395506, 'tsl_mult': 0.42939407330081386, 'strategy': 'breakout', 'time_stop': 95, 'use_sma': False, 'use_atr': False, 'use_adx': False, 'use_ema': False, 'use_spike': False, 'rsi_required': False, 'edge_k': 0.5086869349778991, 'edge_cap': 0.7977088656117675}.
[I 2025-08-29 23:35:22,946] Trial 1067 finished with values: [-0.018537071020798823, 0.018504705674178293] and parameters: {'p_sma': 50, 'p_std': 23, 'p_atr': 22, 'p_adx': 16, 'rsi_period': 46, 'ema1': 25, 'ema2': 18, 'slip_atr_k': 0.21376819947676517, 'slip_spread_k': 0.7921248793528805, 'spread_hl_frac': 0.020065641268607475, 'bb_std_mult': 1.9369374911821193, 'rsi_os': 29, 'rsi_ob': 63, 'vol_spike': 0.1830625465665867, 'adx_thresh': 15.433824785196887, 'atr_min_pct': 0.0018701655490351088, 'atr_max_pct': 0.1275974690444342, 'tp_mult': 1.3161804142636473, 'tsl_mult': 0.7578425077668439, 'strategy': 'breakout', 'time_stop': 124, 'use_sma': False, 'use_atr': False, 'use_adx': False, 'use_ema': False, 'use_spike': False, 'rsi_required': False, 'edge_k': 0.4520712728120956, 'edge_cap': 0.1595008720467435}.
[I 2025-08-29 23:35:23,318] Trial 1066 finished with values: [-1000000000.0, 1000000000.0] and parameters: {'p_sma': 8, 'p_std': 26, 'p_atr': 10, 'p_adx': 15, 'rsi_period': 32, 'ema1': 25, 'ema2': 54, 'slip_atr_k': 0.0001490021099746497, 'slip_spread_k': 0.7775972079809708, 'spread_hl_frac': 0.013737060463547042, 'bb_std_mult': 3.325714126817209, 'rsi_os': 26, 'rsi_ob': 63, 'vol_spike': 0.015436180503501012, 'adx_thresh': 7.8772076569468155, 'atr_min_pct': 0.0064612346550881345, 'atr_max_pct': 0.12675840539047661, 'tp_mult': 1.9397636668097797, 'tsl_mult': 0.8550108746004826, 'strategy': 'breakout', 'time_stop': 122, 'use_sma': False, 'use_atr': False, 'use_adx': False, 'use_ema': False, 'use_spike': False, 'rsi_required': False, 'edge_k': 1.8421758533564474, 'edge_cap': 0.8610592148223817}.
[I 2025-08-29 23:35:23,515] Trial 1069 finished with values: [-0.00813574839227893, 0.008107669146416118] and parameters: {'p_sma': 11, 'p_std': 25, 'p_atr': 25, 'p_adx': 8, 'rsi_period': 42, 'ema1': 10, 'ema2': 50, 'slip_atr_k': 0.02789687067351227, 'slip_spread_k': 0.7874220559683173, 'spread_hl_frac': 0.01999563141561574, 'bb_std_mult': 1.9245129134886654, 'rsi_os': 29, 'rsi_ob': 63, 'vol_spike': 0.18362360381276072, 'adx_thresh': 21.304783109553526, 'atr_min_pct': 0.0017025281283223645, 'atr_max_pct': 0.0934017799481755, 'tp_mult': 2.9621300101386137, 'tsl_mult': 0.7650857480262945, 'strategy': 'breakout', 'time_stop': 123, 'use_sma': False, 'use_atr': False, 'use_adx': False, 'use_ema': False, 'use_spike': False, 'rsi_required': False, 'edge_k': 0.9351260970753986, 'edge_cap': 0.7739495789266522}.
[I 2025-08-29 23:35:23,639] Trial 1068 finished with values: [-0.004532855320072304, 0.0048330566635287585] and parameters: {'p_sma': 8, 'p_std': 23, 'p_atr': 13, 'p_adx': 16, 'rsi_period': 84, 'ema1': 25, 'ema2': 50, 'slip_atr_k': 0.028477999859811722, 'slip_spread_k': 0.2439376751706276, 'spread_hl_frac': 0.0029037368358167497, 'bb_std_mult': 2.0934168074251676, 'rsi_os': 33, 'rsi_ob': 63, 'vol_spike': 0.18414009847540724, 'adx_thresh': 6.997985962322874, 'atr_min_pct': 0.0017343206702378406, 'atr_max_pct': 0.12053009650707308, 'tp_mult': 1.1857258531623125, 'tsl_mult': 0.8431726178234299, 'strategy': 'breakout', 'time_stop': 119, 'use_sma': False, 'use_atr': False, 'use_adx': False, 'use_ema': False, 'use_spike': False, 'rsi_required': False, 'edge_k': 0.9506709298348716, 'edge_cap': 0.7791988809175795}.
[I 2025-08-29 23:35:23,930] Trial 1072 finished with values: [-1000000000.0, 1000000000.0] and parameters: {'p_sma': 7, 'p_std': 44, 'p_atr': 13, 'p_adx': 26, 'rsi_period': 70, 'ema1': 19, 'ema2': 22, 'slip_atr_k': 0.12354539604049651, 'slip_spread_k': 0.562582416859583, 'spread_hl_frac': 0.005222134722935427, 'bb_std_mult': 2.0975671708716774, 'rsi_os': 34, 'rsi_ob': 46, 'vol_spike': 0.05197875665830512, 'adx_thresh': 17.293131296807744, 'atr_min_pct': 0.002805491988849374, 'atr_max_pct': 0.06348213754261726, 'tp_mult': 2.6900611556728946, 'tsl_mult': 0.1344656087309139, 'strategy': 'mean_reversion', 'time_stop': 47, 'use_sma': False, 'use_atr': False, 'use_adx': False, 'use_ema': False, 'use_spike': False, 'rsi_required': False, 'edge_k': 0.5715586419219024, 'edge_cap': 0.6467605736021895}.
[I 2025-08-29 23:35:51,973] Trial 1070 finished with values: [-1000000000.0, 1000000000.0] and parameters: {'p_sma': 8, 'p_std': 54, 'p_atr': 30, 'p_adx': 16, 'rsi_period': 81, 'ema1': 19, 'ema2': 50, 'slip_atr_k': 0.0005340153226857415, 'slip_spread_k': 0.8209779053965693, 'spread_hl_frac': 0.018175939351286117, 'bb_std_mult': 0.6392017960272367, 'rsi_os': 14, 'rsi_ob': 46, 'vol_spike': 0.1958998725418212, 'adx_thresh': 18.436321084642053, 'atr_min_pct': 0.005244344182423874, 'atr_max_pct': 0.11970891916025288, 'tp_mult': 1.173911335853286, 'tsl_mult': 0.020967691214211936, 'strategy': 'breakout', 'time_stop': 111, 'use_sma': False, 'use_atr': False, 'use_adx': False, 'use_ema': False, 'use_spike': False, 'rsi_required': False, 'edge_k': 0.5913765858866692, 'edge_cap': 0.7714636961438159}.
[I 2025-08-29 23:35:52,375] Trial 1071 finished with values: [-1000000000.0, 1000000000.0] and parameters: {'p_sma': 7, 'p_std': 25, 'p_atr': 23, 'p_adx': 16, 'rsi_period': 40, 'ema1': 22, 'ema2': 53, 'slip_atr_k': 0.028127764432115215, 'slip_spread_k': 0.8190122431463375, 'spread_hl_frac': 0.003035310260211678, 'bb_std_mult': 2.089858372807318, 'rsi_os': 25, 'rsi_ob': 60, 'vol_spike': 0.07376583192382496, 'adx_thresh': 24.55630939772097, 'atr_min_pct': 0.00496616098703233, 'atr_max_pct': 0.06638006356875054, 'tp_mult': 2.167133567457227, 'tsl_mult': 0.737302413623647, 'strategy': 'breakout', 'time_stop': 111, 'use_sma': False, 'use_atr': False, 'use_adx': False, 'use_ema': False, 'use_spike': False, 'rsi_required': False, 'edge_k': 0.40773990529718007, 'edge_cap': 0.7601782063495152}.
[I 2025-08-29 23:35:52,559] Trial 1073 finished with values: [-1000000000.0, 1000000000.0] and parameters: {'p_sma': 21, 'p_std': 54, 'p_atr': 21, 'p_adx': 24, 'rsi_period': 72, 'ema1': 23, 'ema2': 53, 'slip_atr_k': 0.011580305410147027, 'slip_spread_k': 0.9997250538450906, 'spread_hl_frac': 0.032190787682190226, 'bb_std_mult': 2.008386020980131, 'rsi_os': 36, 'rsi_ob': 58, 'vol_spike': 0.17393779206080187, 'adx_thresh': 33.76710602972673, 'atr_min_pct': 0.021242583101649455, 'atr_max_pct': 0.06226608098573362, 'tp_mult': 2.699574036770561, 'tsl_mult': 0.7374789260061455, 'strategy': 'mean_reversion', 'time_stop': 268, 'use_sma': False, 'use_atr': False, 'use_adx': False, 'use_ema': False, 'use_spike': False, 'rsi_required': False, 'edge_k': 0.5999071375431838, 'edge_cap': 0.7405715839628757}.
[I 2025-08-29 23:35:52,559] Trial 1074 finished with values: [-1000000000.0, 1000000000.0] and parameters: {'p_sma': 9, 'p_std': 55, 'p_atr': 30, 'p_adx': 16, 'rsi_period': 40, 'ema1': 24, 'ema2': 58, 'slip_atr_k': 0.011049433333690819, 'slip_spread_k': 0.04834060391138023, 'spread_hl_frac': 0.018097980791114777, 'bb_std_mult': 2.003632632984244, 'rsi_os': 25, 'rsi_ob': 60, 'vol_spike': 0.13520632220484127, 'adx_thresh': 18.63178092132808, 'atr_min_pct': 0.021241303124183583, 'atr_max_pct': 0.13166615487857317, 'tp_mult': 1.2429635320547714, 'tsl_mult': 0.7347189427593999, 'strategy': 'breakout', 'time_stop': 270, 'use_sma': False, 'use_atr': False, 'use_adx': False, 'use_ema': False, 'use_spike': False, 'rsi_required': False, 'edge_k': 0.42065070118520775, 'edge_cap': 0.11661771782441849}.
[I 2025-08-29 23:36:20,334] Trial 1076 finished with values: [-1000000000.0, 1000000000.0] and parameters: {'p_sma': 9, 'p_std': 26, 'p_atr': 22, 'p_adx': 11, 'rsi_period': 22, 'ema1': 5, 'ema2': 55, 'slip_atr_k': 0.17589636413378848, 'slip_spread_k': 0.4498333209881938, 'spread_hl_frac': 0.009284627275895671, 'bb_std_mult': 2.4419205452014205, 'rsi_os': 25, 'rsi_ob': 61, 'vol_spike': 0.12321547771334042, 'adx_thresh': 33.67936735255223, 'atr_min_pct': 0.008550268277791907, 'atr_max_pct': 0.09082610199448218, 'tp_mult': 1.0129085822491846, 'tsl_mult': 0.7953627114133118, 'strategy': 'mean_reversion', 'time_stop': 270, 'use_sma': False, 'use_atr': False, 'use_adx': False, 'use_ema': False, 'use_spike': False, 'rsi_required': False, 'edge_k': 1.33844243251617, 'edge_cap': 0.839240440594736}.
[I 2025-08-29 23:36:20,830] Trial 1075 finished with values: [-1000000000.0, 1000000000.0] and parameters: {'p_sma': 21, 'p_std': 25, 'p_atr': 23, 'p_adx': 16, 'rsi_period': 22, 'ema1': 23, 'ema2': 58, 'slip_atr_k': 0.013648857076197311, 'slip_spread_k': 0.8826908123098937, 'spread_hl_frac': 0.016573263361525516, 'bb_std_mult': 2.0061749353791143, 'rsi_os': 25, 'rsi_ob': 56, 'vol_spike': 0.17275591009074123, 'adx_thresh': 33.46356324966007, 'atr_min_pct': 0.028687423046402708, 'atr_max_pct': 0.06713176511616491, 'tp_mult': 1.6345406689781399, 'tsl_mult': 0.72660540162341, 'strategy': 'breakout', 'time_stop': 59, 'use_sma': False, 'use_atr': False, 'use_adx': False, 'use_ema': False, 'use_spike': False, 'rsi_required': False, 'edge_k': 0.4125796239830712, 'edge_cap': 0.8363810215288433}.
[I 2025-08-29 23:36:20,951] Trial 1077 finished with values: [-1000000000.0, 1000000000.0] and parameters: {'p_sma': 5, 'p_std': 26, 'p_atr': 7, 'p_adx': 18, 'rsi_period': 22, 'ema1': 23, 'ema2': 55, 'slip_atr_k': 0.01666428448341086, 'slip_spread_k': 0.891873275170335, 'spread_hl_frac': 0.016542587034194773, 'bb_std_mult': 2.575011425281251, 'rsi_os': 26, 'rsi_ob': 61, 'vol_spike': 0.10726450498618187, 'adx_thresh': 23.88824618683085, 'atr_min_pct': 0.011448124829427494, 'atr_max_pct': 0.09069885728417416, 'tp_mult': 2.364867488363117, 'tsl_mult': 0.7890666925110579, 'strategy': 'breakout', 'time_stop': 58, 'use_sma': False, 'use_atr': False, 'use_adx': False, 'use_ema': False, 'use_spike': False, 'rsi_required': False, 'edge_k': 1.1087002631901643, 'edge_cap': 0.8354611916902986}.
[I 2025-08-29 23:36:21,164] Trial 1078 finished with values: [-1000000000.0, 1000000000.0] and parameters: {'p_sma': 5, 'p_std': 34, 'p_atr': 14, 'p_adx': 18, 'rsi_period': 22, 'ema1': 23, 'ema2': 29, 'slip_atr_k': 0.016415157751830937, 'slip_spread_k': 0.8404622471636668, 'spread_hl_frac': 0.01655668438146734, 'bb_std_mult': 1.8460746012121279, 'rsi_os': 26, 'rsi_ob': 61, 'vol_spike': 0.16108998466824873, 'adx_thresh': 23.888873492711433, 'atr_min_pct': 0.003506337237077712, 'atr_max_pct': 0.09467782174430865, 'tp_mult': 1.0914848844177818, 'tsl_mult': 0.7815915089693365, 'strategy': 'breakout', 'time_stop': 59, 'use_sma': False, 'use_atr': False, 'use_adx': False, 'use_ema': False, 'use_spike': False, 'rsi_required': False, 'edge_k': 0.4706384367548641, 'edge_cap': 0.8311560058095917}.
[I 2025-08-29 23:36:47,863] Trial 1079 finished with values: [-1000000000.0, 1000000000.0] and parameters: {'p_sma': 5, 'p_std': 34, 'p_atr': 14, 'p_adx': 17, 'rsi_period': 17, 'ema1': 28, 'ema2': 55, 'slip_atr_k': 0.059735353701857924, 'slip_spread_k': 0.8338646329216336, 'spread_hl_frac': 0.01639730452965786, 'bb_std_mult': 2.307992737728616, 'rsi_os': 26, 'rsi_ob': 56, 'vol_spike': 0.21117851577041963, 'adx_thresh': 26.050874578446088, 'atr_min_pct': 0.003583109445606806, 'atr_max_pct': 0.10079395445269443, 'tp_mult': 1.0776042613421495, 'tsl_mult': 0.15147521518963247, 'strategy': 'breakout', 'time_stop': 60, 'use_sma': False, 'use_atr': False, 'use_adx': False, 'use_ema': False, 'use_spike': False, 'rsi_required': False, 'edge_k': 0.8327997500387699, 'edge_cap': 0.3525359104628747}.
