[I 2025-08-29 23:36:48,585] Trial 1082 finished with values: [-0.012172898965426615, 0.012119714671448942] and parameters: {'p_sma': 6, 'p_std': 22, 'p_atr': 26, 'p_adx': 12, 'rsi_period': 17, 'ema1': 24, 'ema2': 56, 'slip_atr_k': 0.06072748492646203, 'slip_spread_k': 0.7997502227855624, 'spread_hl_frac': 0.04683972905252956, 'bb_std_mult': 2.0621868509828776, 'rsi_os': 42, 'rsi_ob': 67, 'vol_spike': 0.20828659509017344, 'adx_thresh': 11.9195339800917, 'atr_min_pct': 0.0028124392932095763, 'atr_max_pct': 0.10010352006571371, 'tp_mult': 1.1441599197639478, 'tsl_mult': 0.6840839827395435, 'strategy': 'breakout', 'time_stop': 100, 'use_sma': False, 'use_atr': False, 'use_adx': False, 'use_ema': False, 'use_spike': False, 'rsi_required': False, 'edge_k': 0.479790121614908, 'edge_cap': 0.3558238806564137}.
[I 2025-08-29 23:36:48,825] Trial 1080 finished with values: [-1000000000.0, 1000000000.0] and parameters: {'p_sma': 5, 'p_std': 24, 'p_atr': 16, 'p_adx': 17, 'rsi_period': 19, 'ema1': 26, 'ema2': 29, 'slip_atr_k': 0.056027122206650265, 'slip_spread_k': 0.8392052669883975, 'spread_hl_frac': 0.015391260566438998, 'bb_std_mult': 1.8278432095948738, 'rsi_os': 26, 'rsi_ob': 66, 'vol_spike': 0.17844948329414656, 'adx_thresh': 5.6193892309735265, 'atr_min_pct': 0.0035022365722174893, 'atr_max_pct': 0.09490724496357304, 'tp_mult': 2.0283534799554515, 'tsl_mult': 0.6965761704640553, 'strategy': 'breakout', 'time_stop': 101, 'use_sma': False, 'use_atr': False, 'use_adx': False, 'use_ema': False, 'use_spike': False, 'rsi_required': False, 'edge_k': 0.4777453479100054, 'edge_cap': 0.8139078929035071}.
[I 2025-08-29 23:36:49,057] Trial 1081 finished with values: [-1000000000.0, 1000000000.0] and parameters: {'p_sma': 17, 'p_std': 49, 'p_atr': 16, 'p_adx': 17, 'rsi_period': 17, 'ema1': 26, 'ema2': 29, 'slip_atr_k': 0.05362766850592694, 'slip_spread_k': 0.8325163656886261, 'spread_hl_frac': 0.04653463093972975, 'bb_std_mult': 1.3622648548258516, 'rsi_os': 30, 'rsi_ob': 58, 'vol_spike': 0.20967174073322753, 'adx_thresh': 5.650334584198994, 'atr_min_pct': 0.018725728412890857, 'atr_max_pct': 0.07539503360404767, 'tp_mult': 1.0851001193784142, 'tsl_mult': 0.3001672043013047, 'strategy': 'breakout', 'time_stop': 287, 'use_sma': False, 'use_atr': False, 'use_adx': False, 'use_ema': False, 'use_spike': False, 'rsi_required': False, 'edge_k': 0.4773167533608909, 'edge_cap': 0.8144890089064755}.
[I 2025-08-29 23:36:49,353] Trial 1086 finished with values: [-1000000000.0, 1000000000.0] and parameters: {'p_sma': 7, 'p_std': 27, 'p_atr': 20, 'p_adx': 19, 'rsi_period': 24, 'ema1': 24, 'ema2': 54, 'slip_atr_k': 0.20504837467168813, 'slip_spread_k': 0.802529305710935, 'spread_hl_frac': 0.017871062804638533, 'bb_std_mult': 1.941783968064104, 'rsi_os': 54, 'rsi_ob': 59, 'vol_spike': 0.26215418985306804, 'adx_thresh': 25.437077070723493, 'atr_min_pct': 0.009991591670854744, 'atr_max_pct': 0.043294890798498895, 'tp_mult': 1.1977329583900111, 'tsl_mult': 0.7150409214598085, 'strategy': 'mean_reversion', 'time_stop': 220, 'use_sma': False, 'use_atr': False, 'use_adx': False, 'use_ema': False, 'use_spike': False, 'rsi_required': False, 'edge_k': 0.5616452187941501, 'edge_cap': 0.8022255375744843}.
[I 2025-08-29 23:37:16,406] Trial 1083 finished with values: [-0.004632992062086672, 0.00492485369694324] and parameters: {'p_sma': 17, 'p_std': 27, 'p_atr': 16, 'p_adx': 19, 'rsi_period': 18, 'ema1': 24, 'ema2': 54, 'slip_atr_k': 0.20525718222587186, 'slip_spread_k': 0.3980798825229039, 'spread_hl_frac': 0.01933396716404751, 'bb_std_mult': 2.0521345746565705, 'rsi_os': 17, 'rsi_ob': 59, 'vol_spike': 0.19224007071762814, 'adx_thresh': 25.615371714067717, 'atr_min_pct': 0.0030191130179264645, 'atr_max_pct': 0.07462423932180438, 'tp_mult': 2.2212706818353123, 'tsl_mult': 0.30051286688524126, 'strategy': 'breakout', 'time_stop': 220, 'use_sma': False, 'use_atr': False, 'use_adx': False, 'use_ema': False, 'use_spike': False, 'rsi_required': False, 'edge_k': 1.7193528626829435, 'edge_cap': 0.555290362365676}.
[I 2025-08-29 23:37:16,732] Trial 1085 finished with values: [-0.0034542906709220667, 0.0034651557989845757] and parameters: {'p_sma': 28, 'p_std': 27, 'p_atr': 20, 'p_adx': 15, 'rsi_period': 53, 'ema1': 24, 'ema2': 37, 'slip_atr_k': 0.021694545194775042, 'slip_spread_k': 0.5032023725756921, 'spread_hl_frac': 0.01913880158304512, 'bb_std_mult': 1.9548624294289634, 'rsi_os': 24, 'rsi_ob': 91, 'vol_spike': 0.19253149736134928, 'adx_thresh': 25.291748353724536, 'atr_min_pct': 0.0023713856366721154, 'atr_max_pct': 0.0841530973929675, 'tp_mult': 1.6782894420224892, 'tsl_mult': 0.644260277006487, 'strategy': 'mean_reversion', 'time_stop': 187, 'use_sma': False, 'use_atr': False, 'use_adx': False, 'use_ema': False, 'use_spike': False, 'rsi_required': False, 'edge_k': 1.779259590707242, 'edge_cap': 0.9429020566447526}.
[I 2025-08-29 23:37:16,944] Trial 1084 finished with values: [-1000000000.0, 1000000000.0] and parameters: {'p_sma': 7, 'p_std': 27, 'p_atr': 16, 'p_adx': 7, 'rsi_period': 52, 'ema1': 26, 'ema2': 12, 'slip_atr_k': 0.02194560700743075, 'slip_spread_k': 0.40649272301474254, 'spread_hl_frac': 0.019218581217350594, 'bb_std_mult': 1.920589131435184, 'rsi_os': 24, 'rsi_ob': 79, 'vol_spike': 0.19337923485774233, 'adx_thresh': 32.60708493360109, 'atr_min_pct': 0.018813884451315623, 'atr_max_pct': 0.09512617884667184, 'tp_mult': 1.2001975060487713, 'tsl_mult': 0.7061107202573818, 'strategy': 'mean_reversion', 'time_stop': 108, 'use_sma': False, 'use_atr': False, 'use_adx': False, 'use_ema': False, 'use_spike': False, 'rsi_required': False, 'edge_k': 1.0138947414539041, 'edge_cap': 0.8092604697267154}.
[I 2025-08-29 23:37:17,451] Trial 1087 finished with values: [-0.006482608980238336, 0.006468485371268482] and parameters: {'p_sma': 7, 'p_std': 28, 'p_atr': 23, 'p_adx': 15, 'rsi_period': 19, 'ema1': 25, 'ema2': 53, 'slip_atr_k': 0.022590882610513355, 'slip_spread_k': 0.40630276950500477, 'spread_hl_frac': 0.019588223156232848, 'bb_std_mult': 2.1355914528617594, 'rsi_os': 28, 'rsi_ob': 65, 'vol_spike': 0.19243256362481528, 'adx_thresh': 10.061693418550005, 'atr_min_pct': 0.0022821524181335455, 'atr_max_pct': 0.03264260570145656, 'tp_mult': 2.8303222579679397, 'tsl_mult': 0.636136055394842, 'strategy': 'mean_reversion', 'time_stop': 191, 'use_sma': False, 'use_atr': False, 'use_adx': False, 'use_ema': False, 'use_spike': False, 'rsi_required': False, 'edge_k': 1.9313164686157744, 'edge_cap': 0.20709889853990238}.
[I 2025-08-29 23:37:44,912] Trial 1091 finished with values: [-0.0026557942851870298, 0.0026300335415454876] and parameters: {'p_sma': 9, 'p_std': 36, 'p_atr': 22, 'p_adx': 23, 'rsi_period': 15, 'ema1': 25, 'ema2': 34, 'slip_atr_k': 0.005746805636393073, 'slip_spread_k': 0.619295692918187, 'spread_hl_frac': 0.01755014782619284, 'bb_std_mult': 2.880701919756251, 'rsi_os': 13, 'rsi_ob': 60, 'vol_spike': 0.1787077170716026, 'adx_thresh': 24.540957771642642, 'atr_min_pct': 0.001015547248939132, 'atr_max_pct': 0.1365269356403153, 'tp_mult': 1.1387208274137453, 'tsl_mult': 0.7531834060180282, 'strategy': 'breakout', 'time_stop': 116, 'use_sma': False, 'use_atr': False, 'use_adx': False, 'use_ema': False, 'use_spike': False, 'rsi_required': False, 'edge_k': 0.7594467100921594, 'edge_cap': 0.414389650373102}.
[I 2025-08-29 23:37:44,983] Trial 1088 finished with values: [-1000000000.0, 1000000000.0] and parameters: {'p_sma': 10, 'p_std': 24, 'p_atr': 23, 'p_adx': 15, 'rsi_period': 15, 'ema1': 25, 'ema2': 40, 'slip_atr_k': 0.006976353668480659, 'slip_spread_k': 0.6980729551445239, 'spread_hl_frac': 0.017483858074143967, 'bb_std_mult': 1.9132279024112504, 'rsi_os': 28, 'rsi_ob': 82, 'vol_spike': 0.04056050442987197, 'adx_thresh': 24.610253021308814, 'atr_min_pct': 0.002524566457131544, 'atr_max_pct': 0.08526375473501546, 'tp_mult': 2.5217813351658926, 'tsl_mult': 0.7529463761963896, 'strategy': 'mean_reversion', 'time_stop': 194, 'use_sma': False, 'use_atr': False, 'use_adx': False, 'use_ema': False, 'use_spike': False, 'rsi_required': False, 'edge_k': 1.7958688423019402, 'edge_cap': 0.7883830236533974}.
[I 2025-08-29 23:37:45,205] Trial 1089 finished with values: [-0.014318583527800022, 0.014292097826557546] and parameters: {'p_sma': 10, 'p_std': 17, 'p_atr': 29, 'p_adx': 16, 'rsi_period': 15, 'ema1': 25, 'ema2': 13, 'slip_atr_k': 0.008870084205709063, 'slip_spread_k': 0.6154163215598044, 'spread_hl_frac': 0.017342464640529888, 'bb_std_mult': 1.4569165739050622, 'rsi_os': 20, 'rsi_ob': 60, 'vol_spike': 0.17806484994167818, 'adx_thresh': 9.918756325443711, 'atr_min_pct': 0.0012992051296571118, 'atr_max_pct': 0.09699305950061052, 'tp_mult': 1.1573509410816198, 'tsl_mult': 0.7588069124434667, 'strategy': 'breakout', 'time_stop': 300, 'use_sma': False, 'use_atr': False, 'use_adx': False, 'use_ema': False, 'use_spike': False, 'rsi_required': False, 'edge_k': 1.0119823273902684, 'edge_cap': 0.07745638258652376}.
[I 2025-08-29 23:37:45,397] Trial 1090 finished with values: [-1000000000.0, 1000000000.0] and parameters: {'p_sma': 11, 'p_std': 36, 'p_atr': 29, 'p_adx': 29, 'rsi_period': 15, 'ema1': 28, 'ema2': 57, 'slip_atr_k': 0.23116530489649406, 'slip_spread_k': 0.8539376529624804, 'spread_hl_frac': 0.036271985214609136, 'bb_std_mult': 2.234955519959551, 'rsi_os': 9, 'rsi_ob': 62, 'vol_spike': 0.1859267694010717, 'adx_thresh': 24.51352420783385, 'atr_min_pct': 0.001254267109651282, 'atr_max_pct': 0.0979667878458417, 'tp_mult': 2.9998912214047864, 'tsl_mult': 0.7557852226650421, 'strategy': 'breakout', 'time_stop': 235, 'use_sma': False, 'use_atr': False, 'use_adx': False, 'use_ema': False, 'use_spike': False, 'rsi_required': False, 'edge_k': 0.7548211963020602, 'edge_cap': 0.7897347166038143}.
[I 2025-08-29 23:38:13,005] Trial 1095 finished with values: [-0.046465924948138504, 0.046445467087822954] and parameters: {'p_sma': 32, 'p_std': 23, 'p_atr': 22, 'p_adx': 21, 'rsi_period': 57, 'ema1': 24, 'ema2': 53, 'slip_atr_k': 0.1164291947471437, 'slip_spread_k': 0.0947204908953852, 'spread_hl_frac': 0.0426975105989954, 'bb_std_mult': 2.1167958295861755, 'rsi_os': 44, 'rsi_ob': 58, 'vol_spike': 0.1707037062464241, 'adx_thresh': 27.22033393172417, 'atr_min_pct': 0.0017709309340846768, 'atr_max_pct': 0.11078010634022545, 'tp_mult': 1.2603987154788845, 'tsl_mult': 0.8878668519266263, 'strategy': 'breakout', 'time_stop': 31, 'use_sma': False, 'use_atr': False, 'use_adx': False, 'use_ema': False, 'use_spike': False, 'rsi_required': False, 'edge_k': 0.6674686220076639, 'edge_cap': 0.7485395192734354}.
[I 2025-08-29 23:38:13,161] Trial 1093 finished with values: [-0.009172223999058371, 0.009144363429363261] and parameters: {'p_sma': 9, 'p_std': 24, 'p_atr': 29, 'p_adx': 16, 'rsi_period': 21, 'ema1': 24, 'ema2': 57, 'slip_atr_k': 0.015398800247619908, 'slip_spread_k': 0.8614111932001736, 'spread_hl_frac': 0.04404671855133441, 'bb_std_mult': 1.4472834351499018, 'rsi_os': 27, 'rsi_ob': 95, 'vol_spike': 0.16928375149945563, 'adx_thresh': 27.251569299941092, 'atr_min_pct': 0.0013309868092330202, 'atr_max_pct': 0.0969841905218043, 'tp_mult': 1.1438329249047554, 'tsl_mult': 0.6717311649023652, 'strategy': 'breakout', 'time_stop': 117, 'use_sma': False, 'use_atr': False, 'use_adx': False, 'use_ema': False, 'use_spike': False, 'rsi_required': False, 'edge_k': 0.5511309047799086, 'edge_cap': 0.7740445005723928}.
[I 2025-08-29 23:38:13,562] Trial 1094 finished with values: [-0.03921801814289905, 0.0392051058044707] and parameters: {'p_sma': 46, 'p_std': 24, 'p_atr': 12, 'p_adx': 16, 'rsi_period': 20, 'ema1': 24, 'ema2': 33, 'slip_atr_k': 0.19334666630965497, 'slip_spread_k': 0.5277388250895706, 'spread_hl_frac': 0.0340127440142915, 'bb_std_mult': 1.7268906808458335, 'rsi_os': 27, 'rsi_ob': 62, 'vol_spike': 0.1445875498810259, 'adx_thresh': 8.982870478499263, 'atr_min_pct': 0.0016964255377771272, 'atr_max_pct': 0.0880837454327867, 'tp_mult': 1.1358978765623713, 'tsl_mult': 0.344599311560044, 'strategy': 'breakout', 'time_stop': 114, 'use_sma': False, 'use_atr': False, 'use_adx': False, 'use_ema': False, 'use_spike': False, 'rsi_required': False, 'edge_k': 1.5080981991352171, 'edge_cap': 0.42310459102358}.
[I 2025-08-29 23:38:13,662] Trial 1092 finished with values: [-0.004279699947015936, 0.004255142000538335] and parameters: {'p_sma': 10, 'p_std': 23, 'p_atr': 22, 'p_adx': 16, 'rsi_period': 21, 'ema1': 24, 'ema2': 57, 'slip_atr_k': 0.008238340687413108, 'slip_spread_k': 0.631387792601179, 'spread_hl_frac': 0.03411314963116541, 'bb_std_mult': 2.120417883715213, 'rsi_os': 9, 'rsi_ob': 84, 'vol_spike': 0.1715113925719236, 'adx_thresh': 24.513304295213903, 'atr_min_pct': 0.0013444036542264125, 'atr_max_pct': 0.11506269856574755, 'tp_mult': 2.2638529106117176, 'tsl_mult': 0.7580452529115659, 'strategy': 'breakout', 'time_stop': 115, 'use_sma': False, 'use_atr': False, 'use_adx': False, 'use_ema': False, 'use_spike': False, 'rsi_required': False, 'edge_k': 0.6719141388562376, 'edge_cap': 0.3031874853920147}.
[I 2025-08-29 23:38:41,270] Trial 1096 finished with values: [-1000000000.0, 1000000000.0] and parameters: {'p_sma': 46, 'p_std': 25, 'p_atr': 24, 'p_adx': 16, 'rsi_period': 78, 'ema1': 24, 'ema2': 47, 'slip_atr_k': 0.19374135174225693, 'slip_spread_k': 0.7707048474914174, 'spread_hl_frac': 0.015029388136632354, 'bb_std_mult': 2.740499517681469, 'rsi_os': 27, 'rsi_ob': 60, 'vol_spike': 0.18186535543063354, 'adx_thresh': 26.093489264414643, 'atr_min_pct': 0.027804070296797295, 'atr_max_pct': 0.13675782172375436, 'tp_mult': 1.1332802177618075, 'tsl_mult': 0.5207858201570836, 'strategy': 'breakout', 'time_stop': 174, 'use_sma': False, 'use_atr': False, 'use_adx': False, 'use_ema': False, 'use_spike': False, 'rsi_required': False, 'edge_k': 0.5456076945951895, 'edge_cap': 0.4930407921558441}.
[I 2025-08-29 23:38:41,508] Trial 1097 finished with values: [-1000000000.0, 1000000000.0] and parameters: {'p_sma': 6, 'p_std': 25, 'p_atr': 22, 'p_adx': 25, 'rsi_period': 45, 'ema1': 24, 'ema2': 41, 'slip_atr_k': 0.019221122044784114, 'slip_spread_k': 0.770610750920556, 'spread_hl_frac': 0.015322788103022976, 'bb_std_mult': 3.51469392189703, 'rsi_os': 27, 'rsi_ob': 60, 'vol_spike': 0.18076065202061176, 'adx_thresh': 26.160268986468324, 'atr_min_pct': 0.018006145334006303, 'atr_max_pct': 0.11555738098859367, 'tp_mult': 1.7956370221797253, 'tsl_mult': 0.7192370890664506, 'strategy': 'breakout', 'time_stop': 172, 'use_sma': False, 'use_atr': False, 'use_adx': False, 'use_ema': False, 'use_spike': False, 'rsi_required': False, 'edge_k': 0.5163936596883986, 'edge_cap': 0.486437293859531}.
[I 2025-08-29 23:38:41,679] Trial 1098 finished with values: [-1000000000.0, 1000000000.0] and parameters: {'p_sma': 13, 'p_std': 25, 'p_atr': 24, 'p_adx': 14, 'rsi_period': 49, 'ema1': 24, 'ema2': 34, 'slip_atr_k': 0.06862085999083004, 'slip_spread_k': 0.7718470558584485, 'spread_hl_frac': 0.01540490477376411, 'bb_std_mult': 3.0764389386623616, 'rsi_os': 26, 'rsi_ob': 60, 'vol_spike': 0.18142984679059226, 'adx_thresh': 25.9955096934375, 'atr_min_pct': 0.014533455409766758, 'atr_max_pct': 0.11631440452503197, 'tp_mult': 1.091605380367798, 'tsl_mult': 0.7246270946666339, 'strategy': 'breakout', 'time_stop': 76, 'use_sma': False, 'use_atr': False, 'use_adx': False, 'use_ema': False, 'use_spike': False, 'rsi_required': False, 'edge_k': 0.43926878962452987, 'edge_cap': 0.6152309513750385}.
[I 2025-08-29 23:38:41,793] Trial 1099 finished with values: [-0.012070564075226109, 0.01204134185241856] and parameters: {'p_sma': 48, 'p_std': 25, 'p_atr': 24, 'p_adx': 13, 'rsi_period': 25, 'ema1': 23, 'ema2': 41, 'slip_atr_k': 0.1650591882494175, 'slip_spread_k': 0.7708545612800538, 'spread_hl_frac': 0.008437380559068206, 'bb_std_mult': 2.021996446984525, 'rsi_os': 26, 'rsi_ob': 76, 'vol_spike': 0.25011149260445276, 'adx_thresh': 26.193671657687077, 'atr_min_pct': 0.002966426991347218, 'atr_max_pct': 0.09253254445122781, 'tp_mult': 1.1085667823598597, 'tsl_mult': 0.5139744798206373, 'strategy': 'breakout', 'time_stop': 255, 'use_sma': False, 'use_atr': False, 'use_adx': False, 'use_ema': False, 'use_spike': False, 'rsi_required': False, 'edge_k': 0.06232226741716562, 'edge_cap': 0.7301593748421323}.
[I 2025-08-29 23:39:08,804] Trial 1101 finished with values: [-1000000000.0, 1000000000.0] and parameters: {'p_sma': 6, 'p_std': 42, 'p_atr': 23, 'p_adx': 20, 'rsi_period': 23, 'ema1': 23, 'ema2': 34, 'slip_atr_k': 0.07396612853253474, 'slip_spread_k': 0.8129288187207999, 'spread_hl_frac': 0.00804229265139832, 'bb_std_mult': 3.085816231810978, 'rsi_os': 40, 'rsi_ob': 53, 'vol_spike': 0.02860838348546832, 'adx_thresh': 22.858080483752325, 'atr_min_pct': 0.012304327474111061, 'atr_max_pct': 0.09150136399140114, 'tp_mult': 1.0661752454148048, 'tsl_mult': 0.17495674923407778, 'strategy': 'breakout', 'time_stop': 76, 'use_sma': False, 'use_atr': False, 'use_adx': False, 'use_ema': False, 'use_spike': False, 'rsi_required': False, 'edge_k': 0.04985724809426506, 'edge_cap': 0.7928302063993652}.
[I 2025-08-29 23:39:09,560] Trial 1100 finished with values: [-1000000000.0, 1000000000.0] and parameters: {'p_sma': 6, 'p_std': 26, 'p_atr': 23, 'p_adx': 25, 'rsi_period': 19, 'ema1': 23, 'ema2': 41, 'slip_atr_k': 0.018645594242438064, 'slip_spread_k': 0.8084011073747024, 'spread_hl_frac': 0.018065715931532767, 'bb_std_mult': 2.0407155177399394, 'rsi_os': 24, 'rsi_ob': 77, 'vol_spike': 0.185804244032111, 'adx_thresh': 22.769982846903716, 'atr_min_pct': 0.012176848556416155, 'atr_max_pct': 0.09241855030355708, 'tp_mult': 1.074692847815199, 'tsl_mult': 0.7168424143542335, 'strategy': 'breakout', 'time_stop': 107, 'use_sma': False, 'use_atr': False, 'use_adx': False, 'use_ema': False, 'use_spike': False, 'rsi_required': False, 'edge_k': 0.44295778471346337, 'edge_cap': 0.2441328565328772}.
[I 2025-08-29 23:39:09,695] Trial 1103 finished with values: [-0.08125739759077333, 0.08123703942816973] and parameters: {'p_sma': 38, 'p_std': 29, 'p_atr': 23, 'p_adx': 22, 'rsi_period': 9, 'ema1': 25, 'ema2': 54, 'slip_atr_k': 0.031128344196615337, 'slip_spread_k': 0.8089498137636819, 'spread_hl_frac': 0.03083309034349085, 'bb_std_mult': 1.9945172765532508, 'rsi_os': 24, 'rsi_ob': 55, 'vol_spike': 0.02627499120808377, 'adx_thresh': 28.116558054571495, 'atr_min_pct': 0.00041996271371000826, 'atr_max_pct': 0.10042410160093869, 'tp_mult': 1.01035756414513, 'tsl_mult': 0.6940115434387567, 'strategy': 'mean_reversion', 'time_stop': 107, 'use_sma': False, 'use_atr': False, 'use_adx': False, 'use_ema': False, 'use_spike': False, 'rsi_required': False, 'edge_k': 0.13466258918073115, 'edge_cap': 0.759747318311905}.
[I 2025-08-29 23:39:09,866] Trial 1102 finished with values: [-1000000000.0, 1000000000.0] and parameters: {'p_sma': 44, 'p_std': 23, 'p_atr': 23, 'p_adx': 17, 'rsi_period': 43, 'ema1': 16, 'ema2': 55, 'slip_atr_k': 0.03349665857608973, 'slip_spread_k': 0.8129221691269968, 'spread_hl_frac': 0.018355077684298015, 'bb_std_mult': 2.024031473950019, 'rsi_os': 24, 'rsi_ob': 77, 'vol_spike': 0.061550448169344366, 'adx_thresh': 25.065345751914446, 'atr_min_pct': 0.026124918678405457, 'atr_max_pct': 0.0930371021051668, 'tp_mult': 1.0668790631260914, 'tsl_mult': 0.6983139733814501, 'strategy': 'breakout', 'time_stop': 105, 'use_sma': False, 'use_atr': False, 'use_adx': False, 'use_ema': False, 'use_spike': False, 'rsi_required': False, 'edge_k': 0.12154845860394359, 'edge_cap': 0.383373834703278}.
[I 2025-08-29 23:39:10,198] Trial 1107 finished with values: [-1000000000.0, 1000000000.0] and parameters: {'p_sma': 8, 'p_std': 47, 'p_atr': 22, 'p_adx': 15, 'rsi_period': 18, 'ema1': 20, 'ema2': 46, 'slip_atr_k': 0.02632936472646439, 'slip_spread_k': 0.8496559516867128, 'spread_hl_frac': 0.016979843871398545, 'bb_std_mult': 1.588344078411404, 'rsi_os': 52, 'rsi_ob': 61, 'vol_spike': 0.17605987041396934, 'adx_thresh': 21.769432483291336, 'atr_min_pct': 0.0022246602430087007, 'atr_max_pct': 0.09503247334071876, 'tp_mult': 1.7197812220111548, 'tsl_mult': 0.7373626168781467, 'strategy': 'mean_reversion', 'time_stop': 204, 'use_sma': False, 'use_atr': False, 'use_adx': False, 'use_ema': False, 'use_spike': False, 'rsi_required': False, 'edge_k': 1.3977867390170644, 'edge_cap': 0.8191573333983793}.
[I 2025-08-29 23:39:36,666] Trial 1104 finished with values: [-1000000000.0, 1000000000.0] and parameters: {'p_sma': 8, 'p_std': 47, 'p_atr': 27, 'p_adx': 9, 'rsi_period': 43, 'ema1': 13, 'ema2': 55, 'slip_atr_k': 0.02495671237660146, 'slip_spread_k': 0.8123031210545778, 'spread_hl_frac': 0.018673996460715863, 'bb_std_mult': 2.019758295877498, 'rsi_os': 25, 'rsi_ob': 61, 'vol_spike': 0.1630800342952147, 'adx_thresh': 25.483943527285223, 'atr_min_pct': 0.010938253763412094, 'atr_max_pct': 0.10176412203165675, 'tp_mult': 1.223759481771131, 'tsl_mult': 0.688452963182385, 'strategy': 'mean_reversion', 'time_stop': 13, 'use_sma': False, 'use_atr': False, 'use_adx': False, 'use_ema': False, 'use_spike': False, 'rsi_required': False, 'edge_k': 0.16634121585402162, 'edge_cap': 0.8142011199003315}.
[I 2025-08-29 23:39:37,288] Trial 1105 finished with values: [-1000000000.0, 1000000000.0] and parameters: {'p_sma': 8, 'p_std': 21, 'p_atr': 21, 'p_adx': 22, 'rsi_period': 19, 'ema1': 25, 'ema2': 55, 'slip_atr_k': 0.033786329696163894, 'slip_spread_k': 0.795759632156754, 'spread_hl_frac': 0.03857441619170214, 'bb_std_mult': 1.6271876929605742, 'rsi_os': 15, 'rsi_ob': 69, 'vol_spike': 0.16320700083298448, 'adx_thresh': 25.13767300365851, 'atr_min_pct': 0.01091223101506264, 'atr_max_pct': 0.09930195065578476, 'tp_mult': 1.2281171421543635, 'tsl_mult': 0.04660970248041607, 'strategy': 'mean_reversion', 'time_stop': 102, 'use_sma': False, 'use_atr': False, 'use_adx': False, 'use_ema': False, 'use_spike': False, 'rsi_required': False, 'edge_k': 1.154349267496907, 'edge_cap': 0.818537936259616}.
