[I 2025-08-29 23:42:27,208] Trial 1137 finished with values: [-1000000000.0, 1000000000.0] and parameters: {'p_sma': 7, 'p_std': 25, 'p_atr': 22, 'p_adx': 16, 'rsi_period': 61, 'ema1': 19, 'ema2': 53, 'slip_atr_k': 0.08155110127647912, 'slip_spread_k': 0.20784870658560384, 'spread_hl_frac': 0.04827612612643722, 'bb_std_mult': 1.795444774506249, 'rsi_os': 55, 'rsi_ob': 61, 'vol_spike': 0.14156181414606492, 'adx_thresh': 25.87703127611936, 'atr_min_pct': 0.002333195200193854, 'atr_max_pct': 0.10101833609573439, 'tp_mult': 2.7235536845057196, 'tsl_mult': 0.7721439907038089, 'strategy': 'mean_reversion', 'time_stop': 99, 'use_sma': False, 'use_atr': False, 'use_adx': False, 'use_ema': False, 'use_spike': False, 'rsi_required': False, 'edge_k': 0.39995710383851285, 'edge_cap': 0.10303185637052953}.
[I 2025-08-29 23:42:53,983] Trial 1134 finished with values: [-1000000000.0, 1000000000.0] and parameters: {'p_sma': 5, 'p_std': 40, 'p_atr': 22, 'p_adx': 16, 'rsi_period': 20, 'ema1': 24, 'ema2': 14, 'slip_atr_k': 0.00953538238005332, 'slip_spread_k': 0.02223281304681135, 'spread_hl_frac': 0.016925681794506393, 'bb_std_mult': 1.9758842268766286, 'rsi_os': 5, 'rsi_ob': 59, 'vol_spike': 0.18219384091135576, 'adx_thresh': 24.25207067978753, 'atr_min_pct': 0.0020614117795274512, 'atr_max_pct': 0.08645839562065491, 'tp_mult': 1.4134409332844404, 'tsl_mult': 0.49347873206417275, 'strategy': 'mean_reversion', 'time_stop': 251, 'use_sma': False, 'use_atr': False, 'use_adx': False, 'use_ema': False, 'use_spike': False, 'rsi_required': False, 'edge_k': 0.9056823067316259, 'edge_cap': 0.7993439961661948}.
[I 2025-08-29 23:42:54,183] Trial 1135 finished with values: [-1000000000.0, 1000000000.0] and parameters: {'p_sma': 33, 'p_std': 25, 'p_atr': 22, 'p_adx': 16, 'rsi_period': 20, 'ema1': 24, 'ema2': 53, 'slip_atr_k': 0.08002949716922428, 'slip_spread_k': 0.20799983931830757, 'spread_hl_frac': 0.017601247201503127, 'bb_std_mult': 1.049216474623669, 'rsi_os': 27, 'rsi_ob': 92, 'vol_spike': 0.2166161584585801, 'adx_thresh': 15.991408911180605, 'atr_min_pct': 0.005603557482259287, 'atr_max_pct': 0.06013406763573437, 'tp_mult': 1.3504701459325053, 'tsl_mult': 0.9582342677705944, 'strategy': 'mean_reversion', 'time_stop': 99, 'use_sma': False, 'use_atr': False, 'use_adx': False, 'use_ema': False, 'use_spike': False, 'rsi_required': False, 'edge_k': 0.3992754690687086, 'edge_cap': 0.9273881753979382}.
[I 2025-08-29 23:42:54,220] Trial 1136 finished with values: [-0.07614572476452308, 0.07613551385159884] and parameters: {'p_sma': 12, 'p_std': 25, 'p_atr': 22, 'p_adx': 16, 'rsi_period': 7, 'ema1': 29, 'ema2': 52, 'slip_atr_k': 0.08079677561731968, 'slip_spread_k': 0.20369997904098747, 'spread_hl_frac': 0.04815478309844774, 'bb_std_mult': 1.9677990523833309, 'rsi_os': 28, 'rsi_ob': 61, 'vol_spike': 0.18160701615711794, 'adx_thresh': 24.276749815126568, 'atr_min_pct': 0.000928423122511692, 'atr_max_pct': 0.08605730085298545, 'tp_mult': 1.3708801478741206, 'tsl_mult': 0.6842510486984673, 'strategy': 'mean_reversion', 'time_stop': 103, 'use_sma': False, 'use_atr': False, 'use_adx': False, 'use_ema': False, 'use_spike': False, 'rsi_required': False, 'edge_k': 0.8916666771256792, 'edge_cap': 0.8300851817768913}.
[I 2025-08-29 23:42:54,649] Trial 1138 finished with values: [-1000000000.0, 1000000000.0] and parameters: {'p_sma': 59, 'p_std': 43, 'p_atr': 24, 'p_adx': 16, 'rsi_period': 21, 'ema1': 24, 'ema2': 14, 'slip_atr_k': 0.016869714224810445, 'slip_spread_k': 0.8772976741546972, 'spread_hl_frac': 0.004129741205953018, 'bb_std_mult': 1.9676309496467213, 'rsi_os': 27, 'rsi_ob': 60, 'vol_spike': 0.1825335107376929, 'adx_thresh': 24.332850131189634, 'atr_min_pct': 0.027218022707436458, 'atr_max_pct': 0.060455798946775295, 'tp_mult': 1.1842837308822838, 'tsl_mult': 0.7320593686599165, 'strategy': 'mean_reversion', 'time_stop': 114, 'use_sma': False, 'use_atr': False, 'use_adx': False, 'use_ema': False, 'use_spike': False, 'rsi_required': False, 'edge_k': 0.49752429298431244, 'edge_cap': 0.8268967525036677}.
[I 2025-08-29 23:43:22,033] Trial 1142 finished with values: [-1000000000.0, 1000000000.0] and parameters: {'p_sma': 8, 'p_std': 14, 'p_atr': 21, 'p_adx': 16, 'rsi_period': 22, 'ema1': 8, 'ema2': 26, 'slip_atr_k': 0.12391124330538719, 'slip_spread_k': 0.49423667906547114, 'spread_hl_frac': 0.03954202729889326, 'bb_std_mult': 1.3209563722287392, 'rsi_os': 18, 'rsi_ob': 57, 'vol_spike': 0.09300519064425383, 'adx_thresh': 30.60652693524312, 'atr_min_pct': 0.02880399752705077, 'atr_max_pct': 0.09856511542505728, 'tp_mult': 1.9598180067342577, 'tsl_mult': 0.7464972852116443, 'strategy': 'breakout', 'time_stop': 67, 'use_sma': False, 'use_atr': False, 'use_adx': False, 'use_ema': False, 'use_spike': False, 'rsi_required': False, 'edge_k': 1.2840938867232232, 'edge_cap': 0.26806611610808534}.
[I 2025-08-29 23:43:22,218] Trial 1141 finished with values: [-1000000000.0, 1000000000.0] and parameters: {'p_sma': 8, 'p_std': 21, 'p_atr': 21, 'p_adx': 16, 'rsi_period': 21, 'ema1': 25, 'ema2': 59, 'slip_atr_k': 0.21116596075766897, 'slip_spread_k': 0.8837740225265869, 'spread_hl_frac': 0.003717773917652635, 'bb_std_mult': 1.162210016326982, 'rsi_os': 18, 'rsi_ob': 60, 'vol_spike': 0.0927331970891537, 'adx_thresh': 27.31814800515274, 'atr_min_pct': 0.0031386964174705306, 'atr_max_pct': 0.09847164250143137, 'tp_mult': 1.8378685716422083, 'tsl_mult': 0.08665345265281521, 'strategy': 'breakout', 'time_stop': 229, 'use_sma': False, 'use_atr': False, 'use_adx': False, 'use_ema': False, 'use_spike': False, 'rsi_required': False, 'edge_k': 1.2731432689919635, 'edge_cap': 0.6804646627280404}.
[I 2025-08-29 23:43:22,346] Trial 1139 finished with values: [-1000000000.0, 1000000000.0] and parameters: {'p_sma': 33, 'p_std': 21, 'p_atr': 21, 'p_adx': 16, 'rsi_period': 22, 'ema1': 25, 'ema2': 31, 'slip_atr_k': 0.017038560604349877, 'slip_spread_k': 0.796289723713566, 'spread_hl_frac': 0.005959802448746752, 'bb_std_mult': 1.125581758694529, 'rsi_os': 18, 'rsi_ob': 57, 'vol_spike': 0.19170905212772896, 'adx_thresh': 27.109308637485846, 'atr_min_pct': 0.009126271729952565, 'atr_max_pct': 0.09824146520391279, 'tp_mult': 1.1683480267711233, 'tsl_mult': 0.742792316964888, 'strategy': 'breakout', 'time_stop': 113, 'use_sma': False, 'use_atr': False, 'use_adx': False, 'use_ema': False, 'use_spike': False, 'rsi_required': False, 'edge_k': 0.48479655211781103, 'edge_cap': 0.8277230342550018}.
[I 2025-08-29 23:43:22,356] Trial 1140 finished with values: [-1000000000.0, 1000000000.0] and parameters: {'p_sma': 55, 'p_std': 21, 'p_atr': 21, 'p_adx': 16, 'rsi_period': 21, 'ema1': 8, 'ema2': 59, 'slip_atr_k': 0.017269003971363092, 'slip_spread_k': 0.8834340748556575, 'spread_hl_frac': 0.005330035626867603, 'bb_std_mult': 1.1198331257118495, 'rsi_os': 30, 'rsi_ob': 60, 'vol_spike': 0.12107664612351494, 'adx_thresh': 25.439244126822746, 'atr_min_pct': 0.00908418074867803, 'atr_max_pct': 0.09874226079011336, 'tp_mult': 1.955698528112201, 'tsl_mult': 0.018032721078254543, 'strategy': 'breakout', 'time_stop': 116, 'use_sma': False, 'use_atr': False, 'use_adx': False, 'use_ema': False, 'use_spike': False, 'rsi_required': False, 'edge_k': 0.4867034168303134, 'edge_cap': 0.6274704515258374}.
[I 2025-08-29 23:43:49,894] Trial 1145 finished with values: [-1000000000.0, 1000000000.0] and parameters: {'p_sma': 5, 'p_std': 23, 'p_atr': 23, 'p_adx': 16, 'rsi_period': 77, 'ema1': 23, 'ema2': 49, 'slip_atr_k': 0.24313140639364256, 'slip_spread_k': 0.8543640471632072, 'spread_hl_frac': 0.010331783946424415, 'bb_std_mult': 3.1547687707869603, 'rsi_os': 24, 'rsi_ob': 58, 'vol_spike': 0.20481701079856632, 'adx_thresh': 23.353736215567455, 'atr_min_pct': 5.314815356134359e-06, 'atr_max_pct': 0.020811529454149547, 'tp_mult': 1.1509475770670579, 'tsl_mult': 0.722943884299445, 'strategy': 'breakout', 'time_stop': 107, 'use_sma': False, 'use_atr': False, 'use_adx': False, 'use_ema': False, 'use_spike': False, 'rsi_required': False, 'edge_k': 0.5477372557785396, 'edge_cap': 0.8057863764571491}.
[I 2025-08-29 23:43:49,911] Trial 1144 finished with values: [-1000000000.0, 1000000000.0] and parameters: {'p_sma': 7, 'p_std': 28, 'p_atr': 23, 'p_adx': 16, 'rsi_period': 83, 'ema1': 6, 'ema2': 55, 'slip_atr_k': 0.1577332463160538, 'slip_spread_k': 0.84968809015974, 'spread_hl_frac': 0.010116840248376585, 'bb_std_mult': 3.594615077683132, 'rsi_os': 24, 'rsi_ob': 62, 'vol_spike': 0.2949886694933006, 'adx_thresh': 5.002113718823294, 'atr_min_pct': 0.0027063461062446295, 'atr_max_pct': 0.09184537717361664, 'tp_mult': 1.1307296491815708, 'tsl_mult': 0.8696194151361858, 'strategy': 'breakout', 'time_stop': 119, 'use_sma': False, 'use_atr': False, 'use_adx': False, 'use_ema': False, 'use_spike': False, 'rsi_required': False, 'edge_k': 0.49099540511524803, 'edge_cap': 0.7674291850630683}.
[I 2025-08-29 23:43:50,171] Trial 1146 finished with values: [-1000000000.0, 1000000000.0] and parameters: {'p_sma': 31, 'p_std': 23, 'p_atr': 23, 'p_adx': 11, 'rsi_period': 19, 'ema1': 23, 'ema2': 10, 'slip_atr_k': 0.02981796331146977, 'slip_spread_k': 0.8451866083092325, 'spread_hl_frac': 0.010144423257774985, 'bb_std_mult': 2.041112278047168, 'rsi_os': 24, 'rsi_ob': 58, 'vol_spike': 0.29453721776578184, 'adx_thresh': 26.35990871930309, 'atr_min_pct': 0.006373024572299393, 'atr_max_pct': 0.09236635064553451, 'tp_mult': 1.1332040496368445, 'tsl_mult': 0.7248892437305962, 'strategy': 'breakout', 'time_stop': 121, 'use_sma': False, 'use_atr': False, 'use_adx': False, 'use_ema': False, 'use_spike': False, 'rsi_required': False, 'edge_k': 0.5450532141675547, 'edge_cap': 0.774013540733609}.
[I 2025-08-29 23:43:50,180] Trial 1143 finished with values: [-1000000000.0, 1000000000.0] and parameters: {'p_sma': 10, 'p_std': 59, 'p_atr': 23, 'p_adx': 16, 'rsi_period': 19, 'ema1': 20, 'ema2': 55, 'slip_atr_k': 0.11147983226245202, 'slip_spread_k': 0.8451634869065785, 'spread_hl_frac': 0.03312809991765816, 'bb_std_mult': 2.5437096890756066, 'rsi_os': 26, 'rsi_ob': 58, 'vol_spike': 0.29536442030549226, 'adx_thresh': 25.576244498041742, 'atr_min_pct': 0.0029560898314927855, 'atr_max_pct': 0.09153812117329951, 'tp_mult': 1.1332018492711569, 'tsl_mult': 0.01569525762284818, 'strategy': 'breakout', 'time_stop': 119, 'use_sma': False, 'use_atr': False, 'use_adx': False, 'use_ema': False, 'use_spike': False, 'rsi_required': False, 'edge_k': 0.48780050616524284, 'edge_cap': 0.685293992705442}.
[I 2025-08-29 23:44:17,979] Trial 1149 finished with values: [-1000000000.0, 1000000000.0] and parameters: {'p_sma': 6, 'p_std': 26, 'p_atr': 24, 'p_adx': 16, 'rsi_period': 56, 'ema1': 24, 'ema2': 54, 'slip_atr_k': 0.18086762532069728, 'slip_spread_k': 0.8148988143273109, 'spread_hl_frac': 0.02046436099373783, 'bb_std_mult': 2.120406742965812, 'rsi_os': 27, 'rsi_ob': 60, 'vol_spike': 0.05680132448026086, 'adx_thresh': 25.963558322891128, 'atr_min_pct': 0.0016792697056026663, 'atr_max_pct': 0.10118831863941766, 'tp_mult': 2.648426491730053, 'tsl_mult': 0.6229111031940165, 'strategy': 'breakout', 'time_stop': 260, 'use_sma': False, 'use_atr': False, 'use_adx': False, 'use_ema': False, 'use_spike': False, 'rsi_required': False, 'edge_k': 0.6445117630993801, 'edge_cap': 0.20193922054632446}.
[I 2025-08-29 23:44:18,141] Trial 1147 finished with values: [-1000000000.0, 1000000000.0] and parameters: {'p_sma': 9, 'p_std': 26, 'p_atr': 24, 'p_adx': 16, 'rsi_period': 54, 'ema1': 24, 'ema2': 54, 'slip_atr_k': 0.17169257183167386, 'slip_spread_k': 0.8046001658724532, 'spread_hl_frac': 0.03170416363484281, 'bb_std_mult': 0.7288457741337668, 'rsi_os': 28, 'rsi_ob': 89, 'vol_spike': 0.28477257672503453, 'adx_thresh': 26.29241477588246, 'atr_min_pct': 0.006490803120081792, 'atr_max_pct': 0.09019323236554692, 'tp_mult': 2.4899320752083844, 'tsl_mult': 0.8119559614390879, 'strategy': 'breakout', 'time_stop': 90, 'use_sma': False, 'use_atr': False, 'use_adx': False, 'use_ema': False, 'use_spike': False, 'rsi_required': False, 'edge_k': 0.4361848457470213, 'edge_cap': 0.776792718677318}.
[I 2025-08-29 23:44:18,219] Trial 1150 finished with values: [-0.007488466494508295, 0.007490852893293728] and parameters: {'p_sma': 6, 'p_std': 26, 'p_atr': 24, 'p_adx': 16, 'rsi_period': 10, 'ema1': 14, 'ema2': 54, 'slip_atr_k': 0.19950103924463858, 'slip_spread_k': 0.8160605999028719, 'spread_hl_frac': 0.020817431819180277, 'bb_std_mult': 2.2531963971632196, 'rsi_os': 27, 'rsi_ob': 84, 'vol_spike': 0.10974162444365287, 'adx_thresh': 26.125418659040314, 'atr_min_pct': 0.0024302394700094487, 'atr_max_pct': 0.08877620814225361, 'tp_mult': 2.655628709980073, 'tsl_mult': 0.79443078429638, 'strategy': 'breakout', 'time_stop': 108, 'use_sma': False, 'use_atr': False, 'use_adx': False, 'use_ema': False, 'use_spike': False, 'rsi_required': False, 'edge_k': 0.43051297603205946, 'edge_cap': 0.7867209227481764}.
[I 2025-08-29 23:44:18,291] Trial 1148 finished with values: [-1000000000.0, 1000000000.0] and parameters: {'p_sma': 10, 'p_std': 60, 'p_atr': 24, 'p_adx': 16, 'rsi_period': 56, 'ema1': 22, 'ema2': 18, 'slip_atr_k': 0.010857515334780465, 'slip_spread_k': 0.8172215814765141, 'spread_hl_frac': 0.02433280216991736, 'bb_std_mult': 2.03079371341045, 'rsi_os': 28, 'rsi_ob': 61, 'vol_spike': 0.1569964989382107, 'adx_thresh': 26.45127235184179, 'atr_min_pct': 0.006297571389071057, 'atr_max_pct': 0.09346184015672154, 'tp_mult': 2.6264305383727637, 'tsl_mult': 0.6731492253854572, 'strategy': 'breakout', 'time_stop': 124, 'use_sma': False, 'use_atr': False, 'use_adx': False, 'use_ema': False, 'use_spike': False, 'rsi_required': False, 'edge_k': 0.0030851435059060517, 'edge_cap': 0.7883859475034254}.
[I 2025-08-29 23:44:45,408] Trial 1151 finished with values: [-1000000000.0, 1000000000.0] and parameters: {'p_sma': 42, 'p_std': 29, 'p_atr': 7, 'p_adx': 17, 'rsi_period': 18, 'ema1': 14, 'ema2': 51, 'slip_atr_k': 0.06503228188279106, 'slip_spread_k': 0.7892369169434484, 'spread_hl_frac': 0.03139511340735285, 'bb_std_mult': 0.7043848918340592, 'rsi_os': 8, 'rsi_ob': 45, 'vol_spike': 0.13474382593654513, 'adx_thresh': 25.19462824464385, 'atr_min_pct': 0.004596073322774079, 'atr_max_pct': 0.08996236799206088, 'tp_mult': 1.6360373459279787, 'tsl_mult': 0.9989244795294113, 'strategy': 'breakout', 'time_stop': 108, 'use_sma': False, 'use_atr': False, 'use_adx': False, 'use_ema': False, 'use_spike': False, 'rsi_required': False, 'edge_k': 0.004108272686823344, 'edge_cap': 0.8535649451569751}.
[I 2025-08-29 23:44:45,567] Trial 1152 finished with values: [-0.037876820402130806, 0.03787336863731861] and parameters: {'p_sma': 42, 'p_std': 11, 'p_atr': 22, 'p_adx': 8, 'rsi_period': 36, 'ema1': 14, 'ema2': 51, 'slip_atr_k': 0.011801975316183386, 'slip_spread_k': 0.7902013336878514, 'spread_hl_frac': 0.017947970069289772, 'bb_std_mult': 2.259065196298604, 'rsi_os': 39, 'rsi_ob': 61, 'vol_spike': 0.13315821949405088, 'adx_thresh': 25.036812852276256, 'atr_min_pct': 0.0017344692461686278, 'atr_max_pct': 0.09427778302400676, 'tp_mult': 1.0315782585911915, 'tsl_mult': 0.7752136014441767, 'strategy': 'mean_reversion', 'time_stop': 106, 'use_sma': False, 'use_atr': False, 'use_adx': False, 'use_ema': False, 'use_spike': False, 'rsi_required': False, 'edge_k': 0.7017568264115789, 'edge_cap': 0.06796455033148247}.
[I 2025-08-29 23:44:45,774] Trial 1154 finished with values: [-0.011526186464273058, 0.011503671610439687] and parameters: {'p_sma': 49, 'p_std': 29, 'p_atr': 9, 'p_adx': 17, 'rsi_period': 36, 'ema1': 25, 'ema2': 52, 'slip_atr_k': 0.020131108235711632, 'slip_spread_k': 0.7883201414907438, 'spread_hl_frac': 0.014677287288677834, 'bb_std_mult': 1.2418644578328435, 'rsi_os': 22, 'rsi_ob': 81, 'vol_spike': 0.03557972309386234, 'adx_thresh': 27.876748430740882, 'atr_min_pct': 0.0014021769669238886, 'atr_max_pct': 0.09503572393618782, 'tp_mult': 1.0130012904726524, 'tsl_mult': 0.9992140247122181, 'strategy': 'mean_reversion', 'time_stop': 26, 'use_sma': False, 'use_atr': False, 'use_adx': False, 'use_ema': False, 'use_spike': False, 'rsi_required': False, 'edge_k': 0.5324960419372174, 'edge_cap': 0.8505258781443618}.
[I 2025-08-29 23:44:45,789] Trial 1153 finished with values: [-0.003256534063459382, 0.0032497345791277195] and parameters: {'p_sma': 8, 'p_std': 29, 'p_atr': 22, 'p_adx': 8, 'rsi_period': 31, 'ema1': 16, 'ema2': 48, 'slip_atr_k': 0.011397483606867657, 'slip_spread_k': 0.7902401877036964, 'spread_hl_frac': 0.037268759437477525, 'bb_std_mult': 1.2259054481175853, 'rsi_os': 38, 'rsi_ob': 82, 'vol_spike': 0.15502656537580492, 'adx_thresh': 25.38999000335326, 'atr_min_pct': 0.0013553214072503852, 'atr_max_pct': 0.09451388062358336, 'tp_mult': 2.3715965954853093, 'tsl_mult': 0.00025783483554936426, 'strategy': 'mean_reversion', 'time_stop': 160, 'use_sma': False, 'use_atr': False, 'use_adx': False, 'use_ema': False, 'use_spike': False, 'rsi_required': False, 'edge_k': 0.535521732941666, 'edge_cap': 0.8548340864546815}.
[I 2025-08-29 23:45:13,709] Trial 1157 finished with values: [-1000000000.0, 1000000000.0] and parameters: {'p_sma': 8, 'p_std': 24, 'p_atr': 23, 'p_adx': 15, 'rsi_period': 23, 'ema1': 16, 'ema2': 56, 'slip_atr_k': 0.13286507826968558, 'slip_spread_k': 0.053420082402827085, 'spread_hl_frac': 0.03718532365241709, 'bb_std_mult': 2.179858289978866, 'rsi_os': 26, 'rsi_ob': 91, 'vol_spike': 0.16683126600311549, 'adx_thresh': 6.714256900339523, 'atr_min_pct': 0.008185224174190889, 'atr_max_pct': 0.03231927119595808, 'tp_mult': 1.2720462840565483, 'tsl_mult': 0.3734644864924191, 'strategy': 'breakout', 'time_stop': 132, 'use_sma': False, 'use_atr': False, 'use_adx': False, 'use_ema': False, 'use_spike': False, 'rsi_required': False, 'edge_k': 0.5801967514285942, 'edge_cap': 0.7258111833266859}.
[I 2025-08-29 23:45:13,896] Trial 1158 finished with values: [-1000000000.0, 1000000000.0] and parameters: {'p_sma': 5, 'p_std': 24, 'p_atr': 18, 'p_adx': 15, 'rsi_period': 38, 'ema1': 29, 'ema2': 11, 'slip_atr_k': 0.14954780231076753, 'slip_spread_k': 0.24637908074141263, 'spread_hl_frac': 0.015880744724931197, 'bb_std_mult': 2.4327314967595415, 'rsi_os': 26, 'rsi_ob': 79, 'vol_spike': 0.06866989834857753, 'adx_thresh': 17.575761879651566, 'atr_min_pct': 0.019955835937509825, 'atr_max_pct': 0.1004613616786415, 'tp_mult': 1.0889232562299582, 'tsl_mult': 0.36353226342279116, 'strategy': 'breakout', 'time_stop': 100, 'use_sma': False, 'use_atr': False, 'use_adx': False, 'use_ema': False, 'use_spike': False, 'rsi_required': False, 'edge_k': 0.5890194941746852, 'edge_cap': 0.3082355958684978}.
[I 2025-08-29 23:45:14,034] Trial 1155 finished with values: [-0.023644621054011106, 0.023624262597061033] and parameters: {'p_sma': 43, 'p_std': 24, 'p_atr': 22, 'p_adx': 29, 'rsi_period': 37, 'ema1': 17, 'ema2': 37, 'slip_atr_k': 0.02034614155793935, 'slip_spread_k': 0.25324875978383754, 'spread_hl_frac': 0.015979548541462385, 'bb_std_mult': 3.003615829844446, 'rsi_os': 38, 'rsi_ob': 63, 'vol_spike': 0.19085972164208906, 'adx_thresh': 25.225104557746377, 'atr_min_pct': 0.0014941000634008288, 'atr_max_pct': 0.09469163603604154, 'tp_mult': 2.848917894694072, 'tsl_mult': 0.6980407649057463, 'strategy': 'mean_reversion', 'time_stop': 103, 'use_sma': False, 'use_atr': False, 'use_adx': False, 'use_ema': False, 'use_spike': False, 'rsi_required': False, 'edge_k': 0.580107324998421, 'edge_cap': 0.7564315224581235}.
[I 2025-08-29 23:45:14,115] Trial 1156 finished with values: [-0.008279874495027983, 0.00834380936113788] and parameters: {'p_sma': 37, 'p_std': 22, 'p_atr': 18, 'p_adx': 7, 'rsi_period': 22, 'ema1': 25, 'ema2': 52, 'slip_atr_k': 0.10558594726403517, 'slip_spread_k': 0.6793617860688985, 'spread_hl_frac': 0.01569193147886587, 'bb_std_mult': 2.1495436442161724, 'rsi_os': 25, 'rsi_ob': 78, 'vol_spike': 0.16835225479054552, 'adx_thresh': 10.564162236663382, 'atr_min_pct': 0.0031249057489993147, 'atr_max_pct': 0.09660092820041476, 'tp_mult': 1.0737240462744282, 'tsl_mult': 0.7062566927986372, 'strategy': 'mean_reversion', 'time_stop': 26, 'use_sma': False, 'use_atr': False, 'use_adx': False, 'use_ema': False, 'use_spike': False, 'rsi_required': False, 'edge_k': 1.3335512609377185, 'edge_cap': 0.37323650832031535}.
[I 2025-08-29 23:45:41,831] Trial 1162 finished with values: [-1000000000.0, 1000000000.0] and parameters: {'p_sma': 18, 'p_std': 27, 'p_atr': 23, 'p_adx': 30, 'rsi_period': 19, 'ema1': 10, 'ema2': 53, 'slip_atr_k': 0.036528861276373274, 'slip_spread_k': 0.07514836202068581, 'spread_hl_frac': 0.012493748264325295, 'bb_std_mult': 1.9989461334558598, 'rsi_os': 30, 'rsi_ob': 88, 'vol_spike': 0.17932477261718585, 'adx_thresh': 19.735460107793905, 'atr_min_pct': 0.01038274054608464, 'atr_max_pct': 0.041780355666117555, 'tp_mult': 2.092097129737149, 'tsl_mult': 0.6492498086567562, 'strategy': 'breakout', 'time_stop': 276, 'use_sma': False, 'use_atr': False, 'use_adx': False, 'use_ema': False, 'use_spike': False, 'rsi_required': False, 'edge_k': 0.292182711785691, 'edge_cap': 0.8069734416941586}.
[I 2025-08-29 23:45:41,980] Trial 1160 finished with values: [-1000000000.0, 1000000000.0] and parameters: {'p_sma': 7, 'p_std': 22, 'p_atr': 19, 'p_adx': 20, 'rsi_period': 18, 'ema1': 24, 'ema2': 53, 'slip_atr_k': 0.02139373921816352, 'slip_spread_k': 0.8252476453234644, 'spread_hl_frac': 0.018825017694791606, 'bb_std_mult': 3.0039985851278015, 'rsi_os': 25, 'rsi_ob': 69, 'vol_spike': 0.1783228534248864, 'adx_thresh': 23.659895753527866, 'atr_min_pct': 0.003161222547820288, 'atr_max_pct': 0.04587986266270706, 'tp_mult': 2.1941900093606916, 'tsl_mult': 0.7025829206240508, 'strategy': 'breakout', 'time_stop': 294, 'use_sma': False, 'use_atr': False, 'use_adx': False, 'use_ema': False, 'use_spike': False, 'rsi_required': False, 'edge_k': 0.5223618282613719, 'edge_cap': 0.38141688874541974}.
