[I 2025-08-29 21:50:47,900] Trial 110 finished with values: [-1000000000.0, 1000000000.0] and parameters: {'p_sma': 50, 'p_std': 25, 'p_atr': 19, 'p_adx': 19, 'rsi_period': 24, 'ema1': 27, 'ema2': 20, 'slip_atr_k': 0.014089411125481347, 'slip_spread_k': 0.9405896166157899, 'spread_hl_frac': 0.021445108879768547, 'bb_std_mult': 0.7453701466185979, 'rsi_os': 25, 'rsi_ob': 47, 'vol_spike': 0.264588393555191, 'adx_thresh': 23.45288413660833, 'atr_min_pct': 0.0021372996289567465, 'atr_max_pct': 0.10188628832311625, 'tp_mult': 1.0774495113889027, 'tsl_mult': 0.14727993733973938, 'strategy': 'mean_reversion', 'time_stop': 91, 'use_sma': False, 'use_atr': False, 'use_adx': False, 'use_ema': False, 'use_spike': False, 'rsi_required': False, 'edge_k': 0.6595594566616486, 'edge_cap': 0.8485457566486088}.
[I 2025-08-29 21:51:14,819] Trial 109 finished with values: [-1000000000.0, 1000000000.0] and parameters: {'p_sma': 49, 'p_std': 25, 'p_atr': 28, 'p_adx': 22, 'rsi_period': 71, 'ema1': 29, 'ema2': 20, 'slip_atr_k': 0.01474022865297603, 'slip_spread_k': 0.9321468512795914, 'spread_hl_frac': 0.00889427664262955, 'bb_std_mult': 0.9971013073602433, 'rsi_os': 25, 'rsi_ob': 59, 'vol_spike': 0.28691605136591475, 'adx_thresh': 23.470751533228427, 'atr_min_pct': 0.02628695889230956, 'atr_max_pct': 0.10241784036138109, 'tp_mult': 2.668919970397397, 'tsl_mult': 0.8262570164911199, 'strategy': 'breakout', 'time_stop': 51, 'use_sma': False, 'use_atr': False, 'use_adx': False, 'use_ema': False, 'use_spike': False, 'rsi_required': False, 'edge_k': 0.6551815587743712, 'edge_cap': 0.8503659102241383}.
[I 2025-08-29 21:51:14,907] Trial 111 finished with values: [-1000000000.0, 1000000000.0] and parameters: {'p_sma': 6, 'p_std': 25, 'p_atr': 20, 'p_adx': 9, 'rsi_period': 47, 'ema1': 27, 'ema2': 20, 'slip_atr_k': 0.12233155526730868, 'slip_spread_k': 0.9346804564166218, 'spread_hl_frac': 0.02173775246170252, 'bb_std_mult': 2.956571229476522, 'rsi_os': 33, 'rsi_ob': 88, 'vol_spike': 0.20539828822657746, 'adx_thresh': 29.89877563503373, 'atr_min_pct': 0.026096412855929046, 'atr_max_pct': 0.13921173876702767, 'tp_mult': 1.0692181785481165, 'tsl_mult': 0.720313950017397, 'strategy': 'mean_reversion', 'time_stop': 92, 'use_sma': False, 'use_atr': False, 'use_adx': False, 'use_ema': False, 'use_spike': False, 'rsi_required': False, 'edge_k': 0.43883693460834705, 'edge_cap': 0.2977816598834786}.
[I 2025-08-29 21:51:14,982] Trial 112 finished with values: [-1000000000.0, 1000000000.0] and parameters: {'p_sma': 15, 'p_std': 32, 'p_atr': 24, 'p_adx': 23, 'rsi_period': 41, 'ema1': 29, 'ema2': 13, 'slip_atr_k': 0.12015580528676448, 'slip_spread_k': 0.9710815600168075, 'spread_hl_frac': 0.008838138731577343, 'bb_std_mult': 1.0146933706917598, 'rsi_os': 32, 'rsi_ob': 88, 'vol_spike': 0.20659584335846753, 'adx_thresh': 31.543543715042794, 'atr_min_pct': 0.02661639455301042, 'atr_max_pct': 0.09792726092835978, 'tp_mult': 2.2929055202065043, 'tsl_mult': 0.8123626373448722, 'strategy': 'breakout', 'time_stop': 211, 'use_sma': False, 'use_atr': False, 'use_adx': False, 'use_ema': False, 'use_spike': False, 'rsi_required': False, 'edge_k': 0.007253273120585657, 'edge_cap': 0.3020036416056238}.
[I 2025-08-29 21:51:15,079] Trial 108 finished with values: [-0.004171174035946357, 0.004423207432217073] and parameters: {'p_sma': 8, 'p_std': 24, 'p_atr': 10, 'p_adx': 12, 'rsi_period': 19, 'ema1': 27, 'ema2': 20, 'slip_atr_k': 0.011612225321478944, 'slip_spread_k': 0.7436860665189599, 'spread_hl_frac': 0.000558334923654577, 'bb_std_mult': 2.618538974282406, 'rsi_os': 25, 'rsi_ob': 59, 'vol_spike': 0.07153104171373435, 'adx_thresh': 31.50543844797581, 'atr_min_pct': 0.0022495985954794915, 'atr_max_pct': 0.1036460302898195, 'tp_mult': 1.1490894518945063, 'tsl_mult': 0.8177564379546867, 'strategy': 'breakout', 'time_stop': 90, 'use_sma': False, 'use_atr': False, 'use_adx': False, 'use_ema': False, 'use_spike': False, 'rsi_required': False, 'edge_k': 0.5794895460066053, 'edge_cap': 0.3002275749450272}.
[I 2025-08-29 21:51:41,661] Trial 116 finished with values: [-0.003472861970682417, 0.0034763151807823568] and parameters: {'p_sma': 11, 'p_std': 24, 'p_atr': 8, 'p_adx': 27, 'rsi_period': 28, 'ema1': 26, 'ema2': 12, 'slip_atr_k': 0.038935377139692154, 'slip_spread_k': 0.8623879424429445, 'spread_hl_frac': 0.014895187289875425, 'bb_std_mult': 1.191377414988996, 'rsi_os': 27, 'rsi_ob': 62, 'vol_spike': 0.17027383314698658, 'adx_thresh': 28.421219992511755, 'atr_min_pct': 0.002500925714866745, 'atr_max_pct': 0.06536785824436268, 'tp_mult': 1.8110432009083357, 'tsl_mult': 0.8500110748507401, 'strategy': 'breakout', 'time_stop': 257, 'use_sma': False, 'use_atr': False, 'use_adx': False, 'use_ema': False, 'use_spike': False, 'rsi_required': False, 'edge_k': 0.9284611613424413, 'edge_cap': 0.3781365307945959}.
[I 2025-08-29 21:51:41,819] Trial 114 finished with values: [-1000000000.0, 1000000000.0] and parameters: {'p_sma': 11, 'p_std': 29, 'p_atr': 24, 'p_adx': 27, 'rsi_period': 43, 'ema1': 19, 'ema2': 13, 'slip_atr_k': 0.10328054324878784, 'slip_spread_k': 0.12323221899882991, 'spread_hl_frac': 0.023850408074081068, 'bb_std_mult': 3.3336883814386176, 'rsi_os': 5, 'rsi_ob': 62, 'vol_spike': 0.19642082924660303, 'adx_thresh': 31.811483980054216, 'atr_min_pct': 0.0006097718869900084, 'atr_max_pct': 0.0674764078177074, 'tp_mult': 2.2969842794762934, 'tsl_mult': 0.8070589248904233, 'strategy': 'breakout', 'time_stop': 257, 'use_sma': False, 'use_atr': False, 'use_adx': False, 'use_ema': False, 'use_spike': False, 'rsi_required': False, 'edge_k': 0.537985974939016, 'edge_cap': 0.23865196134797162}.
[I 2025-08-29 21:51:42,088] Trial 115 finished with values: [-1000000000.0, 1000000000.0] and parameters: {'p_sma': 11, 'p_std': 29, 'p_atr': 27, 'p_adx': 27, 'rsi_period': 23, 'ema1': 26, 'ema2': 44, 'slip_atr_k': 0.011089880272001099, 'slip_spread_k': 0.8486707578257618, 'spread_hl_frac': 0.023920578632624503, 'bb_std_mult': 1.1924640753952729, 'rsi_os': 27, 'rsi_ob': 62, 'vol_spike': 0.07359470544432917, 'adx_thresh': 34.48979379653595, 'atr_min_pct': 0.002590931973564146, 'atr_max_pct': 0.07089300660605491, 'tp_mult': 2.152743956855816, 'tsl_mult': 0.8546068132285876, 'strategy': 'breakout', 'time_stop': 300, 'use_sma': False, 'use_atr': False, 'use_adx': False, 'use_ema': False, 'use_spike': False, 'rsi_required': False, 'edge_k': 0.9629050746427456, 'edge_cap': 0.4492017504457162}.
[I 2025-08-29 21:51:42,170] Trial 113 finished with values: [-1000000000.0, 1000000000.0] and parameters: {'p_sma': 15, 'p_std': 29, 'p_atr': 24, 'p_adx': 27, 'rsi_period': 28, 'ema1': 12, 'ema2': 11, 'slip_atr_k': 0.12040319645061111, 'slip_spread_k': 0.12937103442967285, 'spread_hl_frac': 0.006932753135725984, 'bb_std_mult': 0.5793817732537495, 'rsi_os': 27, 'rsi_ob': 55, 'vol_spike': 0.07754663600104786, 'adx_thresh': 34.50480361472181, 'atr_min_pct': 0.0025221097055349636, 'atr_max_pct': 0.14059460852526895, 'tp_mult': 2.2907549250201917, 'tsl_mult': 0.7136552117410692, 'strategy': 'breakout', 'time_stop': 180, 'use_sma': False, 'use_atr': False, 'use_adx': False, 'use_ema': False, 'use_spike': False, 'rsi_required': False, 'edge_k': 0.4431934451089753, 'edge_cap': 0.7940538873079186}.
[I 2025-08-29 21:52:08,960] Trial 119 finished with values: [-1000000000.0, 1000000000.0] and parameters: {'p_sma': 18, 'p_std': 44, 'p_atr': 29, 'p_adx': 29, 'rsi_period': 73, 'ema1': 26, 'ema2': 18, 'slip_atr_k': 0.03908792147947672, 'slip_spread_k': 0.7413719694531694, 'spread_hl_frac': 0.015038821432966363, 'bb_std_mult': 0.5896592144881198, 'rsi_os': 28, 'rsi_ob': 57, 'vol_spike': 0.1748918916608426, 'adx_thresh': 33.27093430253116, 'atr_min_pct': 0.013774590886809364, 'atr_max_pct': 0.11877800755648787, 'tp_mult': 1.277645340876388, 'tsl_mult': 0.8901262130423406, 'strategy': 'mean_reversion', 'time_stop': 29, 'use_sma': False, 'use_atr': False, 'use_adx': False, 'use_ema': False, 'use_spike': False, 'rsi_required': False, 'edge_k': 1.2052283459715052, 'edge_cap': 0.7909440874576399}.
[I 2025-08-29 21:52:09,321] Trial 120 finished with values: [-1000000000.0, 1000000000.0] and parameters: {'p_sma': 18, 'p_std': 24, 'p_atr': 28, 'p_adx': 29, 'rsi_period': 76, 'ema1': 25, 'ema2': 34, 'slip_atr_k': 0.02588664673815024, 'slip_spread_k': 0.8580996628894588, 'spread_hl_frac': 0.0041002431826241935, 'bb_std_mult': 0.8150188683447085, 'rsi_os': 22, 'rsi_ob': 57, 'vol_spike': 0.1745090480473854, 'adx_thresh': 8.278589554769507, 'atr_min_pct': 0.01629444332749712, 'atr_max_pct': 0.12109105404740483, 'tp_mult': 2.4248531500527384, 'tsl_mult': 0.9033674267536386, 'strategy': 'mean_reversion', 'time_stop': 119, 'use_sma': False, 'use_atr': False, 'use_adx': False, 'use_ema': False, 'use_spike': False, 'rsi_required': False, 'edge_k': 1.184748230894641, 'edge_cap': 0.3705075564824586}.
[I 2025-08-29 21:52:09,486] Trial 117 finished with values: [-1000000000.0, 1000000000.0] and parameters: {'p_sma': 11, 'p_std': 24, 'p_atr': 16, 'p_adx': 29, 'rsi_period': 24, 'ema1': 26, 'ema2': 35, 'slip_atr_k': 0.10119210081559032, 'slip_spread_k': 0.534225734422055, 'spread_hl_frac': 0.006808431557962024, 'bb_std_mult': 0.7883548345027404, 'rsi_os': 16, 'rsi_ob': 66, 'vol_spike': 0.19779675097180416, 'adx_thresh': 7.717534200320106, 'atr_min_pct': 0.016830665507720076, 'atr_max_pct': 0.0665957936141809, 'tp_mult': 1.7969889229948839, 'tsl_mult': 0.0081537261555657, 'strategy': 'breakout', 'time_stop': 258, 'use_sma': False, 'use_atr': False, 'use_adx': False, 'use_ema': False, 'use_spike': False, 'rsi_required': False, 'edge_k': 1.1870212979648886, 'edge_cap': 0.7881864229435908}.
[I 2025-08-29 21:52:09,591] Trial 118 finished with values: [-1000000000.0, 1000000000.0] and parameters: {'p_sma': 42, 'p_std': 14, 'p_atr': 29, 'p_adx': 28, 'rsi_period': 32, 'ema1': 26, 'ema2': 34, 'slip_atr_k': 0.00031282879526554376, 'slip_spread_k': 0.8638353010555867, 'spread_hl_frac': 0.006512649578776118, 'bb_std_mult': 0.5756008044821268, 'rsi_os': 16, 'rsi_ob': 63, 'vol_spike': 0.18845896900321585, 'adx_thresh': 34.364870301302346, 'atr_min_pct': 0.0026109591107819586, 'atr_max_pct': 0.12783804116272085, 'tp_mult': 1.288890017383124, 'tsl_mult': 0.012025233948325775, 'strategy': 'breakout', 'time_stop': 138, 'use_sma': False, 'use_atr': False, 'use_adx': False, 'use_ema': False, 'use_spike': False, 'rsi_required': False, 'edge_k': 0.2871434605675225, 'edge_cap': 0.7957865053536596}.
[I 2025-08-29 21:52:36,144] Trial 122 finished with values: [-1000000000.0, 1000000000.0] and parameters: {'p_sma': 41, 'p_std': 14, 'p_atr': 30, 'p_adx': 28, 'rsi_period': 16, 'ema1': 23, 'ema2': 49, 'slip_atr_k': 0.0012560527619994415, 'slip_spread_k': 0.872577902233595, 'spread_hl_frac': 0.041764631795599916, 'bb_std_mult': 0.7682408932872828, 'rsi_os': 12, 'rsi_ob': 45, 'vol_spike': 0.19088787691590753, 'adx_thresh': 28.249373016787366, 'atr_min_pct': 0.005262065387175611, 'atr_max_pct': 0.12700441558795206, 'tp_mult': 1.189726049188165, 'tsl_mult': 0.7864352315521798, 'strategy': 'breakout', 'time_stop': 275, 'use_sma': False, 'use_atr': False, 'use_adx': False, 'use_ema': False, 'use_spike': False, 'rsi_required': False, 'edge_k': 1.334861086960169, 'edge_cap': 0.8828093522144651}.
[I 2025-08-29 21:52:36,497] Trial 121 finished with values: [-1000000000.0, 1000000000.0] and parameters: {'p_sma': 42, 'p_std': 19, 'p_atr': 28, 'p_adx': 28, 'rsi_period': 9, 'ema1': 6, 'ema2': 48, 'slip_atr_k': 0.00011850016265566726, 'slip_spread_k': 0.8710428885222559, 'spread_hl_frac': 0.004169561037195209, 'bb_std_mult': 0.8093451934338178, 'rsi_os': 12, 'rsi_ob': 63, 'vol_spike': 0.11017681913980716, 'adx_thresh': 8.423012945405883, 'atr_min_pct': 0.016536405511573687, 'atr_max_pct': 0.08876470893573385, 'tp_mult': 1.468227451391731, 'tsl_mult': 0.9296719416443322, 'strategy': 'breakout', 'time_stop': 140, 'use_sma': False, 'use_atr': False, 'use_adx': False, 'use_ema': False, 'use_spike': False, 'rsi_required': False, 'edge_k': 1.3073634657617994, 'edge_cap': 0.3748645021770064}.
[I 2025-08-29 21:52:36,831] Trial 123 finished with values: [-1000000000.0, 1000000000.0] and parameters: {'p_sma': 43, 'p_std': 18, 'p_atr': 30, 'p_adx': 28, 'rsi_period': 51, 'ema1': 24, 'ema2': 14, 'slip_atr_k': 0.002130819369190823, 'slip_spread_k': 0.8728069859075277, 'spread_hl_frac': 0.002711642262194655, 'bb_std_mult': 0.729202461658315, 'rsi_os': 13, 'rsi_ob': 63, 'vol_spike': 0.22440518813119562, 'adx_thresh': 28.29853242515548, 'atr_min_pct': 0.005331631113349542, 'atr_max_pct': 0.07275076619404601, 'tp_mult': 2.7779120244061972, 'tsl_mult': 0.7843085907647669, 'strategy': 'breakout', 'time_stop': 143, 'use_sma': False, 'use_atr': False, 'use_adx': False, 'use_ema': False, 'use_spike': False, 'rsi_required': False, 'edge_k': 0.16028367966711587, 'edge_cap': 0.0844938312510028}.
[I 2025-08-29 21:52:36,883] Trial 124 finished with values: [-1000000000.0, 1000000000.0] and parameters: {'p_sma': 7, 'p_std': 56, 'p_atr': 30, 'p_adx': 30, 'rsi_period': 20, 'ema1': 8, 'ema2': 48, 'slip_atr_k': 0.2426400450299046, 'slip_spread_k': 0.04855026724718686, 'spread_hl_frac': 0.0009311845841469667, 'bb_std_mult': 1.0708753043526704, 'rsi_os': 13, 'rsi_ob': 45, 'vol_spike': 0.16598779790554652, 'adx_thresh': 30.21048404791537, 'atr_min_pct': 0.005166434981851336, 'atr_max_pct': 0.08771295495430456, 'tp_mult': 1.0936999042474085, 'tsl_mult': 0.7758122711585681, 'strategy': 'breakout', 'time_stop': 289, 'use_sma': False, 'use_atr': False, 'use_adx': False, 'use_ema': False, 'use_spike': False, 'rsi_required': False, 'edge_k': 0.4020357498699527, 'edge_cap': 0.09757001857178593}.
[I 2025-08-29 21:53:02,496] Trial 128 finished with values: [-1000000000.0, 1000000000.0] and parameters: {'p_sma': 13, 'p_std': 22, 'p_atr': 11, 'p_adx': 14, 'rsi_period': 26, 'ema1': 22, 'ema2': 17, 'slip_atr_k': 0.08185927185353103, 'slip_spread_k': 0.9064205114482268, 'spread_hl_frac': 0.01266176754733372, 'bb_std_mult': 0.6908950589141278, 'rsi_os': 26, 'rsi_ob': 93, 'vol_spike': 0.022127065838760868, 'adx_thresh': 16.468140581362757, 'atr_min_pct': 0.015306797917424566, 'atr_max_pct': 0.10899503334591826, 'tp_mult': 1.1712183825946492, 'tsl_mult': 0.5112721681134257, 'strategy': 'mean_reversion', 'time_stop': 112, 'use_sma': False, 'use_atr': False, 'use_adx': False, 'use_ema': False, 'use_spike': False, 'rsi_required': False, 'edge_k': 1.5161215618787134, 'edge_cap': 0.598578139456668}.
[I 2025-08-29 21:53:03,795] Trial 125 finished with values: [-0.006015537085395373, 0.006038163887439584] and parameters: {'p_sma': 58, 'p_std': 20, 'p_atr': 30, 'p_adx': 30, 'rsi_period': 20, 'ema1': 6, 'ema2': 16, 'slip_atr_k': 0.028804896709767894, 'slip_spread_k': 0.9026707265302153, 'spread_hl_frac': 0.0028996509947683976, 'bb_std_mult': 0.7061285726311282, 'rsi_os': 26, 'rsi_ob': 61, 'vol_spike': 0.2216306680266244, 'adx_thresh': 32.54546170799172, 'atr_min_pct': 0.0019425050537357133, 'atr_max_pct': 0.0879042466013017, 'tp_mult': 1.4684348171760173, 'tsl_mult': 0.49507563945066985, 'strategy': 'breakout', 'time_stop': 114, 'use_sma': False, 'use_atr': False, 'use_adx': False, 'use_ema': False, 'use_spike': False, 'rsi_required': False, 'edge_k': 0.8475006556065343, 'edge_cap': 0.7661507553816517}.
[I 2025-08-29 21:53:03,826] Trial 126 finished with values: [-0.011071044390734142, 0.011042023677645115] and parameters: {'p_sma': 8, 'p_std': 22, 'p_atr': 8, 'p_adx': 30, 'rsi_period': 51, 'ema1': 8, 'ema2': 17, 'slip_atr_k': 0.029864004855213754, 'slip_spread_k': 0.9007224489660864, 'spread_hl_frac': 0.00034485864899452823, 'bb_std_mult': 0.6919471016401832, 'rsi_os': 44, 'rsi_ob': 93, 'vol_spike': 0.1664325086630939, 'adx_thresh': 32.568679813744005, 'atr_min_pct': 0.0018009428355118813, 'atr_max_pct': 0.11018692593141156, 'tp_mult': 1.098538348903797, 'tsl_mult': 0.5191581405223391, 'strategy': 'breakout', 'time_stop': 114, 'use_sma': False, 'use_atr': False, 'use_adx': False, 'use_ema': False, 'use_spike': False, 'rsi_required': False, 'edge_k': 0.5309052129222029, 'edge_cap': 0.1729840197959558}.
[I 2025-08-29 21:53:03,901] Trial 127 finished with values: [-0.004222078782039396, 0.004214619960371709] and parameters: {'p_sma': 6, 'p_std': 22, 'p_atr': 10, 'p_adx': 30, 'rsi_period': 20, 'ema1': 8, 'ema2': 17, 'slip_atr_k': 0.0292784962123658, 'slip_spread_k': 0.806218037655725, 'spread_hl_frac': 1.94856597857309e-05, 'bb_std_mult': 1.065160897032682, 'rsi_os': 26, 'rsi_ob': 59, 'vol_spike': 0.16632156985548452, 'adx_thresh': 16.041930348018447, 'atr_min_pct': 0.001955603113097548, 'atr_max_pct': 0.07946092333167336, 'tp_mult': 1.0822752923193273, 'tsl_mult': 0.2864658081308217, 'strategy': 'breakout', 'time_stop': 110, 'use_sma': False, 'use_atr': False, 'use_adx': False, 'use_ema': False, 'use_spike': False, 'rsi_required': False, 'edge_k': 0.5283894095726117, 'edge_cap': 0.15476912406070054}.
[I 2025-08-29 21:53:04,009] Trial 132 finished with values: [-1000000000.0, 1000000000.0] and parameters: {'p_sma': 32, 'p_std': 48, 'p_atr': 17, 'p_adx': 29, 'rsi_period': 29, 'ema1': 14, 'ema2': 25, 'slip_atr_k': 0.008566363562670848, 'slip_spread_k': 0.3329988408506627, 'spread_hl_frac': 0.005335370585701292, 'bb_std_mult': 0.9686143803037262, 'rsi_os': 55, 'rsi_ob': 58, 'vol_spike': 0.29925571691798303, 'adx_thresh': 31.197813333434237, 'atr_min_pct': 0.028217682810285166, 'atr_max_pct': 0.031174475666475313, 'tp_mult': 1.0584342250855705, 'tsl_mult': 0.7387868162957216, 'strategy': 'mean_reversion', 'time_stop': 46, 'use_sma': False, 'use_atr': False, 'use_adx': False, 'use_ema': False, 'use_spike': False, 'rsi_required': False, 'edge_k': 0.46826801557517395, 'edge_cap': 0.8365519837905248}.
[I 2025-08-29 21:53:30,057] Trial 129 finished with values: [-0.013745016016467715, 0.013721279671430919] and parameters: {'p_sma': 8, 'p_std': 47, 'p_atr': 8, 'p_adx': 7, 'rsi_period': 22, 'ema1': 25, 'ema2': 27, 'slip_atr_k': 0.1424996221495901, 'slip_spread_k': 0.24181192233885523, 'spread_hl_frac': 0.0006319665989067517, 'bb_std_mult': 1.1354491907827815, 'rsi_os': 29, 'rsi_ob': 75, 'vol_spike': 0.21341892345500116, 'adx_thresh': 32.258343919559195, 'atr_min_pct': 0.0017295323608853379, 'atr_max_pct': 0.030505519770517367, 'tp_mult': 1.1215727522895529, 'tsl_mult': 0.8266773626325022, 'strategy': 'breakout', 'time_stop': 86, 'use_sma': False, 'use_atr': False, 'use_adx': False, 'use_ema': False, 'use_spike': False, 'rsi_required': False, 'edge_k': 1.9980367187778638, 'edge_cap': 0.9136348308778052}.
[I 2025-08-29 21:53:30,729] Trial 130 finished with values: [-1000000000.0, 1000000000.0] and parameters: {'p_sma': 8, 'p_std': 26, 'p_atr': 13, 'p_adx': 29, 'rsi_period': 47, 'ema1': 25, 'ema2': 27, 'slip_atr_k': 0.180871551665942, 'slip_spread_k': 0.8055590020754195, 'spread_hl_frac': 0.0010838040458841479, 'bb_std_mult': 1.2661937489748802, 'rsi_os': 29, 'rsi_ob': 76, 'vol_spike': 0.2980383279421056, 'adx_thresh': 24.262108119344383, 'atr_min_pct': 0.027911063079667578, 'atr_max_pct': 0.09628139573658845, 'tp_mult': 1.0408665896850058, 'tsl_mult': 0.4115694223084262, 'strategy': 'breakout', 'time_stop': 99, 'use_sma': False, 'use_atr': False, 'use_adx': False, 'use_ema': False, 'use_spike': False, 'rsi_required': False, 'edge_k': 0.5213600344730543, 'edge_cap': 0.14283244785705512}.
[I 2025-08-29 21:53:31,018] Trial 131 finished with values: [-1000000000.0, 1000000000.0] and parameters: {'p_sma': 5, 'p_std': 26, 'p_atr': 29, 'p_adx': 29, 'rsi_period': 23, 'ema1': 25, 'ema2': 27, 'slip_atr_k': 0.054410336691007116, 'slip_spread_k': 0.7833604228056285, 'spread_hl_frac': 0.018108752936006056, 'bb_std_mult': 1.267612331987527, 'rsi_os': 9, 'rsi_ob': 58, 'vol_spike': 0.29588992559157257, 'adx_thresh': 21.188059420071042, 'atr_min_pct': 0.028237790132012424, 'atr_max_pct': 0.07842432782441665, 'tp_mult': 1.0353632295163893, 'tsl_mult': 0.8796431155524108, 'strategy': 'mean_reversion', 'time_stop': 98, 'use_sma': False, 'use_atr': False, 'use_adx': False, 'use_ema': False, 'use_spike': False, 'rsi_required': False, 'edge_k': 1.9894482491617012, 'edge_cap': 0.8951906799845925}.
[I 2025-08-29 21:53:31,357] Trial 133 finished with values: [-1000000000.0, 1000000000.0] and parameters: {'p_sma': 6, 'p_std': 26, 'p_atr': 29, 'p_adx': 7, 'rsi_period': 22, 'ema1': 25, 'ema2': 12, 'slip_atr_k': 0.18485067283834028, 'slip_spread_k': 0.8101667400451311, 'spread_hl_frac': 0.014431132980890814, 'bb_std_mult': 0.8634427466597716, 'rsi_os': 24, 'rsi_ob': 68, 'vol_spike': 0.0002220833628264196, 'adx_thresh': 21.248455460734338, 'atr_min_pct': 0.019826004384522145, 'atr_max_pct': 0.09284442854440393, 'tp_mult': 1.5814857497698518, 'tsl_mult': 0.8299173710954827, 'strategy': 'breakout', 'time_stop': 154, 'use_sma': False, 'use_atr': False, 'use_adx': False, 'use_ema': False, 'use_spike': False, 'rsi_required': False, 'edge_k': 1.6339310978327817, 'edge_cap': 0.9003640231139194}.
[I 2025-08-29 21:53:31,464] Trial 137 finished with values: [-1000000000.0, 1000000000.0] and parameters: {'p_sma': 10, 'p_std': 43, 'p_atr': 22, 'p_adx': 9, 'rsi_period': 61, 'ema1': 24, 'ema2': 52, 'slip_atr_k': 0.01750533432297167, 'slip_spread_k': 0.8384063472542329, 'spread_hl_frac': 0.04789240399048645, 'bb_std_mult': 0.6258244425134887, 'rsi_os': 23, 'rsi_ob': 61, 'vol_spike': 0.23149603525239204, 'adx_thresh': 30.6352178063124, 'atr_min_pct': 0.012761679206248034, 'atr_max_pct': 0.011035493934818064, 'tp_mult': 1.226267103028741, 'tsl_mult': 0.3030369393044034, 'strategy': 'breakout', 'time_stop': 77, 'use_sma': False, 'use_atr': False, 'use_adx': False, 'use_ema': False, 'use_spike': False, 'rsi_required': False, 'edge_k': 1.7731130199681266, 'edge_cap': 0.8058797193926271}.
