[I 2025-08-29 21:45:16,653] Trial 53 finished with values: [-0.00515109270505032, 0.005314668298435477] and parameters: {'p_sma': 8, 'p_std': 13, 'p_atr': 27, 'p_adx': 30, 'rsi_period': 65, 'ema1': 24, 'ema2': 10, 'slip_atr_k': 0.0017552751635734084, 'slip_spread_k': 0.5090973185097044, 'spread_hl_frac': 0.005462101597246624, 'bb_std_mult': 0.5139133037099076, 'rsi_os': 31, 'rsi_ob': 63, 'vol_spike': 0.27408440899879527, 'adx_thresh': 25.850252818385464, 'atr_min_pct': 3.835663149437743e-05, 'atr_max_pct': 0.12156433716384833, 'tp_mult': 1.4408775219076033, 'tsl_mult': 0.9027198903638671, 'strategy': 'breakout', 'time_stop': 118, 'use_sma': False, 'use_atr': False, 'use_adx': False, 'use_ema': False, 'use_spike': False, 'rsi_required': False, 'edge_k': 0.4867268042770134, 'edge_cap': 0.20925918243375963}.
[I 2025-08-29 21:45:16,896] Trial 56 finished with values: [-0.0027243736371030947, 0.003622558518267389] and parameters: {'p_sma': 9, 'p_std': 26, 'p_atr': 30, 'p_adx': 30, 'rsi_period': 21, 'ema1': 24, 'ema2': 12, 'slip_atr_k': 0.01573050948133995, 'slip_spread_k': 0.8482686546450985, 'spread_hl_frac': 0.006138190834218148, 'bb_std_mult': 0.5146864873783532, 'rsi_os': 25, 'rsi_ob': 61, 'vol_spike': 0.1855492152394078, 'adx_thresh': 30.77431415264408, 'atr_min_pct': 0.00017174996791960567, 'atr_max_pct': 0.12207801205659484, 'tp_mult': 1.417690988498117, 'tsl_mult': 0.7876863739956839, 'strategy': 'breakout', 'time_stop': 117, 'use_sma': False, 'use_atr': False, 'use_adx': False, 'use_ema': False, 'use_spike': False, 'rsi_required': False, 'edge_k': 0.5529376008610868, 'edge_cap': 0.7604490829091223}.
[I 2025-08-29 21:45:17,056] Trial 55 finished with values: [-0.004676078333515021, 0.004656723794603061] and parameters: {'p_sma': 10, 'p_std': 11, 'p_atr': 27, 'p_adx': 30, 'rsi_period': 67, 'ema1': 24, 'ema2': 10, 'slip_atr_k': 0.011793433693354428, 'slip_spread_k': 0.8390797519815268, 'spread_hl_frac': 0.006096924215311523, 'bb_std_mult': 0.5130159777605023, 'rsi_os': 25, 'rsi_ob': 61, 'vol_spike': 0.27369633000076193, 'adx_thresh': 25.91361857074897, 'atr_min_pct': 0.0005902615112902479, 'atr_max_pct': 0.07001076288361584, 'tp_mult': 1.4372719862915715, 'tsl_mult': 0.806379681033805, 'strategy': 'breakout', 'time_stop': 117, 'use_sma': False, 'use_atr': False, 'use_adx': False, 'use_ema': False, 'use_spike': False, 'rsi_required': False, 'edge_k': 0.507328427970395, 'edge_cap': 0.21918835865841996}.
[I 2025-08-29 21:45:44,361] Trial 60 finished with values: [-0.001279013359749892, 0.002395085981380845] and parameters: {'p_sma': 9, 'p_std': 25, 'p_atr': 30, 'p_adx': 29, 'rsi_period': 21, 'ema1': 25, 'ema2': 17, 'slip_atr_k': 0.015140851704437764, 'slip_spread_k': 0.852042231108806, 'spread_hl_frac': 0.0063421914799374444, 'bb_std_mult': 0.7393083007162673, 'rsi_os': 25, 'rsi_ob': 61, 'vol_spike': 0.18724954821692397, 'adx_thresh': 31.217469241008796, 'atr_min_pct': 0.0012058381241187206, 'atr_max_pct': 0.09596345962830223, 'tp_mult': 1.1335549739422428, 'tsl_mult': 0.7983136716904525, 'strategy': 'breakout', 'time_stop': 107, 'use_sma': False, 'use_atr': False, 'use_adx': False, 'use_ema': False, 'use_spike': False, 'rsi_required': False, 'edge_k': 0.5067668827028016, 'edge_cap': 0.8078720109306696}.
[I 2025-08-29 21:45:45,134] Trial 57 finished with values: [-0.004226253863054419, 0.0045712153542092765] and parameters: {'p_sma': 9, 'p_std': 25, 'p_atr': 30, 'p_adx': 30, 'rsi_period': 19, 'ema1': 24, 'ema2': 10, 'slip_atr_k': 0.013315305234244882, 'slip_spread_k': 0.8349393622127119, 'spread_hl_frac': 0.006056620730978629, 'bb_std_mult': 0.5154728417565536, 'rsi_os': 25, 'rsi_ob': 60, 'vol_spike': 0.259541360759483, 'adx_thresh': 31.192810992828658, 'atr_min_pct': 0.00020455974668622594, 'atr_max_pct': 0.12388555538215426, 'tp_mult': 1.4275164761858625, 'tsl_mult': 0.7903785561769265, 'strategy': 'breakout', 'time_stop': 114, 'use_sma': False, 'use_atr': False, 'use_adx': False, 'use_ema': False, 'use_spike': False, 'rsi_required': False, 'edge_k': 0.5189878940860391, 'edge_cap': 0.2231551363484865}.
[I 2025-08-29 21:45:45,396] Trial 58 finished with values: [-0.003918901388714979, 0.004004749978280052] and parameters: {'p_sma': 8, 'p_std': 26, 'p_atr': 29, 'p_adx': 30, 'rsi_period': 18, 'ema1': 24, 'ema2': 10, 'slip_atr_k': 0.1760362491366383, 'slip_spread_k': 0.6589110778101561, 'spread_hl_frac': 0.005717633803561204, 'bb_std_mult': 0.500904655384129, 'rsi_os': 25, 'rsi_ob': 65, 'vol_spike': 0.25752405526899286, 'adx_thresh': 31.17417906485683, 'atr_min_pct': 0.000995370824667509, 'atr_max_pct': 0.12287121215399137, 'tp_mult': 1.1483610160683166, 'tsl_mult': 0.8059828790687436, 'strategy': 'breakout', 'time_stop': 120, 'use_sma': False, 'use_atr': False, 'use_adx': False, 'use_ema': False, 'use_spike': False, 'rsi_required': False, 'edge_k': 0.5195783675590225, 'edge_cap': 0.7799165846984699}.
[I 2025-08-29 21:45:45,486] Trial 59 finished with values: [-0.0027488999529001745, 0.003078768480357789] and parameters: {'p_sma': 9, 'p_std': 26, 'p_atr': 30, 'p_adx': 30, 'rsi_period': 22, 'ema1': 24, 'ema2': 10, 'slip_atr_k': 0.013427599942472414, 'slip_spread_k': 0.843467228597126, 'spread_hl_frac': 0.006230522352335461, 'bb_std_mult': 0.5845383328839988, 'rsi_os': 25, 'rsi_ob': 61, 'vol_spike': 0.19028403321688828, 'adx_thresh': 28.922783304408302, 'atr_min_pct': 0.0009767858717482727, 'atr_max_pct': 0.12264348876691095, 'tp_mult': 1.1170528029721931, 'tsl_mult': 0.9030726422016746, 'strategy': 'breakout', 'time_stop': 113, 'use_sma': False, 'use_atr': False, 'use_adx': False, 'use_ema': False, 'use_spike': False, 'rsi_required': False, 'edge_k': 0.5569996652747234, 'edge_cap': 0.7500818010409143}.
[I 2025-08-29 21:46:12,581] Trial 61 finished with values: [-0.007293035621689925, 0.007263333596227138] and parameters: {'p_sma': 10, 'p_std': 26, 'p_atr': 30, 'p_adx': 29, 'rsi_period': 17, 'ema1': 30, 'ema2': 17, 'slip_atr_k': 0.17900970385003584, 'slip_spread_k': 0.8448112352974126, 'spread_hl_frac': 0.011908050719050635, 'bb_std_mult': 0.8116652143584342, 'rsi_os': 25, 'rsi_ob': 68, 'vol_spike': 0.214614657550583, 'adx_thresh': 31.31038221540843, 'atr_min_pct': 0.001017344858207475, 'atr_max_pct': 0.0828713712106977, 'tp_mult': 1.1098571089385512, 'tsl_mult': 0.7967300751689509, 'strategy': 'breakout', 'time_stop': 110, 'use_sma': False, 'use_atr': False, 'use_adx': False, 'use_ema': False, 'use_spike': False, 'rsi_required': False, 'edge_k': 0.6182474338781885, 'edge_cap': 0.7965519044365301}.
[I 2025-08-29 21:46:12,843] Trial 64 finished with values: [-0.012985430219191185, 0.012954551230322704] and parameters: {'p_sma': 17, 'p_std': 26, 'p_atr': 30, 'p_adx': 16, 'rsi_period': 20, 'ema1': 26, 'ema2': 21, 'slip_atr_k': 0.16864001230345196, 'slip_spread_k': 0.857501594113096, 'spread_hl_frac': 0.012503341154575897, 'bb_std_mult': 0.8211486498834243, 'rsi_os': 23, 'rsi_ob': 59, 'vol_spike': 0.18931817948717133, 'adx_thresh': 33.679022463649446, 'atr_min_pct': 0.0014706550829455256, 'atr_max_pct': 0.09566825282767183, 'tp_mult': 1.1002514280887483, 'tsl_mult': 0.7734071454119393, 'strategy': 'breakout', 'time_stop': 111, 'use_sma': False, 'use_atr': False, 'use_adx': False, 'use_ema': False, 'use_spike': False, 'rsi_required': False, 'edge_k': 0.6216188640172079, 'edge_cap': 0.8392602156875604}.
[I 2025-08-29 21:46:13,100] Trial 63 finished with values: [-0.024238828995596706, 0.024254751781101203] and parameters: {'p_sma': 16, 'p_std': 30, 'p_atr': 30, 'p_adx': 16, 'rsi_period': 20, 'ema1': 22, 'ema2': 21, 'slip_atr_k': 0.17081915500207184, 'slip_spread_k': 0.8559409691802967, 'spread_hl_frac': 0.015307631922637904, 'bb_std_mult': 0.7583344892431607, 'rsi_os': 38, 'rsi_ob': 69, 'vol_spike': 0.1921644410547046, 'adx_thresh': 33.828824786930994, 'atr_min_pct': 0.0018341022654871468, 'atr_max_pct': 0.08532623252331076, 'tp_mult': 1.119193781376337, 'tsl_mult': 0.8038890201391277, 'strategy': 'breakout', 'time_stop': 147, 'use_sma': False, 'use_atr': False, 'use_adx': False, 'use_ema': False, 'use_spike': False, 'rsi_required': False, 'edge_k': 0.6133507530808593, 'edge_cap': 0.8403835666168116}.
[I 2025-08-29 21:46:13,278] Trial 62 finished with values: [-0.018354016588878252, 0.018325397516853487] and parameters: {'p_sma': 16, 'p_std': 26, 'p_atr': 30, 'p_adx': 29, 'rsi_period': 19, 'ema1': 30, 'ema2': 17, 'slip_atr_k': 0.17423576055090023, 'slip_spread_k': 0.8572967238406961, 'spread_hl_frac': 0.016179160617402447, 'bb_std_mult': 0.8561107394154289, 'rsi_os': 39, 'rsi_ob': 69, 'vol_spike': 0.18739151908974422, 'adx_thresh': 34.0992341204267, 'atr_min_pct': 0.0015248487827490187, 'atr_max_pct': 0.09460120631284186, 'tp_mult': 1.1172554449198535, 'tsl_mult': 0.7982434710309857, 'strategy': 'breakout', 'time_stop': 146, 'use_sma': False, 'use_atr': False, 'use_adx': False, 'use_ema': False, 'use_spike': False, 'rsi_required': False, 'edge_k': 0.8041537857371359, 'edge_cap': 0.786149912887102}.
[I 2025-08-29 21:46:40,407] Trial 66 finished with values: [-1000000000.0, 1000000000.0] and parameters: {'p_sma': 56, 'p_std': 31, 'p_atr': 29, 'p_adx': 28, 'rsi_period': 23, 'ema1': 22, 'ema2': 17, 'slip_atr_k': 0.03493009168188094, 'slip_spread_k': 0.949577350797522, 'spread_hl_frac': 0.015976818348096056, 'bb_std_mult': 1.08374136315925, 'rsi_os': 19, 'rsi_ob': 65, 'vol_spike': 0.18021686482692234, 'adx_thresh': 34.92780257423981, 'atr_min_pct': 0.0039768135562961195, 'atr_max_pct': 0.0993649157780185, 'tp_mult': 1.1938234593233459, 'tsl_mult': 0.837386476763076, 'strategy': 'breakout', 'time_stop': 270, 'use_sma': False, 'use_atr': False, 'use_adx': False, 'use_ema': False, 'use_spike': False, 'rsi_required': False, 'edge_k': 0.7748879259544057, 'edge_cap': 0.7071581527921854}.
[I 2025-08-29 21:46:40,568] Trial 65 finished with values: [-1000000000.0, 1000000000.0] and parameters: {'p_sma': 60, 'p_std': 30, 'p_atr': 29, 'p_adx': 16, 'rsi_period': 23, 'ema1': 25, 'ema2': 21, 'slip_atr_k': 0.11401931043690652, 'slip_spread_k': 0.8698783363636129, 'spread_hl_frac': 0.016170932647346436, 'bb_std_mult': 1.1161810324920038, 'rsi_os': 22, 'rsi_ob': 59, 'vol_spike': 0.18119500062674135, 'adx_thresh': 33.92594107729924, 'atr_min_pct': 0.02162866351487945, 'atr_max_pct': 0.09546261307456531, 'tp_mult': 1.1931793427600588, 'tsl_mult': 0.8403678991101051, 'strategy': 'breakout', 'time_stop': 108, 'use_sma': False, 'use_atr': False, 'use_adx': False, 'use_ema': False, 'use_spike': False, 'rsi_required': False, 'edge_k': 0.8063228110801506, 'edge_cap': 0.8322591741282795}.
[I 2025-08-29 21:46:40,679] Trial 68 finished with values: [-1000000000.0, 1000000000.0] and parameters: {'p_sma': 53, 'p_std': 31, 'p_atr': 29, 'p_adx': 28, 'rsi_period': 24, 'ema1': 25, 'ema2': 16, 'slip_atr_k': 0.015059648145556506, 'slip_spread_k': 0.955782258304128, 'spread_hl_frac': 0.022545307982143336, 'bb_std_mult': 1.1573328787794823, 'rsi_os': 19, 'rsi_ob': 65, 'vol_spike': 0.24643959505428545, 'adx_thresh': 18.00759119780132, 'atr_min_pct': 0.003800660882810185, 'atr_max_pct': 0.1008646249878081, 'tp_mult': 1.188492691980376, 'tsl_mult': 0.7107741451548476, 'strategy': 'breakout', 'time_stop': 125, 'use_sma': False, 'use_atr': False, 'use_adx': False, 'use_ema': False, 'use_spike': False, 'rsi_required': False, 'edge_k': 0.23283819072635548, 'edge_cap': 0.7176742375643732}.
[I 2025-08-29 21:46:40,825] Trial 67 finished with values: [-1000000000.0, 1000000000.0] and parameters: {'p_sma': 60, 'p_std': 23, 'p_atr': 29, 'p_adx': 28, 'rsi_period': 25, 'ema1': 26, 'ema2': 16, 'slip_atr_k': 0.11405811206059667, 'slip_spread_k': 0.9532902919669302, 'spread_hl_frac': 0.02249645348103124, 'bb_std_mult': 1.1177948571339575, 'rsi_os': 19, 'rsi_ob': 65, 'vol_spike': 0.254704123431131, 'adx_thresh': 31.140237929429155, 'atr_min_pct': 0.003873870493097578, 'atr_max_pct': 0.09396020697421002, 'tp_mult': 1.2217618630632563, 'tsl_mult': 0.7106334070031909, 'strategy': 'breakout', 'time_stop': 149, 'use_sma': False, 'use_atr': False, 'use_adx': False, 'use_ema': False, 'use_spike': False, 'rsi_required': False, 'edge_k': 0.7581747112602495, 'edge_cap': 0.7007637076319985}.
[I 2025-08-29 21:47:07,982] Trial 72 finished with values: [-1000000000.0, 1000000000.0] and parameters: {'p_sma': 20, 'p_std': 18, 'p_atr': 28, 'p_adx': 23, 'rsi_period': 11, 'ema1': 23, 'ema2': 13, 'slip_atr_k': 0.1993493944629129, 'slip_spread_k': 0.6903011224410582, 'spread_hl_frac': 6.277523839187671e-05, 'bb_std_mult': 3.5374359512682623, 'rsi_os': 26, 'rsi_ob': 56, 'vol_spike': 0.17056318086274785, 'adx_thresh': 28.719014096145397, 'atr_min_pct': 0.005956972124287186, 'atr_max_pct': 0.027358167442598856, 'tp_mult': 1.0543403333354526, 'tsl_mult': 0.6037021105815109, 'strategy': 'breakout', 'time_stop': 283, 'use_sma': False, 'use_atr': False, 'use_adx': False, 'use_ema': False, 'use_spike': False, 'rsi_required': False, 'edge_k': 0.40878531934517687, 'edge_cap': 0.9050424461971998}.
[I 2025-08-29 21:47:08,123] Trial 71 finished with values: [-1000000000.0, 1000000000.0] and parameters: {'p_sma': 20, 'p_std': 23, 'p_atr': 28, 'p_adx': 19, 'rsi_period': 12, 'ema1': 26, 'ema2': 43, 'slip_atr_k': 0.20681271345677554, 'slip_spread_k': 0.8093566760412467, 'spread_hl_frac': 0.028591248406081318, 'bb_std_mult': 3.4495364818058905, 'rsi_os': 27, 'rsi_ob': 56, 'vol_spike': 0.2559642950149753, 'adx_thresh': 31.332374289604505, 'atr_min_pct': 0.005898139589123335, 'atr_max_pct': 0.07812716959161127, 'tp_mult': 2.6281099918042545, 'tsl_mult': 0.6212838140314136, 'strategy': 'breakout', 'time_stop': 294, 'use_sma': False, 'use_atr': False, 'use_adx': False, 'use_ema': False, 'use_spike': False, 'rsi_required': False, 'edge_k': 0.4154118615250632, 'edge_cap': 0.9128717678042217}.
[I 2025-08-29 21:47:08,310] Trial 70 finished with values: [-1000000000.0, 1000000000.0] and parameters: {'p_sma': 19, 'p_std': 23, 'p_atr': 28, 'p_adx': 28, 'rsi_period': 14, 'ema1': 26, 'ema2': 53, 'slip_atr_k': 0.01595249871008201, 'slip_spread_k': 0.8016043014817444, 'spread_hl_frac': 0.02238830048009414, 'bb_std_mult': 3.5794017439903625, 'rsi_os': 41, 'rsi_ob': 56, 'vol_spike': 0.1659265527555492, 'adx_thresh': 29.223389453757015, 'atr_min_pct': 0.01916612021294055, 'atr_max_pct': 0.0251041784219646, 'tp_mult': 1.0187444327911663, 'tsl_mult': 0.7422667587291184, 'strategy': 'breakout', 'time_stop': 126, 'use_sma': False, 'use_atr': False, 'use_adx': False, 'use_ema': False, 'use_spike': False, 'rsi_required': False, 'edge_k': 0.24234047937120917, 'edge_cap': 0.7161934548337929}.
[I 2025-08-29 21:47:08,413] Trial 69 finished with values: [-1000000000.0, 1000000000.0] and parameters: {'p_sma': 58, 'p_std': 23, 'p_atr': 28, 'p_adx': 18, 'rsi_period': 12, 'ema1': 26, 'ema2': 47, 'slip_atr_k': 0.01612324992415862, 'slip_spread_k': 0.6792508238234864, 'spread_hl_frac': 0.030182068083239106, 'bb_std_mult': 3.4484319357909836, 'rsi_os': 36, 'rsi_ob': 56, 'vol_spike': 0.25637652437767894, 'adx_thresh': 29.0183365662617, 'atr_min_pct': 0.0212290342243013, 'atr_max_pct': 0.07512833889251119, 'tp_mult': 1.024038345369796, 'tsl_mult': 0.699560610451544, 'strategy': 'breakout', 'time_stop': 125, 'use_sma': False, 'use_atr': False, 'use_adx': False, 'use_ema': False, 'use_spike': False, 'rsi_required': False, 'edge_k': 0.19897961688197502, 'edge_cap': 0.7162579098612709}.
[I 2025-08-29 21:47:35,036] Trial 74 finished with values: [-0.0055634968456722556, 0.005536842734990218] and parameters: {'p_sma': 42, 'p_std': 25, 'p_atr': 28, 'p_adx': 25, 'rsi_period': 30, 'ema1': 27, 'ema2': 19, 'slip_atr_k': 0.05641067117360929, 'slip_spread_k': 0.9185949094475382, 'spread_hl_frac': 0.007558903993830424, 'bb_std_mult': 1.3318901380410084, 'rsi_os': 14, 'rsi_ob': 93, 'vol_spike': 0.16852266365437724, 'adx_thresh': 14.092651257377263, 'atr_min_pct': 0.0023862718322918636, 'atr_max_pct': 0.09110920609352002, 'tp_mult': 1.0402580548945684, 'tsl_mult': 0.8696426125316744, 'strategy': 'breakout', 'time_stop': 23, 'use_sma': False, 'use_atr': False, 'use_adx': False, 'use_ema': False, 'use_spike': False, 'rsi_required': False, 'edge_k': 0.4148098119655922, 'edge_cap': 0.759226991049589}.
[I 2025-08-29 21:47:35,053] Trial 73 finished with values: [-1000000000.0, 1000000000.0] and parameters: {'p_sma': 14, 'p_std': 24, 'p_atr': 15, 'p_adx': 18, 'rsi_period': 31, 'ema1': 20, 'ema2': 45, 'slip_atr_k': 0.06140160621428521, 'slip_spread_k': 0.8024758870037416, 'spread_hl_frac': 0.007813742278535006, 'bb_std_mult': 1.3701779973540937, 'rsi_os': 28, 'rsi_ob': 61, 'vol_spike': 0.21769092070288304, 'adx_thresh': 29.082350236797943, 'atr_min_pct': 0.01824070976419777, 'atr_max_pct': 0.07691851861491775, 'tp_mult': 1.0130103918963016, 'tsl_mult': 0.7481110082625702, 'strategy': 'breakout', 'time_stop': 102, 'use_sma': False, 'use_atr': False, 'use_adx': False, 'use_ema': False, 'use_spike': False, 'rsi_required': False, 'edge_k': 0.42849159941736653, 'edge_cap': 0.7471222788236582}.
[I 2025-08-29 21:47:35,415] Trial 75 finished with values: [-0.044655913641818756, 0.04464327010114103] and parameters: {'p_sma': 45, 'p_std': 45, 'p_atr': 16, 'p_adx': 17, 'rsi_period': 30, 'ema1': 20, 'ema2': 47, 'slip_atr_k': 0.21689904220232087, 'slip_spread_k': 0.9152986947910109, 'spread_hl_frac': 0.006567077715854408, 'bb_std_mult': 0.6469335757298886, 'rsi_os': 36, 'rsi_ob': 62, 'vol_spike': 0.14638204741528563, 'adx_thresh': 13.107250109556254, 'atr_min_pct': 0.0021695338515967284, 'atr_max_pct': 0.07052485164492872, 'tp_mult': 1.2657000808755596, 'tsl_mult': 0.8678404334706875, 'strategy': 'breakout', 'time_stop': 100, 'use_sma': False, 'use_atr': False, 'use_adx': False, 'use_ema': False, 'use_spike': False, 'rsi_required': False, 'edge_k': 0.5458375294824873, 'edge_cap': 0.7526856751078477}.
[I 2025-08-29 21:47:35,424] Trial 76 finished with values: [-0.00991008831407958, 0.009954816675225658] and parameters: {'p_sma': 14, 'p_std': 25, 'p_atr': 18, 'p_adx': 25, 'rsi_period': 28, 'ema1': 23, 'ema2': 19, 'slip_atr_k': 0.0616104334738564, 'slip_spread_k': 0.913054893611729, 'spread_hl_frac': 0.00796553220109491, 'bb_std_mult': 1.3591544178185733, 'rsi_os': 14, 'rsi_ob': 62, 'vol_spike': 0.2201777549036224, 'adx_thresh': 12.486777312650714, 'atr_min_pct': 0.0025663958059643334, 'atr_max_pct': 0.04075277421170897, 'tp_mult': 1.360879576576836, 'tsl_mult': 0.8720011806592372, 'strategy': 'mean_reversion', 'time_stop': 98, 'use_sma': False, 'use_atr': False, 'use_adx': False, 'use_ema': False, 'use_spike': False, 'rsi_required': False, 'edge_k': 0.45528655159758713, 'edge_cap': 0.7563308003117829}.
[I 2025-08-29 21:47:35,523] Trial 80 finished with values: [-1000000000.0, 1000000000.0] and parameters: {'p_sma': 35, 'p_std': 16, 'p_atr': 13, 'p_adx': 27, 'rsi_period': 27, 'ema1': 23, 'ema2': 26, 'slip_atr_k': 0.028720238920023622, 'slip_spread_k': 0.7621671621019814, 'spread_hl_frac': 0.011277642812423234, 'bb_std_mult': 2.878852240417307, 'rsi_os': 53, 'rsi_ob': 86, 'vol_spike': 0.20254299937726455, 'adx_thresh': 7.777558329162483, 'atr_min_pct': 0.013414752479024784, 'atr_max_pct': 0.10630212658199598, 'tp_mult': 1.1661220194234432, 'tsl_mult': 0.6659323013192646, 'strategy': 'mean_reversion', 'time_stop': 80, 'use_sma': False, 'use_atr': False, 'use_adx': False, 'use_ema': False, 'use_spike': False, 'rsi_required': False, 'edge_k': 0.5804892029926936, 'edge_cap': 0.8731395564107226}.
[I 2025-08-29 21:47:35,523] Trial 79 finished with values: [-1000000000.0, 1000000000.0] and parameters: {'p_sma': 35, 'p_std': 16, 'p_atr': 26, 'p_adx': 21, 'rsi_period': 16, 'ema1': 25, 'ema2': 50, 'slip_atr_k': 0.18824606922677312, 'slip_spread_k': 0.764006679768728, 'spread_hl_frac': 0.012307833670933558, 'bb_std_mult': 2.6275797424620064, 'rsi_os': 53, 'rsi_ob': 86, 'vol_spike': 0.19861977753212637, 'adx_thresh': 32.34449877531871, 'atr_min_pct': 0.007593837895358454, 'atr_max_pct': 0.1074120258715787, 'tp_mult': 2.3524681658960507, 'tsl_mult': 0.9463444943446603, 'strategy': 'mean_reversion', 'time_stop': 215, 'use_sma': False, 'use_atr': False, 'use_adx': False, 'use_ema': False, 'use_spike': False, 'rsi_required': False, 'edge_k': 0.3473263048032347, 'edge_cap': 0.8090681828779519}.
[I 2025-08-29 21:48:02,296] Trial 78 finished with values: [-1000000000.0, 1000000000.0] and parameters: {'p_sma': 10, 'p_std': 46, 'p_atr': 18, 'p_adx': 21, 'rsi_period': 27, 'ema1': 23, 'ema2': 26, 'slip_atr_k': 0.2185635429210681, 'slip_spread_k': 0.8919076528656755, 'spread_hl_frac': 0.011292839169094305, 'bb_std_mult': 0.6417200135125632, 'rsi_os': 23, 'rsi_ob': 85, 'vol_spike': 0.14229526340805612, 'adx_thresh': 32.71166752848644, 'atr_min_pct': 0.02733266086791521, 'atr_max_pct': 0.03987307594177162, 'tp_mult': 1.3716988784800015, 'tsl_mult': 0.06907218771058038, 'strategy': 'mean_reversion', 'time_stop': 97, 'use_sma': False, 'use_atr': False, 'use_adx': False, 'use_ema': False, 'use_spike': False, 'rsi_required': False, 'edge_k': 0.5616723388358149, 'edge_cap': 0.6169948917865614}.
[I 2025-08-29 21:48:02,474] Trial 77 finished with values: [-1000000000.0, 1000000000.0] and parameters: {'p_sma': 46, 'p_std': 28, 'p_atr': 18, 'p_adx': 27, 'rsi_period': 7, 'ema1': 23, 'ema2': 37, 'slip_atr_k': 0.19107324392686578, 'slip_spread_k': 0.770757993460538, 'spread_hl_frac': 0.01114355508782889, 'bb_std_mult': 0.650042691879962, 'rsi_os': 24, 'rsi_ob': 71, 'vol_spike': 0.20132604932272122, 'adx_thresh': 17.258460844105496, 'atr_min_pct': 0.007424431120002588, 'atr_max_pct': 0.06820878435804668, 'tp_mult': 1.270068350950428, 'tsl_mult': 0.07199712361362531, 'strategy': 'mean_reversion', 'time_stop': 83, 'use_sma': False, 'use_atr': False, 'use_adx': False, 'use_ema': False, 'use_spike': False, 'rsi_required': False, 'edge_k': 0.5584411324578193, 'edge_cap': 0.86383143414808}.
