[I 2025-08-30 00:17:35,064] Trial 1458 finished with values: [-1000000000.0, 1000000000.0] and parameters: {'p_sma': 28, 'p_std': 26, 'p_atr': 22, 'p_adx': 12, 'rsi_period': 17, 'ema1': 24, 'ema2': 40, 'slip_atr_k': 0.055111164721886347, 'slip_spread_k': 0.7745804799532622, 'spread_hl_frac': 0.029948196941415314, 'bb_std_mult': 3.0525613233351505, 'rsi_os': 26, 'rsi_ob': 50, 'vol_spike': 0.17854317305089698, 'adx_thresh': 24.954799155520185, 'atr_min_pct': 0.01097459876723128, 'atr_max_pct': 0.09381342034873792, 'tp_mult': 2.713509638029585, 'tsl_mult': 0.7431342205397874, 'strategy': 'breakout', 'time_stop': 123, 'use_sma': False, 'use_atr': False, 'use_adx': False, 'use_ema': False, 'use_spike': False, 'rsi_required': False, 'edge_k': 0.6508459565105106, 'edge_cap': 0.8217033725680677}.
[I 2025-08-30 00:18:01,247] Trial 1462 finished with values: [-1000000000.0, 1000000000.0] and parameters: {'p_sma': 5, 'p_std': 25, 'p_atr': 11, 'p_adx': 7, 'rsi_period': 23, 'ema1': 23, 'ema2': 39, 'slip_atr_k': 0.06655764368110684, 'slip_spread_k': 0.834813660704821, 'spread_hl_frac': 0.02009837787213878, 'bb_std_mult': 1.9883357645527224, 'rsi_os': 44, 'rsi_ob': 68, 'vol_spike': 0.1972788031816276, 'adx_thresh': 26.75484419353674, 'atr_min_pct': 0.015436470786680413, 'atr_max_pct': 0.09717355994379209, 'tp_mult': 1.9046206945674127, 'tsl_mult': 0.6905221487401508, 'strategy': 'mean_reversion', 'time_stop': 75, 'use_sma': False, 'use_atr': False, 'use_adx': False, 'use_ema': False, 'use_spike': False, 'rsi_required': False, 'edge_k': 1.4190568237437524, 'edge_cap': 0.7448770170655886}.
[I 2025-08-30 00:18:01,506] Trial 1460 finished with values: [-1000000000.0, 1000000000.0] and parameters: {'p_sma': 14, 'p_std': 24, 'p_atr': 10, 'p_adx': 7, 'rsi_period': 21, 'ema1': 24, 'ema2': 39, 'slip_atr_k': 0.128141245074257, 'slip_spread_k': 0.31147800777889123, 'spread_hl_frac': 0.030265863309683363, 'bb_std_mult': 1.9829629551081525, 'rsi_os': 18, 'rsi_ob': 50, 'vol_spike': 0.18137896341761012, 'adx_thresh': 10.277472114808862, 'atr_min_pct': 0.010093611236134255, 'atr_max_pct': 0.07258472239586958, 'tp_mult': 2.2612716162173943, 'tsl_mult': 0.33202798948525597, 'strategy': 'breakout', 'time_stop': 171, 'use_sma': False, 'use_atr': False, 'use_adx': False, 'use_ema': False, 'use_spike': False, 'rsi_required': False, 'edge_k': 0.45601620080050753, 'edge_cap': 0.8861766235760383}.
[I 2025-08-30 00:18:01,677] Trial 1461 finished with values: [-1000000000.0, 1000000000.0] and parameters: {'p_sma': 5, 'p_std': 13, 'p_atr': 10, 'p_adx': 7, 'rsi_period': 23, 'ema1': 6, 'ema2': 12, 'slip_atr_k': 0.11979414370561746, 'slip_spread_k': 0.8327284695579784, 'spread_hl_frac': 0.01724958284541565, 'bb_std_mult': 2.0662776391169535, 'rsi_os': 44, 'rsi_ob': 81, 'vol_spike': 0.29385270637823035, 'adx_thresh': 25.831896853129003, 'atr_min_pct': 0.004032982272814814, 'atr_max_pct': 0.06616964416282856, 'tp_mult': 1.0971200960142096, 'tsl_mult': 0.9993935911715466, 'strategy': 'mean_reversion', 'time_stop': 181, 'use_sma': False, 'use_atr': False, 'use_adx': False, 'use_ema': False, 'use_spike': False, 'rsi_required': False, 'edge_k': 0.35568466790081743, 'edge_cap': 0.7791399992073509}.
[I 2025-08-30 00:18:01,788] Trial 1459 finished with values: [-1000000000.0, 1000000000.0] and parameters: {'p_sma': 28, 'p_std': 24, 'p_atr': 22, 'p_adx': 13, 'rsi_period': 10, 'ema1': 24, 'ema2': 12, 'slip_atr_k': 0.12102828136239477, 'slip_spread_k': 0.6390734324089744, 'spread_hl_frac': 0.01866067945846165, 'bb_std_mult': 0.6200467853935592, 'rsi_os': 26, 'rsi_ob': 91, 'vol_spike': 0.19565887436892504, 'adx_thresh': 30.18834659668679, 'atr_min_pct': 0.015300754656074606, 'atr_max_pct': 0.09631987942866473, 'tp_mult': 2.264105648603786, 'tsl_mult': 0.6921830550211604, 'strategy': 'breakout', 'time_stop': 279, 'use_sma': False, 'use_atr': False, 'use_adx': False, 'use_ema': False, 'use_spike': False, 'rsi_required': False, 'edge_k': 0.4864187187318671, 'edge_cap': 0.82310397725628}.
[I 2025-08-30 00:18:27,728] Trial 1464 finished with values: [-0.007462773252404964, 0.007826559703404122] and parameters: {'p_sma': 29, 'p_std': 13, 'p_atr': 18, 'p_adx': 17, 'rsi_period': 59, 'ema1': 14, 'ema2': 45, 'slip_atr_k': 0.017841931311714892, 'slip_spread_k': 0.5157850505420649, 'spread_hl_frac': 0.018831835958852867, 'bb_std_mult': 3.3968751207905017, 'rsi_os': 29, 'rsi_ob': 61, 'vol_spike': 0.15735861867091916, 'adx_thresh': 25.842184351010683, 'atr_min_pct': 0.002348246259492267, 'atr_max_pct': 0.06590262488190743, 'tp_mult': 1.1016269990676641, 'tsl_mult': 0.494711976287794, 'strategy': 'breakout', 'time_stop': 267, 'use_sma': False, 'use_atr': False, 'use_adx': False, 'use_ema': False, 'use_spike': False, 'rsi_required': False, 'edge_k': 0.2649752699555925, 'edge_cap': 0.7711364011720196}.
[I 2025-08-30 00:18:27,925] Trial 1466 finished with values: [-1000000000.0, 1000000000.0] and parameters: {'p_sma': 53, 'p_std': 38, 'p_atr': 13, 'p_adx': 15, 'rsi_period': 17, 'ema1': 29, 'ema2': 49, 'slip_atr_k': 0.1484888511347254, 'slip_spread_k': 0.5068284128230115, 'spread_hl_frac': 0.01612716987217756, 'bb_std_mult': 3.2638686171953917, 'rsi_os': 29, 'rsi_ob': 54, 'vol_spike': 0.16254258454384374, 'adx_thresh': 33.7088991259776, 'atr_min_pct': 0.005232248163859125, 'atr_max_pct': 0.11343860731385425, 'tp_mult': 1.5326089170450965, 'tsl_mult': 0.6348100068234596, 'strategy': 'breakout', 'time_stop': 265, 'use_sma': False, 'use_atr': False, 'use_adx': False, 'use_ema': False, 'use_spike': False, 'rsi_required': False, 'edge_k': 0.5465055928178164, 'edge_cap': 0.7915170327856427}.
[I 2025-08-30 00:18:28,017] Trial 1463 finished with values: [-1000000000.0, 1000000000.0] and parameters: {'p_sma': 56, 'p_std': 38, 'p_atr': 10, 'p_adx': 21, 'rsi_period': 61, 'ema1': 24, 'ema2': 54, 'slip_atr_k': 0.1515086657390185, 'slip_spread_k': 0.6383118679033708, 'spread_hl_frac': 0.007151654658691088, 'bb_std_mult': 2.0819117068317445, 'rsi_os': 39, 'rsi_ob': 76, 'vol_spike': 0.18344376107091556, 'adx_thresh': 25.965352966267787, 'atr_min_pct': 0.02897751257671216, 'atr_max_pct': 0.06635301839770248, 'tp_mult': 1.0834354874851762, 'tsl_mult': 0.7039140797346765, 'strategy': 'breakout', 'time_stop': 103, 'use_sma': False, 'use_atr': False, 'use_adx': False, 'use_ema': False, 'use_spike': False, 'rsi_required': False, 'edge_k': 1.6977562001666886, 'edge_cap': 0.7715190542327237}.
[I 2025-08-30 00:18:28,187] Trial 1465 finished with values: [-1000000000.0, 1000000000.0] and parameters: {'p_sma': 6, 'p_std': 38, 'p_atr': 13, 'p_adx': 24, 'rsi_period': 78, 'ema1': 24, 'ema2': 24, 'slip_atr_k': 0.01717848496571881, 'slip_spread_k': 0.8862798549382739, 'spread_hl_frac': 0.007104182518468127, 'bb_std_mult': 1.5975637804399885, 'rsi_os': 40, 'rsi_ob': 88, 'vol_spike': 0.1844715116847604, 'adx_thresh': 25.693185798669845, 'atr_min_pct': 0.019163451102044975, 'atr_max_pct': 0.09683855526751194, 'tp_mult': 1.0376403380686563, 'tsl_mult': 0.9401264083413141, 'strategy': 'breakout', 'time_stop': 295, 'use_sma': False, 'use_atr': False, 'use_adx': False, 'use_ema': False, 'use_spike': False, 'rsi_required': False, 'edge_k': 0.266907600217122, 'edge_cap': 0.8009123095061078}.
[I 2025-08-30 00:18:54,244] Trial 1467 finished with values: [-1000000000.0, 1000000000.0] and parameters: {'p_sma': 6, 'p_std': 27, 'p_atr': 12, 'p_adx': 16, 'rsi_period': 44, 'ema1': 29, 'ema2': 54, 'slip_atr_k': 0.005130883713092746, 'slip_spread_k': 0.8009488774070425, 'spread_hl_frac': 0.007352168274698919, 'bb_std_mult': 1.5122059317279188, 'rsi_os': 25, 'rsi_ob': 76, 'vol_spike': 0.16822070898703528, 'adx_thresh': 24.069361155499656, 'atr_min_pct': 0.0030242487995648447, 'atr_max_pct': 0.11369817286950928, 'tp_mult': 1.0495891841937024, 'tsl_mult': 0.7300019307450767, 'strategy': 'breakout', 'time_stop': 101, 'use_sma': False, 'use_atr': False, 'use_adx': False, 'use_ema': False, 'use_spike': False, 'rsi_required': False, 'edge_k': 0.5601513791375992, 'edge_cap': 0.8009585161629584}.
[I 2025-08-30 00:18:54,256] Trial 1469 finished with values: [-1000000000.0, 1000000000.0] and parameters: {'p_sma': 40, 'p_std': 27, 'p_atr': 17, 'p_adx': 16, 'rsi_period': 20, 'ema1': 21, 'ema2': 55, 'slip_atr_k': 0.17758107715789032, 'slip_spread_k': 0.7949189776292922, 'spread_hl_frac': 0.03452100417048505, 'bb_std_mult': 1.215908046577352, 'rsi_os': 41, 'rsi_ob': 86, 'vol_spike': 0.1671448141391786, 'adx_thresh': 6.254384361797726, 'atr_min_pct': 0.017202020737870975, 'atr_max_pct': 0.10049311956328201, 'tp_mult': 2.1734683499626675, 'tsl_mult': 0.9388306361148767, 'strategy': 'mean_reversion', 'time_stop': 110, 'use_sma': False, 'use_atr': False, 'use_adx': False, 'use_ema': False, 'use_spike': False, 'rsi_required': False, 'edge_k': 0.5797325884816072, 'edge_cap': 0.5218384493002721}.
[I 2025-08-30 00:18:54,554] Trial 1470 finished with values: [-1000000000.0, 1000000000.0] and parameters: {'p_sma': 8, 'p_std': 46, 'p_atr': 24, 'p_adx': 16, 'rsi_period': 20, 'ema1': 21, 'ema2': 56, 'slip_atr_k': 0.025888792671798944, 'slip_spread_k': 0.3584319002302694, 'spread_hl_frac': 0.014811239978630339, 'bb_std_mult': 1.785962694962572, 'rsi_os': 33, 'rsi_ob': 64, 'vol_spike': 0.1374430235883917, 'adx_thresh': 24.151818715345616, 'atr_min_pct': 0.002998719811102288, 'atr_max_pct': 0.10134367825689987, 'tp_mult': 1.1322820874433828, 'tsl_mult': 0.5508302481133811, 'strategy': 'mean_reversion', 'time_stop': 110, 'use_sma': False, 'use_atr': False, 'use_adx': False, 'use_ema': False, 'use_spike': False, 'rsi_required': False, 'edge_k': 0.4957960696068049, 'edge_cap': 0.7387038189789713}.
[I 2025-08-30 00:18:54,562] Trial 1468 finished with values: [-1000000000.0, 1000000000.0] and parameters: {'p_sma': 6, 'p_std': 59, 'p_atr': 16, 'p_adx': 24, 'rsi_period': 61, 'ema1': 23, 'ema2': 54, 'slip_atr_k': 0.026407667206619613, 'slip_spread_k': 0.800922909051738, 'spread_hl_frac': 0.04270104063574698, 'bb_std_mult': 1.7966193453990649, 'rsi_os': 41, 'rsi_ob': 65, 'vol_spike': 0.18500571897906934, 'adx_thresh': 24.34982365186569, 'atr_min_pct': 0.0030174168976165395, 'atr_max_pct': 0.1398390087256393, 'tp_mult': 1.0563079643211921, 'tsl_mult': 0.7332454149582033, 'strategy': 'mean_reversion', 'time_stop': 102, 'use_sma': False, 'use_atr': False, 'use_adx': False, 'use_ema': False, 'use_spike': False, 'rsi_required': False, 'edge_k': 1.9172131203485079, 'edge_cap': 0.4794817722019705}.
[I 2025-08-30 00:18:54,998] Trial 1471 finished with values: [-1000000000.0, 1000000000.0] and parameters: {'p_sma': 8, 'p_std': 35, 'p_atr': 25, 'p_adx': 28, 'rsi_period': 36, 'ema1': 23, 'ema2': 60, 'slip_atr_k': 0.03206391373902938, 'slip_spread_k': 0.8668707745063109, 'spread_hl_frac': 0.036891920055580826, 'bb_std_mult': 2.1673641554155196, 'rsi_os': 27, 'rsi_ob': 45, 'vol_spike': 0.1866340550978892, 'adx_thresh': 24.485787480324337, 'atr_min_pct': 0.001868053315373239, 'atr_max_pct': 0.08427231051875626, 'tp_mult': 1.2129363540413325, 'tsl_mult': 0.7234104290585541, 'strategy': 'mean_reversion', 'time_stop': 96, 'use_sma': False, 'use_atr': False, 'use_adx': False, 'use_ema': False, 'use_spike': False, 'rsi_required': False, 'edge_k': 1.930196382728512, 'edge_cap': 0.41597520550579054}.
[I 2025-08-30 00:19:20,870] Trial 1472 finished with values: [-0.011801388787821998, 0.01178319131609349] and parameters: {'p_sma': 8, 'p_std': 35, 'p_atr': 25, 'p_adx': 28, 'rsi_period': 20, 'ema1': 23, 'ema2': 60, 'slip_atr_k': 0.21463551303446615, 'slip_spread_k': 0.2625816575666862, 'spread_hl_frac': 0.014644339458837849, 'bb_std_mult': 1.7991072461338968, 'rsi_os': 27, 'rsi_ob': 57, 'vol_spike': 0.1898605610655333, 'adx_thresh': 24.412654009867904, 'atr_min_pct': 0.001694921961552971, 'atr_max_pct': 0.01892338369822503, 'tp_mult': 1.322904634304424, 'tsl_mult': 0.8469465590755291, 'strategy': 'mean_reversion', 'time_stop': 22, 'use_sma': False, 'use_atr': False, 'use_adx': False, 'use_ema': False, 'use_spike': False, 'rsi_required': False, 'edge_k': 1.925611343676006, 'edge_cap': 0.8471539297342308}.
[I 2025-08-30 00:19:21,233] Trial 1473 finished with values: [-1000000000.0, 1000000000.0] and parameters: {'p_sma': 8, 'p_std': 24, 'p_atr': 25, 'p_adx': 17, 'rsi_period': 38, 'ema1': 25, 'ema2': 57, 'slip_atr_k': 0.03286085199364409, 'slip_spread_k': 0.09073354402926898, 'spread_hl_frac': 0.027460224486389267, 'bb_std_mult': 0.8247410653805567, 'rsi_os': 22, 'rsi_ob': 60, 'vol_spike': 0.19091372524405859, 'adx_thresh': 25.21205443160861, 'atr_min_pct': 0.0017058732693760238, 'atr_max_pct': 0.019400253595621142, 'tp_mult': 1.21708483847055, 'tsl_mult': 0.6646749092788953, 'strategy': 'breakout', 'time_stop': 96, 'use_sma': False, 'use_atr': False, 'use_adx': False, 'use_ema': False, 'use_spike': False, 'rsi_required': False, 'edge_k': 0.43608667264470813, 'edge_cap': 0.837038613097477}.
[I 2025-08-30 00:19:21,387] Trial 1474 finished with values: [-1000000000.0, 1000000000.0] and parameters: {'p_sma': 8, 'p_std': 35, 'p_atr': 14, 'p_adx': 20, 'rsi_period': 42, 'ema1': 25, 'ema2': 57, 'slip_atr_k': 0.019451730937301324, 'slip_spread_k': 0.8400355272422041, 'spread_hl_frac': 0.017588097985872297, 'bb_std_mult': 2.205088429509137, 'rsi_os': 22, 'rsi_ob': 60, 'vol_spike': 0.25403254859903923, 'adx_thresh': 25.367672928890904, 'atr_min_pct': 0.0020771885585522134, 'atr_max_pct': 0.019522554324878684, 'tp_mult': 1.1968557244602909, 'tsl_mult': 0.35384117236104196, 'strategy': 'breakout', 'time_stop': 23, 'use_sma': False, 'use_atr': False, 'use_adx': False, 'use_ema': False, 'use_spike': False, 'rsi_required': False, 'edge_k': 0.453536533381739, 'edge_cap': 0.8221754945250258}.
[I 2025-08-30 00:19:21,956] Trial 1475 finished with values: [-1000000000.0, 1000000000.0] and parameters: {'p_sma': 30, 'p_std': 24, 'p_atr': 22, 'p_adx': 17, 'rsi_period': 42, 'ema1': 10, 'ema2': 54, 'slip_atr_k': 0.16269458939572376, 'slip_spread_k': 0.8208341252078281, 'spread_hl_frac': 0.021660373873818656, 'bb_std_mult': 2.0492268139231196, 'rsi_os': 25, 'rsi_ob': 57, 'vol_spike': 0.2545145558026175, 'adx_thresh': 27.202718728069033, 'atr_min_pct': 0.006902726951529322, 'atr_max_pct': 0.14756855342817007, 'tp_mult': 1.8532867178275796, 'tsl_mult': 0.6589302346139213, 'strategy': 'breakout', 'time_stop': 118, 'use_sma': False, 'use_atr': False, 'use_adx': False, 'use_ema': False, 'use_spike': False, 'rsi_required': False, 'edge_k': 0.43333002863169234, 'edge_cap': 0.8310548726635246}.
[I 2025-08-30 00:19:47,997] Trial 1478 finished with values: [-1000000000.0, 1000000000.0] and parameters: {'p_sma': 49, 'p_std': 22, 'p_atr': 22, 'p_adx': 15, 'rsi_period': 22, 'ema1': 26, 'ema2': 10, 'slip_atr_k': 0.01508270206176425, 'slip_spread_k': 0.8237573491215275, 'spread_hl_frac': 0.02257495896856442, 'bb_std_mult': 2.9696625885839443, 'rsi_os': 6, 'rsi_ob': 62, 'vol_spike': 0.1729113377241754, 'adx_thresh': 27.07708845490451, 'atr_min_pct': 0.013236116588469942, 'atr_max_pct': 0.09325993577363963, 'tp_mult': 1.8484671569957865, 'tsl_mult': 0.7580938015031722, 'strategy': 'breakout', 'time_stop': 117, 'use_sma': False, 'use_atr': False, 'use_adx': False, 'use_ema': False, 'use_spike': False, 'rsi_required': False, 'edge_k': 0.38259736597142735, 'edge_cap': 0.78087919205617}.
[I 2025-08-30 00:19:48,745] Trial 1476 finished with values: [-1000000000.0, 1000000000.0] and parameters: {'p_sma': 49, 'p_std': 25, 'p_atr': 22, 'p_adx': 15, 'rsi_period': 29, 'ema1': 25, 'ema2': 57, 'slip_atr_k': 0.04400984649125378, 'slip_spread_k': 0.8481216915221186, 'spread_hl_frac': 0.022573277102339147, 'bb_std_mult': 1.1063804120223417, 'rsi_os': 23, 'rsi_ob': 56, 'vol_spike': 0.2498549248783613, 'adx_thresh': 25.306043456493857, 'atr_min_pct': 0.025810034439352186, 'atr_max_pct': 0.09422029896025663, 'tp_mult': 2.861044385430403, 'tsl_mult': 0.38592359101298535, 'strategy': 'breakout', 'time_stop': 117, 'use_sma': False, 'use_atr': False, 'use_adx': False, 'use_ema': False, 'use_spike': False, 'rsi_required': False, 'edge_k': 0.2077425973473419, 'edge_cap': 0.8183692154135412}.
[I 2025-08-30 00:19:48,836] Trial 1477 finished with values: [-1000000000.0, 1000000000.0] and parameters: {'p_sma': 46, 'p_std': 50, 'p_atr': 22, 'p_adx': 15, 'rsi_period': 18, 'ema1': 10, 'ema2': 53, 'slip_atr_k': 0.019291914608068415, 'slip_spread_k': 0.8456331671298524, 'spread_hl_frac': 0.01753375926368077, 'bb_std_mult': 2.0353887676505935, 'rsi_os': 49, 'rsi_ob': 52, 'vol_spike': 0.26526436266088893, 'adx_thresh': 27.063321135540274, 'atr_min_pct': 0.01330708287058306, 'atr_max_pct': 0.09366234464305341, 'tp_mult': 1.79975595028243, 'tsl_mult': 0.36713152999736715, 'strategy': 'breakout', 'time_stop': 117, 'use_sma': False, 'use_atr': False, 'use_adx': False, 'use_ema': False, 'use_spike': False, 'rsi_required': False, 'edge_k': 1.2811270978344727, 'edge_cap': 0.5743359182733659}.
[I 2025-08-30 00:19:48,919] Trial 1479 finished with values: [-1000000000.0, 1000000000.0] and parameters: {'p_sma': 42, 'p_std': 25, 'p_atr': 20, 'p_adx': 15, 'rsi_period': 18, 'ema1': 28, 'ema2': 14, 'slip_atr_k': 0.04389003617477322, 'slip_spread_k': 0.8505452324460981, 'spread_hl_frac': 0.016459995709370255, 'bb_std_mult': 0.9444063360615855, 'rsi_os': 26, 'rsi_ob': 62, 'vol_spike': 0.2999728778206947, 'adx_thresh': 14.021275635580217, 'atr_min_pct': 0.013166170696348133, 'atr_max_pct': 0.07913076733202404, 'tp_mult': 1.0135482849888755, 'tsl_mult': 0.3810247784993734, 'strategy': 'breakout', 'time_stop': 114, 'use_sma': False, 'use_atr': False, 'use_adx': False, 'use_ema': False, 'use_spike': False, 'rsi_required': False, 'edge_k': 0.5216096735836572, 'edge_cap': 0.349022703770365}.
[I 2025-08-30 00:20:14,952] Trial 1482 finished with values: [-1000000000.0, 1000000000.0] and parameters: {'p_sma': 17, 'p_std': 26, 'p_atr': 19, 'p_adx': 27, 'rsi_period': 16, 'ema1': 5, 'ema2': 27, 'slip_atr_k': 0.022395003126973474, 'slip_spread_k': 0.5464178494794327, 'spread_hl_frac': 0.003541703624257552, 'bb_std_mult': 2.5394393584996076, 'rsi_os': 31, 'rsi_ob': 61, 'vol_spike': 0.17471462039439767, 'adx_thresh': 32.636008920517455, 'atr_min_pct': 0.0040538413301836815, 'atr_max_pct': 0.08879690207021039, 'tp_mult': 2.361902898444955, 'tsl_mult': 0.7072492812048228, 'strategy': 'breakout', 'time_stop': 108, 'use_sma': False, 'use_atr': False, 'use_adx': False, 'use_ema': False, 'use_spike': False, 'rsi_required': False, 'edge_k': 0.5242590406483297, 'edge_cap': 0.802485314241635}.
[I 2025-08-30 00:20:15,663] Trial 1483 finished with values: [-1000000000.0, 1000000000.0] and parameters: {'p_sma': 6, 'p_std': 26, 'p_atr': 24, 'p_adx': 27, 'rsi_period': 24, 'ema1': 5, 'ema2': 41, 'slip_atr_k': 0.09652003049983907, 'slip_spread_k': 0.5400390795128536, 'spread_hl_frac': 0.003044963023795845, 'bb_std_mult': 1.924008652118363, 'rsi_os': 31, 'rsi_ob': 59, 'vol_spike': 0.17951746633224347, 'adx_thresh': 26.363587418982256, 'atr_min_pct': 0.0039014358979166906, 'atr_max_pct': 0.08789209131402305, 'tp_mult': 1.1207421341651937, 'tsl_mult': 0.30748428480786155, 'strategy': 'breakout', 'time_stop': 138, 'use_sma': False, 'use_atr': False, 'use_adx': False, 'use_ema': False, 'use_spike': False, 'rsi_required': False, 'edge_k': 0.5192425339875317, 'edge_cap': 0.7572683591016491}.
[I 2025-08-30 00:20:15,664] Trial 1481 finished with values: [-1000000000.0, 1000000000.0] and parameters: {'p_sma': 6, 'p_std': 25, 'p_atr': 20, 'p_adx': 16, 'rsi_period': 55, 'ema1': 20, 'ema2': 53, 'slip_atr_k': 0.19742442649311953, 'slip_spread_k': 0.13984103045025015, 'spread_hl_frac': 0.016275537332513766, 'bb_std_mult': 0.9209195169382205, 'rsi_os': 19, 'rsi_ob': 59, 'vol_spike': 0.2647014939709993, 'adx_thresh': 15.564146901787979, 'atr_min_pct': 0.014139033248922886, 'atr_max_pct': 0.08000056984535722, 'tp_mult': 2.940710975329117, 'tsl_mult': 0.21168114740392913, 'strategy': 'breakout', 'time_stop': 81, 'use_sma': False, 'use_atr': False, 'use_adx': False, 'use_ema': False, 'use_spike': False, 'rsi_required': False, 'edge_k': 0.5156728408667186, 'edge_cap': 0.5701086519809638}.
[I 2025-08-30 00:20:15,757] Trial 1480 finished with values: [-1000000000.0, 1000000000.0] and parameters: {'p_sma': 42, 'p_std': 25, 'p_atr': 28, 'p_adx': 19, 'rsi_period': 51, 'ema1': 20, 'ema2': 41, 'slip_atr_k': 0.02047081316699816, 'slip_spread_k': 0.8472550499334162, 'spread_hl_frac': 0.016517992105627963, 'bb_std_mult': 1.957449994055392, 'rsi_os': 50, 'rsi_ob': 48, 'vol_spike': 0.17957280727160346, 'adx_thresh': 15.274654524474435, 'atr_min_pct': 0.02606139187066856, 'atr_max_pct': 0.07874958025820471, 'tp_mult': 1.9780346036912337, 'tsl_mult': 0.058613600978920155, 'strategy': 'breakout', 'time_stop': 139, 'use_sma': False, 'use_atr': False, 'use_adx': False, 'use_ema': False, 'use_spike': False, 'rsi_required': False, 'edge_k': 0.5003828285331011, 'edge_cap': 0.940475871782524}.
[I 2025-08-30 00:20:41,536] Trial 1487 finished with values: [-1000000000.0, 1000000000.0] and parameters: {'p_sma': 7, 'p_std': 22, 'p_atr': 24, 'p_adx': 17, 'rsi_period': 19, 'ema1': 22, 'ema2': 51, 'slip_atr_k': 0.004888150547458834, 'slip_spread_k': 0.8781816114746893, 'spread_hl_frac': 0.02894308735787986, 'bb_std_mult': 2.1292024760960158, 'rsi_os': 25, 'rsi_ob': 58, 'vol_spike': 0.20198585352401832, 'adx_thresh': 26.444790523148058, 'atr_min_pct': 0.0223345817895173, 'atr_max_pct': 0.09893471456795028, 'tp_mult': 1.1655740203515006, 'tsl_mult': 0.8024565847287721, 'strategy': 'mean_reversion', 'time_stop': 105, 'use_sma': False, 'use_atr': False, 'use_adx': False, 'use_ema': False, 'use_spike': False, 'rsi_required': False, 'edge_k': 0.000844043963831087, 'edge_cap': 0.7599934859046945}.
