[I 2025-08-29 21:56:41,245] Trial 159 finished with values: [-0.05001413391829246, 0.050007379953377444] and parameters: {'p_sma': 9, 'p_std': 51, 'p_atr': 29, 'p_adx': 26, 'rsi_period': 40, 'ema1': 24, 'ema2': 18, 'slip_atr_k': 0.024087045817080675, 'slip_spread_k': 0.6541121869337111, 'spread_hl_frac': 0.009695346268968608, 'bb_std_mult': 0.6014039525613986, 'rsi_os': 49, 'rsi_ob': 55, 'vol_spike': 0.009959769208455871, 'adx_thresh': 15.865805698385046, 'atr_min_pct': 0.00019669359948055456, 'atr_max_pct': 0.0810190032562268, 'tp_mult': 1.8703890466901596, 'tsl_mult': 0.13345928953624747, 'strategy': 'breakout', 'time_stop': 181, 'use_sma': False, 'use_atr': False, 'use_adx': False, 'use_ema': False, 'use_spike': False, 'rsi_required': False, 'edge_k': 0.5321137583126562, 'edge_cap': 0.43700739282042395}.
[I 2025-08-29 21:57:08,139] Trial 163 finished with values: [-0.02981621657792477, 0.029804031892371192] and parameters: {'p_sma': 39, 'p_std': 23, 'p_atr': 29, 'p_adx': 30, 'rsi_period': 23, 'ema1': 28, 'ema2': 20, 'slip_atr_k': 0.023732973217135155, 'slip_spread_k': 0.0006119740322843015, 'spread_hl_frac': 0.015887606496117507, 'bb_std_mult': 1.168742865913899, 'rsi_os': 32, 'rsi_ob': 70, 'vol_spike': 0.18157847013644296, 'adx_thresh': 32.012590258265874, 'atr_min_pct': 7.252268112661517e-05, 'atr_max_pct': 0.05855195681033996, 'tp_mult': 1.1343884765544008, 'tsl_mult': 0.8265917763084125, 'strategy': 'breakout', 'time_stop': 112, 'use_sma': False, 'use_atr': False, 'use_adx': False, 'use_ema': False, 'use_spike': False, 'rsi_required': False, 'edge_k': 0.31420320746096775, 'edge_cap': 0.33133737660709817}.
[I 2025-08-29 21:57:08,541] Trial 165 finished with values: [-1000000000.0, 1000000000.0] and parameters: {'p_sma': 45, 'p_std': 22, 'p_atr': 11, 'p_adx': 30, 'rsi_period': 24, 'ema1': 28, 'ema2': 16, 'slip_atr_k': 0.02013611023554565, 'slip_spread_k': 0.8239331294724433, 'spread_hl_frac': 0.015401684828184966, 'bb_std_mult': 2.5631149159517737, 'rsi_os': 50, 'rsi_ob': 80, 'vol_spike': 0.24926185652508964, 'adx_thresh': 31.307153945928615, 'atr_min_pct': 0.017473735762177173, 'atr_max_pct': 0.10710518954170428, 'tp_mult': 1.8484025393504093, 'tsl_mult': 0.7797801386307864, 'strategy': 'breakout', 'time_stop': 111, 'use_sma': False, 'use_atr': False, 'use_adx': False, 'use_ema': False, 'use_spike': False, 'rsi_required': False, 'edge_k': 1.8642586411017046, 'edge_cap': 0.2101167202436277}.
[I 2025-08-29 21:57:08,719] Trial 164 finished with values: [-0.012716419462720618, 0.0126994113974816] and parameters: {'p_sma': 11, 'p_std': 23, 'p_atr': 29, 'p_adx': 30, 'rsi_period': 23, 'ema1': 28, 'ema2': 16, 'slip_atr_k': 0.021275492050649165, 'slip_spread_k': 0.4919492929948569, 'spread_hl_frac': 0.018963516523669816, 'bb_std_mult': 1.7913822429933826, 'rsi_os': 32, 'rsi_ob': 71, 'vol_spike': 0.006950889343368627, 'adx_thresh': 32.08125224286426, 'atr_min_pct': 0.0001221276609507402, 'atr_max_pct': 0.057106352493548555, 'tp_mult': 1.8707408562524308, 'tsl_mult': 0.7834033502317603, 'strategy': 'breakout', 'time_stop': 113, 'use_sma': False, 'use_atr': False, 'use_adx': False, 'use_ema': False, 'use_spike': False, 'rsi_required': False, 'edge_k': 0.5363979669465304, 'edge_cap': 0.7909966910089192}.
[I 2025-08-29 21:57:08,721] Trial 166 finished with values: [-0.005136619212688265, 0.005113911331714975] and parameters: {'p_sma': 34, 'p_std': 22, 'p_atr': 30, 'p_adx': 11, 'rsi_period': 76, 'ema1': 26, 'ema2': 16, 'slip_atr_k': 0.015791669613399652, 'slip_spread_k': 0.817667098113772, 'spread_hl_frac': 0.015516294429041485, 'bb_std_mult': 2.117971953234916, 'rsi_os': 24, 'rsi_ob': 77, 'vol_spike': 0.17901215079566707, 'adx_thresh': 31.433015698254685, 'atr_min_pct': 0.0020488136153155923, 'atr_max_pct': 0.10715000177332565, 'tp_mult': 1.1301916672399963, 'tsl_mult': 0.7809068214547987, 'strategy': 'breakout', 'time_stop': 111, 'use_sma': False, 'use_atr': False, 'use_adx': False, 'use_ema': False, 'use_spike': False, 'rsi_required': False, 'edge_k': 0.0459390223615358, 'edge_cap': 0.5875407938797912}.
[I 2025-08-29 21:57:34,618] Trial 167 finished with values: [-0.003042929163355801, 0.0032461251240891507] and parameters: {'p_sma': 34, 'p_std': 22, 'p_atr': 30, 'p_adx': 27, 'rsi_period': 15, 'ema1': 21, 'ema2': 16, 'slip_atr_k': 0.01602117946231134, 'slip_spread_k': 0.8162868275835197, 'spread_hl_frac': 0.03625789253879932, 'bb_std_mult': 1.4152086512468567, 'rsi_os': 10, 'rsi_ob': 59, 'vol_spike': 0.1774075986392436, 'adx_thresh': 30.298896766992794, 'atr_min_pct': 0.001818996811290571, 'atr_max_pct': 0.07250957368526648, 'tp_mult': 1.0144284915351718, 'tsl_mult': 0.7902259985442025, 'strategy': 'breakout', 'time_stop': 130, 'use_sma': False, 'use_atr': False, 'use_adx': False, 'use_ema': False, 'use_spike': False, 'rsi_required': False, 'edge_k': 1.8600822021407375, 'edge_cap': 0.7979765838531951}.
[I 2025-08-29 21:57:35,097] Trial 169 finished with values: [-1000000000.0, 1000000000.0] and parameters: {'p_sma': 57, 'p_std': 53, 'p_atr': 20, 'p_adx': 29, 'rsi_period': 15, 'ema1': 21, 'ema2': 31, 'slip_atr_k': 0.21118834343317022, 'slip_spread_k': 0.5965445376413979, 'spread_hl_frac': 0.03368761873562056, 'bb_std_mult': 1.1061469310262617, 'rsi_os': 25, 'rsi_ob': 59, 'vol_spike': 0.19693653523012783, 'adx_thresh': 28.767442120669994, 'atr_min_pct': 0.020402109677064156, 'atr_max_pct': 0.07344665606413162, 'tp_mult': 1.0890950799015628, 'tsl_mult': 0.240163771700445, 'strategy': 'breakout', 'time_stop': 187, 'use_sma': False, 'use_atr': False, 'use_adx': False, 'use_ema': False, 'use_spike': False, 'rsi_required': False, 'edge_k': 1.2634120168669307, 'edge_cap': 0.831450677685329}.
[I 2025-08-29 21:57:35,198] Trial 168 finished with values: [-1000000000.0, 1000000000.0] and parameters: {'p_sma': 34, 'p_std': 23, 'p_atr': 20, 'p_adx': 19, 'rsi_period': 76, 'ema1': 25, 'ema2': 15, 'slip_atr_k': 0.015146720884535038, 'slip_spread_k': 0.8639149431253241, 'spread_hl_frac': 0.036387870755599544, 'bb_std_mult': 1.0294994540606481, 'rsi_os': 10, 'rsi_ob': 77, 'vol_spike': 0.10875969954837689, 'adx_thresh': 30.159518983577552, 'atr_min_pct': 0.020376587668784207, 'atr_max_pct': 0.07327822001632055, 'tp_mult': 2.1062803871699054, 'tsl_mult': 0.7774024586491024, 'strategy': 'breakout', 'time_stop': 63, 'use_sma': False, 'use_atr': False, 'use_adx': False, 'use_ema': False, 'use_spike': False, 'rsi_required': False, 'edge_k': 0.07335352256974748, 'edge_cap': 0.7902165865811819}.
[I 2025-08-29 21:57:35,435] Trial 170 finished with values: [-1000000000.0, 1000000000.0] and parameters: {'p_sma': 7, 'p_std': 26, 'p_atr': 20, 'p_adx': 29, 'rsi_period': 19, 'ema1': 21, 'ema2': 58, 'slip_atr_k': 0.21246188252957526, 'slip_spread_k': 0.8713844711886579, 'spread_hl_frac': 0.03605576676204911, 'bb_std_mult': 3.3267401377603747, 'rsi_os': 25, 'rsi_ob': 59, 'vol_spike': 0.1964930205405131, 'adx_thresh': 30.270906459515007, 'atr_min_pct': 0.00174789007845192, 'atr_max_pct': 0.09010522280012258, 'tp_mult': 1.5655863646359842, 'tsl_mult': 0.21926387842445855, 'strategy': 'breakout', 'time_stop': 134, 'use_sma': False, 'use_atr': False, 'use_adx': False, 'use_ema': False, 'use_spike': False, 'rsi_required': False, 'edge_k': 0.46831445784446213, 'edge_cap': 0.39584248002947564}.
[I 2025-08-29 21:58:02,297] Trial 172 finished with values: [-1000000000.0, 1000000000.0] and parameters: {'p_sma': 55, 'p_std': 27, 'p_atr': 17, 'p_adx': 29, 'rsi_period': 21, 'ema1': 25, 'ema2': 57, 'slip_atr_k': 0.2000599869425769, 'slip_spread_k': 0.8617342045545345, 'spread_hl_frac': 0.010861373776937104, 'bb_std_mult': 1.0640783516647638, 'rsi_os': 45, 'rsi_ob': 48, 'vol_spike': 0.21633598907043683, 'adx_thresh': 30.2368083758442, 'atr_min_pct': 0.014213395226253702, 'atr_max_pct': 0.13260277964742254, 'tp_mult': 1.992126931748933, 'tsl_mult': 0.6968433882079661, 'strategy': 'breakout', 'time_stop': 99, 'use_sma': False, 'use_atr': False, 'use_adx': False, 'use_ema': False, 'use_spike': False, 'rsi_required': False, 'edge_k': 0.20332825685987832, 'edge_cap': 0.5431735626511077}.
[I 2025-08-29 21:58:02,468] Trial 174 finished with values: [-1000000000.0, 1000000000.0] and parameters: {'p_sma': 25, 'p_std': 28, 'p_atr': 30, 'p_adx': 29, 'rsi_period': 21, 'ema1': 25, 'ema2': 19, 'slip_atr_k': 0.08694896025762128, 'slip_spread_k': 0.8512545491157196, 'spread_hl_frac': 0.014283706002984085, 'bb_std_mult': 3.0772214444120523, 'rsi_os': 46, 'rsi_ob': 61, 'vol_spike': 0.02679096072879647, 'adx_thresh': 32.765460934777984, 'atr_min_pct': 0.025466305919305633, 'atr_max_pct': 0.06593915506932196, 'tp_mult': 1.160092892690147, 'tsl_mult': 0.03307735875825479, 'strategy': 'mean_reversion', 'time_stop': 102, 'use_sma': False, 'use_atr': False, 'use_adx': False, 'use_ema': False, 'use_spike': False, 'rsi_required': False, 'edge_k': 0.1757361285819934, 'edge_cap': 0.8225467004043987}.
[I 2025-08-29 21:58:02,468] Trial 171 finished with values: [-1000000000.0, 1000000000.0] and parameters: {'p_sma': 57, 'p_std': 26, 'p_atr': 30, 'p_adx': 29, 'rsi_period': 15, 'ema1': 30, 'ema2': 15, 'slip_atr_k': 0.13041742309731633, 'slip_spread_k': 0.8598887232030734, 'spread_hl_frac': 0.04051688895196087, 'bb_std_mult': 1.4142999235714244, 'rsi_os': 9, 'rsi_ob': 82, 'vol_spike': 0.1979042885956217, 'adx_thresh': 30.469486961262593, 'atr_min_pct': 0.0017476173551336173, 'atr_max_pct': 0.06417288001862367, 'tp_mult': 1.014522102521555, 'tsl_mult': 0.8133039686487723, 'strategy': 'breakout', 'time_stop': 102, 'use_sma': False, 'use_atr': False, 'use_adx': False, 'use_ema': False, 'use_spike': False, 'rsi_required': False, 'edge_k': 0.37816240682606106, 'edge_cap': 0.7802569309913638}.
[I 2025-08-29 21:58:02,538] Trial 173 finished with values: [-1000000000.0, 1000000000.0] and parameters: {'p_sma': 6, 'p_std': 27, 'p_atr': 17, 'p_adx': 29, 'rsi_period': 19, 'ema1': 20, 'ema2': 45, 'slip_atr_k': 0.029547617015289296, 'slip_spread_k': 0.34163358413996164, 'spread_hl_frac': 0.003920810386710817, 'bb_std_mult': 1.387317810321222, 'rsi_os': 27, 'rsi_ob': 66, 'vol_spike': 0.18869393101611198, 'adx_thresh': 32.9126380298206, 'atr_min_pct': 0.001594866091259708, 'atr_max_pct': 0.09007372785388396, 'tp_mult': 1.5591074273427574, 'tsl_mult': 0.8135819464560398, 'strategy': 'mean_reversion', 'time_stop': 102, 'use_sma': False, 'use_atr': False, 'use_adx': False, 'use_ema': False, 'use_spike': False, 'rsi_required': False, 'edge_k': 0.38257125086410587, 'edge_cap': 0.8239548464219039}.
[I 2025-08-29 21:58:02,642] Trial 175 finished with values: [-1000000000.0, 1000000000.0] and parameters: {'p_sma': 12, 'p_std': 26, 'p_atr': 30, 'p_adx': 29, 'rsi_period': 44, 'ema1': 9, 'ema2': 17, 'slip_atr_k': 0.12954979263755292, 'slip_spread_k': 0.5297079351075986, 'spread_hl_frac': 0.003438500089744896, 'bb_std_mult': 1.4098154798599722, 'rsi_os': 54, 'rsi_ob': 61, 'vol_spike': 0.18756573056860917, 'adx_thresh': 20.436733014586572, 'atr_min_pct': 0.001645877860047296, 'atr_max_pct': 0.06567072572302844, 'tp_mult': 1.1709137231571318, 'tsl_mult': 0.8088591879114339, 'strategy': 'mean_reversion', 'time_stop': 280, 'use_sma': False, 'use_atr': False, 'use_adx': False, 'use_ema': False, 'use_spike': False, 'rsi_required': False, 'edge_k': 0.39573595480624324, 'edge_cap': 0.8200144744685757}.
[I 2025-08-29 21:58:02,673] Trial 176 finished with values: [-1000000000.0, 1000000000.0] and parameters: {'p_sma': 11, 'p_std': 21, 'p_atr': 30, 'p_adx': 28, 'rsi_period': 9, 'ema1': 9, 'ema2': 17, 'slip_atr_k': 0.14948189792645808, 'slip_spread_k': 0.9632051995135056, 'spread_hl_frac': 0.003564405188522298, 'bb_std_mult': 2.812414718419301, 'rsi_os': 54, 'rsi_ob': 57, 'vol_spike': 0.18769009830132752, 'adx_thresh': 31.351757238885494, 'atr_min_pct': 0.027054638970188352, 'atr_max_pct': 0.14291537633490997, 'tp_mult': 2.991415780655409, 'tsl_mult': 0.8368389849126544, 'strategy': 'mean_reversion', 'time_stop': 131, 'use_sma': False, 'use_atr': False, 'use_adx': False, 'use_ema': False, 'use_spike': False, 'rsi_required': False, 'edge_k': 0.4801795706127495, 'edge_cap': 0.8031813691396653}.
[I 2025-08-29 21:58:28,566] Trial 177 finished with values: [-1000000000.0, 1000000000.0] and parameters: {'p_sma': 8, 'p_std': 35, 'p_atr': 12, 'p_adx': 28, 'rsi_period': 18, 'ema1': 26, 'ema2': 17, 'slip_atr_k': 0.1382186116737865, 'slip_spread_k': 0.3388136497230694, 'spread_hl_frac': 0.0033246883939662495, 'bb_std_mult': 1.617197362675122, 'rsi_os': 27, 'rsi_ob': 63, 'vol_spike': 0.18822606136040348, 'adx_thresh': 13.531451197780536, 'atr_min_pct': 0.01906031170589889, 'atr_max_pct': 0.12111911326479008, 'tp_mult': 1.0774844119099491, 'tsl_mult': 0.8246407753113707, 'strategy': 'mean_reversion', 'time_stop': 130, 'use_sma': False, 'use_atr': False, 'use_adx': False, 'use_ema': False, 'use_spike': False, 'rsi_required': False, 'edge_k': 1.3569641806761197, 'edge_cap': 0.8549995034987105}.
[I 2025-08-29 21:58:28,751] Trial 178 finished with values: [-1000000000.0, 1000000000.0] and parameters: {'p_sma': 11, 'p_std': 40, 'p_atr': 30, 'p_adx': 28, 'rsi_period': 34, 'ema1': 26, 'ema2': 51, 'slip_atr_k': 0.13680058745144882, 'slip_spread_k': 0.24014922740334838, 'spread_hl_frac': 0.029801305302612463, 'bb_std_mult': 0.5556508507285469, 'rsi_os': 23, 'rsi_ob': 51, 'vol_spike': 0.27919610845715415, 'adx_thresh': 20.295202974193444, 'atr_min_pct': 0.01865211780372387, 'atr_max_pct': 0.12378340364805049, 'tp_mult': 1.0661079860304143, 'tsl_mult': 0.8376225778662206, 'strategy': 'breakout', 'time_stop': 277, 'use_sma': False, 'use_atr': False, 'use_adx': False, 'use_ema': False, 'use_spike': False, 'rsi_required': False, 'edge_k': 1.3576952776735034, 'edge_cap': 0.7522114777082917}.
[I 2025-08-29 21:58:29,133] Trial 179 finished with values: [-1000000000.0, 1000000000.0] and parameters: {'p_sma': 11, 'p_std': 35, 'p_atr': 13, 'p_adx': 30, 'rsi_period': 81, 'ema1': 17, 'ema2': 17, 'slip_atr_k': 0.013742711020601317, 'slip_spread_k': 0.7986588159464965, 'spread_hl_frac': 0.007013052783808429, 'bb_std_mult': 1.623906720807833, 'rsi_os': 23, 'rsi_ob': 63, 'vol_spike': 0.16239619107227155, 'adx_thresh': 31.09761817104252, 'atr_min_pct': 0.018484498467625086, 'atr_max_pct': 0.1424348982551956, 'tp_mult': 2.7256433482667006, 'tsl_mult': 0.9362565643459346, 'strategy': 'breakout', 'time_stop': 266, 'use_sma': False, 'use_atr': False, 'use_adx': False, 'use_ema': False, 'use_spike': False, 'rsi_required': False, 'edge_k': 1.3521662694624665, 'edge_cap': 0.2924917482465603}.
[I 2025-08-29 21:58:29,440] Trial 180 finished with values: [-1000000000.0, 1000000000.0] and parameters: {'p_sma': 49, 'p_std': 35, 'p_atr': 13, 'p_adx': 28, 'rsi_period': 25, 'ema1': 26, 'ema2': 38, 'slip_atr_k': 0.004802545728870983, 'slip_spread_k': 0.6963210810861976, 'spread_hl_frac': 0.03072516729622535, 'bb_std_mult': 2.975091044766264, 'rsi_os': 29, 'rsi_ob': 63, 'vol_spike': 0.2805602595533934, 'adx_thresh': 31.130197802982583, 'atr_min_pct': 0.019263031972854137, 'atr_max_pct': 0.12321575022470743, 'tp_mult': 2.0469715064099976, 'tsl_mult': 0.9307499444841536, 'strategy': 'breakout', 'time_stop': 199, 'use_sma': False, 'use_atr': False, 'use_adx': False, 'use_ema': False, 'use_spike': False, 'rsi_required': False, 'edge_k': 0.8027296494622991, 'edge_cap': 0.9305338738888125}.
[I 2025-08-29 21:58:56,971] Trial 182 finished with values: [-0.0064811141171130515, 0.006556571816810454] and parameters: {'p_sma': 49, 'p_std': 24, 'p_atr': 7, 'p_adx': 30, 'rsi_period': 81, 'ema1': 23, 'ema2': 19, 'slip_atr_k': 0.005878256487807359, 'slip_spread_k': 0.8981534105682794, 'spread_hl_frac': 0.007515528817795089, 'bb_std_mult': 1.8782228499748355, 'rsi_os': 20, 'rsi_ob': 87, 'vol_spike': 0.17375972704944276, 'adx_thresh': 10.18084620728401, 'atr_min_pct': 0.002278183296101146, 'atr_max_pct': 0.08591721476892421, 'tp_mult': 2.2291038301601747, 'tsl_mult': 0.9330371208050856, 'strategy': 'breakout', 'time_stop': 83, 'use_sma': False, 'use_atr': False, 'use_adx': False, 'use_ema': False, 'use_spike': False, 'rsi_required': False, 'edge_k': 1.0205109770918348, 'edge_cap': 0.9399813292288208}.
[I 2025-08-29 21:58:57,208] Trial 184 finished with values: [-1000000000.0, 1000000000.0] and parameters: {'p_sma': 9, 'p_std': 38, 'p_atr': 29, 'p_adx': 11, 'rsi_period': 22, 'ema1': 25, 'ema2': 29, 'slip_atr_k': 0.015628890687555876, 'slip_spread_k': 0.8364263415747897, 'spread_hl_frac': 0.0022457655307952648, 'bb_std_mult': 1.914653358038989, 'rsi_os': 24, 'rsi_ob': 87, 'vol_spike': 0.176826549968912, 'adx_thresh': 10.072333171648785, 'atr_min_pct': 0.015419266950226046, 'atr_max_pct': 0.08515940159668592, 'tp_mult': 1.1316405937555252, 'tsl_mult': 0.7939693642661482, 'strategy': 'breakout', 'time_stop': 117, 'use_sma': False, 'use_atr': False, 'use_adx': False, 'use_ema': False, 'use_spike': False, 'rsi_required': False, 'edge_k': 0.5706690450596947, 'edge_cap': 0.7695509535210119}.
[I 2025-08-29 21:58:57,241] Trial 181 finished with values: [-0.00784641294537447, 0.007818536681348538] and parameters: {'p_sma': 14, 'p_std': 13, 'p_atr': 25, 'p_adx': 28, 'rsi_period': 25, 'ema1': 23, 'ema2': 19, 'slip_atr_k': 0.00539162946203349, 'slip_spread_k': 0.8017189309219385, 'spread_hl_frac': 0.04510948853699941, 'bb_std_mult': 1.9592540879275275, 'rsi_os': 29, 'rsi_ob': 52, 'vol_spike': 0.17682649821587962, 'adx_thresh': 30.946459360934366, 'atr_min_pct': 0.0023061420625093126, 'atr_max_pct': 0.06995529100379927, 'tp_mult': 1.1316520572522428, 'tsl_mult': 0.6121855197220912, 'strategy': 'breakout', 'time_stop': 197, 'use_sma': False, 'use_atr': False, 'use_adx': False, 'use_ema': False, 'use_spike': False, 'rsi_required': False, 'edge_k': 0.66512074981335, 'edge_cap': 0.7494948078502852}.
[I 2025-08-29 21:58:57,416] Trial 183 finished with values: [-0.005892234401614904, 0.006094156851514085] and parameters: {'p_sma': 9, 'p_std': 24, 'p_atr': 7, 'p_adx': 8, 'rsi_period': 61, 'ema1': 25, 'ema2': 38, 'slip_atr_k': 0.005035564452207094, 'slip_spread_k': 0.42234996646800654, 'spread_hl_frac': 0.0022851967759517757, 'bb_std_mult': 2.9550520709054826, 'rsi_os': 34, 'rsi_ob': 87, 'vol_spike': 0.1746146616238271, 'adx_thresh': 16.61807825660151, 'atr_min_pct': 0.002459343922988998, 'atr_max_pct': 0.13617915976494774, 'tp_mult': 1.1285607285529702, 'tsl_mult': 0.7227058565385218, 'strategy': 'breakout', 'time_stop': 117, 'use_sma': False, 'use_atr': False, 'use_adx': False, 'use_ema': False, 'use_spike': False, 'rsi_required': False, 'edge_k': 1.4909195508022681, 'edge_cap': 0.24485439879965443}.
[I 2025-08-29 21:59:24,007] Trial 188 finished with values: [-0.007135937526398406, 0.007115420194146903] and parameters: {'p_sma': 7, 'p_std': 25, 'p_atr': 18, 'p_adx': 17, 'rsi_period': 20, 'ema1': 24, 'ema2': 16, 'slip_atr_k': 0.175432486459943, 'slip_spread_k': 0.8290854320967626, 'spread_hl_frac': 0.021293852348554604, 'bb_std_mult': 2.1007913616458507, 'rsi_os': 24, 'rsi_ob': 60, 'vol_spike': 0.09339605265447751, 'adx_thresh': 31.775325734663678, 'atr_min_pct': 0.0008300025452471695, 'atr_max_pct': 0.09588693649383113, 'tp_mult': 1.3169461875707507, 'tsl_mult': 0.7864530459776428, 'strategy': 'breakout', 'time_stop': 109, 'use_sma': False, 'use_atr': False, 'use_adx': False, 'use_ema': False, 'use_spike': False, 'rsi_required': False, 'edge_k': 1.6885748086778287, 'edge_cap': 0.5973733903738072}.
[I 2025-08-29 21:59:24,270] Trial 186 finished with values: [-0.0010892847052300647, 0.0015816770091488404] and parameters: {'p_sma': 7, 'p_std': 25, 'p_atr': 23, 'p_adx': 16, 'rsi_period': 20, 'ema1': 24, 'ema2': 54, 'slip_atr_k': 0.01809690795604898, 'slip_spread_k': 0.8228740944092309, 'spread_hl_frac': 0.017646548024041756, 'bb_std_mult': 2.0453709473892814, 'rsi_os': 26, 'rsi_ob': 60, 'vol_spike': 0.18060665645643564, 'adx_thresh': 25.475926286887166, 'atr_min_pct': 0.0023467618349022803, 'atr_max_pct': 0.0953217539489132, 'tp_mult': 1.1233914222623753, 'tsl_mult': 0.7241255850720459, 'strategy': 'breakout', 'time_stop': 108, 'use_sma': False, 'use_atr': False, 'use_adx': False, 'use_ema': False, 'use_spike': False, 'rsi_required': False, 'edge_k': 0.5077292775497879, 'edge_cap': 0.795439715142571}.
[I 2025-08-29 21:59:24,452] Trial 187 finished with values: [-1000000000.0, 1000000000.0] and parameters: {'p_sma': 9, 'p_std': 49, 'p_atr': 26, 'p_adx': 13, 'rsi_period': 20, 'ema1': 11, 'ema2': 54, 'slip_atr_k': 0.17484308087319, 'slip_spread_k': 0.07747688102372458, 'spread_hl_frac': 0.01814902455390487, 'bb_std_mult': 0.8167257375827205, 'rsi_os': 26, 'rsi_ob': 60, 'vol_spike': 0.0962355809078396, 'adx_thresh': 25.510043761526457, 'atr_min_pct': 0.02415860734228934, 'atr_max_pct': 0.10065783352354223, 'tp_mult': 1.1919474632721758, 'tsl_mult': 0.5839173427656554, 'strategy': 'breakout', 'time_stop': 112, 'use_sma': False, 'use_atr': False, 'use_adx': False, 'use_ema': False, 'use_spike': False, 'rsi_required': False, 'edge_k': 0.493286544854624, 'edge_cap': 0.5185141475537461}.
[I 2025-08-29 21:59:24,577] Trial 185 finished with values: [-0.007014300642082305, 0.00725226402674392] and parameters: {'p_sma': 9, 'p_std': 13, 'p_atr': 29, 'p_adx': 8, 'rsi_period': 22, 'ema1': 25, 'ema2': 60, 'slip_atr_k': 0.016581594994074314, 'slip_spread_k': 0.814040593903526, 'spread_hl_frac': 0.017010473643533582, 'bb_std_mult': 2.129486936215303, 'rsi_os': 24, 'rsi_ob': 60, 'vol_spike': 0.1801413423817808, 'adx_thresh': 12.225278862898273, 'atr_min_pct': 0.002275617137502491, 'atr_max_pct': 0.100632585377125, 'tp_mult': 1.1254688888250561, 'tsl_mult': 0.7926982469362597, 'strategy': 'breakout', 'time_stop': 109, 'use_sma': False, 'use_atr': False, 'use_adx': False, 'use_ema': False, 'use_spike': False, 'rsi_required': False, 'edge_k': 1.5088175453916035, 'edge_cap': 0.5816781041668844}.
