[I 2025-08-29 23:45:42,085] Trial 1161 finished with values: [-1000000000.0, 1000000000.0] and parameters: {'p_sma': 38, 'p_std': 52, 'p_atr': 15, 'p_adx': 17, 'rsi_period': 20, 'ema1': 10, 'ema2': 39, 'slip_atr_k': 0.01689308480753824, 'slip_spread_k': 0.7145452325623708, 'spread_hl_frac': 0.01748042986401059, 'bb_std_mult': 2.1095392580669845, 'rsi_os': 25, 'rsi_ob': 56, 'vol_spike': 0.17872675387578688, 'adx_thresh': 31.48130028435046, 'atr_min_pct': 0.028154137036631256, 'atr_max_pct': 0.04623519234324578, 'tp_mult': 1.0701308893814638, 'tsl_mult': 0.7538299200448758, 'strategy': 'breakout', 'time_stop': 288, 'use_sma': False, 'use_atr': False, 'use_adx': False, 'use_ema': False, 'use_spike': False, 'rsi_required': False, 'edge_k': 1.921120664435651, 'edge_cap': 0.5550458790315616}.
[I 2025-08-29 23:45:42,179] Trial 1159 finished with values: [-1000000000.0, 1000000000.0] and parameters: {'p_sma': 7, 'p_std': 22, 'p_atr': 26, 'p_adx': 29, 'rsi_period': 19, 'ema1': 24, 'ema2': 11, 'slip_atr_k': 0.10498450638413968, 'slip_spread_k': 0.26237843826441865, 'spread_hl_frac': 0.016215196855915815, 'bb_std_mult': 2.07029845194143, 'rsi_os': 25, 'rsi_ob': 79, 'vol_spike': 0.1922721504519456, 'adx_thresh': 32.79794863188275, 'atr_min_pct': 0.019961642279079306, 'atr_max_pct': 0.07147569327621216, 'tp_mult': 2.7975584289376907, 'tsl_mult': 0.7015878269384939, 'strategy': 'breakout', 'time_stop': 101, 'use_sma': False, 'use_atr': False, 'use_adx': False, 'use_ema': False, 'use_spike': False, 'rsi_required': False, 'edge_k': 0.3377875930498164, 'edge_cap': 0.7558407236999944}.
[I 2025-08-29 23:46:10,244] Trial 1163 finished with values: [-0.008452752067452773, 0.008718788774974829] and parameters: {'p_sma': 39, 'p_std': 48, 'p_atr': 23, 'p_adx': 17, 'rsi_period': 20, 'ema1': 23, 'ema2': 55, 'slip_atr_k': 0.015835577624650515, 'slip_spread_k': 0.5360562157114376, 'spread_hl_frac': 0.02684918826684885, 'bb_std_mult': 2.056220069579271, 'rsi_os': 25, 'rsi_ob': 60, 'vol_spike': 0.18614922428987216, 'adx_thresh': 32.98258896827319, 'atr_min_pct': 0.0023880570613828206, 'atr_max_pct': 0.09837697921415059, 'tp_mult': 2.7904837558385864, 'tsl_mult': 0.7507381977744231, 'strategy': 'breakout', 'time_stop': 48, 'use_sma': False, 'use_atr': False, 'use_adx': False, 'use_ema': False, 'use_spike': False, 'rsi_required': False, 'edge_k': 1.1972821220022631, 'edge_cap': 0.8093421275930945}.
[I 2025-08-29 23:46:10,367] Trial 1165 finished with values: [-1000000000.0, 1000000000.0] and parameters: {'p_sma': 7, 'p_std': 25, 'p_atr': 23, 'p_adx': 16, 'rsi_period': 51, 'ema1': 23, 'ema2': 16, 'slip_atr_k': 0.029323566481871528, 'slip_spread_k': 0.5983538250272595, 'spread_hl_frac': 0.017627415468942434, 'bb_std_mult': 1.933856937667564, 'rsi_os': 27, 'rsi_ob': 60, 'vol_spike': 0.2661852710061677, 'adx_thresh': 8.817973703816145, 'atr_min_pct': 0.002404411229915757, 'atr_max_pct': 0.05328606273899164, 'tp_mult': 1.2011264802975719, 'tsl_mult': 0.7255250261163174, 'strategy': 'breakout', 'time_stop': 110, 'use_sma': False, 'use_atr': False, 'use_adx': False, 'use_ema': False, 'use_spike': False, 'rsi_required': False, 'edge_k': 0.43655714514283916, 'edge_cap': 0.811788327088959}.
[I 2025-08-29 23:46:10,499] Trial 1164 finished with values: [-1000000000.0, 1000000000.0] and parameters: {'p_sma': 47, 'p_std': 44, 'p_atr': 23, 'p_adx': 17, 'rsi_period': 20, 'ema1': 23, 'ema2': 57, 'slip_atr_k': 0.016407708724151857, 'slip_spread_k': 0.7106272188770011, 'spread_hl_frac': 0.017505183223840093, 'bb_std_mult': 2.085324966893364, 'rsi_os': 26, 'rsi_ob': 60, 'vol_spike': 0.2598158069793529, 'adx_thresh': 15.12182820410391, 'atr_min_pct': 0.016908884042696637, 'atr_max_pct': 0.14106453589374646, 'tp_mult': 1.1868835364307868, 'tsl_mult': 0.7641293076069879, 'strategy': 'breakout', 'time_stop': 201, 'use_sma': False, 'use_atr': False, 'use_adx': False, 'use_ema': False, 'use_spike': False, 'rsi_required': False, 'edge_k': 0.9675664740568626, 'edge_cap': 0.8146819746419427}.
[I 2025-08-29 23:46:10,584] Trial 1166 finished with values: [-0.005342028281571043, 0.005556813316158327] and parameters: {'p_sma': 9, 'p_std': 56, 'p_atr': 23, 'p_adx': 16, 'rsi_period': 16, 'ema1': 26, 'ema2': 35, 'slip_atr_k': 0.030321196512775046, 'slip_spread_k': 0.6060000269264939, 'spread_hl_frac': 0.026608469118407495, 'bb_std_mult': 1.7467717753573455, 'rsi_os': 33, 'rsi_ob': 60, 'vol_spike': 0.18615385067343299, 'adx_thresh': 22.066380810226054, 'atr_min_pct': 0.0023902059385875613, 'atr_max_pct': 0.09723348505931526, 'tp_mult': 1.1922292607781524, 'tsl_mult': 0.73043066331548, 'strategy': 'breakout', 'time_stop': 112, 'use_sma': False, 'use_atr': False, 'use_adx': False, 'use_ema': False, 'use_spike': False, 'rsi_required': False, 'edge_k': 0.9607825585928367, 'edge_cap': 0.8164321516139499}.
[I 2025-08-29 23:46:37,597] Trial 1169 finished with values: [-1000000000.0, 1000000000.0] and parameters: {'p_sma': 5, 'p_std': 35, 'p_atr': 25, 'p_adx': 15, 'rsi_period': 23, 'ema1': 25, 'ema2': 30, 'slip_atr_k': 0.023185398824112694, 'slip_spread_k': 0.9820971690106449, 'spread_hl_frac': 0.04188374363596091, 'bb_std_mult': 1.9445836938375058, 'rsi_os': 23, 'rsi_ob': 75, 'vol_spike': 0.17226302828395437, 'adx_thresh': 21.358203170435292, 'atr_min_pct': 0.029515959025344582, 'atr_max_pct': 0.08172223115075754, 'tp_mult': 2.936387720862954, 'tsl_mult': 0.8347506369847547, 'strategy': 'breakout', 'time_stop': 114, 'use_sma': False, 'use_atr': False, 'use_adx': False, 'use_ema': False, 'use_spike': False, 'rsi_required': False, 'edge_k': 0.7931116443472748, 'edge_cap': 0.6037549237462618}.
[I 2025-08-29 23:46:38,084] Trial 1170 finished with values: [-1000000000.0, 1000000000.0] and parameters: {'p_sma': 6, 'p_std': 17, 'p_atr': 25, 'p_adx': 10, 'rsi_period': 23, 'ema1': 9, 'ema2': 21, 'slip_atr_k': 0.23190640276794122, 'slip_spread_k': 0.12983952917711922, 'spread_hl_frac': 0.04183896862187976, 'bb_std_mult': 3.3584984488256406, 'rsi_os': 28, 'rsi_ob': 62, 'vol_spike': 0.043170956184062984, 'adx_thresh': 29.216386036817596, 'atr_min_pct': 0.019221561244923857, 'atr_max_pct': 0.13297133260920233, 'tp_mult': 1.767446014645559, 'tsl_mult': 0.6740276061485316, 'strategy': 'breakout', 'time_stop': 93, 'use_sma': False, 'use_atr': False, 'use_adx': False, 'use_ema': False, 'use_spike': False, 'rsi_required': False, 'edge_k': 1.377388851470136, 'edge_cap': 0.7854949609798358}.
[I 2025-08-29 23:46:38,297] Trial 1167 finished with values: [-1000000000.0, 1000000000.0] and parameters: {'p_sma': 47, 'p_std': 25, 'p_atr': 23, 'p_adx': 9, 'rsi_period': 23, 'ema1': 23, 'ema2': 45, 'slip_atr_k': 0.030851391031971813, 'slip_spread_k': 0.8679022064913193, 'spread_hl_frac': 0.04194989710967499, 'bb_std_mult': 2.3627407565410876, 'rsi_os': 33, 'rsi_ob': 59, 'vol_spike': 0.050467889015466075, 'adx_thresh': 34.39358215722736, 'atr_min_pct': 0.01674156498836233, 'atr_max_pct': 0.05190315091222189, 'tp_mult': 1.2019689601526813, 'tsl_mult': 0.83552397668668, 'strategy': 'breakout', 'time_stop': 5, 'use_sma': False, 'use_atr': False, 'use_adx': False, 'use_ema': False, 'use_spike': False, 'rsi_required': False, 'edge_k': 0.45857178807806354, 'edge_cap': 0.5260542155299055}.
[I 2025-08-29 23:46:38,298] Trial 1168 finished with values: [-1000000000.0, 1000000000.0] and parameters: {'p_sma': 5, 'p_std': 27, 'p_atr': 10, 'p_adx': 10, 'rsi_period': 16, 'ema1': 24, 'ema2': 57, 'slip_atr_k': 0.11544500313307024, 'slip_spread_k': 0.8584213406144962, 'spread_hl_frac': 0.01962045518927115, 'bb_std_mult': 1.9821083771623906, 'rsi_os': 23, 'rsi_ob': 62, 'vol_spike': 0.0850891887934625, 'adx_thresh': 24.486741441816708, 'atr_min_pct': 0.018016421169659347, 'atr_max_pct': 0.13487167544287498, 'tp_mult': 1.1876948411086403, 'tsl_mult': 0.6774976411083922, 'strategy': 'breakout', 'time_stop': 113, 'use_sma': False, 'use_atr': False, 'use_adx': False, 'use_ema': False, 'use_spike': False, 'rsi_required': False, 'edge_k': 0.9666055663667326, 'edge_cap': 0.601978343092911}.
[I 2025-08-29 23:47:05,154] Trial 1171 finished with values: [-0.021037928793272265, 0.021053428507490497] and parameters: {'p_sma': 6, 'p_std': 19, 'p_atr': 24, 'p_adx': 15, 'rsi_period': 33, 'ema1': 9, 'ema2': 21, 'slip_atr_k': 0.23524886649696056, 'slip_spread_k': 0.7607264732004431, 'spread_hl_frac': 0.01862860380136099, 'bb_std_mult': 3.3662851852577784, 'rsi_os': 29, 'rsi_ob': 52, 'vol_spike': 0.04956261357243885, 'adx_thresh': 24.589913290727583, 'atr_min_pct': 0.0019446034953288548, 'atr_max_pct': 0.133133269445305, 'tp_mult': 1.6844862803749643, 'tsl_mult': 0.6832330743531764, 'strategy': 'mean_reversion', 'time_stop': 184, 'use_sma': False, 'use_atr': False, 'use_adx': False, 'use_ema': False, 'use_spike': False, 'rsi_required': False, 'edge_k': 1.5020956597877153, 'edge_cap': 0.7847377946215895}.
[I 2025-08-29 23:47:05,945] Trial 1172 finished with values: [-0.021414219305818216, 0.021416883385755606] and parameters: {'p_sma': 8, 'p_std': 26, 'p_atr': 24, 'p_adx': 16, 'rsi_period': 33, 'ema1': 24, 'ema2': 56, 'slip_atr_k': 0.009350909316298792, 'slip_spread_k': 0.8628087384040224, 'spread_hl_frac': 0.019409269529619366, 'bb_std_mult': 2.9210435481306343, 'rsi_os': 11, 'rsi_ob': 59, 'vol_spike': 0.1962170051793198, 'adx_thresh': 24.570225940864418, 'atr_min_pct': 0.0009481419025049848, 'atr_max_pct': 0.11258526254895473, 'tp_mult': 1.1075357833895532, 'tsl_mult': 0.16183823984105433, 'strategy': 'mean_reversion', 'time_stop': 125, 'use_sma': False, 'use_atr': False, 'use_adx': False, 'use_ema': False, 'use_spike': False, 'rsi_required': False, 'edge_k': 1.479206290751375, 'edge_cap': 0.7920358617081481}.
[I 2025-08-29 23:47:06,030] Trial 1174 finished with values: [-0.020211882494551525, 0.020227515891158242] and parameters: {'p_sma': 14, 'p_std': 26, 'p_atr': 24, 'p_adx': 16, 'rsi_period': 32, 'ema1': 24, 'ema2': 54, 'slip_atr_k': 0.021808176836363227, 'slip_spread_k': 0.837819956930365, 'spread_hl_frac': 0.017985242680021316, 'bb_std_mult': 0.9249879782458992, 'rsi_os': 29, 'rsi_ob': 59, 'vol_spike': 0.19669864834074405, 'adx_thresh': 12.184363309760014, 'atr_min_pct': 0.0019000493863863147, 'atr_max_pct': 0.11120133737947428, 'tp_mult': 1.1036045795614704, 'tsl_mult': 0.7251599044361581, 'strategy': 'mean_reversion', 'time_stop': 104, 'use_sma': False, 'use_atr': False, 'use_adx': False, 'use_ema': False, 'use_spike': False, 'rsi_required': False, 'edge_k': 0.09425757825778114, 'edge_cap': 0.8356489505597806}.
[I 2025-08-29 23:47:06,032] Trial 1173 finished with values: [-1000000000.0, 1000000000.0] and parameters: {'p_sma': 7, 'p_std': 26, 'p_atr': 24, 'p_adx': 16, 'rsi_period': 21, 'ema1': 24, 'ema2': 54, 'slip_atr_k': 0.010118314268388119, 'slip_spread_k': 0.645330972775404, 'spread_hl_frac': 0.019134249109949677, 'bb_std_mult': 2.015248566989064, 'rsi_os': 48, 'rsi_ob': 61, 'vol_spike': 0.1978798838096929, 'adx_thresh': 25.849103273157105, 'atr_min_pct': 0.014699327116754824, 'atr_max_pct': 0.11034294403215976, 'tp_mult': 1.116117294865159, 'tsl_mult': 0.7216590315449909, 'strategy': 'mean_reversion', 'time_stop': 215, 'use_sma': False, 'use_atr': False, 'use_adx': False, 'use_ema': False, 'use_spike': False, 'rsi_required': False, 'edge_k': 1.507167570294686, 'edge_cap': 0.87043842803979}.
[I 2025-08-29 23:47:33,124] Trial 1175 finished with values: [-0.010023333643228938, 0.010001056793876365] and parameters: {'p_sma': 11, 'p_std': 10, 'p_atr': 11, 'p_adx': 16, 'rsi_period': 21, 'ema1': 24, 'ema2': 55, 'slip_atr_k': 0.00943124291187843, 'slip_spread_k': 0.38713161044272726, 'spread_hl_frac': 0.016840873206598387, 'bb_std_mult': 1.8176623349406544, 'rsi_os': 49, 'rsi_ob': 86, 'vol_spike': 0.021590432804816234, 'adx_thresh': 25.815982850279834, 'atr_min_pct': 0.0009500111777206394, 'atr_max_pct': 0.10569138932301936, 'tp_mult': 2.0184792163942915, 'tsl_mult': 0.7288337214236298, 'strategy': 'mean_reversion', 'time_stop': 128, 'use_sma': False, 'use_atr': False, 'use_adx': False, 'use_ema': False, 'use_spike': False, 'rsi_required': False, 'edge_k': 0.3819194874362929, 'edge_cap': 0.8714203054964722}.
[I 2025-08-29 23:47:33,660] Trial 1178 finished with values: [-1000000000.0, 1000000000.0] and parameters: {'p_sma': 11, 'p_std': 24, 'p_atr': 28, 'p_adx': 17, 'rsi_period': 74, 'ema1': 12, 'ema2': 53, 'slip_atr_k': 0.01684550431186178, 'slip_spread_k': 0.825990845129679, 'spread_hl_frac': 0.013335842399505835, 'bb_std_mult': 0.8282404079083143, 'rsi_os': 35, 'rsi_ob': 61, 'vol_spike': 0.1828792807055959, 'adx_thresh': 26.77048580175254, 'atr_min_pct': 0.023734786769442233, 'atr_max_pct': 0.10202291453467575, 'tp_mult': 1.5613827641244327, 'tsl_mult': 0.781643389108388, 'strategy': 'breakout', 'time_stop': 97, 'use_sma': False, 'use_atr': False, 'use_adx': False, 'use_ema': False, 'use_spike': False, 'rsi_required': False, 'edge_k': 1.742121271508947, 'edge_cap': 0.7600512713281409}.
[I 2025-08-29 23:47:33,687] Trial 1176 finished with values: [-1000000000.0, 1000000000.0] and parameters: {'p_sma': 11, 'p_std': 24, 'p_atr': 14, 'p_adx': 17, 'rsi_period': 18, 'ema1': 18, 'ema2': 55, 'slip_atr_k': 0.025142141458066043, 'slip_spread_k': 0.905068057692714, 'spread_hl_frac': 0.04369306284137074, 'bb_std_mult': 2.5973350453473762, 'rsi_os': 15, 'rsi_ob': 71, 'vol_spike': 0.18328838418059712, 'adx_thresh': 26.91401133508683, 'atr_min_pct': 0.0034414584214348546, 'atr_max_pct': 0.10280897728912713, 'tp_mult': 1.2502632534423355, 'tsl_mult': 0.22911289885662506, 'strategy': 'breakout', 'time_stop': 236, 'use_sma': False, 'use_atr': False, 'use_adx': False, 'use_ema': False, 'use_spike': False, 'rsi_required': False, 'edge_k': 0.38258019884902206, 'edge_cap': 0.42695115771768305}.
[I 2025-08-29 23:47:33,844] Trial 1177 finished with values: [-0.010326591183617007, 0.010323101202703043] and parameters: {'p_sma': 60, 'p_std': 23, 'p_atr': 11, 'p_adx': 17, 'rsi_period': 18, 'ema1': 12, 'ema2': 53, 'slip_atr_k': 0.13979666875526525, 'slip_spread_k': 0.1785934634280923, 'spread_hl_frac': 0.028533591990500755, 'bb_std_mult': 2.1766327092100957, 'rsi_os': 26, 'rsi_ob': 86, 'vol_spike': 0.17430262672131583, 'adx_thresh': 26.73329611365893, 'atr_min_pct': 0.004127743524801435, 'atr_max_pct': 0.14543584919539232, 'tp_mult': 2.019731636460642, 'tsl_mult': 0.31171230248667114, 'strategy': 'breakout', 'time_stop': 247, 'use_sma': False, 'use_atr': False, 'use_adx': False, 'use_ema': False, 'use_spike': False, 'rsi_required': False, 'edge_k': 0.3826107252390844, 'edge_cap': 0.7604649204569864}.
[I 2025-08-29 23:48:00,190] Trial 1180 finished with values: [-1000000000.0, 1000000000.0] and parameters: {'p_sma': 9, 'p_std': 23, 'p_atr': 22, 'p_adx': 15, 'rsi_period': 18, 'ema1': 18, 'ema2': 52, 'slip_atr_k': 0.0870752809743768, 'slip_spread_k': 0.1844876339434781, 'spread_hl_frac': 0.045712166578494674, 'bb_std_mult': 2.17739152431476, 'rsi_os': 27, 'rsi_ob': 71, 'vol_spike': 0.16951347600907635, 'adx_thresh': 25.491479635394683, 'atr_min_pct': 0.024567640471642935, 'atr_max_pct': 0.0874792945724384, 'tp_mult': 1.0402533543354595, 'tsl_mult': 0.4676229636145461, 'strategy': 'breakout', 'time_stop': 89, 'use_sma': False, 'use_atr': False, 'use_adx': False, 'use_ema': False, 'use_spike': False, 'rsi_required': False, 'edge_k': 0.5044734052152915, 'edge_cap': 0.47428332951015845}.
[I 2025-08-29 23:48:00,546] Trial 1181 finished with values: [-1000000000.0, 1000000000.0] and parameters: {'p_sma': 9, 'p_std': 16, 'p_atr': 13, 'p_adx': 27, 'rsi_period': 18, 'ema1': 28, 'ema2': 43, 'slip_atr_k': 0.17397839900728496, 'slip_spread_k': 0.10234409903801533, 'spread_hl_frac': 0.028481794405169986, 'bb_std_mult': 2.183567483741529, 'rsi_os': 27, 'rsi_ob': 68, 'vol_spike': 0.17476839620779874, 'adx_thresh': 25.504153757840964, 'atr_min_pct': 0.004445725402967476, 'atr_max_pct': 0.016936607573027895, 'tp_mult': 1.474900958535446, 'tsl_mult': 0.470983557814362, 'strategy': 'breakout', 'time_stop': 88, 'use_sma': False, 'use_atr': False, 'use_adx': False, 'use_ema': False, 'use_spike': False, 'rsi_required': False, 'edge_k': 0.4903233585169612, 'edge_cap': 0.175703459805635}.
[I 2025-08-29 23:48:00,875] Trial 1182 finished with values: [-1000000000.0, 1000000000.0] and parameters: {'p_sma': 9, 'p_std': 28, 'p_atr': 13, 'p_adx': 26, 'rsi_period': 39, 'ema1': 22, 'ema2': 43, 'slip_atr_k': 0.18672517662234095, 'slip_spread_k': 0.8079129118143057, 'spread_hl_frac': 0.007413568919303032, 'bb_std_mult': 2.723991026731242, 'rsi_os': 22, 'rsi_ob': 55, 'vol_spike': 0.2504763307622937, 'adx_thresh': 23.165749419194686, 'atr_min_pct': 0.0028299841670813316, 'atr_max_pct': 0.018031648872619842, 'tp_mult': 1.4849002943341807, 'tsl_mult': 0.2581570762772634, 'strategy': 'breakout', 'time_stop': 108, 'use_sma': False, 'use_atr': False, 'use_adx': False, 'use_ema': False, 'use_spike': False, 'rsi_required': False, 'edge_k': 0.48912729052550985, 'edge_cap': 0.17343034562587883}.
[I 2025-08-29 23:48:01,012] Trial 1179 finished with values: [-1000000000.0, 1000000000.0] and parameters: {'p_sma': 9, 'p_std': 23, 'p_atr': 22, 'p_adx': 28, 'rsi_period': 18, 'ema1': 12, 'ema2': 19, 'slip_atr_k': 0.2152863421212358, 'slip_spread_k': 0.8246007885336342, 'spread_hl_frac': 0.045985930407982475, 'bb_std_mult': 2.2004995192034724, 'rsi_os': 14, 'rsi_ob': 61, 'vol_spike': 0.17484406127588695, 'adx_thresh': 27.045952106967654, 'atr_min_pct': 0.004096400378902073, 'atr_max_pct': 0.10184560506931727, 'tp_mult': 1.2553855121002364, 'tsl_mult': 0.13062660435361295, 'strategy': 'breakout', 'time_stop': 97, 'use_sma': False, 'use_atr': False, 'use_adx': False, 'use_ema': False, 'use_spike': False, 'rsi_required': False, 'edge_k': 0.5091829695541027, 'edge_cap': 0.4276690597189528}.
[I 2025-08-29 23:48:27,008] Trial 1184 finished with values: [-0.015395720233513877, 0.01540328746580304] and parameters: {'p_sma': 7, 'p_std': 27, 'p_atr': 23, 'p_adx': 11, 'rsi_period': 66, 'ema1': 25, 'ema2': 56, 'slip_atr_k': 0.1611590765441138, 'slip_spread_k': 0.15146678805464597, 'spread_hl_frac': 0.049980684006950785, 'bb_std_mult': 2.1025057802849227, 'rsi_os': 51, 'rsi_ob': 63, 'vol_spike': 0.16398308089528485, 'adx_thresh': 23.220052474260335, 'atr_min_pct': 0.002827041677500543, 'atr_max_pct': 0.036924664207188776, 'tp_mult': 1.1629329781791675, 'tsl_mult': 0.7479156042710954, 'strategy': 'breakout', 'time_stop': 155, 'use_sma': False, 'use_atr': False, 'use_adx': False, 'use_ema': False, 'use_spike': False, 'rsi_required': False, 'edge_k': 0.5430223172989836, 'edge_cap': 0.834298273639101}.
[I 2025-08-29 23:48:27,212] Trial 1183 finished with values: [-1000000000.0, 1000000000.0] and parameters: {'p_sma': 8, 'p_std': 25, 'p_atr': 23, 'p_adx': 27, 'rsi_period': 39, 'ema1': 25, 'ema2': 19, 'slip_atr_k': 0.014302775041908038, 'slip_spread_k': 0.2992130355866378, 'spread_hl_frac': 0.04995434537375774, 'bb_std_mult': 2.1101570557311633, 'rsi_os': 27, 'rsi_ob': 93, 'vol_spike': 0.1260475164363289, 'adx_thresh': 25.118477017066727, 'atr_min_pct': 0.02260751999071084, 'atr_max_pct': 0.03668096028255565, 'tp_mult': 1.4982369537752334, 'tsl_mult': 0.7517159286531213, 'strategy': 'breakout', 'time_stop': 110, 'use_sma': False, 'use_atr': False, 'use_adx': False, 'use_ema': False, 'use_spike': False, 'rsi_required': False, 'edge_k': 0.5206975275347093, 'edge_cap': 0.16448865631309656}.
[I 2025-08-29 23:48:27,294] Trial 1185 finished with values: [-1000000000.0, 1000000000.0] and parameters: {'p_sma': 7, 'p_std': 27, 'p_atr': 20, 'p_adx': 28, 'rsi_period': 65, 'ema1': 25, 'ema2': 47, 'slip_atr_k': 0.21637871980918089, 'slip_spread_k': 0.8338248380758368, 'spread_hl_frac': 0.01682434615534116, 'bb_std_mult': 2.091046145318794, 'rsi_os': 26, 'rsi_ob': 58, 'vol_spike': 0.2748303110956323, 'adx_thresh': 24.951887528356043, 'atr_min_pct': 0.02633723257463065, 'atr_max_pct': 0.09202253147115945, 'tp_mult': 1.1510274177718431, 'tsl_mult': 0.7492043760215682, 'strategy': 'breakout', 'time_stop': 118, 'use_sma': False, 'use_atr': False, 'use_adx': False, 'use_ema': False, 'use_spike': False, 'rsi_required': False, 'edge_k': 0.6298900856048073, 'edge_cap': 0.6523990038295122}.
[I 2025-08-29 23:48:27,377] Trial 1186 finished with values: [-0.025008022161319254, 0.025025919209576766] and parameters: {'p_sma': 6, 'p_std': 13, 'p_atr': 23, 'p_adx': 12, 'rsi_period': 14, 'ema1': 25, 'ema2': 54, 'slip_atr_k': 0.0736125212721753, 'slip_spread_k': 0.8377803185362909, 'spread_hl_frac': 0.03491427212168205, 'bb_std_mult': 1.3973286801814682, 'rsi_os': 44, 'rsi_ob': 58, 'vol_spike': 0.1906070181110654, 'adx_thresh': 18.86722441172893, 'atr_min_pct': 0.0025568893174132594, 'atr_max_pct': 0.09264547666916406, 'tp_mult': 2.2978991972654805, 'tsl_mult': 0.7509269229837903, 'strategy': 'breakout', 'time_stop': 116, 'use_sma': False, 'use_atr': False, 'use_adx': False, 'use_ema': False, 'use_spike': False, 'rsi_required': False, 'edge_k': 0.752549339579095, 'edge_cap': 0.6527211713812124}.
[I 2025-08-29 23:48:53,033] Trial 1190 finished with values: [-1000000000.0, 1000000000.0] and parameters: {'p_sma': 5, 'p_std': 45, 'p_atr': 9, 'p_adx': 20, 'rsi_period': 61, 'ema1': 23, 'ema2': 55, 'slip_atr_k': 0.019828990155476112, 'slip_spread_k': 0.43147380615962583, 'spread_hl_frac': 0.022677535446442014, 'bb_std_mult': 2.014038173241186, 'rsi_os': 10, 'rsi_ob': 62, 'vol_spike': 0.007697345206860634, 'adx_thresh': 9.54870849130725, 'atr_min_pct': 0.011457903540519624, 'atr_max_pct': 0.09701147842753313, 'tp_mult': 1.0730665464602946, 'tsl_mult': 0.19456243057764627, 'strategy': 'mean_reversion', 'time_stop': 104, 'use_sma': False, 'use_atr': False, 'use_adx': False, 'use_ema': False, 'use_spike': False, 'rsi_required': False, 'edge_k': 0.20212441435688888, 'edge_cap': 0.7991737960033416}.
