[I 2025-08-29 23:15:58,011] Trial 888 finished with values: [-0.018510112412007618, 0.01847935500516039] and parameters: {'p_sma': 10, 'p_std': 14, 'p_atr': 9, 'p_adx': 11, 'rsi_period': 17, 'ema1': 30, 'ema2': 55, 'slip_atr_k': 0.2141747126724756, 'slip_spread_k': 0.7991300166828545, 'spread_hl_frac': 0.017974734291024808, 'bb_std_mult': 2.122588024123071, 'rsi_os': 27, 'rsi_ob': 68, 'vol_spike': 0.1780374009239415, 'adx_thresh': 25.932012984847535, 'atr_min_pct': 0.0029666248449092656, 'atr_max_pct': 0.12367415749654079, 'tp_mult': 1.1021743171453782, 'tsl_mult': 0.7229824697966883, 'strategy': 'breakout', 'time_stop': 101, 'use_sma': False, 'use_atr': False, 'use_adx': False, 'use_ema': False, 'use_spike': False, 'rsi_required': False, 'edge_k': 1.8511155961708288, 'edge_cap': 0.9133033977047749}.
[I 2025-08-29 23:16:25,214] Trial 895 finished with values: [-1000000000.0, 1000000000.0] and parameters: {'p_sma': 5, 'p_std': 25, 'p_atr': 13, 'p_adx': 16, 'rsi_period': 21, 'ema1': 24, 'ema2': 54, 'slip_atr_k': 0.06435493232941258, 'slip_spread_k': 0.8394469273899372, 'spread_hl_frac': 0.021681532114055203, 'bb_std_mult': 3.5341622109786783, 'rsi_os': 45, 'rsi_ob': 60, 'vol_spike': 0.18845989702977384, 'adx_thresh': 26.28922656450265, 'atr_min_pct': 0.01627938283928004, 'atr_max_pct': 0.08968713617825681, 'tp_mult': 2.3824136037922212, 'tsl_mult': 0.949511036568355, 'strategy': 'mean_reversion', 'time_stop': 116, 'use_sma': False, 'use_atr': False, 'use_adx': False, 'use_ema': False, 'use_spike': False, 'rsi_required': False, 'edge_k': 1.8079867948663302, 'edge_cap': 0.07736244693236949}.
[I 2025-08-29 23:16:25,253] Trial 893 finished with values: [-1000000000.0, 1000000000.0] and parameters: {'p_sma': 14, 'p_std': 25, 'p_atr': 13, 'p_adx': 16, 'rsi_period': 41, 'ema1': 24, 'ema2': 54, 'slip_atr_k': 0.0315497247098627, 'slip_spread_k': 0.18205133962816944, 'spread_hl_frac': 0.014563873581911878, 'bb_std_mult': 2.7826243438696014, 'rsi_os': 27, 'rsi_ob': 68, 'vol_spike': 0.18797155185067665, 'adx_thresh': 26.077135128105144, 'atr_min_pct': 0.004055316720744004, 'atr_max_pct': 0.10547768088235693, 'tp_mult': 1.2136595204419325, 'tsl_mult': 0.39040187854780606, 'strategy': 'mean_reversion', 'time_stop': 144, 'use_sma': False, 'use_atr': False, 'use_adx': False, 'use_ema': False, 'use_spike': False, 'rsi_required': False, 'edge_k': 0.40318643508479063, 'edge_cap': 0.8131706831448884}.
[I 2025-08-29 23:16:25,400] Trial 892 finished with values: [-1000000000.0, 1000000000.0] and parameters: {'p_sma': 9, 'p_std': 45, 'p_atr': 18, 'p_adx': 10, 'rsi_period': 21, 'ema1': 24, 'ema2': 55, 'slip_atr_k': 0.011926675339817307, 'slip_spread_k': 0.3615889277200718, 'spread_hl_frac': 0.014645637350150969, 'bb_std_mult': 1.9383823502359583, 'rsi_os': 25, 'rsi_ob': 68, 'vol_spike': 0.18509733939847983, 'adx_thresh': 26.790063656834242, 'atr_min_pct': 0.0038981635174433434, 'atr_max_pct': 0.0982201332954215, 'tp_mult': 1.134734981686183, 'tsl_mult': 0.9507317914327832, 'strategy': 'mean_reversion', 'time_stop': 134, 'use_sma': False, 'use_atr': False, 'use_adx': False, 'use_ema': False, 'use_spike': False, 'rsi_required': False, 'edge_k': 1.108327952695144, 'edge_cap': 0.9095588098881447}.
[I 2025-08-29 23:16:25,517] Trial 894 finished with values: [-1000000000.0, 1000000000.0] and parameters: {'p_sma': 5, 'p_std': 25, 'p_atr': 24, 'p_adx': 10, 'rsi_period': 33, 'ema1': 24, 'ema2': 20, 'slip_atr_k': 0.06252667131203779, 'slip_spread_k': 0.02455060115618274, 'spread_hl_frac': 0.018643237012910787, 'bb_std_mult': 2.1931732209914188, 'rsi_os': 27, 'rsi_ob': 60, 'vol_spike': 0.18795175478352832, 'adx_thresh': 26.43602682164971, 'atr_min_pct': 0.021065565312618176, 'atr_max_pct': 0.08847459092361104, 'tp_mult': 1.130245003232036, 'tsl_mult': 0.6590071432599104, 'strategy': 'breakout', 'time_stop': 133, 'use_sma': False, 'use_atr': False, 'use_adx': False, 'use_ema': False, 'use_spike': False, 'rsi_required': False, 'edge_k': 0.41511228680603063, 'edge_cap': 0.8172660930884841}.
[I 2025-08-29 23:16:53,247] Trial 897 finished with values: [-1000000000.0, 1000000000.0] and parameters: {'p_sma': 6, 'p_std': 26, 'p_atr': 24, 'p_adx': 15, 'rsi_period': 33, 'ema1': 15, 'ema2': 25, 'slip_atr_k': 0.011751158494705965, 'slip_spread_k': 0.8212962412243247, 'spread_hl_frac': 0.04219516117447347, 'bb_std_mult': 2.213713522764634, 'rsi_os': 25, 'rsi_ob': 78, 'vol_spike': 0.18239090805315203, 'adx_thresh': 24.783570921977336, 'atr_min_pct': 0.02066127868325445, 'atr_max_pct': 0.10011838383672858, 'tp_mult': 1.1575080639053232, 'tsl_mult': 0.6678331342742103, 'strategy': 'breakout', 'time_stop': 134, 'use_sma': False, 'use_atr': False, 'use_adx': False, 'use_ema': False, 'use_spike': False, 'rsi_required': False, 'edge_k': 0.4449392508711617, 'edge_cap': 0.7950288405544278}.
[I 2025-08-29 23:16:53,551] Trial 898 finished with values: [-1000000000.0, 1000000000.0] and parameters: {'p_sma': 6, 'p_std': 26, 'p_atr': 11, 'p_adx': 16, 'rsi_period': 45, 'ema1': 15, 'ema2': 51, 'slip_atr_k': 0.0741226321142457, 'slip_spread_k': 0.741457447243592, 'spread_hl_frac': 0.018736000460224337, 'bb_std_mult': 2.205241695515049, 'rsi_os': 11, 'rsi_ob': 49, 'vol_spike': 0.16384874163495666, 'adx_thresh': 25.22316657236784, 'atr_min_pct': 0.023865330632614465, 'atr_max_pct': 0.08741917908125676, 'tp_mult': 2.8679242649248176, 'tsl_mult': 0.6779217446220193, 'strategy': 'breakout', 'time_stop': 28, 'use_sma': False, 'use_atr': False, 'use_adx': False, 'use_ema': False, 'use_spike': False, 'rsi_required': False, 'edge_k': 0.5667245201631999, 'edge_cap': 0.36311506855629705}.
[I 2025-08-29 23:16:53,803] Trial 896 finished with values: [-1000000000.0, 1000000000.0] and parameters: {'p_sma': 58, 'p_std': 26, 'p_atr': 24, 'p_adx': 16, 'rsi_period': 23, 'ema1': 15, 'ema2': 54, 'slip_atr_k': 0.08160097681865304, 'slip_spread_k': 0.3634519625490541, 'spread_hl_frac': 0.01884153851953729, 'bb_std_mult': 2.2171273452629956, 'rsi_os': 20, 'rsi_ob': 64, 'vol_spike': 0.18458720376709237, 'adx_thresh': 24.666570951735437, 'atr_min_pct': 0.026396444253317188, 'atr_max_pct': 0.1455645875110796, 'tp_mult': 2.9161107557965775, 'tsl_mult': 0.6687724058916217, 'strategy': 'breakout', 'time_stop': 135, 'use_sma': False, 'use_atr': False, 'use_adx': False, 'use_ema': False, 'use_spike': False, 'rsi_required': False, 'edge_k': 0.4238313669879279, 'edge_cap': 0.8195927913178114}.
[I 2025-08-29 23:16:53,899] Trial 899 finished with values: [-1000000000.0, 1000000000.0] and parameters: {'p_sma': 6, 'p_std': 54, 'p_atr': 11, 'p_adx': 14, 'rsi_period': 23, 'ema1': 23, 'ema2': 34, 'slip_atr_k': 0.024880600386385426, 'slip_spread_k': 0.7428143226218925, 'spread_hl_frac': 0.01285824287760777, 'bb_std_mult': 3.033402470007158, 'rsi_os': 24, 'rsi_ob': 62, 'vol_spike': 0.26378732344960376, 'adx_thresh': 24.587507833944628, 'atr_min_pct': 0.024785683713142482, 'atr_max_pct': 0.14488990169451232, 'tp_mult': 1.5484968049940138, 'tsl_mult': 0.7783253582315308, 'strategy': 'breakout', 'time_stop': 107, 'use_sma': False, 'use_atr': False, 'use_adx': False, 'use_ema': False, 'use_spike': False, 'rsi_required': False, 'edge_k': 1.1843896601904667, 'edge_cap': 0.5151647283285598}.
[I 2025-08-29 23:17:21,231] Trial 902 finished with values: [-1000000000.0, 1000000000.0] and parameters: {'p_sma': 7, 'p_std': 35, 'p_atr': 22, 'p_adx': 14, 'rsi_period': 19, 'ema1': 23, 'ema2': 22, 'slip_atr_k': 0.04986368895506711, 'slip_spread_k': 0.27506514918352987, 'spread_hl_frac': 0.006029372805342836, 'bb_std_mult': 2.0132818951830576, 'rsi_os': 13, 'rsi_ob': 61, 'vol_spike': 0.2636871693363103, 'adx_thresh': 23.59933128498965, 'atr_min_pct': 0.0015271935116929086, 'atr_max_pct': 0.09332781791618772, 'tp_mult': 2.232205975390826, 'tsl_mult': 0.7817847655785999, 'strategy': 'breakout', 'time_stop': 110, 'use_sma': False, 'use_atr': False, 'use_adx': False, 'use_ema': False, 'use_spike': False, 'rsi_required': False, 'edge_k': 0.6097042542933606, 'edge_cap': 0.6333612473533182}.
[I 2025-08-29 23:17:21,339] Trial 900 finished with values: [-1000000000.0, 1000000000.0] and parameters: {'p_sma': 49, 'p_std': 23, 'p_atr': 23, 'p_adx': 14, 'rsi_period': 46, 'ema1': 23, 'ema2': 53, 'slip_atr_k': 0.19811462789659892, 'slip_spread_k': 0.7413410825812019, 'spread_hl_frac': 0.020659051979685834, 'bb_std_mult': 2.03415933749235, 'rsi_os': 40, 'rsi_ob': 81, 'vol_spike': 0.10430881212226753, 'adx_thresh': 25.45465045599333, 'atr_min_pct': 0.013277542872548948, 'atr_max_pct': 0.09439424954373259, 'tp_mult': 2.8592947025739814, 'tsl_mult': 0.7848832732775198, 'strategy': 'breakout', 'time_stop': 64, 'use_sma': False, 'use_atr': False, 'use_adx': False, 'use_ema': False, 'use_spike': False, 'rsi_required': False, 'edge_k': 1.1790690101441221, 'edge_cap': 0.7538962476067618}.
[I 2025-08-29 23:17:21,447] Trial 901 finished with values: [-1000000000.0, 1000000000.0] and parameters: {'p_sma': 8, 'p_std': 35, 'p_atr': 23, 'p_adx': 17, 'rsi_period': 14, 'ema1': 23, 'ema2': 53, 'slip_atr_k': 0.023637273377567998, 'slip_spread_k': 0.46107731605169916, 'spread_hl_frac': 0.036161280060678654, 'bb_std_mult': 1.998026933149717, 'rsi_os': 50, 'rsi_ob': 61, 'vol_spike': 0.10480474586662128, 'adx_thresh': 14.22931445126175, 'atr_min_pct': 0.007690694247155123, 'atr_max_pct': 0.14001513827331513, 'tp_mult': 2.910392214903422, 'tsl_mult': 0.7592571092523647, 'strategy': 'breakout', 'time_stop': 108, 'use_sma': False, 'use_atr': False, 'use_adx': False, 'use_ema': False, 'use_spike': False, 'rsi_required': False, 'edge_k': 0.5386440918195468, 'edge_cap': 0.5238520720899176}.
[I 2025-08-29 23:17:21,542] Trial 903 finished with values: [-1000000000.0, 1000000000.0] and parameters: {'p_sma': 8, 'p_std': 50, 'p_atr': 23, 'p_adx': 17, 'rsi_period': 18, 'ema1': 17, 'ema2': 53, 'slip_atr_k': 0.23878327864243054, 'slip_spread_k': 0.572048775369475, 'spread_hl_frac': 0.005929578926505925, 'bb_std_mult': 1.9969567896038694, 'rsi_os': 29, 'rsi_ob': 54, 'vol_spike': 0.2447967300895288, 'adx_thresh': 21.238345845843032, 'atr_min_pct': 0.007755776855193636, 'atr_max_pct': 0.09331672965185962, 'tp_mult': 2.1091432662680054, 'tsl_mult': 0.030050255109297652, 'strategy': 'breakout', 'time_stop': 120, 'use_sma': False, 'use_atr': False, 'use_adx': False, 'use_ema': False, 'use_spike': False, 'rsi_required': False, 'edge_k': 1.6033337654900925, 'edge_cap': 0.755324651164554}.
[I 2025-08-29 23:17:21,849] Trial 906 finished with values: [-1000000000.0, 1000000000.0] and parameters: {'p_sma': 7, 'p_std': 47, 'p_atr': 22, 'p_adx': 15, 'rsi_period': 21, 'ema1': 17, 'ema2': 56, 'slip_atr_k': 0.23663181137353462, 'slip_spread_k': 0.8255746995571519, 'spread_hl_frac': 0.017783684900555242, 'bb_std_mult': 1.6771842891977602, 'rsi_os': 55, 'rsi_ob': 59, 'vol_spike': 0.17280373716241582, 'adx_thresh': 34.55673290470251, 'atr_min_pct': 0.002317077975362738, 'atr_max_pct': 0.018945705459871967, 'tp_mult': 1.190199334608211, 'tsl_mult': 0.5604831086274459, 'strategy': 'mean_reversion', 'time_stop': 300, 'use_sma': False, 'use_atr': False, 'use_adx': False, 'use_ema': False, 'use_spike': False, 'rsi_required': False, 'edge_k': 0.3355671697218998, 'edge_cap': 0.7852501551853279}.
[I 2025-08-29 23:17:21,862] Trial 907 finished with values: [-1000000000.0, 1000000000.0] and parameters: {'p_sma': 7, 'p_std': 24, 'p_atr': 14, 'p_adx': 12, 'rsi_period': 19, 'ema1': 25, 'ema2': 56, 'slip_atr_k': 0.014343021105482447, 'slip_spread_k': 0.8248890542483109, 'spread_hl_frac': 0.033561670169324105, 'bb_std_mult': 1.8643461804081993, 'rsi_os': 55, 'rsi_ob': 60, 'vol_spike': 0.02928723121206868, 'adx_thresh': 33.347911746732514, 'atr_min_pct': 0.0022015792830149495, 'atr_max_pct': 0.1337268582583736, 'tp_mult': 1.1910800108391626, 'tsl_mult': 0.7351852335950301, 'strategy': 'mean_reversion', 'time_stop': 265, 'use_sma': False, 'use_atr': False, 'use_adx': False, 'use_ema': False, 'use_spike': False, 'rsi_required': False, 'edge_k': 0.3287208079491265, 'edge_cap': 0.7904186611848334}.
[I 2025-08-29 23:17:46,993] Trial 905 finished with values: [-0.029536803318132132, 0.029508439080017712] and parameters: {'p_sma': 26, 'p_std': 21, 'p_atr': 23, 'p_adx': 17, 'rsi_period': 18, 'ema1': 25, 'ema2': 56, 'slip_atr_k': 0.23762471103534438, 'slip_spread_k': 0.5740322621218152, 'spread_hl_frac': 0.01730929690719956, 'bb_std_mult': 2.1160275073768213, 'rsi_os': 29, 'rsi_ob': 60, 'vol_spike': 0.17389548912497285, 'adx_thresh': 34.96323639365851, 'atr_min_pct': 0.001898719728851454, 'atr_max_pct': 0.03082838876226566, 'tp_mult': 1.1870964633523098, 'tsl_mult': 0.026254096344580757, 'strategy': 'breakout', 'time_stop': 123, 'use_sma': False, 'use_atr': False, 'use_adx': False, 'use_ema': False, 'use_spike': False, 'rsi_required': False, 'edge_k': 0.33698835849344155, 'edge_cap': 0.4712578599621112}.
[I 2025-08-29 23:17:47,453] Trial 904 finished with values: [-0.06008094199044989, 0.06004870381402947] and parameters: {'p_sma': 53, 'p_std': 23, 'p_atr': 23, 'p_adx': 12, 'rsi_period': 14, 'ema1': 25, 'ema2': 24, 'slip_atr_k': 0.15841051113864343, 'slip_spread_k': 0.8214994101055666, 'spread_hl_frac': 0.036090923584021335, 'bb_std_mult': 1.1506257941859017, 'rsi_os': 38, 'rsi_ob': 81, 'vol_spike': 0.17272703902648123, 'adx_thresh': 14.231092228276097, 'atr_min_pct': 0.0020749954627718487, 'atr_max_pct': 0.03063249562958132, 'tp_mult': 2.1001233502499255, 'tsl_mult': 0.7563867535328368, 'strategy': 'breakout', 'time_stop': 64, 'use_sma': False, 'use_atr': False, 'use_adx': False, 'use_ema': False, 'use_spike': False, 'rsi_required': False, 'edge_k': 1.6138173495960735, 'edge_cap': 0.7515962616100424}.
[I 2025-08-29 23:17:49,093] Trial 909 finished with values: [-1000000000.0, 1000000000.0] and parameters: {'p_sma': 6, 'p_std': 7, 'p_atr': 23, 'p_adx': 16, 'rsi_period': 22, 'ema1': 25, 'ema2': 24, 'slip_atr_k': 0.11829426066637747, 'slip_spread_k': 0.2979528871175005, 'spread_hl_frac': 0.01698361179722027, 'bb_std_mult': 1.1958451254817715, 'rsi_os': 27, 'rsi_ob': 71, 'vol_spike': 0.06429703440779803, 'adx_thresh': 25.75721672946333, 'atr_min_pct': 0.005265919380108463, 'atr_max_pct': 0.09867742843774908, 'tp_mult': 2.498888102773968, 'tsl_mult': 0.8246129272356073, 'strategy': 'breakout', 'time_stop': 115, 'use_sma': False, 'use_atr': False, 'use_adx': False, 'use_ema': False, 'use_spike': False, 'rsi_required': False, 'edge_k': 0.5234953635587867, 'edge_cap': 0.8339432656058391}.
[I 2025-08-29 23:17:49,206] Trial 908 finished with values: [-1000000000.0, 1000000000.0] and parameters: {'p_sma': 53, 'p_std': 21, 'p_atr': 14, 'p_adx': 16, 'rsi_period': 80, 'ema1': 25, 'ema2': 24, 'slip_atr_k': 0.014801470034923703, 'slip_spread_k': 0.29732080439046926, 'spread_hl_frac': 0.04008037846482589, 'bb_std_mult': 1.162739985927209, 'rsi_os': 42, 'rsi_ob': 60, 'vol_spike': 0.03084960401538872, 'adx_thresh': 7.663233883525617, 'atr_min_pct': 0.019325466104778942, 'atr_max_pct': 0.030559173684298897, 'tp_mult': 1.971827436762723, 'tsl_mult': 0.999796480207588, 'strategy': 'breakout', 'time_stop': 276, 'use_sma': False, 'use_atr': False, 'use_adx': False, 'use_ema': False, 'use_spike': False, 'rsi_required': False, 'edge_k': 0.07032173918821338, 'edge_cap': 0.10960680030921333}.
[I 2025-08-29 23:17:49,502] Trial 913 finished with values: [-1000000000.0, 1000000000.0] and parameters: {'p_sma': 9, 'p_std': 25, 'p_atr': 8, 'p_adx': 24, 'rsi_period': 10, 'ema1': 24, 'ema2': 55, 'slip_atr_k': 0.16630435206959868, 'slip_spread_k': 0.8515376153596629, 'spread_hl_frac': 0.016298789981869878, 'bb_std_mult': 0.9276355454202347, 'rsi_os': 26, 'rsi_ob': 46, 'vol_spike': 0.13885205599526235, 'adx_thresh': 27.044301733625453, 'atr_min_pct': 0.001074561390627818, 'atr_max_pct': 0.05945396512182585, 'tp_mult': 2.035598053334673, 'tsl_mult': 0.6978339986646732, 'strategy': 'mean_reversion', 'time_stop': 231, 'use_sma': False, 'use_atr': False, 'use_adx': False, 'use_ema': False, 'use_spike': False, 'rsi_required': False, 'edge_k': 0.45718153319287036, 'edge_cap': 0.7682070112741068}.
[I 2025-08-29 23:18:15,909] Trial 914 finished with values: [-1000000000.0, 1000000000.0] and parameters: {'p_sma': 29, 'p_std': 37, 'p_atr': 26, 'p_adx': 15, 'rsi_period': 19, 'ema1': 12, 'ema2': 51, 'slip_atr_k': 0.13294578092500697, 'slip_spread_k': 0.12587375916900395, 'spread_hl_frac': 0.010957338049761574, 'bb_std_mult': 2.074158873679985, 'rsi_os': 48, 'rsi_ob': 58, 'vol_spike': 0.18006533730802102, 'adx_thresh': 27.588773272965813, 'atr_min_pct': 0.014239148859123498, 'atr_max_pct': 0.08465768276464636, 'tp_mult': 2.2860061226706154, 'tsl_mult': 0.5108716558148483, 'strategy': 'breakout', 'time_stop': 107, 'use_sma': False, 'use_atr': False, 'use_adx': False, 'use_ema': False, 'use_spike': False, 'rsi_required': False, 'edge_k': 0.13924779198348647, 'edge_cap': 0.8055833690442361}.
[I 2025-08-29 23:18:16,450] Trial 911 finished with values: [-0.017766062696801255, 0.017740317176345218] and parameters: {'p_sma': 15, 'p_std': 57, 'p_atr': 26, 'p_adx': 24, 'rsi_period': 22, 'ema1': 24, 'ema2': 54, 'slip_atr_k': 0.17713978456023258, 'slip_spread_k': 0.8561041782385881, 'spread_hl_frac': 0.015998756270779877, 'bb_std_mult': 1.3930321540735444, 'rsi_os': 27, 'rsi_ob': 47, 'vol_spike': 0.017752746956822746, 'adx_thresh': 8.045659220388693, 'atr_min_pct': 0.0012562805970667034, 'atr_max_pct': 0.09765611346675636, 'tp_mult': 2.494194611508313, 'tsl_mult': 0.7013498030474986, 'strategy': 'breakout', 'time_stop': 231, 'use_sma': False, 'use_atr': False, 'use_adx': False, 'use_ema': False, 'use_spike': False, 'rsi_required': False, 'edge_k': 0.1700686038346706, 'edge_cap': 0.40503325824127334}.
[I 2025-08-29 23:18:16,456] Trial 910 finished with values: [-0.055610320417720294, 0.05559907755874136] and parameters: {'p_sma': 9, 'p_std': 23, 'p_atr': 22, 'p_adx': 16, 'rsi_period': 10, 'ema1': 24, 'ema2': 24, 'slip_atr_k': 0.1769938516231528, 'slip_spread_k': 0.8525928100304669, 'spread_hl_frac': 0.01649902324358426, 'bb_std_mult': 1.2062597159727868, 'rsi_os': 42, 'rsi_ob': 47, 'vol_spike': 0.144115734474062, 'adx_thresh': 27.215895113034833, 'atr_min_pct': 0.0012200301907604539, 'atr_max_pct': 0.07145486734079728, 'tp_mult': 2.3243132240711977, 'tsl_mult': 0.708508972172781, 'strategy': 'breakout', 'time_stop': 280, 'use_sma': False, 'use_atr': False, 'use_adx': False, 'use_ema': False, 'use_spike': False, 'rsi_required': False, 'edge_k': 1.6485313231441192, 'edge_cap': 0.8314103984775356}.
[I 2025-08-29 23:18:16,601] Trial 912 finished with values: [-1000000000.0, 1000000000.0] and parameters: {'p_sma': 59, 'p_std': 24, 'p_atr': 22, 'p_adx': 23, 'rsi_period': 19, 'ema1': 16, 'ema2': 27, 'slip_atr_k': 0.017948884780416934, 'slip_spread_k': 0.8534264269291838, 'spread_hl_frac': 0.016084906105379618, 'bb_std_mult': 2.0572668094809456, 'rsi_os': 26, 'rsi_ob': 47, 'vol_spike': 0.139471510031677, 'adx_thresh': 7.472007057472437, 'atr_min_pct': 0.018722915187572884, 'atr_max_pct': 0.08560980748597079, 'tp_mult': 2.793523778420057, 'tsl_mult': 0.7087191844477505, 'strategy': 'breakout', 'time_stop': 82, 'use_sma': False, 'use_atr': False, 'use_adx': False, 'use_ema': False, 'use_spike': False, 'rsi_required': False, 'edge_k': 0.4882863689933535, 'edge_cap': 0.8037517595266158}.
[I 2025-08-29 23:18:43,543] Trial 915 finished with values: [-1000000000.0, 1000000000.0] and parameters: {'p_sma': 10, 'p_std': 24, 'p_atr': 22, 'p_adx': 16, 'rsi_period': 27, 'ema1': 8, 'ema2': 58, 'slip_atr_k': 0.18980989098556794, 'slip_spread_k': 0.780156859858497, 'spread_hl_frac': 0.031577609390891756, 'bb_std_mult': 1.9374905774102507, 'rsi_os': 25, 'rsi_ob': 62, 'vol_spike': 0.04480454129361916, 'adx_thresh': 29.53882838832849, 'atr_min_pct': 0.0033720477734304143, 'atr_max_pct': 0.05477492410176695, 'tp_mult': 2.804468877170487, 'tsl_mult': 0.7097924004360416, 'strategy': 'breakout', 'time_stop': 159, 'use_sma': False, 'use_atr': False, 'use_adx': False, 'use_ema': False, 'use_spike': False, 'rsi_required': False, 'edge_k': 0.566661406195058, 'edge_cap': 0.8608113067435078}.
[I 2025-08-29 23:18:43,685] Trial 917 finished with values: [-1000000000.0, 1000000000.0] and parameters: {'p_sma': 24, 'p_std': 27, 'p_atr': 24, 'p_adx': 29, 'rsi_period': 49, 'ema1': 24, 'ema2': 58, 'slip_atr_k': 0.20953224513028118, 'slip_spread_k': 0.7794822254023948, 'spread_hl_frac': 0.03125140265307123, 'bb_std_mult': 2.47042752095584, 'rsi_os': 25, 'rsi_ob': 51, 'vol_spike': 0.16443087566203984, 'adx_thresh': 25.388563604191503, 'atr_min_pct': 0.003285052658082028, 'atr_max_pct': 0.09144144528642144, 'tp_mult': 1.0822736923232013, 'tsl_mult': 0.7342709299889851, 'strategy': 'mean_reversion', 'time_stop': 53, 'use_sma': False, 'use_atr': False, 'use_adx': False, 'use_ema': False, 'use_spike': False, 'rsi_required': False, 'edge_k': 0.5761344324910407, 'edge_cap': 0.9992121022337939}.
[I 2025-08-29 23:18:43,800] Trial 918 finished with values: [-0.010290455639896945, 0.010317678675234504] and parameters: {'p_sma': 24, 'p_std': 27, 'p_atr': 10, 'p_adx': 18, 'rsi_period': 16, 'ema1': 13, 'ema2': 32, 'slip_atr_k': 0.019960320127851365, 'slip_spread_k': 0.6530372552409804, 'spread_hl_frac': 0.020241056122251123, 'bb_std_mult': 1.9621925282599537, 'rsi_os': 10, 'rsi_ob': 65, 'vol_spike': 0.1791691968077308, 'adx_thresh': 29.36338722073782, 'atr_min_pct': 0.003010855132619885, 'atr_max_pct': 0.09162213822392204, 'tp_mult': 2.998883726656576, 'tsl_mult': 0.7357446125119643, 'strategy': 'mean_reversion', 'time_stop': 52, 'use_sma': False, 'use_atr': False, 'use_adx': False, 'use_ema': False, 'use_spike': False, 'rsi_required': False, 'edge_k': 0.6764720147536372, 'edge_cap': 0.8618891039078611}.
