[I 2025-08-29 22:55:30,548] Trial 703 finished with values: [-1000000000.0, 1000000000.0] and parameters: {'p_sma': 8, 'p_std': 9, 'p_atr': 18, 'p_adx': 20, 'rsi_period': 53, 'ema1': 24, 'ema2': 56, 'slip_atr_k': 0.1877173649397875, 'slip_spread_k': 0.8057495577730797, 'spread_hl_frac': 0.014849747978915216, 'bb_std_mult': 2.8188114092317043, 'rsi_os': 7, 'rsi_ob': 66, 'vol_spike': 0.1915985644701833, 'adx_thresh': 25.940143328552907, 'atr_min_pct': 0.003260850921828916, 'atr_max_pct': 0.101423757205848, 'tp_mult': 1.1403894731327122, 'tsl_mult': 0.33127393535895455, 'strategy': 'mean_reversion', 'time_stop': 278, 'use_sma': False, 'use_atr': False, 'use_adx': False, 'use_ema': False, 'use_spike': False, 'rsi_required': False, 'edge_k': 0.5334968366305883, 'edge_cap': 0.7424497213556799}.
[I 2025-08-29 22:55:30,766] Trial 702 finished with values: [-1000000000.0, 1000000000.0] and parameters: {'p_sma': 11, 'p_std': 46, 'p_atr': 18, 'p_adx': 17, 'rsi_period': 21, 'ema1': 24, 'ema2': 57, 'slip_atr_k': 0.031788671350679865, 'slip_spread_k': 0.0781691826793997, 'spread_hl_frac': 0.0009053188550589807, 'bb_std_mult': 2.1757789311893863, 'rsi_os': 29, 'rsi_ob': 54, 'vol_spike': 0.264077865995627, 'adx_thresh': 29.028312691792365, 'atr_min_pct': 0.027701824323397364, 'atr_max_pct': 0.07063061693538142, 'tp_mult': 1.0988205854559463, 'tsl_mult': 0.46922092623124334, 'strategy': 'mean_reversion', 'time_stop': 112, 'use_sma': False, 'use_atr': False, 'use_adx': False, 'use_ema': False, 'use_spike': False, 'rsi_required': False, 'edge_k': 0.3671397050722437, 'edge_cap': 0.8222594977070918}.
[I 2025-08-29 22:55:30,879] Trial 704 finished with values: [-1000000000.0, 1000000000.0] and parameters: {'p_sma': 32, 'p_std': 23, 'p_atr': 18, 'p_adx': 15, 'rsi_period': 22, 'ema1': 23, 'ema2': 57, 'slip_atr_k': 0.03068017070724258, 'slip_spread_k': 0.2981241559782887, 'spread_hl_frac': 0.014968237207869009, 'bb_std_mult': 2.2101119769670996, 'rsi_os': 26, 'rsi_ob': 57, 'vol_spike': 0.16022986967337072, 'adx_thresh': 25.89468581232711, 'atr_min_pct': 0.01903936485649227, 'atr_max_pct': 0.09970613630291669, 'tp_mult': 1.839286159954706, 'tsl_mult': 0.7374072046934578, 'strategy': 'mean_reversion', 'time_stop': 115, 'use_sma': False, 'use_atr': False, 'use_adx': False, 'use_ema': False, 'use_spike': False, 'rsi_required': False, 'edge_k': 0.5334385873553567, 'edge_cap': 0.07407519603679674}.
[I 2025-08-29 22:55:57,839] Trial 705 finished with values: [-0.014025254754810312, 0.013975034585701554] and parameters: {'p_sma': 40, 'p_std': 28, 'p_atr': 25, 'p_adx': 15, 'rsi_period': 13, 'ema1': 23, 'ema2': 10, 'slip_atr_k': 0.030782967419003444, 'slip_spread_k': 0.07980648593300121, 'spread_hl_frac': 0.01584352878698474, 'bb_std_mult': 2.794012781751269, 'rsi_os': 26, 'rsi_ob': 61, 'vol_spike': 0.19497297129943034, 'adx_thresh': 11.8053342216124, 'atr_min_pct': 0.003410978222879674, 'atr_max_pct': 0.10044459548486241, 'tp_mult': 1.0970027640910842, 'tsl_mult': 0.021703050174619376, 'strategy': 'mean_reversion', 'time_stop': 116, 'use_sma': False, 'use_atr': False, 'use_adx': False, 'use_ema': False, 'use_spike': False, 'rsi_required': False, 'edge_k': 0.5156433812474926, 'edge_cap': 0.9850513808319895}.
[I 2025-08-29 22:55:57,987] Trial 706 finished with values: [-1000000000.0, 1000000000.0] and parameters: {'p_sma': 30, 'p_std': 22, 'p_atr': 22, 'p_adx': 22, 'rsi_period': 55, 'ema1': 23, 'ema2': 41, 'slip_atr_k': 0.031185623824102122, 'slip_spread_k': 0.7869835673942588, 'spread_hl_frac': 0.016071436230543745, 'bb_std_mult': 3.0456205086453236, 'rsi_os': 29, 'rsi_ob': 94, 'vol_spike': 0.2220448104711597, 'adx_thresh': 34.425232844023625, 'atr_min_pct': 0.0222703411774311, 'atr_max_pct': 0.06637161657743904, 'tp_mult': 1.1012240034194178, 'tsl_mult': 0.7415429395298676, 'strategy': 'mean_reversion', 'time_stop': 262, 'use_sma': False, 'use_atr': False, 'use_adx': False, 'use_ema': False, 'use_spike': False, 'rsi_required': False, 'edge_k': 0.5029064208803744, 'edge_cap': 0.0696064457805175}.
[I 2025-08-29 22:55:58,154] Trial 707 finished with values: [-1000000000.0, 1000000000.0] and parameters: {'p_sma': 34, 'p_std': 28, 'p_atr': 22, 'p_adx': 15, 'rsi_period': 13, 'ema1': 23, 'ema2': 50, 'slip_atr_k': 0.14530238946384028, 'slip_spread_k': 0.04497612433550341, 'spread_hl_frac': 0.04903482478104486, 'bb_std_mult': 3.046168398569093, 'rsi_os': 26, 'rsi_ob': 60, 'vol_spike': 0.049040677761126486, 'adx_thresh': 26.451400156039202, 'atr_min_pct': 0.019183782387013536, 'atr_max_pct': 0.0979909535177488, 'tp_mult': 1.0468016300657377, 'tsl_mult': 0.7399948111674918, 'strategy': 'breakout', 'time_stop': 119, 'use_sma': False, 'use_atr': False, 'use_adx': False, 'use_ema': False, 'use_spike': False, 'rsi_required': False, 'edge_k': 0.4974447629834785, 'edge_cap': 0.6256396346619861}.
[I 2025-08-29 22:55:58,261] Trial 708 finished with values: [-0.005100178261752131, 0.005075894729011207] and parameters: {'p_sma': 29, 'p_std': 50, 'p_atr': 14, 'p_adx': 22, 'rsi_period': 55, 'ema1': 23, 'ema2': 41, 'slip_atr_k': 0.020160262191290492, 'slip_spread_k': 0.12536443811877584, 'spread_hl_frac': 0.016058669294144217, 'bb_std_mult': 2.1177225109129223, 'rsi_os': 13, 'rsi_ob': 61, 'vol_spike': 0.19790866210432714, 'adx_thresh': 19.849591907686488, 'atr_min_pct': 3.5683116998536622e-06, 'atr_max_pct': 0.09044056638740978, 'tp_mult': 1.1352122164824183, 'tsl_mult': 0.24872107430949691, 'strategy': 'breakout', 'time_stop': 118, 'use_sma': False, 'use_atr': False, 'use_adx': False, 'use_ema': False, 'use_spike': False, 'rsi_required': False, 'edge_k': 1.8790619090730911, 'edge_cap': 0.8267050821629226}.
[I 2025-08-29 22:56:24,760] Trial 709 finished with values: [-0.030148307781503347, 0.030124977748450292] and parameters: {'p_sma': 30, 'p_std': 26, 'p_atr': 22, 'p_adx': 11, 'rsi_period': 19, 'ema1': 27, 'ema2': 54, 'slip_atr_k': 0.007527190802363179, 'slip_spread_k': 0.046844715078267096, 'spread_hl_frac': 0.009862788543734383, 'bb_std_mult': 1.086921811413692, 'rsi_os': 27, 'rsi_ob': 58, 'vol_spike': 0.043361325679039706, 'adx_thresh': 32.1675422142455, 'atr_min_pct': 0.0009622047347972698, 'atr_max_pct': 0.08998500230122815, 'tp_mult': 1.054455019382502, 'tsl_mult': 0.2249502387565448, 'strategy': 'breakout', 'time_stop': 266, 'use_sma': False, 'use_atr': False, 'use_adx': False, 'use_ema': False, 'use_spike': False, 'rsi_required': False, 'edge_k': 0.4769234944495553, 'edge_cap': 0.7622286534998599}.
[I 2025-08-29 22:56:25,820] Trial 711 finished with values: [-1000000000.0, 1000000000.0] and parameters: {'p_sma': 55, 'p_std': 53, 'p_atr': 23, 'p_adx': 17, 'rsi_period': 19, 'ema1': 17, 'ema2': 33, 'slip_atr_k': 0.006842930494517185, 'slip_spread_k': 0.732813365867893, 'spread_hl_frac': 0.0204489065701516, 'bb_std_mult': 2.0688948653311505, 'rsi_os': 16, 'rsi_ob': 48, 'vol_spike': 0.18748465821934873, 'adx_thresh': 30.3275022149922, 'atr_min_pct': 0.013664280432217098, 'atr_max_pct': 0.059347314253889734, 'tp_mult': 2.1800654085034172, 'tsl_mult': 0.7080849442886032, 'strategy': 'breakout', 'time_stop': 98, 'use_sma': False, 'use_atr': False, 'use_adx': False, 'use_ema': False, 'use_spike': False, 'rsi_required': False, 'edge_k': 0.4563037032857698, 'edge_cap': 0.763303890872927}.
[I 2025-08-29 22:56:25,825] Trial 710 finished with values: [-0.05498029782363634, 0.05496615544691517] and parameters: {'p_sma': 55, 'p_std': 50, 'p_atr': 20, 'p_adx': 28, 'rsi_period': 37, 'ema1': 26, 'ema2': 13, 'slip_atr_k': 0.15667725905887436, 'slip_spread_k': 0.045262233704199795, 'spread_hl_frac': 0.009985939274331194, 'bb_std_mult': 2.0702893421308826, 'rsi_os': 48, 'rsi_ob': 73, 'vol_spike': 0.044782117641771965, 'adx_thresh': 32.28710107878098, 'atr_min_pct': 0.0009839181824224338, 'atr_max_pct': 0.08710355383597555, 'tp_mult': 2.799659769612007, 'tsl_mult': 0.8048692483890554, 'strategy': 'breakout', 'time_stop': 172, 'use_sma': False, 'use_atr': False, 'use_adx': False, 'use_ema': False, 'use_spike': False, 'rsi_required': False, 'edge_k': 1.3942671556299215, 'edge_cap': 0.7582885742013004}.
[I 2025-08-29 22:56:25,896] Trial 712 finished with values: [-1000000000.0, 1000000000.0] and parameters: {'p_sma': 55, 'p_std': 35, 'p_atr': 29, 'p_adx': 11, 'rsi_period': 16, 'ema1': 17, 'ema2': 54, 'slip_atr_k': 0.007235651023793114, 'slip_spread_k': 0.9578187550601298, 'spread_hl_frac': 0.02054481933074647, 'bb_std_mult': 2.0379153107021564, 'rsi_os': 48, 'rsi_ob': 64, 'vol_spike': 0.1882221801721918, 'adx_thresh': 24.20173638214287, 'atr_min_pct': 0.007030517458282639, 'atr_max_pct': 0.09471317636169893, 'tp_mult': 2.406868691787345, 'tsl_mult': 0.7999706587668511, 'strategy': 'breakout', 'time_stop': 209, 'use_sma': False, 'use_atr': False, 'use_adx': False, 'use_ema': False, 'use_spike': False, 'rsi_required': False, 'edge_k': 0.4558797153703308, 'edge_cap': 0.9547762400609328}.
[I 2025-08-29 22:56:52,663] Trial 715 finished with values: [-1000000000.0, 1000000000.0] and parameters: {'p_sma': 37, 'p_std': 20, 'p_atr': 26, 'p_adx': 16, 'rsi_period': 42, 'ema1': 9, 'ema2': 30, 'slip_atr_k': 0.02538899614211881, 'slip_spread_k': 0.2301288780739128, 'spread_hl_frac': 0.01733452346547958, 'bb_std_mult': 2.0073940475054095, 'rsi_os': 28, 'rsi_ob': 75, 'vol_spike': 0.1748729178664827, 'adx_thresh': 17.38735868027978, 'atr_min_pct': 0.011767156569540721, 'atr_max_pct': 0.09540113617009373, 'tp_mult': 1.1776299044766712, 'tsl_mult': 0.4166482924622888, 'strategy': 'breakout', 'time_stop': 106, 'use_sma': False, 'use_atr': False, 'use_adx': False, 'use_ema': False, 'use_spike': False, 'rsi_required': False, 'edge_k': 1.7273723597849369, 'edge_cap': 0.3193735167897029}.
[I 2025-08-29 22:56:53,208] Trial 716 finished with values: [-0.00397732261655892, 0.003933385855452038] and parameters: {'p_sma': 37, 'p_std': 25, 'p_atr': 24, 'p_adx': 16, 'rsi_period': 28, 'ema1': 21, 'ema2': 16, 'slip_atr_k': 0.024828935343637525, 'slip_spread_k': 0.22598742393710664, 'spread_hl_frac': 0.017320590986833098, 'bb_std_mult': 2.0051704589673895, 'rsi_os': 31, 'rsi_ob': 63, 'vol_spike': 0.17468768941868848, 'adx_thresh': 17.424152817248704, 'atr_min_pct': 0.0048604766469505355, 'atr_max_pct': 0.09558772802470726, 'tp_mult': 1.178610189987655, 'tsl_mult': 0.6953656306457516, 'strategy': 'breakout', 'time_stop': 107, 'use_sma': False, 'use_atr': False, 'use_adx': False, 'use_ema': False, 'use_spike': False, 'rsi_required': False, 'edge_k': 0.14206163684177187, 'edge_cap': 0.5158178885636061}.
[I 2025-08-29 22:56:53,228] Trial 714 finished with values: [-1000000000.0, 1000000000.0] and parameters: {'p_sma': 6, 'p_std': 25, 'p_atr': 16, 'p_adx': 16, 'rsi_period': 16, 'ema1': 6, 'ema2': 55, 'slip_atr_k': 0.09494883891052541, 'slip_spread_k': 0.8173170395243072, 'spread_hl_frac': 0.017302962135230825, 'bb_std_mult': 2.0215090881132607, 'rsi_os': 28, 'rsi_ob': 53, 'vol_spike': 0.1288103499948707, 'adx_thresh': 24.951070813013004, 'atr_min_pct': 0.005956968186587379, 'atr_max_pct': 0.09395911512046419, 'tp_mult': 1.1922596585239238, 'tsl_mult': 0.6651875424211682, 'strategy': 'breakout', 'time_stop': 9, 'use_sma': False, 'use_atr': False, 'use_adx': False, 'use_ema': False, 'use_spike': False, 'rsi_required': False, 'edge_k': 0.6093022999227915, 'edge_cap': 0.7891535884641208}.
[I 2025-08-29 22:56:53,438] Trial 713 finished with values: [-1000000000.0, 1000000000.0] and parameters: {'p_sma': 6, 'p_std': 25, 'p_atr': 23, 'p_adx': 18, 'rsi_period': 25, 'ema1': 17, 'ema2': 54, 'slip_atr_k': 0.1755120346786147, 'slip_spread_k': 0.7261746190465583, 'spread_hl_frac': 0.017468031001361524, 'bb_std_mult': 2.032109963940924, 'rsi_os': 16, 'rsi_ob': 64, 'vol_spike': 0.18576098647110503, 'adx_thresh': 30.075854492702618, 'atr_min_pct': 0.015699560826743078, 'atr_max_pct': 0.05966585803702633, 'tp_mult': 1.1765451115878012, 'tsl_mult': 0.7032787945781592, 'strategy': 'breakout', 'time_stop': 96, 'use_sma': False, 'use_atr': False, 'use_adx': False, 'use_ema': False, 'use_spike': False, 'rsi_required': False, 'edge_k': 0.9273939025705378, 'edge_cap': 0.5119503350526724}.
[I 2025-08-29 22:57:20,189] Trial 717 finished with values: [-1000000000.0, 1000000000.0] and parameters: {'p_sma': 15, 'p_std': 32, 'p_atr': 24, 'p_adx': 16, 'rsi_period': 23, 'ema1': 24, 'ema2': 16, 'slip_atr_k': 0.016414869424967737, 'slip_spread_k': 0.8169330871829105, 'spread_hl_frac': 0.04296632387917171, 'bb_std_mult': 2.151269168542929, 'rsi_os': 24, 'rsi_ob': 53, 'vol_spike': 0.1756097687514478, 'adx_thresh': 24.941192147417905, 'atr_min_pct': 0.00949565771121109, 'atr_max_pct': 0.09302984517877083, 'tp_mult': 1.1405390374446152, 'tsl_mult': 0.6921489252417424, 'strategy': 'breakout', 'time_stop': 40, 'use_sma': False, 'use_atr': False, 'use_adx': False, 'use_ema': False, 'use_spike': False, 'rsi_required': False, 'edge_k': 1.338566087075055, 'edge_cap': 0.7879281077730167}.
[I 2025-08-29 22:57:20,462] Trial 720 finished with values: [-1000000000.0, 1000000000.0] and parameters: {'p_sma': 48, 'p_std': 27, 'p_atr': 12, 'p_adx': 17, 'rsi_period': 82, 'ema1': 24, 'ema2': 39, 'slip_atr_k': 0.017657059324914005, 'slip_spread_k': 0.8137956102942575, 'spread_hl_frac': 0.019554551905181777, 'bb_std_mult': 3.4254467210722668, 'rsi_os': 23, 'rsi_ob': 60, 'vol_spike': 0.026642536403765543, 'adx_thresh': 21.456001370639807, 'atr_min_pct': 0.009168789958015802, 'atr_max_pct': 0.1044134810443971, 'tp_mult': 1.1283469258433294, 'tsl_mult': 0.5101914307491143, 'strategy': 'breakout', 'time_stop': 23, 'use_sma': False, 'use_atr': False, 'use_adx': False, 'use_ema': False, 'use_spike': False, 'rsi_required': False, 'edge_k': 0.30582739451258206, 'edge_cap': 0.8146996267375015}.
[I 2025-08-29 22:57:20,734] Trial 718 finished with values: [-1000000000.0, 1000000000.0] and parameters: {'p_sma': 7, 'p_std': 27, 'p_atr': 21, 'p_adx': 18, 'rsi_period': 25, 'ema1': 24, 'ema2': 39, 'slip_atr_k': 0.01707698983415116, 'slip_spread_k': 0.8252253576227188, 'spread_hl_frac': 0.018938975014720156, 'bb_std_mult': 3.187417945804147, 'rsi_os': 20, 'rsi_ob': 60, 'vol_spike': 0.12803554407211834, 'adx_thresh': 24.981963173577565, 'atr_min_pct': 0.02916722858832469, 'atr_max_pct': 0.1451352425891811, 'tp_mult': 1.2281260657455233, 'tsl_mult': 0.6683518304192955, 'strategy': 'breakout', 'time_stop': 72, 'use_sma': False, 'use_atr': False, 'use_adx': False, 'use_ema': False, 'use_spike': False, 'rsi_required': False, 'edge_k': 0.9137934932702314, 'edge_cap': 0.7868986912043308}.
[I 2025-08-29 22:57:20,895] Trial 719 finished with values: [-1000000000.0, 1000000000.0] and parameters: {'p_sma': 7, 'p_std': 23, 'p_atr': 25, 'p_adx': 19, 'rsi_period': 23, 'ema1': 25, 'ema2': 39, 'slip_atr_k': 0.017335872843824825, 'slip_spread_k': 0.9142792345735544, 'spread_hl_frac': 0.026176674226059213, 'bb_std_mult': 3.4341518314224686, 'rsi_os': 52, 'rsi_ob': 70, 'vol_spike': 0.09294436607129876, 'adx_thresh': 25.192617687543084, 'atr_min_pct': 0.009454809106615409, 'atr_max_pct': 0.10458681983847574, 'tp_mult': 1.6346071156362625, 'tsl_mult': 0.7194518884797964, 'strategy': 'breakout', 'time_stop': 22, 'use_sma': False, 'use_atr': False, 'use_adx': False, 'use_ema': False, 'use_spike': False, 'rsi_required': False, 'edge_k': 1.3289656977719648, 'edge_cap': 0.8182503119223423}.
[I 2025-08-29 22:57:21,176] Trial 721 finished with values: [-1000000000.0, 1000000000.0] and parameters: {'p_sma': 21, 'p_std': 44, 'p_atr': 10, 'p_adx': 17, 'rsi_period': 22, 'ema1': 24, 'ema2': 52, 'slip_atr_k': 0.018313713106325052, 'slip_spread_k': 0.7861130477615272, 'spread_hl_frac': 0.006942812808812485, 'bb_std_mult': 2.2229766703466427, 'rsi_os': 23, 'rsi_ob': 45, 'vol_spike': 0.09558026532535621, 'adx_thresh': 25.517705423038365, 'atr_min_pct': 0.029044006786569584, 'atr_max_pct': 0.04546967387718341, 'tp_mult': 1.9750453137340735, 'tsl_mult': 0.7223741758254243, 'strategy': 'mean_reversion', 'time_stop': 73, 'use_sma': False, 'use_atr': False, 'use_adx': False, 'use_ema': False, 'use_spike': False, 'rsi_required': False, 'edge_k': 0.9905939147092339, 'edge_cap': 0.8177015790061207}.
[I 2025-08-29 22:57:49,042] Trial 725 finished with values: [-0.004290843020545276, 0.004279610413845191] and parameters: {'p_sma': 9, 'p_std': 24, 'p_atr': 23, 'p_adx': 15, 'rsi_period': 75, 'ema1': 30, 'ema2': 55, 'slip_atr_k': 0.012593248104498491, 'slip_spread_k': 0.4069394107193479, 'spread_hl_frac': 0.016526848792323884, 'bb_std_mult': 2.9010027828543654, 'rsi_os': 46, 'rsi_ob': 58, 'vol_spike': 0.29994828881727653, 'adx_thresh': 13.217608353437198, 'atr_min_pct': 0.0021448373122069137, 'atr_max_pct': 0.09821813040623233, 'tp_mult': 1.0129500071012814, 'tsl_mult': 0.7618167810829791, 'strategy': 'mean_reversion', 'time_stop': 154, 'use_sma': False, 'use_atr': False, 'use_adx': False, 'use_ema': False, 'use_spike': False, 'rsi_required': False, 'edge_k': 0.5507615870837211, 'edge_cap': 0.1136062391301284}.
[I 2025-08-29 22:57:49,512] Trial 724 finished with values: [-1000000000.0, 1000000000.0] and parameters: {'p_sma': 9, 'p_std': 12, 'p_atr': 23, 'p_adx': 15, 'rsi_period': 44, 'ema1': 14, 'ema2': 52, 'slip_atr_k': 0.13087335294330554, 'slip_spread_k': 0.7869358869777815, 'spread_hl_frac': 0.01646845129809376, 'bb_std_mult': 2.927267976799234, 'rsi_os': 46, 'rsi_ob': 57, 'vol_spike': 0.05420691675279532, 'adx_thresh': 26.742022786818765, 'atr_min_pct': 0.01640165417120617, 'atr_max_pct': 0.11277929066786695, 'tp_mult': 1.069858504529555, 'tsl_mult': 0.13459156806073175, 'strategy': 'mean_reversion', 'time_stop': 128, 'use_sma': False, 'use_atr': False, 'use_adx': False, 'use_ema': False, 'use_spike': False, 'rsi_required': False, 'edge_k': 0.41893956372091534, 'edge_cap': 0.2879710905079218}.
[I 2025-08-29 22:57:49,538] Trial 722 finished with values: [-0.01826031693692598, 0.018308505355014673] and parameters: {'p_sma': 8, 'p_std': 23, 'p_atr': 10, 'p_adx': 15, 'rsi_period': 20, 'ema1': 13, 'ema2': 35, 'slip_atr_k': 0.011586534872328627, 'slip_spread_k': 0.7873772326673487, 'spread_hl_frac': 0.007097392759769047, 'bb_std_mult': 3.5147767741349933, 'rsi_os': 37, 'rsi_ob': 58, 'vol_spike': 0.09341866763805, 'adx_thresh': 14.142297907855797, 'atr_min_pct': 0.002237689086513888, 'atr_max_pct': 0.0979450878116836, 'tp_mult': 2.9985420694527654, 'tsl_mult': 0.6191694328506622, 'strategy': 'mean_reversion', 'time_stop': 156, 'use_sma': False, 'use_atr': False, 'use_adx': False, 'use_ema': False, 'use_spike': False, 'rsi_required': False, 'edge_k': 1.804024687799067, 'edge_cap': 0.8143664949940649}.
[I 2025-08-29 22:57:49,811] Trial 723 finished with values: [-0.025892274256523296, 0.02587880698434204] and parameters: {'p_sma': 25, 'p_std': 23, 'p_atr': 7, 'p_adx': 9, 'rsi_period': 69, 'ema1': 13, 'ema2': 52, 'slip_atr_k': 0.22249683477901994, 'slip_spread_k': 0.7892272008077282, 'spread_hl_frac': 0.006394652763460861, 'bb_std_mult': 2.1194942633496057, 'rsi_os': 46, 'rsi_ob': 57, 'vol_spike': 0.19225871113527976, 'adx_thresh': 26.683570929034943, 'atr_min_pct': 0.002110133271302655, 'atr_max_pct': 0.020350502690106485, 'tp_mult': 1.4916428011462575, 'tsl_mult': 0.28904874282704873, 'strategy': 'mean_reversion', 'time_stop': 102, 'use_sma': False, 'use_atr': False, 'use_adx': False, 'use_ema': False, 'use_spike': False, 'rsi_required': False, 'edge_k': 1.0650246933809457, 'edge_cap': 0.5418217597157536}.
[I 2025-08-29 22:58:17,332] Trial 729 finished with values: [-0.016601275267309812, 0.01657210861285545] and parameters: {'p_sma': 46, 'p_std': 26, 'p_atr': 24, 'p_adx': 16, 'rsi_period': 17, 'ema1': 16, 'ema2': 25, 'slip_atr_k': 0.1411877583050541, 'slip_spread_k': 0.8665461672578139, 'spread_hl_frac': 0.03938712541584457, 'bb_std_mult': 1.481165570881059, 'rsi_os': 26, 'rsi_ob': 51, 'vol_spike': 0.16748349713630228, 'adx_thresh': 24.0868007197745, 'atr_min_pct': 0.002836966794735598, 'atr_max_pct': 0.0790781948594902, 'tp_mult': 1.8044136703375655, 'tsl_mult': 0.7441699915901511, 'strategy': 'breakout', 'time_stop': 164, 'use_sma': False, 'use_atr': False, 'use_adx': False, 'use_ema': False, 'use_spike': False, 'rsi_required': False, 'edge_k': 1.2326562000482026, 'edge_cap': 0.23198186049941605}.
[I 2025-08-29 22:58:17,487] Trial 726 finished with values: [-1000000000.0, 1000000000.0] and parameters: {'p_sma': 8, 'p_std': 58, 'p_atr': 7, 'p_adx': 16, 'rsi_period': 49, 'ema1': 26, 'ema2': 53, 'slip_atr_k': 0.22598848553355003, 'slip_spread_k': 0.7753290820297685, 'spread_hl_frac': 0.01807111130724634, 'bb_std_mult': 2.342292848644855, 'rsi_os': 18, 'rsi_ob': 62, 'vol_spike': 0.18242918238218842, 'adx_thresh': 26.86272753096927, 'atr_min_pct': 0.016435568725836167, 'atr_max_pct': 0.07921999335486653, 'tp_mult': 1.0795077962768826, 'tsl_mult': 0.5593038510429187, 'strategy': 'breakout', 'time_stop': 103, 'use_sma': False, 'use_atr': False, 'use_adx': False, 'use_ema': False, 'use_spike': False, 'rsi_required': False, 'edge_k': 0.4165500291594712, 'edge_cap': 0.7407024958895373}.
[I 2025-08-29 22:58:17,670] Trial 728 finished with values: [-1000000000.0, 1000000000.0] and parameters: {'p_sma': 5, 'p_std': 26, 'p_atr': 27, 'p_adx': 16, 'rsi_period': 7, 'ema1': 26, 'ema2': 53, 'slip_atr_k': 0.2122723211579047, 'slip_spread_k': 0.8659725618662003, 'spread_hl_frac': 0.037159761010542545, 'bb_std_mult': 2.122462939626037, 'rsi_os': 27, 'rsi_ob': 62, 'vol_spike': 0.06769936131260844, 'adx_thresh': 33.076259189522375, 'atr_min_pct': 0.003690622451716438, 'atr_max_pct': 0.0876600860853207, 'tp_mult': 1.7786249749267846, 'tsl_mult': 0.7834569423204617, 'strategy': 'breakout', 'time_stop': 102, 'use_sma': False, 'use_atr': False, 'use_adx': False, 'use_ema': False, 'use_spike': False, 'rsi_required': False, 'edge_k': 0.5607590579868542, 'edge_cap': 0.7396069624414531}.
