[I 2025-08-29 22:11:15,558] Trial 298 finished with values: [-1000000000.0, 1000000000.0] and parameters: {'p_sma': 6, 'p_std': 27, 'p_atr': 22, 'p_adx': 7, 'rsi_period': 19, 'ema1': 18, 'ema2': 55, 'slip_atr_k': 0.017726521242321255, 'slip_spread_k': 0.8273234488560827, 'spread_hl_frac': 0.018407310999202838, 'bb_std_mult': 2.23075638877666, 'rsi_os': 45, 'rsi_ob': 94, 'vol_spike': 0.14646600138360602, 'adx_thresh': 20.920128535078373, 'atr_min_pct': 0.0025068219148261907, 'atr_max_pct': 0.09821214356408173, 'tp_mult': 1.166607084350559, 'tsl_mult': 0.7080326802389905, 'strategy': 'mean_reversion', 'time_stop': 33, 'use_sma': False, 'use_atr': False, 'use_adx': False, 'use_ema': False, 'use_spike': False, 'rsi_required': False, 'edge_k': 0.5658104481922663, 'edge_cap': 0.9523750475514332}.
[I 2025-08-29 22:11:15,810] Trial 296 finished with values: [-0.009509672095869615, 0.009474363124715435] and parameters: {'p_sma': 59, 'p_std': 20, 'p_atr': 23, 'p_adx': 15, 'rsi_period': 51, 'ema1': 25, 'ema2': 56, 'slip_atr_k': 0.01838795906172418, 'slip_spread_k': 0.7593315551241089, 'spread_hl_frac': 0.037022574885646205, 'bb_std_mult': 3.1248005569885535, 'rsi_os': 25, 'rsi_ob': 83, 'vol_spike': 0.06973788925575093, 'adx_thresh': 25.94830387234154, 'atr_min_pct': 0.0025762347708182675, 'atr_max_pct': 0.09811522342831609, 'tp_mult': 2.396582038654638, 'tsl_mult': 0.7309529242818522, 'strategy': 'mean_reversion', 'time_stop': 212, 'use_sma': False, 'use_atr': False, 'use_adx': False, 'use_ema': False, 'use_spike': False, 'rsi_required': False, 'edge_k': 0.001314792154206046, 'edge_cap': 0.5078234154489192}.
[I 2025-08-29 22:11:42,567] Trial 301 finished with values: [-1000000000.0, 1000000000.0] and parameters: {'p_sma': 27, 'p_std': 22, 'p_atr': 24, 'p_adx': 8, 'rsi_period': 69, 'ema1': 25, 'ema2': 30, 'slip_atr_k': 0.08622696846258351, 'slip_spread_k': 0.7781637694848014, 'spread_hl_frac': 0.03029592830373637, 'bb_std_mult': 2.1284813136043748, 'rsi_os': 17, 'rsi_ob': 74, 'vol_spike': 0.18849493436504872, 'adx_thresh': 25.42568405636452, 'atr_min_pct': 0.027875028772901787, 'atr_max_pct': 0.09411166657320195, 'tp_mult': 1.095829466456021, 'tsl_mult': 0.7035560030767566, 'strategy': 'breakout', 'time_stop': 89, 'use_sma': False, 'use_atr': False, 'use_adx': False, 'use_ema': False, 'use_spike': False, 'rsi_required': False, 'edge_k': 0.5632633932777096, 'edge_cap': 0.5014799643006209}.
[I 2025-08-29 22:11:42,702] Trial 302 finished with values: [-1000000000.0, 1000000000.0] and parameters: {'p_sma': 32, 'p_std': 23, 'p_atr': 24, 'p_adx': 13, 'rsi_period': 22, 'ema1': 23, 'ema2': 36, 'slip_atr_k': 0.08194923548345825, 'slip_spread_k': 0.2540184703232286, 'spread_hl_frac': 0.017548808113678465, 'bb_std_mult': 3.2434997330431496, 'rsi_os': 17, 'rsi_ob': 59, 'vol_spike': 0.18753742083488692, 'adx_thresh': 28.245336122791244, 'atr_min_pct': 0.027632889948829176, 'atr_max_pct': 0.13271063931008303, 'tp_mult': 1.1238420981443928, 'tsl_mult': 0.7081903030633651, 'strategy': 'breakout', 'time_stop': 51, 'use_sma': False, 'use_atr': False, 'use_adx': False, 'use_ema': False, 'use_spike': False, 'rsi_required': False, 'edge_k': 0.567122178283656, 'edge_cap': 0.820596431812812}.
[I 2025-08-29 22:11:42,702] Trial 300 finished with values: [-0.004613582011467998, 0.004643163896049638] and parameters: {'p_sma': 27, 'p_std': 38, 'p_atr': 22, 'p_adx': 19, 'rsi_period': 22, 'ema1': 11, 'ema2': 36, 'slip_atr_k': 0.01891669881515084, 'slip_spread_k': 0.7559496876884385, 'spread_hl_frac': 0.01809116149652098, 'bb_std_mult': 2.228650296195176, 'rsi_os': 10, 'rsi_ob': 74, 'vol_spike': 0.14156179961375537, 'adx_thresh': 20.64367042468634, 'atr_min_pct': 0.0016527744251748164, 'atr_max_pct': 0.017779035096971374, 'tp_mult': 2.996217616544733, 'tsl_mult': 0.7008916077803424, 'strategy': 'breakout', 'time_stop': 95, 'use_sma': False, 'use_atr': False, 'use_adx': False, 'use_ema': False, 'use_spike': False, 'rsi_required': False, 'edge_k': 0.5630902807898206, 'edge_cap': 0.9562572175121411}.
[I 2025-08-29 22:11:42,832] Trial 299 finished with values: [-1000000000.0, 1000000000.0] and parameters: {'p_sma': 27, 'p_std': 27, 'p_atr': 22, 'p_adx': 17, 'rsi_period': 19, 'ema1': 12, 'ema2': 55, 'slip_atr_k': 0.06984021391278142, 'slip_spread_k': 0.7648123080826991, 'spread_hl_frac': 0.018360019847386156, 'bb_std_mult': 2.2052248308965465, 'rsi_os': 27, 'rsi_ob': 59, 'vol_spike': 0.266996512156193, 'adx_thresh': 26.02945810915007, 'atr_min_pct': 0.004576815085779513, 'atr_max_pct': 0.06941690818421695, 'tp_mult': 2.998304444327566, 'tsl_mult': 0.7028965633528266, 'strategy': 'breakout', 'time_stop': 97, 'use_sma': False, 'use_atr': False, 'use_adx': False, 'use_ema': False, 'use_spike': False, 'rsi_required': False, 'edge_k': 0.5495595369980738, 'edge_cap': 0.8545416023634304}.
[I 2025-08-29 22:11:42,993] Trial 305 finished with values: [-1000000000.0, 1000000000.0] and parameters: {'p_sma': 9, 'p_std': 26, 'p_atr': 22, 'p_adx': 17, 'rsi_period': 17, 'ema1': 11, 'ema2': 53, 'slip_atr_k': 0.021427851214158727, 'slip_spread_k': 0.012091270772585427, 'spread_hl_frac': 0.04439456669306821, 'bb_std_mult': 3.439555691431119, 'rsi_os': 10, 'rsi_ob': 69, 'vol_spike': 0.09160426122639476, 'adx_thresh': 25.161352000732194, 'atr_min_pct': 0.014866765084612949, 'atr_max_pct': 0.010171332434060598, 'tp_mult': 1.533599898405239, 'tsl_mult': 0.760850004060889, 'strategy': 'breakout', 'time_stop': 104, 'use_sma': False, 'use_atr': False, 'use_adx': False, 'use_ema': False, 'use_spike': False, 'rsi_required': False, 'edge_k': 0.4261685017567328, 'edge_cap': 0.4268691024980088}.
[I 2025-08-29 22:12:09,691] Trial 303 finished with values: [-1000000000.0, 1000000000.0] and parameters: {'p_sma': 9, 'p_std': 26, 'p_atr': 22, 'p_adx': 25, 'rsi_period': 46, 'ema1': 11, 'ema2': 11, 'slip_atr_k': 0.013026275901206693, 'slip_spread_k': 0.8554160379784156, 'spread_hl_frac': 0.0164257610820198, 'bb_std_mult': 1.9220067724870389, 'rsi_os': 28, 'rsi_ob': 85, 'vol_spike': 0.2545786522559205, 'adx_thresh': 20.104182195056737, 'atr_min_pct': 0.00456950620313174, 'atr_max_pct': 0.0175004218819693, 'tp_mult': 1.2458736866544706, 'tsl_mult': 0.6972904779923828, 'strategy': 'breakout', 'time_stop': 94, 'use_sma': False, 'use_atr': False, 'use_adx': False, 'use_ema': False, 'use_spike': False, 'rsi_required': False, 'edge_k': 1.3131755755705496, 'edge_cap': 0.6505657961328574}.
[I 2025-08-29 22:12:09,966] Trial 304 finished with values: [-1000000000.0, 1000000000.0] and parameters: {'p_sma': 9, 'p_std': 26, 'p_atr': 22, 'p_adx': 25, 'rsi_period': 17, 'ema1': 11, 'ema2': 53, 'slip_atr_k': 0.07397959318392716, 'slip_spread_k': 0.011817899308388669, 'spread_hl_frac': 0.01628191629372925, 'bb_std_mult': 1.3258466080935416, 'rsi_os': 10, 'rsi_ob': 88, 'vol_spike': 0.13718725854134334, 'adx_thresh': 16.404223264417617, 'atr_min_pct': 0.004462359326584252, 'atr_max_pct': 0.09008192744740141, 'tp_mult': 2.1208715931744115, 'tsl_mult': 0.7453784676359253, 'strategy': 'breakout', 'time_stop': 95, 'use_sma': False, 'use_atr': False, 'use_adx': False, 'use_ema': False, 'use_spike': False, 'rsi_required': False, 'edge_k': 0.32861500420304723, 'edge_cap': 0.42028661011050755}.
[I 2025-08-29 22:12:10,131] Trial 307 finished with values: [-1000000000.0, 1000000000.0] and parameters: {'p_sma': 30, 'p_std': 24, 'p_atr': 23, 'p_adx': 19, 'rsi_period': 22, 'ema1': 23, 'ema2': 11, 'slip_atr_k': 0.16775421314728406, 'slip_spread_k': 0.85349172885484, 'spread_hl_frac': 0.015913529320790532, 'bb_std_mult': 1.213437567301713, 'rsi_os': 26, 'rsi_ob': 88, 'vol_spike': 0.036941116918598624, 'adx_thresh': 10.836086474854438, 'atr_min_pct': 0.021363142170774667, 'atr_max_pct': 0.0894508324330393, 'tp_mult': 2.102116750298504, 'tsl_mult': 0.7487780147194893, 'strategy': 'breakout', 'time_stop': 121, 'use_sma': False, 'use_atr': False, 'use_adx': False, 'use_ema': False, 'use_spike': False, 'rsi_required': False, 'edge_k': 0.4637176385005114, 'edge_cap': 0.23484055951166893}.
[I 2025-08-29 22:12:10,202] Trial 306 finished with values: [-1000000000.0, 1000000000.0] and parameters: {'p_sma': 10, 'p_std': 26, 'p_atr': 22, 'p_adx': 14, 'rsi_period': 23, 'ema1': 23, 'ema2': 53, 'slip_atr_k': 0.01199111074348189, 'slip_spread_k': 0.8552910726321558, 'spread_hl_frac': 0.04466757609945115, 'bb_std_mult': 1.2160210615782874, 'rsi_os': 10, 'rsi_ob': 45, 'vol_spike': 0.0915301450962116, 'adx_thresh': 11.010941747459608, 'atr_min_pct': 0.0033981983534443674, 'atr_max_pct': 0.01780856274705018, 'tp_mult': 1.0777036046319597, 'tsl_mult': 0.7553189724626042, 'strategy': 'breakout', 'time_stop': 105, 'use_sma': False, 'use_atr': False, 'use_adx': False, 'use_ema': False, 'use_spike': False, 'rsi_required': False, 'edge_k': 0.41866797795684074, 'edge_cap': 0.23877906522157327}.
[I 2025-08-29 22:12:36,905] Trial 309 finished with values: [-1000000000.0, 1000000000.0] and parameters: {'p_sma': 5, 'p_std': 24, 'p_atr': 24, 'p_adx': 14, 'rsi_period': 73, 'ema1': 25, 'ema2': 54, 'slip_atr_k': 0.1677804410388573, 'slip_spread_k': 0.8421268346719444, 'spread_hl_frac': 0.019208692859999273, 'bb_std_mult': 1.8829430105142069, 'rsi_os': 26, 'rsi_ob': 90, 'vol_spike': 0.1567202117745386, 'adx_thresh': 26.963364975563454, 'atr_min_pct': 0.0014238986110797402, 'atr_max_pct': 0.09443016352493933, 'tp_mult': 1.3307499308673765, 'tsl_mult': 0.7518026859962894, 'strategy': 'breakout', 'time_stop': 120, 'use_sma': False, 'use_atr': False, 'use_adx': False, 'use_ema': False, 'use_spike': False, 'rsi_required': False, 'edge_k': 0.4536466070403461, 'edge_cap': 0.23498091252401698}.
[I 2025-08-29 22:12:37,123] Trial 311 finished with values: [-0.01787167572240067, 0.017876242822482243] and parameters: {'p_sma': 5, 'p_std': 36, 'p_atr': 24, 'p_adx': 16, 'rsi_period': 25, 'ema1': 25, 'ema2': 51, 'slip_atr_k': 0.029597610609451777, 'slip_spread_k': 0.728523327395771, 'spread_hl_frac': 0.01945839941539476, 'bb_std_mult': 1.8840857780327207, 'rsi_os': 49, 'rsi_ob': 61, 'vol_spike': 0.1764288436847915, 'adx_thresh': 9.891810016942506, 'atr_min_pct': 0.001492905116646099, 'atr_max_pct': 0.041861734637047475, 'tp_mult': 2.683206685502041, 'tsl_mult': 0.7332506791070188, 'strategy': 'breakout', 'time_stop': 116, 'use_sma': False, 'use_atr': False, 'use_adx': False, 'use_ema': False, 'use_spike': False, 'rsi_required': False, 'edge_k': 1.523268532840287, 'edge_cap': 0.8131744043975686}.
[I 2025-08-29 22:12:37,216] Trial 310 finished with values: [-0.00799239569577026, 0.007969733869664092] and parameters: {'p_sma': 46, 'p_std': 36, 'p_atr': 24, 'p_adx': 14, 'rsi_period': 13, 'ema1': 25, 'ema2': 52, 'slip_atr_k': 0.00035858870620462946, 'slip_spread_k': 0.0486448839983184, 'spread_hl_frac': 0.017436976369652794, 'bb_std_mult': 1.8650017930637097, 'rsi_os': 7, 'rsi_ob': 80, 'vol_spike': 0.12192376085935316, 'adx_thresh': 26.754825973125296, 'atr_min_pct': 0.001457640820840968, 'atr_max_pct': 0.12580040873636303, 'tp_mult': 2.230708653892994, 'tsl_mult': 0.7353024647921176, 'strategy': 'breakout', 'time_stop': 114, 'use_sma': False, 'use_atr': False, 'use_adx': False, 'use_ema': False, 'use_spike': False, 'rsi_required': False, 'edge_k': 1.5229019355365254, 'edge_cap': 0.5563408403788258}.
[I 2025-08-29 22:12:37,433] Trial 308 finished with values: [-1000000000.0, 1000000000.0] and parameters: {'p_sma': 5, 'p_std': 24, 'p_atr': 24, 'p_adx': 14, 'rsi_period': 67, 'ema1': 25, 'ema2': 51, 'slip_atr_k': 0.07326233282383751, 'slip_spread_k': 0.7109638139315742, 'spread_hl_frac': 0.019647306401151674, 'bb_std_mult': 2.0126087607116454, 'rsi_os': 28, 'rsi_ob': 91, 'vol_spike': 0.03631954767137002, 'adx_thresh': 34.96703376571392, 'atr_min_pct': 0.0016852178480114602, 'atr_max_pct': 0.08980522918295691, 'tp_mult': 2.1024530904047323, 'tsl_mult': 0.7501829783136047, 'strategy': 'breakout', 'time_stop': 116, 'use_sma': False, 'use_atr': False, 'use_adx': False, 'use_ema': False, 'use_spike': False, 'rsi_required': False, 'edge_k': 0.4655449808806903, 'edge_cap': 0.6213966215896963}.
[I 2025-08-29 22:13:04,195] Trial 313 finished with values: [-1000000000.0, 1000000000.0] and parameters: {'p_sma': 8, 'p_std': 15, 'p_atr': 23, 'p_adx': 16, 'rsi_period': 57, 'ema1': 24, 'ema2': 60, 'slip_atr_k': 0.0010518862511565141, 'slip_spread_k': 0.6625756328346724, 'spread_hl_frac': 0.03819665498531387, 'bb_std_mult': 2.0346397749259, 'rsi_os': 28, 'rsi_ob': 80, 'vol_spike': 0.18467105735801015, 'adx_thresh': 13.590804861106704, 'atr_min_pct': 0.0031657766907191042, 'atr_max_pct': 0.12517673132846077, 'tp_mult': 2.80078174977544, 'tsl_mult': 0.6844680698988033, 'strategy': 'mean_reversion', 'time_stop': 167, 'use_sma': False, 'use_atr': False, 'use_adx': False, 'use_ema': False, 'use_spike': False, 'rsi_required': False, 'edge_k': 1.9566156558486125, 'edge_cap': 0.08339529500689702}.
[I 2025-08-29 22:13:04,213] Trial 314 finished with values: [-0.007067180681698537, 0.0070157268049768] and parameters: {'p_sma': 8, 'p_std': 10, 'p_atr': 23, 'p_adx': 19, 'rsi_period': 57, 'ema1': 6, 'ema2': 55, 'slip_atr_k': 0.1015149011781124, 'slip_spread_k': 0.8013020392825989, 'spread_hl_frac': 0.03859791611871774, 'bb_std_mult': 2.0194318242850864, 'rsi_os': 28, 'rsi_ob': 58, 'vol_spike': 0.10126696423742089, 'adx_thresh': 8.404903406508124, 'atr_min_pct': 0.0032085347519014797, 'atr_max_pct': 0.10299928287729083, 'tp_mult': 2.75139824970182, 'tsl_mult': 0.6901407338076706, 'strategy': 'mean_reversion', 'time_stop': 201, 'use_sma': False, 'use_atr': False, 'use_adx': False, 'use_ema': False, 'use_spike': False, 'rsi_required': False, 'edge_k': 1.9556725432560698, 'edge_cap': 0.7770460908958793}.
[I 2025-08-29 22:13:04,460] Trial 312 finished with values: [-0.06632022414801453, 0.06633831503458282] and parameters: {'p_sma': 45, 'p_std': 38, 'p_atr': 24, 'p_adx': 16, 'rsi_period': 25, 'ema1': 25, 'ema2': 52, 'slip_atr_k': 0.15142765085448703, 'slip_spread_k': 0.8073075708479367, 'spread_hl_frac': 0.017613451778335603, 'bb_std_mult': 2.0112934466417225, 'rsi_os': 47, 'rsi_ob': 80, 'vol_spike': 0.17881838895655955, 'adx_thresh': 26.615459231293684, 'atr_min_pct': 0.0016420205273445531, 'atr_max_pct': 0.12605715656929117, 'tp_mult': 2.2189603812455436, 'tsl_mult': 0.6868008702594719, 'strategy': 'breakout', 'time_stop': 115, 'use_sma': False, 'use_atr': False, 'use_adx': False, 'use_ema': False, 'use_spike': False, 'rsi_required': False, 'edge_k': 0.5070200837631851, 'edge_cap': 0.8120959233986094}.
[I 2025-08-29 22:13:04,651] Trial 315 finished with values: [-1000000000.0, 1000000000.0] and parameters: {'p_sma': 8, 'p_std': 22, 'p_atr': 23, 'p_adx': 17, 'rsi_period': 61, 'ema1': 24, 'ema2': 60, 'slip_atr_k': 0.01853369781676637, 'slip_spread_k': 0.8040198253525588, 'spread_hl_frac': 0.032722678024762475, 'bb_std_mult': 2.120370407903342, 'rsi_os': 14, 'rsi_ob': 70, 'vol_spike': 0.16448953421830867, 'adx_thresh': 8.291252635889728, 'atr_min_pct': 0.0035945732960495085, 'atr_max_pct': 0.0967604122272514, 'tp_mult': 2.782360034614014, 'tsl_mult': 0.6945238397977401, 'strategy': 'mean_reversion', 'time_stop': 107, 'use_sma': False, 'use_atr': False, 'use_adx': False, 'use_ema': False, 'use_spike': False, 'rsi_required': False, 'edge_k': 1.957468741494437, 'edge_cap': 0.7709378550145131}.
[I 2025-08-29 22:13:04,848] Trial 316 finished with values: [-1000000000.0, 1000000000.0] and parameters: {'p_sma': 7, 'p_std': 38, 'p_atr': 23, 'p_adx': 17, 'rsi_period': 20, 'ema1': 22, 'ema2': 54, 'slip_atr_k': 0.018411916874462753, 'slip_spread_k': 0.945122822243586, 'spread_hl_frac': 0.02180976458525114, 'bb_std_mult': 2.1124828169509744, 'rsi_os': 25, 'rsi_ob': 62, 'vol_spike': 0.16673770465232335, 'adx_thresh': 24.84167052752056, 'atr_min_pct': 0.01974390037787195, 'atr_max_pct': 0.013467536417551162, 'tp_mult': 1.1234319414040406, 'tsl_mult': 0.7141047162086022, 'strategy': 'breakout', 'time_stop': 62, 'use_sma': False, 'use_atr': False, 'use_adx': False, 'use_ema': False, 'use_spike': False, 'rsi_required': False, 'edge_k': 0.8222191197669897, 'edge_cap': 0.8384084608926407}.
[I 2025-08-29 22:13:31,009] Trial 317 finished with values: [-1000000000.0, 1000000000.0] and parameters: {'p_sma': 6, 'p_std': 39, 'p_atr': 23, 'p_adx': 17, 'rsi_period': 20, 'ema1': 17, 'ema2': 37, 'slip_atr_k': 0.017342374072345526, 'slip_spread_k': 0.9604493922361488, 'spread_hl_frac': 0.021601208852128587, 'bb_std_mult': 2.108784849255241, 'rsi_os': 14, 'rsi_ob': 62, 'vol_spike': 0.16744266317698733, 'adx_thresh': 24.886519947795218, 'atr_min_pct': 0.011908306245846951, 'atr_max_pct': 0.022352136704261484, 'tp_mult': 1.1228753991370302, 'tsl_mult': 0.715829737740463, 'strategy': 'breakout', 'time_stop': 127, 'use_sma': False, 'use_atr': False, 'use_adx': False, 'use_ema': False, 'use_spike': False, 'rsi_required': False, 'edge_k': 0.5106228049436851, 'edge_cap': 0.8386057776016606}.
[I 2025-08-29 22:13:31,409] Trial 319 finished with values: [-0.003203610799583867, 0.0033707927439124274] and parameters: {'p_sma': 7, 'p_std': 52, 'p_atr': 23, 'p_adx': 18, 'rsi_period': 20, 'ema1': 17, 'ema2': 28, 'slip_atr_k': 0.02233731279777443, 'slip_spread_k': 0.970568264295439, 'spread_hl_frac': 0.031165159611101383, 'bb_std_mult': 2.1219058669976927, 'rsi_os': 31, 'rsi_ob': 62, 'vol_spike': 0.1911904899858112, 'adx_thresh': 24.727014065417087, 'atr_min_pct': 0.002109615331397444, 'atr_max_pct': 0.02243686255916342, 'tp_mult': 2.563870074259725, 'tsl_mult': 0.7108066420532058, 'strategy': 'breakout', 'time_stop': 127, 'use_sma': False, 'use_atr': False, 'use_adx': False, 'use_ema': False, 'use_spike': False, 'rsi_required': False, 'edge_k': 0.8141451794116594, 'edge_cap': 0.969064078982264}.
[I 2025-08-29 22:13:31,657] Trial 318 finished with values: [-1000000000.0, 1000000000.0] and parameters: {'p_sma': 7, 'p_std': 52, 'p_atr': 23, 'p_adx': 21, 'rsi_period': 61, 'ema1': 22, 'ema2': 22, 'slip_atr_k': 0.017396524664720595, 'slip_spread_k': 0.38487403752623023, 'spread_hl_frac': 0.03268816951919863, 'bb_std_mult': 2.607469907774179, 'rsi_os': 14, 'rsi_ob': 50, 'vol_spike': 0.1634708016169122, 'adx_thresh': 17.89373282230412, 'atr_min_pct': 0.016707555843833724, 'atr_max_pct': 0.09317887721681432, 'tp_mult': 1.8323332686352019, 'tsl_mult': 0.7142432778753048, 'strategy': 'breakout', 'time_stop': 127, 'use_sma': False, 'use_atr': False, 'use_adx': False, 'use_ema': False, 'use_spike': False, 'rsi_required': False, 'edge_k': 1.8838736050939877, 'edge_cap': 0.8493856224723906}.
[I 2025-08-29 22:13:31,745] Trial 320 finished with values: [-1000000000.0, 1000000000.0] and parameters: {'p_sma': 17, 'p_std': 25, 'p_atr': 22, 'p_adx': 23, 'rsi_period': 21, 'ema1': 24, 'ema2': 28, 'slip_atr_k': 0.02463677179466824, 'slip_spread_k': 0.8300856478459724, 'spread_hl_frac': 0.014707978338292294, 'bb_std_mult': 2.1775875014397448, 'rsi_os': 23, 'rsi_ob': 60, 'vol_spike': 0.05114331829421295, 'adx_thresh': 25.525284202554435, 'atr_min_pct': 0.007838574584556175, 'atr_max_pct': 0.02247150400560284, 'tp_mult': 1.8645403863909884, 'tsl_mult': 0.7211357684096779, 'strategy': 'breakout', 'time_stop': 129, 'use_sma': False, 'use_atr': False, 'use_adx': False, 'use_ema': False, 'use_spike': False, 'rsi_required': False, 'edge_k': 0.7331946969710396, 'edge_cap': 0.2766992790330688}.
[I 2025-08-29 22:13:58,752] Trial 323 finished with values: [-1000000000.0, 1000000000.0] and parameters: {'p_sma': 36, 'p_std': 6, 'p_atr': 22, 'p_adx': 23, 'rsi_period': 21, 'ema1': 26, 'ema2': 45, 'slip_atr_k': 0.0221177794717028, 'slip_spread_k': 0.8256499976930981, 'spread_hl_frac': 0.0150209602856906, 'bb_std_mult': 2.199447640019129, 'rsi_os': 23, 'rsi_ob': 57, 'vol_spike': 0.190622047672182, 'adx_thresh': 11.734876667960568, 'atr_min_pct': 0.011424291088229692, 'atr_max_pct': 0.09922150507964307, 'tp_mult': 1.6747854691922806, 'tsl_mult': 0.7421514944358666, 'strategy': 'breakout', 'time_stop': 71, 'use_sma': False, 'use_atr': False, 'use_adx': False, 'use_ema': False, 'use_spike': False, 'rsi_required': False, 'edge_k': 0.6119003924981854, 'edge_cap': 0.17587934714810582}.
[I 2025-08-29 22:13:58,925] Trial 321 finished with values: [-0.0011047884060056967, 0.001901047761665657] and parameters: {'p_sma': 6, 'p_std': 45, 'p_atr': 23, 'p_adx': 23, 'rsi_period': 16, 'ema1': 24, 'ema2': 24, 'slip_atr_k': 0.006397196920814354, 'slip_spread_k': 0.8249954511660323, 'spread_hl_frac': 0.011720493447899456, 'bb_std_mult': 2.5739407114379023, 'rsi_os': 35, 'rsi_ob': 60, 'vol_spike': 0.1887575023433762, 'adx_thresh': 25.551069724513127, 'atr_min_pct': 0.0021656907848145047, 'atr_max_pct': 0.09274900936844598, 'tp_mult': 1.0486118807045015, 'tsl_mult': 0.7174786618081673, 'strategy': 'breakout', 'time_stop': 105, 'use_sma': False, 'use_atr': False, 'use_adx': False, 'use_ema': False, 'use_spike': False, 'rsi_required': False, 'edge_k': 0.5899353900548436, 'edge_cap': 0.36203078314270687}.
[I 2025-08-29 22:13:59,098] Trial 322 finished with values: [-0.006855844200936212, 0.007075309081521394] and parameters: {'p_sma': 35, 'p_std': 30, 'p_atr': 22, 'p_adx': 21, 'rsi_period': 21, 'ema1': 26, 'ema2': 49, 'slip_atr_k': 0.024234271451266054, 'slip_spread_k': 0.8266820254247835, 'spread_hl_frac': 0.014583957221896801, 'bb_std_mult': 2.1983662263051067, 'rsi_os': 21, 'rsi_ob': 59, 'vol_spike': 0.2838695947154739, 'adx_thresh': 25.43150651547071, 'atr_min_pct': 0.0020544372229759416, 'atr_max_pct': 0.14709190015515552, 'tp_mult': 1.0109040512449863, 'tsl_mult': 0.7255150477107714, 'strategy': 'breakout', 'time_stop': 18, 'use_sma': False, 'use_atr': False, 'use_adx': False, 'use_ema': False, 'use_spike': False, 'rsi_required': False, 'edge_k': 1.0598946396117461, 'edge_cap': 0.18117898197450932}.
