[I 2025-08-30 00:06:03,972] Trial 1348 finished with values: [-0.002291474411980743, 0.0026068057180413436] and parameters: {'p_sma': 31, 'p_std': 21, 'p_atr': 23, 'p_adx': 16, 'rsi_period': 16, 'ema1': 22, 'ema2': 55, 'slip_atr_k': 0.008613311779588803, 'slip_spread_k': 0.8346175944222723, 'spread_hl_frac': 0.00714855362252248, 'bb_std_mult': 0.5787116746246592, 'rsi_os': 28, 'rsi_ob': 58, 'vol_spike': 0.1549629747192837, 'adx_thresh': 17.24849822324531, 'atr_min_pct': 0.004729212004277548, 'atr_max_pct': 0.03509634653908154, 'tp_mult': 1.9934041790884074, 'tsl_mult': 0.7100358406745144, 'strategy': 'breakout', 'time_stop': 166, 'use_sma': False, 'use_atr': False, 'use_adx': False, 'use_ema': False, 'use_spike': False, 'rsi_required': False, 'edge_k': 0.6815867209731785, 'edge_cap': 0.3869934492463517}.
[I 2025-08-30 00:06:30,165] Trial 1354 finished with values: [-1000000000.0, 1000000000.0] and parameters: {'p_sma': 55, 'p_std': 25, 'p_atr': 23, 'p_adx': 16, 'rsi_period': 25, 'ema1': 23, 'ema2': 55, 'slip_atr_k': 0.02275613090808766, 'slip_spread_k': 0.816078612659283, 'spread_hl_frac': 0.01708839392931629, 'bb_std_mult': 0.8478850162003984, 'rsi_os': 33, 'rsi_ob': 59, 'vol_spike': 0.1852863588438797, 'adx_thresh': 30.41949280341043, 'atr_min_pct': 0.019655242061819796, 'atr_max_pct': 0.08992896846750553, 'tp_mult': 1.2297570857436049, 'tsl_mult': 0.7355425360634473, 'strategy': 'breakout', 'time_stop': 82, 'use_sma': False, 'use_atr': False, 'use_adx': False, 'use_ema': False, 'use_spike': False, 'rsi_required': False, 'edge_k': 1.0895994546121495, 'edge_cap': 0.7225175133190497}.
[I 2025-08-30 00:06:30,287] Trial 1352 finished with values: [-0.0073594865582227165, 0.007327677682622656] and parameters: {'p_sma': 20, 'p_std': 22, 'p_atr': 23, 'p_adx': 17, 'rsi_period': 17, 'ema1': 23, 'ema2': 55, 'slip_atr_k': 0.22673603292805306, 'slip_spread_k': 0.8242270057182253, 'spread_hl_frac': 0.017185776120773426, 'bb_std_mult': 2.9967365363202965, 'rsi_os': 13, 'rsi_ob': 61, 'vol_spike': 0.18564984359741257, 'adx_thresh': 27.01770616040484, 'atr_min_pct': 0.0023924452294950766, 'atr_max_pct': 0.048453621296716216, 'tp_mult': 1.522946902547319, 'tsl_mult': 0.7475515435512655, 'strategy': 'breakout', 'time_stop': 248, 'use_sma': False, 'use_atr': False, 'use_adx': False, 'use_ema': False, 'use_spike': False, 'rsi_required': False, 'edge_k': 0.5558494702338189, 'edge_cap': 0.7347881670084042}.
[I 2025-08-30 00:06:30,430] Trial 1351 finished with values: [-1000000000.0, 1000000000.0] and parameters: {'p_sma': 8, 'p_std': 26, 'p_atr': 23, 'p_adx': 17, 'rsi_period': 17, 'ema1': 23, 'ema2': 55, 'slip_atr_k': 0.01351908766068402, 'slip_spread_k': 0.8727556510930412, 'spread_hl_frac': 0.00880654492189887, 'bb_std_mult': 1.7715818308615163, 'rsi_os': 28, 'rsi_ob': 59, 'vol_spike': 0.18317420431298742, 'adx_thresh': 26.995436313555658, 'atr_min_pct': 0.019808750404787467, 'atr_max_pct': 0.0886144719859977, 'tp_mult': 1.341252040401557, 'tsl_mult': 0.268966919071562, 'strategy': 'breakout', 'time_stop': 115, 'use_sma': False, 'use_atr': False, 'use_adx': False, 'use_ema': False, 'use_spike': False, 'rsi_required': False, 'edge_k': 0.9875722972807935, 'edge_cap': 0.6780106226446347}.
[I 2025-08-30 00:06:30,504] Trial 1353 finished with values: [-1000000000.0, 1000000000.0] and parameters: {'p_sma': 31, 'p_std': 26, 'p_atr': 13, 'p_adx': 17, 'rsi_period': 25, 'ema1': 9, 'ema2': 29, 'slip_atr_k': 0.08423790233472864, 'slip_spread_k': 0.0874695511385265, 'spread_hl_frac': 0.04623211859312657, 'bb_std_mult': 3.0018869257368634, 'rsi_os': 30, 'rsi_ob': 59, 'vol_spike': 0.18594556101672777, 'adx_thresh': 17.010183736102803, 'atr_min_pct': 0.01938888388223742, 'atr_max_pct': 0.08986679294703778, 'tp_mult': 2.002459986807821, 'tsl_mult': 0.4362410257639836, 'strategy': 'breakout', 'time_stop': 112, 'use_sma': False, 'use_atr': False, 'use_adx': False, 'use_ema': False, 'use_spike': False, 'rsi_required': False, 'edge_k': 0.5160561835878132, 'edge_cap': 0.7368057808564619}.
[I 2025-08-30 00:06:56,403] Trial 1356 finished with values: [-1000000000.0, 1000000000.0] and parameters: {'p_sma': 7, 'p_std': 26, 'p_atr': 22, 'p_adx': 16, 'rsi_period': 27, 'ema1': 13, 'ema2': 50, 'slip_atr_k': 0.014315827801728478, 'slip_spread_k': 0.8784656277321438, 'spread_hl_frac': 0.01835043151945794, 'bb_std_mult': 1.9274879905963342, 'rsi_os': 30, 'rsi_ob': 47, 'vol_spike': 0.17591336010061534, 'adx_thresh': 24.842445615585298, 'atr_min_pct': 0.004578313509260761, 'atr_max_pct': 0.09724466768029746, 'tp_mult': 2.005235742122222, 'tsl_mult': 0.4301517439574505, 'strategy': 'breakout', 'time_stop': 114, 'use_sma': False, 'use_atr': False, 'use_adx': False, 'use_ema': False, 'use_spike': False, 'rsi_required': False, 'edge_k': 0.5137443081543495, 'edge_cap': 0.8137812895559415}.
[I 2025-08-30 00:06:57,105] Trial 1355 finished with values: [-0.005777352827577298, 0.005776595943669698] and parameters: {'p_sma': 20, 'p_std': 26, 'p_atr': 12, 'p_adx': 16, 'rsi_period': 15, 'ema1': 13, 'ema2': 50, 'slip_atr_k': 0.08305242944793984, 'slip_spread_k': 0.8759095821474224, 'spread_hl_frac': 0.034334136217065624, 'bb_std_mult': 1.9166059169984357, 'rsi_os': 27, 'rsi_ob': 49, 'vol_spike': 0.18653109567027756, 'adx_thresh': 26.99349098606528, 'atr_min_pct': 0.004644059551082614, 'atr_max_pct': 0.09732330690335708, 'tp_mult': 1.0352899847367172, 'tsl_mult': 0.7710986741320306, 'strategy': 'breakout', 'time_stop': 287, 'use_sma': False, 'use_atr': False, 'use_adx': False, 'use_ema': False, 'use_spike': False, 'rsi_required': False, 'edge_k': 0.513802153843822, 'edge_cap': 0.6729710187498557}.
[I 2025-08-30 00:06:57,386] Trial 1358 finished with values: [-1000000000.0, 1000000000.0] and parameters: {'p_sma': 42, 'p_std': 10, 'p_atr': 10, 'p_adx': 16, 'rsi_period': 28, 'ema1': 24, 'ema2': 50, 'slip_atr_k': 0.20932829012710236, 'slip_spread_k': 0.6248748543794386, 'spread_hl_frac': 0.018025964237687157, 'bb_std_mult': 1.1300326389241113, 'rsi_os': 27, 'rsi_ob': 49, 'vol_spike': 0.17532570995566796, 'adx_thresh': 25.8913520074783, 'atr_min_pct': 0.005952816610725222, 'atr_max_pct': 0.09708768136349748, 'tp_mult': 1.0895013709191772, 'tsl_mult': 0.7765177425576552, 'strategy': 'breakout', 'time_stop': 289, 'use_sma': False, 'use_atr': False, 'use_adx': False, 'use_ema': False, 'use_spike': False, 'rsi_required': False, 'edge_k': 0.9320924611707807, 'edge_cap': 0.48909438160905705}.
[I 2025-08-30 00:06:57,482] Trial 1357 finished with values: [-0.01674542293672543, 0.01673777920111263] and parameters: {'p_sma': 40, 'p_std': 26, 'p_atr': 22, 'p_adx': 16, 'rsi_period': 26, 'ema1': 5, 'ema2': 54, 'slip_atr_k': 0.08313109338633867, 'slip_spread_k': 0.8071237659414996, 'spread_hl_frac': 0.01882462652373002, 'bb_std_mult': 1.9227407053106003, 'rsi_os': 27, 'rsi_ob': 62, 'vol_spike': 0.20816338487989589, 'adx_thresh': 24.72214672066658, 'atr_min_pct': 0.001900316164806641, 'atr_max_pct': 0.09753737684093235, 'tp_mult': 2.00773101352552, 'tsl_mult': 0.7695991467246341, 'strategy': 'breakout', 'time_stop': 287, 'use_sma': False, 'use_atr': False, 'use_adx': False, 'use_ema': False, 'use_spike': False, 'rsi_required': False, 'edge_k': 0.4715605677281517, 'edge_cap': 0.8150212416377312}.
[I 2025-08-30 00:06:57,781] Trial 1359 finished with values: [-1000000000.0, 1000000000.0] and parameters: {'p_sma': 9, 'p_std': 24, 'p_atr': 10, 'p_adx': 16, 'rsi_period': 15, 'ema1': 24, 'ema2': 32, 'slip_atr_k': 0.11441176915215745, 'slip_spread_k': 0.6063503331220242, 'spread_hl_frac': 0.016342313373771827, 'bb_std_mult': 1.174781662749181, 'rsi_os': 52, 'rsi_ob': 61, 'vol_spike': 0.21069247873281688, 'adx_thresh': 34.38564221219167, 'atr_min_pct': 0.006151687481242032, 'atr_max_pct': 0.09382206518391165, 'tp_mult': 1.0328307766575608, 'tsl_mult': 0.7713811931560313, 'strategy': 'mean_reversion', 'time_stop': 289, 'use_sma': False, 'use_atr': False, 'use_adx': False, 'use_ema': False, 'use_spike': False, 'rsi_required': False, 'edge_k': 0.46152699412353204, 'edge_cap': 0.4147475461289558}.
[I 2025-08-30 00:07:22,749] Trial 1362 finished with values: [-0.0423973416195933, 0.04239885111092295] and parameters: {'p_sma': 11, 'p_std': 30, 'p_atr': 7, 'p_adx': 16, 'rsi_period': 11, 'ema1': 25, 'ema2': 32, 'slip_atr_k': 0.02017994387715074, 'slip_spread_k': 0.740570575616921, 'spread_hl_frac': 0.016281833598109603, 'bb_std_mult': 2.0396422101479854, 'rsi_os': 25, 'rsi_ob': 60, 'vol_spike': 0.16162511133037025, 'adx_thresh': 23.85190955046991, 'atr_min_pct': 0.001393202226817953, 'atr_max_pct': 0.09293831626454158, 'tp_mult': 2.35406607843488, 'tsl_mult': 0.6605367708558786, 'strategy': 'mean_reversion', 'time_stop': 108, 'use_sma': False, 'use_atr': False, 'use_adx': False, 'use_ema': False, 'use_spike': False, 'rsi_required': False, 'edge_k': 0.4731342214568419, 'edge_cap': 0.7703391570944169}.
[I 2025-08-30 00:07:23,059] Trial 1360 finished with values: [-1000000000.0, 1000000000.0] and parameters: {'p_sma': 43, 'p_std': 24, 'p_atr': 7, 'p_adx': 16, 'rsi_period': 62, 'ema1': 24, 'ema2': 54, 'slip_atr_k': 0.021247766455961176, 'slip_spread_k': 0.6209197024016797, 'spread_hl_frac': 0.04784461926540879, 'bb_std_mult': 1.1834215166220092, 'rsi_os': 25, 'rsi_ob': 62, 'vol_spike': 0.12948391087084588, 'adx_thresh': 31.131631887842758, 'atr_min_pct': 0.010940685245441593, 'atr_max_pct': 0.11387652958058904, 'tp_mult': 1.8407168472292925, 'tsl_mult': 0.9780388463504713, 'strategy': 'mean_reversion', 'time_stop': 236, 'use_sma': False, 'use_atr': False, 'use_adx': False, 'use_ema': False, 'use_spike': False, 'rsi_required': False, 'edge_k': 0.4704070590662793, 'edge_cap': 0.7736624486953452}.
[I 2025-08-30 00:07:23,372] Trial 1361 finished with values: [-1000000000.0, 1000000000.0] and parameters: {'p_sma': 11, 'p_std': 24, 'p_atr': 14, 'p_adx': 16, 'rsi_period': 62, 'ema1': 15, 'ema2': 54, 'slip_atr_k': 0.11619859623652977, 'slip_spread_k': 0.7367304259730585, 'spread_hl_frac': 0.016359313915347003, 'bb_std_mult': 2.0383742246218013, 'rsi_os': 6, 'rsi_ob': 60, 'vol_spike': 0.16590413830326448, 'adx_thresh': 31.111329135361352, 'atr_min_pct': 0.022896552512801312, 'atr_max_pct': 0.06430776867100073, 'tp_mult': 2.300093271222459, 'tsl_mult': 0.9798661731315053, 'strategy': 'mean_reversion', 'time_stop': 105, 'use_sma': False, 'use_atr': False, 'use_adx': False, 'use_ema': False, 'use_spike': False, 'rsi_required': False, 'edge_k': 1.248001230755917, 'edge_cap': 0.13494831668317542}.
[I 2025-08-30 00:07:23,923] Trial 1363 finished with values: [-1000000000.0, 1000000000.0] and parameters: {'p_sma': 11, 'p_std': 23, 'p_atr': 7, 'p_adx': 16, 'rsi_period': 24, 'ema1': 25, 'ema2': 10, 'slip_atr_k': 0.18082189068624094, 'slip_spread_k': 0.8367044003698705, 'spread_hl_frac': 0.030834094973620725, 'bb_std_mult': 2.054646970241256, 'rsi_os': 25, 'rsi_ob': 60, 'vol_spike': 0.1645985604621335, 'adx_thresh': 23.839715055761573, 'atr_min_pct': 0.010430114473642756, 'atr_max_pct': 0.101176456538658, 'tp_mult': 1.7603391375575557, 'tsl_mult': 0.6851019742444574, 'strategy': 'mean_reversion', 'time_stop': 106, 'use_sma': False, 'use_atr': False, 'use_adx': False, 'use_ema': False, 'use_spike': False, 'rsi_required': False, 'edge_k': 0.5589733939414367, 'edge_cap': 0.2761085240579985}.
[I 2025-08-30 00:07:49,306] Trial 1366 finished with values: [-0.008626222306013509, 0.00862158064588298] and parameters: {'p_sma': 7, 'p_std': 22, 'p_atr': 8, 'p_adx': 16, 'rsi_period': 24, 'ema1': 25, 'ema2': 53, 'slip_atr_k': 0.025247259319025474, 'slip_spread_k': 0.8323601390364148, 'spread_hl_frac': 0.036285035589742644, 'bb_std_mult': 3.5931016625314465, 'rsi_os': 36, 'rsi_ob': 57, 'vol_spike': 0.18035224228701577, 'adx_thresh': 26.14175761986185, 'atr_min_pct': 0.0026504152720019268, 'atr_max_pct': 0.1311845418416316, 'tp_mult': 1.1817818598996634, 'tsl_mult': 0.7302827245129986, 'strategy': 'breakout', 'time_stop': 97, 'use_sma': False, 'use_atr': False, 'use_adx': False, 'use_ema': False, 'use_spike': False, 'rsi_required': False, 'edge_k': 0.5882652077206972, 'edge_cap': 0.6394871795174694}.
[I 2025-08-30 00:07:49,722] Trial 1364 finished with values: [-1000000000.0, 1000000000.0] and parameters: {'p_sma': 24, 'p_std': 22, 'p_atr': 25, 'p_adx': 16, 'rsi_period': 24, 'ema1': 29, 'ema2': 18, 'slip_atr_k': 0.02485395772146201, 'slip_spread_k': 0.8400485033172298, 'spread_hl_frac': 0.03576666947276843, 'bb_std_mult': 2.010767076950636, 'rsi_os': 28, 'rsi_ob': 65, 'vol_spike': 0.27041255097720246, 'adx_thresh': 25.46642793194344, 'atr_min_pct': 0.022878568387325274, 'atr_max_pct': 0.1357144722049917, 'tp_mult': 1.7713433249021684, 'tsl_mult': 0.7232604677719694, 'strategy': 'breakout', 'time_stop': 96, 'use_sma': False, 'use_atr': False, 'use_adx': False, 'use_ema': False, 'use_spike': False, 'rsi_required': False, 'edge_k': 0.7071232344374305, 'edge_cap': 0.7837830435280713}.
[I 2025-08-30 00:07:49,939] Trial 1365 finished with values: [-0.014780396415361219, 0.014789331726352857] and parameters: {'p_sma': 7, 'p_std': 22, 'p_atr': 25, 'p_adx': 16, 'rsi_period': 23, 'ema1': 21, 'ema2': 37, 'slip_atr_k': 0.16037168116901113, 'slip_spread_k': 0.8348635497139747, 'spread_hl_frac': 0.0009794786457409457, 'bb_std_mult': 2.018545438625856, 'rsi_os': 40, 'rsi_ob': 57, 'vol_spike': 0.27252816774720756, 'adx_thresh': 8.083257334000256, 'atr_min_pct': 0.0027757770788771094, 'atr_max_pct': 0.09257317239687379, 'tp_mult': 1.137177046667308, 'tsl_mult': 0.7196048289230046, 'strategy': 'breakout', 'time_stop': 266, 'use_sma': False, 'use_atr': False, 'use_adx': False, 'use_ema': False, 'use_spike': False, 'rsi_required': False, 'edge_k': 0.695770354235185, 'edge_cap': 0.1371466586448123}.
[I 2025-08-30 00:07:50,087] Trial 1367 finished with values: [-0.01684005191527138, 0.016860758946511834] and parameters: {'p_sma': 7, 'p_std': 22, 'p_atr': 24, 'p_adx': 16, 'rsi_period': 23, 'ema1': 18, 'ema2': 37, 'slip_atr_k': 0.07701758865534394, 'slip_spread_k': 0.8049699616991872, 'spread_hl_frac': 0.019524648600380612, 'bb_std_mult': 2.148802417821785, 'rsi_os': 39, 'rsi_ob': 90, 'vol_spike': 0.08958987069412097, 'adx_thresh': 21.530879920543544, 'atr_min_pct': 0.0019375779474952348, 'atr_max_pct': 0.10029415097953705, 'tp_mult': 1.189454648566651, 'tsl_mult': 0.7217561110884034, 'strategy': 'breakout', 'time_stop': 68, 'use_sma': False, 'use_atr': False, 'use_adx': False, 'use_ema': False, 'use_spike': False, 'rsi_required': False, 'edge_k': 0.3209278690211075, 'edge_cap': 0.8436012584250282}.
[I 2025-08-30 00:08:16,704] Trial 1368 finished with values: [-0.0049404267455631645, 0.0050649003113948975] and parameters: {'p_sma': 6, 'p_std': 25, 'p_atr': 25, 'p_adx': 16, 'rsi_period': 22, 'ema1': 17, 'ema2': 16, 'slip_atr_k': 0.15917715727426934, 'slip_spread_k': 0.8169146646330421, 'spread_hl_frac': 0.023104587530023264, 'bb_std_mult': 2.1650247637772826, 'rsi_os': 28, 'rsi_ob': 64, 'vol_spike': 0.2723602509006786, 'adx_thresh': 21.473775817594092, 'atr_min_pct': 0.0018242414709571718, 'atr_max_pct': 0.09960774150677608, 'tp_mult': 1.145022129711191, 'tsl_mult': 0.7205267294422883, 'strategy': 'breakout', 'time_stop': 70, 'use_sma': False, 'use_atr': False, 'use_adx': False, 'use_ema': False, 'use_spike': False, 'rsi_required': False, 'edge_k': 0.04443442909527484, 'edge_cap': 0.8377487069900832}.
[I 2025-08-30 00:08:16,834] Trial 1370 finished with values: [-0.005647542966303987, 0.005730422538883229] and parameters: {'p_sma': 9, 'p_std': 25, 'p_atr': 17, 'p_adx': 16, 'rsi_period': 22, 'ema1': 22, 'ema2': 22, 'slip_atr_k': 0.01723611864325416, 'slip_spread_k': 0.9235386251610882, 'spread_hl_frac': 0.019280499546934726, 'bb_std_mult': 2.164484737956466, 'rsi_os': 26, 'rsi_ob': 77, 'vol_spike': 0.1728380606327649, 'adx_thresh': 24.95072646480009, 'atr_min_pct': 0.0018351622133826171, 'atr_max_pct': 0.10040194219836926, 'tp_mult': 1.0951252050804092, 'tsl_mult': 0.7476589030655622, 'strategy': 'breakout', 'time_stop': 24, 'use_sma': False, 'use_atr': False, 'use_adx': False, 'use_ema': False, 'use_spike': False, 'rsi_required': False, 'edge_k': 0.5544623662488383, 'edge_cap': 0.8128357662316416}.
[I 2025-08-30 00:08:16,851] Trial 1371 finished with values: [-0.011095754356545529, 0.011063888175947745] and parameters: {'p_sma': 5, 'p_std': 14, 'p_atr': 22, 'p_adx': 16, 'rsi_period': 22, 'ema1': 17, 'ema2': 15, 'slip_atr_k': 0.17329352887617097, 'slip_spread_k': 0.8577914304659797, 'spread_hl_frac': 0.024001220643855993, 'bb_std_mult': 2.1761847872990336, 'rsi_os': 26, 'rsi_ob': 53, 'vol_spike': 0.19101286096002518, 'adx_thresh': 22.51103079423924, 'atr_min_pct': 0.0010837703732101476, 'atr_max_pct': 0.08253567538486205, 'tp_mult': 1.1033048603500313, 'tsl_mult': 0.3314331551673514, 'strategy': 'breakout', 'time_stop': 123, 'use_sma': False, 'use_atr': False, 'use_adx': False, 'use_ema': False, 'use_spike': False, 'rsi_required': False, 'edge_k': 1.3414095565664539, 'edge_cap': 0.8027475309403114}.
[I 2025-08-30 00:08:16,964] Trial 1369 finished with values: [-1000000000.0, 1000000000.0] and parameters: {'p_sma': 6, 'p_std': 27, 'p_atr': 24, 'p_adx': 7, 'rsi_period': 35, 'ema1': 23, 'ema2': 52, 'slip_atr_k': 0.19308302925987303, 'slip_spread_k': 0.5737262843852836, 'spread_hl_frac': 0.01966705120037833, 'bb_std_mult': 2.3260561630342376, 'rsi_os': 19, 'rsi_ob': 90, 'vol_spike': 0.1388949099864799, 'adx_thresh': 7.997895917827291, 'atr_min_pct': 0.008690448978212795, 'atr_max_pct': 0.1003553008775392, 'tp_mult': 1.1452178856199138, 'tsl_mult': 0.7388398543023685, 'strategy': 'breakout', 'time_stop': 123, 'use_sma': False, 'use_atr': False, 'use_adx': False, 'use_ema': False, 'use_spike': False, 'rsi_required': False, 'edge_k': 1.160539796793256, 'edge_cap': 0.8408944150647221}.
[I 2025-08-30 00:08:17,272] Trial 1374 finished with values: [-1000000000.0, 1000000000.0] and parameters: {'p_sma': 56, 'p_std': 27, 'p_atr': 24, 'p_adx': 15, 'rsi_period': 47, 'ema1': 24, 'ema2': 52, 'slip_atr_k': 0.19269082213486677, 'slip_spread_k': 0.42733193559180704, 'spread_hl_frac': 0.017534263718922537, 'bb_std_mult': 1.708920395230785, 'rsi_os': 34, 'rsi_ob': 71, 'vol_spike': 0.07467719425894208, 'adx_thresh': 25.873276445316613, 'atr_min_pct': 0.018543316579770316, 'atr_max_pct': 0.013563756036958932, 'tp_mult': 1.071215700808166, 'tsl_mult': 0.12301747728064072, 'strategy': 'breakout', 'time_stop': 89, 'use_sma': False, 'use_atr': False, 'use_adx': False, 'use_ema': False, 'use_spike': False, 'rsi_required': False, 'edge_k': 1.1408341470715468, 'edge_cap': 0.752276042669111}.
[I 2025-08-30 00:08:42,486] Trial 1372 finished with values: [-1000000000.0, 1000000000.0] and parameters: {'p_sma': 9, 'p_std': 17, 'p_atr': 21, 'p_adx': 15, 'rsi_period': 52, 'ema1': 24, 'ema2': 52, 'slip_atr_k': 0.1707610442920692, 'slip_spread_k': 0.377951472150754, 'spread_hl_frac': 0.01764581525995878, 'bb_std_mult': 2.254340311178012, 'rsi_os': 18, 'rsi_ob': 56, 'vol_spike': 0.06882684519398431, 'adx_thresh': 29.598472786568827, 'atr_min_pct': 0.029135175949002036, 'atr_max_pct': 0.08271717043683202, 'tp_mult': 1.085732299537027, 'tsl_mult': 0.745815347818474, 'strategy': 'breakout', 'time_stop': 34, 'use_sma': False, 'use_atr': False, 'use_adx': False, 'use_ema': False, 'use_spike': False, 'rsi_required': False, 'edge_k': 0.8237085943734401, 'edge_cap': 0.09707605378000084}.
[I 2025-08-30 00:08:42,625] Trial 1373 finished with values: [-1000000000.0, 1000000000.0] and parameters: {'p_sma': 8, 'p_std': 49, 'p_atr': 24, 'p_adx': 7, 'rsi_period': 56, 'ema1': 24, 'ema2': 52, 'slip_atr_k': 0.1988912790873364, 'slip_spread_k': 0.06814341178430111, 'spread_hl_frac': 0.017542286062639453, 'bb_std_mult': 2.3472751686301923, 'rsi_os': 10, 'rsi_ob': 46, 'vol_spike': 0.03296562051699557, 'adx_thresh': 25.810915258786935, 'atr_min_pct': 0.023489547258153054, 'atr_max_pct': 0.09508396098466898, 'tp_mult': 1.0740393734094158, 'tsl_mult': 0.6896282967247063, 'strategy': 'breakout', 'time_stop': 14, 'use_sma': False, 'use_atr': False, 'use_adx': False, 'use_ema': False, 'use_spike': False, 'rsi_required': False, 'edge_k': 0.36442900674682466, 'edge_cap': 0.5513218899375766}.
[I 2025-08-30 00:08:43,144] Trial 1375 finished with values: [-1000000000.0, 1000000000.0] and parameters: {'p_sma': 8, 'p_std': 28, 'p_atr': 21, 'p_adx': 15, 'rsi_period': 18, 'ema1': 12, 'ema2': 57, 'slip_atr_k': 0.24474657722224444, 'slip_spread_k': 0.7890329084323219, 'spread_hl_frac': 0.017749299263971494, 'bb_std_mult': 1.9823243854592105, 'rsi_os': 24, 'rsi_ob': 67, 'vol_spike': 0.03723916648225711, 'adx_thresh': 29.732989359898923, 'atr_min_pct': 0.014674625471251708, 'atr_max_pct': 0.020339370877141244, 'tp_mult': 1.012426342164819, 'tsl_mult': 0.6862168606733732, 'strategy': 'breakout', 'time_stop': 166, 'use_sma': False, 'use_atr': False, 'use_adx': False, 'use_ema': False, 'use_spike': False, 'rsi_required': False, 'edge_k': 0.412985129907122, 'edge_cap': 0.5458330347695471}.
[I 2025-08-30 00:08:43,816] Trial 1376 finished with values: [-1000000000.0, 1000000000.0] and parameters: {'p_sma': 45, 'p_std': 49, 'p_atr': 21, 'p_adx': 15, 'rsi_period': 52, 'ema1': 12, 'ema2': 57, 'slip_atr_k': 0.2444980953739085, 'slip_spread_k': 0.37287789240344105, 'spread_hl_frac': 0.013119889777634758, 'bb_std_mult': 2.5841309728235564, 'rsi_os': 10, 'rsi_ob': 61, 'vol_spike': 0.179628360314131, 'adx_thresh': 17.354140867137698, 'atr_min_pct': 0.014642198192524896, 'atr_max_pct': 0.08684573143385335, 'tp_mult': 1.2192974239581649, 'tsl_mult': 0.6907062384590539, 'strategy': 'breakout', 'time_stop': 33, 'use_sma': False, 'use_atr': False, 'use_adx': False, 'use_ema': False, 'use_spike': False, 'rsi_required': False, 'edge_k': 0.36077076908628225, 'edge_cap': 0.4438462032758123}.
