[I 2025-08-29 23:18:44,037] Trial 916 finished with values: [-0.025619767482740974, 0.02552332108072144] and parameters: {'p_sma': 47, 'p_std': 27, 'p_atr': 24, 'p_adx': 18, 'rsi_period': 20, 'ema1': 18, 'ema2': 58, 'slip_atr_k': 0.20906125151683552, 'slip_spread_k': 0.6541947250122196, 'spread_hl_frac': 0.019577292742747603, 'bb_std_mult': 1.2868241009642345, 'rsi_os': 37, 'rsi_ob': 51, 'vol_spike': 0.19352816370309817, 'adx_thresh': 10.022310041337747, 'atr_min_pct': 0.0032980944599645757, 'atr_max_pct': 0.09126358075852825, 'tp_mult': 1.9000970271309108, 'tsl_mult': 0.7298939252879546, 'strategy': 'mean_reversion', 'time_stop': 52, 'use_sma': False, 'use_atr': False, 'use_adx': False, 'use_ema': False, 'use_spike': False, 'rsi_required': False, 'edge_k': 0.21848468000440036, 'edge_cap': 0.7973392861267226}.
[I 2025-08-29 23:19:10,988] Trial 920 finished with values: [-1000000000.0, 1000000000.0] and parameters: {'p_sma': 5, 'p_std': 29, 'p_atr': 24, 'p_adx': 9, 'rsi_period': 21, 'ema1': 23, 'ema2': 55, 'slip_atr_k': 0.009264213429012602, 'slip_spread_k': 0.8100264890397397, 'spread_hl_frac': 0.027173104582821666, 'bb_std_mult': 2.3103615084217934, 'rsi_os': 24, 'rsi_ob': 59, 'vol_spike': 0.11863936991492163, 'adx_thresh': 19.822210805803266, 'atr_min_pct': 0.0025146743430210484, 'atr_max_pct': 0.10276112832529227, 'tp_mult': 1.4746379289285567, 'tsl_mult': 0.7546631425052692, 'strategy': 'breakout', 'time_stop': 92, 'use_sma': False, 'use_atr': False, 'use_adx': False, 'use_ema': False, 'use_spike': False, 'rsi_required': False, 'edge_k': 0.5079714860298269, 'edge_cap': 0.7817254677658275}.
[I 2025-08-29 23:19:11,431] Trial 919 finished with values: [-1000000000.0, 1000000000.0] and parameters: {'p_sma': 32, 'p_std': 51, 'p_atr': 24, 'p_adx': 15, 'rsi_period': 57, 'ema1': 13, 'ema2': 32, 'slip_atr_k': 0.023451986262379616, 'slip_spread_k': 0.6428576830139001, 'spread_hl_frac': 0.019961383506720186, 'bb_std_mult': 1.2967135777228687, 'rsi_os': 35, 'rsi_ob': 59, 'vol_spike': 0.1916321656064802, 'adx_thresh': 20.00819705363507, 'atr_min_pct': 0.022863382736214743, 'atr_max_pct': 0.09594797574584285, 'tp_mult': 1.1109768693838968, 'tsl_mult': 0.7367948076012947, 'strategy': 'mean_reversion', 'time_stop': 16, 'use_sma': False, 'use_atr': False, 'use_adx': False, 'use_ema': False, 'use_spike': False, 'rsi_required': False, 'edge_k': 0.6755547977552543, 'edge_cap': 0.6896645769548988}.
[I 2025-08-29 23:19:11,553] Trial 922 finished with values: [-1000000000.0, 1000000000.0] and parameters: {'p_sma': 5, 'p_std': 25, 'p_atr': 17, 'p_adx': 15, 'rsi_period': 69, 'ema1': 6, 'ema2': 53, 'slip_atr_k': 0.00858135991006976, 'slip_spread_k': 0.8061667873095562, 'spread_hl_frac': 0.0013833043887843711, 'bb_std_mult': 2.1341145606644227, 'rsi_os': 16, 'rsi_ob': 84, 'vol_spike': 0.12202979312860412, 'adx_thresh': 20.198910469203202, 'atr_min_pct': 0.01669474597293394, 'atr_max_pct': 0.10236863664813467, 'tp_mult': 1.1274525614905389, 'tsl_mult': 0.9778120685689586, 'strategy': 'breakout', 'time_stop': 90, 'use_sma': False, 'use_atr': False, 'use_adx': False, 'use_ema': False, 'use_spike': False, 'rsi_required': False, 'edge_k': 0.5071154365832512, 'edge_cap': 0.32246772626206066}.
[I 2025-08-29 23:19:11,622] Trial 921 finished with values: [-1000000000.0, 1000000000.0] and parameters: {'p_sma': 5, 'p_std': 22, 'p_atr': 24, 'p_adx': 15, 'rsi_period': 59, 'ema1': 18, 'ema2': 46, 'slip_atr_k': 0.01097500006015555, 'slip_spread_k': 0.8076515180041363, 'spread_hl_frac': 0.04764009675774448, 'bb_std_mult': 1.2805520484339459, 'rsi_os': 8, 'rsi_ob': 59, 'vol_spike': 0.28491918362407703, 'adx_thresh': 31.44065098055069, 'atr_min_pct': 0.025534235645005295, 'atr_max_pct': 0.07743726249957411, 'tp_mult': 1.1188826820402444, 'tsl_mult': 0.26873271339069005, 'strategy': 'breakout', 'time_stop': 94, 'use_sma': False, 'use_atr': False, 'use_adx': False, 'use_ema': False, 'use_spike': False, 'rsi_required': False, 'edge_k': 0.22066637877798378, 'edge_cap': 0.7863959648535083}.
[I 2025-08-29 23:19:38,126] Trial 925 finished with values: [-0.002513094420860229, 0.0026282106782302066] and parameters: {'p_sma': 8, 'p_std': 22, 'p_atr': 23, 'p_adx': 13, 'rsi_period': 63, 'ema1': 23, 'ema2': 26, 'slip_atr_k': 0.016200767256114003, 'slip_spread_k': 0.501273045316652, 'spread_hl_frac': 0.02385467218227272, 'bb_std_mult': 1.8152539127622676, 'rsi_os': 26, 'rsi_ob': 63, 'vol_spike': 0.2042988122945186, 'adx_thresh': 24.638129992936467, 'atr_min_pct': 0.0017711852781055505, 'atr_max_pct': 0.0799736395565376, 'tp_mult': 2.7289244901933505, 'tsl_mult': 0.6930960966026027, 'strategy': 'breakout', 'time_stop': 99, 'use_sma': False, 'use_atr': False, 'use_adx': False, 'use_ema': False, 'use_spike': False, 'rsi_required': False, 'edge_k': 0.6106142076106652, 'edge_cap': 0.43413747777601996}.
[I 2025-08-29 23:19:38,412] Trial 926 finished with values: [-0.04279761507439139, 0.042792857308491826] and parameters: {'p_sma': 39, 'p_std': 12, 'p_atr': 30, 'p_adx': 16, 'rsi_period': 7, 'ema1': 24, 'ema2': 14, 'slip_atr_k': 0.028135818369610405, 'slip_spread_k': 0.9966896090948496, 'spread_hl_frac': 0.017582382158678113, 'bb_std_mult': 1.8074292159907475, 'rsi_os': 26, 'rsi_ob': 56, 'vol_spike': 0.17012297499008353, 'adx_thresh': 26.546426128809355, 'atr_min_pct': 0.0017671590771197458, 'atr_max_pct': 0.11384526933056409, 'tp_mult': 2.6490349633527233, 'tsl_mult': 0.8523562872890561, 'strategy': 'breakout', 'time_stop': 116, 'use_sma': False, 'use_atr': False, 'use_adx': False, 'use_ema': False, 'use_spike': False, 'rsi_required': False, 'edge_k': 0.6149937522479738, 'edge_cap': 0.23957350529864924}.
[I 2025-08-29 23:19:38,701] Trial 923 finished with values: [-1000000000.0, 1000000000.0] and parameters: {'p_sma': 6, 'p_std': 41, 'p_atr': 23, 'p_adx': 25, 'rsi_period': 23, 'ema1': 6, 'ema2': 46, 'slip_atr_k': 0.023135680997584257, 'slip_spread_k': 0.8044385560989274, 'spread_hl_frac': 0.017498042285972144, 'bb_std_mult': 2.133284954805563, 'rsi_os': 7, 'rsi_ob': 83, 'vol_spike': 0.22619157929590566, 'adx_thresh': 13.484429883967987, 'atr_min_pct': 0.016938216557667626, 'atr_max_pct': 0.09723199027771394, 'tp_mult': 1.12405838816048, 'tsl_mult': 0.9027913363257754, 'strategy': 'breakout', 'time_stop': 100, 'use_sma': False, 'use_atr': False, 'use_adx': False, 'use_ema': False, 'use_spike': False, 'rsi_required': False, 'edge_k': 0.6029564982988757, 'edge_cap': 0.7130976790001352}.
[I 2025-08-29 23:19:38,702] Trial 924 finished with values: [-0.008753679484143517, 0.008729573300400747] and parameters: {'p_sma': 37, 'p_std': 25, 'p_atr': 23, 'p_adx': 17, 'rsi_period': 68, 'ema1': 24, 'ema2': 26, 'slip_atr_k': 0.028643584841971003, 'slip_spread_k': 0.8017851162020047, 'spread_hl_frac': 0.047736600817512076, 'bb_std_mult': 2.1445617189873785, 'rsi_os': 7, 'rsi_ob': 83, 'vol_spike': 0.29960000684914834, 'adx_thresh': 16.404421473035427, 'atr_min_pct': 0.0016137310409150857, 'atr_max_pct': 0.09998253722973886, 'tp_mult': 1.1585195228436607, 'tsl_mult': 0.8969587120922398, 'strategy': 'breakout', 'time_stop': 99, 'use_sma': False, 'use_atr': False, 'use_adx': False, 'use_ema': False, 'use_spike': False, 'rsi_required': False, 'edge_k': 0.5390903757816012, 'edge_cap': 0.4444294996044142}.
[I 2025-08-29 23:20:06,106] Trial 927 finished with values: [-1000000000.0, 1000000000.0] and parameters: {'p_sma': 7, 'p_std': 26, 'p_atr': 12, 'p_adx': 27, 'rsi_period': 24, 'ema1': 24, 'ema2': 19, 'slip_atr_k': 0.029116687069359888, 'slip_spread_k': 0.7038508651746169, 'spread_hl_frac': 0.01763893606891345, 'bb_std_mult': 1.807341009543645, 'rsi_os': 26, 'rsi_ob': 56, 'vol_spike': 0.1697803621784144, 'adx_thresh': 24.770822403702148, 'atr_min_pct': 0.02174486071518343, 'atr_max_pct': 0.07994927775502118, 'tp_mult': 1.2349531480348457, 'tsl_mult': 0.8627799743190079, 'strategy': 'breakout', 'time_stop': 115, 'use_sma': False, 'use_atr': False, 'use_adx': False, 'use_ema': False, 'use_spike': False, 'rsi_required': False, 'edge_k': 0.6049672879065506, 'edge_cap': 0.7692891833041657}.
[I 2025-08-29 23:20:06,225] Trial 928 finished with values: [-1000000000.0, 1000000000.0] and parameters: {'p_sma': 7, 'p_std': 25, 'p_atr': 7, 'p_adx': 25, 'rsi_period': 30, 'ema1': 24, 'ema2': 52, 'slip_atr_k': 0.03523182275821559, 'slip_spread_k': 0.5185891477198536, 'spread_hl_frac': 0.017927680703562918, 'bb_std_mult': 2.1068822693019724, 'rsi_os': 7, 'rsi_ob': 73, 'vol_spike': 0.17999315448604883, 'adx_thresh': 24.766723185707235, 'atr_min_pct': 0.002457647815161553, 'atr_max_pct': 0.026872471038291337, 'tp_mult': 1.2348181452374494, 'tsl_mult': 0.9021000056654496, 'strategy': 'breakout', 'time_stop': 104, 'use_sma': False, 'use_atr': False, 'use_adx': False, 'use_ema': False, 'use_spike': False, 'rsi_required': False, 'edge_k': 0.7550917458234884, 'edge_cap': 0.8206081472273944}.
[I 2025-08-29 23:20:06,423] Trial 929 finished with values: [-0.003265313005407, 0.003424938976872847] and parameters: {'p_sma': 22, 'p_std': 22, 'p_atr': 7, 'p_adx': 8, 'rsi_period': 17, 'ema1': 19, 'ema2': 18, 'slip_atr_k': 0.016238054217158557, 'slip_spread_k': 0.8805952444626366, 'spread_hl_frac': 0.018715819775379727, 'bb_std_mult': 2.054162919894654, 'rsi_os': 15, 'rsi_ob': 63, 'vol_spike': 0.20095335673191012, 'adx_thresh': 11.610080923520371, 'atr_min_pct': 0.004241635443691434, 'atr_max_pct': 0.094418715271278, 'tp_mult': 1.765549254061363, 'tsl_mult': 0.100904653896082, 'strategy': 'breakout', 'time_stop': 127, 'use_sma': False, 'use_atr': False, 'use_adx': False, 'use_ema': False, 'use_spike': False, 'rsi_required': False, 'edge_k': 0.4591408164700044, 'edge_cap': 0.6141477020585664}.
[I 2025-08-29 23:20:06,537] Trial 930 finished with values: [-1000000000.0, 1000000000.0] and parameters: {'p_sma': 7, 'p_std': 26, 'p_atr': 7, 'p_adx': 17, 'rsi_period': 17, 'ema1': 19, 'ema2': 54, 'slip_atr_k': 0.016749684116224614, 'slip_spread_k': 0.8256889097472748, 'spread_hl_frac': 0.004026216247331509, 'bb_std_mult': 0.6113578227653265, 'rsi_os': 15, 'rsi_ob': 61, 'vol_spike': 0.18128757951978705, 'adx_thresh': 24.92010671626605, 'atr_min_pct': 0.004425114355497807, 'atr_max_pct': 0.10844781934429167, 'tp_mult': 1.2361111779163028, 'tsl_mult': 0.682705887835384, 'strategy': 'breakout', 'time_stop': 111, 'use_sma': False, 'use_atr': False, 'use_adx': False, 'use_ema': False, 'use_spike': False, 'rsi_required': False, 'edge_k': 0.4550064470673967, 'edge_cap': 0.19459756630655434}.
[I 2025-08-29 23:20:33,694] Trial 934 finished with values: [-1000000000.0, 1000000000.0] and parameters: {'p_sma': 12, 'p_std': 11, 'p_atr': 15, 'p_adx': 13, 'rsi_period': 73, 'ema1': 24, 'ema2': 11, 'slip_atr_k': 0.020306996352636133, 'slip_spread_k': 0.7615631840028412, 'spread_hl_frac': 0.023189001978370507, 'bb_std_mult': 1.97766768625206, 'rsi_os': 24, 'rsi_ob': 62, 'vol_spike': 0.18838716596423147, 'adx_thresh': 25.677526234943016, 'atr_min_pct': 0.010515244988713405, 'atr_max_pct': 0.04913710710279079, 'tp_mult': 1.0697317070685022, 'tsl_mult': 0.06173699258139337, 'strategy': 'mean_reversion', 'time_stop': 195, 'use_sma': False, 'use_atr': False, 'use_adx': False, 'use_ema': False, 'use_spike': False, 'rsi_required': False, 'edge_k': 0.3871072084380591, 'edge_cap': 0.803701626386519}.
[I 2025-08-29 23:20:33,730] Trial 933 finished with values: [-0.022163221978877434, 0.022144263571781786] and parameters: {'p_sma': 28, 'p_std': 59, 'p_atr': 23, 'p_adx': 17, 'rsi_period': 55, 'ema1': 23, 'ema2': 54, 'slip_atr_k': 0.019266043148489585, 'slip_spread_k': 0.40862951837396816, 'spread_hl_frac': 0.021472775968517793, 'bb_std_mult': 3.4616079513233347, 'rsi_os': 18, 'rsi_ob': 58, 'vol_spike': 0.18332921174744046, 'adx_thresh': 25.81433485175709, 'atr_min_pct': 0.0009197595193534444, 'atr_max_pct': 0.09938662251812784, 'tp_mult': 1.077856329324798, 'tsl_mult': 0.689922555770556, 'strategy': 'mean_reversion', 'time_stop': 110, 'use_sma': False, 'use_atr': False, 'use_adx': False, 'use_ema': False, 'use_spike': False, 'rsi_required': False, 'edge_k': 0.9850155766727026, 'edge_cap': 0.8063332788743447}.
[I 2025-08-29 23:20:33,872] Trial 931 finished with values: [-0.0034971402576062793, 0.003558890074180389] and parameters: {'p_sma': 28, 'p_std': 23, 'p_atr': 22, 'p_adx': 17, 'rsi_period': 73, 'ema1': 23, 'ema2': 10, 'slip_atr_k': 0.016741992422909517, 'slip_spread_k': 0.8808169085720344, 'spread_hl_frac': 0.01890250135264835, 'bb_std_mult': 3.378442973243821, 'rsi_os': 24, 'rsi_ob': 61, 'vol_spike': 0.20479321140177856, 'adx_thresh': 25.725141069336576, 'atr_min_pct': 0.0024725671910338157, 'atr_max_pct': 0.06440588677946683, 'tp_mult': 1.2882626816998775, 'tsl_mult': 0.6354242950131588, 'strategy': 'breakout', 'time_stop': 184, 'use_sma': False, 'use_atr': False, 'use_adx': False, 'use_ema': False, 'use_spike': False, 'rsi_required': False, 'edge_k': 1.3057405099953734, 'edge_cap': 0.8066231014109875}.
[I 2025-08-29 23:20:33,883] Trial 932 finished with values: [-0.01310526885455654, 0.013084811359094447] and parameters: {'p_sma': 8, 'p_std': 11, 'p_atr': 28, 'p_adx': 17, 'rsi_period': 20, 'ema1': 23, 'ema2': 54, 'slip_atr_k': 0.01849143391065602, 'slip_spread_k': 0.4077143347457985, 'spread_hl_frac': 0.004047338588214034, 'bb_std_mult': 0.5697153767295335, 'rsi_os': 18, 'rsi_ob': 62, 'vol_spike': 0.18335707041615398, 'adx_thresh': 11.591080368327415, 'atr_min_pct': 0.0007072505651518964, 'atr_max_pct': 0.09469009740421985, 'tp_mult': 1.061114777986339, 'tsl_mult': 0.6290099185687139, 'strategy': 'breakout', 'time_stop': 108, 'use_sma': False, 'use_atr': False, 'use_adx': False, 'use_ema': False, 'use_spike': False, 'rsi_required': False, 'edge_k': 1.311418755893313, 'edge_cap': 0.6124039865052696}.
[I 2025-08-29 23:21:00,917] Trial 938 finished with values: [-0.021595300741802048, 0.021602395234093612] and parameters: {'p_sma': 8, 'p_std': 55, 'p_atr': 23, 'p_adx': 28, 'rsi_period': 64, 'ema1': 25, 'ema2': 57, 'slip_atr_k': 0.24507652217332254, 'slip_spread_k': 0.9263170317520573, 'spread_hl_frac': 0.01510113930024216, 'bb_std_mult': 2.0476312161318275, 'rsi_os': 52, 'rsi_ob': 60, 'vol_spike': 0.1738726194284742, 'adx_thresh': 9.298743238777202, 'atr_min_pct': 0.001998024047570231, 'atr_max_pct': 0.11714109136385209, 'tp_mult': 2.1949980643446674, 'tsl_mult': 0.17269995521109782, 'strategy': 'breakout', 'time_stop': 122, 'use_sma': False, 'use_atr': False, 'use_adx': False, 'use_ema': False, 'use_spike': False, 'rsi_required': False, 'edge_k': 0.5497757239306443, 'edge_cap': 0.7724062923558739}.
[I 2025-08-29 23:21:01,115] Trial 936 finished with values: [-0.007960639614900678, 0.008091932593429253] and parameters: {'p_sma': 30, 'p_std': 24, 'p_atr': 28, 'p_adx': 16, 'rsi_period': 77, 'ema1': 23, 'ema2': 57, 'slip_atr_k': 0.24657773700126878, 'slip_spread_k': 0.09581545470037228, 'spread_hl_frac': 0.015288842092265931, 'bb_std_mult': 2.407156817772485, 'rsi_os': 30, 'rsi_ob': 60, 'vol_spike': 0.1492166021519438, 'adx_thresh': 24.124514410237524, 'atr_min_pct': 0.0022838689545863987, 'atr_max_pct': 0.09600670976937774, 'tp_mult': 2.178206507509535, 'tsl_mult': 0.757632594615951, 'strategy': 'breakout', 'time_stop': 105, 'use_sma': False, 'use_atr': False, 'use_adx': False, 'use_ema': False, 'use_spike': False, 'rsi_required': False, 'edge_k': 0.5515505264661201, 'edge_cap': 0.9807777568554413}.
[I 2025-08-29 23:21:01,267] Trial 935 finished with values: [-1000000000.0, 1000000000.0] and parameters: {'p_sma': 8, 'p_std': 24, 'p_atr': 22, 'p_adx': 16, 'rsi_period': 63, 'ema1': 23, 'ema2': 57, 'slip_atr_k': 0.013910729906236312, 'slip_spread_k': 0.49821797861805306, 'spread_hl_frac': 0.015898582235585667, 'bb_std_mult': 1.87453067725357, 'rsi_os': 31, 'rsi_ob': 60, 'vol_spike': 0.1758159696821987, 'adx_thresh': 23.791193705456536, 'atr_min_pct': 0.0025681387498710595, 'atr_max_pct': 0.09672330510265856, 'tp_mult': 1.158094908044025, 'tsl_mult': 0.35828662749287943, 'strategy': 'breakout', 'time_stop': 103, 'use_sma': False, 'use_atr': False, 'use_adx': False, 'use_ema': False, 'use_spike': False, 'rsi_required': False, 'edge_k': 0.5469026350052663, 'edge_cap': 0.7738432958533816}.
[I 2025-08-29 23:21:01,358] Trial 937 finished with values: [-0.0115599947290288, 0.011819580989476856] and parameters: {'p_sma': 31, 'p_std': 32, 'p_atr': 23, 'p_adx': 16, 'rsi_period': 21, 'ema1': 10, 'ema2': 35, 'slip_atr_k': 0.013673845874480645, 'slip_spread_k': 0.8419495184140275, 'spread_hl_frac': 0.03266256619549389, 'bb_std_mult': 2.0420265346132385, 'rsi_os': 30, 'rsi_ob': 87, 'vol_spike': 0.17567167216595744, 'adx_thresh': 23.521667779534532, 'atr_min_pct': 0.0027046275336451717, 'atr_max_pct': 0.10526402235141025, 'tp_mult': 1.1580954807467925, 'tsl_mult': 0.16349104709553447, 'strategy': 'breakout', 'time_stop': 120, 'use_sma': False, 'use_atr': False, 'use_adx': False, 'use_ema': False, 'use_spike': False, 'rsi_required': False, 'edge_k': 1.5014913304888704, 'edge_cap': 0.5736085908536613}.
[I 2025-08-29 23:21:01,628] Trial 940 finished with values: [-1000000000.0, 1000000000.0] and parameters: {'p_sma': 10, 'p_std': 29, 'p_atr': 23, 'p_adx': 16, 'rsi_period': 15, 'ema1': 10, 'ema2': 21, 'slip_atr_k': 0.04395466832862868, 'slip_spread_k': 0.492707595481522, 'spread_hl_frac': 0.038184669125735024, 'bb_std_mult': 1.0942860249565307, 'rsi_os': 23, 'rsi_ob': 45, 'vol_spike': 0.1326034227638522, 'adx_thresh': 26.569448111331752, 'atr_min_pct': 0.0028673091878144924, 'atr_max_pct': 0.10518348225881402, 'tp_mult': 1.1576316237254718, 'tsl_mult': 0.3423713548926368, 'strategy': 'mean_reversion', 'time_stop': 118, 'use_sma': False, 'use_atr': False, 'use_adx': False, 'use_ema': False, 'use_spike': False, 'rsi_required': False, 'edge_k': 1.8809358835539283, 'edge_cap': 0.7412350284968416}.
[I 2025-08-29 23:21:28,851] Trial 942 finished with values: [-1000000000.0, 1000000000.0] and parameters: {'p_sma': 11, 'p_std': 28, 'p_atr': 23, 'p_adx': 15, 'rsi_period': 15, 'ema1': 24, 'ema2': 55, 'slip_atr_k': 0.04124266269682485, 'slip_spread_k': 0.8408384573145402, 'spread_hl_frac': 0.016882474309394546, 'bb_std_mult': 2.8707962904474233, 'rsi_os': 27, 'rsi_ob': 58, 'vol_spike': 0.19693225539125453, 'adx_thresh': 26.51991643052286, 'atr_min_pct': 0.02725915010131487, 'atr_max_pct': 0.04612070866260692, 'tp_mult': 2.4060019039912084, 'tsl_mult': 0.7269758566203288, 'strategy': 'mean_reversion', 'time_stop': 171, 'use_sma': False, 'use_atr': False, 'use_adx': False, 'use_ema': False, 'use_spike': False, 'rsi_required': False, 'edge_k': 0.505736427315316, 'edge_cap': 0.833925746969866}.
[I 2025-08-29 23:21:28,895] Trial 939 finished with values: [-0.004025302669819042, 0.00436850626531881] and parameters: {'p_sma': 11, 'p_std': 32, 'p_atr': 23, 'p_adx': 16, 'rsi_period': 19, 'ema1': 10, 'ema2': 55, 'slip_atr_k': 0.04333054671788028, 'slip_spread_k': 0.8295406767508239, 'spread_hl_frac': 0.016015350996655593, 'bb_std_mult': 1.9071465796617761, 'rsi_os': 27, 'rsi_ob': 60, 'vol_spike': 0.09595411880121588, 'adx_thresh': 24.26398524818356, 'atr_min_pct': 0.0024861201361183107, 'atr_max_pct': 0.105066366159068, 'tp_mult': 2.550286995262322, 'tsl_mult': 0.35664795524179593, 'strategy': 'breakout', 'time_stop': 104, 'use_sma': False, 'use_atr': False, 'use_adx': False, 'use_ema': False, 'use_spike': False, 'rsi_required': False, 'edge_k': 1.7581940596226402, 'edge_cap': 0.7375425065139514}.
[I 2025-08-29 23:21:29,028] Trial 941 finished with values: [-1000000000.0, 1000000000.0] and parameters: {'p_sma': 10, 'p_std': 31, 'p_atr': 23, 'p_adx': 7, 'rsi_period': 84, 'ema1': 24, 'ema2': 21, 'slip_atr_k': 0.011441337312158087, 'slip_spread_k': 0.841533884615024, 'spread_hl_frac': 0.038118795073083925, 'bb_std_mult': 2.905805992141768, 'rsi_os': 27, 'rsi_ob': 58, 'vol_spike': 0.19532752263964567, 'adx_thresh': 34.07631394734953, 'atr_min_pct': 0.027421501568027626, 'atr_max_pct': 0.13757957478185348, 'tp_mult': 2.407995452343978, 'tsl_mult': 0.7238533703902796, 'strategy': 'mean_reversion', 'time_stop': 119, 'use_sma': False, 'use_atr': False, 'use_adx': False, 'use_ema': False, 'use_spike': False, 'rsi_required': False, 'edge_k': 0.49483418321274864, 'edge_cap': 0.7374966806150178}.
[I 2025-08-29 23:21:29,260] Trial 943 finished with values: [-0.0362553663213655, 0.036224461345447316] and parameters: {'p_sma': 40, 'p_std': 16, 'p_atr': 23, 'p_adx': 11, 'rsi_period': 18, 'ema1': 24, 'ema2': 51, 'slip_atr_k': 0.1513055326432387, 'slip_spread_k': 0.7857833172630369, 'spread_hl_frac': 0.0416177307716977, 'bb_std_mult': 1.911330207236573, 'rsi_os': 27, 'rsi_ob': 58, 'vol_spike': 0.19555552772475576, 'adx_thresh': 25.225062498603602, 'atr_min_pct': 0.0017967475476263137, 'atr_max_pct': 0.04569358961009508, 'tp_mult': 2.4135078262603633, 'tsl_mult': 0.7203349029629663, 'strategy': 'breakout', 'time_stop': 23, 'use_sma': False, 'use_atr': False, 'use_adx': False, 'use_ema': False, 'use_spike': False, 'rsi_required': False, 'edge_k': 0.5041810803119646, 'edge_cap': 0.4940713675679641}.
[I 2025-08-29 23:21:56,288] Trial 946 finished with values: [-1000000000.0, 1000000000.0] and parameters: {'p_sma': 36, 'p_std': 40, 'p_atr': 22, 'p_adx': 15, 'rsi_period': 82, 'ema1': 25, 'ema2': 44, 'slip_atr_k': 0.023580453415674836, 'slip_spread_k': 0.7724200465855203, 'spread_hl_frac': 2.5510301228333365e-05, 'bb_std_mult': 2.550611956240402, 'rsi_os': 28, 'rsi_ob': 61, 'vol_spike': 0.1907194467657466, 'adx_thresh': 25.257160679091122, 'atr_min_pct': 0.02985011229434292, 'atr_max_pct': 0.08832126065584352, 'tp_mult': 1.6644358820952672, 'tsl_mult': 0.7725253220959187, 'strategy': 'breakout', 'time_stop': 112, 'use_sma': False, 'use_atr': False, 'use_adx': False, 'use_ema': False, 'use_spike': False, 'rsi_required': False, 'edge_k': 0.4421974872783671, 'edge_cap': 0.4821502549256321}.
