[I 2025-08-29 23:21:56,725] Trial 945 finished with values: [-1000000000.0, 1000000000.0] and parameters: {'p_sma': 6, 'p_std': 26, 'p_atr': 24, 'p_adx': 7, 'rsi_period': 22, 'ema1': 24, 'ema2': 51, 'slip_atr_k': 0.024412445333497977, 'slip_spread_k': 0.7749891165600996, 'spread_hl_frac': 0.018302162136888064, 'bb_std_mult': 1.9679939983769759, 'rsi_os': 32, 'rsi_ob': 57, 'vol_spike': 0.1900675825635071, 'adx_thresh': 25.360304999401297, 'atr_min_pct': 0.0037309475332398256, 'atr_max_pct': 0.04015967187337501, 'tp_mult': 1.1028084262926847, 'tsl_mult': 0.7167891707847102, 'strategy': 'breakout', 'time_stop': 219, 'use_sma': False, 'use_atr': False, 'use_adx': False, 'use_ema': False, 'use_spike': False, 'rsi_required': False, 'edge_k': 1.1319491979621872, 'edge_cap': 0.6667853051793915}.
[I 2025-08-29 23:21:56,795] Trial 944 finished with values: [-0.009416053501745458, 0.009355221123995817] and parameters: {'p_sma': 34, 'p_std': 26, 'p_atr': 22, 'p_adx': 15, 'rsi_period': 19, 'ema1': 24, 'ema2': 51, 'slip_atr_k': 0.1507344871908046, 'slip_spread_k': 0.7874530798653573, 'spread_hl_frac': 0.030198180695293744, 'bb_std_mult': 1.9120220053706118, 'rsi_os': 27, 'rsi_ob': 69, 'vol_spike': 0.19084770000488974, 'adx_thresh': 32.76119052303098, 'atr_min_pct': 0.0038295062112989305, 'atr_max_pct': 0.08872259970780019, 'tp_mult': 1.104531090095166, 'tsl_mult': 0.8059898508993618, 'strategy': 'breakout', 'time_stop': 25, 'use_sma': False, 'use_atr': False, 'use_adx': False, 'use_ema': False, 'use_spike': False, 'rsi_required': False, 'edge_k': 1.7791375148340358, 'edge_cap': 0.7906145869059829}.
[I 2025-08-29 23:21:56,863] Trial 947 finished with values: [-1000000000.0, 1000000000.0] and parameters: {'p_sma': 34, 'p_std': 34, 'p_atr': 24, 'p_adx': 19, 'rsi_period': 82, 'ema1': 29, 'ema2': 53, 'slip_atr_k': 0.08848710649548483, 'slip_spread_k': 0.7914210047348583, 'spread_hl_frac': 0.019250990554152688, 'bb_std_mult': 1.631141333655442, 'rsi_os': 25, 'rsi_ob': 90, 'vol_spike': 0.18806275060519592, 'adx_thresh': 30.380295277711177, 'atr_min_pct': 0.011928698185420295, 'atr_max_pct': 0.07443955108301319, 'tp_mult': 2.7123898696404134, 'tsl_mult': 0.7684594164513535, 'strategy': 'breakout', 'time_stop': 97, 'use_sma': False, 'use_atr': False, 'use_adx': False, 'use_ema': False, 'use_spike': False, 'rsi_required': False, 'edge_k': 1.5633682545331595, 'edge_cap': 0.2609371720429639}.
[I 2025-08-29 23:22:23,957] Trial 949 finished with values: [-0.02609358185605415, 0.026067278800405477] and parameters: {'p_sma': 34, 'p_std': 20, 'p_atr': 16, 'p_adx': 23, 'rsi_period': 31, 'ema1': 29, 'ema2': 53, 'slip_atr_k': 0.12200069691730597, 'slip_spread_k': 0.9403317515573127, 'spread_hl_frac': 0.01681018984371142, 'bb_std_mult': 2.0911165910672476, 'rsi_os': 25, 'rsi_ob': 62, 'vol_spike': 0.16538492263980076, 'adx_thresh': 10.90951988432145, 'atr_min_pct': 4.8594283452402937e-05, 'atr_max_pct': 0.09107296244290534, 'tp_mult': 1.0640480327986765, 'tsl_mult': 0.7527454439891411, 'strategy': 'breakout', 'time_stop': 151, 'use_sma': False, 'use_atr': False, 'use_adx': False, 'use_ema': False, 'use_spike': False, 'rsi_required': False, 'edge_k': 0.9096425694194568, 'edge_cap': 0.7901557306101372}.
[I 2025-08-29 23:22:24,278] Trial 951 finished with values: [-1000000000.0, 1000000000.0] and parameters: {'p_sma': 6, 'p_std': 24, 'p_atr': 16, 'p_adx': 22, 'rsi_period': 44, 'ema1': 12, 'ema2': 53, 'slip_atr_k': 0.03236019384418132, 'slip_spread_k': 0.8154469373420705, 'spread_hl_frac': 0.017087100944761707, 'bb_std_mult': 2.091332919763274, 'rsi_os': 25, 'rsi_ob': 85, 'vol_spike': 0.2570648116921174, 'adx_thresh': 20.847606794882505, 'atr_min_pct': 0.0015486018338838861, 'atr_max_pct': 0.09233482237796302, 'tp_mult': 1.359339752561871, 'tsl_mult': 0.14051865287367415, 'strategy': 'mean_reversion', 'time_stop': 72, 'use_sma': False, 'use_atr': False, 'use_adx': False, 'use_ema': False, 'use_spike': False, 'rsi_required': False, 'edge_k': 1.3648012223925698, 'edge_cap': 0.8319165931231045}.
[I 2025-08-29 23:22:24,296] Trial 948 finished with values: [-1000000000.0, 1000000000.0] and parameters: {'p_sma': 6, 'p_std': 20, 'p_atr': 27, 'p_adx': 15, 'rsi_period': 44, 'ema1': 25, 'ema2': 53, 'slip_atr_k': 0.004677633837200974, 'slip_spread_k': 0.9461470325190735, 'spread_hl_frac': 0.018345081322525582, 'bb_std_mult': 1.9821315709436522, 'rsi_os': 25, 'rsi_ob': 59, 'vol_spike': 0.21365433704072598, 'adx_thresh': 30.611763664945784, 'atr_min_pct': 0.0035896546181812495, 'atr_max_pct': 0.021807510257983623, 'tp_mult': 1.0971810962445077, 'tsl_mult': 0.8073755523265594, 'strategy': 'breakout', 'time_stop': 202, 'use_sma': False, 'use_atr': False, 'use_adx': False, 'use_ema': False, 'use_spike': False, 'rsi_required': False, 'edge_k': 0.3845150391812986, 'edge_cap': 0.8772442455267644}.
[I 2025-08-29 23:22:24,363] Trial 950 finished with values: [-1000000000.0, 1000000000.0] and parameters: {'p_sma': 18, 'p_std': 24, 'p_atr': 16, 'p_adx': 16, 'rsi_period': 21, 'ema1': 25, 'ema2': 53, 'slip_atr_k': 0.0039553795850616295, 'slip_spread_k': 0.8216249939366016, 'spread_hl_frac': 0.01723598144427505, 'bb_std_mult': 2.0812200534826686, 'rsi_os': 25, 'rsi_ob': 63, 'vol_spike': 0.16860788964453066, 'adx_thresh': 19.076021877862043, 'atr_min_pct': 0.011930343909548075, 'atr_max_pct': 0.09356446547304098, 'tp_mult': 1.1848095831802534, 'tsl_mult': 0.5389862648923842, 'strategy': 'breakout', 'time_stop': 95, 'use_sma': False, 'use_atr': False, 'use_adx': False, 'use_ema': False, 'use_spike': False, 'rsi_required': False, 'edge_k': 0.935160611592549, 'edge_cap': 0.8309757216094416}.
[I 2025-08-29 23:22:24,676] Trial 955 finished with values: [-1000000000.0, 1000000000.0] and parameters: {'p_sma': 9, 'p_std': 15, 'p_atr': 24, 'p_adx': 26, 'rsi_period': 24, 'ema1': 14, 'ema2': 17, 'slip_atr_k': 0.13889909864027747, 'slip_spread_k': 0.5399863754173382, 'spread_hl_frac': 0.04315678417114571, 'bb_std_mult': 0.7802518388738715, 'rsi_os': 39, 'rsi_ob': 55, 'vol_spike': 0.013427593677663802, 'adx_thresh': 28.855682742179344, 'atr_min_pct': 0.020073326474301077, 'atr_max_pct': 0.011996138016971261, 'tp_mult': 1.0123504728325892, 'tsl_mult': 0.6850420581733172, 'strategy': 'mean_reversion', 'time_stop': 142, 'use_sma': False, 'use_atr': False, 'use_adx': False, 'use_ema': False, 'use_spike': False, 'rsi_required': False, 'edge_k': 0.46711173129603967, 'edge_cap': 0.14069773929584262}.
[I 2025-08-29 23:22:51,489] Trial 954 finished with values: [-1000000000.0, 1000000000.0] and parameters: {'p_sma': 9, 'p_std': 22, 'p_atr': 8, 'p_adx': 26, 'rsi_period': 24, 'ema1': 24, 'ema2': 55, 'slip_atr_k': 0.023311650475849377, 'slip_spread_k': 0.8649825758140498, 'spread_hl_frac': 0.020587741070072524, 'bb_std_mult': 3.5967731700266947, 'rsi_os': 39, 'rsi_ob': 79, 'vol_spike': 0.1790772077117094, 'adx_thresh': 26.094576936545764, 'atr_min_pct': 0.005218277076192867, 'atr_max_pct': 0.09888259165981823, 'tp_mult': 1.1418130966294995, 'tsl_mult': 0.4042702548634709, 'strategy': 'mean_reversion', 'time_stop': 85, 'use_sma': False, 'use_atr': False, 'use_adx': False, 'use_ema': False, 'use_spike': False, 'rsi_required': False, 'edge_k': 0.4594184720532152, 'edge_cap': 0.14839459639330782}.
[I 2025-08-29 23:22:52,067] Trial 953 finished with values: [-1000000000.0, 1000000000.0] and parameters: {'p_sma': 51, 'p_std': 43, 'p_atr': 8, 'p_adx': 16, 'rsi_period': 23, 'ema1': 25, 'ema2': 17, 'slip_atr_k': 0.02071863534641684, 'slip_spread_k': 0.26133195691811784, 'spread_hl_frac': 0.012009838328313586, 'bb_std_mult': 0.8631506564577043, 'rsi_os': 29, 'rsi_ob': 61, 'vol_spike': 0.23344667241286632, 'adx_thresh': 5.019308046283124, 'atr_min_pct': 0.018315873010272318, 'atr_max_pct': 0.10011763090496777, 'tp_mult': 1.4045481431881757, 'tsl_mult': 0.6959610928605425, 'strategy': 'breakout', 'time_stop': 111, 'use_sma': False, 'use_atr': False, 'use_adx': False, 'use_ema': False, 'use_spike': False, 'rsi_required': False, 'edge_k': 0.466513709242681, 'edge_cap': 0.8245393593312061}.
[I 2025-08-29 23:22:52,297] Trial 952 finished with values: [-1000000000.0, 1000000000.0] and parameters: {'p_sma': 6, 'p_std': 38, 'p_atr': 22, 'p_adx': 22, 'rsi_period': 23, 'ema1': 14, 'ema2': 49, 'slip_atr_k': 0.007213136872267628, 'slip_spread_k': 0.8225741160098468, 'spread_hl_frac': 0.012027787018479659, 'bb_std_mult': 0.8789421390113701, 'rsi_os': 26, 'rsi_ob': 55, 'vol_spike': 0.17879937828239417, 'adx_thresh': 26.07860363737415, 'atr_min_pct': 0.01999264351806815, 'atr_max_pct': 0.09864637506453802, 'tp_mult': 1.1800710756081156, 'tsl_mult': 0.5783710621320671, 'strategy': 'mean_reversion', 'time_stop': 210, 'use_sma': False, 'use_atr': False, 'use_adx': False, 'use_ema': False, 'use_spike': False, 'rsi_required': False, 'edge_k': 1.406617628957957, 'edge_cap': 0.8237563961671907}.
[I 2025-08-29 23:22:52,305] Trial 956 finished with values: [-1000000000.0, 1000000000.0] and parameters: {'p_sma': 16, 'p_std': 25, 'p_atr': 8, 'p_adx': 18, 'rsi_period': 20, 'ema1': 24, 'ema2': 55, 'slip_atr_k': 0.09572597000868031, 'slip_spread_k': 0.8382086048688603, 'spread_hl_frac': 0.0208807806405067, 'bb_std_mult': 2.1935996303415624, 'rsi_os': 23, 'rsi_ob': 61, 'vol_spike': 0.05227628999467322, 'adx_thresh': 26.063671474471786, 'atr_min_pct': 0.018304059471119714, 'atr_max_pct': 0.099028983181124, 'tp_mult': 1.1473387271762319, 'tsl_mult': 0.7047459993576884, 'strategy': 'breakout', 'time_stop': 86, 'use_sma': False, 'use_atr': False, 'use_adx': False, 'use_ema': False, 'use_spike': False, 'rsi_required': False, 'edge_k': 1.4081334524816613, 'edge_cap': 0.17902954416433436}.
[I 2025-08-29 23:23:19,346] Trial 959 finished with values: [-1000000000.0, 1000000000.0] and parameters: {'p_sma': 8, 'p_std': 27, 'p_atr': 20, 'p_adx': 17, 'rsi_period': 38, 'ema1': 7, 'ema2': 59, 'slip_atr_k': 0.07706659880881106, 'slip_spread_k': 0.7211392913549048, 'spread_hl_frac': 0.019309921040889386, 'bb_std_mult': 3.0807288295562767, 'rsi_os': 43, 'rsi_ob': 59, 'vol_spike': 0.067836696987755, 'adx_thresh': 24.568925320748043, 'atr_min_pct': 0.009487092292681645, 'atr_max_pct': 0.0956388826637232, 'tp_mult': 1.0558480623195536, 'tsl_mult': 0.4696799076330814, 'strategy': 'breakout', 'time_stop': 251, 'use_sma': False, 'use_atr': False, 'use_adx': False, 'use_ema': False, 'use_spike': False, 'rsi_required': False, 'edge_k': 0.5635933708026575, 'edge_cap': 0.2127925084962941}.
[I 2025-08-29 23:23:19,678] Trial 957 finished with values: [-1000000000.0, 1000000000.0] and parameters: {'p_sma': 52, 'p_std': 43, 'p_atr': 20, 'p_adx': 18, 'rsi_period': 20, 'ema1': 23, 'ema2': 42, 'slip_atr_k': 0.2271697017091762, 'slip_spread_k': 0.15244263255111995, 'spread_hl_frac': 0.01800019453656199, 'bb_std_mult': 2.026254211478073, 'rsi_os': 23, 'rsi_ob': 61, 'vol_spike': 0.24098229800752274, 'adx_thresh': 24.601851952434934, 'atr_min_pct': 0.00982602724613893, 'atr_max_pct': 0.09560300172291049, 'tp_mult': 1.1931839461409428, 'tsl_mult': 0.6986595181547659, 'strategy': 'breakout', 'time_stop': 113, 'use_sma': False, 'use_atr': False, 'use_adx': False, 'use_ema': False, 'use_spike': False, 'rsi_required': False, 'edge_k': 0.579479143374146, 'edge_cap': 0.760815428817905}.
[I 2025-08-29 23:23:19,829] Trial 960 finished with values: [-1000000000.0, 1000000000.0] and parameters: {'p_sma': 8, 'p_std': 8, 'p_atr': 15, 'p_adx': 17, 'rsi_period': 39, 'ema1': 5, 'ema2': 56, 'slip_atr_k': 0.013231279080840316, 'slip_spread_k': 0.223673560344827, 'spread_hl_frac': 0.019623506293287615, 'bb_std_mult': 2.642917890979636, 'rsi_os': 19, 'rsi_ob': 59, 'vol_spike': 0.06687378493023073, 'adx_thresh': 6.670098637717462, 'atr_min_pct': 0.0030407909928232752, 'atr_max_pct': 0.12977040031060366, 'tp_mult': 2.048675432325184, 'tsl_mult': 0.7446295761047832, 'strategy': 'breakout', 'time_stop': 254, 'use_sma': False, 'use_atr': False, 'use_adx': False, 'use_ema': False, 'use_spike': False, 'rsi_required': False, 'edge_k': 1.9597945527162408, 'edge_cap': 0.2856454082052111}.
[I 2025-08-29 23:23:19,911] Trial 958 finished with values: [-0.04032451911013957, 0.04031101755418062] and parameters: {'p_sma': 23, 'p_std': 25, 'p_atr': 20, 'p_adx': 28, 'rsi_period': 27, 'ema1': 8, 'ema2': 13, 'slip_atr_k': 0.09517122349544846, 'slip_spread_k': 0.7158795123715928, 'spread_hl_frac': 0.013226216730539486, 'bb_std_mult': 2.1982916739339995, 'rsi_os': 43, 'rsi_ob': 72, 'vol_spike': 0.17727024429545066, 'adx_thresh': 24.53224000972625, 'atr_min_pct': 0.001546746296724152, 'atr_max_pct': 0.06996186581405398, 'tp_mult': 1.8618086549400694, 'tsl_mult': 0.5826187863730686, 'strategy': 'breakout', 'time_stop': 100, 'use_sma': False, 'use_atr': False, 'use_adx': False, 'use_ema': False, 'use_spike': False, 'rsi_required': False, 'edge_k': 0.5782614200412635, 'edge_cap': 0.2876167311033523}.
[I 2025-08-29 23:23:47,129] Trial 961 finished with values: [-1000000000.0, 1000000000.0] and parameters: {'p_sma': 13, 'p_std': 25, 'p_atr': 10, 'p_adx': 17, 'rsi_period': 66, 'ema1': 23, 'ema2': 40, 'slip_atr_k': 0.05550332438080338, 'slip_spread_k': 0.22447170681586093, 'spread_hl_frac': 0.018078256667859283, 'bb_std_mult': 2.6279594513908693, 'rsi_os': 26, 'rsi_ob': 60, 'vol_spike': 0.1848092635010211, 'adx_thresh': 25.465902906616076, 'atr_min_pct': 0.003108733289977484, 'atr_max_pct': 0.12972623407288958, 'tp_mult': 1.2154331469111082, 'tsl_mult': 0.7410731048976378, 'strategy': 'breakout', 'time_stop': 114, 'use_sma': False, 'use_atr': False, 'use_adx': False, 'use_ema': False, 'use_spike': False, 'rsi_required': False, 'edge_k': 0.5151961639204042, 'edge_cap': 0.29301662813498486}.
[I 2025-08-29 23:23:47,341] Trial 962 finished with values: [-0.005813327566565052, 0.006024108160876332] and parameters: {'p_sma': 7, 'p_std': 23, 'p_atr': 23, 'p_adx': 16, 'rsi_period': 18, 'ema1': 16, 'ema2': 56, 'slip_atr_k': 0.012571679436559569, 'slip_spread_k': 0.2236326189647458, 'spread_hl_frac': 0.027892036701456308, 'bb_std_mult': 2.0062655625013384, 'rsi_os': 26, 'rsi_ob': 59, 'vol_spike': 0.24807670451245073, 'adx_thresh': 13.082143574902494, 'atr_min_pct': 0.0017920347094856207, 'atr_max_pct': 0.06835117716207867, 'tp_mult': 1.1249297146314317, 'tsl_mult': 0.22844929914675566, 'strategy': 'breakout', 'time_stop': 100, 'use_sma': False, 'use_atr': False, 'use_adx': False, 'use_ema': False, 'use_spike': False, 'rsi_required': False, 'edge_k': 0.5272511943523641, 'edge_cap': 0.8491474714146325}.
[I 2025-08-29 23:23:47,368] Trial 964 finished with values: [-0.03822142000201134, 0.03820537238602266] and parameters: {'p_sma': 43, 'p_std': 28, 'p_atr': 24, 'p_adx': 13, 'rsi_period': 17, 'ema1': 24, 'ema2': 54, 'slip_atr_k': 0.02717553188671265, 'slip_spread_k': 0.8715970165227183, 'spread_hl_frac': 0.016196863034805935, 'bb_std_mult': 0.9887506569986682, 'rsi_os': 26, 'rsi_ob': 67, 'vol_spike': 0.05897895643643676, 'adx_thresh': 25.421269888667865, 'atr_min_pct': 0.0008357242064699871, 'atr_max_pct': 0.09072349178934072, 'tp_mult': 1.1216469348157392, 'tsl_mult': 0.2391984552357566, 'strategy': 'breakout', 'time_stop': 104, 'use_sma': False, 'use_atr': False, 'use_adx': False, 'use_ema': False, 'use_spike': False, 'rsi_required': False, 'edge_k': 0.5310729636736408, 'edge_cap': 0.942909067344256}.
[I 2025-08-29 23:23:47,460] Trial 963 finished with values: [-0.04466142916103166, 0.04463793404532869] and parameters: {'p_sma': 7, 'p_std': 25, 'p_atr': 23, 'p_adx': 14, 'rsi_period': 18, 'ema1': 24, 'ema2': 52, 'slip_atr_k': 0.17025299453753082, 'slip_spread_k': 0.44273919051614563, 'spread_hl_frac': 0.01323034302087832, 'bb_std_mult': 2.157115158629974, 'rsi_os': 49, 'rsi_ob': 64, 'vol_spike': 0.18463450786690092, 'adx_thresh': 15.407727220121465, 'atr_min_pct': 0.0016806556564801847, 'atr_max_pct': 0.09026465769438954, 'tp_mult': 1.1185559361368766, 'tsl_mult': 0.740229799588904, 'strategy': 'breakout', 'time_stop': 101, 'use_sma': False, 'use_atr': False, 'use_adx': False, 'use_ema': False, 'use_spike': False, 'rsi_required': False, 'edge_k': 1.2431205227119406, 'edge_cap': 0.5449420013735286}.
[I 2025-08-29 23:24:14,447] Trial 967 finished with values: [-1000000000.0, 1000000000.0] and parameters: {'p_sma': 5, 'p_std': 36, 'p_atr': 22, 'p_adx': 16, 'rsi_period': 21, 'ema1': 24, 'ema2': 52, 'slip_atr_k': 0.01719849541360471, 'slip_spread_k': 0.46562943096283826, 'spread_hl_frac': 0.007181997112671541, 'bb_std_mult': 2.161736031499251, 'rsi_os': 28, 'rsi_ob': 64, 'vol_spike': 0.17229816703201317, 'adx_thresh': 18.44545425304683, 'atr_min_pct': 0.028502952172806444, 'atr_max_pct': 0.14227486267929484, 'tp_mult': 1.0787654030521248, 'tsl_mult': 0.6702196706142086, 'strategy': 'mean_reversion', 'time_stop': 107, 'use_sma': False, 'use_atr': False, 'use_adx': False, 'use_ema': False, 'use_spike': False, 'rsi_required': False, 'edge_k': 0.41994314782128606, 'edge_cap': 0.7784716809939808}.
[I 2025-08-29 23:24:14,509] Trial 965 finished with values: [-0.01848872253503686, 0.018456703849979876] and parameters: {'p_sma': 45, 'p_std': 26, 'p_atr': 21, 'p_adx': 14, 'rsi_period': 47, 'ema1': 24, 'ema2': 29, 'slip_atr_k': 0.1716617864255871, 'slip_spread_k': 0.8645557055419237, 'spread_hl_frac': 0.023996277979386728, 'bb_std_mult': 1.996525499654111, 'rsi_os': 28, 'rsi_ob': 63, 'vol_spike': 0.2698148162498384, 'adx_thresh': 27.704379669969473, 'atr_min_pct': 0.0007350497519540619, 'atr_max_pct': 0.0932335971507593, 'tp_mult': 1.114904010144512, 'tsl_mult': 0.6557403715433783, 'strategy': 'breakout', 'time_stop': 126, 'use_sma': False, 'use_atr': False, 'use_adx': False, 'use_ema': False, 'use_spike': False, 'rsi_required': False, 'edge_k': 1.2578197449121202, 'edge_cap': 0.7838838406480823}.
[I 2025-08-29 23:24:14,592] Trial 966 finished with values: [-1000000000.0, 1000000000.0] and parameters: {'p_sma': 57, 'p_std': 60, 'p_atr': 21, 'p_adx': 20, 'rsi_period': 42, 'ema1': 24, 'ema2': 52, 'slip_atr_k': 0.027762479475911053, 'slip_spread_k': 0.8745971174094682, 'spread_hl_frac': 0.03366192839641204, 'bb_std_mult': 0.9956260227151232, 'rsi_os': 48, 'rsi_ob': 65, 'vol_spike': 0.2707363404327453, 'adx_thresh': 27.2402294887301, 'atr_min_pct': 0.015914460712473846, 'atr_max_pct': 0.09149908452806563, 'tp_mult': 1.29968799718075, 'tsl_mult': 0.31775323437563474, 'strategy': 'mean_reversion', 'time_stop': 106, 'use_sma': False, 'use_atr': False, 'use_adx': False, 'use_ema': False, 'use_spike': False, 'rsi_required': False, 'edge_k': 1.0355708036217823, 'edge_cap': 0.42353938605929564}.
[I 2025-08-29 23:24:14,771] Trial 968 finished with values: [-1000000000.0, 1000000000.0] and parameters: {'p_sma': 5, 'p_std': 27, 'p_atr': 18, 'p_adx': 16, 'rsi_period': 22, 'ema1': 25, 'ema2': 31, 'slip_atr_k': 0.1999733841248763, 'slip_spread_k': 0.3837042873061669, 'spread_hl_frac': 0.049114502383761555, 'bb_std_mult': 2.274201498507666, 'rsi_os': 28, 'rsi_ob': 63, 'vol_spike': 0.17085083304077672, 'adx_thresh': 27.520510435757295, 'atr_min_pct': 0.0023968565075387473, 'atr_max_pct': 0.10174072701936321, 'tp_mult': 2.2685198170698806, 'tsl_mult': 0.49703583120014505, 'strategy': 'mean_reversion', 'time_stop': 191, 'use_sma': False, 'use_atr': False, 'use_adx': False, 'use_ema': False, 'use_spike': False, 'rsi_required': False, 'edge_k': 0.6324109796163765, 'edge_cap': 0.7822257625867407}.
[I 2025-08-29 23:24:15,046] Trial 970 finished with values: [-1000000000.0, 1000000000.0] and parameters: {'p_sma': 7, 'p_std': 58, 'p_atr': 30, 'p_adx': 15, 'rsi_period': 22, 'ema1': 25, 'ema2': 48, 'slip_atr_k': 0.03556344972667744, 'slip_spread_k': 0.8354258263574891, 'spread_hl_frac': 0.009492879315981008, 'bb_std_mult': 2.786954379963762, 'rsi_os': 51, 'rsi_ob': 94, 'vol_spike': 0.16713525698996393, 'adx_thresh': 26.431475004376555, 'atr_min_pct': 0.01587821058856232, 'atr_max_pct': 0.034259037629209295, 'tp_mult': 1.0481986405240071, 'tsl_mult': 0.7201503491557834, 'strategy': 'mean_reversion', 'time_stop': 179, 'use_sma': False, 'use_atr': False, 'use_adx': False, 'use_ema': False, 'use_spike': False, 'rsi_required': False, 'edge_k': 0.6431749286574351, 'edge_cap': 0.8082991622380957}.
[I 2025-08-29 23:24:41,589] Trial 969 finished with values: [-1000000000.0, 1000000000.0] and parameters: {'p_sma': 46, 'p_std': 27, 'p_atr': 24, 'p_adx': 29, 'rsi_period': 47, 'ema1': 25, 'ema2': 54, 'slip_atr_k': 0.1937424934393648, 'slip_spread_k': 0.8398449267689784, 'spread_hl_frac': 0.010271851912997634, 'bb_std_mult': 2.2806103496996575, 'rsi_os': 28, 'rsi_ob': 62, 'vol_spike': 0.27032617204818127, 'adx_thresh': 23.398134652953953, 'atr_min_pct': 0.025929306396323903, 'atr_max_pct': 0.03491631043329608, 'tp_mult': 1.9505049979486293, 'tsl_mult': 0.6509265308673241, 'strategy': 'breakout', 'time_stop': 180, 'use_sma': False, 'use_atr': False, 'use_adx': False, 'use_ema': False, 'use_spike': False, 'rsi_required': False, 'edge_k': 1.04260511509977, 'edge_cap': 0.8068995347965789}.
[I 2025-08-29 23:24:41,858] Trial 971 finished with values: [-1000000000.0, 1000000000.0] and parameters: {'p_sma': 8, 'p_std': 23, 'p_atr': 22, 'p_adx': 15, 'rsi_period': 29, 'ema1': 25, 'ema2': 37, 'slip_atr_k': 0.16152215335329978, 'slip_spread_k': 0.3785298357650072, 'spread_hl_frac': 0.0492172401371983, 'bb_std_mult': 2.345261000007193, 'rsi_os': 54, 'rsi_ob': 88, 'vol_spike': 0.1656325940634001, 'adx_thresh': 32.12207375449522, 'atr_min_pct': 0.015008403351982962, 'atr_max_pct': 0.0961501556514857, 'tp_mult': 1.0450946081270491, 'tsl_mult': 0.5000535804847974, 'strategy': 'breakout', 'time_stop': 114, 'use_sma': False, 'use_atr': False, 'use_adx': False, 'use_ema': False, 'use_spike': False, 'rsi_required': False, 'edge_k': 0.4850761814705489, 'edge_cap': 0.7183130810486084}.
