[I 2025-08-29 22:08:30,534] Trial 271 finished with values: [-0.010408378666334817, 0.010424537368980134] and parameters: {'p_sma': 10, 'p_std': 50, 'p_atr': 16, 'p_adx': 17, 'rsi_period': 20, 'ema1': 20, 'ema2': 39, 'slip_atr_k': 0.11812766503002578, 'slip_spread_k': 0.324973566658497, 'spread_hl_frac': 0.01874979853106993, 'bb_std_mult': 2.6564286044523175, 'rsi_os': 30, 'rsi_ob': 60, 'vol_spike': 0.18798354933560366, 'adx_thresh': 26.528633600169574, 'atr_min_pct': 0.0017801723129095986, 'atr_max_pct': 0.08708445458520392, 'tp_mult': 1.0866479375815195, 'tsl_mult': 0.3254132222402535, 'strategy': 'breakout', 'time_stop': 120, 'use_sma': False, 'use_atr': False, 'use_adx': False, 'use_ema': False, 'use_spike': False, 'rsi_required': False, 'edge_k': 1.6413337793398797, 'edge_cap': 0.3796611051327713}.
[I 2025-08-29 22:08:30,763] Trial 269 finished with values: [-0.02042954901971694, 0.02041182272588015] and parameters: {'p_sma': 53, 'p_std': 37, 'p_atr': 20, 'p_adx': 13, 'rsi_period': 37, 'ema1': 20, 'ema2': 58, 'slip_atr_k': 0.2082119682808421, 'slip_spread_k': 0.3208526105070775, 'spread_hl_frac': 0.01874296535304079, 'bb_std_mult': 2.055783928616454, 'rsi_os': 35, 'rsi_ob': 72, 'vol_spike': 0.015644293918865126, 'adx_thresh': 25.578432353690015, 'atr_min_pct': 0.0033822865567817977, 'atr_max_pct': 0.09687574907756398, 'tp_mult': 1.2485435005701944, 'tsl_mult': 0.9168380882757079, 'strategy': 'breakout', 'time_stop': 251, 'use_sma': False, 'use_atr': False, 'use_adx': False, 'use_ema': False, 'use_spike': False, 'rsi_required': False, 'edge_k': 0.35848533864624665, 'edge_cap': 0.3937020373345885}.
[I 2025-08-29 22:08:30,864] Trial 270 finished with values: [-0.01863745398242811, 0.018608077071737554] and parameters: {'p_sma': 19, 'p_std': 50, 'p_atr': 16, 'p_adx': 17, 'rsi_period': 23, 'ema1': 21, 'ema2': 39, 'slip_atr_k': 0.020899307887300468, 'slip_spread_k': 0.8284922071999216, 'spread_hl_frac': 0.02080023932758234, 'bb_std_mult': 2.0191136999810535, 'rsi_os': 28, 'rsi_ob': 72, 'vol_spike': 0.07675976635035521, 'adx_thresh': 26.06485916790915, 'atr_min_pct': 0.001111102378742638, 'atr_max_pct': 0.046315033693459684, 'tp_mult': 2.0267684697464583, 'tsl_mult': 0.7518429657064358, 'strategy': 'breakout', 'time_stop': 122, 'use_sma': False, 'use_atr': False, 'use_adx': False, 'use_ema': False, 'use_spike': False, 'rsi_required': False, 'edge_k': 0.4003643448932208, 'edge_cap': 0.3955210152398174}.
[I 2025-08-29 22:08:57,626] Trial 273 finished with values: [-1000000000.0, 1000000000.0] and parameters: {'p_sma': 8, 'p_std': 26, 'p_atr': 13, 'p_adx': 7, 'rsi_period': 24, 'ema1': 22, 'ema2': 55, 'slip_atr_k': 0.20874654261114528, 'slip_spread_k': 0.8323876259851157, 'spread_hl_frac': 0.02063566646582434, 'bb_std_mult': 2.170448777738248, 'rsi_os': 24, 'rsi_ob': 86, 'vol_spike': 0.1074111435851554, 'adx_thresh': 27.421349877280004, 'atr_min_pct': 0.00362500063099309, 'atr_max_pct': 0.09928224851232778, 'tp_mult': 1.0788355097003866, 'tsl_mult': 0.048375882138120774, 'strategy': 'breakout', 'time_stop': 13, 'use_sma': False, 'use_atr': False, 'use_adx': False, 'use_ema': False, 'use_spike': False, 'rsi_required': False, 'edge_k': 0.5910863020095991, 'edge_cap': 0.7246372779178369}.
[I 2025-08-29 22:08:57,863] Trial 276 finished with values: [-0.009096874682922529, 0.009102858864912255] and parameters: {'p_sma': 8, 'p_std': 55, 'p_atr': 27, 'p_adx': 14, 'rsi_period': 22, 'ema1': 22, 'ema2': 55, 'slip_atr_k': 0.1425183168856865, 'slip_spread_k': 0.8544419438893547, 'spread_hl_frac': 0.027828615868128587, 'bb_std_mult': 2.156320691524148, 'rsi_os': 44, 'rsi_ob': 62, 'vol_spike': 0.10862540271259295, 'adx_thresh': 12.10874423048675, 'atr_min_pct': 0.002563949109841252, 'atr_max_pct': 0.09821023927215347, 'tp_mult': 1.1849810873663915, 'tsl_mult': 0.36830591661119527, 'strategy': 'breakout', 'time_stop': 65, 'use_sma': False, 'use_atr': False, 'use_adx': False, 'use_ema': False, 'use_spike': False, 'rsi_required': False, 'edge_k': 0.6072284426328064, 'edge_cap': 0.8758707259247742}.
[I 2025-08-29 22:08:58,200] Trial 274 finished with values: [-0.0032366442167420795, 0.0034241220773061185] and parameters: {'p_sma': 36, 'p_std': 37, 'p_atr': 27, 'p_adx': 22, 'rsi_period': 24, 'ema1': 22, 'ema2': 55, 'slip_atr_k': 0.03356662132665082, 'slip_spread_k': 0.8319153676877619, 'spread_hl_frac': 0.017598188018031518, 'bb_std_mult': 2.187715506962557, 'rsi_os': 24, 'rsi_ob': 72, 'vol_spike': 0.1731447660870233, 'adx_thresh': 27.93599715153706, 'atr_min_pct': 0.0034140531057591083, 'atr_max_pct': 0.09800161620124513, 'tp_mult': 1.1825036516687932, 'tsl_mult': 0.3732875205819053, 'strategy': 'breakout', 'time_stop': 100, 'use_sma': False, 'use_atr': False, 'use_adx': False, 'use_ema': False, 'use_spike': False, 'rsi_required': False, 'edge_k': 1.908435196207141, 'edge_cap': 0.1078930958120976}.
[I 2025-08-29 22:08:58,216] Trial 275 finished with values: [-0.05223325118523914, 0.0522014307974726] and parameters: {'p_sma': 56, 'p_std': 26, 'p_atr': 10, 'p_adx': 14, 'rsi_period': 24, 'ema1': 21, 'ema2': 55, 'slip_atr_k': 0.2396942744166703, 'slip_spread_k': 0.6308284396049517, 'spread_hl_frac': 0.020479603540892555, 'bb_std_mult': 2.170250313524898, 'rsi_os': 42, 'rsi_ob': 48, 'vol_spike': 0.2021166770784597, 'adx_thresh': 27.85897764529168, 'atr_min_pct': 0.002814820065063448, 'atr_max_pct': 0.04572888819967118, 'tp_mult': 1.1887190495537685, 'tsl_mult': 0.9588384292590773, 'strategy': 'breakout', 'time_stop': 99, 'use_sma': False, 'use_atr': False, 'use_adx': False, 'use_ema': False, 'use_spike': False, 'rsi_required': False, 'edge_k': 1.0304378083648602, 'edge_cap': 0.7173832752583518}.
[I 2025-08-29 22:08:58,365] Trial 279 finished with values: [-1000000000.0, 1000000000.0] and parameters: {'p_sma': 6, 'p_std': 24, 'p_atr': 10, 'p_adx': 15, 'rsi_period': 16, 'ema1': 5, 'ema2': 53, 'slip_atr_k': 0.029413042312166494, 'slip_spread_k': 0.6013358831076563, 'spread_hl_frac': 0.024600531709295406, 'bb_std_mult': 1.9921589234749744, 'rsi_os': 41, 'rsi_ob': 47, 'vol_spike': 0.24185892015366212, 'adx_thresh': 14.523714618691805, 'atr_min_pct': 0.003188834079538095, 'atr_max_pct': 0.14021594232526474, 'tp_mult': 1.2120618387439437, 'tsl_mult': 0.6258996489058225, 'strategy': 'mean_reversion', 'time_stop': 102, 'use_sma': False, 'use_atr': False, 'use_adx': False, 'use_ema': False, 'use_spike': False, 'rsi_required': False, 'edge_k': 0.5424168127524885, 'edge_cap': 0.6015961245855971}.
[I 2025-08-29 22:09:25,656] Trial 278 finished with values: [-1000000000.0, 1000000000.0] and parameters: {'p_sma': 56, 'p_std': 21, 'p_atr': 25, 'p_adx': 22, 'rsi_period': 41, 'ema1': 29, 'ema2': 34, 'slip_atr_k': 0.03327304927919031, 'slip_spread_k': 0.5476826759317294, 'spread_hl_frac': 0.024300364895221208, 'bb_std_mult': 1.9675829892059884, 'rsi_os': 41, 'rsi_ob': 58, 'vol_spike': 0.05950692969951382, 'adx_thresh': 19.061380868401578, 'atr_min_pct': 0.009240659136387754, 'atr_max_pct': 0.09473440677003601, 'tp_mult': 1.2083421320502683, 'tsl_mult': 0.9961131582454045, 'strategy': 'mean_reversion', 'time_stop': 102, 'use_sma': False, 'use_atr': False, 'use_adx': False, 'use_ema': False, 'use_spike': False, 'rsi_required': False, 'edge_k': 0.9400406589646692, 'edge_cap': 0.7957053951138593}.
[I 2025-08-29 22:09:25,691] Trial 280 finished with values: [-1000000000.0, 1000000000.0] and parameters: {'p_sma': 6, 'p_std': 28, 'p_atr': 25, 'p_adx': 22, 'rsi_period': 80, 'ema1': 8, 'ema2': 34, 'slip_atr_k': 0.034876842711886194, 'slip_spread_k': 0.15017937463592418, 'spread_hl_frac': 0.023218160643739365, 'bb_std_mult': 1.9646871789559464, 'rsi_os': 27, 'rsi_ob': 58, 'vol_spike': 0.24048239262972582, 'adx_thresh': 14.755723230071844, 'atr_min_pct': 0.02396884652591607, 'atr_max_pct': 0.09090577860735582, 'tp_mult': 1.7279188403339014, 'tsl_mult': 0.6676333242890752, 'strategy': 'mean_reversion', 'time_stop': 103, 'use_sma': False, 'use_atr': False, 'use_adx': False, 'use_ema': False, 'use_spike': False, 'rsi_required': False, 'edge_k': 0.5462593469897933, 'edge_cap': 0.051635298900092996}.
[I 2025-08-29 22:09:25,995] Trial 277 finished with values: [-1000000000.0, 1000000000.0] and parameters: {'p_sma': 56, 'p_std': 28, 'p_atr': 25, 'p_adx': 14, 'rsi_period': 21, 'ema1': 19, 'ema2': 57, 'slip_atr_k': 0.14458984355846236, 'slip_spread_k': 0.6197619045609131, 'spread_hl_frac': 0.024056780131199444, 'bb_std_mult': 1.9292247715781443, 'rsi_os': 27, 'rsi_ob': 48, 'vol_spike': 0.24053556503986734, 'adx_thresh': 23.915941541371698, 'atr_min_pct': 0.013650918493079959, 'atr_max_pct': 0.0917571143116947, 'tp_mult': 1.1969342619608083, 'tsl_mult': 0.9992375181016571, 'strategy': 'breakout', 'time_stop': 100, 'use_sma': False, 'use_atr': False, 'use_adx': False, 'use_ema': False, 'use_spike': False, 'rsi_required': False, 'edge_k': 1.9208792012496196, 'edge_cap': 0.8696837134666711}.
[I 2025-08-29 22:09:26,298] Trial 281 finished with values: [-1000000000.0, 1000000000.0] and parameters: {'p_sma': 15, 'p_std': 28, 'p_atr': 15, 'p_adx': 25, 'rsi_period': 21, 'ema1': 23, 'ema2': 51, 'slip_atr_k': 0.21903978896502752, 'slip_spread_k': 0.15593689246804182, 'spread_hl_frac': 0.018048100694050172, 'bb_std_mult': 1.9417461636395554, 'rsi_os': 27, 'rsi_ob': 58, 'vol_spike': 0.17308582674645306, 'adx_thresh': 24.0315229116647, 'atr_min_pct': 0.009690603860228814, 'atr_max_pct': 0.09185131597452735, 'tp_mult': 1.1170630256285037, 'tsl_mult': 0.9980390459157618, 'strategy': 'breakout', 'time_stop': 95, 'use_sma': False, 'use_atr': False, 'use_adx': False, 'use_ema': False, 'use_spike': False, 'rsi_required': False, 'edge_k': 1.2333274381503339, 'edge_cap': 0.10855953881815356}.
[I 2025-08-29 22:09:53,767] Trial 283 finished with values: [-0.005713938575255484, 0.005681517085249151] and parameters: {'p_sma': 15, 'p_std': 41, 'p_atr': 15, 'p_adx': 16, 'rsi_period': 21, 'ema1': 15, 'ema2': 50, 'slip_atr_k': 0.22996391999526555, 'slip_spread_k': 0.5788752667098089, 'spread_hl_frac': 0.017478466222156628, 'bb_std_mult': 1.878601399948985, 'rsi_os': 5, 'rsi_ob': 81, 'vol_spike': 0.2267896664972099, 'adx_thresh': 12.745184208314592, 'atr_min_pct': 0.0020759220056729326, 'atr_max_pct': 0.029648190570752936, 'tp_mult': 1.068673937827995, 'tsl_mult': 0.6092021366654833, 'strategy': 'breakout', 'time_stop': 109, 'use_sma': False, 'use_atr': False, 'use_adx': False, 'use_ema': False, 'use_spike': False, 'rsi_required': False, 'edge_k': 1.6963743716102004, 'edge_cap': 0.7439605588608158}.
[I 2025-08-29 22:09:54,020] Trial 285 finished with values: [-1000000000.0, 1000000000.0] and parameters: {'p_sma': 7, 'p_std': 41, 'p_atr': 12, 'p_adx': 16, 'rsi_period': 33, 'ema1': 13, 'ema2': 52, 'slip_atr_k': 0.09200775857552831, 'slip_spread_k': 0.7828708745224835, 'spread_hl_frac': 0.014957977062407951, 'bb_std_mult': 2.9799427770168387, 'rsi_os': 24, 'rsi_ob': 61, 'vol_spike': 0.18164580546321593, 'adx_thresh': 25.07304536981859, 'atr_min_pct': 0.005527669747962276, 'atr_max_pct': 0.10493874206708245, 'tp_mult': 1.0887273217213933, 'tsl_mult': 0.8893245396308933, 'strategy': 'breakout', 'time_stop': 110, 'use_sma': False, 'use_atr': False, 'use_adx': False, 'use_ema': False, 'use_spike': False, 'rsi_required': False, 'edge_k': 0.6528819399230549, 'edge_cap': 0.7443817417929097}.
[I 2025-08-29 22:09:54,100] Trial 282 finished with values: [-1000000000.0, 1000000000.0] and parameters: {'p_sma': 7, 'p_std': 23, 'p_atr': 24, 'p_adx': 16, 'rsi_period': 55, 'ema1': 15, 'ema2': 50, 'slip_atr_k': 0.004538618871659086, 'slip_spread_k': 0.7984723774243534, 'spread_hl_frac': 0.015042688210580283, 'bb_std_mult': 2.07013745635421, 'rsi_os': 19, 'rsi_ob': 61, 'vol_spike': 0.18265525847572364, 'adx_thresh': 23.71380048990692, 'atr_min_pct': 0.0019351581570536938, 'atr_max_pct': 0.09290233017007654, 'tp_mult': 2.9109557217034387, 'tsl_mult': 0.602982108028069, 'strategy': 'breakout', 'time_stop': 111, 'use_sma': False, 'use_atr': False, 'use_adx': False, 'use_ema': False, 'use_spike': False, 'rsi_required': False, 'edge_k': 0.6486403177803727, 'edge_cap': 0.457669692433304}.
[I 2025-08-29 22:09:54,178] Trial 284 finished with values: [-1000000000.0, 1000000000.0] and parameters: {'p_sma': 7, 'p_std': 24, 'p_atr': 15, 'p_adx': 16, 'rsi_period': 17, 'ema1': 23, 'ema2': 53, 'slip_atr_k': 0.21681457152599765, 'slip_spread_k': 0.7982446758848017, 'spread_hl_frac': 0.017482248762104212, 'bb_std_mult': 3.0301257493284774, 'rsi_os': 25, 'rsi_ob': 59, 'vol_spike': 0.0026615231492967684, 'adx_thresh': 25.169454849780838, 'atr_min_pct': 0.005732646498508484, 'atr_max_pct': 0.09542987541140065, 'tp_mult': 1.9746337475064373, 'tsl_mult': 0.6893879313738339, 'strategy': 'breakout', 'time_stop': 111, 'use_sma': False, 'use_atr': False, 'use_adx': False, 'use_ema': False, 'use_spike': False, 'rsi_required': False, 'edge_k': 0.6578158830296399, 'edge_cap': 0.9957176678066443}.
[I 2025-08-29 22:10:20,887] Trial 289 finished with values: [-1000000000.0, 1000000000.0] and parameters: {'p_sma': 9, 'p_std': 32, 'p_atr': 18, 'p_adx': 15, 'rsi_period': 82, 'ema1': 24, 'ema2': 47, 'slip_atr_k': 0.012148628621793636, 'slip_spread_k': 0.8438716818069122, 'spread_hl_frac': 0.04619293056860157, 'bb_std_mult': 2.745090674576768, 'rsi_os': 15, 'rsi_ob': 55, 'vol_spike': 0.2096022380028465, 'adx_thresh': 26.55664898060398, 'atr_min_pct': 0.018136944819982875, 'atr_max_pct': 0.054667229826104016, 'tp_mult': 2.634466282414906, 'tsl_mult': 0.7431778142562212, 'strategy': 'mean_reversion', 'time_stop': 80, 'use_sma': False, 'use_atr': False, 'use_adx': False, 'use_ema': False, 'use_spike': False, 'rsi_required': False, 'edge_k': 0.45962476933976654, 'edge_cap': 0.8293280462703241}.
[I 2025-08-29 22:10:21,450] Trial 287 finished with values: [-0.004137586833558249, 0.0041200819297306625] and parameters: {'p_sma': 9, 'p_std': 22, 'p_atr': 24, 'p_adx': 19, 'rsi_period': 55, 'ema1': 24, 'ema2': 47, 'slip_atr_k': 0.08409710668502429, 'slip_spread_k': 0.8017773321153875, 'spread_hl_frac': 0.017837036882593832, 'bb_std_mult': 1.462859787650697, 'rsi_os': 25, 'rsi_ob': 60, 'vol_spike': 0.19681372131443475, 'adx_thresh': 24.921537532757494, 'atr_min_pct': 0.0014579041665019532, 'atr_max_pct': 0.09600820593064868, 'tp_mult': 1.9012439548449183, 'tsl_mult': 0.6962349356672193, 'strategy': 'breakout', 'time_stop': 81, 'use_sma': False, 'use_atr': False, 'use_adx': False, 'use_ema': False, 'use_spike': False, 'rsi_required': False, 'edge_k': 0.44778728511180865, 'edge_cap': 0.8267740132116204}.
[I 2025-08-29 22:10:21,450] Trial 286 finished with values: [-1000000000.0, 1000000000.0] and parameters: {'p_sma': 7, 'p_std': 31, 'p_atr': 9, 'p_adx': 19, 'rsi_period': 76, 'ema1': 13, 'ema2': 52, 'slip_atr_k': 0.1323133784050052, 'slip_spread_k': 0.8055003564427449, 'spread_hl_frac': 0.015701037928757048, 'bb_std_mult': 2.98875858885855, 'rsi_os': 24, 'rsi_ob': 61, 'vol_spike': 0.18176389612235466, 'adx_thresh': 25.085066369581416, 'atr_min_pct': 0.00566753270703115, 'atr_max_pct': 0.09589640659587519, 'tp_mult': 1.9709402861391612, 'tsl_mult': 0.7610924775570702, 'strategy': 'breakout', 'time_stop': 174, 'use_sma': False, 'use_atr': False, 'use_adx': False, 'use_ema': False, 'use_spike': False, 'rsi_required': False, 'edge_k': 0.4374535044039893, 'edge_cap': 0.831982628964637}.
[I 2025-08-29 22:10:21,544] Trial 288 finished with values: [-0.0064348290039708544, 0.006427934211290597] and parameters: {'p_sma': 9, 'p_std': 25, 'p_atr': 9, 'p_adx': 20, 'rsi_period': 75, 'ema1': 24, 'ema2': 46, 'slip_atr_k': 0.04124837990308272, 'slip_spread_k': 0.3601462255842496, 'spread_hl_frac': 0.017056562033938127, 'bb_std_mult': 1.4774054795293057, 'rsi_os': 23, 'rsi_ob': 60, 'vol_spike': 0.19745033614802807, 'adx_thresh': 7.576942227571303, 'atr_min_pct': 0.0011216949754614743, 'atr_max_pct': 0.09595523342146939, 'tp_mult': 1.9097617239635138, 'tsl_mult': 0.6813331712762756, 'strategy': 'breakout', 'time_stop': 82, 'use_sma': False, 'use_atr': False, 'use_adx': False, 'use_ema': False, 'use_spike': False, 'rsi_required': False, 'edge_k': 0.46045418680397593, 'edge_cap': 0.9144694969383727}.
[I 2025-08-29 22:10:48,178] Trial 290 finished with values: [-1000000000.0, 1000000000.0] and parameters: {'p_sma': 36, 'p_std': 25, 'p_atr': 21, 'p_adx': 13, 'rsi_period': 29, 'ema1': 30, 'ema2': 54, 'slip_atr_k': 0.02347355523434737, 'slip_spread_k': 0.8878341179125316, 'spread_hl_frac': 0.01925595404139275, 'bb_std_mult': 2.1096698650763104, 'rsi_os': 22, 'rsi_ob': 60, 'vol_spike': 0.19675217289602906, 'adx_thresh': 26.977899516228018, 'atr_min_pct': 0.02875999937397429, 'atr_max_pct': 0.09939271914672314, 'tp_mult': 1.12219920357608, 'tsl_mult': 0.6431211115024762, 'strategy': 'breakout', 'time_stop': 117, 'use_sma': False, 'use_atr': False, 'use_adx': False, 'use_ema': False, 'use_spike': False, 'rsi_required': False, 'edge_k': 0.5044576351346323, 'edge_cap': 0.7919046281717642}.
[I 2025-08-29 22:10:48,291] Trial 293 finished with values: [-1000000000.0, 1000000000.0] and parameters: {'p_sma': 25, 'p_std': 18, 'p_atr': 23, 'p_adx': 18, 'rsi_period': 44, 'ema1': 6, 'ema2': 54, 'slip_atr_k': 0.008830825171517967, 'slip_spread_k': 0.8727847558119392, 'spread_hl_frac': 0.019713036900602648, 'bb_std_mult': 2.056949249145695, 'rsi_os': 26, 'rsi_ob': 53, 'vol_spike': 0.17176486810808073, 'adx_thresh': 22.707649530440374, 'atr_min_pct': 0.006904717555959124, 'atr_max_pct': 0.08700782378606414, 'tp_mult': 1.0410776422455992, 'tsl_mult': 0.7248157643898022, 'strategy': 'breakout', 'time_stop': 223, 'use_sma': False, 'use_atr': False, 'use_adx': False, 'use_ema': False, 'use_spike': False, 'rsi_required': False, 'edge_k': 0.5091834680960763, 'edge_cap': 0.7914647803647832}.
[I 2025-08-29 22:10:48,420] Trial 292 finished with values: [-1000000000.0, 1000000000.0] and parameters: {'p_sma': 8, 'p_std': 25, 'p_atr': 23, 'p_adx': 18, 'rsi_period': 84, 'ema1': 24, 'ema2': 26, 'slip_atr_k': 0.025488188332149744, 'slip_spread_k': 0.8724201032357356, 'spread_hl_frac': 0.017075519164897763, 'bb_std_mult': 2.0545829656335335, 'rsi_os': 50, 'rsi_ob': 64, 'vol_spike': 0.19633465913333586, 'adx_thresh': 24.502669608076324, 'atr_min_pct': 0.028701661197895873, 'atr_max_pct': 0.10087686727494508, 'tp_mult': 1.0358689156259233, 'tsl_mult': 0.7152096009652829, 'strategy': 'breakout', 'time_stop': 263, 'use_sma': False, 'use_atr': False, 'use_adx': False, 'use_ema': False, 'use_spike': False, 'rsi_required': False, 'edge_k': 0.4941350750545913, 'edge_cap': 0.8016589661224278}.
[I 2025-08-29 22:10:48,728] Trial 291 finished with values: [-0.017812935073126424, 0.017797978612148588] and parameters: {'p_sma': 41, 'p_std': 57, 'p_atr': 23, 'p_adx': 20, 'rsi_period': 27, 'ema1': 24, 'ema2': 54, 'slip_atr_k': 0.026445314889103285, 'slip_spread_k': 0.2828627527225372, 'spread_hl_frac': 0.04825197289943181, 'bb_std_mult': 3.137363121163623, 'rsi_os': 26, 'rsi_ob': 60, 'vol_spike': 0.1653232031522449, 'adx_thresh': 7.365581401049283, 'atr_min_pct': 0.0008103685874233609, 'atr_max_pct': 0.08549786249903948, 'tp_mult': 2.4572572153794408, 'tsl_mult': 0.7207861251418232, 'strategy': 'breakout', 'time_stop': 210, 'use_sma': False, 'use_atr': False, 'use_adx': False, 'use_ema': False, 'use_spike': False, 'rsi_required': False, 'edge_k': 1.7868891554681463, 'edge_cap': 0.7896413974160115}.
[I 2025-08-29 22:10:48,964] Trial 294 finished with values: [-1000000000.0, 1000000000.0] and parameters: {'p_sma': 25, 'p_std': 12, 'p_atr': 23, 'p_adx': 18, 'rsi_period': 43, 'ema1': 23, 'ema2': 56, 'slip_atr_k': 0.009629971301713273, 'slip_spread_k': 0.2864769509030301, 'spread_hl_frac': 0.03547042991040786, 'bb_std_mult': 2.085009645413618, 'rsi_os': 51, 'rsi_ob': 63, 'vol_spike': 0.17134529321552563, 'adx_thresh': 24.444484296652764, 'atr_min_pct': 0.02462268409752231, 'atr_max_pct': 0.08535225535922386, 'tp_mult': 2.3800321221536946, 'tsl_mult': 0.7283946357094494, 'strategy': 'mean_reversion', 'time_stop': 133, 'use_sma': False, 'use_atr': False, 'use_adx': False, 'use_ema': False, 'use_spike': False, 'rsi_required': False, 'edge_k': 0.5011213641345829, 'edge_cap': 0.8002205775475797}.
[I 2025-08-29 22:11:15,219] Trial 295 finished with values: [-0.025507881802336096, 0.02542156786926458] and parameters: {'p_sma': 39, 'p_std': 34, 'p_atr': 23, 'p_adx': 15, 'rsi_period': 19, 'ema1': 24, 'ema2': 57, 'slip_atr_k': 0.10686164898317078, 'slip_spread_k': 0.8222558512140759, 'spread_hl_frac': 0.026350175945276597, 'bb_std_mult': 2.029438475851431, 'rsi_os': 25, 'rsi_ob': 62, 'vol_spike': 0.21973050254163817, 'adx_thresh': 24.248828410993514, 'atr_min_pct': 0.002453873770959363, 'atr_max_pct': 0.037711367250877634, 'tp_mult': 1.163760690965896, 'tsl_mult': 0.7256824145669473, 'strategy': 'mean_reversion', 'time_stop': 264, 'use_sma': False, 'use_atr': False, 'use_adx': False, 'use_ema': False, 'use_spike': False, 'rsi_required': False, 'edge_k': 0.27418280386376825, 'edge_cap': 0.7643609135451628}.
[I 2025-08-29 22:11:15,367] Trial 297 finished with values: [-1000000000.0, 1000000000.0] and parameters: {'p_sma': 6, 'p_std': 27, 'p_atr': 23, 'p_adx': 15, 'rsi_period': 19, 'ema1': 18, 'ema2': 56, 'slip_atr_k': 0.11046911470883598, 'slip_spread_k': 0.8297025466994421, 'spread_hl_frac': 0.018343903123543753, 'bb_std_mult': 1.9915071441954462, 'rsi_os': 45, 'rsi_ob': 63, 'vol_spike': 0.17280320422787415, 'adx_thresh': 26.01680278885452, 'atr_min_pct': 0.0026975756219845253, 'atr_max_pct': 0.10185920395354721, 'tp_mult': 1.1526817008913381, 'tsl_mult': 0.7364036130162341, 'strategy': 'mean_reversion', 'time_stop': 136, 'use_sma': False, 'use_atr': False, 'use_adx': False, 'use_ema': False, 'use_spike': False, 'rsi_required': False, 'edge_k': 0.09155355197166537, 'edge_cap': 0.7623922154800457}.
