[I 2025-08-29 23:04:23,166] Trial 781 finished with values: [-1000000000.0, 1000000000.0] and parameters: {'p_sma': 5, 'p_std': 36, 'p_atr': 20, 'p_adx': 17, 'rsi_period': 19, 'ema1': 6, 'ema2': 52, 'slip_atr_k': 0.01854470300437528, 'slip_spread_k': 0.8424548605702539, 'spread_hl_frac': 0.01699049306165416, 'bb_std_mult': 2.1068934809675532, 'rsi_os': 49, 'rsi_ob': 52, 'vol_spike': 0.1492357473305394, 'adx_thresh': 25.298053011307694, 'atr_min_pct': 0.018715993195299218, 'atr_max_pct': 0.04172900616610093, 'tp_mult': 1.1041259156222882, 'tsl_mult': 0.6933768968974287, 'strategy': 'breakout', 'time_stop': 174, 'use_sma': False, 'use_atr': False, 'use_adx': False, 'use_ema': False, 'use_spike': False, 'rsi_required': False, 'edge_k': 0.42233419615445883, 'edge_cap': 0.7533106039379116}.
[I 2025-08-29 23:04:50,471] Trial 784 finished with values: [-1000000000.0, 1000000000.0] and parameters: {'p_sma': 24, 'p_std': 25, 'p_atr': 23, 'p_adx': 10, 'rsi_period': 21, 'ema1': 23, 'ema2': 59, 'slip_atr_k': 0.016641987376828943, 'slip_spread_k': 0.8428988268535587, 'spread_hl_frac': 0.01834979374435423, 'bb_std_mult': 2.1899126044995723, 'rsi_os': 23, 'rsi_ob': 58, 'vol_spike': 0.18014938997730004, 'adx_thresh': 21.868859879169136, 'atr_min_pct': 0.008123756360466791, 'atr_max_pct': 0.09534403932287527, 'tp_mult': 1.0798856874942948, 'tsl_mult': 0.7239307132965517, 'strategy': 'breakout', 'time_stop': 124, 'use_sma': False, 'use_atr': False, 'use_adx': False, 'use_ema': False, 'use_spike': False, 'rsi_required': False, 'edge_k': 0.5212309449937941, 'edge_cap': 0.8413472789533593}.
[I 2025-08-29 23:04:50,625] Trial 785 finished with values: [-0.006099989641930925, 0.006423253080842569] and parameters: {'p_sma': 43, 'p_std': 18, 'p_atr': 28, 'p_adx': 15, 'rsi_period': 45, 'ema1': 23, 'ema2': 59, 'slip_atr_k': 0.01530446705258182, 'slip_spread_k': 0.8434644066794017, 'spread_hl_frac': 0.026341180054494404, 'bb_std_mult': 2.1896377634006345, 'rsi_os': 23, 'rsi_ob': 84, 'vol_spike': 0.17682514692051898, 'adx_thresh': 22.127133981714326, 'atr_min_pct': 0.0023514738975876914, 'atr_max_pct': 0.041741972090767986, 'tp_mult': 2.076748510604665, 'tsl_mult': 0.7293470134626525, 'strategy': 'breakout', 'time_stop': 260, 'use_sma': False, 'use_atr': False, 'use_adx': False, 'use_ema': False, 'use_spike': False, 'rsi_required': False, 'edge_k': 0.22479192194205455, 'edge_cap': 0.9760224737229797}.
[I 2025-08-29 23:04:50,713] Trial 786 finished with values: [-1000000000.0, 1000000000.0] and parameters: {'p_sma': 50, 'p_std': 27, 'p_atr': 28, 'p_adx': 27, 'rsi_period': 21, 'ema1': 23, 'ema2': 17, 'slip_atr_k': 0.07961431097051791, 'slip_spread_k': 0.8367202924169507, 'spread_hl_frac': 0.014321786208418614, 'bb_std_mult': 2.1817420716196834, 'rsi_os': 39, 'rsi_ob': 72, 'vol_spike': 0.1779973752911992, 'adx_thresh': 21.99180498148121, 'atr_min_pct': 0.02830529788972523, 'atr_max_pct': 0.09560080775046263, 'tp_mult': 1.0143526660481341, 'tsl_mult': 0.2117329778973716, 'strategy': 'breakout', 'time_stop': 285, 'use_sma': False, 'use_atr': False, 'use_adx': False, 'use_ema': False, 'use_spike': False, 'rsi_required': False, 'edge_k': 0.9540177584781808, 'edge_cap': 0.6498296681770032}.
[I 2025-08-29 23:04:50,780] Trial 787 finished with values: [-1000000000.0, 1000000000.0] and parameters: {'p_sma': 42, 'p_std': 27, 'p_atr': 23, 'p_adx': 27, 'rsi_period': 21, 'ema1': 23, 'ema2': 55, 'slip_atr_k': 0.024192382892045592, 'slip_spread_k': 0.851319005490797, 'spread_hl_frac': 0.049992932860667416, 'bb_std_mult': 1.9897640795757126, 'rsi_os': 39, 'rsi_ob': 58, 'vol_spike': 0.17859654765200597, 'adx_thresh': 24.399677567134802, 'atr_min_pct': 0.024283496916295944, 'atr_max_pct': 0.09536524292610103, 'tp_mult': 2.5256250781596457, 'tsl_mult': 0.7239981668379394, 'strategy': 'breakout', 'time_stop': 127, 'use_sma': False, 'use_atr': False, 'use_adx': False, 'use_ema': False, 'use_spike': False, 'rsi_required': False, 'edge_k': 0.5252242306137953, 'edge_cap': 0.8561993051511523}.
[I 2025-08-29 23:04:51,024] Trial 788 finished with values: [-1000000000.0, 1000000000.0] and parameters: {'p_sma': 54, 'p_std': 18, 'p_atr': 23, 'p_adx': 7, 'rsi_period': 23, 'ema1': 24, 'ema2': 50, 'slip_atr_k': 0.02338554247337306, 'slip_spread_k': 0.9959442160909906, 'spread_hl_frac': 0.02070500343070039, 'bb_std_mult': 1.9904698115818955, 'rsi_os': 5, 'rsi_ob': 69, 'vol_spike': 0.25801019405738534, 'adx_thresh': 11.423186893098116, 'atr_min_pct': 0.024236801859931042, 'atr_max_pct': 0.016543675309266842, 'tp_mult': 2.068186422512041, 'tsl_mult': 0.41205395201769396, 'strategy': 'mean_reversion', 'time_stop': 285, 'use_sma': False, 'use_atr': False, 'use_adx': False, 'use_ema': False, 'use_spike': False, 'rsi_required': False, 'edge_k': 0.9625951619588735, 'edge_cap': 0.9642966029606643}.
[I 2025-08-29 23:04:51,137] Trial 792 finished with values: [-1000000000.0, 1000000000.0] and parameters: {'p_sma': 18, 'p_std': 15, 'p_atr': 21, 'p_adx': 16, 'rsi_period': 50, 'ema1': 26, 'ema2': 45, 'slip_atr_k': 0.03117874984775399, 'slip_spread_k': 0.819684361779315, 'spread_hl_frac': 0.03655750563274251, 'bb_std_mult': 1.222794210104725, 'rsi_os': 31, 'rsi_ob': 46, 'vol_spike': 0.18645807381668536, 'adx_thresh': 27.714799125857695, 'atr_min_pct': 0.0022826537725075258, 'atr_max_pct': 0.04654511718135499, 'tp_mult': 2.758299397460914, 'tsl_mult': 0.7054699946556754, 'strategy': 'mean_reversion', 'time_stop': 113, 'use_sma': False, 'use_atr': False, 'use_adx': False, 'use_ema': False, 'use_spike': False, 'rsi_required': False, 'edge_k': 0.8702187981244793, 'edge_cap': 0.8136301835645338}.
[I 2025-08-29 23:05:17,255] Trial 791 finished with values: [-0.00831912288899872, 0.008296645778415174] and parameters: {'p_sma': 54, 'p_std': 47, 'p_atr': 21, 'p_adx': 24, 'rsi_period': 66, 'ema1': 24, 'ema2': 49, 'slip_atr_k': 0.1922361097615952, 'slip_spread_k': 0.816100219264526, 'spread_hl_frac': 0.016190409990662798, 'bb_std_mult': 1.9489158862544662, 'rsi_os': 28, 'rsi_ob': 79, 'vol_spike': 0.18581579129535256, 'adx_thresh': 11.093829717339093, 'atr_min_pct': 0.0021714464655352736, 'atr_max_pct': 0.11483003968829184, 'tp_mult': 1.6092188905336817, 'tsl_mult': 0.32815518157471335, 'strategy': 'mean_reversion', 'time_stop': 113, 'use_sma': False, 'use_atr': False, 'use_adx': False, 'use_ema': False, 'use_spike': False, 'rsi_required': False, 'edge_k': 1.4052132854492723, 'edge_cap': 0.30127841929731486}.
[I 2025-08-29 23:05:17,276] Trial 789 finished with values: [-0.00607937358092292, 0.0061165411582236005] and parameters: {'p_sma': 17, 'p_std': 29, 'p_atr': 21, 'p_adx': 27, 'rsi_period': 22, 'ema1': 24, 'ema2': 17, 'slip_atr_k': 0.07790689048744369, 'slip_spread_k': 0.8213089763356315, 'spread_hl_frac': 0.014726600991378147, 'bb_std_mult': 1.9770749815729074, 'rsi_os': 20, 'rsi_ob': 60, 'vol_spike': 0.18370390125409233, 'adx_thresh': 24.30477999623988, 'atr_min_pct': 0.003001429951816941, 'atr_max_pct': 0.13280134282144118, 'tp_mult': 1.204540893408546, 'tsl_mult': 0.328355949343044, 'strategy': 'mean_reversion', 'time_stop': 232, 'use_sma': False, 'use_atr': False, 'use_adx': False, 'use_ema': False, 'use_spike': False, 'rsi_required': False, 'edge_k': 1.3794886527861558, 'edge_cap': 0.8164802471732014}.
[I 2025-08-29 23:05:17,480] Trial 790 finished with values: [-0.005863677169001824, 0.005943044701867206] and parameters: {'p_sma': 17, 'p_std': 23, 'p_atr': 21, 'p_adx': 7, 'rsi_period': 66, 'ema1': 24, 'ema2': 53, 'slip_atr_k': 0.03501564881008129, 'slip_spread_k': 0.8181742556039929, 'spread_hl_frac': 0.015799171065095347, 'bb_std_mult': 1.2491830513086684, 'rsi_os': 26, 'rsi_ob': 60, 'vol_spike': 0.19850161724451834, 'adx_thresh': 26.779709373413226, 'atr_min_pct': 0.0023171559031421284, 'atr_max_pct': 0.1161621030518071, 'tp_mult': 2.76008014968981, 'tsl_mult': 0.7440697267591531, 'strategy': 'mean_reversion', 'time_stop': 112, 'use_sma': False, 'use_atr': False, 'use_adx': False, 'use_ema': False, 'use_spike': False, 'rsi_required': False, 'edge_k': 0.8685971740770102, 'edge_cap': 0.8154608078084992}.
[I 2025-08-29 23:05:18,204] Trial 793 finished with values: [-0.01688813175050652, 0.01686158870908332] and parameters: {'p_sma': 39, 'p_std': 23, 'p_atr': 8, 'p_adx': 14, 'rsi_period': 16, 'ema1': 16, 'ema2': 53, 'slip_atr_k': 0.00896572855440575, 'slip_spread_k': 0.8706973516060895, 'spread_hl_frac': 0.015327505519259965, 'bb_std_mult': 2.03962678459264, 'rsi_os': 28, 'rsi_ob': 60, 'vol_spike': 0.1973998152185413, 'adx_thresh': 26.903827628170212, 'atr_min_pct': 0.003087134346857979, 'atr_max_pct': 0.036463564972529894, 'tp_mult': 2.8385474354427727, 'tsl_mult': 0.3469948693037568, 'strategy': 'breakout', 'time_stop': 115, 'use_sma': False, 'use_atr': False, 'use_adx': False, 'use_ema': False, 'use_spike': False, 'rsi_required': False, 'edge_k': 0.6203863770521595, 'edge_cap': 0.683519232901557}.
[I 2025-08-29 23:05:45,092] Trial 796 finished with values: [-1000000000.0, 1000000000.0] and parameters: {'p_sma': 13, 'p_std': 8, 'p_atr': 15, 'p_adx': 28, 'rsi_period': 29, 'ema1': 21, 'ema2': 54, 'slip_atr_k': 0.004818557284280947, 'slip_spread_k': 0.8678014492958842, 'spread_hl_frac': 0.030701994382313205, 'bb_std_mult': 0.6835042481058595, 'rsi_os': 8, 'rsi_ob': 49, 'vol_spike': 0.15867919287087198, 'adx_thresh': 25.96572146629274, 'atr_min_pct': 0.0031941610843118566, 'atr_max_pct': 0.09068537845624204, 'tp_mult': 1.1527302503250747, 'tsl_mult': 0.027276791703726433, 'strategy': 'breakout', 'time_stop': 120, 'use_sma': False, 'use_atr': False, 'use_adx': False, 'use_ema': False, 'use_spike': False, 'rsi_required': False, 'edge_k': 0.6123407666586511, 'edge_cap': 0.7721235545692672}.
[I 2025-08-29 23:05:45,612] Trial 795 finished with values: [-1000000000.0, 1000000000.0] and parameters: {'p_sma': 6, 'p_std': 23, 'p_atr': 12, 'p_adx': 25, 'rsi_period': 32, 'ema1': 10, 'ema2': 43, 'slip_atr_k': 0.0072728795347313715, 'slip_spread_k': 0.5316169664207678, 'spread_hl_frac': 0.0027829827919554143, 'bb_std_mult': 1.3255318715934745, 'rsi_os': 26, 'rsi_ob': 81, 'vol_spike': 0.21033980356187804, 'adx_thresh': 26.492771222813424, 'atr_min_pct': 0.0032166180689611598, 'atr_max_pct': 0.027156284424370916, 'tp_mult': 1.1591958929270307, 'tsl_mult': 0.7460488263598068, 'strategy': 'breakout', 'time_stop': 204, 'use_sma': False, 'use_atr': False, 'use_adx': False, 'use_ema': False, 'use_spike': False, 'rsi_required': False, 'edge_k': 0.6436843762907921, 'edge_cap': 0.24126230030468326}.
[I 2025-08-29 23:05:45,834] Trial 797 finished with values: [-1000000000.0, 1000000000.0] and parameters: {'p_sma': 14, 'p_std': 24, 'p_atr': 17, 'p_adx': 17, 'rsi_period': 18, 'ema1': 8, 'ema2': 54, 'slip_atr_k': 0.005369138045610226, 'slip_spread_k': 0.3947970490367382, 'spread_hl_frac': 0.018172988050539192, 'bb_std_mult': 3.183808175961503, 'rsi_os': 26, 'rsi_ob': 75, 'vol_spike': 0.2748146002892757, 'adx_thresh': 22.99400942637879, 'atr_min_pct': 0.01554875825456818, 'atr_max_pct': 0.09089557647804755, 'tp_mult': 1.1621364157163547, 'tsl_mult': 0.6227918702583933, 'strategy': 'breakout', 'time_stop': 44, 'use_sma': False, 'use_atr': False, 'use_adx': False, 'use_ema': False, 'use_spike': False, 'rsi_required': False, 'edge_k': 1.6737832763135305, 'edge_cap': 0.774956818585879}.
[I 2025-08-29 23:05:46,001] Trial 794 finished with values: [-1000000000.0, 1000000000.0] and parameters: {'p_sma': 6, 'p_std': 24, 'p_atr': 12, 'p_adx': 25, 'rsi_period': 16, 'ema1': 21, 'ema2': 53, 'slip_atr_k': 0.2186151542569455, 'slip_spread_k': 0.527928862450476, 'spread_hl_frac': 0.030563511850823614, 'bb_std_mult': 1.4096406167062119, 'rsi_os': 26, 'rsi_ob': 50, 'vol_spike': 0.21010429106560463, 'adx_thresh': 26.623382155386143, 'atr_min_pct': 0.003301834239025447, 'atr_max_pct': 0.09856074271520443, 'tp_mult': 1.1566178043595534, 'tsl_mult': 0.6332852216012063, 'strategy': 'breakout', 'time_stop': 269, 'use_sma': False, 'use_atr': False, 'use_adx': False, 'use_ema': False, 'use_spike': False, 'rsi_required': False, 'edge_k': 1.8143368363601542, 'edge_cap': 0.775001477884584}.
[I 2025-08-29 23:06:13,374] Trial 799 finished with values: [-1000000000.0, 1000000000.0] and parameters: {'p_sma': 36, 'p_std': 25, 'p_atr': 17, 'p_adx': 17, 'rsi_period': 18, 'ema1': 25, 'ema2': 21, 'slip_atr_k': 0.01495484847205275, 'slip_spread_k': 0.1995049851204147, 'spread_hl_frac': 0.02206974860156931, 'bb_std_mult': 1.6062205002208383, 'rsi_os': 13, 'rsi_ob': 75, 'vol_spike': 0.02962815620521761, 'adx_thresh': 23.246907801961818, 'atr_min_pct': 0.012905529422386278, 'atr_max_pct': 0.09950971489861404, 'tp_mult': 1.0550098945012247, 'tsl_mult': 0.9820464221112812, 'strategy': 'breakout', 'time_stop': 79, 'use_sma': False, 'use_atr': False, 'use_adx': False, 'use_ema': False, 'use_spike': False, 'rsi_required': False, 'edge_k': 0.7281669635384675, 'edge_cap': 0.5900285778303795}.
[I 2025-08-29 23:06:13,570] Trial 800 finished with values: [-1000000000.0, 1000000000.0] and parameters: {'p_sma': 57, 'p_std': 11, 'p_atr': 24, 'p_adx': 16, 'rsi_period': 26, 'ema1': 25, 'ema2': 56, 'slip_atr_k': 0.2034056606587798, 'slip_spread_k': 0.19982191345180222, 'spread_hl_frac': 0.022545106807862196, 'bb_std_mult': 1.827198866847576, 'rsi_os': 24, 'rsi_ob': 71, 'vol_spike': 0.1914789641072454, 'adx_thresh': 25.62916798395719, 'atr_min_pct': 0.013794305509240346, 'atr_max_pct': 0.10746597284506576, 'tp_mult': 1.071161944702515, 'tsl_mult': 0.8979012371062165, 'strategy': 'breakout', 'time_stop': 107, 'use_sma': False, 'use_atr': False, 'use_adx': False, 'use_ema': False, 'use_spike': False, 'rsi_required': False, 'edge_k': 0.7263453347933091, 'edge_cap': 0.7866601981979117}.
[I 2025-08-29 23:06:13,789] Trial 801 finished with values: [-0.043796334465871944, 0.04377804873992108] and parameters: {'p_sma': 9, 'p_std': 31, 'p_atr': 24, 'p_adx': 11, 'rsi_period': 26, 'ema1': 25, 'ema2': 57, 'slip_atr_k': 0.02032126730645824, 'slip_spread_k': 0.5905685645296966, 'spread_hl_frac': 0.04491902472661207, 'bb_std_mult': 1.8080161182544998, 'rsi_os': 53, 'rsi_ob': 62, 'vol_spike': 0.1720352117478873, 'adx_thresh': 31.029226172813708, 'atr_min_pct': 0.0011930244008877637, 'atr_max_pct': 0.05670854500152084, 'tp_mult': 1.0736118009860496, 'tsl_mult': 0.00041888408426904444, 'strategy': 'breakout', 'time_stop': 194, 'use_sma': False, 'use_atr': False, 'use_adx': False, 'use_ema': False, 'use_spike': False, 'rsi_required': False, 'edge_k': 0.4701384221996155, 'edge_cap': 0.8347253226838478}.
[I 2025-08-29 23:06:13,790] Trial 798 finished with values: [-1000000000.0, 1000000000.0] and parameters: {'p_sma': 6, 'p_std': 54, 'p_atr': 12, 'p_adx': 25, 'rsi_period': 18, 'ema1': 25, 'ema2': 28, 'slip_atr_k': 0.01416402046396769, 'slip_spread_k': 0.6709692849810789, 'spread_hl_frac': 0.018282378007939696, 'bb_std_mult': 1.5851451041635558, 'rsi_os': 53, 'rsi_ob': 62, 'vol_spike': 0.2100526837518488, 'adx_thresh': 23.004257671517696, 'atr_min_pct': 0.013815959398895494, 'atr_max_pct': 0.08445195515249805, 'tp_mult': 1.0510160706549403, 'tsl_mult': 0.7465993036102065, 'strategy': 'breakout', 'time_stop': 43, 'use_sma': False, 'use_atr': False, 'use_adx': False, 'use_ema': False, 'use_spike': False, 'rsi_required': False, 'edge_k': 0.4604055954389559, 'edge_cap': 0.7904015304836371}.
[I 2025-08-29 23:06:40,968] Trial 802 finished with values: [-0.008661920578337257, 0.008627262960105568] and parameters: {'p_sma': 9, 'p_std': 25, 'p_atr': 11, 'p_adx': 15, 'rsi_period': 25, 'ema1': 25, 'ema2': 56, 'slip_atr_k': 0.2022088925041008, 'slip_spread_k': 0.4233404967263031, 'spread_hl_frac': 0.04860003863396592, 'bb_std_mult': 1.8307149462819983, 'rsi_os': 24, 'rsi_ob': 62, 'vol_spike': 0.17295767015506122, 'adx_thresh': 25.549832455370804, 'atr_min_pct': 0.0018513137868148473, 'atr_max_pct': 0.10704376117370487, 'tp_mult': 2.1757410009540994, 'tsl_mult': 0.788925195450053, 'strategy': 'breakout', 'time_stop': 12, 'use_sma': False, 'use_atr': False, 'use_adx': False, 'use_ema': False, 'use_spike': False, 'rsi_required': False, 'edge_k': 0.12920233702507167, 'edge_cap': 0.7888195334164522}.
[I 2025-08-29 23:06:41,135] Trial 804 finished with values: [-0.005352735570053335, 0.005409076933084004] and parameters: {'p_sma': 15, 'p_std': 60, 'p_atr': 11, 'p_adx': 15, 'rsi_period': 84, 'ema1': 18, 'ema2': 55, 'slip_atr_k': 0.027656036868738312, 'slip_spread_k': 0.4216678428991604, 'spread_hl_frac': 0.03903016897993196, 'bb_std_mult': 2.294949409866559, 'rsi_os': 36, 'rsi_ob': 59, 'vol_spike': 0.16243663592386454, 'adx_thresh': 24.760347661511613, 'atr_min_pct': 0.001898048038121293, 'atr_max_pct': 0.06907217335590338, 'tp_mult': 1.2124211982441482, 'tsl_mult': 0.5043156152062166, 'strategy': 'breakout', 'time_stop': 97, 'use_sma': False, 'use_atr': False, 'use_adx': False, 'use_ema': False, 'use_spike': False, 'rsi_required': False, 'edge_k': 1.0078870087441758, 'edge_cap': 0.3230915841392613}.
[I 2025-08-29 23:06:41,348] Trial 803 finished with values: [-0.008642311602539143, 0.008614935896926175] and parameters: {'p_sma': 26, 'p_std': 25, 'p_atr': 16, 'p_adx': 11, 'rsi_period': 83, 'ema1': 25, 'ema2': 55, 'slip_atr_k': 0.020986946123139977, 'slip_spread_k': 0.7779648210496709, 'spread_hl_frac': 0.0189049528871887, 'bb_std_mult': 2.118165868408343, 'rsi_os': 25, 'rsi_ob': 62, 'vol_spike': 0.1725361204958476, 'adx_thresh': 31.018149135985965, 'atr_min_pct': 0.00014378117852705983, 'atr_max_pct': 0.05678252125680967, 'tp_mult': 1.2066099986353274, 'tsl_mult': 0.7140191338153953, 'strategy': 'breakout', 'time_stop': 100, 'use_sma': False, 'use_atr': False, 'use_adx': False, 'use_ema': False, 'use_spike': False, 'rsi_required': False, 'edge_k': 0.465959968758236, 'edge_cap': 0.15517826715807986}.
[I 2025-08-29 23:06:41,439] Trial 805 finished with values: [-0.0022934823383325975, 0.0027373204711148218] and parameters: {'p_sma': 12, 'p_std': 51, 'p_atr': 25, 'p_adx': 15, 'rsi_period': 24, 'ema1': 24, 'ema2': 31, 'slip_atr_k': 0.024859737740183237, 'slip_spread_k': 0.42271709152379355, 'spread_hl_frac': 0.011362956644556927, 'bb_std_mult': 2.123831022555342, 'rsi_os': 21, 'rsi_ob': 64, 'vol_spike': 0.16309137566932053, 'adx_thresh': 25.006105886924786, 'atr_min_pct': 0.001865450487312039, 'atr_max_pct': 0.02124373771691876, 'tp_mult': 2.1998524263420585, 'tsl_mult': 0.9318342299290319, 'strategy': 'breakout', 'time_stop': 165, 'use_sma': False, 'use_atr': False, 'use_adx': False, 'use_ema': False, 'use_spike': False, 'rsi_required': False, 'edge_k': 0.5248606428399806, 'edge_cap': 0.4091845116062355}.
[I 2025-08-29 23:06:41,705] Trial 808 finished with values: [-1000000000.0, 1000000000.0] and parameters: {'p_sma': 7, 'p_std': 43, 'p_atr': 23, 'p_adx': 9, 'rsi_period': 23, 'ema1': 24, 'ema2': 31, 'slip_atr_k': 0.1687176849071823, 'slip_spread_k': 0.9606677619327304, 'spread_hl_frac': 0.020477496737843267, 'bb_std_mult': 3.5424066923974253, 'rsi_os': 50, 'rsi_ob': 64, 'vol_spike': 0.2248569831000546, 'adx_thresh': 24.94439325136804, 'atr_min_pct': 0.005041987561849334, 'atr_max_pct': 0.09449229953008717, 'tp_mult': 1.1236704207319197, 'tsl_mult': 0.929030030197638, 'strategy': 'mean_reversion', 'time_stop': 130, 'use_sma': False, 'use_atr': False, 'use_adx': False, 'use_ema': False, 'use_spike': False, 'rsi_required': False, 'edge_k': 0.5308477299702022, 'edge_cap': 0.41591353257112973}.
[I 2025-08-29 23:06:41,714] Trial 809 finished with values: [-1000000000.0, 1000000000.0] and parameters: {'p_sma': 20, 'p_std': 27, 'p_atr': 23, 'p_adx': 9, 'rsi_period': 38, 'ema1': 24, 'ema2': 51, 'slip_atr_k': 0.05993805001950751, 'slip_spread_k': 0.16480754238506717, 'spread_hl_frac': 0.019800873036949915, 'bb_std_mult': 2.036792230949122, 'rsi_os': 28, 'rsi_ob': 59, 'vol_spike': 0.1841804608456202, 'adx_thresh': 24.8503905471961, 'atr_min_pct': 0.024895164527715098, 'atr_max_pct': 0.01950610563967165, 'tp_mult': 1.1177682961715028, 'tsl_mult': 0.6799884198840186, 'strategy': 'mean_reversion', 'time_stop': 108, 'use_sma': False, 'use_atr': False, 'use_adx': False, 'use_ema': False, 'use_spike': False, 'rsi_required': False, 'edge_k': 0.5259466725785122, 'edge_cap': 0.45744879329279853}.
[I 2025-08-29 23:06:42,006] Trial 810 finished with values: [-1000000000.0, 1000000000.0] and parameters: {'p_sma': 38, 'p_std': 35, 'p_atr': 25, 'p_adx': 16, 'rsi_period': 12, 'ema1': 24, 'ema2': 51, 'slip_atr_k': 0.02423669102836903, 'slip_spread_k': 0.8066793297456077, 'spread_hl_frac': 0.011344765632695748, 'bb_std_mult': 1.7216684076105444, 'rsi_os': 34, 'rsi_ob': 77, 'vol_spike': 0.18441063440988587, 'adx_thresh': 9.922948225013458, 'atr_min_pct': 0.02692280510127841, 'atr_max_pct': 0.010163824515839567, 'tp_mult': 2.6835199713009192, 'tsl_mult': 0.6923627945116861, 'strategy': 'breakout', 'time_stop': 237, 'use_sma': False, 'use_atr': False, 'use_adx': False, 'use_ema': False, 'use_spike': False, 'rsi_required': False, 'edge_k': 0.5079712681880526, 'edge_cap': 0.8115050900595823}.
[I 2025-08-29 23:07:06,842] Trial 806 finished with values: [-0.0011984139444910502, 0.0021173172504899735] and parameters: {'p_sma': 11, 'p_std': 59, 'p_atr': 22, 'p_adx': 16, 'rsi_period': 23, 'ema1': 7, 'ema2': 31, 'slip_atr_k': 0.02900490798434005, 'slip_spread_k': 0.8015132012940671, 'spread_hl_frac': 0.019509518667091167, 'bb_std_mult': 2.8574162568208465, 'rsi_os': 25, 'rsi_ob': 59, 'vol_spike': 0.18550448693852734, 'adx_thresh': 9.961092672054905, 'atr_min_pct': 0.0026058576379147614, 'atr_max_pct': 0.021661545197060997, 'tp_mult': 1.1287700372329732, 'tsl_mult': 0.9260607496226193, 'strategy': 'breakout', 'time_stop': 98, 'use_sma': False, 'use_atr': False, 'use_adx': False, 'use_ema': False, 'use_spike': False, 'rsi_required': False, 'edge_k': 1.9518569013378375, 'edge_cap': 0.4593598731270626}.
