[I 2025-08-29 23:13:12,275] Trial 866 finished with values: [-0.003028205627396363, 0.0031591300353598904] and parameters: {'p_sma': 31, 'p_std': 47, 'p_atr': 18, 'p_adx': 15, 'rsi_period': 41, 'ema1': 19, 'ema2': 53, 'slip_atr_k': 0.013755339876118537, 'slip_spread_k': 0.4521402241096263, 'spread_hl_frac': 0.017596852055273855, 'bb_std_mult': 3.311914338385871, 'rsi_os': 26, 'rsi_ob': 63, 'vol_spike': 0.17184718738158072, 'adx_thresh': 24.975566133156445, 'atr_min_pct': 0.0028366163742844213, 'atr_max_pct': 0.08812160028543733, 'tp_mult': 1.126675756250591, 'tsl_mult': 0.707188007093196, 'strategy': 'breakout', 'time_stop': 95, 'use_sma': False, 'use_atr': False, 'use_adx': False, 'use_ema': False, 'use_spike': False, 'rsi_required': False, 'edge_k': 0.6004481310923029, 'edge_cap': 0.40132635257280846}.
[I 2025-08-29 23:13:12,495] Trial 865 finished with values: [-1000000000.0, 1000000000.0] and parameters: {'p_sma': 38, 'p_std': 25, 'p_atr': 8, 'p_adx': 23, 'rsi_period': 61, 'ema1': 21, 'ema2': 18, 'slip_atr_k': 0.1372867101467237, 'slip_spread_k': 0.39528032744368347, 'spread_hl_frac': 0.02888172118601116, 'bb_std_mult': 3.3001281468150485, 'rsi_os': 24, 'rsi_ob': 64, 'vol_spike': 0.17547658382461925, 'adx_thresh': 26.146133283110355, 'atr_min_pct': 0.014664461851165416, 'atr_max_pct': 0.14977306728668716, 'tp_mult': 1.1220583330158473, 'tsl_mult': 0.7276786766805607, 'strategy': 'breakout', 'time_stop': 94, 'use_sma': False, 'use_atr': False, 'use_adx': False, 'use_ema': False, 'use_spike': False, 'rsi_required': False, 'edge_k': 0.591932908730621, 'edge_cap': 0.28279315111847525}.
[I 2025-08-29 23:13:12,801] Trial 867 finished with values: [-1000000000.0, 1000000000.0] and parameters: {'p_sma': 6, 'p_std': 24, 'p_atr': 22, 'p_adx': 10, 'rsi_period': 68, 'ema1': 21, 'ema2': 53, 'slip_atr_k': 0.19443511917536455, 'slip_spread_k': 0.6035194199889105, 'spread_hl_frac': 0.020296435080893405, 'bb_std_mult': 2.438861929529981, 'rsi_os': 19, 'rsi_ob': 63, 'vol_spike': 0.29292056498312213, 'adx_thresh': 24.134069620769303, 'atr_min_pct': 0.0019240673280600641, 'atr_max_pct': 0.08897646203621414, 'tp_mult': 2.6016969708504787, 'tsl_mult': 0.6806934877005056, 'strategy': 'breakout', 'time_stop': 96, 'use_sma': False, 'use_atr': False, 'use_adx': False, 'use_ema': False, 'use_spike': False, 'rsi_required': False, 'edge_k': 1.3539254952053894, 'edge_cap': 0.8660385402819473}.
[I 2025-08-29 23:13:12,801] Trial 864 finished with values: [-1000000000.0, 1000000000.0] and parameters: {'p_sma': 33, 'p_std': 17, 'p_atr': 24, 'p_adx': 15, 'rsi_period': 36, 'ema1': 19, 'ema2': 27, 'slip_atr_k': 0.1442161770925961, 'slip_spread_k': 0.602425372275681, 'spread_hl_frac': 0.019856264044435887, 'bb_std_mult': 3.3153072457744592, 'rsi_os': 27, 'rsi_ob': 61, 'vol_spike': 0.1735780270847122, 'adx_thresh': 25.915421390299183, 'atr_min_pct': 0.012645581559527054, 'atr_max_pct': 0.061839474679717246, 'tp_mult': 2.697907721582582, 'tsl_mult': 0.7320870665265246, 'strategy': 'breakout', 'time_stop': 94, 'use_sma': False, 'use_atr': False, 'use_adx': False, 'use_ema': False, 'use_spike': False, 'rsi_required': False, 'edge_k': 0.5833595780214881, 'edge_cap': 0.16745489637090288}.
[I 2025-08-29 23:13:40,037] Trial 868 finished with values: [-1000000000.0, 1000000000.0] and parameters: {'p_sma': 22, 'p_std': 46, 'p_atr': 23, 'p_adx': 21, 'rsi_period': 61, 'ema1': 23, 'ema2': 52, 'slip_atr_k': 0.012475411762697109, 'slip_spread_k': 0.5966670538129824, 'spread_hl_frac': 0.028945123787312083, 'bb_std_mult': 1.977174441726328, 'rsi_os': 33, 'rsi_ob': 59, 'vol_spike': 0.29421286056120843, 'adx_thresh': 10.52921606049464, 'atr_min_pct': 0.00613080421130472, 'atr_max_pct': 0.014589359608509253, 'tp_mult': 2.6035062251248533, 'tsl_mult': 0.7113539972333356, 'strategy': 'breakout', 'time_stop': 199, 'use_sma': False, 'use_atr': False, 'use_adx': False, 'use_ema': False, 'use_spike': False, 'rsi_required': False, 'edge_k': 0.4769016873544095, 'edge_cap': 0.7676979797875764}.
[I 2025-08-29 23:13:40,225] Trial 871 finished with values: [-1000000000.0, 1000000000.0] and parameters: {'p_sma': 8, 'p_std': 22, 'p_atr': 23, 'p_adx': 15, 'rsi_period': 19, 'ema1': 23, 'ema2': 60, 'slip_atr_k': 0.22203071903808475, 'slip_spread_k': 0.7793644347689326, 'spread_hl_frac': 0.04443339742457833, 'bb_std_mult': 1.9667454505690911, 'rsi_os': 33, 'rsi_ob': 59, 'vol_spike': 0.18619945811128566, 'adx_thresh': 28.105498478469386, 'atr_min_pct': 0.006038182686683834, 'atr_max_pct': 0.01550116267105621, 'tp_mult': 1.1927380514402235, 'tsl_mult': 0.7100698514707918, 'strategy': 'breakout', 'time_stop': 207, 'use_sma': False, 'use_atr': False, 'use_adx': False, 'use_ema': False, 'use_spike': False, 'rsi_required': False, 'edge_k': 0.9030859134446831, 'edge_cap': 0.7649397030607069}.
[I 2025-08-29 23:13:40,246] Trial 870 finished with values: [-1000000000.0, 1000000000.0] and parameters: {'p_sma': 18, 'p_std': 22, 'p_atr': 23, 'p_adx': 21, 'rsi_period': 28, 'ema1': 23, 'ema2': 12, 'slip_atr_k': 0.1150351560260905, 'slip_spread_k': 0.7718827604413219, 'spread_hl_frac': 0.017680933316269135, 'bb_std_mult': 2.233873762228049, 'rsi_os': 26, 'rsi_ob': 59, 'vol_spike': 0.18427174867118587, 'adx_thresh': 28.318595569201683, 'atr_min_pct': 0.006260759367078055, 'atr_max_pct': 0.014819700740655292, 'tp_mult': 1.1962062141767533, 'tsl_mult': 0.7064254412523155, 'strategy': 'breakout', 'time_stop': 110, 'use_sma': False, 'use_atr': False, 'use_adx': False, 'use_ema': False, 'use_spike': False, 'rsi_required': False, 'edge_k': 0.6860753427320905, 'edge_cap': 0.8811995191838187}.
[I 2025-08-29 23:13:40,320] Trial 869 finished with values: [-1000000000.0, 1000000000.0] and parameters: {'p_sma': 6, 'p_std': 24, 'p_atr': 23, 'p_adx': 21, 'rsi_period': 19, 'ema1': 23, 'ema2': 13, 'slip_atr_k': 0.01424044219537524, 'slip_spread_k': 0.4432961748141596, 'spread_hl_frac': 0.01945007487455639, 'bb_std_mult': 2.6699956755556378, 'rsi_os': 14, 'rsi_ob': 48, 'vol_spike': 0.183417875493086, 'adx_thresh': 28.149208001195767, 'atr_min_pct': 0.027943548959483134, 'atr_max_pct': 0.08922715796489963, 'tp_mult': 1.6163900537901121, 'tsl_mult': 0.8440006322887086, 'strategy': 'breakout', 'time_stop': 124, 'use_sma': False, 'use_atr': False, 'use_adx': False, 'use_ema': False, 'use_spike': False, 'rsi_required': False, 'edge_k': 0.49768522837506424, 'edge_cap': 0.1599455750441824}.
[I 2025-08-29 23:14:06,745] Trial 875 finished with values: [-0.01005771516652021, 0.010045695496370357] and parameters: {'p_sma': 8, 'p_std': 5, 'p_atr': 23, 'p_adx': 24, 'rsi_period': 79, 'ema1': 11, 'ema2': 53, 'slip_atr_k': 0.042001320182367505, 'slip_spread_k': 0.8313206605933746, 'spread_hl_frac': 0.019050597541902047, 'bb_std_mult': 2.017013691786086, 'rsi_os': 26, 'rsi_ob': 60, 'vol_spike': 0.2195519286283712, 'adx_thresh': 18.619379535380954, 'atr_min_pct': 0.002284397402095179, 'atr_max_pct': 0.10999427833300764, 'tp_mult': 1.934399635729483, 'tsl_mult': 0.775496146481379, 'strategy': 'mean_reversion', 'time_stop': 291, 'use_sma': False, 'use_atr': False, 'use_adx': False, 'use_ema': False, 'use_spike': False, 'rsi_required': False, 'edge_k': 0.632909451212304, 'edge_cap': 0.6984719558193815}.
[I 2025-08-29 23:14:07,477] Trial 873 finished with values: [-1000000000.0, 1000000000.0] and parameters: {'p_sma': 31, 'p_std': 28, 'p_atr': 23, 'p_adx': 18, 'rsi_period': 22, 'ema1': 7, 'ema2': 57, 'slip_atr_k': 0.017166061849407614, 'slip_spread_k': 0.8355680131101713, 'spread_hl_frac': 0.01666193366276294, 'bb_std_mult': 2.6965791575156395, 'rsi_os': 26, 'rsi_ob': 91, 'vol_spike': 0.17963063109417451, 'adx_thresh': 23.443609925842416, 'atr_min_pct': 0.009817777127903632, 'atr_max_pct': 0.07287968753988608, 'tp_mult': 1.1140944911397526, 'tsl_mult': 0.6799288102533964, 'strategy': 'mean_reversion', 'time_stop': 111, 'use_sma': False, 'use_atr': False, 'use_adx': False, 'use_ema': False, 'use_spike': False, 'rsi_required': False, 'edge_k': 0.4745082956036021, 'edge_cap': 0.41499174620286744}.
[I 2025-08-29 23:14:07,732] Trial 874 finished with values: [-1000000000.0, 1000000000.0] and parameters: {'p_sma': 6, 'p_std': 28, 'p_atr': 23, 'p_adx': 18, 'rsi_period': 22, 'ema1': 11, 'ema2': 53, 'slip_atr_k': 0.01687003990647678, 'slip_spread_k': 0.8653661642478767, 'spread_hl_frac': 0.01908532872955586, 'bb_std_mult': 2.1105465955809857, 'rsi_os': 26, 'rsi_ob': 74, 'vol_spike': 0.2549375365674197, 'adx_thresh': 8.60071975147252, 'atr_min_pct': 0.002481074775681105, 'atr_max_pct': 0.10099072322749596, 'tp_mult': 1.5872205601965224, 'tsl_mult': 0.7645492746686293, 'strategy': 'mean_reversion', 'time_stop': 111, 'use_sma': False, 'use_atr': False, 'use_adx': False, 'use_ema': False, 'use_spike': False, 'rsi_required': False, 'edge_k': 0.47134519775786954, 'edge_cap': 0.5894560091952457}.
[I 2025-08-29 23:14:07,746] Trial 872 finished with values: [-1000000000.0, 0.1286013346163038] and parameters: {'p_sma': 50, 'p_std': 27, 'p_atr': 23, 'p_adx': 15, 'rsi_period': 12, 'ema1': 7, 'ema2': 31, 'slip_atr_k': 0.2212451456676131, 'slip_spread_k': 0.7733557563965271, 'spread_hl_frac': 0.04434779691958494, 'bb_std_mult': 2.2583754441110724, 'rsi_os': 26, 'rsi_ob': 59, 'vol_spike': 0.21765104261961668, 'adx_thresh': 25.14402961945046, 'atr_min_pct': 0.0005275223815071541, 'atr_max_pct': 0.035479859656666266, 'tp_mult': 1.5975589788440567, 'tsl_mult': 0.07790732204191486, 'strategy': 'mean_reversion', 'time_stop': 293, 'use_sma': False, 'use_atr': False, 'use_adx': False, 'use_ema': False, 'use_spike': False, 'rsi_required': False, 'edge_k': 0.47888048280229667, 'edge_cap': 0.7852255463688129}.
[I 2025-08-29 23:14:35,040] Trial 877 finished with values: [-1000000000.0, 1000000000.0] and parameters: {'p_sma': 51, 'p_std': 27, 'p_atr': 23, 'p_adx': 15, 'rsi_period': 17, 'ema1': 5, 'ema2': 54, 'slip_atr_k': 0.02635225839144678, 'slip_spread_k': 0.863446199390234, 'spread_hl_frac': 0.017931593733753165, 'bb_std_mult': 2.318536382159537, 'rsi_os': 24, 'rsi_ob': 74, 'vol_spike': 0.1674412410111582, 'adx_thresh': 25.089767835086842, 'atr_min_pct': 0.004894180944438587, 'atr_max_pct': 0.05147896963332914, 'tp_mult': 1.162590697217377, 'tsl_mult': 0.7447163152796262, 'strategy': 'breakout', 'time_stop': 150, 'use_sma': False, 'use_atr': False, 'use_adx': False, 'use_ema': False, 'use_spike': False, 'rsi_required': False, 'edge_k': 0.509022801457049, 'edge_cap': 0.45460634631885233}.
[I 2025-08-29 23:14:35,041] Trial 876 finished with values: [-0.013332179240311381, 0.0133137220173914] and parameters: {'p_sma': 44, 'p_std': 28, 'p_atr': 23, 'p_adx': 15, 'rsi_period': 22, 'ema1': 13, 'ema2': 54, 'slip_atr_k': 0.025819679671343618, 'slip_spread_k': 0.8688470777585188, 'spread_hl_frac': 0.003171611288360611, 'bb_std_mult': 2.075956124761664, 'rsi_os': 24, 'rsi_ob': 91, 'vol_spike': 0.2358239922621042, 'adx_thresh': 25.05886165728987, 'atr_min_pct': 0.0005582477324791182, 'atr_max_pct': 0.10126058096916572, 'tp_mult': 1.1320558758819872, 'tsl_mult': 0.22055092579436547, 'strategy': 'mean_reversion', 'time_stop': 111, 'use_sma': False, 'use_atr': False, 'use_adx': False, 'use_ema': False, 'use_spike': False, 'rsi_required': False, 'edge_k': 0.47725777660725266, 'edge_cap': 0.7927586622151614}.
[I 2025-08-29 23:14:35,063] Trial 879 finished with values: [-0.008959123782973255, 0.009045774632509015] and parameters: {'p_sma': 9, 'p_std': 25, 'p_atr': 15, 'p_adx': 16, 'rsi_period': 18, 'ema1': 24, 'ema2': 45, 'slip_atr_k': 0.08985926520513023, 'slip_spread_k': 0.8167764390965346, 'spread_hl_frac': 0.048999731056546904, 'bb_std_mult': 1.5540806153334779, 'rsi_os': 52, 'rsi_ob': 62, 'vol_spike': 0.16905226047161698, 'adx_thresh': 26.91081886272204, 'atr_min_pct': 0.003498356535285558, 'atr_max_pct': 0.09830373438057441, 'tp_mult': 1.1576570255903713, 'tsl_mult': 0.741753388742258, 'strategy': 'breakout', 'time_stop': 258, 'use_sma': False, 'use_atr': False, 'use_adx': False, 'use_ema': False, 'use_spike': False, 'rsi_required': False, 'edge_k': 0.5099755619576206, 'edge_cap': 0.8100023125021049}.
[I 2025-08-29 23:14:35,206] Trial 878 finished with values: [-0.008978801784921053, 0.008972221047147831] and parameters: {'p_sma': 44, 'p_std': 27, 'p_atr': 23, 'p_adx': 30, 'rsi_period': 12, 'ema1': 5, 'ema2': 56, 'slip_atr_k': 0.027019418427206496, 'slip_spread_k': 0.8112148461878339, 'spread_hl_frac': 0.0024120848511032175, 'bb_std_mult': 1.9041971768161212, 'rsi_os': 36, 'rsi_ob': 86, 'vol_spike': 0.17051273305676753, 'adx_thresh': 25.034534669273192, 'atr_min_pct': 0.003656150194791333, 'atr_max_pct': 0.09614809098289652, 'tp_mult': 1.1486450931486267, 'tsl_mult': 0.7412340222872527, 'strategy': 'breakout', 'time_stop': 259, 'use_sma': False, 'use_atr': False, 'use_adx': False, 'use_ema': False, 'use_spike': False, 'rsi_required': False, 'edge_k': 0.25389509886707506, 'edge_cap': 0.6564099502944626}.
[I 2025-08-29 23:15:01,987] Trial 881 finished with values: [-0.0045724223049521395, 0.004818404383905125] and parameters: {'p_sma': 46, 'p_std': 24, 'p_atr': 23, 'p_adx': 30, 'rsi_period': 25, 'ema1': 24, 'ema2': 56, 'slip_atr_k': 0.006810189531104549, 'slip_spread_k': 0.3319465156634248, 'spread_hl_frac': 0.022757529021962163, 'bb_std_mult': 1.7413679110340934, 'rsi_os': 22, 'rsi_ob': 86, 'vol_spike': 0.1581452081785946, 'adx_thresh': 26.57669784639525, 'atr_min_pct': 0.001896288027656052, 'atr_max_pct': 0.09531174253083818, 'tp_mult': 1.0409967004475935, 'tsl_mult': 0.4198817368252729, 'strategy': 'breakout', 'time_stop': 177, 'use_sma': False, 'use_atr': False, 'use_adx': False, 'use_ema': False, 'use_spike': False, 'rsi_required': False, 'edge_k': 0.442134521079539, 'edge_cap': 0.33805530466504713}.
[I 2025-08-29 23:15:01,999] Trial 880 finished with values: [-1000000000.0, 1000000000.0] and parameters: {'p_sma': 7, 'p_std': 24, 'p_atr': 23, 'p_adx': 17, 'rsi_period': 25, 'ema1': 24, 'ema2': 57, 'slip_atr_k': 0.007161281333336126, 'slip_spread_k': 0.9696890009332123, 'spread_hl_frac': 0.01652575238079175, 'bb_std_mult': 0.8425186705522574, 'rsi_os': 22, 'rsi_ob': 58, 'vol_spike': 0.15542160980822675, 'adx_thresh': 32.294655971337846, 'atr_min_pct': 0.010738679359709284, 'atr_max_pct': 0.038706288318823154, 'tp_mult': 1.0502275499184712, 'tsl_mult': 0.6962664988324238, 'strategy': 'breakout', 'time_stop': 124, 'use_sma': False, 'use_atr': False, 'use_adx': False, 'use_ema': False, 'use_spike': False, 'rsi_required': False, 'edge_k': 0.3694649761965576, 'edge_cap': 0.731228627335019}.
[I 2025-08-29 23:15:02,226] Trial 883 finished with values: [-1000000000.0, 1000000000.0] and parameters: {'p_sma': 7, 'p_std': 30, 'p_atr': 17, 'p_adx': 17, 'rsi_period': 24, 'ema1': 25, 'ema2': 52, 'slip_atr_k': 0.05605307615604446, 'slip_spread_k': 0.5508564352795206, 'spread_hl_frac': 0.016481799991693313, 'bb_std_mult': 1.75069381600114, 'rsi_os': 31, 'rsi_ob': 58, 'vol_spike': 0.0778864791152738, 'adx_thresh': 24.189692771776187, 'atr_min_pct': 0.01760700566579043, 'atr_max_pct': 0.09484669886393435, 'tp_mult': 1.0515237920226193, 'tsl_mult': 0.6393713084598455, 'strategy': 'breakout', 'time_stop': 270, 'use_sma': False, 'use_atr': False, 'use_adx': False, 'use_ema': False, 'use_spike': False, 'rsi_required': False, 'edge_k': 1.9567813512334937, 'edge_cap': 0.7364036657326863}.
[I 2025-08-29 23:15:02,339] Trial 882 finished with values: [-1000000000.0, 1000000000.0] and parameters: {'p_sma': 7, 'p_std': 49, 'p_atr': 23, 'p_adx': 17, 'rsi_period': 25, 'ema1': 9, 'ema2': 48, 'slip_atr_k': 0.006173367013871417, 'slip_spread_k': 0.3263583197267571, 'spread_hl_frac': 0.03886523079658925, 'bb_std_mult': 1.860170610570735, 'rsi_os': 22, 'rsi_ob': 61, 'vol_spike': 0.15797366672363583, 'adx_thresh': 24.130543942990247, 'atr_min_pct': 0.0017898699951774811, 'atr_max_pct': 0.09614973930657843, 'tp_mult': 1.0585013045286018, 'tsl_mult': 0.6952559523670936, 'strategy': 'breakout', 'time_stop': 100, 'use_sma': False, 'use_atr': False, 'use_adx': False, 'use_ema': False, 'use_spike': False, 'rsi_required': False, 'edge_k': 1.5180284855927528, 'edge_cap': 0.7758136501878888}.
[I 2025-08-29 23:15:29,669] Trial 884 finished with values: [-1000000000.0, 1000000000.0] and parameters: {'p_sma': 20, 'p_std': 42, 'p_atr': 29, 'p_adx': 19, 'rsi_period': 20, 'ema1': 16, 'ema2': 52, 'slip_atr_k': 0.018323602968665757, 'slip_spread_k': 0.9042697980703789, 'spread_hl_frac': 0.024916099412236728, 'bb_std_mult': 1.3413333357184278, 'rsi_os': 28, 'rsi_ob': 63, 'vol_spike': 0.07889448023130739, 'adx_thresh': 24.071604124223846, 'atr_min_pct': 0.017776372285797985, 'atr_max_pct': 0.09189777826019711, 'tp_mult': 1.0122630677198345, 'tsl_mult': 0.20118031448910312, 'strategy': 'breakout', 'time_stop': 36, 'use_sma': False, 'use_atr': False, 'use_adx': False, 'use_ema': False, 'use_spike': False, 'rsi_required': False, 'edge_k': 0.5452680574449229, 'edge_cap': 0.8411888616824318}.
[I 2025-08-29 23:15:29,839] Trial 887 finished with values: [-1000000000.0, 1000000000.0] and parameters: {'p_sma': 10, 'p_std': 26, 'p_atr': 22, 'p_adx': 26, 'rsi_period': 48, 'ema1': 29, 'ema2': 29, 'slip_atr_k': 0.018365880009134573, 'slip_spread_k': 0.9057097836079746, 'spread_hl_frac': 0.017867180254818524, 'bb_std_mult': 2.0171005320434596, 'rsi_os': 28, 'rsi_ob': 53, 'vol_spike': 0.27148447767317874, 'adx_thresh': 25.585370859069602, 'atr_min_pct': 0.0027115353699372563, 'atr_max_pct': 0.09159252586442443, 'tp_mult': 1.0108640105189524, 'tsl_mult': 0.2517118079837271, 'strategy': 'breakout', 'time_stop': 214, 'use_sma': False, 'use_atr': False, 'use_adx': False, 'use_ema': False, 'use_spike': False, 'rsi_required': False, 'edge_k': 0.5207890641598445, 'edge_cap': 0.8474633464430268}.
[I 2025-08-29 23:15:29,921] Trial 886 finished with values: [-1000000000.0, 1000000000.0] and parameters: {'p_sma': 11, 'p_std': 14, 'p_atr': 29, 'p_adx': 13, 'rsi_period': 20, 'ema1': 30, 'ema2': 53, 'slip_atr_k': 0.1269322638263613, 'slip_spread_k': 0.9026067257447041, 'spread_hl_frac': 0.02508782064367346, 'bb_std_mult': 2.0262745972494742, 'rsi_os': 28, 'rsi_ob': 93, 'vol_spike': 0.1781580729003848, 'adx_thresh': 25.832561518450166, 'atr_min_pct': 0.015211431668256864, 'atr_max_pct': 0.12221000090517228, 'tp_mult': 1.0990250648247029, 'tsl_mult': 0.7167685284198191, 'strategy': 'breakout', 'time_stop': 103, 'use_sma': False, 'use_atr': False, 'use_adx': False, 'use_ema': False, 'use_spike': False, 'rsi_required': False, 'edge_k': 0.5348862106661555, 'edge_cap': 0.30507054936292954}.
[I 2025-08-29 23:15:29,984] Trial 885 finished with values: [-0.006729740050642974, 0.006739264318422225] and parameters: {'p_sma': 20, 'p_std': 30, 'p_atr': 28, 'p_adx': 19, 'rsi_period': 20, 'ema1': 9, 'ema2': 52, 'slip_atr_k': 0.021245021089743382, 'slip_spread_k': 0.8885546059936791, 'spread_hl_frac': 0.024889152225256873, 'bb_std_mult': 2.1196401170369095, 'rsi_os': 28, 'rsi_ob': 93, 'vol_spike': 0.17770953831004593, 'adx_thresh': 22.51825439924985, 'atr_min_pct': 0.0029721720475201913, 'atr_max_pct': 0.06741312921072397, 'tp_mult': 1.092447809603575, 'tsl_mult': 0.20331097457142355, 'strategy': 'breakout', 'time_stop': 38, 'use_sma': False, 'use_atr': False, 'use_adx': False, 'use_ema': False, 'use_spike': False, 'rsi_required': False, 'edge_k': 1.0097282750207757, 'edge_cap': 0.7768073900998778}.
[I 2025-08-29 23:15:57,442] Trial 890 finished with values: [-1000000000.0, 1000000000.0] and parameters: {'p_sma': 8, 'p_std': 19, 'p_atr': 9, 'p_adx': 16, 'rsi_period': 17, 'ema1': 25, 'ema2': 42, 'slip_atr_k': 0.215961126842977, 'slip_spread_k': 0.8005684487678549, 'spread_hl_frac': 0.026539597544292224, 'bb_std_mult': 3.2215815823445455, 'rsi_os': 5, 'rsi_ob': 76, 'vol_spike': 0.19469643550972862, 'adx_thresh': 17.606874957531677, 'atr_min_pct': 0.008928381743856755, 'atr_max_pct': 0.10121837449085011, 'tp_mult': 1.423991622406672, 'tsl_mult': 0.2950227391429162, 'strategy': 'breakout', 'time_stop': 98, 'use_sma': False, 'use_atr': False, 'use_adx': False, 'use_ema': False, 'use_spike': False, 'rsi_required': False, 'edge_k': 0.6425862027315519, 'edge_cap': 0.8036473294769125}.
[I 2025-08-29 23:15:57,709] Trial 889 finished with values: [-0.006320034518410789, 0.006425785097758634] and parameters: {'p_sma': 8, 'p_std': 12, 'p_atr': 18, 'p_adx': 29, 'rsi_period': 17, 'ema1': 10, 'ema2': 55, 'slip_atr_k': 0.12764770155845193, 'slip_spread_k': 0.795569782475962, 'spread_hl_frac': 0.009148117671362414, 'bb_std_mult': 2.0893581990097387, 'rsi_os': 25, 'rsi_ob': 76, 'vol_spike': 0.19462896567341537, 'adx_thresh': 22.65160240567273, 'atr_min_pct': 0.002856713725436003, 'atr_max_pct': 0.12611864271741133, 'tp_mult': 1.0934754759907888, 'tsl_mult': 0.2951065167015955, 'strategy': 'breakout', 'time_stop': 101, 'use_sma': False, 'use_atr': False, 'use_adx': False, 'use_ema': False, 'use_spike': False, 'rsi_required': False, 'edge_k': 0.8288116735550491, 'edge_cap': 0.9087561914086073}.
[I 2025-08-29 23:15:57,808] Trial 891 finished with values: [-1000000000.0, 1000000000.0] and parameters: {'p_sma': 9, 'p_std': 23, 'p_atr': 9, 'p_adx': 7, 'rsi_period': 40, 'ema1': 25, 'ema2': 40, 'slip_atr_k': 0.03169307825665364, 'slip_spread_k': 0.8406848425310394, 'spread_hl_frac': 0.014764401915292227, 'bb_std_mult': 1.9472973331250811, 'rsi_os': 25, 'rsi_ob': 76, 'vol_spike': 0.2005600742732424, 'adx_thresh': 17.9307304300958, 'atr_min_pct': 0.008844993067972309, 'atr_max_pct': 0.12566239797144746, 'tp_mult': 1.2198044279781013, 'tsl_mult': 0.717445747445413, 'strategy': 'mean_reversion', 'time_stop': 88, 'use_sma': False, 'use_atr': False, 'use_adx': False, 'use_ema': False, 'use_spike': False, 'rsi_required': False, 'edge_k': 0.8290579400339775, 'edge_cap': 0.9074477508458908}.
