[I 2025-08-29 22:23:08,114] Trial 403 finished with values: [-1000000000.0, 1000000000.0] and parameters: {'p_sma': 21, 'p_std': 26, 'p_atr': 7, 'p_adx': 16, 'rsi_period': 45, 'ema1': 24, 'ema2': 37, 'slip_atr_k': 0.013061661443410068, 'slip_spread_k': 0.829561678250232, 'spread_hl_frac': 0.039050411274134646, 'bb_std_mult': 2.084830021130811, 'rsi_os': 28, 'rsi_ob': 67, 'vol_spike': 0.1864480571221875, 'adx_thresh': 26.70788362325871, 'atr_min_pct': 0.024505920289513372, 'atr_max_pct': 0.09098421290051643, 'tp_mult': 1.1464662637708305, 'tsl_mult': 0.7561461247004851, 'strategy': 'breakout', 'time_stop': 84, 'use_sma': False, 'use_atr': False, 'use_adx': False, 'use_ema': False, 'use_spike': False, 'rsi_required': False, 'edge_k': 0.5733830574113244, 'edge_cap': 0.8267851167253369}.
[I 2025-08-29 22:23:08,337] Trial 405 finished with values: [-1000000000.0, 1000000000.0] and parameters: {'p_sma': 8, 'p_std': 43, 'p_atr': 22, 'p_adx': 17, 'rsi_period': 33, 'ema1': 24, 'ema2': 51, 'slip_atr_k': 0.011383948683733672, 'slip_spread_k': 0.7717050201658918, 'spread_hl_frac': 0.0013965770659077024, 'bb_std_mult': 3.31007560705787, 'rsi_os': 28, 'rsi_ob': 87, 'vol_spike': 0.22362834647251528, 'adx_thresh': 24.859376900836427, 'atr_min_pct': 0.0028238103306675, 'atr_max_pct': 0.08992678275336746, 'tp_mult': 1.1604378730685054, 'tsl_mult': 0.6949410715771652, 'strategy': 'breakout', 'time_stop': 242, 'use_sma': False, 'use_atr': False, 'use_adx': False, 'use_ema': False, 'use_spike': False, 'rsi_required': False, 'edge_k': 0.5799868771327332, 'edge_cap': 0.8307315537322105}.
[I 2025-08-29 22:23:34,715] Trial 409 finished with values: [-1000000000.0, 1000000000.0] and parameters: {'p_sma': 50, 'p_std': 35, 'p_atr': 23, 'p_adx': 16, 'rsi_period': 21, 'ema1': 25, 'ema2': 53, 'slip_atr_k': 0.10675723098957926, 'slip_spread_k': 0.36298503980502517, 'spread_hl_frac': 0.0013644726058595555, 'bb_std_mult': 1.0009340157598923, 'rsi_os': 24, 'rsi_ob': 83, 'vol_spike': 0.10403312353275349, 'adx_thresh': 24.769915634675844, 'atr_min_pct': 0.014686195271391318, 'atr_max_pct': 0.0942749979398947, 'tp_mult': 1.1739495675894092, 'tsl_mult': 0.6981384537469406, 'strategy': 'breakout', 'time_stop': 237, 'use_sma': False, 'use_atr': False, 'use_adx': False, 'use_ema': False, 'use_spike': False, 'rsi_required': False, 'edge_k': 0.4592969766242727, 'edge_cap': 0.7609300406634657}.
[I 2025-08-29 22:23:34,890] Trial 410 finished with values: [-0.011473382556770995, 0.011614722198580667] and parameters: {'p_sma': 50, 'p_std': 28, 'p_atr': 23, 'p_adx': 16, 'rsi_period': 18, 'ema1': 7, 'ema2': 53, 'slip_atr_k': 0.03484473362790644, 'slip_spread_k': 0.06341709578727073, 'spread_hl_frac': 0.0271879523568083, 'bb_std_mult': 1.69954376164751, 'rsi_os': 26, 'rsi_ob': 47, 'vol_spike': 0.12726845934668504, 'adx_thresh': 22.46626031256894, 'atr_min_pct': 0.002598990408425844, 'atr_max_pct': 0.0999197857383582, 'tp_mult': 1.1867293048527356, 'tsl_mult': 0.6976599280806968, 'strategy': 'breakout', 'time_stop': 117, 'use_sma': False, 'use_atr': False, 'use_adx': False, 'use_ema': False, 'use_spike': False, 'rsi_required': False, 'edge_k': 0.4744249975521895, 'edge_cap': 0.7581885145932261}.
[I 2025-08-29 22:23:35,151] Trial 408 finished with values: [-0.009685628096410603, 0.010053468663118402] and parameters: {'p_sma': 50, 'p_std': 43, 'p_atr': 23, 'p_adx': 16, 'rsi_period': 21, 'ema1': 24, 'ema2': 53, 'slip_atr_k': 0.01631668360631452, 'slip_spread_k': 0.36691325371085737, 'spread_hl_frac': 0.014275235860664008, 'bb_std_mult': 1.015270436870642, 'rsi_os': 28, 'rsi_ob': 66, 'vol_spike': 0.10527851597350121, 'adx_thresh': 22.597852746053512, 'atr_min_pct': 0.0027045213751454573, 'atr_max_pct': 0.09417236117745549, 'tp_mult': 1.152589923544804, 'tsl_mult': 0.21940052096929347, 'strategy': 'breakout', 'time_stop': 114, 'use_sma': False, 'use_atr': False, 'use_adx': False, 'use_ema': False, 'use_spike': False, 'rsi_required': False, 'edge_k': 0.4520354284619301, 'edge_cap': 0.8954340383182677}.
[I 2025-08-29 22:23:35,324] Trial 407 finished with values: [-0.0068796440771191625, 0.006852236420815605] and parameters: {'p_sma': 50, 'p_std': 25, 'p_atr': 23, 'p_adx': 16, 'rsi_period': 22, 'ema1': 29, 'ema2': 53, 'slip_atr_k': 0.016469809537320003, 'slip_spread_k': 0.1398995052547637, 'spread_hl_frac': 0.017157431009406674, 'bb_std_mult': 2.0803635831655507, 'rsi_os': 24, 'rsi_ob': 85, 'vol_spike': 0.1841421167810655, 'adx_thresh': 22.451958063852643, 'atr_min_pct': 0.0030997281163685384, 'atr_max_pct': 0.10057901520067207, 'tp_mult': 1.1629984527562476, 'tsl_mult': 0.21614587275072994, 'strategy': 'breakout', 'time_stop': 241, 'use_sma': False, 'use_atr': False, 'use_adx': False, 'use_ema': False, 'use_spike': False, 'rsi_required': False, 'edge_k': 0.47173496032699774, 'edge_cap': 0.8964586280404921}.
[I 2025-08-29 22:24:02,643] Trial 411 finished with values: [-0.03011210789429719, 0.030097828401129727] and parameters: {'p_sma': 45, 'p_std': 28, 'p_atr': 23, 'p_adx': 16, 'rsi_period': 18, 'ema1': 20, 'ema2': 55, 'slip_atr_k': 0.03860486406711005, 'slip_spread_k': 0.0961920149391387, 'spread_hl_frac': 0.01700448051939187, 'bb_std_mult': 2.1895846918176525, 'rsi_os': 26, 'rsi_ob': 47, 'vol_spike': 0.173251528712368, 'adx_thresh': 27.41475320606926, 'atr_min_pct': 0.001001164505184429, 'atr_max_pct': 0.1004818177909728, 'tp_mult': 1.952305830839547, 'tsl_mult': 0.7340470214379619, 'strategy': 'breakout', 'time_stop': 116, 'use_sma': False, 'use_atr': False, 'use_adx': False, 'use_ema': False, 'use_spike': False, 'rsi_required': False, 'edge_k': 0.44483831576129007, 'edge_cap': 0.7865122939337087}.
[I 2025-08-29 22:24:02,760] Trial 412 finished with values: [-1000000000.0, 1000000000.0] and parameters: {'p_sma': 7, 'p_std': 25, 'p_atr': 23, 'p_adx': 16, 'rsi_period': 17, 'ema1': 15, 'ema2': 55, 'slip_atr_k': 0.21977976542504563, 'slip_spread_k': 0.8583862591550043, 'spread_hl_frac': 0.017312048047772543, 'bb_std_mult': 2.1817499365606934, 'rsi_os': 23, 'rsi_ob': 60, 'vol_spike': 0.17408633787632657, 'adx_thresh': 21.576120156113543, 'atr_min_pct': 0.028203041997981376, 'atr_max_pct': 0.029344170032263986, 'tp_mult': 2.3572734585424437, 'tsl_mult': 0.19032282495059583, 'strategy': 'mean_reversion', 'time_stop': 100, 'use_sma': False, 'use_atr': False, 'use_adx': False, 'use_ema': False, 'use_spike': False, 'rsi_required': False, 'edge_k': 1.8968565507251747, 'edge_cap': 0.78293128889461}.
[I 2025-08-29 22:24:02,954] Trial 414 finished with values: [-1000000000.0, 1000000000.0] and parameters: {'p_sma': 45, 'p_std': 23, 'p_atr': 23, 'p_adx': 16, 'rsi_period': 10, 'ema1': 15, 'ema2': 55, 'slip_atr_k': 0.02612189179650873, 'slip_spread_k': 0.8540708132702455, 'spread_hl_frac': 0.004834187716889784, 'bb_std_mult': 2.18709778950055, 'rsi_os': 26, 'rsi_ob': 60, 'vol_spike': 0.17283737546499484, 'adx_thresh': 27.504750639668046, 'atr_min_pct': 0.02268422861325974, 'atr_max_pct': 0.02901092353460851, 'tp_mult': 1.0947859560110906, 'tsl_mult': 0.49884526888788655, 'strategy': 'mean_reversion', 'time_stop': 101, 'use_sma': False, 'use_atr': False, 'use_adx': False, 'use_ema': False, 'use_spike': False, 'rsi_required': False, 'edge_k': 0.5256048499395845, 'edge_cap': 0.7879381046788516}.
[I 2025-08-29 22:24:03,082] Trial 413 finished with values: [-0.005463583464746291, 0.0054441575282997215] and parameters: {'p_sma': 41, 'p_std': 53, 'p_atr': 23, 'p_adx': 16, 'rsi_period': 65, 'ema1': 12, 'ema2': 21, 'slip_atr_k': 0.026393644341673066, 'slip_spread_k': 0.6134791054432721, 'spread_hl_frac': 0.01667736642999225, 'bb_std_mult': 2.0732460722190664, 'rsi_os': 40, 'rsi_ob': 81, 'vol_spike': 0.17457520450152875, 'adx_thresh': 27.422220681953654, 'atr_min_pct': 0.0011498215784250467, 'atr_max_pct': 0.07058821406352188, 'tp_mult': 2.851139232104167, 'tsl_mult': 0.6614483215256761, 'strategy': 'mean_reversion', 'time_stop': 102, 'use_sma': False, 'use_atr': False, 'use_adx': False, 'use_ema': False, 'use_spike': False, 'rsi_required': False, 'edge_k': 1.4338736047877307, 'edge_cap': 0.793777389671873}.
[I 2025-08-29 22:24:03,244] Trial 415 finished with values: [-1000000000.0, 1000000000.0] and parameters: {'p_sma': 35, 'p_std': 23, 'p_atr': 24, 'p_adx': 16, 'rsi_period': 64, 'ema1': 23, 'ema2': 27, 'slip_atr_k': 0.21996955823995504, 'slip_spread_k': 0.8532950943420097, 'spread_hl_frac': 0.040436758969731396, 'bb_std_mult': 2.0116809966575113, 'rsi_os': 32, 'rsi_ob': 45, 'vol_spike': 0.18046510642653016, 'adx_thresh': 13.255959913432104, 'atr_min_pct': 0.004399502242695103, 'atr_max_pct': 0.029697042182717494, 'tp_mult': 2.874036358109078, 'tsl_mult': 0.6606660896336486, 'strategy': 'mean_reversion', 'time_stop': 270, 'use_sma': False, 'use_atr': False, 'use_adx': False, 'use_ema': False, 'use_spike': False, 'rsi_required': False, 'edge_k': 1.4530121426880054, 'edge_cap': 0.9959694897498108}.
[I 2025-08-29 22:24:30,670] Trial 416 finished with values: [-1000000000.0, 1000000000.0] and parameters: {'p_sma': 26, 'p_std': 23, 'p_atr': 24, 'p_adx': 16, 'rsi_period': 73, 'ema1': 23, 'ema2': 57, 'slip_atr_k': 0.025772712833424454, 'slip_spread_k': 0.812482397078502, 'spread_hl_frac': 0.019339544072127422, 'bb_std_mult': 2.042416371987518, 'rsi_os': 32, 'rsi_ob': 75, 'vol_spike': 0.2177124086609517, 'adx_thresh': 13.283876613837911, 'atr_min_pct': 0.019936776998746734, 'atr_max_pct': 0.10941606244538031, 'tp_mult': 1.3380071164258516, 'tsl_mult': 0.7340443032581896, 'strategy': 'mean_reversion', 'time_stop': 258, 'use_sma': False, 'use_atr': False, 'use_adx': False, 'use_ema': False, 'use_spike': False, 'rsi_required': False, 'edge_k': 1.1958665544235592, 'edge_cap': 0.20624325216216288}.
[I 2025-08-29 22:24:30,796] Trial 418 finished with values: [-1000000000.0, 1000000000.0] and parameters: {'p_sma': 34, 'p_std': 24, 'p_atr': 24, 'p_adx': 16, 'rsi_period': 50, 'ema1': 10, 'ema2': 57, 'slip_atr_k': 0.02104948239006627, 'slip_spread_k': 0.19809213497005568, 'spread_hl_frac': 0.019704220400371696, 'bb_std_mult': 1.9635219954061673, 'rsi_os': 11, 'rsi_ob': 63, 'vol_spike': 0.18150169358329923, 'adx_thresh': 25.332817228100023, 'atr_min_pct': 0.01358830320119357, 'atr_max_pct': 0.10388196764884483, 'tp_mult': 1.343700909066084, 'tsl_mult': 0.7357368164746289, 'strategy': 'breakout', 'time_stop': 253, 'use_sma': False, 'use_atr': False, 'use_adx': False, 'use_ema': False, 'use_spike': False, 'rsi_required': False, 'edge_k': 0.5226208702539229, 'edge_cap': 0.8518844700620526}.
[I 2025-08-29 22:24:31,043] Trial 419 finished with values: [-1000000000.0, 1000000000.0] and parameters: {'p_sma': 37, 'p_std': 24, 'p_atr': 22, 'p_adx': 16, 'rsi_period': 25, 'ema1': 10, 'ema2': 10, 'slip_atr_k': 0.17155865712437926, 'slip_spread_k': 0.20557530417165537, 'spread_hl_frac': 0.019879219412400045, 'bb_std_mult': 1.8450303178803609, 'rsi_os': 25, 'rsi_ob': 63, 'vol_spike': 0.28311652942544585, 'adx_thresh': 12.359943277718095, 'atr_min_pct': 0.01351540337043249, 'atr_max_pct': 0.05121365189683111, 'tp_mult': 1.3465845826288554, 'tsl_mult': 0.1095202340935919, 'strategy': 'breakout', 'time_stop': 132, 'use_sma': False, 'use_atr': False, 'use_adx': False, 'use_ema': False, 'use_spike': False, 'rsi_required': False, 'edge_k': 0.4015236103099941, 'edge_cap': 0.8438690101826067}.
[I 2025-08-29 22:24:31,218] Trial 417 finished with values: [-1000000000.0, 1000000000.0] and parameters: {'p_sma': 8, 'p_std': 24, 'p_atr': 24, 'p_adx': 16, 'rsi_period': 65, 'ema1': 23, 'ema2': 21, 'slip_atr_k': 0.021728191883876275, 'slip_spread_k': 0.6085847633716939, 'spread_hl_frac': 0.019798252512142345, 'bb_std_mult': 1.9748903688738626, 'rsi_os': 40, 'rsi_ob': 71, 'vol_spike': 0.18120337066336564, 'adx_thresh': 25.410259065864036, 'atr_min_pct': 0.013568023812823458, 'atr_max_pct': 0.10978490791598393, 'tp_mult': 1.3351419767505608, 'tsl_mult': 0.6603431548936786, 'strategy': 'breakout', 'time_stop': 30, 'use_sma': False, 'use_atr': False, 'use_adx': False, 'use_ema': False, 'use_spike': False, 'rsi_required': False, 'edge_k': 0.5212827076442597, 'edge_cap': 0.8521569808935344}.
[I 2025-08-29 22:24:31,429] Trial 422 finished with values: [-1000000000.0, 1000000000.0] and parameters: {'p_sma': 9, 'p_std': 5, 'p_atr': 28, 'p_adx': 17, 'rsi_period': 20, 'ema1': 26, 'ema2': 44, 'slip_atr_k': 0.01968298963607678, 'slip_spread_k': 0.6807511272230423, 'spread_hl_frac': 0.017995132938182647, 'bb_std_mult': 2.35043116667491, 'rsi_os': 36, 'rsi_ob': 79, 'vol_spike': 0.1947246257308164, 'adx_thresh': 23.79575496874026, 'atr_min_pct': 0.01730688417098535, 'atr_max_pct': 0.014623015213637472, 'tp_mult': 1.1038709069435038, 'tsl_mult': 0.35877940098900585, 'strategy': 'breakout', 'time_stop': 70, 'use_sma': False, 'use_atr': False, 'use_adx': False, 'use_ema': False, 'use_spike': False, 'rsi_required': False, 'edge_k': 0.6293366622235342, 'edge_cap': 0.8152625180909471}.
[I 2025-08-29 22:24:58,773] Trial 421 finished with values: [-1000000000.0, 1000000000.0] and parameters: {'p_sma': 9, 'p_std': 27, 'p_atr': 22, 'p_adx': 17, 'rsi_period': 80, 'ema1': 24, 'ema2': 25, 'slip_atr_k': 0.23570048576941052, 'slip_spread_k': 0.9971115844708318, 'spread_hl_frac': 0.0180008043344272, 'bb_std_mult': 1.83631760061808, 'rsi_os': 30, 'rsi_ob': 61, 'vol_spike': 0.2676811486656142, 'adx_thresh': 12.043849057693205, 'atr_min_pct': 0.016315222403330987, 'atr_max_pct': 0.09671566686608002, 'tp_mult': 1.247117984100493, 'tsl_mult': 0.012416291753208297, 'strategy': 'breakout', 'time_stop': 111, 'use_sma': False, 'use_atr': False, 'use_adx': False, 'use_ema': False, 'use_spike': False, 'rsi_required': False, 'edge_k': 1.369437300691236, 'edge_cap': 0.9396345211422759}.
[I 2025-08-29 22:24:58,876] Trial 423 finished with values: [-1000000000.0, 1000000000.0] and parameters: {'p_sma': 5, 'p_std': 10, 'p_atr': 28, 'p_adx': 17, 'rsi_period': 80, 'ema1': 24, 'ema2': 43, 'slip_atr_k': 0.09871242103948057, 'slip_spread_k': 0.7956322885743631, 'spread_hl_frac': 0.022751715075893623, 'bb_std_mult': 2.139161228559873, 'rsi_os': 30, 'rsi_ob': 61, 'vol_spike': 0.1636151122990276, 'adx_thresh': 26.137536951144142, 'atr_min_pct': 0.012463984021276173, 'atr_max_pct': 0.09699729134865667, 'tp_mult': 1.1129454585707228, 'tsl_mult': 0.013069892984372333, 'strategy': 'breakout', 'time_stop': 70, 'use_sma': False, 'use_atr': False, 'use_adx': False, 'use_ema': False, 'use_spike': False, 'rsi_required': False, 'edge_k': 0.6190423691455528, 'edge_cap': 0.05284389534728201}.
[I 2025-08-29 22:24:59,035] Trial 424 finished with values: [-1000000000.0, 1000000000.0] and parameters: {'p_sma': 6, 'p_std': 27, 'p_atr': 8, 'p_adx': 15, 'rsi_period': 19, 'ema1': 24, 'ema2': 48, 'slip_atr_k': 0.0001406381958104011, 'slip_spread_k': 0.8018316428368699, 'spread_hl_frac': 0.0471377777702596, 'bb_std_mult': 1.1660213138999171, 'rsi_os': 24, 'rsi_ob': 61, 'vol_spike': 0.03220392135365274, 'adx_thresh': 26.27498585524228, 'atr_min_pct': 0.012163573162861745, 'atr_max_pct': 0.09789536452378104, 'tp_mult': 1.8209954724456845, 'tsl_mult': 0.7134532816138225, 'strategy': 'breakout', 'time_stop': 108, 'use_sma': False, 'use_atr': False, 'use_adx': False, 'use_ema': False, 'use_spike': False, 'rsi_required': False, 'edge_k': 0.5621861509844152, 'edge_cap': 0.5214686739693826}.
[I 2025-08-29 22:24:59,095] Trial 420 finished with values: [-1000000000.0, 1000000000.0] and parameters: {'p_sma': 9, 'p_std': 24, 'p_atr': 22, 'p_adx': 17, 'rsi_period': 80, 'ema1': 24, 'ema2': 25, 'slip_atr_k': 0.19172166999964202, 'slip_spread_k': 0.8024498482634642, 'spread_hl_frac': 0.022928424385052514, 'bb_std_mult': 1.9386818350088328, 'rsi_os': 8, 'rsi_ob': 63, 'vol_spike': 0.14654950220922075, 'adx_thresh': 25.344372668521377, 'atr_min_pct': 0.021151487954605697, 'atr_max_pct': 0.09628508902811385, 'tp_mult': 1.1110120175013496, 'tsl_mult': 0.12251668270943028, 'strategy': 'breakout', 'time_stop': 109, 'use_sma': False, 'use_atr': False, 'use_adx': False, 'use_ema': False, 'use_spike': False, 'rsi_required': False, 'edge_k': 0.40720299274586697, 'edge_cap': 0.8511525769264933}.
[I 2025-08-29 22:25:26,186] Trial 426 finished with values: [-1000000000.0, 1000000000.0] and parameters: {'p_sma': 28, 'p_std': 26, 'p_atr': 19, 'p_adx': 15, 'rsi_period': 84, 'ema1': 28, 'ema2': 54, 'slip_atr_k': 0.189008793322257, 'slip_spread_k': 0.7419311266383992, 'spread_hl_frac': 0.00858765295519056, 'bb_std_mult': 0.736448961298585, 'rsi_os': 27, 'rsi_ob': 60, 'vol_spike': 0.033655553703969526, 'adx_thresh': 24.173304168447984, 'atr_min_pct': 0.011032449115045077, 'atr_max_pct': 0.09331093831675324, 'tp_mult': 1.0545565934193328, 'tsl_mult': 0.7154440334915625, 'strategy': 'breakout', 'time_stop': 106, 'use_sma': False, 'use_atr': False, 'use_adx': False, 'use_ema': False, 'use_spike': False, 'rsi_required': False, 'edge_k': 0.48901868485856126, 'edge_cap': 0.768617278798043}.
[I 2025-08-29 22:25:26,411] Trial 427 finished with values: [-0.004100862129605365, 0.004098331551094598] and parameters: {'p_sma': 60, 'p_std': 26, 'p_atr': 23, 'p_adx': 15, 'rsi_period': 28, 'ema1': 25, 'ema2': 35, 'slip_atr_k': 0.031849619463160825, 'slip_spread_k': 0.8265784360637252, 'spread_hl_frac': 0.01617153242309878, 'bb_std_mult': 3.0918656617796008, 'rsi_os': 27, 'rsi_ob': 90, 'vol_spike': 0.14618364694208846, 'adx_thresh': 33.57575546510613, 'atr_min_pct': 0.0036124126025104857, 'atr_max_pct': 0.09358694207772118, 'tp_mult': 1.060704774482469, 'tsl_mult': 0.7779095725718045, 'strategy': 'breakout', 'time_stop': 120, 'use_sma': False, 'use_atr': False, 'use_adx': False, 'use_ema': False, 'use_spike': False, 'rsi_required': False, 'edge_k': 0.26611777190832564, 'edge_cap': 0.5640760379751701}.
[I 2025-08-29 22:25:26,421] Trial 425 finished with values: [-0.0022755240174190394, 0.002523334260414721] and parameters: {'p_sma': 6, 'p_std': 26, 'p_atr': 19, 'p_adx': 15, 'rsi_period': 14, 'ema1': 25, 'ema2': 48, 'slip_atr_k': 0.002980526991636749, 'slip_spread_k': 0.16516831517173602, 'spread_hl_frac': 0.022003363645777964, 'bb_std_mult': 0.7283193578388429, 'rsi_os': 27, 'rsi_ob': 62, 'vol_spike': 0.16475396645455123, 'adx_thresh': 26.00259816534455, 'atr_min_pct': 0.0022408215291370125, 'atr_max_pct': 0.09354998703511151, 'tp_mult': 1.7232607750807816, 'tsl_mult': 0.7054627323913456, 'strategy': 'breakout', 'time_stop': 18, 'use_sma': False, 'use_atr': False, 'use_adx': False, 'use_ema': False, 'use_spike': False, 'rsi_required': False, 'edge_k': 0.564852853622835, 'edge_cap': 0.5643126250967003}.
[I 2025-08-29 22:25:26,492] Trial 428 finished with values: [-0.009784586305020104, 0.00978612594232176] and parameters: {'p_sma': 6, 'p_std': 26, 'p_atr': 18, 'p_adx': 15, 'rsi_period': 7, 'ema1': 28, 'ema2': 51, 'slip_atr_k': 0.06826451119992169, 'slip_spread_k': 0.4519651321413436, 'spread_hl_frac': 0.01648533909424982, 'bb_std_mult': 2.0260404288097664, 'rsi_os': 27, 'rsi_ob': 91, 'vol_spike': 0.1896501250565021, 'adx_thresh': 24.30244231937177, 'atr_min_pct': 0.002176279300979532, 'atr_max_pct': 0.08844927744727885, 'tp_mult': 2.257171842134712, 'tsl_mult': 0.7912447009698267, 'strategy': 'breakout', 'time_stop': 143, 'use_sma': False, 'use_atr': False, 'use_adx': False, 'use_ema': False, 'use_spike': False, 'rsi_required': False, 'edge_k': 1.8422971922779818, 'edge_cap': 0.3132087998971089}.
[I 2025-08-29 22:25:26,669] Trial 430 finished with values: [-1000000000.0, 1000000000.0] and parameters: {'p_sma': 7, 'p_std': 34, 'p_atr': 13, 'p_adx': 16, 'rsi_period': 38, 'ema1': 25, 'ema2': 51, 'slip_atr_k': 0.00995891551082199, 'slip_spread_k': 0.8707143458935209, 'spread_hl_frac': 0.018765424068167932, 'bb_std_mult': 2.031202459524557, 'rsi_os': 6, 'rsi_ob': 49, 'vol_spike': 0.1873171202704299, 'adx_thresh': 5.838055699829535, 'atr_min_pct': 0.0021379249742867167, 'atr_max_pct': 0.08841472772029467, 'tp_mult': 2.0710803376365323, 'tsl_mult': 0.4153769045984652, 'strategy': 'mean_reversion', 'time_stop': 96, 'use_sma': False, 'use_atr': False, 'use_adx': False, 'use_ema': False, 'use_spike': False, 'rsi_required': False, 'edge_k': 1.8504451945223157, 'edge_cap': 0.7341248440806378}.
[I 2025-08-29 22:25:53,206] Trial 431 finished with values: [-0.005250220582043941, 0.005273640972588429] and parameters: {'p_sma': 7, 'p_std': 48, 'p_atr': 25, 'p_adx': 16, 'rsi_period': 40, 'ema1': 25, 'ema2': 50, 'slip_atr_k': 0.016096234194596996, 'slip_spread_k': 0.8732387603408494, 'spread_hl_frac': 0.01885491823710637, 'bb_std_mult': 0.554437118019159, 'rsi_os': 9, 'rsi_ob': 57, 'vol_spike': 0.06476246533747708, 'adx_thresh': 5.942832891875284, 'atr_min_pct': 0.002024730436681668, 'atr_max_pct': 0.08844670844731096, 'tp_mult': 2.7338927143633494, 'tsl_mult': 0.7443150861177098, 'strategy': 'mean_reversion', 'time_stop': 123, 'use_sma': False, 'use_atr': False, 'use_adx': False, 'use_ema': False, 'use_spike': False, 'rsi_required': False, 'edge_k': 1.5452751908245057, 'edge_cap': 0.8016986211762043}.
[I 2025-08-29 22:25:53,712] Trial 429 finished with values: [-1000000000.0, 1000000000.0] and parameters: {'p_sma': 7, 'p_std': 25, 'p_atr': 9, 'p_adx': 23, 'rsi_period': 14, 'ema1': 25, 'ema2': 52, 'slip_atr_k': 0.03188595564824491, 'slip_spread_k': 0.7707833701909598, 'spread_hl_frac': 0.01624561248238714, 'bb_std_mult': 3.163810029666673, 'rsi_os': 26, 'rsi_ob': 90, 'vol_spike': 0.0640951686989085, 'adx_thresh': 33.61814721083989, 'atr_min_pct': 0.0035527782254917515, 'atr_max_pct': 0.02522522225664193, 'tp_mult': 1.2072769664233285, 'tsl_mult': 0.7903321007981914, 'strategy': 'breakout', 'time_stop': 121, 'use_sma': False, 'use_atr': False, 'use_adx': False, 'use_ema': False, 'use_spike': False, 'rsi_required': False, 'edge_k': 0.9647667216041732, 'edge_cap': 0.6400405242505169}.
