[I 2025-08-29 22:17:10,551] Trial 353 finished with values: [-0.019698853910815717, 0.019667699765046842] and parameters: {'p_sma': 59, 'p_std': 20, 'p_atr': 12, 'p_adx': 14, 'rsi_period': 9, 'ema1': 12, 'ema2': 53, 'slip_atr_k': 0.24142347268748046, 'slip_spread_k': 0.8369887472152743, 'spread_hl_frac': 0.018413171767163096, 'bb_std_mult': 2.0014876896101796, 'rsi_os': 8, 'rsi_ob': 66, 'vol_spike': 0.17172064944517876, 'adx_thresh': 27.144568715099584, 'atr_min_pct': 0.002001661535344021, 'atr_max_pct': 0.09212544604336541, 'tp_mult': 1.0636675964907016, 'tsl_mult': 0.7510520789014985, 'strategy': 'breakout', 'time_stop': 256, 'use_sma': False, 'use_atr': False, 'use_adx': False, 'use_ema': False, 'use_spike': False, 'rsi_required': False, 'edge_k': 1.7390246155820994, 'edge_cap': 0.82923298544452}.
[I 2025-08-29 22:17:10,772] Trial 351 finished with values: [-1000000000.0, 1000000000.0] and parameters: {'p_sma': 9, 'p_std': 20, 'p_atr': 23, 'p_adx': 17, 'rsi_period': 47, 'ema1': 23, 'ema2': 52, 'slip_atr_k': 0.014066258961357785, 'slip_spread_k': 0.4152271148180399, 'spread_hl_frac': 0.00019423900339978623, 'bb_std_mult': 1.6276121676787656, 'rsi_os': 26, 'rsi_ob': 61, 'vol_spike': 0.17140184493805574, 'adx_thresh': 25.474483388328473, 'atr_min_pct': 0.02045300183174464, 'atr_max_pct': 0.09128609240445913, 'tp_mult': 1.046891160108998, 'tsl_mult': 0.17730790090352866, 'strategy': 'breakout', 'time_stop': 273, 'use_sma': False, 'use_atr': False, 'use_adx': False, 'use_ema': False, 'use_spike': False, 'rsi_required': False, 'edge_k': 0.5958332084099704, 'edge_cap': 0.8298238569680396}.
[I 2025-08-29 22:17:10,949] Trial 354 finished with values: [-1000000000.0, 1000000000.0] and parameters: {'p_sma': 8, 'p_std': 57, 'p_atr': 23, 'p_adx': 10, 'rsi_period': 22, 'ema1': 15, 'ema2': 38, 'slip_atr_k': 0.06504025118099113, 'slip_spread_k': 0.8379245694806358, 'spread_hl_frac': 0.01851067041712361, 'bb_std_mult': 2.1511376428306814, 'rsi_os': 25, 'rsi_ob': 63, 'vol_spike': 0.171268697705387, 'adx_thresh': 9.120440263225131, 'atr_min_pct': 0.015349014418653693, 'atr_max_pct': 0.09167410257537544, 'tp_mult': 2.6279903875057764, 'tsl_mult': 0.7606598565240591, 'strategy': 'breakout', 'time_stop': 106, 'use_sma': False, 'use_atr': False, 'use_adx': False, 'use_ema': False, 'use_spike': False, 'rsi_required': False, 'edge_k': 0.5473900175964256, 'edge_cap': 0.73427782305766}.
[I 2025-08-29 22:17:11,024] Trial 352 finished with values: [-1000000000.0, 1000000000.0] and parameters: {'p_sma': 8, 'p_std': 26, 'p_atr': 23, 'p_adx': 10, 'rsi_period': 55, 'ema1': 23, 'ema2': 31, 'slip_atr_k': 0.24024545214836546, 'slip_spread_k': 0.7412089632632415, 'spread_hl_frac': 0.013433114200427485, 'bb_std_mult': 2.7807445285586736, 'rsi_os': 26, 'rsi_ob': 73, 'vol_spike': 0.2592618868832943, 'adx_thresh': 25.462179298317256, 'atr_min_pct': 0.019188595529883647, 'atr_max_pct': 0.06283078385906132, 'tp_mult': 1.1300243863752841, 'tsl_mult': 0.7579566943195949, 'strategy': 'breakout', 'time_stop': 6, 'use_sma': False, 'use_atr': False, 'use_adx': False, 'use_ema': False, 'use_spike': False, 'rsi_required': False, 'edge_k': 0.5847941956154923, 'edge_cap': 0.7320803823250035}.
[I 2025-08-29 22:17:37,547] Trial 355 finished with values: [-1000000000.0, 1000000000.0] and parameters: {'p_sma': 8, 'p_std': 57, 'p_atr': 23, 'p_adx': 10, 'rsi_period': 22, 'ema1': 23, 'ema2': 55, 'slip_atr_k': 0.06072553617609727, 'slip_spread_k': 0.8120838769917211, 'spread_hl_frac': 0.00017017235975552367, 'bb_std_mult': 1.42629076952844, 'rsi_os': 25, 'rsi_ob': 63, 'vol_spike': 0.26194444473857326, 'adx_thresh': 16.82380747014037, 'atr_min_pct': 0.017948316298496865, 'atr_max_pct': 0.05270041736925027, 'tp_mult': 2.6269368317294557, 'tsl_mult': 0.7023645968981793, 'strategy': 'breakout', 'time_stop': 111, 'use_sma': False, 'use_atr': False, 'use_adx': False, 'use_ema': False, 'use_spike': False, 'rsi_required': False, 'edge_k': 0.5423807524762737, 'edge_cap': 0.7678755178239087}.
[I 2025-08-29 22:17:37,790] Trial 358 finished with values: [-0.019800825803584443, 0.019768207932062423] and parameters: {'p_sma': 13, 'p_std': 25, 'p_atr': 24, 'p_adx': 18, 'rsi_period': 27, 'ema1': 24, 'ema2': 55, 'slip_atr_k': 0.23100190274371035, 'slip_spread_k': 0.7964110238981201, 'spread_hl_frac': 0.026647941553377668, 'bb_std_mult': 1.903098807478796, 'rsi_os': 27, 'rsi_ob': 64, 'vol_spike': 0.061739266840764515, 'adx_thresh': 12.712338777088839, 'atr_min_pct': 0.0012988979299871604, 'atr_max_pct': 0.09463847362804137, 'tp_mult': 1.1915424196725255, 'tsl_mult': 0.6985753626326546, 'strategy': 'breakout', 'time_stop': 98, 'use_sma': False, 'use_atr': False, 'use_adx': False, 'use_ema': False, 'use_spike': False, 'rsi_required': False, 'edge_k': 0.3017279380519081, 'edge_cap': 0.768509864283798}.
[I 2025-08-29 22:17:37,929] Trial 356 finished with values: [-1000000000.0, 1000000000.0] and parameters: {'p_sma': 7, 'p_std': 14, 'p_atr': 23, 'p_adx': 10, 'rsi_period': 24, 'ema1': 24, 'ema2': 55, 'slip_atr_k': 0.14810757071685923, 'slip_spread_k': 0.8134233575255915, 'spread_hl_frac': 0.016745459096840377, 'bb_std_mult': 1.9124426130624217, 'rsi_os': 25, 'rsi_ob': 84, 'vol_spike': 0.22838876179396442, 'adx_thresh': 24.90257348078898, 'atr_min_pct': 0.018083155192193896, 'atr_max_pct': 0.09592094890318596, 'tp_mult': 2.6286768194621946, 'tsl_mult': 0.7008008482880947, 'strategy': 'breakout', 'time_stop': 107, 'use_sma': False, 'use_atr': False, 'use_adx': False, 'use_ema': False, 'use_spike': False, 'rsi_required': False, 'edge_k': 0.5553134027386226, 'edge_cap': 0.7689014723069236}.
[I 2025-08-29 22:17:37,999] Trial 357 finished with values: [-1000000000.0, 1000000000.0] and parameters: {'p_sma': 12, 'p_std': 14, 'p_atr': 24, 'p_adx': 18, 'rsi_period': 18, 'ema1': 24, 'ema2': 55, 'slip_atr_k': 0.11498418351362288, 'slip_spread_k': 0.8153515972091911, 'spread_hl_frac': 0.022920782567544807, 'bb_std_mult': 1.4504181298287961, 'rsi_os': 27, 'rsi_ob': 64, 'vol_spike': 0.07590898729723533, 'adx_thresh': 19.83632129196147, 'atr_min_pct': 0.018104343399964307, 'atr_max_pct': 0.0950695412625099, 'tp_mult': 1.1885643666771988, 'tsl_mult': 0.7003078323579013, 'strategy': 'breakout', 'time_stop': 112, 'use_sma': False, 'use_atr': False, 'use_adx': False, 'use_ema': False, 'use_spike': False, 'rsi_required': False, 'edge_k': 0.6928535462902802, 'edge_cap': 0.7707121370664075}.
[I 2025-08-29 22:18:04,986] Trial 362 finished with values: [-1000000000.0, 1000000000.0] and parameters: {'p_sma': 6, 'p_std': 26, 'p_atr': 22, 'p_adx': 7, 'rsi_period': 59, 'ema1': 17, 'ema2': 22, 'slip_atr_k': 0.020760210536398423, 'slip_spread_k': 0.5891231334937922, 'spread_hl_frac': 0.01609808603954078, 'bb_std_mult': 2.0589182014231575, 'rsi_os': 40, 'rsi_ob': 60, 'vol_spike': 0.18615686428018977, 'adx_thresh': 23.688125534394047, 'atr_min_pct': 0.004001978772606243, 'atr_max_pct': 0.08809276086765214, 'tp_mult': 2.055377871571225, 'tsl_mult': 0.7291449048536022, 'strategy': 'breakout', 'time_stop': 101, 'use_sma': False, 'use_atr': False, 'use_adx': False, 'use_ema': False, 'use_spike': False, 'rsi_required': False, 'edge_k': 1.6544157011069918, 'edge_cap': 0.8012354678593174}.
[I 2025-08-29 22:18:05,211] Trial 359 finished with values: [-0.003434216547531288, 0.0037613321198360443] and parameters: {'p_sma': 31, 'p_std': 25, 'p_atr': 24, 'p_adx': 15, 'rsi_period': 27, 'ema1': 24, 'ema2': 29, 'slip_atr_k': 0.021915050674962737, 'slip_spread_k': 0.8024459031270624, 'spread_hl_frac': 0.02704181133378556, 'bb_std_mult': 1.9229755797617392, 'rsi_os': 27, 'rsi_ob': 61, 'vol_spike': 0.06265462345925904, 'adx_thresh': 24.24651031825977, 'atr_min_pct': 0.003954234753159382, 'atr_max_pct': 0.05724490050192219, 'tp_mult': 1.174520735207576, 'tsl_mult': 0.724765728555496, 'strategy': 'breakout', 'time_stop': 161, 'use_sma': False, 'use_atr': False, 'use_adx': False, 'use_ema': False, 'use_spike': False, 'rsi_required': False, 'edge_k': 0.7006918785313485, 'edge_cap': 0.10474297053294124}.
[I 2025-08-29 22:18:05,468] Trial 361 finished with values: [-1000000000.0, 1000000000.0] and parameters: {'p_sma': 6, 'p_std': 26, 'p_atr': 14, 'p_adx': 16, 'rsi_period': 18, 'ema1': 17, 'ema2': 54, 'slip_atr_k': 0.11394708095408705, 'slip_spread_k': 0.9737790102213599, 'spread_hl_frac': 0.01573955847354489, 'bb_std_mult': 2.048337772844086, 'rsi_os': 28, 'rsi_ob': 92, 'vol_spike': 0.15070269899108785, 'adx_thresh': 19.838777789760215, 'atr_min_pct': 0.026959571700808163, 'atr_max_pct': 0.03954104612690349, 'tp_mult': 2.3166163497756957, 'tsl_mult': 0.7221912592013559, 'strategy': 'breakout', 'time_stop': 161, 'use_sma': False, 'use_atr': False, 'use_adx': False, 'use_ema': False, 'use_spike': False, 'rsi_required': False, 'edge_k': 0.4459385407151497, 'edge_cap': 0.8028501194952657}.
[I 2025-08-29 22:18:05,479] Trial 360 finished with values: [-1000000000.0, 1000000000.0] and parameters: {'p_sma': 6, 'p_std': 26, 'p_atr': 22, 'p_adx': 15, 'rsi_period': 18, 'ema1': 29, 'ema2': 54, 'slip_atr_k': 0.09564170839853359, 'slip_spread_k': 0.5782157308966374, 'spread_hl_frac': 0.016283780465701857, 'bb_std_mult': 2.0824396061872212, 'rsi_os': 30, 'rsi_ob': 86, 'vol_spike': 0.15849013552047522, 'adx_thresh': 24.55466376259906, 'atr_min_pct': 0.0027102052517143944, 'atr_max_pct': 0.039893048178354186, 'tp_mult': 2.2931876356462855, 'tsl_mult': 0.7241008094254074, 'strategy': 'breakout', 'time_stop': 106, 'use_sma': False, 'use_atr': False, 'use_adx': False, 'use_ema': False, 'use_spike': False, 'rsi_required': False, 'edge_k': 0.6952324311972875, 'edge_cap': 0.8029311275307839}.
[I 2025-08-29 22:18:32,620] Trial 365 finished with values: [-0.006917303120085649, 0.006847388237817421] and parameters: {'p_sma': 58, 'p_std': 34, 'p_atr': 24, 'p_adx': 20, 'rsi_period': 29, 'ema1': 22, 'ema2': 47, 'slip_atr_k': 0.01666243191365256, 'slip_spread_k': 0.5320927600396934, 'spread_hl_frac': 0.028306212631636483, 'bb_std_mult': 2.1452942027693664, 'rsi_os': 33, 'rsi_ob': 61, 'vol_spike': 0.17839650867987103, 'adx_thresh': 26.602489901393156, 'atr_min_pct': 0.003433696231676664, 'atr_max_pct': 0.09688216956786842, 'tp_mult': 2.4397917149959776, 'tsl_mult': 0.7488323132578996, 'strategy': 'mean_reversion', 'time_stop': 86, 'use_sma': False, 'use_atr': False, 'use_adx': False, 'use_ema': False, 'use_spike': False, 'rsi_required': False, 'edge_k': 0.3933762071073677, 'edge_cap': 0.8579797996764191}.
[I 2025-08-29 22:18:32,960] Trial 366 finished with values: [-1000000000.0, 1000000000.0] and parameters: {'p_sma': 16, 'p_std': 24, 'p_atr': 21, 'p_adx': 20, 'rsi_period': 20, 'ema1': 28, 'ema2': 47, 'slip_atr_k': 0.036105592519526275, 'slip_spread_k': 0.834851382473273, 'spread_hl_frac': 0.028126659680023525, 'bb_std_mult': 2.1551783656039643, 'rsi_os': 28, 'rsi_ob': 61, 'vol_spike': 0.18009907836914024, 'adx_thresh': 26.04935657791184, 'atr_min_pct': 0.016010921988818698, 'atr_max_pct': 0.09995188484575149, 'tp_mult': 1.239614520585876, 'tsl_mult': 0.3385078828236553, 'strategy': 'mean_reversion', 'time_stop': 77, 'use_sma': False, 'use_atr': False, 'use_adx': False, 'use_ema': False, 'use_spike': False, 'rsi_required': False, 'edge_k': 1.2427947163655646, 'edge_cap': 0.07313564805592976}.
[I 2025-08-29 22:18:33,048] Trial 364 finished with values: [-0.016783058103066684, 0.016907253510246863] and parameters: {'p_sma': 16, 'p_std': 24, 'p_atr': 21, 'p_adx': 15, 'rsi_period': 12, 'ema1': 19, 'ema2': 52, 'slip_atr_k': 0.008937833712218068, 'slip_spread_k': 0.8624634098165244, 'spread_hl_frac': 0.04246118045200324, 'bb_std_mult': 2.1146333539567626, 'rsi_os': 33, 'rsi_ob': 56, 'vol_spike': 0.15916022722093617, 'adx_thresh': 26.138952186824714, 'atr_min_pct': 0.0026842000741135476, 'atr_max_pct': 0.10821220344384189, 'tp_mult': 2.299759850485594, 'tsl_mult': 0.7280921195339874, 'strategy': 'breakout', 'time_stop': 115, 'use_sma': False, 'use_atr': False, 'use_adx': False, 'use_ema': False, 'use_spike': False, 'rsi_required': False, 'edge_k': 1.5808166723454806, 'edge_cap': 0.7937792211163597}.
[I 2025-08-29 22:18:33,181] Trial 363 finished with values: [-1000000000.0, 1000000000.0] and parameters: {'p_sma': 24, 'p_std': 8, 'p_atr': 10, 'p_adx': 16, 'rsi_period': 12, 'ema1': 19, 'ema2': 29, 'slip_atr_k': 0.22490765498815485, 'slip_spread_k': 0.17406047792659274, 'spread_hl_frac': 0.04238343224855012, 'bb_std_mult': 1.2863278802227487, 'rsi_os': 16, 'rsi_ob': 92, 'vol_spike': 0.15801912379769295, 'adx_thresh': 24.19520018298748, 'atr_min_pct': 0.005051520521926834, 'atr_max_pct': 0.038094176995150185, 'tp_mult': 2.306867174165536, 'tsl_mult': 0.6642064626273658, 'strategy': 'breakout', 'time_stop': 160, 'use_sma': False, 'use_atr': False, 'use_adx': False, 'use_ema': False, 'use_spike': False, 'rsi_required': False, 'edge_k': 1.246290483481777, 'edge_cap': 0.2909187029085183}.
[I 2025-08-29 22:19:00,228] Trial 368 finished with values: [-1000000000.0, 1000000000.0] and parameters: {'p_sma': 54, 'p_std': 52, 'p_atr': 10, 'p_adx': 11, 'rsi_period': 12, 'ema1': 19, 'ema2': 29, 'slip_atr_k': 0.0076871441544497845, 'slip_spread_k': 0.8600372964203362, 'spread_hl_frac': 0.0412653330657434, 'bb_std_mult': 1.2805183811826204, 'rsi_os': 22, 'rsi_ob': 56, 'vol_spike': 0.1867972622108139, 'adx_thresh': 24.38007131172216, 'atr_min_pct': 0.023634998508287607, 'atr_max_pct': 0.06776865772315574, 'tp_mult': 2.910227409228792, 'tsl_mult': 0.7405797439181871, 'strategy': 'breakout', 'time_stop': 122, 'use_sma': False, 'use_atr': False, 'use_adx': False, 'use_ema': False, 'use_spike': False, 'rsi_required': False, 'edge_k': 0.9206798097254678, 'edge_cap': 0.7895349813874606}.
[I 2025-08-29 22:19:00,593] Trial 369 finished with values: [-1000000000.0, 1000000000.0] and parameters: {'p_sma': 54, 'p_std': 8, 'p_atr': 25, 'p_adx': 26, 'rsi_period': 21, 'ema1': 25, 'ema2': 53, 'slip_atr_k': 0.027019994548381693, 'slip_spread_k': 0.7888876076839343, 'spread_hl_frac': 0.036134177513366984, 'bb_std_mult': 1.8201446627129563, 'rsi_os': 16, 'rsi_ob': 49, 'vol_spike': 0.18823615053844966, 'adx_thresh': 15.880361004453297, 'atr_min_pct': 0.029507231066130547, 'atr_max_pct': 0.1345072429963565, 'tp_mult': 1.0344231551855516, 'tsl_mult': 0.6520507448339817, 'strategy': 'breakout', 'time_stop': 94, 'use_sma': False, 'use_atr': False, 'use_adx': False, 'use_ema': False, 'use_spike': False, 'rsi_required': False, 'edge_k': 0.9201994882729206, 'edge_cap': 0.14042754493773424}.
[I 2025-08-29 22:19:00,747] Trial 367 finished with values: [-1000000000.0, 1000000000.0] and parameters: {'p_sma': 7, 'p_std': 8, 'p_atr': 21, 'p_adx': 11, 'rsi_period': 20, 'ema1': 5, 'ema2': 52, 'slip_atr_k': 0.22569622003616616, 'slip_spread_k': 0.7918378326163874, 'spread_hl_frac': 0.017285819402523897, 'bb_std_mult': 1.961080530167688, 'rsi_os': 27, 'rsi_ob': 59, 'vol_spike': 0.18302451305882247, 'adx_thresh': 26.002877009892217, 'atr_min_pct': 0.005042583631045842, 'atr_max_pct': 0.05637239412366787, 'tp_mult': 1.0106026078081123, 'tsl_mult': 0.11090772307199942, 'strategy': 'breakout', 'time_stop': 93, 'use_sma': False, 'use_atr': False, 'use_adx': False, 'use_ema': False, 'use_spike': False, 'rsi_required': False, 'edge_k': 0.6317881211698624, 'edge_cap': 0.4856789812445028}.
[I 2025-08-29 22:19:00,931] Trial 370 finished with values: [-0.01456475139997293, 0.014530562542762748] and parameters: {'p_sma': 18, 'p_std': 28, 'p_atr': 12, 'p_adx': 17, 'rsi_period': 20, 'ema1': 25, 'ema2': 13, 'slip_atr_k': 0.20162816517990373, 'slip_spread_k': 0.7871766318767192, 'spread_hl_frac': 0.01892606952105858, 'bb_std_mult': 1.9589873136295952, 'rsi_os': 22, 'rsi_ob': 58, 'vol_spike': 0.1860891633783244, 'adx_thresh': 25.342828708327776, 'atr_min_pct': 0.0019995225029873363, 'atr_max_pct': 0.10132234984939165, 'tp_mult': 1.022801935585455, 'tsl_mult': 0.37162821236214405, 'strategy': 'breakout', 'time_stop': 92, 'use_sma': False, 'use_atr': False, 'use_adx': False, 'use_ema': False, 'use_spike': False, 'rsi_required': False, 'edge_k': 0.509509011000628, 'edge_cap': 0.09577012144101471}.
[I 2025-08-29 22:19:28,757] Trial 374 finished with values: [-1000000000.0, 1000000000.0] and parameters: {'p_sma': 30, 'p_std': 16, 'p_atr': 22, 'p_adx': 14, 'rsi_period': 39, 'ema1': 14, 'ema2': 49, 'slip_atr_k': 0.015201364653727619, 'slip_spread_k': 0.8284666907790132, 'spread_hl_frac': 0.019869639104554332, 'bb_std_mult': 2.8365210181925504, 'rsi_os': 29, 'rsi_ob': 62, 'vol_spike': 0.20039754588643083, 'adx_thresh': 26.979638996489445, 'atr_min_pct': 0.021885775587419175, 'atr_max_pct': 0.09031104518118434, 'tp_mult': 1.1681078741554711, 'tsl_mult': 0.029476377111206875, 'strategy': 'mean_reversion', 'time_stop': 100, 'use_sma': False, 'use_atr': False, 'use_adx': False, 'use_ema': False, 'use_spike': False, 'rsi_required': False, 'edge_k': 0.4603447807480237, 'edge_cap': 0.8444330067822654}.
[I 2025-08-29 22:19:28,924] Trial 372 finished with values: [-1000000000.0, 1000000000.0] and parameters: {'p_sma': 18, 'p_std': 16, 'p_atr': 9, 'p_adx': 27, 'rsi_period': 20, 'ema1': 9, 'ema2': 35, 'slip_atr_k': 0.1969756799874503, 'slip_spread_k': 0.7703117099239514, 'spread_hl_frac': 0.019265966906269145, 'bb_std_mult': 3.202204451864259, 'rsi_os': 26, 'rsi_ob': 59, 'vol_spike': 0.19980443322700095, 'adx_thresh': 27.635761336131964, 'atr_min_pct': 0.021889132598109227, 'atr_max_pct': 0.10132475448667207, 'tp_mult': 1.0908935810619558, 'tsl_mult': 0.7680397770827097, 'strategy': 'breakout', 'time_stop': 98, 'use_sma': False, 'use_atr': False, 'use_adx': False, 'use_ema': False, 'use_spike': False, 'rsi_required': False, 'edge_k': 1.1088236220364545, 'edge_cap': 0.10331831484282678}.
[I 2025-08-29 22:19:29,089] Trial 371 finished with values: [-0.02617447307943932, 0.026154092534660174] and parameters: {'p_sma': 18, 'p_std': 50, 'p_atr': 22, 'p_adx': 24, 'rsi_period': 20, 'ema1': 25, 'ema2': 51, 'slip_atr_k': 0.022090468568032935, 'slip_spread_k': 0.7849939652488387, 'spread_hl_frac': 0.01947516120450098, 'bb_std_mult': 1.8470239743350259, 'rsi_os': 46, 'rsi_ob': 59, 'vol_spike': 0.04387688792717724, 'adx_thresh': 14.070854387632384, 'atr_min_pct': 0.0020470573716807553, 'atr_max_pct': 0.13288227544620984, 'tp_mult': 1.0397030701060044, 'tsl_mult': 0.31285591665623985, 'strategy': 'breakout', 'time_stop': 94, 'use_sma': False, 'use_atr': False, 'use_adx': False, 'use_ema': False, 'use_spike': False, 'rsi_required': False, 'edge_k': 0.6382675526723092, 'edge_cap': 0.4853902874760573}.
[I 2025-08-29 22:19:29,168] Trial 373 finished with values: [-1000000000.0, 1000000000.0] and parameters: {'p_sma': 31, 'p_std': 29, 'p_atr': 22, 'p_adx': 17, 'rsi_period': 16, 'ema1': 25, 'ema2': 56, 'slip_atr_k': 0.019559699306492505, 'slip_spread_k': 0.2554997446768147, 'spread_hl_frac': 0.018938260393151985, 'bb_std_mult': 1.9960535133630306, 'rsi_os': 46, 'rsi_ob': 62, 'vol_spike': 0.19932347715768428, 'adx_thresh': 25.220994990767583, 'atr_min_pct': 0.010083560044935824, 'atr_max_pct': 0.08970752148579694, 'tp_mult': 1.154586074172591, 'tsl_mult': 0.3182921755604969, 'strategy': 'mean_reversion', 'time_stop': 100, 'use_sma': False, 'use_atr': False, 'use_adx': False, 'use_ema': False, 'use_spike': False, 'rsi_required': False, 'edge_k': 0.5001553491945823, 'edge_cap': 0.37364782276759856}.
[I 2025-08-29 22:19:55,607] Trial 376 finished with values: [-1000000000.0, 1000000000.0] and parameters: {'p_sma': 5, 'p_std': 11, 'p_atr': 24, 'p_adx': 17, 'rsi_period': 63, 'ema1': 24, 'ema2': 56, 'slip_atr_k': 0.02172164949063471, 'slip_spread_k': 0.2597439354637805, 'spread_hl_frac': 0.018088055799274486, 'bb_std_mult': 1.133388368457802, 'rsi_os': 46, 'rsi_ob': 60, 'vol_spike': 0.17603493635054246, 'adx_thresh': 25.06586760674989, 'atr_min_pct': 0.013057865763475692, 'atr_max_pct': 0.09472809509868832, 'tp_mult': 1.1103774892842924, 'tsl_mult': 0.2388895825618909, 'strategy': 'breakout', 'time_stop': 290, 'use_sma': False, 'use_atr': False, 'use_adx': False, 'use_ema': False, 'use_spike': False, 'rsi_required': False, 'edge_k': 1.3263783237468223, 'edge_cap': 0.366461901285435}.
[I 2025-08-29 22:19:56,154] Trial 375 finished with values: [-1000000000.0, 1000000000.0] and parameters: {'p_sma': 5, 'p_std': 11, 'p_atr': 24, 'p_adx': 16, 'rsi_period': 25, 'ema1': 22, 'ema2': 56, 'slip_atr_k': 0.023367916745123833, 'slip_spread_k': 0.6347774852288002, 'spread_hl_frac': 0.017823371948910875, 'bb_std_mult': 2.4834184566251443, 'rsi_os': 34, 'rsi_ob': 60, 'vol_spike': 0.0003711024915654393, 'adx_thresh': 14.165544154258653, 'atr_min_pct': 0.010165868015698815, 'atr_max_pct': 0.09482997158945933, 'tp_mult': 1.1591549277965536, 'tsl_mult': 0.7802907222902982, 'strategy': 'breakout', 'time_stop': 12, 'use_sma': False, 'use_atr': False, 'use_adx': False, 'use_ema': False, 'use_spike': False, 'rsi_required': False, 'edge_k': 0.5316536162391643, 'edge_cap': 0.4660602269329175}.
[I 2025-08-29 22:19:56,240] Trial 378 finished with values: [-1000000000.0, 1000000000.0] and parameters: {'p_sma': 5, 'p_std': 22, 'p_atr': 24, 'p_adx': 9, 'rsi_period': 70, 'ema1': 24, 'ema2': 53, 'slip_atr_k': 0.029026284178509408, 'slip_spread_k': 0.8765461787536112, 'spread_hl_frac': 0.017599728060240277, 'bb_std_mult': 3.048878891665291, 'rsi_os': 25, 'rsi_ob': 60, 'vol_spike': 0.17606087445194038, 'adx_thresh': 9.93907280119976, 'atr_min_pct': 0.0012560579868102545, 'atr_max_pct': 0.09620559607828513, 'tp_mult': 1.1121423702907463, 'tsl_mult': 0.4235834758110948, 'strategy': 'breakout', 'time_stop': 114, 'use_sma': False, 'use_atr': False, 'use_adx': False, 'use_ema': False, 'use_spike': False, 'rsi_required': False, 'edge_k': 1.7984256217508636, 'edge_cap': 0.46635419744512396}.
