[I 2025-08-29 22:58:17,804] Trial 727 finished with values: [-1000000000.0, 1000000000.0] and parameters: {'p_sma': 5, 'p_std': 26, 'p_atr': 22, 'p_adx': 16, 'rsi_period': 33, 'ema1': 26, 'ema2': 53, 'slip_atr_k': 0.14002351420657594, 'slip_spread_k': 0.8644943570045142, 'spread_hl_frac': 0.031494227148744454, 'bb_std_mult': 1.868167807229099, 'rsi_os': 26, 'rsi_ob': 61, 'vol_spike': 0.1661305185752314, 'adx_thresh': 26.084920118038017, 'atr_min_pct': 0.013100210788167506, 'atr_max_pct': 0.09116328180278206, 'tp_mult': 1.7914771981676554, 'tsl_mult': 0.7869772011054013, 'strategy': 'breakout', 'time_stop': 84, 'use_sma': False, 'use_atr': False, 'use_adx': False, 'use_ema': False, 'use_spike': False, 'rsi_required': False, 'edge_k': 0.536256348751716, 'edge_cap': 0.5406170427682477}.
[I 2025-08-29 22:58:44,930] Trial 732 finished with values: [-0.014750192885219615, 0.014721919404190674] and parameters: {'p_sma': 19, 'p_std': 41, 'p_atr': 22, 'p_adx': 17, 'rsi_period': 20, 'ema1': 25, 'ema2': 56, 'slip_atr_k': 0.025090757313977512, 'slip_spread_k': 0.5468781412479036, 'spread_hl_frac': 0.034994999642433355, 'bb_std_mult': 1.8552955616439968, 'rsi_os': 25, 'rsi_ob': 59, 'vol_spike': 0.20970496842630132, 'adx_thresh': 22.850367984022764, 'atr_min_pct': 0.00144080077456271, 'atr_max_pct': 0.09162713264301973, 'tp_mult': 2.866084434074369, 'tsl_mult': 0.7123207319462467, 'strategy': 'breakout', 'time_stop': 82, 'use_sma': False, 'use_atr': False, 'use_adx': False, 'use_ema': False, 'use_spike': False, 'rsi_required': False, 'edge_k': 1.167343439532959, 'edge_cap': 0.19841277496654464}.
[I 2025-08-29 22:58:45,127] Trial 730 finished with values: [-1000000000.0, 1000000000.0] and parameters: {'p_sma': 5, 'p_std': 26, 'p_atr': 21, 'p_adx': 17, 'rsi_period': 7, 'ema1': 25, 'ema2': 53, 'slip_atr_k': 0.21385205668015414, 'slip_spread_k': 0.48259678943595, 'spread_hl_frac': 0.024356093783853446, 'bb_std_mult': 2.3457154034393204, 'rsi_os': 18, 'rsi_ob': 84, 'vol_spike': 0.20100231986761835, 'adx_thresh': 26.08275282733816, 'atr_min_pct': 0.0035844506289960977, 'atr_max_pct': 0.09182250324647484, 'tp_mult': 1.0859436823706792, 'tsl_mult': 0.7218383089739933, 'strategy': 'breakout', 'time_stop': 109, 'use_sma': False, 'use_atr': False, 'use_adx': False, 'use_ema': False, 'use_spike': False, 'rsi_required': False, 'edge_k': 0.5425637102724986, 'edge_cap': 0.7779475776855844}.
[I 2025-08-29 22:58:45,435] Trial 731 finished with values: [-1000000000.0, 1000000000.0] and parameters: {'p_sma': 5, 'p_std': 31, 'p_atr': 22, 'p_adx': 17, 'rsi_period': 20, 'ema1': 25, 'ema2': 46, 'slip_atr_k': 0.204250355157162, 'slip_spread_k': 0.4825056107646308, 'spread_hl_frac': 0.019745041403083897, 'bb_std_mult': 1.8753362512987095, 'rsi_os': 27, 'rsi_ob': 85, 'vol_spike': 0.18565210838444046, 'adx_thresh': 25.80576023192966, 'atr_min_pct': 0.0036070713758791038, 'atr_max_pct': 0.13862042457223245, 'tp_mult': 1.414369098936262, 'tsl_mult': 0.7804040344572791, 'strategy': 'breakout', 'time_stop': 85, 'use_sma': False, 'use_atr': False, 'use_adx': False, 'use_ema': False, 'use_spike': False, 'rsi_required': False, 'edge_k': 0.5434276440224581, 'edge_cap': 0.2009111990433019}.
[I 2025-08-29 22:58:45,605] Trial 733 finished with values: [-0.06111194944213805, 0.06109013572308354] and parameters: {'p_sma': 19, 'p_std': 13, 'p_atr': 23, 'p_adx': 14, 'rsi_period': 19, 'ema1': 25, 'ema2': 28, 'slip_atr_k': 0.00024178071705448917, 'slip_spread_k': 0.8395742220442627, 'spread_hl_frac': 0.03634872763853309, 'bb_std_mult': 1.97297686395311, 'rsi_os': 42, 'rsi_ob': 59, 'vol_spike': 0.20222805579781733, 'adx_thresh': 28.46437419481627, 'atr_min_pct': 0.0014677876680066334, 'atr_max_pct': 0.10148105848574893, 'tp_mult': 1.1230433228100307, 'tsl_mult': 0.7150374945556359, 'strategy': 'breakout', 'time_stop': 109, 'use_sma': False, 'use_atr': False, 'use_adx': False, 'use_ema': False, 'use_spike': False, 'rsi_required': False, 'edge_k': 0.49877700090317706, 'edge_cap': 0.7737336056197184}.
[I 2025-08-29 22:59:12,928] Trial 736 finished with values: [-0.006142536880555216, 0.006116200810533376] and parameters: {'p_sma': 10, 'p_std': 22, 'p_atr': 28, 'p_adx': 8, 'rsi_period': 17, 'ema1': 28, 'ema2': 20, 'slip_atr_k': 0.023396288123183232, 'slip_spread_k': 0.8339389803805662, 'spread_hl_frac': 0.04217947981641097, 'bb_std_mult': 1.293923014963105, 'rsi_os': 25, 'rsi_ob': 59, 'vol_spike': 0.17815455100587244, 'adx_thresh': 34.9991506453801, 'atr_min_pct': 0.002744751936544341, 'atr_max_pct': 0.10152504045875797, 'tp_mult': 1.871510813896374, 'tsl_mult': 0.756020606529136, 'strategy': 'breakout', 'time_stop': 33, 'use_sma': False, 'use_atr': False, 'use_adx': False, 'use_ema': False, 'use_spike': False, 'rsi_required': False, 'edge_k': 0.6114704334156227, 'edge_cap': 0.6596365827987998}.
[I 2025-08-29 22:59:13,152] Trial 734 finished with values: [-0.011262979836873077, 0.01122985545017657] and parameters: {'p_sma': 57, 'p_std': 60, 'p_atr': 23, 'p_adx': 23, 'rsi_period': 19, 'ema1': 23, 'ema2': 51, 'slip_atr_k': 0.1801368959426226, 'slip_spread_k': 0.4828595781119378, 'spread_hl_frac': 0.024625347954674404, 'bb_std_mult': 1.645544148649324, 'rsi_os': 25, 'rsi_ob': 87, 'vol_spike': 0.18531328519916973, 'adx_thresh': 25.728308736192922, 'atr_min_pct': 0.0029324688867978024, 'atr_max_pct': 0.10162240202371525, 'tp_mult': 1.1287828795302428, 'tsl_mult': 0.7567667563290207, 'strategy': 'breakout', 'time_stop': 109, 'use_sma': False, 'use_atr': False, 'use_adx': False, 'use_ema': False, 'use_spike': False, 'rsi_required': False, 'edge_k': 0.4659056441501196, 'edge_cap': 0.7739036609545311}.
[I 2025-08-29 22:59:13,269] Trial 737 finished with values: [-1000000000.0, 1000000000.0] and parameters: {'p_sma': 13, 'p_std': 22, 'p_atr': 24, 'p_adx': 15, 'rsi_period': 62, 'ema1': 24, 'ema2': 36, 'slip_atr_k': 0.1667849071788385, 'slip_spread_k': 0.8312827746717407, 'spread_hl_frac': 0.02248667761450908, 'bb_std_mult': 1.6608353872897206, 'rsi_os': 14, 'rsi_ob': 82, 'vol_spike': 0.17605722707540553, 'adx_thresh': 24.564393637354907, 'atr_min_pct': 0.025118746994224832, 'atr_max_pct': 0.09681713139644241, 'tp_mult': 1.8714905395508368, 'tsl_mult': 0.7550880166771154, 'strategy': 'breakout', 'time_stop': 123, 'use_sma': False, 'use_atr': False, 'use_adx': False, 'use_ema': False, 'use_spike': False, 'rsi_required': False, 'edge_k': 0.6062956792488456, 'edge_cap': 0.9313836018380806}.
[I 2025-08-29 22:59:13,364] Trial 735 finished with values: [-1000000000.0, 1000000000.0] and parameters: {'p_sma': 7, 'p_std': 21, 'p_atr': 23, 'p_adx': 8, 'rsi_period': 52, 'ema1': 24, 'ema2': 18, 'slip_atr_k': 0.021521914569698156, 'slip_spread_k': 0.699244124029533, 'spread_hl_frac': 0.01920222224224913, 'bb_std_mult': 1.9611444825265991, 'rsi_os': 28, 'rsi_ob': 59, 'vol_spike': 0.17747502025861492, 'adx_thresh': 28.33607322103849, 'atr_min_pct': 0.0027488104872499023, 'atr_max_pct': 0.07424924561034478, 'tp_mult': 2.3671863430567335, 'tsl_mult': 0.7581718600350413, 'strategy': 'breakout', 'time_stop': 111, 'use_sma': False, 'use_atr': False, 'use_adx': False, 'use_ema': False, 'use_spike': False, 'rsi_required': False, 'edge_k': 0.6179563827722125, 'edge_cap': 0.9210801454951443}.
[I 2025-08-29 22:59:13,621] Trial 741 finished with values: [-1000000000.0, 1000000000.0] and parameters: {'p_sma': 35, 'p_std': 52, 'p_atr': 24, 'p_adx': 10, 'rsi_period': 65, 'ema1': 11, 'ema2': 55, 'slip_atr_k': 0.05821557265621624, 'slip_spread_k': 0.6647776257988155, 'spread_hl_frac': 0.017715070181628923, 'bb_std_mult': 2.7141422351806974, 'rsi_os': 32, 'rsi_ob': 47, 'vol_spike': 0.012128472455911338, 'adx_thresh': 24.025135143842125, 'atr_min_pct': 0.0023484232217082443, 'atr_max_pct': 0.08506125928434678, 'tp_mult': 1.22905573909846, 'tsl_mult': 0.6857438796433187, 'strategy': 'mean_reversion', 'time_stop': 97, 'use_sma': False, 'use_atr': False, 'use_adx': False, 'use_ema': False, 'use_spike': False, 'rsi_required': False, 'edge_k': 0.44188469009026965, 'edge_cap': 0.8402703789279307}.
[I 2025-08-29 22:59:40,220] Trial 738 finished with values: [-1000000000.0, 1000000000.0] and parameters: {'p_sma': 7, 'p_std': 24, 'p_atr': 24, 'p_adx': 20, 'rsi_period': 22, 'ema1': 19, 'ema2': 51, 'slip_atr_k': 0.24315652287539158, 'slip_spread_k': 0.610828706180219, 'spread_hl_frac': 0.019155239278043443, 'bb_std_mult': 0.7364769622868563, 'rsi_os': 51, 'rsi_ob': 61, 'vol_spike': 0.1727877961591718, 'adx_thresh': 24.431011800301924, 'atr_min_pct': 0.029998406337445747, 'atr_max_pct': 0.07494933108739835, 'tp_mult': 1.2314319869629125, 'tsl_mult': 0.7336804770257896, 'strategy': 'breakout', 'time_stop': 93, 'use_sma': False, 'use_atr': False, 'use_adx': False, 'use_ema': False, 'use_spike': False, 'rsi_required': False, 'edge_k': 0.4589684754101697, 'edge_cap': 0.9291569430464544}.
[I 2025-08-29 22:59:40,479] Trial 739 finished with values: [-1000000000.0, 1000000000.0] and parameters: {'p_sma': 7, 'p_std': 52, 'p_atr': 24, 'p_adx': 15, 'rsi_period': 62, 'ema1': 11, 'ema2': 19, 'slip_atr_k': 0.020927731257309824, 'slip_spread_k': 0.6148284972213451, 'spread_hl_frac': 0.019027853830864413, 'bb_std_mult': 2.0973771020814276, 'rsi_os': 28, 'rsi_ob': 89, 'vol_spike': 0.012049357267555294, 'adx_thresh': 24.468916763546176, 'atr_min_pct': 0.0024421765933717765, 'atr_max_pct': 0.0963277506816177, 'tp_mult': 1.152299962357993, 'tsl_mult': 0.683908125170374, 'strategy': 'breakout', 'time_stop': 123, 'use_sma': False, 'use_atr': False, 'use_adx': False, 'use_ema': False, 'use_spike': False, 'rsi_required': False, 'edge_k': 0.43914654797308345, 'edge_cap': 0.46936321927021996}.
[I 2025-08-29 22:59:40,689] Trial 740 finished with values: [-0.004898148537799352, 0.004921314712007442] and parameters: {'p_sma': 7, 'p_std': 7, 'p_atr': 23, 'p_adx': 16, 'rsi_period': 22, 'ema1': 24, 'ema2': 44, 'slip_atr_k': 0.05253168334899798, 'slip_spread_k': 0.0014322548167658988, 'spread_hl_frac': 0.018791234534946164, 'bb_std_mult': 2.068160070814071, 'rsi_os': 28, 'rsi_ob': 80, 'vol_spike': 0.1081178758186227, 'adx_thresh': 23.386313264207846, 'atr_min_pct': 0.0016773412977067414, 'atr_max_pct': 0.05554899982992259, 'tp_mult': 2.37547897513545, 'tsl_mult': 0.6871464214302706, 'strategy': 'mean_reversion', 'time_stop': 91, 'use_sma': False, 'use_atr': False, 'use_adx': False, 'use_ema': False, 'use_spike': False, 'rsi_required': False, 'edge_k': 0.49546617970269646, 'edge_cap': 0.8389045280438799}.
[I 2025-08-29 22:59:40,946] Trial 742 finished with values: [-0.004534779937412914, 0.004636751435466645] and parameters: {'p_sma': 7, 'p_std': 37, 'p_atr': 25, 'p_adx': 20, 'rsi_period': 22, 'ema1': 22, 'ema2': 54, 'slip_atr_k': 0.011828654269895225, 'slip_spread_k': 0.001781839746307523, 'spread_hl_frac': 0.029562665554119655, 'bb_std_mult': 2.0917369804939896, 'rsi_os': 44, 'rsi_ob': 60, 'vol_spike': 0.10290266986410784, 'adx_thresh': 25.131267251712316, 'atr_min_pct': 0.001993910175734425, 'atr_max_pct': 0.02496273716569411, 'tp_mult': 1.5306492171530495, 'tsl_mult': 0.6431328815848706, 'strategy': 'breakout', 'time_stop': 120, 'use_sma': False, 'use_atr': False, 'use_adx': False, 'use_ema': False, 'use_spike': False, 'rsi_required': False, 'edge_k': 0.5005566045791874, 'edge_cap': 0.8018897911381895}.
[I 2025-08-29 22:59:41,207] Trial 743 finished with values: [-1000000000.0, 1000000000.0] and parameters: {'p_sma': 28, 'p_std': 7, 'p_atr': 23, 'p_adx': 30, 'rsi_period': 21, 'ema1': 7, 'ema2': 54, 'slip_atr_k': 0.07436422285943733, 'slip_spread_k': 0.8085895259049964, 'spread_hl_frac': 0.01572831736402514, 'bb_std_mult': 2.0707985077252293, 'rsi_os': 54, 'rsi_ob': 60, 'vol_spike': 0.06180399337282323, 'adx_thresh': 25.360825966203628, 'atr_min_pct': 0.0018554730695199643, 'atr_max_pct': 0.10690158055414868, 'tp_mult': 1.1599776528786099, 'tsl_mult': 0.9056983464171533, 'strategy': 'mean_reversion', 'time_stop': 117, 'use_sma': False, 'use_atr': False, 'use_adx': False, 'use_ema': False, 'use_spike': False, 'rsi_required': False, 'edge_k': 0.7967159096695557, 'edge_cap': 0.14114310442438716}.
[I 2025-08-29 23:00:08,575] Trial 744 finished with values: [-1000000000.0, 1000000000.0] and parameters: {'p_sma': 45, 'p_std': 37, 'p_atr': 25, 'p_adx': 30, 'rsi_period': 14, 'ema1': 29, 'ema2': 56, 'slip_atr_k': 0.013007564871303876, 'slip_spread_k': 0.7523660099095577, 'spread_hl_frac': 0.016771697592457217, 'bb_std_mult': 2.2308678481357997, 'rsi_os': 22, 'rsi_ob': 60, 'vol_spike': 0.15515102690593274, 'adx_thresh': 19.415876829370017, 'atr_min_pct': 0.02369029173070834, 'atr_max_pct': 0.09462428551792748, 'tp_mult': 1.0458766902550092, 'tsl_mult': 0.7404956515188825, 'strategy': 'mean_reversion', 'time_stop': 119, 'use_sma': False, 'use_atr': False, 'use_adx': False, 'use_ema': False, 'use_spike': False, 'rsi_required': False, 'edge_k': 0.4971605880713339, 'edge_cap': 0.7979737186327079}.
[I 2025-08-29 23:00:08,757] Trial 745 finished with values: [-0.05242936647773899, 0.052469008389131884] and parameters: {'p_sma': 28, 'p_std': 24, 'p_atr': 25, 'p_adx': 30, 'rsi_period': 36, 'ema1': 22, 'ema2': 54, 'slip_atr_k': 0.1109126637668097, 'slip_spread_k': 0.7522437668886057, 'spread_hl_frac': 0.02930345409879731, 'bb_std_mult': 1.5409133455987556, 'rsi_os': 54, 'rsi_ob': 60, 'vol_spike': 0.288325493996165, 'adx_thresh': 18.805417256945386, 'atr_min_pct': 0.0019200728916516083, 'atr_max_pct': 0.0939472028522924, 'tp_mult': 1.088628965557283, 'tsl_mult': 0.6529802296683183, 'strategy': 'breakout', 'time_stop': 242, 'use_sma': False, 'use_atr': False, 'use_adx': False, 'use_ema': False, 'use_spike': False, 'rsi_required': False, 'edge_k': 1.4770475012952944, 'edge_cap': 0.8965086802093931}.
[I 2025-08-29 23:00:08,871] Trial 746 finished with values: [-1000000000.0, 1000000000.0] and parameters: {'p_sma': 45, 'p_std': 11, 'p_atr': 21, 'p_adx': 16, 'rsi_period': 15, 'ema1': 23, 'ema2': 56, 'slip_atr_k': 0.009437545111843063, 'slip_spread_k': 0.8099819928032074, 'spread_hl_frac': 0.01687366088070308, 'bb_std_mult': 2.2277526018863534, 'rsi_os': 26, 'rsi_ob': 60, 'vol_spike': 0.28852425537909593, 'adx_thresh': 19.479799435731472, 'atr_min_pct': 0.025905340031524858, 'atr_max_pct': 0.09403545282119573, 'tp_mult': 2.6475083155829804, 'tsl_mult': 0.7338327290818114, 'strategy': 'breakout', 'time_stop': 116, 'use_sma': False, 'use_atr': False, 'use_adx': False, 'use_ema': False, 'use_spike': False, 'rsi_required': False, 'edge_k': 0.3320904285664199, 'edge_cap': 0.8884824457339793}.
[I 2025-08-29 23:00:08,981] Trial 747 finished with values: [-1000000000.0, 1000000000.0] and parameters: {'p_sma': 6, 'p_std': 27, 'p_atr': 21, 'p_adx': 26, 'rsi_period': 14, 'ema1': 23, 'ema2': 56, 'slip_atr_k': 0.11191945596229479, 'slip_spread_k': 0.7599295681500701, 'spread_hl_frac': 0.016714741572620293, 'bb_std_mult': 2.1729780317621636, 'rsi_os': 26, 'rsi_ob': 62, 'vol_spike': 0.1550724658864936, 'adx_thresh': 16.083234992937673, 'atr_min_pct': 0.026141341363017597, 'atr_max_pct': 0.09420637725515077, 'tp_mult': 1.0875703703073742, 'tsl_mult': 0.733710194968271, 'strategy': 'breakout', 'time_stop': 102, 'use_sma': False, 'use_atr': False, 'use_adx': False, 'use_ema': False, 'use_spike': False, 'rsi_required': False, 'edge_k': 1.4908801490289507, 'edge_cap': 0.8985031944504636}.
[I 2025-08-29 23:00:36,197] Trial 750 finished with values: [-0.007285119808866369, 0.007602792095818987] and parameters: {'p_sma': 40, 'p_std': 39, 'p_atr': 8, 'p_adx': 13, 'rsi_period': 59, 'ema1': 23, 'ema2': 55, 'slip_atr_k': 0.09270460818290643, 'slip_spread_k': 0.5658153871501593, 'spread_hl_frac': 0.008819962290557742, 'bb_std_mult': 0.6082875242506074, 'rsi_os': 33, 'rsi_ob': 65, 'vol_spike': 0.2791596782467577, 'adx_thresh': 27.289817912009084, 'atr_min_pct': 0.004061237350891523, 'atr_max_pct': 0.0989700140152131, 'tp_mult': 1.1084260716283851, 'tsl_mult': 0.48033758272962696, 'strategy': 'breakout', 'time_stop': 100, 'use_sma': False, 'use_atr': False, 'use_adx': False, 'use_ema': False, 'use_spike': False, 'rsi_required': False, 'edge_k': 0.5712578950857556, 'edge_cap': 0.7985634550600355}.
[I 2025-08-29 23:00:36,616] Trial 748 finished with values: [-0.01126759506757824, 0.011240318078599718] and parameters: {'p_sma': 9, 'p_std': 24, 'p_atr': 9, 'p_adx': 26, 'rsi_period': 58, 'ema1': 23, 'ema2': 55, 'slip_atr_k': 0.11166751323598115, 'slip_spread_k': 0.810378588797719, 'spread_hl_frac': 0.017784599973143266, 'bb_std_mult': 1.7877415294025103, 'rsi_os': 35, 'rsi_ob': 76, 'vol_spike': 0.18569752787008792, 'adx_thresh': 27.25707786623254, 'atr_min_pct': 0.0007834254000328583, 'atr_max_pct': 0.09906743826464941, 'tp_mult': 1.0886935941155074, 'tsl_mult': 0.8639103634591523, 'strategy': 'breakout', 'time_stop': 273, 'use_sma': False, 'use_atr': False, 'use_adx': False, 'use_ema': False, 'use_spike': False, 'rsi_required': False, 'edge_k': 1.454975645526728, 'edge_cap': 0.796829717259201}.
[I 2025-08-29 23:00:36,873] Trial 749 finished with values: [-0.0052116938329951346, 0.0051835741960899705] and parameters: {'p_sma': 9, 'p_std': 39, 'p_atr': 9, 'p_adx': 16, 'rsi_period': 57, 'ema1': 23, 'ema2': 55, 'slip_atr_k': 0.12185141668683813, 'slip_spread_k': 0.8065709965682014, 'spread_hl_frac': 0.008612281113574507, 'bb_std_mult': 2.1740096265430124, 'rsi_os': 26, 'rsi_ob': 72, 'vol_spike': 0.18830792756949122, 'adx_thresh': 16.59850690612147, 'atr_min_pct': 0.0008444184676111327, 'atr_max_pct': 0.09912140818678315, 'tp_mult': 2.0169962327983995, 'tsl_mult': 0.9617237209176095, 'strategy': 'breakout', 'time_stop': 296, 'use_sma': False, 'use_atr': False, 'use_adx': False, 'use_ema': False, 'use_spike': False, 'rsi_required': False, 'edge_k': 0.34134579187392733, 'edge_cap': 0.7568831446483769}.
[I 2025-08-29 23:00:37,002] Trial 751 finished with values: [-1000000000.0, 1000000000.0] and parameters: {'p_sma': 9, 'p_std': 39, 'p_atr': 22, 'p_adx': 21, 'rsi_period': 58, 'ema1': 24, 'ema2': 55, 'slip_atr_k': 0.027629799879503855, 'slip_spread_k': 0.8084157422387684, 'spread_hl_frac': 0.0410890195499516, 'bb_std_mult': 1.7799166182205306, 'rsi_os': 24, 'rsi_ob': 61, 'vol_spike': 0.26893974228910483, 'adx_thresh': 26.270219508687408, 'atr_min_pct': 0.0008531099257504497, 'atr_max_pct': 0.1278134210519819, 'tp_mult': 1.7311697582094072, 'tsl_mult': 0.04880470380876267, 'strategy': 'breakout', 'time_stop': 226, 'use_sma': False, 'use_atr': False, 'use_adx': False, 'use_ema': False, 'use_spike': False, 'rsi_required': False, 'edge_k': 0.573316196309531, 'edge_cap': 0.4344898910467642}.
[I 2025-08-29 23:01:05,104] Trial 752 finished with values: [-0.08338320336398042, 0.08336327282152675] and parameters: {'p_sma': 23, 'p_std': 16, 'p_atr': 22, 'p_adx': 14, 'rsi_period': 18, 'ema1': 21, 'ema2': 50, 'slip_atr_k': 0.02724357343230923, 'slip_spread_k': 0.8270468823546107, 'spread_hl_frac': 0.04571748061958909, 'bb_std_mult': 2.0038003131429467, 'rsi_os': 35, 'rsi_ob': 78, 'vol_spike': 0.19334533259510187, 'adx_thresh': 26.256930335658442, 'atr_min_pct': 0.0008479263360571447, 'atr_max_pct': 0.1285887729026445, 'tp_mult': 1.0472796241540654, 'tsl_mult': 0.7023565052842098, 'strategy': 'breakout', 'time_stop': 198, 'use_sma': False, 'use_atr': False, 'use_adx': False, 'use_ema': False, 'use_spike': False, 'rsi_required': False, 'edge_k': 0.39841560836301093, 'edge_cap': 0.4366460451261689}.
[I 2025-08-29 23:01:05,261] Trial 753 finished with values: [-1000000000.0, 1000000000.0] and parameters: {'p_sma': 12, 'p_std': 28, 'p_atr': 19, 'p_adx': 21, 'rsi_period': 40, 'ema1': 9, 'ema2': 32, 'slip_atr_k': 0.02686367340028498, 'slip_spread_k': 0.145681703739387, 'spread_hl_frac': 0.014297097696237649, 'bb_std_mult': 1.997594429486832, 'rsi_os': 24, 'rsi_ob': 58, 'vol_spike': 0.25190043797737527, 'adx_thresh': 26.248711349150714, 'atr_min_pct': 0.012212396470669601, 'atr_max_pct': 0.12921098392142907, 'tp_mult': 1.0394018712125315, 'tsl_mult': 0.5251674848993811, 'strategy': 'breakout', 'time_stop': 106, 'use_sma': False, 'use_atr': False, 'use_adx': False, 'use_ema': False, 'use_spike': False, 'rsi_required': False, 'edge_k': 1.5801356755687164, 'edge_cap': 0.7635269467408675}.
[I 2025-08-29 23:01:05,433] Trial 754 finished with values: [-1000000000.0, 1000000000.0] and parameters: {'p_sma': 52, 'p_std': 28, 'p_atr': 22, 'p_adx': 21, 'rsi_period': 18, 'ema1': 24, 'ema2': 32, 'slip_atr_k': 0.02571838513594272, 'slip_spread_k': 0.3328312922648954, 'spread_hl_frac': 0.04127311714788545, 'bb_std_mult': 1.9737433236285533, 'rsi_os': 24, 'rsi_ob': 68, 'vol_spike': 0.17026177047217034, 'adx_thresh': 26.220490320369137, 'atr_min_pct': 0.021697730278141217, 'atr_max_pct': 0.08890766966229226, 'tp_mult': 1.0349892076296034, 'tsl_mult': 0.5257433070486613, 'strategy': 'breakout', 'time_stop': 108, 'use_sma': False, 'use_atr': False, 'use_adx': False, 'use_ema': False, 'use_spike': False, 'rsi_required': False, 'edge_k': 1.5772310711826822, 'edge_cap': 0.5734218000194666}.
[I 2025-08-29 23:01:05,610] Trial 755 finished with values: [-1000000000.0, 1000000000.0] and parameters: {'p_sma': 8, 'p_std': 25, 'p_atr': 16, 'p_adx': 14, 'rsi_period': 18, 'ema1': 24, 'ema2': 11, 'slip_atr_k': 0.00428271568583548, 'slip_spread_k': 0.8403665818029822, 'spread_hl_frac': 0.0110351633459119, 'bb_std_mult': 2.0048046588481947, 'rsi_os': 9, 'rsi_ob': 68, 'vol_spike': 0.19616760603152955, 'adx_thresh': 25.56476535353486, 'atr_min_pct': 0.0033747887991465173, 'atr_max_pct': 0.08833747771099666, 'tp_mult': 1.3233429680594897, 'tsl_mult': 0.7037397182697106, 'strategy': 'mean_reversion', 'time_stop': 108, 'use_sma': False, 'use_atr': False, 'use_adx': False, 'use_ema': False, 'use_spike': False, 'rsi_required': False, 'edge_k': 0.3900684999354075, 'edge_cap': 0.6117534287236008}.
