[I 2025-08-29 22:19:56,334] Trial 377 finished with values: [-1000000000.0, 1000000000.0] and parameters: {'p_sma': 52, 'p_std': 22, 'p_atr': 24, 'p_adx': 17, 'rsi_period': 16, 'ema1': 23, 'ema2': 56, 'slip_atr_k': 0.021397667039793674, 'slip_spread_k': 0.8194556773877978, 'spread_hl_frac': 0.017972007219055824, 'bb_std_mult': 2.4561413633308464, 'rsi_os': 25, 'rsi_ob': 60, 'vol_spike': 0.17587174727029106, 'adx_thresh': 25.06744425165595, 'atr_min_pct': 0.017067886201916363, 'atr_max_pct': 0.113620059703853, 'tp_mult': 1.902061976757731, 'tsl_mult': 0.24429920453133397, 'strategy': 'mean_reversion', 'time_stop': 115, 'use_sma': False, 'use_atr': False, 'use_adx': False, 'use_ema': False, 'use_spike': False, 'rsi_required': False, 'edge_k': 1.3188623820666248, 'edge_cap': 0.6023829008609453}.
[I 2025-08-29 22:20:23,492] Trial 380 finished with values: [-0.029309413541224072, 0.029291328021216183] and parameters: {'p_sma': 9, 'p_std': 6, 'p_atr': 23, 'p_adx': 9, 'rsi_period': 17, 'ema1': 23, 'ema2': 53, 'slip_atr_k': 0.013146359833781653, 'slip_spread_k': 0.2138436739547907, 'spread_hl_frac': 0.029700210771441457, 'bb_std_mult': 2.0503608304535486, 'rsi_os': 24, 'rsi_ob': 61, 'vol_spike': 0.09741007434046388, 'adx_thresh': 6.87249765168351, 'atr_min_pct': 0.0013119502579062847, 'atr_max_pct': 0.09273076776180512, 'tp_mult': 2.1592655619525676, 'tsl_mult': 0.6671354943783392, 'strategy': 'breakout', 'time_stop': 113, 'use_sma': False, 'use_atr': False, 'use_adx': False, 'use_ema': False, 'use_spike': False, 'rsi_required': False, 'edge_k': 0.42450764286779585, 'edge_cap': 0.8141315499908053}.
[I 2025-08-29 22:20:23,577] Trial 382 finished with values: [-1000000000.0, 1000000000.0] and parameters: {'p_sma': 7, 'p_std': 25, 'p_atr': 23, 'p_adx': 15, 'rsi_period': 82, 'ema1': 6, 'ema2': 33, 'slip_atr_k': 0.01482097715282244, 'slip_spread_k': 0.03993702874009136, 'spread_hl_frac': 0.03387699980634418, 'bb_std_mult': 2.9259791164033477, 'rsi_os': 20, 'rsi_ob': 89, 'vol_spike': 0.16641946416061365, 'adx_thresh': 6.751942276337044, 'atr_min_pct': 0.0031210220436880777, 'atr_max_pct': 0.10484101095259918, 'tp_mult': 2.004249552951822, 'tsl_mult': 0.7164688382711344, 'strategy': 'breakout', 'time_stop': 52, 'use_sma': False, 'use_atr': False, 'use_adx': False, 'use_ema': False, 'use_spike': False, 'rsi_required': False, 'edge_k': 0.4259353282411599, 'edge_cap': 0.8201469000269214}.
[I 2025-08-29 22:20:23,664] Trial 381 finished with values: [-1000000000.0, 1000000000.0] and parameters: {'p_sma': 47, 'p_std': 25, 'p_atr': 23, 'p_adx': 19, 'rsi_period': 22, 'ema1': 23, 'ema2': 54, 'slip_atr_k': 0.01281427069062556, 'slip_spread_k': 0.8148322814577972, 'spread_hl_frac': 0.010394301370634365, 'bb_std_mult': 2.9063666592724227, 'rsi_os': 23, 'rsi_ob': 61, 'vol_spike': 0.1677367824135889, 'adx_thresh': 6.98810755354328, 'atr_min_pct': 0.00639563829119813, 'atr_max_pct': 0.11440331397782875, 'tp_mult': 1.8858920656229516, 'tsl_mult': 0.6815514425255854, 'strategy': 'mean_reversion', 'time_stop': 106, 'use_sma': False, 'use_atr': False, 'use_adx': False, 'use_ema': False, 'use_spike': False, 'rsi_required': False, 'edge_k': 0.46629714944624523, 'edge_cap': 0.44203849046570975}.
[I 2025-08-29 22:20:23,896] Trial 379 finished with values: [-0.006267239785987311, 0.006579400630645001] and parameters: {'p_sma': 8, 'p_std': 22, 'p_atr': 11, 'p_adx': 9, 'rsi_period': 24, 'ema1': 22, 'ema2': 33, 'slip_atr_k': 0.02843085215725667, 'slip_spread_k': 0.8162756190832142, 'spread_hl_frac': 0.0104164497745981, 'bb_std_mult': 2.4838025898435374, 'rsi_os': 20, 'rsi_ob': 57, 'vol_spike': 0.16925211961122358, 'adx_thresh': 19.1111173716764, 'atr_min_pct': 0.0014027056622194834, 'atr_max_pct': 0.115509557780201, 'tp_mult': 1.6291137548145416, 'tsl_mult': 0.682691709927485, 'strategy': 'breakout', 'time_stop': 50, 'use_sma': False, 'use_atr': False, 'use_adx': False, 'use_ema': False, 'use_spike': False, 'rsi_required': False, 'edge_k': 0.7549234975388206, 'edge_cap': 0.4606965853513134}.
[I 2025-08-29 22:20:50,755] Trial 383 finished with values: [-0.014850164012485179, 0.014803080194977938] and parameters: {'p_sma': 47, 'p_std': 24, 'p_atr': 11, 'p_adx': 19, 'rsi_period': 23, 'ema1': 24, 'ema2': 54, 'slip_atr_k': 0.2114424582986282, 'slip_spread_k': 0.46981582992000065, 'spread_hl_frac': 0.04554570176074969, 'bb_std_mult': 2.2751719260107985, 'rsi_os': 27, 'rsi_ob': 62, 'vol_spike': 0.05685582378310593, 'adx_thresh': 26.68180722763601, 'atr_min_pct': 0.003857375799251988, 'atr_max_pct': 0.027063746869385723, 'tp_mult': 1.2165709355704222, 'tsl_mult': 0.6870917032189578, 'strategy': 'mean_reversion', 'time_stop': 110, 'use_sma': False, 'use_atr': False, 'use_adx': False, 'use_ema': False, 'use_spike': False, 'rsi_required': False, 'edge_k': 1.9948703143532076, 'edge_cap': 0.7829492137275931}.
[I 2025-08-29 22:20:50,895] Trial 385 finished with values: [-1000000000.0, 1000000000.0] and parameters: {'p_sma': 8, 'p_std': 45, 'p_atr': 8, 'p_adx': 14, 'rsi_period': 23, 'ema1': 24, 'ema2': 54, 'slip_atr_k': 0.033297039566811654, 'slip_spread_k': 0.8410655339006998, 'spread_hl_frac': 0.015383805220898203, 'bb_std_mult': 3.5416858463426717, 'rsi_os': 27, 'rsi_ob': 94, 'vol_spike': 0.19362193034380304, 'adx_thresh': 23.267586323259508, 'atr_min_pct': 0.0038276534400002084, 'atr_max_pct': 0.09752347144204726, 'tp_mult': 1.20001942899493, 'tsl_mult': 0.74359089036602, 'strategy': 'breakout', 'time_stop': 207, 'use_sma': False, 'use_atr': False, 'use_adx': False, 'use_ema': False, 'use_spike': False, 'rsi_required': False, 'edge_k': 0.5545192928307088, 'edge_cap': 0.7168963462654491}.
[I 2025-08-29 22:20:51,180] Trial 384 finished with values: [-0.016056119436446137, 0.0160785404643885] and parameters: {'p_sma': 11, 'p_std': 27, 'p_atr': 23, 'p_adx': 19, 'rsi_period': 23, 'ema1': 13, 'ema2': 54, 'slip_atr_k': 0.18480741899046338, 'slip_spread_k': 0.8457201453193404, 'spread_hl_frac': 0.015603893246441567, 'bb_std_mult': 2.2376238706782017, 'rsi_os': 27, 'rsi_ob': 57, 'vol_spike': 0.25407709802029366, 'adx_thresh': 23.21516339223493, 'atr_min_pct': 0.0023122085098668944, 'atr_max_pct': 0.07592151906959885, 'tp_mult': 2.698545105770791, 'tsl_mult': 0.16074244303730262, 'strategy': 'mean_reversion', 'time_stop': 108, 'use_sma': False, 'use_atr': False, 'use_adx': False, 'use_ema': False, 'use_spike': False, 'rsi_required': False, 'edge_k': 0.47643371179637817, 'edge_cap': 0.715600671022111}.
[I 2025-08-29 22:20:51,258] Trial 386 finished with values: [-0.005537396418663576, 0.005503266364509207] and parameters: {'p_sma': 22, 'p_std': 27, 'p_atr': 17, 'p_adx': 14, 'rsi_period': 23, 'ema1': 13, 'ema2': 54, 'slip_atr_k': 0.09004668117070777, 'slip_spread_k': 0.8524465399820442, 'spread_hl_frac': 0.01510327628869125, 'bb_std_mult': 2.2633039554052434, 'rsi_os': 27, 'rsi_ob': 51, 'vol_spike': 0.1332227162688066, 'adx_thresh': 25.800303951814826, 'atr_min_pct': 0.0039060803534957628, 'atr_max_pct': 0.11935463849972731, 'tp_mult': 1.2175846286889738, 'tsl_mult': 0.7354282583991343, 'strategy': 'breakout', 'time_stop': 221, 'use_sma': False, 'use_atr': False, 'use_adx': False, 'use_ema': False, 'use_spike': False, 'rsi_required': False, 'edge_k': 0.82986216813541, 'edge_cap': 0.8761054366047589}.
[I 2025-08-29 22:21:17,925] Trial 387 finished with values: [-0.008497351139957532, 0.008482485871787153] and parameters: {'p_sma': 7, 'p_std': 18, 'p_atr': 25, 'p_adx': 14, 'rsi_period': 35, 'ema1': 24, 'ema2': 52, 'slip_atr_k': 0.0049644542912783834, 'slip_spread_k': 0.38350773040008623, 'spread_hl_frac': 0.0150510204655767, 'bb_std_mult': 2.0167844759478895, 'rsi_os': 38, 'rsi_ob': 51, 'vol_spike': 0.18194639015299413, 'adx_thresh': 18.24270999175116, 'atr_min_pct': 0.002391854032003956, 'atr_max_pct': 0.08643600778015209, 'tp_mult': 2.694851086468811, 'tsl_mult': 0.743795389644547, 'strategy': 'breakout', 'time_stop': 123, 'use_sma': False, 'use_atr': False, 'use_adx': False, 'use_ema': False, 'use_spike': False, 'rsi_required': False, 'edge_k': 1.6994290675732557, 'edge_cap': 0.6575146386280115}.
[I 2025-08-29 22:21:18,342] Trial 390 finished with values: [-1000000000.0, 1000000000.0] and parameters: {'p_sma': 7, 'p_std': 40, 'p_atr': 16, 'p_adx': 22, 'rsi_period': 19, 'ema1': 24, 'ema2': 50, 'slip_atr_k': 0.006339675335143255, 'slip_spread_k': 0.7134750186508574, 'spread_hl_frac': 0.01711216183153763, 'bb_std_mult': 2.033613376929672, 'rsi_os': 49, 'rsi_ob': 54, 'vol_spike': 0.07057801800038567, 'adx_thresh': 18.16480620736272, 'atr_min_pct': 0.007702383235573019, 'atr_max_pct': 0.1381721713285361, 'tp_mult': 1.5384786569361248, 'tsl_mult': 0.7124002708427891, 'strategy': 'breakout', 'time_stop': 300, 'use_sma': False, 'use_atr': False, 'use_adx': False, 'use_ema': False, 'use_spike': False, 'rsi_required': False, 'edge_k': 0.5310481629225575, 'edge_cap': 0.7476490646278023}.
[I 2025-08-29 22:21:18,411] Trial 389 finished with values: [-0.008839901818522011, 0.009169715248025855] and parameters: {'p_sma': 39, 'p_std': 41, 'p_atr': 25, 'p_adx': 15, 'rsi_period': 19, 'ema1': 10, 'ema2': 45, 'slip_atr_k': 0.008295577429474024, 'slip_spread_k': 0.7563989917763874, 'spread_hl_frac': 0.013129727628710279, 'bb_std_mult': 2.0447390393265685, 'rsi_os': 26, 'rsi_ob': 54, 'vol_spike': 0.13427160353372175, 'adx_thresh': 17.574127187296064, 'atr_min_pct': 0.0028181917636675843, 'atr_max_pct': 0.0859800140879837, 'tp_mult': 2.9608088058874578, 'tsl_mult': 0.7134340467621779, 'strategy': 'breakout', 'time_stop': 120, 'use_sma': False, 'use_atr': False, 'use_adx': False, 'use_ema': False, 'use_spike': False, 'rsi_required': False, 'edge_k': 0.5356322878841642, 'edge_cap': 0.826847818614273}.
[I 2025-08-29 22:21:18,422] Trial 388 finished with values: [-0.03205466884629882, 0.03214671417886145] and parameters: {'p_sma': 39, 'p_std': 27, 'p_atr': 23, 'p_adx': 21, 'rsi_period': 19, 'ema1': 16, 'ema2': 52, 'slip_atr_k': 0.04420402324746274, 'slip_spread_k': 0.9309362377434072, 'spread_hl_frac': 0.016424896582057022, 'bb_std_mult': 2.5630500465458677, 'rsi_os': 50, 'rsi_ob': 54, 'vol_spike': 0.2533685768436108, 'adx_thresh': 28.185929617988318, 'atr_min_pct': 0.002417269821735325, 'atr_max_pct': 0.0864629473315398, 'tp_mult': 1.5062419556147983, 'tsl_mult': 0.7147985489408095, 'strategy': 'breakout', 'time_stop': 125, 'use_sma': False, 'use_atr': False, 'use_adx': False, 'use_ema': False, 'use_spike': False, 'rsi_required': False, 'edge_k': 1.6877573645967272, 'edge_cap': 0.7463142418396158}.
[I 2025-08-29 22:21:45,434] Trial 392 finished with values: [-1000000000.0, 1000000000.0] and parameters: {'p_sma': 57, 'p_std': 26, 'p_atr': 22, 'p_adx': 18, 'rsi_period': 43, 'ema1': 25, 'ema2': 41, 'slip_atr_k': 0.0444622287323824, 'slip_spread_k': 0.9302234627331837, 'spread_hl_frac': 0.03738283012754094, 'bb_std_mult': 2.1679300372843002, 'rsi_os': 54, 'rsi_ob': 58, 'vol_spike': 0.23435751054394574, 'adx_thresh': 24.47612768531634, 'atr_min_pct': 0.008877108245120828, 'atr_max_pct': 0.1441705473038065, 'tp_mult': 1.5034827152331312, 'tsl_mult': 0.7174752895651738, 'strategy': 'breakout', 'time_stop': 129, 'use_sma': False, 'use_atr': False, 'use_adx': False, 'use_ema': False, 'use_spike': False, 'rsi_required': False, 'edge_k': 0.1813766375198237, 'edge_cap': 0.7840923887935424}.
[I 2025-08-29 22:21:45,561] Trial 394 finished with values: [-1000000000.0, 0.11237560568089695] and parameters: {'p_sma': 33, 'p_std': 48, 'p_atr': 22, 'p_adx': 18, 'rsi_period': 26, 'ema1': 25, 'ema2': 39, 'slip_atr_k': 0.01731602904770456, 'slip_spread_k': 0.8038728546976002, 'spread_hl_frac': 0.016943030015280074, 'bb_std_mult': 2.107605267546066, 'rsi_os': 54, 'rsi_ob': 58, 'vol_spike': 0.20732157769488635, 'adx_thresh': 7.930662621419872, 'atr_min_pct': 0.0004550645364369485, 'atr_max_pct': 0.09931301169702364, 'tp_mult': 1.7921110066924086, 'tsl_mult': 0.7690347656475361, 'strategy': 'breakout', 'time_stop': 105, 'use_sma': False, 'use_atr': False, 'use_adx': False, 'use_ema': False, 'use_spike': False, 'rsi_required': False, 'edge_k': 0.3844767608721027, 'edge_cap': 0.6259150341087104}.
[I 2025-08-29 22:21:45,586] Trial 391 finished with values: [-0.0035805530333818947, 0.0038409810514223193] and parameters: {'p_sma': 6, 'p_std': 31, 'p_atr': 22, 'p_adx': 18, 'rsi_period': 19, 'ema1': 18, 'ema2': 26, 'slip_atr_k': 0.04374811836683026, 'slip_spread_k': 0.7103970678776634, 'spread_hl_frac': 0.016807297528899402, 'bb_std_mult': 2.5661795545646715, 'rsi_os': 54, 'rsi_ob': 58, 'vol_spike': 0.2356695751875318, 'adx_thresh': 27.964510135597155, 'atr_min_pct': 0.002826205912588359, 'atr_max_pct': 0.14973778442396396, 'tp_mult': 1.3395490134366295, 'tsl_mult': 0.7090511297911448, 'strategy': 'breakout', 'time_stop': 21, 'use_sma': False, 'use_atr': False, 'use_adx': False, 'use_ema': False, 'use_spike': False, 'rsi_required': False, 'edge_k': 1.0431138977650303, 'edge_cap': 0.7503515458290477}.
[I 2025-08-29 22:21:45,586] Trial 393 finished with values: [-0.023293864230511607, 0.023277719117113113] and parameters: {'p_sma': 6, 'p_std': 25, 'p_atr': 14, 'p_adx': 18, 'rsi_period': 52, 'ema1': 25, 'ema2': 39, 'slip_atr_k': 0.0174134311954463, 'slip_spread_k': 0.6600241293337741, 'spread_hl_frac': 0.04809933280144235, 'bb_std_mult': 2.1191977744979043, 'rsi_os': 42, 'rsi_ob': 58, 'vol_spike': 0.24624455876660462, 'adx_thresh': 24.543735236733852, 'atr_min_pct': 0.00046895790441915317, 'atr_max_pct': 0.06034343235740756, 'tp_mult': 1.0706203757979458, 'tsl_mult': 0.28441987940149993, 'strategy': 'breakout', 'time_stop': 109, 'use_sma': False, 'use_atr': False, 'use_adx': False, 'use_ema': False, 'use_spike': False, 'rsi_required': False, 'edge_k': 0.1119680246116771, 'edge_cap': 0.7789141046881776}.
[I 2025-08-29 22:22:12,622] Trial 397 finished with values: [-0.006322104453854394, 0.006359375282773874] and parameters: {'p_sma': 10, 'p_std': 24, 'p_atr': 21, 'p_adx': 16, 'rsi_period': 21, 'ema1': 24, 'ema2': 23, 'slip_atr_k': 0.08130359696785852, 'slip_spread_k': 0.798354600013117, 'spread_hl_frac': 0.020566566170628717, 'bb_std_mult': 1.9119969223770816, 'rsi_os': 5, 'rsi_ob': 73, 'vol_spike': 0.27265783658071713, 'adx_thresh': 25.488476428258767, 'atr_min_pct': 0.001753545831285731, 'atr_max_pct': 0.13002829659977733, 'tp_mult': 1.2882757298507035, 'tsl_mult': 0.7908779832155917, 'strategy': 'mean_reversion', 'time_stop': 171, 'use_sma': False, 'use_atr': False, 'use_adx': False, 'use_ema': False, 'use_spike': False, 'rsi_required': False, 'edge_k': 0.35539126053850134, 'edge_cap': 0.8487233813887247}.
[I 2025-08-29 22:22:12,843] Trial 398 finished with values: [-0.007689118771666781, 0.007675723243204865] and parameters: {'p_sma': 14, 'p_std': 30, 'p_atr': 21, 'p_adx': 16, 'rsi_period': 68, 'ema1': 24, 'ema2': 23, 'slip_atr_k': 0.08222866298815387, 'slip_spread_k': 0.8964040061580146, 'spread_hl_frac': 0.02130075798780349, 'bb_std_mult': 1.9059732502806372, 'rsi_os': 18, 'rsi_ob': 59, 'vol_spike': 0.18224553323867526, 'adx_thresh': 25.717586490361846, 'atr_min_pct': 0.0017635493783319334, 'atr_max_pct': 0.14996565341111726, 'tp_mult': 1.282229525993046, 'tsl_mult': 0.4546104273276364, 'strategy': 'mean_reversion', 'time_stop': 173, 'use_sma': False, 'use_atr': False, 'use_adx': False, 'use_ema': False, 'use_spike': False, 'rsi_required': False, 'edge_k': 0.5008485499101882, 'edge_cap': 0.4095745171361486}.
[I 2025-08-29 22:22:13,012] Trial 395 finished with values: [-0.007446093291796796, 0.007425812192495379] and parameters: {'p_sma': 10, 'p_std': 30, 'p_atr': 14, 'p_adx': 8, 'rsi_period': 67, 'ema1': 18, 'ema2': 26, 'slip_atr_k': 0.02530869724985433, 'slip_spread_k': 0.8954167128216958, 'spread_hl_frac': 0.04866773004251917, 'bb_std_mult': 0.922366060585897, 'rsi_os': 44, 'rsi_ob': 59, 'vol_spike': 0.08337759207403708, 'adx_thresh': 29.25328938663563, 'atr_min_pct': 0.001872198988342517, 'atr_max_pct': 0.09285240048082488, 'tp_mult': 1.0684494687638162, 'tsl_mult': 0.27650761891293774, 'strategy': 'mean_reversion', 'time_stop': 171, 'use_sma': False, 'use_atr': False, 'use_adx': False, 'use_ema': False, 'use_spike': False, 'rsi_required': False, 'edge_k': 0.3380433413248748, 'edge_cap': 0.8039292640625937}.
[I 2025-08-29 22:22:13,075] Trial 396 finished with values: [-1000000000.0, 1000000000.0] and parameters: {'p_sma': 10, 'p_std': 24, 'p_atr': 23, 'p_adx': 15, 'rsi_period': 21, 'ema1': 30, 'ema2': 12, 'slip_atr_k': 0.1304455989477672, 'slip_spread_k': 0.89765631529314, 'spread_hl_frac': 0.048531598154480916, 'bb_std_mult': 1.347287496593644, 'rsi_os': 31, 'rsi_ob': 59, 'vol_spike': 0.19167461634129132, 'adx_thresh': 25.845588061238168, 'atr_min_pct': 0.003093100524638371, 'atr_max_pct': 0.04732644077838171, 'tp_mult': 1.0715081537270796, 'tsl_mult': 0.3877060894915776, 'strategy': 'mean_reversion', 'time_stop': 107, 'use_sma': False, 'use_atr': False, 'use_adx': False, 'use_ema': False, 'use_spike': False, 'rsi_required': False, 'edge_k': 0.49725768518068897, 'edge_cap': 0.8070014726296395}.
[I 2025-08-29 22:22:39,897] Trial 401 finished with values: [-1000000000.0, 1000000000.0] and parameters: {'p_sma': 6, 'p_std': 21, 'p_atr': 23, 'p_adx': 15, 'rsi_period': 17, 'ema1': 23, 'ema2': 59, 'slip_atr_k': 0.021530977788838786, 'slip_spread_k': 0.8331626239501352, 'spread_hl_frac': 0.01845410981823947, 'bb_std_mult': 1.9723226651733248, 'rsi_os': 25, 'rsi_ob': 62, 'vol_spike': 0.023581297986369487, 'adx_thresh': 23.85080250646575, 'atr_min_pct': 0.0033885060694408774, 'atr_max_pct': 0.0967504310421858, 'tp_mult': 1.1163599368444264, 'tsl_mult': 0.3869805897283677, 'strategy': 'breakout', 'time_stop': 23, 'use_sma': False, 'use_atr': False, 'use_adx': False, 'use_ema': False, 'use_spike': False, 'rsi_required': False, 'edge_k': 0.8703951980570005, 'edge_cap': 0.257882331123045}.
[I 2025-08-29 22:22:40,439] Trial 402 finished with values: [-1000000000.0, 1000000000.0] and parameters: {'p_sma': 7, 'p_std': 21, 'p_atr': 7, 'p_adx': 27, 'rsi_period': 31, 'ema1': 23, 'ema2': 58, 'slip_atr_k': 0.24735212307111942, 'slip_spread_k': 0.8318481676452768, 'spread_hl_frac': 0.018488175002084734, 'bb_std_mult': 1.9685276970484487, 'rsi_os': 25, 'rsi_ob': 61, 'vol_spike': 0.021151286535224884, 'adx_thresh': 11.5340524147753, 'atr_min_pct': 0.02595477883654074, 'atr_max_pct': 0.09740141336481016, 'tp_mult': 1.691842338651857, 'tsl_mult': 0.7578584940080062, 'strategy': 'breakout', 'time_stop': 152, 'use_sma': False, 'use_atr': False, 'use_adx': False, 'use_ema': False, 'use_spike': False, 'rsi_required': False, 'edge_k': 0.6076663929925825, 'edge_cap': 0.2671059967421832}.
[I 2025-08-29 22:22:40,607] Trial 400 finished with values: [-1000000000.0, 1000000000.0] and parameters: {'p_sma': 9, 'p_std': 31, 'p_atr': 24, 'p_adx': 15, 'rsi_period': 45, 'ema1': 18, 'ema2': 58, 'slip_atr_k': 0.1542151363587504, 'slip_spread_k': 0.8324961683838757, 'spread_hl_frac': 0.04378322044727281, 'bb_std_mult': 1.352081253764013, 'rsi_os': 7, 'rsi_ob': 68, 'vol_spike': 0.19136595435439854, 'adx_thresh': 29.316911147558052, 'atr_min_pct': 0.024433533539607144, 'atr_max_pct': 0.047676207618587485, 'tp_mult': 1.116360675828472, 'tsl_mult': 0.7636901178675033, 'strategy': 'breakout', 'time_stop': 61, 'use_sma': False, 'use_atr': False, 'use_adx': False, 'use_ema': False, 'use_spike': False, 'rsi_required': False, 'edge_k': 1.035326613378761, 'edge_cap': 0.8064544256975354}.
[I 2025-08-29 22:22:40,607] Trial 399 finished with values: [-0.008796585547606317, 0.008791908240392254] and parameters: {'p_sma': 29, 'p_std': 31, 'p_atr': 24, 'p_adx': 25, 'rsi_period': 45, 'ema1': 23, 'ema2': 55, 'slip_atr_k': 0.13084951210159884, 'slip_spread_k': 0.8776022872928338, 'spread_hl_frac': 0.007675034782881646, 'bb_std_mult': 0.9200757050156254, 'rsi_os': 29, 'rsi_ob': 59, 'vol_spike': 0.08215507713854214, 'adx_thresh': 26.059589754230934, 'atr_min_pct': 0.002028514059200316, 'atr_max_pct': 0.09247427140516108, 'tp_mult': 2.2045902351783377, 'tsl_mult': 0.7549797006781869, 'strategy': 'breakout', 'time_stop': 103, 'use_sma': False, 'use_atr': False, 'use_adx': False, 'use_ema': False, 'use_spike': False, 'rsi_required': False, 'edge_k': 0.07185339292094228, 'edge_cap': 0.26113948111333524}.
[I 2025-08-29 22:23:07,944] Trial 406 finished with values: [-1000000000.0, 1000000000.0] and parameters: {'p_sma': 6, 'p_std': 26, 'p_atr': 22, 'p_adx': 17, 'rsi_period': 15, 'ema1': 24, 'ema2': 37, 'slip_atr_k': 0.009951219513245771, 'slip_spread_k': 0.2973232473418651, 'spread_hl_frac': 0.035088188125012694, 'bb_std_mult': 1.5030292817912474, 'rsi_os': 35, 'rsi_ob': 61, 'vol_spike': 0.17825122265875465, 'adx_thresh': 26.568975075975654, 'atr_min_pct': 0.02074307652404549, 'atr_max_pct': 0.08962588522568177, 'tp_mult': 2.5057858684880623, 'tsl_mult': 0.7270780213134764, 'strategy': 'breakout', 'time_stop': 84, 'use_sma': False, 'use_atr': False, 'use_adx': False, 'use_ema': False, 'use_spike': False, 'rsi_required': False, 'edge_k': 0.5819096473617678, 'edge_cap': 0.5461704830371049}.
[I 2025-08-29 22:23:07,973] Trial 404 finished with values: [-0.003246169340190508, 0.003887413487957175] and parameters: {'p_sma': 9, 'p_std': 25, 'p_atr': 24, 'p_adx': 17, 'rsi_period': 14, 'ema1': 24, 'ema2': 55, 'slip_atr_k': 0.01245987569300632, 'slip_spread_k': 0.874611881773474, 'spread_hl_frac': 0.0016773792753990054, 'bb_std_mult': 2.0710812412719877, 'rsi_os': 29, 'rsi_ob': 66, 'vol_spike': 0.1873355887299778, 'adx_thresh': 26.798639886653362, 'atr_min_pct': 0.002799640583108904, 'atr_max_pct': 0.08995466403547117, 'tp_mult': 1.1461143440509542, 'tsl_mult': 0.698888943888131, 'strategy': 'breakout', 'time_stop': 101, 'use_sma': False, 'use_atr': False, 'use_adx': False, 'use_ema': False, 'use_spike': False, 'rsi_required': False, 'edge_k': 0.4462599909703395, 'edge_cap': 0.5621743620158813}.
