[I 2025-08-29 23:54:34,703] Trial 1240 finished with values: [-1000000000.0, 1000000000.0] and parameters: {'p_sma': 15, 'p_std': 26, 'p_atr': 28, 'p_adx': 14, 'rsi_period': 21, 'ema1': 23, 'ema2': 30, 'slip_atr_k': 0.026192762779295466, 'slip_spread_k': 0.8152384110323236, 'spread_hl_frac': 0.018616414199798773, 'bb_std_mult': 2.39700719513413, 'rsi_os': 37, 'rsi_ob': 58, 'vol_spike': 0.1807633690811854, 'adx_thresh': 20.462244802862042, 'atr_min_pct': 0.01274280262149198, 'atr_max_pct': 0.12566124325878247, 'tp_mult': 1.0743595787826554, 'tsl_mult': 0.7159177424584434, 'strategy': 'breakout', 'time_stop': 108, 'use_sma': False, 'use_atr': False, 'use_adx': False, 'use_ema': False, 'use_spike': False, 'rsi_required': False, 'edge_k': 1.0306629833138856, 'edge_cap': 0.551306343269188}.
[I 2025-08-29 23:54:34,771] Trial 1243 finished with values: [-1000000000.0, 1000000000.0] and parameters: {'p_sma': 23, 'p_std': 59, 'p_atr': 24, 'p_adx': 14, 'rsi_period': 21, 'ema1': 23, 'ema2': 44, 'slip_atr_k': 0.027782831500827977, 'slip_spread_k': 0.7790406443169862, 'spread_hl_frac': 0.016378502569252523, 'bb_std_mult': 2.2326658063393046, 'rsi_os': 26, 'rsi_ob': 58, 'vol_spike': 0.1974181709401759, 'adx_thresh': 23.745051880686095, 'atr_min_pct': 0.02408879549715065, 'atr_max_pct': 0.12603011686156845, 'tp_mult': 2.052053870330071, 'tsl_mult': 0.7141887491517458, 'strategy': 'breakout', 'time_stop': 111, 'use_sma': False, 'use_atr': False, 'use_adx': False, 'use_ema': False, 'use_spike': False, 'rsi_required': False, 'edge_k': 0.7006647328649488, 'edge_cap': 0.6331383285929534}.
[I 2025-08-29 23:55:00,858] Trial 1245 finished with values: [-1000000000.0, 1000000000.0] and parameters: {'p_sma': 12, 'p_std': 7, 'p_atr': 24, 'p_adx': 19, 'rsi_period': 17, 'ema1': 24, 'ema2': 53, 'slip_atr_k': 0.01659272203645734, 'slip_spread_k': 0.772522920679279, 'spread_hl_frac': 0.0026896191373667992, 'bb_std_mult': 2.3853509874324557, 'rsi_os': 43, 'rsi_ob': 69, 'vol_spike': 0.25214370699804206, 'adx_thresh': 23.647279694834822, 'atr_min_pct': 0.012424464772535983, 'atr_max_pct': 0.10367778220456084, 'tp_mult': 2.901616965266707, 'tsl_mult': 0.7133857185468137, 'strategy': 'breakout', 'time_stop': 81, 'use_sma': False, 'use_atr': False, 'use_adx': False, 'use_ema': False, 'use_spike': False, 'rsi_required': False, 'edge_k': 0.8154720226578457, 'edge_cap': 0.7810830953379023}.
[I 2025-08-29 23:55:00,858] Trial 1244 finished with values: [-1000000000.0, 1000000000.0] and parameters: {'p_sma': 12, 'p_std': 7, 'p_atr': 24, 'p_adx': 19, 'rsi_period': 21, 'ema1': 23, 'ema2': 53, 'slip_atr_k': 0.016734831278308132, 'slip_spread_k': 0.0018250564186185203, 'spread_hl_frac': 0.0065774245448005746, 'bb_std_mult': 1.9293283033210675, 'rsi_os': 25, 'rsi_ob': 66, 'vol_spike': 0.09835747411282332, 'adx_thresh': 23.437709976477095, 'atr_min_pct': 0.019507158023136566, 'atr_max_pct': 0.09710872813493948, 'tp_mult': 2.9650504641502824, 'tsl_mult': 0.7104233822432313, 'strategy': 'breakout', 'time_stop': 144, 'use_sma': False, 'use_atr': False, 'use_adx': False, 'use_ema': False, 'use_spike': False, 'rsi_required': False, 'edge_k': 0.43818446857633414, 'edge_cap': 0.7644866980064488}.
[I 2025-08-29 23:55:00,990] Trial 1246 finished with values: [-1000000000.0, 1000000000.0] and parameters: {'p_sma': 23, 'p_std': 24, 'p_atr': 27, 'p_adx': 17, 'rsi_period': 17, 'ema1': 11, 'ema2': 53, 'slip_atr_k': 0.08831348409564464, 'slip_spread_k': 0.08223473404407927, 'spread_hl_frac': 0.0011298832227426732, 'bb_std_mult': 1.0712588330628658, 'rsi_os': 26, 'rsi_ob': 45, 'vol_spike': 0.14820240432620252, 'adx_thresh': 24.599236783300363, 'atr_min_pct': 0.017978966032696254, 'atr_max_pct': 0.09727595562226266, 'tp_mult': 1.1816612017688666, 'tsl_mult': 0.7110028058762561, 'strategy': 'breakout', 'time_stop': 275, 'use_sma': False, 'use_atr': False, 'use_adx': False, 'use_ema': False, 'use_spike': False, 'rsi_required': False, 'edge_k': 1.3721630176247228, 'edge_cap': 0.7792079860196932}.
[I 2025-08-29 23:55:01,262] Trial 1247 finished with values: [-1000000000.0, 1000000000.0] and parameters: {'p_sma': 7, 'p_std': 24, 'p_atr': 23, 'p_adx': 18, 'rsi_period': 7, 'ema1': 9, 'ema2': 16, 'slip_atr_k': 0.14224777473220412, 'slip_spread_k': 0.7607789014490198, 'spread_hl_frac': 0.0183112089139208, 'bb_std_mult': 1.9660503936613054, 'rsi_os': 16, 'rsi_ob': 64, 'vol_spike': 0.20732730845176534, 'adx_thresh': 24.512787409453498, 'atr_min_pct': 0.01789710166340249, 'atr_max_pct': 0.10339063538229516, 'tp_mult': 1.1679929509809739, 'tsl_mult': 0.22016578459281988, 'strategy': 'breakout', 'time_stop': 188, 'use_sma': False, 'use_atr': False, 'use_adx': False, 'use_ema': False, 'use_spike': False, 'rsi_required': False, 'edge_k': 1.3787160145714275, 'edge_cap': 0.7811356243905588}.
[I 2025-08-29 23:55:01,598] Trial 1250 finished with values: [-1000000000.0, 1000000000.0] and parameters: {'p_sma': 7, 'p_std': 28, 'p_atr': 25, 'p_adx': 20, 'rsi_period': 47, 'ema1': 25, 'ema2': 54, 'slip_atr_k': 0.14101779493468375, 'slip_spread_k': 0.8534720731373655, 'spread_hl_frac': 0.030855241682940522, 'bb_std_mult': 1.9757477005246178, 'rsi_os': 52, 'rsi_ob': 70, 'vol_spike': 0.24019306192394374, 'adx_thresh': 7.210868199051038, 'atr_min_pct': 0.014615322293515136, 'atr_max_pct': 0.09215974467686236, 'tp_mult': 2.8543309405576873, 'tsl_mult': 0.06508965455955351, 'strategy': 'mean_reversion', 'time_stop': 161, 'use_sma': False, 'use_atr': False, 'use_adx': False, 'use_ema': False, 'use_spike': False, 'rsi_required': False, 'edge_k': 1.6450666175190194, 'edge_cap': 0.8137849048568495}.
[I 2025-08-29 23:55:26,521] Trial 1248 finished with values: [-1000000000.0, 1000000000.0] and parameters: {'p_sma': 7, 'p_std': 24, 'p_atr': 23, 'p_adx': 20, 'rsi_period': 9, 'ema1': 25, 'ema2': 12, 'slip_atr_k': 0.009637054071686118, 'slip_spread_k': 0.6190200252343155, 'spread_hl_frac': 0.018188052299693214, 'bb_std_mult': 1.6738362875036277, 'rsi_os': 29, 'rsi_ob': 64, 'vol_spike': 0.1515424181337928, 'adx_thresh': 24.456870942806884, 'atr_min_pct': 0.022711378912610918, 'atr_max_pct': 0.07295810404755416, 'tp_mult': 1.165577314409548, 'tsl_mult': 0.740557390266376, 'strategy': 'breakout', 'time_stop': 184, 'use_sma': False, 'use_atr': False, 'use_adx': False, 'use_ema': False, 'use_spike': False, 'rsi_required': False, 'edge_k': 1.3766824219669762, 'edge_cap': 0.809849044063364}.
[I 2025-08-29 23:55:26,748] Trial 1249 finished with values: [-0.00731399009297673, 0.007338458561009042] and parameters: {'p_sma': 39, 'p_std': 24, 'p_atr': 27, 'p_adx': 18, 'rsi_period': 7, 'ema1': 29, 'ema2': 17, 'slip_atr_k': 0.0863596426170104, 'slip_spread_k': 0.6323164293690371, 'spread_hl_frac': 0.01819746044791837, 'bb_std_mult': 1.9843638683527323, 'rsi_os': 19, 'rsi_ob': 92, 'vol_spike': 0.2050648431380739, 'adx_thresh': 34.998223122035434, 'atr_min_pct': 0.003537996317296116, 'atr_max_pct': 0.09710642389123354, 'tp_mult': 1.1939569855989642, 'tsl_mult': 0.22029793724999802, 'strategy': 'breakout', 'time_stop': 159, 'use_sma': False, 'use_atr': False, 'use_adx': False, 'use_ema': False, 'use_spike': False, 'rsi_required': False, 'edge_k': 1.3795349921385833, 'edge_cap': 0.8486570896622259}.
[I 2025-08-29 23:55:26,977] Trial 1251 finished with values: [-1000000000.0, 1000000000.0] and parameters: {'p_sma': 5, 'p_std': 9, 'p_atr': 25, 'p_adx': 21, 'rsi_period': 19, 'ema1': 25, 'ema2': 47, 'slip_atr_k': 0.06458211149804483, 'slip_spread_k': 0.8547055879082626, 'spread_hl_frac': 0.04328665820545559, 'bb_std_mult': 2.0520520253327077, 'rsi_os': 29, 'rsi_ob': 55, 'vol_spike': 0.006514052005491322, 'adx_thresh': 28.385840871429746, 'atr_min_pct': 0.004899214637437154, 'atr_max_pct': 0.1470144583600746, 'tp_mult': 1.9858392153657278, 'tsl_mult': 0.7956598643417896, 'strategy': 'mean_reversion', 'time_stop': 101, 'use_sma': False, 'use_atr': False, 'use_adx': False, 'use_ema': False, 'use_spike': False, 'rsi_required': False, 'edge_k': 0.575454593686031, 'edge_cap': 0.8469181520948145}.
[I 2025-08-29 23:55:27,747] Trial 1252 finished with values: [-1000000000.0, 1000000000.0] and parameters: {'p_sma': 5, 'p_std': 9, 'p_atr': 10, 'p_adx': 17, 'rsi_period': 50, 'ema1': 7, 'ema2': 26, 'slip_atr_k': 0.010993680548903421, 'slip_spread_k': 0.4210513157170833, 'spread_hl_frac': 0.021344774698079577, 'bb_std_mult': 2.0489945848214886, 'rsi_os': 29, 'rsi_ob': 92, 'vol_spike': 0.19034321819853503, 'adx_thresh': 12.575584416792719, 'atr_min_pct': 0.010088525749877675, 'atr_max_pct': 0.07303056525087627, 'tp_mult': 1.1300282673244753, 'tsl_mult': 0.7500345307291892, 'strategy': 'breakout', 'time_stop': 295, 'use_sma': False, 'use_atr': False, 'use_adx': False, 'use_ema': False, 'use_spike': False, 'rsi_required': False, 'edge_k': 0.09297010893037183, 'edge_cap': 0.8530620758274557}.
[I 2025-08-29 23:55:53,578] Trial 1254 finished with values: [-0.01869367914014297, 0.01869028332288715] and parameters: {'p_sma': 34, 'p_std': 9, 'p_atr': 19, 'p_adx': 13, 'rsi_period': 44, 'ema1': 24, 'ema2': 49, 'slip_atr_k': 0.013247459314697806, 'slip_spread_k': 0.1253689493823864, 'spread_hl_frac': 0.021518782031627885, 'bb_std_mult': 2.0634268373209896, 'rsi_os': 12, 'rsi_ob': 80, 'vol_spike': 0.1885140827150415, 'adx_thresh': 26.714358847937987, 'atr_min_pct': 0.001113472498056883, 'atr_max_pct': 0.09362935196266102, 'tp_mult': 1.6811618943934996, 'tsl_mult': 0.3269200616541109, 'strategy': 'mean_reversion', 'time_stop': 101, 'use_sma': False, 'use_atr': False, 'use_adx': False, 'use_ema': False, 'use_spike': False, 'rsi_required': False, 'edge_k': 0.5641017346309027, 'edge_cap': 0.2626149191365625}.
[I 2025-08-29 23:55:53,834] Trial 1253 finished with values: [-0.011507907580170507, 0.011418550770595217] and parameters: {'p_sma': 41, 'p_std': 11, 'p_atr': 10, 'p_adx': 13, 'rsi_period': 19, 'ema1': 7, 'ema2': 48, 'slip_atr_k': 0.12621393090920993, 'slip_spread_k': 0.8424548177768528, 'spread_hl_frac': 0.015149636123838175, 'bb_std_mult': 3.534231544247457, 'rsi_os': 23, 'rsi_ob': 60, 'vol_spike': 0.19027382910071827, 'adx_thresh': 28.49816555671055, 'atr_min_pct': 0.004533488429246118, 'atr_max_pct': 0.033954466700024645, 'tp_mult': 1.1207592252135496, 'tsl_mult': 0.25459526562014323, 'strategy': 'mean_reversion', 'time_stop': 127, 'use_sma': False, 'use_atr': False, 'use_adx': False, 'use_ema': False, 'use_spike': False, 'rsi_required': False, 'edge_k': 0.2843262833591538, 'edge_cap': 0.8412399100610171}.
[I 2025-08-29 23:55:53,860] Trial 1256 finished with values: [-0.006428544144705506, 0.006403752552783592] and parameters: {'p_sma': 8, 'p_std': 26, 'p_atr': 20, 'p_adx': 15, 'rsi_period': 23, 'ema1': 24, 'ema2': 22, 'slip_atr_k': 0.11319334745772006, 'slip_spread_k': 0.8879566305344557, 'spread_hl_frac': 0.038853109852194576, 'bb_std_mult': 0.834532644165495, 'rsi_os': 23, 'rsi_ob': 60, 'vol_spike': 0.11978871689349474, 'adx_thresh': 26.839841421417976, 'atr_min_pct': 0.001149725192381512, 'atr_max_pct': 0.09306097605958984, 'tp_mult': 1.6591217228555248, 'tsl_mult': 0.7497545344875182, 'strategy': 'breakout', 'time_stop': 126, 'use_sma': False, 'use_atr': False, 'use_adx': False, 'use_ema': False, 'use_spike': False, 'rsi_required': False, 'edge_k': 0.4678566323706522, 'edge_cap': 0.7341209508775481}.
[I 2025-08-29 23:55:53,923] Trial 1255 finished with values: [-0.02041863196441407, 0.02039342380026641] and parameters: {'p_sma': 41, 'p_std': 26, 'p_atr': 22, 'p_adx': 13, 'rsi_period': 23, 'ema1': 7, 'ema2': 55, 'slip_atr_k': 0.12651107070322498, 'slip_spread_k': 0.12440118608894157, 'spread_hl_frac': 0.004708689740397176, 'bb_std_mult': 3.5536235025594713, 'rsi_os': 23, 'rsi_ob': 60, 'vol_spike': 0.15792321800343248, 'adx_thresh': 26.74143124419615, 'atr_min_pct': 0.0010664826142668183, 'atr_max_pct': 0.04403489242012277, 'tp_mult': 1.1245023412289288, 'tsl_mult': 0.28683649361995245, 'strategy': 'breakout', 'time_stop': 250, 'use_sma': False, 'use_atr': False, 'use_adx': False, 'use_ema': False, 'use_spike': False, 'rsi_required': False, 'edge_k': 0.4531120961732641, 'edge_cap': 0.2665344746466113}.
[I 2025-08-29 23:56:19,512] Trial 1258 finished with values: [-0.015422532741277029, 0.015402801660056737] and parameters: {'p_sma': 48, 'p_std': 27, 'p_atr': 8, 'p_adx': 17, 'rsi_period': 23, 'ema1': 5, 'ema2': 35, 'slip_atr_k': 0.021155256628879474, 'slip_spread_k': 0.48586401587391753, 'spread_hl_frac': 0.017104487973818864, 'bb_std_mult': 2.159270660325547, 'rsi_os': 25, 'rsi_ob': 61, 'vol_spike': 0.15832595732527432, 'adx_thresh': 9.513871282129479, 'atr_min_pct': 0.0022448066119573912, 'atr_max_pct': 0.1308535898240603, 'tp_mult': 1.0448341297828256, 'tsl_mult': 0.29347819422314725, 'strategy': 'breakout', 'time_stop': 54, 'use_sma': False, 'use_atr': False, 'use_adx': False, 'use_ema': False, 'use_spike': False, 'rsi_required': False, 'edge_k': 1.7734727576451024, 'edge_cap': 0.23486378705938737}.
[I 2025-08-29 23:56:20,059] Trial 1259 finished with values: [-1000000000.0, 1000000000.0] and parameters: {'p_sma': 48, 'p_std': 15, 'p_atr': 23, 'p_adx': 25, 'rsi_period': 62, 'ema1': 5, 'ema2': 54, 'slip_atr_k': 0.019101157617065195, 'slip_spread_k': 0.2724696189485982, 'spread_hl_frac': 0.03510651814045814, 'bb_std_mult': 1.4170037473565107, 'rsi_os': 25, 'rsi_ob': 61, 'vol_spike': 0.0407257597994241, 'adx_thresh': 17.171076220749956, 'atr_min_pct': 0.020573165653166886, 'atr_max_pct': 0.08700599828045523, 'tp_mult': 1.0396064692119642, 'tsl_mult': 0.6387675537078064, 'strategy': 'breakout', 'time_stop': 119, 'use_sma': False, 'use_atr': False, 'use_adx': False, 'use_ema': False, 'use_spike': False, 'rsi_required': False, 'edge_k': 1.7452476812689703, 'edge_cap': 0.32595516384664347}.
[I 2025-08-29 23:56:20,252] Trial 1260 finished with values: [-1000000000.0, 1000000000.0] and parameters: {'p_sma': 48, 'p_std': 33, 'p_atr': 23, 'p_adx': 30, 'rsi_period': 81, 'ema1': 10, 'ema2': 35, 'slip_atr_k': 0.15200646696741182, 'slip_spread_k': 0.5871380345125269, 'spread_hl_frac': 0.015305659611699815, 'bb_std_mult': 2.1486139554463, 'rsi_os': 27, 'rsi_ob': 46, 'vol_spike': 0.17426891500973735, 'adx_thresh': 25.092753617535998, 'atr_min_pct': 0.018918250262764256, 'atr_max_pct': 0.10866862068527317, 'tp_mult': 1.0470096346651474, 'tsl_mult': 0.5442783242683231, 'strategy': 'breakout', 'time_stop': 89, 'use_sma': False, 'use_atr': False, 'use_adx': False, 'use_ema': False, 'use_spike': False, 'rsi_required': False, 'edge_k': 0.18509784940264717, 'edge_cap': 0.33642304237693466}.
[I 2025-08-29 23:56:20,315] Trial 1257 finished with values: [-0.014899266275125722, 0.014871244671123164] and parameters: {'p_sma': 25, 'p_std': 27, 'p_atr': 22, 'p_adx': 9, 'rsi_period': 19, 'ema1': 26, 'ema2': 56, 'slip_atr_k': 0.11004042179437704, 'slip_spread_k': 0.8757119044705424, 'spread_hl_frac': 0.03522650746675711, 'bb_std_mult': 2.9360437717053776, 'rsi_os': 23, 'rsi_ob': 60, 'vol_spike': 0.2619375340248188, 'adx_thresh': 25.38497177546836, 'atr_min_pct': 0.0023191186673197535, 'atr_max_pct': 0.10044142781709764, 'tp_mult': 1.0368256368589268, 'tsl_mult': 0.2541923657889083, 'strategy': 'breakout', 'time_stop': 118, 'use_sma': False, 'use_atr': False, 'use_adx': False, 'use_ema': False, 'use_spike': False, 'rsi_required': False, 'edge_k': 0.27510518583690813, 'edge_cap': 0.7347006190414979}.
[I 2025-08-29 23:56:46,669] Trial 1263 finished with values: [-0.024183279341841835, 0.024243775115259582] and parameters: {'p_sma': 9, 'p_std': 25, 'p_atr': 22, 'p_adx': 10, 'rsi_period': 14, 'ema1': 24, 'ema2': 52, 'slip_atr_k': 0.18143842349966507, 'slip_spread_k': 0.8787561387996919, 'spread_hl_frac': 0.027683158489687425, 'bb_std_mult': 1.8953304029802502, 'rsi_os': 55, 'rsi_ob': 82, 'vol_spike': 0.2673272024361221, 'adx_thresh': 26.07660774143167, 'atr_min_pct': 0.002713632736734483, 'atr_max_pct': 0.05515180118904635, 'tp_mult': 1.2161311512410773, 'tsl_mult': 0.7327834960502368, 'strategy': 'breakout', 'time_stop': 97, 'use_sma': False, 'use_atr': False, 'use_adx': False, 'use_ema': False, 'use_spike': False, 'rsi_required': False, 'edge_k': 0.505879194352645, 'edge_cap': 0.8022895983446535}.
[I 2025-08-29 23:56:46,681] Trial 1262 finished with values: [-1000000000.0, 1000000000.0] and parameters: {'p_sma': 44, 'p_std': 53, 'p_atr': 22, 'p_adx': 7, 'rsi_period': 46, 'ema1': 26, 'ema2': 56, 'slip_atr_k': 0.03248421950045183, 'slip_spread_k': 0.5902634789053159, 'spread_hl_frac': 0.023418011711761465, 'bb_std_mult': 2.531715367236808, 'rsi_os': 27, 'rsi_ob': 61, 'vol_spike': 0.1725879790072628, 'adx_thresh': 25.241957228436096, 'atr_min_pct': 0.018777302375443644, 'atr_max_pct': 0.05546606474898837, 'tp_mult': 1.0914177290249178, 'tsl_mult': 0.5446384916720596, 'strategy': 'breakout', 'time_stop': 10, 'use_sma': False, 'use_atr': False, 'use_adx': False, 'use_ema': False, 'use_spike': False, 'rsi_required': False, 'edge_k': 0.1934413777992262, 'edge_cap': 0.892967286606904}.
[I 2025-08-29 23:56:46,701] Trial 1264 finished with values: [-1000000000.0, 1000000000.0] and parameters: {'p_sma': 9, 'p_std': 52, 'p_atr': 23, 'p_adx': 7, 'rsi_period': 19, 'ema1': 24, 'ema2': 52, 'slip_atr_k': 0.09770230251467013, 'slip_spread_k': 0.8322938294289972, 'spread_hl_frac': 0.032036281996417865, 'bb_std_mult': 2.2998559894956507, 'rsi_os': 55, 'rsi_ob': 59, 'vol_spike': 0.17058899020686893, 'adx_thresh': 26.022971728204936, 'atr_min_pct': 0.02950425006546761, 'atr_max_pct': 0.08893436374166398, 'tp_mult': 1.2313913183374154, 'tsl_mult': 0.7262839491974105, 'strategy': 'breakout', 'time_stop': 105, 'use_sma': False, 'use_atr': False, 'use_adx': False, 'use_ema': False, 'use_spike': False, 'rsi_required': False, 'edge_k': 0.4986221980303262, 'edge_cap': 0.8884097213353161}.
[I 2025-08-29 23:56:46,809] Trial 1261 finished with values: [-1000000000.0, 1000000000.0] and parameters: {'p_sma': 9, 'p_std': 25, 'p_atr': 23, 'p_adx': 15, 'rsi_period': 19, 'ema1': 26, 'ema2': 54, 'slip_atr_k': 0.1520205977488876, 'slip_spread_k': 0.8705127682436697, 'spread_hl_frac': 0.015764631008148233, 'bb_std_mult': 1.4050249767135754, 'rsi_os': 27, 'rsi_ob': 59, 'vol_spike': 0.17201931286853492, 'adx_thresh': 25.082877362042012, 'atr_min_pct': 0.020521454313412853, 'atr_max_pct': 0.08891341346897985, 'tp_mult': 1.0487450677261312, 'tsl_mult': 0.7339133718201837, 'strategy': 'breakout', 'time_stop': 213, 'use_sma': False, 'use_atr': False, 'use_adx': False, 'use_ema': False, 'use_spike': False, 'rsi_required': False, 'edge_k': 0.1789703192282912, 'edge_cap': 0.14640489311038984}.
[I 2025-08-29 23:56:47,135] Trial 1267 finished with values: [-1000000000.0, 1000000000.0] and parameters: {'p_sma': 55, 'p_std': 23, 'p_atr': 16, 'p_adx': 15, 'rsi_period': 17, 'ema1': 22, 'ema2': 10, 'slip_atr_k': 0.24488150739472875, 'slip_spread_k': 0.04375288748245737, 'spread_hl_frac': 0.017110829038690274, 'bb_std_mult': 2.102293690460131, 'rsi_os': 51, 'rsi_ob': 76, 'vol_spike': 0.12644838524955074, 'adx_thresh': 30.850660160005805, 'atr_min_pct': 0.003490873965198576, 'atr_max_pct': 0.09625384041955078, 'tp_mult': 1.1553029131241914, 'tsl_mult': 0.6868629735780326, 'strategy': 'mean_reversion', 'time_stop': 215, 'use_sma': False, 'use_atr': False, 'use_adx': False, 'use_ema': False, 'use_spike': False, 'rsi_required': False, 'edge_k': 1.168784930026628, 'edge_cap': 0.47689849249934935}.
[I 2025-08-29 23:57:12,777] Trial 1265 finished with values: [-1000000000.0, 1000000000.0] and parameters: {'p_sma': 10, 'p_std': 48, 'p_atr': 16, 'p_adx': 15, 'rsi_period': 17, 'ema1': 22, 'ema2': 54, 'slip_atr_k': 0.020351389392904054, 'slip_spread_k': 0.7967253303001902, 'spread_hl_frac': 0.016987575969086025, 'bb_std_mult': 0.8964135343766761, 'rsi_os': 14, 'rsi_ob': 56, 'vol_spike': 0.18167741254435968, 'adx_thresh': 22.753845420777118, 'atr_min_pct': 0.021659077967947138, 'atr_max_pct': 0.09503928020881264, 'tp_mult': 2.1572467737836654, 'tsl_mult': 0.6095522229786501, 'strategy': 'mean_reversion', 'time_stop': 108, 'use_sma': False, 'use_atr': False, 'use_adx': False, 'use_ema': False, 'use_spike': False, 'rsi_required': False, 'edge_k': 0.6218480663692451, 'edge_cap': 0.7927733953823146}.
[I 2025-08-29 23:57:12,921] Trial 1268 finished with values: [-1000000000.0, 1000000000.0] and parameters: {'p_sma': 6, 'p_std': 17, 'p_atr': 16, 'p_adx': 26, 'rsi_period': 57, 'ema1': 23, 'ema2': 50, 'slip_atr_k': 0.22888021174137518, 'slip_spread_k': 0.7869131370395758, 'spread_hl_frac': 0.01692904688684193, 'bb_std_mult': 2.0923708730907005, 'rsi_os': 39, 'rsi_ob': 84, 'vol_spike': 0.1819967682080618, 'adx_thresh': 22.78251996417404, 'atr_min_pct': 0.003327253484128623, 'atr_max_pct': 0.09699873585093374, 'tp_mult': 1.149295281210533, 'tsl_mult': 0.6838920228217162, 'strategy': 'mean_reversion', 'time_stop': 115, 'use_sma': False, 'use_atr': False, 'use_adx': False, 'use_ema': False, 'use_spike': False, 'rsi_required': False, 'edge_k': 1.258665250728173, 'edge_cap': 0.09273999472654415}.
[I 2025-08-29 23:57:13,046] Trial 1266 finished with values: [-1000000000.0, 1000000000.0] and parameters: {'p_sma': 6, 'p_std': 13, 'p_atr': 16, 'p_adx': 15, 'rsi_period': 17, 'ema1': 22, 'ema2': 18, 'slip_atr_k': 0.00019082034733255634, 'slip_spread_k': 0.7979820067188852, 'spread_hl_frac': 0.01714974829702597, 'bb_std_mult': 2.0982711780458825, 'rsi_os': 32, 'rsi_ob': 59, 'vol_spike': 0.017809655490645532, 'adx_thresh': 32.345976455996315, 'atr_min_pct': 0.0035089581494447235, 'atr_max_pct': 0.06652611212660953, 'tp_mult': 1.3947827874526495, 'tsl_mult': 0.6938505576459189, 'strategy': 'mean_reversion', 'time_stop': 109, 'use_sma': False, 'use_atr': False, 'use_adx': False, 'use_ema': False, 'use_spike': False, 'rsi_required': False, 'edge_k': 0.9146785846985211, 'edge_cap': 0.5319183726415501}.
