[I 2025-08-30 00:20:41,719] Trial 1486 finished with values: [-1000000000.0, 1000000000.0] and parameters: {'p_sma': 43, 'p_std': 33, 'p_atr': 24, 'p_adx': 17, 'rsi_period': 22, 'ema1': 24, 'ema2': 16, 'slip_atr_k': 0.005260292359276721, 'slip_spread_k': 0.6068482801037224, 'spread_hl_frac': 0.005517601510291396, 'bb_std_mult': 3.4563899971444103, 'rsi_os': 25, 'rsi_ob': 80, 'vol_spike': 0.2028680465457487, 'adx_thresh': 26.21849435008991, 'atr_min_pct': 0.022275800489845163, 'atr_max_pct': 0.09705959277547128, 'tp_mult': 1.6167273870073202, 'tsl_mult': 0.24836817583701004, 'strategy': 'breakout', 'time_stop': 104, 'use_sma': False, 'use_atr': False, 'use_adx': False, 'use_ema': False, 'use_spike': False, 'rsi_required': False, 'edge_k': 0.965898647157624, 'edge_cap': 0.7648291314684643}.
[I 2025-08-30 00:20:41,855] Trial 1485 finished with values: [-1000000000.0, 1000000000.0] and parameters: {'p_sma': 47, 'p_std': 22, 'p_atr': 30, 'p_adx': 16, 'rsi_period': 53, 'ema1': 30, 'ema2': 55, 'slip_atr_k': 0.005088738650034711, 'slip_spread_k': 0.8170143294050026, 'spread_hl_frac': 0.005264656815309774, 'bb_std_mult': 1.98339718369711, 'rsi_os': 24, 'rsi_ob': 58, 'vol_spike': 0.0006835428052504311, 'adx_thresh': 26.471754831356932, 'atr_min_pct': 0.022095472000818656, 'atr_max_pct': 0.09752041444628835, 'tp_mult': 1.0927362629661392, 'tsl_mult': 0.6932656926272565, 'strategy': 'breakout', 'time_stop': 86, 'use_sma': False, 'use_atr': False, 'use_adx': False, 'use_ema': False, 'use_spike': False, 'rsi_required': False, 'edge_k': 0.49257747529093626, 'edge_cap': 0.7880948464958926}.
[I 2025-08-30 00:20:41,863] Trial 1484 finished with values: [-1000000000.0, 1000000000.0] and parameters: {'p_sma': 7, 'p_std': 44, 'p_atr': 24, 'p_adx': 16, 'rsi_period': 22, 'ema1': 20, 'ema2': 22, 'slip_atr_k': 0.20018871214540487, 'slip_spread_k': 0.8061560780795874, 'spread_hl_frac': 0.005170775473144391, 'bb_std_mult': 1.936031911273853, 'rsi_os': 25, 'rsi_ob': 58, 'vol_spike': 0.18033240765757952, 'adx_thresh': 26.471564484049665, 'atr_min_pct': 0.0023791909641328935, 'atr_max_pct': 0.013330526493497946, 'tp_mult': 1.9655991862133442, 'tsl_mult': 0.06030326042189044, 'strategy': 'breakout', 'time_stop': 40, 'use_sma': False, 'use_atr': False, 'use_adx': False, 'use_ema': False, 'use_spike': False, 'rsi_required': False, 'edge_k': 0.8968999601900837, 'edge_cap': 0.9800851497370209}.
[I 2025-08-30 00:21:07,983] Trial 1488 finished with values: [-1000000000.0, 1000000000.0] and parameters: {'p_sma': 35, 'p_std': 33, 'p_atr': 24, 'p_adx': 26, 'rsi_period': 22, 'ema1': 7, 'ema2': 55, 'slip_atr_k': 0.014174014336132433, 'slip_spread_k': 0.9265853286322365, 'spread_hl_frac': 0.019950484029652493, 'bb_std_mult': 2.735975810051309, 'rsi_os': 11, 'rsi_ob': 61, 'vol_spike': 0.07142362427401153, 'adx_thresh': 25.464714785813023, 'atr_min_pct': 0.0026002119196470927, 'atr_max_pct': 0.09591039118000848, 'tp_mult': 1.0939902890242748, 'tsl_mult': 0.6136964130984313, 'strategy': 'breakout', 'time_stop': 92, 'use_sma': False, 'use_atr': False, 'use_adx': False, 'use_ema': False, 'use_spike': False, 'rsi_required': False, 'edge_k': 0.9544836804036778, 'edge_cap': 0.7919904218662165}.
[I 2025-08-30 00:21:08,171] Trial 1489 finished with values: [-1000000000.0, 1000000000.0] and parameters: {'p_sma': 11, 'p_std': 17, 'p_atr': 22, 'p_adx': 16, 'rsi_period': 21, 'ema1': 23, 'ema2': 47, 'slip_atr_k': 0.2399432937021922, 'slip_spread_k': 0.38801675378996076, 'spread_hl_frac': 0.019220006106615506, 'bb_std_mult': 2.000652707619597, 'rsi_os': 26, 'rsi_ob': 60, 'vol_spike': 0.15380294593796864, 'adx_thresh': 25.11746674701209, 'atr_min_pct': 0.02703384707982795, 'atr_max_pct': 0.10600178325735028, 'tp_mult': 2.812677139310683, 'tsl_mult': 0.6823385998129958, 'strategy': 'breakout', 'time_stop': 88, 'use_sma': False, 'use_atr': False, 'use_adx': False, 'use_ema': False, 'use_spike': False, 'rsi_required': False, 'edge_k': 0.5626301893234938, 'edge_cap': 0.7851324579602649}.
[I 2025-08-30 00:21:08,195] Trial 1490 finished with values: [-0.008283093545766729, 0.008264511772490254] and parameters: {'p_sma': 21, 'p_std': 16, 'p_atr': 29, 'p_adx': 26, 'rsi_period': 71, 'ema1': 24, 'ema2': 56, 'slip_atr_k': 0.028377361067420896, 'slip_spread_k': 0.19719988109934072, 'spread_hl_frac': 0.01945967670879231, 'bb_std_mult': 2.3708260300054524, 'rsi_os': 14, 'rsi_ob': 61, 'vol_spike': 0.15116190270326246, 'adx_thresh': 34.989846702661296, 'atr_min_pct': 0.0011145266008743939, 'atr_max_pct': 0.0950235636750199, 'tp_mult': 1.1337657365424392, 'tsl_mult': 0.7644300834240692, 'strategy': 'mean_reversion', 'time_stop': 199, 'use_sma': False, 'use_atr': False, 'use_adx': False, 'use_ema': False, 'use_spike': False, 'rsi_required': False, 'edge_k': 0.5802251867749474, 'edge_cap': 0.7363679131947548}.
[I 2025-08-30 00:21:08,323] Trial 1491 finished with values: [-1000000000.0, 1000000000.0] and parameters: {'p_sma': 5, 'p_std': 7, 'p_atr': 29, 'p_adx': 26, 'rsi_period': 20, 'ema1': 24, 'ema2': 56, 'slip_atr_k': 0.10722155701921253, 'slip_spread_k': 0.7130339442964052, 'spread_hl_frac': 0.019345234151304184, 'bb_std_mult': 2.064985829177686, 'rsi_os': 27, 'rsi_ob': 60, 'vol_spike': 0.1606457637261264, 'adx_thresh': 24.986850203432585, 'atr_min_pct': 0.02076735781030689, 'atr_max_pct': 0.13573507078886768, 'tp_mult': 1.6626809359283583, 'tsl_mult': 0.7339711463209856, 'strategy': 'mean_reversion', 'time_stop': 92, 'use_sma': False, 'use_atr': False, 'use_adx': False, 'use_ema': False, 'use_spike': False, 'rsi_required': False, 'edge_k': 0.573267208307345, 'edge_cap': 0.8071030890988344}.
[I 2025-08-30 00:21:34,489] Trial 1494 finished with values: [-0.022234723442978832, 0.022206803362264965] and parameters: {'p_sma': 24, 'p_std': 27, 'p_atr': 11, 'p_adx': 23, 'rsi_period': 19, 'ema1': 24, 'ema2': 53, 'slip_atr_k': 0.10922124994956708, 'slip_spread_k': 0.7846262589318276, 'spread_hl_frac': 0.01813111687702246, 'bb_std_mult': 0.7040184932179316, 'rsi_os': 28, 'rsi_ob': 73, 'vol_spike': 0.19378266095491675, 'adx_thresh': 8.587608336661242, 'atr_min_pct': 0.0024917874044987167, 'atr_max_pct': 0.03721998245925942, 'tp_mult': 2.5169108197853363, 'tsl_mult': 0.7364662850376222, 'strategy': 'breakout', 'time_stop': 148, 'use_sma': False, 'use_atr': False, 'use_adx': False, 'use_ema': False, 'use_spike': False, 'rsi_required': False, 'edge_k': 0.4679195148068106, 'edge_cap': 0.8131411986769883}.
[I 2025-08-30 00:21:34,676] Trial 1495 finished with values: [-1000000000.0, 1000000000.0] and parameters: {'p_sma': 9, 'p_std': 29, 'p_atr': 26, 'p_adx': 10, 'rsi_period': 19, 'ema1': 25, 'ema2': 43, 'slip_atr_k': 0.013523205741143744, 'slip_spread_k': 0.7726801002567947, 'spread_hl_frac': 0.018259298264846697, 'bb_std_mult': 3.5942082832785167, 'rsi_os': 28, 'rsi_ob': 62, 'vol_spike': 0.10185454062155808, 'adx_thresh': 30.72831925897532, 'atr_min_pct': 0.003371473366220828, 'atr_max_pct': 0.08976907852020759, 'tp_mult': 2.321667017751679, 'tsl_mult': 0.7187802510373695, 'strategy': 'breakout', 'time_stop': 251, 'use_sma': False, 'use_atr': False, 'use_adx': False, 'use_ema': False, 'use_spike': False, 'rsi_required': False, 'edge_k': 0.40871878486407837, 'edge_cap': 0.17200581539343646}.
[I 2025-08-30 00:21:34,676] Trial 1492 finished with values: [-1000000000.0, 1000000000.0] and parameters: {'p_sma': 10, 'p_std': 17, 'p_atr': 21, 'p_adx': 10, 'rsi_period': 20, 'ema1': 24, 'ema2': 52, 'slip_atr_k': 0.027109227300836675, 'slip_spread_k': 0.19123324802390518, 'spread_hl_frac': 0.01837366097310268, 'bb_std_mult': 0.7377154290414751, 'rsi_os': 14, 'rsi_ob': 92, 'vol_spike': 0.10437686101861532, 'adx_thresh': 24.87956423004421, 'atr_min_pct': 0.020906106402735623, 'atr_max_pct': 0.09186391378047574, 'tp_mult': 2.434435187380479, 'tsl_mult': 0.7360035842363212, 'strategy': 'mean_reversion', 'time_stop': 197, 'use_sma': False, 'use_atr': False, 'use_adx': False, 'use_ema': False, 'use_spike': False, 'rsi_required': False, 'edge_k': 0.5782971850364182, 'edge_cap': 0.804853129545054}.
[I 2025-08-30 00:21:34,761] Trial 1493 finished with values: [-1000000000.0, 1000000000.0] and parameters: {'p_sma': 9, 'p_std': 52, 'p_atr': 26, 'p_adx': 16, 'rsi_period': 24, 'ema1': 24, 'ema2': 43, 'slip_atr_k': 0.17214835090163347, 'slip_spread_k': 0.7677765791367535, 'spread_hl_frac': 0.03119784302995792, 'bb_std_mult': 2.065296643041311, 'rsi_os': 28, 'rsi_ob': 60, 'vol_spike': 0.06067425901950567, 'adx_thresh': 24.66641389573553, 'atr_min_pct': 0.002539938235786971, 'atr_max_pct': 0.09191677887581501, 'tp_mult': 2.3275388035987254, 'tsl_mult': 0.4758067809215495, 'strategy': 'breakout', 'time_stop': 108, 'use_sma': False, 'use_atr': False, 'use_adx': False, 'use_ema': False, 'use_spike': False, 'rsi_required': False, 'edge_k': 0.47094665813240644, 'edge_cap': 0.31020375286343227}.
[I 2025-08-30 00:22:01,071] Trial 1499 finished with values: [-0.004240143613387981, 0.004244730384371267] and parameters: {'p_sma': 6, 'p_std': 58, 'p_atr': 22, 'p_adx': 12, 'rsi_period': 81, 'ema1': 23, 'ema2': 33, 'slip_atr_k': 0.2334725070073496, 'slip_spread_k': 0.8247259855567142, 'spread_hl_frac': 0.046091152639110206, 'bb_std_mult': 0.5019531430882178, 'rsi_os': 37, 'rsi_ob': 63, 'vol_spike': 0.1715161400369143, 'adx_thresh': 23.770938719761723, 'atr_min_pct': 0.001395211522262779, 'atr_max_pct': 0.12876406323477393, 'tp_mult': 1.1705086780248948, 'tsl_mult': 0.1818763782398659, 'strategy': 'breakout', 'time_stop': 100, 'use_sma': False, 'use_atr': False, 'use_adx': False, 'use_ema': False, 'use_spike': False, 'rsi_required': False, 'edge_k': 0.4643104765845901, 'edge_cap': 0.27401584284852243}.
[I 2025-08-30 00:22:01,225] Trial 1498 finished with values: [-1000000000.0, 1000000000.0] and parameters: {'p_sma': 6, 'p_std': 19, 'p_atr': 22, 'p_adx': 16, 'rsi_period': 24, 'ema1': 11, 'ema2': 54, 'slip_atr_k': 0.16879568484033136, 'slip_spread_k': 0.7380831549956526, 'spread_hl_frac': 0.047104029082907686, 'bb_std_mult': 2.123809186974027, 'rsi_os': 26, 'rsi_ob': 63, 'vol_spike': 0.171562321921567, 'adx_thresh': 25.670076665406373, 'atr_min_pct': 0.009455976425036781, 'atr_max_pct': 0.10020750022775314, 'tp_mult': 1.011533804888184, 'tsl_mult': 0.7114480324743021, 'strategy': 'breakout', 'time_stop': 111, 'use_sma': False, 'use_atr': False, 'use_adx': False, 'use_ema': False, 'use_spike': False, 'rsi_required': False, 'edge_k': 0.4777079550425198, 'edge_cap': 0.1225022917159348}.
[I 2025-08-30 00:22:01,252] Trial 1497 finished with values: [-1000000000.0, 1000000000.0] and parameters: {'p_sma': 39, 'p_std': 19, 'p_atr': 22, 'p_adx': 16, 'rsi_period': 24, 'ema1': 26, 'ema2': 54, 'slip_atr_k': 0.05220929126776366, 'slip_spread_k': 0.7468806090496732, 'spread_hl_frac': 0.03108873442952709, 'bb_std_mult': 2.1326132910823317, 'rsi_os': 37, 'rsi_ob': 75, 'vol_spike': 0.17005706546743887, 'adx_thresh': 17.732543018550754, 'atr_min_pct': 0.018176986706645755, 'atr_max_pct': 0.11746493089290871, 'tp_mult': 1.01171754084093, 'tsl_mult': 0.5825614337737488, 'strategy': 'breakout', 'time_stop': 61, 'use_sma': False, 'use_atr': False, 'use_adx': False, 'use_ema': False, 'use_spike': False, 'rsi_required': False, 'edge_k': 0.47048945308347345, 'edge_cap': 0.37836705210259725}.
[I 2025-08-30 00:22:01,440] Trial 1496 finished with values: [-0.01137406880442382, 0.011354558628539273] and parameters: {'p_sma': 9, 'p_std': 30, 'p_atr': 15, 'p_adx': 16, 'rsi_period': 16, 'ema1': 25, 'ema2': 54, 'slip_atr_k': 0.01286265067986752, 'slip_spread_k': 0.7607946942975878, 'spread_hl_frac': 0.01810784117562727, 'bb_std_mult': 2.120727932041937, 'rsi_os': 26, 'rsi_ob': 69, 'vol_spike': 0.16890866356062456, 'adx_thresh': 23.546049540010976, 'atr_min_pct': 0.001513384701163514, 'atr_max_pct': 0.09086284432773145, 'tp_mult': 1.1833449150735218, 'tsl_mult': 0.7142924246977795, 'strategy': 'breakout', 'time_stop': 253, 'use_sma': False, 'use_atr': False, 'use_adx': False, 'use_ema': False, 'use_spike': False, 'rsi_required': False, 'edge_k': 0.4019058276673171, 'edge_cap': 0.5402770802021405}.
Starting optimization (1500 trials, n_jobs=4) | multi-objective=True
Saved trials CSV -> runs/FUT_SHORT_fee1e-3_slip6e-4_UShours_blend/trials_metrics.csv
Saved Pareto plot -> runs/FUT_SHORT_fee1e-3_slip6e-4_UShours_blend/pareto_return_vs_drawdown.png
Top-K under DD cap: [831, 1012, 1438] (agg='median')
=== Selected trial(s) ===
top_k=3 selected_trial_numbers=[831, 1012, 1438] primary=831
ret%_train=-0.02% dd%_train=-0.07% trades=63
ret%_test=0.12% dd%_test=-0.04% pnl_test=24.98 trades_test=33
Dumped TEST trades -> runs/FUT_SHORT_fee1e-3_slip6e-4_UShours_blend/test_trades.csv
WFO fold 1: OOS PnL=0.00 trades=0 win_rate=0.00% avg=0.000000 ret%=0.00% maxDD=0.000000 maxDD%=0.00%
WFO fold 2: OOS PnL=29.43 trades=19 win_rate=63.16% avg=1.549148 ret%=0.15% maxDD=-2.008001 maxDD%=-0.01%
WFO fold 3: OOS PnL=-2.86 trades=6 win_rate=16.67% avg=-0.476327 ret%=-0.01% maxDD=-2.772122 maxDD%=-0.01%
WFO fold 4: OOS PnL=5.44 trades=2 win_rate=100.00% avg=2.718547 ret%=0.03% maxDD=0.000000 maxDD%=0.00%
WFO fold 5: OOS PnL=-5.80 trades=5 win_rate=20.00% avg=-1.160611 ret%=-0.03% maxDD=-4.198471 maxDD%=-0.02%
WFO fold 6: OOS PnL=-1.22 trades=1 win_rate=0.00% avg=-1.218405 ret%=-0.01% maxDD=0.000000 maxDD%=0.00%
WFO summary: meanPnL=4.17 stdPnL=11.80 meanWR=33.30% meanAvg=0.235392 meanRet%=0.02% worstDD=-4.198471 worstDD%=-0.02% folds=6 trades=33
Wrote runs/FUT_SHORT_fee1e-3_slip6e-4_UShours_blend/strategy_profile.json
=== ECHO SELECTED PARAMS (JSON) ===
{
  "adx_thresh": 28.637428564769383,
  "aggregate_params": "median",
  "atr_max_pct": 0.07521270203532948,
  "atr_min_pct": 0.0047203864065070295,
  "bar_priority": "stop_first",
  "bb_std_mult": 1.3665609984295406,
  "cooldown_bars": 10,
  "daily_loss_limit_pct": 0.03,
  "edge_cap": 0.21878705541583848,
  "edge_k": 1.5131493349859362,
  "ema1": 22,
  "ema2": 53,
  "embargo_bars": 120,
  "fee": 0.001,
  "fill_timing": "next_open",
  "include_hours_set": "{3, 8, 10, 14, 16, 18, 20, 22}",
  "lockout_bars": 30,
  "max_consec_losses": 3,
  "max_notional_pct_equity": 1.0,
  "min_notional": 5.0,
  "ml_thresh": 0.0,
  "objective": "multi",
  "p_adx": 15,
  "p_atr": 22,
  "p_sma": 8,
  "p_std": 27,
  "participation_cap": 1.0,
  "price_step": 0.0001,
  "proba_temp": 1.0,
  "qty_step": 0.0001,
  "regime_adapt": true,
  "regime_band": 0.006,
  "regime_fast": 50,
  "regime_overrides": {
    "bear": {
      "adx": 20.0,
      "allowed_sides": [
        "long",
        "short"
      ],
      "atr_range": [
        0.0015,
        0.06
      ],
      "bb_std_mult": 1.2571599337995167,
      "mode": "breakout",
      "rsi_required": true,
      "time_stop_bars": 122,
      "tp_mult": 1.7149673432024581,
      "tsl_mult": 0.25,
      "use_adx": true,
      "use_atr": true
    },
    "bull": {
      "adx": 18.0,
      "allowed_sides": [
        "long",
        "short"
      ],
      "atr_range": [
        0.0008,
        0.06
      ],
      "bb_std_mult": 2.0169431746748376,
      "mode": "mean_reversion",
      "rsi_required": false,
      "time_stop_bars": 214,
      "tp_mult": 1.9194251920826044,
      "tsl_mult": 0.6891458682949287,
      "use_adx": true,
      "use_atr": true
    },
    "sideways": {
      "adx": 15.0,
      "allowed_sides": [
        "long",
        "short"
      ],
      "atr_range": [
        0.001,
        0.14
      ],
      "bb_std_mult": 1.5828092896467827,
      "mode": "breakout",
      "rsi_required": true,
      "time_stop_bars": 235,
      "tp_mult": 2.341879695778944,
      "tsl_mult": 0.651967765830165,
      "use_adx": true,
      "use_atr": true
    }
  },
  "regime_slow": 200,
  "risk_min_stop_frac": 0.001,
  "risk_per_trade": 0.004,
  "risk_stop_atr_mult": 1.0,
  "round_exits": true,
  "rsi_key": "rsi22",
  "rsi_ob": 60,
  "rsi_os": 35,
  "rsi_period": 22,
  "rsi_required": false,
  "select_top_k": 3,
  "session_end": 24,
  "session_start": 0,
  "sides": "short",
  "slip_atr_k": 0.02760295139014655,
  "slip_spread_k": 0.6215034039803924,
  "slippage": 0.0006,
  "spread_hl_frac": 0.0208170480219934,
  "start_equity": 20000.0,
  "stop_extra_slip": 0.0,
  "strategy": "breakout",
  "time_stop": 130,
  "tp_mult": 1.1657777876915871,
  "tsl_mult": 0.6610819180265515,
  "use_adx": false,
  "use_atr": false,
  "use_ema": false,
  "use_ml": false,
  "use_sma": false,
  "use_spike": false,
  "vol_spike": 0.18385867373133602,
  "wfo_folds": 6
}
Wrote runs/FUT_SHORT_fee1e-3_slip6e-4_UShours_blend/best_params.pkl
