[I 2025-08-29 22:02:36,030] Trial 217 finished with values: [-1000000000.0, 1000000000.0] and parameters: {'p_sma': 8, 'p_std': 28, 'p_atr': 19, 'p_adx': 12, 'rsi_period': 42, 'ema1': 19, 'ema2': 54, 'slip_atr_k': 0.1451874024701988, 'slip_spread_k': 0.30399453697655454, 'spread_hl_frac': 0.0490208594307931, 'bb_std_mult': 2.280953728591974, 'rsi_os': 41, 'rsi_ob': 59, 'vol_spike': 0.17572711184054707, 'adx_thresh': 25.870430924526843, 'atr_min_pct': 0.021063779410094602, 'atr_max_pct': 0.09651101282875353, 'tp_mult': 1.7762619934284656, 'tsl_mult': 0.8811884324963268, 'strategy': 'breakout', 'time_stop': 22, 'use_sma': False, 'use_atr': False, 'use_adx': False, 'use_ema': False, 'use_spike': False, 'rsi_required': False, 'edge_k': 1.944193585816394, 'edge_cap': 0.28293346673668296}.
[I 2025-08-29 22:02:36,131] Trial 218 finished with values: [-1000000000.0, 1000000000.0] and parameters: {'p_sma': 44, 'p_std': 24, 'p_atr': 22, 'p_adx': 12, 'rsi_period': 58, 'ema1': 24, 'ema2': 54, 'slip_atr_k': 0.011660831234788446, 'slip_spread_k': 0.8294922662571218, 'spread_hl_frac': 0.018677344413407033, 'bb_std_mult': 2.246805233450765, 'rsi_os': 29, 'rsi_ob': 89, 'vol_spike': 0.17560543533145023, 'adx_thresh': 25.94092239923877, 'atr_min_pct': 0.017477671952593487, 'atr_max_pct': 0.09078294399865215, 'tp_mult': 1.1001188812139797, 'tsl_mult': 0.7117398627844657, 'strategy': 'breakout', 'time_stop': 56, 'use_sma': False, 'use_atr': False, 'use_adx': False, 'use_ema': False, 'use_spike': False, 'rsi_required': False, 'edge_k': 0.5654976299101322, 'edge_cap': 0.12558989016884897}.
[I 2025-08-29 22:02:36,310] Trial 216 finished with values: [-0.007742357695589841, 0.007830061146462132] and parameters: {'p_sma': 44, 'p_std': 47, 'p_atr': 21, 'p_adx': 12, 'rsi_period': 16, 'ema1': 29, 'ema2': 54, 'slip_atr_k': 0.16298959715487848, 'slip_spread_k': 0.8385019222365566, 'spread_hl_frac': 0.01819625184438817, 'bb_std_mult': 2.2973725557256484, 'rsi_os': 18, 'rsi_ob': 57, 'vol_spike': 0.2908857946142097, 'adx_thresh': 25.674439912047145, 'atr_min_pct': 0.0030882498674515138, 'atr_max_pct': 0.09738955277894747, 'tp_mult': 1.0927327455688143, 'tsl_mult': 0.5074909725457233, 'strategy': 'breakout', 'time_stop': 99, 'use_sma': False, 'use_atr': False, 'use_adx': False, 'use_ema': False, 'use_spike': False, 'rsi_required': False, 'edge_k': 0.5216689453344134, 'edge_cap': 0.12612567683868986}.
[I 2025-08-29 22:03:02,753] Trial 222 finished with values: [-0.014380375748999308, 0.014356728589923018] and parameters: {'p_sma': 34, 'p_std': 25, 'p_atr': 20, 'p_adx': 23, 'rsi_period': 20, 'ema1': 8, 'ema2': 51, 'slip_atr_k': 0.01119050500062329, 'slip_spread_k': 0.7927529372381913, 'spread_hl_frac': 0.015912617809637833, 'bb_std_mult': 1.678880471911039, 'rsi_os': 27, 'rsi_ob': 77, 'vol_spike': 0.10287692801462735, 'adx_thresh': 23.798427383222766, 'atr_min_pct': 0.002034642085880967, 'atr_max_pct': 0.09115404815120184, 'tp_mult': 1.0480728635922834, 'tsl_mult': 0.9166451747041062, 'strategy': 'breakout', 'time_stop': 125, 'use_sma': False, 'use_atr': False, 'use_adx': False, 'use_ema': False, 'use_spike': False, 'rsi_required': False, 'edge_k': 0.4093567286499884, 'edge_cap': 0.40398822045329785}.
[I 2025-08-29 22:03:03,081] Trial 220 finished with values: [-0.024248122036541142, 0.024237381753629775] and parameters: {'p_sma': 35, 'p_std': 24, 'p_atr': 20, 'p_adx': 18, 'rsi_period': 31, 'ema1': 10, 'ema2': 51, 'slip_atr_k': 0.010457130166968693, 'slip_spread_k': 0.8488213991260138, 'spread_hl_frac': 0.02746644321951188, 'bb_std_mult': 2.2459262561251276, 'rsi_os': 48, 'rsi_ob': 91, 'vol_spike': 0.2728816199763927, 'adx_thresh': 21.99604871374925, 'atr_min_pct': 0.002990404608135827, 'atr_max_pct': 0.09141451718535107, 'tp_mult': 1.0568147367048493, 'tsl_mult': 0.7063177018082846, 'strategy': 'breakout', 'time_stop': 99, 'use_sma': False, 'use_atr': False, 'use_adx': False, 'use_ema': False, 'use_spike': False, 'rsi_required': False, 'edge_k': 0.5348004865355169, 'edge_cap': 0.8045548962114824}.
[I 2025-08-29 22:03:03,093] Trial 219 finished with values: [-1000000000.0, 1000000000.0] and parameters: {'p_sma': 44, 'p_std': 23, 'p_atr': 20, 'p_adx': 12, 'rsi_period': 31, 'ema1': 24, 'ema2': 54, 'slip_atr_k': 0.011221365932646457, 'slip_spread_k': 0.826231718510392, 'spread_hl_frac': 0.01874409882065569, 'bb_std_mult': 3.194979045378207, 'rsi_os': 48, 'rsi_ob': 77, 'vol_spike': 0.17591262343510086, 'adx_thresh': 22.027025987069813, 'atr_min_pct': 0.017709906649336145, 'atr_max_pct': 0.09678633878052058, 'tp_mult': 1.1017136436890624, 'tsl_mult': 0.7064339863637877, 'strategy': 'breakout', 'time_stop': 125, 'use_sma': False, 'use_atr': False, 'use_adx': False, 'use_ema': False, 'use_spike': False, 'rsi_required': False, 'edge_k': 1.8190932599796121, 'edge_cap': 0.12954128894680134}.
[I 2025-08-29 22:03:03,175] Trial 221 finished with values: [-1000000000.0, 1000000000.0] and parameters: {'p_sma': 5, 'p_std': 54, 'p_atr': 21, 'p_adx': 23, 'rsi_period': 52, 'ema1': 29, 'ema2': 51, 'slip_atr_k': 0.0379689547030443, 'slip_spread_k': 0.8424924271302304, 'spread_hl_frac': 0.015680062012024286, 'bb_std_mult': 1.6864864809191955, 'rsi_os': 48, 'rsi_ob': 77, 'vol_spike': 0.03205464059220001, 'adx_thresh': 22.224417183061778, 'atr_min_pct': 0.02314935938354564, 'atr_max_pct': 0.10009914103869913, 'tp_mult': 1.24369843614272, 'tsl_mult': 0.26889720344066664, 'strategy': 'breakout', 'time_stop': 125, 'use_sma': False, 'use_atr': False, 'use_adx': False, 'use_ema': False, 'use_spike': False, 'rsi_required': False, 'edge_k': 0.5059602460398218, 'edge_cap': 0.08619998719942745}.
[I 2025-08-29 22:03:29,844] Trial 224 finished with values: [-1000000000.0, 1000000000.0] and parameters: {'p_sma': 54, 'p_std': 26, 'p_atr': 12, 'p_adx': 9, 'rsi_period': 53, 'ema1': 24, 'ema2': 53, 'slip_atr_k': 0.1164513125603455, 'slip_spread_k': 0.3682785970687824, 'spread_hl_frac': 0.031899647346628666, 'bb_std_mult': 2.207359779281161, 'rsi_os': 26, 'rsi_ob': 80, 'vol_spike': 0.029696702624649365, 'adx_thresh': 24.87796351489523, 'atr_min_pct': 0.007477091631590218, 'atr_max_pct': 0.10032161133907026, 'tp_mult': 1.689748556655484, 'tsl_mult': 0.4578930409270566, 'strategy': 'mean_reversion', 'time_stop': 27, 'use_sma': False, 'use_atr': False, 'use_adx': False, 'use_ema': False, 'use_spike': False, 'rsi_required': False, 'edge_k': 1.217872203031201, 'edge_cap': 0.4280749535665638}.
[I 2025-08-29 22:03:30,385] Trial 223 finished with values: [-0.007108435861245432, 0.007101488894563764] and parameters: {'p_sma': 8, 'p_std': 30, 'p_atr': 26, 'p_adx': 21, 'rsi_period': 19, 'ema1': 30, 'ema2': 53, 'slip_atr_k': 0.08948191537784121, 'slip_spread_k': 0.8195730479993986, 'spread_hl_frac': 0.03217890339850768, 'bb_std_mult': 2.537855790019489, 'rsi_os': 37, 'rsi_ob': 60, 'vol_spike': 0.06967341833560255, 'adx_thresh': 22.024206303779245, 'atr_min_pct': 0.002574448977298269, 'atr_max_pct': 0.09897791428617443, 'tp_mult': 2.468304431296999, 'tsl_mult': 0.277736081175832, 'strategy': 'breakout', 'time_stop': 109, 'use_sma': False, 'use_atr': False, 'use_adx': False, 'use_ema': False, 'use_spike': False, 'rsi_required': False, 'edge_k': 1.1647679583236643, 'edge_cap': 0.7993300644047108}.
[I 2025-08-29 22:03:30,520] Trial 225 finished with values: [-1000000000.0, 1000000000.0] and parameters: {'p_sma': 8, 'p_std': 15, 'p_atr': 27, 'p_adx': 9, 'rsi_period': 39, 'ema1': 24, 'ema2': 53, 'slip_atr_k': 0.022167207768062035, 'slip_spread_k': 0.797143537433634, 'spread_hl_frac': 0.019863739425258296, 'bb_std_mult': 2.100169002264137, 'rsi_os': 26, 'rsi_ob': 60, 'vol_spike': 0.1388471868224021, 'adx_thresh': 14.198177817145428, 'atr_min_pct': 0.01476308829945632, 'atr_max_pct': 0.09415347797188753, 'tp_mult': 2.498116189880088, 'tsl_mult': 0.979574288451188, 'strategy': 'mean_reversion', 'time_stop': 108, 'use_sma': False, 'use_atr': False, 'use_adx': False, 'use_ema': False, 'use_spike': False, 'rsi_required': False, 'edge_k': 0.585116353299487, 'edge_cap': 0.5311131008140199}.
[I 2025-08-29 22:03:30,585] Trial 226 finished with values: [-0.060635020832354725, 0.06061465587825247] and parameters: {'p_sma': 23, 'p_std': 15, 'p_atr': 27, 'p_adx': 9, 'rsi_period': 19, 'ema1': 24, 'ema2': 53, 'slip_atr_k': 0.023087437345427248, 'slip_spread_k': 0.7934395418474366, 'spread_hl_frac': 0.016601869777324633, 'bb_std_mult': 1.553677977755635, 'rsi_os': 26, 'rsi_ob': 60, 'vol_spike': 0.19138785002429068, 'adx_thresh': 24.721518186978493, 'atr_min_pct': 0.0016899013477844973, 'atr_max_pct': 0.09872824592376551, 'tp_mult': 1.139740765239772, 'tsl_mult': 0.982880177337038, 'strategy': 'mean_reversion', 'time_stop': 109, 'use_sma': False, 'use_atr': False, 'use_adx': False, 'use_ema': False, 'use_spike': False, 'rsi_required': False, 'edge_k': 0.25668145757574534, 'edge_cap': 0.7486877209159201}.
[I 2025-08-29 22:03:57,000] Trial 230 finished with values: [-1000000000.0, 1000000000.0] and parameters: {'p_sma': 25, 'p_std': 44, 'p_atr': 14, 'p_adx': 17, 'rsi_period': 21, 'ema1': 20, 'ema2': 55, 'slip_atr_k': 0.20247201097278464, 'slip_spread_k': 0.8149328660878481, 'spread_hl_frac': 0.018079764734391882, 'bb_std_mult': 1.8265244091525958, 'rsi_os': 6, 'rsi_ob': 62, 'vol_spike': 0.019707040072754145, 'adx_thresh': 7.270805373361178, 'atr_min_pct': 0.010515551311729692, 'atr_max_pct': 0.0917771224106203, 'tp_mult': 2.1665250997357983, 'tsl_mult': 0.5497060879192781, 'strategy': 'breakout', 'time_stop': 117, 'use_sma': False, 'use_atr': False, 'use_adx': False, 'use_ema': False, 'use_spike': False, 'rsi_required': False, 'edge_k': 0.4806130912768547, 'edge_cap': 0.261353106173656}.
[I 2025-08-29 22:03:57,670] Trial 229 finished with values: [-1000000000.0, 1000000000.0] and parameters: {'p_sma': 23, 'p_std': 27, 'p_atr': 8, 'p_adx': 17, 'rsi_period': 19, 'ema1': 12, 'ema2': 55, 'slip_atr_k': 0.017607506683493007, 'slip_spread_k': 0.8210464655143398, 'spread_hl_frac': 0.016854581269899013, 'bb_std_mult': 1.8317582988926864, 'rsi_os': 6, 'rsi_ob': 49, 'vol_spike': 0.19171649365641943, 'adx_thresh': 24.62649664951319, 'atr_min_pct': 0.010595585045641863, 'atr_max_pct': 0.09227319886926862, 'tp_mult': 2.763371899606463, 'tsl_mult': 0.5905677637891864, 'strategy': 'breakout', 'time_stop': 157, 'use_sma': False, 'use_atr': False, 'use_adx': False, 'use_ema': False, 'use_spike': False, 'rsi_required': False, 'edge_k': 0.4780184610326416, 'edge_cap': 0.2556293954454049}.
[I 2025-08-29 22:03:57,670] Trial 227 finished with values: [-0.03568934243666666, 0.03567268703605893] and parameters: {'p_sma': 23, 'p_std': 55, 'p_atr': 27, 'p_adx': 21, 'rsi_period': 19, 'ema1': 22, 'ema2': 55, 'slip_atr_k': 0.2044535257081528, 'slip_spread_k': 0.10708608273208109, 'spread_hl_frac': 0.016794092493998873, 'bb_std_mult': 2.5305997420239246, 'rsi_os': 37, 'rsi_ob': 60, 'vol_spike': 0.021432346258552754, 'adx_thresh': 24.620560698470143, 'atr_min_pct': 0.0015968971467756722, 'atr_max_pct': 0.09495072178271502, 'tp_mult': 2.514505435659583, 'tsl_mult': 0.05538124253738813, 'strategy': 'breakout', 'time_stop': 110, 'use_sma': False, 'use_atr': False, 'use_adx': False, 'use_ema': False, 'use_spike': False, 'rsi_required': False, 'edge_k': 0.5917048855766638, 'edge_cap': 0.5378340881288189}.
[I 2025-08-29 22:03:57,799] Trial 228 finished with values: [-1000000000.0, 1000000000.0] and parameters: {'p_sma': 8, 'p_std': 44, 'p_atr': 8, 'p_adx': 15, 'rsi_period': 39, 'ema1': 11, 'ema2': 55, 'slip_atr_k': 0.03187416396566516, 'slip_spread_k': 0.7942169965362048, 'spread_hl_frac': 0.047219520594267206, 'bb_std_mult': 1.8668876740579923, 'rsi_os': 24, 'rsi_ob': 59, 'vol_spike': 0.1904591540104791, 'adx_thresh': 18.526115643925618, 'atr_min_pct': 0.014191713286723204, 'atr_max_pct': 0.09306377393869895, 'tp_mult': 2.185138855324844, 'tsl_mult': 0.5858890280040812, 'strategy': 'mean_reversion', 'time_stop': 157, 'use_sma': False, 'use_atr': False, 'use_adx': False, 'use_ema': False, 'use_spike': False, 'rsi_required': False, 'edge_k': 0.5802044123604384, 'edge_cap': 0.6167748362229892}.
[I 2025-08-29 22:04:24,311] Trial 233 finished with values: [-1000000000.0, 1000000000.0] and parameters: {'p_sma': 6, 'p_std': 40, 'p_atr': 15, 'p_adx': 24, 'rsi_period': 66, 'ema1': 25, 'ema2': 36, 'slip_atr_k': 0.10549349339832094, 'slip_spread_k': 0.2681295586647262, 'spread_hl_frac': 0.037231435542280776, 'bb_std_mult': 1.954042908521801, 'rsi_os': 24, 'rsi_ob': 59, 'vol_spike': 0.2489809459089975, 'adx_thresh': 18.129512900813378, 'atr_min_pct': 0.02742058483394898, 'atr_max_pct': 0.09642418876020817, 'tp_mult': 1.1512838767191693, 'tsl_mult': 0.6613206749369392, 'strategy': 'breakout', 'time_stop': 35, 'use_sma': False, 'use_atr': False, 'use_adx': False, 'use_ema': False, 'use_spike': False, 'rsi_required': False, 'edge_k': 0.5490003320073906, 'edge_cap': 0.8159973037643548}.
[I 2025-08-29 22:04:24,608] Trial 231 finished with values: [-0.01513929819197235, 0.015113560234239728] and parameters: {'p_sma': 6, 'p_std': 25, 'p_atr': 8, 'p_adx': 11, 'rsi_period': 15, 'ema1': 15, 'ema2': 55, 'slip_atr_k': 0.221798174896457, 'slip_spread_k': 0.10191928272344469, 'spread_hl_frac': 0.0475684085577611, 'bb_std_mult': 1.9799307913802262, 'rsi_os': 24, 'rsi_ob': 59, 'vol_spike': 0.24975126778115483, 'adx_thresh': 27.71233959444215, 'atr_min_pct': 0.0015287758209061246, 'atr_max_pct': 0.09490354402397026, 'tp_mult': 1.1505916817683255, 'tsl_mult': 0.5912851097008396, 'strategy': 'breakout', 'time_stop': 178, 'use_sma': False, 'use_atr': False, 'use_adx': False, 'use_ema': False, 'use_spike': False, 'rsi_required': False, 'edge_k': 0.5573723453710173, 'edge_cap': 0.9721563510778821}.
[I 2025-08-29 22:04:24,734] Trial 232 finished with values: [-0.002813580984031616, 0.0032972499316250314] and parameters: {'p_sma': 6, 'p_std': 40, 'p_atr': 15, 'p_adx': 15, 'rsi_period': 17, 'ema1': 25, 'ema2': 57, 'slip_atr_k': 0.030537416105706816, 'slip_spread_k': 0.5649812794677178, 'spread_hl_frac': 0.047182322328225446, 'bb_std_mult': 2.014139450714357, 'rsi_os': 24, 'rsi_ob': 59, 'vol_spike': 0.1844405667426449, 'adx_thresh': 18.284497306315842, 'atr_min_pct': 0.0024641106374918564, 'atr_max_pct': 0.09677264231187548, 'tp_mult': 1.1370348791569975, 'tsl_mult': 0.8820974975227931, 'strategy': 'breakout', 'time_stop': 102, 'use_sma': False, 'use_atr': False, 'use_adx': False, 'use_ema': False, 'use_spike': False, 'rsi_required': False, 'edge_k': 0.5542265103847176, 'edge_cap': 0.1621086292466295}.
[I 2025-08-29 22:04:24,891] Trial 234 finished with values: [-0.01001248809331734, 0.009995869306604125] and parameters: {'p_sma': 17, 'p_std': 25, 'p_atr': 22, 'p_adx': 24, 'rsi_period': 24, 'ema1': 25, 'ema2': 35, 'slip_atr_k': 0.01586776678982137, 'slip_spread_k': 0.6740663578420395, 'spread_hl_frac': 0.017539433743200744, 'bb_std_mult': 2.00560670911077, 'rsi_os': 33, 'rsi_ob': 62, 'vol_spike': 0.171563711675926, 'adx_thresh': 26.683912035803452, 'atr_min_pct': 0.0023581575981156473, 'atr_max_pct': 0.13607076787521297, 'tp_mult': 1.1669968721156594, 'tsl_mult': 0.7304785694036461, 'strategy': 'breakout', 'time_stop': 103, 'use_sma': False, 'use_atr': False, 'use_adx': False, 'use_ema': False, 'use_spike': False, 'rsi_required': False, 'edge_k': 1.2836725002449132, 'edge_cap': 0.31538745364716436}.
[I 2025-08-29 22:04:51,726] Trial 236 finished with values: [-0.002344683903058864, 0.0026928855543715954] and parameters: {'p_sma': 7, 'p_std': 52, 'p_atr': 17, 'p_adx': 18, 'rsi_period': 21, 'ema1': 25, 'ema2': 52, 'slip_atr_k': 0.015113839961310042, 'slip_spread_k': 0.8503038174711611, 'spread_hl_frac': 0.0192429812719841, 'bb_std_mult': 2.353897299925237, 'rsi_os': 33, 'rsi_ob': 70, 'vol_spike': 0.16972158164717013, 'adx_thresh': 26.51067827190131, 'atr_min_pct': 0.002488630904345002, 'atr_max_pct': 0.13502190215511087, 'tp_mult': 1.1146190281828032, 'tsl_mult': 0.7295789413891398, 'strategy': 'breakout', 'time_stop': 103, 'use_sma': False, 'use_atr': False, 'use_adx': False, 'use_ema': False, 'use_spike': False, 'rsi_required': False, 'edge_k': 0.8976192805646162, 'edge_cap': 0.15833774379819904}.
[I 2025-08-29 22:04:52,508] Trial 238 finished with values: [-1000000000.0, 1000000000.0] and parameters: {'p_sma': 46, 'p_std': 53, 'p_atr': 23, 'p_adx': 16, 'rsi_period': 21, 'ema1': 21, 'ema2': 32, 'slip_atr_k': 0.020014895474246494, 'slip_spread_k': 0.8566828978179354, 'spread_hl_frac': 0.019679427686327383, 'bb_std_mult': 2.0569485958167486, 'rsi_os': 51, 'rsi_ob': 70, 'vol_spike': 0.1657476016742952, 'adx_thresh': 26.249831723963506, 'atr_min_pct': 0.015810144273202882, 'atr_max_pct': 0.08884493827073808, 'tp_mult': 1.1950713734024254, 'tsl_mult': 0.8664921994568351, 'strategy': 'breakout', 'time_stop': 188, 'use_sma': False, 'use_atr': False, 'use_adx': False, 'use_ema': False, 'use_spike': False, 'rsi_required': False, 'edge_k': 0.44487144530755185, 'edge_cap': 0.4995434475713413}.
[I 2025-08-29 22:04:52,508] Trial 235 finished with values: [-0.011641256854375226, 0.011627296603363072] and parameters: {'p_sma': 6, 'p_std': 7, 'p_atr': 17, 'p_adx': 11, 'rsi_period': 21, 'ema1': 25, 'ema2': 32, 'slip_atr_k': 0.013963984652190675, 'slip_spread_k': 0.4201554147058424, 'spread_hl_frac': 0.019037183811656568, 'bb_std_mult': 2.452210568844933, 'rsi_os': 33, 'rsi_ob': 62, 'vol_spike': 0.16921910993491773, 'adx_thresh': 26.46859646939746, 'atr_min_pct': 0.0025505827714381764, 'atr_max_pct': 0.13686541864779034, 'tp_mult': 1.138486412795158, 'tsl_mult': 0.7278826407493352, 'strategy': 'breakout', 'time_stop': 191, 'use_sma': False, 'use_atr': False, 'use_adx': False, 'use_ema': False, 'use_spike': False, 'rsi_required': False, 'edge_k': 0.42462641041389865, 'edge_cap': 0.452714912419659}.
[I 2025-08-29 22:04:52,594] Trial 237 finished with values: [-0.02654686396197703, 0.02661493783194148] and parameters: {'p_sma': 17, 'p_std': 38, 'p_atr': 9, 'p_adx': 14, 'rsi_period': 17, 'ema1': 21, 'ema2': 57, 'slip_atr_k': 0.0158204362225173, 'slip_spread_k': 0.5593695334327987, 'spread_hl_frac': 0.019711785622121916, 'bb_std_mult': 2.043268036070175, 'rsi_os': 46, 'rsi_ob': 62, 'vol_spike': 0.1847656188470005, 'adx_thresh': 27.003555198854258, 'atr_min_pct': 0.00252880859685594, 'atr_max_pct': 0.08935119368592752, 'tp_mult': 2.0697981762560236, 'tsl_mult': 0.890887861953539, 'strategy': 'breakout', 'time_stop': 189, 'use_sma': False, 'use_atr': False, 'use_adx': False, 'use_ema': False, 'use_spike': False, 'rsi_required': False, 'edge_k': 1.2807217659258954, 'edge_cap': 0.3078475511677734}.
[I 2025-08-29 22:04:52,749] Trial 240 finished with values: [-1000000000.0, 1000000000.0] and parameters: {'p_sma': 42, 'p_std': 24, 'p_atr': 25, 'p_adx': 16, 'rsi_period': 18, 'ema1': 23, 'ema2': 46, 'slip_atr_k': 0.027980748702077955, 'slip_spread_k': 0.8372132594542816, 'spread_hl_frac': 0.021189615951446097, 'bb_std_mult': 2.089888250063387, 'rsi_os': 27, 'rsi_ob': 82, 'vol_spike': 0.18458547116112373, 'adx_thresh': 23.879475202442723, 'atr_min_pct': 0.028812890935887105, 'atr_max_pct': 0.015523687312413686, 'tp_mult': 2.253026644591924, 'tsl_mult': 0.9475022575973153, 'strategy': 'breakout', 'time_stop': 101, 'use_sma': False, 'use_atr': False, 'use_adx': False, 'use_ema': False, 'use_spike': False, 'rsi_required': False, 'edge_k': 0.5007209349198116, 'edge_cap': 0.798496171428757}.
[I 2025-08-29 22:05:19,345] Trial 241 finished with values: [-1000000000.0, 1000000000.0] and parameters: {'p_sma': 5, 'p_std': 24, 'p_atr': 25, 'p_adx': 16, 'rsi_period': 49, 'ema1': 23, 'ema2': 57, 'slip_atr_k': 0.02258877793498448, 'slip_spread_k': 0.836930880141668, 'spread_hl_frac': 0.045041635086897756, 'bb_std_mult': 2.1063638322450497, 'rsi_os': 27, 'rsi_ob': 61, 'vol_spike': 0.18423912701238218, 'adx_thresh': 27.212442172780793, 'atr_min_pct': 0.0032113851922071805, 'atr_max_pct': 0.013654474679520842, 'tp_mult': 2.571921955485835, 'tsl_mult': 0.4309405142740235, 'strategy': 'breakout', 'time_stop': 288, 'use_sma': False, 'use_atr': False, 'use_adx': False, 'use_ema': False, 'use_spike': False, 'rsi_required': False, 'edge_k': 0.9880172327132072, 'edge_cap': 0.8002154326113882}.
[I 2025-08-29 22:05:19,644] Trial 239 finished with values: [-1000000000.0, 1000000000.0] and parameters: {'p_sma': 7, 'p_std': 7, 'p_atr': 17, 'p_adx': 16, 'rsi_period': 68, 'ema1': 23, 'ema2': 32, 'slip_atr_k': 0.2332681710364289, 'slip_spread_k': 0.850117221063538, 'spread_hl_frac': 0.019598600458216372, 'bb_std_mult': 2.0533532669587293, 'rsi_os': 27, 'rsi_ob': 69, 'vol_spike': 0.1840445669961839, 'adx_thresh': 5.812406837076747, 'atr_min_pct': 0.015811873142725107, 'atr_max_pct': 0.10311740656241848, 'tp_mult': 2.273687609413698, 'tsl_mult': 0.8664949218709848, 'strategy': 'breakout', 'time_stop': 97, 'use_sma': False, 'use_atr': False, 'use_adx': False, 'use_ema': False, 'use_spike': False, 'rsi_required': False, 'edge_k': 0.45589157913089456, 'edge_cap': 0.7896173038377633}.
[I 2025-08-29 22:05:19,644] Trial 243 finished with values: [-1000000000.0, 1000000000.0] and parameters: {'p_sma': 7, 'p_std': 12, 'p_atr': 24, 'p_adx': 15, 'rsi_period': 49, 'ema1': 24, 'ema2': 52, 'slip_atr_k': 0.17032365351006679, 'slip_spread_k': 0.9825074917096805, 'spread_hl_frac': 0.01565038958363574, 'bb_std_mult': 2.1451896603406904, 'rsi_os': 26, 'rsi_ob': 58, 'vol_spike': 0.17942950633775914, 'adx_thresh': 5.716531342852262, 'atr_min_pct': 0.02994122101193, 'atr_max_pct': 0.10193179970593678, 'tp_mult': 1.069605205967137, 'tsl_mult': 0.4382125896561473, 'strategy': 'mean_reversion', 'time_stop': 285, 'use_sma': False, 'use_atr': False, 'use_adx': False, 'use_ema': False, 'use_spike': False, 'rsi_required': False, 'edge_k': 0.8923877844682406, 'edge_cap': 0.765749350282773}.
