[I 2025-08-29 22:05:19,887] Trial 242 finished with values: [-1000000000.0, 1000000000.0] and parameters: {'p_sma': 8, 'p_std': 23, 'p_atr': 24, 'p_adx': 16, 'rsi_period': 20, 'ema1': 23, 'ema2': 52, 'slip_atr_k': 0.12519957741099613, 'slip_spread_k': 0.8443521700108065, 'spread_hl_frac': 0.01781647664006951, 'bb_std_mult': 2.111332187358802, 'rsi_os': 27, 'rsi_ob': 83, 'vol_spike': 0.1841326211030424, 'adx_thresh': 23.929721047878388, 'atr_min_pct': 0.003386869715365672, 'atr_max_pct': 0.10307838422784583, 'tp_mult': 2.832789850224817, 'tsl_mult': 0.09793614723347793, 'strategy': 'mean_reversion', 'time_stop': 260, 'use_sma': False, 'use_atr': False, 'use_adx': False, 'use_ema': False, 'use_spike': False, 'rsi_required': False, 'edge_k': 0.7840017932337942, 'edge_cap': 0.7987850352687184}.
[I 2025-08-29 22:05:20,016] Trial 246 finished with values: [-1000000000.0, 1000000000.0] and parameters: {'p_sma': 58, 'p_std': 27, 'p_atr': 11, 'p_adx': 17, 'rsi_period': 7, 'ema1': 24, 'ema2': 43, 'slip_atr_k': 0.01838664569509714, 'slip_spread_k': 0.8086823304491286, 'spread_hl_frac': 0.01771236685600248, 'bb_std_mult': 2.0017321924014086, 'rsi_os': 25, 'rsi_ob': 46, 'vol_spike': 0.17936715265428024, 'adx_thresh': 25.096454896225843, 'atr_min_pct': 0.0020778965910386946, 'atr_max_pct': 0.09706000080807456, 'tp_mult': 1.1144962311800808, 'tsl_mult': 0.6927833596372913, 'strategy': 'mean_reversion', 'time_stop': 296, 'use_sma': False, 'use_atr': False, 'use_adx': False, 'use_ema': False, 'use_spike': False, 'rsi_required': False, 'edge_k': 0.7741948176399127, 'edge_cap': 0.15507791221624534}.
[I 2025-08-29 22:05:46,437] Trial 247 finished with values: [-0.008693226862843018, 0.008659702738804535] and parameters: {'p_sma': 48, 'p_std': 26, 'p_atr': 11, 'p_adx': 17, 'rsi_period': 45, 'ema1': 24, 'ema2': 44, 'slip_atr_k': 0.18101189542628815, 'slip_spread_k': 0.22844761408218178, 'spread_hl_frac': 0.02895638223329423, 'bb_std_mult': 1.9800744587162167, 'rsi_os': 25, 'rsi_ob': 60, 'vol_spike': 0.1754351831676552, 'adx_thresh': 25.192448620100425, 'atr_min_pct': 0.0021517351494993245, 'atr_max_pct': 0.0967944702882414, 'tp_mult': 1.1059603705269372, 'tsl_mult': 0.3010224583258736, 'strategy': 'breakout', 'time_stop': 114, 'use_sma': False, 'use_atr': False, 'use_adx': False, 'use_ema': False, 'use_spike': False, 'rsi_required': False, 'edge_k': 0.5285525154664039, 'edge_cap': 0.15872198264540588}.
[I 2025-08-29 22:05:46,754] Trial 244 finished with values: [-0.016778177821365925, 0.016760701531056212] and parameters: {'p_sma': 7, 'p_std': 27, 'p_atr': 24, 'p_adx': 15, 'rsi_period': 8, 'ema1': 24, 'ema2': 52, 'slip_atr_k': 0.12601720987114537, 'slip_spread_k': 0.9998779683240768, 'spread_hl_frac': 0.01785686686250187, 'bb_std_mult': 2.035065208192665, 'rsi_os': 25, 'rsi_ob': 58, 'vol_spike': 0.26068414477504764, 'adx_thresh': 25.22305437265771, 'atr_min_pct': 0.0022183082702971987, 'atr_max_pct': 0.14937283558139297, 'tp_mult': 1.1141348880540987, 'tsl_mult': 0.2960101453013746, 'strategy': 'mean_reversion', 'time_stop': 298, 'use_sma': False, 'use_atr': False, 'use_adx': False, 'use_ema': False, 'use_spike': False, 'rsi_required': False, 'edge_k': 0.9013625593983765, 'edge_cap': 0.7761128044152772}.
[I 2025-08-29 22:05:46,784] Trial 245 finished with values: [-0.01734015406358025, 0.017386512583261314] and parameters: {'p_sma': 8, 'p_std': 27, 'p_atr': 11, 'p_adx': 17, 'rsi_period': 8, 'ema1': 6, 'ema2': 43, 'slip_atr_k': 0.018989979347941083, 'slip_spread_k': 0.22168496324654768, 'spread_hl_frac': 0.01795165012679961, 'bb_std_mult': 1.9870440518451946, 'rsi_os': 25, 'rsi_ob': 60, 'vol_spike': 0.04665281991567667, 'adx_thresh': 25.138143388591764, 'atr_min_pct': 0.0020286218772737636, 'atr_max_pct': 0.09757993707952062, 'tp_mult': 1.1090608984548085, 'tsl_mult': 0.16860017680966938, 'strategy': 'mean_reversion', 'time_stop': 117, 'use_sma': False, 'use_atr': False, 'use_adx': False, 'use_ema': False, 'use_spike': False, 'rsi_required': False, 'edge_k': 0.5257109608417077, 'edge_cap': 0.8236542045042934}.
[I 2025-08-29 22:05:46,986] Trial 248 finished with values: [-1000000000.0, 1000000000.0] and parameters: {'p_sma': 48, 'p_std': 26, 'p_atr': 14, 'p_adx': 18, 'rsi_period': 74, 'ema1': 24, 'ema2': 56, 'slip_atr_k': 0.18341041881083456, 'slip_spread_k': 0.22737343793952464, 'spread_hl_frac': 0.02932129464755793, 'bb_std_mult': 2.0039019778143063, 'rsi_os': 12, 'rsi_ob': 75, 'vol_spike': 0.04614887093803667, 'adx_thresh': 19.52039029326168, 'atr_min_pct': 0.025183598630612775, 'atr_max_pct': 0.09828679004107096, 'tp_mult': 1.4858217167377576, 'tsl_mult': 0.613502005062309, 'strategy': 'breakout', 'time_stop': 105, 'use_sma': False, 'use_atr': False, 'use_adx': False, 'use_ema': False, 'use_spike': False, 'rsi_required': False, 'edge_k': 0.5297607807117434, 'edge_cap': 0.5775470947627395}.
[I 2025-08-29 22:06:13,652] Trial 252 finished with values: [-1000000000.0, 1000000000.0] and parameters: {'p_sma': 33, 'p_std': 21, 'p_atr': 18, 'p_adx': 18, 'rsi_period': 34, 'ema1': 17, 'ema2': 41, 'slip_atr_k': 0.06534750588071342, 'slip_spread_k': 0.7838305963145566, 'spread_hl_frac': 0.0335377410446947, 'bb_std_mult': 2.1447515938806645, 'rsi_os': 10, 'rsi_ob': 54, 'vol_spike': 0.08349223316815428, 'adx_thresh': 11.163279047168519, 'atr_min_pct': 0.006138910527331018, 'atr_max_pct': 0.054691946442174566, 'tp_mult': 1.3784245255714058, 'tsl_mult': 0.22724934133867586, 'strategy': 'breakout', 'time_stop': 146, 'use_sma': False, 'use_atr': False, 'use_adx': False, 'use_ema': False, 'use_spike': False, 'rsi_required': False, 'edge_k': 1.8606802838077292, 'edge_cap': 0.69129670134474}.
[I 2025-08-29 22:06:13,700] Trial 250 finished with values: [-1000000000.0, 1000000000.0] and parameters: {'p_sma': 51, 'p_std': 33, 'p_atr': 21, 'p_adx': 18, 'rsi_period': 23, 'ema1': 13, 'ema2': 49, 'slip_atr_k': 0.02388501101566393, 'slip_spread_k': 0.7857206070991015, 'spread_hl_frac': 0.016632347217312184, 'bb_std_mult': 3.5806927903216357, 'rsi_os': 13, 'rsi_ob': 93, 'vol_spike': 0.17136846676200965, 'adx_thresh': 25.767983914688987, 'atr_min_pct': 0.00396247792737187, 'atr_max_pct': 0.0946280773638891, 'tp_mult': 1.4687408608102221, 'tsl_mult': 0.0005473271604340413, 'strategy': 'breakout', 'time_stop': 149, 'use_sma': False, 'use_atr': False, 'use_adx': False, 'use_ema': False, 'use_spike': False, 'rsi_required': False, 'edge_k': 1.4006037634619015, 'edge_cap': 0.5699965958072001}.
[I 2025-08-29 22:06:14,056] Trial 249 finished with values: [-0.02406600819783311, 0.024057490568104994] and parameters: {'p_sma': 33, 'p_std': 25, 'p_atr': 18, 'p_adx': 18, 'rsi_period': 11, 'ema1': 9, 'ema2': 41, 'slip_atr_k': 0.024900331925783763, 'slip_spread_k': 0.8165125718313606, 'spread_hl_frac': 0.034684730378527234, 'bb_std_mult': 2.041942570445257, 'rsi_os': 17, 'rsi_ob': 74, 'vol_spike': 0.08521700534489528, 'adx_thresh': 25.781380905382495, 'atr_min_pct': 0.0012425775481518008, 'atr_max_pct': 0.06118955477495454, 'tp_mult': 1.4644458342222988, 'tsl_mult': 0.39644759626565546, 'strategy': 'breakout', 'time_stop': 216, 'use_sma': False, 'use_atr': False, 'use_adx': False, 'use_ema': False, 'use_spike': False, 'rsi_required': False, 'edge_k': 1.7399488977319448, 'edge_cap': 0.8228602095147342}.
[I 2025-08-29 22:06:14,058] Trial 251 finished with values: [-0.011070790705344224, 0.011068843847543681] and parameters: {'p_sma': 51, 'p_std': 25, 'p_atr': 26, 'p_adx': 18, 'rsi_period': 11, 'ema1': 25, 'ema2': 25, 'slip_atr_k': 0.02644911081987069, 'slip_spread_k': 0.19004190421593903, 'spread_hl_frac': 0.01385299453137138, 'bb_std_mult': 2.158712162193445, 'rsi_os': 39, 'rsi_ob': 92, 'vol_spike': 0.16919094426811732, 'adx_thresh': 8.788232436350071, 'atr_min_pct': 0.004146938873405051, 'atr_max_pct': 0.06145702082538547, 'tp_mult': 1.212566614993578, 'tsl_mult': 0.4030204873821668, 'strategy': 'breakout', 'time_stop': 149, 'use_sma': False, 'use_atr': False, 'use_adx': False, 'use_ema': False, 'use_spike': False, 'rsi_required': False, 'edge_k': 0.48315038756697615, 'edge_cap': 0.5757048194612424}.
[I 2025-08-29 22:06:40,833] Trial 256 finished with values: [-0.0012742435981061284, 0.0021380069945363942] and parameters: {'p_sma': 9, 'p_std': 52, 'p_atr': 19, 'p_adx': 14, 'rsi_period': 21, 'ema1': 25, 'ema2': 54, 'slip_atr_k': 0.051868083933986675, 'slip_spread_k': 0.06943129332942793, 'spread_hl_frac': 0.018788122174314234, 'bb_std_mult': 1.9253352893174926, 'rsi_os': 29, 'rsi_ob': 61, 'vol_spike': 0.1771353797615403, 'adx_thresh': 26.27447777655227, 'atr_min_pct': 0.002894716325237702, 'atr_max_pct': 0.09106761014162942, 'tp_mult': 1.0555181843550596, 'tsl_mult': 0.9171875453298477, 'strategy': 'breakout', 'time_stop': 203, 'use_sma': False, 'use_atr': False, 'use_adx': False, 'use_ema': False, 'use_spike': False, 'rsi_required': False, 'edge_k': 0.4962600227937118, 'edge_cap': 0.7638363795736538}.
[I 2025-08-29 22:06:41,192] Trial 253 finished with values: [-0.01396713921309889, 0.01408053539186722] and parameters: {'p_sma': 31, 'p_std': 25, 'p_atr': 21, 'p_adx': 14, 'rsi_period': 23, 'ema1': 10, 'ema2': 48, 'slip_atr_k': 0.0985333989265889, 'slip_spread_k': 0.1424588906144338, 'spread_hl_frac': 0.013711954500178498, 'bb_std_mult': 1.925898742502006, 'rsi_os': 39, 'rsi_ob': 61, 'vol_spike': 0.16887638382472997, 'adx_thresh': 15.416342515650559, 'atr_min_pct': 0.004047246447362228, 'atr_max_pct': 0.09340363701217369, 'tp_mult': 1.4294792070668194, 'tsl_mult': 0.5325100708876945, 'strategy': 'breakout', 'time_stop': 204, 'use_sma': False, 'use_atr': False, 'use_adx': False, 'use_ema': False, 'use_spike': False, 'rsi_required': False, 'edge_k': 0.8485841589240071, 'edge_cap': 0.19052118264627654}.
[I 2025-08-29 22:06:41,193] Trial 254 finished with values: [-0.016751914628300613, 0.016725890257180645] and parameters: {'p_sma': 9, 'p_std': 25, 'p_atr': 26, 'p_adx': 14, 'rsi_period': 60, 'ema1': 9, 'ema2': 54, 'slip_atr_k': 0.07771645556122338, 'slip_spread_k': 0.4469554626579573, 'spread_hl_frac': 0.013993938402255166, 'bb_std_mult': 2.0797870878126243, 'rsi_os': 39, 'rsi_ob': 61, 'vol_spike': 0.17838700108533895, 'adx_thresh': 26.1671780215735, 'atr_min_pct': 0.0010542853629132503, 'atr_max_pct': 0.0927847363778152, 'tp_mult': 1.818315483780868, 'tsl_mult': 0.5308164298532961, 'strategy': 'breakout', 'time_stop': 234, 'use_sma': False, 'use_atr': False, 'use_adx': False, 'use_ema': False, 'use_spike': False, 'rsi_required': False, 'edge_k': 0.485242750979582, 'edge_cap': 0.35098851718101076}.
[I 2025-08-29 22:06:41,202] Trial 255 finished with values: [-1000000000.0, 1000000000.0] and parameters: {'p_sma': 9, 'p_std': 23, 'p_atr': 26, 'p_adx': 14, 'rsi_period': 21, 'ema1': 20, 'ema2': 30, 'slip_atr_k': 0.030232278216595465, 'slip_spread_k': 0.18911683504510657, 'spread_hl_frac': 0.01878836141138088, 'bb_std_mult': 3.2740324131211507, 'rsi_os': 29, 'rsi_ob': 61, 'vol_spike': 0.12432796713814684, 'adx_thresh': 9.298101603091956, 'atr_min_pct': 0.016933667056704967, 'atr_max_pct': 0.09301616142010423, 'tp_mult': 1.1954697289670462, 'tsl_mult': 0.5252725625367044, 'strategy': 'breakout', 'time_stop': 235, 'use_sma': False, 'use_atr': False, 'use_adx': False, 'use_ema': False, 'use_spike': False, 'rsi_required': False, 'edge_k': 0.46120806158473593, 'edge_cap': 0.769801899400574}.
[I 2025-08-29 22:07:08,345] Trial 259 finished with values: [-1000000000.0, 1000000000.0] and parameters: {'p_sma': 5, 'p_std': 22, 'p_atr': 22, 'p_adx': 15, 'rsi_period': 20, 'ema1': 25, 'ema2': 54, 'slip_atr_k': 0.00937594066207966, 'slip_spread_k': 0.6485635741534305, 'spread_hl_frac': 0.015851892192896462, 'bb_std_mult': 3.138105795835531, 'rsi_os': 25, 'rsi_ob': 51, 'vol_spike': 0.18786504475081628, 'adx_thresh': 26.365315665726495, 'atr_min_pct': 0.0028555898888364315, 'atr_max_pct': 0.042938225493577155, 'tp_mult': 1.0624071767073042, 'tsl_mult': 0.48339369982723823, 'strategy': 'breakout', 'time_stop': 74, 'use_sma': False, 'use_atr': False, 'use_adx': False, 'use_ema': False, 'use_spike': False, 'rsi_required': False, 'edge_k': 0.6223951848507842, 'edge_cap': 0.7513220325134441}.
[I 2025-08-29 22:07:08,617] Trial 260 finished with values: [-1000000000.0, 1000000000.0] and parameters: {'p_sma': 5, 'p_std': 19, 'p_atr': 22, 'p_adx': 15, 'rsi_period': 17, 'ema1': 25, 'ema2': 54, 'slip_atr_k': 0.00834667031542676, 'slip_spread_k': 0.8685607327331943, 'spread_hl_frac': 0.04163488969818621, 'bb_std_mult': 1.930994095063169, 'rsi_os': 26, 'rsi_ob': 59, 'vol_spike': 0.19063443290434323, 'adx_thresh': 13.275302876722986, 'atr_min_pct': 0.01963478917657729, 'atr_max_pct': 0.08839704234861717, 'tp_mult': 2.7092223754385163, 'tsl_mult': 0.47397216630965955, 'strategy': 'breakout', 'time_stop': 163, 'use_sma': False, 'use_atr': False, 'use_adx': False, 'use_ema': False, 'use_spike': False, 'rsi_required': False, 'edge_k': 1.1356176499513377, 'edge_cap': 0.7551043009552634}.
[I 2025-08-29 22:07:08,762] Trial 257 finished with values: [-0.0032231067848368378, 0.003403009527504947] and parameters: {'p_sma': 9, 'p_std': 52, 'p_atr': 22, 'p_adx': 14, 'rsi_period': 21, 'ema1': 8, 'ema2': 30, 'slip_atr_k': 0.008281481628365854, 'slip_spread_k': 0.864379803891564, 'spread_hl_frac': 0.01876693087179741, 'bb_std_mult': 1.9204112718464248, 'rsi_os': 55, 'rsi_ob': 61, 'vol_spike': 0.1611182469044177, 'adx_thresh': 26.287403156052697, 'atr_min_pct': 0.0033409735980286788, 'atr_max_pct': 0.09181662006366721, 'tp_mult': 1.0468468250543448, 'tsl_mult': 0.4794927851239345, 'strategy': 'breakout', 'time_stop': 204, 'use_sma': False, 'use_atr': False, 'use_adx': False, 'use_ema': False, 'use_spike': False, 'rsi_required': False, 'edge_k': 0.6921398462179635, 'edge_cap': 0.7645624610671615}.
[I 2025-08-29 22:07:08,762] Trial 258 finished with values: [-1000000000.0, 1000000000.0] and parameters: {'p_sma': 5, 'p_std': 23, 'p_atr': 22, 'p_adx': 15, 'rsi_period': 21, 'ema1': 25, 'ema2': 54, 'slip_atr_k': 0.014628055104924431, 'slip_spread_k': 0.8233524559700177, 'spread_hl_frac': 0.03954500961182602, 'bb_std_mult': 1.9313422911795688, 'rsi_os': 29, 'rsi_ob': 51, 'vol_spike': 0.19183518917860046, 'adx_thresh': 17.196428705890863, 'atr_min_pct': 0.0029315350001229796, 'atr_max_pct': 0.10001639091102056, 'tp_mult': 1.045041243830581, 'tsl_mult': 0.4650708100756139, 'strategy': 'breakout', 'time_stop': 106, 'use_sma': False, 'use_atr': False, 'use_adx': False, 'use_ema': False, 'use_spike': False, 'rsi_required': False, 'edge_k': 0.6933645081271473, 'edge_cap': 0.8587108102961599}.
[I 2025-08-29 22:07:34,930] Trial 263 finished with values: [-1000000000.0, 1000000000.0] and parameters: {'p_sma': 7, 'p_std': 46, 'p_atr': 14, 'p_adx': 16, 'rsi_period': 19, 'ema1': 28, 'ema2': 56, 'slip_atr_k': 0.053647909944592856, 'slip_spread_k': 0.3999064420839046, 'spread_hl_frac': 0.02206307892616632, 'bb_std_mult': 3.506807853845154, 'rsi_os': 26, 'rsi_ob': 79, 'vol_spike': 0.17974754547132277, 'adx_thresh': 24.660097183038342, 'atr_min_pct': 0.025858889430882475, 'atr_max_pct': 0.05072237612871065, 'tp_mult': 1.1492394251257596, 'tsl_mult': 0.5643481197908676, 'strategy': 'mean_reversion', 'time_stop': 113, 'use_sma': False, 'use_atr': False, 'use_adx': False, 'use_ema': False, 'use_spike': False, 'rsi_required': False, 'edge_k': 0.5503175887814158, 'edge_cap': 0.820662572939463}.
[I 2025-08-29 22:07:35,421] Trial 261 finished with values: [-1000000000.0, 1000000000.0] and parameters: {'p_sma': 6, 'p_std': 47, 'p_atr': 19, 'p_adx': 15, 'rsi_period': 18, 'ema1': 24, 'ema2': 53, 'slip_atr_k': 0.05530306912637831, 'slip_spread_k': 0.8689831925961878, 'spread_hl_frac': 0.04100278333820308, 'bb_std_mult': 3.3721914064972918, 'rsi_os': 26, 'rsi_ob': 59, 'vol_spike': 0.19414320200939153, 'adx_thresh': 24.58411227390758, 'atr_min_pct': 0.026704494467146185, 'atr_max_pct': 0.09046345912425184, 'tp_mult': 1.1557727384045857, 'tsl_mult': 0.1445548926231071, 'strategy': 'breakout', 'time_stop': 106, 'use_sma': False, 'use_atr': False, 'use_adx': False, 'use_ema': False, 'use_spike': False, 'rsi_required': False, 'edge_k': 1.1210663705819006, 'edge_cap': 0.8073861957380973}.
[I 2025-08-29 22:07:35,570] Trial 262 finished with values: [-0.015609195782606333, 0.015565573002600927] and parameters: {'p_sma': 38, 'p_std': 59, 'p_atr': 17, 'p_adx': 16, 'rsi_period': 18, 'ema1': 24, 'ema2': 53, 'slip_atr_k': 0.013860272524269742, 'slip_spread_k': 0.8082583547096515, 'spread_hl_frac': 0.016533161605905462, 'bb_std_mult': 2.801968376587855, 'rsi_os': 8, 'rsi_ob': 59, 'vol_spike': 0.23384715588077737, 'adx_thresh': 17.203190611890882, 'atr_min_pct': 0.002742366331577332, 'atr_max_pct': 0.10081095505332405, 'tp_mult': 1.1448512982540358, 'tsl_mult': 0.12407197428399364, 'strategy': 'mean_reversion', 'time_stop': 108, 'use_sma': False, 'use_atr': False, 'use_adx': False, 'use_ema': False, 'use_spike': False, 'rsi_required': False, 'edge_k': 0.14485857578069683, 'edge_cap': 0.8102340300685896}.
[I 2025-08-29 22:07:35,824] Trial 264 finished with values: [-0.024048828005862055, 0.02397745842262721] and parameters: {'p_sma': 29, 'p_std': 47, 'p_atr': 19, 'p_adx': 16, 'rsi_period': 18, 'ema1': 27, 'ema2': 56, 'slip_atr_k': 0.015439981196402695, 'slip_spread_k': 0.8100176536426134, 'spread_hl_frac': 0.01654396985748586, 'bb_std_mult': 3.3827437263875435, 'rsi_os': 26, 'rsi_ob': 67, 'vol_spike': 0.17790049433177288, 'adx_thresh': 24.533813021737803, 'atr_min_pct': 0.0017371534108588855, 'atr_max_pct': 0.14529627703730535, 'tp_mult': 1.136507977595533, 'tsl_mult': 0.13744181555634338, 'strategy': 'mean_reversion', 'time_stop': 112, 'use_sma': False, 'use_atr': False, 'use_adx': False, 'use_ema': False, 'use_spike': False, 'rsi_required': False, 'edge_k': 1.551794177194643, 'edge_cap': 0.811513095512443}.
[I 2025-08-29 22:08:03,137] Trial 268 finished with values: [-1000000000.0, 1000000000.0] and parameters: {'p_sma': 7, 'p_std': 24, 'p_atr': 23, 'p_adx': 19, 'rsi_period': 15, 'ema1': 19, 'ema2': 28, 'slip_atr_k': 0.1890728685522168, 'slip_spread_k': 0.7640781596318724, 'spread_hl_frac': 0.04341417695506103, 'bb_std_mult': 2.2035103785731485, 'rsi_os': 55, 'rsi_ob': 57, 'vol_spike': 0.16208100537390735, 'adx_thresh': 6.759485060596102, 'atr_min_pct': 0.023007539883711167, 'atr_max_pct': 0.09463450972647856, 'tp_mult': 1.653268848623667, 'tsl_mult': 0.6473355523749792, 'strategy': 'breakout', 'time_stop': 95, 'use_sma': False, 'use_atr': False, 'use_adx': False, 'use_ema': False, 'use_spike': False, 'rsi_required': False, 'edge_k': 0.5046989623977736, 'edge_cap': 0.7776597141699203}.
[I 2025-08-29 22:08:03,195] Trial 266 finished with values: [-1000000000.0, 1000000000.0] and parameters: {'p_sma': 53, 'p_std': 42, 'p_atr': 23, 'p_adx': 13, 'rsi_period': 37, 'ema1': 27, 'ema2': 59, 'slip_atr_k': 0.015177925733660077, 'slip_spread_k': 0.06702057375273818, 'spread_hl_frac': 0.0168943760615543, 'bb_std_mult': 2.095423673694925, 'rsi_os': 23, 'rsi_ob': 89, 'vol_spike': 0.15956452742138086, 'adx_thresh': 25.669333131370887, 'atr_min_pct': 0.013170252949260722, 'atr_max_pct': 0.09622294733312338, 'tp_mult': 1.2709495498963588, 'tsl_mult': 0.1919947619964132, 'strategy': 'mean_reversion', 'time_stop': 250, 'use_sma': False, 'use_atr': False, 'use_adx': False, 'use_ema': False, 'use_spike': False, 'rsi_required': False, 'edge_k': 1.4604800603446273, 'edge_cap': 0.7768421107975759}.
[I 2025-08-29 22:08:03,380] Trial 267 finished with values: [-1000000000.0, 1000000000.0] and parameters: {'p_sma': 29, 'p_std': 26, 'p_atr': 20, 'p_adx': 17, 'rsi_period': 14, 'ema1': 27, 'ema2': 58, 'slip_atr_k': 0.02090271297035623, 'slip_spread_k': 0.6965546592628493, 'spread_hl_frac': 0.042838133666312894, 'bb_std_mult': 2.106635861311461, 'rsi_os': 28, 'rsi_ob': 57, 'vol_spike': 0.1756929008020746, 'adx_thresh': 25.63197938126869, 'atr_min_pct': 0.023076175175363894, 'atr_max_pct': 0.03291798360038785, 'tp_mult': 1.2724571722711535, 'tsl_mult': 0.25526918816319527, 'strategy': 'breakout', 'time_stop': 248, 'use_sma': False, 'use_atr': False, 'use_adx': False, 'use_ema': False, 'use_spike': False, 'rsi_required': False, 'edge_k': 0.4010982441180438, 'edge_cap': 0.7773213584908013}.
[I 2025-08-29 22:08:03,443] Trial 265 finished with values: [-0.04503781638104998, 0.04501602515229296] and parameters: {'p_sma': 21, 'p_std': 29, 'p_atr': 23, 'p_adx': 17, 'rsi_period': 37, 'ema1': 27, 'ema2': 59, 'slip_atr_k': 0.020096831655942247, 'slip_spread_k': 0.3219261292436656, 'spread_hl_frac': 0.016435235811800605, 'bb_std_mult': 2.8772297978635675, 'rsi_os': 53, 'rsi_ob': 67, 'vol_spike': 0.17772484383802256, 'adx_thresh': 25.530975708270578, 'atr_min_pct': 0.0014759180467488512, 'atr_max_pct': 0.08995690283038224, 'tp_mult': 2.024843908791561, 'tsl_mult': 0.2562886468316474, 'strategy': 'breakout', 'time_stop': 272, 'use_sma': False, 'use_atr': False, 'use_adx': False, 'use_ema': False, 'use_spike': False, 'rsi_required': False, 'edge_k': 0.38804231679485607, 'edge_cap': 0.7861909842827214}.
[I 2025-08-29 22:08:30,515] Trial 272 finished with values: [-1000000000.0, 1000000000.0] and parameters: {'p_sma': 10, 'p_std': 52, 'p_atr': 28, 'p_adx': 17, 'rsi_period': 20, 'ema1': 21, 'ema2': 52, 'slip_atr_k': 0.19680928837131645, 'slip_spread_k': 0.47938516651193747, 'spread_hl_frac': 0.01871439369848308, 'bb_std_mult': 2.027878459554451, 'rsi_os': 30, 'rsi_ob': 60, 'vol_spike': 0.18554110271720645, 'adx_thresh': 26.207862122811406, 'atr_min_pct': 0.020730794478240912, 'atr_max_pct': 0.02613555213559962, 'tp_mult': 1.0100767394139736, 'tsl_mult': 0.9166723198807658, 'strategy': 'breakout', 'time_stop': 118, 'use_sma': False, 'use_atr': False, 'use_adx': False, 'use_ema': False, 'use_spike': False, 'rsi_required': False, 'edge_k': 0.2115730707132687, 'edge_cap': 0.8415623302524492}.
