[I 2025-09-01 12:06:12,880] Trial 521 finished with values: [-1000000000.0, 1000000000.0] and parameters: {'p_sma': 26, 'p_std': 31, 'p_atr': 18, 'p_adx': 9, 'rsi_period': 46, 'ema1': 26, 'ema2': 47, 'slip_atr_k': 0.18445442220081124, 'slip_spread_k': 0.3399053151773391, 'spread_hl_frac': 0.007580024667034053, 'bb_std_mult': 0.8049317840229123, 'rsi_os': 34, 'rsi_ob': 49, 'vol_spike': 0.20817682221866582, 'adx_thresh': 22.644404060077523, 'atr_min_pct': 0.022456781189144615, 'atr_max_pct': 0.14358081523834648, 'tp_mult': 1.747464174077686, 'tsl_mult': 0.41432094312319784, 'strategy': 'breakout', 'time_stop': 149, 'use_sma': False, 'use_atr': True, 'use_adx': True, 'use_ema': True, 'use_spike': False, 'rsi_required': False, 'edge_k': 0.7008852877181422, 'edge_cap': 0.13232691251657466, 'bull_strategy': 'mean_reversion', 'bull_bb_std_mult': 1.8371724190938723, 'bull_rsi_os': 49, 'bull_rsi_ob': 52, 'bull_adx_thresh': 17.568280025508145, 'bull_atr_min_pct': 0.016970106392687347, 'bull_atr_max_pct': 0.11643536686857371, 'bull_tp_mult': 1.2600040751930437, 'bull_tsl_mult': 0.34121665611535384, 'bull_time_stop': 100, 'bull_use_sma': False, 'bull_use_ema': False, 'bull_use_atr': True, 'bull_use_adx': False, 'bull_use_spike': False, 'bull_rsi_required': False, 'bear_strategy': 'breakout', 'bear_bb_std_mult': 1.3531388112209013, 'bear_rsi_os': 27, 'bear_rsi_ob': 67, 'bear_adx_thresh': 8.730166462355664, 'bear_atr_min_pct': 0.004985426376302244, 'bear_atr_max_pct': 0.09130434628493787, 'bear_tp_mult': 2.891296947406942, 'bear_tsl_mult': 0.6595371481027575, 'bear_time_stop': 276, 'bear_use_sma': True, 'bear_use_ema': False, 'bear_use_atr': True, 'bear_use_adx': True, 'bear_use_spike': False, 'bear_rsi_required': True, 'sideways_strategy': 'breakout', 'sideways_bb_std_mult': 1.1039379622810865, 'sideways_rsi_os': 40, 'sideways_rsi_ob': 87, 'sideways_adx_thresh': 33.542498437318365, 'sideways_atr_min_pct': 0.001714397957297797, 'sideways_atr_max_pct': 0.1324122915031944, 'sideways_tp_mult': 2.8406910230085387, 'sideways_tsl_mult': 0.20900543805235516, 'sideways_time_stop': 85, 'sideways_use_sma': False, 'sideways_use_ema': False, 'sideways_use_atr': True, 'sideways_use_adx': True, 'sideways_use_spike': True, 'sideways_rsi_required': False}.
[I 2025-09-01 12:06:13,210] Trial 520 finished with values: [-0.0003475487983929382, 0.004200736666446913] and parameters: {'p_sma': 26, 'p_std': 34, 'p_atr': 18, 'p_adx': 9, 'rsi_period': 20, 'ema1': 25, 'ema2': 16, 'slip_atr_k': 0.021086441370812947, 'slip_spread_k': 0.3508425249102173, 'spread_hl_frac': 0.00727844451333471, 'bb_std_mult': 1.0638555885768095, 'rsi_os': 34, 'rsi_ob': 49, 'vol_spike': 0.19872015644734853, 'adx_thresh': 7.345063635061505, 'atr_min_pct': 0.022460301141263687, 'atr_max_pct': 0.0754669134163503, 'tp_mult': 2.1321931183613674, 'tsl_mult': 0.12587722345609823, 'strategy': 'breakout', 'time_stop': 137, 'use_sma': False, 'use_atr': True, 'use_adx': True, 'use_ema': False, 'use_spike': False, 'rsi_required': False, 'edge_k': 1.65142605622101, 'edge_cap': 0.1342690514715757, 'bull_strategy': 'mean_reversion', 'bull_bb_std_mult': 1.6676929352429164, 'bull_rsi_os': 6, 'bull_rsi_ob': 46, 'bull_adx_thresh': 6.5159542949138345, 'bull_atr_min_pct': 0.009975849445530621, 'bull_atr_max_pct': 0.10818188990347105, 'bull_tp_mult': 1.2720844843547974, 'bull_tsl_mult': 0.5457489257751809, 'bull_time_stop': 116, 'bull_use_sma': False, 'bull_use_ema': False, 'bull_use_atr': True, 'bull_use_adx': False, 'bull_use_spike': False, 'bull_rsi_required': False, 'bear_strategy': 'breakout', 'bear_bb_std_mult': 1.3418505137181493, 'bear_rsi_os': 26, 'bear_rsi_ob': 67, 'bear_adx_thresh': 23.355485303580814, 'bear_atr_min_pct': 0.0036586640072697563, 'bear_atr_max_pct': 0.027949972110716568, 'bear_tp_mult': 1.4416313379439598, 'bear_tsl_mult': 0.7317621428737258, 'bear_time_stop': 279, 'bear_use_sma': True, 'bear_use_ema': False, 'bear_use_atr': True, 'bear_use_adx': True, 'bear_use_spike': False, 'bear_rsi_required': True, 'sideways_strategy': 'breakout', 'sideways_bb_std_mult': 2.096290775013371, 'sideways_rsi_os': 43, 'sideways_rsi_ob': 78, 'sideways_adx_thresh': 33.58210371573716, 'sideways_atr_min_pct': 0.007082587482940472, 'sideways_atr_max_pct': 0.13237380227139536, 'sideways_tp_mult': 2.8474230021771816, 'sideways_tsl_mult': 0.8970777831246439, 'sideways_time_stop': 109, 'sideways_use_sma': False, 'sideways_use_ema': False, 'sideways_use_atr': True, 'sideways_use_adx': True, 'sideways_use_spike': True, 'sideways_rsi_required': False}.
[I 2025-09-01 12:06:54,251] Trial 525 finished with values: [-1000000000.0, 1000000000.0] and parameters: {'p_sma': 24, 'p_std': 33, 'p_atr': 19, 'p_adx': 9, 'rsi_period': 18, 'ema1': 24, 'ema2': 42, 'slip_atr_k': 0.10871267667574959, 'slip_spread_k': 0.34228401785518203, 'spread_hl_frac': 0.049931183577418055, 'bb_std_mult': 1.0016150546315126, 'rsi_os': 34, 'rsi_ob': 48, 'vol_spike': 0.20091783820938625, 'adx_thresh': 10.926632661414748, 'atr_min_pct': 0.024272878134471723, 'atr_max_pct': 0.0902375142626074, 'tp_mult': 1.7508490178931368, 'tsl_mult': 0.34528290716188326, 'strategy': 'breakout', 'time_stop': 163, 'use_sma': False, 'use_atr': True, 'use_adx': True, 'use_ema': True, 'use_spike': False, 'rsi_required': False, 'edge_k': 0.20122535264799693, 'edge_cap': 0.08377434751136562, 'bull_strategy': 'mean_reversion', 'bull_bb_std_mult': 1.8781573939892446, 'bull_rsi_os': 50, 'bull_rsi_ob': 46, 'bull_adx_thresh': 27.109696802055886, 'bull_atr_min_pct': 0.01677502297861645, 'bull_atr_max_pct': 0.10820287903693362, 'bull_tp_mult': 1.7482666705948455, 'bull_tsl_mult': 0.5762388436010004, 'bull_time_stop': 99, 'bull_use_sma': False, 'bull_use_ema': False, 'bull_use_atr': True, 'bull_use_adx': False, 'bull_use_spike': False, 'bull_rsi_required': False, 'bear_strategy': 'mean_reversion', 'bear_bb_std_mult': 1.33915715143658, 'bear_rsi_os': 23, 'bear_rsi_ob': 55, 'bear_adx_thresh': 9.081203637232983, 'bear_atr_min_pct': 0.01602222346526313, 'bear_atr_max_pct': 0.09098772933414598, 'bear_tp_mult': 2.9960201308431285, 'bear_tsl_mult': 0.7215272506150617, 'bear_time_stop': 278, 'bear_use_sma': True, 'bear_use_ema': False, 'bear_use_atr': True, 'bear_use_adx': True, 'bear_use_spike': False, 'bear_rsi_required': True, 'sideways_strategy': 'breakout', 'sideways_bb_std_mult': 1.1019752482302976, 'sideways_rsi_os': 40, 'sideways_rsi_ob': 90, 'sideways_adx_thresh': 34.27427648926023, 'sideways_atr_min_pct': 0.003196096907979514, 'sideways_atr_max_pct': 0.12398445586722792, 'sideways_tp_mult': 1.11857426180167, 'sideways_tsl_mult': 0.9519224426212145, 'sideways_time_stop': 85, 'sideways_use_sma': False, 'sideways_use_ema': False, 'sideways_use_atr': True, 'sideways_use_adx': True, 'sideways_use_spike': True, 'sideways_rsi_required': False}.
[I 2025-09-01 12:06:54,285] Trial 526 finished with values: [-0.022749462602675297, 0.02386352832088396] and parameters: {'p_sma': 20, 'p_std': 33, 'p_atr': 26, 'p_adx': 14, 'rsi_period': 18, 'ema1': 25, 'ema2': 14, 'slip_atr_k': 0.02048091181774024, 'slip_spread_k': 0.7595206947183764, 'spread_hl_frac': 0.00618579278234186, 'bb_std_mult': 1.7598643784940098, 'rsi_os': 34, 'rsi_ob': 48, 'vol_spike': 0.20266904799643745, 'adx_thresh': 23.846946952500378, 'atr_min_pct': 0.009958798286035075, 'atr_max_pct': 0.08652151159697075, 'tp_mult': 2.92129050669615, 'tsl_mult': 0.7055439289188432, 'strategy': 'breakout', 'time_stop': 182, 'use_sma': False, 'use_atr': True, 'use_adx': True, 'use_ema': True, 'use_spike': False, 'rsi_required': False, 'edge_k': 0.6315245788603776, 'edge_cap': 0.09266688551397516, 'bull_strategy': 'mean_reversion', 'bull_bb_std_mult': 1.695476773748067, 'bull_rsi_os': 50, 'bull_rsi_ob': 46, 'bull_adx_thresh': 5.786272038589304, 'bull_atr_min_pct': 0.016584354408303997, 'bull_atr_max_pct': 0.0279573915671742, 'bull_tp_mult': 1.3269813457314978, 'bull_tsl_mult': 0.5884963212119407, 'bull_time_stop': 118, 'bull_use_sma': False, 'bull_use_ema': False, 'bull_use_atr': True, 'bull_use_adx': False, 'bull_use_spike': False, 'bull_rsi_required': False, 'bear_strategy': 'breakout', 'bear_bb_std_mult': 1.2666479159315132, 'bear_rsi_os': 24, 'bear_rsi_ob': 52, 'bear_adx_thresh': 9.74770316721454, 'bear_atr_min_pct': 0.003017153860997218, 'bear_atr_max_pct': 0.011237252228013236, 'bear_tp_mult': 1.5929421788121334, 'bear_tsl_mult': 0.7257774814185882, 'bear_time_stop': 265, 'bear_use_sma': True, 'bear_use_ema': False, 'bear_use_atr': True, 'bear_use_adx': True, 'bear_use_spike': False, 'bear_rsi_required': True, 'sideways_strategy': 'breakout', 'sideways_bb_std_mult': 2.3642590849758367, 'sideways_rsi_os': 43, 'sideways_rsi_ob': 90, 'sideways_adx_thresh': 21.469121351592307, 'sideways_atr_min_pct': 0.006424665523314702, 'sideways_atr_max_pct': 0.12364527369001133, 'sideways_tp_mult': 1.1269181462461582, 'sideways_tsl_mult': 0.35999532792007954, 'sideways_time_stop': 206, 'sideways_use_sma': False, 'sideways_use_ema': False, 'sideways_use_atr': True, 'sideways_use_adx': True, 'sideways_use_spike': True, 'sideways_rsi_required': False}.
[I 2025-09-01 12:06:54,679] Trial 524 finished with values: [-1000000000.0, 1000000000.0] and parameters: {'p_sma': 50, 'p_std': 33, 'p_atr': 18, 'p_adx': 9, 'rsi_period': 71, 'ema1': 24, 'ema2': 14, 'slip_atr_k': 0.030282442573549506, 'slip_spread_k': 0.33853142063583314, 'spread_hl_frac': 0.017020948348000838, 'bb_std_mult': 2.4565910710426144, 'rsi_os': 32, 'rsi_ob': 47, 'vol_spike': 0.19989377675503633, 'adx_thresh': 25.75326453536234, 'atr_min_pct': 0.019204196671073655, 'atr_max_pct': 0.08259135949891738, 'tp_mult': 2.0814907144010886, 'tsl_mult': 0.11741833138741405, 'strategy': 'breakout', 'time_stop': 182, 'use_sma': False, 'use_atr': True, 'use_adx': True, 'use_ema': True, 'use_spike': False, 'rsi_required': False, 'edge_k': 1.6770473285065974, 'edge_cap': 0.7828555143303031, 'bull_strategy': 'mean_reversion', 'bull_bb_std_mult': 1.2090185969009926, 'bull_rsi_os': 12, 'bull_rsi_ob': 73, 'bull_adx_thresh': 6.530543144129361, 'bull_atr_min_pct': 0.016874348301839176, 'bull_atr_max_pct': 0.10802370062951863, 'bull_tp_mult': 1.323414462580312, 'bull_tsl_mult': 0.5815749255511385, 'bull_time_stop': 136, 'bull_use_sma': False, 'bull_use_ema': False, 'bull_use_atr': True, 'bull_use_adx': False, 'bull_use_spike': False, 'bull_rsi_required': False, 'bear_strategy': 'breakout', 'bear_bb_std_mult': 1.3442816794646235, 'bear_rsi_os': 27, 'bear_rsi_ob': 70, 'bear_adx_thresh': 8.563080715786134, 'bear_atr_min_pct': 0.015239612384136864, 'bear_atr_max_pct': 0.019987245406769664, 'bear_tp_mult': 1.5967923582046901, 'bear_tsl_mult': 0.726269064365591, 'bear_time_stop': 278, 'bear_use_sma': True, 'bear_use_ema': False, 'bear_use_atr': True, 'bear_use_adx': True, 'bear_use_spike': False, 'bear_rsi_required': True, 'sideways_strategy': 'breakout', 'sideways_bb_std_mult': 2.393384030992339, 'sideways_rsi_os': 41, 'sideways_rsi_ob': 87, 'sideways_adx_thresh': 34.10301002345625, 'sideways_atr_min_pct': 0.007245109719194208, 'sideways_atr_max_pct': 0.04336764637870094, 'sideways_tp_mult': 2.842712301760852, 'sideways_tsl_mult': 0.7967835383457733, 'sideways_time_stop': 85, 'sideways_use_sma': False, 'sideways_use_ema': False, 'sideways_use_atr': True, 'sideways_use_adx': True, 'sideways_use_spike': True, 'sideways_rsi_required': False}.
[I 2025-09-01 12:06:54,958] Trial 527 finished with values: [-0.003340873743456374, 0.008211652308416249] and parameters: {'p_sma': 24, 'p_std': 33, 'p_atr': 19, 'p_adx': 14, 'rsi_period': 44, 'ema1': 25, 'ema2': 14, 'slip_atr_k': 0.020671481147849495, 'slip_spread_k': 0.3034727039647952, 'spread_hl_frac': 0.005141977634759218, 'bb_std_mult': 2.4618040703674917, 'rsi_os': 34, 'rsi_ob': 48, 'vol_spike': 0.1986438103565568, 'adx_thresh': 25.666690517022307, 'atr_min_pct': 0.005604381986862739, 'atr_max_pct': 0.08915828739745746, 'tp_mult': 2.0910378732537778, 'tsl_mult': 0.01589545200904524, 'strategy': 'breakout', 'time_stop': 171, 'use_sma': False, 'use_atr': True, 'use_adx': True, 'use_ema': True, 'use_spike': False, 'rsi_required': False, 'edge_k': 1.0043338352016542, 'edge_cap': 0.0870847531645922, 'bull_strategy': 'mean_reversion', 'bull_bb_std_mult': 1.6742364080874284, 'bull_rsi_os': 12, 'bull_rsi_ob': 46, 'bull_adx_thresh': 5.867748032249821, 'bull_atr_min_pct': 0.022559852554286396, 'bull_atr_max_pct': 0.10755452893758148, 'bull_tp_mult': 1.3622795427761345, 'bull_tsl_mult': 0.5911044624951438, 'bull_time_stop': 133, 'bull_use_sma': False, 'bull_use_ema': False, 'bull_use_atr': True, 'bull_use_adx': False, 'bull_use_spike': False, 'bull_rsi_required': False, 'bear_strategy': 'breakout', 'bear_bb_std_mult': 1.2571036263929831, 'bear_rsi_os': 24, 'bear_rsi_ob': 52, 'bear_adx_thresh': 9.665799932884159, 'bear_atr_min_pct': 0.003066970950339834, 'bear_atr_max_pct': 0.01949637478245065, 'bear_tp_mult': 1.5996563558993975, 'bear_tsl_mult': 0.7189469770777863, 'bear_time_stop': 266, 'bear_use_sma': True, 'bear_use_ema': False, 'bear_use_atr': True, 'bear_use_adx': True, 'bear_use_spike': False, 'bear_rsi_required': True, 'sideways_strategy': 'breakout', 'sideways_bb_std_mult': 2.757309341968149, 'sideways_rsi_os': 35, 'sideways_rsi_ob': 57, 'sideways_adx_thresh': 34.383123701148456, 'sideways_atr_min_pct': 0.006147301967260842, 'sideways_atr_max_pct': 0.12375681902593312, 'sideways_tp_mult': 2.1253940671103457, 'sideways_tsl_mult': 0.9504978548601015, 'sideways_time_stop': 211, 'sideways_use_sma': False, 'sideways_use_ema': False, 'sideways_use_atr': True, 'sideways_use_adx': True, 'sideways_use_spike': True, 'sideways_rsi_required': False}.
[I 2025-09-01 12:07:36,496] Trial 530 finished with values: [-1000000000.0, 1000000000.0] and parameters: {'p_sma': 28, 'p_std': 44, 'p_atr': 17, 'p_adx': 8, 'rsi_period': 48, 'ema1': 27, 'ema2': 16, 'slip_atr_k': 0.034671556608855854, 'slip_spread_k': 0.3779296989432697, 'spread_hl_frac': 0.0026929391115297838, 'bb_std_mult': 0.925594027491173, 'rsi_os': 20, 'rsi_ob': 51, 'vol_spike': 0.07299185912506688, 'adx_thresh': 21.799998918696456, 'atr_min_pct': 0.02397787624061099, 'atr_max_pct': 0.08076277281523005, 'tp_mult': 2.02886156926059, 'tsl_mult': 0.09337318168752831, 'strategy': 'breakout', 'time_stop': 171, 'use_sma': False, 'use_atr': True, 'use_adx': True, 'use_ema': False, 'use_spike': False, 'rsi_required': False, 'edge_k': 0.15951910209672876, 'edge_cap': 0.11617839627636015, 'bull_strategy': 'mean_reversion', 'bull_bb_std_mult': 1.750392916423328, 'bull_rsi_os': 52, 'bull_rsi_ob': 54, 'bull_adx_thresh': 7.21731415993492, 'bull_atr_min_pct': 0.014906642783287943, 'bull_atr_max_pct': 0.11245004319181721, 'bull_tp_mult': 1.2058976644597994, 'bull_tsl_mult': 0.6222927943685691, 'bull_time_stop': 165, 'bull_use_sma': False, 'bull_use_ema': False, 'bull_use_atr': True, 'bull_use_adx': False, 'bull_use_spike': False, 'bull_rsi_required': False, 'bear_strategy': 'breakout', 'bear_bb_std_mult': 1.4733190345553038, 'bear_rsi_os': 28, 'bear_rsi_ob': 51, 'bear_adx_thresh': 10.156417493715587, 'bear_atr_min_pct': 0.004751655735559454, 'bear_atr_max_pct': 0.03043695535269965, 'bear_tp_mult': 1.0347201754299167, 'bear_tsl_mult': 0.42497389012634795, 'bear_time_stop': 286, 'bear_use_sma': True, 'bear_use_ema': False, 'bear_use_atr': True, 'bear_use_adx': True, 'bear_use_spike': False, 'bear_rsi_required': True, 'sideways_strategy': 'breakout', 'sideways_bb_std_mult': 0.79787542972104, 'sideways_rsi_os': 44, 'sideways_rsi_ob': 89, 'sideways_adx_thresh': 32.89760254142901, 'sideways_atr_min_pct': 0.007932044784548222, 'sideways_atr_max_pct': 0.13467233366373899, 'sideways_tp_mult': 2.4763806155645907, 'sideways_tsl_mult': 0.2561136617828224, 'sideways_time_stop': 96, 'sideways_use_sma': False, 'sideways_use_ema': False, 'sideways_use_atr': True, 'sideways_use_adx': True, 'sideways_use_spike': True, 'sideways_rsi_required': False}.
[I 2025-09-01 12:07:36,945] Trial 529 finished with values: [-1000000000.0, 1000000000.0] and parameters: {'p_sma': 27, 'p_std': 34, 'p_atr': 19, 'p_adx': 8, 'rsi_period': 76, 'ema1': 24, 'ema2': 13, 'slip_atr_k': 0.15365380093323155, 'slip_spread_k': 0.379560929755974, 'spread_hl_frac': 0.0021367112281484276, 'bb_std_mult': 0.6861100060273075, 'rsi_os': 32, 'rsi_ob': 51, 'vol_spike': 0.024523291570497124, 'adx_thresh': 25.449350394416328, 'atr_min_pct': 0.012755235425381923, 'atr_max_pct': 0.08144592858800542, 'tp_mult': 2.095006171809309, 'tsl_mult': 0.12008836547430984, 'strategy': 'breakout', 'time_stop': 171, 'use_sma': False, 'use_atr': True, 'use_adx': True, 'use_ema': True, 'use_spike': False, 'rsi_required': False, 'edge_k': 0.5790066283382345, 'edge_cap': 0.1308492644640649, 'bull_strategy': 'mean_reversion', 'bull_bb_std_mult': 1.7488707772816061, 'bull_rsi_os': 10, 'bull_rsi_ob': 73, 'bull_adx_thresh': 7.186376614160162, 'bull_atr_min_pct': 0.01741841635450802, 'bull_atr_max_pct': 0.05042147253209488, 'bull_tp_mult': 1.3739266143777045, 'bull_tsl_mult': 0.09893982522726841, 'bull_time_stop': 71, 'bull_use_sma': False, 'bull_use_ema': False, 'bull_use_atr': True, 'bull_use_adx': False, 'bull_use_spike': False, 'bull_rsi_required': False, 'bear_strategy': 'breakout', 'bear_bb_std_mult': 1.4133530360157163, 'bear_rsi_os': 52, 'bear_rsi_ob': 51, 'bear_adx_thresh': 29.02667898039922, 'bear_atr_min_pct': 0.004846658958028313, 'bear_atr_max_pct': 0.11659201778974101, 'bear_tp_mult': 2.082311747358462, 'bear_tsl_mult': 0.7249590672026952, 'bear_time_stop': 272, 'bear_use_sma': True, 'bear_use_ema': False, 'bear_use_atr': True, 'bear_use_adx': True, 'bear_use_spike': False, 'bear_rsi_required': True, 'sideways_strategy': 'breakout', 'sideways_bb_std_mult': 2.2255017328128655, 'sideways_rsi_os': 35, 'sideways_rsi_ob': 80, 'sideways_adx_thresh': 29.95666101796582, 'sideways_atr_min_pct': 0.006980678745184153, 'sideways_atr_max_pct': 0.044664712439375066, 'sideways_tp_mult': 2.76221348871971, 'sideways_tsl_mult': 0.2528882331542432, 'sideways_time_stop': 103, 'sideways_use_sma': False, 'sideways_use_ema': False, 'sideways_use_atr': True, 'sideways_use_adx': True, 'sideways_use_spike': True, 'sideways_rsi_required': False}.
[I 2025-09-01 12:07:37,450] Trial 528 finished with values: [-1000000000.0, 1000000000.0] and parameters: {'p_sma': 51, 'p_std': 34, 'p_atr': 14, 'p_adx': 8, 'rsi_period': 24, 'ema1': 24, 'ema2': 13, 'slip_atr_k': 0.030851660143154845, 'slip_spread_k': 0.36608005233138613, 'spread_hl_frac': 0.007280382018303988, 'bb_std_mult': 1.6195717760318324, 'rsi_os': 32, 'rsi_ob': 58, 'vol_spike': 0.02032536562411949, 'adx_thresh': 25.91671690680313, 'atr_min_pct': 0.023941878336706923, 'atr_max_pct': 0.08168592948572895, 'tp_mult': 2.092036931028472, 'tsl_mult': 0.11041210057809159, 'strategy': 'breakout', 'time_stop': 172, 'use_sma': False, 'use_atr': True, 'use_adx': True, 'use_ema': True, 'use_spike': False, 'rsi_required': False, 'edge_k': 0.5873994980261326, 'edge_cap': 0.116701969964708, 'bull_strategy': 'mean_reversion', 'bull_bb_std_mult': 3.3229268020148446, 'bull_rsi_os': 42, 'bull_rsi_ob': 73, 'bull_adx_thresh': 32.78130887049246, 'bull_atr_min_pct': 0.01481838575143983, 'bull_atr_max_pct': 0.11232607585895785, 'bull_tp_mult': 1.3625738802632126, 'bull_tsl_mult': 0.6157524535465437, 'bull_time_stop': 166, 'bull_use_sma': False, 'bull_use_ema': False, 'bull_use_atr': True, 'bull_use_adx': False, 'bull_use_spike': False, 'bull_rsi_required': False, 'bear_strategy': 'breakout', 'bear_bb_std_mult': 1.421991812734558, 'bear_rsi_os': 28, 'bear_rsi_ob': 51, 'bear_adx_thresh': 25.521553346301182, 'bear_atr_min_pct': 0.004894122605978538, 'bear_atr_max_pct': 0.018727077381682174, 'bear_tp_mult': 1.448619134768523, 'bear_tsl_mult': 0.7226340661865348, 'bear_time_stop': 286, 'bear_use_sma': True, 'bear_use_ema': False, 'bear_use_atr': True, 'bear_use_adx': True, 'bear_use_spike': False, 'bear_rsi_required': True, 'sideways_strategy': 'breakout', 'sideways_bb_std_mult': 2.2097396749012086, 'sideways_rsi_os': 35, 'sideways_rsi_ob': 57, 'sideways_adx_thresh': 32.83043497494712, 'sideways_atr_min_pct': 0.007233684765968941, 'sideways_atr_max_pct': 0.12712009886777628, 'sideways_tp_mult': 2.7588138480337054, 'sideways_tsl_mult': 0.3099417892376336, 'sideways_time_stop': 103, 'sideways_use_sma': False, 'sideways_use_ema': False, 'sideways_use_atr': True, 'sideways_use_adx': True, 'sideways_use_spike': True, 'sideways_rsi_required': False}.
