[I 2025-09-01 10:53:55,492] Trial 73 finished with values: [-0.005373187877541041, 0.005790962638835327] and parameters: {'p_sma': 8, 'p_std': 25, 'p_atr': 7, 'p_adx': 25, 'rsi_period': 34, 'ema1': 18, 'ema2': 56, 'slip_atr_k': 0.03166741499279416, 'slip_spread_k': 0.21398052565027853, 'spread_hl_frac': 0.005484956102752472, 'bb_std_mult': 0.5635568749976627, 'rsi_os': 27, 'rsi_ob': 62, 'vol_spike': 0.1369027106662295, 'adx_thresh': 5.650426486789247, 'atr_min_pct': 0.015463710112576905, 'atr_max_pct': 0.06657059549901632, 'tp_mult': 1.8462228652043629, 'tsl_mult': 0.5888201606362651, 'strategy': 'mean_reversion', 'time_stop': 239, 'use_sma': True, 'use_atr': True, 'use_adx': True, 'use_ema': True, 'use_spike': False, 'rsi_required': True, 'edge_k': 1.8741063452121787, 'edge_cap': 0.5039355062145731, 'bull_strategy': 'breakout', 'bull_bb_std_mult': 2.1220363185545965, 'bull_rsi_os': 26, 'bull_rsi_ob': 80, 'bull_adx_thresh': 28.713444545199295, 'bull_atr_min_pct': 0.0009620846265957426, 'bull_atr_max_pct': 0.10645404921408295, 'bull_tp_mult': 1.5803706835118747, 'bull_tsl_mult': 0.927813278908149, 'bull_time_stop': 22, 'bull_use_sma': False, 'bull_use_ema': False, 'bull_use_atr': False, 'bull_use_adx': True, 'bull_use_spike': True, 'bull_rsi_required': False, 'bear_strategy': 'breakout', 'bear_bb_std_mult': 1.2808679971201382, 'bear_rsi_os': 41, 'bear_rsi_ob': 89, 'bear_adx_thresh': 21.461008246696842, 'bear_atr_min_pct': 0.020032896927129618, 'bear_atr_max_pct': 0.13980613152305954, 'bear_tp_mult': 1.758295360339666, 'bear_tsl_mult': 0.15618337293669532, 'bear_time_stop': 134, 'bear_use_sma': False, 'bear_use_ema': False, 'bear_use_atr': True, 'bear_use_adx': False, 'bear_use_spike': True, 'bear_rsi_required': False, 'sideways_strategy': 'breakout', 'sideways_bb_std_mult': 3.383232673659483, 'sideways_rsi_os': 22, 'sideways_rsi_ob': 47, 'sideways_adx_thresh': 16.134988021958637, 'sideways_atr_min_pct': 0.019236311020023447, 'sideways_atr_max_pct': 0.09790700253667459, 'sideways_tp_mult': 1.9758942784706954, 'sideways_tsl_mult': 0.01065854018702539, 'sideways_time_stop': 147, 'sideways_use_sma': False, 'sideways_use_ema': True, 'sideways_use_atr': False, 'sideways_use_adx': False, 'sideways_use_spike': False, 'sideways_rsi_required': True}.
[I 2025-09-01 10:53:55,507] Trial 74 finished with values: [-1000000000.0, 1000000000.0] and parameters: {'p_sma': 14, 'p_std': 25, 'p_atr': 7, 'p_adx': 25, 'rsi_period': 33, 'ema1': 16, 'ema2': 59, 'slip_atr_k': 0.21632438707488966, 'slip_spread_k': 0.6623947123247939, 'spread_hl_frac': 0.006142721836463154, 'bb_std_mult': 1.6375337826969494, 'rsi_os': 29, 'rsi_ob': 62, 'vol_spike': 0.0008690430062230081, 'adx_thresh': 5.870464385710572, 'atr_min_pct': 0.014876830459760662, 'atr_max_pct': 0.06585092750114235, 'tp_mult': 1.7574775310286814, 'tsl_mult': 0.5132095439740859, 'strategy': 'mean_reversion', 'time_stop': 240, 'use_sma': True, 'use_atr': True, 'use_adx': False, 'use_ema': False, 'use_spike': False, 'rsi_required': True, 'edge_k': 1.5823869039823213, 'edge_cap': 0.5073695570424838, 'bull_strategy': 'breakout', 'bull_bb_std_mult': 1.935987113153983, 'bull_rsi_os': 26, 'bull_rsi_ob': 77, 'bull_adx_thresh': 29.860561071570647, 'bull_atr_min_pct': 0.014833074513678799, 'bull_atr_max_pct': 0.11253659187630558, 'bull_tp_mult': 1.6032938797789495, 'bull_tsl_mult': 0.6733676442831787, 'bull_time_stop': 20, 'bull_use_sma': False, 'bull_use_ema': False, 'bull_use_atr': False, 'bull_use_adx': True, 'bull_use_spike': False, 'bull_rsi_required': False, 'bear_strategy': 'breakout', 'bear_bb_std_mult': 2.0539259780159913, 'bear_rsi_os': 41, 'bear_rsi_ob': 76, 'bear_adx_thresh': 21.636301530146497, 'bear_atr_min_pct': 0.020218776409244927, 'bear_atr_max_pct': 0.010072940994118665, 'bear_tp_mult': 1.7572794316879772, 'bear_tsl_mult': 0.1724356281046935, 'bear_time_stop': 139, 'bear_use_sma': False, 'bear_use_ema': False, 'bear_use_atr': True, 'bear_use_adx': False, 'bear_use_spike': True, 'bear_rsi_required': False, 'sideways_strategy': 'breakout', 'sideways_bb_std_mult': 3.296576683175794, 'sideways_rsi_os': 22, 'sideways_rsi_ob': 81, 'sideways_adx_thresh': 10.929188662741316, 'sideways_atr_min_pct': 0.0218698553050604, 'sideways_atr_max_pct': 0.10605338764555654, 'sideways_tp_mult': 1.0889195316792506, 'sideways_tsl_mult': 0.6093508726878099, 'sideways_time_stop': 151, 'sideways_use_sma': False, 'sideways_use_ema': True, 'sideways_use_atr': False, 'sideways_use_adx': False, 'sideways_use_spike': False, 'sideways_rsi_required': True}.
[I 2025-09-01 10:53:56,190] Trial 75 finished with values: [-0.017028712528451617, 0.01826338474548553] and parameters: {'p_sma': 15, 'p_std': 25, 'p_atr': 7, 'p_adx': 25, 'rsi_period': 38, 'ema1': 19, 'ema2': 56, 'slip_atr_k': 0.2296609143799925, 'slip_spread_k': 0.7351556409386556, 'spread_hl_frac': 0.005572497800652273, 'bb_std_mult': 2.0375538870764345, 'rsi_os': 20, 'rsi_ob': 59, 'vol_spike': 0.09130134984515138, 'adx_thresh': 8.07708865414084, 'atr_min_pct': 0.015159164608569909, 'atr_max_pct': 0.06727207657555394, 'tp_mult': 1.6955339445156596, 'tsl_mult': 0.5073868209391446, 'strategy': 'mean_reversion', 'time_stop': 75, 'use_sma': True, 'use_atr': True, 'use_adx': False, 'use_ema': True, 'use_spike': False, 'rsi_required': False, 'edge_k': 1.5966371940455253, 'edge_cap': 0.23376427138589478, 'bull_strategy': 'breakout', 'bull_bb_std_mult': 1.872588372115646, 'bull_rsi_os': 26, 'bull_rsi_ob': 86, 'bull_adx_thresh': 28.80493127865571, 'bull_atr_min_pct': 0.0009229145463490317, 'bull_atr_max_pct': 0.10718636604182724, 'bull_tp_mult': 1.5858387810053796, 'bull_tsl_mult': 0.7103027198655834, 'bull_time_stop': 21, 'bull_use_sma': False, 'bull_use_ema': False, 'bull_use_atr': False, 'bull_use_adx': True, 'bull_use_spike': True, 'bull_rsi_required': False, 'bear_strategy': 'breakout', 'bear_bb_std_mult': 0.7373814278731765, 'bear_rsi_os': 42, 'bear_rsi_ob': 89, 'bear_adx_thresh': 21.74928674398802, 'bear_atr_min_pct': 0.02022177792264241, 'bear_atr_max_pct': 0.13589941206055353, 'bear_tp_mult': 1.7881584228071807, 'bear_tsl_mult': 0.18024928625340483, 'bear_time_stop': 173, 'bear_use_sma': False, 'bear_use_ema': False, 'bear_use_atr': True, 'bear_use_adx': False, 'bear_use_spike': True, 'bear_rsi_required': True, 'sideways_strategy': 'breakout', 'sideways_bb_std_mult': 3.274036001836941, 'sideways_rsi_os': 17, 'sideways_rsi_ob': 47, 'sideways_adx_thresh': 15.281521962465252, 'sideways_atr_min_pct': 0.018852454132380587, 'sideways_atr_max_pct': 0.13710349310023862, 'sideways_tp_mult': 2.8952539684156737, 'sideways_tsl_mult': 0.6195770934992304, 'sideways_time_stop': 147, 'sideways_use_sma': False, 'sideways_use_ema': True, 'sideways_use_atr': False, 'sideways_use_adx': False, 'sideways_use_spike': False, 'sideways_rsi_required': True}.
[I 2025-09-01 10:53:56,351] Trial 72 finished with values: [-0.012163525964388966, 0.012613908197421034] and parameters: {'p_sma': 14, 'p_std': 31, 'p_atr': 7, 'p_adx': 25, 'rsi_period': 34, 'ema1': 18, 'ema2': 60, 'slip_atr_k': 0.22631904304758352, 'slip_spread_k': 0.20942303950717184, 'spread_hl_frac': 0.023820334355388263, 'bb_std_mult': 2.6716866581190053, 'rsi_os': 20, 'rsi_ob': 62, 'vol_spike': 0.10059791098056403, 'adx_thresh': 5.807985515032605, 'atr_min_pct': 0.0013984529110117507, 'atr_max_pct': 0.0663041084643094, 'tp_mult': 1.049103291559711, 'tsl_mult': 0.5820810117686112, 'strategy': 'mean_reversion', 'time_stop': 75, 'use_sma': True, 'use_atr': True, 'use_adx': False, 'use_ema': False, 'use_spike': False, 'rsi_required': True, 'edge_k': 1.8994275354633237, 'edge_cap': 0.5064943342497131, 'bull_strategy': 'breakout', 'bull_bb_std_mult': 2.115495583784647, 'bull_rsi_os': 29, 'bull_rsi_ob': 69, 'bull_adx_thresh': 28.93859573938967, 'bull_atr_min_pct': 0.0007944186513245272, 'bull_atr_max_pct': 0.10542244881732324, 'bull_tp_mult': 1.5349779299216504, 'bull_tsl_mult': 0.9174017746752893, 'bull_time_stop': 19, 'bull_use_sma': True, 'bull_use_ema': False, 'bull_use_atr': True, 'bull_use_adx': True, 'bull_use_spike': True, 'bull_rsi_required': False, 'bear_strategy': 'breakout', 'bear_bb_std_mult': 0.687397825188387, 'bear_rsi_os': 41, 'bear_rsi_ob': 89, 'bear_adx_thresh': 16.333675963142205, 'bear_atr_min_pct': 0.020155286754075154, 'bear_atr_max_pct': 0.033519007502068376, 'bear_tp_mult': 1.7428849199059326, 'bear_tsl_mult': 0.1529184632654335, 'bear_time_stop': 143, 'bear_use_sma': False, 'bear_use_ema': False, 'bear_use_atr': True, 'bear_use_adx': False, 'bear_use_spike': True, 'bear_rsi_required': False, 'sideways_strategy': 'breakout', 'sideways_bb_std_mult': 3.3725929880127454, 'sideways_rsi_os': 22, 'sideways_rsi_ob': 83, 'sideways_adx_thresh': 11.0642914247838, 'sideways_atr_min_pct': 0.018885887284861822, 'sideways_atr_max_pct': 0.13131870490344122, 'sideways_tp_mult': 2.8366403929767148, 'sideways_tsl_mult': 0.6372454715400659, 'sideways_time_stop': 96, 'sideways_use_sma': True, 'sideways_use_ema': True, 'sideways_use_atr': False, 'sideways_use_adx': False, 'sideways_use_spike': False, 'sideways_rsi_required': True}.
[I 2025-09-01 10:54:35,025] Trial 78 finished with values: [-1000000000.0, 1000000000.0] and parameters: {'p_sma': 8, 'p_std': 8, 'p_atr': 17, 'p_adx': 27, 'rsi_period': 37, 'ema1': 19, 'ema2': 54, 'slip_atr_k': 0.06478499344060559, 'slip_spread_k': 0.21948981643198467, 'spread_hl_frac': 0.004777887307756696, 'bb_std_mult': 0.555231463817451, 'rsi_os': 26, 'rsi_ob': 66, 'vol_spike': 0.10349374689950525, 'adx_thresh': 8.40053320652418, 'atr_min_pct': 0.02256460143182601, 'atr_max_pct': 0.06815952037955834, 'tp_mult': 1.8613511250870878, 'tsl_mult': 0.6461635871921556, 'strategy': 'breakout', 'time_stop': 72, 'use_sma': False, 'use_atr': True, 'use_adx': True, 'use_ema': True, 'use_spike': False, 'rsi_required': True, 'edge_k': 1.8894742630535188, 'edge_cap': 0.215150514245874, 'bull_strategy': 'breakout', 'bull_bb_std_mult': 2.3691241120821025, 'bull_rsi_os': 29, 'bull_rsi_ob': 79, 'bull_adx_thresh': 28.162305915371785, 'bull_atr_min_pct': 0.003997435470234621, 'bull_atr_max_pct': 0.10591972180026177, 'bull_tp_mult': 1.4661553617613003, 'bull_tsl_mult': 0.9462314236338246, 'bull_time_stop': 75, 'bull_use_sma': False, 'bull_use_ema': False, 'bull_use_atr': False, 'bull_use_adx': True, 'bull_use_spike': True, 'bull_rsi_required': False, 'bear_strategy': 'mean_reversion', 'bear_bb_std_mult': 1.2658838182864764, 'bear_rsi_os': 43, 'bear_rsi_ob': 89, 'bear_adx_thresh': 20.456075277602253, 'bear_atr_min_pct': 0.02322965241177772, 'bear_atr_max_pct': 0.13882231439442425, 'bear_tp_mult': 1.6834857367827358, 'bear_tsl_mult': 0.13258260778819003, 'bear_time_stop': 169, 'bear_use_sma': True, 'bear_use_ema': False, 'bear_use_atr': True, 'bear_use_adx': False, 'bear_use_spike': True, 'bear_rsi_required': False, 'sideways_strategy': 'mean_reversion', 'sideways_bb_std_mult': 3.3011549888054357, 'sideways_rsi_os': 29, 'sideways_rsi_ob': 65, 'sideways_adx_thresh': 15.413987242225328, 'sideways_atr_min_pct': 0.018949752327039316, 'sideways_atr_max_pct': 0.09207233278159366, 'sideways_tp_mult': 2.1670191523524545, 'sideways_tsl_mult': 0.00027794458091246095, 'sideways_time_stop': 169, 'sideways_use_sma': True, 'sideways_use_ema': False, 'sideways_use_atr': False, 'sideways_use_adx': False, 'sideways_use_spike': False, 'sideways_rsi_required': True}.
[I 2025-09-01 10:54:35,302] Trial 79 finished with values: [-1000000000.0, 1000000000.0] and parameters: {'p_sma': 8, 'p_std': 46, 'p_atr': 17, 'p_adx': 27, 'rsi_period': 37, 'ema1': 19, 'ema2': 54, 'slip_atr_k': 0.0312982885656297, 'slip_spread_k': 0.22441160002575825, 'spread_hl_frac': 0.03696855335927639, 'bb_std_mult': 0.5423294268921984, 'rsi_os': 20, 'rsi_ob': 68, 'vol_spike': 0.10148218207068407, 'adx_thresh': 5.380112366386518, 'atr_min_pct': 0.01898850883673294, 'atr_max_pct': 0.07778295529914438, 'tp_mult': 1.8021542551047864, 'tsl_mult': 0.6376742866054749, 'strategy': 'breakout', 'time_stop': 146, 'use_sma': False, 'use_atr': True, 'use_adx': True, 'use_ema': True, 'use_spike': False, 'rsi_required': True, 'edge_k': 1.9021830684413914, 'edge_cap': 0.20618173394507489, 'bull_strategy': 'breakout', 'bull_bb_std_mult': 1.8534230063590271, 'bull_rsi_os': 29, 'bull_rsi_ob': 79, 'bull_adx_thresh': 28.2233637887022, 'bull_atr_min_pct': 0.004020304244015453, 'bull_atr_max_pct': 0.10474626436191477, 'bull_tp_mult': 1.4380080370511454, 'bull_tsl_mult': 0.9487332946324525, 'bull_time_stop': 58, 'bull_use_sma': False, 'bull_use_ema': False, 'bull_use_atr': False, 'bull_use_adx': True, 'bull_use_spike': True, 'bull_rsi_required': False, 'bear_strategy': 'mean_reversion', 'bear_bb_std_mult': 1.2577918199413687, 'bear_rsi_os': 44, 'bear_rsi_ob': 89, 'bear_adx_thresh': 16.797436175025247, 'bear_atr_min_pct': 0.02043264260432276, 'bear_atr_max_pct': 0.14038863848704022, 'bear_tp_mult': 1.6864018160995844, 'bear_tsl_mult': 0.146921548800393, 'bear_time_stop': 164, 'bear_use_sma': True, 'bear_use_ema': False, 'bear_use_atr': True, 'bear_use_adx': False, 'bear_use_spike': True, 'bear_rsi_required': False, 'sideways_strategy': 'mean_reversion', 'sideways_bb_std_mult': 3.05988093236348, 'sideways_rsi_os': 29, 'sideways_rsi_ob': 51, 'sideways_adx_thresh': 15.351360043722568, 'sideways_atr_min_pct': 0.01891254534435409, 'sideways_atr_max_pct': 0.09007232216405897, 'sideways_tp_mult': 1.9544482796557694, 'sideways_tsl_mult': 0.0002467047609979456, 'sideways_time_stop': 113, 'sideways_use_sma': True, 'sideways_use_ema': False, 'sideways_use_atr': False, 'sideways_use_adx': False, 'sideways_use_spike': False, 'sideways_rsi_required': True}.
[I 2025-09-01 10:54:35,572] Trial 77 finished with values: [-1000000000.0, 1000000000.0] and parameters: {'p_sma': 8, 'p_std': 7, 'p_atr': 8, 'p_adx': 9, 'rsi_period': 36, 'ema1': 19, 'ema2': 54, 'slip_atr_k': 0.03195656243826235, 'slip_spread_k': 0.227909224733841, 'spread_hl_frac': 0.012440249646607754, 'bb_std_mult': 0.5436577355633927, 'rsi_os': 20, 'rsi_ob': 67, 'vol_spike': 0.08469706223333821, 'adx_thresh': 5.595745474092252, 'atr_min_pct': 0.0189266942049612, 'atr_max_pct': 0.07842918414968911, 'tp_mult': 1.694202675755966, 'tsl_mult': 0.6533269243851835, 'strategy': 'breakout', 'time_stop': 142, 'use_sma': False, 'use_atr': True, 'use_adx': True, 'use_ema': True, 'use_spike': False, 'rsi_required': True, 'edge_k': 1.9032759433666737, 'edge_cap': 0.45745997222308094, 'bull_strategy': 'breakout', 'bull_bb_std_mult': 2.0915221547211016, 'bull_rsi_os': 29, 'bull_rsi_ob': 85, 'bull_adx_thresh': 28.32678050706999, 'bull_atr_min_pct': 0.004026087753447779, 'bull_atr_max_pct': 0.09102721182723258, 'bull_tp_mult': 1.4879068689205035, 'bull_tsl_mult': 0.9937044076772241, 'bull_time_stop': 50, 'bull_use_sma': False, 'bull_use_ema': False, 'bull_use_atr': False, 'bull_use_adx': True, 'bull_use_spike': True, 'bull_rsi_required': False, 'bear_strategy': 'mean_reversion', 'bear_bb_std_mult': 1.3136105302933396, 'bear_rsi_os': 43, 'bear_rsi_ob': 90, 'bear_adx_thresh': 20.385219580823055, 'bear_atr_min_pct': 0.020494084144303554, 'bear_atr_max_pct': 0.13821680084948607, 'bear_tp_mult': 1.6821664519010895, 'bear_tsl_mult': 0.08602423653999786, 'bear_time_stop': 160, 'bear_use_sma': True, 'bear_use_ema': False, 'bear_use_atr': True, 'bear_use_adx': False, 'bear_use_spike': True, 'bear_rsi_required': False, 'sideways_strategy': 'breakout', 'sideways_bb_std_mult': 3.0719203432649547, 'sideways_rsi_os': 29, 'sideways_rsi_ob': 65, 'sideways_adx_thresh': 15.471661507138668, 'sideways_atr_min_pct': 0.01971551557195505, 'sideways_atr_max_pct': 0.09786829526224379, 'sideways_tp_mult': 1.9646882936459835, 'sideways_tsl_mult': 0.030700735810122965, 'sideways_time_stop': 182, 'sideways_use_sma': True, 'sideways_use_ema': False, 'sideways_use_atr': False, 'sideways_use_adx': False, 'sideways_use_spike': False, 'sideways_rsi_required': True}.
[I 2025-09-01 10:54:35,780] Trial 76 finished with values: [-1000000000.0, 1000000000.0] and parameters: {'p_sma': 8, 'p_std': 46, 'p_atr': 17, 'p_adx': 27, 'rsi_period': 27, 'ema1': 19, 'ema2': 54, 'slip_atr_k': 0.03141669128189018, 'slip_spread_k': 0.22758677511217837, 'spread_hl_frac': 0.03685845827347911, 'bb_std_mult': 0.5333955740389279, 'rsi_os': 20, 'rsi_ob': 67, 'vol_spike': 0.09129708673433076, 'adx_thresh': 5.481599629166936, 'atr_min_pct': 0.02270218293863713, 'atr_max_pct': 0.07773916949011116, 'tp_mult': 1.4598700592548115, 'tsl_mult': 0.6406126488798997, 'strategy': 'breakout', 'time_stop': 144, 'use_sma': False, 'use_atr': True, 'use_adx': True, 'use_ema': True, 'use_spike': False, 'rsi_required': True, 'edge_k': 1.9047551529949884, 'edge_cap': 0.4512353314721999, 'bull_strategy': 'breakout', 'bull_bb_std_mult': 2.1326961096855404, 'bull_rsi_os': 29, 'bull_rsi_ob': 79, 'bull_adx_thresh': 28.34926213083044, 'bull_atr_min_pct': 0.003751591539266493, 'bull_atr_max_pct': 0.08793291649767984, 'bull_tp_mult': 1.4284792802242388, 'bull_tsl_mult': 0.9796632420861304, 'bull_time_stop': 46, 'bull_use_sma': False, 'bull_use_ema': False, 'bull_use_atr': False, 'bull_use_adx': True, 'bull_use_spike': True, 'bull_rsi_required': False, 'bear_strategy': 'mean_reversion', 'bear_bb_std_mult': 1.3090036762429378, 'bear_rsi_os': 43, 'bear_rsi_ob': 89, 'bear_adx_thresh': 22.795809612508975, 'bear_atr_min_pct': 0.020611091485981725, 'bear_atr_max_pct': 0.14007603051057774, 'bear_tp_mult': 1.6565993414377271, 'bear_tsl_mult': 0.14966142318297054, 'bear_time_stop': 165, 'bear_use_sma': True, 'bear_use_ema': False, 'bear_use_atr': True, 'bear_use_adx': False, 'bear_use_spike': True, 'bear_rsi_required': False, 'sideways_strategy': 'breakout', 'sideways_bb_std_mult': 3.080125079159621, 'sideways_rsi_os': 24, 'sideways_rsi_ob': 51, 'sideways_adx_thresh': 15.453360589571327, 'sideways_atr_min_pct': 0.018818514910077574, 'sideways_atr_max_pct': 0.13585281969386892, 'sideways_tp_mult': 1.969011317442528, 'sideways_tsl_mult': 0.0058615373034119345, 'sideways_time_stop': 114, 'sideways_use_sma': True, 'sideways_use_ema': False, 'sideways_use_atr': False, 'sideways_use_adx': False, 'sideways_use_spike': False, 'sideways_rsi_required': True}.
[I 2025-09-01 10:55:13,806] Trial 80 finished with values: [-1000000000.0, 1000000000.0] and parameters: {'p_sma': 8, 'p_std': 46, 'p_atr': 8, 'p_adx': 27, 'rsi_period': 27, 'ema1': 20, 'ema2': 57, 'slip_atr_k': 0.1379280915582181, 'slip_spread_k': 0.22976855336227545, 'spread_hl_frac': 0.008827680970757172, 'bb_std_mult': 0.7587673764511125, 'rsi_os': 25, 'rsi_ob': 68, 'vol_spike': 0.12994014566621723, 'adx_thresh': 5.118632830689775, 'atr_min_pct': 0.01838778475587145, 'atr_max_pct': 0.06952563529059728, 'tp_mult': 1.8391852959805155, 'tsl_mult': 0.5915475563704959, 'strategy': 'mean_reversion', 'time_stop': 139, 'use_sma': True, 'use_atr': True, 'use_adx': True, 'use_ema': True, 'use_spike': False, 'rsi_required': True, 'edge_k': 1.7082808537564562, 'edge_cap': 0.44594409357117604, 'bull_strategy': 'breakout', 'bull_bb_std_mult': 2.6569160224856, 'bull_rsi_os': 25, 'bull_rsi_ob': 85, 'bull_adx_thresh': 29.046950861947188, 'bull_atr_min_pct': 0.028500152618283627, 'bull_atr_max_pct': 0.10833430925790952, 'bull_tp_mult': 1.3753521254668994, 'bull_tsl_mult': 0.9947204991924408, 'bull_time_stop': 50, 'bull_use_sma': False, 'bull_use_ema': False, 'bull_use_atr': False, 'bull_use_adx': True, 'bull_use_spike': True, 'bull_rsi_required': False, 'bear_strategy': 'mean_reversion', 'bear_bb_std_mult': 0.6466908688703031, 'bear_rsi_os': 46, 'bear_rsi_ob': 91, 'bear_adx_thresh': 23.068663767742496, 'bear_atr_min_pct': 0.020186379270573672, 'bear_atr_max_pct': 0.14310508442405978, 'bear_tp_mult': 1.3225022440274126, 'bear_tsl_mult': 0.8136922129887633, 'bear_time_stop': 165, 'bear_use_sma': False, 'bear_use_ema': False, 'bear_use_atr': True, 'bear_use_adx': False, 'bear_use_spike': True, 'bear_rsi_required': False, 'sideways_strategy': 'breakout', 'sideways_bb_std_mult': 3.087599302114264, 'sideways_rsi_os': 24, 'sideways_rsi_ob': 51, 'sideways_adx_thresh': 19.643750642471698, 'sideways_atr_min_pct': 0.019247227066884035, 'sideways_atr_max_pct': 0.0973154259468028, 'sideways_tp_mult': 1.9810147372588347, 'sideways_tsl_mult': 0.0379755028968875, 'sideways_time_stop': 119, 'sideways_use_sma': True, 'sideways_use_ema': False, 'sideways_use_atr': False, 'sideways_use_adx': False, 'sideways_use_spike': False, 'sideways_rsi_required': True}.
