[I 2025-09-01 11:43:54,286] Trial 398 finished with values: [-1000000000.0, 1000000000.0] and parameters: {'p_sma': 10, 'p_std': 18, 'p_atr': 24, 'p_adx': 11, 'rsi_period': 52, 'ema1': 27, 'ema2': 17, 'slip_atr_k': 0.0059775220418306525, 'slip_spread_k': 0.4288530945009611, 'spread_hl_frac': 0.02886172084939017, 'bb_std_mult': 1.9872499015207266, 'rsi_os': 46, 'rsi_ob': 85, 'vol_spike': 0.23936241844453376, 'adx_thresh': 23.15752418845244, 'atr_min_pct': 0.003935230730734851, 'atr_max_pct': 0.035142262402552436, 'tp_mult': 2.2521830546405517, 'tsl_mult': 0.48624506454034033, 'strategy': 'breakout', 'time_stop': 199, 'use_sma': False, 'use_atr': False, 'use_adx': False, 'use_ema': False, 'use_spike': True, 'rsi_required': False, 'edge_k': 0.6489448761958962, 'edge_cap': 0.2590084363543977, 'bull_strategy': 'breakout', 'bull_bb_std_mult': 0.5666096060469896, 'bull_rsi_os': 38, 'bull_rsi_ob': 67, 'bull_adx_thresh': 12.553896289764355, 'bull_atr_min_pct': 0.0037141605222099773, 'bull_atr_max_pct': 0.14263699293922616, 'bull_tp_mult': 1.9286328751893642, 'bull_tsl_mult': 0.5357872609932124, 'bull_time_stop': 277, 'bull_use_sma': True, 'bull_use_ema': True, 'bull_use_atr': True, 'bull_use_adx': True, 'bull_use_spike': True, 'bull_rsi_required': False, 'bear_strategy': 'breakout', 'bear_bb_std_mult': 1.012866217656246, 'bear_rsi_os': 9, 'bear_rsi_ob': 74, 'bear_adx_thresh': 8.337568018036226, 'bear_atr_min_pct': 0.00454969784260853, 'bear_atr_max_pct': 0.035994826736673424, 'bear_tp_mult': 1.35682825336667, 'bear_tsl_mult': 0.9696118551824078, 'bear_time_stop': 62, 'bear_use_sma': True, 'bear_use_ema': True, 'bear_use_atr': False, 'bear_use_adx': False, 'bear_use_spike': True, 'bear_rsi_required': True, 'sideways_strategy': 'mean_reversion', 'sideways_bb_std_mult': 1.7266403340683552, 'sideways_rsi_os': 11, 'sideways_rsi_ob': 62, 'sideways_adx_thresh': 5.556590769296314, 'sideways_atr_min_pct': 0.024364491857962453, 'sideways_atr_max_pct': 0.11612899292953412, 'sideways_tp_mult': 1.4716349946721423, 'sideways_tsl_mult': 0.2213945854036542, 'sideways_time_stop': 242, 'sideways_use_sma': True, 'sideways_use_ema': False, 'sideways_use_atr': True, 'sideways_use_adx': False, 'sideways_use_spike': False, 'sideways_rsi_required': True}.
[I 2025-09-01 11:43:54,659] Trial 396 finished with values: [-1000000000.0, 1000000000.0] and parameters: {'p_sma': 31, 'p_std': 36, 'p_atr': 15, 'p_adx': 11, 'rsi_period': 22, 'ema1': 20, 'ema2': 17, 'slip_atr_k': 0.006869645022506054, 'slip_spread_k': 0.34880471493319565, 'spread_hl_frac': 0.04190196031464401, 'bb_std_mult': 3.381868043508998, 'rsi_os': 49, 'rsi_ob': 85, 'vol_spike': 0.2728202134382241, 'adx_thresh': 23.013607058454337, 'atr_min_pct': 0.004771518669998557, 'atr_max_pct': 0.02693596612847922, 'tp_mult': 1.5957828694043832, 'tsl_mult': 0.8656940648068479, 'strategy': 'breakout', 'time_stop': 258, 'use_sma': False, 'use_atr': False, 'use_adx': False, 'use_ema': True, 'use_spike': True, 'rsi_required': False, 'edge_k': 1.4419501308153604, 'edge_cap': 0.6722113080710586, 'bull_strategy': 'breakout', 'bull_bb_std_mult': 0.687586596176941, 'bull_rsi_os': 37, 'bull_rsi_ob': 80, 'bull_adx_thresh': 12.826386061022664, 'bull_atr_min_pct': 0.02294647466811809, 'bull_atr_max_pct': 0.09839810972323501, 'bull_tp_mult': 2.05596080952693, 'bull_tsl_mult': 0.5533655638086601, 'bull_time_stop': 293, 'bull_use_sma': True, 'bull_use_ema': True, 'bull_use_atr': True, 'bull_use_adx': True, 'bull_use_spike': True, 'bull_rsi_required': False, 'bear_strategy': 'breakout', 'bear_bb_std_mult': 2.2879249917607836, 'bear_rsi_os': 9, 'bear_rsi_ob': 48, 'bear_adx_thresh': 8.351318570552346, 'bear_atr_min_pct': 0.0049737610141867145, 'bear_atr_max_pct': 0.11460275306536441, 'bear_tp_mult': 1.1097123312823172, 'bear_tsl_mult': 0.9681669092877574, 'bear_time_stop': 62, 'bear_use_sma': True, 'bear_use_ema': True, 'bear_use_atr': False, 'bear_use_adx': False, 'bear_use_spike': True, 'bear_rsi_required': True, 'sideways_strategy': 'mean_reversion', 'sideways_bb_std_mult': 1.7157069232288944, 'sideways_rsi_os': 10, 'sideways_rsi_ob': 62, 'sideways_adx_thresh': 5.609072340310827, 'sideways_atr_min_pct': 0.024278634893482753, 'sideways_atr_max_pct': 0.08627329096538712, 'sideways_tp_mult': 1.413463040072987, 'sideways_tsl_mult': 0.4547304998368754, 'sideways_time_stop': 259, 'sideways_use_sma': True, 'sideways_use_ema': False, 'sideways_use_atr': True, 'sideways_use_adx': False, 'sideways_use_spike': False, 'sideways_rsi_required': True}.
[I 2025-09-01 11:43:54,942] Trial 395 finished with values: [-0.06529643355891768, 0.06553911391876373] and parameters: {'p_sma': 55, 'p_std': 51, 'p_atr': 15, 'p_adx': 11, 'rsi_period': 82, 'ema1': 20, 'ema2': 17, 'slip_atr_k': 0.2220517721332949, 'slip_spread_k': 0.3402141646539219, 'spread_hl_frac': 0.018860918457914752, 'bb_std_mult': 3.3778044461146033, 'rsi_os': 35, 'rsi_ob': 66, 'vol_spike': 0.2720315266822671, 'adx_thresh': 26.265577661683267, 'atr_min_pct': 0.004223324509561534, 'atr_max_pct': 0.025823647973001906, 'tp_mult': 2.949953186705707, 'tsl_mult': 0.17443983619237524, 'strategy': 'breakout', 'time_stop': 259, 'use_sma': False, 'use_atr': False, 'use_adx': False, 'use_ema': True, 'use_spike': True, 'rsi_required': False, 'edge_k': 0.32980907768989787, 'edge_cap': 0.8691082256590683, 'bull_strategy': 'breakout', 'bull_bb_std_mult': 0.7370598402628283, 'bull_rsi_os': 37, 'bull_rsi_ob': 69, 'bull_adx_thresh': 15.137894404850055, 'bull_atr_min_pct': 0.004951377091051901, 'bull_atr_max_pct': 0.09795116949772609, 'bull_tp_mult': 2.043905772877984, 'bull_tsl_mult': 0.5497188701915311, 'bull_time_stop': 293, 'bull_use_sma': True, 'bull_use_ema': True, 'bull_use_atr': True, 'bull_use_adx': True, 'bull_use_spike': True, 'bull_rsi_required': False, 'bear_strategy': 'breakout', 'bear_bb_std_mult': 1.0521002879915333, 'bear_rsi_os': 24, 'bear_rsi_ob': 48, 'bear_adx_thresh': 8.399974140115383, 'bear_atr_min_pct': 0.0018122744713505792, 'bear_atr_max_pct': 0.1285111576907808, 'bear_tp_mult': 1.3399019400708672, 'bear_tsl_mult': 0.43327441792493515, 'bear_time_stop': 74, 'bear_use_sma': True, 'bear_use_ema': True, 'bear_use_atr': False, 'bear_use_adx': False, 'bear_use_spike': True, 'bear_rsi_required': True, 'sideways_strategy': 'mean_reversion', 'sideways_bb_std_mult': 1.7225280492476749, 'sideways_rsi_os': 10, 'sideways_rsi_ob': 54, 'sideways_adx_thresh': 5.657438213278472, 'sideways_atr_min_pct': 0.0241456123226736, 'sideways_atr_max_pct': 0.08636900426296987, 'sideways_tp_mult': 1.3989663503195893, 'sideways_tsl_mult': 0.453440569712798, 'sideways_time_stop': 241, 'sideways_use_sma': True, 'sideways_use_ema': False, 'sideways_use_atr': True, 'sideways_use_adx': False, 'sideways_use_spike': False, 'sideways_rsi_required': True}.
[I 2025-09-01 11:43:55,594] Trial 399 finished with values: [-1000000000.0, 1000000000.0] and parameters: {'p_sma': 10, 'p_std': 36, 'p_atr': 20, 'p_adx': 10, 'rsi_period': 22, 'ema1': 20, 'ema2': 49, 'slip_atr_k': 0.007081852277286638, 'slip_spread_k': 0.42824811435504884, 'spread_hl_frac': 0.04346717712147314, 'bb_std_mult': 3.225484233454504, 'rsi_os': 35, 'rsi_ob': 89, 'vol_spike': 0.2546668862916006, 'adx_thresh': 31.68911395036539, 'atr_min_pct': 0.028083151520350933, 'atr_max_pct': 0.025391634637108064, 'tp_mult': 1.349927204355891, 'tsl_mult': 0.9216095699465411, 'strategy': 'breakout', 'time_stop': 146, 'use_sma': False, 'use_atr': False, 'use_adx': False, 'use_ema': True, 'use_spike': True, 'rsi_required': False, 'edge_k': 1.7041148560586108, 'edge_cap': 0.25479354708475654, 'bull_strategy': 'breakout', 'bull_bb_std_mult': 0.7487960676192416, 'bull_rsi_os': 55, 'bull_rsi_ob': 80, 'bull_adx_thresh': 16.056434653694993, 'bull_atr_min_pct': 0.012942702854838246, 'bull_atr_max_pct': 0.07689967651386129, 'bull_tp_mult': 2.1286982024510577, 'bull_tsl_mult': 0.5636462547532699, 'bull_time_stop': 277, 'bull_use_sma': True, 'bull_use_ema': True, 'bull_use_atr': True, 'bull_use_adx': True, 'bull_use_spike': True, 'bull_rsi_required': False, 'bear_strategy': 'breakout', 'bear_bb_std_mult': 0.9979266068413915, 'bear_rsi_os': 24, 'bear_rsi_ob': 59, 'bear_adx_thresh': 9.304250197390473, 'bear_atr_min_pct': 0.016917898981408948, 'bear_atr_max_pct': 0.11285888126307925, 'bear_tp_mult': 1.348352111088471, 'bear_tsl_mult': 0.9103201074428672, 'bear_time_stop': 76, 'bear_use_sma': True, 'bear_use_ema': True, 'bear_use_atr': False, 'bear_use_adx': False, 'bear_use_spike': True, 'bear_rsi_required': True, 'sideways_strategy': 'mean_reversion', 'sideways_bb_std_mult': 1.7345669870228286, 'sideways_rsi_os': 39, 'sideways_rsi_ob': 77, 'sideways_adx_thresh': 8.134290074889254, 'sideways_atr_min_pct': 0.02227572411457887, 'sideways_atr_max_pct': 0.11542205824795704, 'sideways_tp_mult': 1.420897660364566, 'sideways_tsl_mult': 0.3835799007755361, 'sideways_time_stop': 259, 'sideways_use_sma': False, 'sideways_use_ema': True, 'sideways_use_atr': True, 'sideways_use_adx': True, 'sideways_use_spike': True, 'sideways_rsi_required': True}.
[I 2025-09-01 11:44:35,495] Trial 402 finished with values: [-0.08706340830853332, 0.08686809480341487] and parameters: {'p_sma': 10, 'p_std': 39, 'p_atr': 20, 'p_adx': 10, 'rsi_period': 50, 'ema1': 10, 'ema2': 49, 'slip_atr_k': 0.2159055233635459, 'slip_spread_k': 0.39251546711030944, 'spread_hl_frac': 0.03809103528094645, 'bb_std_mult': 3.2750548382579985, 'rsi_os': 28, 'rsi_ob': 89, 'vol_spike': 0.1662609130194623, 'adx_thresh': 31.870913840299075, 'atr_min_pct': 0.021322215743035722, 'atr_max_pct': 0.09929098887669252, 'tp_mult': 2.1133040349928716, 'tsl_mult': 0.0027088824037940773, 'strategy': 'breakout', 'time_stop': 276, 'use_sma': False, 'use_atr': True, 'use_adx': True, 'use_ema': True, 'use_spike': False, 'rsi_required': False, 'edge_k': 0.2881784784158215, 'edge_cap': 0.19069250769732554, 'bull_strategy': 'mean_reversion', 'bull_bb_std_mult': 1.7556138917265338, 'bull_rsi_os': 49, 'bull_rsi_ob': 75, 'bull_adx_thresh': 16.161199043644743, 'bull_atr_min_pct': 0.013340945932777796, 'bull_atr_max_pct': 0.10015314267447353, 'bull_tp_mult': 1.2483447657503022, 'bull_tsl_mult': 0.5674350583573134, 'bull_time_stop': 283, 'bull_use_sma': False, 'bull_use_ema': False, 'bull_use_atr': True, 'bull_use_adx': False, 'bull_use_spike': False, 'bull_rsi_required': False, 'bear_strategy': 'breakout', 'bear_bb_std_mult': 1.1470806031405698, 'bear_rsi_os': 20, 'bear_rsi_ob': 49, 'bear_adx_thresh': 9.429709479516955, 'bear_atr_min_pct': 7.500353148510476e-05, 'bear_atr_max_pct': 0.11171360509634898, 'bear_tp_mult': 1.4412142991540215, 'bear_tsl_mult': 0.9063077936707082, 'bear_time_stop': 78, 'bear_use_sma': True, 'bear_use_ema': False, 'bear_use_atr': True, 'bear_use_adx': True, 'bear_use_spike': True, 'bear_rsi_required': True, 'sideways_strategy': 'breakout', 'sideways_bb_std_mult': 1.8798988099306193, 'sideways_rsi_os': 43, 'sideways_rsi_ob': 92, 'sideways_adx_thresh': 6.576314364035204, 'sideways_atr_min_pct': 0.022461216247893708, 'sideways_atr_max_pct': 0.08198732422180262, 'sideways_tp_mult': 1.3273963966113074, 'sideways_tsl_mult': 0.2716149085865297, 'sideways_time_stop': 228, 'sideways_use_sma': False, 'sideways_use_ema': True, 'sideways_use_atr': True, 'sideways_use_adx': True, 'sideways_use_spike': True, 'sideways_rsi_required': False}.
[I 2025-09-01 11:44:36,139] Trial 401 finished with values: [-1000000000.0, 1000000000.0] and parameters: {'p_sma': 27, 'p_std': 39, 'p_atr': 16, 'p_adx': 10, 'rsi_period': 50, 'ema1': 24, 'ema2': 25, 'slip_atr_k': 0.0002961227490426172, 'slip_spread_k': 0.39538952037765257, 'spread_hl_frac': 0.009927732832716635, 'bb_std_mult': 3.2468898135390067, 'rsi_os': 28, 'rsi_ob': 90, 'vol_spike': 0.2546849738508277, 'adx_thresh': 31.777335940069257, 'atr_min_pct': 0.0007507515737054191, 'atr_max_pct': 0.033573140636361916, 'tp_mult': 2.122710054074647, 'tsl_mult': 0.958226568460659, 'strategy': 'breakout', 'time_stop': 276, 'use_sma': False, 'use_atr': True, 'use_adx': True, 'use_ema': True, 'use_spike': False, 'rsi_required': False, 'edge_k': 0.28007012665910036, 'edge_cap': 0.23657509590739093, 'bull_strategy': 'mean_reversion', 'bull_bb_std_mult': 1.652772443041989, 'bull_rsi_os': 21, 'bull_rsi_ob': 85, 'bull_adx_thresh': 16.297598151114332, 'bull_atr_min_pct': 0.01848114183558529, 'bull_atr_max_pct': 0.06539702357751082, 'bull_tp_mult': 2.130628928454483, 'bull_tsl_mult': 0.5713067745797847, 'bull_time_stop': 285, 'bull_use_sma': False, 'bull_use_ema': False, 'bull_use_atr': True, 'bull_use_adx': False, 'bull_use_spike': False, 'bull_rsi_required': False, 'bear_strategy': 'breakout', 'bear_bb_std_mult': 1.1584392197581244, 'bear_rsi_os': 15, 'bear_rsi_ob': 81, 'bear_adx_thresh': 19.02520059716436, 'bear_atr_min_pct': 0.0036327758968920333, 'bear_atr_max_pct': 0.05681720562556435, 'bear_tp_mult': 1.4385664158983118, 'bear_tsl_mult': 0.9014691150770655, 'bear_time_stop': 78, 'bear_use_sma': True, 'bear_use_ema': True, 'bear_use_atr': True, 'bear_use_adx': True, 'bear_use_spike': True, 'bear_rsi_required': True, 'sideways_strategy': 'breakout', 'sideways_bb_std_mult': 1.867223914856204, 'sideways_rsi_os': 34, 'sideways_rsi_ob': 91, 'sideways_adx_thresh': 19.17460437669559, 'sideways_atr_min_pct': 0.022374785830027718, 'sideways_atr_max_pct': 0.1334704835638154, 'sideways_tp_mult': 2.8819734749649366, 'sideways_tsl_mult': 0.39791504631617075, 'sideways_time_stop': 233, 'sideways_use_sma': False, 'sideways_use_ema': True, 'sideways_use_atr': True, 'sideways_use_adx': True, 'sideways_use_spike': True, 'sideways_rsi_required': True}.
[I 2025-09-01 11:44:36,468] Trial 400 finished with values: [-1000000000.0, 1000000000.0] and parameters: {'p_sma': 27, 'p_std': 34, 'p_atr': 20, 'p_adx': 10, 'rsi_period': 72, 'ema1': 24, 'ema2': 16, 'slip_atr_k': 0.007993150679245269, 'slip_spread_k': 0.8326289798036122, 'spread_hl_frac': 0.0376205823500168, 'bb_std_mult': 3.209700030090075, 'rsi_os': 49, 'rsi_ob': 86, 'vol_spike': 0.28291917095494806, 'adx_thresh': 13.894777623044842, 'atr_min_pct': 0.018611339474558453, 'atr_max_pct': 0.0769783205257015, 'tp_mult': 1.33283174509726, 'tsl_mult': 0.8660704541518124, 'strategy': 'breakout', 'time_stop': 147, 'use_sma': False, 'use_atr': False, 'use_adx': False, 'use_ema': True, 'use_spike': True, 'rsi_required': False, 'edge_k': 0.28829689727343333, 'edge_cap': 0.19106765459469605, 'bull_strategy': 'breakout', 'bull_bb_std_mult': 0.7664408279248877, 'bull_rsi_os': 50, 'bull_rsi_ob': 86, 'bull_adx_thresh': 5.879637165877553, 'bull_atr_min_pct': 0.02019933085711893, 'bull_atr_max_pct': 0.10112781165247652, 'bull_tp_mult': 1.7947276142752444, 'bull_tsl_mult': 0.5660106957883815, 'bull_time_stop': 294, 'bull_use_sma': True, 'bull_use_ema': True, 'bull_use_atr': True, 'bull_use_adx': True, 'bull_use_spike': True, 'bull_rsi_required': False, 'bear_strategy': 'breakout', 'bear_bb_std_mult': 2.2151770808236506, 'bear_rsi_os': 24, 'bear_rsi_ob': 65, 'bear_adx_thresh': 29.320035946599415, 'bear_atr_min_pct': 0.0002262228317289599, 'bear_atr_max_pct': 0.06643962988750697, 'bear_tp_mult': 2.060882321988182, 'bear_tsl_mult': 0.916000701396736, 'bear_time_stop': 75, 'bear_use_sma': True, 'bear_use_ema': True, 'bear_use_atr': False, 'bear_use_adx': False, 'bear_use_spike': True, 'bear_rsi_required': True, 'sideways_strategy': 'mean_reversion', 'sideways_bb_std_mult': 1.866257951085561, 'sideways_rsi_os': 34, 'sideways_rsi_ob': 54, 'sideways_adx_thresh': 8.188721647335388, 'sideways_atr_min_pct': 0.022286557593248067, 'sideways_atr_max_pct': 0.08157169469416221, 'sideways_tp_mult': 2.7698912069133046, 'sideways_tsl_mult': 0.3921693583098571, 'sideways_time_stop': 86, 'sideways_use_sma': False, 'sideways_use_ema': True, 'sideways_use_atr': True, 'sideways_use_adx': True, 'sideways_use_spike': True, 'sideways_rsi_required': True}.
[I 2025-09-01 11:44:36,800] Trial 403 finished with values: [0.0034156821043980212, 0.004860832767150902] and parameters: {'p_sma': 26, 'p_std': 34, 'p_atr': 19, 'p_adx': 9, 'rsi_period': 50, 'ema1': 24, 'ema2': 16, 'slip_atr_k': 0.015157750975795085, 'slip_spread_k': 0.40192680552705057, 'spread_hl_frac': 0.0012460918674379942, 'bb_std_mult': 0.9318182927672658, 'rsi_os': 28, 'rsi_ob': 86, 'vol_spike': 0.2057821266392257, 'adx_thresh': 22.455768083186868, 'atr_min_pct': 0.024419948352801337, 'atr_max_pct': 0.07623376517861939, 'tp_mult': 2.117241279276684, 'tsl_mult': 0.08723075301104383, 'strategy': 'breakout', 'time_stop': 183, 'use_sma': False, 'use_atr': True, 'use_adx': True, 'use_ema': True, 'use_spike': False, 'rsi_required': False, 'edge_k': 0.30010218112160547, 'edge_cap': 0.19088524271385435, 'bull_strategy': 'mean_reversion', 'bull_bb_std_mult': 1.6493203625684176, 'bull_rsi_os': 49, 'bull_rsi_ob': 50, 'bull_adx_thresh': 5.85637765958619, 'bull_atr_min_pct': 0.018336919665902902, 'bull_atr_max_pct': 0.1040377958340527, 'bull_tp_mult': 1.34611643888529, 'bull_tsl_mult': 0.5999022589928684, 'bull_time_stop': 284, 'bull_use_sma': False, 'bull_use_ema': False, 'bull_use_atr': True, 'bull_use_adx': False, 'bull_use_spike': False, 'bull_rsi_required': False, 'bear_strategy': 'breakout', 'bear_bb_std_mult': 1.1690092636960294, 'bear_rsi_os': 26, 'bear_rsi_ob': 49, 'bear_adx_thresh': 9.268346989155765, 'bear_atr_min_pct': 0.0037268983045528484, 'bear_atr_max_pct': 0.02748277649833346, 'bear_tp_mult': 1.4789367909195363, 'bear_tsl_mult': 0.9853390304991887, 'bear_time_stop': 67, 'bear_use_sma': True, 'bear_use_ema': False, 'bear_use_atr': True, 'bear_use_adx': True, 'bear_use_spike': False, 'bear_rsi_required': True, 'sideways_strategy': 'breakout', 'sideways_bb_std_mult': 1.8731811610271585, 'sideways_rsi_os': 40, 'sideways_rsi_ob': 91, 'sideways_adx_thresh': 32.91913479130652, 'sideways_atr_min_pct': 0.02352473693010593, 'sideways_atr_max_pct': 0.1344812999282917, 'sideways_tp_mult': 2.759744394090502, 'sideways_tsl_mult': 0.3902638597357524, 'sideways_time_stop': 83, 'sideways_use_sma': False, 'sideways_use_ema': True, 'sideways_use_atr': True, 'sideways_use_adx': True, 'sideways_use_spike': True, 'sideways_rsi_required': False}.
[I 2025-09-01 11:45:19,187] Trial 405 finished with values: [-1000000000.0, 1000000000.0] and parameters: {'p_sma': 29, 'p_std': 45, 'p_atr': 19, 'p_adx': 9, 'rsi_period': 26, 'ema1': 5, 'ema2': 16, 'slip_atr_k': 0.24988513726640157, 'slip_spread_k': 0.9327190647022522, 'spread_hl_frac': 0.02048912306960743, 'bb_std_mult': 3.0586995283290923, 'rsi_os': 32, 'rsi_ob': 79, 'vol_spike': 0.28183520853540917, 'adx_thresh': 11.581064654113122, 'atr_min_pct': 0.02411787217984713, 'atr_max_pct': 0.029324481547085373, 'tp_mult': 2.2409595333206167, 'tsl_mult': 0.9007914480349701, 'strategy': 'breakout', 'time_stop': 179, 'use_sma': False, 'use_atr': False, 'use_adx': False, 'use_ema': False, 'use_spike': True, 'rsi_required': False, 'edge_k': 0.40272747557230204, 'edge_cap': 0.279938030203874, 'bull_strategy': 'breakout', 'bull_bb_std_mult': 0.5745545280405656, 'bull_rsi_os': 51, 'bull_rsi_ob': 49, 'bull_adx_thresh': 5.826256526353987, 'bull_atr_min_pct': 0.020134289177696222, 'bull_atr_max_pct': 0.10332590202305704, 'bull_tp_mult': 1.3532732948447026, 'bull_tsl_mult': 0.5191601413369835, 'bull_time_stop': 284, 'bull_use_sma': True, 'bull_use_ema': True, 'bull_use_atr': False, 'bull_use_adx': True, 'bull_use_spike': True, 'bull_rsi_required': True, 'bear_strategy': 'mean_reversion', 'bear_bb_std_mult': 0.958511089023623, 'bear_rsi_os': 19, 'bear_rsi_ob': 47, 'bear_adx_thresh': 9.296130979981989, 'bear_atr_min_pct': 0.003669782780352722, 'bear_atr_max_pct': 0.027546691150671168, 'bear_tp_mult': 1.2115730858040739, 'bear_tsl_mult': 0.9878521784563243, 'bear_time_stop': 69, 'bear_use_sma': True, 'bear_use_ema': True, 'bear_use_atr': False, 'bear_use_adx': False, 'bear_use_spike': False, 'bear_rsi_required': True, 'sideways_strategy': 'mean_reversion', 'sideways_bb_std_mult': 1.8084850090784033, 'sideways_rsi_os': 37, 'sideways_rsi_ob': 93, 'sideways_adx_thresh': 6.464385081228178, 'sideways_atr_min_pct': 0.014488944264110255, 'sideways_atr_max_pct': 0.08230110563386432, 'sideways_tp_mult': 2.801874807420806, 'sideways_tsl_mult': 0.4094583783965396, 'sideways_time_stop': 248, 'sideways_use_sma': True, 'sideways_use_ema': True, 'sideways_use_atr': True, 'sideways_use_adx': False, 'sideways_use_spike': False, 'sideways_rsi_required': True}.
