[I 2025-09-01 12:07:37,948] Trial 531 finished with values: [-1000000000.0, 1000000000.0] and parameters: {'p_sma': 28, 'p_std': 34, 'p_atr': 12, 'p_adx': 8, 'rsi_period': 84, 'ema1': 26, 'ema2': 26, 'slip_atr_k': 0.12304249771312468, 'slip_spread_k': 0.3841700037228714, 'spread_hl_frac': 0.0024264783663241174, 'bb_std_mult': 1.650305581847321, 'rsi_os': 45, 'rsi_ob': 51, 'vol_spike': 0.020402998927448207, 'adx_thresh': 21.55554286978426, 'atr_min_pct': 0.010980972182141674, 'atr_max_pct': 0.08156140704065296, 'tp_mult': 2.1426796481631722, 'tsl_mult': 0.09722171171629979, 'strategy': 'breakout', 'time_stop': 221, 'use_sma': False, 'use_atr': True, 'use_adx': True, 'use_ema': False, 'use_spike': False, 'rsi_required': False, 'edge_k': 1.0607953761386246, 'edge_cap': 0.6528040939574742, 'bull_strategy': 'mean_reversion', 'bull_bb_std_mult': 1.3848027762769717, 'bull_rsi_os': 52, 'bull_rsi_ob': 48, 'bull_adx_thresh': 21.496263683288007, 'bull_atr_min_pct': 0.029111849164230916, 'bull_atr_max_pct': 0.11300175177464294, 'bull_tp_mult': 1.1249396732442145, 'bull_tsl_mult': 0.14698714640860028, 'bull_time_stop': 73, 'bull_use_sma': False, 'bull_use_ema': False, 'bull_use_atr': True, 'bull_use_adx': False, 'bull_use_spike': False, 'bull_rsi_required': False, 'bear_strategy': 'breakout', 'bear_bb_std_mult': 1.422132442426129, 'bear_rsi_os': 51, 'bear_rsi_ob': 82, 'bear_adx_thresh': 25.278177236828242, 'bear_atr_min_pct': 0.004939111726482577, 'bear_atr_max_pct': 0.029895527940056052, 'bear_tp_mult': 1.4452781548966476, 'bear_tsl_mult': 0.6862976838073374, 'bear_time_stop': 273, 'bear_use_sma': True, 'bear_use_ema': False, 'bear_use_atr': True, 'bear_use_adx': True, 'bear_use_spike': False, 'bear_rsi_required': True, 'sideways_strategy': 'breakout', 'sideways_bb_std_mult': 2.097277501529291, 'sideways_rsi_os': 38, 'sideways_rsi_ob': 89, 'sideways_adx_thresh': 32.89092343232785, 'sideways_atr_min_pct': 0.00800957362513903, 'sideways_atr_max_pct': 0.12650865625771798, 'sideways_tp_mult': 2.7578189709170835, 'sideways_tsl_mult': 0.3132591361579372, 'sideways_time_stop': 98, 'sideways_use_sma': False, 'sideways_use_ema': False, 'sideways_use_atr': True, 'sideways_use_adx': True, 'sideways_use_spike': True, 'sideways_rsi_required': False}.
[I 2025-09-01 12:08:16,942] Trial 534 finished with values: [-1000000000.0, 1000000000.0] and parameters: {'p_sma': 36, 'p_std': 35, 'p_atr': 20, 'p_adx': 15, 'rsi_period': 45, 'ema1': 9, 'ema2': 15, 'slip_atr_k': 0.08831327532379976, 'slip_spread_k': 0.5355497649857667, 'spread_hl_frac': 0.004872701308409962, 'bb_std_mult': 0.8553064531528461, 'rsi_os': 15, 'rsi_ob': 47, 'vol_spike': 0.1884441325747379, 'adx_thresh': 22.59089647801242, 'atr_min_pct': 0.024689486848531523, 'atr_max_pct': 0.07830771159927924, 'tp_mult': 2.148956970760018, 'tsl_mult': 0.07125918347074886, 'strategy': 'breakout', 'time_stop': 162, 'use_sma': False, 'use_atr': True, 'use_adx': True, 'use_ema': True, 'use_spike': False, 'rsi_required': False, 'edge_k': 0.09659318798619466, 'edge_cap': 0.8470642828784252, 'bull_strategy': 'mean_reversion', 'bull_bb_std_mult': 1.4229760146986186, 'bull_rsi_os': 35, 'bull_rsi_ob': 48, 'bull_adx_thresh': 6.531805514887313, 'bull_atr_min_pct': 0.015773938824764435, 'bull_atr_max_pct': 0.013742581248606, 'bull_tp_mult': 1.2928912702169502, 'bull_tsl_mult': 0.561610771722078, 'bull_time_stop': 153, 'bull_use_sma': False, 'bull_use_ema': False, 'bull_use_atr': False, 'bull_use_adx': False, 'bull_use_spike': False, 'bull_rsi_required': True, 'bear_strategy': 'mean_reversion', 'bear_bb_std_mult': 1.2793821059325274, 'bear_rsi_os': 25, 'bear_rsi_ob': 59, 'bear_adx_thresh': 23.233731863601143, 'bear_atr_min_pct': 0.003494925568219527, 'bear_atr_max_pct': 0.02720964001670281, 'bear_tp_mult': 1.5218488394096783, 'bear_tsl_mult': 0.6920988572676996, 'bear_time_stop': 193, 'bear_use_sma': True, 'bear_use_ema': False, 'bear_use_atr': True, 'bear_use_adx': True, 'bear_use_spike': False, 'bear_rsi_required': True, 'sideways_strategy': 'breakout', 'sideways_bb_std_mult': 2.12994859436364, 'sideways_rsi_os': 39, 'sideways_rsi_ob': 64, 'sideways_adx_thresh': 33.14512198892302, 'sideways_atr_min_pct': 0.005103996146884855, 'sideways_atr_max_pct': 0.13171353254563264, 'sideways_tp_mult': 2.620690144714873, 'sideways_tsl_mult': 0.5881693098397882, 'sideways_time_stop': 93, 'sideways_use_sma': False, 'sideways_use_ema': False, 'sideways_use_atr': True, 'sideways_use_adx': True, 'sideways_use_spike': True, 'sideways_rsi_required': False}.
[I 2025-09-01 12:08:17,222] Trial 532 finished with values: [-1000000000.0, 1000000000.0] and parameters: {'p_sma': 25, 'p_std': 35, 'p_atr': 16, 'p_adx': 7, 'rsi_period': 45, 'ema1': 26, 'ema2': 15, 'slip_atr_k': 0.12394180696860398, 'slip_spread_k': 0.39450765215847133, 'spread_hl_frac': 0.007291106424381889, 'bb_std_mult': 0.8476271891525273, 'rsi_os': 45, 'rsi_ob': 73, 'vol_spike': 0.21222357086806423, 'adx_thresh': 22.65686565328513, 'atr_min_pct': 0.01098929834968862, 'atr_max_pct': 0.07858493414253358, 'tp_mult': 2.148475108214818, 'tsl_mult': 0.16600518500277314, 'strategy': 'breakout', 'time_stop': 108, 'use_sma': False, 'use_atr': True, 'use_adx': True, 'use_ema': True, 'use_spike': False, 'rsi_required': False, 'edge_k': 0.09411493599384614, 'edge_cap': 0.8386117136620399, 'bull_strategy': 'mean_reversion', 'bull_bb_std_mult': 0.9314003743086825, 'bull_rsi_os': 42, 'bull_rsi_ob': 48, 'bull_adx_thresh': 5.821990427650596, 'bull_atr_min_pct': 0.015974841145901315, 'bull_atr_max_pct': 0.11226059961834751, 'bull_tp_mult': 1.1375104805526064, 'bull_tsl_mult': 0.17454828385991578, 'bull_time_stop': 154, 'bull_use_sma': False, 'bull_use_ema': False, 'bull_use_atr': False, 'bull_use_adx': False, 'bull_use_spike': False, 'bull_rsi_required': True, 'bear_strategy': 'mean_reversion', 'bear_bb_std_mult': 3.5448673553484817, 'bear_rsi_os': 26, 'bear_rsi_ob': 53, 'bear_adx_thresh': 9.760127997269569, 'bear_atr_min_pct': 0.0066436614723555144, 'bear_atr_max_pct': 0.08804325619651096, 'bear_tp_mult': 1.4482313322218823, 'bear_tsl_mult': 0.4678781626150428, 'bear_time_stop': 273, 'bear_use_sma': True, 'bear_use_ema': False, 'bear_use_atr': True, 'bear_use_adx': True, 'bear_use_spike': False, 'bear_rsi_required': True, 'sideways_strategy': 'breakout', 'sideways_bb_std_mult': 2.1332417306799507, 'sideways_rsi_os': 38, 'sideways_rsi_ob': 88, 'sideways_adx_thresh': 32.92734720476776, 'sideways_atr_min_pct': 0.009804329664128808, 'sideways_atr_max_pct': 0.12729454065755558, 'sideways_tp_mult': 2.6732281256103407, 'sideways_tsl_mult': 0.3770882741306753, 'sideways_time_stop': 93, 'sideways_use_sma': False, 'sideways_use_ema': False, 'sideways_use_atr': True, 'sideways_use_adx': True, 'sideways_use_spike': True, 'sideways_rsi_required': False}.
[I 2025-09-01 12:08:17,617] Trial 533 finished with values: [-1000000000.0, 1000000000.0] and parameters: {'p_sma': 23, 'p_std': 35, 'p_atr': 16, 'p_adx': 22, 'rsi_period': 45, 'ema1': 30, 'ema2': 26, 'slip_atr_k': 0.02929391145568187, 'slip_spread_k': 0.5284404533261607, 'spread_hl_frac': 0.00780412522969098, 'bb_std_mult': 0.9068045480033977, 'rsi_os': 5, 'rsi_ob': 49, 'vol_spike': 0.18693677137474057, 'adx_thresh': 32.65838436658029, 'atr_min_pct': 0.02187201688037126, 'atr_max_pct': 0.07820778542673482, 'tp_mult': 2.153010230235087, 'tsl_mult': 0.07264305576989252, 'strategy': 'breakout', 'time_stop': 162, 'use_sma': False, 'use_atr': True, 'use_adx': True, 'use_ema': True, 'use_spike': False, 'rsi_required': False, 'edge_k': 0.9361455310775584, 'edge_cap': 0.6545632326035999, 'bull_strategy': 'mean_reversion', 'bull_bb_std_mult': 1.8228941309878008, 'bull_rsi_os': 6, 'bull_rsi_ob': 48, 'bull_adx_thresh': 32.79950320339404, 'bull_atr_min_pct': 0.015720446624836047, 'bull_atr_max_pct': 0.014328102283405489, 'bull_tp_mult': 1.2806073614648854, 'bull_tsl_mult': 0.550915892302353, 'bull_time_stop': 169, 'bull_use_sma': False, 'bull_use_ema': False, 'bull_use_atr': False, 'bull_use_adx': False, 'bull_use_spike': False, 'bull_rsi_required': True, 'bear_strategy': 'mean_reversion', 'bear_bb_std_mult': 0.5191468006075814, 'bear_rsi_os': 26, 'bear_rsi_ob': 94, 'bear_adx_thresh': 23.395780544999546, 'bear_atr_min_pct': 0.02848509327408455, 'bear_atr_max_pct': 0.027665568299094407, 'bear_tp_mult': 1.522566490893161, 'bear_tsl_mult': 0.683392843618621, 'bear_time_stop': 272, 'bear_use_sma': True, 'bear_use_ema': False, 'bear_use_atr': True, 'bear_use_adx': True, 'bear_use_spike': False, 'bear_rsi_required': True, 'sideways_strategy': 'breakout', 'sideways_bb_std_mult': 2.147221300243168, 'sideways_rsi_os': 38, 'sideways_rsi_ob': 88, 'sideways_adx_thresh': 32.841870598395516, 'sideways_atr_min_pct': 0.00997405601902045, 'sideways_atr_max_pct': 0.12716677050726477, 'sideways_tp_mult': 1.2001873779555698, 'sideways_tsl_mult': 0.3069141266643484, 'sideways_time_stop': 96, 'sideways_use_sma': False, 'sideways_use_ema': False, 'sideways_use_atr': True, 'sideways_use_adx': True, 'sideways_use_spike': True, 'sideways_rsi_required': False}.
[I 2025-09-01 12:08:18,142] Trial 535 finished with values: [-1000000000.0, 1000000000.0] and parameters: {'p_sma': 24, 'p_std': 35, 'p_atr': 20, 'p_adx': 7, 'rsi_period': 45, 'ema1': 25, 'ema2': 15, 'slip_atr_k': 0.1624402899466423, 'slip_spread_k': 0.3995742257284013, 'spread_hl_frac': 0.004955195114119189, 'bb_std_mult': 0.8445215246285239, 'rsi_os': 15, 'rsi_ob': 49, 'vol_spike': 0.00794799962120546, 'adx_thresh': 24.066895239212812, 'atr_min_pct': 0.02495613119356078, 'atr_max_pct': 0.07736611296851681, 'tp_mult': 2.1471146217105375, 'tsl_mult': 0.05504490983742363, 'strategy': 'breakout', 'time_stop': 141, 'use_sma': False, 'use_atr': True, 'use_adx': True, 'use_ema': True, 'use_spike': False, 'rsi_required': False, 'edge_k': 1.2742343948697281, 'edge_cap': 0.17383148193571535, 'bull_strategy': 'mean_reversion', 'bull_bb_std_mult': 1.7919196239895185, 'bull_rsi_os': 54, 'bull_rsi_ob': 49, 'bull_adx_thresh': 5.778580518973997, 'bull_atr_min_pct': 0.015792367040619638, 'bull_atr_max_pct': 0.11582618514302975, 'bull_tp_mult': 2.2462870654101397, 'bull_tsl_mult': 0.563486445186725, 'bull_time_stop': 154, 'bull_use_sma': False, 'bull_use_ema': False, 'bull_use_atr': False, 'bull_use_adx': False, 'bull_use_spike': False, 'bull_rsi_required': True, 'bear_strategy': 'mean_reversion', 'bear_bb_std_mult': 1.2825272973852087, 'bear_rsi_os': 26, 'bear_rsi_ob': 53, 'bear_adx_thresh': 7.3021357463829, 'bear_atr_min_pct': 0.0067751199888145125, 'bear_atr_max_pct': 0.023532526216419603, 'bear_tp_mult': 1.527221851785899, 'bear_tsl_mult': 0.8268405040085781, 'bear_time_stop': 273, 'bear_use_sma': True, 'bear_use_ema': False, 'bear_use_atr': True, 'bear_use_adx': True, 'bear_use_spike': False, 'bear_rsi_required': True, 'sideways_strategy': 'breakout', 'sideways_bb_std_mult': 2.164449137493246, 'sideways_rsi_os': 42, 'sideways_rsi_ob': 78, 'sideways_adx_thresh': 18.24557107171829, 'sideways_atr_min_pct': 0.004541951599684284, 'sideways_atr_max_pct': 0.010631512561955062, 'sideways_tp_mult': 1.0209636648097016, 'sideways_tsl_mult': 0.3761172116062649, 'sideways_time_stop': 92, 'sideways_use_sma': False, 'sideways_use_ema': False, 'sideways_use_atr': True, 'sideways_use_adx': True, 'sideways_use_spike': True, 'sideways_rsi_required': False}.
[I 2025-09-01 12:08:59,318] Trial 538 finished with values: [-0.020699000463749173, 0.022784208977600265] and parameters: {'p_sma': 39, 'p_std': 58, 'p_atr': 19, 'p_adx': 7, 'rsi_period': 41, 'ema1': 25, 'ema2': 22, 'slip_atr_k': 0.04077306787619414, 'slip_spread_k': 0.3169512047227224, 'spread_hl_frac': 0.003923962705345663, 'bb_std_mult': 0.7658993036596838, 'rsi_os': 33, 'rsi_ob': 47, 'vol_spike': 0.20411628847891555, 'adx_thresh': 23.417565654802655, 'atr_min_pct': 0.022825495569450963, 'atr_max_pct': 0.07364949798770212, 'tp_mult': 2.0263919538430293, 'tsl_mult': 0.09000774415591238, 'strategy': 'breakout', 'time_stop': 180, 'use_sma': False, 'use_atr': True, 'use_adx': True, 'use_ema': True, 'use_spike': False, 'rsi_required': False, 'edge_k': 0.20792160980051674, 'edge_cap': 0.1413710194786944, 'bull_strategy': 'mean_reversion', 'bull_bb_std_mult': 1.6555806828830688, 'bull_rsi_os': 49, 'bull_rsi_ob': 59, 'bull_adx_thresh': 9.229350772729125, 'bull_atr_min_pct': 0.017575969031628384, 'bull_atr_max_pct': 0.07306234159220387, 'bull_tp_mult': 1.4444583214266795, 'bull_tsl_mult': 0.48640528801305316, 'bull_time_stop': 165, 'bull_use_sma': False, 'bull_use_ema': False, 'bull_use_atr': True, 'bull_use_adx': False, 'bull_use_spike': False, 'bull_rsi_required': False, 'bear_strategy': 'breakout', 'bear_bb_std_mult': 2.0665311369541173, 'bear_rsi_os': 29, 'bear_rsi_ob': 51, 'bear_adx_thresh': 34.95621478265902, 'bear_atr_min_pct': 0.002485022427061572, 'bear_atr_max_pct': 0.058472478040790254, 'bear_tp_mult': 2.3592832603845557, 'bear_tsl_mult': 0.7475068232182699, 'bear_time_stop': 280, 'bear_use_sma': True, 'bear_use_ema': False, 'bear_use_atr': True, 'bear_use_adx': True, 'bear_use_spike': False, 'bear_rsi_required': True, 'sideways_strategy': 'breakout', 'sideways_bb_std_mult': 2.278873031542933, 'sideways_rsi_os': 6, 'sideways_rsi_ob': 90, 'sideways_adx_thresh': 14.273433106636894, 'sideways_atr_min_pct': 0.01298501687867676, 'sideways_atr_max_pct': 0.12050653186755299, 'sideways_tp_mult': 2.8081656907285377, 'sideways_tsl_mult': 0.3936222751428555, 'sideways_time_stop': 104, 'sideways_use_sma': False, 'sideways_use_ema': False, 'sideways_use_atr': True, 'sideways_use_adx': True, 'sideways_use_spike': True, 'sideways_rsi_required': False}.
[I 2025-09-01 12:08:59,318] Trial 539 finished with values: [-1000000000.0, 1000000000.0] and parameters: {'p_sma': 26, 'p_std': 54, 'p_atr': 19, 'p_adx': 7, 'rsi_period': 48, 'ema1': 16, 'ema2': 17, 'slip_atr_k': 0.04240886868504779, 'slip_spread_k': 0.6042870456190891, 'spread_hl_frac': 0.0034487240008757823, 'bb_std_mult': 1.3636734053488362, 'rsi_os': 33, 'rsi_ob': 47, 'vol_spike': 0.08019817217143951, 'adx_thresh': 30.83121065582571, 'atr_min_pct': 0.022724555280206303, 'atr_max_pct': 0.12659138311217796, 'tp_mult': 2.0299403835968377, 'tsl_mult': 0.12783563263586778, 'strategy': 'breakout', 'time_stop': 182, 'use_sma': False, 'use_atr': True, 'use_adx': True, 'use_ema': True, 'use_spike': False, 'rsi_required': False, 'edge_k': 0.7563309798361364, 'edge_cap': 0.14647554917682407, 'bull_strategy': 'mean_reversion', 'bull_bb_std_mult': 1.694361312824227, 'bull_rsi_os': 49, 'bull_rsi_ob': 66, 'bull_adx_thresh': 9.41789442936624, 'bull_atr_min_pct': 0.009535184361872232, 'bull_atr_max_pct': 0.10976840392843043, 'bull_tp_mult': 1.3258865415384185, 'bull_tsl_mult': 0.5988797621371804, 'bull_time_stop': 177, 'bull_use_sma': False, 'bull_use_ema': False, 'bull_use_atr': True, 'bull_use_adx': False, 'bull_use_spike': False, 'bull_rsi_required': False, 'bear_strategy': 'breakout', 'bear_bb_std_mult': 1.3804662306387996, 'bear_rsi_os': 29, 'bear_rsi_ob': 63, 'bear_adx_thresh': 28.276340754141785, 'bear_atr_min_pct': 0.0038313583131942795, 'bear_atr_max_pct': 0.07224886237234356, 'bear_tp_mult': 2.380357376258233, 'bear_tsl_mult': 0.44632315831369285, 'bear_time_stop': 282, 'bear_use_sma': True, 'bear_use_ema': False, 'bear_use_atr': True, 'bear_use_adx': True, 'bear_use_spike': False, 'bear_rsi_required': True, 'sideways_strategy': 'breakout', 'sideways_bb_std_mult': 2.5698856453091947, 'sideways_rsi_os': 17, 'sideways_rsi_ob': 90, 'sideways_adx_thresh': 27.335783232132627, 'sideways_atr_min_pct': 0.013089773882064724, 'sideways_atr_max_pct': 0.13011248950274182, 'sideways_tp_mult': 2.804756324029275, 'sideways_tsl_mult': 0.4140768209202218, 'sideways_time_stop': 13, 'sideways_use_sma': False, 'sideways_use_ema': False, 'sideways_use_atr': True, 'sideways_use_adx': True, 'sideways_use_spike': True, 'sideways_rsi_required': False}.
[I 2025-09-01 12:08:59,553] Trial 537 finished with values: [-1000000000.0, 1000000000.0] and parameters: {'p_sma': 29, 'p_std': 32, 'p_atr': 24, 'p_adx': 7, 'rsi_period': 66, 'ema1': 25, 'ema2': 45, 'slip_atr_k': 0.04104932486003948, 'slip_spread_k': 0.35507162054815383, 'spread_hl_frac': 0.003216314416475749, 'bb_std_mult': 0.9154855281853246, 'rsi_os': 33, 'rsi_ob': 49, 'vol_spike': 0.20373223509923033, 'adx_thresh': 24.311442928639597, 'atr_min_pct': 0.0227672773167113, 'atr_max_pct': 0.06954236534063113, 'tp_mult': 2.0450831355291417, 'tsl_mult': 0.07799633299084095, 'strategy': 'breakout', 'time_stop': 156, 'use_sma': False, 'use_atr': True, 'use_adx': True, 'use_ema': True, 'use_spike': False, 'rsi_required': False, 'edge_k': 0.20103689665179936, 'edge_cap': 0.9677467277197984, 'bull_strategy': 'mean_reversion', 'bull_bb_std_mult': 1.8079438528337173, 'bull_rsi_os': 6, 'bull_rsi_ob': 51, 'bull_adx_thresh': 5.641000631232295, 'bull_atr_min_pct': 0.009004536703174443, 'bull_atr_max_pct': 0.07276020512373998, 'bull_tp_mult': 2.2294188155482213, 'bull_tsl_mult': 0.4838397528633509, 'bull_time_stop': 113, 'bull_use_sma': False, 'bull_use_ema': False, 'bull_use_atr': True, 'bull_use_adx': False, 'bull_use_spike': False, 'bull_rsi_required': False, 'bear_strategy': 'breakout', 'bear_bb_std_mult': 1.328360498333264, 'bear_rsi_os': 45, 'bear_rsi_ob': 86, 'bear_adx_thresh': 9.1154687009534, 'bear_atr_min_pct': 0.018784864751260587, 'bear_atr_max_pct': 0.07329895092366057, 'bear_tp_mult': 1.527302181031044, 'bear_tsl_mult': 0.8199072920757845, 'bear_time_stop': 299, 'bear_use_sma': True, 'bear_use_ema': False, 'bear_use_atr': True, 'bear_use_adx': True, 'bear_use_spike': False, 'bear_rsi_required': True, 'sideways_strategy': 'breakout', 'sideways_bb_std_mult': 2.0565591583092853, 'sideways_rsi_os': 41, 'sideways_rsi_ob': 87, 'sideways_adx_thresh': 14.424107536373006, 'sideways_atr_min_pct': 0.008773365766017005, 'sideways_atr_max_pct': 0.1299143071306124, 'sideways_tp_mult': 1.202505268170038, 'sideways_tsl_mult': 0.3795566988360397, 'sideways_time_stop': 81, 'sideways_use_sma': False, 'sideways_use_ema': False, 'sideways_use_atr': True, 'sideways_use_adx': True, 'sideways_use_spike': True, 'sideways_rsi_required': False}.
[I 2025-09-01 12:08:59,768] Trial 536 finished with values: [-1000000000.0, 1000000000.0] and parameters: {'p_sma': 23, 'p_std': 53, 'p_atr': 22, 'p_adx': 7, 'rsi_period': 48, 'ema1': 25, 'ema2': 15, 'slip_atr_k': 0.019129045015770396, 'slip_spread_k': 0.3192108081884848, 'spread_hl_frac': 0.003931429250837351, 'bb_std_mult': 0.9109388588263563, 'rsi_os': 33, 'rsi_ob': 49, 'vol_spike': 0.0853183049945881, 'adx_thresh': 19.469755382993576, 'atr_min_pct': 0.022856725380209435, 'atr_max_pct': 0.07414268131271708, 'tp_mult': 2.1859834753443295, 'tsl_mult': 0.07395049583937882, 'strategy': 'breakout', 'time_stop': 156, 'use_sma': False, 'use_atr': True, 'use_adx': True, 'use_ema': True, 'use_spike': False, 'rsi_required': False, 'edge_k': 1.4833381988423984, 'edge_cap': 0.9707666721861974, 'bull_strategy': 'mean_reversion', 'bull_bb_std_mult': 1.8106810965644209, 'bull_rsi_os': 40, 'bull_rsi_ob': 60, 'bull_adx_thresh': 5.739506023859233, 'bull_atr_min_pct': 0.01570096740131389, 'bull_atr_max_pct': 0.061198620897607955, 'bull_tp_mult': 1.2692328015535927, 'bull_tsl_mult': 0.4842378974000899, 'bull_time_stop': 170, 'bull_use_sma': False, 'bull_use_ema': False, 'bull_use_atr': False, 'bull_use_adx': False, 'bull_use_spike': False, 'bull_rsi_required': True, 'bear_strategy': 'mean_reversion', 'bear_bb_std_mult': 0.5304105969052391, 'bear_rsi_os': 46, 'bear_rsi_ob': 53, 'bear_adx_thresh': 7.151883987763206, 'bear_atr_min_pct': 0.018805174504003583, 'bear_atr_max_pct': 0.072568672486096, 'bear_tp_mult': 2.3674392380269724, 'bear_tsl_mult': 0.70276965448134, 'bear_time_stop': 9, 'bear_use_sma': True, 'bear_use_ema': False, 'bear_use_atr': True, 'bear_use_adx': True, 'bear_use_spike': False, 'bear_rsi_required': True, 'sideways_strategy': 'breakout', 'sideways_bb_std_mult': 2.164855530806529, 'sideways_rsi_os': 6, 'sideways_rsi_ob': 88, 'sideways_adx_thresh': 30.89520694465616, 'sideways_atr_min_pct': 0.009883464920018055, 'sideways_atr_max_pct': 0.12954675361939888, 'sideways_tp_mult': 2.677428715366934, 'sideways_tsl_mult': 0.1421694936609939, 'sideways_time_stop': 186, 'sideways_use_sma': False, 'sideways_use_ema': False, 'sideways_use_atr': True, 'sideways_use_adx': True, 'sideways_use_spike': True, 'sideways_rsi_required': False}.
