[I 2025-09-01 11:21:26,138] Trial 261 finished with values: [-0.009354338316696298, 0.00944247037786927] and parameters: {'p_sma': 26, 'p_std': 36, 'p_atr': 9, 'p_adx': 30, 'rsi_period': 53, 'ema1': 22, 'ema2': 35, 'slip_atr_k': 0.0006808451358218063, 'slip_spread_k': 0.806884504585011, 'spread_hl_frac': 0.02966540488892187, 'bb_std_mult': 3.4279150037743986, 'rsi_os': 26, 'rsi_ob': 82, 'vol_spike': 0.09944352425624377, 'adx_thresh': 27.36152257898564, 'atr_min_pct': 0.0008088729574949761, 'atr_max_pct': 0.035780632094165155, 'tp_mult': 2.539775201203734, 'tsl_mult': 0.9031279717608593, 'strategy': 'breakout', 'time_stop': 235, 'use_sma': False, 'use_atr': False, 'use_adx': False, 'use_ema': True, 'use_spike': True, 'rsi_required': True, 'edge_k': 1.027713524341113, 'edge_cap': 0.34131561134909666, 'bull_strategy': 'mean_reversion', 'bull_bb_std_mult': 2.8534580664523803, 'bull_rsi_os': 45, 'bull_rsi_ob': 88, 'bull_adx_thresh': 8.888408078314477, 'bull_atr_min_pct': 0.0004385488930914224, 'bull_atr_max_pct': 0.08590732688080244, 'bull_tp_mult': 2.688978350219184, 'bull_tsl_mult': 0.8479742379809494, 'bull_time_stop': 130, 'bull_use_sma': True, 'bull_use_ema': True, 'bull_use_atr': True, 'bull_use_adx': False, 'bull_use_spike': True, 'bull_rsi_required': True, 'bear_strategy': 'breakout', 'bear_bb_std_mult': 2.8577397290154485, 'bear_rsi_os': 33, 'bear_rsi_ob': 47, 'bear_adx_thresh': 18.22017446466279, 'bear_atr_min_pct': 0.009206908268029331, 'bear_atr_max_pct': 0.02312790607440174, 'bear_tp_mult': 2.671793594838704, 'bear_tsl_mult': 0.689900386262003, 'bear_time_stop': 48, 'bear_use_sma': True, 'bear_use_ema': True, 'bear_use_atr': False, 'bear_use_adx': True, 'bear_use_spike': False, 'bear_rsi_required': False, 'sideways_strategy': 'mean_reversion', 'sideways_bb_std_mult': 1.573783923144584, 'sideways_rsi_os': 55, 'sideways_rsi_ob': 63, 'sideways_adx_thresh': 11.245465632269594, 'sideways_atr_min_pct': 0.017710269510255863, 'sideways_atr_max_pct': 0.09445744338999104, 'sideways_tp_mult': 1.5782114240434955, 'sideways_tsl_mult': 0.476789128930261, 'sideways_time_stop': 129, 'sideways_use_sma': True, 'sideways_use_ema': False, 'sideways_use_atr': False, 'sideways_use_adx': True, 'sideways_use_spike': True, 'sideways_rsi_required': False}.
[I 2025-09-01 11:21:26,461] Trial 262 finished with values: [-0.015764355748001058, 0.015633459024458573] and parameters: {'p_sma': 15, 'p_std': 37, 'p_atr': 7, 'p_adx': 18, 'rsi_period': 46, 'ema1': 22, 'ema2': 16, 'slip_atr_k': 0.07665530184410356, 'slip_spread_k': 0.09500148980072799, 'spread_hl_frac': 0.029196192673366476, 'bb_std_mult': 3.337115502695484, 'rsi_os': 26, 'rsi_ob': 78, 'vol_spike': 0.10769287888890874, 'adx_thresh': 13.79265718254872, 'atr_min_pct': 0.029826801283812304, 'atr_max_pct': 0.05123607962491277, 'tp_mult': 2.9435120181572056, 'tsl_mult': 0.8886413799135122, 'strategy': 'mean_reversion', 'time_stop': 233, 'use_sma': True, 'use_atr': False, 'use_adx': False, 'use_ema': True, 'use_spike': True, 'rsi_required': True, 'edge_k': 0.23650092737209238, 'edge_cap': 0.2876039022871513, 'bull_strategy': 'breakout', 'bull_bb_std_mult': 2.5892438244284417, 'bull_rsi_os': 47, 'bull_rsi_ob': 90, 'bull_adx_thresh': 10.314685230574236, 'bull_atr_min_pct': 0.0017552752101388084, 'bull_atr_max_pct': 0.08890424692387243, 'bull_tp_mult': 2.721101059317292, 'bull_tsl_mult': 0.7424918233066213, 'bull_time_stop': 254, 'bull_use_sma': True, 'bull_use_ema': True, 'bull_use_atr': True, 'bull_use_adx': False, 'bull_use_spike': True, 'bull_rsi_required': True, 'bear_strategy': 'breakout', 'bear_bb_std_mult': 0.6579408934579936, 'bear_rsi_os': 33, 'bear_rsi_ob': 71, 'bear_adx_thresh': 9.400249089985898, 'bear_atr_min_pct': 0.029969256671838484, 'bear_atr_max_pct': 0.021603750529665646, 'bear_tp_mult': 2.565153953980678, 'bear_tsl_mult': 0.2594156196485991, 'bear_time_stop': 19, 'bear_use_sma': False, 'bear_use_ema': True, 'bear_use_atr': False, 'bear_use_adx': True, 'bear_use_spike': False, 'bear_rsi_required': False, 'sideways_strategy': 'mean_reversion', 'sideways_bb_std_mult': 1.6197228300448188, 'sideways_rsi_os': 21, 'sideways_rsi_ob': 94, 'sideways_adx_thresh': 23.580996097310987, 'sideways_atr_min_pct': 0.0186138803985147, 'sideways_atr_max_pct': 0.1351032558241743, 'sideways_tp_mult': 1.6345885349158689, 'sideways_tsl_mult': 0.8418599738739361, 'sideways_time_stop': 80, 'sideways_use_sma': True, 'sideways_use_ema': False, 'sideways_use_atr': False, 'sideways_use_adx': True, 'sideways_use_spike': True, 'sideways_rsi_required': False}.
[I 2025-09-01 11:21:27,439] Trial 263 finished with values: [-0.04435596814199383, 0.04427011131295813] and parameters: {'p_sma': 47, 'p_std': 24, 'p_atr': 12, 'p_adx': 30, 'rsi_period': 50, 'ema1': 22, 'ema2': 37, 'slip_atr_k': 0.0005553979259501213, 'slip_spread_k': 0.813957972530198, 'spread_hl_frac': 0.02701939832811501, 'bb_std_mult': 3.3460997475345873, 'rsi_os': 5, 'rsi_ob': 55, 'vol_spike': 0.10644086556269958, 'adx_thresh': 24.935234254120083, 'atr_min_pct': 0.02855946174735922, 'atr_max_pct': 0.03246943349132654, 'tp_mult': 2.5625250784143345, 'tsl_mult': 0.906009012615834, 'strategy': 'mean_reversion', 'time_stop': 36, 'use_sma': True, 'use_atr': False, 'use_adx': False, 'use_ema': True, 'use_spike': True, 'rsi_required': True, 'edge_k': 1.4462418156884316, 'edge_cap': 0.27034483627673944, 'bull_strategy': 'breakout', 'bull_bb_std_mult': 3.312152557117276, 'bull_rsi_os': 48, 'bull_rsi_ob': 87, 'bull_adx_thresh': 10.50846105706445, 'bull_atr_min_pct': 0.0005354823843665907, 'bull_atr_max_pct': 0.0910030083418904, 'bull_tp_mult': 2.468957326766817, 'bull_tsl_mult': 0.1400420768810413, 'bull_time_stop': 257, 'bull_use_sma': True, 'bull_use_ema': True, 'bull_use_atr': True, 'bull_use_adx': True, 'bull_use_spike': True, 'bull_rsi_required': True, 'bear_strategy': 'breakout', 'bear_bb_std_mult': 0.6723541860380582, 'bear_rsi_os': 33, 'bear_rsi_ob': 67, 'bear_adx_thresh': 18.288134268897423, 'bear_atr_min_pct': 0.009887542312532945, 'bear_atr_max_pct': 0.022192067622907347, 'bear_tp_mult': 2.5717490770472446, 'bear_tsl_mult': 0.2911986590108612, 'bear_time_stop': 76, 'bear_use_sma': False, 'bear_use_ema': True, 'bear_use_atr': False, 'bear_use_adx': True, 'bear_use_spike': False, 'bear_rsi_required': False, 'sideways_strategy': 'mean_reversion', 'sideways_bb_std_mult': 1.5706314239723886, 'sideways_rsi_os': 32, 'sideways_rsi_ob': 74, 'sideways_adx_thresh': 32.40670278045182, 'sideways_atr_min_pct': 0.025589147994523363, 'sideways_atr_max_pct': 0.09344306156115907, 'sideways_tp_mult': 1.6294101623832686, 'sideways_tsl_mult': 0.502629742538665, 'sideways_time_stop': 129, 'sideways_use_sma': True, 'sideways_use_ema': True, 'sideways_use_atr': False, 'sideways_use_adx': True, 'sideways_use_spike': False, 'sideways_rsi_required': True}.
[I 2025-09-01 11:21:27,835] Trial 264 finished with values: [-1000000000.0, 1000000000.0] and parameters: {'p_sma': 22, 'p_std': 24, 'p_atr': 7, 'p_adx': 30, 'rsi_period': 7, 'ema1': 21, 'ema2': 37, 'slip_atr_k': 0.018768355778457774, 'slip_spread_k': 0.8043483805504299, 'spread_hl_frac': 0.027071186815958388, 'bb_std_mult': 3.3437942258779842, 'rsi_os': 26, 'rsi_ob': 76, 'vol_spike': 0.03867631682666599, 'adx_thresh': 27.808709214814588, 'atr_min_pct': 0.028385196601600673, 'atr_max_pct': 0.010109817336940358, 'tp_mult': 2.5369346408398417, 'tsl_mult': 0.9182929889793214, 'strategy': 'mean_reversion', 'time_stop': 249, 'use_sma': True, 'use_atr': False, 'use_adx': False, 'use_ema': True, 'use_spike': True, 'rsi_required': True, 'edge_k': 1.4066129136064056, 'edge_cap': 0.2766612583835108, 'bull_strategy': 'breakout', 'bull_bb_std_mult': 2.9459159305902256, 'bull_rsi_os': 48, 'bull_rsi_ob': 87, 'bull_adx_thresh': 18.975526957331233, 'bull_atr_min_pct': 0.010742372227894507, 'bull_atr_max_pct': 0.08978716033397247, 'bull_tp_mult': 2.479804557049829, 'bull_tsl_mult': 0.6640420978070537, 'bull_time_stop': 257, 'bull_use_sma': True, 'bull_use_ema': True, 'bull_use_atr': True, 'bull_use_adx': False, 'bull_use_spike': True, 'bull_rsi_required': True, 'bear_strategy': 'mean_reversion', 'bear_bb_std_mult': 0.8651798955570715, 'bear_rsi_os': 31, 'bear_rsi_ob': 52, 'bear_adx_thresh': 16.682969323177332, 'bear_atr_min_pct': 0.00974926621350907, 'bear_atr_max_pct': 0.021319187427518847, 'bear_tp_mult': 2.5688498643812063, 'bear_tsl_mult': 0.2932688062901521, 'bear_time_stop': 73, 'bear_use_sma': False, 'bear_use_ema': True, 'bear_use_atr': False, 'bear_use_adx': False, 'bear_use_spike': True, 'bear_rsi_required': False, 'sideways_strategy': 'mean_reversion', 'sideways_bb_std_mult': 3.4578936467032277, 'sideways_rsi_os': 20, 'sideways_rsi_ob': 95, 'sideways_adx_thresh': 25.20616396261781, 'sideways_atr_min_pct': 0.025810824566941545, 'sideways_atr_max_pct': 0.03351321218714678, 'sideways_tp_mult': 2.7889686173706743, 'sideways_tsl_mult': 0.49593513911379133, 'sideways_time_stop': 121, 'sideways_use_sma': True, 'sideways_use_ema': True, 'sideways_use_atr': False, 'sideways_use_adx': False, 'sideways_use_spike': True, 'sideways_rsi_required': False}.
[I 2025-09-01 11:21:28,266] Trial 266 finished with values: [-1000000000.0, 1000000000.0] and parameters: {'p_sma': 22, 'p_std': 28, 'p_atr': 21, 'p_adx': 30, 'rsi_period': 49, 'ema1': 11, 'ema2': 32, 'slip_atr_k': 0.018322007355152777, 'slip_spread_k': 0.4688739874321366, 'spread_hl_frac': 0.030002661699631557, 'bb_std_mult': 3.02290284846929, 'rsi_os': 27, 'rsi_ob': 86, 'vol_spike': 0.04044828348152231, 'adx_thresh': 10.161669264507385, 'atr_min_pct': 0.028342485239842997, 'atr_max_pct': 0.011933124647121193, 'tp_mult': 2.2015306309901495, 'tsl_mult': 0.9104760132190385, 'strategy': 'mean_reversion', 'time_stop': 262, 'use_sma': True, 'use_atr': False, 'use_adx': False, 'use_ema': True, 'use_spike': True, 'rsi_required': True, 'edge_k': 0.2743777761221575, 'edge_cap': 0.3226194280039434, 'bull_strategy': 'breakout', 'bull_bb_std_mult': 2.8513168822277293, 'bull_rsi_os': 43, 'bull_rsi_ob': 90, 'bull_adx_thresh': 24.978521281688696, 'bull_atr_min_pct': 0.007290988311188361, 'bull_atr_max_pct': 0.14561274723637757, 'bull_tp_mult': 2.6399868494096146, 'bull_tsl_mult': 0.8424024492194655, 'bull_time_stop': 265, 'bull_use_sma': True, 'bull_use_ema': True, 'bull_use_atr': True, 'bull_use_adx': True, 'bull_use_spike': False, 'bull_rsi_required': False, 'bear_strategy': 'mean_reversion', 'bear_bb_std_mult': 3.4571769639642955, 'bear_rsi_os': 34, 'bear_rsi_ob': 48, 'bear_adx_thresh': 29.593599880666105, 'bear_atr_min_pct': 0.009794173432222103, 'bear_atr_max_pct': 0.03675329453859728, 'bear_tp_mult': 2.5613049088720454, 'bear_tsl_mult': 0.3816390264697954, 'bear_time_stop': 76, 'bear_use_sma': False, 'bear_use_ema': True, 'bear_use_atr': False, 'bear_use_adx': False, 'bear_use_spike': True, 'bear_rsi_required': False, 'sideways_strategy': 'mean_reversion', 'sideways_bb_std_mult': 3.5932864994656244, 'sideways_rsi_os': 32, 'sideways_rsi_ob': 63, 'sideways_adx_thresh': 26.39586479827335, 'sideways_atr_min_pct': 0.017832291017962833, 'sideways_atr_max_pct': 0.016358698381809367, 'sideways_tp_mult': 1.7257281907254909, 'sideways_tsl_mult': 0.49581647244578897, 'sideways_time_stop': 130, 'sideways_use_sma': True, 'sideways_use_ema': True, 'sideways_use_atr': False, 'sideways_use_adx': False, 'sideways_use_spike': False, 'sideways_rsi_required': True}.
[I 2025-09-01 11:22:08,074] Trial 268 finished with values: [-1000000000.0, 1000000000.0] and parameters: {'p_sma': 16, 'p_std': 43, 'p_atr': 19, 'p_adx': 29, 'rsi_period': 49, 'ema1': 20, 'ema2': 33, 'slip_atr_k': 0.013395698827149274, 'slip_spread_k': 0.13274720492221165, 'spread_hl_frac': 0.03040813744271074, 'bb_std_mult': 3.0690034025510067, 'rsi_os': 38, 'rsi_ob': 86, 'vol_spike': 0.12514479015318097, 'adx_thresh': 20.14387158287624, 'atr_min_pct': 0.029371763283666828, 'atr_max_pct': 0.12838093023497085, 'tp_mult': 2.8130660171472903, 'tsl_mult': 0.8219366428244295, 'strategy': 'mean_reversion', 'time_stop': 97, 'use_sma': True, 'use_atr': False, 'use_adx': False, 'use_ema': False, 'use_spike': True, 'rsi_required': True, 'edge_k': 1.0530205542331086, 'edge_cap': 0.3213404941840344, 'bull_strategy': 'breakout', 'bull_bb_std_mult': 2.830834624379267, 'bull_rsi_os': 43, 'bull_rsi_ob': 90, 'bull_adx_thresh': 30.877180036716325, 'bull_atr_min_pct': 0.014249234145910686, 'bull_atr_max_pct': 0.08202583933932571, 'bull_tp_mult': 2.6630364821600483, 'bull_tsl_mult': 0.6964264838621598, 'bull_time_stop': 268, 'bull_use_sma': True, 'bull_use_ema': True, 'bull_use_atr': True, 'bull_use_adx': True, 'bull_use_spike': False, 'bull_rsi_required': False, 'bear_strategy': 'mean_reversion', 'bear_bb_std_mult': 3.5200482092135923, 'bear_rsi_os': 16, 'bear_rsi_ob': 48, 'bear_adx_thresh': 17.26508031628347, 'bear_atr_min_pct': 0.0013000053720756345, 'bear_atr_max_pct': 0.02974816298136521, 'bear_tp_mult': 2.6903286606984746, 'bear_tsl_mult': 0.8659621332871588, 'bear_time_stop': 162, 'bear_use_sma': False, 'bear_use_ema': True, 'bear_use_atr': False, 'bear_use_adx': False, 'bear_use_spike': True, 'bear_rsi_required': False, 'sideways_strategy': 'mean_reversion', 'sideways_bb_std_mult': 3.598832426813457, 'sideways_rsi_os': 29, 'sideways_rsi_ob': 67, 'sideways_adx_thresh': 21.50433676108414, 'sideways_atr_min_pct': 0.01778945893238878, 'sideways_atr_max_pct': 0.013346283059342753, 'sideways_tp_mult': 1.7169923757343397, 'sideways_tsl_mult': 0.45060959967201897, 'sideways_time_stop': 111, 'sideways_use_sma': True, 'sideways_use_ema': True, 'sideways_use_atr': False, 'sideways_use_adx': False, 'sideways_use_spike': False, 'sideways_rsi_required': True}.
[I 2025-09-01 11:22:08,742] Trial 267 finished with values: [-1000000000.0, 1000000000.0] and parameters: {'p_sma': 16, 'p_std': 28, 'p_atr': 8, 'p_adx': 29, 'rsi_period': 22, 'ema1': 11, 'ema2': 31, 'slip_atr_k': 0.01807717351402127, 'slip_spread_k': 0.13097426042155297, 'spread_hl_frac': 0.03018858149555211, 'bb_std_mult': 3.050924992857734, 'rsi_os': 38, 'rsi_ob': 86, 'vol_spike': 0.041140702685695155, 'adx_thresh': 10.34959775963889, 'atr_min_pct': 0.0009236170233337306, 'atr_max_pct': 0.0558404517209737, 'tp_mult': 2.535051976723112, 'tsl_mult': 0.8238764130519343, 'strategy': 'mean_reversion', 'time_stop': 265, 'use_sma': True, 'use_atr': False, 'use_adx': False, 'use_ema': True, 'use_spike': True, 'rsi_required': True, 'edge_k': 0.26850631692503246, 'edge_cap': 0.3300960919403586, 'bull_strategy': 'breakout', 'bull_bb_std_mult': 2.840488803395446, 'bull_rsi_os': 50, 'bull_rsi_ob': 89, 'bull_adx_thresh': 31.17776455664417, 'bull_atr_min_pct': 0.010721274283047895, 'bull_atr_max_pct': 0.030875537571257695, 'bull_tp_mult': 2.9654823274930577, 'bull_tsl_mult': 0.6963015685332514, 'bull_time_stop': 130, 'bull_use_sma': True, 'bull_use_ema': True, 'bull_use_atr': True, 'bull_use_adx': True, 'bull_use_spike': False, 'bull_rsi_required': False, 'bear_strategy': 'mean_reversion', 'bear_bb_std_mult': 3.549549149432212, 'bear_rsi_os': 16, 'bear_rsi_ob': 48, 'bear_adx_thresh': 17.225362448920446, 'bear_atr_min_pct': 0.008983688301333028, 'bear_atr_max_pct': 0.03163810498373617, 'bear_tp_mult': 2.6807821971299672, 'bear_tsl_mult': 0.40324257948609, 'bear_time_stop': 47, 'bear_use_sma': False, 'bear_use_ema': True, 'bear_use_atr': False, 'bear_use_adx': False, 'bear_use_spike': True, 'bear_rsi_required': False, 'sideways_strategy': 'mean_reversion', 'sideways_bb_std_mult': 3.4396427887624164, 'sideways_rsi_os': 47, 'sideways_rsi_ob': 64, 'sideways_adx_thresh': 8.265510454287337, 'sideways_atr_min_pct': 0.018064931341845666, 'sideways_atr_max_pct': 0.0882853841434616, 'sideways_tp_mult': 2.8054014155369478, 'sideways_tsl_mult': 0.625656036220154, 'sideways_time_stop': 120, 'sideways_use_sma': True, 'sideways_use_ema': True, 'sideways_use_atr': False, 'sideways_use_adx': False, 'sideways_use_spike': False, 'sideways_rsi_required': True}.
[I 2025-09-01 11:22:09,584] Trial 269 finished with values: [-0.052446599119141735, 0.05232642245015377] and parameters: {'p_sma': 59, 'p_std': 35, 'p_atr': 8, 'p_adx': 29, 'rsi_period': 52, 'ema1': 28, 'ema2': 33, 'slip_atr_k': 0.2339302570628472, 'slip_spread_k': 0.6156133521777408, 'spread_hl_frac': 0.028732105013036538, 'bb_std_mult': 2.0114469813552165, 'rsi_os': 41, 'rsi_ob': 88, 'vol_spike': 0.12348564177861042, 'adx_thresh': 20.271390155690412, 'atr_min_pct': 3.9310023115446055e-05, 'atr_max_pct': 0.1282879040979229, 'tp_mult': 2.495209548711424, 'tsl_mult': 0.7713068422867657, 'strategy': 'mean_reversion', 'time_stop': 5, 'use_sma': True, 'use_atr': False, 'use_adx': False, 'use_ema': False, 'use_spike': True, 'rsi_required': True, 'edge_k': 1.4889937633545005, 'edge_cap': 0.298391902859681, 'bull_strategy': 'breakout', 'bull_bb_std_mult': 2.823142549895976, 'bull_rsi_os': 50, 'bull_rsi_ob': 89, 'bull_adx_thresh': 23.51006522820766, 'bull_atr_min_pct': 0.001335100468448686, 'bull_atr_max_pct': 0.031855134653687105, 'bull_tp_mult': 2.679056820115721, 'bull_tsl_mult': 0.6977883071304462, 'bull_time_stop': 242, 'bull_use_sma': True, 'bull_use_ema': True, 'bull_use_atr': True, 'bull_use_adx': True, 'bull_use_spike': False, 'bull_rsi_required': False, 'bear_strategy': 'breakout', 'bear_bb_std_mult': 1.9000640295440974, 'bear_rsi_os': 17, 'bear_rsi_ob': 49, 'bear_adx_thresh': 31.34588666943824, 'bear_atr_min_pct': 0.0070751158533698035, 'bear_atr_max_pct': 0.029657593817344327, 'bear_tp_mult': 2.6703089741316313, 'bear_tsl_mult': 0.3516345755409337, 'bear_time_stop': 68, 'bear_use_sma': False, 'bear_use_ema': True, 'bear_use_atr': False, 'bear_use_adx': False, 'bear_use_spike': True, 'bear_rsi_required': False, 'sideways_strategy': 'mean_reversion', 'sideways_bb_std_mult': 1.4844348049494243, 'sideways_rsi_os': 55, 'sideways_rsi_ob': 85, 'sideways_adx_thresh': 24.150960726568037, 'sideways_atr_min_pct': 0.01748338155364773, 'sideways_atr_max_pct': 0.030507785456470298, 'sideways_tp_mult': 2.9139340310016206, 'sideways_tsl_mult': 0.31427783416607347, 'sideways_time_stop': 110, 'sideways_use_sma': True, 'sideways_use_ema': True, 'sideways_use_atr': False, 'sideways_use_adx': False, 'sideways_use_spike': False, 'sideways_rsi_required': True}.
[I 2025-09-01 11:22:10,042] Trial 265 finished with values: [-1000000000.0, 1000000000.0] and parameters: {'p_sma': 11, 'p_std': 34, 'p_atr': 7, 'p_adx': 30, 'rsi_period': 25, 'ema1': 20, 'ema2': 37, 'slip_atr_k': 0.016791177037247588, 'slip_spread_k': 0.4640599436069189, 'spread_hl_frac': 0.029871311839102327, 'bb_std_mult': 2.3951523431355737, 'rsi_os': 41, 'rsi_ob': 86, 'vol_spike': 0.10653293240562356, 'adx_thresh': 19.986042474601955, 'atr_min_pct': 0.028412834399133474, 'atr_max_pct': 0.12525380788151294, 'tp_mult': 2.533462706716812, 'tsl_mult': 0.8993597841891889, 'strategy': 'mean_reversion', 'time_stop': 263, 'use_sma': True, 'use_atr': False, 'use_adx': False, 'use_ema': True, 'use_spike': True, 'rsi_required': True, 'edge_k': 1.0368016367910693, 'edge_cap': 0.32334414260220273, 'bull_strategy': 'breakout', 'bull_bb_std_mult': 2.8289944865588637, 'bull_rsi_os': 48, 'bull_rsi_ob': 90, 'bull_adx_thresh': 23.39853593215384, 'bull_atr_min_pct': 0.0016759881608061193, 'bull_atr_max_pct': 0.09004918946828458, 'bull_tp_mult': 2.4771873161415914, 'bull_tsl_mult': 0.8500145005818888, 'bull_time_stop': 256, 'bull_use_sma': True, 'bull_use_ema': True, 'bull_use_atr': True, 'bull_use_adx': True, 'bull_use_spike': False, 'bull_rsi_required': True, 'bear_strategy': 'mean_reversion', 'bear_bb_std_mult': 2.4041696511341755, 'bear_rsi_os': 33, 'bear_rsi_ob': 48, 'bear_adx_thresh': 31.556789712458063, 'bear_atr_min_pct': 0.009843910410883358, 'bear_atr_max_pct': 0.06349268325753761, 'bear_tp_mult': 2.548150751923462, 'bear_tsl_mult': 0.9096190218784048, 'bear_time_stop': 73, 'bear_use_sma': False, 'bear_use_ema': True, 'bear_use_atr': False, 'bear_use_adx': False, 'bear_use_spike': True, 'bear_rsi_required': False, 'sideways_strategy': 'mean_reversion', 'sideways_bb_std_mult': 1.5888705320531964, 'sideways_rsi_os': 32, 'sideways_rsi_ob': 64, 'sideways_adx_thresh': 25.18079181419693, 'sideways_atr_min_pct': 0.025560579750943106, 'sideways_atr_max_pct': 0.08873561240236473, 'sideways_tp_mult': 1.7293167037328232, 'sideways_tsl_mult': 0.4991537116524094, 'sideways_time_stop': 210, 'sideways_use_sma': True, 'sideways_use_ema': True, 'sideways_use_atr': False, 'sideways_use_adx': False, 'sideways_use_spike': True, 'sideways_rsi_required': True}.
