[I 2025-09-01 11:17:51,794] Trial 236 finished with values: [-0.018484440061117713, 0.01869399615565934] and parameters: {'p_sma': 33, 'p_std': 27, 'p_atr': 8, 'p_adx': 29, 'rsi_period': 45, 'ema1': 29, 'ema2': 37, 'slip_atr_k': 0.08685240650871011, 'slip_spread_k': 0.08642593299832557, 'spread_hl_frac': 0.02101949065516001, 'bb_std_mult': 3.2736665018525932, 'rsi_os': 45, 'rsi_ob': 87, 'vol_spike': 0.05865481739515091, 'adx_thresh': 20.64744578266763, 'atr_min_pct': 0.027826308633372272, 'atr_max_pct': 0.05270940672863815, 'tp_mult': 2.836481454602467, 'tsl_mult': 0.8419659541596624, 'strategy': 'mean_reversion', 'time_stop': 240, 'use_sma': True, 'use_atr': False, 'use_adx': False, 'use_ema': True, 'use_spike': True, 'rsi_required': True, 'edge_k': 0.18151669400827744, 'edge_cap': 0.7619126705595618, 'bull_strategy': 'breakout', 'bull_bb_std_mult': 2.7004069738418663, 'bull_rsi_os': 50, 'bull_rsi_ob': 60, 'bull_adx_thresh': 29.12120988326595, 'bull_atr_min_pct': 0.0011198445791363268, 'bull_atr_max_pct': 0.08645196551549711, 'bull_tp_mult': 2.161496356587603, 'bull_tsl_mult': 0.2125985866768636, 'bull_time_stop': 266, 'bull_use_sma': True, 'bull_use_ema': True, 'bull_use_atr': True, 'bull_use_adx': True, 'bull_use_spike': True, 'bull_rsi_required': False, 'bear_strategy': 'breakout', 'bear_bb_std_mult': 0.7910135591665817, 'bear_rsi_os': 10, 'bear_rsi_ob': 45, 'bear_adx_thresh': 15.415223345273356, 'bear_atr_min_pct': 0.015586608189023328, 'bear_atr_max_pct': 0.032092148084305674, 'bear_tp_mult': 1.3486174086628828, 'bear_tsl_mult': 0.2894700174983786, 'bear_time_stop': 288, 'bear_use_sma': False, 'bear_use_ema': True, 'bear_use_atr': False, 'bear_use_adx': True, 'bear_use_spike': False, 'bear_rsi_required': False, 'sideways_strategy': 'mean_reversion', 'sideways_bb_std_mult': 3.4495109789474054, 'sideways_rsi_os': 36, 'sideways_rsi_ob': 86, 'sideways_adx_thresh': 23.167917745546987, 'sideways_atr_min_pct': 0.007361370739976388, 'sideways_atr_max_pct': 0.08580612081635682, 'sideways_tp_mult': 2.5601667699075454, 'sideways_tsl_mult': 0.48647062792247187, 'sideways_time_stop': 125, 'sideways_use_sma': True, 'sideways_use_ema': False, 'sideways_use_atr': False, 'sideways_use_adx': True, 'sideways_use_spike': False, 'sideways_rsi_required': True}.
[I 2025-09-01 11:17:52,742] Trial 234 finished with values: [-1000000000.0, 1000000000.0] and parameters: {'p_sma': 11, 'p_std': 24, 'p_atr': 8, 'p_adx': 29, 'rsi_period': 45, 'ema1': 29, 'ema2': 22, 'slip_atr_k': 0.08365119961219764, 'slip_spread_k': 0.9085871806489457, 'spread_hl_frac': 0.02116035474380798, 'bb_std_mult': 2.9166327798521228, 'rsi_os': 27, 'rsi_ob': 87, 'vol_spike': 0.12258106350294234, 'adx_thresh': 22.22395932575268, 'atr_min_pct': 0.022433447045296585, 'atr_max_pct': 0.053784029783723014, 'tp_mult': 2.5235106921004253, 'tsl_mult': 0.837448066477584, 'strategy': 'mean_reversion', 'time_stop': 170, 'use_sma': True, 'use_atr': False, 'use_adx': False, 'use_ema': True, 'use_spike': True, 'rsi_required': True, 'edge_k': 0.05634465567235167, 'edge_cap': 0.9952550048795661, 'bull_strategy': 'breakout', 'bull_bb_std_mult': 2.918563954690366, 'bull_rsi_os': 48, 'bull_rsi_ob': 56, 'bull_adx_thresh': 29.415275839706467, 'bull_atr_min_pct': 0.0018197151639067575, 'bull_atr_max_pct': 0.14026517506898484, 'bull_tp_mult': 2.595224846191515, 'bull_tsl_mult': 0.025034837312473246, 'bull_time_stop': 247, 'bull_use_sma': True, 'bull_use_ema': True, 'bull_use_atr': True, 'bull_use_adx': True, 'bull_use_spike': True, 'bull_rsi_required': False, 'bear_strategy': 'breakout', 'bear_bb_std_mult': 0.8978539662982821, 'bear_rsi_os': 33, 'bear_rsi_ob': 45, 'bear_adx_thresh': 15.688051708299632, 'bear_atr_min_pct': 0.011616278136951909, 'bear_atr_max_pct': 0.03085005526147956, 'bear_tp_mult': 1.402156696510596, 'bear_tsl_mult': 0.2910642628483303, 'bear_time_stop': 299, 'bear_use_sma': False, 'bear_use_ema': True, 'bear_use_atr': False, 'bear_use_adx': False, 'bear_use_spike': True, 'bear_rsi_required': False, 'sideways_strategy': 'mean_reversion', 'sideways_bb_std_mult': 3.4494427614767917, 'sideways_rsi_os': 10, 'sideways_rsi_ob': 86, 'sideways_adx_thresh': 22.530310399016567, 'sideways_atr_min_pct': 0.02759134191231984, 'sideways_atr_max_pct': 0.08571449025493107, 'sideways_tp_mult': 1.4884103651797276, 'sideways_tsl_mult': 0.8815284174196101, 'sideways_time_stop': 48, 'sideways_use_sma': True, 'sideways_use_ema': True, 'sideways_use_atr': False, 'sideways_use_adx': False, 'sideways_use_spike': False, 'sideways_rsi_required': True}.
[I 2025-09-01 11:17:53,190] Trial 233 finished with values: [-0.03030602728402154, 0.03038161716999544] and parameters: {'p_sma': 13, 'p_std': 6, 'p_atr': 13, 'p_adx': 29, 'rsi_period': 45, 'ema1': 8, 'ema2': 13, 'slip_atr_k': 0.08643504839564392, 'slip_spread_k': 0.10733462053084925, 'spread_hl_frac': 0.025284689523284477, 'bb_std_mult': 3.5968786334074676, 'rsi_os': 28, 'rsi_ob': 91, 'vol_spike': 0.05812187398936028, 'adx_thresh': 23.65398981591746, 'atr_min_pct': 0.0034206960392870137, 'atr_max_pct': 0.03399469226828982, 'tp_mult': 2.43954361966212, 'tsl_mult': 0.9419006322103814, 'strategy': 'mean_reversion', 'time_stop': 239, 'use_sma': True, 'use_atr': False, 'use_adx': False, 'use_ema': False, 'use_spike': True, 'rsi_required': False, 'edge_k': 0.2625869251599402, 'edge_cap': 0.28691647439992995, 'bull_strategy': 'breakout', 'bull_bb_std_mult': 2.9006674211991412, 'bull_rsi_os': 50, 'bull_rsi_ob': 90, 'bull_adx_thresh': 29.259641480491247, 'bull_atr_min_pct': 0.001351163020936521, 'bull_atr_max_pct': 0.06843247258920299, 'bull_tp_mult': 2.6224478567060023, 'bull_tsl_mult': 0.7849045107045656, 'bull_time_stop': 241, 'bull_use_sma': True, 'bull_use_ema': True, 'bull_use_atr': True, 'bull_use_adx': True, 'bull_use_spike': False, 'bull_rsi_required': True, 'bear_strategy': 'mean_reversion', 'bear_bb_std_mult': 0.9322043444267561, 'bear_rsi_os': 32, 'bear_rsi_ob': 45, 'bear_adx_thresh': 16.904593574137934, 'bear_atr_min_pct': 0.011506547008504222, 'bear_atr_max_pct': 0.02007611340370338, 'bear_tp_mult': 2.210849680459806, 'bear_tsl_mult': 0.2922430621481512, 'bear_time_stop': 225, 'bear_use_sma': False, 'bear_use_ema': True, 'bear_use_atr': False, 'bear_use_adx': False, 'bear_use_spike': True, 'bear_rsi_required': True, 'sideways_strategy': 'mean_reversion', 'sideways_bb_std_mult': 1.1648752315209863, 'sideways_rsi_os': 45, 'sideways_rsi_ob': 86, 'sideways_adx_thresh': 25.026527265325914, 'sideways_atr_min_pct': 0.017891018611316867, 'sideways_atr_max_pct': 0.08560160427465671, 'sideways_tp_mult': 2.6902246859706898, 'sideways_tsl_mult': 0.8783765234715311, 'sideways_time_stop': 48, 'sideways_use_sma': True, 'sideways_use_ema': True, 'sideways_use_atr': True, 'sideways_use_adx': False, 'sideways_use_spike': True, 'sideways_rsi_required': True}.
[I 2025-09-01 11:17:53,436] Trial 237 finished with values: [-0.009576102749896509, 0.009645752641603006] and parameters: {'p_sma': 11, 'p_std': 27, 'p_atr': 9, 'p_adx': 29, 'rsi_period': 45, 'ema1': 20, 'ema2': 13, 'slip_atr_k': 0.016156144719301255, 'slip_spread_k': 0.06460361033182131, 'spread_hl_frac': 0.03289870769264791, 'bb_std_mult': 1.0679320713588427, 'rsi_os': 26, 'rsi_ob': 92, 'vol_spike': 0.029241482234883737, 'adx_thresh': 22.917460849233883, 'atr_min_pct': 0.023579808584155933, 'atr_max_pct': 0.0342103942208974, 'tp_mult': 2.351223938504613, 'tsl_mult': 0.9913124424751638, 'strategy': 'mean_reversion', 'time_stop': 242, 'use_sma': True, 'use_atr': False, 'use_adx': False, 'use_ema': False, 'use_spike': True, 'rsi_required': False, 'edge_k': 0.1558464496387615, 'edge_cap': 0.38573972728348865, 'bull_strategy': 'breakout', 'bull_bb_std_mult': 0.7975243632891618, 'bull_rsi_os': 50, 'bull_rsi_ob': 87, 'bull_adx_thresh': 20.35449945655995, 'bull_atr_min_pct': 0.0011910058703158545, 'bull_atr_max_pct': 0.06742655153075208, 'bull_tp_mult': 2.416955580794387, 'bull_tsl_mult': 0.8346809115513403, 'bull_time_stop': 242, 'bull_use_sma': True, 'bull_use_ema': True, 'bull_use_atr': True, 'bull_use_adx': True, 'bull_use_spike': True, 'bull_rsi_required': False, 'bear_strategy': 'mean_reversion', 'bear_bb_std_mult': 0.7994357940650174, 'bear_rsi_os': 50, 'bear_rsi_ob': 46, 'bear_adx_thresh': 15.620731206055574, 'bear_atr_min_pct': 0.007731408243986104, 'bear_atr_max_pct': 0.08294988362430687, 'bear_tp_mult': 2.491072382061255, 'bear_tsl_mult': 0.3518492376253386, 'bear_time_stop': 299, 'bear_use_sma': False, 'bear_use_ema': True, 'bear_use_atr': False, 'bear_use_adx': False, 'bear_use_spike': True, 'bear_rsi_required': True, 'sideways_strategy': 'mean_reversion', 'sideways_bb_std_mult': 3.4545152831200947, 'sideways_rsi_os': 23, 'sideways_rsi_ob': 88, 'sideways_adx_thresh': 25.361671941135565, 'sideways_atr_min_pct': 0.017805346162442108, 'sideways_atr_max_pct': 0.027947763353574497, 'sideways_tp_mult': 1.6753479230837756, 'sideways_tsl_mult': 0.4912795104934461, 'sideways_time_stop': 90, 'sideways_use_sma': True, 'sideways_use_ema': True, 'sideways_use_atr': True, 'sideways_use_adx': False, 'sideways_use_spike': False, 'sideways_rsi_required': True}.
[I 2025-09-01 11:17:53,984] Trial 240 finished with values: [-1000000000.0, 1000000000.0] and parameters: {'p_sma': 35, 'p_std': 27, 'p_atr': 9, 'p_adx': 7, 'rsi_period': 53, 'ema1': 5, 'ema2': 34, 'slip_atr_k': 0.006092824585332331, 'slip_spread_k': 0.05675133681221857, 'spread_hl_frac': 0.02735245000368087, 'bb_std_mult': 3.1537467702354256, 'rsi_os': 51, 'rsi_ob': 84, 'vol_spike': 0.11567637059967902, 'adx_thresh': 23.15343320780484, 'atr_min_pct': 0.019553658256457808, 'atr_max_pct': 0.11276372954085463, 'tp_mult': 1.3196397772176236, 'tsl_mult': 0.6864126762780416, 'strategy': 'mean_reversion', 'time_stop': 148, 'use_sma': True, 'use_atr': False, 'use_adx': False, 'use_ema': True, 'use_spike': True, 'rsi_required': True, 'edge_k': 0.8826721971057746, 'edge_cap': 0.3193939226969781, 'bull_strategy': 'breakout', 'bull_bb_std_mult': 0.6947536891509771, 'bull_rsi_os': 7, 'bull_rsi_ob': 87, 'bull_adx_thresh': 15.75835171447432, 'bull_atr_min_pct': 0.01661021628246397, 'bull_atr_max_pct': 0.046391528036065034, 'bull_tp_mult': 2.4269977497623096, 'bull_tsl_mult': 0.25930213030352267, 'bull_time_stop': 261, 'bull_use_sma': True, 'bull_use_ema': True, 'bull_use_atr': True, 'bull_use_adx': True, 'bull_use_spike': True, 'bull_rsi_required': False, 'bear_strategy': 'breakout', 'bear_bb_std_mult': 0.8357916079234113, 'bear_rsi_os': 31, 'bear_rsi_ob': 56, 'bear_adx_thresh': 16.01897701799034, 'bear_atr_min_pct': 0.00756917611502103, 'bear_atr_max_pct': 0.08484214952708798, 'bear_tp_mult': 2.527179640234333, 'bear_tsl_mult': 0.8257237462229599, 'bear_time_stop': 248, 'bear_use_sma': False, 'bear_use_ema': True, 'bear_use_atr': False, 'bear_use_adx': False, 'bear_use_spike': True, 'bear_rsi_required': False, 'sideways_strategy': 'mean_reversion', 'sideways_bb_std_mult': 1.03223645875561, 'sideways_rsi_os': 21, 'sideways_rsi_ob': 88, 'sideways_adx_thresh': 24.00555708179131, 'sideways_atr_min_pct': 0.01759576231186208, 'sideways_atr_max_pct': 0.06257330219417354, 'sideways_tp_mult': 1.7345566616246073, 'sideways_tsl_mult': 0.4655630953944577, 'sideways_time_stop': 31, 'sideways_use_sma': True, 'sideways_use_ema': True, 'sideways_use_atr': False, 'sideways_use_adx': False, 'sideways_use_spike': False, 'sideways_rsi_required': True}.
[I 2025-09-01 11:18:36,829] Trial 238 finished with values: [-1000000000.0, 1000000000.0] and parameters: {'p_sma': 11, 'p_std': 43, 'p_atr': 30, 'p_adx': 11, 'rsi_period': 46, 'ema1': 5, 'ema2': 11, 'slip_atr_k': 0.006336217429853334, 'slip_spread_k': 0.06136344239290278, 'spread_hl_frac': 0.016548034515219016, 'bb_std_mult': 1.0662308808065224, 'rsi_os': 26, 'rsi_ob': 91, 'vol_spike': 0.10758327333624523, 'adx_thresh': 22.742965172407597, 'atr_min_pct': 0.0238047102510047, 'atr_max_pct': 0.13556265108032334, 'tp_mult': 2.4258871559411124, 'tsl_mult': 0.994923239922155, 'strategy': 'mean_reversion', 'time_stop': 245, 'use_sma': True, 'use_atr': False, 'use_adx': False, 'use_ema': False, 'use_spike': True, 'rsi_required': False, 'edge_k': 0.2751981979420387, 'edge_cap': 0.3067250558584215, 'bull_strategy': 'breakout', 'bull_bb_std_mult': 3.3662746345963637, 'bull_rsi_os': 13, 'bull_rsi_ob': 53, 'bull_adx_thresh': 22.47493818344246, 'bull_atr_min_pct': 0.027831890648439578, 'bull_atr_max_pct': 0.09368861748574096, 'bull_tp_mult': 2.393829751980416, 'bull_tsl_mult': 0.8339643639347374, 'bull_time_stop': 242, 'bull_use_sma': True, 'bull_use_ema': True, 'bull_use_atr': True, 'bull_use_adx': True, 'bull_use_spike': False, 'bull_rsi_required': False, 'bear_strategy': 'mean_reversion', 'bear_bb_std_mult': 0.8305649323469347, 'bear_rsi_os': 32, 'bear_rsi_ob': 56, 'bear_adx_thresh': 16.204956885692468, 'bear_atr_min_pct': 0.028190055557424088, 'bear_atr_max_pct': 0.023490418110384395, 'bear_tp_mult': 2.5316902388069678, 'bear_tsl_mult': 0.36372348873958554, 'bear_time_stop': 66, 'bear_use_sma': False, 'bear_use_ema': True, 'bear_use_atr': False, 'bear_use_adx': False, 'bear_use_spike': True, 'bear_rsi_required': True, 'sideways_strategy': 'mean_reversion', 'sideways_bb_std_mult': 3.5306823849102686, 'sideways_rsi_os': 45, 'sideways_rsi_ob': 88, 'sideways_adx_thresh': 25.518219678823613, 'sideways_atr_min_pct': 0.02775700934539055, 'sideways_atr_max_pct': 0.1277923397058457, 'sideways_tp_mult': 1.6571192259117258, 'sideways_tsl_mult': 0.5994398571422804, 'sideways_time_stop': 45, 'sideways_use_sma': True, 'sideways_use_ema': True, 'sideways_use_atr': True, 'sideways_use_adx': False, 'sideways_use_spike': False, 'sideways_rsi_required': True}.
[I 2025-09-01 11:18:37,625] Trial 242 finished with values: [-1000000000.0, 1000000000.0] and parameters: {'p_sma': 16, 'p_std': 59, 'p_atr': 9, 'p_adx': 11, 'rsi_period': 9, 'ema1': 6, 'ema2': 29, 'slip_atr_k': 0.14768864223234346, 'slip_spread_k': 0.07437763850785697, 'spread_hl_frac': 0.03715950393697273, 'bb_std_mult': 3.0480590740597, 'rsi_os': 13, 'rsi_ob': 92, 'vol_spike': 0.10613569073078993, 'adx_thresh': 12.825280652622556, 'atr_min_pct': 0.0103585917409006, 'atr_max_pct': 0.016751882034278437, 'tp_mult': 1.4253772276946757, 'tsl_mult': 0.9925486958287663, 'strategy': 'breakout', 'time_stop': 258, 'use_sma': False, 'use_atr': False, 'use_adx': False, 'use_ema': False, 'use_spike': True, 'rsi_required': False, 'edge_k': 0.21158971550265396, 'edge_cap': 0.30963769335184455, 'bull_strategy': 'mean_reversion', 'bull_bb_std_mult': 0.5856695318442051, 'bull_rsi_os': 13, 'bull_rsi_ob': 89, 'bull_adx_thresh': 30.11599051535949, 'bull_atr_min_pct': 0.017943020384415864, 'bull_atr_max_pct': 0.12864826557580702, 'bull_tp_mult': 2.7025710643545726, 'bull_tsl_mult': 0.8218231426111656, 'bull_time_stop': 236, 'bull_use_sma': True, 'bull_use_ema': True, 'bull_use_atr': True, 'bull_use_adx': True, 'bull_use_spike': False, 'bull_rsi_required': False, 'bear_strategy': 'mean_reversion', 'bear_bb_std_mult': 3.0122375080305916, 'bear_rsi_os': 21, 'bear_rsi_ob': 48, 'bear_adx_thresh': 16.73586862206637, 'bear_atr_min_pct': 0.028606986991381086, 'bear_atr_max_pct': 0.024094303425329543, 'bear_tp_mult': 2.9011758238974092, 'bear_tsl_mult': 0.25609685840245827, 'bear_time_stop': 98, 'bear_use_sma': True, 'bear_use_ema': True, 'bear_use_atr': False, 'bear_use_adx': False, 'bear_use_spike': True, 'bear_rsi_required': True, 'sideways_strategy': 'mean_reversion', 'sideways_bb_std_mult': 3.529567606725374, 'sideways_rsi_os': 23, 'sideways_rsi_ob': 88, 'sideways_adx_thresh': 25.712489020065934, 'sideways_atr_min_pct': 0.02901525202134076, 'sideways_atr_max_pct': 0.09655172570048416, 'sideways_tp_mult': 1.6583803651479694, 'sideways_tsl_mult': 0.937001671241602, 'sideways_time_stop': 250, 'sideways_use_sma': True, 'sideways_use_ema': True, 'sideways_use_atr': True, 'sideways_use_adx': False, 'sideways_use_spike': False, 'sideways_rsi_required': True}.
[I 2025-09-01 11:18:37,940] Trial 241 finished with values: [-1000000000.0, 1000000000.0] and parameters: {'p_sma': 52, 'p_std': 27, 'p_atr': 9, 'p_adx': 30, 'rsi_period': 10, 'ema1': 20, 'ema2': 10, 'slip_atr_k': 0.0002933609370946305, 'slip_spread_k': 0.06622151592444113, 'spread_hl_frac': 0.032540748341012816, 'bb_std_mult': 3.3677136332930644, 'rsi_os': 26, 'rsi_ob': 79, 'vol_spike': 0.00867891634331222, 'adx_thresh': 29.275841986567983, 'atr_min_pct': 0.028943766607736458, 'atr_max_pct': 0.1367211608352828, 'tp_mult': 2.6040909911703918, 'tsl_mult': 0.9902946294838196, 'strategy': 'mean_reversion', 'time_stop': 149, 'use_sma': True, 'use_atr': False, 'use_adx': False, 'use_ema': False, 'use_spike': True, 'rsi_required': False, 'edge_k': 0.2157676378422143, 'edge_cap': 0.31025825590699635, 'bull_strategy': 'breakout', 'bull_bb_std_mult': 3.4029014412111005, 'bull_rsi_os': 7, 'bull_rsi_ob': 91, 'bull_adx_thresh': 31.38941312569704, 'bull_atr_min_pct': 0.021259347909799334, 'bull_atr_max_pct': 0.09354490555913779, 'bull_tp_mult': 2.396723084565416, 'bull_tsl_mult': 0.8313705638443059, 'bull_time_stop': 237, 'bull_use_sma': True, 'bull_use_ema': True, 'bull_use_atr': True, 'bull_use_adx': True, 'bull_use_spike': True, 'bull_rsi_required': False, 'bear_strategy': 'breakout', 'bear_bb_std_mult': 0.8198411718679741, 'bear_rsi_os': 21, 'bear_rsi_ob': 47, 'bear_adx_thresh': 16.171574257586474, 'bear_atr_min_pct': 0.02834364308021213, 'bear_atr_max_pct': 0.08455795188021223, 'bear_tp_mult': 1.0648404923867583, 'bear_tsl_mult': 0.3479258987408857, 'bear_time_stop': 99, 'bear_use_sma': False, 'bear_use_ema': True, 'bear_use_atr': False, 'bear_use_adx': False, 'bear_use_spike': True, 'bear_rsi_required': True, 'sideways_strategy': 'mean_reversion', 'sideways_bb_std_mult': 3.5330847034621033, 'sideways_rsi_os': 23, 'sideways_rsi_ob': 88, 'sideways_adx_thresh': 23.78991318748667, 'sideways_atr_min_pct': 0.01707923434788513, 'sideways_atr_max_pct': 0.12307851633761926, 'sideways_tp_mult': 1.6728590019082068, 'sideways_tsl_mult': 0.9399394305905495, 'sideways_time_stop': 117, 'sideways_use_sma': True, 'sideways_use_ema': True, 'sideways_use_atr': True, 'sideways_use_adx': False, 'sideways_use_spike': False, 'sideways_rsi_required': True}.
[I 2025-09-01 11:18:38,394] Trial 239 finished with values: [-0.023513401556303104, 0.023454924855956023] and parameters: {'p_sma': 14, 'p_std': 26, 'p_atr': 9, 'p_adx': 7, 'rsi_period': 14, 'ema1': 5, 'ema2': 34, 'slip_atr_k': 0.015625460050397843, 'slip_spread_k': 0.0595824932501777, 'spread_hl_frac': 0.032112834852957496, 'bb_std_mult': 1.085511438044209, 'rsi_os': 15, 'rsi_ob': 91, 'vol_spike': 0.11638339807608741, 'adx_thresh': 22.9175896434098, 'atr_min_pct': 0.003421193313232873, 'atr_max_pct': 0.017405905792533483, 'tp_mult': 2.444932507141433, 'tsl_mult': 0.004453413388984029, 'strategy': 'mean_reversion', 'time_stop': 245, 'use_sma': True, 'use_atr': False, 'use_adx': False, 'use_ema': False, 'use_spike': True, 'rsi_required': False, 'edge_k': 0.251189479750893, 'edge_cap': 0.31173247050409214, 'bull_strategy': 'breakout', 'bull_bb_std_mult': 3.383160106039312, 'bull_rsi_os': 7, 'bull_rsi_ob': 93, 'bull_adx_thresh': 15.4376827021127, 'bull_atr_min_pct': 0.0008915386143350772, 'bull_atr_max_pct': 0.06666691615860487, 'bull_tp_mult': 2.415336902748088, 'bull_tsl_mult': 0.8290590699732213, 'bull_time_stop': 237, 'bull_use_sma': True, 'bull_use_ema': True, 'bull_use_atr': True, 'bull_use_adx': True, 'bull_use_spike': False, 'bull_rsi_required': False, 'bear_strategy': 'mean_reversion', 'bear_bb_std_mult': 2.1493680340624763, 'bear_rsi_os': 51, 'bear_rsi_ob': 79, 'bear_adx_thresh': 16.661569001890115, 'bear_atr_min_pct': 0.007485851995477413, 'bear_atr_max_pct': 0.02312254133187463, 'bear_tp_mult': 2.9327351030115474, 'bear_tsl_mult': 0.7221859135045039, 'bear_time_stop': 98, 'bear_use_sma': False, 'bear_use_ema': True, 'bear_use_atr': False, 'bear_use_adx': False, 'bear_use_spike': True, 'bear_rsi_required': True, 'sideways_strategy': 'mean_reversion', 'sideways_bb_std_mult': 3.525901995886626, 'sideways_rsi_os': 21, 'sideways_rsi_ob': 88, 'sideways_adx_thresh': 25.25606827555118, 'sideways_atr_min_pct': 0.017084775136301175, 'sideways_atr_max_pct': 0.03635448468855893, 'sideways_tp_mult': 1.6981790635886762, 'sideways_tsl_mult': 0.5290163343826252, 'sideways_time_stop': 245, 'sideways_use_sma': True, 'sideways_use_ema': True, 'sideways_use_atr': True, 'sideways_use_adx': False, 'sideways_use_spike': False, 'sideways_rsi_required': True}.
