[I 2025-09-01 11:17:10,240] Trial 227 finished with values: [-1000000000.0, 1000000000.0] and parameters: {'p_sma': 58, 'p_std': 25, 'p_atr': 26, 'p_adx': 30, 'rsi_period': 51, 'ema1': 21, 'ema2': 36, 'slip_atr_k': 0.005757535646398879, 'slip_spread_k': 0.07802488837374412, 'spread_hl_frac': 0.022763106384378336, 'bb_std_mult': 3.3162608334097925, 'rsi_os': 27, 'rsi_ob': 88, 'vol_spike': 0.11348306309779445, 'adx_thresh': 21.993978175497247, 'atr_min_pct': 0.028278929712380677, 'atr_max_pct': 0.04765127200860867, 'tp_mult': 2.572498013686782, 'tsl_mult': 0.8946415690237173, 'strategy': 'breakout', 'time_stop': 230, 'use_sma': False, 'use_atr': False, 'use_adx': False, 'use_ema': True, 'use_spike': True, 'rsi_required': True, 'edge_k': 0.4147889964398084, 'edge_cap': 0.2581416037314084, 'bull_strategy': 'mean_reversion', 'bull_bb_std_mult': 3.224453698949139, 'bull_rsi_os': 47, 'bull_rsi_ob': 85, 'bull_adx_thresh': 30.552033664484924, 'bull_atr_min_pct': 0.008198565919824163, 'bull_atr_max_pct': 0.08996473230952738, 'bull_tp_mult': 2.5492478261001974, 'bull_tsl_mult': 0.8121757053248249, 'bull_time_stop': 259, 'bull_use_sma': True, 'bull_use_ema': True, 'bull_use_atr': True, 'bull_use_adx': True, 'bull_use_spike': True, 'bull_rsi_required': False, 'bear_strategy': 'breakout', 'bear_bb_std_mult': 0.8107285027712442, 'bear_rsi_os': 25, 'bear_rsi_ob': 52, 'bear_adx_thresh': 12.06401628087464, 'bear_atr_min_pct': 0.009614066814038707, 'bear_atr_max_pct': 0.03391811259791402, 'bear_tp_mult': 2.912865201290398, 'bear_tsl_mult': 0.3427423090050916, 'bear_time_stop': 97, 'bear_use_sma': True, 'bear_use_ema': True, 'bear_use_atr': False, 'bear_use_adx': False, 'bear_use_spike': True, 'bear_rsi_required': False, 'sideways_strategy': 'mean_reversion', 'sideways_bb_std_mult': 3.5968873029990744, 'sideways_rsi_os': 31, 'sideways_rsi_ob': 89, 'sideways_adx_thresh': 26.590002382231315, 'sideways_atr_min_pct': 0.004755660163031765, 'sideways_atr_max_pct': 0.022135102318932155, 'sideways_tp_mult': 1.5290973339652445, 'sideways_tsl_mult': 0.7849102490514523, 'sideways_time_stop': 208, 'sideways_use_sma': True, 'sideways_use_ema': False, 'sideways_use_atr': False, 'sideways_use_adx': False, 'sideways_use_spike': False, 'sideways_rsi_required': True}.
[I 2025-09-01 11:17:11,092] Trial 225 finished with values: [-1000000000.0, 1000000000.0] and parameters: {'p_sma': 14, 'p_std': 25, 'p_atr': 15, 'p_adx': 30, 'rsi_period': 51, 'ema1': 21, 'ema2': 36, 'slip_atr_k': 0.19078942920980918, 'slip_spread_k': 0.04283975461891212, 'spread_hl_frac': 0.0364146389670122, 'bb_std_mult': 3.1870954880565656, 'rsi_os': 26, 'rsi_ob': 80, 'vol_spike': 0.2414858811743082, 'adx_thresh': 21.346147650499283, 'atr_min_pct': 0.02851630902681593, 'atr_max_pct': 0.050219042223217714, 'tp_mult': 2.5757062396986314, 'tsl_mult': 0.7194949614256899, 'strategy': 'breakout', 'time_stop': 252, 'use_sma': False, 'use_atr': False, 'use_adx': False, 'use_ema': True, 'use_spike': True, 'rsi_required': True, 'edge_k': 0.3628793731729224, 'edge_cap': 0.25060742043596895, 'bull_strategy': 'mean_reversion', 'bull_bb_std_mult': 3.247894208732016, 'bull_rsi_os': 46, 'bull_rsi_ob': 88, 'bull_adx_thresh': 30.30982263228025, 'bull_atr_min_pct': 0.02872104072688257, 'bull_atr_max_pct': 0.09064673705299493, 'bull_tp_mult': 2.5184670622027547, 'bull_tsl_mult': 0.4418321665900383, 'bull_time_stop': 252, 'bull_use_sma': True, 'bull_use_ema': True, 'bull_use_atr': True, 'bull_use_adx': True, 'bull_use_spike': True, 'bull_rsi_required': False, 'bear_strategy': 'breakout', 'bear_bb_std_mult': 0.5791114552088197, 'bear_rsi_os': 36, 'bear_rsi_ob': 47, 'bear_adx_thresh': 14.543571764024557, 'bear_atr_min_pct': 0.009384965673391428, 'bear_atr_max_pct': 0.02224606874860719, 'bear_tp_mult': 2.3877704854241286, 'bear_tsl_mult': 0.24359118121957568, 'bear_time_stop': 104, 'bear_use_sma': True, 'bear_use_ema': True, 'bear_use_atr': False, 'bear_use_adx': False, 'bear_use_spike': True, 'bear_rsi_required': False, 'sideways_strategy': 'mean_reversion', 'sideways_bb_std_mult': 3.598748499048723, 'sideways_rsi_os': 22, 'sideways_rsi_ob': 89, 'sideways_adx_thresh': 26.083756832388747, 'sideways_atr_min_pct': 0.01849738590062429, 'sideways_atr_max_pct': 0.09401507708345685, 'sideways_tp_mult': 1.5220439675249438, 'sideways_tsl_mult': 0.4636592845496067, 'sideways_time_stop': 128, 'sideways_use_sma': True, 'sideways_use_ema': True, 'sideways_use_atr': False, 'sideways_use_adx': False, 'sideways_use_spike': False, 'sideways_rsi_required': True}.
[I 2025-09-01 11:17:11,339] Trial 224 finished with values: [-1000000000.0, 1000000000.0] and parameters: {'p_sma': 11, 'p_std': 52, 'p_atr': 17, 'p_adx': 30, 'rsi_period': 51, 'ema1': 21, 'ema2': 35, 'slip_atr_k': 0.19009612542641263, 'slip_spread_k': 0.04249591252568039, 'spread_hl_frac': 0.03518285372523793, 'bb_std_mult': 3.1988284115508714, 'rsi_os': 36, 'rsi_ob': 81, 'vol_spike': 0.11152518848188038, 'adx_thresh': 21.325805057477673, 'atr_min_pct': 0.028343087163886484, 'atr_max_pct': 0.04664711200460362, 'tp_mult': 2.564202500531633, 'tsl_mult': 0.7057250742622161, 'strategy': 'breakout', 'time_stop': 112, 'use_sma': False, 'use_atr': False, 'use_adx': False, 'use_ema': True, 'use_spike': True, 'rsi_required': True, 'edge_k': 0.3735826315157035, 'edge_cap': 0.2609834103059397, 'bull_strategy': 'mean_reversion', 'bull_bb_std_mult': 3.1510382971615387, 'bull_rsi_os': 46, 'bull_rsi_ob': 65, 'bull_adx_thresh': 30.729902182886388, 'bull_atr_min_pct': 0.0097140038168286, 'bull_atr_max_pct': 0.0900570330335187, 'bull_tp_mult': 2.2299780720291933, 'bull_tsl_mult': 0.8097621899388864, 'bull_time_stop': 255, 'bull_use_sma': True, 'bull_use_ema': True, 'bull_use_atr': True, 'bull_use_adx': True, 'bull_use_spike': True, 'bull_rsi_required': False, 'bear_strategy': 'breakout', 'bear_bb_std_mult': 0.694719184340491, 'bear_rsi_os': 36, 'bear_rsi_ob': 50, 'bear_adx_thresh': 11.50974977125012, 'bear_atr_min_pct': 0.009356372334194904, 'bear_atr_max_pct': 0.02573933426467919, 'bear_tp_mult': 2.744362698952985, 'bear_tsl_mult': 0.24702911294603047, 'bear_time_stop': 104, 'bear_use_sma': True, 'bear_use_ema': True, 'bear_use_atr': False, 'bear_use_adx': False, 'bear_use_spike': True, 'bear_rsi_required': False, 'sideways_strategy': 'mean_reversion', 'sideways_bb_std_mult': 3.5362603396244645, 'sideways_rsi_os': 22, 'sideways_rsi_ob': 87, 'sideways_adx_thresh': 24.40624976594986, 'sideways_atr_min_pct': 0.019049914954717494, 'sideways_atr_max_pct': 0.07143028390399028, 'sideways_tp_mult': 1.5464286564181833, 'sideways_tsl_mult': 0.3995177233045371, 'sideways_time_stop': 262, 'sideways_use_sma': True, 'sideways_use_ema': True, 'sideways_use_atr': False, 'sideways_use_adx': False, 'sideways_use_spike': False, 'sideways_rsi_required': True}.
[I 2025-09-01 11:17:11,703] Trial 228 finished with values: [-1000000000.0, 1000000000.0] and parameters: {'p_sma': 45, 'p_std': 25, 'p_atr': 28, 'p_adx': 30, 'rsi_period': 51, 'ema1': 21, 'ema2': 39, 'slip_atr_k': 0.21308109677726772, 'slip_spread_k': 0.059516995774359156, 'spread_hl_frac': 0.024295863585452347, 'bb_std_mult': 3.459344676249435, 'rsi_os': 27, 'rsi_ob': 82, 'vol_spike': 0.24069444180981758, 'adx_thresh': 21.846659205438606, 'atr_min_pct': 0.029381223253254034, 'atr_max_pct': 0.04947151852624969, 'tp_mult': 2.5935628533356736, 'tsl_mult': 0.8962263129438627, 'strategy': 'mean_reversion', 'time_stop': 250, 'use_sma': True, 'use_atr': False, 'use_adx': False, 'use_ema': True, 'use_spike': True, 'rsi_required': True, 'edge_k': 0.40697497850575265, 'edge_cap': 0.3423255584258329, 'bull_strategy': 'breakout', 'bull_bb_std_mult': 2.759448232526862, 'bull_rsi_os': 47, 'bull_rsi_ob': 73, 'bull_adx_thresh': 13.222210402194307, 'bull_atr_min_pct': 0.009190846831216489, 'bull_atr_max_pct': 0.09055575565336466, 'bull_tp_mult': 2.5377003141388617, 'bull_tsl_mult': 0.7702344899986995, 'bull_time_stop': 252, 'bull_use_sma': True, 'bull_use_ema': True, 'bull_use_atr': True, 'bull_use_adx': False, 'bull_use_spike': True, 'bull_rsi_required': False, 'bear_strategy': 'breakout', 'bear_bb_std_mult': 0.8219497041249128, 'bear_rsi_os': 35, 'bear_rsi_ob': 52, 'bear_adx_thresh': 17.864579099974964, 'bear_atr_min_pct': 0.009281640607787694, 'bear_atr_max_pct': 0.03466746803193988, 'bear_tp_mult': 2.7273153983971143, 'bear_tsl_mult': 0.9438746079325819, 'bear_time_stop': 110, 'bear_use_sma': False, 'bear_use_ema': True, 'bear_use_atr': False, 'bear_use_adx': False, 'bear_use_spike': True, 'bear_rsi_required': False, 'sideways_strategy': 'mean_reversion', 'sideways_bb_std_mult': 2.047976913387584, 'sideways_rsi_os': 20, 'sideways_rsi_ob': 89, 'sideways_adx_thresh': 24.50773488636013, 'sideways_atr_min_pct': 0.012535524076510653, 'sideways_atr_max_pct': 0.04010458905267156, 'sideways_tp_mult': 1.5404208544285525, 'sideways_tsl_mult': 0.7902023004543648, 'sideways_time_stop': 265, 'sideways_use_sma': True, 'sideways_use_ema': True, 'sideways_use_atr': False, 'sideways_use_adx': False, 'sideways_use_spike': False, 'sideways_rsi_required': False}.
[I 2025-09-01 11:17:12,364] Trial 229 finished with values: [-1000000000.0, 1000000000.0] and parameters: {'p_sma': 14, 'p_std': 26, 'p_atr': 28, 'p_adx': 30, 'rsi_period': 48, 'ema1': 22, 'ema2': 37, 'slip_atr_k': 0.1304403854196653, 'slip_spread_k': 0.11444938418768412, 'spread_hl_frac': 0.033584257550256257, 'bb_std_mult': 3.510062390901064, 'rsi_os': 28, 'rsi_ob': 89, 'vol_spike': 0.2099979928484937, 'adx_thresh': 21.42361041613505, 'atr_min_pct': 0.029998302377408297, 'atr_max_pct': 0.026821261477359266, 'tp_mult': 2.6290854394883354, 'tsl_mult': 0.8680408456635701, 'strategy': 'mean_reversion', 'time_stop': 134, 'use_sma': True, 'use_atr': False, 'use_adx': False, 'use_ema': True, 'use_spike': True, 'rsi_required': True, 'edge_k': 0.5145711574979196, 'edge_cap': 0.3512746132124112, 'bull_strategy': 'breakout', 'bull_bb_std_mult': 3.0509753785939395, 'bull_rsi_os': 48, 'bull_rsi_ob': 47, 'bull_adx_thresh': 12.782652689912595, 'bull_atr_min_pct': 0.0099004653159088, 'bull_atr_max_pct': 0.015509542477929086, 'bull_tp_mult': 2.329350057865463, 'bull_tsl_mult': 0.3646195001859046, 'bull_time_stop': 251, 'bull_use_sma': True, 'bull_use_ema': True, 'bull_use_atr': True, 'bull_use_adx': False, 'bull_use_spike': True, 'bull_rsi_required': True, 'bear_strategy': 'breakout', 'bear_bb_std_mult': 0.7186965492632051, 'bear_rsi_os': 14, 'bear_rsi_ob': 49, 'bear_adx_thresh': 32.25175616990905, 'bear_atr_min_pct': 0.008956767794962161, 'bear_atr_max_pct': 0.02582815555131985, 'bear_tp_mult': 2.7298655300525665, 'bear_tsl_mult': 0.31764911843496074, 'bear_time_stop': 110, 'bear_use_sma': False, 'bear_use_ema': True, 'bear_use_atr': False, 'bear_use_adx': False, 'bear_use_spike': True, 'bear_rsi_required': False, 'sideways_strategy': 'mean_reversion', 'sideways_bb_std_mult': 3.5586921821576767, 'sideways_rsi_os': 20, 'sideways_rsi_ob': 92, 'sideways_adx_thresh': 25.965767604525976, 'sideways_atr_min_pct': 0.018907888224030635, 'sideways_atr_max_pct': 0.09018661759942817, 'sideways_tp_mult': 1.5973688353468354, 'sideways_tsl_mult': 0.5121204995376561, 'sideways_time_stop': 265, 'sideways_use_sma': True, 'sideways_use_ema': True, 'sideways_use_atr': False, 'sideways_use_adx': False, 'sideways_use_spike': False, 'sideways_rsi_required': False}.
[I 2025-09-01 11:17:12,403] Trial 232 finished with values: [-1000000000.0, 1000000000.0] and parameters: {'p_sma': 13, 'p_std': 34, 'p_atr': 8, 'p_adx': 30, 'rsi_period': 48, 'ema1': 22, 'ema2': 40, 'slip_atr_k': 0.012651719892501015, 'slip_spread_k': 0.10892119598337952, 'spread_hl_frac': 0.025689588007748395, 'bb_std_mult': 3.542822319008007, 'rsi_os': 28, 'rsi_ob': 73, 'vol_spike': 0.09539191105573513, 'adx_thresh': 23.92137665372389, 'atr_min_pct': 0.029983764508468222, 'atr_max_pct': 0.022021897771828496, 'tp_mult': 2.6421739765788006, 'tsl_mult': 0.9533547786109121, 'strategy': 'mean_reversion', 'time_stop': 238, 'use_sma': True, 'use_atr': False, 'use_adx': False, 'use_ema': False, 'use_spike': True, 'rsi_required': False, 'edge_k': 0.5079924105795854, 'edge_cap': 0.6915960969551596, 'bull_strategy': 'breakout', 'bull_bb_std_mult': 3.040360805621393, 'bull_rsi_os': 50, 'bull_rsi_ob': 90, 'bull_adx_thresh': 29.7069348453569, 'bull_atr_min_pct': 0.025892750597765947, 'bull_atr_max_pct': 0.09350625021471365, 'bull_tp_mult': 2.330655103671999, 'bull_tsl_mult': 0.35522329086294613, 'bull_time_stop': 241, 'bull_use_sma': True, 'bull_use_ema': True, 'bull_use_atr': True, 'bull_use_adx': False, 'bull_use_spike': False, 'bull_rsi_required': True, 'bear_strategy': 'mean_reversion', 'bear_bb_std_mult': 0.9224925719777504, 'bear_rsi_os': 14, 'bear_rsi_ob': 49, 'bear_adx_thresh': 30.324789997911587, 'bear_atr_min_pct': 0.010519698249129076, 'bear_atr_max_pct': 0.01883401627178863, 'bear_tp_mult': 2.579642904954158, 'bear_tsl_mult': 0.3175195395320742, 'bear_time_stop': 80, 'bear_use_sma': False, 'bear_use_ema': True, 'bear_use_atr': False, 'bear_use_adx': False, 'bear_use_spike': True, 'bear_rsi_required': True, 'sideways_strategy': 'mean_reversion', 'sideways_bb_std_mult': 1.7109564101291985, 'sideways_rsi_os': 53, 'sideways_rsi_ob': 92, 'sideways_adx_thresh': 25.53918147543697, 'sideways_atr_min_pct': 0.01086151101098494, 'sideways_atr_max_pct': 0.0898153347324664, 'sideways_tp_mult': 2.684183048879194, 'sideways_tsl_mult': 0.5091760550195329, 'sideways_time_stop': 20, 'sideways_use_sma': True, 'sideways_use_ema': True, 'sideways_use_atr': True, 'sideways_use_adx': False, 'sideways_use_spike': True, 'sideways_rsi_required': False}.
[I 2025-09-01 11:17:12,444] Trial 231 finished with values: [-1000000000.0, 1000000000.0] and parameters: {'p_sma': 44, 'p_std': 24, 'p_atr': 14, 'p_adx': 30, 'rsi_period': 48, 'ema1': 22, 'ema2': 39, 'slip_atr_k': 0.014412933148468015, 'slip_spread_k': 0.1257046667353599, 'spread_hl_frac': 0.024227572261169655, 'bb_std_mult': 3.409037962318062, 'rsi_os': 27, 'rsi_ob': 91, 'vol_spike': 0.1247884399703358, 'adx_thresh': 22.1664948495568, 'atr_min_pct': 0.029429858491961395, 'atr_max_pct': 0.025569403788207407, 'tp_mult': 2.6172249042682294, 'tsl_mult': 0.86981099781503, 'strategy': 'mean_reversion', 'time_stop': 90, 'use_sma': True, 'use_atr': False, 'use_adx': False, 'use_ema': True, 'use_spike': True, 'rsi_required': True, 'edge_k': 0.23369183762006507, 'edge_cap': 0.7251049246991261, 'bull_strategy': 'breakout', 'bull_bb_std_mult': 3.0496506703445774, 'bull_rsi_os': 48, 'bull_rsi_ob': 90, 'bull_adx_thresh': 29.60983257735192, 'bull_atr_min_pct': 0.0014550271760365913, 'bull_atr_max_pct': 0.14183625387084148, 'bull_tp_mult': 1.932051792109165, 'bull_tsl_mult': 7.859532170639838e-07, 'bull_time_stop': 249, 'bull_use_sma': True, 'bull_use_ema': True, 'bull_use_atr': True, 'bull_use_adx': False, 'bull_use_spike': True, 'bull_rsi_required': True, 'bear_strategy': 'breakout', 'bear_bb_std_mult': 0.914690226708756, 'bear_rsi_os': 33, 'bear_rsi_ob': 49, 'bear_adx_thresh': 15.723307453992433, 'bear_atr_min_pct': 0.01039275849202568, 'bear_atr_max_pct': 0.019298652769056755, 'bear_tp_mult': 2.2208721089726766, 'bear_tsl_mult': 0.3177702120018537, 'bear_time_stop': 110, 'bear_use_sma': False, 'bear_use_ema': True, 'bear_use_atr': False, 'bear_use_adx': False, 'bear_use_spike': True, 'bear_rsi_required': False, 'sideways_strategy': 'mean_reversion', 'sideways_bb_std_mult': 2.045078138263528, 'sideways_rsi_os': 20, 'sideways_rsi_ob': 90, 'sideways_adx_thresh': 24.62036469254052, 'sideways_atr_min_pct': 0.0130258902185656, 'sideways_atr_max_pct': 0.09067014126308338, 'sideways_tp_mult': 1.5896207257128212, 'sideways_tsl_mult': 0.5118975717757508, 'sideways_time_stop': 71, 'sideways_use_sma': True, 'sideways_use_ema': True, 'sideways_use_atr': False, 'sideways_use_adx': False, 'sideways_use_spike': True, 'sideways_rsi_required': False}.
[I 2025-09-01 11:17:12,457] Trial 230 finished with values: [-1000000000.0, 1000000000.0] and parameters: {'p_sma': 13, 'p_std': 6, 'p_atr': 8, 'p_adx': 16, 'rsi_period': 48, 'ema1': 30, 'ema2': 39, 'slip_atr_k': 0.2139866830115839, 'slip_spread_k': 0.10457586197484703, 'spread_hl_frac': 0.03439247375954781, 'bb_std_mult': 3.5015546580235095, 'rsi_os': 28, 'rsi_ob': 89, 'vol_spike': 0.18461262743446366, 'adx_thresh': 22.0203355028375, 'atr_min_pct': 0.029500486449459132, 'atr_max_pct': 0.023470981162448376, 'tp_mult': 2.52698753769818, 'tsl_mult': 0.9485812668632396, 'strategy': 'mean_reversion', 'time_stop': 167, 'use_sma': True, 'use_atr': False, 'use_adx': False, 'use_ema': True, 'use_spike': True, 'rsi_required': True, 'edge_k': 1.1752857656948987, 'edge_cap': 0.28672797292099156, 'bull_strategy': 'breakout', 'bull_bb_std_mult': 3.047522877820789, 'bull_rsi_os': 48, 'bull_rsi_ob': 73, 'bull_adx_thresh': 29.474300130534875, 'bull_atr_min_pct': 1.7295670352254896e-05, 'bull_atr_max_pct': 0.14962617516726942, 'bull_tp_mult': 2.3113168536694686, 'bull_tsl_mult': 0.7812798311258413, 'bull_time_stop': 249, 'bull_use_sma': True, 'bull_use_ema': True, 'bull_use_atr': True, 'bull_use_adx': False, 'bull_use_spike': True, 'bull_rsi_required': True, 'bear_strategy': 'breakout', 'bear_bb_std_mult': 0.9172194721638016, 'bear_rsi_os': 14, 'bear_rsi_ob': 52, 'bear_adx_thresh': 16.966718985046494, 'bear_atr_min_pct': 0.009954909021867698, 'bear_atr_max_pct': 0.020529212871322096, 'bear_tp_mult': 2.585284767488652, 'bear_tsl_mult': 0.3192910722348746, 'bear_time_stop': 230, 'bear_use_sma': False, 'bear_use_ema': True, 'bear_use_atr': False, 'bear_use_adx': False, 'bear_use_spike': True, 'bear_rsi_required': False, 'sideways_strategy': 'mean_reversion', 'sideways_bb_std_mult': 1.7956288858020306, 'sideways_rsi_os': 20, 'sideways_rsi_ob': 92, 'sideways_adx_thresh': 24.658322364044814, 'sideways_atr_min_pct': 0.017830013819394336, 'sideways_atr_max_pct': 0.08929635790702486, 'sideways_tp_mult': 1.4478141679588408, 'sideways_tsl_mult': 0.8867932149424509, 'sideways_time_stop': 277, 'sideways_use_sma': True, 'sideways_use_ema': True, 'sideways_use_atr': False, 'sideways_use_adx': False, 'sideways_use_spike': True, 'sideways_rsi_required': False}.
[I 2025-09-01 11:17:13,160] Trial 235 finished with values: [-1000000000.0, 1000000000.0] and parameters: {'p_sma': 12, 'p_std': 15, 'p_atr': 8, 'p_adx': 29, 'rsi_period': 44, 'ema1': 8, 'ema2': 37, 'slip_atr_k': 0.08750213965467561, 'slip_spread_k': 0.08886995344944429, 'spread_hl_frac': 0.029224742975292647, 'bb_std_mult': 2.9271989909672644, 'rsi_os': 44, 'rsi_ob': 87, 'vol_spike': 0.05915922003250419, 'adx_thresh': 20.597986515706566, 'atr_min_pct': 0.027760210968346088, 'atr_max_pct': 0.011271408365630856, 'tp_mult': 2.529066032614434, 'tsl_mult': 0.7799483507316665, 'strategy': 'mean_reversion', 'time_stop': 166, 'use_sma': True, 'use_atr': False, 'use_adx': False, 'use_ema': True, 'use_spike': True, 'rsi_required': True, 'edge_k': 0.07750228767184883, 'edge_cap': 0.9799479753467495, 'bull_strategy': 'breakout', 'bull_bb_std_mult': 2.90935473362052, 'bull_rsi_os': 44, 'bull_rsi_ob': 92, 'bull_adx_thresh': 6.5408553161822525, 'bull_atr_min_pct': 0.000398183459141916, 'bull_atr_max_pct': 0.0873149019703262, 'bull_tp_mult': 2.5923124655057004, 'bull_tsl_mult': 0.32130963468813334, 'bull_time_stop': 71, 'bull_use_sma': True, 'bull_use_ema': True, 'bull_use_atr': True, 'bull_use_adx': True, 'bull_use_spike': True, 'bull_rsi_required': False, 'bear_strategy': 'breakout', 'bear_bb_std_mult': 3.3835190853234822, 'bear_rsi_os': 33, 'bear_rsi_ob': 45, 'bear_adx_thresh': 8.006808196670885, 'bear_atr_min_pct': 0.01166547220368007, 'bear_atr_max_pct': 0.027733815197825844, 'bear_tp_mult': 2.6628536722801543, 'bear_tsl_mult': 0.2838397920214601, 'bear_time_stop': 229, 'bear_use_sma': False, 'bear_use_ema': True, 'bear_use_atr': False, 'bear_use_adx': True, 'bear_use_spike': False, 'bear_rsi_required': False, 'sideways_strategy': 'mean_reversion', 'sideways_bb_std_mult': 1.7902772513898815, 'sideways_rsi_os': 37, 'sideways_rsi_ob': 86, 'sideways_adx_thresh': 22.546597652231924, 'sideways_atr_min_pct': 0.024358394051076662, 'sideways_atr_max_pct': 0.08562635243014761, 'sideways_tp_mult': 1.3364138465798705, 'sideways_tsl_mult': 0.3753842651883209, 'sideways_time_stop': 124, 'sideways_use_sma': True, 'sideways_use_ema': False, 'sideways_use_atr': False, 'sideways_use_adx': True, 'sideways_use_spike': False, 'sideways_rsi_required': True}.
