[I 2025-09-01 11:10:02,088] Trial 181 finished with values: [-1000000000.0, 1000000000.0] and parameters: {'p_sma': 51, 'p_std': 25, 'p_atr': 30, 'p_adx': 25, 'rsi_period': 34, 'ema1': 20, 'ema2': 28, 'slip_atr_k': 0.02800270978735428, 'slip_spread_k': 0.6551601387690558, 'spread_hl_frac': 0.03593554756480786, 'bb_std_mult': 2.1310491795486337, 'rsi_os': 53, 'rsi_ob': 79, 'vol_spike': 0.13747208873351424, 'adx_thresh': 6.392970215748651, 'atr_min_pct': 0.014960843048023444, 'atr_max_pct': 0.07179377669061389, 'tp_mult': 1.6851110892815055, 'tsl_mult': 0.5264321813277022, 'strategy': 'mean_reversion', 'time_stop': 240, 'use_sma': True, 'use_atr': False, 'use_adx': False, 'use_ema': True, 'use_spike': True, 'rsi_required': True, 'edge_k': 1.8102356453715456, 'edge_cap': 0.1792091818908988, 'bull_strategy': 'breakout', 'bull_bb_std_mult': 0.9745115614923279, 'bull_rsi_os': 24, 'bull_rsi_ob': 94, 'bull_adx_thresh': 30.495229241400747, 'bull_atr_min_pct': 0.0007158208643355355, 'bull_atr_max_pct': 0.10270640337759515, 'bull_tp_mult': 1.6824594478017552, 'bull_tsl_mult': 0.9979714913813681, 'bull_time_stop': 19, 'bull_use_sma': False, 'bull_use_ema': True, 'bull_use_atr': True, 'bull_use_adx': True, 'bull_use_spike': True, 'bull_rsi_required': False, 'bear_strategy': 'breakout', 'bear_bb_std_mult': 3.2918974807846, 'bear_rsi_os': 54, 'bear_rsi_ob': 65, 'bear_adx_thresh': 13.84781478282999, 'bear_atr_min_pct': 0.02423998291293681, 'bear_atr_max_pct': 0.14522638626968395, 'bear_tp_mult': 1.8475839791099156, 'bear_tsl_mult': 0.17806204583458685, 'bear_time_stop': 116, 'bear_use_sma': False, 'bear_use_ema': True, 'bear_use_atr': False, 'bear_use_adx': False, 'bear_use_spike': True, 'bear_rsi_required': False, 'sideways_strategy': 'breakout', 'sideways_bb_std_mult': 3.430362226823101, 'sideways_rsi_os': 19, 'sideways_rsi_ob': 82, 'sideways_adx_thresh': 16.110110069000825, 'sideways_atr_min_pct': 0.02851646115905354, 'sideways_atr_max_pct': 0.09477708154898912, 'sideways_tp_mult': 1.9157534621100119, 'sideways_tsl_mult': 0.029786718184148964, 'sideways_time_stop': 160, 'sideways_use_sma': False, 'sideways_use_ema': True, 'sideways_use_atr': False, 'sideways_use_adx': False, 'sideways_use_spike': True, 'sideways_rsi_required': True}.
[I 2025-09-01 11:10:40,945] Trial 184 finished with values: [-1000000000.0, 1000000000.0] and parameters: {'p_sma': 26, 'p_std': 24, 'p_atr': 8, 'p_adx': 25, 'rsi_period': 36, 'ema1': 17, 'ema2': 33, 'slip_atr_k': 0.12465298595991987, 'slip_spread_k': 0.7121180824817579, 'spread_hl_frac': 0.02055736108336356, 'bb_std_mult': 3.4970655110221367, 'rsi_os': 29, 'rsi_ob': 63, 'vol_spike': 0.003696216874646968, 'adx_thresh': 5.590233676892167, 'atr_min_pct': 0.014388811224110672, 'atr_max_pct': 0.06398999350132378, 'tp_mult': 2.9891046010223246, 'tsl_mult': 0.6050195366957906, 'strategy': 'mean_reversion', 'time_stop': 272, 'use_sma': True, 'use_atr': True, 'use_adx': True, 'use_ema': True, 'use_spike': False, 'rsi_required': False, 'edge_k': 1.9115535464203794, 'edge_cap': 0.466887620474915, 'bull_strategy': 'breakout', 'bull_bb_std_mult': 1.8065045602640704, 'bull_rsi_os': 26, 'bull_rsi_ob': 58, 'bull_adx_thresh': 28.78479506014959, 'bull_atr_min_pct': 0.0077794858097823836, 'bull_atr_max_pct': 0.09984028965122489, 'bull_tp_mult': 1.5770893057398718, 'bull_tsl_mult': 0.8948753135510251, 'bull_time_stop': 30, 'bull_use_sma': False, 'bull_use_ema': False, 'bull_use_atr': True, 'bull_use_adx': True, 'bull_use_spike': True, 'bull_rsi_required': False, 'bear_strategy': 'mean_reversion', 'bear_bb_std_mult': 1.3926196272085025, 'bear_rsi_os': 39, 'bear_rsi_ob': 88, 'bear_adx_thresh': 33.43502635940025, 'bear_atr_min_pct': 0.021483973793458847, 'bear_atr_max_pct': 0.13699639338453043, 'bear_tp_mult': 1.193658788945355, 'bear_tsl_mult': 0.1272705164159308, 'bear_time_stop': 41, 'bear_use_sma': False, 'bear_use_ema': False, 'bear_use_atr': True, 'bear_use_adx': False, 'bear_use_spike': True, 'bear_rsi_required': True, 'sideways_strategy': 'breakout', 'sideways_bb_std_mult': 3.5059550898361964, 'sideways_rsi_os': 20, 'sideways_rsi_ob': 50, 'sideways_adx_thresh': 22.89561578822673, 'sideways_atr_min_pct': 0.01829505408695782, 'sideways_atr_max_pct': 0.0984467035010318, 'sideways_tp_mult': 2.0828437403869464, 'sideways_tsl_mult': 0.0327470850095272, 'sideways_time_stop': 157, 'sideways_use_sma': False, 'sideways_use_ema': True, 'sideways_use_atr': True, 'sideways_use_adx': False, 'sideways_use_spike': False, 'sideways_rsi_required': True}.
[I 2025-09-01 11:10:41,380] Trial 180 finished with values: [-1000000000.0, 1000000000.0] and parameters: {'p_sma': 9, 'p_std': 17, 'p_atr': 18, 'p_adx': 17, 'rsi_period': 34, 'ema1': 10, 'ema2': 59, 'slip_atr_k': 0.24220757511549698, 'slip_spread_k': 0.1908900052219794, 'spread_hl_frac': 0.0037210885272641464, 'bb_std_mult': 0.502695324328306, 'rsi_os': 24, 'rsi_ob': 79, 'vol_spike': 0.11212669195683586, 'adx_thresh': 6.8384748733176695, 'atr_min_pct': 0.015950450771185083, 'atr_max_pct': 0.06376859872643789, 'tp_mult': 1.7969856363424672, 'tsl_mult': 0.05782132158654213, 'strategy': 'breakout', 'time_stop': 230, 'use_sma': False, 'use_atr': True, 'use_adx': True, 'use_ema': True, 'use_spike': False, 'rsi_required': True, 'edge_k': 1.837929208730751, 'edge_cap': 0.5094316260679755, 'bull_strategy': 'mean_reversion', 'bull_bb_std_mult': 2.1578301650670966, 'bull_rsi_os': 24, 'bull_rsi_ob': 80, 'bull_adx_thresh': 30.239334700742113, 'bull_atr_min_pct': 0.014153796331081575, 'bull_atr_max_pct': 0.033511785819511905, 'bull_tp_mult': 1.5026016660198656, 'bull_tsl_mult': 0.710213520552196, 'bull_time_stop': 30, 'bull_use_sma': False, 'bull_use_ema': False, 'bull_use_atr': True, 'bull_use_adx': False, 'bull_use_spike': True, 'bull_rsi_required': False, 'bear_strategy': 'breakout', 'bear_bb_std_mult': 3.2982916989044515, 'bear_rsi_os': 40, 'bear_rsi_ob': 91, 'bear_adx_thresh': 10.268480033376678, 'bear_atr_min_pct': 0.02493360687844421, 'bear_atr_max_pct': 0.014043907237351438, 'bear_tp_mult': 2.284169680433571, 'bear_tsl_mult': 0.10187689850775908, 'bear_time_stop': 118, 'bear_use_sma': True, 'bear_use_ema': False, 'bear_use_atr': True, 'bear_use_adx': False, 'bear_use_spike': True, 'bear_rsi_required': False, 'sideways_strategy': 'mean_reversion', 'sideways_bb_std_mult': 2.1496816276829485, 'sideways_rsi_os': 47, 'sideways_rsi_ob': 50, 'sideways_adx_thresh': 16.068149318120785, 'sideways_atr_min_pct': 0.011867709426712992, 'sideways_atr_max_pct': 0.09411685770781733, 'sideways_tp_mult': 1.8876910853646565, 'sideways_tsl_mult': 0.10413388908905441, 'sideways_time_stop': 160, 'sideways_use_sma': False, 'sideways_use_ema': True, 'sideways_use_atr': False, 'sideways_use_adx': False, 'sideways_use_spike': True, 'sideways_rsi_required': False}.
[I 2025-09-01 11:10:41,749] Trial 182 finished with values: [-0.0068515593198058555, 0.007133035231335065] and parameters: {'p_sma': 12, 'p_std': 26, 'p_atr': 18, 'p_adx': 25, 'rsi_period': 34, 'ema1': 20, 'ema2': 32, 'slip_atr_k': 0.028429241750547875, 'slip_spread_k': 0.7620600114751703, 'spread_hl_frac': 0.038403635497624856, 'bb_std_mult': 0.9800035927678197, 'rsi_os': 24, 'rsi_ob': 79, 'vol_spike': 0.15778854532337877, 'adx_thresh': 6.242258203474703, 'atr_min_pct': 0.014502546522332585, 'atr_max_pct': 0.018146023024183403, 'tp_mult': 1.8976886016931191, 'tsl_mult': 0.5200075407923365, 'strategy': 'mean_reversion', 'time_stop': 238, 'use_sma': True, 'use_atr': False, 'use_adx': False, 'use_ema': True, 'use_spike': True, 'rsi_required': True, 'edge_k': 1.0954402576645221, 'edge_cap': 0.5096434051681906, 'bull_strategy': 'breakout', 'bull_bb_std_mult': 2.649182868188401, 'bull_rsi_os': 26, 'bull_rsi_ob': 94, 'bull_adx_thresh': 28.879802999275064, 'bull_atr_min_pct': 0.0007704038867736039, 'bull_atr_max_pct': 0.09874050074255486, 'bull_tp_mult': 1.4916462726928514, 'bull_tsl_mult': 0.9958173180059837, 'bull_time_stop': 158, 'bull_use_sma': False, 'bull_use_ema': True, 'bull_use_atr': True, 'bull_use_adx': True, 'bull_use_spike': True, 'bull_rsi_required': False, 'bear_strategy': 'breakout', 'bear_bb_std_mult': 1.3876413676202188, 'bear_rsi_os': 37, 'bear_rsi_ob': 91, 'bear_adx_thresh': 20.59446602441559, 'bear_atr_min_pct': 0.021968823846026393, 'bear_atr_max_pct': 0.14537784596410597, 'bear_tp_mult': 1.8690313645684764, 'bear_tsl_mult': 0.0021901257462516033, 'bear_time_stop': 129, 'bear_use_sma': False, 'bear_use_ema': True, 'bear_use_atr': False, 'bear_use_adx': False, 'bear_use_spike': True, 'bear_rsi_required': False, 'sideways_strategy': 'breakout', 'sideways_bb_std_mult': 0.8478428207130886, 'sideways_rsi_os': 19, 'sideways_rsi_ob': 50, 'sideways_adx_thresh': 15.887739597659554, 'sideways_atr_min_pct': 0.01803933410985521, 'sideways_atr_max_pct': 0.09519353651774476, 'sideways_tp_mult': 2.6983493137250485, 'sideways_tsl_mult': 0.783053857717914, 'sideways_time_stop': 161, 'sideways_use_sma': False, 'sideways_use_ema': True, 'sideways_use_atr': False, 'sideways_use_adx': False, 'sideways_use_spike': True, 'sideways_rsi_required': True}.
[I 2025-09-01 11:10:42,346] Trial 183 finished with values: [-0.029469361695438456, 0.029374250765715985] and parameters: {'p_sma': 12, 'p_std': 7, 'p_atr': 8, 'p_adx': 25, 'rsi_period': 66, 'ema1': 17, 'ema2': 59, 'slip_atr_k': 0.1238046492003701, 'slip_spread_k': 0.7088252483932909, 'spread_hl_frac': 0.01910652400334562, 'bb_std_mult': 0.9699654282080254, 'rsi_os': 24, 'rsi_ob': 59, 'vol_spike': 0.13745494194731975, 'adx_thresh': 34.78308224350974, 'atr_min_pct': 0.015000152263294831, 'atr_max_pct': 0.10749584935765379, 'tp_mult': 1.8915653587697043, 'tsl_mult': 0.06475590680968113, 'strategy': 'mean_reversion', 'time_stop': 157, 'use_sma': True, 'use_atr': False, 'use_adx': False, 'use_ema': True, 'use_spike': True, 'rsi_required': False, 'edge_k': 1.7732100052123094, 'edge_cap': 0.45869723094707454, 'bull_strategy': 'breakout', 'bull_bb_std_mult': 1.799246607646411, 'bull_rsi_os': 25, 'bull_rsi_ob': 80, 'bull_adx_thresh': 29.081330057422722, 'bull_atr_min_pct': 0.0006208295131702142, 'bull_atr_max_pct': 0.11247862490391637, 'bull_tp_mult': 1.6754652930805893, 'bull_tsl_mult': 0.6244386152645285, 'bull_time_stop': 19, 'bull_use_sma': False, 'bull_use_ema': True, 'bull_use_atr': True, 'bull_use_adx': True, 'bull_use_spike': True, 'bull_rsi_required': False, 'bear_strategy': 'mean_reversion', 'bear_bb_std_mult': 1.4037957787253807, 'bear_rsi_os': 45, 'bear_rsi_ob': 65, 'bear_adx_thresh': 20.626916639723543, 'bear_atr_min_pct': 0.029385128819436036, 'bear_atr_max_pct': 0.13217451288321216, 'bear_tp_mult': 1.2054322894590517, 'bear_tsl_mult': 0.1253103845767517, 'bear_time_stop': 44, 'bear_use_sma': False, 'bear_use_ema': True, 'bear_use_atr': False, 'bear_use_adx': False, 'bear_use_spike': True, 'bear_rsi_required': True, 'sideways_strategy': 'breakout', 'sideways_bb_std_mult': 3.495650162190632, 'sideways_rsi_os': 19, 'sideways_rsi_ob': 82, 'sideways_adx_thresh': 29.234342821074698, 'sideways_atr_min_pct': 0.01808133793025288, 'sideways_atr_max_pct': 0.09917786683357527, 'sideways_tp_mult': 2.4557969071637613, 'sideways_tsl_mult': 0.030779499766353354, 'sideways_time_stop': 160, 'sideways_use_sma': False, 'sideways_use_ema': True, 'sideways_use_atr': True, 'sideways_use_adx': False, 'sideways_use_spike': True, 'sideways_rsi_required': True}.
[I 2025-09-01 11:11:24,050] Trial 186 finished with values: [-1000000000.0, 1000000000.0] and parameters: {'p_sma': 8, 'p_std': 25, 'p_atr': 8, 'p_adx': 27, 'rsi_period': 60, 'ema1': 21, 'ema2': 31, 'slip_atr_k': 0.024003334820033077, 'slip_spread_k': 0.3997962702800767, 'spread_hl_frac': 0.02643577260279324, 'bb_std_mult': 0.9781155599916314, 'rsi_os': 25, 'rsi_ob': 60, 'vol_spike': 0.15651841016525336, 'adx_thresh': 5.996350068861661, 'atr_min_pct': 0.014680156427236116, 'atr_max_pct': 0.018634195655779888, 'tp_mult': 1.9194575131829101, 'tsl_mult': 0.5886492160594534, 'strategy': 'mean_reversion', 'time_stop': 241, 'use_sma': True, 'use_atr': False, 'use_adx': False, 'use_ema': True, 'use_spike': True, 'rsi_required': True, 'edge_k': 0.08392293631910086, 'edge_cap': 0.30936317136755653, 'bull_strategy': 'breakout', 'bull_bb_std_mult': 2.2156034349889406, 'bull_rsi_os': 27, 'bull_rsi_ob': 91, 'bull_adx_thresh': 29.28749124386679, 'bull_atr_min_pct': 0.029950792992424122, 'bull_atr_max_pct': 0.08426037168337942, 'bull_tp_mult': 2.6001006766836787, 'bull_tsl_mult': 0.9135305467552394, 'bull_time_stop': 20, 'bull_use_sma': False, 'bull_use_ema': True, 'bull_use_atr': False, 'bull_use_adx': True, 'bull_use_spike': True, 'bull_rsi_required': False, 'bear_strategy': 'breakout', 'bear_bb_std_mult': 1.1913156858693004, 'bear_rsi_os': 20, 'bear_rsi_ob': 63, 'bear_adx_thresh': 12.783732302936379, 'bear_atr_min_pct': 0.020596402445734963, 'bear_atr_max_pct': 0.07456904289906285, 'bear_tp_mult': 1.7502501907534254, 'bear_tsl_mult': 0.6655838862232948, 'bear_time_stop': 15, 'bear_use_sma': False, 'bear_use_ema': True, 'bear_use_atr': False, 'bear_use_adx': False, 'bear_use_spike': True, 'bear_rsi_required': False, 'sideways_strategy': 'breakout', 'sideways_bb_std_mult': 0.8668349451160995, 'sideways_rsi_os': 22, 'sideways_rsi_ob': 71, 'sideways_adx_thresh': 18.35055395862877, 'sideways_atr_min_pct': 0.024980830747590832, 'sideways_atr_max_pct': 0.09942693736139391, 'sideways_tp_mult': 1.366789917501527, 'sideways_tsl_mult': 0.3361629158964493, 'sideways_time_stop': 135, 'sideways_use_sma': True, 'sideways_use_ema': True, 'sideways_use_atr': False, 'sideways_use_adx': False, 'sideways_use_spike': False, 'sideways_rsi_required': True}.
[I 2025-09-01 11:11:25,283] Trial 187 finished with values: [-0.005411950006802946, 0.0056246863299433784] and parameters: {'p_sma': 15, 'p_std': 27, 'p_atr': 8, 'p_adx': 27, 'rsi_period': 59, 'ema1': 21, 'ema2': 35, 'slip_atr_k': 0.02468360928068669, 'slip_spread_k': 0.16591992954706464, 'spread_hl_frac': 0.038633091922041105, 'bb_std_mult': 2.7518938186417574, 'rsi_os': 25, 'rsi_ob': 93, 'vol_spike': 0.11695261118776071, 'adx_thresh': 18.79192052536917, 'atr_min_pct': 0.015261076170840163, 'atr_max_pct': 0.019208582410507664, 'tp_mult': 2.619187472603299, 'tsl_mult': 0.5917167614904374, 'strategy': 'mean_reversion', 'time_stop': 249, 'use_sma': True, 'use_atr': False, 'use_adx': False, 'use_ema': True, 'use_spike': True, 'rsi_required': True, 'edge_k': 0.26212287990789473, 'edge_cap': 0.3075165145539098, 'bull_strategy': 'breakout', 'bull_bb_std_mult': 2.64357265695715, 'bull_rsi_os': 25, 'bull_rsi_ob': 91, 'bull_adx_thresh': 29.287001974045552, 'bull_atr_min_pct': 0.0011179407007460267, 'bull_atr_max_pct': 0.08296671511374425, 'bull_tp_mult': 1.5458925245989599, 'bull_tsl_mult': 0.8514405398101672, 'bull_time_stop': 234, 'bull_use_sma': False, 'bull_use_ema': True, 'bull_use_atr': False, 'bull_use_adx': True, 'bull_use_spike': True, 'bull_rsi_required': False, 'bear_strategy': 'breakout', 'bear_bb_std_mult': 1.188391744496157, 'bear_rsi_os': 32, 'bear_rsi_ob': 45, 'bear_adx_thresh': 16.453786140035216, 'bear_atr_min_pct': 0.009466397474595718, 'bear_atr_max_pct': 0.023143183620376415, 'bear_tp_mult': 2.489367579224952, 'bear_tsl_mult': 0.37698186559928965, 'bear_time_stop': 131, 'bear_use_sma': False, 'bear_use_ema': True, 'bear_use_atr': False, 'bear_use_adx': False, 'bear_use_spike': True, 'bear_rsi_required': False, 'sideways_strategy': 'breakout', 'sideways_bb_std_mult': 3.4050805084502707, 'sideways_rsi_os': 21, 'sideways_rsi_ob': 48, 'sideways_adx_thresh': 28.90874735448458, 'sideways_atr_min_pct': 0.0180558438100618, 'sideways_atr_max_pct': 0.10033879669537725, 'sideways_tp_mult': 1.3762240248428315, 'sideways_tsl_mult': 0.5180305903433103, 'sideways_time_stop': 136, 'sideways_use_sma': True, 'sideways_use_ema': True, 'sideways_use_atr': False, 'sideways_use_adx': False, 'sideways_use_spike': False, 'sideways_rsi_required': True}.
[I 2025-09-01 11:11:25,639] Trial 185 finished with values: [-0.028256344308647208, 0.028168354230363343] and parameters: {'p_sma': 48, 'p_std': 14, 'p_atr': 25, 'p_adx': 25, 'rsi_period': 75, 'ema1': 26, 'ema2': 32, 'slip_atr_k': 0.014405773760607393, 'slip_spread_k': 0.18947802734592412, 'spread_hl_frac': 0.023399452700862067, 'bb_std_mult': 2.781711134494997, 'rsi_os': 26, 'rsi_ob': 60, 'vol_spike': 0.04950100387029237, 'adx_thresh': 22.787433728855554, 'atr_min_pct': 0.01523464894238716, 'atr_max_pct': 0.035519713855199454, 'tp_mult': 1.9116872372572389, 'tsl_mult': 0.5955244461802023, 'strategy': 'mean_reversion', 'time_stop': 65, 'use_sma': True, 'use_atr': True, 'use_adx': True, 'use_ema': True, 'use_spike': False, 'rsi_required': True, 'edge_k': 0.38868263313988793, 'edge_cap': 0.509883488190371, 'bull_strategy': 'breakout', 'bull_bb_std_mult': 2.217409061711978, 'bull_rsi_os': 25, 'bull_rsi_ob': 80, 'bull_adx_thresh': 26.02799233053109, 'bull_atr_min_pct': 0.0014669512422060766, 'bull_atr_max_pct': 0.11175780705410915, 'bull_tp_mult': 1.120997638324309, 'bull_tsl_mult': 0.5740485931894599, 'bull_time_stop': 207, 'bull_use_sma': False, 'bull_use_ema': False, 'bull_use_atr': False, 'bull_use_adx': True, 'bull_use_spike': True, 'bull_rsi_required': False, 'bear_strategy': 'breakout', 'bear_bb_std_mult': 1.2013483540736114, 'bear_rsi_os': 41, 'bear_rsi_ob': 45, 'bear_adx_thresh': 16.47368971355131, 'bear_atr_min_pct': 0.008629109598586173, 'bear_atr_max_pct': 0.11504696605054911, 'bear_tp_mult': 2.870418384661075, 'bear_tsl_mult': 0.19901435005689172, 'bear_time_stop': 130, 'bear_use_sma': False, 'bear_use_ema': False, 'bear_use_atr': True, 'bear_use_adx': False, 'bear_use_spike': True, 'bear_rsi_required': False, 'sideways_strategy': 'breakout', 'sideways_bb_std_mult': 3.384236465306725, 'sideways_rsi_os': 22, 'sideways_rsi_ob': 50, 'sideways_adx_thresh': 17.61806611114179, 'sideways_atr_min_pct': 0.025184940805310953, 'sideways_atr_max_pct': 0.09953924186918764, 'sideways_tp_mult': 1.954965239480499, 'sideways_tsl_mult': 0.5098752775390084, 'sideways_time_stop': 244, 'sideways_use_sma': True, 'sideways_use_ema': True, 'sideways_use_atr': False, 'sideways_use_adx': False, 'sideways_use_spike': False, 'sideways_rsi_required': True}.
[I 2025-09-01 11:11:25,893] Trial 188 finished with values: [-0.005659388587283654, 0.00600103960607712] and parameters: {'p_sma': 8, 'p_std': 26, 'p_atr': 7, 'p_adx': 26, 'rsi_period': 75, 'ema1': 18, 'ema2': 35, 'slip_atr_k': 0.02486943034342911, 'slip_spread_k': 0.3964917019383772, 'spread_hl_frac': 0.005933138544071034, 'bb_std_mult': 1.5135119797792869, 'rsi_os': 29, 'rsi_ob': 60, 'vol_spike': 0.15405609945599388, 'adx_thresh': 21.353065713632976, 'atr_min_pct': 0.013377121141068956, 'atr_max_pct': 0.07540267269770067, 'tp_mult': 2.6284715655938076, 'tsl_mult': 0.1173677332954508, 'strategy': 'mean_reversion', 'time_stop': 247, 'use_sma': True, 'use_atr': True, 'use_adx': True, 'use_ema': True, 'use_spike': False, 'rsi_required': True, 'edge_k': 0.0694543806139244, 'edge_cap': 0.6878759494122333, 'bull_strategy': 'breakout', 'bull_bb_std_mult': 3.0890085695854226, 'bull_rsi_os': 26, 'bull_rsi_ob': 78, 'bull_adx_thresh': 20.804638700448557, 'bull_atr_min_pct': 0.0015430159920435441, 'bull_atr_max_pct': 0.10902398367357254, 'bull_tp_mult': 1.554115498238727, 'bull_tsl_mult': 0.910445263146181, 'bull_time_stop': 169, 'bull_use_sma': False, 'bull_use_ema': False, 'bull_use_atr': False, 'bull_use_adx': True, 'bull_use_spike': True, 'bull_rsi_required': False, 'bear_strategy': 'breakout', 'bear_bb_std_mult': 0.9472868002622357, 'bear_rsi_os': 32, 'bear_rsi_ob': 63, 'bear_adx_thresh': 16.400039251764653, 'bear_atr_min_pct': 0.02079280142996482, 'bear_atr_max_pct': 0.13692123288100508, 'bear_tp_mult': 1.7539511369707936, 'bear_tsl_mult': 0.7806885860302231, 'bear_time_stop': 132, 'bear_use_sma': False, 'bear_use_ema': False, 'bear_use_atr': True, 'bear_use_adx': False, 'bear_use_spike': True, 'bear_rsi_required': False, 'sideways_strategy': 'breakout', 'sideways_bb_std_mult': 3.3762788067127967, 'sideways_rsi_os': 21, 'sideways_rsi_ob': 48, 'sideways_adx_thresh': 24.753273763636663, 'sideways_atr_min_pct': 0.024949555993439027, 'sideways_atr_max_pct': 0.1126853040836083, 'sideways_tp_mult': 1.4821325952795994, 'sideways_tsl_mult': 0.3421136075490381, 'sideways_time_stop': 265, 'sideways_use_sma': True, 'sideways_use_ema': True, 'sideways_use_atr': False, 'sideways_use_adx': False, 'sideways_use_spike': False, 'sideways_rsi_required': True}.
