[I 2025-09-01 11:37:53,213] Trial 363 finished with values: [-0.0069559632436103636, 0.007066459547128376] and parameters: {'p_sma': 53, 'p_std': 36, 'p_atr': 20, 'p_adx': 9, 'rsi_period': 52, 'ema1': 25, 'ema2': 18, 'slip_atr_k': 0.0006457645838834885, 'slip_spread_k': 0.41119904454616013, 'spread_hl_frac': 0.027159775755683287, 'bb_std_mult': 1.515622538434744, 'rsi_os': 17, 'rsi_ob': 88, 'vol_spike': 0.2728480132510352, 'adx_thresh': 24.776425498446038, 'atr_min_pct': 0.028059939682919078, 'atr_max_pct': 0.10996228688214829, 'tp_mult': 2.2409097103121804, 'tsl_mult': 0.8890236519598302, 'strategy': 'breakout', 'time_stop': 252, 'use_sma': False, 'use_atr': False, 'use_adx': False, 'use_ema': True, 'use_spike': True, 'rsi_required': False, 'edge_k': 0.2767719192155944, 'edge_cap': 0.21654967179915027, 'bull_strategy': 'breakout', 'bull_bb_std_mult': 0.589363055033493, 'bull_rsi_os': 54, 'bull_rsi_ob': 85, 'bull_adx_thresh': 7.73637996453727, 'bull_atr_min_pct': 0.0031948659489839464, 'bull_atr_max_pct': 0.1385588683500015, 'bull_tp_mult': 2.0754759492256354, 'bull_tsl_mult': 0.30136181202568957, 'bull_time_stop': 227, 'bull_use_sma': True, 'bull_use_ema': False, 'bull_use_atr': True, 'bull_use_adx': True, 'bull_use_spike': True, 'bull_rsi_required': False, 'bear_strategy': 'breakout', 'bear_bb_std_mult': 2.501787301041044, 'bear_rsi_os': 46, 'bear_rsi_ob': 48, 'bear_adx_thresh': 9.226835742967078, 'bear_atr_min_pct': 0.012547258296266819, 'bear_atr_max_pct': 0.02981824674923527, 'bear_tp_mult': 1.1838415904970025, 'bear_tsl_mult': 0.9797404352901036, 'bear_time_stop': 85, 'bear_use_sma': True, 'bear_use_ema': True, 'bear_use_atr': False, 'bear_use_adx': False, 'bear_use_spike': True, 'bear_rsi_required': True, 'sideways_strategy': 'mean_reversion', 'sideways_bb_std_mult': 1.7774750605579732, 'sideways_rsi_os': 39, 'sideways_rsi_ob': 92, 'sideways_adx_thresh': 5.0791314625089345, 'sideways_atr_min_pct': 0.022854911535959987, 'sideways_atr_max_pct': 0.11348773559670752, 'sideways_tp_mult': 1.4664697015540682, 'sideways_tsl_mult': 0.4163925657291946, 'sideways_time_stop': 235, 'sideways_use_sma': True, 'sideways_use_ema': True, 'sideways_use_atr': True, 'sideways_use_adx': False, 'sideways_use_spike': False, 'sideways_rsi_required': False}.
[I 2025-09-01 11:37:54,036] Trial 362 finished with values: [-1000000000.0, 1000000000.0] and parameters: {'p_sma': 10, 'p_std': 35, 'p_atr': 20, 'p_adx': 10, 'rsi_period': 80, 'ema1': 27, 'ema2': 20, 'slip_atr_k': 0.16137784769179833, 'slip_spread_k': 0.36428065203082877, 'spread_hl_frac': 0.02809889883249765, 'bb_std_mult': 3.200749599898736, 'rsi_os': 37, 'rsi_ob': 86, 'vol_spike': 0.28424393497681194, 'adx_thresh': 20.1977730918586, 'atr_min_pct': 0.02804038225997535, 'atr_max_pct': 0.03534407306809014, 'tp_mult': 2.232051155702271, 'tsl_mult': 0.382001496753572, 'strategy': 'breakout', 'time_stop': 265, 'use_sma': False, 'use_atr': False, 'use_adx': False, 'use_ema': True, 'use_spike': True, 'rsi_required': False, 'edge_k': 0.28155992991209844, 'edge_cap': 0.22677899275976954, 'bull_strategy': 'breakout', 'bull_bb_std_mult': 0.6109780810249178, 'bull_rsi_os': 49, 'bull_rsi_ob': 81, 'bull_adx_thresh': 7.951613346428076, 'bull_atr_min_pct': 0.02729926072981563, 'bull_atr_max_pct': 0.09378179840115669, 'bull_tp_mult': 2.051205116413165, 'bull_tsl_mult': 0.7249461750380035, 'bull_time_stop': 290, 'bull_use_sma': True, 'bull_use_ema': True, 'bull_use_atr': True, 'bull_use_adx': True, 'bull_use_spike': True, 'bull_rsi_required': False, 'bear_strategy': 'breakout', 'bear_bb_std_mult': 0.9080362568505354, 'bear_rsi_os': 28, 'bear_rsi_ob': 95, 'bear_adx_thresh': 11.10199890741283, 'bear_atr_min_pct': 0.003994542849353536, 'bear_atr_max_pct': 0.03008721685705653, 'bear_tp_mult': 1.2587944913577733, 'bear_tsl_mult': 0.9650659360085694, 'bear_time_stop': 88, 'bear_use_sma': True, 'bear_use_ema': True, 'bear_use_atr': False, 'bear_use_adx': False, 'bear_use_spike': True, 'bear_rsi_required': True, 'sideways_strategy': 'mean_reversion', 'sideways_bb_std_mult': 2.026887032351818, 'sideways_rsi_os': 39, 'sideways_rsi_ob': 92, 'sideways_adx_thresh': 6.1906070665756925, 'sideways_atr_min_pct': 0.022915781359583977, 'sideways_atr_max_pct': 0.14645714645344027, 'sideways_tp_mult': 1.478185111118739, 'sideways_tsl_mult': 0.8559813083188338, 'sideways_time_stop': 237, 'sideways_use_sma': True, 'sideways_use_ema': True, 'sideways_use_atr': True, 'sideways_use_adx': False, 'sideways_use_spike': False, 'sideways_rsi_required': True}.
[I 2025-09-01 11:37:54,755] Trial 361 finished with values: [-1000000000.0, 1000000000.0] and parameters: {'p_sma': 14, 'p_std': 41, 'p_atr': 20, 'p_adx': 9, 'rsi_period': 52, 'ema1': 21, 'ema2': 18, 'slip_atr_k': 0.07897405073957335, 'slip_spread_k': 0.37080013247808924, 'spread_hl_frac': 0.028281156963172897, 'bb_std_mult': 3.13830814886805, 'rsi_os': 26, 'rsi_ob': 85, 'vol_spike': 0.26748293983497184, 'adx_thresh': 22.1998688528329, 'atr_min_pct': 0.008568350734906664, 'atr_max_pct': 0.1399508363269816, 'tp_mult': 2.222625420521919, 'tsl_mult': 0.3920063670942434, 'strategy': 'breakout', 'time_stop': 254, 'use_sma': False, 'use_atr': True, 'use_adx': True, 'use_ema': True, 'use_spike': False, 'rsi_required': False, 'edge_k': 1.5991117869164704, 'edge_cap': 0.8206285365558619, 'bull_strategy': 'breakout', 'bull_bb_std_mult': 0.5618713224936575, 'bull_rsi_os': 50, 'bull_rsi_ob': 85, 'bull_adx_thresh': 8.162482764569521, 'bull_atr_min_pct': 0.00354928012480203, 'bull_atr_max_pct': 0.09401169404382312, 'bull_tp_mult': 2.1125615967286815, 'bull_tsl_mult': 0.30274191476454326, 'bull_time_stop': 194, 'bull_use_sma': True, 'bull_use_ema': True, 'bull_use_atr': True, 'bull_use_adx': True, 'bull_use_spike': True, 'bull_rsi_required': False, 'bear_strategy': 'breakout', 'bear_bb_std_mult': 0.914171367786076, 'bear_rsi_os': 26, 'bear_rsi_ob': 45, 'bear_adx_thresh': 11.066821625776193, 'bear_atr_min_pct': 0.01311524898210567, 'bear_atr_max_pct': 0.029504978853404425, 'bear_tp_mult': 1.3534022148824059, 'bear_tsl_mult': 0.9031274277473074, 'bear_time_stop': 91, 'bear_use_sma': True, 'bear_use_ema': True, 'bear_use_atr': True, 'bear_use_adx': False, 'bear_use_spike': True, 'bear_rsi_required': True, 'sideways_strategy': 'breakout', 'sideways_bb_std_mult': 1.150794447439113, 'sideways_rsi_os': 38, 'sideways_rsi_ob': 93, 'sideways_adx_thresh': 6.592598120467028, 'sideways_atr_min_pct': 0.02241729632230349, 'sideways_atr_max_pct': 0.0897912846843423, 'sideways_tp_mult': 1.4734099453424874, 'sideways_tsl_mult': 0.9112586132057097, 'sideways_time_stop': 235, 'sideways_use_sma': True, 'sideways_use_ema': True, 'sideways_use_atr': True, 'sideways_use_adx': False, 'sideways_use_spike': True, 'sideways_rsi_required': True}.
[I 2025-09-01 11:37:55,054] Trial 360 finished with values: [-1000000000.0, 1000000000.0] and parameters: {'p_sma': 14, 'p_std': 41, 'p_atr': 19, 'p_adx': 9, 'rsi_period': 48, 'ema1': 25, 'ema2': 14, 'slip_atr_k': 0.0035666144069657945, 'slip_spread_k': 0.3748440856964227, 'spread_hl_frac': 0.028259072293440102, 'bb_std_mult': 3.1334358927416774, 'rsi_os': 27, 'rsi_ob': 85, 'vol_spike': 0.26904124533913026, 'adx_thresh': 22.07483914177694, 'atr_min_pct': 0.02829039290693597, 'atr_max_pct': 0.14347247192144819, 'tp_mult': 2.233178885964548, 'tsl_mult': 0.8958197341629923, 'strategy': 'breakout', 'time_stop': 134, 'use_sma': False, 'use_atr': False, 'use_adx': True, 'use_ema': True, 'use_spike': False, 'rsi_required': False, 'edge_k': 0.27479505990556236, 'edge_cap': 0.2273549936968286, 'bull_strategy': 'breakout', 'bull_bb_std_mult': 0.5905753939542224, 'bull_rsi_os': 50, 'bull_rsi_ob': 81, 'bull_adx_thresh': 6.486573445151075, 'bull_atr_min_pct': 0.027054028027196343, 'bull_atr_max_pct': 0.09506137880847194, 'bull_tp_mult': 2.048750806139938, 'bull_tsl_mult': 0.7158762279634965, 'bull_time_stop': 204, 'bull_use_sma': True, 'bull_use_ema': True, 'bull_use_atr': True, 'bull_use_adx': True, 'bull_use_spike': True, 'bull_rsi_required': False, 'bear_strategy': 'breakout', 'bear_bb_std_mult': 3.2802206843796373, 'bear_rsi_os': 9, 'bear_rsi_ob': 45, 'bear_adx_thresh': 11.00445894694942, 'bear_atr_min_pct': 0.004240329577791623, 'bear_atr_max_pct': 0.030250476065455792, 'bear_tp_mult': 1.2573717604149999, 'bear_tsl_mult': 0.9810505485159376, 'bear_time_stop': 89, 'bear_use_sma': True, 'bear_use_ema': True, 'bear_use_atr': False, 'bear_use_adx': False, 'bear_use_spike': True, 'bear_rsi_required': True, 'sideways_strategy': 'breakout', 'sideways_bb_std_mult': 2.1854363337198954, 'sideways_rsi_os': 38, 'sideways_rsi_ob': 93, 'sideways_adx_thresh': 5.031215954105499, 'sideways_atr_min_pct': 0.022041721269817467, 'sideways_atr_max_pct': 0.14992432806017242, 'sideways_tp_mult': 1.4763580276866062, 'sideways_tsl_mult': 0.3876685335604607, 'sideways_time_stop': 265, 'sideways_use_sma': True, 'sideways_use_ema': True, 'sideways_use_atr': True, 'sideways_use_adx': False, 'sideways_use_spike': True, 'sideways_rsi_required': True}.
[I 2025-09-01 11:38:37,348] Trial 367 finished with values: [-1000000000.0, 1000000000.0] and parameters: {'p_sma': 40, 'p_std': 39, 'p_atr': 18, 'p_adx': 8, 'rsi_period': 51, 'ema1': 20, 'ema2': 16, 'slip_atr_k': 0.011272978054555191, 'slip_spread_k': 0.5048455478871973, 'spread_hl_frac': 0.02670291125247258, 'bb_std_mult': 1.5337917228537847, 'rsi_os': 28, 'rsi_ob': 88, 'vol_spike': 0.28451721391708434, 'adx_thresh': 20.49495672824691, 'atr_min_pct': 0.028867692380708226, 'atr_max_pct': 0.09734325546782396, 'tp_mult': 2.212997423840186, 'tsl_mult': 0.870901525921605, 'strategy': 'breakout', 'time_stop': 254, 'use_sma': False, 'use_atr': False, 'use_adx': False, 'use_ema': True, 'use_spike': True, 'rsi_required': False, 'edge_k': 0.4901268202980017, 'edge_cap': 0.2017662507310496, 'bull_strategy': 'breakout', 'bull_bb_std_mult': 0.680005030480619, 'bull_rsi_os': 54, 'bull_rsi_ob': 82, 'bull_adx_thresh': 6.4089686872722424, 'bull_atr_min_pct': 0.00368415310395558, 'bull_atr_max_pct': 0.10094036533994596, 'bull_tp_mult': 1.9202528098981269, 'bull_tsl_mult': 0.656970005439595, 'bull_time_stop': 232, 'bull_use_sma': False, 'bull_use_ema': False, 'bull_use_atr': True, 'bull_use_adx': False, 'bull_use_spike': True, 'bull_rsi_required': False, 'bear_strategy': 'breakout', 'bear_bb_std_mult': 2.4919086250324853, 'bear_rsi_os': 7, 'bear_rsi_ob': 69, 'bear_adx_thresh': 8.895468070120689, 'bear_atr_min_pct': 0.01223221729837501, 'bear_atr_max_pct': 0.023459093223532623, 'bear_tp_mult': 1.220347248382452, 'bear_tsl_mult': 0.9500013895311002, 'bear_time_stop': 81, 'bear_use_sma': True, 'bear_use_ema': False, 'bear_use_atr': False, 'bear_use_adx': False, 'bear_use_spike': True, 'bear_rsi_required': True, 'sideways_strategy': 'mean_reversion', 'sideways_bb_std_mult': 1.7616891814179692, 'sideways_rsi_os': 41, 'sideways_rsi_ob': 94, 'sideways_adx_thresh': 5.5700202645712515, 'sideways_atr_min_pct': 0.02330866977357686, 'sideways_atr_max_pct': 0.08517984310675461, 'sideways_tp_mult': 1.5207694083276926, 'sideways_tsl_mult': 0.4249636295882299, 'sideways_time_stop': 256, 'sideways_use_sma': True, 'sideways_use_ema': True, 'sideways_use_atr': True, 'sideways_use_adx': False, 'sideways_use_spike': False, 'sideways_rsi_required': False}.
[I 2025-09-01 11:38:37,364] Trial 364 finished with values: [-1000000000.0, 1000000000.0] and parameters: {'p_sma': 12, 'p_std': 36, 'p_atr': 20, 'p_adx': 9, 'rsi_period': 79, 'ema1': 20, 'ema2': 14, 'slip_atr_k': 0.010209208295928302, 'slip_spread_k': 0.41614258930102205, 'spread_hl_frac': 0.027175139214593087, 'bb_std_mult': 3.2009116061601337, 'rsi_os': 6, 'rsi_ob': 88, 'vol_spike': 0.26873607721348075, 'adx_thresh': 20.376995793021962, 'atr_min_pct': 0.028076640319836182, 'atr_max_pct': 0.028923016873285974, 'tp_mult': 2.2298176218812205, 'tsl_mult': 0.8913258090748072, 'strategy': 'breakout', 'time_stop': 254, 'use_sma': False, 'use_atr': False, 'use_adx': False, 'use_ema': True, 'use_spike': True, 'rsi_required': False, 'edge_k': 1.6261421971348313, 'edge_cap': 0.1930617203653721, 'bull_strategy': 'breakout', 'bull_bb_std_mult': 0.5649040719167143, 'bull_rsi_os': 54, 'bull_rsi_ob': 85, 'bull_adx_thresh': 6.647173995893221, 'bull_atr_min_pct': 0.0037482570717833593, 'bull_atr_max_pct': 0.09562109448468963, 'bull_tp_mult': 1.9848834727100562, 'bull_tsl_mult': 0.3032909430293544, 'bull_time_stop': 291, 'bull_use_sma': True, 'bull_use_ema': True, 'bull_use_atr': True, 'bull_use_adx': True, 'bull_use_spike': True, 'bull_rsi_required': False, 'bear_strategy': 'breakout', 'bear_bb_std_mult': 0.9345892394836575, 'bear_rsi_os': 29, 'bear_rsi_ob': 47, 'bear_adx_thresh': 10.884296471358498, 'bear_atr_min_pct': 0.01456821117434002, 'bear_atr_max_pct': 0.0600511503214892, 'bear_tp_mult': 1.1973293375603424, 'bear_tsl_mult': 0.897900926895406, 'bear_time_stop': 39, 'bear_use_sma': True, 'bear_use_ema': True, 'bear_use_atr': False, 'bear_use_adx': False, 'bear_use_spike': True, 'bear_rsi_required': True, 'sideways_strategy': 'mean_reversion', 'sideways_bb_std_mult': 1.7715460096948743, 'sideways_rsi_os': 39, 'sideways_rsi_ob': 92, 'sideways_adx_thresh': 6.129894228070147, 'sideways_atr_min_pct': 0.022716386128591934, 'sideways_atr_max_pct': 0.08978648865856947, 'sideways_tp_mult': 1.4942792728861656, 'sideways_tsl_mult': 0.4137787084735682, 'sideways_time_stop': 234, 'sideways_use_sma': True, 'sideways_use_ema': True, 'sideways_use_atr': True, 'sideways_use_adx': False, 'sideways_use_spike': False, 'sideways_rsi_required': False}.
[I 2025-09-01 11:38:38,423] Trial 365 finished with values: [-0.007099245373398677, 0.007149653604885364] and parameters: {'p_sma': 58, 'p_std': 41, 'p_atr': 18, 'p_adx': 9, 'rsi_period': 52, 'ema1': 20, 'ema2': 14, 'slip_atr_k': 0.010547804687235214, 'slip_spread_k': 0.3880943939011259, 'spread_hl_frac': 0.04458766128157747, 'bb_std_mult': 2.4016887649967606, 'rsi_os': 17, 'rsi_ob': 88, 'vol_spike': 0.2724110366085365, 'adx_thresh': 21.956964481213788, 'atr_min_pct': 0.028755878384056653, 'atr_max_pct': 0.09913192990188913, 'tp_mult': 2.224403437440991, 'tsl_mult': 0.12614096156220234, 'strategy': 'breakout', 'time_stop': 254, 'use_sma': False, 'use_atr': False, 'use_adx': False, 'use_ema': True, 'use_spike': True, 'rsi_required': False, 'edge_k': 1.6176053525036491, 'edge_cap': 0.2357192682904944, 'bull_strategy': 'breakout', 'bull_bb_std_mult': 0.5836379045258014, 'bull_rsi_os': 53, 'bull_rsi_ob': 85, 'bull_adx_thresh': 6.507348114572544, 'bull_atr_min_pct': 0.0036746454210660404, 'bull_atr_max_pct': 0.09633088361997519, 'bull_tp_mult': 1.9719941140703041, 'bull_tsl_mult': 0.21295612468640807, 'bull_time_stop': 204, 'bull_use_sma': True, 'bull_use_ema': False, 'bull_use_atr': True, 'bull_use_adx': True, 'bull_use_spike': True, 'bull_rsi_required': False, 'bear_strategy': 'breakout', 'bear_bb_std_mult': 1.1361760827910663, 'bear_rsi_os': 24, 'bear_rsi_ob': 57, 'bear_adx_thresh': 9.028301766573103, 'bear_atr_min_pct': 0.012183250216485487, 'bear_atr_max_pct': 0.036558715828725635, 'bear_tp_mult': 1.3528613239318068, 'bear_tsl_mult': 0.9804995319155811, 'bear_time_stop': 95, 'bear_use_sma': True, 'bear_use_ema': True, 'bear_use_atr': False, 'bear_use_adx': False, 'bear_use_spike': True, 'bear_rsi_required': True, 'sideways_strategy': 'mean_reversion', 'sideways_bb_std_mult': 1.796849797055069, 'sideways_rsi_os': 41, 'sideways_rsi_ob': 93, 'sideways_adx_thresh': 5.08126010960328, 'sideways_atr_min_pct': 0.02255383613330946, 'sideways_atr_max_pct': 0.08997134367335045, 'sideways_tp_mult': 1.5374669159883494, 'sideways_tsl_mult': 0.4129480161705545, 'sideways_time_stop': 258, 'sideways_use_sma': True, 'sideways_use_ema': True, 'sideways_use_atr': True, 'sideways_use_adx': False, 'sideways_use_spike': False, 'sideways_rsi_required': False}.
[I 2025-09-01 11:38:39,173] Trial 366 finished with values: [-1000000000.0, 1000000000.0] and parameters: {'p_sma': 12, 'p_std': 38, 'p_atr': 18, 'p_adx': 8, 'rsi_period': 11, 'ema1': 20, 'ema2': 17, 'slip_atr_k': 0.011376801265717275, 'slip_spread_k': 0.40690813375343443, 'spread_hl_frac': 0.010849012151219022, 'bb_std_mult': 1.1335240411951921, 'rsi_os': 6, 'rsi_ob': 88, 'vol_spike': 0.27436402482627503, 'adx_thresh': 20.452424047294333, 'atr_min_pct': 0.026999610598778312, 'atr_max_pct': 0.028089021425284372, 'tp_mult': 2.1995561032496336, 'tsl_mult': 0.8783537394524938, 'strategy': 'breakout', 'time_stop': 255, 'use_sma': False, 'use_atr': False, 'use_adx': False, 'use_ema': True, 'use_spike': True, 'rsi_required': False, 'edge_k': 0.41873199902485486, 'edge_cap': 0.19398392658641334, 'bull_strategy': 'breakout', 'bull_bb_std_mult': 0.6624910089559792, 'bull_rsi_os': 54, 'bull_rsi_ob': 82, 'bull_adx_thresh': 7.349753839640363, 'bull_atr_min_pct': 0.003314821727166676, 'bull_atr_max_pct': 0.08885460925892329, 'bull_tp_mult': 1.971005526970554, 'bull_tsl_mult': 0.49562863933403467, 'bull_time_stop': 229, 'bull_use_sma': False, 'bull_use_ema': False, 'bull_use_atr': True, 'bull_use_adx': False, 'bull_use_spike': True, 'bull_rsi_required': False, 'bear_strategy': 'breakout', 'bear_bb_std_mult': 1.157140741190496, 'bear_rsi_os': 23, 'bear_rsi_ob': 57, 'bear_adx_thresh': 7.721437066333658, 'bear_atr_min_pct': 0.014914713938926422, 'bear_atr_max_pct': 0.06137932124985518, 'bear_tp_mult': 1.199676400331162, 'bear_tsl_mult': 0.9268711371821245, 'bear_time_stop': 41, 'bear_use_sma': True, 'bear_use_ema': False, 'bear_use_atr': False, 'bear_use_adx': False, 'bear_use_spike': True, 'bear_rsi_required': True, 'sideways_strategy': 'mean_reversion', 'sideways_bb_std_mult': 1.806183022867275, 'sideways_rsi_os': 41, 'sideways_rsi_ob': 94, 'sideways_adx_thresh': 5.657913065974809, 'sideways_atr_min_pct': 0.023339020523150185, 'sideways_atr_max_pct': 0.08428672280383331, 'sideways_tp_mult': 1.5302200776131272, 'sideways_tsl_mult': 0.4172083460468731, 'sideways_time_stop': 257, 'sideways_use_sma': True, 'sideways_use_ema': True, 'sideways_use_atr': True, 'sideways_use_adx': False, 'sideways_use_spike': False, 'sideways_rsi_required': False}.
[I 2025-09-01 11:39:31,737] Trial 368 finished with values: [-1000000000.0, 1000000000.0] and parameters: {'p_sma': 30, 'p_std': 38, 'p_atr': 21, 'p_adx': 10, 'rsi_period': 74, 'ema1': 19, 'ema2': 15, 'slip_atr_k': 0.15709857345805536, 'slip_spread_k': 0.3968001887847868, 'spread_hl_frac': 0.027004474092744174, 'bb_std_mult': 3.2643755782159594, 'rsi_os': 31, 'rsi_ob': 87, 'vol_spike': 0.2731375364103282, 'adx_thresh': 10.895045473417555, 'atr_min_pct': 0.012635029003984135, 'atr_max_pct': 0.03332239856139973, 'tp_mult': 2.1848548800797767, 'tsl_mult': 0.8491374469848435, 'strategy': 'breakout', 'time_stop': 260, 'use_sma': False, 'use_atr': False, 'use_adx': False, 'use_ema': True, 'use_spike': True, 'rsi_required': False, 'edge_k': 1.2491528744234308, 'edge_cap': 0.25097176581036257, 'bull_strategy': 'breakout', 'bull_bb_std_mult': 0.654555571286871, 'bull_rsi_os': 9, 'bull_rsi_ob': 83, 'bull_adx_thresh': 7.523022639800507, 'bull_atr_min_pct': 0.003997566866564077, 'bull_atr_max_pct': 0.1407914763007226, 'bull_tp_mult': 1.97653573603336, 'bull_tsl_mult': 0.5371785609329741, 'bull_time_stop': 210, 'bull_use_sma': True, 'bull_use_ema': True, 'bull_use_atr': False, 'bull_use_adx': True, 'bull_use_spike': True, 'bull_rsi_required': True, 'bear_strategy': 'mean_reversion', 'bear_bb_std_mult': 1.1211584279218838, 'bear_rsi_os': 25, 'bear_rsi_ob': 49, 'bear_adx_thresh': 7.777401882800421, 'bear_atr_min_pct': 0.0038450458670747723, 'bear_atr_max_pct': 0.06867710007095373, 'bear_tp_mult': 1.3661784089849243, 'bear_tsl_mult': 0.9995618357882293, 'bear_time_stop': 100, 'bear_use_sma': True, 'bear_use_ema': True, 'bear_use_atr': False, 'bear_use_adx': False, 'bear_use_spike': True, 'bear_rsi_required': True, 'sideways_strategy': 'mean_reversion', 'sideways_bb_std_mult': 1.3675871690936565, 'sideways_rsi_os': 37, 'sideways_rsi_ob': 91, 'sideways_adx_thresh': 7.088823110276547, 'sideways_atr_min_pct': 0.02355802754389831, 'sideways_atr_max_pct': 0.08319422016085097, 'sideways_tp_mult': 1.3682281528577218, 'sideways_tsl_mult': 0.4586598854345041, 'sideways_time_stop': 256, 'sideways_use_sma': True, 'sideways_use_ema': True, 'sideways_use_atr': True, 'sideways_use_adx': False, 'sideways_use_spike': False, 'sideways_rsi_required': True}.
