[I 2025-09-01 11:18:38,938] Trial 245 finished with values: [-1000000000.0, 1000000000.0] and parameters: {'p_sma': 14, 'p_std': 26, 'p_atr': 8, 'p_adx': 30, 'rsi_period': 49, 'ema1': 21, 'ema2': 26, 'slip_atr_k': 0.017005891778087, 'slip_spread_k': 0.671960839844181, 'spread_hl_frac': 0.02906795084474835, 'bb_std_mult': 1.3284358702097219, 'rsi_os': 54, 'rsi_ob': 71, 'vol_spike': 0.11594663131735448, 'adx_thresh': 19.987897565608517, 'atr_min_pct': 0.006080298214338619, 'atr_max_pct': 0.03436164835998995, 'tp_mult': 1.3707678511551638, 'tsl_mult': 0.7627156261518683, 'strategy': 'mean_reversion', 'time_stop': 249, 'use_sma': True, 'use_atr': False, 'use_adx': False, 'use_ema': True, 'use_spike': True, 'rsi_required': True, 'edge_k': 0.2768202211048876, 'edge_cap': 0.363479953821446, 'bull_strategy': 'breakout', 'bull_bb_std_mult': 2.416269196602455, 'bull_rsi_os': 47, 'bull_rsi_ob': 92, 'bull_adx_thresh': 20.382513686334168, 'bull_atr_min_pct': 0.0009405954605277247, 'bull_atr_max_pct': 0.06358798212056746, 'bull_tp_mult': 2.6696108151862945, 'bull_tsl_mult': 0.8602743530363838, 'bull_time_stop': 259, 'bull_use_sma': True, 'bull_use_ema': True, 'bull_use_atr': True, 'bull_use_adx': True, 'bull_use_spike': True, 'bull_rsi_required': False, 'bear_strategy': 'breakout', 'bear_bb_std_mult': 3.138890587135489, 'bear_rsi_os': 35, 'bear_rsi_ob': 50, 'bear_adx_thresh': 34.43160895694131, 'bear_atr_min_pct': 0.008135680952443505, 'bear_atr_max_pct': 0.11032746962916049, 'bear_tp_mult': 2.1395686208875984, 'bear_tsl_mult': 0.8853382828795191, 'bear_time_stop': 216, 'bear_use_sma': False, 'bear_use_ema': True, 'bear_use_atr': False, 'bear_use_adx': True, 'bear_use_spike': False, 'bear_rsi_required': False, 'sideways_strategy': 'mean_reversion', 'sideways_bb_std_mult': 0.6053424100147631, 'sideways_rsi_os': 21, 'sideways_rsi_ob': 87, 'sideways_adx_thresh': 9.345181562480452, 'sideways_atr_min_pct': 0.018176393489469547, 'sideways_atr_max_pct': 0.046905258001937344, 'sideways_tp_mult': 2.3901421148844024, 'sideways_tsl_mult': 0.49680351177989107, 'sideways_time_stop': 91, 'sideways_use_sma': True, 'sideways_use_ema': False, 'sideways_use_atr': False, 'sideways_use_adx': True, 'sideways_use_spike': False, 'sideways_rsi_required': True}.
[I 2025-09-01 11:18:38,948] Trial 243 finished with values: [-1000000000.0, 1000000000.0] and parameters: {'p_sma': 28, 'p_std': 26, 'p_atr': 9, 'p_adx': 21, 'rsi_period': 80, 'ema1': 20, 'ema2': 34, 'slip_atr_k': 0.015542697440218994, 'slip_spread_k': 0.4164285371464762, 'spread_hl_frac': 0.03715471025764082, 'bb_std_mult': 3.369541001824937, 'rsi_os': 54, 'rsi_ob': 92, 'vol_spike': 0.2754536742097546, 'adx_thresh': 29.63464168844483, 'atr_min_pct': 0.028903902107133266, 'atr_max_pct': 0.017085889493318265, 'tp_mult': 1.3982458693015243, 'tsl_mult': 0.7383962754576338, 'strategy': 'breakout', 'time_stop': 258, 'use_sma': False, 'use_atr': False, 'use_adx': False, 'use_ema': True, 'use_spike': True, 'rsi_required': True, 'edge_k': 0.20028713039553425, 'edge_cap': 0.3808951259511384, 'bull_strategy': 'mean_reversion', 'bull_bb_std_mult': 1.1040882651136066, 'bull_rsi_os': 41, 'bull_rsi_ob': 89, 'bull_adx_thresh': 30.225188241582007, 'bull_atr_min_pct': 0.0007007137982496676, 'bull_atr_max_pct': 0.02418315484615601, 'bull_tp_mult': 2.4612277377275524, 'bull_tsl_mult': 0.8649065495929412, 'bull_time_stop': 109, 'bull_use_sma': True, 'bull_use_ema': True, 'bull_use_atr': True, 'bull_use_adx': True, 'bull_use_spike': True, 'bull_rsi_required': False, 'bear_strategy': 'breakout', 'bear_bb_std_mult': 2.2056200466369242, 'bear_rsi_os': 35, 'bear_rsi_ob': 47, 'bear_adx_thresh': 34.44227609103991, 'bear_atr_min_pct': 0.006411320048233024, 'bear_atr_max_pct': 0.10208603061968635, 'bear_tp_mult': 2.4916091692790427, 'bear_tsl_mult': 0.34697657230636314, 'bear_time_stop': 98, 'bear_use_sma': True, 'bear_use_ema': True, 'bear_use_atr': False, 'bear_use_adx': True, 'bear_use_spike': False, 'bear_rsi_required': False, 'sideways_strategy': 'mean_reversion', 'sideways_bb_std_mult': 3.5945179734466985, 'sideways_rsi_os': 22, 'sideways_rsi_ob': 88, 'sideways_adx_thresh': 8.537300129638218, 'sideways_atr_min_pct': 0.023256132563305113, 'sideways_atr_max_pct': 0.02790583734228789, 'sideways_tp_mult': 1.6563961196325205, 'sideways_tsl_mult': 0.9241550511972703, 'sideways_time_stop': 246, 'sideways_use_sma': True, 'sideways_use_ema': True, 'sideways_use_atr': False, 'sideways_use_adx': True, 'sideways_use_spike': False, 'sideways_rsi_required': True}.
[I 2025-09-01 11:19:15,148] Trial 246 finished with values: [-0.001049012408027683, 0.005844068205688555] and parameters: {'p_sma': 12, 'p_std': 39, 'p_atr': 8, 'p_adx': 12, 'rsi_period': 42, 'ema1': 14, 'ema2': 36, 'slip_atr_k': 0.01297550373561483, 'slip_spread_k': 0.6331809027802154, 'spread_hl_frac': 0.029442289183070416, 'bb_std_mult': 3.278119095050572, 'rsi_os': 24, 'rsi_ob': 51, 'vol_spike': 0.2291339131998434, 'adx_thresh': 16.16732852699987, 'atr_min_pct': 0.028901731079042633, 'atr_max_pct': 0.033748068057920896, 'tp_mult': 2.6392143388352265, 'tsl_mult': 0.7934575721181937, 'strategy': 'breakout', 'time_stop': 251, 'use_sma': False, 'use_atr': False, 'use_adx': False, 'use_ema': True, 'use_spike': True, 'rsi_required': True, 'edge_k': 0.3104316701376067, 'edge_cap': 0.3876613289224728, 'bull_strategy': 'mean_reversion', 'bull_bb_std_mult': 2.783432033714505, 'bull_rsi_os': 42, 'bull_rsi_ob': 91, 'bull_adx_thresh': 20.196840845937306, 'bull_atr_min_pct': 0.005825305660587386, 'bull_atr_max_pct': 0.09828656188753518, 'bull_tp_mult': 2.470812325585465, 'bull_tsl_mult': 0.8003419399156765, 'bull_time_stop': 106, 'bull_use_sma': True, 'bull_use_ema': True, 'bull_use_atr': True, 'bull_use_adx': True, 'bull_use_spike': True, 'bull_rsi_required': False, 'bear_strategy': 'breakout', 'bear_bb_std_mult': 0.7416813212986144, 'bear_rsi_os': 35, 'bear_rsi_ob': 50, 'bear_adx_thresh': 15.080510044791652, 'bear_atr_min_pct': 0.003706046948906961, 'bear_atr_max_pct': 0.027414619490322013, 'bear_tp_mult': 2.6145625479263717, 'bear_tsl_mult': 0.3350110241559066, 'bear_time_stop': 103, 'bear_use_sma': True, 'bear_use_ema': True, 'bear_use_atr': False, 'bear_use_adx': True, 'bear_use_spike': False, 'bear_rsi_required': False, 'sideways_strategy': 'mean_reversion', 'sideways_bb_std_mult': 1.4257173951842725, 'sideways_rsi_os': 55, 'sideways_rsi_ob': 58, 'sideways_adx_thresh': 10.361172917793281, 'sideways_atr_min_pct': 0.023262693190743367, 'sideways_atr_max_pct': 0.027240423527549774, 'sideways_tp_mult': 1.6121477231995958, 'sideways_tsl_mult': 0.7012213226410097, 'sideways_time_stop': 229, 'sideways_use_sma': True, 'sideways_use_ema': False, 'sideways_use_atr': False, 'sideways_use_adx': True, 'sideways_use_spike': False, 'sideways_rsi_required': True}.
[I 2025-09-01 11:19:15,681] Trial 244 finished with values: [-0.00905716081701935, 0.009507875582531938] and parameters: {'p_sma': 14, 'p_std': 26, 'p_atr': 8, 'p_adx': 14, 'rsi_period': 13, 'ema1': 14, 'ema2': 36, 'slip_atr_k': 0.014541345588377358, 'slip_spread_k': 0.08840261215578227, 'spread_hl_frac': 0.03332608495563632, 'bb_std_mult': 1.340321355398396, 'rsi_os': 24, 'rsi_ob': 70, 'vol_spike': 0.03803119943635344, 'adx_thresh': 20.09686131522693, 'atr_min_pct': 0.02879911338217152, 'atr_max_pct': 0.03449590529596094, 'tp_mult': 1.1506093040523375, 'tsl_mult': 0.7553417951756201, 'strategy': 'mean_reversion', 'time_stop': 250, 'use_sma': True, 'use_atr': False, 'use_adx': False, 'use_ema': True, 'use_spike': True, 'rsi_required': True, 'edge_k': 0.3144713083028683, 'edge_cap': 0.3738468268566968, 'bull_strategy': 'breakout', 'bull_bb_std_mult': 0.7908625259305657, 'bull_rsi_os': 47, 'bull_rsi_ob': 92, 'bull_adx_thresh': 33.77769529632485, 'bull_atr_min_pct': 0.000770755556602026, 'bull_atr_max_pct': 0.09854599088557636, 'bull_tp_mult': 2.807987580075817, 'bull_tsl_mult': 0.8027685656905784, 'bull_time_stop': 257, 'bull_use_sma': True, 'bull_use_ema': True, 'bull_use_atr': True, 'bull_use_adx': True, 'bull_use_spike': True, 'bull_rsi_required': False, 'bear_strategy': 'breakout', 'bear_bb_std_mult': 3.1571348893682067, 'bear_rsi_os': 49, 'bear_rsi_ob': 50, 'bear_adx_thresh': 15.250843218164107, 'bear_atr_min_pct': 0.008088531857039167, 'bear_atr_max_pct': 0.027266255205893753, 'bear_tp_mult': 2.482564814092994, 'bear_tsl_mult': 0.7117707461720304, 'bear_time_stop': 264, 'bear_use_sma': False, 'bear_use_ema': True, 'bear_use_atr': False, 'bear_use_adx': True, 'bear_use_spike': False, 'bear_rsi_required': False, 'sideways_strategy': 'mean_reversion', 'sideways_bb_std_mult': 3.5977614247471736, 'sideways_rsi_os': 21, 'sideways_rsi_ob': 90, 'sideways_adx_thresh': 8.626456539890293, 'sideways_atr_min_pct': 0.01829379138172582, 'sideways_atr_max_pct': 0.09300458460827526, 'sideways_tp_mult': 1.6087488199270434, 'sideways_tsl_mult': 0.5293919807450013, 'sideways_time_stop': 230, 'sideways_use_sma': True, 'sideways_use_ema': False, 'sideways_use_atr': False, 'sideways_use_adx': True, 'sideways_use_spike': False, 'sideways_rsi_required': True}.
[I 2025-09-01 11:19:18,219] Trial 248 finished with values: [-0.03490219243725079, 0.03483007784952338] and parameters: {'p_sma': 56, 'p_std': 38, 'p_atr': 22, 'p_adx': 14, 'rsi_period': 56, 'ema1': 21, 'ema2': 36, 'slip_atr_k': 0.13390765225795287, 'slip_spread_k': 0.028471809729235943, 'spread_hl_frac': 0.030466254922940972, 'bb_std_mult': 1.81685439425925, 'rsi_os': 24, 'rsi_ob': 84, 'vol_spike': 0.027889334064245652, 'adx_thresh': 21.143186071618647, 'atr_min_pct': 0.028775505906994257, 'atr_max_pct': 0.039294819301578014, 'tp_mult': 2.6386986447436147, 'tsl_mult': 0.7900905484674261, 'strategy': 'mean_reversion', 'time_stop': 231, 'use_sma': True, 'use_atr': False, 'use_adx': False, 'use_ema': True, 'use_spike': True, 'rsi_required': True, 'edge_k': 0.9531505608088493, 'edge_cap': 0.33844731067016925, 'bull_strategy': 'breakout', 'bull_bb_std_mult': 2.797976150624929, 'bull_rsi_os': 49, 'bull_rsi_ob': 91, 'bull_adx_thresh': 30.079269816103853, 'bull_atr_min_pct': 0.002041572989997089, 'bull_atr_max_pct': 0.05446228587949011, 'bull_tp_mult': 2.718763440786613, 'bull_tsl_mult': 0.801290490903952, 'bull_time_stop': 291, 'bull_use_sma': True, 'bull_use_ema': True, 'bull_use_atr': True, 'bull_use_adx': True, 'bull_use_spike': True, 'bull_rsi_required': False, 'bear_strategy': 'breakout', 'bear_bb_std_mult': 0.7467143069531246, 'bear_rsi_os': 37, 'bear_rsi_ob': 50, 'bear_adx_thresh': 15.055760311970726, 'bear_atr_min_pct': 0.005073767930272494, 'bear_atr_max_pct': 0.027739982037875418, 'bear_tp_mult': 2.6470141642635014, 'bear_tsl_mult': 0.3067737036231636, 'bear_time_stop': 105, 'bear_use_sma': False, 'bear_use_ema': True, 'bear_use_atr': False, 'bear_use_adx': False, 'bear_use_spike': True, 'bear_rsi_required': False, 'sideways_strategy': 'mean_reversion', 'sideways_bb_std_mult': 2.442532321049458, 'sideways_rsi_os': 19, 'sideways_rsi_ob': 58, 'sideways_adx_thresh': 24.580076465697655, 'sideways_atr_min_pct': 0.008536672678133869, 'sideways_atr_max_pct': 0.1383225840614716, 'sideways_tp_mult': 1.6122507336013348, 'sideways_tsl_mult': 0.557631624659532, 'sideways_time_stop': 131, 'sideways_use_sma': True, 'sideways_use_ema': False, 'sideways_use_atr': False, 'sideways_use_adx': False, 'sideways_use_spike': False, 'sideways_rsi_required': True}.
[I 2025-09-01 11:19:18,915] Trial 247 finished with values: [-0.012366077759346839, 0.012126509854372797] and parameters: {'p_sma': 12, 'p_std': 25, 'p_atr': 29, 'p_adx': 30, 'rsi_period': 82, 'ema1': 14, 'ema2': 36, 'slip_atr_k': 0.20470364221790804, 'slip_spread_k': 0.6278729387647131, 'spread_hl_frac': 0.03313502434306593, 'bb_std_mult': 1.6677353591824755, 'rsi_os': 24, 'rsi_ob': 75, 'vol_spike': 0.277773603162234, 'adx_thresh': 21.028021125111753, 'atr_min_pct': 0.028900588275928243, 'atr_max_pct': 0.04029437289662883, 'tp_mult': 2.6413299509255723, 'tsl_mult': 0.7386648418134909, 'strategy': 'breakout', 'time_stop': 61, 'use_sma': False, 'use_atr': False, 'use_adx': False, 'use_ema': True, 'use_spike': True, 'rsi_required': True, 'edge_k': 0.3177802629165673, 'edge_cap': 0.8123414756428353, 'bull_strategy': 'mean_reversion', 'bull_bb_std_mult': 2.787366775686051, 'bull_rsi_os': 42, 'bull_rsi_ob': 89, 'bull_adx_thresh': 7.589271080806601, 'bull_atr_min_pct': 0.0022122941871850106, 'bull_atr_max_pct': 0.05411430878987418, 'bull_tp_mult': 2.7866954880305306, 'bull_tsl_mult': 0.16583852456988907, 'bull_time_stop': 102, 'bull_use_sma': True, 'bull_use_ema': True, 'bull_use_atr': True, 'bull_use_adx': True, 'bull_use_spike': True, 'bull_rsi_required': False, 'bear_strategy': 'breakout', 'bear_bb_std_mult': 0.7342095697054554, 'bear_rsi_os': 37, 'bear_rsi_ob': 75, 'bear_adx_thresh': 15.160678036269852, 'bear_atr_min_pct': 0.00627280101847056, 'bear_atr_max_pct': 0.027210636475858627, 'bear_tp_mult': 2.3224962042772774, 'bear_tsl_mult': 0.7511668558273186, 'bear_time_stop': 265, 'bear_use_sma': True, 'bear_use_ema': True, 'bear_use_atr': False, 'bear_use_adx': False, 'bear_use_spike': True, 'bear_rsi_required': False, 'sideways_strategy': 'mean_reversion', 'sideways_bb_std_mult': 0.5075969100259796, 'sideways_rsi_os': 19, 'sideways_rsi_ob': 90, 'sideways_adx_thresh': 24.620233107408207, 'sideways_atr_min_pct': 0.0014605678625145852, 'sideways_atr_max_pct': 0.09259176730680375, 'sideways_tp_mult': 1.6140438885330353, 'sideways_tsl_mult': 0.6920415067898958, 'sideways_time_stop': 300, 'sideways_use_sma': True, 'sideways_use_ema': True, 'sideways_use_atr': False, 'sideways_use_adx': False, 'sideways_use_spike': False, 'sideways_rsi_required': True}.
[I 2025-09-01 11:19:58,791] Trial 249 finished with values: [-1000000000.0, 1000000000.0] and parameters: {'p_sma': 12, 'p_std': 37, 'p_atr': 8, 'p_adx': 12, 'rsi_period': 43, 'ema1': 7, 'ema2': 36, 'slip_atr_k': 0.011159154732413645, 'slip_spread_k': 0.49349370339936194, 'spread_hl_frac': 0.03052484185492123, 'bb_std_mult': 3.293078910259192, 'rsi_os': 24, 'rsi_ob': 51, 'vol_spike': 0.2025749574321585, 'adx_thresh': 11.025876888995521, 'atr_min_pct': 0.02873701000565871, 'atr_max_pct': 0.08778002792576932, 'tp_mult': 2.650824069582218, 'tsl_mult': 0.876831231005468, 'strategy': 'breakout', 'time_stop': 264, 'use_sma': False, 'use_atr': False, 'use_adx': False, 'use_ema': True, 'use_spike': True, 'rsi_required': True, 'edge_k': 0.315329610461712, 'edge_cap': 0.39805713962194933, 'bull_strategy': 'mean_reversion', 'bull_bb_std_mult': 2.7946910529393985, 'bull_rsi_os': 36, 'bull_rsi_ob': 91, 'bull_adx_thresh': 11.79404204355133, 'bull_atr_min_pct': 0.005415864488883379, 'bull_atr_max_pct': 0.09974911080705993, 'bull_tp_mult': 2.7964461512381713, 'bull_tsl_mult': 0.7222873297912846, 'bull_time_stop': 89, 'bull_use_sma': True, 'bull_use_ema': True, 'bull_use_atr': True, 'bull_use_adx': True, 'bull_use_spike': True, 'bull_rsi_required': False, 'bear_strategy': 'breakout', 'bear_bb_std_mult': 0.7523614366124519, 'bear_rsi_os': 34, 'bear_rsi_ob': 51, 'bear_adx_thresh': 14.927359815746007, 'bear_atr_min_pct': 0.0040975729686839185, 'bear_atr_max_pct': 0.027569263800069743, 'bear_tp_mult': 2.6892211349386033, 'bear_tsl_mult': 0.3408938249222325, 'bear_time_stop': 104, 'bear_use_sma': True, 'bear_use_ema': True, 'bear_use_atr': False, 'bear_use_adx': True, 'bear_use_spike': False, 'bear_rsi_required': False, 'sideways_strategy': 'mean_reversion', 'sideways_bb_std_mult': 1.4242297013743037, 'sideways_rsi_os': 42, 'sideways_rsi_ob': 58, 'sideways_adx_thresh': 10.454550807941068, 'sideways_atr_min_pct': 0.023502164521358948, 'sideways_atr_max_pct': 0.03298201778860557, 'sideways_tp_mult': 1.6158864240848965, 'sideways_tsl_mult': 0.7368359000569626, 'sideways_time_stop': 235, 'sideways_use_sma': True, 'sideways_use_ema': False, 'sideways_use_atr': False, 'sideways_use_adx': True, 'sideways_use_spike': False, 'sideways_rsi_required': True}.
[I 2025-09-01 11:19:59,597] Trial 250 finished with values: [-0.006044541593738906, 0.00944009434280167] and parameters: {'p_sma': 12, 'p_std': 37, 'p_atr': 8, 'p_adx': 13, 'rsi_period': 42, 'ema1': 14, 'ema2': 36, 'slip_atr_k': 0.009177860169929908, 'slip_spread_k': 0.7290310641247394, 'spread_hl_frac': 0.029569801499102908, 'bb_std_mult': 3.255958367644258, 'rsi_os': 24, 'rsi_ob': 47, 'vol_spike': 0.24759186833157265, 'adx_thresh': 10.706361035000903, 'atr_min_pct': 0.02880363746754677, 'atr_max_pct': 0.08730217433687132, 'tp_mult': 2.656411021068331, 'tsl_mult': 0.8791525939416885, 'strategy': 'breakout', 'time_stop': 254, 'use_sma': False, 'use_atr': False, 'use_adx': False, 'use_ema': True, 'use_spike': True, 'rsi_required': True, 'edge_k': 0.30343360269598574, 'edge_cap': 0.38472714373751254, 'bull_strategy': 'mean_reversion', 'bull_bb_std_mult': 2.7599591549202867, 'bull_rsi_os': 40, 'bull_rsi_ob': 91, 'bull_adx_thresh': 19.813203233877424, 'bull_atr_min_pct': 0.001818875402716134, 'bull_atr_max_pct': 0.0980590171961432, 'bull_tp_mult': 2.783703246339199, 'bull_tsl_mult': 0.7313787352509239, 'bull_time_stop': 156, 'bull_use_sma': True, 'bull_use_ema': True, 'bull_use_atr': True, 'bull_use_adx': True, 'bull_use_spike': True, 'bull_rsi_required': False, 'bear_strategy': 'breakout', 'bear_bb_std_mult': 0.7218363154507603, 'bear_rsi_os': 37, 'bear_rsi_ob': 50, 'bear_adx_thresh': 15.333749455478623, 'bear_atr_min_pct': 0.003463328324249731, 'bear_atr_max_pct': 0.026957922024520214, 'bear_tp_mult': 2.6283548406039547, 'bear_tsl_mult': 0.37559093053131143, 'bear_time_stop': 103, 'bear_use_sma': True, 'bear_use_ema': True, 'bear_use_atr': False, 'bear_use_adx': True, 'bear_use_spike': False, 'bear_rsi_required': False, 'sideways_strategy': 'mean_reversion', 'sideways_bb_std_mult': 1.3173196044846076, 'sideways_rsi_os': 34, 'sideways_rsi_ob': 58, 'sideways_adx_thresh': 8.242468130488255, 'sideways_atr_min_pct': 0.02392578123095058, 'sideways_atr_max_pct': 0.02707119031466757, 'sideways_tp_mult': 1.5984362765322824, 'sideways_tsl_mult': 0.6846520316118703, 'sideways_time_stop': 182, 'sideways_use_sma': True, 'sideways_use_ema': False, 'sideways_use_atr': False, 'sideways_use_adx': True, 'sideways_use_spike': False, 'sideways_rsi_required': True}.
[I 2025-09-01 11:20:00,129] Trial 252 finished with values: [-1000000000.0, 1000000000.0] and parameters: {'p_sma': 11, 'p_std': 39, 'p_atr': 8, 'p_adx': 12, 'rsi_period': 44, 'ema1': 13, 'ema2': 37, 'slip_atr_k': 0.009302394523122738, 'slip_spread_k': 0.49194999261763545, 'spread_hl_frac': 0.029518316629932848, 'bb_std_mult': 3.260151342930096, 'rsi_os': 23, 'rsi_ob': 46, 'vol_spike': 0.1982452598246946, 'adx_thresh': 16.341802432927132, 'atr_min_pct': 0.029182461862012125, 'atr_max_pct': 0.08686371095458614, 'tp_mult': 2.6776096709057535, 'tsl_mult': 0.852611874347032, 'strategy': 'breakout', 'time_stop': 253, 'use_sma': False, 'use_atr': False, 'use_adx': False, 'use_ema': True, 'use_spike': True, 'rsi_required': True, 'edge_k': 0.3174782395084375, 'edge_cap': 0.3849426344044795, 'bull_strategy': 'mean_reversion', 'bull_bb_std_mult': 2.66712720671501, 'bull_rsi_os': 38, 'bull_rsi_ob': 91, 'bull_adx_thresh': 18.61003544918759, 'bull_atr_min_pct': 0.015160817920561181, 'bull_atr_max_pct': 0.09849126815225069, 'bull_tp_mult': 2.812187869498317, 'bull_tsl_mult': 0.4012375091879615, 'bull_time_stop': 117, 'bull_use_sma': True, 'bull_use_ema': True, 'bull_use_atr': True, 'bull_use_adx': True, 'bull_use_spike': True, 'bull_rsi_required': False, 'bear_strategy': 'breakout', 'bear_bb_std_mult': 0.780930187020823, 'bear_rsi_os': 34, 'bear_rsi_ob': 51, 'bear_adx_thresh': 14.273403368680713, 'bear_atr_min_pct': 0.008911994682796241, 'bear_atr_max_pct': 0.01566694957997819, 'bear_tp_mult': 2.6981396574628778, 'bear_tsl_mult': 0.3640458138967075, 'bear_time_stop': 110, 'bear_use_sma': True, 'bear_use_ema': True, 'bear_use_atr': False, 'bear_use_adx': True, 'bear_use_spike': False, 'bear_rsi_required': False, 'sideways_strategy': 'mean_reversion', 'sideways_bb_std_mult': 1.4263512039198585, 'sideways_rsi_os': 41, 'sideways_rsi_ob': 57, 'sideways_adx_thresh': 10.520535588064906, 'sideways_atr_min_pct': 0.022236281482204676, 'sideways_atr_max_pct': 0.025617009915090222, 'sideways_tp_mult': 1.618229641969349, 'sideways_tsl_mult': 0.7707286649940295, 'sideways_time_stop': 230, 'sideways_use_sma': True, 'sideways_use_ema': False, 'sideways_use_atr': False, 'sideways_use_adx': True, 'sideways_use_spike': False, 'sideways_rsi_required': True}.
