[I 2025-09-01 11:20:00,130] Trial 251 finished with values: [-0.012444571408730898, 0.013689167857247027] and parameters: {'p_sma': 12, 'p_std': 48, 'p_atr': 8, 'p_adx': 12, 'rsi_period': 42, 'ema1': 13, 'ema2': 36, 'slip_atr_k': 0.008610808292635115, 'slip_spread_k': 0.6363613811857859, 'spread_hl_frac': 0.027662647726629325, 'bb_std_mult': 3.25984354895348, 'rsi_os': 23, 'rsi_ob': 47, 'vol_spike': 0.20028741439027462, 'adx_thresh': 16.347874932402362, 'atr_min_pct': 0.02933278632887255, 'atr_max_pct': 0.08726236967931206, 'tp_mult': 2.660994667784046, 'tsl_mult': 0.8511849658170897, 'strategy': 'breakout', 'time_stop': 254, 'use_sma': False, 'use_atr': False, 'use_adx': False, 'use_ema': True, 'use_spike': True, 'rsi_required': True, 'edge_k': 0.3216030922668025, 'edge_cap': 0.35611987855870675, 'bull_strategy': 'mean_reversion', 'bull_bb_std_mult': 0.8419176737267995, 'bull_rsi_os': 42, 'bull_rsi_ob': 90, 'bull_adx_thresh': 20.603155818052144, 'bull_atr_min_pct': 0.005671655472185441, 'bull_atr_max_pct': 0.0978356955621258, 'bull_tp_mult': 2.6420496555550605, 'bull_tsl_mult': 0.7178045086300577, 'bull_time_stop': 100, 'bull_use_sma': True, 'bull_use_ema': True, 'bull_use_atr': True, 'bull_use_adx': True, 'bull_use_spike': True, 'bull_rsi_required': False, 'bear_strategy': 'breakout', 'bear_bb_std_mult': 0.7844341785642363, 'bear_rsi_os': 37, 'bear_rsi_ob': 49, 'bear_adx_thresh': 14.333082425969243, 'bear_atr_min_pct': 0.0030798284547156793, 'bear_atr_max_pct': 0.025748493549587075, 'bear_tp_mult': 2.6167352005523963, 'bear_tsl_mult': 0.37676686174761015, 'bear_time_stop': 109, 'bear_use_sma': True, 'bear_use_ema': True, 'bear_use_atr': False, 'bear_use_adx': True, 'bear_use_spike': False, 'bear_rsi_required': False, 'sideways_strategy': 'mean_reversion', 'sideways_bb_std_mult': 1.3847669676785856, 'sideways_rsi_os': 47, 'sideways_rsi_ob': 59, 'sideways_adx_thresh': 10.523505066933906, 'sideways_atr_min_pct': 0.019259801906900183, 'sideways_atr_max_pct': 0.02784115815460789, 'sideways_tp_mult': 1.621234418642548, 'sideways_tsl_mult': 0.7138452183234283, 'sideways_time_stop': 219, 'sideways_use_sma': True, 'sideways_use_ema': False, 'sideways_use_atr': False, 'sideways_use_adx': True, 'sideways_use_spike': False, 'sideways_rsi_required': True}.
[I 2025-09-01 11:20:00,901] Trial 253 finished with values: [-1000000000.0, 1000000000.0] and parameters: {'p_sma': 12, 'p_std': 39, 'p_atr': 8, 'p_adx': 12, 'rsi_period': 43, 'ema1': 14, 'ema2': 33, 'slip_atr_k': 0.010379969293390282, 'slip_spread_k': 0.6436122397185495, 'spread_hl_frac': 0.029423845857142354, 'bb_std_mult': 3.239217937479202, 'rsi_os': 23, 'rsi_ob': 52, 'vol_spike': 0.25077255513427943, 'adx_thresh': 16.649243515192715, 'atr_min_pct': 0.02739802932307387, 'atr_max_pct': 0.020392889854347458, 'tp_mult': 2.6928273023834794, 'tsl_mult': 0.8452642974704986, 'strategy': 'breakout', 'time_stop': 253, 'use_sma': False, 'use_atr': False, 'use_adx': False, 'use_ema': True, 'use_spike': True, 'rsi_required': True, 'edge_k': 0.3382766771100443, 'edge_cap': 0.359259971942776, 'bull_strategy': 'mean_reversion', 'bull_bb_std_mult': 2.6503865827994693, 'bull_rsi_os': 39, 'bull_rsi_ob': 92, 'bull_adx_thresh': 20.00876933592822, 'bull_atr_min_pct': 0.013679003894735624, 'bull_atr_max_pct': 0.09870941939814282, 'bull_tp_mult': 2.6337003774167536, 'bull_tsl_mult': 0.6237934861695124, 'bull_time_stop': 120, 'bull_use_sma': True, 'bull_use_ema': True, 'bull_use_atr': True, 'bull_use_adx': True, 'bull_use_spike': True, 'bull_rsi_required': False, 'bear_strategy': 'breakout', 'bear_bb_std_mult': 0.8781738203820492, 'bear_rsi_os': 49, 'bear_rsi_ob': 49, 'bear_adx_thresh': 14.194335342248829, 'bear_atr_min_pct': 0.003431432375845771, 'bear_atr_max_pct': 0.031070224842108654, 'bear_tp_mult': 2.5894311437594726, 'bear_tsl_mult': 0.3178376578392755, 'bear_time_stop': 174, 'bear_use_sma': True, 'bear_use_ema': True, 'bear_use_atr': False, 'bear_use_adx': True, 'bear_use_spike': False, 'bear_rsi_required': False, 'sideways_strategy': 'mean_reversion', 'sideways_bb_std_mult': 1.5096862572798422, 'sideways_rsi_os': 51, 'sideways_rsi_ob': 59, 'sideways_adx_thresh': 10.547449723384718, 'sideways_atr_min_pct': 0.02251981915584807, 'sideways_atr_max_pct': 0.0261237714105935, 'sideways_tp_mult': 1.664152774770852, 'sideways_tsl_mult': 0.6668756658870826, 'sideways_time_stop': 222, 'sideways_use_sma': True, 'sideways_use_ema': False, 'sideways_use_atr': False, 'sideways_use_adx': True, 'sideways_use_spike': False, 'sideways_rsi_required': True}.
[I 2025-09-01 11:20:00,980] Trial 256 finished with values: [-1000000000.0, 1000000000.0] and parameters: {'p_sma': 13, 'p_std': 38, 'p_atr': 10, 'p_adx': 30, 'rsi_period': 40, 'ema1': 14, 'ema2': 38, 'slip_atr_k': 0.09492397403370176, 'slip_spread_k': 0.7481838285168583, 'spread_hl_frac': 0.02810998533007131, 'bb_std_mult': 3.1542166671481153, 'rsi_os': 25, 'rsi_ob': 85, 'vol_spike': 0.234926319216184, 'adx_thresh': 15.577983951842779, 'atr_min_pct': 0.02807133252897945, 'atr_max_pct': 0.021024913618363776, 'tp_mult': 1.1353129027348698, 'tsl_mult': 0.8818345897883514, 'strategy': 'breakout', 'time_stop': 248, 'use_sma': False, 'use_atr': False, 'use_adx': False, 'use_ema': True, 'use_spike': True, 'rsi_required': True, 'edge_k': 1.2944007801701773, 'edge_cap': 0.41424926958746705, 'bull_strategy': 'mean_reversion', 'bull_bb_std_mult': 2.714732670360476, 'bull_rsi_os': 40, 'bull_rsi_ob': 93, 'bull_adx_thresh': 19.57010645639239, 'bull_atr_min_pct': 0.0013826457917894682, 'bull_atr_max_pct': 0.09242079860532834, 'bull_tp_mult': 2.8813494267892534, 'bull_tsl_mult': 0.09573864366357043, 'bull_time_stop': 246, 'bull_use_sma': True, 'bull_use_ema': True, 'bull_use_atr': True, 'bull_use_adx': True, 'bull_use_spike': True, 'bull_rsi_required': False, 'bear_strategy': 'breakout', 'bear_bb_std_mult': 0.8585380296087965, 'bear_rsi_os': 26, 'bear_rsi_ob': 50, 'bear_adx_thresh': 13.26683589533981, 'bear_atr_min_pct': 0.0019552827779199555, 'bear_atr_max_pct': 0.07843207421378814, 'bear_tp_mult': 2.616854429740434, 'bear_tsl_mult': 0.33686565954094205, 'bear_time_stop': 58, 'bear_use_sma': True, 'bear_use_ema': True, 'bear_use_atr': False, 'bear_use_adx': True, 'bear_use_spike': False, 'bear_rsi_required': False, 'sideways_strategy': 'mean_reversion', 'sideways_bb_std_mult': 1.1748626583255968, 'sideways_rsi_os': 34, 'sideways_rsi_ob': 56, 'sideways_adx_thresh': 9.578732604178729, 'sideways_atr_min_pct': 0.00267117194956522, 'sideways_atr_max_pct': 0.030536654497241765, 'sideways_tp_mult': 1.6789686918383129, 'sideways_tsl_mult': 0.6487625615576766, 'sideways_time_stop': 199, 'sideways_use_sma': True, 'sideways_use_ema': False, 'sideways_use_atr': False, 'sideways_use_adx': True, 'sideways_use_spike': False, 'sideways_rsi_required': True}.
[I 2025-09-01 11:20:40,748] Trial 254 finished with values: [-0.0438936887677861, 0.04364908264989445] and parameters: {'p_sma': 11, 'p_std': 41, 'p_atr': 10, 'p_adx': 12, 'rsi_period': 42, 'ema1': 14, 'ema2': 38, 'slip_atr_k': 0.010098726100910158, 'slip_spread_k': 0.7498249708136119, 'spread_hl_frac': 0.02798276440109832, 'bb_std_mult': 3.2634826679574993, 'rsi_os': 25, 'rsi_ob': 53, 'vol_spike': 0.1973866062093565, 'adx_thresh': 11.762783261143259, 'atr_min_pct': 0.029347944288770602, 'atr_max_pct': 0.0570755717853593, 'tp_mult': 2.688519282764014, 'tsl_mult': 0.8468127596956756, 'strategy': 'breakout', 'time_stop': 252, 'use_sma': False, 'use_atr': False, 'use_adx': False, 'use_ema': True, 'use_spike': True, 'rsi_required': True, 'edge_k': 0.35523628261991586, 'edge_cap': 0.38203912603022294, 'bull_strategy': 'mean_reversion', 'bull_bb_std_mult': 0.7985392914700953, 'bull_rsi_os': 40, 'bull_rsi_ob': 92, 'bull_adx_thresh': 20.494798520466176, 'bull_atr_min_pct': 0.00474453282394513, 'bull_atr_max_pct': 0.09702609579173449, 'bull_tp_mult': 2.50888910689895, 'bull_tsl_mult': 0.8049646677648715, 'bull_time_stop': 159, 'bull_use_sma': True, 'bull_use_ema': True, 'bull_use_atr': True, 'bull_use_adx': True, 'bull_use_spike': True, 'bull_rsi_required': False, 'bear_strategy': 'breakout', 'bear_bb_std_mult': 0.985886816549438, 'bear_rsi_os': 35, 'bear_rsi_ob': 49, 'bear_adx_thresh': 15.69828100240383, 'bear_atr_min_pct': 0.0008250930896597387, 'bear_atr_max_pct': 0.059082992598300785, 'bear_tp_mult': 2.6145776875021007, 'bear_tsl_mult': 0.3677405458838372, 'bear_time_stop': 174, 'bear_use_sma': True, 'bear_use_ema': True, 'bear_use_atr': False, 'bear_use_adx': True, 'bear_use_spike': False, 'bear_rsi_required': False, 'sideways_strategy': 'mean_reversion', 'sideways_bb_std_mult': 1.3980259405103452, 'sideways_rsi_os': 50, 'sideways_rsi_ob': 56, 'sideways_adx_thresh': 12.322642155801706, 'sideways_atr_min_pct': 0.024585229072613225, 'sideways_atr_max_pct': 0.02392864472974235, 'sideways_tp_mult': 1.6804188762254841, 'sideways_tsl_mult': 0.717477809613261, 'sideways_time_stop': 229, 'sideways_use_sma': True, 'sideways_use_ema': False, 'sideways_use_atr': False, 'sideways_use_adx': True, 'sideways_use_spike': False, 'sideways_rsi_required': True}.
[I 2025-09-01 11:20:42,021] Trial 255 finished with values: [-1000000000.0, 1000000000.0] and parameters: {'p_sma': 13, 'p_std': 40, 'p_atr': 10, 'p_adx': 13, 'rsi_period': 42, 'ema1': 14, 'ema2': 20, 'slip_atr_k': 0.013840412176280042, 'slip_spread_k': 0.38088281945429237, 'spread_hl_frac': 0.03154416004222, 'bb_std_mult': 3.1618537021869644, 'rsi_os': 25, 'rsi_ob': 50, 'vol_spike': 0.22556032632836132, 'adx_thresh': 15.575461384862681, 'atr_min_pct': 0.02760439471100523, 'atr_max_pct': 0.09503650013934234, 'tp_mult': 2.6063033379400826, 'tsl_mult': 0.8353410518522529, 'strategy': 'breakout', 'time_stop': 242, 'use_sma': False, 'use_atr': False, 'use_adx': False, 'use_ema': True, 'use_spike': True, 'rsi_required': True, 'edge_k': 0.27308208130831235, 'edge_cap': 0.4122071847958765, 'bull_strategy': 'mean_reversion', 'bull_bb_std_mult': 2.7206128823810145, 'bull_rsi_os': 33, 'bull_rsi_ob': 93, 'bull_adx_thresh': 19.833382688208207, 'bull_atr_min_pct': 0.004523428367375055, 'bull_atr_max_pct': 0.09299422152924082, 'bull_tp_mult': 2.8743085740371797, 'bull_tsl_mult': 0.7663792976573012, 'bull_time_stop': 67, 'bull_use_sma': True, 'bull_use_ema': True, 'bull_use_atr': True, 'bull_use_adx': True, 'bull_use_spike': True, 'bull_rsi_required': False, 'bear_strategy': 'breakout', 'bear_bb_std_mult': 0.9800812372212391, 'bear_rsi_os': 35, 'bear_rsi_ob': 50, 'bear_adx_thresh': 15.551114402399866, 'bear_atr_min_pct': 0.008670496289364464, 'bear_atr_max_pct': 0.0951056085616733, 'bear_tp_mult': 2.625299476213372, 'bear_tsl_mult': 0.33626878714640823, 'bear_time_stop': 175, 'bear_use_sma': True, 'bear_use_ema': True, 'bear_use_atr': False, 'bear_use_adx': True, 'bear_use_spike': False, 'bear_rsi_required': False, 'sideways_strategy': 'mean_reversion', 'sideways_bb_std_mult': 1.285079571409635, 'sideways_rsi_os': 49, 'sideways_rsi_ob': 56, 'sideways_adx_thresh': 7.221284793184724, 'sideways_atr_min_pct': 0.022536524528871397, 'sideways_atr_max_pct': 0.023717204481792372, 'sideways_tp_mult': 1.6949860978904259, 'sideways_tsl_mult': 0.6604741878292506, 'sideways_time_stop': 180, 'sideways_use_sma': True, 'sideways_use_ema': False, 'sideways_use_atr': False, 'sideways_use_adx': True, 'sideways_use_spike': False, 'sideways_rsi_required': True}.
[I 2025-09-01 11:20:44,102] Trial 257 finished with values: [-1000000000.0, 1000000000.0] and parameters: {'p_sma': 13, 'p_std': 41, 'p_atr': 10, 'p_adx': 10, 'rsi_period': 41, 'ema1': 15, 'ema2': 38, 'slip_atr_k': 0.004659286529225807, 'slip_spread_k': 0.5672098055143913, 'spread_hl_frac': 0.03140858182583038, 'bb_std_mult': 3.1390695779331037, 'rsi_os': 25, 'rsi_ob': 53, 'vol_spike': 0.22787966085407674, 'adx_thresh': 11.612186888026052, 'atr_min_pct': 0.02793194751871752, 'atr_max_pct': 0.04573293307692501, 'tp_mult': 2.60010934299678, 'tsl_mult': 0.7969428395631889, 'strategy': 'breakout', 'time_stop': 243, 'use_sma': False, 'use_atr': False, 'use_adx': False, 'use_ema': True, 'use_spike': True, 'rsi_required': True, 'edge_k': 1.2929868682707362, 'edge_cap': 0.4139884302733697, 'bull_strategy': 'mean_reversion', 'bull_bb_std_mult': 2.72637208001441, 'bull_rsi_os': 9, 'bull_rsi_ob': 93, 'bull_adx_thresh': 19.773574073135123, 'bull_atr_min_pct': 0.004947641076375912, 'bull_atr_max_pct': 0.09380445859691978, 'bull_tp_mult': 2.5653923967706596, 'bull_tsl_mult': 0.8017923974115275, 'bull_time_stop': 247, 'bull_use_sma': True, 'bull_use_ema': True, 'bull_use_atr': True, 'bull_use_adx': True, 'bull_use_spike': True, 'bull_rsi_required': False, 'bear_strategy': 'breakout', 'bear_bb_std_mult': 0.9610889656943808, 'bear_rsi_os': 35, 'bear_rsi_ob': 50, 'bear_adx_thresh': 13.229675124799128, 'bear_atr_min_pct': 0.008336465037426456, 'bear_atr_max_pct': 0.07223259203054543, 'bear_tp_mult': 2.631912706959005, 'bear_tsl_mult': 0.9720061986512787, 'bear_time_stop': 5, 'bear_use_sma': True, 'bear_use_ema': True, 'bear_use_atr': False, 'bear_use_adx': True, 'bear_use_spike': False, 'bear_rsi_required': False, 'sideways_strategy': 'mean_reversion', 'sideways_bb_std_mult': 1.3159145088242696, 'sideways_rsi_os': 54, 'sideways_rsi_ob': 61, 'sideways_adx_thresh': 7.2452835665835345, 'sideways_atr_min_pct': 0.024529655279156088, 'sideways_atr_max_pct': 0.021229814769862812, 'sideways_tp_mult': 1.6801791723945285, 'sideways_tsl_mult': 0.7186302866952063, 'sideways_time_stop': 291, 'sideways_use_sma': True, 'sideways_use_ema': False, 'sideways_use_atr': False, 'sideways_use_adx': True, 'sideways_use_spike': False, 'sideways_rsi_required': True}.
[I 2025-09-01 11:20:44,489] Trial 258 finished with values: [-1000000000.0, 1000000000.0] and parameters: {'p_sma': 14, 'p_std': 36, 'p_atr': 9, 'p_adx': 13, 'rsi_period': 42, 'ema1': 14, 'ema2': 35, 'slip_atr_k': 0.0042771791707751, 'slip_spread_k': 0.5192865350309355, 'spread_hl_frac': 0.031273181055635514, 'bb_std_mult': 3.4308465916173843, 'rsi_os': 25, 'rsi_ob': 53, 'vol_spike': 0.09810410196183544, 'adx_thresh': 21.708212424027334, 'atr_min_pct': 0.008466779171676986, 'atr_max_pct': 0.028606158337200496, 'tp_mult': 2.591554484035378, 'tsl_mult': 0.8222207934228974, 'strategy': 'breakout', 'time_stop': 242, 'use_sma': False, 'use_atr': False, 'use_adx': False, 'use_ema': True, 'use_spike': True, 'rsi_required': True, 'edge_k': 0.1416770429262778, 'edge_cap': 0.3338601355992093, 'bull_strategy': 'mean_reversion', 'bull_bb_std_mult': 2.854360583078213, 'bull_rsi_os': 46, 'bull_rsi_ob': 88, 'bull_adx_thresh': 21.765332599013423, 'bull_atr_min_pct': 0.0042745799126016875, 'bull_atr_max_pct': 0.08635801115348249, 'bull_tp_mult': 2.5694615671355066, 'bull_tsl_mult': 0.7648274061878355, 'bull_time_stop': 134, 'bull_use_sma': True, 'bull_use_ema': True, 'bull_use_atr': True, 'bull_use_adx': True, 'bull_use_spike': True, 'bull_rsi_required': False, 'bear_strategy': 'breakout', 'bear_bb_std_mult': 0.9820093300217132, 'bear_rsi_os': 35, 'bear_rsi_ob': 47, 'bear_adx_thresh': 15.541831360095788, 'bear_atr_min_pct': 0.008216020521025859, 'bear_atr_max_pct': 0.09560677278678736, 'bear_tp_mult': 2.644488592719882, 'bear_tsl_mult': 0.543827861534888, 'bear_time_stop': 197, 'bear_use_sma': True, 'bear_use_ema': True, 'bear_use_atr': False, 'bear_use_adx': True, 'bear_use_spike': False, 'bear_rsi_required': False, 'sideways_strategy': 'mean_reversion', 'sideways_bb_std_mult': 1.3225968168629665, 'sideways_rsi_os': 44, 'sideways_rsi_ob': 60, 'sideways_adx_thresh': 11.094145421689852, 'sideways_atr_min_pct': 0.024138769486696906, 'sideways_atr_max_pct': 0.09640854915783381, 'sideways_tp_mult': 1.5729120665627156, 'sideways_tsl_mult': 0.47711760238486023, 'sideways_time_stop': 182, 'sideways_use_sma': True, 'sideways_use_ema': False, 'sideways_use_atr': False, 'sideways_use_adx': True, 'sideways_use_spike': False, 'sideways_rsi_required': True}.
[I 2025-09-01 11:20:45,108] Trial 260 finished with values: [-1000000000.0, 1000000000.0] and parameters: {'p_sma': 15, 'p_std': 41, 'p_atr': 8, 'p_adx': 10, 'rsi_period': 53, 'ema1': 9, 'ema2': 35, 'slip_atr_k': 0.1824474276155914, 'slip_spread_k': 0.5836220816568719, 'spread_hl_frac': 0.02969646769375118, 'bb_std_mult': 3.4410297998305337, 'rsi_os': 26, 'rsi_ob': 83, 'vol_spike': 0.09908672048710852, 'adx_thresh': 26.671455397029888, 'atr_min_pct': 0.029937491413551266, 'atr_max_pct': 0.028452511707572722, 'tp_mult': 2.3418000619102965, 'tsl_mult': 0.7976310718975002, 'strategy': 'breakout', 'time_stop': 235, 'use_sma': False, 'use_atr': False, 'use_adx': False, 'use_ema': True, 'use_spike': True, 'rsi_required': True, 'edge_k': 0.16125617397581637, 'edge_cap': 0.9159144743873524, 'bull_strategy': 'mean_reversion', 'bull_bb_std_mult': 2.957993272140954, 'bull_rsi_os': 47, 'bull_rsi_ob': 90, 'bull_adx_thresh': 21.740412778519264, 'bull_atr_min_pct': 0.002675296546709037, 'bull_atr_max_pct': 0.08840128438006672, 'bull_tp_mult': 2.57306062861131, 'bull_tsl_mult': 0.74585306343699, 'bull_time_stop': 79, 'bull_use_sma': True, 'bull_use_ema': True, 'bull_use_atr': True, 'bull_use_adx': False, 'bull_use_spike': True, 'bull_rsi_required': False, 'bear_strategy': 'breakout', 'bear_bb_std_mult': 2.8677758226743304, 'bear_rsi_os': 33, 'bear_rsi_ob': 47, 'bear_adx_thresh': 27.346026517327083, 'bear_atr_min_pct': 0.014761271759000147, 'bear_atr_max_pct': 0.0716132639203659, 'bear_tp_mult': 2.6532310259846468, 'bear_tsl_mult': 0.2571775494010379, 'bear_time_stop': 6, 'bear_use_sma': True, 'bear_use_ema': True, 'bear_use_atr': False, 'bear_use_adx': True, 'bear_use_spike': False, 'bear_rsi_required': False, 'sideways_strategy': 'mean_reversion', 'sideways_bb_std_mult': 2.2986142656027955, 'sideways_rsi_os': 21, 'sideways_rsi_ob': 90, 'sideways_adx_thresh': 11.260564233492182, 'sideways_atr_min_pct': 0.01952896004262598, 'sideways_atr_max_pct': 0.0213011521621338, 'sideways_tp_mult': 1.5716415859637736, 'sideways_tsl_mult': 0.6955426819394022, 'sideways_time_stop': 293, 'sideways_use_sma': True, 'sideways_use_ema': False, 'sideways_use_atr': False, 'sideways_use_adx': True, 'sideways_use_spike': True, 'sideways_rsi_required': False}.
[I 2025-09-01 11:21:22,110] Trial 259 finished with values: [-1000000000.0, 1000000000.0] and parameters: {'p_sma': 14, 'p_std': 40, 'p_atr': 9, 'p_adx': 13, 'rsi_period': 46, 'ema1': 22, 'ema2': 35, 'slip_atr_k': 0.11392273919261357, 'slip_spread_k': 0.5962537121107369, 'spread_hl_frac': 0.0315845757485478, 'bb_std_mult': 3.137528773327124, 'rsi_os': 25, 'rsi_ob': 69, 'vol_spike': 0.21726998678196496, 'adx_thresh': 14.0502480081245, 'atr_min_pct': 0.011617334028745268, 'atr_max_pct': 0.09600356483764616, 'tp_mult': 2.5940127212281965, 'tsl_mult': 0.8874927597387372, 'strategy': 'breakout', 'time_stop': 239, 'use_sma': False, 'use_atr': False, 'use_adx': False, 'use_ema': True, 'use_spike': True, 'rsi_required': True, 'edge_k': 0.15535565690729017, 'edge_cap': 0.3302806844899083, 'bull_strategy': 'mean_reversion', 'bull_bb_std_mult': 2.8495524137079027, 'bull_rsi_os': 44, 'bull_rsi_ob': 89, 'bull_adx_thresh': 33.7352952362893, 'bull_atr_min_pct': 0.00035332599086765196, 'bull_atr_max_pct': 0.09329189583856912, 'bull_tp_mult': 2.578393399824152, 'bull_tsl_mult': 0.7406132074401, 'bull_time_stop': 78, 'bull_use_sma': True, 'bull_use_ema': True, 'bull_use_atr': True, 'bull_use_adx': True, 'bull_use_spike': True, 'bull_rsi_required': False, 'bear_strategy': 'breakout', 'bear_bb_std_mult': 0.6939328661494136, 'bear_rsi_os': 35, 'bear_rsi_ob': 48, 'bear_adx_thresh': 17.837741308612678, 'bear_atr_min_pct': 0.008386243882743904, 'bear_atr_max_pct': 0.071510627089869, 'bear_tp_mult': 2.640437420497887, 'bear_tsl_mult': 0.5479432551280896, 'bear_time_stop': 53, 'bear_use_sma': True, 'bear_use_ema': True, 'bear_use_atr': False, 'bear_use_adx': True, 'bear_use_spike': False, 'bear_rsi_required': False, 'sideways_strategy': 'mean_reversion', 'sideways_bb_std_mult': 1.284444239543773, 'sideways_rsi_os': 43, 'sideways_rsi_ob': 90, 'sideways_adx_thresh': 11.071377617182627, 'sideways_atr_min_pct': 0.023959350855647755, 'sideways_atr_max_pct': 0.09304951175536287, 'sideways_tp_mult': 1.573734103709467, 'sideways_tsl_mult': 0.6914390570188947, 'sideways_time_stop': 181, 'sideways_use_sma': True, 'sideways_use_ema': False, 'sideways_use_atr': False, 'sideways_use_adx': True, 'sideways_use_spike': False, 'sideways_rsi_required': True}.
