[I 2025-09-01 11:12:07,355] Trial 198 finished with values: [-1000000000.0, 1000000000.0] and parameters: {'p_sma': 17, 'p_std': 31, 'p_atr': 9, 'p_adx': 27, 'rsi_period': 58, 'ema1': 23, 'ema2': 34, 'slip_atr_k': 0.023905086208493968, 'slip_spread_k': 0.05259652330678591, 'spread_hl_frac': 0.045948846436114445, 'bb_std_mult': 2.562750154883122, 'rsi_os': 25, 'rsi_ob': 90, 'vol_spike': 0.11652692266783321, 'adx_thresh': 19.414495173372213, 'atr_min_pct': 0.027976608414190883, 'atr_max_pct': 0.02122379812663215, 'tp_mult': 2.517069042462439, 'tsl_mult': 0.2987602453309949, 'strategy': 'mean_reversion', 'time_stop': 185, 'use_sma': True, 'use_atr': False, 'use_adx': False, 'use_ema': True, 'use_spike': True, 'rsi_required': True, 'edge_k': 0.4662231230650714, 'edge_cap': 0.3544170125820679, 'bull_strategy': 'breakout', 'bull_bb_std_mult': 2.7798952031678614, 'bull_rsi_os': 55, 'bull_rsi_ob': 91, 'bull_adx_thresh': 30.955482371231643, 'bull_atr_min_pct': 0.0004455936099656509, 'bull_atr_max_pct': 0.08450415849374658, 'bull_tp_mult': 1.5128466560080178, 'bull_tsl_mult': 0.8472171740766334, 'bull_time_stop': 239, 'bull_use_sma': True, 'bull_use_ema': True, 'bull_use_atr': True, 'bull_use_adx': True, 'bull_use_spike': True, 'bull_rsi_required': False, 'bear_strategy': 'breakout', 'bear_bb_std_mult': 1.1026101273783244, 'bear_rsi_os': 33, 'bear_rsi_ob': 54, 'bear_adx_thresh': 17.404507926800928, 'bear_atr_min_pct': 0.007735955960017258, 'bear_atr_max_pct': 0.031287421528671935, 'bear_tp_mult': 2.4335242114150994, 'bear_tsl_mult': 0.3291881220491899, 'bear_time_stop': 123, 'bear_use_sma': False, 'bear_use_ema': True, 'bear_use_atr': False, 'bear_use_adx': False, 'bear_use_spike': True, 'bear_rsi_required': False, 'sideways_strategy': 'mean_reversion', 'sideways_bb_std_mult': 2.8511351989748923, 'sideways_rsi_os': 20, 'sideways_rsi_ob': 86, 'sideways_adx_thresh': 29.43863250254036, 'sideways_atr_min_pct': 0.01739304698059377, 'sideways_atr_max_pct': 0.10363947574986546, 'sideways_tp_mult': 1.4080139173869444, 'sideways_tsl_mult': 0.54835537488169, 'sideways_time_stop': 137, 'sideways_use_sma': True, 'sideways_use_ema': True, 'sideways_use_atr': False, 'sideways_use_adx': False, 'sideways_use_spike': False, 'sideways_rsi_required': True}.
[I 2025-09-01 11:12:48,244] Trial 200 finished with values: [-1000000000.0, 1000000000.0] and parameters: {'p_sma': 14, 'p_std': 30, 'p_atr': 9, 'p_adx': 27, 'rsi_period': 55, 'ema1': 23, 'ema2': 37, 'slip_atr_k': 0.02629902387437094, 'slip_spread_k': 0.1438903977343145, 'spread_hl_frac': 0.044725178456767635, 'bb_std_mult': 2.4766857376943876, 'rsi_os': 25, 'rsi_ob': 95, 'vol_spike': 0.08814720558900258, 'adx_thresh': 19.46577631523826, 'atr_min_pct': 0.025916766079653493, 'atr_max_pct': 0.04122991697319564, 'tp_mult': 2.4700400036933177, 'tsl_mult': 0.4454165695914179, 'strategy': 'mean_reversion', 'time_stop': 244, 'use_sma': True, 'use_atr': False, 'use_adx': False, 'use_ema': True, 'use_spike': True, 'rsi_required': True, 'edge_k': 0.4694616597222512, 'edge_cap': 0.20716252932565016, 'bull_strategy': 'breakout', 'bull_bb_std_mult': 2.798917830180083, 'bull_rsi_os': 23, 'bull_rsi_ob': 88, 'bull_adx_thresh': 30.992049529315018, 'bull_atr_min_pct': 0.002282154931040313, 'bull_atr_max_pct': 0.0746067034418599, 'bull_tp_mult': 1.4975548739831122, 'bull_tsl_mult': 0.7523836834227806, 'bull_time_stop': 216, 'bull_use_sma': True, 'bull_use_ema': True, 'bull_use_atr': True, 'bull_use_adx': True, 'bull_use_spike': True, 'bull_rsi_required': False, 'bear_strategy': 'breakout', 'bear_bb_std_mult': 1.126676334223315, 'bear_rsi_os': 33, 'bear_rsi_ob': 54, 'bear_adx_thresh': 16.15373854383014, 'bear_atr_min_pct': 0.010714831247150301, 'bear_atr_max_pct': 0.05201852811298849, 'bear_tp_mult': 2.061776362777373, 'bear_tsl_mult': 0.32529790911336265, 'bear_time_stop': 123, 'bear_use_sma': False, 'bear_use_ema': True, 'bear_use_atr': False, 'bear_use_adx': False, 'bear_use_spike': True, 'bear_rsi_required': False, 'sideways_strategy': 'mean_reversion', 'sideways_bb_std_mult': 2.8378775551441855, 'sideways_rsi_os': 21, 'sideways_rsi_ob': 84, 'sideways_adx_thresh': 29.78759198462698, 'sideways_atr_min_pct': 0.01743288924124309, 'sideways_atr_max_pct': 0.10362011561257949, 'sideways_tp_mult': 1.243109044338126, 'sideways_tsl_mult': 0.5340962983867006, 'sideways_time_stop': 139, 'sideways_use_sma': True, 'sideways_use_ema': True, 'sideways_use_atr': False, 'sideways_use_adx': False, 'sideways_use_spike': False, 'sideways_rsi_required': True}.
[I 2025-09-01 11:12:49,265] Trial 202 finished with values: [-1000000000.0, 1000000000.0] and parameters: {'p_sma': 14, 'p_std': 26, 'p_atr': 8, 'p_adx': 27, 'rsi_period': 55, 'ema1': 21, 'ema2': 37, 'slip_atr_k': 0.009808579399477704, 'slip_spread_k': 0.15843448942649763, 'spread_hl_frac': 0.02526258863648962, 'bb_std_mult': 2.4815981684759, 'rsi_os': 25, 'rsi_ob': 95, 'vol_spike': 0.10979194920524489, 'adx_thresh': 20.258831785899783, 'atr_min_pct': 0.025905403552756966, 'atr_max_pct': 0.1011460783386001, 'tp_mult': 2.6798015703142246, 'tsl_mult': 0.10123745999619266, 'strategy': 'mean_reversion', 'time_stop': 191, 'use_sma': True, 'use_atr': False, 'use_adx': False, 'use_ema': True, 'use_spike': True, 'rsi_required': True, 'edge_k': 0.2669753362377747, 'edge_cap': 0.31858944988237425, 'bull_strategy': 'breakout', 'bull_bb_std_mult': 2.5802314169892493, 'bull_rsi_os': 23, 'bull_rsi_ob': 88, 'bull_adx_thresh': 31.31324716399816, 'bull_atr_min_pct': 0.002264387079589705, 'bull_atr_max_pct': 0.07838790966312123, 'bull_tp_mult': 1.598709524054681, 'bull_tsl_mult': 0.7623445553730658, 'bull_time_stop': 214, 'bull_use_sma': True, 'bull_use_ema': True, 'bull_use_atr': True, 'bull_use_adx': True, 'bull_use_spike': True, 'bull_rsi_required': False, 'bear_strategy': 'breakout', 'bear_bb_std_mult': 1.1550733680324263, 'bear_rsi_os': 34, 'bear_rsi_ob': 49, 'bear_adx_thresh': 14.852875223836095, 'bear_atr_min_pct': 0.01098287275764474, 'bear_atr_max_pct': 0.05248551762847354, 'bear_tp_mult': 2.0326205342407966, 'bear_tsl_mult': 0.29969428179331925, 'bear_time_stop': 99, 'bear_use_sma': False, 'bear_use_ema': True, 'bear_use_atr': False, 'bear_use_adx': False, 'bear_use_spike': True, 'bear_rsi_required': False, 'sideways_strategy': 'mean_reversion', 'sideways_bb_std_mult': 3.584670713570688, 'sideways_rsi_os': 21, 'sideways_rsi_ob': 82, 'sideways_adx_thresh': 26.82597813522724, 'sideways_atr_min_pct': 0.017914952211372744, 'sideways_atr_max_pct': 0.10631928951344213, 'sideways_tp_mult': 1.5760702101395219, 'sideways_tsl_mult': 0.5326287753433212, 'sideways_time_stop': 138, 'sideways_use_sma': True, 'sideways_use_ema': True, 'sideways_use_atr': False, 'sideways_use_adx': False, 'sideways_use_spike': False, 'sideways_rsi_required': True}.
[I 2025-09-01 11:12:49,797] Trial 199 finished with values: [-1000000000.0, 1000000000.0] and parameters: {'p_sma': 14, 'p_std': 30, 'p_atr': 9, 'p_adx': 27, 'rsi_period': 55, 'ema1': 21, 'ema2': 37, 'slip_atr_k': 0.02888284960862155, 'slip_spread_k': 0.05916079639046043, 'spread_hl_frac': 0.024906720443637228, 'bb_std_mult': 2.6292363795101132, 'rsi_os': 25, 'rsi_ob': 95, 'vol_spike': 0.11686584572346463, 'adx_thresh': 19.339587304619176, 'atr_min_pct': 0.028205148045811382, 'atr_max_pct': 0.048068920441953086, 'tp_mult': 2.5125753720116926, 'tsl_mult': 0.3964536844859807, 'strategy': 'mean_reversion', 'time_stop': 242, 'use_sma': True, 'use_atr': False, 'use_adx': False, 'use_ema': True, 'use_spike': True, 'rsi_required': True, 'edge_k': 0.0006549051304421405, 'edge_cap': 0.3163048695508138, 'bull_strategy': 'breakout', 'bull_bb_std_mult': 2.794161618038019, 'bull_rsi_os': 23, 'bull_rsi_ob': 91, 'bull_adx_thresh': 30.970781170285527, 'bull_atr_min_pct': 0.0010270903557017166, 'bull_atr_max_pct': 0.07455586602904064, 'bull_tp_mult': 1.4911735509673274, 'bull_tsl_mult': 0.7524471636321267, 'bull_time_stop': 244, 'bull_use_sma': True, 'bull_use_ema': True, 'bull_use_atr': True, 'bull_use_adx': True, 'bull_use_spike': True, 'bull_rsi_required': False, 'bear_strategy': 'breakout', 'bear_bb_std_mult': 1.1033304960309773, 'bear_rsi_os': 33, 'bear_rsi_ob': 49, 'bear_adx_thresh': 16.16261893129108, 'bear_atr_min_pct': 0.010828262624161542, 'bear_atr_max_pct': 0.04879310326309906, 'bear_tp_mult': 2.6980371054913306, 'bear_tsl_mult': 0.33060104391698764, 'bear_time_stop': 124, 'bear_use_sma': False, 'bear_use_ema': True, 'bear_use_atr': False, 'bear_use_adx': False, 'bear_use_spike': True, 'bear_rsi_required': False, 'sideways_strategy': 'mean_reversion', 'sideways_bb_std_mult': 2.9080302068294506, 'sideways_rsi_os': 21, 'sideways_rsi_ob': 84, 'sideways_adx_thresh': 26.115093920126565, 'sideways_atr_min_pct': 0.01744069431925858, 'sideways_atr_max_pct': 0.10491636339553417, 'sideways_tp_mult': 1.3839126365279766, 'sideways_tsl_mult': 0.5497015922378592, 'sideways_time_stop': 135, 'sideways_use_sma': True, 'sideways_use_ema': True, 'sideways_use_atr': False, 'sideways_use_adx': False, 'sideways_use_spike': False, 'sideways_rsi_required': True}.
[I 2025-09-01 11:12:49,993] Trial 201 finished with values: [-1000000000.0, 1000000000.0] and parameters: {'p_sma': 13, 'p_std': 30, 'p_atr': 8, 'p_adx': 27, 'rsi_period': 67, 'ema1': 23, 'ema2': 38, 'slip_atr_k': 0.025638536714657437, 'slip_spread_k': 0.15883174255914337, 'spread_hl_frac': 0.0296577819883234, 'bb_std_mult': 2.505059958711967, 'rsi_os': 25, 'rsi_ob': 95, 'vol_spike': 0.08893634255672617, 'adx_thresh': 19.37559078098223, 'atr_min_pct': 0.025832095756229488, 'atr_max_pct': 0.10150003444166851, 'tp_mult': 2.4613540281169746, 'tsl_mult': 0.2941913269417269, 'strategy': 'mean_reversion', 'time_stop': 190, 'use_sma': True, 'use_atr': False, 'use_adx': False, 'use_ema': True, 'use_spike': True, 'rsi_required': True, 'edge_k': 0.44060787085218467, 'edge_cap': 0.3195239264834369, 'bull_strategy': 'breakout', 'bull_bb_std_mult': 2.565059788831512, 'bull_rsi_os': 22, 'bull_rsi_ob': 91, 'bull_adx_thresh': 31.368946478595674, 'bull_atr_min_pct': 0.0007448556702039913, 'bull_atr_max_pct': 0.07828066254935447, 'bull_tp_mult': 1.597737531264102, 'bull_tsl_mult': 0.7614221634981255, 'bull_time_stop': 215, 'bull_use_sma': True, 'bull_use_ema': True, 'bull_use_atr': True, 'bull_use_adx': True, 'bull_use_spike': True, 'bull_rsi_required': False, 'bear_strategy': 'breakout', 'bear_bb_std_mult': 1.1080354474975997, 'bear_rsi_os': 33, 'bear_rsi_ob': 54, 'bear_adx_thresh': 14.861623069500936, 'bear_atr_min_pct': 0.012006175587296851, 'bear_atr_max_pct': 0.0501591420660209, 'bear_tp_mult': 2.692849019337772, 'bear_tsl_mult': 0.32970599902820674, 'bear_time_stop': 125, 'bear_use_sma': False, 'bear_use_ema': True, 'bear_use_atr': False, 'bear_use_adx': False, 'bear_use_spike': True, 'bear_rsi_required': False, 'sideways_strategy': 'mean_reversion', 'sideways_bb_std_mult': 3.1146401797692738, 'sideways_rsi_os': 21, 'sideways_rsi_ob': 84, 'sideways_adx_thresh': 29.65763533202405, 'sideways_atr_min_pct': 0.017423751977502958, 'sideways_atr_max_pct': 0.10368290514325539, 'sideways_tp_mult': 1.616851618173027, 'sideways_tsl_mult': 0.5435461572443777, 'sideways_time_stop': 138, 'sideways_use_sma': True, 'sideways_use_ema': True, 'sideways_use_atr': False, 'sideways_use_adx': False, 'sideways_use_spike': False, 'sideways_rsi_required': True}.
[I 2025-09-01 11:13:31,572] Trial 206 finished with values: [-0.004198476838572218, 0.0049997672553593695] and parameters: {'p_sma': 16, 'p_std': 26, 'p_atr': 8, 'p_adx': 30, 'rsi_period': 47, 'ema1': 22, 'ema2': 36, 'slip_atr_k': 0.013022599828603256, 'slip_spread_k': 0.31388494793102784, 'spread_hl_frac': 0.03250951028939743, 'bb_std_mult': 2.824474799957793, 'rsi_os': 23, 'rsi_ob': 88, 'vol_spike': 0.1019517032425792, 'adx_thresh': 21.33566434710289, 'atr_min_pct': 0.026989244842356826, 'atr_max_pct': 0.0923535509676362, 'tp_mult': 2.5873357597902418, 'tsl_mult': 0.5482287172243852, 'strategy': 'mean_reversion', 'time_stop': 209, 'use_sma': True, 'use_atr': False, 'use_adx': False, 'use_ema': True, 'use_spike': True, 'rsi_required': True, 'edge_k': 0.3192766110755081, 'edge_cap': 0.39983667224670183, 'bull_strategy': 'breakout', 'bull_bb_std_mult': 2.6183224975947255, 'bull_rsi_os': 48, 'bull_rsi_ob': 94, 'bull_adx_thresh': 29.759904151120054, 'bull_atr_min_pct': 0.001423299838120947, 'bull_atr_max_pct': 0.09281759497574911, 'bull_tp_mult': 1.5729428822542837, 'bull_tsl_mult': 0.822758953705125, 'bull_time_stop': 247, 'bull_use_sma': True, 'bull_use_ema': True, 'bull_use_atr': True, 'bull_use_adx': True, 'bull_use_spike': True, 'bull_rsi_required': False, 'bear_strategy': 'breakout', 'bear_bb_std_mult': 1.1985390325599898, 'bear_rsi_os': 30, 'bear_rsi_ob': 51, 'bear_adx_thresh': 15.311751205237208, 'bear_atr_min_pct': 0.009153941276695486, 'bear_atr_max_pct': 0.02635786278866078, 'bear_tp_mult': 2.618536620293945, 'bear_tsl_mult': 0.05054412152587022, 'bear_time_stop': 111, 'bear_use_sma': False, 'bear_use_ema': True, 'bear_use_atr': False, 'bear_use_adx': False, 'bear_use_spike': True, 'bear_rsi_required': False, 'sideways_strategy': 'mean_reversion', 'sideways_bb_std_mult': 2.9777617188013408, 'sideways_rsi_os': 19, 'sideways_rsi_ob': 49, 'sideways_adx_thresh': 27.414483864323167, 'sideways_atr_min_pct': 0.018238415205513014, 'sideways_atr_max_pct': 0.14434814357406806, 'sideways_tp_mult': 1.3268225394101538, 'sideways_tsl_mult': 0.5033698540288851, 'sideways_time_stop': 127, 'sideways_use_sma': True, 'sideways_use_ema': True, 'sideways_use_atr': False, 'sideways_use_adx': False, 'sideways_use_spike': False, 'sideways_rsi_required': True}.
[I 2025-09-01 11:13:32,536] Trial 205 finished with values: [-0.004887791108526107, 0.005312468441499311] and parameters: {'p_sma': 13, 'p_std': 26, 'p_atr': 8, 'p_adx': 28, 'rsi_period': 48, 'ema1': 22, 'ema2': 35, 'slip_atr_k': 0.02578191745930041, 'slip_spread_k': 0.32028130203686633, 'spread_hl_frac': 0.03541383178887713, 'bb_std_mult': 2.817919832099136, 'rsi_os': 26, 'rsi_ob': 88, 'vol_spike': 0.10101876414338577, 'adx_thresh': 16.58231180820978, 'atr_min_pct': 0.027045610483301407, 'atr_max_pct': 0.03737147897328971, 'tp_mult': 2.5903985438405788, 'tsl_mult': 0.5493820776680172, 'strategy': 'mean_reversion', 'time_stop': 219, 'use_sma': True, 'use_atr': False, 'use_adx': False, 'use_ema': True, 'use_spike': True, 'rsi_required': True, 'edge_k': 0.1094296607018436, 'edge_cap': 0.40745289858700295, 'bull_strategy': 'breakout', 'bull_bb_std_mult': 2.664722267400945, 'bull_rsi_os': 48, 'bull_rsi_ob': 90, 'bull_adx_thresh': 29.814393434131144, 'bull_atr_min_pct': 0.0006465380896372596, 'bull_atr_max_pct': 0.09293578697814492, 'bull_tp_mult': 1.579137607609749, 'bull_tsl_mult': 0.8185558609307021, 'bull_time_stop': 249, 'bull_use_sma': True, 'bull_use_ema': True, 'bull_use_atr': True, 'bull_use_adx': True, 'bull_use_spike': True, 'bull_rsi_required': False, 'bear_strategy': 'breakout', 'bear_bb_std_mult': 1.1860470424061405, 'bear_rsi_os': 30, 'bear_rsi_ob': 50, 'bear_adx_thresh': 15.183561028126187, 'bear_atr_min_pct': 0.012147080523657042, 'bear_atr_max_pct': 0.015276413272570115, 'bear_tp_mult': 1.9917609556835578, 'bear_tsl_mult': 0.3608143971877701, 'bear_time_stop': 134, 'bear_use_sma': False, 'bear_use_ema': True, 'bear_use_atr': False, 'bear_use_adx': False, 'bear_use_spike': True, 'bear_rsi_required': False, 'sideways_strategy': 'mean_reversion', 'sideways_bb_std_mult': 1.1699055423105256, 'sideways_rsi_os': 21, 'sideways_rsi_ob': 49, 'sideways_adx_thresh': 30.289048817779847, 'sideways_atr_min_pct': 0.01676146145814951, 'sideways_atr_max_pct': 0.08641182016009069, 'sideways_tp_mult': 1.3334935494165716, 'sideways_tsl_mult': 0.5032862320337409, 'sideways_time_stop': 123, 'sideways_use_sma': True, 'sideways_use_ema': True, 'sideways_use_atr': False, 'sideways_use_adx': False, 'sideways_use_spike': False, 'sideways_rsi_required': True}.
[I 2025-09-01 11:13:33,105] Trial 203 finished with values: [-0.0018236783867660034, 0.003098682919924217] and parameters: {'p_sma': 13, 'p_std': 26, 'p_atr': 8, 'p_adx': 30, 'rsi_period': 49, 'ema1': 21, 'ema2': 36, 'slip_atr_k': 0.010441865150852154, 'slip_spread_k': 0.0792585687926424, 'spread_hl_frac': 0.029608974446707074, 'bb_std_mult': 3.1842993184964494, 'rsi_os': 26, 'rsi_ob': 86, 'vol_spike': 0.11339019130769168, 'adx_thresh': 21.42361194350276, 'atr_min_pct': 0.029185946224652, 'atr_max_pct': 0.03748931023403078, 'tp_mult': 2.5949099496349404, 'tsl_mult': 0.8516495583843253, 'strategy': 'mean_reversion', 'time_stop': 245, 'use_sma': True, 'use_atr': False, 'use_adx': False, 'use_ema': True, 'use_spike': True, 'rsi_required': True, 'edge_k': 0.257683921928994, 'edge_cap': 0.3150131311298686, 'bull_strategy': 'breakout', 'bull_bb_std_mult': 2.8432682262751285, 'bull_rsi_os': 48, 'bull_rsi_ob': 90, 'bull_adx_thresh': 30.045994326480198, 'bull_atr_min_pct': 0.0011201723694301414, 'bull_atr_max_pct': 0.09167381263583503, 'bull_tp_mult': 2.6711581524653667, 'bull_tsl_mult': 0.8158476911436592, 'bull_time_stop': 250, 'bull_use_sma': True, 'bull_use_ema': True, 'bull_use_atr': True, 'bull_use_adx': True, 'bull_use_spike': True, 'bull_rsi_required': False, 'bear_strategy': 'breakout', 'bear_bb_std_mult': 0.8383748931193498, 'bear_rsi_os': 34, 'bear_rsi_ob': 49, 'bear_adx_thresh': 15.886512377121129, 'bear_atr_min_pct': 0.008972194991237085, 'bear_atr_max_pct': 0.025802132792945874, 'bear_tp_mult': 2.619090135242263, 'bear_tsl_mult': 0.2974430825481539, 'bear_time_stop': 102, 'bear_use_sma': False, 'bear_use_ema': True, 'bear_use_atr': False, 'bear_use_adx': False, 'bear_use_spike': True, 'bear_rsi_required': False, 'sideways_strategy': 'mean_reversion', 'sideways_bb_std_mult': 3.591263725324293, 'sideways_rsi_os': 21, 'sideways_rsi_ob': 88, 'sideways_adx_thresh': 24.844508758457884, 'sideways_atr_min_pct': 0.018137405040728506, 'sideways_atr_max_pct': 0.09135038157865175, 'sideways_tp_mult': 1.6446503453001138, 'sideways_tsl_mult': 0.49845482655050977, 'sideways_time_stop': 126, 'sideways_use_sma': True, 'sideways_use_ema': True, 'sideways_use_atr': False, 'sideways_use_adx': False, 'sideways_use_spike': False, 'sideways_rsi_required': True}.
[I 2025-09-01 11:13:33,470] Trial 204 finished with values: [-0.007989307539399304, 0.008008510426556776] and parameters: {'p_sma': 19, 'p_std': 27, 'p_atr': 20, 'p_adx': 28, 'rsi_period': 47, 'ema1': 21, 'ema2': 36, 'slip_atr_k': 0.027724247416250274, 'slip_spread_k': 0.3264053784825004, 'spread_hl_frac': 0.03601054385895651, 'bb_std_mult': 2.848454571214148, 'rsi_os': 26, 'rsi_ob': 88, 'vol_spike': 0.10149168016410964, 'adx_thresh': 21.341213224613906, 'atr_min_pct': 0.028196310151961827, 'atr_max_pct': 0.036634953226303724, 'tp_mult': 2.587066290684759, 'tsl_mult': 0.5396464866513303, 'strategy': 'mean_reversion', 'time_stop': 208, 'use_sma': True, 'use_atr': False, 'use_adx': False, 'use_ema': True, 'use_spike': True, 'rsi_required': True, 'edge_k': 0.3320266434415669, 'edge_cap': 0.39887016884016785, 'bull_strategy': 'breakout', 'bull_bb_std_mult': 2.6367851105516693, 'bull_rsi_os': 22, 'bull_rsi_ob': 90, 'bull_adx_thresh': 29.762546528886208, 'bull_atr_min_pct': 0.000980907079606101, 'bull_atr_max_pct': 0.09354539692267758, 'bull_tp_mult': 1.5615454844535681, 'bull_tsl_mult': 0.8129617418161735, 'bull_time_stop': 245, 'bull_use_sma': True, 'bull_use_ema': True, 'bull_use_atr': True, 'bull_use_adx': True, 'bull_use_spike': True, 'bull_rsi_required': False, 'bear_strategy': 'breakout', 'bear_bb_std_mult': 1.1901893575030595, 'bear_rsi_os': 35, 'bear_rsi_ob': 67, 'bear_adx_thresh': 15.336738300523924, 'bear_atr_min_pct': 0.011661273643131362, 'bear_atr_max_pct': 0.01659318114989529, 'bear_tp_mult': 2.6154415314922588, 'bear_tsl_mult': 0.053812868117314706, 'bear_time_stop': 29, 'bear_use_sma': False, 'bear_use_ema': True, 'bear_use_atr': False, 'bear_use_adx': False, 'bear_use_spike': True, 'bear_rsi_required': False, 'sideways_strategy': 'mean_reversion', 'sideways_bb_std_mult': 3.4515003735696874, 'sideways_rsi_os': 21, 'sideways_rsi_ob': 84, 'sideways_adx_thresh': 25.025516885160364, 'sideways_atr_min_pct': 0.01854980057592959, 'sideways_atr_max_pct': 0.09029184078592359, 'sideways_tp_mult': 1.5159642951104373, 'sideways_tsl_mult': 0.4963000413242472, 'sideways_time_stop': 145, 'sideways_use_sma': True, 'sideways_use_ema': True, 'sideways_use_atr': False, 'sideways_use_adx': False, 'sideways_use_spike': False, 'sideways_rsi_required': True}.
