[I 2025-09-01 12:03:10,818] Trial 507 finished with values: [-1000000000.0, 1000000000.0] and parameters: {'p_sma': 27, 'p_std': 35, 'p_atr': 27, 'p_adx': 13, 'rsi_period': 74, 'ema1': 28, 'ema2': 53, 'slip_atr_k': 0.027929650685298048, 'slip_spread_k': 0.3834474831783311, 'spread_hl_frac': 0.003171636528204206, 'bb_std_mult': 1.9597215051232477, 'rsi_os': 36, 'rsi_ob': 49, 'vol_spike': 0.20275232220925593, 'adx_thresh': 22.311317444902063, 'atr_min_pct': 0.020433987128629323, 'atr_max_pct': 0.08326393263055716, 'tp_mult': 1.386815093718441, 'tsl_mult': 0.11793652834878822, 'strategy': 'breakout', 'time_stop': 152, 'use_sma': False, 'use_atr': True, 'use_adx': True, 'use_ema': True, 'use_spike': False, 'rsi_required': False, 'edge_k': 0.18138498202485745, 'edge_cap': 0.0876188826580613, 'bull_strategy': 'mean_reversion', 'bull_bb_std_mult': 2.4536583638437803, 'bull_rsi_os': 52, 'bull_rsi_ob': 76, 'bull_adx_thresh': 14.316307270126789, 'bull_atr_min_pct': 0.014475528764964784, 'bull_atr_max_pct': 0.10972090994134003, 'bull_tp_mult': 1.3032120690094775, 'bull_tsl_mult': 0.18671695173953617, 'bull_time_stop': 167, 'bull_use_sma': False, 'bull_use_ema': False, 'bull_use_atr': True, 'bull_use_adx': False, 'bull_use_spike': False, 'bull_rsi_required': False, 'bear_strategy': 'mean_reversion', 'bear_bb_std_mult': 1.5981123929684617, 'bear_rsi_os': 26, 'bear_rsi_ob': 72, 'bear_adx_thresh': 9.58238517727562, 'bear_atr_min_pct': 0.017796971095591148, 'bear_atr_max_pct': 0.02922677740672333, 'bear_tp_mult': 2.9504569047431337, 'bear_tsl_mult': 0.7300041159736672, 'bear_time_stop': 273, 'bear_use_sma': True, 'bear_use_ema': False, 'bear_use_atr': True, 'bear_use_adx': True, 'bear_use_spike': False, 'bear_rsi_required': True, 'sideways_strategy': 'breakout', 'sideways_bb_std_mult': 2.107629384091341, 'sideways_rsi_os': 42, 'sideways_rsi_ob': 88, 'sideways_adx_thresh': 20.181665467205725, 'sideways_atr_min_pct': 0.015057861012256394, 'sideways_atr_max_pct': 0.12586727326580954, 'sideways_tp_mult': 2.8151888633309823, 'sideways_tsl_mult': 0.4138775744333381, 'sideways_time_stop': 99, 'sideways_use_sma': False, 'sideways_use_ema': False, 'sideways_use_atr': True, 'sideways_use_adx': True, 'sideways_use_spike': True, 'sideways_rsi_required': False}.
[I 2025-09-01 12:03:10,860] Trial 504 finished with values: [-1000000000.0, 1000000000.0] and parameters: {'p_sma': 38, 'p_std': 35, 'p_atr': 28, 'p_adx': 8, 'rsi_period': 47, 'ema1': 26, 'ema2': 11, 'slip_atr_k': 0.06735215932480537, 'slip_spread_k': 0.9722168783109568, 'spread_hl_frac': 0.003285658486357747, 'bb_std_mult': 0.9043521285125031, 'rsi_os': 36, 'rsi_ob': 49, 'vol_spike': 0.19840986462865476, 'adx_thresh': 22.362863524755483, 'atr_min_pct': 0.02050157901455264, 'atr_max_pct': 0.08601247003924856, 'tp_mult': 2.038343577633782, 'tsl_mult': 0.6680882087024536, 'strategy': 'breakout', 'time_stop': 177, 'use_sma': False, 'use_atr': True, 'use_adx': True, 'use_ema': False, 'use_spike': False, 'rsi_required': False, 'edge_k': 0.1651076557188951, 'edge_cap': 0.13915462885078558, 'bull_strategy': 'mean_reversion', 'bull_bb_std_mult': 1.9333897505213795, 'bull_rsi_os': 52, 'bull_rsi_ob': 49, 'bull_adx_thresh': 23.554048272369176, 'bull_atr_min_pct': 0.013818388052228937, 'bull_atr_max_pct': 0.11831625448977218, 'bull_tp_mult': 1.3046989188818825, 'bull_tsl_mult': 0.5303313547564457, 'bull_time_stop': 181, 'bull_use_sma': False, 'bull_use_ema': False, 'bull_use_atr': True, 'bull_use_adx': False, 'bull_use_spike': False, 'bull_rsi_required': False, 'bear_strategy': 'breakout', 'bear_bb_std_mult': 2.0075345504148436, 'bear_rsi_os': 50, 'bear_rsi_ob': 83, 'bear_adx_thresh': 9.646170282725059, 'bear_atr_min_pct': 0.0032589808182016174, 'bear_atr_max_pct': 0.055453315261330884, 'bear_tp_mult': 1.5235979545775853, 'bear_tsl_mult': 0.6875139374471062, 'bear_time_stop': 274, 'bear_use_sma': True, 'bear_use_ema': False, 'bear_use_atr': True, 'bear_use_adx': True, 'bear_use_spike': False, 'bear_rsi_required': True, 'sideways_strategy': 'breakout', 'sideways_bb_std_mult': 2.6706115820926066, 'sideways_rsi_os': 41, 'sideways_rsi_ob': 86, 'sideways_adx_thresh': 33.51031606156696, 'sideways_atr_min_pct': 0.01133312976213416, 'sideways_atr_max_pct': 0.1317148995259685, 'sideways_tp_mult': 2.8875297640343907, 'sideways_tsl_mult': 0.4135602351444282, 'sideways_time_stop': 101, 'sideways_use_sma': False, 'sideways_use_ema': False, 'sideways_use_atr': True, 'sideways_use_adx': True, 'sideways_use_spike': True, 'sideways_rsi_required': False}.
[I 2025-09-01 12:03:11,156] Trial 506 finished with values: [-1000000000.0, 1000000000.0] and parameters: {'p_sma': 27, 'p_std': 35, 'p_atr': 19, 'p_adx': 13, 'rsi_period': 47, 'ema1': 28, 'ema2': 27, 'slip_atr_k': 0.1674599983969769, 'slip_spread_k': 0.7388094232361279, 'spread_hl_frac': 0.00314339708730735, 'bb_std_mult': 1.9598202017406494, 'rsi_os': 35, 'rsi_ob': 49, 'vol_spike': 0.19932805987429558, 'adx_thresh': 22.29943947721102, 'atr_min_pct': 0.02248569632897731, 'atr_max_pct': 0.08300077644939002, 'tp_mult': 2.860665307787494, 'tsl_mult': 0.11836724689648567, 'strategy': 'breakout', 'time_stop': 184, 'use_sma': False, 'use_atr': True, 'use_adx': True, 'use_ema': True, 'use_spike': False, 'rsi_required': False, 'edge_k': 0.19192654295012845, 'edge_cap': 0.7185925036352219, 'bull_strategy': 'mean_reversion', 'bull_bb_std_mult': 3.581253701221506, 'bull_rsi_os': 9, 'bull_rsi_ob': 50, 'bull_adx_thresh': 13.97655688961067, 'bull_atr_min_pct': 0.014373692827843905, 'bull_atr_max_pct': 0.10865754767576313, 'bull_tp_mult': 1.2879345619863962, 'bull_tsl_mult': 0.01954592095836999, 'bull_time_stop': 166, 'bull_use_sma': False, 'bull_use_ema': False, 'bull_use_atr': True, 'bull_use_adx': False, 'bull_use_spike': False, 'bull_rsi_required': False, 'bear_strategy': 'mean_reversion', 'bear_bb_std_mult': 1.5698930528923638, 'bear_rsi_os': 26, 'bear_rsi_ob': 54, 'bear_adx_thresh': 11.229539675727448, 'bear_atr_min_pct': 0.017870037676585102, 'bear_atr_max_pct': 0.055785588329342856, 'bear_tp_mult': 1.651268081380018, 'bear_tsl_mult': 0.7301812805871397, 'bear_time_stop': 277, 'bear_use_sma': True, 'bear_use_ema': False, 'bear_use_atr': True, 'bear_use_adx': True, 'bear_use_spike': False, 'bear_rsi_required': True, 'sideways_strategy': 'breakout', 'sideways_bb_std_mult': 2.11477665069672, 'sideways_rsi_os': 42, 'sideways_rsi_ob': 88, 'sideways_adx_thresh': 33.929823737119754, 'sideways_atr_min_pct': 0.004685517675586361, 'sideways_atr_max_pct': 0.1257497647677302, 'sideways_tp_mult': 2.8492069446239214, 'sideways_tsl_mult': 0.8354901121463403, 'sideways_time_stop': 101, 'sideways_use_sma': False, 'sideways_use_ema': False, 'sideways_use_atr': True, 'sideways_use_adx': True, 'sideways_use_spike': True, 'sideways_rsi_required': False}.
[I 2025-09-01 12:03:11,591] Trial 505 finished with values: [-1000000000.0, 1000000000.0] and parameters: {'p_sma': 27, 'p_std': 60, 'p_atr': 28, 'p_adx': 8, 'rsi_period': 74, 'ema1': 24, 'ema2': 14, 'slip_atr_k': 0.14714515958658156, 'slip_spread_k': 0.9964419166488203, 'spread_hl_frac': 0.0028090066401777747, 'bb_std_mult': 0.8788120153861622, 'rsi_os': 32, 'rsi_ob': 49, 'vol_spike': 0.19806861002510937, 'adx_thresh': 11.999786894213504, 'atr_min_pct': 0.020482443433353224, 'atr_max_pct': 0.08314026633472275, 'tp_mult': 2.0869936598129777, 'tsl_mult': 0.11415899934690843, 'strategy': 'breakout', 'time_stop': 176, 'use_sma': False, 'use_atr': True, 'use_adx': True, 'use_ema': False, 'use_spike': False, 'rsi_required': False, 'edge_k': 0.164742042059989, 'edge_cap': 0.08396016241061217, 'bull_strategy': 'mean_reversion', 'bull_bb_std_mult': 1.9379283389392565, 'bull_rsi_os': 52, 'bull_rsi_ob': 50, 'bull_adx_thresh': 10.385982326442104, 'bull_atr_min_pct': 0.015357049110678126, 'bull_atr_max_pct': 0.10844591586086759, 'bull_tp_mult': 1.3145727486561762, 'bull_tsl_mult': 0.016746695277705337, 'bull_time_stop': 166, 'bull_use_sma': False, 'bull_use_ema': False, 'bull_use_atr': True, 'bull_use_adx': False, 'bull_use_spike': False, 'bull_rsi_required': False, 'bear_strategy': 'breakout', 'bear_bb_std_mult': 1.6291607450776657, 'bear_rsi_os': 24, 'bear_rsi_ob': 73, 'bear_adx_thresh': 9.58784031402241, 'bear_atr_min_pct': 0.0022075882439287382, 'bear_atr_max_pct': 0.028581575117091338, 'bear_tp_mult': 1.6580155050989116, 'bear_tsl_mult': 0.6565762887770418, 'bear_time_stop': 272, 'bear_use_sma': True, 'bear_use_ema': False, 'bear_use_atr': True, 'bear_use_adx': True, 'bear_use_spike': False, 'bear_rsi_required': True, 'sideways_strategy': 'breakout', 'sideways_bb_std_mult': 0.6017349047897909, 'sideways_rsi_os': 42, 'sideways_rsi_ob': 86, 'sideways_adx_thresh': 20.31250918762854, 'sideways_atr_min_pct': 0.003396291247676906, 'sideways_atr_max_pct': 0.12607008056007232, 'sideways_tp_mult': 2.958576518047178, 'sideways_tsl_mult': 0.412089088491724, 'sideways_time_stop': 100, 'sideways_use_sma': False, 'sideways_use_ema': False, 'sideways_use_atr': True, 'sideways_use_adx': True, 'sideways_use_spike': True, 'sideways_rsi_required': False}.
[I 2025-09-01 12:03:55,331] Trial 510 finished with values: [-0.06415422644365953, 0.06378573912511931] and parameters: {'p_sma': 25, 'p_std': 32, 'p_atr': 24, 'p_adx': 8, 'rsi_period': 27, 'ema1': 24, 'ema2': 15, 'slip_atr_k': 0.20333334674700215, 'slip_spread_k': 0.8438345401732595, 'spread_hl_frac': 0.0025827249216485854, 'bb_std_mult': 0.8619864433819415, 'rsi_os': 33, 'rsi_ob': 48, 'vol_spike': 0.18793380547894709, 'adx_thresh': 26.870822837647054, 'atr_min_pct': 0.024438084712164423, 'atr_max_pct': 0.07487764423932516, 'tp_mult': 2.1667192115169662, 'tsl_mult': 0.07544472650764247, 'strategy': 'breakout', 'time_stop': 170, 'use_sma': False, 'use_atr': True, 'use_adx': True, 'use_ema': True, 'use_spike': False, 'rsi_required': False, 'edge_k': 0.060431954269043506, 'edge_cap': 0.9058409020195315, 'bull_strategy': 'mean_reversion', 'bull_bb_std_mult': 1.7152520771395992, 'bull_rsi_os': 31, 'bull_rsi_ob': 51, 'bull_adx_thresh': 5.936154657899075, 'bull_atr_min_pct': 0.015428333634268182, 'bull_atr_max_pct': 0.11442487246829469, 'bull_tp_mult': 1.3628007842299064, 'bull_tsl_mult': 0.568160606812441, 'bull_time_stop': 171, 'bull_use_sma': False, 'bull_use_ema': False, 'bull_use_atr': True, 'bull_use_adx': False, 'bull_use_spike': False, 'bull_rsi_required': False, 'bear_strategy': 'breakout', 'bear_bb_std_mult': 1.280544725037824, 'bear_rsi_os': 28, 'bear_rsi_ob': 51, 'bear_adx_thresh': 32.85160662323374, 'bear_atr_min_pct': 0.00280487827992478, 'bear_atr_max_pct': 0.10802358198928372, 'bear_tp_mult': 1.5594090721665421, 'bear_tsl_mult': 0.7995969217946974, 'bear_time_stop': 260, 'bear_use_sma': True, 'bear_use_ema': False, 'bear_use_atr': True, 'bear_use_adx': True, 'bear_use_spike': False, 'bear_rsi_required': True, 'sideways_strategy': 'breakout', 'sideways_bb_std_mult': 2.210333545571023, 'sideways_rsi_os': 39, 'sideways_rsi_ob': 88, 'sideways_adx_thresh': 32.4422094063876, 'sideways_atr_min_pct': 0.005200880055257921, 'sideways_atr_max_pct': 0.12250252008367542, 'sideways_tp_mult': 2.771620216032963, 'sideways_tsl_mult': 0.39956654614112136, 'sideways_time_stop': 217, 'sideways_use_sma': False, 'sideways_use_ema': False, 'sideways_use_atr': True, 'sideways_use_adx': True, 'sideways_use_spike': True, 'sideways_rsi_required': False}.
[I 2025-09-01 12:03:55,345] Trial 509 finished with values: [-1000000000.0, 1000000000.0] and parameters: {'p_sma': 25, 'p_std': 5, 'p_atr': 18, 'p_adx': 21, 'rsi_period': 27, 'ema1': 24, 'ema2': 24, 'slip_atr_k': 0.13644734696935812, 'slip_spread_k': 0.36523549145957, 'spread_hl_frac': 0.04611538626025351, 'bb_std_mult': 0.839613317517903, 'rsi_os': 32, 'rsi_ob': 48, 'vol_spike': 0.20241549078022986, 'adx_thresh': 30.062662039665152, 'atr_min_pct': 0.024614490342658397, 'atr_max_pct': 0.12376741394873372, 'tp_mult': 2.1773135483525023, 'tsl_mult': 0.0850489916506943, 'strategy': 'breakout', 'time_stop': 185, 'use_sma': False, 'use_atr': True, 'use_adx': True, 'use_ema': True, 'use_spike': False, 'rsi_required': False, 'edge_k': 0.07387134318944942, 'edge_cap': 0.09258464904802335, 'bull_strategy': 'mean_reversion', 'bull_bb_std_mult': 3.4261196514868146, 'bull_rsi_os': 14, 'bull_rsi_ob': 47, 'bull_adx_thresh': 6.1621238358156, 'bull_atr_min_pct': 0.015590316816470226, 'bull_atr_max_pct': 0.11396973097518759, 'bull_tp_mult': 1.3556984453804504, 'bull_tsl_mult': 0.12575079137603085, 'bull_time_stop': 171, 'bull_use_sma': False, 'bull_use_ema': False, 'bull_use_atr': True, 'bull_use_adx': False, 'bull_use_spike': False, 'bull_rsi_required': False, 'bear_strategy': 'breakout', 'bear_bb_std_mult': 1.2908136571461475, 'bear_rsi_os': 28, 'bear_rsi_ob': 74, 'bear_adx_thresh': 33.97563164680336, 'bear_atr_min_pct': 0.02237534011310018, 'bear_atr_max_pct': 0.10846479163336285, 'bear_tp_mult': 2.2469185719098315, 'bear_tsl_mult': 0.7695959667052505, 'bear_time_stop': 261, 'bear_use_sma': True, 'bear_use_ema': False, 'bear_use_atr': True, 'bear_use_adx': True, 'bear_use_spike': False, 'bear_rsi_required': True, 'sideways_strategy': 'breakout', 'sideways_bb_std_mult': 2.1862385318711275, 'sideways_rsi_os': 39, 'sideways_rsi_ob': 89, 'sideways_adx_thresh': 32.60765287745679, 'sideways_atr_min_pct': 0.012426268125377758, 'sideways_atr_max_pct': 0.130480196859716, 'sideways_tp_mult': 2.898587912265781, 'sideways_tsl_mult': 0.7312932364410807, 'sideways_time_stop': 110, 'sideways_use_sma': False, 'sideways_use_ema': False, 'sideways_use_atr': True, 'sideways_use_adx': True, 'sideways_use_spike': True, 'sideways_rsi_required': False}.
[I 2025-09-01 12:03:55,683] Trial 508 finished with values: [-1000000000.0, 1000000000.0] and parameters: {'p_sma': 48, 'p_std': 32, 'p_atr': 26, 'p_adx': 21, 'rsi_period': 61, 'ema1': 24, 'ema2': 15, 'slip_atr_k': 0.24361711286800597, 'slip_spread_k': 0.7866523618351277, 'spread_hl_frac': 0.019235101608631303, 'bb_std_mult': 0.8766790589112043, 'rsi_os': 32, 'rsi_ob': 48, 'vol_spike': 0.18970532818280592, 'adx_thresh': 23.39930443674838, 'atr_min_pct': 0.02350860660888361, 'atr_max_pct': 0.07566109879138293, 'tp_mult': 1.2840033257681047, 'tsl_mult': 0.0784951825787599, 'strategy': 'breakout', 'time_stop': 188, 'use_sma': False, 'use_atr': True, 'use_adx': True, 'use_ema': True, 'use_spike': False, 'rsi_required': False, 'edge_k': 0.052824749283874206, 'edge_cap': 0.09448145148529366, 'bull_strategy': 'mean_reversion', 'bull_bb_std_mult': 1.0906477910254426, 'bull_rsi_os': 31, 'bull_rsi_ob': 51, 'bull_adx_thresh': 6.14944395487766, 'bull_atr_min_pct': 0.015043432239614652, 'bull_atr_max_pct': 0.11409046683958196, 'bull_tp_mult': 1.3536772135921673, 'bull_tsl_mult': 0.5104593489584524, 'bull_time_stop': 162, 'bull_use_sma': False, 'bull_use_ema': False, 'bull_use_atr': True, 'bull_use_adx': False, 'bull_use_spike': False, 'bull_rsi_required': False, 'bear_strategy': 'breakout', 'bear_bb_std_mult': 1.2731415210250383, 'bear_rsi_os': 28, 'bear_rsi_ob': 56, 'bear_adx_thresh': 31.99590005536393, 'bear_atr_min_pct': 0.0028987247609860633, 'bear_atr_max_pct': 0.06134674119404579, 'bear_tp_mult': 1.5592137628132867, 'bear_tsl_mult': 0.7694414346655886, 'bear_time_stop': 289, 'bear_use_sma': True, 'bear_use_ema': False, 'bear_use_atr': True, 'bear_use_adx': True, 'bear_use_spike': False, 'bear_rsi_required': True, 'sideways_strategy': 'breakout', 'sideways_bb_std_mult': 2.154589192919411, 'sideways_rsi_os': 39, 'sideways_rsi_ob': 75, 'sideways_adx_thresh': 32.80261166245537, 'sideways_atr_min_pct': 0.01232565504566332, 'sideways_atr_max_pct': 0.13027817174339956, 'sideways_tp_mult': 2.909884911004596, 'sideways_tsl_mult': 0.5983597903912159, 'sideways_time_stop': 5, 'sideways_use_sma': False, 'sideways_use_ema': False, 'sideways_use_atr': True, 'sideways_use_adx': True, 'sideways_use_spike': True, 'sideways_rsi_required': False}.
[I 2025-09-01 12:03:55,890] Trial 511 finished with values: [-1000000000.0, 1000000000.0] and parameters: {'p_sma': 25, 'p_std': 5, 'p_atr': 17, 'p_adx': 8, 'rsi_period': 61, 'ema1': 25, 'ema2': 15, 'slip_atr_k': 0.19366095225743302, 'slip_spread_k': 0.7143069299175739, 'spread_hl_frac': 0.021347460887933496, 'bb_std_mult': 1.167678537952759, 'rsi_os': 33, 'rsi_ob': 48, 'vol_spike': 0.20031930626586394, 'adx_thresh': 26.929521702920574, 'atr_min_pct': 0.02452348710453356, 'atr_max_pct': 0.07917564087537501, 'tp_mult': 2.183335452136722, 'tsl_mult': 0.3148122511536513, 'strategy': 'breakout', 'time_stop': 188, 'use_sma': False, 'use_atr': True, 'use_adx': True, 'use_ema': True, 'use_spike': False, 'rsi_required': False, 'edge_k': 0.14472354432392387, 'edge_cap': 0.9340926727911181, 'bull_strategy': 'mean_reversion', 'bull_bb_std_mult': 1.691658095352182, 'bull_rsi_os': 16, 'bull_rsi_ob': 48, 'bull_adx_thresh': 12.084274227097566, 'bull_atr_min_pct': 0.02642486337210382, 'bull_atr_max_pct': 0.1149183909707089, 'bull_tp_mult': 1.2308311007238846, 'bull_tsl_mult': 0.5738523202227833, 'bull_time_stop': 171, 'bull_use_sma': False, 'bull_use_ema': False, 'bull_use_atr': False, 'bull_use_adx': False, 'bull_use_spike': False, 'bull_rsi_required': True, 'bear_strategy': 'breakout', 'bear_bb_std_mult': 1.4943129576611236, 'bear_rsi_os': 28, 'bear_rsi_ob': 51, 'bear_adx_thresh': 8.48956698541792, 'bear_atr_min_pct': 0.003944015446907607, 'bear_atr_max_pct': 0.0990413403060976, 'bear_tp_mult': 1.5600528253393726, 'bear_tsl_mult': 0.792008780256638, 'bear_time_stop': 261, 'bear_use_sma': True, 'bear_use_ema': False, 'bear_use_atr': True, 'bear_use_adx': True, 'bear_use_spike': False, 'bear_rsi_required': True, 'sideways_strategy': 'breakout', 'sideways_bb_std_mult': 2.2395883843403066, 'sideways_rsi_os': 39, 'sideways_rsi_ob': 71, 'sideways_adx_thresh': 32.57550976276313, 'sideways_atr_min_pct': 0.009075459105693514, 'sideways_atr_max_pct': 0.12978301886662758, 'sideways_tp_mult': 2.9137283146284165, 'sideways_tsl_mult': 0.7304656205501451, 'sideways_time_stop': 86, 'sideways_use_sma': False, 'sideways_use_ema': False, 'sideways_use_atr': True, 'sideways_use_adx': True, 'sideways_use_spike': True, 'sideways_rsi_required': False}.
[I 2025-09-01 12:04:40,656] Trial 513 finished with values: [-1000000000.0, 1000000000.0] and parameters: {'p_sma': 22, 'p_std': 46, 'p_atr': 19, 'p_adx': 8, 'rsi_period': 10, 'ema1': 25, 'ema2': 13, 'slip_atr_k': 0.07375520389955204, 'slip_spread_k': 0.39783293230144445, 'spread_hl_frac': 0.004734213890063111, 'bb_std_mult': 0.9638013358372833, 'rsi_os': 37, 'rsi_ob': 46, 'vol_spike': 0.20338151771175825, 'adx_thresh': 22.069338719088314, 'atr_min_pct': 0.02304181388536936, 'atr_max_pct': 0.0794981023875057, 'tp_mult': 1.6620324588819497, 'tsl_mult': 0.10410673945135258, 'strategy': 'breakout', 'time_stop': 165, 'use_sma': False, 'use_atr': True, 'use_adx': True, 'use_ema': True, 'use_spike': False, 'rsi_required': False, 'edge_k': 0.13968494502580833, 'edge_cap': 0.14733660498718631, 'bull_strategy': 'mean_reversion', 'bull_bb_std_mult': 1.7310025994423657, 'bull_rsi_os': 50, 'bull_rsi_ob': 64, 'bull_adx_thresh': 18.82151676512585, 'bull_atr_min_pct': 0.01718087949483912, 'bull_atr_max_pct': 0.1115096510946252, 'bull_tp_mult': 1.2205689220784708, 'bull_tsl_mult': 0.6081506395308462, 'bull_time_stop': 159, 'bull_use_sma': False, 'bull_use_ema': False, 'bull_use_atr': False, 'bull_use_adx': False, 'bull_use_spike': False, 'bull_rsi_required': True, 'bear_strategy': 'mean_reversion', 'bear_bb_std_mult': 1.4962591452653728, 'bear_rsi_os': 29, 'bear_rsi_ob': 51, 'bear_adx_thresh': 30.524974101551926, 'bear_atr_min_pct': 0.011418651305069461, 'bear_atr_max_pct': 0.11827103546429746, 'bear_tp_mult': 2.3311446221418124, 'bear_tsl_mult': 0.709113467545025, 'bear_time_stop': 268, 'bear_use_sma': True, 'bear_use_ema': False, 'bear_use_atr': True, 'bear_use_adx': True, 'bear_use_spike': False, 'bear_rsi_required': True, 'sideways_strategy': 'breakout', 'sideways_bb_std_mult': 2.262153047191915, 'sideways_rsi_os': 49, 'sideways_rsi_ob': 63, 'sideways_adx_thresh': 34.06714888029184, 'sideways_atr_min_pct': 0.009011655314578357, 'sideways_atr_max_pct': 0.12865587868528156, 'sideways_tp_mult': 2.374665720505077, 'sideways_tsl_mult': 0.6629332298570821, 'sideways_time_stop': 92, 'sideways_use_sma': False, 'sideways_use_ema': False, 'sideways_use_atr': True, 'sideways_use_adx': True, 'sideways_use_spike': True, 'sideways_rsi_required': False}.
