[I 2025-09-01 12:13:16,291] Trial 570 finished with values: [-1000000000.0, 1000000000.0] and parameters: {'p_sma': 25, 'p_std': 43, 'p_atr': 11, 'p_adx': 8, 'rsi_period': 39, 'ema1': 27, 'ema2': 31, 'slip_atr_k': 0.18894157071679385, 'slip_spread_k': 0.7976555981946365, 'spread_hl_frac': 0.04292346170042446, 'bb_std_mult': 2.345957895290334, 'rsi_os': 53, 'rsi_ob': 59, 'vol_spike': 0.1939660117361787, 'adx_thresh': 23.453149796640577, 'atr_min_pct': 0.025091427738441186, 'atr_max_pct': 0.08434979525104007, 'tp_mult': 2.190165039429896, 'tsl_mult': 0.6870027050038312, 'strategy': 'mean_reversion', 'time_stop': 170, 'use_sma': False, 'use_atr': True, 'use_adx': True, 'use_ema': False, 'use_spike': False, 'rsi_required': False, 'edge_k': 1.762903244129828, 'edge_cap': 0.09878293023661776, 'bull_strategy': 'mean_reversion', 'bull_bb_std_mult': 1.583493107969407, 'bull_rsi_os': 51, 'bull_rsi_ob': 65, 'bull_adx_thresh': 20.964285769454392, 'bull_atr_min_pct': 0.015414012212509732, 'bull_atr_max_pct': 0.010059716344886838, 'bull_tp_mult': 1.4739077331118424, 'bull_tsl_mult': 0.5691546684119209, 'bull_time_stop': 161, 'bull_use_sma': False, 'bull_use_ema': False, 'bull_use_atr': True, 'bull_use_adx': False, 'bull_use_spike': False, 'bull_rsi_required': True, 'bear_strategy': 'mean_reversion', 'bear_bb_std_mult': 1.9993401256987173, 'bear_rsi_os': 28, 'bear_rsi_ob': 64, 'bear_adx_thresh': 20.063085517489515, 'bear_atr_min_pct': 0.026420995124545283, 'bear_atr_max_pct': 0.06530543128094579, 'bear_tp_mult': 2.1028498741923958, 'bear_tsl_mult': 0.6974066304821105, 'bear_time_stop': 283, 'bear_use_sma': True, 'bear_use_ema': False, 'bear_use_atr': True, 'bear_use_adx': True, 'bear_use_spike': False, 'bear_rsi_required': True, 'sideways_strategy': 'breakout', 'sideways_bb_std_mult': 1.1892968872904979, 'sideways_rsi_os': 38, 'sideways_rsi_ob': 59, 'sideways_adx_thresh': 31.54831835300677, 'sideways_atr_min_pct': 0.009231654843611081, 'sideways_atr_max_pct': 0.11986878182062667, 'sideways_tp_mult': 2.8451330555323575, 'sideways_tsl_mult': 0.2756559391563401, 'sideways_time_stop': 87, 'sideways_use_sma': False, 'sideways_use_ema': False, 'sideways_use_atr': True, 'sideways_use_adx': True, 'sideways_use_spike': True, 'sideways_rsi_required': False}.
[I 2025-09-01 12:13:56,678] Trial 569 finished with values: [-1000000000.0, 1000000000.0] and parameters: {'p_sma': 25, 'p_std': 31, 'p_atr': 19, 'p_adx': 8, 'rsi_period': 48, 'ema1': 5, 'ema2': 50, 'slip_atr_k': 0.057736445603798606, 'slip_spread_k': 0.32497287389753965, 'spread_hl_frac': 0.0032186895455486295, 'bb_std_mult': 1.0150743461537013, 'rsi_os': 13, 'rsi_ob': 59, 'vol_spike': 0.19443464885059247, 'adx_thresh': 18.9459335821563, 'atr_min_pct': 0.02494946676035722, 'atr_max_pct': 0.05251043690652682, 'tp_mult': 1.9953181277987648, 'tsl_mult': 0.15818446237363218, 'strategy': 'mean_reversion', 'time_stop': 168, 'use_sma': False, 'use_atr': True, 'use_adx': True, 'use_ema': True, 'use_spike': False, 'rsi_required': False, 'edge_k': 0.7139493610136978, 'edge_cap': 0.14026145688569125, 'bull_strategy': 'mean_reversion', 'bull_bb_std_mult': 3.2703818416479997, 'bull_rsi_os': 51, 'bull_rsi_ob': 47, 'bull_adx_thresh': 5.467159261101782, 'bull_atr_min_pct': 0.028500086596456066, 'bull_atr_max_pct': 0.10604241645195321, 'bull_tp_mult': 1.4181699462591966, 'bull_tsl_mult': 0.6846075349431098, 'bull_time_stop': 42, 'bull_use_sma': False, 'bull_use_ema': False, 'bull_use_atr': True, 'bull_use_adx': False, 'bull_use_spike': False, 'bull_rsi_required': False, 'bear_strategy': 'breakout', 'bear_bb_std_mult': 1.480756908265566, 'bear_rsi_os': 28, 'bear_rsi_ob': 64, 'bear_adx_thresh': 9.068279254269035, 'bear_atr_min_pct': 0.007200405427054738, 'bear_atr_max_pct': 0.10496344275491652, 'bear_tp_mult': 1.4503090222297297, 'bear_tsl_mult': 0.5229623549474932, 'bear_time_stop': 174, 'bear_use_sma': True, 'bear_use_ema': False, 'bear_use_atr': True, 'bear_use_adx': True, 'bear_use_spike': False, 'bear_rsi_required': True, 'sideways_strategy': 'breakout', 'sideways_bb_std_mult': 2.5475528523279767, 'sideways_rsi_os': 40, 'sideways_rsi_ob': 90, 'sideways_adx_thresh': 31.59426582534489, 'sideways_atr_min_pct': 0.006429098553997301, 'sideways_atr_max_pct': 0.12201355441732016, 'sideways_tp_mult': 2.860063825570508, 'sideways_tsl_mult': 0.6990620477931557, 'sideways_time_stop': 95, 'sideways_use_sma': False, 'sideways_use_ema': False, 'sideways_use_atr': True, 'sideways_use_adx': True, 'sideways_use_spike': True, 'sideways_rsi_required': False}.
[I 2025-09-01 12:13:57,537] Trial 567 finished with values: [-1000000000.0, 1000000000.0] and parameters: {'p_sma': 43, 'p_std': 36, 'p_atr': 19, 'p_adx': 22, 'rsi_period': 31, 'ema1': 27, 'ema2': 13, 'slip_atr_k': 0.22511747627549122, 'slip_spread_k': 0.3697256531204216, 'spread_hl_frac': 0.02016864591305183, 'bb_std_mult': 0.9287414210282092, 'rsi_os': 34, 'rsi_ob': 45, 'vol_spike': 0.19544436454858138, 'adx_thresh': 22.118353465839345, 'atr_min_pct': 0.01811354926306174, 'atr_max_pct': 0.057865330178979414, 'tp_mult': 1.9842583167604502, 'tsl_mult': 0.09585128323425027, 'strategy': 'breakout', 'time_stop': 54, 'use_sma': False, 'use_atr': True, 'use_adx': True, 'use_ema': True, 'use_spike': False, 'rsi_required': False, 'edge_k': 1.7646531194714723, 'edge_cap': 0.18132017337346232, 'bull_strategy': 'mean_reversion', 'bull_bb_std_mult': 1.6527855410800685, 'bull_rsi_os': 51, 'bull_rsi_ob': 49, 'bull_adx_thresh': 5.017413327042015, 'bull_atr_min_pct': 0.015400958767530181, 'bull_atr_max_pct': 0.06467770959343865, 'bull_tp_mult': 1.419316976560629, 'bull_tsl_mult': 0.401461471436629, 'bull_time_stop': 161, 'bull_use_sma': False, 'bull_use_ema': False, 'bull_use_atr': True, 'bull_use_adx': False, 'bull_use_spike': False, 'bull_rsi_required': False, 'bear_strategy': 'breakout', 'bear_bb_std_mult': 2.4570792748540735, 'bear_rsi_os': 49, 'bear_rsi_ob': 51, 'bear_adx_thresh': 9.007208791394381, 'bear_atr_min_pct': 0.027164444641594863, 'bear_atr_max_pct': 0.11114573390243837, 'bear_tp_mult': 2.1327385968877524, 'bear_tsl_mult': 0.7585421363046613, 'bear_time_stop': 246, 'bear_use_sma': True, 'bear_use_ema': False, 'bear_use_atr': True, 'bear_use_adx': True, 'bear_use_spike': False, 'bear_rsi_required': True, 'sideways_strategy': 'breakout', 'sideways_bb_std_mult': 0.9282010769296933, 'sideways_rsi_os': 40, 'sideways_rsi_ob': 59, 'sideways_adx_thresh': 32.679944797526495, 'sideways_atr_min_pct': 0.006383074355762461, 'sideways_atr_max_pct': 0.12277158566364339, 'sideways_tp_mult': 2.7997094371650415, 'sideways_tsl_mult': 0.2789811935638453, 'sideways_time_stop': 97, 'sideways_use_sma': False, 'sideways_use_ema': False, 'sideways_use_atr': True, 'sideways_use_adx': True, 'sideways_use_spike': True, 'sideways_rsi_required': False}.
[I 2025-09-01 12:13:57,850] Trial 568 finished with values: [-1000000000.0, 1000000000.0] and parameters: {'p_sma': 25, 'p_std': 43, 'p_atr': 27, 'p_adx': 12, 'rsi_period': 48, 'ema1': 29, 'ema2': 31, 'slip_atr_k': 0.18889151695166553, 'slip_spread_k': 0.32641659641166715, 'spread_hl_frac': 0.020115922657285592, 'bb_std_mult': 1.0377142955422083, 'rsi_os': 13, 'rsi_ob': 66, 'vol_spike': 0.19553479768207682, 'adx_thresh': 23.282040218912744, 'atr_min_pct': 0.0013415067381991764, 'atr_max_pct': 0.05449777263602554, 'tp_mult': 2.001913564054828, 'tsl_mult': 0.14773371415339648, 'strategy': 'breakout', 'time_stop': 216, 'use_sma': False, 'use_atr': True, 'use_adx': True, 'use_ema': True, 'use_spike': False, 'rsi_required': False, 'edge_k': 1.7491752064257842, 'edge_cap': 0.10113885421036894, 'bull_strategy': 'mean_reversion', 'bull_bb_std_mult': 1.749296903010676, 'bull_rsi_os': 51, 'bull_rsi_ob': 45, 'bull_adx_thresh': 5.432529460574518, 'bull_atr_min_pct': 0.015284425482983411, 'bull_atr_max_pct': 0.10673490331230041, 'bull_tp_mult': 1.4272427776269576, 'bull_tsl_mult': 0.5925536700164452, 'bull_time_stop': 5, 'bull_use_sma': False, 'bull_use_ema': False, 'bull_use_atr': True, 'bull_use_adx': False, 'bull_use_spike': False, 'bull_rsi_required': False, 'bear_strategy': 'breakout', 'bear_bb_std_mult': 1.4691784189954216, 'bear_rsi_os': 29, 'bear_rsi_ob': 63, 'bear_adx_thresh': 9.044047087624481, 'bear_atr_min_pct': 0.021963700416158013, 'bear_atr_max_pct': 0.06393491054673484, 'bear_tp_mult': 2.0553880995414593, 'bear_tsl_mult': 0.6686700396389192, 'bear_time_stop': 171, 'bear_use_sma': True, 'bear_use_ema': False, 'bear_use_atr': True, 'bear_use_adx': True, 'bear_use_spike': False, 'bear_rsi_required': True, 'sideways_strategy': 'breakout', 'sideways_bb_std_mult': 2.5248521189666366, 'sideways_rsi_os': 52, 'sideways_rsi_ob': 59, 'sideways_adx_thresh': 31.587961686378794, 'sideways_atr_min_pct': 0.009477254831872122, 'sideways_atr_max_pct': 0.1217683206404959, 'sideways_tp_mult': 2.7910580253999497, 'sideways_tsl_mult': 0.2802091172301552, 'sideways_time_stop': 94, 'sideways_use_sma': False, 'sideways_use_ema': False, 'sideways_use_atr': True, 'sideways_use_adx': True, 'sideways_use_spike': True, 'sideways_rsi_required': False}.
[I 2025-09-01 12:13:59,252] Trial 571 finished with values: [-1000000000.0, 1000000000.0] and parameters: {'p_sma': 43, 'p_std': 36, 'p_atr': 19, 'p_adx': 19, 'rsi_period': 72, 'ema1': 24, 'ema2': 50, 'slip_atr_k': 0.028114467021867703, 'slip_spread_k': 0.9203140422021467, 'spread_hl_frac': 0.0033824629210976328, 'bb_std_mult': 1.719067355653452, 'rsi_os': 12, 'rsi_ob': 67, 'vol_spike': 0.04497783304969066, 'adx_thresh': 30.012762760482126, 'atr_min_pct': 0.0019922321579987218, 'atr_max_pct': 0.06873763972469948, 'tp_mult': 1.118693304129823, 'tsl_mult': 0.1552064138198268, 'strategy': 'breakout', 'time_stop': 53, 'use_sma': False, 'use_atr': True, 'use_adx': True, 'use_ema': True, 'use_spike': False, 'rsi_required': False, 'edge_k': 1.661334350911948, 'edge_cap': 0.1360607040473799, 'bull_strategy': 'mean_reversion', 'bull_bb_std_mult': 1.7711248371141768, 'bull_rsi_os': 50, 'bull_rsi_ob': 49, 'bull_adx_thresh': 32.218846321284374, 'bull_atr_min_pct': 0.01269778336760166, 'bull_atr_max_pct': 0.12744556426300374, 'bull_tp_mult': 1.4094209805023947, 'bull_tsl_mult': 0.6771823828577311, 'bull_time_stop': 166, 'bull_use_sma': False, 'bull_use_ema': False, 'bull_use_atr': False, 'bull_use_adx': False, 'bull_use_spike': False, 'bull_rsi_required': False, 'bear_strategy': 'breakout', 'bear_bb_std_mult': 1.4231200509882735, 'bear_rsi_os': 26, 'bear_rsi_ob': 62, 'bear_adx_thresh': 8.942928464204194, 'bear_atr_min_pct': 0.004207725417448456, 'bear_atr_max_pct': 0.02368104269929134, 'bear_tp_mult': 2.049768363782941, 'bear_tsl_mult': 0.6716023375621059, 'bear_time_stop': 274, 'bear_use_sma': True, 'bear_use_ema': False, 'bear_use_atr': True, 'bear_use_adx': True, 'bear_use_spike': False, 'bear_rsi_required': True, 'sideways_strategy': 'breakout', 'sideways_bb_std_mult': 1.0408400545689982, 'sideways_rsi_os': 32, 'sideways_rsi_ob': 90, 'sideways_adx_thresh': 33.86904678233842, 'sideways_atr_min_pct': 0.004828519828518974, 'sideways_atr_max_pct': 0.14592955817755338, 'sideways_tp_mult': 2.804434300857676, 'sideways_tsl_mult': 0.22319869212886573, 'sideways_time_stop': 20, 'sideways_use_sma': False, 'sideways_use_ema': False, 'sideways_use_atr': True, 'sideways_use_adx': True, 'sideways_use_spike': True, 'sideways_rsi_required': False}.
[I 2025-09-01 12:14:41,601] Trial 572 finished with values: [-1000000000.0, 1000000000.0] and parameters: {'p_sma': 29, 'p_std': 33, 'p_atr': 19, 'p_adx': 13, 'rsi_period': 72, 'ema1': 24, 'ema2': 13, 'slip_atr_k': 0.02916703152620944, 'slip_spread_k': 0.3904677531853253, 'spread_hl_frac': 0.0035474670139408002, 'bb_std_mult': 1.1424060745416327, 'rsi_os': 35, 'rsi_ob': 49, 'vol_spike': 0.21167178710373138, 'adx_thresh': 22.792566907271556, 'atr_min_pct': 0.012357736898661969, 'atr_max_pct': 0.07973282893217919, 'tp_mult': 2.1081164454302925, 'tsl_mult': 0.11515730677812593, 'strategy': 'breakout', 'time_stop': 177, 'use_sma': True, 'use_atr': True, 'use_adx': True, 'use_ema': True, 'use_spike': False, 'rsi_required': False, 'edge_k': 1.540824736008147, 'edge_cap': 0.10857591177034738, 'bull_strategy': 'mean_reversion', 'bull_bb_std_mult': 1.7742361291636228, 'bull_rsi_os': 49, 'bull_rsi_ob': 45, 'bull_adx_thresh': 18.223422228719233, 'bull_atr_min_pct': 0.014640133371940757, 'bull_atr_max_pct': 0.11725828932416911, 'bull_tp_mult': 1.2642238707018822, 'bull_tsl_mult': 0.40588978879162174, 'bull_time_stop': 167, 'bull_use_sma': False, 'bull_use_ema': False, 'bull_use_atr': False, 'bull_use_adx': False, 'bull_use_spike': False, 'bull_rsi_required': False, 'bear_strategy': 'breakout', 'bear_bb_std_mult': 3.332684606538053, 'bear_rsi_os': 26, 'bear_rsi_ob': 60, 'bear_adx_thresh': 8.857678501357118, 'bear_atr_min_pct': 0.0273310111006251, 'bear_atr_max_pct': 0.02410077026911659, 'bear_tp_mult': 1.5013890129926235, 'bear_tsl_mult': 0.6685041714870346, 'bear_time_stop': 273, 'bear_use_sma': True, 'bear_use_ema': False, 'bear_use_atr': True, 'bear_use_adx': True, 'bear_use_spike': False, 'bear_rsi_required': True, 'sideways_strategy': 'breakout', 'sideways_bb_std_mult': 2.8679037737566024, 'sideways_rsi_os': 43, 'sideways_rsi_ob': 86, 'sideways_adx_thresh': 34.053245739408915, 'sideways_atr_min_pct': 0.027951119338867597, 'sideways_atr_max_pct': 0.13094080307638475, 'sideways_tp_mult': 2.81323084446723, 'sideways_tsl_mult': 0.8321802798980427, 'sideways_time_stop': 97, 'sideways_use_sma': False, 'sideways_use_ema': False, 'sideways_use_atr': True, 'sideways_use_adx': True, 'sideways_use_spike': True, 'sideways_rsi_required': False}.
[I 2025-09-01 12:14:42,116] Trial 574 finished with values: [-0.033049711716901964, 0.032978785659018815] and parameters: {'p_sma': 22, 'p_std': 33, 'p_atr': 19, 'p_adx': 27, 'rsi_period': 46, 'ema1': 24, 'ema2': 16, 'slip_atr_k': 0.15843943733090307, 'slip_spread_k': 0.38879036958693236, 'spread_hl_frac': 0.0034810141378174182, 'bb_std_mult': 0.8373366963642043, 'rsi_os': 35, 'rsi_ob': 49, 'vol_spike': 0.21193789021145082, 'adx_thresh': 22.89074000232556, 'atr_min_pct': 0.002218845523236172, 'atr_max_pct': 0.07923252975101677, 'tp_mult': 2.9053827603143265, 'tsl_mult': 0.3713161717521454, 'strategy': 'breakout', 'time_stop': 300, 'use_sma': True, 'use_atr': True, 'use_adx': True, 'use_ema': False, 'use_spike': False, 'rsi_required': False, 'edge_k': 0.055539287719487365, 'edge_cap': 0.1153479085217458, 'bull_strategy': 'mean_reversion', 'bull_bb_std_mult': 1.7779389265919383, 'bull_rsi_os': 48, 'bull_rsi_ob': 49, 'bull_adx_thresh': 23.097816923232603, 'bull_atr_min_pct': 0.014642353086716547, 'bull_atr_max_pct': 0.03180639196625297, 'bull_tp_mult': 1.2394809577670653, 'bull_tsl_mult': 0.5208424096376973, 'bull_time_stop': 65, 'bull_use_sma': False, 'bull_use_ema': False, 'bull_use_atr': False, 'bull_use_adx': False, 'bull_use_spike': False, 'bull_rsi_required': True, 'bear_strategy': 'mean_reversion', 'bear_bb_std_mult': 1.2211394542345526, 'bear_rsi_os': 53, 'bear_rsi_ob': 84, 'bear_adx_thresh': 8.307348904607947, 'bear_atr_min_pct': 0.004084036873978739, 'bear_atr_max_pct': 0.02249925417011664, 'bear_tp_mult': 1.4945577367134493, 'bear_tsl_mult': 0.7323870680771168, 'bear_time_stop': 274, 'bear_use_sma': False, 'bear_use_ema': False, 'bear_use_atr': True, 'bear_use_adx': True, 'bear_use_spike': False, 'bear_rsi_required': True, 'sideways_strategy': 'breakout', 'sideways_bb_std_mult': 3.194397752340243, 'sideways_rsi_os': 9, 'sideways_rsi_ob': 65, 'sideways_adx_thresh': 34.92570014395556, 'sideways_atr_min_pct': 0.0074521841764313, 'sideways_atr_max_pct': 0.13166600919919072, 'sideways_tp_mult': 2.9234425132184545, 'sideways_tsl_mult': 0.3309623322549048, 'sideways_time_stop': 16, 'sideways_use_sma': False, 'sideways_use_ema': False, 'sideways_use_atr': True, 'sideways_use_adx': True, 'sideways_use_spike': True, 'sideways_rsi_required': False}.
[I 2025-09-01 12:14:42,509] Trial 573 finished with values: [-1000000000.0, 1000000000.0] and parameters: {'p_sma': 5, 'p_std': 36, 'p_atr': 19, 'p_adx': 13, 'rsi_period': 36, 'ema1': 24, 'ema2': 16, 'slip_atr_k': 0.15713931653886448, 'slip_spread_k': 0.9242506904052945, 'spread_hl_frac': 0.003495701124513027, 'bb_std_mult': 0.8417212880742341, 'rsi_os': 35, 'rsi_ob': 49, 'vol_spike': 0.04549370208913775, 'adx_thresh': 23.125477322877437, 'atr_min_pct': 0.024122486461440253, 'atr_max_pct': 0.0738636325391825, 'tp_mult': 2.1088357095820114, 'tsl_mult': 0.15063907909965765, 'strategy': 'breakout', 'time_stop': 217, 'use_sma': True, 'use_atr': True, 'use_adx': True, 'use_ema': True, 'use_spike': False, 'rsi_required': False, 'edge_k': 1.9970541886534219, 'edge_cap': 0.10519461185703165, 'bull_strategy': 'mean_reversion', 'bull_bb_std_mult': 1.7811494895034035, 'bull_rsi_os': 50, 'bull_rsi_ob': 74, 'bull_adx_thresh': 17.967476007293108, 'bull_atr_min_pct': 0.026692127491735544, 'bull_atr_max_pct': 0.04054665029346204, 'bull_tp_mult': 1.262180577498913, 'bull_tsl_mult': 0.5984486488835725, 'bull_time_stop': 177, 'bull_use_sma': False, 'bull_use_ema': False, 'bull_use_atr': False, 'bull_use_adx': False, 'bull_use_spike': False, 'bull_rsi_required': False, 'bear_strategy': 'mean_reversion', 'bear_bb_std_mult': 3.036735434531068, 'bear_rsi_os': 26, 'bear_rsi_ob': 50, 'bear_adx_thresh': 8.336247992010549, 'bear_atr_min_pct': 0.004048101751730482, 'bear_atr_max_pct': 0.02385790417220736, 'bear_tp_mult': 1.4834155539013307, 'bear_tsl_mult': 0.6734916995114336, 'bear_time_stop': 274, 'bear_use_sma': False, 'bear_use_ema': False, 'bear_use_atr': True, 'bear_use_adx': True, 'bear_use_spike': False, 'bear_rsi_required': True, 'sideways_strategy': 'breakout', 'sideways_bb_std_mult': 1.2756055910713053, 'sideways_rsi_os': 42, 'sideways_rsi_ob': 86, 'sideways_adx_thresh': 34.02154794106771, 'sideways_atr_min_pct': 0.004820057802311112, 'sideways_atr_max_pct': 0.12924507229141893, 'sideways_tp_mult': 2.9227224457208765, 'sideways_tsl_mult': 0.33591843473615407, 'sideways_time_stop': 17, 'sideways_use_sma': False, 'sideways_use_ema': False, 'sideways_use_atr': True, 'sideways_use_adx': True, 'sideways_use_spike': True, 'sideways_rsi_required': False}.
[I 2025-09-01 12:14:42,931] Trial 575 finished with values: [-1000000000.0, 1000000000.0] and parameters: {'p_sma': 5, 'p_std': 57, 'p_atr': 25, 'p_adx': 13, 'rsi_period': 7, 'ema1': 10, 'ema2': 16, 'slip_atr_k': 0.15820706161487352, 'slip_spread_k': 0.38832917328402533, 'spread_hl_frac': 0.040079347570663254, 'bb_std_mult': 0.8353311438673277, 'rsi_os': 41, 'rsi_ob': 49, 'vol_spike': 0.21383250552969635, 'adx_thresh': 9.027761945417556, 'atr_min_pct': 0.02409834227258741, 'atr_max_pct': 0.13982531445706103, 'tp_mult': 2.7645149176793806, 'tsl_mult': 0.19506007644136142, 'strategy': 'breakout', 'time_stop': 175, 'use_sma': True, 'use_atr': True, 'use_adx': True, 'use_ema': False, 'use_spike': False, 'rsi_required': False, 'edge_k': 0.06547877502130195, 'edge_cap': 0.11477541283001372, 'bull_strategy': 'mean_reversion', 'bull_bb_std_mult': 1.835455347912579, 'bull_rsi_os': 48, 'bull_rsi_ob': 50, 'bull_adx_thresh': 7.751807060792345, 'bull_atr_min_pct': 0.01446411612413462, 'bull_atr_max_pct': 0.03257962814317412, 'bull_tp_mult': 1.2338197195316234, 'bull_tsl_mult': 0.24122586417611563, 'bull_time_stop': 81, 'bull_use_sma': False, 'bull_use_ema': False, 'bull_use_atr': False, 'bull_use_adx': False, 'bull_use_spike': False, 'bull_rsi_required': True, 'bear_strategy': 'mean_reversion', 'bear_bb_std_mult': 1.2126108984603174, 'bear_rsi_os': 53, 'bear_rsi_ob': 83, 'bear_adx_thresh': 8.368613264490113, 'bear_atr_min_pct': 0.003487837885656454, 'bear_atr_max_pct': 0.02093464679777297, 'bear_tp_mult': 1.4959805652403313, 'bear_tsl_mult': 0.7269208493644537, 'bear_time_stop': 264, 'bear_use_sma': False, 'bear_use_ema': False, 'bear_use_atr': True, 'bear_use_adx': True, 'bear_use_spike': False, 'bear_rsi_required': True, 'sideways_strategy': 'breakout', 'sideways_bb_std_mult': 2.4237048204790477, 'sideways_rsi_os': 42, 'sideways_rsi_ob': 81, 'sideways_adx_thresh': 34.25993390214598, 'sideways_atr_min_pct': 0.0070151654078955145, 'sideways_atr_max_pct': 0.02229711341142468, 'sideways_tp_mult': 2.2370369578976748, 'sideways_tsl_mult': 0.32486370533470954, 'sideways_time_stop': 87, 'sideways_use_sma': False, 'sideways_use_ema': False, 'sideways_use_atr': True, 'sideways_use_adx': True, 'sideways_use_spike': True, 'sideways_rsi_required': False}.
