[I 2025-09-01 10:59:23,401] Trial 106 finished with values: [-1000000000.0, 1000000000.0] and parameters: {'p_sma': 6, 'p_std': 27, 'p_atr': 8, 'p_adx': 24, 'rsi_period': 42, 'ema1': 27, 'ema2': 12, 'slip_atr_k': 0.02766712905220621, 'slip_spread_k': 0.16694600515679117, 'spread_hl_frac': 0.0007200953147649229, 'bb_std_mult': 0.5112242946022534, 'rsi_os': 29, 'rsi_ob': 65, 'vol_spike': 0.12184984969492413, 'adx_thresh': 31.522707672724778, 'atr_min_pct': 0.020544147393594385, 'atr_max_pct': 0.06862163990973011, 'tp_mult': 1.8879200390907824, 'tsl_mult': 0.618558708367164, 'strategy': 'mean_reversion', 'time_stop': 251, 'use_sma': True, 'use_atr': True, 'use_adx': True, 'use_ema': True, 'use_spike': False, 'rsi_required': True, 'edge_k': 1.0402560331712187, 'edge_cap': 0.540806146922534, 'bull_strategy': 'breakout', 'bull_bb_std_mult': 1.8415211875792292, 'bull_rsi_os': 28, 'bull_rsi_ob': 80, 'bull_adx_thresh': 29.177547388993666, 'bull_atr_min_pct': 1.1149883777122568e-05, 'bull_atr_max_pct': 0.05071555787779945, 'bull_tp_mult': 1.6202024557612302, 'bull_tsl_mult': 0.8804732622382279, 'bull_time_stop': 12, 'bull_use_sma': False, 'bull_use_ema': False, 'bull_use_atr': False, 'bull_use_adx': False, 'bull_use_spike': True, 'bull_rsi_required': False, 'bear_strategy': 'breakout', 'bear_bb_std_mult': 0.971094624600843, 'bear_rsi_os': 42, 'bear_rsi_ob': 66, 'bear_adx_thresh': 22.247480341668584, 'bear_atr_min_pct': 0.00037435250259342835, 'bear_atr_max_pct': 0.14790167807553647, 'bear_tp_mult': 2.2194939015550097, 'bear_tsl_mult': 0.16901761659837441, 'bear_time_stop': 213, 'bear_use_sma': False, 'bear_use_ema': False, 'bear_use_atr': True, 'bear_use_adx': False, 'bear_use_spike': True, 'bear_rsi_required': False, 'sideways_strategy': 'breakout', 'sideways_bb_std_mult': 3.4979833373667093, 'sideways_rsi_os': 21, 'sideways_rsi_ob': 87, 'sideways_adx_thresh': 18.0638477492529, 'sideways_atr_min_pct': 0.017211523522851283, 'sideways_atr_max_pct': 0.08504472235844657, 'sideways_tp_mult': 2.0992892839581128, 'sideways_tsl_mult': 0.06535385062871346, 'sideways_time_stop': 133, 'sideways_use_sma': False, 'sideways_use_ema': True, 'sideways_use_atr': False, 'sideways_use_adx': False, 'sideways_use_spike': False, 'sideways_rsi_required': True}.
[I 2025-09-01 10:59:23,657] Trial 107 finished with values: [-1000000000.0, 1000000000.0] and parameters: {'p_sma': 60, 'p_std': 27, 'p_atr': 7, 'p_adx': 24, 'rsi_period': 25, 'ema1': 27, 'ema2': 58, 'slip_atr_k': 0.026945625474507993, 'slip_spread_k': 0.16286839274535564, 'spread_hl_frac': 0.0036520969934866867, 'bb_std_mult': 0.5063319705466974, 'rsi_os': 26, 'rsi_ob': 65, 'vol_spike': 0.15468679651201647, 'adx_thresh': 5.014191040010542, 'atr_min_pct': 0.020869371195070333, 'atr_max_pct': 0.07072435785310102, 'tp_mult': 1.8820994125494792, 'tsl_mult': 0.5761259204217488, 'strategy': 'mean_reversion', 'time_stop': 246, 'use_sma': True, 'use_atr': False, 'use_adx': True, 'use_ema': True, 'use_spike': False, 'rsi_required': True, 'edge_k': 1.8699888069829278, 'edge_cap': 0.4698446116319457, 'bull_strategy': 'breakout', 'bull_bb_std_mult': 3.353216632844882, 'bull_rsi_os': 24, 'bull_rsi_ob': 78, 'bull_adx_thresh': 29.07699648355713, 'bull_atr_min_pct': 0.012275990224734088, 'bull_atr_max_pct': 0.10537505326461874, 'bull_tp_mult': 1.3382450019381307, 'bull_tsl_mult': 0.8837426191303769, 'bull_time_stop': 13, 'bull_use_sma': False, 'bull_use_ema': False, 'bull_use_atr': False, 'bull_use_adx': False, 'bull_use_spike': True, 'bull_rsi_required': True, 'bear_strategy': 'breakout', 'bear_bb_std_mult': 0.981541839733802, 'bear_rsi_os': 53, 'bear_rsi_ob': 65, 'bear_adx_thresh': 16.138202961743744, 'bear_atr_min_pct': 0.0035478480601369607, 'bear_atr_max_pct': 0.13029933190634302, 'bear_tp_mult': 2.229072554991419, 'bear_tsl_mult': 0.16072170945955158, 'bear_time_stop': 137, 'bear_use_sma': False, 'bear_use_ema': False, 'bear_use_atr': False, 'bear_use_adx': False, 'bear_use_spike': True, 'bear_rsi_required': False, 'sideways_strategy': 'breakout', 'sideways_bb_std_mult': 3.3171761871145193, 'sideways_rsi_os': 40, 'sideways_rsi_ob': 85, 'sideways_adx_thresh': 18.13049350581523, 'sideways_atr_min_pct': 0.01818075806563801, 'sideways_atr_max_pct': 0.10132974813212114, 'sideways_tp_mult': 2.103495264262635, 'sideways_tsl_mult': 0.06880322121044143, 'sideways_time_stop': 130, 'sideways_use_sma': False, 'sideways_use_ema': True, 'sideways_use_atr': False, 'sideways_use_adx': False, 'sideways_use_spike': False, 'sideways_rsi_required': True}.
[I 2025-09-01 10:59:24,065] Trial 113 finished with values: [-1000000000.0, 1000000000.0] and parameters: {'p_sma': 18, 'p_std': 59, 'p_atr': 12, 'p_adx': 25, 'rsi_period': 30, 'ema1': 15, 'ema2': 36, 'slip_atr_k': 0.058466117282536895, 'slip_spread_k': 0.3378540084183492, 'spread_hl_frac': 0.04174634005378688, 'bb_std_mult': 0.599995491605334, 'rsi_os': 18, 'rsi_ob': 60, 'vol_spike': 0.16998310881680323, 'adx_thresh': 5.919859171424175, 'atr_min_pct': 0.027823748983892276, 'atr_max_pct': 0.015262381000885075, 'tp_mult': 1.2577080743900009, 'tsl_mult': 0.5052861973400267, 'strategy': 'breakout', 'time_stop': 5, 'use_sma': False, 'use_atr': True, 'use_adx': True, 'use_ema': True, 'use_spike': False, 'rsi_required': True, 'edge_k': 1.9342538959836284, 'edge_cap': 0.4293967860566976, 'bull_strategy': 'mean_reversion', 'bull_bb_std_mult': 2.054849768677796, 'bull_rsi_os': 25, 'bull_rsi_ob': 82, 'bull_adx_thresh': 10.92706456248854, 'bull_atr_min_pct': 0.003348480302169398, 'bull_atr_max_pct': 0.06051738610884763, 'bull_tp_mult': 1.0558591590155686, 'bull_tsl_mult': 0.9234286485533975, 'bull_time_stop': 5, 'bull_use_sma': True, 'bull_use_ema': False, 'bull_use_atr': False, 'bull_use_adx': True, 'bull_use_spike': True, 'bull_rsi_required': False, 'bear_strategy': 'breakout', 'bear_bb_std_mult': 1.488087048231277, 'bear_rsi_os': 40, 'bear_rsi_ob': 85, 'bear_adx_thresh': 20.622004634283552, 'bear_atr_min_pct': 0.01869134823753263, 'bear_atr_max_pct': 0.14162452323648958, 'bear_tp_mult': 1.981400932392387, 'bear_tsl_mult': 0.8573890667390002, 'bear_time_stop': 222, 'bear_use_sma': True, 'bear_use_ema': True, 'bear_use_atr': True, 'bear_use_adx': False, 'bear_use_spike': True, 'bear_rsi_required': False, 'sideways_strategy': 'breakout', 'sideways_bb_std_mult': 3.4059119035065324, 'sideways_rsi_os': 15, 'sideways_rsi_ob': 46, 'sideways_adx_thresh': 24.87301857150128, 'sideways_atr_min_pct': 0.021250583865214834, 'sideways_atr_max_pct': 0.07790483820420052, 'sideways_tp_mult': 2.0372313146946244, 'sideways_tsl_mult': 0.10802285798127642, 'sideways_time_stop': 167, 'sideways_use_sma': False, 'sideways_use_ema': False, 'sideways_use_atr': False, 'sideways_use_adx': False, 'sideways_use_spike': False, 'sideways_rsi_required': True}.
[I 2025-09-01 11:00:01,080] Trial 112 finished with values: [-0.012767444956658824, 0.0135227617659942] and parameters: {'p_sma': 60, 'p_std': 59, 'p_atr': 7, 'p_adx': 28, 'rsi_period': 30, 'ema1': 15, 'ema2': 37, 'slip_atr_k': 0.058848085655121174, 'slip_spread_k': 0.3368171632268771, 'spread_hl_frac': 0.0016770324750123079, 'bb_std_mult': 0.6079998753058337, 'rsi_os': 18, 'rsi_ob': 60, 'vol_spike': 0.1703901028446671, 'adx_thresh': 5.875958373336935, 'atr_min_pct': 0.023518648538844132, 'atr_max_pct': 0.08122857484849093, 'tp_mult': 1.617477580556632, 'tsl_mult': 0.33421426844011887, 'strategy': 'breakout', 'time_stop': 242, 'use_sma': False, 'use_atr': False, 'use_adx': True, 'use_ema': True, 'use_spike': False, 'rsi_required': True, 'edge_k': 1.9924167949147926, 'edge_cap': 0.14471688235605695, 'bull_strategy': 'mean_reversion', 'bull_bb_std_mult': 3.4830640876673415, 'bull_rsi_os': 23, 'bull_rsi_ob': 78, 'bull_adx_thresh': 14.371339657151456, 'bull_atr_min_pct': 0.0019642410950611545, 'bull_atr_max_pct': 0.018131484997224626, 'bull_tp_mult': 1.064951836462721, 'bull_tsl_mult': 0.22763003676204824, 'bull_time_stop': 30, 'bull_use_sma': False, 'bull_use_ema': False, 'bull_use_atr': False, 'bull_use_adx': True, 'bull_use_spike': True, 'bull_rsi_required': True, 'bear_strategy': 'breakout', 'bear_bb_std_mult': 1.4976284837577178, 'bear_rsi_os': 55, 'bear_rsi_ob': 85, 'bear_adx_thresh': 23.29819863314745, 'bear_atr_min_pct': 0.018720105882257067, 'bear_atr_max_pct': 0.1421941660135297, 'bear_tp_mult': 1.9788059317530773, 'bear_tsl_mult': 0.46677837262557625, 'bear_time_stop': 156, 'bear_use_sma': True, 'bear_use_ema': True, 'bear_use_atr': False, 'bear_use_adx': False, 'bear_use_spike': True, 'bear_rsi_required': False, 'sideways_strategy': 'breakout', 'sideways_bb_std_mult': 3.339627082949026, 'sideways_rsi_os': 15, 'sideways_rsi_ob': 94, 'sideways_adx_thresh': 19.228015096984326, 'sideways_atr_min_pct': 0.007670752132627474, 'sideways_atr_max_pct': 0.031795981719119314, 'sideways_tp_mult': 1.869934756730766, 'sideways_tsl_mult': 0.11426441591893176, 'sideways_time_stop': 128, 'sideways_use_sma': False, 'sideways_use_ema': False, 'sideways_use_atr': False, 'sideways_use_adx': False, 'sideways_use_spike': False, 'sideways_rsi_required': True}.
[I 2025-09-01 11:00:01,322] Trial 111 finished with values: [-1000000000.0, 1000000000.0] and parameters: {'p_sma': 7, 'p_std': 60, 'p_atr': 16, 'p_adx': 25, 'rsi_period': 48, 'ema1': 15, 'ema2': 36, 'slip_atr_k': 0.058714541736945666, 'slip_spread_k': 0.33404099391217745, 'spread_hl_frac': 0.0007491793559835759, 'bb_std_mult': 0.6065427853590064, 'rsi_os': 49, 'rsi_ob': 60, 'vol_spike': 0.17173569362759467, 'adx_thresh': 5.914651353249616, 'atr_min_pct': 0.027739567345781653, 'atr_max_pct': 0.13156084035621998, 'tp_mult': 1.6259363870825922, 'tsl_mult': 0.8337356615846518, 'strategy': 'breakout', 'time_stop': 259, 'use_sma': False, 'use_atr': False, 'use_adx': True, 'use_ema': True, 'use_spike': False, 'rsi_required': True, 'edge_k': 1.9339482558016785, 'edge_cap': 0.4293530455803976, 'bull_strategy': 'breakout', 'bull_bb_std_mult': 2.069924309685998, 'bull_rsi_os': 28, 'bull_rsi_ob': 78, 'bull_adx_thresh': 11.100656340006084, 'bull_atr_min_pct': 6.742105712392464e-05, 'bull_atr_max_pct': 0.01851850690399927, 'bull_tp_mult': 1.3640200503450401, 'bull_tsl_mult': 0.22649278580454751, 'bull_time_stop': 201, 'bull_use_sma': False, 'bull_use_ema': False, 'bull_use_atr': False, 'bull_use_adx': False, 'bull_use_spike': True, 'bull_rsi_required': True, 'bear_strategy': 'breakout', 'bear_bb_std_mult': 1.5010509318484777, 'bear_rsi_os': 53, 'bear_rsi_ob': 70, 'bear_adx_thresh': 23.3915686323798, 'bear_atr_min_pct': 0.0059674008465425595, 'bear_atr_max_pct': 0.14624401746744337, 'bear_tp_mult': 1.7278188131376844, 'bear_tsl_mult': 0.4491605026743573, 'bear_time_stop': 141, 'bear_use_sma': True, 'bear_use_ema': True, 'bear_use_atr': False, 'bear_use_adx': False, 'bear_use_spike': True, 'bear_rsi_required': False, 'sideways_strategy': 'breakout', 'sideways_bb_std_mult': 3.3232539451466003, 'sideways_rsi_os': 21, 'sideways_rsi_ob': 95, 'sideways_adx_thresh': 26.73079386879593, 'sideways_atr_min_pct': 0.018141998412289286, 'sideways_atr_max_pct': 0.11198538695320107, 'sideways_tp_mult': 2.0427687670933135, 'sideways_tsl_mult': 0.21464036019197255, 'sideways_time_stop': 135, 'sideways_use_sma': False, 'sideways_use_ema': False, 'sideways_use_atr': False, 'sideways_use_adx': False, 'sideways_use_spike': False, 'sideways_rsi_required': True}.
[I 2025-09-01 11:00:01,757] Trial 114 finished with values: [-1000000000.0, 1000000000.0] and parameters: {'p_sma': 7, 'p_std': 43, 'p_atr': 7, 'p_adx': 17, 'rsi_period': 11, 'ema1': 17, 'ema2': 56, 'slip_atr_k': 0.011983465784900463, 'slip_spread_k': 0.031442459044071, 'spread_hl_frac': 0.038297896042067375, 'bb_std_mult': 0.5886890635915137, 'rsi_os': 24, 'rsi_ob': 62, 'vol_spike': 0.09539999410479506, 'adx_thresh': 34.135706135365595, 'atr_min_pct': 0.01724042828412977, 'atr_max_pct': 0.13259901933655385, 'tp_mult': 1.6012077837974183, 'tsl_mult': 0.7105381841245766, 'strategy': 'mean_reversion', 'time_stop': 240, 'use_sma': True, 'use_atr': True, 'use_adx': True, 'use_ema': True, 'use_spike': False, 'rsi_required': True, 'edge_k': 1.9963916251741414, 'edge_cap': 0.5831374855330564, 'bull_strategy': 'breakout', 'bull_bb_std_mult': 3.5120614168186766, 'bull_rsi_os': 26, 'bull_rsi_ob': 78, 'bull_adx_thresh': 6.983887066418971, 'bull_atr_min_pct': 0.0020669350300423625, 'bull_atr_max_pct': 0.044254232892987036, 'bull_tp_mult': 1.0980967960556556, 'bull_tsl_mult': 0.23603194172496045, 'bull_time_stop': 44, 'bull_use_sma': False, 'bull_use_ema': False, 'bull_use_atr': False, 'bull_use_adx': True, 'bull_use_spike': True, 'bull_rsi_required': False, 'bear_strategy': 'breakout', 'bear_bb_std_mult': 1.3146247988437838, 'bear_rsi_os': 45, 'bear_rsi_ob': 83, 'bear_adx_thresh': 21.172532379273875, 'bear_atr_min_pct': 0.019740066723714183, 'bear_atr_max_pct': 0.01767149607680065, 'bear_tp_mult': 1.7220933878350575, 'bear_tsl_mult': 0.729008030514295, 'bear_time_stop': 120, 'bear_use_sma': False, 'bear_use_ema': False, 'bear_use_atr': True, 'bear_use_adx': False, 'bear_use_spike': True, 'bear_rsi_required': False, 'sideways_strategy': 'breakout', 'sideways_bb_std_mult': 3.352104973900462, 'sideways_rsi_os': 46, 'sideways_rsi_ob': 48, 'sideways_adx_thresh': 26.883179077964456, 'sideways_atr_min_pct': 0.005232079666917936, 'sideways_atr_max_pct': 0.031376356356455345, 'sideways_tp_mult': 1.8565407658080253, 'sideways_tsl_mult': 0.04080001555808925, 'sideways_time_stop': 123, 'sideways_use_sma': False, 'sideways_use_ema': True, 'sideways_use_atr': False, 'sideways_use_adx': False, 'sideways_use_spike': False, 'sideways_rsi_required': True}.
[I 2025-09-01 11:00:02,115] Trial 110 finished with values: [-1000000000.0, 1000000000.0] and parameters: {'p_sma': 18, 'p_std': 33, 'p_atr': 7, 'p_adx': 25, 'rsi_period': 16, 'ema1': 15, 'ema2': 58, 'slip_atr_k': 0.014069444773505236, 'slip_spread_k': 0.19519317899363853, 'spread_hl_frac': 0.009749686049081198, 'bb_std_mult': 0.6117244919911214, 'rsi_os': 24, 'rsi_ob': 60, 'vol_spike': 0.17191511790414954, 'adx_thresh': 22.45193151187278, 'atr_min_pct': 0.017782514039703805, 'atr_max_pct': 0.10741926185675493, 'tp_mult': 1.5057618808827558, 'tsl_mult': 0.5004970896796761, 'strategy': 'mean_reversion', 'time_stop': 256, 'use_sma': False, 'use_atr': True, 'use_adx': True, 'use_ema': True, 'use_spike': False, 'rsi_required': True, 'edge_k': 1.9198927226990419, 'edge_cap': 0.4998764087026829, 'bull_strategy': 'breakout', 'bull_bb_std_mult': 3.323626796700849, 'bull_rsi_os': 25, 'bull_rsi_ob': 78, 'bull_adx_thresh': 26.34701142934563, 'bull_atr_min_pct': 0.02688483837954689, 'bull_atr_max_pct': 0.02178186425296407, 'bull_tp_mult': 1.3172561512170553, 'bull_tsl_mult': 0.9261490700785464, 'bull_time_stop': 6, 'bull_use_sma': False, 'bull_use_ema': False, 'bull_use_atr': False, 'bull_use_adx': False, 'bull_use_spike': True, 'bull_rsi_required': True, 'bear_strategy': 'breakout', 'bear_bb_std_mult': 0.9821262274911622, 'bear_rsi_os': 52, 'bear_rsi_ob': 85, 'bear_adx_thresh': 27.998390241481523, 'bear_atr_min_pct': 0.006122833863876825, 'bear_atr_max_pct': 0.14092892015500663, 'bear_tp_mult': 1.7236893031567262, 'bear_tsl_mult': 0.9292563235339704, 'bear_time_stop': 158, 'bear_use_sma': True, 'bear_use_ema': False, 'bear_use_atr': True, 'bear_use_adx': False, 'bear_use_spike': True, 'bear_rsi_required': False, 'sideways_strategy': 'breakout', 'sideways_bb_std_mult': 3.282740609471719, 'sideways_rsi_os': 15, 'sideways_rsi_ob': 50, 'sideways_adx_thresh': 18.049282061863835, 'sideways_atr_min_pct': 0.018274254560139272, 'sideways_atr_max_pct': 0.08507662387447516, 'sideways_tp_mult': 1.6907033891652814, 'sideways_tsl_mult': 0.9991300377231309, 'sideways_time_stop': 136, 'sideways_use_sma': False, 'sideways_use_ema': True, 'sideways_use_atr': False, 'sideways_use_adx': False, 'sideways_use_spike': False, 'sideways_rsi_required': True}.
[I 2025-09-01 11:00:02,608] Trial 116 finished with values: [-1000000000.0, 1000000000.0] and parameters: {'p_sma': 7, 'p_std': 23, 'p_atr': 26, 'p_adx': 30, 'rsi_period': 72, 'ema1': 17, 'ema2': 30, 'slip_atr_k': 0.16494580721512422, 'slip_spread_k': 0.20627764795240477, 'spread_hl_frac': 0.006778097284654982, 'bb_std_mult': 2.8272820255664453, 'rsi_os': 55, 'rsi_ob': 62, 'vol_spike': 0.09935726454901778, 'adx_thresh': 18.029527472708068, 'atr_min_pct': 0.01567317350785426, 'atr_max_pct': 0.06582277636729458, 'tp_mult': 1.5184716998847987, 'tsl_mult': 0.2022564048997918, 'strategy': 'mean_reversion', 'time_stop': 268, 'use_sma': True, 'use_atr': True, 'use_adx': True, 'use_ema': True, 'use_spike': False, 'rsi_required': True, 'edge_k': 1.9898577496728533, 'edge_cap': 0.49694381190484893, 'bull_strategy': 'breakout', 'bull_bb_std_mult': 2.1200211242173435, 'bull_rsi_os': 26, 'bull_rsi_ob': 82, 'bull_adx_thresh': 7.215118758743381, 'bull_atr_min_pct': 0.026679297102152104, 'bull_atr_max_pct': 0.11042080701161176, 'bull_tp_mult': 1.9111804943139161, 'bull_tsl_mult': 0.9755030852947232, 'bull_time_stop': 26, 'bull_use_sma': False, 'bull_use_ema': False, 'bull_use_atr': True, 'bull_use_adx': True, 'bull_use_spike': True, 'bull_rsi_required': False, 'bear_strategy': 'breakout', 'bear_bb_std_mult': 1.307013711911022, 'bear_rsi_os': 38, 'bear_rsi_ob': 46, 'bear_adx_thresh': 11.16772364858027, 'bear_atr_min_pct': 0.019540421668794182, 'bear_atr_max_pct': 0.14149421245823304, 'bear_tp_mult': 1.81920599381465, 'bear_tsl_mult': 0.7177624767259341, 'bear_time_stop': 121, 'bear_use_sma': False, 'bear_use_ema': False, 'bear_use_atr': True, 'bear_use_adx': False, 'bear_use_spike': True, 'bear_rsi_required': False, 'sideways_strategy': 'breakout', 'sideways_bb_std_mult': 2.233795548401021, 'sideways_rsi_os': 36, 'sideways_rsi_ob': 50, 'sideways_adx_thresh': 19.064225067688575, 'sideways_atr_min_pct': 0.007986014893184075, 'sideways_atr_max_pct': 0.09788103979766848, 'sideways_tp_mult': 1.8746529282831481, 'sideways_tsl_mult': 0.7543435743559601, 'sideways_time_stop': 252, 'sideways_use_sma': False, 'sideways_use_ema': True, 'sideways_use_atr': False, 'sideways_use_adx': False, 'sideways_use_spike': False, 'sideways_rsi_required': True}.
[I 2025-09-01 11:00:47,952] Trial 117 finished with values: [-0.012372507010435352, 0.01295408514315483] and parameters: {'p_sma': 49, 'p_std': 24, 'p_atr': 26, 'p_adx': 28, 'rsi_period': 15, 'ema1': 17, 'ema2': 30, 'slip_atr_k': 0.014971148725904534, 'slip_spread_k': 0.20044685947049928, 'spread_hl_frac': 0.010415639391588263, 'bb_std_mult': 3.457634852136083, 'rsi_os': 26, 'rsi_ob': 62, 'vol_spike': 0.04663974510445554, 'adx_thresh': 22.60759209117609, 'atr_min_pct': 0.021730175701729054, 'atr_max_pct': 0.065116334723949, 'tp_mult': 2.7202226405576075, 'tsl_mult': 0.5993135263003037, 'strategy': 'mean_reversion', 'time_stop': 269, 'use_sma': True, 'use_atr': True, 'use_adx': True, 'use_ema': True, 'use_spike': False, 'rsi_required': True, 'edge_k': 1.2204538894551193, 'edge_cap': 0.5003264526801221, 'bull_strategy': 'mean_reversion', 'bull_bb_std_mult': 1.7291391460059815, 'bull_rsi_os': 49, 'bull_rsi_ob': 82, 'bull_adx_thresh': 13.943697161470993, 'bull_atr_min_pct': 0.02646814388069344, 'bull_atr_max_pct': 0.12033022678707107, 'bull_tp_mult': 1.1840133427863522, 'bull_tsl_mult': 0.8330200107930958, 'bull_time_stop': 26, 'bull_use_sma': False, 'bull_use_ema': False, 'bull_use_atr': True, 'bull_use_adx': True, 'bull_use_spike': True, 'bull_rsi_required': False, 'bear_strategy': 'breakout', 'bear_bb_std_mult': 1.5884451602852048, 'bear_rsi_os': 39, 'bear_rsi_ob': 88, 'bear_adx_thresh': 30.039917149741477, 'bear_atr_min_pct': 0.008274041420524965, 'bear_atr_max_pct': 0.1412005237152378, 'bear_tp_mult': 1.8028223618817478, 'bear_tsl_mult': 0.6376217153983492, 'bear_time_stop': 157, 'bear_use_sma': False, 'bear_use_ema': False, 'bear_use_atr': True, 'bear_use_adx': False, 'bear_use_spike': True, 'bear_rsi_required': False, 'sideways_strategy': 'breakout', 'sideways_bb_std_mult': 3.276160796182606, 'sideways_rsi_os': 19, 'sideways_rsi_ob': 50, 'sideways_adx_thresh': 17.215439674428513, 'sideways_atr_min_pct': 0.002921993564584247, 'sideways_atr_max_pct': 0.09814418756603624, 'sideways_tp_mult': 1.9305555398911114, 'sideways_tsl_mult': 0.024344688735078376, 'sideways_time_stop': 187, 'sideways_use_sma': False, 'sideways_use_ema': True, 'sideways_use_atr': False, 'sideways_use_adx': False, 'sideways_use_spike': False, 'sideways_rsi_required': True}.
