[I 2025-09-01 10:55:14,557] Trial 83 finished with values: [-1000000000.0, 1000000000.0] and parameters: {'p_sma': 56, 'p_std': 56, 'p_atr': 8, 'p_adx': 25, 'rsi_period': 12, 'ema1': 20, 'ema2': 57, 'slip_atr_k': 0.07170735242503634, 'slip_spread_k': 0.30716718068719473, 'spread_hl_frac': 0.008753506446059931, 'bb_std_mult': 0.7169863390658956, 'rsi_os': 25, 'rsi_ob': 71, 'vol_spike': 0.1270890140455591, 'adx_thresh': 28.03244060850748, 'atr_min_pct': 0.016391108584894877, 'atr_max_pct': 0.09325082989993809, 'tp_mult': 1.892671571957302, 'tsl_mult': 0.7239332507183701, 'strategy': 'mean_reversion', 'time_stop': 118, 'use_sma': True, 'use_atr': False, 'use_adx': True, 'use_ema': True, 'use_spike': False, 'rsi_required': True, 'edge_k': 1.6754426603692814, 'edge_cap': 0.27547223194799353, 'bull_strategy': 'mean_reversion', 'bull_bb_std_mult': 2.600137210284176, 'bull_rsi_os': 25, 'bull_rsi_ob': 84, 'bull_adx_thresh': 26.438158881903448, 'bull_atr_min_pct': 0.028736381137640987, 'bull_atr_max_pct': 0.09915042983953257, 'bull_tp_mult': 1.771585531659421, 'bull_tsl_mult': 0.8940705708422438, 'bull_time_stop': 183, 'bull_use_sma': True, 'bull_use_ema': False, 'bull_use_atr': True, 'bull_use_adx': False, 'bull_use_spike': True, 'bull_rsi_required': True, 'bear_strategy': 'breakout', 'bear_bb_std_mult': 1.666835904822275, 'bear_rsi_os': 41, 'bear_rsi_ob': 92, 'bear_adx_thresh': 18.19672561696394, 'bear_atr_min_pct': 0.022749776504075222, 'bear_atr_max_pct': 0.13414814805812575, 'bear_tp_mult': 1.1429275887740347, 'bear_tsl_mult': 0.8123382213989119, 'bear_time_stop': 182, 'bear_use_sma': False, 'bear_use_ema': False, 'bear_use_atr': False, 'bear_use_adx': False, 'bear_use_spike': True, 'bear_rsi_required': False, 'sideways_strategy': 'breakout', 'sideways_bb_std_mult': 3.5934499358367074, 'sideways_rsi_os': 20, 'sideways_rsi_ob': 47, 'sideways_adx_thresh': 17.511064825881565, 'sideways_atr_min_pct': 0.024300210555069965, 'sideways_atr_max_pct': 0.14483227707005075, 'sideways_tp_mult': 1.8245044518566966, 'sideways_tsl_mult': 0.09321078904586125, 'sideways_time_stop': 141, 'sideways_use_sma': False, 'sideways_use_ema': True, 'sideways_use_atr': False, 'sideways_use_adx': False, 'sideways_use_spike': False, 'sideways_rsi_required': True}.
[I 2025-09-01 10:55:14,894] Trial 81 finished with values: [-1000000000.0, 1000000000.0] and parameters: {'p_sma': 7, 'p_std': 14, 'p_atr': 8, 'p_adx': 29, 'rsi_period': 26, 'ema1': 22, 'ema2': 56, 'slip_atr_k': 0.07756866758362044, 'slip_spread_k': 0.293561762774043, 'spread_hl_frac': 0.009303148130320234, 'bb_std_mult': 0.7226019519714975, 'rsi_os': 25, 'rsi_ob': 64, 'vol_spike': 0.12389233864739652, 'adx_thresh': 8.005995567279923, 'atr_min_pct': 0.016498327935504008, 'atr_max_pct': 0.06171780434938772, 'tp_mult': 1.7015932789261405, 'tsl_mult': 0.6041169777124479, 'strategy': 'mean_reversion', 'time_stop': 178, 'use_sma': True, 'use_atr': False, 'use_adx': True, 'use_ema': True, 'use_spike': False, 'rsi_required': True, 'edge_k': 1.6981948554077841, 'edge_cap': 0.44980915069876776, 'bull_strategy': 'breakout', 'bull_bb_std_mult': 2.1655696250414267, 'bull_rsi_os': 26, 'bull_rsi_ob': 85, 'bull_adx_thresh': 25.726931351486638, 'bull_atr_min_pct': 0.00625221106175973, 'bull_atr_max_pct': 0.09876710419108013, 'bull_tp_mult': 1.7770232301230962, 'bull_tsl_mult': 0.9007160942428919, 'bull_time_stop': 180, 'bull_use_sma': False, 'bull_use_ema': False, 'bull_use_atr': False, 'bull_use_adx': True, 'bull_use_spike': True, 'bull_rsi_required': False, 'bear_strategy': 'breakout', 'bear_bb_std_mult': 0.7203175927398117, 'bear_rsi_os': 41, 'bear_rsi_ob': 90, 'bear_adx_thresh': 22.684859113061588, 'bear_atr_min_pct': 0.019693802946811084, 'bear_atr_max_pct': 0.13316838622648577, 'bear_tp_mult': 1.2921255974337211, 'bear_tsl_mult': 0.7956792179661265, 'bear_time_stop': 116, 'bear_use_sma': False, 'bear_use_ema': False, 'bear_use_atr': False, 'bear_use_adx': False, 'bear_use_spike': True, 'bear_rsi_required': False, 'sideways_strategy': 'breakout', 'sideways_bb_std_mult': 3.5908775020088655, 'sideways_rsi_os': 17, 'sideways_rsi_ob': 47, 'sideways_adx_thresh': 18.984108119168827, 'sideways_atr_min_pct': 0.028054937355879342, 'sideways_atr_max_pct': 0.09959927673639855, 'sideways_tp_mult': 1.8053417906222415, 'sideways_tsl_mult': 0.046010269879681535, 'sideways_time_stop': 120, 'sideways_use_sma': False, 'sideways_use_ema': True, 'sideways_use_atr': False, 'sideways_use_adx': False, 'sideways_use_spike': False, 'sideways_rsi_required': True}.
[I 2025-09-01 10:55:15,021] Trial 82 finished with values: [-0.009977451750703414, 0.010441766590444023] and parameters: {'p_sma': 9, 'p_std': 16, 'p_atr': 8, 'p_adx': 25, 'rsi_period': 31, 'ema1': 23, 'ema2': 57, 'slip_atr_k': 0.07677025095519352, 'slip_spread_k': 0.3179215929184277, 'spread_hl_frac': 0.0095241040325703, 'bb_std_mult': 0.730381312625282, 'rsi_os': 26, 'rsi_ob': 64, 'vol_spike': 0.1492276642979031, 'adx_thresh': 8.04212104389993, 'atr_min_pct': 0.01006444473246877, 'atr_max_pct': 0.061941891936641576, 'tp_mult': 1.8892902166175398, 'tsl_mult': 0.5927737633592013, 'strategy': 'mean_reversion', 'time_stop': 189, 'use_sma': True, 'use_atr': False, 'use_adx': True, 'use_ema': True, 'use_spike': False, 'rsi_required': True, 'edge_k': 1.685654390880257, 'edge_cap': 0.30712227792662306, 'bull_strategy': 'mean_reversion', 'bull_bb_std_mult': 3.1975427197245816, 'bull_rsi_os': 25, 'bull_rsi_ob': 84, 'bull_adx_thresh': 33.25752281382228, 'bull_atr_min_pct': 0.02733251093014701, 'bull_atr_max_pct': 0.09923456964221034, 'bull_tp_mult': 1.7725887414371122, 'bull_tsl_mult': 0.9033404707314805, 'bull_time_stop': 129, 'bull_use_sma': False, 'bull_use_ema': False, 'bull_use_atr': False, 'bull_use_adx': False, 'bull_use_spike': True, 'bull_rsi_required': False, 'bear_strategy': 'breakout', 'bear_bb_std_mult': 0.7215311624155776, 'bear_rsi_os': 41, 'bear_rsi_ob': 93, 'bear_adx_thresh': 23.037610673277296, 'bear_atr_min_pct': 0.017449288657294122, 'bear_atr_max_pct': 0.14318982097152594, 'bear_tp_mult': 1.6125667259134322, 'bear_tsl_mult': 0.8021168964735572, 'bear_time_stop': 112, 'bear_use_sma': False, 'bear_use_ema': False, 'bear_use_atr': False, 'bear_use_adx': False, 'bear_use_spike': True, 'bear_rsi_required': False, 'sideways_strategy': 'breakout', 'sideways_bb_std_mult': 3.2064874501795964, 'sideways_rsi_os': 24, 'sideways_rsi_ob': 47, 'sideways_adx_thresh': 18.720679027309302, 'sideways_atr_min_pct': 0.002621065749608145, 'sideways_atr_max_pct': 0.14384318909868066, 'sideways_tp_mult': 1.8127705681585782, 'sideways_tsl_mult': 0.08601330560108195, 'sideways_time_stop': 119, 'sideways_use_sma': False, 'sideways_use_ema': True, 'sideways_use_atr': False, 'sideways_use_adx': False, 'sideways_use_spike': False, 'sideways_rsi_required': True}.
[I 2025-09-01 10:55:55,816] Trial 84 finished with values: [-1000000000.0, 1000000000.0] and parameters: {'p_sma': 57, 'p_std': 57, 'p_atr': 8, 'p_adx': 25, 'rsi_period': 31, 'ema1': 17, 'ema2': 56, 'slip_atr_k': 0.08020747959989862, 'slip_spread_k': 0.3139016375369745, 'spread_hl_frac': 0.006143494050571772, 'bb_std_mult': 0.9966654217685209, 'rsi_os': 31, 'rsi_ob': 64, 'vol_spike': 0.1484135609776093, 'adx_thresh': 8.993211279791696, 'atr_min_pct': 0.016717577586999356, 'atr_max_pct': 0.08542145870293905, 'tp_mult': 1.9249034098802087, 'tsl_mult': 0.7246777905770418, 'strategy': 'mean_reversion', 'time_stop': 121, 'use_sma': True, 'use_atr': False, 'use_adx': True, 'use_ema': True, 'use_spike': False, 'rsi_required': True, 'edge_k': 1.7105403847396574, 'edge_cap': 0.29639803351578053, 'bull_strategy': 'mean_reversion', 'bull_bb_std_mult': 1.9929317252457386, 'bull_rsi_os': 24, 'bull_rsi_ob': 83, 'bull_adx_thresh': 25.825620713915526, 'bull_atr_min_pct': 0.017440637119804318, 'bull_atr_max_pct': 0.09812448887590497, 'bull_tp_mult': 1.78775579926395, 'bull_tsl_mult': 0.8947058821042093, 'bull_time_stop': 21, 'bull_use_sma': False, 'bull_use_ema': False, 'bull_use_atr': False, 'bull_use_adx': False, 'bull_use_spike': True, 'bull_rsi_required': True, 'bear_strategy': 'breakout', 'bear_bb_std_mult': 1.4693860763347826, 'bear_rsi_os': 41, 'bear_rsi_ob': 93, 'bear_adx_thresh': 17.935737757716346, 'bear_atr_min_pct': 0.021620482382074507, 'bear_atr_max_pct': 0.1325374496455927, 'bear_tp_mult': 1.1313028242910104, 'bear_tsl_mult': 0.9602014162472894, 'bear_time_stop': 189, 'bear_use_sma': False, 'bear_use_ema': True, 'bear_use_atr': False, 'bear_use_adx': False, 'bear_use_spike': True, 'bear_rsi_required': False, 'sideways_strategy': 'breakout', 'sideways_bb_std_mult': 3.5837745230534614, 'sideways_rsi_os': 20, 'sideways_rsi_ob': 47, 'sideways_adx_thresh': 18.632918620821982, 'sideways_atr_min_pct': 0.024715686258601276, 'sideways_atr_max_pct': 0.11693821544373076, 'sideways_tp_mult': 1.8316312671427724, 'sideways_tsl_mult': 0.07978348289500618, 'sideways_time_stop': 142, 'sideways_use_sma': False, 'sideways_use_ema': True, 'sideways_use_atr': False, 'sideways_use_adx': False, 'sideways_use_spike': False, 'sideways_rsi_required': True}.
[I 2025-09-01 10:55:56,664] Trial 85 finished with values: [-1000000000.0, 1000000000.0] and parameters: {'p_sma': 6, 'p_std': 13, 'p_atr': 23, 'p_adx': 11, 'rsi_period': 31, 'ema1': 22, 'ema2': 52, 'slip_atr_k': 0.0962863813113805, 'slip_spread_k': 0.14441806593051004, 'spread_hl_frac': 0.0058481463911364585, 'bb_std_mult': 0.995993598609614, 'rsi_os': 32, 'rsi_ob': 63, 'vol_spike': 0.07325822317483666, 'adx_thresh': 8.099579494466655, 'atr_min_pct': 0.009876788900682438, 'atr_max_pct': 0.08425210620592438, 'tp_mult': 1.9709417425008637, 'tsl_mult': 0.9957413153669579, 'strategy': 'mean_reversion', 'time_stop': 187, 'use_sma': True, 'use_atr': False, 'use_adx': True, 'use_ema': True, 'use_spike': False, 'rsi_required': True, 'edge_k': 1.8263342053343952, 'edge_cap': 0.09561605935417244, 'bull_strategy': 'breakout', 'bull_bb_std_mult': 2.015980744948616, 'bull_rsi_os': 27, 'bull_rsi_ob': 81, 'bull_adx_thresh': 33.41852537558723, 'bull_atr_min_pct': 0.017210310847344774, 'bull_atr_max_pct': 0.10104838552097806, 'bull_tp_mult': 1.6796389316479114, 'bull_tsl_mult': 0.8963701780313382, 'bull_time_stop': 123, 'bull_use_sma': False, 'bull_use_ema': False, 'bull_use_atr': False, 'bull_use_adx': False, 'bull_use_spike': True, 'bull_rsi_required': True, 'bear_strategy': 'breakout', 'bear_bb_std_mult': 1.1269050445192033, 'bear_rsi_os': 40, 'bear_rsi_ob': 95, 'bear_adx_thresh': 21.767725149186255, 'bear_atr_min_pct': 0.01776886575731907, 'bear_atr_max_pct': 0.1191264607325559, 'bear_tp_mult': 1.4961673605286219, 'bear_tsl_mult': 0.6414146925939346, 'bear_time_stop': 127, 'bear_use_sma': False, 'bear_use_ema': True, 'bear_use_atr': False, 'bear_use_adx': False, 'bear_use_spike': True, 'bear_rsi_required': False, 'sideways_strategy': 'breakout', 'sideways_bb_std_mult': 3.371267891825642, 'sideways_rsi_os': 17, 'sideways_rsi_ob': 62, 'sideways_adx_thresh': 12.794123901810607, 'sideways_atr_min_pct': 0.028076210750804326, 'sideways_atr_max_pct': 0.11528256256197314, 'sideways_tp_mult': 1.7958680894198957, 'sideways_tsl_mult': 0.09800958859840074, 'sideways_time_stop': 169, 'sideways_use_sma': False, 'sideways_use_ema': True, 'sideways_use_atr': False, 'sideways_use_adx': False, 'sideways_use_spike': False, 'sideways_rsi_required': True}.
[I 2025-09-01 10:55:56,665] Trial 87 finished with values: [-1000000000.0, 1000000000.0] and parameters: {'p_sma': 10, 'p_std': 20, 'p_atr': 30, 'p_adx': 25, 'rsi_period': 32, 'ema1': 18, 'ema2': 49, 'slip_atr_k': 0.0902248719321885, 'slip_spread_k': 0.1406340456264223, 'spread_hl_frac': 0.006170949872904926, 'bb_std_mult': 0.6431870209821363, 'rsi_os': 35, 'rsi_ob': 63, 'vol_spike': 0.1484492667595504, 'adx_thresh': 9.069859331398831, 'atr_min_pct': 0.010848811025164874, 'atr_max_pct': 0.06113146459478681, 'tp_mult': 1.9385418332565176, 'tsl_mult': 0.42974849780748514, 'strategy': 'mean_reversion', 'time_stop': 195, 'use_sma': True, 'use_atr': False, 'use_adx': True, 'use_ema': True, 'use_spike': False, 'rsi_required': True, 'edge_k': 1.8035210835973308, 'edge_cap': 0.33960570422990655, 'bull_strategy': 'mean_reversion', 'bull_bb_std_mult': 3.187339403521296, 'bull_rsi_os': 27, 'bull_rsi_ob': 81, 'bull_adx_thresh': 33.72234210965749, 'bull_atr_min_pct': 0.017317326865157755, 'bull_atr_max_pct': 0.1103307376304949, 'bull_tp_mult': 1.6376903516908186, 'bull_tsl_mult': 0.910964078807529, 'bull_time_stop': 123, 'bull_use_sma': False, 'bull_use_ema': False, 'bull_use_atr': False, 'bull_use_adx': False, 'bull_use_spike': True, 'bull_rsi_required': True, 'bear_strategy': 'breakout', 'bear_bb_std_mult': 1.8383673130837341, 'bear_rsi_os': 49, 'bear_rsi_ob': 95, 'bear_adx_thresh': 21.817557376683066, 'bear_atr_min_pct': 0.01808157716797006, 'bear_atr_max_pct': 0.11934004109688401, 'bear_tp_mult': 1.6126060325133387, 'bear_tsl_mult': 0.1862334704995134, 'bear_time_stop': 127, 'bear_use_sma': False, 'bear_use_ema': True, 'bear_use_atr': False, 'bear_use_adx': False, 'bear_use_spike': True, 'bear_rsi_required': False, 'sideways_strategy': 'breakout', 'sideways_bb_std_mult': 3.3768915520778027, 'sideways_rsi_os': 26, 'sideways_rsi_ob': 49, 'sideways_adx_thresh': 16.77178201935033, 'sideways_atr_min_pct': 0.0032261136282747526, 'sideways_atr_max_pct': 0.11654808016841009, 'sideways_tp_mult': 2.115795222047101, 'sideways_tsl_mult': 0.08676958700744072, 'sideways_time_stop': 96, 'sideways_use_sma': False, 'sideways_use_ema': True, 'sideways_use_atr': False, 'sideways_use_adx': False, 'sideways_use_spike': False, 'sideways_rsi_required': True}.
[I 2025-09-01 10:55:56,947] Trial 86 finished with values: [-0.21285604215072218, 0.21275338422784365] and parameters: {'p_sma': 10, 'p_std': 20, 'p_atr': 24, 'p_adx': 25, 'rsi_period': 32, 'ema1': 17, 'ema2': 14, 'slip_atr_k': 0.1514224609683738, 'slip_spread_k': 0.059475123346275555, 'spread_hl_frac': 0.022513221483474257, 'bb_std_mult': 1.0514073459908233, 'rsi_os': 31, 'rsi_ob': 75, 'vol_spike': 0.1476069755516744, 'adx_thresh': 9.159036146649182, 'atr_min_pct': 0.015048588111925082, 'atr_max_pct': 0.0853267494940377, 'tp_mult': 1.9545338483290764, 'tsl_mult': 0.9927488870723102, 'strategy': 'mean_reversion', 'time_stop': 46, 'use_sma': True, 'use_atr': False, 'use_adx': True, 'use_ema': True, 'use_spike': False, 'rsi_required': True, 'edge_k': 1.7648538902708895, 'edge_cap': 0.3058485946320383, 'bull_strategy': 'breakout', 'bull_bb_std_mult': 2.010545456276936, 'bull_rsi_os': 20, 'bull_rsi_ob': 81, 'bull_adx_thresh': 33.09537080626384, 'bull_atr_min_pct': 0.01796988054946779, 'bull_atr_max_pct': 0.1100816737212468, 'bull_tp_mult': 1.87345589078133, 'bull_tsl_mult': 0.8147959384652192, 'bull_time_stop': 23, 'bull_use_sma': False, 'bull_use_ema': False, 'bull_use_atr': False, 'bull_use_adx': False, 'bull_use_spike': True, 'bull_rsi_required': True, 'bear_strategy': 'breakout', 'bear_bb_std_mult': 1.4615512448425554, 'bear_rsi_os': 50, 'bear_rsi_ob': 94, 'bear_adx_thresh': 21.647316290198592, 'bear_atr_min_pct': 0.017762317909965273, 'bear_atr_max_pct': 0.1177258183402576, 'bear_tp_mult': 1.454363928711551, 'bear_tsl_mult': 0.18778584747429283, 'bear_time_stop': 131, 'bear_use_sma': False, 'bear_use_ema': True, 'bear_use_atr': False, 'bear_use_adx': False, 'bear_use_spike': True, 'bear_rsi_required': False, 'sideways_strategy': 'breakout', 'sideways_bb_std_mult': 3.4212415308736457, 'sideways_rsi_os': 26, 'sideways_rsi_ob': 49, 'sideways_adx_thresh': 12.714848950110245, 'sideways_atr_min_pct': 0.0004874172851196609, 'sideways_atr_max_pct': 0.11716166539436165, 'sideways_tp_mult': 1.8951874287453099, 'sideways_tsl_mult': 0.09560545020943495, 'sideways_time_stop': 136, 'sideways_use_sma': False, 'sideways_use_ema': True, 'sideways_use_atr': False, 'sideways_use_adx': False, 'sideways_use_spike': False, 'sideways_rsi_required': True}.
[I 2025-09-01 10:56:37,760] Trial 89 finished with values: [-0.022025243610716116, 0.02217151669552661] and parameters: {'p_sma': 36, 'p_std': 21, 'p_atr': 24, 'p_adx': 26, 'rsi_period': 35, 'ema1': 18, 'ema2': 34, 'slip_atr_k': 0.02010146250677828, 'slip_spread_k': 0.06998244267784373, 'spread_hl_frac': 0.03989577587446538, 'bb_std_mult': 0.8457694520819568, 'rsi_os': 27, 'rsi_ob': 75, 'vol_spike': 0.10767994121215042, 'adx_thresh': 6.663639696465675, 'atr_min_pct': 0.015172881068151498, 'atr_max_pct': 0.05421081071997291, 'tp_mult': 2.0510803460760587, 'tsl_mult': 0.531662627491416, 'strategy': 'breakout', 'time_stop': 62, 'use_sma': False, 'use_atr': True, 'use_adx': True, 'use_ema': True, 'use_spike': False, 'rsi_required': True, 'edge_k': 1.9711733072146533, 'edge_cap': 0.386892152001218, 'bull_strategy': 'breakout', 'bull_bb_std_mult': 2.342706582860437, 'bull_rsi_os': 39, 'bull_rsi_ob': 87, 'bull_adx_thresh': 30.660217827326743, 'bull_atr_min_pct': 0.0007378898195770144, 'bull_atr_max_pct': 0.033219074152775814, 'bull_tp_mult': 1.8554389208446285, 'bull_tsl_mult': 0.8079294005180483, 'bull_time_stop': 156, 'bull_use_sma': True, 'bull_use_ema': False, 'bull_use_atr': True, 'bull_use_adx': True, 'bull_use_spike': True, 'bull_rsi_required': False, 'bear_strategy': 'breakout', 'bear_bb_std_mult': 2.34610707807977, 'bear_rsi_os': 7, 'bear_rsi_ob': 87, 'bear_adx_thresh': 23.970802612419753, 'bear_atr_min_pct': 0.0023018032821052296, 'bear_atr_max_pct': 0.14464239708393978, 'bear_tp_mult': 1.780393146890989, 'bear_tsl_mult': 0.026892275118994835, 'bear_time_stop': 105, 'bear_use_sma': True, 'bear_use_ema': False, 'bear_use_atr': True, 'bear_use_adx': False, 'bear_use_spike': True, 'bear_rsi_required': False, 'sideways_strategy': 'mean_reversion', 'sideways_bb_std_mult': 2.961664018656287, 'sideways_rsi_os': 25, 'sideways_rsi_ob': 54, 'sideways_adx_thresh': 14.551912275849533, 'sideways_atr_min_pct': 0.00013698824584042896, 'sideways_atr_max_pct': 0.1064665694366997, 'sideways_tp_mult': 1.9019190443990295, 'sideways_tsl_mult': 0.12526344225325697, 'sideways_time_stop': 153, 'sideways_use_sma': False, 'sideways_use_ema': True, 'sideways_use_atr': False, 'sideways_use_adx': False, 'sideways_use_spike': False, 'sideways_rsi_required': True}.
[I 2025-09-01 10:56:38,150] Trial 90 finished with values: [-1000000000.0, 1000000000.0] and parameters: {'p_sma': 10, 'p_std': 21, 'p_atr': 20, 'p_adx': 26, 'rsi_period': 34, 'ema1': 18, 'ema2': 58, 'slip_atr_k': 0.009654679548262463, 'slip_spread_k': 0.0731696420134258, 'spread_hl_frac': 0.02706650619603759, 'bb_std_mult': 0.8173535873533038, 'rsi_os': 23, 'rsi_ob': 75, 'vol_spike': 0.1390563013997291, 'adx_thresh': 21.565775848356303, 'atr_min_pct': 0.026769406047109916, 'atr_max_pct': 0.065633874964974, 'tp_mult': 2.071928671766558, 'tsl_mult': 0.03434794014648784, 'strategy': 'breakout', 'time_stop': 292, 'use_sma': False, 'use_atr': True, 'use_adx': True, 'use_ema': True, 'use_spike': False, 'rsi_required': True, 'edge_k': 1.950776365448494, 'edge_cap': 0.5319155423121404, 'bull_strategy': 'breakout', 'bull_bb_std_mult': 2.389436468304466, 'bull_rsi_os': 40, 'bull_rsi_ob': 87, 'bull_adx_thresh': 30.27372050216616, 'bull_atr_min_pct': 0.00863656001500861, 'bull_atr_max_pct': 0.027265338789458568, 'bull_tp_mult': 1.5392911939362024, 'bull_tsl_mult': 0.8301902990865014, 'bull_time_stop': 152, 'bull_use_sma': True, 'bull_use_ema': False, 'bull_use_atr': True, 'bull_use_adx': True, 'bull_use_spike': True, 'bull_rsi_required': False, 'bear_strategy': 'breakout', 'bear_bb_std_mult': 2.0221331057656142, 'bear_rsi_os': 6, 'bear_rsi_ob': 87, 'bear_adx_thresh': 8.778831987430962, 'bear_atr_min_pct': 0.021244895006140706, 'bear_atr_max_pct': 0.1287673257453135, 'bear_tp_mult': 1.774805791443857, 'bear_tsl_mult': 0.5297358708804645, 'bear_time_stop': 108, 'bear_use_sma': True, 'bear_use_ema': False, 'bear_use_atr': True, 'bear_use_adx': False, 'bear_use_spike': True, 'bear_rsi_required': False, 'sideways_strategy': 'mean_reversion', 'sideways_bb_std_mult': 3.225622230154358, 'sideways_rsi_os': 26, 'sideways_rsi_ob': 54, 'sideways_adx_thresh': 14.433558596658928, 'sideways_atr_min_pct': 0.021772732314443037, 'sideways_atr_max_pct': 0.10712829380489575, 'sideways_tp_mult': 2.292094702696276, 'sideways_tsl_mult': 0.14598585961765453, 'sideways_time_stop': 193, 'sideways_use_sma': False, 'sideways_use_ema': True, 'sideways_use_atr': False, 'sideways_use_adx': False, 'sideways_use_spike': False, 'sideways_rsi_required': True}.
