[I 2025-09-01 11:08:41,644] Trial 170 finished with values: [-1000000000.0, 1000000000.0] and parameters: {'p_sma': 23, 'p_std': 48, 'p_atr': 16, 'p_adx': 26, 'rsi_period': 70, 'ema1': 16, 'ema2': 58, 'slip_atr_k': 0.043645652480311284, 'slip_spread_k': 0.510852094213785, 'spread_hl_frac': 0.005007773642321996, 'bb_std_mult': 3.579285198287745, 'rsi_os': 6, 'rsi_ob': 88, 'vol_spike': 0.2995669101563583, 'adx_thresh': 5.90565378326024, 'atr_min_pct': 0.009084969364412991, 'atr_max_pct': 0.135563106842185, 'tp_mult': 1.8467988506796358, 'tsl_mult': 0.3742053199151487, 'strategy': 'mean_reversion', 'time_stop': 200, 'use_sma': True, 'use_atr': True, 'use_adx': True, 'use_ema': True, 'use_spike': False, 'rsi_required': False, 'edge_k': 1.956877873296339, 'edge_cap': 0.5602826430144958, 'bull_strategy': 'breakout', 'bull_bb_std_mult': 1.9415243281391508, 'bull_rsi_os': 28, 'bull_rsi_ob': 70, 'bull_adx_thresh': 7.763445998499989, 'bull_atr_min_pct': 0.027864223449092722, 'bull_atr_max_pct': 0.029148306920728576, 'bull_tp_mult': 1.6363776776573018, 'bull_tsl_mult': 0.5138223111561047, 'bull_time_stop': 12, 'bull_use_sma': False, 'bull_use_ema': False, 'bull_use_atr': False, 'bull_use_adx': True, 'bull_use_spike': False, 'bull_rsi_required': False, 'bear_strategy': 'mean_reversion', 'bear_bb_std_mult': 2.091414748168212, 'bear_rsi_os': 23, 'bear_rsi_ob': 61, 'bear_adx_thresh': 28.728483107909724, 'bear_atr_min_pct': 0.026057686289102818, 'bear_atr_max_pct': 0.09876281145110433, 'bear_tp_mult': 1.081958830146536, 'bear_tsl_mult': 0.2147023696035386, 'bear_time_stop': 198, 'bear_use_sma': False, 'bear_use_ema': False, 'bear_use_atr': True, 'bear_use_adx': False, 'bear_use_spike': True, 'bear_rsi_required': True, 'sideways_strategy': 'breakout', 'sideways_bb_std_mult': 3.3187187724969824, 'sideways_rsi_os': 26, 'sideways_rsi_ob': 45, 'sideways_adx_thresh': 15.05394031881264, 'sideways_atr_min_pct': 0.0038407865458998797, 'sideways_atr_max_pct': 0.14817974555816224, 'sideways_tp_mult': 1.8805837656019735, 'sideways_tsl_mult': 0.15431159549143203, 'sideways_time_stop': 123, 'sideways_use_sma': True, 'sideways_use_ema': True, 'sideways_use_atr': True, 'sideways_use_adx': False, 'sideways_use_spike': False, 'sideways_rsi_required': True}.
[I 2025-09-01 11:09:19,153] Trial 174 finished with values: [-0.022242481196124375, 0.022191779831945802] and parameters: {'p_sma': 37, 'p_std': 23, 'p_atr': 11, 'p_adx': 24, 'rsi_period': 35, 'ema1': 18, 'ema2': 56, 'slip_atr_k': 0.04153444849066542, 'slip_spread_k': 0.8366661641231594, 'spread_hl_frac': 0.004927163550227303, 'bb_std_mult': 0.5561122048510287, 'rsi_os': 26, 'rsi_ob': 64, 'vol_spike': 0.13243082003835682, 'adx_thresh': 24.272624171771582, 'atr_min_pct': 0.02633823576551601, 'atr_max_pct': 0.0557982014064638, 'tp_mult': 1.1103790517841605, 'tsl_mult': 0.5811684911823307, 'strategy': 'mean_reversion', 'time_stop': 199, 'use_sma': True, 'use_atr': True, 'use_adx': True, 'use_ema': False, 'use_spike': False, 'rsi_required': True, 'edge_k': 1.885998814584763, 'edge_cap': 0.5355266837587296, 'bull_strategy': 'breakout', 'bull_bb_std_mult': 1.5267133255589134, 'bull_rsi_os': 50, 'bull_rsi_ob': 70, 'bull_adx_thresh': 29.54616567277194, 'bull_atr_min_pct': 0.0005209760204163579, 'bull_atr_max_pct': 0.10840107314917868, 'bull_tp_mult': 1.5279160462221606, 'bull_tsl_mult': 0.9257995487834187, 'bull_time_stop': 18, 'bull_use_sma': True, 'bull_use_ema': False, 'bull_use_atr': False, 'bull_use_adx': True, 'bull_use_spike': True, 'bull_rsi_required': True, 'bear_strategy': 'breakout', 'bear_bb_std_mult': 2.688262692789312, 'bear_rsi_os': 30, 'bear_rsi_ob': 89, 'bear_adx_thresh': 26.49510853025879, 'bear_atr_min_pct': 0.020472578195716906, 'bear_atr_max_pct': 0.06760212503022428, 'bear_tp_mult': 1.787197431685969, 'bear_tsl_mult': 0.4777761604785443, 'bear_time_stop': 73, 'bear_use_sma': False, 'bear_use_ema': False, 'bear_use_atr': True, 'bear_use_adx': True, 'bear_use_spike': False, 'bear_rsi_required': False, 'sideways_strategy': 'breakout', 'sideways_bb_std_mult': 3.37749253864087, 'sideways_rsi_os': 25, 'sideways_rsi_ob': 47, 'sideways_adx_thresh': 24.103351085799545, 'sideways_atr_min_pct': 0.016953580530847338, 'sideways_atr_max_pct': 0.10257489867655355, 'sideways_tp_mult': 1.9459587718588989, 'sideways_tsl_mult': 0.20847726417295503, 'sideways_time_stop': 151, 'sideways_use_sma': False, 'sideways_use_ema': False, 'sideways_use_atr': False, 'sideways_use_adx': True, 'sideways_use_spike': False, 'sideways_rsi_required': True}.
[I 2025-09-01 11:09:19,574] Trial 172 finished with values: [-1000000000.0, 1000000000.0] and parameters: {'p_sma': 13, 'p_std': 29, 'p_atr': 11, 'p_adx': 24, 'rsi_period': 71, 'ema1': 19, 'ema2': 56, 'slip_atr_k': 0.010599642777310223, 'slip_spread_k': 0.8523653342185216, 'spread_hl_frac': 0.005607196955079847, 'bb_std_mult': 0.6452468367510809, 'rsi_os': 31, 'rsi_ob': 54, 'vol_spike': 0.29068306715080505, 'adx_thresh': 7.9209095296996725, 'atr_min_pct': 0.009416900506261278, 'atr_max_pct': 0.04542412663420442, 'tp_mult': 1.6567028333565563, 'tsl_mult': 0.6206509803895581, 'strategy': 'mean_reversion', 'time_stop': 120, 'use_sma': True, 'use_atr': True, 'use_adx': True, 'use_ema': True, 'use_spike': False, 'rsi_required': True, 'edge_k': 1.396604016009653, 'edge_cap': 0.43272055942616017, 'bull_strategy': 'breakout', 'bull_bb_std_mult': 2.2871111453155075, 'bull_rsi_os': 52, 'bull_rsi_ob': 86, 'bull_adx_thresh': 18.662196166882506, 'bull_atr_min_pct': 0.01042501779091641, 'bull_atr_max_pct': 0.07446396394407864, 'bull_tp_mult': 1.5584580724286443, 'bull_tsl_mult': 0.507966110555204, 'bull_time_stop': 146, 'bull_use_sma': False, 'bull_use_ema': False, 'bull_use_atr': False, 'bull_use_adx': True, 'bull_use_spike': False, 'bull_rsi_required': True, 'bear_strategy': 'breakout', 'bear_bb_std_mult': 2.709160546507644, 'bear_rsi_os': 5, 'bear_rsi_ob': 88, 'bear_adx_thresh': 6.871061212517249, 'bear_atr_min_pct': 0.01757876619855798, 'bear_atr_max_pct': 0.0686544696273857, 'bear_tp_mult': 1.6969090375835723, 'bear_tsl_mult': 0.4831836910465472, 'bear_time_stop': 124, 'bear_use_sma': False, 'bear_use_ema': False, 'bear_use_atr': True, 'bear_use_adx': True, 'bear_use_spike': False, 'bear_rsi_required': False, 'sideways_strategy': 'breakout', 'sideways_bb_std_mult': 2.4177596009374747, 'sideways_rsi_os': 50, 'sideways_rsi_ob': 45, 'sideways_adx_thresh': 33.93004818599877, 'sideways_atr_min_pct': 0.016969678230109315, 'sideways_atr_max_pct': 0.10373646472574889, 'sideways_tp_mult': 1.9998111100098053, 'sideways_tsl_mult': 0.1561996606804673, 'sideways_time_stop': 52, 'sideways_use_sma': False, 'sideways_use_ema': False, 'sideways_use_atr': False, 'sideways_use_adx': True, 'sideways_use_spike': False, 'sideways_rsi_required': True}.
[I 2025-09-01 11:09:20,434] Trial 173 finished with values: [-1000000000.0, 1000000000.0] and parameters: {'p_sma': 19, 'p_std': 23, 'p_atr': 11, 'p_adx': 10, 'rsi_period': 29, 'ema1': 18, 'ema2': 56, 'slip_atr_k': 0.043759148367295525, 'slip_spread_k': 0.7942178166630329, 'spread_hl_frac': 0.004594520448477017, 'bb_std_mult': 0.5767865698382048, 'rsi_os': 27, 'rsi_ob': 55, 'vol_spike': 0.2858313266466528, 'adx_thresh': 7.968466345058671, 'atr_min_pct': 0.018055644117622848, 'atr_max_pct': 0.11943284780868144, 'tp_mult': 2.2528391237257406, 'tsl_mult': 0.6238545090949144, 'strategy': 'mean_reversion', 'time_stop': 125, 'use_sma': True, 'use_atr': True, 'use_adx': True, 'use_ema': True, 'use_spike': False, 'rsi_required': True, 'edge_k': 1.8774264035930202, 'edge_cap': 0.5448064012621512, 'bull_strategy': 'breakout', 'bull_bb_std_mult': 1.5333791376568768, 'bull_rsi_os': 50, 'bull_rsi_ob': 79, 'bull_adx_thresh': 16.219920810074118, 'bull_atr_min_pct': 0.01816990728960207, 'bull_atr_max_pct': 0.11569362224133936, 'bull_tp_mult': 1.6507543748953968, 'bull_tsl_mult': 0.9341662447594167, 'bull_time_stop': 192, 'bull_use_sma': False, 'bull_use_ema': False, 'bull_use_atr': False, 'bull_use_adx': True, 'bull_use_spike': True, 'bull_rsi_required': True, 'bear_strategy': 'breakout', 'bear_bb_std_mult': 2.3541337917701863, 'bear_rsi_os': 5, 'bear_rsi_ob': 60, 'bear_adx_thresh': 6.6227292053469, 'bear_atr_min_pct': 0.013103886387015094, 'bear_atr_max_pct': 0.06518452417468859, 'bear_tp_mult': 1.2826711247494775, 'bear_tsl_mult': 0.3325406993136014, 'bear_time_stop': 202, 'bear_use_sma': False, 'bear_use_ema': False, 'bear_use_atr': True, 'bear_use_adx': True, 'bear_use_spike': False, 'bear_rsi_required': False, 'sideways_strategy': 'breakout', 'sideways_bb_std_mult': 3.3300962307400725, 'sideways_rsi_os': 55, 'sideways_rsi_ob': 46, 'sideways_adx_thresh': 15.01495866349222, 'sideways_atr_min_pct': 0.017040861284539646, 'sideways_atr_max_pct': 0.12067436395987695, 'sideways_tp_mult': 2.0006508963804874, 'sideways_tsl_mult': 0.1597023642015905, 'sideways_time_stop': 61, 'sideways_use_sma': False, 'sideways_use_ema': False, 'sideways_use_atr': False, 'sideways_use_adx': True, 'sideways_use_spike': False, 'sideways_rsi_required': True}.
[I 2025-09-01 11:09:21,029] Trial 175 finished with values: [-0.021479393118194245, 0.021481091913104444] and parameters: {'p_sma': 37, 'p_std': 23, 'p_atr': 28, 'p_adx': 24, 'rsi_period': 11, 'ema1': 18, 'ema2': 56, 'slip_atr_k': 0.03628768811251752, 'slip_spread_k': 0.21438295689025677, 'spread_hl_frac': 0.007008675859317819, 'bb_std_mult': 0.5522937162139022, 'rsi_os': 27, 'rsi_ob': 64, 'vol_spike': 0.28275108938025195, 'adx_thresh': 5.001713017420987, 'atr_min_pct': 0.026569230366635596, 'atr_max_pct': 0.06763367339954836, 'tp_mult': 1.2050747785128855, 'tsl_mult': 0.5836268923269801, 'strategy': 'mean_reversion', 'time_stop': 175, 'use_sma': True, 'use_atr': True, 'use_adx': True, 'use_ema': False, 'use_spike': False, 'rsi_required': True, 'edge_k': 1.8835608914309143, 'edge_cap': 0.48420469154973544, 'bull_strategy': 'breakout', 'bull_bb_std_mult': 1.2390410011495705, 'bull_rsi_os': 50, 'bull_rsi_ob': 79, 'bull_adx_thresh': 29.497771149648035, 'bull_atr_min_pct': 3.0455386997228513e-05, 'bull_atr_max_pct': 0.10893839038483957, 'bull_tp_mult': 1.5304627697370052, 'bull_tsl_mult': 0.9267956252755258, 'bull_time_stop': 176, 'bull_use_sma': True, 'bull_use_ema': False, 'bull_use_atr': False, 'bull_use_adx': True, 'bull_use_spike': True, 'bull_rsi_required': True, 'bear_strategy': 'breakout', 'bear_bb_std_mult': 2.713450500935224, 'bear_rsi_os': 29, 'bear_rsi_ob': 89, 'bear_adx_thresh': 21.495367136272023, 'bear_atr_min_pct': 0.013599975412422796, 'bear_atr_max_pct': 0.14104456247293634, 'bear_tp_mult': 1.7932127721901738, 'bear_tsl_mult': 0.149665346961123, 'bear_time_stop': 145, 'bear_use_sma': False, 'bear_use_ema': False, 'bear_use_atr': True, 'bear_use_adx': True, 'bear_use_spike': False, 'bear_rsi_required': False, 'sideways_strategy': 'breakout', 'sideways_bb_std_mult': 1.9311737062389616, 'sideways_rsi_os': 24, 'sideways_rsi_ob': 46, 'sideways_adx_thresh': 23.95751056947073, 'sideways_atr_min_pct': 0.01019532209576267, 'sideways_atr_max_pct': 0.08812361746722511, 'sideways_tp_mult': 2.000648761542357, 'sideways_tsl_mult': 0.05745946649779471, 'sideways_time_stop': 150, 'sideways_use_sma': False, 'sideways_use_ema': False, 'sideways_use_atr': False, 'sideways_use_adx': True, 'sideways_use_spike': False, 'sideways_rsi_required': True}.
[I 2025-09-01 11:09:59,722] Trial 177 finished with values: [-1000000000.0, 1000000000.0] and parameters: {'p_sma': 17, 'p_std': 57, 'p_atr': 7, 'p_adx': 15, 'rsi_period': 45, 'ema1': 13, 'ema2': 55, 'slip_atr_k': 0.034655132037709396, 'slip_spread_k': 0.2169700105213128, 'spread_hl_frac': 0.00709957851191312, 'bb_std_mult': 0.5751110782192337, 'rsi_os': 27, 'rsi_ob': 62, 'vol_spike': 0.032606343902858326, 'adx_thresh': 13.515066888254026, 'atr_min_pct': 0.0051496746019473235, 'atr_max_pct': 0.06651262602345119, 'tp_mult': 2.145932518726594, 'tsl_mult': 0.5456600599290932, 'strategy': 'breakout', 'time_stop': 260, 'use_sma': False, 'use_atr': True, 'use_adx': True, 'use_ema': False, 'use_spike': False, 'rsi_required': True, 'edge_k': 0.3373955120234282, 'edge_cap': 0.48459974753947843, 'bull_strategy': 'mean_reversion', 'bull_bb_std_mult': 2.1184219737431507, 'bull_rsi_os': 5, 'bull_rsi_ob': 82, 'bull_adx_thresh': 23.040807874790843, 'bull_atr_min_pct': 0.013323852631343277, 'bull_atr_max_pct': 0.11527580926314955, 'bull_tp_mult': 1.6156116595651204, 'bull_tsl_mult': 0.2870817643709727, 'bull_time_stop': 220, 'bull_use_sma': True, 'bull_use_ema': False, 'bull_use_atr': False, 'bull_use_adx': False, 'bull_use_spike': True, 'bull_rsi_required': False, 'bear_strategy': 'breakout', 'bear_bb_std_mult': 1.2633952305003007, 'bear_rsi_os': 12, 'bear_rsi_ob': 87, 'bear_adx_thresh': 21.619226095958926, 'bear_atr_min_pct': 0.013067596077395278, 'bear_atr_max_pct': 0.059053831193328236, 'bear_tp_mult': 2.160526398878586, 'bear_tsl_mult': 0.15465060580183143, 'bear_time_stop': 138, 'bear_use_sma': True, 'bear_use_ema': False, 'bear_use_atr': True, 'bear_use_adx': False, 'bear_use_spike': True, 'bear_rsi_required': False, 'sideways_strategy': 'mean_reversion', 'sideways_bb_std_mult': 3.2319076556451334, 'sideways_rsi_os': 24, 'sideways_rsi_ob': 84, 'sideways_adx_thresh': 16.70032820335868, 'sideways_atr_min_pct': 0.010074810137758617, 'sideways_atr_max_pct': 0.019794179614417616, 'sideways_tp_mult': 2.1555229399754765, 'sideways_tsl_mult': 0.0014003642253251347, 'sideways_time_stop': 144, 'sideways_use_sma': False, 'sideways_use_ema': True, 'sideways_use_atr': False, 'sideways_use_adx': False, 'sideways_use_spike': False, 'sideways_rsi_required': False}.
[I 2025-09-01 11:10:00,778] Trial 178 finished with values: [-0.018339685620150314, 0.01822510246333896] and parameters: {'p_sma': 9, 'p_std': 17, 'p_atr': 7, 'p_adx': 19, 'rsi_period': 45, 'ema1': 12, 'ema2': 18, 'slip_atr_k': 0.24340219161417903, 'slip_spread_k': 0.22444268795803116, 'spread_hl_frac': 0.006935338997942674, 'bb_std_mult': 0.8834316897604808, 'rsi_os': 26, 'rsi_ob': 61, 'vol_spike': 0.10763682829193057, 'adx_thresh': 6.895101518039402, 'atr_min_pct': 0.01596939537358861, 'atr_max_pct': 0.0674849607190957, 'tp_mult': 1.7953197425987186, 'tsl_mult': 0.17430787850223384, 'strategy': 'breakout', 'time_stop': 259, 'use_sma': False, 'use_atr': True, 'use_adx': True, 'use_ema': False, 'use_spike': False, 'rsi_required': True, 'edge_k': 1.810506408252891, 'edge_cap': 0.8333589268101436, 'bull_strategy': 'mean_reversion', 'bull_bb_std_mult': 2.115741158414546, 'bull_rsi_os': 5, 'bull_rsi_ob': 82, 'bull_adx_thresh': 30.08341673572442, 'bull_atr_min_pct': 0.001307645362985541, 'bull_atr_max_pct': 0.09008261806907168, 'bull_tp_mult': 1.4875130298653878, 'bull_tsl_mult': 0.2879548962251087, 'bull_time_stop': 33, 'bull_use_sma': True, 'bull_use_ema': False, 'bull_use_atr': False, 'bull_use_adx': False, 'bull_use_spike': True, 'bull_rsi_required': False, 'bear_strategy': 'breakout', 'bear_bb_std_mult': 1.2624835663667904, 'bear_rsi_os': 28, 'bear_rsi_ob': 73, 'bear_adx_thresh': 21.448696277285727, 'bear_atr_min_pct': 0.019976934289326172, 'bear_atr_max_pct': 0.14053412526033682, 'bear_tp_mult': 1.7808131570044266, 'bear_tsl_mult': 0.14982868639308267, 'bear_time_stop': 181, 'bear_use_sma': True, 'bear_use_ema': False, 'bear_use_atr': True, 'bear_use_adx': False, 'bear_use_spike': True, 'bear_rsi_required': False, 'sideways_strategy': 'mean_reversion', 'sideways_bb_std_mult': 2.122185198882544, 'sideways_rsi_os': 48, 'sideways_rsi_ob': 47, 'sideways_adx_thresh': 16.941234811270867, 'sideways_atr_min_pct': 0.02014160041738116, 'sideways_atr_max_pct': 0.08824354281875477, 'sideways_tp_mult': 2.1458880194008274, 'sideways_tsl_mult': 0.97306121528896, 'sideways_time_stop': 145, 'sideways_use_sma': False, 'sideways_use_ema': True, 'sideways_use_atr': False, 'sideways_use_adx': False, 'sideways_use_spike': False, 'sideways_rsi_required': False}.
[I 2025-09-01 11:10:01,124] Trial 176 finished with values: [-1000000000.0, 1000000000.0] and parameters: {'p_sma': 9, 'p_std': 57, 'p_atr': 7, 'p_adx': 29, 'rsi_period': 20, 'ema1': 19, 'ema2': 18, 'slip_atr_k': 0.036381932698294865, 'slip_spread_k': 0.2244478216118453, 'spread_hl_frac': 0.0038494558101657035, 'bb_std_mult': 0.7000771273101754, 'rsi_os': 27, 'rsi_ob': 62, 'vol_spike': 0.28916920108913446, 'adx_thresh': 7.937718582274421, 'atr_min_pct': 0.027105841192081474, 'atr_max_pct': 0.06658480202713418, 'tp_mult': 1.7718512607804162, 'tsl_mult': 0.16428624764732397, 'strategy': 'breakout', 'time_stop': 177, 'use_sma': False, 'use_atr': True, 'use_adx': True, 'use_ema': True, 'use_spike': False, 'rsi_required': True, 'edge_k': 1.8482345040100279, 'edge_cap': 0.9644322878794305, 'bull_strategy': 'mean_reversion', 'bull_bb_std_mult': 2.148733053830965, 'bull_rsi_os': 52, 'bull_rsi_ob': 79, 'bull_adx_thresh': 27.97618366153045, 'bull_atr_min_pct': 0.021414754702426445, 'bull_atr_max_pct': 0.11501531524859293, 'bull_tp_mult': 1.6025087513085672, 'bull_tsl_mult': 0.9434415665290248, 'bull_time_stop': 144, 'bull_use_sma': True, 'bull_use_ema': False, 'bull_use_atr': False, 'bull_use_adx': False, 'bull_use_spike': True, 'bull_rsi_required': False, 'bear_strategy': 'breakout', 'bear_bb_std_mult': 1.2889143783500476, 'bear_rsi_os': 41, 'bear_rsi_ob': 88, 'bear_adx_thresh': 10.06734169515813, 'bear_atr_min_pct': 0.019934666267082148, 'bear_atr_max_pct': 0.14085945249460188, 'bear_tp_mult': 2.2625112637947598, 'bear_tsl_mult': 0.15319265461871504, 'bear_time_stop': 138, 'bear_use_sma': True, 'bear_use_ema': False, 'bear_use_atr': True, 'bear_use_adx': False, 'bear_use_spike': True, 'bear_rsi_required': False, 'sideways_strategy': 'mean_reversion', 'sideways_bb_std_mult': 1.9018557229269148, 'sideways_rsi_os': 49, 'sideways_rsi_ob': 86, 'sideways_adx_thresh': 15.290365819829132, 'sideways_atr_min_pct': 0.020041072367368545, 'sideways_atr_max_pct': 0.08836779706844461, 'sideways_tp_mult': 2.0019706221109, 'sideways_tsl_mult': 0.0574235399280493, 'sideways_time_stop': 145, 'sideways_use_sma': False, 'sideways_use_ema': True, 'sideways_use_atr': False, 'sideways_use_adx': False, 'sideways_use_spike': False, 'sideways_rsi_required': False}.
[I 2025-09-01 11:10:01,527] Trial 179 finished with values: [-1000000000.0, 1000000000.0] and parameters: {'p_sma': 9, 'p_std': 26, 'p_atr': 7, 'p_adx': 17, 'rsi_period': 19, 'ema1': 12, 'ema2': 55, 'slip_atr_k': 0.029980932239271754, 'slip_spread_k': 0.18818843086030726, 'spread_hl_frac': 0.006969191825941224, 'bb_std_mult': 0.5002078295925542, 'rsi_os': 53, 'rsi_ob': 78, 'vol_spike': 0.10945276930195384, 'adx_thresh': 6.942826390249712, 'atr_min_pct': 0.027268279112854274, 'atr_max_pct': 0.06638362333412492, 'tp_mult': 2.1504309502308123, 'tsl_mult': 0.5125737189812286, 'strategy': 'breakout', 'time_stop': 237, 'use_sma': False, 'use_atr': True, 'use_adx': True, 'use_ema': True, 'use_spike': False, 'rsi_required': True, 'edge_k': 1.821928256401204, 'edge_cap': 0.5050380192025173, 'bull_strategy': 'mean_reversion', 'bull_bb_std_mult': 2.112080832296193, 'bull_rsi_os': 46, 'bull_rsi_ob': 45, 'bull_adx_thresh': 27.960456464596287, 'bull_atr_min_pct': 0.013093636376956787, 'bull_atr_max_pct': 0.10403734006859, 'bull_tp_mult': 1.493910828537179, 'bull_tsl_mult': 0.28045261289868595, 'bull_time_stop': 36, 'bull_use_sma': True, 'bull_use_ema': False, 'bull_use_atr': True, 'bull_use_adx': False, 'bull_use_spike': True, 'bull_rsi_required': False, 'bear_strategy': 'breakout', 'bear_bb_std_mult': 1.2759815573930111, 'bear_rsi_os': 37, 'bear_rsi_ob': 91, 'bear_adx_thresh': 13.832848299113259, 'bear_atr_min_pct': 0.024767236401156988, 'bear_atr_max_pct': 0.14435830665303995, 'bear_tp_mult': 1.8703225572848643, 'bear_tsl_mult': 0.10834785327246861, 'bear_time_stop': 137, 'bear_use_sma': True, 'bear_use_ema': False, 'bear_use_atr': True, 'bear_use_adx': False, 'bear_use_spike': True, 'bear_rsi_required': False, 'sideways_strategy': 'mean_reversion', 'sideways_bb_std_mult': 3.2467855115305038, 'sideways_rsi_os': 23, 'sideways_rsi_ob': 47, 'sideways_adx_thresh': 16.077587976728267, 'sideways_atr_min_pct': 0.020139855389008806, 'sideways_atr_max_pct': 0.09489896592794088, 'sideways_tp_mult': 1.9074761154883155, 'sideways_tsl_mult': 0.002640797717218868, 'sideways_time_stop': 225, 'sideways_use_sma': False, 'sideways_use_ema': True, 'sideways_use_atr': False, 'sideways_use_adx': False, 'sideways_use_spike': True, 'sideways_rsi_required': False}.
