[I 2025-09-01 12:15:24,265] Trial 577 finished with values: [-1000000000.0, 1000000000.0] and parameters: {'p_sma': 27, 'p_std': 35, 'p_atr': 20, 'p_adx': 7, 'rsi_period': 44, 'ema1': 10, 'ema2': 17, 'slip_atr_k': 0.025185703793023546, 'slip_spread_k': 0.17554964259053146, 'spread_hl_frac': 0.0021362092185050526, 'bb_std_mult': 1.5793864884743471, 'rsi_os': 40, 'rsi_ob': 48, 'vol_spike': 0.18690838924799413, 'adx_thresh': 23.970051381613306, 'atr_min_pct': 0.02410540062655573, 'atr_max_pct': 0.14016006684714818, 'tp_mult': 2.1759274135563036, 'tsl_mult': 0.18644434181454017, 'strategy': 'breakout', 'time_stop': 176, 'use_sma': False, 'use_atr': True, 'use_adx': True, 'use_ema': True, 'use_spike': False, 'rsi_required': False, 'edge_k': 1.4185876902482373, 'edge_cap': 0.5626351944503549, 'bull_strategy': 'mean_reversion', 'bull_bb_std_mult': 1.8274479105104244, 'bull_rsi_os': 48, 'bull_rsi_ob': 50, 'bull_adx_thresh': 7.72940080094487, 'bull_atr_min_pct': 0.016983313638562963, 'bull_atr_max_pct': 0.07657663376415139, 'bull_tp_mult': 2.3806948037129447, 'bull_tsl_mult': 0.5551783617387319, 'bull_time_stop': 80, 'bull_use_sma': False, 'bull_use_ema': False, 'bull_use_atr': True, 'bull_use_adx': False, 'bull_use_spike': False, 'bull_rsi_required': True, 'bear_strategy': 'mean_reversion', 'bear_bb_std_mult': 1.3801974840218536, 'bear_rsi_os': 47, 'bear_rsi_ob': 55, 'bear_adx_thresh': 26.19089302496851, 'bear_atr_min_pct': 0.005756119337849563, 'bear_atr_max_pct': 0.1146723517413945, 'bear_tp_mult': 1.4284075111442605, 'bear_tsl_mult': 0.04123058300345955, 'bear_time_stop': 263, 'bear_use_sma': False, 'bear_use_ema': False, 'bear_use_atr': True, 'bear_use_adx': True, 'bear_use_spike': False, 'bear_rsi_required': True, 'sideways_strategy': 'breakout', 'sideways_bb_std_mult': 2.4291206306130366, 'sideways_rsi_os': 27, 'sideways_rsi_ob': 87, 'sideways_adx_thresh': 32.92166990732192, 'sideways_atr_min_pct': 0.0042917519192527155, 'sideways_atr_max_pct': 0.12641986005579764, 'sideways_tp_mult': 2.8556877369500433, 'sideways_tsl_mult': 0.37382585516917005, 'sideways_time_stop': 87, 'sideways_use_sma': False, 'sideways_use_ema': False, 'sideways_use_atr': True, 'sideways_use_adx': True, 'sideways_use_spike': True, 'sideways_rsi_required': False}.
[I 2025-09-01 12:15:24,303] Trial 576 finished with values: [-1000000000.0, 1000000000.0] and parameters: {'p_sma': 23, 'p_std': 33, 'p_atr': 14, 'p_adx': 15, 'rsi_period': 46, 'ema1': 26, 'ema2': 16, 'slip_atr_k': 0.09145364021860622, 'slip_spread_k': 0.3756905962611235, 'spread_hl_frac': 0.0021679432067503463, 'bb_std_mult': 0.8429791002797283, 'rsi_os': 33, 'rsi_ob': 48, 'vol_spike': 0.15236190269248703, 'adx_thresh': 12.800583111197428, 'atr_min_pct': 0.023975285986684778, 'atr_max_pct': 0.0740729178876683, 'tp_mult': 2.8830843084702837, 'tsl_mult': 0.37355096039981417, 'strategy': 'breakout', 'time_stop': 300, 'use_sma': True, 'use_atr': True, 'use_adx': True, 'use_ema': False, 'use_spike': False, 'rsi_required': False, 'edge_k': 0.0826898542107232, 'edge_cap': 0.7689200204685785, 'bull_strategy': 'mean_reversion', 'bull_bb_std_mult': 1.8577061164438007, 'bull_rsi_os': 48, 'bull_rsi_ob': 49, 'bull_adx_thresh': 27.748299309911125, 'bull_atr_min_pct': 0.01699159975334137, 'bull_atr_max_pct': 0.07614617317288797, 'bull_tp_mult': 1.2330641600603884, 'bull_tsl_mult': 0.5553704530506793, 'bull_time_stop': 80, 'bull_use_sma': False, 'bull_use_ema': False, 'bull_use_atr': True, 'bull_use_adx': False, 'bull_use_spike': False, 'bull_rsi_required': True, 'bear_strategy': 'mean_reversion', 'bear_bb_std_mult': 2.702981273607063, 'bear_rsi_os': 30, 'bear_rsi_ob': 55, 'bear_adx_thresh': 11.883827415165547, 'bear_atr_min_pct': 0.00573755163411967, 'bear_atr_max_pct': 0.021137102847820777, 'bear_tp_mult': 1.6802733866418231, 'bear_tsl_mult': 0.4073100574916335, 'bear_time_stop': 265, 'bear_use_sma': False, 'bear_use_ema': False, 'bear_use_atr': True, 'bear_use_adx': True, 'bear_use_spike': False, 'bear_rsi_required': True, 'sideways_strategy': 'breakout', 'sideways_bb_std_mult': 0.7240463060369249, 'sideways_rsi_os': 42, 'sideways_rsi_ob': 88, 'sideways_adx_thresh': 33.04024817262767, 'sideways_atr_min_pct': 0.004616311901128829, 'sideways_atr_max_pct': 0.1365036319530785, 'sideways_tp_mult': 2.9149678625433832, 'sideways_tsl_mult': 0.33355350479830237, 'sideways_time_stop': 88, 'sideways_use_sma': False, 'sideways_use_ema': False, 'sideways_use_atr': True, 'sideways_use_adx': True, 'sideways_use_spike': True, 'sideways_rsi_required': False}.
[I 2025-09-01 12:15:24,721] Trial 579 finished with values: [-0.02155878305009573, 0.022528276669696975] and parameters: {'p_sma': 30, 'p_std': 52, 'p_atr': 20, 'p_adx': 24, 'rsi_period': 11, 'ema1': 26, 'ema2': 10, 'slip_atr_k': 0.06805670458867227, 'slip_spread_k': 0.2997075247898684, 'spread_hl_frac': 0.002294692653994828, 'bb_std_mult': 2.2700195171592004, 'rsi_os': 33, 'rsi_ob': 94, 'vol_spike': 0.18773581800702452, 'adx_thresh': 33.29804978556872, 'atr_min_pct': 0.0006584417301683399, 'atr_max_pct': 0.0839979730714156, 'tp_mult': 1.8961698114075904, 'tsl_mult': 0.0302774189727672, 'strategy': 'mean_reversion', 'time_stop': 194, 'use_sma': False, 'use_atr': True, 'use_adx': True, 'use_ema': True, 'use_spike': False, 'rsi_required': False, 'edge_k': 0.2222266586580064, 'edge_cap': 0.14422719342704968, 'bull_strategy': 'mean_reversion', 'bull_bb_std_mult': 1.694587744790417, 'bull_rsi_os': 28, 'bull_rsi_ob': 46, 'bull_adx_thresh': 7.02491064475722, 'bull_atr_min_pct': 0.01673014569092806, 'bull_atr_max_pct': 0.04819422894354514, 'bull_tp_mult': 1.340087439913046, 'bull_tsl_mult': 0.3556766497685616, 'bull_time_stop': 158, 'bull_use_sma': False, 'bull_use_ema': False, 'bull_use_atr': True, 'bull_use_adx': False, 'bull_use_spike': False, 'bull_rsi_required': False, 'bear_strategy': 'breakout', 'bear_bb_std_mult': 1.3640367179402468, 'bear_rsi_os': 24, 'bear_rsi_ob': 53, 'bear_adx_thresh': 9.756172970220879, 'bear_atr_min_pct': 0.003162706091328662, 'bear_atr_max_pct': 0.027079430380428017, 'bear_tp_mult': 1.6847572467162293, 'bear_tsl_mult': 0.6966275951860322, 'bear_time_stop': 300, 'bear_use_sma': True, 'bear_use_ema': False, 'bear_use_atr': True, 'bear_use_adx': True, 'bear_use_spike': False, 'bear_rsi_required': True, 'sideways_strategy': 'breakout', 'sideways_bb_std_mult': 0.5687888790871156, 'sideways_rsi_os': 38, 'sideways_rsi_ob': 87, 'sideways_adx_thresh': 27.835624191724385, 'sideways_atr_min_pct': 0.013951088556157632, 'sideways_atr_max_pct': 0.1355324606155208, 'sideways_tp_mult': 2.866803851397827, 'sideways_tsl_mult': 0.38189471931300994, 'sideways_time_stop': 80, 'sideways_use_sma': False, 'sideways_use_ema': False, 'sideways_use_atr': True, 'sideways_use_adx': True, 'sideways_use_spike': True, 'sideways_rsi_required': False}.
[I 2025-09-01 12:15:25,039] Trial 578 finished with values: [-1000000000.0, 1000000000.0] and parameters: {'p_sma': 30, 'p_std': 45, 'p_atr': 20, 'p_adx': 24, 'rsi_period': 60, 'ema1': 10, 'ema2': 14, 'slip_atr_k': 0.09247943922904271, 'slip_spread_k': 0.36740522597845693, 'spread_hl_frac': 0.046940769053691274, 'bb_std_mult': 0.8944115432676208, 'rsi_os': 8, 'rsi_ob': 94, 'vol_spike': 0.1865470551335723, 'adx_thresh': 21.61742663135168, 'atr_min_pct': 0.023317932272174154, 'atr_max_pct': 0.08319445659091537, 'tp_mult': 2.157888259274931, 'tsl_mult': 0.0645796143376425, 'strategy': 'mean_reversion', 'time_stop': 177, 'use_sma': False, 'use_atr': True, 'use_adx': True, 'use_ema': False, 'use_spike': False, 'rsi_required': False, 'edge_k': 0.16642522536787438, 'edge_cap': 0.5654198380822588, 'bull_strategy': 'mean_reversion', 'bull_bb_std_mult': 1.2890266319228914, 'bull_rsi_os': 48, 'bull_rsi_ob': 50, 'bull_adx_thresh': 12.859213303086662, 'bull_atr_min_pct': 0.016715167464056734, 'bull_atr_max_pct': 0.11262557167790442, 'bull_tp_mult': 1.3171793401396268, 'bull_tsl_mult': 0.5556686662270277, 'bull_time_stop': 150, 'bull_use_sma': False, 'bull_use_ema': False, 'bull_use_atr': True, 'bull_use_adx': False, 'bull_use_spike': False, 'bull_rsi_required': True, 'bear_strategy': 'breakout', 'bear_bb_std_mult': 1.2365360376305514, 'bear_rsi_os': 24, 'bear_rsi_ob': 70, 'bear_adx_thresh': 9.649035560570036, 'bear_atr_min_pct': 0.0034468292777678124, 'bear_atr_max_pct': 0.010028937852927078, 'bear_tp_mult': 1.667313086246108, 'bear_tsl_mult': 0.6423667818107444, 'bear_time_stop': 262, 'bear_use_sma': True, 'bear_use_ema': False, 'bear_use_atr': True, 'bear_use_adx': True, 'bear_use_spike': False, 'bear_rsi_required': True, 'sideways_strategy': 'breakout', 'sideways_bb_std_mult': 1.3561029602296648, 'sideways_rsi_os': 11, 'sideways_rsi_ob': 88, 'sideways_adx_thresh': 33.056960462632055, 'sideways_atr_min_pct': 0.006653628753192026, 'sideways_atr_max_pct': 0.02294508138905161, 'sideways_tp_mult': 2.8566057764258903, 'sideways_tsl_mult': 0.3751569750654345, 'sideways_time_stop': 86, 'sideways_use_sma': False, 'sideways_use_ema': False, 'sideways_use_atr': True, 'sideways_use_adx': True, 'sideways_use_spike': True, 'sideways_rsi_required': False}.
[I 2025-09-01 12:16:00,975] Trial 581 finished with values: [-1000000000.0, 1000000000.0] and parameters: {'p_sma': 24, 'p_std': 52, 'p_atr': 26, 'p_adx': 9, 'rsi_period': 60, 'ema1': 25, 'ema2': 14, 'slip_atr_k': 0.023842878558856855, 'slip_spread_k': 0.41595265844676005, 'spread_hl_frac': 1.8580865124922033e-05, 'bb_std_mult': 0.9614300081756113, 'rsi_os': 31, 'rsi_ob': 94, 'vol_spike': 0.20579999237284077, 'adx_thresh': 33.35456857586418, 'atr_min_pct': 0.0003411198394447229, 'atr_max_pct': 0.11579602498451247, 'tp_mult': 1.8710183330484154, 'tsl_mult': 0.05756188540547768, 'strategy': 'mean_reversion', 'time_stop': 168, 'use_sma': False, 'use_atr': True, 'use_adx': True, 'use_ema': True, 'use_spike': False, 'rsi_required': False, 'edge_k': 0.15988900503250286, 'edge_cap': 0.14538694888888953, 'bull_strategy': 'mean_reversion', 'bull_bb_std_mult': 1.466496791535148, 'bull_rsi_os': 50, 'bull_rsi_ob': 47, 'bull_adx_thresh': 33.32659635303142, 'bull_atr_min_pct': 0.01747975550379634, 'bull_atr_max_pct': 0.11282932072362704, 'bull_tp_mult': 1.3179151678880687, 'bull_tsl_mult': 0.6309299129620468, 'bull_time_stop': 153, 'bull_use_sma': False, 'bull_use_ema': False, 'bull_use_atr': True, 'bull_use_adx': False, 'bull_use_spike': False, 'bull_rsi_required': False, 'bear_strategy': 'breakout', 'bear_bb_std_mult': 1.3575495958605919, 'bear_rsi_os': 24, 'bear_rsi_ob': 52, 'bear_adx_thresh': 10.84061646551991, 'bear_atr_min_pct': 0.012249601026341999, 'bear_atr_max_pct': 0.07593739886104375, 'bear_tp_mult': 1.5803177657314176, 'bear_tsl_mult': 0.7886289800839237, 'bear_time_stop': 284, 'bear_use_sma': True, 'bear_use_ema': False, 'bear_use_atr': True, 'bear_use_adx': True, 'bear_use_spike': False, 'bear_rsi_required': True, 'sideways_strategy': 'breakout', 'sideways_bb_std_mult': 2.650309886566179, 'sideways_rsi_os': 38, 'sideways_rsi_ob': 78, 'sideways_adx_thresh': 34.95761369449116, 'sideways_atr_min_pct': 0.007931389647814516, 'sideways_atr_max_pct': 0.13088486040237196, 'sideways_tp_mult': 1.0648785606597833, 'sideways_tsl_mult': 0.3807824791840447, 'sideways_time_stop': 215, 'sideways_use_sma': False, 'sideways_use_ema': False, 'sideways_use_atr': True, 'sideways_use_adx': True, 'sideways_use_spike': True, 'sideways_rsi_required': False}.
[I 2025-09-01 12:16:01,584] Trial 580 finished with values: [-1000000000.0, 1000000000.0] and parameters: {'p_sma': 31, 'p_std': 32, 'p_atr': 20, 'p_adx': 9, 'rsi_period': 64, 'ema1': 25, 'ema2': 10, 'slip_atr_k': 0.06503144223440313, 'slip_spread_k': 0.2971276655522587, 'spread_hl_frac': 0.005366644575598513, 'bb_std_mult': 1.8973275139495993, 'rsi_os': 8, 'rsi_ob': 68, 'vol_spike': 0.18847526539768777, 'adx_thresh': 21.35198196074153, 'atr_min_pct': 0.02314776566345394, 'atr_max_pct': 0.08385827288490004, 'tp_mult': 1.8661508581116368, 'tsl_mult': 0.9749838663664638, 'strategy': 'mean_reversion', 'time_stop': 80, 'use_sma': False, 'use_atr': True, 'use_adx': True, 'use_ema': True, 'use_spike': False, 'rsi_required': False, 'edge_k': 0.1706845594250815, 'edge_cap': 0.6785346774098391, 'bull_strategy': 'mean_reversion', 'bull_bb_std_mult': 1.280784450584418, 'bull_rsi_os': 50, 'bull_rsi_ob': 57, 'bull_adx_thresh': 33.33508684713316, 'bull_atr_min_pct': 0.020689656058406804, 'bull_atr_max_pct': 0.11365435553690911, 'bull_tp_mult': 1.3291124519588702, 'bull_tsl_mult': 0.6322897948186442, 'bull_time_stop': 150, 'bull_use_sma': False, 'bull_use_ema': False, 'bull_use_atr': True, 'bull_use_adx': False, 'bull_use_spike': False, 'bull_rsi_required': False, 'bear_strategy': 'breakout', 'bear_bb_std_mult': 2.576174806908843, 'bear_rsi_os': 55, 'bear_rsi_ob': 81, 'bear_adx_thresh': 9.686236329269875, 'bear_atr_min_pct': 0.0033073270073287757, 'bear_atr_max_pct': 0.02661394047818191, 'bear_tp_mult': 2.195168659779893, 'bear_tsl_mult': 0.6420081571458136, 'bear_time_stop': 295, 'bear_use_sma': True, 'bear_use_ema': False, 'bear_use_atr': True, 'bear_use_adx': True, 'bear_use_spike': False, 'bear_rsi_required': True, 'sideways_strategy': 'breakout', 'sideways_bb_std_mult': 2.6386807649152564, 'sideways_rsi_os': 14, 'sideways_rsi_ob': 89, 'sideways_adx_thresh': 27.665792918147293, 'sideways_atr_min_pct': 0.007781402736769808, 'sideways_atr_max_pct': 0.1172187488298369, 'sideways_tp_mult': 2.093990296585988, 'sideways_tsl_mult': 0.07381769356744344, 'sideways_time_stop': 216, 'sideways_use_sma': False, 'sideways_use_ema': False, 'sideways_use_atr': True, 'sideways_use_adx': True, 'sideways_use_spike': True, 'sideways_rsi_required': False}.
[I 2025-09-01 12:16:02,411] Trial 583 finished with values: [-1000000000.0, 1000000000.0] and parameters: {'p_sma': 28, 'p_std': 29, 'p_atr': 24, 'p_adx': 21, 'rsi_period': 41, 'ema1': 25, 'ema2': 14, 'slip_atr_k': 0.1316377675006877, 'slip_spread_k': 0.7186765272665149, 'spread_hl_frac': 0.005120192995996185, 'bb_std_mult': 1.0952666879625004, 'rsi_os': 38, 'rsi_ob': 80, 'vol_spike': 0.2064560325634278, 'adx_thresh': 21.576304819642917, 'atr_min_pct': 0.021661172422473104, 'atr_max_pct': 0.11467645059307399, 'tp_mult': 2.131920942676779, 'tsl_mult': 0.11810405342917946, 'strategy': 'breakout', 'time_stop': 168, 'use_sma': False, 'use_atr': True, 'use_adx': True, 'use_ema': True, 'use_spike': False, 'rsi_required': False, 'edge_k': 0.15522569559120092, 'edge_cap': 0.08561858761522942, 'bull_strategy': 'mean_reversion', 'bull_bb_std_mult': 2.5715406252549586, 'bull_rsi_os': 50, 'bull_rsi_ob': 48, 'bull_adx_thresh': 6.7998649674279354, 'bull_atr_min_pct': 0.017821783863436018, 'bull_atr_max_pct': 0.12138667838247486, 'bull_tp_mult': 1.3689581493482297, 'bull_tsl_mult': 0.03367105072526938, 'bull_time_stop': 175, 'bull_use_sma': False, 'bull_use_ema': False, 'bull_use_atr': True, 'bull_use_adx': False, 'bull_use_spike': False, 'bull_rsi_required': False, 'bear_strategy': 'breakout', 'bear_bb_std_mult': 1.3138717777897744, 'bear_rsi_os': 27, 'bear_rsi_ob': 52, 'bear_adx_thresh': 10.966365869564244, 'bear_atr_min_pct': 0.004510683009780679, 'bear_atr_max_pct': 0.0762888109155043, 'bear_tp_mult': 1.5677180037527247, 'bear_tsl_mult': 0.7076454390482471, 'bear_time_stop': 282, 'bear_use_sma': True, 'bear_use_ema': False, 'bear_use_atr': True, 'bear_use_adx': True, 'bear_use_spike': False, 'bear_rsi_required': True, 'sideways_strategy': 'breakout', 'sideways_bb_std_mult': 2.6269767430998683, 'sideways_rsi_os': 54, 'sideways_rsi_ob': 89, 'sideways_adx_thresh': 31.00512456457357, 'sideways_atr_min_pct': 0.01472131183453806, 'sideways_atr_max_pct': 0.11795409725920389, 'sideways_tp_mult': 2.825911233854959, 'sideways_tsl_mult': 0.4045463842614378, 'sideways_time_stop': 278, 'sideways_use_sma': False, 'sideways_use_ema': False, 'sideways_use_atr': True, 'sideways_use_adx': True, 'sideways_use_spike': True, 'sideways_rsi_required': False}.
[I 2025-09-01 12:16:03,100] Trial 582 finished with values: [-1000000000.0, 1000000000.0] and parameters: {'p_sma': 38, 'p_std': 32, 'p_atr': 26, 'p_adx': 9, 'rsi_period': 64, 'ema1': 25, 'ema2': 14, 'slip_atr_k': 0.23341768656858825, 'slip_spread_k': 0.4047546840778536, 'spread_hl_frac': 0.04583203428275019, 'bb_std_mult': 1.7863118383077954, 'rsi_os': 31, 'rsi_ob': 80, 'vol_spike': 0.20597069269390322, 'adx_thresh': 7.7355427376569, 'atr_min_pct': 0.023183681398837086, 'atr_max_pct': 0.0770289605216343, 'tp_mult': 2.1453775692982737, 'tsl_mult': 0.054642879146054577, 'strategy': 'mean_reversion', 'time_stop': 33, 'use_sma': False, 'use_atr': True, 'use_adx': True, 'use_ema': True, 'use_spike': False, 'rsi_required': False, 'edge_k': 0.16336186555472332, 'edge_cap': 0.677894763540962, 'bull_strategy': 'mean_reversion', 'bull_bb_std_mult': 1.4559473911034035, 'bull_rsi_os': 55, 'bull_rsi_ob': 61, 'bull_adx_thresh': 33.24422215536306, 'bull_atr_min_pct': 0.017612847043698997, 'bull_atr_max_pct': 0.11239936079868768, 'bull_tp_mult': 1.3276640208443558, 'bull_tsl_mult': 0.6290986153066539, 'bull_time_stop': 150, 'bull_use_sma': False, 'bull_use_ema': False, 'bull_use_atr': True, 'bull_use_adx': False, 'bull_use_spike': False, 'bull_rsi_required': False, 'bear_strategy': 'breakout', 'bear_bb_std_mult': 1.2776542730380074, 'bear_rsi_os': 10, 'bear_rsi_ob': 50, 'bear_adx_thresh': 10.60288006398033, 'bear_atr_min_pct': 0.004648354706545184, 'bear_atr_max_pct': 0.03202321099084231, 'bear_tp_mult': 1.5502672886888427, 'bear_tsl_mult': 0.45613570997629427, 'bear_time_stop': 285, 'bear_use_sma': True, 'bear_use_ema': False, 'bear_use_atr': True, 'bear_use_adx': True, 'bear_use_spike': False, 'bear_rsi_required': True, 'sideways_strategy': 'breakout', 'sideways_bb_std_mult': 1.5315521809591939, 'sideways_rsi_os': 37, 'sideways_rsi_ob': 89, 'sideways_adx_thresh': 32.37271574551513, 'sideways_atr_min_pct': 0.007851405182904562, 'sideways_atr_max_pct': 0.12546381523243688, 'sideways_tp_mult': 2.8377795284812954, 'sideways_tsl_mult': 0.07367806505619556, 'sideways_time_stop': 217, 'sideways_use_sma': False, 'sideways_use_ema': False, 'sideways_use_atr': True, 'sideways_use_adx': True, 'sideways_use_spike': True, 'sideways_rsi_required': False}.
[I 2025-09-01 12:16:41,085] Trial 586 finished with values: [-1000000000.0, 1000000000.0] and parameters: {'p_sma': 27, 'p_std': 34, 'p_atr': 18, 'p_adx': 8, 'rsi_period': 49, 'ema1': 9, 'ema2': 59, 'slip_atr_k': 0.03344147410218073, 'slip_spread_k': 0.7448834699924402, 'spread_hl_frac': 0.03536589012842582, 'bb_std_mult': 0.7147164776944619, 'rsi_os': 31, 'rsi_ob': 50, 'vol_spike': 0.0716489790734801, 'adx_thresh': 22.339389725139398, 'atr_min_pct': 0.009453044404237262, 'atr_max_pct': 0.07816981359570746, 'tp_mult': 2.067423974378128, 'tsl_mult': 0.0882971176621903, 'strategy': 'breakout', 'time_stop': 33, 'use_sma': False, 'use_atr': True, 'use_adx': True, 'use_ema': True, 'use_spike': False, 'rsi_required': False, 'edge_k': 0.20908486066071302, 'edge_cap': 0.1287059503063564, 'bull_strategy': 'mean_reversion', 'bull_bb_std_mult': 1.5948628120163708, 'bull_rsi_os': 14, 'bull_rsi_ob': 75, 'bull_adx_thresh': 5.809592215163014, 'bull_atr_min_pct': 0.016082484455069303, 'bull_atr_max_pct': 0.10784941386783048, 'bull_tp_mult': 1.2795890599994075, 'bull_tsl_mult': 0.2671106802736998, 'bull_time_stop': 105, 'bull_use_sma': False, 'bull_use_ema': False, 'bull_use_atr': True, 'bull_use_adx': False, 'bull_use_spike': False, 'bull_rsi_required': False, 'bear_strategy': 'breakout', 'bear_bb_std_mult': 1.4504346854371883, 'bear_rsi_os': 51, 'bear_rsi_ob': 92, 'bear_adx_thresh': 10.408859029109408, 'bear_atr_min_pct': 0.0021544709295638034, 'bear_atr_max_pct': 0.03260213811140459, 'bear_tp_mult': 1.5450370633699442, 'bear_tsl_mult': 0.1956014014585895, 'bear_time_stop': 269, 'bear_use_sma': True, 'bear_use_ema': False, 'bear_use_atr': True, 'bear_use_adx': True, 'bear_use_spike': False, 'bear_rsi_required': True, 'sideways_strategy': 'breakout', 'sideways_bb_std_mult': 2.8153073531835986, 'sideways_rsi_os': 39, 'sideways_rsi_ob': 90, 'sideways_adx_thresh': 32.38610326375709, 'sideways_atr_min_pct': 0.002920780453483254, 'sideways_atr_max_pct': 0.12506626632566617, 'sideways_tp_mult': 2.882333597684771, 'sideways_tsl_mult': 0.42666479797341916, 'sideways_time_stop': 102, 'sideways_use_sma': False, 'sideways_use_ema': False, 'sideways_use_atr': True, 'sideways_use_adx': True, 'sideways_use_spike': True, 'sideways_rsi_required': False}.
