[I 2025-09-01 11:53:13,867] Trial 451 finished with values: [0.0005845579253112021, 0.006118272270892052] and parameters: {'p_sma': 28, 'p_std': 34, 'p_atr': 19, 'p_adx': 8, 'rsi_period': 48, 'ema1': 23, 'ema2': 17, 'slip_atr_k': 0.03311047684301747, 'slip_spread_k': 0.40945939942686266, 'spread_hl_frac': 0.0007606404469744502, 'bb_std_mult': 0.8007816093102893, 'rsi_os': 28, 'rsi_ob': 52, 'vol_spike': 0.2169938898193595, 'adx_thresh': 22.806149423360697, 'atr_min_pct': 0.02532278503059009, 'atr_max_pct': 0.07346192789665934, 'tp_mult': 2.159959103364821, 'tsl_mult': 0.13269227015512122, 'strategy': 'breakout', 'time_stop': 204, 'use_sma': False, 'use_atr': True, 'use_adx': True, 'use_ema': True, 'use_spike': False, 'rsi_required': False, 'edge_k': 0.27339131359656194, 'edge_cap': 0.12062881214070773, 'bull_strategy': 'mean_reversion', 'bull_bb_std_mult': 1.5172346044764873, 'bull_rsi_os': 49, 'bull_rsi_ob': 49, 'bull_adx_thresh': 6.685109139271788, 'bull_atr_min_pct': 0.01714859783958893, 'bull_atr_max_pct': 0.10476246264137476, 'bull_tp_mult': 1.3909306174463827, 'bull_tsl_mult': 0.5996572978211483, 'bull_time_stop': 189, 'bull_use_sma': False, 'bull_use_ema': False, 'bull_use_atr': True, 'bull_use_adx': False, 'bull_use_spike': False, 'bull_rsi_required': False, 'bear_strategy': 'breakout', 'bear_bb_std_mult': 1.1860230285399451, 'bear_rsi_os': 31, 'bear_rsi_ob': 49, 'bear_adx_thresh': 8.675704961825055, 'bear_atr_min_pct': 0.003810688137393375, 'bear_atr_max_pct': 0.02226895541055205, 'bear_tp_mult': 1.460695980708401, 'bear_tsl_mult': 0.872515395072565, 'bear_time_stop': 286, 'bear_use_sma': True, 'bear_use_ema': False, 'bear_use_atr': True, 'bear_use_adx': True, 'bear_use_spike': False, 'bear_rsi_required': True, 'sideways_strategy': 'breakout', 'sideways_bb_std_mult': 1.859384775828099, 'sideways_rsi_os': 46, 'sideways_rsi_ob': 91, 'sideways_adx_thresh': 31.81018039065296, 'sideways_atr_min_pct': 0.02465557354729947, 'sideways_atr_max_pct': 0.14270094879488365, 'sideways_tp_mult': 2.6983588719230256, 'sideways_tsl_mult': 0.3775188412455632, 'sideways_time_stop': 69, 'sideways_use_sma': False, 'sideways_use_ema': False, 'sideways_use_atr': True, 'sideways_use_adx': True, 'sideways_use_spike': True, 'sideways_rsi_required': False}.
[I 2025-09-01 11:53:14,270] Trial 449 finished with values: [-0.001265370008211586, 0.006270168397840566] and parameters: {'p_sma': 27, 'p_std': 31, 'p_atr': 20, 'p_adx': 8, 'rsi_period': 48, 'ema1': 24, 'ema2': 18, 'slip_atr_k': 0.03300646288552485, 'slip_spread_k': 0.4173370568520988, 'spread_hl_frac': 0.0011169533848517147, 'bb_std_mult': 0.9399275620060854, 'rsi_os': 28, 'rsi_ob': 52, 'vol_spike': 0.20094313498484995, 'adx_thresh': 22.894380899080087, 'atr_min_pct': 0.023787171718930796, 'atr_max_pct': 0.07767719204237984, 'tp_mult': 2.0923689653591784, 'tsl_mult': 0.1503092015566667, 'strategy': 'breakout', 'time_stop': 186, 'use_sma': False, 'use_atr': True, 'use_adx': True, 'use_ema': True, 'use_spike': False, 'rsi_required': False, 'edge_k': 0.3163539071210752, 'edge_cap': 0.10225357905840007, 'bull_strategy': 'mean_reversion', 'bull_bb_std_mult': 1.5374605255039406, 'bull_rsi_os': 38, 'bull_rsi_ob': 48, 'bull_adx_thresh': 6.159314928646131, 'bull_atr_min_pct': 0.018523794847957516, 'bull_atr_max_pct': 0.10592983246265153, 'bull_tp_mult': 1.4146599311190489, 'bull_tsl_mult': 0.5977414267303305, 'bull_time_stop': 146, 'bull_use_sma': False, 'bull_use_ema': False, 'bull_use_atr': True, 'bull_use_adx': False, 'bull_use_spike': False, 'bull_rsi_required': False, 'bear_strategy': 'breakout', 'bear_bb_std_mult': 1.1745328402815565, 'bear_rsi_os': 26, 'bear_rsi_ob': 50, 'bear_adx_thresh': 8.595102115713795, 'bear_atr_min_pct': 0.003637945570513972, 'bear_atr_max_pct': 0.021554889191862752, 'bear_tp_mult': 1.4640830622173397, 'bear_tsl_mult': 0.6346775470984416, 'bear_time_stop': 260, 'bear_use_sma': True, 'bear_use_ema': False, 'bear_use_atr': True, 'bear_use_adx': True, 'bear_use_spike': False, 'bear_rsi_required': True, 'sideways_strategy': 'breakout', 'sideways_bb_std_mult': 1.879665328672888, 'sideways_rsi_os': 43, 'sideways_rsi_ob': 92, 'sideways_adx_thresh': 32.06838763202647, 'sideways_atr_min_pct': 0.023650701322553938, 'sideways_atr_max_pct': 0.14192260288947833, 'sideways_tp_mult': 2.650011864103505, 'sideways_tsl_mult': 0.38417099143487177, 'sideways_time_stop': 77, 'sideways_use_sma': False, 'sideways_use_ema': False, 'sideways_use_atr': True, 'sideways_use_adx': True, 'sideways_use_spike': True, 'sideways_rsi_required': False}.
[I 2025-09-01 11:53:55,586] Trial 455 finished with values: [0.00010637960542725367, 0.005345352747522991] and parameters: {'p_sma': 24, 'p_std': 35, 'p_atr': 21, 'p_adx': 7, 'rsi_period': 47, 'ema1': 26, 'ema2': 19, 'slip_atr_k': 0.032279306049816034, 'slip_spread_k': 0.4241508614084018, 'spread_hl_frac': 0.00014483291708757137, 'bb_std_mult': 0.8239524006096881, 'rsi_os': 30, 'rsi_ob': 52, 'vol_spike': 0.21709396880102108, 'adx_thresh': 23.890901768670332, 'atr_min_pct': 0.0247759732742187, 'atr_max_pct': 0.07676569715878465, 'tp_mult': 2.010223101890597, 'tsl_mult': 0.08232986519835084, 'strategy': 'breakout', 'time_stop': 188, 'use_sma': False, 'use_atr': True, 'use_adx': True, 'use_ema': True, 'use_spike': False, 'rsi_required': False, 'edge_k': 0.15568504683862328, 'edge_cap': 0.060604065605879644, 'bull_strategy': 'mean_reversion', 'bull_bb_std_mult': 1.7651289458828892, 'bull_rsi_os': 42, 'bull_rsi_ob': 48, 'bull_adx_thresh': 6.893700728005847, 'bull_atr_min_pct': 0.01639713010310134, 'bull_atr_max_pct': 0.11507388441030722, 'bull_tp_mult': 1.2540026376722628, 'bull_tsl_mult': 0.6219556473768693, 'bull_time_stop': 172, 'bull_use_sma': False, 'bull_use_ema': False, 'bull_use_atr': True, 'bull_use_adx': False, 'bull_use_spike': False, 'bull_rsi_required': False, 'bear_strategy': 'breakout', 'bear_bb_std_mult': 1.5010867565129276, 'bear_rsi_os': 25, 'bear_rsi_ob': 50, 'bear_adx_thresh': 7.290450731912462, 'bear_atr_min_pct': 0.003762111868278685, 'bear_atr_max_pct': 0.012145238536386145, 'bear_tp_mult': 1.4684603723898093, 'bear_tsl_mult': 0.6290521094421755, 'bear_time_stop': 292, 'bear_use_sma': True, 'bear_use_ema': False, 'bear_use_atr': True, 'bear_use_adx': True, 'bear_use_spike': False, 'bear_rsi_required': True, 'sideways_strategy': 'breakout', 'sideways_bb_std_mult': 1.939564644221474, 'sideways_rsi_os': 44, 'sideways_rsi_ob': 92, 'sideways_adx_thresh': 33.21154408078059, 'sideways_atr_min_pct': 0.026520583840963296, 'sideways_atr_max_pct': 0.133723517326203, 'sideways_tp_mult': 2.574649596272303, 'sideways_tsl_mult': 0.3224697023795745, 'sideways_time_stop': 83, 'sideways_use_sma': False, 'sideways_use_ema': False, 'sideways_use_atr': True, 'sideways_use_adx': True, 'sideways_use_spike': True, 'sideways_rsi_required': False}.
[I 2025-09-01 11:53:56,153] Trial 454 finished with values: [-0.0019895855113863936, 0.006010975419178653] and parameters: {'p_sma': 23, 'p_std': 31, 'p_atr': 20, 'p_adx': 7, 'rsi_period': 47, 'ema1': 25, 'ema2': 19, 'slip_atr_k': 0.030441218834097547, 'slip_spread_k': 0.4254207079908043, 'spread_hl_frac': 0.000145906559607925, 'bb_std_mult': 0.8197297876024134, 'rsi_os': 28, 'rsi_ob': 51, 'vol_spike': 0.21525656209012206, 'adx_thresh': 24.055779588803336, 'atr_min_pct': 0.024693525485581957, 'atr_max_pct': 0.0774158379028704, 'tp_mult': 2.008744957106775, 'tsl_mult': 0.08000283593777764, 'strategy': 'breakout', 'time_stop': 186, 'use_sma': False, 'use_atr': True, 'use_adx': True, 'use_ema': True, 'use_spike': False, 'rsi_required': False, 'edge_k': 0.15251552406843716, 'edge_cap': 0.06756442742241384, 'bull_strategy': 'mean_reversion', 'bull_bb_std_mult': 1.7554033978620402, 'bull_rsi_os': 38, 'bull_rsi_ob': 50, 'bull_adx_thresh': 6.929205645146978, 'bull_atr_min_pct': 0.016498151764647386, 'bull_atr_max_pct': 0.11578602706597944, 'bull_tp_mult': 1.0904324752526702, 'bull_tsl_mult': 0.6216593506934396, 'bull_time_stop': 172, 'bull_use_sma': False, 'bull_use_ema': False, 'bull_use_atr': True, 'bull_use_adx': False, 'bull_use_spike': False, 'bull_rsi_required': False, 'bear_strategy': 'breakout', 'bear_bb_std_mult': 1.332651601572076, 'bear_rsi_os': 31, 'bear_rsi_ob': 50, 'bear_adx_thresh': 6.994131514306081, 'bear_atr_min_pct': 0.0038350983929110877, 'bear_atr_max_pct': 0.017797776752342623, 'bear_tp_mult': 1.477288821273102, 'bear_tsl_mult': 0.5755708731104289, 'bear_time_stop': 298, 'bear_use_sma': True, 'bear_use_ema': False, 'bear_use_atr': True, 'bear_use_adx': True, 'bear_use_spike': False, 'bear_rsi_required': True, 'sideways_strategy': 'breakout', 'sideways_bb_std_mult': 1.9201663665724855, 'sideways_rsi_os': 46, 'sideways_rsi_ob': 91, 'sideways_adx_thresh': 33.14473283388805, 'sideways_atr_min_pct': 0.02680263911289115, 'sideways_atr_max_pct': 0.13444393047621728, 'sideways_tp_mult': 2.873949413015003, 'sideways_tsl_mult': 0.2986725624078325, 'sideways_time_stop': 82, 'sideways_use_sma': False, 'sideways_use_ema': False, 'sideways_use_atr': True, 'sideways_use_adx': True, 'sideways_use_spike': True, 'sideways_rsi_required': False}.
[I 2025-09-01 11:53:56,160] Trial 452 finished with values: [-0.009391928139925732, 0.01248753282975018] and parameters: {'p_sma': 27, 'p_std': 34, 'p_atr': 20, 'p_adx': 8, 'rsi_period': 48, 'ema1': 23, 'ema2': 17, 'slip_atr_k': 0.03061456000484821, 'slip_spread_k': 0.41051730370329764, 'spread_hl_frac': 0.0007787606058761826, 'bb_std_mult': 0.9465109319463544, 'rsi_os': 28, 'rsi_ob': 51, 'vol_spike': 0.21611488930398084, 'adx_thresh': 22.756978998952544, 'atr_min_pct': 0.02541511401100445, 'atr_max_pct': 0.07694441432224917, 'tp_mult': 2.1067857706910855, 'tsl_mult': 0.1456583781825881, 'strategy': 'breakout', 'time_stop': 203, 'use_sma': False, 'use_atr': True, 'use_adx': True, 'use_ema': True, 'use_spike': False, 'rsi_required': False, 'edge_k': 0.26823473498494776, 'edge_cap': 0.16556463520277126, 'bull_strategy': 'mean_reversion', 'bull_bb_std_mult': 1.5514467740863784, 'bull_rsi_os': 38, 'bull_rsi_ob': 48, 'bull_adx_thresh': 6.225883543613886, 'bull_atr_min_pct': 0.018381953683146417, 'bull_atr_max_pct': 0.10538706852329213, 'bull_tp_mult': 1.433071560804856, 'bull_tsl_mult': 0.5836024206988729, 'bull_time_stop': 183, 'bull_use_sma': False, 'bull_use_ema': False, 'bull_use_atr': True, 'bull_use_adx': False, 'bull_use_spike': False, 'bull_rsi_required': False, 'bear_strategy': 'breakout', 'bear_bb_std_mult': 1.2158861948222215, 'bear_rsi_os': 31, 'bear_rsi_ob': 49, 'bear_adx_thresh': 8.809781703101894, 'bear_atr_min_pct': 0.003059151286767761, 'bear_atr_max_pct': 0.02416671548688945, 'bear_tp_mult': 1.4686109962364187, 'bear_tsl_mult': 0.5778241076453577, 'bear_time_stop': 279, 'bear_use_sma': True, 'bear_use_ema': False, 'bear_use_atr': True, 'bear_use_adx': True, 'bear_use_spike': False, 'bear_rsi_required': True, 'sideways_strategy': 'breakout', 'sideways_bb_std_mult': 1.8876645618321513, 'sideways_rsi_os': 44, 'sideways_rsi_ob': 91, 'sideways_adx_thresh': 33.12653852483101, 'sideways_atr_min_pct': 0.024433664894512614, 'sideways_atr_max_pct': 0.141757962798061, 'sideways_tp_mult': 2.809976060601334, 'sideways_tsl_mult': 0.3925750630740721, 'sideways_time_stop': 70, 'sideways_use_sma': False, 'sideways_use_ema': False, 'sideways_use_atr': True, 'sideways_use_adx': True, 'sideways_use_spike': True, 'sideways_rsi_required': False}.
[I 2025-09-01 11:53:56,345] Trial 453 finished with values: [-0.0010785904520462797, 0.009000881925843498] and parameters: {'p_sma': 27, 'p_std': 34, 'p_atr': 19, 'p_adx': 8, 'rsi_period': 49, 'ema1': 23, 'ema2': 17, 'slip_atr_k': 0.03074794532027187, 'slip_spread_k': 0.40438313172404255, 'spread_hl_frac': 0.00015626044466926156, 'bb_std_mult': 0.8308301125706297, 'rsi_os': 28, 'rsi_ob': 47, 'vol_spike': 0.21710166378672754, 'adx_thresh': 23.10031326059231, 'atr_min_pct': 0.025571489713663784, 'atr_max_pct': 0.0769152001458617, 'tp_mult': 2.098313867767451, 'tsl_mult': 0.08774860770274673, 'strategy': 'breakout', 'time_stop': 199, 'use_sma': False, 'use_atr': True, 'use_adx': True, 'use_ema': True, 'use_spike': False, 'rsi_required': False, 'edge_k': 0.2815142636103457, 'edge_cap': 0.1683854309187712, 'bull_strategy': 'mean_reversion', 'bull_bb_std_mult': 1.5248141374487147, 'bull_rsi_os': 48, 'bull_rsi_ob': 48, 'bull_adx_thresh': 6.722945550836748, 'bull_atr_min_pct': 0.018960722573187837, 'bull_atr_max_pct': 0.10642497429789112, 'bull_tp_mult': 1.254225281253372, 'bull_tsl_mult': 0.6174314415556663, 'bull_time_stop': 145, 'bull_use_sma': False, 'bull_use_ema': False, 'bull_use_atr': True, 'bull_use_adx': False, 'bull_use_spike': False, 'bull_rsi_required': True, 'bear_strategy': 'breakout', 'bear_bb_std_mult': 1.1757225921474572, 'bear_rsi_os': 25, 'bear_rsi_ob': 49, 'bear_adx_thresh': 8.765653801756088, 'bear_atr_min_pct': 0.003660935639263755, 'bear_atr_max_pct': 0.024094386850281587, 'bear_tp_mult': 1.4668245172121517, 'bear_tsl_mult': 0.5679579134601789, 'bear_time_stop': 294, 'bear_use_sma': True, 'bear_use_ema': False, 'bear_use_atr': True, 'bear_use_adx': True, 'bear_use_spike': False, 'bear_rsi_required': True, 'sideways_strategy': 'breakout', 'sideways_bb_std_mult': 1.8950405737774763, 'sideways_rsi_os': 44, 'sideways_rsi_ob': 92, 'sideways_adx_thresh': 33.14787396334142, 'sideways_atr_min_pct': 0.023572394845229605, 'sideways_atr_max_pct': 0.1403473810341003, 'sideways_tp_mult': 2.814878036092741, 'sideways_tsl_mult': 0.387091826461024, 'sideways_time_stop': 77, 'sideways_use_sma': False, 'sideways_use_ema': False, 'sideways_use_atr': True, 'sideways_use_adx': True, 'sideways_use_spike': True, 'sideways_rsi_required': False}.
[I 2025-09-01 11:54:36,721] Trial 458 finished with values: [-0.006860441531926109, 0.008809092357887452] and parameters: {'p_sma': 24, 'p_std': 34, 'p_atr': 19, 'p_adx': 7, 'rsi_period': 58, 'ema1': 24, 'ema2': 16, 'slip_atr_k': 0.02011448627067399, 'slip_spread_k': 0.39809072611232843, 'spread_hl_frac': 0.0019378024139660372, 'bb_std_mult': 0.8687728979359792, 'rsi_os': 29, 'rsi_ob': 47, 'vol_spike': 0.1849132973989595, 'adx_thresh': 23.325822886809014, 'atr_min_pct': 0.02485051320420795, 'atr_max_pct': 0.07233627923283027, 'tp_mult': 2.1500248811224716, 'tsl_mult': 0.09039521726816782, 'strategy': 'breakout', 'time_stop': 186, 'use_sma': False, 'use_atr': True, 'use_adx': True, 'use_ema': True, 'use_spike': False, 'rsi_required': False, 'edge_k': 0.26742932847308687, 'edge_cap': 0.12841357318746993, 'bull_strategy': 'mean_reversion', 'bull_bb_std_mult': 1.674892113749574, 'bull_rsi_os': 49, 'bull_rsi_ob': 53, 'bull_adx_thresh': 6.821897563122423, 'bull_atr_min_pct': 0.018936144538624113, 'bull_atr_max_pct': 0.11726186054459303, 'bull_tp_mult': 1.254458789547116, 'bull_tsl_mult': 0.6200186075190443, 'bull_time_stop': 85, 'bull_use_sma': False, 'bull_use_ema': False, 'bull_use_atr': False, 'bull_use_adx': False, 'bull_use_spike': False, 'bull_rsi_required': True, 'bear_strategy': 'breakout', 'bear_bb_std_mult': 1.1651506726045349, 'bear_rsi_os': 25, 'bear_rsi_ob': 49, 'bear_adx_thresh': 8.541912059190498, 'bear_atr_min_pct': 0.0026963918185280832, 'bear_atr_max_pct': 0.012123563186699118, 'bear_tp_mult': 1.607714056747201, 'bear_tsl_mult': 0.5346033664201837, 'bear_time_stop': 295, 'bear_use_sma': True, 'bear_use_ema': False, 'bear_use_atr': True, 'bear_use_adx': True, 'bear_use_spike': False, 'bear_rsi_required': True, 'sideways_strategy': 'breakout', 'sideways_bb_std_mult': 1.8454552541529026, 'sideways_rsi_os': 41, 'sideways_rsi_ob': 92, 'sideways_adx_thresh': 32.6301899568621, 'sideways_atr_min_pct': 0.009847498027351721, 'sideways_atr_max_pct': 0.1342811685530348, 'sideways_tp_mult': 2.716280774230444, 'sideways_tsl_mult': 0.38519702399729727, 'sideways_time_stop': 81, 'sideways_use_sma': False, 'sideways_use_ema': False, 'sideways_use_atr': True, 'sideways_use_adx': True, 'sideways_use_spike': True, 'sideways_rsi_required': False}.
[I 2025-09-01 11:54:36,937] Trial 457 finished with values: [-0.01040910504740511, 0.014318893904621181] and parameters: {'p_sma': 24, 'p_std': 34, 'p_atr': 19, 'p_adx': 7, 'rsi_period': 50, 'ema1': 24, 'ema2': 16, 'slip_atr_k': 0.020257645065210616, 'slip_spread_k': 0.39541208399842864, 'spread_hl_frac': 0.0018524494528435614, 'bb_std_mult': 0.8029858045217697, 'rsi_os': 29, 'rsi_ob': 47, 'vol_spike': 0.1911075242806558, 'adx_thresh': 23.214587139853595, 'atr_min_pct': 0.024787876381206088, 'atr_max_pct': 0.07286078747401845, 'tp_mult': 2.1417768039404366, 'tsl_mult': 0.08622141151752236, 'strategy': 'breakout', 'time_stop': 189, 'use_sma': False, 'use_atr': True, 'use_adx': True, 'use_ema': True, 'use_spike': False, 'rsi_required': False, 'edge_k': 0.2887251698162435, 'edge_cap': 0.15588061805687545, 'bull_strategy': 'mean_reversion', 'bull_bb_std_mult': 1.6865256465745095, 'bull_rsi_os': 48, 'bull_rsi_ob': 53, 'bull_adx_thresh': 5.43197116996844, 'bull_atr_min_pct': 0.01731833605767985, 'bull_atr_max_pct': 0.11538972537099633, 'bull_tp_mult': 1.377403367966838, 'bull_tsl_mult': 0.6112761710091204, 'bull_time_stop': 78, 'bull_use_sma': False, 'bull_use_ema': False, 'bull_use_atr': False, 'bull_use_adx': False, 'bull_use_spike': False, 'bull_rsi_required': True, 'bear_strategy': 'breakout', 'bear_bb_std_mult': 1.5159805579859025, 'bear_rsi_os': 25, 'bear_rsi_ob': 49, 'bear_adx_thresh': 8.696779110855907, 'bear_atr_min_pct': 0.0026056608697174644, 'bear_atr_max_pct': 0.025422104307206005, 'bear_tp_mult': 1.5518205953187483, 'bear_tsl_mult': 0.6418023127075556, 'bear_time_stop': 293, 'bear_use_sma': True, 'bear_use_ema': False, 'bear_use_atr': True, 'bear_use_adx': True, 'bear_use_spike': False, 'bear_rsi_required': True, 'sideways_strategy': 'breakout', 'sideways_bb_std_mult': 1.8433331100116552, 'sideways_rsi_os': 41, 'sideways_rsi_ob': 92, 'sideways_adx_thresh': 32.725817750333455, 'sideways_atr_min_pct': 0.02443190132356837, 'sideways_atr_max_pct': 0.13934699142418425, 'sideways_tp_mult': 2.785955201243275, 'sideways_tsl_mult': 0.3266574083236239, 'sideways_time_stop': 82, 'sideways_use_sma': False, 'sideways_use_ema': False, 'sideways_use_atr': True, 'sideways_use_adx': True, 'sideways_use_spike': True, 'sideways_rsi_required': False}.
[I 2025-09-01 11:54:37,425] Trial 459 finished with values: [-0.010059034316892812, 0.012091089485465977] and parameters: {'p_sma': 28, 'p_std': 35, 'p_atr': 19, 'p_adx': 7, 'rsi_period': 58, 'ema1': 24, 'ema2': 16, 'slip_atr_k': 0.019879695683352922, 'slip_spread_k': 0.38906635678781387, 'spread_hl_frac': 0.0024043368323129746, 'bb_std_mult': 0.7732998402850189, 'rsi_os': 29, 'rsi_ob': 46, 'vol_spike': 0.19015037113720226, 'adx_thresh': 23.414654747017543, 'atr_min_pct': 0.024488898882101588, 'atr_max_pct': 0.07250045378305492, 'tp_mult': 2.1622734564536366, 'tsl_mult': 0.04181924502718165, 'strategy': 'breakout', 'time_stop': 189, 'use_sma': False, 'use_atr': True, 'use_adx': True, 'use_ema': True, 'use_spike': False, 'rsi_required': False, 'edge_k': 0.2121255525122805, 'edge_cap': 0.15021158816352173, 'bull_strategy': 'mean_reversion', 'bull_bb_std_mult': 1.6836748780608533, 'bull_rsi_os': 49, 'bull_rsi_ob': 53, 'bull_adx_thresh': 5.081673937288822, 'bull_atr_min_pct': 0.017518593025733723, 'bull_atr_max_pct': 0.11862276137420104, 'bull_tp_mult': 1.3707649562566429, 'bull_tsl_mult': 0.6145661489862321, 'bull_time_stop': 153, 'bull_use_sma': False, 'bull_use_ema': False, 'bull_use_atr': False, 'bull_use_adx': False, 'bull_use_spike': False, 'bull_rsi_required': True, 'bear_strategy': 'breakout', 'bear_bb_std_mult': 1.3211827803622236, 'bear_rsi_os': 25, 'bear_rsi_ob': 49, 'bear_adx_thresh': 8.571834495759068, 'bear_atr_min_pct': 0.0026242658323349074, 'bear_atr_max_pct': 0.0240625883724741, 'bear_tp_mult': 1.6058628679043503, 'bear_tsl_mult': 0.5475045265838231, 'bear_time_stop': 280, 'bear_use_sma': True, 'bear_use_ema': False, 'bear_use_atr': True, 'bear_use_adx': True, 'bear_use_spike': False, 'bear_rsi_required': True, 'sideways_strategy': 'breakout', 'sideways_bb_std_mult': 1.844796597448374, 'sideways_rsi_os': 41, 'sideways_rsi_ob': 90, 'sideways_adx_thresh': 32.424643826771366, 'sideways_atr_min_pct': 0.024399937941924958, 'sideways_atr_max_pct': 0.1340930130171238, 'sideways_tp_mult': 2.709939197086978, 'sideways_tsl_mult': 0.3329830766639579, 'sideways_time_stop': 85, 'sideways_use_sma': False, 'sideways_use_ema': False, 'sideways_use_atr': True, 'sideways_use_adx': True, 'sideways_use_spike': True, 'sideways_rsi_required': False}.
