[I 2025-09-01 11:54:37,642] Trial 456 finished with values: [-0.008468508248227535, 0.013912169678107926] and parameters: {'p_sma': 28, 'p_std': 34, 'p_atr': 19, 'p_adx': 7, 'rsi_period': 50, 'ema1': 23, 'ema2': 16, 'slip_atr_k': 0.0291753144346892, 'slip_spread_k': 0.39853276420413597, 'spread_hl_frac': 0.0004864931642231948, 'bb_std_mult': 0.8157278945742141, 'rsi_os': 28, 'rsi_ob': 53, 'vol_spike': 0.21564657199123816, 'adx_thresh': 23.16791018377616, 'atr_min_pct': 0.024772472111134085, 'atr_max_pct': 0.07299025707879656, 'tp_mult': 2.003377728670495, 'tsl_mult': 0.07999825313856586, 'strategy': 'breakout', 'time_stop': 198, 'use_sma': False, 'use_atr': True, 'use_adx': True, 'use_ema': True, 'use_spike': False, 'rsi_required': False, 'edge_k': 0.28154740310792586, 'edge_cap': 0.1527744564686803, 'bull_strategy': 'mean_reversion', 'bull_bb_std_mult': 1.679047468530178, 'bull_rsi_os': 48, 'bull_rsi_ob': 50, 'bull_adx_thresh': 6.839065398553978, 'bull_atr_min_pct': 0.0189693935761192, 'bull_atr_max_pct': 0.11526601760975536, 'bull_tp_mult': 1.3887994766037615, 'bull_tsl_mult': 0.6235556701081265, 'bull_time_stop': 153, 'bull_use_sma': False, 'bull_use_ema': False, 'bull_use_atr': True, 'bull_use_adx': False, 'bull_use_spike': False, 'bull_rsi_required': True, 'bear_strategy': 'breakout', 'bear_bb_std_mult': 1.1953280834375044, 'bear_rsi_os': 25, 'bear_rsi_ob': 49, 'bear_adx_thresh': 9.01766275593136, 'bear_atr_min_pct': 0.002872759538230185, 'bear_atr_max_pct': 0.02416493252775378, 'bear_tp_mult': 1.6080842294759, 'bear_tsl_mult': 0.8580779436560313, 'bear_time_stop': 294, 'bear_use_sma': True, 'bear_use_ema': False, 'bear_use_atr': True, 'bear_use_adx': True, 'bear_use_spike': False, 'bear_rsi_required': True, 'sideways_strategy': 'breakout', 'sideways_bb_std_mult': 1.8471136632454999, 'sideways_rsi_os': 41, 'sideways_rsi_ob': 91, 'sideways_adx_thresh': 33.06025063338469, 'sideways_atr_min_pct': 0.024430101818656496, 'sideways_atr_max_pct': 0.13389651913914996, 'sideways_tp_mult': 2.792903982825474, 'sideways_tsl_mult': 0.29715668686512187, 'sideways_time_stop': 82, 'sideways_use_sma': False, 'sideways_use_ema': False, 'sideways_use_atr': True, 'sideways_use_adx': True, 'sideways_use_spike': True, 'sideways_rsi_required': False}.
[I 2025-09-01 11:55:18,226] Trial 463 finished with values: [-1000000000.0, 1000000000.0] and parameters: {'p_sma': 25, 'p_std': 33, 'p_atr': 20, 'p_adx': 8, 'rsi_period': 50, 'ema1': 24, 'ema2': 17, 'slip_atr_k': 0.0404501886250086, 'slip_spread_k': 0.4259840750027627, 'spread_hl_frac': 0.0032043812859941095, 'bb_std_mult': 1.0486841723508724, 'rsi_os': 30, 'rsi_ob': 49, 'vol_spike': 0.20764402794616188, 'adx_thresh': 22.897139072852784, 'atr_min_pct': 0.0238809423190797, 'atr_max_pct': 0.0839613560603441, 'tp_mult': 2.1730926835638242, 'tsl_mult': 0.12929360372354282, 'strategy': 'breakout', 'time_stop': 180, 'use_sma': False, 'use_atr': True, 'use_adx': True, 'use_ema': True, 'use_spike': False, 'rsi_required': False, 'edge_k': 0.3325082268613581, 'edge_cap': 0.08917125586839142, 'bull_strategy': 'mean_reversion', 'bull_bb_std_mult': 1.5969447290114807, 'bull_rsi_os': 47, 'bull_rsi_ob': 51, 'bull_adx_thresh': 5.575300983677874, 'bull_atr_min_pct': 0.017713441512954592, 'bull_atr_max_pct': 0.11171631695358611, 'bull_tp_mult': 1.2960070320345092, 'bull_tsl_mult': 0.6456664592968546, 'bull_time_stop': 168, 'bull_use_sma': False, 'bull_use_ema': False, 'bull_use_atr': True, 'bull_use_adx': False, 'bull_use_spike': False, 'bull_rsi_required': False, 'bear_strategy': 'mean_reversion', 'bear_bb_std_mult': 1.247512180195459, 'bear_rsi_os': 26, 'bear_rsi_ob': 51, 'bear_adx_thresh': 7.557311624572528, 'bear_atr_min_pct': 0.004531344796974797, 'bear_atr_max_pct': 0.08998362696756312, 'bear_tp_mult': 1.5466561269741654, 'bear_tsl_mult': 0.8784641467379151, 'bear_time_stop': 271, 'bear_use_sma': True, 'bear_use_ema': False, 'bear_use_atr': True, 'bear_use_adx': True, 'bear_use_spike': False, 'bear_rsi_required': True, 'sideways_strategy': 'breakout', 'sideways_bb_std_mult': 1.948217555334802, 'sideways_rsi_os': 42, 'sideways_rsi_ob': 90, 'sideways_adx_thresh': 30.2937336385584, 'sideways_atr_min_pct': 0.013735740507232978, 'sideways_atr_max_pct': 0.12795698676884587, 'sideways_tp_mult': 2.7048449767123195, 'sideways_tsl_mult': 0.36576364832158514, 'sideways_time_stop': 61, 'sideways_use_sma': False, 'sideways_use_ema': False, 'sideways_use_atr': True, 'sideways_use_adx': True, 'sideways_use_spike': True, 'sideways_rsi_required': False}.
[I 2025-09-01 11:55:18,991] Trial 460 finished with values: [-1000000000.0, 1000000000.0] and parameters: {'p_sma': 25, 'p_std': 35, 'p_atr': 19, 'p_adx': 7, 'rsi_period': 50, 'ema1': 23, 'ema2': 16, 'slip_atr_k': 0.038089752780156874, 'slip_spread_k': 0.4353759116773363, 'spread_hl_frac': 0.002038616728211008, 'bb_std_mult': 1.021753070605753, 'rsi_os': 30, 'rsi_ob': 53, 'vol_spike': 0.20797986615466962, 'adx_thresh': 22.553859955638014, 'atr_min_pct': 0.024089461943516674, 'atr_max_pct': 0.08191119388284854, 'tp_mult': 2.032458226881763, 'tsl_mult': 0.041515733644233006, 'strategy': 'breakout', 'time_stop': 180, 'use_sma': False, 'use_atr': True, 'use_adx': True, 'use_ema': True, 'use_spike': False, 'rsi_required': False, 'edge_k': 0.3363780451659417, 'edge_cap': 0.09025692875350083, 'bull_strategy': 'mean_reversion', 'bull_bb_std_mult': 1.6169841408988808, 'bull_rsi_os': 49, 'bull_rsi_ob': 50, 'bull_adx_thresh': 5.410355447548699, 'bull_atr_min_pct': 0.01794902302899321, 'bull_atr_max_pct': 0.10896159161991215, 'bull_tp_mult': 1.3852026893620293, 'bull_tsl_mult': 0.6537198942587649, 'bull_time_stop': 168, 'bull_use_sma': False, 'bull_use_ema': False, 'bull_use_atr': True, 'bull_use_adx': False, 'bull_use_spike': False, 'bull_rsi_required': False, 'bear_strategy': 'mean_reversion', 'bear_bb_std_mult': 1.2673154351896936, 'bear_rsi_os': 26, 'bear_rsi_ob': 50, 'bear_adx_thresh': 7.6133387540828625, 'bear_atr_min_pct': 0.00446187598505892, 'bear_atr_max_pct': 0.024288840822710364, 'bear_tp_mult': 1.5868022397565276, 'bear_tsl_mult': 0.8788716940548679, 'bear_time_stop': 280, 'bear_use_sma': True, 'bear_use_ema': False, 'bear_use_atr': True, 'bear_use_adx': True, 'bear_use_spike': False, 'bear_rsi_required': True, 'sideways_strategy': 'breakout', 'sideways_bb_std_mult': 1.9591978063835003, 'sideways_rsi_os': 42, 'sideways_rsi_ob': 90, 'sideways_adx_thresh': 31.58794712360013, 'sideways_atr_min_pct': 0.013603572234805537, 'sideways_atr_max_pct': 0.13359181718665014, 'sideways_tp_mult': 2.708226298876736, 'sideways_tsl_mult': 0.3576555746070011, 'sideways_time_stop': 88, 'sideways_use_sma': False, 'sideways_use_ema': False, 'sideways_use_atr': True, 'sideways_use_adx': True, 'sideways_use_spike': True, 'sideways_rsi_required': False}.
[I 2025-09-01 11:55:19,770] Trial 462 finished with values: [-1000000000.0, 1000000000.0] and parameters: {'p_sma': 25, 'p_std': 32, 'p_atr': 20, 'p_adx': 8, 'rsi_period': 50, 'ema1': 23, 'ema2': 17, 'slip_atr_k': 0.0377590514090567, 'slip_spread_k': 0.4298737797051559, 'spread_hl_frac': 0.0009905021830108125, 'bb_std_mult': 1.0274767594413472, 'rsi_os': 30, 'rsi_ob': 53, 'vol_spike': 0.20970484483368793, 'adx_thresh': 9.023057638404534, 'atr_min_pct': 0.02415486142848802, 'atr_max_pct': 0.08473654745940881, 'tp_mult': 2.052179102526158, 'tsl_mult': 0.07139899561686378, 'strategy': 'breakout', 'time_stop': 182, 'use_sma': False, 'use_atr': True, 'use_adx': True, 'use_ema': True, 'use_spike': False, 'rsi_required': False, 'edge_k': 0.33018057073472384, 'edge_cap': 0.06260939159116721, 'bull_strategy': 'mean_reversion', 'bull_bb_std_mult': 1.58741259019742, 'bull_rsi_os': 47, 'bull_rsi_ob': 50, 'bull_adx_thresh': 5.568669544408972, 'bull_atr_min_pct': 0.0179962489210505, 'bull_atr_max_pct': 0.10983505784320809, 'bull_tp_mult': 1.2931360152057043, 'bull_tsl_mult': 0.5867029607138652, 'bull_time_stop': 171, 'bull_use_sma': False, 'bull_use_ema': False, 'bull_use_atr': True, 'bull_use_adx': False, 'bull_use_spike': False, 'bull_rsi_required': False, 'bear_strategy': 'mean_reversion', 'bear_bb_std_mult': 1.2306905790796938, 'bear_rsi_os': 26, 'bear_rsi_ob': 50, 'bear_adx_thresh': 7.705132832208374, 'bear_atr_min_pct': 0.004175507716766127, 'bear_atr_max_pct': 0.02215865681303886, 'bear_tp_mult': 1.5309197155947427, 'bear_tsl_mult': 0.8775158913387814, 'bear_time_stop': 288, 'bear_use_sma': True, 'bear_use_ema': False, 'bear_use_atr': True, 'bear_use_adx': True, 'bear_use_spike': False, 'bear_rsi_required': True, 'sideways_strategy': 'breakout', 'sideways_bb_std_mult': 1.9427251638712557, 'sideways_rsi_os': 42, 'sideways_rsi_ob': 91, 'sideways_adx_thresh': 31.77669147832477, 'sideways_atr_min_pct': 0.023564779526091623, 'sideways_atr_max_pct': 0.13767645073213725, 'sideways_tp_mult': 2.7797264065931957, 'sideways_tsl_mult': 0.36281331155810903, 'sideways_time_stop': 89, 'sideways_use_sma': False, 'sideways_use_ema': False, 'sideways_use_atr': True, 'sideways_use_adx': True, 'sideways_use_spike': True, 'sideways_rsi_required': False}.
[I 2025-09-01 11:55:20,410] Trial 461 finished with values: [-1000000000.0, 1000000000.0] and parameters: {'p_sma': 25, 'p_std': 35, 'p_atr': 19, 'p_adx': 7, 'rsi_period': 50, 'ema1': 23, 'ema2': 16, 'slip_atr_k': 0.02521582462294625, 'slip_spread_k': 0.4296923385948597, 'spread_hl_frac': 0.0032691663984196766, 'bb_std_mult': 1.032360141946577, 'rsi_os': 30, 'rsi_ob': 48, 'vol_spike': 0.20823728964901667, 'adx_thresh': 22.835536780419794, 'atr_min_pct': 0.023749530659341846, 'atr_max_pct': 0.0847260641359164, 'tp_mult': 2.0291974186207047, 'tsl_mult': 0.042641064704605304, 'strategy': 'breakout', 'time_stop': 181, 'use_sma': False, 'use_atr': True, 'use_adx': True, 'use_ema': True, 'use_spike': False, 'rsi_required': False, 'edge_k': 0.20712699328069017, 'edge_cap': 0.06272148339868085, 'bull_strategy': 'mean_reversion', 'bull_bb_std_mult': 1.6438224481378125, 'bull_rsi_os': 47, 'bull_rsi_ob': 50, 'bull_adx_thresh': 5.462704675180747, 'bull_atr_min_pct': 0.01770572540044877, 'bull_atr_max_pct': 0.11081677390627676, 'bull_tp_mult': 1.3670929051860554, 'bull_tsl_mult': 0.5886839441244538, 'bull_time_stop': 156, 'bull_use_sma': False, 'bull_use_ema': False, 'bull_use_atr': True, 'bull_use_adx': False, 'bull_use_spike': False, 'bull_rsi_required': False, 'bear_strategy': 'mean_reversion', 'bear_bb_std_mult': 1.324632998446034, 'bear_rsi_os': 26, 'bear_rsi_ob': 50, 'bear_adx_thresh': 7.6103291045618455, 'bear_atr_min_pct': 0.004526438723116929, 'bear_atr_max_pct': 0.02391155033182171, 'bear_tp_mult': 1.539205175522945, 'bear_tsl_mult': 0.7570127745892834, 'bear_time_stop': 270, 'bear_use_sma': True, 'bear_use_ema': False, 'bear_use_atr': True, 'bear_use_adx': True, 'bear_use_spike': False, 'bear_rsi_required': True, 'sideways_strategy': 'breakout', 'sideways_bb_std_mult': 1.9486159218332015, 'sideways_rsi_os': 42, 'sideways_rsi_ob': 90, 'sideways_adx_thresh': 31.845291667627258, 'sideways_atr_min_pct': 0.023576646232063233, 'sideways_atr_max_pct': 0.13355175025070512, 'sideways_tp_mult': 2.7089556615039037, 'sideways_tsl_mult': 0.36120615072700396, 'sideways_time_stop': 62, 'sideways_use_sma': False, 'sideways_use_ema': False, 'sideways_use_atr': True, 'sideways_use_adx': True, 'sideways_use_spike': True, 'sideways_rsi_required': False}.
[I 2025-09-01 11:56:00,723] Trial 464 finished with values: [-0.008818726444191127, 0.010604908788786744] and parameters: {'p_sma': 25, 'p_std': 35, 'p_atr': 19, 'p_adx': 15, 'rsi_period': 47, 'ema1': 23, 'ema2': 15, 'slip_atr_k': 0.036245546226207064, 'slip_spread_k': 0.43524917077100994, 'spread_hl_frac': 0.0013044158260097005, 'bb_std_mult': 0.8862954607126524, 'rsi_os': 30, 'rsi_ob': 48, 'vol_spike': 0.20035855777803765, 'adx_thresh': 22.455870494077647, 'atr_min_pct': 0.023079191841365955, 'atr_max_pct': 0.08031801308626382, 'tp_mult': 2.0493028645085354, 'tsl_mult': 0.05921849113399476, 'strategy': 'breakout', 'time_stop': 182, 'use_sma': False, 'use_atr': True, 'use_adx': True, 'use_ema': True, 'use_spike': False, 'rsi_required': False, 'edge_k': 0.17747563660926954, 'edge_cap': 0.06020683222049367, 'bull_strategy': 'mean_reversion', 'bull_bb_std_mult': 1.6037427093217107, 'bull_rsi_os': 49, 'bull_rsi_ob': 50, 'bull_adx_thresh': 5.0118150409595845, 'bull_atr_min_pct': 0.016137972182420274, 'bull_atr_max_pct': 0.10838590204282951, 'bull_tp_mult': 1.3502183663549325, 'bull_tsl_mult': 0.5827884072197633, 'bull_time_stop': 188, 'bull_use_sma': False, 'bull_use_ema': False, 'bull_use_atr': True, 'bull_use_adx': False, 'bull_use_spike': False, 'bull_rsi_required': False, 'bear_strategy': 'breakout', 'bear_bb_std_mult': 1.3127763320781627, 'bear_rsi_os': 26, 'bear_rsi_ob': 50, 'bear_adx_thresh': 8.053154682535594, 'bear_atr_min_pct': 0.0034125931796061, 'bear_atr_max_pct': 0.0220836796145285, 'bear_tp_mult': 1.530931473968326, 'bear_tsl_mult': 0.7593257841163543, 'bear_time_stop': 269, 'bear_use_sma': True, 'bear_use_ema': False, 'bear_use_atr': True, 'bear_use_adx': True, 'bear_use_spike': False, 'bear_rsi_required': True, 'sideways_strategy': 'breakout', 'sideways_bb_std_mult': 2.158523262860557, 'sideways_rsi_os': 40, 'sideways_rsi_ob': 90, 'sideways_adx_thresh': 31.679729103648256, 'sideways_atr_min_pct': 0.023532098737641623, 'sideways_atr_max_pct': 0.1375610211659076, 'sideways_tp_mult': 2.592115592475077, 'sideways_tsl_mult': 0.3941047639235723, 'sideways_time_stop': 89, 'sideways_use_sma': False, 'sideways_use_ema': False, 'sideways_use_atr': True, 'sideways_use_adx': True, 'sideways_use_spike': True, 'sideways_rsi_required': False}.
[I 2025-09-01 11:56:01,325] Trial 467 finished with values: [-0.004388220066334325, 0.00845130102491424] and parameters: {'p_sma': 26, 'p_std': 33, 'p_atr': 20, 'p_adx': 8, 'rsi_period': 47, 'ema1': 25, 'ema2': 15, 'slip_atr_k': 0.023458246243381064, 'slip_spread_k': 0.37301633387840993, 'spread_hl_frac': 0.0010019179329371197, 'bb_std_mult': 0.9018990077241923, 'rsi_os': 28, 'rsi_ob': 50, 'vol_spike': 0.199943711918652, 'adx_thresh': 23.672031108657066, 'atr_min_pct': 0.02330009196709441, 'atr_max_pct': 0.08090280757213662, 'tp_mult': 2.121018290852348, 'tsl_mult': 0.10492700446190456, 'strategy': 'breakout', 'time_stop': 174, 'use_sma': False, 'use_atr': True, 'use_adx': True, 'use_ema': True, 'use_spike': False, 'rsi_required': False, 'edge_k': 0.24560784746798364, 'edge_cap': 0.0502838581369862, 'bull_strategy': 'mean_reversion', 'bull_bb_std_mult': 1.7750189092471758, 'bull_rsi_os': 50, 'bull_rsi_ob': 49, 'bull_adx_thresh': 6.180819361725653, 'bull_atr_min_pct': 0.01689507489986742, 'bull_atr_max_pct': 0.1214241646043992, 'bull_tp_mult': 1.1855289933227426, 'bull_tsl_mult': 0.5794485701743851, 'bull_time_stop': 161, 'bull_use_sma': False, 'bull_use_ema': False, 'bull_use_atr': True, 'bull_use_adx': False, 'bull_use_spike': False, 'bull_rsi_required': False, 'bear_strategy': 'breakout', 'bear_bb_std_mult': 1.1450559999832575, 'bear_rsi_os': 27, 'bear_rsi_ob': 51, 'bear_adx_thresh': 9.597046786690905, 'bear_atr_min_pct': 0.0033186704813922318, 'bear_atr_max_pct': 0.012754658884597585, 'bear_tp_mult': 1.5122108422676899, 'bear_tsl_mult': 0.6313393812468886, 'bear_time_stop': 71, 'bear_use_sma': True, 'bear_use_ema': False, 'bear_use_atr': True, 'bear_use_adx': True, 'bear_use_spike': False, 'bear_rsi_required': True, 'sideways_strategy': 'breakout', 'sideways_bb_std_mult': 2.1270581684288, 'sideways_rsi_os': 40, 'sideways_rsi_ob': 89, 'sideways_adx_thresh': 33.663878470996465, 'sideways_atr_min_pct': 0.02387638405606298, 'sideways_atr_max_pct': 0.12908441488624173, 'sideways_tp_mult': 2.8527143566510844, 'sideways_tsl_mult': 0.3855397775633833, 'sideways_time_stop': 92, 'sideways_use_sma': False, 'sideways_use_ema': False, 'sideways_use_atr': True, 'sideways_use_adx': True, 'sideways_use_spike': True, 'sideways_rsi_required': False}.
[I 2025-09-01 11:56:02,104] Trial 465 finished with values: [0.0018745614576909375, 0.003786513371795989] and parameters: {'p_sma': 26, 'p_std': 33, 'p_atr': 20, 'p_adx': 20, 'rsi_period': 47, 'ema1': 25, 'ema2': 15, 'slip_atr_k': 0.023683802315319906, 'slip_spread_k': 0.3742669291246669, 'spread_hl_frac': 4.123283847506888e-06, 'bb_std_mult': 0.9785087463380541, 'rsi_os': 33, 'rsi_ob': 48, 'vol_spike': 0.1987853693354745, 'adx_thresh': 22.621272762259796, 'atr_min_pct': 0.023197114325744256, 'atr_max_pct': 0.07995838506919857, 'tp_mult': 2.110073543827803, 'tsl_mult': 0.06806973084908259, 'strategy': 'breakout', 'time_stop': 184, 'use_sma': False, 'use_atr': True, 'use_adx': True, 'use_ema': True, 'use_spike': False, 'rsi_required': False, 'edge_k': 0.168997008100469, 'edge_cap': 0.12565945087890423, 'bull_strategy': 'mean_reversion', 'bull_bb_std_mult': 1.722764126398461, 'bull_rsi_os': 47, 'bull_rsi_ob': 50, 'bull_adx_thresh': 6.045975187016255, 'bull_atr_min_pct': 0.01639037277663061, 'bull_atr_max_pct': 0.12163717966939383, 'bull_tp_mult': 1.2987665082238768, 'bull_tsl_mult': 0.5774075708371138, 'bull_time_stop': 161, 'bull_use_sma': False, 'bull_use_ema': False, 'bull_use_atr': True, 'bull_use_adx': False, 'bull_use_spike': False, 'bull_rsi_required': False, 'bear_strategy': 'breakout', 'bear_bb_std_mult': 1.3205503434143318, 'bear_rsi_os': 26, 'bear_rsi_ob': 52, 'bear_adx_thresh': 8.155055560144568, 'bear_atr_min_pct': 0.003533846580737471, 'bear_atr_max_pct': 0.021415392640246826, 'bear_tp_mult': 1.5323416125716378, 'bear_tsl_mult': 0.6366306621395367, 'bear_time_stop': 271, 'bear_use_sma': True, 'bear_use_ema': False, 'bear_use_atr': True, 'bear_use_adx': True, 'bear_use_spike': False, 'bear_rsi_required': True, 'sideways_strategy': 'breakout', 'sideways_bb_std_mult': 2.1431423452186067, 'sideways_rsi_os': 40, 'sideways_rsi_ob': 91, 'sideways_adx_thresh': 33.744525371475405, 'sideways_atr_min_pct': 0.023938470075444994, 'sideways_atr_max_pct': 0.1372813834712528, 'sideways_tp_mult': 2.8535228179549805, 'sideways_tsl_mult': 0.39428055697894526, 'sideways_time_stop': 93, 'sideways_use_sma': False, 'sideways_use_ema': False, 'sideways_use_atr': True, 'sideways_use_adx': True, 'sideways_use_spike': True, 'sideways_rsi_required': False}.
[I 2025-09-01 11:56:03,523] Trial 466 finished with values: [0.004082198451180519, 0.004065586659717033] and parameters: {'p_sma': 26, 'p_std': 33, 'p_atr': 19, 'p_adx': 8, 'rsi_period': 47, 'ema1': 25, 'ema2': 15, 'slip_atr_k': 0.024202858265403082, 'slip_spread_k': 0.37982316650524645, 'spread_hl_frac': 0.003106534882534262, 'bb_std_mult': 0.8787230820502776, 'rsi_os': 33, 'rsi_ob': 48, 'vol_spike': 0.1984862980892898, 'adx_thresh': 22.542372034361367, 'atr_min_pct': 0.02347903667159547, 'atr_max_pct': 0.07996688896513038, 'tp_mult': 2.1109896900842626, 'tsl_mult': 0.11067228361211132, 'strategy': 'breakout', 'time_stop': 174, 'use_sma': False, 'use_atr': True, 'use_adx': True, 'use_ema': True, 'use_spike': False, 'rsi_required': False, 'edge_k': 0.15976106522060385, 'edge_cap': 0.12438166651817784, 'bull_strategy': 'mean_reversion', 'bull_bb_std_mult': 1.7556506611801004, 'bull_rsi_os': 50, 'bull_rsi_ob': 49, 'bull_adx_thresh': 6.205448369997539, 'bull_atr_min_pct': 0.016350999508767675, 'bull_atr_max_pct': 0.11182126154408081, 'bull_tp_mult': 1.3401391827683806, 'bull_tsl_mult': 0.5804239789677481, 'bull_time_stop': 165, 'bull_use_sma': False, 'bull_use_ema': False, 'bull_use_atr': True, 'bull_use_adx': False, 'bull_use_spike': False, 'bull_rsi_required': False, 'bear_strategy': 'breakout', 'bear_bb_std_mult': 1.3391173067187971, 'bear_rsi_os': 27, 'bear_rsi_ob': 51, 'bear_adx_thresh': 9.469129798199553, 'bear_atr_min_pct': 0.0036609769812951647, 'bear_atr_max_pct': 0.0263036431987254, 'bear_tp_mult': 1.5117116758693123, 'bear_tsl_mult': 0.7070767600879772, 'bear_time_stop': 275, 'bear_use_sma': True, 'bear_use_ema': False, 'bear_use_atr': True, 'bear_use_adx': True, 'bear_use_spike': False, 'bear_rsi_required': True, 'sideways_strategy': 'breakout', 'sideways_bb_std_mult': 2.1743978371009636, 'sideways_rsi_os': 40, 'sideways_rsi_ob': 89, 'sideways_adx_thresh': 33.460978813728104, 'sideways_atr_min_pct': 0.005835451748763145, 'sideways_atr_max_pct': 0.12850833239928913, 'sideways_tp_mult': 2.8566762977406635, 'sideways_tsl_mult': 0.38888045534769033, 'sideways_time_stop': 94, 'sideways_use_sma': False, 'sideways_use_ema': False, 'sideways_use_atr': True, 'sideways_use_adx': True, 'sideways_use_spike': True, 'sideways_rsi_required': False}.
