[I 2025-09-01 11:24:18,789] Trial 280 finished with values: [-1000000000.0, 1000000000.0] and parameters: {'p_sma': 13, 'p_std': 19, 'p_atr': 23, 'p_adx': 19, 'rsi_period': 75, 'ema1': 15, 'ema2': 40, 'slip_atr_k': 0.2190847154567393, 'slip_spread_k': 0.6769697762368037, 'spread_hl_frac': 0.030790991345122577, 'bb_std_mult': 1.4032449700950118, 'rsi_os': 11, 'rsi_ob': 87, 'vol_spike': 0.16555050336250238, 'adx_thresh': 22.502042318179143, 'atr_min_pct': 0.028962371106353246, 'atr_max_pct': 0.039155344734013525, 'tp_mult': 2.6292023997964935, 'tsl_mult': 0.2405568137621264, 'strategy': 'mean_reversion', 'time_stop': 245, 'use_sma': True, 'use_atr': False, 'use_adx': False, 'use_ema': False, 'use_spike': True, 'rsi_required': True, 'edge_k': 0.3020626394649293, 'edge_cap': 0.2909150369973868, 'bull_strategy': 'breakout', 'bull_bb_std_mult': 2.775186255622589, 'bull_rsi_os': 41, 'bull_rsi_ob': 62, 'bull_adx_thresh': 29.81619774945957, 'bull_atr_min_pct': 0.00625629784203947, 'bull_atr_max_pct': 0.09606924889981384, 'bull_tp_mult': 2.202448226345397, 'bull_tsl_mult': 0.8006402399646788, 'bull_time_stop': 90, 'bull_use_sma': True, 'bull_use_ema': True, 'bull_use_atr': True, 'bull_use_adx': True, 'bull_use_spike': True, 'bull_rsi_required': False, 'bear_strategy': 'breakout', 'bear_bb_std_mult': 2.2786549068193103, 'bear_rsi_os': 34, 'bear_rsi_ob': 70, 'bear_adx_thresh': 15.634447485604456, 'bear_atr_min_pct': 0.0029909215986691825, 'bear_atr_max_pct': 0.02762428567401839, 'bear_tp_mult': 2.5235941561135347, 'bear_tsl_mult': 0.6855481220203252, 'bear_time_stop': 30, 'bear_use_sma': False, 'bear_use_ema': True, 'bear_use_atr': False, 'bear_use_adx': False, 'bear_use_spike': True, 'bear_rsi_required': False, 'sideways_strategy': 'mean_reversion', 'sideways_bb_std_mult': 3.5523414157220214, 'sideways_rsi_os': 20, 'sideways_rsi_ob': 87, 'sideways_adx_thresh': 20.553484017181436, 'sideways_atr_min_pct': 0.019681698004744553, 'sideways_atr_max_pct': 0.11511654999037976, 'sideways_tp_mult': 1.5875175455199653, 'sideways_tsl_mult': 0.6748125039142993, 'sideways_time_stop': 133, 'sideways_use_sma': True, 'sideways_use_ema': False, 'sideways_use_atr': False, 'sideways_use_adx': False, 'sideways_use_spike': False, 'sideways_rsi_required': True}.
[I 2025-09-01 11:24:19,418] Trial 281 finished with values: [-1000000000.0, 1000000000.0] and parameters: {'p_sma': 13, 'p_std': 20, 'p_atr': 23, 'p_adx': 30, 'rsi_period': 56, 'ema1': 15, 'ema2': 36, 'slip_atr_k': 0.013023000928557162, 'slip_spread_k': 0.7750436588821075, 'spread_hl_frac': 0.030536067677689554, 'bb_std_mult': 2.813368527168461, 'rsi_os': 16, 'rsi_ob': 87, 'vol_spike': 0.18870650767815403, 'adx_thresh': 32.17244694713629, 'atr_min_pct': 0.02999439932005477, 'atr_max_pct': 0.03931603641287427, 'tp_mult': 2.5792716689290134, 'tsl_mult': 0.11801824222692481, 'strategy': 'mean_reversion', 'time_stop': 48, 'use_sma': True, 'use_atr': False, 'use_adx': False, 'use_ema': False, 'use_spike': True, 'rsi_required': True, 'edge_k': 0.29522387874712164, 'edge_cap': 0.0756107518960421, 'bull_strategy': 'breakout', 'bull_bb_std_mult': 1.6315849031766367, 'bull_rsi_os': 41, 'bull_rsi_ob': 58, 'bull_adx_thresh': 29.821653759322807, 'bull_atr_min_pct': 0.018737568477939497, 'bull_atr_max_pct': 0.13430923387802893, 'bull_tp_mult': 1.2522664153266998, 'bull_tsl_mult': 0.7919185954462352, 'bull_time_stop': 168, 'bull_use_sma': True, 'bull_use_ema': True, 'bull_use_atr': True, 'bull_use_adx': True, 'bull_use_spike': True, 'bull_rsi_required': True, 'bear_strategy': 'breakout', 'bear_bb_std_mult': 2.56965798800091, 'bear_rsi_os': 34, 'bear_rsi_ob': 70, 'bear_adx_thresh': 14.669960230033961, 'bear_atr_min_pct': 0.004791653639968521, 'bear_atr_max_pct': 0.03356608700719513, 'bear_tp_mult': 2.718934770773954, 'bear_tsl_mult': 0.30444863356417645, 'bear_time_stop': 168, 'bear_use_sma': False, 'bear_use_ema': True, 'bear_use_atr': False, 'bear_use_adx': False, 'bear_use_spike': True, 'bear_rsi_required': False, 'sideways_strategy': 'mean_reversion', 'sideways_bb_std_mult': 3.5514501331861923, 'sideways_rsi_os': 13, 'sideways_rsi_ob': 87, 'sideways_adx_thresh': 12.378677583662409, 'sideways_atr_min_pct': 0.027007952912089402, 'sideways_atr_max_pct': 0.08270087176118718, 'sideways_tp_mult': 1.5457908483331209, 'sideways_tsl_mult': 0.24122528809998978, 'sideways_time_stop': 198, 'sideways_use_sma': True, 'sideways_use_ema': True, 'sideways_use_atr': False, 'sideways_use_adx': False, 'sideways_use_spike': False, 'sideways_rsi_required': True}.
[I 2025-09-01 11:24:20,345] Trial 279 finished with values: [-0.0103510549466298, 0.010586352022789054] and parameters: {'p_sma': 14, 'p_std': 27, 'p_atr': 18, 'p_adx': 30, 'rsi_period': 47, 'ema1': 6, 'ema2': 35, 'slip_atr_k': 0.005972390291740751, 'slip_spread_k': 0.9982261062509474, 'spread_hl_frac': 0.03077637683770062, 'bb_std_mult': 1.4123852778432302, 'rsi_os': 19, 'rsi_ob': 85, 'vol_spike': 0.11114524885084817, 'adx_thresh': 32.215825691590965, 'atr_min_pct': 0.027257162758034532, 'atr_max_pct': 0.03896254985821338, 'tp_mult': 2.627545770329402, 'tsl_mult': 0.8042509163890791, 'strategy': 'breakout', 'time_stop': 70, 'use_sma': False, 'use_atr': False, 'use_adx': False, 'use_ema': False, 'use_spike': True, 'rsi_required': True, 'edge_k': 1.2324890929013044, 'edge_cap': 0.8695541909552622, 'bull_strategy': 'breakout', 'bull_bb_std_mult': 2.7556724753065884, 'bull_rsi_os': 17, 'bull_rsi_ob': 64, 'bull_adx_thresh': 29.807117251476377, 'bull_atr_min_pct': 1.4295654621744938e-05, 'bull_atr_max_pct': 0.020369835650026147, 'bull_tp_mult': 2.2649565128001408, 'bull_tsl_mult': 0.8088433153004726, 'bull_time_stop': 94, 'bull_use_sma': True, 'bull_use_ema': True, 'bull_use_atr': True, 'bull_use_adx': True, 'bull_use_spike': True, 'bull_rsi_required': False, 'bear_strategy': 'breakout', 'bear_bb_std_mult': 2.534101749054911, 'bear_rsi_os': 34, 'bear_rsi_ob': 50, 'bear_adx_thresh': 15.73570728634597, 'bear_atr_min_pct': 0.004337861464032062, 'bear_atr_max_pct': 0.02636666917417687, 'bear_tp_mult': 2.5854612432877353, 'bear_tsl_mult': 0.6935940187698952, 'bear_time_stop': 50, 'bear_use_sma': True, 'bear_use_ema': True, 'bear_use_atr': False, 'bear_use_adx': False, 'bear_use_spike': False, 'bear_rsi_required': False, 'sideways_strategy': 'mean_reversion', 'sideways_bb_std_mult': 3.5947513289566957, 'sideways_rsi_os': 22, 'sideways_rsi_ob': 87, 'sideways_adx_thresh': 25.648429871016596, 'sideways_atr_min_pct': 0.019681453984650335, 'sideways_atr_max_pct': 0.09196379278041131, 'sideways_tp_mult': 2.611073811751079, 'sideways_tsl_mult': 0.749277334940895, 'sideways_time_stop': 134, 'sideways_use_sma': True, 'sideways_use_ema': True, 'sideways_use_atr': False, 'sideways_use_adx': False, 'sideways_use_spike': False, 'sideways_rsi_required': True}.
[I 2025-09-01 11:25:01,842] Trial 282 finished with values: [-0.005043917672202247, 0.005222515965867724] and parameters: {'p_sma': 14, 'p_std': 27, 'p_atr': 8, 'p_adx': 30, 'rsi_period': 47, 'ema1': 15, 'ema2': 35, 'slip_atr_k': 0.011622609214866091, 'slip_spread_k': 0.7749684341432366, 'spread_hl_frac': 0.03066906476230213, 'bb_std_mult': 2.7615190925660524, 'rsi_os': 11, 'rsi_ob': 87, 'vol_spike': 0.10355100167563659, 'adx_thresh': 32.045371612778915, 'atr_min_pct': 0.005231538821339582, 'atr_max_pct': 0.04000132180032105, 'tp_mult': 2.6315735982350965, 'tsl_mult': 0.8108940419895787, 'strategy': 'breakout', 'time_stop': 14, 'use_sma': False, 'use_atr': False, 'use_adx': False, 'use_ema': False, 'use_spike': True, 'rsi_required': True, 'edge_k': 0.7433016514588142, 'edge_cap': 0.8481185405952006, 'bull_strategy': 'breakout', 'bull_bb_std_mult': 1.6421575745379018, 'bull_rsi_os': 15, 'bull_rsi_ob': 59, 'bull_adx_thresh': 29.825622415852067, 'bull_atr_min_pct': 0.0008695375076137699, 'bull_atr_max_pct': 0.017623777183048077, 'bull_tp_mult': 2.825085814073919, 'bull_tsl_mult': 0.8171703157572302, 'bull_time_stop': 168, 'bull_use_sma': True, 'bull_use_ema': True, 'bull_use_atr': True, 'bull_use_adx': True, 'bull_use_spike': True, 'bull_rsi_required': False, 'bear_strategy': 'breakout', 'bear_bb_std_mult': 0.8930781116920088, 'bear_rsi_os': 7, 'bear_rsi_ob': 50, 'bear_adx_thresh': 26.12698109248701, 'bear_atr_min_pct': 0.004705275331786503, 'bear_atr_max_pct': 0.010786458971999324, 'bear_tp_mult': 1.2399987809043544, 'bear_tsl_mult': 0.3071138873022912, 'bear_time_stop': 26, 'bear_use_sma': True, 'bear_use_ema': True, 'bear_use_atr': False, 'bear_use_adx': False, 'bear_use_spike': False, 'bear_rsi_required': False, 'sideways_strategy': 'mean_reversion', 'sideways_bb_std_mult': 1.2043915561460579, 'sideways_rsi_os': 22, 'sideways_rsi_ob': 87, 'sideways_adx_thresh': 33.71361302021545, 'sideways_atr_min_pct': 0.01966648800126274, 'sideways_atr_max_pct': 0.048653429522064966, 'sideways_tp_mult': 1.0110102815480877, 'sideways_tsl_mult': 0.3528443126702142, 'sideways_time_stop': 276, 'sideways_use_sma': True, 'sideways_use_ema': True, 'sideways_use_atr': False, 'sideways_use_adx': False, 'sideways_use_spike': False, 'sideways_rsi_required': True}.
[I 2025-09-01 11:25:01,854] Trial 283 finished with values: [-0.010402605890197592, 0.010437523025048901] and parameters: {'p_sma': 14, 'p_std': 27, 'p_atr': 25, 'p_adx': 30, 'rsi_period': 50, 'ema1': 15, 'ema2': 35, 'slip_atr_k': 0.17513376458296573, 'slip_spread_k': 0.10781650029155623, 'spread_hl_frac': 0.03084590254782263, 'bb_std_mult': 2.7966437666230086, 'rsi_os': 24, 'rsi_ob': 87, 'vol_spike': 0.29405268783467037, 'adx_thresh': 32.25517869123651, 'atr_min_pct': 0.004301501061409831, 'atr_max_pct': 0.04109143621645387, 'tp_mult': 2.5797482210127907, 'tsl_mult': 0.8031740422350109, 'strategy': 'breakout', 'time_stop': 24, 'use_sma': False, 'use_atr': False, 'use_adx': False, 'use_ema': False, 'use_spike': True, 'rsi_required': True, 'edge_k': 0.7656613361892252, 'edge_cap': 0.9484522658869157, 'bull_strategy': 'breakout', 'bull_bb_std_mult': 1.4929003613516147, 'bull_rsi_os': 18, 'bull_rsi_ob': 71, 'bull_adx_thresh': 31.962078991061375, 'bull_atr_min_pct': 0.0009062640366811221, 'bull_atr_max_pct': 0.08708882065660672, 'bull_tp_mult': 2.5231387002672734, 'bull_tsl_mult': 0.8367815524310779, 'bull_time_stop': 168, 'bull_use_sma': True, 'bull_use_ema': True, 'bull_use_atr': True, 'bull_use_adx': True, 'bull_use_spike': True, 'bull_rsi_required': False, 'bear_strategy': 'breakout', 'bear_bb_std_mult': 1.75643464485456, 'bear_rsi_os': 36, 'bear_rsi_ob': 50, 'bear_adx_thresh': 26.094499699650584, 'bear_atr_min_pct': 0.004939196825650162, 'bear_atr_max_pct': 0.03394265485066972, 'bear_tp_mult': 1.257187351572648, 'bear_tsl_mult': 0.307027035804554, 'bear_time_stop': 207, 'bear_use_sma': True, 'bear_use_ema': True, 'bear_use_atr': False, 'bear_use_adx': False, 'bear_use_spike': False, 'bear_rsi_required': False, 'sideways_strategy': 'mean_reversion', 'sideways_bb_std_mult': 1.098335428562163, 'sideways_rsi_os': 22, 'sideways_rsi_ob': 91, 'sideways_adx_thresh': 25.055361288609042, 'sideways_atr_min_pct': 0.01953711756004339, 'sideways_atr_max_pct': 0.05015234764688287, 'sideways_tp_mult': 2.4429081280966525, 'sideways_tsl_mult': 0.41782637812969503, 'sideways_time_stop': 239, 'sideways_use_sma': True, 'sideways_use_ema': True, 'sideways_use_atr': False, 'sideways_use_adx': False, 'sideways_use_spike': False, 'sideways_rsi_required': True}.
[I 2025-09-01 11:25:02,664] Trial 285 finished with values: [-0.014714039576276261, 0.014815891369111836] and parameters: {'p_sma': 42, 'p_std': 27, 'p_atr': 25, 'p_adx': 29, 'rsi_period': 50, 'ema1': 22, 'ema2': 34, 'slip_atr_k': 0.0003063009853390766, 'slip_spread_k': 0.06766497605986248, 'spread_hl_frac': 0.030030300765803507, 'bb_std_mult': 2.7508901134452786, 'rsi_os': 12, 'rsi_ob': 87, 'vol_spike': 0.0198846794425121, 'adx_thresh': 21.100126326771157, 'atr_min_pct': 0.0016302350929834983, 'atr_max_pct': 0.03394028924624935, 'tp_mult': 1.5181388638069993, 'tsl_mult': 0.8301207063232363, 'strategy': 'breakout', 'time_stop': 18, 'use_sma': False, 'use_atr': False, 'use_adx': False, 'use_ema': False, 'use_spike': True, 'rsi_required': True, 'edge_k': 0.4370761374662657, 'edge_cap': 0.9492048560831187, 'bull_strategy': 'breakout', 'bull_bb_std_mult': 1.311261787664952, 'bull_rsi_os': 15, 'bull_rsi_ob': 59, 'bull_adx_thresh': 34.721589834105906, 'bull_atr_min_pct': 0.0008825843962401935, 'bull_atr_max_pct': 0.086583486293426, 'bull_tp_mult': 2.5264551229080774, 'bull_tsl_mult': 0.8373640694154324, 'bull_time_stop': 262, 'bull_use_sma': True, 'bull_use_ema': True, 'bull_use_atr': True, 'bull_use_adx': True, 'bull_use_spike': True, 'bull_rsi_required': False, 'bear_strategy': 'breakout', 'bear_bb_std_mult': 0.8907468166415257, 'bear_rsi_os': 36, 'bear_rsi_ob': 78, 'bear_adx_thresh': 26.485276735687926, 'bear_atr_min_pct': 0.002772011130511934, 'bear_atr_max_pct': 0.010881212500269077, 'bear_tp_mult': 1.131630442305926, 'bear_tsl_mult': 0.27894828183087716, 'bear_time_stop': 26, 'bear_use_sma': True, 'bear_use_ema': True, 'bear_use_atr': False, 'bear_use_adx': False, 'bear_use_spike': False, 'bear_rsi_required': False, 'sideways_strategy': 'mean_reversion', 'sideways_bb_std_mult': 0.7173638062679326, 'sideways_rsi_os': 23, 'sideways_rsi_ob': 58, 'sideways_adx_thresh': 24.8765341150163, 'sideways_atr_min_pct': 0.018817913905061046, 'sideways_atr_max_pct': 0.07483003415869768, 'sideways_tp_mult': 2.4931973901880236, 'sideways_tsl_mult': 0.4112373309007584, 'sideways_time_stop': 240, 'sideways_use_sma': True, 'sideways_use_ema': True, 'sideways_use_atr': False, 'sideways_use_adx': False, 'sideways_use_spike': False, 'sideways_rsi_required': True}.
[I 2025-09-01 11:25:03,033] Trial 284 finished with values: [-0.027502169644283314, 0.02760614123930186] and parameters: {'p_sma': 50, 'p_std': 27, 'p_atr': 17, 'p_adx': 29, 'rsi_period': 50, 'ema1': 20, 'ema2': 34, 'slip_atr_k': 0.007497085724687039, 'slip_spread_k': 0.07420926418862575, 'spread_hl_frac': 0.03081277452191599, 'bb_std_mult': 2.762168313240388, 'rsi_os': 9, 'rsi_ob': 87, 'vol_spike': 0.1045040583279151, 'adx_thresh': 32.86508691899729, 'atr_min_pct': 0.002537381448188417, 'atr_max_pct': 0.042505280325069346, 'tp_mult': 2.561654360891869, 'tsl_mult': 0.8016063522703905, 'strategy': 'breakout', 'time_stop': 237, 'use_sma': False, 'use_atr': False, 'use_adx': False, 'use_ema': False, 'use_spike': True, 'rsi_required': True, 'edge_k': 0.9032142732629658, 'edge_cap': 0.3224888221350997, 'bull_strategy': 'breakout', 'bull_bb_std_mult': 1.3466186091858088, 'bull_rsi_os': 17, 'bull_rsi_ob': 68, 'bull_adx_thresh': 34.178725486416965, 'bull_atr_min_pct': 0.0008858892370079166, 'bull_atr_max_pct': 0.017934338690304467, 'bull_tp_mult': 2.022992980709634, 'bull_tsl_mult': 0.8445061614413003, 'bull_time_stop': 154, 'bull_use_sma': True, 'bull_use_ema': True, 'bull_use_atr': True, 'bull_use_adx': True, 'bull_use_spike': True, 'bull_rsi_required': False, 'bear_strategy': 'breakout', 'bear_bb_std_mult': 0.8896717497040958, 'bear_rsi_os': 36, 'bear_rsi_ob': 50, 'bear_adx_thresh': 26.11693086800402, 'bear_atr_min_pct': 0.0027712614393165854, 'bear_atr_max_pct': 0.010018222585977135, 'bear_tp_mult': 2.6661887979571617, 'bear_tsl_mult': 0.27788175130109627, 'bear_time_stop': 25, 'bear_use_sma': True, 'bear_use_ema': True, 'bear_use_atr': False, 'bear_use_adx': False, 'bear_use_spike': False, 'bear_rsi_required': False, 'sideways_strategy': 'mean_reversion', 'sideways_bb_std_mult': 0.8963419472591092, 'sideways_rsi_os': 22, 'sideways_rsi_ob': 89, 'sideways_adx_thresh': 24.999121607318244, 'sideways_atr_min_pct': 0.019537900550147033, 'sideways_atr_max_pct': 0.06913799963265707, 'sideways_tp_mult': 1.706960726711823, 'sideways_tsl_mult': 0.4181552515835316, 'sideways_time_stop': 115, 'sideways_use_sma': True, 'sideways_use_ema': True, 'sideways_use_atr': False, 'sideways_use_adx': False, 'sideways_use_spike': False, 'sideways_rsi_required': True}.
[I 2025-09-01 11:25:47,577] Trial 289 finished with values: [-1000000000.0, 1000000000.0] and parameters: {'p_sma': 32, 'p_std': 29, 'p_atr': 8, 'p_adx': 16, 'rsi_period': 44, 'ema1': 13, 'ema2': 37, 'slip_atr_k': 0.012513669689418928, 'slip_spread_k': 0.10495713073190333, 'spread_hl_frac': 0.032715409047715395, 'bb_std_mult': 3.446241117734114, 'rsi_os': 23, 'rsi_ob': 82, 'vol_spike': 0.1283079061141924, 'adx_thresh': 21.420177511739453, 'atr_min_pct': 0.005247486402193977, 'atr_max_pct': 0.03526269005553088, 'tp_mult': 2.2929736127341758, 'tsl_mult': 0.20928562659247096, 'strategy': 'breakout', 'time_stop': 77, 'use_sma': False, 'use_atr': False, 'use_adx': False, 'use_ema': False, 'use_spike': True, 'rsi_required': True, 'edge_k': 0.6753040347443166, 'edge_cap': 0.6309555506382133, 'bull_strategy': 'breakout', 'bull_bb_std_mult': 2.975145611967983, 'bull_rsi_os': 47, 'bull_rsi_ob': 61, 'bull_adx_thresh': 13.856876214757797, 'bull_atr_min_pct': 0.008556942319347716, 'bull_atr_max_pct': 0.025888047743022162, 'bull_tp_mult': 2.8166120377866473, 'bull_tsl_mult': 0.8718777615071964, 'bull_time_stop': 189, 'bull_use_sma': True, 'bull_use_ema': True, 'bull_use_atr': True, 'bull_use_adx': True, 'bull_use_spike': True, 'bull_rsi_required': True, 'bear_strategy': 'breakout', 'bear_bb_std_mult': 0.6147382772994976, 'bear_rsi_os': 11, 'bear_rsi_ob': 47, 'bear_adx_thresh': 8.00673482556319, 'bear_atr_min_pct': 0.005246177794667532, 'bear_atr_max_pct': 0.08255519605147069, 'bear_tp_mult': 1.0355777153600887, 'bear_tsl_mult': 0.33033776510725915, 'bear_time_stop': 218, 'bear_use_sma': False, 'bear_use_ema': True, 'bear_use_atr': False, 'bear_use_adx': False, 'bear_use_spike': False, 'bear_rsi_required': False, 'sideways_strategy': 'mean_reversion', 'sideways_bb_std_mult': 1.2256732684883034, 'sideways_rsi_os': 18, 'sideways_rsi_ob': 91, 'sideways_adx_thresh': 23.352342197291055, 'sideways_atr_min_pct': 0.01345324142808267, 'sideways_atr_max_pct': 0.14083434182704282, 'sideways_tp_mult': 1.016394172082896, 'sideways_tsl_mult': 0.5151467253104856, 'sideways_time_stop': 261, 'sideways_use_sma': True, 'sideways_use_ema': True, 'sideways_use_atr': False, 'sideways_use_adx': False, 'sideways_use_spike': False, 'sideways_rsi_required': True}.
[I 2025-09-01 11:25:47,586] Trial 286 finished with values: [-0.017896345786890366, 0.017836508110470214] and parameters: {'p_sma': 32, 'p_std': 29, 'p_atr': 21, 'p_adx': 14, 'rsi_period': 44, 'ema1': 13, 'ema2': 19, 'slip_atr_k': 0.0026938670413348825, 'slip_spread_k': 0.06376215699469043, 'spread_hl_frac': 0.03258513627109326, 'bb_std_mult': 2.7304881536189085, 'rsi_os': 12, 'rsi_ob': 83, 'vol_spike': 0.12887889323424082, 'adx_thresh': 21.58570614439143, 'atr_min_pct': 0.023053098499637062, 'atr_max_pct': 0.034292908419567524, 'tp_mult': 2.6610459766381314, 'tsl_mult': 0.8310300687422685, 'strategy': 'breakout', 'time_stop': 15, 'use_sma': False, 'use_atr': False, 'use_adx': False, 'use_ema': False, 'use_spike': True, 'rsi_required': True, 'edge_k': 0.1829999591195906, 'edge_cap': 0.32286534773807274, 'bull_strategy': 'breakout', 'bull_bb_std_mult': 0.5042681668127889, 'bull_rsi_os': 15, 'bull_rsi_ob': 61, 'bull_adx_thresh': 34.14918081670645, 'bull_atr_min_pct': 0.001207610044128111, 'bull_atr_max_pct': 0.04754400217391105, 'bull_tp_mult': 2.6073436744747056, 'bull_tsl_mult': 0.8762261203928741, 'bull_time_stop': 180, 'bull_use_sma': True, 'bull_use_ema': True, 'bull_use_atr': True, 'bull_use_adx': True, 'bull_use_spike': True, 'bull_rsi_required': False, 'bear_strategy': 'breakout', 'bear_bb_std_mult': 0.8745467365342781, 'bear_rsi_os': 24, 'bear_rsi_ob': 47, 'bear_adx_thresh': 26.615402555986567, 'bear_atr_min_pct': 0.005249057968342406, 'bear_atr_max_pct': 0.11595204873873138, 'bear_tp_mult': 1.1377513180041052, 'bear_tsl_mult': 0.3361232916317398, 'bear_time_stop': 23, 'bear_use_sma': True, 'bear_use_ema': True, 'bear_use_atr': False, 'bear_use_adx': False, 'bear_use_spike': False, 'bear_rsi_required': False, 'sideways_strategy': 'mean_reversion', 'sideways_bb_std_mult': 0.9862028601873847, 'sideways_rsi_os': 19, 'sideways_rsi_ob': 55, 'sideways_adx_thresh': 11.976063016519825, 'sideways_atr_min_pct': 0.01822333802878479, 'sideways_atr_max_pct': 0.07281210670495618, 'sideways_tp_mult': 2.966589173177901, 'sideways_tsl_mult': 0.38082839476212715, 'sideways_time_stop': 261, 'sideways_use_sma': True, 'sideways_use_ema': True, 'sideways_use_atr': False, 'sideways_use_adx': False, 'sideways_use_spike': False, 'sideways_rsi_required': True}.
