[I 2025-09-01 11:50:24,600] Trial 432 finished with values: [-1000000000.0, 1000000000.0] and parameters: {'p_sma': 27, 'p_std': 34, 'p_atr': 21, 'p_adx': 7, 'rsi_period': 43, 'ema1': 26, 'ema2': 20, 'slip_atr_k': 0.018979871459868923, 'slip_spread_k': 0.43241474244036704, 'spread_hl_frac': 0.0030894945421166484, 'bb_std_mult': 1.0031190870992288, 'rsi_os': 30, 'rsi_ob': 50, 'vol_spike': 0.2087908860628431, 'adx_thresh': 25.39283339536626, 'atr_min_pct': 0.02510288091155639, 'atr_max_pct': 0.07733963246966659, 'tp_mult': 2.12227879386662, 'tsl_mult': 0.08392469569799721, 'strategy': 'breakout', 'time_stop': 158, 'use_sma': False, 'use_atr': True, 'use_adx': True, 'use_ema': True, 'use_spike': False, 'rsi_required': False, 'edge_k': 0.2910352775378883, 'edge_cap': 0.1047964329742079, 'bull_strategy': 'mean_reversion', 'bull_bb_std_mult': 1.8045739983752889, 'bull_rsi_os': 48, 'bull_rsi_ob': 49, 'bull_adx_thresh': 6.340913386166886, 'bull_atr_min_pct': 0.015543047212598686, 'bull_atr_max_pct': 0.1088771228344045, 'bull_tp_mult': 1.3686272067892244, 'bull_tsl_mult': 0.604261764596098, 'bull_time_stop': 165, 'bull_use_sma': False, 'bull_use_ema': False, 'bull_use_atr': True, 'bull_use_adx': False, 'bull_use_spike': False, 'bull_rsi_required': False, 'bear_strategy': 'mean_reversion', 'bear_bb_std_mult': 1.3684466452135333, 'bear_rsi_os': 28, 'bear_rsi_ob': 49, 'bear_adx_thresh': 7.465058174605836, 'bear_atr_min_pct': 0.004212895293249803, 'bear_atr_max_pct': 0.018008440171179717, 'bear_tp_mult': 1.4436093861873918, 'bear_tsl_mult': 0.7028518170518179, 'bear_time_stop': 274, 'bear_use_sma': True, 'bear_use_ema': False, 'bear_use_atr': True, 'bear_use_adx': True, 'bear_use_spike': False, 'bear_rsi_required': True, 'sideways_strategy': 'breakout', 'sideways_bb_std_mult': 1.9459610965901037, 'sideways_rsi_os': 46, 'sideways_rsi_ob': 90, 'sideways_adx_thresh': 33.58180063197588, 'sideways_atr_min_pct': 0.025660813877305223, 'sideways_atr_max_pct': 0.1307946501891478, 'sideways_tp_mult': 2.6793682224908424, 'sideways_tsl_mult': 0.3267644726680924, 'sideways_time_stop': 83, 'sideways_use_sma': False, 'sideways_use_ema': False, 'sideways_use_atr': True, 'sideways_use_adx': True, 'sideways_use_spike': True, 'sideways_rsi_required': False}.
[I 2025-09-01 11:50:24,598] Trial 434 finished with values: [0.0007033613765290436, 0.005655684094376289] and parameters: {'p_sma': 21, 'p_std': 32, 'p_atr': 22, 'p_adx': 7, 'rsi_period': 42, 'ema1': 24, 'ema2': 20, 'slip_atr_k': 0.020715790080246346, 'slip_spread_k': 0.4933430190724327, 'spread_hl_frac': 0.003090231557948052, 'bb_std_mult': 1.0050345213233343, 'rsi_os': 29, 'rsi_ob': 49, 'vol_spike': 0.20760681665165218, 'adx_thresh': 23.921845950332674, 'atr_min_pct': 0.022621520070310527, 'atr_max_pct': 0.07922148109066643, 'tp_mult': 2.077037377766093, 'tsl_mult': 0.07730751770669944, 'strategy': 'breakout', 'time_stop': 155, 'use_sma': False, 'use_atr': True, 'use_adx': True, 'use_ema': True, 'use_spike': False, 'rsi_required': False, 'edge_k': 0.3011770874654335, 'edge_cap': 0.08276622351888271, 'bull_strategy': 'mean_reversion', 'bull_bb_std_mult': 1.8269021869708153, 'bull_rsi_os': 48, 'bull_rsi_ob': 51, 'bull_adx_thresh': 6.64449656675646, 'bull_atr_min_pct': 0.01563369606252117, 'bull_atr_max_pct': 0.11085533907778582, 'bull_tp_mult': 1.2648940960958779, 'bull_tsl_mult': 0.6349956028835781, 'bull_time_stop': 150, 'bull_use_sma': False, 'bull_use_ema': False, 'bull_use_atr': True, 'bull_use_adx': False, 'bull_use_spike': False, 'bull_rsi_required': False, 'bear_strategy': 'breakout', 'bear_bb_std_mult': 1.370334798606002, 'bear_rsi_os': 28, 'bear_rsi_ob': 49, 'bear_adx_thresh': 7.657282473135642, 'bear_atr_min_pct': 0.004311509051388281, 'bear_atr_max_pct': 0.01566154186233681, 'bear_tp_mult': 1.5037286555423914, 'bear_tsl_mult': 0.8602097247192062, 'bear_time_stop': 254, 'bear_use_sma': True, 'bear_use_ema': False, 'bear_use_atr': True, 'bear_use_adx': True, 'bear_use_spike': False, 'bear_rsi_required': True, 'sideways_strategy': 'breakout', 'sideways_bb_std_mult': 2.0176118804812573, 'sideways_rsi_os': 45, 'sideways_rsi_ob': 90, 'sideways_adx_thresh': 33.742815257896495, 'sideways_atr_min_pct': 0.02521208047293755, 'sideways_atr_max_pct': 0.13007138320570974, 'sideways_tp_mult': 2.675855979212816, 'sideways_tsl_mult': 0.3611193144105165, 'sideways_time_stop': 103, 'sideways_use_sma': False, 'sideways_use_ema': False, 'sideways_use_atr': True, 'sideways_use_adx': True, 'sideways_use_spike': True, 'sideways_rsi_required': False}.
[I 2025-09-01 11:50:25,093] Trial 435 finished with values: [-0.004883765060367251, 0.006713619706227208] and parameters: {'p_sma': 21, 'p_std': 35, 'p_atr': 21, 'p_adx': 7, 'rsi_period': 45, 'ema1': 24, 'ema2': 21, 'slip_atr_k': 0.04271434435159365, 'slip_spread_k': 0.432782243796658, 'spread_hl_frac': 0.0029482528060304145, 'bb_std_mult': 0.9934447642099054, 'rsi_os': 29, 'rsi_ob': 49, 'vol_spike': 0.19502050002273716, 'adx_thresh': 23.911737595466363, 'atr_min_pct': 0.022570642545048408, 'atr_max_pct': 0.07009500514375908, 'tp_mult': 2.067131039275436, 'tsl_mult': 0.06065873895821763, 'strategy': 'breakout', 'time_stop': 154, 'use_sma': False, 'use_atr': True, 'use_adx': True, 'use_ema': True, 'use_spike': False, 'rsi_required': False, 'edge_k': 0.24227712672938437, 'edge_cap': 0.0768588400504517, 'bull_strategy': 'mean_reversion', 'bull_bb_std_mult': 1.6186238331937919, 'bull_rsi_os': 39, 'bull_rsi_ob': 51, 'bull_adx_thresh': 6.68273108212437, 'bull_atr_min_pct': 0.015362165808141898, 'bull_atr_max_pct': 0.10798155494182238, 'bull_tp_mult': 1.2825065243844964, 'bull_tsl_mult': 0.6356817662637735, 'bull_time_stop': 170, 'bull_use_sma': False, 'bull_use_ema': False, 'bull_use_atr': True, 'bull_use_adx': False, 'bull_use_spike': False, 'bull_rsi_required': False, 'bear_strategy': 'breakout', 'bear_bb_std_mult': 1.3918805255254127, 'bear_rsi_os': 31, 'bear_rsi_ob': 49, 'bear_adx_thresh': 5.652619578997661, 'bear_atr_min_pct': 0.0042020696066168445, 'bear_atr_max_pct': 0.01563475167869472, 'bear_tp_mult': 1.516755339794286, 'bear_tsl_mult': 0.783128577470813, 'bear_time_stop': 273, 'bear_use_sma': True, 'bear_use_ema': False, 'bear_use_atr': True, 'bear_use_adx': True, 'bear_use_spike': False, 'bear_rsi_required': True, 'sideways_strategy': 'breakout', 'sideways_bb_std_mult': 1.9030917541326473, 'sideways_rsi_os': 53, 'sideways_rsi_ob': 91, 'sideways_adx_thresh': 33.658544570330164, 'sideways_atr_min_pct': 0.025917547268834162, 'sideways_atr_max_pct': 0.13706514202233927, 'sideways_tp_mult': 2.6930062924956575, 'sideways_tsl_mult': 0.379408356689269, 'sideways_time_stop': 104, 'sideways_use_sma': False, 'sideways_use_ema': False, 'sideways_use_atr': True, 'sideways_use_adx': True, 'sideways_use_spike': True, 'sideways_rsi_required': False}.
[I 2025-09-01 11:50:25,341] Trial 433 finished with values: [0.0023081569070049213, 0.005036805497309039] and parameters: {'p_sma': 27, 'p_std': 34, 'p_atr': 21, 'p_adx': 7, 'rsi_period': 43, 'ema1': 25, 'ema2': 21, 'slip_atr_k': 0.01902402170141171, 'slip_spread_k': 0.501580780076896, 'spread_hl_frac': 0.0028466308354629004, 'bb_std_mult': 1.0258297842074133, 'rsi_os': 29, 'rsi_ob': 50, 'vol_spike': 0.20841236614931433, 'adx_thresh': 23.47438207322373, 'atr_min_pct': 0.022716997438022156, 'atr_max_pct': 0.07798796610084462, 'tp_mult': 2.0725953939673354, 'tsl_mult': 0.0824848788236091, 'strategy': 'breakout', 'time_stop': 156, 'use_sma': False, 'use_atr': True, 'use_adx': True, 'use_ema': True, 'use_spike': False, 'rsi_required': False, 'edge_k': 0.2956412572254467, 'edge_cap': 0.08044444848489657, 'bull_strategy': 'mean_reversion', 'bull_bb_std_mult': 1.6283872687504446, 'bull_rsi_os': 36, 'bull_rsi_ob': 49, 'bull_adx_thresh': 6.4651828048767745, 'bull_atr_min_pct': 0.015674576993546022, 'bull_atr_max_pct': 0.10945723187807786, 'bull_tp_mult': 1.093464281989123, 'bull_tsl_mult': 0.602055802374786, 'bull_time_stop': 180, 'bull_use_sma': False, 'bull_use_ema': False, 'bull_use_atr': True, 'bull_use_adx': False, 'bull_use_spike': False, 'bull_rsi_required': False, 'bear_strategy': 'breakout', 'bear_bb_std_mult': 1.391392429328353, 'bear_rsi_os': 28, 'bear_rsi_ob': 49, 'bear_adx_thresh': 7.336387137541151, 'bear_atr_min_pct': 0.004223651246592126, 'bear_atr_max_pct': 0.019319338800387355, 'bear_tp_mult': 1.455687971212693, 'bear_tsl_mult': 0.7043544783222494, 'bear_time_stop': 275, 'bear_use_sma': True, 'bear_use_ema': False, 'bear_use_atr': True, 'bear_use_adx': True, 'bear_use_spike': False, 'bear_rsi_required': True, 'sideways_strategy': 'breakout', 'sideways_bb_std_mult': 1.918035833724143, 'sideways_rsi_os': 46, 'sideways_rsi_ob': 90, 'sideways_adx_thresh': 33.74835351670217, 'sideways_atr_min_pct': 0.026113106759610653, 'sideways_atr_max_pct': 0.13805517546766188, 'sideways_tp_mult': 2.6790372557052424, 'sideways_tsl_mult': 0.38065699925895363, 'sideways_time_stop': 82, 'sideways_use_sma': False, 'sideways_use_ema': False, 'sideways_use_atr': True, 'sideways_use_adx': True, 'sideways_use_spike': True, 'sideways_rsi_required': False}.
[I 2025-09-01 11:51:05,583] Trial 437 finished with values: [0.0013552301791477372, 0.004659113677050111] and parameters: {'p_sma': 25, 'p_std': 32, 'p_atr': 22, 'p_adx': 7, 'rsi_period': 45, 'ema1': 24, 'ema2': 21, 'slip_atr_k': 0.041027605952081075, 'slip_spread_k': 0.48918685812049484, 'spread_hl_frac': 0.002646717219499905, 'bb_std_mult': 0.9851176028463484, 'rsi_os': 29, 'rsi_ob': 49, 'vol_spike': 0.20571213437744998, 'adx_thresh': 23.91401713207289, 'atr_min_pct': 0.022718102021495004, 'atr_max_pct': 0.07927225527976585, 'tp_mult': 2.0676480190382747, 'tsl_mult': 0.05845050521310391, 'strategy': 'breakout', 'time_stop': 152, 'use_sma': False, 'use_atr': True, 'use_adx': True, 'use_ema': True, 'use_spike': False, 'rsi_required': False, 'edge_k': 0.23039009639985164, 'edge_cap': 0.07650063480128422, 'bull_strategy': 'mean_reversion', 'bull_bb_std_mult': 1.6183684961205176, 'bull_rsi_os': 39, 'bull_rsi_ob': 51, 'bull_adx_thresh': 5.076258988422774, 'bull_atr_min_pct': 0.016034450238078597, 'bull_atr_max_pct': 0.11153093518543346, 'bull_tp_mult': 1.26719162441431, 'bull_tsl_mult': 0.6341839981314153, 'bull_time_stop': 150, 'bull_use_sma': False, 'bull_use_ema': False, 'bull_use_atr': True, 'bull_use_adx': False, 'bull_use_spike': False, 'bull_rsi_required': False, 'bear_strategy': 'breakout', 'bear_bb_std_mult': 1.3834086662932967, 'bear_rsi_os': 28, 'bear_rsi_ob': 52, 'bear_adx_thresh': 5.754957842995908, 'bear_atr_min_pct': 0.004081772407609734, 'bear_atr_max_pct': 0.016108428034465543, 'bear_tp_mult': 1.5125615616499897, 'bear_tsl_mult': 0.8603865795592623, 'bear_time_stop': 280, 'bear_use_sma': True, 'bear_use_ema': False, 'bear_use_atr': True, 'bear_use_adx': True, 'bear_use_spike': False, 'bear_rsi_required': True, 'sideways_strategy': 'breakout', 'sideways_bb_std_mult': 2.085817111806165, 'sideways_rsi_os': 45, 'sideways_rsi_ob': 91, 'sideways_adx_thresh': 34.230383404647995, 'sideways_atr_min_pct': 0.025715430794944143, 'sideways_atr_max_pct': 0.13858302260423488, 'sideways_tp_mult': 2.715949276603796, 'sideways_tsl_mult': 0.38021258843821953, 'sideways_time_stop': 103, 'sideways_use_sma': False, 'sideways_use_ema': False, 'sideways_use_atr': True, 'sideways_use_adx': True, 'sideways_use_spike': True, 'sideways_rsi_required': False}.
[I 2025-09-01 11:51:06,321] Trial 436 finished with values: [-1000000000.0, 1000000000.0] and parameters: {'p_sma': 21, 'p_std': 32, 'p_atr': 22, 'p_adx': 7, 'rsi_period': 44, 'ema1': 24, 'ema2': 21, 'slip_atr_k': 0.09182108854315114, 'slip_spread_k': 0.4864068815601966, 'spread_hl_frac': 0.0024807876061324436, 'bb_std_mult': 0.9770021950176112, 'rsi_os': 29, 'rsi_ob': 52, 'vol_spike': 0.22195999226644414, 'adx_thresh': 23.66833020967812, 'atr_min_pct': 0.02269132280419678, 'atr_max_pct': 0.07067337096496683, 'tp_mult': 2.079376851689069, 'tsl_mult': 0.05729320463185703, 'strategy': 'breakout', 'time_stop': 170, 'use_sma': False, 'use_atr': True, 'use_adx': True, 'use_ema': True, 'use_spike': False, 'rsi_required': False, 'edge_k': 0.22651124270355247, 'edge_cap': 0.07392115243793353, 'bull_strategy': 'mean_reversion', 'bull_bb_std_mult': 1.6062329828464756, 'bull_rsi_os': 39, 'bull_rsi_ob': 51, 'bull_adx_thresh': 5.028285112279098, 'bull_atr_min_pct': 0.01601458873967831, 'bull_atr_max_pct': 0.10767465613686647, 'bull_tp_mult': 1.2756274344644887, 'bull_tsl_mult': 0.634690951605764, 'bull_time_stop': 169, 'bull_use_sma': False, 'bull_use_ema': False, 'bull_use_atr': True, 'bull_use_adx': False, 'bull_use_spike': False, 'bull_rsi_required': False, 'bear_strategy': 'breakout', 'bear_bb_std_mult': 1.2458348740049487, 'bear_rsi_os': 29, 'bear_rsi_ob': 52, 'bear_adx_thresh': 8.126073637484769, 'bear_atr_min_pct': 0.004190951806936607, 'bear_atr_max_pct': 0.015367268935388964, 'bear_tp_mult': 1.5160489327973186, 'bear_tsl_mult': 0.6030402585516224, 'bear_time_stop': 283, 'bear_use_sma': True, 'bear_use_ema': False, 'bear_use_atr': True, 'bear_use_adx': True, 'bear_use_spike': False, 'bear_rsi_required': True, 'sideways_strategy': 'breakout', 'sideways_bb_std_mult': 2.0553265610504634, 'sideways_rsi_os': 45, 'sideways_rsi_ob': 91, 'sideways_adx_thresh': 33.97706115694513, 'sideways_atr_min_pct': 0.026110125981481592, 'sideways_atr_max_pct': 0.1382416550430494, 'sideways_tp_mult': 2.7149310191664164, 'sideways_tsl_mult': 0.38094391927799565, 'sideways_time_stop': 102, 'sideways_use_sma': False, 'sideways_use_ema': False, 'sideways_use_atr': True, 'sideways_use_adx': True, 'sideways_use_spike': True, 'sideways_rsi_required': False}.
[I 2025-09-01 11:51:06,934] Trial 439 finished with values: [-1000000000.0, 1000000000.0] and parameters: {'p_sma': 25, 'p_std': 35, 'p_atr': 22, 'p_adx': 7, 'rsi_period': 44, 'ema1': 25, 'ema2': 21, 'slip_atr_k': 0.04067120457728617, 'slip_spread_k': 0.499966426115297, 'spread_hl_frac': 0.002483856220255997, 'bb_std_mult': 1.0031453300504194, 'rsi_os': 29, 'rsi_ob': 49, 'vol_spike': 0.19700962550580134, 'adx_thresh': 24.74075179668949, 'atr_min_pct': 0.02276608593836398, 'atr_max_pct': 0.07010704883889948, 'tp_mult': 2.0652948317089064, 'tsl_mult': 0.059345302990453014, 'strategy': 'breakout', 'time_stop': 152, 'use_sma': False, 'use_atr': True, 'use_adx': True, 'use_ema': True, 'use_spike': False, 'rsi_required': False, 'edge_k': 0.2361529493310756, 'edge_cap': 0.0756722471539753, 'bull_strategy': 'mean_reversion', 'bull_bb_std_mult': 1.6430106461754783, 'bull_rsi_os': 41, 'bull_rsi_ob': 51, 'bull_adx_thresh': 5.5725346441783, 'bull_atr_min_pct': 0.015814169298586374, 'bull_atr_max_pct': 0.10718139055662318, 'bull_tp_mult': 1.2931587581556663, 'bull_tsl_mult': 0.6388525537596831, 'bull_time_stop': 151, 'bull_use_sma': False, 'bull_use_ema': False, 'bull_use_atr': True, 'bull_use_adx': False, 'bull_use_spike': False, 'bull_rsi_required': False, 'bear_strategy': 'breakout', 'bear_bb_std_mult': 1.3648392057255379, 'bear_rsi_os': 28, 'bear_rsi_ob': 53, 'bear_adx_thresh': 5.966357672615791, 'bear_atr_min_pct': 0.00438870612754187, 'bear_atr_max_pct': 0.016087225827372487, 'bear_tp_mult': 1.5149632326742755, 'bear_tsl_mult': 0.6746964179341355, 'bear_time_stop': 283, 'bear_use_sma': True, 'bear_use_ema': False, 'bear_use_atr': True, 'bear_use_adx': True, 'bear_use_spike': False, 'bear_rsi_required': True, 'sideways_strategy': 'breakout', 'sideways_bb_std_mult': 2.0613491155614545, 'sideways_rsi_os': 45, 'sideways_rsi_ob': 91, 'sideways_adx_thresh': 34.16464878902273, 'sideways_atr_min_pct': 0.025901200997272538, 'sideways_atr_max_pct': 0.13749515626462222, 'sideways_tp_mult': 2.7259338316117945, 'sideways_tsl_mult': 0.38075978935879523, 'sideways_time_stop': 101, 'sideways_use_sma': False, 'sideways_use_ema': False, 'sideways_use_atr': True, 'sideways_use_adx': True, 'sideways_use_spike': True, 'sideways_rsi_required': False}.
[I 2025-09-01 11:51:07,906] Trial 438 finished with values: [-0.0009390322256751515, 0.006562713354173027] and parameters: {'p_sma': 21, 'p_std': 32, 'p_atr': 22, 'p_adx': 7, 'rsi_period': 44, 'ema1': 25, 'ema2': 21, 'slip_atr_k': 0.04477608346946986, 'slip_spread_k': 0.4867308568672517, 'spread_hl_frac': 0.0025770486339762445, 'bb_std_mult': 1.0047250559484004, 'rsi_os': 29, 'rsi_ob': 50, 'vol_spike': 0.1960345327422523, 'adx_thresh': 24.72860512333945, 'atr_min_pct': 0.02250490511588545, 'atr_max_pct': 0.07165562343240656, 'tp_mult': 2.0800089359288205, 'tsl_mult': 0.06205529958609926, 'strategy': 'breakout', 'time_stop': 171, 'use_sma': False, 'use_atr': True, 'use_adx': True, 'use_ema': True, 'use_spike': False, 'rsi_required': False, 'edge_k': 0.23586887974316878, 'edge_cap': 0.06997325957014673, 'bull_strategy': 'mean_reversion', 'bull_bb_std_mult': 1.628963825753798, 'bull_rsi_os': 39, 'bull_rsi_ob': 51, 'bull_adx_thresh': 5.0571814751446595, 'bull_atr_min_pct': 0.01568641026303809, 'bull_atr_max_pct': 0.10787190063460989, 'bull_tp_mult': 1.3019868228831906, 'bull_tsl_mult': 0.6342982594837425, 'bull_time_stop': 152, 'bull_use_sma': False, 'bull_use_ema': False, 'bull_use_atr': True, 'bull_use_adx': False, 'bull_use_spike': False, 'bull_rsi_required': False, 'bear_strategy': 'breakout', 'bear_bb_std_mult': 1.3751847917020075, 'bear_rsi_os': 28, 'bear_rsi_ob': 52, 'bear_adx_thresh': 7.917169422986294, 'bear_atr_min_pct': 0.004069988652321407, 'bear_atr_max_pct': 0.015992558351528702, 'bear_tp_mult': 1.5110718466928184, 'bear_tsl_mult': 0.6729954310835595, 'bear_time_stop': 277, 'bear_use_sma': True, 'bear_use_ema': False, 'bear_use_atr': True, 'bear_use_adx': True, 'bear_use_spike': False, 'bear_rsi_required': True, 'sideways_strategy': 'breakout', 'sideways_bb_std_mult': 2.0592282204934627, 'sideways_rsi_os': 45, 'sideways_rsi_ob': 91, 'sideways_adx_thresh': 34.02557681334749, 'sideways_atr_min_pct': 0.025813689279050263, 'sideways_atr_max_pct': 0.1375160892390165, 'sideways_tp_mult': 2.7174468081794467, 'sideways_tsl_mult': 0.3806198591509926, 'sideways_time_stop': 86, 'sideways_use_sma': False, 'sideways_use_ema': False, 'sideways_use_atr': True, 'sideways_use_adx': True, 'sideways_use_spike': True, 'sideways_rsi_required': False}.
[I 2025-09-01 11:51:49,708] Trial 442 finished with values: [-1000000000.0, 1000000000.0] and parameters: {'p_sma': 26, 'p_std': 35, 'p_atr': 21, 'p_adx': 8, 'rsi_period': 46, 'ema1': 25, 'ema2': 20, 'slip_atr_k': 0.043117237625752036, 'slip_spread_k': 0.43828456489448875, 'spread_hl_frac': 0.0044188748072215124, 'bb_std_mult': 0.8420733372089392, 'rsi_os': 31, 'rsi_ob': 49, 'vol_spike': 0.20456628305897184, 'adx_thresh': 23.813737471595413, 'atr_min_pct': 0.02429399770319326, 'atr_max_pct': 0.08039681754837802, 'tp_mult': 2.0511338781494204, 'tsl_mult': 0.12286467397531234, 'strategy': 'breakout', 'time_stop': 178, 'use_sma': False, 'use_atr': True, 'use_adx': True, 'use_ema': True, 'use_spike': False, 'rsi_required': False, 'edge_k': 0.260453248097149, 'edge_cap': 0.07741884603323634, 'bull_strategy': 'mean_reversion', 'bull_bb_std_mult': 1.7804773685717965, 'bull_rsi_os': 39, 'bull_rsi_ob': 52, 'bull_adx_thresh': 6.694147366696824, 'bull_atr_min_pct': 0.019323989390420605, 'bull_atr_max_pct': 0.11073531792735374, 'bull_tp_mult': 1.3551309123109299, 'bull_tsl_mult': 0.6191964135918716, 'bull_time_stop': 177, 'bull_use_sma': False, 'bull_use_ema': False, 'bull_use_atr': True, 'bull_use_adx': False, 'bull_use_spike': False, 'bull_rsi_required': False, 'bear_strategy': 'breakout', 'bear_bb_std_mult': 1.3747560309133653, 'bear_rsi_os': 28, 'bear_rsi_ob': 49, 'bear_adx_thresh': 6.787060944752549, 'bear_atr_min_pct': 0.005492735136784936, 'bear_atr_max_pct': 0.017310082281083536, 'bear_tp_mult': 1.474085576903929, 'bear_tsl_mult': 0.7391604047125642, 'bear_time_stop': 275, 'bear_use_sma': True, 'bear_use_ema': False, 'bear_use_atr': True, 'bear_use_adx': True, 'bear_use_spike': False, 'bear_rsi_required': True, 'sideways_strategy': 'breakout', 'sideways_bb_std_mult': 1.893281430554901, 'sideways_rsi_os': 45, 'sideways_rsi_ob': 90, 'sideways_adx_thresh': 33.40635085179506, 'sideways_atr_min_pct': 0.02543371172407573, 'sideways_atr_max_pct': 0.1351138265666053, 'sideways_tp_mult': 2.77492791135126, 'sideways_tsl_mult': 0.36329428823830967, 'sideways_time_stop': 84, 'sideways_use_sma': False, 'sideways_use_ema': False, 'sideways_use_atr': True, 'sideways_use_adx': True, 'sideways_use_spike': True, 'sideways_rsi_required': False}.
