[I 2025-09-01 11:34:09,599] Trial 343 finished with values: [-1000000000.0, 1000000000.0] and parameters: {'p_sma': 13, 'p_std': 36, 'p_atr': 19, 'p_adx': 9, 'rsi_period': 50, 'ema1': 20, 'ema2': 10, 'slip_atr_k': 0.010476481981996468, 'slip_spread_k': 0.42063124446486466, 'spread_hl_frac': 0.026593873441278185, 'bb_std_mult': 3.2286837343143313, 'rsi_os': 29, 'rsi_ob': 88, 'vol_spike': 0.27811833788712315, 'adx_thresh': 22.037246316921344, 'atr_min_pct': 0.026700841184282544, 'atr_max_pct': 0.02628862973564956, 'tp_mult': 2.0507452352983773, 'tsl_mult': 0.8707616447919695, 'strategy': 'breakout', 'time_stop': 288, 'use_sma': False, 'use_atr': False, 'use_adx': False, 'use_ema': True, 'use_spike': True, 'rsi_required': False, 'edge_k': 0.45112205784881976, 'edge_cap': 0.23757036715704577, 'bull_strategy': 'breakout', 'bull_bb_std_mult': 0.7178019368489261, 'bull_rsi_os': 49, 'bull_rsi_ob': 82, 'bull_adx_thresh': 6.810200004220092, 'bull_atr_min_pct': 0.004796385574602588, 'bull_atr_max_pct': 0.09336493507356759, 'bull_tp_mult': 2.050511275534895, 'bull_tsl_mult': 0.38427922805003784, 'bull_time_stop': 296, 'bull_use_sma': False, 'bull_use_ema': True, 'bull_use_atr': True, 'bull_use_adx': False, 'bull_use_spike': True, 'bull_rsi_required': True, 'bear_strategy': 'mean_reversion', 'bear_bb_std_mult': 0.9336704485252132, 'bear_rsi_os': 25, 'bear_rsi_ob': 47, 'bear_adx_thresh': 9.41589184000818, 'bear_atr_min_pct': 0.0032334666484501286, 'bear_atr_max_pct': 0.03234935499340366, 'bear_tp_mult': 1.2288012315723573, 'bear_tsl_mult': 0.9985445646021163, 'bear_time_stop': 66, 'bear_use_sma': True, 'bear_use_ema': True, 'bear_use_atr': False, 'bear_use_adx': False, 'bear_use_spike': True, 'bear_rsi_required': True, 'sideways_strategy': 'mean_reversion', 'sideways_bb_std_mult': 1.7395740857095767, 'sideways_rsi_os': 37, 'sideways_rsi_ob': 95, 'sideways_adx_thresh': 5.163536412258047, 'sideways_atr_min_pct': 0.023191400740961113, 'sideways_atr_max_pct': 0.08568155665417837, 'sideways_tp_mult': 1.491926100050137, 'sideways_tsl_mult': 0.36408697349585734, 'sideways_time_stop': 237, 'sideways_use_sma': True, 'sideways_use_ema': True, 'sideways_use_atr': True, 'sideways_use_adx': False, 'sideways_use_spike': False, 'sideways_rsi_required': True}.
[I 2025-09-01 11:34:49,648] Trial 345 finished with values: [-0.020007674841854506, 0.020287147152994425] and parameters: {'p_sma': 13, 'p_std': 36, 'p_atr': 20, 'p_adx': 9, 'rsi_period': 52, 'ema1': 20, 'ema2': 17, 'slip_atr_k': 0.10706674294402156, 'slip_spread_k': 0.3226705436564655, 'spread_hl_frac': 0.02410877297031957, 'bb_std_mult': 1.6067299785620532, 'rsi_os': 29, 'rsi_ob': 86, 'vol_spike': 0.2745262704084473, 'adx_thresh': 20.778451981233104, 'atr_min_pct': 0.026955295958854143, 'atr_max_pct': 0.03329640945489822, 'tp_mult': 2.05040724783654, 'tsl_mult': 0.8769009361653077, 'strategy': 'breakout', 'time_stop': 258, 'use_sma': False, 'use_atr': False, 'use_adx': False, 'use_ema': True, 'use_spike': True, 'rsi_required': False, 'edge_k': 0.4534769964186521, 'edge_cap': 0.22504204117367788, 'bull_strategy': 'breakout', 'bull_bb_std_mult': 0.731764144886682, 'bull_rsi_os': 49, 'bull_rsi_ob': 81, 'bull_adx_thresh': 7.932074634073928, 'bull_atr_min_pct': 0.005418078189449942, 'bull_atr_max_pct': 0.09887618210542623, 'bull_tp_mult': 2.0542176624850432, 'bull_tsl_mult': 0.5908672936880075, 'bull_time_stop': 223, 'bull_use_sma': False, 'bull_use_ema': True, 'bull_use_atr': True, 'bull_use_adx': True, 'bull_use_spike': True, 'bull_rsi_required': True, 'bear_strategy': 'breakout', 'bear_bb_std_mult': 0.9550945248160438, 'bear_rsi_os': 24, 'bear_rsi_ob': 46, 'bear_adx_thresh': 10.68778785192, 'bear_atr_min_pct': 0.0035192846622044884, 'bear_atr_max_pct': 0.10106851321316832, 'bear_tp_mult': 1.3720466247673222, 'bear_tsl_mult': 0.9989255945453728, 'bear_time_stop': 92, 'bear_use_sma': True, 'bear_use_ema': True, 'bear_use_atr': False, 'bear_use_adx': False, 'bear_use_spike': True, 'bear_rsi_required': True, 'sideways_strategy': 'breakout', 'sideways_bb_std_mult': 2.1955251152967405, 'sideways_rsi_os': 37, 'sideways_rsi_ob': 95, 'sideways_adx_thresh': 7.482611867571359, 'sideways_atr_min_pct': 0.021381683983900182, 'sideways_atr_max_pct': 0.08476008479776462, 'sideways_tp_mult': 1.5011669057969326, 'sideways_tsl_mult': 0.3715305792024723, 'sideways_time_stop': 237, 'sideways_use_sma': True, 'sideways_use_ema': True, 'sideways_use_atr': True, 'sideways_use_adx': False, 'sideways_use_spike': False, 'sideways_rsi_required': True}.
[I 2025-09-01 11:34:50,586] Trial 344 finished with values: [-1000000000.0, 1000000000.0] and parameters: {'p_sma': 20, 'p_std': 36, 'p_atr': 20, 'p_adx': 9, 'rsi_period': 50, 'ema1': 20, 'ema2': 10, 'slip_atr_k': 0.10836029899933132, 'slip_spread_k': 0.45169612507896456, 'spread_hl_frac': 0.026354700127368905, 'bb_std_mult': 1.272332411172864, 'rsi_os': 30, 'rsi_ob': 88, 'vol_spike': 0.2778059926356303, 'adx_thresh': 20.835454696957775, 'atr_min_pct': 0.026824575096834814, 'atr_max_pct': 0.03204516670069704, 'tp_mult': 2.2563922770097555, 'tsl_mult': 0.8801581985541935, 'strategy': 'breakout', 'time_stop': 260, 'use_sma': False, 'use_atr': False, 'use_adx': False, 'use_ema': True, 'use_spike': True, 'rsi_required': False, 'edge_k': 0.3752382051710424, 'edge_cap': 0.2481057926351669, 'bull_strategy': 'breakout', 'bull_bb_std_mult': 0.7362304284173886, 'bull_rsi_os': 49, 'bull_rsi_ob': 81, 'bull_adx_thresh': 6.933858064030459, 'bull_atr_min_pct': 0.00531947522527918, 'bull_atr_max_pct': 0.09181366861283966, 'bull_tp_mult': 2.0246703305568596, 'bull_tsl_mult': 0.5725637235808623, 'bull_time_stop': 294, 'bull_use_sma': False, 'bull_use_ema': True, 'bull_use_atr': True, 'bull_use_adx': True, 'bull_use_spike': True, 'bull_rsi_required': False, 'bear_strategy': 'breakout', 'bear_bb_std_mult': 0.9347614715321702, 'bear_rsi_os': 13, 'bear_rsi_ob': 62, 'bear_adx_thresh': 10.615658136371755, 'bear_atr_min_pct': 0.003498455012572147, 'bear_atr_max_pct': 0.03217114872176487, 'bear_tp_mult': 1.3945764424475195, 'bear_tsl_mult': 0.9665146150395578, 'bear_time_stop': 71, 'bear_use_sma': True, 'bear_use_ema': True, 'bear_use_atr': False, 'bear_use_adx': False, 'bear_use_spike': True, 'bear_rsi_required': True, 'sideways_strategy': 'breakout', 'sideways_bb_std_mult': 1.9833212093753092, 'sideways_rsi_os': 39, 'sideways_rsi_ob': 95, 'sideways_adx_thresh': 5.2192926483469835, 'sideways_atr_min_pct': 0.023475664115886002, 'sideways_atr_max_pct': 0.08798809899688109, 'sideways_tp_mult': 1.499640188707542, 'sideways_tsl_mult': 0.43034707835924113, 'sideways_time_stop': 248, 'sideways_use_sma': True, 'sideways_use_ema': True, 'sideways_use_atr': True, 'sideways_use_adx': False, 'sideways_use_spike': False, 'sideways_rsi_required': True}.
[I 2025-09-01 11:34:51,394] Trial 342 finished with values: [-1000000000.0, 1000000000.0] and parameters: {'p_sma': 13, 'p_std': 35, 'p_atr': 19, 'p_adx': 8, 'rsi_period': 51, 'ema1': 20, 'ema2': 13, 'slip_atr_k': 0.13282023431630097, 'slip_spread_k': 0.41289049494045876, 'spread_hl_frac': 0.02746709151852728, 'bb_std_mult': 3.182755374876403, 'rsi_os': 29, 'rsi_ob': 88, 'vol_spike': 0.2792162721058738, 'adx_thresh': 21.911309609365137, 'atr_min_pct': 0.028177738763814266, 'atr_max_pct': 0.03284848240327896, 'tp_mult': 2.284800565706494, 'tsl_mult': 0.8742591902681012, 'strategy': 'breakout', 'time_stop': 258, 'use_sma': False, 'use_atr': False, 'use_adx': False, 'use_ema': True, 'use_spike': True, 'rsi_required': False, 'edge_k': 0.3775330470627609, 'edge_cap': 0.24257332148618568, 'bull_strategy': 'breakout', 'bull_bb_std_mult': 0.7076080515518919, 'bull_rsi_os': 50, 'bull_rsi_ob': 82, 'bull_adx_thresh': 6.987630937706393, 'bull_atr_min_pct': 0.005279634122027343, 'bull_atr_max_pct': 0.14533622017702708, 'bull_tp_mult': 1.896165422136452, 'bull_tsl_mult': 0.5821301019837558, 'bull_time_stop': 294, 'bull_use_sma': True, 'bull_use_ema': True, 'bull_use_atr': True, 'bull_use_adx': False, 'bull_use_spike': True, 'bull_rsi_required': True, 'bear_strategy': 'mean_reversion', 'bear_bb_std_mult': 0.9482272950149814, 'bear_rsi_os': 10, 'bear_rsi_ob': 47, 'bear_adx_thresh': 9.422097544971821, 'bear_atr_min_pct': 0.0035649877795839776, 'bear_atr_max_pct': 0.0282429214379935, 'bear_tp_mult': 1.2322515570888395, 'bear_tsl_mult': 0.9979013483598943, 'bear_time_stop': 65, 'bear_use_sma': True, 'bear_use_ema': True, 'bear_use_atr': False, 'bear_use_adx': False, 'bear_use_spike': True, 'bear_rsi_required': True, 'sideways_strategy': 'mean_reversion', 'sideways_bb_std_mult': 2.2762788981200845, 'sideways_rsi_os': 37, 'sideways_rsi_ob': 95, 'sideways_adx_thresh': 6.949227027275838, 'sideways_atr_min_pct': 0.021327827337569764, 'sideways_atr_max_pct': 0.08543145481054054, 'sideways_tp_mult': 1.3563990806687827, 'sideways_tsl_mult': 0.32353608058133787, 'sideways_time_stop': 259, 'sideways_use_sma': True, 'sideways_use_ema': True, 'sideways_use_atr': True, 'sideways_use_adx': False, 'sideways_use_spike': False, 'sideways_rsi_required': False}.
[I 2025-09-01 11:34:51,866] Trial 346 finished with values: [-0.019986727482049882, 0.01978583446955951] and parameters: {'p_sma': 42, 'p_std': 35, 'p_atr': 20, 'p_adx': 9, 'rsi_period': 52, 'ema1': 20, 'ema2': 17, 'slip_atr_k': 0.1320069716673358, 'slip_spread_k': 0.45562650630222534, 'spread_hl_frac': 0.023814475011944686, 'bb_std_mult': 3.3344456570520595, 'rsi_os': 29, 'rsi_ob': 86, 'vol_spike': 0.2754351565433627, 'adx_thresh': 20.762653721204092, 'atr_min_pct': 0.027673098426536674, 'atr_max_pct': 0.033747474940171704, 'tp_mult': 2.2809339935851316, 'tsl_mult': 0.8844783980850908, 'strategy': 'breakout', 'time_stop': 259, 'use_sma': False, 'use_atr': False, 'use_adx': False, 'use_ema': True, 'use_spike': True, 'rsi_required': False, 'edge_k': 0.37226130733597473, 'edge_cap': 0.2465827552130142, 'bull_strategy': 'breakout', 'bull_bb_std_mult': 0.682222596832128, 'bull_rsi_os': 53, 'bull_rsi_ob': 81, 'bull_adx_thresh': 7.376520424225403, 'bull_atr_min_pct': 0.002837236106497977, 'bull_atr_max_pct': 0.09108320593407873, 'bull_tp_mult': 2.090276628913194, 'bull_tsl_mult': 0.6567118879986185, 'bull_time_stop': 277, 'bull_use_sma': True, 'bull_use_ema': True, 'bull_use_atr': True, 'bull_use_adx': True, 'bull_use_spike': True, 'bull_rsi_required': False, 'bear_strategy': 'breakout', 'bear_bb_std_mult': 0.9470460023143173, 'bear_rsi_os': 13, 'bear_rsi_ob': 75, 'bear_adx_thresh': 10.422950796735112, 'bear_atr_min_pct': 0.00523282294402567, 'bear_atr_max_pct': 0.038259314019208596, 'bear_tp_mult': 1.2998003908885432, 'bear_tsl_mult': 0.9647796836338208, 'bear_time_stop': 90, 'bear_use_sma': True, 'bear_use_ema': True, 'bear_use_atr': False, 'bear_use_adx': False, 'bear_use_spike': True, 'bear_rsi_required': True, 'sideways_strategy': 'breakout', 'sideways_bb_std_mult': 1.9191205299851188, 'sideways_rsi_os': 39, 'sideways_rsi_ob': 94, 'sideways_adx_thresh': 5.82516690062978, 'sideways_atr_min_pct': 0.02453716246473556, 'sideways_atr_max_pct': 0.08379260760759814, 'sideways_tp_mult': 1.4334339976348895, 'sideways_tsl_mult': 0.4154955398523212, 'sideways_time_stop': 253, 'sideways_use_sma': True, 'sideways_use_ema': True, 'sideways_use_atr': True, 'sideways_use_adx': False, 'sideways_use_spike': False, 'sideways_rsi_required': True}.
[I 2025-09-01 11:35:32,002] Trial 348 finished with values: [-0.016557334645631805, 0.016653677427282427] and parameters: {'p_sma': 37, 'p_std': 38, 'p_atr': 19, 'p_adx': 10, 'rsi_period': 54, 'ema1': 19, 'ema2': 13, 'slip_atr_k': 0.17923628617838777, 'slip_spread_k': 0.43526535344210193, 'spread_hl_frac': 0.02798105885477931, 'bb_std_mult': 3.3392202873297006, 'rsi_os': 26, 'rsi_ob': 86, 'vol_spike': 0.2881369223628653, 'adx_thresh': 22.247852450367745, 'atr_min_pct': 0.027564880062237274, 'atr_max_pct': 0.13243333036904062, 'tp_mult': 2.1321524051519103, 'tsl_mult': 0.8611579421282306, 'strategy': 'breakout', 'time_stop': 259, 'use_sma': False, 'use_atr': False, 'use_adx': False, 'use_ema': True, 'use_spike': True, 'rsi_required': False, 'edge_k': 0.3003388969468832, 'edge_cap': 0.2761390207046838, 'bull_strategy': 'breakout', 'bull_bb_std_mult': 0.6531212895925735, 'bull_rsi_os': 53, 'bull_rsi_ob': 83, 'bull_adx_thresh': 7.555415909779976, 'bull_atr_min_pct': 0.0030371732413425304, 'bull_atr_max_pct': 0.0982349799369826, 'bull_tp_mult': 1.9374710485936562, 'bull_tsl_mult': 0.41260042998688956, 'bull_time_stop': 278, 'bull_use_sma': True, 'bull_use_ema': True, 'bull_use_atr': True, 'bull_use_adx': True, 'bull_use_spike': True, 'bull_rsi_required': False, 'bear_strategy': 'breakout', 'bear_bb_std_mult': 3.4104681255697087, 'bear_rsi_os': 22, 'bear_rsi_ob': 64, 'bear_adx_thresh': 11.532281981465564, 'bear_atr_min_pct': 0.003948284822323676, 'bear_atr_max_pct': 0.025842080528759352, 'bear_tp_mult': 1.3033480119425378, 'bear_tsl_mult': 0.9677943124944713, 'bear_time_stop': 60, 'bear_use_sma': True, 'bear_use_ema': True, 'bear_use_atr': False, 'bear_use_adx': False, 'bear_use_spike': True, 'bear_rsi_required': True, 'sideways_strategy': 'mean_reversion', 'sideways_bb_std_mult': 2.3131929872011607, 'sideways_rsi_os': 40, 'sideways_rsi_ob': 92, 'sideways_adx_thresh': 6.176120429954503, 'sideways_atr_min_pct': 0.02487184166852844, 'sideways_atr_max_pct': 0.08782246953667007, 'sideways_tp_mult': 1.4467359050641677, 'sideways_tsl_mult': 0.4155801411205274, 'sideways_time_stop': 255, 'sideways_use_sma': True, 'sideways_use_ema': True, 'sideways_use_atr': True, 'sideways_use_adx': False, 'sideways_use_spike': False, 'sideways_rsi_required': True}.
[I 2025-09-01 11:35:32,888] Trial 350 finished with values: [-1000000000.0, 1000000000.0] and parameters: {'p_sma': 11, 'p_std': 38, 'p_atr': 18, 'p_adx': 10, 'rsi_period': 49, 'ema1': 19, 'ema2': 14, 'slip_atr_k': 0.008687336646799885, 'slip_spread_k': 0.361275336434057, 'spread_hl_frac': 0.0422296256620588, 'bb_std_mult': 3.25785540844289, 'rsi_os': 48, 'rsi_ob': 86, 'vol_spike': 0.26053686723581126, 'adx_thresh': 22.49281417293668, 'atr_min_pct': 0.027750802854358114, 'atr_max_pct': 0.13419221576624388, 'tp_mult': 2.3558523701493557, 'tsl_mult': 0.8983199589941676, 'strategy': 'breakout', 'time_stop': 269, 'use_sma': False, 'use_atr': False, 'use_adx': False, 'use_ema': True, 'use_spike': True, 'rsi_required': False, 'edge_k': 0.3076360919967629, 'edge_cap': 0.2732376036254328, 'bull_strategy': 'breakout', 'bull_bb_std_mult': 0.5104720902806565, 'bull_rsi_os': 52, 'bull_rsi_ob': 83, 'bull_adx_thresh': 6.644156417013864, 'bull_atr_min_pct': 0.0033666578480266935, 'bull_atr_max_pct': 0.09865465373623136, 'bull_tp_mult': 1.9459694620261963, 'bull_tsl_mult': 0.2620296136275645, 'bull_time_stop': 280, 'bull_use_sma': True, 'bull_use_ema': True, 'bull_use_atr': False, 'bull_use_adx': True, 'bull_use_spike': True, 'bull_rsi_required': False, 'bear_strategy': 'breakout', 'bear_bb_std_mult': 1.1061615670145528, 'bear_rsi_os': 27, 'bear_rsi_ob': 80, 'bear_adx_thresh': 9.873252249061698, 'bear_atr_min_pct': 0.004324894136116776, 'bear_atr_max_pct': 0.026114044734942398, 'bear_tp_mult': 1.3158653217141298, 'bear_tsl_mult': 0.9382479492769185, 'bear_time_stop': 81, 'bear_use_sma': True, 'bear_use_ema': True, 'bear_use_atr': False, 'bear_use_adx': False, 'bear_use_spike': True, 'bear_rsi_required': True, 'sideways_strategy': 'mean_reversion', 'sideways_bb_std_mult': 2.0956535132220813, 'sideways_rsi_os': 41, 'sideways_rsi_ob': 92, 'sideways_adx_thresh': 6.3639663419328025, 'sideways_atr_min_pct': 0.024076939027922576, 'sideways_atr_max_pct': 0.07743737066058913, 'sideways_tp_mult': 1.4385320008361586, 'sideways_tsl_mult': 0.4421823893075396, 'sideways_time_stop': 251, 'sideways_use_sma': True, 'sideways_use_ema': True, 'sideways_use_atr': True, 'sideways_use_adx': False, 'sideways_use_spike': False, 'sideways_rsi_required': True}.
[I 2025-09-01 11:35:33,429] Trial 347 finished with values: [-0.009010889729670124, 0.009090081213059558] and parameters: {'p_sma': 42, 'p_std': 38, 'p_atr': 20, 'p_adx': 9, 'rsi_period': 54, 'ema1': 19, 'ema2': 13, 'slip_atr_k': 0.09953305802698058, 'slip_spread_k': 0.4417238662438235, 'spread_hl_frac': 0.028073779881263087, 'bb_std_mult': 3.2467001597449183, 'rsi_os': 29, 'rsi_ob': 88, 'vol_spike': 0.2575904928441351, 'adx_thresh': 20.964556794541803, 'atr_min_pct': 0.027556571566594933, 'atr_max_pct': 0.033302566922824524, 'tp_mult': 2.262994448015919, 'tsl_mult': 0.8608363867059495, 'strategy': 'breakout', 'time_stop': 261, 'use_sma': False, 'use_atr': False, 'use_adx': False, 'use_ema': True, 'use_spike': True, 'rsi_required': False, 'edge_k': 0.3595982099739031, 'edge_cap': 0.2431487669623857, 'bull_strategy': 'breakout', 'bull_bb_std_mult': 0.6757862799287809, 'bull_rsi_os': 52, 'bull_rsi_ob': 82, 'bull_adx_thresh': 6.681043165651963, 'bull_atr_min_pct': 0.0032016250684059914, 'bull_atr_max_pct': 0.09104061950228691, 'bull_tp_mult': 1.9445893133528573, 'bull_tsl_mult': 0.49487825431480864, 'bull_time_stop': 278, 'bull_use_sma': True, 'bull_use_ema': True, 'bull_use_atr': True, 'bull_use_adx': True, 'bull_use_spike': True, 'bull_rsi_required': False, 'bear_strategy': 'breakout', 'bear_bb_std_mult': 3.395812026023993, 'bear_rsi_os': 21, 'bear_rsi_ob': 80, 'bear_adx_thresh': 11.159892096343544, 'bear_atr_min_pct': 0.00548347920922741, 'bear_atr_max_pct': 0.03854226792592426, 'bear_tp_mult': 1.3103176155690808, 'bear_tsl_mult': 0.9621777011449542, 'bear_time_stop': 74, 'bear_use_sma': True, 'bear_use_ema': True, 'bear_use_atr': False, 'bear_use_adx': False, 'bear_use_spike': True, 'bear_rsi_required': True, 'sideways_strategy': 'mean_reversion', 'sideways_bb_std_mult': 1.8943358843724831, 'sideways_rsi_os': 39, 'sideways_rsi_ob': 94, 'sideways_adx_thresh': 5.814081118941925, 'sideways_atr_min_pct': 0.024345383528275803, 'sideways_atr_max_pct': 0.08810490083913355, 'sideways_tp_mult': 1.4371376282556156, 'sideways_tsl_mult': 0.4249100763105699, 'sideways_time_stop': 250, 'sideways_use_sma': True, 'sideways_use_ema': True, 'sideways_use_atr': True, 'sideways_use_adx': False, 'sideways_use_spike': False, 'sideways_rsi_required': True}.
[I 2025-09-01 11:35:33,802] Trial 349 finished with values: [-0.07549390335009609, 0.0759355638989161] and parameters: {'p_sma': 50, 'p_std': 37, 'p_atr': 20, 'p_adx': 9, 'rsi_period': 17, 'ema1': 19, 'ema2': 15, 'slip_atr_k': 0.12811094760075367, 'slip_spread_k': 0.4399627912392529, 'spread_hl_frac': 0.02317117849238285, 'bb_std_mult': 3.3422559957191935, 'rsi_os': 26, 'rsi_ob': 86, 'vol_spike': 0.28801317514537944, 'adx_thresh': 22.44305815748517, 'atr_min_pct': 0.02756955309073288, 'atr_max_pct': 0.027669916263882963, 'tp_mult': 2.132652298086925, 'tsl_mult': 0.8534273688823204, 'strategy': 'breakout', 'time_stop': 270, 'use_sma': False, 'use_atr': False, 'use_adx': False, 'use_ema': True, 'use_spike': True, 'rsi_required': False, 'edge_k': 0.30816506800284127, 'edge_cap': 0.21578238950885636, 'bull_strategy': 'breakout', 'bull_bb_std_mult': 0.6646749278602504, 'bull_rsi_os': 52, 'bull_rsi_ob': 83, 'bull_adx_thresh': 7.496720505826341, 'bull_atr_min_pct': 0.0029520663958671205, 'bull_atr_max_pct': 0.09828172117550532, 'bull_tp_mult': 1.9524472288292734, 'bull_tsl_mult': 0.2697758840726215, 'bull_time_stop': 276, 'bull_use_sma': True, 'bull_use_ema': True, 'bull_use_atr': False, 'bull_use_adx': True, 'bull_use_spike': True, 'bull_rsi_required': False, 'bear_strategy': 'breakout', 'bear_bb_std_mult': 2.0291179247439923, 'bear_rsi_os': 21, 'bear_rsi_ob': 64, 'bear_adx_thresh': 8.45057534519493, 'bear_atr_min_pct': 0.0019304110792315895, 'bear_atr_max_pct': 0.02524003709469736, 'bear_tp_mult': 1.2923770116862412, 'bear_tsl_mult': 0.9695199965050397, 'bear_time_stop': 78, 'bear_use_sma': True, 'bear_use_ema': True, 'bear_use_atr': False, 'bear_use_adx': False, 'bear_use_spike': True, 'bear_rsi_required': True, 'sideways_strategy': 'mean_reversion', 'sideways_bb_std_mult': 1.532153537481348, 'sideways_rsi_os': 41, 'sideways_rsi_ob': 92, 'sideways_adx_thresh': 5.98807776899717, 'sideways_atr_min_pct': 0.023937477461292496, 'sideways_atr_max_pct': 0.07580946333059227, 'sideways_tp_mult': 1.385226007255617, 'sideways_tsl_mult': 0.44956538050555617, 'sideways_time_stop': 252, 'sideways_use_sma': True, 'sideways_use_ema': True, 'sideways_use_atr': True, 'sideways_use_adx': False, 'sideways_use_spike': False, 'sideways_rsi_required': True}.
