[I 2025-09-01 11:39:33,418] Trial 371 finished with values: [-1000000000.0, 1000000000.0] and parameters: {'p_sma': 15, 'p_std': 39, 'p_atr': 19, 'p_adx': 10, 'rsi_period': 27, 'ema1': 29, 'ema2': 15, 'slip_atr_k': 0.017050789205696807, 'slip_spread_k': 0.39196948018868805, 'spread_hl_frac': 0.024677507886106002, 'bb_std_mult': 3.2901480948091555, 'rsi_os': 25, 'rsi_ob': 86, 'vol_spike': 0.2637394343725722, 'adx_thresh': 21.838885146678987, 'atr_min_pct': 0.025215354468367066, 'atr_max_pct': 0.03295261273210204, 'tp_mult': 2.2713697201723684, 'tsl_mult': 0.8434478130834434, 'strategy': 'breakout', 'time_stop': 262, 'use_sma': False, 'use_atr': False, 'use_adx': False, 'use_ema': True, 'use_spike': True, 'rsi_required': False, 'edge_k': 1.2485954807067516, 'edge_cap': 0.24469545642122154, 'bull_strategy': 'breakout', 'bull_bb_std_mult': 0.7126870040307836, 'bull_rsi_os': 9, 'bull_rsi_ob': 84, 'bull_adx_thresh': 6.049147335290094, 'bull_atr_min_pct': 0.0038822836597411157, 'bull_atr_max_pct': 0.13779522935228503, 'bull_tp_mult': 1.3182403786818342, 'bull_tsl_mult': 0.21693497231725817, 'bull_time_stop': 209, 'bull_use_sma': True, 'bull_use_ema': True, 'bull_use_atr': False, 'bull_use_adx': True, 'bull_use_spike': True, 'bull_rsi_required': True, 'bear_strategy': 'mean_reversion', 'bear_bb_std_mult': 1.0940832675317262, 'bear_rsi_os': 10, 'bear_rsi_ob': 48, 'bear_adx_thresh': 9.300115742130702, 'bear_atr_min_pct': 0.0007878172979484972, 'bear_atr_max_pct': 0.035498910199029815, 'bear_tp_mult': 1.3697640250930567, 'bear_tsl_mult': 0.9815305269847543, 'bear_time_stop': 95, 'bear_use_sma': True, 'bear_use_ema': True, 'bear_use_atr': False, 'bear_use_adx': False, 'bear_use_spike': True, 'bear_rsi_required': True, 'sideways_strategy': 'mean_reversion', 'sideways_bb_std_mult': 1.655286435483781, 'sideways_rsi_os': 37, 'sideways_rsi_ob': 91, 'sideways_adx_thresh': 7.948424343569213, 'sideways_atr_min_pct': 0.023798044095979146, 'sideways_atr_max_pct': 0.13691405805852455, 'sideways_tp_mult': 1.3635892153117528, 'sideways_tsl_mult': 0.4657144845441331, 'sideways_time_stop': 251, 'sideways_use_sma': True, 'sideways_use_ema': True, 'sideways_use_atr': True, 'sideways_use_adx': False, 'sideways_use_spike': False, 'sideways_rsi_required': True}.
[I 2025-09-01 11:39:33,419] Trial 369 finished with values: [-1000000000.0, 1000000000.0] and parameters: {'p_sma': 24, 'p_std': 38, 'p_atr': 19, 'p_adx': 10, 'rsi_period': 53, 'ema1': 19, 'ema2': 15, 'slip_atr_k': 0.15369571812456925, 'slip_spread_k': 0.39997315087531327, 'spread_hl_frac': 0.03987507329135371, 'bb_std_mult': 2.389217003766948, 'rsi_os': 30, 'rsi_ob': 87, 'vol_spike': 0.2774116788233163, 'adx_thresh': 25.021339482827443, 'atr_min_pct': 0.025359099370102705, 'atr_max_pct': 0.03344381913224809, 'tp_mult': 2.175029970125682, 'tsl_mult': 0.8682129037824858, 'strategy': 'breakout', 'time_stop': 263, 'use_sma': False, 'use_atr': False, 'use_adx': False, 'use_ema': True, 'use_spike': True, 'rsi_required': False, 'edge_k': 0.42142595712367453, 'edge_cap': 0.24379190313198498, 'bull_strategy': 'breakout', 'bull_bb_std_mult': 0.8589446852808, 'bull_rsi_os': 51, 'bull_rsi_ob': 83, 'bull_adx_thresh': 7.722356251009077, 'bull_atr_min_pct': 0.028154981207937274, 'bull_atr_max_pct': 0.08709514972407546, 'bull_tp_mult': 1.977565977666016, 'bull_tsl_mult': 0.21234221214263876, 'bull_time_stop': 272, 'bull_use_sma': True, 'bull_use_ema': True, 'bull_use_atr': False, 'bull_use_adx': True, 'bull_use_spike': True, 'bull_rsi_required': True, 'bear_strategy': 'mean_reversion', 'bear_bb_std_mult': 1.1198195163839681, 'bear_rsi_os': 53, 'bear_rsi_ob': 72, 'bear_adx_thresh': 9.452433969153123, 'bear_atr_min_pct': 0.00573180901845712, 'bear_atr_max_pct': 0.10977229242713579, 'bear_tp_mult': 2.1808574898702964, 'bear_tsl_mult': 0.9256169204402891, 'bear_time_stop': 30, 'bear_use_sma': True, 'bear_use_ema': True, 'bear_use_atr': False, 'bear_use_adx': False, 'bear_use_spike': True, 'bear_rsi_required': True, 'sideways_strategy': 'mean_reversion', 'sideways_bb_std_mult': 1.8748088979164401, 'sideways_rsi_os': 37, 'sideways_rsi_ob': 91, 'sideways_adx_thresh': 7.399366138841653, 'sideways_atr_min_pct': 0.02089066694285867, 'sideways_atr_max_pct': 0.05515264668889651, 'sideways_tp_mult': 1.3749300220964538, 'sideways_tsl_mult': 0.4640305200328638, 'sideways_time_stop': 257, 'sideways_use_sma': True, 'sideways_use_ema': True, 'sideways_use_atr': True, 'sideways_use_adx': False, 'sideways_use_spike': False, 'sideways_rsi_required': True}.
[I 2025-09-01 11:39:33,823] Trial 370 finished with values: [-0.0023774323493593874, 0.0029373133231452623] and parameters: {'p_sma': 53, 'p_std': 38, 'p_atr': 19, 'p_adx': 10, 'rsi_period': 55, 'ema1': 19, 'ema2': 15, 'slip_atr_k': 0.0009084091970540265, 'slip_spread_k': 0.39532961492378266, 'spread_hl_frac': 0.02779021812845777, 'bb_std_mult': 2.071117486366843, 'rsi_os': 30, 'rsi_ob': 87, 'vol_spike': 0.2716468433467262, 'adx_thresh': 10.815150923340667, 'atr_min_pct': 0.027614331662138013, 'atr_max_pct': 0.03375892599345466, 'tp_mult': 2.1878982275503214, 'tsl_mult': 0.8719249389203327, 'strategy': 'breakout', 'time_stop': 262, 'use_sma': False, 'use_atr': False, 'use_adx': False, 'use_ema': True, 'use_spike': True, 'rsi_required': False, 'edge_k': 0.4291662711382125, 'edge_cap': 0.24455279483730763, 'bull_strategy': 'breakout', 'bull_bb_std_mult': 0.831198676144103, 'bull_rsi_os': 51, 'bull_rsi_ob': 84, 'bull_adx_thresh': 7.298394954118413, 'bull_atr_min_pct': 0.003991884950761268, 'bull_atr_max_pct': 0.11861964597725329, 'bull_tp_mult': 1.9681105818502462, 'bull_tsl_mult': 0.5420563791400995, 'bull_time_stop': 53, 'bull_use_sma': True, 'bull_use_ema': True, 'bull_use_atr': False, 'bull_use_adx': True, 'bull_use_spike': True, 'bull_rsi_required': True, 'bear_strategy': 'mean_reversion', 'bear_bb_std_mult': 2.789129040117424, 'bear_rsi_os': 10, 'bear_rsi_ob': 48, 'bear_adx_thresh': 7.469731309452742, 'bear_atr_min_pct': 0.005688864908976048, 'bear_atr_max_pct': 0.03657626881516912, 'bear_tp_mult': 1.1665531293877494, 'bear_tsl_mult': 0.9265124252504455, 'bear_time_stop': 95, 'bear_use_sma': True, 'bear_use_ema': True, 'bear_use_atr': False, 'bear_use_adx': False, 'bear_use_spike': True, 'bear_rsi_required': True, 'sideways_strategy': 'mean_reversion', 'sideways_bb_std_mult': 1.6335843781078048, 'sideways_rsi_os': 37, 'sideways_rsi_ob': 91, 'sideways_adx_thresh': 5.0284151558228105, 'sideways_atr_min_pct': 0.010564031108385247, 'sideways_atr_max_pct': 0.055320778595405615, 'sideways_tp_mult': 2.4169593568622028, 'sideways_tsl_mult': 0.47644156449174224, 'sideways_time_stop': 256, 'sideways_use_sma': True, 'sideways_use_ema': True, 'sideways_use_atr': True, 'sideways_use_adx': False, 'sideways_use_spike': False, 'sideways_rsi_required': True}.
[I 2025-09-01 11:40:17,655] Trial 375 finished with values: [-1000000000.0, 1000000000.0] and parameters: {'p_sma': 58, 'p_std': 37, 'p_atr': 18, 'p_adx': 9, 'rsi_period': 58, 'ema1': 10, 'ema2': 14, 'slip_atr_k': 0.1673803572466645, 'slip_spread_k': 0.38648609755935953, 'spread_hl_frac': 0.016381675410074594, 'bb_std_mult': 1.6867249919389302, 'rsi_os': 32, 'rsi_ob': 67, 'vol_spike': 0.28733357668586773, 'adx_thresh': 15.799201487969913, 'atr_min_pct': 0.011269714448819723, 'atr_max_pct': 0.02358396277656233, 'tp_mult': 2.259598852184765, 'tsl_mult': 0.10499775745615081, 'strategy': 'breakout', 'time_stop': 141, 'use_sma': False, 'use_atr': True, 'use_adx': True, 'use_ema': False, 'use_spike': False, 'rsi_required': False, 'edge_k': 1.5251902212307047, 'edge_cap': 0.6365278488017356, 'bull_strategy': 'mean_reversion', 'bull_bb_std_mult': 0.6084309599250222, 'bull_rsi_os': 36, 'bull_rsi_ob': 72, 'bull_adx_thresh': 7.053765192494192, 'bull_atr_min_pct': 0.004071568712262202, 'bull_atr_max_pct': 0.03693265374817216, 'bull_tp_mult': 1.9102748604101156, 'bull_tsl_mult': 0.5472153125617953, 'bull_time_stop': 54, 'bull_use_sma': False, 'bull_use_ema': False, 'bull_use_atr': False, 'bull_use_adx': False, 'bull_use_spike': False, 'bull_rsi_required': True, 'bear_strategy': 'mean_reversion', 'bear_bb_std_mult': 1.0311178271407604, 'bear_rsi_os': 8, 'bear_rsi_ob': 66, 'bear_adx_thresh': 6.912329306763834, 'bear_atr_min_pct': 0.002496934812309456, 'bear_atr_max_pct': 0.03714286147950505, 'bear_tp_mult': 1.2816024609880587, 'bear_tsl_mult': 0.9613385312682161, 'bear_time_stop': 54, 'bear_use_sma': True, 'bear_use_ema': False, 'bear_use_atr': True, 'bear_use_adx': True, 'bear_use_spike': False, 'bear_rsi_required': True, 'sideways_strategy': 'breakout', 'sideways_bb_std_mult': 1.6906386985816062, 'sideways_rsi_os': 40, 'sideways_rsi_ob': 93, 'sideways_adx_thresh': 5.6159888307174235, 'sideways_atr_min_pct': 0.024655490269498172, 'sideways_atr_max_pct': 0.04661193822325718, 'sideways_tp_mult': 2.3012292683897084, 'sideways_tsl_mult': 0.4097252009715362, 'sideways_time_stop': 270, 'sideways_use_sma': False, 'sideways_use_ema': False, 'sideways_use_atr': True, 'sideways_use_adx': True, 'sideways_use_spike': True, 'sideways_rsi_required': False}.
[I 2025-09-01 11:40:18,381] Trial 373 finished with values: [-0.019812328690813397, 0.019913316934539852] and parameters: {'p_sma': 57, 'p_std': 37, 'p_atr': 19, 'p_adx': 9, 'rsi_period': 51, 'ema1': 21, 'ema2': 11, 'slip_atr_k': 0.024634141742049007, 'slip_spread_k': 0.38575868075553144, 'spread_hl_frac': 0.044350418735968546, 'bb_std_mult': 2.065440972667581, 'rsi_os': 27, 'rsi_ob': 84, 'vol_spike': 0.2898399680951301, 'adx_thresh': 22.78317150545199, 'atr_min_pct': 0.007440799150010778, 'atr_max_pct': 0.03017080533339068, 'tp_mult': 2.2526348379100054, 'tsl_mult': 0.43040600974953785, 'strategy': 'breakout', 'time_stop': 295, 'use_sma': False, 'use_atr': False, 'use_adx': False, 'use_ema': False, 'use_spike': True, 'rsi_required': False, 'edge_k': 1.3392086596567128, 'edge_cap': 0.22636176522251497, 'bull_strategy': 'breakout', 'bull_bb_std_mult': 0.6208650442270192, 'bull_rsi_os': 51, 'bull_rsi_ob': 70, 'bull_adx_thresh': 6.9775262972520915, 'bull_atr_min_pct': 0.002552738609729502, 'bull_atr_max_pct': 0.11840081281630914, 'bull_tp_mult': 2.0823005411546345, 'bull_tsl_mult': 0.13758370489890304, 'bull_time_stop': 54, 'bull_use_sma': True, 'bull_use_ema': True, 'bull_use_atr': True, 'bull_use_adx': True, 'bull_use_spike': True, 'bull_rsi_required': False, 'bear_strategy': 'breakout', 'bear_bb_std_mult': 1.863841627453195, 'bear_rsi_os': 14, 'bear_rsi_ob': 47, 'bear_adx_thresh': 10.333573699032257, 'bear_atr_min_pct': 0.012716892196731298, 'bear_atr_max_pct': 0.02756788992447998, 'bear_tp_mult': 1.5286191662629267, 'bear_tsl_mult': 0.9659164906408526, 'bear_time_stop': 103, 'bear_use_sma': True, 'bear_use_ema': True, 'bear_use_atr': False, 'bear_use_adx': False, 'bear_use_spike': True, 'bear_rsi_required': True, 'sideways_strategy': 'mean_reversion', 'sideways_bb_std_mult': 1.5913306918494536, 'sideways_rsi_os': 40, 'sideways_rsi_ob': 93, 'sideways_adx_thresh': 5.002744603733765, 'sideways_atr_min_pct': 0.010340866076182148, 'sideways_atr_max_pct': 0.12843344994282377, 'sideways_tp_mult': 1.4251606387369977, 'sideways_tsl_mult': 0.39928062170008477, 'sideways_time_stop': 247, 'sideways_use_sma': False, 'sideways_use_ema': True, 'sideways_use_atr': True, 'sideways_use_adx': False, 'sideways_use_spike': False, 'sideways_rsi_required': True}.
[I 2025-09-01 11:40:18,952] Trial 374 finished with values: [-0.03161418276815198, 0.031888158155084126] and parameters: {'p_sma': 9, 'p_std': 36, 'p_atr': 19, 'p_adx': 9, 'rsi_period': 51, 'ema1': 11, 'ema2': 14, 'slip_atr_k': 0.0004727582993528951, 'slip_spread_k': 0.38669093107519764, 'spread_hl_frac': 0.02742389372230708, 'bb_std_mult': 3.392130664261387, 'rsi_os': 27, 'rsi_ob': 84, 'vol_spike': 0.28532734898415013, 'adx_thresh': 22.935209090383786, 'atr_min_pct': 0.028913540566569917, 'atr_max_pct': 0.07941234256141036, 'tp_mult': 2.2665035998548317, 'tsl_mult': 0.2290030961599398, 'strategy': 'breakout', 'time_stop': 66, 'use_sma': False, 'use_atr': False, 'use_adx': False, 'use_ema': False, 'use_spike': True, 'rsi_required': False, 'edge_k': 1.3643928480585648, 'edge_cap': 0.9257522764791684, 'bull_strategy': 'breakout', 'bull_bb_std_mult': 0.5131860706740825, 'bull_rsi_os': 51, 'bull_rsi_ob': 71, 'bull_adx_thresh': 6.957880140843904, 'bull_atr_min_pct': 0.003162017695669501, 'bull_atr_max_pct': 0.05299658599938842, 'bull_tp_mult': 2.086750063075199, 'bull_tsl_mult': 0.6382276609253952, 'bull_time_stop': 265, 'bull_use_sma': True, 'bull_use_ema': True, 'bull_use_atr': True, 'bull_use_adx': True, 'bull_use_spike': True, 'bull_rsi_required': False, 'bear_strategy': 'breakout', 'bear_bb_std_mult': 2.766070873662624, 'bear_rsi_os': 14, 'bear_rsi_ob': 47, 'bear_adx_thresh': 10.443887564280356, 'bear_atr_min_pct': 0.0012856776195226821, 'bear_atr_max_pct': 0.027422600196912533, 'bear_tp_mult': 1.5296472704745172, 'bear_tsl_mult': 0.963283909345261, 'bear_time_stop': 102, 'bear_use_sma': True, 'bear_use_ema': True, 'bear_use_atr': False, 'bear_use_adx': False, 'bear_use_spike': True, 'bear_rsi_required': True, 'sideways_strategy': 'mean_reversion', 'sideways_bb_std_mult': 1.5892573160721202, 'sideways_rsi_os': 40, 'sideways_rsi_ob': 94, 'sideways_adx_thresh': 6.2088213028568235, 'sideways_atr_min_pct': 0.02293166662525246, 'sideways_atr_max_pct': 0.07950444354743429, 'sideways_tp_mult': 1.4378082037304734, 'sideways_tsl_mult': 0.2048993090292281, 'sideways_time_stop': 247, 'sideways_use_sma': False, 'sideways_use_ema': True, 'sideways_use_atr': True, 'sideways_use_adx': False, 'sideways_use_spike': False, 'sideways_rsi_required': True}.
[I 2025-09-01 11:40:19,228] Trial 372 finished with values: [-1000000000.0, 1000000000.0] and parameters: {'p_sma': 33, 'p_std': 33, 'p_atr': 19, 'p_adx': 9, 'rsi_period': 52, 'ema1': 21, 'ema2': 15, 'slip_atr_k': 0.017422221039651083, 'slip_spread_k': 0.3934817484840475, 'spread_hl_frac': 0.024542075851633753, 'bb_std_mult': 1.691678412147023, 'rsi_os': 30, 'rsi_ob': 84, 'vol_spike': 0.2867722372859119, 'adx_thresh': 24.692424690736022, 'atr_min_pct': 0.02890397949838994, 'atr_max_pct': 0.11019947022504502, 'tp_mult': 2.2562217676956147, 'tsl_mult': 0.12118210960805581, 'strategy': 'breakout', 'time_stop': 265, 'use_sma': False, 'use_atr': False, 'use_adx': False, 'use_ema': False, 'use_spike': True, 'rsi_required': False, 'edge_k': 1.3860804127108397, 'edge_cap': 0.6476069323092335, 'bull_strategy': 'breakout', 'bull_bb_std_mult': 0.8510343557173582, 'bull_rsi_os': 51, 'bull_rsi_ob': 84, 'bull_adx_thresh': 5.974352491975761, 'bull_atr_min_pct': 0.028103755756149214, 'bull_atr_max_pct': 0.03880214942063287, 'bull_tp_mult': 1.9026073014956568, 'bull_tsl_mult': 0.21773847082119346, 'bull_time_stop': 273, 'bull_use_sma': True, 'bull_use_ema': True, 'bull_use_atr': True, 'bull_use_adx': True, 'bull_use_spike': True, 'bull_rsi_required': False, 'bear_strategy': 'breakout', 'bear_bb_std_mult': 1.0203995830125308, 'bear_rsi_os': 10, 'bear_rsi_ob': 48, 'bear_adx_thresh': 9.22294743803773, 'bear_atr_min_pct': 0.005649876410361448, 'bear_atr_max_pct': 0.03728684946673187, 'bear_tp_mult': 1.3232275874172839, 'bear_tsl_mult': 0.9790060688730872, 'bear_time_stop': 96, 'bear_use_sma': True, 'bear_use_ema': True, 'bear_use_atr': False, 'bear_use_adx': False, 'bear_use_spike': True, 'bear_rsi_required': True, 'sideways_strategy': 'mean_reversion', 'sideways_bb_std_mult': 1.58484725949032, 'sideways_rsi_os': 40, 'sideways_rsi_ob': 92, 'sideways_adx_thresh': 7.461068361341333, 'sideways_atr_min_pct': 0.020881977394585072, 'sideways_atr_max_pct': 0.05559904395353672, 'sideways_tp_mult': 1.4296232576046222, 'sideways_tsl_mult': 0.47536486434411973, 'sideways_time_stop': 252, 'sideways_use_sma': True, 'sideways_use_ema': True, 'sideways_use_atr': True, 'sideways_use_adx': False, 'sideways_use_spike': False, 'sideways_rsi_required': True}.
[I 2025-09-01 11:40:20,201] Trial 377 finished with values: [-1000000000.0, 1000000000.0] and parameters: {'p_sma': 53, 'p_std': 35, 'p_atr': 17, 'p_adx': 8, 'rsi_period': 84, 'ema1': 19, 'ema2': 16, 'slip_atr_k': 0.0003060700410333274, 'slip_spread_k': 0.4208156512626995, 'spread_hl_frac': 0.021907163175233633, 'bb_std_mult': 2.2198794961174615, 'rsi_os': 44, 'rsi_ob': 89, 'vol_spike': 0.28112334422098745, 'adx_thresh': 34.912936733103514, 'atr_min_pct': 0.026966890867072053, 'atr_max_pct': 0.02490113616513917, 'tp_mult': 2.204868047429636, 'tsl_mult': 0.14166027095888883, 'strategy': 'breakout', 'time_stop': 281, 'use_sma': False, 'use_atr': True, 'use_adx': True, 'use_ema': False, 'use_spike': False, 'rsi_required': False, 'edge_k': 1.3925849114205253, 'edge_cap': 0.17804338518161322, 'bull_strategy': 'mean_reversion', 'bull_bb_std_mult': 0.8467229478902983, 'bull_rsi_os': 33, 'bull_rsi_ob': 83, 'bull_adx_thresh': 5.638003636914849, 'bull_atr_min_pct': 0.0033286547481906387, 'bull_atr_max_pct': 0.12355607712347016, 'bull_tp_mult': 1.1476903100823643, 'bull_tsl_mult': 0.601141136736687, 'bull_time_stop': 64, 'bull_use_sma': False, 'bull_use_ema': False, 'bull_use_atr': False, 'bull_use_adx': False, 'bull_use_spike': False, 'bull_rsi_required': True, 'bear_strategy': 'mean_reversion', 'bear_bb_std_mult': 1.9403510074644268, 'bear_rsi_os': 10, 'bear_rsi_ob': 75, 'bear_adx_thresh': 8.808776993131898, 'bear_atr_min_pct': 0.027760758161295297, 'bear_atr_max_pct': 0.07652761870050988, 'bear_tp_mult': 1.1717065657842682, 'bear_tsl_mult': 0.9461559099981945, 'bear_time_stop': 251, 'bear_use_sma': True, 'bear_use_ema': False, 'bear_use_atr': True, 'bear_use_adx': True, 'bear_use_spike': False, 'bear_rsi_required': True, 'sideways_strategy': 'breakout', 'sideways_bb_std_mult': 1.7487275794410808, 'sideways_rsi_os': 38, 'sideways_rsi_ob': 94, 'sideways_adx_thresh': 6.338448693839284, 'sideways_atr_min_pct': 0.01102043724533575, 'sideways_atr_max_pct': 0.058377530528180135, 'sideways_tp_mult': 2.404820080315476, 'sideways_tsl_mult': 0.4349674237748269, 'sideways_time_stop': 261, 'sideways_use_sma': False, 'sideways_use_ema': False, 'sideways_use_atr': True, 'sideways_use_adx': True, 'sideways_use_spike': True, 'sideways_rsi_required': False}.
[I 2025-09-01 11:41:02,373] Trial 379 finished with values: [-1000000000.0, 1000000000.0] and parameters: {'p_sma': 52, 'p_std': 35, 'p_atr': 18, 'p_adx': 7, 'rsi_period': 66, 'ema1': 8, 'ema2': 16, 'slip_atr_k': 0.05556498031157067, 'slip_spread_k': 0.42345191218479594, 'spread_hl_frac': 0.025825843600813095, 'bb_std_mult': 2.181917723276819, 'rsi_os': 35, 'rsi_ob': 46, 'vol_spike': 0.26280140795587476, 'adx_thresh': 9.787412519260995, 'atr_min_pct': 0.02602715089414484, 'atr_max_pct': 0.09038782193209192, 'tp_mult': 2.17241631194396, 'tsl_mult': 0.46459066504349594, 'strategy': 'breakout', 'time_stop': 284, 'use_sma': False, 'use_atr': True, 'use_adx': True, 'use_ema': False, 'use_spike': False, 'rsi_required': False, 'edge_k': 0.3630169482226589, 'edge_cap': 0.17784857405281757, 'bull_strategy': 'mean_reversion', 'bull_bb_std_mult': 0.7087070808236153, 'bull_rsi_os': 33, 'bull_rsi_ob': 45, 'bull_adx_thresh': 5.624293248272861, 'bull_atr_min_pct': 0.003496129157586167, 'bull_atr_max_pct': 0.04895757261522696, 'bull_tp_mult': 1.844480379709125, 'bull_tsl_mult': 0.5178886029248858, 'bull_time_stop': 283, 'bull_use_sma': False, 'bull_use_ema': False, 'bull_use_atr': False, 'bull_use_adx': False, 'bull_use_spike': False, 'bull_rsi_required': True, 'bear_strategy': 'mean_reversion', 'bear_bb_std_mult': 1.055292056977214, 'bear_rsi_os': 17, 'bear_rsi_ob': 46, 'bear_adx_thresh': 8.811899834305274, 'bear_atr_min_pct': 0.027928367562487698, 'bear_atr_max_pct': 0.04251079323781014, 'bear_tp_mult': 1.1752564248533315, 'bear_tsl_mult': 0.7383445466678733, 'bear_time_stop': 49, 'bear_use_sma': True, 'bear_use_ema': False, 'bear_use_atr': True, 'bear_use_adx': True, 'bear_use_spike': False, 'bear_rsi_required': True, 'sideways_strategy': 'breakout', 'sideways_bb_std_mult': 1.6955031165081993, 'sideways_rsi_os': 42, 'sideways_rsi_ob': 95, 'sideways_adx_thresh': 31.088772105424233, 'sideways_atr_min_pct': 0.022514980292636256, 'sideways_atr_max_pct': 0.06716372288439136, 'sideways_tp_mult': 2.3501137914030386, 'sideways_tsl_mult': 0.42918282051876566, 'sideways_time_stop': 261, 'sideways_use_sma': False, 'sideways_use_ema': False, 'sideways_use_atr': True, 'sideways_use_adx': True, 'sideways_use_spike': True, 'sideways_rsi_required': False}.
