[I 2025-09-01 11:41:03,055] Trial 378 finished with values: [-1000000000.0, 1000000000.0] and parameters: {'p_sma': 53, 'p_std': 40, 'p_atr': 17, 'p_adx': 7, 'rsi_period': 23, 'ema1': 6, 'ema2': 15, 'slip_atr_k': 0.1418874243659539, 'slip_spread_k': 0.4132440850974909, 'spread_hl_frac': 0.02589018725810388, 'bb_std_mult': 1.8103158208691514, 'rsi_os': 44, 'rsi_ob': 89, 'vol_spike': 0.2738256549398409, 'adx_thresh': 24.403268741981076, 'atr_min_pct': 0.020502223479781263, 'atr_max_pct': 0.08343254622963135, 'tp_mult': 2.2023327683054887, 'tsl_mult': 0.1326917734536468, 'strategy': 'breakout', 'time_stop': 283, 'use_sma': False, 'use_atr': True, 'use_adx': True, 'use_ema': False, 'use_spike': False, 'rsi_required': False, 'edge_k': 0.3607469964744103, 'edge_cap': 0.16280794969352017, 'bull_strategy': 'mean_reversion', 'bull_bb_std_mult': 0.7224272640671268, 'bull_rsi_os': 33, 'bull_rsi_ob': 84, 'bull_adx_thresh': 5.4616805178864904, 'bull_atr_min_pct': 0.004226853718676862, 'bull_atr_max_pct': 0.12213416903636293, 'bull_tp_mult': 1.9283662940193977, 'bull_tsl_mult': 0.5219675350823316, 'bull_time_stop': 62, 'bull_use_sma': False, 'bull_use_ema': False, 'bull_use_atr': False, 'bull_use_adx': False, 'bull_use_spike': False, 'bull_rsi_required': True, 'bear_strategy': 'mean_reversion', 'bear_bb_std_mult': 2.382039542709843, 'bear_rsi_os': 12, 'bear_rsi_ob': 78, 'bear_adx_thresh': 8.884256948171311, 'bear_atr_min_pct': 0.02769502380405551, 'bear_atr_max_pct': 0.053063512112976566, 'bear_tp_mult': 1.1786302921316765, 'bear_tsl_mult': 0.7391408920022975, 'bear_time_stop': 63, 'bear_use_sma': True, 'bear_use_ema': False, 'bear_use_atr': True, 'bear_use_adx': True, 'bear_use_spike': False, 'bear_rsi_required': True, 'sideways_strategy': 'breakout', 'sideways_bb_std_mult': 1.7583834442242645, 'sideways_rsi_os': 42, 'sideways_rsi_ob': 95, 'sideways_adx_thresh': 5.003344487919118, 'sideways_atr_min_pct': 0.025110437811692442, 'sideways_atr_max_pct': 0.0588252897205488, 'sideways_tp_mult': 1.3238750591089825, 'sideways_tsl_mult': 0.43375229515643354, 'sideways_time_stop': 56, 'sideways_use_sma': False, 'sideways_use_ema': False, 'sideways_use_atr': True, 'sideways_use_adx': True, 'sideways_use_spike': True, 'sideways_rsi_required': False}.
[I 2025-09-01 11:41:03,611] Trial 380 finished with values: [-1000000000.0, 1000000000.0] and parameters: {'p_sma': 44, 'p_std': 39, 'p_atr': 20, 'p_adx': 7, 'rsi_period': 67, 'ema1': 6, 'ema2': 16, 'slip_atr_k': 0.1130219356408119, 'slip_spread_k': 0.4249102671061387, 'spread_hl_frac': 0.02631656877562543, 'bb_std_mult': 1.3036649824796727, 'rsi_os': 29, 'rsi_ob': 86, 'vol_spike': 0.2730434317800523, 'adx_thresh': 29.029250746289087, 'atr_min_pct': 0.027214084873774632, 'atr_max_pct': 0.0846660297319426, 'tp_mult': 2.141823743556007, 'tsl_mult': 0.3586218876348655, 'strategy': 'breakout', 'time_stop': 96, 'use_sma': False, 'use_atr': True, 'use_adx': True, 'use_ema': False, 'use_spike': False, 'rsi_required': False, 'edge_k': 0.5959465661964967, 'edge_cap': 0.5813420355855977, 'bull_strategy': 'mean_reversion', 'bull_bb_std_mult': 0.7104471059265136, 'bull_rsi_os': 52, 'bull_rsi_ob': 51, 'bull_adx_thresh': 5.015397944190772, 'bull_atr_min_pct': 0.004200560568601531, 'bull_atr_max_pct': 0.04557025769189776, 'bull_tp_mult': 1.8381524292652265, 'bull_tsl_mult': 0.5171506941143104, 'bull_time_stop': 285, 'bull_use_sma': False, 'bull_use_ema': False, 'bull_use_atr': False, 'bull_use_adx': False, 'bull_use_spike': False, 'bull_rsi_required': True, 'bear_strategy': 'mean_reversion', 'bear_bb_std_mult': 2.3991384485493734, 'bear_rsi_os': 15, 'bear_rsi_ob': 61, 'bear_adx_thresh': 28.811909055588174, 'bear_atr_min_pct': 0.004149079585436552, 'bear_atr_max_pct': 0.04056428366613356, 'bear_tp_mult': 1.0153997604317264, 'bear_tsl_mult': 0.9976411542928767, 'bear_time_stop': 61, 'bear_use_sma': True, 'bear_use_ema': False, 'bear_use_atr': True, 'bear_use_adx': True, 'bear_use_spike': False, 'bear_rsi_required': True, 'sideways_strategy': 'breakout', 'sideways_bb_std_mult': 1.71530847024693, 'sideways_rsi_os': 39, 'sideways_rsi_ob': 95, 'sideways_adx_thresh': 5.6585467119178325, 'sideways_atr_min_pct': 0.005374298723273141, 'sideways_atr_max_pct': 0.07998934250535965, 'sideways_tp_mult': 1.0926380949902057, 'sideways_tsl_mult': 0.43202644487367664, 'sideways_time_stop': 242, 'sideways_use_sma': False, 'sideways_use_ema': False, 'sideways_use_atr': True, 'sideways_use_adx': True, 'sideways_use_spike': True, 'sideways_rsi_required': False}.
[I 2025-09-01 11:41:03,899] Trial 376 finished with values: [-0.0006008052961736787, 0.005632692768552223] and parameters: {'p_sma': 57, 'p_std': 36, 'p_atr': 20, 'p_adx': 9, 'rsi_period': 9, 'ema1': 19, 'ema2': 16, 'slip_atr_k': 0.0016790901075236092, 'slip_spread_k': 0.42216703274730416, 'spread_hl_frac': 0.04377490568606168, 'bb_std_mult': 2.2016243421488038, 'rsi_os': 31, 'rsi_ob': 84, 'vol_spike': 0.2794476636096953, 'adx_thresh': 9.966549799647456, 'atr_min_pct': 0.026101717879369754, 'atr_max_pct': 0.029719857926558256, 'tp_mult': 2.2202258549488767, 'tsl_mult': 0.13621552008215182, 'strategy': 'breakout', 'time_stop': 267, 'use_sma': False, 'use_atr': True, 'use_adx': True, 'use_ema': False, 'use_spike': False, 'rsi_required': False, 'edge_k': 0.4649989742314763, 'edge_cap': 0.9241356720461518, 'bull_strategy': 'mean_reversion', 'bull_bb_std_mult': 0.8322988094092314, 'bull_rsi_os': 32, 'bull_rsi_ob': 84, 'bull_adx_thresh': 6.4085074510930395, 'bull_atr_min_pct': 0.002773521673130639, 'bull_atr_max_pct': 0.12259492752346735, 'bull_tp_mult': 2.075116937716254, 'bull_tsl_mult': 0.5602124805786395, 'bull_time_stop': 283, 'bull_use_sma': False, 'bull_use_ema': False, 'bull_use_atr': False, 'bull_use_adx': False, 'bull_use_spike': False, 'bull_rsi_required': True, 'bear_strategy': 'mean_reversion', 'bear_bb_std_mult': 1.951248735675393, 'bear_rsi_os': 12, 'bear_rsi_ob': 78, 'bear_adx_thresh': 8.736847083360473, 'bear_atr_min_pct': 0.004116986396088057, 'bear_atr_max_pct': 0.054403517441319174, 'bear_tp_mult': 1.3319502498819054, 'bear_tsl_mult': 0.49878868169932583, 'bear_time_stop': 65, 'bear_use_sma': True, 'bear_use_ema': False, 'bear_use_atr': True, 'bear_use_adx': True, 'bear_use_spike': True, 'bear_rsi_required': True, 'sideways_strategy': 'breakout', 'sideways_bb_std_mult': 1.758488955596938, 'sideways_rsi_os': 40, 'sideways_rsi_ob': 94, 'sideways_adx_thresh': 5.040689628089997, 'sideways_atr_min_pct': 0.005681262235511965, 'sideways_atr_max_pct': 0.1303231211626553, 'sideways_tp_mult': 1.430253385317765, 'sideways_tsl_mult': 0.43624770325585294, 'sideways_time_stop': 84, 'sideways_use_sma': False, 'sideways_use_ema': False, 'sideways_use_atr': True, 'sideways_use_adx': True, 'sideways_use_spike': True, 'sideways_rsi_required': False}.
[I 2025-09-01 11:41:04,724] Trial 383 finished with values: [-1000000000.0, 1000000000.0] and parameters: {'p_sma': 28, 'p_std': 47, 'p_atr': 20, 'p_adx': 21, 'rsi_period': 55, 'ema1': 19, 'ema2': 14, 'slip_atr_k': 0.1500367493881172, 'slip_spread_k': 0.35716495046141095, 'spread_hl_frac': 0.027117428731087908, 'bb_std_mult': 1.950318816281602, 'rsi_os': 39, 'rsi_ob': 72, 'vol_spike': 0.29704828614905304, 'adx_thresh': 26.756146787633387, 'atr_min_pct': 0.0277758039593807, 'atr_max_pct': 0.02736387211416752, 'tp_mult': 2.3002126303116044, 'tsl_mult': 0.9030873833376611, 'strategy': 'breakout', 'time_stop': 116, 'use_sma': False, 'use_atr': True, 'use_adx': True, 'use_ema': True, 'use_spike': False, 'rsi_required': False, 'edge_k': 0.4326662032795775, 'edge_cap': 0.2021165305959535, 'bull_strategy': 'mean_reversion', 'bull_bb_std_mult': 0.5980802183381901, 'bull_rsi_os': 14, 'bull_rsi_ob': 81, 'bull_adx_thresh': 6.6953812296279045, 'bull_atr_min_pct': 0.004991146266630277, 'bull_atr_max_pct': 0.02998689872955957, 'bull_tp_mult': 1.0664556752312284, 'bull_tsl_mult': 0.5571464977777029, 'bull_time_stop': 300, 'bull_use_sma': False, 'bull_use_ema': False, 'bull_use_atr': False, 'bull_use_adx': False, 'bull_use_spike': False, 'bull_rsi_required': True, 'bear_strategy': 'mean_reversion', 'bear_bb_std_mult': 1.5412979989397482, 'bear_rsi_os': 23, 'bear_rsi_ob': 71, 'bear_adx_thresh': 11.979935031665171, 'bear_atr_min_pct': 0.0030041973552722896, 'bear_atr_max_pct': 0.04612977877740681, 'bear_tp_mult': 1.2360036293480123, 'bear_tsl_mult': 0.8550486406520605, 'bear_time_stop': 279, 'bear_use_sma': True, 'bear_use_ema': False, 'bear_use_atr': True, 'bear_use_adx': True, 'bear_use_spike': True, 'bear_rsi_required': True, 'sideways_strategy': 'breakout', 'sideways_bb_std_mult': 1.6751341315843518, 'sideways_rsi_os': 38, 'sideways_rsi_ob': 92, 'sideways_adx_thresh': 6.780282639092908, 'sideways_atr_min_pct': 0.029550051292276572, 'sideways_atr_max_pct': 0.11259231269879041, 'sideways_tp_mult': 1.1623031695549224, 'sideways_tsl_mult': 0.4019199665236817, 'sideways_time_stop': 241, 'sideways_use_sma': False, 'sideways_use_ema': True, 'sideways_use_atr': True, 'sideways_use_adx': True, 'sideways_use_spike': True, 'sideways_rsi_required': False}.
[I 2025-09-01 11:41:48,084] Trial 382 finished with values: [-1000000000.0, 1000000000.0] and parameters: {'p_sma': 22, 'p_std': 39, 'p_atr': 20, 'p_adx': 10, 'rsi_period': 55, 'ema1': 19, 'ema2': 16, 'slip_atr_k': 0.11638585861494284, 'slip_spread_k': 0.35860954866634676, 'spread_hl_frac': 0.04833474444728945, 'bb_std_mult': 2.350290752852851, 'rsi_os': 29, 'rsi_ob': 86, 'vol_spike': 0.2983180157000609, 'adx_thresh': 23.65419540249642, 'atr_min_pct': 0.02198898807439809, 'atr_max_pct': 0.11297092613179605, 'tp_mult': 2.22301853116462, 'tsl_mult': 0.9213182032936192, 'strategy': 'breakout', 'time_stop': 91, 'use_sma': False, 'use_atr': True, 'use_adx': True, 'use_ema': False, 'use_spike': False, 'rsi_required': False, 'edge_k': 1.1576129472187808, 'edge_cap': 0.2116615959318087, 'bull_strategy': 'mean_reversion', 'bull_bb_std_mult': 0.566686975464969, 'bull_rsi_os': 13, 'bull_rsi_ob': 53, 'bull_adx_thresh': 6.425251971603294, 'bull_atr_min_pct': 0.019359488129077243, 'bull_atr_max_pct': 0.100326758119756, 'bull_tp_mult': 2.0072183430461705, 'bull_tsl_mult': 0.5671519339583841, 'bull_time_stop': 70, 'bull_use_sma': False, 'bull_use_ema': False, 'bull_use_atr': False, 'bull_use_adx': False, 'bull_use_spike': False, 'bull_rsi_required': True, 'bear_strategy': 'mean_reversion', 'bear_bb_std_mult': 2.938687064473391, 'bear_rsi_os': 7, 'bear_rsi_ob': 62, 'bear_adx_thresh': 6.0824865214732595, 'bear_atr_min_pct': 0.015847943971757462, 'bear_atr_max_pct': 0.048508843474196844, 'bear_tp_mult': 1.232083565948448, 'bear_tsl_mult': 0.8095557297079979, 'bear_time_stop': 17, 'bear_use_sma': True, 'bear_use_ema': False, 'bear_use_atr': True, 'bear_use_adx': True, 'bear_use_spike': True, 'bear_rsi_required': True, 'sideways_strategy': 'breakout', 'sideways_bb_std_mult': 1.6505083299980754, 'sideways_rsi_os': 36, 'sideways_rsi_ob': 92, 'sideways_adx_thresh': 5.627606870948049, 'sideways_atr_min_pct': 0.029495893275422888, 'sideways_atr_max_pct': 0.07904922095042743, 'sideways_tp_mult': 2.5066868837137575, 'sideways_tsl_mult': 0.40255649970179436, 'sideways_time_stop': 78, 'sideways_use_sma': False, 'sideways_use_ema': False, 'sideways_use_atr': True, 'sideways_use_adx': True, 'sideways_use_spike': True, 'sideways_rsi_required': False}.
[I 2025-09-01 11:41:49,012] Trial 381 finished with values: [-1000000000.0, 1000000000.0] and parameters: {'p_sma': 22, 'p_std': 40, 'p_atr': 20, 'p_adx': 10, 'rsi_period': 70, 'ema1': 19, 'ema2': 16, 'slip_atr_k': 0.07156270921356675, 'slip_spread_k': 0.3618566294560796, 'spread_hl_frac': 0.026278949453469563, 'bb_std_mult': 3.306497305880883, 'rsi_os': 40, 'rsi_ob': 86, 'vol_spike': 0.29963184954278005, 'adx_thresh': 23.91935549248934, 'atr_min_pct': 0.027506776627057878, 'atr_max_pct': 0.027687421025791185, 'tp_mult': 2.150884206258567, 'tsl_mult': 0.9013402069560448, 'strategy': 'breakout', 'time_stop': 274, 'use_sma': False, 'use_atr': True, 'use_adx': True, 'use_ema': False, 'use_spike': False, 'rsi_required': False, 'edge_k': 0.47248389615410014, 'edge_cap': 0.21895910662579623, 'bull_strategy': 'mean_reversion', 'bull_bb_std_mult': 0.7034802224568935, 'bull_rsi_os': 13, 'bull_rsi_ob': 81, 'bull_adx_thresh': 6.379001912970656, 'bull_atr_min_pct': 0.004228547737696711, 'bull_atr_max_pct': 0.07061005210110974, 'bull_tp_mult': 2.0175194735506334, 'bull_tsl_mult': 0.46521754802628174, 'bull_time_stop': 282, 'bull_use_sma': False, 'bull_use_ema': False, 'bull_use_atr': False, 'bull_use_adx': False, 'bull_use_spike': False, 'bull_rsi_required': True, 'bear_strategy': 'mean_reversion', 'bear_bb_std_mult': 2.77545667335632, 'bear_rsi_os': 12, 'bear_rsi_ob': 84, 'bear_adx_thresh': 9.732583669842692, 'bear_atr_min_pct': 0.003315490109330948, 'bear_atr_max_pct': 0.054360611266953324, 'bear_tp_mult': 1.999564607553301, 'bear_tsl_mult': 0.8064651167929171, 'bear_time_stop': 212, 'bear_use_sma': True, 'bear_use_ema': False, 'bear_use_atr': True, 'bear_use_adx': True, 'bear_use_spike': True, 'bear_rsi_required': True, 'sideways_strategy': 'breakout', 'sideways_bb_std_mult': 1.7594733206725168, 'sideways_rsi_os': 39, 'sideways_rsi_ob': 73, 'sideways_adx_thresh': 5.034075570282527, 'sideways_atr_min_pct': 0.0033040197971575484, 'sideways_atr_max_pct': 0.11101886107725391, 'sideways_tp_mult': 1.0645307384337592, 'sideways_tsl_mult': 0.4444975591082358, 'sideways_time_stop': 55, 'sideways_use_sma': False, 'sideways_use_ema': False, 'sideways_use_atr': True, 'sideways_use_adx': True, 'sideways_use_spike': True, 'sideways_rsi_required': False}.
[I 2025-09-01 11:41:50,709] Trial 384 finished with values: [-0.010314258874593696, 0.010033590345352866] and parameters: {'p_sma': 22, 'p_std': 47, 'p_atr': 21, 'p_adx': 21, 'rsi_period': 55, 'ema1': 19, 'ema2': 14, 'slip_atr_k': 0.18758996262047883, 'slip_spread_k': 0.3583137795220452, 'spread_hl_frac': 0.04841829514013102, 'bb_std_mult': 1.0070110191378874, 'rsi_os': 17, 'rsi_ob': 56, 'vol_spike': 0.29982204528890344, 'adx_thresh': 18.192101821343464, 'atr_min_pct': 0.027834133009478224, 'atr_max_pct': 0.11310496757914129, 'tp_mult': 2.1599655656487653, 'tsl_mult': 0.24592456124491013, 'strategy': 'breakout', 'time_stop': 269, 'use_sma': False, 'use_atr': True, 'use_adx': True, 'use_ema': True, 'use_spike': False, 'rsi_required': False, 'edge_k': 0.47333509789339384, 'edge_cap': 0.8515479832971304, 'bull_strategy': 'mean_reversion', 'bull_bb_std_mult': 0.5910744887928502, 'bull_rsi_os': 12, 'bull_rsi_ob': 74, 'bull_adx_thresh': 6.384021099094623, 'bull_atr_min_pct': 0.0027299501737322106, 'bull_atr_max_pct': 0.12857864343982423, 'bull_tp_mult': 2.0043013807199905, 'bull_tsl_mult': 0.5631265319154746, 'bull_time_stop': 291, 'bull_use_sma': False, 'bull_use_ema': False, 'bull_use_atr': False, 'bull_use_adx': False, 'bull_use_spike': False, 'bull_rsi_required': True, 'bear_strategy': 'mean_reversion', 'bear_bb_std_mult': 0.9737698966669579, 'bear_rsi_os': 7, 'bear_rsi_ob': 71, 'bear_adx_thresh': 6.039106663471742, 'bear_atr_min_pct': 0.003310927390565383, 'bear_atr_max_pct': 0.04480639694687728, 'bear_tp_mult': 1.4065418262693061, 'bear_tsl_mult': 0.5183419136391756, 'bear_time_stop': 69, 'bear_use_sma': True, 'bear_use_ema': False, 'bear_use_atr': True, 'bear_use_adx': True, 'bear_use_spike': True, 'bear_rsi_required': True, 'sideways_strategy': 'breakout', 'sideways_bb_std_mult': 1.78879536756046, 'sideways_rsi_os': 36, 'sideways_rsi_ob': 92, 'sideways_adx_thresh': 6.662214802708536, 'sideways_atr_min_pct': 0.012294306839866306, 'sideways_atr_max_pct': 0.07769416017783479, 'sideways_tp_mult': 2.2035942557687322, 'sideways_tsl_mult': 0.44638951456936077, 'sideways_time_stop': 29, 'sideways_use_sma': False, 'sideways_use_ema': True, 'sideways_use_atr': True, 'sideways_use_adx': True, 'sideways_use_spike': True, 'sideways_rsi_required': False}.
[I 2025-09-01 11:41:50,709] Trial 385 finished with values: [-0.015525586855855145, 0.01553859461718332] and parameters: {'p_sma': 46, 'p_std': 41, 'p_atr': 18, 'p_adx': 10, 'rsi_period': 76, 'ema1': 20, 'ema2': 16, 'slip_atr_k': 0.18210728153744102, 'slip_spread_k': 0.3643104517333534, 'spread_hl_frac': 0.027778479800876527, 'bb_std_mult': 1.4607309097217074, 'rsi_os': 42, 'rsi_ob': 57, 'vol_spike': 0.27878534188555726, 'adx_thresh': 17.002585560325567, 'atr_min_pct': 0.0014103727854656613, 'atr_max_pct': 0.11338517781958829, 'tp_mult': 2.236053965917846, 'tsl_mult': 0.2592257402106894, 'strategy': 'breakout', 'time_stop': 73, 'use_sma': False, 'use_atr': True, 'use_adx': True, 'use_ema': False, 'use_spike': False, 'rsi_required': False, 'edge_k': 0.4592480361196537, 'edge_cap': 0.7110102420718796, 'bull_strategy': 'mean_reversion', 'bull_bb_std_mult': 0.7854807281217981, 'bull_rsi_os': 53, 'bull_rsi_ob': 82, 'bull_adx_thresh': 6.3329797186651655, 'bull_atr_min_pct': 0.002612091522625244, 'bull_atr_max_pct': 0.020577877071426456, 'bull_tp_mult': 1.9966731500720936, 'bull_tsl_mult': 0.571399152382163, 'bull_time_stop': 290, 'bull_use_sma': False, 'bull_use_ema': False, 'bull_use_atr': False, 'bull_use_adx': False, 'bull_use_spike': False, 'bull_rsi_required': True, 'bear_strategy': 'mean_reversion', 'bear_bb_std_mult': 2.7562933933807106, 'bear_rsi_os': 6, 'bear_rsi_ob': 77, 'bear_adx_thresh': 9.722315382075005, 'bear_atr_min_pct': 0.0031757079915451718, 'bear_atr_max_pct': 0.04921295093718164, 'bear_tp_mult': 2.0121853494154958, 'bear_tsl_mult': 0.9797216616869794, 'bear_time_stop': 68, 'bear_use_sma': True, 'bear_use_ema': False, 'bear_use_atr': True, 'bear_use_adx': True, 'bear_use_spike': True, 'bear_rsi_required': True, 'sideways_strategy': 'breakout', 'sideways_bb_std_mult': 1.793133153059391, 'sideways_rsi_os': 36, 'sideways_rsi_ob': 73, 'sideways_adx_thresh': 5.982253611380092, 'sideways_atr_min_pct': 0.007139539141517373, 'sideways_atr_max_pct': 0.07742442776114064, 'sideways_tp_mult': 2.4626579769344605, 'sideways_tsl_mult': 0.44375840686650614, 'sideways_time_stop': 256, 'sideways_use_sma': True, 'sideways_use_ema': True, 'sideways_use_atr': True, 'sideways_use_adx': True, 'sideways_use_spike': True, 'sideways_rsi_required': False}.
[I 2025-09-01 11:42:31,890] Trial 388 finished with values: [-0.015129693137747702, 0.014919952718966203] and parameters: {'p_sma': 49, 'p_std': 37, 'p_atr': 19, 'p_adx': 8, 'rsi_period': 57, 'ema1': 30, 'ema2': 14, 'slip_atr_k': 0.19603507723382152, 'slip_spread_k': 0.4000933410710145, 'spread_hl_frac': 0.02739337161567655, 'bb_std_mult': 1.203730669037241, 'rsi_os': 31, 'rsi_ob': 76, 'vol_spike': 0.26501490918259285, 'adx_thresh': 8.699064015711688, 'atr_min_pct': 0.026671173715066804, 'atr_max_pct': 0.0313113443141808, 'tp_mult': 2.2989222670450147, 'tsl_mult': 0.04668500803333242, 'strategy': 'breakout', 'time_stop': 265, 'use_sma': False, 'use_atr': False, 'use_adx': False, 'use_ema': True, 'use_spike': True, 'rsi_required': False, 'edge_k': 0.7854417123219972, 'edge_cap': 0.7550317219628699, 'bull_strategy': 'breakout', 'bull_bb_std_mult': 0.506815724074652, 'bull_rsi_os': 51, 'bull_rsi_ob': 84, 'bull_adx_thresh': 8.244076019567313, 'bull_atr_min_pct': 0.003560483861160733, 'bull_atr_max_pct': 0.14961598456718983, 'bull_tp_mult': 1.9578748654741784, 'bull_tsl_mult': 0.5435813473453243, 'bull_time_stop': 284, 'bull_use_sma': True, 'bull_use_ema': True, 'bull_use_atr': False, 'bull_use_adx': True, 'bull_use_spike': True, 'bull_rsi_required': True, 'bear_strategy': 'mean_reversion', 'bear_bb_std_mult': 2.542467193833629, 'bear_rsi_os': 8, 'bear_rsi_ob': 46, 'bear_adx_thresh': 33.5982889684444, 'bear_atr_min_pct': 0.003949655123903881, 'bear_atr_max_pct': 0.08597086353617747, 'bear_tp_mult': 1.3188943575050984, 'bear_tsl_mult': 0.9350884189146426, 'bear_time_stop': 72, 'bear_use_sma': True, 'bear_use_ema': True, 'bear_use_atr': False, 'bear_use_adx': False, 'bear_use_spike': True, 'bear_rsi_required': True, 'sideways_strategy': 'mean_reversion', 'sideways_bb_std_mult': 1.7006404457287712, 'sideways_rsi_os': 41, 'sideways_rsi_ob': 93, 'sideways_adx_thresh': 6.210118384047413, 'sideways_atr_min_pct': 0.02139050636455946, 'sideways_atr_max_pct': 0.08272474413630942, 'sideways_tp_mult': 1.4526200557677018, 'sideways_tsl_mult': 0.8307016156725997, 'sideways_time_stop': 275, 'sideways_use_sma': True, 'sideways_use_ema': True, 'sideways_use_atr': True, 'sideways_use_adx': False, 'sideways_use_spike': False, 'sideways_rsi_required': True}.
