[I 2025-09-01 12:16:41,355] Trial 585 finished with values: [-0.09638578226148997, 0.09656057710552518] and parameters: {'p_sma': 28, 'p_std': 49, 'p_atr': 18, 'p_adx': 21, 'rsi_period': 42, 'ema1': 16, 'ema2': 46, 'slip_atr_k': 0.2353057500584035, 'slip_spread_k': 0.40598353943449417, 'spread_hl_frac': 0.018675252017721803, 'bb_std_mult': 1.0929239558221995, 'rsi_os': 31, 'rsi_ob': 46, 'vol_spike': 0.2420139235590777, 'adx_thresh': 15.74426041659791, 'atr_min_pct': 0.025882377486025933, 'atr_max_pct': 0.07668037786006325, 'tp_mult': 2.1307697644363595, 'tsl_mult': 0.1220018329522441, 'strategy': 'breakout', 'time_stop': 38, 'use_sma': False, 'use_atr': True, 'use_adx': True, 'use_ema': True, 'use_spike': False, 'rsi_required': False, 'edge_k': 0.210674965469519, 'edge_cap': 0.09173589067230957, 'bull_strategy': 'mean_reversion', 'bull_bb_std_mult': 1.5794555493016644, 'bull_rsi_os': 34, 'bull_rsi_ob': 48, 'bull_adx_thresh': 6.646124278152351, 'bull_atr_min_pct': 0.023907116025854082, 'bull_atr_max_pct': 0.016602499076313018, 'bull_tp_mult': 1.3826197288324888, 'bull_tsl_mult': 0.5745624827338531, 'bull_time_stop': 172, 'bull_use_sma': False, 'bull_use_ema': False, 'bull_use_atr': True, 'bull_use_adx': False, 'bull_use_spike': False, 'bull_rsi_required': False, 'bear_strategy': 'breakout', 'bear_bb_std_mult': 1.2910437051962658, 'bear_rsi_os': 50, 'bear_rsi_ob': 50, 'bear_adx_thresh': 10.554890911723039, 'bear_atr_min_pct': 0.0016471295359955247, 'bear_atr_max_pct': 0.03221030525805671, 'bear_tp_mult': 1.5405441107677302, 'bear_tsl_mult': 0.8557135506799993, 'bear_time_stop': 282, 'bear_use_sma': True, 'bear_use_ema': False, 'bear_use_atr': True, 'bear_use_adx': True, 'bear_use_spike': False, 'bear_rsi_required': True, 'sideways_strategy': 'breakout', 'sideways_bb_std_mult': 2.826072440905557, 'sideways_rsi_os': 37, 'sideways_rsi_ob': 90, 'sideways_adx_thresh': 32.139568714244106, 'sideways_atr_min_pct': 0.0029518827308340333, 'sideways_atr_max_pct': 0.12477854870563161, 'sideways_tp_mult': 1.8692365525645351, 'sideways_tsl_mult': 0.4077237066538681, 'sideways_time_stop': 101, 'sideways_use_sma': False, 'sideways_use_ema': False, 'sideways_use_atr': True, 'sideways_use_adx': True, 'sideways_use_spike': True, 'sideways_rsi_required': False}.
[I 2025-09-01 12:16:41,598] Trial 587 finished with values: [-0.027997914888994058, 0.02804567885941789] and parameters: {'p_sma': 27, 'p_std': 34, 'p_atr': 18, 'p_adx': 8, 'rsi_period': 49, 'ema1': 9, 'ema2': 54, 'slip_atr_k': 0.032617671486923405, 'slip_spread_k': 0.3581133828287436, 'spread_hl_frac': 0.013464474132754664, 'bb_std_mult': 0.663773625270246, 'rsi_os': 33, 'rsi_ob': 50, 'vol_spike': 0.1976866785463167, 'adx_thresh': 22.298731966414458, 'atr_min_pct': 0.009708933882845217, 'atr_max_pct': 0.14581911473212883, 'tp_mult': 2.0931283398175795, 'tsl_mult': 0.08302419534372951, 'strategy': 'breakout', 'time_stop': 161, 'use_sma': False, 'use_atr': True, 'use_adx': True, 'use_ema': True, 'use_spike': False, 'rsi_required': True, 'edge_k': 0.8678874054258783, 'edge_cap': 0.12541030923979368, 'bull_strategy': 'mean_reversion', 'bull_bb_std_mult': 2.4124189710280195, 'bull_rsi_os': 19, 'bull_rsi_ob': 52, 'bull_adx_thresh': 12.222182358701144, 'bull_atr_min_pct': 0.015965325808444293, 'bull_atr_max_pct': 0.052454097239189555, 'bull_tp_mult': 1.4884367528738986, 'bull_tsl_mult': 0.16547544745238063, 'bull_time_stop': 173, 'bull_use_sma': False, 'bull_use_ema': False, 'bull_use_atr': True, 'bull_use_adx': False, 'bull_use_spike': False, 'bull_rsi_required': False, 'bear_strategy': 'breakout', 'bear_bb_std_mult': 1.4290617989127583, 'bear_rsi_os': 27, 'bear_rsi_ob': 53, 'bear_adx_thresh': 27.798579252785604, 'bear_atr_min_pct': 0.002190579075612378, 'bear_atr_max_pct': 0.026073842146175603, 'bear_tp_mult': 2.450013590239578, 'bear_tsl_mult': 0.8404407059750445, 'bear_time_stop': 197, 'bear_use_sma': True, 'bear_use_ema': False, 'bear_use_atr': True, 'bear_use_adx': True, 'bear_use_spike': False, 'bear_rsi_required': False, 'sideways_strategy': 'breakout', 'sideways_bb_std_mult': 3.0164989420073325, 'sideways_rsi_os': 39, 'sideways_rsi_ob': 90, 'sideways_adx_thresh': 33.73755959511903, 'sideways_atr_min_pct': 0.010149485136329432, 'sideways_atr_max_pct': 0.12465061038208675, 'sideways_tp_mult': 1.8873876691585179, 'sideways_tsl_mult': 0.43047284007073605, 'sideways_time_stop': 102, 'sideways_use_sma': False, 'sideways_use_ema': False, 'sideways_use_atr': False, 'sideways_use_adx': True, 'sideways_use_spike': True, 'sideways_rsi_required': False}.
[I 2025-09-01 12:16:41,832] Trial 584 finished with values: [-1000000000.0, 1000000000.0] and parameters: {'p_sma': 28, 'p_std': 32, 'p_atr': 18, 'p_adx': 26, 'rsi_period': 49, 'ema1': 12, 'ema2': 60, 'slip_atr_k': 0.21539798018266643, 'slip_spread_k': 0.40559811277203983, 'spread_hl_frac': 0.0048894936620322745, 'bb_std_mult': 1.0781078046125825, 'rsi_os': 33, 'rsi_ob': 50, 'vol_spike': 0.19930290879287713, 'adx_thresh': 15.709612392734964, 'atr_min_pct': 0.009533670756379398, 'atr_max_pct': 0.07733424581389357, 'tp_mult': 2.101705054621572, 'tsl_mult': 0.11050264496378837, 'strategy': 'breakout', 'time_stop': 40, 'use_sma': False, 'use_atr': True, 'use_adx': True, 'use_ema': True, 'use_spike': False, 'rsi_required': False, 'edge_k': 0.21017779189312707, 'edge_cap': 0.08863018319041681, 'bull_strategy': 'mean_reversion', 'bull_bb_std_mult': 3.421581370539097, 'bull_rsi_os': 19, 'bull_rsi_ob': 61, 'bull_adx_thresh': 6.648625444676296, 'bull_atr_min_pct': 0.020849212716965375, 'bull_atr_max_pct': 0.11939956777923522, 'bull_tp_mult': 1.3895279928056667, 'bull_tsl_mult': 0.03689002271955755, 'bull_time_stop': 172, 'bull_use_sma': False, 'bull_use_ema': False, 'bull_use_atr': True, 'bull_use_adx': False, 'bull_use_spike': False, 'bull_rsi_required': False, 'bear_strategy': 'breakout', 'bear_bb_std_mult': 1.2818912812764347, 'bear_rsi_os': 27, 'bear_rsi_ob': 50, 'bear_adx_thresh': 10.293348148420176, 'bear_atr_min_pct': 0.014716039266630962, 'bear_atr_max_pct': 0.02595899863758702, 'bear_tp_mult': 2.1883533173059497, 'bear_tsl_mult': 0.7005290883891776, 'bear_time_stop': 282, 'bear_use_sma': True, 'bear_use_ema': False, 'bear_use_atr': True, 'bear_use_adx': True, 'bear_use_spike': False, 'bear_rsi_required': True, 'sideways_strategy': 'breakout', 'sideways_bb_std_mult': 2.4945822834181723, 'sideways_rsi_os': 25, 'sideways_rsi_ob': 89, 'sideways_adx_thresh': 32.40048371481105, 'sideways_atr_min_pct': 0.0030376083021580284, 'sideways_atr_max_pct': 0.1157704750714126, 'sideways_tp_mult': 2.0933069816174577, 'sideways_tsl_mult': 0.6407797008989766, 'sideways_time_stop': 98, 'sideways_use_sma': False, 'sideways_use_ema': False, 'sideways_use_atr': True, 'sideways_use_adx': True, 'sideways_use_spike': True, 'sideways_rsi_required': False}.
[I 2025-09-01 12:17:23,920] Trial 590 finished with values: [-1000000000.0, 1000000000.0] and parameters: {'p_sma': 26, 'p_std': 21, 'p_atr': 19, 'p_adx': 7, 'rsi_period': 45, 'ema1': 28, 'ema2': 44, 'slip_atr_k': 0.021385519958146734, 'slip_spread_k': 0.25442140536173363, 'spread_hl_frac': 0.0014040955853658345, 'bb_std_mult': 0.9339587420020183, 'rsi_os': 21, 'rsi_ob': 47, 'vol_spike': 0.21624203944688342, 'adx_thresh': 24.882050328265528, 'atr_min_pct': 0.022552431794472194, 'atr_max_pct': 0.07020312789367278, 'tp_mult': 2.1906512642238174, 'tsl_mult': 0.10574887929012479, 'strategy': 'breakout', 'time_stop': 187, 'use_sma': False, 'use_atr': True, 'use_adx': True, 'use_ema': True, 'use_spike': False, 'rsi_required': False, 'edge_k': 0.785032581345487, 'edge_cap': 0.07485347002478074, 'bull_strategy': 'mean_reversion', 'bull_bb_std_mult': 1.6990399160911946, 'bull_rsi_os': 52, 'bull_rsi_ob': 53, 'bull_adx_thresh': 11.258891646005594, 'bull_atr_min_pct': 0.026122076469350566, 'bull_atr_max_pct': 0.025847030793730387, 'bull_tp_mult': 1.6726942882062854, 'bull_tsl_mult': 0.6054209246474801, 'bull_time_stop': 163, 'bull_use_sma': False, 'bull_use_ema': False, 'bull_use_atr': False, 'bull_use_adx': False, 'bull_use_spike': False, 'bull_rsi_required': False, 'bear_strategy': 'breakout', 'bear_bb_std_mult': 2.8188313279786725, 'bear_rsi_os': 28, 'bear_rsi_ob': 71, 'bear_adx_thresh': 9.409694018956305, 'bear_atr_min_pct': 0.029051342726893234, 'bear_atr_max_pct': 0.09323753315807087, 'bear_tp_mult': 1.1536415319295084, 'bear_tsl_mult': 0.6966757496457777, 'bear_time_stop': 210, 'bear_use_sma': True, 'bear_use_ema': False, 'bear_use_atr': True, 'bear_use_adx': True, 'bear_use_spike': False, 'bear_rsi_required': True, 'sideways_strategy': 'breakout', 'sideways_bb_std_mult': 2.528229384795302, 'sideways_rsi_os': 13, 'sideways_rsi_ob': 63, 'sideways_adx_thresh': 33.28591706529872, 'sideways_atr_min_pct': 0.02835129564254745, 'sideways_atr_max_pct': 0.033244510258218736, 'sideways_tp_mult': 2.9597374673853913, 'sideways_tsl_mult': 0.36159005915192866, 'sideways_time_stop': 36, 'sideways_use_sma': False, 'sideways_use_ema': False, 'sideways_use_atr': True, 'sideways_use_adx': True, 'sideways_use_spike': True, 'sideways_rsi_required': False}.
[I 2025-09-01 12:17:23,931] Trial 591 finished with values: [-0.21222321125481836, 0.21213151082995194] and parameters: {'p_sma': 49, 'p_std': 16, 'p_atr': 19, 'p_adx': 7, 'rsi_period': 45, 'ema1': 15, 'ema2': 44, 'slip_atr_k': 0.1990429670766557, 'slip_spread_k': 0.2488055821013188, 'spread_hl_frac': 0.0010294493315373713, 'bb_std_mult': 0.901053748751867, 'rsi_os': 21, 'rsi_ob': 48, 'vol_spike': 0.1781508426938587, 'adx_thresh': 23.40395146289204, 'atr_min_pct': 0.02466317397845229, 'atr_max_pct': 0.07136871648701887, 'tp_mult': 2.4546881872012083, 'tsl_mult': 0.627686916384834, 'strategy': 'breakout', 'time_stop': 183, 'use_sma': False, 'use_atr': True, 'use_adx': True, 'use_ema': False, 'use_spike': False, 'rsi_required': True, 'edge_k': 0.11079007285932392, 'edge_cap': 0.9139468644772235, 'bull_strategy': 'mean_reversion', 'bull_bb_std_mult': 1.694273016277609, 'bull_rsi_os': 49, 'bull_rsi_ob': 51, 'bull_adx_thresh': 24.92105578804121, 'bull_atr_min_pct': 0.02607327365568883, 'bull_atr_max_pct': 0.11703672845027886, 'bull_tp_mult': 1.6926635440361475, 'bull_tsl_mult': 0.5896344077821488, 'bull_time_stop': 192, 'bull_use_sma': False, 'bull_use_ema': False, 'bull_use_atr': False, 'bull_use_adx': False, 'bull_use_spike': False, 'bull_rsi_required': False, 'bear_strategy': 'mean_reversion', 'bear_bb_std_mult': 3.567328694460298, 'bear_rsi_os': 28, 'bear_rsi_ob': 73, 'bear_adx_thresh': 34.12206041914054, 'bear_atr_min_pct': 0.015768393642183777, 'bear_atr_max_pct': 0.06070394094486993, 'bear_tp_mult': 1.1519501841626816, 'bear_tsl_mult': 0.7463035806222728, 'bear_time_stop': 224, 'bear_use_sma': True, 'bear_use_ema': False, 'bear_use_atr': True, 'bear_use_adx': True, 'bear_use_spike': False, 'bear_rsi_required': False, 'sideways_strategy': 'breakout', 'sideways_bb_std_mult': 0.7802467634243946, 'sideways_rsi_os': 41, 'sideways_rsi_ob': 54, 'sideways_adx_thresh': 33.283635991138624, 'sideways_atr_min_pct': 0.0009523778290091781, 'sideways_atr_max_pct': 0.12915992842306961, 'sideways_tp_mult': 2.7620170526620993, 'sideways_tsl_mult': 0.13609910615887932, 'sideways_time_stop': 77, 'sideways_use_sma': False, 'sideways_use_ema': False, 'sideways_use_atr': False, 'sideways_use_adx': True, 'sideways_use_spike': True, 'sideways_rsi_required': False}.
[I 2025-09-01 12:17:24,268] Trial 589 finished with values: [-1000000000.0, 1000000000.0] and parameters: {'p_sma': 49, 'p_std': 31, 'p_atr': 19, 'p_adx': 7, 'rsi_period': 45, 'ema1': 28, 'ema2': 40, 'slip_atr_k': 0.20008122384270238, 'slip_spread_k': 0.24116415099856792, 'spread_hl_frac': 0.0064717992178544, 'bb_std_mult': 0.9033681795098767, 'rsi_os': 37, 'rsi_ob': 47, 'vol_spike': 0.19607309379683313, 'adx_thresh': 32.48366930707607, 'atr_min_pct': 0.022617997449716414, 'atr_max_pct': 0.1455231082846279, 'tp_mult': 1.2725943239252473, 'tsl_mult': 0.3001441335881113, 'strategy': 'breakout', 'time_stop': 162, 'use_sma': False, 'use_atr': True, 'use_adx': True, 'use_ema': True, 'use_spike': False, 'rsi_required': True, 'edge_k': 0.8756278249222315, 'edge_cap': 0.07493728147673728, 'bull_strategy': 'mean_reversion', 'bull_bb_std_mult': 2.4238140914304287, 'bull_rsi_os': 23, 'bull_rsi_ob': 52, 'bull_adx_thresh': 11.489324863231888, 'bull_atr_min_pct': 0.01598198816670021, 'bull_atr_max_pct': 0.11665595811979264, 'bull_tp_mult': 1.6791685735020732, 'bull_tsl_mult': 0.6065541937271091, 'bull_time_stop': 164, 'bull_use_sma': False, 'bull_use_ema': False, 'bull_use_atr': False, 'bull_use_adx': False, 'bull_use_spike': False, 'bull_rsi_required': False, 'bear_strategy': 'breakout', 'bear_bb_std_mult': 2.8438814271215436, 'bear_rsi_os': 27, 'bear_rsi_ob': 53, 'bear_adx_thresh': 9.271759818538872, 'bear_atr_min_pct': 0.014569048705590549, 'bear_atr_max_pct': 0.08605408981756908, 'bear_tp_mult': 1.4022271595266946, 'bear_tsl_mult': 0.8426511944441004, 'bear_time_stop': 278, 'bear_use_sma': True, 'bear_use_ema': False, 'bear_use_atr': True, 'bear_use_adx': True, 'bear_use_spike': False, 'bear_rsi_required': False, 'sideways_strategy': 'breakout', 'sideways_bb_std_mult': 1.4299050415272125, 'sideways_rsi_os': 41, 'sideways_rsi_ob': 54, 'sideways_adx_thresh': 20.594673281171147, 'sideways_atr_min_pct': 0.028476336423477678, 'sideways_atr_max_pct': 0.12924653246830525, 'sideways_tp_mult': 2.7814430424424543, 'sideways_tsl_mult': 0.39552434130644537, 'sideways_time_stop': 194, 'sideways_use_sma': False, 'sideways_use_ema': False, 'sideways_use_atr': False, 'sideways_use_adx': True, 'sideways_use_spike': True, 'sideways_rsi_required': False}.
[I 2025-09-01 12:17:24,861] Trial 588 finished with values: [-0.10893918097914101, 0.1088630994642294] and parameters: {'p_sma': 26, 'p_std': 16, 'p_atr': 19, 'p_adx': 7, 'rsi_period': 20, 'ema1': 26, 'ema2': 17, 'slip_atr_k': 0.2124573054852097, 'slip_spread_k': 0.35646908771004093, 'spread_hl_frac': 0.0012248862884393003, 'bb_std_mult': 0.8922757299381733, 'rsi_os': 21, 'rsi_ob': 47, 'vol_spike': 0.2432628178305331, 'adx_thresh': 23.95639807775311, 'atr_min_pct': 0.02461265564216757, 'atr_max_pct': 0.08735486948193628, 'tp_mult': 2.093191444570445, 'tsl_mult': 0.11285043118465121, 'strategy': 'breakout', 'time_stop': 187, 'use_sma': False, 'use_atr': True, 'use_adx': True, 'use_ema': True, 'use_spike': False, 'rsi_required': True, 'edge_k': 0.11709205835017286, 'edge_cap': 0.8634849162029954, 'bull_strategy': 'mean_reversion', 'bull_bb_std_mult': 1.694428847808356, 'bull_rsi_os': 52, 'bull_rsi_ob': 52, 'bull_adx_thresh': 24.997849273798273, 'bull_atr_min_pct': 0.024112397713359032, 'bull_atr_max_pct': 0.11623331500268493, 'bull_tp_mult': 1.392156195485622, 'bull_tsl_mult': 0.15125326336264033, 'bull_time_stop': 169, 'bull_use_sma': False, 'bull_use_ema': False, 'bull_use_atr': True, 'bull_use_adx': False, 'bull_use_spike': False, 'bull_rsi_required': False, 'bear_strategy': 'breakout', 'bear_bb_std_mult': 2.373156939084012, 'bear_rsi_os': 27, 'bear_rsi_ob': 53, 'bear_adx_thresh': 27.80117822259691, 'bear_atr_min_pct': 0.029297508347098128, 'bear_atr_max_pct': 0.025730271181100054, 'bear_tp_mult': 1.4548838136038513, 'bear_tsl_mult': 0.758067273946293, 'bear_time_stop': 204, 'bear_use_sma': True, 'bear_use_ema': False, 'bear_use_atr': True, 'bear_use_adx': True, 'bear_use_spike': False, 'bear_rsi_required': False, 'sideways_strategy': 'breakout', 'sideways_bb_std_mult': 2.4057614719490537, 'sideways_rsi_os': 41, 'sideways_rsi_ob': 66, 'sideways_adx_thresh': 33.65008124280156, 'sideways_atr_min_pct': 0.001239158365728044, 'sideways_atr_max_pct': 0.12893473457021581, 'sideways_tp_mult': 1.8659890267939754, 'sideways_tsl_mult': 0.4005540878233555, 'sideways_time_stop': 74, 'sideways_use_sma': False, 'sideways_use_ema': False, 'sideways_use_atr': False, 'sideways_use_adx': True, 'sideways_use_spike': True, 'sideways_rsi_required': False}.
[I 2025-09-01 12:18:07,022] Trial 593 finished with values: [-1000000000.0, 1000000000.0] and parameters: {'p_sma': 59, 'p_std': 12, 'p_atr': 13, 'p_adx': 11, 'rsi_period': 47, 'ema1': 26, 'ema2': 12, 'slip_atr_k': 0.05334839173004587, 'slip_spread_k': 0.37262606383913444, 'spread_hl_frac': 0.002907033152003767, 'bb_std_mult': 0.7908601322499372, 'rsi_os': 48, 'rsi_ob': 47, 'vol_spike': 0.03653597941983509, 'adx_thresh': 24.21897072980993, 'atr_min_pct': 0.022593598597128124, 'atr_max_pct': 0.08159850970488786, 'tp_mult': 2.0657096353650037, 'tsl_mult': 0.29623532530485097, 'strategy': 'breakout', 'time_stop': 164, 'use_sma': True, 'use_atr': True, 'use_adx': True, 'use_ema': True, 'use_spike': False, 'rsi_required': False, 'edge_k': 1.081666725870688, 'edge_cap': 0.43022086957991246, 'bull_strategy': 'mean_reversion', 'bull_bb_std_mult': 1.6362669979846642, 'bull_rsi_os': 49, 'bull_rsi_ob': 49, 'bull_adx_thresh': 5.9678818506125095, 'bull_atr_min_pct': 0.016185526177821943, 'bull_atr_max_pct': 0.10863716595593852, 'bull_tp_mult': 1.283947098588942, 'bull_tsl_mult': 0.1325818657862491, 'bull_time_stop': 49, 'bull_use_sma': False, 'bull_use_ema': False, 'bull_use_atr': True, 'bull_use_adx': False, 'bull_use_spike': False, 'bull_rsi_required': True, 'bear_strategy': 'breakout', 'bear_bb_std_mult': 2.3704555532962996, 'bear_rsi_os': 30, 'bear_rsi_ob': 79, 'bear_adx_thresh': 8.67579804063063, 'bear_atr_min_pct': 0.005244512007173987, 'bear_atr_max_pct': 0.1334918691909698, 'bear_tp_mult': 1.4042601675875017, 'bear_tsl_mult': 0.734782273481744, 'bear_time_stop': 158, 'bear_use_sma': False, 'bear_use_ema': False, 'bear_use_atr': True, 'bear_use_adx': True, 'bear_use_spike': False, 'bear_rsi_required': True, 'sideways_strategy': 'breakout', 'sideways_bb_std_mult': 2.393096959011908, 'sideways_rsi_os': 40, 'sideways_rsi_ob': 68, 'sideways_adx_thresh': 29.8665418386608, 'sideways_atr_min_pct': 0.009035559797352212, 'sideways_atr_max_pct': 0.13213287258269296, 'sideways_tp_mult': 1.1506295624543055, 'sideways_tsl_mult': 0.3616257377693707, 'sideways_time_stop': 93, 'sideways_use_sma': False, 'sideways_use_ema': False, 'sideways_use_atr': True, 'sideways_use_adx': True, 'sideways_use_spike': True, 'sideways_rsi_required': False}.
[I 2025-09-01 12:18:07,625] Trial 595 finished with values: [-1000000000.0, 1000000000.0] and parameters: {'p_sma': 51, 'p_std': 12, 'p_atr': 10, 'p_adx': 11, 'rsi_period': 48, 'ema1': 26, 'ema2': 12, 'slip_atr_k': 0.021572567259093043, 'slip_spread_k': 0.3839943672075162, 'spread_hl_frac': 0.0025707307988726887, 'bb_std_mult': 1.1989817512422893, 'rsi_os': 34, 'rsi_ob': 51, 'vol_spike': 0.20998501073632944, 'adx_thresh': 23.391181819410992, 'atr_min_pct': 0.021148923258220848, 'atr_max_pct': 0.08074242996852814, 'tp_mult': 2.0345611593449675, 'tsl_mult': 0.07993919695635034, 'strategy': 'breakout', 'time_stop': 173, 'use_sma': True, 'use_atr': True, 'use_adx': True, 'use_ema': False, 'use_spike': False, 'rsi_required': False, 'edge_k': 1.6363788541877147, 'edge_cap': 0.15818290569243804, 'bull_strategy': 'mean_reversion', 'bull_bb_std_mult': 1.8415717587732336, 'bull_rsi_os': 54, 'bull_rsi_ob': 49, 'bull_adx_thresh': 5.0501132332434775, 'bull_atr_min_pct': 0.01661719942117781, 'bull_atr_max_pct': 0.10885824451618323, 'bull_tp_mult': 1.2750825774125218, 'bull_tsl_mult': 0.5247269148810926, 'bull_time_stop': 214, 'bull_use_sma': False, 'bull_use_ema': False, 'bull_use_atr': True, 'bull_use_adx': False, 'bull_use_spike': False, 'bull_rsi_required': True, 'bear_strategy': 'mean_reversion', 'bear_bb_std_mult': 1.3727991808137827, 'bear_rsi_os': 25, 'bear_rsi_ob': 72, 'bear_adx_thresh': 7.9607056653285975, 'bear_atr_min_pct': 0.0038009132893542935, 'bear_atr_max_pct': 0.029112493796097753, 'bear_tp_mult': 1.6218432774041438, 'bear_tsl_mult': 0.7226789404442129, 'bear_time_stop': 269, 'bear_use_sma': False, 'bear_use_ema': False, 'bear_use_atr': True, 'bear_use_adx': True, 'bear_use_spike': False, 'bear_rsi_required': True, 'sideways_strategy': 'breakout', 'sideways_bb_std_mult': 1.169761027933443, 'sideways_rsi_os': 40, 'sideways_rsi_ob': 87, 'sideways_adx_thresh': 21.508411276967706, 'sideways_atr_min_pct': 0.00904418679380614, 'sideways_atr_max_pct': 0.1355964075333813, 'sideways_tp_mult': 2.285629823029864, 'sideways_tsl_mult': 0.36252997390131886, 'sideways_time_stop': 107, 'sideways_use_sma': False, 'sideways_use_ema': False, 'sideways_use_atr': True, 'sideways_use_adx': True, 'sideways_use_spike': True, 'sideways_rsi_required': False}.
