[I 2025-09-01 10:46:13,038] Trial 18 finished with values: [-0.12479023589412808, 0.12470288054169433] and parameters: {'p_sma': 50, 'p_std': 29, 'p_atr': 7, 'p_adx': 15, 'rsi_period': 74, 'ema1': 13, 'ema2': 60, 'slip_atr_k': 0.2222924744794949, 'slip_spread_k': 0.34268083107486796, 'spread_hl_frac': 0.03948282302427729, 'bb_std_mult': 2.7502086616595323, 'rsi_os': 43, 'rsi_ob': 78, 'vol_spike': 0.2941044181327347, 'adx_thresh': 5.150512877002708, 'atr_min_pct': 0.005134030028824295, 'atr_max_pct': 0.1467120418157113, 'tp_mult': 1.9824206244369802, 'tsl_mult': 0.3998299603669688, 'strategy': 'breakout', 'time_stop': 55, 'use_sma': True, 'use_atr': True, 'use_adx': True, 'use_ema': False, 'use_spike': True, 'rsi_required': False, 'edge_k': 0.2846747002617852, 'edge_cap': 0.8642517304961428, 'bull_strategy': 'breakout', 'bull_bb_std_mult': 3.5570829034723417, 'bull_rsi_os': 16, 'bull_rsi_ob': 81, 'bull_adx_thresh': 16.93755813060086, 'bull_atr_min_pct': 0.004560857855318696, 'bull_atr_max_pct': 0.10917514436859248, 'bull_tp_mult': 2.7874226699776252, 'bull_tsl_mult': 0.644017575974593, 'bull_time_stop': 189, 'bull_use_sma': False, 'bull_use_ema': True, 'bull_use_atr': False, 'bull_use_adx': True, 'bull_use_spike': True, 'bull_rsi_required': False, 'bear_strategy': 'breakout', 'bear_bb_std_mult': 1.748834198834962, 'bear_rsi_os': 31, 'bear_rsi_ob': 45, 'bear_adx_thresh': 23.05606805130374, 'bear_atr_min_pct': 0.000512481813904864, 'bear_atr_max_pct': 0.0619121804813971, 'bear_tp_mult': 2.401624440179704, 'bear_tsl_mult': 0.346647962130352, 'bear_time_stop': 87, 'bear_use_sma': False, 'bear_use_ema': False, 'bear_use_atr': True, 'bear_use_adx': True, 'bear_use_spike': False, 'bear_rsi_required': True, 'sideways_strategy': 'breakout', 'sideways_bb_std_mult': 2.8740980798702855, 'sideways_rsi_os': 11, 'sideways_rsi_ob': 94, 'sideways_adx_thresh': 31.09413906584672, 'sideways_atr_min_pct': 0.01848223387735024, 'sideways_atr_max_pct': 0.010269258663476943, 'sideways_tp_mult': 1.8544949312661319, 'sideways_tsl_mult': 0.9852006771409345, 'sideways_time_stop': 62, 'sideways_use_sma': False, 'sideways_use_ema': False, 'sideways_use_atr': True, 'sideways_use_adx': True, 'sideways_use_spike': True, 'sideways_rsi_required': False}.
[I 2025-09-01 10:46:13,376] Trial 19 finished with values: [-0.10292767093819999, 0.10271132366542199] and parameters: {'p_sma': 18, 'p_std': 5, 'p_atr': 11, 'p_adx': 15, 'rsi_period': 36, 'ema1': 13, 'ema2': 49, 'slip_atr_k': 0.15370050397753976, 'slip_spread_k': 0.26908807000792995, 'spread_hl_frac': 0.0023176218319990874, 'bb_std_mult': 2.552313811311372, 'rsi_os': 17, 'rsi_ob': 77, 'vol_spike': 0.29643651415979727, 'adx_thresh': 7.0323776680600485, 'atr_min_pct': 0.003654400178587234, 'atr_max_pct': 0.14686382877566556, 'tp_mult': 1.5514861813704142, 'tsl_mult': 0.41540835087384, 'strategy': 'breakout', 'time_stop': 185, 'use_sma': False, 'use_atr': False, 'use_adx': True, 'use_ema': False, 'use_spike': True, 'rsi_required': False, 'edge_k': 0.047717200483647804, 'edge_cap': 0.8509126560838453, 'bull_strategy': 'breakout', 'bull_bb_std_mult': 3.292793072932972, 'bull_rsi_os': 28, 'bull_rsi_ob': 83, 'bull_adx_thresh': 16.2784529838506, 'bull_atr_min_pct': 0.003811221730967984, 'bull_atr_max_pct': 0.11292837146708076, 'bull_tp_mult': 2.7398245276964825, 'bull_tsl_mult': 0.8674159695995101, 'bull_time_stop': 192, 'bull_use_sma': False, 'bull_use_ema': True, 'bull_use_atr': False, 'bull_use_adx': True, 'bull_use_spike': True, 'bull_rsi_required': False, 'bear_strategy': 'breakout', 'bear_bb_std_mult': 2.932118073917028, 'bear_rsi_os': 29, 'bear_rsi_ob': 52, 'bear_adx_thresh': 25.99439123901265, 'bear_atr_min_pct': 0.0008579955964594949, 'bear_atr_max_pct': 0.012525417656473456, 'bear_tp_mult': 1.6579754669868985, 'bear_tsl_mult': 0.1733693917840839, 'bear_time_stop': 119, 'bear_use_sma': False, 'bear_use_ema': True, 'bear_use_atr': False, 'bear_use_adx': True, 'bear_use_spike': False, 'bear_rsi_required': True, 'sideways_strategy': 'breakout', 'sideways_bb_std_mult': 2.7231688626639556, 'sideways_rsi_os': 13, 'sideways_rsi_ob': 95, 'sideways_adx_thresh': 23.74741192217727, 'sideways_atr_min_pct': 0.017272266150058425, 'sideways_atr_max_pct': 0.05818098460001267, 'sideways_tp_mult': 1.9198750104852949, 'sideways_tsl_mult': 0.060040622395596766, 'sideways_time_stop': 127, 'sideways_use_sma': False, 'sideways_use_ema': False, 'sideways_use_atr': True, 'sideways_use_adx': True, 'sideways_use_spike': True, 'sideways_rsi_required': False}.
[I 2025-09-01 10:46:48,032] Trial 20 finished with values: [-1000000000.0, 1000000000.0] and parameters: {'p_sma': 19, 'p_std': 49, 'p_atr': 11, 'p_adx': 15, 'rsi_period': 29, 'ema1': 25, 'ema2': 49, 'slip_atr_k': 0.1656987758695892, 'slip_spread_k': 0.17416532895549736, 'spread_hl_frac': 0.0009579006528060597, 'bb_std_mult': 3.5676495359139535, 'rsi_os': 19, 'rsi_ob': 78, 'vol_spike': 0.26354747072542295, 'adx_thresh': 6.354748751003206, 'atr_min_pct': 0.003137796289938276, 'atr_max_pct': 0.03881698462425034, 'tp_mult': 1.5957929445269512, 'tsl_mult': 0.4392624880597483, 'strategy': 'breakout', 'time_stop': 164, 'use_sma': False, 'use_atr': False, 'use_adx': True, 'use_ema': False, 'use_spike': True, 'rsi_required': False, 'edge_k': 0.055831979773344864, 'edge_cap': 0.9251582472423199, 'bull_strategy': 'breakout', 'bull_bb_std_mult': 3.38435181584125, 'bull_rsi_os': 5, 'bull_rsi_ob': 85, 'bull_adx_thresh': 27.54151921270386, 'bull_atr_min_pct': 0.02679309344507559, 'bull_atr_max_pct': 0.015044496450256836, 'bull_tp_mult': 1.0170388325585895, 'bull_tsl_mult': 0.9921907312260655, 'bull_time_stop': 174, 'bull_use_sma': False, 'bull_use_ema': True, 'bull_use_atr': False, 'bull_use_adx': True, 'bull_use_spike': True, 'bull_rsi_required': True, 'bear_strategy': 'breakout', 'bear_bb_std_mult': 2.7888341550452114, 'bear_rsi_os': 30, 'bear_rsi_ob': 53, 'bear_adx_thresh': 27.334407085277903, 'bear_atr_min_pct': 0.01269817430261782, 'bear_atr_max_pct': 0.059033107662428384, 'bear_tp_mult': 2.577659507866417, 'bear_tsl_mult': 0.005446610145581676, 'bear_time_stop': 181, 'bear_use_sma': False, 'bear_use_ema': True, 'bear_use_atr': False, 'bear_use_adx': True, 'bear_use_spike': False, 'bear_rsi_required': True, 'sideways_strategy': 'breakout', 'sideways_bb_std_mult': 2.8942753242873387, 'sideways_rsi_os': 14, 'sideways_rsi_ob': 84, 'sideways_adx_thresh': 23.672654233212736, 'sideways_atr_min_pct': 0.0023218129014583033, 'sideways_atr_max_pct': 0.05601208909026856, 'sideways_tp_mult': 1.8916643576914924, 'sideways_tsl_mult': 0.9593469933735395, 'sideways_time_stop': 131, 'sideways_use_sma': True, 'sideways_use_ema': False, 'sideways_use_atr': True, 'sideways_use_adx': True, 'sideways_use_spike': True, 'sideways_rsi_required': False}.
[I 2025-09-01 10:46:52,913] Trial 22 finished with values: [-1000000000.0, 1000000000.0] and parameters: {'p_sma': 16, 'p_std': 32, 'p_atr': 11, 'p_adx': 21, 'rsi_period': 41, 'ema1': 24, 'ema2': 48, 'slip_atr_k': 0.09177012794970474, 'slip_spread_k': 0.17762236724652722, 'spread_hl_frac': 0.021625192225858778, 'bb_std_mult': 3.528421390684274, 'rsi_os': 19, 'rsi_ob': 47, 'vol_spike': 0.24899072910826242, 'adx_thresh': 16.775611592513087, 'atr_min_pct': 0.009980629390939839, 'atr_max_pct': 0.03357922781108159, 'tp_mult': 1.5426792702707963, 'tsl_mult': 0.44768562247896193, 'strategy': 'breakout', 'time_stop': 284, 'use_sma': False, 'use_atr': False, 'use_adx': False, 'use_ema': False, 'use_spike': False, 'rsi_required': False, 'edge_k': 0.07708338528756775, 'edge_cap': 0.9982662789972311, 'bull_strategy': 'breakout', 'bull_bb_std_mult': 3.0231418309048674, 'bull_rsi_os': 27, 'bull_rsi_ob': 69, 'bull_adx_thresh': 26.684369278505162, 'bull_atr_min_pct': 0.003386237338846106, 'bull_atr_max_pct': 0.1278597653158203, 'bull_tp_mult': 2.2682079511799422, 'bull_tsl_mult': 0.9372373810668047, 'bull_time_stop': 53, 'bull_use_sma': False, 'bull_use_ema': True, 'bull_use_atr': True, 'bull_use_adx': False, 'bull_use_spike': True, 'bull_rsi_required': True, 'bear_strategy': 'breakout', 'bear_bb_std_mult': 3.5752055093650785, 'bear_rsi_os': 26, 'bear_rsi_ob': 54, 'bear_adx_thresh': 17.371277563267775, 'bear_atr_min_pct': 0.01269531140156514, 'bear_atr_max_pct': 0.06736655686578039, 'bear_tp_mult': 1.596832918947217, 'bear_tsl_mult': 0.17423527986483442, 'bear_time_stop': 46, 'bear_use_sma': True, 'bear_use_ema': True, 'bear_use_atr': False, 'bear_use_adx': True, 'bear_use_spike': False, 'bear_rsi_required': True, 'sideways_strategy': 'breakout', 'sideways_bb_std_mult': 1.987578565311112, 'sideways_rsi_os': 14, 'sideways_rsi_ob': 85, 'sideways_adx_thresh': 23.70451935000108, 'sideways_atr_min_pct': 0.02357416249743499, 'sideways_atr_max_pct': 0.06057905926650163, 'sideways_tp_mult': 1.354862864259764, 'sideways_tsl_mult': 0.08326838096348643, 'sideways_time_stop': 130, 'sideways_use_sma': True, 'sideways_use_ema': False, 'sideways_use_atr': True, 'sideways_use_adx': True, 'sideways_use_spike': True, 'sideways_rsi_required': False}.
[I 2025-09-01 10:46:53,335] Trial 21 finished with values: [-1000000000.0, 1000000000.0] and parameters: {'p_sma': 19, 'p_std': 49, 'p_atr': 11, 'p_adx': 21, 'rsi_period': 39, 'ema1': 24, 'ema2': 48, 'slip_atr_k': 0.07978641791198507, 'slip_spread_k': 0.17382542226863368, 'spread_hl_frac': 0.020116816727026664, 'bb_std_mult': 3.538033871659393, 'rsi_os': 19, 'rsi_ob': 94, 'vol_spike': 0.11517749102210306, 'adx_thresh': 7.946354519599972, 'atr_min_pct': 0.008862059907548599, 'atr_max_pct': 0.03899948498392278, 'tp_mult': 1.541204888833409, 'tsl_mult': 0.45259312514146754, 'strategy': 'breakout', 'time_stop': 182, 'use_sma': False, 'use_atr': False, 'use_adx': False, 'use_ema': False, 'use_spike': False, 'rsi_required': False, 'edge_k': 0.011875983488430775, 'edge_cap': 0.8577836516636622, 'bull_strategy': 'breakout', 'bull_bb_std_mult': 3.1074199675189202, 'bull_rsi_os': 27, 'bull_rsi_ob': 69, 'bull_adx_thresh': 26.644138716346074, 'bull_atr_min_pct': 0.028713394309328365, 'bull_atr_max_pct': 0.12837985932853657, 'bull_tp_mult': 2.2896267734719693, 'bull_tsl_mult': 0.2628756628902432, 'bull_time_stop': 135, 'bull_use_sma': False, 'bull_use_ema': True, 'bull_use_atr': True, 'bull_use_adx': False, 'bull_use_spike': True, 'bull_rsi_required': True, 'bear_strategy': 'breakout', 'bear_bb_std_mult': 2.9052569293390413, 'bear_rsi_os': 24, 'bear_rsi_ob': 55, 'bear_adx_thresh': 15.408213204976933, 'bear_atr_min_pct': 0.012545722242143452, 'bear_atr_max_pct': 0.034750080027611874, 'bear_tp_mult': 1.7165024808989406, 'bear_tsl_mult': 0.1585732496515232, 'bear_time_stop': 51, 'bear_use_sma': True, 'bear_use_ema': True, 'bear_use_atr': False, 'bear_use_adx': True, 'bear_use_spike': False, 'bear_rsi_required': True, 'sideways_strategy': 'breakout', 'sideways_bb_std_mult': 2.12657317909892, 'sideways_rsi_os': 14, 'sideways_rsi_ob': 82, 'sideways_adx_thresh': 23.590793001072015, 'sideways_atr_min_pct': 0.022578222572649912, 'sideways_atr_max_pct': 0.051463570504493836, 'sideways_tp_mult': 1.29949869946097, 'sideways_tsl_mult': 0.8626793352025552, 'sideways_time_stop': 127, 'sideways_use_sma': True, 'sideways_use_ema': False, 'sideways_use_atr': True, 'sideways_use_adx': True, 'sideways_use_spike': True, 'sideways_rsi_required': False}.
[I 2025-09-01 10:46:54,209] Trial 23 finished with values: [-1000000000.0, 1000000000.0] and parameters: {'p_sma': 43, 'p_std': 47, 'p_atr': 11, 'p_adx': 22, 'rsi_period': 24, 'ema1': 24, 'ema2': 28, 'slip_atr_k': 0.08118912256485243, 'slip_spread_k': 0.17172475969752388, 'spread_hl_frac': 0.020842737402795783, 'bb_std_mult': 3.589019418021607, 'rsi_os': 22, 'rsi_ob': 95, 'vol_spike': 0.11560989194138943, 'adx_thresh': 17.07866210366784, 'atr_min_pct': 0.009028597908622621, 'atr_max_pct': 0.04239232019475633, 'tp_mult': 2.267777291715799, 'tsl_mult': 0.7311539626036115, 'strategy': 'breakout', 'time_stop': 265, 'use_sma': False, 'use_atr': False, 'use_adx': False, 'use_ema': False, 'use_spike': False, 'rsi_required': False, 'edge_k': 0.8463916779586866, 'edge_cap': 0.47450897850565515, 'bull_strategy': 'breakout', 'bull_bb_std_mult': 0.5079521350687215, 'bull_rsi_os': 41, 'bull_rsi_ob': 70, 'bull_adx_thresh': 27.239839238067642, 'bull_atr_min_pct': 0.02968455282775366, 'bull_atr_max_pct': 0.1307786802843363, 'bull_tp_mult': 2.3062862052208812, 'bull_tsl_mult': 0.25410857715407664, 'bull_time_stop': 123, 'bull_use_sma': False, 'bull_use_ema': True, 'bull_use_atr': True, 'bull_use_adx': False, 'bull_use_spike': True, 'bull_rsi_required': True, 'bear_strategy': 'breakout', 'bear_bb_std_mult': 3.5433060015857873, 'bear_rsi_os': 23, 'bear_rsi_ob': 59, 'bear_adx_thresh': 15.349233825895295, 'bear_atr_min_pct': 0.0223586876671808, 'bear_atr_max_pct': 0.03950727778581861, 'bear_tp_mult': 2.59164319415887, 'bear_tsl_mult': 0.4230421526849216, 'bear_time_stop': 50, 'bear_use_sma': True, 'bear_use_ema': True, 'bear_use_atr': False, 'bear_use_adx': True, 'bear_use_spike': False, 'bear_rsi_required': True, 'sideways_strategy': 'breakout', 'sideways_bb_std_mult': 1.9904439020046856, 'sideways_rsi_os': 16, 'sideways_rsi_ob': 85, 'sideways_adx_thresh': 13.438172204145243, 'sideways_atr_min_pct': 0.02301266895133817, 'sideways_atr_max_pct': 0.059172974879814634, 'sideways_tp_mult': 1.3529808925210234, 'sideways_tsl_mult': 0.5515420494538751, 'sideways_time_stop': 57, 'sideways_use_sma': True, 'sideways_use_ema': False, 'sideways_use_atr': True, 'sideways_use_adx': True, 'sideways_use_spike': True, 'sideways_rsi_required': False}.
[I 2025-09-01 10:47:33,386] Trial 24 finished with values: [-0.03320724786924911, 0.03329261926712634] and parameters: {'p_sma': 41, 'p_std': 31, 'p_atr': 23, 'p_adx': 22, 'rsi_period': 65, 'ema1': 26, 'ema2': 29, 'slip_atr_k': 0.20609811549177282, 'slip_spread_k': 0.1404463391873011, 'spread_hl_frac': 0.020869681097150764, 'bb_std_mult': 3.3014233162435223, 'rsi_os': 12, 'rsi_ob': 61, 'vol_spike': 0.17564535927724045, 'adx_thresh': 16.65404241833819, 'atr_min_pct': 0.00831413432782913, 'atr_max_pct': 0.11261629599776499, 'tp_mult': 2.3012467620057353, 'tsl_mult': 0.6895105245733155, 'strategy': 'breakout', 'time_stop': 263, 'use_sma': False, 'use_atr': False, 'use_adx': False, 'use_ema': False, 'use_spike': False, 'rsi_required': False, 'edge_k': 0.7776668408161063, 'edge_cap': 0.6096114254196542, 'bull_strategy': 'breakout', 'bull_bb_std_mult': 1.5125593592226991, 'bull_rsi_os': 22, 'bull_rsi_ob': 69, 'bull_adx_thresh': 7.019773217504451, 'bull_atr_min_pct': 0.0021900517539310263, 'bull_atr_max_pct': 0.12493065998923325, 'bull_tp_mult': 2.2332231432656036, 'bull_tsl_mult': 0.5422296831951583, 'bull_time_stop': 110, 'bull_use_sma': True, 'bull_use_ema': True, 'bull_use_atr': True, 'bull_use_adx': False, 'bull_use_spike': True, 'bull_rsi_required': True, 'bear_strategy': 'breakout', 'bear_bb_std_mult': 3.0018603840513833, 'bear_rsi_os': 22, 'bear_rsi_ob': 59, 'bear_adx_thresh': 16.118044708540683, 'bear_atr_min_pct': 0.00436342146223803, 'bear_atr_max_pct': 0.03858746988709169, 'bear_tp_mult': 1.9540813966411203, 'bear_tsl_mult': 0.4267439731931597, 'bear_time_stop': 47, 'bear_use_sma': True, 'bear_use_ema': True, 'bear_use_atr': False, 'bear_use_adx': True, 'bear_use_spike': False, 'bear_rsi_required': True, 'sideways_strategy': 'breakout', 'sideways_bb_std_mult': 1.9667585727354981, 'sideways_rsi_os': 27, 'sideways_rsi_ob': 87, 'sideways_adx_thresh': 13.789417381080778, 'sideways_atr_min_pct': 0.022573476954315677, 'sideways_atr_max_pct': 0.03465863550350117, 'sideways_tp_mult': 1.298087735803548, 'sideways_tsl_mult': 0.8390279662422686, 'sideways_time_stop': 46, 'sideways_use_sma': True, 'sideways_use_ema': False, 'sideways_use_atr': True, 'sideways_use_adx': True, 'sideways_use_spike': True, 'sideways_rsi_required': False}.
[I 2025-09-01 10:47:36,739] Trial 27 finished with values: [-0.06304805334113373, 0.0630978519661614] and parameters: {'p_sma': 53, 'p_std': 22, 'p_atr': 21, 'p_adx': 14, 'rsi_period': 65, 'ema1': 28, 'ema2': 38, 'slip_atr_k': 0.2093042914649477, 'slip_spread_k': 0.9971031183490688, 'spread_hl_frac': 0.009246057989293602, 'bb_std_mult': 3.154620043466551, 'rsi_os': 30, 'rsi_ob': 63, 'vol_spike': 0.1853457030283728, 'adx_thresh': 15.220548853286104, 'atr_min_pct': 0.013169997752662345, 'atr_max_pct': 0.11500793318421453, 'tp_mult': 2.9114880794124, 'tsl_mult': 0.304164376889003, 'strategy': 'breakout', 'time_stop': 9, 'use_sma': False, 'use_atr': False, 'use_adx': True, 'use_ema': True, 'use_spike': True, 'rsi_required': False, 'edge_k': 0.714655277514942, 'edge_cap': 0.6430715044593456, 'bull_strategy': 'breakout', 'bull_bb_std_mult': 1.5964460909948714, 'bull_rsi_os': 21, 'bull_rsi_ob': 75, 'bull_adx_thresh': 6.134052977421694, 'bull_atr_min_pct': 0.0017443627956970093, 'bull_atr_max_pct': 0.09439630586257974, 'bull_tp_mult': 2.71427057526264, 'bull_tsl_mult': 0.5382385629586763, 'bull_time_stop': 85, 'bull_use_sma': True, 'bull_use_ema': True, 'bull_use_atr': False, 'bull_use_adx': False, 'bull_use_spike': True, 'bull_rsi_required': True, 'bear_strategy': 'mean_reversion', 'bear_bb_std_mult': 1.0177754688080127, 'bear_rsi_os': 14, 'bear_rsi_ob': 50, 'bear_adx_thresh': 20.82470820427447, 'bear_atr_min_pct': 0.005119805952261122, 'bear_atr_max_pct': 0.14762550811137912, 'bear_tp_mult': 1.8974074521872162, 'bear_tsl_mult': 0.6027170374418435, 'bear_time_stop': 7, 'bear_use_sma': True, 'bear_use_ema': True, 'bear_use_atr': False, 'bear_use_adx': False, 'bear_use_spike': False, 'bear_rsi_required': True, 'sideways_strategy': 'breakout', 'sideways_bb_std_mult': 1.0318577742961168, 'sideways_rsi_os': 24, 'sideways_rsi_ob': 61, 'sideways_adx_thresh': 28.641367382809584, 'sideways_atr_min_pct': 0.016082853775685347, 'sideways_atr_max_pct': 0.11341233810380452, 'sideways_tp_mult': 2.0755411920089597, 'sideways_tsl_mult': 0.7993408946736609, 'sideways_time_stop': 39, 'sideways_use_sma': True, 'sideways_use_ema': False, 'sideways_use_atr': False, 'sideways_use_adx': True, 'sideways_use_spike': True, 'sideways_rsi_required': True}.
[I 2025-09-01 10:47:36,969] Trial 25 finished with values: [-1000000000.0, 1000000000.0] and parameters: {'p_sma': 41, 'p_std': 21, 'p_atr': 23, 'p_adx': 21, 'rsi_period': 65, 'ema1': 28, 'ema2': 10, 'slip_atr_k': 0.21533230587529845, 'slip_spread_k': 0.1368644253943948, 'spread_hl_frac': 0.008114143579955196, 'bb_std_mult': 3.189013516701907, 'rsi_os': 26, 'rsi_ob': 64, 'vol_spike': 0.11458320617664423, 'adx_thresh': 15.256661869260132, 'atr_min_pct': 0.013665411182856212, 'atr_max_pct': 0.05619249648803274, 'tp_mult': 2.3111990029573706, 'tsl_mult': 0.7006363465143798, 'strategy': 'breakout', 'time_stop': 268, 'use_sma': False, 'use_atr': False, 'use_adx': True, 'use_ema': False, 'use_spike': True, 'rsi_required': False, 'edge_k': 0.8133663409826528, 'edge_cap': 0.4356973877879993, 'bull_strategy': 'breakout', 'bull_bb_std_mult': 1.4292014350245361, 'bull_rsi_os': 43, 'bull_rsi_ob': 77, 'bull_adx_thresh': 30.81122360471628, 'bull_atr_min_pct': 0.011151791994945415, 'bull_atr_max_pct': 0.12757292699054046, 'bull_tp_mult': 2.6937809475283427, 'bull_tsl_mult': 0.5406410717775092, 'bull_time_stop': 119, 'bull_use_sma': True, 'bull_use_ema': True, 'bull_use_atr': False, 'bull_use_adx': False, 'bull_use_spike': True, 'bull_rsi_required': True, 'bear_strategy': 'breakout', 'bear_bb_std_mult': 1.9315277965551323, 'bear_rsi_os': 22, 'bear_rsi_ob': 61, 'bear_adx_thresh': 19.996855756885218, 'bear_atr_min_pct': 0.0048370130098796225, 'bear_atr_max_pct': 0.03945181234911509, 'bear_tp_mult': 1.8897539846829758, 'bear_tsl_mult': 0.4094628490550673, 'bear_time_stop': 52, 'bear_use_sma': True, 'bear_use_ema': True, 'bear_use_atr': False, 'bear_use_adx': True, 'bear_use_spike': False, 'bear_rsi_required': True, 'sideways_strategy': 'breakout', 'sideways_bb_std_mult': 0.8308181909811884, 'sideways_rsi_os': 25, 'sideways_rsi_ob': 64, 'sideways_adx_thresh': 13.56830992627788, 'sideways_atr_min_pct': 0.015840269325709925, 'sideways_atr_max_pct': 0.034447601722203944, 'sideways_tp_mult': 2.032108228314931, 'sideways_tsl_mult': 0.8374500427309421, 'sideways_time_stop': 44, 'sideways_use_sma': True, 'sideways_use_ema': False, 'sideways_use_atr': True, 'sideways_use_adx': True, 'sideways_use_spike': True, 'sideways_rsi_required': False}.
