[I 2025-09-01 12:10:24,980] Trial 551 finished with values: [-1000000000.0, 1000000000.0] and parameters: {'p_sma': 26, 'p_std': 21, 'p_atr': 29, 'p_adx': 16, 'rsi_period': 49, 'ema1': 17, 'ema2': 14, 'slip_atr_k': 0.20589847580352838, 'slip_spread_k': 0.3884140776077821, 'spread_hl_frac': 0.0030181745714677813, 'bb_std_mult': 0.7626587076687956, 'rsi_os': 36, 'rsi_ob': 46, 'vol_spike': 0.1914668995219231, 'adx_thresh': 22.54021132892869, 'atr_min_pct': 0.003298584449193613, 'atr_max_pct': 0.09106280585871206, 'tp_mult': 1.438864303718605, 'tsl_mult': 0.4733640578086011, 'strategy': 'mean_reversion', 'time_stop': 295, 'use_sma': True, 'use_atr': True, 'use_adx': True, 'use_ema': False, 'use_spike': False, 'rsi_required': False, 'edge_k': 0.05856648328842173, 'edge_cap': 0.15188258026758705, 'bull_strategy': 'mean_reversion', 'bull_bb_std_mult': 3.19645399707791, 'bull_rsi_os': 50, 'bull_rsi_ob': 49, 'bull_adx_thresh': 6.285402550901267, 'bull_atr_min_pct': 0.015243032521847093, 'bull_atr_max_pct': 0.11617893840709077, 'bull_tp_mult': 1.4408146807500133, 'bull_tsl_mult': 0.5056274152023318, 'bull_time_stop': 184, 'bull_use_sma': False, 'bull_use_ema': False, 'bull_use_atr': False, 'bull_use_adx': False, 'bull_use_spike': False, 'bull_rsi_required': True, 'bear_strategy': 'mean_reversion', 'bear_bb_std_mult': 2.6404966567341592, 'bear_rsi_os': 27, 'bear_rsi_ob': 54, 'bear_adx_thresh': 11.352793438280656, 'bear_atr_min_pct': 0.0020433452784124496, 'bear_atr_max_pct': 0.029924113630664564, 'bear_tp_mult': 2.2186219510609706, 'bear_tsl_mult': 0.7344881980914457, 'bear_time_stop': 208, 'bear_use_sma': False, 'bear_use_ema': False, 'bear_use_atr': True, 'bear_use_adx': True, 'bear_use_spike': False, 'bear_rsi_required': True, 'sideways_strategy': 'breakout', 'sideways_bb_std_mult': 2.673774612198099, 'sideways_rsi_os': 39, 'sideways_rsi_ob': 84, 'sideways_adx_thresh': 34.42505235570208, 'sideways_atr_min_pct': 0.014214780086139942, 'sideways_atr_max_pct': 0.0669567610048418, 'sideways_tp_mult': 2.862143186179115, 'sideways_tsl_mult': 0.41053735070588643, 'sideways_time_stop': 52, 'sideways_use_sma': False, 'sideways_use_ema': False, 'sideways_use_atr': True, 'sideways_use_adx': True, 'sideways_use_spike': True, 'sideways_rsi_required': False}.
[I 2025-09-01 12:11:05,766] Trial 552 finished with values: [-1000000000.0, 1000000000.0] and parameters: {'p_sma': 29, 'p_std': 48, 'p_atr': 18, 'p_adx': 8, 'rsi_period': 49, 'ema1': 17, 'ema2': 14, 'slip_atr_k': 0.2053120400415485, 'slip_spread_k': 0.8650603573741765, 'spread_hl_frac': 0.0031022433762661916, 'bb_std_mult': 0.7523536175939071, 'rsi_os': 36, 'rsi_ob': 65, 'vol_spike': 0.2059862330640818, 'adx_thresh': 12.157832564787743, 'atr_min_pct': 0.02442294987703537, 'atr_max_pct': 0.09180733406848392, 'tp_mult': 1.2244769894593803, 'tsl_mult': 0.264144410611858, 'strategy': 'mean_reversion', 'time_stop': 46, 'use_sma': True, 'use_atr': True, 'use_adx': True, 'use_ema': False, 'use_spike': False, 'rsi_required': False, 'edge_k': 0.0599433891849329, 'edge_cap': 0.15965157440702996, 'bull_strategy': 'mean_reversion', 'bull_bb_std_mult': 1.0281026734767158, 'bull_rsi_os': 49, 'bull_rsi_ob': 47, 'bull_adx_thresh': 26.26137040404307, 'bull_atr_min_pct': 0.015104681063583612, 'bull_atr_max_pct': 0.04541555868464758, 'bull_tp_mult': 1.4535887479323786, 'bull_tsl_mult': 0.0023702099149540135, 'bull_time_stop': 185, 'bull_use_sma': False, 'bull_use_ema': False, 'bull_use_atr': False, 'bull_use_adx': False, 'bull_use_spike': False, 'bull_rsi_required': True, 'bear_strategy': 'mean_reversion', 'bear_bb_std_mult': 1.3909403596888767, 'bear_rsi_os': 25, 'bear_rsi_ob': 54, 'bear_adx_thresh': 11.290703982127857, 'bear_atr_min_pct': 0.002041686969149553, 'bear_atr_max_pct': 0.03154991199605889, 'bear_tp_mult': 1.6416134459920086, 'bear_tsl_mult': 0.7407344052072193, 'bear_time_stop': 268, 'bear_use_sma': False, 'bear_use_ema': False, 'bear_use_atr': True, 'bear_use_adx': True, 'bear_use_spike': False, 'bear_rsi_required': True, 'sideways_strategy': 'breakout', 'sideways_bb_std_mult': 2.8214802268209223, 'sideways_rsi_os': 39, 'sideways_rsi_ob': 72, 'sideways_adx_thresh': 34.38250046665346, 'sideways_atr_min_pct': 0.011863004547802827, 'sideways_atr_max_pct': 0.06530093824138378, 'sideways_tp_mult': 2.8715257258370332, 'sideways_tsl_mult': 0.19422948417840097, 'sideways_time_stop': 100, 'sideways_use_sma': False, 'sideways_use_ema': False, 'sideways_use_atr': True, 'sideways_use_adx': True, 'sideways_use_spike': True, 'sideways_rsi_required': False}.
[I 2025-09-01 12:11:06,328] Trial 549 finished with values: [-1000000000.0, 1000000000.0] and parameters: {'p_sma': 25, 'p_std': 33, 'p_atr': 18, 'p_adx': 8, 'rsi_period': 57, 'ema1': 24, 'ema2': 17, 'slip_atr_k': 0.03428409634349666, 'slip_spread_k': 0.860477517231411, 'spread_hl_frac': 0.010005181051690602, 'bb_std_mult': 0.7679021452991942, 'rsi_os': 31, 'rsi_ob': 52, 'vol_spike': 0.20866290528564907, 'adx_thresh': 21.876461228710667, 'atr_min_pct': 0.0243200446730505, 'atr_max_pct': 0.07623264597659923, 'tp_mult': 1.3052213837668418, 'tsl_mult': 0.4492855721947379, 'strategy': 'breakout', 'time_stop': 290, 'use_sma': False, 'use_atr': True, 'use_adx': True, 'use_ema': True, 'use_spike': False, 'rsi_required': False, 'edge_k': 0.17736324680080703, 'edge_cap': 0.15608430138907592, 'bull_strategy': 'mean_reversion', 'bull_bb_std_mult': 1.9913365508799714, 'bull_rsi_os': 50, 'bull_rsi_ob': 47, 'bull_adx_thresh': 8.798281914995489, 'bull_atr_min_pct': 0.02462341562850426, 'bull_atr_max_pct': 0.04448429767774752, 'bull_tp_mult': 1.3129911569554256, 'bull_tsl_mult': 0.5084043857419219, 'bull_time_stop': 165, 'bull_use_sma': False, 'bull_use_ema': False, 'bull_use_atr': True, 'bull_use_adx': False, 'bull_use_spike': False, 'bull_rsi_required': False, 'bear_strategy': 'breakout', 'bear_bb_std_mult': 3.1944333848693858, 'bear_rsi_os': 27, 'bear_rsi_ob': 54, 'bear_adx_thresh': 12.875122332229834, 'bear_atr_min_pct': 0.011113387040779046, 'bear_atr_max_pct': 0.025160743195522948, 'bear_tp_mult': 1.569817985834014, 'bear_tsl_mult': 0.7356108079872352, 'bear_time_stop': 289, 'bear_use_sma': True, 'bear_use_ema': False, 'bear_use_atr': True, 'bear_use_adx': True, 'bear_use_spike': False, 'bear_rsi_required': True, 'sideways_strategy': 'breakout', 'sideways_bb_std_mult': 2.0366425656812766, 'sideways_rsi_os': 41, 'sideways_rsi_ob': 85, 'sideways_adx_thresh': 34.511299056302136, 'sideways_atr_min_pct': 0.011911225327079538, 'sideways_atr_max_pct': 0.019010727907938056, 'sideways_tp_mult': 2.949224390686899, 'sideways_tsl_mult': 0.406932158828518, 'sideways_time_stop': 300, 'sideways_use_sma': False, 'sideways_use_ema': False, 'sideways_use_atr': True, 'sideways_use_adx': True, 'sideways_use_spike': True, 'sideways_rsi_required': False}.
[I 2025-09-01 12:11:06,718] Trial 553 finished with values: [-1000000000.0, 1000000000.0] and parameters: {'p_sma': 41, 'p_std': 19, 'p_atr': 18, 'p_adx': 8, 'rsi_period': 65, 'ema1': 25, 'ema2': 16, 'slip_atr_k': 0.027586031602781974, 'slip_spread_k': 0.8787682582981488, 'spread_hl_frac': 0.004278027492905194, 'bb_std_mult': 0.7852191459515407, 'rsi_os': 35, 'rsi_ob': 78, 'vol_spike': 0.182576753523066, 'adx_thresh': 9.566728236761215, 'atr_min_pct': 0.021869938544080994, 'atr_max_pct': 0.13383596362220318, 'tp_mult': 2.4274886071410218, 'tsl_mult': 0.646309067727548, 'strategy': 'mean_reversion', 'time_stop': 69, 'use_sma': True, 'use_atr': True, 'use_adx': True, 'use_ema': False, 'use_spike': False, 'rsi_required': False, 'edge_k': 0.09838766438844791, 'edge_cap': 0.17388584993408937, 'bull_strategy': 'mean_reversion', 'bull_bb_std_mult': 1.6170461587947318, 'bull_rsi_os': 22, 'bull_rsi_ob': 47, 'bull_adx_thresh': 24.0053497040892, 'bull_atr_min_pct': 0.01653674355644904, 'bull_atr_max_pct': 0.05651114039182538, 'bull_tp_mult': 1.7137917869780814, 'bull_tsl_mult': 0.9988286224442282, 'bull_time_stop': 177, 'bull_use_sma': False, 'bull_use_ema': False, 'bull_use_atr': False, 'bull_use_adx': False, 'bull_use_spike': False, 'bull_rsi_required': True, 'bear_strategy': 'mean_reversion', 'bear_bb_std_mult': 1.419783147899607, 'bear_rsi_os': 44, 'bear_rsi_ob': 66, 'bear_adx_thresh': 12.691785901806217, 'bear_atr_min_pct': 0.013795560930790597, 'bear_atr_max_pct': 0.025921096800205812, 'bear_tp_mult': 1.702490581718184, 'bear_tsl_mult': 0.6836574411232749, 'bear_time_stop': 285, 'bear_use_sma': False, 'bear_use_ema': False, 'bear_use_atr': True, 'bear_use_adx': True, 'bear_use_spike': False, 'bear_rsi_required': True, 'sideways_strategy': 'breakout', 'sideways_bb_std_mult': 2.7961538753582236, 'sideways_rsi_os': 41, 'sideways_rsi_ob': 72, 'sideways_adx_thresh': 22.26743708936828, 'sideways_atr_min_pct': 0.01522469804015374, 'sideways_atr_max_pct': 0.12127661117670761, 'sideways_tp_mult': 2.8414641399281892, 'sideways_tsl_mult': 0.18434840993111123, 'sideways_time_stop': 80, 'sideways_use_sma': False, 'sideways_use_ema': False, 'sideways_use_atr': True, 'sideways_use_adx': True, 'sideways_use_spike': True, 'sideways_rsi_required': False}.
[I 2025-09-01 12:11:07,195] Trial 550 finished with values: [-1000000000.0, 1000000000.0] and parameters: {'p_sma': 48, 'p_std': 34, 'p_atr': 19, 'p_adx': 8, 'rsi_period': 49, 'ema1': 24, 'ema2': 28, 'slip_atr_k': 0.03292894888574596, 'slip_spread_k': 0.38428436921561626, 'spread_hl_frac': 0.004345790227442032, 'bb_std_mult': 0.7495067305077839, 'rsi_os': 11, 'rsi_ob': 47, 'vol_spike': 0.20860150612411882, 'adx_thresh': 22.804486453577393, 'atr_min_pct': 0.011777641375037213, 'atr_max_pct': 0.0911399036164559, 'tp_mult': 1.4418181196127504, 'tsl_mult': 0.12707920037864906, 'strategy': 'breakout', 'time_stop': 291, 'use_sma': False, 'use_atr': True, 'use_adx': True, 'use_ema': True, 'use_spike': False, 'rsi_required': False, 'edge_k': 0.18062203118631923, 'edge_cap': 0.15929715133670944, 'bull_strategy': 'mean_reversion', 'bull_bb_std_mult': 2.0169950127967717, 'bull_rsi_os': 49, 'bull_rsi_ob': 54, 'bull_adx_thresh': 26.48005252751312, 'bull_atr_min_pct': 0.01644196648771054, 'bull_atr_max_pct': 0.11517894270733883, 'bull_tp_mult': 1.291972308960468, 'bull_tsl_mult': 0.569528297879164, 'bull_time_stop': 185, 'bull_use_sma': False, 'bull_use_ema': False, 'bull_use_atr': True, 'bull_use_adx': False, 'bull_use_spike': False, 'bull_rsi_required': True, 'bear_strategy': 'mean_reversion', 'bear_bb_std_mult': 1.4130946344242268, 'bear_rsi_os': 27, 'bear_rsi_ob': 51, 'bear_adx_thresh': 9.025256417458461, 'bear_atr_min_pct': 0.02290445929825993, 'bear_atr_max_pct': 0.01716842841496159, 'bear_tp_mult': 1.4785007206706602, 'bear_tsl_mult': 0.7356578381328807, 'bear_time_stop': 284, 'bear_use_sma': True, 'bear_use_ema': False, 'bear_use_atr': True, 'bear_use_adx': True, 'bear_use_spike': False, 'bear_rsi_required': True, 'sideways_strategy': 'breakout', 'sideways_bb_std_mult': 0.6563094934070999, 'sideways_rsi_os': 39, 'sideways_rsi_ob': 84, 'sideways_adx_thresh': 34.233179295232226, 'sideways_atr_min_pct': 0.005704840471482922, 'sideways_atr_max_pct': 0.01923873505567216, 'sideways_tp_mult': 2.55015272407906, 'sideways_tsl_mult': 0.4006056806996703, 'sideways_time_stop': 90, 'sideways_use_sma': False, 'sideways_use_ema': False, 'sideways_use_atr': True, 'sideways_use_adx': True, 'sideways_use_spike': True, 'sideways_rsi_required': False}.
[I 2025-09-01 12:11:08,531] Trial 554 finished with values: [-1000000000.0, 1000000000.0] and parameters: {'p_sma': 33, 'p_std': 33, 'p_atr': 19, 'p_adx': 23, 'rsi_period': 82, 'ema1': 24, 'ema2': 29, 'slip_atr_k': 0.027703955665591706, 'slip_spread_k': 0.34729206745338903, 'spread_hl_frac': 0.004114309191429624, 'bb_std_mult': 0.8136938112946924, 'rsi_os': 52, 'rsi_ob': 56, 'vol_spike': 0.18588620134957412, 'adx_thresh': 29.01878493044168, 'atr_min_pct': 0.00731435863619369, 'atr_max_pct': 0.12102135658390173, 'tp_mult': 1.022057073068926, 'tsl_mult': 0.13068161242512036, 'strategy': 'mean_reversion', 'time_stop': 185, 'use_sma': True, 'use_atr': True, 'use_adx': True, 'use_ema': False, 'use_spike': False, 'rsi_required': False, 'edge_k': 1.5661935301241083, 'edge_cap': 0.9501847227231082, 'bull_strategy': 'mean_reversion', 'bull_bb_std_mult': 2.0172283321250664, 'bull_rsi_os': 50, 'bull_rsi_ob': 63, 'bull_adx_thresh': 23.819143859825395, 'bull_atr_min_pct': 0.007315510402136098, 'bull_atr_max_pct': 0.07936005762796675, 'bull_tp_mult': 1.3540509361595574, 'bull_tsl_mult': 0.56811243072499, 'bull_time_stop': 177, 'bull_use_sma': False, 'bull_use_ema': False, 'bull_use_atr': False, 'bull_use_adx': False, 'bull_use_spike': False, 'bull_rsi_required': True, 'bear_strategy': 'mean_reversion', 'bear_bb_std_mult': 3.1998875675538963, 'bear_rsi_os': 43, 'bear_rsi_ob': 52, 'bear_adx_thresh': 12.533038384068643, 'bear_atr_min_pct': 0.013392332157662326, 'bear_atr_max_pct': 0.026911365768731023, 'bear_tp_mult': 1.5139162592696491, 'bear_tsl_mult': 0.6803254359103902, 'bear_time_stop': 165, 'bear_use_sma': False, 'bear_use_ema': False, 'bear_use_atr': True, 'bear_use_adx': True, 'bear_use_spike': False, 'bear_rsi_required': True, 'sideways_strategy': 'breakout', 'sideways_bb_std_mult': 2.61025622115374, 'sideways_rsi_os': 41, 'sideways_rsi_ob': 53, 'sideways_adx_thresh': 22.456507193881666, 'sideways_atr_min_pct': 0.005975634841334123, 'sideways_atr_max_pct': 0.03884767776027141, 'sideways_tp_mult': 2.860917318590776, 'sideways_tsl_mult': 0.3946414968782309, 'sideways_time_stop': 170, 'sideways_use_sma': False, 'sideways_use_ema': False, 'sideways_use_atr': True, 'sideways_use_adx': True, 'sideways_use_spike': True, 'sideways_rsi_required': False}.
[I 2025-09-01 12:11:49,629] Trial 556 finished with values: [-1000000000.0, 1000000000.0] and parameters: {'p_sma': 32, 'p_std': 32, 'p_atr': 19, 'p_adx': 28, 'rsi_period': 79, 'ema1': 7, 'ema2': 28, 'slip_atr_k': 0.2188905914551221, 'slip_spread_k': 0.34929827291528326, 'spread_hl_frac': 0.004042062217339087, 'bb_std_mult': 2.643794695715452, 'rsi_os': 34, 'rsi_ob': 56, 'vol_spike': 0.0635947685738674, 'adx_thresh': 11.308774887704592, 'atr_min_pct': 0.006302721268322018, 'atr_max_pct': 0.14939990476044956, 'tp_mult': 1.7055919366553765, 'tsl_mult': 0.13215030009785458, 'strategy': 'breakout', 'time_stop': 99, 'use_sma': True, 'use_atr': True, 'use_adx': True, 'use_ema': True, 'use_spike': False, 'rsi_required': False, 'edge_k': 0.12357020431572899, 'edge_cap': 0.7975635224122857, 'bull_strategy': 'mean_reversion', 'bull_bb_std_mult': 1.9090458000203976, 'bull_rsi_os': 53, 'bull_rsi_ob': 69, 'bull_adx_thresh': 6.3815205813888465, 'bull_atr_min_pct': 0.006975251585796838, 'bull_atr_max_pct': 0.11068916111485735, 'bull_tp_mult': 1.3610049450829993, 'bull_tsl_mult': 0.5646722546367433, 'bull_time_stop': 156, 'bull_use_sma': False, 'bull_use_ema': False, 'bull_use_atr': False, 'bull_use_adx': False, 'bull_use_spike': False, 'bull_rsi_required': True, 'bear_strategy': 'mean_reversion', 'bear_bb_std_mult': 3.0979239549742554, 'bear_rsi_os': 54, 'bear_rsi_ob': 52, 'bear_adx_thresh': 18.544486264224147, 'bear_atr_min_pct': 0.021420245671844366, 'bear_atr_max_pct': 0.14892992909529038, 'bear_tp_mult': 1.528172620248824, 'bear_tsl_mult': 0.010279646075982363, 'bear_time_stop': 277, 'bear_use_sma': False, 'bear_use_ema': False, 'bear_use_atr': True, 'bear_use_adx': True, 'bear_use_spike': False, 'bear_rsi_required': True, 'sideways_strategy': 'breakout', 'sideways_bb_std_mult': 2.5735247581313265, 'sideways_rsi_os': 15, 'sideways_rsi_ob': 87, 'sideways_adx_thresh': 33.57861979266477, 'sideways_atr_min_pct': 0.006033880300819944, 'sideways_atr_max_pct': 0.040274568451151536, 'sideways_tp_mult': 2.830693821512791, 'sideways_tsl_mult': 0.38463475453361184, 'sideways_time_stop': 91, 'sideways_use_sma': False, 'sideways_use_ema': False, 'sideways_use_atr': True, 'sideways_use_adx': True, 'sideways_use_spike': True, 'sideways_rsi_required': False}.
[I 2025-09-01 12:11:50,142] Trial 555 finished with values: [-1000000000.0, 1000000000.0] and parameters: {'p_sma': 19, 'p_std': 31, 'p_atr': 19, 'p_adx': 9, 'rsi_period': 48, 'ema1': 25, 'ema2': 12, 'slip_atr_k': 0.10325422761561617, 'slip_spread_k': 0.34986580921042854, 'spread_hl_frac': 0.004380024134268858, 'bb_std_mult': 0.8476177829017931, 'rsi_os': 35, 'rsi_ob': 56, 'vol_spike': 0.18267430388316766, 'adx_thresh': 23.026217400455764, 'atr_min_pct': 0.017453736052057828, 'atr_max_pct': 0.08313449190507467, 'tp_mult': 2.123625514928778, 'tsl_mult': 0.13042903859539073, 'strategy': 'mean_reversion', 'time_stop': 116, 'use_sma': True, 'use_atr': True, 'use_adx': True, 'use_ema': False, 'use_spike': False, 'rsi_required': False, 'edge_k': 0.11077472974579322, 'edge_cap': 0.8011953243023977, 'bull_strategy': 'mean_reversion', 'bull_bb_std_mult': 1.6275408573089722, 'bull_rsi_os': 29, 'bull_rsi_ob': 67, 'bull_adx_thresh': 15.769176553543158, 'bull_atr_min_pct': 0.011859527749944448, 'bull_atr_max_pct': 0.054878040566858625, 'bull_tp_mult': 1.3565568379607185, 'bull_tsl_mult': 0.5472641087103334, 'bull_time_stop': 155, 'bull_use_sma': False, 'bull_use_ema': False, 'bull_use_atr': False, 'bull_use_adx': False, 'bull_use_spike': False, 'bull_rsi_required': True, 'bear_strategy': 'mean_reversion', 'bear_bb_std_mult': 2.162135373113039, 'bear_rsi_os': 26, 'bear_rsi_ob': 52, 'bear_adx_thresh': 9.179088913011066, 'bear_atr_min_pct': 0.012781612477642597, 'bear_atr_max_pct': 0.0692009551099548, 'bear_tp_mult': 1.4913334207973008, 'bear_tsl_mult': 0.6889995012882161, 'bear_time_stop': 187, 'bear_use_sma': False, 'bear_use_ema': False, 'bear_use_atr': True, 'bear_use_adx': True, 'bear_use_spike': False, 'bear_rsi_required': True, 'sideways_strategy': 'breakout', 'sideways_bb_std_mult': 2.620756137723772, 'sideways_rsi_os': 41, 'sideways_rsi_ob': 76, 'sideways_adx_thresh': 33.61349278832334, 'sideways_atr_min_pct': 0.005425887004323807, 'sideways_atr_max_pct': 0.037923944661465286, 'sideways_tp_mult': 2.836093931003742, 'sideways_tsl_mult': 0.39146993420697923, 'sideways_time_stop': 79, 'sideways_use_sma': False, 'sideways_use_ema': False, 'sideways_use_atr': True, 'sideways_use_adx': True, 'sideways_use_spike': True, 'sideways_rsi_required': False}.
[I 2025-09-01 12:11:50,698] Trial 557 finished with values: [-1000000000.0, 1000000000.0] and parameters: {'p_sma': 28, 'p_std': 32, 'p_atr': 19, 'p_adx': 28, 'rsi_period': 78, 'ema1': 27, 'ema2': 53, 'slip_atr_k': 0.017356225431692095, 'slip_spread_k': 0.34585439946718555, 'spread_hl_frac': 0.0018348099758882736, 'bb_std_mult': 2.6787882353712655, 'rsi_os': 43, 'rsi_ob': 56, 'vol_spike': 0.03192142979817819, 'adx_thresh': 17.868985673576752, 'atr_min_pct': 0.008724101591981583, 'atr_max_pct': 0.08065513322085538, 'tp_mult': 1.7009617985637484, 'tsl_mult': 0.3324538395620249, 'strategy': 'mean_reversion', 'time_stop': 97, 'use_sma': True, 'use_atr': True, 'use_adx': True, 'use_ema': False, 'use_spike': False, 'rsi_required': False, 'edge_k': 0.12592641564389548, 'edge_cap': 0.6160794557769737, 'bull_strategy': 'mean_reversion', 'bull_bb_std_mult': 1.8931638068983985, 'bull_rsi_os': 53, 'bull_rsi_ob': 69, 'bull_adx_thresh': 7.236427816669185, 'bull_atr_min_pct': 0.007128922729273181, 'bull_atr_max_pct': 0.02122432158566473, 'bull_tp_mult': 1.3534343932972526, 'bull_tsl_mult': 0.3794159856342101, 'bull_time_stop': 122, 'bull_use_sma': False, 'bull_use_ema': False, 'bull_use_atr': False, 'bull_use_adx': False, 'bull_use_spike': False, 'bull_rsi_required': False, 'bear_strategy': 'breakout', 'bear_bb_std_mult': 1.6818927943474395, 'bear_rsi_os': 26, 'bear_rsi_ob': 58, 'bear_adx_thresh': 9.847490346814688, 'bear_atr_min_pct': 0.002719402345965091, 'bear_atr_max_pct': 0.14965454193307504, 'bear_tp_mult': 1.4846297141694116, 'bear_tsl_mult': 0.6767710044503327, 'bear_time_stop': 232, 'bear_use_sma': False, 'bear_use_ema': False, 'bear_use_atr': True, 'bear_use_adx': True, 'bear_use_spike': False, 'bear_rsi_required': True, 'sideways_strategy': 'breakout', 'sideways_bb_std_mult': 2.568204349916578, 'sideways_rsi_os': 42, 'sideways_rsi_ob': 61, 'sideways_adx_thresh': 33.61854010886146, 'sideways_atr_min_pct': 0.008347082468012886, 'sideways_atr_max_pct': 0.014223042621712922, 'sideways_tp_mult': 2.8305539977665, 'sideways_tsl_mult': 0.38823969249747076, 'sideways_time_stop': 168, 'sideways_use_sma': False, 'sideways_use_ema': False, 'sideways_use_atr': True, 'sideways_use_adx': True, 'sideways_use_spike': True, 'sideways_rsi_required': False}.
