[I 2025-09-01 11:58:11,889] Trial 479 finished with values: [-1000000000.0, 1000000000.0] and parameters: {'p_sma': 26, 'p_std': 32, 'p_atr': 23, 'p_adx': 7, 'rsi_period': 41, 'ema1': 25, 'ema2': 14, 'slip_atr_k': 0.025491906616847994, 'slip_spread_k': 0.34826554984796054, 'spread_hl_frac': 0.003965412829721554, 'bb_std_mult': 0.8767992646607136, 'rsi_os': 33, 'rsi_ob': 48, 'vol_spike': 0.2391163094770181, 'adx_thresh': 29.550609506545108, 'atr_min_pct': 0.02210107913961804, 'atr_max_pct': 0.08161360716812135, 'tp_mult': 2.1800799230224923, 'tsl_mult': 0.12003721707306987, 'strategy': 'breakout', 'time_stop': 176, 'use_sma': False, 'use_atr': True, 'use_adx': True, 'use_ema': True, 'use_spike': False, 'rsi_required': False, 'edge_k': 0.13774416426522687, 'edge_cap': 0.11296148252882035, 'bull_strategy': 'mean_reversion', 'bull_bb_std_mult': 1.8124073135183443, 'bull_rsi_os': 50, 'bull_rsi_ob': 49, 'bull_adx_thresh': 8.04162814309911, 'bull_atr_min_pct': 0.016069312599356483, 'bull_atr_max_pct': 0.1200844864966657, 'bull_tp_mult': 1.3010045496250553, 'bull_tsl_mult': 0.572349184214818, 'bull_time_stop': 157, 'bull_use_sma': False, 'bull_use_ema': False, 'bull_use_atr': False, 'bull_use_adx': False, 'bull_use_spike': False, 'bull_rsi_required': True, 'bear_strategy': 'mean_reversion', 'bear_bb_std_mult': 1.558942885093552, 'bear_rsi_os': 28, 'bear_rsi_ob': 52, 'bear_adx_thresh': 24.16959878380748, 'bear_atr_min_pct': 0.024418575172705764, 'bear_atr_max_pct': 0.04402231110738426, 'bear_tp_mult': 1.5395975312535082, 'bear_tsl_mult': 0.6961747316264867, 'bear_time_stop': 268, 'bear_use_sma': True, 'bear_use_ema': False, 'bear_use_atr': True, 'bear_use_adx': True, 'bear_use_spike': False, 'bear_rsi_required': True, 'sideways_strategy': 'breakout', 'sideways_bb_std_mult': 2.366526960533189, 'sideways_rsi_os': 40, 'sideways_rsi_ob': 88, 'sideways_adx_thresh': 33.55489178271187, 'sideways_atr_min_pct': 0.0038178729037117573, 'sideways_atr_max_pct': 0.12529329886760565, 'sideways_tp_mult': 2.9369335843562845, 'sideways_tsl_mult': 0.36980483171565115, 'sideways_time_stop': 101, 'sideways_use_sma': False, 'sideways_use_ema': False, 'sideways_use_atr': True, 'sideways_use_adx': True, 'sideways_use_spike': True, 'sideways_rsi_required': False}.
[I 2025-09-01 11:58:11,918] Trial 476 finished with values: [-1000000000.0, 1000000000.0] and parameters: {'p_sma': 26, 'p_std': 31, 'p_atr': 19, 'p_adx': 8, 'rsi_period': 46, 'ema1': 26, 'ema2': 14, 'slip_atr_k': 0.02819669708783404, 'slip_spread_k': 0.3447683942527051, 'spread_hl_frac': 0.004650018409069659, 'bb_std_mult': 0.7754098394469697, 'rsi_os': 34, 'rsi_ob': 48, 'vol_spike': 0.22231645688912194, 'adx_thresh': 8.337503593658935, 'atr_min_pct': 0.022095140778565923, 'atr_max_pct': 0.08529743022963142, 'tp_mult': 1.4985298743499618, 'tsl_mult': 0.1530725079157417, 'strategy': 'breakout', 'time_stop': 174, 'use_sma': False, 'use_atr': True, 'use_adx': True, 'use_ema': False, 'use_spike': False, 'rsi_required': False, 'edge_k': 0.08648340939567242, 'edge_cap': 0.13764364126965992, 'bull_strategy': 'mean_reversion', 'bull_bb_std_mult': 1.9494457286923839, 'bull_rsi_os': 51, 'bull_rsi_ob': 48, 'bull_adx_thresh': 8.173033703603489, 'bull_atr_min_pct': 0.0159458877307619, 'bull_atr_max_pct': 0.11949794241463305, 'bull_tp_mult': 1.2567747170591599, 'bull_tsl_mult': 0.5748095454888009, 'bull_time_stop': 168, 'bull_use_sma': False, 'bull_use_ema': False, 'bull_use_atr': False, 'bull_use_adx': False, 'bull_use_spike': False, 'bull_rsi_required': True, 'bear_strategy': 'mean_reversion', 'bear_bb_std_mult': 1.5283643443523385, 'bear_rsi_os': 28, 'bear_rsi_ob': 53, 'bear_adx_thresh': 9.953182919764975, 'bear_atr_min_pct': 0.0016203852646638952, 'bear_atr_max_pct': 0.026167468682691895, 'bear_tp_mult': 1.5554244953786422, 'bear_tsl_mult': 0.7021762532565599, 'bear_time_stop': 281, 'bear_use_sma': True, 'bear_use_ema': False, 'bear_use_atr': True, 'bear_use_adx': True, 'bear_use_spike': False, 'bear_rsi_required': True, 'sideways_strategy': 'breakout', 'sideways_bb_std_mult': 2.3620846477228525, 'sideways_rsi_os': 40, 'sideways_rsi_ob': 88, 'sideways_adx_thresh': 33.54899495303015, 'sideways_atr_min_pct': 0.00745400067530228, 'sideways_atr_max_pct': 0.12163378978122918, 'sideways_tp_mult': 2.92162532817102, 'sideways_tsl_mult': 0.6368413916205957, 'sideways_time_stop': 99, 'sideways_use_sma': False, 'sideways_use_ema': False, 'sideways_use_atr': True, 'sideways_use_adx': True, 'sideways_use_spike': True, 'sideways_rsi_required': False}.
[I 2025-09-01 11:58:12,187] Trial 478 finished with values: [-1000000000.0, 1000000000.0] and parameters: {'p_sma': 27, 'p_std': 32, 'p_atr': 23, 'p_adx': 16, 'rsi_period': 42, 'ema1': 25, 'ema2': 15, 'slip_atr_k': 0.028601471354448606, 'slip_spread_k': 0.31330538804086444, 'spread_hl_frac': 0.0040099152692901685, 'bb_std_mult': 0.8923890972908768, 'rsi_os': 34, 'rsi_ob': 47, 'vol_spike': 0.17561952862856117, 'adx_thresh': 8.279178948023295, 'atr_min_pct': 0.022133453898211367, 'atr_max_pct': 0.08086295103424515, 'tp_mult': 2.181777842282888, 'tsl_mult': 0.1618844495501585, 'strategy': 'breakout', 'time_stop': 166, 'use_sma': False, 'use_atr': True, 'use_adx': True, 'use_ema': True, 'use_spike': False, 'rsi_required': False, 'edge_k': 0.1421853602733602, 'edge_cap': 0.11034583723296358, 'bull_strategy': 'mean_reversion', 'bull_bb_std_mult': 1.8085137557142263, 'bull_rsi_os': 50, 'bull_rsi_ob': 49, 'bull_adx_thresh': 7.84574822780041, 'bull_atr_min_pct': 0.015709598929498744, 'bull_atr_max_pct': 0.12054187304216134, 'bull_tp_mult': 1.3176288689501872, 'bull_tsl_mult': 0.5735691818017693, 'bull_time_stop': 159, 'bull_use_sma': False, 'bull_use_ema': False, 'bull_use_atr': False, 'bull_use_adx': False, 'bull_use_spike': False, 'bull_rsi_required': True, 'bear_strategy': 'mean_reversion', 'bear_bb_std_mult': 1.5977204787308374, 'bear_rsi_os': 28, 'bear_rsi_ob': 52, 'bear_adx_thresh': 24.110394223577476, 'bear_atr_min_pct': 0.02440674459810857, 'bear_atr_max_pct': 0.040279578963478675, 'bear_tp_mult': 1.549504821732624, 'bear_tsl_mult': 0.6940513643014381, 'bear_time_stop': 269, 'bear_use_sma': True, 'bear_use_ema': False, 'bear_use_atr': True, 'bear_use_adx': True, 'bear_use_spike': False, 'bear_rsi_required': True, 'sideways_strategy': 'breakout', 'sideways_bb_std_mult': 2.3755487355429343, 'sideways_rsi_os': 40, 'sideways_rsi_ob': 88, 'sideways_adx_thresh': 33.7394540196994, 'sideways_atr_min_pct': 0.0038579134056780625, 'sideways_atr_max_pct': 0.12593954061730686, 'sideways_tp_mult': 2.9191107501708635, 'sideways_tsl_mult': 0.37058004930266003, 'sideways_time_stop': 98, 'sideways_use_sma': False, 'sideways_use_ema': False, 'sideways_use_atr': True, 'sideways_use_adx': True, 'sideways_use_spike': True, 'sideways_rsi_required': False}.
[I 2025-09-01 11:58:52,856] Trial 481 finished with values: [-0.007248182232978406, 0.008284438891116179] and parameters: {'p_sma': 24, 'p_std': 33, 'p_atr': 25, 'p_adx': 23, 'rsi_period': 43, 'ema1': 25, 'ema2': 15, 'slip_atr_k': 0.028482111425045968, 'slip_spread_k': 0.37654524195814587, 'spread_hl_frac': 0.0043538569508632975, 'bb_std_mult': 0.8889235145738148, 'rsi_os': 33, 'rsi_ob': 47, 'vol_spike': 0.18648226381355837, 'adx_thresh': 17.546375012439675, 'atr_min_pct': 0.023422332831807353, 'atr_max_pct': 0.08126486478166135, 'tp_mult': 2.1366622538642974, 'tsl_mult': 0.1293728802572817, 'strategy': 'breakout', 'time_stop': 164, 'use_sma': False, 'use_atr': True, 'use_adx': True, 'use_ema': True, 'use_spike': False, 'rsi_required': False, 'edge_k': 0.03237482261217256, 'edge_cap': 0.13874210188168765, 'bull_strategy': 'mean_reversion', 'bull_bb_std_mult': 1.789865870211463, 'bull_rsi_os': 50, 'bull_rsi_ob': 46, 'bull_adx_thresh': 7.238986423122062, 'bull_atr_min_pct': 0.01600492202613622, 'bull_atr_max_pct': 0.11257670505374803, 'bull_tp_mult': 1.4286922567001663, 'bull_tsl_mult': 0.5395437095189495, 'bull_time_stop': 151, 'bull_use_sma': False, 'bull_use_ema': False, 'bull_use_atr': True, 'bull_use_adx': False, 'bull_use_spike': False, 'bull_rsi_required': False, 'bear_strategy': 'breakout', 'bear_bb_std_mult': 1.3639479466707205, 'bear_rsi_os': 26, 'bear_rsi_ob': 52, 'bear_adx_thresh': 10.702566627795523, 'bear_atr_min_pct': 0.0031914918238550583, 'bear_atr_max_pct': 0.0220256704462544, 'bear_tp_mult': 1.5003700338310548, 'bear_tsl_mult': 0.7355358475056372, 'bear_time_stop': 276, 'bear_use_sma': True, 'bear_use_ema': False, 'bear_use_atr': True, 'bear_use_adx': True, 'bear_use_spike': False, 'bear_rsi_required': True, 'sideways_strategy': 'breakout', 'sideways_bb_std_mult': 2.205769773295895, 'sideways_rsi_os': 47, 'sideways_rsi_ob': 69, 'sideways_adx_thresh': 34.006908898951146, 'sideways_atr_min_pct': 0.004740930099677564, 'sideways_atr_max_pct': 0.12604145703982922, 'sideways_tp_mult': 2.9419342063747185, 'sideways_tsl_mult': 0.3730587666546218, 'sideways_time_stop': 94, 'sideways_use_sma': False, 'sideways_use_ema': False, 'sideways_use_atr': True, 'sideways_use_adx': True, 'sideways_use_spike': True, 'sideways_rsi_required': False}.
[I 2025-09-01 11:58:53,322] Trial 482 finished with values: [-0.008367103983124458, 0.00913008688250767] and parameters: {'p_sma': 24, 'p_std': 33, 'p_atr': 25, 'p_adx': 23, 'rsi_period': 43, 'ema1': 25, 'ema2': 15, 'slip_atr_k': 0.02752380040411361, 'slip_spread_k': 0.5318829252342268, 'spread_hl_frac': 0.0037027386486871566, 'bb_std_mult': 0.8827780199935079, 'rsi_os': 33, 'rsi_ob': 47, 'vol_spike': 0.16798526489543608, 'adx_thresh': 27.805613675902904, 'atr_min_pct': 0.023063663995213, 'atr_max_pct': 0.0797712218717283, 'tp_mult': 2.1342923878344178, 'tsl_mult': 0.1248820278876822, 'strategy': 'breakout', 'time_stop': 167, 'use_sma': False, 'use_atr': True, 'use_adx': True, 'use_ema': True, 'use_spike': False, 'rsi_required': False, 'edge_k': 0.03214537408272092, 'edge_cap': 0.14389444914495292, 'bull_strategy': 'mean_reversion', 'bull_bb_std_mult': 1.7967411588831634, 'bull_rsi_os': 50, 'bull_rsi_ob': 46, 'bull_adx_thresh': 7.174473295992449, 'bull_atr_min_pct': 0.016340809209885006, 'bull_atr_max_pct': 0.1144555530667878, 'bull_tp_mult': 1.3732383303293658, 'bull_tsl_mult': 0.5334820487398161, 'bull_time_stop': 148, 'bull_use_sma': False, 'bull_use_ema': False, 'bull_use_atr': True, 'bull_use_adx': False, 'bull_use_spike': False, 'bull_rsi_required': False, 'bear_strategy': 'breakout', 'bear_bb_std_mult': 1.3658444408859751, 'bear_rsi_os': 26, 'bear_rsi_ob': 52, 'bear_adx_thresh': 10.639069233436693, 'bear_atr_min_pct': 0.0031159138747177528, 'bear_atr_max_pct': 0.02247841197831335, 'bear_tp_mult': 1.4984706766502545, 'bear_tsl_mult': 0.7381738099166477, 'bear_time_stop': 274, 'bear_use_sma': True, 'bear_use_ema': False, 'bear_use_atr': True, 'bear_use_adx': True, 'bear_use_spike': False, 'bear_rsi_required': True, 'sideways_strategy': 'breakout', 'sideways_bb_std_mult': 2.1932684576702695, 'sideways_rsi_os': 47, 'sideways_rsi_ob': 69, 'sideways_adx_thresh': 34.00647893350065, 'sideways_atr_min_pct': 0.005193321369174238, 'sideways_atr_max_pct': 0.12738464601383584, 'sideways_tp_mult': 2.8749759228147527, 'sideways_tsl_mult': 0.3687102735007727, 'sideways_time_stop': 108, 'sideways_use_sma': False, 'sideways_use_ema': False, 'sideways_use_atr': True, 'sideways_use_adx': True, 'sideways_use_spike': True, 'sideways_rsi_required': False}.
[I 2025-09-01 11:58:53,756] Trial 480 finished with values: [-1000000000.0, 1000000000.0] and parameters: {'p_sma': 24, 'p_std': 32, 'p_atr': 19, 'p_adx': 8, 'rsi_period': 46, 'ema1': 25, 'ema2': 14, 'slip_atr_k': 0.02573778012703161, 'slip_spread_k': 0.34054811331426305, 'spread_hl_frac': 0.003983108433843037, 'bb_std_mult': 0.8849985904694248, 'rsi_os': 33, 'rsi_ob': 47, 'vol_spike': 0.18495408565964502, 'adx_thresh': 27.711037938658293, 'atr_min_pct': 0.02261703147701185, 'atr_max_pct': 0.08058060910560948, 'tp_mult': 2.1483790031756036, 'tsl_mult': 0.12266174064980023, 'strategy': 'breakout', 'time_stop': 166, 'use_sma': False, 'use_atr': True, 'use_adx': True, 'use_ema': True, 'use_spike': False, 'rsi_required': False, 'edge_k': 0.03967414345083142, 'edge_cap': 0.1446495813007872, 'bull_strategy': 'mean_reversion', 'bull_bb_std_mult': 1.785767356577901, 'bull_rsi_os': 50, 'bull_rsi_ob': 49, 'bull_adx_thresh': 8.66736684261108, 'bull_atr_min_pct': 0.01648225330362123, 'bull_atr_max_pct': 0.120852561721848, 'bull_tp_mult': 1.4447409420380297, 'bull_tsl_mult': 0.579795258911514, 'bull_time_stop': 156, 'bull_use_sma': False, 'bull_use_ema': False, 'bull_use_atr': True, 'bull_use_adx': False, 'bull_use_spike': False, 'bull_rsi_required': True, 'bear_strategy': 'mean_reversion', 'bear_bb_std_mult': 1.3668918449932281, 'bear_rsi_os': 28, 'bear_rsi_ob': 52, 'bear_adx_thresh': 28.447865917876143, 'bear_atr_min_pct': 0.017192504934163258, 'bear_atr_max_pct': 0.02203733243421691, 'bear_tp_mult': 1.0696385901242706, 'bear_tsl_mult': 0.748460213328075, 'bear_time_stop': 278, 'bear_use_sma': True, 'bear_use_ema': False, 'bear_use_atr': True, 'bear_use_adx': True, 'bear_use_spike': False, 'bear_rsi_required': True, 'sideways_strategy': 'breakout', 'sideways_bb_std_mult': 2.3237713236181885, 'sideways_rsi_os': 33, 'sideways_rsi_ob': 87, 'sideways_adx_thresh': 33.7323994630915, 'sideways_atr_min_pct': 0.0037899250765020434, 'sideways_atr_max_pct': 0.12524262800576538, 'sideways_tp_mult': 2.9614295485554005, 'sideways_tsl_mult': 0.3676379429939596, 'sideways_time_stop': 95, 'sideways_use_sma': False, 'sideways_use_ema': False, 'sideways_use_atr': True, 'sideways_use_adx': True, 'sideways_use_spike': True, 'sideways_rsi_required': False}.
[I 2025-09-01 11:58:53,950] Trial 483 finished with values: [-0.00604453330090271, 0.007259759954373597] and parameters: {'p_sma': 24, 'p_std': 33, 'p_atr': 25, 'p_adx': 8, 'rsi_period': 46, 'ema1': 25, 'ema2': 14, 'slip_atr_k': 0.05172597704843772, 'slip_spread_k': 0.3763275448475899, 'spread_hl_frac': 0.0035662351497116034, 'bb_std_mult': 0.8841538054373262, 'rsi_os': 33, 'rsi_ob': 49, 'vol_spike': 0.1887109407263107, 'adx_thresh': 27.599183731525947, 'atr_min_pct': 0.023539160655372388, 'atr_max_pct': 0.0817109773516877, 'tp_mult': 1.4173171124286041, 'tsl_mult': 0.12858835664411244, 'strategy': 'breakout', 'time_stop': 168, 'use_sma': False, 'use_atr': True, 'use_adx': True, 'use_ema': True, 'use_spike': False, 'rsi_required': False, 'edge_k': 0.1712911619362832, 'edge_cap': 0.1505106132621393, 'bull_strategy': 'mean_reversion', 'bull_bb_std_mult': 1.7682219369689498, 'bull_rsi_os': 36, 'bull_rsi_ob': 46, 'bull_adx_thresh': 6.957190576167829, 'bull_atr_min_pct': 0.01648895511680055, 'bull_atr_max_pct': 0.11277713200025756, 'bull_tp_mult': 1.4187255123240914, 'bull_tsl_mult': 0.5310106158819202, 'bull_time_stop': 148, 'bull_use_sma': False, 'bull_use_ema': False, 'bull_use_atr': True, 'bull_use_adx': False, 'bull_use_spike': False, 'bull_rsi_required': False, 'bear_strategy': 'breakout', 'bear_bb_std_mult': 1.3544140800075974, 'bear_rsi_os': 26, 'bear_rsi_ob': 52, 'bear_adx_thresh': 10.8634431458464, 'bear_atr_min_pct': 0.0033103238456126585, 'bear_atr_max_pct': 0.022536948938552324, 'bear_tp_mult': 1.4983048201953488, 'bear_tsl_mult': 0.7391814920070955, 'bear_time_stop': 276, 'bear_use_sma': True, 'bear_use_ema': False, 'bear_use_atr': True, 'bear_use_adx': True, 'bear_use_spike': False, 'bear_rsi_required': True, 'sideways_strategy': 'breakout', 'sideways_bb_std_mult': 2.445528885685425, 'sideways_rsi_os': 47, 'sideways_rsi_ob': 69, 'sideways_adx_thresh': 33.06690180003842, 'sideways_atr_min_pct': 0.0026770790241825927, 'sideways_atr_max_pct': 0.12794899904723042, 'sideways_tp_mult': 2.873858663532099, 'sideways_tsl_mult': 0.9747736155740843, 'sideways_time_stop': 94, 'sideways_use_sma': False, 'sideways_use_ema': False, 'sideways_use_atr': True, 'sideways_use_adx': True, 'sideways_use_spike': True, 'sideways_rsi_required': False}.
[I 2025-09-01 11:59:38,093] Trial 484 finished with values: [-0.011616581589660724, 0.012652401905259913] and parameters: {'p_sma': 24, 'p_std': 56, 'p_atr': 19, 'p_adx': 8, 'rsi_period': 12, 'ema1': 25, 'ema2': 12, 'slip_atr_k': 0.03498287153833531, 'slip_spread_k': 0.3856639072946411, 'spread_hl_frac': 0.006374717833588086, 'bb_std_mult': 0.7041515305397799, 'rsi_os': 36, 'rsi_ob': 49, 'vol_spike': 0.1672537844997335, 'adx_thresh': 22.49477451492052, 'atr_min_pct': 0.02285179905504295, 'atr_max_pct': 0.0796210217069284, 'tp_mult': 2.0732790202088234, 'tsl_mult': 0.12894465947014686, 'strategy': 'breakout', 'time_stop': 165, 'use_sma': False, 'use_atr': True, 'use_adx': True, 'use_ema': True, 'use_spike': False, 'rsi_required': False, 'edge_k': 0.1522305040971459, 'edge_cap': 0.14494886429035775, 'bull_strategy': 'mean_reversion', 'bull_bb_std_mult': 1.7370759723281095, 'bull_rsi_os': 5, 'bull_rsi_ob': 49, 'bull_adx_thresh': 6.759992332313035, 'bull_atr_min_pct': 0.016456331600931993, 'bull_atr_max_pct': 0.11480298409034696, 'bull_tp_mult': 1.3643547983213506, 'bull_tsl_mult': 0.5979631071040883, 'bull_time_stop': 173, 'bull_use_sma': False, 'bull_use_ema': False, 'bull_use_atr': True, 'bull_use_adx': False, 'bull_use_spike': False, 'bull_rsi_required': False, 'bear_strategy': 'breakout', 'bear_bb_std_mult': 1.3619644486540488, 'bear_rsi_os': 26, 'bear_rsi_ob': 52, 'bear_adx_thresh': 9.622199449204313, 'bear_atr_min_pct': 0.0035133125849557863, 'bear_atr_max_pct': 0.019742319297126373, 'bear_tp_mult': 1.0784649865897606, 'bear_tsl_mult': 0.6719754601522405, 'bear_time_stop': 278, 'bear_use_sma': True, 'bear_use_ema': False, 'bear_use_atr': True, 'bear_use_adx': True, 'bear_use_spike': False, 'bear_rsi_required': True, 'sideways_strategy': 'breakout', 'sideways_bb_std_mult': 2.5063602188631915, 'sideways_rsi_os': 5, 'sideways_rsi_ob': 87, 'sideways_adx_thresh': 33.00374012965059, 'sideways_atr_min_pct': 0.002931424303416667, 'sideways_atr_max_pct': 0.12914779965966358, 'sideways_tp_mult': 2.871257326454487, 'sideways_tsl_mult': 0.14986759149055623, 'sideways_time_stop': 106, 'sideways_use_sma': False, 'sideways_use_ema': False, 'sideways_use_atr': True, 'sideways_use_adx': True, 'sideways_use_spike': True, 'sideways_rsi_required': False}.
[I 2025-09-01 11:59:38,115] Trial 486 finished with values: [-1000000000.0, 1000000000.0] and parameters: {'p_sma': 27, 'p_std': 33, 'p_atr': 18, 'p_adx': 7, 'rsi_period': 69, 'ema1': 26, 'ema2': 28, 'slip_atr_k': 0.040394112329192405, 'slip_spread_k': 0.3863019051366937, 'spread_hl_frac': 0.006731556978205271, 'bb_std_mult': 0.8036332218755884, 'rsi_os': 36, 'rsi_ob': 45, 'vol_spike': 0.2353967513282297, 'adx_thresh': 22.402163793089695, 'atr_min_pct': 0.023623010785279522, 'atr_max_pct': 0.08437236493428721, 'tp_mult': 2.0739050026507817, 'tsl_mult': 0.09695608072532474, 'strategy': 'breakout', 'time_stop': 177, 'use_sma': False, 'use_atr': True, 'use_adx': True, 'use_ema': True, 'use_spike': False, 'rsi_required': False, 'edge_k': 0.15852569368208155, 'edge_cap': 0.11262275348591781, 'bull_strategy': 'mean_reversion', 'bull_bb_std_mult': 1.7380736889134796, 'bull_rsi_os': 40, 'bull_rsi_ob': 49, 'bull_adx_thresh': 9.337738793442153, 'bull_atr_min_pct': 0.01533556562815811, 'bull_atr_max_pct': 0.11069698019362915, 'bull_tp_mult': 1.269115926729208, 'bull_tsl_mult': 0.5542928031873612, 'bull_time_stop': 168, 'bull_use_sma': False, 'bull_use_ema': False, 'bull_use_atr': True, 'bull_use_adx': False, 'bull_use_spike': False, 'bull_rsi_required': False, 'bear_strategy': 'breakout', 'bear_bb_std_mult': 1.4497356396221375, 'bear_rsi_os': 29, 'bear_rsi_ob': 54, 'bear_adx_thresh': 29.694315549734025, 'bear_atr_min_pct': 0.013386134641211104, 'bear_atr_max_pct': 0.028839246303318272, 'bear_tp_mult': 1.6297612344140233, 'bear_tsl_mult': 0.6883495837080655, 'bear_time_stop': 256, 'bear_use_sma': True, 'bear_use_ema': False, 'bear_use_atr': True, 'bear_use_adx': True, 'bear_use_spike': False, 'bear_rsi_required': True, 'sideways_strategy': 'breakout', 'sideways_bb_std_mult': 2.163092303115727, 'sideways_rsi_os': 28, 'sideways_rsi_ob': 89, 'sideways_adx_thresh': 32.81195838177609, 'sideways_atr_min_pct': 0.008730251122081981, 'sideways_atr_max_pct': 0.12918977254115765, 'sideways_tp_mult': 2.8342572086316364, 'sideways_tsl_mult': 0.3430896339357659, 'sideways_time_stop': 103, 'sideways_use_sma': False, 'sideways_use_ema': False, 'sideways_use_atr': True, 'sideways_use_adx': True, 'sideways_use_spike': True, 'sideways_rsi_required': False}.
