[I 2025-09-01 10:44:51,443] Trial 12 finished with values: [-1000000000.0, 1000000000.0] and parameters: {'p_sma': 27, 'p_std': 35, 'p_atr': 14, 'p_adx': 24, 'rsi_period': 15, 'ema1': 19, 'ema2': 50, 'slip_atr_k': 0.23348087176917778, 'slip_spread_k': 0.040350893822363565, 'spread_hl_frac': 0.013751331979486898, 'bb_std_mult': 0.884804602956281, 'rsi_os': 51, 'rsi_ob': 48, 'vol_spike': 0.013035264171286809, 'adx_thresh': 34.79561982153221, 'atr_min_pct': 0.005964955006408407, 'atr_max_pct': 0.12566213805495158, 'tp_mult': 1.5932914358250634, 'tsl_mult': 0.5162073746753822, 'strategy': 'mean_reversion', 'time_stop': 218, 'use_sma': False, 'use_atr': True, 'use_adx': True, 'use_ema': False, 'use_spike': False, 'rsi_required': True, 'edge_k': 1.0810460571375793, 'edge_cap': 0.4115277643709091, 'bull_strategy': 'mean_reversion', 'bull_bb_std_mult': 1.5445795603539012, 'bull_rsi_os': 24, 'bull_rsi_ob': 63, 'bull_adx_thresh': 10.649443763755217, 'bull_atr_min_pct': 0.007940947158341892, 'bull_atr_max_pct': 0.04910074921022517, 'bull_tp_mult': 2.2624564408663863, 'bull_tsl_mult': 0.5154474848349413, 'bull_time_stop': 211, 'bull_use_sma': True, 'bull_use_ema': True, 'bull_use_atr': True, 'bull_use_adx': False, 'bull_use_spike': True, 'bull_rsi_required': False, 'bear_strategy': 'breakout', 'bear_bb_std_mult': 0.8483244349837769, 'bear_rsi_os': 51, 'bear_rsi_ob': 55, 'bear_adx_thresh': 32.654450807846175, 'bear_atr_min_pct': 0.01908956286278564, 'bear_atr_max_pct': 0.07939909950955978, 'bear_tp_mult': 1.1780592263818384, 'bear_tsl_mult': 0.7489304364193997, 'bear_time_stop': 69, 'bear_use_sma': True, 'bear_use_ema': True, 'bear_use_atr': True, 'bear_use_adx': True, 'bear_use_spike': False, 'bear_rsi_required': False, 'sideways_strategy': 'mean_reversion', 'sideways_bb_std_mult': 2.53400050073235, 'sideways_rsi_os': 36, 'sideways_rsi_ob': 75, 'sideways_adx_thresh': 9.153148429609729, 'sideways_atr_min_pct': 0.007422255087018017, 'sideways_atr_max_pct': 0.1299650171638948, 'sideways_tp_mult': 2.259458776272138, 'sideways_tsl_mult': 0.4568172178913623, 'sideways_time_stop': 11, 'sideways_use_sma': False, 'sideways_use_ema': False, 'sideways_use_atr': False, 'sideways_use_adx': True, 'sideways_use_spike': True, 'sideways_rsi_required': True}.
[I 2025-09-01 10:44:51,628] Trial 6 finished with values: [-1000000000.0, 1000000000.0] and parameters: {'p_sma': 56, 'p_std': 53, 'p_atr': 29, 'p_adx': 27, 'rsi_period': 30, 'ema1': 29, 'ema2': 41, 'slip_atr_k': 0.13083107707813893, 'slip_spread_k': 0.7550763813487077, 'spread_hl_frac': 0.04786691956304179, 'bb_std_mult': 2.1844904512912113, 'rsi_os': 19, 'rsi_ob': 68, 'vol_spike': 0.06356412476085377, 'adx_thresh': 28.94592511192974, 'atr_min_pct': 0.00212532863918239, 'atr_max_pct': 0.07402358606196295, 'tp_mult': 2.524750992783014, 'tsl_mult': 0.8475174189292197, 'strategy': 'breakout', 'time_stop': 278, 'use_sma': False, 'use_atr': False, 'use_adx': True, 'use_ema': True, 'use_spike': True, 'rsi_required': True, 'edge_k': 1.7683634146152978, 'edge_cap': 0.1837329653914302, 'bull_strategy': 'breakout', 'bull_bb_std_mult': 2.350932051474104, 'bull_rsi_os': 39, 'bull_rsi_ob': 91, 'bull_adx_thresh': 12.220565238167316, 'bull_atr_min_pct': 0.013936993453892314, 'bull_atr_max_pct': 0.07593271878696999, 'bull_tp_mult': 2.8476320315967296, 'bull_tsl_mult': 0.007441961894675719, 'bull_time_stop': 15, 'bull_use_sma': True, 'bull_use_ema': True, 'bull_use_atr': False, 'bull_use_adx': True, 'bull_use_spike': True, 'bull_rsi_required': True, 'bear_strategy': 'mean_reversion', 'bear_bb_std_mult': 2.1991938393479042, 'bear_rsi_os': 40, 'bear_rsi_ob': 91, 'bear_adx_thresh': 33.90751060656306, 'bear_atr_min_pct': 0.017081543555019705, 'bear_atr_max_pct': 0.07716193284914517, 'bear_tp_mult': 2.9987753209369434, 'bear_tsl_mult': 0.6683690181000702, 'bear_time_stop': 212, 'bear_use_sma': False, 'bear_use_ema': True, 'bear_use_atr': False, 'bear_use_adx': True, 'bear_use_spike': False, 'bear_rsi_required': False, 'sideways_strategy': 'breakout', 'sideways_bb_std_mult': 1.3162377481391938, 'sideways_rsi_os': 18, 'sideways_rsi_ob': 79, 'sideways_adx_thresh': 7.481736125469873, 'sideways_atr_min_pct': 0.02540181788312685, 'sideways_atr_max_pct': 0.09186104330530147, 'sideways_tp_mult': 1.7563883970315868, 'sideways_tsl_mult': 0.9426398263396836, 'sideways_time_stop': 81, 'sideways_use_sma': True, 'sideways_use_ema': True, 'sideways_use_atr': False, 'sideways_use_adx': True, 'sideways_use_spike': True, 'sideways_rsi_required': True}.
[I 2025-09-01 10:44:51,829] Trial 14 finished with values: [-1000000000.0, 1000000000.0] and parameters: {'p_sma': 59, 'p_std': 24, 'p_atr': 7, 'p_adx': 18, 'rsi_period': 83, 'ema1': 15, 'ema2': 30, 'slip_atr_k': 0.15864179058279737, 'slip_spread_k': 0.3986341731462361, 'spread_hl_frac': 0.00013029027171548163, 'bb_std_mult': 1.6263516449254474, 'rsi_os': 5, 'rsi_ob': 81, 'vol_spike': 0.2823189841091541, 'adx_thresh': 5.32166175180045, 'atr_min_pct': 0.029872283012764025, 'atr_max_pct': 0.013797119930572518, 'tp_mult': 1.1257345554874156, 'tsl_mult': 0.2953309864144228, 'strategy': 'breakout', 'time_stop': 19, 'use_sma': False, 'use_atr': False, 'use_adx': True, 'use_ema': False, 'use_spike': True, 'rsi_required': False, 'edge_k': 0.35201472825751723, 'edge_cap': 0.58879449935576, 'bull_strategy': 'breakout', 'bull_bb_std_mult': 3.5790269147373097, 'bull_rsi_os': 25, 'bull_rsi_ob': 78, 'bull_adx_thresh': 34.132975023873875, 'bull_atr_min_pct': 0.0003901232136688318, 'bull_atr_max_pct': 0.139713478140113, 'bull_tp_mult': 2.9654373715489766, 'bull_tsl_mult': 0.6620826836189524, 'bull_time_stop': 108, 'bull_use_sma': False, 'bull_use_ema': False, 'bull_use_atr': False, 'bull_use_adx': False, 'bull_use_spike': True, 'bull_rsi_required': False, 'bear_strategy': 'breakout', 'bear_bb_std_mult': 1.3827133669253573, 'bear_rsi_os': 9, 'bear_rsi_ob': 45, 'bear_adx_thresh': 23.748077667891195, 'bear_atr_min_pct': 0.009924943134351827, 'bear_atr_max_pct': 0.09736915269060228, 'bear_tp_mult': 2.3944368973306878, 'bear_tsl_mult': 0.0673200054970162, 'bear_time_stop': 13, 'bear_use_sma': True, 'bear_use_ema': False, 'bear_use_atr': False, 'bear_use_adx': True, 'bear_use_spike': False, 'bear_rsi_required': True, 'sideways_strategy': 'breakout', 'sideways_bb_std_mult': 0.5958068221782168, 'sideways_rsi_os': 5, 'sideways_rsi_ob': 64, 'sideways_adx_thresh': 34.7202291301656, 'sideways_atr_min_pct': 0.00033838160573489845, 'sideways_atr_max_pct': 0.04543736183725529, 'sideways_tp_mult': 1.5247398442872075, 'sideways_tsl_mult': 0.7308413654662056, 'sideways_time_stop': 84, 'sideways_use_sma': False, 'sideways_use_ema': False, 'sideways_use_atr': True, 'sideways_use_adx': True, 'sideways_use_spike': True, 'sideways_rsi_required': False}.
[I 2025-09-01 10:45:30,704] Trial 10 finished with values: [-1000000000.0, 1000000000.0] and parameters: {'p_sma': 59, 'p_std': 42, 'p_atr': 25, 'p_adx': 8, 'rsi_period': 13, 'ema1': 18, 'ema2': 15, 'slip_atr_k': 0.189895698914887, 'slip_spread_k': 0.5078604612696724, 'spread_hl_frac': 0.028292516579111693, 'bb_std_mult': 0.672106099932179, 'rsi_os': 8, 'rsi_ob': 61, 'vol_spike': 0.14619818816622895, 'adx_thresh': 20.50258496479437, 'atr_min_pct': 0.009842438535198809, 'atr_max_pct': 0.08927906270154662, 'tp_mult': 1.2414457970988835, 'tsl_mult': 0.5709589879318795, 'strategy': 'mean_reversion', 'time_stop': 149, 'use_sma': False, 'use_atr': False, 'use_adx': True, 'use_ema': False, 'use_spike': True, 'rsi_required': False, 'edge_k': 0.9713480064132052, 'edge_cap': 0.23524767904935864, 'bull_strategy': 'breakout', 'bull_bb_std_mult': 2.7176054208543023, 'bull_rsi_os': 48, 'bull_rsi_ob': 65, 'bull_adx_thresh': 33.64244896456437, 'bull_atr_min_pct': 0.01680587884434799, 'bull_atr_max_pct': 0.14774288121839627, 'bull_tp_mult': 2.9545912441437197, 'bull_tsl_mult': 0.38264979461299076, 'bull_time_stop': 263, 'bull_use_sma': False, 'bull_use_ema': False, 'bull_use_atr': False, 'bull_use_adx': False, 'bull_use_spike': True, 'bull_rsi_required': True, 'bear_strategy': 'mean_reversion', 'bear_bb_std_mult': 3.2194229382411965, 'bear_rsi_os': 45, 'bear_rsi_ob': 64, 'bear_adx_thresh': 31.24923715201744, 'bear_atr_min_pct': 0.010362645881794919, 'bear_atr_max_pct': 0.09437519735814912, 'bear_tp_mult': 2.7372024179932652, 'bear_tsl_mult': 0.2510519185813621, 'bear_time_stop': 193, 'bear_use_sma': True, 'bear_use_ema': True, 'bear_use_atr': False, 'bear_use_adx': False, 'bear_use_spike': True, 'bear_rsi_required': True, 'sideways_strategy': 'breakout', 'sideways_bb_std_mult': 3.511388283443634, 'sideways_rsi_os': 39, 'sideways_rsi_ob': 75, 'sideways_adx_thresh': 27.604378614301623, 'sideways_atr_min_pct': 0.010265407716479852, 'sideways_atr_max_pct': 0.07067053555906504, 'sideways_tp_mult': 2.88286795673275, 'sideways_tsl_mult': 0.24599447793555373, 'sideways_time_stop': 251, 'sideways_use_sma': True, 'sideways_use_ema': True, 'sideways_use_atr': True, 'sideways_use_adx': True, 'sideways_use_spike': False, 'sideways_rsi_required': True}.
[I 2025-09-01 10:45:33,961] Trial 11 finished with values: [-1000000000.0, 1000000000.0] and parameters: {'p_sma': 38, 'p_std': 8, 'p_atr': 26, 'p_adx': 17, 'rsi_period': 13, 'ema1': 30, 'ema2': 20, 'slip_atr_k': 0.00319048149656348, 'slip_spread_k': 0.04344308082089188, 'spread_hl_frac': 0.04592673949682899, 'bb_std_mult': 1.8175287592952085, 'rsi_os': 26, 'rsi_ob': 86, 'vol_spike': 0.08671635364789744, 'adx_thresh': 21.264819668661065, 'atr_min_pct': 0.017121265916480135, 'atr_max_pct': 0.031848254767748094, 'tp_mult': 1.0154361487910444, 'tsl_mult': 0.14535216175555232, 'strategy': 'mean_reversion', 'time_stop': 244, 'use_sma': True, 'use_atr': False, 'use_adx': False, 'use_ema': False, 'use_spike': True, 'rsi_required': False, 'edge_k': 0.672896889798777, 'edge_cap': 0.7396561714896461, 'bull_strategy': 'breakout', 'bull_bb_std_mult': 1.9631072324494034, 'bull_rsi_os': 53, 'bull_rsi_ob': 74, 'bull_adx_thresh': 22.876098835429097, 'bull_atr_min_pct': 0.018545953298949962, 'bull_atr_max_pct': 0.08426050840818133, 'bull_tp_mult': 2.5257273729156235, 'bull_tsl_mult': 0.12944283501908593, 'bull_time_stop': 98, 'bull_use_sma': True, 'bull_use_ema': False, 'bull_use_atr': True, 'bull_use_adx': False, 'bull_use_spike': False, 'bull_rsi_required': True, 'bear_strategy': 'breakout', 'bear_bb_std_mult': 0.7162878951898642, 'bear_rsi_os': 16, 'bear_rsi_ob': 77, 'bear_adx_thresh': 7.461374449467442, 'bear_atr_min_pct': 0.026822013248458274, 'bear_atr_max_pct': 0.08829491266016204, 'bear_tp_mult': 1.2349230650934333, 'bear_tsl_mult': 0.9523508043847508, 'bear_time_stop': 137, 'bear_use_sma': True, 'bear_use_ema': False, 'bear_use_atr': False, 'bear_use_adx': True, 'bear_use_spike': True, 'bear_rsi_required': False, 'sideways_strategy': 'mean_reversion', 'sideways_bb_std_mult': 1.0973134339775232, 'sideways_rsi_os': 48, 'sideways_rsi_ob': 52, 'sideways_adx_thresh': 16.585128880090082, 'sideways_atr_min_pct': 0.01970433014836875, 'sideways_atr_max_pct': 0.13835841892368192, 'sideways_tp_mult': 1.4070539857904978, 'sideways_tsl_mult': 0.7270948965475995, 'sideways_time_stop': 30, 'sideways_use_sma': True, 'sideways_use_ema': True, 'sideways_use_atr': False, 'sideways_use_adx': False, 'sideways_use_spike': False, 'sideways_rsi_required': False}.
[I 2025-09-01 10:45:34,306] Trial 13 finished with values: [-0.08845572437047644, 0.08832178778636866] and parameters: {'p_sma': 59, 'p_std': 6, 'p_atr': 7, 'p_adx': 17, 'rsi_period': 83, 'ema1': 29, 'ema2': 11, 'slip_atr_k': 0.15668795782325845, 'slip_spread_k': 0.42582786836103725, 'spread_hl_frac': 0.04274194823356613, 'bb_std_mult': 1.9914359150190375, 'rsi_os': 7, 'rsi_ob': 79, 'vol_spike': 0.2897221193386553, 'adx_thresh': 14.512513713515798, 'atr_min_pct': 3.607963349728377e-05, 'atr_max_pct': 0.10895777652757985, 'tp_mult': 2.123497233006104, 'tsl_mult': 0.3552416221079482, 'strategy': 'breakout', 'time_stop': 12, 'use_sma': True, 'use_atr': False, 'use_adx': True, 'use_ema': False, 'use_spike': True, 'rsi_required': False, 'edge_k': 0.36991128150863156, 'edge_cap': 0.05732851263960459, 'bull_strategy': 'breakout', 'bull_bb_std_mult': 3.50687924348956, 'bull_rsi_os': 16, 'bull_rsi_ob': 80, 'bull_adx_thresh': 32.855807215684194, 'bull_atr_min_pct': 0.0005133631351543107, 'bull_atr_max_pct': 0.1489567919204689, 'bull_tp_mult': 2.731091310777474, 'bull_tsl_mult': 0.684787239170215, 'bull_time_stop': 89, 'bull_use_sma': True, 'bull_use_ema': False, 'bull_use_atr': False, 'bull_use_adx': True, 'bull_use_spike': True, 'bull_rsi_required': False, 'bear_strategy': 'breakout', 'bear_bb_std_mult': 1.783122163312423, 'bear_rsi_os': 5, 'bear_rsi_ob': 48, 'bear_adx_thresh': 24.597577027973774, 'bear_atr_min_pct': 0.003493249100929815, 'bear_atr_max_pct': 0.08538478549539863, 'bear_tp_mult': 2.839980910371721, 'bear_tsl_mult': 0.04344476689990273, 'bear_time_stop': 155, 'bear_use_sma': False, 'bear_use_ema': False, 'bear_use_atr': False, 'bear_use_adx': True, 'bear_use_spike': False, 'bear_rsi_required': True, 'sideways_strategy': 'breakout', 'sideways_bb_std_mult': 0.5093918574493623, 'sideways_rsi_os': 7, 'sideways_rsi_ob': 93, 'sideways_adx_thresh': 33.224600556563686, 'sideways_atr_min_pct': 0.0016750612959335436, 'sideways_atr_max_pct': 0.04195004327350474, 'sideways_tp_mult': 1.727453278188231, 'sideways_tsl_mult': 0.9873244362018154, 'sideways_time_stop': 91, 'sideways_use_sma': False, 'sideways_use_ema': False, 'sideways_use_atr': True, 'sideways_use_adx': True, 'sideways_use_spike': True, 'sideways_rsi_required': False}.
[I 2025-09-01 10:45:34,646] Trial 15 finished with values: [-0.11298763359392028, 0.11292898455762602] and parameters: {'p_sma': 49, 'p_std': 26, 'p_atr': 8, 'p_adx': 18, 'rsi_period': 76, 'ema1': 15, 'ema2': 60, 'slip_atr_k': 0.2405125823722676, 'slip_spread_k': 0.48149968139453825, 'spread_hl_frac': 0.04062090277287033, 'bb_std_mult': 2.753115463874674, 'rsi_os': 44, 'rsi_ob': 54, 'vol_spike': 0.14267196070210128, 'adx_thresh': 11.480329115144677, 'atr_min_pct': 0.005775080223931625, 'atr_max_pct': 0.10282008442458533, 'tp_mult': 1.910835153989786, 'tsl_mult': 0.007105692725962287, 'strategy': 'breakout', 'time_stop': 53, 'use_sma': True, 'use_atr': True, 'use_adx': True, 'use_ema': False, 'use_spike': True, 'rsi_required': False, 'edge_k': 0.5314439548457233, 'edge_cap': 0.10238438512103931, 'bull_strategy': 'breakout', 'bull_bb_std_mult': 2.5961964579548082, 'bull_rsi_os': 17, 'bull_rsi_ob': 81, 'bull_adx_thresh': 18.234025377793298, 'bull_atr_min_pct': 0.005071624572608496, 'bull_atr_max_pct': 0.11030378539113195, 'bull_tp_mult': 1.8371788591872957, 'bull_tsl_mult': 0.6433503679453108, 'bull_time_stop': 228, 'bull_use_sma': False, 'bull_use_ema': False, 'bull_use_atr': False, 'bull_use_adx': False, 'bull_use_spike': True, 'bull_rsi_required': False, 'bear_strategy': 'breakout', 'bear_bb_std_mult': 1.5544878620178464, 'bear_rsi_os': 27, 'bear_rsi_ob': 45, 'bear_adx_thresh': 22.45056174131874, 'bear_atr_min_pct': 0.0011434051148820502, 'bear_atr_max_pct': 0.09531881532811881, 'bear_tp_mult': 2.296539628451304, 'bear_tsl_mult': 0.2992369406478023, 'bear_time_stop': 91, 'bear_use_sma': True, 'bear_use_ema': False, 'bear_use_atr': True, 'bear_use_adx': False, 'bear_use_spike': False, 'bear_rsi_required': True, 'sideways_strategy': 'mean_reversion', 'sideways_bb_std_mult': 1.257101012023416, 'sideways_rsi_os': 5, 'sideways_rsi_ob': 92, 'sideways_adx_thresh': 30.728904738858102, 'sideways_atr_min_pct': 0.019546957750225365, 'sideways_atr_max_pct': 0.010890180455127407, 'sideways_tp_mult': 1.6109400289086586, 'sideways_tsl_mult': 0.6707701258433396, 'sideways_time_stop': 75, 'sideways_use_sma': False, 'sideways_use_ema': False, 'sideways_use_atr': True, 'sideways_use_adx': True, 'sideways_use_spike': False, 'sideways_rsi_required': False}.
[I 2025-09-01 10:46:07,294] Trial 16 finished with values: [-0.10100311642414528, 0.1008819677534476] and parameters: {'p_sma': 48, 'p_std': 5, 'p_atr': 7, 'p_adx': 18, 'rsi_period': 75, 'ema1': 13, 'ema2': 56, 'slip_atr_k': 0.24620527760662225, 'slip_spread_k': 0.3015334950548262, 'spread_hl_frac': 0.041892417341202734, 'bb_std_mult': 2.916550337324099, 'rsi_os': 40, 'rsi_ob': 78, 'vol_spike': 0.29899620810950256, 'adx_thresh': 13.47432803545639, 'atr_min_pct': 0.01836349973347644, 'atr_max_pct': 0.1359332583911552, 'tp_mult': 1.9441590528700077, 'tsl_mult': 0.0933373281094077, 'strategy': 'breakout', 'time_stop': 69, 'use_sma': True, 'use_atr': True, 'use_adx': True, 'use_ema': False, 'use_spike': True, 'rsi_required': False, 'edge_k': 0.5126393170740653, 'edge_cap': 0.6693089113958075, 'bull_strategy': 'breakout', 'bull_bb_std_mult': 2.7054937461273503, 'bull_rsi_os': 13, 'bull_rsi_ob': 83, 'bull_adx_thresh': 19.051528583176914, 'bull_atr_min_pct': 0.005597113983128413, 'bull_atr_max_pct': 0.1084063087897417, 'bull_tp_mult': 1.8349765782755703, 'bull_tsl_mult': 0.634666986316409, 'bull_time_stop': 191, 'bull_use_sma': False, 'bull_use_ema': True, 'bull_use_atr': False, 'bull_use_adx': False, 'bull_use_spike': True, 'bull_rsi_required': False, 'bear_strategy': 'breakout', 'bear_bb_std_mult': 1.7263405946635313, 'bear_rsi_os': 5, 'bear_rsi_ob': 47, 'bear_adx_thresh': 23.335062664470104, 'bear_atr_min_pct': 0.001885444659221065, 'bear_atr_max_pct': 0.01698844351241753, 'bear_tp_mult': 2.173426913714145, 'bear_tsl_mult': 0.27922819852832503, 'bear_time_stop': 107, 'bear_use_sma': True, 'bear_use_ema': False, 'bear_use_atr': True, 'bear_use_adx': True, 'bear_use_spike': False, 'bear_rsi_required': True, 'sideways_strategy': 'mean_reversion', 'sideways_bb_std_mult': 1.1813852003156127, 'sideways_rsi_os': 7, 'sideways_rsi_ob': 93, 'sideways_adx_thresh': 34.48459012895038, 'sideways_atr_min_pct': 0.019471636897287967, 'sideways_atr_max_pct': 0.01518030418648137, 'sideways_tp_mult': 1.557598595528025, 'sideways_tsl_mult': 0.6652477308262956, 'sideways_time_stop': 84, 'sideways_use_sma': False, 'sideways_use_ema': False, 'sideways_use_atr': True, 'sideways_use_adx': True, 'sideways_use_spike': True, 'sideways_rsi_required': False}.
[I 2025-09-01 10:46:13,018] Trial 17 finished with values: [-0.070973748474354, 0.07077112397957629] and parameters: {'p_sma': 50, 'p_std': 29, 'p_atr': 8, 'p_adx': 16, 'rsi_period': 80, 'ema1': 11, 'ema2': 55, 'slip_atr_k': 0.22410876643887093, 'slip_spread_k': 0.28994549870981595, 'spread_hl_frac': 0.036449298551628304, 'bb_std_mult': 2.813097134769534, 'rsi_os': 43, 'rsi_ob': 95, 'vol_spike': 0.2974641191656642, 'adx_thresh': 14.641378313456162, 'atr_min_pct': 0.004680124628985715, 'atr_max_pct': 0.14869119224060046, 'tp_mult': 2.0115899333322, 'tsl_mult': 0.3803758811090364, 'strategy': 'breakout', 'time_stop': 38, 'use_sma': True, 'use_atr': True, 'use_adx': True, 'use_ema': False, 'use_spike': True, 'rsi_required': False, 'edge_k': 0.16122158928765623, 'edge_cap': 0.05609349470495367, 'bull_strategy': 'breakout', 'bull_bb_std_mult': 3.4243293864631887, 'bull_rsi_os': 16, 'bull_rsi_ob': 82, 'bull_adx_thresh': 16.639072159799003, 'bull_atr_min_pct': 0.004159219255330736, 'bull_atr_max_pct': 0.1174316412620695, 'bull_tp_mult': 2.6859324406879748, 'bull_tsl_mult': 0.6250001117913929, 'bull_time_stop': 207, 'bull_use_sma': False, 'bull_use_ema': True, 'bull_use_atr': False, 'bull_use_adx': True, 'bull_use_spike': True, 'bull_rsi_required': False, 'bear_strategy': 'breakout', 'bear_bb_std_mult': 1.8993054009324517, 'bear_rsi_os': 28, 'bear_rsi_ob': 46, 'bear_adx_thresh': 23.820719681170758, 'bear_atr_min_pct': 0.0028607939798381363, 'bear_atr_max_pct': 0.06280342156604433, 'bear_tp_mult': 2.40618843091828, 'bear_tsl_mult': 0.31232234524486996, 'bear_time_stop': 106, 'bear_use_sma': False, 'bear_use_ema': False, 'bear_use_atr': True, 'bear_use_adx': True, 'bear_use_spike': False, 'bear_rsi_required': True, 'sideways_strategy': 'breakout', 'sideways_bb_std_mult': 2.788900311111641, 'sideways_rsi_os': 12, 'sideways_rsi_ob': 93, 'sideways_adx_thresh': 31.754264857821855, 'sideways_atr_min_pct': 0.017535452855221696, 'sideways_atr_max_pct': 0.053890450014357334, 'sideways_tp_mult': 1.845538460708399, 'sideways_tsl_mult': 0.006955423728355892, 'sideways_time_stop': 63, 'sideways_use_sma': False, 'sideways_use_ema': False, 'sideways_use_atr': True, 'sideways_use_adx': True, 'sideways_use_spike': True, 'sideways_rsi_required': False}.
