[I 2025-09-01 11:11:26,532] Trial 191 finished with values: [-1000000000.0, 1000000000.0] and parameters: {'p_sma': 15, 'p_std': 28, 'p_atr': 10, 'p_adx': 28, 'rsi_period': 47, 'ema1': 22, 'ema2': 37, 'slip_atr_k': 0.016859232950339594, 'slip_spread_k': 0.08832252705891806, 'spread_hl_frac': 0.03842405222488467, 'bb_std_mult': 2.87282881345038, 'rsi_os': 21, 'rsi_ob': 93, 'vol_spike': 0.0967512853298248, 'adx_thresh': 18.586072288491124, 'atr_min_pct': 0.029542142704390373, 'atr_max_pct': 0.017088499681338576, 'tp_mult': 2.6378089878496804, 'tsl_mult': 0.43326030032607715, 'strategy': 'mean_reversion', 'time_stop': 250, 'use_sma': True, 'use_atr': False, 'use_adx': False, 'use_ema': True, 'use_spike': True, 'rsi_required': True, 'edge_k': 0.25965913166188026, 'edge_cap': 0.2968178492706932, 'bull_strategy': 'breakout', 'bull_bb_std_mult': 2.662011581508029, 'bull_rsi_os': 53, 'bull_rsi_ob': 90, 'bull_adx_thresh': 31.675591278040685, 'bull_atr_min_pct': 0.0028773583440251304, 'bull_atr_max_pct': 0.07992193335349758, 'bull_tp_mult': 1.437366681432918, 'bull_tsl_mult': 0.8015210290171454, 'bull_time_stop': 231, 'bull_use_sma': True, 'bull_use_ema': True, 'bull_use_atr': True, 'bull_use_adx': True, 'bull_use_spike': True, 'bull_rsi_required': False, 'bear_strategy': 'breakout', 'bear_bb_std_mult': 0.9610785279252808, 'bear_rsi_os': 32, 'bear_rsi_ob': 51, 'bear_adx_thresh': 15.825206126226751, 'bear_atr_min_pct': 0.010354382764337953, 'bear_atr_max_pct': 0.027329559105424343, 'bear_tp_mult': 2.5231286928823575, 'bear_tsl_mult': 0.3832760187786818, 'bear_time_stop': 107, 'bear_use_sma': False, 'bear_use_ema': True, 'bear_use_atr': False, 'bear_use_adx': False, 'bear_use_spike': True, 'bear_rsi_required': False, 'sideways_strategy': 'mean_reversion', 'sideways_bb_std_mult': 3.0283112443802045, 'sideways_rsi_os': 17, 'sideways_rsi_ob': 84, 'sideways_adx_thresh': 27.702626588945424, 'sideways_atr_min_pct': 0.016012321059360558, 'sideways_atr_max_pct': 0.07631850160414515, 'sideways_tp_mult': 1.3234664442823947, 'sideways_tsl_mult': 0.5326158276278007, 'sideways_time_stop': 118, 'sideways_use_sma': True, 'sideways_use_ema': True, 'sideways_use_atr': False, 'sideways_use_adx': False, 'sideways_use_spike': False, 'sideways_rsi_required': True}.
[I 2025-09-01 11:12:04,773] Trial 189 finished with values: [-0.034912099702760546, 0.034812308571460275] and parameters: {'p_sma': 48, 'p_std': 27, 'p_atr': 25, 'p_adx': 26, 'rsi_period': 31, 'ema1': 18, 'ema2': 57, 'slip_atr_k': 0.10091114800865404, 'slip_spread_k': 0.7638907048625727, 'spread_hl_frac': 0.038798259676140485, 'bb_std_mult': 1.4854073169740605, 'rsi_os': 29, 'rsi_ob': 83, 'vol_spike': 0.1308573839795756, 'adx_thresh': 5.413992452436197, 'atr_min_pct': 0.013292280665407576, 'atr_max_pct': 0.07068353324965089, 'tp_mult': 1.049765633805709, 'tsl_mult': 0.570370026542584, 'strategy': 'mean_reversion', 'time_stop': 249, 'use_sma': True, 'use_atr': True, 'use_adx': True, 'use_ema': True, 'use_spike': False, 'rsi_required': True, 'edge_k': 1.0906495288822522, 'edge_cap': 0.2745277830498404, 'bull_strategy': 'breakout', 'bull_bb_std_mult': 1.9920346630578154, 'bull_rsi_os': 54, 'bull_rsi_ob': 78, 'bull_adx_thresh': 25.845506367253936, 'bull_atr_min_pct': 0.001527128616134906, 'bull_atr_max_pct': 0.10805154955202154, 'bull_tp_mult': 1.1080968991426379, 'bull_tsl_mult': 0.5756384960261326, 'bull_time_stop': 206, 'bull_use_sma': False, 'bull_use_ema': False, 'bull_use_atr': False, 'bull_use_adx': True, 'bull_use_spike': False, 'bull_rsi_required': True, 'bear_strategy': 'breakout', 'bear_bb_std_mult': 0.9318391578059273, 'bear_rsi_os': 17, 'bear_rsi_ob': 89, 'bear_adx_thresh': 16.721848007432335, 'bear_atr_min_pct': 0.021976832355787748, 'bear_atr_max_pct': 0.022216721915479028, 'bear_tp_mult': 2.4753637520682337, 'bear_tsl_mult': 0.7876648866834655, 'bear_time_stop': 129, 'bear_use_sma': False, 'bear_use_ema': False, 'bear_use_atr': True, 'bear_use_adx': False, 'bear_use_spike': True, 'bear_rsi_required': False, 'sideways_strategy': 'breakout', 'sideways_bb_std_mult': 3.3912553414169833, 'sideways_rsi_os': 43, 'sideways_rsi_ob': 48, 'sideways_adx_thresh': 17.52367788675234, 'sideways_atr_min_pct': 0.01921262719312575, 'sideways_atr_max_pct': 0.10574352915100373, 'sideways_tp_mult': 1.964853037256225, 'sideways_tsl_mult': 0.5141532870031374, 'sideways_time_stop': 152, 'sideways_use_sma': True, 'sideways_use_ema': True, 'sideways_use_atr': False, 'sideways_use_adx': False, 'sideways_use_spike': False, 'sideways_rsi_required': True}.
[I 2025-09-01 11:12:04,780] Trial 192 finished with values: [-1000000000.0, 1000000000.0] and parameters: {'p_sma': 16, 'p_std': 29, 'p_atr': 10, 'p_adx': 28, 'rsi_period': 52, 'ema1': 22, 'ema2': 35, 'slip_atr_k': 0.013819823462201139, 'slip_spread_k': 0.12767068405574417, 'spread_hl_frac': 0.03413182580780885, 'bb_std_mult': 2.9131855036792023, 'rsi_os': 21, 'rsi_ob': 93, 'vol_spike': 0.09631635321001791, 'adx_thresh': 18.724357763011206, 'atr_min_pct': 0.029739978719283775, 'atr_max_pct': 0.032730599073283344, 'tp_mult': 2.6157933997314915, 'tsl_mult': 0.4134759482458388, 'strategy': 'mean_reversion', 'time_stop': 251, 'use_sma': True, 'use_atr': False, 'use_adx': False, 'use_ema': True, 'use_spike': True, 'rsi_required': True, 'edge_k': 0.6371749095521443, 'edge_cap': 0.28663114057535116, 'bull_strategy': 'breakout', 'bull_bb_std_mult': 2.6297699539250696, 'bull_rsi_os': 53, 'bull_rsi_ob': 90, 'bull_adx_thresh': 31.80394953430625, 'bull_atr_min_pct': 0.0025976273946307273, 'bull_atr_max_pct': 0.07863227609514342, 'bull_tp_mult': 1.451077854037552, 'bull_tsl_mult': 0.797598663412097, 'bull_time_stop': 232, 'bull_use_sma': True, 'bull_use_ema': True, 'bull_use_atr': True, 'bull_use_adx': True, 'bull_use_spike': True, 'bull_rsi_required': False, 'bear_strategy': 'breakout', 'bear_bb_std_mult': 0.9519513200274097, 'bear_rsi_os': 32, 'bear_rsi_ob': 52, 'bear_adx_thresh': 15.714908261463165, 'bear_atr_min_pct': 0.00952081327799211, 'bear_atr_max_pct': 0.02186898410397816, 'bear_tp_mult': 2.7191525858298298, 'bear_tsl_mult': 0.37508700908243275, 'bear_time_stop': 106, 'bear_use_sma': False, 'bear_use_ema': True, 'bear_use_atr': False, 'bear_use_adx': False, 'bear_use_spike': True, 'bear_rsi_required': False, 'sideways_strategy': 'mean_reversion', 'sideways_bb_std_mult': 2.6433154106363266, 'sideways_rsi_os': 17, 'sideways_rsi_ob': 80, 'sideways_adx_thresh': 27.22275862855619, 'sideways_atr_min_pct': 0.01767160580626963, 'sideways_atr_max_pct': 0.08278179097690408, 'sideways_tp_mult': 1.4748762215410316, 'sideways_tsl_mult': 0.5223759060474814, 'sideways_time_stop': 130, 'sideways_use_sma': True, 'sideways_use_ema': True, 'sideways_use_atr': False, 'sideways_use_adx': False, 'sideways_use_spike': False, 'sideways_rsi_required': True}.
[I 2025-09-01 11:12:04,973] Trial 193 finished with values: [-1000000000.0, 1000000000.0] and parameters: {'p_sma': 17, 'p_std': 29, 'p_atr': 9, 'p_adx': 28, 'rsi_period': 62, 'ema1': 23, 'ema2': 35, 'slip_atr_k': 0.00950752449812256, 'slip_spread_k': 0.12040508222239699, 'spread_hl_frac': 0.04318247888213769, 'bb_std_mult': 2.97340851338545, 'rsi_os': 23, 'rsi_ob': 94, 'vol_spike': 0.10427919008486809, 'adx_thresh': 18.93013927224211, 'atr_min_pct': 0.024418918508573167, 'atr_max_pct': 0.02713371140114132, 'tp_mult': 2.6247720668556536, 'tsl_mult': 0.3416440578007031, 'strategy': 'mean_reversion', 'time_stop': 253, 'use_sma': True, 'use_atr': False, 'use_adx': False, 'use_ema': True, 'use_spike': True, 'rsi_required': True, 'edge_k': 0.16527136022236388, 'edge_cap': 0.26920192840183477, 'bull_strategy': 'breakout', 'bull_bb_std_mult': 2.5420493655587486, 'bull_rsi_os': 53, 'bull_rsi_ob': 92, 'bull_adx_thresh': 32.44773431876242, 'bull_atr_min_pct': 0.001840858645308364, 'bull_atr_max_pct': 0.08467543769591993, 'bull_tp_mult': 1.4570367092462408, 'bull_tsl_mult': 0.854810446721973, 'bull_time_stop': 245, 'bull_use_sma': True, 'bull_use_ema': True, 'bull_use_atr': True, 'bull_use_adx': True, 'bull_use_spike': True, 'bull_rsi_required': False, 'bear_strategy': 'breakout', 'bear_bb_std_mult': 1.0925824400785231, 'bear_rsi_os': 33, 'bear_rsi_ob': 47, 'bear_adx_thresh': 16.818593032056068, 'bear_atr_min_pct': 0.009605164877058576, 'bear_atr_max_pct': 0.020540961494578396, 'bear_tp_mult': 2.4735551212402003, 'bear_tsl_mult': 0.0032548409999740603, 'bear_time_stop': 109, 'bear_use_sma': False, 'bear_use_ema': True, 'bear_use_atr': False, 'bear_use_adx': False, 'bear_use_spike': True, 'bear_rsi_required': False, 'sideways_strategy': 'mean_reversion', 'sideways_bb_std_mult': 2.7760661452195428, 'sideways_rsi_os': 19, 'sideways_rsi_ob': 79, 'sideways_adx_thresh': 28.529695870870107, 'sideways_atr_min_pct': 0.016371943140764584, 'sideways_atr_max_pct': 0.08281640400086308, 'sideways_tp_mult': 1.483354097422785, 'sideways_tsl_mult': 0.5721708783091672, 'sideways_time_stop': 112, 'sideways_use_sma': True, 'sideways_use_ema': True, 'sideways_use_atr': False, 'sideways_use_adx': False, 'sideways_use_spike': False, 'sideways_rsi_required': True}.
[I 2025-09-01 11:12:05,165] Trial 190 finished with values: [-1000000000.0, 1000000000.0] and parameters: {'p_sma': 15, 'p_std': 29, 'p_atr': 10, 'p_adx': 28, 'rsi_period': 51, 'ema1': 22, 'ema2': 35, 'slip_atr_k': 0.016104811615721516, 'slip_spread_k': 0.12046718321993496, 'spread_hl_frac': 0.03857503340128911, 'bb_std_mult': 2.7909923550268183, 'rsi_os': 22, 'rsi_ob': 93, 'vol_spike': 0.10225309176575162, 'adx_thresh': 18.718343860857377, 'atr_min_pct': 0.02760530251628268, 'atr_max_pct': 0.03456200106905044, 'tp_mult': 2.6303050679075093, 'tsl_mult': 0.40719134811274504, 'strategy': 'mean_reversion', 'time_stop': 250, 'use_sma': True, 'use_atr': False, 'use_adx': False, 'use_ema': True, 'use_spike': True, 'rsi_required': True, 'edge_k': 0.14749769494919251, 'edge_cap': 0.273048872710043, 'bull_strategy': 'breakout', 'bull_bb_std_mult': 2.6552274377723317, 'bull_rsi_os': 53, 'bull_rsi_ob': 92, 'bull_adx_thresh': 31.977741186950762, 'bull_atr_min_pct': 0.0017204593242713174, 'bull_atr_max_pct': 0.08214202886357125, 'bull_tp_mult': 1.46441260652514, 'bull_tsl_mult': 0.8119200739660916, 'bull_time_stop': 231, 'bull_use_sma': True, 'bull_use_ema': True, 'bull_use_atr': True, 'bull_use_adx': True, 'bull_use_spike': True, 'bull_rsi_required': False, 'bear_strategy': 'breakout', 'bear_bb_std_mult': 0.916753328802623, 'bear_rsi_os': 32, 'bear_rsi_ob': 45, 'bear_adx_thresh': 16.610709345559638, 'bear_atr_min_pct': 0.009580914069373773, 'bear_atr_max_pct': 0.02071016977088228, 'bear_tp_mult': 2.5013745681535724, 'bear_tsl_mult': 0.4434729218175871, 'bear_time_stop': 105, 'bear_use_sma': False, 'bear_use_ema': True, 'bear_use_atr': False, 'bear_use_adx': False, 'bear_use_spike': True, 'bear_rsi_required': False, 'sideways_strategy': 'mean_reversion', 'sideways_bb_std_mult': 3.026320179274071, 'sideways_rsi_os': 18, 'sideways_rsi_ob': 80, 'sideways_adx_thresh': 28.20543980419503, 'sideways_atr_min_pct': 0.01632957913261688, 'sideways_atr_max_pct': 0.08361157575350033, 'sideways_tp_mult': 1.1596640563886698, 'sideways_tsl_mult': 0.5061240191926718, 'sideways_time_stop': 119, 'sideways_use_sma': True, 'sideways_use_ema': True, 'sideways_use_atr': False, 'sideways_use_adx': False, 'sideways_use_spike': False, 'sideways_rsi_required': True}.
[I 2025-09-01 11:12:06,076] Trial 196 finished with values: [-1000000000.0, 1000000000.0] and parameters: {'p_sma': 15, 'p_std': 28, 'p_atr': 9, 'p_adx': 29, 'rsi_period': 64, 'ema1': 21, 'ema2': 33, 'slip_atr_k': 0.01780800927681208, 'slip_spread_k': 0.10271825986391975, 'spread_hl_frac': 0.040819770181251706, 'bb_std_mult': 2.7251083644742153, 'rsi_os': 24, 'rsi_ob': 90, 'vol_spike': 0.08228015036366125, 'adx_thresh': 17.644206337129944, 'atr_min_pct': 0.027496387496966496, 'atr_max_pct': 0.013143716753991383, 'tp_mult': 2.672120133933472, 'tsl_mult': 0.4950517425999836, 'strategy': 'mean_reversion', 'time_stop': 257, 'use_sma': True, 'use_atr': False, 'use_adx': False, 'use_ema': True, 'use_spike': True, 'rsi_required': True, 'edge_k': 0.18825282549052938, 'edge_cap': 0.3773343083901981, 'bull_strategy': 'breakout', 'bull_bb_std_mult': 2.706285371378607, 'bull_rsi_os': 51, 'bull_rsi_ob': 93, 'bull_adx_thresh': 30.42202919708163, 'bull_atr_min_pct': 0.001167351671288979, 'bull_atr_max_pct': 0.08838101859590328, 'bull_tp_mult': 1.5510147978799045, 'bull_tsl_mult': 0.8600925326601233, 'bull_time_stop': 224, 'bull_use_sma': True, 'bull_use_ema': True, 'bull_use_atr': True, 'bull_use_adx': True, 'bull_use_spike': True, 'bull_rsi_required': False, 'bear_strategy': 'breakout', 'bear_bb_std_mult': 1.0305381327935683, 'bear_rsi_os': 31, 'bear_rsi_ob': 58, 'bear_adx_thresh': 17.60706541600242, 'bear_atr_min_pct': 0.007203677305548439, 'bear_atr_max_pct': 0.04070880620838234, 'bear_tp_mult': 2.3071907919321886, 'bear_tsl_mult': 0.4064253995155159, 'bear_time_stop': 119, 'bear_use_sma': False, 'bear_use_ema': True, 'bear_use_atr': False, 'bear_use_adx': False, 'bear_use_spike': True, 'bear_rsi_required': False, 'sideways_strategy': 'mean_reversion', 'sideways_bb_std_mult': 2.984426611321303, 'sideways_rsi_os': 18, 'sideways_rsi_ob': 81, 'sideways_adx_thresh': 30.66017212237545, 'sideways_atr_min_pct': 0.01749516965880823, 'sideways_atr_max_pct': 0.1123097396483649, 'sideways_tp_mult': 1.195215716615521, 'sideways_tsl_mult': 0.47485915396976797, 'sideways_time_stop': 130, 'sideways_use_sma': True, 'sideways_use_ema': True, 'sideways_use_atr': False, 'sideways_use_adx': False, 'sideways_use_spike': False, 'sideways_rsi_required': True}.
[I 2025-09-01 11:12:06,207] Trial 197 finished with values: [-1000000000.0, 1000000000.0] and parameters: {'p_sma': 17, 'p_std': 27, 'p_atr': 9, 'p_adx': 29, 'rsi_period': 58, 'ema1': 24, 'ema2': 33, 'slip_atr_k': 0.02095915286716624, 'slip_spread_k': 0.29624596828556066, 'spread_hl_frac': 0.04559672764355842, 'bb_std_mult': 2.6074067743957, 'rsi_os': 24, 'rsi_ob': 90, 'vol_spike': 0.116282023085335, 'adx_thresh': 17.867109530602878, 'atr_min_pct': 0.028746626468577115, 'atr_max_pct': 0.025521120083682396, 'tp_mult': 2.561647268646181, 'tsl_mult': 0.5003742935547992, 'strategy': 'mean_reversion', 'time_stop': 265, 'use_sma': True, 'use_atr': False, 'use_adx': False, 'use_ema': True, 'use_spike': True, 'rsi_required': True, 'edge_k': 0.20763799845914277, 'edge_cap': 0.3711495299479911, 'bull_strategy': 'breakout', 'bull_bb_std_mult': 2.730006765637787, 'bull_rsi_os': 55, 'bull_rsi_ob': 93, 'bull_adx_thresh': 30.263278074251737, 'bull_atr_min_pct': 6.112894086525824e-05, 'bull_atr_max_pct': 0.08809572325308145, 'bull_tp_mult': 1.5445041263164212, 'bull_tsl_mult': 0.8417455836495326, 'bull_time_stop': 237, 'bull_use_sma': True, 'bull_use_ema': True, 'bull_use_atr': True, 'bull_use_adx': True, 'bull_use_spike': True, 'bull_rsi_required': False, 'bear_strategy': 'breakout', 'bear_bb_std_mult': 1.046218228833978, 'bear_rsi_os': 31, 'bear_rsi_ob': 58, 'bear_adx_thresh': 17.122978491584185, 'bear_atr_min_pct': 0.007892430269423757, 'bear_atr_max_pct': 0.041168048979794376, 'bear_tp_mult': 2.5910806063343768, 'bear_tsl_mult': 0.024299606087841652, 'bear_time_stop': 115, 'bear_use_sma': False, 'bear_use_ema': True, 'bear_use_atr': False, 'bear_use_adx': False, 'bear_use_spike': True, 'bear_rsi_required': False, 'sideways_strategy': 'mean_reversion', 'sideways_bb_std_mult': 2.899104326922523, 'sideways_rsi_os': 20, 'sideways_rsi_ob': 86, 'sideways_adx_thresh': 31.281444362373577, 'sideways_atr_min_pct': 0.015595498275348913, 'sideways_atr_max_pct': 0.07989547090662445, 'sideways_tp_mult': 1.424715944479357, 'sideways_tsl_mult': 0.47769239150476983, 'sideways_time_stop': 131, 'sideways_use_sma': True, 'sideways_use_ema': True, 'sideways_use_atr': False, 'sideways_use_adx': False, 'sideways_use_spike': False, 'sideways_rsi_required': True}.
[I 2025-09-01 11:12:06,316] Trial 195 finished with values: [-1000000000.0, 1000000000.0] and parameters: {'p_sma': 15, 'p_std': 28, 'p_atr': 9, 'p_adx': 27, 'rsi_period': 43, 'ema1': 24, 'ema2': 34, 'slip_atr_k': 0.019764927942370152, 'slip_spread_k': 0.05009026394644868, 'spread_hl_frac': 0.048992753433779034, 'bb_std_mult': 2.731715881461184, 'rsi_os': 24, 'rsi_ob': 90, 'vol_spike': 0.11631186494686864, 'adx_thresh': 17.857978057800075, 'atr_min_pct': 0.028763841668750127, 'atr_max_pct': 0.02368895043294578, 'tp_mult': 2.520311850205143, 'tsl_mult': 0.7947390955305182, 'strategy': 'mean_reversion', 'time_stop': 256, 'use_sma': True, 'use_atr': False, 'use_adx': False, 'use_ema': True, 'use_spike': True, 'rsi_required': True, 'edge_k': 0.007753824691572597, 'edge_cap': 0.358111609050331, 'bull_strategy': 'breakout', 'bull_bb_std_mult': 2.7041969046932626, 'bull_rsi_os': 51, 'bull_rsi_ob': 93, 'bull_adx_thresh': 30.79147085238905, 'bull_atr_min_pct': 0.0009750122046975, 'bull_atr_max_pct': 0.08838331884462917, 'bull_tp_mult': 1.5464063559406065, 'bull_tsl_mult': 0.8442756329120779, 'bull_time_stop': 225, 'bull_use_sma': True, 'bull_use_ema': True, 'bull_use_atr': True, 'bull_use_adx': True, 'bull_use_spike': True, 'bull_rsi_required': False, 'bear_strategy': 'breakout', 'bear_bb_std_mult': 1.0407840748375645, 'bear_rsi_os': 31, 'bear_rsi_ob': 58, 'bear_adx_thresh': 17.41317021615178, 'bear_atr_min_pct': 0.0077595483739471924, 'bear_atr_max_pct': 0.029862340692630378, 'bear_tp_mult': 2.4457481898713356, 'bear_tsl_mult': 0.41486191624623886, 'bear_time_stop': 118, 'bear_use_sma': False, 'bear_use_ema': True, 'bear_use_atr': False, 'bear_use_adx': False, 'bear_use_spike': True, 'bear_rsi_required': False, 'sideways_strategy': 'mean_reversion', 'sideways_bb_std_mult': 2.8960856788446887, 'sideways_rsi_os': 18, 'sideways_rsi_ob': 80, 'sideways_adx_thresh': 26.023374387205845, 'sideways_atr_min_pct': 0.015707493545232935, 'sideways_atr_max_pct': 0.08000782267187644, 'sideways_tp_mult': 1.4083746604910505, 'sideways_tsl_mult': 0.4839213978030566, 'sideways_time_stop': 132, 'sideways_use_sma': True, 'sideways_use_ema': True, 'sideways_use_atr': False, 'sideways_use_adx': False, 'sideways_use_spike': False, 'sideways_rsi_required': True}.
[I 2025-09-01 11:12:06,355] Trial 194 finished with values: [-1000000000.0, 1000000000.0] and parameters: {'p_sma': 17, 'p_std': 28, 'p_atr': 9, 'p_adx': 29, 'rsi_period': 63, 'ema1': 24, 'ema2': 35, 'slip_atr_k': 0.019832043625583735, 'slip_spread_k': 0.05240350501413324, 'spread_hl_frac': 0.043335886366947976, 'bb_std_mult': 2.626137656544369, 'rsi_os': 22, 'rsi_ob': 90, 'vol_spike': 0.10497709023637317, 'adx_thresh': 19.141883028878244, 'atr_min_pct': 0.024885872212405458, 'atr_max_pct': 0.013662058865286852, 'tp_mult': 2.559899668070771, 'tsl_mult': 0.3499021998340878, 'strategy': 'mean_reversion', 'time_stop': 255, 'use_sma': True, 'use_atr': False, 'use_adx': False, 'use_ema': True, 'use_spike': True, 'rsi_required': True, 'edge_k': 0.1953133711830043, 'edge_cap': 0.37505613016999495, 'bull_strategy': 'breakout', 'bull_bb_std_mult': 2.525059897134123, 'bull_rsi_os': 51, 'bull_rsi_ob': 92, 'bull_adx_thresh': 32.41616229959812, 'bull_atr_min_pct': 0.0018200344505045986, 'bull_atr_max_pct': 0.08439096430322394, 'bull_tp_mult': 1.4775428503924295, 'bull_tsl_mult': 0.8465216215577978, 'bull_time_stop': 238, 'bull_use_sma': True, 'bull_use_ema': True, 'bull_use_atr': True, 'bull_use_adx': True, 'bull_use_spike': True, 'bull_rsi_required': False, 'bear_strategy': 'breakout', 'bear_bb_std_mult': 1.066611232744704, 'bear_rsi_os': 33, 'bear_rsi_ob': 46, 'bear_adx_thresh': 17.18853110116161, 'bear_atr_min_pct': 0.007560822196516986, 'bear_atr_max_pct': 0.04623014390316239, 'bear_tp_mult': 2.432704302232482, 'bear_tsl_mult': 0.0362307135375289, 'bear_time_stop': 120, 'bear_use_sma': False, 'bear_use_ema': True, 'bear_use_atr': False, 'bear_use_adx': False, 'bear_use_spike': True, 'bear_rsi_required': False, 'sideways_strategy': 'mean_reversion', 'sideways_bb_std_mult': 2.872458645443256, 'sideways_rsi_os': 20, 'sideways_rsi_ob': 86, 'sideways_adx_thresh': 28.736828788431957, 'sideways_atr_min_pct': 0.01640360361269173, 'sideways_atr_max_pct': 0.0842318088313199, 'sideways_tp_mult': 1.4020891295994042, 'sideways_tsl_mult': 0.5765832535482901, 'sideways_time_stop': 136, 'sideways_use_sma': True, 'sideways_use_ema': True, 'sideways_use_atr': False, 'sideways_use_adx': False, 'sideways_use_spike': False, 'sideways_rsi_required': True}.
