[I 2025-09-01 12:09:41,146] Trial 540 finished with values: [-0.005604965375728743, 0.010518865273356316] and parameters: {'p_sma': 27, 'p_std': 8, 'p_atr': 15, 'p_adx': 12, 'rsi_period': 47, 'ema1': 26, 'ema2': 45, 'slip_atr_k': 0.018828159133094297, 'slip_spread_k': 0.5710990344172642, 'spread_hl_frac': 0.047604356311926846, 'bb_std_mult': 0.9659579253804124, 'rsi_os': 33, 'rsi_ob': 50, 'vol_spike': 0.054141875638810594, 'adx_thresh': 19.47235382268363, 'atr_min_pct': 0.02366540254320519, 'atr_max_pct': 0.0858596551471551, 'tp_mult': 2.200569048724179, 'tsl_mult': 0.16600249665031716, 'strategy': 'breakout', 'time_stop': 156, 'use_sma': False, 'use_atr': True, 'use_adx': True, 'use_ema': False, 'use_spike': False, 'rsi_required': False, 'edge_k': 0.8091662818231974, 'edge_cap': 0.10524823913148403, 'bull_strategy': 'mean_reversion', 'bull_bb_std_mult': 1.8851258396017518, 'bull_rsi_os': 40, 'bull_rsi_ob': 51, 'bull_adx_thresh': 6.864949643504605, 'bull_atr_min_pct': 0.023668717170582575, 'bull_atr_max_pct': 0.11930214304763295, 'bull_tp_mult': 1.404018276821212, 'bull_tsl_mult': 0.2834241343344617, 'bull_time_stop': 47, 'bull_use_sma': False, 'bull_use_ema': False, 'bull_use_atr': True, 'bull_use_adx': False, 'bull_use_spike': False, 'bull_rsi_required': False, 'bear_strategy': 'breakout', 'bear_bb_std_mult': 2.3345446299648205, 'bear_rsi_os': 48, 'bear_rsi_ob': 50, 'bear_adx_thresh': 9.43354158823836, 'bear_atr_min_pct': 0.004091836603352106, 'bear_atr_max_pct': 0.10035118101957896, 'bear_tp_mult': 1.3873169189586358, 'bear_tsl_mult': 0.6999799613050793, 'bear_time_stop': 260, 'bear_use_sma': True, 'bear_use_ema': False, 'bear_use_atr': True, 'bear_use_adx': True, 'bear_use_spike': False, 'bear_rsi_required': True, 'sideways_strategy': 'breakout', 'sideways_bb_std_mult': 2.4726973601709012, 'sideways_rsi_os': 26, 'sideways_rsi_ob': 89, 'sideways_adx_thresh': 30.578288338766583, 'sideways_atr_min_pct': 0.004003123596718748, 'sideways_atr_max_pct': 0.13386452872184015, 'sideways_tp_mult': 2.6656187855789604, 'sideways_tsl_mult': 0.3461505126453613, 'sideways_time_stop': 26, 'sideways_use_sma': False, 'sideways_use_ema': False, 'sideways_use_atr': True, 'sideways_use_adx': True, 'sideways_use_spike': True, 'sideways_rsi_required': False}.
[I 2025-09-01 12:09:41,382] Trial 543 finished with values: [0.00027798664614775426, 0.006357367841091075] and parameters: {'p_sma': 27, 'p_std': 32, 'p_atr': 15, 'p_adx': 9, 'rsi_period': 37, 'ema1': 26, 'ema2': 16, 'slip_atr_k': 0.025375295389188722, 'slip_spread_k': 0.0008703012423724177, 'spread_hl_frac': 0.0017770895717827838, 'bb_std_mult': 1.000041828985131, 'rsi_os': 40, 'rsi_ob': 46, 'vol_spike': 0.05582972972793249, 'adx_thresh': 17.132002176858965, 'atr_min_pct': 0.023692338853665125, 'atr_max_pct': 0.09592697301724731, 'tp_mult': 2.1068239689547044, 'tsl_mult': 0.11187213207925158, 'strategy': 'breakout', 'time_stop': 175, 'use_sma': False, 'use_atr': True, 'use_adx': True, 'use_ema': False, 'use_spike': False, 'rsi_required': False, 'edge_k': 0.14704178066264065, 'edge_cap': 0.7335678022210474, 'bull_strategy': 'mean_reversion', 'bull_bb_std_mult': 3.516453883519982, 'bull_rsi_os': 18, 'bull_rsi_ob': 51, 'bull_adx_thresh': 14.991542224807585, 'bull_atr_min_pct': 0.016400210516969507, 'bull_atr_max_pct': 0.11877337355189252, 'bull_tp_mult': 1.3930962563988134, 'bull_tsl_mult': 0.5325785029524474, 'bull_time_stop': 159, 'bull_use_sma': False, 'bull_use_ema': False, 'bull_use_atr': True, 'bull_use_adx': False, 'bull_use_spike': False, 'bull_rsi_required': False, 'bear_strategy': 'breakout', 'bear_bb_std_mult': 1.2428213557122403, 'bear_rsi_os': 28, 'bear_rsi_ob': 50, 'bear_adx_thresh': 8.308695653053809, 'bear_atr_min_pct': 0.004256828369948173, 'bear_atr_max_pct': 0.09678603115244287, 'bear_tp_mult': 1.4850751960413726, 'bear_tsl_mult': 0.7118093938371172, 'bear_time_stop': 264, 'bear_use_sma': True, 'bear_use_ema': False, 'bear_use_atr': True, 'bear_use_adx': True, 'bear_use_spike': False, 'bear_rsi_required': True, 'sideways_strategy': 'breakout', 'sideways_bb_std_mult': 2.4773259087170563, 'sideways_rsi_os': 48, 'sideways_rsi_ob': 89, 'sideways_adx_thresh': 32.41789914045354, 'sideways_atr_min_pct': 0.0013637485451909927, 'sideways_atr_max_pct': 0.13453068396173237, 'sideways_tp_mult': 2.8724125901918125, 'sideways_tsl_mult': 0.349057638110622, 'sideways_time_stop': 288, 'sideways_use_sma': False, 'sideways_use_ema': False, 'sideways_use_atr': True, 'sideways_use_adx': True, 'sideways_use_spike': True, 'sideways_rsi_required': False}.
[I 2025-09-01 12:09:41,670] Trial 542 finished with values: [-1000000000.0, 1000000000.0] and parameters: {'p_sma': 27, 'p_std': 8, 'p_atr': 22, 'p_adx': 9, 'rsi_period': 43, 'ema1': 26, 'ema2': 48, 'slip_atr_k': 0.022513304134133976, 'slip_spread_k': 0.40688262317105883, 'spread_hl_frac': 0.040671576709498974, 'bb_std_mult': 0.9872203642047825, 'rsi_os': 50, 'rsi_ob': 50, 'vol_spike': 0.19855423397219968, 'adx_thresh': 16.918827258209337, 'atr_min_pct': 0.02361045047254014, 'atr_max_pct': 0.0842291600257641, 'tp_mult': 2.104582867069137, 'tsl_mult': 0.11020143851539571, 'strategy': 'breakout', 'time_stop': 62, 'use_sma': False, 'use_atr': True, 'use_adx': True, 'use_ema': False, 'use_spike': False, 'rsi_required': False, 'edge_k': 0.13833074157185893, 'edge_cap': 0.07689792513293914, 'bull_strategy': 'mean_reversion', 'bull_bb_std_mult': 3.529695445820323, 'bull_rsi_os': 37, 'bull_rsi_ob': 57, 'bull_adx_thresh': 6.711538744797848, 'bull_atr_min_pct': 0.01095489371946859, 'bull_atr_max_pct': 0.12146240894686215, 'bull_tp_mult': 1.3836201763139342, 'bull_tsl_mult': 0.5346943669338509, 'bull_time_stop': 56, 'bull_use_sma': False, 'bull_use_ema': False, 'bull_use_atr': True, 'bull_use_adx': False, 'bull_use_spike': False, 'bull_rsi_required': False, 'bear_strategy': 'breakout', 'bear_bb_std_mult': 1.257757503561045, 'bear_rsi_os': 28, 'bear_rsi_ob': 50, 'bear_adx_thresh': 26.72343740668375, 'bear_atr_min_pct': 0.025018108470480055, 'bear_atr_max_pct': 0.02229604978135099, 'bear_tp_mult': 1.401204705463912, 'bear_tsl_mult': 0.7082348952468458, 'bear_time_stop': 260, 'bear_use_sma': True, 'bear_use_ema': False, 'bear_use_atr': True, 'bear_use_adx': True, 'bear_use_spike': False, 'bear_rsi_required': True, 'sideways_strategy': 'breakout', 'sideways_bb_std_mult': 2.467960322933015, 'sideways_rsi_os': 40, 'sideways_rsi_ob': 89, 'sideways_adx_thresh': 32.375094090527085, 'sideways_atr_min_pct': 0.004047370852074472, 'sideways_atr_max_pct': 0.13309398557925728, 'sideways_tp_mult': 2.6635797388272744, 'sideways_tsl_mult': 0.36715908769697575, 'sideways_time_stop': 186, 'sideways_use_sma': False, 'sideways_use_ema': False, 'sideways_use_atr': True, 'sideways_use_adx': True, 'sideways_use_spike': True, 'sideways_rsi_required': False}.
[I 2025-09-01 12:09:41,810] Trial 541 finished with values: [-0.02625562593534103, 0.026060719884297628] and parameters: {'p_sma': 21, 'p_std': 32, 'p_atr': 22, 'p_adx': 9, 'rsi_period': 47, 'ema1': 26, 'ema2': 48, 'slip_atr_k': 0.01866112419239888, 'slip_spread_k': 0.5596023262689103, 'spread_hl_frac': 0.005936289716100577, 'bb_std_mult': 1.8615299713228797, 'rsi_os': 55, 'rsi_ob': 45, 'vol_spike': 0.21200022092676116, 'adx_thresh': 23.557362319581816, 'atr_min_pct': 0.0236450223366619, 'atr_max_pct': 0.1056453497457003, 'tp_mult': 2.194379961592106, 'tsl_mult': 0.15982973300341954, 'strategy': 'breakout', 'time_stop': 177, 'use_sma': False, 'use_atr': True, 'use_adx': True, 'use_ema': True, 'use_spike': False, 'rsi_required': False, 'edge_k': 1.490747398448575, 'edge_cap': 0.10419707718415647, 'bull_strategy': 'mean_reversion', 'bull_bb_std_mult': 1.868630683661544, 'bull_rsi_os': 18, 'bull_rsi_ob': 76, 'bull_adx_thresh': 15.120782158350025, 'bull_atr_min_pct': 0.010179578556874834, 'bull_atr_max_pct': 0.0698075362080572, 'bull_tp_mult': 1.1726873850370523, 'bull_tsl_mult': 0.6259493387763563, 'bull_time_stop': 172, 'bull_use_sma': False, 'bull_use_ema': False, 'bull_use_atr': True, 'bull_use_adx': False, 'bull_use_spike': False, 'bull_rsi_required': False, 'bear_strategy': 'breakout', 'bear_bb_std_mult': 1.2402156828216833, 'bear_rsi_os': 48, 'bear_rsi_ob': 57, 'bear_adx_thresh': 8.190841683507202, 'bear_atr_min_pct': 0.0005492756723254177, 'bear_atr_max_pct': 0.09637563285863575, 'bear_tp_mult': 1.1250301670417622, 'bear_tsl_mult': 0.7060847024676025, 'bear_time_stop': 255, 'bear_use_sma': True, 'bear_use_ema': False, 'bear_use_atr': True, 'bear_use_adx': True, 'bear_use_spike': False, 'bear_rsi_required': True, 'sideways_strategy': 'breakout', 'sideways_bb_std_mult': 3.0982051849639856, 'sideways_rsi_os': 48, 'sideways_rsi_ob': 89, 'sideways_adx_thresh': 32.077829268789245, 'sideways_atr_min_pct': 0.001479443269694047, 'sideways_atr_max_pct': 0.1339385421260766, 'sideways_tp_mult': 2.9032702658126293, 'sideways_tsl_mult': 0.355856320813373, 'sideways_time_stop': 186, 'sideways_use_sma': False, 'sideways_use_ema': False, 'sideways_use_atr': True, 'sideways_use_adx': True, 'sideways_use_spike': True, 'sideways_rsi_required': False}.
[I 2025-09-01 12:09:42,828] Trial 545 finished with values: [-1000000000.0, 1000000000.0] and parameters: {'p_sma': 56, 'p_std': 30, 'p_atr': 20, 'p_adx': 17, 'rsi_period': 43, 'ema1': 12, 'ema2': 49, 'slip_atr_k': 0.17280356509604944, 'slip_spread_k': 0.9470464969279676, 'spread_hl_frac': 0.03662025340856871, 'bb_std_mult': 1.4568665911977223, 'rsi_os': 50, 'rsi_ob': 48, 'vol_spike': 0.19675469706883988, 'adx_thresh': 14.192525587922283, 'atr_min_pct': 0.025547645864948433, 'atr_max_pct': 0.014795547110181356, 'tp_mult': 2.0852157763595325, 'tsl_mult': 0.5040377689884723, 'strategy': 'breakout', 'time_stop': 194, 'use_sma': False, 'use_atr': True, 'use_adx': True, 'use_ema': True, 'use_spike': False, 'rsi_required': False, 'edge_k': 0.6754508373318933, 'edge_cap': 0.12656505847682123, 'bull_strategy': 'mean_reversion', 'bull_bb_std_mult': 1.718314511601063, 'bull_rsi_os': 37, 'bull_rsi_ob': 76, 'bull_adx_thresh': 7.624031510474955, 'bull_atr_min_pct': 0.01728826449121421, 'bull_atr_max_pct': 0.039303587634941475, 'bull_tp_mult': 1.183660619458969, 'bull_tsl_mult': 0.6064097210704201, 'bull_time_stop': 58, 'bull_use_sma': False, 'bull_use_ema': False, 'bull_use_atr': True, 'bull_use_adx': False, 'bull_use_spike': False, 'bull_rsi_required': False, 'bear_strategy': 'breakout', 'bear_bb_std_mult': 1.4937619655439647, 'bear_rsi_os': 30, 'bear_rsi_ob': 52, 'bear_adx_thresh': 10.215060529822217, 'bear_atr_min_pct': 0.0029683719741974016, 'bear_atr_max_pct': 0.07985592517216893, 'bear_tp_mult': 1.1165494936777358, 'bear_tsl_mult': 0.6550377784373146, 'bear_time_stop': 253, 'bear_use_sma': True, 'bear_use_ema': False, 'bear_use_atr': True, 'bear_use_adx': True, 'bear_use_spike': False, 'bear_rsi_required': True, 'sideways_strategy': 'breakout', 'sideways_bb_std_mult': 2.338150407797371, 'sideways_rsi_os': 44, 'sideways_rsi_ob': 75, 'sideways_adx_thresh': 33.394231081755414, 'sideways_atr_min_pct': 0.003538632788979706, 'sideways_atr_max_pct': 0.12566574172369066, 'sideways_tp_mult': 2.882536312383227, 'sideways_tsl_mult': 0.36143518945655695, 'sideways_time_stop': 86, 'sideways_use_sma': False, 'sideways_use_ema': False, 'sideways_use_atr': True, 'sideways_use_adx': True, 'sideways_use_spike': True, 'sideways_rsi_required': False}.
[I 2025-09-01 12:10:22,982] Trial 544 finished with values: [-1000000000.0, 1000000000.0] and parameters: {'p_sma': 56, 'p_std': 30, 'p_atr': 20, 'p_adx': 17, 'rsi_period': 47, 'ema1': 8, 'ema2': 13, 'slip_atr_k': 0.024717446551947547, 'slip_spread_k': 0.3654063368676119, 'spread_hl_frac': 0.006006521599044115, 'bb_std_mult': 2.58592622300777, 'rsi_os': 47, 'rsi_ob': 48, 'vol_spike': 0.19613234224220857, 'adx_thresh': 14.287907495574924, 'atr_min_pct': 0.0027995507243819065, 'atr_max_pct': 0.08517853275773257, 'tp_mult': 1.940848343540901, 'tsl_mult': 0.10195285457849124, 'strategy': 'breakout', 'time_stop': 76, 'use_sma': False, 'use_atr': True, 'use_adx': True, 'use_ema': True, 'use_spike': False, 'rsi_required': False, 'edge_k': 1.1606637355930383, 'edge_cap': 0.07737260253149801, 'bull_strategy': 'mean_reversion', 'bull_bb_std_mult': 1.7241097552532256, 'bull_rsi_os': 51, 'bull_rsi_ob': 49, 'bull_adx_thresh': 7.779969488378171, 'bull_atr_min_pct': 0.017365295837840553, 'bull_atr_max_pct': 0.13421582056352688, 'bull_tp_mult': 1.1638776592053157, 'bull_tsl_mult': 0.622390134884566, 'bull_time_stop': 174, 'bull_use_sma': False, 'bull_use_ema': False, 'bull_use_atr': True, 'bull_use_adx': False, 'bull_use_spike': False, 'bull_rsi_required': False, 'bear_strategy': 'breakout', 'bear_bb_std_mult': 1.3350575540945122, 'bear_rsi_os': 30, 'bear_rsi_ob': 95, 'bear_adx_thresh': 10.218085006082912, 'bear_atr_min_pct': 0.024869408913507057, 'bear_atr_max_pct': 0.022061795914746697, 'bear_tp_mult': 1.1143096626608424, 'bear_tsl_mult': 0.6549360987275522, 'bear_time_stop': 253, 'bear_use_sma': True, 'bear_use_ema': False, 'bear_use_atr': True, 'bear_use_adx': True, 'bear_use_spike': False, 'bear_rsi_required': True, 'sideways_strategy': 'breakout', 'sideways_bb_std_mult': 3.04783124754917, 'sideways_rsi_os': 44, 'sideways_rsi_ob': 70, 'sideways_adx_thresh': 32.11297711067096, 'sideways_atr_min_pct': 0.0032932085243994745, 'sideways_atr_max_pct': 0.13178212972507206, 'sideways_tp_mult': 2.9993682112238913, 'sideways_tsl_mult': 0.9861575283475963, 'sideways_time_stop': 33, 'sideways_use_sma': False, 'sideways_use_ema': False, 'sideways_use_atr': True, 'sideways_use_adx': True, 'sideways_use_spike': True, 'sideways_rsi_required': False}.
[I 2025-09-01 12:10:23,443] Trial 547 finished with values: [-1000000000.0, 1000000000.0] and parameters: {'p_sma': 25, 'p_std': 30, 'p_atr': 20, 'p_adx': 18, 'rsi_period': 44, 'ema1': 8, 'ema2': 51, 'slip_atr_k': 0.037236593683861466, 'slip_spread_k': 0.35515013265299766, 'spread_hl_frac': 0.0022524866638089815, 'bb_std_mult': 0.6812504892123137, 'rsi_os': 38, 'rsi_ob': 48, 'vol_spike': 0.19538641754365155, 'adx_thresh': 21.877803897864826, 'atr_min_pct': 0.024218679150699217, 'atr_max_pct': 0.10168453413032463, 'tp_mult': 2.0662863290563855, 'tsl_mult': 0.04370470471707809, 'strategy': 'breakout', 'time_stop': 167, 'use_sma': False, 'use_atr': True, 'use_adx': True, 'use_ema': True, 'use_spike': False, 'rsi_required': False, 'edge_k': 0.8934617167199567, 'edge_cap': 0.12733589545689325, 'bull_strategy': 'mean_reversion', 'bull_bb_std_mult': 1.7501666615038336, 'bull_rsi_os': 51, 'bull_rsi_ob': 77, 'bull_adx_thresh': 8.44361398224753, 'bull_atr_min_pct': 0.02485175470064158, 'bull_atr_max_pct': 0.10685674520274571, 'bull_tp_mult': 1.3370447448560703, 'bull_tsl_mult': 0.6053451633420304, 'bull_time_stop': 163, 'bull_use_sma': False, 'bull_use_ema': False, 'bull_use_atr': True, 'bull_use_adx': False, 'bull_use_spike': False, 'bull_rsi_required': False, 'bear_strategy': 'breakout', 'bear_bb_std_mult': 1.5281671922776634, 'bear_rsi_os': 27, 'bear_rsi_ob': 95, 'bear_adx_thresh': 33.373278859524575, 'bear_atr_min_pct': 0.0031454896864611245, 'bear_atr_max_pct': 0.1029934311995704, 'bear_tp_mult': 1.565795565063163, 'bear_tsl_mult': 0.6683392756817421, 'bear_time_stop': 289, 'bear_use_sma': True, 'bear_use_ema': False, 'bear_use_atr': True, 'bear_use_adx': True, 'bear_use_spike': False, 'bear_rsi_required': True, 'sideways_strategy': 'breakout', 'sideways_bb_std_mult': 2.3240006516513305, 'sideways_rsi_os': 44, 'sideways_rsi_ob': 68, 'sideways_adx_thresh': 9.182311391224191, 'sideways_atr_min_pct': 0.004855644636733544, 'sideways_atr_max_pct': 0.12491704238035403, 'sideways_tp_mult': 2.931592213721111, 'sideways_tsl_mult': 0.4267890089396161, 'sideways_time_stop': 47, 'sideways_use_sma': False, 'sideways_use_ema': False, 'sideways_use_atr': True, 'sideways_use_adx': True, 'sideways_use_spike': True, 'sideways_rsi_required': False}.
[I 2025-09-01 12:10:23,780] Trial 548 finished with values: [0.001325045103318434, 0.003548137971461135] and parameters: {'p_sma': 25, 'p_std': 34, 'p_atr': 27, 'p_adx': 8, 'rsi_period': 47, 'ema1': 24, 'ema2': 28, 'slip_atr_k': 0.036463577051386614, 'slip_spread_k': 0.36613109060950777, 'spread_hl_frac': 0.002169523663037659, 'bb_std_mult': 0.664208294776427, 'rsi_os': 52, 'rsi_ob': 48, 'vol_spike': 0.2116395521768702, 'adx_thresh': 11.464975169261388, 'atr_min_pct': 0.0073117031556181955, 'atr_max_pct': 0.07634071870283479, 'tp_mult': 1.9263246596612982, 'tsl_mult': 0.0010263708667431898, 'strategy': 'breakout', 'time_stop': 130, 'use_sma': False, 'use_atr': True, 'use_adx': True, 'use_ema': True, 'use_spike': False, 'rsi_required': False, 'edge_k': 0.17948093515225186, 'edge_cap': 0.15572723891679408, 'bull_strategy': 'mean_reversion', 'bull_bb_std_mult': 1.5967556214035725, 'bull_rsi_os': 51, 'bull_rsi_ob': 47, 'bull_adx_thresh': 26.367100568507457, 'bull_atr_min_pct': 0.007217487741260224, 'bull_atr_max_pct': 0.10669217783422953, 'bull_tp_mult': 1.319740891775025, 'bull_tsl_mult': 0.5094209302424664, 'bull_time_stop': 162, 'bull_use_sma': False, 'bull_use_ema': False, 'bull_use_atr': True, 'bull_use_adx': False, 'bull_use_spike': False, 'bull_rsi_required': False, 'bear_strategy': 'breakout', 'bear_bb_std_mult': 1.3327276463068751, 'bear_rsi_os': 27, 'bear_rsi_ob': 54, 'bear_adx_thresh': 10.918178238139339, 'bear_atr_min_pct': 0.00349431625182209, 'bear_atr_max_pct': 0.025651800755018096, 'bear_tp_mult': 1.9108446481534276, 'bear_tsl_mult': 0.6750166699692153, 'bear_time_stop': 267, 'bear_use_sma': True, 'bear_use_ema': False, 'bear_use_atr': True, 'bear_use_adx': True, 'bear_use_spike': False, 'bear_rsi_required': True, 'sideways_strategy': 'breakout', 'sideways_bb_std_mult': 2.041458554914476, 'sideways_rsi_os': 29, 'sideways_rsi_ob': 53, 'sideways_adx_thresh': 34.59461108440139, 'sideways_atr_min_pct': 0.01532008684223802, 'sideways_atr_max_pct': 0.03974396321769213, 'sideways_tp_mult': 2.9347190834151045, 'sideways_tsl_mult': 0.4210727097337555, 'sideways_time_stop': 33, 'sideways_use_sma': False, 'sideways_use_ema': False, 'sideways_use_atr': True, 'sideways_use_adx': True, 'sideways_use_spike': True, 'sideways_rsi_required': False}.
[I 2025-09-01 12:10:23,940] Trial 546 finished with values: [-1000000000.0, 1000000000.0] and parameters: {'p_sma': 47, 'p_std': 17, 'p_atr': 27, 'p_adx': 8, 'rsi_period': 57, 'ema1': 24, 'ema2': 11, 'slip_atr_k': 0.09641986389953547, 'slip_spread_k': 0.3663245014405458, 'spread_hl_frac': 0.0019156962782936055, 'bb_std_mult': 0.6749231913530829, 'rsi_os': 31, 'rsi_ob': 48, 'vol_spike': 0.19707733193355062, 'adx_thresh': 21.57012214867307, 'atr_min_pct': 0.0032969913648745516, 'atr_max_pct': 0.014275877550476102, 'tp_mult': 1.9881338853678499, 'tsl_mult': 0.5064321726070315, 'strategy': 'breakout', 'time_stop': 165, 'use_sma': False, 'use_atr': True, 'use_adx': True, 'use_ema': True, 'use_spike': False, 'rsi_required': False, 'edge_k': 0.17605904961032004, 'edge_cap': 0.705213784944987, 'bull_strategy': 'mean_reversion', 'bull_bb_std_mult': 1.7305492841001966, 'bull_rsi_os': 51, 'bull_rsi_ob': 49, 'bull_adx_thresh': 8.403149989901824, 'bull_atr_min_pct': 0.01711844249046801, 'bull_atr_max_pct': 0.1153772412916756, 'bull_tp_mult': 1.3165416920139659, 'bull_tsl_mult': 0.5989398513663247, 'bull_time_stop': 164, 'bull_use_sma': False, 'bull_use_ema': False, 'bull_use_atr': True, 'bull_use_adx': False, 'bull_use_spike': False, 'bull_rsi_required': False, 'bear_strategy': 'breakout', 'bear_bb_std_mult': 2.90809472230995, 'bear_rsi_os': 27, 'bear_rsi_ob': 95, 'bear_adx_thresh': 10.899934938411713, 'bear_atr_min_pct': 0.02585200220629758, 'bear_atr_max_pct': 0.024528417118629946, 'bear_tp_mult': 1.57640878715772, 'bear_tsl_mult': 0.6508740051477052, 'bear_time_stop': 291, 'bear_use_sma': True, 'bear_use_ema': False, 'bear_use_atr': True, 'bear_use_adx': True, 'bear_use_spike': False, 'bear_rsi_required': True, 'sideways_strategy': 'breakout', 'sideways_bb_std_mult': 2.326559601699115, 'sideways_rsi_os': 33, 'sideways_rsi_ob': 84, 'sideways_adx_thresh': 34.42075061731084, 'sideways_atr_min_pct': 0.0032972337496325888, 'sideways_atr_max_pct': 0.031867054338006594, 'sideways_tp_mult': 2.94802236051435, 'sideways_tsl_mult': 0.7589153703776109, 'sideways_time_stop': 89, 'sideways_use_sma': False, 'sideways_use_ema': False, 'sideways_use_atr': True, 'sideways_use_adx': True, 'sideways_use_spike': True, 'sideways_rsi_required': False}.
