[I 2025-09-01 11:22:48,305] Trial 271 finished with values: [-1000000000.0, 1000000000.0] and parameters: {'p_sma': 39, 'p_std': 33, 'p_atr': 8, 'p_adx': 15, 'rsi_period': 52, 'ema1': 10, 'ema2': 36, 'slip_atr_k': 0.1653220326854029, 'slip_spread_k': 0.9491735386312157, 'spread_hl_frac': 0.01816154817942051, 'bb_std_mult': 2.0003212553083696, 'rsi_os': 49, 'rsi_ob': 88, 'vol_spike': 0.18029691928646474, 'adx_thresh': 25.55640589026064, 'atr_min_pct': 3.44326863515286e-06, 'atr_max_pct': 0.04330207744711979, 'tp_mult': 2.711352764364705, 'tsl_mult': 0.8723392287425102, 'strategy': 'mean_reversion', 'time_stop': 300, 'use_sma': True, 'use_atr': False, 'use_adx': False, 'use_ema': True, 'use_spike': True, 'rsi_required': False, 'edge_k': 0.22284900778464678, 'edge_cap': 0.2985132994538755, 'bull_strategy': 'mean_reversion', 'bull_bb_std_mult': 2.7644766727269783, 'bull_rsi_os': 49, 'bull_rsi_ob': 91, 'bull_adx_thresh': 23.08950994292034, 'bull_atr_min_pct': 0.022003734809271532, 'bull_atr_max_pct': 0.09509324906807826, 'bull_tp_mult': 2.686837221833819, 'bull_tsl_mult': 0.7861940326211007, 'bull_time_stop': 113, 'bull_use_sma': True, 'bull_use_ema': True, 'bull_use_atr': True, 'bull_use_adx': True, 'bull_use_spike': True, 'bull_rsi_required': False, 'bear_strategy': 'breakout', 'bear_bb_std_mult': 1.8372568438355517, 'bear_rsi_os': 32, 'bear_rsi_ob': 49, 'bear_adx_thresh': 16.0322075082493, 'bear_atr_min_pct': 0.009044487643550687, 'bear_atr_max_pct': 0.09134091632850369, 'bear_tp_mult': 2.6056616700221413, 'bear_tsl_mult': 0.7773410484774221, 'bear_time_stop': 65, 'bear_use_sma': False, 'bear_use_ema': True, 'bear_use_atr': False, 'bear_use_adx': False, 'bear_use_spike': True, 'bear_rsi_required': True, 'sideways_strategy': 'mean_reversion', 'sideways_bb_std_mult': 0.6704070500991872, 'sideways_rsi_os': 23, 'sideways_rsi_ob': 70, 'sideways_adx_thresh': 24.08577573842757, 'sideways_atr_min_pct': 0.01711921208007256, 'sideways_atr_max_pct': 0.029198651087933927, 'sideways_tp_mult': 1.5961976997863974, 'sideways_tsl_mult': 0.530092222417649, 'sideways_time_stop': 208, 'sideways_use_sma': True, 'sideways_use_ema': True, 'sideways_use_atr': True, 'sideways_use_adx': False, 'sideways_use_spike': False, 'sideways_rsi_required': True}.
[I 2025-09-01 11:22:48,907] Trial 270 finished with values: [-1000000000.0, 1000000000.0] and parameters: {'p_sma': 10, 'p_std': 47, 'p_atr': 8, 'p_adx': 22, 'rsi_period': 24, 'ema1': 20, 'ema2': 36, 'slip_atr_k': 0.10298957901414635, 'slip_spread_k': 0.07748014953075241, 'spread_hl_frac': 0.02858732946661086, 'bb_std_mult': 2.928872019972865, 'rsi_os': 24, 'rsi_ob': 88, 'vol_spike': 0.17841883788105428, 'adx_thresh': 25.72565342847886, 'atr_min_pct': 0.02132732936001264, 'atr_max_pct': 0.12483801950708553, 'tp_mult': 2.5043380604663477, 'tsl_mult': 0.7796224798879725, 'strategy': 'mean_reversion', 'time_stop': 247, 'use_sma': True, 'use_atr': False, 'use_adx': False, 'use_ema': True, 'use_spike': True, 'rsi_required': True, 'edge_k': 0.23585708674070419, 'edge_cap': 0.3026633367954932, 'bull_strategy': 'breakout', 'bull_bb_std_mult': 2.7761216193599174, 'bull_rsi_os': 11, 'bull_rsi_ob': 89, 'bull_adx_thresh': 28.859940698617823, 'bull_atr_min_pct': 0.022375186142780612, 'bull_atr_max_pct': 0.04266493587920597, 'bull_tp_mult': 2.9625869077748876, 'bull_tsl_mult': 0.8145078751154983, 'bull_time_stop': 300, 'bull_use_sma': True, 'bull_use_ema': True, 'bull_use_atr': True, 'bull_use_adx': True, 'bull_use_spike': True, 'bull_rsi_required': False, 'bear_strategy': 'breakout', 'bear_bb_std_mult': 2.4262516958346843, 'bear_rsi_os': 18, 'bear_rsi_ob': 49, 'bear_adx_thresh': 16.188886252885666, 'bear_atr_min_pct': 0.007001846652969219, 'bear_atr_max_pct': 0.025307146091206805, 'bear_tp_mult': 2.672243368112221, 'bear_tsl_mult': 0.7825721088907358, 'bear_time_stop': 60, 'bear_use_sma': False, 'bear_use_ema': True, 'bear_use_atr': False, 'bear_use_adx': False, 'bear_use_spike': True, 'bear_rsi_required': False, 'sideways_strategy': 'mean_reversion', 'sideways_bb_std_mult': 0.8298304056526027, 'sideways_rsi_os': 55, 'sideways_rsi_ob': 85, 'sideways_adx_thresh': 9.734018272565987, 'sideways_atr_min_pct': 0.018536332670390412, 'sideways_atr_max_pct': 0.08848173890582457, 'sideways_tp_mult': 2.930885279123645, 'sideways_tsl_mult': 0.5296345330415515, 'sideways_time_stop': 122, 'sideways_use_sma': True, 'sideways_use_ema': True, 'sideways_use_atr': False, 'sideways_use_adx': False, 'sideways_use_spike': False, 'sideways_rsi_required': True}.
[I 2025-09-01 11:22:49,312] Trial 273 finished with values: [-0.010133559225183109, 0.00988174307720972] and parameters: {'p_sma': 38, 'p_std': 26, 'p_atr': 27, 'p_adx': 11, 'rsi_period': 47, 'ema1': 15, 'ema2': 36, 'slip_atr_k': 0.21955548779091408, 'slip_spread_k': 0.04330508514755629, 'spread_hl_frac': 0.028391472928461416, 'bb_std_mult': 2.9281546572115205, 'rsi_os': 19, 'rsi_ob': 84, 'vol_spike': 0.18002602510954888, 'adx_thresh': 20.792039525061853, 'atr_min_pct': 0.029351460643006207, 'atr_max_pct': 0.0438270577814896, 'tp_mult': 2.6278746353341353, 'tsl_mult': 0.8695564532982152, 'strategy': 'mean_reversion', 'time_stop': 246, 'use_sma': True, 'use_atr': False, 'use_adx': False, 'use_ema': True, 'use_spike': True, 'rsi_required': False, 'edge_k': 0.3937219097198239, 'edge_cap': 0.29816587025498, 'bull_strategy': 'mean_reversion', 'bull_bb_std_mult': 2.916818051191239, 'bull_rsi_os': 49, 'bull_rsi_ob': 91, 'bull_adx_thresh': 28.624304944311767, 'bull_atr_min_pct': 0.0007613502636783862, 'bull_atr_max_pct': 0.08544468234370493, 'bull_tp_mult': 1.0160193015525887, 'bull_tsl_mult': 0.784876492529125, 'bull_time_stop': 108, 'bull_use_sma': True, 'bull_use_ema': True, 'bull_use_atr': True, 'bull_use_adx': True, 'bull_use_spike': True, 'bull_rsi_required': False, 'bear_strategy': 'breakout', 'bear_bb_std_mult': 1.7776623535693534, 'bear_rsi_os': 8, 'bear_rsi_ob': 49, 'bear_adx_thresh': 16.347018081292337, 'bear_atr_min_pct': 0.008958552877153244, 'bear_atr_max_pct': 0.010403850575205056, 'bear_tp_mult': 2.5859724179387378, 'bear_tsl_mult': 0.23485328737646655, 'bear_time_stop': 36, 'bear_use_sma': True, 'bear_use_ema': True, 'bear_use_atr': False, 'bear_use_adx': False, 'bear_use_spike': True, 'bear_rsi_required': True, 'sideways_strategy': 'mean_reversion', 'sideways_bb_std_mult': 0.7207360430759242, 'sideways_rsi_os': 23, 'sideways_rsi_ob': 89, 'sideways_adx_thresh': 5.024556829158318, 'sideways_atr_min_pct': 0.01869697358028561, 'sideways_atr_max_pct': 0.09489348668788893, 'sideways_tp_mult': 1.584750846509222, 'sideways_tsl_mult': 0.5298768486393972, 'sideways_time_stop': 191, 'sideways_use_sma': True, 'sideways_use_ema': True, 'sideways_use_atr': True, 'sideways_use_adx': False, 'sideways_use_spike': False, 'sideways_rsi_required': True}.
[I 2025-09-01 11:22:50,147] Trial 272 finished with values: [-0.009693348069726881, 0.010909509804011109] and parameters: {'p_sma': 39, 'p_std': 34, 'p_atr': 27, 'p_adx': 20, 'rsi_period': 25, 'ema1': 21, 'ema2': 44, 'slip_atr_k': 0.10384313661953254, 'slip_spread_k': 0.09131193303717375, 'spread_hl_frac': 0.029399198429964975, 'bb_std_mult': 3.2013573820403924, 'rsi_os': 16, 'rsi_ob': 85, 'vol_spike': 0.11460223383591045, 'adx_thresh': 31.156796909370193, 'atr_min_pct': 0.029085453523872488, 'atr_max_pct': 0.03629192933100905, 'tp_mult': 1.248417719394784, 'tsl_mult': 0.8665065694050329, 'strategy': 'mean_reversion', 'time_stop': 246, 'use_sma': True, 'use_atr': False, 'use_adx': False, 'use_ema': True, 'use_spike': True, 'rsi_required': False, 'edge_k': 0.3957602040177819, 'edge_cap': 0.08169196302934517, 'bull_strategy': 'mean_reversion', 'bull_bb_std_mult': 2.7655827514470537, 'bull_rsi_os': 49, 'bull_rsi_ob': 91, 'bull_adx_thresh': 28.767334515207413, 'bull_atr_min_pct': 0.01257327240504218, 'bull_atr_max_pct': 0.04289273913299087, 'bull_tp_mult': 2.893224206915105, 'bull_tsl_mult': 0.7850357965598291, 'bull_time_stop': 92, 'bull_use_sma': True, 'bull_use_ema': True, 'bull_use_atr': True, 'bull_use_adx': True, 'bull_use_spike': True, 'bull_rsi_required': False, 'bear_strategy': 'breakout', 'bear_bb_std_mult': 0.8089891451936325, 'bear_rsi_os': 55, 'bear_rsi_ob': 49, 'bear_adx_thresh': 15.86234547649236, 'bear_atr_min_pct': 0.003962391835757927, 'bear_atr_max_pct': 0.06398484326958107, 'bear_tp_mult': 2.603147317375985, 'bear_tsl_mult': 0.6809211488323703, 'bear_time_stop': 50, 'bear_use_sma': False, 'bear_use_ema': True, 'bear_use_atr': False, 'bear_use_adx': False, 'bear_use_spike': True, 'bear_rsi_required': True, 'sideways_strategy': 'mean_reversion', 'sideways_bb_std_mult': 3.5166535037002054, 'sideways_rsi_os': 39, 'sideways_rsi_ob': 87, 'sideways_adx_thresh': 5.062359301785927, 'sideways_atr_min_pct': 0.011935618781170623, 'sideways_atr_max_pct': 0.08973730627654045, 'sideways_tp_mult': 1.641332571171181, 'sideways_tsl_mult': 0.22985815446891372, 'sideways_time_stop': 255, 'sideways_use_sma': True, 'sideways_use_ema': True, 'sideways_use_atr': True, 'sideways_use_adx': False, 'sideways_use_spike': True, 'sideways_rsi_required': True}.
[I 2025-09-01 11:23:32,706] Trial 276 finished with values: [-1000000000.0, 1000000000.0] and parameters: {'p_sma': 12, 'p_std': 26, 'p_atr': 26, 'p_adx': 11, 'rsi_period': 18, 'ema1': 21, 'ema2': 44, 'slip_atr_k': 0.012209091594633226, 'slip_spread_k': 0.03388032448432554, 'spread_hl_frac': 0.02878576230282144, 'bb_std_mult': 3.2060167865252476, 'rsi_os': 34, 'rsi_ob': 85, 'vol_spike': 0.11900644220531177, 'adx_thresh': 31.299704644858053, 'atr_min_pct': 0.029233929053000714, 'atr_max_pct': 0.037656280799647196, 'tp_mult': 1.2608902562699698, 'tsl_mult': 0.8601255197038133, 'strategy': 'breakout', 'time_stop': 128, 'use_sma': False, 'use_atr': False, 'use_adx': False, 'use_ema': True, 'use_spike': True, 'rsi_required': False, 'edge_k': 0.38552008682847555, 'edge_cap': 0.3492502009258536, 'bull_strategy': 'mean_reversion', 'bull_bb_std_mult': 2.895023436025006, 'bull_rsi_os': 45, 'bull_rsi_ob': 91, 'bull_adx_thresh': 8.888813942833867, 'bull_atr_min_pct': 0.011934223472371575, 'bull_atr_max_pct': 0.05882072507120696, 'bull_tp_mult': 2.764762824934974, 'bull_tsl_mult': 0.4572137103643256, 'bull_time_stop': 249, 'bull_use_sma': True, 'bull_use_ema': True, 'bull_use_atr': True, 'bull_use_adx': False, 'bull_use_spike': True, 'bull_rsi_required': False, 'bear_strategy': 'breakout', 'bear_bb_std_mult': 3.182831442944174, 'bear_rsi_os': 52, 'bear_rsi_ob': 51, 'bear_adx_thresh': 15.100724937732329, 'bear_atr_min_pct': 0.016622619352977475, 'bear_atr_max_pct': 0.02461387307378367, 'bear_tp_mult': 2.614883025527253, 'bear_tsl_mult': 0.2347945409665111, 'bear_time_stop': 185, 'bear_use_sma': True, 'bear_use_ema': True, 'bear_use_atr': False, 'bear_use_adx': True, 'bear_use_spike': False, 'bear_rsi_required': True, 'sideways_strategy': 'mean_reversion', 'sideways_bb_std_mult': 3.488848468503906, 'sideways_rsi_os': 11, 'sideways_rsi_ob': 89, 'sideways_adx_thresh': 25.974238446235123, 'sideways_atr_min_pct': 0.019004288630186647, 'sideways_atr_max_pct': 0.05264858700014956, 'sideways_tp_mult': 1.642204087805668, 'sideways_tsl_mult': 0.47622294156816364, 'sideways_time_stop': 14, 'sideways_use_sma': True, 'sideways_use_ema': False, 'sideways_use_atr': True, 'sideways_use_adx': True, 'sideways_use_spike': True, 'sideways_rsi_required': False}.
[I 2025-09-01 11:23:33,144] Trial 277 finished with values: [-1000000000.0, 1000000000.0] and parameters: {'p_sma': 26, 'p_std': 26, 'p_atr': 9, 'p_adx': 8, 'rsi_period': 78, 'ema1': 21, 'ema2': 34, 'slip_atr_k': 0.006355062646638463, 'slip_spread_k': 0.025959383784729423, 'spread_hl_frac': 0.028609331576111046, 'bb_std_mult': 1.8927382716219099, 'rsi_os': 27, 'rsi_ob': 85, 'vol_spike': 0.21105433883798785, 'adx_thresh': 20.806113505075874, 'atr_min_pct': 0.007743340769322268, 'atr_max_pct': 0.034155267758684486, 'tp_mult': 1.229216247447667, 'tsl_mult': 0.8613574360415776, 'strategy': 'breakout', 'time_stop': 257, 'use_sma': False, 'use_atr': False, 'use_adx': False, 'use_ema': True, 'use_spike': True, 'rsi_required': False, 'edge_k': 1.5709440287440393, 'edge_cap': 0.34664929537952177, 'bull_strategy': 'mean_reversion', 'bull_bb_std_mult': 2.8987105916274785, 'bull_rsi_os': 45, 'bull_rsi_ob': 91, 'bull_adx_thresh': 8.957121036987893, 'bull_atr_min_pct': 0.012136044671933948, 'bull_atr_max_pct': 0.08433581181752342, 'bull_tp_mult': 2.7580298932820067, 'bull_tsl_mult': 0.7917058785423856, 'bull_time_stop': 106, 'bull_use_sma': True, 'bull_use_ema': True, 'bull_use_atr': True, 'bull_use_adx': True, 'bull_use_spike': True, 'bull_rsi_required': False, 'bear_strategy': 'breakout', 'bear_bb_std_mult': 0.7987554401945527, 'bear_rsi_os': 55, 'bear_rsi_ob': 80, 'bear_adx_thresh': 5.757306242875096, 'bear_atr_min_pct': 0.0038688612294863795, 'bear_atr_max_pct': 0.016493117573199503, 'bear_tp_mult': 2.6003009342100487, 'bear_tsl_mult': 0.6238737451110632, 'bear_time_stop': 13, 'bear_use_sma': True, 'bear_use_ema': True, 'bear_use_atr': False, 'bear_use_adx': True, 'bear_use_spike': False, 'bear_rsi_required': True, 'sideways_strategy': 'mean_reversion', 'sideways_bb_std_mult': 3.5483063321916135, 'sideways_rsi_os': 52, 'sideways_rsi_ob': 89, 'sideways_adx_thresh': 8.966429998733265, 'sideways_atr_min_pct': 0.011505953575347588, 'sideways_atr_max_pct': 0.09540027173268145, 'sideways_tp_mult': 1.648870612196465, 'sideways_tsl_mult': 0.46853356038690935, 'sideways_time_stop': 7, 'sideways_use_sma': True, 'sideways_use_ema': False, 'sideways_use_atr': True, 'sideways_use_adx': True, 'sideways_use_spike': True, 'sideways_rsi_required': False}.
[I 2025-09-01 11:23:34,319] Trial 274 finished with values: [-0.028470129381385267, 0.028396571741806792] and parameters: {'p_sma': 10, 'p_std': 12, 'p_atr': 9, 'p_adx': 11, 'rsi_period': 47, 'ema1': 21, 'ema2': 14, 'slip_atr_k': 0.19879048968931232, 'slip_spread_k': 0.08500049409359024, 'spread_hl_frac': 0.02856980771817046, 'bb_std_mult': 1.5277491876084524, 'rsi_os': 19, 'rsi_ob': 84, 'vol_spike': 0.11523149308040151, 'adx_thresh': 31.302146060352197, 'atr_min_pct': 0.007791791381652637, 'atr_max_pct': 0.03681913364502352, 'tp_mult': 2.630207296070184, 'tsl_mult': 0.8627248174075731, 'strategy': 'breakout', 'time_stop': 140, 'use_sma': False, 'use_atr': False, 'use_adx': False, 'use_ema': True, 'use_spike': True, 'rsi_required': True, 'edge_k': 0.3772630633747295, 'edge_cap': 0.34732427924875603, 'bull_strategy': 'breakout', 'bull_bb_std_mult': 2.894250344051435, 'bull_rsi_os': 45, 'bull_rsi_ob': 64, 'bull_adx_thresh': 28.559346952722116, 'bull_atr_min_pct': 4.040626437612797e-06, 'bull_atr_max_pct': 0.04221186621888103, 'bull_tp_mult': 2.9040534764609065, 'bull_tsl_mult': 0.8159923107080189, 'bull_time_stop': 251, 'bull_use_sma': True, 'bull_use_ema': True, 'bull_use_atr': True, 'bull_use_adx': False, 'bull_use_spike': True, 'bull_rsi_required': False, 'bear_strategy': 'breakout', 'bear_bb_std_mult': 0.8020628284084008, 'bear_rsi_os': 8, 'bear_rsi_ob': 51, 'bear_adx_thresh': 16.398895535675695, 'bear_atr_min_pct': 0.009265141761458172, 'bear_atr_max_pct': 0.02516422475799032, 'bear_tp_mult': 2.5956364866396333, 'bear_tsl_mult': 0.3212602802122717, 'bear_time_stop': 189, 'bear_use_sma': True, 'bear_use_ema': True, 'bear_use_atr': False, 'bear_use_adx': False, 'bear_use_spike': False, 'bear_rsi_required': False, 'sideways_strategy': 'mean_reversion', 'sideways_bb_std_mult': 3.4842680226322464, 'sideways_rsi_os': 53, 'sideways_rsi_ob': 87, 'sideways_adx_thresh': 25.82981728930334, 'sideways_atr_min_pct': 0.01480994303849862, 'sideways_atr_max_pct': 0.09182880965824947, 'sideways_tp_mult': 2.6391394185434485, 'sideways_tsl_mult': 0.47135206666447443, 'sideways_time_stop': 280, 'sideways_use_sma': True, 'sideways_use_ema': True, 'sideways_use_atr': False, 'sideways_use_adx': False, 'sideways_use_spike': False, 'sideways_rsi_required': False}.
[I 2025-09-01 11:23:34,855] Trial 275 finished with values: [-0.26144019756782966, 0.261398295267626] and parameters: {'p_sma': 12, 'p_std': 12, 'p_atr': 27, 'p_adx': 21, 'rsi_period': 13, 'ema1': 21, 'ema2': 35, 'slip_atr_k': 0.005475513679668208, 'slip_spread_k': 0.03455629114807257, 'spread_hl_frac': 0.029005457396442887, 'bb_std_mult': 1.4057088657249515, 'rsi_os': 19, 'rsi_ob': 85, 'vol_spike': 0.11247306034635712, 'adx_thresh': 34.01410253936072, 'atr_min_pct': 0.027128809637837824, 'atr_max_pct': 0.03659384412080081, 'tp_mult': 1.2472231240805556, 'tsl_mult': 0.8686849360528108, 'strategy': 'breakout', 'time_stop': 236, 'use_sma': False, 'use_atr': False, 'use_adx': False, 'use_ema': True, 'use_spike': True, 'rsi_required': False, 'edge_k': 0.809269091162643, 'edge_cap': 0.05060221282987454, 'bull_strategy': 'mean_reversion', 'bull_bb_std_mult': 2.900035731717989, 'bull_rsi_os': 45, 'bull_rsi_ob': 91, 'bull_adx_thresh': 32.84646768954507, 'bull_atr_min_pct': 5.1992301311631515e-05, 'bull_atr_max_pct': 0.03586792568994891, 'bull_tp_mult': 2.771574300533046, 'bull_tsl_mult': 0.057401651980846125, 'bull_time_stop': 247, 'bull_use_sma': True, 'bull_use_ema': True, 'bull_use_atr': True, 'bull_use_adx': False, 'bull_use_spike': True, 'bull_rsi_required': False, 'bear_strategy': 'breakout', 'bear_bb_std_mult': 0.8020778496159312, 'bear_rsi_os': 54, 'bear_rsi_ob': 51, 'bear_adx_thresh': 12.479390471456426, 'bear_atr_min_pct': 0.016395502934211072, 'bear_atr_max_pct': 0.107946741175454, 'bear_tp_mult': 2.596264106017463, 'bear_tsl_mult': 0.6871614734319971, 'bear_time_stop': 40, 'bear_use_sma': True, 'bear_use_ema': True, 'bear_use_atr': False, 'bear_use_adx': True, 'bear_use_spike': False, 'bear_rsi_required': True, 'sideways_strategy': 'mean_reversion', 'sideways_bb_std_mult': 3.4953903302597435, 'sideways_rsi_os': 52, 'sideways_rsi_ob': 68, 'sideways_adx_thresh': 25.823891419043658, 'sideways_atr_min_pct': 2.8143337155613762e-05, 'sideways_atr_max_pct': 0.09569399915460114, 'sideways_tp_mult': 1.6518645593069303, 'sideways_tsl_mult': 0.4746726262597354, 'sideways_time_stop': 133, 'sideways_use_sma': True, 'sideways_use_ema': False, 'sideways_use_atr': True, 'sideways_use_adx': True, 'sideways_use_spike': True, 'sideways_rsi_required': False}.
[I 2025-09-01 11:24:18,088] Trial 278 finished with values: [-0.0013614324634614317, 0.0041151096468163605] and parameters: {'p_sma': 13, 'p_std': 27, 'p_atr': 25, 'p_adx': 19, 'rsi_period': 47, 'ema1': 15, 'ema2': 35, 'slip_atr_k': 0.00633139694130821, 'slip_spread_k': 0.0858295797906332, 'spread_hl_frac': 0.03077649872325225, 'bb_std_mult': 2.798298107686453, 'rsi_os': 11, 'rsi_ob': 87, 'vol_spike': 0.11235550572462977, 'adx_thresh': 32.39874387873251, 'atr_min_pct': 0.001653050208017157, 'atr_max_pct': 0.036965317819309194, 'tp_mult': 2.6286174397434308, 'tsl_mult': 0.8026382573933123, 'strategy': 'breakout', 'time_stop': 16, 'use_sma': False, 'use_atr': False, 'use_adx': False, 'use_ema': False, 'use_spike': True, 'rsi_required': True, 'edge_k': 0.8181286391035663, 'edge_cap': 0.08756455009527864, 'bull_strategy': 'breakout', 'bull_bb_std_mult': 1.6509579732654494, 'bull_rsi_os': 17, 'bull_rsi_ob': 62, 'bull_adx_thresh': 34.97095043270211, 'bull_atr_min_pct': 0.0007812278919184969, 'bull_atr_max_pct': 0.03529850239197969, 'bull_tp_mult': 2.9011429377784017, 'bull_tsl_mult': 0.8178529616199745, 'bull_time_stop': 172, 'bull_use_sma': True, 'bull_use_ema': True, 'bull_use_atr': True, 'bull_use_adx': True, 'bull_use_spike': True, 'bull_rsi_required': False, 'bear_strategy': 'breakout', 'bear_bb_std_mult': 0.8483422294563232, 'bear_rsi_os': 8, 'bear_rsi_ob': 50, 'bear_adx_thresh': 25.947684008978584, 'bear_atr_min_pct': 0.004581855727167475, 'bear_atr_max_pct': 0.026651488076484833, 'bear_tp_mult': 1.1435289996275804, 'bear_tsl_mult': 0.31524449911351393, 'bear_time_stop': 31, 'bear_use_sma': True, 'bear_use_ema': True, 'bear_use_atr': False, 'bear_use_adx': False, 'bear_use_spike': False, 'bear_rsi_required': False, 'sideways_strategy': 'mean_reversion', 'sideways_bb_std_mult': 1.0878714987943225, 'sideways_rsi_os': 22, 'sideways_rsi_ob': 87, 'sideways_adx_thresh': 12.382013249527683, 'sideways_atr_min_pct': 0.019492663676189927, 'sideways_atr_max_pct': 0.07631958405349192, 'sideways_tp_mult': 2.988054222269793, 'sideways_tsl_mult': 0.42390779461729367, 'sideways_time_stop': 255, 'sideways_use_sma': True, 'sideways_use_ema': True, 'sideways_use_atr': False, 'sideways_use_adx': False, 'sideways_use_spike': False, 'sideways_rsi_required': True}.
