[I 2025-09-01 10:49:48,676] Trial 48 finished with values: [-1000000000.0, 1000000000.0] and parameters: {'p_sma': 30, 'p_std': 41, 'p_atr': 15, 'p_adx': 26, 'rsi_period': 34, 'ema1': 8, 'ema2': 57, 'slip_atr_k': 0.19000060900314986, 'slip_spread_k': 0.9066755681996053, 'spread_hl_frac': 0.017836012103268545, 'bb_std_mult': 1.1522040640014437, 'rsi_os': 22, 'rsi_ob': 45, 'vol_spike': 0.2337212896368405, 'adx_thresh': 26.990093724249906, 'atr_min_pct': 0.016645013256559007, 'atr_max_pct': 0.02961616726577734, 'tp_mult': 2.4369887055632096, 'tsl_mult': 0.5990420088085161, 'strategy': 'mean_reversion', 'time_stop': 239, 'use_sma': True, 'use_atr': True, 'use_adx': False, 'use_ema': False, 'use_spike': False, 'rsi_required': False, 'edge_k': 1.82657399123969, 'edge_cap': 0.32299037320581225, 'bull_strategy': 'breakout', 'bull_bb_std_mult': 1.2904045483844602, 'bull_rsi_os': 5, 'bull_rsi_ob': 57, 'bull_adx_thresh': 19.292021620423842, 'bull_atr_min_pct': 0.0001368356468002558, 'bull_atr_max_pct': 0.012346260007599044, 'bull_tp_mult': 1.2095110442175523, 'bull_tsl_mult': 0.4822574608711353, 'bull_time_stop': 252, 'bull_use_sma': False, 'bull_use_ema': True, 'bull_use_atr': False, 'bull_use_adx': True, 'bull_use_spike': False, 'bull_rsi_required': False, 'bear_strategy': 'breakout', 'bear_bb_std_mult': 3.4194538743260754, 'bear_rsi_os': 17, 'bear_rsi_ob': 68, 'bear_adx_thresh': 6.713130303086475, 'bear_atr_min_pct': 0.02594929109165089, 'bear_atr_max_pct': 0.06995868505320463, 'bear_tp_mult': 2.5226222055079552, 'bear_tsl_mult': 0.5272694677556573, 'bear_time_stop': 236, 'bear_use_sma': False, 'bear_use_ema': False, 'bear_use_atr': True, 'bear_use_adx': True, 'bear_use_spike': True, 'bear_rsi_required': True, 'sideways_strategy': 'mean_reversion', 'sideways_bb_std_mult': 1.6876734276868652, 'sideways_rsi_os': 42, 'sideways_rsi_ob': 52, 'sideways_adx_thresh': 5.008195240424174, 'sideways_atr_min_pct': 0.009035660266837796, 'sideways_atr_max_pct': 0.09430861096768456, 'sideways_tp_mult': 1.0427866963248948, 'sideways_tsl_mult': 0.4927925242045482, 'sideways_time_stop': 203, 'sideways_use_sma': False, 'sideways_use_ema': True, 'sideways_use_atr': False, 'sideways_use_adx': True, 'sideways_use_spike': True, 'sideways_rsi_required': True}.
[I 2025-09-01 10:50:27,187] Trial 42 finished with values: [-1000000000.0, 1000000000.0] and parameters: {'p_sma': 24, 'p_std': 45, 'p_atr': 9, 'p_adx': 28, 'rsi_period': 61, 'ema1': 6, 'ema2': 26, 'slip_atr_k': 0.12129667641496238, 'slip_spread_k': 0.822055402949146, 'spread_hl_frac': 0.01700688658166659, 'bb_std_mult': 1.141584367879537, 'rsi_os': 22, 'rsi_ob': 66, 'vol_spike': 0.22677390369688533, 'adx_thresh': 12.29397700550418, 'atr_min_pct': 0.0297550478670247, 'atr_max_pct': 0.07438772542286542, 'tp_mult': 2.6612296345727287, 'tsl_mult': 0.8853281006039055, 'strategy': 'mean_reversion', 'time_stop': 201, 'use_sma': True, 'use_atr': False, 'use_adx': False, 'use_ema': False, 'use_spike': False, 'rsi_required': False, 'edge_k': 0.4942880532342111, 'edge_cap': 0.966324293003546, 'bull_strategy': 'breakout', 'bull_bb_std_mult': 2.902805907341591, 'bull_rsi_os': 8, 'bull_rsi_ob': 59, 'bull_adx_thresh': 8.3847435129983, 'bull_atr_min_pct': 0.0137754020434745, 'bull_atr_max_pct': 0.06448632552296538, 'bull_tp_mult': 1.9490308439542474, 'bull_tsl_mult': 0.005076819247048364, 'bull_time_stop': 32, 'bull_use_sma': False, 'bull_use_ema': True, 'bull_use_atr': False, 'bull_use_adx': False, 'bull_use_spike': False, 'bull_rsi_required': True, 'bear_strategy': 'breakout', 'bear_bb_std_mult': 2.199413045768676, 'bear_rsi_os': 19, 'bear_rsi_ob': 68, 'bear_adx_thresh': 14.775830823396042, 'bear_atr_min_pct': 0.01842173257202798, 'bear_atr_max_pct': 0.12767676717545873, 'bear_tp_mult': 2.013388933679943, 'bear_tsl_mult': 0.3622795500699245, 'bear_time_stop': 245, 'bear_use_sma': False, 'bear_use_ema': True, 'bear_use_atr': False, 'bear_use_adx': True, 'bear_use_spike': True, 'bear_rsi_required': True, 'sideways_strategy': 'breakout', 'sideways_bb_std_mult': 1.8540247714970328, 'sideways_rsi_os': 32, 'sideways_rsi_ob': 50, 'sideways_adx_thresh': 29.472868110955467, 'sideways_atr_min_pct': 0.010884906205919871, 'sideways_atr_max_pct': 0.08340689986192729, 'sideways_tp_mult': 1.1734339550026067, 'sideways_tsl_mult': 0.9266629845963174, 'sideways_time_stop': 159, 'sideways_use_sma': False, 'sideways_use_ema': True, 'sideways_use_atr': True, 'sideways_use_adx': False, 'sideways_use_spike': True, 'sideways_rsi_required': False}.
[I 2025-09-01 10:50:27,186] Trial 41 finished with values: [-1000000000.0, 1000000000.0] and parameters: {'p_sma': 24, 'p_std': 44, 'p_atr': 9, 'p_adx': 28, 'rsi_period': 44, 'ema1': 6, 'ema2': 33, 'slip_atr_k': 0.043763568594396104, 'slip_spread_k': 0.8259166189737566, 'spread_hl_frac': 0.01421371575529097, 'bb_std_mult': 1.2561026976781684, 'rsi_os': 37, 'rsi_ob': 65, 'vol_spike': 0.23936333252621886, 'adx_thresh': 12.465164908149644, 'atr_min_pct': 0.029660315246714457, 'atr_max_pct': 0.07263396935323896, 'tp_mult': 2.6598669688606744, 'tsl_mult': 0.8874406969277505, 'strategy': 'mean_reversion', 'time_stop': 208, 'use_sma': True, 'use_atr': False, 'use_adx': False, 'use_ema': False, 'use_spike': False, 'rsi_required': False, 'edge_k': 0.4628639180405294, 'edge_cap': 0.9471127675014432, 'bull_strategy': 'breakout', 'bull_bb_std_mult': 1.2675627169589199, 'bull_rsi_os': 8, 'bull_rsi_ob': 59, 'bull_adx_thresh': 8.201237461107725, 'bull_atr_min_pct': 0.012978751813140725, 'bull_atr_max_pct': 0.07618311755640142, 'bull_tp_mult': 1.9611214176786553, 'bull_tsl_mult': 0.15791978295020287, 'bull_time_stop': 30, 'bull_use_sma': False, 'bull_use_ema': True, 'bull_use_atr': False, 'bull_use_adx': False, 'bull_use_spike': False, 'bull_rsi_required': True, 'bear_strategy': 'breakout', 'bear_bb_std_mult': 2.202755165890149, 'bear_rsi_os': 18, 'bear_rsi_ob': 68, 'bear_adx_thresh': 18.141384330138447, 'bear_atr_min_pct': 0.01848153574872173, 'bear_atr_max_pct': 0.12486469082615338, 'bear_tp_mult': 2.0259111261141767, 'bear_tsl_mult': 0.35211397378700454, 'bear_time_stop': 231, 'bear_use_sma': False, 'bear_use_ema': True, 'bear_use_atr': False, 'bear_use_adx': True, 'bear_use_spike': True, 'bear_rsi_required': True, 'sideways_strategy': 'breakout', 'sideways_bb_std_mult': 1.8217138762632825, 'sideways_rsi_os': 32, 'sideways_rsi_ob': 50, 'sideways_adx_thresh': 20.7945929233697, 'sideways_atr_min_pct': 0.011094418305619318, 'sideways_atr_max_pct': 0.08349062500678303, 'sideways_tp_mult': 1.1896769946937498, 'sideways_tsl_mult': 0.47825193251243525, 'sideways_time_stop': 300, 'sideways_use_sma': False, 'sideways_use_ema': True, 'sideways_use_atr': True, 'sideways_use_adx': False, 'sideways_use_spike': True, 'sideways_rsi_required': False}.
[I 2025-09-01 10:50:27,875] Trial 43 finished with values: [-1000000000.0, 1000000000.0] and parameters: {'p_sma': 25, 'p_std': 54, 'p_atr': 9, 'p_adx': 28, 'rsi_period': 59, 'ema1': 6, 'ema2': 25, 'slip_atr_k': 0.06220195182404302, 'slip_spread_k': 0.6450407592377158, 'spread_hl_frac': 0.016479905321091573, 'bb_std_mult': 1.1232256058090797, 'rsi_os': 38, 'rsi_ob': 72, 'vol_spike': 0.2674071202475954, 'adx_thresh': 12.181495953010364, 'atr_min_pct': 0.029535533603059032, 'atr_max_pct': 0.07525559342655572, 'tp_mult': 2.4751121743238853, 'tsl_mult': 0.21870653836694925, 'strategy': 'mean_reversion', 'time_stop': 200, 'use_sma': True, 'use_atr': False, 'use_adx': False, 'use_ema': False, 'use_spike': False, 'rsi_required': True, 'edge_k': 1.3985445601967916, 'edge_cap': 0.9934167147586477, 'bull_strategy': 'mean_reversion', 'bull_bb_std_mult': 2.8597363931875126, 'bull_rsi_os': 7, 'bull_rsi_ob': 59, 'bull_adx_thresh': 8.892845110862865, 'bull_atr_min_pct': 0.012902365236277627, 'bull_atr_max_pct': 0.012551374754649458, 'bull_tp_mult': 2.0219877259600034, 'bull_tsl_mult': 0.13965598153867603, 'bull_time_stop': 33, 'bull_use_sma': False, 'bull_use_ema': True, 'bull_use_atr': False, 'bull_use_adx': True, 'bull_use_spike': False, 'bull_rsi_required': True, 'bear_strategy': 'breakout', 'bear_bb_std_mult': 2.2551038570118465, 'bear_rsi_os': 19, 'bear_rsi_ob': 71, 'bear_adx_thresh': 14.1688979306387, 'bear_atr_min_pct': 0.018535730917271433, 'bear_atr_max_pct': 0.12498823756508434, 'bear_tp_mult': 1.0105199890811, 'bear_tsl_mult': 0.36369874801451474, 'bear_time_stop': 300, 'bear_use_sma': False, 'bear_use_ema': True, 'bear_use_atr': False, 'bear_use_adx': True, 'bear_use_spike': True, 'bear_rsi_required': False, 'sideways_strategy': 'breakout', 'sideways_bb_std_mult': 1.7760175537619187, 'sideways_rsi_os': 35, 'sideways_rsi_ob': 49, 'sideways_adx_thresh': 21.17750041048725, 'sideways_atr_min_pct': 0.011244704974678924, 'sideways_atr_max_pct': 0.08130595047193512, 'sideways_tp_mult': 1.2198908470309362, 'sideways_tsl_mult': 0.35155976764485647, 'sideways_time_stop': 262, 'sideways_use_sma': False, 'sideways_use_ema': True, 'sideways_use_atr': True, 'sideways_use_adx': False, 'sideways_use_spike': True, 'sideways_rsi_required': False}.
[I 2025-09-01 10:50:28,678] Trial 49 finished with values: [-1000000000.0, 1000000000.0] and parameters: {'p_sma': 12, 'p_std': 18, 'p_atr': 28, 'p_adx': 24, 'rsi_period': 8, 'ema1': 9, 'ema2': 46, 'slip_atr_k': 0.18088100414467376, 'slip_spread_k': 0.5328998200567789, 'spread_hl_frac': 0.012856974914661121, 'bb_std_mult': 0.9283506260551154, 'rsi_os': 15, 'rsi_ob': 56, 'vol_spike': 0.2088614262778167, 'adx_thresh': 12.01759358096894, 'atr_min_pct': 0.006465865885199705, 'atr_max_pct': 0.07326371219739328, 'tp_mult': 2.781579708667756, 'tsl_mult': 0.48457180761622, 'strategy': 'mean_reversion', 'time_stop': 89, 'use_sma': True, 'use_atr': True, 'use_adx': False, 'use_ema': False, 'use_spike': True, 'rsi_required': True, 'edge_k': 0.45430255891433285, 'edge_cap': 0.8953948858273283, 'bull_strategy': 'breakout', 'bull_bb_std_mult': 0.8132446579089703, 'bull_rsi_os': 55, 'bull_rsi_ob': 55, 'bull_adx_thresh': 8.313931398285773, 'bull_atr_min_pct': 0.018880284785920486, 'bull_atr_max_pct': 0.10212901838370392, 'bull_tp_mult': 1.9633145673041887, 'bull_tsl_mult': 0.6928544732786162, 'bull_time_stop': 280, 'bull_use_sma': True, 'bull_use_ema': False, 'bull_use_atr': True, 'bull_use_adx': True, 'bull_use_spike': False, 'bull_rsi_required': False, 'bear_strategy': 'breakout', 'bear_bb_std_mult': 2.6997208264849073, 'bear_rsi_os': 55, 'bear_rsi_ob': 74, 'bear_adx_thresh': 31.06424194696755, 'bear_atr_min_pct': 0.019317017189469737, 'bear_atr_max_pct': 0.10017384424757961, 'bear_tp_mult': 2.930010917785263, 'bear_tsl_mult': 0.695666392200267, 'bear_time_stop': 122, 'bear_use_sma': False, 'bear_use_ema': False, 'bear_use_atr': True, 'bear_use_adx': True, 'bear_use_spike': False, 'bear_rsi_required': True, 'sideways_strategy': 'breakout', 'sideways_bb_std_mult': 1.8922149033919922, 'sideways_rsi_os': 51, 'sideways_rsi_ob': 54, 'sideways_adx_thresh': 33.50398694410524, 'sideways_atr_min_pct': 0.00666705459824574, 'sideways_atr_max_pct': 0.08697053802670697, 'sideways_tp_mult': 1.4928987448037603, 'sideways_tsl_mult': 0.30727446231087074, 'sideways_time_stop': 169, 'sideways_use_sma': False, 'sideways_use_ema': True, 'sideways_use_atr': True, 'sideways_use_adx': False, 'sideways_use_spike': False, 'sideways_rsi_required': False}.
[I 2025-09-01 10:50:28,935] Trial 53 finished with values: [-1000000000.0, 1000000000.0] and parameters: {'p_sma': 21, 'p_std': 23, 'p_atr': 12, 'p_adx': 23, 'rsi_period': 51, 'ema1': 11, 'ema2': 51, 'slip_atr_k': 0.00188074514780677, 'slip_spread_k': 0.7326772199113187, 'spread_hl_frac': 1.2254124751539131e-05, 'bb_std_mult': 1.4380535051121606, 'rsi_os': 10, 'rsi_ob': 50, 'vol_spike': 0.16358254246847512, 'adx_thresh': 19.919700460481227, 'atr_min_pct': 0.0006543695500715102, 'atr_max_pct': 0.09130596913427563, 'tp_mult': 2.1430169449734837, 'tsl_mult': 0.009488707745033187, 'strategy': 'mean_reversion', 'time_stop': 231, 'use_sma': True, 'use_atr': True, 'use_adx': False, 'use_ema': True, 'use_spike': True, 'rsi_required': False, 'edge_k': 1.127018159216433, 'edge_cap': 0.7973329525075207, 'bull_strategy': 'breakout', 'bull_bb_std_mult': 0.9612616404253833, 'bull_rsi_os': 14, 'bull_rsi_ob': 66, 'bull_adx_thresh': 13.219167810962416, 'bull_atr_min_pct': 0.001351070815842453, 'bull_atr_max_pct': 0.02151083703529178, 'bull_tp_mult': 2.55752887741274, 'bull_tsl_mult': 0.4393812186566144, 'bull_time_stop': 228, 'bull_use_sma': True, 'bull_use_ema': False, 'bull_use_atr': True, 'bull_use_adx': True, 'bull_use_spike': False, 'bull_rsi_required': False, 'bear_strategy': 'mean_reversion', 'bear_bb_std_mult': 3.5923627300300627, 'bear_rsi_os': 25, 'bear_rsi_ob': 88, 'bear_adx_thresh': 28.40749738194079, 'bear_atr_min_pct': 0.029648752460415834, 'bear_atr_max_pct': 0.08442496625626755, 'bear_tp_mult': 1.7857941528869106, 'bear_tsl_mult': 0.0007203668668570029, 'bear_time_stop': 69, 'bear_use_sma': False, 'bear_use_ema': False, 'bear_use_atr': True, 'bear_use_adx': False, 'bear_use_spike': False, 'bear_rsi_required': False, 'sideways_strategy': 'mean_reversion', 'sideways_bb_std_mult': 1.3429173401948102, 'sideways_rsi_os': 21, 'sideways_rsi_ob': 45, 'sideways_adx_thresh': 32.986324766109874, 'sideways_atr_min_pct': 0.01414456084167782, 'sideways_atr_max_pct': 0.06487404503604695, 'sideways_tp_mult': 1.7253668706882492, 'sideways_tsl_mult': 0.22700125654907466, 'sideways_time_stop': 55, 'sideways_use_sma': False, 'sideways_use_ema': True, 'sideways_use_atr': False, 'sideways_use_adx': True, 'sideways_use_spike': False, 'sideways_rsi_required': True}.
[I 2025-09-01 10:50:29,003] Trial 54 finished with values: [-1000000000.0, 1000000000.0] and parameters: {'p_sma': 28, 'p_std': 37, 'p_atr': 25, 'p_adx': 7, 'rsi_period': 54, 'ema1': 9, 'ema2': 17, 'slip_atr_k': 0.2356433284293909, 'slip_spread_k': 0.7803727649885384, 'spread_hl_frac': 0.049620672014229976, 'bb_std_mult': 2.1438485761255155, 'rsi_os': 50, 'rsi_ob': 48, 'vol_spike': 0.25074794396854605, 'adx_thresh': 33.036342626775514, 'atr_min_pct': 0.003045175087343705, 'atr_max_pct': 0.12763086986515737, 'tp_mult': 2.5680885935399047, 'tsl_mult': 0.7773213660107996, 'strategy': 'mean_reversion', 'time_stop': 253, 'use_sma': True, 'use_atr': True, 'use_adx': False, 'use_ema': False, 'use_spike': True, 'rsi_required': False, 'edge_k': 0.302313621940424, 'edge_cap': 0.8902782055671895, 'bull_strategy': 'breakout', 'bull_bb_std_mult': 1.777554399612583, 'bull_rsi_os': 49, 'bull_rsi_ob': 52, 'bull_adx_thresh': 21.7701640233282, 'bull_atr_min_pct': 0.002255737581541155, 'bull_atr_max_pct': 0.0409850892927532, 'bull_tp_mult': 2.4075532818426577, 'bull_tsl_mult': 0.7448802202886735, 'bull_time_stop': 267, 'bull_use_sma': False, 'bull_use_ema': True, 'bull_use_atr': False, 'bull_use_adx': True, 'bull_use_spike': False, 'bull_rsi_required': False, 'bear_strategy': 'breakout', 'bear_bb_std_mult': 3.237004492029456, 'bear_rsi_os': 38, 'bear_rsi_ob': 79, 'bear_adx_thresh': 26.099464068441737, 'bear_atr_min_pct': 0.014282967358003206, 'bear_atr_max_pct': 0.055044931784093976, 'bear_tp_mult': 2.1036397477306727, 'bear_tsl_mult': 0.24623261626674436, 'bear_time_stop': 206, 'bear_use_sma': False, 'bear_use_ema': False, 'bear_use_atr': True, 'bear_use_adx': True, 'bear_use_spike': False, 'bear_rsi_required': True, 'sideways_strategy': 'breakout', 'sideways_bb_std_mult': 1.6770779503647755, 'sideways_rsi_os': 8, 'sideways_rsi_ob': 89, 'sideways_adx_thresh': 26.243549523221617, 'sideways_atr_min_pct': 0.014648730599627463, 'sideways_atr_max_pct': 0.06886346234946117, 'sideways_tp_mult': 1.0118117997951095, 'sideways_tsl_mult': 0.4385671977414709, 'sideways_time_stop': 24, 'sideways_use_sma': False, 'sideways_use_ema': True, 'sideways_use_atr': True, 'sideways_use_adx': True, 'sideways_use_spike': True, 'sideways_rsi_required': False}.
[I 2025-09-01 10:50:29,143] Trial 55 finished with values: [-1000000000.0, 1000000000.0] and parameters: {'p_sma': 16, 'p_std': 27, 'p_atr': 8, 'p_adx': 30, 'rsi_period': 55, 'ema1': 10, 'ema2': 58, 'slip_atr_k': 0.21930083667208397, 'slip_spread_k': 0.6837155677203313, 'spread_hl_frac': 0.0033268094219757217, 'bb_std_mult': 1.5693043037277965, 'rsi_os': 54, 'rsi_ob': 89, 'vol_spike': 0.27814276733016274, 'adx_thresh': 10.515650694621208, 'atr_min_pct': 0.020075435560712566, 'atr_max_pct': 0.051999196304314294, 'tp_mult': 2.3631933421622113, 'tsl_mult': 0.6744439965080432, 'strategy': 'mean_reversion', 'time_stop': 276, 'use_sma': True, 'use_atr': True, 'use_adx': False, 'use_ema': False, 'use_spike': True, 'rsi_required': False, 'edge_k': 0.9266012391453149, 'edge_cap': 0.13587922095183225, 'bull_strategy': 'breakout', 'bull_bb_std_mult': 0.6459621845093867, 'bull_rsi_os': 10, 'bull_rsi_ob': 64, 'bull_adx_thresh': 16.829071995783753, 'bull_atr_min_pct': 0.021012180933280968, 'bull_atr_max_pct': 0.055408290545091596, 'bull_tp_mult': 2.4688456330177777, 'bull_tsl_mult': 0.5712818132089217, 'bull_time_stop': 251, 'bull_use_sma': False, 'bull_use_ema': True, 'bull_use_atr': False, 'bull_use_adx': True, 'bull_use_spike': False, 'bull_rsi_required': False, 'bear_strategy': 'breakout', 'bear_bb_std_mult': 2.896653672672943, 'bear_rsi_os': 21, 'bear_rsi_ob': 83, 'bear_adx_thresh': 23.68900623912139, 'bear_atr_min_pct': 0.01385853898455669, 'bear_atr_max_pct': 0.0767215907726086, 'bear_tp_mult': 1.257144852354766, 'bear_tsl_mult': 0.24368503767938293, 'bear_time_stop': 62, 'bear_use_sma': False, 'bear_use_ema': False, 'bear_use_atr': True, 'bear_use_adx': True, 'bear_use_spike': False, 'bear_rsi_required': True, 'sideways_strategy': 'mean_reversion', 'sideways_bb_std_mult': 1.3607210447925662, 'sideways_rsi_os': 5, 'sideways_rsi_ob': 48, 'sideways_adx_thresh': 29.815270317428375, 'sideways_atr_min_pct': 0.0126790686630803, 'sideways_atr_max_pct': 0.07452943218498137, 'sideways_tp_mult': 1.1035566645848371, 'sideways_tsl_mult': 0.13974780236654155, 'sideways_time_stop': 20, 'sideways_use_sma': False, 'sideways_use_ema': True, 'sideways_use_atr': True, 'sideways_use_adx': True, 'sideways_use_spike': True, 'sideways_rsi_required': False}.
[I 2025-09-01 10:51:07,662] Trial 52 finished with values: [-1000000000.0, 1000000000.0] and parameters: {'p_sma': 12, 'p_std': 18, 'p_atr': 28, 'p_adx': 24, 'rsi_period': 7, 'ema1': 9, 'ema2': 46, 'slip_atr_k': 0.00830782527056742, 'slip_spread_k': 0.5481006663835748, 'spread_hl_frac': 0.02923166528384216, 'bb_std_mult': 0.8701180126841105, 'rsi_os': 16, 'rsi_ob': 56, 'vol_spike': 0.20952889007152906, 'adx_thresh': 10.559794297651592, 'atr_min_pct': 0.005469524021063156, 'atr_max_pct': 0.12355997525708777, 'tp_mult': 2.8024113401930713, 'tsl_mult': 0.6772883135748397, 'strategy': 'mean_reversion', 'time_stop': 92, 'use_sma': True, 'use_atr': True, 'use_adx': False, 'use_ema': True, 'use_spike': True, 'rsi_required': False, 'edge_k': 0.31214889688607483, 'edge_cap': 0.7759954670421276, 'bull_strategy': 'breakout', 'bull_bb_std_mult': 0.7709809750869838, 'bull_rsi_os': 18, 'bull_rsi_ob': 66, 'bull_adx_thresh': 12.355238144109872, 'bull_atr_min_pct': 0.020337154230521202, 'bull_atr_max_pct': 0.05667608753195637, 'bull_tp_mult': 2.5659623963587785, 'bull_tsl_mult': 0.4171618011562658, 'bull_time_stop': 286, 'bull_use_sma': True, 'bull_use_ema': False, 'bull_use_atr': True, 'bull_use_adx': True, 'bull_use_spike': False, 'bull_rsi_required': False, 'bear_strategy': 'mean_reversion', 'bear_bb_std_mult': 3.2105773318367334, 'bear_rsi_os': 22, 'bear_rsi_ob': 74, 'bear_adx_thresh': 32.12464271847621, 'bear_atr_min_pct': 0.029765836436916247, 'bear_atr_max_pct': 0.08745006107407967, 'bear_tp_mult': 2.9220704537633444, 'bear_tsl_mult': 0.6985856910234912, 'bear_time_stop': 123, 'bear_use_sma': False, 'bear_use_ema': False, 'bear_use_atr': True, 'bear_use_adx': False, 'bear_use_spike': False, 'bear_rsi_required': True, 'sideways_strategy': 'mean_reversion', 'sideways_bb_std_mult': 1.3679311197856885, 'sideways_rsi_os': 51, 'sideways_rsi_ob': 55, 'sideways_adx_thresh': 33.05985209131885, 'sideways_atr_min_pct': 0.014465349129041061, 'sideways_atr_max_pct': 0.0720926218528853, 'sideways_tp_mult': 1.4736583097136753, 'sideways_tsl_mult': 0.27204478441543917, 'sideways_time_stop': 56, 'sideways_use_sma': False, 'sideways_use_ema': True, 'sideways_use_atr': False, 'sideways_use_adx': True, 'sideways_use_spike': False, 'sideways_rsi_required': True}.
