[I 2025-09-01 11:03:42,230] Trial 132 finished with values: [-0.008590431455914205, 0.008760443710471466] and parameters: {'p_sma': 49, 'p_std': 26, 'p_atr': 20, 'p_adx': 14, 'rsi_period': 46, 'ema1': 20, 'ema2': 20, 'slip_atr_k': 0.0325815045990294, 'slip_spread_k': 0.8479226816092587, 'spread_hl_frac': 0.01549743926862495, 'bb_std_mult': 3.3555966250270393, 'rsi_os': 22, 'rsi_ob': 69, 'vol_spike': 0.07935683771322938, 'adx_thresh': 23.684424691861242, 'atr_min_pct': 0.014461815400030973, 'atr_max_pct': 0.0634337613401743, 'tp_mult': 2.0936949383384977, 'tsl_mult': 0.885785825136819, 'strategy': 'mean_reversion', 'time_stop': 100, 'use_sma': True, 'use_atr': True, 'use_adx': True, 'use_ema': True, 'use_spike': True, 'rsi_required': True, 'edge_k': 0.6543773938839763, 'edge_cap': 0.6563851464652237, 'bull_strategy': 'breakout', 'bull_bb_std_mult': 2.2030498132348244, 'bull_rsi_os': 19, 'bull_rsi_ob': 75, 'bull_adx_thresh': 29.99347779476522, 'bull_atr_min_pct': 0.0031729770267913387, 'bull_atr_max_pct': 0.12354701306730095, 'bull_tp_mult': 1.8038700775390142, 'bull_tsl_mult': 0.9652150640017142, 'bull_time_stop': 83, 'bull_use_sma': False, 'bull_use_ema': False, 'bull_use_atr': False, 'bull_use_adx': False, 'bull_use_spike': True, 'bull_rsi_required': False, 'bear_strategy': 'mean_reversion', 'bear_bb_std_mult': 1.1042976279071823, 'bear_rsi_os': 44, 'bear_rsi_ob': 55, 'bear_adx_thresh': 17.4158647698584, 'bear_atr_min_pct': 0.022721739837037378, 'bear_atr_max_pct': 0.14576131328294264, 'bear_tp_mult': 1.2255342255144706, 'bear_tsl_mult': 0.24694888660383793, 'bear_time_stop': 282, 'bear_use_sma': False, 'bear_use_ema': False, 'bear_use_atr': True, 'bear_use_adx': True, 'bear_use_spike': False, 'bear_rsi_required': False, 'sideways_strategy': 'breakout', 'sideways_bb_std_mult': 0.5241057033707957, 'sideways_rsi_os': 31, 'sideways_rsi_ob': 48, 'sideways_adx_thresh': 8.612755316989393, 'sideways_atr_min_pct': 0.016041205690389675, 'sideways_atr_max_pct': 0.08124571797582285, 'sideways_tp_mult': 2.0630959116129137, 'sideways_tsl_mult': 0.2494976119536138, 'sideways_time_stop': 284, 'sideways_use_sma': True, 'sideways_use_ema': True, 'sideways_use_atr': False, 'sideways_use_adx': False, 'sideways_use_spike': False, 'sideways_rsi_required': True}.
[I 2025-09-01 11:04:23,215] Trial 137 finished with values: [-1000000000.0, 1000000000.0] and parameters: {'p_sma': 11, 'p_std': 32, 'p_atr': 7, 'p_adx': 24, 'rsi_period': 33, 'ema1': 29, 'ema2': 45, 'slip_atr_k': 0.06553256669664503, 'slip_spread_k': 0.21881455357080504, 'spread_hl_frac': 0.014745658383863679, 'bb_std_mult': 3.031498158374805, 'rsi_os': 26, 'rsi_ob': 72, 'vol_spike': 0.07889486508670902, 'adx_thresh': 8.62845143199792, 'atr_min_pct': 0.01622759654011119, 'atr_max_pct': 0.14976932083078232, 'tp_mult': 2.099533055323931, 'tsl_mult': 0.8873795729770362, 'strategy': 'mean_reversion', 'time_stop': 227, 'use_sma': True, 'use_atr': True, 'use_adx': True, 'use_ema': True, 'use_spike': False, 'rsi_required': True, 'edge_k': 1.8975449477012984, 'edge_cap': 0.8785985153387685, 'bull_strategy': 'breakout', 'bull_bb_std_mult': 1.981256056761685, 'bull_rsi_os': 19, 'bull_rsi_ob': 80, 'bull_adx_thresh': 28.226092073119634, 'bull_atr_min_pct': 0.022084444746951894, 'bull_atr_max_pct': 0.0464279841988148, 'bull_tp_mult': 1.1915107744376459, 'bull_tsl_mult': 0.6452825337188093, 'bull_time_stop': 22, 'bull_use_sma': False, 'bull_use_ema': False, 'bull_use_atr': False, 'bull_use_adx': True, 'bull_use_spike': True, 'bull_rsi_required': False, 'bear_strategy': 'mean_reversion', 'bear_bb_std_mult': 0.5065165392280431, 'bear_rsi_os': 30, 'bear_rsi_ob': 56, 'bear_adx_thresh': 20.968435250850703, 'bear_atr_min_pct': 0.021733239847332626, 'bear_atr_max_pct': 0.14605959264537915, 'bear_tp_mult': 1.6836173977665374, 'bear_tsl_mult': 0.38825332567238047, 'bear_time_stop': 113, 'bear_use_sma': False, 'bear_use_ema': False, 'bear_use_atr': True, 'bear_use_adx': False, 'bear_use_spike': True, 'bear_rsi_required': False, 'sideways_strategy': 'breakout', 'sideways_bb_std_mult': 0.9496476674571654, 'sideways_rsi_os': 38, 'sideways_rsi_ob': 76, 'sideways_adx_thresh': 13.914288157057042, 'sideways_atr_min_pct': 0.02995253826462196, 'sideways_atr_max_pct': 0.012938041343090415, 'sideways_tp_mult': 1.7717067848400712, 'sideways_tsl_mult': 0.018665601365029198, 'sideways_time_stop': 149, 'sideways_use_sma': True, 'sideways_use_ema': True, 'sideways_use_atr': False, 'sideways_use_adx': False, 'sideways_use_spike': False, 'sideways_rsi_required': True}.
[I 2025-09-01 11:04:23,258] Trial 139 finished with values: [-0.049363194897883655, 0.04928113051544588] and parameters: {'p_sma': 11, 'p_std': 5, 'p_atr': 7, 'p_adx': 25, 'rsi_period': 33, 'ema1': 19, 'ema2': 45, 'slip_atr_k': 0.0262731808020909, 'slip_spread_k': 0.4352225779397953, 'spread_hl_frac': 0.004192143241989226, 'bb_std_mult': 3.3289611054531267, 'rsi_os': 24, 'rsi_ob': 66, 'vol_spike': 0.021491433575591246, 'adx_thresh': 24.985227156542752, 'atr_min_pct': 0.013435249171311978, 'atr_max_pct': 0.12320321887964594, 'tp_mult': 1.417695369634274, 'tsl_mult': 0.906046901982408, 'strategy': 'mean_reversion', 'time_stop': 151, 'use_sma': True, 'use_atr': True, 'use_adx': True, 'use_ema': True, 'use_spike': False, 'rsi_required': False, 'edge_k': 0.112385744149611, 'edge_cap': 0.6279299184022905, 'bull_strategy': 'breakout', 'bull_bb_std_mult': 1.9737529351886705, 'bull_rsi_os': 47, 'bull_rsi_ob': 80, 'bull_adx_thresh': 9.709889621062615, 'bull_atr_min_pct': 0.001416162735629314, 'bull_atr_max_pct': 0.11096197749321077, 'bull_tp_mult': 1.5804849854649847, 'bull_tsl_mult': 0.9133339909690665, 'bull_time_stop': 44, 'bull_use_sma': True, 'bull_use_ema': False, 'bull_use_atr': False, 'bull_use_adx': True, 'bull_use_spike': True, 'bull_rsi_required': False, 'bear_strategy': 'mean_reversion', 'bear_bb_std_mult': 1.2455932141005044, 'bear_rsi_os': 24, 'bear_rsi_ob': 89, 'bear_adx_thresh': 7.348232169785652, 'bear_atr_min_pct': 0.0015042931789094292, 'bear_atr_max_pct': 0.13814565715709667, 'bear_tp_mult': 1.545921175110366, 'bear_tsl_mult': 0.23413389836936394, 'bear_time_stop': 174, 'bear_use_sma': False, 'bear_use_ema': False, 'bear_use_atr': True, 'bear_use_adx': False, 'bear_use_spike': True, 'bear_rsi_required': True, 'sideways_strategy': 'mean_reversion', 'sideways_bb_std_mult': 3.192594746166951, 'sideways_rsi_os': 38, 'sideways_rsi_ob': 76, 'sideways_adx_thresh': 13.118982174073814, 'sideways_atr_min_pct': 0.02997535850709731, 'sideways_atr_max_pct': 0.09217236357584911, 'sideways_tp_mult': 1.5449191199552188, 'sideways_tsl_mult': 0.8591416852387732, 'sideways_time_stop': 148, 'sideways_use_sma': True, 'sideways_use_ema': True, 'sideways_use_atr': True, 'sideways_use_adx': False, 'sideways_use_spike': False, 'sideways_rsi_required': True}.
[I 2025-09-01 11:04:24,003] Trial 138 finished with values: [-1000000000.0, 1000000000.0] and parameters: {'p_sma': 11, 'p_std': 28, 'p_atr': 20, 'p_adx': 27, 'rsi_period': 33, 'ema1': 24, 'ema2': 21, 'slip_atr_k': 0.025206222211235033, 'slip_spread_k': 0.8768873654882953, 'spread_hl_frac': 0.004888140264633838, 'bb_std_mult': 3.3188273637137122, 'rsi_os': 22, 'rsi_ob': 57, 'vol_spike': 0.023382298058188422, 'adx_thresh': 6.3773282501830515, 'atr_min_pct': 0.016342711101474863, 'atr_max_pct': 0.12209790123615383, 'tp_mult': 1.7355365671309482, 'tsl_mult': 0.9088670069540323, 'strategy': 'mean_reversion', 'time_stop': 270, 'use_sma': True, 'use_atr': True, 'use_adx': True, 'use_ema': True, 'use_spike': False, 'rsi_required': False, 'edge_k': 1.482282872200848, 'edge_cap': 0.8785762500130276, 'bull_strategy': 'breakout', 'bull_bb_std_mult': 2.517472662050246, 'bull_rsi_os': 37, 'bull_rsi_ob': 80, 'bull_adx_thresh': 28.47339182459187, 'bull_atr_min_pct': 0.022064223323405137, 'bull_atr_max_pct': 0.08725756299461104, 'bull_tp_mult': 1.5733944940817917, 'bull_tsl_mult': 0.6541527838221208, 'bull_time_stop': 187, 'bull_use_sma': True, 'bull_use_ema': False, 'bull_use_atr': True, 'bull_use_adx': True, 'bull_use_spike': True, 'bull_rsi_required': False, 'bear_strategy': 'mean_reversion', 'bear_bb_std_mult': 1.2395440399502882, 'bear_rsi_os': 42, 'bear_rsi_ob': 49, 'bear_adx_thresh': 14.40539272742839, 'bear_atr_min_pct': 0.027545652320071407, 'bear_atr_max_pct': 0.13974502713332454, 'bear_tp_mult': 1.6705663172784104, 'bear_tsl_mult': 0.19138610625996152, 'bear_time_stop': 281, 'bear_use_sma': False, 'bear_use_ema': False, 'bear_use_atr': True, 'bear_use_adx': False, 'bear_use_spike': True, 'bear_rsi_required': True, 'sideways_strategy': 'mean_reversion', 'sideways_bb_std_mult': 0.9745863090623494, 'sideways_rsi_os': 38, 'sideways_rsi_ob': 76, 'sideways_adx_thresh': 13.343836021336834, 'sideways_atr_min_pct': 0.021148183143599102, 'sideways_atr_max_pct': 0.10003107359501226, 'sideways_tp_mult': 2.0591219620237373, 'sideways_tsl_mult': 0.013670529276433745, 'sideways_time_stop': 149, 'sideways_use_sma': True, 'sideways_use_ema': True, 'sideways_use_atr': True, 'sideways_use_adx': False, 'sideways_use_spike': False, 'sideways_rsi_required': True}.
[I 2025-09-01 11:04:24,004] Trial 136 finished with values: [-1000000000.0, 1000000000.0] and parameters: {'p_sma': 11, 'p_std': 23, 'p_atr': 9, 'p_adx': 26, 'rsi_period': 33, 'ema1': 5, 'ema2': 48, 'slip_atr_k': 0.017738661577471712, 'slip_spread_k': 0.21961652113718677, 'spread_hl_frac': 0.0044904357997044, 'bb_std_mult': 0.5525905346882362, 'rsi_os': 27, 'rsi_ob': 95, 'vol_spike': 0.14915673124997825, 'adx_thresh': 5.668642232733965, 'atr_min_pct': 0.0176904015349785, 'atr_max_pct': 0.029610684355548395, 'tp_mult': 2.108797987719008, 'tsl_mult': 0.5709356907597053, 'strategy': 'mean_reversion', 'time_stop': 160, 'use_sma': True, 'use_atr': True, 'use_adx': True, 'use_ema': True, 'use_spike': False, 'rsi_required': True, 'edge_k': 1.8756217142180174, 'edge_cap': 0.6776085214311971, 'bull_strategy': 'breakout', 'bull_bb_std_mult': 2.264506903637007, 'bull_rsi_os': 37, 'bull_rsi_ob': 80, 'bull_adx_thresh': 30.394227107907348, 'bull_atr_min_pct': 0.003215095137511478, 'bull_atr_max_pct': 0.12405143264820287, 'bull_tp_mult': 1.1604873366163182, 'bull_tsl_mult': 0.969378765397066, 'bull_time_stop': 82, 'bull_use_sma': True, 'bull_use_ema': False, 'bull_use_atr': True, 'bull_use_adx': True, 'bull_use_spike': True, 'bull_rsi_required': False, 'bear_strategy': 'mean_reversion', 'bear_bb_std_mult': 1.2462962934382842, 'bear_rsi_os': 38, 'bear_rsi_ob': 90, 'bear_adx_thresh': 33.170133896751345, 'bear_atr_min_pct': 0.02716900972068459, 'bear_atr_max_pct': 0.14617222704590396, 'bear_tp_mult': 1.5474440031336358, 'bear_tsl_mult': 0.144987247157513, 'bear_time_stop': 113, 'bear_use_sma': False, 'bear_use_ema': False, 'bear_use_atr': True, 'bear_use_adx': False, 'bear_use_spike': True, 'bear_rsi_required': False, 'sideways_strategy': 'mean_reversion', 'sideways_bb_std_mult': 3.250545684201219, 'sideways_rsi_os': 38, 'sideways_rsi_ob': 53, 'sideways_adx_thresh': 14.145018512849196, 'sideways_atr_min_pct': 0.018918464298249768, 'sideways_atr_max_pct': 0.09987423184143844, 'sideways_tp_mult': 1.535152365688584, 'sideways_tsl_mult': 0.020900373060302235, 'sideways_time_stop': 150, 'sideways_use_sma': False, 'sideways_use_ema': True, 'sideways_use_atr': False, 'sideways_use_adx': False, 'sideways_use_spike': False, 'sideways_rsi_required': True}.
[I 2025-09-01 11:05:05,456] Trial 140 finished with values: [-0.010964669997420629, 0.010959705754449219] and parameters: {'p_sma': 30, 'p_std': 41, 'p_atr': 8, 'p_adx': 26, 'rsi_period': 71, 'ema1': 13, 'ema2': 23, 'slip_atr_k': 0.18525999221476697, 'slip_spread_k': 0.8458183339477443, 'spread_hl_frac': 0.004657593352431161, 'bb_std_mult': 2.4804145051490627, 'rsi_os': 22, 'rsi_ob': 57, 'vol_spike': 0.14258329029223446, 'adx_thresh': 17.125892126825097, 'atr_min_pct': 0.01818187021535607, 'atr_max_pct': 0.11127963747512745, 'tp_mult': 1.9259415947816905, 'tsl_mult': 0.14708693556374625, 'strategy': 'breakout', 'time_stop': 158, 'use_sma': False, 'use_atr': True, 'use_adx': True, 'use_ema': True, 'use_spike': False, 'rsi_required': False, 'edge_k': 1.3653702216232424, 'edge_cap': 0.5486575168217996, 'bull_strategy': 'breakout', 'bull_bb_std_mult': 2.530827329528638, 'bull_rsi_os': 38, 'bull_rsi_ob': 47, 'bull_adx_thresh': 26.851659067558913, 'bull_atr_min_pct': 0.002531622809961519, 'bull_atr_max_pct': 0.10573020566819462, 'bull_tp_mult': 1.8028914909040685, 'bull_tsl_mult': 0.9474587864278756, 'bull_time_stop': 227, 'bull_use_sma': True, 'bull_use_ema': True, 'bull_use_atr': False, 'bull_use_adx': False, 'bull_use_spike': True, 'bull_rsi_required': True, 'bear_strategy': 'breakout', 'bear_bb_std_mult': 1.14777890316001, 'bear_rsi_os': 42, 'bear_rsi_ob': 76, 'bear_adx_thresh': 33.14518043754223, 'bear_atr_min_pct': 0.02275708190762972, 'bear_atr_max_pct': 0.13270637846586802, 'bear_tp_mult': 1.7505830870794372, 'bear_tsl_mult': 0.25423717481644503, 'bear_time_stop': 141, 'bear_use_sma': True, 'bear_use_ema': False, 'bear_use_atr': True, 'bear_use_adx': True, 'bear_use_spike': True, 'bear_rsi_required': True, 'sideways_strategy': 'mean_reversion', 'sideways_bb_std_mult': 3.263633467053116, 'sideways_rsi_os': 21, 'sideways_rsi_ob': 62, 'sideways_adx_thresh': 15.893411738477491, 'sideways_atr_min_pct': 0.02091276975973657, 'sideways_atr_max_pct': 0.10923241995802067, 'sideways_tp_mult': 2.2749367214808105, 'sideways_tsl_mult': 0.08778381487582199, 'sideways_time_stop': 154, 'sideways_use_sma': False, 'sideways_use_ema': False, 'sideways_use_atr': True, 'sideways_use_adx': True, 'sideways_use_spike': False, 'sideways_rsi_required': False}.
[I 2025-09-01 11:05:05,828] Trial 141 finished with values: [-1000000000.0, 1000000000.0] and parameters: {'p_sma': 9, 'p_std': 28, 'p_atr': 25, 'p_adx': 26, 'rsi_period': 37, 'ema1': 13, 'ema2': 24, 'slip_atr_k': 0.03155717485054904, 'slip_spread_k': 0.8678411671759211, 'spread_hl_frac': 0.031227897253342046, 'bb_std_mult': 2.8715012360042795, 'rsi_os': 28, 'rsi_ob': 90, 'vol_spike': 0.14152583081794026, 'adx_thresh': 11.230779201974869, 'atr_min_pct': 0.014772950911901029, 'atr_max_pct': 0.02938025794625599, 'tp_mult': 1.9307153669415695, 'tsl_mult': 0.40301424049273543, 'strategy': 'breakout', 'time_stop': 215, 'use_sma': False, 'use_atr': True, 'use_adx': True, 'use_ema': True, 'use_spike': False, 'rsi_required': False, 'edge_k': 0.8769969231771828, 'edge_cap': 0.45968885889921185, 'bull_strategy': 'breakout', 'bull_bb_std_mult': 2.266570104064937, 'bull_rsi_os': 38, 'bull_rsi_ob': 76, 'bull_adx_thresh': 31.110936042358148, 'bull_atr_min_pct': 0.002479422027758091, 'bull_atr_max_pct': 0.10750405764740867, 'bull_tp_mult': 1.5776108492239838, 'bull_tsl_mult': 0.45849010658293715, 'bull_time_stop': 14, 'bull_use_sma': True, 'bull_use_ema': True, 'bull_use_atr': False, 'bull_use_adx': False, 'bull_use_spike': True, 'bull_rsi_required': True, 'bear_strategy': 'breakout', 'bear_bb_std_mult': 2.6171513014962446, 'bear_rsi_os': 42, 'bear_rsi_ob': 49, 'bear_adx_thresh': 17.35591047642228, 'bear_atr_min_pct': 0.027435516331317543, 'bear_atr_max_pct': 0.07228341367499624, 'bear_tp_mult': 1.7653769727414148, 'bear_tsl_mult': 0.8432633028767003, 'bear_time_stop': 141, 'bear_use_sma': True, 'bear_use_ema': False, 'bear_use_atr': True, 'bear_use_adx': True, 'bear_use_spike': True, 'bear_rsi_required': True, 'sideways_strategy': 'mean_reversion', 'sideways_bb_std_mult': 3.0486933822167415, 'sideways_rsi_os': 21, 'sideways_rsi_ob': 46, 'sideways_adx_thresh': 28.598034380936923, 'sideways_atr_min_pct': 0.023857470187141804, 'sideways_atr_max_pct': 0.10907705151650852, 'sideways_tp_mult': 2.758111521779492, 'sideways_tsl_mult': 0.08284006589510202, 'sideways_time_stop': 113, 'sideways_use_sma': False, 'sideways_use_ema': False, 'sideways_use_atr': True, 'sideways_use_adx': True, 'sideways_use_spike': False, 'sideways_rsi_required': False}.
[I 2025-09-01 11:05:06,481] Trial 142 finished with values: [-1000000000.0, 1000000000.0] and parameters: {'p_sma': 33, 'p_std': 40, 'p_atr': 24, 'p_adx': 23, 'rsi_period': 35, 'ema1': 19, 'ema2': 53, 'slip_atr_k': 0.030048570674260675, 'slip_spread_k': 0.17797855563576773, 'spread_hl_frac': 0.031550700003210155, 'bb_std_mult': 1.217412580727916, 'rsi_os': 28, 'rsi_ob': 63, 'vol_spike': 0.18320262108110397, 'adx_thresh': 17.26585220439736, 'atr_min_pct': 0.01868049484556611, 'atr_max_pct': 0.11062616832771074, 'tp_mult': 1.9190339424179605, 'tsl_mult': 0.0731806203223373, 'strategy': 'breakout', 'time_stop': 134, 'use_sma': False, 'use_atr': False, 'use_adx': True, 'use_ema': True, 'use_spike': True, 'rsi_required': True, 'edge_k': 1.9293412307210651, 'edge_cap': 0.37226498617504744, 'bull_strategy': 'breakout', 'bull_bb_std_mult': 3.036964031692408, 'bull_rsi_os': 27, 'bull_rsi_ob': 51, 'bull_adx_thresh': 31.029845870910023, 'bull_atr_min_pct': 0.008730935706391232, 'bull_atr_max_pct': 0.010007278382466483, 'bull_tp_mult': 1.4555191784453039, 'bull_tsl_mult': 0.7779268677322132, 'bull_time_stop': 173, 'bull_use_sma': False, 'bull_use_ema': True, 'bull_use_atr': False, 'bull_use_adx': False, 'bull_use_spike': True, 'bull_rsi_required': True, 'bear_strategy': 'breakout', 'bear_bb_std_mult': 2.5792973659063687, 'bear_rsi_os': 41, 'bear_rsi_ob': 89, 'bear_adx_thresh': 31.655342549301928, 'bear_atr_min_pct': 0.022712553102714042, 'bear_atr_max_pct': 0.13328245825997045, 'bear_tp_mult': 1.9194447805373025, 'bear_tsl_mult': 0.2516476510078567, 'bear_time_stop': 55, 'bear_use_sma': True, 'bear_use_ema': True, 'bear_use_atr': False, 'bear_use_adx': True, 'bear_use_spike': True, 'bear_rsi_required': False, 'sideways_strategy': 'breakout', 'sideways_bb_std_mult': 3.0421930298300133, 'sideways_rsi_os': 25, 'sideways_rsi_ob': 62, 'sideways_adx_thresh': 15.621053101155542, 'sideways_atr_min_pct': 0.025732585012659827, 'sideways_atr_max_pct': 0.03606210679200765, 'sideways_tp_mult': 2.273642847228259, 'sideways_tsl_mult': 0.29479911180720264, 'sideways_time_stop': 102, 'sideways_use_sma': False, 'sideways_use_ema': False, 'sideways_use_atr': False, 'sideways_use_adx': True, 'sideways_use_spike': True, 'sideways_rsi_required': False}.
[I 2025-09-01 11:05:07,173] Trial 143 finished with values: [-1000000000.0, 1000000000.0] and parameters: {'p_sma': 40, 'p_std': 21, 'p_atr': 8, 'p_adx': 23, 'rsi_period': 37, 'ema1': 19, 'ema2': 51, 'slip_atr_k': 0.03208471693907859, 'slip_spread_k': 0.30312515628483255, 'spread_hl_frac': 0.03108082544906779, 'bb_std_mult': 1.2601787656785732, 'rsi_os': 34, 'rsi_ob': 77, 'vol_spike': 0.14015191756591547, 'adx_thresh': 27.417021782994663, 'atr_min_pct': 0.018480383935642702, 'atr_max_pct': 0.06760829050869444, 'tp_mult': 1.8505453398967704, 'tsl_mult': 0.8204333412014235, 'strategy': 'breakout', 'time_stop': 85, 'use_sma': False, 'use_atr': False, 'use_adx': True, 'use_ema': True, 'use_spike': True, 'rsi_required': True, 'edge_k': 1.9242268522748995, 'edge_cap': 0.454662546392195, 'bull_strategy': 'breakout', 'bull_bb_std_mult': 1.1537194600217318, 'bull_rsi_os': 30, 'bull_rsi_ob': 93, 'bull_adx_thresh': 31.310473586901804, 'bull_atr_min_pct': 0.009024624540728315, 'bull_atr_max_pct': 0.09746468943179472, 'bull_tp_mult': 2.7797229145345836, 'bull_tsl_mult': 0.9068423324320465, 'bull_time_stop': 226, 'bull_use_sma': False, 'bull_use_ema': True, 'bull_use_atr': False, 'bull_use_adx': False, 'bull_use_spike': True, 'bull_rsi_required': True, 'bear_strategy': 'breakout', 'bear_bb_std_mult': 3.1301971958012, 'bear_rsi_os': 34, 'bear_rsi_ob': 92, 'bear_adx_thresh': 22.833804440222135, 'bear_atr_min_pct': 0.022749645407034176, 'bear_atr_max_pct': 0.10548778855128019, 'bear_tp_mult': 1.3721858605046426, 'bear_tsl_mult': 0.25871683067681206, 'bear_time_stop': 150, 'bear_use_sma': True, 'bear_use_ema': True, 'bear_use_atr': False, 'bear_use_adx': True, 'bear_use_spike': True, 'bear_rsi_required': False, 'sideways_strategy': 'breakout', 'sideways_bb_std_mult': 0.7641305729593584, 'sideways_rsi_os': 31, 'sideways_rsi_ob': 63, 'sideways_adx_thresh': 15.670254552648997, 'sideways_atr_min_pct': 0.023819319645705106, 'sideways_atr_max_pct': 0.038151709605731145, 'sideways_tp_mult': 2.020099810970818, 'sideways_tsl_mult': 0.08954674816674885, 'sideways_time_stop': 103, 'sideways_use_sma': False, 'sideways_use_ema': False, 'sideways_use_atr': False, 'sideways_use_adx': True, 'sideways_use_spike': True, 'sideways_rsi_required': False}.
