[I 2025-09-01 11:32:39,776] Trial 332 finished with values: [-1000000000.0, 1000000000.0] and parameters: {'p_sma': 10, 'p_std': 37, 'p_atr': 18, 'p_adx': 9, 'rsi_period': 53, 'ema1': 19, 'ema2': 15, 'slip_atr_k': 0.012763068999938613, 'slip_spread_k': 0.37634349436479253, 'spread_hl_frac': 0.02510681039258109, 'bb_std_mult': 3.286382931575621, 'rsi_os': 28, 'rsi_ob': 87, 'vol_spike': 0.27004393033806784, 'adx_thresh': 23.258851491026483, 'atr_min_pct': 0.02734711615378018, 'atr_max_pct': 0.028550789061518384, 'tp_mult': 2.3840861309640364, 'tsl_mult': 0.9030709733830374, 'strategy': 'breakout', 'time_stop': 268, 'use_sma': False, 'use_atr': False, 'use_adx': False, 'use_ema': True, 'use_spike': True, 'rsi_required': False, 'edge_k': 0.35091657852791436, 'edge_cap': 0.22926172849134685, 'bull_strategy': 'breakout', 'bull_bb_std_mult': 0.7180820964857181, 'bull_rsi_os': 51, 'bull_rsi_ob': 83, 'bull_adx_thresh': 5.165098350293547, 'bull_atr_min_pct': 0.003841639973386261, 'bull_atr_max_pct': 0.09658542748726263, 'bull_tp_mult': 1.9714243141844972, 'bull_tsl_mult': 0.45002673958318257, 'bull_time_stop': 286, 'bull_use_sma': True, 'bull_use_ema': True, 'bull_use_atr': True, 'bull_use_adx': True, 'bull_use_spike': True, 'bull_rsi_required': False, 'bear_strategy': 'breakout', 'bear_bb_std_mult': 0.9998500917088797, 'bear_rsi_os': 12, 'bear_rsi_ob': 47, 'bear_adx_thresh': 9.064408894953342, 'bear_atr_min_pct': 0.004462146447947805, 'bear_atr_max_pct': 0.03533424283422646, 'bear_tp_mult': 1.3432394991669547, 'bear_tsl_mult': 0.9481547531029018, 'bear_time_stop': 78, 'bear_use_sma': True, 'bear_use_ema': True, 'bear_use_atr': False, 'bear_use_adx': False, 'bear_use_spike': True, 'bear_rsi_required': True, 'sideways_strategy': 'mean_reversion', 'sideways_bb_std_mult': 1.8322253180543941, 'sideways_rsi_os': 39, 'sideways_rsi_ob': 93, 'sideways_adx_thresh': 6.046500758631698, 'sideways_atr_min_pct': 0.022042922609964512, 'sideways_atr_max_pct': 0.07765280977400828, 'sideways_tp_mult': 1.4084322751076188, 'sideways_tsl_mult': 0.4273822073003038, 'sideways_time_stop': 242, 'sideways_use_sma': True, 'sideways_use_ema': True, 'sideways_use_atr': True, 'sideways_use_adx': False, 'sideways_use_spike': False, 'sideways_rsi_required': True}.
[I 2025-09-01 11:33:21,987] Trial 334 finished with values: [-1000000000.0, 1000000000.0] and parameters: {'p_sma': 10, 'p_std': 38, 'p_atr': 19, 'p_adx': 9, 'rsi_period': 56, 'ema1': 19, 'ema2': 14, 'slip_atr_k': 0.0042222418686027035, 'slip_spread_k': 0.3370540281933604, 'spread_hl_frac': 0.025712701999013866, 'bb_std_mult': 3.093816484643099, 'rsi_os': 28, 'rsi_ob': 85, 'vol_spike': 0.2695963107298597, 'adx_thresh': 22.48582493894382, 'atr_min_pct': 0.027742668610530673, 'atr_max_pct': 0.02948436674234928, 'tp_mult': 2.1691532565464366, 'tsl_mult': 0.8995162937431591, 'strategy': 'breakout', 'time_stop': 267, 'use_sma': False, 'use_atr': False, 'use_adx': False, 'use_ema': True, 'use_spike': True, 'rsi_required': False, 'edge_k': 0.351718915712297, 'edge_cap': 0.24127894094744456, 'bull_strategy': 'breakout', 'bull_bb_std_mult': 0.6160418772079158, 'bull_rsi_os': 51, 'bull_rsi_ob': 84, 'bull_adx_thresh': 7.77343108772833, 'bull_atr_min_pct': 0.004059921110859382, 'bull_atr_max_pct': 0.09536256354390296, 'bull_tp_mult': 1.973312099173208, 'bull_tsl_mult': 0.5605548972366785, 'bull_time_stop': 288, 'bull_use_sma': True, 'bull_use_ema': True, 'bull_use_atr': True, 'bull_use_adx': True, 'bull_use_spike': True, 'bull_rsi_required': False, 'bear_strategy': 'breakout', 'bear_bb_std_mult': 0.9915382537839005, 'bear_rsi_os': 11, 'bear_rsi_ob': 47, 'bear_adx_thresh': 10.151212486553192, 'bear_atr_min_pct': 0.004392835368025225, 'bear_atr_max_pct': 0.031424549974250544, 'bear_tp_mult': 1.2713070737505483, 'bear_tsl_mult': 0.9544792036390981, 'bear_time_stop': 85, 'bear_use_sma': True, 'bear_use_ema': True, 'bear_use_atr': False, 'bear_use_adx': False, 'bear_use_spike': True, 'bear_rsi_required': True, 'sideways_strategy': 'mean_reversion', 'sideways_bb_std_mult': 1.9115671458199937, 'sideways_rsi_os': 40, 'sideways_rsi_ob': 93, 'sideways_adx_thresh': 6.146539084583581, 'sideways_atr_min_pct': 0.023863839855891515, 'sideways_atr_max_pct': 0.08360078137044873, 'sideways_tp_mult': 1.4734178194153524, 'sideways_tsl_mult': 0.3928144836499246, 'sideways_time_stop': 247, 'sideways_use_sma': True, 'sideways_use_ema': True, 'sideways_use_atr': True, 'sideways_use_adx': False, 'sideways_use_spike': False, 'sideways_rsi_required': True}.
[I 2025-09-01 11:33:23,482] Trial 337 finished with values: [-1000000000.0, 1000000000.0] and parameters: {'p_sma': 12, 'p_std': 39, 'p_atr': 19, 'p_adx': 10, 'rsi_period': 56, 'ema1': 20, 'ema2': 19, 'slip_atr_k': 0.004099594356559048, 'slip_spread_k': 0.38558230514355835, 'spread_hl_frac': 0.025338747725129014, 'bb_std_mult': 3.0929095231204506, 'rsi_os': 27, 'rsi_ob': 84, 'vol_spike': 0.2629431356533689, 'adx_thresh': 21.65879914541996, 'atr_min_pct': 0.0265497691030198, 'atr_max_pct': 0.030367953588724517, 'tp_mult': 2.282533160089891, 'tsl_mult': 0.8799853033403497, 'strategy': 'breakout', 'time_stop': 263, 'use_sma': False, 'use_atr': False, 'use_adx': False, 'use_ema': True, 'use_spike': True, 'rsi_required': False, 'edge_k': 0.40475362669496917, 'edge_cap': 0.21115856994906915, 'bull_strategy': 'breakout', 'bull_bb_std_mult': 0.6312144904807439, 'bull_rsi_os': 50, 'bull_rsi_ob': 84, 'bull_adx_thresh': 7.208200617177215, 'bull_atr_min_pct': 0.0034259357297747265, 'bull_atr_max_pct': 0.09375414975580976, 'bull_tp_mult': 2.0059613865782007, 'bull_tsl_mult': 0.6695229383453293, 'bull_time_stop': 300, 'bull_use_sma': True, 'bull_use_ema': True, 'bull_use_atr': True, 'bull_use_adx': False, 'bull_use_spike': True, 'bull_rsi_required': False, 'bear_strategy': 'mean_reversion', 'bear_bb_std_mult': 0.944647686297176, 'bear_rsi_os': 18, 'bear_rsi_ob': 48, 'bear_adx_thresh': 9.925132120093501, 'bear_atr_min_pct': 0.00373412631809842, 'bear_atr_max_pct': 0.030210485914285316, 'bear_tp_mult': 1.2691916432502894, 'bear_tsl_mult': 0.9876803052719325, 'bear_time_stop': 85, 'bear_use_sma': True, 'bear_use_ema': True, 'bear_use_atr': False, 'bear_use_adx': False, 'bear_use_spike': True, 'bear_rsi_required': True, 'sideways_strategy': 'mean_reversion', 'sideways_bb_std_mult': 2.112894913121407, 'sideways_rsi_os': 38, 'sideways_rsi_ob': 94, 'sideways_adx_thresh': 5.401849309900241, 'sideways_atr_min_pct': 0.023508761136044887, 'sideways_atr_max_pct': 0.08029355665849619, 'sideways_tp_mult': 1.4626172396789787, 'sideways_tsl_mult': 0.39615118686932294, 'sideways_time_stop': 265, 'sideways_use_sma': True, 'sideways_use_ema': True, 'sideways_use_atr': True, 'sideways_use_adx': False, 'sideways_use_spike': True, 'sideways_rsi_required': True}.
[I 2025-09-01 11:33:24,317] Trial 336 finished with values: [-0.02327182703278763, 0.024828723979432473] and parameters: {'p_sma': 28, 'p_std': 40, 'p_atr': 18, 'p_adx': 10, 'rsi_period': 56, 'ema1': 20, 'ema2': 19, 'slip_atr_k': 0.004155612893765539, 'slip_spread_k': 0.409319417365691, 'spread_hl_frac': 0.0254605892614269, 'bb_std_mult': 3.0993627462072664, 'rsi_os': 27, 'rsi_ob': 84, 'vol_spike': 0.26912026749588536, 'adx_thresh': 23.151551573973155, 'atr_min_pct': 0.027996365747176382, 'atr_max_pct': 0.029892265096731686, 'tp_mult': 2.1825391001885834, 'tsl_mult': 0.8854404697957081, 'strategy': 'breakout', 'time_stop': 264, 'use_sma': False, 'use_atr': False, 'use_adx': False, 'use_ema': True, 'use_spike': True, 'rsi_required': False, 'edge_k': 0.4058852602179197, 'edge_cap': 0.2073084282328519, 'bull_strategy': 'breakout', 'bull_bb_std_mult': 0.6146851666483455, 'bull_rsi_os': 51, 'bull_rsi_ob': 84, 'bull_adx_thresh': 6.987116856026807, 'bull_atr_min_pct': 0.003382535779458929, 'bull_atr_max_pct': 0.0956494413229161, 'bull_tp_mult': 1.9835321139360644, 'bull_tsl_mult': 0.5522187662378274, 'bull_time_stop': 288, 'bull_use_sma': True, 'bull_use_ema': True, 'bull_use_atr': True, 'bull_use_adx': True, 'bull_use_spike': True, 'bull_rsi_required': False, 'bear_strategy': 'breakout', 'bear_bb_std_mult': 0.9850063229901891, 'bear_rsi_os': 15, 'bear_rsi_ob': 48, 'bear_adx_thresh': 8.947491491195676, 'bear_atr_min_pct': 0.002317384634365729, 'bear_atr_max_pct': 0.030435673778703667, 'bear_tp_mult': 1.2697730944720844, 'bear_tsl_mult': 0.9883755200624953, 'bear_time_stop': 52, 'bear_use_sma': True, 'bear_use_ema': True, 'bear_use_atr': False, 'bear_use_adx': False, 'bear_use_spike': True, 'bear_rsi_required': True, 'sideways_strategy': 'mean_reversion', 'sideways_bb_std_mult': 1.9418113965786274, 'sideways_rsi_os': 38, 'sideways_rsi_ob': 93, 'sideways_adx_thresh': 5.4114116890549315, 'sideways_atr_min_pct': 0.02230325029421592, 'sideways_atr_max_pct': 0.08018017910231448, 'sideways_tp_mult': 1.4657966918599388, 'sideways_tsl_mult': 0.38167013689511964, 'sideways_time_stop': 264, 'sideways_use_sma': True, 'sideways_use_ema': True, 'sideways_use_atr': True, 'sideways_use_adx': False, 'sideways_use_spike': True, 'sideways_rsi_required': True}.
[I 2025-09-01 11:33:24,728] Trial 335 finished with values: [-1000000000.0, 1000000000.0] and parameters: {'p_sma': 10, 'p_std': 40, 'p_atr': 18, 'p_adx': 10, 'rsi_period': 56, 'ema1': 20, 'ema2': 19, 'slip_atr_k': 0.01754513263455059, 'slip_spread_k': 0.3942977315738874, 'spread_hl_frac': 0.025082382539380617, 'bb_std_mult': 3.1161075980249233, 'rsi_os': 27, 'rsi_ob': 84, 'vol_spike': 0.26748280742655844, 'adx_thresh': 23.001923494711487, 'atr_min_pct': 0.026295968018230892, 'atr_max_pct': 0.02935794834311834, 'tp_mult': 2.1795079636442116, 'tsl_mult': 0.9343591555889978, 'strategy': 'breakout', 'time_stop': 263, 'use_sma': False, 'use_atr': False, 'use_adx': False, 'use_ema': True, 'use_spike': True, 'rsi_required': False, 'edge_k': 0.42058709760407226, 'edge_cap': 0.2113533369774451, 'bull_strategy': 'breakout', 'bull_bb_std_mult': 0.6237587923808592, 'bull_rsi_os': 51, 'bull_rsi_ob': 84, 'bull_adx_thresh': 6.194353300468011, 'bull_atr_min_pct': 0.0038115080142329116, 'bull_atr_max_pct': 0.09414811355825174, 'bull_tp_mult': 1.9918916348451463, 'bull_tsl_mult': 0.5227664173243937, 'bull_time_stop': 287, 'bull_use_sma': True, 'bull_use_ema': True, 'bull_use_atr': True, 'bull_use_adx': True, 'bull_use_spike': True, 'bull_rsi_required': False, 'bear_strategy': 'breakout', 'bear_bb_std_mult': 0.9869346189902934, 'bear_rsi_os': 18, 'bear_rsi_ob': 48, 'bear_adx_thresh': 8.981940241828417, 'bear_atr_min_pct': 0.003967166152359876, 'bear_atr_max_pct': 0.03142512163188492, 'bear_tp_mult': 1.2591373084607687, 'bear_tsl_mult': 0.9828660734198179, 'bear_time_stop': 51, 'bear_use_sma': True, 'bear_use_ema': True, 'bear_use_atr': False, 'bear_use_adx': False, 'bear_use_spike': True, 'bear_rsi_required': True, 'sideways_strategy': 'mean_reversion', 'sideways_bb_std_mult': 1.6619407964636381, 'sideways_rsi_os': 38, 'sideways_rsi_ob': 93, 'sideways_adx_thresh': 5.805904618186999, 'sideways_atr_min_pct': 0.02211549168656899, 'sideways_atr_max_pct': 0.08088163552520311, 'sideways_tp_mult': 1.4610471109861953, 'sideways_tsl_mult': 0.3938158233687193, 'sideways_time_stop': 253, 'sideways_use_sma': True, 'sideways_use_ema': True, 'sideways_use_atr': True, 'sideways_use_adx': False, 'sideways_use_spike': True, 'sideways_rsi_required': True}.
[I 2025-09-01 11:34:06,245] Trial 340 finished with values: [-1000000000.0, 1000000000.0] and parameters: {'p_sma': 12, 'p_std': 39, 'p_atr': 19, 'p_adx': 8, 'rsi_period': 51, 'ema1': 20, 'ema2': 12, 'slip_atr_k': 0.09375056671346592, 'slip_spread_k': 0.35419369351875046, 'spread_hl_frac': 0.027522173136919143, 'bb_std_mult': 3.2079065671149767, 'rsi_os': 27, 'rsi_ob': 85, 'vol_spike': 0.28449117484233544, 'adx_thresh': 21.497797662636145, 'atr_min_pct': 0.028069523646136196, 'atr_max_pct': 0.03239459862867639, 'tp_mult': 2.1359816113087606, 'tsl_mult': 0.9325483952659992, 'strategy': 'breakout', 'time_stop': 276, 'use_sma': False, 'use_atr': False, 'use_adx': False, 'use_ema': True, 'use_spike': True, 'rsi_required': False, 'edge_k': 0.31212655590382254, 'edge_cap': 0.26165516207562267, 'bull_strategy': 'breakout', 'bull_bb_std_mult': 0.5518631669768348, 'bull_rsi_os': 50, 'bull_rsi_ob': 85, 'bull_adx_thresh': 6.046124526265898, 'bull_atr_min_pct': 0.004417905375247541, 'bull_atr_max_pct': 0.10185834720363936, 'bull_tp_mult': 1.924130204072334, 'bull_tsl_mult': 0.6228331417735509, 'bull_time_stop': 271, 'bull_use_sma': True, 'bull_use_ema': True, 'bull_use_atr': False, 'bull_use_adx': True, 'bull_use_spike': False, 'bull_rsi_required': False, 'bear_strategy': 'breakout', 'bear_bb_std_mult': 1.0742557713277454, 'bear_rsi_os': 7, 'bear_rsi_ob': 60, 'bear_adx_thresh': 8.188882889160745, 'bear_atr_min_pct': 0.0025042020888625936, 'bear_atr_max_pct': 0.02816410181363156, 'bear_tp_mult': 1.312173426335353, 'bear_tsl_mult': 0.9167478424499276, 'bear_time_stop': 70, 'bear_use_sma': True, 'bear_use_ema': True, 'bear_use_atr': False, 'bear_use_adx': False, 'bear_use_spike': True, 'bear_rsi_required': True, 'sideways_strategy': 'mean_reversion', 'sideways_bb_std_mult': 1.6360210435918285, 'sideways_rsi_os': 40, 'sideways_rsi_ob': 92, 'sideways_adx_thresh': 6.679303418775193, 'sideways_atr_min_pct': 0.022527854430798782, 'sideways_atr_max_pct': 0.08642912407276838, 'sideways_tp_mult': 1.3293942940353953, 'sideways_tsl_mult': 0.35349290914545395, 'sideways_time_stop': 254, 'sideways_use_sma': True, 'sideways_use_ema': True, 'sideways_use_atr': True, 'sideways_use_adx': False, 'sideways_use_spike': False, 'sideways_rsi_required': False}.
[I 2025-09-01 11:34:07,137] Trial 339 finished with values: [-0.04480804425006302, 0.04556185816958025] and parameters: {'p_sma': 44, 'p_std': 39, 'p_atr': 18, 'p_adx': 8, 'rsi_period': 51, 'ema1': 20, 'ema2': 13, 'slip_atr_k': 0.13804200732808716, 'slip_spread_k': 0.40575206845803374, 'spread_hl_frac': 0.02746640785577665, 'bb_std_mult': 3.1782586164917173, 'rsi_os': 27, 'rsi_ob': 85, 'vol_spike': 0.2835179276718889, 'adx_thresh': 21.58044881566529, 'atr_min_pct': 0.028160681942794873, 'atr_max_pct': 0.03038500684665102, 'tp_mult': 2.1908597108693093, 'tsl_mult': 0.9342290884943816, 'strategy': 'breakout', 'time_stop': 276, 'use_sma': False, 'use_atr': False, 'use_adx': False, 'use_ema': True, 'use_spike': True, 'rsi_required': False, 'edge_k': 0.4066864212395955, 'edge_cap': 0.2503180360018824, 'bull_strategy': 'breakout', 'bull_bb_std_mult': 0.5618324485663526, 'bull_rsi_os': 50, 'bull_rsi_ob': 85, 'bull_adx_thresh': 6.029460937750851, 'bull_atr_min_pct': 0.0043603108113482725, 'bull_atr_max_pct': 0.09909290732324576, 'bull_tp_mult': 1.9028121248592176, 'bull_tsl_mult': 0.4727637111888201, 'bull_time_stop': 271, 'bull_use_sma': True, 'bull_use_ema': True, 'bull_use_atr': True, 'bull_use_adx': True, 'bull_use_spike': False, 'bull_rsi_required': False, 'bear_strategy': 'breakout', 'bear_bb_std_mult': 1.0688117912587134, 'bear_rsi_os': 14, 'bear_rsi_ob': 48, 'bear_adx_thresh': 8.99633708081089, 'bear_atr_min_pct': 0.0027523065179930915, 'bear_atr_max_pct': 0.029230343503373453, 'bear_tp_mult': 1.230714323652803, 'bear_tsl_mult': 0.9262365530745444, 'bear_time_stop': 52, 'bear_use_sma': True, 'bear_use_ema': True, 'bear_use_atr': False, 'bear_use_adx': False, 'bear_use_spike': True, 'bear_rsi_required': True, 'sideways_strategy': 'mean_reversion', 'sideways_bb_std_mult': 1.7084766465292012, 'sideways_rsi_os': 38, 'sideways_rsi_ob': 92, 'sideways_adx_thresh': 6.843053070515675, 'sideways_atr_min_pct': 0.02251244924966924, 'sideways_atr_max_pct': 0.0820014906322903, 'sideways_tp_mult': 1.3491714180105023, 'sideways_tsl_mult': 0.40746297042424184, 'sideways_time_stop': 259, 'sideways_use_sma': True, 'sideways_use_ema': True, 'sideways_use_atr': True, 'sideways_use_adx': False, 'sideways_use_spike': True, 'sideways_rsi_required': False}.
[I 2025-09-01 11:34:08,533] Trial 341 finished with values: [-1000000000.0, 1000000000.0] and parameters: {'p_sma': 13, 'p_std': 39, 'p_atr': 19, 'p_adx': 8, 'rsi_period': 51, 'ema1': 20, 'ema2': 18, 'slip_atr_k': 0.017394878079579366, 'slip_spread_k': 0.35341822573706316, 'spread_hl_frac': 0.02724776372624594, 'bb_std_mult': 3.1911080994353402, 'rsi_os': 27, 'rsi_ob': 85, 'vol_spike': 0.2805567550029485, 'adx_thresh': 21.55391329738651, 'atr_min_pct': 0.02822705213450773, 'atr_max_pct': 0.03144661175684504, 'tp_mult': 2.3074712773492267, 'tsl_mult': 0.9311606443098456, 'strategy': 'breakout', 'time_stop': 284, 'use_sma': False, 'use_atr': False, 'use_adx': False, 'use_ema': True, 'use_spike': True, 'rsi_required': False, 'edge_k': 0.31032529714913876, 'edge_cap': 0.2605968715302082, 'bull_strategy': 'breakout', 'bull_bb_std_mult': 0.5629059784621756, 'bull_rsi_os': 50, 'bull_rsi_ob': 82, 'bull_adx_thresh': 5.870455693543675, 'bull_atr_min_pct': 0.004299522524191105, 'bull_atr_max_pct': 0.14638458797573314, 'bull_tp_mult': 1.898071607095384, 'bull_tsl_mult': 0.47780551617655487, 'bull_time_stop': 293, 'bull_use_sma': True, 'bull_use_ema': True, 'bull_use_atr': False, 'bull_use_adx': False, 'bull_use_spike': False, 'bull_rsi_required': True, 'bear_strategy': 'mean_reversion', 'bear_bb_std_mult': 1.0700000982901297, 'bear_rsi_os': 16, 'bear_rsi_ob': 47, 'bear_adx_thresh': 9.469854111540156, 'bear_atr_min_pct': 0.003332003360825564, 'bear_atr_max_pct': 0.027759363686114168, 'bear_tp_mult': 1.206628181222285, 'bear_tsl_mult': 0.922251761765058, 'bear_time_stop': 63, 'bear_use_sma': True, 'bear_use_ema': True, 'bear_use_atr': False, 'bear_use_adx': False, 'bear_use_spike': True, 'bear_rsi_required': True, 'sideways_strategy': 'mean_reversion', 'sideways_bb_std_mult': 1.7147352174293966, 'sideways_rsi_os': 40, 'sideways_rsi_ob': 92, 'sideways_adx_thresh': 6.853895108066454, 'sideways_atr_min_pct': 0.022712349121849933, 'sideways_atr_max_pct': 0.08642335692894354, 'sideways_tp_mult': 1.3436129533782444, 'sideways_tsl_mult': 0.33152898631004435, 'sideways_time_stop': 260, 'sideways_use_sma': True, 'sideways_use_ema': True, 'sideways_use_atr': True, 'sideways_use_adx': False, 'sideways_use_spike': False, 'sideways_rsi_required': False}.
[I 2025-09-01 11:34:08,938] Trial 338 finished with values: [-1000000000.0, 1000000000.0] and parameters: {'p_sma': 12, 'p_std': 39, 'p_atr': 19, 'p_adx': 8, 'rsi_period': 50, 'ema1': 20, 'ema2': 19, 'slip_atr_k': 0.018343622449478743, 'slip_spread_k': 0.39729474791500297, 'spread_hl_frac': 0.027098886215633732, 'bb_std_mult': 3.1631465866157638, 'rsi_os': 27, 'rsi_ob': 84, 'vol_spike': 0.2816900222925328, 'adx_thresh': 21.70291601828967, 'atr_min_pct': 0.026264585175402075, 'atr_max_pct': 0.03128448404351867, 'tp_mult': 2.1935274342840194, 'tsl_mult': 0.9384145173987977, 'strategy': 'breakout', 'time_stop': 278, 'use_sma': False, 'use_atr': False, 'use_adx': False, 'use_ema': True, 'use_spike': True, 'rsi_required': False, 'edge_k': 0.38934634242478044, 'edge_cap': 0.2551819184374328, 'bull_strategy': 'breakout', 'bull_bb_std_mult': 0.5599752056851426, 'bull_rsi_os': 50, 'bull_rsi_ob': 85, 'bull_adx_thresh': 7.108046310852573, 'bull_atr_min_pct': 0.003490271150520377, 'bull_atr_max_pct': 0.09341360847451885, 'bull_tp_mult': 1.9918719872182689, 'bull_tsl_mult': 0.5225544279201272, 'bull_time_stop': 270, 'bull_use_sma': True, 'bull_use_ema': True, 'bull_use_atr': True, 'bull_use_adx': False, 'bull_use_spike': True, 'bull_rsi_required': False, 'bear_strategy': 'mean_reversion', 'bear_bb_std_mult': 0.9864917162469674, 'bear_rsi_os': 8, 'bear_rsi_ob': 48, 'bear_adx_thresh': 9.508947864272303, 'bear_atr_min_pct': 0.0024505829029050595, 'bear_atr_max_pct': 0.029277052859464598, 'bear_tp_mult': 1.231882345360448, 'bear_tsl_mult': 0.9758316619860465, 'bear_time_stop': 70, 'bear_use_sma': True, 'bear_use_ema': True, 'bear_use_atr': False, 'bear_use_adx': False, 'bear_use_spike': True, 'bear_rsi_required': True, 'sideways_strategy': 'mean_reversion', 'sideways_bb_std_mult': 1.7115067727476692, 'sideways_rsi_os': 38, 'sideways_rsi_ob': 94, 'sideways_adx_thresh': 5.440052872605927, 'sideways_atr_min_pct': 0.02324970965072611, 'sideways_atr_max_pct': 0.08042152785903056, 'sideways_tp_mult': 1.3385902353508847, 'sideways_tsl_mult': 0.40586596260350927, 'sideways_time_stop': 261, 'sideways_use_sma': True, 'sideways_use_ema': True, 'sideways_use_atr': True, 'sideways_use_adx': False, 'sideways_use_spike': True, 'sideways_rsi_required': False}.
