[I 2025-09-01 11:25:47,623] Trial 288 finished with values: [-0.025920708337498266, 0.02663920409147098] and parameters: {'p_sma': 57, 'p_std': 25, 'p_atr': 8, 'p_adx': 14, 'rsi_period': 44, 'ema1': 13, 'ema2': 38, 'slip_atr_k': 0.009127057683246412, 'slip_spread_k': 0.08820309491887471, 'spread_hl_frac': 0.02776599279419929, 'bb_std_mult': 3.399873227359058, 'rsi_os': 9, 'rsi_ob': 89, 'vol_spike': 0.09976490834325871, 'adx_thresh': 21.742440214328333, 'atr_min_pct': 0.0019617953295723925, 'atr_max_pct': 0.03403777084393842, 'tp_mult': 2.5554574134627175, 'tsl_mult': 0.8398635627927699, 'strategy': 'breakout', 'time_stop': 12, 'use_sma': False, 'use_atr': False, 'use_adx': False, 'use_ema': False, 'use_spike': True, 'rsi_required': True, 'edge_k': 0.6006596902890116, 'edge_cap': 0.12147917209640902, 'bull_strategy': 'breakout', 'bull_bb_std_mult': 1.4318021657967668, 'bull_rsi_os': 16, 'bull_rsi_ob': 68, 'bull_adx_thresh': 30.648927476766566, 'bull_atr_min_pct': 0.002466659565259756, 'bull_atr_max_pct': 0.09210758707754478, 'bull_tp_mult': 2.8105710603631575, 'bull_tsl_mult': 0.8673916298297137, 'bull_time_stop': 177, 'bull_use_sma': True, 'bull_use_ema': True, 'bull_use_atr': True, 'bull_use_adx': True, 'bull_use_spike': True, 'bull_rsi_required': False, 'bear_strategy': 'breakout', 'bear_bb_std_mult': 0.8718161698169764, 'bear_rsi_os': 12, 'bear_rsi_ob': 47, 'bear_adx_thresh': 25.61804014909653, 'bear_atr_min_pct': 0.0037146960876982375, 'bear_atr_max_pct': 0.0282962216042149, 'bear_tp_mult': 1.1408821765337436, 'bear_tsl_mult': 0.6500368775928375, 'bear_time_stop': 23, 'bear_use_sma': True, 'bear_use_ema': True, 'bear_use_atr': False, 'bear_use_adx': False, 'bear_use_spike': False, 'bear_rsi_required': False, 'sideways_strategy': 'mean_reversion', 'sideways_bb_std_mult': 0.9500506193848035, 'sideways_rsi_os': 19, 'sideways_rsi_ob': 85, 'sideways_adx_thresh': 34.124252824701045, 'sideways_atr_min_pct': 0.016712339559608217, 'sideways_atr_max_pct': 0.06056716456146699, 'sideways_tp_mult': 2.85041508066081, 'sideways_tsl_mult': 0.4444964128346118, 'sideways_time_stop': 257, 'sideways_use_sma': True, 'sideways_use_ema': True, 'sideways_use_atr': False, 'sideways_use_adx': False, 'sideways_use_spike': False, 'sideways_rsi_required': True}.
[I 2025-09-01 11:25:48,184] Trial 287 finished with values: [-0.009553181750989292, 0.01143644405640097] and parameters: {'p_sma': 11, 'p_std': 29, 'p_atr': 8, 'p_adx': 29, 'rsi_period': 44, 'ema1': 13, 'ema2': 37, 'slip_atr_k': 0.010250722857264232, 'slip_spread_k': 0.06312009921687764, 'spread_hl_frac': 0.04995038532827706, 'bb_std_mult': 2.7291430775801153, 'rsi_os': 7, 'rsi_ob': 89, 'vol_spike': 0.09233927724758761, 'adx_thresh': 21.523685524156996, 'atr_min_pct': 0.028663402616877637, 'atr_max_pct': 0.03440801849079689, 'tp_mult': 2.7295892481850483, 'tsl_mult': 0.8399276110448873, 'strategy': 'breakout', 'time_stop': 32, 'use_sma': False, 'use_atr': False, 'use_adx': False, 'use_ema': False, 'use_spike': True, 'rsi_required': True, 'edge_k': 0.70490714560227, 'edge_cap': 0.3323169565978891, 'bull_strategy': 'breakout', 'bull_bb_std_mult': 1.4149285993910181, 'bull_rsi_os': 15, 'bull_rsi_ob': 60, 'bull_adx_thresh': 34.27231224179738, 'bull_atr_min_pct': 0.0024350404068729766, 'bull_atr_max_pct': 0.027188165619061976, 'bull_tp_mult': 2.809738896615613, 'bull_tsl_mult': 0.8708149336078372, 'bull_time_stop': 184, 'bull_use_sma': True, 'bull_use_ema': True, 'bull_use_atr': True, 'bull_use_adx': True, 'bull_use_spike': True, 'bull_rsi_required': False, 'bear_strategy': 'breakout', 'bear_bb_std_mult': 0.8910461279208886, 'bear_rsi_os': 30, 'bear_rsi_ob': 47, 'bear_adx_thresh': 25.105726759887773, 'bear_atr_min_pct': 0.002331219452198805, 'bear_atr_max_pct': 0.11744046458908512, 'bear_tp_mult': 1.103258479771985, 'bear_tsl_mult': 0.837457206578129, 'bear_time_stop': 260, 'bear_use_sma': True, 'bear_use_ema': True, 'bear_use_atr': False, 'bear_use_adx': False, 'bear_use_spike': False, 'bear_rsi_required': False, 'sideways_strategy': 'mean_reversion', 'sideways_bb_std_mult': 1.215895590237096, 'sideways_rsi_os': 18, 'sideways_rsi_ob': 89, 'sideways_adx_thresh': 23.07006338380925, 'sideways_atr_min_pct': 0.018824586391603063, 'sideways_atr_max_pct': 0.07646477048503121, 'sideways_tp_mult': 1.697388962190058, 'sideways_tsl_mult': 0.3730307462600783, 'sideways_time_stop': 273, 'sideways_use_sma': True, 'sideways_use_ema': True, 'sideways_use_atr': False, 'sideways_use_adx': False, 'sideways_use_spike': False, 'sideways_rsi_required': True}.
[I 2025-09-01 11:25:48,985] Trial 292 finished with values: [-1000000000.0, 1000000000.0] and parameters: {'p_sma': 25, 'p_std': 25, 'p_atr': 7, 'p_adx': 8, 'rsi_period': 48, 'ema1': 22, 'ema2': 37, 'slip_atr_k': 0.12067110199087498, 'slip_spread_k': 0.8960541213798803, 'spread_hl_frac': 0.012563117000887433, 'bb_std_mult': 2.8702367231105357, 'rsi_os': 14, 'rsi_ob': 48, 'vol_spike': 0.12089510314730442, 'adx_thresh': 27.191571876661328, 'atr_min_pct': 0.0066561521934091275, 'atr_max_pct': 0.037492315022800524, 'tp_mult': 2.7370037058423344, 'tsl_mult': 0.8436619029653524, 'strategy': 'mean_reversion', 'time_stop': 253, 'use_sma': True, 'use_atr': False, 'use_adx': False, 'use_ema': True, 'use_spike': True, 'rsi_required': True, 'edge_k': 0.7325436135523224, 'edge_cap': 0.27909488988319003, 'bull_strategy': 'breakout', 'bull_bb_std_mult': 0.9827276776390463, 'bull_rsi_os': 36, 'bull_rsi_ob': 88, 'bull_adx_thresh': 30.203781692301117, 'bull_atr_min_pct': 0.00193453770627836, 'bull_atr_max_pct': 0.035312391549955295, 'bull_tp_mult': 2.3628826689631595, 'bull_tsl_mult': 0.8209359721940167, 'bull_time_stop': 61, 'bull_use_sma': True, 'bull_use_ema': True, 'bull_use_atr': True, 'bull_use_adx': True, 'bull_use_spike': False, 'bull_rsi_required': False, 'bear_strategy': 'mean_reversion', 'bear_bb_std_mult': 0.7470428751866878, 'bear_rsi_os': 6, 'bear_rsi_ob': 73, 'bear_adx_thresh': 27.949022632121547, 'bear_atr_min_pct': 0.01082518472520383, 'bear_atr_max_pct': 0.0879365321523749, 'bear_tp_mult': 1.1665707047537217, 'bear_tsl_mult': 0.353381585109232, 'bear_time_stop': 281, 'bear_use_sma': False, 'bear_use_ema': True, 'bear_use_atr': False, 'bear_use_adx': True, 'bear_use_spike': True, 'bear_rsi_required': False, 'sideways_strategy': 'mean_reversion', 'sideways_bb_std_mult': 3.4143974764163976, 'sideways_rsi_os': 9, 'sideways_rsi_ob': 88, 'sideways_adx_thresh': 24.262125468614386, 'sideways_atr_min_pct': 0.028390757722394216, 'sideways_atr_max_pct': 0.04514152222984172, 'sideways_tp_mult': 1.6082705164852649, 'sideways_tsl_mult': 0.5650381361999602, 'sideways_time_stop': 273, 'sideways_use_sma': True, 'sideways_use_ema': True, 'sideways_use_atr': False, 'sideways_use_adx': True, 'sideways_use_spike': False, 'sideways_rsi_required': True}.
[I 2025-09-01 11:25:49,012] Trial 291 finished with values: [-1000000000.0, 1000000000.0] and parameters: {'p_sma': 25, 'p_std': 25, 'p_atr': 7, 'p_adx': 30, 'rsi_period': 54, 'ema1': 7, 'ema2': 25, 'slip_atr_k': 0.1200983449250717, 'slip_spread_k': 0.7220256024645302, 'spread_hl_frac': 0.012848470357266632, 'bb_std_mult': 2.87959738349965, 'rsi_os': 14, 'rsi_ob': 48, 'vol_spike': 0.09247745101478409, 'adx_thresh': 24.3604428080788, 'atr_min_pct': 0.028643617451847497, 'atr_max_pct': 0.03912307916228872, 'tp_mult': 2.605626089500925, 'tsl_mult': 0.8418065062645465, 'strategy': 'mean_reversion', 'time_stop': 31, 'use_sma': True, 'use_atr': False, 'use_adx': False, 'use_ema': True, 'use_spike': True, 'rsi_required': True, 'edge_k': 0.8600414761916433, 'edge_cap': 0.28192462968944465, 'bull_strategy': 'breakout', 'bull_bb_std_mult': 0.987404830751206, 'bull_rsi_os': 46, 'bull_rsi_ob': 88, 'bull_adx_thresh': 30.53907685616594, 'bull_atr_min_pct': 0.0018810531052627045, 'bull_atr_max_pct': 0.051343797770060234, 'bull_tp_mult': 2.3621251998429846, 'bull_tsl_mult': 0.819342015354372, 'bull_time_stop': 233, 'bull_use_sma': True, 'bull_use_ema': True, 'bull_use_atr': True, 'bull_use_adx': True, 'bull_use_spike': False, 'bull_rsi_required': False, 'bear_strategy': 'mean_reversion', 'bear_bb_std_mult': 0.7142265991845724, 'bear_rsi_os': 26, 'bear_rsi_ob': 50, 'bear_adx_thresh': 14.92778959649275, 'bear_atr_min_pct': 0.0077372608715421, 'bear_atr_max_pct': 0.0569209150561157, 'bear_tp_mult': 2.5051644886761135, 'bear_tsl_mult': 0.3617079603601243, 'bear_time_stop': 82, 'bear_use_sma': False, 'bear_use_ema': True, 'bear_use_atr': False, 'bear_use_adx': True, 'bear_use_spike': True, 'bear_rsi_required': False, 'sideways_strategy': 'mean_reversion', 'sideways_bb_std_mult': 3.412598111175784, 'sideways_rsi_os': 21, 'sideways_rsi_ob': 86, 'sideways_adx_thresh': 24.057274422760493, 'sideways_atr_min_pct': 0.020677243148667784, 'sideways_atr_max_pct': 0.11842977779088482, 'sideways_tp_mult': 2.7150131976245233, 'sideways_tsl_mult': 0.35568296363150587, 'sideways_time_stop': 126, 'sideways_use_sma': True, 'sideways_use_ema': True, 'sideways_use_atr': False, 'sideways_use_adx': True, 'sideways_use_spike': False, 'sideways_rsi_required': True}.
[I 2025-09-01 11:26:32,465] Trial 294 finished with values: [-1000000000.0, 1000000000.0] and parameters: {'p_sma': 14, 'p_std': 22, 'p_atr': 12, 'p_adx': 30, 'rsi_period': 53, 'ema1': 20, 'ema2': 31, 'slip_atr_k': 0.021526042392693744, 'slip_spread_k': 0.10739176174195332, 'spread_hl_frac': 0.029458159058463954, 'bb_std_mult': 3.1104747014487155, 'rsi_os': 26, 'rsi_ob': 81, 'vol_spike': 0.26295781767207677, 'adx_thresh': 22.555832925675325, 'atr_min_pct': 0.02956141208408085, 'atr_max_pct': 0.04012480776870019, 'tp_mult': 2.5968238272811766, 'tsl_mult': 0.8221172931148792, 'strategy': 'mean_reversion', 'time_stop': 229, 'use_sma': True, 'use_atr': False, 'use_adx': False, 'use_ema': True, 'use_spike': True, 'rsi_required': True, 'edge_k': 0.3400537601152641, 'edge_cap': 0.843322843856638, 'bull_strategy': 'breakout', 'bull_bb_std_mult': 2.8339512651282357, 'bull_rsi_os': 48, 'bull_rsi_ob': 89, 'bull_adx_thresh': 11.284145999351594, 'bull_atr_min_pct': 0.017647547600325844, 'bull_atr_max_pct': 0.09492149618586053, 'bull_tp_mult': 2.7307454944235636, 'bull_tsl_mult': 0.1951876047643974, 'bull_time_stop': 140, 'bull_use_sma': True, 'bull_use_ema': True, 'bull_use_atr': True, 'bull_use_adx': False, 'bull_use_spike': True, 'bull_rsi_required': True, 'bear_strategy': 'mean_reversion', 'bear_bb_std_mult': 0.7228804949720263, 'bear_rsi_os': 32, 'bear_rsi_ob': 51, 'bear_adx_thresh': 24.539640850442986, 'bear_atr_min_pct': 0.026683045396058962, 'bear_atr_max_pct': 0.039003093008311895, 'bear_tp_mult': 2.511514914180111, 'bear_tsl_mult': 0.3137252511742, 'bear_time_stop': 86, 'bear_use_sma': False, 'bear_use_ema': True, 'bear_use_atr': False, 'bear_use_adx': False, 'bear_use_spike': True, 'bear_rsi_required': False, 'sideways_strategy': 'mean_reversion', 'sideways_bb_std_mult': 1.6714927007547091, 'sideways_rsi_os': 34, 'sideways_rsi_ob': 86, 'sideways_adx_thresh': 26.682814157900946, 'sideways_atr_min_pct': 0.005119438167980503, 'sideways_atr_max_pct': 0.12003951166036443, 'sideways_tp_mult': 2.859469462250022, 'sideways_tsl_mult': 0.26253408273949885, 'sideways_time_stop': 127, 'sideways_use_sma': True, 'sideways_use_ema': False, 'sideways_use_atr': False, 'sideways_use_adx': True, 'sideways_use_spike': False, 'sideways_rsi_required': True}.
[I 2025-09-01 11:26:33,555] Trial 290 finished with values: [-1000000000.0, 1000000000.0] and parameters: {'p_sma': 11, 'p_std': 25, 'p_atr': 12, 'p_adx': 30, 'rsi_period': 54, 'ema1': 7, 'ema2': 37, 'slip_atr_k': 0.12074867437060677, 'slip_spread_k': 0.04932162029330922, 'spread_hl_frac': 0.012279048306970117, 'bb_std_mult': 3.1058782521862867, 'rsi_os': 14, 'rsi_ob': 89, 'vol_spike': 0.09155008726533616, 'adx_thresh': 22.396739718265408, 'atr_min_pct': 0.006428444895935793, 'atr_max_pct': 0.03847289592154729, 'tp_mult': 2.7151104068586975, 'tsl_mult': 0.844419455487764, 'strategy': 'mean_reversion', 'time_stop': 279, 'use_sma': True, 'use_atr': False, 'use_adx': False, 'use_ema': True, 'use_spike': True, 'rsi_required': True, 'edge_k': 0.8260225083374058, 'edge_cap': 0.27821995978277575, 'bull_strategy': 'breakout', 'bull_bb_std_mult': 0.9779719391112653, 'bull_rsi_os': 46, 'bull_rsi_ob': 66, 'bull_adx_thresh': 34.954519994324286, 'bull_atr_min_pct': 0.0020318330408182436, 'bull_atr_max_pct': 0.010797927130433715, 'bull_tp_mult': 2.7237505286413075, 'bull_tsl_mult': 0.190785247519434, 'bull_time_stop': 138, 'bull_use_sma': True, 'bull_use_ema': True, 'bull_use_atr': True, 'bull_use_adx': True, 'bull_use_spike': False, 'bull_rsi_required': False, 'bear_strategy': 'mean_reversion', 'bear_bb_std_mult': 0.7394492421086264, 'bear_rsi_os': 19, 'bear_rsi_ob': 73, 'bear_adx_thresh': 24.906730175047123, 'bear_atr_min_pct': 0.026721030396008927, 'bear_atr_max_pct': 0.022836657363451803, 'bear_tp_mult': 1.1797882894155194, 'bear_tsl_mult': 0.8318469667364528, 'bear_time_stop': 259, 'bear_use_sma': False, 'bear_use_ema': True, 'bear_use_atr': False, 'bear_use_adx': True, 'bear_use_spike': True, 'bear_rsi_required': False, 'sideways_strategy': 'mean_reversion', 'sideways_bb_std_mult': 3.3817054638886983, 'sideways_rsi_os': 21, 'sideways_rsi_ob': 88, 'sideways_adx_thresh': 23.956240559610418, 'sideways_atr_min_pct': 0.017386367743831274, 'sideways_atr_max_pct': 0.06510981586725458, 'sideways_tp_mult': 1.616762961242991, 'sideways_tsl_mult': 0.34948525731441027, 'sideways_time_stop': 271, 'sideways_use_sma': True, 'sideways_use_ema': True, 'sideways_use_atr': False, 'sideways_use_adx': True, 'sideways_use_spike': False, 'sideways_rsi_required': True}.
[I 2025-09-01 11:26:33,974] Trial 293 finished with values: [-0.02467224490592579, 0.024760477374594848] and parameters: {'p_sma': 35, 'p_std': 25, 'p_atr': 7, 'p_adx': 8, 'rsi_period': 54, 'ema1': 22, 'ema2': 31, 'slip_atr_k': 0.020116764922534648, 'slip_spread_k': 0.8944209304035169, 'spread_hl_frac': 0.012583676025052722, 'bb_std_mult': 2.1330839413074196, 'rsi_os': 13, 'rsi_ob': 51, 'vol_spike': 0.1208723861871667, 'adx_thresh': 23.45679659541807, 'atr_min_pct': 0.027809067333700144, 'atr_max_pct': 0.03877341153976626, 'tp_mult': 2.5987932727912177, 'tsl_mult': 0.813813272888413, 'strategy': 'mean_reversion', 'time_stop': 226, 'use_sma': True, 'use_atr': False, 'use_adx': False, 'use_ema': True, 'use_spike': True, 'rsi_required': True, 'edge_k': 0.1992220659158977, 'edge_cap': 0.27915036972480445, 'bull_strategy': 'breakout', 'bull_bb_std_mult': 0.9868158195374803, 'bull_rsi_os': 46, 'bull_rsi_ob': 88, 'bull_adx_thresh': 5.751506666854198, 'bull_atr_min_pct': 0.001923712091111285, 'bull_atr_max_pct': 0.09579344903772692, 'bull_tp_mult': 2.7143889550551368, 'bull_tsl_mult': 0.8255167829441082, 'bull_time_stop': 242, 'bull_use_sma': True, 'bull_use_ema': True, 'bull_use_atr': True, 'bull_use_adx': True, 'bull_use_spike': False, 'bull_rsi_required': True, 'bear_strategy': 'mean_reversion', 'bear_bb_std_mult': 0.722790751639304, 'bear_rsi_os': 19, 'bear_rsi_ob': 63, 'bear_adx_thresh': 10.574649493835516, 'bear_atr_min_pct': 0.026671826196837747, 'bear_atr_max_pct': 0.039575834935548546, 'bear_tp_mult': 1.1827187713097753, 'bear_tsl_mult': 0.35223083836756564, 'bear_time_stop': 83, 'bear_use_sma': False, 'bear_use_ema': True, 'bear_use_atr': False, 'bear_use_adx': True, 'bear_use_spike': True, 'bear_rsi_required': False, 'sideways_strategy': 'mean_reversion', 'sideways_bb_std_mult': 3.425165600646657, 'sideways_rsi_os': 6, 'sideways_rsi_ob': 86, 'sideways_adx_thresh': 24.4688796000868, 'sideways_atr_min_pct': 0.028645625291198032, 'sideways_atr_max_pct': 0.06517746847858868, 'sideways_tp_mult': 1.5985457388942028, 'sideways_tsl_mult': 0.570014398185214, 'sideways_time_stop': 38, 'sideways_use_sma': True, 'sideways_use_ema': True, 'sideways_use_atr': False, 'sideways_use_adx': True, 'sideways_use_spike': False, 'sideways_rsi_required': True}.
[I 2025-09-01 11:26:34,631] Trial 295 finished with values: [-1000000000.0, 1000000000.0] and parameters: {'p_sma': 14, 'p_std': 50, 'p_atr': 30, 'p_adx': 30, 'rsi_period': 59, 'ema1': 26, 'ema2': 34, 'slip_atr_k': 0.15950973349883546, 'slip_spread_k': 0.11444396380043416, 'spread_hl_frac': 0.029662078862818488, 'bb_std_mult': 2.1429586710190884, 'rsi_os': 10, 'rsi_ob': 82, 'vol_spike': 0.24580412337663538, 'adx_thresh': 22.479140233008792, 'atr_min_pct': 0.02947649009555052, 'atr_max_pct': 0.031336222904975994, 'tp_mult': 1.1470139323190234, 'tsl_mult': 0.8139304512262426, 'strategy': 'mean_reversion', 'time_stop': 227, 'use_sma': True, 'use_atr': False, 'use_adx': False, 'use_ema': True, 'use_spike': True, 'rsi_required': True, 'edge_k': 1.0880798839087693, 'edge_cap': 0.3066952871249754, 'bull_strategy': 'breakout', 'bull_bb_std_mult': 2.822294426615609, 'bull_rsi_os': 47, 'bull_rsi_ob': 66, 'bull_adx_thresh': 24.16829850019054, 'bull_atr_min_pct': 0.01749487422834609, 'bull_atr_max_pct': 0.011208008467293487, 'bull_tp_mult': 2.7215039883475978, 'bull_tsl_mult': 0.7669889773646268, 'bull_time_stop': 138, 'bull_use_sma': True, 'bull_use_ema': True, 'bull_use_atr': True, 'bull_use_adx': False, 'bull_use_spike': True, 'bull_rsi_required': True, 'bear_strategy': 'breakout', 'bear_bb_std_mult': 0.7385212117738734, 'bear_rsi_os': 34, 'bear_rsi_ob': 52, 'bear_adx_thresh': 13.603422513237051, 'bear_atr_min_pct': 0.007931390231641048, 'bear_atr_max_pct': 0.023118480831852833, 'bear_tp_mult': 1.4781792892385885, 'bear_tsl_mult': 0.3132617621499413, 'bear_time_stop': 236, 'bear_use_sma': False, 'bear_use_ema': True, 'bear_use_atr': False, 'bear_use_adx': False, 'bear_use_spike': True, 'bear_rsi_required': False, 'sideways_strategy': 'mean_reversion', 'sideways_bb_std_mult': 2.7192104081569872, 'sideways_rsi_os': 7, 'sideways_rsi_ob': 58, 'sideways_adx_thresh': 7.827426291422974, 'sideways_atr_min_pct': 0.017351891884667014, 'sideways_atr_max_pct': 0.08757858589017417, 'sideways_tp_mult': 2.992842034281837, 'sideways_tsl_mult': 0.9996657552062307, 'sideways_time_stop': 128, 'sideways_use_sma': True, 'sideways_use_ema': False, 'sideways_use_atr': False, 'sideways_use_adx': False, 'sideways_use_spike': False, 'sideways_rsi_required': True}.
[I 2025-09-01 11:26:35,374] Trial 296 finished with values: [-1000000000.0, 1000000000.0] and parameters: {'p_sma': 35, 'p_std': 58, 'p_atr': 26, 'p_adx': 30, 'rsi_period': 60, 'ema1': 26, 'ema2': 35, 'slip_atr_k': 0.014307437471884912, 'slip_spread_k': 0.12649689379533813, 'spread_hl_frac': 0.046837474108749715, 'bb_std_mult': 3.2947582884702986, 'rsi_os': 10, 'rsi_ob': 46, 'vol_spike': 0.11069196094564666, 'adx_thresh': 28.733537905332753, 'atr_min_pct': 0.02804780738281151, 'atr_max_pct': 0.030697413385317576, 'tp_mult': 2.6719547302818567, 'tsl_mult': 0.8847783084950388, 'strategy': 'mean_reversion', 'time_stop': 257, 'use_sma': True, 'use_atr': False, 'use_adx': False, 'use_ema': True, 'use_spike': True, 'rsi_required': True, 'edge_k': 1.0059756410777674, 'edge_cap': 0.3083894685583078, 'bull_strategy': 'breakout', 'bull_bb_std_mult': 3.493496425409775, 'bull_rsi_os': 47, 'bull_rsi_ob': 56, 'bull_adx_thresh': 24.239647022866716, 'bull_atr_min_pct': 0.026147239076459355, 'bull_atr_max_pct': 0.09158416562791716, 'bull_tp_mult': 2.7003898060875846, 'bull_tsl_mult': 0.1134832327093952, 'bull_time_stop': 196, 'bull_use_sma': True, 'bull_use_ema': True, 'bull_use_atr': True, 'bull_use_adx': True, 'bull_use_spike': True, 'bull_rsi_required': False, 'bear_strategy': 'breakout', 'bear_bb_std_mult': 3.0470253242154124, 'bear_rsi_os': 20, 'bear_rsi_ob': 82, 'bear_adx_thresh': 10.900486860069929, 'bear_atr_min_pct': 0.02908203685927135, 'bear_atr_max_pct': 0.07500546152125392, 'bear_tp_mult': 2.7166127398611493, 'bear_tsl_mult': 0.9343415387871523, 'bear_time_stop': 237, 'bear_use_sma': False, 'bear_use_ema': True, 'bear_use_atr': False, 'bear_use_adx': False, 'bear_use_spike': True, 'bear_rsi_required': False, 'sideways_strategy': 'mean_reversion', 'sideways_bb_std_mult': 2.157380056183777, 'sideways_rsi_os': 20, 'sideways_rsi_ob': 88, 'sideways_adx_thresh': 34.977138122608466, 'sideways_atr_min_pct': 0.01782439349001808, 'sideways_atr_max_pct': 0.010119383825676898, 'sideways_tp_mult': 2.554914939998231, 'sideways_tsl_mult': 0.5839009315754466, 'sideways_time_stop': 38, 'sideways_use_sma': True, 'sideways_use_ema': True, 'sideways_use_atr': False, 'sideways_use_adx': False, 'sideways_use_spike': False, 'sideways_rsi_required': False}.
