[I 2025-09-01 11:05:07,698] Trial 145 finished with values: [-1000000000.0, 1000000000.0] and parameters: {'p_sma': 34, 'p_std': 41, 'p_atr': 8, 'p_adx': 25, 'rsi_period': 35, 'ema1': 19, 'ema2': 16, 'slip_atr_k': 0.1792354669345026, 'slip_spread_k': 0.18150350266065693, 'spread_hl_frac': 0.04550093076707185, 'bb_std_mult': 0.6449455891624586, 'rsi_os': 25, 'rsi_ob': 63, 'vol_spike': 0.12176083503213389, 'adx_thresh': 17.223133471402615, 'atr_min_pct': 0.015339199115526793, 'atr_max_pct': 0.010010108873300824, 'tp_mult': 1.9962429179663623, 'tsl_mult': 0.14695107078586805, 'strategy': 'mean_reversion', 'time_stop': 284, 'use_sma': True, 'use_atr': False, 'use_adx': True, 'use_ema': False, 'use_spike': True, 'rsi_required': True, 'edge_k': 1.3449759858576127, 'edge_cap': 0.5507569252590939, 'bull_strategy': 'breakout', 'bull_bb_std_mult': 0.9139481112465315, 'bull_rsi_os': 30, 'bull_rsi_ob': 79, 'bull_adx_thresh': 26.95329789501069, 'bull_atr_min_pct': 0.0012211380864096272, 'bull_atr_max_pct': 0.06673966148936077, 'bull_tp_mult': 1.8127703395319488, 'bull_tsl_mult': 0.9436776464030328, 'bull_time_stop': 256, 'bull_use_sma': False, 'bull_use_ema': True, 'bull_use_atr': False, 'bull_use_adx': False, 'bull_use_spike': True, 'bull_rsi_required': False, 'bear_strategy': 'breakout', 'bear_bb_std_mult': 1.1539652273300371, 'bear_rsi_os': 41, 'bear_rsi_ob': 92, 'bear_adx_thresh': 26.900783138983563, 'bear_atr_min_pct': 0.02260535992041855, 'bear_atr_max_pct': 0.1055784876108179, 'bear_tp_mult': 1.8950649148988516, 'bear_tsl_mult': 0.20655004805980098, 'bear_time_stop': 57, 'bear_use_sma': False, 'bear_use_ema': True, 'bear_use_atr': False, 'bear_use_adx': False, 'bear_use_spike': True, 'bear_rsi_required': False, 'sideways_strategy': 'breakout', 'sideways_bb_std_mult': 2.8373764076758836, 'sideways_rsi_os': 22, 'sideways_rsi_ob': 47, 'sideways_adx_thresh': 15.711616509394046, 'sideways_atr_min_pct': 0.017870030757033434, 'sideways_atr_max_pct': 0.0909394603683349, 'sideways_tp_mult': 2.244793643454002, 'sideways_tsl_mult': 0.9234202609440246, 'sideways_time_stop': 141, 'sideways_use_sma': False, 'sideways_use_ema': True, 'sideways_use_atr': False, 'sideways_use_adx': False, 'sideways_use_spike': True, 'sideways_rsi_required': False}.
[I 2025-09-01 11:05:50,163] Trial 146 finished with values: [-1000000000.0, 1000000000.0] and parameters: {'p_sma': 7, 'p_std': 21, 'p_atr': 8, 'p_adx': 25, 'rsi_period': 36, 'ema1': 18, 'ema2': 51, 'slip_atr_k': 0.1389171004693963, 'slip_spread_k': 0.2441614637903286, 'spread_hl_frac': 0.008192808162323748, 'bb_std_mult': 2.440930411367167, 'rsi_os': 34, 'rsi_ob': 70, 'vol_spike': 0.1584876771703016, 'adx_thresh': 20.77403906179249, 'atr_min_pct': 0.015388606279252879, 'atr_max_pct': 0.06305241583572253, 'tp_mult': 1.8413555710096792, 'tsl_mult': 0.6349662105801388, 'strategy': 'mean_reversion', 'time_stop': 82, 'use_sma': True, 'use_atr': True, 'use_adx': False, 'use_ema': False, 'use_spike': False, 'rsi_required': True, 'edge_k': 1.3475575011187895, 'edge_cap': 0.5477255564705389, 'bull_strategy': 'breakout', 'bull_bb_std_mult': 0.8781404994293596, 'bull_rsi_os': 25, 'bull_rsi_ob': 63, 'bull_adx_thresh': 27.609928563388976, 'bull_atr_min_pct': 0.015563227488215358, 'bull_atr_max_pct': 0.14537386651356854, 'bull_tp_mult': 1.8194299949300385, 'bull_tsl_mult': 0.9043516739934614, 'bull_time_stop': 106, 'bull_use_sma': False, 'bull_use_ema': False, 'bull_use_atr': False, 'bull_use_adx': True, 'bull_use_spike': True, 'bull_rsi_required': False, 'bear_strategy': 'breakout', 'bear_bb_std_mult': 1.1498415215498217, 'bear_rsi_os': 47, 'bear_rsi_ob': 92, 'bear_adx_thresh': 22.144112479701267, 'bear_atr_min_pct': 0.010341596395167468, 'bear_atr_max_pct': 0.13881871767681814, 'bear_tp_mult': 1.766908604628728, 'bear_tsl_mult': 0.9122177656922983, 'bear_time_stop': 151, 'bear_use_sma': False, 'bear_use_ema': False, 'bear_use_atr': True, 'bear_use_adx': False, 'bear_use_spike': False, 'bear_rsi_required': False, 'sideways_strategy': 'breakout', 'sideways_bb_std_mult': 0.7468652564793494, 'sideways_rsi_os': 22, 'sideways_rsi_ob': 69, 'sideways_adx_thresh': 16.059129271067615, 'sideways_atr_min_pct': 0.018620139404297638, 'sideways_atr_max_pct': 0.09197676645307162, 'sideways_tp_mult': 2.0072129419169795, 'sideways_tsl_mult': 0.8171829379376911, 'sideways_time_stop': 282, 'sideways_use_sma': False, 'sideways_use_ema': True, 'sideways_use_atr': False, 'sideways_use_adx': False, 'sideways_use_spike': True, 'sideways_rsi_required': True}.
[I 2025-09-01 11:05:50,960] Trial 148 finished with values: [-1000000000.0, 1000000000.0] and parameters: {'p_sma': 29, 'p_std': 25, 'p_atr': 7, 'p_adx': 7, 'rsi_period': 31, 'ema1': 18, 'ema2': 59, 'slip_atr_k': 0.02175154684868616, 'slip_spread_k': 0.2395511723933016, 'spread_hl_frac': 0.008510994552754995, 'bb_std_mult': 0.7054629479602952, 'rsi_os': 30, 'rsi_ob': 85, 'vol_spike': 0.2749587256495918, 'adx_thresh': 6.836470439118081, 'atr_min_pct': 0.01948472744265295, 'atr_max_pct': 0.0394240329703934, 'tp_mult': 1.6626667081833104, 'tsl_mult': 0.6409534689587592, 'strategy': 'mean_reversion', 'time_stop': 110, 'use_sma': True, 'use_atr': True, 'use_adx': False, 'use_ema': False, 'use_spike': False, 'rsi_required': True, 'edge_k': 1.8463922006379363, 'edge_cap': 0.5992321714994046, 'bull_strategy': 'mean_reversion', 'bull_bb_std_mult': 2.056691814238389, 'bull_rsi_os': 25, 'bull_rsi_ob': 47, 'bull_adx_thresh': 27.782169259240682, 'bull_atr_min_pct': 0.015948094133439603, 'bull_atr_max_pct': 0.06023135002752399, 'bull_tp_mult': 1.4605918561536786, 'bull_tsl_mult': 0.8684705506917767, 'bull_time_stop': 95, 'bull_use_sma': False, 'bull_use_ema': False, 'bull_use_atr': False, 'bull_use_adx': True, 'bull_use_spike': False, 'bull_rsi_required': False, 'bear_strategy': 'breakout', 'bear_bb_std_mult': 1.7959918085210387, 'bear_rsi_os': 47, 'bear_rsi_ob': 58, 'bear_adx_thresh': 21.989424327196645, 'bear_atr_min_pct': 0.019492768808666485, 'bear_atr_max_pct': 0.01650762964316277, 'bear_tp_mult': 2.0903043449269405, 'bear_tsl_mult': 0.8879886763212099, 'bear_time_stop': 224, 'bear_use_sma': False, 'bear_use_ema': False, 'bear_use_atr': True, 'bear_use_adx': False, 'bear_use_spike': False, 'bear_rsi_required': False, 'sideways_strategy': 'breakout', 'sideways_bb_std_mult': 3.528844501038435, 'sideways_rsi_os': 25, 'sideways_rsi_ob': 81, 'sideways_adx_thresh': 14.934690104848901, 'sideways_atr_min_pct': 0.01647358237246483, 'sideways_atr_max_pct': 0.09509369002883221, 'sideways_tp_mult': 1.9668118977865499, 'sideways_tsl_mult': 0.8120573216638043, 'sideways_time_stop': 172, 'sideways_use_sma': False, 'sideways_use_ema': True, 'sideways_use_atr': False, 'sideways_use_adx': False, 'sideways_use_spike': False, 'sideways_rsi_required': True}.
[I 2025-09-01 11:05:51,393] Trial 147 finished with values: [-1000000000.0, 1000000000.0] and parameters: {'p_sma': 7, 'p_std': 25, 'p_atr': 29, 'p_adx': 25, 'rsi_period': 31, 'ema1': 18, 'ema2': 15, 'slip_atr_k': 0.13954586216535397, 'slip_spread_k': 0.17977594205613484, 'spread_hl_frac': 0.007951655789975717, 'bb_std_mult': 0.6162244875141103, 'rsi_os': 25, 'rsi_ob': 85, 'vol_spike': 0.119068837028923, 'adx_thresh': 33.00431207186171, 'atr_min_pct': 0.015534927711861643, 'atr_max_pct': 0.07401668317088006, 'tp_mult': 2.4082953334607766, 'tsl_mult': 0.6578333035588534, 'strategy': 'mean_reversion', 'time_stop': 283, 'use_sma': True, 'use_atr': True, 'use_adx': False, 'use_ema': False, 'use_spike': False, 'rsi_required': True, 'edge_k': 1.7914867399699494, 'edge_cap': 0.5255808251085553, 'bull_strategy': 'mean_reversion', 'bull_bb_std_mult': 2.0750150521550403, 'bull_rsi_os': 25, 'bull_rsi_ob': 63, 'bull_adx_thresh': 26.929883429409173, 'bull_atr_min_pct': 0.01569054773780684, 'bull_atr_max_pct': 0.061131210408616146, 'bull_tp_mult': 1.6651904110157363, 'bull_tsl_mult': 0.9462503488083738, 'bull_time_stop': 93, 'bull_use_sma': False, 'bull_use_ema': False, 'bull_use_atr': False, 'bull_use_adx': True, 'bull_use_spike': True, 'bull_rsi_required': False, 'bear_strategy': 'breakout', 'bear_bb_std_mult': 1.1282845041093563, 'bear_rsi_os': 47, 'bear_rsi_ob': 92, 'bear_adx_thresh': 21.970077389553136, 'bear_atr_min_pct': 0.0208010614743747, 'bear_atr_max_pct': 0.04609416739734926, 'bear_tp_mult': 1.7461639081069915, 'bear_tsl_mult': 0.5403956928713689, 'bear_time_stop': 239, 'bear_use_sma': False, 'bear_use_ema': False, 'bear_use_atr': True, 'bear_use_adx': False, 'bear_use_spike': False, 'bear_rsi_required': False, 'sideways_strategy': 'breakout', 'sideways_bb_std_mult': 2.842997030341672, 'sideways_rsi_os': 22, 'sideways_rsi_ob': 69, 'sideways_adx_thresh': 14.877355544897789, 'sideways_atr_min_pct': 0.018662600214470335, 'sideways_atr_max_pct': 0.0921082591030393, 'sideways_tp_mult': 1.960653229128558, 'sideways_tsl_mult': 0.048408595000666896, 'sideways_time_stop': 285, 'sideways_use_sma': False, 'sideways_use_ema': True, 'sideways_use_atr': False, 'sideways_use_adx': False, 'sideways_use_spike': False, 'sideways_rsi_required': True}.
[I 2025-09-01 11:05:51,798] Trial 144 finished with values: [-0.08231177069038154, 0.08252081982262925] and parameters: {'p_sma': 29, 'p_std': 40, 'p_atr': 8, 'p_adx': 25, 'rsi_period': 73, 'ema1': 19, 'ema2': 52, 'slip_atr_k': 0.14303067791013052, 'slip_spread_k': 0.3150498258785307, 'spread_hl_frac': 0.008279814587748392, 'bb_std_mult': 1.2097622182078513, 'rsi_os': 25, 'rsi_ob': 85, 'vol_spike': 0.2581090464406967, 'adx_thresh': 32.9507163803819, 'atr_min_pct': 0.01550063308671985, 'atr_max_pct': 0.04004049800914997, 'tp_mult': 2.4037020620312677, 'tsl_mult': 0.13485639079094652, 'strategy': 'mean_reversion', 'time_stop': 254, 'use_sma': True, 'use_atr': False, 'use_adx': True, 'use_ema': False, 'use_spike': True, 'rsi_required': True, 'edge_k': 1.898840911982796, 'edge_cap': 0.5172919679877749, 'bull_strategy': 'breakout', 'bull_bb_std_mult': 1.1642496770738262, 'bull_rsi_os': 30, 'bull_rsi_ob': 63, 'bull_adx_thresh': 26.891233774253443, 'bull_atr_min_pct': 0.016066358044237068, 'bull_atr_max_pct': 0.09775740110068197, 'bull_tp_mult': 2.8195088323583337, 'bull_tsl_mult': 0.9522656671771013, 'bull_time_stop': 256, 'bull_use_sma': False, 'bull_use_ema': True, 'bull_use_atr': False, 'bull_use_adx': False, 'bull_use_spike': True, 'bull_rsi_required': False, 'bear_strategy': 'breakout', 'bear_bb_std_mult': 1.1356842282092983, 'bear_rsi_os': 41, 'bear_rsi_ob': 92, 'bear_adx_thresh': 22.067979005799906, 'bear_atr_min_pct': 0.01965130098530508, 'bear_atr_max_pct': 0.13310640157252832, 'bear_tp_mult': 2.868250719071118, 'bear_tsl_mult': 0.28928396757353475, 'bear_time_stop': 151, 'bear_use_sma': False, 'bear_use_ema': True, 'bear_use_atr': False, 'bear_use_adx': False, 'bear_use_spike': True, 'bear_rsi_required': False, 'sideways_strategy': 'breakout', 'sideways_bb_std_mult': 3.3622599758565204, 'sideways_rsi_os': 22, 'sideways_rsi_ob': 47, 'sideways_adx_thresh': 15.86084206836088, 'sideways_atr_min_pct': 0.00187743461755455, 'sideways_atr_max_pct': 0.08679799142492345, 'sideways_tp_mult': 1.9870075081507723, 'sideways_tsl_mult': 0.8186250007696569, 'sideways_time_stop': 139, 'sideways_use_sma': False, 'sideways_use_ema': True, 'sideways_use_atr': False, 'sideways_use_adx': False, 'sideways_use_spike': True, 'sideways_rsi_required': False}.
[I 2025-09-01 11:05:52,259] Trial 152 finished with values: [-1000000000.0, 1000000000.0] and parameters: {'p_sma': 5, 'p_std': 53, 'p_atr': 21, 'p_adx': 24, 'rsi_period': 43, 'ema1': 17, 'ema2': 55, 'slip_atr_k': 0.036247780087670746, 'slip_spread_k': 0.1528562772448935, 'spread_hl_frac': 0.0065392310782628705, 'bb_std_mult': 0.500851097112998, 'rsi_os': 50, 'rsi_ob': 61, 'vol_spike': 0.2148214260520896, 'adx_thresh': 5.101490145290005, 'atr_min_pct': 0.013946211140679711, 'atr_max_pct': 0.14459918546715378, 'tp_mult': 1.9823844205267889, 'tsl_mult': 0.5246547754511318, 'strategy': 'mean_reversion', 'time_stop': 236, 'use_sma': True, 'use_atr': True, 'use_adx': True, 'use_ema': True, 'use_spike': False, 'rsi_required': False, 'edge_k': 0.7431378076445141, 'edge_cap': 0.44337527666925947, 'bull_strategy': 'breakout', 'bull_bb_std_mult': 2.1323578623986905, 'bull_rsi_os': 27, 'bull_rsi_ob': 54, 'bull_adx_thresh': 26.235466274056517, 'bull_atr_min_pct': 0.00036542298104751917, 'bull_atr_max_pct': 0.11653055230412464, 'bull_tp_mult': 2.06969601725663, 'bull_tsl_mult': 0.3441344920119649, 'bull_time_stop': 10, 'bull_use_sma': False, 'bull_use_ema': False, 'bull_use_atr': True, 'bull_use_adx': True, 'bull_use_spike': False, 'bull_rsi_required': False, 'bear_strategy': 'mean_reversion', 'bear_bb_std_mult': 0.8048351466631001, 'bear_rsi_os': 7, 'bear_rsi_ob': 86, 'bear_adx_thresh': 34.22955336425545, 'bear_atr_min_pct': 0.004457972841023174, 'bear_atr_max_pct': 0.0519498644851524, 'bear_tp_mult': 1.8474417142585986, 'bear_tsl_mult': 0.17767796027246985, 'bear_time_stop': 142, 'bear_use_sma': False, 'bear_use_ema': False, 'bear_use_atr': True, 'bear_use_adx': False, 'bear_use_spike': True, 'bear_rsi_required': True, 'sideways_strategy': 'breakout', 'sideways_bb_std_mult': 0.5182430380255933, 'sideways_rsi_os': 52, 'sideways_rsi_ob': 85, 'sideways_adx_thresh': 16.775894578803296, 'sideways_atr_min_pct': 0.015009220677876718, 'sideways_atr_max_pct': 0.10171591092803302, 'sideways_tp_mult': 1.8387914268993384, 'sideways_tsl_mult': 0.36103577011677473, 'sideways_time_stop': 156, 'sideways_use_sma': True, 'sideways_use_ema': True, 'sideways_use_atr': True, 'sideways_use_adx': False, 'sideways_use_spike': False, 'sideways_rsi_required': True}.
[I 2025-09-01 11:06:34,624] Trial 153 finished with values: [-1000000000.0, 1000000000.0] and parameters: {'p_sma': 9, 'p_std': 11, 'p_atr': 7, 'p_adx': 12, 'rsi_period': 28, 'ema1': 27, 'ema2': 60, 'slip_atr_k': 0.04869611403429834, 'slip_spread_k': 0.0883025822406886, 'spread_hl_frac': 0.04166638477248388, 'bb_std_mult': 2.3458566070744498, 'rsi_os': 14, 'rsi_ob': 59, 'vol_spike': 0.06311922941413017, 'adx_thresh': 7.624929371982164, 'atr_min_pct': 0.012964385469917464, 'atr_max_pct': 0.12683378650648386, 'tp_mult': 2.310444636085938, 'tsl_mult': 0.7560738384350268, 'strategy': 'breakout', 'time_stop': 30, 'use_sma': False, 'use_atr': True, 'use_adx': True, 'use_ema': True, 'use_spike': False, 'rsi_required': False, 'edge_k': 0.8226277485810685, 'edge_cap': 0.4746362415080408, 'bull_strategy': 'breakout', 'bull_bb_std_mult': 3.593856859538911, 'bull_rsi_os': 12, 'bull_rsi_ob': 77, 'bull_adx_thresh': 28.542150998571028, 'bull_atr_min_pct': 0.027433942877961297, 'bull_atr_max_pct': 0.10443955571221088, 'bull_tp_mult': 1.5363239784992493, 'bull_tsl_mult': 0.030468850243171697, 'bull_time_stop': 21, 'bull_use_sma': True, 'bull_use_ema': False, 'bull_use_atr': True, 'bull_use_adx': True, 'bull_use_spike': True, 'bull_rsi_required': False, 'bear_strategy': 'breakout', 'bear_bb_std_mult': 1.3581181192760443, 'bear_rsi_os': 11, 'bear_rsi_ob': 89, 'bear_adx_thresh': 24.67957757713295, 'bear_atr_min_pct': 0.012387961783063619, 'bear_atr_max_pct': 0.12692235351653056, 'bear_tp_mult': 1.7052880274957176, 'bear_tsl_mult': 0.12216295470118527, 'bear_time_stop': 103, 'bear_use_sma': True, 'bear_use_ema': False, 'bear_use_atr': True, 'bear_use_adx': False, 'bear_use_spike': True, 'bear_rsi_required': True, 'sideways_strategy': 'mean_reversion', 'sideways_bb_std_mult': 1.4288968423561639, 'sideways_rsi_os': 23, 'sideways_rsi_ob': 51, 'sideways_adx_thresh': 17.65806487190647, 'sideways_atr_min_pct': 0.0056202644174706586, 'sideways_atr_max_pct': 0.06351655958516583, 'sideways_tp_mult': 2.6365647662078766, 'sideways_tsl_mult': 0.7558478284936492, 'sideways_time_stop': 292, 'sideways_use_sma': True, 'sideways_use_ema': True, 'sideways_use_atr': True, 'sideways_use_adx': False, 'sideways_use_spike': False, 'sideways_rsi_required': True}.
[I 2025-09-01 11:06:34,650] Trial 150 finished with values: [-1000000000.0, 1000000000.0] and parameters: {'p_sma': 5, 'p_std': 25, 'p_atr': 29, 'p_adx': 9, 'rsi_period': 73, 'ema1': 27, 'ema2': 55, 'slip_atr_k': 0.04597536104947103, 'slip_spread_k': 0.925496293983409, 'spread_hl_frac': 0.006612298439205612, 'bb_std_mult': 0.5772422884155851, 'rsi_os': 42, 'rsi_ob': 61, 'vol_spike': 0.2580193063669394, 'adx_thresh': 33.46474876066356, 'atr_min_pct': 0.013927553892789123, 'atr_max_pct': 0.14538653004686433, 'tp_mult': 1.4746781009135992, 'tsl_mult': 0.5785207111619769, 'strategy': 'mean_reversion', 'time_stop': 29, 'use_sma': True, 'use_atr': True, 'use_adx': True, 'use_ema': True, 'use_spike': False, 'rsi_required': False, 'edge_k': 0.7710206612199368, 'edge_cap': 0.5205796704910687, 'bull_strategy': 'mean_reversion', 'bull_bb_std_mult': 3.586501874522595, 'bull_rsi_os': 27, 'bull_rsi_ob': 77, 'bull_adx_thresh': 12.148677647363836, 'bull_atr_min_pct': 0.0016998645285745784, 'bull_atr_max_pct': 0.10291477281965233, 'bull_tp_mult': 1.2870702440612432, 'bull_tsl_mult': 0.3903975387970323, 'bull_time_stop': 115, 'bull_use_sma': False, 'bull_use_ema': False, 'bull_use_atr': True, 'bull_use_adx': True, 'bull_use_spike': True, 'bull_rsi_required': False, 'bear_strategy': 'breakout', 'bear_bb_std_mult': 3.5002396067765345, 'bear_rsi_os': 43, 'bear_rsi_ob': 86, 'bear_adx_thresh': 5.050689038741266, 'bear_atr_min_pct': 0.004593134987252178, 'bear_atr_max_pct': 0.043354570195603445, 'bear_tp_mult': 2.5443297957999884, 'bear_tsl_mult': 0.5635299346541321, 'bear_time_stop': 242, 'bear_use_sma': False, 'bear_use_ema': False, 'bear_use_atr': True, 'bear_use_adx': False, 'bear_use_spike': True, 'bear_rsi_required': True, 'sideways_strategy': 'breakout', 'sideways_bb_std_mult': 3.366518981785933, 'sideways_rsi_os': 23, 'sideways_rsi_ob': 51, 'sideways_adx_thresh': 16.731176520146064, 'sideways_atr_min_pct': 0.020814534368699778, 'sideways_atr_max_pct': 0.10141810417264238, 'sideways_tp_mult': 1.8513633051195932, 'sideways_tsl_mult': 0.7421812585156129, 'sideways_time_stop': 156, 'sideways_use_sma': True, 'sideways_use_ema': True, 'sideways_use_atr': True, 'sideways_use_adx': False, 'sideways_use_spike': False, 'sideways_rsi_required': True}.
[I 2025-09-01 11:06:34,987] Trial 151 finished with values: [-0.009147076300839219, 0.009785881327721038] and parameters: {'p_sma': 5, 'p_std': 26, 'p_atr': 21, 'p_adx': 30, 'rsi_period': 72, 'ema1': 27, 'ema2': 55, 'slip_atr_k': 0.1723532373296707, 'slip_spread_k': 0.08901921970637061, 'spread_hl_frac': 0.0030628354799277432, 'bb_std_mult': 0.5071274998292218, 'rsi_os': 16, 'rsi_ob': 61, 'vol_spike': 0.1328934694379459, 'adx_thresh': 5.068471633332741, 'atr_min_pct': 0.01396979376290427, 'atr_max_pct': 0.14510637402370963, 'tp_mult': 1.4739813636002363, 'tsl_mult': 0.6867625253819947, 'strategy': 'mean_reversion', 'time_stop': 31, 'use_sma': True, 'use_atr': True, 'use_adx': True, 'use_ema': True, 'use_spike': False, 'rsi_required': False, 'edge_k': 0.7379331992819647, 'edge_cap': 0.48828873253440175, 'bull_strategy': 'breakout', 'bull_bb_std_mult': 2.1237951537273903, 'bull_rsi_os': 27, 'bull_rsi_ob': 54, 'bull_adx_thresh': 28.76825150429044, 'bull_atr_min_pct': 0.0007425515724801302, 'bull_atr_max_pct': 0.13653573070529512, 'bull_tp_mult': 2.994747127693442, 'bull_tsl_mult': 0.38661336885483766, 'bull_time_stop': 9, 'bull_use_sma': False, 'bull_use_ema': False, 'bull_use_atr': True, 'bull_use_adx': True, 'bull_use_spike': False, 'bull_rsi_required': False, 'bear_strategy': 'breakout', 'bear_bb_std_mult': 1.3750696786984502, 'bear_rsi_os': 7, 'bear_rsi_ob': 89, 'bear_adx_thresh': 34.547083031448736, 'bear_atr_min_pct': 0.020180190821909572, 'bear_atr_max_pct': 0.14397063759292564, 'bear_tp_mult': 1.857223684440281, 'bear_tsl_mult': 0.02958731470520254, 'bear_time_stop': 194, 'bear_use_sma': False, 'bear_use_ema': False, 'bear_use_atr': True, 'bear_use_adx': False, 'bear_use_spike': True, 'bear_rsi_required': True, 'sideways_strategy': 'breakout', 'sideways_bb_std_mult': 1.5981200497997297, 'sideways_rsi_os': 23, 'sideways_rsi_ob': 51, 'sideways_adx_thresh': 17.551808958265923, 'sideways_atr_min_pct': 0.0017646667183655873, 'sideways_atr_max_pct': 0.08649795533252591, 'sideways_tp_mult': 2.6833423502832288, 'sideways_tsl_mult': 0.7399582578360896, 'sideways_time_stop': 156, 'sideways_use_sma': True, 'sideways_use_ema': True, 'sideways_use_atr': True, 'sideways_use_adx': False, 'sideways_use_spike': False, 'sideways_rsi_required': True}.
