[I 2025-09-01 11:07:17,371] Trial 163 finished with values: [-1000000000.0, 1000000000.0] and parameters: {'p_sma': 31, 'p_std': 34, 'p_atr': 27, 'p_adx': 27, 'rsi_period': 38, 'ema1': 18, 'ema2': 54, 'slip_atr_k': 0.17381393013617946, 'slip_spread_k': 0.27674374258079576, 'spread_hl_frac': 0.00018689203017453748, 'bb_std_mult': 0.8293328895256635, 'rsi_os': 23, 'rsi_ob': 58, 'vol_spike': 0.14738827791839024, 'adx_thresh': 28.357145035413403, 'atr_min_pct': 0.029074703132517483, 'atr_max_pct': 0.02426795038791959, 'tp_mult': 1.5705256921195494, 'tsl_mult': 0.5564101448865174, 'strategy': 'mean_reversion', 'time_stop': 291, 'use_sma': True, 'use_atr': False, 'use_adx': True, 'use_ema': False, 'use_spike': False, 'rsi_required': True, 'edge_k': 0.49582885788075814, 'edge_cap': 0.3367629547924429, 'bull_strategy': 'breakout', 'bull_bb_std_mult': 2.184914576790435, 'bull_rsi_os': 16, 'bull_rsi_ob': 84, 'bull_adx_thresh': 9.958096757702826, 'bull_atr_min_pct': 0.006425375615564895, 'bull_atr_max_pct': 0.13691149806788822, 'bull_tp_mult': 1.984975827380971, 'bull_tsl_mult': 0.48270190913722655, 'bull_time_stop': 32, 'bull_use_sma': False, 'bull_use_ema': False, 'bull_use_atr': True, 'bull_use_adx': False, 'bull_use_spike': True, 'bull_rsi_required': False, 'bear_strategy': 'breakout', 'bear_bb_std_mult': 2.8798288735056485, 'bear_rsi_os': 42, 'bear_rsi_ob': 91, 'bear_adx_thresh': 22.831787410358984, 'bear_atr_min_pct': 0.006659877075986092, 'bear_atr_max_pct': 0.13052885594355818, 'bear_tp_mult': 1.7449819640212518, 'bear_tsl_mult': 0.18594174896887877, 'bear_time_stop': 90, 'bear_use_sma': False, 'bear_use_ema': True, 'bear_use_atr': False, 'bear_use_adx': False, 'bear_use_spike': True, 'bear_rsi_required': False, 'sideways_strategy': 'breakout', 'sideways_bb_std_mult': 2.243513407135428, 'sideways_rsi_os': 24, 'sideways_rsi_ob': 47, 'sideways_adx_thresh': 16.299619173081798, 'sideways_atr_min_pct': 0.021283786225868725, 'sideways_atr_max_pct': 0.1396873929546462, 'sideways_tp_mult': 1.6466957541924345, 'sideways_tsl_mult': 0.0795996078426113, 'sideways_time_stop': 165, 'sideways_use_sma': False, 'sideways_use_ema': True, 'sideways_use_atr': False, 'sideways_use_adx': False, 'sideways_use_spike': True, 'sideways_rsi_required': False}.
[I 2025-09-01 11:07:17,816] Trial 165 finished with values: [-1000000000.0, 1000000000.0] and parameters: {'p_sma': 31, 'p_std': 44, 'p_atr': 13, 'p_adx': 13, 'rsi_period': 32, 'ema1': 6, 'ema2': 55, 'slip_atr_k': 0.033810128006767054, 'slip_spread_k': 0.25489721250783565, 'spread_hl_frac': 0.015370787267647843, 'bb_std_mult': 0.5010914106192127, 'rsi_os': 23, 'rsi_ob': 91, 'vol_spike': 0.12465950192594882, 'adx_thresh': 14.925162208962053, 'atr_min_pct': 0.01642014902223047, 'atr_max_pct': 0.01468151966829244, 'tp_mult': 1.5684124607750125, 'tsl_mult': 0.5602541242628409, 'strategy': 'mean_reversion', 'time_stop': 294, 'use_sma': True, 'use_atr': False, 'use_adx': False, 'use_ema': False, 'use_spike': True, 'rsi_required': True, 'edge_k': 0.6908481668245842, 'edge_cap': 0.11565651639243896, 'bull_strategy': 'breakout', 'bull_bb_std_mult': 2.1051355842983095, 'bull_rsi_os': 24, 'bull_rsi_ob': 83, 'bull_adx_thresh': 12.41135235644828, 'bull_atr_min_pct': 0.0017444275112201086, 'bull_atr_max_pct': 0.13055797398611882, 'bull_tp_mult': 2.1595704078817453, 'bull_tsl_mult': 0.48951335499639537, 'bull_time_stop': 25, 'bull_use_sma': True, 'bull_use_ema': True, 'bull_use_atr': True, 'bull_use_adx': True, 'bull_use_spike': True, 'bull_rsi_required': False, 'bear_strategy': 'breakout', 'bear_bb_std_mult': 1.949521194642677, 'bear_rsi_os': 51, 'bear_rsi_ob': 90, 'bear_adx_thresh': 21.34780317369376, 'bear_atr_min_pct': 0.006562332783031612, 'bear_atr_max_pct': 0.13473282821802196, 'bear_tp_mult': 1.75297226713069, 'bear_tsl_mult': 0.5990437453568205, 'bear_time_stop': 137, 'bear_use_sma': False, 'bear_use_ema': True, 'bear_use_atr': False, 'bear_use_adx': False, 'bear_use_spike': True, 'bear_rsi_required': False, 'sideways_strategy': 'mean_reversion', 'sideways_bb_std_mult': 2.636906354990113, 'sideways_rsi_os': 21, 'sideways_rsi_ob': 46, 'sideways_adx_thresh': 7.549270008176185, 'sideways_atr_min_pct': 0.019300833101004295, 'sideways_atr_max_pct': 0.1321316328313652, 'sideways_tp_mult': 2.9401068611741836, 'sideways_tsl_mult': 0.0020172782970125543, 'sideways_time_stop': 162, 'sideways_use_sma': False, 'sideways_use_ema': True, 'sideways_use_atr': False, 'sideways_use_adx': False, 'sideways_use_spike': False, 'sideways_rsi_required': True}.
[I 2025-09-01 11:07:57,637] Trial 161 finished with values: [-1000000000.0, 1000000000.0] and parameters: {'p_sma': 10, 'p_std': 26, 'p_atr': 7, 'p_adx': 24, 'rsi_period': 57, 'ema1': 25, 'ema2': 57, 'slip_atr_k': 0.15272364766617375, 'slip_spread_k': 0.5502978973381473, 'spread_hl_frac': 0.009637250414123928, 'bb_std_mult': 0.7420156790015533, 'rsi_os': 44, 'rsi_ob': 81, 'vol_spike': 0.14490806149698193, 'adx_thresh': 30.483740224417154, 'atr_min_pct': 0.006960646351804626, 'atr_max_pct': 0.06889816403263771, 'tp_mult': 2.022503530095846, 'tsl_mult': 0.9525269580649937, 'strategy': 'breakout', 'time_stop': 245, 'use_sma': False, 'use_atr': False, 'use_adx': False, 'use_ema': True, 'use_spike': True, 'rsi_required': True, 'edge_k': 1.7329142192257418, 'edge_cap': 0.11726159111904294, 'bull_strategy': 'breakout', 'bull_bb_std_mult': 2.0307307607189333, 'bull_rsi_os': 17, 'bull_rsi_ob': 89, 'bull_adx_thresh': 11.786148347277454, 'bull_atr_min_pct': 0.0194907659539822, 'bull_atr_max_pct': 0.03867253221490018, 'bull_tp_mult': 1.3905556973216049, 'bull_tsl_mult': 0.9731392224445808, 'bull_time_stop': 24, 'bull_use_sma': False, 'bull_use_ema': True, 'bull_use_atr': True, 'bull_use_adx': True, 'bull_use_spike': True, 'bull_rsi_required': False, 'bear_strategy': 'breakout', 'bear_bb_std_mult': 1.9636715736518788, 'bear_rsi_os': 43, 'bear_rsi_ob': 69, 'bear_adx_thresh': 18.568091891766134, 'bear_atr_min_pct': 0.021103749304216275, 'bear_atr_max_pct': 0.1389686488352571, 'bear_tp_mult': 1.7277308820763198, 'bear_tsl_mult': 0.5984092983669401, 'bear_time_stop': 273, 'bear_use_sma': True, 'bear_use_ema': True, 'bear_use_atr': False, 'bear_use_adx': False, 'bear_use_spike': False, 'bear_rsi_required': False, 'sideways_strategy': 'breakout', 'sideways_bb_std_mult': 1.601372295611998, 'sideways_rsi_os': 21, 'sideways_rsi_ob': 48, 'sideways_adx_thresh': 32.23742512872391, 'sideways_atr_min_pct': 0.013457980692111063, 'sideways_atr_max_pct': 0.1083583600561028, 'sideways_tp_mult': 2.3362033484803493, 'sideways_tsl_mult': 0.00958031617757003, 'sideways_time_stop': 139, 'sideways_use_sma': False, 'sideways_use_ema': True, 'sideways_use_atr': False, 'sideways_use_adx': False, 'sideways_use_spike': True, 'sideways_rsi_required': True}.
[I 2025-09-01 11:07:58,899] Trial 166 finished with values: [-1000000000.0, 1000000000.0] and parameters: {'p_sma': 7, 'p_std': 28, 'p_atr': 7, 'p_adx': 13, 'rsi_period': 32, 'ema1': 25, 'ema2': 58, 'slip_atr_k': 0.2029011997756261, 'slip_spread_k': 0.6009022566815427, 'spread_hl_frac': 0.015262680770126973, 'bb_std_mult': 1.7849527778351955, 'rsi_os': 16, 'rsi_ob': 63, 'vol_spike': 0.12576079847157945, 'adx_thresh': 15.087881713540577, 'atr_min_pct': 0.011513436724839982, 'atr_max_pct': 0.1405902839319331, 'tp_mult': 1.955505444001859, 'tsl_mult': 0.23181245739194256, 'strategy': 'mean_reversion', 'time_stop': 213, 'use_sma': True, 'use_atr': True, 'use_adx': False, 'use_ema': True, 'use_spike': True, 'rsi_required': False, 'edge_k': 0.9875353245785873, 'edge_cap': 0.7951701911943567, 'bull_strategy': 'breakout', 'bull_bb_std_mult': 3.264279449988435, 'bull_rsi_os': 23, 'bull_rsi_ob': 67, 'bull_adx_thresh': 17.448491829616458, 'bull_atr_min_pct': 0.002250289990533582, 'bull_atr_max_pct': 0.10133820157980923, 'bull_tp_mult': 2.2734374379133055, 'bull_tsl_mult': 0.9593967464454426, 'bull_time_stop': 26, 'bull_use_sma': True, 'bull_use_ema': True, 'bull_use_atr': False, 'bull_use_adx': True, 'bull_use_spike': True, 'bull_rsi_required': False, 'bear_strategy': 'mean_reversion', 'bear_bb_std_mult': 1.9913440361446535, 'bear_rsi_os': 39, 'bear_rsi_ob': 90, 'bear_adx_thresh': 20.91823354476223, 'bear_atr_min_pct': 0.019034229887863796, 'bear_atr_max_pct': 0.14815666858112234, 'bear_tp_mult': 1.880073573518991, 'bear_tsl_mult': 0.6134238497468706, 'bear_time_stop': 144, 'bear_use_sma': False, 'bear_use_ema': False, 'bear_use_atr': True, 'bear_use_adx': False, 'bear_use_spike': True, 'bear_rsi_required': True, 'sideways_strategy': 'mean_reversion', 'sideways_bb_std_mult': 3.139677196190754, 'sideways_rsi_os': 36, 'sideways_rsi_ob': 66, 'sideways_adx_thresh': 13.954170286591408, 'sideways_atr_min_pct': 0.01923261049453406, 'sideways_atr_max_pct': 0.10800591765222027, 'sideways_tp_mult': 1.9321808659913102, 'sideways_tsl_mult': 0.5598841620199129, 'sideways_time_stop': 131, 'sideways_use_sma': False, 'sideways_use_ema': True, 'sideways_use_atr': True, 'sideways_use_adx': False, 'sideways_use_spike': False, 'sideways_rsi_required': True}.
[I 2025-09-01 11:07:59,411] Trial 167 finished with values: [-0.008344849198642423, 0.008234125717688796] and parameters: {'p_sma': 20, 'p_std': 49, 'p_atr': 11, 'p_adx': 24, 'rsi_period': 53, 'ema1': 16, 'ema2': 58, 'slip_atr_k': 0.011785057240711834, 'slip_spread_k': 0.9854920726681196, 'spread_hl_frac': 0.005505735107298435, 'bb_std_mult': 1.7866489807595773, 'rsi_os': 7, 'rsi_ob': 64, 'vol_spike': 0.10753557389768537, 'adx_thresh': 5.767315411753628, 'atr_min_pct': 0.02833768324862023, 'atr_max_pct': 0.06059540592318822, 'tp_mult': 2.1549877867203784, 'tsl_mult': 0.3782110848544362, 'strategy': 'breakout', 'time_stop': 215, 'use_sma': False, 'use_atr': True, 'use_adx': True, 'use_ema': True, 'use_spike': False, 'rsi_required': False, 'edge_k': 1.9474380080748728, 'edge_cap': 0.5695050315715016, 'bull_strategy': 'breakout', 'bull_bb_std_mult': 2.3229755290043004, 'bull_rsi_os': 50, 'bull_rsi_ob': 65, 'bull_adx_thresh': 7.711556608232982, 'bull_atr_min_pct': 0.0020800349971432435, 'bull_atr_max_pct': 0.11143309998510703, 'bull_tp_mult': 1.6115038181768417, 'bull_tsl_mult': 0.09508764721369112, 'bull_time_stop': 13, 'bull_use_sma': False, 'bull_use_ema': False, 'bull_use_atr': False, 'bull_use_adx': True, 'bull_use_spike': False, 'bull_rsi_required': False, 'bear_strategy': 'mean_reversion', 'bear_bb_std_mult': 1.236574230242911, 'bear_rsi_os': 39, 'bear_rsi_ob': 83, 'bear_adx_thresh': 13.45890627760048, 'bear_atr_min_pct': 0.01816255323248083, 'bear_atr_max_pct': 0.09984754303998945, 'bear_tp_mult': 1.686776100453247, 'bear_tsl_mult': 0.21803969669493029, 'bear_time_stop': 144, 'bear_use_sma': True, 'bear_use_ema': False, 'bear_use_atr': True, 'bear_use_adx': False, 'bear_use_spike': True, 'bear_rsi_required': True, 'sideways_strategy': 'breakout', 'sideways_bb_std_mult': 3.1494125791402787, 'sideways_rsi_os': 35, 'sideways_rsi_ob': 65, 'sideways_adx_thresh': 30.181434397903654, 'sideways_atr_min_pct': 0.01835850117300126, 'sideways_atr_max_pct': 0.10713773375662274, 'sideways_tp_mult': 1.9297773709497572, 'sideways_tsl_mult': 0.5729348089771386, 'sideways_time_stop': 127, 'sideways_use_sma': True, 'sideways_use_ema': True, 'sideways_use_atr': True, 'sideways_use_adx': False, 'sideways_use_spike': False, 'sideways_rsi_required': True}.
[I 2025-09-01 11:07:59,816] Trial 162 finished with values: [-1000000000.0, 1000000000.0] and parameters: {'p_sma': 6, 'p_std': 36, 'p_atr': 16, 'p_adx': 26, 'rsi_period': 38, 'ema1': 25, 'ema2': 54, 'slip_atr_k': 0.17026943027127414, 'slip_spread_k': 0.26823174626528673, 'spread_hl_frac': 0.005655886185246689, 'bb_std_mult': 2.2845510572412016, 'rsi_os': 6, 'rsi_ob': 45, 'vol_spike': 0.12479236980134825, 'adx_thresh': 29.832823650849164, 'atr_min_pct': 0.01683963000269807, 'atr_max_pct': 0.14115932567274717, 'tp_mult': 1.7327634751092225, 'tsl_mult': 0.5635554903654849, 'strategy': 'breakout', 'time_stop': 246, 'use_sma': False, 'use_atr': False, 'use_adx': False, 'use_ema': True, 'use_spike': True, 'rsi_required': True, 'edge_k': 1.6704029714948456, 'edge_cap': 0.34242461265897584, 'bull_strategy': 'breakout', 'bull_bb_std_mult': 2.034203415113593, 'bull_rsi_os': 28, 'bull_rsi_ob': 84, 'bull_adx_thresh': 9.574032781217475, 'bull_atr_min_pct': 0.002123984720679425, 'bull_atr_max_pct': 0.13517154136569132, 'bull_tp_mult': 2.2945001513335987, 'bull_tsl_mult': 0.09659528797765005, 'bull_time_stop': 130, 'bull_use_sma': False, 'bull_use_ema': True, 'bull_use_atr': True, 'bull_use_adx': False, 'bull_use_spike': True, 'bull_rsi_required': False, 'bear_strategy': 'breakout', 'bear_bb_std_mult': 1.0416864397554586, 'bear_rsi_os': 42, 'bear_rsi_ob': 55, 'bear_adx_thresh': 28.806235354355003, 'bear_atr_min_pct': 0.018543189912419624, 'bear_atr_max_pct': 0.036657153045941526, 'bear_tp_mult': 2.3702823133012956, 'bear_tsl_mult': 0.9997143275859404, 'bear_time_stop': 90, 'bear_use_sma': True, 'bear_use_ema': True, 'bear_use_atr': False, 'bear_use_adx': False, 'bear_use_spike': True, 'bear_rsi_required': False, 'sideways_strategy': 'breakout', 'sideways_bb_std_mult': 3.463486936010265, 'sideways_rsi_os': 28, 'sideways_rsi_ob': 66, 'sideways_adx_thresh': 16.228429793135042, 'sideways_atr_min_pct': 0.02149500762060292, 'sideways_atr_max_pct': 0.04309877926682199, 'sideways_tp_mult': 2.3613813929294496, 'sideways_tsl_mult': 0.07631005519545338, 'sideways_time_stop': 215, 'sideways_use_sma': False, 'sideways_use_ema': True, 'sideways_use_atr': False, 'sideways_use_adx': False, 'sideways_use_spike': True, 'sideways_rsi_required': False}.
[I 2025-09-01 11:08:40,344] Trial 171 finished with values: [-1000000000.0, 1000000000.0] and parameters: {'p_sma': 54, 'p_std': 50, 'p_atr': 8, 'p_adx': 25, 'rsi_period': 49, 'ema1': 16, 'ema2': 58, 'slip_atr_k': 0.027876644610556292, 'slip_spread_k': 0.9742835692282243, 'spread_hl_frac': 0.0037517412172072065, 'bb_std_mult': 1.9444982426120851, 'rsi_os': 8, 'rsi_ob': 69, 'vol_spike': 0.22179806319300865, 'adx_thresh': 5.064291363875974, 'atr_min_pct': 0.028337581597993877, 'atr_max_pct': 0.06110764399776353, 'tp_mult': 1.8567035193576598, 'tsl_mult': 0.36700578623157926, 'strategy': 'mean_reversion', 'time_stop': 252, 'use_sma': True, 'use_atr': True, 'use_adx': True, 'use_ema': True, 'use_spike': False, 'rsi_required': False, 'edge_k': 1.9335544836781215, 'edge_cap': 0.5637555551111715, 'bull_strategy': 'mean_reversion', 'bull_bb_std_mult': 1.3707375928147327, 'bull_rsi_os': 21, 'bull_rsi_ob': 57, 'bull_adx_thresh': 19.928749474636284, 'bull_atr_min_pct': 0.00558117356816949, 'bull_atr_max_pct': 0.02502912138533573, 'bull_tp_mult': 1.614947607607102, 'bull_tsl_mult': 0.8820243036240195, 'bull_time_stop': 14, 'bull_use_sma': False, 'bull_use_ema': False, 'bull_use_atr': False, 'bull_use_adx': True, 'bull_use_spike': False, 'bull_rsi_required': False, 'bear_strategy': 'mean_reversion', 'bear_bb_std_mult': 1.5236863932401539, 'bear_rsi_os': 40, 'bear_rsi_ob': 82, 'bear_adx_thresh': 23.43313093614397, 'bear_atr_min_pct': 0.02643542479706117, 'bear_atr_max_pct': 0.13568641662616684, 'bear_tp_mult': 1.594181025885131, 'bear_tsl_mult': 0.2191617984095771, 'bear_time_stop': 258, 'bear_use_sma': False, 'bear_use_ema': False, 'bear_use_atr': True, 'bear_use_adx': False, 'bear_use_spike': True, 'bear_rsi_required': True, 'sideways_strategy': 'breakout', 'sideways_bb_std_mult': 3.5475916482618985, 'sideways_rsi_os': 34, 'sideways_rsi_ob': 78, 'sideways_adx_thresh': 17.186071814994275, 'sideways_atr_min_pct': 0.0038753107372323393, 'sideways_atr_max_pct': 0.12704113283959445, 'sideways_tp_mult': 2.5126584490846535, 'sideways_tsl_mult': 0.42505774980078453, 'sideways_time_stop': 122, 'sideways_use_sma': True, 'sideways_use_ema': True, 'sideways_use_atr': True, 'sideways_use_adx': False, 'sideways_use_spike': False, 'sideways_rsi_required': True}.
[I 2025-09-01 11:08:40,996] Trial 168 finished with values: [-1000000000.0, 1000000000.0] and parameters: {'p_sma': 7, 'p_std': 30, 'p_atr': 8, 'p_adx': 26, 'rsi_period': 53, 'ema1': 16, 'ema2': 58, 'slip_atr_k': 4.8833166028494635e-05, 'slip_spread_k': 0.9714383881414898, 'spread_hl_frac': 0.00580138830974375, 'bb_std_mult': 0.6356309921309853, 'rsi_os': 30, 'rsi_ob': 87, 'vol_spike': 0.22196341869689656, 'adx_thresh': 5.732803384041716, 'atr_min_pct': 0.028351668988363152, 'atr_max_pct': 0.06044310761661402, 'tp_mult': 1.8488507779217696, 'tsl_mult': 0.6133576729387848, 'strategy': 'mean_reversion', 'time_stop': 215, 'use_sma': True, 'use_atr': True, 'use_adx': True, 'use_ema': True, 'use_spike': False, 'rsi_required': False, 'edge_k': 1.9561207286502886, 'edge_cap': 0.7881276917403428, 'bull_strategy': 'breakout', 'bull_bb_std_mult': 1.928718358917965, 'bull_rsi_os': 21, 'bull_rsi_ob': 67, 'bull_adx_thresh': 17.24474036587186, 'bull_atr_min_pct': 0.0021718241417723358, 'bull_atr_max_pct': 0.1008799658790201, 'bull_tp_mult': 2.722672267635607, 'bull_tsl_mult': 0.5201560530207228, 'bull_time_stop': 10, 'bull_use_sma': False, 'bull_use_ema': False, 'bull_use_atr': False, 'bull_use_adx': True, 'bull_use_spike': False, 'bull_rsi_required': False, 'bear_strategy': 'mean_reversion', 'bear_bb_std_mult': 1.230954477352718, 'bear_rsi_os': 23, 'bear_rsi_ob': 83, 'bear_adx_thresh': 20.73776085325823, 'bear_atr_min_pct': 0.01911365270082963, 'bear_atr_max_pct': 0.14990577274344516, 'bear_tp_mult': 1.705072527914364, 'bear_tsl_mult': 0.22362065924378688, 'bear_time_stop': 125, 'bear_use_sma': False, 'bear_use_ema': False, 'bear_use_atr': True, 'bear_use_adx': False, 'bear_use_spike': True, 'bear_rsi_required': True, 'sideways_strategy': 'mean_reversion', 'sideways_bb_std_mult': 3.1614333367859864, 'sideways_rsi_os': 35, 'sideways_rsi_ob': 78, 'sideways_adx_thresh': 14.14391617042607, 'sideways_atr_min_pct': 0.018665902146775395, 'sideways_atr_max_pct': 0.05895375064379496, 'sideways_tp_mult': 2.086193156927473, 'sideways_tsl_mult': 0.029459107284820655, 'sideways_time_stop': 126, 'sideways_use_sma': True, 'sideways_use_ema': True, 'sideways_use_atr': True, 'sideways_use_adx': False, 'sideways_use_spike': False, 'sideways_rsi_required': True}.
[I 2025-09-01 11:08:41,296] Trial 169 finished with values: [-0.03997942360935891, 0.03990987179205047] and parameters: {'p_sma': 54, 'p_std': 49, 'p_atr': 14, 'p_adx': 25, 'rsi_period': 70, 'ema1': 16, 'ema2': 53, 'slip_atr_k': 0.05461253022923496, 'slip_spread_k': 0.9835390231318695, 'spread_hl_frac': 0.04292527056337035, 'bb_std_mult': 0.633150230135288, 'rsi_os': 7, 'rsi_ob': 54, 'vol_spike': 0.20024044909445304, 'adx_thresh': 5.867866196358599, 'atr_min_pct': 0.01800754765883323, 'atr_max_pct': 0.06052419262863023, 'tp_mult': 2.2510264084144462, 'tsl_mult': 0.6309414825752447, 'strategy': 'mean_reversion', 'time_stop': 205, 'use_sma': True, 'use_atr': True, 'use_adx': True, 'use_ema': True, 'use_spike': False, 'rsi_required': True, 'edge_k': 1.9521436183961725, 'edge_cap': 0.4241453039440566, 'bull_strategy': 'breakout', 'bull_bb_std_mult': 2.9053778026480277, 'bull_rsi_os': 29, 'bull_rsi_ob': 86, 'bull_adx_thresh': 6.115332038599959, 'bull_atr_min_pct': 0.0011229857870394399, 'bull_atr_max_pct': 0.11123309217507218, 'bull_tp_mult': 1.5558949246278186, 'bull_tsl_mult': 0.15062710255950246, 'bull_time_stop': 10, 'bull_use_sma': False, 'bull_use_ema': False, 'bull_use_atr': False, 'bull_use_adx': True, 'bull_use_spike': False, 'bull_rsi_required': False, 'bear_strategy': 'breakout', 'bear_bb_std_mult': 2.3187086383407842, 'bear_rsi_os': 23, 'bear_rsi_ob': 47, 'bear_adx_thresh': 6.488144676508265, 'bear_atr_min_pct': 0.01802563628030965, 'bear_atr_max_pct': 0.08972546830190814, 'bear_tp_mult': 1.6941129688808316, 'bear_tsl_mult': 0.2200778632425295, 'bear_time_stop': 204, 'bear_use_sma': False, 'bear_use_ema': False, 'bear_use_atr': True, 'bear_use_adx': False, 'bear_use_spike': True, 'bear_rsi_required': False, 'sideways_strategy': 'breakout', 'sideways_bb_std_mult': 3.3134747654165744, 'sideways_rsi_os': 33, 'sideways_rsi_ob': 45, 'sideways_adx_thresh': 30.09091428273006, 'sideways_atr_min_pct': 0.004361644566029376, 'sideways_atr_max_pct': 0.14886859304090125, 'sideways_tp_mult': 2.760214189036314, 'sideways_tsl_mult': 0.025311635740026414, 'sideways_time_stop': 62, 'sideways_use_sma': True, 'sideways_use_ema': True, 'sideways_use_atr': False, 'sideways_use_adx': False, 'sideways_use_spike': False, 'sideways_rsi_required': True}.
