[I 2025-09-01 11:15:44,142] Trial 217 finished with values: [-1000000000.0, 1000000000.0] and parameters: {'p_sma': 12, 'p_std': 26, 'p_atr': 24, 'p_adx': 29, 'rsi_period': 47, 'ema1': 20, 'ema2': 38, 'slip_atr_k': 0.008997900160119402, 'slip_spread_k': 0.09866046051727101, 'spread_hl_frac': 0.03387193077845032, 'bb_std_mult': 3.1094992775671613, 'rsi_os': 39, 'rsi_ob': 84, 'vol_spike': 0.11976742138890262, 'adx_thresh': 23.345083343966053, 'atr_min_pct': 0.028898787910511904, 'atr_max_pct': 0.030126781447057806, 'tp_mult': 2.7578354300409402, 'tsl_mult': 0.7501948166378096, 'strategy': 'mean_reversion', 'time_stop': 37, 'use_sma': True, 'use_atr': False, 'use_adx': False, 'use_ema': True, 'use_spike': True, 'rsi_required': True, 'edge_k': 0.23986762848445115, 'edge_cap': 0.3363675136302864, 'bull_strategy': 'breakout', 'bull_bb_std_mult': 2.841596509471802, 'bull_rsi_os': 45, 'bull_rsi_ob': 85, 'bull_adx_thresh': 17.886627152842795, 'bull_atr_min_pct': 0.024309862539657806, 'bull_atr_max_pct': 0.09630159154088894, 'bull_tp_mult': 2.4468514178806826, 'bull_tsl_mult': 0.7968203647550133, 'bull_time_stop': 247, 'bull_use_sma': True, 'bull_use_ema': True, 'bull_use_atr': True, 'bull_use_adx': True, 'bull_use_spike': True, 'bull_rsi_required': False, 'bear_strategy': 'breakout', 'bear_bb_std_mult': 0.8630309969413126, 'bear_rsi_os': 36, 'bear_rsi_ob': 46, 'bear_adx_thresh': 15.736541448222752, 'bear_atr_min_pct': 0.009195175078888805, 'bear_atr_max_pct': 0.03330853699454222, 'bear_tp_mult': 2.5455338035032575, 'bear_tsl_mult': 0.357145768093298, 'bear_time_stop': 82, 'bear_use_sma': False, 'bear_use_ema': True, 'bear_use_atr': False, 'bear_use_adx': True, 'bear_use_spike': False, 'bear_rsi_required': False, 'sideways_strategy': 'mean_reversion', 'sideways_bb_std_mult': 3.529581167851454, 'sideways_rsi_os': 8, 'sideways_rsi_ob': 91, 'sideways_adx_thresh': 25.57494600491637, 'sideways_atr_min_pct': 0.005937301519543449, 'sideways_atr_max_pct': 0.05175036780454674, 'sideways_tp_mult': 1.575365442620741, 'sideways_tsl_mult': 0.47261165373161557, 'sideways_time_stop': 117, 'sideways_use_sma': True, 'sideways_use_ema': True, 'sideways_use_atr': False, 'sideways_use_adx': True, 'sideways_use_spike': False, 'sideways_rsi_required': True}.
[I 2025-09-01 11:15:44,393] Trial 218 finished with values: [-1000000000.0, 1000000000.0] and parameters: {'p_sma': 12, 'p_std': 25, 'p_atr': 24, 'p_adx': 29, 'rsi_period': 47, 'ema1': 20, 'ema2': 38, 'slip_atr_k': 0.013333446751895905, 'slip_spread_k': 0.10222338670752859, 'spread_hl_frac': 0.026683391657835554, 'bb_std_mult': 3.1015104779680773, 'rsi_os': 40, 'rsi_ob': 76, 'vol_spike': 0.12059006952203835, 'adx_thresh': 22.31292457877643, 'atr_min_pct': 0.028632940694553542, 'atr_max_pct': 0.03150789828338538, 'tp_mult': 2.7566694533699074, 'tsl_mult': 0.8309091237329933, 'strategy': 'mean_reversion', 'time_stop': 10, 'use_sma': True, 'use_atr': False, 'use_adx': False, 'use_ema': True, 'use_spike': True, 'rsi_required': True, 'edge_k': 0.10707861000503688, 'edge_cap': 0.18959438242329812, 'bull_strategy': 'breakout', 'bull_bb_std_mult': 2.8627100424514786, 'bull_rsi_os': 45, 'bull_rsi_ob': 86, 'bull_adx_thresh': 5.382733261423093, 'bull_atr_min_pct': 0.024241320831411957, 'bull_atr_max_pct': 0.09601112525041379, 'bull_tp_mult': 2.930534535639705, 'bull_tsl_mult': 0.798387148031139, 'bull_time_stop': 245, 'bull_use_sma': True, 'bull_use_ema': True, 'bull_use_atr': True, 'bull_use_adx': True, 'bull_use_spike': True, 'bull_rsi_required': False, 'bear_strategy': 'breakout', 'bear_bb_std_mult': 0.8665559024283429, 'bear_rsi_os': 34, 'bear_rsi_ob': 46, 'bear_adx_thresh': 16.09518488883288, 'bear_atr_min_pct': 0.008130266287409097, 'bear_atr_max_pct': 0.018534647906309577, 'bear_tp_mult': 2.5487614108633974, 'bear_tsl_mult': 0.3562479129815707, 'bear_time_stop': 93, 'bear_use_sma': False, 'bear_use_ema': True, 'bear_use_atr': False, 'bear_use_adx': False, 'bear_use_spike': True, 'bear_rsi_required': False, 'sideways_strategy': 'mean_reversion', 'sideways_bb_std_mult': 3.5224566228187273, 'sideways_rsi_os': 30, 'sideways_rsi_ob': 91, 'sideways_adx_thresh': 23.49227681137278, 'sideways_atr_min_pct': 0.01789560966764774, 'sideways_atr_max_pct': 0.08743341292577554, 'sideways_tp_mult': 1.5686776395167623, 'sideways_tsl_mult': 0.4796338368585504, 'sideways_time_stop': 118, 'sideways_use_sma': True, 'sideways_use_ema': True, 'sideways_use_atr': False, 'sideways_use_adx': False, 'sideways_use_spike': False, 'sideways_rsi_required': True}.
[I 2025-09-01 11:15:44,690] Trial 216 finished with values: [-1000000000.0, 1000000000.0] and parameters: {'p_sma': 12, 'p_std': 27, 'p_atr': 8, 'p_adx': 30, 'rsi_period': 46, 'ema1': 20, 'ema2': 38, 'slip_atr_k': 0.009275181940029735, 'slip_spread_k': 0.09546087669169032, 'spread_hl_frac': 0.026650483997845413, 'bb_std_mult': 3.0810145913064333, 'rsi_os': 18, 'rsi_ob': 84, 'vol_spike': 0.12021289444690934, 'adx_thresh': 20.92824620518703, 'atr_min_pct': 0.028965859943010746, 'atr_max_pct': 0.03113213590489555, 'tp_mult': 2.7532323537112044, 'tsl_mult': 0.8166250842727332, 'strategy': 'mean_reversion', 'time_stop': 246, 'use_sma': True, 'use_atr': False, 'use_adx': False, 'use_ema': False, 'use_spike': True, 'rsi_required': False, 'edge_k': 0.24517285908531794, 'edge_cap': 0.1964563786321003, 'bull_strategy': 'breakout', 'bull_bb_std_mult': 2.983925500263039, 'bull_rsi_os': 46, 'bull_rsi_ob': 86, 'bull_adx_thresh': 14.276237740677061, 'bull_atr_min_pct': 0.019954544219688935, 'bull_atr_max_pct': 0.08945963228255059, 'bull_tp_mult': 2.942001254034387, 'bull_tsl_mult': 0.7982444406807935, 'bull_time_stop': 244, 'bull_use_sma': True, 'bull_use_ema': True, 'bull_use_atr': True, 'bull_use_adx': True, 'bull_use_spike': False, 'bull_rsi_required': False, 'bear_strategy': 'mean_reversion', 'bear_bb_std_mult': 0.8375964750213741, 'bear_rsi_os': 34, 'bear_rsi_ob': 50, 'bear_adx_thresh': 16.071546252443138, 'bear_atr_min_pct': 0.010164849199087094, 'bear_atr_max_pct': 0.02741756790929, 'bear_tp_mult': 2.7981086048716026, 'bear_tsl_mult': 0.3025714876253686, 'bear_time_stop': 91, 'bear_use_sma': False, 'bear_use_ema': True, 'bear_use_atr': False, 'bear_use_adx': True, 'bear_use_spike': False, 'bear_rsi_required': True, 'sideways_strategy': 'mean_reversion', 'sideways_bb_std_mult': 3.530969742441095, 'sideways_rsi_os': 7, 'sideways_rsi_ob': 88, 'sideways_adx_thresh': 25.410018679642764, 'sideways_atr_min_pct': 0.00214342921511119, 'sideways_atr_max_pct': 0.09189956377737264, 'sideways_tp_mult': 1.6884675480193725, 'sideways_tsl_mult': 0.49923967403762015, 'sideways_time_stop': 119, 'sideways_use_sma': True, 'sideways_use_ema': True, 'sideways_use_atr': True, 'sideways_use_adx': True, 'sideways_use_spike': False, 'sideways_rsi_required': True}.
[I 2025-09-01 11:15:45,272] Trial 221 finished with values: [-1000000000.0, 1000000000.0] and parameters: {'p_sma': 23, 'p_std': 55, 'p_atr': 9, 'p_adx': 30, 'rsi_period': 54, 'ema1': 21, 'ema2': 35, 'slip_atr_k': 0.012262158929834335, 'slip_spread_k': 0.06708469583103041, 'spread_hl_frac': 0.028472702600355716, 'bb_std_mult': 2.9720465267248937, 'rsi_os': 26, 'rsi_ob': 77, 'vol_spike': 0.2680749584147141, 'adx_thresh': 20.23569359479741, 'atr_min_pct': 0.02903411166517068, 'atr_max_pct': 0.02755849185136648, 'tp_mult': 2.4900906928334905, 'tsl_mult': 0.7741228676781011, 'strategy': 'mean_reversion', 'time_stop': 239, 'use_sma': True, 'use_atr': False, 'use_adx': False, 'use_ema': True, 'use_spike': True, 'rsi_required': True, 'edge_k': 0.22975225952031603, 'edge_cap': 0.14760606399391374, 'bull_strategy': 'breakout', 'bull_bb_std_mult': 3.1371144725099485, 'bull_rsi_os': 49, 'bull_rsi_ob': 51, 'bull_adx_thresh': 19.3725684147613, 'bull_atr_min_pct': 0.02322562933152734, 'bull_atr_max_pct': 0.08581653601710601, 'bull_tp_mult': 2.7558278369909086, 'bull_tsl_mult': 0.8263449441126468, 'bull_time_stop': 276, 'bull_use_sma': True, 'bull_use_ema': True, 'bull_use_atr': True, 'bull_use_adx': True, 'bull_use_spike': True, 'bull_rsi_required': False, 'bear_strategy': 'breakout', 'bear_bb_std_mult': 0.6562098454230153, 'bear_rsi_os': 34, 'bear_rsi_ob': 53, 'bear_adx_thresh': 16.335285104039286, 'bear_atr_min_pct': 0.008545942417717486, 'bear_atr_max_pct': 0.02981018119617214, 'bear_tp_mult': 2.7838843323944253, 'bear_tsl_mult': 0.2707327268681115, 'bear_time_stop': 90, 'bear_use_sma': False, 'bear_use_ema': True, 'bear_use_atr': False, 'bear_use_adx': False, 'bear_use_spike': True, 'bear_rsi_required': False, 'sideways_strategy': 'mean_reversion', 'sideways_bb_std_mult': 3.4755546626326956, 'sideways_rsi_os': 12, 'sideways_rsi_ob': 88, 'sideways_adx_thresh': 24.278947232998092, 'sideways_atr_min_pct': 0.01681053359495995, 'sideways_atr_max_pct': 0.08681636801660406, 'sideways_tp_mult': 1.7882881020226618, 'sideways_tsl_mult': 0.5172340098490178, 'sideways_time_stop': 124, 'sideways_use_sma': True, 'sideways_use_ema': True, 'sideways_use_atr': False, 'sideways_use_adx': False, 'sideways_use_spike': False, 'sideways_rsi_required': True}.
[I 2025-09-01 11:16:28,089] Trial 220 finished with values: [-1000000000.0, 1000000000.0] and parameters: {'p_sma': 15, 'p_std': 45, 'p_atr': 18, 'p_adx': 29, 'rsi_period': 47, 'ema1': 20, 'ema2': 34, 'slip_atr_k': 0.11144922038961198, 'slip_spread_k': 0.07298259605842775, 'spread_hl_frac': 0.028607065968829625, 'bb_std_mult': 2.984713306283496, 'rsi_os': 42, 'rsi_ob': 77, 'vol_spike': 0.11075037187349017, 'adx_thresh': 20.381391576972593, 'atr_min_pct': 0.029279484541533264, 'atr_max_pct': 0.041259832067921845, 'tp_mult': 2.6878434523523294, 'tsl_mult': 0.8163121817547219, 'strategy': 'mean_reversion', 'time_stop': 22, 'use_sma': True, 'use_atr': False, 'use_adx': False, 'use_ema': True, 'use_spike': True, 'rsi_required': True, 'edge_k': 0.11158741245152007, 'edge_cap': 0.18746637643997482, 'bull_strategy': 'breakout', 'bull_bb_std_mult': 2.867524258201986, 'bull_rsi_os': 49, 'bull_rsi_ob': 49, 'bull_adx_thresh': 19.357082572293468, 'bull_atr_min_pct': 0.007085956791985858, 'bull_atr_max_pct': 0.09621931377417421, 'bull_tp_mult': 2.752143147596829, 'bull_tsl_mult': 0.8265681322703657, 'bull_time_stop': 270, 'bull_use_sma': True, 'bull_use_ema': True, 'bull_use_atr': True, 'bull_use_adx': True, 'bull_use_spike': True, 'bull_rsi_required': False, 'bear_strategy': 'breakout', 'bear_bb_std_mult': 0.8643642622829072, 'bear_rsi_os': 34, 'bear_rsi_ob': 53, 'bear_adx_thresh': 16.661661155484065, 'bear_atr_min_pct': 0.00846910500214368, 'bear_atr_max_pct': 0.0296639794724789, 'bear_tp_mult': 2.782878131008022, 'bear_tsl_mult': 0.26762818547704886, 'bear_time_stop': 91, 'bear_use_sma': False, 'bear_use_ema': True, 'bear_use_atr': False, 'bear_use_adx': False, 'bear_use_spike': True, 'bear_rsi_required': False, 'sideways_strategy': 'mean_reversion', 'sideways_bb_std_mult': 3.477589382287503, 'sideways_rsi_os': 21, 'sideways_rsi_ob': 88, 'sideways_adx_thresh': 23.604713320848987, 'sideways_atr_min_pct': 0.014293760691737682, 'sideways_atr_max_pct': 0.0569900342947306, 'sideways_tp_mult': 1.7630678467812442, 'sideways_tsl_mult': 0.48717610331814387, 'sideways_time_stop': 118, 'sideways_use_sma': True, 'sideways_use_ema': True, 'sideways_use_atr': False, 'sideways_use_adx': False, 'sideways_use_spike': False, 'sideways_rsi_required': True}.
[I 2025-09-01 11:16:28,496] Trial 219 finished with values: [-1000000000.0, 1000000000.0] and parameters: {'p_sma': 15, 'p_std': 55, 'p_atr': 17, 'p_adx': 29, 'rsi_period': 53, 'ema1': 20, 'ema2': 35, 'slip_atr_k': 0.011685184392365013, 'slip_spread_k': 0.03609447493692383, 'spread_hl_frac': 0.031836319053168555, 'bb_std_mult': 3.011463763887323, 'rsi_os': 17, 'rsi_ob': 77, 'vol_spike': 0.11033227959592488, 'adx_thresh': 20.383443444293206, 'atr_min_pct': 0.028680759605124156, 'atr_max_pct': 0.04183825001541213, 'tp_mult': 2.4807883699165885, 'tsl_mult': 0.8118135090671624, 'strategy': 'mean_reversion', 'time_stop': 239, 'use_sma': True, 'use_atr': False, 'use_adx': False, 'use_ema': True, 'use_spike': True, 'rsi_required': True, 'edge_k': 0.13730592323537424, 'edge_cap': 0.19343712002539026, 'bull_strategy': 'breakout', 'bull_bb_std_mult': 2.8496029046947777, 'bull_rsi_os': 49, 'bull_rsi_ob': 86, 'bull_adx_thresh': 14.695123139103451, 'bull_atr_min_pct': 0.023057867506033093, 'bull_atr_max_pct': 0.09581450841594985, 'bull_tp_mult': 2.748642551573321, 'bull_tsl_mult': 0.8233535798256881, 'bull_time_stop': 272, 'bull_use_sma': True, 'bull_use_ema': True, 'bull_use_atr': True, 'bull_use_adx': True, 'bull_use_spike': True, 'bull_rsi_required': False, 'bear_strategy': 'breakout', 'bear_bb_std_mult': 0.6600359736629837, 'bear_rsi_os': 34, 'bear_rsi_ob': 50, 'bear_adx_thresh': 16.27608047726055, 'bear_atr_min_pct': 0.008535034438973457, 'bear_atr_max_pct': 0.029264063900989165, 'bear_tp_mult': 2.7954908571775956, 'bear_tsl_mult': 0.2715800887308874, 'bear_time_stop': 87, 'bear_use_sma': False, 'bear_use_ema': True, 'bear_use_atr': False, 'bear_use_adx': False, 'bear_use_spike': True, 'bear_rsi_required': False, 'sideways_strategy': 'mean_reversion', 'sideways_bb_std_mult': 3.4899497951587346, 'sideways_rsi_os': 21, 'sideways_rsi_ob': 87, 'sideways_adx_thresh': 24.1490846004682, 'sideways_atr_min_pct': 0.0180341441130354, 'sideways_atr_max_pct': 0.05629461769838233, 'sideways_tp_mult': 1.7969028824794608, 'sideways_tsl_mult': 0.48799828851239024, 'sideways_time_stop': 105, 'sideways_use_sma': True, 'sideways_use_ema': True, 'sideways_use_atr': False, 'sideways_use_adx': False, 'sideways_use_spike': False, 'sideways_rsi_required': True}.
[I 2025-09-01 11:16:28,823] Trial 223 finished with values: [-1000000000.0, 1000000000.0] and parameters: {'p_sma': 15, 'p_std': 45, 'p_atr': 21, 'p_adx': 29, 'rsi_period': 45, 'ema1': 22, 'ema2': 35, 'slip_atr_k': 0.15854226030225832, 'slip_spread_k': 0.04521995773121417, 'spread_hl_frac': 0.031326454529479617, 'bb_std_mult': 3.2249992593798784, 'rsi_os': 36, 'rsi_ob': 74, 'vol_spike': 0.11143566221554667, 'adx_thresh': 21.34201704333221, 'atr_min_pct': 0.02916866267126183, 'atr_max_pct': 0.04269730446613075, 'tp_mult': 2.671276360956055, 'tsl_mult': 0.7162683226262943, 'strategy': 'breakout', 'time_stop': 111, 'use_sma': False, 'use_atr': False, 'use_adx': False, 'use_ema': True, 'use_spike': True, 'rsi_required': True, 'edge_k': 0.3667811851150309, 'edge_cap': 0.2519211413384973, 'bull_strategy': 'mean_reversion', 'bull_bb_std_mult': 3.1694055261636036, 'bull_rsi_os': 49, 'bull_rsi_ob': 88, 'bull_adx_thresh': 30.761479311724134, 'bull_atr_min_pct': 0.0013798931532594972, 'bull_atr_max_pct': 0.09542264880455804, 'bull_tp_mult': 2.231186599236688, 'bull_tsl_mult': 0.8307906966057682, 'bull_time_stop': 254, 'bull_use_sma': True, 'bull_use_ema': True, 'bull_use_atr': True, 'bull_use_adx': True, 'bull_use_spike': True, 'bull_rsi_required': False, 'bear_strategy': 'breakout', 'bear_bb_std_mult': 0.8896052963742368, 'bear_rsi_os': 36, 'bear_rsi_ob': 47, 'bear_adx_thresh': 13.980944636483116, 'bear_atr_min_pct': 0.007117209010425179, 'bear_atr_max_pct': 0.024321573759889414, 'bear_tp_mult': 2.3993630877291094, 'bear_tsl_mult': 0.2824902881050325, 'bear_time_stop': 105, 'bear_use_sma': True, 'bear_use_ema': True, 'bear_use_atr': False, 'bear_use_adx': False, 'bear_use_spike': True, 'bear_rsi_required': False, 'sideways_strategy': 'mean_reversion', 'sideways_bb_std_mult': 3.4980394063711695, 'sideways_rsi_os': 22, 'sideways_rsi_ob': 87, 'sideways_adx_thresh': 24.152532207067267, 'sideways_atr_min_pct': 0.01899818692578787, 'sideways_atr_max_pct': 0.06747529314287148, 'sideways_tp_mult': 1.5026092637888109, 'sideways_tsl_mult': 0.4640812561114849, 'sideways_time_stop': 101, 'sideways_use_sma': True, 'sideways_use_ema': True, 'sideways_use_atr': False, 'sideways_use_adx': False, 'sideways_use_spike': False, 'sideways_rsi_required': True}.
[I 2025-09-01 11:16:29,121] Trial 222 finished with values: [-1000000000.0, 1000000000.0] and parameters: {'p_sma': 40, 'p_std': 54, 'p_atr': 15, 'p_adx': 29, 'rsi_period': 54, 'ema1': 22, 'ema2': 35, 'slip_atr_k': 0.00505423642862998, 'slip_spread_k': 0.06923992882310986, 'spread_hl_frac': 0.03537497151351217, 'bb_std_mult': 2.9945963574139736, 'rsi_os': 26, 'rsi_ob': 80, 'vol_spike': 0.2655875250340827, 'adx_thresh': 22.963428013037937, 'atr_min_pct': 0.028357318759784093, 'atr_max_pct': 0.0442040418883083, 'tp_mult': 2.6874695813262965, 'tsl_mult': 0.8044051609802245, 'strategy': 'mean_reversion', 'time_stop': 113, 'use_sma': True, 'use_atr': False, 'use_adx': False, 'use_ema': True, 'use_spike': True, 'rsi_required': True, 'edge_k': 0.11114680433115487, 'edge_cap': 0.16797028864814992, 'bull_strategy': 'breakout', 'bull_bb_std_mult': 3.1229697915241075, 'bull_rsi_os': 49, 'bull_rsi_ob': 88, 'bull_adx_thresh': 16.55727583003126, 'bull_atr_min_pct': 0.02902242346161696, 'bull_atr_max_pct': 0.09648243529567821, 'bull_tp_mult': 2.6390638813193186, 'bull_tsl_mult': 0.8385552227899663, 'bull_time_stop': 277, 'bull_use_sma': True, 'bull_use_ema': True, 'bull_use_atr': True, 'bull_use_adx': True, 'bull_use_spike': True, 'bull_rsi_required': False, 'bear_strategy': 'breakout', 'bear_bb_std_mult': 0.6859687079476046, 'bear_rsi_os': 36, 'bear_rsi_ob': 53, 'bear_adx_thresh': 14.055954989863306, 'bear_atr_min_pct': 0.008575529499803876, 'bear_atr_max_pct': 0.023471656252493096, 'bear_tp_mult': 2.666974509188532, 'bear_tsl_mult': 0.2686916284038847, 'bear_time_stop': 106, 'bear_use_sma': False, 'bear_use_ema': True, 'bear_use_atr': False, 'bear_use_adx': False, 'bear_use_spike': True, 'bear_rsi_required': False, 'sideways_strategy': 'mean_reversion', 'sideways_bb_std_mult': 3.452509400594568, 'sideways_rsi_os': 22, 'sideways_rsi_ob': 87, 'sideways_adx_thresh': 23.67403461697839, 'sideways_atr_min_pct': 0.016669688791522575, 'sideways_atr_max_pct': 0.094290273591968, 'sideways_tp_mult': 1.7729148498274394, 'sideways_tsl_mult': 0.521828399956856, 'sideways_time_stop': 129, 'sideways_use_sma': True, 'sideways_use_ema': True, 'sideways_use_atr': False, 'sideways_use_adx': False, 'sideways_use_spike': False, 'sideways_rsi_required': True}.
[I 2025-09-01 11:16:29,903] Trial 226 finished with values: [-1000000000.0, 1000000000.0] and parameters: {'p_sma': 41, 'p_std': 51, 'p_atr': 23, 'p_adx': 30, 'rsi_period': 50, 'ema1': 21, 'ema2': 36, 'slip_atr_k': 0.19059454205614332, 'slip_spread_k': 0.08170056962269114, 'spread_hl_frac': 0.035649552588709, 'bb_std_mult': 3.323197757628858, 'rsi_os': 50, 'rsi_ob': 80, 'vol_spike': 0.0691419949290324, 'adx_thresh': 22.655198432656032, 'atr_min_pct': 0.028164544433125438, 'atr_max_pct': 0.018596411631662705, 'tp_mult': 2.5711089207722644, 'tsl_mult': 0.7429652026832427, 'strategy': 'breakout', 'time_stop': 103, 'use_sma': False, 'use_atr': False, 'use_adx': False, 'use_ema': True, 'use_spike': True, 'rsi_required': True, 'edge_k': 0.18113858407104022, 'edge_cap': 0.29822699500235905, 'bull_strategy': 'mean_reversion', 'bull_bb_std_mult': 3.250184132143068, 'bull_rsi_os': 46, 'bull_rsi_ob': 90, 'bull_adx_thresh': 30.491052059807956, 'bull_atr_min_pct': 0.011234241463086062, 'bull_atr_max_pct': 0.0879304714559938, 'bull_tp_mult': 2.498287623271272, 'bull_tsl_mult': 0.8126496811144982, 'bull_time_stop': 257, 'bull_use_sma': True, 'bull_use_ema': True, 'bull_use_atr': True, 'bull_use_adx': True, 'bull_use_spike': True, 'bull_rsi_required': False, 'bear_strategy': 'breakout', 'bear_bb_std_mult': 0.6052229258395324, 'bear_rsi_os': 32, 'bear_rsi_ob': 56, 'bear_adx_thresh': 14.769314607824432, 'bear_atr_min_pct': 0.009747077126606565, 'bear_atr_max_pct': 0.02332693353234298, 'bear_tp_mult': 2.3437057310974856, 'bear_tsl_mult': 0.24165889232173893, 'bear_time_stop': 98, 'bear_use_sma': True, 'bear_use_ema': True, 'bear_use_atr': False, 'bear_use_adx': False, 'bear_use_spike': True, 'bear_rsi_required': False, 'sideways_strategy': 'mean_reversion', 'sideways_bb_std_mult': 1.4999911630862572, 'sideways_rsi_os': 23, 'sideways_rsi_ob': 89, 'sideways_adx_thresh': 26.332968585075278, 'sideways_atr_min_pct': 0.018504524919323237, 'sideways_atr_max_pct': 0.09350706841881103, 'sideways_tp_mult': 1.7397913294557914, 'sideways_tsl_mult': 0.2538240363790165, 'sideways_time_stop': 128, 'sideways_use_sma': True, 'sideways_use_ema': False, 'sideways_use_atr': False, 'sideways_use_adx': False, 'sideways_use_spike': False, 'sideways_rsi_required': True}.
