[I 2025-09-01 12:04:41,915] Trial 514 finished with values: [-1000000000.0, 1000000000.0] and parameters: {'p_sma': 43, 'p_std': 18, 'p_atr': 20, 'p_adx': 8, 'rsi_period': 68, 'ema1': 11, 'ema2': 12, 'slip_atr_k': 0.07335275970626937, 'slip_spread_k': 0.8899112154299371, 'spread_hl_frac': 0.0020067540586713936, 'bb_std_mult': 0.9574096400994175, 'rsi_os': 37, 'rsi_ob': 50, 'vol_spike': 0.20457843168595993, 'adx_thresh': 23.081994952462196, 'atr_min_pct': 0.023071166108247394, 'atr_max_pct': 0.08002285630151108, 'tp_mult': 2.0418252622616957, 'tsl_mult': 0.10738515626173617, 'strategy': 'breakout', 'time_stop': 165, 'use_sma': False, 'use_atr': True, 'use_adx': True, 'use_ema': True, 'use_spike': False, 'rsi_required': False, 'edge_k': 0.2035240629516005, 'edge_cap': 0.1122369909707321, 'bull_strategy': 'mean_reversion', 'bull_bb_std_mult': 1.7654203862779059, 'bull_rsi_os': 8, 'bull_rsi_ob': 48, 'bull_adx_thresh': 21.961315837311155, 'bull_atr_min_pct': 0.01637800797160473, 'bull_atr_max_pct': 0.11134635897185267, 'bull_tp_mult': 1.4144778128079385, 'bull_tsl_mult': 0.6105475530747522, 'bull_time_stop': 159, 'bull_use_sma': False, 'bull_use_ema': False, 'bull_use_atr': False, 'bull_use_adx': False, 'bull_use_spike': False, 'bull_rsi_required': True, 'bear_strategy': 'mean_reversion', 'bear_bb_std_mult': 1.3789442403748478, 'bear_rsi_os': 29, 'bear_rsi_ob': 61, 'bear_adx_thresh': 9.273973527933032, 'bear_atr_min_pct': 0.005597483199365524, 'bear_atr_max_pct': 0.02524456882396732, 'bear_tp_mult': 1.5145042711331498, 'bear_tsl_mult': 0.7063922237946441, 'bear_time_stop': 269, 'bear_use_sma': True, 'bear_use_ema': False, 'bear_use_atr': True, 'bear_use_adx': True, 'bear_use_spike': False, 'bear_rsi_required': True, 'sideways_strategy': 'breakout', 'sideways_bb_std_mult': 2.3005332197777166, 'sideways_rsi_os': 54, 'sideways_rsi_ob': 81, 'sideways_adx_thresh': 28.200160183560207, 'sideways_atr_min_pct': 0.008099964389540361, 'sideways_atr_max_pct': 0.1222395305025489, 'sideways_tp_mult': 2.3916493873006672, 'sideways_tsl_mult': 0.3504000214237344, 'sideways_time_stop': 93, 'sideways_use_sma': False, 'sideways_use_ema': False, 'sideways_use_atr': True, 'sideways_use_adx': True, 'sideways_use_spike': True, 'sideways_rsi_required': False}.
[I 2025-09-01 12:04:42,639] Trial 512 finished with values: [-0.01287449798567708, 0.013141064483466868] and parameters: {'p_sma': 25, 'p_std': 46, 'p_atr': 19, 'p_adx': 8, 'rsi_period': 62, 'ema1': 25, 'ema2': 22, 'slip_atr_k': 0.24222326286004914, 'slip_spread_k': 0.39792666276899963, 'spread_hl_frac': 0.004691336964476893, 'bb_std_mult': 0.9453090026742625, 'rsi_os': 33, 'rsi_ob': 46, 'vol_spike': 0.19162608230305686, 'adx_thresh': 23.21400446926249, 'atr_min_pct': 0.023227063534302213, 'atr_max_pct': 0.07850293355524893, 'tp_mult': 2.057724820816658, 'tsl_mult': 0.10676794133632403, 'strategy': 'breakout', 'time_stop': 188, 'use_sma': False, 'use_atr': True, 'use_adx': True, 'use_ema': True, 'use_spike': False, 'rsi_required': False, 'edge_k': 0.12672454714977133, 'edge_cap': 0.10684692049211733, 'bull_strategy': 'mean_reversion', 'bull_bb_std_mult': 2.3822051590696307, 'bull_rsi_os': 50, 'bull_rsi_ob': 64, 'bull_adx_thresh': 6.766227919999216, 'bull_atr_min_pct': 0.01718040119631366, 'bull_atr_max_pct': 0.0337986303555537, 'bull_tp_mult': 1.4074065410372665, 'bull_tsl_mult': 0.5235117629252894, 'bull_time_stop': 161, 'bull_use_sma': False, 'bull_use_ema': False, 'bull_use_atr': False, 'bull_use_adx': False, 'bull_use_spike': False, 'bull_rsi_required': True, 'bear_strategy': 'breakout', 'bear_bb_std_mult': 2.703429377195195, 'bear_rsi_os': 54, 'bear_rsi_ob': 77, 'bear_adx_thresh': 10.578188174019985, 'bear_atr_min_pct': 0.00399453765353143, 'bear_atr_max_pct': 0.02490394666231245, 'bear_tp_mult': 1.529802851712278, 'bear_tsl_mult': 0.6968627274481334, 'bear_time_stop': 290, 'bear_use_sma': True, 'bear_use_ema': False, 'bear_use_atr': True, 'bear_use_adx': True, 'bear_use_spike': False, 'bear_rsi_required': True, 'sideways_strategy': 'breakout', 'sideways_bb_std_mult': 2.414566920941106, 'sideways_rsi_os': 40, 'sideways_rsi_ob': 66, 'sideways_adx_thresh': 33.21782517693973, 'sideways_atr_min_pct': 4.011042036328183e-05, 'sideways_atr_max_pct': 0.04936284470370955, 'sideways_tp_mult': 2.321310933361976, 'sideways_tsl_mult': 0.3553886146477943, 'sideways_time_stop': 9, 'sideways_use_sma': False, 'sideways_use_ema': False, 'sideways_use_atr': True, 'sideways_use_adx': True, 'sideways_use_spike': True, 'sideways_rsi_required': False}.
[I 2025-09-01 12:04:43,205] Trial 515 finished with values: [-1000000000.0, 1000000000.0] and parameters: {'p_sma': 22, 'p_std': 10, 'p_atr': 20, 'p_adx': 8, 'rsi_period': 44, 'ema1': 11, 'ema2': 12, 'slip_atr_k': 0.025734638864567047, 'slip_spread_k': 0.3959317951705803, 'spread_hl_frac': 0.002215503447842138, 'bb_std_mult': 1.2443322986359935, 'rsi_os': 35, 'rsi_ob': 46, 'vol_spike': 0.1918176326278088, 'adx_thresh': 21.951966179965442, 'atr_min_pct': 0.023164458399968887, 'atr_max_pct': 0.08015079617269136, 'tp_mult': 1.6442665471442004, 'tsl_mult': 0.14327681893851568, 'strategy': 'breakout', 'time_stop': 167, 'use_sma': False, 'use_atr': True, 'use_adx': True, 'use_ema': True, 'use_spike': False, 'rsi_required': False, 'edge_k': 0.005908924549889061, 'edge_cap': 0.10528831961722412, 'bull_strategy': 'mean_reversion', 'bull_bb_std_mult': 1.7562944293401463, 'bull_rsi_os': 55, 'bull_rsi_ob': 62, 'bull_adx_thresh': 19.071167685290387, 'bull_atr_min_pct': 0.016354794850200312, 'bull_atr_max_pct': 0.11019313862716022, 'bull_tp_mult': 1.411455517762336, 'bull_tsl_mult': 0.607925694543207, 'bull_time_stop': 160, 'bull_use_sma': False, 'bull_use_ema': False, 'bull_use_atr': False, 'bull_use_adx': False, 'bull_use_spike': False, 'bull_rsi_required': True, 'bear_strategy': 'mean_reversion', 'bear_bb_std_mult': 1.9042121751545973, 'bear_rsi_os': 29, 'bear_rsi_ob': 61, 'bear_adx_thresh': 30.58817460395509, 'bear_atr_min_pct': 0.004304889128355776, 'bear_atr_max_pct': 0.13160433873582222, 'bear_tp_mult': 2.3127196126735843, 'bear_tsl_mult': 0.6976675810551878, 'bear_time_stop': 268, 'bear_use_sma': True, 'bear_use_ema': False, 'bear_use_atr': True, 'bear_use_adx': True, 'bear_use_spike': False, 'bear_rsi_required': True, 'sideways_strategy': 'breakout', 'sideways_bb_std_mult': 2.292800814997323, 'sideways_rsi_os': 8, 'sideways_rsi_ob': 89, 'sideways_adx_thresh': 28.272877031110763, 'sideways_atr_min_pct': 1.2578159736872235e-06, 'sideways_atr_max_pct': 0.12769459055639545, 'sideways_tp_mult': 2.378067930856266, 'sideways_tsl_mult': 0.6668093233886561, 'sideways_time_stop': 91, 'sideways_use_sma': False, 'sideways_use_ema': False, 'sideways_use_atr': True, 'sideways_use_adx': True, 'sideways_use_spike': True, 'sideways_rsi_required': False}.
[I 2025-09-01 12:05:27,443] Trial 516 finished with values: [-0.0053000306498439675, 0.005735120399038566] and parameters: {'p_sma': 44, 'p_std': 16, 'p_atr': 20, 'p_adx': 7, 'rsi_period': 43, 'ema1': 25, 'ema2': 51, 'slip_atr_k': 0.022826045785471625, 'slip_spread_k': 0.8200981447292719, 'spread_hl_frac': 0.001953112509850894, 'bb_std_mult': 1.2262260330089647, 'rsi_os': 35, 'rsi_ob': 50, 'vol_spike': 0.18987957357553903, 'adx_thresh': 23.078815647899457, 'atr_min_pct': 0.023674343364505617, 'atr_max_pct': 0.07686222300110027, 'tp_mult': 2.9735009189909043, 'tsl_mult': 0.14765626053802589, 'strategy': 'breakout', 'time_stop': 172, 'use_sma': False, 'use_atr': True, 'use_adx': True, 'use_ema': True, 'use_spike': False, 'rsi_required': False, 'edge_k': 0.0007035832616116844, 'edge_cap': 0.11544403309451745, 'bull_strategy': 'mean_reversion', 'bull_bb_std_mult': 1.796111476454936, 'bull_rsi_os': 17, 'bull_rsi_ob': 50, 'bull_adx_thresh': 7.951157165600225, 'bull_atr_min_pct': 0.016296352864837674, 'bull_atr_max_pct': 0.12440044401332359, 'bull_tp_mult': 1.0632243330184077, 'bull_tsl_mult': 0.2507544523458791, 'bull_time_stop': 161, 'bull_use_sma': False, 'bull_use_ema': False, 'bull_use_atr': True, 'bull_use_adx': False, 'bull_use_spike': False, 'bull_rsi_required': False, 'bear_strategy': 'breakout', 'bear_bb_std_mult': 1.3789157013004987, 'bear_rsi_os': 48, 'bear_rsi_ob': 76, 'bear_adx_thresh': 10.421855898651462, 'bear_atr_min_pct': 0.005624912661279197, 'bear_atr_max_pct': 0.025082894743670286, 'bear_tp_mult': 2.4264335871041602, 'bear_tsl_mult': 0.6939026409820179, 'bear_time_stop': 282, 'bear_use_sma': True, 'bear_use_ema': False, 'bear_use_atr': True, 'bear_use_adx': True, 'bear_use_spike': False, 'bear_rsi_required': True, 'sideways_strategy': 'breakout', 'sideways_bb_std_mult': 2.0848196601586317, 'sideways_rsi_os': 31, 'sideways_rsi_ob': 67, 'sideways_adx_thresh': 29.05478392247342, 'sideways_atr_min_pct': 0.0025246837109510196, 'sideways_atr_max_pct': 0.05275371172494492, 'sideways_tp_mult': 2.15719108058024, 'sideways_tsl_mult': 0.9224485908690613, 'sideways_time_stop': 176, 'sideways_use_sma': False, 'sideways_use_ema': False, 'sideways_use_atr': True, 'sideways_use_adx': True, 'sideways_use_spike': True, 'sideways_rsi_required': False}.
[I 2025-09-01 12:05:28,501] Trial 519 finished with values: [-0.03572692246089115, 0.036485087527921144] and parameters: {'p_sma': 41, 'p_std': 33, 'p_atr': 19, 'p_adx': 7, 'rsi_period': 21, 'ema1': 25, 'ema2': 16, 'slip_atr_k': 0.02867502091051609, 'slip_spread_k': 0.8148078454660526, 'spread_hl_frac': 0.03452485480086336, 'bb_std_mult': 0.791545528192134, 'rsi_os': 32, 'rsi_ob': 50, 'vol_spike': 0.19522694157912845, 'adx_thresh': 7.355237980418067, 'atr_min_pct': 0.02388065145012848, 'atr_max_pct': 0.07511559413090353, 'tp_mult': 2.125420017134715, 'tsl_mult': 0.13004215373195913, 'strategy': 'breakout', 'time_stop': 174, 'use_sma': False, 'use_atr': True, 'use_adx': True, 'use_ema': False, 'use_spike': False, 'rsi_required': False, 'edge_k': 0.17961268792658902, 'edge_cap': 0.14309589059546185, 'bull_strategy': 'mean_reversion', 'bull_bb_std_mult': 1.6648177167291418, 'bull_rsi_os': 51, 'bull_rsi_ob': 50, 'bull_adx_thresh': 13.294165430009437, 'bull_atr_min_pct': 0.01583610187849444, 'bull_atr_max_pct': 0.12467380503237095, 'bull_tp_mult': 1.2681855619216407, 'bull_tsl_mult': 0.5427463554450246, 'bull_time_stop': 148, 'bull_use_sma': False, 'bull_use_ema': False, 'bull_use_atr': True, 'bull_use_adx': False, 'bull_use_spike': False, 'bull_rsi_required': False, 'bear_strategy': 'breakout', 'bear_bb_std_mult': 2.4434428117751446, 'bear_rsi_os': 26, 'bear_rsi_ob': 65, 'bear_adx_thresh': 5.5647519371651715, 'bear_atr_min_pct': 0.003547433749466512, 'bear_atr_max_pct': 0.027429570021277945, 'bear_tp_mult': 1.4411571702028796, 'bear_tsl_mult': 0.7444566313481664, 'bear_time_stop': 280, 'bear_use_sma': True, 'bear_use_ema': False, 'bear_use_atr': True, 'bear_use_adx': True, 'bear_use_spike': False, 'bear_rsi_required': True, 'sideways_strategy': 'breakout', 'sideways_bb_std_mult': 2.1036725112880683, 'sideways_rsi_os': 43, 'sideways_rsi_ob': 55, 'sideways_adx_thresh': 33.64768827509521, 'sideways_atr_min_pct': 0.002455577549844582, 'sideways_atr_max_pct': 0.05233464687195903, 'sideways_tp_mult': 2.1833333060171753, 'sideways_tsl_mult': 0.9136706031626018, 'sideways_time_stop': 109, 'sideways_use_sma': False, 'sideways_use_ema': False, 'sideways_use_atr': True, 'sideways_use_adx': True, 'sideways_use_spike': True, 'sideways_rsi_required': False}.
[I 2025-09-01 12:05:28,990] Trial 517 finished with values: [-0.0018236274648965045, 0.012045672884593413] and parameters: {'p_sma': 26, 'p_std': 11, 'p_atr': 30, 'p_adx': 7, 'rsi_period': 39, 'ema1': 7, 'ema2': 16, 'slip_atr_k': 0.025260895755307416, 'slip_spread_k': 0.3613856353292918, 'spread_hl_frac': 0.00364930228434468, 'bb_std_mult': 2.3054133859983423, 'rsi_os': 34, 'rsi_ob': 46, 'vol_spike': 0.1935791943197471, 'adx_thresh': 22.98808014660613, 'atr_min_pct': 0.023529434847174374, 'atr_max_pct': 0.07585257333618693, 'tp_mult': 2.96374147965047, 'tsl_mult': 0.14229643427779443, 'strategy': 'breakout', 'time_stop': 24, 'use_sma': False, 'use_atr': True, 'use_adx': True, 'use_ema': True, 'use_spike': False, 'rsi_required': False, 'edge_k': 1.2032435625401259, 'edge_cap': 0.13874744593019026, 'bull_strategy': 'mean_reversion', 'bull_bb_std_mult': 1.6759667753142584, 'bull_rsi_os': 51, 'bull_rsi_ob': 50, 'bull_adx_thresh': 6.861341673715236, 'bull_atr_min_pct': 0.017043342574294917, 'bull_atr_max_pct': 0.10854200921388642, 'bull_tp_mult': 1.0520664670184596, 'bull_tsl_mult': 0.5376188430593609, 'bull_time_stop': 148, 'bull_use_sma': False, 'bull_use_ema': False, 'bull_use_atr': True, 'bull_use_adx': False, 'bull_use_spike': False, 'bull_rsi_required': False, 'bear_strategy': 'breakout', 'bear_bb_std_mult': 1.9076704788457022, 'bear_rsi_os': 26, 'bear_rsi_ob': 53, 'bear_adx_thresh': 10.79469403429735, 'bear_atr_min_pct': 0.0036527651569056322, 'bear_atr_max_pct': 0.06682031113520254, 'bear_tp_mult': 2.861411064777285, 'bear_tsl_mult': 0.7474115627509769, 'bear_time_stop': 291, 'bear_use_sma': True, 'bear_use_ema': False, 'bear_use_atr': True, 'bear_use_adx': True, 'bear_use_spike': False, 'bear_rsi_required': True, 'sideways_strategy': 'breakout', 'sideways_bb_std_mult': 0.9932837010393962, 'sideways_rsi_os': 31, 'sideways_rsi_ob': 55, 'sideways_adx_thresh': 33.44939345945227, 'sideways_atr_min_pct': 0.005524439338015551, 'sideways_atr_max_pct': 0.132718120929886, 'sideways_tp_mult': 2.3185437282779082, 'sideways_tsl_mult': 0.9235937036423963, 'sideways_time_stop': 110, 'sideways_use_sma': False, 'sideways_use_ema': False, 'sideways_use_atr': True, 'sideways_use_adx': True, 'sideways_use_spike': True, 'sideways_rsi_required': False}.
[I 2025-09-01 12:05:29,405] Trial 518 finished with values: [-1000000000.0, 1000000000.0] and parameters: {'p_sma': 26, 'p_std': 10, 'p_atr': 19, 'p_adx': 7, 'rsi_period': 20, 'ema1': 25, 'ema2': 16, 'slip_atr_k': 0.021886389062338543, 'slip_spread_k': 0.8241504786815781, 'spread_hl_frac': 0.003801067723126692, 'bb_std_mult': 0.7993855861110335, 'rsi_os': 35, 'rsi_ob': 50, 'vol_spike': 0.19399275292817578, 'adx_thresh': 22.080136249011208, 'atr_min_pct': 0.022359089675075865, 'atr_max_pct': 0.07588917249523958, 'tp_mult': 1.4774915332254839, 'tsl_mult': 0.14437879803813006, 'strategy': 'breakout', 'time_stop': 5, 'use_sma': False, 'use_atr': True, 'use_adx': True, 'use_ema': False, 'use_spike': False, 'rsi_required': False, 'edge_k': 0.1977401072920513, 'edge_cap': 0.4383896811732059, 'bull_strategy': 'mean_reversion', 'bull_bb_std_mult': 1.3439158383506333, 'bull_rsi_os': 51, 'bull_rsi_ob': 50, 'bull_adx_thresh': 7.925997250204156, 'bull_atr_min_pct': 0.016184574524959687, 'bull_atr_max_pct': 0.12454814449192088, 'bull_tp_mult': 1.2486595545117904, 'bull_tsl_mult': 0.5568645869003483, 'bull_time_stop': 146, 'bull_use_sma': False, 'bull_use_ema': False, 'bull_use_atr': True, 'bull_use_adx': False, 'bull_use_spike': False, 'bull_rsi_required': False, 'bear_strategy': 'breakout', 'bear_bb_std_mult': 1.890546694182549, 'bear_rsi_os': 26, 'bear_rsi_ob': 85, 'bear_adx_thresh': 11.825525861335818, 'bear_atr_min_pct': 0.004389201275903594, 'bear_atr_max_pct': 0.12939298360588503, 'bear_tp_mult': 1.4252695497361991, 'bear_tsl_mult': 0.7479077235417598, 'bear_time_stop': 279, 'bear_use_sma': True, 'bear_use_ema': False, 'bear_use_atr': True, 'bear_use_adx': True, 'bear_use_spike': False, 'bear_rsi_required': True, 'sideways_strategy': 'breakout', 'sideways_bb_std_mult': 2.099472358709054, 'sideways_rsi_os': 31, 'sideways_rsi_ob': 89, 'sideways_adx_thresh': 33.46575501538642, 'sideways_atr_min_pct': 0.0025389579893097757, 'sideways_atr_max_pct': 0.052933636696249266, 'sideways_tp_mult': 2.21513735657959, 'sideways_tsl_mult': 0.3961354648359706, 'sideways_time_stop': 110, 'sideways_use_sma': False, 'sideways_use_ema': False, 'sideways_use_atr': True, 'sideways_use_adx': True, 'sideways_use_spike': True, 'sideways_rsi_required': False}.
[I 2025-09-01 12:06:11,506] Trial 522 finished with values: [-1000000000.0, 1000000000.0] and parameters: {'p_sma': 28, 'p_std': 31, 'p_atr': 18, 'p_adx': 20, 'rsi_period': 46, 'ema1': 26, 'ema2': 15, 'slip_atr_k': 0.047447566581177145, 'slip_spread_k': 0.3747648915290048, 'spread_hl_frac': 0.004001641507803636, 'bb_std_mult': 1.0676821691254728, 'rsi_os': 33, 'rsi_ob': 49, 'vol_spike': 0.20693026455296495, 'adx_thresh': 34.933049535764184, 'atr_min_pct': 0.008122962256330492, 'atr_max_pct': 0.10387648465956109, 'tp_mult': 2.8314922758206285, 'tsl_mult': 0.08032443979746931, 'strategy': 'breakout', 'time_stop': 136, 'use_sma': False, 'use_atr': True, 'use_adx': True, 'use_ema': True, 'use_spike': False, 'rsi_required': False, 'edge_k': 0.10633434725030919, 'edge_cap': 0.17238051782522276, 'bull_strategy': 'mean_reversion', 'bull_bb_std_mult': 1.8299208997425553, 'bull_rsi_os': 49, 'bull_rsi_ob': 52, 'bull_adx_thresh': 24.846040596962848, 'bull_atr_min_pct': 0.02544077717107946, 'bull_atr_max_pct': 0.1183291491245215, 'bull_tp_mult': 1.1858499315479094, 'bull_tsl_mult': 0.5811849774037674, 'bull_time_stop': 175, 'bull_use_sma': False, 'bull_use_ema': False, 'bull_use_atr': True, 'bull_use_adx': False, 'bull_use_spike': False, 'bull_rsi_required': False, 'bear_strategy': 'breakout', 'bear_bb_std_mult': 1.7985961679969762, 'bear_rsi_os': 27, 'bear_rsi_ob': 93, 'bear_adx_thresh': 18.86421208450238, 'bear_atr_min_pct': 0.001629473685382259, 'bear_atr_max_pct': 0.0837467643496552, 'bear_tp_mult': 1.4909384126782608, 'bear_tsl_mult': 0.6676722854964692, 'bear_time_stop': 271, 'bear_use_sma': True, 'bear_use_ema': False, 'bear_use_atr': True, 'bear_use_adx': True, 'bear_use_spike': False, 'bear_rsi_required': True, 'sideways_strategy': 'breakout', 'sideways_bb_std_mult': 2.1696205411588005, 'sideways_rsi_os': 40, 'sideways_rsi_ob': 52, 'sideways_adx_thresh': 33.90499475243742, 'sideways_atr_min_pct': 0.004303797900834715, 'sideways_atr_max_pct': 0.06269484623130002, 'sideways_tp_mult': 2.795950079945197, 'sideways_tsl_mult': 0.39759436401431825, 'sideways_time_stop': 194, 'sideways_use_sma': False, 'sideways_use_ema': False, 'sideways_use_atr': True, 'sideways_use_adx': True, 'sideways_use_spike': True, 'sideways_rsi_required': False}.
[I 2025-09-01 12:06:12,388] Trial 523 finished with values: [-1000000000.0, 1000000000.0] and parameters: {'p_sma': 31, 'p_std': 31, 'p_atr': 18, 'p_adx': 8, 'rsi_period': 47, 'ema1': 29, 'ema2': 14, 'slip_atr_k': 0.1839729590968741, 'slip_spread_k': 0.6582861768478608, 'spread_hl_frac': 0.017377276789951643, 'bb_std_mult': 1.0655210791077132, 'rsi_os': 32, 'rsi_ob': 54, 'vol_spike': 0.2083109618807107, 'adx_thresh': 16.025287737023948, 'atr_min_pct': 0.022509053745001423, 'atr_max_pct': 0.08310481257226152, 'tp_mult': 2.135336607293525, 'tsl_mult': 0.42525985297179225, 'strategy': 'breakout', 'time_stop': 151, 'use_sma': False, 'use_atr': True, 'use_adx': True, 'use_ema': True, 'use_spike': False, 'rsi_required': False, 'edge_k': 1.324039462806068, 'edge_cap': 0.15493218677125667, 'bull_strategy': 'mean_reversion', 'bull_bb_std_mult': 1.1807441781201937, 'bull_rsi_os': 7, 'bull_rsi_ob': 48, 'bull_adx_thresh': 24.489083741176017, 'bull_atr_min_pct': 0.025380408692554448, 'bull_atr_max_pct': 0.11747830872126985, 'bull_tp_mult': 2.294349148206567, 'bull_tsl_mult': 0.5881313362485061, 'bull_time_stop': 174, 'bull_use_sma': False, 'bull_use_ema': False, 'bull_use_atr': True, 'bull_use_adx': False, 'bull_use_spike': False, 'bull_rsi_required': False, 'bear_strategy': 'breakout', 'bear_bb_std_mult': 3.360860101213577, 'bear_rsi_os': 27, 'bear_rsi_ob': 67, 'bear_adx_thresh': 8.344398844546165, 'bear_atr_min_pct': 0.002061361807572012, 'bear_atr_max_pct': 0.08280684918738462, 'bear_tp_mult': 1.4871688532498206, 'bear_tsl_mult': 0.6813696970247942, 'bear_time_stop': 250, 'bear_use_sma': True, 'bear_use_ema': False, 'bear_use_atr': True, 'bear_use_adx': True, 'bear_use_spike': False, 'bear_rsi_required': True, 'sideways_strategy': 'breakout', 'sideways_bb_std_mult': 0.8727316833957857, 'sideways_rsi_os': 41, 'sideways_rsi_ob': 52, 'sideways_adx_thresh': 33.9919579356628, 'sideways_atr_min_pct': 0.0069679362680959995, 'sideways_atr_max_pct': 0.06256589464508888, 'sideways_tp_mult': 2.856415077519355, 'sideways_tsl_mult': 0.7939099274493948, 'sideways_time_stop': 41, 'sideways_use_sma': False, 'sideways_use_ema': False, 'sideways_use_atr': True, 'sideways_use_adx': True, 'sideways_use_spike': True, 'sideways_rsi_required': False}.
