[I 2025-09-01 10:49:04,839] Trial 36 finished with values: [-1000000000.0, 1000000000.0] and parameters: {'p_sma': 38, 'p_std': 29, 'p_atr': 9, 'p_adx': 16, 'rsi_period': 56, 'ema1': 10, 'ema2': 43, 'slip_atr_k': 0.22802964246049368, 'slip_spread_k': 0.7230570736784456, 'spread_hl_frac': 0.010892499025870996, 'bb_std_mult': 1.488966188003554, 'rsi_os': 47, 'rsi_ob': 53, 'vol_spike': 0.0259284158204931, 'adx_thresh': 17.968910899444925, 'atr_min_pct': 0.024248381415309737, 'atr_max_pct': 0.010191860997217785, 'tp_mult': 1.363661131873807, 'tsl_mult': 0.627257305757485, 'strategy': 'mean_reversion', 'time_stop': 245, 'use_sma': True, 'use_atr': True, 'use_adx': False, 'use_ema': False, 'use_spike': False, 'rsi_required': False, 'edge_k': 0.18927076216009953, 'edge_cap': 0.8190650537287422, 'bull_strategy': 'breakout', 'bull_bb_std_mult': 2.4859965361955867, 'bull_rsi_os': 20, 'bull_rsi_ob': 50, 'bull_adx_thresh': 6.0819137242278245, 'bull_atr_min_pct': 0.002807342446834748, 'bull_atr_max_pct': 0.11741119801619938, 'bull_tp_mult': 2.4370403168676376, 'bull_tsl_mult': 0.5952798915736881, 'bull_time_stop': 141, 'bull_use_sma': False, 'bull_use_ema': False, 'bull_use_atr': True, 'bull_use_adx': True, 'bull_use_spike': False, 'bull_rsi_required': False, 'bear_strategy': 'breakout', 'bear_bb_std_mult': 3.4745555182927816, 'bear_rsi_os': 20, 'bear_rsi_ob': 57, 'bear_adx_thresh': 25.351922850333125, 'bear_atr_min_pct': 0.008338997049093043, 'bear_atr_max_pct': 0.11008865366633315, 'bear_tp_mult': 2.0622128328700473, 'bear_tsl_mult': 0.21813310172276543, 'bear_time_stop': 35, 'bear_use_sma': False, 'bear_use_ema': False, 'bear_use_atr': True, 'bear_use_adx': True, 'bear_use_spike': False, 'bear_rsi_required': True, 'sideways_strategy': 'breakout', 'sideways_bb_std_mult': 1.4922944198610695, 'sideways_rsi_os': 9, 'sideways_rsi_ob': 69, 'sideways_adx_thresh': 31.124292253694954, 'sideways_atr_min_pct': 0.021055922679772333, 'sideways_atr_max_pct': 0.06821040968162781, 'sideways_tp_mult': 2.5880544319460435, 'sideways_tsl_mult': 0.8867433301395552, 'sideways_time_stop': 35, 'sideways_use_sma': False, 'sideways_use_ema': True, 'sideways_use_atr': True, 'sideways_use_adx': True, 'sideways_use_spike': True, 'sideways_rsi_required': False}.
[I 2025-09-01 10:49:46,322] Trial 38 finished with values: [-0.02841101040070515, 0.028261833609243964] and parameters: {'p_sma': 25, 'p_std': 39, 'p_atr': 9, 'p_adx': 24, 'rsi_period': 58, 'ema1': 11, 'ema2': 41, 'slip_atr_k': 0.23101044461910997, 'slip_spread_k': 0.7360588089346691, 'spread_hl_frac': 0.002119247947402124, 'bb_std_mult': 1.6132298102118785, 'rsi_os': 23, 'rsi_ob': 67, 'vol_spike': 0.23333284809394178, 'adx_thresh': 12.55947939777563, 'atr_min_pct': 0.024270547729307798, 'atr_max_pct': 0.05008566610197476, 'tp_mult': 2.6149823249277246, 'tsl_mult': 0.6542517128335916, 'strategy': 'mean_reversion', 'time_stop': 247, 'use_sma': True, 'use_atr': False, 'use_adx': False, 'use_ema': False, 'use_spike': False, 'rsi_required': False, 'edge_k': 0.42932620844310726, 'edge_cap': 0.923011162786305, 'bull_strategy': 'breakout', 'bull_bb_std_mult': 2.588799207259883, 'bull_rsi_os': 10, 'bull_rsi_ob': 61, 'bull_adx_thresh': 5.499820898006144, 'bull_atr_min_pct': 0.0019553088942816264, 'bull_atr_max_pct': 0.14826032853701085, 'bull_tp_mult': 2.411072598215894, 'bull_tsl_mult': 0.17723963744059734, 'bull_time_stop': 144, 'bull_use_sma': False, 'bull_use_ema': True, 'bull_use_atr': False, 'bull_use_adx': False, 'bull_use_spike': False, 'bull_rsi_required': True, 'bear_strategy': 'breakout', 'bear_bb_std_mult': 2.4495741514454044, 'bear_rsi_os': 18, 'bear_rsi_ob': 64, 'bear_adx_thresh': 18.186086762124113, 'bear_atr_min_pct': 0.015215783230739455, 'bear_atr_max_pct': 0.07549855541306137, 'bear_tp_mult': 2.0378791271209677, 'bear_tsl_mult': 0.22332934004737168, 'bear_time_stop': 287, 'bear_use_sma': False, 'bear_use_ema': True, 'bear_use_atr': False, 'bear_use_adx': True, 'bear_use_spike': True, 'bear_rsi_required': True, 'sideways_strategy': 'breakout', 'sideways_bb_std_mult': 1.7622313903683542, 'sideways_rsi_os': 11, 'sideways_rsi_ob': 49, 'sideways_adx_thresh': 30.36829534441695, 'sideways_atr_min_pct': 0.013833897582881227, 'sideways_atr_max_pct': 0.07335475385018253, 'sideways_tp_mult': 1.2562428432308914, 'sideways_tsl_mult': 0.9045070434102918, 'sideways_time_stop': 31, 'sideways_use_sma': False, 'sideways_use_ema': True, 'sideways_use_atr': True, 'sideways_use_adx': False, 'sideways_use_spike': True, 'sideways_rsi_required': False}.
[I 2025-09-01 10:49:46,552] Trial 40 finished with values: [-1000000000.0, 1000000000.0] and parameters: {'p_sma': 31, 'p_std': 38, 'p_atr': 30, 'p_adx': 25, 'rsi_period': 51, 'ema1': 26, 'ema2': 41, 'slip_atr_k': 0.24799838500559138, 'slip_spread_k': 0.08868099016706793, 'spread_hl_frac': 0.002487381907535329, 'bb_std_mult': 3.3737536269384187, 'rsi_os': 23, 'rsi_ob': 69, 'vol_spike': 0.21894927848940024, 'adx_thresh': 23.849171154930282, 'atr_min_pct': 0.011398261508375765, 'atr_max_pct': 0.05089347127264328, 'tp_mult': 2.6894242375099804, 'tsl_mult': 0.8075321733087266, 'strategy': 'mean_reversion', 'time_stop': 212, 'use_sma': False, 'use_atr': False, 'use_adx': True, 'use_ema': False, 'use_spike': True, 'rsi_required': False, 'edge_k': 0.41155333166834945, 'edge_cap': 0.7159002023175028, 'bull_strategy': 'mean_reversion', 'bull_bb_std_mult': 2.7786181528835048, 'bull_rsi_os': 24, 'bull_rsi_ob': 66, 'bull_adx_thresh': 24.965482457821253, 'bull_atr_min_pct': 0.002400483017760831, 'bull_atr_max_pct': 0.14912854684179971, 'bull_tp_mult': 1.6737843292960233, 'bull_tsl_mult': 0.4631439470337668, 'bull_time_stop': 113, 'bull_use_sma': False, 'bull_use_ema': True, 'bull_use_atr': False, 'bull_use_adx': False, 'bull_use_spike': True, 'bull_rsi_required': True, 'bear_strategy': 'mean_reversion', 'bear_bb_std_mult': 2.449853218701496, 'bear_rsi_os': 34, 'bear_rsi_ob': 80, 'bear_adx_thresh': 28.417783473049745, 'bear_atr_min_pct': 0.014561531478486104, 'bear_atr_max_pct': 0.07262434082300233, 'bear_tp_mult': 2.2784660606101745, 'bear_tsl_mult': 0.09280036384292628, 'bear_time_stop': 277, 'bear_use_sma': True, 'bear_use_ema': True, 'bear_use_atr': False, 'bear_use_adx': True, 'bear_use_spike': True, 'bear_rsi_required': True, 'sideways_strategy': 'breakout', 'sideways_bb_std_mult': 3.1404543464354413, 'sideways_rsi_os': 43, 'sideways_rsi_ob': 46, 'sideways_adx_thresh': 25.489180323071974, 'sideways_atr_min_pct': 0.02568850193813347, 'sideways_atr_max_pct': 0.023214846623721995, 'sideways_tp_mult': 2.320944506429217, 'sideways_tsl_mult': 0.7202349771423393, 'sideways_time_stop': 157, 'sideways_use_sma': True, 'sideways_use_ema': True, 'sideways_use_atr': False, 'sideways_use_adx': False, 'sideways_use_spike': True, 'sideways_rsi_required': False}.
[I 2025-09-01 10:49:47,040] Trial 39 finished with values: [-0.035229088281890975, 0.0353082016795977] and parameters: {'p_sma': 45, 'p_std': 37, 'p_atr': 26, 'p_adx': 30, 'rsi_period': 55, 'ema1': 10, 'ema2': 41, 'slip_atr_k': 0.24975736263663917, 'slip_spread_k': 0.8203407412345308, 'spread_hl_frac': 0.0026125081752343335, 'bb_std_mult': 3.421654471322282, 'rsi_os': 48, 'rsi_ob': 66, 'vol_spike': 0.23510004337397877, 'adx_thresh': 24.547706793679886, 'atr_min_pct': 0.02475834641536433, 'atr_max_pct': 0.05158300927438597, 'tp_mult': 2.669046781871236, 'tsl_mult': 0.7699123235221021, 'strategy': 'mean_reversion', 'time_stop': 214, 'use_sma': False, 'use_atr': False, 'use_adx': False, 'use_ema': False, 'use_spike': True, 'rsi_required': False, 'edge_k': 0.44451868806071737, 'edge_cap': 0.7150803320514145, 'bull_strategy': 'breakout', 'bull_bb_std_mult': 2.512718742716444, 'bull_rsi_os': 9, 'bull_rsi_ob': 53, 'bull_adx_thresh': 5.013435562940504, 'bull_atr_min_pct': 0.0019608920220440407, 'bull_atr_max_pct': 0.07074486134671484, 'bull_tp_mult': 2.4230734700271697, 'bull_tsl_mult': 0.7197362179543837, 'bull_time_stop': 141, 'bull_use_sma': False, 'bull_use_ema': True, 'bull_use_atr': False, 'bull_use_adx': False, 'bull_use_spike': False, 'bull_rsi_required': True, 'bear_strategy': 'breakout', 'bear_bb_std_mult': 2.5372810492729596, 'bear_rsi_os': 35, 'bear_rsi_ob': 78, 'bear_adx_thresh': 18.126671108956145, 'bear_atr_min_pct': 0.014401296776646949, 'bear_atr_max_pct': 0.07700503302196081, 'bear_tp_mult': 2.0312918918818976, 'bear_tsl_mult': 0.23808895809856787, 'bear_time_stop': 265, 'bear_use_sma': True, 'bear_use_ema': True, 'bear_use_atr': False, 'bear_use_adx': True, 'bear_use_spike': True, 'bear_rsi_required': True, 'sideways_strategy': 'breakout', 'sideways_bb_std_mult': 1.0932167789348546, 'sideways_rsi_os': 9, 'sideways_rsi_ob': 49, 'sideways_adx_thresh': 25.845456748574076, 'sideways_atr_min_pct': 0.010681946329418886, 'sideways_atr_max_pct': 0.06903276962404889, 'sideways_tp_mult': 1.1286107172631437, 'sideways_tsl_mult': 0.44579869594597465, 'sideways_time_stop': 297, 'sideways_use_sma': True, 'sideways_use_ema': True, 'sideways_use_atr': True, 'sideways_use_adx': False, 'sideways_use_spike': True, 'sideways_rsi_required': False}.
[I 2025-09-01 10:49:47,671] Trial 37 finished with values: [-0.021774641191040556, 0.021871057157796494] and parameters: {'p_sma': 24, 'p_std': 28, 'p_atr': 9, 'p_adx': 24, 'rsi_period': 55, 'ema1': 10, 'ema2': 54, 'slip_atr_k': 0.22774642006731666, 'slip_spread_k': 0.7370403525351666, 'spread_hl_frac': 0.0025421107185925255, 'bb_std_mult': 1.608117261886276, 'rsi_os': 23, 'rsi_ob': 51, 'vol_spike': 0.23059640872028758, 'adx_thresh': 12.247649000864536, 'atr_min_pct': 0.004326161870259797, 'atr_max_pct': 0.047494898565265536, 'tp_mult': 2.6021195126558396, 'tsl_mult': 0.6213990642518447, 'strategy': 'mean_reversion', 'time_stop': 251, 'use_sma': True, 'use_atr': True, 'use_adx': False, 'use_ema': False, 'use_spike': True, 'rsi_required': False, 'edge_k': 0.39815450220711446, 'edge_cap': 0.9112131810040037, 'bull_strategy': 'breakout', 'bull_bb_std_mult': 1.2685449738387027, 'bull_rsi_os': 10, 'bull_rsi_ob': 60, 'bull_adx_thresh': 18.86534370061321, 'bull_atr_min_pct': 0.0024124082249318175, 'bull_atr_max_pct': 0.11581915821243319, 'bull_tp_mult': 2.4738040476150465, 'bull_tsl_mult': 0.5797571824551311, 'bull_time_stop': 294, 'bull_use_sma': False, 'bull_use_ema': True, 'bull_use_atr': False, 'bull_use_adx': True, 'bull_use_spike': False, 'bull_rsi_required': False, 'bear_strategy': 'breakout', 'bear_bb_std_mult': 3.460928567692996, 'bear_rsi_os': 18, 'bear_rsi_ob': 80, 'bear_adx_thresh': 24.98996449508737, 'bear_atr_min_pct': 0.014343953674583151, 'bear_atr_max_pct': 0.06670270724549722, 'bear_tp_mult': 2.032883125827185, 'bear_tsl_mult': 0.2322057923866931, 'bear_time_stop': 34, 'bear_use_sma': False, 'bear_use_ema': False, 'bear_use_atr': True, 'bear_use_adx': True, 'bear_use_spike': False, 'bear_rsi_required': True, 'sideways_strategy': 'breakout', 'sideways_bb_std_mult': 1.726488802082629, 'sideways_rsi_os': 9, 'sideways_rsi_ob': 48, 'sideways_adx_thresh': 31.203683513230235, 'sideways_atr_min_pct': 0.01314719633834121, 'sideways_atr_max_pct': 0.07007817339708934, 'sideways_tp_mult': 1.1857090129340886, 'sideways_tsl_mult': 0.4571049220774864, 'sideways_time_stop': 29, 'sideways_use_sma': False, 'sideways_use_ema': True, 'sideways_use_atr': True, 'sideways_use_adx': True, 'sideways_use_spike': True, 'sideways_rsi_required': False}.
[I 2025-09-01 10:49:47,977] Trial 44 finished with values: [-1000000000.0, 1000000000.0] and parameters: {'p_sma': 24, 'p_std': 26, 'p_atr': 9, 'p_adx': 24, 'rsi_period': 46, 'ema1': 7, 'ema2': 53, 'slip_atr_k': 0.10981208957915051, 'slip_spread_k': 0.6824624162457908, 'spread_hl_frac': 0.015920555162810268, 'bb_std_mult': 1.2570413981224473, 'rsi_os': 36, 'rsi_ob': 45, 'vol_spike': 0.22340902607079827, 'adx_thresh': 12.988225719767419, 'atr_min_pct': 0.02144779501487994, 'atr_max_pct': 0.07302919752065384, 'tp_mult': 2.483172642477211, 'tsl_mult': 0.6727579823241103, 'strategy': 'mean_reversion', 'time_stop': 200, 'use_sma': True, 'use_atr': True, 'use_adx': False, 'use_ema': False, 'use_spike': True, 'rsi_required': False, 'edge_k': 1.3449155810703972, 'edge_cap': 0.9595650664229778, 'bull_strategy': 'breakout', 'bull_bb_std_mult': 1.142019488631314, 'bull_rsi_os': 8, 'bull_rsi_ob': 58, 'bull_adx_thresh': 18.376471731190936, 'bull_atr_min_pct': 0.013476996057325049, 'bull_atr_max_pct': 0.06450570619950832, 'bull_tp_mult': 2.016642995299017, 'bull_tsl_mult': 0.010671635494024612, 'bull_time_stop': 296, 'bull_use_sma': False, 'bull_use_ema': True, 'bull_use_atr': False, 'bull_use_adx': True, 'bull_use_spike': False, 'bull_rsi_required': False, 'bear_strategy': 'breakout', 'bear_bb_std_mult': 3.381188738079066, 'bear_rsi_os': 17, 'bear_rsi_ob': 71, 'bear_adx_thresh': 30.893433043418828, 'bear_atr_min_pct': 0.01800624856141036, 'bear_atr_max_pct': 0.04843806426307158, 'bear_tp_mult': 1.0208131652434749, 'bear_tsl_mult': 0.35688935029916746, 'bear_time_stop': 70, 'bear_use_sma': False, 'bear_use_ema': False, 'bear_use_atr': True, 'bear_use_adx': True, 'bear_use_spike': True, 'bear_rsi_required': True, 'sideways_strategy': 'breakout', 'sideways_bb_std_mult': 1.844992330161718, 'sideways_rsi_os': 16, 'sideways_rsi_ob': 50, 'sideways_adx_thresh': 32.69070546220268, 'sideways_atr_min_pct': 0.010628481045109512, 'sideways_atr_max_pct': 0.08287698319736245, 'sideways_tp_mult': 1.226063874050396, 'sideways_tsl_mult': 0.380937455534493, 'sideways_time_stop': 226, 'sideways_use_sma': False, 'sideways_use_ema': True, 'sideways_use_atr': True, 'sideways_use_adx': False, 'sideways_use_spike': True, 'sideways_rsi_required': False}.
[I 2025-09-01 10:49:48,041] Trial 45 finished with values: [-1000000000.0, 1000000000.0] and parameters: {'p_sma': 23, 'p_std': 55, 'p_atr': 9, 'p_adx': 27, 'rsi_period': 60, 'ema1': 5, 'ema2': 53, 'slip_atr_k': 0.04435116228630727, 'slip_spread_k': 0.853107677339344, 'spread_hl_frac': 0.03517454648694014, 'bb_std_mult': 1.8726623004813483, 'rsi_os': 23, 'rsi_ob': 50, 'vol_spike': 0.25879377669757875, 'adx_thresh': 11.370424188491375, 'atr_min_pct': 0.0022396626488341053, 'atr_max_pct': 0.04492781742579494, 'tp_mult': 2.6429189008908986, 'tsl_mult': 0.5825182992165769, 'strategy': 'mean_reversion', 'time_stop': 106, 'use_sma': True, 'use_atr': True, 'use_adx': False, 'use_ema': False, 'use_spike': False, 'rsi_required': True, 'edge_k': 0.2890736851085894, 'edge_cap': 0.26663428715415477, 'bull_strategy': 'mean_reversion', 'bull_bb_std_mult': 1.1909603147294603, 'bull_rsi_os': 12, 'bull_rsi_ob': 60, 'bull_adx_thresh': 13.464695062287419, 'bull_atr_min_pct': 0.005936085283095141, 'bull_atr_max_pct': 0.08482707413993268, 'bull_tp_mult': 2.1800114800761095, 'bull_tsl_mult': 0.4265304361227108, 'bull_time_stop': 263, 'bull_use_sma': False, 'bull_use_ema': True, 'bull_use_atr': False, 'bull_use_adx': True, 'bull_use_spike': False, 'bull_rsi_required': False, 'bear_strategy': 'breakout', 'bear_bb_std_mult': 2.184804887046628, 'bear_rsi_os': 19, 'bear_rsi_ob': 88, 'bear_adx_thresh': 27.15636828400568, 'bear_atr_min_pct': 0.015854610510066102, 'bear_atr_max_pct': 0.025853585607269497, 'bear_tp_mult': 1.7416213502056168, 'bear_tsl_mult': 0.874680639508617, 'bear_time_stop': 232, 'bear_use_sma': False, 'bear_use_ema': False, 'bear_use_atr': True, 'bear_use_adx': True, 'bear_use_spike': False, 'bear_rsi_required': False, 'sideways_strategy': 'breakout', 'sideways_bb_std_mult': 1.7782519238509005, 'sideways_rsi_os': 7, 'sideways_rsi_ob': 46, 'sideways_adx_thresh': 11.707418432576286, 'sideways_atr_min_pct': 0.008598670468157193, 'sideways_atr_max_pct': 0.07584610563811613, 'sideways_tp_mult': 1.2198923501951964, 'sideways_tsl_mult': 0.3210853281004928, 'sideways_time_stop': 224, 'sideways_use_sma': False, 'sideways_use_ema': True, 'sideways_use_atr': True, 'sideways_use_adx': True, 'sideways_use_spike': True, 'sideways_rsi_required': False}.
[I 2025-09-01 10:49:48,158] Trial 46 finished with values: [-1000000000.0, 1000000000.0] and parameters: {'p_sma': 11, 'p_std': 26, 'p_atr': 13, 'p_adx': 28, 'rsi_period': 18, 'ema1': 7, 'ema2': 24, 'slip_atr_k': 0.14419406372185392, 'slip_spread_k': 0.6371271636701686, 'spread_hl_frac': 0.01436607051095788, 'bb_std_mult': 2.2190916979754776, 'rsi_os': 10, 'rsi_ob': 56, 'vol_spike': 0.19747377767225457, 'adx_thresh': 30.408476102582448, 'atr_min_pct': 0.02900478883553237, 'atr_max_pct': 0.02583173899884457, 'tp_mult': 2.794971564951409, 'tsl_mult': 0.856395688848983, 'strategy': 'mean_reversion', 'time_stop': 231, 'use_sma': True, 'use_atr': True, 'use_adx': False, 'use_ema': False, 'use_spike': True, 'rsi_required': False, 'edge_k': 1.4322631973767963, 'edge_cap': 0.988207650938853, 'bull_strategy': 'breakout', 'bull_bb_std_mult': 0.9092376837188212, 'bull_rsi_os': 7, 'bull_rsi_ob': 62, 'bull_adx_thresh': 9.747700384398328, 'bull_atr_min_pct': 0.00822799026426895, 'bull_atr_max_pct': 0.03349382950408617, 'bull_tp_mult': 2.5647549631137503, 'bull_tsl_mult': 0.1757363597257331, 'bull_time_stop': 280, 'bull_use_sma': False, 'bull_use_ema': True, 'bull_use_atr': True, 'bull_use_adx': True, 'bull_use_spike': False, 'bull_rsi_required': False, 'bear_strategy': 'breakout', 'bear_bb_std_mult': 0.5506499510239025, 'bear_rsi_os': 49, 'bear_rsi_ob': 82, 'bear_adx_thresh': 34.1723805435507, 'bear_atr_min_pct': 0.011686836166723273, 'bear_atr_max_pct': 0.04954902582086304, 'bear_tp_mult': 1.5192443700085954, 'bear_tsl_mult': 0.21201511910430226, 'bear_time_stop': 296, 'bear_use_sma': False, 'bear_use_ema': False, 'bear_use_atr': True, 'bear_use_adx': True, 'bear_use_spike': True, 'bear_rsi_required': True, 'sideways_strategy': 'breakout', 'sideways_bb_std_mult': 2.208366495544746, 'sideways_rsi_os': 55, 'sideways_rsi_ob': 54, 'sideways_adx_thresh': 29.449385527580613, 'sideways_atr_min_pct': 0.012312466722924582, 'sideways_atr_max_pct': 0.0938055187534883, 'sideways_tp_mult': 2.999254082637686, 'sideways_tsl_mult': 0.41342233432985603, 'sideways_time_stop': 271, 'sideways_use_sma': False, 'sideways_use_ema': True, 'sideways_use_atr': True, 'sideways_use_adx': False, 'sideways_use_spike': False, 'sideways_rsi_required': True}.
[I 2025-09-01 10:49:48,488] Trial 47 finished with values: [-1000000000.0, 1000000000.0] and parameters: {'p_sma': 25, 'p_std': 60, 'p_atr': 10, 'p_adx': 23, 'rsi_period': 52, 'ema1': 12, 'ema2': 53, 'slip_atr_k': 0.05068797551284829, 'slip_spread_k': 0.7838944958524205, 'spread_hl_frac': 0.024217561714118135, 'bb_std_mult': 1.7284781918590602, 'rsi_os': 38, 'rsi_ob': 50, 'vol_spike': 0.2700633398338744, 'adx_thresh': 34.74197172933545, 'atr_min_pct': 0.0012919817498493868, 'atr_max_pct': 0.04789364646047555, 'tp_mult': 2.492369087004982, 'tsl_mult': 0.22028753714922333, 'strategy': 'mean_reversion', 'time_stop': 131, 'use_sma': True, 'use_atr': True, 'use_adx': False, 'use_ema': True, 'use_spike': True, 'rsi_required': True, 'edge_k': 1.6553647953887034, 'edge_cap': 0.9354393075866824, 'bull_strategy': 'mean_reversion', 'bull_bb_std_mult': 1.304041605669811, 'bull_rsi_os': 12, 'bull_rsi_ob': 53, 'bull_adx_thresh': 14.923660047389989, 'bull_atr_min_pct': 0.015995997220169922, 'bull_atr_max_pct': 0.07865134630992587, 'bull_tp_mult': 2.4012812565463175, 'bull_tsl_mult': 0.7289159494437026, 'bull_time_stop': 246, 'bull_use_sma': True, 'bull_use_ema': False, 'bull_use_atr': False, 'bull_use_adx': True, 'bull_use_spike': False, 'bull_rsi_required': False, 'bear_strategy': 'mean_reversion', 'bear_bb_std_mult': 3.246011822494872, 'bear_rsi_os': 19, 'bear_rsi_ob': 74, 'bear_adx_thresh': 21.94359569539274, 'bear_atr_min_pct': 0.01655450994504257, 'bear_atr_max_pct': 0.12864890693822412, 'bear_tp_mult': 1.9869046996182305, 'bear_tsl_mult': 0.4588739618322339, 'bear_time_stop': 27, 'bear_use_sma': False, 'bear_use_ema': False, 'bear_use_atr': True, 'bear_use_adx': True, 'bear_use_spike': False, 'bear_rsi_required': False, 'sideways_strategy': 'breakout', 'sideways_bb_std_mult': 2.3737100847265826, 'sideways_rsi_os': 33, 'sideways_rsi_ob': 49, 'sideways_adx_thresh': 20.351313347585155, 'sideways_atr_min_pct': 0.013102700725560357, 'sideways_atr_max_pct': 0.07842096974970149, 'sideways_tp_mult': 1.1223619540168621, 'sideways_tsl_mult': 0.5990393964187586, 'sideways_time_stop': 26, 'sideways_use_sma': False, 'sideways_use_ema': True, 'sideways_use_atr': True, 'sideways_use_adx': True, 'sideways_use_spike': True, 'sideways_rsi_required': False}.
