[I 2025-09-01 12:18:08,121] Trial 592 finished with values: [-1000000000.0, 1000000000.0] and parameters: {'p_sma': 24, 'p_std': 31, 'p_atr': 13, 'p_adx': 11, 'rsi_period': 47, 'ema1': 26, 'ema2': 40, 'slip_atr_k': 0.051391237185754876, 'slip_spread_k': 0.380834093208585, 'spread_hl_frac': 0.04896386776982335, 'bb_std_mult': 0.8774799452451769, 'rsi_os': 34, 'rsi_ob': 47, 'vol_spike': 0.1986505631329873, 'adx_thresh': 18.38091194974214, 'atr_min_pct': 0.01631899829828037, 'atr_max_pct': 0.08108040222098546, 'tp_mult': 2.4075512295316805, 'tsl_mult': 0.17319936798437674, 'strategy': 'breakout', 'time_stop': 146, 'use_sma': True, 'use_atr': True, 'use_adx': True, 'use_ema': True, 'use_spike': False, 'rsi_required': False, 'edge_k': 1.2972683465105674, 'edge_cap': 0.15817094353358857, 'bull_strategy': 'mean_reversion', 'bull_bb_std_mult': 1.7329615248060921, 'bull_rsi_os': 49, 'bull_rsi_ob': 49, 'bull_adx_thresh': 7.205797693346083, 'bull_atr_min_pct': 0.016327193863087362, 'bull_atr_max_pct': 0.06721604480385364, 'bull_tp_mult': 1.2787394171783057, 'bull_tsl_mult': 0.5292938055295, 'bull_time_stop': 159, 'bull_use_sma': False, 'bull_use_ema': False, 'bull_use_atr': True, 'bull_use_adx': False, 'bull_use_spike': False, 'bull_rsi_required': True, 'bear_strategy': 'breakout', 'bear_bb_std_mult': 2.375421640010977, 'bear_rsi_os': 30, 'bear_rsi_ob': 72, 'bear_adx_thresh': 9.457879086978426, 'bear_atr_min_pct': 0.0038731082774499867, 'bear_atr_max_pct': 0.02882454695933394, 'bear_tp_mult': 1.4102822851488381, 'bear_tsl_mult': 0.7594074614098186, 'bear_time_stop': 277, 'bear_use_sma': False, 'bear_use_ema': False, 'bear_use_atr': True, 'bear_use_adx': True, 'bear_use_spike': False, 'bear_rsi_required': True, 'sideways_strategy': 'breakout', 'sideways_bb_std_mult': 1.4468582589011834, 'sideways_rsi_os': 29, 'sideways_rsi_ob': 80, 'sideways_adx_thresh': 29.84033453986626, 'sideways_atr_min_pct': 0.009067445449342907, 'sideways_atr_max_pct': 0.13273189770634428, 'sideways_tp_mult': 2.895670717590186, 'sideways_tsl_mult': 0.4013479598534531, 'sideways_time_stop': 94, 'sideways_use_sma': False, 'sideways_use_ema': False, 'sideways_use_atr': True, 'sideways_use_adx': True, 'sideways_use_spike': True, 'sideways_rsi_required': False}.
[I 2025-09-01 12:18:08,365] Trial 594 finished with values: [-1000000000.0, 1000000000.0] and parameters: {'p_sma': 24, 'p_std': 30, 'p_atr': 20, 'p_adx': 18, 'rsi_period': 47, 'ema1': 26, 'ema2': 17, 'slip_atr_k': 0.08560332512078209, 'slip_spread_k': 0.3593198528597953, 'spread_hl_frac': 0.0029275704466249905, 'bb_std_mult': 0.7942557537787334, 'rsi_os': 32, 'rsi_ob': 48, 'vol_spike': 0.07697116460798202, 'adx_thresh': 24.133466207904654, 'atr_min_pct': 0.0060492405748821965, 'atr_max_pct': 0.08080606845505847, 'tp_mult': 2.9988045487864032, 'tsl_mult': 0.07693930766477439, 'strategy': 'breakout', 'time_stop': 173, 'use_sma': True, 'use_atr': True, 'use_adx': True, 'use_ema': True, 'use_spike': False, 'rsi_required': False, 'edge_k': 0.09659513123784552, 'edge_cap': 0.9871024036964842, 'bull_strategy': 'mean_reversion', 'bull_bb_std_mult': 3.098135084166, 'bull_rsi_os': 54, 'bull_rsi_ob': 59, 'bull_adx_thresh': 5.904345882620457, 'bull_atr_min_pct': 0.01679426907444553, 'bull_atr_max_pct': 0.06710017462887731, 'bull_tp_mult': 1.2902218256616818, 'bull_tsl_mult': 0.7141259608809891, 'bull_time_stop': 49, 'bull_use_sma': False, 'bull_use_ema': False, 'bull_use_atr': True, 'bull_use_adx': False, 'bull_use_spike': False, 'bull_rsi_required': True, 'bear_strategy': 'breakout', 'bear_bb_std_mult': 3.414121942411444, 'bear_rsi_os': 30, 'bear_rsi_ob': 86, 'bear_adx_thresh': 5.588159844436957, 'bear_atr_min_pct': 0.019351810733526674, 'bear_atr_max_pct': 0.019580531100598243, 'bear_tp_mult': 1.4371060061974679, 'bear_tsl_mult': 0.7249956026136513, 'bear_time_stop': 268, 'bear_use_sma': False, 'bear_use_ema': False, 'bear_use_atr': True, 'bear_use_adx': True, 'bear_use_spike': False, 'bear_rsi_required': True, 'sideways_strategy': 'breakout', 'sideways_bb_std_mult': 1.242870605754172, 'sideways_rsi_os': 40, 'sideways_rsi_ob': 87, 'sideways_adx_thresh': 10.006591055206854, 'sideways_atr_min_pct': 0.008908871755757644, 'sideways_atr_max_pct': 0.13255585752629095, 'sideways_tp_mult': 2.901822725426863, 'sideways_tsl_mult': 0.3616986923072583, 'sideways_time_stop': 93, 'sideways_use_sma': False, 'sideways_use_ema': False, 'sideways_use_atr': True, 'sideways_use_adx': True, 'sideways_use_spike': True, 'sideways_rsi_required': False}.
[I 2025-09-01 12:18:48,998] Trial 598 finished with values: [-0.011596776905062112, 0.01287549328510161] and parameters: {'p_sma': 25, 'p_std': 35, 'p_atr': 28, 'p_adx': 18, 'rsi_period': 44, 'ema1': 25, 'ema2': 13, 'slip_atr_k': 0.027947876113069904, 'slip_spread_k': 0.7670856452344679, 'spread_hl_frac': 0.004197394850622081, 'bb_std_mult': 1.2819619053754527, 'rsi_os': 36, 'rsi_ob': 70, 'vol_spike': 0.1907763387728579, 'adx_thresh': 22.72237427345845, 'atr_min_pct': 0.019925180759881575, 'atr_max_pct': 0.09480837377495499, 'tp_mult': 2.1649873201910257, 'tsl_mult': 0.12539134496772245, 'strategy': 'mean_reversion', 'time_stop': 24, 'use_sma': False, 'use_atr': True, 'use_adx': True, 'use_ema': True, 'use_spike': False, 'rsi_required': False, 'edge_k': 0.027320785866799868, 'edge_cap': 0.1363950746606417, 'bull_strategy': 'mean_reversion', 'bull_bb_std_mult': 1.9580370913317324, 'bull_rsi_os': 51, 'bull_rsi_ob': 67, 'bull_adx_thresh': 13.58704160834088, 'bull_atr_min_pct': 0.029367317930162548, 'bull_atr_max_pct': 0.10439006233761786, 'bull_tp_mult': 2.956461655615798, 'bull_tsl_mult': 0.5680048134332913, 'bull_time_stop': 96, 'bull_use_sma': False, 'bull_use_ema': False, 'bull_use_atr': True, 'bull_use_adx': False, 'bull_use_spike': False, 'bull_rsi_required': False, 'bear_strategy': 'breakout', 'bear_bb_std_mult': 2.1142428300795113, 'bear_rsi_os': 11, 'bear_rsi_ob': 51, 'bear_adx_thresh': 5.613594367739209, 'bear_atr_min_pct': 0.002707730504823352, 'bear_atr_max_pct': 0.01758100665920824, 'bear_tp_mult': 1.0624979275472166, 'bear_tsl_mult': 0.7186113879031992, 'bear_time_stop': 291, 'bear_use_sma': True, 'bear_use_ema': False, 'bear_use_atr': True, 'bear_use_adx': True, 'bear_use_spike': False, 'bear_rsi_required': True, 'sideways_strategy': 'breakout', 'sideways_bb_std_mult': 3.1178827098209414, 'sideways_rsi_os': 30, 'sideways_rsi_ob': 88, 'sideways_adx_thresh': 34.39700669896184, 'sideways_atr_min_pct': 0.005412544257425083, 'sideways_atr_max_pct': 0.07192366176358274, 'sideways_tp_mult': 2.421303232675181, 'sideways_tsl_mult': 0.567569448221106, 'sideways_time_stop': 81, 'sideways_use_sma': False, 'sideways_use_ema': False, 'sideways_use_atr': True, 'sideways_use_adx': True, 'sideways_use_spike': True, 'sideways_rsi_required': False}.
[I 2025-09-01 12:18:49,726] Trial 597 finished with values: [-1000000000.0, 1000000000.0] and parameters: {'p_sma': 24, 'p_std': 35, 'p_atr': 20, 'p_adx': 18, 'rsi_period': 43, 'ema1': 25, 'ema2': 15, 'slip_atr_k': 0.08516945240465093, 'slip_spread_k': 0.4957964564342802, 'spread_hl_frac': 0.0036569783880193527, 'bb_std_mult': 0.9927751448922798, 'rsi_os': 6, 'rsi_ob': 69, 'vol_spike': 0.19157777197831635, 'adx_thresh': 34.47892875314403, 'atr_min_pct': 0.023603365965731156, 'atr_max_pct': 0.07496854685291303, 'tp_mult': 1.9452087864017935, 'tsl_mult': 0.17168454431447477, 'strategy': 'breakout', 'time_stop': 170, 'use_sma': False, 'use_atr': True, 'use_adx': True, 'use_ema': True, 'use_spike': False, 'rsi_required': False, 'edge_k': 0.0847139662746918, 'edge_cap': 0.9932199219102792, 'bull_strategy': 'mean_reversion', 'bull_bb_std_mult': 0.9481378861529237, 'bull_rsi_os': 5, 'bull_rsi_ob': 78, 'bull_adx_thresh': 17.285861217181267, 'bull_atr_min_pct': 0.013301654384849482, 'bull_atr_max_pct': 0.11078589764197125, 'bull_tp_mult': 1.3524633790266951, 'bull_tsl_mult': 0.5750686570832638, 'bull_time_stop': 155, 'bull_use_sma': False, 'bull_use_ema': False, 'bull_use_atr': True, 'bull_use_adx': False, 'bull_use_spike': False, 'bull_rsi_required': False, 'bear_strategy': 'breakout', 'bear_bb_std_mult': 1.5469047821702415, 'bear_rsi_os': 25, 'bear_rsi_ob': 51, 'bear_adx_thresh': 9.470274821884118, 'bear_atr_min_pct': 0.0192781362906436, 'bear_atr_max_pct': 0.019693551788827035, 'bear_tp_mult': 1.4506897809058903, 'bear_tsl_mult': 0.716562328893059, 'bear_time_stop': 19, 'bear_use_sma': True, 'bear_use_ema': False, 'bear_use_atr': True, 'bear_use_adx': True, 'bear_use_spike': False, 'bear_rsi_required': True, 'sideways_strategy': 'breakout', 'sideways_bb_std_mult': 3.234355525004182, 'sideways_rsi_os': 36, 'sideways_rsi_ob': 64, 'sideways_adx_thresh': 9.932009880347273, 'sideways_atr_min_pct': 0.0039177576963166936, 'sideways_atr_max_pct': 0.0736241933313862, 'sideways_tp_mult': 2.8833088294355296, 'sideways_tsl_mult': 0.85518842349415, 'sideways_time_stop': 92, 'sideways_use_sma': False, 'sideways_use_ema': False, 'sideways_use_atr': True, 'sideways_use_adx': True, 'sideways_use_spike': True, 'sideways_rsi_required': False}.
[I 2025-09-01 12:18:50,026] Trial 599 finished with values: [-1000000000.0, 1000000000.0] and parameters: {'p_sma': 40, 'p_std': 33, 'p_atr': 21, 'p_adx': 8, 'rsi_period': 43, 'ema1': 11, 'ema2': 15, 'slip_atr_k': 0.029126334551758774, 'slip_spread_k': 0.33681844338296163, 'spread_hl_frac': 0.0043568872625719774, 'bb_std_mult': 1.3964283585660597, 'rsi_os': 18, 'rsi_ob': 69, 'vol_spike': 0.004205414589271039, 'adx_thresh': 22.788805950318682, 'atr_min_pct': 0.023626195876950803, 'atr_max_pct': 0.07437205218236725, 'tp_mult': 1.9367188549002654, 'tsl_mult': 0.1402336875575907, 'strategy': 'mean_reversion', 'time_stop': 183, 'use_sma': False, 'use_atr': True, 'use_adx': True, 'use_ema': False, 'use_spike': False, 'rsi_required': False, 'edge_k': 1.2007645498121844, 'edge_cap': 0.1376406557642959, 'bull_strategy': 'mean_reversion', 'bull_bb_std_mult': 0.9373207756663204, 'bull_rsi_os': 51, 'bull_rsi_ob': 47, 'bull_adx_thresh': 7.334165170773198, 'bull_atr_min_pct': 0.01552736108860415, 'bull_atr_max_pct': 0.1052071743565469, 'bull_tp_mult': 2.264261463246154, 'bull_tsl_mult': 0.5749487897867951, 'bull_time_stop': 167, 'bull_use_sma': False, 'bull_use_ema': False, 'bull_use_atr': True, 'bull_use_adx': False, 'bull_use_spike': False, 'bull_rsi_required': False, 'bear_strategy': 'mean_reversion', 'bear_bb_std_mult': 2.1212879027110105, 'bear_rsi_os': 25, 'bear_rsi_ob': 51, 'bear_adx_thresh': 10.152416927018376, 'bear_atr_min_pct': 0.021021410192633528, 'bear_atr_max_pct': 0.023479898864758708, 'bear_tp_mult': 2.921796938022887, 'bear_tsl_mult': 0.6866550289516289, 'bear_time_stop': 292, 'bear_use_sma': True, 'bear_use_ema': False, 'bear_use_atr': True, 'bear_use_adx': True, 'bear_use_spike': False, 'bear_rsi_required': True, 'sideways_strategy': 'breakout', 'sideways_bb_std_mult': 1.3182273892751226, 'sideways_rsi_os': 26, 'sideways_rsi_ob': 74, 'sideways_adx_thresh': 15.102596367331731, 'sideways_atr_min_pct': 0.005205224189134263, 'sideways_atr_max_pct': 0.07165631675481413, 'sideways_tp_mult': 2.0383659292258067, 'sideways_tsl_mult': 0.3857828325210433, 'sideways_time_stop': 83, 'sideways_use_sma': False, 'sideways_use_ema': False, 'sideways_use_atr': True, 'sideways_use_adx': True, 'sideways_use_spike': True, 'sideways_rsi_required': False}.
[I 2025-09-01 12:18:50,365] Trial 596 finished with values: [-1000000000.0, 1000000000.0] and parameters: {'p_sma': 40, 'p_std': 35, 'p_atr': 20, 'p_adx': 8, 'rsi_period': 43, 'ema1': 25, 'ema2': 15, 'slip_atr_k': 0.16837877638092238, 'slip_spread_k': 0.38676838380124884, 'spread_hl_frac': 0.004071384654176046, 'bb_std_mult': 2.4148232370284415, 'rsi_os': 34, 'rsi_ob': 51, 'vol_spike': 0.190561156176468, 'adx_thresh': 34.411681570109806, 'atr_min_pct': 0.02365821516861584, 'atr_max_pct': 0.07985701295510514, 'tp_mult': 2.0172767092593684, 'tsl_mult': 0.0775355177287186, 'strategy': 'breakout', 'time_stop': 172, 'use_sma': False, 'use_atr': True, 'use_adx': True, 'use_ema': False, 'use_spike': False, 'rsi_required': False, 'edge_k': 0.08507576142816299, 'edge_cap': 0.14450730946383064, 'bull_strategy': 'mean_reversion', 'bull_bb_std_mult': 2.2819651005450887, 'bull_rsi_os': 5, 'bull_rsi_ob': 78, 'bull_adx_thresh': 13.719364114756672, 'bull_atr_min_pct': 0.016696265676695493, 'bull_atr_max_pct': 0.10697826978001189, 'bull_tp_mult': 1.2882322199010603, 'bull_tsl_mult': 0.5241799415311119, 'bull_time_stop': 160, 'bull_use_sma': False, 'bull_use_ema': False, 'bull_use_atr': True, 'bull_use_adx': False, 'bull_use_spike': False, 'bull_rsi_required': True, 'bear_strategy': 'mean_reversion', 'bear_bb_std_mult': 3.441911315436668, 'bear_rsi_os': 13, 'bear_rsi_ob': 86, 'bear_adx_thresh': 7.8121359940564306, 'bear_atr_min_pct': 0.0039546647893460175, 'bear_atr_max_pct': 0.01796729003520388, 'bear_tp_mult': 1.6174730628923109, 'bear_tsl_mult': 0.7154291292261878, 'bear_time_stop': 18, 'bear_use_sma': True, 'bear_use_ema': False, 'bear_use_atr': True, 'bear_use_adx': True, 'bear_use_spike': False, 'bear_rsi_required': True, 'sideways_strategy': 'breakout', 'sideways_bb_std_mult': 0.9924733119918767, 'sideways_rsi_os': 36, 'sideways_rsi_ob': 90, 'sideways_adx_thresh': 34.418503007569015, 'sideways_atr_min_pct': 0.01341617342261853, 'sideways_atr_max_pct': 0.07170482138507522, 'sideways_tp_mult': 2.89522716034795, 'sideways_tsl_mult': 0.5656618362993937, 'sideways_time_stop': 91, 'sideways_use_sma': False, 'sideways_use_ema': False, 'sideways_use_atr': True, 'sideways_use_adx': True, 'sideways_use_spike': True, 'sideways_rsi_required': False}.
Starting optimization (600 trials, n_jobs=4) | multi-objective=True
Saved trials CSV -> runs/REAL_SPOT_LONG_US_ret/h14-15-16-17-18-19-20-22_r0.025_s913/trials_metrics.csv
Saved Pareto plot -> runs/REAL_SPOT_LONG_US_ret/h14-15-16-17-18-19-20-22_r0.025_s913/pareto_return_vs_drawdown.png
Top-K under DD cap: [422] (agg='median')
=== Selected trial(s) ===
top_k=1 selected_trial_numbers=[422] primary=422
ret%_train=0.00% dd%_train=0.00% trades=0
ret%_test=0.00% dd%_test=0.00% pnl_test=0.00 trades_test=0
WFO fold 1: OOS PnL=0.00 trades=0 win_rate=0.00% avg=0.000000 ret%=0.00% maxDD=0.000000 maxDD%=0.00%
WFO fold 2: OOS PnL=0.00 trades=0 win_rate=0.00% avg=0.000000 ret%=0.00% maxDD=0.000000 maxDD%=0.00%
WFO fold 3: OOS PnL=0.00 trades=0 win_rate=0.00% avg=0.000000 ret%=0.00% maxDD=0.000000 maxDD%=0.00%
WFO fold 4: OOS PnL=0.00 trades=0 win_rate=0.00% avg=0.000000 ret%=0.00% maxDD=0.000000 maxDD%=0.00%
WFO fold 5: OOS PnL=0.00 trades=0 win_rate=0.00% avg=0.000000 ret%=0.00% maxDD=0.000000 maxDD%=0.00%
WFO fold 6: OOS PnL=0.00 trades=0 win_rate=0.00% avg=0.000000 ret%=0.00% maxDD=0.000000 maxDD%=0.00%
WFO summary: meanPnL=0.00 stdPnL=0.00 meanWR=0.00% meanAvg=0.000000 meanRet%=0.00% worstDD=0.000000 worstDD%=0.00% folds=6 trades=0
Wrote runs/REAL_SPOT_LONG_US_ret/h14-15-16-17-18-19-20-22_r0.025_s913/strategy_profile.json
=== ECHO SELECTED PARAMS (JSON) ===
{
  "adx_thresh": 24.47156079506984,
  "aggregate_params": "median",
  "atr_max_pct": 0.08169469072188969,
  "atr_min_pct": 0.023872295174049693,
  "bar_priority": "stop_first",
  "bb_std_mult": 1.1122222512769158,
  "bear_adx_thresh": 7.5626929472502935,
  "bear_atr_max_pct": 0.0183828880398531,
  "bear_atr_min_pct": 0.005058544166505379,
  "bear_bb_std_mult": 1.4571788647532662,
  "bear_rsi_ob": 51,
  "bear_rsi_os": 30,
  "bear_rsi_required": true,
  "bear_strategy": "breakout",
  "bear_time_stop": 218,
  "bear_tp_mult": 1.5593846067189656,
  "bear_tsl_mult": 0.6623807531288781,
  "bear_use_adx": true,
  "bear_use_atr": true,
  "bear_use_ema": false,
  "bear_use_sma": true,
  "bear_use_spike": false,
  "bull_adx_thresh": 5.932233306342789,
  "bull_atr_max_pct": 0.1136981552664761,
  "bull_atr_min_pct": 0.017836421968743393,
  "bull_bb_std_mult": 1.48248915527623,
  "bull_rsi_ob": 51,
  "bull_rsi_os": 47,
  "bull_rsi_required": false,
  "bull_strategy": "mean_reversion",
  "bull_time_stop": 157,
  "bull_tp_mult": 1.120218113127511,
  "bull_tsl_mult": 0.671448209349818,
  "bull_use_adx": false,
  "bull_use_atr": true,
  "bull_use_ema": false,
  "bull_use_sma": false,
  "bull_use_spike": false,
  "cooldown_bars": 30,
  "daily_loss_limit_pct": 0.1,
  "edge_cap": 0.05050347600172475,
  "edge_k": 0.21416463533461605,
  "ema1": 25,
  "ema2": 19,
  "embargo_bars": 150,
  "fee": 0.0005,
  "fill_timing": "next_open",
  "include_hours_set": "{14, 15, 16, 17, 18, 19, 20, 22}",
  "lockout_bars": 100,
  "max_consec_losses": 7,
  "max_notional_pct_equity": 1.0,
  "min_notional": 5.0,
  "ml_thresh": 0.0,
  "objective": "multi",
  "p_adx": 7,
  "p_atr": 17,
  "p_sma": 23,
  "p_std": 32,
  "participation_cap": 1.0,
  "price_step": 0.0001,
  "proba_temp": 1.0,
  "qty_step": 0.0001,
  "regime_adapt": true,
  "regime_band": 0.006,
  "regime_fast": 50,
  "regime_overrides": {
    "bear": {
      "adx": 20.0,
      "allowed_sides": [
        "long",
        "short"
      ],
      "atr_range": [
        0.0015,
        0.06
      ],
      "bb_std_mult": 1.2571599337995167,
      "mode": "breakout",
      "rsi_required": true,
      "time_stop_bars": 122,
      "tp_mult": 1.7149673432024581,
      "tsl_mult": 0.25,
      "use_adx": true,
      "use_atr": true
    },
    "bull": {
      "adx": 18.0,
      "allowed_sides": [
        "long",
        "short"
      ],
      "atr_range": [
        0.0008,
        0.06
      ],
      "bb_std_mult": 2.0169431746748376,
      "mode": "mean_reversion",
      "rsi_required": false,
      "time_stop_bars": 214,
      "tp_mult": 1.9194251920826044,
      "tsl_mult": 0.6891458682949287,
      "use_adx": true,
      "use_atr": true
    },
    "sideways": {
      "adx": 15.0,
      "allowed_sides": [
        "long",
        "short"
      ],
      "atr_range": [
        0.001,
        0.14
      ],
      "bb_std_mult": 1.5828092896467827,
      "mode": "breakout",
      "rsi_required": true,
      "time_stop_bars": 235,
      "tp_mult": 2.341879695778944,
      "tsl_mult": 0.651967765830165,
      "use_adx": true,
      "use_atr": true
    }
  },
  "regime_slow": 200,
  "risk_min_stop_frac": 0.001,
  "risk_per_trade": 0.025,
  "risk_stop_atr_mult": 1.0,
  "round_exits": true,
  "rsi_key": "rsi45",
  "rsi_ob": 48,
  "rsi_os": 32,
  "rsi_period": 45,
  "rsi_required": false,
  "select_top_k": 1,
  "session_end": 24,
  "session_start": 0,
  "sides": "long",
  "sideways_adx_thresh": 33.108332452922774,
  "sideways_atr_max_pct": 0.1269525282086537,
  "sideways_atr_min_pct": 0.024084402522513627,
  "sideways_bb_std_mult": 2.1028516795358962,
  "sideways_rsi_ob": 89,
  "sideways_rsi_os": 50,
  "sideways_rsi_required": false,
  "sideways_strategy": "breakout",
  "sideways_time_stop": 89,
  "sideways_tp_mult": 2.6677938788606275,
  "sideways_tsl_mult": 0.30969640657787545,
  "sideways_use_adx": true,
  "sideways_use_atr": true,
  "sideways_use_ema": false,
  "sideways_use_sma": false,
  "sideways_use_spike": true,
  "slip_atr_k": 0.023493214807708863,
  "slip_spread_k": 0.4644768031386141,
  "slippage": 0.0004,
  "spread_hl_frac": 0.002007740454117456,
  "start_equity": 20000.0,
  "stop_extra_slip": 0.0,
  "strategy": "breakout",
  "time_stop": 175,
  "tp_mult": 1.9729877991492137,
  "tsl_mult": 0.02456759413759335,
  "use_adx": true,
  "use_atr": true,
  "use_ema": true,
  "use_ml": false,
  "use_sma": false,
  "use_spike": false,
  "vol_spike": 0.22801637011022963,
  "wfo_folds": 6
}
Wrote runs/REAL_SPOT_LONG_US_ret/h14-15-16-17-18-19-20-22_r0.025_s913/best_params.pkl
