[I 2025-09-01 11:28:55,777] Trial 308 finished with values: [-0.008363777587407806, 0.008239730214767992] and parameters: {'p_sma': 13, 'p_std': 53, 'p_atr': 9, 'p_adx': 22, 'rsi_period': 49, 'ema1': 23, 'ema2': 27, 'slip_atr_k': 0.021431876878379132, 'slip_spread_k': 0.8648742461028123, 'spread_hl_frac': 0.029243872672320915, 'bb_std_mult': 2.9904339594903333, 'rsi_os': 27, 'rsi_ob': 55, 'vol_spike': 0.11589612128763377, 'adx_thresh': 21.780199008022468, 'atr_min_pct': 0.02931260756547373, 'atr_max_pct': 0.11639057895649402, 'tp_mult': 2.547451847267959, 'tsl_mult': 0.8920381979448896, 'strategy': 'mean_reversion', 'time_stop': 270, 'use_sma': True, 'use_atr': False, 'use_adx': False, 'use_ema': False, 'use_spike': True, 'rsi_required': False, 'edge_k': 0.5445409559367415, 'edge_cap': 0.32858618419720187, 'bull_strategy': 'breakout', 'bull_bb_std_mult': 2.8656030481738157, 'bull_rsi_os': 44, 'bull_rsi_ob': 90, 'bull_adx_thresh': 17.100056974488517, 'bull_atr_min_pct': 0.001423773264942048, 'bull_atr_max_pct': 0.014555238040001667, 'bull_tp_mult': 2.619660611680986, 'bull_tsl_mult': 0.8558302605254421, 'bull_time_stop': 248, 'bull_use_sma': True, 'bull_use_ema': True, 'bull_use_atr': True, 'bull_use_adx': True, 'bull_use_spike': False, 'bull_rsi_required': False, 'bear_strategy': 'breakout', 'bear_bb_std_mult': 2.6568450975032993, 'bear_rsi_os': 22, 'bear_rsi_ob': 60, 'bear_adx_thresh': 14.603727266808477, 'bear_atr_min_pct': 0.008777418961348302, 'bear_atr_max_pct': 0.025561305001667214, 'bear_tp_mult': 1.3193762093645631, 'bear_tsl_mult': 0.26202163790662575, 'bear_time_stop': 180, 'bear_use_sma': False, 'bear_use_ema': True, 'bear_use_atr': False, 'bear_use_adx': True, 'bear_use_spike': True, 'bear_rsi_required': True, 'sideways_strategy': 'mean_reversion', 'sideways_bb_std_mult': 3.5430293428375843, 'sideways_rsi_os': 16, 'sideways_rsi_ob': 87, 'sideways_adx_thresh': 26.326921348303912, 'sideways_atr_min_pct': 0.01918942213967057, 'sideways_atr_max_pct': 0.04886047429670552, 'sideways_tp_mult': 1.8281748355078409, 'sideways_tsl_mult': 0.5371560150644229, 'sideways_time_stop': 124, 'sideways_use_sma': True, 'sideways_use_ema': False, 'sideways_use_atr': True, 'sideways_use_adx': True, 'sideways_use_spike': False, 'sideways_rsi_required': True}.
[I 2025-09-01 11:28:56,108] Trial 307 finished with values: [-0.023991828936416493, 0.02391238096019705] and parameters: {'p_sma': 30, 'p_std': 56, 'p_atr': 9, 'p_adx': 18, 'rsi_period': 48, 'ema1': 23, 'ema2': 33, 'slip_atr_k': 0.2297561597708172, 'slip_spread_k': 0.42802090697774814, 'spread_hl_frac': 0.04835349358912881, 'bb_std_mult': 3.0197859617676546, 'rsi_os': 25, 'rsi_ob': 71, 'vol_spike': 0.12279317489048179, 'adx_thresh': 22.09717314037772, 'atr_min_pct': 0.003790104731017171, 'atr_max_pct': 0.10653758796514548, 'tp_mult': 2.544006353063881, 'tsl_mult': 0.8953583821256893, 'strategy': 'mean_reversion', 'time_stop': 272, 'use_sma': True, 'use_atr': False, 'use_adx': False, 'use_ema': False, 'use_spike': True, 'rsi_required': False, 'edge_k': 0.09005044344643395, 'edge_cap': 0.3301020881280508, 'bull_strategy': 'breakout', 'bull_bb_std_mult': 2.877335461093876, 'bull_rsi_os': 44, 'bull_rsi_ob': 90, 'bull_adx_thresh': 30.483995076801865, 'bull_atr_min_pct': 0.0005621615764763841, 'bull_atr_max_pct': 0.014730780567161553, 'bull_tp_mult': 2.6302810300110817, 'bull_tsl_mult': 0.5394272995827054, 'bull_time_stop': 235, 'bull_use_sma': True, 'bull_use_ema': True, 'bull_use_atr': True, 'bull_use_adx': True, 'bull_use_spike': False, 'bull_rsi_required': False, 'bear_strategy': 'breakout', 'bear_bb_std_mult': 0.6443966709450211, 'bear_rsi_os': 33, 'bear_rsi_ob': 51, 'bear_adx_thresh': 14.641765199638087, 'bear_atr_min_pct': 0.025568172711915416, 'bear_atr_max_pct': 0.026245059125211034, 'bear_tp_mult': 2.6929064481192193, 'bear_tsl_mult': 0.3212638104540601, 'bear_time_stop': 156, 'bear_use_sma': False, 'bear_use_ema': True, 'bear_use_atr': False, 'bear_use_adx': True, 'bear_use_spike': True, 'bear_rsi_required': True, 'sideways_strategy': 'mean_reversion', 'sideways_bb_std_mult': 3.544712484037129, 'sideways_rsi_os': 22, 'sideways_rsi_ob': 87, 'sideways_adx_thresh': 23.505262148085297, 'sideways_atr_min_pct': 0.004309780079278817, 'sideways_atr_max_pct': 0.09229631300768289, 'sideways_tp_mult': 1.2449051709934684, 'sideways_tsl_mult': 0.5512141311631945, 'sideways_time_stop': 121, 'sideways_use_sma': True, 'sideways_use_ema': False, 'sideways_use_atr': True, 'sideways_use_adx': True, 'sideways_use_spike': False, 'sideways_rsi_required': True}.
[I 2025-09-01 11:28:56,499] Trial 305 finished with values: [-0.005660295584495323, 0.005600563000036717] and parameters: {'p_sma': 13, 'p_std': 26, 'p_atr': 9, 'p_adx': 18, 'rsi_period': 48, 'ema1': 23, 'ema2': 36, 'slip_atr_k': 0.00016287306387858386, 'slip_spread_k': 0.4270949339917071, 'spread_hl_frac': 0.025889260634846617, 'bb_std_mult': 3.0531676855970766, 'rsi_os': 27, 'rsi_ob': 86, 'vol_spike': 0.11756890838584194, 'adx_thresh': 22.02157204431645, 'atr_min_pct': 0.009050903569247206, 'atr_max_pct': 0.036101842144705326, 'tp_mult': 2.5454693406680895, 'tsl_mult': 0.758263506189644, 'strategy': 'breakout', 'time_stop': 235, 'use_sma': False, 'use_atr': False, 'use_adx': False, 'use_ema': True, 'use_spike': True, 'rsi_required': False, 'edge_k': 0.4519490213797941, 'edge_cap': 0.6851127700363642, 'bull_strategy': 'breakout', 'bull_bb_std_mult': 2.889404869299626, 'bull_rsi_os': 51, 'bull_rsi_ob': 50, 'bull_adx_thresh': 31.09210634326908, 'bull_atr_min_pct': 0.0006751506780642402, 'bull_atr_max_pct': 0.13806858172145078, 'bull_tp_mult': 2.8632180878589146, 'bull_tsl_mult': 0.8033578538366616, 'bull_time_stop': 85, 'bull_use_sma': True, 'bull_use_ema': True, 'bull_use_atr': True, 'bull_use_adx': True, 'bull_use_spike': True, 'bull_rsi_required': False, 'bear_strategy': 'breakout', 'bear_bb_std_mult': 2.958889780769601, 'bear_rsi_os': 35, 'bear_rsi_ob': 50, 'bear_adx_thresh': 15.168622700630038, 'bear_atr_min_pct': 0.009258204257730808, 'bear_atr_max_pct': 0.044596741880108495, 'bear_tp_mult': 1.3092351028508413, 'bear_tsl_mult': 0.273056611796069, 'bear_time_stop': 44, 'bear_use_sma': True, 'bear_use_ema': True, 'bear_use_atr': False, 'bear_use_adx': False, 'bear_use_spike': True, 'bear_rsi_required': True, 'sideways_strategy': 'mean_reversion', 'sideways_bb_std_mult': 2.5995190649561692, 'sideways_rsi_os': 22, 'sideways_rsi_ob': 85, 'sideways_adx_thresh': 12.716857774798067, 'sideways_atr_min_pct': 0.02157717038089047, 'sideways_atr_max_pct': 0.03575618207398579, 'sideways_tp_mult': 1.3337185104068972, 'sideways_tsl_mult': 0.5342816578884452, 'sideways_time_stop': 125, 'sideways_use_sma': True, 'sideways_use_ema': True, 'sideways_use_atr': True, 'sideways_use_adx': False, 'sideways_use_spike': False, 'sideways_rsi_required': True}.
[I 2025-09-01 11:28:57,165] Trial 311 finished with values: [-1000000000.0, 1000000000.0] and parameters: {'p_sma': 55, 'p_std': 9, 'p_atr': 11, 'p_adx': 12, 'rsi_period': 51, 'ema1': 21, 'ema2': 46, 'slip_atr_k': 0.1449925008969429, 'slip_spread_k': 0.867253963941983, 'spread_hl_frac': 0.02922347800007731, 'bb_std_mult': 3.205166895548344, 'rsi_os': 26, 'rsi_ob': 50, 'vol_spike': 0.11352213083489565, 'adx_thresh': 34.04868186069048, 'atr_min_pct': 0.0029485374392194987, 'atr_max_pct': 0.041210683059837154, 'tp_mult': 2.8637092635858585, 'tsl_mult': 0.08058645701269412, 'strategy': 'mean_reversion', 'time_stop': 56, 'use_sma': True, 'use_atr': False, 'use_adx': False, 'use_ema': True, 'use_spike': True, 'rsi_required': True, 'edge_k': 0.5550542076804921, 'edge_cap': 0.3180963424797738, 'bull_strategy': 'breakout', 'bull_bb_std_mult': 2.7916485598120766, 'bull_rsi_os': 42, 'bull_rsi_ob': 46, 'bull_adx_thresh': 29.97914782239749, 'bull_atr_min_pct': 0.006898766201780841, 'bull_atr_max_pct': 0.06303606738447828, 'bull_tp_mult': 2.6470298743719676, 'bull_tsl_mult': 0.6038430636819667, 'bull_time_stop': 162, 'bull_use_sma': True, 'bull_use_ema': True, 'bull_use_atr': True, 'bull_use_adx': True, 'bull_use_spike': True, 'bull_rsi_required': True, 'bear_strategy': 'breakout', 'bear_bb_std_mult': 0.7774932393993363, 'bear_rsi_os': 48, 'bear_rsi_ob': 50, 'bear_adx_thresh': 15.37018297158538, 'bear_atr_min_pct': 0.009279374906315124, 'bear_atr_max_pct': 0.024697690913166582, 'bear_tp_mult': 2.7501782131353285, 'bear_tsl_mult': 0.3081127656433671, 'bear_time_stop': 56, 'bear_use_sma': False, 'bear_use_ema': True, 'bear_use_atr': False, 'bear_use_adx': False, 'bear_use_spike': True, 'bear_rsi_required': False, 'sideways_strategy': 'mean_reversion', 'sideways_bb_std_mult': 3.591864511890824, 'sideways_rsi_os': 44, 'sideways_rsi_ob': 68, 'sideways_adx_thresh': 33.292449837795814, 'sideways_atr_min_pct': 0.01916378100556672, 'sideways_atr_max_pct': 0.08359132034025571, 'sideways_tp_mult': 1.8135027436565387, 'sideways_tsl_mult': 0.6089502870484964, 'sideways_time_stop': 136, 'sideways_use_sma': True, 'sideways_use_ema': True, 'sideways_use_atr': False, 'sideways_use_adx': False, 'sideways_use_spike': False, 'sideways_rsi_required': True}.
[I 2025-09-01 11:29:38,282] Trial 309 finished with values: [-1000000000.0, 1000000000.0] and parameters: {'p_sma': 55, 'p_std': 28, 'p_atr': 9, 'p_adx': 18, 'rsi_period': 49, 'ema1': 23, 'ema2': 38, 'slip_atr_k': 0.22928839311561294, 'slip_spread_k': 0.4283147840816848, 'spread_hl_frac': 0.029288958962411307, 'bb_std_mult': 3.381421680474242, 'rsi_os': 25, 'rsi_ob': 71, 'vol_spike': 0.12262312188978634, 'adx_thresh': 34.07224530103799, 'atr_min_pct': 0.02507451203962582, 'atr_max_pct': 0.10656973101676476, 'tp_mult': 2.5347611107895727, 'tsl_mult': 0.18426148591720132, 'strategy': 'mean_reversion', 'time_stop': 237, 'use_sma': True, 'use_atr': False, 'use_adx': False, 'use_ema': True, 'use_spike': True, 'rsi_required': False, 'edge_k': 0.0482562647725068, 'edge_cap': 0.3259773978523171, 'bull_strategy': 'breakout', 'bull_bb_std_mult': 2.780105538180982, 'bull_rsi_os': 39, 'bull_rsi_ob': 90, 'bull_adx_thresh': 16.993394588312345, 'bull_atr_min_pct': 0.02494581999867533, 'bull_atr_max_pct': 0.06284676926852588, 'bull_tp_mult': 2.072356539733414, 'bull_tsl_mult': 0.8063171137746997, 'bull_time_stop': 151, 'bull_use_sma': True, 'bull_use_ema': True, 'bull_use_atr': True, 'bull_use_adx': True, 'bull_use_spike': False, 'bull_rsi_required': False, 'bear_strategy': 'breakout', 'bear_bb_std_mult': 0.6238394866743154, 'bear_rsi_os': 33, 'bear_rsi_ob': 50, 'bear_adx_thresh': 15.25277070724167, 'bear_atr_min_pct': 0.024016902052625105, 'bear_atr_max_pct': 0.04543750582841531, 'bear_tp_mult': 1.2574868310106015, 'bear_tsl_mult': 0.3170000751597336, 'bear_time_stop': 56, 'bear_use_sma': False, 'bear_use_ema': True, 'bear_use_atr': False, 'bear_use_adx': False, 'bear_use_spike': True, 'bear_rsi_required': True, 'sideways_strategy': 'mean_reversion', 'sideways_bb_std_mult': 1.3580103546505933, 'sideways_rsi_os': 22, 'sideways_rsi_ob': 85, 'sideways_adx_thresh': 25.105032729047227, 'sideways_atr_min_pct': 0.007776413264025643, 'sideways_atr_max_pct': 0.09184722919400208, 'sideways_tp_mult': 1.4634656690683787, 'sideways_tsl_mult': 0.5343163126724587, 'sideways_time_stop': 224, 'sideways_use_sma': True, 'sideways_use_ema': False, 'sideways_use_atr': True, 'sideways_use_adx': False, 'sideways_use_spike': False, 'sideways_rsi_required': True}.
[I 2025-09-01 11:29:39,160] Trial 310 finished with values: [-1000000000.0, 1000000000.0] and parameters: {'p_sma': 15, 'p_std': 9, 'p_atr': 29, 'p_adx': 28, 'rsi_period': 48, 'ema1': 23, 'ema2': 11, 'slip_atr_k': 0.22938091510463182, 'slip_spread_k': 0.5399756969223152, 'spread_hl_frac': 0.029367711782441335, 'bb_std_mult': 3.2016930670915436, 'rsi_os': 43, 'rsi_ob': 88, 'vol_spike': 0.008448316646963466, 'adx_thresh': 21.276061802605913, 'atr_min_pct': 0.029256763696889496, 'atr_max_pct': 0.041867620649587885, 'tp_mult': 2.791105280649237, 'tsl_mult': 0.8250624330265146, 'strategy': 'mean_reversion', 'time_stop': 104, 'use_sma': True, 'use_atr': False, 'use_adx': False, 'use_ema': True, 'use_spike': True, 'rsi_required': True, 'edge_k': 0.5308281078135607, 'edge_cap': 0.3283397001684253, 'bull_strategy': 'breakout', 'bull_bb_std_mult': 2.810549137723869, 'bull_rsi_os': 43, 'bull_rsi_ob': 89, 'bull_adx_thresh': 16.787470157369754, 'bull_atr_min_pct': 0.016866755755841765, 'bull_atr_max_pct': 0.09005147287191999, 'bull_tp_mult': 2.6599977877261876, 'bull_tsl_mult': 0.5360773775599282, 'bull_time_stop': 248, 'bull_use_sma': True, 'bull_use_ema': True, 'bull_use_atr': True, 'bull_use_adx': True, 'bull_use_spike': False, 'bull_rsi_required': True, 'bear_strategy': 'breakout', 'bear_bb_std_mult': 0.5447212748399584, 'bear_rsi_os': 33, 'bear_rsi_ob': 50, 'bear_adx_thresh': 15.33170959728945, 'bear_atr_min_pct': 0.02367957954462427, 'bear_atr_max_pct': 0.025719395354478883, 'bear_tp_mult': 2.5762287259593486, 'bear_tsl_mult': 0.3149882302202346, 'bear_time_stop': 207, 'bear_use_sma': False, 'bear_use_ema': True, 'bear_use_atr': False, 'bear_use_adx': False, 'bear_use_spike': True, 'bear_rsi_required': False, 'sideways_strategy': 'mean_reversion', 'sideways_bb_std_mult': 3.582951768650093, 'sideways_rsi_os': 22, 'sideways_rsi_ob': 65, 'sideways_adx_thresh': 31.847006281737045, 'sideways_atr_min_pct': 0.02172198495130443, 'sideways_atr_max_pct': 0.03612594769124229, 'sideways_tp_mult': 1.8085078905584229, 'sideways_tsl_mult': 0.6083816007865609, 'sideways_time_stop': 124, 'sideways_use_sma': True, 'sideways_use_ema': True, 'sideways_use_atr': False, 'sideways_use_adx': False, 'sideways_use_spike': False, 'sideways_rsi_required': True}.
[I 2025-09-01 11:29:39,546] Trial 313 finished with values: [-0.007934413990161926, 0.008646937744078684] and parameters: {'p_sma': 16, 'p_std': 14, 'p_atr': 15, 'p_adx': 22, 'rsi_period': 49, 'ema1': 12, 'ema2': 41, 'slip_atr_k': 0.021557654877820482, 'slip_spread_k': 0.11535018633089292, 'spread_hl_frac': 0.03098642005082337, 'bb_std_mult': 3.2005256836062874, 'rsi_os': 24, 'rsi_ob': 93, 'vol_spike': 0.2547636278210946, 'adx_thresh': 30.506589592791915, 'atr_min_pct': 0.02945224354076599, 'atr_max_pct': 0.11743011083082014, 'tp_mult': 2.6149518118994513, 'tsl_mult': 0.1940271113090986, 'strategy': 'mean_reversion', 'time_stop': 259, 'use_sma': True, 'use_atr': False, 'use_adx': False, 'use_ema': True, 'use_spike': True, 'rsi_required': True, 'edge_k': 0.5171154447443995, 'edge_cap': 0.29733381382182494, 'bull_strategy': 'breakout', 'bull_bb_std_mult': 2.970979904455417, 'bull_rsi_os': 49, 'bull_rsi_ob': 48, 'bull_adx_thresh': 34.95279111808503, 'bull_atr_min_pct': 0.0013647993573110422, 'bull_atr_max_pct': 0.13017013723622822, 'bull_tp_mult': 2.6370189882563793, 'bull_tsl_mult': 0.8027819323925853, 'bull_time_stop': 248, 'bull_use_sma': True, 'bull_use_ema': True, 'bull_use_atr': True, 'bull_use_adx': True, 'bull_use_spike': True, 'bull_rsi_required': False, 'bear_strategy': 'breakout', 'bear_bb_std_mult': 2.1468999891840923, 'bear_rsi_os': 34, 'bear_rsi_ob': 50, 'bear_adx_thresh': 15.0914938090749, 'bear_atr_min_pct': 0.003551176871882735, 'bear_atr_max_pct': 0.03233401022714543, 'bear_tp_mult': 1.305624386481694, 'bear_tsl_mult': 0.2660744456663819, 'bear_time_stop': 182, 'bear_use_sma': False, 'bear_use_ema': True, 'bear_use_atr': False, 'bear_use_adx': False, 'bear_use_spike': True, 'bear_rsi_required': False, 'sideways_strategy': 'mean_reversion', 'sideways_bb_std_mult': 2.373721859810217, 'sideways_rsi_os': 39, 'sideways_rsi_ob': 65, 'sideways_adx_thresh': 25.48663462605845, 'sideways_atr_min_pct': 0.02206597050717603, 'sideways_atr_max_pct': 0.03692979984082287, 'sideways_tp_mult': 1.8226671256725635, 'sideways_tsl_mult': 0.5198817422683408, 'sideways_time_stop': 250, 'sideways_use_sma': True, 'sideways_use_ema': True, 'sideways_use_atr': False, 'sideways_use_adx': False, 'sideways_use_spike': False, 'sideways_rsi_required': True}.
[I 2025-09-01 11:29:39,887] Trial 312 finished with values: [-0.03847217188426055, 0.03837345350442827] and parameters: {'p_sma': 16, 'p_std': 9, 'p_atr': 28, 'p_adx': 12, 'rsi_period': 83, 'ema1': 12, 'ema2': 41, 'slip_atr_k': 0.0614680745169944, 'slip_spread_k': 0.6573416920385627, 'spread_hl_frac': 0.030993084332736377, 'bb_std_mult': 3.2165299832661565, 'rsi_os': 24, 'rsi_ob': 74, 'vol_spike': 0.11441873277048718, 'adx_thresh': 34.167620392351466, 'atr_min_pct': 0.022186556253002775, 'atr_max_pct': 0.0408850502607668, 'tp_mult': 2.796200497895285, 'tsl_mult': 0.827184055630062, 'strategy': 'mean_reversion', 'time_stop': 59, 'use_sma': True, 'use_atr': False, 'use_adx': False, 'use_ema': True, 'use_spike': True, 'rsi_required': True, 'edge_k': 0.959553936733705, 'edge_cap': 0.16115486811875868, 'bull_strategy': 'breakout', 'bull_bb_std_mult': 2.7690965245325745, 'bull_rsi_os': 43, 'bull_rsi_ob': 90, 'bull_adx_thresh': 29.97093741332794, 'bull_atr_min_pct': 0.0014901952328215525, 'bull_atr_max_pct': 0.08870324789822363, 'bull_tp_mult': 2.66050535825047, 'bull_tsl_mult': 0.5992522708867127, 'bull_time_stop': 163, 'bull_use_sma': True, 'bull_use_ema': True, 'bull_use_atr': True, 'bull_use_adx': True, 'bull_use_spike': True, 'bull_rsi_required': False, 'bear_strategy': 'breakout', 'bear_bb_std_mult': 2.6445165677270044, 'bear_rsi_os': 9, 'bear_rsi_ob': 50, 'bear_adx_thresh': 15.029154723807656, 'bear_atr_min_pct': 0.0058620596230910815, 'bear_atr_max_pct': 0.04295247980139568, 'bear_tp_mult': 2.7473983007656084, 'bear_tsl_mult': 0.5894755997155965, 'bear_time_stop': 61, 'bear_use_sma': False, 'bear_use_ema': True, 'bear_use_atr': False, 'bear_use_adx': False, 'bear_use_spike': True, 'bear_rsi_required': False, 'sideways_strategy': 'mean_reversion', 'sideways_bb_std_mult': 0.7910984932114383, 'sideways_rsi_os': 28, 'sideways_rsi_ob': 74, 'sideways_adx_thresh': 24.955902569676887, 'sideways_atr_min_pct': 0.023481390281551055, 'sideways_atr_max_pct': 0.08128020731435306, 'sideways_tp_mult': 1.8396764337443496, 'sideways_tsl_mult': 0.5155974026786264, 'sideways_time_stop': 137, 'sideways_use_sma': True, 'sideways_use_ema': True, 'sideways_use_atr': False, 'sideways_use_adx': False, 'sideways_use_spike': False, 'sideways_rsi_required': True}.
[I 2025-09-01 11:30:21,653] Trial 317 finished with values: [-1000000000.0, 1000000000.0] and parameters: {'p_sma': 13, 'p_std': 24, 'p_atr': 22, 'p_adx': 17, 'rsi_period': 49, 'ema1': 21, 'ema2': 29, 'slip_atr_k': 0.020573601344935424, 'slip_spread_k': 0.6214709787118449, 'spread_hl_frac': 0.0197878265780556, 'bb_std_mult': 3.148004435188835, 'rsi_os': 28, 'rsi_ob': 86, 'vol_spike': 0.23326793190777034, 'adx_thresh': 20.867879848866718, 'atr_min_pct': 0.005817911199978038, 'atr_max_pct': 0.1170412976521546, 'tp_mult': 2.6150617698423306, 'tsl_mult': 0.8021646662338765, 'strategy': 'mean_reversion', 'time_stop': 156, 'use_sma': True, 'use_atr': False, 'use_adx': False, 'use_ema': False, 'use_spike': True, 'rsi_required': True, 'edge_k': 1.1238774501910953, 'edge_cap': 0.29517613167747125, 'bull_strategy': 'breakout', 'bull_bb_std_mult': 2.9878758868300346, 'bull_rsi_os': 48, 'bull_rsi_ob': 94, 'bull_adx_thresh': 34.921338052549196, 'bull_atr_min_pct': 0.007876834389939563, 'bull_atr_max_pct': 0.056540669120391074, 'bull_tp_mult': 2.5961474979803336, 'bull_tsl_mult': 0.8195497063052152, 'bull_time_stop': 281, 'bull_use_sma': True, 'bull_use_ema': True, 'bull_use_atr': True, 'bull_use_adx': True, 'bull_use_spike': True, 'bull_rsi_required': False, 'bear_strategy': 'mean_reversion', 'bear_bb_std_mult': 2.132624486543442, 'bear_rsi_os': 36, 'bear_rsi_ob': 84, 'bear_adx_thresh': 30.622714389603477, 'bear_atr_min_pct': 0.008672478540708607, 'bear_atr_max_pct': 0.03292778756484827, 'bear_tp_mult': 2.541454099570389, 'bear_tsl_mult': 0.2794887342641818, 'bear_time_stop': 32, 'bear_use_sma': False, 'bear_use_ema': True, 'bear_use_atr': False, 'bear_use_adx': False, 'bear_use_spike': True, 'bear_rsi_required': False, 'sideways_strategy': 'mean_reversion', 'sideways_bb_std_mult': 2.578575696690262, 'sideways_rsi_os': 24, 'sideways_rsi_ob': 71, 'sideways_adx_thresh': 13.287483607834165, 'sideways_atr_min_pct': 0.017192304110758366, 'sideways_atr_max_pct': 0.08988790844292584, 'sideways_tp_mult': 1.5175688044562405, 'sideways_tsl_mult': 0.4950746576570576, 'sideways_time_stop': 250, 'sideways_use_sma': True, 'sideways_use_ema': True, 'sideways_use_atr': False, 'sideways_use_adx': False, 'sideways_use_spike': False, 'sideways_rsi_required': False}.
