[I 2025-09-01 11:27:25,457] Trial 297 finished with values: [-0.018665222370805923, 0.019063973781359034] and parameters: {'p_sma': 35, 'p_std': 28, 'p_atr': 13, 'p_adx': 16, 'rsi_period': 61, 'ema1': 26, 'ema2': 34, 'slip_atr_k': 0.014050313422831516, 'slip_spread_k': 0.08531900155342835, 'spread_hl_frac': 0.040772154191546325, 'bb_std_mult': 3.298189470436415, 'rsi_os': 10, 'rsi_ob': 82, 'vol_spike': 0.1086652508097589, 'adx_thresh': 23.083508192598554, 'atr_min_pct': 0.027923184120734728, 'atr_max_pct': 0.041913686600837774, 'tp_mult': 2.496426864552312, 'tsl_mult': 0.7876006345669744, 'strategy': 'mean_reversion', 'time_stop': 42, 'use_sma': True, 'use_atr': False, 'use_adx': False, 'use_ema': True, 'use_spike': True, 'rsi_required': True, 'edge_k': 0.25074970258590923, 'edge_cap': 0.3104489499175339, 'bull_strategy': 'breakout', 'bull_bb_std_mult': 3.4847836493505664, 'bull_rsi_os': 47, 'bull_rsi_ob': 55, 'bull_adx_thresh': 29.364329600644115, 'bull_atr_min_pct': 0.0014309694315987487, 'bull_atr_max_pct': 0.12494882489682893, 'bull_tp_mult': 2.1438664130882725, 'bull_tsl_mult': 0.772137778458114, 'bull_time_stop': 243, 'bull_use_sma': True, 'bull_use_ema': True, 'bull_use_atr': True, 'bull_use_adx': True, 'bull_use_spike': True, 'bull_rsi_required': True, 'bear_strategy': 'breakout', 'bear_bb_std_mult': 3.0679113469329513, 'bear_rsi_os': 33, 'bear_rsi_ob': 82, 'bear_adx_thresh': 13.741352546719547, 'bear_atr_min_pct': 0.00805260811429589, 'bear_atr_max_pct': 0.01777897649814887, 'bear_tp_mult': 1.4577942184845094, 'bear_tsl_mult': 0.4624858002273007, 'bear_time_stop': 292, 'bear_use_sma': False, 'bear_use_ema': True, 'bear_use_atr': False, 'bear_use_adx': False, 'bear_use_spike': True, 'bear_rsi_required': False, 'sideways_strategy': 'mean_reversion', 'sideways_bb_std_mult': 1.5362148454031834, 'sideways_rsi_os': 6, 'sideways_rsi_ob': 60, 'sideways_adx_thresh': 13.193736900874, 'sideways_atr_min_pct': 0.009363173649196437, 'sideways_atr_max_pct': 0.0871262163051685, 'sideways_tp_mult': 1.6819110722077115, 'sideways_tsl_mult': 0.19440745112828356, 'sideways_time_stop': 107, 'sideways_use_sma': True, 'sideways_use_ema': False, 'sideways_use_atr': False, 'sideways_use_adx': False, 'sideways_use_spike': False, 'sideways_rsi_required': False}.
[I 2025-09-01 11:27:25,455] Trial 298 finished with values: [-0.009002853747480888, 0.009023155913172641] and parameters: {'p_sma': 13, 'p_std': 28, 'p_atr': 9, 'p_adx': 19, 'rsi_period': 61, 'ema1': 14, 'ema2': 35, 'slip_atr_k': 0.014403529021122088, 'slip_spread_k': 0.43606953236981355, 'spread_hl_frac': 0.03203799851059037, 'bb_std_mult': 3.296090778505408, 'rsi_os': 28, 'rsi_ob': 71, 'vol_spike': 0.11014210966857628, 'adx_thresh': 34.17858385830324, 'atr_min_pct': 0.019606090517684464, 'atr_max_pct': 0.03133642330137179, 'tp_mult': 1.1592407211379987, 'tsl_mult': 0.787774286461141, 'strategy': 'mean_reversion', 'time_stop': 256, 'use_sma': True, 'use_atr': False, 'use_adx': False, 'use_ema': True, 'use_spike': True, 'rsi_required': True, 'edge_k': 1.120994625980265, 'edge_cap': 0.3689273866374567, 'bull_strategy': 'mean_reversion', 'bull_bb_std_mult': 2.947729465738172, 'bull_rsi_os': 47, 'bull_rsi_ob': 56, 'bull_adx_thresh': 24.379587518731583, 'bull_atr_min_pct': 0.000703741297567687, 'bull_atr_max_pct': 0.12674845457242834, 'bull_tp_mult': 2.930431249098668, 'bull_tsl_mult': 0.5890829624483742, 'bull_time_stop': 283, 'bull_use_sma': True, 'bull_use_ema': True, 'bull_use_atr': True, 'bull_use_adx': False, 'bull_use_spike': True, 'bull_rsi_required': False, 'bear_strategy': 'breakout', 'bear_bb_std_mult': 3.024666750821029, 'bear_rsi_os': 33, 'bear_rsi_ob': 49, 'bear_adx_thresh': 13.61740131150947, 'bear_atr_min_pct': 0.008064633711277592, 'bear_atr_max_pct': 0.12042965842303424, 'bear_tp_mult': 2.648087756535623, 'bear_tsl_mult': 0.265181389032073, 'bear_time_stop': 159, 'bear_use_sma': False, 'bear_use_ema': True, 'bear_use_atr': False, 'bear_use_adx': False, 'bear_use_spike': True, 'bear_rsi_required': False, 'sideways_strategy': 'mean_reversion', 'sideways_bb_std_mult': 3.5985190583116937, 'sideways_rsi_os': 20, 'sideways_rsi_ob': 90, 'sideways_adx_thresh': 13.274253486819426, 'sideways_atr_min_pct': 0.006225632564599619, 'sideways_atr_max_pct': 0.08605414308229917, 'sideways_tp_mult': 2.5622441908402624, 'sideways_tsl_mult': 0.9977150934781763, 'sideways_time_stop': 98, 'sideways_use_sma': True, 'sideways_use_ema': False, 'sideways_use_atr': False, 'sideways_use_adx': False, 'sideways_use_spike': True, 'sideways_rsi_required': False}.
[I 2025-09-01 11:27:26,219] Trial 300 finished with values: [-1000000000.0, 1000000000.0] and parameters: {'p_sma': 12, 'p_std': 23, 'p_atr': 20, 'p_adx': 20, 'rsi_period': 46, 'ema1': 14, 'ema2': 17, 'slip_atr_k': 0.17115921404197573, 'slip_spread_k': 0.0924890814294975, 'spread_hl_frac': 0.031895256142635005, 'bb_std_mult': 3.5029232719353045, 'rsi_os': 33, 'rsi_ob': 68, 'vol_spike': 0.10111084758985764, 'adx_thresh': 13.13269444304259, 'atr_min_pct': 0.029997034343022085, 'atr_max_pct': 0.04274013981789994, 'tp_mult': 1.074174766637599, 'tsl_mult': 0.04195351724979923, 'strategy': 'breakout', 'time_stop': 241, 'use_sma': False, 'use_atr': False, 'use_adx': False, 'use_ema': False, 'use_spike': True, 'rsi_required': True, 'edge_k': 0.25019859591874644, 'edge_cap': 0.3713191936457325, 'bull_strategy': 'mean_reversion', 'bull_bb_std_mult': 2.9475759771877503, 'bull_rsi_os': 34, 'bull_rsi_ob': 52, 'bull_adx_thresh': 29.29302471787923, 'bull_atr_min_pct': 0.001338117751451237, 'bull_atr_max_pct': 0.09833561963549517, 'bull_tp_mult': 2.4325543901083506, 'bull_tsl_mult': 0.3297771851643917, 'bull_time_stop': 253, 'bull_use_sma': True, 'bull_use_ema': True, 'bull_use_atr': True, 'bull_use_adx': True, 'bull_use_spike': True, 'bull_rsi_required': False, 'bear_strategy': 'breakout', 'bear_bb_std_mult': 0.9599995652789175, 'bear_rsi_os': 50, 'bear_rsi_ob': 48, 'bear_adx_thresh': 32.77302149003421, 'bear_atr_min_pct': 0.01384030799301671, 'bear_atr_max_pct': 0.01884186718966224, 'bear_tp_mult': 2.6477377407329046, 'bear_tsl_mult': 0.3946865488154654, 'bear_time_stop': 195, 'bear_use_sma': True, 'bear_use_ema': True, 'bear_use_atr': False, 'bear_use_adx': False, 'bear_use_spike': False, 'bear_rsi_required': False, 'sideways_strategy': 'mean_reversion', 'sideways_bb_std_mult': 1.8453859573653202, 'sideways_rsi_os': 25, 'sideways_rsi_ob': 77, 'sideways_adx_thresh': 9.903332468191252, 'sideways_atr_min_pct': 0.018541292397028165, 'sideways_atr_max_pct': 0.03885156482215725, 'sideways_tp_mult': 2.747931006418508, 'sideways_tsl_mult': 0.515550225275518, 'sideways_time_stop': 97, 'sideways_use_sma': True, 'sideways_use_ema': False, 'sideways_use_atr': False, 'sideways_use_adx': False, 'sideways_use_spike': True, 'sideways_rsi_required': False}.
[I 2025-09-01 11:27:26,763] Trial 299 finished with values: [-1000000000.0, 1000000000.0] and parameters: {'p_sma': 18, 'p_std': 58, 'p_atr': 14, 'p_adx': 19, 'rsi_period': 46, 'ema1': 14, 'ema2': 39, 'slip_atr_k': 0.014380185945459426, 'slip_spread_k': 0.08445607490156821, 'spread_hl_frac': 0.04670154015892717, 'bb_std_mult': 3.268079998743071, 'rsi_os': 33, 'rsi_ob': 83, 'vol_spike': 0.1016200847817215, 'adx_thresh': 20.582261770172867, 'atr_min_pct': 0.019932748475793884, 'atr_max_pct': 0.03234752853022336, 'tp_mult': 2.4906127657915227, 'tsl_mult': 0.7812487184986262, 'strategy': 'mean_reversion', 'time_stop': 241, 'use_sma': True, 'use_atr': False, 'use_adx': False, 'use_ema': True, 'use_spike': True, 'rsi_required': True, 'edge_k': 0.24996970714053401, 'edge_cap': 0.35964692952687455, 'bull_strategy': 'mean_reversion', 'bull_bb_std_mult': 1.225733797276137, 'bull_rsi_os': 49, 'bull_rsi_ob': 92, 'bull_adx_thresh': 21.048045352626072, 'bull_atr_min_pct': 0.015053185151208775, 'bull_atr_max_pct': 0.0989596879882031, 'bull_tp_mult': 2.928247445766643, 'bull_tsl_mult': 0.4153681082469157, 'bull_time_stop': 253, 'bull_use_sma': True, 'bull_use_ema': True, 'bull_use_atr': True, 'bull_use_adx': True, 'bull_use_spike': True, 'bull_rsi_required': False, 'bear_strategy': 'breakout', 'bear_bb_std_mult': 3.073673723945811, 'bear_rsi_os': 31, 'bear_rsi_ob': 48, 'bear_adx_thresh': 11.625408421171489, 'bear_atr_min_pct': 0.008673433602895108, 'bear_atr_max_pct': 0.01967146797361661, 'bear_tp_mult': 2.651603862620592, 'bear_tsl_mult': 0.3933454194178347, 'bear_time_stop': 39, 'bear_use_sma': False, 'bear_use_ema': True, 'bear_use_atr': False, 'bear_use_adx': False, 'bear_use_spike': True, 'bear_rsi_required': False, 'sideways_strategy': 'mean_reversion', 'sideways_bb_std_mult': 1.9901198142909315, 'sideways_rsi_os': 37, 'sideways_rsi_ob': 60, 'sideways_adx_thresh': 6.532174472950194, 'sideways_atr_min_pct': 0.00919996243706196, 'sideways_atr_max_pct': 0.09720663142388976, 'sideways_tp_mult': 1.6681610617492948, 'sideways_tsl_mult': 0.5120053822293338, 'sideways_time_stop': 116, 'sideways_use_sma': True, 'sideways_use_ema': True, 'sideways_use_atr': False, 'sideways_use_adx': False, 'sideways_use_spike': True, 'sideways_rsi_required': False}.
[I 2025-09-01 11:28:11,159] Trial 304 finished with values: [-1000000000.0, 1000000000.0] and parameters: {'p_sma': 15, 'p_std': 43, 'p_atr': 8, 'p_adx': 19, 'rsi_period': 40, 'ema1': 28, 'ema2': 21, 'slip_atr_k': 0.005614837354507771, 'slip_spread_k': 0.14445994228063655, 'spread_hl_frac': 0.027511550021477357, 'bb_std_mult': 1.7452870300034589, 'rsi_os': 29, 'rsi_ob': 89, 'vol_spike': 0.07355730593833436, 'adx_thresh': 19.869435273874576, 'atr_min_pct': 0.028761765156269485, 'atr_max_pct': 0.036279715992196565, 'tp_mult': 2.6532777884224026, 'tsl_mult': 0.855191592605505, 'strategy': 'breakout', 'time_stop': 252, 'use_sma': False, 'use_atr': False, 'use_adx': False, 'use_ema': True, 'use_spike': True, 'rsi_required': True, 'edge_k': 0.04444784328866522, 'edge_cap': 0.7766419209425688, 'bull_strategy': 'mean_reversion', 'bull_bb_std_mult': 2.6954364882995794, 'bull_rsi_os': 19, 'bull_rsi_ob': 62, 'bull_adx_thresh': 33.69474111463254, 'bull_atr_min_pct': 0.0028969865609222026, 'bull_atr_max_pct': 0.09062436712114907, 'bull_tp_mult': 2.905166044804058, 'bull_tsl_mult': 0.23339691383234284, 'bull_time_stop': 262, 'bull_use_sma': True, 'bull_use_ema': True, 'bull_use_atr': True, 'bull_use_adx': False, 'bull_use_spike': True, 'bull_rsi_required': False, 'bear_strategy': 'breakout', 'bear_bb_std_mult': 0.9385105858431039, 'bear_rsi_os': 37, 'bear_rsi_ob': 49, 'bear_adx_thresh': 16.821975802240022, 'bear_atr_min_pct': 0.01034306933050298, 'bear_atr_max_pct': 0.1208574343867268, 'bear_tp_mult': 2.5498533192607122, 'bear_tsl_mult': 0.29222482911628617, 'bear_time_stop': 14, 'bear_use_sma': True, 'bear_use_ema': True, 'bear_use_atr': False, 'bear_use_adx': True, 'bear_use_spike': False, 'bear_rsi_required': False, 'sideways_strategy': 'mean_reversion', 'sideways_bb_std_mult': 2.4744634306782203, 'sideways_rsi_os': 20, 'sideways_rsi_ob': 90, 'sideways_adx_thresh': 24.707219628467143, 'sideways_atr_min_pct': 0.016630409716668453, 'sideways_atr_max_pct': 0.04120147411248133, 'sideways_tp_mult': 1.2853627537347976, 'sideways_tsl_mult': 0.45225635008050125, 'sideways_time_stop': 24, 'sideways_use_sma': True, 'sideways_use_ema': True, 'sideways_use_atr': False, 'sideways_use_adx': False, 'sideways_use_spike': False, 'sideways_rsi_required': True}.
[I 2025-09-01 11:28:12,786] Trial 302 finished with values: [-1000000000.0, 1000000000.0] and parameters: {'p_sma': 18, 'p_std': 44, 'p_atr': 14, 'p_adx': 19, 'rsi_period': 40, 'ema1': 30, 'ema2': 36, 'slip_atr_k': 0.00018279509075680954, 'slip_spread_k': 0.6957329245941564, 'spread_hl_frac': 0.027938509493824686, 'bb_std_mult': 2.2670554846285373, 'rsi_os': 28, 'rsi_ob': 83, 'vol_spike': 0.06636748741635572, 'adx_thresh': 14.504332441901429, 'atr_min_pct': 0.02888342837632215, 'atr_max_pct': 0.036129560925449285, 'tp_mult': 1.4542000646609106, 'tsl_mult': 0.8547851042610217, 'strategy': 'breakout', 'time_stop': 248, 'use_sma': False, 'use_atr': False, 'use_adx': False, 'use_ema': True, 'use_spike': True, 'rsi_required': True, 'edge_k': 0.4746119172854181, 'edge_cap': 0.34084489516232996, 'bull_strategy': 'mean_reversion', 'bull_bb_std_mult': 1.6277083441793614, 'bull_rsi_os': 48, 'bull_rsi_ob': 92, 'bull_adx_thresh': 33.600190751286036, 'bull_atr_min_pct': 0.00039378863133934013, 'bull_atr_max_pct': 0.10105504929272413, 'bull_tp_mult': 2.8676811151254062, 'bull_tsl_mult': 0.24290104558474973, 'bull_time_stop': 261, 'bull_use_sma': True, 'bull_use_ema': True, 'bull_use_atr': True, 'bull_use_adx': False, 'bull_use_spike': True, 'bull_rsi_required': False, 'bear_strategy': 'breakout', 'bear_bb_std_mult': 0.8345726376638719, 'bear_rsi_os': 35, 'bear_rsi_ob': 49, 'bear_adx_thresh': 16.785266059521152, 'bear_atr_min_pct': 0.010387254853251794, 'bear_atr_max_pct': 0.029492480399811907, 'bear_tp_mult': 2.6455725777364822, 'bear_tsl_mult': 0.28630506767640745, 'bear_time_stop': 43, 'bear_use_sma': True, 'bear_use_ema': True, 'bear_use_atr': False, 'bear_use_adx': False, 'bear_use_spike': False, 'bear_rsi_required': False, 'sideways_strategy': 'mean_reversion', 'sideways_bb_std_mult': 1.4710719605608695, 'sideways_rsi_os': 20, 'sideways_rsi_ob': 90, 'sideways_adx_thresh': 12.592856447465586, 'sideways_atr_min_pct': 0.016214509189112672, 'sideways_atr_max_pct': 0.0967982499146781, 'sideways_tp_mult': 1.2120821771282535, 'sideways_tsl_mult': 0.4889973603557764, 'sideways_time_stop': 117, 'sideways_use_sma': True, 'sideways_use_ema': True, 'sideways_use_atr': False, 'sideways_use_adx': False, 'sideways_use_spike': True, 'sideways_rsi_required': True}.
[I 2025-09-01 11:28:13,006] Trial 303 finished with values: [-1000000000.0, 1000000000.0] and parameters: {'p_sma': 18, 'p_std': 42, 'p_atr': 8, 'p_adx': 19, 'rsi_period': 52, 'ema1': 28, 'ema2': 39, 'slip_atr_k': 0.00018933734294488812, 'slip_spread_k': 0.048353802141220495, 'spread_hl_frac': 0.02616524820609481, 'bb_std_mult': 1.1796285764397418, 'rsi_os': 52, 'rsi_ob': 83, 'vol_spike': 0.06566151987363263, 'adx_thresh': 14.63181543740306, 'atr_min_pct': 0.0198338063494053, 'atr_max_pct': 0.03630749937404808, 'tp_mult': 2.66080547358778, 'tsl_mult': 0.7648324286149172, 'strategy': 'breakout', 'time_stop': 250, 'use_sma': False, 'use_atr': False, 'use_adx': False, 'use_ema': True, 'use_spike': True, 'rsi_required': True, 'edge_k': 0.11984702395837835, 'edge_cap': 0.689905860987013, 'bull_strategy': 'mean_reversion', 'bull_bb_std_mult': 1.2333360666485695, 'bull_rsi_os': 49, 'bull_rsi_ob': 50, 'bull_adx_thresh': 31.41345749253294, 'bull_atr_min_pct': 0.0029407609655790535, 'bull_atr_max_pct': 0.07150833759091586, 'bull_tp_mult': 2.890733966012356, 'bull_tsl_mult': 0.42309958671178427, 'bull_time_stop': 260, 'bull_use_sma': True, 'bull_use_ema': True, 'bull_use_atr': True, 'bull_use_adx': False, 'bull_use_spike': True, 'bull_rsi_required': False, 'bear_strategy': 'breakout', 'bear_bb_std_mult': 0.8490237560450558, 'bear_rsi_os': 35, 'bear_rsi_ob': 49, 'bear_adx_thresh': 16.71884693728088, 'bear_atr_min_pct': 0.009339521521211385, 'bear_atr_max_pct': 0.11316386070414394, 'bear_tp_mult': 2.632337144384412, 'bear_tsl_mult': 0.2986494753003347, 'bear_time_stop': 162, 'bear_use_sma': True, 'bear_use_ema': True, 'bear_use_atr': False, 'bear_use_adx': False, 'bear_use_spike': False, 'bear_rsi_required': False, 'sideways_strategy': 'mean_reversion', 'sideways_bb_std_mult': 1.0634961523465678, 'sideways_rsi_os': 30, 'sideways_rsi_ob': 90, 'sideways_adx_thresh': 19.746954383879448, 'sideways_atr_min_pct': 0.014023829582031314, 'sideways_atr_max_pct': 0.04127173957276792, 'sideways_tp_mult': 1.30317916056085, 'sideways_tsl_mult': 0.45122851271439346, 'sideways_time_stop': 68, 'sideways_use_sma': True, 'sideways_use_ema': True, 'sideways_use_atr': False, 'sideways_use_adx': False, 'sideways_use_spike': True, 'sideways_rsi_required': True}.
[I 2025-09-01 11:28:13,225] Trial 301 finished with values: [-1000000000.0, 1000000000.0] and parameters: {'p_sma': 18, 'p_std': 42, 'p_atr': 8, 'p_adx': 19, 'rsi_period': 40, 'ema1': 21, 'ema2': 36, 'slip_atr_k': 0.005451190094409004, 'slip_spread_k': 0.08855191421739367, 'spread_hl_frac': 0.03197642462074005, 'bb_std_mult': 2.2696855239942604, 'rsi_os': 33, 'rsi_ob': 83, 'vol_spike': 0.11664547096316448, 'adx_thresh': 13.101224315311875, 'atr_min_pct': 0.029941345421944054, 'atr_max_pct': 0.036592546320323875, 'tp_mult': 2.9984277236878256, 'tsl_mult': 0.7600363650265496, 'strategy': 'breakout', 'time_stop': 248, 'use_sma': False, 'use_atr': False, 'use_adx': False, 'use_ema': True, 'use_spike': True, 'rsi_required': True, 'edge_k': 0.4677566249610676, 'edge_cap': 0.35638499328691153, 'bull_strategy': 'mean_reversion', 'bull_bb_std_mult': 2.701923692067033, 'bull_rsi_os': 32, 'bull_rsi_ob': 90, 'bull_adx_thresh': 31.199153880091238, 'bull_atr_min_pct': 0.0005682496195930953, 'bull_atr_max_pct': 0.09856084489041307, 'bull_tp_mult': 2.9065665748645166, 'bull_tsl_mult': 0.3304309381577287, 'bull_time_stop': 127, 'bull_use_sma': True, 'bull_use_ema': True, 'bull_use_atr': True, 'bull_use_adx': False, 'bull_use_spike': True, 'bull_rsi_required': False, 'bear_strategy': 'breakout', 'bear_bb_std_mult': 0.8346394690982842, 'bear_rsi_os': 31, 'bear_rsi_ob': 49, 'bear_adx_thresh': 32.69646831318501, 'bear_atr_min_pct': 0.01037984362921606, 'bear_atr_max_pct': 0.030537988855130052, 'bear_tp_mult': 2.6421381907483674, 'bear_tsl_mult': 0.2924000263727909, 'bear_time_stop': 45, 'bear_use_sma': True, 'bear_use_ema': True, 'bear_use_atr': False, 'bear_use_adx': False, 'bear_use_spike': False, 'bear_rsi_required': False, 'sideways_strategy': 'mean_reversion', 'sideways_bb_std_mult': 1.8768892290070323, 'sideways_rsi_os': 20, 'sideways_rsi_ob': 90, 'sideways_adx_thresh': 11.932734724349098, 'sideways_atr_min_pct': 0.016560487072051166, 'sideways_atr_max_pct': 0.01795130287344142, 'sideways_tp_mult': 1.4505516519402408, 'sideways_tsl_mult': 0.9662720312330442, 'sideways_time_stop': 115, 'sideways_use_sma': True, 'sideways_use_ema': True, 'sideways_use_atr': False, 'sideways_use_adx': False, 'sideways_use_spike': True, 'sideways_rsi_required': True}.
[I 2025-09-01 11:28:54,938] Trial 306 finished with values: [-1000000000.0, 1000000000.0] and parameters: {'p_sma': 13, 'p_std': 60, 'p_atr': 9, 'p_adx': 29, 'rsi_period': 49, 'ema1': 9, 'ema2': 36, 'slip_atr_k': 0.008318071158802062, 'slip_spread_k': 0.564091896515569, 'spread_hl_frac': 0.029725255053465162, 'bb_std_mult': 3.011872757152109, 'rsi_os': 27, 'rsi_ob': 55, 'vol_spike': 0.0001757992857992774, 'adx_thresh': 21.858395495588745, 'atr_min_pct': 0.004721827804049929, 'atr_max_pct': 0.031193184332629777, 'tp_mult': 2.556439283081956, 'tsl_mult': 0.8817620439406306, 'strategy': 'mean_reversion', 'time_stop': 181, 'use_sma': True, 'use_atr': False, 'use_adx': False, 'use_ema': False, 'use_spike': True, 'rsi_required': False, 'edge_k': 0.42249514275022576, 'edge_cap': 0.8977874149370629, 'bull_strategy': 'breakout', 'bull_bb_std_mult': 2.86163461703241, 'bull_rsi_os': 51, 'bull_rsi_ob': 90, 'bull_adx_thresh': 30.75114160061138, 'bull_atr_min_pct': 0.02934347739867119, 'bull_atr_max_pct': 0.09346462068026422, 'bull_tp_mult': 2.991032379344684, 'bull_tsl_mult': 0.30661661588390454, 'bull_time_stop': 124, 'bull_use_sma': True, 'bull_use_ema': True, 'bull_use_atr': True, 'bull_use_adx': True, 'bull_use_spike': True, 'bull_rsi_required': False, 'bear_strategy': 'breakout', 'bear_bb_std_mult': 0.9338501827174961, 'bear_rsi_os': 22, 'bear_rsi_ob': 67, 'bear_adx_thresh': 14.526252684214372, 'bear_atr_min_pct': 0.004371980998331984, 'bear_atr_max_pct': 0.09832662018526717, 'bear_tp_mult': 2.703190544192391, 'bear_tsl_mult': 0.27257502510590786, 'bear_time_stop': 66, 'bear_use_sma': False, 'bear_use_ema': True, 'bear_use_atr': False, 'bear_use_adx': True, 'bear_use_spike': True, 'bear_rsi_required': True, 'sideways_strategy': 'mean_reversion', 'sideways_bb_std_mult': 3.5394773081820996, 'sideways_rsi_os': 46, 'sideways_rsi_ob': 87, 'sideways_adx_thresh': 26.33329824378639, 'sideways_atr_min_pct': 0.018145991651236967, 'sideways_atr_max_pct': 0.016690904352105497, 'sideways_tp_mult': 1.352113994478593, 'sideways_tsl_mult': 0.5487385304317256, 'sideways_time_stop': 123, 'sideways_use_sma': True, 'sideways_use_ema': False, 'sideways_use_atr': True, 'sideways_use_adx': True, 'sideways_use_spike': False, 'sideways_rsi_required': True}.
