[I 2025-09-01 11:56:44,159] Trial 469 finished with values: [-1000000000.0, 1000000000.0] and parameters: {'p_sma': 23, 'p_std': 31, 'p_atr': 18, 'p_adx': 8, 'rsi_period': 48, 'ema1': 25, 'ema2': 18, 'slip_atr_k': 0.01852510855550396, 'slip_spread_k': 0.4102640523427498, 'spread_hl_frac': 0.002635354418611552, 'bb_std_mult': 0.971395531256186, 'rsi_os': 33, 'rsi_ob': 48, 'vol_spike': 0.19923283993770638, 'adx_thresh': 22.581093621920388, 'atr_min_pct': 0.025136339768578174, 'atr_max_pct': 0.07595306335692198, 'tp_mult': 1.9653932621204155, 'tsl_mult': 0.10505261085174164, 'strategy': 'breakout', 'time_stop': 191, 'use_sma': False, 'use_atr': True, 'use_adx': True, 'use_ema': True, 'use_spike': False, 'rsi_required': False, 'edge_k': 0.26147564557519626, 'edge_cap': 0.1709521270655132, 'bull_strategy': 'mean_reversion', 'bull_bb_std_mult': 1.7281483012412422, 'bull_rsi_os': 42, 'bull_rsi_ob': 51, 'bull_adx_thresh': 6.652148523902279, 'bull_atr_min_pct': 0.01708647083423889, 'bull_atr_max_pct': 0.10292570931087004, 'bull_tp_mult': 1.331221617401995, 'bull_tsl_mult': 0.6484856706870593, 'bull_time_stop': 179, 'bull_use_sma': False, 'bull_use_ema': False, 'bull_use_atr': False, 'bull_use_adx': False, 'bull_use_spike': False, 'bull_rsi_required': False, 'bear_strategy': 'breakout', 'bear_bb_std_mult': 1.4217745368273542, 'bear_rsi_os': 27, 'bear_rsi_ob': 53, 'bear_adx_thresh': 9.264396972714533, 'bear_atr_min_pct': 0.02613337381535516, 'bear_atr_max_pct': 0.01874333671807388, 'bear_tp_mult': 1.4211079294811326, 'bear_tsl_mult': 0.7253916641183441, 'bear_time_stop': 263, 'bear_use_sma': True, 'bear_use_ema': False, 'bear_use_atr': True, 'bear_use_adx': True, 'bear_use_spike': False, 'bear_rsi_required': True, 'sideways_strategy': 'breakout', 'sideways_bb_std_mult': 2.0538457994281396, 'sideways_rsi_os': 43, 'sideways_rsi_ob': 92, 'sideways_adx_thresh': 33.84023587967882, 'sideways_atr_min_pct': 0.02454880613117383, 'sideways_atr_max_pct': 0.12994386184933582, 'sideways_tp_mult': 2.7437289999429817, 'sideways_tsl_mult': 0.4012606877695114, 'sideways_time_stop': 73, 'sideways_use_sma': False, 'sideways_use_ema': False, 'sideways_use_atr': True, 'sideways_use_adx': True, 'sideways_use_spike': True, 'sideways_rsi_required': False}.
[I 2025-09-01 11:56:44,941] Trial 468 finished with values: [0.0035462256004521464, 0.0045691785109270005] and parameters: {'p_sma': 29, 'p_std': 31, 'p_atr': 20, 'p_adx': 8, 'rsi_period': 47, 'ema1': 25, 'ema2': 19, 'slip_atr_k': 0.02517228646388075, 'slip_spread_k': 0.37805784809417375, 'spread_hl_frac': 0.0017497582224357058, 'bb_std_mult': 0.9543626661809188, 'rsi_os': 28, 'rsi_ob': 50, 'vol_spike': 0.20252141580626426, 'adx_thresh': 23.92596984419356, 'atr_min_pct': 0.025489229221666784, 'atr_max_pct': 0.07506583113237722, 'tp_mult': 2.11755097065768, 'tsl_mult': 0.1024960889546429, 'strategy': 'breakout', 'time_stop': 173, 'use_sma': False, 'use_atr': True, 'use_adx': True, 'use_ema': True, 'use_spike': False, 'rsi_required': False, 'edge_k': 0.2476270035438854, 'edge_cap': 0.10012450099061948, 'bull_strategy': 'mean_reversion', 'bull_bb_std_mult': 1.7569504430846192, 'bull_rsi_os': 42, 'bull_rsi_ob': 49, 'bull_adx_thresh': 6.245127743238148, 'bull_atr_min_pct': 0.01675378362896709, 'bull_atr_max_pct': 0.10305097572433637, 'bull_tp_mult': 1.1869718576612118, 'bull_tsl_mult': 0.6491591763565762, 'bull_time_stop': 180, 'bull_use_sma': False, 'bull_use_ema': False, 'bull_use_atr': True, 'bull_use_adx': False, 'bull_use_spike': False, 'bull_rsi_required': False, 'bear_strategy': 'breakout', 'bear_bb_std_mult': 1.411063824548941, 'bear_rsi_os': 27, 'bear_rsi_ob': 51, 'bear_adx_thresh': 9.573686158766245, 'bear_atr_min_pct': 0.003732634083245429, 'bear_atr_max_pct': 0.018146824290152175, 'bear_tp_mult': 1.4940330829528843, 'bear_tsl_mult': 0.6624848905434813, 'bear_time_stop': 71, 'bear_use_sma': True, 'bear_use_ema': False, 'bear_use_atr': True, 'bear_use_adx': True, 'bear_use_spike': False, 'bear_rsi_required': True, 'sideways_strategy': 'breakout', 'sideways_bb_std_mult': 2.066059815832819, 'sideways_rsi_os': 40, 'sideways_rsi_ob': 89, 'sideways_adx_thresh': 33.86820950390287, 'sideways_atr_min_pct': 0.024107591537824158, 'sideways_atr_max_pct': 0.12481721342913038, 'sideways_tp_mult': 2.8509025249037077, 'sideways_tsl_mult': 0.3941603390895231, 'sideways_time_stop': 94, 'sideways_use_sma': False, 'sideways_use_ema': False, 'sideways_use_atr': True, 'sideways_use_adx': True, 'sideways_use_spike': True, 'sideways_rsi_required': False}.
[I 2025-09-01 11:56:45,580] Trial 470 finished with values: [-1000000000.0, 1000000000.0] and parameters: {'p_sma': 22, 'p_std': 33, 'p_atr': 21, 'p_adx': 7, 'rsi_period': 44, 'ema1': 26, 'ema2': 20, 'slip_atr_k': 0.03652877474714128, 'slip_spread_k': 0.4718864553153806, 'spread_hl_frac': 0.002966546015628159, 'bb_std_mult': 2.036514541118421, 'rsi_os': 32, 'rsi_ob': 50, 'vol_spike': 0.22109698673531997, 'adx_thresh': 24.193998565867766, 'atr_min_pct': 0.023107601860339534, 'atr_max_pct': 0.07622908595102511, 'tp_mult': 2.1042837626297572, 'tsl_mult': 0.06919158755997065, 'strategy': 'breakout', 'time_stop': 159, 'use_sma': False, 'use_atr': True, 'use_adx': True, 'use_ema': True, 'use_spike': False, 'rsi_required': False, 'edge_k': 0.14947152591980256, 'edge_cap': 0.08906042632488838, 'bull_strategy': 'mean_reversion', 'bull_bb_std_mult': 1.7680311850987502, 'bull_rsi_os': 41, 'bull_rsi_ob': 47, 'bull_adx_thresh': 7.212907874053276, 'bull_atr_min_pct': 0.016425645523424518, 'bull_atr_max_pct': 0.11211712055668155, 'bull_tp_mult': 1.208062534652124, 'bull_tsl_mult': 0.6460540703625424, 'bull_time_stop': 175, 'bull_use_sma': False, 'bull_use_ema': False, 'bull_use_atr': False, 'bull_use_adx': False, 'bull_use_spike': False, 'bull_rsi_required': False, 'bear_strategy': 'breakout', 'bear_bb_std_mult': 1.437025888225961, 'bear_rsi_os': 27, 'bear_rsi_ob': 53, 'bear_adx_thresh': 6.930077674707738, 'bear_atr_min_pct': 0.006004407617312888, 'bear_atr_max_pct': 0.01509134243733911, 'bear_tp_mult': 1.3936450689723576, 'bear_tsl_mult': 0.7193652227881111, 'bear_time_stop': 276, 'bear_use_sma': True, 'bear_use_ema': False, 'bear_use_atr': True, 'bear_use_adx': True, 'bear_use_spike': False, 'bear_rsi_required': True, 'sideways_strategy': 'breakout', 'sideways_bb_std_mult': 2.0689685993197244, 'sideways_rsi_os': 46, 'sideways_rsi_ob': 92, 'sideways_adx_thresh': 33.372109792028844, 'sideways_atr_min_pct': 0.025111764690410134, 'sideways_atr_max_pct': 0.12595253072451726, 'sideways_tp_mult': 2.8605364550870926, 'sideways_tsl_mult': 0.3201958529143327, 'sideways_time_stop': 99, 'sideways_use_sma': False, 'sideways_use_ema': False, 'sideways_use_atr': True, 'sideways_use_adx': True, 'sideways_use_spike': True, 'sideways_rsi_required': False}.
[I 2025-09-01 11:56:46,035] Trial 471 finished with values: [-1000000000.0, 1000000000.0] and parameters: {'p_sma': 29, 'p_std': 30, 'p_atr': 30, 'p_adx': 20, 'rsi_period': 44, 'ema1': 26, 'ema2': 13, 'slip_atr_k': 0.03269507242164271, 'slip_spread_k': 0.36255625075847464, 'spread_hl_frac': 0.005451409371205656, 'bb_std_mult': 0.7530244514316972, 'rsi_os': 34, 'rsi_ob': 46, 'vol_spike': 0.1612115668689701, 'adx_thresh': 12.641708831312936, 'atr_min_pct': 0.022936848533904902, 'atr_max_pct': 0.08683938350923913, 'tp_mult': 2.111247056121896, 'tsl_mult': 0.13155403274945415, 'strategy': 'breakout', 'time_stop': 162, 'use_sma': False, 'use_atr': True, 'use_adx': True, 'use_ema': True, 'use_spike': False, 'rsi_required': False, 'edge_k': 0.12174088875161226, 'edge_cap': 0.12626363214721711, 'bull_strategy': 'mean_reversion', 'bull_bb_std_mult': 1.90697498289004, 'bull_rsi_os': 52, 'bull_rsi_ob': 47, 'bull_adx_thresh': 7.48761853047336, 'bull_atr_min_pct': 0.01515580869462579, 'bull_atr_max_pct': 0.11460141595841086, 'bull_tp_mult': 1.3392223691286447, 'bull_tsl_mult': 0.5647749558836777, 'bull_time_stop': 162, 'bull_use_sma': False, 'bull_use_ema': False, 'bull_use_atr': False, 'bull_use_adx': False, 'bull_use_spike': False, 'bull_rsi_required': True, 'bear_strategy': 'mean_reversion', 'bear_bb_std_mult': 1.4054360838230056, 'bear_rsi_os': 27, 'bear_rsi_ob': 54, 'bear_adx_thresh': 9.961543935897405, 'bear_atr_min_pct': 0.0021291002412081464, 'bear_atr_max_pct': 0.026628051596662528, 'bear_tp_mult': 1.5781696089743136, 'bear_tsl_mult': 0.7293942978709551, 'bear_time_stop': 286, 'bear_use_sma': True, 'bear_use_ema': False, 'bear_use_atr': True, 'bear_use_adx': True, 'bear_use_spike': False, 'bear_rsi_required': True, 'sideways_strategy': 'breakout', 'sideways_bb_std_mult': 2.2556417984057915, 'sideways_rsi_os': 40, 'sideways_rsi_ob': 88, 'sideways_adx_thresh': 34.04937028616055, 'sideways_atr_min_pct': 0.004314565341852274, 'sideways_atr_max_pct': 0.12418974022808177, 'sideways_tp_mult': 2.974714510570008, 'sideways_tsl_mult': 0.9031107044010618, 'sideways_time_stop': 95, 'sideways_use_sma': False, 'sideways_use_ema': False, 'sideways_use_atr': True, 'sideways_use_adx': True, 'sideways_use_spike': True, 'sideways_rsi_required': False}.
[I 2025-09-01 11:57:28,538] Trial 474 finished with values: [-1000000000.0, 1000000000.0] and parameters: {'p_sma': 27, 'p_std': 30, 'p_atr': 18, 'p_adx': 8, 'rsi_period': 45, 'ema1': 26, 'ema2': 13, 'slip_atr_k': 0.0316391061168869, 'slip_spread_k': 0.36690775551882565, 'spread_hl_frac': 0.005465540893627262, 'bb_std_mult': 0.8452064488391722, 'rsi_os': 34, 'rsi_ob': 46, 'vol_spike': 0.18044508628823458, 'adx_thresh': 10.445605473646191, 'atr_min_pct': 0.021878862540596927, 'atr_max_pct': 0.08904977516819045, 'tp_mult': 2.1629898280009843, 'tsl_mult': 0.1343179680014453, 'strategy': 'breakout', 'time_stop': 173, 'use_sma': False, 'use_atr': True, 'use_adx': True, 'use_ema': True, 'use_spike': False, 'rsi_required': False, 'edge_k': 0.10285174532793671, 'edge_cap': 0.12884923369862206, 'bull_strategy': 'mean_reversion', 'bull_bb_std_mult': 1.8722087411195243, 'bull_rsi_os': 52, 'bull_rsi_ob': 47, 'bull_adx_thresh': 7.706531914558003, 'bull_atr_min_pct': 0.014889130348608582, 'bull_atr_max_pct': 0.11505126181347221, 'bull_tp_mult': 1.022788803192972, 'bull_tsl_mult': 0.5665100726879833, 'bull_time_stop': 164, 'bull_use_sma': False, 'bull_use_ema': False, 'bull_use_atr': False, 'bull_use_adx': False, 'bull_use_spike': False, 'bull_rsi_required': True, 'bear_strategy': 'mean_reversion', 'bear_bb_std_mult': 1.475745929052696, 'bear_rsi_os': 27, 'bear_rsi_ob': 55, 'bear_adx_thresh': 10.093421442041016, 'bear_atr_min_pct': 0.0011254076659019917, 'bear_atr_max_pct': 0.026325240150196383, 'bear_tp_mult': 1.5773981241697148, 'bear_tsl_mult': 0.7100831044339765, 'bear_time_stop': 285, 'bear_use_sma': True, 'bear_use_ema': False, 'bear_use_atr': True, 'bear_use_adx': True, 'bear_use_spike': False, 'bear_rsi_required': True, 'sideways_strategy': 'breakout', 'sideways_bb_std_mult': 2.239908726087335, 'sideways_rsi_os': 8, 'sideways_rsi_ob': 88, 'sideways_adx_thresh': 34.908423848011196, 'sideways_atr_min_pct': 0.006888352326624103, 'sideways_atr_max_pct': 0.12225896085829455, 'sideways_tp_mult': 2.996557578255552, 'sideways_tsl_mult': 0.8024076397037706, 'sideways_time_stop': 106, 'sideways_use_sma': False, 'sideways_use_ema': False, 'sideways_use_atr': True, 'sideways_use_adx': True, 'sideways_use_spike': True, 'sideways_rsi_required': False}.
[I 2025-09-01 11:57:29,271] Trial 473 finished with values: [-1000000000.0, 1000000000.0] and parameters: {'p_sma': 29, 'p_std': 30, 'p_atr': 13, 'p_adx': 8, 'rsi_period': 45, 'ema1': 26, 'ema2': 13, 'slip_atr_k': 0.03249510139960099, 'slip_spread_k': 0.3620631210856626, 'spread_hl_frac': 0.00538682440545292, 'bb_std_mult': 0.7558807859260724, 'rsi_os': 33, 'rsi_ob': 46, 'vol_spike': 0.18478988073327546, 'adx_thresh': 12.632491282688832, 'atr_min_pct': 0.02317423849501374, 'atr_max_pct': 0.08739534101409767, 'tp_mult': 2.1128852234413884, 'tsl_mult': 0.11522949840901964, 'strategy': 'breakout', 'time_stop': 159, 'use_sma': False, 'use_atr': True, 'use_adx': True, 'use_ema': True, 'use_spike': False, 'rsi_required': False, 'edge_k': 0.11542870932734592, 'edge_cap': 0.12545522508434487, 'bull_strategy': 'mean_reversion', 'bull_bb_std_mult': 1.8534883770099593, 'bull_rsi_os': 52, 'bull_rsi_ob': 48, 'bull_adx_thresh': 7.194242420671252, 'bull_atr_min_pct': 0.01495072222272431, 'bull_atr_max_pct': 0.11298911253953056, 'bull_tp_mult': 1.027884851649565, 'bull_tsl_mult': 0.5508476450147968, 'bull_time_stop': 161, 'bull_use_sma': False, 'bull_use_ema': False, 'bull_use_atr': False, 'bull_use_adx': False, 'bull_use_spike': False, 'bull_rsi_required': True, 'bear_strategy': 'mean_reversion', 'bear_bb_std_mult': 1.4850761608401637, 'bear_rsi_os': 27, 'bear_rsi_ob': 53, 'bear_adx_thresh': 12.530507857589246, 'bear_atr_min_pct': 0.015403345724551026, 'bear_atr_max_pct': 0.026627538523216858, 'bear_tp_mult': 1.6427879295878196, 'bear_tsl_mult': 0.7063059781383777, 'bear_time_stop': 275, 'bear_use_sma': True, 'bear_use_ema': False, 'bear_use_atr': True, 'bear_use_adx': True, 'bear_use_spike': False, 'bear_rsi_required': True, 'sideways_strategy': 'breakout', 'sideways_bb_std_mult': 2.2819235810891856, 'sideways_rsi_os': 27, 'sideways_rsi_ob': 88, 'sideways_adx_thresh': 34.596767937942005, 'sideways_atr_min_pct': 0.0021142116865206996, 'sideways_atr_max_pct': 0.1245392609859234, 'sideways_tp_mult': 2.995484317493423, 'sideways_tsl_mult': 0.4022027871889741, 'sideways_time_stop': 107, 'sideways_use_sma': False, 'sideways_use_ema': False, 'sideways_use_atr': True, 'sideways_use_adx': True, 'sideways_use_spike': True, 'sideways_rsi_required': False}.
[I 2025-09-01 11:57:29,880] Trial 475 finished with values: [-1000000000.0, 1000000000.0] and parameters: {'p_sma': 26, 'p_std': 31, 'p_atr': 13, 'p_adx': 8, 'rsi_period': 46, 'ema1': 26, 'ema2': 14, 'slip_atr_k': 0.031696756400471475, 'slip_spread_k': 0.36720266258424783, 'spread_hl_frac': 0.004844262990366626, 'bb_std_mult': 0.7559572913461616, 'rsi_os': 34, 'rsi_ob': 46, 'vol_spike': 0.17613415124916412, 'adx_thresh': 10.029256077847968, 'atr_min_pct': 0.022928149555430592, 'atr_max_pct': 0.08856397295587448, 'tp_mult': 1.1038754076411728, 'tsl_mult': 0.14975712609755457, 'strategy': 'breakout', 'time_stop': 172, 'use_sma': False, 'use_atr': True, 'use_adx': True, 'use_ema': False, 'use_spike': False, 'rsi_required': False, 'edge_k': 0.08650085821746024, 'edge_cap': 0.1303575188167118, 'bull_strategy': 'mean_reversion', 'bull_bb_std_mult': 1.8765025001696096, 'bull_rsi_os': 51, 'bull_rsi_ob': 48, 'bull_adx_thresh': 14.692079505112984, 'bull_atr_min_pct': 0.015955932322893187, 'bull_atr_max_pct': 0.1175974507326639, 'bull_tp_mult': 1.2623294876423106, 'bull_tsl_mult': 0.5681204655024639, 'bull_time_stop': 165, 'bull_use_sma': False, 'bull_use_ema': False, 'bull_use_atr': False, 'bull_use_adx': False, 'bull_use_spike': False, 'bull_rsi_required': True, 'bear_strategy': 'mean_reversion', 'bear_bb_std_mult': 1.515160433343825, 'bear_rsi_os': 27, 'bear_rsi_ob': 54, 'bear_adx_thresh': 12.280289567670174, 'bear_atr_min_pct': 0.0009140054366606389, 'bear_atr_max_pct': 0.026334605354770505, 'bear_tp_mult': 1.5715539432965107, 'bear_tsl_mult': 0.7158170075238702, 'bear_time_stop': 282, 'bear_use_sma': True, 'bear_use_ema': False, 'bear_use_atr': True, 'bear_use_adx': True, 'bear_use_spike': False, 'bear_rsi_required': True, 'sideways_strategy': 'breakout', 'sideways_bb_std_mult': 2.2377656478038994, 'sideways_rsi_os': 13, 'sideways_rsi_ob': 88, 'sideways_adx_thresh': 34.56816476813391, 'sideways_atr_min_pct': 0.005996228878113856, 'sideways_atr_max_pct': 0.12201069186772671, 'sideways_tp_mult': 2.9227444775144895, 'sideways_tsl_mult': 0.39480504363398394, 'sideways_time_stop': 107, 'sideways_use_sma': False, 'sideways_use_ema': False, 'sideways_use_atr': True, 'sideways_use_adx': True, 'sideways_use_spike': True, 'sideways_rsi_required': False}.
[I 2025-09-01 11:57:30,101] Trial 472 finished with values: [-1000000000.0, 1000000000.0] and parameters: {'p_sma': 29, 'p_std': 31, 'p_atr': 13, 'p_adx': 20, 'rsi_period': 44, 'ema1': 26, 'ema2': 13, 'slip_atr_k': 0.032259908377330324, 'slip_spread_k': 0.3652154900555897, 'spread_hl_frac': 0.005340887224474354, 'bb_std_mult': 0.8492255518156325, 'rsi_os': 34, 'rsi_ob': 46, 'vol_spike': 0.17383462399316058, 'adx_thresh': 26.204159958757103, 'atr_min_pct': 0.021975275343740844, 'atr_max_pct': 0.08900693905997159, 'tp_mult': 2.10671389721533, 'tsl_mult': 0.14131630892472657, 'strategy': 'breakout', 'time_stop': 159, 'use_sma': False, 'use_atr': True, 'use_adx': True, 'use_ema': True, 'use_spike': False, 'rsi_required': False, 'edge_k': 0.11208354632561755, 'edge_cap': 0.12641568380485108, 'bull_strategy': 'mean_reversion', 'bull_bb_std_mult': 1.9185553251682934, 'bull_rsi_os': 52, 'bull_rsi_ob': 47, 'bull_adx_thresh': 10.88430420740822, 'bull_atr_min_pct': 0.01496616985366771, 'bull_atr_max_pct': 0.11370399248361206, 'bull_tp_mult': 1.339478453986968, 'bull_tsl_mult': 0.5666025312583076, 'bull_time_stop': 162, 'bull_use_sma': False, 'bull_use_ema': False, 'bull_use_atr': False, 'bull_use_adx': False, 'bull_use_spike': False, 'bull_rsi_required': True, 'bear_strategy': 'mean_reversion', 'bear_bb_std_mult': 1.494791270708413, 'bear_rsi_os': 27, 'bear_rsi_ob': 55, 'bear_adx_thresh': 9.770482864153074, 'bear_atr_min_pct': 0.002220759603921549, 'bear_atr_max_pct': 0.02603917745695231, 'bear_tp_mult': 1.6493552706866548, 'bear_tsl_mult': 0.7142928739754214, 'bear_time_stop': 285, 'bear_use_sma': True, 'bear_use_ema': False, 'bear_use_atr': True, 'bear_use_adx': True, 'bear_use_spike': False, 'bear_rsi_required': True, 'sideways_strategy': 'breakout', 'sideways_bb_std_mult': 2.2418744992535973, 'sideways_rsi_os': 40, 'sideways_rsi_ob': 88, 'sideways_adx_thresh': 34.82318674460894, 'sideways_atr_min_pct': 0.005906411601542623, 'sideways_atr_max_pct': 0.12082500888303149, 'sideways_tp_mult': 2.9991216805390435, 'sideways_tsl_mult': 0.39973609715275726, 'sideways_time_stop': 98, 'sideways_use_sma': False, 'sideways_use_ema': False, 'sideways_use_atr': True, 'sideways_use_adx': True, 'sideways_use_spike': True, 'sideways_rsi_required': False}.
[I 2025-09-01 11:58:11,438] Trial 477 finished with values: [-1000000000.0, 1000000000.0] and parameters: {'p_sma': 26, 'p_std': 31, 'p_atr': 23, 'p_adx': 16, 'rsi_period': 41, 'ema1': 27, 'ema2': 43, 'slip_atr_k': 0.02718192497687547, 'slip_spread_k': 0.3254077677801237, 'spread_hl_frac': 0.004166952021175591, 'bb_std_mult': 0.7953272298491627, 'rsi_os': 34, 'rsi_ob': 48, 'vol_spike': 0.17150456440383013, 'adx_thresh': 8.449736950538568, 'atr_min_pct': 0.021817043609053677, 'atr_max_pct': 0.08239721511838928, 'tp_mult': 2.1715203351436005, 'tsl_mult': 0.15889856503249739, 'strategy': 'breakout', 'time_stop': 174, 'use_sma': False, 'use_atr': True, 'use_adx': True, 'use_ema': False, 'use_spike': False, 'rsi_required': False, 'edge_k': 0.1352186769376016, 'edge_cap': 0.1212131295997826, 'bull_strategy': 'mean_reversion', 'bull_bb_std_mult': 1.9055637557027936, 'bull_rsi_os': 51, 'bull_rsi_ob': 48, 'bull_adx_thresh': 10.969404706556832, 'bull_atr_min_pct': 0.015921733541738033, 'bull_atr_max_pct': 0.11759157070116466, 'bull_tp_mult': 1.3192352309817816, 'bull_tsl_mult': 0.06543183500956135, 'bull_time_stop': 169, 'bull_use_sma': False, 'bull_use_ema': False, 'bull_use_atr': False, 'bull_use_adx': False, 'bull_use_spike': False, 'bull_rsi_required': True, 'bear_strategy': 'mean_reversion', 'bear_bb_std_mult': 1.4254289494042345, 'bear_rsi_os': 28, 'bear_rsi_ob': 53, 'bear_adx_thresh': 10.076561728074564, 'bear_atr_min_pct': 0.0015813951988662162, 'bear_atr_max_pct': 0.04053449989296187, 'bear_tp_mult': 1.5541591714040375, 'bear_tsl_mult': 0.7018986379794316, 'bear_time_stop': 270, 'bear_use_sma': True, 'bear_use_ema': False, 'bear_use_atr': True, 'bear_use_adx': True, 'bear_use_spike': False, 'bear_rsi_required': True, 'sideways_strategy': 'breakout', 'sideways_bb_std_mult': 2.364105446569289, 'sideways_rsi_os': 40, 'sideways_rsi_ob': 88, 'sideways_adx_thresh': 33.565555787677695, 'sideways_atr_min_pct': 0.005765870130347619, 'sideways_atr_max_pct': 0.12003372000739543, 'sideways_tp_mult': 2.9032580391100646, 'sideways_tsl_mult': 0.3876271441933471, 'sideways_time_stop': 98, 'sideways_use_sma': False, 'sideways_use_ema': False, 'sideways_use_atr': True, 'sideways_use_adx': True, 'sideways_use_spike': True, 'sideways_rsi_required': False}.
