[I 2025-09-01 11:14:15,146] Trial 209 finished with values: [-1000000000.0, 1000000000.0] and parameters: {'p_sma': 12, 'p_std': 26, 'p_atr': 8, 'p_adx': 30, 'rsi_period': 49, 'ema1': 21, 'ema2': 42, 'slip_atr_k': 0.004729549564838228, 'slip_spread_k': 0.07619239618461088, 'spread_hl_frac': 0.027828747638975658, 'bb_std_mult': 3.18684519759414, 'rsi_os': 9, 'rsi_ob': 82, 'vol_spike': 0.11176132784321402, 'adx_thresh': 21.57883559647976, 'atr_min_pct': 0.029187956692834773, 'atr_max_pct': 0.04491655852715607, 'tp_mult': 2.586020539015272, 'tsl_mult': 0.8581949994979468, 'strategy': 'breakout', 'time_stop': 235, 'use_sma': False, 'use_atr': False, 'use_adx': False, 'use_ema': False, 'use_spike': True, 'rsi_required': False, 'edge_k': 0.3433093787445734, 'edge_cap': 0.24476603443334455, 'bull_strategy': 'mean_reversion', 'bull_bb_std_mult': 3.0820425537577822, 'bull_rsi_os': 47, 'bull_rsi_ob': 87, 'bull_adx_thresh': 21.276453987392227, 'bull_atr_min_pct': 0.01674427620337351, 'bull_atr_max_pct': 0.09263166287476317, 'bull_tp_mult': 2.686885346266662, 'bull_tsl_mult': 0.7345233285209098, 'bull_time_stop': 251, 'bull_use_sma': True, 'bull_use_ema': True, 'bull_use_atr': True, 'bull_use_adx': False, 'bull_use_spike': False, 'bull_rsi_required': True, 'bear_strategy': 'mean_reversion', 'bear_bb_std_mult': 0.8327751921249376, 'bear_rsi_os': 35, 'bear_rsi_ob': 51, 'bear_adx_thresh': 15.645950307770411, 'bear_atr_min_pct': 0.008791700930617246, 'bear_atr_max_pct': 0.0252557722943992, 'bear_tp_mult': 2.770132403645622, 'bear_tsl_mult': 0.28593377688534133, 'bear_time_stop': 86, 'bear_use_sma': True, 'bear_use_ema': True, 'bear_use_atr': False, 'bear_use_adx': True, 'bear_use_spike': False, 'bear_rsi_required': True, 'sideways_strategy': 'mean_reversion', 'sideways_bb_std_mult': 3.597847921801869, 'sideways_rsi_os': 41, 'sideways_rsi_ob': 89, 'sideways_adx_thresh': 25.063710839744008, 'sideways_atr_min_pct': 0.018377099855471927, 'sideways_atr_max_pct': 0.09034098041472025, 'sideways_tp_mult': 1.6944128865541528, 'sideways_tsl_mult': 0.2869685101725043, 'sideways_time_stop': 110, 'sideways_use_sma': True, 'sideways_use_ema': False, 'sideways_use_atr': True, 'sideways_use_adx': True, 'sideways_use_spike': True, 'sideways_rsi_required': False}.
[I 2025-09-01 11:14:15,154] Trial 207 finished with values: [-1000000000.0, 1000000000.0] and parameters: {'p_sma': 20, 'p_std': 26, 'p_atr': 12, 'p_adx': 30, 'rsi_period': 48, 'ema1': 22, 'ema2': 40, 'slip_atr_k': 0.005281219079013472, 'slip_spread_k': 0.31908129884285236, 'spread_hl_frac': 0.03262389719996126, 'bb_std_mult': 2.8414243547800764, 'rsi_os': 21, 'rsi_ob': 88, 'vol_spike': 0.07699113799463884, 'adx_thresh': 21.46937810618422, 'atr_min_pct': 0.026593349733861578, 'atr_max_pct': 0.09238415781494136, 'tp_mult': 2.5562311762036605, 'tsl_mult': 0.5320468002482606, 'strategy': 'breakout', 'time_stop': 209, 'use_sma': False, 'use_atr': False, 'use_adx': False, 'use_ema': False, 'use_spike': True, 'rsi_required': False, 'edge_k': 0.05684042172158821, 'edge_cap': 0.39695192872530316, 'bull_strategy': 'mean_reversion', 'bull_bb_std_mult': 2.6121809450603637, 'bull_rsi_os': 47, 'bull_rsi_ob': 95, 'bull_adx_thresh': 20.911187897743616, 'bull_atr_min_pct': 0.0034567250060181637, 'bull_atr_max_pct': 0.09323606803737847, 'bull_tp_mult': 1.6383447402870086, 'bull_tsl_mult': 0.5478355183321687, 'bull_time_stop': 252, 'bull_use_sma': True, 'bull_use_ema': True, 'bull_use_atr': True, 'bull_use_adx': False, 'bull_use_spike': False, 'bull_rsi_required': True, 'bear_strategy': 'mean_reversion', 'bear_bb_std_mult': 1.198673749221669, 'bear_rsi_os': 28, 'bear_rsi_ob': 51, 'bear_adx_thresh': 13.227175779905838, 'bear_atr_min_pct': 0.008950584160730076, 'bear_atr_max_pct': 0.013062975903262247, 'bear_tp_mult': 2.598382290293639, 'bear_tsl_mult': 0.04621985293750116, 'bear_time_stop': 101, 'bear_use_sma': True, 'bear_use_ema': True, 'bear_use_atr': False, 'bear_use_adx': True, 'bear_use_spike': False, 'bear_rsi_required': True, 'sideways_strategy': 'mean_reversion', 'sideways_bb_std_mult': 2.9683545794316104, 'sideways_rsi_os': 16, 'sideways_rsi_ob': 52, 'sideways_adx_thresh': 27.448498354298973, 'sideways_atr_min_pct': 0.018629637762261012, 'sideways_atr_max_pct': 0.1445438000061991, 'sideways_tp_mult': 1.0520437415717014, 'sideways_tsl_mult': 0.4572007566644693, 'sideways_time_stop': 114, 'sideways_use_sma': True, 'sideways_use_ema': False, 'sideways_use_atr': True, 'sideways_use_adx': True, 'sideways_use_spike': True, 'sideways_rsi_required': False}.
[I 2025-09-01 11:14:15,656] Trial 208 finished with values: [-1000000000.0, 1000000000.0] and parameters: {'p_sma': 20, 'p_std': 42, 'p_atr': 20, 'p_adx': 30, 'rsi_period': 48, 'ema1': 22, 'ema2': 39, 'slip_atr_k': 0.000989101819773644, 'slip_spread_k': 0.3592484643458673, 'spread_hl_frac': 0.03236744042943221, 'bb_std_mult': 2.8593316161439755, 'rsi_os': 21, 'rsi_ob': 88, 'vol_spike': 0.09514932457096545, 'adx_thresh': 21.719539287947224, 'atr_min_pct': 0.026635417640448463, 'atr_max_pct': 0.09112368688516695, 'tp_mult': 2.6068569579491823, 'tsl_mult': 0.5418848259372394, 'strategy': 'breakout', 'time_stop': 209, 'use_sma': False, 'use_atr': False, 'use_adx': False, 'use_ema': False, 'use_spike': True, 'rsi_required': False, 'edge_k': 0.33671647308758723, 'edge_cap': 0.4028563470830338, 'bull_strategy': 'mean_reversion', 'bull_bb_std_mult': 2.4814789238862462, 'bull_rsi_os': 47, 'bull_rsi_ob': 95, 'bull_adx_thresh': 21.3291917527091, 'bull_atr_min_pct': 0.0036903359882587937, 'bull_atr_max_pct': 0.09330568085467085, 'bull_tp_mult': 1.6516250155579522, 'bull_tsl_mult': 0.7823897054644385, 'bull_time_stop': 251, 'bull_use_sma': True, 'bull_use_ema': True, 'bull_use_atr': True, 'bull_use_adx': False, 'bull_use_spike': False, 'bull_rsi_required': True, 'bear_strategy': 'mean_reversion', 'bear_bb_std_mult': 1.1888080280036495, 'bear_rsi_os': 29, 'bear_rsi_ob': 51, 'bear_adx_thresh': 14.475698395757902, 'bear_atr_min_pct': 0.009151457068786402, 'bear_atr_max_pct': 0.014375700473297578, 'bear_tp_mult': 2.833497063364678, 'bear_tsl_mult': 0.06556182436144707, 'bear_time_stop': 101, 'bear_use_sma': True, 'bear_use_ema': True, 'bear_use_atr': False, 'bear_use_adx': True, 'bear_use_spike': False, 'bear_rsi_required': True, 'sideways_strategy': 'mean_reversion', 'sideways_bb_std_mult': 2.579140630707027, 'sideways_rsi_os': 14, 'sideways_rsi_ob': 52, 'sideways_adx_thresh': 27.280137542741198, 'sideways_atr_min_pct': 0.01834563354651796, 'sideways_atr_max_pct': 0.1432775749813629, 'sideways_tp_mult': 1.5156998233439491, 'sideways_tsl_mult': 0.4475192727300403, 'sideways_time_stop': 110, 'sideways_use_sma': True, 'sideways_use_ema': False, 'sideways_use_atr': True, 'sideways_use_adx': True, 'sideways_use_spike': True, 'sideways_rsi_required': False}.
[I 2025-09-01 11:14:15,807] Trial 210 finished with values: [-1000000000.0, 1000000000.0] and parameters: {'p_sma': 14, 'p_std': 38, 'p_atr': 20, 'p_adx': 30, 'rsi_period': 49, 'ema1': 21, 'ema2': 36, 'slip_atr_k': 0.004363605004937105, 'slip_spread_k': 0.07807296167287514, 'spread_hl_frac': 0.028015406007547285, 'bb_std_mult': 3.1721460813472073, 'rsi_os': 9, 'rsi_ob': 82, 'vol_spike': 0.1121378735163903, 'adx_thresh': 21.748195268732097, 'atr_min_pct': 0.029270478618911258, 'atr_max_pct': 0.05116395199689317, 'tp_mult': 2.6028849216594176, 'tsl_mult': 0.8566519128275565, 'strategy': 'breakout', 'time_stop': 234, 'use_sma': False, 'use_atr': False, 'use_adx': False, 'use_ema': False, 'use_spike': True, 'rsi_required': False, 'edge_k': 0.3275636100504613, 'edge_cap': 0.23867112120853162, 'bull_strategy': 'mean_reversion', 'bull_bb_std_mult': 3.060988936878075, 'bull_rsi_os': 47, 'bull_rsi_ob': 87, 'bull_adx_thresh': 29.660671515191282, 'bull_atr_min_pct': 0.020506717903461917, 'bull_atr_max_pct': 0.09358605174995582, 'bull_tp_mult': 2.6691562748022792, 'bull_tsl_mult': 0.7801123196209955, 'bull_time_stop': 256, 'bull_use_sma': True, 'bull_use_ema': True, 'bull_use_atr': True, 'bull_use_adx': False, 'bull_use_spike': False, 'bull_rsi_required': True, 'bear_strategy': 'mean_reversion', 'bear_bb_std_mult': 0.8374997036939467, 'bear_rsi_os': 35, 'bear_rsi_ob': 51, 'bear_adx_thresh': 15.567490672302535, 'bear_atr_min_pct': 0.008698577802151152, 'bear_atr_max_pct': 0.025462978615399524, 'bear_tp_mult': 2.6206037054377784, 'bear_tsl_mult': 0.28297028531372115, 'bear_time_stop': 31, 'bear_use_sma': True, 'bear_use_ema': True, 'bear_use_atr': False, 'bear_use_adx': True, 'bear_use_spike': False, 'bear_rsi_required': True, 'sideways_strategy': 'mean_reversion', 'sideways_bb_std_mult': 3.5755107786382685, 'sideways_rsi_os': 40, 'sideways_rsi_ob': 89, 'sideways_adx_thresh': 24.828478316225166, 'sideways_atr_min_pct': 0.01830704718563446, 'sideways_atr_max_pct': 0.08933369597536929, 'sideways_tp_mult': 1.7037492956585896, 'sideways_tsl_mult': 0.44270591918047053, 'sideways_time_stop': 111, 'sideways_use_sma': True, 'sideways_use_ema': False, 'sideways_use_atr': True, 'sideways_use_adx': True, 'sideways_use_spike': True, 'sideways_rsi_required': False}.
[I 2025-09-01 11:14:59,112] Trial 214 finished with values: [-1000000000.0, 1000000000.0] and parameters: {'p_sma': 12, 'p_std': 12, 'p_atr': 13, 'p_adx': 30, 'rsi_period': 52, 'ema1': 21, 'ema2': 36, 'slip_atr_k': 0.009053989825639298, 'slip_spread_k': 0.006625450244869269, 'spread_hl_frac': 0.030159949588578785, 'bb_std_mult': 3.2630719446414918, 'rsi_os': 47, 'rsi_ob': 86, 'vol_spike': 0.10325053418440677, 'adx_thresh': 21.020640502157942, 'atr_min_pct': 0.029861188901065285, 'atr_max_pct': 0.036888722869764363, 'tp_mult': 2.6518356651813666, 'tsl_mult': 0.9756803683828295, 'strategy': 'mean_reversion', 'time_stop': 55, 'use_sma': True, 'use_atr': False, 'use_adx': False, 'use_ema': False, 'use_spike': True, 'rsi_required': False, 'edge_k': 0.2851250293471152, 'edge_cap': 0.22335648729878704, 'bull_strategy': 'breakout', 'bull_bb_std_mult': 2.9403532980048217, 'bull_rsi_os': 48, 'bull_rsi_ob': 89, 'bull_adx_thresh': 8.939020347577063, 'bull_atr_min_pct': 0.025059051529753004, 'bull_atr_max_pct': 0.09136106045278404, 'bull_tp_mult': 2.8523488977209293, 'bull_tsl_mult': 0.8134144099300914, 'bull_time_stop': 260, 'bull_use_sma': True, 'bull_use_ema': True, 'bull_use_atr': True, 'bull_use_adx': False, 'bull_use_spike': False, 'bull_rsi_required': True, 'bear_strategy': 'mean_reversion', 'bear_bb_std_mult': 0.7783574023420546, 'bear_rsi_os': 34, 'bear_rsi_ob': 48, 'bear_adx_thresh': 15.274622526202, 'bear_atr_min_pct': 0.009849485482003767, 'bear_atr_max_pct': 0.028550019840923858, 'bear_tp_mult': 2.9708551796459286, 'bear_tsl_mult': 0.2681131250336122, 'bear_time_stop': 94, 'bear_use_sma': False, 'bear_use_ema': True, 'bear_use_atr': False, 'bear_use_adx': True, 'bear_use_spike': False, 'bear_rsi_required': True, 'sideways_strategy': 'mean_reversion', 'sideways_bb_std_mult': 3.599264889249663, 'sideways_rsi_os': 5, 'sideways_rsi_ob': 88, 'sideways_adx_thresh': 24.749900875179126, 'sideways_atr_min_pct': 0.00100122797482613, 'sideways_atr_max_pct': 0.08644569301302531, 'sideways_tp_mult': 1.6233890808808074, 'sideways_tsl_mult': 0.49751828130004233, 'sideways_time_stop': 124, 'sideways_use_sma': True, 'sideways_use_ema': False, 'sideways_use_atr': True, 'sideways_use_adx': True, 'sideways_use_spike': True, 'sideways_rsi_required': False}.
[I 2025-09-01 11:14:59,878] Trial 211 finished with values: [-1000000000.0, 1000000000.0] and parameters: {'p_sma': 13, 'p_std': 10, 'p_atr': 22, 'p_adx': 30, 'rsi_period': 50, 'ema1': 21, 'ema2': 36, 'slip_atr_k': 0.0013263455697015512, 'slip_spread_k': 0.013633593797000756, 'spread_hl_frac': 0.03057709109119799, 'bb_std_mult': 3.3864283782838775, 'rsi_os': 26, 'rsi_ob': 86, 'vol_spike': 0.10440165973481971, 'adx_thresh': 22.117302668892997, 'atr_min_pct': 0.029956578735837597, 'atr_max_pct': 0.03745309076017339, 'tp_mult': 2.5868561444943943, 'tsl_mult': 0.9236402804144825, 'strategy': 'breakout', 'time_stop': 245, 'use_sma': False, 'use_atr': False, 'use_adx': False, 'use_ema': False, 'use_spike': True, 'rsi_required': False, 'edge_k': 0.3033795364604471, 'edge_cap': 0.22740848626449747, 'bull_strategy': 'mean_reversion', 'bull_bb_std_mult': 2.913204062014195, 'bull_rsi_os': 48, 'bull_rsi_ob': 94, 'bull_adx_thresh': 29.823191314555253, 'bull_atr_min_pct': 0.012559058522533164, 'bull_atr_max_pct': 0.09133647867559515, 'bull_tp_mult': 2.846954780738894, 'bull_tsl_mult': 0.7805343757629275, 'bull_time_stop': 266, 'bull_use_sma': True, 'bull_use_ema': True, 'bull_use_atr': True, 'bull_use_adx': False, 'bull_use_spike': False, 'bull_rsi_required': True, 'bear_strategy': 'mean_reversion', 'bear_bb_std_mult': 0.7414440854857602, 'bear_rsi_os': 35, 'bear_rsi_ob': 48, 'bear_adx_thresh': 14.668399917433756, 'bear_atr_min_pct': 0.008256758560726293, 'bear_atr_max_pct': 0.024331573732676123, 'bear_tp_mult': 2.6200086726994063, 'bear_tsl_mult': 0.3009066259846322, 'bear_time_stop': 27, 'bear_use_sma': True, 'bear_use_ema': True, 'bear_use_atr': False, 'bear_use_adx': True, 'bear_use_spike': False, 'bear_rsi_required': True, 'sideways_strategy': 'mean_reversion', 'sideways_bb_std_mult': 3.596484107777776, 'sideways_rsi_os': 19, 'sideways_rsi_ob': 90, 'sideways_adx_thresh': 24.84022354927464, 'sideways_atr_min_pct': 0.026263228926927944, 'sideways_atr_max_pct': 0.09076710133345244, 'sideways_tp_mult': 1.6548489415736123, 'sideways_tsl_mult': 0.43401929785197313, 'sideways_time_stop': 124, 'sideways_use_sma': True, 'sideways_use_ema': False, 'sideways_use_atr': True, 'sideways_use_adx': True, 'sideways_use_spike': True, 'sideways_rsi_required': False}.
[I 2025-09-01 11:15:00,571] Trial 213 finished with values: [-1000000000.0, 1000000000.0] and parameters: {'p_sma': 13, 'p_std': 27, 'p_atr': 8, 'p_adx': 30, 'rsi_period': 52, 'ema1': 21, 'ema2': 36, 'slip_atr_k': 0.008670839148098256, 'slip_spread_k': 0.002455352889229684, 'spread_hl_frac': 0.029941011073887833, 'bb_std_mult': 3.24955672298137, 'rsi_os': 46, 'rsi_ob': 85, 'vol_spike': 0.10470787551986485, 'adx_thresh': 20.959661985761002, 'atr_min_pct': 0.029685706121715897, 'atr_max_pct': 0.037486561976169876, 'tp_mult': 2.653520140389814, 'tsl_mult': 0.9698830389276335, 'strategy': 'mean_reversion', 'time_stop': 246, 'use_sma': True, 'use_atr': False, 'use_adx': False, 'use_ema': False, 'use_spike': True, 'rsi_required': False, 'edge_k': 0.29815389194505226, 'edge_cap': 0.28852434564967094, 'bull_strategy': 'breakout', 'bull_bb_std_mult': 2.96840432846493, 'bull_rsi_os': 48, 'bull_rsi_ob': 89, 'bull_adx_thresh': 29.909288885524713, 'bull_atr_min_pct': 0.018935311126536493, 'bull_atr_max_pct': 0.09176181671929001, 'bull_tp_mult': 2.839495699437025, 'bull_tsl_mult': 0.8175092241157379, 'bull_time_stop': 263, 'bull_use_sma': True, 'bull_use_ema': True, 'bull_use_atr': True, 'bull_use_adx': False, 'bull_use_spike': False, 'bull_rsi_required': True, 'bear_strategy': 'mean_reversion', 'bear_bb_std_mult': 0.7641809350421997, 'bear_rsi_os': 34, 'bear_rsi_ob': 48, 'bear_adx_thresh': 15.170322397163497, 'bear_atr_min_pct': 0.010124253228560046, 'bear_atr_max_pct': 0.028042427863837087, 'bear_tp_mult': 2.987697464442323, 'bear_tsl_mult': 0.3066801714774701, 'bear_time_stop': 100, 'bear_use_sma': False, 'bear_use_ema': True, 'bear_use_atr': False, 'bear_use_adx': True, 'bear_use_spike': False, 'bear_rsi_required': True, 'sideways_strategy': 'mean_reversion', 'sideways_bb_std_mult': 3.5893069995324156, 'sideways_rsi_os': 19, 'sideways_rsi_ob': 88, 'sideways_adx_thresh': 25.204659107179616, 'sideways_atr_min_pct': 0.008971761931572333, 'sideways_atr_max_pct': 0.09183627403975216, 'sideways_tp_mult': 1.6501547284155307, 'sideways_tsl_mult': 0.4964040910289748, 'sideways_time_stop': 125, 'sideways_use_sma': True, 'sideways_use_ema': False, 'sideways_use_atr': True, 'sideways_use_adx': True, 'sideways_use_spike': True, 'sideways_rsi_required': False}.
[I 2025-09-01 11:15:00,968] Trial 212 finished with values: [-0.1075243740928088, 0.10749409452338407] and parameters: {'p_sma': 13, 'p_std': 27, 'p_atr': 8, 'p_adx': 30, 'rsi_period': 50, 'ema1': 21, 'ema2': 37, 'slip_atr_k': 0.0019271564674467768, 'slip_spread_k': 0.00985463459889202, 'spread_hl_frac': 0.03033441770698544, 'bb_std_mult': 3.3715713211508125, 'rsi_os': 48, 'rsi_ob': 86, 'vol_spike': 0.10144115392592773, 'adx_thresh': 20.905664105761556, 'atr_min_pct': 0.029408642763964352, 'atr_max_pct': 0.037967437290497265, 'tp_mult': 2.6063473618660886, 'tsl_mult': 0.9210702756539496, 'strategy': 'breakout', 'time_stop': 51, 'use_sma': False, 'use_atr': False, 'use_adx': False, 'use_ema': False, 'use_spike': True, 'rsi_required': False, 'edge_k': 0.29995528637245805, 'edge_cap': 0.22943799065802922, 'bull_strategy': 'mean_reversion', 'bull_bb_std_mult': 2.995187088003374, 'bull_rsi_os': 48, 'bull_rsi_ob': 94, 'bull_adx_thresh': 17.955894790777933, 'bull_atr_min_pct': 0.01989058473708147, 'bull_atr_max_pct': 0.0922615083322973, 'bull_tp_mult': 2.8486858292644, 'bull_tsl_mult': 0.7835391274936054, 'bull_time_stop': 261, 'bull_use_sma': True, 'bull_use_ema': True, 'bull_use_atr': True, 'bull_use_adx': False, 'bull_use_spike': False, 'bull_rsi_required': True, 'bear_strategy': 'mean_reversion', 'bear_bb_std_mult': 0.7721236130108022, 'bear_rsi_os': 35, 'bear_rsi_ob': 48, 'bear_adx_thresh': 15.25862821723059, 'bear_atr_min_pct': 0.009204819485714538, 'bear_atr_max_pct': 0.026222015048396597, 'bear_tp_mult': 2.8263729747406416, 'bear_tsl_mult': 0.3027735882293577, 'bear_time_stop': 186, 'bear_use_sma': True, 'bear_use_ema': True, 'bear_use_atr': False, 'bear_use_adx': True, 'bear_use_spike': False, 'bear_rsi_required': True, 'sideways_strategy': 'mean_reversion', 'sideways_bb_std_mult': 3.550871043144152, 'sideways_rsi_os': 52, 'sideways_rsi_ob': 90, 'sideways_adx_thresh': 24.91074768889852, 'sideways_atr_min_pct': 0.0006160021651836559, 'sideways_atr_max_pct': 0.09078490917137222, 'sideways_tp_mult': 1.7106807679565208, 'sideways_tsl_mult': 0.4333202493344996, 'sideways_time_stop': 124, 'sideways_use_sma': True, 'sideways_use_ema': False, 'sideways_use_atr': True, 'sideways_use_adx': True, 'sideways_use_spike': True, 'sideways_rsi_required': False}.
[I 2025-09-01 11:15:44,108] Trial 215 finished with values: [-1000000000.0, 1000000000.0] and parameters: {'p_sma': 13, 'p_std': 9, 'p_atr': 24, 'p_adx': 30, 'rsi_period': 50, 'ema1': 20, 'ema2': 38, 'slip_atr_k': 0.008464538105538995, 'slip_spread_k': 0.09539482338404058, 'spread_hl_frac': 0.026324962680914013, 'bb_std_mult': 3.0845098055323077, 'rsi_os': 12, 'rsi_ob': 83, 'vol_spike': 0.12005817911130164, 'adx_thresh': 22.198093130662066, 'atr_min_pct': 0.029993825947914467, 'atr_max_pct': 0.03143940987463973, 'tp_mult': 2.5459894619920824, 'tsl_mult': 0.9249840374489944, 'strategy': 'mean_reversion', 'time_stop': 246, 'use_sma': True, 'use_atr': False, 'use_adx': False, 'use_ema': False, 'use_spike': True, 'rsi_required': False, 'edge_k': 0.38667303597015557, 'edge_cap': 0.3346283965214364, 'bull_strategy': 'breakout', 'bull_bb_std_mult': 3.00037441947432, 'bull_rsi_os': 45, 'bull_rsi_ob': 94, 'bull_adx_thresh': 30.016521910733704, 'bull_atr_min_pct': 0.024400808624077043, 'bull_atr_max_pct': 0.0890179901037036, 'bull_tp_mult': 2.37228138168601, 'bull_tsl_mult': 0.795273587715873, 'bull_time_stop': 247, 'bull_use_sma': True, 'bull_use_ema': True, 'bull_use_atr': True, 'bull_use_adx': True, 'bull_use_spike': False, 'bull_rsi_required': True, 'bear_strategy': 'mean_reversion', 'bear_bb_std_mult': 0.7613455108834363, 'bear_rsi_os': 36, 'bear_rsi_ob': 50, 'bear_adx_thresh': 15.170695231232715, 'bear_atr_min_pct': 0.008074346218653708, 'bear_atr_max_pct': 0.018251547988333304, 'bear_tp_mult': 2.8750014771294454, 'bear_tsl_mult': 0.3085735042614905, 'bear_time_stop': 94, 'bear_use_sma': False, 'bear_use_ema': True, 'bear_use_atr': False, 'bear_use_adx': True, 'bear_use_spike': False, 'bear_rsi_required': True, 'sideways_strategy': 'mean_reversion', 'sideways_bb_std_mult': 3.531776132489707, 'sideways_rsi_os': 45, 'sideways_rsi_ob': 90, 'sideways_adx_thresh': 25.42740122817086, 'sideways_atr_min_pct': 0.02631349108101899, 'sideways_atr_max_pct': 0.09235978792758959, 'sideways_tp_mult': 1.6348898296643086, 'sideways_tsl_mult': 0.5037868091613543, 'sideways_time_stop': 119, 'sideways_use_sma': True, 'sideways_use_ema': False, 'sideways_use_atr': True, 'sideways_use_adx': True, 'sideways_use_spike': True, 'sideways_rsi_required': True}.
