[I 2025-09-01 11:59:38,611] Trial 487 finished with values: [-0.006759803132361464, 0.008428830214954757] and parameters: {'p_sma': 27, 'p_std': 55, 'p_atr': 19, 'p_adx': 7, 'rsi_period': 13, 'ema1': 26, 'ema2': 12, 'slip_atr_k': 0.03972570839339619, 'slip_spread_k': 0.3823753894452679, 'spread_hl_frac': 0.00901142313627995, 'bb_std_mult': 0.724918417466762, 'rsi_os': 35, 'rsi_ob': 49, 'vol_spike': 0.2356915279568989, 'adx_thresh': 14.464421536357799, 'atr_min_pct': 0.02142134762491576, 'atr_max_pct': 0.08495156396828388, 'tp_mult': 2.0695580204790014, 'tsl_mult': 0.104450718683386, 'strategy': 'breakout', 'time_stop': 176, 'use_sma': False, 'use_atr': True, 'use_adx': True, 'use_ema': True, 'use_spike': False, 'rsi_required': False, 'edge_k': 0.1592505408911006, 'edge_cap': 0.10678759418999521, 'bull_strategy': 'mean_reversion', 'bull_bb_std_mult': 1.742447708036416, 'bull_rsi_os': 32, 'bull_rsi_ob': 49, 'bull_adx_thresh': 26.45807911385412, 'bull_atr_min_pct': 0.014355749445005964, 'bull_atr_max_pct': 0.1262540645331443, 'bull_tp_mult': 1.2594261520987422, 'bull_tsl_mult': 0.6013352544094863, 'bull_time_stop': 174, 'bull_use_sma': False, 'bull_use_ema': False, 'bull_use_atr': True, 'bull_use_adx': False, 'bull_use_spike': False, 'bull_rsi_required': False, 'bear_strategy': 'breakout', 'bear_bb_std_mult': 1.4246967980669614, 'bear_rsi_os': 29, 'bear_rsi_ob': 53, 'bear_adx_thresh': 29.830421089187404, 'bear_atr_min_pct': 0.003857806387892383, 'bear_atr_max_pct': 0.01821933658865969, 'bear_tp_mult': 1.5877158424364248, 'bear_tsl_mult': 0.672331485753919, 'bear_time_stop': 256, 'bear_use_sma': True, 'bear_use_ema': False, 'bear_use_atr': True, 'bear_use_adx': True, 'bear_use_spike': False, 'bear_rsi_required': True, 'sideways_strategy': 'breakout', 'sideways_bb_std_mult': 2.1379166835236556, 'sideways_rsi_os': 5, 'sideways_rsi_ob': 87, 'sideways_adx_thresh': 32.885427794818234, 'sideways_atr_min_pct': 0.006683416066046724, 'sideways_atr_max_pct': 0.12862178607231753, 'sideways_tp_mult': 2.8877494228181777, 'sideways_tsl_mult': 0.33357860245198484, 'sideways_time_stop': 106, 'sideways_use_sma': False, 'sideways_use_ema': False, 'sideways_use_atr': True, 'sideways_use_adx': True, 'sideways_use_spike': True, 'sideways_rsi_required': False}.
[I 2025-09-01 11:59:38,831] Trial 485 finished with values: [-1000000000.0, 1000000000.0] and parameters: {'p_sma': 23, 'p_std': 56, 'p_atr': 18, 'p_adx': 8, 'rsi_period': 46, 'ema1': 25, 'ema2': 50, 'slip_atr_k': 0.04049606025312004, 'slip_spread_k': 0.3827105925549099, 'spread_hl_frac': 0.008786880057084796, 'bb_std_mult': 0.8357496167487888, 'rsi_os': 35, 'rsi_ob': 49, 'vol_spike': 0.18535980870251675, 'adx_thresh': 22.652609052897944, 'atr_min_pct': 0.02354832655924274, 'atr_max_pct': 0.07838083025954037, 'tp_mult': 2.062782113196906, 'tsl_mult': 0.11100228064209838, 'strategy': 'breakout', 'time_stop': 168, 'use_sma': False, 'use_atr': True, 'use_adx': True, 'use_ema': True, 'use_spike': False, 'rsi_required': False, 'edge_k': 0.13504411005177938, 'edge_cap': 0.1105133069854296, 'bull_strategy': 'mean_reversion', 'bull_bb_std_mult': 1.74904601098638, 'bull_rsi_os': 36, 'bull_rsi_ob': 49, 'bull_adx_thresh': 22.811609981462148, 'bull_atr_min_pct': 0.016565511012695867, 'bull_atr_max_pct': 0.11102385505481231, 'bull_tp_mult': 1.2877180166192248, 'bull_tsl_mult': 0.6012834056680402, 'bull_time_stop': 173, 'bull_use_sma': False, 'bull_use_ema': False, 'bull_use_atr': True, 'bull_use_adx': False, 'bull_use_spike': False, 'bull_rsi_required': False, 'bear_strategy': 'breakout', 'bear_bb_std_mult': 1.3954202402550786, 'bear_rsi_os': 29, 'bear_rsi_ob': 53, 'bear_adx_thresh': 19.660543605298074, 'bear_atr_min_pct': 0.023564043593071158, 'bear_atr_max_pct': 0.028450981339460453, 'bear_tp_mult': 1.6031640723691878, 'bear_tsl_mult': 0.6728744080695197, 'bear_time_stop': 253, 'bear_use_sma': True, 'bear_use_ema': False, 'bear_use_atr': True, 'bear_use_adx': True, 'bear_use_spike': False, 'bear_rsi_required': True, 'sideways_strategy': 'breakout', 'sideways_bb_std_mult': 2.4366234556466724, 'sideways_rsi_os': 15, 'sideways_rsi_ob': 89, 'sideways_adx_thresh': 32.91753361593817, 'sideways_atr_min_pct': 0.008598320564896114, 'sideways_atr_max_pct': 0.13027924333196397, 'sideways_tp_mult': 2.8515175010676743, 'sideways_tsl_mult': 0.3349052720709961, 'sideways_time_stop': 105, 'sideways_use_sma': False, 'sideways_use_ema': False, 'sideways_use_atr': True, 'sideways_use_adx': True, 'sideways_use_spike': True, 'sideways_rsi_required': False}.
[I 2025-09-01 12:00:20,538] Trial 491 finished with values: [-1000000000.0, 1000000000.0] and parameters: {'p_sma': 28, 'p_std': 20, 'p_atr': 19, 'p_adx': 18, 'rsi_period': 45, 'ema1': 27, 'ema2': 15, 'slip_atr_k': 0.03425940926497876, 'slip_spread_k': 0.3584088683039856, 'spread_hl_frac': 0.0033406009103338456, 'bb_std_mult': 0.9491898130804324, 'rsi_os': 32, 'rsi_ob': 48, 'vol_spike': 0.18059780105002865, 'adx_thresh': 13.337493973467684, 'atr_min_pct': 0.024042621822456037, 'atr_max_pct': 0.0857088699905446, 'tp_mult': 1.5514186135915546, 'tsl_mult': 0.1869470757572774, 'strategy': 'breakout', 'time_stop': 172, 'use_sma': False, 'use_atr': True, 'use_adx': True, 'use_ema': False, 'use_spike': False, 'rsi_required': False, 'edge_k': 0.09562674769270778, 'edge_cap': 0.09615725640060664, 'bull_strategy': 'mean_reversion', 'bull_bb_std_mult': 1.8400320973055937, 'bull_rsi_os': 53, 'bull_rsi_ob': 50, 'bull_adx_thresh': 6.566780982750383, 'bull_atr_min_pct': 0.015590286432169477, 'bull_atr_max_pct': 0.11626997827264925, 'bull_tp_mult': 1.3355984598942314, 'bull_tsl_mult': 0.5571996247048131, 'bull_time_stop': 160, 'bull_use_sma': False, 'bull_use_ema': False, 'bull_use_atr': True, 'bull_use_adx': False, 'bull_use_spike': False, 'bull_rsi_required': False, 'bear_strategy': 'breakout', 'bear_bb_std_mult': 1.310022283289038, 'bear_rsi_os': 25, 'bear_rsi_ob': 51, 'bear_adx_thresh': 8.942037492013315, 'bear_atr_min_pct': 0.027047524100899632, 'bear_atr_max_pct': 0.0775948127801887, 'bear_tp_mult': 1.502411069437545, 'bear_tsl_mult': 0.7200665489184165, 'bear_time_stop': 264, 'bear_use_sma': True, 'bear_use_ema': False, 'bear_use_atr': True, 'bear_use_adx': True, 'bear_use_spike': False, 'bear_rsi_required': True, 'sideways_strategy': 'breakout', 'sideways_bb_std_mult': 2.3035550691020483, 'sideways_rsi_os': 41, 'sideways_rsi_ob': 89, 'sideways_adx_thresh': 33.55099861882332, 'sideways_atr_min_pct': 0.0007857013703612102, 'sideways_atr_max_pct': 0.1240312901936826, 'sideways_tp_mult': 2.5302903551712883, 'sideways_tsl_mult': 0.404075422475043, 'sideways_time_stop': 96, 'sideways_use_sma': False, 'sideways_use_ema': False, 'sideways_use_atr': True, 'sideways_use_adx': True, 'sideways_use_spike': True, 'sideways_rsi_required': False}.
[I 2025-09-01 12:00:20,559] Trial 488 finished with values: [-1000000000.0, 1000000000.0] and parameters: {'p_sma': 23, 'p_std': 32, 'p_atr': 11, 'p_adx': 15, 'rsi_period': 45, 'ema1': 26, 'ema2': 15, 'slip_atr_k': 0.03497685670645023, 'slip_spread_k': 0.2936937419631446, 'spread_hl_frac': 0.008281809223361546, 'bb_std_mult': 0.9363614214996555, 'rsi_os': 35, 'rsi_ob': 48, 'vol_spike': 0.16149643552457424, 'adx_thresh': 13.537564088793037, 'atr_min_pct': 0.024096601164535592, 'atr_max_pct': 0.07862896321069336, 'tp_mult': 2.004531653279459, 'tsl_mult': 0.18488294140171335, 'strategy': 'breakout', 'time_stop': 172, 'use_sma': False, 'use_atr': True, 'use_adx': True, 'use_ema': False, 'use_spike': False, 'rsi_required': False, 'edge_k': 0.08516726977689187, 'edge_cap': 0.09989898732022234, 'bull_strategy': 'mean_reversion', 'bull_bb_std_mult': 1.8454775561067376, 'bull_rsi_os': 53, 'bull_rsi_ob': 48, 'bull_adx_thresh': 6.47770637662576, 'bull_atr_min_pct': 0.015449388505404364, 'bull_atr_max_pct': 0.11666597665722549, 'bull_tp_mult': 1.2347015431491937, 'bull_tsl_mult': 0.0824920862484455, 'bull_time_stop': 159, 'bull_use_sma': False, 'bull_use_ema': False, 'bull_use_atr': True, 'bull_use_adx': False, 'bull_use_spike': False, 'bull_rsi_required': False, 'bear_strategy': 'breakout', 'bear_bb_std_mult': 3.457244657094993, 'bear_rsi_os': 25, 'bear_rsi_ob': 51, 'bear_adx_thresh': 9.341929967799114, 'bear_atr_min_pct': 0.02328649094518077, 'bear_atr_max_pct': 0.04698705697483716, 'bear_tp_mult': 1.6026828686690748, 'bear_tsl_mult': 0.6682578461110207, 'bear_time_stop': 266, 'bear_use_sma': True, 'bear_use_ema': False, 'bear_use_atr': True, 'bear_use_adx': True, 'bear_use_spike': False, 'bear_rsi_required': True, 'sideways_strategy': 'breakout', 'sideways_bb_std_mult': 2.2039258654081673, 'sideways_rsi_os': 14, 'sideways_rsi_ob': 89, 'sideways_adx_thresh': 33.27220863726576, 'sideways_atr_min_pct': 0.0006143619581118441, 'sideways_atr_max_pct': 0.12383906279835477, 'sideways_tp_mult': 2.5186854121449844, 'sideways_tsl_mult': 0.4063901661896172, 'sideways_time_stop': 96, 'sideways_use_sma': False, 'sideways_use_ema': False, 'sideways_use_atr': True, 'sideways_use_adx': True, 'sideways_use_spike': True, 'sideways_rsi_required': False}.
[I 2025-09-01 12:00:22,173] Trial 490 finished with values: [-1000000000.0, 1000000000.0] and parameters: {'p_sma': 23, 'p_std': 32, 'p_atr': 18, 'p_adx': 7, 'rsi_period': 45, 'ema1': 25, 'ema2': 52, 'slip_atr_k': 0.12684631082794642, 'slip_spread_k': 0.3567239921372332, 'spread_hl_frac': 0.011325880369322553, 'bb_std_mult': 2.2087611395943565, 'rsi_os': 32, 'rsi_ob': 48, 'vol_spike': 0.1803890003514666, 'adx_thresh': 13.519691620617273, 'atr_min_pct': 0.024108093456152536, 'atr_max_pct': 0.07814815392653571, 'tp_mult': 1.9965962085133562, 'tsl_mult': 0.19088741651287788, 'strategy': 'breakout', 'time_stop': 171, 'use_sma': False, 'use_atr': True, 'use_adx': True, 'use_ema': False, 'use_spike': False, 'rsi_required': False, 'edge_k': 0.10479523551094876, 'edge_cap': 0.10822125353760229, 'bull_strategy': 'mean_reversion', 'bull_bb_std_mult': 1.852081996788814, 'bull_rsi_os': 51, 'bull_rsi_ob': 48, 'bull_adx_thresh': 6.482229453095399, 'bull_atr_min_pct': 0.015657068751446162, 'bull_atr_max_pct': 0.11659571449654738, 'bull_tp_mult': 1.3372133810672442, 'bull_tsl_mult': 0.5526553186407547, 'bull_time_stop': 158, 'bull_use_sma': False, 'bull_use_ema': False, 'bull_use_atr': True, 'bull_use_adx': False, 'bull_use_spike': False, 'bull_rsi_required': False, 'bear_strategy': 'breakout', 'bear_bb_std_mult': 3.4818518457352186, 'bear_rsi_os': 27, 'bear_rsi_ob': 51, 'bear_adx_thresh': 19.393870125580666, 'bear_atr_min_pct': 0.025526605959355186, 'bear_atr_max_pct': 0.050806443654407674, 'bear_tp_mult': 1.4974585396243478, 'bear_tsl_mult': 0.7232845880735549, 'bear_time_stop': 263, 'bear_use_sma': True, 'bear_use_ema': False, 'bear_use_atr': True, 'bear_use_adx': True, 'bear_use_spike': False, 'bear_rsi_required': True, 'sideways_strategy': 'breakout', 'sideways_bb_std_mult': 2.3226670659409097, 'sideways_rsi_os': 41, 'sideways_rsi_ob': 89, 'sideways_adx_thresh': 33.31137822551576, 'sideways_atr_min_pct': 0.010975408722915195, 'sideways_atr_max_pct': 0.12343904224991448, 'sideways_tp_mult': 2.562209729276508, 'sideways_tsl_mult': 0.2814382391216209, 'sideways_time_stop': 96, 'sideways_use_sma': False, 'sideways_use_ema': False, 'sideways_use_atr': True, 'sideways_use_adx': True, 'sideways_use_spike': True, 'sideways_rsi_required': False}.
[I 2025-09-01 12:00:22,174] Trial 489 finished with values: [-0.0253055821242526, 0.02672284194742517] and parameters: {'p_sma': 28, 'p_std': 15, 'p_atr': 11, 'p_adx': 7, 'rsi_period': 45, 'ema1': 26, 'ema2': 45, 'slip_atr_k': 0.03456005061978179, 'slip_spread_k': 0.2857063511739975, 'spread_hl_frac': 0.005060479979099565, 'bb_std_mult': 0.9413526408185238, 'rsi_os': 35, 'rsi_ob': 48, 'vol_spike': 0.18003451103247056, 'adx_thresh': 23.602214018666817, 'atr_min_pct': 0.024127409951536533, 'atr_max_pct': 0.07798038867057468, 'tp_mult': 2.0136738426339487, 'tsl_mult': 0.10809251986683148, 'strategy': 'breakout', 'time_stop': 170, 'use_sma': False, 'use_atr': True, 'use_adx': True, 'use_ema': False, 'use_spike': False, 'rsi_required': False, 'edge_k': 0.07520967065187485, 'edge_cap': 0.10066840905939345, 'bull_strategy': 'mean_reversion', 'bull_bb_std_mult': 1.8642174133758376, 'bull_rsi_os': 53, 'bull_rsi_ob': 48, 'bull_adx_thresh': 17.897762645129852, 'bull_atr_min_pct': 0.015444095869625493, 'bull_atr_max_pct': 0.11587830119329949, 'bull_tp_mult': 1.2930435083828316, 'bull_tsl_mult': 0.6023383076386142, 'bull_time_stop': 173, 'bull_use_sma': False, 'bull_use_ema': False, 'bull_use_atr': True, 'bull_use_adx': False, 'bull_use_spike': False, 'bull_rsi_required': False, 'bear_strategy': 'breakout', 'bear_bb_std_mult': 2.976072557850698, 'bear_rsi_os': 27, 'bear_rsi_ob': 51, 'bear_adx_thresh': 31.046123327581196, 'bear_atr_min_pct': 0.002568451994827581, 'bear_atr_max_pct': 0.05042123138671745, 'bear_tp_mult': 1.602947921646945, 'bear_tsl_mult': 0.7196216965530247, 'bear_time_stop': 263, 'bear_use_sma': True, 'bear_use_ema': False, 'bear_use_atr': True, 'bear_use_adx': True, 'bear_use_spike': False, 'bear_rsi_required': True, 'sideways_strategy': 'breakout', 'sideways_bb_std_mult': 2.317071694227854, 'sideways_rsi_os': 29, 'sideways_rsi_ob': 89, 'sideways_adx_thresh': 33.1341977012158, 'sideways_atr_min_pct': 0.0013906538411911267, 'sideways_atr_max_pct': 0.1244198076187501, 'sideways_tp_mult': 2.5866902374224847, 'sideways_tsl_mult': 0.8752309841217154, 'sideways_time_stop': 94, 'sideways_use_sma': False, 'sideways_use_ema': False, 'sideways_use_atr': True, 'sideways_use_adx': True, 'sideways_use_spike': True, 'sideways_rsi_required': False}.
[I 2025-09-01 12:01:02,278] Trial 494 finished with values: [-1000000000.0, 1000000000.0] and parameters: {'p_sma': 30, 'p_std': 34, 'p_atr': 19, 'p_adx': 8, 'rsi_period': 47, 'ema1': 27, 'ema2': 15, 'slip_atr_k': 0.02375857524792608, 'slip_spread_k': 0.9139063803299485, 'spread_hl_frac': 0.003167952976836212, 'bb_std_mult': 0.8206598531305561, 'rsi_os': 33, 'rsi_ob': 50, 'vol_spike': 0.19242362547138409, 'adx_thresh': 23.78301044979614, 'atr_min_pct': 0.022924391956292253, 'atr_max_pct': 0.07574413854744243, 'tp_mult': 1.1984156934712626, 'tsl_mult': 0.09083756017451808, 'strategy': 'breakout', 'time_stop': 157, 'use_sma': False, 'use_atr': True, 'use_adx': True, 'use_ema': True, 'use_spike': False, 'rsi_required': False, 'edge_k': 0.18347877623668227, 'edge_cap': 0.12470569257703293, 'bull_strategy': 'mean_reversion', 'bull_bb_std_mult': 1.7021133758519649, 'bull_rsi_os': 30, 'bull_rsi_ob': 47, 'bull_adx_thresh': 11.691524423642432, 'bull_atr_min_pct': 0.01688523776787766, 'bull_atr_max_pct': 0.11121073747458038, 'bull_tp_mult': 1.0967871830066498, 'bull_tsl_mult': 0.5834934093431468, 'bull_time_stop': 166, 'bull_use_sma': False, 'bull_use_ema': False, 'bull_use_atr': False, 'bull_use_adx': False, 'bull_use_spike': False, 'bull_rsi_required': True, 'bear_strategy': 'mean_reversion', 'bear_bb_std_mult': 1.3267753997815814, 'bear_rsi_os': 27, 'bear_rsi_ob': 53, 'bear_adx_thresh': 9.013926980520917, 'bear_atr_min_pct': 0.004745136739660653, 'bear_atr_max_pct': 0.07017589728075738, 'bear_tp_mult': 1.5367476933329782, 'bear_tsl_mult': 0.6975621541022899, 'bear_time_stop': 271, 'bear_use_sma': True, 'bear_use_ema': False, 'bear_use_atr': True, 'bear_use_adx': True, 'bear_use_spike': False, 'bear_rsi_required': True, 'sideways_strategy': 'breakout', 'sideways_bb_std_mult': 2.1910704693728253, 'sideways_rsi_os': 26, 'sideways_rsi_ob': 82, 'sideways_adx_thresh': 34.33666381210801, 'sideways_atr_min_pct': 0.00950635457620487, 'sideways_atr_max_pct': 0.12784576249569005, 'sideways_tp_mult': 2.4297478853542698, 'sideways_tsl_mult': 0.3848146481973597, 'sideways_time_stop': 91, 'sideways_use_sma': False, 'sideways_use_ema': False, 'sideways_use_atr': True, 'sideways_use_adx': True, 'sideways_use_spike': True, 'sideways_rsi_required': False}.
[I 2025-09-01 12:01:02,854] Trial 495 finished with values: [-1000000000.0, 1000000000.0] and parameters: {'p_sma': 27, 'p_std': 49, 'p_atr': 19, 'p_adx': 8, 'rsi_period': 64, 'ema1': 27, 'ema2': 26, 'slip_atr_k': 0.022443031348352384, 'slip_spread_k': 0.5850639027669496, 'spread_hl_frac': 0.0137213735490025, 'bb_std_mult': 0.8337569913848626, 'rsi_os': 33, 'rsi_ob': 50, 'vol_spike': 0.22241791237701042, 'adx_thresh': 18.32914932431034, 'atr_min_pct': 0.022935134139754194, 'atr_max_pct': 0.08312057404166409, 'tp_mult': 1.9533979146315164, 'tsl_mult': 0.14753949455957333, 'strategy': 'breakout', 'time_stop': 181, 'use_sma': False, 'use_atr': True, 'use_adx': True, 'use_ema': True, 'use_spike': False, 'rsi_required': False, 'edge_k': 0.1718695339564415, 'edge_cap': 0.12615119379023054, 'bull_strategy': 'mean_reversion', 'bull_bb_std_mult': 1.737524985124919, 'bull_rsi_os': 51, 'bull_rsi_ob': 47, 'bull_adx_thresh': 7.426705769955788, 'bull_atr_min_pct': 0.016869703331171975, 'bull_atr_max_pct': 0.11013809521681807, 'bull_tp_mult': 1.1536901263682076, 'bull_tsl_mult': 0.5879888759812336, 'bull_time_stop': 165, 'bull_use_sma': False, 'bull_use_ema': False, 'bull_use_atr': False, 'bull_use_adx': False, 'bull_use_spike': False, 'bull_rsi_required': True, 'bear_strategy': 'mean_reversion', 'bear_bb_std_mult': 1.3326141848530257, 'bear_rsi_os': 27, 'bear_rsi_ob': 53, 'bear_adx_thresh': 9.130497866203132, 'bear_atr_min_pct': 0.006730121324502431, 'bear_atr_max_pct': 0.12240410234890628, 'bear_tp_mult': 1.5472283282628931, 'bear_tsl_mult': 0.7680619135759127, 'bear_time_stop': 271, 'bear_use_sma': True, 'bear_use_ema': False, 'bear_use_atr': True, 'bear_use_adx': True, 'bear_use_spike': False, 'bear_rsi_required': True, 'sideways_strategy': 'breakout', 'sideways_bb_std_mult': 2.143989958699332, 'sideways_rsi_os': 40, 'sideways_rsi_ob': 82, 'sideways_adx_thresh': 34.25873762164103, 'sideways_atr_min_pct': 0.009574518576085517, 'sideways_atr_max_pct': 0.1281649273309113, 'sideways_tp_mult': 2.9350798516172962, 'sideways_tsl_mult': 0.3153521486982689, 'sideways_time_stop': 88, 'sideways_use_sma': False, 'sideways_use_ema': False, 'sideways_use_atr': True, 'sideways_use_adx': True, 'sideways_use_spike': True, 'sideways_rsi_required': False}.
[I 2025-09-01 12:01:03,335] Trial 492 finished with values: [-1000000000.0, 1000000000.0] and parameters: {'p_sma': 25, 'p_std': 13, 'p_atr': 18, 'p_adx': 7, 'rsi_period': 47, 'ema1': 25, 'ema2': 14, 'slip_atr_k': 0.02386214795707025, 'slip_spread_k': 0.35162344128964607, 'spread_hl_frac': 0.0030744196045326376, 'bb_std_mult': 0.8007826703969197, 'rsi_os': 33, 'rsi_ob': 47, 'vol_spike': 0.22295137048595254, 'adx_thresh': 16.58901999074659, 'atr_min_pct': 0.023236204487147968, 'atr_max_pct': 0.07888775644173769, 'tp_mult': 2.1237678950446606, 'tsl_mult': 0.0926311939834161, 'strategy': 'breakout', 'time_stop': 160, 'use_sma': False, 'use_atr': True, 'use_adx': True, 'use_ema': True, 'use_spike': False, 'rsi_required': False, 'edge_k': 0.17787572366540608, 'edge_cap': 0.11897455167129611, 'bull_strategy': 'mean_reversion', 'bull_bb_std_mult': 1.8840850674795502, 'bull_rsi_os': 51, 'bull_rsi_ob': 54, 'bull_adx_thresh': 7.388799205994197, 'bull_atr_min_pct': 0.01678938341542588, 'bull_atr_max_pct': 0.11165391712774418, 'bull_tp_mult': 1.3802616502945628, 'bull_tsl_mult': 0.5812571470543292, 'bull_time_stop': 143, 'bull_use_sma': False, 'bull_use_ema': False, 'bull_use_atr': False, 'bull_use_adx': False, 'bull_use_spike': False, 'bull_rsi_required': True, 'bear_strategy': 'breakout', 'bear_bb_std_mult': 1.3083588981839758, 'bear_rsi_os': 27, 'bear_rsi_ob': 52, 'bear_adx_thresh': 5.061768252573595, 'bear_atr_min_pct': 0.004770767760027475, 'bear_atr_max_pct': 0.02408989188670916, 'bear_tp_mult': 1.4797844007460474, 'bear_tsl_mult': 0.7094162393661609, 'bear_time_stop': 288, 'bear_use_sma': True, 'bear_use_ema': False, 'bear_use_atr': True, 'bear_use_adx': True, 'bear_use_spike': False, 'bear_rsi_required': True, 'sideways_strategy': 'breakout', 'sideways_bb_std_mult': 2.3108093506442104, 'sideways_rsi_os': 39, 'sideways_rsi_ob': 82, 'sideways_adx_thresh': 32.32949449750666, 'sideways_atr_min_pct': 0.010600924833124513, 'sideways_atr_max_pct': 0.12770334050152582, 'sideways_tp_mult': 2.5865074935856467, 'sideways_tsl_mult': 0.38639655689803715, 'sideways_time_stop': 92, 'sideways_use_sma': False, 'sideways_use_ema': False, 'sideways_use_atr': True, 'sideways_use_adx': True, 'sideways_use_spike': True, 'sideways_rsi_required': False}.
