[I 2025-09-01 11:46:52,144] Trial 415 finished with values: [0.0027526324650541945, 0.003834937487090992] and parameters: {'p_sma': 25, 'p_std': 33, 'p_atr': 20, 'p_adx': 7, 'rsi_period': 47, 'ema1': 25, 'ema2': 18, 'slip_atr_k': 0.022782184724826304, 'slip_spread_k': 0.4255292092680344, 'spread_hl_frac': 0.0023507974077179197, 'bb_std_mult': 1.016315130759389, 'rsi_os': 29, 'rsi_ob': 49, 'vol_spike': 0.22047821254132255, 'adx_thresh': 23.61583228679817, 'atr_min_pct': 0.023590838186477413, 'atr_max_pct': 0.07692613679715153, 'tp_mult': 2.0927419066446866, 'tsl_mult': 0.07469966304439335, 'strategy': 'breakout', 'time_stop': 171, 'use_sma': False, 'use_atr': True, 'use_adx': True, 'use_ema': True, 'use_spike': False, 'rsi_required': False, 'edge_k': 0.2750334825258547, 'edge_cap': 0.06082511299085708, 'bull_strategy': 'mean_reversion', 'bull_bb_std_mult': 1.7029644280174454, 'bull_rsi_os': 48, 'bull_rsi_ob': 51, 'bull_adx_thresh': 5.711295643704632, 'bull_atr_min_pct': 0.017410701850321984, 'bull_atr_max_pct': 0.1098291181470434, 'bull_tp_mult': 1.2046243501611793, 'bull_tsl_mult': 0.6368555870677317, 'bull_time_stop': 174, 'bull_use_sma': False, 'bull_use_ema': False, 'bull_use_atr': True, 'bull_use_adx': False, 'bull_use_spike': False, 'bull_rsi_required': False, 'bear_strategy': 'breakout', 'bear_bb_std_mult': 1.305169323972732, 'bear_rsi_os': 30, 'bear_rsi_ob': 50, 'bear_adx_thresh': 8.575344627110558, 'bear_atr_min_pct': 0.00426973161302036, 'bear_atr_max_pct': 0.020073425893242534, 'bear_tp_mult': 1.4852778331158292, 'bear_tsl_mult': 0.6201076295839527, 'bear_time_stop': 223, 'bear_use_sma': True, 'bear_use_ema': False, 'bear_use_atr': True, 'bear_use_adx': True, 'bear_use_spike': False, 'bear_rsi_required': True, 'sideways_strategy': 'breakout', 'sideways_bb_std_mult': 2.004905100949234, 'sideways_rsi_os': 42, 'sideways_rsi_ob': 91, 'sideways_adx_thresh': 31.922140131315924, 'sideways_atr_min_pct': 0.024047314749555484, 'sideways_atr_max_pct': 0.13045803383546542, 'sideways_tp_mult': 2.8354907913373513, 'sideways_tsl_mult': 0.36921069792627925, 'sideways_time_stop': 90, 'sideways_use_sma': False, 'sideways_use_ema': False, 'sideways_use_atr': True, 'sideways_use_adx': True, 'sideways_use_spike': True, 'sideways_rsi_required': False}.
[I 2025-09-01 11:46:52,548] Trial 412 finished with values: [-1000000000.0, 1000000000.0] and parameters: {'p_sma': 26, 'p_std': 33, 'p_atr': 29, 'p_adx': 16, 'rsi_period': 48, 'ema1': 24, 'ema2': 18, 'slip_atr_k': 0.03233170657246209, 'slip_spread_k': 0.4424104549215972, 'spread_hl_frac': 0.0001292943692288277, 'bb_std_mult': 0.8511660287516939, 'rsi_os': 30, 'rsi_ob': 49, 'vol_spike': 0.21781580227028724, 'adx_thresh': 23.785397160965907, 'atr_min_pct': 0.02364404333889024, 'atr_max_pct': 0.07915055192505202, 'tp_mult': 2.070714016775262, 'tsl_mult': 0.0973698557752513, 'strategy': 'breakout', 'time_stop': 194, 'use_sma': False, 'use_atr': True, 'use_adx': True, 'use_ema': True, 'use_spike': False, 'rsi_required': False, 'edge_k': 0.2532519647736793, 'edge_cap': 0.14101076040747318, 'bull_strategy': 'mean_reversion', 'bull_bb_std_mult': 1.5681290777879098, 'bull_rsi_os': 48, 'bull_rsi_ob': 50, 'bull_adx_thresh': 5.18002681845734, 'bull_atr_min_pct': 0.018300750479598636, 'bull_atr_max_pct': 0.106440369786764, 'bull_tp_mult': 1.208773518511672, 'bull_tsl_mult': 0.638219620571733, 'bull_time_stop': 274, 'bull_use_sma': False, 'bull_use_ema': False, 'bull_use_atr': True, 'bull_use_adx': False, 'bull_use_spike': False, 'bull_rsi_required': False, 'bear_strategy': 'breakout', 'bear_bb_std_mult': 1.284844943829259, 'bear_rsi_os': 30, 'bear_rsi_ob': 51, 'bear_adx_thresh': 7.788167335366301, 'bear_atr_min_pct': 0.029277791076654763, 'bear_atr_max_pct': 0.023827884816244645, 'bear_tp_mult': 1.4824867058178046, 'bear_tsl_mult': 0.9994937545087631, 'bear_time_stop': 60, 'bear_use_sma': True, 'bear_use_ema': False, 'bear_use_atr': True, 'bear_use_adx': True, 'bear_use_spike': False, 'bear_rsi_required': True, 'sideways_strategy': 'breakout', 'sideways_bb_std_mult': 1.980489269609945, 'sideways_rsi_os': 43, 'sideways_rsi_ob': 90, 'sideways_adx_thresh': 33.71065477193313, 'sideways_atr_min_pct': 0.024931646653891668, 'sideways_atr_max_pct': 0.13024248539352407, 'sideways_tp_mult': 2.737331892517565, 'sideways_tsl_mult': 0.3690999306850768, 'sideways_time_stop': 74, 'sideways_use_sma': False, 'sideways_use_ema': True, 'sideways_use_atr': True, 'sideways_use_adx': True, 'sideways_use_spike': True, 'sideways_rsi_required': False}.
[I 2025-09-01 11:47:33,095] Trial 418 finished with values: [-1000000000.0, 1000000000.0] and parameters: {'p_sma': 25, 'p_std': 34, 'p_atr': 22, 'p_adx': 7, 'rsi_period': 46, 'ema1': 25, 'ema2': 20, 'slip_atr_k': 0.02894325902128633, 'slip_spread_k': 0.47092510079014394, 'spread_hl_frac': 0.00286609273761185, 'bb_std_mult': 1.031403765856106, 'rsi_os': 31, 'rsi_ob': 49, 'vol_spike': 0.2253202745166621, 'adx_thresh': 25.339033804825394, 'atr_min_pct': 0.022760708794152075, 'atr_max_pct': 0.07311330639453933, 'tp_mult': 2.090242238603408, 'tsl_mult': 0.05246011874802302, 'strategy': 'breakout', 'time_stop': 169, 'use_sma': False, 'use_atr': True, 'use_adx': True, 'use_ema': True, 'use_spike': False, 'rsi_required': False, 'edge_k': 0.2720854698561169, 'edge_cap': 0.0732249108307543, 'bull_strategy': 'mean_reversion', 'bull_bb_std_mult': 1.796064193553107, 'bull_rsi_os': 47, 'bull_rsi_ob': 55, 'bull_adx_thresh': 5.798509967049545, 'bull_atr_min_pct': 0.018480348559957737, 'bull_atr_max_pct': 0.11013005223297362, 'bull_tp_mult': 1.1840688888524071, 'bull_tsl_mult': 0.6264709277463137, 'bull_time_stop': 147, 'bull_use_sma': False, 'bull_use_ema': False, 'bull_use_atr': True, 'bull_use_adx': False, 'bull_use_spike': False, 'bull_rsi_required': False, 'bear_strategy': 'breakout', 'bear_bb_std_mult': 1.339166868275173, 'bear_rsi_os': 30, 'bear_rsi_ob': 52, 'bear_adx_thresh': 7.085389427999335, 'bear_atr_min_pct': 0.006104950236534406, 'bear_atr_max_pct': 0.016709853805317126, 'bear_tp_mult': 1.4731572667140513, 'bear_tsl_mult': 0.6269279852494438, 'bear_time_stop': 227, 'bear_use_sma': True, 'bear_use_ema': False, 'bear_use_atr': True, 'bear_use_adx': True, 'bear_use_spike': False, 'bear_rsi_required': True, 'sideways_strategy': 'breakout', 'sideways_bb_std_mult': 2.048297668999298, 'sideways_rsi_os': 44, 'sideways_rsi_ob': 91, 'sideways_adx_thresh': 32.05392796327511, 'sideways_atr_min_pct': 0.02482497311033624, 'sideways_atr_max_pct': 0.12958634732734542, 'sideways_tp_mult': 2.7862299619770345, 'sideways_tsl_mult': 0.3665863228238041, 'sideways_time_stop': 94, 'sideways_use_sma': False, 'sideways_use_ema': False, 'sideways_use_atr': True, 'sideways_use_adx': True, 'sideways_use_spike': True, 'sideways_rsi_required': False}.
[I 2025-09-01 11:47:33,651] Trial 419 finished with values: [-1000000000.0, 1000000000.0] and parameters: {'p_sma': 25, 'p_std': 31, 'p_atr': 22, 'p_adx': 7, 'rsi_period': 46, 'ema1': 25, 'ema2': 20, 'slip_atr_k': 0.029501948076144608, 'slip_spread_k': 0.465746272470584, 'spread_hl_frac': 0.002868426346440426, 'bb_std_mult': 1.048918391634234, 'rsi_os': 31, 'rsi_ob': 49, 'vol_spike': 0.2216758054544081, 'adx_thresh': 25.051469319427405, 'atr_min_pct': 0.022512712100978723, 'atr_max_pct': 0.07289390573663786, 'tp_mult': 2.11433221830787, 'tsl_mult': 0.05219953595592956, 'strategy': 'breakout', 'time_stop': 171, 'use_sma': False, 'use_atr': True, 'use_adx': True, 'use_ema': True, 'use_spike': False, 'rsi_required': False, 'edge_k': 0.2032263696457377, 'edge_cap': 0.07622131039228094, 'bull_strategy': 'mean_reversion', 'bull_bb_std_mult': 1.7522476574659511, 'bull_rsi_os': 46, 'bull_rsi_ob': 55, 'bull_adx_thresh': 5.701576155769359, 'bull_atr_min_pct': 0.017679938808689257, 'bull_atr_max_pct': 0.11620960747433566, 'bull_tp_mult': 1.150089016968456, 'bull_tsl_mult': 0.6207696956466123, 'bull_time_stop': 183, 'bull_use_sma': False, 'bull_use_ema': False, 'bull_use_atr': True, 'bull_use_adx': False, 'bull_use_spike': False, 'bull_rsi_required': False, 'bear_strategy': 'breakout', 'bear_bb_std_mult': 1.3392128640914482, 'bear_rsi_os': 29, 'bear_rsi_ob': 52, 'bear_adx_thresh': 6.877447631979491, 'bear_atr_min_pct': 0.004555237489681925, 'bear_atr_max_pct': 0.016130552992924298, 'bear_tp_mult': 1.4711840923033885, 'bear_tsl_mult': 0.6179379043479073, 'bear_time_stop': 235, 'bear_use_sma': True, 'bear_use_ema': False, 'bear_use_atr': True, 'bear_use_adx': True, 'bear_use_spike': False, 'bear_rsi_required': True, 'sideways_strategy': 'breakout', 'sideways_bb_std_mult': 2.0397060987329754, 'sideways_rsi_os': 44, 'sideways_rsi_ob': 91, 'sideways_adx_thresh': 31.90459227048523, 'sideways_atr_min_pct': 0.02461756521292632, 'sideways_atr_max_pct': 0.13495503947747878, 'sideways_tp_mult': 2.7632174073541047, 'sideways_tsl_mult': 0.37362580804367385, 'sideways_time_stop': 93, 'sideways_use_sma': False, 'sideways_use_ema': False, 'sideways_use_atr': True, 'sideways_use_adx': True, 'sideways_use_spike': True, 'sideways_rsi_required': False}.
[I 2025-09-01 11:47:34,273] Trial 416 finished with values: [-1000000000.0, 1000000000.0] and parameters: {'p_sma': 25, 'p_std': 34, 'p_atr': 23, 'p_adx': 23, 'rsi_period': 49, 'ema1': 25, 'ema2': 17, 'slip_atr_k': 0.024273191235921927, 'slip_spread_k': 0.7792249691635049, 'spread_hl_frac': 0.00025536402091635166, 'bb_std_mult': 1.030791277956753, 'rsi_os': 29, 'rsi_ob': 86, 'vol_spike': 0.17266053332910367, 'adx_thresh': 23.14752799052147, 'atr_min_pct': 0.023377135750015904, 'atr_max_pct': 0.07254132244517755, 'tp_mult': 2.0942248284125817, 'tsl_mult': 0.0671334676752858, 'strategy': 'breakout', 'time_stop': 192, 'use_sma': False, 'use_atr': True, 'use_adx': True, 'use_ema': True, 'use_spike': False, 'rsi_required': False, 'edge_k': 0.27099817489095646, 'edge_cap': 0.11364928496980765, 'bull_strategy': 'mean_reversion', 'bull_bb_std_mult': 1.6011111193992087, 'bull_rsi_os': 48, 'bull_rsi_ob': 47, 'bull_adx_thresh': 5.4490642326918834, 'bull_atr_min_pct': 0.01876036063673243, 'bull_atr_max_pct': 0.10985281477229655, 'bull_tp_mult': 1.2320492940221677, 'bull_tsl_mult': 0.6194274307476152, 'bull_time_stop': 281, 'bull_use_sma': False, 'bull_use_ema': False, 'bull_use_atr': True, 'bull_use_adx': False, 'bull_use_spike': False, 'bull_rsi_required': False, 'bear_strategy': 'breakout', 'bear_bb_std_mult': 1.3213259259730812, 'bear_rsi_os': 29, 'bear_rsi_ob': 53, 'bear_adx_thresh': 32.022546975906515, 'bear_atr_min_pct': 0.004149773286702645, 'bear_atr_max_pct': 0.12545459554250896, 'bear_tp_mult': 1.478791797527566, 'bear_tsl_mult': 0.9561468635315934, 'bear_time_stop': 64, 'bear_use_sma': True, 'bear_use_ema': False, 'bear_use_atr': True, 'bear_use_adx': True, 'bear_use_spike': False, 'bear_rsi_required': True, 'sideways_strategy': 'breakout', 'sideways_bb_std_mult': 1.8958611641616496, 'sideways_rsi_os': 43, 'sideways_rsi_ob': 91, 'sideways_adx_thresh': 33.847092461154865, 'sideways_atr_min_pct': 0.02601996883136721, 'sideways_atr_max_pct': 0.13490028167460635, 'sideways_tp_mult': 2.5599002989093007, 'sideways_tsl_mult': 0.37517471289640114, 'sideways_time_stop': 92, 'sideways_use_sma': False, 'sideways_use_ema': True, 'sideways_use_atr': True, 'sideways_use_adx': True, 'sideways_use_spike': True, 'sideways_rsi_required': False}.
[I 2025-09-01 11:47:34,613] Trial 417 finished with values: [0.0008846471121077837, 0.005274102510032512] and parameters: {'p_sma': 30, 'p_std': 34, 'p_atr': 21, 'p_adx': 23, 'rsi_period': 50, 'ema1': 25, 'ema2': 18, 'slip_atr_k': 0.021547830226504305, 'slip_spread_k': 0.40407586562833975, 'spread_hl_frac': 0.00028233589476441045, 'bb_std_mult': 1.0390057639765384, 'rsi_os': 29, 'rsi_ob': 86, 'vol_spike': 0.17216504590830245, 'adx_thresh': 23.0328166413663, 'atr_min_pct': 0.02352952494374566, 'atr_max_pct': 0.07321662695570229, 'tp_mult': 2.095203959147564, 'tsl_mult': 0.10325654977347327, 'strategy': 'breakout', 'time_stop': 172, 'use_sma': False, 'use_atr': True, 'use_adx': True, 'use_ema': True, 'use_spike': False, 'rsi_required': False, 'edge_k': 0.2747706374969882, 'edge_cap': 0.09242085450267697, 'bull_strategy': 'mean_reversion', 'bull_bb_std_mult': 1.7626814513594724, 'bull_rsi_os': 48, 'bull_rsi_ob': 54, 'bull_adx_thresh': 5.618906551748989, 'bull_atr_min_pct': 0.01860250111506625, 'bull_atr_max_pct': 0.10906711695231298, 'bull_tp_mult': 1.3485952690627532, 'bull_tsl_mult': 0.6687778165007522, 'bull_time_stop': 146, 'bull_use_sma': False, 'bull_use_ema': False, 'bull_use_atr': True, 'bull_use_adx': False, 'bull_use_spike': False, 'bull_rsi_required': False, 'bear_strategy': 'breakout', 'bear_bb_std_mult': 1.311949890404238, 'bear_rsi_os': 53, 'bear_rsi_ob': 50, 'bear_adx_thresh': 6.380095804511679, 'bear_atr_min_pct': 0.004185401361515132, 'bear_atr_max_pct': 0.025147429656465714, 'bear_tp_mult': 1.4595674156813283, 'bear_tsl_mult': 0.7674756479281388, 'bear_time_stop': 293, 'bear_use_sma': True, 'bear_use_ema': False, 'bear_use_atr': True, 'bear_use_adx': True, 'bear_use_spike': False, 'bear_rsi_required': True, 'sideways_strategy': 'breakout', 'sideways_bb_std_mult': 2.0304249490706083, 'sideways_rsi_os': 41, 'sideways_rsi_ob': 91, 'sideways_adx_thresh': 33.828191182885966, 'sideways_atr_min_pct': 0.02383986763796208, 'sideways_atr_max_pct': 0.13445797362721318, 'sideways_tp_mult': 2.564046387468017, 'sideways_tsl_mult': 0.3690355696500993, 'sideways_time_stop': 95, 'sideways_use_sma': False, 'sideways_use_ema': True, 'sideways_use_atr': True, 'sideways_use_adx': True, 'sideways_use_spike': True, 'sideways_rsi_required': False}.
[I 2025-09-01 11:48:17,989] Trial 423 finished with values: [-1000000000.0, 1000000000.0] and parameters: {'p_sma': 26, 'p_std': 32, 'p_atr': 21, 'p_adx': 7, 'rsi_period': 46, 'ema1': 25, 'ema2': 19, 'slip_atr_k': 0.021466270998521757, 'slip_spread_k': 0.4356515448038953, 'spread_hl_frac': 0.0019967274977733475, 'bb_std_mult': 1.1235784951698053, 'rsi_os': 32, 'rsi_ob': 48, 'vol_spike': 0.23083879726449852, 'adx_thresh': 24.71548473447972, 'atr_min_pct': 0.02404731538924138, 'atr_max_pct': 0.08247153697428879, 'tp_mult': 2.0075828975281707, 'tsl_mult': 0.03377229699124735, 'strategy': 'breakout', 'time_stop': 174, 'use_sma': False, 'use_atr': True, 'use_adx': True, 'use_ema': True, 'use_spike': False, 'rsi_required': False, 'edge_k': 0.1986297040620414, 'edge_cap': 0.062024503109157726, 'bull_strategy': 'mean_reversion', 'bull_bb_std_mult': 1.854938253196625, 'bull_rsi_os': 40, 'bull_rsi_ob': 53, 'bull_adx_thresh': 5.854155950941022, 'bull_atr_min_pct': 0.017912638149017668, 'bull_atr_max_pct': 0.11383024145489563, 'bull_tp_mult': 1.1248673171000547, 'bull_tsl_mult': 0.6615327457399313, 'bull_time_stop': 173, 'bull_use_sma': False, 'bull_use_ema': False, 'bull_use_atr': True, 'bull_use_adx': False, 'bull_use_spike': False, 'bull_rsi_required': False, 'bear_strategy': 'breakout', 'bear_bb_std_mult': 1.3814798987704242, 'bear_rsi_os': 30, 'bear_rsi_ob': 51, 'bear_adx_thresh': 6.449798761776021, 'bear_atr_min_pct': 0.005524708284417725, 'bear_atr_max_pct': 0.01835577557520346, 'bear_tp_mult': 1.5579130699461665, 'bear_tsl_mult': 0.5641861779329197, 'bear_time_stop': 202, 'bear_use_sma': True, 'bear_use_ema': False, 'bear_use_atr': True, 'bear_use_adx': True, 'bear_use_spike': False, 'bear_rsi_required': True, 'sideways_strategy': 'breakout', 'sideways_bb_std_mult': 2.1016001520610113, 'sideways_rsi_os': 49, 'sideways_rsi_ob': 89, 'sideways_adx_thresh': 30.939386085905884, 'sideways_atr_min_pct': 0.02399673278066209, 'sideways_atr_max_pct': 0.12627209182832244, 'sideways_tp_mult': 2.9009615990404396, 'sideways_tsl_mult': 0.31995346288947, 'sideways_time_stop': 88, 'sideways_use_sma': False, 'sideways_use_ema': False, 'sideways_use_atr': True, 'sideways_use_adx': True, 'sideways_use_spike': True, 'sideways_rsi_required': False}.
[I 2025-09-01 11:48:18,636] Trial 420 finished with values: [-1000000000.0, 1000000000.0] and parameters: {'p_sma': 23, 'p_std': 31, 'p_atr': 20, 'p_adx': 7, 'rsi_period': 46, 'ema1': 25, 'ema2': 19, 'slip_atr_k': 0.025663714734515654, 'slip_spread_k': 0.46392107799669846, 'spread_hl_frac': 0.0025815319571207275, 'bb_std_mult': 1.1029773568927208, 'rsi_os': 32, 'rsi_ob': 48, 'vol_spike': 0.2218259829907518, 'adx_thresh': 24.465668690507048, 'atr_min_pct': 0.023451573150945162, 'atr_max_pct': 0.0812005946099396, 'tp_mult': 2.104178075396349, 'tsl_mult': 0.06508878969861633, 'strategy': 'breakout', 'time_stop': 172, 'use_sma': False, 'use_atr': True, 'use_adx': True, 'use_ema': True, 'use_spike': False, 'rsi_required': False, 'edge_k': 0.1934119241326912, 'edge_cap': 0.0514922820213623, 'bull_strategy': 'mean_reversion', 'bull_bb_std_mult': 1.4688435554122083, 'bull_rsi_os': 46, 'bull_rsi_ob': 53, 'bull_adx_thresh': 5.736641974675515, 'bull_atr_min_pct': 0.01746369760966659, 'bull_atr_max_pct': 0.11718012671975057, 'bull_tp_mult': 1.1501167075244232, 'bull_tsl_mult': 0.6217500738862758, 'bull_time_stop': 172, 'bull_use_sma': False, 'bull_use_ema': False, 'bull_use_atr': True, 'bull_use_adx': False, 'bull_use_spike': False, 'bull_rsi_required': False, 'bear_strategy': 'breakout', 'bear_bb_std_mult': 1.4425544020000334, 'bear_rsi_os': 30, 'bear_rsi_ob': 52, 'bear_adx_thresh': 6.434223132299998, 'bear_atr_min_pct': 0.004661527898892809, 'bear_atr_max_pct': 0.015067458286289066, 'bear_tp_mult': 1.513776682451769, 'bear_tsl_mult': 0.7646558007622053, 'bear_time_stop': 217, 'bear_use_sma': True, 'bear_use_ema': False, 'bear_use_atr': True, 'bear_use_adx': True, 'bear_use_spike': False, 'bear_rsi_required': True, 'sideways_strategy': 'breakout', 'sideways_bb_std_mult': 2.0311765224631193, 'sideways_rsi_os': 30, 'sideways_rsi_ob': 91, 'sideways_adx_thresh': 31.95785964008603, 'sideways_atr_min_pct': 0.024024968704196875, 'sideways_atr_max_pct': 0.12728598685321935, 'sideways_tp_mult': 2.9031465529227374, 'sideways_tsl_mult': 0.31090804246743997, 'sideways_time_stop': 91, 'sideways_use_sma': False, 'sideways_use_ema': False, 'sideways_use_atr': True, 'sideways_use_adx': True, 'sideways_use_spike': True, 'sideways_rsi_required': False}.
[I 2025-09-01 11:48:19,179] Trial 421 finished with values: [-1000000000.0, 1000000000.0] and parameters: {'p_sma': 23, 'p_std': 34, 'p_atr': 21, 'p_adx': 7, 'rsi_period': 45, 'ema1': 25, 'ema2': 19, 'slip_atr_k': 0.024483236612962048, 'slip_spread_k': 0.45578839166677226, 'spread_hl_frac': 0.0018877090757925949, 'bb_std_mult': 1.1109922764948235, 'rsi_os': 32, 'rsi_ob': 48, 'vol_spike': 0.23000766719387616, 'adx_thresh': 24.399907415129107, 'atr_min_pct': 0.023432203800315094, 'atr_max_pct': 0.0810792443651989, 'tp_mult': 1.9841357109596593, 'tsl_mult': 0.025355427637775825, 'strategy': 'breakout', 'time_stop': 174, 'use_sma': False, 'use_atr': True, 'use_adx': True, 'use_ema': True, 'use_spike': False, 'rsi_required': False, 'edge_k': 0.18352591274602503, 'edge_cap': 0.05374075517169575, 'bull_strategy': 'mean_reversion', 'bull_bb_std_mult': 1.8433295711709092, 'bull_rsi_os': 46, 'bull_rsi_ob': 52, 'bull_adx_thresh': 5.74815883993708, 'bull_atr_min_pct': 0.01773646960494188, 'bull_atr_max_pct': 0.11349968234955174, 'bull_tp_mult': 1.133497984399598, 'bull_tsl_mult': 0.670693070775871, 'bull_time_stop': 172, 'bull_use_sma': False, 'bull_use_ema': False, 'bull_use_atr': True, 'bull_use_adx': False, 'bull_use_spike': False, 'bull_rsi_required': False, 'bear_strategy': 'breakout', 'bear_bb_std_mult': 1.4648161449868793, 'bear_rsi_os': 30, 'bear_rsi_ob': 51, 'bear_adx_thresh': 6.53408045536832, 'bear_atr_min_pct': 0.00509590867875024, 'bear_atr_max_pct': 0.01364769433112327, 'bear_tp_mult': 1.5699730756360388, 'bear_tsl_mult': 0.7624065535969013, 'bear_time_stop': 245, 'bear_use_sma': True, 'bear_use_ema': False, 'bear_use_atr': True, 'bear_use_adx': True, 'bear_use_spike': False, 'bear_rsi_required': True, 'sideways_strategy': 'breakout', 'sideways_bb_std_mult': 2.0892089059895556, 'sideways_rsi_os': 49, 'sideways_rsi_ob': 90, 'sideways_adx_thresh': 30.726349876704987, 'sideways_atr_min_pct': 0.023985342052901006, 'sideways_atr_max_pct': 0.12213754365192146, 'sideways_tp_mult': 2.830246874800269, 'sideways_tsl_mult': 0.34812875033850177, 'sideways_time_stop': 90, 'sideways_use_sma': False, 'sideways_use_ema': False, 'sideways_use_atr': True, 'sideways_use_adx': True, 'sideways_use_spike': True, 'sideways_rsi_required': False}.
