[I 2025-09-01 10:51:07,666] Trial 50 finished with values: [-1000000000.0, 1000000000.0] and parameters: {'p_sma': 11, 'p_std': 23, 'p_atr': 27, 'p_adx': 7, 'rsi_period': 8, 'ema1': 9, 'ema2': 46, 'slip_atr_k': 0.0165269717491595, 'slip_spread_k': 0.5220341526344107, 'spread_hl_frac': 0.04741198638552248, 'bb_std_mult': 2.0703066417079925, 'rsi_os': 10, 'rsi_ob': 56, 'vol_spike': 0.2066767369108783, 'adx_thresh': 10.250183180236464, 'atr_min_pct': 0.00578877179291811, 'atr_max_pct': 0.03662678538689717, 'tp_mult': 2.7870398530641673, 'tsl_mult': 0.7917010448451639, 'strategy': 'mean_reversion', 'time_stop': 225, 'use_sma': True, 'use_atr': True, 'use_adx': False, 'use_ema': True, 'use_spike': True, 'rsi_required': True, 'edge_k': 0.9972443420006112, 'edge_cap': 0.9034992124088096, 'bull_strategy': 'mean_reversion', 'bull_bb_std_mult': 0.7408418376849039, 'bull_rsi_os': 18, 'bull_rsi_ob': 65, 'bull_adx_thresh': 17.60984056513697, 'bull_atr_min_pct': 0.02037096790518079, 'bull_atr_max_pct': 0.04082737736984664, 'bull_tp_mult': 2.533668835503258, 'bull_tsl_mult': 0.40650856877067576, 'bull_time_stop': 283, 'bull_use_sma': True, 'bull_use_ema': False, 'bull_use_atr': True, 'bull_use_adx': True, 'bull_use_spike': False, 'bull_rsi_required': False, 'bear_strategy': 'mean_reversion', 'bear_bb_std_mult': 3.223199040550681, 'bear_rsi_os': 21, 'bear_rsi_ob': 74, 'bear_adx_thresh': 31.07381224623047, 'bear_atr_min_pct': 0.020466252351771866, 'bear_atr_max_pct': 0.08607191772223505, 'bear_tp_mult': 2.8047259242871396, 'bear_tsl_mult': 0.6946872017888902, 'bear_time_stop': 62, 'bear_use_sma': False, 'bear_use_ema': False, 'bear_use_atr': True, 'bear_use_adx': True, 'bear_use_spike': False, 'bear_rsi_required': False, 'sideways_strategy': 'mean_reversion', 'sideways_bb_std_mult': 1.3410518537625395, 'sideways_rsi_os': 50, 'sideways_rsi_ob': 45, 'sideways_adx_thresh': 33.11347019510576, 'sideways_atr_min_pct': 0.006246122949040414, 'sideways_atr_max_pct': 0.0655415337339995, 'sideways_tp_mult': 1.4484715675508548, 'sideways_tsl_mult': 0.2686684961439171, 'sideways_time_stop': 55, 'sideways_use_sma': False, 'sideways_use_ema': True, 'sideways_use_atr': False, 'sideways_use_adx': True, 'sideways_use_spike': False, 'sideways_rsi_required': False}.
[I 2025-09-01 10:51:07,970] Trial 51 finished with values: [-1000000000.0, 1000000000.0] and parameters: {'p_sma': 12, 'p_std': 18, 'p_atr': 28, 'p_adx': 24, 'rsi_period': 8, 'ema1': 9, 'ema2': 16, 'slip_atr_k': 0.002380340164360298, 'slip_spread_k': 0.5304130666806516, 'spread_hl_frac': 0.03010381895176801, 'bb_std_mult': 0.944560678341703, 'rsi_os': 15, 'rsi_ob': 56, 'vol_spike': 0.15706463978502172, 'adx_thresh': 32.317098698289456, 'atr_min_pct': 0.006899245926531886, 'atr_max_pct': 0.08941155206938099, 'tp_mult': 2.377829694268213, 'tsl_mult': 0.6881344509597099, 'strategy': 'mean_reversion', 'time_stop': 225, 'use_sma': True, 'use_atr': True, 'use_adx': False, 'use_ema': True, 'use_spike': True, 'rsi_required': True, 'edge_k': 0.9476402421753589, 'edge_cap': 0.8015275500250681, 'bull_strategy': 'mean_reversion', 'bull_bb_std_mult': 0.7375944359643416, 'bull_rsi_os': 18, 'bull_rsi_ob': 55, 'bull_adx_thresh': 13.122162639850242, 'bull_atr_min_pct': 0.021172229214166165, 'bull_atr_max_pct': 0.10404312318678019, 'bull_tp_mult': 2.5578098864251317, 'bull_tsl_mult': 0.42563743580771374, 'bull_time_stop': 286, 'bull_use_sma': True, 'bull_use_ema': False, 'bull_use_atr': True, 'bull_use_adx': True, 'bull_use_spike': False, 'bull_rsi_required': False, 'bear_strategy': 'mean_reversion', 'bear_bb_std_mult': 3.5981923417066204, 'bear_rsi_os': 25, 'bear_rsi_ob': 74, 'bear_adx_thresh': 30.910215900544543, 'bear_atr_min_pct': 0.013896309011655767, 'bear_atr_max_pct': 0.027307343735520052, 'bear_tp_mult': 2.27880360154544, 'bear_tsl_mult': 0.7456477504922645, 'bear_time_stop': 64, 'bear_use_sma': False, 'bear_use_ema': False, 'bear_use_atr': True, 'bear_use_adx': True, 'bear_use_spike': False, 'bear_rsi_required': False, 'sideways_strategy': 'mean_reversion', 'sideways_bb_std_mult': 1.4016860452243063, 'sideways_rsi_os': 49, 'sideways_rsi_ob': 56, 'sideways_adx_thresh': 33.30458471468285, 'sideways_atr_min_pct': 0.006335252808796673, 'sideways_atr_max_pct': 0.06592707678982983, 'sideways_tp_mult': 1.4022271812685083, 'sideways_tsl_mult': 0.16122395954930235, 'sideways_time_stop': 178, 'sideways_use_sma': False, 'sideways_use_ema': True, 'sideways_use_atr': False, 'sideways_use_adx': True, 'sideways_use_spike': False, 'sideways_rsi_required': False}.
[I 2025-09-01 10:51:08,987] Trial 56 finished with values: [-1000000000.0, 1000000000.0] and parameters: {'p_sma': 11, 'p_std': 24, 'p_atr': 10, 'p_adx': 25, 'rsi_period': 72, 'ema1': 14, 'ema2': 41, 'slip_atr_k': 0.24928995293802034, 'slip_spread_k': 0.6131338749262532, 'spread_hl_frac': 0.031364994769994416, 'bb_std_mult': 1.975470456997902, 'rsi_os': 41, 'rsi_ob': 52, 'vol_spike': 0.0874463993306398, 'adx_thresh': 25.180934403271046, 'atr_min_pct': 0.005730867050891321, 'atr_max_pct': 0.03473237773779576, 'tp_mult': 2.848216581885459, 'tsl_mult': 0.7509470687452476, 'strategy': 'mean_reversion', 'time_stop': 222, 'use_sma': True, 'use_atr': True, 'use_adx': False, 'use_ema': False, 'use_spike': True, 'rsi_required': False, 'edge_k': 0.3539943127140641, 'edge_cap': 0.771267435089505, 'bull_strategy': 'breakout', 'bull_bb_std_mult': 1.4461360446042986, 'bull_rsi_os': 10, 'bull_rsi_ob': 61, 'bull_adx_thresh': 17.620891208572143, 'bull_atr_min_pct': 0.005130123545085626, 'bull_atr_max_pct': 0.08666200055542607, 'bull_tp_mult': 2.17434221131199, 'bull_tsl_mult': 0.8561296712845878, 'bull_time_stop': 287, 'bull_use_sma': False, 'bull_use_ema': False, 'bull_use_atr': False, 'bull_use_adx': True, 'bull_use_spike': False, 'bull_rsi_required': False, 'bear_strategy': 'mean_reversion', 'bear_bb_std_mult': 3.337666228458718, 'bear_rsi_os': 34, 'bear_rsi_ob': 78, 'bear_adx_thresh': 32.61458198032547, 'bear_atr_min_pct': 0.011085092133948107, 'bear_atr_max_pct': 0.08914445686908322, 'bear_tp_mult': 2.33707662009783, 'bear_tsl_mult': 0.30938206640783694, 'bear_time_stop': 35, 'bear_use_sma': False, 'bear_use_ema': False, 'bear_use_atr': True, 'bear_use_adx': True, 'bear_use_spike': False, 'bear_rsi_required': True, 'sideways_strategy': 'breakout', 'sideways_bb_std_mult': 2.1291842005517845, 'sideways_rsi_os': 10, 'sideways_rsi_ob': 52, 'sideways_adx_thresh': 16.306687670280837, 'sideways_atr_min_pct': 0.009451116346879245, 'sideways_atr_max_pct': 0.04745600337164611, 'sideways_tp_mult': 1.3018144282864497, 'sideways_tsl_mult': 0.40715531002918764, 'sideways_time_stop': 242, 'sideways_use_sma': False, 'sideways_use_ema': True, 'sideways_use_atr': True, 'sideways_use_adx': True, 'sideways_use_spike': False, 'sideways_rsi_required': False}.
[I 2025-09-01 10:51:49,656] Trial 57 finished with values: [-1000000000.0, 1000000000.0] and parameters: {'p_sma': 6, 'p_std': 31, 'p_atr': 10, 'p_adx': 26, 'rsi_period': 24, 'ema1': 14, 'ema2': 55, 'slip_atr_k': 0.23696534566259436, 'slip_spread_k': 0.8972274760572297, 'spread_hl_frac': 0.0013156464049213236, 'bb_std_mult': 1.8799772818790728, 'rsi_os': 5, 'rsi_ob': 51, 'vol_spike': 0.05469968993564264, 'adx_thresh': 26.495504722329972, 'atr_min_pct': 0.004655421847421432, 'atr_max_pct': 0.043582341237637934, 'tp_mult': 2.1852391073939033, 'tsl_mult': 0.6182468771862619, 'strategy': 'mean_reversion', 'time_stop': 167, 'use_sma': True, 'use_atr': True, 'use_adx': False, 'use_ema': False, 'use_spike': True, 'rsi_required': False, 'edge_k': 0.7382108400719258, 'edge_cap': 0.7088709216109031, 'bull_strategy': 'breakout', 'bull_bb_std_mult': 1.0433553402470872, 'bull_rsi_os': 10, 'bull_rsi_ob': 61, 'bull_adx_thresh': 15.683585541545833, 'bull_atr_min_pct': 0.02451162844349825, 'bull_atr_max_pct': 0.07033582584355147, 'bull_tp_mult': 2.2241085271273398, 'bull_tsl_mult': 0.8553625359833291, 'bull_time_stop': 299, 'bull_use_sma': False, 'bull_use_ema': True, 'bull_use_atr': False, 'bull_use_adx': True, 'bull_use_spike': False, 'bull_rsi_required': False, 'bear_strategy': 'breakout', 'bear_bb_std_mult': 2.6199440100633833, 'bear_rsi_os': 47, 'bear_rsi_ob': 78, 'bear_adx_thresh': 12.140639536499592, 'bear_atr_min_pct': 0.01108531902302225, 'bear_atr_max_pct': 0.10258189554366216, 'bear_tp_mult': 2.3298612400325314, 'bear_tsl_mult': 0.9094572944205465, 'bear_time_stop': 85, 'bear_use_sma': False, 'bear_use_ema': False, 'bear_use_atr': True, 'bear_use_adx': True, 'bear_use_spike': False, 'bear_rsi_required': True, 'sideways_strategy': 'breakout', 'sideways_bb_std_mult': 2.440287387997341, 'sideways_rsi_os': 38, 'sideways_rsi_ob': 52, 'sideways_adx_thresh': 31.862011457406737, 'sideways_atr_min_pct': 0.009513337036855498, 'sideways_atr_max_pct': 0.047161848961382924, 'sideways_tp_mult': 1.291824798581462, 'sideways_tsl_mult': 0.3952657241941274, 'sideways_time_stop': 75, 'sideways_use_sma': False, 'sideways_use_ema': True, 'sideways_use_atr': True, 'sideways_use_adx': True, 'sideways_use_spike': True, 'sideways_rsi_required': False}.
[I 2025-09-01 10:51:49,903] Trial 58 finished with values: [-1000000000.0, 1000000000.0] and parameters: {'p_sma': 5, 'p_std': 35, 'p_atr': 10, 'p_adx': 26, 'rsi_period': 20, 'ema1': 14, 'ema2': 13, 'slip_atr_k': 0.23901830729377482, 'slip_spread_k': 0.6323079958199358, 'spread_hl_frac': 0.03283338655559402, 'bb_std_mult': 1.8486289914535685, 'rsi_os': 41, 'rsi_ob': 83, 'vol_spike': 0.2500483339723926, 'adx_thresh': 16.090926810254008, 'atr_min_pct': 0.004044811074462266, 'atr_max_pct': 0.022655095918918032, 'tp_mult': 2.1743101513669205, 'tsl_mult': 0.4811434153006918, 'strategy': 'mean_reversion', 'time_stop': 166, 'use_sma': True, 'use_atr': True, 'use_adx': False, 'use_ema': False, 'use_spike': True, 'rsi_required': False, 'edge_k': 0.7063843716279492, 'edge_cap': 0.7048646047159677, 'bull_strategy': 'breakout', 'bull_bb_std_mult': 1.0368663836765943, 'bull_rsi_os': 10, 'bull_rsi_ob': 94, 'bull_adx_thresh': 15.460851155794925, 'bull_atr_min_pct': 0.004572334082320234, 'bull_atr_max_pct': 0.07198438446937572, 'bull_tp_mult': 2.2019129997354754, 'bull_tsl_mult': 0.8465780277238937, 'bull_time_stop': 217, 'bull_use_sma': False, 'bull_use_ema': True, 'bull_use_atr': False, 'bull_use_adx': True, 'bull_use_spike': False, 'bull_rsi_required': False, 'bear_strategy': 'breakout', 'bear_bb_std_mult': 2.489820931236438, 'bear_rsi_os': 15, 'bear_rsi_ob': 79, 'bear_adx_thresh': 12.03167626977395, 'bear_atr_min_pct': 0.011565836622583153, 'bear_atr_max_pct': 0.02123289151281821, 'bear_tp_mult': 1.9499060383421596, 'bear_tsl_mult': 0.1266763733889293, 'bear_time_stop': 37, 'bear_use_sma': False, 'bear_use_ema': False, 'bear_use_atr': True, 'bear_use_adx': True, 'bear_use_spike': False, 'bear_rsi_required': True, 'sideways_strategy': 'breakout', 'sideways_bb_std_mult': 2.333076369168082, 'sideways_rsi_os': 10, 'sideways_rsi_ob': 79, 'sideways_adx_thresh': 31.830077521480934, 'sideways_atr_min_pct': 0.009800362770099762, 'sideways_atr_max_pct': 0.04800939693740834, 'sideways_tp_mult': 1.6112282489671796, 'sideways_tsl_mult': 0.4165977799493431, 'sideways_time_stop': 241, 'sideways_use_sma': False, 'sideways_use_ema': True, 'sideways_use_atr': True, 'sideways_use_adx': True, 'sideways_use_spike': True, 'sideways_rsi_required': False}.
[I 2025-09-01 10:51:50,152] Trial 59 finished with values: [-1000000000.0, 1000000000.0] and parameters: {'p_sma': 27, 'p_std': 35, 'p_atr': 10, 'p_adx': 20, 'rsi_period': 20, 'ema1': 14, 'ema2': 51, 'slip_atr_k': 0.24973545878235975, 'slip_spread_k': 0.611663612630701, 'spread_hl_frac': 0.00710192447262073, 'bb_std_mult': 1.9350299738033896, 'rsi_os': 33, 'rsi_ob': 83, 'vol_spike': 0.05931385400060793, 'adx_thresh': 23.157276738768147, 'atr_min_pct': 0.004536679354460116, 'atr_max_pct': 0.020148949561754614, 'tp_mult': 2.191600092053471, 'tsl_mult': 0.13171714099298876, 'strategy': 'mean_reversion', 'time_stop': 159, 'use_sma': True, 'use_atr': True, 'use_adx': False, 'use_ema': False, 'use_spike': True, 'rsi_required': False, 'edge_k': 0.13578579117941614, 'edge_cap': 0.8557125290150451, 'bull_strategy': 'breakout', 'bull_bb_std_mult': 1.4545967126015316, 'bull_rsi_os': 14, 'bull_rsi_ob': 61, 'bull_adx_thresh': 19.694215509333493, 'bull_atr_min_pct': 0.005184480978384606, 'bull_atr_max_pct': 0.06945840724138119, 'bull_tp_mult': 2.360214110206033, 'bull_tsl_mult': 0.3027150732957118, 'bull_time_stop': 211, 'bull_use_sma': False, 'bull_use_ema': True, 'bull_use_atr': False, 'bull_use_adx': True, 'bull_use_spike': False, 'bull_rsi_required': False, 'bear_strategy': 'breakout', 'bear_bb_std_mult': 2.4888679672581833, 'bear_rsi_os': 33, 'bear_rsi_ob': 77, 'bear_adx_thresh': 29.409549353747447, 'bear_atr_min_pct': 0.011231584309250133, 'bear_atr_max_pct': 0.09159781026768146, 'bear_tp_mult': 2.3549959836880054, 'bear_tsl_mult': 0.3103636666915576, 'bear_time_stop': 269, 'bear_use_sma': False, 'bear_use_ema': False, 'bear_use_atr': True, 'bear_use_adx': True, 'bear_use_spike': False, 'bear_rsi_required': True, 'sideways_strategy': 'breakout', 'sideways_bb_std_mult': 2.3373921041896164, 'sideways_rsi_os': 11, 'sideways_rsi_ob': 52, 'sideways_adx_thresh': 18.246073235159358, 'sideways_atr_min_pct': 0.009479245794788345, 'sideways_atr_max_pct': 0.05094022239926488, 'sideways_tp_mult': 1.6567579397983376, 'sideways_tsl_mult': 0.38649764222713795, 'sideways_time_stop': 78, 'sideways_use_sma': False, 'sideways_use_ema': True, 'sideways_use_atr': True, 'sideways_use_adx': True, 'sideways_use_spike': True, 'sideways_rsi_required': False}.
[I 2025-09-01 10:51:50,286] Trial 60 finished with values: [-1000000000.0, 1000000000.0] and parameters: {'p_sma': 21, 'p_std': 35, 'p_atr': 15, 'p_adx': 19, 'rsi_period': 23, 'ema1': 11, 'ema2': 55, 'slip_atr_k': 0.23748096679416444, 'slip_spread_k': 0.4380235376403605, 'spread_hl_frac': 0.0015235777596390907, 'bb_std_mult': 1.731099155438622, 'rsi_os': 5, 'rsi_ob': 82, 'vol_spike': 0.25086110425338326, 'adx_thresh': 16.35826540388171, 'atr_min_pct': 0.0042191212623732205, 'atr_max_pct': 0.0421445878592803, 'tp_mult': 2.583331744807841, 'tsl_mult': 0.4862733179456008, 'strategy': 'mean_reversion', 'time_stop': 180, 'use_sma': True, 'use_atr': True, 'use_adx': False, 'use_ema': False, 'use_spike': True, 'rsi_required': False, 'edge_k': 0.22774369537580358, 'edge_cap': 0.699497714280857, 'bull_strategy': 'breakout', 'bull_bb_std_mult': 1.0766052516053588, 'bull_rsi_os': 37, 'bull_rsi_ob': 95, 'bull_adx_thresh': 15.674234818065983, 'bull_atr_min_pct': 0.025560365015366352, 'bull_atr_max_pct': 0.07150787682461038, 'bull_tp_mult': 2.3507836371268573, 'bull_tsl_mult': 0.3205008779077484, 'bull_time_stop': 212, 'bull_use_sma': False, 'bull_use_ema': True, 'bull_use_atr': False, 'bull_use_adx': True, 'bull_use_spike': False, 'bull_rsi_required': False, 'bear_strategy': 'breakout', 'bear_bb_std_mult': 2.4504318128716363, 'bear_rsi_os': 16, 'bear_rsi_ob': 81, 'bear_adx_thresh': 12.749643055570917, 'bear_atr_min_pct': 0.02440038439084174, 'bear_atr_max_pct': 0.10203802375818116, 'bear_tp_mult': 2.489300026661984, 'bear_tsl_mult': 0.11834303875063834, 'bear_time_stop': 83, 'bear_use_sma': False, 'bear_use_ema': False, 'bear_use_atr': True, 'bear_use_adx': True, 'bear_use_spike': False, 'bear_rsi_required': True, 'sideways_strategy': 'breakout', 'sideways_bb_std_mult': 2.340064760742737, 'sideways_rsi_os': 12, 'sideways_rsi_ob': 78, 'sideways_adx_thresh': 6.29876396528409, 'sideways_atr_min_pct': 0.012285223816588536, 'sideways_atr_max_pct': 0.05005630935530547, 'sideways_tp_mult': 1.5798317486561642, 'sideways_tsl_mult': 0.5231901164643185, 'sideways_time_stop': 78, 'sideways_use_sma': False, 'sideways_use_ema': True, 'sideways_use_atr': True, 'sideways_use_adx': True, 'sideways_use_spike': True, 'sideways_rsi_required': False}.
[I 2025-09-01 10:51:50,660] Trial 62 finished with values: [-1000000000.0, 1000000000.0] and parameters: {'p_sma': 27, 'p_std': 28, 'p_atr': 15, 'p_adx': 19, 'rsi_period': 41, 'ema1': 11, 'ema2': 51, 'slip_atr_k': 0.1971329971410493, 'slip_spread_k': 0.7659684019463672, 'spread_hl_frac': 0.0040367932803359475, 'bb_std_mult': 1.6612150053218635, 'rsi_os': 24, 'rsi_ob': 47, 'vol_spike': 0.23052002245166459, 'adx_thresh': 13.878147769866647, 'atr_min_pct': 0.00870693478367092, 'atr_max_pct': 0.059150785271860795, 'tp_mult': 2.560245425085192, 'tsl_mult': 0.08821717372361981, 'strategy': 'mean_reversion', 'time_stop': 127, 'use_sma': True, 'use_atr': True, 'use_adx': False, 'use_ema': False, 'use_spike': True, 'rsi_required': False, 'edge_k': 0.1617415308792547, 'edge_cap': 0.36447093320263674, 'bull_strategy': 'breakout', 'bull_bb_std_mult': 1.4101691737369335, 'bull_rsi_os': 14, 'bull_rsi_ob': 56, 'bull_adx_thresh': 24.779714795531714, 'bull_atr_min_pct': 0.0030773951873786067, 'bull_atr_max_pct': 0.12172810194139891, 'bull_tp_mult': 2.347666720781738, 'bull_tsl_mult': 0.5001185479160976, 'bull_time_stop': 240, 'bull_use_sma': False, 'bull_use_ema': True, 'bull_use_atr': False, 'bull_use_adx': True, 'bull_use_spike': False, 'bull_rsi_required': False, 'bear_strategy': 'breakout', 'bear_bb_std_mult': 1.2400249431920902, 'bear_rsi_os': 43, 'bear_rsi_ob': 81, 'bear_adx_thresh': 8.067677531964044, 'bear_atr_min_pct': 0.024652204410487346, 'bear_atr_max_pct': 0.06606166554817751, 'bear_tp_mult': 2.469909178049304, 'bear_tsl_mult': 0.2011304682621855, 'bear_time_stop': 267, 'bear_use_sma': False, 'bear_use_ema': False, 'bear_use_atr': True, 'bear_use_adx': False, 'bear_use_spike': True, 'bear_rsi_required': True, 'sideways_strategy': 'breakout', 'sideways_bb_std_mult': 2.5609329484460774, 'sideways_rsi_os': 16, 'sideways_rsi_ob': 48, 'sideways_adx_thresh': 11.68874435732986, 'sideways_atr_min_pct': 0.0178495582266586, 'sideways_atr_max_pct': 0.10243237319627703, 'sideways_tp_mult': 1.6018631465050377, 'sideways_tsl_mult': 0.5127629438612575, 'sideways_time_stop': 34, 'sideways_use_sma': False, 'sideways_use_ema': True, 'sideways_use_atr': True, 'sideways_use_adx': False, 'sideways_use_spike': True, 'sideways_rsi_required': True}.
[I 2025-09-01 10:51:50,718] Trial 61 finished with values: [-1000000000.0, 1000000000.0] and parameters: {'p_sma': 27, 'p_std': 28, 'p_atr': 15, 'p_adx': 19, 'rsi_period': 39, 'ema1': 11, 'ema2': 59, 'slip_atr_k': 0.1963083649505405, 'slip_spread_k': 0.4671826517889409, 'spread_hl_frac': 0.007424274461014183, 'bb_std_mult': 1.7353280452690711, 'rsi_os': 33, 'rsi_ob': 47, 'vol_spike': 0.1273560526910951, 'adx_thresh': 14.116540389603845, 'atr_min_pct': 0.02688167669013166, 'atr_max_pct': 0.05784354827391193, 'tp_mult': 2.5709912283827348, 'tsl_mult': 0.10398458235398678, 'strategy': 'mean_reversion', 'time_stop': 32, 'use_sma': True, 'use_atr': True, 'use_adx': False, 'use_ema': False, 'use_spike': True, 'rsi_required': False, 'edge_k': 0.21935846868038544, 'edge_cap': 0.8475895049391173, 'bull_strategy': 'breakout', 'bull_bb_std_mult': 1.3536519542978278, 'bull_rsi_os': 46, 'bull_rsi_ob': 68, 'bull_adx_thresh': 5.049689059946843, 'bull_atr_min_pct': 0.003241808817587527, 'bull_atr_max_pct': 0.12091510981977216, 'bull_tp_mult': 2.346998603578616, 'bull_tsl_mult': 0.30834012782411435, 'bull_time_stop': 239, 'bull_use_sma': False, 'bull_use_ema': True, 'bull_use_atr': False, 'bull_use_adx': True, 'bull_use_spike': False, 'bull_rsi_required': False, 'bear_strategy': 'breakout', 'bear_bb_std_mult': 1.411195721476024, 'bear_rsi_os': 11, 'bear_rsi_ob': 64, 'bear_adx_thresh': 34.894181414972834, 'bear_atr_min_pct': 0.023421737362998747, 'bear_atr_max_pct': 0.055659208563306195, 'bear_tp_mult': 1.6603763804944076, 'bear_tsl_mult': 0.21376393639419058, 'bear_time_stop': 22, 'bear_use_sma': False, 'bear_use_ema': False, 'bear_use_atr': True, 'bear_use_adx': False, 'bear_use_spike': True, 'bear_rsi_required': True, 'sideways_strategy': 'breakout', 'sideways_bb_std_mult': 3.162803067232778, 'sideways_rsi_os': 12, 'sideways_rsi_ob': 47, 'sideways_adx_thresh': 8.793198331789897, 'sideways_atr_min_pct': 0.018201122346086923, 'sideways_atr_max_pct': 0.10214229046956455, 'sideways_tp_mult': 1.1392621979303899, 'sideways_tsl_mult': 0.583764188419865, 'sideways_time_stop': 72, 'sideways_use_sma': False, 'sideways_use_ema': True, 'sideways_use_atr': True, 'sideways_use_adx': False, 'sideways_use_spike': True, 'sideways_rsi_required': True}.
