[I 2025-09-01 11:45:20,099] Trial 407 finished with values: [-1000000000.0, 1000000000.0] and parameters: {'p_sma': 29, 'p_std': 32, 'p_atr': 19, 'p_adx': 17, 'rsi_period': 47, 'ema1': 24, 'ema2': 18, 'slip_atr_k': 0.027644530093520917, 'slip_spread_k': 0.44947265598484193, 'spread_hl_frac': 0.0013550997879884837, 'bb_std_mult': 0.9164254112487067, 'rsi_os': 31, 'rsi_ob': 84, 'vol_spike': 0.19214028002912723, 'adx_thresh': 23.730478025579636, 'atr_min_pct': 0.02406239406744895, 'atr_max_pct': 0.07507531056691995, 'tp_mult': 2.0420736162515785, 'tsl_mult': 0.0868203859439078, 'strategy': 'breakout', 'time_stop': 179, 'use_sma': False, 'use_atr': True, 'use_adx': True, 'use_ema': False, 'use_spike': False, 'rsi_required': False, 'edge_k': 0.2265461356724507, 'edge_cap': 0.0859522466272844, 'bull_strategy': 'mean_reversion', 'bull_bb_std_mult': 1.6554709813098643, 'bull_rsi_os': 48, 'bull_rsi_ob': 49, 'bull_adx_thresh': 5.04596268634788, 'bull_atr_min_pct': 0.01912702996424546, 'bull_atr_max_pct': 0.10563175488184326, 'bull_tp_mult': 1.315718138241833, 'bull_tsl_mult': 0.0280913571357983, 'bull_time_stop': 275, 'bull_use_sma': False, 'bull_use_ema': False, 'bull_use_atr': False, 'bull_use_adx': False, 'bull_use_spike': False, 'bull_rsi_required': True, 'bear_strategy': 'mean_reversion', 'bear_bb_std_mult': 1.237291737809465, 'bear_rsi_os': 26, 'bear_rsi_ob': 51, 'bear_adx_thresh': 7.990798463450595, 'bear_atr_min_pct': 0.0061518380778336846, 'bear_atr_max_pct': 0.021983593909799093, 'bear_tp_mult': 1.5661294724806483, 'bear_tsl_mult': 0.9916686805421994, 'bear_time_stop': 65, 'bear_use_sma': True, 'bear_use_ema': False, 'bear_use_atr': True, 'bear_use_adx': True, 'bear_use_spike': False, 'bear_rsi_required': True, 'sideways_strategy': 'breakout', 'sideways_bb_std_mult': 1.9179684715962666, 'sideways_rsi_os': 43, 'sideways_rsi_ob': 90, 'sideways_adx_thresh': 32.57609003561566, 'sideways_atr_min_pct': 0.025114255772231687, 'sideways_atr_max_pct': 0.1398939042864027, 'sideways_tp_mult': 2.81418185953675, 'sideways_tsl_mult': 0.34724089923472606, 'sideways_time_stop': 84, 'sideways_use_sma': False, 'sideways_use_ema': True, 'sideways_use_atr': True, 'sideways_use_adx': True, 'sideways_use_spike': True, 'sideways_rsi_required': False}.
[I 2025-09-01 11:45:20,444] Trial 406 finished with values: [-1000000000.0, 1000000000.0] and parameters: {'p_sma': 12, 'p_std': 42, 'p_atr': 19, 'p_adx': 17, 'rsi_period': 59, 'ema1': 5, 'ema2': 16, 'slip_atr_k': 0.015212108412056113, 'slip_spread_k': 0.9533451889011897, 'spread_hl_frac': 0.026612228973940832, 'bb_std_mult': 3.062937409176694, 'rsi_os': 30, 'rsi_ob': 83, 'vol_spike': 0.2915311067714039, 'adx_thresh': 22.1900832678194, 'atr_min_pct': 0.024617863139749688, 'atr_max_pct': 0.030010791354920484, 'tp_mult': 2.233152362513329, 'tsl_mult': 0.9046495644363511, 'strategy': 'breakout', 'time_stop': 84, 'use_sma': False, 'use_atr': False, 'use_adx': False, 'use_ema': False, 'use_spike': True, 'rsi_required': False, 'edge_k': 0.4191529380418096, 'edge_cap': 0.27879986167152965, 'bull_strategy': 'breakout', 'bull_bb_std_mult': 0.6025770931834669, 'bull_rsi_os': 51, 'bull_rsi_ob': 83, 'bull_adx_thresh': 6.839021979402061, 'bull_atr_min_pct': 0.004300072491867479, 'bull_atr_max_pct': 0.09032064022516789, 'bull_tp_mult': 1.2887856360347554, 'bull_tsl_mult': 0.605647371482661, 'bull_time_stop': 285, 'bull_use_sma': True, 'bull_use_ema': True, 'bull_use_atr': False, 'bull_use_adx': True, 'bull_use_spike': True, 'bull_rsi_required': True, 'bear_strategy': 'mean_reversion', 'bear_bb_std_mult': 1.7321411090152328, 'bear_rsi_os': 22, 'bear_rsi_ob': 47, 'bear_adx_thresh': 9.183226201464963, 'bear_atr_min_pct': 0.002867963677676894, 'bear_atr_max_pct': 0.09657533727825961, 'bear_tp_mult': 1.2152998357266034, 'bear_tsl_mult': 0.9987036880783565, 'bear_time_stop': 67, 'bear_use_sma': True, 'bear_use_ema': True, 'bear_use_atr': False, 'bear_use_adx': False, 'bear_use_spike': False, 'bear_rsi_required': True, 'sideways_strategy': 'mean_reversion', 'sideways_bb_std_mult': 2.7751713087439276, 'sideways_rsi_os': 37, 'sideways_rsi_ob': 67, 'sideways_adx_thresh': 6.316858841559073, 'sideways_atr_min_pct': 0.023590211341175178, 'sideways_atr_max_pct': 0.08372958272069667, 'sideways_tp_mult': 1.2723325452834293, 'sideways_tsl_mult': 0.12033858178026519, 'sideways_time_stop': 248, 'sideways_use_sma': True, 'sideways_use_ema': True, 'sideways_use_atr': True, 'sideways_use_adx': False, 'sideways_use_spike': False, 'sideways_rsi_required': False}.
[I 2025-09-01 11:45:20,852] Trial 404 finished with values: [-1000000000.0, 1000000000.0] and parameters: {'p_sma': 12, 'p_std': 11, 'p_atr': 19, 'p_adx': 9, 'rsi_period': 51, 'ema1': 26, 'ema2': 16, 'slip_atr_k': 0.013239464440210335, 'slip_spread_k': 0.4476635897705876, 'spread_hl_frac': 0.027016450464742, 'bb_std_mult': 1.5655527459748289, 'rsi_os': 31, 'rsi_ob': 69, 'vol_spike': 0.28212510355669407, 'adx_thresh': 11.303336201119837, 'atr_min_pct': 0.017130514025118723, 'atr_max_pct': 0.033170819188926594, 'tp_mult': 2.239043668251943, 'tsl_mult': 0.9529004212468455, 'strategy': 'breakout', 'time_stop': 252, 'use_sma': False, 'use_atr': False, 'use_adx': False, 'use_ema': True, 'use_spike': True, 'rsi_required': False, 'edge_k': 0.41196385173492855, 'edge_cap': 0.6173598480080889, 'bull_strategy': 'breakout', 'bull_bb_std_mult': 0.9144215544455587, 'bull_rsi_os': 21, 'bull_rsi_ob': 85, 'bull_adx_thresh': 13.560632912261589, 'bull_atr_min_pct': 0.004308398907283382, 'bull_atr_max_pct': 0.10274286113138748, 'bull_tp_mult': 1.2859678742400091, 'bull_tsl_mult': 0.5972892902918003, 'bull_time_stop': 285, 'bull_use_sma': True, 'bull_use_ema': True, 'bull_use_atr': False, 'bull_use_adx': True, 'bull_use_spike': True, 'bull_rsi_required': True, 'bear_strategy': 'breakout', 'bear_bb_std_mult': 1.7089067316049362, 'bear_rsi_os': 19, 'bear_rsi_ob': 81, 'bear_adx_thresh': 9.084138906055532, 'bear_atr_min_pct': 0.003854701540955618, 'bear_atr_max_pct': 0.08089240646623794, 'bear_tp_mult': 2.1222895243643944, 'bear_tsl_mult': 0.9981969842537102, 'bear_time_stop': 66, 'bear_use_sma': True, 'bear_use_ema': True, 'bear_use_atr': False, 'bear_use_adx': False, 'bear_use_spike': False, 'bear_rsi_required': True, 'sideways_strategy': 'mean_reversion', 'sideways_bb_std_mult': 1.8199586340742107, 'sideways_rsi_os': 37, 'sideways_rsi_ob': 91, 'sideways_adx_thresh': 19.42070203571639, 'sideways_atr_min_pct': 0.0010778370572270407, 'sideways_atr_max_pct': 0.08320220705883119, 'sideways_tp_mult': 1.2681710187589843, 'sideways_tsl_mult': 0.12021638895181636, 'sideways_time_stop': 87, 'sideways_use_sma': True, 'sideways_use_ema': True, 'sideways_use_atr': True, 'sideways_use_adx': False, 'sideways_use_spike': False, 'sideways_rsi_required': True}.
[I 2025-09-01 11:46:03,900] Trial 410 finished with values: [-0.0007165700586545531, 0.004358305934483614] and parameters: {'p_sma': 23, 'p_std': 33, 'p_atr': 18, 'p_adx': 8, 'rsi_period': 48, 'ema1': 25, 'ema2': 18, 'slip_atr_k': 0.028808702102594706, 'slip_spread_k': 0.43237763486496145, 'spread_hl_frac': 0.0007697458364345995, 'bb_std_mult': 0.83934116560735, 'rsi_os': 30, 'rsi_ob': 87, 'vol_spike': 0.20579079465271105, 'adx_thresh': 24.200894348156762, 'atr_min_pct': 0.023376396133113295, 'atr_max_pct': 0.0791171421219935, 'tp_mult': 2.0682607264377983, 'tsl_mult': 0.07503442520680595, 'strategy': 'breakout', 'time_stop': 162, 'use_sma': False, 'use_atr': True, 'use_adx': True, 'use_ema': True, 'use_spike': False, 'rsi_required': False, 'edge_k': 0.2519096194417547, 'edge_cap': 0.05263563384024819, 'bull_strategy': 'mean_reversion', 'bull_bb_std_mult': 1.5590945248680437, 'bull_rsi_os': 48, 'bull_rsi_ob': 46, 'bull_adx_thresh': 5.128749779128497, 'bull_atr_min_pct': 0.016729334238635173, 'bull_atr_max_pct': 0.10760618867558837, 'bull_tp_mult': 1.218149271812421, 'bull_tsl_mult': 0.6757466903123133, 'bull_time_stop': 274, 'bull_use_sma': False, 'bull_use_ema': False, 'bull_use_atr': True, 'bull_use_adx': False, 'bull_use_spike': False, 'bull_rsi_required': False, 'bear_strategy': 'breakout', 'bear_bb_std_mult': 1.2030590963814434, 'bear_rsi_os': 29, 'bear_rsi_ob': 51, 'bear_adx_thresh': 7.725154469371763, 'bear_atr_min_pct': 0.0041348411323759784, 'bear_atr_max_pct': 0.022937896078467107, 'bear_tp_mult': 1.4871729001440983, 'bear_tsl_mult': 0.9980015208638462, 'bear_time_stop': 59, 'bear_use_sma': True, 'bear_use_ema': False, 'bear_use_atr': True, 'bear_use_adx': True, 'bear_use_spike': False, 'bear_rsi_required': True, 'sideways_strategy': 'breakout', 'sideways_bb_std_mult': 1.9650120514489207, 'sideways_rsi_os': 42, 'sideways_rsi_ob': 89, 'sideways_adx_thresh': 33.79582230818062, 'sideways_atr_min_pct': 0.02486854903117431, 'sideways_atr_max_pct': 0.12967913476722626, 'sideways_tp_mult': 2.7385617330601875, 'sideways_tsl_mult': 0.3615191848736596, 'sideways_time_stop': 91, 'sideways_use_sma': False, 'sideways_use_ema': True, 'sideways_use_atr': True, 'sideways_use_adx': True, 'sideways_use_spike': True, 'sideways_rsi_required': False}.
[I 2025-09-01 11:46:06,998] Trial 411 finished with values: [-1000000000.0, 1000000000.0] and parameters: {'p_sma': 26, 'p_std': 33, 'p_atr': 18, 'p_adx': 8, 'rsi_period': 48, 'ema1': 25, 'ema2': 18, 'slip_atr_k': 0.026383410150883232, 'slip_spread_k': 0.4264384072148194, 'spread_hl_frac': 0.0007826258239603569, 'bb_std_mult': 0.8442639285431323, 'rsi_os': 30, 'rsi_ob': 88, 'vol_spike': 0.20576797552113105, 'adx_thresh': 24.084699101282258, 'atr_min_pct': 0.023438961469528525, 'atr_max_pct': 0.07966632948195747, 'tp_mult': 2.0718898090785847, 'tsl_mult': 0.09711106797283495, 'strategy': 'breakout', 'time_stop': 163, 'use_sma': False, 'use_atr': True, 'use_adx': True, 'use_ema': True, 'use_spike': False, 'rsi_required': False, 'edge_k': 0.2509694757886065, 'edge_cap': 0.1474519847469779, 'bull_strategy': 'mean_reversion', 'bull_bb_std_mult': 1.568815327527435, 'bull_rsi_os': 49, 'bull_rsi_ob': 52, 'bull_adx_thresh': 5.033873621342215, 'bull_atr_min_pct': 0.016311785334356583, 'bull_atr_max_pct': 0.10766384903572764, 'bull_tp_mult': 1.3252993809340414, 'bull_tsl_mult': 0.6887282887844397, 'bull_time_stop': 274, 'bull_use_sma': False, 'bull_use_ema': False, 'bull_use_atr': True, 'bull_use_adx': False, 'bull_use_spike': False, 'bull_rsi_required': False, 'bear_strategy': 'breakout', 'bear_bb_std_mult': 1.2135675434987192, 'bear_rsi_os': 26, 'bear_rsi_ob': 51, 'bear_adx_thresh': 7.340486023749049, 'bear_atr_min_pct': 0.02903089647750938, 'bear_atr_max_pct': 0.022540229526007677, 'bear_tp_mult': 1.6168305968409777, 'bear_tsl_mult': 0.9784648466971491, 'bear_time_stop': 56, 'bear_use_sma': True, 'bear_use_ema': False, 'bear_use_atr': True, 'bear_use_adx': True, 'bear_use_spike': False, 'bear_rsi_required': True, 'sideways_strategy': 'breakout', 'sideways_bb_std_mult': 1.937353446538567, 'sideways_rsi_os': 41, 'sideways_rsi_ob': 90, 'sideways_adx_thresh': 34.32512254265223, 'sideways_atr_min_pct': 0.02515375418634654, 'sideways_atr_max_pct': 0.1293176771257522, 'sideways_tp_mult': 2.709410814223784, 'sideways_tsl_mult': 0.3598668212446941, 'sideways_time_stop': 77, 'sideways_use_sma': False, 'sideways_use_ema': True, 'sideways_use_atr': True, 'sideways_use_adx': True, 'sideways_use_spike': True, 'sideways_rsi_required': False}.
[I 2025-09-01 11:46:07,010] Trial 409 finished with values: [-1000000000.0, 1000000000.0] and parameters: {'p_sma': 24, 'p_std': 33, 'p_atr': 18, 'p_adx': 8, 'rsi_period': 48, 'ema1': 24, 'ema2': 17, 'slip_atr_k': 0.023832392590710738, 'slip_spread_k': 0.44374251039119456, 'spread_hl_frac': 0.0008089586347906118, 'bb_std_mult': 0.8488798361047805, 'rsi_os': 30, 'rsi_ob': 87, 'vol_spike': 0.2096677704975655, 'adx_thresh': 24.222378100404175, 'atr_min_pct': 0.02196819544150657, 'atr_max_pct': 0.07942736660334797, 'tp_mult': 2.0749507860378187, 'tsl_mult': 0.09827912588477242, 'strategy': 'breakout', 'time_stop': 162, 'use_sma': False, 'use_atr': True, 'use_adx': True, 'use_ema': True, 'use_spike': False, 'rsi_required': False, 'edge_k': 0.24711280255801393, 'edge_cap': 0.13458078659037165, 'bull_strategy': 'mean_reversion', 'bull_bb_std_mult': 1.5471201860283827, 'bull_rsi_os': 48, 'bull_rsi_ob': 46, 'bull_adx_thresh': 5.007257485299954, 'bull_atr_min_pct': 0.0182336602232605, 'bull_atr_max_pct': 0.10757869640835185, 'bull_tp_mult': 1.4134903911185703, 'bull_tsl_mult': 0.16223960129570025, 'bull_time_stop': 278, 'bull_use_sma': False, 'bull_use_ema': False, 'bull_use_atr': True, 'bull_use_adx': False, 'bull_use_spike': False, 'bull_rsi_required': False, 'bear_strategy': 'breakout', 'bear_bb_std_mult': 1.2018459473407994, 'bear_rsi_os': 27, 'bear_rsi_ob': 50, 'bear_adx_thresh': 7.6726409221757175, 'bear_atr_min_pct': 0.013964028842959511, 'bear_atr_max_pct': 0.023902995220160757, 'bear_tp_mult': 1.5021969161285087, 'bear_tsl_mult': 0.9914744995053089, 'bear_time_stop': 58, 'bear_use_sma': True, 'bear_use_ema': False, 'bear_use_atr': True, 'bear_use_adx': True, 'bear_use_spike': False, 'bear_rsi_required': True, 'sideways_strategy': 'breakout', 'sideways_bb_std_mult': 1.9560841125320072, 'sideways_rsi_os': 42, 'sideways_rsi_ob': 90, 'sideways_adx_thresh': 33.4819071127261, 'sideways_atr_min_pct': 0.024812455051110346, 'sideways_atr_max_pct': 0.13648421448726075, 'sideways_tp_mult': 2.9521210384341248, 'sideways_tsl_mult': 0.3642056102572546, 'sideways_time_stop': 74, 'sideways_use_sma': False, 'sideways_use_ema': True, 'sideways_use_atr': True, 'sideways_use_adx': True, 'sideways_use_spike': True, 'sideways_rsi_required': False}.
[I 2025-09-01 11:46:07,533] Trial 408 finished with values: [-1000000000.0, 1000000000.0] and parameters: {'p_sma': 24, 'p_std': 32, 'p_atr': 19, 'p_adx': 17, 'rsi_period': 48, 'ema1': 24, 'ema2': 18, 'slip_atr_k': 0.02614410527995458, 'slip_spread_k': 0.4506284791001168, 'spread_hl_frac': 0.001143143895766892, 'bb_std_mult': 0.9250764152044081, 'rsi_os': 30, 'rsi_ob': 87, 'vol_spike': 0.20399800510832303, 'adx_thresh': 23.957179306259395, 'atr_min_pct': 0.02453865859684917, 'atr_max_pct': 0.07565214118777298, 'tp_mult': 2.0295833674674073, 'tsl_mult': 0.08960606820055853, 'strategy': 'breakout', 'time_stop': 162, 'use_sma': False, 'use_atr': True, 'use_adx': True, 'use_ema': True, 'use_spike': False, 'rsi_required': False, 'edge_k': 0.23468717863070643, 'edge_cap': 0.13985184675519513, 'bull_strategy': 'mean_reversion', 'bull_bb_std_mult': 1.6636344483575836, 'bull_rsi_os': 48, 'bull_rsi_ob': 50, 'bull_adx_thresh': 5.100248384945254, 'bull_atr_min_pct': 0.01637628808105111, 'bull_atr_max_pct': 0.10638419224882097, 'bull_tp_mult': 1.27525647407006, 'bull_tsl_mult': 0.6984865808210005, 'bull_time_stop': 275, 'bull_use_sma': False, 'bull_use_ema': False, 'bull_use_atr': True, 'bull_use_adx': False, 'bull_use_spike': False, 'bull_rsi_required': False, 'bear_strategy': 'breakout', 'bear_bb_std_mult': 1.2186930546953354, 'bear_rsi_os': 26, 'bear_rsi_ob': 51, 'bear_adx_thresh': 7.9696830507735115, 'bear_atr_min_pct': 0.005162536741918332, 'bear_atr_max_pct': 0.02327717092886219, 'bear_tp_mult': 1.5412499368503914, 'bear_tsl_mult': 0.9991694329119923, 'bear_time_stop': 56, 'bear_use_sma': True, 'bear_use_ema': False, 'bear_use_atr': True, 'bear_use_adx': True, 'bear_use_spike': False, 'bear_rsi_required': True, 'sideways_strategy': 'breakout', 'sideways_bb_std_mult': 1.931696531983696, 'sideways_rsi_os': 42, 'sideways_rsi_ob': 90, 'sideways_adx_thresh': 32.72452447804102, 'sideways_atr_min_pct': 0.024661058881119302, 'sideways_atr_max_pct': 0.13930553374059987, 'sideways_tp_mult': 2.7266240548794047, 'sideways_tsl_mult': 0.3449487399883212, 'sideways_time_stop': 83, 'sideways_use_sma': False, 'sideways_use_ema': True, 'sideways_use_atr': True, 'sideways_use_adx': True, 'sideways_use_spike': True, 'sideways_rsi_required': False}.
[I 2025-09-01 11:46:51,022] Trial 413 finished with values: [-1000000000.0, 1000000000.0] and parameters: {'p_sma': 27, 'p_std': 33, 'p_atr': 20, 'p_adx': 7, 'rsi_period': 48, 'ema1': 24, 'ema2': 18, 'slip_atr_k': 0.03141998915055808, 'slip_spread_k': 0.4212602544200566, 'spread_hl_frac': 0.0018655163540144063, 'bb_std_mult': 0.9771421123004449, 'rsi_os': 30, 'rsi_ob': 45, 'vol_spike': 0.21789092507931235, 'adx_thresh': 23.50572275351706, 'atr_min_pct': 0.024632483519305158, 'atr_max_pct': 0.07626298505015701, 'tp_mult': 2.032651559188028, 'tsl_mult': 0.07304729982111069, 'strategy': 'breakout', 'time_stop': 186, 'use_sma': False, 'use_atr': True, 'use_adx': True, 'use_ema': True, 'use_spike': False, 'rsi_required': False, 'edge_k': 0.2287097759141753, 'edge_cap': 0.060945772105527124, 'bull_strategy': 'mean_reversion', 'bull_bb_std_mult': 1.7032862321998397, 'bull_rsi_os': 49, 'bull_rsi_ob': 50, 'bull_adx_thresh': 5.286840322652897, 'bull_atr_min_pct': 0.017381018234522053, 'bull_atr_max_pct': 0.10555974641719941, 'bull_tp_mult': 1.2071823181502577, 'bull_tsl_mult': 0.6441534416120384, 'bull_time_stop': 46, 'bull_use_sma': False, 'bull_use_ema': False, 'bull_use_atr': True, 'bull_use_adx': False, 'bull_use_spike': False, 'bull_rsi_required': False, 'bear_strategy': 'breakout', 'bear_bb_std_mult': 1.2544709475807037, 'bear_rsi_os': 29, 'bear_rsi_ob': 50, 'bear_adx_thresh': 7.469858039972522, 'bear_atr_min_pct': 0.005439800699998059, 'bear_atr_max_pct': 0.01973425763027834, 'bear_tp_mult': 1.4966144190650228, 'bear_tsl_mult': 0.9746921920960204, 'bear_time_stop': 60, 'bear_use_sma': True, 'bear_use_ema': False, 'bear_use_atr': True, 'bear_use_adx': True, 'bear_use_spike': False, 'bear_rsi_required': True, 'sideways_strategy': 'breakout', 'sideways_bb_std_mult': 1.9857916103479982, 'sideways_rsi_os': 42, 'sideways_rsi_ob': 91, 'sideways_adx_thresh': 31.546151537375046, 'sideways_atr_min_pct': 0.025571073653062812, 'sideways_atr_max_pct': 0.13175136269837956, 'sideways_tp_mult': 2.847168074712703, 'sideways_tsl_mult': 0.3364020380452821, 'sideways_time_stop': 80, 'sideways_use_sma': False, 'sideways_use_ema': False, 'sideways_use_atr': True, 'sideways_use_adx': True, 'sideways_use_spike': True, 'sideways_rsi_required': False}.
[I 2025-09-01 11:46:51,667] Trial 414 finished with values: [-1000000000.0, 1000000000.0] and parameters: {'p_sma': 24, 'p_std': 32, 'p_atr': 20, 'p_adx': 7, 'rsi_period': 48, 'ema1': 24, 'ema2': 17, 'slip_atr_k': 0.03195340101725483, 'slip_spread_k': 0.41978794751816634, 'spread_hl_frac': 0.002167707009896694, 'bb_std_mult': 0.9477879842866288, 'rsi_os': 30, 'rsi_ob': 87, 'vol_spike': 0.21545598148494208, 'adx_thresh': 23.56789975335738, 'atr_min_pct': 0.024657621811756274, 'atr_max_pct': 0.07639203724827318, 'tp_mult': 2.0242706502052124, 'tsl_mult': 0.07351069056704267, 'strategy': 'breakout', 'time_stop': 194, 'use_sma': False, 'use_atr': True, 'use_adx': True, 'use_ema': True, 'use_spike': False, 'rsi_required': False, 'edge_k': 0.22292340086707407, 'edge_cap': 0.062165774887981085, 'bull_strategy': 'mean_reversion', 'bull_bb_std_mult': 1.6872565897509186, 'bull_rsi_os': 48, 'bull_rsi_ob': 50, 'bull_adx_thresh': 5.42040077541663, 'bull_atr_min_pct': 0.01710129273973708, 'bull_atr_max_pct': 0.10532039190487116, 'bull_tp_mult': 1.231331945514098, 'bull_tsl_mult': 0.6364996331032465, 'bull_time_stop': 279, 'bull_use_sma': False, 'bull_use_ema': False, 'bull_use_atr': True, 'bull_use_adx': False, 'bull_use_spike': False, 'bull_rsi_required': False, 'bear_strategy': 'breakout', 'bear_bb_std_mult': 1.2546714805251569, 'bear_rsi_os': 29, 'bear_rsi_ob': 53, 'bear_adx_thresh': 8.557364232871448, 'bear_atr_min_pct': 0.005419312937773844, 'bear_atr_max_pct': 0.013987641833821604, 'bear_tp_mult': 1.4819410438992793, 'bear_tsl_mult': 0.9981462268589676, 'bear_time_stop': 222, 'bear_use_sma': True, 'bear_use_ema': False, 'bear_use_atr': True, 'bear_use_adx': True, 'bear_use_spike': False, 'bear_rsi_required': True, 'sideways_strategy': 'breakout', 'sideways_bb_std_mult': 1.967812223210643, 'sideways_rsi_os': 42, 'sideways_rsi_ob': 91, 'sideways_adx_thresh': 32.9086678464464, 'sideways_atr_min_pct': 0.026036372490246113, 'sideways_atr_max_pct': 0.1318658357321747, 'sideways_tp_mult': 2.7334215941561473, 'sideways_tsl_mult': 0.33460667131760874, 'sideways_time_stop': 80, 'sideways_use_sma': False, 'sideways_use_ema': False, 'sideways_use_atr': True, 'sideways_use_adx': True, 'sideways_use_spike': True, 'sideways_rsi_required': False}.
