[I 2025-09-01 11:02:15,683] Trial 124 finished with values: [-0.02694532287389284, 0.026966763598506086] and parameters: {'p_sma': 43, 'p_std': 29, 'p_atr': 7, 'p_adx': 26, 'rsi_period': 81, 'ema1': 18, 'ema2': 42, 'slip_atr_k': 0.0723743279980549, 'slip_spread_k': 0.5760235995165658, 'spread_hl_frac': 0.034016525964546865, 'bb_std_mult': 0.7581549880273402, 'rsi_os': 30, 'rsi_ob': 64, 'vol_spike': 0.013362922642648323, 'adx_thresh': 26.017755127360793, 'atr_min_pct': 0.01566172281802001, 'atr_max_pct': 0.08134802338545843, 'tp_mult': 1.3044352250304496, 'tsl_mult': 0.5501006957662322, 'strategy': 'mean_reversion', 'time_stop': 19, 'use_sma': True, 'use_atr': False, 'use_adx': True, 'use_ema': True, 'use_spike': False, 'rsi_required': True, 'edge_k': 1.810062457321985, 'edge_cap': 0.40235479459469164, 'bull_strategy': 'breakout', 'bull_bb_std_mult': 1.7071538514532376, 'bull_rsi_os': 52, 'bull_rsi_ob': 82, 'bull_adx_thresh': 27.596559619254144, 'bull_atr_min_pct': 0.0014498198122115682, 'bull_atr_max_pct': 0.11338523501978126, 'bull_tp_mult': 2.1056559124071996, 'bull_tsl_mult': 0.9372995793522119, 'bull_time_stop': 35, 'bull_use_sma': False, 'bull_use_ema': False, 'bull_use_atr': False, 'bull_use_adx': True, 'bull_use_spike': True, 'bull_rsi_required': False, 'bear_strategy': 'breakout', 'bear_bb_std_mult': 1.4266905651202737, 'bear_rsi_os': 40, 'bear_rsi_ob': 88, 'bear_adx_thresh': 20.381697084383646, 'bear_atr_min_pct': 0.02096116021504147, 'bear_atr_max_pct': 0.12352625968195315, 'bear_tp_mult': 2.821914742581196, 'bear_tsl_mult': 0.6346049653131356, 'bear_time_stop': 125, 'bear_use_sma': False, 'bear_use_ema': True, 'bear_use_atr': False, 'bear_use_adx': False, 'bear_use_spike': True, 'bear_rsi_required': False, 'sideways_strategy': 'mean_reversion', 'sideways_bb_std_mult': 3.44372369024923, 'sideways_rsi_os': 24, 'sideways_rsi_ob': 59, 'sideways_adx_thresh': 10.242260954084296, 'sideways_atr_min_pct': 0.0035552272829794205, 'sideways_atr_max_pct': 0.05471822695015248, 'sideways_tp_mult': 2.1917988878850663, 'sideways_tsl_mult': 0.328472289440605, 'sideways_time_stop': 273, 'sideways_use_sma': False, 'sideways_use_ema': True, 'sideways_use_atr': False, 'sideways_use_adx': False, 'sideways_use_spike': False, 'sideways_rsi_required': True}.
[I 2025-09-01 11:02:15,984] Trial 126 finished with values: [-0.008368150618577985, 0.008247610771894356] and parameters: {'p_sma': 11, 'p_std': 24, 'p_atr': 10, 'p_adx': 15, 'rsi_period': 34, 'ema1': 18, 'ema2': 47, 'slip_atr_k': 0.0005688779428155398, 'slip_spread_k': 0.4920765220510239, 'spread_hl_frac': 0.03544767945959837, 'bb_std_mult': 0.8948704132919811, 'rsi_os': 30, 'rsi_ob': 63, 'vol_spike': 0.015850774868881284, 'adx_thresh': 24.32273234817822, 'atr_min_pct': 0.013079080967474815, 'atr_max_pct': 0.05894119571061809, 'tp_mult': 1.2042470874154914, 'tsl_mult': 0.547952403854178, 'strategy': 'mean_reversion', 'time_stop': 155, 'use_sma': True, 'use_atr': False, 'use_adx': True, 'use_ema': True, 'use_spike': False, 'rsi_required': True, 'edge_k': 1.8254495581049224, 'edge_cap': 0.3974366723700102, 'bull_strategy': 'breakout', 'bull_bb_std_mult': 2.1926565593015472, 'bull_rsi_os': 52, 'bull_rsi_ob': 82, 'bull_adx_thresh': 27.749232858646373, 'bull_atr_min_pct': 0.0016992127890305023, 'bull_atr_max_pct': 0.10066036126715835, 'bull_tp_mult': 1.2071089614772, 'bull_tsl_mult': 0.11115522825398816, 'bull_time_stop': 35, 'bull_use_sma': False, 'bull_use_ema': False, 'bull_use_atr': False, 'bull_use_adx': True, 'bull_use_spike': True, 'bull_rsi_required': True, 'bear_strategy': 'breakout', 'bear_bb_std_mult': 1.4291523326437379, 'bear_rsi_os': 40, 'bear_rsi_ob': 88, 'bear_adx_thresh': 30.141570922482465, 'bear_atr_min_pct': 0.007740782984523394, 'bear_atr_max_pct': 0.12718236717497478, 'bear_tp_mult': 2.841577114779122, 'bear_tsl_mult': 0.07737002059629944, 'bear_time_stop': 124, 'bear_use_sma': False, 'bear_use_ema': True, 'bear_use_atr': False, 'bear_use_adx': False, 'bear_use_spike': True, 'bear_rsi_required': False, 'sideways_strategy': 'breakout', 'sideways_bb_std_mult': 0.5157808064510887, 'sideways_rsi_os': 24, 'sideways_rsi_ob': 48, 'sideways_adx_thresh': 11.678563266094288, 'sideways_atr_min_pct': 0.011606294166930382, 'sideways_atr_max_pct': 0.10374038098139393, 'sideways_tp_mult': 1.9380536676658309, 'sideways_tsl_mult': 0.007756165070385873, 'sideways_time_stop': 188, 'sideways_use_sma': False, 'sideways_use_ema': False, 'sideways_use_atr': False, 'sideways_use_adx': False, 'sideways_use_spike': False, 'sideways_rsi_required': True}.
[I 2025-09-01 11:02:57,895] Trial 130 finished with values: [-1000000000.0, 1000000000.0] and parameters: {'p_sma': 6, 'p_std': 26, 'p_atr': 8, 'p_adx': 20, 'rsi_period': 34, 'ema1': 17, 'ema2': 52, 'slip_atr_k': 0.12944707081726917, 'slip_spread_k': 0.12441030622220806, 'spread_hl_frac': 0.04905186030282359, 'bb_std_mult': 3.137444003745699, 'rsi_os': 25, 'rsi_ob': 62, 'vol_spike': 0.12663649547390193, 'adx_thresh': 7.024632230508622, 'atr_min_pct': 0.013575104429219017, 'atr_max_pct': 0.059189712397706325, 'tp_mult': 1.7846517543083658, 'tsl_mult': 0.596636690300557, 'strategy': 'breakout', 'time_stop': 194, 'use_sma': False, 'use_atr': True, 'use_adx': True, 'use_ema': True, 'use_spike': True, 'rsi_required': True, 'edge_k': 1.6351387823912393, 'edge_cap': 0.06441190910790706, 'bull_strategy': 'breakout', 'bull_bb_std_mult': 2.8184418883056663, 'bull_rsi_os': 28, 'bull_rsi_ob': 88, 'bull_adx_thresh': 29.507895260474054, 'bull_atr_min_pct': 0.025768190109102855, 'bull_atr_max_pct': 0.10359665595459354, 'bull_tp_mult': 1.7048832173881805, 'bull_tsl_mult': 0.9955625475891672, 'bull_time_stop': 219, 'bull_use_sma': False, 'bull_use_ema': False, 'bull_use_atr': False, 'bull_use_adx': True, 'bull_use_spike': True, 'bull_rsi_required': False, 'bear_strategy': 'breakout', 'bear_bb_std_mult': 1.3431024481636347, 'bear_rsi_os': 44, 'bear_rsi_ob': 93, 'bear_adx_thresh': 23.19137647169516, 'bear_atr_min_pct': 0.023671682043954728, 'bear_atr_max_pct': 0.05866156490772585, 'bear_tp_mult': 2.6700114072026553, 'bear_tsl_mult': 0.5034299305493457, 'bear_time_stop': 79, 'bear_use_sma': True, 'bear_use_ema': False, 'bear_use_atr': True, 'bear_use_adx': True, 'bear_use_spike': False, 'bear_rsi_required': False, 'sideways_strategy': 'breakout', 'sideways_bb_std_mult': 2.519424853354036, 'sideways_rsi_os': 22, 'sideways_rsi_ob': 57, 'sideways_adx_thresh': 20.988758649093707, 'sideways_atr_min_pct': 0.011587583784254106, 'sideways_atr_max_pct': 0.1034805414593078, 'sideways_tp_mult': 1.9787774534628988, 'sideways_tsl_mult': 0.03998485377290363, 'sideways_time_stop': 164, 'sideways_use_sma': False, 'sideways_use_ema': True, 'sideways_use_atr': False, 'sideways_use_adx': True, 'sideways_use_spike': False, 'sideways_rsi_required': False}.
[I 2025-09-01 11:02:59,044] Trial 131 finished with values: [-1000000000.0, 1000000000.0] and parameters: {'p_sma': 55, 'p_std': 26, 'p_atr': 8, 'p_adx': 20, 'rsi_period': 68, 'ema1': 20, 'ema2': 26, 'slip_atr_k': 0.03446031728370425, 'slip_spread_k': 0.10737830972202006, 'spread_hl_frac': 0.010592104336721937, 'bb_std_mult': 2.2127592843362485, 'rsi_os': 11, 'rsi_ob': 62, 'vol_spike': 0.12778639398747188, 'adx_thresh': 7.270393780900439, 'atr_min_pct': 0.014422386696063058, 'atr_max_pct': 0.05869777804606343, 'tp_mult': 1.7775220987896003, 'tsl_mult': 0.6035342228669296, 'strategy': 'mean_reversion', 'time_stop': 100, 'use_sma': True, 'use_atr': True, 'use_adx': True, 'use_ema': True, 'use_spike': True, 'rsi_required': True, 'edge_k': 0.012381546338195548, 'edge_cap': 0.5196876491065757, 'bull_strategy': 'breakout', 'bull_bb_std_mult': 2.1863232382140723, 'bull_rsi_os': 30, 'bull_rsi_ob': 76, 'bull_adx_thresh': 29.742899214764876, 'bull_atr_min_pct': 0.010164768110111022, 'bull_atr_max_pct': 0.07667450876450387, 'bull_tp_mult': 1.7258097009402653, 'bull_tsl_mult': 0.9830085201866872, 'bull_time_stop': 74, 'bull_use_sma': False, 'bull_use_ema': False, 'bull_use_atr': False, 'bull_use_adx': False, 'bull_use_spike': True, 'bull_rsi_required': False, 'bear_strategy': 'mean_reversion', 'bear_bb_std_mult': 1.0796003643521064, 'bear_rsi_os': 44, 'bear_rsi_ob': 60, 'bear_adx_thresh': 9.219455580950152, 'bear_atr_min_pct': 0.023264110092476524, 'bear_atr_max_pct': 0.11178099286912033, 'bear_tp_mult': 1.2125270688983192, 'bear_tsl_mult': 0.5069839480009498, 'bear_time_stop': 134, 'bear_use_sma': False, 'bear_use_ema': False, 'bear_use_atr': True, 'bear_use_adx': True, 'bear_use_spike': False, 'bear_rsi_required': False, 'sideways_strategy': 'breakout', 'sideways_bb_std_mult': 2.50099713720055, 'sideways_rsi_os': 20, 'sideways_rsi_ob': 48, 'sideways_adx_thresh': 12.086595406142683, 'sideways_atr_min_pct': 0.029050396759656136, 'sideways_atr_max_pct': 0.07953696747840824, 'sideways_tp_mult': 1.9730906563062276, 'sideways_tsl_mult': 0.036232864332310655, 'sideways_time_stop': 68, 'sideways_use_sma': True, 'sideways_use_ema': True, 'sideways_use_atr': False, 'sideways_use_adx': True, 'sideways_use_spike': False, 'sideways_rsi_required': False}.
[I 2025-09-01 11:02:59,606] Trial 128 finished with values: [-1000000000.0, 1000000000.0] and parameters: {'p_sma': 6, 'p_std': 24, 'p_atr': 14, 'p_adx': 26, 'rsi_period': 30, 'ema1': 17, 'ema2': 50, 'slip_atr_k': 0.07209998732767982, 'slip_spread_k': 0.4875476897964911, 'spread_hl_frac': 0.0115327756637308, 'bb_std_mult': 0.6722146058177851, 'rsi_os': 32, 'rsi_ob': 64, 'vol_spike': 0.11353409603211877, 'adx_thresh': 9.716016887619887, 'atr_min_pct': 0.01696868436201979, 'atr_max_pct': 0.06289052147768315, 'tp_mult': 1.084743868209374, 'tsl_mult': 0.6018688401288024, 'strategy': 'mean_reversion', 'time_stop': 43, 'use_sma': True, 'use_atr': True, 'use_adx': True, 'use_ema': True, 'use_spike': True, 'rsi_required': True, 'edge_k': 1.207226143743648, 'edge_cap': 0.06868569848529121, 'bull_strategy': 'breakout', 'bull_bb_std_mult': 2.189837737768696, 'bull_rsi_os': 22, 'bull_rsi_ob': 74, 'bull_adx_thresh': 29.778866853215288, 'bull_atr_min_pct': 0.004710721087145693, 'bull_atr_max_pct': 0.10056010385004602, 'bull_tp_mult': 1.7165847075079963, 'bull_tsl_mult': 0.9283514475020849, 'bull_time_stop': 19, 'bull_use_sma': False, 'bull_use_ema': False, 'bull_use_atr': False, 'bull_use_adx': False, 'bull_use_spike': True, 'bull_rsi_required': True, 'bear_strategy': 'breakout', 'bear_bb_std_mult': 1.2754980120820905, 'bear_rsi_os': 44, 'bear_rsi_ob': 93, 'bear_adx_thresh': 25.453793864049565, 'bear_atr_min_pct': 0.01889086375878116, 'bear_atr_max_pct': 0.02315096646181454, 'bear_tp_mult': 2.636209315215252, 'bear_tsl_mult': 0.5156038240872938, 'bear_time_stop': 135, 'bear_use_sma': False, 'bear_use_ema': False, 'bear_use_atr': True, 'bear_use_adx': True, 'bear_use_spike': False, 'bear_rsi_required': False, 'sideways_strategy': 'breakout', 'sideways_bb_std_mult': 2.0614597832520234, 'sideways_rsi_os': 33, 'sideways_rsi_ob': 56, 'sideways_adx_thresh': 11.529995801019638, 'sideways_atr_min_pct': 0.017562523984936438, 'sideways_atr_max_pct': 0.10452919213377414, 'sideways_tp_mult': 1.926025312783585, 'sideways_tsl_mult': 0.044120396868247515, 'sideways_time_stop': 237, 'sideways_use_sma': False, 'sideways_use_ema': True, 'sideways_use_atr': False, 'sideways_use_adx': True, 'sideways_use_spike': False, 'sideways_rsi_required': False}.
[I 2025-09-01 11:02:59,976] Trial 129 finished with values: [-1000000000.0, 1000000000.0] and parameters: {'p_sma': 49, 'p_std': 26, 'p_atr': 16, 'p_adx': 20, 'rsi_period': 46, 'ema1': 20, 'ema2': 27, 'slip_atr_k': 0.07143086495938365, 'slip_spread_k': 0.5769487762402805, 'spread_hl_frac': 0.03490221629149006, 'bb_std_mult': 2.217557408751609, 'rsi_os': 11, 'rsi_ob': 61, 'vol_spike': 0.12848356782457376, 'adx_thresh': 23.671196819823148, 'atr_min_pct': 0.014450851099252772, 'atr_max_pct': 0.05913310155295151, 'tp_mult': 1.7803198830629485, 'tsl_mult': 0.603662578795434, 'strategy': 'breakout', 'time_stop': 193, 'use_sma': False, 'use_atr': True, 'use_adx': True, 'use_ema': True, 'use_spike': True, 'rsi_required': True, 'edge_k': 1.8343608427587519, 'edge_cap': 0.5713241527500937, 'bull_strategy': 'breakout', 'bull_bb_std_mult': 0.6456195364529893, 'bull_rsi_os': 28, 'bull_rsi_ob': 74, 'bull_adx_thresh': 29.67593033424985, 'bull_atr_min_pct': 0.007521427429342841, 'bull_atr_max_pct': 0.08172092790667704, 'bull_tp_mult': 1.71338475299679, 'bull_tsl_mult': 0.9319001294324815, 'bull_time_stop': 30, 'bull_use_sma': False, 'bull_use_ema': False, 'bull_use_atr': False, 'bull_use_adx': True, 'bull_use_spike': True, 'bull_rsi_required': False, 'bear_strategy': 'breakout', 'bear_bb_std_mult': 1.0914251333721552, 'bear_rsi_os': 44, 'bear_rsi_ob': 93, 'bear_adx_thresh': 9.267510833072205, 'bear_atr_min_pct': 0.020891785530262812, 'bear_atr_max_pct': 0.06212238778442394, 'bear_tp_mult': 2.6559022358646898, 'bear_tsl_mult': 0.2032379380296819, 'bear_time_stop': 132, 'bear_use_sma': True, 'bear_use_ema': False, 'bear_use_atr': True, 'bear_use_adx': True, 'bear_use_spike': False, 'bear_rsi_required': False, 'sideways_strategy': 'breakout', 'sideways_bb_std_mult': 3.4846382110021215, 'sideways_rsi_os': 20, 'sideways_rsi_ob': 48, 'sideways_adx_thresh': 11.590692354647794, 'sideways_atr_min_pct': 0.022219180546869787, 'sideways_atr_max_pct': 0.10510578072330544, 'sideways_tp_mult': 2.07051870878216, 'sideways_tsl_mult': 0.2433630519384355, 'sideways_time_stop': 269, 'sideways_use_sma': False, 'sideways_use_ema': True, 'sideways_use_atr': False, 'sideways_use_adx': False, 'sideways_use_spike': False, 'sideways_rsi_required': True}.
[I 2025-09-01 11:03:40,786] Trial 134 finished with values: [-0.0113141390946766, 0.011494010107717757] and parameters: {'p_sma': 9, 'p_std': 5, 'p_atr': 16, 'p_adx': 15, 'rsi_period': 33, 'ema1': 19, 'ema2': 48, 'slip_atr_k': 0.016997764411471626, 'slip_spread_k': 0.21522840799772092, 'spread_hl_frac': 0.0018996285187582226, 'bb_std_mult': 0.5790560223838301, 'rsi_os': 27, 'rsi_ob': 94, 'vol_spike': 0.08178505824233594, 'adx_thresh': 17.357506780059715, 'atr_min_pct': 0.017855486675199327, 'atr_max_pct': 0.07247201097443035, 'tp_mult': 2.117836576190729, 'tsl_mult': 0.15935532304459216, 'strategy': 'breakout', 'time_stop': 84, 'use_sma': False, 'use_atr': True, 'use_adx': True, 'use_ema': True, 'use_spike': False, 'rsi_required': True, 'edge_k': 0.6422767122727852, 'edge_cap': 0.5530287398205622, 'bull_strategy': 'mean_reversion', 'bull_bb_std_mult': 2.257303460895013, 'bull_rsi_os': 19, 'bull_rsi_ob': 79, 'bull_adx_thresh': 30.33775271733427, 'bull_atr_min_pct': 0.0032210205715585863, 'bull_atr_max_pct': 0.06688810997510877, 'bull_tp_mult': 1.1940248986045252, 'bull_tsl_mult': 0.963805137314185, 'bull_time_stop': 26, 'bull_use_sma': False, 'bull_use_ema': False, 'bull_use_atr': False, 'bull_use_adx': True, 'bull_use_spike': True, 'bull_rsi_required': False, 'bear_strategy': 'breakout', 'bear_bb_std_mult': 0.5764063799809993, 'bear_rsi_os': 38, 'bear_rsi_ob': 90, 'bear_adx_thresh': 33.862405971100245, 'bear_atr_min_pct': 0.021650565732217412, 'bear_atr_max_pct': 0.10565350778458865, 'bear_tp_mult': 1.0764427483767376, 'bear_tsl_mult': 0.21167648984939888, 'bear_time_stop': 153, 'bear_use_sma': True, 'bear_use_ema': False, 'bear_use_atr': True, 'bear_use_adx': False, 'bear_use_spike': True, 'bear_rsi_required': False, 'sideways_strategy': 'breakout', 'sideways_bb_std_mult': 0.5204986904128175, 'sideways_rsi_os': 31, 'sideways_rsi_ob': 76, 'sideways_adx_thresh': 13.858548829023404, 'sideways_atr_min_pct': 0.018703066647039645, 'sideways_atr_max_pct': 0.09154387235711829, 'sideways_tp_mult': 2.0763570462078955, 'sideways_tsl_mult': 0.546273037353992, 'sideways_time_stop': 150, 'sideways_use_sma': False, 'sideways_use_ema': False, 'sideways_use_atr': False, 'sideways_use_adx': False, 'sideways_use_spike': False, 'sideways_rsi_required': True}.
[I 2025-09-01 11:03:41,209] Trial 135 finished with values: [-1000000000.0, 1000000000.0] and parameters: {'p_sma': 9, 'p_std': 23, 'p_atr': 9, 'p_adx': 14, 'rsi_period': 63, 'ema1': 16, 'ema2': 48, 'slip_atr_k': 0.0173666575302107, 'slip_spread_k': 0.9384853164991498, 'spread_hl_frac': 0.013551201124970377, 'bb_std_mult': 0.5612478301364527, 'rsi_os': 27, 'rsi_ob': 94, 'vol_spike': 0.1512772925542565, 'adx_thresh': 5.630383174686792, 'atr_min_pct': 0.017597052672449758, 'atr_max_pct': 0.07298859127092441, 'tp_mult': 1.6582956418437598, 'tsl_mult': 0.570995156871172, 'strategy': 'mean_reversion', 'time_stop': 203, 'use_sma': True, 'use_atr': True, 'use_adx': True, 'use_ema': True, 'use_spike': False, 'rsi_required': True, 'edge_k': 0.6312281798442986, 'edge_cap': 0.6559907823525435, 'bull_strategy': 'mean_reversion', 'bull_bb_std_mult': 3.4400168781482545, 'bull_rsi_os': 24, 'bull_rsi_ob': 68, 'bull_adx_thresh': 30.965956981800954, 'bull_atr_min_pct': 0.029528264335378723, 'bull_atr_max_pct': 0.10866908900024168, 'bull_tp_mult': 2.610836912781926, 'bull_tsl_mult': 0.9612226360328189, 'bull_time_stop': 85, 'bull_use_sma': True, 'bull_use_ema': False, 'bull_use_atr': True, 'bull_use_adx': True, 'bull_use_spike': True, 'bull_rsi_required': False, 'bear_strategy': 'breakout', 'bear_bb_std_mult': 2.0790778255399016, 'bear_rsi_os': 38, 'bear_rsi_ob': 90, 'bear_adx_thresh': 21.163720971767358, 'bear_atr_min_pct': 0.019980483859479946, 'bear_atr_max_pct': 0.09262024885780797, 'bear_tp_mult': 1.0730785729603085, 'bear_tsl_mult': 0.13819504368486243, 'bear_time_stop': 291, 'bear_use_sma': False, 'bear_use_ema': False, 'bear_use_atr': True, 'bear_use_adx': False, 'bear_use_spike': True, 'bear_rsi_required': False, 'sideways_strategy': 'mean_reversion', 'sideways_bb_std_mult': 0.5771037008247062, 'sideways_rsi_os': 23, 'sideways_rsi_ob': 46, 'sideways_adx_thresh': 19.948020365121593, 'sideways_atr_min_pct': 0.016022775265181737, 'sideways_atr_max_pct': 0.029782386072110215, 'sideways_tp_mult': 2.150238152422101, 'sideways_tsl_mult': 0.5443076694691306, 'sideways_time_stop': 87, 'sideways_use_sma': False, 'sideways_use_ema': False, 'sideways_use_atr': False, 'sideways_use_adx': False, 'sideways_use_spike': False, 'sideways_rsi_required': True}.
[I 2025-09-01 11:03:41,793] Trial 133 finished with values: [-1000000000.0, 1000000000.0] and parameters: {'p_sma': 12, 'p_std': 32, 'p_atr': 9, 'p_adx': 15, 'rsi_period': 28, 'ema1': 16, 'ema2': 48, 'slip_atr_k': 0.06627296640559141, 'slip_spread_k': 0.20759015716950727, 'spread_hl_frac': 0.013425678438560297, 'bb_std_mult': 3.049588596580892, 'rsi_os': 27, 'rsi_ob': 73, 'vol_spike': 0.15238454295948475, 'adx_thresh': 5.677726411211139, 'atr_min_pct': 0.017442546878781637, 'atr_max_pct': 0.07215560796365114, 'tp_mult': 2.104505193875575, 'tsl_mult': 0.8719231333630449, 'strategy': 'mean_reversion', 'time_stop': 44, 'use_sma': True, 'use_atr': True, 'use_adx': True, 'use_ema': True, 'use_spike': False, 'rsi_required': True, 'edge_k': 1.8513732256562627, 'edge_cap': 0.6660707682999546, 'bull_strategy': 'breakout', 'bull_bb_std_mult': 1.978596468702603, 'bull_rsi_os': 19, 'bull_rsi_ob': 95, 'bull_adx_thresh': 30.067833466423068, 'bull_atr_min_pct': 0.0032609816724546545, 'bull_atr_max_pct': 0.12380561151969557, 'bull_tp_mult': 1.170829190202431, 'bull_tsl_mult': 0.27817453746253906, 'bull_time_stop': 26, 'bull_use_sma': False, 'bull_use_ema': False, 'bull_use_atr': False, 'bull_use_adx': True, 'bull_use_spike': True, 'bull_rsi_required': False, 'bear_strategy': 'breakout', 'bear_bb_std_mult': 0.5024076298990794, 'bear_rsi_os': 38, 'bear_rsi_ob': 90, 'bear_adx_thresh': 20.938868142471037, 'bear_atr_min_pct': 0.021671096847342544, 'bear_atr_max_pct': 0.1463254871104235, 'bear_tp_mult': 2.43895110035544, 'bear_tsl_mult': 0.13804791528575738, 'bear_time_stop': 112, 'bear_use_sma': False, 'bear_use_ema': False, 'bear_use_atr': True, 'bear_use_adx': False, 'bear_use_spike': False, 'bear_rsi_required': False, 'sideways_strategy': 'breakout', 'sideways_bb_std_mult': 3.519287663187849, 'sideways_rsi_os': 48, 'sideways_rsi_ob': 53, 'sideways_adx_thresh': 8.60329744772781, 'sideways_atr_min_pct': 0.022191818148211938, 'sideways_atr_max_pct': 0.011726892256139224, 'sideways_tp_mult': 1.7720200569981726, 'sideways_tsl_mult': 0.01733231532778436, 'sideways_time_stop': 85, 'sideways_use_sma': False, 'sideways_use_ema': True, 'sideways_use_atr': False, 'sideways_use_adx': False, 'sideways_use_spike': False, 'sideways_rsi_required': True}.
