[I 2025-09-01 11:31:13,386] Trial 327 finished with values: [-1000000000.0, 1000000000.0] and parameters: {'p_sma': 11, 'p_std': 37, 'p_atr': 19, 'p_adx': 10, 'rsi_period': 52, 'ema1': 19, 'ema2': 14, 'slip_atr_k': 0.0060412292198519, 'slip_spread_k': 0.397575490529017, 'spread_hl_frac': 0.02767292389367098, 'bb_std_mult': 3.1687488808882143, 'rsi_os': 30, 'rsi_ob': 85, 'vol_spike': 0.2983661838761759, 'adx_thresh': 21.948941995903787, 'atr_min_pct': 0.027600038750519734, 'atr_max_pct': 0.024649118224726072, 'tp_mult': 2.262419137756735, 'tsl_mult': 0.915218539244926, 'strategy': 'breakout', 'time_stop': 273, 'use_sma': False, 'use_atr': False, 'use_adx': False, 'use_ema': True, 'use_spike': True, 'rsi_required': False, 'edge_k': 0.3847602296990934, 'edge_cap': 0.17494084528724702, 'bull_strategy': 'breakout', 'bull_bb_std_mult': 0.9070668115415341, 'bull_rsi_os': 52, 'bull_rsi_ob': 82, 'bull_adx_thresh': 6.898866313074984, 'bull_atr_min_pct': 0.003650127526715996, 'bull_atr_max_pct': 0.09637566206807678, 'bull_tp_mult': 1.8406362909635516, 'bull_tsl_mult': 0.4732930404805635, 'bull_time_stop': 273, 'bull_use_sma': True, 'bull_use_ema': True, 'bull_use_atr': True, 'bull_use_adx': True, 'bull_use_spike': True, 'bull_rsi_required': False, 'bear_strategy': 'breakout', 'bear_bb_std_mult': 1.074317793534966, 'bear_rsi_os': 15, 'bear_rsi_ob': 46, 'bear_adx_thresh': 9.656884515772253, 'bear_atr_min_pct': 0.004154623213819432, 'bear_atr_max_pct': 0.03160210875005792, 'bear_tp_mult': 1.2302013614162448, 'bear_tsl_mult': 0.9982132197563496, 'bear_time_stop': 76, 'bear_use_sma': True, 'bear_use_ema': True, 'bear_use_atr': False, 'bear_use_adx': False, 'bear_use_spike': True, 'bear_rsi_required': True, 'sideways_strategy': 'mean_reversion', 'sideways_bb_std_mult': 2.054825750348062, 'sideways_rsi_os': 48, 'sideways_rsi_ob': 94, 'sideways_adx_thresh': 5.461158013246742, 'sideways_atr_min_pct': 0.02357870081375532, 'sideways_atr_max_pct': 0.07987164350981997, 'sideways_tp_mult': 1.3848349938603381, 'sideways_tsl_mult': 0.40001770715160573, 'sideways_time_stop': 247, 'sideways_use_sma': True, 'sideways_use_ema': True, 'sideways_use_atr': True, 'sideways_use_adx': False, 'sideways_use_spike': False, 'sideways_rsi_required': True}.
[I 2025-09-01 11:31:14,060] Trial 328 finished with values: [-1000000000.0, 1000000000.0] and parameters: {'p_sma': 10, 'p_std': 38, 'p_atr': 19, 'p_adx': 9, 'rsi_period': 51, 'ema1': 19, 'ema2': 12, 'slip_atr_k': 0.009863627210849647, 'slip_spread_k': 0.4107704585096774, 'spread_hl_frac': 0.026232796191481594, 'bb_std_mult': 3.243684897051308, 'rsi_os': 29, 'rsi_ob': 87, 'vol_spike': 0.28437321636020024, 'adx_thresh': 22.72107052459393, 'atr_min_pct': 0.027195875890086103, 'atr_max_pct': 0.026116770227747818, 'tp_mult': 2.3241001186306303, 'tsl_mult': 0.8903752876677421, 'strategy': 'breakout', 'time_stop': 265, 'use_sma': False, 'use_atr': False, 'use_adx': False, 'use_ema': True, 'use_spike': True, 'rsi_required': False, 'edge_k': 0.4115895605780936, 'edge_cap': 0.15583988005249488, 'bull_strategy': 'breakout', 'bull_bb_std_mult': 1.1522710522090072, 'bull_rsi_os': 51, 'bull_rsi_ob': 84, 'bull_adx_thresh': 6.307932419390523, 'bull_atr_min_pct': 0.004768958415991516, 'bull_atr_max_pct': 0.10124195374514491, 'bull_tp_mult': 1.9434810316699773, 'bull_tsl_mult': 0.4982372882965394, 'bull_time_stop': 298, 'bull_use_sma': True, 'bull_use_ema': True, 'bull_use_atr': True, 'bull_use_adx': True, 'bull_use_spike': True, 'bull_rsi_required': False, 'bear_strategy': 'breakout', 'bear_bb_std_mult': 1.0416921696318906, 'bear_rsi_os': 5, 'bear_rsi_ob': 46, 'bear_adx_thresh': 8.536483114191965, 'bear_atr_min_pct': 0.0018003796714972705, 'bear_atr_max_pct': 0.031623463508841564, 'bear_tp_mult': 1.2821299898674108, 'bear_tsl_mult': 0.8885913188047119, 'bear_time_stop': 73, 'bear_use_sma': True, 'bear_use_ema': True, 'bear_use_atr': False, 'bear_use_adx': False, 'bear_use_spike': True, 'bear_rsi_required': True, 'sideways_strategy': 'mean_reversion', 'sideways_bb_std_mult': 1.675618582791443, 'sideways_rsi_os': 44, 'sideways_rsi_ob': 93, 'sideways_adx_thresh': 7.044625815671635, 'sideways_atr_min_pct': 0.02289887954114248, 'sideways_atr_max_pct': 0.08324639339259875, 'sideways_tp_mult': 1.445577068315101, 'sideways_tsl_mult': 0.38420838119993656, 'sideways_time_stop': 257, 'sideways_use_sma': True, 'sideways_use_ema': True, 'sideways_use_atr': True, 'sideways_use_adx': False, 'sideways_use_spike': False, 'sideways_rsi_required': True}.
[I 2025-09-01 11:31:53,445] Trial 323 finished with values: [-0.011525907041040617, 0.011807402532878644] and parameters: {'p_sma': 12, 'p_std': 39, 'p_atr': 8, 'p_adx': 15, 'rsi_period': 49, 'ema1': 20, 'ema2': 38, 'slip_atr_k': 0.007310066030244751, 'slip_spread_k': 0.04835875336534219, 'spread_hl_frac': 0.01409651861297252, 'bb_std_mult': 3.1760756587637657, 'rsi_os': 46, 'rsi_ob': 86, 'vol_spike': 0.2996280545669337, 'adx_thresh': 9.380855691710407, 'atr_min_pct': 0.029339051217682877, 'atr_max_pct': 0.03831564311481778, 'tp_mult': 2.6937528405485, 'tsl_mult': 0.8611152348514018, 'strategy': 'breakout', 'time_stop': 232, 'use_sma': False, 'use_atr': False, 'use_adx': False, 'use_ema': True, 'use_spike': True, 'rsi_required': False, 'edge_k': 0.1541986881270967, 'edge_cap': 0.26431263058769416, 'bull_strategy': 'breakout', 'bull_bb_std_mult': 0.6749952507847565, 'bull_rsi_os': 50, 'bull_rsi_ob': 95, 'bull_adx_thresh': 31.740381228764406, 'bull_atr_min_pct': 0.0015104953386116046, 'bull_atr_max_pct': 0.0916827636714779, 'bull_tp_mult': 2.760469976713135, 'bull_tsl_mult': 0.7802483519321065, 'bull_time_stop': 293, 'bull_use_sma': True, 'bull_use_ema': True, 'bull_use_atr': True, 'bull_use_adx': True, 'bull_use_spike': False, 'bull_rsi_required': True, 'bear_strategy': 'breakout', 'bear_bb_std_mult': 1.6982183800790955, 'bear_rsi_os': 37, 'bear_rsi_ob': 54, 'bear_adx_thresh': 17.671936511601672, 'bear_atr_min_pct': 0.003093171675706943, 'bear_atr_max_pct': 0.021463600237401743, 'bear_tp_mult': 1.302880154604541, 'bear_tsl_mult': 0.3030916819870723, 'bear_time_stop': 70, 'bear_use_sma': True, 'bear_use_ema': True, 'bear_use_atr': False, 'bear_use_adx': False, 'bear_use_spike': True, 'bear_rsi_required': True, 'sideways_strategy': 'mean_reversion', 'sideways_bb_std_mult': 3.53872351522846, 'sideways_rsi_os': 39, 'sideways_rsi_ob': 93, 'sideways_adx_thresh': 23.678697771700783, 'sideways_atr_min_pct': 0.022993467108810183, 'sideways_atr_max_pct': 0.014234322073332084, 'sideways_tp_mult': 1.7670251613597632, 'sideways_tsl_mult': 0.7655055308995175, 'sideways_time_stop': 256, 'sideways_use_sma': True, 'sideways_use_ema': True, 'sideways_use_atr': True, 'sideways_use_adx': False, 'sideways_use_spike': False, 'sideways_rsi_required': True}.
[I 2025-09-01 11:31:53,468] Trial 322 finished with values: [-0.05012570589664933, 0.04970070284845591] and parameters: {'p_sma': 52, 'p_std': 24, 'p_atr': 8, 'p_adx': 9, 'rsi_period': 51, 'ema1': 20, 'ema2': 38, 'slip_atr_k': 0.2085170778268299, 'slip_spread_k': 0.9239272882771101, 'spread_hl_frac': 0.027266612344185582, 'bb_std_mult': 3.2303691309159253, 'rsi_os': 36, 'rsi_ob': 86, 'vol_spike': 0.25419323524620013, 'adx_thresh': 21.924371291204945, 'atr_min_pct': 0.011964478263830652, 'atr_max_pct': 0.04516905266332844, 'tp_mult': 2.6962963466096665, 'tsl_mult': 0.021313438082277647, 'strategy': 'breakout', 'time_stop': 82, 'use_sma': False, 'use_atr': False, 'use_adx': False, 'use_ema': True, 'use_spike': True, 'rsi_required': False, 'edge_k': 1.1969124345539313, 'edge_cap': 0.25846902872776184, 'bull_strategy': 'breakout', 'bull_bb_std_mult': 1.5784358074047113, 'bull_rsi_os': 18, 'bull_rsi_ob': 84, 'bull_adx_thresh': 25.388592807210557, 'bull_atr_min_pct': 0.009339620032461252, 'bull_atr_max_pct': 0.09174898806375113, 'bull_tp_mult': 2.5575802735700464, 'bull_tsl_mult': 0.7696626636796219, 'bull_time_stop': 209, 'bull_use_sma': True, 'bull_use_ema': True, 'bull_use_atr': True, 'bull_use_adx': True, 'bull_use_spike': False, 'bull_rsi_required': True, 'bear_strategy': 'breakout', 'bear_bb_std_mult': 0.8974106059313834, 'bear_rsi_os': 37, 'bear_rsi_ob': 54, 'bear_adx_thresh': 17.836229316950742, 'bear_atr_min_pct': 0.003083808720419457, 'bear_atr_max_pct': 0.027345179240879702, 'bear_tp_mult': 2.0911827202819344, 'bear_tsl_mult': 0.976299525397829, 'bear_time_stop': 169, 'bear_use_sma': True, 'bear_use_ema': True, 'bear_use_atr': False, 'bear_use_adx': False, 'bear_use_spike': True, 'bear_rsi_required': True, 'sideways_strategy': 'mean_reversion', 'sideways_bb_std_mult': 3.530751197146809, 'sideways_rsi_os': 48, 'sideways_rsi_ob': 94, 'sideways_adx_thresh': 23.933550855889077, 'sideways_atr_min_pct': 0.022913623118424126, 'sideways_atr_max_pct': 0.1323824908141683, 'sideways_tp_mult': 1.755504075372766, 'sideways_tsl_mult': 0.4625707729475406, 'sideways_time_stop': 128, 'sideways_use_sma': True, 'sideways_use_ema': True, 'sideways_use_atr': True, 'sideways_use_adx': False, 'sideways_use_spike': False, 'sideways_rsi_required': True}.
[I 2025-09-01 11:31:53,771] Trial 325 finished with values: [0.0018653921052258493, 0.006058857536374259] and parameters: {'p_sma': 10, 'p_std': 38, 'p_atr': 19, 'p_adx': 9, 'rsi_period': 52, 'ema1': 20, 'ema2': 15, 'slip_atr_k': 0.006996500036737479, 'slip_spread_k': 0.391015391991949, 'spread_hl_frac': 0.02569596325200324, 'bb_std_mult': 3.2356679333299994, 'rsi_os': 29, 'rsi_ob': 85, 'vol_spike': 0.29825518470673995, 'adx_thresh': 22.18400809340201, 'atr_min_pct': 0.027126085003410186, 'atr_max_pct': 0.0279622305100825, 'tp_mult': 2.1575787382904323, 'tsl_mult': 0.9139048044020259, 'strategy': 'breakout', 'time_stop': 268, 'use_sma': False, 'use_atr': False, 'use_adx': False, 'use_ema': True, 'use_spike': True, 'rsi_required': False, 'edge_k': 0.41700928110329905, 'edge_cap': 0.21617223195527369, 'bull_strategy': 'breakout', 'bull_bb_std_mult': 1.080927201387699, 'bull_rsi_os': 52, 'bull_rsi_ob': 83, 'bull_adx_thresh': 7.298799036492978, 'bull_atr_min_pct': 0.004184470347964604, 'bull_atr_max_pct': 0.09690324210739884, 'bull_tp_mult': 1.9214291617011767, 'bull_tsl_mult': 0.44291576103960406, 'bull_time_stop': 292, 'bull_use_sma': True, 'bull_use_ema': True, 'bull_use_atr': True, 'bull_use_adx': True, 'bull_use_spike': True, 'bull_rsi_required': False, 'bear_strategy': 'breakout', 'bear_bb_std_mult': 1.0352133722877632, 'bear_rsi_os': 12, 'bear_rsi_ob': 46, 'bear_adx_thresh': 9.693002503739713, 'bear_atr_min_pct': 0.0033647181778886748, 'bear_atr_max_pct': 0.03169423014026757, 'bear_tp_mult': 1.2874944062354827, 'bear_tsl_mult': 0.9498868428876516, 'bear_time_stop': 71, 'bear_use_sma': True, 'bear_use_ema': True, 'bear_use_atr': False, 'bear_use_adx': False, 'bear_use_spike': True, 'bear_rsi_required': True, 'sideways_strategy': 'mean_reversion', 'sideways_bb_std_mult': 1.9766559685710838, 'sideways_rsi_os': 39, 'sideways_rsi_ob': 95, 'sideways_adx_thresh': 5.46769148863118, 'sideways_atr_min_pct': 0.02255877555690808, 'sideways_atr_max_pct': 0.07876704219067131, 'sideways_tp_mult': 1.3765063434209233, 'sideways_tsl_mult': 0.3993451744005343, 'sideways_time_stop': 255, 'sideways_use_sma': True, 'sideways_use_ema': True, 'sideways_use_atr': True, 'sideways_use_adx': False, 'sideways_use_spike': False, 'sideways_rsi_required': True}.
[I 2025-09-01 11:31:56,239] Trial 329 finished with values: [-0.0062435764421142625, 0.008935018603669007] and parameters: {'p_sma': 11, 'p_std': 37, 'p_atr': 20, 'p_adx': 7, 'rsi_period': 51, 'ema1': 19, 'ema2': 19, 'slip_atr_k': 0.012737603193043828, 'slip_spread_k': 0.33390502540077927, 'spread_hl_frac': 0.026841748783681275, 'bb_std_mult': 3.1809451503759116, 'rsi_os': 29, 'rsi_ob': 85, 'vol_spike': 0.26167118392913036, 'adx_thresh': 22.162628505933267, 'atr_min_pct': 0.02733418923627422, 'atr_max_pct': 0.02839894654711595, 'tp_mult': 2.370713218125543, 'tsl_mult': 0.9013271484935143, 'strategy': 'breakout', 'time_stop': 269, 'use_sma': False, 'use_atr': False, 'use_adx': False, 'use_ema': True, 'use_spike': True, 'rsi_required': False, 'edge_k': 0.3667398532081215, 'edge_cap': 0.21935018187470165, 'bull_strategy': 'breakout', 'bull_bb_std_mult': 0.7174140090386452, 'bull_rsi_os': 51, 'bull_rsi_ob': 84, 'bull_adx_thresh': 7.677108415857283, 'bull_atr_min_pct': 0.005221938374152541, 'bull_atr_max_pct': 0.09488308116350962, 'bull_tp_mult': 2.0478502432630474, 'bull_tsl_mult': 0.4388994909767013, 'bull_time_stop': 292, 'bull_use_sma': True, 'bull_use_ema': True, 'bull_use_atr': True, 'bull_use_adx': True, 'bull_use_spike': True, 'bull_rsi_required': False, 'bear_strategy': 'breakout', 'bear_bb_std_mult': 1.0052652820282377, 'bear_rsi_os': 6, 'bear_rsi_ob': 46, 'bear_adx_thresh': 10.491410145708368, 'bear_atr_min_pct': 0.0033409036477034977, 'bear_atr_max_pct': 0.03497512944441065, 'bear_tp_mult': 1.3456991326998753, 'bear_tsl_mult': 0.9573902128705298, 'bear_time_stop': 80, 'bear_use_sma': True, 'bear_use_ema': True, 'bear_use_atr': False, 'bear_use_adx': False, 'bear_use_spike': True, 'bear_rsi_required': True, 'sideways_strategy': 'mean_reversion', 'sideways_bb_std_mult': 1.9280660817280055, 'sideways_rsi_os': 37, 'sideways_rsi_ob': 93, 'sideways_adx_thresh': 6.084795621415726, 'sideways_atr_min_pct': 0.021853690398773922, 'sideways_atr_max_pct': 0.08350037987520957, 'sideways_tp_mult': 1.4034267297525316, 'sideways_tsl_mult': 0.4248865611564341, 'sideways_time_stop': 243, 'sideways_use_sma': True, 'sideways_use_ema': True, 'sideways_use_atr': True, 'sideways_use_adx': False, 'sideways_use_spike': False, 'sideways_rsi_required': True}.
[I 2025-09-01 11:32:37,304] Trial 330 finished with values: [-1000000000.0, 1000000000.0] and parameters: {'p_sma': 11, 'p_std': 37, 'p_atr': 20, 'p_adx': 7, 'rsi_period': 53, 'ema1': 19, 'ema2': 16, 'slip_atr_k': 0.2462075826456533, 'slip_spread_k': 0.37012241287313763, 'spread_hl_frac': 0.026950240555624266, 'bb_std_mult': 3.3056947790030238, 'rsi_os': 28, 'rsi_ob': 87, 'vol_spike': 0.29273631805352196, 'adx_thresh': 24.134069536008667, 'atr_min_pct': 0.027389008435014538, 'atr_max_pct': 0.02880808793313719, 'tp_mult': 2.40266004829897, 'tsl_mult': 0.9035880833398737, 'strategy': 'breakout', 'time_stop': 270, 'use_sma': False, 'use_atr': False, 'use_adx': False, 'use_ema': True, 'use_spike': True, 'rsi_required': False, 'edge_k': 0.34983735093483653, 'edge_cap': 0.12518454242896088, 'bull_strategy': 'breakout', 'bull_bb_std_mult': 0.8853342880991742, 'bull_rsi_os': 52, 'bull_rsi_ob': 83, 'bull_adx_thresh': 5.021771243142851, 'bull_atr_min_pct': 0.0051570046774489465, 'bull_atr_max_pct': 0.09672056408857209, 'bull_tp_mult': 2.042259607106679, 'bull_tsl_mult': 0.4461576999120205, 'bull_time_stop': 278, 'bull_use_sma': True, 'bull_use_ema': True, 'bull_use_atr': True, 'bull_use_adx': True, 'bull_use_spike': True, 'bull_rsi_required': False, 'bear_strategy': 'breakout', 'bear_bb_std_mult': 1.0286281627328784, 'bear_rsi_os': 6, 'bear_rsi_ob': 46, 'bear_adx_thresh': 10.787339329734735, 'bear_atr_min_pct': 0.0037204089967395096, 'bear_atr_max_pct': 0.034824873084287, 'bear_tp_mult': 1.3528893398562358, 'bear_tsl_mult': 0.948337346390258, 'bear_time_stop': 78, 'bear_use_sma': True, 'bear_use_ema': True, 'bear_use_atr': False, 'bear_use_adx': False, 'bear_use_spike': True, 'bear_rsi_required': True, 'sideways_strategy': 'mean_reversion', 'sideways_bb_std_mult': 1.8355773289177009, 'sideways_rsi_os': 37, 'sideways_rsi_ob': 95, 'sideways_adx_thresh': 6.317081735726086, 'sideways_atr_min_pct': 0.021951784568026912, 'sideways_atr_max_pct': 0.08475827442415323, 'sideways_tp_mult': 1.406163314725493, 'sideways_tsl_mult': 0.4370466516186339, 'sideways_time_stop': 243, 'sideways_use_sma': True, 'sideways_use_ema': True, 'sideways_use_atr': True, 'sideways_use_adx': False, 'sideways_use_spike': False, 'sideways_rsi_required': True}.
[I 2025-09-01 11:32:38,053] Trial 331 finished with values: [-1000000000.0, 1000000000.0] and parameters: {'p_sma': 11, 'p_std': 36, 'p_atr': 20, 'p_adx': 9, 'rsi_period': 53, 'ema1': 19, 'ema2': 15, 'slip_atr_k': 0.011278629519340586, 'slip_spread_k': 0.3371256144006292, 'spread_hl_frac': 0.02666946560633422, 'bb_std_mult': 3.3065824329180313, 'rsi_os': 28, 'rsi_ob': 87, 'vol_spike': 0.29126636610620604, 'adx_thresh': 22.411192126327336, 'atr_min_pct': 0.027280341410812984, 'atr_max_pct': 0.02885347458091627, 'tp_mult': 2.2254888251983167, 'tsl_mult': 0.9085035970715082, 'strategy': 'breakout', 'time_stop': 267, 'use_sma': False, 'use_atr': False, 'use_adx': False, 'use_ema': True, 'use_spike': True, 'rsi_required': False, 'edge_k': 0.3488913989743579, 'edge_cap': 0.23200147531272544, 'bull_strategy': 'breakout', 'bull_bb_std_mult': 0.7483666419223101, 'bull_rsi_os': 52, 'bull_rsi_ob': 83, 'bull_adx_thresh': 8.107242168589657, 'bull_atr_min_pct': 0.003955501749032016, 'bull_atr_max_pct': 0.09676470675455885, 'bull_tp_mult': 1.961530749311377, 'bull_tsl_mult': 0.44840288826040636, 'bull_time_stop': 287, 'bull_use_sma': True, 'bull_use_ema': True, 'bull_use_atr': True, 'bull_use_adx': True, 'bull_use_spike': True, 'bull_rsi_required': False, 'bear_strategy': 'breakout', 'bear_bb_std_mult': 1.0012111917940243, 'bear_rsi_os': 11, 'bear_rsi_ob': 46, 'bear_adx_thresh': 10.230122405055837, 'bear_atr_min_pct': 0.004620004439318239, 'bear_atr_max_pct': 0.03574571547472945, 'bear_tp_mult': 1.352571415789317, 'bear_tsl_mult': 0.9553606255005409, 'bear_time_stop': 60, 'bear_use_sma': True, 'bear_use_ema': True, 'bear_use_atr': False, 'bear_use_adx': False, 'bear_use_spike': True, 'bear_rsi_required': True, 'sideways_strategy': 'mean_reversion', 'sideways_bb_std_mult': 1.8482761966303018, 'sideways_rsi_os': 40, 'sideways_rsi_ob': 93, 'sideways_adx_thresh': 6.3831661730509675, 'sideways_atr_min_pct': 0.02394794824379761, 'sideways_atr_max_pct': 0.08372937687816441, 'sideways_tp_mult': 1.4056865613812806, 'sideways_tsl_mult': 0.43699443208195404, 'sideways_time_stop': 241, 'sideways_use_sma': True, 'sideways_use_ema': True, 'sideways_use_atr': True, 'sideways_use_adx': False, 'sideways_use_spike': False, 'sideways_rsi_required': True}.
[I 2025-09-01 11:32:38,758] Trial 333 finished with values: [-1000000000.0, 1000000000.0] and parameters: {'p_sma': 11, 'p_std': 37, 'p_atr': 19, 'p_adx': 9, 'rsi_period': 53, 'ema1': 19, 'ema2': 16, 'slip_atr_k': 0.01248694010497603, 'slip_spread_k': 0.3736588467097961, 'spread_hl_frac': 0.026694076708538222, 'bb_std_mult': 3.2838560799483836, 'rsi_os': 28, 'rsi_ob': 87, 'vol_spike': 0.2903721940793913, 'adx_thresh': 22.494684038798432, 'atr_min_pct': 0.02728116967535391, 'atr_max_pct': 0.028707493327425167, 'tp_mult': 2.2273444446485726, 'tsl_mult': 0.906267723976504, 'strategy': 'breakout', 'time_stop': 268, 'use_sma': False, 'use_atr': False, 'use_adx': False, 'use_ema': True, 'use_spike': True, 'rsi_required': False, 'edge_k': 0.3422254627942751, 'edge_cap': 0.2319555257832282, 'bull_strategy': 'breakout', 'bull_bb_std_mult': 0.62961640989385, 'bull_rsi_os': 51, 'bull_rsi_ob': 82, 'bull_adx_thresh': 5.14819457342398, 'bull_atr_min_pct': 0.004019752004382747, 'bull_atr_max_pct': 0.09585764775872703, 'bull_tp_mult': 1.9377289225053065, 'bull_tsl_mult': 0.6465854590769703, 'bull_time_stop': 285, 'bull_use_sma': True, 'bull_use_ema': True, 'bull_use_atr': True, 'bull_use_adx': True, 'bull_use_spike': True, 'bull_rsi_required': False, 'bear_strategy': 'breakout', 'bear_bb_std_mult': 1.0707532814605514, 'bear_rsi_os': 6, 'bear_rsi_ob': 46, 'bear_adx_thresh': 9.580261004722002, 'bear_atr_min_pct': 0.0045338207045107545, 'bear_atr_max_pct': 0.03537109106713475, 'bear_tp_mult': 1.3342263034961903, 'bear_tsl_mult': 0.94887274594449, 'bear_time_stop': 83, 'bear_use_sma': True, 'bear_use_ema': True, 'bear_use_atr': False, 'bear_use_adx': False, 'bear_use_spike': True, 'bear_rsi_required': True, 'sideways_strategy': 'mean_reversion', 'sideways_bb_std_mult': 1.8175884272031062, 'sideways_rsi_os': 39, 'sideways_rsi_ob': 92, 'sideways_adx_thresh': 6.290325431495397, 'sideways_atr_min_pct': 0.021856987764019366, 'sideways_atr_max_pct': 0.08462946267414971, 'sideways_tp_mult': 1.4060005045863515, 'sideways_tsl_mult': 0.4341879482088598, 'sideways_time_stop': 246, 'sideways_use_sma': True, 'sideways_use_ema': True, 'sideways_use_atr': True, 'sideways_use_adx': False, 'sideways_use_spike': False, 'sideways_rsi_required': True}.
