[I 2025-09-01 11:35:34,694] Trial 353 finished with values: [-1000000000.0, 1000000000.0] and parameters: {'p_sma': 11, 'p_std': 40, 'p_atr': 19, 'p_adx': 10, 'rsi_period': 18, 'ema1': 20, 'ema2': 21, 'slip_atr_k': 0.02421045939210833, 'slip_spread_k': 0.30474560515542437, 'spread_hl_frac': 0.01807813670067055, 'bb_std_mult': 3.1587609211503365, 'rsi_os': 26, 'rsi_ob': 87, 'vol_spike': 0.2934010486184639, 'adx_thresh': 22.926205115121974, 'atr_min_pct': 0.028566070459523384, 'atr_max_pct': 0.02671260939649065, 'tp_mult': 2.3245056785920304, 'tsl_mult': 0.8517131258711814, 'strategy': 'breakout', 'time_stop': 273, 'use_sma': False, 'use_atr': True, 'use_adx': False, 'use_ema': True, 'use_spike': True, 'rsi_required': False, 'edge_k': 0.31735251626206396, 'edge_cap': 0.20878707298362845, 'bull_strategy': 'breakout', 'bull_bb_std_mult': 0.6111743071529552, 'bull_rsi_os': 6, 'bull_rsi_ob': 83, 'bull_adx_thresh': 5.675728128141389, 'bull_atr_min_pct': 0.005925492268751484, 'bull_atr_max_pct': 0.10290562342846649, 'bull_tp_mult': 1.861672800417228, 'bull_tsl_mult': 0.678302923742172, 'bull_time_stop': 267, 'bull_use_sma': True, 'bull_use_ema': True, 'bull_use_atr': False, 'bull_use_adx': True, 'bull_use_spike': False, 'bull_rsi_required': False, 'bear_strategy': 'breakout', 'bear_bb_std_mult': 3.599559587622082, 'bear_rsi_os': 19, 'bear_rsi_ob': 49, 'bear_adx_thresh': 8.443712053782994, 'bear_atr_min_pct': 0.001864913297536323, 'bear_atr_max_pct': 0.03307749274757661, 'bear_tp_mult': 1.2861792759193214, 'bear_tsl_mult': 0.9364367469425097, 'bear_time_stop': 46, 'bear_use_sma': True, 'bear_use_ema': True, 'bear_use_atr': True, 'bear_use_adx': False, 'bear_use_spike': True, 'bear_rsi_required': True, 'sideways_strategy': 'mean_reversion', 'sideways_bb_std_mult': 1.6119810760981126, 'sideways_rsi_os': 42, 'sideways_rsi_ob': 93, 'sideways_adx_thresh': 7.39763325420513, 'sideways_atr_min_pct': 0.023696338199248643, 'sideways_atr_max_pct': 0.07432089008119591, 'sideways_tp_mult': 1.5032695493917982, 'sideways_tsl_mult': 0.4529512704163492, 'sideways_time_stop': 244, 'sideways_use_sma': False, 'sideways_use_ema': True, 'sideways_use_atr': True, 'sideways_use_adx': False, 'sideways_use_spike': False, 'sideways_rsi_required': True}.
[I 2025-09-01 11:36:17,687] Trial 351 finished with values: [-1000000000.0, 1000000000.0] and parameters: {'p_sma': 11, 'p_std': 38, 'p_atr': 18, 'p_adx': 10, 'rsi_period': 20, 'ema1': 19, 'ema2': 15, 'slip_atr_k': 0.008916243889083714, 'slip_spread_k': 0.3868752902329501, 'spread_hl_frac': 0.022526084939845092, 'bb_std_mult': 3.2501998019739733, 'rsi_os': 55, 'rsi_ob': 87, 'vol_spike': 0.2590446473335585, 'adx_thresh': 22.853250682631057, 'atr_min_pct': 0.028437526076911666, 'atr_max_pct': 0.0819878542827722, 'tp_mult': 2.3430929481571092, 'tsl_mult': 0.8505398687467688, 'strategy': 'breakout', 'time_stop': 274, 'use_sma': False, 'use_atr': False, 'use_adx': False, 'use_ema': True, 'use_spike': True, 'rsi_required': False, 'edge_k': 0.3365715116330541, 'edge_cap': 0.26908603058507446, 'bull_strategy': 'breakout', 'bull_bb_std_mult': 0.5102565556642886, 'bull_rsi_os': 52, 'bull_rsi_ob': 83, 'bull_adx_thresh': 5.652967699559182, 'bull_atr_min_pct': 0.006188319114408132, 'bull_atr_max_pct': 0.09378342588685351, 'bull_tp_mult': 1.9461447847340403, 'bull_tsl_mult': 0.6254360732988148, 'bull_time_stop': 227, 'bull_use_sma': True, 'bull_use_ema': True, 'bull_use_atr': False, 'bull_use_adx': True, 'bull_use_spike': True, 'bull_rsi_required': False, 'bear_strategy': 'breakout', 'bear_bb_std_mult': 1.0272526957710455, 'bear_rsi_os': 20, 'bear_rsi_ob': 80, 'bear_adx_thresh': 8.442641005841752, 'bear_atr_min_pct': 0.004830975864652727, 'bear_atr_max_pct': 0.025469396272525563, 'bear_tp_mult': 1.319493005335256, 'bear_tsl_mult': 0.9369961253910681, 'bear_time_stop': 78, 'bear_use_sma': True, 'bear_use_ema': True, 'bear_use_atr': False, 'bear_use_adx': False, 'bear_use_spike': True, 'bear_rsi_required': True, 'sideways_strategy': 'mean_reversion', 'sideways_bb_std_mult': 2.1033506512589093, 'sideways_rsi_os': 40, 'sideways_rsi_ob': 94, 'sideways_adx_thresh': 5.83621688616663, 'sideways_atr_min_pct': 0.024140590571089783, 'sideways_atr_max_pct': 0.07363038295152947, 'sideways_tp_mult': 1.377426622544012, 'sideways_tsl_mult': 0.4387311316105473, 'sideways_time_stop': 250, 'sideways_use_sma': False, 'sideways_use_ema': True, 'sideways_use_atr': True, 'sideways_use_adx': False, 'sideways_use_spike': False, 'sideways_rsi_required': True}.
[I 2025-09-01 11:36:17,693] Trial 355 finished with values: [-1000000000.0, 1000000000.0] and parameters: {'p_sma': 12, 'p_std': 37, 'p_atr': 18, 'p_adx': 8, 'rsi_period': 52, 'ema1': 20, 'ema2': 16, 'slip_atr_k': 0.01510815632222898, 'slip_spread_k': 0.47476152468416355, 'spread_hl_frac': 0.026130350054850822, 'bb_std_mult': 3.2398966794902355, 'rsi_os': 28, 'rsi_ob': 85, 'vol_spike': 0.29577505678487587, 'adx_thresh': 21.234641005526004, 'atr_min_pct': 0.020929742759149526, 'atr_max_pct': 0.03563504919323005, 'tp_mult': 1.9986530162476317, 'tsl_mult': 0.2784739009935159, 'strategy': 'breakout', 'time_stop': 254, 'use_sma': False, 'use_atr': False, 'use_adx': False, 'use_ema': True, 'use_spike': True, 'rsi_required': False, 'edge_k': 0.44331691440580473, 'edge_cap': 0.2679503456828571, 'bull_strategy': 'breakout', 'bull_bb_std_mult': 0.7938860714988492, 'bull_rsi_os': 49, 'bull_rsi_ob': 85, 'bull_adx_thresh': 5.610396787873328, 'bull_atr_min_pct': 0.0044358493950167575, 'bull_atr_max_pct': 0.08880350486308423, 'bull_tp_mult': 2.015497102458338, 'bull_tsl_mult': 0.3717937819001042, 'bull_time_stop': 218, 'bull_use_sma': False, 'bull_use_ema': False, 'bull_use_atr': True, 'bull_use_adx': True, 'bull_use_spike': True, 'bull_rsi_required': False, 'bear_strategy': 'breakout', 'bear_bb_std_mult': 1.1272097819403468, 'bear_rsi_os': 17, 'bear_rsi_ob': 48, 'bear_adx_thresh': 10.146672006638035, 'bear_atr_min_pct': 0.004827890734744921, 'bear_atr_max_pct': 0.07930849232155542, 'bear_tp_mult': 1.3682409008113219, 'bear_tsl_mult': 0.9755723706401331, 'bear_time_stop': 270, 'bear_use_sma': True, 'bear_use_ema': False, 'bear_use_atr': False, 'bear_use_adx': False, 'bear_use_spike': True, 'bear_rsi_required': True, 'sideways_strategy': 'mean_reversion', 'sideways_bb_std_mult': 1.4446182694510183, 'sideways_rsi_os': 40, 'sideways_rsi_ob': 91, 'sideways_adx_thresh': 5.153528298950676, 'sideways_atr_min_pct': 0.02294168376770571, 'sideways_atr_max_pct': 0.081974398126242, 'sideways_tp_mult': 1.3900714392173492, 'sideways_tsl_mult': 0.2876813327743934, 'sideways_time_stop': 244, 'sideways_use_sma': False, 'sideways_use_ema': True, 'sideways_use_atr': True, 'sideways_use_adx': False, 'sideways_use_spike': False, 'sideways_rsi_required': True}.
[I 2025-09-01 11:36:19,859] Trial 352 finished with values: [-0.018160672723590454, 0.01877789712924892] and parameters: {'p_sma': 51, 'p_std': 38, 'p_atr': 19, 'p_adx': 9, 'rsi_period': 54, 'ema1': 20, 'ema2': 21, 'slip_atr_k': 0.09884011028985293, 'slip_spread_k': 0.31086965036559416, 'spread_hl_frac': 0.017907437350011976, 'bb_std_mult': 1.907023267330771, 'rsi_os': 26, 'rsi_ob': 87, 'vol_spike': 0.2938554722233551, 'adx_thresh': 21.22777110299938, 'atr_min_pct': 0.024177697982407792, 'atr_max_pct': 0.025924759044582663, 'tp_mult': 2.330583585914024, 'tsl_mult': 0.9146188714265613, 'strategy': 'breakout', 'time_stop': 271, 'use_sma': False, 'use_atr': False, 'use_adx': False, 'use_ema': True, 'use_spike': True, 'rsi_required': False, 'edge_k': 0.3342791686193733, 'edge_cap': 0.26534749764986304, 'bull_strategy': 'breakout', 'bull_bb_std_mult': 0.6612282676701702, 'bull_rsi_os': 51, 'bull_rsi_ob': 82, 'bull_adx_thresh': 5.664244380464891, 'bull_atr_min_pct': 0.003114985063575785, 'bull_atr_max_pct': 0.08846343838750452, 'bull_tp_mult': 2.010445920348624, 'bull_tsl_mult': 0.3511027589897937, 'bull_time_stop': 220, 'bull_use_sma': True, 'bull_use_ema': True, 'bull_use_atr': True, 'bull_use_adx': True, 'bull_use_spike': False, 'bull_rsi_required': False, 'bear_strategy': 'breakout', 'bear_bb_std_mult': 3.336988077078039, 'bear_rsi_os': 20, 'bear_rsi_ob': 49, 'bear_adx_thresh': 8.049143050904279, 'bear_atr_min_pct': 0.004892018888588285, 'bear_atr_max_pct': 0.10412275563002354, 'bear_tp_mult': 1.4359416721094669, 'bear_tsl_mult': 0.9580183928978268, 'bear_time_stop': 77, 'bear_use_sma': True, 'bear_use_ema': True, 'bear_use_atr': False, 'bear_use_adx': False, 'bear_use_spike': True, 'bear_rsi_required': True, 'sideways_strategy': 'mean_reversion', 'sideways_bb_std_mult': 1.473266188464463, 'sideways_rsi_os': 42, 'sideways_rsi_ob': 94, 'sideways_adx_thresh': 5.61386861228172, 'sideways_atr_min_pct': 0.023521229938383986, 'sideways_atr_max_pct': 0.0884878682012879, 'sideways_tp_mult': 1.386110511026092, 'sideways_tsl_mult': 0.45344680502732987, 'sideways_time_stop': 245, 'sideways_use_sma': False, 'sideways_use_ema': True, 'sideways_use_atr': True, 'sideways_use_adx': False, 'sideways_use_spike': False, 'sideways_rsi_required': True}.
[I 2025-09-01 11:36:20,817] Trial 354 finished with values: [-1000000000.0, 1000000000.0] and parameters: {'p_sma': 11, 'p_std': 40, 'p_atr': 18, 'p_adx': 8, 'rsi_period': 50, 'ema1': 20, 'ema2': 12, 'slip_atr_k': 0.014215954436994728, 'slip_spread_k': 0.4764879864795138, 'spread_hl_frac': 0.026129994103789283, 'bb_std_mult': 3.135703145700105, 'rsi_os': 51, 'rsi_ob': 67, 'vol_spike': 0.2929479186435698, 'adx_thresh': 21.307109460216818, 'atr_min_pct': 0.028511238421678707, 'atr_max_pct': 0.12074702699980114, 'tp_mult': 2.3283522276273527, 'tsl_mult': 0.9146895359224338, 'strategy': 'breakout', 'time_stop': 257, 'use_sma': False, 'use_atr': True, 'use_adx': False, 'use_ema': True, 'use_spike': True, 'rsi_required': False, 'edge_k': 0.3333618004916645, 'edge_cap': 0.2664900416071897, 'bull_strategy': 'breakout', 'bull_bb_std_mult': 0.7936496952298666, 'bull_rsi_os': 49, 'bull_rsi_ob': 84, 'bull_adx_thresh': 8.423608597806624, 'bull_atr_min_pct': 0.005986649121502055, 'bull_atr_max_pct': 0.1035248064886136, 'bull_tp_mult': 2.023190429433824, 'bull_tsl_mult': 0.6142125537556928, 'bull_time_stop': 268, 'bull_use_sma': True, 'bull_use_ema': True, 'bull_use_atr': True, 'bull_use_adx': True, 'bull_use_spike': False, 'bull_rsi_required': False, 'bear_strategy': 'breakout', 'bear_bb_std_mult': 1.0290554204768898, 'bear_rsi_os': 16, 'bear_rsi_ob': 48, 'bear_adx_thresh': 10.303049339146279, 'bear_atr_min_pct': 0.004933184451216802, 'bear_atr_max_pct': 0.033411293382994166, 'bear_tp_mult': 1.4159997474515518, 'bear_tsl_mult': 0.9431119917367696, 'bear_time_stop': 44, 'bear_use_sma': True, 'bear_use_ema': False, 'bear_use_atr': True, 'bear_use_adx': False, 'bear_use_spike': True, 'bear_rsi_required': True, 'sideways_strategy': 'mean_reversion', 'sideways_bb_std_mult': 1.789268519688924, 'sideways_rsi_os': 36, 'sideways_rsi_ob': 93, 'sideways_adx_thresh': 7.776323344091295, 'sideways_atr_min_pct': 0.022632401079929084, 'sideways_atr_max_pct': 0.0819018519906929, 'sideways_tp_mult': 1.4022046458715054, 'sideways_tsl_mult': 0.4603892225606949, 'sideways_time_stop': 244, 'sideways_use_sma': False, 'sideways_use_ema': True, 'sideways_use_atr': True, 'sideways_use_adx': False, 'sideways_use_spike': False, 'sideways_rsi_required': True}.
[I 2025-09-01 11:37:05,142] Trial 359 finished with values: [-1000000000.0, 1000000000.0] and parameters: {'p_sma': 9, 'p_std': 37, 'p_atr': 19, 'p_adx': 9, 'rsi_period': 49, 'ema1': 21, 'ema2': 17, 'slip_atr_k': 0.24017102164319343, 'slip_spread_k': 0.3457221282733519, 'spread_hl_frac': 0.02847860228452158, 'bb_std_mult': 3.0532738782181577, 'rsi_os': 28, 'rsi_ob': 84, 'vol_spike': 0.25067594263857623, 'adx_thresh': 23.5446612420437, 'atr_min_pct': 0.028735335344723757, 'atr_max_pct': 0.10319137804892049, 'tp_mult': 2.0896523422644617, 'tsl_mult': 0.961973255786172, 'strategy': 'breakout', 'time_stop': 263, 'use_sma': False, 'use_atr': False, 'use_adx': True, 'use_ema': False, 'use_spike': False, 'rsi_required': False, 'edge_k': 0.39225672591106614, 'edge_cap': 0.29063507398951915, 'bull_strategy': 'breakout', 'bull_bb_std_mult': 0.756421096151758, 'bull_rsi_os': 50, 'bull_rsi_ob': 86, 'bull_adx_thresh': 6.257702813847312, 'bull_atr_min_pct': 0.004612821579895459, 'bull_atr_max_pct': 0.02326358943854749, 'bull_tp_mult': 1.8619744298803003, 'bull_tsl_mult': 0.40085453881705546, 'bull_time_stop': 300, 'bull_use_sma': False, 'bull_use_ema': False, 'bull_use_atr': True, 'bull_use_adx': False, 'bull_use_spike': True, 'bull_rsi_required': True, 'bear_strategy': 'mean_reversion', 'bear_bb_std_mult': 1.0248823106962535, 'bear_rsi_os': 5, 'bear_rsi_ob': 59, 'bear_adx_thresh': 9.88834897707689, 'bear_atr_min_pct': 0.0028052551645350175, 'bear_atr_max_pct': 0.029488355239283198, 'bear_tp_mult': 1.2524941950990194, 'bear_tsl_mult': 0.9882189352885141, 'bear_time_stop': 57, 'bear_use_sma': True, 'bear_use_ema': True, 'bear_use_atr': False, 'bear_use_adx': False, 'bear_use_spike': True, 'bear_rsi_required': True, 'sideways_strategy': 'breakout', 'sideways_bb_std_mult': 2.0046959244912057, 'sideways_rsi_os': 39, 'sideways_rsi_ob': 91, 'sideways_adx_thresh': 6.774022881505151, 'sideways_atr_min_pct': 0.0214731303859973, 'sideways_atr_max_pct': 0.0842872198898458, 'sideways_tp_mult': 1.2972592155515068, 'sideways_tsl_mult': 0.34711359256788754, 'sideways_time_stop': 262, 'sideways_use_sma': True, 'sideways_use_ema': True, 'sideways_use_atr': True, 'sideways_use_adx': False, 'sideways_use_spike': True, 'sideways_rsi_required': False}.
[I 2025-09-01 11:37:05,970] Trial 357 finished with values: [-0.001136081895938501, 0.005735589757362954] and parameters: {'p_sma': 14, 'p_std': 40, 'p_atr': 19, 'p_adx': 9, 'rsi_period': 49, 'ema1': 21, 'ema2': 12, 'slip_atr_k': 0.0016401491904874822, 'slip_spread_k': 0.33000109089173457, 'spread_hl_frac': 0.0285312246274439, 'bb_std_mult': 1.1355318435044417, 'rsi_os': 31, 'rsi_ob': 85, 'vol_spike': 0.2716085689898571, 'adx_thresh': 21.371284087767012, 'atr_min_pct': 0.02854468702863282, 'atr_max_pct': 0.03496533976387466, 'tp_mult': 2.083402612775666, 'tsl_mult': 0.11782638907798787, 'strategy': 'breakout', 'time_stop': 264, 'use_sma': False, 'use_atr': True, 'use_adx': True, 'use_ema': False, 'use_spike': False, 'rsi_required': False, 'edge_k': 0.37803230554382616, 'edge_cap': 0.8182774032174532, 'bull_strategy': 'breakout', 'bull_bb_std_mult': 0.821844663391037, 'bull_rsi_os': 50, 'bull_rsi_ob': 86, 'bull_adx_thresh': 6.173722836377918, 'bull_atr_min_pct': 0.0037171436133917246, 'bull_atr_max_pct': 0.08856246235854627, 'bull_tp_mult': 2.0019900135059445, 'bull_tsl_mult': 0.5383727860833433, 'bull_time_stop': 300, 'bull_use_sma': True, 'bull_use_ema': True, 'bull_use_atr': True, 'bull_use_adx': True, 'bull_use_spike': False, 'bull_rsi_required': False, 'bear_strategy': 'breakout', 'bear_bb_std_mult': 3.2331252921792495, 'bear_rsi_os': 7, 'bear_rsi_ob': 48, 'bear_adx_thresh': 9.583882814552508, 'bear_atr_min_pct': 0.003970924058665051, 'bear_atr_max_pct': 0.10347058641450665, 'bear_tp_mult': 1.4400071050691652, 'bear_tsl_mult': 0.9539807050581689, 'bear_time_stop': 41, 'bear_use_sma': True, 'bear_use_ema': True, 'bear_use_atr': True, 'bear_use_adx': False, 'bear_use_spike': True, 'bear_rsi_required': True, 'sideways_strategy': 'breakout', 'sideways_bb_std_mult': 1.7806282593969824, 'sideways_rsi_os': 38, 'sideways_rsi_ob': 93, 'sideways_adx_thresh': 6.662002515179196, 'sideways_atr_min_pct': 0.02198301444546878, 'sideways_atr_max_pct': 0.08878359610585626, 'sideways_tp_mult': 1.4294517815153351, 'sideways_tsl_mult': 0.4053833315548161, 'sideways_time_stop': 265, 'sideways_use_sma': True, 'sideways_use_ema': True, 'sideways_use_atr': True, 'sideways_use_adx': False, 'sideways_use_spike': True, 'sideways_rsi_required': True}.
[I 2025-09-01 11:37:06,564] Trial 358 finished with values: [-1000000000.0, 1000000000.0] and parameters: {'p_sma': 14, 'p_std': 37, 'p_atr': 19, 'p_adx': 8, 'rsi_period': 49, 'ema1': 21, 'ema2': 17, 'slip_atr_k': 0.004263166502894486, 'slip_spread_k': 0.3338195166117339, 'spread_hl_frac': 0.02866622350990054, 'bb_std_mult': 3.1311688846131163, 'rsi_os': 51, 'rsi_ob': 85, 'vol_spike': 0.24694840082433234, 'adx_thresh': 23.790513782480286, 'atr_min_pct': 0.02851075469312113, 'atr_max_pct': 0.11909001281264343, 'tp_mult': 2.0749991843404683, 'tsl_mult': 0.32398178344863493, 'strategy': 'breakout', 'time_stop': 257, 'use_sma': False, 'use_atr': True, 'use_adx': True, 'use_ema': False, 'use_spike': False, 'rsi_required': False, 'edge_k': 0.3760832175485015, 'edge_cap': 0.8177915698235316, 'bull_strategy': 'breakout', 'bull_bb_std_mult': 0.7575210732496467, 'bull_rsi_os': 50, 'bull_rsi_ob': 84, 'bull_adx_thresh': 6.358332774672383, 'bull_atr_min_pct': 0.004711182614855489, 'bull_atr_max_pct': 0.09441401615434578, 'bull_tp_mult': 1.8790382677310768, 'bull_tsl_mult': 0.4303946936590626, 'bull_time_stop': 300, 'bull_use_sma': True, 'bull_use_ema': True, 'bull_use_atr': True, 'bull_use_adx': False, 'bull_use_spike': True, 'bull_rsi_required': True, 'bear_strategy': 'mean_reversion', 'bear_bb_std_mult': 3.2649112226232067, 'bear_rsi_os': 5, 'bear_rsi_ob': 45, 'bear_adx_thresh': 9.78051836356524, 'bear_atr_min_pct': 0.002788117250748614, 'bear_atr_max_pct': 0.03346873842246229, 'bear_tp_mult': 1.3487204917996034, 'bear_tsl_mult': 0.9854238455885937, 'bear_time_stop': 57, 'bear_use_sma': True, 'bear_use_ema': False, 'bear_use_atr': True, 'bear_use_adx': False, 'bear_use_spike': True, 'bear_rsi_required': True, 'sideways_strategy': 'breakout', 'sideways_bb_std_mult': 1.5398719855007652, 'sideways_rsi_os': 38, 'sideways_rsi_ob': 91, 'sideways_adx_thresh': 6.652989502237904, 'sideways_atr_min_pct': 0.02204311669569556, 'sideways_atr_max_pct': 0.1498715650770101, 'sideways_tp_mult': 1.419853389438936, 'sideways_tsl_mult': 0.3806498928870383, 'sideways_time_stop': 268, 'sideways_use_sma': True, 'sideways_use_ema': True, 'sideways_use_atr': True, 'sideways_use_adx': False, 'sideways_use_spike': True, 'sideways_rsi_required': True}.
[I 2025-09-01 11:37:07,118] Trial 356 finished with values: [-0.014302535534826188, 0.015094057115863117] and parameters: {'p_sma': 47, 'p_std': 40, 'p_atr': 17, 'p_adx': 9, 'rsi_period': 49, 'ema1': 21, 'ema2': 12, 'slip_atr_k': 0.005172317099999768, 'slip_spread_k': 0.37370258144227214, 'spread_hl_frac': 0.028557137917709724, 'bb_std_mult': 3.118266794035146, 'rsi_os': 37, 'rsi_ob': 85, 'vol_spike': 0.24810108757400987, 'adx_thresh': 28.133851012513865, 'atr_min_pct': 0.01905144639588737, 'atr_max_pct': 0.035840915897485066, 'tp_mult': 2.1050317878394393, 'tsl_mult': 0.9140018058772675, 'strategy': 'breakout', 'time_stop': 264, 'use_sma': False, 'use_atr': True, 'use_adx': True, 'use_ema': False, 'use_spike': False, 'rsi_required': False, 'edge_k': 0.40886752045998076, 'edge_cap': 0.2906782124303809, 'bull_strategy': 'breakout', 'bull_bb_std_mult': 0.7647065955646566, 'bull_rsi_os': 31, 'bull_rsi_ob': 86, 'bull_adx_thresh': 8.471642788127793, 'bull_atr_min_pct': 0.004662534472760663, 'bull_atr_max_pct': 0.09314687287202265, 'bull_tp_mult': 2.0128357331696654, 'bull_tsl_mult': 0.427726065626835, 'bull_time_stop': 283, 'bull_use_sma': True, 'bull_use_ema': True, 'bull_use_atr': True, 'bull_use_adx': True, 'bull_use_spike': False, 'bull_rsi_required': False, 'bear_strategy': 'breakout', 'bear_bb_std_mult': 2.2478998888049344, 'bear_rsi_os': 28, 'bear_rsi_ob': 45, 'bear_adx_thresh': 9.881795162013884, 'bear_atr_min_pct': 0.0030025923887432365, 'bear_atr_max_pct': 0.09293348518504377, 'bear_tp_mult': 1.2623774107305017, 'bear_tsl_mult': 0.9569303165754731, 'bear_time_stop': 89, 'bear_use_sma': True, 'bear_use_ema': True, 'bear_use_atr': True, 'bear_use_adx': False, 'bear_use_spike': True, 'bear_rsi_required': True, 'sideways_strategy': 'breakout', 'sideways_bb_std_mult': 2.1790695346732485, 'sideways_rsi_os': 36, 'sideways_rsi_ob': 93, 'sideways_adx_thresh': 6.604884497948817, 'sideways_atr_min_pct': 0.021821145933927984, 'sideways_atr_max_pct': 0.08803235089677049, 'sideways_tp_mult': 1.43202783452408, 'sideways_tsl_mult': 0.3675023636453751, 'sideways_time_stop': 267, 'sideways_use_sma': True, 'sideways_use_ema': True, 'sideways_use_atr': True, 'sideways_use_adx': False, 'sideways_use_spike': True, 'sideways_rsi_required': True}.
