[I 2025-09-01 11:06:35,155] Trial 149 finished with values: [-0.023208227986708185, 0.02389989948456509] and parameters: {'p_sma': 58, 'p_std': 54, 'p_atr': 7, 'p_adx': 9, 'rsi_period': 31, 'ema1': 28, 'ema2': 24, 'slip_atr_k': 0.18541124280497226, 'slip_spread_k': 0.24235048169910195, 'spread_hl_frac': 0.0026236051939662066, 'bb_std_mult': 0.5744299705539034, 'rsi_os': 14, 'rsi_ob': 61, 'vol_spike': 0.25760397380712297, 'adx_thresh': 33.4364936937765, 'atr_min_pct': 0.014039695346862084, 'atr_max_pct': 0.07373235821543488, 'tp_mult': 2.3618722716705878, 'tsl_mult': 0.6654667421351372, 'strategy': 'mean_reversion', 'time_stop': 236, 'use_sma': True, 'use_atr': True, 'use_adx': False, 'use_ema': True, 'use_spike': False, 'rsi_required': False, 'edge_k': 1.7764155748419777, 'edge_cap': 0.5201368867902113, 'bull_strategy': 'mean_reversion', 'bull_bb_std_mult': 2.1405546652665333, 'bull_rsi_os': 27, 'bull_rsi_ob': 54, 'bull_adx_thresh': 32.50929824822432, 'bull_atr_min_pct': 1.0567094701354677e-05, 'bull_atr_max_pct': 0.10480509650989202, 'bull_tp_mult': 2.0468619684193747, 'bull_tsl_mult': 0.8592262832830563, 'bull_time_stop': 49, 'bull_use_sma': False, 'bull_use_ema': False, 'bull_use_atr': False, 'bull_use_adx': True, 'bull_use_spike': False, 'bull_rsi_required': False, 'bear_strategy': 'breakout', 'bear_bb_std_mult': 1.839255182449023, 'bear_rsi_os': 8, 'bear_rsi_ob': 86, 'bear_adx_thresh': 20.157180873391546, 'bear_atr_min_pct': 0.019403068418536982, 'bear_atr_max_pct': 0.08205855383834784, 'bear_tp_mult': 2.561502873976201, 'bear_tsl_mult': 0.5624881915655205, 'bear_time_stop': 192, 'bear_use_sma': False, 'bear_use_ema': False, 'bear_use_atr': True, 'bear_use_adx': False, 'bear_use_spike': True, 'bear_rsi_required': True, 'sideways_strategy': 'breakout', 'sideways_bb_std_mult': 3.3913821710026406, 'sideways_rsi_os': 23, 'sideways_rsi_ob': 92, 'sideways_adx_thresh': 17.544001833553807, 'sideways_atr_min_pct': 0.02696134731800905, 'sideways_atr_max_pct': 0.08565246870158995, 'sideways_tp_mult': 2.1241794663306948, 'sideways_tsl_mult': 0.71358626761957, 'sideways_time_stop': 155, 'sideways_use_sma': True, 'sideways_use_ema': True, 'sideways_use_atr': True, 'sideways_use_adx': False, 'sideways_use_spike': False, 'sideways_rsi_required': True}.
[I 2025-09-01 11:06:35,587] Trial 157 finished with values: [-1000000000.0, 1000000000.0] and parameters: {'p_sma': 8, 'p_std': 22, 'p_atr': 19, 'p_adx': 18, 'rsi_period': 77, 'ema1': 24, 'ema2': 56, 'slip_atr_k': 0.09641546575614152, 'slip_spread_k': 0.45521438145263365, 'spread_hl_frac': 0.02197206051363666, 'bb_std_mult': 0.6581321937116149, 'rsi_os': 29, 'rsi_ob': 49, 'vol_spike': 0.13348085732407045, 'adx_thresh': 6.3188411246438605, 'atr_min_pct': 0.008102508739845995, 'atr_max_pct': 0.08749894951012908, 'tp_mult': 2.936687817198522, 'tsl_mult': 0.2682969903404706, 'strategy': 'mean_reversion', 'time_stop': 96, 'use_sma': True, 'use_atr': True, 'use_adx': True, 'use_ema': True, 'use_spike': False, 'rsi_required': True, 'edge_k': 0.5441739747224512, 'edge_cap': 0.4912693484588537, 'bull_strategy': 'breakout', 'bull_bb_std_mult': 2.2556335396707596, 'bull_rsi_os': 54, 'bull_rsi_ob': 81, 'bull_adx_thresh': 28.74346639074639, 'bull_atr_min_pct': 0.0012638638771909033, 'bull_atr_max_pct': 0.05470256221487005, 'bull_tp_mult': 1.759987233654326, 'bull_tsl_mult': 0.9058920235038811, 'bull_time_stop': 5, 'bull_use_sma': True, 'bull_use_ema': False, 'bull_use_atr': False, 'bull_use_adx': True, 'bull_use_spike': True, 'bull_rsi_required': True, 'bear_strategy': 'mean_reversion', 'bear_bb_std_mult': 1.2039471904218044, 'bear_rsi_os': 43, 'bear_rsi_ob': 76, 'bear_adx_thresh': 21.45812564374868, 'bear_atr_min_pct': 0.00557281046839175, 'bear_atr_max_pct': 0.1439195732374952, 'bear_tp_mult': 1.9492485526868764, 'bear_tsl_mult': 0.7622726085961765, 'bear_time_stop': 131, 'bear_use_sma': False, 'bear_use_ema': False, 'bear_use_atr': True, 'bear_use_adx': True, 'bear_use_spike': True, 'bear_rsi_required': False, 'sideways_strategy': 'mean_reversion', 'sideways_bb_std_mult': 1.248686629828598, 'sideways_rsi_os': 13, 'sideways_rsi_ob': 49, 'sideways_adx_thresh': 5.843621293645231, 'sideways_atr_min_pct': 0.019189397002341835, 'sideways_atr_max_pct': 0.027302548208783625, 'sideways_tp_mult': 2.8812385534869556, 'sideways_tsl_mult': 0.047477119299399344, 'sideways_time_stop': 16, 'sideways_use_sma': False, 'sideways_use_ema': False, 'sideways_use_atr': False, 'sideways_use_adx': True, 'sideways_use_spike': False, 'sideways_rsi_required': True}.
[I 2025-09-01 11:06:35,593] Trial 155 finished with values: [-1000000000.0, 1000000000.0] and parameters: {'p_sma': 8, 'p_std': 24, 'p_atr': 22, 'p_adx': 30, 'rsi_period': 16, 'ema1': 17, 'ema2': 20, 'slip_atr_k': 0.16366157226001735, 'slip_spread_k': 0.024430336266623998, 'spread_hl_frac': 0.003012176285995201, 'bb_std_mult': 0.661827178098424, 'rsi_os': 47, 'rsi_ob': 49, 'vol_spike': 0.04210702252547073, 'adx_thresh': 6.3648610205476, 'atr_min_pct': 0.014730886857020986, 'atr_max_pct': 0.06433704701838663, 'tp_mult': 2.7216350399104767, 'tsl_mult': 0.6897749490297096, 'strategy': 'mean_reversion', 'time_stop': 186, 'use_sma': True, 'use_atr': True, 'use_adx': True, 'use_ema': True, 'use_spike': False, 'rsi_required': True, 'edge_k': 0.5661423073022864, 'edge_cap': 0.5045372395914084, 'bull_strategy': 'mean_reversion', 'bull_bb_std_mult': 2.2127970099728502, 'bull_rsi_os': 42, 'bull_rsi_ob': 81, 'bull_adx_thresh': 30.331226897298606, 'bull_atr_min_pct': 0.0008450216947847672, 'bull_atr_max_pct': 0.10646688611319738, 'bull_tp_mult': 2.9916812260129104, 'bull_tsl_mult': 0.8306216912234101, 'bull_time_stop': 202, 'bull_use_sma': False, 'bull_use_ema': False, 'bull_use_atr': False, 'bull_use_adx': True, 'bull_use_spike': False, 'bull_rsi_required': True, 'bear_strategy': 'breakout', 'bear_bb_std_mult': 1.325741280771262, 'bear_rsi_os': 40, 'bear_rsi_ob': 88, 'bear_adx_thresh': 20.000180210542997, 'bear_atr_min_pct': 0.02005470382793398, 'bear_atr_max_pct': 0.1425200145525341, 'bear_tp_mult': 1.648199088032125, 'bear_tsl_mult': 0.15983269340980488, 'bear_time_stop': 120, 'bear_use_sma': False, 'bear_use_ema': False, 'bear_use_atr': True, 'bear_use_adx': True, 'bear_use_spike': True, 'bear_rsi_required': False, 'sideways_strategy': 'breakout', 'sideways_bb_std_mult': 1.2487020607210104, 'sideways_rsi_os': 20, 'sideways_rsi_ob': 45, 'sideways_adx_thresh': 17.11783175973416, 'sideways_atr_min_pct': 0.019853172788106874, 'sideways_atr_max_pct': 0.09793956216731345, 'sideways_tp_mult': 1.4214890859208973, 'sideways_tsl_mult': 0.03742672475174504, 'sideways_time_stop': 198, 'sideways_use_sma': False, 'sideways_use_ema': True, 'sideways_use_atr': False, 'sideways_use_adx': True, 'sideways_use_spike': False, 'sideways_rsi_required': True}.
[I 2025-09-01 11:06:35,608] Trial 154 finished with values: [-1000000000.0, 1000000000.0] and parameters: {'p_sma': 8, 'p_std': 24, 'p_atr': 19, 'p_adx': 8, 'rsi_period': 16, 'ema1': 17, 'ema2': 24, 'slip_atr_k': 0.022724531678133295, 'slip_spread_k': 0.21021301868442177, 'spread_hl_frac': 0.0025265564992349642, 'bb_std_mult': 0.5654793861801883, 'rsi_os': 26, 'rsi_ob': 49, 'vol_spike': 0.2431256758578233, 'adx_thresh': 31.89626763790792, 'atr_min_pct': 0.01610085007086765, 'atr_max_pct': 0.06389945939730535, 'tp_mult': 2.711479626708476, 'tsl_mult': 0.27740846348398146, 'strategy': 'mean_reversion', 'time_stop': 224, 'use_sma': True, 'use_atr': True, 'use_adx': True, 'use_ema': True, 'use_spike': False, 'rsi_required': True, 'edge_k': 1.8671067519129312, 'edge_cap': 0.4872060826210838, 'bull_strategy': 'mean_reversion', 'bull_bb_std_mult': 2.739669952129214, 'bull_rsi_os': 24, 'bull_rsi_ob': 81, 'bull_adx_thresh': 28.77400845975119, 'bull_atr_min_pct': 0.000873278470080229, 'bull_atr_max_pct': 0.10655442667779882, 'bull_tp_mult': 2.9961655890700345, 'bull_tsl_mult': 0.823771579593858, 'bull_time_stop': 52, 'bull_use_sma': False, 'bull_use_ema': False, 'bull_use_atr': False, 'bull_use_adx': True, 'bull_use_spike': False, 'bull_rsi_required': True, 'bear_strategy': 'breakout', 'bear_bb_std_mult': 1.3260795139082162, 'bear_rsi_os': 39, 'bear_rsi_ob': 87, 'bear_adx_thresh': 20.06650720567817, 'bear_atr_min_pct': 0.019986340560573, 'bear_atr_max_pct': 0.14228881591399642, 'bear_tp_mult': 1.641663385184321, 'bear_tsl_mult': 0.1637613324642546, 'bear_time_stop': 131, 'bear_use_sma': False, 'bear_use_ema': False, 'bear_use_atr': True, 'bear_use_adx': True, 'bear_use_spike': True, 'bear_rsi_required': False, 'sideways_strategy': 'breakout', 'sideways_bb_std_mult': 3.2713647668644033, 'sideways_rsi_os': 20, 'sideways_rsi_ob': 49, 'sideways_adx_thresh': 5.6730891294991235, 'sideways_atr_min_pct': 0.02705013693765805, 'sideways_atr_max_pct': 0.09742531952027676, 'sideways_tp_mult': 1.8980190947544948, 'sideways_tsl_mult': 0.4881253745761459, 'sideways_time_stop': 191, 'sideways_use_sma': False, 'sideways_use_ema': True, 'sideways_use_atr': False, 'sideways_use_adx': True, 'sideways_use_spike': False, 'sideways_rsi_required': True}.
[I 2025-09-01 11:07:13,765] Trial 156 finished with values: [-0.024674950054893285, 0.025690479959961487] and parameters: {'p_sma': 45, 'p_std': 22, 'p_atr': 23, 'p_adx': 30, 'rsi_period': 77, 'ema1': 7, 'ema2': 56, 'slip_atr_k': 0.02075694326696465, 'slip_spread_k': 0.027407750044459556, 'spread_hl_frac': 0.028790945126329688, 'bb_std_mult': 2.5471416362479165, 'rsi_os': 28, 'rsi_ob': 66, 'vol_spike': 0.13189285339985474, 'adx_thresh': 6.444684266411995, 'atr_min_pct': 0.01482336358766099, 'atr_max_pct': 0.0707511369974077, 'tp_mult': 1.9107985404080567, 'tsl_mult': 0.4735353955479001, 'strategy': 'mean_reversion', 'time_stop': 225, 'use_sma': True, 'use_atr': True, 'use_adx': True, 'use_ema': True, 'use_spike': False, 'rsi_required': True, 'edge_k': 0.5635233650466083, 'edge_cap': 0.24889155989880757, 'bull_strategy': 'breakout', 'bull_bb_std_mult': 0.5560215197585368, 'bull_rsi_os': 26, 'bull_rsi_ob': 81, 'bull_adx_thresh': 28.599051473926245, 'bull_atr_min_pct': 0.0005827338644341986, 'bull_atr_max_pct': 0.10654553790644489, 'bull_tp_mult': 1.7550518282986167, 'bull_tsl_mult': 0.8996648236026432, 'bull_time_stop': 41, 'bull_use_sma': True, 'bull_use_ema': False, 'bull_use_atr': False, 'bull_use_adx': True, 'bull_use_spike': True, 'bull_rsi_required': True, 'bear_strategy': 'mean_reversion', 'bear_bb_std_mult': 1.3153936607837218, 'bear_rsi_os': 40, 'bear_rsi_ob': 76, 'bear_adx_thresh': 15.457159406223754, 'bear_atr_min_pct': 0.0057813452031359545, 'bear_atr_max_pct': 0.14414909481782026, 'bear_tp_mult': 1.4902676841166214, 'bear_tsl_mult': 0.02096784683598052, 'bear_time_stop': 130, 'bear_use_sma': False, 'bear_use_ema': False, 'bear_use_atr': True, 'bear_use_adx': True, 'bear_use_spike': True, 'bear_rsi_required': False, 'sideways_strategy': 'mean_reversion', 'sideways_bb_std_mult': 1.040829086818871, 'sideways_rsi_os': 45, 'sideways_rsi_ob': 49, 'sideways_adx_thresh': 18.5922656435636, 'sideways_atr_min_pct': 0.0069283738515672905, 'sideways_atr_max_pct': 0.09640698155041427, 'sideways_tp_mult': 2.0448734071564343, 'sideways_tsl_mult': 0.048410461571380875, 'sideways_time_stop': 143, 'sideways_use_sma': False, 'sideways_use_ema': False, 'sideways_use_atr': False, 'sideways_use_adx': True, 'sideways_use_spike': False, 'sideways_rsi_required': True}.
[I 2025-09-01 11:07:14,919] Trial 159 finished with values: [-1000000000.0, 1000000000.0] and parameters: {'p_sma': 10, 'p_std': 26, 'p_atr': 7, 'p_adx': 24, 'rsi_period': 40, 'ema1': 22, 'ema2': 57, 'slip_atr_k': 0.021403304824513032, 'slip_spread_k': 0.545012635618896, 'spread_hl_frac': 0.028874587933417305, 'bb_std_mult': 0.7426411075471493, 'rsi_os': 28, 'rsi_ob': 65, 'vol_spike': 0.1377737399930975, 'adx_thresh': 5.430041434993177, 'atr_min_pct': 0.016637778367883035, 'atr_max_pct': 0.06855218525965039, 'tp_mult': 2.0337006620858893, 'tsl_mult': 0.4757003389325604, 'strategy': 'breakout', 'time_stop': 226, 'use_sma': False, 'use_atr': True, 'use_adx': True, 'use_ema': True, 'use_spike': False, 'rsi_required': True, 'edge_k': 1.7318403767887354, 'edge_cap': 0.24767714192821183, 'bull_strategy': 'breakout', 'bull_bb_std_mult': 2.3908219231460572, 'bull_rsi_os': 26, 'bull_rsi_ob': 79, 'bull_adx_thresh': 27.995857652657875, 'bull_atr_min_pct': 0.02527234136724981, 'bull_atr_max_pct': 0.03863908412317625, 'bull_tp_mult': 1.3992157620355137, 'bull_tsl_mult': 0.1930403155284371, 'bull_time_stop': 41, 'bull_use_sma': False, 'bull_use_ema': False, 'bull_use_atr': False, 'bull_use_adx': True, 'bull_use_spike': True, 'bull_rsi_required': False, 'bear_strategy': 'breakout', 'bear_bb_std_mult': 1.3973785459008021, 'bear_rsi_os': 35, 'bear_rsi_ob': 69, 'bear_adx_thresh': 27.748579859986936, 'bear_atr_min_pct': 0.021283621879193616, 'bear_atr_max_pct': 0.1383798443155909, 'bear_tp_mult': 1.832125381653522, 'bear_tsl_mult': 0.09567737048528485, 'bear_time_stop': 275, 'bear_use_sma': True, 'bear_use_ema': False, 'bear_use_atr': True, 'bear_use_adx': False, 'bear_use_spike': False, 'bear_rsi_required': False, 'sideways_strategy': 'breakout', 'sideways_bb_std_mult': 1.6258954482176478, 'sideways_rsi_os': 21, 'sideways_rsi_ob': 48, 'sideways_adx_thresh': 21.681791794273895, 'sideways_atr_min_pct': 0.017762584307877957, 'sideways_atr_max_pct': 0.08204102737472041, 'sideways_tp_mult': 2.0529698708508857, 'sideways_tsl_mult': 0.00713096088006073, 'sideways_time_stop': 142, 'sideways_use_sma': False, 'sideways_use_ema': False, 'sideways_use_atr': False, 'sideways_use_adx': False, 'sideways_use_spike': False, 'sideways_rsi_required': True}.
[I 2025-09-01 11:07:16,361] Trial 160 finished with values: [-1000000000.0, 1000000000.0] and parameters: {'p_sma': 10, 'p_std': 27, 'p_atr': 7, 'p_adx': 21, 'rsi_period': 34, 'ema1': 22, 'ema2': 57, 'slip_atr_k': 0.150570482401261, 'slip_spread_k': 0.5502270077157977, 'spread_hl_frac': 0.01737022220106571, 'bb_std_mult': 2.08335161163676, 'rsi_os': 28, 'rsi_ob': 81, 'vol_spike': 0.13812963119782046, 'adx_thresh': 30.947048002152858, 'atr_min_pct': 0.0168696598292287, 'atr_max_pct': 0.09524888231976508, 'tp_mult': 2.5300002856180477, 'tsl_mult': 0.03212475112340413, 'strategy': 'breakout', 'time_stop': 243, 'use_sma': False, 'use_atr': False, 'use_adx': False, 'use_ema': True, 'use_spike': True, 'rsi_required': True, 'edge_k': 1.6742274638693888, 'edge_cap': 0.7454431751582304, 'bull_strategy': 'breakout', 'bull_bb_std_mult': 2.035882987970139, 'bull_rsi_os': 26, 'bull_rsi_ob': 79, 'bull_adx_thresh': 29.30086523736338, 'bull_atr_min_pct': 0.0028236869628427497, 'bull_atr_max_pct': 0.038724859624009476, 'bull_tp_mult': 1.3880603654586254, 'bull_tsl_mult': 0.9758642824647353, 'bull_time_stop': 17, 'bull_use_sma': False, 'bull_use_ema': True, 'bull_use_atr': False, 'bull_use_adx': True, 'bull_use_spike': True, 'bull_rsi_required': False, 'bear_strategy': 'breakout', 'bear_bb_std_mult': 1.0438689549074551, 'bear_rsi_os': 35, 'bear_rsi_ob': 68, 'bear_adx_thresh': 15.102489331442742, 'bear_atr_min_pct': 0.018463047790634856, 'bear_atr_max_pct': 0.1389335825208301, 'bear_tp_mult': 1.8239143192827243, 'bear_tsl_mult': 0.4332521656716945, 'bear_time_stop': 139, 'bear_use_sma': True, 'bear_use_ema': True, 'bear_use_atr': False, 'bear_use_adx': False, 'bear_use_spike': False, 'bear_rsi_required': False, 'sideways_strategy': 'breakout', 'sideways_bb_std_mult': 3.4542296623533937, 'sideways_rsi_os': 42, 'sideways_rsi_ob': 48, 'sideways_adx_thresh': 23.18552079717916, 'sideways_atr_min_pct': 0.006889549854971068, 'sideways_atr_max_pct': 0.043821745111523605, 'sideways_tp_mult': 2.0432969581354863, 'sideways_tsl_mult': 0.12983163350374588, 'sideways_time_stop': 6, 'sideways_use_sma': False, 'sideways_use_ema': False, 'sideways_use_atr': False, 'sideways_use_adx': False, 'sideways_use_spike': False, 'sideways_rsi_required': True}.
[I 2025-09-01 11:07:16,817] Trial 158 finished with values: [-0.005401912084333382, 0.006254465057193759] and parameters: {'p_sma': 10, 'p_std': 26, 'p_atr': 22, 'p_adx': 24, 'rsi_period': 40, 'ema1': 6, 'ema2': 57, 'slip_atr_k': 0.02224833662782038, 'slip_spread_k': 0.5544227618758332, 'spread_hl_frac': 0.017167960152411586, 'bb_std_mult': 0.7379050401090508, 'rsi_os': 8, 'rsi_ob': 65, 'vol_spike': 0.03334479981937735, 'adx_thresh': 31.4555159733929, 'atr_min_pct': 0.016851041854078277, 'atr_max_pct': 0.06843546513189118, 'tp_mult': 2.519771404685061, 'tsl_mult': 0.6924802597597683, 'strategy': 'mean_reversion', 'time_stop': 246, 'use_sma': False, 'use_atr': True, 'use_adx': True, 'use_ema': True, 'use_spike': False, 'rsi_required': True, 'edge_k': 1.7319320890911025, 'edge_cap': 0.46932019617764564, 'bull_strategy': 'breakout', 'bull_bb_std_mult': 2.0141076924947052, 'bull_rsi_os': 16, 'bull_rsi_ob': 57, 'bull_adx_thresh': 30.344140219073907, 'bull_atr_min_pct': 0.0006772958129834783, 'bull_atr_max_pct': 0.10736100557178653, 'bull_tp_mult': 2.2875170451319433, 'bull_tsl_mult': 0.505374164630326, 'bull_time_stop': 40, 'bull_use_sma': False, 'bull_use_ema': False, 'bull_use_atr': False, 'bull_use_adx': True, 'bull_use_spike': True, 'bull_rsi_required': False, 'bear_strategy': 'breakout', 'bear_bb_std_mult': 1.3204868233856464, 'bear_rsi_os': 40, 'bear_rsi_ob': 69, 'bear_adx_thresh': 22.85677198935284, 'bear_atr_min_pct': 0.018251351724092438, 'bear_atr_max_pct': 0.13942549213164562, 'bear_tp_mult': 1.8268756665056434, 'bear_tsl_mult': 0.15818093571987957, 'bear_time_stop': 118, 'bear_use_sma': True, 'bear_use_ema': False, 'bear_use_atr': True, 'bear_use_adx': False, 'bear_use_spike': True, 'bear_rsi_required': False, 'sideways_strategy': 'breakout', 'sideways_bb_std_mult': 2.2709623353526576, 'sideways_rsi_os': 36, 'sideways_rsi_ob': 48, 'sideways_adx_thresh': 23.215433417188798, 'sideways_atr_min_pct': 0.020036493695333422, 'sideways_atr_max_pct': 0.04375239289834515, 'sideways_tp_mult': 1.414857164811742, 'sideways_tsl_mult': 0.004737419091631396, 'sideways_time_stop': 163, 'sideways_use_sma': False, 'sideways_use_ema': True, 'sideways_use_atr': False, 'sideways_use_adx': False, 'sideways_use_spike': False, 'sideways_rsi_required': True}.
[I 2025-09-01 11:07:17,365] Trial 164 finished with values: [-1000000000.0, 1000000000.0] and parameters: {'p_sma': 6, 'p_std': 36, 'p_atr': 27, 'p_adx': 26, 'rsi_period': 38, 'ema1': 20, 'ema2': 54, 'slip_atr_k': 0.03978908786221842, 'slip_spread_k': 0.2766750851763552, 'spread_hl_frac': 0.0002684480875432935, 'bb_std_mult': 2.294191274999003, 'rsi_os': 37, 'rsi_ob': 45, 'vol_spike': 0.14577817633582477, 'adx_thresh': 7.062982672626252, 'atr_min_pct': 0.006903550898955127, 'atr_max_pct': 0.07885109721646058, 'tp_mult': 1.726128134555613, 'tsl_mult': 0.5852959272910039, 'strategy': 'mean_reversion', 'time_stop': 262, 'use_sma': True, 'use_atr': True, 'use_adx': True, 'use_ema': True, 'use_spike': False, 'rsi_required': True, 'edge_k': 1.8330280613921093, 'edge_cap': 0.46880711962946364, 'bull_strategy': 'breakout', 'bull_bb_std_mult': 2.1824356552542006, 'bull_rsi_os': 28, 'bull_rsi_ob': 89, 'bull_adx_thresh': 9.942766475947991, 'bull_atr_min_pct': 0.006529458434811893, 'bull_atr_max_pct': 0.11051151868999401, 'bull_tp_mult': 2.494940570329144, 'bull_tsl_mult': 0.9294688306583704, 'bull_time_stop': 273, 'bull_use_sma': False, 'bull_use_ema': False, 'bull_use_atr': True, 'bull_use_adx': False, 'bull_use_spike': True, 'bull_rsi_required': False, 'bear_strategy': 'breakout', 'bear_bb_std_mult': 0.6117912418149709, 'bear_rsi_os': 42, 'bear_rsi_ob': 55, 'bear_adx_thresh': 22.58995798821781, 'bear_atr_min_pct': 0.020622326842445134, 'bear_atr_max_pct': 0.03741761848356064, 'bear_tp_mult': 2.375922996376301, 'bear_tsl_mult': 0.1262100889302932, 'bear_time_stop': 121, 'bear_use_sma': False, 'bear_use_ema': False, 'bear_use_atr': True, 'bear_use_adx': False, 'bear_use_spike': True, 'bear_rsi_required': False, 'sideways_strategy': 'breakout', 'sideways_bb_std_mult': 2.23342262263824, 'sideways_rsi_os': 28, 'sideways_rsi_ob': 74, 'sideways_adx_thresh': 25.58394768085896, 'sideways_atr_min_pct': 0.02023933654965897, 'sideways_atr_max_pct': 0.09357180292791463, 'sideways_tp_mult': 2.3218630171045644, 'sideways_tsl_mult': 0.6504385426774613, 'sideways_time_stop': 214, 'sideways_use_sma': False, 'sideways_use_ema': True, 'sideways_use_atr': False, 'sideways_use_adx': False, 'sideways_use_spike': True, 'sideways_rsi_required': False}.
