[I 2025-09-01 11:30:22,529] Trial 316 finished with values: [-1000000000.0, 1000000000.0] and parameters: {'p_sma': 46, 'p_std': 23, 'p_atr': 16, 'p_adx': 22, 'rsi_period': 50, 'ema1': 21, 'ema2': 29, 'slip_atr_k': 0.02094396924586712, 'slip_spread_k': 0.118888015889779, 'spread_hl_frac': 0.031038328649073646, 'bb_std_mult': 3.1410281597336183, 'rsi_os': 22, 'rsi_ob': 86, 'vol_spike': 0.11098536922445283, 'adx_thresh': 30.468955421394444, 'atr_min_pct': 0.010610799144552052, 'atr_max_pct': 0.1477585462872938, 'tp_mult': 2.6217795004654847, 'tsl_mult': 0.7997634899963766, 'strategy': 'mean_reversion', 'time_stop': 154, 'use_sma': True, 'use_atr': False, 'use_adx': False, 'use_ema': False, 'use_spike': True, 'rsi_required': True, 'edge_k': 0.44297294416675137, 'edge_cap': 0.6097721864483688, 'bull_strategy': 'breakout', 'bull_bb_std_mult': 2.9686449020689096, 'bull_rsi_os': 20, 'bull_rsi_ob': 95, 'bull_adx_thresh': 32.887388038599624, 'bull_atr_min_pct': 0.007902379400926739, 'bull_atr_max_pct': 0.13135424845479488, 'bull_tp_mult': 2.6024233201177935, 'bull_tsl_mult': 0.8529954142182682, 'bull_time_stop': 278, 'bull_use_sma': True, 'bull_use_ema': True, 'bull_use_atr': True, 'bull_use_adx': True, 'bull_use_spike': True, 'bull_rsi_required': False, 'bear_strategy': 'mean_reversion', 'bear_bb_std_mult': 1.638570991960897, 'bear_rsi_os': 9, 'bear_rsi_ob': 48, 'bear_adx_thresh': 16.14357124010273, 'bear_atr_min_pct': 0.008360108792825388, 'bear_atr_max_pct': 0.03311793656968069, 'bear_tp_mult': 1.3847102225837187, 'bear_tsl_mult': 0.27265271675318087, 'bear_time_stop': 150, 'bear_use_sma': False, 'bear_use_ema': True, 'bear_use_atr': False, 'bear_use_adx': False, 'bear_use_spike': True, 'bear_rsi_required': False, 'sideways_strategy': 'mean_reversion', 'sideways_bb_std_mult': 3.510498047477446, 'sideways_rsi_os': 16, 'sideways_rsi_ob': 53, 'sideways_adx_thresh': 13.408137210383218, 'sideways_atr_min_pct': 0.022995738416516122, 'sideways_atr_max_pct': 0.08940371048458631, 'sideways_tp_mult': 1.4934900307574421, 'sideways_tsl_mult': 0.5002855313092989, 'sideways_time_stop': 131, 'sideways_use_sma': True, 'sideways_use_ema': True, 'sideways_use_atr': False, 'sideways_use_adx': False, 'sideways_use_spike': False, 'sideways_rsi_required': True}.
[I 2025-09-01 11:30:22,926] Trial 315 finished with values: [-1000000000.0, 1000000000.0] and parameters: {'p_sma': 16, 'p_std': 17, 'p_atr': 19, 'p_adx': 22, 'rsi_period': 65, 'ema1': 12, 'ema2': 41, 'slip_atr_k': 0.06734734654002963, 'slip_spread_k': 0.11590392460459156, 'spread_hl_frac': 0.030905293333571913, 'bb_std_mult': 3.1351150325511963, 'rsi_os': 22, 'rsi_ob': 93, 'vol_spike': 0.10690873364687355, 'adx_thresh': 30.503141477660108, 'atr_min_pct': 0.009439209025808228, 'atr_max_pct': 0.14809557634033904, 'tp_mult': 2.62716604728124, 'tsl_mult': 0.8081693594587083, 'strategy': 'mean_reversion', 'time_stop': 120, 'use_sma': True, 'use_atr': False, 'use_adx': False, 'use_ema': False, 'use_spike': True, 'rsi_required': True, 'edge_k': 0.9709732286386361, 'edge_cap': 0.1311804850983989, 'bull_strategy': 'breakout', 'bull_bb_std_mult': 2.976763431337397, 'bull_rsi_os': 48, 'bull_rsi_ob': 92, 'bull_adx_thresh': 18.424604113719376, 'bull_atr_min_pct': 0.020898926983511715, 'bull_atr_max_pct': 0.09446117301516867, 'bull_tp_mult': 2.6141026714414455, 'bull_tsl_mult': 0.8133768629180693, 'bull_time_stop': 249, 'bull_use_sma': True, 'bull_use_ema': True, 'bull_use_atr': True, 'bull_use_adx': True, 'bull_use_spike': True, 'bull_rsi_required': False, 'bear_strategy': 'mean_reversion', 'bear_bb_std_mult': 2.9219102117184645, 'bear_rsi_os': 10, 'bear_rsi_ob': 48, 'bear_adx_thresh': 16.025853833765662, 'bear_atr_min_pct': 0.008354393910532915, 'bear_atr_max_pct': 0.03488017787392981, 'bear_tp_mult': 2.5568310857217225, 'bear_tsl_mult': 0.5903602037217089, 'bear_time_stop': 179, 'bear_use_sma': False, 'bear_use_ema': True, 'bear_use_atr': False, 'bear_use_adx': False, 'bear_use_spike': True, 'bear_rsi_required': False, 'sideways_strategy': 'mean_reversion', 'sideways_bb_std_mult': 2.3836725188273102, 'sideways_rsi_os': 24, 'sideways_rsi_ob': 74, 'sideways_adx_thresh': 21.91805570465031, 'sideways_atr_min_pct': 0.006490304973498329, 'sideways_atr_max_pct': 0.08088532344734414, 'sideways_tp_mult': 1.7695211847328163, 'sideways_tsl_mult': 0.5074996837768465, 'sideways_time_stop': 250, 'sideways_use_sma': True, 'sideways_use_ema': True, 'sideways_use_atr': False, 'sideways_use_adx': False, 'sideways_use_spike': False, 'sideways_rsi_required': True}.
[I 2025-09-01 11:30:23,152] Trial 314 finished with values: [-1000000000.0, 1000000000.0] and parameters: {'p_sma': 60, 'p_std': 31, 'p_atr': 22, 'p_adx': 30, 'rsi_period': 68, 'ema1': 21, 'ema2': 11, 'slip_atr_k': 0.022146335430229536, 'slip_spread_k': 0.6141227549536548, 'spread_hl_frac': 0.030736740130489087, 'bb_std_mult': 3.1944373094223533, 'rsi_os': 24, 'rsi_ob': 73, 'vol_spike': 0.10729958144648824, 'adx_thresh': 21.205924613743868, 'atr_min_pct': 0.00947771013402058, 'atr_max_pct': 0.14822539784367927, 'tp_mult': 2.2182257109253802, 'tsl_mult': 0.8263328181891284, 'strategy': 'mean_reversion', 'time_stop': 105, 'use_sma': True, 'use_atr': False, 'use_adx': False, 'use_ema': False, 'use_spike': True, 'rsi_required': True, 'edge_k': 0.3513573469109235, 'edge_cap': 0.7363753662890664, 'bull_strategy': 'breakout', 'bull_bb_std_mult': 2.9907725262646325, 'bull_rsi_os': 43, 'bull_rsi_ob': 48, 'bull_adx_thresh': 29.332652134617504, 'bull_atr_min_pct': 0.020825874356459478, 'bull_atr_max_pct': 0.09469713124778736, 'bull_tp_mult': 2.606447577825874, 'bull_tsl_mult': 0.8096425515652899, 'bull_time_stop': 248, 'bull_use_sma': True, 'bull_use_ema': True, 'bull_use_atr': True, 'bull_use_adx': True, 'bull_use_spike': True, 'bull_rsi_required': False, 'bear_strategy': 'breakout', 'bear_bb_std_mult': 2.144668947021353, 'bear_rsi_os': 35, 'bear_rsi_ob': 52, 'bear_adx_thresh': 16.1084468566805, 'bear_atr_min_pct': 0.00861219883149847, 'bear_atr_max_pct': 0.03551336388393151, 'bear_tp_mult': 1.4087978503874192, 'bear_tsl_mult': 0.5833360440809061, 'bear_time_stop': 181, 'bear_use_sma': False, 'bear_use_ema': True, 'bear_use_atr': False, 'bear_use_adx': False, 'bear_use_spike': True, 'bear_rsi_required': False, 'sideways_strategy': 'mean_reversion', 'sideways_bb_std_mult': 1.738461652323798, 'sideways_rsi_os': 14, 'sideways_rsi_ob': 70, 'sideways_adx_thresh': 24.580801087660433, 'sideways_atr_min_pct': 0.02328989350975032, 'sideways_atr_max_pct': 0.03462899474905179, 'sideways_tp_mult': 1.82066154215957, 'sideways_tsl_mult': 0.5084689852212463, 'sideways_time_stop': 124, 'sideways_use_sma': True, 'sideways_use_ema': True, 'sideways_use_atr': False, 'sideways_use_adx': False, 'sideways_use_spike': False, 'sideways_rsi_required': True}.
[I 2025-09-01 11:31:09,307] Trial 321 finished with values: [-1000000000.0, 1000000000.0] and parameters: {'p_sma': 12, 'p_std': 15, 'p_atr': 7, 'p_adx': 13, 'rsi_period': 47, 'ema1': 10, 'ema2': 23, 'slip_atr_k': 0.009485353180214979, 'slip_spread_k': 0.44746588153268, 'spread_hl_frac': 0.028455648664490334, 'bb_std_mult': 3.082600003124484, 'rsi_os': 30, 'rsi_ob': 86, 'vol_spike': 0.11796786245943787, 'adx_thresh': 12.197014520506212, 'atr_min_pct': 0.028179088642232324, 'atr_max_pct': 0.03232251557568941, 'tp_mult': 1.0102547729660332, 'tsl_mult': 0.878852517251704, 'strategy': 'breakout', 'time_stop': 262, 'use_sma': False, 'use_atr': False, 'use_adx': False, 'use_ema': True, 'use_spike': True, 'rsi_required': False, 'edge_k': 1.5017805392432915, 'edge_cap': 0.09766076645021451, 'bull_strategy': 'mean_reversion', 'bull_bb_std_mult': 2.904841927823831, 'bull_rsi_os': 11, 'bull_rsi_ob': 85, 'bull_adx_thresh': 6.529765804561293, 'bull_atr_min_pct': 0.023562125347649232, 'bull_atr_max_pct': 0.08160253927748051, 'bull_tp_mult': 1.979303443703942, 'bull_tsl_mult': 0.3643467568378644, 'bull_time_stop': 283, 'bull_use_sma': True, 'bull_use_ema': True, 'bull_use_atr': True, 'bull_use_adx': True, 'bull_use_spike': True, 'bull_rsi_required': False, 'bear_strategy': 'breakout', 'bear_bb_std_mult': 0.9907917168143143, 'bear_rsi_os': 32, 'bear_rsi_ob': 77, 'bear_adx_thresh': 27.115095743999344, 'bear_atr_min_pct': 0.009873050719504941, 'bear_atr_max_pct': 0.029196499640569452, 'bear_tp_mult': 2.6281768413084787, 'bear_tsl_mult': 0.25682175564147186, 'bear_time_stop': 36, 'bear_use_sma': True, 'bear_use_ema': True, 'bear_use_atr': False, 'bear_use_adx': True, 'bear_use_spike': False, 'bear_rsi_required': True, 'sideways_strategy': 'mean_reversion', 'sideways_bb_std_mult': 3.5080614887221766, 'sideways_rsi_os': 41, 'sideways_rsi_ob': 88, 'sideways_adx_thresh': 25.57981247332004, 'sideways_atr_min_pct': 0.020172861168398424, 'sideways_atr_max_pct': 0.12373804954600887, 'sideways_tp_mult': 1.444584690398207, 'sideways_tsl_mult': 0.3040937311370223, 'sideways_time_stop': 201, 'sideways_use_sma': True, 'sideways_use_ema': True, 'sideways_use_atr': True, 'sideways_use_adx': True, 'sideways_use_spike': False, 'sideways_rsi_required': False}.
[I 2025-09-01 11:31:09,909] Trial 318 finished with values: [-0.005494094699801999, 0.005286403741596] and parameters: {'p_sma': 12, 'p_std': 53, 'p_atr': 15, 'p_adx': 9, 'rsi_period': 50, 'ema1': 20, 'ema2': 38, 'slip_atr_k': 0.009425036589199336, 'slip_spread_k': 0.11567512880914699, 'spread_hl_frac': 0.04206626216264489, 'bb_std_mult': 3.143121158698502, 'rsi_os': 22, 'rsi_ob': 86, 'vol_spike': 0.10639757253608657, 'adx_thresh': 21.803717859056917, 'atr_min_pct': 0.019081162869168625, 'atr_max_pct': 0.03250362799196145, 'tp_mult': 2.6301707375585535, 'tsl_mult': 0.8688948758051352, 'strategy': 'breakout', 'time_stop': 122, 'use_sma': False, 'use_atr': False, 'use_adx': False, 'use_ema': False, 'use_spike': True, 'rsi_required': True, 'edge_k': 0.5977431904023025, 'edge_cap': 0.5959067481856292, 'bull_strategy': 'breakout', 'bull_bb_std_mult': 2.9125463227730823, 'bull_rsi_os': 20, 'bull_rsi_ob': 84, 'bull_adx_thresh': 29.301241574973485, 'bull_atr_min_pct': 0.0015379506529925211, 'bull_atr_max_pct': 0.12971331894228233, 'bull_tp_mult': 2.611222527033802, 'bull_tsl_mult': 0.8529736139106318, 'bull_time_stop': 289, 'bull_use_sma': True, 'bull_use_ema': True, 'bull_use_atr': True, 'bull_use_adx': True, 'bull_use_spike': True, 'bull_rsi_required': False, 'bear_strategy': 'breakout', 'bear_bb_std_mult': 2.9679404922503254, 'bear_rsi_os': 34, 'bear_rsi_ob': 77, 'bear_adx_thresh': 7.15248877178907, 'bear_atr_min_pct': 0.003664336123756766, 'bear_atr_max_pct': 0.028154793312707063, 'bear_tp_mult': 1.3275190569224904, 'bear_tsl_mult': 0.26126595442762424, 'bear_time_stop': 149, 'bear_use_sma': True, 'bear_use_ema': True, 'bear_use_atr': False, 'bear_use_adx': False, 'bear_use_spike': True, 'bear_rsi_required': False, 'sideways_strategy': 'mean_reversion', 'sideways_bb_std_mult': 2.348349156767257, 'sideways_rsi_os': 21, 'sideways_rsi_ob': 93, 'sideways_adx_thresh': 25.587703179477273, 'sideways_atr_min_pct': 0.022945113240393042, 'sideways_atr_max_pct': 0.08781502231007782, 'sideways_tp_mult': 1.4705628994980664, 'sideways_tsl_mult': 0.4876554043157633, 'sideways_time_stop': 256, 'sideways_use_sma': True, 'sideways_use_ema': True, 'sideways_use_atr': False, 'sideways_use_adx': False, 'sideways_use_spike': False, 'sideways_rsi_required': True}.
[I 2025-09-01 11:31:11,486] Trial 320 finished with values: [-1000000000.0, 1000000000.0] and parameters: {'p_sma': 12, 'p_std': 53, 'p_atr': 7, 'p_adx': 29, 'rsi_period': 47, 'ema1': 20, 'ema2': 38, 'slip_atr_k': 0.19569580710220552, 'slip_spread_k': 0.05127492417382938, 'spread_hl_frac': 0.028199581060101474, 'bb_std_mult': 3.2235824625575087, 'rsi_os': 27, 'rsi_ob': 86, 'vol_spike': 0.10583202523368464, 'adx_thresh': 12.473323198223675, 'atr_min_pct': 0.012035370547894136, 'atr_max_pct': 0.032715377512697555, 'tp_mult': 2.678541145833348, 'tsl_mult': 0.8708842589912206, 'strategy': 'breakout', 'time_stop': 260, 'use_sma': False, 'use_atr': False, 'use_adx': False, 'use_ema': True, 'use_spike': True, 'rsi_required': False, 'edge_k': 0.3700649399144762, 'edge_cap': 0.266221593848574, 'bull_strategy': 'breakout', 'bull_bb_std_mult': 0.6788880492142388, 'bull_rsi_os': 50, 'bull_rsi_ob': 83, 'bull_adx_thresh': 6.685106386720458, 'bull_atr_min_pct': 0.011417266225399524, 'bull_atr_max_pct': 0.08203900342291512, 'bull_tp_mult': 2.5570727915294107, 'bull_tsl_mult': 0.5631955198309866, 'bull_time_stop': 200, 'bull_use_sma': True, 'bull_use_ema': True, 'bull_use_atr': True, 'bull_use_adx': True, 'bull_use_spike': True, 'bull_rsi_required': False, 'bear_strategy': 'breakout', 'bear_bb_std_mult': 1.0024677584532042, 'bear_rsi_os': 35, 'bear_rsi_ob': 52, 'bear_adx_thresh': 7.405734407396112, 'bear_atr_min_pct': 0.0036632763231578417, 'bear_atr_max_pct': 0.028734605091188425, 'bear_tp_mult': 1.3308423912885692, 'bear_tsl_mult': 0.26073731903329833, 'bear_time_stop': 244, 'bear_use_sma': True, 'bear_use_ema': True, 'bear_use_atr': False, 'bear_use_adx': False, 'bear_use_spike': True, 'bear_rsi_required': True, 'sideways_strategy': 'mean_reversion', 'sideways_bb_std_mult': 3.5091952779137676, 'sideways_rsi_os': 41, 'sideways_rsi_ob': 66, 'sideways_adx_thresh': 25.66919080030649, 'sideways_atr_min_pct': 0.023067367791525857, 'sideways_atr_max_pct': 0.08611319229309032, 'sideways_tp_mult': 1.4315106490999108, 'sideways_tsl_mult': 0.7711093637337747, 'sideways_time_stop': 124, 'sideways_use_sma': True, 'sideways_use_ema': True, 'sideways_use_atr': True, 'sideways_use_adx': False, 'sideways_use_spike': False, 'sideways_rsi_required': True}.
[I 2025-09-01 11:31:11,492] Trial 319 finished with values: [0.002583358626171872, 0.005010530869286406] and parameters: {'p_sma': 12, 'p_std': 38, 'p_atr': 19, 'p_adx': 9, 'rsi_period': 51, 'ema1': 20, 'ema2': 15, 'slip_atr_k': 0.00955795338972903, 'slip_spread_k': 0.38981255939608495, 'spread_hl_frac': 0.027663921720576006, 'bb_std_mult': 3.2236326372246307, 'rsi_os': 27, 'rsi_ob': 86, 'vol_spike': 0.2810156178131208, 'adx_thresh': 21.89723735665375, 'atr_min_pct': 0.02822406554603198, 'atr_max_pct': 0.03195311030590922, 'tp_mult': 2.223762387298876, 'tsl_mult': 0.8804130963182958, 'strategy': 'breakout', 'time_stop': 260, 'use_sma': False, 'use_atr': False, 'use_adx': False, 'use_ema': True, 'use_spike': True, 'rsi_required': False, 'edge_k': 0.35564071066643566, 'edge_cap': 0.25774471228365237, 'bull_strategy': 'breakout', 'bull_bb_std_mult': 0.644844244204708, 'bull_rsi_os': 50, 'bull_rsi_ob': 83, 'bull_adx_thresh': 6.602164822772094, 'bull_atr_min_pct': 0.0035879994347782704, 'bull_atr_max_pct': 0.09486645997122031, 'bull_tp_mult': 1.9737096011718331, 'bull_tsl_mult': 0.5593256495376069, 'bull_time_stop': 286, 'bull_use_sma': True, 'bull_use_ema': True, 'bull_use_atr': True, 'bull_use_adx': True, 'bull_use_spike': True, 'bull_rsi_required': False, 'bear_strategy': 'breakout', 'bear_bb_std_mult': 0.9954059623561099, 'bear_rsi_os': 12, 'bear_rsi_ob': 48, 'bear_adx_thresh': 9.703612295461419, 'bear_atr_min_pct': 0.0036803351109814834, 'bear_atr_max_pct': 0.0294639356722491, 'bear_tp_mult': 1.29286486629114, 'bear_tsl_mult': 0.9751785775904116, 'bear_time_stop': 69, 'bear_use_sma': True, 'bear_use_ema': True, 'bear_use_atr': False, 'bear_use_adx': False, 'bear_use_spike': True, 'bear_rsi_required': True, 'sideways_strategy': 'mean_reversion', 'sideways_bb_std_mult': 1.7266262432904727, 'sideways_rsi_os': 39, 'sideways_rsi_ob': 93, 'sideways_adx_thresh': 5.8687048883467, 'sideways_atr_min_pct': 0.02294966478045841, 'sideways_atr_max_pct': 0.0857046196244038, 'sideways_tp_mult': 1.4324185809672323, 'sideways_tsl_mult': 0.43251990817630975, 'sideways_time_stop': 252, 'sideways_use_sma': True, 'sideways_use_ema': True, 'sideways_use_atr': True, 'sideways_use_adx': False, 'sideways_use_spike': False, 'sideways_rsi_required': True}.
[I 2025-09-01 11:31:12,522] Trial 324 finished with values: [-1000000000.0, 1000000000.0] and parameters: {'p_sma': 10, 'p_std': 38, 'p_atr': 19, 'p_adx': 9, 'rsi_period': 52, 'ema1': 19, 'ema2': 15, 'slip_atr_k': 0.006218384714848906, 'slip_spread_k': 0.3836812702803124, 'spread_hl_frac': 0.026246052435453117, 'bb_std_mult': 3.276469467396142, 'rsi_os': 29, 'rsi_ob': 85, 'vol_spike': 0.2723479241169804, 'adx_thresh': 22.121524465009657, 'atr_min_pct': 0.027011442901331912, 'atr_max_pct': 0.026428318292609575, 'tp_mult': 2.1579009979465287, 'tsl_mult': 0.9373819735504084, 'strategy': 'breakout', 'time_stop': 278, 'use_sma': False, 'use_atr': False, 'use_adx': False, 'use_ema': True, 'use_spike': True, 'rsi_required': False, 'edge_k': 0.42913092268760056, 'edge_cap': 0.1429392220230565, 'bull_strategy': 'breakout', 'bull_bb_std_mult': 1.06608318646904, 'bull_rsi_os': 52, 'bull_rsi_ob': 83, 'bull_adx_thresh': 7.3673147116178175, 'bull_atr_min_pct': 0.005863810894960496, 'bull_atr_max_pct': 0.09688627857859722, 'bull_tp_mult': 1.9078587137847423, 'bull_tsl_mult': 0.6367110295740415, 'bull_time_stop': 291, 'bull_use_sma': True, 'bull_use_ema': True, 'bull_use_atr': True, 'bull_use_adx': True, 'bull_use_spike': True, 'bull_rsi_required': False, 'bear_strategy': 'breakout', 'bear_bb_std_mult': 1.0384397220494304, 'bear_rsi_os': 12, 'bear_rsi_ob': 94, 'bear_adx_thresh': 8.800871110388169, 'bear_atr_min_pct': 0.003450442347916278, 'bear_atr_max_pct': 0.03169552638643753, 'bear_tp_mult': 1.2983235526449204, 'bear_tsl_mult': 0.9770941837309446, 'bear_time_stop': 68, 'bear_use_sma': True, 'bear_use_ema': True, 'bear_use_atr': False, 'bear_use_adx': False, 'bear_use_spike': True, 'bear_rsi_required': True, 'sideways_strategy': 'mean_reversion', 'sideways_bb_std_mult': 1.96641551931033, 'sideways_rsi_os': 39, 'sideways_rsi_ob': 93, 'sideways_adx_thresh': 5.8475014865013035, 'sideways_atr_min_pct': 0.022656062666929502, 'sideways_atr_max_pct': 0.08298168459385463, 'sideways_tp_mult': 1.370118836575481, 'sideways_tsl_mult': 0.40077723754007566, 'sideways_time_stop': 255, 'sideways_use_sma': True, 'sideways_use_ema': True, 'sideways_use_atr': True, 'sideways_use_adx': False, 'sideways_use_spike': False, 'sideways_rsi_required': True}.
[I 2025-09-01 11:31:12,786] Trial 326 finished with values: [-1000000000.0, 1000000000.0] and parameters: {'p_sma': 10, 'p_std': 39, 'p_atr': 18, 'p_adx': 9, 'rsi_period': 51, 'ema1': 19, 'ema2': 17, 'slip_atr_k': 0.009458663045035407, 'slip_spread_k': 0.353285872893899, 'spread_hl_frac': 0.02555179850594296, 'bb_std_mult': 3.2344319986791703, 'rsi_os': 31, 'rsi_ob': 86, 'vol_spike': 0.2796006118632771, 'adx_thresh': 23.399746750996414, 'atr_min_pct': 0.02657740154742601, 'atr_max_pct': 0.023462740799380988, 'tp_mult': 2.0901764801423357, 'tsl_mult': 0.9200009865163786, 'strategy': 'breakout', 'time_stop': 269, 'use_sma': False, 'use_atr': False, 'use_adx': False, 'use_ema': True, 'use_spike': True, 'rsi_required': False, 'edge_k': 0.49520108969940624, 'edge_cap': 0.21764890299693718, 'bull_strategy': 'breakout', 'bull_bb_std_mult': 0.583502518460434, 'bull_rsi_os': 51, 'bull_rsi_ob': 83, 'bull_adx_thresh': 5.947231972418061, 'bull_atr_min_pct': 0.004043040721196061, 'bull_atr_max_pct': 0.10047806259664376, 'bull_tp_mult': 2.0140250598968468, 'bull_tsl_mult': 0.5066863542878942, 'bull_time_stop': 297, 'bull_use_sma': True, 'bull_use_ema': True, 'bull_use_atr': True, 'bull_use_adx': True, 'bull_use_spike': True, 'bull_rsi_required': False, 'bear_strategy': 'breakout', 'bear_bb_std_mult': 1.0279347169844821, 'bear_rsi_os': 13, 'bear_rsi_ob': 46, 'bear_adx_thresh': 9.936875460308878, 'bear_atr_min_pct': 0.0031769164678892917, 'bear_atr_max_pct': 0.03770571546333194, 'bear_tp_mult': 1.3097911144741776, 'bear_tsl_mult': 0.9670110801024188, 'bear_time_stop': 63, 'bear_use_sma': True, 'bear_use_ema': True, 'bear_use_atr': False, 'bear_use_adx': False, 'bear_use_spike': True, 'bear_rsi_required': True, 'sideways_strategy': 'mean_reversion', 'sideways_bb_std_mult': 1.7456171351237029, 'sideways_rsi_os': 35, 'sideways_rsi_ob': 95, 'sideways_adx_thresh': 5.897943265993956, 'sideways_atr_min_pct': 0.022406832250490647, 'sideways_atr_max_pct': 0.07816320337789917, 'sideways_tp_mult': 1.4014926309779232, 'sideways_tsl_mult': 0.4204741621043932, 'sideways_time_stop': 250, 'sideways_use_sma': True, 'sideways_use_ema': True, 'sideways_use_atr': True, 'sideways_use_adx': False, 'sideways_use_spike': False, 'sideways_rsi_required': True}.
