[I 2025-09-01 11:51:50,216] Trial 440 finished with values: [-1000000000.0, 1000000000.0] and parameters: {'p_sma': 26, 'p_std': 32, 'p_atr': 22, 'p_adx': 7, 'rsi_period': 44, 'ema1': 25, 'ema2': 20, 'slip_atr_k': 0.038053681636379, 'slip_spread_k': 0.4875218409567149, 'spread_hl_frac': 0.0022694045854994727, 'bb_std_mult': 0.8011184911066165, 'rsi_os': 29, 'rsi_ob': 49, 'vol_spike': 0.19472002198150468, 'adx_thresh': 23.56282347389754, 'atr_min_pct': 0.022531583162260643, 'atr_max_pct': 0.07112156389248335, 'tp_mult': 2.0636088064002585, 'tsl_mult': 0.05945876189597199, 'strategy': 'breakout', 'time_stop': 154, 'use_sma': False, 'use_atr': True, 'use_adx': True, 'use_ema': True, 'use_spike': False, 'rsi_required': False, 'edge_k': 0.23489791308714286, 'edge_cap': 0.08169541776612838, 'bull_strategy': 'mean_reversion', 'bull_bb_std_mult': 1.6356227390039204, 'bull_rsi_os': 39, 'bull_rsi_ob': 51, 'bull_adx_thresh': 5.029549748681594, 'bull_atr_min_pct': 0.019429975389760292, 'bull_atr_max_pct': 0.11177393334915582, 'bull_tp_mult': 1.086496327809932, 'bull_tsl_mult': 0.6367879590638307, 'bull_time_stop': 152, 'bull_use_sma': False, 'bull_use_ema': False, 'bull_use_atr': True, 'bull_use_adx': False, 'bull_use_spike': False, 'bull_rsi_required': False, 'bear_strategy': 'breakout', 'bear_bb_std_mult': 1.3870614314534917, 'bear_rsi_os': 28, 'bear_rsi_ob': 52, 'bear_adx_thresh': 6.192967882393581, 'bear_atr_min_pct': 0.004366827151625012, 'bear_atr_max_pct': 0.01634319566482164, 'bear_tp_mult': 1.5150908603645827, 'bear_tsl_mult': 0.7409383832254199, 'bear_time_stop': 274, 'bear_use_sma': True, 'bear_use_ema': False, 'bear_use_atr': True, 'bear_use_adx': True, 'bear_use_spike': False, 'bear_rsi_required': True, 'sideways_strategy': 'breakout', 'sideways_bb_std_mult': 2.070068888243409, 'sideways_rsi_os': 45, 'sideways_rsi_ob': 91, 'sideways_adx_thresh': 34.38227830266281, 'sideways_atr_min_pct': 0.026251263247187025, 'sideways_atr_max_pct': 0.13707739494571472, 'sideways_tp_mult': 2.7378367550595373, 'sideways_tsl_mult': 0.38060098788128527, 'sideways_time_stop': 103, 'sideways_use_sma': False, 'sideways_use_ema': False, 'sideways_use_atr': True, 'sideways_use_adx': True, 'sideways_use_spike': True, 'sideways_rsi_required': False}.
[I 2025-09-01 11:51:50,660] Trial 443 finished with values: [-1000000000.0, 1000000000.0] and parameters: {'p_sma': 26, 'p_std': 32, 'p_atr': 21, 'p_adx': 8, 'rsi_period': 46, 'ema1': 25, 'ema2': 18, 'slip_atr_k': 0.04016563781132746, 'slip_spread_k': 0.45071297162889684, 'spread_hl_frac': 0.004266271751927191, 'bb_std_mult': 0.8733601666830662, 'rsi_os': 31, 'rsi_ob': 50, 'vol_spike': 0.20427026312111402, 'adx_thresh': 24.247650623049424, 'atr_min_pct': 0.0242771194270341, 'atr_max_pct': 0.07890875567506776, 'tp_mult': 2.0336517865763972, 'tsl_mult': 0.11288832472287261, 'strategy': 'breakout', 'time_stop': 177, 'use_sma': False, 'use_atr': True, 'use_adx': True, 'use_ema': True, 'use_spike': False, 'rsi_required': False, 'edge_k': 0.301109583540765, 'edge_cap': 0.07937783488735194, 'bull_strategy': 'mean_reversion', 'bull_bb_std_mult': 1.794434418681634, 'bull_rsi_os': 41, 'bull_rsi_ob': 50, 'bull_adx_thresh': 5.625693261101951, 'bull_atr_min_pct': 0.019374648775112007, 'bull_atr_max_pct': 0.1132098776037053, 'bull_tp_mult': 1.3209173273016894, 'bull_tsl_mult': 0.6120677234836682, 'bull_time_stop': 178, 'bull_use_sma': False, 'bull_use_ema': False, 'bull_use_atr': True, 'bull_use_adx': False, 'bull_use_spike': False, 'bull_rsi_required': False, 'bear_strategy': 'breakout', 'bear_bb_std_mult': 1.2489947617762556, 'bear_rsi_os': 28, 'bear_rsi_ob': 51, 'bear_adx_thresh': 6.907292228898415, 'bear_atr_min_pct': 0.005265559639678493, 'bear_atr_max_pct': 0.02007348544037498, 'bear_tp_mult': 1.4835136307834924, 'bear_tsl_mult': 0.6186770952273725, 'bear_time_stop': 277, 'bear_use_sma': True, 'bear_use_ema': False, 'bear_use_atr': True, 'bear_use_adx': True, 'bear_use_spike': False, 'bear_rsi_required': True, 'sideways_strategy': 'breakout', 'sideways_bb_std_mult': 2.140457418834993, 'sideways_rsi_os': 45, 'sideways_rsi_ob': 89, 'sideways_adx_thresh': 34.754495980950956, 'sideways_atr_min_pct': 0.025462041369195394, 'sideways_atr_max_pct': 0.13036630034981417, 'sideways_tp_mult': 2.771178933744957, 'sideways_tsl_mult': 0.36804263221026967, 'sideways_time_stop': 88, 'sideways_use_sma': False, 'sideways_use_ema': False, 'sideways_use_atr': True, 'sideways_use_adx': True, 'sideways_use_spike': True, 'sideways_rsi_required': False}.
[I 2025-09-01 11:51:50,923] Trial 441 finished with values: [-0.003430276560371426, 0.006135780168105588] and parameters: {'p_sma': 26, 'p_std': 35, 'p_atr': 22, 'p_adx': 8, 'rsi_period': 45, 'ema1': 25, 'ema2': 20, 'slip_atr_k': 0.0433144750366387, 'slip_spread_k': 0.43700260759305704, 'spread_hl_frac': 0.0044701895452963535, 'bb_std_mult': 1.0203686675965578, 'rsi_os': 31, 'rsi_ob': 49, 'vol_spike': 0.19622514960117077, 'adx_thresh': 24.800282215688608, 'atr_min_pct': 0.024413679255059613, 'atr_max_pct': 0.07973587007606754, 'tp_mult': 2.071961858725286, 'tsl_mult': 0.06873479405208502, 'strategy': 'breakout', 'time_stop': 177, 'use_sma': False, 'use_atr': True, 'use_adx': True, 'use_ema': True, 'use_spike': False, 'rsi_required': False, 'edge_k': 0.24635500619337372, 'edge_cap': 0.07754076482505984, 'bull_strategy': 'mean_reversion', 'bull_bb_std_mult': 1.6309423008421464, 'bull_rsi_os': 41, 'bull_rsi_ob': 52, 'bull_adx_thresh': 5.539998311409239, 'bull_atr_min_pct': 0.019642330380175016, 'bull_atr_max_pct': 0.1042544577143201, 'bull_tp_mult': 1.3099956571031315, 'bull_tsl_mult': 0.6373502212436657, 'bull_time_stop': 178, 'bull_use_sma': False, 'bull_use_ema': False, 'bull_use_atr': True, 'bull_use_adx': False, 'bull_use_spike': False, 'bull_rsi_required': False, 'bear_strategy': 'breakout', 'bear_bb_std_mult': 1.3828363895788789, 'bear_rsi_os': 28, 'bear_rsi_ob': 49, 'bear_adx_thresh': 6.171224456299834, 'bear_atr_min_pct': 0.004341514368826399, 'bear_atr_max_pct': 0.017766072422423493, 'bear_tp_mult': 1.5068431130243736, 'bear_tsl_mult': 0.6839186731298298, 'bear_time_stop': 273, 'bear_use_sma': True, 'bear_use_ema': False, 'bear_use_atr': True, 'bear_use_adx': True, 'bear_use_spike': False, 'bear_rsi_required': True, 'sideways_strategy': 'breakout', 'sideways_bb_std_mult': 2.0230804327449063, 'sideways_rsi_os': 47, 'sideways_rsi_ob': 90, 'sideways_adx_thresh': 34.35726275105626, 'sideways_atr_min_pct': 0.02550438899160212, 'sideways_atr_max_pct': 0.13576881729899792, 'sideways_tp_mult': 2.7469500430217235, 'sideways_tsl_mult': 0.3645358363722695, 'sideways_time_stop': 104, 'sideways_use_sma': False, 'sideways_use_ema': False, 'sideways_use_atr': True, 'sideways_use_adx': True, 'sideways_use_spike': True, 'sideways_rsi_required': False}.
[I 2025-09-01 11:52:31,456] Trial 447 finished with values: [-0.011806462901281178, 0.012886572816414855] and parameters: {'p_sma': 28, 'p_std': 34, 'p_atr': 20, 'p_adx': 8, 'rsi_period': 47, 'ema1': 24, 'ema2': 18, 'slip_atr_k': 0.047866026545002355, 'slip_spread_k': 0.4711193565857488, 'spread_hl_frac': 8.071865218695854e-06, 'bb_std_mult': 1.0624081759682362, 'rsi_os': 29, 'rsi_ob': 51, 'vol_spike': 0.20552555595930527, 'adx_thresh': 23.046839555684475, 'atr_min_pct': 0.023575408307782028, 'atr_max_pct': 0.08331273808165048, 'tp_mult': 2.156825449146007, 'tsl_mult': 0.10003643879664774, 'strategy': 'breakout', 'time_stop': 168, 'use_sma': False, 'use_atr': True, 'use_adx': True, 'use_ema': True, 'use_spike': False, 'rsi_required': False, 'edge_k': 0.3034061305430944, 'edge_cap': 0.11274364286147498, 'bull_strategy': 'mean_reversion', 'bull_bb_std_mult': 1.6936311612064465, 'bull_rsi_os': 37, 'bull_rsi_ob': 52, 'bull_adx_thresh': 6.226971568826106, 'bull_atr_min_pct': 0.018014627815657592, 'bull_atr_max_pct': 0.10402337235422188, 'bull_tp_mult': 1.3449022900318373, 'bull_tsl_mult': 0.5920637050714307, 'bull_time_stop': 163, 'bull_use_sma': False, 'bull_use_ema': False, 'bull_use_atr': True, 'bull_use_adx': False, 'bull_use_spike': False, 'bull_rsi_required': False, 'bear_strategy': 'breakout', 'bear_bb_std_mult': 1.2863746022441913, 'bear_rsi_os': 27, 'bear_rsi_ob': 49, 'bear_adx_thresh': 8.229545804110028, 'bear_atr_min_pct': 0.0036050353146699675, 'bear_atr_max_pct': 0.019900771764530874, 'bear_tp_mult': 1.4171518449015472, 'bear_tsl_mult': 0.6753862355508102, 'bear_time_stop': 265, 'bear_use_sma': True, 'bear_use_ema': False, 'bear_use_atr': True, 'bear_use_adx': True, 'bear_use_spike': False, 'bear_rsi_required': True, 'sideways_strategy': 'breakout', 'sideways_bb_std_mult': 1.987054880091849, 'sideways_rsi_os': 47, 'sideways_rsi_ob': 90, 'sideways_adx_thresh': 31.437541648377845, 'sideways_atr_min_pct': 0.027301997477971567, 'sideways_atr_max_pct': 0.13074278260443079, 'sideways_tp_mult': 2.636147360870276, 'sideways_tsl_mult': 0.3402168008980276, 'sideways_time_stop': 74, 'sideways_use_sma': False, 'sideways_use_ema': False, 'sideways_use_atr': True, 'sideways_use_adx': True, 'sideways_use_spike': True, 'sideways_rsi_required': False}.
[I 2025-09-01 11:52:31,953] Trial 446 finished with values: [-0.0003271575675338756, 0.008951678012026721] and parameters: {'p_sma': 28, 'p_std': 34, 'p_atr': 20, 'p_adx': 8, 'rsi_period': 42, 'ema1': 24, 'ema2': 18, 'slip_atr_k': 0.04541524673693216, 'slip_spread_k': 0.4642966600314999, 'spread_hl_frac': 0.0011141320637564583, 'bb_std_mult': 0.9534321879895462, 'rsi_os': 29, 'rsi_ob': 47, 'vol_spike': 0.208076850860499, 'adx_thresh': 23.14015729029442, 'atr_min_pct': 0.023788462750911038, 'atr_max_pct': 0.08382882832375194, 'tp_mult': 2.1554186478785766, 'tsl_mult': 0.10159515269049067, 'strategy': 'breakout', 'time_stop': 168, 'use_sma': False, 'use_atr': True, 'use_adx': True, 'use_ema': True, 'use_spike': False, 'rsi_required': False, 'edge_k': 0.31948312864618833, 'edge_cap': 0.10613931734648163, 'bull_strategy': 'mean_reversion', 'bull_bb_std_mult': 1.6946443946906955, 'bull_rsi_os': 38, 'bull_rsi_ob': 52, 'bull_adx_thresh': 6.2034856691243005, 'bull_atr_min_pct': 0.017146801723493196, 'bull_atr_max_pct': 0.10608108573734493, 'bull_tp_mult': 1.4049354708188604, 'bull_tsl_mult': 0.5913827921533452, 'bull_time_stop': 163, 'bull_use_sma': False, 'bull_use_ema': False, 'bull_use_atr': True, 'bull_use_adx': False, 'bull_use_spike': False, 'bull_rsi_required': False, 'bear_strategy': 'breakout', 'bear_bb_std_mult': 1.3004019573391716, 'bear_rsi_os': 29, 'bear_rsi_ob': 51, 'bear_adx_thresh': 7.94261691357007, 'bear_atr_min_pct': 0.0037642715590992357, 'bear_atr_max_pct': 0.02077330853929851, 'bear_tp_mult': 1.444394039669953, 'bear_tsl_mult': 0.6372033042636728, 'bear_time_stop': 264, 'bear_use_sma': True, 'bear_use_ema': False, 'bear_use_atr': True, 'bear_use_adx': True, 'bear_use_spike': False, 'bear_rsi_required': True, 'sideways_strategy': 'breakout', 'sideways_bb_std_mult': 2.005293811146017, 'sideways_rsi_os': 48, 'sideways_rsi_ob': 89, 'sideways_adx_thresh': 31.457300137329735, 'sideways_atr_min_pct': 0.027438274238088103, 'sideways_atr_max_pct': 0.1326826953985055, 'sideways_tp_mult': 2.6359121575789217, 'sideways_tsl_mult': 0.34857752881977444, 'sideways_time_stop': 90, 'sideways_use_sma': False, 'sideways_use_ema': False, 'sideways_use_atr': True, 'sideways_use_adx': True, 'sideways_use_spike': True, 'sideways_rsi_required': False}.
[I 2025-09-01 11:52:32,283] Trial 444 finished with values: [-1000000000.0, 1000000000.0] and parameters: {'p_sma': 26, 'p_std': 32, 'p_atr': 21, 'p_adx': 8, 'rsi_period': 46, 'ema1': 25, 'ema2': 18, 'slip_atr_k': 0.03654506097577779, 'slip_spread_k': 0.4549888628181609, 'spread_hl_frac': 0.0013347378445492473, 'bb_std_mult': 1.0537585477344988, 'rsi_os': 29, 'rsi_ob': 51, 'vol_spike': 0.2065956760239084, 'adx_thresh': 23.136017218965392, 'atr_min_pct': 0.024029605044363214, 'atr_max_pct': 0.07901827940541313, 'tp_mult': 2.14872379124595, 'tsl_mult': 0.10709413551947239, 'strategy': 'breakout', 'time_stop': 168, 'use_sma': False, 'use_atr': True, 'use_adx': True, 'use_ema': True, 'use_spike': False, 'rsi_required': False, 'edge_k': 0.31288946447100846, 'edge_cap': 0.11536029615500397, 'bull_strategy': 'mean_reversion', 'bull_bb_std_mult': 1.828493387203764, 'bull_rsi_os': 37, 'bull_rsi_ob': 52, 'bull_adx_thresh': 5.537302488314372, 'bull_atr_min_pct': 0.018152837213650824, 'bull_atr_max_pct': 0.11170260088524162, 'bull_tp_mult': 1.3351435805902763, 'bull_tsl_mult': 0.5922192742560298, 'bull_time_stop': 159, 'bull_use_sma': False, 'bull_use_ema': False, 'bull_use_atr': True, 'bull_use_adx': False, 'bull_use_spike': False, 'bull_rsi_required': False, 'bear_strategy': 'breakout', 'bear_bb_std_mult': 1.2649084310227419, 'bear_rsi_os': 29, 'bear_rsi_ob': 51, 'bear_adx_thresh': 7.835071094883455, 'bear_atr_min_pct': 0.0051551461113304295, 'bear_atr_max_pct': 0.020903202912226294, 'bear_tp_mult': 1.4097724920674422, 'bear_tsl_mult': 0.6125446481476966, 'bear_time_stop': 257, 'bear_use_sma': True, 'bear_use_ema': False, 'bear_use_atr': True, 'bear_use_adx': True, 'bear_use_spike': False, 'bear_rsi_required': True, 'sideways_strategy': 'breakout', 'sideways_bb_std_mult': 1.991441068709934, 'sideways_rsi_os': 44, 'sideways_rsi_ob': 89, 'sideways_adx_thresh': 34.50730950113904, 'sideways_atr_min_pct': 0.02524091555584876, 'sideways_atr_max_pct': 0.13028513072098044, 'sideways_tp_mult': 2.753203070145776, 'sideways_tsl_mult': 0.3534989858228428, 'sideways_time_stop': 76, 'sideways_use_sma': False, 'sideways_use_ema': False, 'sideways_use_atr': True, 'sideways_use_adx': True, 'sideways_use_spike': True, 'sideways_rsi_required': False}.
[I 2025-09-01 11:52:32,627] Trial 445 finished with values: [-1000000000.0, 1000000000.0] and parameters: {'p_sma': 25, 'p_std': 33, 'p_atr': 20, 'p_adx': 8, 'rsi_period': 46, 'ema1': 24, 'ema2': 18, 'slip_atr_k': 0.03462665766102645, 'slip_spread_k': 0.4573513832881493, 'spread_hl_frac': 0.0009346497718083499, 'bb_std_mult': 0.8883588177647149, 'rsi_os': 31, 'rsi_ob': 50, 'vol_spike': 0.2040114959226563, 'adx_thresh': 24.625578783301872, 'atr_min_pct': 0.023811534285538134, 'atr_max_pct': 0.08348908137005787, 'tp_mult': 2.102107157488358, 'tsl_mult': 0.10785954800513789, 'strategy': 'breakout', 'time_stop': 166, 'use_sma': False, 'use_atr': True, 'use_adx': True, 'use_ema': True, 'use_spike': False, 'rsi_required': False, 'edge_k': 0.31499466090745576, 'edge_cap': 0.10277273635439042, 'bull_strategy': 'mean_reversion', 'bull_bb_std_mult': 1.8261517516938879, 'bull_rsi_os': 36, 'bull_rsi_ob': 50, 'bull_adx_thresh': 5.976197310332685, 'bull_atr_min_pct': 0.018212354374075743, 'bull_atr_max_pct': 0.10371852567559975, 'bull_tp_mult': 1.3449319803108868, 'bull_tsl_mult': 0.6051929666624284, 'bull_time_stop': 158, 'bull_use_sma': False, 'bull_use_ema': False, 'bull_use_atr': True, 'bull_use_adx': False, 'bull_use_spike': False, 'bull_rsi_required': False, 'bear_strategy': 'breakout', 'bear_bb_std_mult': 1.262660306927606, 'bear_rsi_os': 27, 'bear_rsi_ob': 51, 'bear_adx_thresh': 8.03440175856972, 'bear_atr_min_pct': 0.005171230795189224, 'bear_atr_max_pct': 0.020380311388783948, 'bear_tp_mult': 1.4110354395310412, 'bear_tsl_mult': 0.6102365765096011, 'bear_time_stop': 263, 'bear_use_sma': True, 'bear_use_ema': False, 'bear_use_atr': True, 'bear_use_adx': True, 'bear_use_spike': False, 'bear_rsi_required': True, 'sideways_strategy': 'breakout', 'sideways_bb_std_mult': 2.003520964484302, 'sideways_rsi_os': 48, 'sideways_rsi_ob': 89, 'sideways_adx_thresh': 31.366334956390723, 'sideways_atr_min_pct': 0.025284085065575154, 'sideways_atr_max_pct': 0.13064036949403035, 'sideways_tp_mult': 2.650596312755257, 'sideways_tsl_mult': 0.347354656886609, 'sideways_time_stop': 91, 'sideways_use_sma': False, 'sideways_use_ema': False, 'sideways_use_atr': True, 'sideways_use_adx': True, 'sideways_use_spike': True, 'sideways_rsi_required': False}.
[I 2025-09-01 11:53:12,132] Trial 448 finished with values: [-1000000000.0, 1000000000.0] and parameters: {'p_sma': 25, 'p_std': 31, 'p_atr': 21, 'p_adx': 8, 'rsi_period': 42, 'ema1': 24, 'ema2': 18, 'slip_atr_k': 0.0464091776597607, 'slip_spread_k': 0.41466696886655297, 'spread_hl_frac': 0.0013289088477297748, 'bb_std_mult': 0.952066083812761, 'rsi_os': 31, 'rsi_ob': 47, 'vol_spike': 0.2089203940359954, 'adx_thresh': 24.633077846635704, 'atr_min_pct': 0.024619531218241557, 'atr_max_pct': 0.074056042464173, 'tp_mult': 2.154328288913312, 'tsl_mult': 0.03859228925268892, 'strategy': 'breakout', 'time_stop': 184, 'use_sma': False, 'use_atr': True, 'use_adx': True, 'use_ema': True, 'use_spike': False, 'rsi_required': False, 'edge_k': 0.197885099428046, 'edge_cap': 0.11492983748346758, 'bull_strategy': 'mean_reversion', 'bull_bb_std_mult': 1.8659075571487234, 'bull_rsi_os': 40, 'bull_rsi_ob': 50, 'bull_adx_thresh': 6.892006752648444, 'bull_atr_min_pct': 0.017107680509396362, 'bull_atr_max_pct': 0.10483818706383854, 'bull_tp_mult': 1.4078810945710625, 'bull_tsl_mult': 0.595357233295311, 'bull_time_stop': 160, 'bull_use_sma': False, 'bull_use_ema': False, 'bull_use_atr': True, 'bull_use_adx': False, 'bull_use_spike': False, 'bull_rsi_required': False, 'bear_strategy': 'breakout', 'bear_bb_std_mult': 1.200028923372869, 'bear_rsi_os': 29, 'bear_rsi_ob': 51, 'bear_adx_thresh': 7.7775919231638175, 'bear_atr_min_pct': 0.004892960257936413, 'bear_atr_max_pct': 0.021300540482608838, 'bear_tp_mult': 1.413703795444754, 'bear_tsl_mult': 0.6932855038000355, 'bear_time_stop': 268, 'bear_use_sma': True, 'bear_use_ema': False, 'bear_use_atr': True, 'bear_use_adx': True, 'bear_use_spike': False, 'bear_rsi_required': True, 'sideways_strategy': 'breakout', 'sideways_bb_std_mult': 1.9964930709920792, 'sideways_rsi_os': 47, 'sideways_rsi_ob': 89, 'sideways_adx_thresh': 32.17193676018196, 'sideways_atr_min_pct': 0.02462880819685184, 'sideways_atr_max_pct': 0.13256545998041463, 'sideways_tp_mult': 2.6527665443888373, 'sideways_tsl_mult': 0.3562380773847973, 'sideways_time_stop': 94, 'sideways_use_sma': False, 'sideways_use_ema': False, 'sideways_use_atr': True, 'sideways_use_adx': True, 'sideways_use_spike': True, 'sideways_rsi_required': False}.
[I 2025-09-01 11:53:13,490] Trial 450 finished with values: [-0.012643363907483773, 0.014101886471037604] and parameters: {'p_sma': 28, 'p_std': 33, 'p_atr': 20, 'p_adx': 8, 'rsi_period': 48, 'ema1': 23, 'ema2': 17, 'slip_atr_k': 0.033642111393806975, 'slip_spread_k': 0.4071791651942247, 'spread_hl_frac': 0.0011261706218270015, 'bb_std_mult': 0.9345711694169011, 'rsi_os': 28, 'rsi_ob': 52, 'vol_spike': 0.20136935884118132, 'adx_thresh': 22.8531378428144, 'atr_min_pct': 0.023178106624379236, 'atr_max_pct': 0.07489551052643166, 'tp_mult': 2.1065399739867847, 'tsl_mult': 0.14641125549836598, 'strategy': 'breakout', 'time_stop': 205, 'use_sma': False, 'use_atr': True, 'use_adx': True, 'use_ema': True, 'use_spike': False, 'rsi_required': False, 'edge_k': 0.3141434806511067, 'edge_cap': 0.12758718660294177, 'bull_strategy': 'mean_reversion', 'bull_bb_std_mult': 1.524661177149686, 'bull_rsi_os': 35, 'bull_rsi_ob': 48, 'bull_adx_thresh': 6.086839971949395, 'bull_atr_min_pct': 0.01869587491938375, 'bull_atr_max_pct': 0.1038244052671088, 'bull_tp_mult': 1.4131083424509459, 'bull_tsl_mult': 0.5879210531027353, 'bull_time_stop': 185, 'bull_use_sma': False, 'bull_use_ema': False, 'bull_use_atr': True, 'bull_use_adx': False, 'bull_use_spike': False, 'bull_rsi_required': False, 'bear_strategy': 'breakout', 'bear_bb_std_mult': 1.1985004661893943, 'bear_rsi_os': 52, 'bear_rsi_ob': 49, 'bear_adx_thresh': 8.732424346848887, 'bear_atr_min_pct': 0.0031189494718814157, 'bear_atr_max_pct': 0.021283142531777724, 'bear_tp_mult': 1.468448584812317, 'bear_tsl_mult': 0.6960361967334053, 'bear_time_stop': 285, 'bear_use_sma': True, 'bear_use_ema': False, 'bear_use_atr': True, 'bear_use_adx': True, 'bear_use_spike': False, 'bear_rsi_required': True, 'sideways_strategy': 'breakout', 'sideways_bb_std_mult': 1.888019391435899, 'sideways_rsi_os': 43, 'sideways_rsi_ob': 91, 'sideways_adx_thresh': 32.08129717256426, 'sideways_atr_min_pct': 0.024698708495124334, 'sideways_atr_max_pct': 0.14113935051331075, 'sideways_tp_mult': 2.6709460292171996, 'sideways_tsl_mult': 0.3935111294193315, 'sideways_time_stop': 67, 'sideways_use_sma': False, 'sideways_use_ema': False, 'sideways_use_atr': True, 'sideways_use_adx': True, 'sideways_use_spike': True, 'sideways_rsi_required': False}.
