[I 2025-09-01 10:58:01,225] Trial 99 finished with values: [-1000000000.0, 1000000000.0] and parameters: {'p_sma': 14, 'p_std': 29, 'p_atr': 9, 'p_adx': 29, 'rsi_period': 38, 'ema1': 20, 'ema2': 32, 'slip_atr_k': 0.045597458188342294, 'slip_spread_k': 0.26273447342799455, 'spread_hl_frac': 0.002794928830630405, 'bb_std_mult': 2.579864059055028, 'rsi_os': 7, 'rsi_ob': 87, 'vol_spike': 0.1343527878968647, 'adx_thresh': 19.6661602416035, 'atr_min_pct': 0.025824957652462843, 'atr_max_pct': 0.12118565499570907, 'tp_mult': 1.8111260001889373, 'tsl_mult': 0.45307964566952985, 'strategy': 'mean_reversion', 'time_stop': 235, 'use_sma': True, 'use_atr': True, 'use_adx': True, 'use_ema': True, 'use_spike': False, 'rsi_required': True, 'edge_k': 1.7650666406812576, 'edge_cap': 0.5165242634056607, 'bull_strategy': 'mean_reversion', 'bull_bb_std_mult': 2.3212914590155744, 'bull_rsi_os': 51, 'bull_rsi_ob': 91, 'bull_adx_thresh': 30.809487889009766, 'bull_atr_min_pct': 0.023871040437184923, 'bull_atr_max_pct': 0.09495929736911488, 'bull_tp_mult': 1.3990641707787483, 'bull_tsl_mult': 0.07051757011217025, 'bull_time_stop': 135, 'bull_use_sma': True, 'bull_use_ema': False, 'bull_use_atr': True, 'bull_use_adx': True, 'bull_use_spike': True, 'bull_rsi_required': False, 'bear_strategy': 'breakout', 'bear_bb_std_mult': 1.1831785769112884, 'bear_rsi_os': 36, 'bear_rsi_ob': 91, 'bear_adx_thresh': 20.883502999363593, 'bear_atr_min_pct': 0.0021238843892774865, 'bear_atr_max_pct': 0.13739302675217105, 'bear_tp_mult': 1.803196419081664, 'bear_tsl_mult': 0.9873752161933951, 'bear_time_stop': 147, 'bear_use_sma': False, 'bear_use_ema': False, 'bear_use_atr': True, 'bear_use_adx': False, 'bear_use_spike': True, 'bear_rsi_required': False, 'sideways_strategy': 'mean_reversion', 'sideways_bb_std_mult': 2.953181124631086, 'sideways_rsi_os': 54, 'sideways_rsi_ob': 80, 'sideways_adx_thresh': 16.372195298065705, 'sideways_atr_min_pct': 0.020009662864255325, 'sideways_atr_max_pct': 0.09504627521880761, 'sideways_tp_mult': 1.7416843526015249, 'sideways_tsl_mult': 0.18081279695632918, 'sideways_time_stop': 163, 'sideways_use_sma': False, 'sideways_use_ema': False, 'sideways_use_atr': False, 'sideways_use_adx': False, 'sideways_use_spike': False, 'sideways_rsi_required': True}.
[I 2025-09-01 10:58:01,638] Trial 100 finished with values: [-1000000000.0, 1000000000.0] and parameters: {'p_sma': 46, 'p_std': 25, 'p_atr': 18, 'p_adx': 9, 'rsi_period': 39, 'ema1': 23, 'ema2': 52, 'slip_atr_k': 0.050990800999350896, 'slip_spread_k': 0.2665017890012711, 'spread_hl_frac': 0.007245129568320574, 'bb_std_mult': 2.6570004322907894, 'rsi_os': 52, 'rsi_ob': 80, 'vol_spike': 0.1333048106983113, 'adx_thresh': 20.60449982437896, 'atr_min_pct': 0.023176947539703615, 'atr_max_pct': 0.13029945251190433, 'tp_mult': 1.8139710083152099, 'tsl_mult': 0.4631036425244624, 'strategy': 'mean_reversion', 'time_stop': 233, 'use_sma': True, 'use_atr': True, 'use_adx': True, 'use_ema': True, 'use_spike': False, 'rsi_required': True, 'edge_k': 1.7425541937294082, 'edge_cap': 0.5952941993905816, 'bull_strategy': 'breakout', 'bull_bb_std_mult': 2.449712138523899, 'bull_rsi_os': 51, 'bull_rsi_ob': 92, 'bull_adx_thresh': 34.315370459884875, 'bull_atr_min_pct': 0.023792263202164564, 'bull_atr_max_pct': 0.09484785486336529, 'bull_tp_mult': 1.4102767282987294, 'bull_tsl_mult': 0.9511422993984608, 'bull_time_stop': 38, 'bull_use_sma': True, 'bull_use_ema': False, 'bull_use_atr': True, 'bull_use_adx': True, 'bull_use_spike': True, 'bull_rsi_required': False, 'bear_strategy': 'mean_reversion', 'bear_bb_std_mult': 1.2076363689438367, 'bear_rsi_os': 36, 'bear_rsi_ob': 91, 'bear_adx_thresh': 24.149781938492048, 'bear_atr_min_pct': 0.0026150014733783197, 'bear_atr_max_pct': 0.13584406086326797, 'bear_tp_mult': 2.646108629340303, 'bear_tsl_mult': 0.11700847957723426, 'bear_time_stop': 100, 'bear_use_sma': False, 'bear_use_ema': False, 'bear_use_atr': True, 'bear_use_adx': False, 'bear_use_spike': True, 'bear_rsi_required': False, 'sideways_strategy': 'mean_reversion', 'sideways_bb_std_mult': 2.7858517662016653, 'sideways_rsi_os': 18, 'sideways_rsi_ob': 91, 'sideways_adx_thresh': 16.984941803173765, 'sideways_atr_min_pct': 0.015311953495093242, 'sideways_atr_max_pct': 0.09502458130864318, 'sideways_tp_mult': 2.017840364312869, 'sideways_tsl_mult': 0.02344622240831091, 'sideways_time_stop': 287, 'sideways_use_sma': True, 'sideways_use_ema': True, 'sideways_use_atr': False, 'sideways_use_adx': False, 'sideways_use_spike': False, 'sideways_rsi_required': True}.
[I 2025-09-01 10:58:01,680] Trial 102 finished with values: [-1000000000.0, 1000000000.0] and parameters: {'p_sma': 13, 'p_std': 25, 'p_atr': 14, 'p_adx': 23, 'rsi_period': 40, 'ema1': 23, 'ema2': 40, 'slip_atr_k': 0.04158979135592956, 'slip_spread_k': 0.24989094090342828, 'spread_hl_frac': 0.005134459279497163, 'bb_std_mult': 2.6904940410502447, 'rsi_os': 52, 'rsi_ob': 70, 'vol_spike': 0.13352188099228457, 'adx_thresh': 7.502181990748134, 'atr_min_pct': 0.025303072401625326, 'atr_max_pct': 0.1174637313645445, 'tp_mult': 1.8250529038495138, 'tsl_mult': 0.45239672649848617, 'strategy': 'mean_reversion', 'time_stop': 232, 'use_sma': True, 'use_atr': True, 'use_adx': True, 'use_ema': True, 'use_spike': False, 'rsi_required': True, 'edge_k': 1.7716696113411232, 'edge_cap': 0.49709202265394986, 'bull_strategy': 'breakout', 'bull_bb_std_mult': 2.455961924480157, 'bull_rsi_os': 54, 'bull_rsi_ob': 92, 'bull_adx_thresh': 34.589660764662895, 'bull_atr_min_pct': 0.023209990213898912, 'bull_atr_max_pct': 0.0955342562674237, 'bull_tp_mult': 1.7133420478920538, 'bull_tsl_mult': 0.07699368436640602, 'bull_time_stop': 40, 'bull_use_sma': True, 'bull_use_ema': False, 'bull_use_atr': True, 'bull_use_adx': True, 'bull_use_spike': True, 'bull_rsi_required': False, 'bear_strategy': 'mean_reversion', 'bear_bb_std_mult': 1.1607201969761858, 'bear_rsi_os': 36, 'bear_rsi_ob': 48, 'bear_adx_thresh': 19.444879465705768, 'bear_atr_min_pct': 0.02236517097953712, 'bear_atr_max_pct': 0.13562526668886873, 'bear_tp_mult': 1.8638572489357075, 'bear_tsl_mult': 0.11032062995176067, 'bear_time_stop': 96, 'bear_use_sma': False, 'bear_use_ema': False, 'bear_use_atr': True, 'bear_use_adx': False, 'bear_use_spike': True, 'bear_rsi_required': False, 'sideways_strategy': 'mean_reversion', 'sideways_bb_std_mult': 2.708771924042796, 'sideways_rsi_os': 18, 'sideways_rsi_ob': 89, 'sideways_adx_thresh': 16.40495407797452, 'sideways_atr_min_pct': 0.023095019906067004, 'sideways_atr_max_pct': 0.09529205497345933, 'sideways_tp_mult': 2.00584424075375, 'sideways_tsl_mult': 0.17476535276278693, 'sideways_time_stop': 136, 'sideways_use_sma': True, 'sideways_use_ema': False, 'sideways_use_atr': False, 'sideways_use_adx': False, 'sideways_use_spike': False, 'sideways_rsi_required': True}.
[I 2025-09-01 10:58:41,563] Trial 103 finished with values: [-1000000000.0, 1000000000.0] and parameters: {'p_sma': 47, 'p_std': 16, 'p_atr': 18, 'p_adx': 8, 'rsi_period': 84, 'ema1': 23, 'ema2': 39, 'slip_atr_k': 0.03754341850454208, 'slip_spread_k': 0.11779046594452874, 'spread_hl_frac': 0.007933629721276508, 'bb_std_mult': 2.97107140747267, 'rsi_os': 21, 'rsi_ob': 80, 'vol_spike': 0.034271669547713074, 'adx_thresh': 7.613364820734037, 'atr_min_pct': 0.028591365887157896, 'atr_max_pct': 0.14277515587002848, 'tp_mult': 1.7455736005305196, 'tsl_mult': 0.9427416819927898, 'strategy': 'mean_reversion', 'time_stop': 218, 'use_sma': True, 'use_atr': True, 'use_adx': True, 'use_ema': True, 'use_spike': False, 'rsi_required': True, 'edge_k': 1.7357312655966308, 'edge_cap': 0.6123372195062913, 'bull_strategy': 'breakout', 'bull_bb_std_mult': 1.9075095455633038, 'bull_rsi_os': 34, 'bull_rsi_ob': 45, 'bull_adx_thresh': 34.609487109283606, 'bull_atr_min_pct': 0.01608909805360084, 'bull_atr_max_pct': 0.1025905372268394, 'bull_tp_mult': 1.4962614711469788, 'bull_tsl_mult': 0.8638318892200222, 'bull_time_stop': 38, 'bull_use_sma': False, 'bull_use_ema': False, 'bull_use_atr': False, 'bull_use_adx': True, 'bull_use_spike': True, 'bull_rsi_required': False, 'bear_strategy': 'mean_reversion', 'bear_bb_std_mult': 1.3659988679714248, 'bear_rsi_os': 32, 'bear_rsi_ob': 90, 'bear_adx_thresh': 19.297657436224704, 'bear_atr_min_pct': 0.0255261550559442, 'bear_atr_max_pct': 0.13616372703452917, 'bear_tp_mult': 1.8582037264653568, 'bear_tsl_mult': 0.10580818762019983, 'bear_time_stop': 97, 'bear_use_sma': False, 'bear_use_ema': False, 'bear_use_atr': True, 'bear_use_adx': False, 'bear_use_spike': True, 'bear_rsi_required': False, 'sideways_strategy': 'breakout', 'sideways_bb_std_mult': 2.7286824828128107, 'sideways_rsi_os': 18, 'sideways_rsi_ob': 76, 'sideways_adx_thresh': 22.08810401954438, 'sideways_atr_min_pct': 0.02291304850036052, 'sideways_atr_max_pct': 0.016278285564118894, 'sideways_tp_mult': 2.39721459892515, 'sideways_tsl_mult': 0.015517597921849292, 'sideways_time_stop': 175, 'sideways_use_sma': True, 'sideways_use_ema': True, 'sideways_use_atr': False, 'sideways_use_adx': False, 'sideways_use_spike': False, 'sideways_rsi_required': True}.
[I 2025-09-01 10:58:42,230] Trial 101 finished with values: [-0.034227280485640055, 0.0340233882998474] and parameters: {'p_sma': 13, 'p_std': 16, 'p_atr': 8, 'p_adx': 29, 'rsi_period': 39, 'ema1': 23, 'ema2': 22, 'slip_atr_k': 0.03703851474471396, 'slip_spread_k': 0.26072296187262295, 'spread_hl_frac': 0.007681980534723458, 'bb_std_mult': 0.7015947405286792, 'rsi_os': 29, 'rsi_ob': 92, 'vol_spike': 0.13526008234962952, 'adx_thresh': 19.80274261916396, 'atr_min_pct': 0.02566925883522262, 'atr_max_pct': 0.11424515601830695, 'tp_mult': 1.8124548286360167, 'tsl_mult': 0.45614855766300955, 'strategy': 'mean_reversion', 'time_stop': 231, 'use_sma': True, 'use_atr': True, 'use_adx': True, 'use_ema': True, 'use_spike': False, 'rsi_required': True, 'edge_k': 1.4500847994510169, 'edge_cap': 0.5333001437691927, 'bull_strategy': 'breakout', 'bull_bb_std_mult': 1.8883146005650304, 'bull_rsi_os': 34, 'bull_rsi_ob': 90, 'bull_adx_thresh': 21.074312030736742, 'bull_atr_min_pct': 0.002675894477606515, 'bull_atr_max_pct': 0.09579163604080568, 'bull_tp_mult': 1.7124742567388884, 'bull_tsl_mult': 0.0436806767249745, 'bull_time_stop': 37, 'bull_use_sma': False, 'bull_use_ema': False, 'bull_use_atr': False, 'bull_use_adx': True, 'bull_use_spike': True, 'bull_rsi_required': False, 'bear_strategy': 'mean_reversion', 'bear_bb_std_mult': 1.17198997677443, 'bear_rsi_os': 36, 'bear_rsi_ob': 91, 'bear_adx_thresh': 19.585448334326447, 'bear_atr_min_pct': 6.0825348006013575e-05, 'bear_atr_max_pct': 0.13680252687404248, 'bear_tp_mult': 1.6270037197324365, 'bear_tsl_mult': 0.0990492956598606, 'bear_time_stop': 94, 'bear_use_sma': False, 'bear_use_ema': False, 'bear_use_atr': True, 'bear_use_adx': False, 'bear_use_spike': True, 'bear_rsi_required': False, 'sideways_strategy': 'mean_reversion', 'sideways_bb_std_mult': 2.6614271214118177, 'sideways_rsi_os': 53, 'sideways_rsi_ob': 87, 'sideways_adx_thresh': 16.745402958055266, 'sideways_atr_min_pct': 0.017265077658678893, 'sideways_atr_max_pct': 0.09338311725074713, 'sideways_tp_mult': 1.7371838952451832, 'sideways_tsl_mult': 0.18464686929984114, 'sideways_time_stop': 176, 'sideways_use_sma': True, 'sideways_use_ema': True, 'sideways_use_atr': False, 'sideways_use_adx': False, 'sideways_use_spike': False, 'sideways_rsi_required': True}.
[I 2025-09-01 10:58:42,769] Trial 104 finished with values: [-1000000000.0, 1000000000.0] and parameters: {'p_sma': 5, 'p_std': 27, 'p_atr': 8, 'p_adx': 23, 'rsi_period': 84, 'ema1': 26, 'ema2': 39, 'slip_atr_k': 0.03919190923256589, 'slip_spread_k': 0.16400483534862856, 'spread_hl_frac': 0.005017360028655757, 'bb_std_mult': 0.5029912953546677, 'rsi_os': 29, 'rsi_ob': 65, 'vol_spike': 0.12048981027983748, 'adx_thresh': 7.622403752615417, 'atr_min_pct': 0.020151394852697714, 'atr_max_pct': 0.11693911722685477, 'tp_mult': 1.752123271224668, 'tsl_mult': 0.6225871837007062, 'strategy': 'mean_reversion', 'time_stop': 219, 'use_sma': True, 'use_atr': True, 'use_adx': True, 'use_ema': True, 'use_spike': False, 'rsi_required': True, 'edge_k': 1.0561787145723305, 'edge_cap': 0.46763657724763497, 'bull_strategy': 'breakout', 'bull_bb_std_mult': 1.8892938319384425, 'bull_rsi_os': 55, 'bull_rsi_ob': 79, 'bull_adx_thresh': 29.269624180366748, 'bull_atr_min_pct': 0.0027654093141558683, 'bull_atr_max_pct': 0.04940875309322962, 'bull_tp_mult': 2.7932840516075403, 'bull_tsl_mult': 0.05862929982728432, 'bull_time_stop': 14, 'bull_use_sma': False, 'bull_use_ema': False, 'bull_use_atr': False, 'bull_use_adx': True, 'bull_use_spike': True, 'bull_rsi_required': False, 'bear_strategy': 'breakout', 'bear_bb_std_mult': 1.3800175557397703, 'bear_rsi_os': 32, 'bear_rsi_ob': 66, 'bear_adx_thresh': 19.738940804154044, 'bear_atr_min_pct': 0.0035527887498326017, 'bear_atr_max_pct': 0.13192870779258273, 'bear_tp_mult': 1.6249131472581633, 'bear_tsl_mult': 0.16782564199792266, 'bear_time_stop': 134, 'bear_use_sma': False, 'bear_use_ema': False, 'bear_use_atr': True, 'bear_use_adx': False, 'bear_use_spike': True, 'bear_rsi_required': False, 'sideways_strategy': 'breakout', 'sideways_bb_std_mult': 3.5027235544261535, 'sideways_rsi_os': 40, 'sideways_rsi_ob': 88, 'sideways_adx_thresh': 23.12676509716559, 'sideways_atr_min_pct': 0.01842481387285967, 'sideways_atr_max_pct': 0.10273817926862765, 'sideways_tp_mult': 2.109751130845549, 'sideways_tsl_mult': 0.06284869012586936, 'sideways_time_stop': 177, 'sideways_use_sma': False, 'sideways_use_ema': True, 'sideways_use_atr': False, 'sideways_use_adx': False, 'sideways_use_spike': False, 'sideways_rsi_required': True}.
[I 2025-09-01 10:58:43,070] Trial 105 finished with values: [-1000000000.0, 1000000000.0] and parameters: {'p_sma': 9, 'p_std': 27, 'p_atr': 8, 'p_adx': 13, 'rsi_period': 42, 'ema1': 25, 'ema2': 12, 'slip_atr_k': 0.036330011157340976, 'slip_spread_k': 0.16162616585250122, 'spread_hl_frac': 0.0038784000330068114, 'bb_std_mult': 0.7033799985836289, 'rsi_os': 29, 'rsi_ob': 92, 'vol_spike': 0.1541215703303931, 'adx_thresh': 5.089252308744808, 'atr_min_pct': 0.020611634744364955, 'atr_max_pct': 0.07078803954059852, 'tp_mult': 1.8714857356660997, 'tsl_mult': 0.6220053193598682, 'strategy': 'mean_reversion', 'time_stop': 219, 'use_sma': True, 'use_atr': True, 'use_adx': True, 'use_ema': True, 'use_spike': False, 'rsi_required': True, 'edge_k': 1.8602794282947135, 'edge_cap': 0.5371199787243084, 'bull_strategy': 'breakout', 'bull_bb_std_mult': 1.9359209201296275, 'bull_rsi_os': 33, 'bull_rsi_ob': 80, 'bull_adx_thresh': 28.94834363855828, 'bull_atr_min_pct': 0.011849106091469299, 'bull_atr_max_pct': 0.1030668984241296, 'bull_tp_mult': 1.6271099998575975, 'bull_tsl_mult': 0.8837988129049872, 'bull_time_stop': 15, 'bull_use_sma': False, 'bull_use_ema': False, 'bull_use_atr': False, 'bull_use_adx': True, 'bull_use_spike': True, 'bull_rsi_required': False, 'bear_strategy': 'breakout', 'bear_bb_std_mult': 1.3769488353986017, 'bear_rsi_os': 42, 'bear_rsi_ob': 66, 'bear_adx_thresh': 22.44539263019982, 'bear_atr_min_pct': 0.025442730048675817, 'bear_atr_max_pct': 0.13057795099688596, 'bear_tp_mult': 1.6190191057856624, 'bear_tsl_mult': 0.1582519100014442, 'bear_time_stop': 211, 'bear_use_sma': False, 'bear_use_ema': False, 'bear_use_atr': True, 'bear_use_adx': False, 'bear_use_spike': True, 'bear_rsi_required': False, 'sideways_strategy': 'breakout', 'sideways_bb_std_mult': 0.6844392508391113, 'sideways_rsi_os': 43, 'sideways_rsi_ob': 78, 'sideways_adx_thresh': 22.189621448112216, 'sideways_atr_min_pct': 0.017212071315391073, 'sideways_atr_max_pct': 0.01747572235393735, 'sideways_tp_mult': 2.353424068467779, 'sideways_tsl_mult': 0.06297905666803277, 'sideways_time_stop': 147, 'sideways_use_sma': False, 'sideways_use_ema': True, 'sideways_use_atr': False, 'sideways_use_adx': False, 'sideways_use_spike': False, 'sideways_rsi_required': True}.
[I 2025-09-01 10:59:22,737] Trial 108 finished with values: [-1000000000.0, 1000000000.0] and parameters: {'p_sma': 9, 'p_std': 23, 'p_atr': 21, 'p_adx': 24, 'rsi_period': 77, 'ema1': 29, 'ema2': 10, 'slip_atr_k': 0.027476836137071976, 'slip_spread_k': 0.1901057583223752, 'spread_hl_frac': 0.01974356560930739, 'bb_std_mult': 0.7682849264636004, 'rsi_os': 45, 'rsi_ob': 62, 'vol_spike': 0.14278629904907678, 'adx_thresh': 5.118661556893883, 'atr_min_pct': 0.014045870141821308, 'atr_max_pct': 0.07040638645882608, 'tp_mult': 1.8839524203536824, 'tsl_mult': 0.5784114956105475, 'strategy': 'mean_reversion', 'time_stop': 248, 'use_sma': True, 'use_atr': False, 'use_adx': True, 'use_ema': True, 'use_spike': False, 'rsi_required': True, 'edge_k': 1.8749789296856103, 'edge_cap': 0.48131426427659396, 'bull_strategy': 'mean_reversion', 'bull_bb_std_mult': 1.805384383825377, 'bull_rsi_os': 21, 'bull_rsi_ob': 80, 'bull_adx_thresh': 23.72885673166592, 'bull_atr_min_pct': 0.01165675564097201, 'bull_atr_max_pct': 0.10619670000655211, 'bull_tp_mult': 1.6273271606276862, 'bull_tsl_mult': 0.882402671470186, 'bull_time_stop': 28, 'bull_use_sma': False, 'bull_use_ema': False, 'bull_use_atr': False, 'bull_use_adx': False, 'bull_use_spike': True, 'bull_rsi_required': True, 'bear_strategy': 'breakout', 'bear_bb_std_mult': 1.0644525910441414, 'bear_rsi_os': 29, 'bear_rsi_ob': 62, 'bear_adx_thresh': 22.335110564351005, 'bear_atr_min_pct': 0.0011301876579453089, 'bear_atr_max_pct': 0.14898445204401578, 'bear_tp_mult': 1.7172464007461925, 'bear_tsl_mult': 0.1479261007911388, 'bear_time_stop': 201, 'bear_use_sma': False, 'bear_use_ema': True, 'bear_use_atr': False, 'bear_use_adx': False, 'bear_use_spike': True, 'bear_rsi_required': False, 'sideways_strategy': 'breakout', 'sideways_bb_std_mult': 0.6661739312988983, 'sideways_rsi_os': 21, 'sideways_rsi_ob': 67, 'sideways_adx_thresh': 15.914011674523149, 'sideways_atr_min_pct': 0.019457657819215025, 'sideways_atr_max_pct': 0.0414786310866022, 'sideways_tp_mult': 2.529873379985161, 'sideways_tsl_mult': 0.06994174732296499, 'sideways_time_stop': 147, 'sideways_use_sma': False, 'sideways_use_ema': True, 'sideways_use_atr': False, 'sideways_use_adx': False, 'sideways_use_spike': False, 'sideways_rsi_required': True}.
[I 2025-09-01 10:59:23,157] Trial 109 finished with values: [-0.006747920234336013, 0.006968152109997064] and parameters: {'p_sma': 7, 'p_std': 23, 'p_atr': 7, 'p_adx': 24, 'rsi_period': 79, 'ema1': 17, 'ema2': 58, 'slip_atr_k': 0.027653712350212974, 'slip_spread_k': 0.19139850661120963, 'spread_hl_frac': 0.0004545293004602534, 'bb_std_mult': 0.587077431183277, 'rsi_os': 18, 'rsi_ob': 62, 'vol_spike': 0.1424612319912308, 'adx_thresh': 22.627046365548182, 'atr_min_pct': 0.02773787920605239, 'atr_max_pct': 0.06548105734584915, 'tp_mult': 1.286802242630185, 'tsl_mult': 0.17175094507021893, 'strategy': 'mean_reversion', 'time_stop': 249, 'use_sma': True, 'use_atr': False, 'use_adx': True, 'use_ema': True, 'use_spike': False, 'rsi_required': True, 'edge_k': 1.8727788589851668, 'edge_cap': 0.4824567117342706, 'bull_strategy': 'mean_reversion', 'bull_bb_std_mult': 3.303977077702905, 'bull_rsi_os': 21, 'bull_rsi_ob': 82, 'bull_adx_thresh': 11.59338291915178, 'bull_atr_min_pct': 0.0020772663371485724, 'bull_atr_max_pct': 0.10605966245599491, 'bull_tp_mult': 1.1908899621613653, 'bull_tsl_mult': 0.22065721897033802, 'bull_time_stop': 26, 'bull_use_sma': False, 'bull_use_ema': False, 'bull_use_atr': False, 'bull_use_adx': False, 'bull_use_spike': True, 'bull_rsi_required': True, 'bear_strategy': 'breakout', 'bear_bb_std_mult': 1.0364347101680402, 'bear_rsi_os': 39, 'bear_rsi_ob': 62, 'bear_adx_thresh': 16.255391742699686, 'bear_atr_min_pct': 0.0012672891786138923, 'bear_atr_max_pct': 0.14930670695890885, 'bear_tp_mult': 1.7313620518851487, 'bear_tsl_mult': 0.13896187292737935, 'bear_time_stop': 157, 'bear_use_sma': False, 'bear_use_ema': True, 'bear_use_atr': False, 'bear_use_adx': False, 'bear_use_spike': True, 'bear_rsi_required': False, 'sideways_strategy': 'breakout', 'sideways_bb_std_mult': 3.3300030426518132, 'sideways_rsi_os': 21, 'sideways_rsi_ob': 86, 'sideways_adx_thresh': 26.709621403704492, 'sideways_atr_min_pct': 0.017978140795744935, 'sideways_atr_max_pct': 0.0862560491363439, 'sideways_tp_mult': 2.577289237735456, 'sideways_tsl_mult': 0.1125472790064518, 'sideways_time_stop': 135, 'sideways_use_sma': False, 'sideways_use_ema': True, 'sideways_use_atr': False, 'sideways_use_adx': False, 'sideways_use_spike': False, 'sideways_rsi_required': True}.
