[I 2025-09-01 10:47:37,223] Trial 26 finished with values: [-1000000000.0, 1000000000.0] and parameters: {'p_sma': 43, 'p_std': 20, 'p_atr': 22, 'p_adx': 13, 'rsi_period': 65, 'ema1': 28, 'ema2': 30, 'slip_atr_k': 0.20711908680246394, 'slip_spread_k': 0.11034314745521209, 'spread_hl_frac': 0.006519901125927371, 'bb_std_mult': 3.2410602545497897, 'rsi_os': 27, 'rsi_ob': 63, 'vol_spike': 0.1775885254546002, 'adx_thresh': 14.476725738415041, 'atr_min_pct': 0.013144250695437818, 'atr_max_pct': 0.10964003017914382, 'tp_mult': 2.2799262544781205, 'tsl_mult': 0.7325870955937216, 'strategy': 'breakout', 'time_stop': 266, 'use_sma': False, 'use_atr': False, 'use_adx': True, 'use_ema': True, 'use_spike': True, 'rsi_required': False, 'edge_k': 1.9744289702605125, 'edge_cap': 0.4927313128373621, 'bull_strategy': 'breakout', 'bull_bb_std_mult': 0.510797835817568, 'bull_rsi_os': 43, 'bull_rsi_ob': 77, 'bull_adx_thresh': 29.837562717779285, 'bull_atr_min_pct': 0.010857880348267707, 'bull_atr_max_pct': 0.12612970393186437, 'bull_tp_mult': 2.6676759515397444, 'bull_tsl_mult': 0.5270018656918071, 'bull_time_stop': 88, 'bull_use_sma': True, 'bull_use_ema': True, 'bull_use_atr': False, 'bull_use_adx': False, 'bull_use_spike': True, 'bull_rsi_required': True, 'bear_strategy': 'mean_reversion', 'bear_bb_std_mult': 1.9312453635616473, 'bear_rsi_os': 13, 'bear_rsi_ob': 60, 'bear_adx_thresh': 20.894811874267702, 'bear_atr_min_pct': 0.0041066209678125055, 'bear_atr_max_pct': 0.043430734081042865, 'bear_tp_mult': 1.902793923881528, 'bear_tsl_mult': 0.40601418744222506, 'bear_time_stop': 169, 'bear_use_sma': True, 'bear_use_ema': True, 'bear_use_atr': False, 'bear_use_adx': False, 'bear_use_spike': False, 'bear_rsi_required': True, 'sideways_strategy': 'breakout', 'sideways_bb_std_mult': 0.8197063191489651, 'sideways_rsi_os': 27, 'sideways_rsi_ob': 61, 'sideways_adx_thresh': 14.234116644235364, 'sideways_atr_min_pct': 0.016316725069718378, 'sideways_atr_max_pct': 0.038980495222142704, 'sideways_tp_mult': 2.0708205140827296, 'sideways_tsl_mult': 0.5300656013814599, 'sideways_time_stop': 43, 'sideways_use_sma': True, 'sideways_use_ema': False, 'sideways_use_atr': False, 'sideways_use_adx': True, 'sideways_use_spike': True, 'sideways_rsi_required': True}.
[I 2025-09-01 10:48:19,938] Trial 29 finished with values: [-1000000000.0, 1000000000.0] and parameters: {'p_sma': 34, 'p_std': 16, 'p_atr': 13, 'p_adx': 12, 'rsi_period': 61, 'ema1': 21, 'ema2': 38, 'slip_atr_k': 0.19820119805281936, 'slip_spread_k': 0.5859111693714333, 'spread_hl_frac': 0.005508780718247723, 'bb_std_mult': 3.280317999708578, 'rsi_os': 14, 'rsi_ob': 58, 'vol_spike': 0.17631033579126443, 'adx_thresh': 9.237776694775095, 'atr_min_pct': 0.02484148855541493, 'atr_max_pct': 0.06212961571400315, 'tp_mult': 1.7733374872379177, 'tsl_mult': 0.5188550508538052, 'strategy': 'breakout', 'time_stop': 262, 'use_sma': False, 'use_atr': False, 'use_adx': True, 'use_ema': True, 'use_spike': True, 'rsi_required': True, 'edge_k': 1.9913591038323788, 'edge_cap': 0.667765465043607, 'bull_strategy': 'mean_reversion', 'bull_bb_std_mult': 2.287572535332391, 'bull_rsi_os': 33, 'bull_rsi_ob': 87, 'bull_adx_thresh': 23.547879886646047, 'bull_atr_min_pct': 0.009855704487344172, 'bull_atr_max_pct': 0.09640988653465735, 'bull_tp_mult': 2.077152620924062, 'bull_tsl_mult': 0.7840254109633267, 'bull_time_stop': 160, 'bull_use_sma': True, 'bull_use_ema': True, 'bull_use_atr': False, 'bull_use_adx': False, 'bull_use_spike': True, 'bull_rsi_required': True, 'bear_strategy': 'mean_reversion', 'bear_bb_std_mult': 3.077864103184599, 'bear_rsi_os': 13, 'bear_rsi_ob': 50, 'bear_adx_thresh': 21.25107815323152, 'bear_atr_min_pct': 0.02202227874746961, 'bear_atr_max_pct': 0.14782506606152662, 'bear_tp_mult': 1.9942882851607424, 'bear_tsl_mult': 0.5728282787541978, 'bear_time_stop': 12, 'bear_use_sma': True, 'bear_use_ema': True, 'bear_use_atr': False, 'bear_use_adx': False, 'bear_use_spike': True, 'bear_rsi_required': False, 'sideways_strategy': 'mean_reversion', 'sideways_bb_std_mult': 0.925854300674285, 'sideways_rsi_os': 28, 'sideways_rsi_ob': 58, 'sideways_adx_thresh': 28.082982480862444, 'sideways_atr_min_pct': 0.029286370816184286, 'sideways_atr_max_pct': 0.11134469900081947, 'sideways_tp_mult': 2.1027085204519773, 'sideways_tsl_mult': 0.7774325745165673, 'sideways_time_stop': 6, 'sideways_use_sma': True, 'sideways_use_ema': False, 'sideways_use_atr': False, 'sideways_use_adx': False, 'sideways_use_spike': False, 'sideways_rsi_required': True}.
[I 2025-09-01 10:48:20,867] Trial 31 finished with values: [-1000000000.0, 1000000000.0] and parameters: {'p_sma': 34, 'p_std': 11, 'p_atr': 17, 'p_adx': 20, 'rsi_period': 48, 'ema1': 21, 'ema2': 38, 'slip_atr_k': 0.1767172834298817, 'slip_spread_k': 0.001904594596557882, 'spread_hl_frac': 0.004046766798694798, 'bb_std_mult': 3.0964551452931626, 'rsi_os': 13, 'rsi_ob': 74, 'vol_spike': 0.1791492156480459, 'adx_thresh': 9.597026979635734, 'atr_min_pct': 0.007719017641252894, 'atr_max_pct': 0.06374369798385418, 'tp_mult': 2.9895124186840585, 'tsl_mult': 0.5473950306627293, 'strategy': 'breakout', 'time_stop': 288, 'use_sma': False, 'use_atr': False, 'use_adx': True, 'use_ema': True, 'use_spike': True, 'rsi_required': True, 'edge_k': 0.604997613187297, 'edge_cap': 0.6179758826738029, 'bull_strategy': 'mean_reversion', 'bull_bb_std_mult': 2.2451498338579263, 'bull_rsi_os': 32, 'bull_rsi_ob': 89, 'bull_adx_thresh': 23.398887895117966, 'bull_atr_min_pct': 0.02236930800223728, 'bull_atr_max_pct': 0.09940261607358836, 'bull_tp_mult': 2.990224389772618, 'bull_tsl_mult': 0.7981075779651853, 'bull_time_stop': 164, 'bull_use_sma': False, 'bull_use_ema': True, 'bull_use_atr': False, 'bull_use_adx': False, 'bull_use_spike': True, 'bull_rsi_required': True, 'bear_strategy': 'mean_reversion', 'bear_bb_std_mult': 3.086600305692342, 'bear_rsi_os': 13, 'bear_rsi_ob': 50, 'bear_adx_thresh': 10.205394878759245, 'bear_atr_min_pct': 0.02177048155026161, 'bear_atr_max_pct': 0.13443158679361117, 'bear_tp_mult': 1.4430005278579552, 'bear_tsl_mult': 0.5756707694959589, 'bear_time_stop': 6, 'bear_use_sma': True, 'bear_use_ema': True, 'bear_use_atr': False, 'bear_use_adx': False, 'bear_use_spike': True, 'bear_rsi_required': False, 'sideways_strategy': 'mean_reversion', 'sideways_bb_std_mult': 0.8220266955914164, 'sideways_rsi_os': 30, 'sideways_rsi_ob': 59, 'sideways_adx_thresh': 28.03505377279329, 'sideways_atr_min_pct': 0.0043872601182489614, 'sideways_atr_max_pct': 0.10923976411406011, 'sideways_tp_mult': 2.4317134749879514, 'sideways_tsl_mult': 0.7703677676468704, 'sideways_time_stop': 11, 'sideways_use_sma': True, 'sideways_use_ema': False, 'sideways_use_atr': False, 'sideways_use_adx': False, 'sideways_use_spike': False, 'sideways_rsi_required': True}.
[I 2025-09-01 10:48:21,844] Trial 30 finished with values: [-1000000000.0, 1000000000.0] and parameters: {'p_sma': 53, 'p_std': 15, 'p_atr': 13, 'p_adx': 12, 'rsi_period': 69, 'ema1': 21, 'ema2': 37, 'slip_atr_k': 0.20225666704129, 'slip_spread_k': 0.10353329936994486, 'spread_hl_frac': 0.0053485969606763915, 'bb_std_mult': 3.2230727421549323, 'rsi_os': 13, 'rsi_ob': 58, 'vol_spike': 0.17459495632327585, 'adx_thresh': 8.417511667786371, 'atr_min_pct': 0.0075179372580941465, 'atr_max_pct': 0.06435771133304384, 'tp_mult': 2.9927550481481586, 'tsl_mult': 0.5350822568125302, 'strategy': 'breakout', 'time_stop': 300, 'use_sma': False, 'use_atr': False, 'use_adx': True, 'use_ema': True, 'use_spike': True, 'rsi_required': True, 'edge_k': 0.6312349897930117, 'edge_cap': 0.6399992374704175, 'bull_strategy': 'mean_reversion', 'bull_bb_std_mult': 2.1752768263941746, 'bull_rsi_os': 32, 'bull_rsi_ob': 89, 'bull_adx_thresh': 22.998864360151373, 'bull_atr_min_pct': 0.010046649684651875, 'bull_atr_max_pct': 0.09323150806725598, 'bull_tp_mult': 1.5303668140012565, 'bull_tsl_mult': 0.7932562941006902, 'bull_time_stop': 67, 'bull_use_sma': True, 'bull_use_ema': True, 'bull_use_atr': False, 'bull_use_adx': False, 'bull_use_spike': True, 'bull_rsi_required': True, 'bear_strategy': 'mean_reversion', 'bear_bb_std_mult': 3.0619311678045324, 'bear_rsi_os': 13, 'bear_rsi_ob': 51, 'bear_adx_thresh': 29.45267512906745, 'bear_atr_min_pct': 0.021296220819922457, 'bear_atr_max_pct': 0.1493535125576061, 'bear_tp_mult': 1.397824620777504, 'bear_tsl_mult': 0.581784839441328, 'bear_time_stop': 10, 'bear_use_sma': True, 'bear_use_ema': True, 'bear_use_atr': False, 'bear_use_adx': False, 'bear_use_spike': True, 'bear_rsi_required': False, 'sideways_strategy': 'mean_reversion', 'sideways_bb_std_mult': 0.9117314924659086, 'sideways_rsi_os': 19, 'sideways_rsi_ob': 57, 'sideways_adx_thresh': 27.884713369543235, 'sideways_atr_min_pct': 0.02951025472900156, 'sideways_atr_max_pct': 0.11348635979205615, 'sideways_tp_mult': 2.049685794371478, 'sideways_tsl_mult': 0.7860139418148596, 'sideways_time_stop': 13, 'sideways_use_sma': True, 'sideways_use_ema': False, 'sideways_use_atr': False, 'sideways_use_adx': False, 'sideways_use_spike': False, 'sideways_rsi_required': True}.
[I 2025-09-01 10:48:22,229] Trial 28 finished with values: [-1000000000.0, 1000000000.0] and parameters: {'p_sma': 53, 'p_std': 14, 'p_atr': 22, 'p_adx': 13, 'rsi_period': 66, 'ema1': 21, 'ema2': 36, 'slip_atr_k': 0.2123745227463326, 'slip_spread_k': 0.002261692574029757, 'spread_hl_frac': 0.008150584291840138, 'bb_std_mult': 3.2259078641724854, 'rsi_os': 28, 'rsi_ob': 60, 'vol_spike': 0.17790857081308473, 'adx_thresh': 8.693063915481613, 'atr_min_pct': 0.013611260761982318, 'atr_max_pct': 0.057152569163909275, 'tp_mult': 1.758315744879927, 'tsl_mult': 0.5336308622492729, 'strategy': 'breakout', 'time_stop': 299, 'use_sma': False, 'use_atr': False, 'use_adx': True, 'use_ema': True, 'use_spike': True, 'rsi_required': False, 'edge_k': 0.7900392545251375, 'edge_cap': 0.6341481342488823, 'bull_strategy': 'breakout', 'bull_bb_std_mult': 1.606133961144638, 'bull_rsi_os': 21, 'bull_rsi_ob': 75, 'bull_adx_thresh': 14.92153798874332, 'bull_atr_min_pct': 0.009418539931724475, 'bull_atr_max_pct': 0.0935127254001143, 'bull_tp_mult': 2.640628456903998, 'bull_tsl_mult': 0.55541741477471, 'bull_time_stop': 68, 'bull_use_sma': True, 'bull_use_ema': True, 'bull_use_atr': False, 'bull_use_adx': False, 'bull_use_spike': True, 'bull_rsi_required': True, 'bear_strategy': 'mean_reversion', 'bear_bb_std_mult': 3.117497908865616, 'bear_rsi_os': 13, 'bear_rsi_ob': 59, 'bear_adx_thresh': 19.72572413708285, 'bear_atr_min_pct': 0.005191585397949781, 'bear_atr_max_pct': 0.1487597738662651, 'bear_tp_mult': 1.881099551978156, 'bear_tsl_mult': 0.576964922218507, 'bear_time_stop': 5, 'bear_use_sma': True, 'bear_use_ema': True, 'bear_use_atr': False, 'bear_use_adx': False, 'bear_use_spike': False, 'bear_rsi_required': True, 'sideways_strategy': 'breakout', 'sideways_bb_std_mult': 0.9137980327960813, 'sideways_rsi_os': 26, 'sideways_rsi_ob': 59, 'sideways_adx_thresh': 27.542014513334827, 'sideways_atr_min_pct': 0.015838304730337906, 'sideways_atr_max_pct': 0.11057831286905945, 'sideways_tp_mult': 2.062053363539393, 'sideways_tsl_mult': 0.849034804644308, 'sideways_time_stop': 42, 'sideways_use_sma': True, 'sideways_use_ema': False, 'sideways_use_atr': False, 'sideways_use_adx': True, 'sideways_use_spike': True, 'sideways_rsi_required': True}.
[I 2025-09-01 10:49:02,908] Trial 32 finished with values: [-1000000000.0, 1000000000.0] and parameters: {'p_sma': 53, 'p_std': 33, 'p_atr': 19, 'p_adx': 10, 'rsi_period': 47, 'ema1': 17, 'ema2': 36, 'slip_atr_k': 0.1719346876446392, 'slip_spread_k': 0.9915958174557078, 'spread_hl_frac': 0.010256196947386838, 'bb_std_mult': 3.088628711877332, 'rsi_os': 31, 'rsi_ob': 74, 'vol_spike': 0.20002196855907048, 'adx_thresh': 9.90313855676731, 'atr_min_pct': 0.007565317868156712, 'atr_max_pct': 0.08363597073018782, 'tp_mult': 1.3995968307359612, 'tsl_mult': 0.9318590599519442, 'strategy': 'breakout', 'time_stop': 300, 'use_sma': False, 'use_atr': True, 'use_adx': True, 'use_ema': True, 'use_spike': True, 'rsi_required': True, 'edge_k': 0.5822819489118778, 'edge_cap': 0.6487158390049655, 'bull_strategy': 'mean_reversion', 'bull_bb_std_mult': 2.2623091040358743, 'bull_rsi_os': 32, 'bull_rsi_ob': 46, 'bull_adx_thresh': 20.59519692422258, 'bull_atr_min_pct': 0.022672595941503206, 'bull_atr_max_pct': 0.13559093420937965, 'bull_tp_mult': 2.8896128835217367, 'bull_tsl_mult': 0.356701725879511, 'bull_time_stop': 56, 'bull_use_sma': False, 'bull_use_ema': False, 'bull_use_atr': False, 'bull_use_adx': False, 'bull_use_spike': False, 'bull_rsi_required': True, 'bear_strategy': 'breakout', 'bear_bb_std_mult': 1.041645575140705, 'bear_rsi_os': 10, 'bear_rsi_ob': 95, 'bear_adx_thresh': 9.963168885558517, 'bear_atr_min_pct': 0.006869937518234188, 'bear_atr_max_pct': 0.10765850785708067, 'bear_tp_mult': 2.19524669521685, 'bear_tsl_mult': 0.6050094761719189, 'bear_time_stop': 26, 'bear_use_sma': True, 'bear_use_ema': True, 'bear_use_atr': True, 'bear_use_adx': False, 'bear_use_spike': False, 'bear_rsi_required': False, 'sideways_strategy': 'mean_reversion', 'sideways_bb_std_mult': 1.5494426545832618, 'sideways_rsi_os': 19, 'sideways_rsi_ob': 71, 'sideways_adx_thresh': 27.634424128173574, 'sideways_atr_min_pct': 0.004879766573390534, 'sideways_atr_max_pct': 0.11719112573741401, 'sideways_tp_mult': 2.4100044701653527, 'sideways_tsl_mult': 0.6367264876803013, 'sideways_time_stop': 106, 'sideways_use_sma': True, 'sideways_use_ema': False, 'sideways_use_atr': True, 'sideways_use_adx': True, 'sideways_use_spike': False, 'sideways_rsi_required': False}.
[I 2025-09-01 10:49:03,584] Trial 33 finished with values: [-1000000000.0, 1000000000.0] and parameters: {'p_sma': 53, 'p_std': 33, 'p_atr': 19, 'p_adx': 10, 'rsi_period': 69, 'ema1': 16, 'ema2': 44, 'slip_atr_k': 0.1307019670734194, 'slip_spread_k': 0.9555674145848525, 'spread_hl_frac': 0.01166570567784658, 'bb_std_mult': 2.484666493201999, 'rsi_os': 31, 'rsi_ob': 53, 'vol_spike': 0.01542348351853598, 'adx_thresh': 18.408765583626828, 'atr_min_pct': 0.0019513075810092565, 'atr_max_pct': 0.020408821486059138, 'tp_mult': 1.3399531846231594, 'tsl_mult': 0.9644597264045491, 'strategy': 'breakout', 'time_stop': 298, 'use_sma': False, 'use_atr': True, 'use_adx': False, 'use_ema': True, 'use_spike': False, 'rsi_required': True, 'edge_k': 0.864266172070125, 'edge_cap': 0.8199490992560322, 'bull_strategy': 'mean_reversion', 'bull_bb_std_mult': 2.4265487915399513, 'bull_rsi_os': 22, 'bull_rsi_ob': 49, 'bull_adx_thresh': 21.11040790216766, 'bull_atr_min_pct': 0.007065125128886043, 'bull_atr_max_pct': 0.13839319621186788, 'bull_tp_mult': 1.4502002068714446, 'bull_tsl_mult': 0.3392365747252081, 'bull_time_stop': 234, 'bull_use_sma': False, 'bull_use_ema': False, 'bull_use_atr': True, 'bull_use_adx': False, 'bull_use_spike': False, 'bull_rsi_required': True, 'bear_strategy': 'breakout', 'bear_bb_std_mult': 1.031007572147354, 'bear_rsi_os': 9, 'bear_rsi_ob': 57, 'bear_adx_thresh': 10.739648770743942, 'bear_atr_min_pct': 0.00712442556055806, 'bear_atr_max_pct': 0.11347495903259822, 'bear_tp_mult': 2.186912084740612, 'bear_tsl_mult': 0.7728360820632253, 'bear_time_stop': 76, 'bear_use_sma': True, 'bear_use_ema': True, 'bear_use_atr': True, 'bear_use_adx': False, 'bear_use_spike': False, 'bear_rsi_required': False, 'sideways_strategy': 'mean_reversion', 'sideways_bb_std_mult': 1.4759593709922898, 'sideways_rsi_os': 19, 'sideways_rsi_ob': 70, 'sideways_adx_thresh': 21.109146933104565, 'sideways_atr_min_pct': 0.02112709229932355, 'sideways_atr_max_pct': 0.14803796032765543, 'sideways_tp_mult': 2.707664025703963, 'sideways_tsl_mult': 0.9035169768813043, 'sideways_time_stop': 106, 'sideways_use_sma': True, 'sideways_use_ema': True, 'sideways_use_atr': True, 'sideways_use_adx': True, 'sideways_use_spike': False, 'sideways_rsi_required': False}.
[I 2025-09-01 10:49:04,092] Trial 34 finished with values: [-0.029308970189240058, 0.02909460928974924] and parameters: {'p_sma': 52, 'p_std': 31, 'p_atr': 19, 'p_adx': 16, 'rsi_period': 59, 'ema1': 17, 'ema2': 44, 'slip_atr_k': 0.22482130984925283, 'slip_spread_k': 0.9566977221097253, 'spread_hl_frac': 0.01108907040924054, 'bb_std_mult': 1.468258345887238, 'rsi_os': 31, 'rsi_ob': 52, 'vol_spike': 0.005196567371201916, 'adx_thresh': 12.146319452056684, 'atr_min_pct': 0.003768079938893462, 'atr_max_pct': 0.0842527157348789, 'tp_mult': 1.3730769764647255, 'tsl_mult': 0.9955355142576706, 'strategy': 'breakout', 'time_stop': 247, 'use_sma': False, 'use_atr': True, 'use_adx': True, 'use_ema': False, 'use_spike': True, 'rsi_required': False, 'edge_k': 0.26262847835700054, 'edge_cap': 0.8363701894916837, 'bull_strategy': 'breakout', 'bull_bb_std_mult': 1.7348841409543323, 'bull_rsi_os': 22, 'bull_rsi_ob': 46, 'bull_adx_thresh': 15.074079723496858, 'bull_atr_min_pct': 0.0028009731109877927, 'bull_atr_max_pct': 0.13959230521514282, 'bull_tp_mult': 2.8699127510769924, 'bull_tsl_mult': 0.556635800014423, 'bull_time_stop': 235, 'bull_use_sma': False, 'bull_use_ema': False, 'bull_use_atr': False, 'bull_use_adx': False, 'bull_use_spike': False, 'bull_rsi_required': True, 'bear_strategy': 'breakout', 'bear_bb_std_mult': 1.0150620584462458, 'bear_rsi_os': 9, 'bear_rsi_ob': 58, 'bear_adx_thresh': 25.318058884638347, 'bear_atr_min_pct': 0.0072885718036104835, 'bear_atr_max_pct': 0.10836121773098258, 'bear_tp_mult': 2.1326645240058624, 'bear_tsl_mult': 0.22715748249342188, 'bear_time_stop': 34, 'bear_use_sma': True, 'bear_use_ema': True, 'bear_use_atr': True, 'bear_use_adx': True, 'bear_use_spike': False, 'bear_rsi_required': True, 'sideways_strategy': 'breakout', 'sideways_bb_std_mult': 1.5515385825940822, 'sideways_rsi_os': 10, 'sideways_rsi_ob': 69, 'sideways_adx_thresh': 30.97101275636044, 'sideways_atr_min_pct': 0.02189581225577907, 'sideways_atr_max_pct': 0.07241617871885259, 'sideways_tp_mult': 2.721912187408032, 'sideways_tsl_mult': 0.888177817281622, 'sideways_time_stop': 298, 'sideways_use_sma': True, 'sideways_use_ema': False, 'sideways_use_atr': True, 'sideways_use_adx': True, 'sideways_use_spike': True, 'sideways_rsi_required': False}.
[I 2025-09-01 10:49:04,503] Trial 35 finished with values: [-1000000000.0, 1000000000.0] and parameters: {'p_sma': 38, 'p_std': 30, 'p_atr': 20, 'p_adx': 10, 'rsi_period': 57, 'ema1': 17, 'ema2': 44, 'slip_atr_k': 0.23202113867517837, 'slip_spread_k': 0.9624905944979427, 'spread_hl_frac': 0.010684492149071963, 'bb_std_mult': 1.4515238222711742, 'rsi_os': 33, 'rsi_ob': 52, 'vol_spike': 0.0413153382899307, 'adx_thresh': 13.178730216835929, 'atr_min_pct': 0.004030077102567231, 'atr_max_pct': 0.08204152428665917, 'tp_mult': 1.3483007002171083, 'tsl_mult': 0.6459021746847683, 'strategy': 'breakout', 'time_stop': 251, 'use_sma': True, 'use_atr': True, 'use_adx': False, 'use_ema': False, 'use_spike': False, 'rsi_required': False, 'edge_k': 0.2084456106768554, 'edge_cap': 0.9028604903131421, 'bull_strategy': 'breakout', 'bull_bb_std_mult': 1.7991731263968513, 'bull_rsi_os': 10, 'bull_rsi_ob': 48, 'bull_adx_thresh': 20.44601314430272, 'bull_atr_min_pct': 0.006778373245873165, 'bull_atr_max_pct': 0.13862661631829792, 'bull_tp_mult': 2.85016029706334, 'bull_tsl_mult': 0.5847107251575278, 'bull_time_stop': 291, 'bull_use_sma': False, 'bull_use_ema': False, 'bull_use_atr': True, 'bull_use_adx': True, 'bull_use_spike': False, 'bull_rsi_required': False, 'bear_strategy': 'breakout', 'bear_bb_std_mult': 1.1282056800594373, 'bear_rsi_os': 9, 'bear_rsi_ob': 56, 'bear_adx_thresh': 24.929102283253645, 'bear_atr_min_pct': 0.009016288260741061, 'bear_atr_max_pct': 0.11404830067400626, 'bear_tp_mult': 2.1500322673752326, 'bear_tsl_mult': 0.12738162183105703, 'bear_time_stop': 36, 'bear_use_sma': False, 'bear_use_ema': False, 'bear_use_atr': True, 'bear_use_adx': True, 'bear_use_spike': False, 'bear_rsi_required': True, 'sideways_strategy': 'breakout', 'sideways_bb_std_mult': 1.5462975490656279, 'sideways_rsi_os': 10, 'sideways_rsi_ob': 67, 'sideways_adx_thresh': 30.617253700700626, 'sideways_atr_min_pct': 0.013906566464501955, 'sideways_atr_max_pct': 0.14888581910028598, 'sideways_tp_mult': 2.66522524804201, 'sideways_tsl_mult': 0.8877818389445757, 'sideways_time_stop': 105, 'sideways_use_sma': False, 'sideways_use_ema': True, 'sideways_use_atr': True, 'sideways_use_adx': True, 'sideways_use_spike': True, 'sideways_rsi_required': False}.
