[I 2025-09-01 11:48:19,504] Trial 422 finished with values: [-1000000000.0, 1000000000.0] and parameters: {'p_sma': 23, 'p_std': 32, 'p_atr': 17, 'p_adx': 7, 'rsi_period': 45, 'ema1': 25, 'ema2': 19, 'slip_atr_k': 0.023493214807708863, 'slip_spread_k': 0.4644768031386141, 'spread_hl_frac': 0.002007740454117456, 'bb_std_mult': 1.1122222512769158, 'rsi_os': 32, 'rsi_ob': 48, 'vol_spike': 0.22801637011022963, 'adx_thresh': 24.47156079506984, 'atr_min_pct': 0.023872295174049693, 'atr_max_pct': 0.08169469072188969, 'tp_mult': 1.9729877991492137, 'tsl_mult': 0.02456759413759335, 'strategy': 'breakout', 'time_stop': 175, 'use_sma': False, 'use_atr': True, 'use_adx': True, 'use_ema': True, 'use_spike': False, 'rsi_required': False, 'edge_k': 0.21416463533461605, 'edge_cap': 0.05050347600172475, 'bull_strategy': 'mean_reversion', 'bull_bb_std_mult': 1.48248915527623, 'bull_rsi_os': 47, 'bull_rsi_ob': 51, 'bull_adx_thresh': 5.932233306342789, 'bull_atr_min_pct': 0.017836421968743393, 'bull_atr_max_pct': 0.1136981552664761, 'bull_tp_mult': 1.120218113127511, 'bull_tsl_mult': 0.671448209349818, 'bull_time_stop': 157, 'bull_use_sma': False, 'bull_use_ema': False, 'bull_use_atr': True, 'bull_use_adx': False, 'bull_use_spike': False, 'bull_rsi_required': False, 'bear_strategy': 'breakout', 'bear_bb_std_mult': 1.4571788647532662, 'bear_rsi_os': 30, 'bear_rsi_ob': 51, 'bear_adx_thresh': 7.5626929472502935, 'bear_atr_min_pct': 0.005058544166505379, 'bear_atr_max_pct': 0.0183828880398531, 'bear_tp_mult': 1.5593846067189656, 'bear_tsl_mult': 0.6623807531288781, 'bear_time_stop': 218, 'bear_use_sma': True, 'bear_use_ema': False, 'bear_use_atr': True, 'bear_use_adx': True, 'bear_use_spike': False, 'bear_rsi_required': True, 'sideways_strategy': 'breakout', 'sideways_bb_std_mult': 2.1028516795358962, 'sideways_rsi_os': 50, 'sideways_rsi_ob': 89, 'sideways_adx_thresh': 33.108332452922774, 'sideways_atr_min_pct': 0.024084402522513627, 'sideways_atr_max_pct': 0.1269525282086537, 'sideways_tp_mult': 2.6677938788606275, 'sideways_tsl_mult': 0.30969640657787545, 'sideways_time_stop': 89, 'sideways_use_sma': False, 'sideways_use_ema': False, 'sideways_use_atr': True, 'sideways_use_adx': True, 'sideways_use_spike': True, 'sideways_rsi_required': False}.
[I 2025-09-01 11:49:00,157] Trial 427 finished with values: [0.00167151005040167, 0.003751758960290101] and parameters: {'p_sma': 25, 'p_std': 33, 'p_atr': 21, 'p_adx': 7, 'rsi_period': 47, 'ema1': 26, 'ema2': 22, 'slip_atr_k': 0.035856297474365806, 'slip_spread_k': 0.4336695057175265, 'spread_hl_frac': 0.0032552901216058128, 'bb_std_mult': 0.9522175316557834, 'rsi_os': 29, 'rsi_ob': 50, 'vol_spike': 0.2121929742922714, 'adx_thresh': 23.83018253957942, 'atr_min_pct': 0.022580894072179915, 'atr_max_pct': 0.0771032549105286, 'tp_mult': 2.0549276110199974, 'tsl_mult': 0.08193105322821033, 'strategy': 'breakout', 'time_stop': 182, 'use_sma': False, 'use_atr': True, 'use_adx': True, 'use_ema': True, 'use_spike': False, 'rsi_required': False, 'edge_k': 0.2940482253716186, 'edge_cap': 0.09074397945226076, 'bull_strategy': 'mean_reversion', 'bull_bb_std_mult': 1.7489516044505542, 'bull_rsi_os': 43, 'bull_rsi_ob': 48, 'bull_adx_thresh': 6.105744104326991, 'bull_atr_min_pct': 0.017012142162673702, 'bull_atr_max_pct': 0.1104091415488592, 'bull_tp_mult': 1.1859887250715764, 'bull_tsl_mult': 0.6092527357055957, 'bull_time_stop': 178, 'bull_use_sma': False, 'bull_use_ema': False, 'bull_use_atr': True, 'bull_use_adx': False, 'bull_use_spike': False, 'bull_rsi_required': False, 'bear_strategy': 'breakout', 'bear_bb_std_mult': 1.3002488052358327, 'bear_rsi_os': 28, 'bear_rsi_ob': 50, 'bear_adx_thresh': 8.556841666981907, 'bear_atr_min_pct': 0.004388804039344127, 'bear_atr_max_pct': 0.019859939589645038, 'bear_tp_mult': 1.5153471441040225, 'bear_tsl_mult': 0.5715507542266864, 'bear_time_stop': 286, 'bear_use_sma': True, 'bear_use_ema': False, 'bear_use_atr': True, 'bear_use_adx': True, 'bear_use_spike': False, 'bear_rsi_required': True, 'sideways_strategy': 'breakout', 'sideways_bb_std_mult': 1.9711063344120527, 'sideways_rsi_os': 46, 'sideways_rsi_ob': 90, 'sideways_adx_thresh': 32.661890172042234, 'sideways_atr_min_pct': 0.025436123202879427, 'sideways_atr_max_pct': 0.1322951605582109, 'sideways_tp_mult': 2.7811269809251513, 'sideways_tsl_mult': 0.35080541610033045, 'sideways_time_stop': 100, 'sideways_use_sma': False, 'sideways_use_ema': False, 'sideways_use_atr': True, 'sideways_use_adx': True, 'sideways_use_spike': True, 'sideways_rsi_required': False}.
[I 2025-09-01 11:49:00,742] Trial 424 finished with values: [-1000000000.0, 1000000000.0] and parameters: {'p_sma': 23, 'p_std': 34, 'p_atr': 21, 'p_adx': 7, 'rsi_period': 45, 'ema1': 26, 'ema2': 19, 'slip_atr_k': 0.03728726670083468, 'slip_spread_k': 0.45749951251855914, 'spread_hl_frac': 0.003501859096527871, 'bb_std_mult': 1.1027113396794848, 'rsi_os': 29, 'rsi_ob': 50, 'vol_spike': 0.22827904680423952, 'adx_thresh': 24.071568982997146, 'atr_min_pct': 0.023380181757339056, 'atr_max_pct': 0.07772797047421776, 'tp_mult': 2.123693749054989, 'tsl_mult': 0.07988189201393864, 'strategy': 'breakout', 'time_stop': 167, 'use_sma': False, 'use_atr': True, 'use_adx': True, 'use_ema': True, 'use_spike': False, 'rsi_required': False, 'edge_k': 0.1894827953169379, 'edge_cap': 0.05222259264700361, 'bull_strategy': 'mean_reversion', 'bull_bb_std_mult': 1.749062623937184, 'bull_rsi_os': 44, 'bull_rsi_ob': 52, 'bull_adx_thresh': 5.89732277496252, 'bull_atr_min_pct': 0.0173467937839415, 'bull_atr_max_pct': 0.11689985877457114, 'bull_tp_mult': 1.1736511050941836, 'bull_tsl_mult': 0.6549421952156063, 'bull_time_stop': 157, 'bull_use_sma': False, 'bull_use_ema': False, 'bull_use_atr': True, 'bull_use_adx': False, 'bull_use_spike': False, 'bull_rsi_required': False, 'bear_strategy': 'breakout', 'bear_bb_std_mult': 1.4398835187344745, 'bear_rsi_os': 30, 'bear_rsi_ob': 50, 'bear_adx_thresh': 7.95221612280695, 'bear_atr_min_pct': 0.004744974558022926, 'bear_atr_max_pct': 0.013644455764773553, 'bear_tp_mult': 1.5183764606678598, 'bear_tsl_mult': 0.6590382056344505, 'bear_time_stop': 256, 'bear_use_sma': True, 'bear_use_ema': False, 'bear_use_atr': True, 'bear_use_adx': True, 'bear_use_spike': False, 'bear_rsi_required': True, 'sideways_strategy': 'breakout', 'sideways_bb_std_mult': 2.032197133276663, 'sideways_rsi_os': 51, 'sideways_rsi_ob': 90, 'sideways_adx_thresh': 33.005724822313745, 'sideways_atr_min_pct': 0.025338005396748298, 'sideways_atr_max_pct': 0.12798930860471416, 'sideways_tp_mult': 2.8288141478221798, 'sideways_tsl_mult': 0.34767318939467545, 'sideways_time_stop': 101, 'sideways_use_sma': False, 'sideways_use_ema': False, 'sideways_use_atr': True, 'sideways_use_adx': True, 'sideways_use_spike': True, 'sideways_rsi_required': False}.
[I 2025-09-01 11:49:01,124] Trial 426 finished with values: [0.001092170315990293, 0.0033098203595008672] and parameters: {'p_sma': 24, 'p_std': 34, 'p_atr': 21, 'p_adx': 7, 'rsi_period': 45, 'ema1': 25, 'ema2': 19, 'slip_atr_k': 0.0377998253637774, 'slip_spread_k': 0.44896673804705134, 'spread_hl_frac': 0.003659893835144687, 'bb_std_mult': 0.952488272495571, 'rsi_os': 29, 'rsi_ob': 50, 'vol_spike': 0.21303819502175422, 'adx_thresh': 23.858722366790243, 'atr_min_pct': 0.023961871804856497, 'atr_max_pct': 0.07730238661891657, 'tp_mult': 2.122595040339189, 'tsl_mult': 0.08317944165465298, 'strategy': 'breakout', 'time_stop': 166, 'use_sma': False, 'use_atr': True, 'use_adx': True, 'use_ema': True, 'use_spike': False, 'rsi_required': False, 'edge_k': 0.26016808447002143, 'edge_cap': 0.08048337067989368, 'bull_strategy': 'mean_reversion', 'bull_bb_std_mult': 1.741133322454381, 'bull_rsi_os': 39, 'bull_rsi_ob': 51, 'bull_adx_thresh': 6.138354189667258, 'bull_atr_min_pct': 0.016746237950394666, 'bull_atr_max_pct': 0.10817852519320205, 'bull_tp_mult': 1.1857640518772288, 'bull_tsl_mult': 0.61196831453457, 'bull_time_stop': 159, 'bull_use_sma': False, 'bull_use_ema': False, 'bull_use_atr': True, 'bull_use_adx': False, 'bull_use_spike': False, 'bull_rsi_required': False, 'bear_strategy': 'breakout', 'bear_bb_std_mult': 1.2998340719519532, 'bear_rsi_os': 28, 'bear_rsi_ob': 50, 'bear_adx_thresh': 7.521354652611146, 'bear_atr_min_pct': 0.004441536109372662, 'bear_atr_max_pct': 0.01889453174107565, 'bear_tp_mult': 1.440046502748654, 'bear_tsl_mult': 0.7144156320826902, 'bear_time_stop': 274, 'bear_use_sma': True, 'bear_use_ema': False, 'bear_use_atr': True, 'bear_use_adx': True, 'bear_use_spike': False, 'bear_rsi_required': True, 'sideways_strategy': 'breakout', 'sideways_bb_std_mult': 1.9986853873601387, 'sideways_rsi_os': 46, 'sideways_rsi_ob': 90, 'sideways_adx_thresh': 33.07919650594558, 'sideways_atr_min_pct': 0.02550323792244893, 'sideways_atr_max_pct': 0.1327140599006174, 'sideways_tp_mult': 2.657861688169394, 'sideways_tsl_mult': 0.3611608490431869, 'sideways_time_stop': 96, 'sideways_use_sma': False, 'sideways_use_ema': False, 'sideways_use_atr': True, 'sideways_use_adx': True, 'sideways_use_spike': True, 'sideways_rsi_required': False}.
[I 2025-09-01 11:49:01,623] Trial 425 finished with values: [-1000000000.0, 1000000000.0] and parameters: {'p_sma': 24, 'p_std': 34, 'p_atr': 21, 'p_adx': 7, 'rsi_period': 45, 'ema1': 26, 'ema2': 19, 'slip_atr_k': 0.0370606042294004, 'slip_spread_k': 0.44065804775837963, 'spread_hl_frac': 0.0014923624471790311, 'bb_std_mult': 0.9647495632195527, 'rsi_os': 29, 'rsi_ob': 50, 'vol_spike': 0.22931662498285982, 'adx_thresh': 24.23870713731646, 'atr_min_pct': 0.02400875617989445, 'atr_max_pct': 0.07671642968782233, 'tp_mult': 2.058696448639356, 'tsl_mult': 0.10939968043455622, 'strategy': 'breakout', 'time_stop': 165, 'use_sma': False, 'use_atr': True, 'use_adx': True, 'use_ema': True, 'use_spike': False, 'rsi_required': False, 'edge_k': 0.2788411229924557, 'edge_cap': 0.09061054241293479, 'bull_strategy': 'mean_reversion', 'bull_bb_std_mult': 1.745596684976381, 'bull_rsi_os': 44, 'bull_rsi_ob': 51, 'bull_adx_thresh': 5.581201584141591, 'bull_atr_min_pct': 0.016799332473848443, 'bull_atr_max_pct': 0.11321658458344602, 'bull_tp_mult': 1.1798175859580182, 'bull_tsl_mult': 0.6611230064460418, 'bull_time_stop': 191, 'bull_use_sma': False, 'bull_use_ema': False, 'bull_use_atr': True, 'bull_use_adx': False, 'bull_use_spike': False, 'bull_rsi_required': False, 'bear_strategy': 'breakout', 'bear_bb_std_mult': 1.2967802318457433, 'bear_rsi_os': 30, 'bear_rsi_ob': 50, 'bear_adx_thresh': 7.586643529452085, 'bear_atr_min_pct': 0.004813591450448429, 'bear_atr_max_pct': 0.013346129635535473, 'bear_tp_mult': 1.576176012697898, 'bear_tsl_mult': 0.6534645565167256, 'bear_time_stop': 241, 'bear_use_sma': True, 'bear_use_ema': False, 'bear_use_atr': True, 'bear_use_adx': True, 'bear_use_spike': False, 'bear_rsi_required': True, 'sideways_strategy': 'breakout', 'sideways_bb_std_mult': 2.0192434435875355, 'sideways_rsi_os': 51, 'sideways_rsi_ob': 91, 'sideways_adx_thresh': 32.98342651963939, 'sideways_atr_min_pct': 0.025207021061735176, 'sideways_atr_max_pct': 0.1329869150079945, 'sideways_tp_mult': 2.828535337449391, 'sideways_tsl_mult': 0.344017521724824, 'sideways_time_stop': 99, 'sideways_use_sma': False, 'sideways_use_ema': False, 'sideways_use_atr': True, 'sideways_use_adx': True, 'sideways_use_spike': True, 'sideways_rsi_required': False}.
[I 2025-09-01 11:49:42,186] Trial 431 finished with values: [-1000000000.0, 1000000000.0] and parameters: {'p_sma': 25, 'p_std': 33, 'p_atr': 21, 'p_adx': 7, 'rsi_period': 47, 'ema1': 24, 'ema2': 23, 'slip_atr_k': 0.018937296725221087, 'slip_spread_k': 0.47871977800064097, 'spread_hl_frac': 0.0038093059650087433, 'bb_std_mult': 0.9126012574972305, 'rsi_os': 31, 'rsi_ob': 51, 'vol_spike': 0.214042925761984, 'adx_thresh': 23.656419057576887, 'atr_min_pct': 0.02489354973196617, 'atr_max_pct': 0.074305346435151, 'tp_mult': 2.1360792318807835, 'tsl_mult': 0.11632316189382653, 'strategy': 'breakout', 'time_stop': 183, 'use_sma': False, 'use_atr': True, 'use_adx': True, 'use_ema': True, 'use_spike': False, 'rsi_required': False, 'edge_k': 0.24279073828298553, 'edge_cap': 0.0930023723161537, 'bull_strategy': 'mean_reversion', 'bull_bb_std_mult': 1.6781900057230301, 'bull_rsi_os': 49, 'bull_rsi_ob': 49, 'bull_adx_thresh': 6.311306651594042, 'bull_atr_min_pct': 0.01666925463612047, 'bull_atr_max_pct': 0.1104783898156261, 'bull_tp_mult': 1.2367835041495796, 'bull_tsl_mult': 0.6093469922626085, 'bull_time_stop': 166, 'bull_use_sma': False, 'bull_use_ema': False, 'bull_use_atr': False, 'bull_use_adx': False, 'bull_use_spike': False, 'bull_rsi_required': True, 'bear_strategy': 'mean_reversion', 'bear_bb_std_mult': 1.3097797280261676, 'bear_rsi_os': 27, 'bear_rsi_ob': 50, 'bear_adx_thresh': 6.873161305703695, 'bear_atr_min_pct': 0.006110001415033544, 'bear_atr_max_pct': 0.01962339139314659, 'bear_tp_mult': 1.4403735595779044, 'bear_tsl_mult': 0.7186284100732169, 'bear_time_stop': 287, 'bear_use_sma': True, 'bear_use_ema': False, 'bear_use_atr': True, 'bear_use_adx': True, 'bear_use_spike': False, 'bear_rsi_required': True, 'sideways_strategy': 'breakout', 'sideways_bb_std_mult': 1.9761471941893531, 'sideways_rsi_os': 46, 'sideways_rsi_ob': 89, 'sideways_adx_thresh': 32.60518878637433, 'sideways_atr_min_pct': 0.027013091174022272, 'sideways_atr_max_pct': 0.1355373933385507, 'sideways_tp_mult': 2.612269352116524, 'sideways_tsl_mult': 0.3665988444699025, 'sideways_time_stop': 97, 'sideways_use_sma': False, 'sideways_use_ema': False, 'sideways_use_atr': True, 'sideways_use_adx': True, 'sideways_use_spike': True, 'sideways_rsi_required': False}.
[I 2025-09-01 11:49:43,072] Trial 429 finished with values: [-1000000000.0, 1000000000.0] and parameters: {'p_sma': 24, 'p_std': 33, 'p_atr': 21, 'p_adx': 7, 'rsi_period': 43, 'ema1': 26, 'ema2': 22, 'slip_atr_k': 0.06179941824277484, 'slip_spread_k': 0.5090945773180479, 'spread_hl_frac': 0.0039040775491106126, 'bb_std_mult': 0.92446995496077, 'rsi_os': 30, 'rsi_ob': 51, 'vol_spike': 0.2121910523479268, 'adx_thresh': 25.34766233855259, 'atr_min_pct': 0.02525842503035973, 'atr_max_pct': 0.07510346536096316, 'tp_mult': 2.1305983134736226, 'tsl_mult': 0.09600475224671955, 'strategy': 'breakout', 'time_stop': 162, 'use_sma': False, 'use_atr': True, 'use_adx': True, 'use_ema': True, 'use_spike': False, 'rsi_required': False, 'edge_k': 0.27016931627788177, 'edge_cap': 0.09272376623656098, 'bull_strategy': 'mean_reversion', 'bull_bb_std_mult': 1.7309839425065607, 'bull_rsi_os': 34, 'bull_rsi_ob': 51, 'bull_adx_thresh': 6.179689525852466, 'bull_atr_min_pct': 0.017090380051078307, 'bull_atr_max_pct': 0.10968456622886444, 'bull_tp_mult': 1.2188297708330171, 'bull_tsl_mult': 0.6115198384210768, 'bull_time_stop': 165, 'bull_use_sma': False, 'bull_use_ema': False, 'bull_use_atr': True, 'bull_use_adx': False, 'bull_use_spike': False, 'bull_rsi_required': False, 'bear_strategy': 'mean_reversion', 'bear_bb_std_mult': 1.2979965564339406, 'bear_rsi_os': 27, 'bear_rsi_ob': 50, 'bear_adx_thresh': 7.178302947299337, 'bear_atr_min_pct': 0.006519719193597631, 'bear_atr_max_pct': 0.02008794826561684, 'bear_tp_mult': 1.4423281780480657, 'bear_tsl_mult': 0.7261034086888968, 'bear_time_stop': 266, 'bear_use_sma': True, 'bear_use_ema': False, 'bear_use_atr': True, 'bear_use_adx': True, 'bear_use_spike': False, 'bear_rsi_required': True, 'sideways_strategy': 'breakout', 'sideways_bb_std_mult': 1.9814426423779774, 'sideways_rsi_os': 47, 'sideways_rsi_ob': 89, 'sideways_adx_thresh': 32.422204564146504, 'sideways_atr_min_pct': 0.02658948364032704, 'sideways_atr_max_pct': 0.13283580999110947, 'sideways_tp_mult': 2.5972963630491703, 'sideways_tsl_mult': 0.3325558504172626, 'sideways_time_stop': 96, 'sideways_use_sma': False, 'sideways_use_ema': False, 'sideways_use_atr': True, 'sideways_use_adx': True, 'sideways_use_spike': True, 'sideways_rsi_required': False}.
[I 2025-09-01 11:49:43,355] Trial 428 finished with values: [-1000000000.0, 1000000000.0] and parameters: {'p_sma': 27, 'p_std': 34, 'p_atr': 21, 'p_adx': 7, 'rsi_period': 47, 'ema1': 26, 'ema2': 17, 'slip_atr_k': 0.018207982926872472, 'slip_spread_k': 0.4136593221177428, 'spread_hl_frac': 0.0012560964129187618, 'bb_std_mult': 0.9017087317701671, 'rsi_os': 30, 'rsi_ob': 50, 'vol_spike': 0.21359085601143815, 'adx_thresh': 23.380741261693874, 'atr_min_pct': 0.025798875605696703, 'atr_max_pct': 0.07768495362443052, 'tp_mult': 2.127797830387324, 'tsl_mult': 0.08402211038315162, 'strategy': 'breakout', 'time_stop': 181, 'use_sma': False, 'use_atr': True, 'use_adx': True, 'use_ema': True, 'use_spike': False, 'rsi_required': False, 'edge_k': 0.2844133982204644, 'edge_cap': 0.09590819868146677, 'bull_strategy': 'mean_reversion', 'bull_bb_std_mult': 1.7269542709138481, 'bull_rsi_os': 49, 'bull_rsi_ob': 49, 'bull_adx_thresh': 6.138002580544712, 'bull_atr_min_pct': 0.018478910836388526, 'bull_atr_max_pct': 0.10853237692616359, 'bull_tp_mult': 1.3685225687462512, 'bull_tsl_mult': 0.5992681682905399, 'bull_time_stop': 177, 'bull_use_sma': False, 'bull_use_ema': False, 'bull_use_atr': False, 'bull_use_adx': False, 'bull_use_spike': False, 'bull_rsi_required': True, 'bear_strategy': 'mean_reversion', 'bear_bb_std_mult': 1.191422252107093, 'bear_rsi_os': 28, 'bear_rsi_ob': 50, 'bear_adx_thresh': 8.461881643952834, 'bear_atr_min_pct': 0.006324074076956222, 'bear_atr_max_pct': 0.022397417301111656, 'bear_tp_mult': 1.449863955146257, 'bear_tsl_mult': 0.6429902764557092, 'bear_time_stop': 268, 'bear_use_sma': True, 'bear_use_ema': False, 'bear_use_atr': True, 'bear_use_adx': True, 'bear_use_spike': False, 'bear_rsi_required': True, 'sideways_strategy': 'breakout', 'sideways_bb_std_mult': 1.9178351236825906, 'sideways_rsi_os': 46, 'sideways_rsi_ob': 90, 'sideways_adx_thresh': 32.62038948430799, 'sideways_atr_min_pct': 0.012871304898693762, 'sideways_atr_max_pct': 0.14612335133504764, 'sideways_tp_mult': 2.7846841339750736, 'sideways_tsl_mult': 0.3823504734409604, 'sideways_time_stop': 84, 'sideways_use_sma': False, 'sideways_use_ema': False, 'sideways_use_atr': True, 'sideways_use_adx': True, 'sideways_use_spike': True, 'sideways_rsi_required': False}.
[I 2025-09-01 11:49:43,597] Trial 430 finished with values: [-1000000000.0, 1000000000.0] and parameters: {'p_sma': 24, 'p_std': 33, 'p_atr': 21, 'p_adx': 7, 'rsi_period': 43, 'ema1': 26, 'ema2': 23, 'slip_atr_k': 0.061073962217899985, 'slip_spread_k': 0.5150464393413986, 'spread_hl_frac': 0.003634320714818975, 'bb_std_mult': 0.9137026084588475, 'rsi_os': 30, 'rsi_ob': 51, 'vol_spike': 0.2123249437272769, 'adx_thresh': 25.607657460627923, 'atr_min_pct': 0.025224227916953054, 'atr_max_pct': 0.07466835740417557, 'tp_mult': 2.123984472566696, 'tsl_mult': 0.08349397736426323, 'strategy': 'breakout', 'time_stop': 164, 'use_sma': False, 'use_atr': True, 'use_adx': True, 'use_ema': True, 'use_spike': False, 'rsi_required': False, 'edge_k': 0.29337003212571106, 'edge_cap': 0.10015614676985495, 'bull_strategy': 'mean_reversion', 'bull_bb_std_mult': 1.7046357504503535, 'bull_rsi_os': 38, 'bull_rsi_ob': 49, 'bull_adx_thresh': 6.369634318658401, 'bull_atr_min_pct': 0.016773205217715536, 'bull_atr_max_pct': 0.11074419573853636, 'bull_tp_mult': 1.2268512302958243, 'bull_tsl_mult': 0.6083369585133136, 'bull_time_stop': 164, 'bull_use_sma': False, 'bull_use_ema': False, 'bull_use_atr': True, 'bull_use_adx': False, 'bull_use_spike': False, 'bull_rsi_required': False, 'bear_strategy': 'mean_reversion', 'bear_bb_std_mult': 1.2979454500821082, 'bear_rsi_os': 28, 'bear_rsi_ob': 50, 'bear_adx_thresh': 7.305034961823949, 'bear_atr_min_pct': 0.005656060296137574, 'bear_atr_max_pct': 0.019800270036884615, 'bear_tp_mult': 1.4423709324144771, 'bear_tsl_mult': 0.7120762654372669, 'bear_time_stop': 291, 'bear_use_sma': True, 'bear_use_ema': False, 'bear_use_atr': True, 'bear_use_adx': True, 'bear_use_spike': False, 'bear_rsi_required': True, 'sideways_strategy': 'breakout', 'sideways_bb_std_mult': 1.9941780797594753, 'sideways_rsi_os': 46, 'sideways_rsi_ob': 89, 'sideways_adx_thresh': 32.5066948929817, 'sideways_atr_min_pct': 0.02667555454333389, 'sideways_atr_max_pct': 0.13322799913292466, 'sideways_tp_mult': 2.675780023656115, 'sideways_tsl_mult': 0.3568107570849537, 'sideways_time_stop': 97, 'sideways_use_sma': False, 'sideways_use_ema': False, 'sideways_use_atr': True, 'sideways_use_adx': True, 'sideways_use_spike': True, 'sideways_rsi_required': False}.
