[I 2025-09-01 10:51:50,739] Trial 64 finished with values: [-1000000000.0, 1000000000.0] and parameters: {'p_sma': 21, 'p_std': 27, 'p_atr': 8, 'p_adx': 22, 'rsi_period': 41, 'ema1': 12, 'ema2': 59, 'slip_atr_k': 0.19799617904448102, 'slip_spread_k': 0.6972203237974766, 'spread_hl_frac': 0.004203489341925139, 'bb_std_mult': 1.3786540263398517, 'rsi_os': 25, 'rsi_ob': 47, 'vol_spike': 0.19207332982858744, 'adx_thresh': 14.312180033422582, 'atr_min_pct': 0.0027426624623908126, 'atr_max_pct': 0.05686204586927667, 'tp_mult': 2.8721714306564614, 'tsl_mult': 0.30756554013791515, 'strategy': 'mean_reversion', 'time_stop': 256, 'use_sma': True, 'use_atr': True, 'use_adx': False, 'use_ema': False, 'use_spike': True, 'rsi_required': False, 'edge_k': 0.5444823401276471, 'edge_cap': 0.3931642821702541, 'bull_strategy': 'breakout', 'bull_bb_std_mult': 1.7142858294399934, 'bull_rsi_os': 15, 'bull_rsi_ob': 72, 'bull_adx_thresh': 24.341010694298184, 'bull_atr_min_pct': 0.0014618562382198034, 'bull_atr_max_pct': 0.12155578370481998, 'bull_tp_mult': 1.2596956681233689, 'bull_tsl_mult': 0.6103078933370879, 'bull_time_stop': 241, 'bull_use_sma': False, 'bull_use_ema': True, 'bull_use_atr': False, 'bull_use_adx': True, 'bull_use_spike': False, 'bull_rsi_required': False, 'bear_strategy': 'breakout', 'bear_bb_std_mult': 1.5659436584756983, 'bear_rsi_os': 11, 'bear_rsi_ob': 84, 'bear_adx_thresh': 22.418613911424345, 'bear_atr_min_pct': 0.015253898117247798, 'bear_atr_max_pct': 0.05430612155006078, 'bear_tp_mult': 2.719698626150336, 'bear_tsl_mult': 0.22205552678787843, 'bear_time_stop': 19, 'bear_use_sma': False, 'bear_use_ema': False, 'bear_use_atr': True, 'bear_use_adx': False, 'bear_use_spike': True, 'bear_rsi_required': True, 'sideways_strategy': 'breakout', 'sideways_bb_std_mult': 1.6639854843610256, 'sideways_rsi_os': 6, 'sideways_rsi_ob': 48, 'sideways_adx_thresh': 9.523228468996109, 'sideways_atr_min_pct': 0.017708069735390845, 'sideways_atr_max_pct': 0.06126757707243308, 'sideways_tp_mult': 1.1105863826840998, 'sideways_tsl_mult': 0.5834090176697884, 'sideways_time_stop': 36, 'sideways_use_sma': False, 'sideways_use_ema': True, 'sideways_use_atr': True, 'sideways_use_adx': False, 'sideways_use_spike': True, 'sideways_rsi_required': True}.
[I 2025-09-01 10:52:32,166] Trial 63 finished with values: [-0.011254635655219447, 0.01129032865525784] and parameters: {'p_sma': 16, 'p_std': 28, 'p_atr': 7, 'p_adx': 23, 'rsi_period': 43, 'ema1': 12, 'ema2': 59, 'slip_atr_k': 0.22456548395796688, 'slip_spread_k': 0.6968428510452742, 'spread_hl_frac': 0.004462759617151344, 'bb_std_mult': 1.7051821574911725, 'rsi_os': 28, 'rsi_ob': 60, 'vol_spike': 0.19207920225314773, 'adx_thresh': 6.725314561229905, 'atr_min_pct': 0.002538336854655137, 'atr_max_pct': 0.05932577843969198, 'tp_mult': 2.5534567981271206, 'tsl_mult': 0.5697591070932511, 'strategy': 'mean_reversion', 'time_stop': 256, 'use_sma': True, 'use_atr': True, 'use_adx': False, 'use_ema': False, 'use_spike': False, 'rsi_required': False, 'edge_k': 1.5473122259392613, 'edge_cap': 0.5637083002508554, 'bull_strategy': 'breakout', 'bull_bb_std_mult': 1.6966796745446169, 'bull_rsi_os': 15, 'bull_rsi_ob': 70, 'bull_adx_thresh': 31.72337751256157, 'bull_atr_min_pct': 0.0011773515326492622, 'bull_atr_max_pct': 0.12133008473877013, 'bull_tp_mult': 1.733194007779213, 'bull_tsl_mult': 0.6800000665054072, 'bull_time_stop': 6, 'bull_use_sma': False, 'bull_use_ema': True, 'bull_use_atr': False, 'bull_use_adx': True, 'bull_use_spike': False, 'bull_rsi_required': False, 'bear_strategy': 'breakout', 'bear_bb_std_mult': 1.339674473763648, 'bear_rsi_os': 37, 'bear_rsi_ob': 81, 'bear_adx_thresh': 22.36832602514111, 'bear_atr_min_pct': 0.015422866687401211, 'bear_atr_max_pct': 0.0657059795146404, 'bear_tp_mult': 1.83073582369144, 'bear_tsl_mult': 0.19750599479640163, 'bear_time_stop': 98, 'bear_use_sma': False, 'bear_use_ema': False, 'bear_use_atr': True, 'bear_use_adx': False, 'bear_use_spike': True, 'bear_rsi_required': True, 'sideways_strategy': 'breakout', 'sideways_bb_std_mult': 3.192245862583901, 'sideways_rsi_os': 15, 'sideways_rsi_ob': 47, 'sideways_adx_thresh': 8.672175699143803, 'sideways_atr_min_pct': 0.018115646720749733, 'sideways_atr_max_pct': 0.10126353560609302, 'sideways_tp_mult': 1.1250094643608672, 'sideways_tsl_mult': 0.5287651086432271, 'sideways_time_stop': 146, 'sideways_use_sma': False, 'sideways_use_ema': True, 'sideways_use_atr': True, 'sideways_use_adx': False, 'sideways_use_spike': True, 'sideways_rsi_required': True}.
[I 2025-09-01 10:52:33,231] Trial 66 finished with values: [-0.032986306938370236, 0.0328941589111364] and parameters: {'p_sma': 21, 'p_std': 10, 'p_atr': 7, 'p_adx': 22, 'rsi_period': 29, 'ema1': 8, 'ema2': 22, 'slip_atr_k': 0.10912997047425288, 'slip_spread_k': 0.686733226795898, 'spread_hl_frac': 0.04434286924925129, 'bb_std_mult': 1.3689446406589656, 'rsi_os': 46, 'rsi_ob': 59, 'vol_spike': 0.19148031529694692, 'adx_thresh': 7.255741298316901, 'atr_min_pct': 0.0028516306090439177, 'atr_max_pct': 0.0496447308768239, 'tp_mult': 2.8746305594766555, 'tsl_mult': 0.5614069932320505, 'strategy': 'mean_reversion', 'time_stop': 279, 'use_sma': True, 'use_atr': True, 'use_adx': False, 'use_ema': False, 'use_spike': False, 'rsi_required': False, 'edge_k': 0.42052852719200184, 'edge_cap': 0.5592892036896393, 'bull_strategy': 'breakout', 'bull_bb_std_mult': 1.6297791240320902, 'bull_rsi_os': 6, 'bull_rsi_ob': 72, 'bull_adx_thresh': 31.642742164867553, 'bull_atr_min_pct': 0.0013202358937781363, 'bull_atr_max_pct': 0.14324122935390074, 'bull_tp_mult': 1.2598399305967731, 'bull_tsl_mult': 0.6090475258727507, 'bull_time_stop': 263, 'bull_use_sma': True, 'bull_use_ema': True, 'bull_use_atr': False, 'bull_use_adx': True, 'bull_use_spike': False, 'bull_rsi_required': False, 'bear_strategy': 'breakout', 'bear_bb_std_mult': 2.9850760100795766, 'bear_rsi_os': 15, 'bear_rsi_ob': 84, 'bear_adx_thresh': 24.47798467134188, 'bear_atr_min_pct': 0.01516857775137869, 'bear_atr_max_pct': 0.08082980969406603, 'bear_tp_mult': 1.844696216298522, 'bear_tsl_mult': 0.26588906138849544, 'bear_time_stop': 43, 'bear_use_sma': False, 'bear_use_ema': False, 'bear_use_atr': True, 'bear_use_adx': False, 'bear_use_spike': False, 'bear_rsi_required': True, 'sideways_strategy': 'breakout', 'sideways_bb_std_mult': 1.1212732251479052, 'sideways_rsi_os': 6, 'sideways_rsi_ob': 47, 'sideways_adx_thresh': 34.78704032072863, 'sideways_atr_min_pct': 0.016573937005487028, 'sideways_atr_max_pct': 0.12443076610042605, 'sideways_tp_mult': 1.0891434826075976, 'sideways_tsl_mult': 0.4561815629675038, 'sideways_time_stop': 39, 'sideways_use_sma': False, 'sideways_use_ema': True, 'sideways_use_atr': False, 'sideways_use_adx': True, 'sideways_use_spike': True, 'sideways_rsi_required': True}.
[I 2025-09-01 10:52:33,634] Trial 67 finished with values: [-1000000000.0, 1000000000.0] and parameters: {'p_sma': 32, 'p_std': 12, 'p_atr': 12, 'p_adx': 23, 'rsi_period': 79, 'ema1': 8, 'ema2': 18, 'slip_atr_k': 0.22242285954496124, 'slip_spread_k': 0.8062891185075816, 'spread_hl_frac': 0.044019221501810285, 'bb_std_mult': 2.326842641825224, 'rsi_os': 28, 'rsi_ob': 92, 'vol_spike': 0.1906560402792844, 'adx_thresh': 7.23072656048238, 'atr_min_pct': 0.0012192273481616035, 'atr_max_pct': 0.04809919444832015, 'tp_mult': 2.9125778426944287, 'tsl_mult': 0.5623529828165406, 'strategy': 'mean_reversion', 'time_stop': 276, 'use_sma': True, 'use_atr': True, 'use_adx': False, 'use_ema': True, 'use_spike': False, 'rsi_required': False, 'edge_k': 1.247402263667277, 'edge_cap': 0.9327338972060555, 'bull_strategy': 'mean_reversion', 'bull_bb_std_mult': 1.5997039076633892, 'bull_rsi_os': 35, 'bull_rsi_ob': 52, 'bull_adx_thresh': 32.44442768653762, 'bull_atr_min_pct': 0.0016726361580849955, 'bull_atr_max_pct': 0.14360262263209406, 'bull_tp_mult': 1.6758906444520814, 'bull_tsl_mult': 0.686681918091428, 'bull_time_stop': 9, 'bull_use_sma': True, 'bull_use_ema': True, 'bull_use_atr': False, 'bull_use_adx': True, 'bull_use_spike': False, 'bull_rsi_required': False, 'bear_strategy': 'breakout', 'bear_bb_std_mult': 2.9839737432189266, 'bear_rsi_os': 15, 'bear_rsi_ob': 86, 'bear_adx_thresh': 26.140358936552506, 'bear_atr_min_pct': 0.016894765310316744, 'bear_atr_max_pct': 0.08005407955284558, 'bear_tp_mult': 1.8505475274775565, 'bear_tsl_mult': 0.27556379856790325, 'bear_time_stop': 99, 'bear_use_sma': False, 'bear_use_ema': False, 'bear_use_atr': True, 'bear_use_adx': True, 'bear_use_spike': False, 'bear_rsi_required': True, 'sideways_strategy': 'breakout', 'sideways_bb_std_mult': 1.9582027863022975, 'sideways_rsi_os': 8, 'sideways_rsi_ob': 90, 'sideways_adx_thresh': 34.2154258068134, 'sideways_atr_min_pct': 0.015544520502422575, 'sideways_atr_max_pct': 0.12106992348506011, 'sideways_tp_mult': 1.35306391209738, 'sideways_tsl_mult': 0.46421038463439107, 'sideways_time_stop': 142, 'sideways_use_sma': False, 'sideways_use_ema': True, 'sideways_use_atr': False, 'sideways_use_adx': True, 'sideways_use_spike': True, 'sideways_rsi_required': False}.
[I 2025-09-01 10:52:34,189] Trial 65 finished with values: [-1000000000.0, 1000000000.0] and parameters: {'p_sma': 21, 'p_std': 51, 'p_atr': 8, 'p_adx': 22, 'rsi_period': 63, 'ema1': 12, 'ema2': 19, 'slip_atr_k': 0.2099083323087674, 'slip_spread_k': 0.6988815641868059, 'spread_hl_frac': 0.04423426806941652, 'bb_std_mult': 1.3360391809500487, 'rsi_os': 30, 'rsi_ob': 59, 'vol_spike': 0.19098253426706563, 'adx_thresh': 7.273142871222319, 'atr_min_pct': 0.0023828865250779055, 'atr_max_pct': 0.10017625615420125, 'tp_mult': 2.8907657546639585, 'tsl_mult': 0.5537080420090814, 'strategy': 'mean_reversion', 'time_stop': 26, 'use_sma': True, 'use_atr': True, 'use_adx': False, 'use_ema': False, 'use_spike': False, 'rsi_required': False, 'edge_k': 1.785346308511654, 'edge_cap': 0.5499410592985834, 'bull_strategy': 'breakout', 'bull_bb_std_mult': 1.5747824345852286, 'bull_rsi_os': 45, 'bull_rsi_ob': 71, 'bull_adx_thresh': 34.904444558340025, 'bull_atr_min_pct': 0.001758492515781389, 'bull_atr_max_pct': 0.11504428333072007, 'bull_tp_mult': 1.0355200464749557, 'bull_tsl_mult': 0.6046513143594824, 'bull_time_stop': 272, 'bull_use_sma': False, 'bull_use_ema': True, 'bull_use_atr': False, 'bull_use_adx': True, 'bull_use_spike': False, 'bull_rsi_required': False, 'bear_strategy': 'breakout', 'bear_bb_std_mult': 1.5603441511106801, 'bear_rsi_os': 15, 'bear_rsi_ob': 85, 'bear_adx_thresh': 24.68969147767149, 'bear_atr_min_pct': 0.015916634817801773, 'bear_atr_max_pct': 0.055082771755056534, 'bear_tp_mult': 2.101167999422062, 'bear_tsl_mult': 0.27320638032506805, 'bear_time_stop': 20, 'bear_use_sma': False, 'bear_use_ema': False, 'bear_use_atr': True, 'bear_use_adx': False, 'bear_use_spike': False, 'bear_rsi_required': True, 'sideways_strategy': 'breakout', 'sideways_bb_std_mult': 1.1296030640070496, 'sideways_rsi_os': 6, 'sideways_rsi_ob': 73, 'sideways_adx_thresh': 34.937371726976934, 'sideways_atr_min_pct': 0.016538470600339295, 'sideways_atr_max_pct': 0.024604912284712274, 'sideways_tp_mult': 1.2752918667504298, 'sideways_tsl_mult': 0.45697376346146307, 'sideways_time_stop': 46, 'sideways_use_sma': False, 'sideways_use_ema': True, 'sideways_use_atr': True, 'sideways_use_adx': True, 'sideways_use_spike': True, 'sideways_rsi_required': True}.
[I 2025-09-01 10:53:14,542] Trial 71 finished with values: [-1000000000.0, 1000000000.0] and parameters: {'p_sma': 16, 'p_std': 39, 'p_atr': 7, 'p_adx': 21, 'rsi_period': 29, 'ema1': 19, 'ema2': 57, 'slip_atr_k': 0.1029375522195568, 'slip_spread_k': 0.3510690790132191, 'spread_hl_frac': 0.009078449230729833, 'bb_std_mult': 1.5458143084350782, 'rsi_os': 28, 'rsi_ob': 61, 'vol_spike': 0.163666057803749, 'adx_thresh': 6.199693188189056, 'atr_min_pct': 0.0002457664896001479, 'atr_max_pct': 0.13766839618907836, 'tp_mult': 2.0627443535494105, 'tsl_mult': 0.35860414126495843, 'strategy': 'mean_reversion', 'time_stop': 285, 'use_sma': True, 'use_atr': True, 'use_adx': True, 'use_ema': False, 'use_spike': False, 'rsi_required': True, 'edge_k': 1.5205985065544099, 'edge_cap': 0.5789890994399794, 'bull_strategy': 'mean_reversion', 'bull_bb_std_mult': 2.0207820922229347, 'bull_rsi_os': 23, 'bull_rsi_ob': 74, 'bull_adx_thresh': 31.80320518411846, 'bull_atr_min_pct': 7.252105834299437e-05, 'bull_atr_max_pct': 0.1323553298573704, 'bull_tp_mult': 1.7446863452898467, 'bull_tsl_mult': 0.7573637299767859, 'bull_time_stop': 99, 'bull_use_sma': False, 'bull_use_ema': True, 'bull_use_atr': True, 'bull_use_adx': True, 'bull_use_spike': False, 'bull_rsi_required': False, 'bear_strategy': 'mean_reversion', 'bear_bb_std_mult': 0.8949785515044637, 'bear_rsi_os': 37, 'bear_rsi_ob': 92, 'bear_adx_thresh': 18.988870733197114, 'bear_atr_min_pct': 0.013027666006230829, 'bear_atr_max_pct': 0.043415617908169064, 'bear_tp_mult': 1.5853928388689242, 'bear_tsl_mult': 0.05030004883953304, 'bear_time_stop': 153, 'bear_use_sma': False, 'bear_use_ema': False, 'bear_use_atr': True, 'bear_use_adx': False, 'bear_use_spike': True, 'bear_rsi_required': False, 'sideways_strategy': 'mean_reversion', 'sideways_bb_std_mult': 3.5382648416623392, 'sideways_rsi_os': 46, 'sideways_rsi_ob': 45, 'sideways_adx_thresh': 6.642281054995172, 'sideways_atr_min_pct': 0.020686624217951533, 'sideways_atr_max_pct': 0.12449167859487748, 'sideways_tp_mult': 1.0528948073111863, 'sideways_tsl_mult': 0.6782161214864234, 'sideways_time_stop': 206, 'sideways_use_sma': False, 'sideways_use_ema': False, 'sideways_use_atr': True, 'sideways_use_adx': False, 'sideways_use_spike': True, 'sideways_rsi_required': True}.
[I 2025-09-01 10:53:15,847] Trial 68 finished with values: [-0.014641280385557232, 0.014638866890755421] and parameters: {'p_sma': 8, 'p_std': 8, 'p_atr': 7, 'p_adx': 23, 'rsi_period': 36, 'ema1': 19, 'ema2': 60, 'slip_atr_k': 0.22337908103805712, 'slip_spread_k': 0.3651720637145528, 'spread_hl_frac': 0.03762264168918407, 'bb_std_mult': 0.5079249722954693, 'rsi_os': 28, 'rsi_ob': 60, 'vol_spike': 0.16403852084230514, 'adx_thresh': 6.588330961224555, 'atr_min_pct': 0.0012077821470245457, 'atr_max_pct': 0.06569079995640031, 'tp_mult': 1.0156830444118996, 'tsl_mult': 0.3562439026746901, 'strategy': 'mean_reversion', 'time_stop': 277, 'use_sma': True, 'use_atr': True, 'use_adx': False, 'use_ema': False, 'use_spike': False, 'rsi_required': True, 'edge_k': 1.253773274237662, 'edge_cap': 0.5407464667984149, 'bull_strategy': 'mean_reversion', 'bull_bb_std_mult': 2.0864952814915845, 'bull_rsi_os': 35, 'bull_rsi_ob': 72, 'bull_adx_thresh': 31.596214235644226, 'bull_atr_min_pct': 0.000650187622470433, 'bull_atr_max_pct': 0.11416735520040115, 'bull_tp_mult': 1.6591299270797895, 'bull_tsl_mult': 0.6836912200196105, 'bull_time_stop': 15, 'bull_use_sma': False, 'bull_use_ema': True, 'bull_use_atr': False, 'bull_use_adx': True, 'bull_use_spike': False, 'bull_rsi_required': False, 'bear_strategy': 'breakout', 'bear_bb_std_mult': 0.7785328058685892, 'bear_rsi_os': 37, 'bear_rsi_ob': 86, 'bear_adx_thresh': 19.05828186880968, 'bear_atr_min_pct': 0.01727835765061076, 'bear_atr_max_pct': 0.032541637342534104, 'bear_tp_mult': 1.839703660456614, 'bear_tsl_mult': 0.051335495984389745, 'bear_time_stop': 142, 'bear_use_sma': False, 'bear_use_ema': False, 'bear_use_atr': True, 'bear_use_adx': False, 'bear_use_spike': True, 'bear_rsi_required': False, 'sideways_strategy': 'breakout', 'sideways_bb_std_mult': 3.5634888091554684, 'sideways_rsi_os': 22, 'sideways_rsi_ob': 72, 'sideways_adx_thresh': 6.439177405976207, 'sideways_atr_min_pct': 0.020555913938216548, 'sideways_atr_max_pct': 0.11986239095202664, 'sideways_tp_mult': 1.0919775366188471, 'sideways_tsl_mult': 0.029964872084901673, 'sideways_time_stop': 143, 'sideways_use_sma': False, 'sideways_use_ema': True, 'sideways_use_atr': True, 'sideways_use_adx': False, 'sideways_use_spike': True, 'sideways_rsi_required': True}.
[I 2025-09-01 10:53:16,169] Trial 69 finished with values: [-0.02947275059638743, 0.02907662311364518] and parameters: {'p_sma': 15, 'p_std': 9, 'p_atr': 7, 'p_adx': 23, 'rsi_period': 28, 'ema1': 18, 'ema2': 60, 'slip_atr_k': 0.22464354758444757, 'slip_spread_k': 0.37010462974764124, 'spread_hl_frac': 0.024797782185650236, 'bb_std_mult': 2.3642377268023904, 'rsi_os': 28, 'rsi_ob': 61, 'vol_spike': 0.16388059015879022, 'adx_thresh': 6.845115790202673, 'atr_min_pct': 0.0018265589231751544, 'atr_max_pct': 0.13921422453903265, 'tp_mult': 1.1727220915140735, 'tsl_mult': 0.5625337096533342, 'strategy': 'mean_reversion', 'time_stop': 274, 'use_sma': True, 'use_atr': True, 'use_adx': False, 'use_ema': False, 'use_spike': False, 'rsi_required': True, 'edge_k': 1.5429646386053584, 'edge_cap': 0.5621983628964302, 'bull_strategy': 'mean_reversion', 'bull_bb_std_mult': 2.10539992889036, 'bull_rsi_os': 35, 'bull_rsi_ob': 71, 'bull_adx_thresh': 32.149596242515656, 'bull_atr_min_pct': 0.0006783585358791852, 'bull_atr_max_pct': 0.13285194734575714, 'bull_tp_mult': 1.5789943025928082, 'bull_tsl_mult': 0.6802495537571491, 'bull_time_stop': 7, 'bull_use_sma': True, 'bull_use_ema': True, 'bull_use_atr': True, 'bull_use_adx': True, 'bull_use_spike': False, 'bull_rsi_required': False, 'bear_strategy': 'breakout', 'bear_bb_std_mult': 0.8917819158568866, 'bear_rsi_os': 38, 'bear_rsi_ob': 86, 'bear_adx_thresh': 20.011718745047723, 'bear_atr_min_pct': 0.01660130546251518, 'bear_atr_max_pct': 0.010658838094880357, 'bear_tp_mult': 1.8288983231234102, 'bear_tsl_mult': 0.08912791646953036, 'bear_time_stop': 148, 'bear_use_sma': False, 'bear_use_ema': False, 'bear_use_atr': True, 'bear_use_adx': False, 'bear_use_spike': True, 'bear_rsi_required': False, 'sideways_strategy': 'breakout', 'sideways_bb_std_mult': 3.4412696849818887, 'sideways_rsi_os': 22, 'sideways_rsi_ob': 45, 'sideways_adx_thresh': 7.979640831993493, 'sideways_atr_min_pct': 0.02069377879789728, 'sideways_atr_max_pct': 0.13377055175077993, 'sideways_tp_mult': 1.2709277410644049, 'sideways_tsl_mult': 0.6983287722636828, 'sideways_time_stop': 144, 'sideways_use_sma': False, 'sideways_use_ema': True, 'sideways_use_atr': False, 'sideways_use_adx': False, 'sideways_use_spike': True, 'sideways_rsi_required': True}.
[I 2025-09-01 10:53:16,346] Trial 70 finished with values: [-1000000000.0, 1000000000.0] and parameters: {'p_sma': 16, 'p_std': 50, 'p_atr': 7, 'p_adx': 22, 'rsi_period': 32, 'ema1': 16, 'ema2': 60, 'slip_atr_k': 0.10604049167084864, 'slip_spread_k': 0.37190023029524255, 'spread_hl_frac': 0.02569497813173309, 'bb_std_mult': 1.5856689080404887, 'rsi_os': 29, 'rsi_ob': 61, 'vol_spike': 0.1383177806657417, 'adx_thresh': 5.987496025607246, 'atr_min_pct': 0.0002560535505239433, 'atr_max_pct': 0.06893691823222747, 'tp_mult': 1.029120405098353, 'tsl_mult': 0.3849598792517149, 'strategy': 'mean_reversion', 'time_stop': 239, 'use_sma': True, 'use_atr': True, 'use_adx': True, 'use_ema': False, 'use_spike': False, 'rsi_required': True, 'edge_k': 1.5339266290188511, 'edge_cap': 0.5669427210857938, 'bull_strategy': 'mean_reversion', 'bull_bb_std_mult': 2.0934249526945607, 'bull_rsi_os': 30, 'bull_rsi_ob': 72, 'bull_adx_thresh': 31.619935910295872, 'bull_atr_min_pct': 0.00024945384111206505, 'bull_atr_max_pct': 0.11354899472620052, 'bull_tp_mult': 1.321177364143617, 'bull_tsl_mult': 0.7677338774942817, 'bull_time_stop': 100, 'bull_use_sma': False, 'bull_use_ema': True, 'bull_use_atr': True, 'bull_use_adx': True, 'bull_use_spike': False, 'bull_rsi_required': False, 'bear_strategy': 'breakout', 'bear_bb_std_mult': 0.9031655496333835, 'bear_rsi_os': 37, 'bear_rsi_ob': 93, 'bear_adx_thresh': 19.313607891772136, 'bear_atr_min_pct': 0.01621814465179165, 'bear_atr_max_pct': 0.03535907960039318, 'bear_tp_mult': 1.5341173292748775, 'bear_tsl_mult': 0.04064591464714459, 'bear_time_stop': 136, 'bear_use_sma': False, 'bear_use_ema': False, 'bear_use_atr': True, 'bear_use_adx': False, 'bear_use_spike': True, 'bear_rsi_required': False, 'sideways_strategy': 'mean_reversion', 'sideways_bb_std_mult': 3.474762200875545, 'sideways_rsi_os': 22, 'sideways_rsi_ob': 73, 'sideways_adx_thresh': 6.724855333036306, 'sideways_atr_min_pct': 0.020540678275550825, 'sideways_atr_max_pct': 0.12455882737944096, 'sideways_tp_mult': 1.2588590711450551, 'sideways_tsl_mult': 0.6860762617225437, 'sideways_time_stop': 204, 'sideways_use_sma': False, 'sideways_use_ema': True, 'sideways_use_atr': True, 'sideways_use_adx': False, 'sideways_use_spike': True, 'sideways_rsi_required': True}.
