[I 2025-09-01 11:00:47,955] Trial 118 finished with values: [-1000000000.0, 1000000000.0] and parameters: {'p_sma': 39, 'p_std': 52, 'p_atr': 27, 'p_adx': 28, 'rsi_period': 33, 'ema1': 16, 'ema2': 45, 'slip_atr_k': 0.04875977265072788, 'slip_spread_k': 0.40421369906817495, 'spread_hl_frac': 0.023325241232860686, 'bb_std_mult': 0.6768136975524446, 'rsi_os': 26, 'rsi_ob': 84, 'vol_spike': 0.14300082468541137, 'adx_thresh': 6.17924162814916, 'atr_min_pct': 0.011063319206858754, 'atr_max_pct': 0.06567779904748244, 'tp_mult': 1.5647413231590341, 'tsl_mult': 0.3244346113416493, 'strategy': 'mean_reversion', 'time_stop': 265, 'use_sma': True, 'use_atr': True, 'use_adx': True, 'use_ema': True, 'use_spike': False, 'rsi_required': True, 'edge_k': 1.139173267866351, 'edge_cap': 0.15614247687075106, 'bull_strategy': 'mean_reversion', 'bull_bb_std_mult': 2.1520442241364477, 'bull_rsi_os': 43, 'bull_rsi_ob': 75, 'bull_adx_thresh': 24.662243338864048, 'bull_atr_min_pct': 0.019381411421911632, 'bull_atr_max_pct': 0.12005395597933516, 'bull_tp_mult': 1.8897418488671764, 'bull_tsl_mult': 0.8380260912573548, 'bull_time_stop': 26, 'bull_use_sma': True, 'bull_use_ema': False, 'bull_use_atr': True, 'bull_use_adx': True, 'bull_use_spike': True, 'bull_rsi_required': False, 'bear_strategy': 'mean_reversion', 'bear_bb_std_mult': 1.5868095165902711, 'bear_rsi_os': 39, 'bear_rsi_ob': 52, 'bear_adx_thresh': 11.163052435045993, 'bear_atr_min_pct': 0.008954337428714449, 'bear_atr_max_pct': 0.149944278804158, 'bear_tp_mult': 1.8042272860592434, 'bear_tsl_mult': 0.1345162770038686, 'bear_time_stop': 154, 'bear_use_sma': False, 'bear_use_ema': False, 'bear_use_atr': True, 'bear_use_adx': False, 'bear_use_spike': True, 'bear_rsi_required': False, 'sideways_strategy': 'breakout', 'sideways_bb_std_mult': 1.2544242420328513, 'sideways_rsi_os': 19, 'sideways_rsi_ob': 45, 'sideways_adx_thresh': 19.148888804928625, 'sideways_atr_min_pct': 0.008249055887717004, 'sideways_atr_max_pct': 0.09664084476851331, 'sideways_tp_mult': 1.9338996263044992, 'sideways_tsl_mult': 0.9589163307549491, 'sideways_time_stop': 256, 'sideways_use_sma': True, 'sideways_use_ema': True, 'sideways_use_atr': False, 'sideways_use_adx': False, 'sideways_use_spike': False, 'sideways_rsi_required': True}.
[I 2025-09-01 11:00:49,138] Trial 115 finished with values: [-0.007105977034957189, 0.0074549905542678225] and parameters: {'p_sma': 40, 'p_std': 42, 'p_atr': 26, 'p_adx': 28, 'rsi_period': 33, 'ema1': 17, 'ema2': 47, 'slip_atr_k': 0.013582796176982048, 'slip_spread_k': 0.2836618314079179, 'spread_hl_frac': 0.010140776620263709, 'bb_std_mult': 2.8283111716272615, 'rsi_os': 24, 'rsi_ob': 62, 'vol_spike': 0.14306923706523944, 'adx_thresh': 33.5410477621261, 'atr_min_pct': 0.017691199592366195, 'atr_max_pct': 0.06606724216416544, 'tp_mult': 1.524610734997253, 'tsl_mult': 0.3472413632593832, 'strategy': 'mean_reversion', 'time_stop': 85, 'use_sma': True, 'use_atr': True, 'use_adx': True, 'use_ema': True, 'use_spike': False, 'rsi_required': True, 'edge_k': 1.9857759925726184, 'edge_cap': 0.4962103911818881, 'bull_strategy': 'breakout', 'bull_bb_std_mult': 3.4928454168352814, 'bull_rsi_os': 26, 'bull_rsi_ob': 82, 'bull_adx_thresh': 25.20832799851143, 'bull_atr_min_pct': 0.0020706213066002, 'bull_atr_max_pct': 0.11186011326899359, 'bull_tp_mult': 1.4938947717218494, 'bull_tsl_mult': 0.8418800340923525, 'bull_time_stop': 24, 'bull_use_sma': False, 'bull_use_ema': False, 'bull_use_atr': True, 'bull_use_adx': True, 'bull_use_spike': True, 'bull_rsi_required': False, 'bear_strategy': 'breakout', 'bear_bb_std_mult': 1.3055118161606811, 'bear_rsi_os': 38, 'bear_rsi_ob': 88, 'bear_adx_thresh': 11.384288102226417, 'bear_atr_min_pct': 0.01979046020764935, 'bear_atr_max_pct': 0.14191684024455348, 'bear_tp_mult': 1.8937980242194492, 'bear_tsl_mult': 0.4948364224067252, 'bear_time_stop': 122, 'bear_use_sma': False, 'bear_use_ema': False, 'bear_use_atr': True, 'bear_use_adx': False, 'bear_use_spike': True, 'bear_rsi_required': False, 'sideways_strategy': 'breakout', 'sideways_bb_std_mult': 1.2143450422344442, 'sideways_rsi_os': 37, 'sideways_rsi_ob': 50, 'sideways_adx_thresh': 17.056044949208815, 'sideways_atr_min_pct': 0.0045447276416643555, 'sideways_atr_max_pct': 0.0987253751377704, 'sideways_tp_mult': 1.9301763370405738, 'sideways_tsl_mult': 0.021600464161862516, 'sideways_time_stop': 259, 'sideways_use_sma': False, 'sideways_use_ema': True, 'sideways_use_atr': False, 'sideways_use_adx': False, 'sideways_use_spike': False, 'sideways_rsi_required': True}.
[I 2025-09-01 11:00:49,776] Trial 119 finished with values: [-0.0211357520843789, 0.021023196053071673] and parameters: {'p_sma': 9, 'p_std': 19, 'p_atr': 22, 'p_adx': 11, 'rsi_period': 22, 'ema1': 21, 'ema2': 47, 'slip_atr_k': 0.0515711989421518, 'slip_spread_k': 0.2861319225806491, 'spread_hl_frac': 0.0476728750232987, 'bb_std_mult': 3.44812750693016, 'rsi_os': 40, 'rsi_ob': 54, 'vol_spike': 0.14255726360504226, 'adx_thresh': 28.813514354658878, 'atr_min_pct': 0.01084693140491037, 'atr_max_pct': 0.07587573031679194, 'tp_mult': 1.7175942314740127, 'tsl_mult': 0.3172224107115522, 'strategy': 'breakout', 'time_stop': 78, 'use_sma': True, 'use_atr': True, 'use_adx': True, 'use_ema': True, 'use_spike': False, 'rsi_required': True, 'edge_k': 1.135078076473451, 'edge_cap': 0.1810486877542763, 'bull_strategy': 'mean_reversion', 'bull_bb_std_mult': 2.965785819498574, 'bull_rsi_os': 44, 'bull_rsi_ob': 84, 'bull_adx_thresh': 24.043152203926162, 'bull_atr_min_pct': 0.0006074642835912298, 'bull_atr_max_pct': 0.11912869818652935, 'bull_tp_mult': 2.9094800127405556, 'bull_tsl_mult': 0.38275241890218425, 'bull_time_stop': 59, 'bull_use_sma': True, 'bull_use_ema': False, 'bull_use_atr': True, 'bull_use_adx': True, 'bull_use_spike': True, 'bull_rsi_required': False, 'bear_strategy': 'mean_reversion', 'bear_bb_std_mult': 1.6180678075757324, 'bear_rsi_os': 42, 'bear_rsi_ob': 53, 'bear_adx_thresh': 18.656133309571636, 'bear_atr_min_pct': 0.01902490664609171, 'bear_atr_max_pct': 0.03099495807690992, 'bear_tp_mult': 1.8873466869274844, 'bear_tsl_mult': 0.3975788556386539, 'bear_time_stop': 250, 'bear_use_sma': False, 'bear_use_ema': False, 'bear_use_atr': True, 'bear_use_adx': False, 'bear_use_spike': True, 'bear_rsi_required': False, 'sideways_strategy': 'mean_reversion', 'sideways_bb_std_mult': 3.13426883653099, 'sideways_rsi_os': 19, 'sideways_rsi_ob': 45, 'sideways_adx_thresh': 17.186787855174174, 'sideways_atr_min_pct': 0.02011415276085419, 'sideways_atr_max_pct': 0.08930430466277411, 'sideways_tp_mult': 2.998772032414985, 'sideways_tsl_mult': 0.01997875725525393, 'sideways_time_stop': 159, 'sideways_use_sma': True, 'sideways_use_ema': True, 'sideways_use_atr': False, 'sideways_use_adx': False, 'sideways_use_spike': False, 'sideways_rsi_required': True}.
[I 2025-09-01 11:01:32,064] Trial 123 finished with values: [-0.00831297613694626, 0.008417888495382855] and parameters: {'p_sma': 11, 'p_std': 30, 'p_atr': 7, 'p_adx': 26, 'rsi_period': 30, 'ema1': 18, 'ema2': 42, 'slip_atr_k': 0.06550024061357791, 'slip_spread_k': 0.24340496105817908, 'spread_hl_frac': 0.012388469359775976, 'bb_std_mult': 0.774534115124986, 'rsi_os': 32, 'rsi_ob': 64, 'vol_spike': 0.016245551834363603, 'adx_thresh': 25.983745383294377, 'atr_min_pct': 0.016105157261406506, 'atr_max_pct': 0.08871354902105555, 'tp_mult': 1.1559198619011317, 'tsl_mult': 0.5473902188187002, 'strategy': 'mean_reversion', 'time_stop': 213, 'use_sma': True, 'use_atr': False, 'use_adx': True, 'use_ema': True, 'use_spike': False, 'rsi_required': True, 'edge_k': 1.8150223520000275, 'edge_cap': 0.5222150077313981, 'bull_strategy': 'breakout', 'bull_bb_std_mult': 3.1231074928491385, 'bull_rsi_os': 47, 'bull_rsi_ob': 48, 'bull_adx_thresh': 27.611099811557203, 'bull_atr_min_pct': 0.014654812702333384, 'bull_atr_max_pct': 0.10158393174517096, 'bull_tp_mult': 2.1080516586122093, 'bull_tsl_mult': 0.968597490814224, 'bull_time_stop': 32, 'bull_use_sma': False, 'bull_use_ema': False, 'bull_use_atr': False, 'bull_use_adx': True, 'bull_use_spike': True, 'bull_rsi_required': True, 'bear_strategy': 'breakout', 'bear_bb_std_mult': 0.8281118702162162, 'bear_rsi_os': 55, 'bear_rsi_ob': 88, 'bear_adx_thresh': 25.526264071061526, 'bear_atr_min_pct': 0.010180395079769314, 'bear_atr_max_pct': 0.12239888191295731, 'bear_tp_mult': 2.969791187888515, 'bear_tsl_mult': 0.6558335161756805, 'bear_time_stop': 115, 'bear_use_sma': False, 'bear_use_ema': True, 'bear_use_atr': False, 'bear_use_adx': False, 'bear_use_spike': True, 'bear_rsi_required': False, 'sideways_strategy': 'mean_reversion', 'sideways_bb_std_mult': 0.5325345635406136, 'sideways_rsi_os': 31, 'sideways_rsi_ob': 60, 'sideways_adx_thresh': 11.335873188865225, 'sideways_atr_min_pct': 0.002736910780667224, 'sideways_atr_max_pct': 0.1423082474837128, 'sideways_tp_mult': 1.9364094252630333, 'sideways_tsl_mult': 0.6504097196459966, 'sideways_time_stop': 277, 'sideways_use_sma': False, 'sideways_use_ema': False, 'sideways_use_atr': False, 'sideways_use_adx': False, 'sideways_use_spike': False, 'sideways_rsi_required': True}.
[I 2025-09-01 11:01:32,923] Trial 121 finished with values: [-1000000000.0, 1000000000.0] and parameters: {'p_sma': 43, 'p_std': 19, 'p_atr': 7, 'p_adx': 11, 'rsi_period': 81, 'ema1': 21, 'ema2': 42, 'slip_atr_k': 0.117291811701972, 'slip_spread_k': 0.2805321830207633, 'spread_hl_frac': 0.032724749159872335, 'bb_std_mult': 0.7661755588206014, 'rsi_os': 39, 'rsi_ob': 57, 'vol_spike': 0.05258574847153337, 'adx_thresh': 25.955607101978444, 'atr_min_pct': 0.021744216919098815, 'atr_max_pct': 0.07636122536878284, 'tp_mult': 1.2966064873363818, 'tsl_mult': 0.25077170237483215, 'strategy': 'mean_reversion', 'time_stop': 172, 'use_sma': True, 'use_atr': False, 'use_adx': True, 'use_ema': True, 'use_spike': False, 'rsi_required': True, 'edge_k': 1.803450402388329, 'edge_cap': 0.7383928069861713, 'bull_strategy': 'breakout', 'bull_bb_std_mult': 1.7080819249180297, 'bull_rsi_os': 48, 'bull_rsi_ob': 84, 'bull_adx_thresh': 25.201049236337106, 'bull_atr_min_pct': 0.014505038505897341, 'bull_atr_max_pct': 0.11380261969289593, 'bull_tp_mult': 2.1099424187280547, 'bull_tsl_mult': 0.9550057190884301, 'bull_time_stop': 63, 'bull_use_sma': True, 'bull_use_ema': False, 'bull_use_atr': True, 'bull_use_adx': True, 'bull_use_spike': True, 'bull_rsi_required': False, 'bear_strategy': 'breakout', 'bear_bb_std_mult': 2.8049608551745804, 'bear_rsi_os': 27, 'bear_rsi_ob': 72, 'bear_adx_thresh': 13.364871137767022, 'bear_atr_min_pct': 0.009620870676468003, 'bear_atr_max_pct': 0.12304190469594406, 'bear_tp_mult': 2.9857249331972775, 'bear_tsl_mult': 0.33384734591812215, 'bear_time_stop': 116, 'bear_use_sma': False, 'bear_use_ema': True, 'bear_use_atr': False, 'bear_use_adx': False, 'bear_use_spike': True, 'bear_rsi_required': False, 'sideways_strategy': 'mean_reversion', 'sideways_bb_std_mult': 3.4511619122405532, 'sideways_rsi_os': 27, 'sideways_rsi_ob': 72, 'sideways_adx_thresh': 15.037685609021604, 'sideways_atr_min_pct': 0.0029907859070249457, 'sideways_atr_max_pct': 0.1417991782683061, 'sideways_tp_mult': 2.600303790897226, 'sideways_tsl_mult': 0.6361991195624441, 'sideways_time_stop': 158, 'sideways_use_sma': False, 'sideways_use_ema': True, 'sideways_use_atr': False, 'sideways_use_adx': False, 'sideways_use_spike': False, 'sideways_rsi_required': True}.
[I 2025-09-01 11:01:33,571] Trial 120 finished with values: [-0.010279803638977514, 0.010366895159656542] and parameters: {'p_sma': 9, 'p_std': 24, 'p_atr': 20, 'p_adx': 18, 'rsi_period': 46, 'ema1': 21, 'ema2': 47, 'slip_atr_k': 0.053888447309148116, 'slip_spread_k': 0.24130305159213328, 'spread_hl_frac': 0.049223078282167675, 'bb_std_mult': 0.9121462546126953, 'rsi_os': 39, 'rsi_ob': 57, 'vol_spike': 0.1159727606505708, 'adx_thresh': 9.638831672076257, 'atr_min_pct': 0.02170689576316489, 'atr_max_pct': 0.07558837664710312, 'tp_mult': 2.711141713302621, 'tsl_mult': 0.5985609391198379, 'strategy': 'mean_reversion', 'time_stop': 89, 'use_sma': True, 'use_atr': False, 'use_adx': True, 'use_ema': True, 'use_spike': False, 'rsi_required': True, 'edge_k': 1.3122156716420423, 'edge_cap': 0.6682622601070111, 'bull_strategy': 'breakout', 'bull_bb_std_mult': 1.7258769774010754, 'bull_rsi_os': 53, 'bull_rsi_ob': 84, 'bull_adx_thresh': 9.883672975253106, 'bull_atr_min_pct': 0.001876122445900671, 'bull_atr_max_pct': 0.11302442078341593, 'bull_tp_mult': 2.101097481524413, 'bull_tsl_mult': 0.9559162722489393, 'bull_time_stop': 31, 'bull_use_sma': True, 'bull_use_ema': False, 'bull_use_atr': True, 'bull_use_adx': True, 'bull_use_spike': True, 'bull_rsi_required': False, 'bear_strategy': 'breakout', 'bear_bb_std_mult': 2.8007230610877656, 'bear_rsi_os': 42, 'bear_rsi_ob': 88, 'bear_adx_thresh': 17.26082940951377, 'bear_atr_min_pct': 0.009867642758248547, 'bear_atr_max_pct': 0.12587732259163006, 'bear_tp_mult': 2.9785770693466644, 'bear_tsl_mult': 0.3283551310476619, 'bear_time_stop': 250, 'bear_use_sma': False, 'bear_use_ema': True, 'bear_use_atr': False, 'bear_use_adx': False, 'bear_use_spike': True, 'bear_rsi_required': False, 'sideways_strategy': 'mean_reversion', 'sideways_bb_std_mult': 3.147901975120666, 'sideways_rsi_os': 27, 'sideways_rsi_ob': 56, 'sideways_adx_thresh': 24.49214684480692, 'sideways_atr_min_pct': 0.02987144234301527, 'sideways_atr_max_pct': 0.08999473797348113, 'sideways_tp_mult': 1.9385462271522282, 'sideways_tsl_mult': 0.8193107286584767, 'sideways_time_stop': 190, 'sideways_use_sma': False, 'sideways_use_ema': True, 'sideways_use_atr': False, 'sideways_use_adx': False, 'sideways_use_spike': False, 'sideways_rsi_required': True}.
[I 2025-09-01 11:01:33,807] Trial 122 finished with values: [-1000000000.0, 1000000000.0] and parameters: {'p_sma': 42, 'p_std': 30, 'p_atr': 10, 'p_adx': 16, 'rsi_period': 22, 'ema1': 18, 'ema2': 47, 'slip_atr_k': 0.11700878007875251, 'slip_spread_k': 0.23864955010919514, 'spread_hl_frac': 0.04682880518393112, 'bb_std_mult': 0.776740704129768, 'rsi_os': 30, 'rsi_ob': 77, 'vol_spike': 0.28819995264518006, 'adx_thresh': 26.178852393718266, 'atr_min_pct': 0.015817488469059025, 'atr_max_pct': 0.09873983826570648, 'tp_mult': 1.1932627348448368, 'tsl_mult': 0.5434299534693263, 'strategy': 'mean_reversion', 'time_stop': 16, 'use_sma': True, 'use_atr': False, 'use_adx': True, 'use_ema': True, 'use_spike': False, 'rsi_required': True, 'edge_k': 1.806273529359527, 'edge_cap': 0.39777647533477417, 'bull_strategy': 'breakout', 'bull_bb_std_mult': 1.709255710026826, 'bull_rsi_os': 49, 'bull_rsi_ob': 83, 'bull_adx_thresh': 27.06793825334094, 'bull_atr_min_pct': 0.01476565973066611, 'bull_atr_max_pct': 0.1129104635895421, 'bull_tp_mult': 2.9246899693383654, 'bull_tsl_mult': 0.11344192837195227, 'bull_time_stop': 33, 'bull_use_sma': True, 'bull_use_ema': False, 'bull_use_atr': True, 'bull_use_adx': True, 'bull_use_spike': True, 'bull_rsi_required': False, 'bear_strategy': 'breakout', 'bear_bb_std_mult': 2.794605967297814, 'bear_rsi_os': 27, 'bear_rsi_ob': 72, 'bear_adx_thresh': 20.183140869481775, 'bear_atr_min_pct': 0.017301559830485307, 'bear_atr_max_pct': 0.12307247298336862, 'bear_tp_mult': 2.932072033174595, 'bear_tsl_mult': 0.6652306883457065, 'bear_time_stop': 257, 'bear_use_sma': False, 'bear_use_ema': True, 'bear_use_atr': False, 'bear_use_adx': False, 'bear_use_spike': True, 'bear_rsi_required': False, 'sideways_strategy': 'mean_reversion', 'sideways_bb_std_mult': 3.134036213129926, 'sideways_rsi_os': 27, 'sideways_rsi_ob': 72, 'sideways_adx_thresh': 24.40737251528415, 'sideways_atr_min_pct': 0.01946487484192405, 'sideways_atr_max_pct': 0.08992481959664592, 'sideways_tp_mult': 2.4761672213049204, 'sideways_tsl_mult': 0.809421993906813, 'sideways_time_stop': 214, 'sideways_use_sma': False, 'sideways_use_ema': True, 'sideways_use_atr': False, 'sideways_use_adx': False, 'sideways_use_spike': False, 'sideways_rsi_required': True}.
[I 2025-09-01 11:02:14,888] Trial 125 finished with values: [-1000000000.0, 1000000000.0] and parameters: {'p_sma': 11, 'p_std': 48, 'p_atr': 8, 'p_adx': 27, 'rsi_period': 36, 'ema1': 18, 'ema2': 50, 'slip_atr_k': 0.006063686837300981, 'slip_spread_k': 0.24340880902635736, 'spread_hl_frac': 0.0016215095526552698, 'bb_std_mult': 0.905128051666724, 'rsi_os': 43, 'rsi_ob': 63, 'vol_spike': 0.014810969028747512, 'adx_thresh': 15.69873756267478, 'atr_min_pct': 0.015788110631622342, 'atr_max_pct': 0.09855180589107633, 'tp_mult': 2.7394105327557936, 'tsl_mult': 0.5498808306637203, 'strategy': 'mean_reversion', 'time_stop': 210, 'use_sma': True, 'use_atr': False, 'use_adx': True, 'use_ema': True, 'use_spike': False, 'rsi_required': True, 'edge_k': 1.3022655217476877, 'edge_cap': 0.09592714420920301, 'bull_strategy': 'breakout', 'bull_bb_std_mult': 3.1476005121370285, 'bull_rsi_os': 52, 'bull_rsi_ob': 49, 'bull_adx_thresh': 27.377921992533718, 'bull_atr_min_pct': 0.0017020855556048042, 'bull_atr_max_pct': 0.09182800972113286, 'bull_tp_mult': 1.506095714941731, 'bull_tsl_mult': 0.12116107659950759, 'bull_time_stop': 33, 'bull_use_sma': False, 'bull_use_ema': False, 'bull_use_atr': False, 'bull_use_adx': True, 'bull_use_spike': True, 'bull_rsi_required': True, 'bear_strategy': 'breakout', 'bear_bb_std_mult': 1.4377556335937545, 'bear_rsi_os': 40, 'bear_rsi_ob': 88, 'bear_adx_thresh': 30.221059528691708, 'bear_atr_min_pct': 0.02207199692668606, 'bear_atr_max_pct': 0.09661471069569263, 'bear_tp_mult': 2.753949521535141, 'bear_tsl_mult': 0.0733701601382093, 'bear_time_stop': 127, 'bear_use_sma': False, 'bear_use_ema': True, 'bear_use_atr': False, 'bear_use_adx': False, 'bear_use_spike': True, 'bear_rsi_required': False, 'sideways_strategy': 'breakout', 'sideways_bb_std_mult': 3.4130644612196877, 'sideways_rsi_os': 24, 'sideways_rsi_ob': 60, 'sideways_adx_thresh': 10.063641207465674, 'sideways_atr_min_pct': 0.01971576973768755, 'sideways_atr_max_pct': 0.13059516123859743, 'sideways_tp_mult': 2.1957258408475875, 'sideways_tsl_mult': 0.00015952429380584193, 'sideways_time_stop': 185, 'sideways_use_sma': False, 'sideways_use_ema': False, 'sideways_use_atr': False, 'sideways_use_adx': False, 'sideways_use_spike': False, 'sideways_rsi_required': True}.
[I 2025-09-01 11:02:15,354] Trial 127 finished with values: [-0.019062333207340965, 0.019218211142149843] and parameters: {'p_sma': 51, 'p_std': 24, 'p_atr': 29, 'p_adx': 18, 'rsi_period': 50, 'ema1': 18, 'ema2': 43, 'slip_atr_k': 0.005152639363082866, 'slip_spread_k': 0.47969109214953964, 'spread_hl_frac': 0.011669296958668769, 'bb_std_mult': 0.6845471030960878, 'rsi_os': 32, 'rsi_ob': 64, 'vol_spike': 0.114705530047581, 'adx_thresh': 19.06328327196853, 'atr_min_pct': 0.012856931174694618, 'atr_max_pct': 0.06270528702774053, 'tp_mult': 2.2312828107394074, 'tsl_mult': 0.6655794142981901, 'strategy': 'mean_reversion', 'time_stop': 223, 'use_sma': True, 'use_atr': True, 'use_adx': True, 'use_ema': True, 'use_spike': False, 'rsi_required': True, 'edge_k': 0.9130784095373267, 'edge_cap': 0.48318248824037624, 'bull_strategy': 'breakout', 'bull_bb_std_mult': 3.2017806019163912, 'bull_rsi_os': 22, 'bull_rsi_ob': 82, 'bull_adx_thresh': 27.729979137684722, 'bull_atr_min_pct': 0.0020659612871888403, 'bull_atr_max_pct': 0.10083444619892024, 'bull_tp_mult': 1.4931077371794472, 'bull_tsl_mult': 0.9141408294424992, 'bull_time_stop': 19, 'bull_use_sma': False, 'bull_use_ema': False, 'bull_use_atr': False, 'bull_use_adx': False, 'bull_use_spike': True, 'bull_rsi_required': True, 'bear_strategy': 'breakout', 'bear_bb_std_mult': 1.4377076871772343, 'bear_rsi_os': 40, 'bear_rsi_ob': 88, 'bear_adx_thresh': 25.548157620214706, 'bear_atr_min_pct': 0.007816977349446627, 'bear_atr_max_pct': 0.12751332506215476, 'bear_tp_mult': 2.771385089073659, 'bear_tsl_mult': 0.08156793786125867, 'bear_time_stop': 125, 'bear_use_sma': False, 'bear_use_ema': False, 'bear_use_atr': True, 'bear_use_adx': False, 'bear_use_spike': True, 'bear_rsi_required': False, 'sideways_strategy': 'breakout', 'sideways_bb_std_mult': 3.418160568009839, 'sideways_rsi_os': 24, 'sideways_rsi_ob': 60, 'sideways_adx_thresh': 20.273400009934935, 'sideways_atr_min_pct': 0.01957824625858584, 'sideways_atr_max_pct': 0.0999442349288422, 'sideways_tp_mult': 1.930762739349579, 'sideways_tsl_mult': 0.00017888780273875998, 'sideways_time_stop': 232, 'sideways_use_sma': False, 'sideways_use_ema': False, 'sideways_use_atr': False, 'sideways_use_adx': True, 'sideways_use_spike': False, 'sideways_rsi_required': False}.
