[I 2025-09-01 12:01:03,635] Trial 493 finished with values: [-1000000000.0, 1000000000.0] and parameters: {'p_sma': 25, 'p_std': 13, 'p_atr': 18, 'p_adx': 7, 'rsi_period': 47, 'ema1': 25, 'ema2': 43, 'slip_atr_k': 0.02287640712996455, 'slip_spread_k': 0.32578318487394536, 'spread_hl_frac': 0.011624627997916762, 'bb_std_mult': 2.1617173833353815, 'rsi_os': 33, 'rsi_ob': 45, 'vol_spike': 0.2225440863144157, 'adx_thresh': 23.735592104166578, 'atr_min_pct': 0.02339488963275618, 'atr_max_pct': 0.07852691630303092, 'tp_mult': 1.9625716452420847, 'tsl_mult': 0.09416581198178219, 'strategy': 'breakout', 'time_stop': 159, 'use_sma': False, 'use_atr': True, 'use_adx': True, 'use_ema': True, 'use_spike': False, 'rsi_required': False, 'edge_k': 0.1750979477169784, 'edge_cap': 0.1269483494353583, 'bull_strategy': 'mean_reversion', 'bull_bb_std_mult': 1.03988409055997, 'bull_rsi_os': 29, 'bull_rsi_ob': 47, 'bull_adx_thresh': 7.279070930877051, 'bull_atr_min_pct': 0.016700431343135202, 'bull_atr_max_pct': 0.11098387553033565, 'bull_tp_mult': 1.3891557615448575, 'bull_tsl_mult': 0.582603033227099, 'bull_time_stop': 142, 'bull_use_sma': False, 'bull_use_ema': False, 'bull_use_atr': False, 'bull_use_adx': False, 'bull_use_spike': False, 'bull_rsi_required': True, 'bear_strategy': 'breakout', 'bear_bb_std_mult': 1.3283826094551583, 'bear_rsi_os': 27, 'bear_rsi_ob': 52, 'bear_adx_thresh': 6.516845770104461, 'bear_atr_min_pct': 0.02996897082760562, 'bear_atr_max_pct': 0.050491344058620595, 'bear_tp_mult': 1.4824935432644328, 'bear_tsl_mult': 0.7097773006716357, 'bear_time_stop': 270, 'bear_use_sma': True, 'bear_use_ema': False, 'bear_use_atr': True, 'bear_use_adx': True, 'bear_use_spike': False, 'bear_rsi_required': True, 'sideways_strategy': 'breakout', 'sideways_bb_std_mult': 2.1536725219963206, 'sideways_rsi_os': 39, 'sideways_rsi_ob': 89, 'sideways_adx_thresh': 34.40277387323924, 'sideways_atr_min_pct': 0.010385621706277465, 'sideways_atr_max_pct': 0.12776409481496456, 'sideways_tp_mult': 2.6062187921975823, 'sideways_tsl_mult': 0.38026713007900576, 'sideways_time_stop': 89, 'sideways_use_sma': False, 'sideways_use_ema': False, 'sideways_use_atr': True, 'sideways_use_adx': True, 'sideways_use_spike': True, 'sideways_rsi_required': False}.
[I 2025-09-01 12:01:44,639] Trial 499 finished with values: [0.0024790296346415275, 0.006909859231449595] and parameters: {'p_sma': 26, 'p_std': 46, 'p_atr': 28, 'p_adx': 8, 'rsi_period': 44, 'ema1': 25, 'ema2': 22, 'slip_atr_k': 0.02863866002436601, 'slip_spread_k': 0.9996566139687917, 'spread_hl_frac': 0.0034578097187548226, 'bb_std_mult': 0.957987775495193, 'rsi_os': 34, 'rsi_ob': 49, 'vol_spike': 0.19085571392242323, 'adx_thresh': 22.711239577809934, 'atr_min_pct': 0.02234580898138106, 'atr_max_pct': 0.0827855750082098, 'tp_mult': 1.2833851167700225, 'tsl_mult': 0.11503846560922454, 'strategy': 'breakout', 'time_stop': 178, 'use_sma': False, 'use_atr': True, 'use_adx': True, 'use_ema': True, 'use_spike': False, 'rsi_required': False, 'edge_k': 0.13551498918857757, 'edge_cap': 0.16116886759663673, 'bull_strategy': 'mean_reversion', 'bull_bb_std_mult': 1.966759804408903, 'bull_rsi_os': 34, 'bull_rsi_ob': 51, 'bull_adx_thresh': 6.089826415818408, 'bull_atr_min_pct': 0.014505320559792765, 'bull_atr_max_pct': 0.11411762714660181, 'bull_tp_mult': 1.2046188408267136, 'bull_tsl_mult': 0.5140986566206422, 'bull_time_stop': 153, 'bull_use_sma': False, 'bull_use_ema': False, 'bull_use_atr': True, 'bull_use_adx': False, 'bull_use_spike': False, 'bull_rsi_required': False, 'bear_strategy': 'breakout', 'bear_bb_std_mult': 1.4308368599997618, 'bear_rsi_os': 28, 'bear_rsi_ob': 51, 'bear_adx_thresh': 8.24834522863599, 'bear_atr_min_pct': 0.0038278543620869233, 'bear_atr_max_pct': 0.07421725689970168, 'bear_tp_mult': 2.2427300554685363, 'bear_tsl_mult': 0.6870784688553188, 'bear_time_stop': 282, 'bear_use_sma': True, 'bear_use_ema': False, 'bear_use_atr': True, 'bear_use_adx': True, 'bear_use_spike': False, 'bear_rsi_required': True, 'sideways_strategy': 'breakout', 'sideways_bb_std_mult': 2.5500660182258086, 'sideways_rsi_os': 44, 'sideways_rsi_ob': 87, 'sideways_adx_thresh': 32.16149185253393, 'sideways_atr_min_pct': 0.0018024621054318745, 'sideways_atr_max_pct': 0.13158094178249086, 'sideways_tp_mult': 2.8276755781969514, 'sideways_tsl_mult': 0.35169743461806147, 'sideways_time_stop': 101, 'sideways_use_sma': False, 'sideways_use_ema': False, 'sideways_use_atr': True, 'sideways_use_adx': True, 'sideways_use_spike': True, 'sideways_rsi_required': False}.
[I 2025-09-01 12:01:45,420] Trial 498 finished with values: [-1000000000.0, 1000000000.0] and parameters: {'p_sma': 26, 'p_std': 33, 'p_atr': 20, 'p_adx': 7, 'rsi_period': 43, 'ema1': 25, 'ema2': 30, 'slip_atr_k': 0.029378415944703487, 'slip_spread_k': 0.32281164029877507, 'spread_hl_frac': 0.004466803315404666, 'bb_std_mult': 0.9672245743339454, 'rsi_os': 34, 'rsi_ob': 45, 'vol_spike': 0.21467029174798255, 'adx_thresh': 9.270884179610528, 'atr_min_pct': 0.022431951787340212, 'atr_max_pct': 0.08186033811823024, 'tp_mult': 2.898612311111758, 'tsl_mult': 0.13885252507235707, 'strategy': 'breakout', 'time_stop': 180, 'use_sma': False, 'use_atr': True, 'use_adx': True, 'use_ema': True, 'use_spike': False, 'rsi_required': False, 'edge_k': 0.12721774897195842, 'edge_cap': 0.15936571716191014, 'bull_strategy': 'mean_reversion', 'bull_bb_std_mult': 1.7887282435470908, 'bull_rsi_os': 34, 'bull_rsi_ob': 51, 'bull_adx_thresh': 6.217471885222199, 'bull_atr_min_pct': 0.016163525358309734, 'bull_atr_max_pct': 0.11331389149377555, 'bull_tp_mult': 2.187413019574319, 'bull_tsl_mult': 0.499954392572974, 'bull_time_stop': 153, 'bull_use_sma': False, 'bull_use_ema': False, 'bull_use_atr': True, 'bull_use_adx': False, 'bull_use_spike': False, 'bull_rsi_required': False, 'bear_strategy': 'breakout', 'bear_bb_std_mult': 2.601586175711093, 'bear_rsi_os': 29, 'bear_rsi_ob': 52, 'bear_adx_thresh': 6.413329110561376, 'bear_atr_min_pct': 0.016364816576328385, 'bear_atr_max_pct': 0.06329335288908518, 'bear_tp_mult': 1.4648548242757584, 'bear_tsl_mult': 0.7461265938700805, 'bear_time_stop': 280, 'bear_use_sma': True, 'bear_use_ema': False, 'bear_use_atr': True, 'bear_use_adx': True, 'bear_use_spike': False, 'bear_rsi_required': True, 'sideways_strategy': 'breakout', 'sideways_bb_std_mult': 2.2503701631697877, 'sideways_rsi_os': 33, 'sideways_rsi_ob': 87, 'sideways_adx_thresh': 32.22477261786366, 'sideways_atr_min_pct': 0.0075875261970926745, 'sideways_atr_max_pct': 0.13062474868015814, 'sideways_tp_mult': 2.8167146185998657, 'sideways_tsl_mult': 0.3480097830051193, 'sideways_time_stop': 100, 'sideways_use_sma': False, 'sideways_use_ema': False, 'sideways_use_atr': True, 'sideways_use_adx': True, 'sideways_use_spike': True, 'sideways_rsi_required': False}.
[I 2025-09-01 12:01:45,780] Trial 497 finished with values: [-0.0055732529308064604, 0.0081131326625859] and parameters: {'p_sma': 26, 'p_std': 30, 'p_atr': 16, 'p_adx': 14, 'rsi_period': 29, 'ema1': 25, 'ema2': 30, 'slip_atr_k': 0.05467123844080847, 'slip_spread_k': 0.34367343971675574, 'spread_hl_frac': 0.016454563337386267, 'bb_std_mult': 0.9764029112025816, 'rsi_os': 32, 'rsi_ob': 45, 'vol_spike': 0.21435804910783496, 'adx_thresh': 28.59276387783978, 'atr_min_pct': 0.02239011631613253, 'atr_max_pct': 0.0816956693659384, 'tp_mult': 1.0559752930608297, 'tsl_mult': 0.0914154318808893, 'strategy': 'breakout', 'time_stop': 160, 'use_sma': False, 'use_atr': True, 'use_adx': True, 'use_ema': True, 'use_spike': False, 'rsi_required': False, 'edge_k': 0.12287315674745375, 'edge_cap': 0.12777214357640973, 'bull_strategy': 'mean_reversion', 'bull_bb_std_mult': 1.8147746150030803, 'bull_rsi_os': 50, 'bull_rsi_ob': 45, 'bull_adx_thresh': 6.0196441692195615, 'bull_atr_min_pct': 0.01659216922465357, 'bull_atr_max_pct': 0.11311699519369406, 'bull_tp_mult': 1.394435897790483, 'bull_tsl_mult': 0.5619957528960362, 'bull_time_stop': 154, 'bull_use_sma': False, 'bull_use_ema': False, 'bull_use_atr': True, 'bull_use_adx': False, 'bull_use_spike': False, 'bull_rsi_required': False, 'bear_strategy': 'breakout', 'bear_bb_std_mult': 1.4476157550698363, 'bear_rsi_os': 28, 'bear_rsi_ob': 52, 'bear_adx_thresh': 34.7557490052542, 'bear_atr_min_pct': 0.003921892159449433, 'bear_atr_max_pct': 0.02519335259505996, 'bear_tp_mult': 1.9431506074852332, 'bear_tsl_mult': 0.705356259229643, 'bear_time_stop': 280, 'bear_use_sma': True, 'bear_use_ema': False, 'bear_use_atr': True, 'bear_use_adx': True, 'bear_use_spike': False, 'bear_rsi_required': True, 'sideways_strategy': 'breakout', 'sideways_bb_std_mult': 2.2435434955237272, 'sideways_rsi_os': 39, 'sideways_rsi_ob': 88, 'sideways_adx_thresh': 32.27240129620776, 'sideways_atr_min_pct': 0.010431668311525373, 'sideways_atr_max_pct': 0.13218332778741967, 'sideways_tp_mult': 2.8249076962992232, 'sideways_tsl_mult': 0.39912281152070206, 'sideways_time_stop': 284, 'sideways_use_sma': False, 'sideways_use_ema': False, 'sideways_use_atr': True, 'sideways_use_adx': True, 'sideways_use_spike': True, 'sideways_rsi_required': False}.
[I 2025-09-01 12:01:46,050] Trial 496 finished with values: [0.0038330439978917497, 0.0072491720262859525] and parameters: {'p_sma': 26, 'p_std': 30, 'p_atr': 20, 'p_adx': 14, 'rsi_period': 20, 'ema1': 25, 'ema2': 27, 'slip_atr_k': 0.025016596218786373, 'slip_spread_k': 0.8836638107337182, 'spread_hl_frac': 0.0030955654667714537, 'bb_std_mult': 0.8158208953746922, 'rsi_os': 34, 'rsi_ob': 49, 'vol_spike': 0.22221228265091056, 'adx_thresh': 14.989088273674659, 'atr_min_pct': 0.02234302292274804, 'atr_max_pct': 0.08300029369961598, 'tp_mult': 2.1154325606599804, 'tsl_mult': 0.09280912810270228, 'strategy': 'breakout', 'time_stop': 178, 'use_sma': False, 'use_atr': True, 'use_adx': True, 'use_ema': True, 'use_spike': False, 'rsi_required': False, 'edge_k': 0.1751417231611758, 'edge_cap': 0.1326813492983532, 'bull_strategy': 'mean_reversion', 'bull_bb_std_mult': 1.7806892130283158, 'bull_rsi_os': 34, 'bull_rsi_ob': 54, 'bull_adx_thresh': 7.490649339599602, 'bull_atr_min_pct': 0.014526064622801049, 'bull_atr_max_pct': 0.10914166289257737, 'bull_tp_mult': 1.3801333795223798, 'bull_tsl_mult': 0.5756967923899755, 'bull_time_stop': 154, 'bull_use_sma': False, 'bull_use_ema': False, 'bull_use_atr': True, 'bull_use_adx': False, 'bull_use_spike': False, 'bull_rsi_required': True, 'bear_strategy': 'breakout', 'bear_bb_std_mult': 1.4162876525885084, 'bear_rsi_os': 27, 'bear_rsi_ob': 52, 'bear_adx_thresh': 5.512827742541569, 'bear_atr_min_pct': 0.0040709956101985375, 'bear_atr_max_pct': 0.0736013468233455, 'bear_tp_mult': 1.488724787575179, 'bear_tsl_mult': 0.7676256955918609, 'bear_time_stop': 288, 'bear_use_sma': True, 'bear_use_ema': False, 'bear_use_atr': True, 'bear_use_adx': True, 'bear_use_spike': False, 'bear_rsi_required': True, 'sideways_strategy': 'breakout', 'sideways_bb_std_mult': 2.1365836596364076, 'sideways_rsi_os': 32, 'sideways_rsi_ob': 72, 'sideways_adx_thresh': 32.3353827136527, 'sideways_atr_min_pct': 0.010483800938637789, 'sideways_atr_max_pct': 0.13067571167691375, 'sideways_tp_mult': 2.822653708600112, 'sideways_tsl_mult': 0.3106393000875072, 'sideways_time_stop': 101, 'sideways_use_sma': False, 'sideways_use_ema': False, 'sideways_use_atr': True, 'sideways_use_adx': True, 'sideways_use_spike': True, 'sideways_rsi_required': False}.
[I 2025-09-01 12:02:27,125] Trial 500 finished with values: [-0.06422873343698343, 0.06415812097576168] and parameters: {'p_sma': 26, 'p_std': 30, 'p_atr': 12, 'p_adx': 8, 'rsi_period': 15, 'ema1': 25, 'ema2': 13, 'slip_atr_k': 0.23477071341417216, 'slip_spread_k': 0.37256894094763615, 'spread_hl_frac': 0.004497844110106142, 'bb_std_mult': 0.7384452203606873, 'rsi_os': 34, 'rsi_ob': 47, 'vol_spike': 0.194146300595421, 'adx_thresh': 15.12186178684665, 'atr_min_pct': 0.02133105234669837, 'atr_max_pct': 0.13813805349052513, 'tp_mult': 2.118887483702935, 'tsl_mult': 0.13943444537151833, 'strategy': 'breakout', 'time_stop': 179, 'use_sma': False, 'use_atr': True, 'use_adx': True, 'use_ema': False, 'use_spike': False, 'rsi_required': False, 'edge_k': 0.11810380100963126, 'edge_cap': 0.1549099583329572, 'bull_strategy': 'mean_reversion', 'bull_bb_std_mult': 1.806593060907135, 'bull_rsi_os': 20, 'bull_rsi_ob': 45, 'bull_adx_thresh': 25.577507465904223, 'bull_atr_min_pct': 0.014877046548376387, 'bull_atr_max_pct': 0.1137267266573894, 'bull_tp_mult': 1.3291323461149704, 'bull_tsl_mult': 0.5564777361788725, 'bull_time_stop': 153, 'bull_use_sma': False, 'bull_use_ema': False, 'bull_use_atr': True, 'bull_use_adx': False, 'bull_use_spike': False, 'bull_rsi_required': False, 'bear_strategy': 'breakout', 'bear_bb_std_mult': 1.448243064941479, 'bear_rsi_os': 25, 'bear_rsi_ob': 68, 'bear_adx_thresh': 10.069113015772807, 'bear_atr_min_pct': 0.002685086610502036, 'bear_atr_max_pct': 0.025768675539553233, 'bear_tp_mult': 1.9668768076373842, 'bear_tsl_mult': 0.7519017709985043, 'bear_time_stop': 285, 'bear_use_sma': True, 'bear_use_ema': False, 'bear_use_atr': True, 'bear_use_adx': True, 'bear_use_spike': False, 'bear_rsi_required': True, 'sideways_strategy': 'breakout', 'sideways_bb_std_mult': 2.5270459709875337, 'sideways_rsi_os': 12, 'sideways_rsi_ob': 77, 'sideways_adx_thresh': 33.881159733545665, 'sideways_atr_min_pct': 0.007698398604670673, 'sideways_atr_max_pct': 0.11908941227527388, 'sideways_tp_mult': 2.952092350403631, 'sideways_tsl_mult': 0.8590165045427447, 'sideways_time_stop': 283, 'sideways_use_sma': False, 'sideways_use_ema': False, 'sideways_use_atr': True, 'sideways_use_adx': True, 'sideways_use_spike': True, 'sideways_rsi_required': False}.
[I 2025-09-01 12:02:27,519] Trial 501 finished with values: [-1000000000.0, 1000000000.0] and parameters: {'p_sma': 30, 'p_std': 34, 'p_atr': 14, 'p_adx': 8, 'rsi_period': 16, 'ema1': 26, 'ema2': 60, 'slip_atr_k': 0.17621483125340953, 'slip_spread_k': 0.6931301364021829, 'spread_hl_frac': 0.005846024142395972, 'bb_std_mult': 0.7178950674926303, 'rsi_os': 32, 'rsi_ob': 47, 'vol_spike': 0.19420254153319047, 'adx_thresh': 28.473698592728518, 'atr_min_pct': 0.021225711612891628, 'atr_max_pct': 0.08622221302421622, 'tp_mult': 1.0700319621928895, 'tsl_mult': 0.1635259854830276, 'strategy': 'breakout', 'time_stop': 177, 'use_sma': False, 'use_atr': True, 'use_adx': True, 'use_ema': False, 'use_spike': False, 'rsi_required': False, 'edge_k': 0.11921370125071545, 'edge_cap': 0.134607431418229, 'bull_strategy': 'mean_reversion', 'bull_bb_std_mult': 1.976850208638813, 'bull_rsi_os': 50, 'bull_rsi_ob': 49, 'bull_adx_thresh': 25.590536352097285, 'bull_atr_min_pct': 0.01617718154074013, 'bull_atr_max_pct': 0.12306386730706109, 'bull_tp_mult': 1.4515640160777075, 'bull_tsl_mult': 0.5470934389810678, 'bull_time_stop': 182, 'bull_use_sma': False, 'bull_use_ema': False, 'bull_use_atr': True, 'bull_use_adx': False, 'bull_use_spike': False, 'bull_rsi_required': False, 'bear_strategy': 'breakout', 'bear_bb_std_mult': 1.409729926398806, 'bear_rsi_os': 25, 'bear_rsi_ob': 79, 'bear_adx_thresh': 10.271696134135814, 'bear_atr_min_pct': 0.014323710194283756, 'bear_atr_max_pct': 0.07494377759917817, 'bear_tp_mult': 1.9764134458442633, 'bear_tsl_mult': 0.6857123584565573, 'bear_time_stop': 282, 'bear_use_sma': True, 'bear_use_ema': False, 'bear_use_atr': True, 'bear_use_adx': True, 'bear_use_spike': False, 'bear_rsi_required': True, 'sideways_strategy': 'breakout', 'sideways_bb_std_mult': 2.5022489710992897, 'sideways_rsi_os': 41, 'sideways_rsi_ob': 72, 'sideways_adx_thresh': 34.991607070804896, 'sideways_atr_min_pct': 0.006512063058250579, 'sideways_atr_max_pct': 0.13138699666606996, 'sideways_tp_mult': 2.8849564112548007, 'sideways_tsl_mult': 0.17087419855984753, 'sideways_time_stop': 295, 'sideways_use_sma': False, 'sideways_use_ema': False, 'sideways_use_atr': True, 'sideways_use_adx': True, 'sideways_use_spike': True, 'sideways_rsi_required': False}.
[I 2025-09-01 12:02:28,682] Trial 503 finished with values: [-1000000000.0, 1000000000.0] and parameters: {'p_sma': 30, 'p_std': 59, 'p_atr': 29, 'p_adx': 8, 'rsi_period': 78, 'ema1': 26, 'ema2': 46, 'slip_atr_k': 0.027061191794991654, 'slip_spread_k': 0.9751364775897331, 'spread_hl_frac': 0.005788649314054092, 'bb_std_mult': 0.7307317066393116, 'rsi_os': 34, 'rsi_ob': 47, 'vol_spike': 0.1955773700851263, 'adx_thresh': 15.10811861429571, 'atr_min_pct': 0.023625466235231773, 'atr_max_pct': 0.13761416515910307, 'tp_mult': 2.0935369311012897, 'tsl_mult': 0.6581201613304726, 'strategy': 'breakout', 'time_stop': 178, 'use_sma': False, 'use_atr': True, 'use_adx': True, 'use_ema': False, 'use_spike': False, 'rsi_required': False, 'edge_k': 0.13761637925313416, 'edge_cap': 0.16325777370004887, 'bull_strategy': 'mean_reversion', 'bull_bb_std_mult': 1.2825600561763024, 'bull_rsi_os': 20, 'bull_rsi_ob': 49, 'bull_adx_thresh': 22.57834451485909, 'bull_atr_min_pct': 0.015988888280420513, 'bull_atr_max_pct': 0.11870714745796657, 'bull_tp_mult': 1.460999313713074, 'bull_tsl_mult': 0.04860164779692572, 'bull_time_stop': 180, 'bull_use_sma': False, 'bull_use_ema': False, 'bull_use_atr': True, 'bull_use_adx': False, 'bull_use_spike': False, 'bull_rsi_required': False, 'bear_strategy': 'breakout', 'bear_bb_std_mult': 3.1161070851028194, 'bear_rsi_os': 25, 'bear_rsi_ob': 79, 'bear_adx_thresh': 27.572876989552363, 'bear_atr_min_pct': 0.002323300379090715, 'bear_atr_max_pct': 0.09381830003260652, 'bear_tp_mult': 2.1604145111706647, 'bear_tsl_mult': 0.6817598078763892, 'bear_time_stop': 275, 'bear_use_sma': True, 'bear_use_ema': False, 'bear_use_atr': True, 'bear_use_adx': True, 'bear_use_spike': False, 'bear_rsi_required': True, 'sideways_strategy': 'breakout', 'sideways_bb_std_mult': 2.438736630283363, 'sideways_rsi_os': 41, 'sideways_rsi_ob': 86, 'sideways_adx_thresh': 34.94312891519477, 'sideways_atr_min_pct': 0.0019318839821423264, 'sideways_atr_max_pct': 0.11824667074105402, 'sideways_tp_mult': 2.9632393267207955, 'sideways_tsl_mult': 0.23985382274930728, 'sideways_time_stop': 20, 'sideways_use_sma': False, 'sideways_use_ema': False, 'sideways_use_atr': True, 'sideways_use_adx': True, 'sideways_use_spike': True, 'sideways_rsi_required': False}.
[I 2025-09-01 12:02:28,999] Trial 502 finished with values: [-1000000000.0, 1000000000.0] and parameters: {'p_sma': 29, 'p_std': 60, 'p_atr': 28, 'p_adx': 8, 'rsi_period': 81, 'ema1': 26, 'ema2': 14, 'slip_atr_k': 0.14566572710721754, 'slip_spread_k': 0.6853176551350595, 'spread_hl_frac': 0.006278671705038898, 'bb_std_mult': 0.8898415373997598, 'rsi_os': 34, 'rsi_ob': 47, 'vol_spike': 0.19342498089643465, 'adx_thresh': 22.55437876386039, 'atr_min_pct': 0.02132354708819301, 'atr_max_pct': 0.08536902363561338, 'tp_mult': 2.1124194012434807, 'tsl_mult': 0.16843569280378912, 'strategy': 'breakout', 'time_stop': 177, 'use_sma': False, 'use_atr': True, 'use_adx': True, 'use_ema': False, 'use_spike': False, 'rsi_required': False, 'edge_k': 0.07647155275865772, 'edge_cap': 0.1673160333497461, 'bull_strategy': 'mean_reversion', 'bull_bb_std_mult': 1.9379071361353175, 'bull_rsi_os': 50, 'bull_rsi_ob': 49, 'bull_adx_thresh': 10.219592799349229, 'bull_atr_min_pct': 0.014109692581988137, 'bull_atr_max_pct': 0.10904244531462223, 'bull_tp_mult': 1.3394152168426199, 'bull_tsl_mult': 0.053715904405376935, 'bull_time_stop': 179, 'bull_use_sma': False, 'bull_use_ema': False, 'bull_use_atr': True, 'bull_use_adx': False, 'bull_use_spike': False, 'bull_rsi_required': False, 'bear_strategy': 'breakout', 'bear_bb_std_mult': 1.4282566464702797, 'bear_rsi_os': 25, 'bear_rsi_ob': 54, 'bear_adx_thresh': 27.391249543176613, 'bear_atr_min_pct': 0.0031982186896422327, 'bear_atr_max_pct': 0.027731558211688757, 'bear_tp_mult': 2.1602232870596976, 'bear_tsl_mult': 0.6564960418458499, 'bear_time_stop': 283, 'bear_use_sma': True, 'bear_use_ema': False, 'bear_use_atr': True, 'bear_use_adx': True, 'bear_use_spike': False, 'bear_rsi_required': True, 'sideways_strategy': 'breakout', 'sideways_bb_std_mult': 2.650655345467981, 'sideways_rsi_os': 12, 'sideways_rsi_ob': 61, 'sideways_adx_thresh': 34.99331301254019, 'sideways_atr_min_pct': 0.01163843545913085, 'sideways_atr_max_pct': 0.11829025372582103, 'sideways_tp_mult': 2.957056687388608, 'sideways_tsl_mult': 0.6266539584152989, 'sideways_time_stop': 295, 'sideways_use_sma': False, 'sideways_use_ema': False, 'sideways_use_atr': True, 'sideways_use_adx': True, 'sideways_use_spike': True, 'sideways_rsi_required': False}.
