[I 2025-08-31 10:40:54,093] Trial 407 finished with values: [-1000000000.0, 1000000000.0] and parameters: {'p_sma': 20, 'p_std': 35, 'p_atr': 17, 'p_adx': 8, 'rsi_period': 19, 'ema1': 12, 'ema2': 57, 'slip_atr_k': 0.06726881348044361, 'slip_spread_k': 0.26469951926286134, 'spread_hl_frac': 0.02631746724227398, 'bb_std_mult': 1.5197316886091987, 'rsi_os': 42, 'rsi_ob': 89, 'vol_spike': 0.21359483750122937, 'adx_thresh': 8.303612056124528, 'atr_min_pct': 0.01898486997047508, 'atr_max_pct': 0.013937695545409162, 'tp_mult': 1.0628368498188507, 'tsl_mult': 0.9968140152243249, 'strategy': 'breakout', 'time_stop': 247, 'use_sma': True, 'use_atr': False, 'use_adx': True, 'use_ema': False, 'use_spike': True, 'rsi_required': False, 'edge_k': 1.6285230970477187, 'edge_cap': 0.20972599601042613, 'bull_strategy': 'breakout', 'bull_bb_std_mult': 2.5001165053820795, 'bull_rsi_os': 43, 'bull_rsi_ob': 79, 'bull_adx_thresh': 13.31398059274446, 'bull_atr_min_pct': 0.012288437472777398, 'bull_atr_max_pct': 0.07324573434884037, 'bull_tp_mult': 1.7376650948746246, 'bull_tsl_mult': 0.10141035618057508, 'bull_time_stop': 257, 'bull_use_sma': True, 'bull_use_ema': True, 'bull_use_atr': True, 'bull_use_adx': False, 'bull_use_spike': False, 'bull_rsi_required': False, 'bear_strategy': 'breakout', 'bear_bb_std_mult': 2.3140755794302783, 'bear_rsi_os': 10, 'bear_rsi_ob': 56, 'bear_adx_thresh': 8.164437683863841, 'bear_atr_min_pct': 0.016688855704202383, 'bear_atr_max_pct': 0.12152985030663759, 'bear_tp_mult': 2.6662231959013862, 'bear_tsl_mult': 0.14897109986755203, 'bear_time_stop': 45, 'bear_use_sma': False, 'bear_use_ema': False, 'bear_use_atr': True, 'bear_use_adx': True, 'bear_use_spike': False, 'bear_rsi_required': False, 'sideways_strategy': 'mean_reversion', 'sideways_bb_std_mult': 2.7104592303122117, 'sideways_rsi_os': 34, 'sideways_rsi_ob': 84, 'sideways_adx_thresh': 12.638090648900057, 'sideways_atr_min_pct': 0.003532221941386628, 'sideways_atr_max_pct': 0.029680162690094946, 'sideways_tp_mult': 1.2727547906732806, 'sideways_tsl_mult': 0.792796814166732, 'sideways_time_stop': 77, 'sideways_use_sma': False, 'sideways_use_ema': False, 'sideways_use_atr': True, 'sideways_use_adx': False, 'sideways_use_spike': False, 'sideways_rsi_required': True}.
[I 2025-08-31 10:41:23,116] Trial 406 finished with values: [-0.004877600348705657, 0.0054408847880305505] and parameters: {'p_sma': 20, 'p_std': 10, 'p_atr': 17, 'p_adx': 8, 'rsi_period': 19, 'ema1': 12, 'ema2': 58, 'slip_atr_k': 0.06698268690587142, 'slip_spread_k': 0.7046764503366536, 'spread_hl_frac': 0.029798954297320022, 'bb_std_mult': 3.5486119753589858, 'rsi_os': 42, 'rsi_ob': 93, 'vol_spike': 0.2139189557497621, 'adx_thresh': 7.962361432393406, 'atr_min_pct': 0.01598729237968744, 'atr_max_pct': 0.14558462054932786, 'tp_mult': 1.9821315280728942, 'tsl_mult': 0.6581370460190445, 'strategy': 'breakout', 'time_stop': 57, 'use_sma': True, 'use_atr': False, 'use_adx': True, 'use_ema': False, 'use_spike': True, 'rsi_required': True, 'edge_k': 0.1348229982914434, 'edge_cap': 0.30145138653773207, 'bull_strategy': 'breakout', 'bull_bb_std_mult': 1.1503352744537159, 'bull_rsi_os': 41, 'bull_rsi_ob': 76, 'bull_adx_thresh': 11.9272989647552, 'bull_atr_min_pct': 0.004368631712670049, 'bull_atr_max_pct': 0.014664554208681846, 'bull_tp_mult': 1.706920031059937, 'bull_tsl_mult': 0.6140521259110703, 'bull_time_stop': 5, 'bull_use_sma': True, 'bull_use_ema': True, 'bull_use_atr': True, 'bull_use_adx': True, 'bull_use_spike': False, 'bull_rsi_required': False, 'bear_strategy': 'breakout', 'bear_bb_std_mult': 1.3929470170087193, 'bear_rsi_os': 7, 'bear_rsi_ob': 59, 'bear_adx_thresh': 8.287792951934206, 'bear_atr_min_pct': 0.01702149431727353, 'bear_atr_max_pct': 0.12041675596558624, 'bear_tp_mult': 2.9444584489772043, 'bear_tsl_mult': 0.710361924762905, 'bear_time_stop': 45, 'bear_use_sma': False, 'bear_use_ema': False, 'bear_use_atr': True, 'bear_use_adx': False, 'bear_use_spike': False, 'bear_rsi_required': False, 'sideways_strategy': 'breakout', 'sideways_bb_std_mult': 2.5430505776118615, 'sideways_rsi_os': 36, 'sideways_rsi_ob': 84, 'sideways_adx_thresh': 25.251978066841417, 'sideways_atr_min_pct': 0.0033775527425641137, 'sideways_atr_max_pct': 0.12777149846202618, 'sideways_tp_mult': 1.6381661022725877, 'sideways_tsl_mult': 0.3654363702672361, 'sideways_time_stop': 258, 'sideways_use_sma': False, 'sideways_use_ema': False, 'sideways_use_atr': True, 'sideways_use_adx': False, 'sideways_use_spike': False, 'sideways_rsi_required': True}.
[I 2025-08-31 10:41:23,889] Trial 405 finished with values: [-1000000000.0, 1000000000.0] and parameters: {'p_sma': 42, 'p_std': 9, 'p_atr': 12, 'p_adx': 8, 'rsi_period': 19, 'ema1': 12, 'ema2': 57, 'slip_atr_k': 0.06674084690205963, 'slip_spread_k': 0.5402533974522893, 'spread_hl_frac': 0.02974184825720961, 'bb_std_mult': 2.725964678085115, 'rsi_os': 42, 'rsi_ob': 76, 'vol_spike': 0.21486423045976885, 'adx_thresh': 23.154579737018445, 'atr_min_pct': 0.015924408016945498, 'atr_max_pct': 0.04480034976620787, 'tp_mult': 2.6764082312793995, 'tsl_mult': 0.6608375210209716, 'strategy': 'breakout', 'time_stop': 56, 'use_sma': True, 'use_atr': False, 'use_adx': True, 'use_ema': False, 'use_spike': True, 'rsi_required': True, 'edge_k': 1.6275946686548453, 'edge_cap': 0.14584069732118424, 'bull_strategy': 'breakout', 'bull_bb_std_mult': 1.166818483211078, 'bull_rsi_os': 41, 'bull_rsi_ob': 84, 'bull_adx_thresh': 12.043888661192021, 'bull_atr_min_pct': 0.012436501868517795, 'bull_atr_max_pct': 0.07288888994411769, 'bull_tp_mult': 1.838174987943221, 'bull_tsl_mult': 0.10311117086241091, 'bull_time_stop': 5, 'bull_use_sma': True, 'bull_use_ema': True, 'bull_use_atr': True, 'bull_use_adx': True, 'bull_use_spike': False, 'bull_rsi_required': False, 'bear_strategy': 'breakout', 'bear_bb_std_mult': 1.8602688281459627, 'bear_rsi_os': 28, 'bear_rsi_ob': 56, 'bear_adx_thresh': 7.809829408923966, 'bear_atr_min_pct': 0.01709549029910221, 'bear_atr_max_pct': 0.12150090345801838, 'bear_tp_mult': 2.6649192637785197, 'bear_tsl_mult': 0.6439975294661431, 'bear_time_stop': 28, 'bear_use_sma': False, 'bear_use_ema': False, 'bear_use_atr': True, 'bear_use_adx': False, 'bear_use_spike': False, 'bear_rsi_required': False, 'sideways_strategy': 'breakout', 'sideways_bb_std_mult': 2.708203954406037, 'sideways_rsi_os': 36, 'sideways_rsi_ob': 84, 'sideways_adx_thresh': 15.99089301881852, 'sideways_atr_min_pct': 0.0030120881972564135, 'sideways_atr_max_pct': 0.01803347166688165, 'sideways_tp_mult': 1.669520111617305, 'sideways_tsl_mult': 0.7874311631408332, 'sideways_time_stop': 257, 'sideways_use_sma': True, 'sideways_use_ema': False, 'sideways_use_atr': True, 'sideways_use_adx': False, 'sideways_use_spike': False, 'sideways_rsi_required': True}.
[I 2025-08-31 10:41:24,302] Trial 408 finished with values: [-1000000000.0, 1000000000.0] and parameters: {'p_sma': 20, 'p_std': 25, 'p_atr': 12, 'p_adx': 7, 'rsi_period': 17, 'ema1': 12, 'ema2': 48, 'slip_atr_k': 0.07079372905203013, 'slip_spread_k': 0.43011222183040887, 'spread_hl_frac': 0.026134886553333545, 'bb_std_mult': 2.6088073709658928, 'rsi_os': 42, 'rsi_ob': 52, 'vol_spike': 0.1980319247381092, 'adx_thresh': 5.018761546320954, 'atr_min_pct': 0.019209170985039777, 'atr_max_pct': 0.02979168829080883, 'tp_mult': 2.2066421365232767, 'tsl_mult': 0.27725546708854976, 'strategy': 'breakout', 'time_stop': 47, 'use_sma': True, 'use_atr': False, 'use_adx': True, 'use_ema': False, 'use_spike': True, 'rsi_required': False, 'edge_k': 1.350689837281942, 'edge_cap': 0.1517046586999986, 'bull_strategy': 'breakout', 'bull_bb_std_mult': 1.156239541250091, 'bull_rsi_os': 43, 'bull_rsi_ob': 74, 'bull_adx_thresh': 11.890599668272216, 'bull_atr_min_pct': 0.004464071885151679, 'bull_atr_max_pct': 0.013353832205884528, 'bull_tp_mult': 1.2226301846586511, 'bull_tsl_mult': 0.5786493655383578, 'bull_time_stop': 256, 'bull_use_sma': True, 'bull_use_ema': True, 'bull_use_atr': True, 'bull_use_adx': False, 'bull_use_spike': False, 'bull_rsi_required': False, 'bear_strategy': 'breakout', 'bear_bb_std_mult': 2.059563862210592, 'bear_rsi_os': 28, 'bear_rsi_ob': 64, 'bear_adx_thresh': 8.235288582515697, 'bear_atr_min_pct': 0.01708191147989638, 'bear_atr_max_pct': 0.12232424682365033, 'bear_tp_mult': 2.62507370801856, 'bear_tsl_mult': 0.14781074316603887, 'bear_time_stop': 26, 'bear_use_sma': False, 'bear_use_ema': False, 'bear_use_atr': True, 'bear_use_adx': True, 'bear_use_spike': False, 'bear_rsi_required': False, 'sideways_strategy': 'mean_reversion', 'sideways_bb_std_mult': 2.70378290930508, 'sideways_rsi_os': 34, 'sideways_rsi_ob': 84, 'sideways_adx_thresh': 33.86490653969632, 'sideways_atr_min_pct': 0.0033355457257887695, 'sideways_atr_max_pct': 0.017958262649202167, 'sideways_tp_mult': 2.5892394366692906, 'sideways_tsl_mult': 0.36437710052692296, 'sideways_time_stop': 139, 'sideways_use_sma': False, 'sideways_use_ema': True, 'sideways_use_atr': True, 'sideways_use_adx': False, 'sideways_use_spike': False, 'sideways_rsi_required': True}.
[I 2025-08-31 10:41:25,826] Trial 409 finished with values: [-0.011634530843323554, 0.011907427870770431] and parameters: {'p_sma': 21, 'p_std': 32, 'p_atr': 11, 'p_adx': 7, 'rsi_period': 24, 'ema1': 23, 'ema2': 53, 'slip_atr_k': 0.0712741484889171, 'slip_spread_k': 0.21369296781081992, 'spread_hl_frac': 0.02977092328717093, 'bb_std_mult': 3.1856225515057393, 'rsi_os': 48, 'rsi_ob': 76, 'vol_spike': 0.199650304600291, 'adx_thresh': 30.244229388769387, 'atr_min_pct': 0.020923165993665355, 'atr_max_pct': 0.14574669300198106, 'tp_mult': 2.7395195813416775, 'tsl_mult': 0.47613553036620526, 'strategy': 'mean_reversion', 'time_stop': 289, 'use_sma': False, 'use_atr': False, 'use_adx': True, 'use_ema': False, 'use_spike': True, 'rsi_required': True, 'edge_k': 0.1177411930681379, 'edge_cap': 0.15694560001079944, 'bull_strategy': 'breakout', 'bull_bb_std_mult': 2.9037218288556077, 'bull_rsi_os': 29, 'bull_rsi_ob': 74, 'bull_adx_thresh': 34.27789006552487, 'bull_atr_min_pct': 0.0023084211580544954, 'bull_atr_max_pct': 0.011608361910174295, 'bull_tp_mult': 2.4127564258622884, 'bull_tsl_mult': 0.06724824637636909, 'bull_time_stop': 274, 'bull_use_sma': True, 'bull_use_ema': True, 'bull_use_atr': True, 'bull_use_adx': True, 'bull_use_spike': True, 'bull_rsi_required': False, 'bear_strategy': 'mean_reversion', 'bear_bb_std_mult': 1.8409406212811044, 'bear_rsi_os': 28, 'bear_rsi_ob': 59, 'bear_adx_thresh': 8.36070316016194, 'bear_atr_min_pct': 0.017221549172867997, 'bear_atr_max_pct': 0.12646439454406244, 'bear_tp_mult': 2.6220491814756315, 'bear_tsl_mult': 0.0823648701456321, 'bear_time_stop': 92, 'bear_use_sma': False, 'bear_use_ema': True, 'bear_use_atr': True, 'bear_use_adx': False, 'bear_use_spike': True, 'bear_rsi_required': True, 'sideways_strategy': 'breakout', 'sideways_bb_std_mult': 2.534299307043392, 'sideways_rsi_os': 33, 'sideways_rsi_ob': 83, 'sideways_adx_thresh': 29.93152502979885, 'sideways_atr_min_pct': 0.0027356866700228018, 'sideways_atr_max_pct': 0.018957363089228206, 'sideways_tp_mult': 2.3242691346871713, 'sideways_tsl_mult': 0.8393044201580993, 'sideways_time_stop': 250, 'sideways_use_sma': False, 'sideways_use_ema': True, 'sideways_use_atr': False, 'sideways_use_adx': False, 'sideways_use_spike': True, 'sideways_rsi_required': False}.
[I 2025-08-31 10:41:57,436] Trial 410 finished with values: [-0.0021223381110515582, 0.002680483910941182] and parameters: {'p_sma': 42, 'p_std': 10, 'p_atr': 12, 'p_adx': 7, 'rsi_period': 21, 'ema1': 12, 'ema2': 35, 'slip_atr_k': 0.042943566025663946, 'slip_spread_k': 0.42482149831184807, 'spread_hl_frac': 0.030178977347252858, 'bb_std_mult': 2.6141602623031606, 'rsi_os': 35, 'rsi_ob': 62, 'vol_spike': 0.20164994843577333, 'adx_thresh': 34.02762441037339, 'atr_min_pct': 0.017904913633823315, 'atr_max_pct': 0.0409965276774505, 'tp_mult': 2.7381211387150852, 'tsl_mult': 0.6711600127122792, 'strategy': 'mean_reversion', 'time_stop': 60, 'use_sma': False, 'use_atr': False, 'use_adx': True, 'use_ema': False, 'use_spike': True, 'rsi_required': True, 'edge_k': 1.8372137951530512, 'edge_cap': 0.15173753757429223, 'bull_strategy': 'breakout', 'bull_bb_std_mult': 1.1624021772782738, 'bull_rsi_os': 41, 'bull_rsi_ob': 64, 'bull_adx_thresh': 10.624898473959078, 'bull_atr_min_pct': 0.023328051676316467, 'bull_atr_max_pct': 0.0690857039784917, 'bull_tp_mult': 1.2620936255314903, 'bull_tsl_mult': 0.15004827722994557, 'bull_time_stop': 149, 'bull_use_sma': True, 'bull_use_ema': False, 'bull_use_atr': True, 'bull_use_adx': True, 'bull_use_spike': True, 'bull_rsi_required': True, 'bear_strategy': 'mean_reversion', 'bear_bb_std_mult': 2.0623306038497216, 'bear_rsi_os': 28, 'bear_rsi_ob': 75, 'bear_adx_thresh': 8.263853143866738, 'bear_atr_min_pct': 0.017068649266270348, 'bear_atr_max_pct': 0.12678710331643558, 'bear_tp_mult': 2.1260320664485346, 'bear_tsl_mult': 0.08646275700013376, 'bear_time_stop': 37, 'bear_use_sma': False, 'bear_use_ema': True, 'bear_use_atr': True, 'bear_use_adx': False, 'bear_use_spike': True, 'bear_rsi_required': True, 'sideways_strategy': 'breakout', 'sideways_bb_std_mult': 2.5394042704187165, 'sideways_rsi_os': 19, 'sideways_rsi_ob': 85, 'sideways_adx_thresh': 33.38073891159135, 'sideways_atr_min_pct': 0.0016852407158257723, 'sideways_atr_max_pct': 0.016880219192295542, 'sideways_tp_mult': 1.9133679494857545, 'sideways_tsl_mult': 0.7512831600568213, 'sideways_time_stop': 189, 'sideways_use_sma': False, 'sideways_use_ema': False, 'sideways_use_atr': False, 'sideways_use_adx': False, 'sideways_use_spike': True, 'sideways_rsi_required': False}.
[I 2025-08-31 10:41:57,548] Trial 413 finished with values: [-1000000000.0, 1000000000.0] and parameters: {'p_sma': 19, 'p_std': 33, 'p_atr': 25, 'p_adx': 24, 'rsi_period': 23, 'ema1': 16, 'ema2': 36, 'slip_atr_k': 0.24562002258639648, 'slip_spread_k': 0.29263525027357523, 'spread_hl_frac': 0.022696896902036585, 'bb_std_mult': 1.0974895270677028, 'rsi_os': 40, 'rsi_ob': 71, 'vol_spike': 0.07859537294402476, 'adx_thresh': 8.638192692029545, 'atr_min_pct': 0.027119113796399568, 'atr_max_pct': 0.048529607683431016, 'tp_mult': 2.3445256518254984, 'tsl_mult': 0.6651606884739646, 'strategy': 'mean_reversion', 'time_stop': 136, 'use_sma': False, 'use_atr': False, 'use_adx': True, 'use_ema': False, 'use_spike': True, 'rsi_required': True, 'edge_k': 1.8574746842517658, 'edge_cap': 0.6321093817908136, 'bull_strategy': 'breakout', 'bull_bb_std_mult': 0.9915655653480048, 'bull_rsi_os': 26, 'bull_rsi_ob': 48, 'bull_adx_thresh': 31.008675046943537, 'bull_atr_min_pct': 0.006663829930547658, 'bull_atr_max_pct': 0.06874167701372473, 'bull_tp_mult': 1.2474913851580596, 'bull_tsl_mult': 0.15112748140811397, 'bull_time_stop': 97, 'bull_use_sma': True, 'bull_use_ema': False, 'bull_use_atr': True, 'bull_use_adx': True, 'bull_use_spike': True, 'bull_rsi_required': True, 'bear_strategy': 'mean_reversion', 'bear_bb_std_mult': 2.10810517337467, 'bear_rsi_os': 32, 'bear_rsi_ob': 74, 'bear_adx_thresh': 12.026334694853864, 'bear_atr_min_pct': 0.018227680843138985, 'bear_atr_max_pct': 0.12770495283627673, 'bear_tp_mult': 2.946394986558482, 'bear_tsl_mult': 0.1820484640175224, 'bear_time_stop': 52, 'bear_use_sma': True, 'bear_use_ema': True, 'bear_use_atr': True, 'bear_use_adx': False, 'bear_use_spike': True, 'bear_rsi_required': True, 'sideways_strategy': 'breakout', 'sideways_bb_std_mult': 1.5306057778087623, 'sideways_rsi_os': 31, 'sideways_rsi_ob': 61, 'sideways_adx_thresh': 15.126551593559942, 'sideways_atr_min_pct': 0.01834429436894148, 'sideways_atr_max_pct': 0.02403757702136812, 'sideways_tp_mult': 1.1768831775561763, 'sideways_tsl_mult': 0.7504266963720505, 'sideways_time_stop': 265, 'sideways_use_sma': True, 'sideways_use_ema': False, 'sideways_use_atr': False, 'sideways_use_adx': True, 'sideways_use_spike': True, 'sideways_rsi_required': False}.
[I 2025-08-31 10:41:57,548] Trial 412 finished with values: [-1000000000.0, 1000000000.0] and parameters: {'p_sma': 8, 'p_std': 32, 'p_atr': 25, 'p_adx': 9, 'rsi_period': 24, 'ema1': 25, 'ema2': 36, 'slip_atr_k': 0.07520004589534106, 'slip_spread_k': 0.7093935733191015, 'spread_hl_frac': 0.0299478252707395, 'bb_std_mult': 2.6182028107045787, 'rsi_os': 40, 'rsi_ob': 93, 'vol_spike': 0.20220081270280474, 'adx_thresh': 30.219190687212915, 'atr_min_pct': 0.027375939704430717, 'atr_max_pct': 0.10720775113136818, 'tp_mult': 1.9844001113667233, 'tsl_mult': 0.6671175935781565, 'strategy': 'mean_reversion', 'time_stop': 84, 'use_sma': False, 'use_atr': False, 'use_adx': True, 'use_ema': False, 'use_spike': True, 'rsi_required': True, 'edge_k': 0.6887688565157162, 'edge_cap': 0.6246981870346555, 'bull_strategy': 'breakout', 'bull_bb_std_mult': 0.9523302570980755, 'bull_rsi_os': 41, 'bull_rsi_ob': 95, 'bull_adx_thresh': 33.97728119402061, 'bull_atr_min_pct': 0.006288036786751489, 'bull_atr_max_pct': 0.06911891708764044, 'bull_tp_mult': 1.5047848975288904, 'bull_tsl_mult': 0.14295415340371598, 'bull_time_stop': 98, 'bull_use_sma': True, 'bull_use_ema': False, 'bull_use_atr': True, 'bull_use_adx': True, 'bull_use_spike': True, 'bull_rsi_required': True, 'bear_strategy': 'mean_reversion', 'bear_bb_std_mult': 0.8342513158223812, 'bear_rsi_os': 32, 'bear_rsi_ob': 59, 'bear_adx_thresh': 6.489780872808852, 'bear_atr_min_pct': 0.018338701035143738, 'bear_atr_max_pct': 0.12677401539785588, 'bear_tp_mult': 2.1376310563972245, 'bear_tsl_mult': 0.08835433613734757, 'bear_time_stop': 90, 'bear_use_sma': False, 'bear_use_ema': True, 'bear_use_atr': True, 'bear_use_adx': False, 'bear_use_spike': True, 'bear_rsi_required': True, 'sideways_strategy': 'breakout', 'sideways_bb_std_mult': 2.0976882496300253, 'sideways_rsi_os': 31, 'sideways_rsi_ob': 83, 'sideways_adx_thresh': 29.566833572081727, 'sideways_atr_min_pct': 0.0022787801014685824, 'sideways_atr_max_pct': 0.055099833706132584, 'sideways_tp_mult': 1.1761143598305723, 'sideways_tsl_mult': 0.8156216109862257, 'sideways_time_stop': 264, 'sideways_use_sma': True, 'sideways_use_ema': False, 'sideways_use_atr': False, 'sideways_use_adx': False, 'sideways_use_spike': True, 'sideways_rsi_required': False}.
[I 2025-08-31 10:41:57,806] Trial 411 finished with values: [-1000000000.0, 1000000000.0] and parameters: {'p_sma': 19, 'p_std': 32, 'p_atr': 17, 'p_adx': 7, 'rsi_period': 23, 'ema1': 10, 'ema2': 45, 'slip_atr_k': 0.07515332526300067, 'slip_spread_k': 0.04340883733735801, 'spread_hl_frac': 0.02113322020526703, 'bb_std_mult': 3.5246239394208123, 'rsi_os': 46, 'rsi_ob': 62, 'vol_spike': 0.2008221768138684, 'adx_thresh': 30.176861419183144, 'atr_min_pct': 0.020857172121916238, 'atr_max_pct': 0.10650397364721874, 'tp_mult': 2.348619335838408, 'tsl_mult': 0.668891400123096, 'strategy': 'mean_reversion', 'time_stop': 134, 'use_sma': False, 'use_atr': False, 'use_adx': True, 'use_ema': False, 'use_spike': True, 'rsi_required': False, 'edge_k': 0.9078678291703448, 'edge_cap': 0.17429410385226288, 'bull_strategy': 'breakout', 'bull_bb_std_mult': 3.5998057878356704, 'bull_rsi_os': 31, 'bull_rsi_ob': 63, 'bull_adx_thresh': 10.489456471691154, 'bull_atr_min_pct': 0.004347215076562937, 'bull_atr_max_pct': 0.012675196858256021, 'bull_tp_mult': 1.2445443939716088, 'bull_tsl_mult': 0.06254754742554372, 'bull_time_stop': 95, 'bull_use_sma': True, 'bull_use_ema': False, 'bull_use_atr': True, 'bull_use_adx': True, 'bull_use_spike': True, 'bull_rsi_required': True, 'bear_strategy': 'mean_reversion', 'bear_bb_std_mult': 2.4375595065257127, 'bear_rsi_os': 30, 'bear_rsi_ob': 59, 'bear_adx_thresh': 21.77829541139021, 'bear_atr_min_pct': 0.017764244279688323, 'bear_atr_max_pct': 0.12650998837974384, 'bear_tp_mult': 2.7324445171777416, 'bear_tsl_mult': 0.09640354793016936, 'bear_time_stop': 54, 'bear_use_sma': False, 'bear_use_ema': True, 'bear_use_atr': True, 'bear_use_adx': False, 'bear_use_spike': True, 'bear_rsi_required': True, 'sideways_strategy': 'mean_reversion', 'sideways_bb_std_mult': 2.9797366544694155, 'sideways_rsi_os': 34, 'sideways_rsi_ob': 76, 'sideways_adx_thresh': 17.353246395610988, 'sideways_atr_min_pct': 0.0016133285138943308, 'sideways_atr_max_pct': 0.11937940974798286, 'sideways_tp_mult': 2.9620155556332723, 'sideways_tsl_mult': 0.7472927252943328, 'sideways_time_stop': 264, 'sideways_use_sma': False, 'sideways_use_ema': True, 'sideways_use_atr': False, 'sideways_use_adx': False, 'sideways_use_spike': True, 'sideways_rsi_required': False}.
