[I 2025-08-31 10:04:09,658] Trial 97 finished with values: [-0.01825190035653379, 0.018107053724324758] and parameters: {'p_sma': 17, 'p_std': 37, 'p_atr': 10, 'p_adx': 23, 'rsi_period': 21, 'ema1': 13, 'ema2': 58, 'slip_atr_k': 0.1572524051350371, 'slip_spread_k': 0.722316582436506, 'spread_hl_frac': 0.04099629050531465, 'bb_std_mult': 3.587767619861946, 'rsi_os': 20, 'rsi_ob': 74, 'vol_spike': 0.04601205082436498, 'adx_thresh': 20.645198430229133, 'atr_min_pct': 0.011980568236076145, 'atr_max_pct': 0.07830166935862985, 'tp_mult': 2.492095346977539, 'tsl_mult': 0.7241693211842872, 'strategy': 'breakout', 'time_stop': 126, 'use_sma': False, 'use_atr': False, 'use_adx': False, 'use_ema': False, 'use_spike': False, 'rsi_required': False, 'edge_k': 1.9299129106827406, 'edge_cap': 0.9999629222567101, 'bull_strategy': 'mean_reversion', 'bull_bb_std_mult': 1.4643193950791882, 'bull_rsi_os': 30, 'bull_rsi_ob': 72, 'bull_adx_thresh': 18.798977787851722, 'bull_atr_min_pct': 0.0015073144116466845, 'bull_atr_max_pct': 0.03772660459874541, 'bull_tp_mult': 1.0702591627057416, 'bull_tsl_mult': 0.7770606689985662, 'bull_time_stop': 65, 'bull_use_sma': True, 'bull_use_ema': False, 'bull_use_atr': True, 'bull_use_adx': False, 'bull_use_spike': True, 'bull_rsi_required': True, 'bear_strategy': 'breakout', 'bear_bb_std_mult': 0.734785494723355, 'bear_rsi_os': 51, 'bear_rsi_ob': 68, 'bear_adx_thresh': 22.31683643087101, 'bear_atr_min_pct': 0.029093524072316808, 'bear_atr_max_pct': 0.044730590185012964, 'bear_tp_mult': 2.410802270394511, 'bear_tsl_mult': 0.05431491656849047, 'bear_time_stop': 103, 'bear_use_sma': False, 'bear_use_ema': True, 'bear_use_atr': True, 'bear_use_adx': True, 'bear_use_spike': False, 'bear_rsi_required': False, 'sideways_strategy': 'mean_reversion', 'sideways_bb_std_mult': 0.6999117269647526, 'sideways_rsi_os': 44, 'sideways_rsi_ob': 59, 'sideways_adx_thresh': 20.234503649768484, 'sideways_atr_min_pct': 0.014281964850741577, 'sideways_atr_max_pct': 0.02261243746535423, 'sideways_tp_mult': 2.0982993166238364, 'sideways_tsl_mult': 0.23795807578791395, 'sideways_time_stop': 167, 'sideways_use_sma': True, 'sideways_use_ema': True, 'sideways_use_atr': False, 'sideways_use_adx': False, 'sideways_use_spike': False, 'sideways_rsi_required': True}.
[I 2025-08-31 10:04:09,761] Trial 98 finished with values: [-1000000000.0, 1000000000.0] and parameters: {'p_sma': 7, 'p_std': 35, 'p_atr': 10, 'p_adx': 25, 'rsi_period': 40, 'ema1': 24, 'ema2': 11, 'slip_atr_k': 0.031149348737174856, 'slip_spread_k': 0.620613461353102, 'spread_hl_frac': 0.04377826815766986, 'bb_std_mult': 3.5948748077283357, 'rsi_os': 26, 'rsi_ob': 55, 'vol_spike': 0.018977963954420946, 'adx_thresh': 7.201022537362476, 'atr_min_pct': 0.015307156019855392, 'atr_max_pct': 0.1362962274699902, 'tp_mult': 2.493494704065936, 'tsl_mult': 0.5925129263670552, 'strategy': 'breakout', 'time_stop': 30, 'use_sma': True, 'use_atr': False, 'use_adx': True, 'use_ema': False, 'use_spike': False, 'rsi_required': False, 'edge_k': 1.3323212229671644, 'edge_cap': 0.9691801967077591, 'bull_strategy': 'mean_reversion', 'bull_bb_std_mult': 1.5087966008426243, 'bull_rsi_os': 50, 'bull_rsi_ob': 90, 'bull_adx_thresh': 28.74427469004292, 'bull_atr_min_pct': 0.01478163410221734, 'bull_atr_max_pct': 0.11639633416575171, 'bull_tp_mult': 1.0757244583977126, 'bull_tsl_mult': 0.006008969540114317, 'bull_time_stop': 155, 'bull_use_sma': True, 'bull_use_ema': False, 'bull_use_atr': True, 'bull_use_adx': False, 'bull_use_spike': True, 'bull_rsi_required': True, 'bear_strategy': 'breakout', 'bear_bb_std_mult': 2.3850010845892884, 'bear_rsi_os': 48, 'bear_rsi_ob': 69, 'bear_adx_thresh': 33.576953976837586, 'bear_atr_min_pct': 0.00547217065809354, 'bear_atr_max_pct': 0.045054272845038476, 'bear_tp_mult': 1.2653454576594472, 'bear_tsl_mult': 0.6034092493574723, 'bear_time_stop': 126, 'bear_use_sma': False, 'bear_use_ema': True, 'bear_use_atr': True, 'bear_use_adx': False, 'bear_use_spike': False, 'bear_rsi_required': False, 'sideways_strategy': 'mean_reversion', 'sideways_bb_std_mult': 0.6945165456892368, 'sideways_rsi_os': 47, 'sideways_rsi_ob': 56, 'sideways_adx_thresh': 22.119752739240475, 'sideways_atr_min_pct': 0.01572157139062459, 'sideways_atr_max_pct': 0.022891852239082716, 'sideways_tp_mult': 2.4900639852447854, 'sideways_tsl_mult': 0.18947329462074097, 'sideways_time_stop': 142, 'sideways_use_sma': True, 'sideways_use_ema': True, 'sideways_use_atr': False, 'sideways_use_adx': False, 'sideways_use_spike': False, 'sideways_rsi_required': True}.
[I 2025-08-31 10:04:10,105] Trial 103 finished with values: [-1000000000.0, 1000000000.0] and parameters: {'p_sma': 8, 'p_std': 52, 'p_atr': 16, 'p_adx': 23, 'rsi_period': 61, 'ema1': 11, 'ema2': 14, 'slip_atr_k': 0.1671238299367235, 'slip_spread_k': 0.7366121434026093, 'spread_hl_frac': 0.04675707771322383, 'bb_std_mult': 1.8619755985615098, 'rsi_os': 22, 'rsi_ob': 47, 'vol_spike': 0.10822401340098817, 'adx_thresh': 30.761512500349333, 'atr_min_pct': 0.011556466002911553, 'atr_max_pct': 0.03126540542118269, 'tp_mult': 1.8934798705455314, 'tsl_mult': 0.720886655656787, 'strategy': 'mean_reversion', 'time_stop': 129, 'use_sma': True, 'use_atr': False, 'use_adx': True, 'use_ema': False, 'use_spike': True, 'rsi_required': False, 'edge_k': 1.4014441603668417, 'edge_cap': 0.9239878435903134, 'bull_strategy': 'mean_reversion', 'bull_bb_std_mult': 0.6109612544473639, 'bull_rsi_os': 10, 'bull_rsi_ob': 94, 'bull_adx_thresh': 28.7708042586475, 'bull_atr_min_pct': 0.0008653022882424595, 'bull_atr_max_pct': 0.03810512040287978, 'bull_tp_mult': 1.247853236255035, 'bull_tsl_mult': 0.004250026355087033, 'bull_time_stop': 150, 'bull_use_sma': True, 'bull_use_ema': False, 'bull_use_atr': True, 'bull_use_adx': False, 'bull_use_spike': False, 'bull_rsi_required': True, 'bear_strategy': 'mean_reversion', 'bear_bb_std_mult': 2.3547475372164097, 'bear_rsi_os': 53, 'bear_rsi_ob': 91, 'bear_adx_thresh': 19.708332125585784, 'bear_atr_min_pct': 0.028194625313360613, 'bear_atr_max_pct': 0.04644235003608971, 'bear_tp_mult': 1.307267724840552, 'bear_tsl_mult': 0.6189424981165736, 'bear_time_stop': 144, 'bear_use_sma': True, 'bear_use_ema': False, 'bear_use_atr': True, 'bear_use_adx': False, 'bear_use_spike': False, 'bear_rsi_required': False, 'sideways_strategy': 'mean_reversion', 'sideways_bb_std_mult': 0.7967660837069421, 'sideways_rsi_os': 45, 'sideways_rsi_ob': 53, 'sideways_adx_thresh': 22.272092319763175, 'sideways_atr_min_pct': 0.006103745357470007, 'sideways_atr_max_pct': 0.022476136862342296, 'sideways_tp_mult': 2.0376024534368717, 'sideways_tsl_mult': 0.516553669516576, 'sideways_time_stop': 118, 'sideways_use_sma': False, 'sideways_use_ema': False, 'sideways_use_atr': False, 'sideways_use_adx': True, 'sideways_use_spike': False, 'sideways_rsi_required': True}.
[I 2025-08-31 10:04:39,547] Trial 104 finished with values: [-1000000000.0, 1000000000.0] and parameters: {'p_sma': 8, 'p_std': 51, 'p_atr': 29, 'p_adx': 24, 'rsi_period': 69, 'ema1': 11, 'ema2': 53, 'slip_atr_k': 0.1932833504936762, 'slip_spread_k': 0.7383736304833304, 'spread_hl_frac': 0.03693988071913298, 'bb_std_mult': 1.8223829652860288, 'rsi_os': 22, 'rsi_ob': 62, 'vol_spike': 0.2492433310995841, 'adx_thresh': 33.75682136129085, 'atr_min_pct': 0.011533597855210279, 'atr_max_pct': 0.12996215873475828, 'tp_mult': 1.906202633769188, 'tsl_mult': 0.7595642902753919, 'strategy': 'mean_reversion', 'time_stop': 278, 'use_sma': True, 'use_atr': False, 'use_adx': True, 'use_ema': False, 'use_spike': False, 'rsi_required': False, 'edge_k': 1.9529598717819074, 'edge_cap': 0.6546163931650271, 'bull_strategy': 'mean_reversion', 'bull_bb_std_mult': 0.9942023919928101, 'bull_rsi_os': 35, 'bull_rsi_ob': 73, 'bull_adx_thresh': 18.307058590319826, 'bull_atr_min_pct': 0.01704944441516928, 'bull_atr_max_pct': 0.014445569030101187, 'bull_tp_mult': 1.2244320656200147, 'bull_tsl_mult': 0.8353325659299712, 'bull_time_stop': 45, 'bull_use_sma': False, 'bull_use_ema': False, 'bull_use_atr': True, 'bull_use_adx': False, 'bull_use_spike': False, 'bull_rsi_required': True, 'bear_strategy': 'breakout', 'bear_bb_std_mult': 1.2989305620830107, 'bear_rsi_os': 53, 'bear_rsi_ob': 78, 'bear_adx_thresh': 19.44243533022881, 'bear_atr_min_pct': 0.028013749318429162, 'bear_atr_max_pct': 0.02539519139733684, 'bear_tp_mult': 2.341201929007724, 'bear_tsl_mult': 0.8281536025998126, 'bear_time_stop': 46, 'bear_use_sma': True, 'bear_use_ema': False, 'bear_use_atr': True, 'bear_use_adx': False, 'bear_use_spike': False, 'bear_rsi_required': False, 'sideways_strategy': 'mean_reversion', 'sideways_bb_std_mult': 0.8507628391771626, 'sideways_rsi_os': 44, 'sideways_rsi_ob': 53, 'sideways_adx_thresh': 15.889751620789557, 'sideways_atr_min_pct': 0.014707472961968684, 'sideways_atr_max_pct': 0.0382835891100129, 'sideways_tp_mult': 2.050232126529883, 'sideways_tsl_mult': 0.44096683201305065, 'sideways_time_stop': 298, 'sideways_use_sma': False, 'sideways_use_ema': False, 'sideways_use_atr': False, 'sideways_use_adx': True, 'sideways_use_spike': False, 'sideways_rsi_required': True}.
[I 2025-08-31 10:04:40,108] Trial 102 finished with values: [-1000000000.0, 1000000000.0] and parameters: {'p_sma': 56, 'p_std': 35, 'p_atr': 30, 'p_adx': 25, 'rsi_period': 40, 'ema1': 24, 'ema2': 14, 'slip_atr_k': 0.07023016210367464, 'slip_spread_k': 0.17665214049535755, 'spread_hl_frac': 0.04604863105822205, 'bb_std_mult': 3.28348557419215, 'rsi_os': 22, 'rsi_ob': 62, 'vol_spike': 0.2514760832634927, 'adx_thresh': 33.999678302378406, 'atr_min_pct': 0.011937735561061235, 'atr_max_pct': 0.1304480924117387, 'tp_mult': 2.4403692544916513, 'tsl_mult': 0.9216552385730741, 'strategy': 'mean_reversion', 'time_stop': 278, 'use_sma': True, 'use_atr': False, 'use_adx': True, 'use_ema': False, 'use_spike': False, 'rsi_required': False, 'edge_k': 1.951113177455274, 'edge_cap': 0.6416346200698884, 'bull_strategy': 'mean_reversion', 'bull_bb_std_mult': 0.6292844014489796, 'bull_rsi_os': 35, 'bull_rsi_ob': 94, 'bull_adx_thresh': 28.672404018551127, 'bull_atr_min_pct': 0.01730269242833626, 'bull_atr_max_pct': 0.037277811035489675, 'bull_tp_mult': 1.2227943982980352, 'bull_tsl_mult': 0.14725154902355447, 'bull_time_stop': 204, 'bull_use_sma': False, 'bull_use_ema': False, 'bull_use_atr': True, 'bull_use_adx': False, 'bull_use_spike': False, 'bull_rsi_required': True, 'bear_strategy': 'breakout', 'bear_bb_std_mult': 2.3686636918479067, 'bear_rsi_os': 53, 'bear_rsi_ob': 78, 'bear_adx_thresh': 24.015085888336095, 'bear_atr_min_pct': 0.027981649274174496, 'bear_atr_max_pct': 0.045492204102486354, 'bear_tp_mult': 1.2913634108196508, 'bear_tsl_mult': 0.8101818231964797, 'bear_time_stop': 187, 'bear_use_sma': True, 'bear_use_ema': False, 'bear_use_atr': True, 'bear_use_adx': False, 'bear_use_spike': False, 'bear_rsi_required': False, 'sideways_strategy': 'mean_reversion', 'sideways_bb_std_mult': 0.7016729191598031, 'sideways_rsi_os': 45, 'sideways_rsi_ob': 56, 'sideways_adx_thresh': 23.99500580804411, 'sideways_atr_min_pct': 0.004690435733873951, 'sideways_atr_max_pct': 0.03689357233762366, 'sideways_tp_mult': 2.0483729471851766, 'sideways_tsl_mult': 0.5248324106572251, 'sideways_time_stop': 297, 'sideways_use_sma': False, 'sideways_use_ema': True, 'sideways_use_atr': False, 'sideways_use_adx': True, 'sideways_use_spike': False, 'sideways_rsi_required': True}.
[I 2025-08-31 10:04:40,680] Trial 101 finished with values: [-1000000000.0, 1000000000.0] and parameters: {'p_sma': 7, 'p_std': 34, 'p_atr': 24, 'p_adx': 22, 'rsi_period': 41, 'ema1': 22, 'ema2': 14, 'slip_atr_k': 0.03400535022638454, 'slip_spread_k': 0.6639852246210783, 'spread_hl_frac': 0.03121540530382299, 'bb_std_mult': 1.8168516241981432, 'rsi_os': 22, 'rsi_ob': 53, 'vol_spike': 0.24598018518954048, 'adx_thresh': 6.059006593295319, 'atr_min_pct': 0.010245772626483962, 'atr_max_pct': 0.13539649785861024, 'tp_mult': 1.9178340410585615, 'tsl_mult': 0.5136302454135011, 'strategy': 'breakout', 'time_stop': 127, 'use_sma': True, 'use_atr': False, 'use_adx': True, 'use_ema': False, 'use_spike': False, 'rsi_required': False, 'edge_k': 0.032559555842202936, 'edge_cap': 0.6390710823725494, 'bull_strategy': 'mean_reversion', 'bull_bb_std_mult': 0.6157290856572568, 'bull_rsi_os': 35, 'bull_rsi_ob': 73, 'bull_adx_thresh': 28.70467648396307, 'bull_atr_min_pct': 0.000645607417178045, 'bull_atr_max_pct': 0.038967626739647675, 'bull_tp_mult': 1.2194512110918438, 'bull_tsl_mult': 0.005248407821533019, 'bull_time_stop': 154, 'bull_use_sma': False, 'bull_use_ema': False, 'bull_use_atr': True, 'bull_use_adx': False, 'bull_use_spike': False, 'bull_rsi_required': True, 'bear_strategy': 'breakout', 'bear_bb_std_mult': 2.3709736852893206, 'bear_rsi_os': 48, 'bear_rsi_ob': 79, 'bear_adx_thresh': 23.659945020839416, 'bear_atr_min_pct': 0.028205703736311948, 'bear_atr_max_pct': 0.04494952324511851, 'bear_tp_mult': 1.3002910788523012, 'bear_tsl_mult': 0.5981104745449585, 'bear_time_stop': 88, 'bear_use_sma': False, 'bear_use_ema': True, 'bear_use_atr': True, 'bear_use_adx': False, 'bear_use_spike': False, 'bear_rsi_required': False, 'sideways_strategy': 'mean_reversion', 'sideways_bb_std_mult': 0.6900262077308631, 'sideways_rsi_os': 20, 'sideways_rsi_ob': 56, 'sideways_adx_thresh': 16.233951061958187, 'sideways_atr_min_pct': 0.015655598346389084, 'sideways_atr_max_pct': 0.0726033322078979, 'sideways_tp_mult': 2.4906127554218074, 'sideways_tsl_mult': 0.4937977798490379, 'sideways_time_stop': 119, 'sideways_use_sma': False, 'sideways_use_ema': True, 'sideways_use_atr': False, 'sideways_use_adx': False, 'sideways_use_spike': False, 'sideways_rsi_required': True}.
[I 2025-08-31 10:04:40,771] Trial 105 finished with values: [-1000000000.0, 1000000000.0] and parameters: {'p_sma': 26, 'p_std': 33, 'p_atr': 29, 'p_adx': 20, 'rsi_period': 46, 'ema1': 22, 'ema2': 54, 'slip_atr_k': 0.1905048456315367, 'slip_spread_k': 0.6637182658733699, 'spread_hl_frac': 0.03157507985034953, 'bb_std_mult': 3.296880040083783, 'rsi_os': 48, 'rsi_ob': 62, 'vol_spike': 0.2736341446276529, 'adx_thresh': 18.83560382863667, 'atr_min_pct': 0.012344138629277142, 'atr_max_pct': 0.1316816423383507, 'tp_mult': 2.863985958575453, 'tsl_mult': 0.7630419464927608, 'strategy': 'breakout', 'time_stop': 200, 'use_sma': True, 'use_atr': False, 'use_adx': True, 'use_ema': False, 'use_spike': False, 'rsi_required': False, 'edge_k': 1.9411838220467754, 'edge_cap': 0.9996987783642484, 'bull_strategy': 'mean_reversion', 'bull_bb_std_mult': 0.9671930645230137, 'bull_rsi_os': 34, 'bull_rsi_ob': 68, 'bull_adx_thresh': 30.80714224022602, 'bull_atr_min_pct': 0.01806204781373121, 'bull_atr_max_pct': 0.014446159599775707, 'bull_tp_mult': 1.2138338969465297, 'bull_tsl_mult': 0.8337920422634039, 'bull_time_stop': 298, 'bull_use_sma': False, 'bull_use_ema': False, 'bull_use_atr': True, 'bull_use_adx': False, 'bull_use_spike': False, 'bull_rsi_required': True, 'bear_strategy': 'breakout', 'bear_bb_std_mult': 1.132866064807859, 'bear_rsi_os': 53, 'bear_rsi_ob': 76, 'bear_adx_thresh': 18.353232855428324, 'bear_atr_min_pct': 0.026491325114042334, 'bear_atr_max_pct': 0.013411514980454075, 'bear_tp_mult': 2.6023595524261096, 'bear_tsl_mult': 0.858312316797136, 'bear_time_stop': 109, 'bear_use_sma': True, 'bear_use_ema': False, 'bear_use_atr': False, 'bear_use_adx': False, 'bear_use_spike': False, 'bear_rsi_required': False, 'sideways_strategy': 'mean_reversion', 'sideways_bb_std_mult': 1.1138746703534117, 'sideways_rsi_os': 20, 'sideways_rsi_ob': 56, 'sideways_adx_thresh': 16.25956160424598, 'sideways_atr_min_pct': 0.014414749851135394, 'sideways_atr_max_pct': 0.04156730860817231, 'sideways_tp_mult': 2.6328735299309303, 'sideways_tsl_mult': 0.5017984619404541, 'sideways_time_stop': 54, 'sideways_use_sma': False, 'sideways_use_ema': True, 'sideways_use_atr': False, 'sideways_use_adx': True, 'sideways_use_spike': False, 'sideways_rsi_required': True}.
[I 2025-08-31 10:05:12,198] Trial 106 finished with values: [-1000000000.0, 1000000000.0] and parameters: {'p_sma': 6, 'p_std': 27, 'p_atr': 29, 'p_adx': 28, 'rsi_period': 17, 'ema1': 22, 'ema2': 46, 'slip_atr_k': 0.14888573117826864, 'slip_spread_k': 0.6918519742259014, 'spread_hl_frac': 0.028875773897188862, 'bb_std_mult': 2.020770400553229, 'rsi_os': 20, 'rsi_ob': 57, 'vol_spike': 0.14095522413780345, 'adx_thresh': 19.856240164455862, 'atr_min_pct': 0.013304972532759746, 'atr_max_pct': 0.09112389830602195, 'tp_mult': 1.8363710110039402, 'tsl_mult': 0.7741576820634768, 'strategy': 'breakout', 'time_stop': 191, 'use_sma': True, 'use_atr': True, 'use_adx': True, 'use_ema': True, 'use_spike': False, 'rsi_required': False, 'edge_k': 0.012300297702050766, 'edge_cap': 0.08860119164852265, 'bull_strategy': 'mean_reversion', 'bull_bb_std_mult': 1.1510619642784001, 'bull_rsi_os': 31, 'bull_rsi_ob': 95, 'bull_adx_thresh': 30.89711759310797, 'bull_atr_min_pct': 0.019813042495755814, 'bull_atr_max_pct': 0.14456020889632698, 'bull_tp_mult': 1.6539285208998524, 'bull_tsl_mult': 0.7672021003179706, 'bull_time_stop': 201, 'bull_use_sma': False, 'bull_use_ema': False, 'bull_use_atr': True, 'bull_use_adx': False, 'bull_use_spike': False, 'bull_rsi_required': True, 'bear_strategy': 'breakout', 'bear_bb_std_mult': 2.505771925448602, 'bear_rsi_os': 52, 'bear_rsi_ob': 62, 'bear_adx_thresh': 20.902884294073683, 'bear_atr_min_pct': 0.029291738892750805, 'bear_atr_max_pct': 0.02934960800240742, 'bear_tp_mult': 2.622463882791223, 'bear_tsl_mult': 0.6513667028267671, 'bear_time_stop': 187, 'bear_use_sma': True, 'bear_use_ema': False, 'bear_use_atr': False, 'bear_use_adx': False, 'bear_use_spike': False, 'bear_rsi_required': False, 'sideways_strategy': 'mean_reversion', 'sideways_bb_std_mult': 0.7156257138600817, 'sideways_rsi_os': 20, 'sideways_rsi_ob': 56, 'sideways_adx_thresh': 24.37819941373111, 'sideways_atr_min_pct': 0.013324346566453841, 'sideways_atr_max_pct': 0.10804670650552257, 'sideways_tp_mult': 2.2303209476587025, 'sideways_tsl_mult': 0.25592920820489895, 'sideways_time_stop': 56, 'sideways_use_sma': False, 'sideways_use_ema': True, 'sideways_use_atr': False, 'sideways_use_adx': True, 'sideways_use_spike': False, 'sideways_rsi_required': True}.
[I 2025-08-31 10:05:12,803] Trial 107 finished with values: [-0.07633462254433487, 0.076256446725427] and parameters: {'p_sma': 33, 'p_std': 12, 'p_atr': 21, 'p_adx': 22, 'rsi_period': 45, 'ema1': 21, 'ema2': 47, 'slip_atr_k': 0.169780109328237, 'slip_spread_k': 0.25887231907734193, 'spread_hl_frac': 0.03110380639289502, 'bb_std_mult': 2.3682442523723197, 'rsi_os': 18, 'rsi_ob': 71, 'vol_spike': 0.13617058710243987, 'adx_thresh': 19.8043831135963, 'atr_min_pct': 0.013548852306610683, 'atr_max_pct': 0.06450059329232609, 'tp_mult': 2.8600080393633447, 'tsl_mult': 0.7692891805460843, 'strategy': 'breakout', 'time_stop': 81, 'use_sma': False, 'use_atr': True, 'use_adx': True, 'use_ema': True, 'use_spike': False, 'rsi_required': False, 'edge_k': 0.04555560635193856, 'edge_cap': 0.5612758844459796, 'bull_strategy': 'mean_reversion', 'bull_bb_std_mult': 1.889438299815839, 'bull_rsi_os': 28, 'bull_rsi_ob': 91, 'bull_adx_thresh': 15.735441168240893, 'bull_atr_min_pct': 0.000699409935302427, 'bull_atr_max_pct': 0.03206543479859916, 'bull_tp_mult': 1.6261264919099776, 'bull_tsl_mult': 0.4186942214068535, 'bull_time_stop': 31, 'bull_use_sma': True, 'bull_use_ema': False, 'bull_use_atr': True, 'bull_use_adx': False, 'bull_use_spike': False, 'bull_rsi_required': True, 'bear_strategy': 'breakout', 'bear_bb_std_mult': 2.5086487523318173, 'bear_rsi_os': 50, 'bear_rsi_ob': 76, 'bear_adx_thresh': 21.27082855691868, 'bear_atr_min_pct': 0.026422069932402717, 'bear_atr_max_pct': 0.014395232270777578, 'bear_tp_mult': 2.2725484849747897, 'bear_tsl_mult': 0.7025698084078824, 'bear_time_stop': 88, 'bear_use_sma': True, 'bear_use_ema': False, 'bear_use_atr': False, 'bear_use_adx': False, 'bear_use_spike': True, 'bear_rsi_required': False, 'sideways_strategy': 'mean_reversion', 'sideways_bb_std_mult': 0.572715635574122, 'sideways_rsi_os': 20, 'sideways_rsi_ob': 65, 'sideways_adx_thresh': 12.999484889738117, 'sideways_atr_min_pct': 0.013263436902753918, 'sideways_atr_max_pct': 0.10892732420012291, 'sideways_tp_mult': 1.9039611880617522, 'sideways_tsl_mult': 0.5529599158117728, 'sideways_time_stop': 47, 'sideways_use_sma': False, 'sideways_use_ema': True, 'sideways_use_atr': True, 'sideways_use_adx': True, 'sideways_use_spike': False, 'sideways_rsi_required': True}.
