[I 2025-08-31 11:24:10,975] Trial 726 finished with values: [-1000000000.0, 1000000000.0] and parameters: {'p_sma': 35, 'p_std': 16, 'p_atr': 30, 'p_adx': 21, 'rsi_period': 65, 'ema1': 6, 'ema2': 13, 'slip_atr_k': 0.012025134521959753, 'slip_spread_k': 0.44791854969100287, 'spread_hl_frac': 0.022722808029643042, 'bb_std_mult': 0.7986155627253506, 'rsi_os': 33, 'rsi_ob': 85, 'vol_spike': 0.06249309179261507, 'adx_thresh': 9.849880715720149, 'atr_min_pct': 0.02615073992869597, 'atr_max_pct': 0.05577686273741746, 'tp_mult': 2.895844539679243, 'tsl_mult': 0.2530250855469026, 'strategy': 'breakout', 'time_stop': 73, 'use_sma': True, 'use_atr': True, 'use_adx': False, 'use_ema': True, 'use_spike': False, 'rsi_required': False, 'edge_k': 0.8777876702100078, 'edge_cap': 0.6541888487313585, 'bull_strategy': 'mean_reversion', 'bull_bb_std_mult': 2.386277477024369, 'bull_rsi_os': 55, 'bull_rsi_ob': 89, 'bull_adx_thresh': 23.53590948172022, 'bull_atr_min_pct': 0.014297095688369428, 'bull_atr_max_pct': 0.03912159932482624, 'bull_tp_mult': 2.9676216992692566, 'bull_tsl_mult': 0.30937924193354993, 'bull_time_stop': 182, 'bull_use_sma': False, 'bull_use_ema': False, 'bull_use_atr': False, 'bull_use_adx': True, 'bull_use_spike': False, 'bull_rsi_required': False, 'bear_strategy': 'mean_reversion', 'bear_bb_std_mult': 3.323838942420087, 'bear_rsi_os': 51, 'bear_rsi_ob': 70, 'bear_adx_thresh': 29.47786930087616, 'bear_atr_min_pct': 0.006820684992750404, 'bear_atr_max_pct': 0.1321413681269626, 'bear_tp_mult': 2.731896261097907, 'bear_tsl_mult': 0.8991100825046567, 'bear_time_stop': 109, 'bear_use_sma': False, 'bear_use_ema': False, 'bear_use_atr': True, 'bear_use_adx': False, 'bear_use_spike': True, 'bear_rsi_required': False, 'sideways_strategy': 'mean_reversion', 'sideways_bb_std_mult': 1.1145495523390327, 'sideways_rsi_os': 41, 'sideways_rsi_ob': 60, 'sideways_adx_thresh': 21.058234654355818, 'sideways_atr_min_pct': 0.006841206931266217, 'sideways_atr_max_pct': 0.10812789136620067, 'sideways_tp_mult': 1.5805815471953788, 'sideways_tsl_mult': 0.5853865519393713, 'sideways_time_stop': 83, 'sideways_use_sma': False, 'sideways_use_ema': True, 'sideways_use_atr': False, 'sideways_use_adx': False, 'sideways_use_spike': True, 'sideways_rsi_required': False}.
[I 2025-08-31 11:24:45,396] Trial 730 finished with values: [-1000000000.0, 1000000000.0] and parameters: {'p_sma': 39, 'p_std': 13, 'p_atr': 27, 'p_adx': 21, 'rsi_period': 32, 'ema1': 5, 'ema2': 13, 'slip_atr_k': 0.017310301044519867, 'slip_spread_k': 0.46313117218174665, 'spread_hl_frac': 0.019487803818605702, 'bb_std_mult': 0.5595273672986825, 'rsi_os': 51, 'rsi_ob': 90, 'vol_spike': 0.019136380049905324, 'adx_thresh': 10.612522729733058, 'atr_min_pct': 0.011182119952260112, 'atr_max_pct': 0.08453987294846227, 'tp_mult': 2.955158850737236, 'tsl_mult': 0.04749478354070942, 'strategy': 'breakout', 'time_stop': 75, 'use_sma': True, 'use_atr': True, 'use_adx': False, 'use_ema': True, 'use_spike': False, 'rsi_required': False, 'edge_k': 1.5189838727868514, 'edge_cap': 0.5875972941649246, 'bull_strategy': 'mean_reversion', 'bull_bb_std_mult': 2.363330414927924, 'bull_rsi_os': 42, 'bull_rsi_ob': 49, 'bull_adx_thresh': 23.548368168384485, 'bull_atr_min_pct': 0.014220059217671655, 'bull_atr_max_pct': 0.040483863153223346, 'bull_tp_mult': 1.813056077813974, 'bull_tsl_mult': 0.24779242823981446, 'bull_time_stop': 261, 'bull_use_sma': False, 'bull_use_ema': True, 'bull_use_atr': False, 'bull_use_adx': True, 'bull_use_spike': False, 'bull_rsi_required': False, 'bear_strategy': 'mean_reversion', 'bear_bb_std_mult': 1.6074912977604638, 'bear_rsi_os': 10, 'bear_rsi_ob': 54, 'bear_adx_thresh': 9.099833909623356, 'bear_atr_min_pct': 0.0009566010881294704, 'bear_atr_max_pct': 0.07102803839511299, 'bear_tp_mult': 2.4381844059657194, 'bear_tsl_mult': 0.9109038703634513, 'bear_time_stop': 94, 'bear_use_sma': False, 'bear_use_ema': True, 'bear_use_atr': True, 'bear_use_adx': False, 'bear_use_spike': False, 'bear_rsi_required': False, 'sideways_strategy': 'mean_reversion', 'sideways_bb_std_mult': 1.037901023231791, 'sideways_rsi_os': 39, 'sideways_rsi_ob': 92, 'sideways_adx_thresh': 31.957605170268074, 'sideways_atr_min_pct': 0.029938351782325606, 'sideways_atr_max_pct': 0.0830443312034273, 'sideways_tp_mult': 1.6355811088545866, 'sideways_tsl_mult': 0.5128494412432247, 'sideways_time_stop': 47, 'sideways_use_sma': True, 'sideways_use_ema': True, 'sideways_use_atr': False, 'sideways_use_adx': False, 'sideways_use_spike': True, 'sideways_rsi_required': False}.
[I 2025-08-31 11:24:45,641] Trial 732 finished with values: [-1000000000.0, 1000000000.0] and parameters: {'p_sma': 34, 'p_std': 15, 'p_atr': 27, 'p_adx': 26, 'rsi_period': 31, 'ema1': 27, 'ema2': 30, 'slip_atr_k': 0.01588199173623003, 'slip_spread_k': 0.5662970843377342, 'spread_hl_frac': 0.03244971777274241, 'bb_std_mult': 1.392816775915849, 'rsi_os': 10, 'rsi_ob': 81, 'vol_spike': 0.13097026597434575, 'adx_thresh': 12.399041343483749, 'atr_min_pct': 0.02234066131617958, 'atr_max_pct': 0.059054602126299184, 'tp_mult': 1.9593193991183295, 'tsl_mult': 0.07368075790636584, 'strategy': 'breakout', 'time_stop': 94, 'use_sma': True, 'use_atr': True, 'use_adx': False, 'use_ema': True, 'use_spike': False, 'rsi_required': False, 'edge_k': 0.7149240889098771, 'edge_cap': 0.6513174714087496, 'bull_strategy': 'mean_reversion', 'bull_bb_std_mult': 1.798034467397696, 'bull_rsi_os': 42, 'bull_rsi_ob': 61, 'bull_adx_thresh': 27.3608539107316, 'bull_atr_min_pct': 0.014224329064348402, 'bull_atr_max_pct': 0.03474368226733203, 'bull_tp_mult': 2.997444050350922, 'bull_tsl_mult': 0.18235534156939626, 'bull_time_stop': 51, 'bull_use_sma': False, 'bull_use_ema': True, 'bull_use_atr': False, 'bull_use_adx': True, 'bull_use_spike': False, 'bull_rsi_required': False, 'bear_strategy': 'mean_reversion', 'bear_bb_std_mult': 2.8064122078813654, 'bear_rsi_os': 49, 'bear_rsi_ob': 54, 'bear_adx_thresh': 10.341552654675558, 'bear_atr_min_pct': 0.012827385106470865, 'bear_atr_max_pct': 0.14093053706145833, 'bear_tp_mult': 2.9282622411206014, 'bear_tsl_mult': 0.9194401493503618, 'bear_time_stop': 97, 'bear_use_sma': False, 'bear_use_ema': True, 'bear_use_atr': True, 'bear_use_adx': False, 'bear_use_spike': False, 'bear_rsi_required': False, 'sideways_strategy': 'mean_reversion', 'sideways_bb_std_mult': 0.9962431647594592, 'sideways_rsi_os': 39, 'sideways_rsi_ob': 93, 'sideways_adx_thresh': 31.8518232434225, 'sideways_atr_min_pct': 0.029983838962435956, 'sideways_atr_max_pct': 0.0996155158667649, 'sideways_tp_mult': 1.6331499346696055, 'sideways_tsl_mult': 0.2488005877925435, 'sideways_time_stop': 47, 'sideways_use_sma': True, 'sideways_use_ema': True, 'sideways_use_atr': False, 'sideways_use_adx': False, 'sideways_use_spike': True, 'sideways_rsi_required': False}.
[I 2025-08-31 11:24:45,937] Trial 733 finished with values: [-1000000000.0, 1000000000.0] and parameters: {'p_sma': 39, 'p_std': 10, 'p_atr': 27, 'p_adx': 28, 'rsi_period': 30, 'ema1': 6, 'ema2': 14, 'slip_atr_k': 0.021473400019522127, 'slip_spread_k': 0.5481757848244267, 'spread_hl_frac': 0.01906864948237499, 'bb_std_mult': 0.5616956283124379, 'rsi_os': 30, 'rsi_ob': 68, 'vol_spike': 0.1316868886167606, 'adx_thresh': 11.30568211541141, 'atr_min_pct': 0.028928221019685653, 'atr_max_pct': 0.06097273289562671, 'tp_mult': 2.96358361456359, 'tsl_mult': 0.051931501869553344, 'strategy': 'breakout', 'time_stop': 94, 'use_sma': True, 'use_atr': True, 'use_adx': False, 'use_ema': True, 'use_spike': False, 'rsi_required': False, 'edge_k': 1.5162265213196242, 'edge_cap': 0.8680888504902734, 'bull_strategy': 'mean_reversion', 'bull_bb_std_mult': 1.7987402913350776, 'bull_rsi_os': 42, 'bull_rsi_ob': 57, 'bull_adx_thresh': 6.962690201334709, 'bull_atr_min_pct': 0.011866273119834115, 'bull_atr_max_pct': 0.03382786757189448, 'bull_tp_mult': 2.9227136111881613, 'bull_tsl_mult': 0.8896973690618954, 'bull_time_stop': 111, 'bull_use_sma': False, 'bull_use_ema': True, 'bull_use_atr': False, 'bull_use_adx': True, 'bull_use_spike': False, 'bull_rsi_required': False, 'bear_strategy': 'mean_reversion', 'bear_bb_std_mult': 1.5865993649711179, 'bear_rsi_os': 49, 'bear_rsi_ob': 65, 'bear_adx_thresh': 8.866753368774193, 'bear_atr_min_pct': 0.013792998720275958, 'bear_atr_max_pct': 0.12804860892030095, 'bear_tp_mult': 2.8154933112504206, 'bear_tsl_mult': 0.8746835616600992, 'bear_time_stop': 84, 'bear_use_sma': False, 'bear_use_ema': True, 'bear_use_atr': True, 'bear_use_adx': False, 'bear_use_spike': False, 'bear_rsi_required': False, 'sideways_strategy': 'mean_reversion', 'sideways_bb_std_mult': 3.3951371584334957, 'sideways_rsi_os': 39, 'sideways_rsi_ob': 64, 'sideways_adx_thresh': 26.15697691059975, 'sideways_atr_min_pct': 0.0053105569079948105, 'sideways_atr_max_pct': 0.08297409272661176, 'sideways_tp_mult': 2.3941962835074997, 'sideways_tsl_mult': 0.8423791018201428, 'sideways_time_stop': 109, 'sideways_use_sma': True, 'sideways_use_ema': True, 'sideways_use_atr': False, 'sideways_use_adx': False, 'sideways_use_spike': True, 'sideways_rsi_required': False}.
[I 2025-08-31 11:24:45,945] Trial 731 finished with values: [-1000000000.0, 1000000000.0] and parameters: {'p_sma': 34, 'p_std': 16, 'p_atr': 27, 'p_adx': 21, 'rsi_period': 32, 'ema1': 6, 'ema2': 14, 'slip_atr_k': 0.017114655412855666, 'slip_spread_k': 0.5495655609874904, 'spread_hl_frac': 0.01914907706463429, 'bb_std_mult': 3.316567386508347, 'rsi_os': 30, 'rsi_ob': 84, 'vol_spike': 0.15977444390869722, 'adx_thresh': 10.694545553572173, 'atr_min_pct': 0.0222252588123953, 'atr_max_pct': 0.053529831349633086, 'tp_mult': 1.0129554284540832, 'tsl_mult': 0.05329223556224252, 'strategy': 'breakout', 'time_stop': 255, 'use_sma': True, 'use_atr': True, 'use_adx': False, 'use_ema': True, 'use_spike': False, 'rsi_required': False, 'edge_k': 1.5169435626899013, 'edge_cap': 0.8694987946138545, 'bull_strategy': 'mean_reversion', 'bull_bb_std_mult': 2.5850457676529444, 'bull_rsi_os': 41, 'bull_rsi_ob': 91, 'bull_adx_thresh': 27.18437463896807, 'bull_atr_min_pct': 0.014264480030562588, 'bull_atr_max_pct': 0.034606592047898684, 'bull_tp_mult': 2.9997452310704302, 'bull_tsl_mult': 0.9983674771345223, 'bull_time_stop': 204, 'bull_use_sma': False, 'bull_use_ema': True, 'bull_use_atr': False, 'bull_use_adx': True, 'bull_use_spike': False, 'bull_rsi_required': False, 'bear_strategy': 'mean_reversion', 'bear_bb_std_mult': 1.5821189935087854, 'bear_rsi_os': 51, 'bear_rsi_ob': 54, 'bear_adx_thresh': 22.931357079220437, 'bear_atr_min_pct': 0.012894180094865353, 'bear_atr_max_pct': 0.0653744135200998, 'bear_tp_mult': 2.7697462545935414, 'bear_tsl_mult': 0.9077992709735293, 'bear_time_stop': 94, 'bear_use_sma': False, 'bear_use_ema': True, 'bear_use_atr': True, 'bear_use_adx': False, 'bear_use_spike': False, 'bear_rsi_required': False, 'sideways_strategy': 'mean_reversion', 'sideways_bb_std_mult': 0.9824288796470392, 'sideways_rsi_os': 39, 'sideways_rsi_ob': 68, 'sideways_adx_thresh': 32.06853912044871, 'sideways_atr_min_pct': 0.005208801616247292, 'sideways_atr_max_pct': 0.05296160127460939, 'sideways_tp_mult': 1.5526832633295689, 'sideways_tsl_mult': 0.16045505611580752, 'sideways_time_stop': 80, 'sideways_use_sma': True, 'sideways_use_ema': True, 'sideways_use_atr': False, 'sideways_use_adx': False, 'sideways_use_spike': True, 'sideways_rsi_required': False}.
[I 2025-08-31 11:25:19,644] Trial 736 finished with values: [-1000000000.0, 1000000000.0] and parameters: {'p_sma': 33, 'p_std': 25, 'p_atr': 28, 'p_adx': 11, 'rsi_period': 37, 'ema1': 16, 'ema2': 20, 'slip_atr_k': 0.12999193285015792, 'slip_spread_k': 0.726652435494419, 'spread_hl_frac': 0.021408592612133563, 'bb_std_mult': 0.7155963296289762, 'rsi_os': 46, 'rsi_ob': 84, 'vol_spike': 0.008457939233366685, 'adx_thresh': 17.140377535543482, 'atr_min_pct': 0.02115752855679576, 'atr_max_pct': 0.06765589840226366, 'tp_mult': 1.3874782845529814, 'tsl_mult': 0.12749716655637983, 'strategy': 'breakout', 'time_stop': 41, 'use_sma': True, 'use_atr': True, 'use_adx': False, 'use_ema': True, 'use_spike': False, 'rsi_required': False, 'edge_k': 0.5478780116372027, 'edge_cap': 0.9356650694899721, 'bull_strategy': 'mean_reversion', 'bull_bb_std_mult': 2.729635782078209, 'bull_rsi_os': 44, 'bull_rsi_ob': 63, 'bull_adx_thresh': 29.12342864952113, 'bull_atr_min_pct': 0.01903186831361291, 'bull_atr_max_pct': 0.03244338078440666, 'bull_tp_mult': 2.8640125103765244, 'bull_tsl_mult': 0.277340589169926, 'bull_time_stop': 42, 'bull_use_sma': False, 'bull_use_ema': True, 'bull_use_atr': False, 'bull_use_adx': True, 'bull_use_spike': False, 'bull_rsi_required': False, 'bear_strategy': 'mean_reversion', 'bear_bb_std_mult': 1.4165486289010172, 'bear_rsi_os': 52, 'bear_rsi_ob': 53, 'bear_adx_thresh': 11.120270156314527, 'bear_atr_min_pct': 0.01151090900803992, 'bear_atr_max_pct': 0.03437874693969495, 'bear_tp_mult': 2.7679839720584942, 'bear_tsl_mult': 0.8462596652385264, 'bear_time_stop': 175, 'bear_use_sma': False, 'bear_use_ema': False, 'bear_use_atr': False, 'bear_use_adx': False, 'bear_use_spike': True, 'bear_rsi_required': False, 'sideways_strategy': 'mean_reversion', 'sideways_bb_std_mult': 3.5120269027346263, 'sideways_rsi_os': 43, 'sideways_rsi_ob': 68, 'sideways_adx_thresh': 27.910499420539608, 'sideways_atr_min_pct': 0.0007964564663218762, 'sideways_atr_max_pct': 0.11230682012197389, 'sideways_tp_mult': 1.5464117015539374, 'sideways_tsl_mult': 0.9963610170015411, 'sideways_time_stop': 65, 'sideways_use_sma': True, 'sideways_use_ema': True, 'sideways_use_atr': True, 'sideways_use_adx': False, 'sideways_use_spike': True, 'sideways_rsi_required': False}.
[I 2025-08-31 11:25:19,904] Trial 734 finished with values: [-1000000000.0, 1000000000.0] and parameters: {'p_sma': 30, 'p_std': 46, 'p_atr': 28, 'p_adx': 22, 'rsi_period': 38, 'ema1': 6, 'ema2': 21, 'slip_atr_k': 0.09825813380427666, 'slip_spread_k': 0.5510628709511889, 'spread_hl_frac': 0.02351035023486621, 'bb_std_mult': 1.7890849412210736, 'rsi_os': 30, 'rsi_ob': 81, 'vol_spike': 0.0756052721374187, 'adx_thresh': 11.428843405981226, 'atr_min_pct': 0.016328000377189844, 'atr_max_pct': 0.06213095584096103, 'tp_mult': 2.859066312141389, 'tsl_mult': 0.07688702034186294, 'strategy': 'breakout', 'time_stop': 40, 'use_sma': True, 'use_atr': True, 'use_adx': False, 'use_ema': True, 'use_spike': False, 'rsi_required': False, 'edge_k': 0.5422390615589638, 'edge_cap': 0.8120972287212526, 'bull_strategy': 'mean_reversion', 'bull_bb_std_mult': 1.8926080243661627, 'bull_rsi_os': 43, 'bull_rsi_ob': 61, 'bull_adx_thresh': 27.363841797649474, 'bull_atr_min_pct': 0.01914482582931423, 'bull_atr_max_pct': 0.033591119161229484, 'bull_tp_mult': 2.0383986986835003, 'bull_tsl_mult': 0.20177016547485885, 'bull_time_stop': 50, 'bull_use_sma': False, 'bull_use_ema': True, 'bull_use_atr': False, 'bull_use_adx': True, 'bull_use_spike': False, 'bull_rsi_required': False, 'bear_strategy': 'mean_reversion', 'bear_bb_std_mult': 2.8030966718935977, 'bear_rsi_os': 16, 'bear_rsi_ob': 53, 'bear_adx_thresh': 10.504438354479346, 'bear_atr_min_pct': 0.0220340086823595, 'bear_atr_max_pct': 0.12929787001243517, 'bear_tp_mult': 1.2151615587289337, 'bear_tsl_mult': 0.4919431002492224, 'bear_time_stop': 85, 'bear_use_sma': False, 'bear_use_ema': True, 'bear_use_atr': True, 'bear_use_adx': False, 'bear_use_spike': False, 'bear_rsi_required': False, 'sideways_strategy': 'mean_reversion', 'sideways_bb_std_mult': 0.790724853561581, 'sideways_rsi_os': 39, 'sideways_rsi_ob': 68, 'sideways_adx_thresh': 29.06685847818335, 'sideways_atr_min_pct': 0.029092016591141835, 'sideways_atr_max_pct': 0.0983163234096015, 'sideways_tp_mult': 1.5487127152420999, 'sideways_tsl_mult': 0.2463292841824462, 'sideways_time_stop': 17, 'sideways_use_sma': True, 'sideways_use_ema': True, 'sideways_use_atr': True, 'sideways_use_adx': False, 'sideways_use_spike': True, 'sideways_rsi_required': False}.
[I 2025-08-31 11:25:20,048] Trial 735 finished with values: [-1000000000.0, 1000000000.0] and parameters: {'p_sma': 30, 'p_std': 45, 'p_atr': 28, 'p_adx': 22, 'rsi_period': 38, 'ema1': 5, 'ema2': 52, 'slip_atr_k': 0.20343689429346024, 'slip_spread_k': 0.4121714447527725, 'spread_hl_frac': 0.021506726359636918, 'bb_std_mult': 3.3070734775360524, 'rsi_os': 30, 'rsi_ob': 84, 'vol_spike': 0.16459242323112896, 'adx_thresh': 11.371143151929502, 'atr_min_pct': 0.012231148017345227, 'atr_max_pct': 0.0680581541949084, 'tp_mult': 2.861352042953378, 'tsl_mult': 0.12696047782819017, 'strategy': 'breakout', 'time_stop': 79, 'use_sma': True, 'use_atr': True, 'use_adx': False, 'use_ema': True, 'use_spike': False, 'rsi_required': False, 'edge_k': 0.5505507959684148, 'edge_cap': 0.7096370430418949, 'bull_strategy': 'mean_reversion', 'bull_bb_std_mult': 0.742146491664601, 'bull_rsi_os': 44, 'bull_rsi_ob': 63, 'bull_adx_thresh': 27.234612676469773, 'bull_atr_min_pct': 0.013001102570997881, 'bull_atr_max_pct': 0.1103924876969064, 'bull_tp_mult': 2.866016348073277, 'bull_tsl_mult': 0.27626276861489724, 'bull_time_stop': 45, 'bull_use_sma': False, 'bull_use_ema': True, 'bull_use_atr': False, 'bull_use_adx': True, 'bull_use_spike': False, 'bull_rsi_required': False, 'bear_strategy': 'mean_reversion', 'bear_bb_std_mult': 2.6098471211172387, 'bear_rsi_os': 52, 'bear_rsi_ob': 81, 'bear_adx_thresh': 9.420065619453101, 'bear_atr_min_pct': 0.007642862109404796, 'bear_atr_max_pct': 0.1350775608375245, 'bear_tp_mult': 2.769572769944137, 'bear_tsl_mult': 0.49467848996551966, 'bear_time_stop': 153, 'bear_use_sma': False, 'bear_use_ema': False, 'bear_use_atr': False, 'bear_use_adx': False, 'bear_use_spike': True, 'bear_rsi_required': False, 'sideways_strategy': 'mean_reversion', 'sideways_bb_std_mult': 0.8217516404212305, 'sideways_rsi_os': 16, 'sideways_rsi_ob': 68, 'sideways_adx_thresh': 27.832815395937565, 'sideways_atr_min_pct': 0.013342034257274281, 'sideways_atr_max_pct': 0.1113533061124842, 'sideways_tp_mult': 1.546216342981773, 'sideways_tsl_mult': 0.9964098375994634, 'sideways_time_stop': 134, 'sideways_use_sma': True, 'sideways_use_ema': True, 'sideways_use_atr': True, 'sideways_use_adx': False, 'sideways_use_spike': True, 'sideways_rsi_required': False}.
[I 2025-08-31 11:25:20,063] Trial 737 finished with values: [-1000000000.0, 1000000000.0] and parameters: {'p_sma': 30, 'p_std': 25, 'p_atr': 28, 'p_adx': 27, 'rsi_period': 37, 'ema1': 5, 'ema2': 19, 'slip_atr_k': 0.023666126910121415, 'slip_spread_k': 0.4074930914676593, 'spread_hl_frac': 0.021255807291183485, 'bb_std_mult': 0.7116739815189158, 'rsi_os': 34, 'rsi_ob': 47, 'vol_spike': 0.1076707556426955, 'adx_thresh': 11.50891081370446, 'atr_min_pct': 0.016485979392889875, 'atr_max_pct': 0.10332190691421021, 'tp_mult': 1.242584131983055, 'tsl_mult': 0.12705961034023297, 'strategy': 'breakout', 'time_stop': 80, 'use_sma': True, 'use_atr': True, 'use_adx': False, 'use_ema': True, 'use_spike': False, 'rsi_required': False, 'edge_k': 0.4599592315820792, 'edge_cap': 0.801165661522032, 'bull_strategy': 'mean_reversion', 'bull_bb_std_mult': 3.0811343402159563, 'bull_rsi_os': 43, 'bull_rsi_ob': 62, 'bull_adx_thresh': 29.23685036971651, 'bull_atr_min_pct': 0.01529311478964732, 'bull_atr_max_pct': 0.11025235772970536, 'bull_tp_mult': 2.881934675749203, 'bull_tsl_mult': 0.3965029443545477, 'bull_time_stop': 219, 'bull_use_sma': False, 'bull_use_ema': True, 'bull_use_atr': False, 'bull_use_adx': True, 'bull_use_spike': False, 'bull_rsi_required': False, 'bear_strategy': 'mean_reversion', 'bear_bb_std_mult': 1.5064932921857361, 'bear_rsi_os': 36, 'bear_rsi_ob': 53, 'bear_adx_thresh': 26.81180181773827, 'bear_atr_min_pct': 0.022018341571180614, 'bear_atr_max_pct': 0.03372796369501896, 'bear_tp_mult': 2.6530047402534285, 'bear_tsl_mult': 0.5319604734453178, 'bear_time_stop': 153, 'bear_use_sma': False, 'bear_use_ema': False, 'bear_use_atr': False, 'bear_use_adx': False, 'bear_use_spike': True, 'bear_rsi_required': False, 'sideways_strategy': 'mean_reversion', 'sideways_bb_std_mult': 0.9706658402041806, 'sideways_rsi_os': 49, 'sideways_rsi_ob': 62, 'sideways_adx_thresh': 29.161642583370643, 'sideways_atr_min_pct': 0.011382593121733744, 'sideways_atr_max_pct': 0.11154922499916138, 'sideways_tp_mult': 1.551839714922465, 'sideways_tsl_mult': 0.876772471699162, 'sideways_time_stop': 175, 'sideways_use_sma': True, 'sideways_use_ema': True, 'sideways_use_atr': True, 'sideways_use_adx': False, 'sideways_use_spike': True, 'sideways_rsi_required': False}.
