[I 2025-08-31 11:25:53,412] Trial 738 finished with values: [-1000000000.0, 1000000000.0] and parameters: {'p_sma': 28, 'p_std': 13, 'p_atr': 28, 'p_adx': 22, 'rsi_period': 37, 'ema1': 5, 'ema2': 19, 'slip_atr_k': 0.09436273806532786, 'slip_spread_k': 0.4074624144087219, 'spread_hl_frac': 0.023476871578704823, 'bb_std_mult': 0.6684141310379759, 'rsi_os': 34, 'rsi_ob': 59, 'vol_spike': 0.07653271292131636, 'adx_thresh': 11.517609101275818, 'atr_min_pct': 0.004076093771500143, 'atr_max_pct': 0.07602457393310821, 'tp_mult': 2.8598196060042174, 'tsl_mult': 0.09746554043266269, 'strategy': 'breakout', 'time_stop': 105, 'use_sma': True, 'use_atr': True, 'use_adx': False, 'use_ema': True, 'use_spike': False, 'rsi_required': False, 'edge_k': 1.5633484083193268, 'edge_cap': 0.776102327183594, 'bull_strategy': 'mean_reversion', 'bull_bb_std_mult': 1.953160500313565, 'bull_rsi_os': 11, 'bull_rsi_ob': 66, 'bull_adx_thresh': 26.7356990449438, 'bull_atr_min_pct': 0.012821715781060727, 'bull_atr_max_pct': 0.11012807118419923, 'bull_tp_mult': 2.8828878922754315, 'bull_tsl_mult': 0.20314657214350418, 'bull_time_stop': 107, 'bull_use_sma': False, 'bull_use_ema': True, 'bull_use_atr': False, 'bull_use_adx': True, 'bull_use_spike': False, 'bull_rsi_required': False, 'bear_strategy': 'mean_reversion', 'bear_bb_std_mult': 1.5033662658663864, 'bear_rsi_os': 18, 'bear_rsi_ob': 55, 'bear_adx_thresh': 10.55770881720583, 'bear_atr_min_pct': 0.010315034756615268, 'bear_atr_max_pct': 0.1448534734350935, 'bear_tp_mult': 2.1466405882756447, 'bear_tsl_mult': 0.5318895347283621, 'bear_time_stop': 273, 'bear_use_sma': False, 'bear_use_ema': False, 'bear_use_atr': True, 'bear_use_adx': False, 'bear_use_spike': True, 'bear_rsi_required': False, 'sideways_strategy': 'mean_reversion', 'sideways_bb_std_mult': 0.5014222467044462, 'sideways_rsi_os': 25, 'sideways_rsi_ob': 65, 'sideways_adx_thresh': 27.06528035688977, 'sideways_atr_min_pct': 0.011528049332720586, 'sideways_atr_max_pct': 0.10184004738405589, 'sideways_tp_mult': 2.62808500908059, 'sideways_tsl_mult': 0.8797688683684817, 'sideways_time_stop': 188, 'sideways_use_sma': True, 'sideways_use_ema': True, 'sideways_use_atr': True, 'sideways_use_adx': False, 'sideways_use_spike': True, 'sideways_rsi_required': False}.
[I 2025-08-31 11:25:53,631] Trial 740 finished with values: [-1000000000.0, 1000000000.0] and parameters: {'p_sma': 41, 'p_std': 12, 'p_atr': 14, 'p_adx': 30, 'rsi_period': 51, 'ema1': 30, 'ema2': 34, 'slip_atr_k': 0.02339956912750779, 'slip_spread_k': 0.4807173259624353, 'spread_hl_frac': 0.020297133898331307, 'bb_std_mult': 3.1500775622036015, 'rsi_os': 34, 'rsi_ob': 67, 'vol_spike': 0.10701623903764501, 'adx_thresh': 22.2935916056259, 'atr_min_pct': 0.0030864500486841116, 'atr_max_pct': 0.12709916306713573, 'tp_mult': 1.790061417352079, 'tsl_mult': 0.16364097590350193, 'strategy': 'breakout', 'time_stop': 273, 'use_sma': True, 'use_atr': True, 'use_adx': False, 'use_ema': True, 'use_spike': False, 'rsi_required': False, 'edge_k': 0.4902857824429947, 'edge_cap': 0.7927337806309406, 'bull_strategy': 'mean_reversion', 'bull_bb_std_mult': 1.9665600654241189, 'bull_rsi_os': 41, 'bull_rsi_ob': 66, 'bull_adx_thresh': 26.51669217707974, 'bull_atr_min_pct': 0.011430264340485935, 'bull_atr_max_pct': 0.02805148138631239, 'bull_tp_mult': 2.9182592933481857, 'bull_tsl_mult': 0.40077569961755566, 'bull_time_stop': 141, 'bull_use_sma': False, 'bull_use_ema': False, 'bull_use_atr': False, 'bull_use_adx': False, 'bull_use_spike': False, 'bull_rsi_required': False, 'bear_strategy': 'mean_reversion', 'bear_bb_std_mult': 3.1873111189679197, 'bear_rsi_os': 35, 'bear_rsi_ob': 94, 'bear_adx_thresh': 21.76191377017444, 'bear_atr_min_pct': 0.009760684403712309, 'bear_atr_max_pct': 0.14473984417028624, 'bear_tp_mult': 2.6497827981796194, 'bear_tsl_mult': 0.9631952389589038, 'bear_time_stop': 272, 'bear_use_sma': True, 'bear_use_ema': False, 'bear_use_atr': True, 'bear_use_adx': True, 'bear_use_spike': True, 'bear_rsi_required': False, 'sideways_strategy': 'mean_reversion', 'sideways_bb_std_mult': 1.8860733431172625, 'sideways_rsi_os': 9, 'sideways_rsi_ob': 62, 'sideways_adx_thresh': 9.829607209879631, 'sideways_atr_min_pct': 0.01786321979951635, 'sideways_atr_max_pct': 0.10180337580977303, 'sideways_tp_mult': 2.2733662786649993, 'sideways_tsl_mult': 0.8802079581909501, 'sideways_time_stop': 149, 'sideways_use_sma': True, 'sideways_use_ema': True, 'sideways_use_atr': False, 'sideways_use_adx': True, 'sideways_use_spike': True, 'sideways_rsi_required': True}.
[I 2025-08-31 11:25:54,010] Trial 739 finished with values: [-1000000000.0, 1000000000.0] and parameters: {'p_sma': 28, 'p_std': 13, 'p_atr': 29, 'p_adx': 12, 'rsi_period': 9, 'ema1': 30, 'ema2': 19, 'slip_atr_k': 0.20219353829605258, 'slip_spread_k': 0.9964464853104381, 'spread_hl_frac': 0.02141159257875452, 'bb_std_mult': 0.6457061510870032, 'rsi_os': 31, 'rsi_ob': 86, 'vol_spike': 0.10594551849389361, 'adx_thresh': 21.90080562894427, 'atr_min_pct': 0.0025872085245719732, 'atr_max_pct': 0.0753617081499103, 'tp_mult': 1.459089137645421, 'tsl_mult': 0.09652014255270808, 'strategy': 'breakout', 'time_stop': 83, 'use_sma': True, 'use_atr': True, 'use_adx': False, 'use_ema': True, 'use_spike': False, 'rsi_required': False, 'edge_k': 0.47415078471208083, 'edge_cap': 0.7075576848956013, 'bull_strategy': 'mean_reversion', 'bull_bb_std_mult': 1.978555599556772, 'bull_rsi_os': 11, 'bull_rsi_ob': 65, 'bull_adx_thresh': 26.511707704702154, 'bull_atr_min_pct': 0.011449215753567426, 'bull_atr_max_pct': 0.028839137981310155, 'bull_tp_mult': 1.9259814239731832, 'bull_tsl_mult': 0.298334708975538, 'bull_time_stop': 31, 'bull_use_sma': False, 'bull_use_ema': True, 'bull_use_atr': False, 'bull_use_adx': True, 'bull_use_spike': False, 'bull_rsi_required': False, 'bear_strategy': 'mean_reversion', 'bear_bb_std_mult': 1.7409811262825856, 'bear_rsi_os': 53, 'bear_rsi_ob': 55, 'bear_adx_thresh': 19.431217403807654, 'bear_atr_min_pct': 0.008602228060927744, 'bear_atr_max_pct': 0.03888359757934318, 'bear_tp_mult': 2.268134961629811, 'bear_tsl_mult': 0.8714070336479998, 'bear_time_stop': 105, 'bear_use_sma': True, 'bear_use_ema': False, 'bear_use_atr': False, 'bear_use_adx': False, 'bear_use_spike': True, 'bear_rsi_required': False, 'sideways_strategy': 'mean_reversion', 'sideways_bb_std_mult': 1.7453056732962284, 'sideways_rsi_os': 40, 'sideways_rsi_ob': 62, 'sideways_adx_thresh': 27.033239801058116, 'sideways_atr_min_pct': 0.024882927091923385, 'sideways_atr_max_pct': 0.09033415817048655, 'sideways_tp_mult': 1.451966635482441, 'sideways_tsl_mult': 0.877505886435357, 'sideways_time_stop': 135, 'sideways_use_sma': True, 'sideways_use_ema': True, 'sideways_use_atr': False, 'sideways_use_adx': True, 'sideways_use_spike': True, 'sideways_rsi_required': True}.
[I 2025-08-31 11:25:54,092] Trial 741 finished with values: [-1000000000.0, 1000000000.0] and parameters: {'p_sma': 37, 'p_std': 14, 'p_atr': 14, 'p_adx': 16, 'rsi_period': 35, 'ema1': 5, 'ema2': 48, 'slip_atr_k': 0.044817527009428926, 'slip_spread_k': 0.48972658844740996, 'spread_hl_frac': 0.023481312150172004, 'bb_std_mult': 0.6366380597814332, 'rsi_os': 26, 'rsi_ob': 59, 'vol_spike': 0.08640863687284087, 'adx_thresh': 18.044955629766548, 'atr_min_pct': 0.002408717310386872, 'atr_max_pct': 0.05868620343912237, 'tp_mult': 1.7858636574033566, 'tsl_mult': 0.09579059336605444, 'strategy': 'breakout', 'time_stop': 106, 'use_sma': True, 'use_atr': True, 'use_adx': False, 'use_ema': True, 'use_spike': False, 'rsi_required': False, 'edge_k': 1.6200616952870162, 'edge_cap': 0.7544189761595815, 'bull_strategy': 'mean_reversion', 'bull_bb_std_mult': 1.6522508501099695, 'bull_rsi_os': 41, 'bull_rsi_ob': 65, 'bull_adx_thresh': 26.69820854180226, 'bull_atr_min_pct': 0.011469700574399645, 'bull_atr_max_pct': 0.02765413243309138, 'bull_tp_mult': 2.925585033307829, 'bull_tsl_mult': 0.23600170086263217, 'bull_time_stop': 59, 'bull_use_sma': False, 'bull_use_ema': False, 'bull_use_atr': False, 'bull_use_adx': False, 'bull_use_spike': False, 'bull_rsi_required': False, 'bear_strategy': 'mean_reversion', 'bear_bb_std_mult': 1.747695420904292, 'bear_rsi_os': 53, 'bear_rsi_ob': 71, 'bear_adx_thresh': 23.857220999928167, 'bear_atr_min_pct': 0.008649701146653086, 'bear_atr_max_pct': 0.13635199119433342, 'bear_tp_mult': 2.261759422917668, 'bear_tsl_mult': 0.9688994394834076, 'bear_time_stop': 271, 'bear_use_sma': True, 'bear_use_ema': False, 'bear_use_atr': True, 'bear_use_adx': True, 'bear_use_spike': True, 'bear_rsi_required': False, 'sideways_strategy': 'mean_reversion', 'sideways_bb_std_mult': 3.0276603008343157, 'sideways_rsi_os': 40, 'sideways_rsi_ob': 64, 'sideways_adx_thresh': 27.16153753024224, 'sideways_atr_min_pct': 0.009103855328163006, 'sideways_atr_max_pct': 0.1020048080167083, 'sideways_tp_mult': 1.464589835280735, 'sideways_tsl_mult': 0.8509120432532338, 'sideways_time_stop': 150, 'sideways_use_sma': True, 'sideways_use_ema': True, 'sideways_use_atr': False, 'sideways_use_adx': True, 'sideways_use_spike': True, 'sideways_rsi_required': True}.
[I 2025-08-31 11:25:55,111] Trial 745 finished with values: [-1000000000.0, 1000000000.0] and parameters: {'p_sma': 36, 'p_std': 59, 'p_atr': 29, 'p_adx': 20, 'rsi_period': 34, 'ema1': 25, 'ema2': 46, 'slip_atr_k': 0.03302048862412285, 'slip_spread_k': 0.4293637031128486, 'spread_hl_frac': 0.009536330993400816, 'bb_std_mult': 0.5548979987499129, 'rsi_os': 28, 'rsi_ob': 81, 'vol_spike': 0.143520399827674, 'adx_thresh': 12.282596367222935, 'atr_min_pct': 0.021797852797038775, 'atr_max_pct': 0.012054576723372956, 'tp_mult': 2.935212218147655, 'tsl_mult': 0.9100157882000988, 'strategy': 'breakout', 'time_stop': 237, 'use_sma': True, 'use_atr': True, 'use_adx': False, 'use_ema': True, 'use_spike': False, 'rsi_required': False, 'edge_k': 1.4196365700539064, 'edge_cap': 0.46654931062311655, 'bull_strategy': 'mean_reversion', 'bull_bb_std_mult': 1.3557934131705762, 'bull_rsi_os': 5, 'bull_rsi_ob': 60, 'bull_adx_thresh': 25.78888577463683, 'bull_atr_min_pct': 0.008843996484736806, 'bull_atr_max_pct': 0.0935776305663731, 'bull_tp_mult': 2.3346233043797615, 'bull_tsl_mult': 0.2587708016559649, 'bull_time_stop': 52, 'bull_use_sma': False, 'bull_use_ema': True, 'bull_use_atr': False, 'bull_use_adx': True, 'bull_use_spike': False, 'bull_rsi_required': True, 'bear_strategy': 'mean_reversion', 'bear_bb_std_mult': 0.7509303983586149, 'bear_rsi_os': 50, 'bear_rsi_ob': 76, 'bear_adx_thresh': 30.58769420759146, 'bear_atr_min_pct': 0.006045212426600589, 'bear_atr_max_pct': 0.13901251147986277, 'bear_tp_mult': 2.5535030936329877, 'bear_tsl_mult': 0.9363563946695789, 'bear_time_stop': 218, 'bear_use_sma': False, 'bear_use_ema': False, 'bear_use_atr': True, 'bear_use_adx': False, 'bear_use_spike': True, 'bear_rsi_required': False, 'sideways_strategy': 'mean_reversion', 'sideways_bb_std_mult': 1.2283044507127734, 'sideways_rsi_os': 22, 'sideways_rsi_ob': 61, 'sideways_adx_thresh': 26.081406437872246, 'sideways_atr_min_pct': 0.02026594508555451, 'sideways_atr_max_pct': 0.0510251661077336, 'sideways_tp_mult': 1.60897873573499, 'sideways_tsl_mult': 0.9144361957581392, 'sideways_time_stop': 159, 'sideways_use_sma': False, 'sideways_use_ema': True, 'sideways_use_atr': False, 'sideways_use_adx': False, 'sideways_use_spike': False, 'sideways_rsi_required': False}.
[I 2025-08-31 11:26:27,363] Trial 744 finished with values: [-1000000000.0, 1000000000.0] and parameters: {'p_sma': 37, 'p_std': 56, 'p_atr': 29, 'p_adx': 20, 'rsi_period': 35, 'ema1': 5, 'ema2': 11, 'slip_atr_k': 0.03143352597236841, 'slip_spread_k': 0.49324018265483227, 'spread_hl_frac': 0.022795953280202765, 'bb_std_mult': 0.8982811179723257, 'rsi_os': 28, 'rsi_ob': 88, 'vol_spike': 0.08434595364261585, 'adx_thresh': 15.562488729948434, 'atr_min_pct': 0.021788327960256103, 'atr_max_pct': 0.05791277533864451, 'tp_mult': 1.8702562976353034, 'tsl_mult': 0.08252398109798012, 'strategy': 'breakout', 'time_stop': 90, 'use_sma': True, 'use_atr': True, 'use_adx': False, 'use_ema': True, 'use_spike': False, 'rsi_required': False, 'edge_k': 1.6199150122856325, 'edge_cap': 0.4686225566588823, 'bull_strategy': 'mean_reversion', 'bull_bb_std_mult': 1.621495119892193, 'bull_rsi_os': 28, 'bull_rsi_ob': 62, 'bull_adx_thresh': 27.81585439525027, 'bull_atr_min_pct': 0.011912580876483359, 'bull_atr_max_pct': 0.038081853670133496, 'bull_tp_mult': 1.011313007614553, 'bull_tsl_mult': 0.23385178753886307, 'bull_time_stop': 53, 'bull_use_sma': False, 'bull_use_ema': True, 'bull_use_atr': False, 'bull_use_adx': False, 'bull_use_spike': False, 'bull_rsi_required': True, 'bear_strategy': 'mean_reversion', 'bear_bb_std_mult': 1.4333812551338192, 'bear_rsi_os': 53, 'bear_rsi_ob': 82, 'bear_adx_thresh': 11.568206938655848, 'bear_atr_min_pct': 0.027463873692135158, 'bear_atr_max_pct': 0.13563695811714968, 'bear_tp_mult': 2.5593706621730794, 'bear_tsl_mult': 0.8846475405349478, 'bear_time_stop': 93, 'bear_use_sma': False, 'bear_use_ema': False, 'bear_use_atr': True, 'bear_use_adx': True, 'bear_use_spike': True, 'bear_rsi_required': False, 'sideways_strategy': 'mean_reversion', 'sideways_bb_std_mult': 1.0574032042217, 'sideways_rsi_os': 42, 'sideways_rsi_ob': 61, 'sideways_adx_thresh': 25.91868129174156, 'sideways_atr_min_pct': 0.02331324005235868, 'sideways_atr_max_pct': 0.1062581190013729, 'sideways_tp_mult': 1.6092154292339957, 'sideways_tsl_mult': 0.8483544448955034, 'sideways_time_stop': 217, 'sideways_use_sma': False, 'sideways_use_ema': True, 'sideways_use_atr': False, 'sideways_use_adx': False, 'sideways_use_spike': False, 'sideways_rsi_required': False}.
[I 2025-08-31 11:26:27,545] Trial 743 finished with values: [-1000000000.0, 1000000000.0] and parameters: {'p_sma': 36, 'p_std': 14, 'p_atr': 29, 'p_adx': 20, 'rsi_period': 34, 'ema1': 25, 'ema2': 46, 'slip_atr_k': 0.1601338751238785, 'slip_spread_k': 0.9955696040546941, 'spread_hl_frac': 0.022380401671767327, 'bb_std_mult': 0.8805327932332462, 'rsi_os': 26, 'rsi_ob': 82, 'vol_spike': 0.08894394334662584, 'adx_thresh': 12.183290176601009, 'atr_min_pct': 0.023167083986295495, 'atr_max_pct': 0.05809273006728284, 'tp_mult': 2.4875596889605998, 'tsl_mult': 0.3088980013553231, 'strategy': 'breakout', 'time_stop': 88, 'use_sma': True, 'use_atr': True, 'use_adx': False, 'use_ema': True, 'use_spike': False, 'rsi_required': False, 'edge_k': 1.3786371298507047, 'edge_cap': 0.6790732042585077, 'bull_strategy': 'mean_reversion', 'bull_bb_std_mult': 1.654306933441108, 'bull_rsi_os': 5, 'bull_rsi_ob': 62, 'bull_adx_thresh': 16.054187706897835, 'bull_atr_min_pct': 0.011946566618378647, 'bull_atr_max_pct': 0.12437864222608891, 'bull_tp_mult': 2.9321908187222125, 'bull_tsl_mult': 0.23362454522633766, 'bull_time_stop': 60, 'bull_use_sma': False, 'bull_use_ema': True, 'bull_use_atr': False, 'bull_use_adx': True, 'bull_use_spike': False, 'bull_rsi_required': True, 'bear_strategy': 'mean_reversion', 'bear_bb_std_mult': 0.8554260632371897, 'bear_rsi_os': 53, 'bear_rsi_ob': 76, 'bear_adx_thresh': 11.690454534987648, 'bear_atr_min_pct': 0.008267450141908106, 'bear_atr_max_pct': 0.13600167353675843, 'bear_tp_mult': 2.674729875842454, 'bear_tsl_mult': 0.9330821377288713, 'bear_time_stop': 78, 'bear_use_sma': True, 'bear_use_ema': False, 'bear_use_atr': True, 'bear_use_adx': False, 'bear_use_spike': True, 'bear_rsi_required': False, 'sideways_strategy': 'mean_reversion', 'sideways_bb_std_mult': 1.7428511120045083, 'sideways_rsi_os': 40, 'sideways_rsi_ob': 72, 'sideways_adx_thresh': 26.461285755608113, 'sideways_atr_min_pct': 0.02036711149373366, 'sideways_atr_max_pct': 0.09169325318010753, 'sideways_tp_mult': 1.6132102113610833, 'sideways_tsl_mult': 0.8512629523954244, 'sideways_time_stop': 157, 'sideways_use_sma': False, 'sideways_use_ema': True, 'sideways_use_atr': False, 'sideways_use_adx': True, 'sideways_use_spike': False, 'sideways_rsi_required': True}.
[I 2025-08-31 11:26:27,711] Trial 742 finished with values: [-1000000000.0, 1000000000.0] and parameters: {'p_sma': 49, 'p_std': 14, 'p_atr': 14, 'p_adx': 30, 'rsi_period': 35, 'ema1': 30, 'ema2': 11, 'slip_atr_k': 0.04341575535769862, 'slip_spread_k': 0.4880283722128783, 'spread_hl_frac': 0.03520289914357114, 'bb_std_mult': 0.8699907664890529, 'rsi_os': 28, 'rsi_ob': 82, 'vol_spike': 0.1433742039674662, 'adx_thresh': 9.764709537606251, 'atr_min_pct': 0.023266195801654805, 'atr_max_pct': 0.13090480523177941, 'tp_mult': 1.786809390505471, 'tsl_mult': 0.09561983873078597, 'strategy': 'breakout', 'time_stop': 280, 'use_sma': True, 'use_atr': True, 'use_adx': False, 'use_ema': True, 'use_spike': False, 'rsi_required': False, 'edge_k': 1.616801651954984, 'edge_cap': 0.4065258642705409, 'bull_strategy': 'mean_reversion', 'bull_bb_std_mult': 1.99319675745347, 'bull_rsi_os': 6, 'bull_rsi_ob': 62, 'bull_adx_thresh': 15.451694038783694, 'bull_atr_min_pct': 0.01157582929686842, 'bull_atr_max_pct': 0.1264962392560919, 'bull_tp_mult': 1.918110177500333, 'bull_tsl_mult': 0.23433149392404662, 'bull_time_stop': 228, 'bull_use_sma': False, 'bull_use_ema': False, 'bull_use_atr': False, 'bull_use_adx': False, 'bull_use_spike': False, 'bull_rsi_required': True, 'bear_strategy': 'mean_reversion', 'bear_bb_std_mult': 1.7468217435364504, 'bear_rsi_os': 53, 'bear_rsi_ob': 71, 'bear_adx_thresh': 19.176342777716382, 'bear_atr_min_pct': 0.008697121290097705, 'bear_atr_max_pct': 0.09084250374206986, 'bear_tp_mult': 2.661908499540216, 'bear_tsl_mult': 0.9647058213668395, 'bear_time_stop': 108, 'bear_use_sma': True, 'bear_use_ema': False, 'bear_use_atr': True, 'bear_use_adx': True, 'bear_use_spike': True, 'bear_rsi_required': False, 'sideways_strategy': 'mean_reversion', 'sideways_bb_std_mult': 1.786029409378522, 'sideways_rsi_os': 40, 'sideways_rsi_ob': 62, 'sideways_adx_thresh': 26.572106941029272, 'sideways_atr_min_pct': 0.016373631421997815, 'sideways_atr_max_pct': 0.036047985218883916, 'sideways_tp_mult': 1.6056645649888268, 'sideways_tsl_mult': 0.480994393642163, 'sideways_time_stop': 218, 'sideways_use_sma': True, 'sideways_use_ema': True, 'sideways_use_atr': False, 'sideways_use_adx': True, 'sideways_use_spike': False, 'sideways_rsi_required': True}.
[I 2025-08-31 11:26:28,931] Trial 746 finished with values: [-1000000000.0, 1000000000.0] and parameters: {'p_sma': 32, 'p_std': 48, 'p_atr': 10, 'p_adx': 14, 'rsi_period': 32, 'ema1': 6, 'ema2': 51, 'slip_atr_k': 0.011446532497345036, 'slip_spread_k': 0.9517989384709558, 'spread_hl_frac': 0.045133412871527126, 'bb_std_mult': 0.8884267159183579, 'rsi_os': 28, 'rsi_ob': 62, 'vol_spike': 0.26380325126869597, 'adx_thresh': 9.784217610647753, 'atr_min_pct': 0.020601513067289082, 'atr_max_pct': 0.051621828743609946, 'tp_mult': 2.281935605841175, 'tsl_mult': 0.4147132326180126, 'strategy': 'breakout', 'time_stop': 88, 'use_sma': True, 'use_atr': True, 'use_adx': False, 'use_ema': True, 'use_spike': False, 'rsi_required': False, 'edge_k': 1.490934756858747, 'edge_cap': 0.686214571746376, 'bull_strategy': 'mean_reversion', 'bull_bb_std_mult': 2.193000314201577, 'bull_rsi_os': 30, 'bull_rsi_ob': 62, 'bull_adx_thresh': 16.131356063961043, 'bull_atr_min_pct': 0.020439870322478862, 'bull_atr_max_pct': 0.10039400002126228, 'bull_tp_mult': 1.5280622688172532, 'bull_tsl_mult': 0.6666242693365659, 'bull_time_stop': 35, 'bull_use_sma': False, 'bull_use_ema': True, 'bull_use_atr': False, 'bull_use_adx': True, 'bull_use_spike': False, 'bull_rsi_required': True, 'bear_strategy': 'mean_reversion', 'bear_bb_std_mult': 1.427692362872437, 'bear_rsi_os': 9, 'bear_rsi_ob': 49, 'bear_adx_thresh': 8.633878759002926, 'bear_atr_min_pct': 0.02794030527348834, 'bear_atr_max_pct': 0.13529402062214285, 'bear_tp_mult': 2.6583723539505404, 'bear_tsl_mult': 0.8832005394886869, 'bear_time_stop': 93, 'bear_use_sma': False, 'bear_use_ema': False, 'bear_use_atr': True, 'bear_use_adx': False, 'bear_use_spike': True, 'bear_rsi_required': False, 'sideways_strategy': 'mean_reversion', 'sideways_bb_std_mult': 1.0596306665634683, 'sideways_rsi_os': 41, 'sideways_rsi_ob': 60, 'sideways_adx_thresh': 24.175479402538336, 'sideways_atr_min_pct': 0.006084683343771283, 'sideways_atr_max_pct': 0.09393323267721307, 'sideways_tp_mult': 2.7474127115008056, 'sideways_tsl_mult': 0.8472450066607062, 'sideways_time_stop': 233, 'sideways_use_sma': True, 'sideways_use_ema': True, 'sideways_use_atr': False, 'sideways_use_adx': False, 'sideways_use_spike': False, 'sideways_rsi_required': False}.
