[I 2025-08-31 11:29:24,431] Trial 763 finished with values: [-1000000000.0, 1000000000.0] and parameters: {'p_sma': 33, 'p_std': 9, 'p_atr': 30, 'p_adx': 22, 'rsi_period': 34, 'ema1': 9, 'ema2': 43, 'slip_atr_k': 0.11337439495979161, 'slip_spread_k': 0.43740816160413276, 'spread_hl_frac': 0.021247548783289136, 'bb_std_mult': 3.477224720349513, 'rsi_os': 31, 'rsi_ob': 81, 'vol_spike': 0.11487037799265076, 'adx_thresh': 9.724382268366272, 'atr_min_pct': 0.01407625804019346, 'atr_max_pct': 0.1498357997079769, 'tp_mult': 2.923787188749331, 'tsl_mult': 0.10237416257118763, 'strategy': 'breakout', 'time_stop': 70, 'use_sma': True, 'use_atr': True, 'use_adx': False, 'use_ema': True, 'use_spike': False, 'rsi_required': False, 'edge_k': 1.5229698538023184, 'edge_cap': 0.6655389290973661, 'bull_strategy': 'mean_reversion', 'bull_bb_std_mult': 2.9030460173277057, 'bull_rsi_os': 42, 'bull_rsi_ob': 58, 'bull_adx_thresh': 28.94265269596273, 'bull_atr_min_pct': 0.01226088760706758, 'bull_atr_max_pct': 0.017543610402236932, 'bull_tp_mult': 2.797536346382845, 'bull_tsl_mult': 0.97462989408023, 'bull_time_stop': 273, 'bull_use_sma': False, 'bull_use_ema': True, 'bull_use_atr': False, 'bull_use_adx': True, 'bull_use_spike': False, 'bull_rsi_required': False, 'bear_strategy': 'mean_reversion', 'bear_bb_std_mult': 1.6326199605083052, 'bear_rsi_os': 52, 'bear_rsi_ob': 55, 'bear_adx_thresh': 12.7943480513233, 'bear_atr_min_pct': 0.007034740396065985, 'bear_atr_max_pct': 0.12783343901565977, 'bear_tp_mult': 2.6901003514417394, 'bear_tsl_mult': 0.45735982804613584, 'bear_time_stop': 98, 'bear_use_sma': False, 'bear_use_ema': False, 'bear_use_atr': True, 'bear_use_adx': False, 'bear_use_spike': True, 'bear_rsi_required': False, 'sideways_strategy': 'mean_reversion', 'sideways_bb_std_mult': 3.5969136451740815, 'sideways_rsi_os': 39, 'sideways_rsi_ob': 62, 'sideways_adx_thresh': 10.813212258464958, 'sideways_atr_min_pct': 0.022537534729510627, 'sideways_atr_max_pct': 0.13636957191232507, 'sideways_tp_mult': 2.8525045715985318, 'sideways_tsl_mult': 0.6348533486395638, 'sideways_time_stop': 169, 'sideways_use_sma': True, 'sideways_use_ema': True, 'sideways_use_atr': False, 'sideways_use_adx': False, 'sideways_use_spike': True, 'sideways_rsi_required': False}.
[I 2025-08-31 11:29:24,574] Trial 764 finished with values: [-1000000000.0, 1000000000.0] and parameters: {'p_sma': 38, 'p_std': 21, 'p_atr': 28, 'p_adx': 20, 'rsi_period': 34, 'ema1': 5, 'ema2': 53, 'slip_atr_k': 0.02759898571791715, 'slip_spread_k': 0.46688690024868074, 'spread_hl_frac': 0.021513561145323185, 'bb_std_mult': 0.5473085791659478, 'rsi_os': 33, 'rsi_ob': 84, 'vol_spike': 0.038226694959045224, 'adx_thresh': 29.747536973080468, 'atr_min_pct': 0.02289687418557528, 'atr_max_pct': 0.06005625082220224, 'tp_mult': 1.3468027161828544, 'tsl_mult': 0.08331903189478886, 'strategy': 'breakout', 'time_stop': 69, 'use_sma': True, 'use_atr': True, 'use_adx': False, 'use_ema': True, 'use_spike': False, 'rsi_required': False, 'edge_k': 1.504507190692767, 'edge_cap': 0.7559029887982442, 'bull_strategy': 'mean_reversion', 'bull_bb_std_mult': 2.7570228522794293, 'bull_rsi_os': 13, 'bull_rsi_ob': 52, 'bull_adx_thresh': 24.855653482761152, 'bull_atr_min_pct': 0.012181443237021179, 'bull_atr_max_pct': 0.1458867592892933, 'bull_tp_mult': 2.276930854953007, 'bull_tsl_mult': 0.1777066594481747, 'bull_time_stop': 52, 'bull_use_sma': False, 'bull_use_ema': True, 'bull_use_atr': False, 'bull_use_adx': True, 'bull_use_spike': False, 'bull_rsi_required': False, 'bear_strategy': 'mean_reversion', 'bear_bb_std_mult': 1.4722489792166145, 'bear_rsi_os': 52, 'bear_rsi_ob': 53, 'bear_adx_thresh': 27.412586590639993, 'bear_atr_min_pct': 0.007072874990610137, 'bear_atr_max_pct': 0.09952831850862515, 'bear_tp_mult': 2.691509501467216, 'bear_tsl_mult': 0.9116794026063229, 'bear_time_stop': 286, 'bear_use_sma': False, 'bear_use_ema': False, 'bear_use_atr': True, 'bear_use_adx': False, 'bear_use_spike': True, 'bear_rsi_required': False, 'sideways_strategy': 'mean_reversion', 'sideways_bb_std_mult': 0.5554636112969153, 'sideways_rsi_os': 41, 'sideways_rsi_ob': 61, 'sideways_adx_thresh': 27.203245997981295, 'sideways_atr_min_pct': 0.0069292448564668915, 'sideways_atr_max_pct': 0.057374972937672936, 'sideways_tp_mult': 2.5824825046087954, 'sideways_tsl_mult': 0.6487221173364907, 'sideways_time_stop': 179, 'sideways_use_sma': True, 'sideways_use_ema': True, 'sideways_use_atr': False, 'sideways_use_adx': False, 'sideways_use_spike': True, 'sideways_rsi_required': False}.
[I 2025-08-31 11:30:01,751] Trial 770 finished with values: [-1000000000.0, 1000000000.0] and parameters: {'p_sma': 31, 'p_std': 17, 'p_atr': 29, 'p_adx': 12, 'rsi_period': 32, 'ema1': 6, 'ema2': 31, 'slip_atr_k': 0.021912182363979887, 'slip_spread_k': 0.5092793068410564, 'spread_hl_frac': 0.04828704646440204, 'bb_std_mult': 0.5181399919933574, 'rsi_os': 29, 'rsi_ob': 86, 'vol_spike': 0.1392172313921016, 'adx_thresh': 23.871058404193306, 'atr_min_pct': 0.021922572953669766, 'atr_max_pct': 0.06552891334033324, 'tp_mult': 1.902426967109074, 'tsl_mult': 0.004087495481881864, 'strategy': 'breakout', 'time_stop': 290, 'use_sma': True, 'use_atr': True, 'use_adx': False, 'use_ema': True, 'use_spike': False, 'rsi_required': False, 'edge_k': 1.4502781347396252, 'edge_cap': 0.7152416376959669, 'bull_strategy': 'mean_reversion', 'bull_bb_std_mult': 1.847972724463403, 'bull_rsi_os': 40, 'bull_rsi_ob': 61, 'bull_adx_thresh': 26.762160234460108, 'bull_atr_min_pct': 0.013178085634049763, 'bull_atr_max_pct': 0.028570313383473156, 'bull_tp_mult': 2.134657042999061, 'bull_tsl_mult': 0.29472516474608207, 'bull_time_stop': 118, 'bull_use_sma': False, 'bull_use_ema': False, 'bull_use_atr': True, 'bull_use_adx': True, 'bull_use_spike': False, 'bull_rsi_required': False, 'bear_strategy': 'mean_reversion', 'bear_bb_std_mult': 1.6974404374806853, 'bear_rsi_os': 54, 'bear_rsi_ob': 83, 'bear_adx_thresh': 6.06679766468221, 'bear_atr_min_pct': 0.006125441882491088, 'bear_atr_max_pct': 0.04433470450722692, 'bear_tp_mult': 2.752610681016822, 'bear_tsl_mult': 0.9417788048919522, 'bear_time_stop': 170, 'bear_use_sma': False, 'bear_use_ema': False, 'bear_use_atr': False, 'bear_use_adx': False, 'bear_use_spike': True, 'bear_rsi_required': False, 'sideways_strategy': 'mean_reversion', 'sideways_bb_std_mult': 1.0613818562893036, 'sideways_rsi_os': 38, 'sideways_rsi_ob': 53, 'sideways_adx_thresh': 20.529784835831567, 'sideways_atr_min_pct': 0.00581482550561579, 'sideways_atr_max_pct': 0.09651294598983876, 'sideways_tp_mult': 1.5190549857340885, 'sideways_tsl_mult': 0.836572165786158, 'sideways_time_stop': 173, 'sideways_use_sma': True, 'sideways_use_ema': True, 'sideways_use_atr': False, 'sideways_use_adx': False, 'sideways_use_spike': True, 'sideways_rsi_required': False}.
[I 2025-08-31 11:30:01,962] Trial 768 finished with values: [-1000000000.0, 1000000000.0] and parameters: {'p_sma': 13, 'p_std': 23, 'p_atr': 7, 'p_adx': 20, 'rsi_period': 33, 'ema1': 6, 'ema2': 35, 'slip_atr_k': 0.123728379247882, 'slip_spread_k': 0.7923349206335926, 'spread_hl_frac': 0.0380451127358461, 'bb_std_mult': 0.5233741555773473, 'rsi_os': 29, 'rsi_ob': 86, 'vol_spike': 0.25690497726709216, 'adx_thresh': 27.887364995129545, 'atr_min_pct': 0.014124100877208272, 'atr_max_pct': 0.02004460464663732, 'tp_mult': 1.918441661161004, 'tsl_mult': 0.07908131153255558, 'strategy': 'breakout', 'time_stop': 248, 'use_sma': True, 'use_atr': True, 'use_adx': False, 'use_ema': True, 'use_spike': False, 'rsi_required': False, 'edge_k': 1.3673518833574465, 'edge_cap': 0.7088027597281257, 'bull_strategy': 'mean_reversion', 'bull_bb_std_mult': 1.4204107352096518, 'bull_rsi_os': 13, 'bull_rsi_ob': 56, 'bull_adx_thresh': 26.92753356361773, 'bull_atr_min_pct': 0.02945518865974948, 'bull_atr_max_pct': 0.017989431356549526, 'bull_tp_mult': 2.138900268031687, 'bull_tsl_mult': 0.30864384339969825, 'bull_time_stop': 40, 'bull_use_sma': False, 'bull_use_ema': True, 'bull_use_atr': False, 'bull_use_adx': True, 'bull_use_spike': False, 'bull_rsi_required': False, 'bear_strategy': 'mean_reversion', 'bear_bb_std_mult': 1.702170520987794, 'bear_rsi_os': 7, 'bear_rsi_ob': 90, 'bear_adx_thresh': 11.748202327180461, 'bear_atr_min_pct': 0.00981165073296402, 'bear_atr_max_pct': 0.13462496422756115, 'bear_tp_mult': 2.6964996174352343, 'bear_tsl_mult': 0.722508041556932, 'bear_time_stop': 300, 'bear_use_sma': False, 'bear_use_ema': False, 'bear_use_atr': False, 'bear_use_adx': False, 'bear_use_spike': True, 'bear_rsi_required': False, 'sideways_strategy': 'mean_reversion', 'sideways_bb_std_mult': 0.592060453306388, 'sideways_rsi_os': 43, 'sideways_rsi_ob': 60, 'sideways_adx_thresh': 20.36244114605874, 'sideways_atr_min_pct': 0.005922592984984256, 'sideways_atr_max_pct': 0.10547864499289272, 'sideways_tp_mult': 1.5105390134674146, 'sideways_tsl_mult': 0.3305473567003719, 'sideways_time_stop': 170, 'sideways_use_sma': True, 'sideways_use_ema': True, 'sideways_use_atr': False, 'sideways_use_adx': False, 'sideways_use_spike': True, 'sideways_rsi_required': False}.
[I 2025-08-31 11:30:02,080] Trial 767 finished with values: [-1000000000.0, 1000000000.0] and parameters: {'p_sma': 33, 'p_std': 15, 'p_atr': 27, 'p_adx': 20, 'rsi_period': 66, 'ema1': 6, 'ema2': 42, 'slip_atr_k': 0.02180731618011599, 'slip_spread_k': 0.3791450274762065, 'spread_hl_frac': 0.020552856498326937, 'bb_std_mult': 0.5015347165802836, 'rsi_os': 29, 'rsi_ob': 50, 'vol_spike': 0.007000288075063699, 'adx_thresh': 11.633387907020074, 'atr_min_pct': 0.015352722802271516, 'atr_max_pct': 0.12238647402797792, 'tp_mult': 2.3646222178968004, 'tsl_mult': 0.08207415148314362, 'strategy': 'breakout', 'time_stop': 12, 'use_sma': True, 'use_atr': True, 'use_adx': False, 'use_ema': True, 'use_spike': False, 'rsi_required': False, 'edge_k': 0.848908135045942, 'edge_cap': 0.7124111546466213, 'bull_strategy': 'mean_reversion', 'bull_bb_std_mult': 2.4436484193419643, 'bull_rsi_os': 44, 'bull_rsi_ob': 61, 'bull_adx_thresh': 13.964718612091541, 'bull_atr_min_pct': 0.012850145512051464, 'bull_atr_max_pct': 0.0845170855221892, 'bull_tp_mult': 1.455776234587943, 'bull_tsl_mult': 0.5235325533640942, 'bull_time_stop': 273, 'bull_use_sma': False, 'bull_use_ema': True, 'bull_use_atr': False, 'bull_use_adx': True, 'bull_use_spike': False, 'bull_rsi_required': False, 'bear_strategy': 'mean_reversion', 'bear_bb_std_mult': 1.6810772046784548, 'bear_rsi_os': 45, 'bear_rsi_ob': 47, 'bear_adx_thresh': 11.687249071125805, 'bear_atr_min_pct': 0.009798019454057179, 'bear_atr_max_pct': 0.10500015910477406, 'bear_tp_mult': 2.743092481033945, 'bear_tsl_mult': 0.870037989882703, 'bear_time_stop': 97, 'bear_use_sma': False, 'bear_use_ema': False, 'bear_use_atr': False, 'bear_use_adx': False, 'bear_use_spike': True, 'bear_rsi_required': False, 'sideways_strategy': 'mean_reversion', 'sideways_bb_std_mult': 1.228323940574613, 'sideways_rsi_os': 43, 'sideways_rsi_ob': 60, 'sideways_adx_thresh': 23.003944681698588, 'sideways_atr_min_pct': 0.006173475312166096, 'sideways_atr_max_pct': 0.05700497326012512, 'sideways_tp_mult': 1.5263987539683772, 'sideways_tsl_mult': 0.8420184918121708, 'sideways_time_stop': 169, 'sideways_use_sma': True, 'sideways_use_ema': True, 'sideways_use_atr': False, 'sideways_use_adx': False, 'sideways_use_spike': True, 'sideways_rsi_required': False}.
[I 2025-08-31 11:30:02,244] Trial 769 finished with values: [-1000000000.0, 1000000000.0] and parameters: {'p_sma': 13, 'p_std': 16, 'p_atr': 7, 'p_adx': 20, 'rsi_period': 32, 'ema1': 5, 'ema2': 31, 'slip_atr_k': 0.02251360283727461, 'slip_spread_k': 0.5136042400739276, 'spread_hl_frac': 0.04917579767829358, 'bb_std_mult': 0.5147315102011052, 'rsi_os': 34, 'rsi_ob': 84, 'vol_spike': 0.006184711324164843, 'adx_thresh': 11.095615202518916, 'atr_min_pct': 0.02418909512913517, 'atr_max_pct': 0.059949656481664455, 'tp_mult': 1.2972760370603107, 'tsl_mult': 0.13310791139520717, 'strategy': 'breakout', 'time_stop': 85, 'use_sma': True, 'use_atr': True, 'use_adx': False, 'use_ema': True, 'use_spike': False, 'rsi_required': False, 'edge_k': 1.5901159307220047, 'edge_cap': 0.7118150990973252, 'bull_strategy': 'mean_reversion', 'bull_bb_std_mult': 2.3292119728153065, 'bull_rsi_os': 44, 'bull_rsi_ob': 61, 'bull_adx_thresh': 27.04472093817198, 'bull_atr_min_pct': 0.025111064379003303, 'bull_atr_max_pct': 0.013959598054439804, 'bull_tp_mult': 2.97064050030832, 'bull_tsl_mult': 0.521571512776914, 'bull_time_stop': 38, 'bull_use_sma': False, 'bull_use_ema': False, 'bull_use_atr': True, 'bull_use_adx': True, 'bull_use_spike': False, 'bull_rsi_required': False, 'bear_strategy': 'mean_reversion', 'bear_bb_std_mult': 1.544392919842342, 'bear_rsi_os': 50, 'bear_rsi_ob': 47, 'bear_adx_thresh': 11.605001491032956, 'bear_atr_min_pct': 0.022569089984380033, 'bear_atr_max_pct': 0.10565004582994264, 'bear_tp_mult': 1.9717703441752141, 'bear_tsl_mult': 0.9495745449373365, 'bear_time_stop': 103, 'bear_use_sma': False, 'bear_use_ema': False, 'bear_use_atr': False, 'bear_use_adx': False, 'bear_use_spike': True, 'bear_rsi_required': False, 'sideways_strategy': 'mean_reversion', 'sideways_bb_std_mult': 1.2351847575373882, 'sideways_rsi_os': 44, 'sideways_rsi_ob': 60, 'sideways_adx_thresh': 19.994217985670197, 'sideways_atr_min_pct': 0.005833866757810083, 'sideways_atr_max_pct': 0.10577651713354785, 'sideways_tp_mult': 1.5102186004223088, 'sideways_tsl_mult': 0.7220536393850056, 'sideways_time_stop': 177, 'sideways_use_sma': True, 'sideways_use_ema': True, 'sideways_use_atr': False, 'sideways_use_adx': False, 'sideways_use_spike': True, 'sideways_rsi_required': False}.
[I 2025-08-31 11:30:37,170] Trial 771 finished with values: [-1000000000.0, 1000000000.0] and parameters: {'p_sma': 33, 'p_std': 13, 'p_atr': 27, 'p_adx': 20, 'rsi_period': 49, 'ema1': 5, 'ema2': 15, 'slip_atr_k': 0.02195050087603359, 'slip_spread_k': 0.8012496130831825, 'spread_hl_frac': 0.003610692745705791, 'bb_std_mult': 0.6174829368887652, 'rsi_os': 13, 'rsi_ob': 69, 'vol_spike': 0.08243714935433823, 'adx_thresh': 11.684401486374352, 'atr_min_pct': 0.015177887874855477, 'atr_max_pct': 0.07031665322690622, 'tp_mult': 2.0117905288934352, 'tsl_mult': 0.13235077235977985, 'strategy': 'breakout', 'time_stop': 84, 'use_sma': True, 'use_atr': True, 'use_adx': False, 'use_ema': True, 'use_spike': False, 'rsi_required': True, 'edge_k': 1.3645093961472634, 'edge_cap': 0.6999624963638852, 'bull_strategy': 'mean_reversion', 'bull_bb_std_mult': 1.4180938227296327, 'bull_rsi_os': 49, 'bull_rsi_ob': 45, 'bull_adx_thresh': 27.34059472151372, 'bull_atr_min_pct': 0.023447152657107936, 'bull_atr_max_pct': 0.0334903888933559, 'bull_tp_mult': 2.0605157457898793, 'bull_tsl_mult': 0.7186025576301798, 'bull_time_stop': 37, 'bull_use_sma': False, 'bull_use_ema': True, 'bull_use_atr': False, 'bull_use_adx': True, 'bull_use_spike': False, 'bull_rsi_required': False, 'bear_strategy': 'mean_reversion', 'bear_bb_std_mult': 1.3767063492358087, 'bear_rsi_os': 45, 'bear_rsi_ob': 90, 'bear_adx_thresh': 11.780089575615126, 'bear_atr_min_pct': 0.010230949783804375, 'bear_atr_max_pct': 0.13435291033846863, 'bear_tp_mult': 2.5132065275936672, 'bear_tsl_mult': 0.724621035390358, 'bear_time_stop': 104, 'bear_use_sma': False, 'bear_use_ema': True, 'bear_use_atr': True, 'bear_use_adx': False, 'bear_use_spike': False, 'bear_rsi_required': False, 'sideways_strategy': 'breakout', 'sideways_bb_std_mult': 1.2192084277341155, 'sideways_rsi_os': 40, 'sideways_rsi_ob': 61, 'sideways_adx_thresh': 23.482871377788133, 'sideways_atr_min_pct': 0.004985315311114229, 'sideways_atr_max_pct': 0.12418564805764547, 'sideways_tp_mult': 1.4700727857274816, 'sideways_tsl_mult': 0.7122655730367224, 'sideways_time_stop': 154, 'sideways_use_sma': True, 'sideways_use_ema': True, 'sideways_use_atr': True, 'sideways_use_adx': False, 'sideways_use_spike': True, 'sideways_rsi_required': False}.
[I 2025-08-31 11:30:37,958] Trial 774 finished with values: [-1000000000.0, 1000000000.0] and parameters: {'p_sma': 39, 'p_std': 58, 'p_atr': 20, 'p_adx': 21, 'rsi_period': 71, 'ema1': 5, 'ema2': 21, 'slip_atr_k': 0.24969275342908945, 'slip_spread_k': 0.9685559367796921, 'spread_hl_frac': 0.011448286724708837, 'bb_std_mult': 3.058410565673392, 'rsi_os': 35, 'rsi_ob': 89, 'vol_spike': 0.0809988870106875, 'adx_thresh': 26.110778494112562, 'atr_min_pct': 0.02073737156363771, 'atr_max_pct': 0.057517274480210566, 'tp_mult': 2.8523219532315895, 'tsl_mult': 0.14731810846279203, 'strategy': 'breakout', 'time_stop': 92, 'use_sma': True, 'use_atr': True, 'use_adx': True, 'use_ema': True, 'use_spike': True, 'rsi_required': True, 'edge_k': 1.5474347538702182, 'edge_cap': 0.6974260968870449, 'bull_strategy': 'mean_reversion', 'bull_bb_std_mult': 2.0769717423495497, 'bull_rsi_os': 42, 'bull_rsi_ob': 64, 'bull_adx_thresh': 28.178507677431014, 'bull_atr_min_pct': 0.008474679385513221, 'bull_atr_max_pct': 0.03399031505451131, 'bull_tp_mult': 2.9976483498802384, 'bull_tsl_mult': 0.24547826104650616, 'bull_time_stop': 246, 'bull_use_sma': True, 'bull_use_ema': True, 'bull_use_atr': False, 'bull_use_adx': False, 'bull_use_spike': False, 'bull_rsi_required': False, 'bear_strategy': 'mean_reversion', 'bear_bb_std_mult': 1.4167593041556477, 'bear_rsi_os': 55, 'bear_rsi_ob': 54, 'bear_adx_thresh': 16.456812752105385, 'bear_atr_min_pct': 0.002052926900113293, 'bear_atr_max_pct': 0.07527782059783542, 'bear_tp_mult': 2.631109343590294, 'bear_tsl_mult': 0.8882296092065283, 'bear_time_stop': 93, 'bear_use_sma': False, 'bear_use_ema': True, 'bear_use_atr': True, 'bear_use_adx': True, 'bear_use_spike': False, 'bear_rsi_required': False, 'sideways_strategy': 'breakout', 'sideways_bb_std_mult': 0.9641793836231798, 'sideways_rsi_os': 54, 'sideways_rsi_ob': 54, 'sideways_adx_thresh': 26.183705291854395, 'sideways_atr_min_pct': 0.004899354376008026, 'sideways_atr_max_pct': 0.10966986156779678, 'sideways_tp_mult': 1.5854506567888713, 'sideways_tsl_mult': 0.8855238702983097, 'sideways_time_stop': 163, 'sideways_use_sma': False, 'sideways_use_ema': True, 'sideways_use_atr': True, 'sideways_use_adx': False, 'sideways_use_spike': True, 'sideways_rsi_required': False}.
[I 2025-08-31 11:30:38,046] Trial 772 finished with values: [-1000000000.0, 1000000000.0] and parameters: {'p_sma': 50, 'p_std': 7, 'p_atr': 27, 'p_adx': 19, 'rsi_period': 55, 'ema1': 5, 'ema2': 21, 'slip_atr_k': 0.018539833671781168, 'slip_spread_k': 0.48858639506271484, 'spread_hl_frac': 0.04147452806152593, 'bb_std_mult': 0.6186149919179691, 'rsi_os': 27, 'rsi_ob': 54, 'vol_spike': 0.16795688449765403, 'adx_thresh': 5.997716355814438, 'atr_min_pct': 0.02421777129425977, 'atr_max_pct': 0.0584116369868633, 'tp_mult': 2.0012964273250193, 'tsl_mult': 0.14297435941519665, 'strategy': 'breakout', 'time_stop': 86, 'use_sma': True, 'use_atr': True, 'use_adx': True, 'use_ema': True, 'use_spike': False, 'rsi_required': True, 'edge_k': 1.574775368702793, 'edge_cap': 0.6938633224735316, 'bull_strategy': 'mean_reversion', 'bull_bb_std_mult': 1.704434732085334, 'bull_rsi_os': 42, 'bull_rsi_ob': 63, 'bull_adx_thresh': 27.579750656414234, 'bull_atr_min_pct': 0.023463475415828893, 'bull_atr_max_pct': 0.12011374601637878, 'bull_tp_mult': 2.95584744098787, 'bull_tsl_mult': 0.24144191428344086, 'bull_time_stop': 130, 'bull_use_sma': False, 'bull_use_ema': False, 'bull_use_atr': True, 'bull_use_adx': False, 'bull_use_spike': False, 'bull_rsi_required': False, 'bear_strategy': 'mean_reversion', 'bear_bb_std_mult': 2.4076595384160298, 'bear_rsi_os': 50, 'bear_rsi_ob': 66, 'bear_adx_thresh': 10.14818730480555, 'bear_atr_min_pct': 0.02273415667653116, 'bear_atr_max_pct': 0.14077022853033036, 'bear_tp_mult': 1.0601873445489733, 'bear_tsl_mult': 0.33642708090921036, 'bear_time_stop': 103, 'bear_use_sma': False, 'bear_use_ema': True, 'bear_use_atr': True, 'bear_use_adx': True, 'bear_use_spike': False, 'bear_rsi_required': False, 'sideways_strategy': 'breakout', 'sideways_bb_std_mult': 0.7062878414612026, 'sideways_rsi_os': 40, 'sideways_rsi_ob': 95, 'sideways_adx_thresh': 26.021911700932787, 'sideways_atr_min_pct': 0.004934199132741043, 'sideways_atr_max_pct': 0.10394764050360325, 'sideways_tp_mult': 1.5938094086839938, 'sideways_tsl_mult': 0.889410024203562, 'sideways_time_stop': 207, 'sideways_use_sma': False, 'sideways_use_ema': True, 'sideways_use_atr': True, 'sideways_use_adx': False, 'sideways_use_spike': True, 'sideways_rsi_required': False}.
