[I 2025-08-31 11:41:40,907] Trial 848 finished with values: [-1000000000.0, 1000000000.0] and parameters: {'p_sma': 34, 'p_std': 13, 'p_atr': 29, 'p_adx': 21, 'rsi_period': 34, 'ema1': 19, 'ema2': 19, 'slip_atr_k': 0.16357585936032748, 'slip_spread_k': 0.53892232797183, 'spread_hl_frac': 0.01979145645088958, 'bb_std_mult': 0.6309341002562452, 'rsi_os': 30, 'rsi_ob': 79, 'vol_spike': 0.07064329068984368, 'adx_thresh': 27.291096729789917, 'atr_min_pct': 0.0225406912074464, 'atr_max_pct': 0.0822933954393276, 'tp_mult': 2.6467490286411057, 'tsl_mult': 0.03071160156877039, 'strategy': 'breakout', 'time_stop': 88, 'use_sma': True, 'use_atr': True, 'use_adx': True, 'use_ema': True, 'use_spike': True, 'rsi_required': True, 'edge_k': 0.5191881919920177, 'edge_cap': 0.7204145320470432, 'bull_strategy': 'mean_reversion', 'bull_bb_std_mult': 2.102040325841008, 'bull_rsi_os': 40, 'bull_rsi_ob': 64, 'bull_adx_thresh': 28.386487862816413, 'bull_atr_min_pct': 0.012367437090383996, 'bull_atr_max_pct': 0.03430675114465023, 'bull_tp_mult': 2.965742493730927, 'bull_tsl_mult': 0.6362249166629808, 'bull_time_stop': 127, 'bull_use_sma': True, 'bull_use_ema': False, 'bull_use_atr': True, 'bull_use_adx': False, 'bull_use_spike': False, 'bull_rsi_required': True, 'bear_strategy': 'mean_reversion', 'bear_bb_std_mult': 3.493202378942244, 'bear_rsi_os': 49, 'bear_rsi_ob': 52, 'bear_adx_thresh': 10.341795607363146, 'bear_atr_min_pct': 0.012002856537212354, 'bear_atr_max_pct': 0.1377868633608719, 'bear_tp_mult': 1.5062003209932882, 'bear_tsl_mult': 0.8909837235301578, 'bear_time_stop': 99, 'bear_use_sma': True, 'bear_use_ema': True, 'bear_use_atr': False, 'bear_use_adx': True, 'bear_use_spike': False, 'bear_rsi_required': False, 'sideways_strategy': 'breakout', 'sideways_bb_std_mult': 1.095265436741033, 'sideways_rsi_os': 41, 'sideways_rsi_ob': 64, 'sideways_adx_thresh': 27.65647628397574, 'sideways_atr_min_pct': 0.0048913963478362955, 'sideways_atr_max_pct': 0.07339118849899519, 'sideways_tp_mult': 1.6237726360402998, 'sideways_tsl_mult': 0.758739127523794, 'sideways_time_stop': 156, 'sideways_use_sma': False, 'sideways_use_ema': True, 'sideways_use_atr': True, 'sideways_use_adx': True, 'sideways_use_spike': False, 'sideways_rsi_required': False}.
[I 2025-08-31 11:41:41,696] Trial 846 finished with values: [-1000000000.0, 1000000000.0] and parameters: {'p_sma': 34, 'p_std': 12, 'p_atr': 8, 'p_adx': 21, 'rsi_period': 36, 'ema1': 9, 'ema2': 22, 'slip_atr_k': 0.014984757775935834, 'slip_spread_k': 0.4341573186694098, 'spread_hl_frac': 0.021408956464217522, 'bb_std_mult': 0.7628145818636336, 'rsi_os': 30, 'rsi_ob': 90, 'vol_spike': 0.27689863471287907, 'adx_thresh': 27.314352299056637, 'atr_min_pct': 0.02057128522192348, 'atr_max_pct': 0.05291279617354651, 'tp_mult': 2.950160015696692, 'tsl_mult': 0.0999203236181802, 'strategy': 'mean_reversion', 'time_stop': 85, 'use_sma': True, 'use_atr': True, 'use_adx': False, 'use_ema': True, 'use_spike': False, 'rsi_required': False, 'edge_k': 1.4506604324583532, 'edge_cap': 0.6987841938559316, 'bull_strategy': 'mean_reversion', 'bull_bb_std_mult': 1.9587363189781453, 'bull_rsi_os': 23, 'bull_rsi_ob': 93, 'bull_adx_thresh': 27.347629697953817, 'bull_atr_min_pct': 0.012299691071944173, 'bull_atr_max_pct': 0.02951222822496949, 'bull_tp_mult': 2.891832284903914, 'bull_tsl_mult': 0.19113189226852695, 'bull_time_stop': 47, 'bull_use_sma': False, 'bull_use_ema': True, 'bull_use_atr': False, 'bull_use_adx': True, 'bull_use_spike': False, 'bull_rsi_required': False, 'bear_strategy': 'mean_reversion', 'bear_bb_std_mult': 1.5982686974008808, 'bear_rsi_os': 17, 'bear_rsi_ob': 89, 'bear_adx_thresh': 15.635259309064274, 'bear_atr_min_pct': 0.004099424320706431, 'bear_atr_max_pct': 0.08299705270892628, 'bear_tp_mult': 2.654149306878228, 'bear_tsl_mult': 0.6530465217060941, 'bear_time_stop': 101, 'bear_use_sma': False, 'bear_use_ema': False, 'bear_use_atr': False, 'bear_use_adx': False, 'bear_use_spike': True, 'bear_rsi_required': False, 'sideways_strategy': 'mean_reversion', 'sideways_bb_std_mult': 1.135444056566007, 'sideways_rsi_os': 40, 'sideways_rsi_ob': 78, 'sideways_adx_thresh': 25.336487197806925, 'sideways_atr_min_pct': 0.0050656060079534064, 'sideways_atr_max_pct': 0.11071318317822007, 'sideways_tp_mult': 2.434567152893221, 'sideways_tsl_mult': 0.911362419403597, 'sideways_time_stop': 214, 'sideways_use_sma': True, 'sideways_use_ema': True, 'sideways_use_atr': False, 'sideways_use_adx': False, 'sideways_use_spike': True, 'sideways_rsi_required': False}.
[I 2025-08-31 11:41:42,140] Trial 845 finished with values: [-0.03664782975296588, 0.03812373793799114] and parameters: {'p_sma': 34, 'p_std': 12, 'p_atr': 29, 'p_adx': 21, 'rsi_period': 36, 'ema1': 5, 'ema2': 19, 'slip_atr_k': 0.13506972132109948, 'slip_spread_k': 0.5005805065467817, 'spread_hl_frac': 0.020665948765577317, 'bb_std_mult': 0.7650632393997847, 'rsi_os': 30, 'rsi_ob': 79, 'vol_spike': 0.06823304134206165, 'adx_thresh': 27.942185160439664, 'atr_min_pct': 0.02233305881106269, 'atr_max_pct': 0.08316829767331332, 'tp_mult': 2.9328985150306632, 'tsl_mult': 0.032598562816749894, 'strategy': 'mean_reversion', 'time_stop': 56, 'use_sma': True, 'use_atr': True, 'use_adx': False, 'use_ema': True, 'use_spike': False, 'rsi_required': False, 'edge_k': 0.9345077027791293, 'edge_cap': 0.6982952059093, 'bull_strategy': 'mean_reversion', 'bull_bb_std_mult': 1.966635849206995, 'bull_rsi_os': 40, 'bull_rsi_ob': 60, 'bull_adx_thresh': 25.1829041656825, 'bull_atr_min_pct': 0.012834128816713437, 'bull_atr_max_pct': 0.04999188174802973, 'bull_tp_mult': 2.9567238613216182, 'bull_tsl_mult': 0.017144229285878276, 'bull_time_stop': 29, 'bull_use_sma': False, 'bull_use_ema': True, 'bull_use_atr': False, 'bull_use_adx': True, 'bull_use_spike': False, 'bull_rsi_required': False, 'bear_strategy': 'mean_reversion', 'bear_bb_std_mult': 2.3777969495090376, 'bear_rsi_os': 48, 'bear_rsi_ob': 53, 'bear_adx_thresh': 10.219271238446035, 'bear_atr_min_pct': 0.004229354694847325, 'bear_atr_max_pct': 0.11425830441310633, 'bear_tp_mult': 2.658726438525571, 'bear_tsl_mult': 0.6932445789083573, 'bear_time_stop': 102, 'bear_use_sma': False, 'bear_use_ema': False, 'bear_use_atr': False, 'bear_use_adx': False, 'bear_use_spike': True, 'bear_rsi_required': False, 'sideways_strategy': 'mean_reversion', 'sideways_bb_std_mult': 1.127905752465236, 'sideways_rsi_os': 40, 'sideways_rsi_ob': 64, 'sideways_adx_thresh': 18.035900357722433, 'sideways_atr_min_pct': 0.004945260722759889, 'sideways_atr_max_pct': 0.0742314472950973, 'sideways_tp_mult': 1.6159004831302297, 'sideways_tsl_mult': 0.9123171430197332, 'sideways_time_stop': 154, 'sideways_use_sma': True, 'sideways_use_ema': True, 'sideways_use_atr': False, 'sideways_use_adx': False, 'sideways_use_spike': True, 'sideways_rsi_required': False}.
[I 2025-08-31 11:42:22,498] Trial 851 finished with values: [-1000000000.0, 1000000000.0] and parameters: {'p_sma': 36, 'p_std': 10, 'p_atr': 14, 'p_adx': 22, 'rsi_period': 14, 'ema1': 24, 'ema2': 21, 'slip_atr_k': 0.023289884161920224, 'slip_spread_k': 0.49351258676089094, 'spread_hl_frac': 0.018242664756052365, 'bb_std_mult': 0.8325245208444787, 'rsi_os': 32, 'rsi_ob': 90, 'vol_spike': 0.05363996871401884, 'adx_thresh': 11.595261786877694, 'atr_min_pct': 0.028720423152055845, 'atr_max_pct': 0.08454833666734043, 'tp_mult': 2.9673125300288645, 'tsl_mult': 0.13295250747161108, 'strategy': 'breakout', 'time_stop': 93, 'use_sma': True, 'use_atr': True, 'use_adx': False, 'use_ema': True, 'use_spike': True, 'rsi_required': False, 'edge_k': 1.2737149496629838, 'edge_cap': 0.6956956305741216, 'bull_strategy': 'mean_reversion', 'bull_bb_std_mult': 2.1615509963758903, 'bull_rsi_os': 42, 'bull_rsi_ob': 95, 'bull_adx_thresh': 25.397053519566548, 'bull_atr_min_pct': 0.013244390252291498, 'bull_atr_max_pct': 0.014452580946980903, 'bull_tp_mult': 1.790815918269565, 'bull_tsl_mult': 0.40681155711359424, 'bull_time_stop': 30, 'bull_use_sma': True, 'bull_use_ema': True, 'bull_use_atr': True, 'bull_use_adx': True, 'bull_use_spike': False, 'bull_rsi_required': False, 'bear_strategy': 'mean_reversion', 'bear_bb_std_mult': 1.685199869077653, 'bear_rsi_os': 19, 'bear_rsi_ob': 54, 'bear_adx_thresh': 26.85954037635879, 'bear_atr_min_pct': 0.02943724985938942, 'bear_atr_max_pct': 0.11370915771972175, 'bear_tp_mult': 1.8854467167038087, 'bear_tsl_mult': 0.4076966916207669, 'bear_time_stop': 72, 'bear_use_sma': False, 'bear_use_ema': False, 'bear_use_atr': True, 'bear_use_adx': False, 'bear_use_spike': True, 'bear_rsi_required': False, 'sideways_strategy': 'mean_reversion', 'sideways_bb_std_mult': 0.9258590571218184, 'sideways_rsi_os': 43, 'sideways_rsi_ob': 63, 'sideways_adx_thresh': 26.054872900599396, 'sideways_atr_min_pct': 0.012176933696349406, 'sideways_atr_max_pct': 0.0430467285575099, 'sideways_tp_mult': 1.5050179360344185, 'sideways_tsl_mult': 0.326358425576861, 'sideways_time_stop': 171, 'sideways_use_sma': True, 'sideways_use_ema': True, 'sideways_use_atr': False, 'sideways_use_adx': False, 'sideways_use_spike': True, 'sideways_rsi_required': True}.
[I 2025-08-31 11:42:22,956] Trial 850 finished with values: [-1000000000.0, 1000000000.0] and parameters: {'p_sma': 34, 'p_std': 10, 'p_atr': 12, 'p_adx': 22, 'rsi_period': 36, 'ema1': 19, 'ema2': 35, 'slip_atr_k': 0.1884167057499856, 'slip_spread_k': 0.4917391527819489, 'spread_hl_frac': 0.020620022441579493, 'bb_std_mult': 0.807788969564196, 'rsi_os': 32, 'rsi_ob': 87, 'vol_spike': 0.2602827488125818, 'adx_thresh': 11.677620357825536, 'atr_min_pct': 0.028545205539473793, 'atr_max_pct': 0.07628349278190741, 'tp_mult': 1.3256134118212912, 'tsl_mult': 0.10524122211282047, 'strategy': 'breakout', 'time_stop': 203, 'use_sma': True, 'use_atr': True, 'use_adx': False, 'use_ema': True, 'use_spike': False, 'rsi_required': False, 'edge_k': 1.999646378897996, 'edge_cap': 0.6981382891815946, 'bull_strategy': 'mean_reversion', 'bull_bb_std_mult': 2.140564192036286, 'bull_rsi_os': 21, 'bull_rsi_ob': 90, 'bull_adx_thresh': 25.102776233905338, 'bull_atr_min_pct': 0.013057989428625447, 'bull_atr_max_pct': 0.03037878124339598, 'bull_tp_mult': 2.9434302796425733, 'bull_tsl_mult': 0.4187099835592731, 'bull_time_stop': 236, 'bull_use_sma': False, 'bull_use_ema': True, 'bull_use_atr': True, 'bull_use_adx': True, 'bull_use_spike': False, 'bull_rsi_required': False, 'bear_strategy': 'mean_reversion', 'bear_bb_std_mult': 1.6691656609708798, 'bear_rsi_os': 54, 'bear_rsi_ob': 77, 'bear_adx_thresh': 10.963159272371414, 'bear_atr_min_pct': 0.029353815406593785, 'bear_atr_max_pct': 0.13039056356350975, 'bear_tp_mult': 2.6164557381382854, 'bear_tsl_mult': 0.35238019821527755, 'bear_time_stop': 109, 'bear_use_sma': False, 'bear_use_ema': False, 'bear_use_atr': False, 'bear_use_adx': False, 'bear_use_spike': True, 'bear_rsi_required': False, 'sideways_strategy': 'mean_reversion', 'sideways_bb_std_mult': 1.133664087005524, 'sideways_rsi_os': 23, 'sideways_rsi_ob': 73, 'sideways_adx_thresh': 5.198528014024141, 'sideways_atr_min_pct': 0.01113262459489059, 'sideways_atr_max_pct': 0.11171622422680245, 'sideways_tp_mult': 1.3717849125342558, 'sideways_tsl_mult': 0.31715473356962076, 'sideways_time_stop': 205, 'sideways_use_sma': True, 'sideways_use_ema': True, 'sideways_use_atr': False, 'sideways_use_adx': False, 'sideways_use_spike': True, 'sideways_rsi_required': True}.
[I 2025-08-31 11:42:23,063] Trial 852 finished with values: [-1000000000.0, 1000000000.0] and parameters: {'p_sma': 36, 'p_std': 10, 'p_atr': 28, 'p_adx': 22, 'rsi_period': 12, 'ema1': 26, 'ema2': 35, 'slip_atr_k': 0.022937567087168927, 'slip_spread_k': 0.48365838842786835, 'spread_hl_frac': 0.031112294650609395, 'bb_std_mult': 0.8580057074050771, 'rsi_os': 32, 'rsi_ob': 87, 'vol_spike': 0.05685201780116393, 'adx_thresh': 11.804662462617873, 'atr_min_pct': 0.02173363407061655, 'atr_max_pct': 0.07261629358243127, 'tp_mult': 2.9684718387551148, 'tsl_mult': 0.1350034065754461, 'strategy': 'breakout', 'time_stop': 95, 'use_sma': True, 'use_atr': True, 'use_adx': False, 'use_ema': True, 'use_spike': True, 'rsi_required': False, 'edge_k': 1.5102668720058172, 'edge_cap': 0.6612492825370295, 'bull_strategy': 'mean_reversion', 'bull_bb_std_mult': 2.1426501011572205, 'bull_rsi_os': 42, 'bull_rsi_ob': 62, 'bull_adx_thresh': 23.072050978239396, 'bull_atr_min_pct': 0.013221598700269864, 'bull_atr_max_pct': 0.025199174178082956, 'bull_tp_mult': 2.9298918839515022, 'bull_tsl_mult': 0.8535175346392951, 'bull_time_stop': 237, 'bull_use_sma': True, 'bull_use_ema': True, 'bull_use_atr': True, 'bull_use_adx': True, 'bull_use_spike': False, 'bull_rsi_required': False, 'bear_strategy': 'mean_reversion', 'bear_bb_std_mult': 1.6640981549119884, 'bear_rsi_os': 47, 'bear_rsi_ob': 83, 'bear_adx_thresh': 7.72314497536818, 'bear_atr_min_pct': 0.013515665920727012, 'bear_atr_max_pct': 0.13079168153724507, 'bear_tp_mult': 1.563814474155967, 'bear_tsl_mult': 0.9115257741154938, 'bear_time_stop': 202, 'bear_use_sma': False, 'bear_use_ema': False, 'bear_use_atr': True, 'bear_use_adx': False, 'bear_use_spike': True, 'bear_rsi_required': False, 'sideways_strategy': 'mean_reversion', 'sideways_bb_std_mult': 0.9613113294940586, 'sideways_rsi_os': 23, 'sideways_rsi_ob': 63, 'sideways_adx_thresh': 26.33170908620426, 'sideways_atr_min_pct': 0.022970282951873602, 'sideways_atr_max_pct': 0.09946001912950897, 'sideways_tp_mult': 1.507474165521555, 'sideways_tsl_mult': 0.35083033311754414, 'sideways_time_stop': 174, 'sideways_use_sma': True, 'sideways_use_ema': True, 'sideways_use_atr': False, 'sideways_use_adx': False, 'sideways_use_spike': True, 'sideways_rsi_required': True}.
[I 2025-08-31 11:42:23,074] Trial 849 finished with values: [-1000000000.0, 1000000000.0] and parameters: {'p_sma': 36, 'p_std': 12, 'p_atr': 29, 'p_adx': 22, 'rsi_period': 14, 'ema1': 19, 'ema2': 35, 'slip_atr_k': 0.13542788646982046, 'slip_spread_k': 0.5494138910736346, 'spread_hl_frac': 0.01969178073093284, 'bb_std_mult': 2.0065704138253664, 'rsi_os': 30, 'rsi_ob': 90, 'vol_spike': 0.05202227396934972, 'adx_thresh': 11.77185924514745, 'atr_min_pct': 0.028723643035180033, 'atr_max_pct': 0.07773570887684036, 'tp_mult': 1.3127935397047796, 'tsl_mult': 0.10236243505656745, 'strategy': 'breakout', 'time_stop': 85, 'use_sma': True, 'use_atr': True, 'use_adx': True, 'use_ema': True, 'use_spike': True, 'rsi_required': True, 'edge_k': 1.456704242995475, 'edge_cap': 0.9260238593237259, 'bull_strategy': 'mean_reversion', 'bull_bb_std_mult': 2.0814480847356176, 'bull_rsi_os': 42, 'bull_rsi_ob': 60, 'bull_adx_thresh': 27.397511092997686, 'bull_atr_min_pct': 0.012297533505921129, 'bull_atr_max_pct': 0.03462286836735168, 'bull_tp_mult': 2.9654997397654053, 'bull_tsl_mult': 0.01719702236546944, 'bull_time_stop': 28, 'bull_use_sma': True, 'bull_use_ema': True, 'bull_use_atr': True, 'bull_use_adx': True, 'bull_use_spike': False, 'bull_rsi_required': False, 'bear_strategy': 'mean_reversion', 'bear_bb_std_mult': 1.6510197519158425, 'bear_rsi_os': 54, 'bear_rsi_ob': 54, 'bear_adx_thresh': 11.108845581486882, 'bear_atr_min_pct': 0.013428007124889039, 'bear_atr_max_pct': 0.13678850121767613, 'bear_tp_mult': 2.6040949134381446, 'bear_tsl_mult': 0.3523546554060204, 'bear_time_stop': 200, 'bear_use_sma': True, 'bear_use_ema': False, 'bear_use_atr': False, 'bear_use_adx': False, 'bear_use_spike': False, 'bear_rsi_required': False, 'sideways_strategy': 'breakout', 'sideways_bb_std_mult': 0.9423573812297334, 'sideways_rsi_os': 23, 'sideways_rsi_ob': 63, 'sideways_adx_thresh': 28.096977398598185, 'sideways_atr_min_pct': 0.011017157907501494, 'sideways_atr_max_pct': 0.112625568221475, 'sideways_tp_mult': 2.7083097895909525, 'sideways_tsl_mult': 0.3318409677425185, 'sideways_time_stop': 170, 'sideways_use_sma': False, 'sideways_use_ema': True, 'sideways_use_atr': True, 'sideways_use_adx': True, 'sideways_use_spike': True, 'sideways_rsi_required': False}.
[I 2025-08-31 11:42:59,967] Trial 855 finished with values: [-1000000000.0, 1000000000.0] and parameters: {'p_sma': 35, 'p_std': 55, 'p_atr': 9, 'p_adx': 23, 'rsi_period': 66, 'ema1': 25, 'ema2': 25, 'slip_atr_k': 0.0962230321307378, 'slip_spread_k': 0.9119788388066095, 'spread_hl_frac': 0.022006165501095118, 'bb_std_mult': 3.0081647559295117, 'rsi_os': 32, 'rsi_ob': 78, 'vol_spike': 0.18094414722533975, 'adx_thresh': 5.854720273725668, 'atr_min_pct': 0.02279139518381956, 'atr_max_pct': 0.09256253663459311, 'tp_mult': 1.7407524562657704, 'tsl_mult': 0.9576094612078925, 'strategy': 'breakout', 'time_stop': 80, 'use_sma': True, 'use_atr': True, 'use_adx': False, 'use_ema': True, 'use_spike': False, 'rsi_required': False, 'edge_k': 0.6602362813120024, 'edge_cap': 0.7488488629887963, 'bull_strategy': 'mean_reversion', 'bull_bb_std_mult': 2.0570661864504296, 'bull_rsi_os': 36, 'bull_rsi_ob': 62, 'bull_adx_thresh': 26.581735421727227, 'bull_atr_min_pct': 0.029902697786705568, 'bull_atr_max_pct': 0.03258737351463799, 'bull_tp_mult': 2.815007863500762, 'bull_tsl_mult': 0.2880537865321877, 'bull_time_stop': 212, 'bull_use_sma': False, 'bull_use_ema': False, 'bull_use_atr': False, 'bull_use_adx': False, 'bull_use_spike': False, 'bull_rsi_required': True, 'bear_strategy': 'mean_reversion', 'bear_bb_std_mult': 1.016734460873915, 'bear_rsi_os': 10, 'bear_rsi_ob': 68, 'bear_adx_thresh': 30.008832364635374, 'bear_atr_min_pct': 0.0016130264797130167, 'bear_atr_max_pct': 0.07461643120524787, 'bear_tp_mult': 1.355569279601875, 'bear_tsl_mult': 0.7591452444770894, 'bear_time_stop': 84, 'bear_use_sma': False, 'bear_use_ema': True, 'bear_use_atr': True, 'bear_use_adx': True, 'bear_use_spike': True, 'bear_rsi_required': False, 'sideways_strategy': 'mean_reversion', 'sideways_bb_std_mult': 2.329455662917406, 'sideways_rsi_os': 39, 'sideways_rsi_ob': 61, 'sideways_adx_thresh': 26.790685084298982, 'sideways_atr_min_pct': 0.007975030490332753, 'sideways_atr_max_pct': 0.10565312725852603, 'sideways_tp_mult': 2.060744813563923, 'sideways_tsl_mult': 0.6246878253486299, 'sideways_time_stop': 99, 'sideways_use_sma': True, 'sideways_use_ema': True, 'sideways_use_atr': False, 'sideways_use_adx': False, 'sideways_use_spike': False, 'sideways_rsi_required': False}.
[I 2025-08-31 11:43:00,165] Trial 856 finished with values: [-1000000000.0, 1000000000.0] and parameters: {'p_sma': 35, 'p_std': 19, 'p_atr': 28, 'p_adx': 16, 'rsi_period': 33, 'ema1': 20, 'ema2': 50, 'slip_atr_k': 0.01526211764572703, 'slip_spread_k': 0.45014704892777213, 'spread_hl_frac': 0.021997135510935625, 'bb_std_mult': 0.6277533854842131, 'rsi_os': 32, 'rsi_ob': 79, 'vol_spike': 0.1811356232719714, 'adx_thresh': 14.428030091823924, 'atr_min_pct': 0.022944716468037304, 'atr_max_pct': 0.07418838178816989, 'tp_mult': 1.7543606353109058, 'tsl_mult': 0.07078120759837753, 'strategy': 'breakout', 'time_stop': 276, 'use_sma': True, 'use_atr': True, 'use_adx': False, 'use_ema': True, 'use_spike': False, 'rsi_required': False, 'edge_k': 1.5463621232008966, 'edge_cap': 0.7400560630971049, 'bull_strategy': 'mean_reversion', 'bull_bb_std_mult': 2.0695697281486285, 'bull_rsi_os': 44, 'bull_rsi_ob': 63, 'bull_adx_thresh': 26.456740608090794, 'bull_atr_min_pct': 0.011396819410082068, 'bull_atr_max_pct': 0.020131378942865485, 'bull_tp_mult': 2.8160785711770226, 'bull_tsl_mult': 0.20952176676988896, 'bull_time_stop': 50, 'bull_use_sma': False, 'bull_use_ema': False, 'bull_use_atr': False, 'bull_use_adx': False, 'bull_use_spike': False, 'bull_rsi_required': True, 'bear_strategy': 'mean_reversion', 'bear_bb_std_mult': 1.0254065949180031, 'bear_rsi_os': 6, 'bear_rsi_ob': 65, 'bear_adx_thresh': 8.59555906934459, 'bear_atr_min_pct': 0.006080861925334588, 'bear_atr_max_pct': 0.12659307711046874, 'bear_tp_mult': 2.8761255863379604, 'bear_tsl_mult': 0.22055519912726307, 'bear_time_stop': 82, 'bear_use_sma': False, 'bear_use_ema': True, 'bear_use_atr': True, 'bear_use_adx': True, 'bear_use_spike': True, 'bear_rsi_required': False, 'sideways_strategy': 'mean_reversion', 'sideways_bb_std_mult': 0.746550892106191, 'sideways_rsi_os': 30, 'sideways_rsi_ob': 61, 'sideways_adx_thresh': 26.923219596528387, 'sideways_atr_min_pct': 0.01377212428408319, 'sideways_atr_max_pct': 0.10615921286599767, 'sideways_tp_mult': 2.997553766637332, 'sideways_tsl_mult': 0.8376427986255226, 'sideways_time_stop': 196, 'sideways_use_sma': True, 'sideways_use_ema': True, 'sideways_use_atr': False, 'sideways_use_adx': False, 'sideways_use_spike': False, 'sideways_rsi_required': False}.
