[I 2025-08-31 10:55:58,659] Trial 522 finished with values: [-1000000000.0, 1000000000.0] and parameters: {'p_sma': 45, 'p_std': 22, 'p_atr': 22, 'p_adx': 19, 'rsi_period': 42, 'ema1': 21, 'ema2': 23, 'slip_atr_k': 0.005868366866971112, 'slip_spread_k': 0.3455637782911463, 'spread_hl_frac': 0.024776368998503794, 'bb_std_mult': 1.6750387710654235, 'rsi_os': 35, 'rsi_ob': 80, 'vol_spike': 0.23324272472090607, 'adx_thresh': 8.667647723157195, 'atr_min_pct': 0.015570287003826795, 'atr_max_pct': 0.042979943631246555, 'tp_mult': 2.8194920956643967, 'tsl_mult': 0.14300733833054674, 'strategy': 'mean_reversion', 'time_stop': 257, 'use_sma': False, 'use_atr': True, 'use_adx': False, 'use_ema': True, 'use_spike': False, 'rsi_required': False, 'edge_k': 1.8050715338681969, 'edge_cap': 0.736518896499319, 'bull_strategy': 'breakout', 'bull_bb_std_mult': 0.5003399325476654, 'bull_rsi_os': 30, 'bull_rsi_ob': 50, 'bull_adx_thresh': 12.264256089652454, 'bull_atr_min_pct': 0.029993483441990827, 'bull_atr_max_pct': 0.042961187916240796, 'bull_tp_mult': 2.2645205015035477, 'bull_tsl_mult': 0.08982701272686135, 'bull_time_stop': 165, 'bull_use_sma': False, 'bull_use_ema': False, 'bull_use_atr': False, 'bull_use_adx': False, 'bull_use_spike': True, 'bull_rsi_required': True, 'bear_strategy': 'mean_reversion', 'bear_bb_std_mult': 1.4485564143528553, 'bear_rsi_os': 42, 'bear_rsi_ob': 68, 'bear_adx_thresh': 11.9609491627745, 'bear_atr_min_pct': 0.02502862499803709, 'bear_atr_max_pct': 0.1359712883972958, 'bear_tp_mult': 2.727620307628588, 'bear_tsl_mult': 0.5755391086239809, 'bear_time_stop': 31, 'bear_use_sma': False, 'bear_use_ema': False, 'bear_use_atr': True, 'bear_use_adx': False, 'bear_use_spike': True, 'bear_rsi_required': False, 'sideways_strategy': 'mean_reversion', 'sideways_bb_std_mult': 2.9658353757710008, 'sideways_rsi_os': 38, 'sideways_rsi_ob': 55, 'sideways_adx_thresh': 18.409491261633647, 'sideways_atr_min_pct': 0.017836568715962862, 'sideways_atr_max_pct': 0.017061024549067164, 'sideways_tp_mult': 1.6144116032781644, 'sideways_tsl_mult': 0.20124220321566194, 'sideways_time_stop': 262, 'sideways_use_sma': False, 'sideways_use_ema': False, 'sideways_use_atr': False, 'sideways_use_adx': False, 'sideways_use_spike': False, 'sideways_rsi_required': False}.
[I 2025-08-31 10:55:59,038] Trial 521 finished with values: [-1000000000.0, 1000000000.0] and parameters: {'p_sma': 45, 'p_std': 26, 'p_atr': 22, 'p_adx': 18, 'rsi_period': 42, 'ema1': 23, 'ema2': 59, 'slip_atr_k': 0.005811747084154995, 'slip_spread_k': 0.5827556139050795, 'spread_hl_frac': 0.02460113128432628, 'bb_std_mult': 2.7040433049746255, 'rsi_os': 33, 'rsi_ob': 62, 'vol_spike': 0.24191237303376628, 'adx_thresh': 8.63674429322662, 'atr_min_pct': 0.020886247416647873, 'atr_max_pct': 0.11409452511562121, 'tp_mult': 2.8211151135019263, 'tsl_mult': 0.722078441837516, 'strategy': 'mean_reversion', 'time_stop': 267, 'use_sma': True, 'use_atr': False, 'use_adx': False, 'use_ema': False, 'use_spike': False, 'rsi_required': False, 'edge_k': 0.8959297200661867, 'edge_cap': 0.23033168559047684, 'bull_strategy': 'breakout', 'bull_bb_std_mult': 3.3744142109513993, 'bull_rsi_os': 45, 'bull_rsi_ob': 67, 'bull_adx_thresh': 21.887947299196934, 'bull_atr_min_pct': 0.009810927630628028, 'bull_atr_max_pct': 0.04915214878756448, 'bull_tp_mult': 2.849683879088618, 'bull_tsl_mult': 0.6795892238286954, 'bull_time_stop': 278, 'bull_use_sma': False, 'bull_use_ema': True, 'bull_use_atr': False, 'bull_use_adx': True, 'bull_use_spike': True, 'bull_rsi_required': False, 'bear_strategy': 'breakout', 'bear_bb_std_mult': 1.6858309109122298, 'bear_rsi_os': 40, 'bear_rsi_ob': 54, 'bear_adx_thresh': 27.23637299223129, 'bear_atr_min_pct': 0.025029080381561618, 'bear_atr_max_pct': 0.02669481053533914, 'bear_tp_mult': 2.2859833291036, 'bear_tsl_mult': 0.1117855334745189, 'bear_time_stop': 33, 'bear_use_sma': False, 'bear_use_ema': False, 'bear_use_atr': True, 'bear_use_adx': False, 'bear_use_spike': True, 'bear_rsi_required': True, 'sideways_strategy': 'mean_reversion', 'sideways_bb_std_mult': 2.9424070549648818, 'sideways_rsi_os': 35, 'sideways_rsi_ob': 58, 'sideways_adx_thresh': 15.11014831516582, 'sideways_atr_min_pct': 0.004595139136811708, 'sideways_atr_max_pct': 0.010152315828645479, 'sideways_tp_mult': 1.923181471597191, 'sideways_tsl_mult': 0.16533467625435827, 'sideways_time_stop': 262, 'sideways_use_sma': True, 'sideways_use_ema': False, 'sideways_use_atr': False, 'sideways_use_adx': False, 'sideways_use_spike': True, 'sideways_rsi_required': False}.
[I 2025-08-31 10:55:59,310] Trial 524 finished with values: [-1000000000.0, 1000000000.0] and parameters: {'p_sma': 53, 'p_std': 27, 'p_atr': 23, 'p_adx': 19, 'rsi_period': 42, 'ema1': 21, 'ema2': 59, 'slip_atr_k': 0.020392227871116646, 'slip_spread_k': 0.21644454333199697, 'spread_hl_frac': 0.04885468876460791, 'bb_std_mult': 2.633613350820835, 'rsi_os': 50, 'rsi_ob': 61, 'vol_spike': 0.04687444843422488, 'adx_thresh': 8.741926301382993, 'atr_min_pct': 0.02079889771347674, 'atr_max_pct': 0.04255198912547876, 'tp_mult': 2.832217598436209, 'tsl_mult': 0.022013993422831446, 'strategy': 'mean_reversion', 'time_stop': 28, 'use_sma': False, 'use_atr': True, 'use_adx': False, 'use_ema': True, 'use_spike': False, 'rsi_required': False, 'edge_k': 1.8170372348389514, 'edge_cap': 0.23496298087580222, 'bull_strategy': 'breakout', 'bull_bb_std_mult': 3.5359731410133897, 'bull_rsi_os': 46, 'bull_rsi_ob': 88, 'bull_adx_thresh': 10.788034691689818, 'bull_atr_min_pct': 0.008771642593619337, 'bull_atr_max_pct': 0.04431957664894399, 'bull_tp_mult': 2.8750672414330887, 'bull_tsl_mult': 0.0022899355365168517, 'bull_time_stop': 63, 'bull_use_sma': False, 'bull_use_ema': False, 'bull_use_atr': False, 'bull_use_adx': False, 'bull_use_spike': True, 'bull_rsi_required': True, 'bear_strategy': 'mean_reversion', 'bear_bb_std_mult': 1.4344406028589876, 'bear_rsi_os': 45, 'bear_rsi_ob': 54, 'bear_adx_thresh': 12.083471472286854, 'bear_atr_min_pct': 0.02392725130955945, 'bear_atr_max_pct': 0.1355360528099579, 'bear_tp_mult': 2.6594418291292974, 'bear_tsl_mult': 0.08123287252576389, 'bear_time_stop': 67, 'bear_use_sma': False, 'bear_use_ema': False, 'bear_use_atr': True, 'bear_use_adx': False, 'bear_use_spike': True, 'bear_rsi_required': False, 'sideways_strategy': 'mean_reversion', 'sideways_bb_std_mult': 2.8527751439292293, 'sideways_rsi_os': 35, 'sideways_rsi_ob': 60, 'sideways_adx_thresh': 15.267909372281995, 'sideways_atr_min_pct': 0.016447960266791614, 'sideways_atr_max_pct': 0.014356495962011308, 'sideways_tp_mult': 2.7253962675761, 'sideways_tsl_mult': 0.6924992767225779, 'sideways_time_stop': 261, 'sideways_use_sma': False, 'sideways_use_ema': False, 'sideways_use_atr': False, 'sideways_use_adx': False, 'sideways_use_spike': False, 'sideways_rsi_required': False}.
[I 2025-08-31 10:55:59,724] Trial 527 finished with values: [-1000000000.0, 1000000000.0] and parameters: {'p_sma': 53, 'p_std': 5, 'p_atr': 23, 'p_adx': 21, 'rsi_period': 53, 'ema1': 21, 'ema2': 58, 'slip_atr_k': 0.011941462314062642, 'slip_spread_k': 0.30036227869691934, 'spread_hl_frac': 0.023394600326365794, 'bb_std_mult': 2.5911859024846953, 'rsi_os': 50, 'rsi_ob': 73, 'vol_spike': 0.22388030624752805, 'adx_thresh': 7.956578993099584, 'atr_min_pct': 0.019375627293958524, 'atr_max_pct': 0.04105105169898494, 'tp_mult': 2.911094823618059, 'tsl_mult': 0.39465654831075847, 'strategy': 'mean_reversion', 'time_stop': 164, 'use_sma': False, 'use_atr': False, 'use_adx': False, 'use_ema': False, 'use_spike': False, 'rsi_required': False, 'edge_k': 1.732587510425085, 'edge_cap': 0.17968452135196136, 'bull_strategy': 'breakout', 'bull_bb_std_mult': 3.5389121491929516, 'bull_rsi_os': 16, 'bull_rsi_ob': 76, 'bull_adx_thresh': 11.103524933344627, 'bull_atr_min_pct': 0.002970808006281352, 'bull_atr_max_pct': 0.03662836683793188, 'bull_tp_mult': 2.034414461320153, 'bull_tsl_mult': 0.4303946223676821, 'bull_time_stop': 242, 'bull_use_sma': False, 'bull_use_ema': True, 'bull_use_atr': False, 'bull_use_adx': True, 'bull_use_spike': True, 'bull_rsi_required': False, 'bear_strategy': 'breakout', 'bear_bb_std_mult': 1.2672089956751325, 'bear_rsi_os': 45, 'bear_rsi_ob': 50, 'bear_adx_thresh': 14.196114780555204, 'bear_atr_min_pct': 0.024020834871344612, 'bear_atr_max_pct': 0.14120444144524152, 'bear_tp_mult': 2.66842012809903, 'bear_tsl_mult': 0.09056757423651701, 'bear_time_stop': 45, 'bear_use_sma': True, 'bear_use_ema': False, 'bear_use_atr': False, 'bear_use_adx': True, 'bear_use_spike': True, 'bear_rsi_required': True, 'sideways_strategy': 'mean_reversion', 'sideways_bb_std_mult': 2.5231986764064422, 'sideways_rsi_os': 35, 'sideways_rsi_ob': 59, 'sideways_adx_thresh': 34.99005582089636, 'sideways_atr_min_pct': 0.005824883363203018, 'sideways_atr_max_pct': 0.014064319366923522, 'sideways_tp_mult': 2.121275785886907, 'sideways_tsl_mult': 0.8775747193686415, 'sideways_time_stop': 277, 'sideways_use_sma': True, 'sideways_use_ema': False, 'sideways_use_atr': True, 'sideways_use_adx': True, 'sideways_use_spike': True, 'sideways_rsi_required': False}.
[I 2025-08-31 10:56:30,396] Trial 526 finished with values: [-1000000000.0, 1000000000.0] and parameters: {'p_sma': 46, 'p_std': 38, 'p_atr': 23, 'p_adx': 21, 'rsi_period': 8, 'ema1': 23, 'ema2': 37, 'slip_atr_k': 0.18054709046827472, 'slip_spread_k': 0.4789355814882518, 'spread_hl_frac': 0.005656242334298522, 'bb_std_mult': 2.402684687501191, 'rsi_os': 10, 'rsi_ob': 61, 'vol_spike': 0.22470169538442952, 'adx_thresh': 18.17745858349301, 'atr_min_pct': 0.019495139997427906, 'atr_max_pct': 0.04131913662333607, 'tp_mult': 1.6478603674354744, 'tsl_mult': 0.8922037661345443, 'strategy': 'mean_reversion', 'time_stop': 288, 'use_sma': False, 'use_atr': False, 'use_adx': False, 'use_ema': False, 'use_spike': False, 'rsi_required': False, 'edge_k': 1.7291232094052493, 'edge_cap': 0.15501690338603463, 'bull_strategy': 'breakout', 'bull_bb_std_mult': 3.085121234978751, 'bull_rsi_os': 23, 'bull_rsi_ob': 76, 'bull_adx_thresh': 7.516254400718131, 'bull_atr_min_pct': 0.025538957456776402, 'bull_atr_max_pct': 0.03642941475576188, 'bull_tp_mult': 2.884719724710379, 'bull_tsl_mult': 0.5329628155830787, 'bull_time_stop': 300, 'bull_use_sma': False, 'bull_use_ema': True, 'bull_use_atr': False, 'bull_use_adx': True, 'bull_use_spike': True, 'bull_rsi_required': False, 'bear_strategy': 'breakout', 'bear_bb_std_mult': 0.9075797540902748, 'bear_rsi_os': 23, 'bear_rsi_ob': 54, 'bear_adx_thresh': 14.14371651529822, 'bear_atr_min_pct': 0.023307672973902106, 'bear_atr_max_pct': 0.027268368787792582, 'bear_tp_mult': 2.665783827487429, 'bear_tsl_mult': 0.0940581068262856, 'bear_time_stop': 73, 'bear_use_sma': True, 'bear_use_ema': False, 'bear_use_atr': False, 'bear_use_adx': False, 'bear_use_spike': True, 'bear_rsi_required': True, 'sideways_strategy': 'mean_reversion', 'sideways_bb_std_mult': 2.552089163268228, 'sideways_rsi_os': 35, 'sideways_rsi_ob': 59, 'sideways_adx_thresh': 14.84156477217966, 'sideways_atr_min_pct': 0.023751099494388483, 'sideways_atr_max_pct': 0.014172820151537594, 'sideways_tp_mult': 2.1163951153357945, 'sideways_tsl_mult': 0.6587649630195509, 'sideways_time_stop': 255, 'sideways_use_sma': True, 'sideways_use_ema': False, 'sideways_use_atr': True, 'sideways_use_adx': True, 'sideways_use_spike': True, 'sideways_rsi_required': False}.
[I 2025-08-31 10:56:30,434] Trial 525 finished with values: [-1000000000.0, 1000000000.0] and parameters: {'p_sma': 45, 'p_std': 36, 'p_atr': 23, 'p_adx': 19, 'rsi_period': 42, 'ema1': 23, 'ema2': 27, 'slip_atr_k': 0.024807550918635346, 'slip_spread_k': 0.8900737042991742, 'spread_hl_frac': 0.02421001631312115, 'bb_std_mult': 2.608029095428024, 'rsi_os': 35, 'rsi_ob': 73, 'vol_spike': 0.22700845535217296, 'adx_thresh': 7.97703921695329, 'atr_min_pct': 0.023652657142691907, 'atr_max_pct': 0.042507274935623285, 'tp_mult': 1.0187188744980942, 'tsl_mult': 0.7330504197551062, 'strategy': 'mean_reversion', 'time_stop': 187, 'use_sma': False, 'use_atr': False, 'use_adx': False, 'use_ema': False, 'use_spike': False, 'rsi_required': False, 'edge_k': 1.792524786582766, 'edge_cap': 0.7177970342645541, 'bull_strategy': 'breakout', 'bull_bb_std_mult': 3.5397423111939106, 'bull_rsi_os': 30, 'bull_rsi_ob': 88, 'bull_adx_thresh': 10.890727000151529, 'bull_atr_min_pct': 0.025311415670086875, 'bull_atr_max_pct': 0.04246444941386205, 'bull_tp_mult': 2.887975233593334, 'bull_tsl_mult': 0.6306398958749291, 'bull_time_stop': 300, 'bull_use_sma': False, 'bull_use_ema': True, 'bull_use_atr': False, 'bull_use_adx': True, 'bull_use_spike': True, 'bull_rsi_required': False, 'bear_strategy': 'breakout', 'bear_bb_std_mult': 1.4484268273487944, 'bear_rsi_os': 23, 'bear_rsi_ob': 85, 'bear_adx_thresh': 12.076557455870638, 'bear_atr_min_pct': 0.02382504880496384, 'bear_atr_max_pct': 0.09981542306331315, 'bear_tp_mult': 2.6717395737479523, 'bear_tsl_mult': 0.9211094248927407, 'bear_time_stop': 41, 'bear_use_sma': True, 'bear_use_ema': False, 'bear_use_atr': False, 'bear_use_adx': False, 'bear_use_spike': True, 'bear_rsi_required': False, 'sideways_strategy': 'mean_reversion', 'sideways_bb_std_mult': 1.360701268909901, 'sideways_rsi_os': 35, 'sideways_rsi_ob': 60, 'sideways_adx_thresh': 15.166940494886504, 'sideways_atr_min_pct': 0.006507242683688838, 'sideways_atr_max_pct': 0.014392591232588986, 'sideways_tp_mult': 2.7499987504441608, 'sideways_tsl_mult': 0.8854063993676082, 'sideways_time_stop': 260, 'sideways_use_sma': True, 'sideways_use_ema': False, 'sideways_use_atr': True, 'sideways_use_adx': True, 'sideways_use_spike': True, 'sideways_rsi_required': False}.
[I 2025-08-31 10:56:31,758] Trial 528 finished with values: [-0.015298810642534577, 0.0151696815505544] and parameters: {'p_sma': 46, 'p_std': 10, 'p_atr': 7, 'p_adx': 21, 'rsi_period': 40, 'ema1': 17, 'ema2': 43, 'slip_atr_k': 0.01086615494573371, 'slip_spread_k': 0.9487060068650297, 'spread_hl_frac': 0.02364938574163901, 'bb_std_mult': 2.5626379672868644, 'rsi_os': 35, 'rsi_ob': 72, 'vol_spike': 0.22300698063276472, 'adx_thresh': 7.727418257054313, 'atr_min_pct': 0.019254774595514508, 'atr_max_pct': 0.07045869886194545, 'tp_mult': 2.9232576797657477, 'tsl_mult': 0.7022809267051825, 'strategy': 'mean_reversion', 'time_stop': 188, 'use_sma': False, 'use_atr': False, 'use_adx': False, 'use_ema': False, 'use_spike': False, 'rsi_required': False, 'edge_k': 1.7251536932058928, 'edge_cap': 0.9366100110008954, 'bull_strategy': 'breakout', 'bull_bb_std_mult': 1.679302464613742, 'bull_rsi_os': 49, 'bull_rsi_ob': 76, 'bull_adx_thresh': 11.299531446286657, 'bull_atr_min_pct': 0.003907191897763526, 'bull_atr_max_pct': 0.037086241284111116, 'bull_tp_mult': 1.7207885499374298, 'bull_tsl_mult': 0.6256918934647175, 'bull_time_stop': 48, 'bull_use_sma': False, 'bull_use_ema': True, 'bull_use_atr': False, 'bull_use_adx': True, 'bull_use_spike': True, 'bull_rsi_required': False, 'bear_strategy': 'breakout', 'bear_bb_std_mult': 2.9415181535630435, 'bear_rsi_os': 23, 'bear_rsi_ob': 46, 'bear_adx_thresh': 14.085473666453526, 'bear_atr_min_pct': 0.020828392626134694, 'bear_atr_max_pct': 0.02310819858989671, 'bear_tp_mult': 2.8537698507756852, 'bear_tsl_mult': 0.9108254429742062, 'bear_time_stop': 93, 'bear_use_sma': True, 'bear_use_ema': False, 'bear_use_atr': False, 'bear_use_adx': True, 'bear_use_spike': True, 'bear_rsi_required': True, 'sideways_strategy': 'mean_reversion', 'sideways_bb_std_mult': 2.5191055193150955, 'sideways_rsi_os': 37, 'sideways_rsi_ob': 59, 'sideways_adx_thresh': 14.32055576414459, 'sideways_atr_min_pct': 0.0058296193964688155, 'sideways_atr_max_pct': 0.013594075751937787, 'sideways_tp_mult': 2.0108954561317627, 'sideways_tsl_mult': 0.8836814506082089, 'sideways_time_stop': 276, 'sideways_use_sma': True, 'sideways_use_ema': False, 'sideways_use_atr': True, 'sideways_use_adx': True, 'sideways_use_spike': True, 'sideways_rsi_required': False}.
[I 2025-08-31 10:56:32,789] Trial 529 finished with values: [-1000000000.0, 1000000000.0] and parameters: {'p_sma': 27, 'p_std': 36, 'p_atr': 28, 'p_adx': 20, 'rsi_period': 8, 'ema1': 17, 'ema2': 38, 'slip_atr_k': 3.91829132964978e-05, 'slip_spread_k': 0.8763264543107592, 'spread_hl_frac': 0.013297600483128294, 'bb_std_mult': 2.386183276365819, 'rsi_os': 10, 'rsi_ob': 92, 'vol_spike': 0.22346904283107166, 'adx_thresh': 32.677189982833475, 'atr_min_pct': 0.010644885226345881, 'atr_max_pct': 0.07339569227399012, 'tp_mult': 2.417391950311054, 'tsl_mult': 0.7030314551834691, 'strategy': 'mean_reversion', 'time_stop': 295, 'use_sma': False, 'use_atr': False, 'use_adx': False, 'use_ema': False, 'use_spike': False, 'rsi_required': False, 'edge_k': 1.7220764520626595, 'edge_cap': 0.1532162818089206, 'bull_strategy': 'breakout', 'bull_bb_std_mult': 1.6507170171964787, 'bull_rsi_os': 44, 'bull_rsi_ob': 47, 'bull_adx_thresh': 9.3682672119487, 'bull_atr_min_pct': 0.0285703222855193, 'bull_atr_max_pct': 0.04166142789367472, 'bull_tp_mult': 2.5189159973999726, 'bull_tsl_mult': 0.5401056790948136, 'bull_time_stop': 127, 'bull_use_sma': False, 'bull_use_ema': True, 'bull_use_atr': False, 'bull_use_adx': True, 'bull_use_spike': True, 'bull_rsi_required': False, 'bear_strategy': 'breakout', 'bear_bb_std_mult': 1.519549074431965, 'bear_rsi_os': 23, 'bear_rsi_ob': 89, 'bear_adx_thresh': 13.204084734484049, 'bear_atr_min_pct': 0.024518839214571177, 'bear_atr_max_pct': 0.023897047510531115, 'bear_tp_mult': 2.7699666098482045, 'bear_tsl_mult': 0.915623184019287, 'bear_time_stop': 110, 'bear_use_sma': True, 'bear_use_ema': False, 'bear_use_atr': False, 'bear_use_adx': False, 'bear_use_spike': True, 'bear_rsi_required': True, 'sideways_strategy': 'mean_reversion', 'sideways_bb_std_mult': 2.6921449987830637, 'sideways_rsi_os': 16, 'sideways_rsi_ob': 46, 'sideways_adx_thresh': 21.023032382307452, 'sideways_atr_min_pct': 0.006336214121708801, 'sideways_atr_max_pct': 0.018934492220704407, 'sideways_tp_mult': 2.011286666336592, 'sideways_tsl_mult': 0.8803246395518582, 'sideways_time_stop': 284, 'sideways_use_sma': True, 'sideways_use_ema': False, 'sideways_use_atr': True, 'sideways_use_adx': True, 'sideways_use_spike': True, 'sideways_rsi_required': False}.
[I 2025-08-31 10:57:05,179] Trial 531 finished with values: [-1000000000.0, 1000000000.0] and parameters: {'p_sma': 48, 'p_std': 40, 'p_atr': 14, 'p_adx': 20, 'rsi_period': 46, 'ema1': 22, 'ema2': 59, 'slip_atr_k': 0.035041524031851345, 'slip_spread_k': 0.259320498135526, 'spread_hl_frac': 0.010360000054321734, 'bb_std_mult': 2.5501410321949973, 'rsi_os': 34, 'rsi_ob': 75, 'vol_spike': 0.26463814615361425, 'adx_thresh': 7.247810936476663, 'atr_min_pct': 0.010416512055335041, 'atr_max_pct': 0.07609668452075886, 'tp_mult': 1.51299221364402, 'tsl_mult': 0.7029480565550841, 'strategy': 'mean_reversion', 'time_stop': 146, 'use_sma': False, 'use_atr': False, 'use_adx': False, 'use_ema': False, 'use_spike': False, 'rsi_required': False, 'edge_k': 1.9639502971008174, 'edge_cap': 0.7811559609987995, 'bull_strategy': 'breakout', 'bull_bb_std_mult': 2.3591347695878153, 'bull_rsi_os': 25, 'bull_rsi_ob': 47, 'bull_adx_thresh': 17.01164167361513, 'bull_atr_min_pct': 0.01778555711908335, 'bull_atr_max_pct': 0.04891497068368396, 'bull_tp_mult': 2.605513903688049, 'bull_tsl_mult': 0.08697001185329523, 'bull_time_stop': 47, 'bull_use_sma': False, 'bull_use_ema': True, 'bull_use_atr': False, 'bull_use_adx': True, 'bull_use_spike': True, 'bull_rsi_required': False, 'bear_strategy': 'breakout', 'bear_bb_std_mult': 1.5237433963646456, 'bear_rsi_os': 25, 'bear_rsi_ob': 90, 'bear_adx_thresh': 22.324010600828586, 'bear_atr_min_pct': 0.02445003206280117, 'bear_atr_max_pct': 0.018692936217595893, 'bear_tp_mult': 1.9848930199966486, 'bear_tsl_mult': 0.45666349202037393, 'bear_time_stop': 19, 'bear_use_sma': False, 'bear_use_ema': False, 'bear_use_atr': True, 'bear_use_adx': True, 'bear_use_spike': False, 'bear_rsi_required': True, 'sideways_strategy': 'mean_reversion', 'sideways_bb_std_mult': 2.676044993138719, 'sideways_rsi_os': 6, 'sideways_rsi_ob': 57, 'sideways_adx_thresh': 11.248913786365554, 'sideways_atr_min_pct': 0.005764649834070286, 'sideways_atr_max_pct': 0.01900511219312315, 'sideways_tp_mult': 1.835065452919994, 'sideways_tsl_mult': 0.37553559399079584, 'sideways_time_stop': 193, 'sideways_use_sma': True, 'sideways_use_ema': False, 'sideways_use_atr': False, 'sideways_use_adx': False, 'sideways_use_spike': True, 'sideways_rsi_required': True}.
