[I 2025-08-31 10:55:01,343] Trial 513 finished with values: [-1000000000.0, 1000000000.0] and parameters: {'p_sma': 44, 'p_std': 37, 'p_atr': 21, 'p_adx': 22, 'rsi_period': 33, 'ema1': 22, 'ema2': 16, 'slip_atr_k': 2.046862751060234e-05, 'slip_spread_k': 0.11480645973519804, 'spread_hl_frac': 0.045731209153446556, 'bb_std_mult': 3.3432205362800147, 'rsi_os': 52, 'rsi_ob': 47, 'vol_spike': 0.21959628054527022, 'adx_thresh': 23.166004068196838, 'atr_min_pct': 0.02031166229240951, 'atr_max_pct': 0.10902316367873661, 'tp_mult': 2.214695630057026, 'tsl_mult': 0.6394771628672705, 'strategy': 'breakout', 'time_stop': 148, 'use_sma': True, 'use_atr': False, 'use_adx': False, 'use_ema': False, 'use_spike': False, 'rsi_required': False, 'edge_k': 0.96585589718152, 'edge_cap': 0.5959992864911118, 'bull_strategy': 'breakout', 'bull_bb_std_mult': 3.591152019536557, 'bull_rsi_os': 5, 'bull_rsi_ob': 69, 'bull_adx_thresh': 24.124984177391198, 'bull_atr_min_pct': 0.023154795244440595, 'bull_atr_max_pct': 0.04348157300430929, 'bull_tp_mult': 2.8246938424216546, 'bull_tsl_mult': 0.18678865730505262, 'bull_time_stop': 73, 'bull_use_sma': False, 'bull_use_ema': True, 'bull_use_atr': False, 'bull_use_adx': True, 'bull_use_spike': False, 'bull_rsi_required': False, 'bear_strategy': 'mean_reversion', 'bear_bb_std_mult': 1.502615401563815, 'bear_rsi_os': 20, 'bear_rsi_ob': 53, 'bear_adx_thresh': 13.684358162314863, 'bear_atr_min_pct': 0.026317493895484035, 'bear_atr_max_pct': 0.1370468616227486, 'bear_tp_mult': 1.1567521190855339, 'bear_tsl_mult': 0.26532091282646775, 'bear_time_stop': 19, 'bear_use_sma': False, 'bear_use_ema': True, 'bear_use_atr': True, 'bear_use_adx': True, 'bear_use_spike': True, 'bear_rsi_required': True, 'sideways_strategy': 'mean_reversion', 'sideways_bb_std_mult': 2.6199806808308854, 'sideways_rsi_os': 48, 'sideways_rsi_ob': 61, 'sideways_adx_thresh': 13.16416204802352, 'sideways_atr_min_pct': 0.021286913228501982, 'sideways_atr_max_pct': 0.12574624180103702, 'sideways_tp_mult': 1.7264575033579228, 'sideways_tsl_mult': 0.4968350163716443, 'sideways_time_stop': 258, 'sideways_use_sma': True, 'sideways_use_ema': True, 'sideways_use_atr': False, 'sideways_use_adx': False, 'sideways_use_spike': True, 'sideways_rsi_required': False}.
[I 2025-08-31 10:55:02,042] Trial 514 finished with values: [-1000000000.0, 1000000000.0] and parameters: {'p_sma': 42, 'p_std': 37, 'p_atr': 21, 'p_adx': 21, 'rsi_period': 34, 'ema1': 22, 'ema2': 34, 'slip_atr_k': 0.0003515996120614905, 'slip_spread_k': 0.1202481254939497, 'spread_hl_frac': 0.04309352298424855, 'bb_std_mult': 2.470901411554944, 'rsi_os': 35, 'rsi_ob': 69, 'vol_spike': 0.21459484475650675, 'adx_thresh': 6.5552641074209905, 'atr_min_pct': 0.025726222927666804, 'atr_max_pct': 0.01030384019853453, 'tp_mult': 2.789657737551553, 'tsl_mult': 0.28921143277059563, 'strategy': 'breakout', 'time_stop': 207, 'use_sma': False, 'use_atr': False, 'use_adx': False, 'use_ema': False, 'use_spike': False, 'rsi_required': False, 'edge_k': 0.9648541756479423, 'edge_cap': 0.196859922335398, 'bull_strategy': 'breakout', 'bull_bb_std_mult': 3.472945657587775, 'bull_rsi_os': 12, 'bull_rsi_ob': 56, 'bull_adx_thresh': 24.357192160826372, 'bull_atr_min_pct': 0.0025599656733673445, 'bull_atr_max_pct': 0.04003850516801176, 'bull_tp_mult': 2.810832158370038, 'bull_tsl_mult': 0.9352421433432623, 'bull_time_stop': 73, 'bull_use_sma': False, 'bull_use_ema': True, 'bull_use_atr': False, 'bull_use_adx': True, 'bull_use_spike': False, 'bull_rsi_required': False, 'bear_strategy': 'breakout', 'bear_bb_std_mult': 1.3473280585512901, 'bear_rsi_os': 22, 'bear_rsi_ob': 55, 'bear_adx_thresh': 13.707616909872407, 'bear_atr_min_pct': 0.025771048400670658, 'bear_atr_max_pct': 0.050701832242591865, 'bear_tp_mult': 2.6790547999914676, 'bear_tsl_mult': 0.11741193297747082, 'bear_time_stop': 208, 'bear_use_sma': False, 'bear_use_ema': True, 'bear_use_atr': True, 'bear_use_adx': False, 'bear_use_spike': True, 'bear_rsi_required': True, 'sideways_strategy': 'mean_reversion', 'sideways_bb_std_mult': 2.5588620601558856, 'sideways_rsi_os': 34, 'sideways_rsi_ob': 56, 'sideways_adx_thresh': 12.825837419793093, 'sideways_atr_min_pct': 0.02965362537055062, 'sideways_atr_max_pct': 0.07666891868536227, 'sideways_tp_mult': 1.8076671470328336, 'sideways_tsl_mult': 0.8538874826498805, 'sideways_time_stop': 29, 'sideways_use_sma': True, 'sideways_use_ema': True, 'sideways_use_atr': False, 'sideways_use_adx': False, 'sideways_use_spike': True, 'sideways_rsi_required': False}.
[I 2025-08-31 10:55:02,682] Trial 518 finished with values: [-1000000000.0, 1000000000.0] and parameters: {'p_sma': 43, 'p_std': 39, 'p_atr': 23, 'p_adx': 20, 'rsi_period': 60, 'ema1': 21, 'ema2': 54, 'slip_atr_k': 0.140337474416894, 'slip_spread_k': 0.060807785576083906, 'spread_hl_frac': 0.026240655526311243, 'bb_std_mult': 2.5371892009607357, 'rsi_os': 33, 'rsi_ob': 49, 'vol_spike': 0.22220519591032079, 'adx_thresh': 14.883689005146259, 'atr_min_pct': 0.019615960171550505, 'atr_max_pct': 0.08778736788336514, 'tp_mult': 1.8051336340926338, 'tsl_mult': 0.6659473264455669, 'strategy': 'mean_reversion', 'time_stop': 155, 'use_sma': False, 'use_atr': False, 'use_adx': False, 'use_ema': False, 'use_spike': False, 'rsi_required': False, 'edge_k': 1.6918656238803127, 'edge_cap': 0.18277042022821707, 'bull_strategy': 'mean_reversion', 'bull_bb_std_mult': 3.494687256493081, 'bull_rsi_os': 43, 'bull_rsi_ob': 79, 'bull_adx_thresh': 10.397231277605524, 'bull_atr_min_pct': 0.004488585318823643, 'bull_atr_max_pct': 0.037955818507761245, 'bull_tp_mult': 2.3366564668133183, 'bull_tsl_mult': 0.3760023006643768, 'bull_time_stop': 53, 'bull_use_sma': False, 'bull_use_ema': False, 'bull_use_atr': False, 'bull_use_adx': True, 'bull_use_spike': True, 'bull_rsi_required': True, 'bear_strategy': 'breakout', 'bear_bb_std_mult': 1.3753307829812518, 'bear_rsi_os': 24, 'bear_rsi_ob': 56, 'bear_adx_thresh': 14.76296382867169, 'bear_atr_min_pct': 0.024097313126500475, 'bear_atr_max_pct': 0.08067819432491882, 'bear_tp_mult': 2.7796473605951624, 'bear_tsl_mult': 0.1391951367191061, 'bear_time_stop': 300, 'bear_use_sma': False, 'bear_use_ema': False, 'bear_use_atr': True, 'bear_use_adx': False, 'bear_use_spike': False, 'bear_rsi_required': True, 'sideways_strategy': 'mean_reversion', 'sideways_bb_std_mult': 2.3250923140589665, 'sideways_rsi_os': 9, 'sideways_rsi_ob': 95, 'sideways_adx_thresh': 9.671661606528147, 'sideways_atr_min_pct': 0.0048889314071640716, 'sideways_atr_max_pct': 0.07016241904650793, 'sideways_tp_mult': 1.931649836321629, 'sideways_tsl_mult': 0.8816720682989881, 'sideways_time_stop': 43, 'sideways_use_sma': False, 'sideways_use_ema': False, 'sideways_use_atr': False, 'sideways_use_adx': False, 'sideways_use_spike': False, 'sideways_rsi_required': True}.
[I 2025-08-31 10:55:07,142] Trial 519 finished with values: [-1000000000.0, 1000000000.0] and parameters: {'p_sma': 38, 'p_std': 36, 'p_atr': 30, 'p_adx': 20, 'rsi_period': 44, 'ema1': 22, 'ema2': 57, 'slip_atr_k': 0.12607063119569228, 'slip_spread_k': 0.279328598078741, 'spread_hl_frac': 0.020466635982469727, 'bb_std_mult': 2.0698992531505898, 'rsi_os': 54, 'rsi_ob': 56, 'vol_spike': 0.17010683022408643, 'adx_thresh': 8.676228282926676, 'atr_min_pct': 0.009593115585453314, 'atr_max_pct': 0.04547990603363762, 'tp_mult': 2.9683215760328907, 'tsl_mult': 0.6928469200904207, 'strategy': 'mean_reversion', 'time_stop': 109, 'use_sma': False, 'use_atr': True, 'use_adx': False, 'use_ema': True, 'use_spike': False, 'rsi_required': False, 'edge_k': 1.9078905097960643, 'edge_cap': 0.38309309540164105, 'bull_strategy': 'mean_reversion', 'bull_bb_std_mult': 3.523944687687718, 'bull_rsi_os': 44, 'bull_rsi_ob': 78, 'bull_adx_thresh': 13.610906847431181, 'bull_atr_min_pct': 0.0049260254076982785, 'bull_atr_max_pct': 0.0421110700985126, 'bull_tp_mult': 2.7583886993342426, 'bull_tsl_mult': 0.1433998594855322, 'bull_time_stop': 59, 'bull_use_sma': False, 'bull_use_ema': True, 'bull_use_atr': False, 'bull_use_adx': True, 'bull_use_spike': True, 'bull_rsi_required': False, 'bear_strategy': 'breakout', 'bear_bb_std_mult': 1.4191599923867482, 'bear_rsi_os': 36, 'bear_rsi_ob': 92, 'bear_adx_thresh': 12.660695174238407, 'bear_atr_min_pct': 0.025909078178031657, 'bear_atr_max_pct': 0.0942037795596634, 'bear_tp_mult': 1.2311180260626857, 'bear_tsl_mult': 0.5321279401173789, 'bear_time_stop': 25, 'bear_use_sma': False, 'bear_use_ema': False, 'bear_use_atr': True, 'bear_use_adx': True, 'bear_use_spike': False, 'bear_rsi_required': True, 'sideways_strategy': 'mean_reversion', 'sideways_bb_std_mult': 3.2934562459338164, 'sideways_rsi_os': 28, 'sideways_rsi_ob': 58, 'sideways_adx_thresh': 15.032838478912145, 'sideways_atr_min_pct': 0.0065674760418217085, 'sideways_atr_max_pct': 0.03763126587845397, 'sideways_tp_mult': 1.9893527395125177, 'sideways_tsl_mult': 0.029156907681518796, 'sideways_time_stop': 96, 'sideways_use_sma': True, 'sideways_use_ema': False, 'sideways_use_atr': False, 'sideways_use_adx': False, 'sideways_use_spike': True, 'sideways_rsi_required': True}.
[I 2025-08-31 10:55:26,507] Trial 517 finished with values: [-1000000000.0, 1000000000.0] and parameters: {'p_sma': 34, 'p_std': 41, 'p_atr': 29, 'p_adx': 20, 'rsi_period': 65, 'ema1': 22, 'ema2': 19, 'slip_atr_k': 0.12703930102587468, 'slip_spread_k': 0.38329034246590893, 'spread_hl_frac': 0.026447095153512443, 'bb_std_mult': 0.9065637592344651, 'rsi_os': 26, 'rsi_ob': 77, 'vol_spike': 0.21623944580477059, 'adx_thresh': 9.58535273333338, 'atr_min_pct': 0.024552226993769233, 'atr_max_pct': 0.03769611146384177, 'tp_mult': 1.8115288835080943, 'tsl_mult': 0.6622043593319544, 'strategy': 'breakout', 'time_stop': 155, 'use_sma': False, 'use_atr': False, 'use_adx': False, 'use_ema': False, 'use_spike': False, 'rsi_required': False, 'edge_k': 1.6715274418480097, 'edge_cap': 0.19311042298004363, 'bull_strategy': 'mean_reversion', 'bull_bb_std_mult': 1.45306152472206, 'bull_rsi_os': 43, 'bull_rsi_ob': 78, 'bull_adx_thresh': 8.402633458049301, 'bull_atr_min_pct': 0.004763586844830969, 'bull_atr_max_pct': 0.04011720168407689, 'bull_tp_mult': 2.7459395800204307, 'bull_tsl_mult': 0.5715687809949466, 'bull_time_stop': 53, 'bull_use_sma': False, 'bull_use_ema': True, 'bull_use_atr': False, 'bull_use_adx': True, 'bull_use_spike': False, 'bull_rsi_required': False, 'bear_strategy': 'breakout', 'bear_bb_std_mult': 1.3378647118905589, 'bear_rsi_os': 24, 'bear_rsi_ob': 56, 'bear_adx_thresh': 14.692037801558929, 'bear_atr_min_pct': 0.026299866388177585, 'bear_atr_max_pct': 0.1325098889594151, 'bear_tp_mult': 2.7958971606395124, 'bear_tsl_mult': 0.47500745320736987, 'bear_time_stop': 25, 'bear_use_sma': False, 'bear_use_ema': True, 'bear_use_atr': True, 'bear_use_adx': False, 'bear_use_spike': False, 'bear_rsi_required': True, 'sideways_strategy': 'mean_reversion', 'sideways_bb_std_mult': 1.8858174247925805, 'sideways_rsi_os': 34, 'sideways_rsi_ob': 58, 'sideways_adx_thresh': 30.277008994038155, 'sideways_atr_min_pct': 0.029735621019753612, 'sideways_atr_max_pct': 0.07568701060350641, 'sideways_tp_mult': 1.7889586359408383, 'sideways_tsl_mult': 0.8567288574526388, 'sideways_time_stop': 269, 'sideways_use_sma': True, 'sideways_use_ema': True, 'sideways_use_atr': False, 'sideways_use_adx': False, 'sideways_use_spike': True, 'sideways_rsi_required': True}.
[I 2025-08-31 10:55:26,623] Trial 516 finished with values: [-1000000000.0, 1000000000.0] and parameters: {'p_sma': 43, 'p_std': 36, 'p_atr': 21, 'p_adx': 20, 'rsi_period': 84, 'ema1': 22, 'ema2': 57, 'slip_atr_k': 0.0044365191546048115, 'slip_spread_k': 0.7955370942809705, 'spread_hl_frac': 0.026263601305142725, 'bb_std_mult': 2.4956014119258265, 'rsi_os': 32, 'rsi_ob': 48, 'vol_spike': 0.21960919072085802, 'adx_thresh': 31.70483791706036, 'atr_min_pct': 0.019996336188289672, 'atr_max_pct': 0.03623693674550739, 'tp_mult': 2.9523234892579038, 'tsl_mult': 0.6639146360569231, 'strategy': 'breakout', 'time_stop': 155, 'use_sma': True, 'use_atr': False, 'use_adx': False, 'use_ema': False, 'use_spike': False, 'rsi_required': False, 'edge_k': 1.6644346773595222, 'edge_cap': 0.19762093736518202, 'bull_strategy': 'mean_reversion', 'bull_bb_std_mult': 3.464655436505596, 'bull_rsi_os': 12, 'bull_rsi_ob': 79, 'bull_adx_thresh': 10.360067492937118, 'bull_atr_min_pct': 0.004009245309560657, 'bull_atr_max_pct': 0.03941178987413784, 'bull_tp_mult': 2.8164749276590766, 'bull_tsl_mult': 0.7426166889715407, 'bull_time_stop': 74, 'bull_use_sma': False, 'bull_use_ema': True, 'bull_use_atr': False, 'bull_use_adx': True, 'bull_use_spike': False, 'bull_rsi_required': False, 'bear_strategy': 'breakout', 'bear_bb_std_mult': 1.3580382086464544, 'bear_rsi_os': 14, 'bear_rsi_ob': 56, 'bear_adx_thresh': 13.765787891149447, 'bear_atr_min_pct': 0.02650829797652566, 'bear_atr_max_pct': 0.07992796558594684, 'bear_tp_mult': 2.689124048962819, 'bear_tsl_mult': 0.11801923455019953, 'bear_time_stop': 152, 'bear_use_sma': False, 'bear_use_ema': True, 'bear_use_atr': True, 'bear_use_adx': True, 'bear_use_spike': False, 'bear_rsi_required': True, 'sideways_strategy': 'mean_reversion', 'sideways_bb_std_mult': 0.8739881578347442, 'sideways_rsi_os': 25, 'sideways_rsi_ob': 95, 'sideways_adx_thresh': 31.221089570243784, 'sideways_atr_min_pct': 0.004671760690359523, 'sideways_atr_max_pct': 0.12616173641694395, 'sideways_tp_mult': 1.738460285934371, 'sideways_tsl_mult': 0.8984219774801908, 'sideways_time_stop': 41, 'sideways_use_sma': True, 'sideways_use_ema': True, 'sideways_use_atr': False, 'sideways_use_adx': False, 'sideways_use_spike': True, 'sideways_rsi_required': True}.
[I 2025-08-31 10:55:26,872] Trial 515 finished with values: [-1000000000.0, 1000000000.0] and parameters: {'p_sma': 43, 'p_std': 39, 'p_atr': 21, 'p_adx': 20, 'rsi_period': 34, 'ema1': 22, 'ema2': 57, 'slip_atr_k': 0.005352615954353165, 'slip_spread_k': 0.2678283687544198, 'spread_hl_frac': 0.024798576630256176, 'bb_std_mult': 2.4859310266865773, 'rsi_os': 33, 'rsi_ob': 56, 'vol_spike': 0.23266966584472734, 'adx_thresh': 9.633302775843132, 'atr_min_pct': 0.02453146402604243, 'atr_max_pct': 0.08535267719448825, 'tp_mult': 2.7891457268684308, 'tsl_mult': 0.6713860207286788, 'strategy': 'breakout', 'time_stop': 156, 'use_sma': False, 'use_atr': False, 'use_adx': False, 'use_ema': False, 'use_spike': False, 'rsi_required': False, 'edge_k': 1.6786807478676433, 'edge_cap': 0.1956010770271282, 'bull_strategy': 'mean_reversion', 'bull_bb_std_mult': 3.4758593193440404, 'bull_rsi_os': 12, 'bull_rsi_ob': 68, 'bull_adx_thresh': 11.708117007019453, 'bull_atr_min_pct': 0.016085566043655592, 'bull_atr_max_pct': 0.039841829851255645, 'bull_tp_mult': 2.8238727287429017, 'bull_tsl_mult': 0.13909140298082512, 'bull_time_stop': 164, 'bull_use_sma': False, 'bull_use_ema': True, 'bull_use_atr': False, 'bull_use_adx': True, 'bull_use_spike': False, 'bull_rsi_required': False, 'bear_strategy': 'breakout', 'bear_bb_std_mult': 1.3457463340144349, 'bear_rsi_os': 42, 'bear_rsi_ob': 56, 'bear_adx_thresh': 14.721725854769376, 'bear_atr_min_pct': 0.025951691814860903, 'bear_atr_max_pct': 0.06930615762694678, 'bear_tp_mult': 2.798355305701672, 'bear_tsl_mult': 0.10902749794638421, 'bear_time_stop': 207, 'bear_use_sma': False, 'bear_use_ema': True, 'bear_use_atr': True, 'bear_use_adx': False, 'bear_use_spike': True, 'bear_rsi_required': True, 'sideways_strategy': 'mean_reversion', 'sideways_bb_std_mult': 1.132572782748041, 'sideways_rsi_os': 9, 'sideways_rsi_ob': 58, 'sideways_adx_thresh': 31.19909289449329, 'sideways_atr_min_pct': 0.00840858556295362, 'sideways_atr_max_pct': 0.01648818706349684, 'sideways_tp_mult': 1.7967431869337012, 'sideways_tsl_mult': 0.8541883502483895, 'sideways_time_stop': 139, 'sideways_use_sma': True, 'sideways_use_ema': True, 'sideways_use_atr': False, 'sideways_use_adx': False, 'sideways_use_spike': True, 'sideways_rsi_required': False}.
[I 2025-08-31 10:55:47,897] Trial 520 finished with values: [-1000000000.0, 1000000000.0] and parameters: {'p_sma': 43, 'p_std': 46, 'p_atr': 22, 'p_adx': 18, 'rsi_period': 66, 'ema1': 21, 'ema2': 58, 'slip_atr_k': 0.004922949527275098, 'slip_spread_k': 0.34540279881262237, 'spread_hl_frac': 0.025157727104000542, 'bb_std_mult': 2.7093906551293445, 'rsi_os': 6, 'rsi_ob': 76, 'vol_spike': 0.21521052593917242, 'adx_thresh': 9.60234649846611, 'atr_min_pct': 0.0004396651670953485, 'atr_max_pct': 0.03653174085397756, 'tp_mult': 1.2660302722256378, 'tsl_mult': 0.9756150516980362, 'strategy': 'breakout', 'time_stop': 267, 'use_sma': True, 'use_atr': False, 'use_adx': False, 'use_ema': False, 'use_spike': False, 'rsi_required': False, 'edge_k': 1.6641148057558794, 'edge_cap': 0.9827456593316531, 'bull_strategy': 'breakout', 'bull_bb_std_mult': 3.36290830717148, 'bull_rsi_os': 45, 'bull_rsi_ob': 78, 'bull_adx_thresh': 22.238243394492432, 'bull_atr_min_pct': 0.009857749757883066, 'bull_atr_max_pct': 0.04886925879078435, 'bull_tp_mult': 2.7018485981765394, 'bull_tsl_mult': 0.7988870539427584, 'bull_time_stop': 278, 'bull_use_sma': False, 'bull_use_ema': True, 'bull_use_atr': False, 'bull_use_adx': True, 'bull_use_spike': True, 'bull_rsi_required': False, 'bear_strategy': 'breakout', 'bear_bb_std_mult': 1.6470502836434502, 'bear_rsi_os': 8, 'bear_rsi_ob': 52, 'bear_adx_thresh': 31.98221663020682, 'bear_atr_min_pct': 0.025054814837308585, 'bear_atr_max_pct': 0.06883131617580872, 'bear_tp_mult': 2.7307249094148274, 'bear_tsl_mult': 0.11521199296300598, 'bear_time_stop': 31, 'bear_use_sma': False, 'bear_use_ema': False, 'bear_use_atr': True, 'bear_use_adx': False, 'bear_use_spike': True, 'bear_rsi_required': True, 'sideways_strategy': 'mean_reversion', 'sideways_bb_std_mult': 2.9684014023606706, 'sideways_rsi_os': 38, 'sideways_rsi_ob': 55, 'sideways_adx_thresh': 13.643612954292424, 'sideways_atr_min_pct': 0.0044757652983543166, 'sideways_atr_max_pct': 0.010138614227412338, 'sideways_tp_mult': 1.6103798962869134, 'sideways_tsl_mult': 0.9102491716179059, 'sideways_time_stop': 269, 'sideways_use_sma': True, 'sideways_use_ema': True, 'sideways_use_atr': False, 'sideways_use_adx': False, 'sideways_use_spike': True, 'sideways_rsi_required': False}.
[I 2025-08-31 10:55:58,540] Trial 523 finished with values: [-1000000000.0, 1000000000.0] and parameters: {'p_sma': 6, 'p_std': 22, 'p_atr': 22, 'p_adx': 19, 'rsi_period': 39, 'ema1': 23, 'ema2': 42, 'slip_atr_k': 0.01796704218512031, 'slip_spread_k': 0.24441985989866855, 'spread_hl_frac': 0.025062103294143916, 'bb_std_mult': 2.688093741351243, 'rsi_os': 37, 'rsi_ob': 76, 'vol_spike': 0.2416270875966255, 'adx_thresh': 8.80418026415443, 'atr_min_pct': 0.021131008474875434, 'atr_max_pct': 0.13278593040536027, 'tp_mult': 1.2647093659646145, 'tsl_mult': 0.14488809450472073, 'strategy': 'mean_reversion', 'time_stop': 171, 'use_sma': True, 'use_atr': True, 'use_adx': False, 'use_ema': True, 'use_spike': False, 'rsi_required': False, 'edge_k': 1.823639393779121, 'edge_cap': 0.23070706125797277, 'bull_strategy': 'breakout', 'bull_bb_std_mult': 2.746679853301294, 'bull_rsi_os': 45, 'bull_rsi_ob': 77, 'bull_adx_thresh': 18.557704379230646, 'bull_atr_min_pct': 0.003562779617682668, 'bull_atr_max_pct': 0.04415521676148977, 'bull_tp_mult': 2.704422357952133, 'bull_tsl_mult': 0.7920604466422456, 'bull_time_stop': 64, 'bull_use_sma': False, 'bull_use_ema': False, 'bull_use_atr': False, 'bull_use_adx': False, 'bull_use_spike': True, 'bull_rsi_required': True, 'bear_strategy': 'mean_reversion', 'bear_bb_std_mult': 1.6356494648765985, 'bear_rsi_os': 22, 'bear_rsi_ob': 52, 'bear_adx_thresh': 12.919567510766184, 'bear_atr_min_pct': 0.02495095958534807, 'bear_atr_max_pct': 0.14998539168848024, 'bear_tp_mult': 1.4783290212694227, 'bear_tsl_mult': 0.4014499406903233, 'bear_time_stop': 66, 'bear_use_sma': False, 'bear_use_ema': False, 'bear_use_atr': True, 'bear_use_adx': False, 'bear_use_spike': True, 'bear_rsi_required': False, 'sideways_strategy': 'mean_reversion', 'sideways_bb_std_mult': 2.839156170329139, 'sideways_rsi_os': 35, 'sideways_rsi_ob': 57, 'sideways_adx_thresh': 18.20713580204498, 'sideways_atr_min_pct': 0.017988304372183885, 'sideways_atr_max_pct': 0.11024528935178761, 'sideways_tp_mult': 1.9276538760870416, 'sideways_tsl_mult': 0.9078194930444135, 'sideways_time_stop': 246, 'sideways_use_sma': False, 'sideways_use_ema': False, 'sideways_use_atr': False, 'sideways_use_adx': False, 'sideways_use_spike': False, 'sideways_rsi_required': False}.
