[I 2025-08-31 11:05:31,199] Trial 594 finished with values: [0.0019028115982520077, 0.0036479273705915527] and parameters: {'p_sma': 35, 'p_std': 14, 'p_atr': 26, 'p_adx': 23, 'rsi_period': 35, 'ema1': 5, 'ema2': 14, 'slip_atr_k': 0.020521162670212166, 'slip_spread_k': 0.4395429115358389, 'spread_hl_frac': 0.020481882559367417, 'bb_std_mult': 0.9599941792757525, 'rsi_os': 30, 'rsi_ob': 82, 'vol_spike': 0.07880224011149105, 'adx_thresh': 10.933720125546483, 'atr_min_pct': 0.022175082476160974, 'atr_max_pct': 0.05892247056092837, 'tp_mult': 2.9315232994873193, 'tsl_mult': 0.07734928039862132, 'strategy': 'breakout', 'time_stop': 84, 'use_sma': True, 'use_atr': True, 'use_adx': False, 'use_ema': True, 'use_spike': False, 'rsi_required': False, 'edge_k': 1.5688350290824384, 'edge_cap': 0.6855633772745544, 'bull_strategy': 'mean_reversion', 'bull_bb_std_mult': 2.039669583739789, 'bull_rsi_os': 42, 'bull_rsi_ob': 62, 'bull_adx_thresh': 30.607188388157493, 'bull_atr_min_pct': 0.00888430920353189, 'bull_atr_max_pct': 0.03656260879804916, 'bull_tp_mult': 2.900798083316734, 'bull_tsl_mult': 0.21335932215185505, 'bull_time_stop': 35, 'bull_use_sma': False, 'bull_use_ema': True, 'bull_use_atr': False, 'bull_use_adx': True, 'bull_use_spike': False, 'bull_rsi_required': False, 'bear_strategy': 'mean_reversion', 'bear_bb_std_mult': 1.7539588396670414, 'bear_rsi_os': 50, 'bear_rsi_ob': 55, 'bear_adx_thresh': 11.676909766231834, 'bear_atr_min_pct': 0.004942341231265203, 'bear_atr_max_pct': 0.13436061238771185, 'bear_tp_mult': 2.616585367746405, 'bear_tsl_mult': 0.8643891759720534, 'bear_time_stop': 107, 'bear_use_sma': False, 'bear_use_ema': False, 'bear_use_atr': True, 'bear_use_adx': False, 'bear_use_spike': True, 'bear_rsi_required': False, 'sideways_strategy': 'mean_reversion', 'sideways_bb_std_mult': 1.0373128907417297, 'sideways_rsi_os': 39, 'sideways_rsi_ob': 63, 'sideways_adx_thresh': 27.253749538511887, 'sideways_atr_min_pct': 0.004767617131448331, 'sideways_atr_max_pct': 0.0969099850849486, 'sideways_tp_mult': 1.562613337499906, 'sideways_tsl_mult': 0.8683193033166717, 'sideways_time_stop': 175, 'sideways_use_sma': True, 'sideways_use_ema': True, 'sideways_use_atr': False, 'sideways_use_adx': False, 'sideways_use_spike': True, 'sideways_rsi_required': False}.
[I 2025-08-31 11:05:31,611] Trial 593 finished with values: [-0.001379310201050088, 0.004938164902668284] and parameters: {'p_sma': 35, 'p_std': 14, 'p_atr': 26, 'p_adx': 23, 'rsi_period': 35, 'ema1': 6, 'ema2': 14, 'slip_atr_k': 0.031264764260607994, 'slip_spread_k': 0.502050723862091, 'spread_hl_frac': 0.01888145799482086, 'bb_std_mult': 0.5759681065415936, 'rsi_os': 30, 'rsi_ob': 79, 'vol_spike': 0.09150112946121412, 'adx_thresh': 11.156154372734864, 'atr_min_pct': 0.022071942151364266, 'atr_max_pct': 0.048879308994388825, 'tp_mult': 2.917187363982965, 'tsl_mult': 0.01879439830799144, 'strategy': 'breakout', 'time_stop': 53, 'use_sma': True, 'use_atr': True, 'use_adx': False, 'use_ema': True, 'use_spike': False, 'rsi_required': False, 'edge_k': 1.5312271432273798, 'edge_cap': 0.6640231403213048, 'bull_strategy': 'mean_reversion', 'bull_bb_std_mult': 2.087371664660175, 'bull_rsi_os': 42, 'bull_rsi_ob': 63, 'bull_adx_thresh': 26.203384616199315, 'bull_atr_min_pct': 0.01297492607855503, 'bull_atr_max_pct': 0.03529291541195862, 'bull_tp_mult': 2.897575761675448, 'bull_tsl_mult': 0.26980330800245306, 'bull_time_stop': 33, 'bull_use_sma': False, 'bull_use_ema': True, 'bull_use_atr': False, 'bull_use_adx': True, 'bull_use_spike': False, 'bull_rsi_required': False, 'bear_strategy': 'mean_reversion', 'bear_bb_std_mult': 1.8039147409681953, 'bear_rsi_os': 50, 'bear_rsi_ob': 55, 'bear_adx_thresh': 11.877010087318402, 'bear_atr_min_pct': 0.00487355840222351, 'bear_atr_max_pct': 0.13413896485192903, 'bear_tp_mult': 2.6301758446200147, 'bear_tsl_mult': 0.860417006618759, 'bear_time_stop': 114, 'bear_use_sma': False, 'bear_use_ema': False, 'bear_use_atr': True, 'bear_use_adx': False, 'bear_use_spike': True, 'bear_rsi_required': False, 'sideways_strategy': 'mean_reversion', 'sideways_bb_std_mult': 1.096109238696402, 'sideways_rsi_os': 39, 'sideways_rsi_ob': 63, 'sideways_adx_thresh': 27.87510576887342, 'sideways_atr_min_pct': 0.00506684610870956, 'sideways_atr_max_pct': 0.09876597746239368, 'sideways_tp_mult': 1.5137856570810047, 'sideways_tsl_mult': 0.8611409849242883, 'sideways_time_stop': 177, 'sideways_use_sma': True, 'sideways_use_ema': True, 'sideways_use_atr': False, 'sideways_use_adx': False, 'sideways_use_spike': True, 'sideways_rsi_required': False}.
[I 2025-08-31 11:05:31,688] Trial 596 finished with values: [0.0023588440684310097, 0.0046174762160282245] and parameters: {'p_sma': 35, 'p_std': 14, 'p_atr': 24, 'p_adx': 23, 'rsi_period': 35, 'ema1': 6, 'ema2': 15, 'slip_atr_k': 0.029441485585348016, 'slip_spread_k': 0.4404795184072665, 'spread_hl_frac': 0.020712294137760247, 'bb_std_mult': 0.5700061562324701, 'rsi_os': 30, 'rsi_ob': 83, 'vol_spike': 0.09292879712108564, 'adx_thresh': 10.871119019418297, 'atr_min_pct': 0.021878644310933174, 'atr_max_pct': 0.04959835243442802, 'tp_mult': 2.9356427678259944, 'tsl_mult': 0.07201676702968045, 'strategy': 'breakout', 'time_stop': 83, 'use_sma': True, 'use_atr': True, 'use_adx': False, 'use_ema': True, 'use_spike': False, 'rsi_required': False, 'edge_k': 1.572863882222625, 'edge_cap': 0.6930967384713158, 'bull_strategy': 'mean_reversion', 'bull_bb_std_mult': 2.006407454465953, 'bull_rsi_os': 42, 'bull_rsi_ob': 62, 'bull_adx_thresh': 30.299791356366605, 'bull_atr_min_pct': 0.008651212752822355, 'bull_atr_max_pct': 0.03590206077302539, 'bull_tp_mult': 2.898451840158511, 'bull_tsl_mult': 0.20041917326122907, 'bull_time_stop': 47, 'bull_use_sma': False, 'bull_use_ema': True, 'bull_use_atr': False, 'bull_use_adx': True, 'bull_use_spike': False, 'bull_rsi_required': False, 'bear_strategy': 'mean_reversion', 'bear_bb_std_mult': 1.6423565624315208, 'bear_rsi_os': 50, 'bear_rsi_ob': 54, 'bear_adx_thresh': 12.130976018771193, 'bear_atr_min_pct': 0.005043089487343571, 'bear_atr_max_pct': 0.13391758736758835, 'bear_tp_mult': 2.627664349174294, 'bear_tsl_mult': 0.8574707170641814, 'bear_time_stop': 105, 'bear_use_sma': False, 'bear_use_ema': False, 'bear_use_atr': True, 'bear_use_adx': False, 'bear_use_spike': True, 'bear_rsi_required': False, 'sideways_strategy': 'mean_reversion', 'sideways_bb_std_mult': 1.335684354693363, 'sideways_rsi_os': 39, 'sideways_rsi_ob': 63, 'sideways_adx_thresh': 27.186769445300524, 'sideways_atr_min_pct': 0.004674889981067279, 'sideways_atr_max_pct': 0.09708174349064583, 'sideways_tp_mult': 1.566896850446616, 'sideways_tsl_mult': 0.8228879514091751, 'sideways_time_stop': 174, 'sideways_use_sma': True, 'sideways_use_ema': True, 'sideways_use_atr': False, 'sideways_use_adx': False, 'sideways_use_spike': True, 'sideways_rsi_required': False}.
[I 2025-08-31 11:06:03,836] Trial 598 finished with values: [0.002110804364156449, 0.004433586745681946] and parameters: {'p_sma': 31, 'p_std': 17, 'p_atr': 24, 'p_adx': 23, 'rsi_period': 35, 'ema1': 6, 'ema2': 14, 'slip_atr_k': 0.029318964669516088, 'slip_spread_k': 0.43322964075760806, 'spread_hl_frac': 0.020695008210469594, 'bb_std_mult': 0.6680447557800588, 'rsi_os': 31, 'rsi_ob': 81, 'vol_spike': 0.08707156704114301, 'adx_thresh': 12.003033547665199, 'atr_min_pct': 0.02182258207662705, 'atr_max_pct': 0.049642019769306954, 'tp_mult': 2.9344463976710315, 'tsl_mult': 0.06472325432763215, 'strategy': 'breakout', 'time_stop': 84, 'use_sma': True, 'use_atr': True, 'use_adx': False, 'use_ema': True, 'use_spike': False, 'rsi_required': False, 'edge_k': 1.560823038637928, 'edge_cap': 0.6721870232450287, 'bull_strategy': 'mean_reversion', 'bull_bb_std_mult': 2.0581085648690087, 'bull_rsi_os': 42, 'bull_rsi_ob': 62, 'bull_adx_thresh': 27.00790603346938, 'bull_atr_min_pct': 0.008938788879685178, 'bull_atr_max_pct': 0.03622122158102793, 'bull_tp_mult': 2.890206628212124, 'bull_tsl_mult': 0.20926803509677072, 'bull_time_stop': 48, 'bull_use_sma': False, 'bull_use_ema': True, 'bull_use_atr': False, 'bull_use_adx': True, 'bull_use_spike': False, 'bull_rsi_required': False, 'bear_strategy': 'mean_reversion', 'bear_bb_std_mult': 1.60664047332201, 'bear_rsi_os': 52, 'bear_rsi_ob': 54, 'bear_adx_thresh': 12.38059551951024, 'bear_atr_min_pct': 0.005204207805550843, 'bear_atr_max_pct': 0.13373690530666194, 'bear_tp_mult': 2.6612019177362147, 'bear_tsl_mult': 0.8656518861933895, 'bear_time_stop': 104, 'bear_use_sma': False, 'bear_use_ema': False, 'bear_use_atr': True, 'bear_use_adx': False, 'bear_use_spike': True, 'bear_rsi_required': False, 'sideways_strategy': 'mean_reversion', 'sideways_bb_std_mult': 1.0908543048972619, 'sideways_rsi_os': 39, 'sideways_rsi_ob': 63, 'sideways_adx_thresh': 27.059403628824356, 'sideways_atr_min_pct': 0.0047829465128290975, 'sideways_atr_max_pct': 0.0977168785513746, 'sideways_tp_mult': 1.568108954719243, 'sideways_tsl_mult': 0.8195072274869513, 'sideways_time_stop': 175, 'sideways_use_sma': True, 'sideways_use_ema': True, 'sideways_use_atr': False, 'sideways_use_adx': False, 'sideways_use_spike': True, 'sideways_rsi_required': False}.
[I 2025-08-31 11:06:03,930] Trial 600 finished with values: [-0.003246169523133169, 0.008338788600294854] and parameters: {'p_sma': 33, 'p_std': 14, 'p_atr': 24, 'p_adx': 21, 'rsi_period': 34, 'ema1': 6, 'ema2': 14, 'slip_atr_k': 0.04047002922890404, 'slip_spread_k': 0.44508546150014483, 'spread_hl_frac': 0.02107427591594008, 'bb_std_mult': 0.6148226518111994, 'rsi_os': 30, 'rsi_ob': 79, 'vol_spike': 0.0896536887319798, 'adx_thresh': 11.243390249927849, 'atr_min_pct': 0.021782465673681393, 'atr_max_pct': 0.04954082922092725, 'tp_mult': 2.933427771169371, 'tsl_mult': 0.08555273739749565, 'strategy': 'breakout', 'time_stop': 89, 'use_sma': True, 'use_atr': True, 'use_adx': False, 'use_ema': True, 'use_spike': False, 'rsi_required': False, 'edge_k': 1.5584394314653163, 'edge_cap': 0.6664997616964752, 'bull_strategy': 'mean_reversion', 'bull_bb_std_mult': 1.9996565847458507, 'bull_rsi_os': 42, 'bull_rsi_ob': 62, 'bull_adx_thresh': 26.92449624788956, 'bull_atr_min_pct': 0.012604753078675238, 'bull_atr_max_pct': 0.035461228209174044, 'bull_tp_mult': 2.890650341159042, 'bull_tsl_mult': 0.197818781415462, 'bull_time_stop': 52, 'bull_use_sma': False, 'bull_use_ema': True, 'bull_use_atr': False, 'bull_use_adx': True, 'bull_use_spike': False, 'bull_rsi_required': False, 'bear_strategy': 'mean_reversion', 'bear_bb_std_mult': 1.7820037884251634, 'bear_rsi_os': 51, 'bear_rsi_ob': 54, 'bear_adx_thresh': 12.414948282296407, 'bear_atr_min_pct': 0.004950576261854988, 'bear_atr_max_pct': 0.13355544877854422, 'bear_tp_mult': 2.6234973874695413, 'bear_tsl_mult': 0.8602692794867615, 'bear_time_stop': 104, 'bear_use_sma': False, 'bear_use_ema': False, 'bear_use_atr': True, 'bear_use_adx': False, 'bear_use_spike': True, 'bear_rsi_required': False, 'sideways_strategy': 'mean_reversion', 'sideways_bb_std_mult': 1.3169445162134257, 'sideways_rsi_os': 39, 'sideways_rsi_ob': 64, 'sideways_adx_thresh': 27.17697280301924, 'sideways_atr_min_pct': 0.004802714849317949, 'sideways_atr_max_pct': 0.09808187862840016, 'sideways_tp_mult': 1.5522812830437023, 'sideways_tsl_mult': 0.8653512313399478, 'sideways_time_stop': 174, 'sideways_use_sma': True, 'sideways_use_ema': True, 'sideways_use_atr': False, 'sideways_use_adx': False, 'sideways_use_spike': True, 'sideways_rsi_required': False}.
[I 2025-08-31 11:06:04,072] Trial 599 finished with values: [0.002575964682569154, 0.004284834978769325] and parameters: {'p_sma': 31, 'p_std': 13, 'p_atr': 24, 'p_adx': 23, 'rsi_period': 35, 'ema1': 6, 'ema2': 14, 'slip_atr_k': 0.02974658520618965, 'slip_spread_k': 0.4327653818296628, 'spread_hl_frac': 0.02096901701328681, 'bb_std_mult': 0.6382513929119206, 'rsi_os': 31, 'rsi_ob': 82, 'vol_spike': 0.0921063567379922, 'adx_thresh': 11.233911279046314, 'atr_min_pct': 0.021727211819535904, 'atr_max_pct': 0.04903547741213101, 'tp_mult': 2.9449659423949823, 'tsl_mult': 0.07579855613416943, 'strategy': 'breakout', 'time_stop': 84, 'use_sma': True, 'use_atr': True, 'use_adx': False, 'use_ema': True, 'use_spike': False, 'rsi_required': False, 'edge_k': 1.432625071649086, 'edge_cap': 0.6633816801718607, 'bull_strategy': 'mean_reversion', 'bull_bb_std_mult': 2.043605528142779, 'bull_rsi_os': 42, 'bull_rsi_ob': 60, 'bull_adx_thresh': 27.102717581023636, 'bull_atr_min_pct': 0.012429456345809253, 'bull_atr_max_pct': 0.035763360047923715, 'bull_tp_mult': 2.891846076875052, 'bull_tsl_mult': 0.19578038373389214, 'bull_time_stop': 48, 'bull_use_sma': False, 'bull_use_ema': True, 'bull_use_atr': False, 'bull_use_adx': True, 'bull_use_spike': False, 'bull_rsi_required': False, 'bear_strategy': 'mean_reversion', 'bear_bb_std_mult': 1.799703368744276, 'bear_rsi_os': 47, 'bear_rsi_ob': 54, 'bear_adx_thresh': 12.301032478013774, 'bear_atr_min_pct': 0.005177480143525829, 'bear_atr_max_pct': 0.13348777809825574, 'bear_tp_mult': 2.632664966200566, 'bear_tsl_mult': 0.8703355799103584, 'bear_time_stop': 105, 'bear_use_sma': False, 'bear_use_ema': False, 'bear_use_atr': True, 'bear_use_adx': False, 'bear_use_spike': True, 'bear_rsi_required': False, 'sideways_strategy': 'mean_reversion', 'sideways_bb_std_mult': 1.3467732316454253, 'sideways_rsi_os': 39, 'sideways_rsi_ob': 63, 'sideways_adx_thresh': 26.723918389142316, 'sideways_atr_min_pct': 0.004669075178780662, 'sideways_atr_max_pct': 0.09771023848250998, 'sideways_tp_mult': 1.5278685505785579, 'sideways_tsl_mult': 0.8244134245421543, 'sideways_time_stop': 176, 'sideways_use_sma': True, 'sideways_use_ema': True, 'sideways_use_atr': False, 'sideways_use_adx': False, 'sideways_use_spike': True, 'sideways_rsi_required': False}.
[I 2025-08-31 11:06:04,146] Trial 597 finished with values: [-0.0024713273042474837, 0.006886588499915346] and parameters: {'p_sma': 31, 'p_std': 14, 'p_atr': 24, 'p_adx': 23, 'rsi_period': 35, 'ema1': 6, 'ema2': 14, 'slip_atr_k': 0.04181080979860266, 'slip_spread_k': 0.44856989426099814, 'spread_hl_frac': 0.020904982657109744, 'bb_std_mult': 0.6167988728048391, 'rsi_os': 30, 'rsi_ob': 81, 'vol_spike': 0.09327945110103589, 'adx_thresh': 11.021399828004046, 'atr_min_pct': 0.022444738420967073, 'atr_max_pct': 0.049887675801612845, 'tp_mult': 2.9368568786562537, 'tsl_mult': 0.07793584868080303, 'strategy': 'breakout', 'time_stop': 82, 'use_sma': True, 'use_atr': True, 'use_adx': False, 'use_ema': True, 'use_spike': False, 'rsi_required': False, 'edge_k': 1.3957562350247703, 'edge_cap': 0.6860392135522039, 'bull_strategy': 'mean_reversion', 'bull_bb_std_mult': 2.0135594193273225, 'bull_rsi_os': 42, 'bull_rsi_ob': 62, 'bull_adx_thresh': 30.424179428032737, 'bull_atr_min_pct': 0.009050754752321342, 'bull_atr_max_pct': 0.035911402237911005, 'bull_tp_mult': 2.8967728472279175, 'bull_tsl_mult': 0.20183993056202687, 'bull_time_stop': 47, 'bull_use_sma': False, 'bull_use_ema': True, 'bull_use_atr': False, 'bull_use_adx': True, 'bull_use_spike': False, 'bull_rsi_required': False, 'bear_strategy': 'mean_reversion', 'bear_bb_std_mult': 1.6024340626899043, 'bear_rsi_os': 50, 'bear_rsi_ob': 54, 'bear_adx_thresh': 12.322084813966997, 'bear_atr_min_pct': 0.0052009522350498555, 'bear_atr_max_pct': 0.1342022174134776, 'bear_tp_mult': 2.620394716287965, 'bear_tsl_mult': 0.8626808270794161, 'bear_time_stop': 102, 'bear_use_sma': False, 'bear_use_ema': False, 'bear_use_atr': True, 'bear_use_adx': False, 'bear_use_spike': True, 'bear_rsi_required': False, 'sideways_strategy': 'mean_reversion', 'sideways_bb_std_mult': 1.0396122088001356, 'sideways_rsi_os': 39, 'sideways_rsi_ob': 62, 'sideways_adx_thresh': 27.292350718797564, 'sideways_atr_min_pct': 0.005079269607058349, 'sideways_atr_max_pct': 0.09774358137768696, 'sideways_tp_mult': 1.5234645801357785, 'sideways_tsl_mult': 0.8265362206916046, 'sideways_time_stop': 176, 'sideways_use_sma': True, 'sideways_use_ema': True, 'sideways_use_atr': False, 'sideways_use_adx': False, 'sideways_use_spike': True, 'sideways_rsi_required': False}.
[I 2025-08-31 11:06:38,518] Trial 601 finished with values: [-0.00034322703910472097, 0.004805340246343729] and parameters: {'p_sma': 33, 'p_std': 14, 'p_atr': 28, 'p_adx': 23, 'rsi_period': 35, 'ema1': 5, 'ema2': 14, 'slip_atr_k': 0.040308405473871455, 'slip_spread_k': 0.4475404944919366, 'spread_hl_frac': 0.01830378232758447, 'bb_std_mult': 0.8344882975257848, 'rsi_os': 30, 'rsi_ob': 81, 'vol_spike': 0.08919223141226365, 'adx_thresh': 10.988567193688969, 'atr_min_pct': 0.021925253016748476, 'atr_max_pct': 0.05045604065811878, 'tp_mult': 2.9364201728459274, 'tsl_mult': 0.10429823132046517, 'strategy': 'breakout', 'time_stop': 81, 'use_sma': True, 'use_atr': True, 'use_adx': False, 'use_ema': True, 'use_spike': False, 'rsi_required': False, 'edge_k': 1.385234776003574, 'edge_cap': 0.6620302180800025, 'bull_strategy': 'mean_reversion', 'bull_bb_std_mult': 2.013174542536651, 'bull_rsi_os': 42, 'bull_rsi_ob': 62, 'bull_adx_thresh': 26.9434851783786, 'bull_atr_min_pct': 0.012820942348665001, 'bull_atr_max_pct': 0.03531768513073214, 'bull_tp_mult': 2.8945787131078724, 'bull_tsl_mult': 0.23833112427024974, 'bull_time_stop': 47, 'bull_use_sma': False, 'bull_use_ema': True, 'bull_use_atr': False, 'bull_use_adx': True, 'bull_use_spike': False, 'bull_rsi_required': False, 'bear_strategy': 'mean_reversion', 'bear_bb_std_mult': 1.8125990268583092, 'bear_rsi_os': 47, 'bear_rsi_ob': 54, 'bear_adx_thresh': 12.460368679358211, 'bear_atr_min_pct': 0.005401140405453925, 'bear_atr_max_pct': 0.13432449892077603, 'bear_tp_mult': 2.695267301004738, 'bear_tsl_mult': 0.8485152678528216, 'bear_time_stop': 112, 'bear_use_sma': False, 'bear_use_ema': False, 'bear_use_atr': True, 'bear_use_adx': False, 'bear_use_spike': True, 'bear_rsi_required': False, 'sideways_strategy': 'mean_reversion', 'sideways_bb_std_mult': 1.339841469835661, 'sideways_rsi_os': 39, 'sideways_rsi_ob': 63, 'sideways_adx_thresh': 26.88160479697377, 'sideways_atr_min_pct': 0.00510151366752172, 'sideways_atr_max_pct': 0.0966936375603413, 'sideways_tp_mult': 1.5219190865970247, 'sideways_tsl_mult': 0.863486773074806, 'sideways_time_stop': 177, 'sideways_use_sma': True, 'sideways_use_ema': True, 'sideways_use_atr': False, 'sideways_use_adx': False, 'sideways_use_spike': True, 'sideways_rsi_required': False}.
[I 2025-08-31 11:06:38,529] Trial 603 finished with values: [-1000000000.0, 1000000000.0] and parameters: {'p_sma': 31, 'p_std': 13, 'p_atr': 28, 'p_adx': 23, 'rsi_period': 34, 'ema1': 6, 'ema2': 15, 'slip_atr_k': 0.03000381212023194, 'slip_spread_k': 0.4700659589395832, 'spread_hl_frac': 0.02082440559397357, 'bb_std_mult': 0.6333728701436242, 'rsi_os': 30, 'rsi_ob': 81, 'vol_spike': 0.09532464587880905, 'adx_thresh': 10.98885636287852, 'atr_min_pct': 0.022004345475158837, 'atr_max_pct': 0.05944886229573839, 'tp_mult': 2.928906461618748, 'tsl_mult': 0.1045422902445424, 'strategy': 'breakout', 'time_stop': 82, 'use_sma': True, 'use_atr': True, 'use_adx': False, 'use_ema': True, 'use_spike': False, 'rsi_required': False, 'edge_k': 1.4274215073886838, 'edge_cap': 0.712844553107706, 'bull_strategy': 'mean_reversion', 'bull_bb_std_mult': 1.9440973725741937, 'bull_rsi_os': 42, 'bull_rsi_ob': 62, 'bull_adx_thresh': 27.191753802073098, 'bull_atr_min_pct': 0.01274725769818116, 'bull_atr_max_pct': 0.03633746089374587, 'bull_tp_mult': 2.876044601120793, 'bull_tsl_mult': 0.23903825687430533, 'bull_time_stop': 46, 'bull_use_sma': False, 'bull_use_ema': True, 'bull_use_atr': False, 'bull_use_adx': True, 'bull_use_spike': False, 'bull_rsi_required': False, 'bear_strategy': 'mean_reversion', 'bear_bb_std_mult': 1.5690484018646826, 'bear_rsi_os': 51, 'bear_rsi_ob': 54, 'bear_adx_thresh': 11.393897613591506, 'bear_atr_min_pct': 0.006372654752097563, 'bear_atr_max_pct': 0.13485844381231613, 'bear_tp_mult': 2.701439491400535, 'bear_tsl_mult': 0.8956764217496762, 'bear_time_stop': 102, 'bear_use_sma': False, 'bear_use_ema': False, 'bear_use_atr': True, 'bear_use_adx': False, 'bear_use_spike': True, 'bear_rsi_required': False, 'sideways_strategy': 'mean_reversion', 'sideways_bb_std_mult': 1.3451637241802286, 'sideways_rsi_os': 40, 'sideways_rsi_ob': 63, 'sideways_adx_thresh': 26.997165199527686, 'sideways_atr_min_pct': 0.00510933994922609, 'sideways_atr_max_pct': 0.10951210977325762, 'sideways_tp_mult': 1.523114862323358, 'sideways_tsl_mult': 0.8180388172706734, 'sideways_time_stop': 166, 'sideways_use_sma': True, 'sideways_use_ema': True, 'sideways_use_atr': False, 'sideways_use_adx': False, 'sideways_use_spike': True, 'sideways_rsi_required': False}.
