[I 2025-08-31 11:27:03,230] Trial 748 finished with values: [-1000000000.0, 1000000000.0] and parameters: {'p_sma': 56, 'p_std': 19, 'p_atr': 26, 'p_adx': 29, 'rsi_period': 68, 'ema1': 29, 'ema2': 28, 'slip_atr_k': 0.19290814168420206, 'slip_spread_k': 0.5235947460817936, 'spread_hl_frac': 0.008324869382073535, 'bb_std_mult': 0.6024945003651794, 'rsi_os': 32, 'rsi_ob': 48, 'vol_spike': 0.11338883782668432, 'adx_thresh': 13.069716727423529, 'atr_min_pct': 0.020803834935569976, 'atr_max_pct': 0.06279424798319419, 'tp_mult': 2.296097457409064, 'tsl_mult': 0.5269090418302758, 'strategy': 'breakout', 'time_stop': 70, 'use_sma': True, 'use_atr': True, 'use_adx': False, 'use_ema': True, 'use_spike': False, 'rsi_required': False, 'edge_k': 0.38176721652165657, 'edge_cap': 0.7308371016878663, 'bull_strategy': 'mean_reversion', 'bull_bb_std_mult': 2.164825168212311, 'bull_rsi_os': 17, 'bull_rsi_ob': 61, 'bull_adx_thresh': 33.859079802879705, 'bull_atr_min_pct': 0.02594320705188733, 'bull_atr_max_pct': 0.1499035291237524, 'bull_tp_mult': 2.8328244848240183, 'bull_tsl_mult': 0.18323284482548044, 'bull_time_stop': 41, 'bull_use_sma': False, 'bull_use_ema': True, 'bull_use_atr': False, 'bull_use_adx': True, 'bull_use_spike': False, 'bull_rsi_required': False, 'bear_strategy': 'mean_reversion', 'bear_bb_std_mult': 1.501469808783375, 'bear_rsi_os': 12, 'bear_rsi_ob': 55, 'bear_adx_thresh': 12.72947719643016, 'bear_atr_min_pct': 0.006649784479727873, 'bear_atr_max_pct': 0.1305862297102686, 'bear_tp_mult': 1.600153999939935, 'bear_tsl_mult': 0.30601948051961525, 'bear_time_stop': 106, 'bear_use_sma': False, 'bear_use_ema': False, 'bear_use_atr': True, 'bear_use_adx': False, 'bear_use_spike': True, 'bear_rsi_required': False, 'sideways_strategy': 'mean_reversion', 'sideways_bb_std_mult': 1.1518970680310303, 'sideways_rsi_os': 38, 'sideways_rsi_ob': 60, 'sideways_adx_thresh': 27.536699305072016, 'sideways_atr_min_pct': 0.006214250454754916, 'sideways_atr_max_pct': 0.035061908596975305, 'sideways_tp_mult': 2.540736687541942, 'sideways_tsl_mult': 0.9042398734903956, 'sideways_time_stop': 165, 'sideways_use_sma': True, 'sideways_use_ema': True, 'sideways_use_atr': False, 'sideways_use_adx': False, 'sideways_use_spike': True, 'sideways_rsi_required': False}.
[I 2025-08-31 11:27:03,401] Trial 747 finished with values: [-0.029480910291092677, 0.02982292832288604] and parameters: {'p_sma': 31, 'p_std': 48, 'p_atr': 10, 'p_adx': 17, 'rsi_period': 83, 'ema1': 6, 'ema2': 17, 'slip_atr_k': 0.15929463452530818, 'slip_spread_k': 0.01637525382804733, 'spread_hl_frac': 0.019986418469678052, 'bb_std_mult': 2.1976995777330073, 'rsi_os': 8, 'rsi_ob': 62, 'vol_spike': 0.09834705029464856, 'adx_thresh': 9.990414878808629, 'atr_min_pct': 0.02079677332582597, 'atr_max_pct': 0.11541694188181596, 'tp_mult': 2.509738327931792, 'tsl_mult': 0.07253959793287547, 'strategy': 'breakout', 'time_stop': 29, 'use_sma': True, 'use_atr': True, 'use_adx': False, 'use_ema': True, 'use_spike': False, 'rsi_required': False, 'edge_k': 1.551080221279508, 'edge_cap': 0.6723014025718845, 'bull_strategy': 'mean_reversion', 'bull_bb_std_mult': 2.179603213666174, 'bull_rsi_os': 40, 'bull_rsi_ob': 86, 'bull_adx_thresh': 16.639734932881588, 'bull_atr_min_pct': 0.012968963932440965, 'bull_atr_max_pct': 0.03640352435398403, 'bull_tp_mult': 2.7919290037650697, 'bull_tsl_mult': 0.6959296026250237, 'bull_time_stop': 35, 'bull_use_sma': False, 'bull_use_ema': True, 'bull_use_atr': False, 'bull_use_adx': True, 'bull_use_spike': False, 'bull_rsi_required': False, 'bear_strategy': 'mean_reversion', 'bear_bb_std_mult': 3.0220375879834203, 'bear_rsi_os': 52, 'bear_rsi_ob': 51, 'bear_adx_thresh': 8.589811236937011, 'bear_atr_min_pct': 0.005437142718941353, 'bear_atr_max_pct': 0.13053080863773697, 'bear_tp_mult': 2.682053211410237, 'bear_tsl_mult': 0.8531296938782789, 'bear_time_stop': 106, 'bear_use_sma': False, 'bear_use_ema': False, 'bear_use_atr': True, 'bear_use_adx': False, 'bear_use_spike': True, 'bear_rsi_required': False, 'sideways_strategy': 'mean_reversion', 'sideways_bb_std_mult': 1.1581529454266786, 'sideways_rsi_os': 51, 'sideways_rsi_ob': 60, 'sideways_adx_thresh': 26.480384771350472, 'sideways_atr_min_pct': 0.006212960918144012, 'sideways_atr_max_pct': 0.09471134505877017, 'sideways_tp_mult': 2.747082414961503, 'sideways_tsl_mult': 0.9396473486539546, 'sideways_time_stop': 178, 'sideways_use_sma': True, 'sideways_use_ema': True, 'sideways_use_atr': False, 'sideways_use_adx': False, 'sideways_use_spike': True, 'sideways_rsi_required': False}.
[I 2025-08-31 11:27:03,537] Trial 749 finished with values: [-1000000000.0, 1000000000.0] and parameters: {'p_sma': 32, 'p_std': 28, 'p_atr': 26, 'p_adx': 29, 'rsi_period': 47, 'ema1': 6, 'ema2': 25, 'slip_atr_k': 0.14108304705577954, 'slip_spread_k': 0.019632155826180275, 'spread_hl_frac': 0.024103289432675257, 'bb_std_mult': 0.57805624687972, 'rsi_os': 24, 'rsi_ob': 85, 'vol_spike': 0.26501118220222847, 'adx_thresh': 10.25443767273602, 'atr_min_pct': 0.020970589950515556, 'atr_max_pct': 0.06273610308383214, 'tp_mult': 2.969367632814674, 'tsl_mult': 0.1133372779913166, 'strategy': 'breakout', 'time_stop': 217, 'use_sma': True, 'use_atr': True, 'use_adx': False, 'use_ema': True, 'use_spike': False, 'rsi_required': False, 'edge_k': 0.7495560407948066, 'edge_cap': 0.7339648209035936, 'bull_strategy': 'mean_reversion', 'bull_bb_std_mult': 3.2012591912634454, 'bull_rsi_os': 39, 'bull_rsi_ob': 63, 'bull_adx_thresh': 33.58468824721953, 'bull_atr_min_pct': 0.02623985168814174, 'bull_atr_max_pct': 0.036207216671532746, 'bull_tp_mult': 1.5411338731712418, 'bull_tsl_mult': 0.2063128721722421, 'bull_time_stop': 35, 'bull_use_sma': False, 'bull_use_ema': True, 'bull_use_atr': False, 'bull_use_adx': True, 'bull_use_spike': False, 'bull_rsi_required': False, 'bear_strategy': 'mean_reversion', 'bear_bb_std_mult': 1.5185631512181907, 'bear_rsi_os': 14, 'bear_rsi_ob': 51, 'bear_adx_thresh': 20.361135294737185, 'bear_atr_min_pct': 0.015064466426750491, 'bear_atr_max_pct': 0.14949738309470512, 'bear_tp_mult': 2.6293815654266797, 'bear_tsl_mult': 0.8572151274977132, 'bear_time_stop': 99, 'bear_use_sma': False, 'bear_use_ema': False, 'bear_use_atr': True, 'bear_use_adx': False, 'bear_use_spike': True, 'bear_rsi_required': False, 'sideways_strategy': 'mean_reversion', 'sideways_bb_std_mult': 1.1680394708949078, 'sideways_rsi_os': 51, 'sideways_rsi_ob': 90, 'sideways_adx_thresh': 23.92241300688751, 'sideways_atr_min_pct': 0.005974712445339609, 'sideways_atr_max_pct': 0.1042293682100234, 'sideways_tp_mult': 1.4828110236810768, 'sideways_tsl_mult': 0.9055903153399518, 'sideways_time_stop': 165, 'sideways_use_sma': True, 'sideways_use_ema': True, 'sideways_use_atr': False, 'sideways_use_adx': False, 'sideways_use_spike': True, 'sideways_rsi_required': False}.
[I 2025-08-31 11:27:03,823] Trial 750 finished with values: [-1000000000.0, 1000000000.0] and parameters: {'p_sma': 34, 'p_std': 50, 'p_atr': 27, 'p_adx': 21, 'rsi_period': 33, 'ema1': 7, 'ema2': 27, 'slip_atr_k': 0.19321262948906595, 'slip_spread_k': 0.0009866153037726977, 'spread_hl_frac': 0.02404443294261574, 'bb_std_mult': 0.5936320662970893, 'rsi_os': 47, 'rsi_ob': 55, 'vol_spike': 0.05271402109041421, 'adx_thresh': 25.42217303831169, 'atr_min_pct': 0.02117736231215747, 'atr_max_pct': 0.06288296836884599, 'tp_mult': 2.9656890100047084, 'tsl_mult': 0.06872470678830245, 'strategy': 'breakout', 'time_stop': 27, 'use_sma': True, 'use_atr': True, 'use_adx': False, 'use_ema': True, 'use_spike': False, 'rsi_required': False, 'edge_k': 0.2960919724829284, 'edge_cap': 0.7329003668337197, 'bull_strategy': 'mean_reversion', 'bull_bb_std_mult': 2.993483907013089, 'bull_rsi_os': 42, 'bull_rsi_ob': 64, 'bull_adx_thresh': 33.76636517053724, 'bull_atr_min_pct': 0.013139640436459451, 'bull_atr_max_pct': 0.035896798308064366, 'bull_tp_mult': 2.8314953155119786, 'bull_tsl_mult': 0.26438021138537715, 'bull_time_stop': 42, 'bull_use_sma': False, 'bull_use_ema': True, 'bull_use_atr': False, 'bull_use_adx': True, 'bull_use_spike': False, 'bull_rsi_required': False, 'bear_strategy': 'mean_reversion', 'bear_bb_std_mult': 2.9487161617376807, 'bear_rsi_os': 43, 'bear_rsi_ob': 51, 'bear_adx_thresh': 20.388204262347422, 'bear_atr_min_pct': 0.005411147786050369, 'bear_atr_max_pct': 0.1087605657744583, 'bear_tp_mult': 1.612536060801382, 'bear_tsl_mult': 0.6226520725342968, 'bear_time_stop': 126, 'bear_use_sma': False, 'bear_use_ema': True, 'bear_use_atr': True, 'bear_use_adx': False, 'bear_use_spike': False, 'bear_rsi_required': False, 'sideways_strategy': 'mean_reversion', 'sideways_bb_std_mult': 3.147354848298362, 'sideways_rsi_os': 38, 'sideways_rsi_ob': 63, 'sideways_adx_thresh': 27.624395688531163, 'sideways_atr_min_pct': 0.004386477651224019, 'sideways_atr_max_pct': 0.06730975283882135, 'sideways_tp_mult': 1.493737186110869, 'sideways_tsl_mult': 0.9026949322436174, 'sideways_time_stop': 143, 'sideways_use_sma': True, 'sideways_use_ema': True, 'sideways_use_atr': False, 'sideways_use_adx': False, 'sideways_use_spike': True, 'sideways_rsi_required': False}.
[I 2025-08-31 11:27:37,457] Trial 752 finished with values: [-1000000000.0, 1000000000.0] and parameters: {'p_sma': 41, 'p_std': 5, 'p_atr': 27, 'p_adx': 24, 'rsi_period': 33, 'ema1': 7, 'ema2': 39, 'slip_atr_k': 0.14181029753862062, 'slip_spread_k': 0.9033994624828146, 'spread_hl_frac': 0.024172514500608235, 'bb_std_mult': 0.738088500335829, 'rsi_os': 25, 'rsi_ob': 85, 'vol_spike': 0.06722279857295678, 'adx_thresh': 10.48499187003302, 'atr_min_pct': 0.022372094991458764, 'atr_max_pct': 0.06171068970077354, 'tp_mult': 2.959768871111076, 'tsl_mult': 0.9821536956666139, 'strategy': 'breakout', 'time_stop': 60, 'use_sma': True, 'use_atr': True, 'use_adx': False, 'use_ema': True, 'use_spike': False, 'rsi_required': False, 'edge_k': 1.4238785586050604, 'edge_cap': 0.7292654047533401, 'bull_strategy': 'mean_reversion', 'bull_bb_std_mult': 3.216253401993028, 'bull_rsi_os': 18, 'bull_rsi_ob': 84, 'bull_adx_thresh': 27.90458033908472, 'bull_atr_min_pct': 0.012208320986086641, 'bull_atr_max_pct': 0.030885363379923203, 'bull_tp_mult': 2.912746830389169, 'bull_tsl_mult': 0.7861112334832566, 'bull_time_stop': 46, 'bull_use_sma': False, 'bull_use_ema': True, 'bull_use_atr': False, 'bull_use_adx': True, 'bull_use_spike': False, 'bull_rsi_required': False, 'bear_strategy': 'mean_reversion', 'bear_bb_std_mult': 1.5437512770720114, 'bear_rsi_os': 50, 'bear_rsi_ob': 56, 'bear_adx_thresh': 28.208726450927095, 'bear_atr_min_pct': 0.0029763886747068004, 'bear_atr_max_pct': 0.10939991997108073, 'bear_tp_mult': 2.623259519275305, 'bear_tsl_mult': 0.8942188267655242, 'bear_time_stop': 100, 'bear_use_sma': False, 'bear_use_ema': True, 'bear_use_atr': False, 'bear_use_adx': False, 'bear_use_spike': False, 'bear_rsi_required': False, 'sideways_strategy': 'mean_reversion', 'sideways_bb_std_mult': 3.1355656950647344, 'sideways_rsi_os': 27, 'sideways_rsi_ob': 63, 'sideways_adx_thresh': 25.64954547185774, 'sideways_atr_min_pct': 0.0046234248338061605, 'sideways_atr_max_pct': 0.044431939294828304, 'sideways_tp_mult': 2.0916472112928566, 'sideways_tsl_mult': 0.8646711661149755, 'sideways_time_stop': 166, 'sideways_use_sma': True, 'sideways_use_ema': True, 'sideways_use_atr': False, 'sideways_use_adx': False, 'sideways_use_spike': True, 'sideways_rsi_required': False}.
[I 2025-08-31 11:27:37,608] Trial 754 finished with values: [-1000000000.0, 1000000000.0] and parameters: {'p_sma': 41, 'p_std': 11, 'p_atr': 28, 'p_adx': 28, 'rsi_period': 13, 'ema1': 5, 'ema2': 33, 'slip_atr_k': 0.011165869619021853, 'slip_spread_k': 0.1627213409058696, 'spread_hl_frac': 0.013354989429920017, 'bb_std_mult': 0.7146142258019459, 'rsi_os': 33, 'rsi_ob': 91, 'vol_spike': 0.19100899553729578, 'adx_thresh': 10.450152423879961, 'atr_min_pct': 0.022372334233431223, 'atr_max_pct': 0.08064190585262068, 'tp_mult': 2.9427051620325853, 'tsl_mult': 0.8610408689296669, 'strategy': 'breakout', 'time_stop': 79, 'use_sma': True, 'use_atr': True, 'use_adx': False, 'use_ema': True, 'use_spike': True, 'rsi_required': False, 'edge_k': 1.426059189798925, 'edge_cap': 0.5524721835848474, 'bull_strategy': 'mean_reversion', 'bull_bb_std_mult': 2.2869383191443253, 'bull_rsi_os': 38, 'bull_rsi_ob': 83, 'bull_adx_thresh': 25.559739498895702, 'bull_atr_min_pct': 0.0168324257480089, 'bull_atr_max_pct': 0.03216434467393572, 'bull_tp_mult': 2.896371193183221, 'bull_tsl_mult': 0.2607150627485641, 'bull_time_stop': 48, 'bull_use_sma': True, 'bull_use_ema': False, 'bull_use_atr': True, 'bull_use_adx': True, 'bull_use_spike': False, 'bull_rsi_required': False, 'bear_strategy': 'mean_reversion', 'bear_bb_std_mult': 1.5775902833110618, 'bear_rsi_os': 40, 'bear_rsi_ob': 56, 'bear_adx_thresh': 9.425851508661435, 'bear_atr_min_pct': 0.00343643335066982, 'bear_atr_max_pct': 0.14040359685630516, 'bear_tp_mult': 1.4870144000233694, 'bear_tsl_mult': 0.8946655556337226, 'bear_time_stop': 88, 'bear_use_sma': False, 'bear_use_ema': True, 'bear_use_atr': False, 'bear_use_adx': False, 'bear_use_spike': False, 'bear_rsi_required': False, 'sideways_strategy': 'mean_reversion', 'sideways_bb_std_mult': 0.9426881143486935, 'sideways_rsi_os': 42, 'sideways_rsi_ob': 45, 'sideways_adx_thresh': 25.69245506260947, 'sideways_atr_min_pct': 0.004967268112944693, 'sideways_atr_max_pct': 0.02946215831471289, 'sideways_tp_mult': 1.578580710621227, 'sideways_tsl_mult': 0.8719460943340113, 'sideways_time_stop': 175, 'sideways_use_sma': True, 'sideways_use_ema': True, 'sideways_use_atr': False, 'sideways_use_adx': False, 'sideways_use_spike': True, 'sideways_rsi_required': False}.
[I 2025-08-31 11:27:37,815] Trial 751 finished with values: [-1000000000.0, 1000000000.0] and parameters: {'p_sma': 41, 'p_std': 5, 'p_atr': 27, 'p_adx': 21, 'rsi_period': 47, 'ema1': 5, 'ema2': 27, 'slip_atr_k': 0.13976068796848345, 'slip_spread_k': 0.1607866892011542, 'spread_hl_frac': 0.020115908604450557, 'bb_std_mult': 2.219553237339343, 'rsi_os': 25, 'rsi_ob': 85, 'vol_spike': 0.0967391160264564, 'adx_thresh': 10.304478693920824, 'atr_min_pct': 0.022523740322727092, 'atr_max_pct': 0.13871224742209154, 'tp_mult': 1.1686353990239264, 'tsl_mult': 0.1168602676568644, 'strategy': 'breakout', 'time_stop': 207, 'use_sma': True, 'use_atr': True, 'use_adx': False, 'use_ema': True, 'use_spike': False, 'rsi_required': False, 'edge_k': 0.7759272229056977, 'edge_cap': 0.7333067031745683, 'bull_strategy': 'mean_reversion', 'bull_bb_std_mult': 2.6223653135034333, 'bull_rsi_os': 40, 'bull_rsi_ob': 86, 'bull_adx_thresh': 27.882547669361593, 'bull_atr_min_pct': 0.016978419346140125, 'bull_atr_max_pct': 0.036878429393173436, 'bull_tp_mult': 2.9007065399447596, 'bull_tsl_mult': 0.2586552101210593, 'bull_time_stop': 47, 'bull_use_sma': False, 'bull_use_ema': True, 'bull_use_atr': False, 'bull_use_adx': True, 'bull_use_spike': False, 'bull_rsi_required': False, 'bear_strategy': 'mean_reversion', 'bear_bb_std_mult': 1.558294765683361, 'bear_rsi_os': 40, 'bear_rsi_ob': 51, 'bear_adx_thresh': 9.531537255871742, 'bear_atr_min_pct': 0.015136130064494553, 'bear_atr_max_pct': 0.1481441444471076, 'bear_tp_mult': 2.317523050876215, 'bear_tsl_mult': 0.8531085534215737, 'bear_time_stop': 126, 'bear_use_sma': False, 'bear_use_ema': True, 'bear_use_atr': False, 'bear_use_adx': False, 'bear_use_spike': False, 'bear_rsi_required': False, 'sideways_strategy': 'mean_reversion', 'sideways_bb_std_mult': 0.9149652602438373, 'sideways_rsi_os': 42, 'sideways_rsi_ob': 90, 'sideways_adx_thresh': 6.164131240458049, 'sideways_atr_min_pct': 0.004598959919319994, 'sideways_atr_max_pct': 0.10426948544572745, 'sideways_tp_mult': 2.685481784924414, 'sideways_tsl_mult': 0.9461895017917923, 'sideways_time_stop': 196, 'sideways_use_sma': True, 'sideways_use_ema': True, 'sideways_use_atr': False, 'sideways_use_adx': False, 'sideways_use_spike': True, 'sideways_rsi_required': False}.
[I 2025-08-31 11:27:37,815] Trial 753 finished with values: [-1000000000.0, 1000000000.0] and parameters: {'p_sma': 41, 'p_std': 11, 'p_atr': 28, 'p_adx': 21, 'rsi_period': 36, 'ema1': 7, 'ema2': 29, 'slip_atr_k': 0.184489347458487, 'slip_spread_k': 0.16523560004225246, 'spread_hl_frac': 0.015777281218948717, 'bb_std_mult': 0.7555486799995524, 'rsi_os': 11, 'rsi_ob': 92, 'vol_spike': 0.06748304649184365, 'adx_thresh': 25.170410227620692, 'atr_min_pct': 0.022190167694858706, 'atr_max_pct': 0.0654075908559455, 'tp_mult': 2.998242206010038, 'tsl_mult': 0.4604178575241862, 'strategy': 'breakout', 'time_stop': 59, 'use_sma': True, 'use_atr': True, 'use_adx': False, 'use_ema': True, 'use_spike': False, 'rsi_required': False, 'edge_k': 1.493560114883577, 'edge_cap': 0.7074889743597685, 'bull_strategy': 'mean_reversion', 'bull_bb_std_mult': 2.538398009221327, 'bull_rsi_os': 44, 'bull_rsi_ob': 64, 'bull_adx_thresh': 27.762083416248235, 'bull_atr_min_pct': 0.017087048824883138, 'bull_atr_max_pct': 0.1061862811141426, 'bull_tp_mult': 2.9062713102772624, 'bull_tsl_mult': 0.2582186373441372, 'bull_time_stop': 45, 'bull_use_sma': False, 'bull_use_ema': False, 'bull_use_atr': True, 'bull_use_adx': True, 'bull_use_spike': False, 'bull_rsi_required': False, 'bear_strategy': 'mean_reversion', 'bear_bb_std_mult': 3.4363625580235535, 'bear_rsi_os': 43, 'bear_rsi_ob': 56, 'bear_adx_thresh': 10.137618016268389, 'bear_atr_min_pct': 0.011616792896595837, 'bear_atr_max_pct': 0.020781381502790464, 'bear_tp_mult': 2.73021244480389, 'bear_tsl_mult': 0.8944095895088334, 'bear_time_stop': 133, 'bear_use_sma': False, 'bear_use_ema': True, 'bear_use_atr': False, 'bear_use_adx': False, 'bear_use_spike': False, 'bear_rsi_required': False, 'sideways_strategy': 'mean_reversion', 'sideways_bb_std_mult': 0.954911405786931, 'sideways_rsi_os': 42, 'sideways_rsi_ob': 63, 'sideways_adx_thresh': 8.69026347877969, 'sideways_atr_min_pct': 0.004666397473301094, 'sideways_atr_max_pct': 0.10548011836915991, 'sideways_tp_mult': 2.094990870987219, 'sideways_tsl_mult': 0.8889790599460546, 'sideways_time_stop': 142, 'sideways_use_sma': True, 'sideways_use_ema': True, 'sideways_use_atr': False, 'sideways_use_adx': False, 'sideways_use_spike': True, 'sideways_rsi_required': False}.
[I 2025-08-31 11:28:11,688] Trial 758 finished with values: [-1000000000.0, 1000000000.0] and parameters: {'p_sma': 39, 'p_std': 53, 'p_atr': 9, 'p_adx': 10, 'rsi_period': 63, 'ema1': 5, 'ema2': 16, 'slip_atr_k': 0.0201395661662922, 'slip_spread_k': 0.7651437349757833, 'spread_hl_frac': 0.01725172375634233, 'bb_std_mult': 1.0344279192321004, 'rsi_os': 29, 'rsi_ob': 83, 'vol_spike': 0.0319919470051942, 'adx_thresh': 10.935363577372748, 'atr_min_pct': 0.013089069244940273, 'atr_max_pct': 0.05256624362914225, 'tp_mult': 2.8928053977069257, 'tsl_mult': 0.1510169530345467, 'strategy': 'breakout', 'time_stop': 84, 'use_sma': True, 'use_atr': True, 'use_adx': True, 'use_ema': True, 'use_spike': True, 'rsi_required': True, 'edge_k': 1.5635995371023523, 'edge_cap': 0.6911754922001303, 'bull_strategy': 'mean_reversion', 'bull_bb_std_mult': 1.7494447982720327, 'bull_rsi_os': 15, 'bull_rsi_ob': 70, 'bull_adx_thresh': 27.134376377102203, 'bull_atr_min_pct': 0.010899550221590908, 'bull_atr_max_pct': 0.04134331078610423, 'bull_tp_mult': 2.8520059681400456, 'bull_tsl_mult': 0.21207425416237924, 'bull_time_stop': 155, 'bull_use_sma': True, 'bull_use_ema': True, 'bull_use_atr': False, 'bull_use_adx': False, 'bull_use_spike': False, 'bull_rsi_required': False, 'bear_strategy': 'mean_reversion', 'bear_bb_std_mult': 1.3961276467451755, 'bear_rsi_os': 51, 'bear_rsi_ob': 54, 'bear_adx_thresh': 34.158127299122, 'bear_atr_min_pct': 0.012268120736730854, 'bear_atr_max_pct': 0.1380937632740789, 'bear_tp_mult': 2.852032436765304, 'bear_tsl_mult': 0.9177738376472123, 'bear_time_stop': 118, 'bear_use_sma': False, 'bear_use_ema': False, 'bear_use_atr': True, 'bear_use_adx': True, 'bear_use_spike': True, 'bear_rsi_required': False, 'sideways_strategy': 'breakout', 'sideways_bb_std_mult': 1.0263514906706859, 'sideways_rsi_os': 15, 'sideways_rsi_ob': 78, 'sideways_adx_thresh': 25.04903847569897, 'sideways_atr_min_pct': 0.005506144264848934, 'sideways_atr_max_pct': 0.09905698550272528, 'sideways_tp_mult': 2.1549600685394674, 'sideways_tsl_mult': 0.8227591159522719, 'sideways_time_stop': 156, 'sideways_use_sma': False, 'sideways_use_ema': True, 'sideways_use_atr': True, 'sideways_use_adx': False, 'sideways_use_spike': True, 'sideways_rsi_required': False}.
