[I 2025-08-31 11:34:41,919] Trial 800 finished with values: [-1000000000.0, 1000000000.0] and parameters: {'p_sma': 32, 'p_std': 50, 'p_atr': 29, 'p_adx': 21, 'rsi_period': 34, 'ema1': 7, 'ema2': 20, 'slip_atr_k': 0.05041878947105401, 'slip_spread_k': 0.583723514798283, 'spread_hl_frac': 0.018433108349097973, 'bb_std_mult': 1.8499456542421353, 'rsi_os': 26, 'rsi_ob': 83, 'vol_spike': 0.0920246416016007, 'adx_thresh': 9.58865017061271, 'atr_min_pct': 0.0035176294775182484, 'atr_max_pct': 0.11906671298423815, 'tp_mult': 2.935480840428413, 'tsl_mult': 0.10382071358087319, 'strategy': 'breakout', 'time_stop': 187, 'use_sma': True, 'use_atr': True, 'use_adx': False, 'use_ema': True, 'use_spike': False, 'rsi_required': False, 'edge_k': 1.51148048306014, 'edge_cap': 0.6841602343484978, 'bull_strategy': 'mean_reversion', 'bull_bb_std_mult': 2.5272441998737696, 'bull_rsi_os': 44, 'bull_rsi_ob': 91, 'bull_adx_thresh': 29.287599309094208, 'bull_atr_min_pct': 0.019757160317107923, 'bull_atr_max_pct': 0.03883985075253389, 'bull_tp_mult': 2.9637156225139107, 'bull_tsl_mult': 0.2525901549774982, 'bull_time_stop': 63, 'bull_use_sma': False, 'bull_use_ema': True, 'bull_use_atr': False, 'bull_use_adx': True, 'bull_use_spike': False, 'bull_rsi_required': False, 'bear_strategy': 'mean_reversion', 'bear_bb_std_mult': 1.4613066608715894, 'bear_rsi_os': 8, 'bear_rsi_ob': 95, 'bear_adx_thresh': 8.33666181643184, 'bear_atr_min_pct': 0.005841396278943402, 'bear_atr_max_pct': 0.07111436225770057, 'bear_tp_mult': 2.6369898318202036, 'bear_tsl_mult': 0.6294251267112958, 'bear_time_stop': 113, 'bear_use_sma': False, 'bear_use_ema': False, 'bear_use_atr': True, 'bear_use_adx': False, 'bear_use_spike': True, 'bear_rsi_required': False, 'sideways_strategy': 'mean_reversion', 'sideways_bb_std_mult': 0.9588730728874346, 'sideways_rsi_os': 6, 'sideways_rsi_ob': 60, 'sideways_adx_thresh': 27.40634507717804, 'sideways_atr_min_pct': 0.01282117272890734, 'sideways_atr_max_pct': 0.1132854976892905, 'sideways_tp_mult': 1.4881063828400212, 'sideways_tsl_mult': 0.8989604516280557, 'sideways_time_stop': 159, 'sideways_use_sma': True, 'sideways_use_ema': True, 'sideways_use_atr': False, 'sideways_use_adx': False, 'sideways_use_spike': True, 'sideways_rsi_required': False}.
[I 2025-08-31 11:34:42,091] Trial 803 finished with values: [-1000000000.0, 1000000000.0] and parameters: {'p_sma': 32, 'p_std': 13, 'p_atr': 15, 'p_adx': 10, 'rsi_period': 35, 'ema1': 5, 'ema2': 23, 'slip_atr_k': 0.048015687647916486, 'slip_spread_k': 0.45430058510128996, 'spread_hl_frac': 0.022734985945884797, 'bb_std_mult': 0.5978368171617316, 'rsi_os': 37, 'rsi_ob': 85, 'vol_spike': 0.09153082293897268, 'adx_thresh': 34.06726036334767, 'atr_min_pct': 0.02114216236590418, 'atr_max_pct': 0.07371740171056054, 'tp_mult': 2.9277413055154775, 'tsl_mult': 0.22687714328425856, 'strategy': 'breakout', 'time_stop': 55, 'use_sma': True, 'use_atr': True, 'use_adx': False, 'use_ema': True, 'use_spike': False, 'rsi_required': False, 'edge_k': 1.4963205531059656, 'edge_cap': 0.7495562937457863, 'bull_strategy': 'mean_reversion', 'bull_bb_std_mult': 2.1164257328147964, 'bull_rsi_os': 10, 'bull_rsi_ob': 62, 'bull_adx_thresh': 28.170424224781186, 'bull_atr_min_pct': 0.013891485921469812, 'bull_atr_max_pct': 0.03892875350879977, 'bull_tp_mult': 2.894380866548708, 'bull_tsl_mult': 0.18398409119271572, 'bull_time_stop': 63, 'bull_use_sma': False, 'bull_use_ema': False, 'bull_use_atr': False, 'bull_use_adx': True, 'bull_use_spike': False, 'bull_rsi_required': False, 'bear_strategy': 'mean_reversion', 'bear_bb_std_mult': 0.8072977956470304, 'bear_rsi_os': 53, 'bear_rsi_ob': 54, 'bear_adx_thresh': 11.026814249554722, 'bear_atr_min_pct': 0.007911858996819105, 'bear_atr_max_pct': 0.023714956342742316, 'bear_tp_mult': 1.9248814384957456, 'bear_tsl_mult': 0.8963720431618214, 'bear_time_stop': 87, 'bear_use_sma': False, 'bear_use_ema': False, 'bear_use_atr': False, 'bear_use_adx': False, 'bear_use_spike': True, 'bear_rsi_required': False, 'sideways_strategy': 'mean_reversion', 'sideways_bb_std_mult': 1.1867761076993322, 'sideways_rsi_os': 37, 'sideways_rsi_ob': 77, 'sideways_adx_thresh': 25.82637043561553, 'sideways_atr_min_pct': 0.005705154481611036, 'sideways_atr_max_pct': 0.10750226392849155, 'sideways_tp_mult': 1.4928712094336756, 'sideways_tsl_mult': 0.2722300122267911, 'sideways_time_stop': 160, 'sideways_use_sma': True, 'sideways_use_ema': True, 'sideways_use_atr': False, 'sideways_use_adx': False, 'sideways_use_spike': True, 'sideways_rsi_required': False}.
[I 2025-08-31 11:34:42,346] Trial 801 finished with values: [-1000000000.0, 1000000000.0] and parameters: {'p_sma': 32, 'p_std': 56, 'p_atr': 15, 'p_adx': 21, 'rsi_period': 13, 'ema1': 5, 'ema2': 20, 'slip_atr_k': 0.009588740370782483, 'slip_spread_k': 0.6606892183950605, 'spread_hl_frac': 0.023262516038407944, 'bb_std_mult': 0.8102382417842073, 'rsi_os': 26, 'rsi_ob': 52, 'vol_spike': 0.044290696840912074, 'adx_thresh': 33.90840936201306, 'atr_min_pct': 0.023602776040028733, 'atr_max_pct': 0.11802947445918269, 'tp_mult': 2.406798572381019, 'tsl_mult': 0.10644241701091929, 'strategy': 'breakout', 'time_stop': 184, 'use_sma': True, 'use_atr': True, 'use_adx': False, 'use_ema': True, 'use_spike': False, 'rsi_required': False, 'edge_k': 1.4954028437829157, 'edge_cap': 0.6854763735450108, 'bull_strategy': 'mean_reversion', 'bull_bb_std_mult': 2.1308086903641934, 'bull_rsi_os': 20, 'bull_rsi_ob': 60, 'bull_adx_thresh': 17.339306204287677, 'bull_atr_min_pct': 0.01538340977061482, 'bull_atr_max_pct': 0.039242108551859965, 'bull_tp_mult': 2.956401228944672, 'bull_tsl_mult': 0.24531042060825992, 'bull_time_stop': 192, 'bull_use_sma': False, 'bull_use_ema': True, 'bull_use_atr': False, 'bull_use_adx': True, 'bull_use_spike': False, 'bull_rsi_required': False, 'bear_strategy': 'mean_reversion', 'bear_bb_std_mult': 0.8102885239338133, 'bear_rsi_os': 17, 'bear_rsi_ob': 53, 'bear_adx_thresh': 11.26282072067532, 'bear_atr_min_pct': 0.008363229678296894, 'bear_atr_max_pct': 0.1286773020247518, 'bear_tp_mult': 2.579503130939586, 'bear_tsl_mult': 0.6059862212381879, 'bear_time_stop': 113, 'bear_use_sma': False, 'bear_use_ema': False, 'bear_use_atr': False, 'bear_use_adx': False, 'bear_use_spike': True, 'bear_rsi_required': False, 'sideways_strategy': 'mean_reversion', 'sideways_bb_std_mult': 1.9189640547856455, 'sideways_rsi_os': 40, 'sideways_rsi_ob': 60, 'sideways_adx_thresh': 32.6436789166847, 'sideways_atr_min_pct': 0.02525607613169272, 'sideways_atr_max_pct': 0.10723807045619609, 'sideways_tp_mult': 1.5017304471692654, 'sideways_tsl_mult': 0.36317197396034434, 'sideways_time_stop': 160, 'sideways_use_sma': True, 'sideways_use_ema': True, 'sideways_use_atr': False, 'sideways_use_adx': False, 'sideways_use_spike': True, 'sideways_rsi_required': False}.
[I 2025-08-31 11:34:43,164] Trial 805 finished with values: [-1000000000.0, 1000000000.0] and parameters: {'p_sma': 37, 'p_std': 14, 'p_atr': 27, 'p_adx': 20, 'rsi_period': 32, 'ema1': 5, 'ema2': 35, 'slip_atr_k': 0.24019925914492404, 'slip_spread_k': 0.6451079981259311, 'spread_hl_frac': 0.02100552287114769, 'bb_std_mult': 3.3832895093210817, 'rsi_os': 54, 'rsi_ob': 46, 'vol_spike': 0.1720109876447332, 'adx_thresh': 18.307138361593573, 'atr_min_pct': 0.021667327583823632, 'atr_max_pct': 0.010324004763539063, 'tp_mult': 2.174605048512145, 'tsl_mult': 0.01830129541037434, 'strategy': 'breakout', 'time_stop': 282, 'use_sma': True, 'use_atr': True, 'use_adx': False, 'use_ema': True, 'use_spike': False, 'rsi_required': False, 'edge_k': 0.9651204371764424, 'edge_cap': 0.9438412773984801, 'bull_strategy': 'mean_reversion', 'bull_bb_std_mult': 2.131390780855424, 'bull_rsi_os': 20, 'bull_rsi_ob': 71, 'bull_adx_thresh': 28.215196046743493, 'bull_atr_min_pct': 0.014064816700630303, 'bull_atr_max_pct': 0.021177039899300254, 'bull_tp_mult': 2.0169520794485996, 'bull_tsl_mult': 0.21840920856817608, 'bull_time_stop': 138, 'bull_use_sma': False, 'bull_use_ema': True, 'bull_use_atr': False, 'bull_use_adx': True, 'bull_use_spike': False, 'bull_rsi_required': False, 'bear_strategy': 'mean_reversion', 'bear_bb_std_mult': 0.7947228681363288, 'bear_rsi_os': 18, 'bear_rsi_ob': 54, 'bear_adx_thresh': 11.297063680596207, 'bear_atr_min_pct': 0.013321505894176031, 'bear_atr_max_pct': 0.13581938666136886, 'bear_tp_mult': 1.936405148729607, 'bear_tsl_mult': 0.7726886384056447, 'bear_time_stop': 148, 'bear_use_sma': False, 'bear_use_ema': False, 'bear_use_atr': False, 'bear_use_adx': False, 'bear_use_spike': True, 'bear_rsi_required': False, 'sideways_strategy': 'mean_reversion', 'sideways_bb_std_mult': 1.165115542290596, 'sideways_rsi_os': 8, 'sideways_rsi_ob': 63, 'sideways_adx_thresh': 26.433300551170873, 'sideways_atr_min_pct': 0.0059441459333739914, 'sideways_atr_max_pct': 0.06441552983940771, 'sideways_tp_mult': 2.202521553827041, 'sideways_tsl_mult': 0.48827728842081763, 'sideways_time_stop': 171, 'sideways_use_sma': True, 'sideways_use_ema': True, 'sideways_use_atr': False, 'sideways_use_adx': False, 'sideways_use_spike': True, 'sideways_rsi_required': True}.
[I 2025-08-31 11:35:16,966] Trial 807 finished with values: [-0.009260163764179152, 0.013162927186625834] and parameters: {'p_sma': 7, 'p_std': 9, 'p_atr': 29, 'p_adx': 20, 'rsi_period': 33, 'ema1': 5, 'ema2': 47, 'slip_atr_k': 0.0300893654164143, 'slip_spread_k': 0.37702236392284993, 'spread_hl_frac': 0.020848460171756806, 'bb_std_mult': 2.2532412348266897, 'rsi_os': 30, 'rsi_ob': 84, 'vol_spike': 0.17302700513044778, 'adx_thresh': 12.542268133063018, 'atr_min_pct': 0.011681024242108838, 'atr_max_pct': 0.05843590676463626, 'tp_mult': 1.3991060425526756, 'tsl_mult': 0.8070551691926484, 'strategy': 'breakout', 'time_stop': 69, 'use_sma': True, 'use_atr': True, 'use_adx': False, 'use_ema': True, 'use_spike': True, 'rsi_required': False, 'edge_k': 0.31825934492123975, 'edge_cap': 0.715917205195162, 'bull_strategy': 'mean_reversion', 'bull_bb_std_mult': 1.762490484939629, 'bull_rsi_os': 37, 'bull_rsi_ob': 48, 'bull_adx_thresh': 27.870639096996502, 'bull_atr_min_pct': 0.011245585190159748, 'bull_atr_max_pct': 0.0355666735945232, 'bull_tp_mult': 2.898472750519579, 'bull_tsl_mult': 0.2072185758299548, 'bull_time_stop': 268, 'bull_use_sma': True, 'bull_use_ema': True, 'bull_use_atr': True, 'bull_use_adx': False, 'bull_use_spike': False, 'bull_rsi_required': False, 'bear_strategy': 'mean_reversion', 'bear_bb_std_mult': 1.6682019504166952, 'bear_rsi_os': 49, 'bear_rsi_ob': 45, 'bear_adx_thresh': 24.23881809880573, 'bear_atr_min_pct': 0.0039050487693470023, 'bear_atr_max_pct': 0.13658489403463403, 'bear_tp_mult': 2.9141433944095527, 'bear_tsl_mult': 0.47297071477508484, 'bear_time_stop': 227, 'bear_use_sma': False, 'bear_use_ema': False, 'bear_use_atr': True, 'bear_use_adx': True, 'bear_use_spike': True, 'bear_rsi_required': False, 'sideways_strategy': 'mean_reversion', 'sideways_bb_std_mult': 1.1473088540660419, 'sideways_rsi_os': 47, 'sideways_rsi_ob': 46, 'sideways_adx_thresh': 26.52471774067272, 'sideways_atr_min_pct': 0.004561407587130773, 'sideways_atr_max_pct': 0.10183199788328676, 'sideways_tp_mult': 1.5535702312328792, 'sideways_tsl_mult': 0.9278812181989785, 'sideways_time_stop': 172, 'sideways_use_sma': True, 'sideways_use_ema': True, 'sideways_use_atr': False, 'sideways_use_adx': False, 'sideways_use_spike': True, 'sideways_rsi_required': True}.
[I 2025-08-31 11:35:17,476] Trial 804 finished with values: [-1000000000.0, 1000000000.0] and parameters: {'p_sma': 49, 'p_std': 14, 'p_atr': 29, 'p_adx': 21, 'rsi_period': 34, 'ema1': 18, 'ema2': 13, 'slip_atr_k': 0.011568110148505555, 'slip_spread_k': 0.6778418520810809, 'spread_hl_frac': 0.022940898107264098, 'bb_std_mult': 1.186262439948635, 'rsi_os': 36, 'rsi_ob': 84, 'vol_spike': 0.08992862194450302, 'adx_thresh': 33.931849788299075, 'atr_min_pct': 0.023385981153707554, 'atr_max_pct': 0.11962533702633088, 'tp_mult': 2.931658774990102, 'tsl_mult': 0.10399988648827826, 'strategy': 'breakout', 'time_stop': 70, 'use_sma': True, 'use_atr': True, 'use_adx': False, 'use_ema': True, 'use_spike': False, 'rsi_required': False, 'edge_k': 1.5092585691851075, 'edge_cap': 0.7490760236272148, 'bull_strategy': 'mean_reversion', 'bull_bb_std_mult': 1.8418447875183483, 'bull_rsi_os': 37, 'bull_rsi_ob': 71, 'bull_adx_thresh': 17.03337755662533, 'bull_atr_min_pct': 0.013805455925624772, 'bull_atr_max_pct': 0.036663455434829476, 'bull_tp_mult': 1.68667282299045, 'bull_tsl_mult': 0.18530268162889962, 'bull_time_stop': 40, 'bull_use_sma': False, 'bull_use_ema': True, 'bull_use_atr': False, 'bull_use_adx': True, 'bull_use_spike': False, 'bull_rsi_required': False, 'bear_strategy': 'mean_reversion', 'bear_bb_std_mult': 1.3509142885273144, 'bear_rsi_os': 53, 'bear_rsi_ob': 84, 'bear_adx_thresh': 13.05029684527363, 'bear_atr_min_pct': 0.027127151286234198, 'bear_atr_max_pct': 0.13599467960476339, 'bear_tp_mult': 2.7938317057360957, 'bear_tsl_mult': 0.6270623325119858, 'bear_time_stop': 227, 'bear_use_sma': False, 'bear_use_ema': False, 'bear_use_atr': True, 'bear_use_adx': False, 'bear_use_spike': True, 'bear_rsi_required': False, 'sideways_strategy': 'mean_reversion', 'sideways_bb_std_mult': 2.332699062642794, 'sideways_rsi_os': 8, 'sideways_rsi_ob': 46, 'sideways_adx_thresh': 8.049885489811679, 'sideways_atr_min_pct': 0.0096969189163708, 'sideways_atr_max_pct': 0.06518486650103295, 'sideways_tp_mult': 2.1350844849507804, 'sideways_tsl_mult': 0.9000177428408428, 'sideways_time_stop': 14, 'sideways_use_sma': True, 'sideways_use_ema': True, 'sideways_use_atr': False, 'sideways_use_adx': False, 'sideways_use_spike': True, 'sideways_rsi_required': False}.
[I 2025-08-31 11:35:17,488] Trial 806 finished with values: [-1000000000.0, 1000000000.0] and parameters: {'p_sma': 7, 'p_std': 19, 'p_atr': 30, 'p_adx': 20, 'rsi_period': 32, 'ema1': 5, 'ema2': 28, 'slip_atr_k': 0.010499462626059348, 'slip_spread_k': 0.48158893232912947, 'spread_hl_frac': 0.021306799873030535, 'bb_std_mult': 0.7383469406259993, 'rsi_os': 16, 'rsi_ob': 84, 'vol_spike': 0.17231471354451688, 'adx_thresh': 13.119661668075608, 'atr_min_pct': 0.023043675505512444, 'atr_max_pct': 0.058141957994056886, 'tp_mult': 1.140461298594812, 'tsl_mult': 0.29859244617002756, 'strategy': 'breakout', 'time_stop': 239, 'use_sma': True, 'use_atr': True, 'use_adx': False, 'use_ema': True, 'use_spike': False, 'rsi_required': False, 'edge_k': 1.4457059179901413, 'edge_cap': 0.7112812573800866, 'bull_strategy': 'mean_reversion', 'bull_bb_std_mult': 1.5284024577913446, 'bull_rsi_os': 52, 'bull_rsi_ob': 60, 'bull_adx_thresh': 15.109378554660466, 'bull_atr_min_pct': 0.009206505132954602, 'bull_atr_max_pct': 0.03512323779506648, 'bull_tp_mult': 2.0027875507186303, 'bull_tsl_mult': 0.5752271833244614, 'bull_time_stop': 106, 'bull_use_sma': False, 'bull_use_ema': True, 'bull_use_atr': True, 'bull_use_adx': False, 'bull_use_spike': False, 'bull_rsi_required': False, 'bear_strategy': 'mean_reversion', 'bear_bb_std_mult': 0.5040270165260534, 'bear_rsi_os': 50, 'bear_rsi_ob': 52, 'bear_adx_thresh': 9.958477372818583, 'bear_atr_min_pct': 0.008822678343003678, 'bear_atr_max_pct': 0.1349120213797601, 'bear_tp_mult': 2.8156678598699254, 'bear_tsl_mult': 0.4746351622554899, 'bear_time_stop': 98, 'bear_use_sma': False, 'bear_use_ema': False, 'bear_use_atr': True, 'bear_use_adx': True, 'bear_use_spike': True, 'bear_rsi_required': False, 'sideways_strategy': 'mean_reversion', 'sideways_bb_std_mult': 1.1289593293285893, 'sideways_rsi_os': 45, 'sideways_rsi_ob': 73, 'sideways_adx_thresh': 19.412619794206602, 'sideways_atr_min_pct': 0.007212954070599101, 'sideways_atr_max_pct': 0.05978986779936406, 'sideways_tp_mult': 1.5288143821022775, 'sideways_tsl_mult': 0.9734660781091683, 'sideways_time_stop': 53, 'sideways_use_sma': True, 'sideways_use_ema': True, 'sideways_use_atr': False, 'sideways_use_adx': False, 'sideways_use_spike': True, 'sideways_rsi_required': True}.
[I 2025-08-31 11:35:19,078] Trial 808 finished with values: [-1000000000.0, 1000000000.0] and parameters: {'p_sma': 29, 'p_std': 9, 'p_atr': 29, 'p_adx': 20, 'rsi_period': 10, 'ema1': 29, 'ema2': 13, 'slip_atr_k': 0.031042331998179528, 'slip_spread_k': 0.8331493817842327, 'spread_hl_frac': 0.042449005491177846, 'bb_std_mult': 0.7245422307906076, 'rsi_os': 30, 'rsi_ob': 84, 'vol_spike': 0.08532945609506198, 'adx_thresh': 13.002519192383811, 'atr_min_pct': 0.022932546201465828, 'atr_max_pct': 0.05790330779937643, 'tp_mult': 2.8594313450821094, 'tsl_mult': 0.8884636594537676, 'strategy': 'breakout', 'time_stop': 69, 'use_sma': True, 'use_atr': True, 'use_adx': False, 'use_ema': True, 'use_spike': True, 'rsi_required': False, 'edge_k': 1.442620650770491, 'edge_cap': 0.708434796951609, 'bull_strategy': 'mean_reversion', 'bull_bb_std_mult': 1.5383578066895516, 'bull_rsi_os': 40, 'bull_rsi_ob': 55, 'bull_adx_thresh': 24.012065959263687, 'bull_atr_min_pct': 0.011440238819432465, 'bull_atr_max_pct': 0.03581596199561568, 'bull_tp_mult': 2.8960610675814653, 'bull_tsl_mult': 0.9400769155476564, 'bull_time_stop': 40, 'bull_use_sma': True, 'bull_use_ema': True, 'bull_use_atr': True, 'bull_use_adx': False, 'bull_use_spike': False, 'bull_rsi_required': False, 'bear_strategy': 'mean_reversion', 'bear_bb_std_mult': 1.6408050087358, 'bear_rsi_os': 55, 'bear_rsi_ob': 74, 'bear_adx_thresh': 10.116775767132811, 'bear_atr_min_pct': 0.009097618985305988, 'bear_atr_max_pct': 0.13953441600942837, 'bear_tp_mult': 2.7852126448579266, 'bear_tsl_mult': 0.9551989447119422, 'bear_time_stop': 106, 'bear_use_sma': False, 'bear_use_ema': False, 'bear_use_atr': True, 'bear_use_adx': True, 'bear_use_spike': True, 'bear_rsi_required': False, 'sideways_strategy': 'mean_reversion', 'sideways_bb_std_mult': 1.0729605826800401, 'sideways_rsi_os': 39, 'sideways_rsi_ob': 70, 'sideways_adx_thresh': 7.918851042551713, 'sideways_atr_min_pct': 0.007490713417856518, 'sideways_atr_max_pct': 0.05007845519773783, 'sideways_tp_mult': 2.0635510735462983, 'sideways_tsl_mult': 0.9304467513151327, 'sideways_time_stop': 11, 'sideways_use_sma': True, 'sideways_use_ema': True, 'sideways_use_atr': True, 'sideways_use_adx': False, 'sideways_use_spike': True, 'sideways_rsi_required': False}.
[I 2025-08-31 11:35:54,760] Trial 812 finished with values: [-1000000000.0, 1000000000.0] and parameters: {'p_sma': 5, 'p_std': 16, 'p_atr': 12, 'p_adx': 14, 'rsi_period': 36, 'ema1': 15, 'ema2': 18, 'slip_atr_k': 0.0197840385552522, 'slip_spread_k': 0.5251593261426494, 'spread_hl_frac': 0.03702295063613483, 'bb_std_mult': 0.6560127353217629, 'rsi_os': 28, 'rsi_ob': 82, 'vol_spike': 0.0512103539708703, 'adx_thresh': 16.776296874387633, 'atr_min_pct': 0.007749037462864947, 'atr_max_pct': 0.05184077807411037, 'tp_mult': 1.4966518062802447, 'tsl_mult': 0.12381087981712671, 'strategy': 'breakout', 'time_stop': 79, 'use_sma': True, 'use_atr': True, 'use_adx': True, 'use_ema': True, 'use_spike': False, 'rsi_required': True, 'edge_k': 1.5588020758128756, 'edge_cap': 0.4499503417326886, 'bull_strategy': 'mean_reversion', 'bull_bb_std_mult': 2.3357510593855886, 'bull_rsi_os': 39, 'bull_rsi_ob': 62, 'bull_adx_thresh': 25.736213319436644, 'bull_atr_min_pct': 0.011940623756760225, 'bull_atr_max_pct': 0.02548919140879423, 'bull_tp_mult': 2.6427148936490283, 'bull_tsl_mult': 0.22433469912403903, 'bull_time_stop': 49, 'bull_use_sma': False, 'bull_use_ema': False, 'bull_use_atr': False, 'bull_use_adx': True, 'bull_use_spike': False, 'bull_rsi_required': False, 'bear_strategy': 'mean_reversion', 'bear_bb_std_mult': 1.5569016267966287, 'bear_rsi_os': 52, 'bear_rsi_ob': 49, 'bear_adx_thresh': 21.564942146691088, 'bear_atr_min_pct': 0.01875944750134328, 'bear_atr_max_pct': 0.13070881053894987, 'bear_tp_mult': 1.8257288619134329, 'bear_tsl_mult': 0.8893423667377331, 'bear_time_stop': 122, 'bear_use_sma': True, 'bear_use_ema': True, 'bear_use_atr': True, 'bear_use_adx': False, 'bear_use_spike': False, 'bear_rsi_required': False, 'sideways_strategy': 'breakout', 'sideways_bb_std_mult': 1.8262367737082061, 'sideways_rsi_os': 39, 'sideways_rsi_ob': 63, 'sideways_adx_thresh': 21.149825647339394, 'sideways_atr_min_pct': 0.004911846966190146, 'sideways_atr_max_pct': 0.11045461738050807, 'sideways_tp_mult': 1.6020871813834938, 'sideways_tsl_mult': 0.22335384807598108, 'sideways_time_stop': 106, 'sideways_use_sma': False, 'sideways_use_ema': True, 'sideways_use_atr': True, 'sideways_use_adx': True, 'sideways_use_spike': True, 'sideways_rsi_required': False}.
