[I 2025-08-31 10:24:02,167] Trial 260 finished with values: [-0.008439999028691081, 0.009878283542732097] and parameters: {'p_sma': 13, 'p_std': 33, 'p_atr': 10, 'p_adx': 23, 'rsi_period': 12, 'ema1': 10, 'ema2': 60, 'slip_atr_k': 0.07111893390142039, 'slip_spread_k': 0.3096052353626657, 'spread_hl_frac': 0.03172134090180021, 'bb_std_mult': 2.830525489223649, 'rsi_os': 25, 'rsi_ob': 79, 'vol_spike': 0.2119426467410345, 'adx_thresh': 10.359966959789931, 'atr_min_pct': 0.01835960475266407, 'atr_max_pct': 0.044753271438207134, 'tp_mult': 2.8785122882393437, 'tsl_mult': 0.7264519951391274, 'strategy': 'mean_reversion', 'time_stop': 5, 'use_sma': False, 'use_atr': True, 'use_adx': True, 'use_ema': True, 'use_spike': True, 'rsi_required': True, 'edge_k': 0.2063606864346189, 'edge_cap': 0.22654707340209143, 'bull_strategy': 'breakout', 'bull_bb_std_mult': 0.6722678602880383, 'bull_rsi_os': 25, 'bull_rsi_ob': 75, 'bull_adx_thresh': 10.885892245447755, 'bull_atr_min_pct': 0.012839445638481183, 'bull_atr_max_pct': 0.07471038386923079, 'bull_tp_mult': 1.1783039474013641, 'bull_tsl_mult': 0.9020129641316754, 'bull_time_stop': 11, 'bull_use_sma': False, 'bull_use_ema': True, 'bull_use_atr': True, 'bull_use_adx': False, 'bull_use_spike': True, 'bull_rsi_required': False, 'bear_strategy': 'mean_reversion', 'bear_bb_std_mult': 1.9386900182814386, 'bear_rsi_os': 35, 'bear_rsi_ob': 79, 'bear_adx_thresh': 7.013502429496064, 'bear_atr_min_pct': 0.016573899427101073, 'bear_atr_max_pct': 0.12717425620921255, 'bear_tp_mult': 1.4541402968671624, 'bear_tsl_mult': 0.13745823999765217, 'bear_time_stop': 21, 'bear_use_sma': False, 'bear_use_ema': False, 'bear_use_atr': False, 'bear_use_adx': False, 'bear_use_spike': True, 'bear_rsi_required': False, 'sideways_strategy': 'breakout', 'sideways_bb_std_mult': 2.7279078731061506, 'sideways_rsi_os': 37, 'sideways_rsi_ob': 82, 'sideways_adx_thresh': 15.751335183510056, 'sideways_atr_min_pct': 0.0024281070902490527, 'sideways_atr_max_pct': 0.13454143756306686, 'sideways_tp_mult': 1.766789307445309, 'sideways_tsl_mult': 0.4283439857172583, 'sideways_time_stop': 248, 'sideways_use_sma': True, 'sideways_use_ema': False, 'sideways_use_atr': True, 'sideways_use_adx': False, 'sideways_use_spike': True, 'sideways_rsi_required': False}.
[I 2025-08-31 10:24:35,259] Trial 264 finished with values: [-1000000000.0, 1000000000.0] and parameters: {'p_sma': 13, 'p_std': 33, 'p_atr': 22, 'p_adx': 19, 'rsi_period': 65, 'ema1': 8, 'ema2': 58, 'slip_atr_k': 0.15259557092695947, 'slip_spread_k': 0.9955633748546067, 'spread_hl_frac': 0.03162751918535704, 'bb_std_mult': 1.3360160034814528, 'rsi_os': 39, 'rsi_ob': 75, 'vol_spike': 0.10238371775621152, 'adx_thresh': 8.504281554840174, 'atr_min_pct': 0.016615840992574505, 'atr_max_pct': 0.04071868427823516, 'tp_mult': 2.282954721248906, 'tsl_mult': 0.6537909653666426, 'strategy': 'mean_reversion', 'time_stop': 184, 'use_sma': False, 'use_atr': False, 'use_adx': True, 'use_ema': False, 'use_spike': True, 'rsi_required': True, 'edge_k': 1.1179280211919138, 'edge_cap': 0.2016004288602003, 'bull_strategy': 'breakout', 'bull_bb_std_mult': 1.048544492767945, 'bull_rsi_os': 37, 'bull_rsi_ob': 52, 'bull_adx_thresh': 10.758362148783416, 'bull_atr_min_pct': 0.003960716259027994, 'bull_atr_max_pct': 0.0713091752638079, 'bull_tp_mult': 1.1973520814602736, 'bull_tsl_mult': 0.1260600825301523, 'bull_time_stop': 29, 'bull_use_sma': False, 'bull_use_ema': True, 'bull_use_atr': True, 'bull_use_adx': True, 'bull_use_spike': True, 'bull_rsi_required': False, 'bear_strategy': 'breakout', 'bear_bb_std_mult': 1.9272281256702801, 'bear_rsi_os': 23, 'bear_rsi_ob': 54, 'bear_adx_thresh': 6.947361898790064, 'bear_atr_min_pct': 0.015817751184368727, 'bear_atr_max_pct': 0.12499092312472654, 'bear_tp_mult': 2.6250093908587306, 'bear_tsl_mult': 0.15020972786795736, 'bear_time_stop': 175, 'bear_use_sma': False, 'bear_use_ema': False, 'bear_use_atr': True, 'bear_use_adx': False, 'bear_use_spike': True, 'bear_rsi_required': True, 'sideways_strategy': 'breakout', 'sideways_bb_std_mult': 2.474950969777498, 'sideways_rsi_os': 35, 'sideways_rsi_ob': 81, 'sideways_adx_thresh': 14.897661137951264, 'sideways_atr_min_pct': 0.0025740916337499997, 'sideways_atr_max_pct': 0.012672504490665818, 'sideways_tp_mult': 1.66452607579478, 'sideways_tsl_mult': 0.4176323569627002, 'sideways_time_stop': 192, 'sideways_use_sma': True, 'sideways_use_ema': False, 'sideways_use_atr': False, 'sideways_use_adx': False, 'sideways_use_spike': True, 'sideways_rsi_required': False}.
[I 2025-08-31 10:24:35,414] Trial 263 finished with values: [-0.00637729686891364, 0.009153907668633747] and parameters: {'p_sma': 13, 'p_std': 19, 'p_atr': 23, 'p_adx': 8, 'rsi_period': 23, 'ema1': 11, 'ema2': 59, 'slip_atr_k': 0.06963522210514839, 'slip_spread_k': 0.252194554375457, 'spread_hl_frac': 0.02779603805960981, 'bb_std_mult': 2.7910744472147484, 'rsi_os': 39, 'rsi_ob': 75, 'vol_spike': 0.2855211142014564, 'adx_thresh': 8.481607313697548, 'atr_min_pct': 0.021389542020352547, 'atr_max_pct': 0.04442938392750187, 'tp_mult': 1.328057419924296, 'tsl_mult': 0.7271081539286824, 'strategy': 'mean_reversion', 'time_stop': 131, 'use_sma': False, 'use_atr': False, 'use_adx': True, 'use_ema': False, 'use_spike': True, 'rsi_required': True, 'edge_k': 1.117731197946019, 'edge_cap': 0.21046750549005644, 'bull_strategy': 'breakout', 'bull_bb_std_mult': 3.1866298497967054, 'bull_rsi_os': 22, 'bull_rsi_ob': 75, 'bull_adx_thresh': 10.605810443271134, 'bull_atr_min_pct': 0.004046961204599691, 'bull_atr_max_pct': 0.07152132350819768, 'bull_tp_mult': 1.1788664704589404, 'bull_tsl_mult': 0.14451435681112362, 'bull_time_stop': 20, 'bull_use_sma': False, 'bull_use_ema': True, 'bull_use_atr': True, 'bull_use_adx': True, 'bull_use_spike': True, 'bull_rsi_required': False, 'bear_strategy': 'mean_reversion', 'bear_bb_std_mult': 2.135001475511713, 'bear_rsi_os': 27, 'bear_rsi_ob': 54, 'bear_adx_thresh': 8.26570663849359, 'bear_atr_min_pct': 0.002771097053170567, 'bear_atr_max_pct': 0.03253961735546086, 'bear_tp_mult': 2.586893001043947, 'bear_tsl_mult': 0.14413453030492723, 'bear_time_stop': 176, 'bear_use_sma': False, 'bear_use_ema': False, 'bear_use_atr': True, 'bear_use_adx': False, 'bear_use_spike': True, 'bear_rsi_required': True, 'sideways_strategy': 'breakout', 'sideways_bb_std_mult': 2.4539615647733255, 'sideways_rsi_os': 37, 'sideways_rsi_ob': 82, 'sideways_adx_thresh': 14.728114851908082, 'sideways_atr_min_pct': 0.002415370859595957, 'sideways_atr_max_pct': 0.012340232933322993, 'sideways_tp_mult': 1.2747588370889618, 'sideways_tsl_mult': 0.7987676025713654, 'sideways_time_stop': 269, 'sideways_use_sma': True, 'sideways_use_ema': False, 'sideways_use_atr': False, 'sideways_use_adx': False, 'sideways_use_spike': True, 'sideways_rsi_required': False}.
[I 2025-08-31 10:24:35,633] Trial 262 finished with values: [-0.020335818894731683, 0.022143645318705243] and parameters: {'p_sma': 22, 'p_std': 32, 'p_atr': 17, 'p_adx': 8, 'rsi_period': 23, 'ema1': 11, 'ema2': 58, 'slip_atr_k': 0.12872605985472255, 'slip_spread_k': 0.3073343018933242, 'spread_hl_frac': 0.02843631550607967, 'bb_std_mult': 2.8312970204606693, 'rsi_os': 39, 'rsi_ob': 78, 'vol_spike': 0.22043100397824583, 'adx_thresh': 10.424401782833074, 'atr_min_pct': 0.02526470785490624, 'atr_max_pct': 0.041926393786308705, 'tp_mult': 2.88324725992385, 'tsl_mult': 0.5681026482510192, 'strategy': 'mean_reversion', 'time_stop': 169, 'use_sma': False, 'use_atr': False, 'use_adx': True, 'use_ema': False, 'use_spike': True, 'rsi_required': True, 'edge_k': 1.777512841597746, 'edge_cap': 0.20409280763366466, 'bull_strategy': 'breakout', 'bull_bb_std_mult': 1.0390188449989126, 'bull_rsi_os': 22, 'bull_rsi_ob': 75, 'bull_adx_thresh': 34.957128755244504, 'bull_atr_min_pct': 0.005694472724327314, 'bull_atr_max_pct': 0.07091833016566447, 'bull_tp_mult': 1.1970400029169481, 'bull_tsl_mult': 0.9144490971326339, 'bull_time_stop': 96, 'bull_use_sma': False, 'bull_use_ema': True, 'bull_use_atr': True, 'bull_use_adx': True, 'bull_use_spike': True, 'bull_rsi_required': False, 'bear_strategy': 'mean_reversion', 'bear_bb_std_mult': 2.0274327734158586, 'bear_rsi_os': 27, 'bear_rsi_ob': 67, 'bear_adx_thresh': 33.678286958467595, 'bear_atr_min_pct': 0.0028172457849201735, 'bear_atr_max_pct': 0.12456348897705913, 'bear_tp_mult': 2.5980455452804647, 'bear_tsl_mult': 0.13576051151925878, 'bear_time_stop': 245, 'bear_use_sma': False, 'bear_use_ema': False, 'bear_use_atr': False, 'bear_use_adx': False, 'bear_use_spike': True, 'bear_rsi_required': True, 'sideways_strategy': 'breakout', 'sideways_bb_std_mult': 2.734756498949882, 'sideways_rsi_os': 27, 'sideways_rsi_ob': 81, 'sideways_adx_thresh': 16.66204955335931, 'sideways_atr_min_pct': 0.0022837259403888244, 'sideways_atr_max_pct': 0.011072371843812918, 'sideways_tp_mult': 1.2817976851462256, 'sideways_tsl_mult': 0.430577002778392, 'sideways_time_stop': 44, 'sideways_use_sma': True, 'sideways_use_ema': False, 'sideways_use_atr': False, 'sideways_use_adx': False, 'sideways_use_spike': True, 'sideways_rsi_required': False}.
[I 2025-08-31 10:24:35,633] Trial 265 finished with values: [-1000000000.0, 1000000000.0] and parameters: {'p_sma': 22, 'p_std': 19, 'p_atr': 16, 'p_adx': 19, 'rsi_period': 31, 'ema1': 14, 'ema2': 58, 'slip_atr_k': 0.12987240256148014, 'slip_spread_k': 0.4512900524182685, 'spread_hl_frac': 0.028327527164276268, 'bb_std_mult': 2.6159504344193527, 'rsi_os': 39, 'rsi_ob': 75, 'vol_spike': 0.21456357265794157, 'adx_thresh': 28.968593459396036, 'atr_min_pct': 0.019381507095873357, 'atr_max_pct': 0.04159629889355733, 'tp_mult': 1.6295486316115984, 'tsl_mult': 0.6592063986723876, 'strategy': 'mean_reversion', 'time_stop': 232, 'use_sma': False, 'use_atr': False, 'use_adx': True, 'use_ema': False, 'use_spike': True, 'rsi_required': True, 'edge_k': 1.796745952590612, 'edge_cap': 0.1937301967647302, 'bull_strategy': 'breakout', 'bull_bb_std_mult': 3.1974628064430033, 'bull_rsi_os': 37, 'bull_rsi_ob': 76, 'bull_adx_thresh': 10.463110594703737, 'bull_atr_min_pct': 0.005612736483472683, 'bull_atr_max_pct': 0.12624912223278562, 'bull_tp_mult': 1.1866178093697661, 'bull_tsl_mult': 0.13305946382836745, 'bull_time_stop': 96, 'bull_use_sma': False, 'bull_use_ema': True, 'bull_use_atr': True, 'bull_use_adx': True, 'bull_use_spike': True, 'bull_rsi_required': False, 'bear_strategy': 'breakout', 'bear_bb_std_mult': 3.3957815084648164, 'bear_rsi_os': 27, 'bear_rsi_ob': 55, 'bear_adx_thresh': 7.009039782439709, 'bear_atr_min_pct': 0.015931565835421962, 'bear_atr_max_pct': 0.03365417700447777, 'bear_tp_mult': 1.6364356211734046, 'bear_tsl_mult': 0.7716264646304648, 'bear_time_stop': 210, 'bear_use_sma': False, 'bear_use_ema': False, 'bear_use_atr': True, 'bear_use_adx': False, 'bear_use_spike': True, 'bear_rsi_required': True, 'sideways_strategy': 'breakout', 'sideways_bb_std_mult': 2.4735084538099494, 'sideways_rsi_os': 35, 'sideways_rsi_ob': 81, 'sideways_adx_thresh': 14.861817735444768, 'sideways_atr_min_pct': 0.0027580099262417323, 'sideways_atr_max_pct': 0.06978913243103338, 'sideways_tp_mult': 2.445679884059427, 'sideways_tsl_mult': 0.8045590397404561, 'sideways_time_stop': 223, 'sideways_use_sma': False, 'sideways_use_ema': False, 'sideways_use_atr': False, 'sideways_use_adx': False, 'sideways_use_spike': True, 'sideways_rsi_required': False}.
[I 2025-08-31 10:24:36,135] Trial 267 finished with values: [-1000000000.0, 1000000000.0] and parameters: {'p_sma': 22, 'p_std': 19, 'p_atr': 24, 'p_adx': 8, 'rsi_period': 31, 'ema1': 13, 'ema2': 60, 'slip_atr_k': 0.08132259734255853, 'slip_spread_k': 0.25249796083985093, 'spread_hl_frac': 0.028145867918494466, 'bb_std_mult': 2.5715191106004713, 'rsi_os': 55, 'rsi_ob': 76, 'vol_spike': 0.2146909476870178, 'adx_thresh': 10.811448360462004, 'atr_min_pct': 0.019238901476821894, 'atr_max_pct': 0.04419600355795819, 'tp_mult': 1.3044563040994106, 'tsl_mult': 0.8857731072105374, 'strategy': 'mean_reversion', 'time_stop': 129, 'use_sma': False, 'use_atr': False, 'use_adx': False, 'use_ema': False, 'use_spike': True, 'rsi_required': True, 'edge_k': 0.867939219249734, 'edge_cap': 0.050260316600500496, 'bull_strategy': 'breakout', 'bull_bb_std_mult': 0.5443778665904233, 'bull_rsi_os': 47, 'bull_rsi_ob': 64, 'bull_adx_thresh': 32.56180427342399, 'bull_atr_min_pct': 0.005532873779139562, 'bull_atr_max_pct': 0.07113830680393514, 'bull_tp_mult': 2.1389863182052644, 'bull_tsl_mult': 0.08092673382512376, 'bull_time_stop': 18, 'bull_use_sma': True, 'bull_use_ema': True, 'bull_use_atr': True, 'bull_use_adx': True, 'bull_use_spike': True, 'bull_rsi_required': False, 'bear_strategy': 'breakout', 'bear_bb_std_mult': 2.130136087205385, 'bear_rsi_os': 11, 'bear_rsi_ob': 61, 'bear_adx_thresh': 8.119369169545, 'bear_atr_min_pct': 0.006534617083680937, 'bear_atr_max_pct': 0.12311478986911112, 'bear_tp_mult': 2.722579729736204, 'bear_tsl_mult': 0.1619680102009248, 'bear_time_stop': 209, 'bear_use_sma': False, 'bear_use_ema': False, 'bear_use_atr': True, 'bear_use_adx': False, 'bear_use_spike': True, 'bear_rsi_required': True, 'sideways_strategy': 'breakout', 'sideways_bb_std_mult': 2.588474929428267, 'sideways_rsi_os': 34, 'sideways_rsi_ob': 86, 'sideways_adx_thresh': 14.823459756906686, 'sideways_atr_min_pct': 0.0021160142629438675, 'sideways_atr_max_pct': 0.134321714492254, 'sideways_tp_mult': 1.3198991125721773, 'sideways_tsl_mult': 0.8039543901279825, 'sideways_time_stop': 269, 'sideways_use_sma': False, 'sideways_use_ema': False, 'sideways_use_atr': False, 'sideways_use_adx': False, 'sideways_use_spike': True, 'sideways_rsi_required': False}.
[I 2025-08-31 10:24:36,155] Trial 268 finished with values: [-1000000000.0, 1000000000.0] and parameters: {'p_sma': 19, 'p_std': 22, 'p_atr': 10, 'p_adx': 14, 'rsi_period': 29, 'ema1': 13, 'ema2': 33, 'slip_atr_k': 0.082325575958098, 'slip_spread_k': 0.4252456087114556, 'spread_hl_frac': 0.026680200466067512, 'bb_std_mult': 2.474374771886097, 'rsi_os': 44, 'rsi_ob': 76, 'vol_spike': 0.20986175891655987, 'adx_thresh': 7.620955143578726, 'atr_min_pct': 0.01961120457256753, 'atr_max_pct': 0.017399348075524304, 'tp_mult': 2.7696469154857017, 'tsl_mult': 0.4782332282448764, 'strategy': 'mean_reversion', 'time_stop': 145, 'use_sma': False, 'use_atr': False, 'use_adx': False, 'use_ema': False, 'use_spike': True, 'rsi_required': True, 'edge_k': 1.995972007281142, 'edge_cap': 0.05917857597994053, 'bull_strategy': 'breakout', 'bull_bb_std_mult': 1.249093565373632, 'bull_rsi_os': 43, 'bull_rsi_ob': 63, 'bull_adx_thresh': 21.4824896184937, 'bull_atr_min_pct': 0.028121041905843948, 'bull_atr_max_pct': 0.08132166454384954, 'bull_tp_mult': 1.247729439782285, 'bull_tsl_mult': 0.4632963893945072, 'bull_time_stop': 5, 'bull_use_sma': True, 'bull_use_ema': True, 'bull_use_atr': True, 'bull_use_adx': True, 'bull_use_spike': True, 'bull_rsi_required': False, 'bear_strategy': 'breakout', 'bear_bb_std_mult': 2.1289972852734023, 'bear_rsi_os': 30, 'bear_rsi_ob': 57, 'bear_adx_thresh': 8.186075375863739, 'bear_atr_min_pct': 0.018487424847884883, 'bear_atr_max_pct': 0.028990728072022208, 'bear_tp_mult': 2.715284249596984, 'bear_tsl_mult': 0.1605452062353604, 'bear_time_stop': 219, 'bear_use_sma': False, 'bear_use_ema': True, 'bear_use_atr': True, 'bear_use_adx': False, 'bear_use_spike': True, 'bear_rsi_required': True, 'sideways_strategy': 'breakout', 'sideways_bb_std_mult': 2.6072833237812905, 'sideways_rsi_os': 33, 'sideways_rsi_ob': 86, 'sideways_adx_thresh': 17.675305825530874, 'sideways_atr_min_pct': 0.005104377252013639, 'sideways_atr_max_pct': 0.012199519342501988, 'sideways_tp_mult': 1.3260432626155008, 'sideways_tsl_mult': 0.9011707219948419, 'sideways_time_stop': 268, 'sideways_use_sma': False, 'sideways_use_ema': False, 'sideways_use_atr': False, 'sideways_use_adx': False, 'sideways_use_spike': True, 'sideways_rsi_required': False}.
[I 2025-08-31 10:24:36,849] Trial 271 finished with values: [-1000000000.0, 1000000000.0] and parameters: {'p_sma': 46, 'p_std': 33, 'p_atr': 27, 'p_adx': 9, 'rsi_period': 35, 'ema1': 19, 'ema2': 59, 'slip_atr_k': 0.05865377229682346, 'slip_spread_k': 0.9517075208169599, 'spread_hl_frac': 0.027213991944894527, 'bb_std_mult': 2.7338714618510465, 'rsi_os': 50, 'rsi_ob': 50, 'vol_spike': 0.12631961120715168, 'adx_thresh': 8.893511796914256, 'atr_min_pct': 0.019852208392179257, 'atr_max_pct': 0.03440629833131868, 'tp_mult': 2.7662407386894494, 'tsl_mult': 0.7976990802522261, 'strategy': 'mean_reversion', 'time_stop': 149, 'use_sma': False, 'use_atr': False, 'use_adx': True, 'use_ema': False, 'use_spike': True, 'rsi_required': True, 'edge_k': 1.6503443856529973, 'edge_cap': 0.8108371512244441, 'bull_strategy': 'breakout', 'bull_bb_std_mult': 2.9577548653144317, 'bull_rsi_os': 40, 'bull_rsi_ob': 78, 'bull_adx_thresh': 26.904182163269724, 'bull_atr_min_pct': 0.0036840449147178557, 'bull_atr_max_pct': 0.06414494068059635, 'bull_tp_mult': 1.0955916290084073, 'bull_tsl_mult': 0.10200757453878806, 'bull_time_stop': 217, 'bull_use_sma': True, 'bull_use_ema': True, 'bull_use_atr': False, 'bull_use_adx': True, 'bull_use_spike': False, 'bull_rsi_required': False, 'bear_strategy': 'breakout', 'bear_bb_std_mult': 0.879404686908813, 'bear_rsi_os': 28, 'bear_rsi_ob': 57, 'bear_adx_thresh': 6.0027966578525955, 'bear_atr_min_pct': 0.0011466833517657076, 'bear_atr_max_pct': 0.12179244795045556, 'bear_tp_mult': 1.9106791361620508, 'bear_tsl_mult': 0.848452872272345, 'bear_time_stop': 188, 'bear_use_sma': False, 'bear_use_ema': False, 'bear_use_atr': True, 'bear_use_adx': True, 'bear_use_spike': False, 'bear_rsi_required': True, 'sideways_strategy': 'breakout', 'sideways_bb_std_mult': 2.7201980809095683, 'sideways_rsi_os': 33, 'sideways_rsi_ob': 83, 'sideways_adx_thresh': 28.353035745742307, 'sideways_atr_min_pct': 0.0035381709787236527, 'sideways_atr_max_pct': 0.010164639798637569, 'sideways_tp_mult': 1.2215945614602364, 'sideways_tsl_mult': 0.8382783659530006, 'sideways_time_stop': 256, 'sideways_use_sma': True, 'sideways_use_ema': False, 'sideways_use_atr': False, 'sideways_use_adx': False, 'sideways_use_spike': True, 'sideways_rsi_required': False}.
[I 2025-08-31 10:25:01,533] Trial 266 finished with values: [-1000000000.0, 1000000000.0] and parameters: {'p_sma': 23, 'p_std': 32, 'p_atr': 24, 'p_adx': 8, 'rsi_period': 33, 'ema1': 14, 'ema2': 60, 'slip_atr_k': 0.08278076799869932, 'slip_spread_k': 0.2550963597132886, 'spread_hl_frac': 0.028667737106165325, 'bb_std_mult': 2.5989074086527006, 'rsi_os': 40, 'rsi_ob': 93, 'vol_spike': 0.2136516308475256, 'adx_thresh': 28.663696788369105, 'atr_min_pct': 0.01921390512335964, 'atr_max_pct': 0.0442241475930991, 'tp_mult': 2.0705470474770626, 'tsl_mult': 0.7301033301125517, 'strategy': 'mean_reversion', 'time_stop': 196, 'use_sma': False, 'use_atr': False, 'use_adx': False, 'use_ema': False, 'use_spike': True, 'rsi_required': True, 'edge_k': 0.32808925107243747, 'edge_cap': 0.06461351096406465, 'bull_strategy': 'breakout', 'bull_bb_std_mult': 2.5532061768077865, 'bull_rsi_os': 40, 'bull_rsi_ob': 76, 'bull_adx_thresh': 27.040719428487268, 'bull_atr_min_pct': 0.0033699393835360737, 'bull_atr_max_pct': 0.0710863113685466, 'bull_tp_mult': 2.768345300086531, 'bull_tsl_mult': 0.45818573475863367, 'bull_time_stop': 21, 'bull_use_sma': True, 'bull_use_ema': True, 'bull_use_atr': True, 'bull_use_adx': True, 'bull_use_spike': True, 'bull_rsi_required': False, 'bear_strategy': 'breakout', 'bear_bb_std_mult': 2.1259940612924533, 'bear_rsi_os': 27, 'bear_rsi_ob': 61, 'bear_adx_thresh': 8.247700074714576, 'bear_atr_min_pct': 0.018705841974783866, 'bear_atr_max_pct': 0.12282041950510517, 'bear_tp_mult': 2.582182028815346, 'bear_tsl_mult': 0.9219925460027005, 'bear_time_stop': 191, 'bear_use_sma': False, 'bear_use_ema': True, 'bear_use_atr': True, 'bear_use_adx': False, 'bear_use_spike': True, 'bear_rsi_required': True, 'sideways_strategy': 'breakout', 'sideways_bb_std_mult': 2.584047135791391, 'sideways_rsi_os': 33, 'sideways_rsi_ob': 87, 'sideways_adx_thresh': 14.932924488168268, 'sideways_atr_min_pct': 0.00237427882531724, 'sideways_atr_max_pct': 0.0690071590385068, 'sideways_tp_mult': 1.3283916799178124, 'sideways_tsl_mult': 0.8010582557543797, 'sideways_time_stop': 48, 'sideways_use_sma': False, 'sideways_use_ema': False, 'sideways_use_atr': False, 'sideways_use_adx': False, 'sideways_use_spike': True, 'sideways_rsi_required': False}.
