[I 2025-08-31 10:20:15,956] Trial 223 finished with values: [-1000000000.0, 1000000000.0] and parameters: {'p_sma': 28, 'p_std': 31, 'p_atr': 17, 'p_adx': 18, 'rsi_period': 73, 'ema1': 28, 'ema2': 60, 'slip_atr_k': 0.06562825610427592, 'slip_spread_k': 0.40724445760032846, 'spread_hl_frac': 0.027272408699735788, 'bb_std_mult': 2.864599512575394, 'rsi_os': 13, 'rsi_ob': 79, 'vol_spike': 0.0021388508242169424, 'adx_thresh': 8.555590769098833, 'atr_min_pct': 0.020073899073399945, 'atr_max_pct': 0.04761120665392212, 'tp_mult': 2.82425961276932, 'tsl_mult': 0.46334443096940653, 'strategy': 'mean_reversion', 'time_stop': 164, 'use_sma': False, 'use_atr': True, 'use_adx': True, 'use_ema': True, 'use_spike': True, 'rsi_required': True, 'edge_k': 1.680483721792114, 'edge_cap': 0.21835126057847998, 'bull_strategy': 'breakout', 'bull_bb_std_mult': 1.9201360889724919, 'bull_rsi_os': 42, 'bull_rsi_ob': 76, 'bull_adx_thresh': 23.21933128512751, 'bull_atr_min_pct': 0.02114884524972213, 'bull_atr_max_pct': 0.10049076976625558, 'bull_tp_mult': 2.4654668948518386, 'bull_tsl_mult': 0.1525938436439542, 'bull_time_stop': 146, 'bull_use_sma': False, 'bull_use_ema': True, 'bull_use_atr': False, 'bull_use_adx': True, 'bull_use_spike': False, 'bull_rsi_required': False, 'bear_strategy': 'mean_reversion', 'bear_bb_std_mult': 2.1441077311488153, 'bear_rsi_os': 10, 'bear_rsi_ob': 59, 'bear_adx_thresh': 6.655840072266667, 'bear_atr_min_pct': 0.015201619136897819, 'bear_atr_max_pct': 0.12948765799960893, 'bear_tp_mult': 2.5903305770009277, 'bear_tsl_mult': 0.06534586910915108, 'bear_time_stop': 198, 'bear_use_sma': False, 'bear_use_ema': False, 'bear_use_atr': False, 'bear_use_adx': False, 'bear_use_spike': True, 'bear_rsi_required': True, 'sideways_strategy': 'breakout', 'sideways_bb_std_mult': 2.154889171091198, 'sideways_rsi_os': 46, 'sideways_rsi_ob': 85, 'sideways_adx_thresh': 29.310535525287168, 'sideways_atr_min_pct': 0.0041064564458014215, 'sideways_atr_max_pct': 0.07130839105317863, 'sideways_tp_mult': 2.663936840344139, 'sideways_tsl_mult': 0.8380556685733479, 'sideways_time_stop': 273, 'sideways_use_sma': True, 'sideways_use_ema': False, 'sideways_use_atr': True, 'sideways_use_adx': False, 'sideways_use_spike': True, 'sideways_rsi_required': False}.
[I 2025-08-31 10:20:16,025] Trial 226 finished with values: [-1000000000.0, 1000000000.0] and parameters: {'p_sma': 28, 'p_std': 31, 'p_atr': 11, 'p_adx': 9, 'rsi_period': 26, 'ema1': 12, 'ema2': 59, 'slip_atr_k': 0.05770759119876077, 'slip_spread_k': 0.2639404781672401, 'spread_hl_frac': 0.026699561521220803, 'bb_std_mult': 2.8846220083490963, 'rsi_os': 39, 'rsi_ob': 74, 'vol_spike': 0.20506899608566087, 'adx_thresh': 15.277057659899315, 'atr_min_pct': 0.019261235652877837, 'atr_max_pct': 0.030739136516107934, 'tp_mult': 2.8301352127979325, 'tsl_mult': 0.6507805449429442, 'strategy': 'mean_reversion', 'time_stop': 30, 'use_sma': False, 'use_atr': False, 'use_adx': False, 'use_ema': False, 'use_spike': True, 'rsi_required': True, 'edge_k': 0.8242549675151566, 'edge_cap': 0.12549661005885304, 'bull_strategy': 'breakout', 'bull_bb_std_mult': 3.484262445148464, 'bull_rsi_os': 42, 'bull_rsi_ob': 75, 'bull_adx_thresh': 9.717955783521573, 'bull_atr_min_pct': 0.024060665646511818, 'bull_atr_max_pct': 0.14816579847502587, 'bull_tp_mult': 1.2562351837779437, 'bull_tsl_mult': 0.0916080559669408, 'bull_time_stop': 22, 'bull_use_sma': False, 'bull_use_ema': True, 'bull_use_atr': False, 'bull_use_adx': True, 'bull_use_spike': True, 'bull_rsi_required': False, 'bear_strategy': 'mean_reversion', 'bear_bb_std_mult': 2.1288641636762007, 'bear_rsi_os': 27, 'bear_rsi_ob': 56, 'bear_adx_thresh': 7.006294009802103, 'bear_atr_min_pct': 0.016494072755241992, 'bear_atr_max_pct': 0.09519543911849046, 'bear_tp_mult': 2.5871682179872275, 'bear_tsl_mult': 0.0564660989949175, 'bear_time_stop': 36, 'bear_use_sma': False, 'bear_use_ema': True, 'bear_use_atr': True, 'bear_use_adx': False, 'bear_use_spike': True, 'bear_rsi_required': True, 'sideways_strategy': 'breakout', 'sideways_bb_std_mult': 2.757260368546326, 'sideways_rsi_os': 47, 'sideways_rsi_ob': 85, 'sideways_adx_thresh': 7.930503891837185, 'sideways_atr_min_pct': 0.004343145501080812, 'sideways_atr_max_pct': 0.05101362771677279, 'sideways_tp_mult': 2.659143238973472, 'sideways_tsl_mult': 0.222770716059506, 'sideways_time_stop': 271, 'sideways_use_sma': True, 'sideways_use_ema': False, 'sideways_use_atr': False, 'sideways_use_adx': False, 'sideways_use_spike': True, 'sideways_rsi_required': False}.
[I 2025-08-31 10:20:16,486] Trial 230 finished with values: [-1000000000.0, 1000000000.0] and parameters: {'p_sma': 41, 'p_std': 5, 'p_atr': 12, 'p_adx': 8, 'rsi_period': 51, 'ema1': 12, 'ema2': 57, 'slip_atr_k': 0.07443545853237707, 'slip_spread_k': 0.2839362729923867, 'spread_hl_frac': 0.029219506930372764, 'bb_std_mult': 2.9596785442622062, 'rsi_os': 53, 'rsi_ob': 74, 'vol_spike': 0.05350753546877618, 'adx_thresh': 26.136584242750125, 'atr_min_pct': 0.014759937229040287, 'atr_max_pct': 0.10854255202724152, 'tp_mult': 1.418385776138605, 'tsl_mult': 0.6958572333448357, 'strategy': 'mean_reversion', 'time_stop': 144, 'use_sma': False, 'use_atr': False, 'use_adx': False, 'use_ema': False, 'use_spike': True, 'rsi_required': True, 'edge_k': 1.6403706041446262, 'edge_cap': 0.1593993998377235, 'bull_strategy': 'breakout', 'bull_bb_std_mult': 1.5280859248772276, 'bull_rsi_os': 38, 'bull_rsi_ob': 77, 'bull_adx_thresh': 11.421189475913426, 'bull_atr_min_pct': 0.022678712710191732, 'bull_atr_max_pct': 0.06950847517562536, 'bull_tp_mult': 1.1712736155433587, 'bull_tsl_mult': 0.4851077021128813, 'bull_time_stop': 15, 'bull_use_sma': True, 'bull_use_ema': True, 'bull_use_atr': True, 'bull_use_adx': True, 'bull_use_spike': True, 'bull_rsi_required': False, 'bear_strategy': 'breakout', 'bear_bb_std_mult': 1.1568918291861545, 'bear_rsi_os': 30, 'bear_rsi_ob': 83, 'bear_adx_thresh': 8.413974830815626, 'bear_atr_min_pct': 0.014750903274739565, 'bear_atr_max_pct': 0.12045544671000986, 'bear_tp_mult': 2.6589342586777893, 'bear_tsl_mult': 0.09980850045595721, 'bear_time_stop': 263, 'bear_use_sma': False, 'bear_use_ema': True, 'bear_use_atr': True, 'bear_use_adx': True, 'bear_use_spike': True, 'bear_rsi_required': True, 'sideways_strategy': 'breakout', 'sideways_bb_std_mult': 2.6324216213520466, 'sideways_rsi_os': 50, 'sideways_rsi_ob': 83, 'sideways_adx_thresh': 33.40586981880938, 'sideways_atr_min_pct': 0.0020221246652757483, 'sideways_atr_max_pct': 0.10922186036720316, 'sideways_tp_mult': 2.747084131794895, 'sideways_tsl_mult': 0.8153611369433568, 'sideways_time_stop': 261, 'sideways_use_sma': True, 'sideways_use_ema': False, 'sideways_use_atr': False, 'sideways_use_adx': False, 'sideways_use_spike': True, 'sideways_rsi_required': False}.
[I 2025-08-31 10:20:16,506] Trial 228 finished with values: [-1000000000.0, 1000000000.0] and parameters: {'p_sma': 28, 'p_std': 5, 'p_atr': 14, 'p_adx': 18, 'rsi_period': 38, 'ema1': 12, 'ema2': 59, 'slip_atr_k': 0.07318538272750018, 'slip_spread_k': 0.5596739365095187, 'spread_hl_frac': 0.027564813231576717, 'bb_std_mult': 2.869548694929098, 'rsi_os': 53, 'rsi_ob': 74, 'vol_spike': 0.0531851239970602, 'adx_thresh': 9.300492588516764, 'atr_min_pct': 0.018886250870716437, 'atr_max_pct': 0.03194740764542954, 'tp_mult': 1.515368324033385, 'tsl_mult': 0.04050536739633004, 'strategy': 'mean_reversion', 'time_stop': 229, 'use_sma': False, 'use_atr': False, 'use_adx': False, 'use_ema': False, 'use_spike': True, 'rsi_required': True, 'edge_k': 0.8137743182141184, 'edge_cap': 0.1607554422001276, 'bull_strategy': 'breakout', 'bull_bb_std_mult': 1.0463245908855596, 'bull_rsi_os': 38, 'bull_rsi_ob': 56, 'bull_adx_thresh': 11.524943265900903, 'bull_atr_min_pct': 0.022526147398704812, 'bull_atr_max_pct': 0.06930717232528491, 'bull_tp_mult': 1.2568913885333983, 'bull_tsl_mult': 0.12026759524240418, 'bull_time_stop': 24, 'bull_use_sma': True, 'bull_use_ema': True, 'bull_use_atr': False, 'bull_use_adx': True, 'bull_use_spike': True, 'bull_rsi_required': False, 'bear_strategy': 'mean_reversion', 'bear_bb_std_mult': 1.1454490190942221, 'bear_rsi_os': 27, 'bear_rsi_ob': 72, 'bear_adx_thresh': 8.424003651161474, 'bear_atr_min_pct': 0.014982538390971988, 'bear_atr_max_pct': 0.12083733318012227, 'bear_tp_mult': 2.892860050775508, 'bear_tsl_mult': 0.10301979113733983, 'bear_time_stop': 35, 'bear_use_sma': False, 'bear_use_ema': True, 'bear_use_atr': True, 'bear_use_adx': False, 'bear_use_spike': True, 'bear_rsi_required': True, 'sideways_strategy': 'breakout', 'sideways_bb_std_mult': 2.615621743099584, 'sideways_rsi_os': 33, 'sideways_rsi_ob': 83, 'sideways_adx_thresh': 22.77348788849193, 'sideways_atr_min_pct': 0.0023106575590663247, 'sideways_atr_max_pct': 0.0937000402841599, 'sideways_tp_mult': 1.2377586007986972, 'sideways_tsl_mult': 0.38934162351336243, 'sideways_time_stop': 263, 'sideways_use_sma': True, 'sideways_use_ema': False, 'sideways_use_atr': True, 'sideways_use_adx': False, 'sideways_use_spike': True, 'sideways_rsi_required': False}.
[I 2025-08-31 10:20:16,535] Trial 227 finished with values: [-1000000000.0, 1000000000.0] and parameters: {'p_sma': 18, 'p_std': 33, 'p_atr': 9, 'p_adx': 9, 'rsi_period': 45, 'ema1': 28, 'ema2': 59, 'slip_atr_k': 0.056607676887053524, 'slip_spread_k': 0.2623370528176232, 'spread_hl_frac': 0.026826208989409413, 'bb_std_mult': 3.139548317840356, 'rsi_os': 51, 'rsi_ob': 93, 'vol_spike': 0.05340745931528994, 'adx_thresh': 9.132999053928433, 'atr_min_pct': 0.01730826610063646, 'atr_max_pct': 0.030234605181765142, 'tp_mult': 2.8460017114379483, 'tsl_mult': 0.6519808057839891, 'strategy': 'mean_reversion', 'time_stop': 219, 'use_sma': False, 'use_atr': False, 'use_adx': False, 'use_ema': False, 'use_spike': True, 'rsi_required': True, 'edge_k': 0.060760516452748714, 'edge_cap': 0.12520856340963926, 'bull_strategy': 'breakout', 'bull_bb_std_mult': 3.492813557379417, 'bull_rsi_os': 38, 'bull_rsi_ob': 76, 'bull_adx_thresh': 11.731201851004831, 'bull_atr_min_pct': 0.02275361494761359, 'bull_atr_max_pct': 0.14833591382831507, 'bull_tp_mult': 1.272429826514182, 'bull_tsl_mult': 0.49548998278275463, 'bull_time_stop': 24, 'bull_use_sma': True, 'bull_use_ema': True, 'bull_use_atr': False, 'bull_use_adx': True, 'bull_use_spike': True, 'bull_rsi_required': False, 'bear_strategy': 'mean_reversion', 'bear_bb_std_mult': 2.07950925547218, 'bear_rsi_os': 30, 'bear_rsi_ob': 73, 'bear_adx_thresh': 8.347821436884269, 'bear_atr_min_pct': 0.015293531852186461, 'bear_atr_max_pct': 0.12721825347908977, 'bear_tp_mult': 1.0818479197446147, 'bear_tsl_mult': 0.22524866331179874, 'bear_time_stop': 34, 'bear_use_sma': False, 'bear_use_ema': True, 'bear_use_atr': True, 'bear_use_adx': False, 'bear_use_spike': True, 'bear_rsi_required': True, 'sideways_strategy': 'breakout', 'sideways_bb_std_mult': 2.644360980729392, 'sideways_rsi_os': 35, 'sideways_rsi_ob': 82, 'sideways_adx_thresh': 29.159556041041746, 'sideways_atr_min_pct': 0.0019005880794362446, 'sideways_atr_max_pct': 0.0520814666245317, 'sideways_tp_mult': 2.743797199138901, 'sideways_tsl_mult': 0.3907141702606865, 'sideways_time_stop': 253, 'sideways_use_sma': True, 'sideways_use_ema': False, 'sideways_use_atr': False, 'sideways_use_adx': False, 'sideways_use_spike': True, 'sideways_rsi_required': False}.
[I 2025-08-31 10:20:43,700] Trial 229 finished with values: [-0.03893337677816422, 0.03887114137860866] and parameters: {'p_sma': 19, 'p_std': 5, 'p_atr': 11, 'p_adx': 9, 'rsi_period': 44, 'ema1': 18, 'ema2': 57, 'slip_atr_k': 0.05869831731482575, 'slip_spread_k': 0.9741413118856893, 'spread_hl_frac': 0.027807116097064242, 'bb_std_mult': 2.236372234239341, 'rsi_os': 39, 'rsi_ob': 74, 'vol_spike': 0.2251095277136963, 'adx_thresh': 15.400091093024479, 'atr_min_pct': 0.018955064133873094, 'atr_max_pct': 0.03184866615151796, 'tp_mult': 2.757255667849177, 'tsl_mult': 0.22906911510780759, 'strategy': 'mean_reversion', 'time_stop': 142, 'use_sma': False, 'use_atr': False, 'use_adx': False, 'use_ema': False, 'use_spike': True, 'rsi_required': True, 'edge_k': 0.3956875769316145, 'edge_cap': 0.13249828685422677, 'bull_strategy': 'breakout', 'bull_bb_std_mult': 1.0550267029461502, 'bull_rsi_os': 38, 'bull_rsi_ob': 75, 'bull_adx_thresh': 19.730751071826454, 'bull_atr_min_pct': 0.002194198712264541, 'bull_atr_max_pct': 0.09607051651706087, 'bull_tp_mult': 1.2700241799555128, 'bull_tsl_mult': 0.11970639937399745, 'bull_time_stop': 24, 'bull_use_sma': True, 'bull_use_ema': True, 'bull_use_atr': True, 'bull_use_adx': True, 'bull_use_spike': True, 'bull_rsi_required': False, 'bear_strategy': 'breakout', 'bear_bb_std_mult': 2.0727453335205444, 'bear_rsi_os': 27, 'bear_rsi_ob': 59, 'bear_adx_thresh': 8.47490237062313, 'bear_atr_min_pct': 0.017670799184249953, 'bear_atr_max_pct': 0.08326242569196039, 'bear_tp_mult': 2.687900051207247, 'bear_tsl_mult': 0.048993478574493765, 'bear_time_stop': 34, 'bear_use_sma': False, 'bear_use_ema': True, 'bear_use_atr': True, 'bear_use_adx': False, 'bear_use_spike': True, 'bear_rsi_required': True, 'sideways_strategy': 'breakout', 'sideways_bb_std_mult': 2.617287744970068, 'sideways_rsi_os': 35, 'sideways_rsi_ob': 82, 'sideways_adx_thresh': 16.139831460319627, 'sideways_atr_min_pct': 0.0018944763692692636, 'sideways_atr_max_pct': 0.1055728145610112, 'sideways_tp_mult': 2.741178672432478, 'sideways_tsl_mult': 0.22389065204387598, 'sideways_time_stop': 261, 'sideways_use_sma': True, 'sideways_use_ema': False, 'sideways_use_atr': False, 'sideways_use_adx': False, 'sideways_use_spike': True, 'sideways_rsi_required': False}.
[I 2025-08-31 10:20:48,184] Trial 231 finished with values: [-1000000000.0, 1000000000.0] and parameters: {'p_sma': 19, 'p_std': 43, 'p_atr': 14, 'p_adx': 8, 'rsi_period': 44, 'ema1': 12, 'ema2': 58, 'slip_atr_k': 0.06079701300166388, 'slip_spread_k': 0.5716809119655476, 'spread_hl_frac': 0.02801082945119596, 'bb_std_mult': 2.2308653955212296, 'rsi_os': 43, 'rsi_ob': 73, 'vol_spike': 0.2264344316358891, 'adx_thresh': 24.53784508367461, 'atr_min_pct': 0.01870776277424091, 'atr_max_pct': 0.034664610432637445, 'tp_mult': 2.7460002542752435, 'tsl_mult': 0.21613150509071122, 'strategy': 'mean_reversion', 'time_stop': 221, 'use_sma': False, 'use_atr': False, 'use_adx': True, 'use_ema': False, 'use_spike': True, 'rsi_required': True, 'edge_k': 0.38975888372641665, 'edge_cap': 0.12519806837842568, 'bull_strategy': 'breakout', 'bull_bb_std_mult': 2.618361210341477, 'bull_rsi_os': 38, 'bull_rsi_ob': 56, 'bull_adx_thresh': 19.35721068206959, 'bull_atr_min_pct': 0.016715439070346914, 'bull_atr_max_pct': 0.07367150422027585, 'bull_tp_mult': 2.0432453027912825, 'bull_tsl_mult': 0.11444011722745755, 'bull_time_stop': 23, 'bull_use_sma': True, 'bull_use_ema': True, 'bull_use_atr': True, 'bull_use_adx': True, 'bull_use_spike': True, 'bull_rsi_required': False, 'bear_strategy': 'breakout', 'bear_bb_std_mult': 2.0700255834051586, 'bear_rsi_os': 19, 'bear_rsi_ob': 72, 'bear_adx_thresh': 8.906636075105672, 'bear_atr_min_pct': 0.017620893186014147, 'bear_atr_max_pct': 0.12632486535080392, 'bear_tp_mult': 2.698401308584351, 'bear_tsl_mult': 0.22588870824654766, 'bear_time_stop': 25, 'bear_use_sma': False, 'bear_use_ema': False, 'bear_use_atr': True, 'bear_use_adx': False, 'bear_use_spike': True, 'bear_rsi_required': True, 'sideways_strategy': 'breakout', 'sideways_bb_std_mult': 2.6070442925746278, 'sideways_rsi_os': 33, 'sideways_rsi_ob': 84, 'sideways_adx_thresh': 16.195470315786128, 'sideways_atr_min_pct': 0.0031458084003120994, 'sideways_atr_max_pct': 0.09407628382498746, 'sideways_tp_mult': 2.4291840697401867, 'sideways_tsl_mult': 0.819559511130349, 'sideways_time_stop': 265, 'sideways_use_sma': True, 'sideways_use_ema': False, 'sideways_use_atr': True, 'sideways_use_adx': False, 'sideways_use_spike': True, 'sideways_rsi_required': False}.
[I 2025-08-31 10:20:48,287] Trial 233 finished with values: [-0.00800928019332059, 0.009010512821508476] and parameters: {'p_sma': 19, 'p_std': 24, 'p_atr': 17, 'p_adx': 20, 'rsi_period': 23, 'ema1': 18, 'ema2': 57, 'slip_atr_k': 0.060692082541076595, 'slip_spread_k': 0.016977163446983023, 'spread_hl_frac': 0.028274039786683944, 'bb_std_mult': 2.219964793834104, 'rsi_os': 43, 'rsi_ob': 75, 'vol_spike': 0.2263085611925038, 'adx_thresh': 7.600891668463033, 'atr_min_pct': 0.01568333968221212, 'atr_max_pct': 0.023201699191617277, 'tp_mult': 2.7446416850210036, 'tsl_mult': 0.43015379420628275, 'strategy': 'mean_reversion', 'time_stop': 132, 'use_sma': False, 'use_atr': False, 'use_adx': True, 'use_ema': False, 'use_spike': True, 'rsi_required': True, 'edge_k': 1.8122364356310987, 'edge_cap': 0.07397221126426438, 'bull_strategy': 'breakout', 'bull_bb_std_mult': 0.9357462680711779, 'bull_rsi_os': 43, 'bull_rsi_ob': 47, 'bull_adx_thresh': 22.202335722722495, 'bull_atr_min_pct': 0.002316923595689885, 'bull_atr_max_pct': 0.10467285967418535, 'bull_tp_mult': 2.6931021256546774, 'bull_tsl_mult': 0.704225847717469, 'bull_time_stop': 208, 'bull_use_sma': True, 'bull_use_ema': True, 'bull_use_atr': True, 'bull_use_adx': False, 'bull_use_spike': True, 'bull_rsi_required': False, 'bear_strategy': 'breakout', 'bear_bb_std_mult': 1.4511776338422748, 'bear_rsi_os': 38, 'bear_rsi_ob': 59, 'bear_adx_thresh': 7.525434827754067, 'bear_atr_min_pct': 0.018045554163248528, 'bear_atr_max_pct': 0.0845622143930707, 'bear_tp_mult': 2.696616301774695, 'bear_tsl_mult': 0.19998735481377025, 'bear_time_stop': 22, 'bear_use_sma': True, 'bear_use_ema': False, 'bear_use_atr': True, 'bear_use_adx': False, 'bear_use_spike': True, 'bear_rsi_required': False, 'sideways_strategy': 'breakout', 'sideways_bb_std_mult': 2.7246359544584786, 'sideways_rsi_os': 30, 'sideways_rsi_ob': 84, 'sideways_adx_thresh': 15.474957854824089, 'sideways_atr_min_pct': 0.003342881889894015, 'sideways_atr_max_pct': 0.013060618000749799, 'sideways_tp_mult': 1.745532271574311, 'sideways_tsl_mult': 0.7668867842006641, 'sideways_time_stop': 267, 'sideways_use_sma': True, 'sideways_use_ema': False, 'sideways_use_atr': False, 'sideways_use_adx': True, 'sideways_use_spike': True, 'sideways_rsi_required': False}.
[I 2025-08-31 10:20:48,417] Trial 232 finished with values: [-1000000000.0, 1000000000.0] and parameters: {'p_sma': 19, 'p_std': 24, 'p_atr': 17, 'p_adx': 20, 'rsi_period': 23, 'ema1': 18, 'ema2': 57, 'slip_atr_k': 0.059068916867288254, 'slip_spread_k': 0.29409685281981907, 'spread_hl_frac': 0.02815558431219536, 'bb_std_mult': 2.230283034522838, 'rsi_os': 48, 'rsi_ob': 75, 'vol_spike': 0.2238811771828972, 'adx_thresh': 24.656189497996657, 'atr_min_pct': 0.01785814053975894, 'atr_max_pct': 0.033211304414404924, 'tp_mult': 2.741845497363084, 'tsl_mult': 0.2935875566691155, 'strategy': 'mean_reversion', 'time_stop': 189, 'use_sma': False, 'use_atr': False, 'use_adx': True, 'use_ema': False, 'use_spike': True, 'rsi_required': True, 'edge_k': 1.2637836700118286, 'edge_cap': 0.07934156749827913, 'bull_strategy': 'breakout', 'bull_bb_std_mult': 0.9002198263351023, 'bull_rsi_os': 43, 'bull_rsi_ob': 47, 'bull_adx_thresh': 20.169078334522258, 'bull_atr_min_pct': 0.004276581674613887, 'bull_atr_max_pct': 0.0736673079660083, 'bull_tp_mult': 2.519473862485854, 'bull_tsl_mult': 0.37136561655555206, 'bull_time_stop': 31, 'bull_use_sma': True, 'bull_use_ema': True, 'bull_use_atr': True, 'bull_use_adx': False, 'bull_use_spike': True, 'bull_rsi_required': False, 'bear_strategy': 'breakout', 'bear_bb_std_mult': 3.0371739234371744, 'bear_rsi_os': 19, 'bear_rsi_ob': 46, 'bear_adx_thresh': 7.398857200366262, 'bear_atr_min_pct': 0.01759432411064519, 'bear_atr_max_pct': 0.0821548966029492, 'bear_tp_mult': 2.7034071817189322, 'bear_tsl_mult': 0.835660829840278, 'bear_time_stop': 24, 'bear_use_sma': True, 'bear_use_ema': False, 'bear_use_atr': True, 'bear_use_adx': False, 'bear_use_spike': True, 'bear_rsi_required': False, 'sideways_strategy': 'breakout', 'sideways_bb_std_mult': 2.6967744643299114, 'sideways_rsi_os': 30, 'sideways_rsi_ob': 82, 'sideways_adx_thresh': 15.97344765570173, 'sideways_atr_min_pct': 0.0031914063491490737, 'sideways_atr_max_pct': 0.012597425691187122, 'sideways_tp_mult': 1.3919209783705035, 'sideways_tsl_mult': 0.7636982149458518, 'sideways_time_stop': 252, 'sideways_use_sma': True, 'sideways_use_ema': False, 'sideways_use_atr': False, 'sideways_use_adx': True, 'sideways_use_spike': True, 'sideways_rsi_required': False}.
