[I 2025-08-31 11:11:40,897] Trial 638 finished with values: [-1000000000.0, 1000000000.0] and parameters: {'p_sma': 36, 'p_std': 13, 'p_atr': 28, 'p_adx': 21, 'rsi_period': 34, 'ema1': 6, 'ema2': 41, 'slip_atr_k': 0.13830901167235907, 'slip_spread_k': 0.4675414965144598, 'spread_hl_frac': 0.02289331358966366, 'bb_std_mult': 0.670052412423764, 'rsi_os': 52, 'rsi_ob': 85, 'vol_spike': 0.15174742024377852, 'adx_thresh': 10.279659975049741, 'atr_min_pct': 0.021247500433274155, 'atr_max_pct': 0.06114995225300006, 'tp_mult': 2.9477882511502926, 'tsl_mult': 0.08793037592566157, 'strategy': 'breakout', 'time_stop': 80, 'use_sma': True, 'use_atr': True, 'use_adx': False, 'use_ema': True, 'use_spike': False, 'rsi_required': False, 'edge_k': 1.429162298044172, 'edge_cap': 0.7461652548260699, 'bull_strategy': 'mean_reversion', 'bull_bb_std_mult': 3.0543402555965473, 'bull_rsi_os': 36, 'bull_rsi_ob': 60, 'bull_adx_thresh': 26.297133396476287, 'bull_atr_min_pct': 0.012609217828044379, 'bull_atr_max_pct': 0.03126571212006514, 'bull_tp_mult': 1.4070642061486462, 'bull_tsl_mult': 0.20066670937355463, 'bull_time_stop': 39, 'bull_use_sma': False, 'bull_use_ema': True, 'bull_use_atr': False, 'bull_use_adx': True, 'bull_use_spike': False, 'bull_rsi_required': True, 'bear_strategy': 'mean_reversion', 'bear_bb_std_mult': 1.0737474722588545, 'bear_rsi_os': 54, 'bear_rsi_ob': 54, 'bear_adx_thresh': 21.882137208978584, 'bear_atr_min_pct': 0.0031343594140015203, 'bear_atr_max_pct': 0.13181514105851397, 'bear_tp_mult': 2.7019516698717934, 'bear_tsl_mult': 0.8909634890394946, 'bear_time_stop': 81, 'bear_use_sma': False, 'bear_use_ema': True, 'bear_use_atr': True, 'bear_use_adx': False, 'bear_use_spike': False, 'bear_rsi_required': False, 'sideways_strategy': 'mean_reversion', 'sideways_bb_std_mult': 1.0747977084838336, 'sideways_rsi_os': 42, 'sideways_rsi_ob': 65, 'sideways_adx_thresh': 25.23920822305912, 'sideways_atr_min_pct': 0.006212329116322841, 'sideways_atr_max_pct': 0.10557725388803789, 'sideways_tp_mult': 1.5332075296469023, 'sideways_tsl_mult': 0.3497217782564361, 'sideways_time_stop': 176, 'sideways_use_sma': True, 'sideways_use_ema': True, 'sideways_use_atr': False, 'sideways_use_adx': False, 'sideways_use_spike': False, 'sideways_rsi_required': False}.
[I 2025-08-31 11:11:41,370] Trial 637 finished with values: [-1000000000.0, 1000000000.0] and parameters: {'p_sma': 36, 'p_std': 12, 'p_atr': 28, 'p_adx': 22, 'rsi_period': 11, 'ema1': 7, 'ema2': 38, 'slip_atr_k': 0.17177696933993097, 'slip_spread_k': 0.5150741719643663, 'spread_hl_frac': 0.023127718895708686, 'bb_std_mult': 0.5129184882786864, 'rsi_os': 32, 'rsi_ob': 85, 'vol_spike': 0.15681852581668881, 'adx_thresh': 10.38479542188326, 'atr_min_pct': 0.023277274306840904, 'atr_max_pct': 0.06864452337439225, 'tp_mult': 2.887212786849193, 'tsl_mult': 0.10684978222810859, 'strategy': 'breakout', 'time_stop': 77, 'use_sma': True, 'use_atr': True, 'use_adx': False, 'use_ema': True, 'use_spike': False, 'rsi_required': False, 'edge_k': 1.480556729979006, 'edge_cap': 0.6980919183521569, 'bull_strategy': 'mean_reversion', 'bull_bb_std_mult': 2.7977564757927307, 'bull_rsi_os': 16, 'bull_rsi_ob': 60, 'bull_adx_thresh': 27.65386839947553, 'bull_atr_min_pct': 0.012395123368884127, 'bull_atr_max_pct': 0.1016004581452524, 'bull_tp_mult': 1.7906490643426856, 'bull_tsl_mult': 0.19200752388090536, 'bull_time_stop': 47, 'bull_use_sma': False, 'bull_use_ema': True, 'bull_use_atr': False, 'bull_use_adx': True, 'bull_use_spike': False, 'bull_rsi_required': False, 'bear_strategy': 'mean_reversion', 'bear_bb_std_mult': 2.361399459975031, 'bear_rsi_os': 53, 'bear_rsi_ob': 54, 'bear_adx_thresh': 9.20975440741772, 'bear_atr_min_pct': 0.009761816328208325, 'bear_atr_max_pct': 0.019839053254077428, 'bear_tp_mult': 2.7854616983182563, 'bear_tsl_mult': 0.892063084612585, 'bear_time_stop': 95, 'bear_use_sma': True, 'bear_use_ema': False, 'bear_use_atr': True, 'bear_use_adx': True, 'bear_use_spike': True, 'bear_rsi_required': False, 'sideways_strategy': 'mean_reversion', 'sideways_bb_std_mult': 1.0745260620398343, 'sideways_rsi_os': 39, 'sideways_rsi_ob': 63, 'sideways_adx_thresh': 26.413094824080762, 'sideways_atr_min_pct': 0.005333701910566533, 'sideways_atr_max_pct': 0.09984373497464381, 'sideways_tp_mult': 1.5513791379349737, 'sideways_tsl_mult': 0.4036903801513674, 'sideways_time_stop': 164, 'sideways_use_sma': False, 'sideways_use_ema': True, 'sideways_use_atr': False, 'sideways_use_adx': True, 'sideways_use_spike': True, 'sideways_rsi_required': False}.
[I 2025-08-31 11:12:16,077] Trial 642 finished with values: [-1000000000.0, 1000000000.0] and parameters: {'p_sma': 36, 'p_std': 15, 'p_atr': 28, 'p_adx': 22, 'rsi_period': 35, 'ema1': 6, 'ema2': 12, 'slip_atr_k': 0.014865251277646874, 'slip_spread_k': 0.4398192399468403, 'spread_hl_frac': 0.04047605549211382, 'bb_std_mult': 0.5672420010648683, 'rsi_os': 29, 'rsi_ob': 85, 'vol_spike': 0.15076740763758692, 'adx_thresh': 10.950065242188996, 'atr_min_pct': 0.02186171340437529, 'atr_max_pct': 0.06026980608934803, 'tp_mult': 2.889274624195339, 'tsl_mult': 0.056137380527128765, 'strategy': 'breakout', 'time_stop': 72, 'use_sma': True, 'use_atr': True, 'use_adx': False, 'use_ema': True, 'use_spike': False, 'rsi_required': False, 'edge_k': 1.4159989105277968, 'edge_cap': 0.7434705568251684, 'bull_strategy': 'mean_reversion', 'bull_bb_std_mult': 3.028163122880043, 'bull_rsi_os': 42, 'bull_rsi_ob': 66, 'bull_adx_thresh': 26.582302553993, 'bull_atr_min_pct': 0.013414325599219979, 'bull_atr_max_pct': 0.03444614287042012, 'bull_tp_mult': 2.470083399959595, 'bull_tsl_mult': 0.20384560010508723, 'bull_time_stop': 42, 'bull_use_sma': False, 'bull_use_ema': True, 'bull_use_atr': False, 'bull_use_adx': True, 'bull_use_spike': False, 'bull_rsi_required': False, 'bear_strategy': 'mean_reversion', 'bear_bb_std_mult': 1.5436064645834293, 'bear_rsi_os': 51, 'bear_rsi_ob': 53, 'bear_adx_thresh': 11.11544513206228, 'bear_atr_min_pct': 0.011185143715103233, 'bear_atr_max_pct': 0.1400976010948172, 'bear_tp_mult': 2.704204655546878, 'bear_tsl_mult': 0.8689369614433725, 'bear_time_stop': 103, 'bear_use_sma': False, 'bear_use_ema': False, 'bear_use_atr': True, 'bear_use_adx': False, 'bear_use_spike': True, 'bear_rsi_required': False, 'sideways_strategy': 'mean_reversion', 'sideways_bb_std_mult': 1.0554738195187348, 'sideways_rsi_os': 40, 'sideways_rsi_ob': 64, 'sideways_adx_thresh': 28.737817004537305, 'sideways_atr_min_pct': 0.016747690694017978, 'sideways_atr_max_pct': 0.10385492888826867, 'sideways_tp_mult': 1.6177841866771823, 'sideways_tsl_mult': 0.9193791755367005, 'sideways_time_stop': 177, 'sideways_use_sma': True, 'sideways_use_ema': True, 'sideways_use_atr': False, 'sideways_use_adx': False, 'sideways_use_spike': True, 'sideways_rsi_required': True}.
[I 2025-08-31 11:12:16,078] Trial 643 finished with values: [-1000000000.0, 1000000000.0] and parameters: {'p_sma': 40, 'p_std': 12, 'p_atr': 28, 'p_adx': 22, 'rsi_period': 36, 'ema1': 6, 'ema2': 12, 'slip_atr_k': 0.22823290905752244, 'slip_spread_k': 0.534046562503232, 'spread_hl_frac': 0.018853326832607018, 'bb_std_mult': 0.578757654998512, 'rsi_os': 29, 'rsi_ob': 82, 'vol_spike': 0.008110924517252163, 'adx_thresh': 10.977958153922813, 'atr_min_pct': 0.02194212344580937, 'atr_max_pct': 0.061508985451556746, 'tp_mult': 2.884518412074869, 'tsl_mult': 0.056606295599360645, 'strategy': 'breakout', 'time_stop': 91, 'use_sma': True, 'use_atr': True, 'use_adx': False, 'use_ema': True, 'use_spike': False, 'rsi_required': False, 'edge_k': 1.5622273181177642, 'edge_cap': 0.7263429780023155, 'bull_strategy': 'mean_reversion', 'bull_bb_std_mult': 2.766767302493997, 'bull_rsi_os': 28, 'bull_rsi_ob': 66, 'bull_adx_thresh': 27.757241787989344, 'bull_atr_min_pct': 0.01345308834436602, 'bull_atr_max_pct': 0.03863670240032828, 'bull_tp_mult': 1.7844901026981377, 'bull_tsl_mult': 0.2254689973031597, 'bull_time_stop': 37, 'bull_use_sma': False, 'bull_use_ema': True, 'bull_use_atr': False, 'bull_use_adx': True, 'bull_use_spike': False, 'bull_rsi_required': False, 'bear_strategy': 'mean_reversion', 'bear_bb_std_mult': 0.9533924569237369, 'bear_rsi_os': 53, 'bear_rsi_ob': 78, 'bear_adx_thresh': 31.706270402370855, 'bear_atr_min_pct': 0.009078405158185152, 'bear_atr_max_pct': 0.0551563537770777, 'bear_tp_mult': 1.0163463047150136, 'bear_tsl_mult': 0.867465464524513, 'bear_time_stop': 120, 'bear_use_sma': False, 'bear_use_ema': False, 'bear_use_atr': True, 'bear_use_adx': False, 'bear_use_spike': True, 'bear_rsi_required': False, 'sideways_strategy': 'mean_reversion', 'sideways_bb_std_mult': 0.8807409948826426, 'sideways_rsi_os': 40, 'sideways_rsi_ob': 64, 'sideways_adx_thresh': 26.804500605009846, 'sideways_atr_min_pct': 0.005762347684467918, 'sideways_atr_max_pct': 0.11260512950601388, 'sideways_tp_mult': 1.6157874385047644, 'sideways_tsl_mult': 0.8494787798588943, 'sideways_time_stop': 157, 'sideways_use_sma': True, 'sideways_use_ema': True, 'sideways_use_atr': False, 'sideways_use_adx': False, 'sideways_use_spike': True, 'sideways_rsi_required': True}.
[I 2025-08-31 11:12:16,192] Trial 644 finished with values: [-1000000000.0, 1000000000.0] and parameters: {'p_sma': 39, 'p_std': 15, 'p_atr': 30, 'p_adx': 22, 'rsi_period': 36, 'ema1': 6, 'ema2': 12, 'slip_atr_k': 0.21277000877894092, 'slip_spread_k': 0.44523085284495867, 'spread_hl_frac': 0.001030579183028301, 'bb_std_mult': 0.5867856612548095, 'rsi_os': 30, 'rsi_ob': 82, 'vol_spike': 0.06452622655278034, 'adx_thresh': 10.996108041839891, 'atr_min_pct': 0.021935168973844267, 'atr_max_pct': 0.05660971235984235, 'tp_mult': 1.587963823604315, 'tsl_mult': 0.054378857755766445, 'strategy': 'breakout', 'time_stop': 91, 'use_sma': True, 'use_atr': True, 'use_adx': False, 'use_ema': True, 'use_spike': False, 'rsi_required': False, 'edge_k': 1.581546318140407, 'edge_cap': 0.6476456085196148, 'bull_strategy': 'mean_reversion', 'bull_bb_std_mult': 2.37577803732734, 'bull_rsi_os': 40, 'bull_rsi_ob': 66, 'bull_adx_thresh': 25.77624037249311, 'bull_atr_min_pct': 0.011616165971677826, 'bull_atr_max_pct': 0.1278588660068312, 'bull_tp_mult': 2.9461505889923254, 'bull_tsl_mult': 0.2229784583595039, 'bull_time_stop': 36, 'bull_use_sma': False, 'bull_use_ema': True, 'bull_use_atr': False, 'bull_use_adx': True, 'bull_use_spike': False, 'bull_rsi_required': False, 'bear_strategy': 'mean_reversion', 'bear_bb_std_mult': 1.5665490959478436, 'bear_rsi_os': 51, 'bear_rsi_ob': 69, 'bear_adx_thresh': 18.060513486202968, 'bear_atr_min_pct': 0.012983687755585331, 'bear_atr_max_pct': 0.03045441396287661, 'bear_tp_mult': 2.7316588146242746, 'bear_tsl_mult': 0.8697351422236929, 'bear_time_stop': 104, 'bear_use_sma': False, 'bear_use_ema': False, 'bear_use_atr': False, 'bear_use_adx': False, 'bear_use_spike': True, 'bear_rsi_required': False, 'sideways_strategy': 'mean_reversion', 'sideways_bb_std_mult': 0.8426537539724361, 'sideways_rsi_os': 40, 'sideways_rsi_ob': 61, 'sideways_adx_thresh': 28.6315876703722, 'sideways_atr_min_pct': 0.025024472938596887, 'sideways_atr_max_pct': 0.10277054853616979, 'sideways_tp_mult': 1.6120790507397298, 'sideways_tsl_mult': 0.8482652565854625, 'sideways_time_stop': 159, 'sideways_use_sma': True, 'sideways_use_ema': True, 'sideways_use_atr': True, 'sideways_use_adx': False, 'sideways_use_spike': True, 'sideways_rsi_required': True}.
[I 2025-08-31 11:12:16,373] Trial 641 finished with values: [-0.07792890905279926, 0.07760322528496715] and parameters: {'p_sma': 36, 'p_std': 12, 'p_atr': 28, 'p_adx': 22, 'rsi_period': 34, 'ema1': 6, 'ema2': 12, 'slip_atr_k': 0.11627263464182337, 'slip_spread_k': 0.5184927866711084, 'spread_hl_frac': 0.02310611964715503, 'bb_std_mult': 0.6655583101382131, 'rsi_os': 19, 'rsi_ob': 85, 'vol_spike': 0.06497503156056474, 'adx_thresh': 10.307679526362417, 'atr_min_pct': 0.021063271010195825, 'atr_max_pct': 0.06195149154594934, 'tp_mult': 2.889113712515072, 'tsl_mult': 0.1512968565756055, 'strategy': 'breakout', 'time_stop': 83, 'use_sma': True, 'use_atr': True, 'use_adx': False, 'use_ema': True, 'use_spike': False, 'rsi_required': False, 'edge_k': 1.4356918075819007, 'edge_cap': 0.7439492575654676, 'bull_strategy': 'mean_reversion', 'bull_bb_std_mult': 3.1099508446347857, 'bull_rsi_os': 36, 'bull_rsi_ob': 61, 'bull_adx_thresh': 26.60001950836277, 'bull_atr_min_pct': 0.013391643399113914, 'bull_atr_max_pct': 0.031053815073806126, 'bull_tp_mult': 2.9483699505628254, 'bull_tsl_mult': 0.27213586165559955, 'bull_time_stop': 41, 'bull_use_sma': False, 'bull_use_ema': True, 'bull_use_atr': False, 'bull_use_adx': True, 'bull_use_spike': False, 'bull_rsi_required': False, 'bear_strategy': 'mean_reversion', 'bear_bb_std_mult': 2.587154206059001, 'bear_rsi_os': 53, 'bear_rsi_ob': 54, 'bear_adx_thresh': 8.964682631505521, 'bear_atr_min_pct': 0.0030774011377055436, 'bear_atr_max_pct': 0.13898451429138195, 'bear_tp_mult': 1.0117538546187608, 'bear_tsl_mult': 0.8997605763888743, 'bear_time_stop': 88, 'bear_use_sma': False, 'bear_use_ema': False, 'bear_use_atr': True, 'bear_use_adx': False, 'bear_use_spike': True, 'bear_rsi_required': False, 'sideways_strategy': 'mean_reversion', 'sideways_bb_std_mult': 1.0366466578457878, 'sideways_rsi_os': 42, 'sideways_rsi_ob': 63, 'sideways_adx_thresh': 27.054742776009196, 'sideways_atr_min_pct': 0.006302244347256329, 'sideways_atr_max_pct': 0.10409812930836915, 'sideways_tp_mult': 1.6164728602456924, 'sideways_tsl_mult': 0.922023818676468, 'sideways_time_stop': 161, 'sideways_use_sma': True, 'sideways_use_ema': True, 'sideways_use_atr': False, 'sideways_use_adx': False, 'sideways_use_spike': True, 'sideways_rsi_required': True}.
[I 2025-08-31 11:12:49,892] Trial 648 finished with values: [-1000000000.0, 1000000000.0] and parameters: {'p_sma': 32, 'p_std': 11, 'p_atr': 29, 'p_adx': 28, 'rsi_period': 33, 'ema1': 5, 'ema2': 20, 'slip_atr_k': 0.01869589613752505, 'slip_spread_k': 0.4945203018593172, 'spread_hl_frac': 0.02163437449615572, 'bb_std_mult': 0.7339974101713954, 'rsi_os': 49, 'rsi_ob': 84, 'vol_spike': 0.13518815919079966, 'adx_thresh': 13.16048980032256, 'atr_min_pct': 0.024755916064959926, 'atr_max_pct': 0.05728596426080531, 'tp_mult': 2.9958026852030106, 'tsl_mult': 0.08136614294399315, 'strategy': 'breakout', 'time_stop': 97, 'use_sma': True, 'use_atr': True, 'use_adx': False, 'use_ema': True, 'use_spike': False, 'rsi_required': False, 'edge_k': 1.5340568487903696, 'edge_cap': 0.7186968451822251, 'bull_strategy': 'mean_reversion', 'bull_bb_std_mult': 2.6725130729758604, 'bull_rsi_os': 42, 'bull_rsi_ob': 64, 'bull_adx_thresh': 27.045655653334492, 'bull_atr_min_pct': 0.011633260655040431, 'bull_atr_max_pct': 0.03874104635776835, 'bull_tp_mult': 2.9059242961919076, 'bull_tsl_mult': 0.2822904372195588, 'bull_time_stop': 187, 'bull_use_sma': False, 'bull_use_ema': True, 'bull_use_atr': False, 'bull_use_adx': False, 'bull_use_spike': False, 'bull_rsi_required': False, 'bear_strategy': 'mean_reversion', 'bear_bb_std_mult': 3.5322658533433184, 'bear_rsi_os': 52, 'bear_rsi_ob': 52, 'bear_adx_thresh': 11.184547993845023, 'bear_atr_min_pct': 0.007002671691756435, 'bear_atr_max_pct': 0.13630644655231344, 'bear_tp_mult': 2.6156697123147117, 'bear_tsl_mult': 0.9224915429164336, 'bear_time_stop': 100, 'bear_use_sma': False, 'bear_use_ema': False, 'bear_use_atr': False, 'bear_use_adx': False, 'bear_use_spike': True, 'bear_rsi_required': False, 'sideways_strategy': 'mean_reversion', 'sideways_bb_std_mult': 0.9685601372499247, 'sideways_rsi_os': 38, 'sideways_rsi_ob': 61, 'sideways_adx_thresh': 27.387527132151014, 'sideways_atr_min_pct': 0.020589953645792698, 'sideways_atr_max_pct': 0.10838980914663496, 'sideways_tp_mult': 1.468938563315439, 'sideways_tsl_mult': 0.8624035378323907, 'sideways_time_stop': 171, 'sideways_use_sma': True, 'sideways_use_ema': True, 'sideways_use_atr': True, 'sideways_use_adx': False, 'sideways_use_spike': True, 'sideways_rsi_required': False}.
[I 2025-08-31 11:12:50,110] Trial 646 finished with values: [-1000000000.0, 1000000000.0] and parameters: {'p_sma': 32, 'p_std': 14, 'p_atr': 29, 'p_adx': 12, 'rsi_period': 52, 'ema1': 5, 'ema2': 30, 'slip_atr_k': 0.15452571566120846, 'slip_spread_k': 0.5017141024743811, 'spread_hl_frac': 0.021755686297213844, 'bb_std_mult': 0.7180364351893886, 'rsi_os': 13, 'rsi_ob': 84, 'vol_spike': 0.13065207484435992, 'adx_thresh': 12.939664408391216, 'atr_min_pct': 0.020955666630342935, 'atr_max_pct': 0.05687006712406183, 'tp_mult': 2.9995199937356136, 'tsl_mult': 0.1439668096262587, 'strategy': 'breakout', 'time_stop': 86, 'use_sma': True, 'use_atr': True, 'use_adx': False, 'use_ema': True, 'use_spike': False, 'rsi_required': False, 'edge_k': 1.5049058004591571, 'edge_cap': 0.72357992103907, 'bull_strategy': 'mean_reversion', 'bull_bb_std_mult': 2.58392072384911, 'bull_rsi_os': 42, 'bull_rsi_ob': 63, 'bull_adx_thresh': 27.09036991614655, 'bull_atr_min_pct': 0.011500881764073484, 'bull_atr_max_pct': 0.08668564386117862, 'bull_tp_mult': 1.8885350458817791, 'bull_tsl_mult': 0.2825930445887243, 'bull_time_stop': 208, 'bull_use_sma': False, 'bull_use_ema': True, 'bull_use_atr': False, 'bull_use_adx': False, 'bull_use_spike': False, 'bull_rsi_required': False, 'bear_strategy': 'mean_reversion', 'bear_bb_std_mult': 2.781795401609286, 'bear_rsi_os': 53, 'bear_rsi_ob': 52, 'bear_adx_thresh': 8.844711731886525, 'bear_atr_min_pct': 0.014121741779577316, 'bear_atr_max_pct': 0.13722690405086935, 'bear_tp_mult': 1.4045308257848756, 'bear_tsl_mult': 0.9328524022540632, 'bear_time_stop': 111, 'bear_use_sma': False, 'bear_use_ema': False, 'bear_use_atr': True, 'bear_use_adx': False, 'bear_use_spike': True, 'bear_rsi_required': False, 'sideways_strategy': 'mean_reversion', 'sideways_bb_std_mult': 0.9973011350910957, 'sideways_rsi_os': 41, 'sideways_rsi_ob': 61, 'sideways_adx_thresh': 27.480797906989025, 'sideways_atr_min_pct': 0.013836906143944592, 'sideways_atr_max_pct': 0.10831832505570312, 'sideways_tp_mult': 1.5179060084150364, 'sideways_tsl_mult': 0.43530877383820354, 'sideways_time_stop': 162, 'sideways_use_sma': True, 'sideways_use_ema': True, 'sideways_use_atr': False, 'sideways_use_adx': False, 'sideways_use_spike': True, 'sideways_rsi_required': False}.
[I 2025-08-31 11:12:50,250] Trial 647 finished with values: [-1000000000.0, 1000000000.0] and parameters: {'p_sma': 32, 'p_std': 14, 'p_atr': 29, 'p_adx': 28, 'rsi_period': 34, 'ema1': 5, 'ema2': 43, 'slip_atr_k': 0.015000210555374607, 'slip_spread_k': 0.4946572612470776, 'spread_hl_frac': 0.021672746044716654, 'bb_std_mult': 0.730466748221007, 'rsi_os': 19, 'rsi_ob': 84, 'vol_spike': 0.12687715417548373, 'adx_thresh': 11.130202142813992, 'atr_min_pct': 0.020988214883501517, 'atr_max_pct': 0.05771850122273431, 'tp_mult': 2.9992553198960668, 'tsl_mult': 0.07642575352489955, 'strategy': 'breakout', 'time_stop': 86, 'use_sma': True, 'use_atr': True, 'use_adx': False, 'use_ema': True, 'use_spike': False, 'rsi_required': False, 'edge_k': 1.4461033655798115, 'edge_cap': 0.7160027002514474, 'bull_strategy': 'mean_reversion', 'bull_bb_std_mult': 1.486907594729251, 'bull_rsi_os': 42, 'bull_rsi_ob': 63, 'bull_adx_thresh': 27.039019546663933, 'bull_atr_min_pct': 0.011445304750733026, 'bull_atr_max_pct': 0.08687702469464346, 'bull_tp_mult': 2.9001874377781407, 'bull_tsl_mult': 0.2690352664719937, 'bull_time_stop': 209, 'bull_use_sma': False, 'bull_use_ema': True, 'bull_use_atr': False, 'bull_use_adx': False, 'bull_use_spike': False, 'bull_rsi_required': False, 'bear_strategy': 'mean_reversion', 'bear_bb_std_mult': 1.477944712910038, 'bear_rsi_os': 53, 'bear_rsi_ob': 52, 'bear_adx_thresh': 8.974178650948557, 'bear_atr_min_pct': 0.021565987589274013, 'bear_atr_max_pct': 0.1386750087882545, 'bear_tp_mult': 1.3867232848450377, 'bear_tsl_mult': 0.9643280504516215, 'bear_time_stop': 91, 'bear_use_sma': False, 'bear_use_ema': False, 'bear_use_atr': True, 'bear_use_adx': False, 'bear_use_spike': True, 'bear_rsi_required': False, 'sideways_strategy': 'mean_reversion', 'sideways_bb_std_mult': 0.9938362045815134, 'sideways_rsi_os': 41, 'sideways_rsi_ob': 61, 'sideways_adx_thresh': 27.09713018163954, 'sideways_atr_min_pct': 0.010776079737783505, 'sideways_atr_max_pct': 0.10829807658699453, 'sideways_tp_mult': 1.458420826408848, 'sideways_tsl_mult': 0.6760412391063468, 'sideways_time_stop': 171, 'sideways_use_sma': True, 'sideways_use_ema': True, 'sideways_use_atr': False, 'sideways_use_adx': False, 'sideways_use_spike': True, 'sideways_rsi_required': False}.
