[I 2025-08-31 10:47:57,233] Trial 460 finished with values: [-1000000000.0, 1000000000.0] and parameters: {'p_sma': 44, 'p_std': 37, 'p_atr': 22, 'p_adx': 20, 'rsi_period': 36, 'ema1': 22, 'ema2': 29, 'slip_atr_k': 0.005087767463194101, 'slip_spread_k': 0.2409150119302656, 'spread_hl_frac': 0.022649938862157472, 'bb_std_mult': 2.6110549657658932, 'rsi_os': 36, 'rsi_ob': 74, 'vol_spike': 0.24742665094313618, 'adx_thresh': 33.18660670137922, 'atr_min_pct': 0.020324668185849677, 'atr_max_pct': 0.01766283160240289, 'tp_mult': 1.3284286147399773, 'tsl_mult': 0.9657151714869958, 'strategy': 'mean_reversion', 'time_stop': 151, 'use_sma': False, 'use_atr': False, 'use_adx': False, 'use_ema': False, 'use_spike': False, 'rsi_required': False, 'edge_k': 1.4363815141903293, 'edge_cap': 0.7938263978961195, 'bull_strategy': 'breakout', 'bull_bb_std_mult': 3.338947539859959, 'bull_rsi_os': 44, 'bull_rsi_ob': 78, 'bull_adx_thresh': 10.990850993535195, 'bull_atr_min_pct': 0.01715827180897366, 'bull_atr_max_pct': 0.03619589252384048, 'bull_tp_mult': 2.795235270701462, 'bull_tsl_mult': 0.10694669333679885, 'bull_time_stop': 59, 'bull_use_sma': False, 'bull_use_ema': True, 'bull_use_atr': False, 'bull_use_adx': True, 'bull_use_spike': True, 'bull_rsi_required': False, 'bear_strategy': 'breakout', 'bear_bb_std_mult': 1.496077117169693, 'bear_rsi_os': 25, 'bear_rsi_ob': 53, 'bear_adx_thresh': 14.342318118879456, 'bear_atr_min_pct': 0.025333331157576147, 'bear_atr_max_pct': 0.13359221565106194, 'bear_tp_mult': 2.850363402300523, 'bear_tsl_mult': 0.5654248329561136, 'bear_time_stop': 50, 'bear_use_sma': False, 'bear_use_ema': False, 'bear_use_atr': True, 'bear_use_adx': False, 'bear_use_spike': True, 'bear_rsi_required': True, 'sideways_strategy': 'mean_reversion', 'sideways_bb_std_mult': 2.334481411489015, 'sideways_rsi_os': 37, 'sideways_rsi_ob': 59, 'sideways_adx_thresh': 13.413901848791667, 'sideways_atr_min_pct': 0.005157709941965924, 'sideways_atr_max_pct': 0.015430825089693775, 'sideways_tp_mult': 1.8204240494323878, 'sideways_tsl_mult': 0.8943082388736643, 'sideways_time_stop': 134, 'sideways_use_sma': False, 'sideways_use_ema': False, 'sideways_use_atr': True, 'sideways_use_adx': False, 'sideways_use_spike': False, 'sideways_rsi_required': False}.
[I 2025-08-31 10:48:27,356] Trial 461 finished with values: [-1000000000.0, 1000000000.0] and parameters: {'p_sma': 43, 'p_std': 39, 'p_atr': 23, 'p_adx': 20, 'rsi_period': 43, 'ema1': 22, 'ema2': 35, 'slip_atr_k': 0.0005073949085960955, 'slip_spread_k': 0.2704794062041276, 'spread_hl_frac': 0.022352177524373056, 'bb_std_mult': 2.5959147798422766, 'rsi_os': 36, 'rsi_ob': 76, 'vol_spike': 0.22132329309797, 'adx_thresh': 26.576550221566567, 'atr_min_pct': 0.020291534568279257, 'atr_max_pct': 0.09259506923063326, 'tp_mult': 1.2262658073517105, 'tsl_mult': 0.23301455607201982, 'strategy': 'mean_reversion', 'time_stop': 153, 'use_sma': False, 'use_atr': False, 'use_adx': False, 'use_ema': False, 'use_spike': False, 'rsi_required': False, 'edge_k': 0.6151651754017745, 'edge_cap': 0.20632804326797538, 'bull_strategy': 'breakout', 'bull_bb_std_mult': 3.4215572852324123, 'bull_rsi_os': 16, 'bull_rsi_ob': 77, 'bull_adx_thresh': 34.95188555727877, 'bull_atr_min_pct': 0.028014290599274842, 'bull_atr_max_pct': 0.021283195384811434, 'bull_tp_mult': 2.7145246549838378, 'bull_tsl_mult': 0.7610006342829989, 'bull_time_stop': 57, 'bull_use_sma': False, 'bull_use_ema': False, 'bull_use_atr': False, 'bull_use_adx': True, 'bull_use_spike': True, 'bull_rsi_required': True, 'bear_strategy': 'breakout', 'bear_bb_std_mult': 1.5004200166270123, 'bear_rsi_os': 24, 'bear_rsi_ob': 53, 'bear_adx_thresh': 14.625242008137668, 'bear_atr_min_pct': 0.024078767516978485, 'bear_atr_max_pct': 0.13687920083400126, 'bear_tp_mult': 2.6940416416185973, 'bear_tsl_mult': 0.7607222091222078, 'bear_time_stop': 31, 'bear_use_sma': False, 'bear_use_ema': True, 'bear_use_atr': True, 'bear_use_adx': False, 'bear_use_spike': True, 'bear_rsi_required': True, 'sideways_strategy': 'mean_reversion', 'sideways_bb_std_mult': 2.399140690101554, 'sideways_rsi_os': 38, 'sideways_rsi_ob': 57, 'sideways_adx_thresh': 13.332194649613843, 'sideways_atr_min_pct': 0.005476144321210876, 'sideways_atr_max_pct': 0.015316083584646683, 'sideways_tp_mult': 1.9667016808805133, 'sideways_tsl_mult': 0.8968689466348314, 'sideways_time_stop': 65, 'sideways_use_sma': True, 'sideways_use_ema': False, 'sideways_use_atr': False, 'sideways_use_adx': False, 'sideways_use_spike': False, 'sideways_rsi_required': False}.
[I 2025-08-31 10:48:28,150] Trial 459 finished with values: [-1000000000.0, 1000000000.0] and parameters: {'p_sma': 44, 'p_std': 39, 'p_atr': 23, 'p_adx': 20, 'rsi_period': 41, 'ema1': 23, 'ema2': 58, 'slip_atr_k': 7.110769332784245e-05, 'slip_spread_k': 0.2689565323422376, 'spread_hl_frac': 0.022058596942449323, 'bb_std_mult': 2.5969125456134488, 'rsi_os': 36, 'rsi_ob': 74, 'vol_spike': 0.2220863507431656, 'adx_thresh': 21.815889871760184, 'atr_min_pct': 0.020388685463811618, 'atr_max_pct': 0.08961325843756729, 'tp_mult': 1.756860919551649, 'tsl_mult': 0.13644205001233584, 'strategy': 'mean_reversion', 'time_stop': 170, 'use_sma': False, 'use_atr': False, 'use_adx': False, 'use_ema': False, 'use_spike': False, 'rsi_required': False, 'edge_k': 1.4809187157431758, 'edge_cap': 0.19614955062651218, 'bull_strategy': 'breakout', 'bull_bb_std_mult': 3.331334785765155, 'bull_rsi_os': 44, 'bull_rsi_ob': 79, 'bull_adx_thresh': 7.1789135185287485, 'bull_atr_min_pct': 0.004275469960226549, 'bull_atr_max_pct': 0.0437141936987508, 'bull_tp_mult': 2.7873777892104226, 'bull_tsl_mult': 0.8368862727352675, 'bull_time_stop': 66, 'bull_use_sma': False, 'bull_use_ema': True, 'bull_use_atr': False, 'bull_use_adx': True, 'bull_use_spike': True, 'bull_rsi_required': False, 'bear_strategy': 'breakout', 'bear_bb_std_mult': 1.2981893018858641, 'bear_rsi_os': 25, 'bear_rsi_ob': 53, 'bear_adx_thresh': 14.570400578851705, 'bear_atr_min_pct': 0.024936191466327712, 'bear_atr_max_pct': 0.14013188469085033, 'bear_tp_mult': 2.8001257621047393, 'bear_tsl_mult': 0.1268420272168284, 'bear_time_stop': 37, 'bear_use_sma': False, 'bear_use_ema': False, 'bear_use_atr': True, 'bear_use_adx': False, 'bear_use_spike': True, 'bear_rsi_required': True, 'sideways_strategy': 'mean_reversion', 'sideways_bb_std_mult': 2.6314781617562204, 'sideways_rsi_os': 37, 'sideways_rsi_ob': 59, 'sideways_adx_thresh': 13.646111149093903, 'sideways_atr_min_pct': 0.0054467666119705485, 'sideways_atr_max_pct': 0.02801393636076157, 'sideways_tp_mult': 1.839371575854556, 'sideways_tsl_mult': 0.8974347071043972, 'sideways_time_stop': 264, 'sideways_use_sma': True, 'sideways_use_ema': False, 'sideways_use_atr': False, 'sideways_use_adx': False, 'sideways_use_spike': False, 'sideways_rsi_required': False}.
[I 2025-08-31 10:48:28,715] Trial 462 finished with values: [-1000000000.0, 1000000000.0] and parameters: {'p_sma': 45, 'p_std': 38, 'p_atr': 23, 'p_adx': 20, 'rsi_period': 38, 'ema1': 22, 'ema2': 58, 'slip_atr_k': 0.0004748637422764598, 'slip_spread_k': 0.07543334816914815, 'spread_hl_frac': 0.025337643330542732, 'bb_std_mult': 2.612998210964381, 'rsi_os': 36, 'rsi_ob': 76, 'vol_spike': 0.22639460223228017, 'adx_thresh': 33.31241360336338, 'atr_min_pct': 0.002902185087694421, 'atr_max_pct': 0.018440474188880285, 'tp_mult': 1.3193462027685374, 'tsl_mult': 0.6546956880523046, 'strategy': 'breakout', 'time_stop': 167, 'use_sma': False, 'use_atr': False, 'use_adx': False, 'use_ema': False, 'use_spike': False, 'rsi_required': False, 'edge_k': 1.823722004623447, 'edge_cap': 0.20587492563669268, 'bull_strategy': 'mean_reversion', 'bull_bb_std_mult': 3.421959526961192, 'bull_rsi_os': 44, 'bull_rsi_ob': 77, 'bull_adx_thresh': 11.140970876244898, 'bull_atr_min_pct': 0.015615682330622278, 'bull_atr_max_pct': 0.03122008393132325, 'bull_tp_mult': 2.718274371432728, 'bull_tsl_mult': 0.10364457296323067, 'bull_time_stop': 57, 'bull_use_sma': False, 'bull_use_ema': False, 'bull_use_atr': False, 'bull_use_adx': True, 'bull_use_spike': True, 'bull_rsi_required': True, 'bear_strategy': 'breakout', 'bear_bb_std_mult': 1.4792165984507273, 'bear_rsi_os': 23, 'bear_rsi_ob': 55, 'bear_adx_thresh': 13.179380586380683, 'bear_atr_min_pct': 0.025265496337640653, 'bear_atr_max_pct': 0.13413814608167113, 'bear_tp_mult': 2.6854569107796706, 'bear_tsl_mult': 0.09323048337521654, 'bear_time_stop': 31, 'bear_use_sma': False, 'bear_use_ema': True, 'bear_use_atr': True, 'bear_use_adx': False, 'bear_use_spike': True, 'bear_rsi_required': True, 'sideways_strategy': 'mean_reversion', 'sideways_bb_std_mult': 2.7100484329698062, 'sideways_rsi_os': 37, 'sideways_rsi_ob': 56, 'sideways_adx_thresh': 32.1523126288377, 'sideways_atr_min_pct': 0.005382727864256197, 'sideways_atr_max_pct': 0.05901698721627982, 'sideways_tp_mult': 1.8007799876838435, 'sideways_tsl_mult': 0.8979557678127332, 'sideways_time_stop': 265, 'sideways_use_sma': True, 'sideways_use_ema': True, 'sideways_use_atr': False, 'sideways_use_adx': False, 'sideways_use_spike': False, 'sideways_rsi_required': True}.
[I 2025-08-31 10:48:30,002] Trial 463 finished with values: [-1000000000.0, 1000000000.0] and parameters: {'p_sma': 45, 'p_std': 38, 'p_atr': 23, 'p_adx': 21, 'rsi_period': 43, 'ema1': 24, 'ema2': 55, 'slip_atr_k': 0.0006460862949603958, 'slip_spread_k': 0.41477148630585503, 'spread_hl_frac': 0.02492977317491484, 'bb_std_mult': 2.633021513198568, 'rsi_os': 34, 'rsi_ob': 76, 'vol_spike': 0.22547902887407165, 'adx_thresh': 8.281505748214999, 'atr_min_pct': 0.019017504247621487, 'atr_max_pct': 0.04546337296813822, 'tp_mult': 1.4806499497367243, 'tsl_mult': 0.648841849461077, 'strategy': 'breakout', 'time_stop': 164, 'use_sma': True, 'use_atr': False, 'use_adx': False, 'use_ema': False, 'use_spike': False, 'rsi_required': False, 'edge_k': 1.831242869369783, 'edge_cap': 0.726293592391482, 'bull_strategy': 'mean_reversion', 'bull_bb_std_mult': 3.4118412390347417, 'bull_rsi_os': 44, 'bull_rsi_ob': 77, 'bull_adx_thresh': 7.9717007940968045, 'bull_atr_min_pct': 0.003708371317018865, 'bull_atr_max_pct': 0.03051807752339615, 'bull_tp_mult': 2.8584885360926204, 'bull_tsl_mult': 0.763362627873109, 'bull_time_stop': 57, 'bull_use_sma': False, 'bull_use_ema': False, 'bull_use_atr': False, 'bull_use_adx': True, 'bull_use_spike': True, 'bull_rsi_required': True, 'bear_strategy': 'mean_reversion', 'bear_bb_std_mult': 1.3918371349406826, 'bear_rsi_os': 23, 'bear_rsi_ob': 55, 'bear_adx_thresh': 14.855606718697615, 'bear_atr_min_pct': 0.024269902383077135, 'bear_atr_max_pct': 0.1446322613703756, 'bear_tp_mult': 2.7001916481380985, 'bear_tsl_mult': 0.9819707928794781, 'bear_time_stop': 32, 'bear_use_sma': False, 'bear_use_ema': True, 'bear_use_atr': True, 'bear_use_adx': False, 'bear_use_spike': True, 'bear_rsi_required': True, 'sideways_strategy': 'mean_reversion', 'sideways_bb_std_mult': 2.7112244443698694, 'sideways_rsi_os': 23, 'sideways_rsi_ob': 56, 'sideways_adx_thresh': 13.825652050745939, 'sideways_atr_min_pct': 0.005483079321019454, 'sideways_atr_max_pct': 0.012223733235577414, 'sideways_tp_mult': 1.7891859871169358, 'sideways_tsl_mult': 0.9042729632137105, 'sideways_time_stop': 287, 'sideways_use_sma': True, 'sideways_use_ema': True, 'sideways_use_atr': False, 'sideways_use_adx': False, 'sideways_use_spike': False, 'sideways_rsi_required': True}.
[I 2025-08-31 10:49:02,177] Trial 467 finished with values: [-1000000000.0, 1000000000.0] and parameters: {'p_sma': 42, 'p_std': 37, 'p_atr': 22, 'p_adx': 21, 'rsi_period': 39, 'ema1': 21, 'ema2': 38, 'slip_atr_k': 0.011899053403124221, 'slip_spread_k': 0.7358799005282225, 'spread_hl_frac': 0.025695774280827574, 'bb_std_mult': 2.451274044372885, 'rsi_os': 34, 'rsi_ob': 71, 'vol_spike': 0.13460571746940453, 'adx_thresh': 7.11506654532303, 'atr_min_pct': 0.010935564619019221, 'atr_max_pct': 0.03434879492254046, 'tp_mult': 2.281331460041894, 'tsl_mult': 0.7226510563387982, 'strategy': 'mean_reversion', 'time_stop': 300, 'use_sma': True, 'use_atr': True, 'use_adx': False, 'use_ema': True, 'use_spike': False, 'rsi_required': False, 'edge_k': 1.2311247612384082, 'edge_cap': 0.609528542463492, 'bull_strategy': 'breakout', 'bull_bb_std_mult': 3.5176256883363957, 'bull_rsi_os': 51, 'bull_rsi_ob': 81, 'bull_adx_thresh': 9.879419540272051, 'bull_atr_min_pct': 0.024645845493323718, 'bull_atr_max_pct': 0.02583804486494514, 'bull_tp_mult': 2.9194390681084976, 'bull_tsl_mult': 0.2938408603304851, 'bull_time_stop': 60, 'bull_use_sma': False, 'bull_use_ema': True, 'bull_use_atr': False, 'bull_use_adx': True, 'bull_use_spike': False, 'bull_rsi_required': False, 'bear_strategy': 'mean_reversion', 'bear_bb_std_mult': 1.3743830101484253, 'bear_rsi_os': 21, 'bear_rsi_ob': 55, 'bear_adx_thresh': 13.98768372780796, 'bear_atr_min_pct': 0.026203888146024413, 'bear_atr_max_pct': 0.1342095479047628, 'bear_tp_mult': 2.0836849433797724, 'bear_tsl_mult': 0.5004357797473238, 'bear_time_stop': 40, 'bear_use_sma': False, 'bear_use_ema': False, 'bear_use_atr': False, 'bear_use_adx': True, 'bear_use_spike': False, 'bear_rsi_required': True, 'sideways_strategy': 'mean_reversion', 'sideways_bb_std_mult': 2.5539653927626644, 'sideways_rsi_os': 50, 'sideways_rsi_ob': 57, 'sideways_adx_thresh': 8.348604936653679, 'sideways_atr_min_pct': 0.004655483128756964, 'sideways_atr_max_pct': 0.010123488567802062, 'sideways_tp_mult': 1.8635880007610544, 'sideways_tsl_mult': 0.9311220120877366, 'sideways_time_stop': 174, 'sideways_use_sma': True, 'sideways_use_ema': False, 'sideways_use_atr': False, 'sideways_use_adx': False, 'sideways_use_spike': True, 'sideways_rsi_required': False}.
[I 2025-08-31 10:49:02,432] Trial 465 finished with values: [-1000000000.0, 1000000000.0] and parameters: {'p_sma': 45, 'p_std': 37, 'p_atr': 22, 'p_adx': 21, 'rsi_period': 38, 'ema1': 24, 'ema2': 55, 'slip_atr_k': 0.01306759122521041, 'slip_spread_k': 0.29852926693251236, 'spread_hl_frac': 0.02557690449411773, 'bb_std_mult': 2.463688164933128, 'rsi_os': 34, 'rsi_ob': 70, 'vol_spike': 0.11116143517098437, 'adx_thresh': 8.331330200546093, 'atr_min_pct': 0.0029171679934671697, 'atr_max_pct': 0.04399433303227371, 'tp_mult': 2.813683902743388, 'tsl_mult': 0.6595663079534495, 'strategy': 'breakout', 'time_stop': 167, 'use_sma': True, 'use_atr': True, 'use_adx': False, 'use_ema': True, 'use_spike': False, 'rsi_required': False, 'edge_k': 1.8175795874193912, 'edge_cap': 0.9026287553607819, 'bull_strategy': 'mean_reversion', 'bull_bb_std_mult': 3.5000340341464153, 'bull_rsi_os': 51, 'bull_rsi_ob': 91, 'bull_adx_thresh': 18.686966789438653, 'bull_atr_min_pct': 0.022374654630555005, 'bull_atr_max_pct': 0.025660288520458166, 'bull_tp_mult': 2.8612818848856896, 'bull_tsl_mult': 0.40218773943706093, 'bull_time_stop': 55, 'bull_use_sma': False, 'bull_use_ema': False, 'bull_use_atr': False, 'bull_use_adx': True, 'bull_use_spike': False, 'bull_rsi_required': True, 'bear_strategy': 'mean_reversion', 'bear_bb_std_mult': 1.3872935375629867, 'bear_rsi_os': 23, 'bear_rsi_ob': 71, 'bear_adx_thresh': 13.395686857128407, 'bear_atr_min_pct': 0.026452258687375805, 'bear_atr_max_pct': 0.1441362352613199, 'bear_tp_mult': 2.696116321093523, 'bear_tsl_mult': 0.09083344301887723, 'bear_time_stop': 43, 'bear_use_sma': False, 'bear_use_ema': True, 'bear_use_atr': False, 'bear_use_adx': False, 'bear_use_spike': False, 'bear_rsi_required': True, 'sideways_strategy': 'mean_reversion', 'sideways_bb_std_mult': 2.7067614292866127, 'sideways_rsi_os': 36, 'sideways_rsi_ob': 56, 'sideways_adx_thresh': 32.51073636931787, 'sideways_atr_min_pct': 0.00477267701795836, 'sideways_atr_max_pct': 0.14469281968788578, 'sideways_tp_mult': 1.9901550192036888, 'sideways_tsl_mult': 0.9252515570214698, 'sideways_time_stop': 272, 'sideways_use_sma': True, 'sideways_use_ema': True, 'sideways_use_atr': False, 'sideways_use_adx': False, 'sideways_use_spike': True, 'sideways_rsi_required': True}.
[I 2025-08-31 10:49:02,716] Trial 464 finished with values: [-1000000000.0, 1000000000.0] and parameters: {'p_sma': 45, 'p_std': 38, 'p_atr': 23, 'p_adx': 21, 'rsi_period': 38, 'ema1': 24, 'ema2': 55, 'slip_atr_k': 0.0037709118494034764, 'slip_spread_k': 0.3544631944575076, 'spread_hl_frac': 0.025360066375455518, 'bb_std_mult': 2.5989489129488117, 'rsi_os': 34, 'rsi_ob': 83, 'vol_spike': 0.22686153994310135, 'adx_thresh': 8.46550118575486, 'atr_min_pct': 0.018910651815255915, 'atr_max_pct': 0.043614707451619744, 'tp_mult': 1.1723183679243396, 'tsl_mult': 0.6459894629174108, 'strategy': 'breakout', 'time_stop': 169, 'use_sma': True, 'use_atr': False, 'use_adx': False, 'use_ema': False, 'use_spike': False, 'rsi_required': False, 'edge_k': 1.2390515076369837, 'edge_cap': 0.9022015081268082, 'bull_strategy': 'mean_reversion', 'bull_bb_std_mult': 3.506358215302447, 'bull_rsi_os': 45, 'bull_rsi_ob': 80, 'bull_adx_thresh': 11.052204108149159, 'bull_atr_min_pct': 0.004312137118814448, 'bull_atr_max_pct': 0.02605142011867189, 'bull_tp_mult': 2.927830106832127, 'bull_tsl_mult': 0.6759936988911991, 'bull_time_stop': 60, 'bull_use_sma': False, 'bull_use_ema': True, 'bull_use_atr': False, 'bull_use_adx': True, 'bull_use_spike': True, 'bull_rsi_required': False, 'bear_strategy': 'mean_reversion', 'bear_bb_std_mult': 1.3947380197957346, 'bear_rsi_os': 23, 'bear_rsi_ob': 55, 'bear_adx_thresh': 13.170087971155962, 'bear_atr_min_pct': 0.02649266562409602, 'bear_atr_max_pct': 0.1346599012516846, 'bear_tp_mult': 2.8204910732289865, 'bear_tsl_mult': 0.9979681921763115, 'bear_time_stop': 36, 'bear_use_sma': False, 'bear_use_ema': False, 'bear_use_atr': False, 'bear_use_adx': False, 'bear_use_spike': False, 'bear_rsi_required': True, 'sideways_strategy': 'mean_reversion', 'sideways_bb_std_mult': 2.706864023958328, 'sideways_rsi_os': 23, 'sideways_rsi_ob': 56, 'sideways_adx_thresh': 14.569840476746766, 'sideways_atr_min_pct': 0.007714344556140399, 'sideways_atr_max_pct': 0.045431314061310325, 'sideways_tp_mult': 1.8445722030040548, 'sideways_tsl_mult': 0.9262777576333057, 'sideways_time_stop': 262, 'sideways_use_sma': True, 'sideways_use_ema': True, 'sideways_use_atr': False, 'sideways_use_adx': False, 'sideways_use_spike': True, 'sideways_rsi_required': True}.
[I 2025-08-31 10:49:02,814] Trial 466 finished with values: [-1000000000.0, 1000000000.0] and parameters: {'p_sma': 42, 'p_std': 37, 'p_atr': 24, 'p_adx': 21, 'rsi_period': 40, 'ema1': 21, 'ema2': 40, 'slip_atr_k': 0.015641891877291605, 'slip_spread_k': 0.29535456262123017, 'spread_hl_frac': 0.025430947549671745, 'bb_std_mult': 2.4301071081290195, 'rsi_os': 34, 'rsi_ob': 71, 'vol_spike': 0.2515664433105343, 'adx_thresh': 8.373626037151071, 'atr_min_pct': 0.019013827121498995, 'atr_max_pct': 0.044587713044801164, 'tp_mult': 2.2795825541462937, 'tsl_mult': 0.722576749734464, 'strategy': 'breakout', 'time_stop': 162, 'use_sma': True, 'use_atr': True, 'use_adx': False, 'use_ema': True, 'use_spike': False, 'rsi_required': False, 'edge_k': 0.5653432058932242, 'edge_cap': 0.36546796223344186, 'bull_strategy': 'mean_reversion', 'bull_bb_std_mult': 3.4985040251063015, 'bull_rsi_os': 54, 'bull_rsi_ob': 57, 'bull_adx_thresh': 8.158722553401917, 'bull_atr_min_pct': 0.014123769943507574, 'bull_atr_max_pct': 0.026755906469834292, 'bull_tp_mult': 2.8743467562487615, 'bull_tsl_mult': 0.12589116281413248, 'bull_time_stop': 75, 'bull_use_sma': False, 'bull_use_ema': True, 'bull_use_atr': False, 'bull_use_adx': True, 'bull_use_spike': False, 'bull_rsi_required': False, 'bear_strategy': 'mean_reversion', 'bear_bb_std_mult': 1.3904407859239134, 'bear_rsi_os': 21, 'bear_rsi_ob': 70, 'bear_adx_thresh': 15.464038756573562, 'bear_atr_min_pct': 0.026417699849362587, 'bear_atr_max_pct': 0.14386874508833467, 'bear_tp_mult': 1.9739436497253642, 'bear_tsl_mult': 0.9832112977306131, 'bear_time_stop': 43, 'bear_use_sma': False, 'bear_use_ema': False, 'bear_use_atr': False, 'bear_use_adx': True, 'bear_use_spike': False, 'bear_rsi_required': True, 'sideways_strategy': 'mean_reversion', 'sideways_bb_std_mult': 2.5657704526110594, 'sideways_rsi_os': 23, 'sideways_rsi_ob': 57, 'sideways_adx_thresh': 8.256072536306048, 'sideways_atr_min_pct': 0.004921108728788872, 'sideways_atr_max_pct': 0.0740918862279216, 'sideways_tp_mult': 1.8630676925414495, 'sideways_tsl_mult': 0.9240153103441026, 'sideways_time_stop': 284, 'sideways_use_sma': True, 'sideways_use_ema': True, 'sideways_use_atr': False, 'sideways_use_adx': False, 'sideways_use_spike': True, 'sideways_rsi_required': True}.
