[I 2025-08-31 10:57:05,452] Trial 533 finished with values: [-1000000000.0, 1000000000.0] and parameters: {'p_sma': 49, 'p_std': 13, 'p_atr': 21, 'p_adx': 20, 'rsi_period': 46, 'ema1': 22, 'ema2': 59, 'slip_atr_k': 0.1660282239901678, 'slip_spread_k': 0.24927286347576527, 'spread_hl_frac': 0.038192205547992374, 'bb_std_mult': 2.52394673900789, 'rsi_os': 19, 'rsi_ob': 75, 'vol_spike': 0.21343486919389665, 'adx_thresh': 11.389452622021835, 'atr_min_pct': 0.018522969468420466, 'atr_max_pct': 0.045721005564456976, 'tp_mult': 2.8566138730247017, 'tsl_mult': 0.686816503581761, 'strategy': 'mean_reversion', 'time_stop': 148, 'use_sma': False, 'use_atr': False, 'use_adx': False, 'use_ema': False, 'use_spike': False, 'rsi_required': False, 'edge_k': 0.7165328709484224, 'edge_cap': 0.21759315832235548, 'bull_strategy': 'breakout', 'bull_bb_std_mult': 2.0405105483235144, 'bull_rsi_os': 43, 'bull_rsi_ob': 84, 'bull_adx_thresh': 10.244414203825244, 'bull_atr_min_pct': 0.017654767029800095, 'bull_atr_max_pct': 0.047694338320261584, 'bull_tp_mult': 1.9057957754213655, 'bull_tsl_mult': 0.8701911201422705, 'bull_time_stop': 69, 'bull_use_sma': False, 'bull_use_ema': False, 'bull_use_atr': False, 'bull_use_adx': False, 'bull_use_spike': False, 'bull_rsi_required': True, 'bear_strategy': 'breakout', 'bear_bb_std_mult': 0.6445303835369458, 'bear_rsi_os': 25, 'bear_rsi_ob': 72, 'bear_adx_thresh': 15.347681999184951, 'bear_atr_min_pct': 0.025551353825174313, 'bear_atr_max_pct': 0.13922028067890838, 'bear_tp_mult': 2.750296877954409, 'bear_tsl_mult': 0.440666744011087, 'bear_time_stop': 57, 'bear_use_sma': False, 'bear_use_ema': True, 'bear_use_atr': True, 'bear_use_adx': False, 'bear_use_spike': False, 'bear_rsi_required': True, 'sideways_strategy': 'mean_reversion', 'sideways_bb_std_mult': 2.739805198428343, 'sideways_rsi_os': 6, 'sideways_rsi_ob': 57, 'sideways_adx_thresh': 11.191802758817314, 'sideways_atr_min_pct': 0.005128334402790981, 'sideways_atr_max_pct': 0.05840069871867051, 'sideways_tp_mult': 1.84089969417629, 'sideways_tsl_mult': 0.5663889085975378, 'sideways_time_stop': 192, 'sideways_use_sma': False, 'sideways_use_ema': False, 'sideways_use_atr': False, 'sideways_use_adx': False, 'sideways_use_spike': False, 'sideways_rsi_required': True}.
[I 2025-08-31 10:57:06,132] Trial 532 finished with values: [-1000000000.0, 1000000000.0] and parameters: {'p_sma': 48, 'p_std': 40, 'p_atr': 22, 'p_adx': 20, 'rsi_period': 74, 'ema1': 22, 'ema2': 55, 'slip_atr_k': 0.1637280617259049, 'slip_spread_k': 0.2502225905454536, 'spread_hl_frac': 0.026270285852308943, 'bb_std_mult': 2.4410989598197275, 'rsi_os': 34, 'rsi_ob': 75, 'vol_spike': 0.09582816532131352, 'adx_thresh': 9.250319111221197, 'atr_min_pct': 0.020047375629674884, 'atr_max_pct': 0.14779489654996786, 'tp_mult': 2.860884254749379, 'tsl_mult': 0.6852825544440936, 'strategy': 'mean_reversion', 'time_stop': 147, 'use_sma': False, 'use_atr': False, 'use_adx': False, 'use_ema': False, 'use_spike': False, 'rsi_required': False, 'edge_k': 0.5498756601148485, 'edge_cap': 0.21064142151927204, 'bull_strategy': 'breakout', 'bull_bb_std_mult': 2.3564688366979825, 'bull_rsi_os': 43, 'bull_rsi_ob': 47, 'bull_adx_thresh': 9.352397423536328, 'bull_atr_min_pct': 0.005297198460654238, 'bull_atr_max_pct': 0.0482367872324798, 'bull_tp_mult': 2.7917171349410133, 'bull_tsl_mult': 0.08534492971311042, 'bull_time_stop': 173, 'bull_use_sma': False, 'bull_use_ema': True, 'bull_use_atr': False, 'bull_use_adx': True, 'bull_use_spike': False, 'bull_rsi_required': False, 'bear_strategy': 'breakout', 'bear_bb_std_mult': 2.63189005895639, 'bear_rsi_os': 17, 'bear_rsi_ob': 95, 'bear_adx_thresh': 12.996508489075232, 'bear_atr_min_pct': 0.024566907556367694, 'bear_atr_max_pct': 0.13829634393148976, 'bear_tp_mult': 2.776132182178391, 'bear_tsl_mult': 0.3031656678272858, 'bear_time_stop': 225, 'bear_use_sma': False, 'bear_use_ema': True, 'bear_use_atr': True, 'bear_use_adx': False, 'bear_use_spike': False, 'bear_rsi_required': True, 'sideways_strategy': 'mean_reversion', 'sideways_bb_std_mult': 3.1918176358113506, 'sideways_rsi_os': 50, 'sideways_rsi_ob': 58, 'sideways_adx_thresh': 32.94751387114564, 'sideways_atr_min_pct': 0.005096475108837754, 'sideways_atr_max_pct': 0.017602864523793994, 'sideways_tp_mult': 1.8547224752185911, 'sideways_tsl_mult': 0.928947673819565, 'sideways_time_stop': 283, 'sideways_use_sma': True, 'sideways_use_ema': False, 'sideways_use_atr': False, 'sideways_use_adx': False, 'sideways_use_spike': True, 'sideways_rsi_required': True}.
[I 2025-08-31 10:57:06,251] Trial 530 finished with values: [-1000000000.0, 1000000000.0] and parameters: {'p_sma': 30, 'p_std': 53, 'p_atr': 22, 'p_adx': 20, 'rsi_period': 50, 'ema1': 22, 'ema2': 39, 'slip_atr_k': 0.1492688869009927, 'slip_spread_k': 0.6585596930171691, 'spread_hl_frac': 0.022094951416641934, 'bb_std_mult': 2.5344762369245144, 'rsi_os': 34, 'rsi_ob': 91, 'vol_spike': 0.12921724887083066, 'adx_thresh': 32.61648731367719, 'atr_min_pct': 0.01843667289460677, 'atr_max_pct': 0.07402073440502868, 'tp_mult': 2.5308160192909326, 'tsl_mult': 0.6997518514805743, 'strategy': 'mean_reversion', 'time_stop': 151, 'use_sma': False, 'use_atr': False, 'use_adx': False, 'use_ema': False, 'use_spike': False, 'rsi_required': False, 'edge_k': 0.12252966954019295, 'edge_cap': 0.7857025495712098, 'bull_strategy': 'breakout', 'bull_bb_std_mult': 1.62945334773495, 'bull_rsi_os': 43, 'bull_rsi_ob': 47, 'bull_adx_thresh': 20.527819654025144, 'bull_atr_min_pct': 0.017608827252850963, 'bull_atr_max_pct': 0.04863961529045822, 'bull_tp_mult': 1.5429763969002495, 'bull_tsl_mult': 0.8706412273681196, 'bull_time_stop': 127, 'bull_use_sma': False, 'bull_use_ema': True, 'bull_use_atr': False, 'bull_use_adx': True, 'bull_use_spike': True, 'bull_rsi_required': False, 'bear_strategy': 'breakout', 'bear_bb_std_mult': 0.6283775769722997, 'bear_rsi_os': 25, 'bear_rsi_ob': 72, 'bear_adx_thresh': 23.752056223548955, 'bear_atr_min_pct': 0.024417887309006497, 'bear_atr_max_pct': 0.13904557052161848, 'bear_tp_mult': 2.7500627079229516, 'bear_tsl_mult': 0.1323644736445031, 'bear_time_stop': 16, 'bear_use_sma': False, 'bear_use_ema': False, 'bear_use_atr': True, 'bear_use_adx': True, 'bear_use_spike': False, 'bear_rsi_required': True, 'sideways_strategy': 'mean_reversion', 'sideways_bb_std_mult': 0.9696655700907555, 'sideways_rsi_os': 50, 'sideways_rsi_ob': 75, 'sideways_adx_thresh': 6.828867381518982, 'sideways_atr_min_pct': 0.005721871779234056, 'sideways_atr_max_pct': 0.01182485466869709, 'sideways_tp_mult': 2.249630926343814, 'sideways_tsl_mult': 0.3840191368463929, 'sideways_time_stop': 128, 'sideways_use_sma': True, 'sideways_use_ema': False, 'sideways_use_atr': False, 'sideways_use_adx': False, 'sideways_use_spike': True, 'sideways_rsi_required': True}.
[I 2025-08-31 10:57:38,335] Trial 534 finished with values: [-1000000000.0, 1000000000.0] and parameters: {'p_sma': 10, 'p_std': 60, 'p_atr': 13, 'p_adx': 19, 'rsi_period': 50, 'ema1': 22, 'ema2': 55, 'slip_atr_k': 0.004101824878986387, 'slip_spread_k': 0.6502180559199366, 'spread_hl_frac': 0.01868840157065759, 'bb_std_mult': 0.983116449407617, 'rsi_os': 14, 'rsi_ob': 75, 'vol_spike': 0.1285520945043958, 'adx_thresh': 9.31457613663909, 'atr_min_pct': 0.02007635197667343, 'atr_max_pct': 0.027729036602848506, 'tp_mult': 2.8516544700061637, 'tsl_mult': 0.6842785289009164, 'strategy': 'mean_reversion', 'time_stop': 160, 'use_sma': False, 'use_atr': True, 'use_adx': False, 'use_ema': True, 'use_spike': False, 'rsi_required': False, 'edge_k': 1.8620090779431038, 'edge_cap': 0.2922904063135322, 'bull_strategy': 'mean_reversion', 'bull_bb_std_mult': 2.1985314629029165, 'bull_rsi_os': 43, 'bull_rsi_ob': 78, 'bull_adx_thresh': 10.31489182397445, 'bull_atr_min_pct': 0.004290025612199939, 'bull_atr_max_pct': 0.04496626835744059, 'bull_tp_mult': 2.774217396061014, 'bull_tsl_mult': 0.8671228765452852, 'bull_time_stop': 80, 'bull_use_sma': False, 'bull_use_ema': False, 'bull_use_atr': False, 'bull_use_adx': False, 'bull_use_spike': False, 'bull_rsi_required': True, 'bear_strategy': 'mean_reversion', 'bear_bb_std_mult': 1.4011907572633786, 'bear_rsi_os': 19, 'bear_rsi_ob': 95, 'bear_adx_thresh': 15.32116685151232, 'bear_atr_min_pct': 0.025576792729738652, 'bear_atr_max_pct': 0.13878946566753986, 'bear_tp_mult': 2.7418282201133946, 'bear_tsl_mult': 0.13865692313181238, 'bear_time_stop': 38, 'bear_use_sma': False, 'bear_use_ema': True, 'bear_use_atr': True, 'bear_use_adx': False, 'bear_use_spike': False, 'bear_rsi_required': True, 'sideways_strategy': 'mean_reversion', 'sideways_bb_std_mult': 3.1909891122049867, 'sideways_rsi_os': 21, 'sideways_rsi_ob': 58, 'sideways_adx_thresh': 32.87076912721986, 'sideways_atr_min_pct': 0.005208708457515568, 'sideways_atr_max_pct': 0.10605280911309654, 'sideways_tp_mult': 1.8888353669976468, 'sideways_tsl_mult': 0.25044391316294445, 'sideways_time_stop': 267, 'sideways_use_sma': False, 'sideways_use_ema': False, 'sideways_use_atr': False, 'sideways_use_adx': False, 'sideways_use_spike': False, 'sideways_rsi_required': True}.
[I 2025-08-31 10:57:39,259] Trial 537 finished with values: [-1000000000.0, 1000000000.0] and parameters: {'p_sma': 44, 'p_std': 38, 'p_atr': 13, 'p_adx': 19, 'rsi_period': 38, 'ema1': 7, 'ema2': 58, 'slip_atr_k': 0.008525551336291216, 'slip_spread_k': 0.416533267270889, 'spread_hl_frac': 0.01867980140981984, 'bb_std_mult': 1.5812143510544905, 'rsi_os': 37, 'rsi_ob': 74, 'vol_spike': 0.019896024848900518, 'adx_thresh': 10.149377037626843, 'atr_min_pct': 0.02007457306198096, 'atr_max_pct': 0.03876576273971094, 'tp_mult': 1.7505085119749475, 'tsl_mult': 0.6497782878941758, 'strategy': 'breakout', 'time_stop': 158, 'use_sma': True, 'use_atr': True, 'use_adx': False, 'use_ema': True, 'use_spike': False, 'rsi_required': False, 'edge_k': 1.8876931781878186, 'edge_cap': 0.667473038946325, 'bull_strategy': 'mean_reversion', 'bull_bb_std_mult': 3.419467642021251, 'bull_rsi_os': 44, 'bull_rsi_ob': 78, 'bull_adx_thresh': 8.514333954826256, 'bull_atr_min_pct': 0.016889370522499083, 'bull_atr_max_pct': 0.044406937845479756, 'bull_tp_mult': 2.7690233829728466, 'bull_tsl_mult': 0.1311314278805446, 'bull_time_stop': 83, 'bull_use_sma': False, 'bull_use_ema': False, 'bull_use_atr': False, 'bull_use_adx': False, 'bull_use_spike': True, 'bull_rsi_required': True, 'bear_strategy': 'mean_reversion', 'bear_bb_std_mult': 1.121783699570361, 'bear_rsi_os': 22, 'bear_rsi_ob': 55, 'bear_adx_thresh': 13.495200467344741, 'bear_atr_min_pct': 0.0256102579627379, 'bear_atr_max_pct': 0.13328927598317938, 'bear_tp_mult': 2.822626786281369, 'bear_tsl_mult': 0.9685475696354826, 'bear_time_stop': 39, 'bear_use_sma': False, 'bear_use_ema': False, 'bear_use_atr': True, 'bear_use_adx': False, 'bear_use_spike': True, 'bear_rsi_required': False, 'sideways_strategy': 'mean_reversion', 'sideways_bb_std_mult': 1.7433194735072852, 'sideways_rsi_os': 21, 'sideways_rsi_ob': 62, 'sideways_adx_thresh': 13.488466678100847, 'sideways_atr_min_pct': 0.007237184307268888, 'sideways_atr_max_pct': 0.04809303536439946, 'sideways_tp_mult': 1.9557120871742906, 'sideways_tsl_mult': 0.24170017692367352, 'sideways_time_stop': 267, 'sideways_use_sma': False, 'sideways_use_ema': True, 'sideways_use_atr': False, 'sideways_use_adx': False, 'sideways_use_spike': False, 'sideways_rsi_required': False}.
[I 2025-08-31 10:57:39,768] Trial 535 finished with values: [-1000000000.0, 1000000000.0] and parameters: {'p_sma': 10, 'p_std': 48, 'p_atr': 13, 'p_adx': 20, 'rsi_period': 38, 'ema1': 22, 'ema2': 55, 'slip_atr_k': 0.14729740846250852, 'slip_spread_k': 0.4182205874998557, 'spread_hl_frac': 0.021967456340375762, 'bb_std_mult': 2.4451520707138665, 'rsi_os': 14, 'rsi_ob': 74, 'vol_spike': 0.13090919574852086, 'adx_thresh': 9.380084117542573, 'atr_min_pct': 0.02000164214779789, 'atr_max_pct': 0.038862690284684476, 'tp_mult': 1.7381782719422743, 'tsl_mult': 0.24355486852191105, 'strategy': 'breakout', 'time_stop': 161, 'use_sma': True, 'use_atr': True, 'use_adx': False, 'use_ema': True, 'use_spike': False, 'rsi_required': False, 'edge_k': 0.10776455407959828, 'edge_cap': 0.44349545499118365, 'bull_strategy': 'mean_reversion', 'bull_bb_std_mult': 3.417121940579585, 'bull_rsi_os': 44, 'bull_rsi_ob': 57, 'bull_adx_thresh': 8.475183997004384, 'bull_atr_min_pct': 0.011765996820793791, 'bull_atr_max_pct': 0.04457234218518393, 'bull_tp_mult': 2.783353417816977, 'bull_tsl_mult': 0.12673764343586397, 'bull_time_stop': 82, 'bull_use_sma': False, 'bull_use_ema': True, 'bull_use_atr': False, 'bull_use_adx': True, 'bull_use_spike': True, 'bull_rsi_required': False, 'bear_strategy': 'mean_reversion', 'bear_bb_std_mult': 2.891354251614168, 'bear_rsi_os': 17, 'bear_rsi_ob': 62, 'bear_adx_thresh': 12.935171109457094, 'bear_atr_min_pct': 0.002150368518422428, 'bear_atr_max_pct': 0.1318154486718886, 'bear_tp_mult': 2.7049615478363913, 'bear_tsl_mult': 0.137924586926779, 'bear_time_stop': 38, 'bear_use_sma': False, 'bear_use_ema': True, 'bear_use_atr': True, 'bear_use_adx': False, 'bear_use_spike': True, 'bear_rsi_required': True, 'sideways_strategy': 'mean_reversion', 'sideways_bb_std_mult': 0.9639946348362725, 'sideways_rsi_os': 47, 'sideways_rsi_ob': 75, 'sideways_adx_thresh': 13.634621021154901, 'sideways_atr_min_pct': 0.007387388702566421, 'sideways_atr_max_pct': 0.02398666251292316, 'sideways_tp_mult': 1.8815973437441038, 'sideways_tsl_mult': 0.9291147547432458, 'sideways_time_stop': 271, 'sideways_use_sma': True, 'sideways_use_ema': True, 'sideways_use_atr': False, 'sideways_use_adx': False, 'sideways_use_spike': True, 'sideways_rsi_required': False}.
[I 2025-08-31 10:57:39,841] Trial 536 finished with values: [-1000000000.0, 1000000000.0] and parameters: {'p_sma': 39, 'p_std': 38, 'p_atr': 9, 'p_adx': 22, 'rsi_period': 50, 'ema1': 6, 'ema2': 48, 'slip_atr_k': 0.0055891853155544706, 'slip_spread_k': 0.2925593697678103, 'spread_hl_frac': 0.0393894325111482, 'bb_std_mult': 2.634423963657163, 'rsi_os': 37, 'rsi_ob': 93, 'vol_spike': 0.21415698151053045, 'adx_thresh': 27.51179718626762, 'atr_min_pct': 0.026858774552626693, 'atr_max_pct': 0.03420976781066738, 'tp_mult': 2.7671482850996183, 'tsl_mult': 0.42376295321027263, 'strategy': 'breakout', 'time_stop': 162, 'use_sma': True, 'use_atr': True, 'use_adx': False, 'use_ema': True, 'use_spike': False, 'rsi_required': False, 'edge_k': 0.1440613788220585, 'edge_cap': 0.17819576338642112, 'bull_strategy': 'mean_reversion', 'bull_bb_std_mult': 3.4218941398433436, 'bull_rsi_os': 44, 'bull_rsi_ob': 78, 'bull_adx_thresh': 8.577358734621715, 'bull_atr_min_pct': 0.004289548342633875, 'bull_atr_max_pct': 0.13278978200893451, 'bull_tp_mult': 1.5601188999668385, 'bull_tsl_mult': 0.12756090721932617, 'bull_time_stop': 88, 'bull_use_sma': False, 'bull_use_ema': True, 'bull_use_atr': False, 'bull_use_adx': True, 'bull_use_spike': True, 'bull_rsi_required': False, 'bear_strategy': 'mean_reversion', 'bear_bb_std_mult': 2.5159734865092975, 'bear_rsi_os': 21, 'bear_rsi_ob': 55, 'bear_adx_thresh': 30.85164296258344, 'bear_atr_min_pct': 0.0006503279968293942, 'bear_atr_max_pct': 0.13534341760806767, 'bear_tp_mult': 2.164743824644938, 'bear_tsl_mult': 0.8076187064352354, 'bear_time_stop': 39, 'bear_use_sma': False, 'bear_use_ema': False, 'bear_use_atr': True, 'bear_use_adx': False, 'bear_use_spike': True, 'bear_rsi_required': True, 'sideways_strategy': 'mean_reversion', 'sideways_bb_std_mult': 2.0469344394396844, 'sideways_rsi_os': 34, 'sideways_rsi_ob': 61, 'sideways_adx_thresh': 13.780724747041639, 'sideways_atr_min_pct': 0.007126189992217072, 'sideways_atr_max_pct': 0.04794036828978637, 'sideways_tp_mult': 2.257797334877653, 'sideways_tsl_mult': 0.8617938964778165, 'sideways_time_stop': 270, 'sideways_use_sma': True, 'sideways_use_ema': True, 'sideways_use_atr': False, 'sideways_use_adx': False, 'sideways_use_spike': True, 'sideways_rsi_required': False}.
[I 2025-08-31 10:58:15,298] Trial 540 finished with values: [-0.017491111612125132, 0.017256840760755274] and parameters: {'p_sma': 51, 'p_std': 37, 'p_atr': 27, 'p_adx': 18, 'rsi_period': 63, 'ema1': 21, 'ema2': 58, 'slip_atr_k': 0.23873323915223726, 'slip_spread_k': 0.2235235406627512, 'spread_hl_frac': 0.025603858084462326, 'bb_std_mult': 0.6382519294701157, 'rsi_os': 29, 'rsi_ob': 77, 'vol_spike': 0.2953242753616939, 'adx_thresh': 5.618561786469835, 'atr_min_pct': 0.027717047199125877, 'atr_max_pct': 0.0461104022689757, 'tp_mult': 2.7851467929969047, 'tsl_mult': 0.16824537750518959, 'strategy': 'mean_reversion', 'time_stop': 99, 'use_sma': False, 'use_atr': False, 'use_adx': False, 'use_ema': False, 'use_spike': False, 'rsi_required': False, 'edge_k': 1.7749542526505033, 'edge_cap': 0.2671483964373012, 'bull_strategy': 'breakout', 'bull_bb_std_mult': 3.491039222898225, 'bull_rsi_os': 20, 'bull_rsi_ob': 95, 'bull_adx_thresh': 5.885050667931969, 'bull_atr_min_pct': 0.0033789874171064275, 'bull_atr_max_pct': 0.040443059899674984, 'bull_tp_mult': 2.9678524963215027, 'bull_tsl_mult': 0.16507674155707897, 'bull_time_stop': 60, 'bull_use_sma': False, 'bull_use_ema': True, 'bull_use_atr': False, 'bull_use_adx': True, 'bull_use_spike': True, 'bull_rsi_required': False, 'bear_strategy': 'breakout', 'bear_bb_std_mult': 1.217536139303835, 'bear_rsi_os': 11, 'bear_rsi_ob': 63, 'bear_adx_thresh': 14.675676778576499, 'bear_atr_min_pct': 0.02693053080477874, 'bear_atr_max_pct': 0.14203581111839672, 'bear_tp_mult': 1.8375221394497083, 'bear_tsl_mult': 0.061955201771745266, 'bear_time_stop': 48, 'bear_use_sma': False, 'bear_use_ema': False, 'bear_use_atr': True, 'bear_use_adx': False, 'bear_use_spike': True, 'bear_rsi_required': False, 'sideways_strategy': 'mean_reversion', 'sideways_bb_std_mult': 3.450229776231726, 'sideways_rsi_os': 33, 'sideways_rsi_ob': 72, 'sideways_adx_thresh': 12.315424637776209, 'sideways_atr_min_pct': 0.004452437711962888, 'sideways_atr_max_pct': 0.010101347345815378, 'sideways_tp_mult': 1.908324404415967, 'sideways_tsl_mult': 0.44371465246835506, 'sideways_time_stop': 182, 'sideways_use_sma': True, 'sideways_use_ema': False, 'sideways_use_atr': False, 'sideways_use_adx': False, 'sideways_use_spike': True, 'sideways_rsi_required': False}.
[I 2025-08-31 10:58:15,739] Trial 541 finished with values: [-0.04594467299717986, 0.046363895333005604] and parameters: {'p_sma': 51, 'p_std': 37, 'p_atr': 21, 'p_adx': 29, 'rsi_period': 14, 'ema1': 21, 'ema2': 57, 'slip_atr_k': 6.344929707037268e-05, 'slip_spread_k': 0.22519311574398768, 'spread_hl_frac': 0.02539066912239053, 'bb_std_mult': 1.985662495392625, 'rsi_os': 35, 'rsi_ob': 77, 'vol_spike': 0.23421515079569566, 'adx_thresh': 8.272125576393819, 'atr_min_pct': 0.018949733866605728, 'atr_max_pct': 0.04562705318438793, 'tp_mult': 2.7869389226332433, 'tsl_mult': 0.7314603608960527, 'strategy': 'mean_reversion', 'time_stop': 212, 'use_sma': False, 'use_atr': False, 'use_adx': False, 'use_ema': False, 'use_spike': False, 'rsi_required': False, 'edge_k': 0.44102269698622076, 'edge_cap': 0.173103883582115, 'bull_strategy': 'breakout', 'bull_bb_std_mult': 3.48942861958022, 'bull_rsi_os': 46, 'bull_rsi_ob': 62, 'bull_adx_thresh': 5.735652552141353, 'bull_atr_min_pct': 0.0031143211644438762, 'bull_atr_max_pct': 0.03829557204648781, 'bull_tp_mult': 2.831454259923655, 'bull_tsl_mult': 0.15944566248990724, 'bull_time_stop': 61, 'bull_use_sma': False, 'bull_use_ema': True, 'bull_use_atr': False, 'bull_use_adx': True, 'bull_use_spike': True, 'bull_rsi_required': False, 'bear_strategy': 'breakout', 'bear_bb_std_mult': 1.2957221756774753, 'bear_rsi_os': 10, 'bear_rsi_ob': 65, 'bear_adx_thresh': 14.71587776008786, 'bear_atr_min_pct': 8.71420423599039e-05, 'bear_atr_max_pct': 0.14269877172904188, 'bear_tp_mult': 1.842085408510514, 'bear_tsl_mult': 0.06633269819447135, 'bear_time_stop': 168, 'bear_use_sma': False, 'bear_use_ema': False, 'bear_use_atr': True, 'bear_use_adx': False, 'bear_use_spike': True, 'bear_rsi_required': False, 'sideways_strategy': 'mean_reversion', 'sideways_bb_std_mult': 2.2645281550703795, 'sideways_rsi_os': 12, 'sideways_rsi_ob': 73, 'sideways_adx_thresh': 12.247952794876088, 'sideways_atr_min_pct': 0.02259562888669749, 'sideways_atr_max_pct': 0.012103933308590574, 'sideways_tp_mult': 1.912508189650746, 'sideways_tsl_mult': 0.898814801671394, 'sideways_time_stop': 71, 'sideways_use_sma': True, 'sideways_use_ema': False, 'sideways_use_atr': False, 'sideways_use_adx': False, 'sideways_use_spike': True, 'sideways_rsi_required': False}.
