[I 2025-08-31 10:27:13,559] Trial 285 finished with values: [-1000000000.0, 1000000000.0] and parameters: {'p_sma': 21, 'p_std': 32, 'p_atr': 18, 'p_adx': 7, 'rsi_period': 27, 'ema1': 14, 'ema2': 23, 'slip_atr_k': 0.016648068062044483, 'slip_spread_k': 0.28613385405090724, 'spread_hl_frac': 0.03210103928943754, 'bb_std_mult': 2.410765851884808, 'rsi_os': 40, 'rsi_ob': 77, 'vol_spike': 0.24046089945794616, 'adx_thresh': 30.583562630335507, 'atr_min_pct': 0.019685034816296673, 'atr_max_pct': 0.06392121031961179, 'tp_mult': 2.3645789147490204, 'tsl_mult': 0.3652946222473785, 'strategy': 'mean_reversion', 'time_stop': 137, 'use_sma': False, 'use_atr': False, 'use_adx': False, 'use_ema': False, 'use_spike': True, 'rsi_required': True, 'edge_k': 1.7420570196361662, 'edge_cap': 0.17666658207671265, 'bull_strategy': 'breakout', 'bull_bb_std_mult': 2.6859023420601207, 'bull_rsi_os': 29, 'bull_rsi_ob': 75, 'bull_adx_thresh': 18.416398883028723, 'bull_atr_min_pct': 0.0042193558493171055, 'bull_atr_max_pct': 0.03134213876807959, 'bull_tp_mult': 2.290432920908357, 'bull_tsl_mult': 0.09684912831323086, 'bull_time_stop': 16, 'bull_use_sma': True, 'bull_use_ema': True, 'bull_use_atr': True, 'bull_use_adx': True, 'bull_use_spike': False, 'bull_rsi_required': False, 'bear_strategy': 'breakout', 'bear_bb_std_mult': 1.9797554545110216, 'bear_rsi_os': 28, 'bear_rsi_ob': 45, 'bear_adx_thresh': 29.6635124748731, 'bear_atr_min_pct': 0.017576041647371855, 'bear_atr_max_pct': 0.12536204742374943, 'bear_tp_mult': 2.21220995578584, 'bear_tsl_mult': 0.739108714385479, 'bear_time_stop': 270, 'bear_use_sma': False, 'bear_use_ema': False, 'bear_use_atr': True, 'bear_use_adx': False, 'bear_use_spike': True, 'bear_rsi_required': True, 'sideways_strategy': 'breakout', 'sideways_bb_std_mult': 3.149098529120148, 'sideways_rsi_os': 35, 'sideways_rsi_ob': 82, 'sideways_adx_thresh': 15.198299515182796, 'sideways_atr_min_pct': 0.005074389442968433, 'sideways_atr_max_pct': 0.10914676277231167, 'sideways_tp_mult': 2.1822448132134116, 'sideways_tsl_mult': 0.7822942370619339, 'sideways_time_stop': 270, 'sideways_use_sma': True, 'sideways_use_ema': False, 'sideways_use_atr': False, 'sideways_use_adx': False, 'sideways_use_spike': True, 'sideways_rsi_required': False}.
[I 2025-08-31 10:27:16,558] Trial 289 finished with values: [-1000000000.0, 1000000000.0] and parameters: {'p_sma': 21, 'p_std': 36, 'p_atr': 17, 'p_adx': 22, 'rsi_period': 39, 'ema1': 9, 'ema2': 19, 'slip_atr_k': 0.05425914469087054, 'slip_spread_k': 0.2862900425825516, 'spread_hl_frac': 0.026675299108430618, 'bb_std_mult': 2.4454017904561303, 'rsi_os': 42, 'rsi_ob': 73, 'vol_spike': 0.21184535002381943, 'adx_thresh': 8.318398807553057, 'atr_min_pct': 0.01809494536892997, 'atr_max_pct': 0.04615742784185065, 'tp_mult': 2.8104103353069365, 'tsl_mult': 0.38612157951295983, 'strategy': 'mean_reversion', 'time_stop': 89, 'use_sma': False, 'use_atr': False, 'use_adx': False, 'use_ema': False, 'use_spike': True, 'rsi_required': True, 'edge_k': 1.7395056146104144, 'edge_cap': 0.11541265913840312, 'bull_strategy': 'breakout', 'bull_bb_std_mult': 2.6976744210739265, 'bull_rsi_os': 15, 'bull_rsi_ob': 76, 'bull_adx_thresh': 11.713350786544112, 'bull_atr_min_pct': 0.004209315665202172, 'bull_atr_max_pct': 0.14145274231310984, 'bull_tp_mult': 1.1242787749903642, 'bull_tsl_mult': 0.09697870627243209, 'bull_time_stop': 21, 'bull_use_sma': True, 'bull_use_ema': True, 'bull_use_atr': True, 'bull_use_adx': True, 'bull_use_spike': False, 'bull_rsi_required': False, 'bear_strategy': 'breakout', 'bear_bb_std_mult': 1.9966667317362456, 'bear_rsi_os': 28, 'bear_rsi_ob': 77, 'bear_adx_thresh': 9.019503551840424, 'bear_atr_min_pct': 0.017492862531124743, 'bear_atr_max_pct': 0.0701184541045738, 'bear_tp_mult': 2.630887048813969, 'bear_tsl_mult': 0.51562554640213, 'bear_time_stop': 23, 'bear_use_sma': False, 'bear_use_ema': True, 'bear_use_atr': True, 'bear_use_adx': False, 'bear_use_spike': True, 'bear_rsi_required': True, 'sideways_strategy': 'breakout', 'sideways_bb_std_mult': 2.4987065163494178, 'sideways_rsi_os': 34, 'sideways_rsi_ob': 85, 'sideways_adx_thresh': 15.117957838509902, 'sideways_atr_min_pct': 0.02129085986742366, 'sideways_atr_max_pct': 0.14681961293762413, 'sideways_tp_mult': 1.1413445924613062, 'sideways_tsl_mult': 0.7773486981547443, 'sideways_time_stop': 105, 'sideways_use_sma': False, 'sideways_use_ema': False, 'sideways_use_atr': False, 'sideways_use_adx': False, 'sideways_use_spike': True, 'sideways_rsi_required': False}.
[I 2025-08-31 10:27:16,859] Trial 290 finished with values: [-1000000000.0, 1000000000.0] and parameters: {'p_sma': 55, 'p_std': 49, 'p_atr': 18, 'p_adx': 7, 'rsi_period': 38, 'ema1': 8, 'ema2': 19, 'slip_atr_k': 0.05382560397469311, 'slip_spread_k': 0.32215530914913126, 'spread_hl_frac': 0.026524932979556798, 'bb_std_mult': 1.5577926779029772, 'rsi_os': 40, 'rsi_ob': 72, 'vol_spike': 0.044472902008587015, 'adx_thresh': 8.858835507395778, 'atr_min_pct': 0.017797042528026698, 'atr_max_pct': 0.04611560001537062, 'tp_mult': 2.801004281493963, 'tsl_mult': 0.4549315380245536, 'strategy': 'mean_reversion', 'time_stop': 136, 'use_sma': False, 'use_atr': True, 'use_adx': True, 'use_ema': True, 'use_spike': True, 'rsi_required': True, 'edge_k': 0.9908594904996574, 'edge_cap': 0.11946290340754383, 'bull_strategy': 'breakout', 'bull_bb_std_mult': 2.6849986167006357, 'bull_rsi_os': 26, 'bull_rsi_ob': 57, 'bull_adx_thresh': 28.101403219326393, 'bull_atr_min_pct': 0.020145863249793956, 'bull_atr_max_pct': 0.07501362184067285, 'bull_tp_mult': 1.0954169526615893, 'bull_tsl_mult': 0.1139803429155551, 'bull_time_stop': 153, 'bull_use_sma': False, 'bull_use_ema': True, 'bull_use_atr': True, 'bull_use_adx': True, 'bull_use_spike': True, 'bull_rsi_required': False, 'bear_strategy': 'breakout', 'bear_bb_std_mult': 3.001660429540194, 'bear_rsi_os': 28, 'bear_rsi_ob': 56, 'bear_adx_thresh': 25.744277686176602, 'bear_atr_min_pct': 0.016247363801565735, 'bear_atr_max_pct': 0.11965334891935829, 'bear_tp_mult': 2.5242848499497157, 'bear_tsl_mult': 0.1230708158505904, 'bear_time_stop': 22, 'bear_use_sma': False, 'bear_use_ema': False, 'bear_use_atr': True, 'bear_use_adx': False, 'bear_use_spike': False, 'bear_rsi_required': True, 'sideways_strategy': 'breakout', 'sideways_bb_std_mult': 2.1580358663692114, 'sideways_rsi_os': 50, 'sideways_rsi_ob': 84, 'sideways_adx_thresh': 13.444138841877576, 'sideways_atr_min_pct': 7.844649974608764e-07, 'sideways_atr_max_pct': 0.13744948037025662, 'sideways_tp_mult': 1.1311861245131218, 'sideways_tsl_mult': 0.7751772157690047, 'sideways_time_stop': 269, 'sideways_use_sma': True, 'sideways_use_ema': False, 'sideways_use_atr': True, 'sideways_use_adx': False, 'sideways_use_spike': True, 'sideways_rsi_required': False}.
[I 2025-08-31 10:27:47,865] Trial 292 finished with values: [-0.01224417533007105, 0.014311722585803825] and parameters: {'p_sma': 44, 'p_std': 58, 'p_atr': 16, 'p_adx': 9, 'rsi_period': 38, 'ema1': 30, 'ema2': 60, 'slip_atr_k': 0.056018372196022556, 'slip_spread_k': 0.32571817806687375, 'spread_hl_frac': 0.028939506974358393, 'bb_std_mult': 2.322357997779926, 'rsi_os': 42, 'rsi_ob': 72, 'vol_spike': 0.04547451134391646, 'adx_thresh': 8.65671784987964, 'atr_min_pct': 0.013997672709417971, 'atr_max_pct': 0.12158090515656389, 'tp_mult': 2.8060991182323227, 'tsl_mult': 0.7688345248159528, 'strategy': 'mean_reversion', 'time_stop': 152, 'use_sma': False, 'use_atr': True, 'use_adx': True, 'use_ema': True, 'use_spike': True, 'rsi_required': True, 'edge_k': 0.9981377594601771, 'edge_cap': 0.11862049843598987, 'bull_strategy': 'breakout', 'bull_bb_std_mult': 1.062971805274321, 'bull_rsi_os': 44, 'bull_rsi_ob': 69, 'bull_adx_thresh': 10.801556656602505, 'bull_atr_min_pct': 0.018436536418662927, 'bull_atr_max_pct': 0.07335716837276911, 'bull_tp_mult': 1.3147669672387292, 'bull_tsl_mult': 0.27696041715295494, 'bull_time_stop': 124, 'bull_use_sma': False, 'bull_use_ema': True, 'bull_use_atr': True, 'bull_use_adx': False, 'bull_use_spike': True, 'bull_rsi_required': False, 'bear_strategy': 'mean_reversion', 'bear_bb_std_mult': 2.071486295239294, 'bear_rsi_os': 32, 'bear_rsi_ob': 71, 'bear_adx_thresh': 26.174057345736323, 'bear_atr_min_pct': 0.0024828415697769265, 'bear_atr_max_pct': 0.08495508587321388, 'bear_tp_mult': 2.8704815283068505, 'bear_tsl_mult': 0.12465753329273455, 'bear_time_stop': 30, 'bear_use_sma': True, 'bear_use_ema': False, 'bear_use_atr': False, 'bear_use_adx': False, 'bear_use_spike': False, 'bear_rsi_required': False, 'sideways_strategy': 'breakout', 'sideways_bb_std_mult': 2.8915068194612688, 'sideways_rsi_os': 34, 'sideways_rsi_ob': 85, 'sideways_adx_thresh': 13.497670012961617, 'sideways_atr_min_pct': 0.021529612604701456, 'sideways_atr_max_pct': 0.012818382364096376, 'sideways_tp_mult': 1.282017650697082, 'sideways_tsl_mult': 0.8282924768377355, 'sideways_time_stop': 104, 'sideways_use_sma': False, 'sideways_use_ema': False, 'sideways_use_atr': True, 'sideways_use_adx': True, 'sideways_use_spike': True, 'sideways_rsi_required': False}.
[I 2025-08-31 10:27:48,666] Trial 291 finished with values: [-1000000000.0, 1000000000.0] and parameters: {'p_sma': 44, 'p_std': 35, 'p_atr': 18, 'p_adx': 20, 'rsi_period': 38, 'ema1': 9, 'ema2': 19, 'slip_atr_k': 0.06635421825387604, 'slip_spread_k': 0.32554421312416426, 'spread_hl_frac': 0.02907138747467804, 'bb_std_mult': 2.3096845068899636, 'rsi_os': 40, 'rsi_ob': 73, 'vol_spike': 0.23954958005344043, 'adx_thresh': 8.815255619349688, 'atr_min_pct': 0.018216072845040746, 'atr_max_pct': 0.04672439730776918, 'tp_mult': 2.9103531344805678, 'tsl_mult': 0.9514854218911847, 'strategy': 'mean_reversion', 'time_stop': 135, 'use_sma': False, 'use_atr': True, 'use_adx': True, 'use_ema': True, 'use_spike': True, 'rsi_required': True, 'edge_k': 1.7301084590260531, 'edge_cap': 0.13165962882535798, 'bull_strategy': 'breakout', 'bull_bb_std_mult': 1.1862767616122152, 'bull_rsi_os': 27, 'bull_rsi_ob': 57, 'bull_adx_thresh': 10.82900385573645, 'bull_atr_min_pct': 0.02514677801008517, 'bull_atr_max_pct': 0.14518429784638903, 'bull_tp_mult': 1.0978657411387391, 'bull_tsl_mult': 0.24843304542808642, 'bull_time_stop': 13, 'bull_use_sma': False, 'bull_use_ema': True, 'bull_use_atr': True, 'bull_use_adx': False, 'bull_use_spike': True, 'bull_rsi_required': False, 'bear_strategy': 'breakout', 'bear_bb_std_mult': 3.0640562544704144, 'bear_rsi_os': 30, 'bear_rsi_ob': 71, 'bear_adx_thresh': 8.140217501640207, 'bear_atr_min_pct': 0.016132058349313333, 'bear_atr_max_pct': 0.12406510460704225, 'bear_tp_mult': 2.2299212593898994, 'bear_tsl_mult': 0.12238763475471592, 'bear_time_stop': 32, 'bear_use_sma': True, 'bear_use_ema': False, 'bear_use_atr': False, 'bear_use_adx': False, 'bear_use_spike': False, 'bear_rsi_required': False, 'sideways_strategy': 'breakout', 'sideways_bb_std_mult': 2.7601028342689675, 'sideways_rsi_os': 34, 'sideways_rsi_ob': 85, 'sideways_adx_thresh': 12.714850918602874, 'sideways_atr_min_pct': 0.001987791622463723, 'sideways_atr_max_pct': 0.010370775245938822, 'sideways_tp_mult': 1.3850421643037485, 'sideways_tsl_mult': 0.7894723627397245, 'sideways_time_stop': 248, 'sideways_use_sma': False, 'sideways_use_ema': False, 'sideways_use_atr': True, 'sideways_use_adx': True, 'sideways_use_spike': True, 'sideways_rsi_required': False}.
[I 2025-08-31 10:27:48,816] Trial 293 finished with values: [-0.014013123908431568, 0.01701696522718998] and parameters: {'p_sma': 55, 'p_std': 58, 'p_atr': 16, 'p_adx': 18, 'rsi_period': 50, 'ema1': 12, 'ema2': 28, 'slip_atr_k': 0.038183908923596466, 'slip_spread_k': 0.3216537804214458, 'spread_hl_frac': 0.029055782506224762, 'bb_std_mult': 2.644113153473384, 'rsi_os': 37, 'rsi_ob': 95, 'vol_spike': 0.17655284718873493, 'adx_thresh': 8.964831236172047, 'atr_min_pct': 0.020292722626097145, 'atr_max_pct': 0.030582270801488433, 'tp_mult': 1.3891152078672284, 'tsl_mult': 0.9873659107587446, 'strategy': 'mean_reversion', 'time_stop': 165, 'use_sma': False, 'use_atr': True, 'use_adx': True, 'use_ema': True, 'use_spike': True, 'rsi_required': False, 'edge_k': 0.9938502191292777, 'edge_cap': 0.09395622400624509, 'bull_strategy': 'breakout', 'bull_bb_std_mult': 1.0694894696301047, 'bull_rsi_os': 43, 'bull_rsi_ob': 48, 'bull_adx_thresh': 20.751325205261722, 'bull_atr_min_pct': 0.0036035902620213836, 'bull_atr_max_pct': 0.05807634857129988, 'bull_tp_mult': 1.1732890155251088, 'bull_tsl_mult': 0.357011349365957, 'bull_time_stop': 125, 'bull_use_sma': False, 'bull_use_ema': True, 'bull_use_atr': False, 'bull_use_adx': False, 'bull_use_spike': True, 'bull_rsi_required': False, 'bear_strategy': 'mean_reversion', 'bear_bb_std_mult': 2.0719527031382126, 'bear_rsi_os': 32, 'bear_rsi_ob': 65, 'bear_adx_thresh': 13.807315930250194, 'bear_atr_min_pct': 0.0024515347727296372, 'bear_atr_max_pct': 0.11912030472461993, 'bear_tp_mult': 1.812228122585362, 'bear_tsl_mult': 0.1265441243309629, 'bear_time_stop': 30, 'bear_use_sma': True, 'bear_use_ema': False, 'bear_use_atr': False, 'bear_use_adx': True, 'bear_use_spike': False, 'bear_rsi_required': False, 'sideways_strategy': 'mean_reversion', 'sideways_bb_std_mult': 2.1710896782336624, 'sideways_rsi_os': 31, 'sideways_rsi_ob': 73, 'sideways_adx_thresh': 14.490287835586352, 'sideways_atr_min_pct': 0.00732650267420276, 'sideways_atr_max_pct': 0.013361106229773812, 'sideways_tp_mult': 2.689715908420148, 'sideways_tsl_mult': 0.8216164407724397, 'sideways_time_stop': 247, 'sideways_use_sma': True, 'sideways_use_ema': False, 'sideways_use_atr': True, 'sideways_use_adx': True, 'sideways_use_spike': True, 'sideways_rsi_required': False}.
[I 2025-08-31 10:27:48,944] Trial 294 finished with values: [-0.016641558430424475, 0.017001648689085866] and parameters: {'p_sma': 19, 'p_std': 35, 'p_atr': 16, 'p_adx': 18, 'rsi_period': 20, 'ema1': 12, 'ema2': 28, 'slip_atr_k': 0.0668832914486883, 'slip_spread_k': 0.2195545568804958, 'spread_hl_frac': 0.028476804104341395, 'bb_std_mult': 2.8030392087490834, 'rsi_os': 37, 'rsi_ob': 95, 'vol_spike': 0.20416795598648474, 'adx_thresh': 17.148914684247078, 'atr_min_pct': 0.018564158938386966, 'atr_max_pct': 0.031263077959497204, 'tp_mult': 2.9129567987968152, 'tsl_mult': 0.7912870769165206, 'strategy': 'mean_reversion', 'time_stop': 21, 'use_sma': False, 'use_atr': True, 'use_adx': True, 'use_ema': True, 'use_spike': True, 'rsi_required': False, 'edge_k': 1.661015601949, 'edge_cap': 0.12781587736952896, 'bull_strategy': 'breakout', 'bull_bb_std_mult': 1.868193645577223, 'bull_rsi_os': 45, 'bull_rsi_ob': 55, 'bull_adx_thresh': 10.75279162133738, 'bull_atr_min_pct': 0.021073394617833256, 'bull_atr_max_pct': 0.05945277489062091, 'bull_tp_mult': 1.1562082945830812, 'bull_tsl_mult': 0.27896555870177864, 'bull_time_stop': 268, 'bull_use_sma': False, 'bull_use_ema': True, 'bull_use_atr': False, 'bull_use_adx': False, 'bull_use_spike': True, 'bull_rsi_required': False, 'bear_strategy': 'mean_reversion', 'bear_bb_std_mult': 2.892362652402908, 'bear_rsi_os': 32, 'bear_rsi_ob': 60, 'bear_adx_thresh': 12.88093294612616, 'bear_atr_min_pct': 0.0026500421547649075, 'bear_atr_max_pct': 0.10990325692432787, 'bear_tp_mult': 2.560367168826941, 'bear_tsl_mult': 0.9680729831652581, 'bear_time_stop': 31, 'bear_use_sma': True, 'bear_use_ema': False, 'bear_use_atr': False, 'bear_use_adx': True, 'bear_use_spike': False, 'bear_rsi_required': False, 'sideways_strategy': 'mean_reversion', 'sideways_bb_std_mult': 2.7200925956206783, 'sideways_rsi_os': 38, 'sideways_rsi_ob': 86, 'sideways_adx_thresh': 14.299207796126314, 'sideways_atr_min_pct': 0.007330074498789928, 'sideways_atr_max_pct': 0.012728206271302528, 'sideways_tp_mult': 1.3786870444427948, 'sideways_tsl_mult': 0.8290609778784884, 'sideways_time_stop': 217, 'sideways_use_sma': True, 'sideways_use_ema': False, 'sideways_use_atr': True, 'sideways_use_adx': True, 'sideways_use_spike': True, 'sideways_rsi_required': False}.
[I 2025-08-31 10:27:49,421] Trial 295 finished with values: [-1000000000.0, 1000000000.0] and parameters: {'p_sma': 41, 'p_std': 15, 'p_atr': 21, 'p_adx': 20, 'rsi_period': 32, 'ema1': 12, 'ema2': 60, 'slip_atr_k': 0.0692002685363441, 'slip_spread_k': 0.19617024970906835, 'spread_hl_frac': 0.02877849299371064, 'bb_std_mult': 2.8143113990371207, 'rsi_os': 38, 'rsi_ob': 75, 'vol_spike': 0.2030188137038852, 'adx_thresh': 9.17263567447044, 'atr_min_pct': 0.018528171243301823, 'atr_max_pct': 0.012471461229087141, 'tp_mult': 2.876028383962936, 'tsl_mult': 0.09691459608847036, 'strategy': 'mean_reversion', 'time_stop': 70, 'use_sma': False, 'use_atr': False, 'use_adx': True, 'use_ema': False, 'use_spike': True, 'rsi_required': False, 'edge_k': 1.6785963105076012, 'edge_cap': 0.7000648493151295, 'bull_strategy': 'breakout', 'bull_bb_std_mult': 1.8601333718206183, 'bull_rsi_os': 43, 'bull_rsi_ob': 55, 'bull_adx_thresh': 20.6753758572648, 'bull_atr_min_pct': 0.00280330538096291, 'bull_atr_max_pct': 0.07007307105709927, 'bull_tp_mult': 1.1696072197862086, 'bull_tsl_mult': 0.23542410626655375, 'bull_time_stop': 85, 'bull_use_sma': True, 'bull_use_ema': True, 'bull_use_atr': False, 'bull_use_adx': False, 'bull_use_spike': True, 'bull_rsi_required': False, 'bear_strategy': 'mean_reversion', 'bear_bb_std_mult': 2.1841571234723847, 'bear_rsi_os': 30, 'bear_rsi_ob': 58, 'bear_adx_thresh': 7.909622981816525, 'bear_atr_min_pct': 0.01627364037709628, 'bear_atr_max_pct': 0.12898507146007493, 'bear_tp_mult': 2.817737164357416, 'bear_tsl_mult': 0.20828907541034325, 'bear_time_stop': 298, 'bear_use_sma': True, 'bear_use_ema': False, 'bear_use_atr': False, 'bear_use_adx': True, 'bear_use_spike': True, 'bear_rsi_required': False, 'sideways_strategy': 'mean_reversion', 'sideways_bb_std_mult': 2.739399562890417, 'sideways_rsi_os': 31, 'sideways_rsi_ob': 83, 'sideways_adx_thresh': 14.237515913995187, 'sideways_atr_min_pct': 0.001934476504273839, 'sideways_atr_max_pct': 0.01001392792700913, 'sideways_tp_mult': 1.3950349085692366, 'sideways_tsl_mult': 0.8413946004740482, 'sideways_time_stop': 55, 'sideways_use_sma': True, 'sideways_use_ema': False, 'sideways_use_atr': False, 'sideways_use_adx': True, 'sideways_use_spike': True, 'sideways_rsi_required': False}.
[I 2025-08-31 10:28:20,077] Trial 297 finished with values: [-0.0051054808655146555, 0.005180119943709113] and parameters: {'p_sma': 19, 'p_std': 37, 'p_atr': 17, 'p_adx': 9, 'rsi_period': 42, 'ema1': 13, 'ema2': 57, 'slip_atr_k': 0.07098109879285316, 'slip_spread_k': 0.08894903815205196, 'spread_hl_frac': 0.048661192420908765, 'bb_std_mult': 2.7577256340099328, 'rsi_os': 14, 'rsi_ob': 75, 'vol_spike': 0.22948152765315386, 'adx_thresh': 7.7960825359528325, 'atr_min_pct': 0.018564823681815393, 'atr_max_pct': 0.054380982738628375, 'tp_mult': 1.2098491020619382, 'tsl_mult': 0.7848245636245031, 'strategy': 'mean_reversion', 'time_stop': 128, 'use_sma': False, 'use_atr': False, 'use_adx': True, 'use_ema': False, 'use_spike': True, 'rsi_required': False, 'edge_k': 1.6196182892569124, 'edge_cap': 0.14461061380874413, 'bull_strategy': 'breakout', 'bull_bb_std_mult': 0.9475105196763104, 'bull_rsi_os': 49, 'bull_rsi_ob': 55, 'bull_adx_thresh': 10.201225016507266, 'bull_atr_min_pct': 0.021128422512746773, 'bull_atr_max_pct': 0.07054444362349435, 'bull_tp_mult': 1.1731870644468623, 'bull_tsl_mult': 0.05089268894187213, 'bull_time_stop': 288, 'bull_use_sma': True, 'bull_use_ema': True, 'bull_use_atr': False, 'bull_use_adx': True, 'bull_use_spike': True, 'bull_rsi_required': False, 'bear_strategy': 'breakout', 'bear_bb_std_mult': 2.1831957774681165, 'bear_rsi_os': 30, 'bear_rsi_ob': 83, 'bear_adx_thresh': 5.078899963023606, 'bear_atr_min_pct': 0.01696892144413824, 'bear_atr_max_pct': 0.10474037094991041, 'bear_tp_mult': 2.9690944351509456, 'bear_tsl_mult': 0.9593722195617636, 'bear_time_stop': 52, 'bear_use_sma': False, 'bear_use_ema': False, 'bear_use_atr': True, 'bear_use_adx': True, 'bear_use_spike': True, 'bear_rsi_required': True, 'sideways_strategy': 'mean_reversion', 'sideways_bb_std_mult': 2.621048357827399, 'sideways_rsi_os': 32, 'sideways_rsi_ob': 90, 'sideways_adx_thresh': 18.902614627215964, 'sideways_atr_min_pct': 0.002400199809922806, 'sideways_atr_max_pct': 0.01486865159774367, 'sideways_tp_mult': 1.5067381685085317, 'sideways_tsl_mult': 0.8024791558293557, 'sideways_time_stop': 54, 'sideways_use_sma': True, 'sideways_use_ema': False, 'sideways_use_atr': False, 'sideways_use_adx': False, 'sideways_use_spike': True, 'sideways_rsi_required': False}.
