[I 2025-08-31 11:35:55,244] Trial 810 finished with values: [-1000000000.0, 1000000000.0] and parameters: {'p_sma': 51, 'p_std': 22, 'p_atr': 28, 'p_adx': 15, 'rsi_period': 36, 'ema1': 7, 'ema2': 17, 'slip_atr_k': 0.01759464706884396, 'slip_spread_k': 0.529525559360092, 'spread_hl_frac': 0.02393457106071739, 'bb_std_mult': 0.6611134027300676, 'rsi_os': 12, 'rsi_ob': 80, 'vol_spike': 0.00022915684980379103, 'adx_thresh': 11.455698205778642, 'atr_min_pct': 0.022453273557829275, 'atr_max_pct': 0.05271793858437286, 'tp_mult': 2.860643075027357, 'tsl_mult': 0.12665722589157427, 'strategy': 'breakout', 'time_stop': 270, 'use_sma': True, 'use_atr': True, 'use_adx': True, 'use_ema': True, 'use_spike': True, 'rsi_required': True, 'edge_k': 0.09809294906306831, 'edge_cap': 0.5353232232387098, 'bull_strategy': 'mean_reversion', 'bull_bb_std_mult': 2.3584604355447594, 'bull_rsi_os': 40, 'bull_rsi_ob': 57, 'bull_adx_thresh': 25.624061825026168, 'bull_atr_min_pct': 0.022770208333482936, 'bull_atr_max_pct': 0.02611998159805431, 'bull_tp_mult': 1.4986724450349294, 'bull_tsl_mult': 0.23039433149695654, 'bull_time_stop': 50, 'bull_use_sma': True, 'bull_use_ema': False, 'bull_use_atr': False, 'bull_use_adx': True, 'bull_use_spike': False, 'bull_rsi_required': False, 'bear_strategy': 'mean_reversion', 'bear_bb_std_mult': 1.6155228019709869, 'bear_rsi_os': 52, 'bear_rsi_ob': 55, 'bear_adx_thresh': 8.867271401580805, 'bear_atr_min_pct': 0.018742813139370967, 'bear_atr_max_pct': 0.13098889353774423, 'bear_tp_mult': 2.697940896209066, 'bear_tsl_mult': 0.416316739018343, 'bear_time_stop': 119, 'bear_use_sma': True, 'bear_use_ema': False, 'bear_use_atr': True, 'bear_use_adx': False, 'bear_use_spike': True, 'bear_rsi_required': False, 'sideways_strategy': 'breakout', 'sideways_bb_std_mult': 0.9215678108988248, 'sideways_rsi_os': 39, 'sideways_rsi_ob': 64, 'sideways_adx_thresh': 21.629742167628656, 'sideways_atr_min_pct': 0.005079580962273303, 'sideways_atr_max_pct': 0.10857376908095676, 'sideways_tp_mult': 1.6180100272557623, 'sideways_tsl_mult': 0.6725240005804586, 'sideways_time_stop': 166, 'sideways_use_sma': False, 'sideways_use_ema': True, 'sideways_use_atr': True, 'sideways_use_adx': True, 'sideways_use_spike': True, 'sideways_rsi_required': False}.
[I 2025-08-31 11:35:55,566] Trial 809 finished with values: [-1000000000.0, 1000000000.0] and parameters: {'p_sma': 30, 'p_std': 16, 'p_atr': 29, 'p_adx': 21, 'rsi_period': 64, 'ema1': 9, 'ema2': 18, 'slip_atr_k': 0.012781087987854458, 'slip_spread_k': 0.05411941876674692, 'spread_hl_frac': 0.02406781856595582, 'bb_std_mult': 0.7386117347720125, 'rsi_os': 35, 'rsi_ob': 49, 'vol_spike': 0.14872860436889562, 'adx_thresh': 11.56603579602854, 'atr_min_pct': 0.02055495891266883, 'atr_max_pct': 0.05829162796783681, 'tp_mult': 2.888517955351946, 'tsl_mult': 0.11951616763115967, 'strategy': 'breakout', 'time_stop': 84, 'use_sma': True, 'use_atr': True, 'use_adx': True, 'use_ema': True, 'use_spike': False, 'rsi_required': True, 'edge_k': 1.453134174938302, 'edge_cap': 0.7052118453914882, 'bull_strategy': 'mean_reversion', 'bull_bb_std_mult': 1.8398877735797265, 'bull_rsi_os': 39, 'bull_rsi_ob': 61, 'bull_adx_thresh': 22.7799990274547, 'bull_atr_min_pct': 0.022774771850500225, 'bull_atr_max_pct': 0.03188450056514847, 'bull_tp_mult': 2.321538638820562, 'bull_tsl_mult': 0.5648267718667469, 'bull_time_stop': 41, 'bull_use_sma': False, 'bull_use_ema': True, 'bull_use_atr': False, 'bull_use_adx': True, 'bull_use_spike': False, 'bull_rsi_required': False, 'bear_strategy': 'mean_reversion', 'bear_bb_std_mult': 1.6159310215837346, 'bear_rsi_os': 55, 'bear_rsi_ob': 55, 'bear_adx_thresh': 21.58121200695434, 'bear_atr_min_pct': 0.00910142445160125, 'bear_atr_max_pct': 0.13207241366069183, 'bear_tp_mult': 2.7545780775603594, 'bear_tsl_mult': 0.8810955013560906, 'bear_time_stop': 98, 'bear_use_sma': True, 'bear_use_ema': False, 'bear_use_atr': True, 'bear_use_adx': False, 'bear_use_spike': True, 'bear_rsi_required': False, 'sideways_strategy': 'breakout', 'sideways_bb_std_mult': 1.0522435345166468, 'sideways_rsi_os': 39, 'sideways_rsi_ob': 88, 'sideways_adx_thresh': 25.66941975089281, 'sideways_atr_min_pct': 0.021802588335733487, 'sideways_atr_max_pct': 0.1399846711382127, 'sideways_tp_mult': 1.0381174607102137, 'sideways_tsl_mult': 0.8664504845584832, 'sideways_time_stop': 189, 'sideways_use_sma': False, 'sideways_use_ema': True, 'sideways_use_atr': True, 'sideways_use_adx': True, 'sideways_use_spike': True, 'sideways_rsi_required': False}.
[I 2025-08-31 11:35:55,777] Trial 811 finished with values: [-1000000000.0, 1000000000.0] and parameters: {'p_sma': 30, 'p_std': 11, 'p_atr': 28, 'p_adx': 14, 'rsi_period': 69, 'ema1': 29, 'ema2': 18, 'slip_atr_k': 0.1532155568934799, 'slip_spread_k': 0.528052214927084, 'spread_hl_frac': 0.02416971494431755, 'bb_std_mult': 0.6460432596333467, 'rsi_os': 48, 'rsi_ob': 56, 'vol_spike': 0.0626814597208356, 'adx_thresh': 11.184689414387464, 'atr_min_pct': 0.007497142680669287, 'atr_max_pct': 0.12432806546295908, 'tp_mult': 2.862452972001945, 'tsl_mult': 0.8871143440871954, 'strategy': 'breakout', 'time_stop': 193, 'use_sma': True, 'use_atr': True, 'use_adx': True, 'use_ema': True, 'use_spike': True, 'rsi_required': True, 'edge_k': 0.4191982033953664, 'edge_cap': 0.703967592338171, 'bull_strategy': 'mean_reversion', 'bull_bb_std_mult': 2.95531039564648, 'bull_rsi_os': 39, 'bull_rsi_ob': 62, 'bull_adx_thresh': 31.21191921515052, 'bull_atr_min_pct': 0.012262589326135566, 'bull_atr_max_pct': 0.027120039207782456, 'bull_tp_mult': 2.999114260447748, 'bull_tsl_mult': 0.8912110929841355, 'bull_time_stop': 96, 'bull_use_sma': True, 'bull_use_ema': False, 'bull_use_atr': False, 'bull_use_adx': True, 'bull_use_spike': False, 'bull_rsi_required': False, 'bear_strategy': 'mean_reversion', 'bear_bb_std_mult': 3.0725608218474907, 'bear_rsi_os': 55, 'bear_rsi_ob': 55, 'bear_adx_thresh': 31.055579091153483, 'bear_atr_min_pct': 0.015030301710270406, 'bear_atr_max_pct': 0.13147180184796162, 'bear_tp_mult': 1.3086903823476579, 'bear_tsl_mult': 0.8811377881630412, 'bear_time_stop': 105, 'bear_use_sma': True, 'bear_use_ema': False, 'bear_use_atr': True, 'bear_use_adx': False, 'bear_use_spike': True, 'bear_rsi_required': False, 'sideways_strategy': 'breakout', 'sideways_bb_std_mult': 1.0504815353549692, 'sideways_rsi_os': 38, 'sideways_rsi_ob': 88, 'sideways_adx_thresh': 10.186285984849647, 'sideways_atr_min_pct': 0.021723302837220536, 'sideways_atr_max_pct': 0.11028269361998533, 'sideways_tp_mult': 1.0420890700349554, 'sideways_tsl_mult': 0.8865755679968148, 'sideways_time_stop': 188, 'sideways_use_sma': False, 'sideways_use_ema': True, 'sideways_use_atr': True, 'sideways_use_adx': True, 'sideways_use_spike': True, 'sideways_rsi_required': False}.
[I 2025-08-31 11:36:31,208] Trial 813 finished with values: [-1000000000.0, 1000000000.0] and parameters: {'p_sma': 27, 'p_std': 13, 'p_atr': 28, 'p_adx': 21, 'rsi_period': 61, 'ema1': 6, 'ema2': 17, 'slip_atr_k': 0.013771881574317822, 'slip_spread_k': 0.05203357477877296, 'spread_hl_frac': 0.008001690884837803, 'bb_std_mult': 3.1172757746253446, 'rsi_os': 35, 'rsi_ob': 80, 'vol_spike': 0.11822627432677163, 'adx_thresh': 11.423295542428168, 'atr_min_pct': 0.013031836679232682, 'atr_max_pct': 0.06002964985861972, 'tp_mult': 2.551837271306646, 'tsl_mult': 0.07686577444226783, 'strategy': 'breakout', 'time_stop': 87, 'use_sma': True, 'use_atr': True, 'use_adx': True, 'use_ema': True, 'use_spike': False, 'rsi_required': True, 'edge_k': 1.1449628671124996, 'edge_cap': 0.7386337014201085, 'bull_strategy': 'mean_reversion', 'bull_bb_std_mult': 2.054173506096186, 'bull_rsi_os': 42, 'bull_rsi_ob': 61, 'bull_adx_thresh': 31.35173022252211, 'bull_atr_min_pct': 0.0280700987731584, 'bull_atr_max_pct': 0.032200260999694634, 'bull_tp_mult': 2.9995981260808975, 'bull_tsl_mult': 0.2690131105606771, 'bull_time_stop': 53, 'bull_use_sma': False, 'bull_use_ema': True, 'bull_use_atr': False, 'bull_use_adx': True, 'bull_use_spike': False, 'bull_rsi_required': False, 'bear_strategy': 'mean_reversion', 'bear_bb_std_mult': 3.238685944291242, 'bear_rsi_os': 50, 'bear_rsi_ob': 64, 'bear_adx_thresh': 8.88422601813849, 'bear_atr_min_pct': 0.011554205610859031, 'bear_atr_max_pct': 0.13189035078342282, 'bear_tp_mult': 2.7432907226945513, 'bear_tsl_mult': 0.8776659210258728, 'bear_time_stop': 105, 'bear_use_sma': True, 'bear_use_ema': False, 'bear_use_atr': True, 'bear_use_adx': False, 'bear_use_spike': True, 'bear_rsi_required': False, 'sideways_strategy': 'breakout', 'sideways_bb_std_mult': 2.1976991993928334, 'sideways_rsi_os': 41, 'sideways_rsi_ob': 64, 'sideways_adx_thresh': 26.609931216690683, 'sideways_atr_min_pct': 0.004119832715895964, 'sideways_atr_max_pct': 0.10095983954634262, 'sideways_tp_mult': 2.946181649973992, 'sideways_tsl_mult': 0.8671629313001912, 'sideways_time_stop': 186, 'sideways_use_sma': False, 'sideways_use_ema': True, 'sideways_use_atr': False, 'sideways_use_adx': True, 'sideways_use_spike': True, 'sideways_rsi_required': False}.
[I 2025-08-31 11:36:31,543] Trial 815 finished with values: [-1000000000.0, 1000000000.0] and parameters: {'p_sma': 37, 'p_std': 60, 'p_atr': 27, 'p_adx': 22, 'rsi_period': 61, 'ema1': 10, 'ema2': 34, 'slip_atr_k': 0.022773070387956867, 'slip_spread_k': 0.4454052389001023, 'spread_hl_frac': 0.02188884446836589, 'bb_std_mult': 0.5738007774360547, 'rsi_os': 29, 'rsi_ob': 53, 'vol_spike': 0.11747903808040286, 'adx_thresh': 10.778772381897873, 'atr_min_pct': 0.021580341816589153, 'atr_max_pct': 0.0703695466564941, 'tp_mult': 1.5570159175034535, 'tsl_mult': 0.042570814162405386, 'strategy': 'breakout', 'time_stop': 98, 'use_sma': True, 'use_atr': True, 'use_adx': False, 'use_ema': True, 'use_spike': False, 'rsi_required': False, 'edge_k': 1.5534374726488367, 'edge_cap': 0.39700499592456673, 'bull_strategy': 'mean_reversion', 'bull_bb_std_mult': 3.2987960239840604, 'bull_rsi_os': 42, 'bull_rsi_ob': 63, 'bull_adx_thresh': 26.824510850038937, 'bull_atr_min_pct': 0.012665896631074756, 'bull_atr_max_pct': 0.04318125362500122, 'bull_tp_mult': 2.5541812931129284, 'bull_tsl_mult': 0.268194684494281, 'bull_time_stop': 57, 'bull_use_sma': False, 'bull_use_ema': True, 'bull_use_atr': False, 'bull_use_adx': True, 'bull_use_spike': False, 'bull_rsi_required': False, 'bear_strategy': 'mean_reversion', 'bear_bb_std_mult': 3.4005973241293077, 'bear_rsi_os': 37, 'bear_rsi_ob': 52, 'bear_adx_thresh': 34.59306515325683, 'bear_atr_min_pct': 0.014680383160152667, 'bear_atr_max_pct': 0.030985003734739017, 'bear_tp_mult': 2.6713780605200816, 'bear_tsl_mult': 0.9072812083301411, 'bear_time_stop': 190, 'bear_use_sma': False, 'bear_use_ema': False, 'bear_use_atr': True, 'bear_use_adx': False, 'bear_use_spike': True, 'bear_rsi_required': False, 'sideways_strategy': 'mean_reversion', 'sideways_bb_std_mult': 3.027516460097239, 'sideways_rsi_os': 12, 'sideways_rsi_ob': 61, 'sideways_adx_thresh': 5.641065816506485, 'sideways_atr_min_pct': 0.003890003070876903, 'sideways_atr_max_pct': 0.10042605263121468, 'sideways_tp_mult': 2.6680657031255963, 'sideways_tsl_mult': 0.8771650713264343, 'sideways_time_stop': 120, 'sideways_use_sma': True, 'sideways_use_ema': True, 'sideways_use_atr': False, 'sideways_use_adx': False, 'sideways_use_spike': True, 'sideways_rsi_required': False}.
[I 2025-08-31 11:36:32,079] Trial 816 finished with values: [-1000000000.0, 1000000000.0] and parameters: {'p_sma': 40, 'p_std': 60, 'p_atr': 27, 'p_adx': 13, 'rsi_period': 75, 'ema1': 6, 'ema2': 40, 'slip_atr_k': 0.13061350295898444, 'slip_spread_k': 0.4495311192720702, 'spread_hl_frac': 0.021591975430587468, 'bb_std_mult': 0.5697997288498995, 'rsi_os': 29, 'rsi_ob': 51, 'vol_spike': 0.13934905963092878, 'adx_thresh': 9.444237543985333, 'atr_min_pct': 0.021876276326893172, 'atr_max_pct': 0.06936998742921603, 'tp_mult': 1.955191709485719, 'tsl_mult': 0.7772679729193572, 'strategy': 'breakout', 'time_stop': 99, 'use_sma': True, 'use_atr': True, 'use_adx': False, 'use_ema': True, 'use_spike': False, 'rsi_required': False, 'edge_k': 0.36668127637421655, 'edge_cap': 0.40163467627628513, 'bull_strategy': 'mean_reversion', 'bull_bb_std_mult': 0.6057281750041072, 'bull_rsi_os': 49, 'bull_rsi_ob': 63, 'bull_adx_thresh': 26.803579017024177, 'bull_atr_min_pct': 0.012643531281499996, 'bull_atr_max_pct': 0.04339963553184889, 'bull_tp_mult': 2.200030792361308, 'bull_tsl_mult': 0.3010551980795984, 'bull_time_stop': 204, 'bull_use_sma': False, 'bull_use_ema': True, 'bull_use_atr': False, 'bull_use_adx': True, 'bull_use_spike': False, 'bull_rsi_required': True, 'bear_strategy': 'mean_reversion', 'bear_bb_std_mult': 1.5503875166548937, 'bear_rsi_os': 33, 'bear_rsi_ob': 52, 'bear_adx_thresh': 12.957287598575231, 'bear_atr_min_pct': 0.021367874401454847, 'bear_atr_max_pct': 0.13858089618923253, 'bear_tp_mult': 2.671313559022701, 'bear_tsl_mult': 0.5480421476420496, 'bear_time_stop': 191, 'bear_use_sma': False, 'bear_use_ema': True, 'bear_use_atr': True, 'bear_use_adx': False, 'bear_use_spike': False, 'bear_rsi_required': False, 'sideways_strategy': 'mean_reversion', 'sideways_bb_std_mult': 3.04925170633817, 'sideways_rsi_os': 41, 'sideways_rsi_ob': 61, 'sideways_adx_thresh': 26.711196274803136, 'sideways_atr_min_pct': 0.0039553474719332665, 'sideways_atr_max_pct': 0.14583585388777964, 'sideways_tp_mult': 2.6469479624499637, 'sideways_tsl_mult': 0.8168775454914872, 'sideways_time_stop': 74, 'sideways_use_sma': True, 'sideways_use_ema': True, 'sideways_use_atr': False, 'sideways_use_adx': False, 'sideways_use_spike': False, 'sideways_rsi_required': False}.
[I 2025-08-31 11:36:32,094] Trial 814 finished with values: [-1000000000.0, 1000000000.0] and parameters: {'p_sma': 39, 'p_std': 42, 'p_atr': 8, 'p_adx': 21, 'rsi_period': 84, 'ema1': 6, 'ema2': 33, 'slip_atr_k': 0.016233225139713047, 'slip_spread_k': 0.4507361114886869, 'spread_hl_frac': 0.0027555476009033, 'bb_std_mult': 0.5767521576857231, 'rsi_os': 35, 'rsi_ob': 49, 'vol_spike': 0.14050019608868045, 'adx_thresh': 10.877665997601953, 'atr_min_pct': 0.02059201057747998, 'atr_max_pct': 0.13803043610390353, 'tp_mult': 2.8985991053521394, 'tsl_mult': 0.9701568689990309, 'strategy': 'breakout', 'time_stop': 216, 'use_sma': True, 'use_atr': True, 'use_adx': False, 'use_ema': True, 'use_spike': False, 'rsi_required': False, 'edge_k': 0.8853095524479055, 'edge_cap': 0.3994522410240593, 'bull_strategy': 'mean_reversion', 'bull_bb_std_mult': 3.1344315355921566, 'bull_rsi_os': 49, 'bull_rsi_ob': 88, 'bull_adx_thresh': 31.21546466324808, 'bull_atr_min_pct': 0.012571465066332645, 'bull_atr_max_pct': 0.03230349114590185, 'bull_tp_mult': 1.8338858626327956, 'bull_tsl_mult': 0.30222931157381566, 'bull_time_stop': 223, 'bull_use_sma': False, 'bull_use_ema': True, 'bull_use_atr': False, 'bull_use_adx': True, 'bull_use_spike': False, 'bull_rsi_required': False, 'bear_strategy': 'mean_reversion', 'bear_bb_std_mult': 3.2421751900103013, 'bear_rsi_os': 50, 'bear_rsi_ob': 55, 'bear_adx_thresh': 5.754926018431462, 'bear_atr_min_pct': 0.02151028945792095, 'bear_atr_max_pct': 0.1389737340038338, 'bear_tp_mult': 2.453712144740902, 'bear_tsl_mult': 0.8736053117163513, 'bear_time_stop': 94, 'bear_use_sma': False, 'bear_use_ema': False, 'bear_use_atr': True, 'bear_use_adx': False, 'bear_use_spike': True, 'bear_rsi_required': False, 'sideways_strategy': 'mean_reversion', 'sideways_bb_std_mult': 1.0666401127954366, 'sideways_rsi_os': 50, 'sideways_rsi_ob': 61, 'sideways_adx_thresh': 10.094196472946068, 'sideways_atr_min_pct': 0.00900704719779847, 'sideways_atr_max_pct': 0.1001920267049707, 'sideways_tp_mult': 1.4382062733646754, 'sideways_tsl_mult': 0.8673764820155978, 'sideways_time_stop': 186, 'sideways_use_sma': True, 'sideways_use_ema': True, 'sideways_use_atr': False, 'sideways_use_adx': False, 'sideways_use_spike': True, 'sideways_rsi_required': False}.
[I 2025-08-31 11:37:06,644] Trial 820 finished with values: [-1000000000.0, 1000000000.0] and parameters: {'p_sma': 33, 'p_std': 17, 'p_atr': 20, 'p_adx': 20, 'rsi_period': 35, 'ema1': 24, 'ema2': 15, 'slip_atr_k': 0.02081523812461683, 'slip_spread_k': 0.3607368986791315, 'spread_hl_frac': 0.019135825349251148, 'bb_std_mult': 1.259073999272934, 'rsi_os': 34, 'rsi_ob': 82, 'vol_spike': 0.1646473152581271, 'adx_thresh': 26.550522049212287, 'atr_min_pct': 0.021156777292518584, 'atr_max_pct': 0.055005371505161396, 'tp_mult': 1.196508837318774, 'tsl_mult': 0.36198358153533744, 'strategy': 'breakout', 'time_stop': 74, 'use_sma': True, 'use_atr': True, 'use_adx': False, 'use_ema': True, 'use_spike': False, 'rsi_required': False, 'edge_k': 1.5320352492952665, 'edge_cap': 0.2613075294636813, 'bull_strategy': 'mean_reversion', 'bull_bb_std_mult': 2.6886241546404, 'bull_rsi_os': 43, 'bull_rsi_ob': 82, 'bull_adx_thresh': 14.611449217963017, 'bull_atr_min_pct': 0.01322056607804145, 'bull_atr_max_pct': 0.0290878218559201, 'bull_tp_mult': 2.9315971653277986, 'bull_tsl_mult': 0.36130019198453445, 'bull_time_stop': 34, 'bull_use_sma': False, 'bull_use_ema': True, 'bull_use_atr': True, 'bull_use_adx': False, 'bull_use_spike': False, 'bull_rsi_required': True, 'bear_strategy': 'mean_reversion', 'bear_bb_std_mult': 1.5315552403542814, 'bear_rsi_os': 41, 'bear_rsi_ob': 54, 'bear_adx_thresh': 33.432990081316454, 'bear_atr_min_pct': 0.0021177859345453843, 'bear_atr_max_pct': 0.06717562426164593, 'bear_tp_mult': 1.6646919699251528, 'bear_tsl_mult': 0.31823347634762417, 'bear_time_stop': 61, 'bear_use_sma': False, 'bear_use_ema': True, 'bear_use_atr': False, 'bear_use_adx': True, 'bear_use_spike': False, 'bear_rsi_required': False, 'sideways_strategy': 'mean_reversion', 'sideways_bb_std_mult': 0.9421322120168406, 'sideways_rsi_os': 43, 'sideways_rsi_ob': 62, 'sideways_adx_thresh': 28.45423256954255, 'sideways_atr_min_pct': 0.005685164311360534, 'sideways_atr_max_pct': 0.10482051916599955, 'sideways_tp_mult': 1.5552841020715802, 'sideways_tsl_mult': 0.8455674282150634, 'sideways_time_stop': 152, 'sideways_use_sma': True, 'sideways_use_ema': True, 'sideways_use_atr': False, 'sideways_use_adx': False, 'sideways_use_spike': False, 'sideways_rsi_required': True}.
[I 2025-08-31 11:37:07,030] Trial 818 finished with values: [-1000000000.0, 1000000000.0] and parameters: {'p_sma': 39, 'p_std': 17, 'p_atr': 10, 'p_adx': 21, 'rsi_period': 37, 'ema1': 24, 'ema2': 52, 'slip_atr_k': 0.019158476373056885, 'slip_spread_k': 0.497694331351402, 'spread_hl_frac': 0.01936386621673115, 'bb_std_mult': 0.5615147439734453, 'rsi_os': 34, 'rsi_ob': 68, 'vol_spike': 0.14344055158681962, 'adx_thresh': 9.431977198441292, 'atr_min_pct': 0.01598379550139473, 'atr_max_pct': 0.05456766904465699, 'tp_mult': 2.904606258452127, 'tsl_mult': 0.09953783873345584, 'strategy': 'breakout', 'time_stop': 251, 'use_sma': True, 'use_atr': True, 'use_adx': False, 'use_ema': True, 'use_spike': False, 'rsi_required': False, 'edge_k': 0.8114816028345828, 'edge_cap': 0.6233379643616483, 'bull_strategy': 'mean_reversion', 'bull_bb_std_mult': 0.618349691340653, 'bull_rsi_os': 43, 'bull_rsi_ob': 82, 'bull_adx_thresh': 13.329438957573352, 'bull_atr_min_pct': 0.00802140104966206, 'bull_atr_max_pct': 0.04193068241573434, 'bull_tp_mult': 2.9272263723387826, 'bull_tsl_mult': 0.2038406857222198, 'bull_time_stop': 280, 'bull_use_sma': False, 'bull_use_ema': True, 'bull_use_atr': True, 'bull_use_adx': False, 'bull_use_spike': False, 'bull_rsi_required': True, 'bear_strategy': 'mean_reversion', 'bear_bb_std_mult': 1.8590975994653847, 'bear_rsi_os': 53, 'bear_rsi_ob': 54, 'bear_adx_thresh': 12.918131570290793, 'bear_atr_min_pct': 0.028170842294962126, 'bear_atr_max_pct': 0.1388449265621158, 'bear_tp_mult': 2.7031779619187546, 'bear_tsl_mult': 0.6725989510879533, 'bear_time_stop': 158, 'bear_use_sma': False, 'bear_use_ema': True, 'bear_use_atr': False, 'bear_use_adx': True, 'bear_use_spike': False, 'bear_rsi_required': False, 'sideways_strategy': 'mean_reversion', 'sideways_bb_std_mult': 3.2053623150684776, 'sideways_rsi_os': 43, 'sideways_rsi_ob': 62, 'sideways_adx_thresh': 26.668270099923983, 'sideways_atr_min_pct': 0.005701356112913318, 'sideways_atr_max_pct': 0.054095949513244534, 'sideways_tp_mult': 1.6515769285540536, 'sideways_tsl_mult': 0.8501488096287372, 'sideways_time_stop': 152, 'sideways_use_sma': True, 'sideways_use_ema': True, 'sideways_use_atr': False, 'sideways_use_adx': False, 'sideways_use_spike': False, 'sideways_rsi_required': True}.
