[I 2025-08-31 11:02:47,070] Trial 575 finished with values: [-1000000000.0, 1000000000.0] and parameters: {'p_sma': 36, 'p_std': 18, 'p_atr': 25, 'p_adx': 22, 'rsi_period': 31, 'ema1': 5, 'ema2': 18, 'slip_atr_k': 0.025440202829313717, 'slip_spread_k': 0.5116400495203794, 'spread_hl_frac': 0.019982285592390642, 'bb_std_mult': 0.832033436481623, 'rsi_os': 27, 'rsi_ob': 82, 'vol_spike': 0.10076136298393015, 'adx_thresh': 12.156411242333581, 'atr_min_pct': 0.023164146474180566, 'atr_max_pct': 0.05979168063002224, 'tp_mult': 2.994295668027286, 'tsl_mult': 0.08095732424311801, 'strategy': 'breakout', 'time_stop': 50, 'use_sma': True, 'use_atr': True, 'use_adx': False, 'use_ema': True, 'use_spike': False, 'rsi_required': False, 'edge_k': 1.4726348615079954, 'edge_cap': 0.685087858143263, 'bull_strategy': 'mean_reversion', 'bull_bb_std_mult': 1.8373358064978502, 'bull_rsi_os': 39, 'bull_rsi_ob': 59, 'bull_adx_thresh': 28.845613423264563, 'bull_atr_min_pct': 0.01024699415770475, 'bull_atr_max_pct': 0.03079689449007457, 'bull_tp_mult': 2.9987839045096676, 'bull_tsl_mult': 0.23740195408023168, 'bull_time_stop': 41, 'bull_use_sma': False, 'bull_use_ema': True, 'bull_use_atr': False, 'bull_use_adx': True, 'bull_use_spike': False, 'bull_rsi_required': False, 'bear_strategy': 'mean_reversion', 'bear_bb_std_mult': 1.7322623848213914, 'bear_rsi_os': 47, 'bear_rsi_ob': 57, 'bear_adx_thresh': 10.465623079213255, 'bear_atr_min_pct': 0.006547298838734128, 'bear_atr_max_pct': 0.13051996211852662, 'bear_tp_mult': 2.651892354968469, 'bear_tsl_mult': 0.8682314100451621, 'bear_time_stop': 103, 'bear_use_sma': False, 'bear_use_ema': False, 'bear_use_atr': True, 'bear_use_adx': False, 'bear_use_spike': True, 'bear_rsi_required': False, 'sideways_strategy': 'mean_reversion', 'sideways_bb_std_mult': 1.1456032885510625, 'sideways_rsi_os': 41, 'sideways_rsi_ob': 60, 'sideways_adx_thresh': 25.828412786270796, 'sideways_atr_min_pct': 0.003947779811741346, 'sideways_atr_max_pct': 0.10432631676317075, 'sideways_tp_mult': 1.5625561567743556, 'sideways_tsl_mult': 0.8389648826051581, 'sideways_time_stop': 153, 'sideways_use_sma': True, 'sideways_use_ema': True, 'sideways_use_atr': False, 'sideways_use_adx': False, 'sideways_use_spike': True, 'sideways_rsi_required': False}.
[I 2025-08-31 11:03:20,173] Trial 577 finished with values: [-0.0013977757603342855, 0.009767821862374645] and parameters: {'p_sma': 35, 'p_std': 18, 'p_atr': 25, 'p_adx': 22, 'rsi_period': 30, 'ema1': 6, 'ema2': 16, 'slip_atr_k': 0.03524864931786098, 'slip_spread_k': 0.5254480467492175, 'spread_hl_frac': 0.019819876437545514, 'bb_std_mult': 0.9054715091362935, 'rsi_os': 29, 'rsi_ob': 82, 'vol_spike': 0.10276640943821896, 'adx_thresh': 12.671773557423853, 'atr_min_pct': 0.022870927805880084, 'atr_max_pct': 0.05712415938341432, 'tp_mult': 2.9960616692319753, 'tsl_mult': 0.04582756097633024, 'strategy': 'breakout', 'time_stop': 71, 'use_sma': True, 'use_atr': True, 'use_adx': False, 'use_ema': True, 'use_spike': False, 'rsi_required': False, 'edge_k': 1.4671713514602243, 'edge_cap': 0.6842369634398088, 'bull_strategy': 'mean_reversion', 'bull_bb_std_mult': 1.758743363477906, 'bull_rsi_os': 39, 'bull_rsi_ob': 60, 'bull_adx_thresh': 29.11029920488997, 'bull_atr_min_pct': 0.011421604072851114, 'bull_atr_max_pct': 0.02896849520464858, 'bull_tp_mult': 2.99829710631742, 'bull_tsl_mult': 0.2691988217988055, 'bull_time_stop': 37, 'bull_use_sma': False, 'bull_use_ema': True, 'bull_use_atr': False, 'bull_use_adx': True, 'bull_use_spike': False, 'bull_rsi_required': False, 'bear_strategy': 'mean_reversion', 'bear_bb_std_mult': 1.7206971665930364, 'bear_rsi_os': 49, 'bear_rsi_ob': 57, 'bear_adx_thresh': 10.883198858322386, 'bear_atr_min_pct': 0.004231075548178212, 'bear_atr_max_pct': 0.13072264100185724, 'bear_tp_mult': 2.6514421736924922, 'bear_tsl_mult': 0.8856537868718348, 'bear_time_stop': 105, 'bear_use_sma': False, 'bear_use_ema': False, 'bear_use_atr': True, 'bear_use_adx': False, 'bear_use_spike': True, 'bear_rsi_required': False, 'sideways_strategy': 'mean_reversion', 'sideways_bb_std_mult': 1.143937077857674, 'sideways_rsi_os': 41, 'sideways_rsi_ob': 56, 'sideways_adx_thresh': 25.744740301100002, 'sideways_atr_min_pct': 0.003915546621246519, 'sideways_atr_max_pct': 0.10690770460077116, 'sideways_tp_mult': 1.581927935398322, 'sideways_tsl_mult': 0.8581034939385994, 'sideways_time_stop': 157, 'sideways_use_sma': True, 'sideways_use_ema': True, 'sideways_use_atr': False, 'sideways_use_adx': False, 'sideways_use_spike': True, 'sideways_rsi_required': False}.
[I 2025-08-31 11:03:20,214] Trial 580 finished with values: [-1000000000.0, 1000000000.0] and parameters: {'p_sma': 35, 'p_std': 19, 'p_atr': 25, 'p_adx': 21, 'rsi_period': 33, 'ema1': 6, 'ema2': 17, 'slip_atr_k': 0.03220688791129777, 'slip_spread_k': 0.4760636696345567, 'spread_hl_frac': 0.01954450111680779, 'bb_std_mult': 0.9073907922487923, 'rsi_os': 29, 'rsi_ob': 80, 'vol_spike': 0.08393484943986913, 'adx_thresh': 12.89157291606157, 'atr_min_pct': 0.02256509344551382, 'atr_max_pct': 0.05664618958734169, 'tp_mult': 2.9658541944264183, 'tsl_mult': 0.09116595238841388, 'strategy': 'breakout', 'time_stop': 60, 'use_sma': True, 'use_atr': True, 'use_adx': False, 'use_ema': True, 'use_spike': False, 'rsi_required': False, 'edge_k': 1.533803063541659, 'edge_cap': 0.727348231084524, 'bull_strategy': 'mean_reversion', 'bull_bb_std_mult': 1.7641158039101137, 'bull_rsi_os': 40, 'bull_rsi_ob': 61, 'bull_adx_thresh': 29.651012491605034, 'bull_atr_min_pct': 0.011315152314410045, 'bull_atr_max_pct': 0.02866116424248483, 'bull_tp_mult': 2.953203768316663, 'bull_tsl_mult': 0.2702819377275731, 'bull_time_stop': 34, 'bull_use_sma': False, 'bull_use_ema': True, 'bull_use_atr': False, 'bull_use_adx': True, 'bull_use_spike': False, 'bull_rsi_required': False, 'bear_strategy': 'mean_reversion', 'bear_bb_std_mult': 1.663180291230099, 'bear_rsi_os': 49, 'bear_rsi_ob': 57, 'bear_adx_thresh': 10.851793853968744, 'bear_atr_min_pct': 0.008641694749862252, 'bear_atr_max_pct': 0.13153814327804272, 'bear_tp_mult': 2.6927343000200064, 'bear_tsl_mult': 0.818776753588224, 'bear_time_stop': 85, 'bear_use_sma': False, 'bear_use_ema': False, 'bear_use_atr': True, 'bear_use_adx': False, 'bear_use_spike': True, 'bear_rsi_required': False, 'sideways_strategy': 'mean_reversion', 'sideways_bb_std_mult': 1.1012742925401946, 'sideways_rsi_os': 40, 'sideways_rsi_ob': 59, 'sideways_adx_thresh': 25.363982893092626, 'sideways_atr_min_pct': 0.004002996887791891, 'sideways_atr_max_pct': 0.10150296822770917, 'sideways_tp_mult': 1.6993816283694347, 'sideways_tsl_mult': 0.8326437223641489, 'sideways_time_stop': 168, 'sideways_use_sma': True, 'sideways_use_ema': True, 'sideways_use_atr': False, 'sideways_use_adx': False, 'sideways_use_spike': True, 'sideways_rsi_required': False}.
[I 2025-08-31 11:03:20,535] Trial 579 finished with values: [-1000000000.0, 1000000000.0] and parameters: {'p_sma': 35, 'p_std': 18, 'p_atr': 26, 'p_adx': 21, 'rsi_period': 30, 'ema1': 6, 'ema2': 16, 'slip_atr_k': 0.034544702867495614, 'slip_spread_k': 0.4781406789802149, 'spread_hl_frac': 0.019315131345415314, 'bb_std_mult': 0.8917756644645218, 'rsi_os': 29, 'rsi_ob': 82, 'vol_spike': 0.08867846661468039, 'adx_thresh': 12.838113528148837, 'atr_min_pct': 0.02328479873841597, 'atr_max_pct': 0.05675049220023358, 'tp_mult': 2.9766866520631647, 'tsl_mult': 0.08748789294543333, 'strategy': 'breakout', 'time_stop': 59, 'use_sma': True, 'use_atr': True, 'use_adx': False, 'use_ema': True, 'use_spike': False, 'rsi_required': False, 'edge_k': 1.4156319169947693, 'edge_cap': 0.6841403205110157, 'bull_strategy': 'mean_reversion', 'bull_bb_std_mult': 1.7620799100930291, 'bull_rsi_os': 39, 'bull_rsi_ob': 60, 'bull_adx_thresh': 29.398277132008243, 'bull_atr_min_pct': 0.011294273528752365, 'bull_atr_max_pct': 0.030320384564498194, 'bull_tp_mult': 2.9611664912501916, 'bull_tsl_mult': 0.2700706086017317, 'bull_time_stop': 35, 'bull_use_sma': False, 'bull_use_ema': True, 'bull_use_atr': False, 'bull_use_adx': True, 'bull_use_spike': False, 'bull_rsi_required': False, 'bear_strategy': 'mean_reversion', 'bear_bb_std_mult': 1.6905617590091526, 'bear_rsi_os': 48, 'bear_rsi_ob': 57, 'bear_adx_thresh': 11.260909009551302, 'bear_atr_min_pct': 0.00897452207640799, 'bear_atr_max_pct': 0.12979975469047497, 'bear_tp_mult': 2.6883665446716294, 'bear_tsl_mult': 0.8753804976984503, 'bear_time_stop': 87, 'bear_use_sma': False, 'bear_use_ema': False, 'bear_use_atr': True, 'bear_use_adx': False, 'bear_use_spike': True, 'bear_rsi_required': False, 'sideways_strategy': 'mean_reversion', 'sideways_bb_std_mult': 1.0480624769187648, 'sideways_rsi_os': 41, 'sideways_rsi_ob': 59, 'sideways_adx_thresh': 25.757459652695278, 'sideways_atr_min_pct': 0.004232084653717385, 'sideways_atr_max_pct': 0.10587815848548905, 'sideways_tp_mult': 1.6883041386848898, 'sideways_tsl_mult': 0.8378540038280217, 'sideways_time_stop': 152, 'sideways_use_sma': True, 'sideways_use_ema': True, 'sideways_use_atr': False, 'sideways_use_adx': False, 'sideways_use_spike': True, 'sideways_rsi_required': False}.
[I 2025-08-31 11:03:20,666] Trial 578 finished with values: [-0.013391312486495499, 0.015011696072218021] and parameters: {'p_sma': 34, 'p_std': 18, 'p_atr': 26, 'p_adx': 21, 'rsi_period': 30, 'ema1': 6, 'ema2': 16, 'slip_atr_k': 0.03347189639260934, 'slip_spread_k': 0.46908906978224124, 'spread_hl_frac': 0.01963757066090248, 'bb_std_mult': 0.8745131411411035, 'rsi_os': 29, 'rsi_ob': 82, 'vol_spike': 0.08719931010075724, 'adx_thresh': 11.9779056442394, 'atr_min_pct': 0.02321304669627472, 'atr_max_pct': 0.056778367312490405, 'tp_mult': 2.99991211980847, 'tsl_mult': 0.08982111302858983, 'strategy': 'breakout', 'time_stop': 57, 'use_sma': True, 'use_atr': True, 'use_adx': False, 'use_ema': True, 'use_spike': False, 'rsi_required': False, 'edge_k': 1.332444778539056, 'edge_cap': 0.7228032196364708, 'bull_strategy': 'mean_reversion', 'bull_bb_std_mult': 1.7785496868410502, 'bull_rsi_os': 40, 'bull_rsi_ob': 60, 'bull_adx_thresh': 29.163819960041156, 'bull_atr_min_pct': 0.011405538282560232, 'bull_atr_max_pct': 0.027546737408871275, 'bull_tp_mult': 2.995632084132867, 'bull_tsl_mult': 0.2355134147105399, 'bull_time_stop': 41, 'bull_use_sma': False, 'bull_use_ema': True, 'bull_use_atr': False, 'bull_use_adx': True, 'bull_use_spike': False, 'bull_rsi_required': False, 'bear_strategy': 'mean_reversion', 'bear_bb_std_mult': 1.6726172199961546, 'bear_rsi_os': 48, 'bear_rsi_ob': 57, 'bear_adx_thresh': 10.922693661592021, 'bear_atr_min_pct': 0.0038977938583674284, 'bear_atr_max_pct': 0.13075636430678378, 'bear_tp_mult': 2.6729976936177735, 'bear_tsl_mult': 0.8769874205991495, 'bear_time_stop': 90, 'bear_use_sma': False, 'bear_use_ema': False, 'bear_use_atr': True, 'bear_use_adx': False, 'bear_use_spike': True, 'bear_rsi_required': False, 'sideways_strategy': 'mean_reversion', 'sideways_bb_std_mult': 1.0686028947265653, 'sideways_rsi_os': 41, 'sideways_rsi_ob': 56, 'sideways_adx_thresh': 25.74102918087362, 'sideways_atr_min_pct': 0.004196507661761304, 'sideways_atr_max_pct': 0.10794307348881206, 'sideways_tp_mult': 1.7015866556688377, 'sideways_tsl_mult': 0.8365571848192919, 'sideways_time_stop': 170, 'sideways_use_sma': True, 'sideways_use_ema': True, 'sideways_use_atr': False, 'sideways_use_adx': False, 'sideways_use_spike': True, 'sideways_rsi_required': False}.
[I 2025-08-31 11:03:52,920] Trial 582 finished with values: [-0.004277388537650584, 0.010852067556576849] and parameters: {'p_sma': 34, 'p_std': 15, 'p_atr': 26, 'p_adx': 22, 'rsi_period': 30, 'ema1': 6, 'ema2': 16, 'slip_atr_k': 0.03704701553818003, 'slip_spread_k': 0.4624198477451532, 'spread_hl_frac': 0.020474981624175357, 'bb_std_mult': 0.7002857149255475, 'rsi_os': 29, 'rsi_ob': 80, 'vol_spike': 0.08690154360971183, 'adx_thresh': 12.7018555979715, 'atr_min_pct': 0.02346571544501648, 'atr_max_pct': 0.0563897707100161, 'tp_mult': 2.9677603801036234, 'tsl_mult': 0.04333292178170792, 'strategy': 'breakout', 'time_stop': 68, 'use_sma': True, 'use_atr': True, 'use_adx': False, 'use_ema': True, 'use_spike': False, 'rsi_required': False, 'edge_k': 1.431190142815683, 'edge_cap': 0.7402556179007251, 'bull_strategy': 'mean_reversion', 'bull_bb_std_mult': 1.9492063647837883, 'bull_rsi_os': 40, 'bull_rsi_ob': 60, 'bull_adx_thresh': 29.18832082766174, 'bull_atr_min_pct': 0.011259925497193983, 'bull_atr_max_pct': 0.028029915590929853, 'bull_tp_mult': 2.962207179906398, 'bull_tsl_mult': 0.26029150353022673, 'bull_time_stop': 41, 'bull_use_sma': False, 'bull_use_ema': True, 'bull_use_atr': False, 'bull_use_adx': True, 'bull_use_spike': False, 'bull_rsi_required': False, 'bear_strategy': 'mean_reversion', 'bear_bb_std_mult': 1.6863788502183203, 'bear_rsi_os': 48, 'bear_rsi_ob': 57, 'bear_adx_thresh': 10.930735596055921, 'bear_atr_min_pct': 0.004219416118634314, 'bear_atr_max_pct': 0.130274233516662, 'bear_tp_mult': 2.6725493942189074, 'bear_tsl_mult': 0.8780701627259097, 'bear_time_stop': 91, 'bear_use_sma': False, 'bear_use_ema': False, 'bear_use_atr': True, 'bear_use_adx': False, 'bear_use_spike': True, 'bear_rsi_required': False, 'sideways_strategy': 'mean_reversion', 'sideways_bb_std_mult': 1.2799239158147948, 'sideways_rsi_os': 40, 'sideways_rsi_ob': 56, 'sideways_adx_thresh': 25.02891853927085, 'sideways_atr_min_pct': 0.004025905790844329, 'sideways_atr_max_pct': 0.10705195834799154, 'sideways_tp_mult': 1.6769569307518195, 'sideways_tsl_mult': 0.8422399416809025, 'sideways_time_stop': 160, 'sideways_use_sma': True, 'sideways_use_ema': True, 'sideways_use_atr': False, 'sideways_use_adx': False, 'sideways_use_spike': True, 'sideways_rsi_required': False}.
[I 2025-08-31 11:03:52,953] Trial 584 finished with values: [-0.0810278117233576, 0.08068883042233503] and parameters: {'p_sma': 32, 'p_std': 15, 'p_atr': 25, 'p_adx': 21, 'rsi_period': 33, 'ema1': 5, 'ema2': 19, 'slip_atr_k': 0.03679706191123775, 'slip_spread_k': 0.5303677789804958, 'spread_hl_frac': 0.02121108993898229, 'bb_std_mult': 0.6910786986255844, 'rsi_os': 27, 'rsi_ob': 80, 'vol_spike': 0.10337685280369277, 'adx_thresh': 12.592364157667467, 'atr_min_pct': 0.022827836515300542, 'atr_max_pct': 0.05327652958614643, 'tp_mult': 2.9695453113253243, 'tsl_mult': 0.04491329127684687, 'strategy': 'breakout', 'time_stop': 68, 'use_sma': True, 'use_atr': True, 'use_adx': False, 'use_ema': True, 'use_spike': False, 'rsi_required': False, 'edge_k': 1.5277667318469534, 'edge_cap': 0.7429122674598165, 'bull_strategy': 'mean_reversion', 'bull_bb_std_mult': 1.976235347762202, 'bull_rsi_os': 40, 'bull_rsi_ob': 58, 'bull_adx_thresh': 28.436138040134733, 'bull_atr_min_pct': 0.009650330612143333, 'bull_atr_max_pct': 0.03356688563399835, 'bull_tp_mult': 2.9520700753334266, 'bull_tsl_mult': 0.2515559190251491, 'bull_time_stop': 44, 'bull_use_sma': False, 'bull_use_ema': True, 'bull_use_atr': False, 'bull_use_adx': True, 'bull_use_spike': False, 'bull_rsi_required': False, 'bear_strategy': 'mean_reversion', 'bear_bb_std_mult': 1.6744234322572458, 'bear_rsi_os': 46, 'bear_rsi_ob': 57, 'bear_adx_thresh': 11.697686268956195, 'bear_atr_min_pct': 0.0017251196773753613, 'bear_atr_max_pct': 0.12873266005879505, 'bear_tp_mult': 2.6738333545575537, 'bear_tsl_mult': 0.8452877134018222, 'bear_time_stop': 108, 'bear_use_sma': False, 'bear_use_ema': False, 'bear_use_atr': True, 'bear_use_adx': False, 'bear_use_spike': True, 'bear_rsi_required': False, 'sideways_strategy': 'mean_reversion', 'sideways_bb_std_mult': 1.244839746033891, 'sideways_rsi_os': 42, 'sideways_rsi_ob': 56, 'sideways_adx_thresh': 24.581341187121698, 'sideways_atr_min_pct': 0.0038890552418802977, 'sideways_atr_max_pct': 0.09777417976363464, 'sideways_tp_mult': 1.6347694375798214, 'sideways_tsl_mult': 0.8324641049400155, 'sideways_time_stop': 160, 'sideways_use_sma': True, 'sideways_use_ema': True, 'sideways_use_atr': False, 'sideways_use_adx': False, 'sideways_use_spike': True, 'sideways_rsi_required': False}.
[I 2025-08-31 11:03:53,353] Trial 583 finished with values: [-0.03423177467650895, 0.03447413747972915] and parameters: {'p_sma': 34, 'p_std': 16, 'p_atr': 25, 'p_adx': 22, 'rsi_period': 34, 'ema1': 6, 'ema2': 16, 'slip_atr_k': 0.0368564837664857, 'slip_spread_k': 0.4614467869307605, 'spread_hl_frac': 0.021449853772439183, 'bb_std_mult': 0.6954699842760057, 'rsi_os': 30, 'rsi_ob': 80, 'vol_spike': 0.09010525347860553, 'adx_thresh': 11.52564205104605, 'atr_min_pct': 0.022632648648590523, 'atr_max_pct': 0.0519786447176119, 'tp_mult': 2.993109226872556, 'tsl_mult': 0.04818668265653156, 'strategy': 'breakout', 'time_stop': 66, 'use_sma': True, 'use_atr': True, 'use_adx': False, 'use_ema': True, 'use_spike': False, 'rsi_required': False, 'edge_k': 1.5273310584465156, 'edge_cap': 0.7394744847580261, 'bull_strategy': 'mean_reversion', 'bull_bb_std_mult': 1.9287740392719137, 'bull_rsi_os': 40, 'bull_rsi_ob': 58, 'bull_adx_thresh': 27.882110243544638, 'bull_atr_min_pct': 0.009537883494616537, 'bull_atr_max_pct': 0.02849535968047274, 'bull_tp_mult': 2.9986818893403675, 'bull_tsl_mult': 0.22775373821150463, 'bull_time_stop': 42, 'bull_use_sma': False, 'bull_use_ema': True, 'bull_use_atr': False, 'bull_use_adx': True, 'bull_use_spike': False, 'bull_rsi_required': False, 'bear_strategy': 'mean_reversion', 'bear_bb_std_mult': 1.6621351961411683, 'bear_rsi_os': 48, 'bear_rsi_ob': 57, 'bear_adx_thresh': 10.911317290179412, 'bear_atr_min_pct': 0.00317263623745019, 'bear_atr_max_pct': 0.13056643039187824, 'bear_tp_mult': 2.6326322955414305, 'bear_tsl_mult': 0.8858624609312437, 'bear_time_stop': 108, 'bear_use_sma': False, 'bear_use_ema': False, 'bear_use_atr': True, 'bear_use_adx': False, 'bear_use_spike': True, 'bear_rsi_required': False, 'sideways_strategy': 'mean_reversion', 'sideways_bb_std_mult': 1.2553659078694517, 'sideways_rsi_os': 42, 'sideways_rsi_ob': 56, 'sideways_adx_thresh': 24.887968263878527, 'sideways_atr_min_pct': 0.003699068108558844, 'sideways_atr_max_pct': 0.10752103069638566, 'sideways_tp_mult': 1.6478763900167945, 'sideways_tsl_mult': 0.8254523164288758, 'sideways_time_stop': 172, 'sideways_use_sma': True, 'sideways_use_ema': True, 'sideways_use_atr': False, 'sideways_use_adx': False, 'sideways_use_spike': True, 'sideways_rsi_required': False}.
[I 2025-08-31 11:03:53,495] Trial 581 finished with values: [-0.027793192898875718, 0.027909966211286975] and parameters: {'p_sma': 34, 'p_std': 18, 'p_atr': 26, 'p_adx': 22, 'rsi_period': 34, 'ema1': 6, 'ema2': 16, 'slip_atr_k': 0.03487560335453849, 'slip_spread_k': 0.4559469211647177, 'spread_hl_frac': 0.020682441546548722, 'bb_std_mult': 0.69730408410315, 'rsi_os': 29, 'rsi_ob': 80, 'vol_spike': 0.08870963547660998, 'adx_thresh': 11.62802363452327, 'atr_min_pct': 0.0228231420677183, 'atr_max_pct': 0.05590467016922277, 'tp_mult': 2.9966576448752247, 'tsl_mult': 0.04952324405939842, 'strategy': 'breakout', 'time_stop': 67, 'use_sma': True, 'use_atr': True, 'use_adx': False, 'use_ema': True, 'use_spike': False, 'rsi_required': False, 'edge_k': 1.4273355693063003, 'edge_cap': 0.7365373948933933, 'bull_strategy': 'mean_reversion', 'bull_bb_std_mult': 1.736882328587965, 'bull_rsi_os': 39, 'bull_rsi_ob': 60, 'bull_adx_thresh': 28.525826440246483, 'bull_atr_min_pct': 0.011302505602730006, 'bull_atr_max_pct': 0.03284033104073482, 'bull_tp_mult': 2.9634803925158386, 'bull_tsl_mult': 0.26000760397148565, 'bull_time_stop': 43, 'bull_use_sma': False, 'bull_use_ema': True, 'bull_use_atr': False, 'bull_use_adx': True, 'bull_use_spike': False, 'bull_rsi_required': False, 'bear_strategy': 'mean_reversion', 'bear_bb_std_mult': 1.6777279134172691, 'bear_rsi_os': 48, 'bear_rsi_ob': 57, 'bear_adx_thresh': 11.062831838650668, 'bear_atr_min_pct': 0.0033123889217598415, 'bear_atr_max_pct': 0.12983968726439782, 'bear_tp_mult': 2.680556363735926, 'bear_tsl_mult': 0.887953765423881, 'bear_time_stop': 89, 'bear_use_sma': False, 'bear_use_ema': False, 'bear_use_atr': True, 'bear_use_adx': False, 'bear_use_spike': True, 'bear_rsi_required': False, 'sideways_strategy': 'mean_reversion', 'sideways_bb_std_mult': 1.255769721319595, 'sideways_rsi_os': 42, 'sideways_rsi_ob': 56, 'sideways_adx_thresh': 24.76387875537674, 'sideways_atr_min_pct': 0.003851358150391633, 'sideways_atr_max_pct': 0.09873861174644594, 'sideways_tp_mult': 1.6108415855762788, 'sideways_tsl_mult': 0.8328989708105707, 'sideways_time_stop': 170, 'sideways_use_sma': True, 'sideways_use_ema': True, 'sideways_use_atr': False, 'sideways_use_adx': False, 'sideways_use_spike': True, 'sideways_rsi_required': False}.
