[I 2025-08-31 10:40:18,357] Trial 396 finished with values: [-0.011551362164133883, 0.012173194813183059] and parameters: {'p_sma': 40, 'p_std': 41, 'p_atr': 8, 'p_adx': 26, 'rsi_period': 25, 'ema1': 11, 'ema2': 59, 'slip_atr_k': 0.05758518664380964, 'slip_spread_k': 0.8653898639745041, 'spread_hl_frac': 0.027703819822239392, 'bb_std_mult': 2.4817663262342298, 'rsi_os': 28, 'rsi_ob': 74, 'vol_spike': 0.2070385686944416, 'adx_thresh': 7.2959333112651725, 'atr_min_pct': 0.012707687050027812, 'atr_max_pct': 0.046604154963114056, 'tp_mult': 2.790788757047248, 'tsl_mult': 0.7448229693277802, 'strategy': 'mean_reversion', 'time_stop': 66, 'use_sma': False, 'use_atr': True, 'use_adx': False, 'use_ema': True, 'use_spike': True, 'rsi_required': True, 'edge_k': 1.701275422799207, 'edge_cap': 0.762896117233962, 'bull_strategy': 'breakout', 'bull_bb_std_mult': 1.0722869698176742, 'bull_rsi_os': 39, 'bull_rsi_ob': 88, 'bull_adx_thresh': 5.946343914364514, 'bull_atr_min_pct': 0.016500249320980778, 'bull_atr_max_pct': 0.10639568771165976, 'bull_tp_mult': 1.1774982998131855, 'bull_tsl_mult': 0.5396213030434853, 'bull_time_stop': 190, 'bull_use_sma': False, 'bull_use_ema': True, 'bull_use_atr': False, 'bull_use_adx': False, 'bull_use_spike': True, 'bull_rsi_required': False, 'bear_strategy': 'breakout', 'bear_bb_std_mult': 2.166231283923319, 'bear_rsi_os': 20, 'bear_rsi_ob': 80, 'bear_adx_thresh': 7.363152538819402, 'bear_atr_min_pct': 0.01576721846219792, 'bear_atr_max_pct': 0.11517099096247543, 'bear_tp_mult': 2.6011114497090384, 'bear_tsl_mult': 0.13094847510127935, 'bear_time_stop': 244, 'bear_use_sma': False, 'bear_use_ema': False, 'bear_use_atr': True, 'bear_use_adx': True, 'bear_use_spike': True, 'bear_rsi_required': True, 'sideways_strategy': 'breakout', 'sideways_bb_std_mult': 2.6593221398487588, 'sideways_rsi_os': 33, 'sideways_rsi_ob': 64, 'sideways_adx_thresh': 16.61566008677189, 'sideways_atr_min_pct': 0.0041049142509570575, 'sideways_atr_max_pct': 0.015046906282098914, 'sideways_tp_mult': 2.3741581118729362, 'sideways_tsl_mult': 0.8331601456254605, 'sideways_time_stop': 269, 'sideways_use_sma': True, 'sideways_use_ema': True, 'sideways_use_atr': False, 'sideways_use_adx': False, 'sideways_use_spike': True, 'sideways_rsi_required': False}.
[I 2025-08-31 10:40:18,542] Trial 395 finished with values: [-0.0086453596744821, 0.008382753434807629] and parameters: {'p_sma': 31, 'p_std': 31, 'p_atr': 16, 'p_adx': 8, 'rsi_period': 25, 'ema1': 20, 'ema2': 60, 'slip_atr_k': 0.054137811345037264, 'slip_spread_k': 0.8595732189363987, 'spread_hl_frac': 0.02770293655002174, 'bb_std_mult': 2.510127730080748, 'rsi_os': 43, 'rsi_ob': 52, 'vol_spike': 0.23589939000696064, 'adx_thresh': 7.2937909682761495, 'atr_min_pct': 0.012755904642324262, 'atr_max_pct': 0.04581899752002475, 'tp_mult': 2.7874701321054296, 'tsl_mult': 0.5017602304783109, 'strategy': 'mean_reversion', 'time_stop': 142, 'use_sma': True, 'use_atr': True, 'use_adx': False, 'use_ema': True, 'use_spike': True, 'rsi_required': True, 'edge_k': 1.6934435036936932, 'edge_cap': 0.7625485678226199, 'bull_strategy': 'mean_reversion', 'bull_bb_std_mult': 0.7001449207673915, 'bull_rsi_os': 42, 'bull_rsi_ob': 86, 'bull_adx_thresh': 26.501233615844054, 'bull_atr_min_pct': 0.0025168703573198734, 'bull_atr_max_pct': 0.07492401130825174, 'bull_tp_mult': 1.1512237230492801, 'bull_tsl_mult': 0.22008385377596978, 'bull_time_stop': 15, 'bull_use_sma': False, 'bull_use_ema': True, 'bull_use_atr': False, 'bull_use_adx': False, 'bull_use_spike': True, 'bull_rsi_required': False, 'bear_strategy': 'breakout', 'bear_bb_std_mult': 1.3530164101233297, 'bear_rsi_os': 29, 'bear_rsi_ob': 80, 'bear_adx_thresh': 7.317630945820177, 'bear_atr_min_pct': 0.01580628794482535, 'bear_atr_max_pct': 0.12029895515172337, 'bear_tp_mult': 2.6251119724628507, 'bear_tsl_mult': 0.2830835479746836, 'bear_time_stop': 227, 'bear_use_sma': False, 'bear_use_ema': False, 'bear_use_atr': True, 'bear_use_adx': True, 'bear_use_spike': True, 'bear_rsi_required': True, 'sideways_strategy': 'breakout', 'sideways_bb_std_mult': 2.679648003614242, 'sideways_rsi_os': 33, 'sideways_rsi_ob': 72, 'sideways_adx_thresh': 16.39777176852342, 'sideways_atr_min_pct': 0.01965023122396043, 'sideways_atr_max_pct': 0.014713026473613151, 'sideways_tp_mult': 2.372886567122117, 'sideways_tsl_mult': 0.8305036762955563, 'sideways_time_stop': 269, 'sideways_use_sma': True, 'sideways_use_ema': True, 'sideways_use_atr': False, 'sideways_use_adx': False, 'sideways_use_spike': True, 'sideways_rsi_required': True}.
[I 2025-08-31 10:40:21,304] Trial 398 finished with values: [-0.02869001425629336, 0.028637679947965948] and parameters: {'p_sma': 56, 'p_std': 48, 'p_atr': 16, 'p_adx': 10, 'rsi_period': 25, 'ema1': 12, 'ema2': 60, 'slip_atr_k': 0.23213426605126963, 'slip_spread_k': 0.8595293179811739, 'spread_hl_frac': 0.02821054670567874, 'bb_std_mult': 2.4717863495291477, 'rsi_os': 37, 'rsi_ob': 88, 'vol_spike': 0.20599588047756612, 'adx_thresh': 12.191921531954327, 'atr_min_pct': 0.012853309922685059, 'atr_max_pct': 0.12013199857250417, 'tp_mult': 2.435832552180767, 'tsl_mult': 0.7942183965861799, 'strategy': 'mean_reversion', 'time_stop': 149, 'use_sma': False, 'use_atr': True, 'use_adx': False, 'use_ema': True, 'use_spike': False, 'rsi_required': True, 'edge_k': 1.7690867787548026, 'edge_cap': 0.11242745509597069, 'bull_strategy': 'breakout', 'bull_bb_std_mult': 1.075719107149852, 'bull_rsi_os': 39, 'bull_rsi_ob': 86, 'bull_adx_thresh': 15.228505391471096, 'bull_atr_min_pct': 0.0027421828545110844, 'bull_atr_max_pct': 0.06175649464953371, 'bull_tp_mult': 1.1488364046764827, 'bull_tsl_mult': 0.07476427462889976, 'bull_time_stop': 189, 'bull_use_sma': False, 'bull_use_ema': True, 'bull_use_atr': False, 'bull_use_adx': True, 'bull_use_spike': True, 'bull_rsi_required': False, 'bear_strategy': 'breakout', 'bear_bb_std_mult': 2.181910654699482, 'bear_rsi_os': 30, 'bear_rsi_ob': 79, 'bear_adx_thresh': 7.860472947524936, 'bear_atr_min_pct': 0.014241889291538986, 'bear_atr_max_pct': 0.08414751854258148, 'bear_tp_mult': 1.1215283331284263, 'bear_tsl_mult': 0.22782660148303469, 'bear_time_stop': 107, 'bear_use_sma': False, 'bear_use_ema': False, 'bear_use_atr': True, 'bear_use_adx': False, 'bear_use_spike': True, 'bear_rsi_required': True, 'sideways_strategy': 'breakout', 'sideways_bb_std_mult': 2.467966730329371, 'sideways_rsi_os': 49, 'sideways_rsi_ob': 82, 'sideways_adx_thresh': 13.671914110181433, 'sideways_atr_min_pct': 0.004291028523517402, 'sideways_atr_max_pct': 0.014655916135180002, 'sideways_tp_mult': 2.5143521227528525, 'sideways_tsl_mult': 0.21310495380403777, 'sideways_time_stop': 270, 'sideways_use_sma': True, 'sideways_use_ema': False, 'sideways_use_atr': False, 'sideways_use_adx': False, 'sideways_use_spike': True, 'sideways_rsi_required': False}.
[I 2025-08-31 10:40:21,463] Trial 399 finished with values: [-1000000000.0, 1000000000.0] and parameters: {'p_sma': 19, 'p_std': 57, 'p_atr': 16, 'p_adx': 15, 'rsi_period': 77, 'ema1': 13, 'ema2': 59, 'slip_atr_k': 0.23588517991714275, 'slip_spread_k': 0.2350068213409396, 'spread_hl_frac': 0.04450546018558153, 'bb_std_mult': 2.427865326323529, 'rsi_os': 39, 'rsi_ob': 74, 'vol_spike': 0.20579015793490052, 'adx_thresh': 22.314781851552226, 'atr_min_pct': 0.003457490375697956, 'atr_max_pct': 0.1207056647079221, 'tp_mult': 2.9362156700809017, 'tsl_mult': 0.5918120458235018, 'strategy': 'mean_reversion', 'time_stop': 129, 'use_sma': False, 'use_atr': False, 'use_adx': False, 'use_ema': True, 'use_spike': False, 'rsi_required': True, 'edge_k': 1.7172412997410444, 'edge_cap': 0.7666333934044154, 'bull_strategy': 'mean_reversion', 'bull_bb_std_mult': 1.727512755109461, 'bull_rsi_os': 42, 'bull_rsi_ob': 76, 'bull_adx_thresh': 9.85920942042881, 'bull_atr_min_pct': 0.002987798726163004, 'bull_atr_max_pct': 0.07853696066544236, 'bull_tp_mult': 1.3605845164134351, 'bull_tsl_mult': 0.08445317414227158, 'bull_time_stop': 266, 'bull_use_sma': True, 'bull_use_ema': True, 'bull_use_atr': True, 'bull_use_adx': False, 'bull_use_spike': True, 'bull_rsi_required': False, 'bear_strategy': 'breakout', 'bear_bb_std_mult': 2.139124917544475, 'bear_rsi_os': 29, 'bear_rsi_ob': 92, 'bear_adx_thresh': 24.81282753707257, 'bear_atr_min_pct': 0.015418227166847952, 'bear_atr_max_pct': 0.1309556794617456, 'bear_tp_mult': 2.720946858298358, 'bear_tsl_mult': 0.21710859053593468, 'bear_time_stop': 293, 'bear_use_sma': False, 'bear_use_ema': False, 'bear_use_atr': True, 'bear_use_adx': True, 'bear_use_spike': True, 'bear_rsi_required': True, 'sideways_strategy': 'breakout', 'sideways_bb_std_mult': 2.4623803279495484, 'sideways_rsi_os': 53, 'sideways_rsi_ob': 85, 'sideways_adx_thresh': 8.831499879254022, 'sideways_atr_min_pct': 0.0039607404539488454, 'sideways_atr_max_pct': 0.06085199027456947, 'sideways_tp_mult': 1.046794806062141, 'sideways_tsl_mult': 0.23380690629260575, 'sideways_time_stop': 269, 'sideways_use_sma': True, 'sideways_use_ema': True, 'sideways_use_atr': False, 'sideways_use_adx': False, 'sideways_use_spike': True, 'sideways_rsi_required': False}.
[I 2025-08-31 10:40:22,269] Trial 403 finished with values: [-1000000000.0, 1000000000.0] and parameters: {'p_sma': 22, 'p_std': 38, 'p_atr': 17, 'p_adx': 8, 'rsi_period': 80, 'ema1': 20, 'ema2': 25, 'slip_atr_k': 0.07439828987684804, 'slip_spread_k': 0.2779801125831086, 'spread_hl_frac': 0.033972935595082805, 'bb_std_mult': 2.6384400970332287, 'rsi_os': 55, 'rsi_ob': 82, 'vol_spike': 0.1920591786518764, 'adx_thresh': 9.596568693900643, 'atr_min_pct': 0.018409878834588767, 'atr_max_pct': 0.14979835231828081, 'tp_mult': 2.8651647596311993, 'tsl_mult': 0.4510807590422379, 'strategy': 'mean_reversion', 'time_stop': 142, 'use_sma': False, 'use_atr': False, 'use_adx': True, 'use_ema': False, 'use_spike': True, 'rsi_required': False, 'edge_k': 0.17820637033700149, 'edge_cap': 0.2603424295479579, 'bull_strategy': 'breakout', 'bull_bb_std_mult': 0.8032445156927015, 'bull_rsi_os': 42, 'bull_rsi_ob': 73, 'bull_adx_thresh': 8.320502250296746, 'bull_atr_min_pct': 0.0035714794979285645, 'bull_atr_max_pct': 0.06691874522355368, 'bull_tp_mult': 1.4214132233215468, 'bull_tsl_mult': 0.11963020796796209, 'bull_time_stop': 26, 'bull_use_sma': True, 'bull_use_ema': True, 'bull_use_atr': True, 'bull_use_adx': True, 'bull_use_spike': True, 'bull_rsi_required': False, 'bear_strategy': 'breakout', 'bear_bb_std_mult': 0.7314365786748884, 'bear_rsi_os': 28, 'bear_rsi_ob': 57, 'bear_adx_thresh': 6.462466358690462, 'bear_atr_min_pct': 0.016166185906621763, 'bear_atr_max_pct': 0.07289239908644944, 'bear_tp_mult': 2.2850775560451795, 'bear_tsl_mult': 0.12742752020396111, 'bear_time_stop': 114, 'bear_use_sma': True, 'bear_use_ema': False, 'bear_use_atr': False, 'bear_use_adx': False, 'bear_use_spike': True, 'bear_rsi_required': True, 'sideways_strategy': 'mean_reversion', 'sideways_bb_std_mult': 0.8711169389994822, 'sideways_rsi_os': 32, 'sideways_rsi_ob': 86, 'sideways_adx_thresh': 18.595848603980162, 'sideways_atr_min_pct': 0.0022093996856687842, 'sideways_atr_max_pct': 0.010102392013966618, 'sideways_tp_mult': 1.228778020049603, 'sideways_tsl_mult': 0.4697331331386239, 'sideways_time_stop': 205, 'sideways_use_sma': True, 'sideways_use_ema': False, 'sideways_use_atr': False, 'sideways_use_adx': True, 'sideways_use_spike': True, 'sideways_rsi_required': False}.
[I 2025-08-31 10:40:51,030] Trial 401 finished with values: [-1000000000.0, 1000000000.0] and parameters: {'p_sma': 55, 'p_std': 29, 'p_atr': 17, 'p_adx': 15, 'rsi_period': 77, 'ema1': 20, 'ema2': 47, 'slip_atr_k': 0.2311602152767791, 'slip_spread_k': 0.2328419388026227, 'spread_hl_frac': 0.04399471476728192, 'bb_std_mult': 2.445619020415307, 'rsi_os': 39, 'rsi_ob': 73, 'vol_spike': 0.22500673493473344, 'adx_thresh': 9.932186898589055, 'atr_min_pct': 0.023199616595464462, 'atr_max_pct': 0.11825968403883554, 'tp_mult': 2.5499735077266807, 'tsl_mult': 0.7944268674837843, 'strategy': 'mean_reversion', 'time_stop': 128, 'use_sma': False, 'use_atr': False, 'use_adx': True, 'use_ema': False, 'use_spike': False, 'rsi_required': True, 'edge_k': 1.7620095770341746, 'edge_cap': 0.1374223751489831, 'bull_strategy': 'mean_reversion', 'bull_bb_std_mult': 0.8060087296617556, 'bull_rsi_os': 42, 'bull_rsi_ob': 73, 'bull_adx_thresh': 10.058031731416529, 'bull_atr_min_pct': 0.002899288694717025, 'bull_atr_max_pct': 0.06225707957622757, 'bull_tp_mult': 1.1378180016820518, 'bull_tsl_mult': 0.3468582455818181, 'bull_time_stop': 27, 'bull_use_sma': True, 'bull_use_ema': True, 'bull_use_atr': True, 'bull_use_adx': True, 'bull_use_spike': True, 'bull_rsi_required': False, 'bear_strategy': 'breakout', 'bear_bb_std_mult': 0.9827775209663772, 'bear_rsi_os': 45, 'bear_rsi_ob': 46, 'bear_adx_thresh': 25.04140188212792, 'bear_atr_min_pct': 0.014112476311996422, 'bear_atr_max_pct': 0.13058052653712396, 'bear_tp_mult': 2.651807031723191, 'bear_tsl_mult': 0.12329865214966977, 'bear_time_stop': 33, 'bear_use_sma': False, 'bear_use_ema': False, 'bear_use_atr': False, 'bear_use_adx': False, 'bear_use_spike': True, 'bear_rsi_required': True, 'sideways_strategy': 'breakout', 'sideways_bb_std_mult': 2.8034081926450707, 'sideways_rsi_os': 49, 'sideways_rsi_ob': 86, 'sideways_adx_thresh': 13.674794949894286, 'sideways_atr_min_pct': 0.019596383960748344, 'sideways_atr_max_pct': 0.010176906410531157, 'sideways_tp_mult': 1.5278083445211847, 'sideways_tsl_mult': 0.46892446525867304, 'sideways_time_stop': 248, 'sideways_use_sma': True, 'sideways_use_ema': False, 'sideways_use_atr': False, 'sideways_use_adx': False, 'sideways_use_spike': True, 'sideways_rsi_required': False}.
[I 2025-08-31 10:40:51,247] Trial 400 finished with values: [-1000000000.0, 1000000000.0] and parameters: {'p_sma': 56, 'p_std': 29, 'p_atr': 16, 'p_adx': 30, 'rsi_period': 26, 'ema1': 26, 'ema2': 25, 'slip_atr_k': 0.013184204247515513, 'slip_spread_k': 0.13521270398476692, 'spread_hl_frac': 0.03876245987844609, 'bb_std_mult': 2.7192195724233823, 'rsi_os': 39, 'rsi_ob': 76, 'vol_spike': 0.2364086262986826, 'adx_thresh': 9.6761668428434, 'atr_min_pct': 0.019471104149010824, 'atr_max_pct': 0.12068765541098267, 'tp_mult': 2.672848181880514, 'tsl_mult': 0.4472549777057744, 'strategy': 'mean_reversion', 'time_stop': 149, 'use_sma': False, 'use_atr': False, 'use_adx': True, 'use_ema': False, 'use_spike': False, 'rsi_required': True, 'edge_k': 0.4790771665867738, 'edge_cap': 0.11673192301316387, 'bull_strategy': 'mean_reversion', 'bull_bb_std_mult': 1.7894709446036763, 'bull_rsi_os': 42, 'bull_rsi_ob': 83, 'bull_adx_thresh': 15.234157275282167, 'bull_atr_min_pct': 0.002932827492516462, 'bull_atr_max_pct': 0.07878763799818246, 'bull_tp_mult': 1.8382470888249767, 'bull_tsl_mult': 0.34500707655612395, 'bull_time_stop': 26, 'bull_use_sma': True, 'bull_use_ema': True, 'bull_use_atr': True, 'bull_use_adx': True, 'bull_use_spike': True, 'bull_rsi_required': False, 'bear_strategy': 'breakout', 'bear_bb_std_mult': 0.732844107570269, 'bear_rsi_os': 5, 'bear_rsi_ob': 57, 'bear_adx_thresh': 28.450794171677085, 'bear_atr_min_pct': 0.015419078030080503, 'bear_atr_max_pct': 0.1304931804943458, 'bear_tp_mult': 1.2539659145187085, 'bear_tsl_mult': 0.189274145711003, 'bear_time_stop': 293, 'bear_use_sma': True, 'bear_use_ema': False, 'bear_use_atr': False, 'bear_use_adx': False, 'bear_use_spike': True, 'bear_rsi_required': True, 'sideways_strategy': 'breakout', 'sideways_bb_std_mult': 2.823716763068382, 'sideways_rsi_os': 51, 'sideways_rsi_ob': 74, 'sideways_adx_thresh': 8.91749315829642, 'sideways_atr_min_pct': 0.029107428381191323, 'sideways_atr_max_pct': 0.07186464705403366, 'sideways_tp_mult': 1.81932948290739, 'sideways_tsl_mult': 0.0024475431588199537, 'sideways_time_stop': 118, 'sideways_use_sma': True, 'sideways_use_ema': False, 'sideways_use_atr': False, 'sideways_use_adx': True, 'sideways_use_spike': True, 'sideways_rsi_required': False}.
[I 2025-08-31 10:40:53,129] Trial 402 finished with values: [-1000000000.0, 1000000000.0] and parameters: {'p_sma': 22, 'p_std': 46, 'p_atr': 17, 'p_adx': 8, 'rsi_period': 80, 'ema1': 13, 'ema2': 39, 'slip_atr_k': 0.011558556888167065, 'slip_spread_k': 0.23853770792988419, 'spread_hl_frac': 0.04427748551052592, 'bb_std_mult': 1.9090620848747122, 'rsi_os': 39, 'rsi_ob': 73, 'vol_spike': 0.22503610970262053, 'adx_thresh': 22.5270020220473, 'atr_min_pct': 0.0036115685528770106, 'atr_max_pct': 0.11263797668132683, 'tp_mult': 2.67992186360472, 'tsl_mult': 0.6466122556155756, 'strategy': 'mean_reversion', 'time_stop': 161, 'use_sma': False, 'use_atr': False, 'use_adx': True, 'use_ema': False, 'use_spike': True, 'rsi_required': True, 'edge_k': 1.258362060245898, 'edge_cap': 0.1369514246276208, 'bull_strategy': 'mean_reversion', 'bull_bb_std_mult': 1.7972805784514405, 'bull_rsi_os': 19, 'bull_rsi_ob': 76, 'bull_adx_thresh': 10.03999088339594, 'bull_atr_min_pct': 0.0031582629282750152, 'bull_atr_max_pct': 0.07781599256463753, 'bull_tp_mult': 1.844905436886293, 'bull_tsl_mult': 0.6132538799989031, 'bull_time_stop': 26, 'bull_use_sma': True, 'bull_use_ema': True, 'bull_use_atr': True, 'bull_use_adx': True, 'bull_use_spike': True, 'bull_rsi_required': False, 'bear_strategy': 'breakout', 'bear_bb_std_mult': 1.9898954443784307, 'bear_rsi_os': 7, 'bear_rsi_ob': 57, 'bear_adx_thresh': 34.22977188241978, 'bear_atr_min_pct': 0.016112866991193693, 'bear_atr_max_pct': 0.109927178902733, 'bear_tp_mult': 1.3833466914696357, 'bear_tsl_mult': 0.7135108343579881, 'bear_time_stop': 32, 'bear_use_sma': True, 'bear_use_ema': False, 'bear_use_atr': False, 'bear_use_adx': False, 'bear_use_spike': True, 'bear_rsi_required': True, 'sideways_strategy': 'breakout', 'sideways_bb_std_mult': 2.848861689417703, 'sideways_rsi_os': 32, 'sideways_rsi_ob': 86, 'sideways_adx_thresh': 15.908120280568976, 'sideways_atr_min_pct': 0.01068495454856387, 'sideways_atr_max_pct': 0.12751229595265154, 'sideways_tp_mult': 1.5412926480071019, 'sideways_tsl_mult': 0.8256488795859662, 'sideways_time_stop': 258, 'sideways_use_sma': True, 'sideways_use_ema': False, 'sideways_use_atr': False, 'sideways_use_adx': True, 'sideways_use_spike': True, 'sideways_rsi_required': False}.
[I 2025-08-31 10:40:53,539] Trial 404 finished with values: [-1000000000.0, 1000000000.0] and parameters: {'p_sma': 20, 'p_std': 35, 'p_atr': 17, 'p_adx': 8, 'rsi_period': 19, 'ema1': 18, 'ema2': 58, 'slip_atr_k': 0.0662292475807118, 'slip_spread_k': 0.1432014260981775, 'spread_hl_frac': 0.015242098568914121, 'bb_std_mult': 2.6967315623243198, 'rsi_os': 42, 'rsi_ob': 73, 'vol_spike': 0.21279147933885156, 'adx_thresh': 8.190857887530406, 'atr_min_pct': 0.01607694298116783, 'atr_max_pct': 0.04498294266417837, 'tp_mult': 2.551562841613389, 'tsl_mult': 0.6525307983469223, 'strategy': 'breakout', 'time_stop': 262, 'use_sma': True, 'use_atr': False, 'use_adx': True, 'use_ema': False, 'use_spike': True, 'rsi_required': True, 'edge_k': 1.6259570818482783, 'edge_cap': 0.5662214268389024, 'bull_strategy': 'mean_reversion', 'bull_bb_std_mult': 1.8106031709470596, 'bull_rsi_os': 19, 'bull_rsi_ob': 83, 'bull_adx_thresh': 11.083687235305705, 'bull_atr_min_pct': 0.012472284988032632, 'bull_atr_max_pct': 0.13745014756696686, 'bull_tp_mult': 2.9165757148512395, 'bull_tsl_mult': 0.6141290930081765, 'bull_time_stop': 10, 'bull_use_sma': True, 'bull_use_ema': True, 'bull_use_atr': True, 'bull_use_adx': True, 'bull_use_spike': False, 'bull_rsi_required': False, 'bear_strategy': 'breakout', 'bear_bb_std_mult': 1.9669207767381018, 'bear_rsi_os': 7, 'bear_rsi_ob': 88, 'bear_adx_thresh': 34.347035894958054, 'bear_atr_min_pct': 0.003943386607204948, 'bear_atr_max_pct': 0.12038637328518416, 'bear_tp_mult': 1.3861323794429732, 'bear_tsl_mult': 0.7195224295797249, 'bear_time_stop': 44, 'bear_use_sma': False, 'bear_use_ema': False, 'bear_use_atr': False, 'bear_use_adx': False, 'bear_use_spike': False, 'bear_rsi_required': False, 'sideways_strategy': 'breakout', 'sideways_bb_std_mult': 2.8316535650064143, 'sideways_rsi_os': 36, 'sideways_rsi_ob': 84, 'sideways_adx_thresh': 26.553989712844, 'sideways_atr_min_pct': 0.01975617826273085, 'sideways_atr_max_pct': 0.0307012395869111, 'sideways_tp_mult': 1.8256447818902115, 'sideways_tsl_mult': 0.7942930709553034, 'sideways_time_stop': 257, 'sideways_use_sma': True, 'sideways_use_ema': False, 'sideways_use_atr': True, 'sideways_use_adx': False, 'sideways_use_spike': False, 'sideways_rsi_required': True}.
