[I 2025-08-31 10:26:11,724] Trial 280 finished with values: [-1000000000.0, 1000000000.0] and parameters: {'p_sma': 51, 'p_std': 34, 'p_atr': 12, 'p_adx': 8, 'rsi_period': 56, 'ema1': 11, 'ema2': 45, 'slip_atr_k': 0.060608247354642646, 'slip_spread_k': 0.056258452527341296, 'spread_hl_frac': 0.042143623258841495, 'bb_std_mult': 2.530030266280063, 'rsi_os': 5, 'rsi_ob': 80, 'vol_spike': 0.19869407856842733, 'adx_thresh': 11.575720108780699, 'atr_min_pct': 0.019388077716403336, 'atr_max_pct': 0.03491739567543771, 'tp_mult': 2.4434972452068795, 'tsl_mult': 0.5448776150023953, 'strategy': 'mean_reversion', 'time_stop': 140, 'use_sma': False, 'use_atr': False, 'use_adx': True, 'use_ema': False, 'use_spike': True, 'rsi_required': True, 'edge_k': 1.5687852736657506, 'edge_cap': 0.1522769904594038, 'bull_strategy': 'breakout', 'bull_bb_std_mult': 2.3414665462800563, 'bull_rsi_os': 18, 'bull_rsi_ob': 83, 'bull_adx_thresh': 24.7581123523314, 'bull_atr_min_pct': 0.0137233749486691, 'bull_atr_max_pct': 0.0795878996604927, 'bull_tp_mult': 1.8226543314164863, 'bull_tsl_mult': 0.9943185990740364, 'bull_time_stop': 29, 'bull_use_sma': True, 'bull_use_ema': True, 'bull_use_atr': True, 'bull_use_adx': True, 'bull_use_spike': True, 'bull_rsi_required': False, 'bear_strategy': 'breakout', 'bear_bb_std_mult': 0.9436605068252857, 'bear_rsi_os': 40, 'bear_rsi_ob': 55, 'bear_adx_thresh': 30.778318557068523, 'bear_atr_min_pct': 0.00456411055528916, 'bear_atr_max_pct': 0.13231250355216112, 'bear_tp_mult': 1.0758812025941848, 'bear_tsl_mult': 0.1390826455368042, 'bear_time_stop': 35, 'bear_use_sma': False, 'bear_use_ema': False, 'bear_use_atr': True, 'bear_use_adx': False, 'bear_use_spike': True, 'bear_rsi_required': True, 'sideways_strategy': 'breakout', 'sideways_bb_std_mult': 2.4256184886089236, 'sideways_rsi_os': 37, 'sideways_rsi_ob': 88, 'sideways_adx_thresh': 16.34156208127589, 'sideways_atr_min_pct': 0.0015112338325074643, 'sideways_atr_max_pct': 0.018097957470546062, 'sideways_tp_mult': 1.1030587615624918, 'sideways_tsl_mult': 0.6856522347490871, 'sideways_time_stop': 262, 'sideways_use_sma': True, 'sideways_use_ema': False, 'sideways_use_atr': False, 'sideways_use_adx': False, 'sideways_use_spike': True, 'sideways_rsi_required': False}.
[I 2025-08-31 10:26:11,926] Trial 277 finished with values: [-1000000000.0, 1000000000.0] and parameters: {'p_sma': 16, 'p_std': 34, 'p_atr': 16, 'p_adx': 25, 'rsi_period': 12, 'ema1': 11, 'ema2': 46, 'slip_atr_k': 0.24271094870003238, 'slip_spread_k': 0.4928306006062384, 'spread_hl_frac': 0.03034243183734469, 'bb_std_mult': 2.5237814622807253, 'rsi_os': 32, 'rsi_ob': 74, 'vol_spike': 0.20674577464001018, 'adx_thresh': 25.50196312583666, 'atr_min_pct': 0.018886879029867524, 'atr_max_pct': 0.0385031909186773, 'tp_mult': 1.695870825355669, 'tsl_mult': 0.42236202387192706, 'strategy': 'mean_reversion', 'time_stop': 209, 'use_sma': False, 'use_atr': False, 'use_adx': True, 'use_ema': False, 'use_spike': True, 'rsi_required': False, 'edge_k': 0.14230009664066645, 'edge_cap': 0.6653365178677383, 'bull_strategy': 'breakout', 'bull_bb_std_mult': 1.0991006443559022, 'bull_rsi_os': 34, 'bull_rsi_ob': 73, 'bull_adx_thresh': 10.372504863769777, 'bull_atr_min_pct': 0.013733480558522634, 'bull_atr_max_pct': 0.09078998111656125, 'bull_tp_mult': 1.736079031812652, 'bull_tsl_mult': 0.9853534024892012, 'bull_time_stop': 26, 'bull_use_sma': False, 'bull_use_ema': True, 'bull_use_atr': False, 'bull_use_adx': True, 'bull_use_spike': True, 'bull_rsi_required': False, 'bear_strategy': 'mean_reversion', 'bear_bb_std_mult': 2.050632242098044, 'bear_rsi_os': 6, 'bear_rsi_ob': 58, 'bear_adx_thresh': 7.299539855069873, 'bear_atr_min_pct': 0.015526430310266228, 'bear_atr_max_pct': 0.025600327711996843, 'bear_tp_mult': 1.3699443628290877, 'bear_tsl_mult': 0.14190684098605325, 'bear_time_stop': 36, 'bear_use_sma': False, 'bear_use_ema': False, 'bear_use_atr': False, 'bear_use_adx': True, 'bear_use_spike': False, 'bear_rsi_required': True, 'sideways_strategy': 'mean_reversion', 'sideways_bb_std_mult': 2.6425416669122326, 'sideways_rsi_os': 36, 'sideways_rsi_ob': 84, 'sideways_adx_thresh': 22.74744308756204, 'sideways_atr_min_pct': 0.004013575334245104, 'sideways_atr_max_pct': 0.017605854979310727, 'sideways_tp_mult': 1.7516394542504976, 'sideways_tsl_mult': 0.6862863075984877, 'sideways_time_stop': 261, 'sideways_use_sma': True, 'sideways_use_ema': False, 'sideways_use_atr': True, 'sideways_use_adx': False, 'sideways_use_spike': True, 'sideways_rsi_required': False}.
[I 2025-08-31 10:26:43,464] Trial 282 finished with values: [-0.06359143101006726, 0.06359055548016934] and parameters: {'p_sma': 37, 'p_std': 34, 'p_atr': 7, 'p_adx': 8, 'rsi_period': 18, 'ema1': 11, 'ema2': 59, 'slip_atr_k': 0.09413654571433056, 'slip_spread_k': 0.24194446734448583, 'spread_hl_frac': 0.027790992001970556, 'bb_std_mult': 2.5882507247476303, 'rsi_os': 29, 'rsi_ob': 54, 'vol_spike': 0.18694403018139938, 'adx_thresh': 11.5636695747884, 'atr_min_pct': 0.02080413796979064, 'atr_max_pct': 0.09306112562003171, 'tp_mult': 1.3306350576076644, 'tsl_mult': 0.9174134481331566, 'strategy': 'mean_reversion', 'time_stop': 55, 'use_sma': False, 'use_atr': False, 'use_adx': True, 'use_ema': False, 'use_spike': True, 'rsi_required': True, 'edge_k': 1.5665952293949232, 'edge_cap': 0.1507199076305329, 'bull_strategy': 'breakout', 'bull_bb_std_mult': 0.8967674274289787, 'bull_rsi_os': 39, 'bull_rsi_ob': 78, 'bull_adx_thresh': 10.359763719246546, 'bull_atr_min_pct': 0.0016855845561367364, 'bull_atr_max_pct': 0.06705582291766336, 'bull_tp_mult': 1.289924193803338, 'bull_tsl_mult': 0.5755537863604766, 'bull_time_stop': 245, 'bull_use_sma': True, 'bull_use_ema': True, 'bull_use_atr': True, 'bull_use_adx': True, 'bull_use_spike': True, 'bull_rsi_required': False, 'bear_strategy': 'breakout', 'bear_bb_std_mult': 2.7307920223301534, 'bear_rsi_os': 26, 'bear_rsi_ob': 84, 'bear_adx_thresh': 6.1970851245484395, 'bear_atr_min_pct': 0.016714389830780125, 'bear_atr_max_pct': 0.11837708557278265, 'bear_tp_mult': 2.584886962413332, 'bear_tsl_mult': 0.5366614042048049, 'bear_time_stop': 87, 'bear_use_sma': False, 'bear_use_ema': False, 'bear_use_atr': True, 'bear_use_adx': False, 'bear_use_spike': True, 'bear_rsi_required': True, 'sideways_strategy': 'breakout', 'sideways_bb_std_mult': 2.0762287830342365, 'sideways_rsi_os': 36, 'sideways_rsi_ob': 80, 'sideways_adx_thresh': 22.981270029825, 'sideways_atr_min_pct': 0.0007618050834197533, 'sideways_atr_max_pct': 0.017742325224919607, 'sideways_tp_mult': 1.1799162353233899, 'sideways_tsl_mult': 0.8148456776190586, 'sideways_time_stop': 255, 'sideways_use_sma': True, 'sideways_use_ema': False, 'sideways_use_atr': False, 'sideways_use_adx': False, 'sideways_use_spike': True, 'sideways_rsi_required': False}.
[I 2025-08-31 10:26:43,560] Trial 284 finished with values: [-1000000000.0, 1000000000.0] and parameters: {'p_sma': 37, 'p_std': 43, 'p_atr': 17, 'p_adx': 8, 'rsi_period': 31, 'ema1': 12, 'ema2': 59, 'slip_atr_k': 0.09284523040029126, 'slip_spread_k': 0.30037339690153325, 'spread_hl_frac': 0.028094360490980182, 'bb_std_mult': 2.6042028625960056, 'rsi_os': 41, 'rsi_ob': 75, 'vol_spike': 0.1887757734033696, 'adx_thresh': 7.438813779542985, 'atr_min_pct': 0.02097280392298949, 'atr_max_pct': 0.09222400400130906, 'tp_mult': 1.337128309342432, 'tsl_mult': 0.466027169622881, 'strategy': 'mean_reversion', 'time_stop': 144, 'use_sma': False, 'use_atr': False, 'use_adx': True, 'use_ema': False, 'use_spike': True, 'rsi_required': True, 'edge_k': 1.677512027794411, 'edge_cap': 0.08659640754946402, 'bull_strategy': 'breakout', 'bull_bb_std_mult': 0.8518131501872908, 'bull_rsi_os': 48, 'bull_rsi_ob': 78, 'bull_adx_thresh': 15.26962184931093, 'bull_atr_min_pct': 0.01495838804786719, 'bull_atr_max_pct': 0.12396649526406604, 'bull_tp_mult': 1.64633630433984, 'bull_tsl_mult': 0.07934536302186239, 'bull_time_stop': 261, 'bull_use_sma': True, 'bull_use_ema': True, 'bull_use_atr': True, 'bull_use_adx': True, 'bull_use_spike': True, 'bull_rsi_required': False, 'bear_strategy': 'breakout', 'bear_bb_std_mult': 2.236272500476392, 'bear_rsi_os': 29, 'bear_rsi_ob': 59, 'bear_adx_thresh': 32.23358881997475, 'bear_atr_min_pct': 0.01685529392092304, 'bear_atr_max_pct': 0.12609401631563996, 'bear_tp_mult': 1.1737189553136171, 'bear_tsl_mult': 0.17458331420383671, 'bear_time_stop': 263, 'bear_use_sma': False, 'bear_use_ema': False, 'bear_use_atr': True, 'bear_use_adx': False, 'bear_use_spike': True, 'bear_rsi_required': True, 'sideways_strategy': 'breakout', 'sideways_bb_std_mult': 3.317183185226654, 'sideways_rsi_os': 30, 'sideways_rsi_ob': 78, 'sideways_adx_thresh': 10.801516732557696, 'sideways_atr_min_pct': 0.02001033053217418, 'sideways_atr_max_pct': 0.012157820057655786, 'sideways_tp_mult': 1.181434347393378, 'sideways_tsl_mult': 0.24973264685727614, 'sideways_time_stop': 116, 'sideways_use_sma': False, 'sideways_use_ema': False, 'sideways_use_atr': False, 'sideways_use_adx': False, 'sideways_use_spike': True, 'sideways_rsi_required': False}.
[I 2025-08-31 10:26:43,663] Trial 283 finished with values: [-1000000000.0, 1000000000.0] and parameters: {'p_sma': 20, 'p_std': 42, 'p_atr': 18, 'p_adx': 8, 'rsi_period': 18, 'ema1': 6, 'ema2': 59, 'slip_atr_k': 0.228701157309751, 'slip_spread_k': 0.48068406406750064, 'spread_hl_frac': 0.027891823102943948, 'bb_std_mult': 2.578880828803018, 'rsi_os': 29, 'rsi_ob': 77, 'vol_spike': 0.21988816160640093, 'adx_thresh': 7.509487327282742, 'atr_min_pct': 0.0022834570618260764, 'atr_max_pct': 0.04597032233146301, 'tp_mult': 1.5294331870404174, 'tsl_mult': 0.9089090557733952, 'strategy': 'mean_reversion', 'time_stop': 145, 'use_sma': False, 'use_atr': False, 'use_adx': True, 'use_ema': False, 'use_spike': True, 'rsi_required': True, 'edge_k': 1.452336852151573, 'edge_cap': 0.6340664998927946, 'bull_strategy': 'breakout', 'bull_bb_std_mult': 0.8675206572886714, 'bull_rsi_os': 48, 'bull_rsi_ob': 75, 'bull_adx_thresh': 5.5555844020604646, 'bull_atr_min_pct': 0.014453656878686511, 'bull_atr_max_pct': 0.06564624467598486, 'bull_tp_mult': 1.6560607046632922, 'bull_tsl_mult': 0.07078433453601733, 'bull_time_stop': 13, 'bull_use_sma': True, 'bull_use_ema': True, 'bull_use_atr': True, 'bull_use_adx': True, 'bull_use_spike': True, 'bull_rsi_required': False, 'bear_strategy': 'breakout', 'bear_bb_std_mult': 2.210252935302107, 'bear_rsi_os': 29, 'bear_rsi_ob': 45, 'bear_adx_thresh': 30.178649961058028, 'bear_atr_min_pct': 0.016574340764882112, 'bear_atr_max_pct': 0.1456317642123096, 'bear_tp_mult': 2.5927698457335198, 'bear_tsl_mult': 0.170399171466097, 'bear_time_stop': 268, 'bear_use_sma': False, 'bear_use_ema': False, 'bear_use_atr': True, 'bear_use_adx': False, 'bear_use_spike': True, 'bear_rsi_required': True, 'sideways_strategy': 'breakout', 'sideways_bb_std_mult': 3.1337657060870896, 'sideways_rsi_os': 35, 'sideways_rsi_ob': 83, 'sideways_adx_thresh': 31.033100896181363, 'sideways_atr_min_pct': 0.003878756155045224, 'sideways_atr_max_pct': 0.1429455135763888, 'sideways_tp_mult': 1.1885741226279676, 'sideways_tsl_mult': 0.33546642914178054, 'sideways_time_stop': 113, 'sideways_use_sma': True, 'sideways_use_ema': False, 'sideways_use_atr': False, 'sideways_use_adx': False, 'sideways_use_spike': True, 'sideways_rsi_required': False}.
[I 2025-08-31 10:26:44,120] Trial 281 finished with values: [-0.013973164350083445, 0.014071648439033106] and parameters: {'p_sma': 37, 'p_std': 34, 'p_atr': 17, 'p_adx': 8, 'rsi_period': 10, 'ema1': 11, 'ema2': 59, 'slip_atr_k': 0.07507847539430951, 'slip_spread_k': 0.37792860895866554, 'spread_hl_frac': 0.027799960020606796, 'bb_std_mult': 2.5540413207188717, 'rsi_os': 41, 'rsi_ob': 87, 'vol_spike': 0.21746759557310646, 'adx_thresh': 25.46760912760444, 'atr_min_pct': 0.020982773130411095, 'atr_max_pct': 0.063005221193289, 'tp_mult': 2.7373599739382684, 'tsl_mult': 0.428831863817297, 'strategy': 'mean_reversion', 'time_stop': 141, 'use_sma': False, 'use_atr': False, 'use_adx': True, 'use_ema': False, 'use_spike': True, 'rsi_required': True, 'edge_k': 1.462706347029812, 'edge_cap': 0.14797188290766572, 'bull_strategy': 'breakout', 'bull_bb_std_mult': 0.8685160836499264, 'bull_rsi_os': 16, 'bull_rsi_ob': 78, 'bull_adx_thresh': 18.844272860688452, 'bull_atr_min_pct': 0.01367798406107379, 'bull_atr_max_pct': 0.09484712804428577, 'bull_tp_mult': 2.9963501581295455, 'bull_tsl_mult': 0.9686393878931795, 'bull_time_stop': 17, 'bull_use_sma': True, 'bull_use_ema': True, 'bull_use_atr': True, 'bull_use_adx': True, 'bull_use_spike': True, 'bull_rsi_required': False, 'bear_strategy': 'breakout', 'bear_bb_std_mult': 2.0329793394308866, 'bear_rsi_os': 26, 'bear_rsi_ob': 55, 'bear_adx_thresh': 6.9614962526852295, 'bear_atr_min_pct': 0.019400948396346974, 'bear_atr_max_pct': 0.12584797110277926, 'bear_tp_mult': 1.2706016442594898, 'bear_tsl_mult': 0.14297428830638934, 'bear_time_stop': 88, 'bear_use_sma': False, 'bear_use_ema': False, 'bear_use_atr': True, 'bear_use_adx': False, 'bear_use_spike': True, 'bear_rsi_required': True, 'sideways_strategy': 'breakout', 'sideways_bb_std_mult': 3.1285728611410457, 'sideways_rsi_os': 36, 'sideways_rsi_ob': 78, 'sideways_adx_thresh': 22.796252129958468, 'sideways_atr_min_pct': 0.00274888991425751, 'sideways_atr_max_pct': 0.017365723420611448, 'sideways_tp_mult': 1.184603298185285, 'sideways_tsl_mult': 0.02664321734699132, 'sideways_time_stop': 255, 'sideways_use_sma': True, 'sideways_use_ema': False, 'sideways_use_atr': False, 'sideways_use_adx': False, 'sideways_use_spike': True, 'sideways_rsi_required': False}.
[I 2025-08-31 10:26:44,635] Trial 286 finished with values: [-1000000000.0, 1000000000.0] and parameters: {'p_sma': 20, 'p_std': 23, 'p_atr': 18, 'p_adx': 7, 'rsi_period': 27, 'ema1': 14, 'ema2': 37, 'slip_atr_k': 0.07500740553544726, 'slip_spread_k': 0.37445292758581106, 'spread_hl_frac': 0.03208415386872886, 'bb_std_mult': 2.409285301740346, 'rsi_os': 52, 'rsi_ob': 77, 'vol_spike': 0.2177098885240896, 'adx_thresh': 18.033898062575446, 'atr_min_pct': 0.019780533159367234, 'atr_max_pct': 0.07134265419071131, 'tp_mult': 1.5417710460135503, 'tsl_mult': 0.30640722179178626, 'strategy': 'mean_reversion', 'time_stop': 136, 'use_sma': False, 'use_atr': False, 'use_adx': False, 'use_ema': False, 'use_spike': True, 'rsi_required': True, 'edge_k': 1.8450718026784139, 'edge_cap': 0.16891843745646862, 'bull_strategy': 'breakout', 'bull_bb_std_mult': 3.048949333383851, 'bull_rsi_os': 36, 'bull_rsi_ob': 75, 'bull_adx_thresh': 7.753393050405714, 'bull_atr_min_pct': 0.008190656589157226, 'bull_atr_max_pct': 0.04041682710530337, 'bull_tp_mult': 1.2119423229865565, 'bull_tsl_mult': 0.059144885718912556, 'bull_time_stop': 38, 'bull_use_sma': True, 'bull_use_ema': True, 'bull_use_atr': True, 'bull_use_adx': True, 'bull_use_spike': False, 'bull_rsi_required': False, 'bear_strategy': 'breakout', 'bear_bb_std_mult': 1.8864090687145543, 'bear_rsi_os': 34, 'bear_rsi_ob': 45, 'bear_adx_thresh': 30.14128679695994, 'bear_atr_min_pct': 0.019325438749601576, 'bear_atr_max_pct': 0.12578711768627368, 'bear_tp_mult': 1.2857653197852716, 'bear_tsl_mult': 0.8049381654877095, 'bear_time_stop': 271, 'bear_use_sma': False, 'bear_use_ema': False, 'bear_use_atr': True, 'bear_use_adx': False, 'bear_use_spike': True, 'bear_rsi_required': True, 'sideways_strategy': 'breakout', 'sideways_bb_std_mult': 2.547355730078909, 'sideways_rsi_os': 35, 'sideways_rsi_ob': 83, 'sideways_adx_thresh': 8.799004942523148, 'sideways_atr_min_pct': 0.0028692075015451742, 'sideways_atr_max_pct': 0.08789571003948517, 'sideways_tp_mult': 1.2333152237806013, 'sideways_tsl_mult': 0.1895949375041292, 'sideways_time_stop': 74, 'sideways_use_sma': True, 'sideways_use_ema': False, 'sideways_use_atr': False, 'sideways_use_adx': False, 'sideways_use_spike': True, 'sideways_rsi_required': False}.
[I 2025-08-31 10:26:44,702] Trial 288 finished with values: [-1000000000.0, 1000000000.0] and parameters: {'p_sma': 21, 'p_std': 29, 'p_atr': 17, 'p_adx': 21, 'rsi_period': 74, 'ema1': 14, 'ema2': 50, 'slip_atr_k': 0.14150690382086126, 'slip_spread_k': 0.286228166389819, 'spread_hl_frac': 0.025190893011173946, 'bb_std_mult': 2.414484536483144, 'rsi_os': 52, 'rsi_ob': 52, 'vol_spike': 0.2857516718599181, 'adx_thresh': 8.214656428954834, 'atr_min_pct': 0.019753185955065665, 'atr_max_pct': 0.13377338201617528, 'tp_mult': 1.1162448258668352, 'tsl_mult': 0.3823488921811894, 'strategy': 'mean_reversion', 'time_stop': 152, 'use_sma': False, 'use_atr': False, 'use_adx': False, 'use_ema': False, 'use_spike': True, 'rsi_required': True, 'edge_k': 1.7252653069317714, 'edge_cap': 0.17642950112393838, 'bull_strategy': 'breakout', 'bull_bb_std_mult': 1.0086598879763726, 'bull_rsi_os': 36, 'bull_rsi_ob': 76, 'bull_adx_thresh': 12.036528940438595, 'bull_atr_min_pct': 0.004195610328433946, 'bull_atr_max_pct': 0.13977655426808427, 'bull_tp_mult': 1.2219102429936382, 'bull_tsl_mult': 0.09929492893310114, 'bull_time_stop': 19, 'bull_use_sma': True, 'bull_use_ema': True, 'bull_use_atr': True, 'bull_use_adx': True, 'bull_use_spike': False, 'bull_rsi_required': False, 'bear_strategy': 'breakout', 'bear_bb_std_mult': 1.9229510727134063, 'bear_rsi_os': 15, 'bear_rsi_ob': 77, 'bear_adx_thresh': 8.93394884745075, 'bear_atr_min_pct': 0.01765802830024353, 'bear_atr_max_pct': 0.1164089007513661, 'bear_tp_mult': 2.6321594122413288, 'bear_tsl_mult': 0.19680691411833143, 'bear_time_stop': 20, 'bear_use_sma': False, 'bear_use_ema': True, 'bear_use_atr': True, 'bear_use_adx': False, 'bear_use_spike': True, 'bear_rsi_required': True, 'sideways_strategy': 'breakout', 'sideways_bb_std_mult': 2.52694837638441, 'sideways_rsi_os': 55, 'sideways_rsi_ob': 82, 'sideways_adx_thresh': 15.249131247493542, 'sideways_atr_min_pct': 0.004771494364602913, 'sideways_atr_max_pct': 0.07351788110479002, 'sideways_tp_mult': 1.2373173426511375, 'sideways_tsl_mult': 0.37227954618458403, 'sideways_time_stop': 271, 'sideways_use_sma': False, 'sideways_use_ema': False, 'sideways_use_atr': False, 'sideways_use_adx': False, 'sideways_use_spike': True, 'sideways_rsi_required': False}.
[I 2025-08-31 10:27:13,336] Trial 287 finished with values: [-1000000000.0, 1000000000.0] and parameters: {'p_sma': 21, 'p_std': 32, 'p_atr': 17, 'p_adx': 24, 'rsi_period': 40, 'ema1': 14, 'ema2': 58, 'slip_atr_k': 0.0748975970369247, 'slip_spread_k': 0.2860874938612548, 'spread_hl_frac': 0.026350735675568743, 'bb_std_mult': 2.452950303594808, 'rsi_os': 45, 'rsi_ob': 91, 'vol_spike': 0.21147487203685802, 'adx_thresh': 30.532974434643357, 'atr_min_pct': 0.019807749307691004, 'atr_max_pct': 0.06456375504553885, 'tp_mult': 2.723667344521187, 'tsl_mult': 0.3748721176393011, 'strategy': 'mean_reversion', 'time_stop': 138, 'use_sma': False, 'use_atr': False, 'use_adx': False, 'use_ema': False, 'use_spike': True, 'rsi_required': True, 'edge_k': 1.844253004110283, 'edge_cap': 0.17677092713844678, 'bull_strategy': 'breakout', 'bull_bb_std_mult': 2.6999091084062017, 'bull_rsi_os': 41, 'bull_rsi_ob': 76, 'bull_adx_thresh': 11.992649210339346, 'bull_atr_min_pct': 0.006994769557668402, 'bull_atr_max_pct': 0.14145034092872438, 'bull_tp_mult': 2.0772530824205235, 'bull_tsl_mult': 0.09452753062543735, 'bull_time_stop': 18, 'bull_use_sma': True, 'bull_use_ema': True, 'bull_use_atr': True, 'bull_use_adx': True, 'bull_use_spike': False, 'bull_rsi_required': False, 'bear_strategy': 'breakout', 'bear_bb_std_mult': 1.8832375640355061, 'bear_rsi_os': 28, 'bear_rsi_ob': 63, 'bear_adx_thresh': 8.856156610562216, 'bear_atr_min_pct': 0.01755156813799731, 'bear_atr_max_pct': 0.07116921354604072, 'bear_tp_mult': 2.310268185613652, 'bear_tsl_mult': 0.7992578404457538, 'bear_time_stop': 22, 'bear_use_sma': False, 'bear_use_ema': True, 'bear_use_atr': True, 'bear_use_adx': False, 'bear_use_spike': True, 'bear_rsi_required': True, 'sideways_strategy': 'breakout', 'sideways_bb_std_mult': 2.5328447159867973, 'sideways_rsi_os': 55, 'sideways_rsi_ob': 84, 'sideways_adx_thresh': 17.085704516144915, 'sideways_atr_min_pct': 0.004924102404785581, 'sideways_atr_max_pct': 0.07309381909312858, 'sideways_tp_mult': 1.2253900625697247, 'sideways_tsl_mult': 0.7694313597871519, 'sideways_time_stop': 270, 'sideways_use_sma': True, 'sideways_use_ema': False, 'sideways_use_atr': False, 'sideways_use_adx': False, 'sideways_use_spike': True, 'sideways_rsi_required': False}.
