[I 2025-08-31 10:34:54,976] Trial 353 finished with values: [-0.026097647270445834, 0.025950202210696095] and parameters: {'p_sma': 57, 'p_std': 41, 'p_atr': 17, 'p_adx': 23, 'rsi_period': 24, 'ema1': 13, 'ema2': 17, 'slip_atr_k': 0.0808340534622434, 'slip_spread_k': 0.6310253939192697, 'spread_hl_frac': 0.024310721677872123, 'bb_std_mult': 2.116730688252055, 'rsi_os': 41, 'rsi_ob': 93, 'vol_spike': 0.1812556975326192, 'adx_thresh': 8.51953782660882, 'atr_min_pct': 0.018527433480797918, 'atr_max_pct': 0.036023027754053125, 'tp_mult': 2.9161938352798815, 'tsl_mult': 0.7150922998098392, 'strategy': 'mean_reversion', 'time_stop': 144, 'use_sma': False, 'use_atr': False, 'use_adx': True, 'use_ema': False, 'use_spike': True, 'rsi_required': True, 'edge_k': 1.7349485793088766, 'edge_cap': 0.0992966057694433, 'bull_strategy': 'breakout', 'bull_bb_std_mult': 0.8535719642491055, 'bull_rsi_os': 44, 'bull_rsi_ob': 85, 'bull_adx_thresh': 10.531307193953895, 'bull_atr_min_pct': 0.0025412623464870386, 'bull_atr_max_pct': 0.07184324962114845, 'bull_tp_mult': 2.2192149219174313, 'bull_tsl_mult': 0.6301124014961382, 'bull_time_stop': 76, 'bull_use_sma': True, 'bull_use_ema': True, 'bull_use_atr': True, 'bull_use_adx': True, 'bull_use_spike': True, 'bull_rsi_required': False, 'bear_strategy': 'breakout', 'bear_bb_std_mult': 1.9808609403052748, 'bear_rsi_os': 30, 'bear_rsi_ob': 73, 'bear_adx_thresh': 13.095710217174403, 'bear_atr_min_pct': 0.004973697746679795, 'bear_atr_max_pct': 0.09233614438954152, 'bear_tp_mult': 2.584220516123943, 'bear_tsl_mult': 0.4515033937292095, 'bear_time_stop': 32, 'bear_use_sma': False, 'bear_use_ema': False, 'bear_use_atr': True, 'bear_use_adx': False, 'bear_use_spike': True, 'bear_rsi_required': True, 'sideways_strategy': 'breakout', 'sideways_bb_std_mult': 3.2438159999022096, 'sideways_rsi_os': 27, 'sideways_rsi_ob': 77, 'sideways_adx_thresh': 34.52828998817179, 'sideways_atr_min_pct': 0.02268901677212041, 'sideways_atr_max_pct': 0.137095660290733, 'sideways_tp_mult': 1.2941503527437959, 'sideways_tsl_mult': 0.8006429238580037, 'sideways_time_stop': 252, 'sideways_use_sma': False, 'sideways_use_ema': False, 'sideways_use_atr': True, 'sideways_use_adx': False, 'sideways_use_spike': True, 'sideways_rsi_required': False}.
[I 2025-08-31 10:34:55,191] Trial 350 finished with values: [-1000000000.0, 1000000000.0] and parameters: {'p_sma': 20, 'p_std': 31, 'p_atr': 14, 'p_adx': 23, 'rsi_period': 22, 'ema1': 11, 'ema2': 60, 'slip_atr_k': 0.1442733552866004, 'slip_spread_k': 0.29019864619333136, 'spread_hl_frac': 0.02389176344640128, 'bb_std_mult': 2.418208471851971, 'rsi_os': 41, 'rsi_ob': 74, 'vol_spike': 0.05812363563165662, 'adx_thresh': 9.368930084297556, 'atr_min_pct': 0.023893830343219062, 'atr_max_pct': 0.04126994754888935, 'tp_mult': 2.7320708862076573, 'tsl_mult': 0.35049640991143793, 'strategy': 'breakout', 'time_stop': 125, 'use_sma': False, 'use_atr': False, 'use_adx': True, 'use_ema': False, 'use_spike': True, 'rsi_required': True, 'edge_k': 1.4982838154720823, 'edge_cap': 0.18352075667275058, 'bull_strategy': 'breakout', 'bull_bb_std_mult': 1.6881183235613135, 'bull_rsi_os': 41, 'bull_rsi_ob': 78, 'bull_adx_thresh': 21.628369326335715, 'bull_atr_min_pct': 0.003692289850544897, 'bull_atr_max_pct': 0.02819235665109064, 'bull_tp_mult': 1.9637202533698705, 'bull_tsl_mult': 0.4359721705826919, 'bull_time_stop': 238, 'bull_use_sma': True, 'bull_use_ema': True, 'bull_use_atr': True, 'bull_use_adx': True, 'bull_use_spike': True, 'bull_rsi_required': False, 'bear_strategy': 'mean_reversion', 'bear_bb_std_mult': 2.848502173932942, 'bear_rsi_os': 19, 'bear_rsi_ob': 59, 'bear_adx_thresh': 6.952799521641746, 'bear_atr_min_pct': 0.012565953604368775, 'bear_atr_max_pct': 0.12338599913504168, 'bear_tp_mult': 1.7830093417526802, 'bear_tsl_mult': 0.8507922786828642, 'bear_time_stop': 19, 'bear_use_sma': False, 'bear_use_ema': False, 'bear_use_atr': True, 'bear_use_adx': False, 'bear_use_spike': True, 'bear_rsi_required': True, 'sideways_strategy': 'breakout', 'sideways_bb_std_mult': 2.2339893064168614, 'sideways_rsi_os': 36, 'sideways_rsi_ob': 95, 'sideways_adx_thresh': 34.907482378267446, 'sideways_atr_min_pct': 0.022809037503630402, 'sideways_atr_max_pct': 0.10357343418953208, 'sideways_tp_mult': 1.22277677073824, 'sideways_tsl_mult': 0.9084089202313128, 'sideways_time_stop': 268, 'sideways_use_sma': True, 'sideways_use_ema': False, 'sideways_use_atr': False, 'sideways_use_adx': False, 'sideways_use_spike': True, 'sideways_rsi_required': False}.
[I 2025-08-31 10:34:55,421] Trial 352 finished with values: [-0.00937194271984354, 0.009920409346889994] and parameters: {'p_sma': 20, 'p_std': 35, 'p_atr': 9, 'p_adx': 25, 'rsi_period': 25, 'ema1': 23, 'ema2': 59, 'slip_atr_k': 0.03879404659286281, 'slip_spread_k': 0.24354978380274117, 'spread_hl_frac': 0.016130270197387643, 'bb_std_mult': 2.4167183735346374, 'rsi_os': 41, 'rsi_ob': 87, 'vol_spike': 0.11302556769717062, 'adx_thresh': 8.380682218792591, 'atr_min_pct': 0.0027651778426390425, 'atr_max_pct': 0.04527667535679815, 'tp_mult': 2.8601593721936402, 'tsl_mult': 0.34700640682702044, 'strategy': 'mean_reversion', 'time_stop': 126, 'use_sma': False, 'use_atr': False, 'use_adx': True, 'use_ema': False, 'use_spike': True, 'rsi_required': True, 'edge_k': 1.0391305727046378, 'edge_cap': 0.18983896095330427, 'bull_strategy': 'breakout', 'bull_bb_std_mult': 0.8280170187313621, 'bull_rsi_os': 44, 'bull_rsi_ob': 79, 'bull_adx_thresh': 10.497440706111039, 'bull_atr_min_pct': 0.0026218844308782503, 'bull_atr_max_pct': 0.13240461198123799, 'bull_tp_mult': 2.0278888481341784, 'bull_tsl_mult': 0.43706906495203607, 'bull_time_stop': 239, 'bull_use_sma': True, 'bull_use_ema': True, 'bull_use_atr': True, 'bull_use_adx': True, 'bull_use_spike': True, 'bull_rsi_required': False, 'bear_strategy': 'breakout', 'bear_bb_std_mult': 1.5502226207415783, 'bear_rsi_os': 30, 'bear_rsi_ob': 72, 'bear_adx_thresh': 8.95388867376273, 'bear_atr_min_pct': 0.016100140749120695, 'bear_atr_max_pct': 0.09175844519108674, 'bear_tp_mult': 1.7861948379452266, 'bear_tsl_mult': 0.7299000022289549, 'bear_time_stop': 157, 'bear_use_sma': False, 'bear_use_ema': False, 'bear_use_atr': True, 'bear_use_adx': False, 'bear_use_spike': True, 'bear_rsi_required': True, 'sideways_strategy': 'breakout', 'sideways_bb_std_mult': 3.222577375000391, 'sideways_rsi_os': 21, 'sideways_rsi_ob': 83, 'sideways_adx_thresh': 16.155855730445346, 'sideways_atr_min_pct': 0.004319459889535291, 'sideways_atr_max_pct': 0.01933867962096486, 'sideways_tp_mult': 2.3888854115564033, 'sideways_tsl_mult': 0.7706384622866319, 'sideways_time_stop': 252, 'sideways_use_sma': False, 'sideways_use_ema': False, 'sideways_use_atr': True, 'sideways_use_adx': False, 'sideways_use_spike': True, 'sideways_rsi_required': False}.
[I 2025-08-31 10:34:56,250] Trial 354 finished with values: [-0.001635919061144686, 0.005475939703699299] and parameters: {'p_sma': 20, 'p_std': 35, 'p_atr': 17, 'p_adx': 8, 'rsi_period': 23, 'ema1': 13, 'ema2': 18, 'slip_atr_k': 0.08423039329736291, 'slip_spread_k': 0.4357196451399047, 'spread_hl_frac': 0.015783236821943592, 'bb_std_mult': 3.1121883570961537, 'rsi_os': 41, 'rsi_ob': 87, 'vol_spike': 0.1989584372300898, 'adx_thresh': 8.363269110526941, 'atr_min_pct': 0.018597990196459958, 'atr_max_pct': 0.14926075710450823, 'tp_mult': 2.854737598433978, 'tsl_mult': 0.34128840028884033, 'strategy': 'mean_reversion', 'time_stop': 129, 'use_sma': False, 'use_atr': False, 'use_adx': True, 'use_ema': False, 'use_spike': True, 'rsi_required': True, 'edge_k': 1.7243194644916267, 'edge_cap': 0.5414612857128491, 'bull_strategy': 'mean_reversion', 'bull_bb_std_mult': 2.1820459353937043, 'bull_rsi_os': 44, 'bull_rsi_ob': 77, 'bull_adx_thresh': 10.459273988691361, 'bull_atr_min_pct': 0.002783607844264434, 'bull_atr_max_pct': 0.07005209184810181, 'bull_tp_mult': 2.6450417998889693, 'bull_tsl_mult': 0.6214546934405524, 'bull_time_stop': 75, 'bull_use_sma': True, 'bull_use_ema': True, 'bull_use_atr': True, 'bull_use_adx': True, 'bull_use_spike': True, 'bull_rsi_required': False, 'bear_strategy': 'breakout', 'bear_bb_std_mult': 1.9767249770549185, 'bear_rsi_os': 30, 'bear_rsi_ob': 59, 'bear_adx_thresh': 14.383534986187016, 'bear_atr_min_pct': 0.0049646890306553285, 'bear_atr_max_pct': 0.07265627405735964, 'bear_tp_mult': 2.571556524685246, 'bear_tsl_mult': 0.13347193832703616, 'bear_time_stop': 46, 'bear_use_sma': False, 'bear_use_ema': False, 'bear_use_atr': True, 'bear_use_adx': False, 'bear_use_spike': True, 'bear_rsi_required': True, 'sideways_strategy': 'breakout', 'sideways_bb_std_mult': 3.2651041113435166, 'sideways_rsi_os': 35, 'sideways_rsi_ob': 77, 'sideways_adx_thresh': 31.50653535133161, 'sideways_atr_min_pct': 0.002917776466720188, 'sideways_atr_max_pct': 0.0661490760490554, 'sideways_tp_mult': 1.8096627661046156, 'sideways_tsl_mult': 0.7984085932696954, 'sideways_time_stop': 98, 'sideways_use_sma': True, 'sideways_use_ema': False, 'sideways_use_atr': False, 'sideways_use_adx': False, 'sideways_use_spike': True, 'sideways_rsi_required': False}.
[I 2025-08-31 10:35:27,337] Trial 358 finished with values: [-0.015930137605286054, 0.01616964257342551] and parameters: {'p_sma': 39, 'p_std': 49, 'p_atr': 27, 'p_adx': 8, 'rsi_period': 23, 'ema1': 28, 'ema2': 56, 'slip_atr_k': 0.06653972264149333, 'slip_spread_k': 0.3153479386148538, 'spread_hl_frac': 0.02575589894612719, 'bb_std_mult': 3.237556861143222, 'rsi_os': 24, 'rsi_ob': 71, 'vol_spike': 0.19605367131047782, 'adx_thresh': 9.124833838602262, 'atr_min_pct': 0.019223922622312307, 'atr_max_pct': 0.14252577801455124, 'tp_mult': 2.851538237996234, 'tsl_mult': 0.2888939733624655, 'strategy': 'mean_reversion', 'time_stop': 179, 'use_sma': False, 'use_atr': False, 'use_adx': True, 'use_ema': False, 'use_spike': False, 'rsi_required': False, 'edge_k': 1.9649709953879078, 'edge_cap': 0.14259375331275317, 'bull_strategy': 'mean_reversion', 'bull_bb_std_mult': 1.0319724392821599, 'bull_rsi_os': 43, 'bull_rsi_ob': 75, 'bull_adx_thresh': 11.32683398018527, 'bull_atr_min_pct': 0.009929859727746834, 'bull_atr_max_pct': 0.0697529361349309, 'bull_tp_mult': 2.629333764774318, 'bull_tsl_mult': 0.9561175908016505, 'bull_time_stop': 16, 'bull_use_sma': False, 'bull_use_ema': True, 'bull_use_atr': False, 'bull_use_adx': False, 'bull_use_spike': False, 'bull_rsi_required': False, 'bear_strategy': 'breakout', 'bear_bb_std_mult': 1.9066610138416549, 'bear_rsi_os': 28, 'bear_rsi_ob': 56, 'bear_adx_thresh': 24.112048532146495, 'bear_atr_min_pct': 0.023074046141609895, 'bear_atr_max_pct': 0.11487784275131234, 'bear_tp_mult': 2.4334503250027746, 'bear_tsl_mult': 0.595919544611199, 'bear_time_stop': 48, 'bear_use_sma': False, 'bear_use_ema': True, 'bear_use_atr': False, 'bear_use_adx': True, 'bear_use_spike': False, 'bear_rsi_required': True, 'sideways_strategy': 'mean_reversion', 'sideways_bb_std_mult': 2.632542432228359, 'sideways_rsi_os': 34, 'sideways_rsi_ob': 85, 'sideways_adx_thresh': 15.434518356164087, 'sideways_atr_min_pct': 0.002845826420536558, 'sideways_atr_max_pct': 0.012373385567735597, 'sideways_tp_mult': 1.1247376496740031, 'sideways_tsl_mult': 0.410485981401417, 'sideways_time_stop': 260, 'sideways_use_sma': True, 'sideways_use_ema': False, 'sideways_use_atr': False, 'sideways_use_adx': False, 'sideways_use_spike': False, 'sideways_rsi_required': False}.
[I 2025-08-31 10:35:27,648] Trial 356 finished with values: [-1000000000.0, 1000000000.0] and parameters: {'p_sma': 38, 'p_std': 35, 'p_atr': 17, 'p_adx': 8, 'rsi_period': 24, 'ema1': 12, 'ema2': 38, 'slip_atr_k': 0.06671374788543098, 'slip_spread_k': 0.5760430714950395, 'spread_hl_frac': 0.01643794130840846, 'bb_std_mult': 2.733941771609956, 'rsi_os': 10, 'rsi_ob': 51, 'vol_spike': 0.17398823708621636, 'adx_thresh': 8.07099303116059, 'atr_min_pct': 0.019221272477663115, 'atr_max_pct': 0.05249711713588911, 'tp_mult': 1.7939423116007132, 'tsl_mult': 0.6753166959155583, 'strategy': 'mean_reversion', 'time_stop': 137, 'use_sma': False, 'use_atr': False, 'use_adx': True, 'use_ema': False, 'use_spike': False, 'rsi_required': True, 'edge_k': 1.595617736469267, 'edge_cap': 0.7904356082633199, 'bull_strategy': 'mean_reversion', 'bull_bb_std_mult': 0.9035736927938652, 'bull_rsi_os': 55, 'bull_rsi_ob': 77, 'bull_adx_thresh': 11.551919279665096, 'bull_atr_min_pct': 0.024976588175332534, 'bull_atr_max_pct': 0.04114673386384714, 'bull_tp_mult': 1.2594915945484662, 'bull_tsl_mult': 0.6682328505187478, 'bull_time_stop': 16, 'bull_use_sma': True, 'bull_use_ema': True, 'bull_use_atr': True, 'bull_use_adx': False, 'bull_use_spike': True, 'bull_rsi_required': False, 'bear_strategy': 'breakout', 'bear_bb_std_mult': 3.5132997917625923, 'bear_rsi_os': 6, 'bear_rsi_ob': 68, 'bear_adx_thresh': 7.51667635056743, 'bear_atr_min_pct': 0.016091178964896664, 'bear_atr_max_pct': 0.07449328225824828, 'bear_tp_mult': 2.574647917537862, 'bear_tsl_mult': 0.5928955015815802, 'bear_time_stop': 48, 'bear_use_sma': False, 'bear_use_ema': True, 'bear_use_atr': False, 'bear_use_adx': True, 'bear_use_spike': True, 'bear_rsi_required': False, 'sideways_strategy': 'breakout', 'sideways_bb_std_mult': 2.1006238138069255, 'sideways_rsi_os': 21, 'sideways_rsi_ob': 88, 'sideways_adx_thresh': 15.435626600932045, 'sideways_atr_min_pct': 0.01769017482737496, 'sideways_atr_max_pct': 0.11092373299955201, 'sideways_tp_mult': 1.0164539208140293, 'sideways_tsl_mult': 0.40973886898292733, 'sideways_time_stop': 51, 'sideways_use_sma': True, 'sideways_use_ema': False, 'sideways_use_atr': False, 'sideways_use_adx': False, 'sideways_use_spike': False, 'sideways_rsi_required': False}.
[I 2025-08-31 10:35:28,006] Trial 357 finished with values: [-0.013358638249353127, 0.013242136408668274] and parameters: {'p_sma': 18, 'p_std': 35, 'p_atr': 17, 'p_adx': 8, 'rsi_period': 66, 'ema1': 12, 'ema2': 59, 'slip_atr_k': 0.06732745185666697, 'slip_spread_k': 0.25414632168017887, 'spread_hl_frac': 0.02590531731107816, 'bb_std_mult': 1.153722106366823, 'rsi_os': 12, 'rsi_ob': 78, 'vol_spike': 0.18776510738235547, 'adx_thresh': 9.110591955709728, 'atr_min_pct': 0.01927212912135244, 'atr_max_pct': 0.14161882866055062, 'tp_mult': 2.856433178014528, 'tsl_mult': 0.6697625513779439, 'strategy': 'mean_reversion', 'time_stop': 206, 'use_sma': False, 'use_atr': False, 'use_adx': True, 'use_ema': False, 'use_spike': False, 'rsi_required': False, 'edge_k': 0.849880611400827, 'edge_cap': 0.13236565631138614, 'bull_strategy': 'mean_reversion', 'bull_bb_std_mult': 1.0273996573126212, 'bull_rsi_os': 43, 'bull_rsi_ob': 75, 'bull_adx_thresh': 32.706412803535066, 'bull_atr_min_pct': 0.0007397850374516019, 'bull_atr_max_pct': 0.04006536212684088, 'bull_tp_mult': 2.625773692280759, 'bull_tsl_mult': 0.9507195063036198, 'bull_time_stop': 50, 'bull_use_sma': False, 'bull_use_ema': True, 'bull_use_atr': False, 'bull_use_adx': False, 'bull_use_spike': False, 'bull_rsi_required': False, 'bear_strategy': 'breakout', 'bear_bb_std_mult': 2.112269452335522, 'bear_rsi_os': 32, 'bear_rsi_ob': 68, 'bear_adx_thresh': 8.293140883673127, 'bear_atr_min_pct': 0.015810967785110378, 'bear_atr_max_pct': 0.14412878823055797, 'bear_tp_mult': 2.256551271508341, 'bear_tsl_mult': 0.5965432426632181, 'bear_time_stop': 47, 'bear_use_sma': False, 'bear_use_ema': True, 'bear_use_atr': False, 'bear_use_adx': True, 'bear_use_spike': False, 'bear_rsi_required': False, 'sideways_strategy': 'mean_reversion', 'sideways_bb_std_mult': 1.9542103197866236, 'sideways_rsi_os': 24, 'sideways_rsi_ob': 85, 'sideways_adx_thresh': 15.233878232745463, 'sideways_atr_min_pct': 0.017156793695945933, 'sideways_atr_max_pct': 0.01268810692603936, 'sideways_tp_mult': 2.7056750008132413, 'sideways_tsl_mult': 0.8262996717064299, 'sideways_time_stop': 258, 'sideways_use_sma': True, 'sideways_use_ema': True, 'sideways_use_atr': False, 'sideways_use_adx': False, 'sideways_use_spike': False, 'sideways_rsi_required': False}.
[I 2025-08-31 10:35:28,191] Trial 355 finished with values: [-1000000000.0, 1000000000.0] and parameters: {'p_sma': 21, 'p_std': 35, 'p_atr': 18, 'p_adx': 30, 'rsi_period': 23, 'ema1': 12, 'ema2': 59, 'slip_atr_k': 0.15632828076145, 'slip_spread_k': 0.25040046975919417, 'spread_hl_frac': 0.030592184843671707, 'bb_std_mult': 3.1034215128720453, 'rsi_os': 24, 'rsi_ob': 79, 'vol_spike': 0.17315937907258877, 'adx_thresh': 9.286591328542873, 'atr_min_pct': 0.019232645031825448, 'atr_max_pct': 0.05297525466157481, 'tp_mult': 1.8066586735740648, 'tsl_mult': 0.12436090489202817, 'strategy': 'mean_reversion', 'time_stop': 135, 'use_sma': False, 'use_atr': False, 'use_adx': True, 'use_ema': False, 'use_spike': True, 'rsi_required': True, 'edge_k': 1.5853086062559045, 'edge_cap': 0.2083159810700151, 'bull_strategy': 'mean_reversion', 'bull_bb_std_mult': 1.037885462660757, 'bull_rsi_os': 43, 'bull_rsi_ob': 75, 'bull_adx_thresh': 19.772586472000125, 'bull_atr_min_pct': 0.00996533940479898, 'bull_atr_max_pct': 0.06965007851970328, 'bull_tp_mult': 1.9827026497075946, 'bull_tsl_mult': 0.4231803421780478, 'bull_time_stop': 16, 'bull_use_sma': True, 'bull_use_ema': True, 'bull_use_atr': True, 'bull_use_adx': True, 'bull_use_spike': True, 'bull_rsi_required': False, 'bear_strategy': 'breakout', 'bear_bb_std_mult': 2.0970855970227245, 'bear_rsi_os': 29, 'bear_rsi_ob': 59, 'bear_adx_thresh': 6.9478581273842375, 'bear_atr_min_pct': 0.016294495518045876, 'bear_atr_max_pct': 0.13852799680482003, 'bear_tp_mult': 1.9331630166402674, 'bear_tsl_mult': 0.24359498416254793, 'bear_time_stop': 5, 'bear_use_sma': False, 'bear_use_ema': True, 'bear_use_atr': False, 'bear_use_adx': False, 'bear_use_spike': True, 'bear_rsi_required': True, 'sideways_strategy': 'breakout', 'sideways_bb_std_mult': 1.7187009382138103, 'sideways_rsi_os': 35, 'sideways_rsi_ob': 84, 'sideways_adx_thresh': 30.75335188662961, 'sideways_atr_min_pct': 0.016949134742082865, 'sideways_atr_max_pct': 0.018480614298681485, 'sideways_tp_mult': 1.206440317933485, 'sideways_tsl_mult': 0.9812526757165572, 'sideways_time_stop': 269, 'sideways_use_sma': True, 'sideways_use_ema': False, 'sideways_use_atr': False, 'sideways_use_adx': False, 'sideways_use_spike': True, 'sideways_rsi_required': False}.
[I 2025-08-31 10:35:28,732] Trial 362 finished with values: [-1000000000.0, 1000000000.0] and parameters: {'p_sma': 43, 'p_std': 33, 'p_atr': 12, 'p_adx': 15, 'rsi_period': 18, 'ema1': 15, 'ema2': 55, 'slip_atr_k': 0.07392925580624785, 'slip_spread_k': 0.8871739887383112, 'spread_hl_frac': 0.039714166353991005, 'bb_std_mult': 1.0014961602610974, 'rsi_os': 26, 'rsi_ob': 63, 'vol_spike': 0.1049775370532286, 'adx_thresh': 7.3721243647202215, 'atr_min_pct': 0.02675774572512829, 'atr_max_pct': 0.010025610972053137, 'tp_mult': 1.265764783799745, 'tsl_mult': 0.6067831070966402, 'strategy': 'mean_reversion', 'time_stop': 142, 'use_sma': True, 'use_atr': True, 'use_adx': False, 'use_ema': True, 'use_spike': True, 'rsi_required': True, 'edge_k': 1.1256123417164416, 'edge_cap': 0.6839790729708652, 'bull_strategy': 'breakout', 'bull_bb_std_mult': 2.1643281981007476, 'bull_rsi_os': 41, 'bull_rsi_ob': 53, 'bull_adx_thresh': 30.19148320747613, 'bull_atr_min_pct': 0.020088440240337423, 'bull_atr_max_pct': 0.06579704659554535, 'bull_tp_mult': 1.6841612167372686, 'bull_tsl_mult': 0.15541805250541085, 'bull_time_stop': 91, 'bull_use_sma': True, 'bull_use_ema': False, 'bull_use_atr': True, 'bull_use_adx': True, 'bull_use_spike': True, 'bull_rsi_required': True, 'bear_strategy': 'mean_reversion', 'bear_bb_std_mult': 0.6309079273257656, 'bear_rsi_os': 29, 'bear_rsi_ob': 57, 'bear_adx_thresh': 8.042082766423013, 'bear_atr_min_pct': 0.0015930701494464086, 'bear_atr_max_pct': 0.03586507837134627, 'bear_tp_mult': 2.686121130596331, 'bear_tsl_mult': 0.8946534258618093, 'bear_time_stop': 25, 'bear_use_sma': True, 'bear_use_ema': False, 'bear_use_atr': True, 'bear_use_adx': False, 'bear_use_spike': True, 'bear_rsi_required': True, 'sideways_strategy': 'breakout', 'sideways_bb_std_mult': 2.666971677545591, 'sideways_rsi_os': 34, 'sideways_rsi_ob': 55, 'sideways_adx_thresh': 11.487765816468366, 'sideways_atr_min_pct': 0.004017151185712908, 'sideways_atr_max_pct': 0.010168487864780841, 'sideways_tp_mult': 1.9266224301570758, 'sideways_tsl_mult': 0.01788259914210677, 'sideways_time_stop': 265, 'sideways_use_sma': True, 'sideways_use_ema': False, 'sideways_use_atr': False, 'sideways_use_adx': True, 'sideways_use_spike': True, 'sideways_rsi_required': True}.
