[I 2025-08-31 11:28:11,751] Trial 755 finished with values: [-1000000000.0, 1000000000.0] and parameters: {'p_sma': 26, 'p_std': 44, 'p_atr': 28, 'p_adx': 23, 'rsi_period': 36, 'ema1': 28, 'ema2': 30, 'slip_atr_k': 0.24363782049548682, 'slip_spread_k': 0.759436699104665, 'spread_hl_frac': 0.016055400374488847, 'bb_std_mult': 1.2652653439973145, 'rsi_os': 52, 'rsi_ob': 83, 'vol_spike': 0.24776835224678234, 'adx_thresh': 27.042477132443942, 'atr_min_pct': 0.021639347062747092, 'atr_max_pct': 0.05261190424310431, 'tp_mult': 1.672141640442212, 'tsl_mult': 0.459348582693646, 'strategy': 'breakout', 'time_stop': 98, 'use_sma': True, 'use_atr': True, 'use_adx': True, 'use_ema': True, 'use_spike': False, 'rsi_required': True, 'edge_k': 0.24537563516135497, 'edge_cap': 0.2833674030732776, 'bull_strategy': 'mean_reversion', 'bull_bb_std_mult': 2.6092644197142256, 'bull_rsi_os': 22, 'bull_rsi_ob': 48, 'bull_adx_thresh': 22.07717822580362, 'bull_atr_min_pct': 0.010807412035457984, 'bull_atr_max_pct': 0.04092470311437792, 'bull_tp_mult': 2.5967715750408384, 'bull_tsl_mult': 0.24986790764798267, 'bull_time_stop': 100, 'bull_use_sma': False, 'bull_use_ema': True, 'bull_use_atr': False, 'bull_use_adx': False, 'bull_use_spike': False, 'bull_rsi_required': False, 'bear_strategy': 'mean_reversion', 'bear_bb_std_mult': 1.4579795050356759, 'bear_rsi_os': 33, 'bear_rsi_ob': 53, 'bear_adx_thresh': 9.966449101790579, 'bear_atr_min_pct': 0.011425905729153557, 'bear_atr_max_pct': 0.07999859935822547, 'bear_tp_mult': 2.315211953776004, 'bear_tsl_mult': 0.008217727630023097, 'bear_time_stop': 246, 'bear_use_sma': False, 'bear_use_ema': False, 'bear_use_atr': True, 'bear_use_adx': True, 'bear_use_spike': True, 'bear_rsi_required': False, 'sideways_strategy': 'breakout', 'sideways_bb_std_mult': 1.0085682826850073, 'sideways_rsi_os': 24, 'sideways_rsi_ob': 65, 'sideways_adx_thresh': 8.529953264312605, 'sideways_atr_min_pct': 0.005384793365879848, 'sideways_atr_max_pct': 0.14240147048271662, 'sideways_tp_mult': 1.7275206224706128, 'sideways_tsl_mult': 0.8164872162922499, 'sideways_time_stop': 171, 'sideways_use_sma': False, 'sideways_use_ema': True, 'sideways_use_atr': True, 'sideways_use_adx': False, 'sideways_use_spike': True, 'sideways_rsi_required': False}.
[I 2025-08-31 11:28:12,092] Trial 757 finished with values: [-1000000000.0, 1000000000.0] and parameters: {'p_sma': 53, 'p_std': 10, 'p_atr': 9, 'p_adx': 19, 'rsi_period': 38, 'ema1': 5, 'ema2': 15, 'slip_atr_k': 0.021557756079655065, 'slip_spread_k': 0.4677081416127258, 'spread_hl_frac': 0.021959212010634582, 'bb_std_mult': 1.9196361801162654, 'rsi_os': 50, 'rsi_ob': 83, 'vol_spike': 0.29533861715798904, 'adx_thresh': 28.880753223335006, 'atr_min_pct': 0.021342095930729024, 'atr_max_pct': 0.05231821103497452, 'tp_mult': 2.066307263434709, 'tsl_mult': 0.19426152431506105, 'strategy': 'breakout', 'time_stop': 85, 'use_sma': True, 'use_atr': True, 'use_adx': True, 'use_ema': True, 'use_spike': True, 'rsi_required': True, 'edge_k': 1.0499159000486349, 'edge_cap': 0.28414115221372205, 'bull_strategy': 'mean_reversion', 'bull_bb_std_mult': 2.058078904666194, 'bull_rsi_os': 9, 'bull_rsi_ob': 70, 'bull_adx_thresh': 18.875518547407932, 'bull_atr_min_pct': 0.01261467755492422, 'bull_atr_max_pct': 0.04088712200653746, 'bull_tp_mult': 2.9402057644138253, 'bull_tsl_mult': 0.21740222822576, 'bull_time_stop': 154, 'bull_use_sma': True, 'bull_use_ema': True, 'bull_use_atr': False, 'bull_use_adx': False, 'bull_use_spike': False, 'bull_rsi_required': False, 'bear_strategy': 'mean_reversion', 'bear_bb_std_mult': 2.5353396398712014, 'bear_rsi_os': 51, 'bear_rsi_ob': 54, 'bear_adx_thresh': 33.992412022109754, 'bear_atr_min_pct': 0.012164277511448386, 'bear_atr_max_pct': 0.07962465380246656, 'bear_tp_mult': 2.8500414780379812, 'bear_tsl_mult': 0.9287496225566183, 'bear_time_stop': 115, 'bear_use_sma': False, 'bear_use_ema': False, 'bear_use_atr': True, 'bear_use_adx': True, 'bear_use_spike': True, 'bear_rsi_required': False, 'sideways_strategy': 'breakout', 'sideways_bb_std_mult': 1.616414165714173, 'sideways_rsi_os': 40, 'sideways_rsi_ob': 65, 'sideways_adx_thresh': 25.082937696154428, 'sideways_atr_min_pct': 0.005439329655669186, 'sideways_atr_max_pct': 0.11516539508133965, 'sideways_tp_mult': 1.7387028683746346, 'sideways_tsl_mult': 0.557194914339602, 'sideways_time_stop': 184, 'sideways_use_sma': False, 'sideways_use_ema': True, 'sideways_use_atr': True, 'sideways_use_adx': False, 'sideways_use_spike': True, 'sideways_rsi_required': False}.
[I 2025-08-31 11:28:12,313] Trial 756 finished with values: [-1000000000.0, 1000000000.0] and parameters: {'p_sma': 6, 'p_std': 44, 'p_atr': 28, 'p_adx': 21, 'rsi_period': 36, 'ema1': 5, 'ema2': 18, 'slip_atr_k': 0.18397262195228253, 'slip_spread_k': 0.603228754577788, 'spread_hl_frac': 0.015708955425800634, 'bb_std_mult': 2.0003402712520493, 'rsi_os': 11, 'rsi_ob': 83, 'vol_spike': 0.04966639031632637, 'adx_thresh': 10.864195981786255, 'atr_min_pct': 0.021687663604515628, 'atr_max_pct': 0.09646654641266236, 'tp_mult': 2.997436635999048, 'tsl_mult': 0.4650146246831738, 'strategy': 'breakout', 'time_stop': 211, 'use_sma': True, 'use_atr': True, 'use_adx': True, 'use_ema': True, 'use_spike': False, 'rsi_required': True, 'edge_k': 1.0606792557504603, 'edge_cap': 0.7012471967995566, 'bull_strategy': 'mean_reversion', 'bull_bb_std_mult': 2.644625197829135, 'bull_rsi_os': 53, 'bull_rsi_ob': 69, 'bull_adx_thresh': 27.112695704675556, 'bull_atr_min_pct': 0.013553266343506107, 'bull_atr_max_pct': 0.041250959216430585, 'bull_tp_mult': 2.852415599550379, 'bull_tsl_mult': 0.2176499251375103, 'bull_time_stop': 55, 'bull_use_sma': False, 'bull_use_ema': True, 'bull_use_atr': False, 'bull_use_adx': False, 'bull_use_spike': False, 'bull_rsi_required': False, 'bear_strategy': 'mean_reversion', 'bear_bb_std_mult': 1.0496879995616037, 'bear_rsi_os': 51, 'bear_rsi_ob': 54, 'bear_adx_thresh': 17.67563423476266, 'bear_atr_min_pct': 0.012402637269881292, 'bear_atr_max_pct': 0.13881977355634595, 'bear_tp_mult': 2.7413834544694535, 'bear_tsl_mult': 0.829722816109274, 'bear_time_stop': 116, 'bear_use_sma': False, 'bear_use_ema': False, 'bear_use_atr': True, 'bear_use_adx': True, 'bear_use_spike': True, 'bear_rsi_required': False, 'sideways_strategy': 'breakout', 'sideways_bb_std_mult': 1.0136999509877158, 'sideways_rsi_os': 48, 'sideways_rsi_ob': 61, 'sideways_adx_thresh': 30.510592108033613, 'sideways_atr_min_pct': 0.005306163365540523, 'sideways_atr_max_pct': 0.1149067239171179, 'sideways_tp_mult': 1.6576557837848906, 'sideways_tsl_mult': 0.8184776165122596, 'sideways_time_stop': 100, 'sideways_use_sma': False, 'sideways_use_ema': True, 'sideways_use_atr': True, 'sideways_use_adx': False, 'sideways_use_spike': True, 'sideways_rsi_required': False}.
[I 2025-08-31 11:28:47,701] Trial 762 finished with values: [-1000000000.0, 1000000000.0] and parameters: {'p_sma': 35, 'p_std': 12, 'p_atr': 12, 'p_adx': 13, 'rsi_period': 31, 'ema1': 6, 'ema2': 24, 'slip_atr_k': 0.015406084725073472, 'slip_spread_k': 0.043475920238672694, 'spread_hl_frac': 0.022900499165750498, 'bb_std_mult': 2.1381798389168667, 'rsi_os': 31, 'rsi_ob': 45, 'vol_spike': 0.12851841667621805, 'adx_thresh': 12.101260626677481, 'atr_min_pct': 0.0016007638395651724, 'atr_max_pct': 0.0559399313110822, 'tp_mult': 2.869159016800679, 'tsl_mult': 0.03512391020138883, 'strategy': 'breakout', 'time_stop': 196, 'use_sma': True, 'use_atr': True, 'use_adx': False, 'use_ema': True, 'use_spike': False, 'rsi_required': False, 'edge_k': 1.3058969784835552, 'edge_cap': 0.8907190056317061, 'bull_strategy': 'mean_reversion', 'bull_bb_std_mult': 1.8894890046177786, 'bull_rsi_os': 43, 'bull_rsi_ob': 95, 'bull_adx_thresh': 25.89533300658882, 'bull_atr_min_pct': 0.01365605544769703, 'bull_atr_max_pct': 0.13436795494688705, 'bull_tp_mult': 2.5077506682718824, 'bull_tsl_mult': 0.5473522181365598, 'bull_time_stop': 62, 'bull_use_sma': False, 'bull_use_ema': False, 'bull_use_atr': True, 'bull_use_adx': True, 'bull_use_spike': False, 'bull_rsi_required': True, 'bear_strategy': 'mean_reversion', 'bear_bb_std_mult': 2.669918290044837, 'bear_rsi_os': 49, 'bear_rsi_ob': 62, 'bear_adx_thresh': 11.04990849708692, 'bear_atr_min_pct': 0.013286720440353242, 'bear_atr_max_pct': 0.13344090461882815, 'bear_tp_mult': 2.803174839780694, 'bear_tsl_mult': 0.8732109738011028, 'bear_time_stop': 163, 'bear_use_sma': True, 'bear_use_ema': False, 'bear_use_atr': True, 'bear_use_adx': False, 'bear_use_spike': True, 'bear_rsi_required': False, 'sideways_strategy': 'mean_reversion', 'sideways_bb_std_mult': 0.8741677129045787, 'sideways_rsi_os': 18, 'sideways_rsi_ob': 64, 'sideways_adx_thresh': 26.924387986755985, 'sideways_atr_min_pct': 0.00733598991386659, 'sideways_atr_max_pct': 0.13211915929718449, 'sideways_tp_mult': 1.3958617517621896, 'sideways_tsl_mult': 0.11029156909913712, 'sideways_time_stop': 31, 'sideways_use_sma': True, 'sideways_use_ema': True, 'sideways_use_atr': False, 'sideways_use_adx': True, 'sideways_use_spike': False, 'sideways_rsi_required': True}.
[I 2025-08-31 11:28:48,139] Trial 761 finished with values: [-1000000000.0, 1000000000.0] and parameters: {'p_sma': 35, 'p_std': 15, 'p_atr': 29, 'p_adx': 22, 'rsi_period': 79, 'ema1': 6, 'ema2': 24, 'slip_atr_k': 0.01438263190589486, 'slip_spread_k': 0.4419126297066436, 'spread_hl_frac': 0.02277458165372882, 'bb_std_mult': 0.6803726808625542, 'rsi_os': 31, 'rsi_ob': 81, 'vol_spike': 0.1277953832397991, 'adx_thresh': 21.25945396116453, 'atr_min_pct': 0.001654382740089196, 'atr_max_pct': 0.056584871776385964, 'tp_mult': 2.9315089949610766, 'tsl_mult': 0.04822930006403045, 'strategy': 'breakout', 'time_stop': 77, 'use_sma': True, 'use_atr': True, 'use_adx': False, 'use_ema': True, 'use_spike': False, 'rsi_required': False, 'edge_k': 1.3103172433993955, 'edge_cap': 0.3102099092392393, 'bull_strategy': 'mean_reversion', 'bull_bb_std_mult': 3.288772480486946, 'bull_rsi_os': 43, 'bull_rsi_ob': 60, 'bull_adx_thresh': 25.975662247287527, 'bull_atr_min_pct': 0.013650584742584956, 'bull_atr_max_pct': 0.03269800434437547, 'bull_tp_mult': 1.6269216182223183, 'bull_tsl_mult': 0.9650882851716013, 'bull_time_stop': 60, 'bull_use_sma': False, 'bull_use_ema': False, 'bull_use_atr': True, 'bull_use_adx': True, 'bull_use_spike': False, 'bull_rsi_required': False, 'bear_strategy': 'mean_reversion', 'bear_bb_std_mult': 1.6438540689761973, 'bear_rsi_os': 16, 'bear_rsi_ob': 55, 'bear_adx_thresh': 32.74461958534261, 'bear_atr_min_pct': 0.009462652943177535, 'bear_atr_max_pct': 0.14292338250524445, 'bear_tp_mult': 1.3717184672887437, 'bear_tsl_mult': 0.6876282217361226, 'bear_time_stop': 232, 'bear_use_sma': True, 'bear_use_ema': False, 'bear_use_atr': True, 'bear_use_adx': False, 'bear_use_spike': True, 'bear_rsi_required': False, 'sideways_strategy': 'mean_reversion', 'sideways_bb_std_mult': 3.596365424828428, 'sideways_rsi_os': 19, 'sideways_rsi_ob': 70, 'sideways_adx_thresh': 26.314714057654662, 'sideways_atr_min_pct': 0.007786285420335015, 'sideways_atr_max_pct': 0.10803719555401248, 'sideways_tp_mult': 1.400607912481164, 'sideways_tsl_mult': 0.8557240495568322, 'sideways_time_stop': 23, 'sideways_use_sma': True, 'sideways_use_ema': True, 'sideways_use_atr': False, 'sideways_use_adx': True, 'sideways_use_spike': True, 'sideways_rsi_required': True}.
[I 2025-08-31 11:28:48,604] Trial 759 finished with values: [-1000000000.0, 1000000000.0] and parameters: {'p_sma': 35, 'p_std': 12, 'p_atr': 30, 'p_adx': 22, 'rsi_period': 38, 'ema1': 26, 'ema2': 24, 'slip_atr_k': 0.015198757979900335, 'slip_spread_k': 0.6019250566078971, 'spread_hl_frac': 0.02210478189679256, 'bb_std_mult': 0.669685358706715, 'rsi_os': 38, 'rsi_ob': 82, 'vol_spike': 0.15406100918765914, 'adx_thresh': 11.19990378984259, 'atr_min_pct': 0.021379243004732755, 'atr_max_pct': 0.09725488544300039, 'tp_mult': 2.0623182071410833, 'tsl_mult': 0.9462156568382233, 'strategy': 'breakout', 'time_stop': 78, 'use_sma': True, 'use_atr': True, 'use_adx': False, 'use_ema': True, 'use_spike': False, 'rsi_required': False, 'edge_k': 1.5199451261967354, 'edge_cap': 0.7539115600710866, 'bull_strategy': 'mean_reversion', 'bull_bb_std_mult': 2.915701943078634, 'bull_rsi_os': 25, 'bull_rsi_ob': 60, 'bull_adx_thresh': 26.27620562915116, 'bull_atr_min_pct': 0.013647223117140811, 'bull_atr_max_pct': 0.11617823172695105, 'bull_tp_mult': 2.5290672120742705, 'bull_tsl_mult': 0.28225874424103414, 'bull_time_stop': 240, 'bull_use_sma': False, 'bull_use_ema': True, 'bull_use_atr': False, 'bull_use_adx': True, 'bull_use_spike': False, 'bull_rsi_required': False, 'bear_strategy': 'mean_reversion', 'bear_bb_std_mult': 1.6233563158693125, 'bear_rsi_os': 52, 'bear_rsi_ob': 55, 'bear_adx_thresh': 10.928215575388572, 'bear_atr_min_pct': 0.014165444576569257, 'bear_atr_max_pct': 0.12796351824211, 'bear_tp_mult': 2.8073293890781463, 'bear_tsl_mult': 0.8336507559142492, 'bear_time_stop': 260, 'bear_use_sma': True, 'bear_use_ema': False, 'bear_use_atr': True, 'bear_use_adx': False, 'bear_use_spike': True, 'bear_rsi_required': False, 'sideways_strategy': 'mean_reversion', 'sideways_bb_std_mult': 1.0949435081038685, 'sideways_rsi_os': 29, 'sideways_rsi_ob': 61, 'sideways_adx_thresh': 30.726672798678322, 'sideways_atr_min_pct': 0.012098501784660386, 'sideways_atr_max_pct': 0.1362448139008513, 'sideways_tp_mult': 1.5328223662281926, 'sideways_tsl_mult': 0.8599706881470524, 'sideways_time_stop': 91, 'sideways_use_sma': True, 'sideways_use_ema': True, 'sideways_use_atr': False, 'sideways_use_adx': True, 'sideways_use_spike': True, 'sideways_rsi_required': True}.
[I 2025-08-31 11:28:48,605] Trial 760 finished with values: [-1000000000.0, 1000000000.0] and parameters: {'p_sma': 35, 'p_std': 10, 'p_atr': 8, 'p_adx': 18, 'rsi_period': 38, 'ema1': 26, 'ema2': 10, 'slip_atr_k': 0.027360588774773483, 'slip_spread_k': 0.4636759242856564, 'spread_hl_frac': 0.021979362133742672, 'bb_std_mult': 0.6489614997679473, 'rsi_os': 31, 'rsi_ob': 83, 'vol_spike': 0.2994268132261199, 'adx_thresh': 29.65050451640755, 'atr_min_pct': 0.00123683368711657, 'atr_max_pct': 0.05594131391502519, 'tp_mult': 2.9304142607648282, 'tsl_mult': 0.19228501806384984, 'strategy': 'breakout', 'time_stop': 77, 'use_sma': True, 'use_atr': True, 'use_adx': False, 'use_ema': True, 'use_spike': False, 'rsi_required': False, 'edge_k': 1.3089772395394854, 'edge_cap': 0.7583143877034529, 'bull_strategy': 'mean_reversion', 'bull_bb_std_mult': 2.753107263603903, 'bull_rsi_os': 43, 'bull_rsi_ob': 61, 'bull_adx_thresh': 26.264380838085398, 'bull_atr_min_pct': 0.012471985842272645, 'bull_atr_max_pct': 0.0323779221331015, 'bull_tp_mult': 2.4496616473339854, 'bull_tsl_mult': 0.9640404913361535, 'bull_time_stop': 54, 'bull_use_sma': False, 'bull_use_ema': True, 'bull_use_atr': False, 'bull_use_adx': True, 'bull_use_spike': False, 'bull_rsi_required': False, 'bear_strategy': 'mean_reversion', 'bear_bb_std_mult': 2.5220604568232106, 'bear_rsi_os': 16, 'bear_rsi_ob': 55, 'bear_adx_thresh': 10.99509410794689, 'bear_atr_min_pct': 0.00730912839565688, 'bear_atr_max_pct': 0.13287227432620366, 'bear_tp_mult': 2.6973808163046784, 'bear_tsl_mult': 0.8306594103894237, 'bear_time_stop': 139, 'bear_use_sma': True, 'bear_use_ema': False, 'bear_use_atr': True, 'bear_use_adx': False, 'bear_use_spike': True, 'bear_rsi_required': False, 'sideways_strategy': 'mean_reversion', 'sideways_bb_std_mult': 2.2817437057122256, 'sideways_rsi_os': 18, 'sideways_rsi_ob': 64, 'sideways_adx_thresh': 10.792452873366994, 'sideways_atr_min_pct': 0.022434399257789672, 'sideways_atr_max_pct': 0.1085196872144683, 'sideways_tp_mult': 1.3872359882717504, 'sideways_tsl_mult': 0.10661847786657747, 'sideways_time_stop': 181, 'sideways_use_sma': True, 'sideways_use_ema': True, 'sideways_use_atr': False, 'sideways_use_adx': True, 'sideways_use_spike': True, 'sideways_rsi_required': True}.
[I 2025-08-31 11:29:24,217] Trial 765 finished with values: [-1000000000.0, 1000000000.0] and parameters: {'p_sma': 9, 'p_std': 21, 'p_atr': 28, 'p_adx': 26, 'rsi_period': 29, 'ema1': 5, 'ema2': 37, 'slip_atr_k': 0.010022281514748816, 'slip_spread_k': 0.10298593709128695, 'spread_hl_frac': 0.021011489663878967, 'bb_std_mult': 3.523783878544436, 'rsi_os': 33, 'rsi_ob': 84, 'vol_spike': 0.04338430027239008, 'adx_thresh': 32.81394954663611, 'atr_min_pct': 0.022662338980522532, 'atr_max_pct': 0.06062115761148, 'tp_mult': 2.897534201726757, 'tsl_mult': 0.27229077237426125, 'strategy': 'breakout', 'time_stop': 47, 'use_sma': True, 'use_atr': True, 'use_adx': False, 'use_ema': True, 'use_spike': True, 'rsi_required': False, 'edge_k': 1.4774959315505003, 'edge_cap': 0.6675125395739596, 'bull_strategy': 'mean_reversion', 'bull_bb_std_mult': 3.130445670399555, 'bull_rsi_os': 41, 'bull_rsi_ob': 58, 'bull_adx_thresh': 28.670987216218457, 'bull_atr_min_pct': 0.009720166528616223, 'bull_atr_max_pct': 0.14003373005222094, 'bull_tp_mult': 2.9409586806769488, 'bull_tsl_mult': 0.1800265641787375, 'bull_time_stop': 172, 'bull_use_sma': True, 'bull_use_ema': True, 'bull_use_atr': False, 'bull_use_adx': True, 'bull_use_spike': False, 'bull_rsi_required': True, 'bear_strategy': 'mean_reversion', 'bear_bb_std_mult': 1.4816823049649517, 'bear_rsi_os': 38, 'bear_rsi_ob': 53, 'bear_adx_thresh': 15.76367365138426, 'bear_atr_min_pct': 0.006831386777273705, 'bear_atr_max_pct': 0.08438819289739163, 'bear_tp_mult': 2.5895474346909992, 'bear_tsl_mult': 0.23065501166739277, 'bear_time_stop': 87, 'bear_use_sma': False, 'bear_use_ema': False, 'bear_use_atr': True, 'bear_use_adx': False, 'bear_use_spike': True, 'bear_rsi_required': False, 'sideways_strategy': 'mean_reversion', 'sideways_bb_std_mult': 3.28127540905597, 'sideways_rsi_os': 13, 'sideways_rsi_ob': 62, 'sideways_adx_thresh': 28.362590709953086, 'sideways_atr_min_pct': 0.006737265543905003, 'sideways_atr_max_pct': 0.1013090054535533, 'sideways_tp_mult': 1.569471226741609, 'sideways_tsl_mult': 0.9230167748577264, 'sideways_time_stop': 116, 'sideways_use_sma': True, 'sideways_use_ema': True, 'sideways_use_atr': False, 'sideways_use_adx': False, 'sideways_use_spike': False, 'sideways_rsi_required': False}.
[I 2025-08-31 11:29:24,218] Trial 766 finished with values: [-1000000000.0, 1000000000.0] and parameters: {'p_sma': 29, 'p_std': 8, 'p_atr': 28, 'p_adx': 26, 'rsi_period': 34, 'ema1': 5, 'ema2': 37, 'slip_atr_k': 0.01052011637063606, 'slip_spread_k': 0.6942676070170749, 'spread_hl_frac': 0.01855999924886148, 'bb_std_mult': 1.1215218187912557, 'rsi_os': 32, 'rsi_ob': 94, 'vol_spike': 0.023802835817622173, 'adx_thresh': 12.823660839222331, 'atr_min_pct': 0.023471740298439472, 'atr_max_pct': 0.02403017592424149, 'tp_mult': 2.1345407607427767, 'tsl_mult': 0.10207658485657808, 'strategy': 'breakout', 'time_stop': 92, 'use_sma': True, 'use_atr': True, 'use_adx': False, 'use_ema': True, 'use_spike': True, 'rsi_required': False, 'edge_k': 0.06786781689540289, 'edge_cap': 0.6639190342415047, 'bull_strategy': 'mean_reversion', 'bull_bb_std_mult': 1.5535556838611928, 'bull_rsi_os': 42, 'bull_rsi_ob': 63, 'bull_adx_thresh': 24.69154845409501, 'bull_atr_min_pct': 0.02845948741099235, 'bull_atr_max_pct': 0.038568527180661394, 'bull_tp_mult': 2.800772443843076, 'bull_tsl_mult': 0.002380690287426046, 'bull_time_stop': 51, 'bull_use_sma': True, 'bull_use_ema': True, 'bull_use_atr': False, 'bull_use_adx': True, 'bull_use_spike': False, 'bull_rsi_required': True, 'bear_strategy': 'mean_reversion', 'bear_bb_std_mult': 1.476046611263402, 'bear_rsi_os': 38, 'bear_rsi_ob': 91, 'bear_adx_thresh': 12.760150657088662, 'bear_atr_min_pct': 0.020712096386183397, 'bear_atr_max_pct': 0.040571293925550735, 'bear_tp_mult': 2.592690811173409, 'bear_tsl_mult': 0.7564753295511124, 'bear_time_stop': 5, 'bear_use_sma': False, 'bear_use_ema': False, 'bear_use_atr': True, 'bear_use_adx': False, 'bear_use_spike': True, 'bear_rsi_required': False, 'sideways_strategy': 'mean_reversion', 'sideways_bb_std_mult': 3.300743336224834, 'sideways_rsi_os': 13, 'sideways_rsi_ob': 62, 'sideways_adx_thresh': 18.01424324479152, 'sideways_atr_min_pct': 0.006865706648534605, 'sideways_atr_max_pct': 0.1004894257229106, 'sideways_tp_mult': 2.584548306410251, 'sideways_tsl_mult': 0.026967198933981418, 'sideways_time_stop': 160, 'sideways_use_sma': True, 'sideways_use_ema': True, 'sideways_use_atr': False, 'sideways_use_adx': False, 'sideways_use_spike': False, 'sideways_rsi_required': False}.
