[I 2025-08-31 10:00:54,051] Trial 72 finished with values: [-0.018431930323110413, 0.018347807316686962] and parameters: {'p_sma': 11, 'p_std': 34, 'p_atr': 23, 'p_adx': 11, 'rsi_period': 58, 'ema1': 30, 'ema2': 53, 'slip_atr_k': 0.22334097299043043, 'slip_spread_k': 0.8752360938644389, 'spread_hl_frac': 0.047149968848649346, 'bb_std_mult': 2.160774720348811, 'rsi_os': 44, 'rsi_ob': 62, 'vol_spike': 0.27716728471060403, 'adx_thresh': 14.60129609592586, 'atr_min_pct': 0.010646370340394465, 'atr_max_pct': 0.1348663722739074, 'tp_mult': 2.3513183636268598, 'tsl_mult': 0.0007878884025246061, 'strategy': 'breakout', 'time_stop': 275, 'use_sma': True, 'use_atr': False, 'use_adx': True, 'use_ema': False, 'use_spike': False, 'rsi_required': True, 'edge_k': 0.8690511138959612, 'edge_cap': 0.9151554170045955, 'bull_strategy': 'mean_reversion', 'bull_bb_std_mult': 3.2513973349360565, 'bull_rsi_os': 34, 'bull_rsi_ob': 77, 'bull_adx_thresh': 29.33234917261767, 'bull_atr_min_pct': 0.00113286208357175, 'bull_atr_max_pct': 0.010696184814757717, 'bull_tp_mult': 2.7369675632259756, 'bull_tsl_mult': 0.5540562839610165, 'bull_time_stop': 71, 'bull_use_sma': True, 'bull_use_ema': False, 'bull_use_atr': False, 'bull_use_adx': False, 'bull_use_spike': False, 'bull_rsi_required': True, 'bear_strategy': 'breakout', 'bear_bb_std_mult': 2.6146877648057893, 'bear_rsi_os': 39, 'bear_rsi_ob': 89, 'bear_adx_thresh': 31.280537028149027, 'bear_atr_min_pct': 0.023040906496460997, 'bear_atr_max_pct': 0.08101254130771779, 'bear_tp_mult': 1.8889445267820186, 'bear_tsl_mult': 0.5642319748998794, 'bear_time_stop': 157, 'bear_use_sma': True, 'bear_use_ema': False, 'bear_use_atr': True, 'bear_use_adx': False, 'bear_use_spike': False, 'bear_rsi_required': False, 'sideways_strategy': 'breakout', 'sideways_bb_std_mult': 0.8465849702743738, 'sideways_rsi_os': 38, 'sideways_rsi_ob': 56, 'sideways_adx_thresh': 16.87651818132497, 'sideways_atr_min_pct': 0.00989536669478224, 'sideways_atr_max_pct': 0.10243394052224764, 'sideways_tp_mult': 2.098905387748601, 'sideways_tsl_mult': 0.5306158543629541, 'sideways_time_stop': 77, 'sideways_use_sma': False, 'sideways_use_ema': True, 'sideways_use_atr': False, 'sideways_use_adx': True, 'sideways_use_spike': False, 'sideways_rsi_required': False}.
[I 2025-08-31 10:00:54,227] Trial 75 finished with values: [-1000000000.0, 1000000000.0] and parameters: {'p_sma': 11, 'p_std': 17, 'p_atr': 30, 'p_adx': 28, 'rsi_period': 43, 'ema1': 21, 'ema2': 10, 'slip_atr_k': 0.17262780757786106, 'slip_spread_k': 0.6835605213146059, 'spread_hl_frac': 0.03821620126200027, 'bb_std_mult': 1.8998546353932027, 'rsi_os': 43, 'rsi_ob': 61, 'vol_spike': 0.24019287354001645, 'adx_thresh': 18.866282240642526, 'atr_min_pct': 0.009769208383703886, 'atr_max_pct': 0.11444349627874596, 'tp_mult': 1.887387506720024, 'tsl_mult': 0.82740029087006, 'strategy': 'mean_reversion', 'time_stop': 271, 'use_sma': False, 'use_atr': False, 'use_adx': True, 'use_ema': False, 'use_spike': False, 'rsi_required': False, 'edge_k': 1.522421930294877, 'edge_cap': 0.9071646212718895, 'bull_strategy': 'mean_reversion', 'bull_bb_std_mult': 0.7897257153110323, 'bull_rsi_os': 40, 'bull_rsi_ob': 93, 'bull_adx_thresh': 19.031498825942958, 'bull_atr_min_pct': 0.024372841251712997, 'bull_atr_max_pct': 0.02157167318629069, 'bull_tp_mult': 1.0287557402961385, 'bull_tsl_mult': 0.7971146155628155, 'bull_time_stop': 69, 'bull_use_sma': True, 'bull_use_ema': False, 'bull_use_atr': True, 'bull_use_adx': False, 'bull_use_spike': False, 'bull_rsi_required': True, 'bear_strategy': 'breakout', 'bear_bb_std_mult': 2.6075435992525837, 'bear_rsi_os': 40, 'bear_rsi_ob': 90, 'bear_adx_thresh': 20.54746307127568, 'bear_atr_min_pct': 0.029935623793239836, 'bear_atr_max_pct': 0.011038743081923397, 'bear_tp_mult': 2.9963922178260574, 'bear_tsl_mult': 0.5956797336209897, 'bear_time_stop': 89, 'bear_use_sma': True, 'bear_use_ema': False, 'bear_use_atr': True, 'bear_use_adx': False, 'bear_use_spike': False, 'bear_rsi_required': False, 'sideways_strategy': 'mean_reversion', 'sideways_bb_std_mult': 1.3578214736346932, 'sideways_rsi_os': 24, 'sideways_rsi_ob': 57, 'sideways_adx_thresh': 13.17079902440702, 'sideways_atr_min_pct': 0.01048665347850556, 'sideways_atr_max_pct': 0.05317065034320882, 'sideways_tp_mult': 2.0811301642255495, 'sideways_tsl_mult': 0.5360832277511299, 'sideways_time_stop': 172, 'sideways_use_sma': True, 'sideways_use_ema': True, 'sideways_use_atr': False, 'sideways_use_adx': True, 'sideways_use_spike': False, 'sideways_rsi_required': True}.
[I 2025-08-31 10:00:54,852] Trial 74 finished with values: [-0.030107317439053594, 0.029901219597228013] and parameters: {'p_sma': 11, 'p_std': 18, 'p_atr': 30, 'p_adx': 27, 'rsi_period': 43, 'ema1': 21, 'ema2': 10, 'slip_atr_k': 0.17028120626279758, 'slip_spread_k': 0.6519803999682094, 'spread_hl_frac': 0.03732363665813397, 'bb_std_mult': 2.1672197617942075, 'rsi_os': 24, 'rsi_ob': 61, 'vol_spike': 0.24044185928252768, 'adx_thresh': 19.173623238946742, 'atr_min_pct': 0.00906937102478118, 'atr_max_pct': 0.11536428167720766, 'tp_mult': 1.8778251149014562, 'tsl_mult': 0.8376597570617428, 'strategy': 'mean_reversion', 'time_stop': 225, 'use_sma': False, 'use_atr': False, 'use_adx': True, 'use_ema': False, 'use_spike': False, 'rsi_required': False, 'edge_k': 1.5128438545375358, 'edge_cap': 0.9197384954297569, 'bull_strategy': 'mean_reversion', 'bull_bb_std_mult': 0.8099444413151122, 'bull_rsi_os': 40, 'bull_rsi_ob': 60, 'bull_adx_thresh': 20.000745623402192, 'bull_atr_min_pct': 0.0009945416139580912, 'bull_atr_max_pct': 0.0214895322080789, 'bull_tp_mult': 1.0269439497117885, 'bull_tsl_mult': 0.7909890755281959, 'bull_time_stop': 71, 'bull_use_sma': True, 'bull_use_ema': False, 'bull_use_atr': True, 'bull_use_adx': False, 'bull_use_spike': False, 'bull_rsi_required': True, 'bear_strategy': 'breakout', 'bear_bb_std_mult': 2.556492118841387, 'bear_rsi_os': 53, 'bear_rsi_ob': 90, 'bear_adx_thresh': 20.694819134213745, 'bear_atr_min_pct': 0.02703171681675524, 'bear_atr_max_pct': 0.01179326145489924, 'bear_tp_mult': 2.6846076951593334, 'bear_tsl_mult': 0.6116778817099983, 'bear_time_stop': 73, 'bear_use_sma': True, 'bear_use_ema': False, 'bear_use_atr': True, 'bear_use_adx': False, 'bear_use_spike': False, 'bear_rsi_required': False, 'sideways_strategy': 'mean_reversion', 'sideways_bb_std_mult': 1.3775469052181923, 'sideways_rsi_os': 28, 'sideways_rsi_ob': 57, 'sideways_adx_thresh': 13.356371938498135, 'sideways_atr_min_pct': 0.009457183299833718, 'sideways_atr_max_pct': 0.056441785817991794, 'sideways_tp_mult': 2.0793624723057382, 'sideways_tsl_mult': 0.5416281136813741, 'sideways_time_stop': 170, 'sideways_use_sma': True, 'sideways_use_ema': True, 'sideways_use_atr': False, 'sideways_use_adx': True, 'sideways_use_spike': False, 'sideways_rsi_required': True}.
[I 2025-08-31 10:00:55,275] Trial 73 finished with values: [-0.014319577703794661, 0.014235397894458516] and parameters: {'p_sma': 11, 'p_std': 44, 'p_atr': 30, 'p_adx': 11, 'rsi_period': 14, 'ema1': 21, 'ema2': 15, 'slip_atr_k': 0.22353739358338778, 'slip_spread_k': 0.7454870180149257, 'spread_hl_frac': 0.010942354599155938, 'bb_std_mult': 1.4855602417716778, 'rsi_os': 44, 'rsi_ob': 61, 'vol_spike': 0.06149154092067098, 'adx_thresh': 19.051262109483996, 'atr_min_pct': 0.010478633224608645, 'atr_max_pct': 0.13601568318703772, 'tp_mult': 2.284786757098808, 'tsl_mult': 0.16405245291077197, 'strategy': 'mean_reversion', 'time_stop': 275, 'use_sma': False, 'use_atr': False, 'use_adx': True, 'use_ema': False, 'use_spike': False, 'rsi_required': True, 'edge_k': 1.5039591757109898, 'edge_cap': 0.9079174660621105, 'bull_strategy': 'mean_reversion', 'bull_bb_std_mult': 1.8285034038569359, 'bull_rsi_os': 51, 'bull_rsi_ob': 65, 'bull_adx_thresh': 18.567401239474975, 'bull_atr_min_pct': 0.0012549948815767146, 'bull_atr_max_pct': 0.021141809192898667, 'bull_tp_mult': 2.5554810803859, 'bull_tsl_mult': 0.12019477854796401, 'bull_time_stop': 35, 'bull_use_sma': True, 'bull_use_ema': False, 'bull_use_atr': True, 'bull_use_adx': False, 'bull_use_spike': False, 'bull_rsi_required': True, 'bear_strategy': 'breakout', 'bear_bb_std_mult': 2.5782081758999427, 'bear_rsi_os': 9, 'bear_rsi_ob': 62, 'bear_adx_thresh': 9.925259056002824, 'bear_atr_min_pct': 0.023126274807601977, 'bear_atr_max_pct': 0.09424563346854513, 'bear_tp_mult': 1.8865665667119105, 'bear_tsl_mult': 0.05134442684759816, 'bear_time_stop': 152, 'bear_use_sma': True, 'bear_use_ema': False, 'bear_use_atr': True, 'bear_use_adx': False, 'bear_use_spike': False, 'bear_rsi_required': False, 'sideways_strategy': 'breakout', 'sideways_bb_std_mult': 0.8775357215591905, 'sideways_rsi_os': 18, 'sideways_rsi_ob': 57, 'sideways_adx_thresh': 14.686841293047024, 'sideways_atr_min_pct': 0.010081477912483502, 'sideways_atr_max_pct': 0.10080863032439856, 'sideways_tp_mult': 2.1044643660991214, 'sideways_tsl_mult': 0.5446682180208392, 'sideways_time_stop': 81, 'sideways_use_sma': True, 'sideways_use_ema': True, 'sideways_use_atr': False, 'sideways_use_adx': True, 'sideways_use_spike': True, 'sideways_rsi_required': False}.
[I 2025-08-31 10:01:26,217] Trial 76 finished with values: [-1000000000.0, 1000000000.0] and parameters: {'p_sma': 9, 'p_std': 18, 'p_atr': 30, 'p_adx': 28, 'rsi_period': 52, 'ema1': 21, 'ema2': 10, 'slip_atr_k': 0.12545961582632503, 'slip_spread_k': 0.6505141999891295, 'spread_hl_frac': 0.037660999340760316, 'bb_std_mult': 1.501680090651199, 'rsi_os': 24, 'rsi_ob': 56, 'vol_spike': 0.23599356465827012, 'adx_thresh': 19.394500953038545, 'atr_min_pct': 0.01077641106980059, 'atr_max_pct': 0.11294708659491372, 'tp_mult': 1.8513463889636885, 'tsl_mult': 0.5385014389153423, 'strategy': 'mean_reversion', 'time_stop': 272, 'use_sma': False, 'use_atr': False, 'use_adx': True, 'use_ema': False, 'use_spike': False, 'rsi_required': False, 'edge_k': 1.5196933125196572, 'edge_cap': 0.9061339631889425, 'bull_strategy': 'mean_reversion', 'bull_bb_std_mult': 0.7765299014683102, 'bull_rsi_os': 39, 'bull_rsi_ob': 77, 'bull_adx_thresh': 24.959165018536666, 'bull_atr_min_pct': 0.023500800495528867, 'bull_atr_max_pct': 0.030059607950781914, 'bull_tp_mult': 1.0495476143659892, 'bull_tsl_mult': 0.8089348487182835, 'bull_time_stop': 74, 'bull_use_sma': True, 'bull_use_ema': False, 'bull_use_atr': True, 'bull_use_adx': False, 'bull_use_spike': False, 'bull_rsi_required': True, 'bear_strategy': 'breakout', 'bear_bb_std_mult': 2.579769651612314, 'bear_rsi_os': 52, 'bear_rsi_ob': 90, 'bear_adx_thresh': 20.01252164555873, 'bear_atr_min_pct': 0.02710084042712577, 'bear_atr_max_pct': 0.011391191073729198, 'bear_tp_mult': 2.9987275764073975, 'bear_tsl_mult': 0.579468275029019, 'bear_time_stop': 64, 'bear_use_sma': True, 'bear_use_ema': False, 'bear_use_atr': True, 'bear_use_adx': True, 'bear_use_spike': False, 'bear_rsi_required': False, 'sideways_strategy': 'mean_reversion', 'sideways_bb_std_mult': 1.3795879704113414, 'sideways_rsi_os': 24, 'sideways_rsi_ob': 57, 'sideways_adx_thresh': 7.508506370824906, 'sideways_atr_min_pct': 0.01006358416815243, 'sideways_atr_max_pct': 0.051822234778445886, 'sideways_tp_mult': 2.0814988691084073, 'sideways_tsl_mult': 0.5333853496539761, 'sideways_time_stop': 152, 'sideways_use_sma': True, 'sideways_use_ema': True, 'sideways_use_atr': False, 'sideways_use_adx': True, 'sideways_use_spike': False, 'sideways_rsi_required': True}.
[I 2025-08-31 10:01:26,547] Trial 79 finished with values: [-0.13877733200315712, 0.13843013601178214] and parameters: {'p_sma': 56, 'p_std': 13, 'p_atr': 30, 'p_adx': 29, 'rsi_period': 50, 'ema1': 22, 'ema2': 15, 'slip_atr_k': 0.15157413085833119, 'slip_spread_k': 0.743129417939544, 'spread_hl_frac': 0.03433513994475098, 'bb_std_mult': 1.4158278828892605, 'rsi_os': 19, 'rsi_ob': 56, 'vol_spike': 0.18052410620382012, 'adx_thresh': 21.063113660494054, 'atr_min_pct': 0.011105203976146344, 'atr_max_pct': 0.13281928189720527, 'tp_mult': 1.9560676524564014, 'tsl_mult': 0.5479848098654879, 'strategy': 'breakout', 'time_stop': 277, 'use_sma': True, 'use_atr': True, 'use_adx': True, 'use_ema': True, 'use_spike': False, 'rsi_required': False, 'edge_k': 1.7827351968804996, 'edge_cap': 0.14476496395143446, 'bull_strategy': 'breakout', 'bull_bb_std_mult': 1.0339837409965678, 'bull_rsi_os': 43, 'bull_rsi_ob': 63, 'bull_adx_thresh': 29.196402775714322, 'bull_atr_min_pct': 0.016117647010267962, 'bull_atr_max_pct': 0.02987733170923222, 'bull_tp_mult': 1.1134812878228821, 'bull_tsl_mult': 0.6979596127966377, 'bull_time_stop': 36, 'bull_use_sma': True, 'bull_use_ema': False, 'bull_use_atr': True, 'bull_use_adx': True, 'bull_use_spike': False, 'bull_rsi_required': True, 'bear_strategy': 'mean_reversion', 'bear_bb_std_mult': 2.0750280297558277, 'bear_rsi_os': 49, 'bear_rsi_ob': 87, 'bear_adx_thresh': 24.521680738468028, 'bear_atr_min_pct': 0.001958326349830706, 'bear_atr_max_pct': 0.03541729967638183, 'bear_tp_mult': 2.6603800806776974, 'bear_tsl_mult': 0.5597151644885785, 'bear_time_stop': 97, 'bear_use_sma': True, 'bear_use_ema': False, 'bear_use_atr': True, 'bear_use_adx': True, 'bear_use_spike': False, 'bear_rsi_required': True, 'sideways_strategy': 'mean_reversion', 'sideways_bb_std_mult': 1.173024337410022, 'sideways_rsi_os': 17, 'sideways_rsi_ob': 59, 'sideways_adx_thresh': 10.777103352933292, 'sideways_atr_min_pct': 0.012960110398642513, 'sideways_atr_max_pct': 0.10095383369380809, 'sideways_tp_mult': 2.175004416068559, 'sideways_tsl_mult': 0.36833690268637465, 'sideways_time_stop': 219, 'sideways_use_sma': False, 'sideways_use_ema': True, 'sideways_use_atr': False, 'sideways_use_adx': True, 'sideways_use_spike': False, 'sideways_rsi_required': True}.
[I 2025-08-31 10:01:26,618] Trial 78 finished with values: [-1000000000.0, 1000000000.0] and parameters: {'p_sma': 8, 'p_std': 14, 'p_atr': 30, 'p_adx': 23, 'rsi_period': 52, 'ema1': 22, 'ema2': 15, 'slip_atr_k': 0.155171538210171, 'slip_spread_k': 0.7422101252732928, 'spread_hl_frac': 0.03507592561982286, 'bb_std_mult': 1.5817261736675226, 'rsi_os': 19, 'rsi_ob': 56, 'vol_spike': 0.210884549405832, 'adx_thresh': 21.555747993678636, 'atr_min_pct': 0.010645413500987258, 'atr_max_pct': 0.1128630968369757, 'tp_mult': 1.8045342487298894, 'tsl_mult': 0.5602292243532387, 'strategy': 'breakout', 'time_stop': 248, 'use_sma': True, 'use_atr': True, 'use_adx': True, 'use_ema': True, 'use_spike': False, 'rsi_required': False, 'edge_k': 1.7474850229735774, 'edge_cap': 0.1620840083879198, 'bull_strategy': 'breakout', 'bull_bb_std_mult': 0.5044005623075379, 'bull_rsi_os': 37, 'bull_rsi_ob': 77, 'bull_adx_thresh': 12.159152734461436, 'bull_atr_min_pct': 0.016096219841502904, 'bull_atr_max_pct': 0.027645761917960903, 'bull_tp_mult': 1.1020086563810718, 'bull_tsl_mult': 0.8129881315488784, 'bull_time_stop': 35, 'bull_use_sma': True, 'bull_use_ema': False, 'bull_use_atr': True, 'bull_use_adx': True, 'bull_use_spike': False, 'bull_rsi_required': True, 'bear_strategy': 'breakout', 'bear_bb_std_mult': 2.0931959955851216, 'bear_rsi_os': 37, 'bear_rsi_ob': 86, 'bear_adx_thresh': 31.541493240913372, 'bear_atr_min_pct': 0.002104497474347362, 'bear_atr_max_pct': 0.03586586777726791, 'bear_tp_mult': 2.675474588121519, 'bear_tsl_mult': 0.6953831077348428, 'bear_time_stop': 96, 'bear_use_sma': True, 'bear_use_ema': False, 'bear_use_atr': True, 'bear_use_adx': True, 'bear_use_spike': False, 'bear_rsi_required': True, 'sideways_strategy': 'mean_reversion', 'sideways_bb_std_mult': 1.1828937492654918, 'sideways_rsi_os': 37, 'sideways_rsi_ob': 60, 'sideways_adx_thresh': 10.964614463842503, 'sideways_atr_min_pct': 0.012755533939681315, 'sideways_atr_max_pct': 0.10353638656631825, 'sideways_tp_mult': 2.203837640947408, 'sideways_tsl_mult': 0.37301137605016566, 'sideways_time_stop': 222, 'sideways_use_sma': False, 'sideways_use_ema': True, 'sideways_use_atr': False, 'sideways_use_adx': True, 'sideways_use_spike': False, 'sideways_rsi_required': True}.
[I 2025-08-31 10:01:26,850] Trial 77 finished with values: [-1000000000.0, 1000000000.0] and parameters: {'p_sma': 51, 'p_std': 57, 'p_atr': 30, 'p_adx': 25, 'rsi_period': 52, 'ema1': 19, 'ema2': 14, 'slip_atr_k': 0.07579583059312643, 'slip_spread_k': 0.5767506051096905, 'spread_hl_frac': 0.034236450076899065, 'bb_std_mult': 2.241641320013219, 'rsi_os': 24, 'rsi_ob': 62, 'vol_spike': 0.212809085602353, 'adx_thresh': 19.31905539248551, 'atr_min_pct': 0.011044883749544421, 'atr_max_pct': 0.11190957492889027, 'tp_mult': 1.8149913206601755, 'tsl_mult': 0.540283362875225, 'strategy': 'breakout', 'time_stop': 242, 'use_sma': True, 'use_atr': True, 'use_adx': True, 'use_ema': True, 'use_spike': False, 'rsi_required': False, 'edge_k': 1.7189698658806096, 'edge_cap': 0.9737106082001065, 'bull_strategy': 'mean_reversion', 'bull_bb_std_mult': 0.5320797623796933, 'bull_rsi_os': 43, 'bull_rsi_ob': 77, 'bull_adx_thresh': 25.31872434898917, 'bull_atr_min_pct': 0.015995929121302325, 'bull_atr_max_pct': 0.029879881954244625, 'bull_tp_mult': 1.1036272639622946, 'bull_tsl_mult': 0.8171544345138659, 'bull_time_stop': 34, 'bull_use_sma': True, 'bull_use_ema': False, 'bull_use_atr': True, 'bull_use_adx': False, 'bull_use_spike': False, 'bull_rsi_required': True, 'bear_strategy': 'breakout', 'bear_bb_std_mult': 2.555061418911311, 'bear_rsi_os': 52, 'bear_rsi_ob': 89, 'bear_adx_thresh': 21.554187756546774, 'bear_atr_min_pct': 0.02719624409415853, 'bear_atr_max_pct': 0.02016629604431824, 'bear_tp_mult': 2.65239569054273, 'bear_tsl_mult': 0.6851910770831223, 'bear_time_stop': 76, 'bear_use_sma': True, 'bear_use_ema': False, 'bear_use_atr': True, 'bear_use_adx': True, 'bear_use_spike': False, 'bear_rsi_required': False, 'sideways_strategy': 'mean_reversion', 'sideways_bb_std_mult': 1.2097820069585423, 'sideways_rsi_os': 37, 'sideways_rsi_ob': 60, 'sideways_adx_thresh': 10.907233135008955, 'sideways_atr_min_pct': 0.012383663668676562, 'sideways_atr_max_pct': 0.06368786655175844, 'sideways_tp_mult': 2.148960007555221, 'sideways_tsl_mult': 0.5200985648031451, 'sideways_time_stop': 220, 'sideways_use_sma': False, 'sideways_use_ema': True, 'sideways_use_atr': False, 'sideways_use_adx': True, 'sideways_use_spike': False, 'sideways_rsi_required': True}.
[I 2025-08-31 10:01:59,015] Trial 80 finished with values: [-1000000000.0, 1000000000.0] and parameters: {'p_sma': 7, 'p_std': 56, 'p_atr': 29, 'p_adx': 23, 'rsi_period': 56, 'ema1': 19, 'ema2': 15, 'slip_atr_k': 0.0981755544942596, 'slip_spread_k': 0.7558646390626838, 'spread_hl_frac': 0.03468620240710361, 'bb_std_mult': 1.6792195672156796, 'rsi_os': 19, 'rsi_ob': 85, 'vol_spike': 0.18193727593375197, 'adx_thresh': 21.206430701105088, 'atr_min_pct': 0.014304647379480229, 'atr_max_pct': 0.11073995441235086, 'tp_mult': 2.376760728153977, 'tsl_mult': 0.6324979800932624, 'strategy': 'breakout', 'time_stop': 65, 'use_sma': True, 'use_atr': True, 'use_adx': False, 'use_ema': True, 'use_spike': True, 'rsi_required': False, 'edge_k': 1.7254228953385704, 'edge_cap': 0.9851996373590112, 'bull_strategy': 'breakout', 'bull_bb_std_mult': 0.9489975721192234, 'bull_rsi_os': 43, 'bull_rsi_ob': 92, 'bull_adx_thresh': 27.288147340611406, 'bull_atr_min_pct': 0.01636765990409639, 'bull_atr_max_pct': 0.01185629446108527, 'bull_tp_mult': 1.1306357980165405, 'bull_tsl_mult': 0.6838086814201807, 'bull_time_stop': 33, 'bull_use_sma': True, 'bull_use_ema': False, 'bull_use_atr': True, 'bull_use_adx': True, 'bull_use_spike': True, 'bull_rsi_required': True, 'bear_strategy': 'mean_reversion', 'bear_bb_std_mult': 2.4122490337164697, 'bear_rsi_os': 55, 'bear_rsi_ob': 87, 'bear_adx_thresh': 25.008073523837183, 'bear_atr_min_pct': 0.01289904306722623, 'bear_atr_max_pct': 0.03852378023885679, 'bear_tp_mult': 2.642237784912279, 'bear_tsl_mult': 0.6871768673173243, 'bear_time_stop': 94, 'bear_use_sma': True, 'bear_use_ema': False, 'bear_use_atr': True, 'bear_use_adx': True, 'bear_use_spike': False, 'bear_rsi_required': True, 'sideways_strategy': 'mean_reversion', 'sideways_bb_std_mult': 1.1915778070623184, 'sideways_rsi_os': 19, 'sideways_rsi_ob': 55, 'sideways_adx_thresh': 17.003521872570275, 'sideways_atr_min_pct': 0.012701089907706659, 'sideways_atr_max_pct': 0.06339759485851115, 'sideways_tp_mult': 2.1841670502495263, 'sideways_tsl_mult': 0.3837686321246509, 'sideways_time_stop': 216, 'sideways_use_sma': False, 'sideways_use_ema': True, 'sideways_use_atr': False, 'sideways_use_adx': True, 'sideways_use_spike': False, 'sideways_rsi_required': True}.
