[I 2025-08-31 10:05:12,916] Trial 109 finished with values: [-0.0366841973136568, 0.0366024117638438] and parameters: {'p_sma': 34, 'p_std': 12, 'p_atr': 30, 'p_adx': 28, 'rsi_period': 54, 'ema1': 17, 'ema2': 47, 'slip_atr_k': 0.17480879475001182, 'slip_spread_k': 0.7055490086842479, 'spread_hl_frac': 0.04804286161355908, 'bb_std_mult': 2.3395644691735997, 'rsi_os': 5, 'rsi_ob': 71, 'vol_spike': 0.14030785058609008, 'adx_thresh': 20.002876068134793, 'atr_min_pct': 0.013290805707891548, 'atr_max_pct': 0.04426894496673729, 'tp_mult': 2.6759281658921568, 'tsl_mult': 0.7817895927778941, 'strategy': 'breakout', 'time_stop': 76, 'use_sma': False, 'use_atr': True, 'use_adx': False, 'use_ema': True, 'use_spike': True, 'rsi_required': False, 'edge_k': 0.5953938223070591, 'edge_cap': 0.5682990604880158, 'bull_strategy': 'mean_reversion', 'bull_bb_std_mult': 0.7611802007354855, 'bull_rsi_os': 31, 'bull_rsi_ob': 91, 'bull_adx_thresh': 15.550524814087296, 'bull_atr_min_pct': 0.0017437916235746149, 'bull_atr_max_pct': 0.07709879583389495, 'bull_tp_mult': 1.6312290507920544, 'bull_tsl_mult': 0.7545288714188595, 'bull_time_stop': 32, 'bull_use_sma': True, 'bull_use_ema': True, 'bull_use_atr': True, 'bull_use_adx': False, 'bull_use_spike': False, 'bull_rsi_required': False, 'bear_strategy': 'mean_reversion', 'bear_bb_std_mult': 2.502030814799751, 'bear_rsi_os': 51, 'bear_rsi_ob': 91, 'bear_adx_thresh': 21.2218547391597, 'bear_atr_min_pct': 0.029373197234356798, 'bear_atr_max_pct': 0.037689302231675985, 'bear_tp_mult': 2.7022611351760304, 'bear_tsl_mult': 0.7793258929937347, 'bear_time_stop': 65, 'bear_use_sma': True, 'bear_use_ema': False, 'bear_use_atr': False, 'bear_use_adx': True, 'bear_use_spike': True, 'bear_rsi_required': False, 'sideways_strategy': 'mean_reversion', 'sideways_bb_std_mult': 0.5844419472341924, 'sideways_rsi_os': 14, 'sideways_rsi_ob': 60, 'sideways_adx_thresh': 32.63765246263118, 'sideways_atr_min_pct': 0.00029204707968976534, 'sideways_atr_max_pct': 0.04365363917816182, 'sideways_tp_mult': 2.220074672872844, 'sideways_tsl_mult': 0.6210547307172759, 'sideways_time_stop': 40, 'sideways_use_sma': False, 'sideways_use_ema': True, 'sideways_use_atr': True, 'sideways_use_adx': True, 'sideways_use_spike': False, 'sideways_rsi_required': True}.
[I 2025-08-31 10:05:13,015] Trial 108 finished with values: [-1000000000.0, 1000000000.0] and parameters: {'p_sma': 13, 'p_std': 28, 'p_atr': 29, 'p_adx': 28, 'rsi_period': 36, 'ema1': 21, 'ema2': 13, 'slip_atr_k': 0.17377960673594403, 'slip_spread_k': 0.7752846079581256, 'spread_hl_frac': 0.04763943349500366, 'bb_std_mult': 2.3784241721077986, 'rsi_os': 18, 'rsi_ob': 57, 'vol_spike': 0.27229201812760817, 'adx_thresh': 19.75710020158366, 'atr_min_pct': 0.013364366243501674, 'atr_max_pct': 0.1216755361983326, 'tp_mult': 2.8685208931277693, 'tsl_mult': 0.7708670499627661, 'strategy': 'breakout', 'time_stop': 193, 'use_sma': False, 'use_atr': True, 'use_adx': False, 'use_ema': True, 'use_spike': True, 'rsi_required': False, 'edge_k': 1.0706741630236838, 'edge_cap': 0.93897292848526, 'bull_strategy': 'mean_reversion', 'bull_bb_std_mult': 1.8762710860869913, 'bull_rsi_os': 29, 'bull_rsi_ob': 91, 'bull_adx_thresh': 30.777973809579013, 'bull_atr_min_pct': 0.020065158577273874, 'bull_atr_max_pct': 0.03273756001910382, 'bull_tp_mult': 1.5810313899635458, 'bull_tsl_mult': 0.6264080432646726, 'bull_time_stop': 298, 'bull_use_sma': True, 'bull_use_ema': True, 'bull_use_atr': True, 'bull_use_adx': False, 'bull_use_spike': False, 'bull_rsi_required': False, 'bear_strategy': 'mean_reversion', 'bear_bb_std_mult': 2.518236769477048, 'bear_rsi_os': 51, 'bear_rsi_ob': 62, 'bear_adx_thresh': 18.570219437734828, 'bear_atr_min_pct': 0.026525538287009626, 'bear_atr_max_pct': 0.014618462250862548, 'bear_tp_mult': 2.71441741211633, 'bear_tsl_mult': 0.6543319886239398, 'bear_time_stop': 105, 'bear_use_sma': True, 'bear_use_ema': False, 'bear_use_atr': False, 'bear_use_adx': True, 'bear_use_spike': True, 'bear_rsi_required': False, 'sideways_strategy': 'mean_reversion', 'sideways_bb_std_mult': 1.7867320465999348, 'sideways_rsi_os': 18, 'sideways_rsi_ob': 82, 'sideways_adx_thresh': 19.45451515628871, 'sideways_atr_min_pct': 0.0012639137345359427, 'sideways_atr_max_pct': 0.04229132950449398, 'sideways_tp_mult': 2.3981150246418137, 'sideways_tsl_mult': 0.5451749962474444, 'sideways_time_stop': 101, 'sideways_use_sma': False, 'sideways_use_ema': True, 'sideways_use_atr': True, 'sideways_use_adx': True, 'sideways_use_spike': False, 'sideways_rsi_required': True}.
[I 2025-08-31 10:05:42,974] Trial 112 finished with values: [-1000000000.0, 1000000000.0] and parameters: {'p_sma': 39, 'p_std': 28, 'p_atr': 12, 'p_adx': 8, 'rsi_period': 49, 'ema1': 23, 'ema2': 13, 'slip_atr_k': 0.18615151283836004, 'slip_spread_k': 0.776532588708517, 'spread_hl_frac': 0.035368287662899275, 'bb_std_mult': 3.423589411113761, 'rsi_os': 14, 'rsi_ob': 60, 'vol_spike': 0.2653257072333312, 'adx_thresh': 18.63236701334484, 'atr_min_pct': 0.009371054298123406, 'atr_max_pct': 0.02421549823709112, 'tp_mult': 2.0132580773828384, 'tsl_mult': 0.8490822593941421, 'strategy': 'breakout', 'time_stop': 170, 'use_sma': True, 'use_atr': False, 'use_adx': False, 'use_ema': False, 'use_spike': True, 'rsi_required': False, 'edge_k': 0.912953316787293, 'edge_cap': 0.9307276678895329, 'bull_strategy': 'breakout', 'bull_bb_std_mult': 0.8331955070716625, 'bull_rsi_os': 28, 'bull_rsi_ob': 93, 'bull_adx_thresh': 30.072771976806152, 'bull_atr_min_pct': 0.029763066176305975, 'bull_atr_max_pct': 0.027304773707734424, 'bull_tp_mult': 1.1501455253152038, 'bull_tsl_mult': 0.4737218514795855, 'bull_time_stop': 141, 'bull_use_sma': True, 'bull_use_ema': True, 'bull_use_atr': True, 'bull_use_adx': True, 'bull_use_spike': True, 'bull_rsi_required': False, 'bear_strategy': 'mean_reversion', 'bear_bb_std_mult': 2.6195766607206776, 'bear_rsi_os': 50, 'bear_rsi_ob': 94, 'bear_adx_thresh': 20.348071076250477, 'bear_atr_min_pct': 0.02031514232279307, 'bear_atr_max_pct': 0.13957391903332245, 'bear_tp_mult': 2.487310621909722, 'bear_tsl_mult': 0.9694785224117479, 'bear_time_stop': 243, 'bear_use_sma': False, 'bear_use_ema': False, 'bear_use_atr': True, 'bear_use_adx': True, 'bear_use_spike': False, 'bear_rsi_required': True, 'sideways_strategy': 'mean_reversion', 'sideways_bb_std_mult': 2.8638109662873, 'sideways_rsi_os': 25, 'sideways_rsi_ob': 77, 'sideways_adx_thresh': 19.781088156435356, 'sideways_atr_min_pct': 0.016720016322264126, 'sideways_atr_max_pct': 0.03364771467252106, 'sideways_tp_mult': 2.3905824448279147, 'sideways_tsl_mult': 0.9600675010105704, 'sideways_time_stop': 24, 'sideways_use_sma': True, 'sideways_use_ema': False, 'sideways_use_atr': False, 'sideways_use_adx': False, 'sideways_use_spike': False, 'sideways_rsi_required': True}.
[I 2025-08-31 10:05:43,003] Trial 111 finished with values: [-1000000000.0, 1000000000.0] and parameters: {'p_sma': 11, 'p_std': 47, 'p_atr': 30, 'p_adx': 26, 'rsi_period': 49, 'ema1': 17, 'ema2': 41, 'slip_atr_k': 0.17460791702519718, 'slip_spread_k': 0.7674330147822305, 'spread_hl_frac': 0.036906232369479576, 'bb_std_mult': 3.4074048964008288, 'rsi_os': 53, 'rsi_ob': 86, 'vol_spike': 0.26630050232164526, 'adx_thresh': 27.874269971195936, 'atr_min_pct': 0.0033148238086720214, 'atr_max_pct': 0.023955859717675845, 'tp_mult': 1.551110696850494, 'tsl_mult': 0.842220693083074, 'strategy': 'breakout', 'time_stop': 169, 'use_sma': False, 'use_atr': False, 'use_adx': False, 'use_ema': False, 'use_spike': True, 'rsi_required': False, 'edge_k': 1.0351817348188503, 'edge_cap': 0.9392327873119627, 'bull_strategy': 'breakout', 'bull_bb_std_mult': 1.4232209850961168, 'bull_rsi_os': 32, 'bull_rsi_ob': 91, 'bull_adx_thresh': 20.91320271681028, 'bull_atr_min_pct': 0.026514492258301003, 'bull_atr_max_pct': 0.027335371636705387, 'bull_tp_mult': 1.7506279526609587, 'bull_tsl_mult': 0.4755438455114788, 'bull_time_stop': 23, 'bull_use_sma': True, 'bull_use_ema': True, 'bull_use_atr': True, 'bull_use_adx': True, 'bull_use_spike': False, 'bull_rsi_required': False, 'bear_strategy': 'mean_reversion', 'bear_bb_std_mult': 1.6105584438029135, 'bear_rsi_os': 50, 'bear_rsi_ob': 94, 'bear_adx_thresh': 20.281718108372615, 'bear_atr_min_pct': 0.020364908281976027, 'bear_atr_max_pct': 0.034784987020449104, 'bear_tp_mult': 2.7122579227025048, 'bear_tsl_mult': 0.5607278220698007, 'bear_time_stop': 102, 'bear_use_sma': True, 'bear_use_ema': False, 'bear_use_atr': True, 'bear_use_adx': True, 'bear_use_spike': True, 'bear_rsi_required': True, 'sideways_strategy': 'mean_reversion', 'sideways_bb_std_mult': 2.148873174723781, 'sideways_rsi_os': 18, 'sideways_rsi_ob': 83, 'sideways_adx_thresh': 30.36733658196942, 'sideways_atr_min_pct': 0.0017137760853262844, 'sideways_atr_max_pct': 0.04430205402147175, 'sideways_tp_mult': 1.8171630676576147, 'sideways_tsl_mult': 0.14866434869033274, 'sideways_time_stop': 80, 'sideways_use_sma': True, 'sideways_use_ema': False, 'sideways_use_atr': True, 'sideways_use_adx': True, 'sideways_use_spike': False, 'sideways_rsi_required': True}.
[I 2025-08-31 10:05:43,389] Trial 110 finished with values: [-0.021112779062805398, 0.02098222968326843] and parameters: {'p_sma': 34, 'p_std': 47, 'p_atr': 19, 'p_adx': 9, 'rsi_period': 48, 'ema1': 21, 'ema2': 13, 'slip_atr_k': 0.17114993997378877, 'slip_spread_k': 0.26172759862985473, 'spread_hl_frac': 0.03838797412449181, 'bb_std_mult': 2.3590888060393973, 'rsi_os': 53, 'rsi_ob': 71, 'vol_spike': 0.20062336047138918, 'adx_thresh': 18.70171252967006, 'atr_min_pct': 0.0030628444889027676, 'atr_max_pct': 0.06627395425450115, 'tp_mult': 2.01548517502469, 'tsl_mult': 0.8496534277808706, 'strategy': 'breakout', 'time_stop': 162, 'use_sma': False, 'use_atr': True, 'use_adx': False, 'use_ema': True, 'use_spike': True, 'rsi_required': False, 'edge_k': 0.8656259662125152, 'edge_cap': 0.9463947782792352, 'bull_strategy': 'breakout', 'bull_bb_std_mult': 1.4083535994360594, 'bull_rsi_os': 28, 'bull_rsi_ob': 91, 'bull_adx_thresh': 24.560086020926697, 'bull_atr_min_pct': 0.001934813909315542, 'bull_atr_max_pct': 0.06359043184367387, 'bull_tp_mult': 2.1090814422909245, 'bull_tsl_mult': 0.40180912221139486, 'bull_time_stop': 31, 'bull_use_sma': True, 'bull_use_ema': True, 'bull_use_atr': True, 'bull_use_adx': True, 'bull_use_spike': False, 'bull_rsi_required': False, 'bear_strategy': 'mean_reversion', 'bear_bb_std_mult': 0.7006442436035532, 'bear_rsi_os': 50, 'bear_rsi_ob': 91, 'bear_adx_thresh': 18.63591283295093, 'bear_atr_min_pct': 0.023751362710071337, 'bear_atr_max_pct': 0.1395277101890683, 'bear_tp_mult': 2.5171505211967786, 'bear_tsl_mult': 0.46880442311798576, 'bear_time_stop': 101, 'bear_use_sma': True, 'bear_use_ema': False, 'bear_use_atr': True, 'bear_use_adx': True, 'bear_use_spike': True, 'bear_rsi_required': True, 'sideways_strategy': 'mean_reversion', 'sideways_bb_std_mult': 2.879684869972185, 'sideways_rsi_os': 14, 'sideways_rsi_ob': 77, 'sideways_adx_thresh': 33.0476454246936, 'sideways_atr_min_pct': 0.002023321507398524, 'sideways_atr_max_pct': 0.04504129128486973, 'sideways_tp_mult': 2.398627393158939, 'sideways_tsl_mult': 0.5499992453702998, 'sideways_time_stop': 35, 'sideways_use_sma': True, 'sideways_use_ema': True, 'sideways_use_atr': True, 'sideways_use_adx': True, 'sideways_use_spike': False, 'sideways_rsi_required': True}.
[I 2025-08-31 10:05:43,485] Trial 113 finished with values: [-0.023376641434003087, 0.023293409306871984] and parameters: {'p_sma': 40, 'p_std': 48, 'p_atr': 8, 'p_adx': 27, 'rsi_period': 48, 'ema1': 14, 'ema2': 40, 'slip_atr_k': 0.20105462945505023, 'slip_spread_k': 0.792579989966725, 'spread_hl_frac': 0.03666163464007364, 'bb_std_mult': 3.21168444914208, 'rsi_os': 15, 'rsi_ob': 78, 'vol_spike': 0.20110318188321527, 'adx_thresh': 14.738719668687288, 'atr_min_pct': 0.019579642204802634, 'atr_max_pct': 0.11655115172954288, 'tp_mult': 2.0137930734460667, 'tsl_mult': 0.8187904447514147, 'strategy': 'breakout', 'time_stop': 287, 'use_sma': True, 'use_atr': False, 'use_adx': True, 'use_ema': False, 'use_spike': False, 'rsi_required': False, 'edge_k': 1.531396041184907, 'edge_cap': 0.8317775895274329, 'bull_strategy': 'breakout', 'bull_bb_std_mult': 0.8397527534990337, 'bull_rsi_os': 36, 'bull_rsi_ob': 93, 'bull_adx_thresh': 24.557700172414584, 'bull_atr_min_pct': 1.7905723694824687e-05, 'bull_atr_max_pct': 0.05372721291605467, 'bull_tp_mult': 1.7746874011434703, 'bull_tsl_mult': 0.34641582368052515, 'bull_time_stop': 82, 'bull_use_sma': True, 'bull_use_ema': False, 'bull_use_atr': True, 'bull_use_adx': True, 'bull_use_spike': True, 'bull_rsi_required': True, 'bear_strategy': 'breakout', 'bear_bb_std_mult': 1.6138828784933739, 'bear_rsi_os': 54, 'bear_rsi_ob': 94, 'bear_adx_thresh': 20.32821773507988, 'bear_atr_min_pct': 0.008720215311534038, 'bear_atr_max_pct': 0.019129905321189813, 'bear_tp_mult': 2.5221280166671103, 'bear_tsl_mult': 0.5563484879532145, 'bear_time_stop': 101, 'bear_use_sma': False, 'bear_use_ema': True, 'bear_use_atr': True, 'bear_use_adx': False, 'bear_use_spike': False, 'bear_rsi_required': True, 'sideways_strategy': 'mean_reversion', 'sideways_bb_std_mult': 0.8029416158061428, 'sideways_rsi_os': 23, 'sideways_rsi_ob': 54, 'sideways_adx_thresh': 11.559953617950395, 'sideways_atr_min_pct': 0.017756234968322814, 'sideways_atr_max_pct': 0.033938267626191045, 'sideways_tp_mult': 1.111220931391195, 'sideways_tsl_mult': 0.5955066008001172, 'sideways_time_stop': 156, 'sideways_use_sma': True, 'sideways_use_ema': False, 'sideways_use_atr': False, 'sideways_use_adx': False, 'sideways_use_spike': False, 'sideways_rsi_required': True}.
[I 2025-08-31 10:06:14,796] Trial 114 finished with values: [-1000000000.0, 1000000000.0] and parameters: {'p_sma': 6, 'p_std': 14, 'p_atr': 8, 'p_adx': 30, 'rsi_period': 63, 'ema1': 8, 'ema2': 19, 'slip_atr_k': 0.011972495132139507, 'slip_spread_k': 0.6359834299761307, 'spread_hl_frac': 0.033128865959709104, 'bb_std_mult': 1.311021971541411, 'rsi_os': 16, 'rsi_ob': 78, 'vol_spike': 0.23907518421639323, 'adx_thresh': 22.03030671078493, 'atr_min_pct': 0.022294619835093055, 'atr_max_pct': 0.11679897565132719, 'tp_mult': 2.0112412242927036, 'tsl_mult': 0.818312193727024, 'strategy': 'mean_reversion', 'time_stop': 290, 'use_sma': True, 'use_atr': False, 'use_adx': True, 'use_ema': False, 'use_spike': False, 'rsi_required': False, 'edge_k': 1.5203940626456363, 'edge_cap': 0.9715696587575516, 'bull_strategy': 'mean_reversion', 'bull_bb_std_mult': 1.5946599431443214, 'bull_rsi_os': 12, 'bull_rsi_ob': 89, 'bull_adx_thresh': 29.881158671415424, 'bull_atr_min_pct': 0.0019620770051245484, 'bull_atr_max_pct': 0.09343549379684747, 'bull_tp_mult': 1.056732983174998, 'bull_tsl_mult': 0.3748092708398634, 'bull_time_stop': 46, 'bull_use_sma': True, 'bull_use_ema': False, 'bull_use_atr': True, 'bull_use_adx': False, 'bull_use_spike': False, 'bull_rsi_required': True, 'bear_strategy': 'breakout', 'bear_bb_std_mult': 0.9434088604076287, 'bear_rsi_os': 27, 'bear_rsi_ob': 88, 'bear_adx_thresh': 22.157565980153386, 'bear_atr_min_pct': 0.023585927022928246, 'bear_atr_max_pct': 0.018903176167320263, 'bear_tp_mult': 2.113635507861955, 'bear_tsl_mult': 0.47414875783737664, 'bear_time_stop': 120, 'bear_use_sma': True, 'bear_use_ema': True, 'bear_use_atr': True, 'bear_use_adx': False, 'bear_use_spike': False, 'bear_rsi_required': False, 'sideways_strategy': 'mean_reversion', 'sideways_bb_std_mult': 0.8202907693448985, 'sideways_rsi_os': 33, 'sideways_rsi_ob': 52, 'sideways_adx_thresh': 28.80617394880177, 'sideways_atr_min_pct': 0.009143343379179256, 'sideways_atr_max_pct': 0.028749910101908915, 'sideways_tp_mult': 1.687585469617757, 'sideways_tsl_mult': 0.590345342216143, 'sideways_time_stop': 210, 'sideways_use_sma': False, 'sideways_use_ema': True, 'sideways_use_atr': False, 'sideways_use_adx': True, 'sideways_use_spike': False, 'sideways_rsi_required': True}.
[I 2025-08-31 10:06:14,998] Trial 115 finished with values: [-0.053019697728338366, 0.05294021741523708] and parameters: {'p_sma': 30, 'p_std': 14, 'p_atr': 27, 'p_adx': 11, 'rsi_period': 68, 'ema1': 14, 'ema2': 58, 'slip_atr_k': 0.18163536762104315, 'slip_spread_k': 0.8226587078700061, 'spread_hl_frac': 0.014592420678184623, 'bb_std_mult': 3.2187486040521103, 'rsi_os': 35, 'rsi_ob': 51, 'vol_spike': 0.25628207739370734, 'adx_thresh': 21.976541530813382, 'atr_min_pct': 0.01892990065404518, 'atr_max_pct': 0.11709938053378573, 'tp_mult': 2.0167513275942497, 'tsl_mult': 0.811625328703842, 'strategy': 'mean_reversion', 'time_stop': 149, 'use_sma': True, 'use_atr': False, 'use_adx': True, 'use_ema': False, 'use_spike': False, 'rsi_required': False, 'edge_k': 1.6884922119264447, 'edge_cap': 0.9713493611366896, 'bull_strategy': 'mean_reversion', 'bull_bb_std_mult': 1.5833634014548963, 'bull_rsi_os': 8, 'bull_rsi_ob': 89, 'bull_adx_thresh': 7.92582818265914, 'bull_atr_min_pct': 0.0019025221030346908, 'bull_atr_max_pct': 0.019570330500414432, 'bull_tp_mult': 1.1023602654520086, 'bull_tsl_mult': 0.36913927840774785, 'bull_time_stop': 127, 'bull_use_sma': True, 'bull_use_ema': False, 'bull_use_atr': True, 'bull_use_adx': False, 'bull_use_spike': False, 'bull_rsi_required': True, 'bear_strategy': 'breakout', 'bear_bb_std_mult': 2.713793832068802, 'bear_rsi_os': 54, 'bear_rsi_ob': 88, 'bear_adx_thresh': 22.13926783066079, 'bear_atr_min_pct': 0.011140585787032461, 'bear_atr_max_pct': 0.018766250019865368, 'bear_tp_mult': 2.9475260778553882, 'bear_tsl_mult': 0.4515061454603387, 'bear_time_stop': 119, 'bear_use_sma': True, 'bear_use_ema': True, 'bear_use_atr': True, 'bear_use_adx': False, 'bear_use_spike': False, 'bear_rsi_required': False, 'sideways_strategy': 'mean_reversion', 'sideways_bb_std_mult': 0.7856154922323912, 'sideways_rsi_os': 31, 'sideways_rsi_ob': 52, 'sideways_adx_thresh': 20.644230287810174, 'sideways_atr_min_pct': 0.017323177342674332, 'sideways_atr_max_pct': 0.027929168012715125, 'sideways_tp_mult': 1.0936200121984199, 'sideways_tsl_mult': 0.5074131213718305, 'sideways_time_stop': 154, 'sideways_use_sma': False, 'sideways_use_ema': True, 'sideways_use_atr': False, 'sideways_use_adx': True, 'sideways_use_spike': False, 'sideways_rsi_required': True}.
[I 2025-08-31 10:06:15,080] Trial 116 finished with values: [-1000000000.0, 1000000000.0] and parameters: {'p_sma': 29, 'p_std': 14, 'p_atr': 19, 'p_adx': 27, 'rsi_period': 64, 'ema1': 8, 'ema2': 10, 'slip_atr_k': 0.16107074779055103, 'slip_spread_k': 0.6427645190411457, 'spread_hl_frac': 0.03382238529843477, 'bb_std_mult': 0.7854432253123531, 'rsi_os': 20, 'rsi_ob': 52, 'vol_spike': 0.16907950080179454, 'adx_thresh': 21.848455204420382, 'atr_min_pct': 0.008758927874538797, 'atr_max_pct': 0.1164031059727185, 'tp_mult': 2.0219047815424442, 'tsl_mult': 0.7216965403699014, 'strategy': 'mean_reversion', 'time_stop': 102, 'use_sma': True, 'use_atr': False, 'use_adx': True, 'use_ema': False, 'use_spike': False, 'rsi_required': False, 'edge_k': 1.5368300818134588, 'edge_cap': 0.971877015009309, 'bull_strategy': 'mean_reversion', 'bull_bb_std_mult': 1.0370395324750983, 'bull_rsi_os': 8, 'bull_rsi_ob': 95, 'bull_adx_thresh': 13.213549682291472, 'bull_atr_min_pct': 0.013482254424723368, 'bull_atr_max_pct': 0.018054078791506056, 'bull_tp_mult': 1.0538887520310722, 'bull_tsl_mult': 0.31056427290571886, 'bull_time_stop': 130, 'bull_use_sma': True, 'bull_use_ema': False, 'bull_use_atr': True, 'bull_use_adx': False, 'bull_use_spike': False, 'bull_rsi_required': True, 'bear_strategy': 'breakout', 'bear_bb_std_mult': 0.9363761481547732, 'bear_rsi_os': 54, 'bear_rsi_ob': 86, 'bear_adx_thresh': 22.155901272471205, 'bear_atr_min_pct': 0.02730523005322616, 'bear_atr_max_pct': 0.01815408879611695, 'bear_tp_mult': 2.772020617552942, 'bear_tsl_mult': 0.5790764407467488, 'bear_time_stop': 118, 'bear_use_sma': True, 'bear_use_ema': True, 'bear_use_atr': True, 'bear_use_adx': False, 'bear_use_spike': False, 'bear_rsi_required': False, 'sideways_strategy': 'mean_reversion', 'sideways_bb_std_mult': 0.822586047168297, 'sideways_rsi_os': 22, 'sideways_rsi_ob': 54, 'sideways_adx_thresh': 11.400009532582319, 'sideways_atr_min_pct': 0.01753878512679106, 'sideways_atr_max_pct': 0.02825650241613918, 'sideways_tp_mult': 2.1602195540936178, 'sideways_tsl_mult': 0.5953780383709562, 'sideways_time_stop': 157, 'sideways_use_sma': False, 'sideways_use_ema': True, 'sideways_use_atr': False, 'sideways_use_adx': True, 'sideways_use_spike': False, 'sideways_rsi_required': True}.
