[I 2025-08-31 11:16:45,172] Trial 674 finished with values: [-1000000000.0, 1000000000.0] and parameters: {'p_sma': 14, 'p_std': 10, 'p_atr': 27, 'p_adx': 25, 'rsi_period': 54, 'ema1': 7, 'ema2': 49, 'slip_atr_k': 0.013109666743649401, 'slip_spread_k': 0.4770129131657464, 'spread_hl_frac': 0.005371367990335892, 'bb_std_mult': 0.7509350494959878, 'rsi_os': 29, 'rsi_ob': 82, 'vol_spike': 0.024229777409948805, 'adx_thresh': 31.36090320596667, 'atr_min_pct': 0.022941596430800876, 'atr_max_pct': 0.07210348854787127, 'tp_mult': 2.9266743715430694, 'tsl_mult': 0.13239043010362253, 'strategy': 'breakout', 'time_stop': 78, 'use_sma': True, 'use_atr': True, 'use_adx': False, 'use_ema': True, 'use_spike': False, 'rsi_required': False, 'edge_k': 1.5673689106270345, 'edge_cap': 0.7850257030663921, 'bull_strategy': 'mean_reversion', 'bull_bb_std_mult': 2.150933037098596, 'bull_rsi_os': 38, 'bull_rsi_ob': 63, 'bull_adx_thresh': 26.447247168052616, 'bull_atr_min_pct': 0.012365618058966308, 'bull_atr_max_pct': 0.12177954504470961, 'bull_tp_mult': 2.2635922151364003, 'bull_tsl_mult': 0.22869913505767897, 'bull_time_stop': 293, 'bull_use_sma': False, 'bull_use_ema': True, 'bull_use_atr': False, 'bull_use_adx': True, 'bull_use_spike': False, 'bull_rsi_required': False, 'bear_strategy': 'mean_reversion', 'bear_bb_std_mult': 2.657682536133046, 'bear_rsi_os': 53, 'bear_rsi_ob': 71, 'bear_adx_thresh': 33.30032650866249, 'bear_atr_min_pct': 0.020954263332882934, 'bear_atr_max_pct': 0.13519813515020523, 'bear_tp_mult': 2.599699668304544, 'bear_tsl_mult': 0.9254224178986681, 'bear_time_stop': 89, 'bear_use_sma': True, 'bear_use_ema': False, 'bear_use_atr': True, 'bear_use_adx': True, 'bear_use_spike': True, 'bear_rsi_required': False, 'sideways_strategy': 'mean_reversion', 'sideways_bb_std_mult': 0.9590243997268417, 'sideways_rsi_os': 41, 'sideways_rsi_ob': 63, 'sideways_adx_thresh': 26.7889847974705, 'sideways_atr_min_pct': 0.005834530138297499, 'sideways_atr_max_pct': 0.10596656950434266, 'sideways_tp_mult': 2.3040051777774853, 'sideways_tsl_mult': 0.8565771620264929, 'sideways_time_stop': 178, 'sideways_use_sma': True, 'sideways_use_ema': True, 'sideways_use_atr': False, 'sideways_use_adx': True, 'sideways_use_spike': True, 'sideways_rsi_required': False}.
[I 2025-08-31 11:16:45,295] Trial 675 finished with values: [-1000000000.0, 1000000000.0] and parameters: {'p_sma': 27, 'p_std': 16, 'p_atr': 27, 'p_adx': 22, 'rsi_period': 72, 'ema1': 6, 'ema2': 21, 'slip_atr_k': 0.030467151350534336, 'slip_spread_k': 0.5452723318870467, 'spread_hl_frac': 0.03824663903739195, 'bb_std_mult': 0.7420593329687806, 'rsi_os': 22, 'rsi_ob': 81, 'vol_spike': 0.10729898935729587, 'adx_thresh': 10.965082812249701, 'atr_min_pct': 0.023253160521674903, 'atr_max_pct': 0.07095930609759601, 'tp_mult': 1.15504751579373, 'tsl_mult': 0.12704832426459456, 'strategy': 'breakout', 'time_stop': 75, 'use_sma': True, 'use_atr': True, 'use_adx': False, 'use_ema': True, 'use_spike': False, 'rsi_required': False, 'edge_k': 1.5502167126837942, 'edge_cap': 0.998874805783731, 'bull_strategy': 'mean_reversion', 'bull_bb_std_mult': 2.1202377032116955, 'bull_rsi_os': 42, 'bull_rsi_ob': 64, 'bull_adx_thresh': 26.611905768046128, 'bull_atr_min_pct': 0.011044371715304039, 'bull_atr_max_pct': 0.03403112211045962, 'bull_tp_mult': 1.7345749570649287, 'bull_tsl_mult': 0.23507089340859053, 'bull_time_stop': 153, 'bull_use_sma': False, 'bull_use_ema': False, 'bull_use_atr': False, 'bull_use_adx': True, 'bull_use_spike': False, 'bull_rsi_required': False, 'bear_strategy': 'mean_reversion', 'bear_bb_std_mult': 1.5775568506047541, 'bear_rsi_os': 53, 'bear_rsi_ob': 55, 'bear_adx_thresh': 33.23437137561909, 'bear_atr_min_pct': 0.007962989778556709, 'bear_atr_max_pct': 0.06150939092123669, 'bear_tp_mult': 2.6037809506908207, 'bear_tsl_mult': 0.8772421649874029, 'bear_time_stop': 92, 'bear_use_sma': True, 'bear_use_ema': False, 'bear_use_atr': True, 'bear_use_adx': False, 'bear_use_spike': True, 'bear_rsi_required': False, 'sideways_strategy': 'mean_reversion', 'sideways_bb_std_mult': 1.1336193670021188, 'sideways_rsi_os': 43, 'sideways_rsi_ob': 65, 'sideways_adx_thresh': 26.364810202707304, 'sideways_atr_min_pct': 0.00675430134250197, 'sideways_atr_max_pct': 0.106428655757676, 'sideways_tp_mult': 1.4085887703087796, 'sideways_tsl_mult': 0.5462491559061916, 'sideways_time_stop': 169, 'sideways_use_sma': True, 'sideways_use_ema': True, 'sideways_use_atr': False, 'sideways_use_adx': True, 'sideways_use_spike': True, 'sideways_rsi_required': False}.
[I 2025-08-31 11:17:20,146] Trial 679 finished with values: [-1000000000.0, 1000000000.0] and parameters: {'p_sma': 59, 'p_std': 7, 'p_atr': 30, 'p_adx': 21, 'rsi_period': 33, 'ema1': 30, 'ema2': 34, 'slip_atr_k': 0.14327815609203462, 'slip_spread_k': 0.4401269515343759, 'spread_hl_frac': 0.014261605108389894, 'bb_std_mult': 0.6901447080072779, 'rsi_os': 17, 'rsi_ob': 84, 'vol_spike': 0.03466135911130942, 'adx_thresh': 18.671887993766074, 'atr_min_pct': 0.021539837410294277, 'atr_max_pct': 0.06710400171766111, 'tp_mult': 2.329654817303035, 'tsl_mult': 0.11056583594911634, 'strategy': 'breakout', 'time_stop': 86, 'use_sma': True, 'use_atr': True, 'use_adx': False, 'use_ema': True, 'use_spike': False, 'rsi_required': False, 'edge_k': 1.449490759017426, 'edge_cap': 0.6332951868897392, 'bull_strategy': 'mean_reversion', 'bull_bb_std_mult': 2.79320907532718, 'bull_rsi_os': 10, 'bull_rsi_ob': 60, 'bull_adx_thresh': 27.88752941492685, 'bull_atr_min_pct': 0.013217293273736335, 'bull_atr_max_pct': 0.03749441802762145, 'bull_tp_mult': 2.927482584209446, 'bull_tsl_mult': 0.7207677415509502, 'bull_time_stop': 39, 'bull_use_sma': False, 'bull_use_ema': True, 'bull_use_atr': False, 'bull_use_adx': True, 'bull_use_spike': False, 'bull_rsi_required': True, 'bear_strategy': 'mean_reversion', 'bear_bb_std_mult': 1.5239772248150238, 'bear_rsi_os': 34, 'bear_rsi_ob': 53, 'bear_adx_thresh': 9.170729099368996, 'bear_atr_min_pct': 0.028563747206297684, 'bear_atr_max_pct': 0.03218830932672886, 'bear_tp_mult': 2.7275370247097936, 'bear_tsl_mult': 0.9470432954162991, 'bear_time_stop': 111, 'bear_use_sma': False, 'bear_use_ema': True, 'bear_use_atr': False, 'bear_use_adx': False, 'bear_use_spike': False, 'bear_rsi_required': False, 'sideways_strategy': 'mean_reversion', 'sideways_bb_std_mult': 1.0093337183899418, 'sideways_rsi_os': 40, 'sideways_rsi_ob': 62, 'sideways_adx_thresh': 26.097198927739022, 'sideways_atr_min_pct': 0.00462866289037333, 'sideways_atr_max_pct': 0.09585279566826084, 'sideways_tp_mult': 1.5721697623752475, 'sideways_tsl_mult': 0.9266632963281477, 'sideways_time_stop': 162, 'sideways_use_sma': True, 'sideways_use_ema': True, 'sideways_use_atr': True, 'sideways_use_adx': False, 'sideways_use_spike': False, 'sideways_rsi_required': True}.
[I 2025-08-31 11:17:20,279] Trial 680 finished with values: [-1000000000.0, 1000000000.0] and parameters: {'p_sma': 35, 'p_std': 14, 'p_atr': 30, 'p_adx': 21, 'rsi_period': 32, 'ema1': 6, 'ema2': 34, 'slip_atr_k': 0.023327140759978698, 'slip_spread_k': 0.44737162582039786, 'spread_hl_frac': 0.0447656455786253, 'bb_std_mult': 0.5070175956342442, 'rsi_os': 17, 'rsi_ob': 84, 'vol_spike': 0.13867435314374854, 'adx_thresh': 11.353808054689944, 'atr_min_pct': 0.005970380099056578, 'atr_max_pct': 0.05531905347174353, 'tp_mult': 2.320053961274433, 'tsl_mult': 0.10825830948419837, 'strategy': 'breakout', 'time_stop': 85, 'use_sma': True, 'use_atr': True, 'use_adx': False, 'use_ema': True, 'use_spike': False, 'rsi_required': False, 'edge_k': 1.3320483518984387, 'edge_cap': 0.6338815198325096, 'bull_strategy': 'mean_reversion', 'bull_bb_std_mult': 2.8183195611229435, 'bull_rsi_os': 42, 'bull_rsi_ob': 60, 'bull_adx_thresh': 27.789258706201995, 'bull_atr_min_pct': 0.014744709127362227, 'bull_atr_max_pct': 0.03727792372354694, 'bull_tp_mult': 2.920617355933426, 'bull_tsl_mult': 0.294565330551642, 'bull_time_stop': 38, 'bull_use_sma': False, 'bull_use_ema': True, 'bull_use_atr': False, 'bull_use_adx': True, 'bull_use_spike': False, 'bull_rsi_required': True, 'bear_strategy': 'mean_reversion', 'bear_bb_std_mult': 1.60429466176039, 'bear_rsi_os': 34, 'bear_rsi_ob': 66, 'bear_adx_thresh': 9.33083321549699, 'bear_atr_min_pct': 0.02848406241135186, 'bear_atr_max_pct': 0.1404779417767631, 'bear_tp_mult': 2.9937282257239994, 'bear_tsl_mult': 0.7720218209157221, 'bear_time_stop': 108, 'bear_use_sma': False, 'bear_use_ema': True, 'bear_use_atr': False, 'bear_use_adx': False, 'bear_use_spike': False, 'bear_rsi_required': False, 'sideways_strategy': 'mean_reversion', 'sideways_bb_std_mult': 1.0190488033122993, 'sideways_rsi_os': 40, 'sideways_rsi_ob': 94, 'sideways_adx_thresh': 26.035861426593762, 'sideways_atr_min_pct': 0.017518709300078882, 'sideways_atr_max_pct': 0.11430120749800801, 'sideways_tp_mult': 1.583263761728833, 'sideways_tsl_mult': 0.3327617876016278, 'sideways_time_stop': 144, 'sideways_use_sma': True, 'sideways_use_ema': True, 'sideways_use_atr': True, 'sideways_use_adx': False, 'sideways_use_spike': False, 'sideways_rsi_required': True}.
[I 2025-08-31 11:17:20,382] Trial 678 finished with values: [-1000000000.0, 1000000000.0] and parameters: {'p_sma': 35, 'p_std': 7, 'p_atr': 29, 'p_adx': 21, 'rsi_period': 33, 'ema1': 15, 'ema2': 13, 'slip_atr_k': 0.022896296759511676, 'slip_spread_k': 0.3905977423781715, 'spread_hl_frac': 0.021102015336059605, 'bb_std_mult': 0.6771033060410963, 'rsi_os': 32, 'rsi_ob': 84, 'vol_spike': 0.0028623603464375813, 'adx_thresh': 30.74776827941865, 'atr_min_pct': 0.025317278803275632, 'atr_max_pct': 0.06644772518954313, 'tp_mult': 1.889327918820172, 'tsl_mult': 0.0771826802385947, 'strategy': 'breakout', 'time_stop': 83, 'use_sma': True, 'use_atr': True, 'use_adx': False, 'use_ema': True, 'use_spike': False, 'rsi_required': False, 'edge_k': 1.6038291581491855, 'edge_cap': 0.7080465191881873, 'bull_strategy': 'mean_reversion', 'bull_bb_std_mult': 2.7924768880723594, 'bull_rsi_os': 42, 'bull_rsi_ob': 61, 'bull_adx_thresh': 24.67941103780062, 'bull_atr_min_pct': 0.0145624797162258, 'bull_atr_max_pct': 0.1429458118997792, 'bull_tp_mult': 2.932930506047171, 'bull_tsl_mult': 0.2841294604688676, 'bull_time_stop': 38, 'bull_use_sma': False, 'bull_use_ema': True, 'bull_use_atr': False, 'bull_use_adx': True, 'bull_use_spike': False, 'bull_rsi_required': True, 'bear_strategy': 'mean_reversion', 'bear_bb_std_mult': 1.4476557100384964, 'bear_rsi_os': 34, 'bear_rsi_ob': 53, 'bear_adx_thresh': 10.669617430116302, 'bear_atr_min_pct': 0.00198034913330528, 'bear_atr_max_pct': 0.1406442594208687, 'bear_tp_mult': 2.7212197455209703, 'bear_tsl_mult': 0.9488670861560881, 'bear_time_stop': 95, 'bear_use_sma': False, 'bear_use_ema': True, 'bear_use_atr': False, 'bear_use_adx': False, 'bear_use_spike': False, 'bear_rsi_required': False, 'sideways_strategy': 'mean_reversion', 'sideways_bb_std_mult': 1.1618619545888704, 'sideways_rsi_os': 40, 'sideways_rsi_ob': 62, 'sideways_adx_thresh': 25.993010795619586, 'sideways_atr_min_pct': 0.004709338284137968, 'sideways_atr_max_pct': 0.11266598893614822, 'sideways_tp_mult': 2.523781202855498, 'sideways_tsl_mult': 0.6912050918332472, 'sideways_time_stop': 160, 'sideways_use_sma': True, 'sideways_use_ema': True, 'sideways_use_atr': True, 'sideways_use_adx': False, 'sideways_use_spike': False, 'sideways_rsi_required': True}.
[I 2025-08-31 11:17:20,699] Trial 677 finished with values: [-1000000000.0, 1000000000.0] and parameters: {'p_sma': 40, 'p_std': 10, 'p_atr': 28, 'p_adx': 16, 'rsi_period': 33, 'ema1': 6, 'ema2': 51, 'slip_atr_k': 0.22599867286205105, 'slip_spread_k': 0.39240496938465247, 'spread_hl_frac': 0.021136484877062867, 'bb_std_mult': 0.6784349184855274, 'rsi_os': 28, 'rsi_ob': 81, 'vol_spike': 0.10714183401787962, 'adx_thresh': 30.9669922868828, 'atr_min_pct': 0.02233898775402149, 'atr_max_pct': 0.055679007974000286, 'tp_mult': 2.868341892389424, 'tsl_mult': 0.15878723925223195, 'strategy': 'breakout', 'time_stop': 85, 'use_sma': True, 'use_atr': True, 'use_adx': False, 'use_ema': True, 'use_spike': False, 'rsi_required': False, 'edge_k': 1.3347961166822722, 'edge_cap': 0.7067648704221026, 'bull_strategy': 'mean_reversion', 'bull_bb_std_mult': 2.0761077053736168, 'bull_rsi_os': 42, 'bull_rsi_ob': 64, 'bull_adx_thresh': 27.563030777069546, 'bull_atr_min_pct': 0.014758575966205723, 'bull_atr_max_pct': 0.14237901641125245, 'bull_tp_mult': 2.917904932111167, 'bull_tsl_mult': 0.2839905500154226, 'bull_time_stop': 47, 'bull_use_sma': False, 'bull_use_ema': True, 'bull_use_atr': False, 'bull_use_adx': True, 'bull_use_spike': False, 'bull_rsi_required': False, 'bear_strategy': 'mean_reversion', 'bear_bb_std_mult': 2.8723266044635047, 'bear_rsi_os': 53, 'bear_rsi_ob': 90, 'bear_adx_thresh': 23.370667673007993, 'bear_atr_min_pct': 0.008041812782294403, 'bear_atr_max_pct': 0.06143004499839031, 'bear_tp_mult': 2.649352444297953, 'bear_tsl_mult': 0.9428390357027343, 'bear_time_stop': 110, 'bear_use_sma': True, 'bear_use_ema': False, 'bear_use_atr': False, 'bear_use_adx': False, 'bear_use_spike': True, 'bear_rsi_required': False, 'sideways_strategy': 'mean_reversion', 'sideways_bb_std_mult': 1.1609270171028954, 'sideways_rsi_os': 41, 'sideways_rsi_ob': 94, 'sideways_adx_thresh': 26.32637809766172, 'sideways_atr_min_pct': 0.005606958547224201, 'sideways_atr_max_pct': 0.11140240131570256, 'sideways_tp_mult': 1.405128603952571, 'sideways_tsl_mult': 0.6928518854136655, 'sideways_time_stop': 160, 'sideways_use_sma': True, 'sideways_use_ema': True, 'sideways_use_atr': True, 'sideways_use_adx': True, 'sideways_use_spike': True, 'sideways_rsi_required': False}.
[I 2025-08-31 11:17:53,462] Trial 681 finished with values: [-0.003178354854109555, 0.00824848204514743] and parameters: {'p_sma': 40, 'p_std': 10, 'p_atr': 29, 'p_adx': 20, 'rsi_period': 7, 'ema1': 6, 'ema2': 42, 'slip_atr_k': 0.024867523454874182, 'slip_spread_k': 0.39533127817210767, 'spread_hl_frac': 0.020792630403003748, 'bb_std_mult': 0.6667256301810898, 'rsi_os': 28, 'rsi_ob': 87, 'vol_spike': 0.18286796288936094, 'adx_thresh': 11.276603131652847, 'atr_min_pct': 0.022240507826514988, 'atr_max_pct': 0.05532690972449328, 'tp_mult': 2.869511523834916, 'tsl_mult': 0.07834614107404397, 'strategy': 'breakout', 'time_stop': 96, 'use_sma': True, 'use_atr': True, 'use_adx': False, 'use_ema': True, 'use_spike': False, 'rsi_required': False, 'edge_k': 1.3417471321210426, 'edge_cap': 0.6802908395207945, 'bull_strategy': 'mean_reversion', 'bull_bb_std_mult': 2.9321443149364086, 'bull_rsi_os': 42, 'bull_rsi_ob': 61, 'bull_adx_thresh': 27.26708089870928, 'bull_atr_min_pct': 0.011543514300805299, 'bull_atr_max_pct': 0.09646339623463421, 'bull_tp_mult': 2.9629478078856226, 'bull_tsl_mult': 0.2893611628739901, 'bull_time_stop': 48, 'bull_use_sma': False, 'bull_use_ema': True, 'bull_use_atr': False, 'bull_use_adx': True, 'bull_use_spike': False, 'bull_rsi_required': False, 'bear_strategy': 'mean_reversion', 'bear_bb_std_mult': 2.8542144287138917, 'bear_rsi_os': 36, 'bear_rsi_ob': 54, 'bear_adx_thresh': 11.398994705112456, 'bear_atr_min_pct': 0.004261412499584066, 'bear_atr_max_pct': 0.13965567518735458, 'bear_tp_mult': 2.648890832958995, 'bear_tsl_mult': 0.8961418125383376, 'bear_time_stop': 96, 'bear_use_sma': False, 'bear_use_ema': False, 'bear_use_atr': False, 'bear_use_adx': False, 'bear_use_spike': True, 'bear_rsi_required': False, 'sideways_strategy': 'mean_reversion', 'sideways_bb_std_mult': 1.176727844406748, 'sideways_rsi_os': 51, 'sideways_rsi_ob': 61, 'sideways_adx_thresh': 27.066891713909552, 'sideways_atr_min_pct': 0.008485241867432148, 'sideways_atr_max_pct': 0.11278932904830152, 'sideways_tp_mult': 1.4819665469532686, 'sideways_tsl_mult': 0.6930444013269579, 'sideways_time_stop': 149, 'sideways_use_sma': True, 'sideways_use_ema': True, 'sideways_use_atr': True, 'sideways_use_adx': False, 'sideways_use_spike': True, 'sideways_rsi_required': False}.
[I 2025-08-31 11:17:53,656] Trial 682 finished with values: [-0.040083592094289466, 0.03972133244897819] and parameters: {'p_sma': 38, 'p_std': 17, 'p_atr': 28, 'p_adx': 20, 'rsi_period': 48, 'ema1': 5, 'ema2': 47, 'slip_atr_k': 0.03207888650021852, 'slip_spread_k': 0.4953174074992677, 'spread_hl_frac': 0.020653933429090807, 'bb_std_mult': 0.8227146181681606, 'rsi_os': 27, 'rsi_ob': 86, 'vol_spike': 0.13000295480086266, 'adx_thresh': 30.814165383800283, 'atr_min_pct': 0.022445712963555846, 'atr_max_pct': 0.0661133779470785, 'tp_mult': 1.7680438884347711, 'tsl_mult': 0.07642466696738007, 'strategy': 'breakout', 'time_stop': 97, 'use_sma': True, 'use_atr': True, 'use_adx': False, 'use_ema': True, 'use_spike': False, 'rsi_required': False, 'edge_k': 1.4873597834919479, 'edge_cap': 0.7037109962800362, 'bull_strategy': 'mean_reversion', 'bull_bb_std_mult': 1.3293501200110862, 'bull_rsi_os': 17, 'bull_rsi_ob': 67, 'bull_adx_thresh': 24.777120935832812, 'bull_atr_min_pct': 0.015511924280734979, 'bull_atr_max_pct': 0.09577078125207655, 'bull_tp_mult': 2.8718892625380863, 'bull_tsl_mult': 0.27734212607637854, 'bull_time_stop': 49, 'bull_use_sma': False, 'bull_use_ema': True, 'bull_use_atr': False, 'bull_use_adx': False, 'bull_use_spike': False, 'bull_rsi_required': False, 'bear_strategy': 'mean_reversion', 'bear_bb_std_mult': 1.439286359505817, 'bear_rsi_os': 43, 'bear_rsi_ob': 75, 'bear_adx_thresh': 31.38781923170751, 'bear_atr_min_pct': 0.0023149918775476177, 'bear_atr_max_pct': 0.13500774449002678, 'bear_tp_mult': 1.078480007671104, 'bear_tsl_mult': 0.8975851174539126, 'bear_time_stop': 81, 'bear_use_sma': False, 'bear_use_ema': False, 'bear_use_atr': True, 'bear_use_adx': False, 'bear_use_spike': True, 'bear_rsi_required': False, 'sideways_strategy': 'mean_reversion', 'sideways_bb_std_mult': 0.8681941639907815, 'sideways_rsi_os': 41, 'sideways_rsi_ob': 78, 'sideways_adx_thresh': 27.174408981673352, 'sideways_atr_min_pct': 0.005464472679317729, 'sideways_atr_max_pct': 0.10246495711974526, 'sideways_tp_mult': 1.4948732694692541, 'sideways_tsl_mult': 0.883827180542589, 'sideways_time_stop': 167, 'sideways_use_sma': True, 'sideways_use_ema': True, 'sideways_use_atr': False, 'sideways_use_adx': False, 'sideways_use_spike': True, 'sideways_rsi_required': False}.
[I 2025-08-31 11:17:53,933] Trial 683 finished with values: [-1000000000.0, 1000000000.0] and parameters: {'p_sma': 25, 'p_std': 17, 'p_atr': 28, 'p_adx': 20, 'rsi_period': 15, 'ema1': 5, 'ema2': 29, 'slip_atr_k': 0.017467687013077677, 'slip_spread_k': 0.49731991023440775, 'spread_hl_frac': 0.008117229553404565, 'bb_std_mult': 0.8159103957420647, 'rsi_os': 20, 'rsi_ob': 82, 'vol_spike': 0.18521172895301952, 'adx_thresh': 10.48713937194106, 'atr_min_pct': 0.012382925923982574, 'atr_max_pct': 0.06033802874767238, 'tp_mult': 2.9675876878530465, 'tsl_mult': 0.15855199399285674, 'strategy': 'breakout', 'time_stop': 95, 'use_sma': True, 'use_atr': True, 'use_adx': False, 'use_ema': True, 'use_spike': False, 'rsi_required': False, 'edge_k': 1.48213524487884, 'edge_cap': 0.684207478191104, 'bull_strategy': 'mean_reversion', 'bull_bb_std_mult': 2.946717194740772, 'bull_rsi_os': 41, 'bull_rsi_ob': 65, 'bull_adx_thresh': 28.557929639396882, 'bull_atr_min_pct': 0.011921670078178041, 'bull_atr_max_pct': 0.031330401092163555, 'bull_tp_mult': 2.3094062561133737, 'bull_tsl_mult': 0.25614087833717863, 'bull_time_stop': 48, 'bull_use_sma': False, 'bull_use_ema': False, 'bull_use_atr': False, 'bull_use_adx': False, 'bull_use_spike': False, 'bull_rsi_required': False, 'bear_strategy': 'mean_reversion', 'bear_bb_std_mult': 2.9040487864577136, 'bear_rsi_os': 51, 'bear_rsi_ob': 50, 'bear_adx_thresh': 11.34276254889731, 'bear_atr_min_pct': 0.010228835889983775, 'bear_atr_max_pct': 0.13494841208963476, 'bear_tp_mult': 2.640225519404485, 'bear_tsl_mult': 0.895453876967449, 'bear_time_stop': 105, 'bear_use_sma': False, 'bear_use_ema': False, 'bear_use_atr': True, 'bear_use_adx': False, 'bear_use_spike': True, 'bear_rsi_required': False, 'sideways_strategy': 'mean_reversion', 'sideways_bb_std_mult': 0.9226742237997093, 'sideways_rsi_os': 41, 'sideways_rsi_ob': 63, 'sideways_adx_thresh': 27.21706620652364, 'sideways_atr_min_pct': 0.005649626984563034, 'sideways_atr_max_pct': 0.10413305709417121, 'sideways_tp_mult': 1.4529690067281114, 'sideways_tsl_mult': 0.8786374043421861, 'sideways_time_stop': 151, 'sideways_use_sma': True, 'sideways_use_ema': True, 'sideways_use_atr': False, 'sideways_use_adx': False, 'sideways_use_spike': True, 'sideways_rsi_required': False}.
