[I 2025-08-31 10:01:59,339] Trial 83 finished with values: [-1000000000.0, 1000000000.0] and parameters: {'p_sma': 44, 'p_std': 20, 'p_atr': 28, 'p_adx': 21, 'rsi_period': 55, 'ema1': 23, 'ema2': 12, 'slip_atr_k': 0.13607605325066158, 'slip_spread_k': 0.5300543542450472, 'spread_hl_frac': 0.032296609822181195, 'bb_std_mult': 2.733678813728554, 'rsi_os': 55, 'rsi_ob': 67, 'vol_spike': 0.10021616254528774, 'adx_thresh': 23.102931700972075, 'atr_min_pct': 0.014334031742432923, 'atr_max_pct': 0.12375236404393729, 'tp_mult': 2.27917201031517, 'tsl_mult': 0.741381897203941, 'strategy': 'breakout', 'time_stop': 59, 'use_sma': True, 'use_atr': False, 'use_adx': False, 'use_ema': False, 'use_spike': True, 'rsi_required': False, 'edge_k': 1.6214853013640398, 'edge_cap': 0.5679550213104456, 'bull_strategy': 'mean_reversion', 'bull_bb_std_mult': 0.8830171004141271, 'bull_rsi_os': 53, 'bull_rsi_ob': 92, 'bull_adx_thresh': 27.602470961461993, 'bull_atr_min_pct': 0.027699014193301952, 'bull_atr_max_pct': 0.0110157489623569, 'bull_tp_mult': 1.3398886001685217, 'bull_tsl_mult': 0.9500988982608845, 'bull_time_stop': 86, 'bull_use_sma': False, 'bull_use_ema': True, 'bull_use_atr': True, 'bull_use_adx': False, 'bull_use_spike': True, 'bull_rsi_required': False, 'bear_strategy': 'mean_reversion', 'bear_bb_std_mult': 2.7170625083322535, 'bear_rsi_os': 55, 'bear_rsi_ob': 84, 'bear_adx_thresh': 16.774429956369683, 'bear_atr_min_pct': 0.012961301458300788, 'bear_atr_max_pct': 0.022745572442907105, 'bear_tp_mult': 2.860192440805031, 'bear_tsl_mult': 0.7515105031037146, 'bear_time_stop': 30, 'bear_use_sma': True, 'bear_use_ema': True, 'bear_use_atr': False, 'bear_use_adx': False, 'bear_use_spike': True, 'bear_rsi_required': False, 'sideways_strategy': 'mean_reversion', 'sideways_bb_std_mult': 1.0567321096279072, 'sideways_rsi_os': 19, 'sideways_rsi_ob': 55, 'sideways_adx_thresh': 17.121140561835336, 'sideways_atr_min_pct': 0.015130015376943818, 'sideways_atr_max_pct': 0.03736341774926913, 'sideways_tp_mult': 1.236788764476855, 'sideways_tsl_mult': 0.4767437209901722, 'sideways_time_stop': 123, 'sideways_use_sma': False, 'sideways_use_ema': False, 'sideways_use_atr': True, 'sideways_use_adx': True, 'sideways_use_spike': False, 'sideways_rsi_required': True}.
[I 2025-08-31 10:01:59,432] Trial 82 finished with values: [-1000000000.0, 1000000000.0] and parameters: {'p_sma': 13, 'p_std': 44, 'p_atr': 28, 'p_adx': 21, 'rsi_period': 57, 'ema1': 19, 'ema2': 12, 'slip_atr_k': 0.1401269026050227, 'slip_spread_k': 0.5594913613928276, 'spread_hl_frac': 0.0311965424018301, 'bb_std_mult': 1.7015714246267086, 'rsi_os': 31, 'rsi_ob': 67, 'vol_spike': 0.07422291053155604, 'adx_thresh': 22.939183414884226, 'atr_min_pct': 0.014376484479220165, 'atr_max_pct': 0.12315056688233819, 'tp_mult': 2.1755770203334643, 'tsl_mult': 0.8661439607883701, 'strategy': 'breakout', 'time_stop': 55, 'use_sma': True, 'use_atr': False, 'use_adx': False, 'use_ema': False, 'use_spike': True, 'rsi_required': False, 'edge_k': 1.6341276576042048, 'edge_cap': 0.9814358809913795, 'bull_strategy': 'mean_reversion', 'bull_bb_std_mult': 0.8645044881175661, 'bull_rsi_os': 35, 'bull_rsi_ob': 49, 'bull_adx_thresh': 27.425041932458477, 'bull_atr_min_pct': 0.0066208978289789945, 'bull_atr_max_pct': 0.010224220768137336, 'bull_tp_mult': 1.1847395661435831, 'bull_tsl_mult': 0.9403720463582574, 'bull_time_stop': 209, 'bull_use_sma': False, 'bull_use_ema': False, 'bull_use_atr': True, 'bull_use_adx': False, 'bull_use_spike': True, 'bull_rsi_required': True, 'bear_strategy': 'breakout', 'bear_bb_std_mult': 1.4212266145202932, 'bear_rsi_os': 55, 'bear_rsi_ob': 84, 'bear_adx_thresh': 28.98128325456868, 'bear_atr_min_pct': 0.028658899573364493, 'bear_atr_max_pct': 0.021308087841076566, 'bear_tp_mult': 2.8485705585315544, 'bear_tsl_mult': 0.6704292877690659, 'bear_time_stop': 126, 'bear_use_sma': True, 'bear_use_ema': True, 'bear_use_atr': True, 'bear_use_adx': False, 'bear_use_spike': True, 'bear_rsi_required': False, 'sideways_strategy': 'mean_reversion', 'sideways_bb_std_mult': 1.0515049344139988, 'sideways_rsi_os': 19, 'sideways_rsi_ob': 55, 'sideways_adx_thresh': 12.391114373900248, 'sideways_atr_min_pct': 0.014956003629373483, 'sideways_atr_max_pct': 0.0631976711932285, 'sideways_tp_mult': 2.8511111104046165, 'sideways_tsl_mult': 0.4679806064477926, 'sideways_time_stop': 119, 'sideways_use_sma': False, 'sideways_use_ema': True, 'sideways_use_atr': False, 'sideways_use_adx': True, 'sideways_use_spike': False, 'sideways_rsi_required': True}.
[I 2025-08-31 10:01:59,525] Trial 81 finished with values: [-1000000000.0, 1000000000.0] and parameters: {'p_sma': 52, 'p_std': 57, 'p_atr': 28, 'p_adx': 25, 'rsi_period': 58, 'ema1': 19, 'ema2': 12, 'slip_atr_k': 0.13265219204277076, 'slip_spread_k': 0.006468003392830601, 'spread_hl_frac': 0.030172288667650635, 'bb_std_mult': 1.0104513289329693, 'rsi_os': 30, 'rsi_ob': 58, 'vol_spike': 0.07064481993825852, 'adx_thresh': 22.667888260538074, 'atr_min_pct': 0.013448657222023173, 'atr_max_pct': 0.12435394705092363, 'tp_mult': 2.3096430004032826, 'tsl_mult': 0.8788728364522975, 'strategy': 'breakout', 'time_stop': 6, 'use_sma': True, 'use_atr': False, 'use_adx': False, 'use_ema': False, 'use_spike': True, 'rsi_required': False, 'edge_k': 1.6416066966221181, 'edge_cap': 0.9823652635172946, 'bull_strategy': 'mean_reversion', 'bull_bb_std_mult': 0.8766351087283004, 'bull_rsi_os': 46, 'bull_rsi_ob': 92, 'bull_adx_thresh': 25.420765094680043, 'bull_atr_min_pct': 0.02827763619614511, 'bull_atr_max_pct': 0.012805163561404362, 'bull_tp_mult': 1.279312295268517, 'bull_tsl_mult': 0.9107313051990282, 'bull_time_stop': 54, 'bull_use_sma': False, 'bull_use_ema': False, 'bull_use_atr': True, 'bull_use_adx': False, 'bull_use_spike': True, 'bull_rsi_required': True, 'bear_strategy': 'breakout', 'bear_bb_std_mult': 2.430369425057355, 'bear_rsi_os': 55, 'bear_rsi_ob': 84, 'bear_adx_thresh': 27.37468712571246, 'bear_atr_min_pct': 0.013489177331562565, 'bear_atr_max_pct': 0.02169404843364347, 'bear_tp_mult': 2.855114082655853, 'bear_tsl_mult': 0.6809465819895026, 'bear_time_stop': 22, 'bear_use_sma': True, 'bear_use_ema': True, 'bear_use_atr': True, 'bear_use_adx': False, 'bear_use_spike': True, 'bear_rsi_required': False, 'sideways_strategy': 'mean_reversion', 'sideways_bb_std_mult': 1.0734912229224323, 'sideways_rsi_os': 19, 'sideways_rsi_ob': 55, 'sideways_adx_thresh': 12.477955925792381, 'sideways_atr_min_pct': 0.011189187034244284, 'sideways_atr_max_pct': 0.06211366204908399, 'sideways_tp_mult': 2.0116638448938904, 'sideways_tsl_mult': 0.475429562790864, 'sideways_time_stop': 186, 'sideways_use_sma': False, 'sideways_use_ema': True, 'sideways_use_atr': False, 'sideways_use_adx': True, 'sideways_use_spike': False, 'sideways_rsi_required': True}.
[I 2025-08-31 10:02:31,042] Trial 86 finished with values: [-1000000000.0, 1000000000.0] and parameters: {'p_sma': 6, 'p_std': 20, 'p_atr': 12, 'p_adx': 26, 'rsi_period': 61, 'ema1': 23, 'ema2': 11, 'slip_atr_k': 0.11729795241474056, 'slip_spread_k': 0.33504507535873085, 'spread_hl_frac': 0.02948723643488985, 'bb_std_mult': 1.0255867258844078, 'rsi_os': 16, 'rsi_ob': 64, 'vol_spike': 0.22585998260026724, 'adx_thresh': 17.802404007504926, 'atr_min_pct': 0.00807325077878682, 'atr_max_pct': 0.12677968930970152, 'tp_mult': 1.9583942594162795, 'tsl_mult': 0.43773005186217456, 'strategy': 'breakout', 'time_stop': 15, 'use_sma': False, 'use_atr': False, 'use_adx': True, 'use_ema': False, 'use_spike': False, 'rsi_required': False, 'edge_k': 0.14693063066455447, 'edge_cap': 0.8844494893495887, 'bull_strategy': 'mean_reversion', 'bull_bb_std_mult': 1.09378208743992, 'bull_rsi_os': 46, 'bull_rsi_ob': 94, 'bull_adx_thresh': 29.192765519778277, 'bull_atr_min_pct': 0.002542919802177813, 'bull_atr_max_pct': 0.016775597079592485, 'bull_tp_mult': 1.267431365056637, 'bull_tsl_mult': 0.7661882331895125, 'bull_time_stop': 53, 'bull_use_sma': True, 'bull_use_ema': False, 'bull_use_atr': True, 'bull_use_adx': False, 'bull_use_spike': False, 'bull_rsi_required': True, 'bear_strategy': 'breakout', 'bear_bb_std_mult': 2.257968958453091, 'bear_rsi_os': 49, 'bear_rsi_ob': 93, 'bear_adx_thresh': 16.102603850573495, 'bear_atr_min_pct': 0.029887546130831815, 'bear_atr_max_pct': 0.026353305458540033, 'bear_tp_mult': 2.564635829380385, 'bear_tsl_mult': 0.5266522095023545, 'bear_time_stop': 158, 'bear_use_sma': False, 'bear_use_ema': False, 'bear_use_atr': True, 'bear_use_adx': False, 'bear_use_spike': False, 'bear_rsi_required': False, 'sideways_strategy': 'mean_reversion', 'sideways_bb_std_mult': 0.858426473859571, 'sideways_rsi_os': 21, 'sideways_rsi_ob': 63, 'sideways_adx_thresh': 5.046455681359955, 'sideways_atr_min_pct': 0.022433485465448384, 'sideways_atr_max_pct': 0.041376804188989515, 'sideways_tp_mult': 1.9802646020359227, 'sideways_tsl_mult': 0.5716020309749258, 'sideways_time_stop': 180, 'sideways_use_sma': True, 'sideways_use_ema': True, 'sideways_use_atr': False, 'sideways_use_adx': False, 'sideways_use_spike': False, 'sideways_rsi_required': True}.
[I 2025-08-31 10:02:31,288] Trial 84 finished with values: [-1000000000.0, 1000000000.0] and parameters: {'p_sma': 43, 'p_std': 20, 'p_atr': 28, 'p_adx': 21, 'rsi_period': 60, 'ema1': 23, 'ema2': 13, 'slip_atr_k': 0.13239239641354586, 'slip_spread_k': 0.5500703206909896, 'spread_hl_frac': 0.03238898194216121, 'bb_std_mult': 2.9659964574392585, 'rsi_os': 45, 'rsi_ob': 59, 'vol_spike': 0.06615932058082702, 'adx_thresh': 22.953117770742217, 'atr_min_pct': 0.008348745377102087, 'atr_max_pct': 0.12540138717280003, 'tp_mult': 1.9545546890862782, 'tsl_mult': 0.87220169314752, 'strategy': 'breakout', 'time_stop': 225, 'use_sma': True, 'use_atr': False, 'use_adx': True, 'use_ema': False, 'use_spike': True, 'rsi_required': False, 'edge_k': 1.642065098938417, 'edge_cap': 0.3100015203836427, 'bull_strategy': 'mean_reversion', 'bull_bb_std_mult': 0.8724770345444347, 'bull_rsi_os': 53, 'bull_rsi_ob': 48, 'bull_adx_thresh': 13.549555698061475, 'bull_atr_min_pct': 0.0027395582531313054, 'bull_atr_max_pct': 0.01003098246799119, 'bull_tp_mult': 1.3132904419903726, 'bull_tsl_mult': 0.11164675769223442, 'bull_time_stop': 52, 'bull_use_sma': False, 'bull_use_ema': True, 'bull_use_atr': True, 'bull_use_adx': False, 'bull_use_spike': False, 'bull_rsi_required': False, 'bear_strategy': 'breakout', 'bear_bb_std_mult': 2.227482407518891, 'bear_rsi_os': 44, 'bear_rsi_ob': 92, 'bear_adx_thresh': 16.392619650200825, 'bear_atr_min_pct': 0.02998173682497852, 'bear_atr_max_pct': 0.026972786945591992, 'bear_tp_mult': 2.8460524976406187, 'bear_tsl_mult': 0.7620745437369651, 'bear_time_stop': 153, 'bear_use_sma': True, 'bear_use_ema': True, 'bear_use_atr': False, 'bear_use_adx': False, 'bear_use_spike': True, 'bear_rsi_required': False, 'sideways_strategy': 'mean_reversion', 'sideways_bb_std_mult': 1.0153241844976308, 'sideways_rsi_os': 18, 'sideways_rsi_ob': 62, 'sideways_adx_thresh': 5.181530220479923, 'sideways_atr_min_pct': 0.011385997676965723, 'sideways_atr_max_pct': 0.039201108828160226, 'sideways_tp_mult': 1.9967639384934186, 'sideways_tsl_mult': 0.4739700658184369, 'sideways_time_stop': 134, 'sideways_use_sma': False, 'sideways_use_ema': False, 'sideways_use_atr': True, 'sideways_use_adx': True, 'sideways_use_spike': False, 'sideways_rsi_required': True}.
[I 2025-08-31 10:02:31,493] Trial 85 finished with values: [-1000000000.0, 1000000000.0] and parameters: {'p_sma': 40, 'p_std': 43, 'p_atr': 29, 'p_adx': 21, 'rsi_period': 48, 'ema1': 16, 'ema2': 12, 'slip_atr_k': 0.1925059258124827, 'slip_spread_k': 0.35250883344762723, 'spread_hl_frac': 0.029945185803869005, 'bb_std_mult': 1.1571059977600244, 'rsi_os': 31, 'rsi_ob': 59, 'vol_spike': 0.22507975624654053, 'adx_thresh': 18.089387102321297, 'atr_min_pct': 0.0076226842356747265, 'atr_max_pct': 0.12594998881325276, 'tp_mult': 1.9847880496154318, 'tsl_mult': 0.874043969033782, 'strategy': 'breakout', 'time_stop': 226, 'use_sma': True, 'use_atr': False, 'use_adx': True, 'use_ema': False, 'use_spike': False, 'rsi_required': False, 'edge_k': 1.4435581208775146, 'edge_cap': 0.9366925191522472, 'bull_strategy': 'mean_reversion', 'bull_bb_std_mult': 0.6720962661974325, 'bull_rsi_os': 33, 'bull_rsi_ob': 53, 'bull_adx_thresh': 29.333988026486065, 'bull_atr_min_pct': 0.002747171014132377, 'bull_atr_max_pct': 0.015469882644380685, 'bull_tp_mult': 1.1847492609859305, 'bull_tsl_mult': 0.728883926419952, 'bull_time_stop': 216, 'bull_use_sma': False, 'bull_use_ema': False, 'bull_use_atr': True, 'bull_use_adx': False, 'bull_use_spike': False, 'bull_rsi_required': True, 'bear_strategy': 'breakout', 'bear_bb_std_mult': 2.232729540170184, 'bear_rsi_os': 50, 'bear_rsi_ob': 95, 'bear_adx_thresh': 27.245660398252785, 'bear_atr_min_pct': 0.02851405247817494, 'bear_atr_max_pct': 0.02301816884056485, 'bear_tp_mult': 2.8177643683079783, 'bear_tsl_mult': 0.5303821869514823, 'bear_time_stop': 155, 'bear_use_sma': True, 'bear_use_ema': False, 'bear_use_atr': True, 'bear_use_adx': False, 'bear_use_spike': False, 'bear_rsi_required': False, 'sideways_strategy': 'mean_reversion', 'sideways_bb_std_mult': 0.9853251193120955, 'sideways_rsi_os': 22, 'sideways_rsi_ob': 93, 'sideways_adx_thresh': 14.729690086736065, 'sideways_atr_min_pct': 0.02334274382875766, 'sideways_atr_max_pct': 0.1369394391425399, 'sideways_tp_mult': 1.9968538872318822, 'sideways_tsl_mult': 0.5721122336241233, 'sideways_time_stop': 137, 'sideways_use_sma': False, 'sideways_use_ema': True, 'sideways_use_atr': False, 'sideways_use_adx': True, 'sideways_use_spike': False, 'sideways_rsi_required': True}.
[I 2025-08-31 10:02:31,626] Trial 87 finished with values: [-1000000000.0, 1000000000.0] and parameters: {'p_sma': 24, 'p_std': 20, 'p_atr': 14, 'p_adx': 26, 'rsi_period': 63, 'ema1': 22, 'ema2': 47, 'slip_atr_k': 0.11649667924431224, 'slip_spread_k': 0.09323533259456906, 'spread_hl_frac': 0.036164312823145986, 'bb_std_mult': 2.9220127671291083, 'rsi_os': 43, 'rsi_ob': 58, 'vol_spike': 0.22473717247393052, 'adx_thresh': 17.549196348613112, 'atr_min_pct': 0.006970847571864896, 'atr_max_pct': 0.12853767243999, 'tp_mult': 1.9663491295353646, 'tsl_mult': 0.43735183278115064, 'strategy': 'mean_reversion', 'time_stop': 93, 'use_sma': False, 'use_atr': False, 'use_adx': True, 'use_ema': False, 'use_spike': False, 'rsi_required': False, 'edge_k': 1.4222616003898103, 'edge_cap': 0.31330004918566356, 'bull_strategy': 'mean_reversion', 'bull_bb_std_mult': 1.1027026309413026, 'bull_rsi_os': 33, 'bull_rsi_ob': 94, 'bull_adx_thresh': 29.415532530705093, 'bull_atr_min_pct': 0.0026633155406197003, 'bull_atr_max_pct': 0.017061766885624295, 'bull_tp_mult': 1.298485421139211, 'bull_tsl_mult': 0.7215059234472544, 'bull_time_stop': 19, 'bull_use_sma': True, 'bull_use_ema': True, 'bull_use_atr': True, 'bull_use_adx': False, 'bull_use_spike': False, 'bull_rsi_required': False, 'bear_strategy': 'breakout', 'bear_bb_std_mult': 2.2009474548014554, 'bear_rsi_os': 45, 'bear_rsi_ob': 93, 'bear_adx_thresh': 13.899910733586957, 'bear_atr_min_pct': 0.029984961921253796, 'bear_atr_max_pct': 0.016912320937907035, 'bear_tp_mult': 2.555779790257515, 'bear_tsl_mult': 0.5356326039466189, 'bear_time_stop': 155, 'bear_use_sma': False, 'bear_use_ema': False, 'bear_use_atr': True, 'bear_use_adx': False, 'bear_use_spike': False, 'bear_rsi_required': False, 'sideways_strategy': 'mean_reversion', 'sideways_bb_std_mult': 0.8806552573058688, 'sideways_rsi_os': 22, 'sideways_rsi_ob': 93, 'sideways_adx_thresh': 14.758790566999084, 'sideways_atr_min_pct': 0.016100894483349296, 'sideways_atr_max_pct': 0.08207118084575568, 'sideways_tp_mult': 1.9797959512471788, 'sideways_tsl_mult': 0.5718143409270795, 'sideways_time_stop': 20, 'sideways_use_sma': True, 'sideways_use_ema': True, 'sideways_use_atr': True, 'sideways_use_adx': False, 'sideways_use_spike': False, 'sideways_rsi_required': True}.
[I 2025-08-31 10:02:31,935] Trial 89 finished with values: [-1000000000.0, 1000000000.0] and parameters: {'p_sma': 22, 'p_std': 16, 'p_atr': 29, 'p_adx': 8, 'rsi_period': 65, 'ema1': 16, 'ema2': 51, 'slip_atr_k': 0.1763872826425607, 'slip_spread_k': 0.07986784790578788, 'spread_hl_frac': 0.04634719081194366, 'bb_std_mult': 3.3631438359852543, 'rsi_os': 50, 'rsi_ob': 54, 'vol_spike': 0.2507346609037948, 'adx_thresh': 17.431344519683623, 'atr_min_pct': 0.016468888553889338, 'atr_max_pct': 0.10200734454180901, 'tp_mult': 1.675956231102929, 'tsl_mult': 0.9424441725372464, 'strategy': 'mean_reversion', 'time_stop': 254, 'use_sma': True, 'use_atr': False, 'use_adx': True, 'use_ema': False, 'use_spike': False, 'rsi_required': False, 'edge_k': 0.6974422051531812, 'edge_cap': 0.9474281078784609, 'bull_strategy': 'mean_reversion', 'bull_bb_std_mult': 0.7182124045314862, 'bull_rsi_os': 33, 'bull_rsi_ob': 90, 'bull_adx_thresh': 30.568442006827816, 'bull_atr_min_pct': 0.0010648135656575715, 'bull_atr_max_pct': 0.025335986011252157, 'bull_tp_mult': 1.0124689488478773, 'bull_tsl_mult': 0.7279466747018208, 'bull_time_stop': 282, 'bull_use_sma': True, 'bull_use_ema': False, 'bull_use_atr': True, 'bull_use_adx': True, 'bull_use_spike': False, 'bull_rsi_required': True, 'bear_strategy': 'breakout', 'bear_bb_std_mult': 2.667040236372127, 'bear_rsi_os': 34, 'bear_rsi_ob': 95, 'bear_adx_thresh': 13.570998086333061, 'bear_atr_min_pct': 0.0065804114187766535, 'bear_atr_max_pct': 0.01724625365253488, 'bear_tp_mult': 2.519277316517935, 'bear_tsl_mult': 0.6313102328567971, 'bear_time_stop': 116, 'bear_use_sma': False, 'bear_use_ema': False, 'bear_use_atr': True, 'bear_use_adx': False, 'bear_use_spike': False, 'bear_rsi_required': True, 'sideways_strategy': 'mean_reversion', 'sideways_bb_std_mult': 0.963232215935574, 'sideways_rsi_os': 27, 'sideways_rsi_ob': 87, 'sideways_adx_thresh': 14.527899917319592, 'sideways_atr_min_pct': 0.013969364469228212, 'sideways_atr_max_pct': 0.13597604985530254, 'sideways_tp_mult': 1.870632685116874, 'sideways_tsl_mult': 0.4014840154570184, 'sideways_time_stop': 150, 'sideways_use_sma': False, 'sideways_use_ema': True, 'sideways_use_atr': False, 'sideways_use_adx': False, 'sideways_use_spike': False, 'sideways_rsi_required': True}.
[I 2025-08-31 10:03:02,775] Trial 91 finished with values: [-0.00890540311587451, 0.008981980011845685] and parameters: {'p_sma': 21, 'p_std': 10, 'p_atr': 8, 'p_adx': 23, 'rsi_period': 9, 'ema1': 20, 'ema2': 53, 'slip_atr_k': 0.1760449273057353, 'slip_spread_k': 0.6157964502899447, 'spread_hl_frac': 0.03965242205106252, 'bb_std_mult': 3.5892750316085764, 'rsi_os': 17, 'rsi_ob': 92, 'vol_spike': 0.2491495148983636, 'adx_thresh': 20.755634254532307, 'atr_min_pct': 0.015463955601741075, 'atr_max_pct': 0.11928910040155735, 'tp_mult': 1.772979771236524, 'tsl_mult': 0.9448902722516546, 'strategy': 'mean_reversion', 'time_stop': 292, 'use_sma': True, 'use_atr': False, 'use_adx': True, 'use_ema': False, 'use_spike': False, 'rsi_required': False, 'edge_k': 1.5763662775210439, 'edge_cap': 0.4944129111882616, 'bull_strategy': 'breakout', 'bull_bb_std_mult': 0.7121927315496865, 'bull_rsi_os': 36, 'bull_rsi_ob': 90, 'bull_adx_thresh': 30.709662149436262, 'bull_atr_min_pct': 0.004203286533220829, 'bull_atr_max_pct': 0.04840973768147469, 'bull_tp_mult': 1.3839631139493673, 'bull_tsl_mult': 0.858757569098299, 'bull_time_stop': 246, 'bull_use_sma': True, 'bull_use_ema': False, 'bull_use_atr': True, 'bull_use_adx': True, 'bull_use_spike': False, 'bull_rsi_required': True, 'bear_strategy': 'mean_reversion', 'bear_bb_std_mult': 2.929897845695983, 'bear_rsi_os': 38, 'bear_rsi_ob': 89, 'bear_adx_thresh': 11.748144915588341, 'bear_atr_min_pct': 0.02654694183210572, 'bear_atr_max_pct': 0.04257898787298485, 'bear_tp_mult': 2.7200545460267964, 'bear_tsl_mult': 0.6378516634015348, 'bear_time_stop': 117, 'bear_use_sma': True, 'bear_use_ema': False, 'bear_use_atr': False, 'bear_use_adx': False, 'bear_use_spike': False, 'bear_rsi_required': True, 'sideways_strategy': 'mean_reversion', 'sideways_bb_std_mult': 2.484306660097067, 'sideways_rsi_os': 17, 'sideways_rsi_ob': 85, 'sideways_adx_thresh': 18.61187514468287, 'sideways_atr_min_pct': 0.014308984557831177, 'sideways_atr_max_pct': 0.03125035649820782, 'sideways_tp_mult': 1.4352048287271169, 'sideways_tsl_mult': 0.0977197100731379, 'sideways_time_stop': 152, 'sideways_use_sma': False, 'sideways_use_ema': False, 'sideways_use_atr': False, 'sideways_use_adx': True, 'sideways_use_spike': False, 'sideways_rsi_required': True}.
