[I 2025-08-31 10:52:49,888] Trial 496 finished with values: [-0.013709698112223445, 0.013706686581840852] and parameters: {'p_sma': 45, 'p_std': 51, 'p_atr': 21, 'p_adx': 20, 'rsi_period': 43, 'ema1': 21, 'ema2': 49, 'slip_atr_k': 0.010638502965637987, 'slip_spread_k': 0.23562883407455557, 'spread_hl_frac': 0.02381077360635243, 'bb_std_mult': 2.502012313200807, 'rsi_os': 36, 'rsi_ob': 72, 'vol_spike': 0.26312049001713345, 'adx_thresh': 10.144594855301893, 'atr_min_pct': 0.019773414002174944, 'atr_max_pct': 0.04035750840149272, 'tp_mult': 2.606640765005094, 'tsl_mult': 0.6661937250245688, 'strategy': 'mean_reversion', 'time_stop': 35, 'use_sma': False, 'use_atr': False, 'use_adx': False, 'use_ema': False, 'use_spike': False, 'rsi_required': False, 'edge_k': 1.8422947862594738, 'edge_cap': 0.22391068986033835, 'bull_strategy': 'breakout', 'bull_bb_std_mult': 3.542149948328971, 'bull_rsi_os': 45, 'bull_rsi_ob': 55, 'bull_adx_thresh': 29.29491249816035, 'bull_atr_min_pct': 0.0008626453260849373, 'bull_atr_max_pct': 0.0432015925130688, 'bull_tp_mult': 2.7984375005558144, 'bull_tsl_mult': 0.2399506719055386, 'bull_time_stop': 47, 'bull_use_sma': False, 'bull_use_ema': True, 'bull_use_atr': False, 'bull_use_adx': True, 'bull_use_spike': True, 'bull_rsi_required': False, 'bear_strategy': 'breakout', 'bear_bb_std_mult': 1.1627298861475617, 'bear_rsi_os': 22, 'bear_rsi_ob': 56, 'bear_adx_thresh': 12.576406145664963, 'bear_atr_min_pct': 0.026712929474945784, 'bear_atr_max_pct': 0.14317589025325989, 'bear_tp_mult': 2.7475516101615907, 'bear_tsl_mult': 0.04918826912398799, 'bear_time_stop': 43, 'bear_use_sma': False, 'bear_use_ema': True, 'bear_use_atr': True, 'bear_use_adx': False, 'bear_use_spike': False, 'bear_rsi_required': True, 'sideways_strategy': 'mean_reversion', 'sideways_bb_std_mult': 2.7607494844623566, 'sideways_rsi_os': 34, 'sideways_rsi_ob': 58, 'sideways_adx_thresh': 14.069915246300644, 'sideways_atr_min_pct': 0.006806865118074998, 'sideways_atr_max_pct': 0.09642182161656199, 'sideways_tp_mult': 1.9933537832039865, 'sideways_tsl_mult': 0.6084941162827001, 'sideways_time_stop': 54, 'sideways_use_sma': True, 'sideways_use_ema': False, 'sideways_use_atr': False, 'sideways_use_adx': False, 'sideways_use_spike': False, 'sideways_rsi_required': False}.
[I 2025-08-31 10:52:50,695] Trial 494 finished with values: [-0.03458945165588734, 0.03452904609847101] and parameters: {'p_sma': 45, 'p_std': 36, 'p_atr': 24, 'p_adx': 20, 'rsi_period': 43, 'ema1': 22, 'ema2': 58, 'slip_atr_k': 0.006258930539711781, 'slip_spread_k': 0.9740478160372286, 'spread_hl_frac': 0.025943439724383132, 'bb_std_mult': 2.4498657914179858, 'rsi_os': 33, 'rsi_ob': 76, 'vol_spike': 0.10400344273585192, 'adx_thresh': 24.876979472533357, 'atr_min_pct': 0.018565157695663873, 'atr_max_pct': 0.0422325579643644, 'tp_mult': 2.5981038523666085, 'tsl_mult': 0.6709951788121215, 'strategy': 'mean_reversion', 'time_stop': 239, 'use_sma': False, 'use_atr': False, 'use_adx': False, 'use_ema': True, 'use_spike': False, 'rsi_required': False, 'edge_k': 1.362518080217665, 'edge_cap': 0.3459949844587885, 'bull_strategy': 'breakout', 'bull_bb_std_mult': 3.5329983020946023, 'bull_rsi_os': 44, 'bull_rsi_ob': 65, 'bull_adx_thresh': 10.190099121029393, 'bull_atr_min_pct': 0.0006694894519099319, 'bull_atr_max_pct': 0.041665672180873393, 'bull_tp_mult': 2.846246985144668, 'bull_tsl_mult': 0.3097036582319648, 'bull_time_stop': 54, 'bull_use_sma': False, 'bull_use_ema': False, 'bull_use_atr': False, 'bull_use_adx': True, 'bull_use_spike': True, 'bull_rsi_required': True, 'bear_strategy': 'breakout', 'bear_bb_std_mult': 1.543507651071297, 'bear_rsi_os': 21, 'bear_rsi_ob': 73, 'bear_adx_thresh': 15.978971356964438, 'bear_atr_min_pct': 0.023863817888163913, 'bear_atr_max_pct': 0.0621700692952523, 'bear_tp_mult': 1.902947923477704, 'bear_tsl_mult': 0.09412780573618154, 'bear_time_stop': 43, 'bear_use_sma': False, 'bear_use_ema': True, 'bear_use_atr': False, 'bear_use_adx': False, 'bear_use_spike': True, 'bear_rsi_required': True, 'sideways_strategy': 'mean_reversion', 'sideways_bb_std_mult': 2.654029686785711, 'sideways_rsi_os': 19, 'sideways_rsi_ob': 57, 'sideways_adx_thresh': 26.916404131070028, 'sideways_atr_min_pct': 0.018871752763297472, 'sideways_atr_max_pct': 0.13549043976354488, 'sideways_tp_mult': 1.8923030356119992, 'sideways_tsl_mult': 0.3085663425434178, 'sideways_time_stop': 77, 'sideways_use_sma': True, 'sideways_use_ema': False, 'sideways_use_atr': True, 'sideways_use_adx': False, 'sideways_use_spike': True, 'sideways_rsi_required': False}.
[I 2025-08-31 10:52:50,907] Trial 497 finished with values: [-1000000000.0, 1000000000.0] and parameters: {'p_sma': 45, 'p_std': 51, 'p_atr': 21, 'p_adx': 20, 'rsi_period': 43, 'ema1': 21, 'ema2': 58, 'slip_atr_k': 0.014166590672079789, 'slip_spread_k': 0.23844192518692447, 'spread_hl_frac': 0.0074885507160958285, 'bb_std_mult': 2.4260997284353483, 'rsi_os': 36, 'rsi_ob': 81, 'vol_spike': 0.24012171375947108, 'adx_thresh': 33.835905976420875, 'atr_min_pct': 0.016670474686984127, 'atr_max_pct': 0.14070372527617525, 'tp_mult': 2.8625188840257625, 'tsl_mult': 0.6359031570911807, 'strategy': 'mean_reversion', 'time_stop': 36, 'use_sma': True, 'use_atr': False, 'use_adx': False, 'use_ema': False, 'use_spike': False, 'rsi_required': False, 'edge_k': 1.8462549567938535, 'edge_cap': 0.16037089838679236, 'bull_strategy': 'breakout', 'bull_bb_std_mult': 3.377715917431351, 'bull_rsi_os': 55, 'bull_rsi_ob': 80, 'bull_adx_thresh': 5.019025317534254, 'bull_atr_min_pct': 0.0050072891997504435, 'bull_atr_max_pct': 0.04274216819615265, 'bull_tp_mult': 2.7978999081211255, 'bull_tsl_mult': 0.32328486005395124, 'bull_time_stop': 44, 'bull_use_sma': False, 'bull_use_ema': True, 'bull_use_atr': False, 'bull_use_adx': True, 'bull_use_spike': True, 'bull_rsi_required': False, 'bear_strategy': 'breakout', 'bear_bb_std_mult': 1.1618629794769313, 'bear_rsi_os': 25, 'bear_rsi_ob': 56, 'bear_adx_thresh': 12.535538000188437, 'bear_atr_min_pct': 0.025764986109575717, 'bear_atr_max_pct': 0.14168631467035422, 'bear_tp_mult': 2.7381281904970414, 'bear_tsl_mult': 0.09846865847545766, 'bear_time_stop': 118, 'bear_use_sma': False, 'bear_use_ema': True, 'bear_use_atr': True, 'bear_use_adx': False, 'bear_use_spike': False, 'bear_rsi_required': True, 'sideways_strategy': 'mean_reversion', 'sideways_bb_std_mult': 2.780260455871686, 'sideways_rsi_os': 34, 'sideways_rsi_ob': 58, 'sideways_adx_thresh': 22.31917564851912, 'sideways_atr_min_pct': 0.004529190495425816, 'sideways_atr_max_pct': 0.14030205926219946, 'sideways_tp_mult': 1.9143858504365372, 'sideways_tsl_mult': 0.9166961969423326, 'sideways_time_stop': 252, 'sideways_use_sma': True, 'sideways_use_ema': True, 'sideways_use_atr': False, 'sideways_use_adx': False, 'sideways_use_spike': False, 'sideways_rsi_required': False}.
[I 2025-08-31 10:53:24,737] Trial 500 finished with values: [-1000000000.0, 1000000000.0] and parameters: {'p_sma': 49, 'p_std': 8, 'p_atr': 23, 'p_adx': 20, 'rsi_period': 41, 'ema1': 22, 'ema2': 32, 'slip_atr_k': 0.02071203189125625, 'slip_spread_k': 0.28027364840285973, 'spread_hl_frac': 0.03520207202895932, 'bb_std_mult': 2.557029994976005, 'rsi_os': 37, 'rsi_ob': 51, 'vol_spike': 0.11628971531748963, 'adx_thresh': 18.526634814327835, 'atr_min_pct': 0.020025077022938115, 'atr_max_pct': 0.037623423684193705, 'tp_mult': 2.8108251828117323, 'tsl_mult': 0.1059739039428399, 'strategy': 'breakout', 'time_stop': 148, 'use_sma': True, 'use_atr': False, 'use_adx': False, 'use_ema': False, 'use_spike': False, 'rsi_required': False, 'edge_k': 1.8284202714350062, 'edge_cap': 0.5767412139414579, 'bull_strategy': 'mean_reversion', 'bull_bb_std_mult': 3.544132750124881, 'bull_rsi_os': 44, 'bull_rsi_ob': 80, 'bull_adx_thresh': 11.038151085681234, 'bull_atr_min_pct': 0.003260696231549313, 'bull_atr_max_pct': 0.04377444468496446, 'bull_tp_mult': 2.8785309593953925, 'bull_tsl_mult': 0.14246758460446732, 'bull_time_stop': 54, 'bull_use_sma': False, 'bull_use_ema': True, 'bull_use_atr': False, 'bull_use_adx': True, 'bull_use_spike': True, 'bull_rsi_required': False, 'bear_strategy': 'breakout', 'bear_bb_std_mult': 1.4853643984171574, 'bear_rsi_os': 24, 'bear_rsi_ob': 51, 'bear_adx_thresh': 13.373576482258265, 'bear_atr_min_pct': 0.025567215889503503, 'bear_atr_max_pct': 0.13322403399196583, 'bear_tp_mult': 1.0354718535533414, 'bear_tsl_mult': 0.11888148911962287, 'bear_time_stop': 249, 'bear_use_sma': False, 'bear_use_ema': False, 'bear_use_atr': True, 'bear_use_adx': True, 'bear_use_spike': True, 'bear_rsi_required': True, 'sideways_strategy': 'mean_reversion', 'sideways_bb_std_mult': 3.3660770811938816, 'sideways_rsi_os': 37, 'sideways_rsi_ob': 58, 'sideways_adx_thresh': 23.925348010172474, 'sideways_atr_min_pct': 0.015779908958822954, 'sideways_atr_max_pct': 0.01244110408000503, 'sideways_tp_mult': 1.9076522178677568, 'sideways_tsl_mult': 0.9135682947843913, 'sideways_time_stop': 258, 'sideways_use_sma': True, 'sideways_use_ema': True, 'sideways_use_atr': False, 'sideways_use_adx': False, 'sideways_use_spike': True, 'sideways_rsi_required': True}.
[I 2025-08-31 10:53:25,094] Trial 499 finished with values: [-0.01456591520573347, 0.014519760898900004] and parameters: {'p_sma': 44, 'p_std': 8, 'p_atr': 22, 'p_adx': 20, 'rsi_period': 41, 'ema1': 22, 'ema2': 59, 'slip_atr_k': 0.004701445375671051, 'slip_spread_k': 0.34767523283635426, 'spread_hl_frac': 0.025178918064269827, 'bb_std_mult': 2.5335416662980164, 'rsi_os': 32, 'rsi_ob': 76, 'vol_spike': 0.12073724888539528, 'adx_thresh': 15.829552943946737, 'atr_min_pct': 0.016589117963559375, 'atr_max_pct': 0.03770917376634335, 'tp_mult': 2.8086691784524667, 'tsl_mult': 0.10310547545587279, 'strategy': 'breakout', 'time_stop': 43, 'use_sma': True, 'use_atr': False, 'use_adx': False, 'use_ema': True, 'use_spike': False, 'rsi_required': False, 'edge_k': 1.7550215680644405, 'edge_cap': 0.3511381569044518, 'bull_strategy': 'breakout', 'bull_bb_std_mult': 3.3784383193019414, 'bull_rsi_os': 27, 'bull_rsi_ob': 80, 'bull_adx_thresh': 11.017198093421893, 'bull_atr_min_pct': 0.0031928245960758123, 'bull_atr_max_pct': 0.043444985449037084, 'bull_tp_mult': 2.87243212816824, 'bull_tsl_mult': 0.11576810592464626, 'bull_time_stop': 56, 'bull_use_sma': False, 'bull_use_ema': True, 'bull_use_atr': False, 'bull_use_adx': True, 'bull_use_spike': True, 'bull_rsi_required': False, 'bear_strategy': 'breakout', 'bear_bb_std_mult': 1.5379151375775233, 'bear_rsi_os': 25, 'bear_rsi_ob': 51, 'bear_adx_thresh': 13.335639069583713, 'bear_atr_min_pct': 0.022690780590964188, 'bear_atr_max_pct': 0.13360732680506343, 'bear_tp_mult': 2.779107094945193, 'bear_tsl_mult': 0.1198597410677252, 'bear_time_stop': 248, 'bear_use_sma': False, 'bear_use_ema': False, 'bear_use_atr': True, 'bear_use_adx': False, 'bear_use_spike': True, 'bear_rsi_required': True, 'sideways_strategy': 'mean_reversion', 'sideways_bb_std_mult': 2.788394238689046, 'sideways_rsi_os': 36, 'sideways_rsi_ob': 61, 'sideways_adx_thresh': 11.837082293666501, 'sideways_atr_min_pct': 0.00459912238181419, 'sideways_atr_max_pct': 0.012513480625854565, 'sideways_tp_mult': 1.9138517021368262, 'sideways_tsl_mult': 0.8870632966353598, 'sideways_time_stop': 201, 'sideways_use_sma': True, 'sideways_use_ema': True, 'sideways_use_atr': False, 'sideways_use_adx': False, 'sideways_use_spike': True, 'sideways_rsi_required': False}.
[I 2025-08-31 10:53:25,128] Trial 501 finished with values: [-1000000000.0, 1000000000.0] and parameters: {'p_sma': 44, 'p_std': 38, 'p_atr': 23, 'p_adx': 21, 'rsi_period': 41, 'ema1': 23, 'ema2': 59, 'slip_atr_k': 0.005934043219017288, 'slip_spread_k': 0.2828494507616003, 'spread_hl_frac': 0.04210393106517843, 'bb_std_mult': 3.167945186275785, 'rsi_os': 34, 'rsi_ob': 75, 'vol_spike': 0.06172745056866219, 'adx_thresh': 20.60782834829924, 'atr_min_pct': 0.020098331227850114, 'atr_max_pct': 0.02144050595588233, 'tp_mult': 1.5454293884465309, 'tsl_mult': 0.6470124917460597, 'strategy': 'breakout', 'time_stop': 44, 'use_sma': True, 'use_atr': False, 'use_adx': False, 'use_ema': False, 'use_spike': False, 'rsi_required': False, 'edge_k': 0.0024002503237090522, 'edge_cap': 0.6870116265850954, 'bull_strategy': 'mean_reversion', 'bull_bb_std_mult': 3.4728454365862476, 'bull_rsi_os': 27, 'bull_rsi_ob': 79, 'bull_adx_thresh': 10.962563611093758, 'bull_atr_min_pct': 0.003158165965419249, 'bull_atr_max_pct': 0.04408581780479253, 'bull_tp_mult': 2.87174518179553, 'bull_tsl_mult': 0.14353099643009914, 'bull_time_stop': 80, 'bull_use_sma': False, 'bull_use_ema': True, 'bull_use_atr': False, 'bull_use_adx': True, 'bull_use_spike': False, 'bull_rsi_required': False, 'bear_strategy': 'breakout', 'bear_bb_std_mult': 1.6912383181004744, 'bear_rsi_os': 24, 'bear_rsi_ob': 67, 'bear_adx_thresh': 13.445944358374096, 'bear_atr_min_pct': 0.022768796424987463, 'bear_atr_max_pct': 0.13393657532877168, 'bear_tp_mult': 2.321505617388981, 'bear_tsl_mult': 0.12758285754207915, 'bear_time_stop': 29, 'bear_use_sma': False, 'bear_use_ema': False, 'bear_use_atr': True, 'bear_use_adx': True, 'bear_use_spike': True, 'bear_rsi_required': True, 'sideways_strategy': 'mean_reversion', 'sideways_bb_std_mult': 0.6996917791796717, 'sideways_rsi_os': 37, 'sideways_rsi_ob': 60, 'sideways_adx_thresh': 23.89028083999111, 'sideways_atr_min_pct': 0.006098883642624833, 'sideways_atr_max_pct': 0.01283062220761573, 'sideways_tp_mult': 1.813550974422386, 'sideways_tsl_mult': 0.14448473936516826, 'sideways_time_stop': 201, 'sideways_use_sma': True, 'sideways_use_ema': True, 'sideways_use_atr': False, 'sideways_use_adx': False, 'sideways_use_spike': True, 'sideways_rsi_required': True}.
[I 2025-08-31 10:53:25,353] Trial 498 finished with values: [-0.004726399151388061, 0.005530841573996051] and parameters: {'p_sma': 46, 'p_std': 38, 'p_atr': 21, 'p_adx': 20, 'rsi_period': 44, 'ema1': 21, 'ema2': 58, 'slip_atr_k': 0.010897058470823968, 'slip_spread_k': 0.12373848424727907, 'spread_hl_frac': 0.04307670531260087, 'bb_std_mult': 2.497953052609415, 'rsi_os': 36, 'rsi_ob': 81, 'vol_spike': 0.08263915761961728, 'adx_thresh': 34.05023980765783, 'atr_min_pct': 0.019720456254854614, 'atr_max_pct': 0.03803590273510247, 'tp_mult': 2.1052141544559, 'tsl_mult': 0.6556916179178808, 'strategy': 'breakout', 'time_stop': 147, 'use_sma': True, 'use_atr': False, 'use_adx': False, 'use_ema': False, 'use_spike': False, 'rsi_required': False, 'edge_k': 1.852187926141297, 'edge_cap': 0.2221806501938299, 'bull_strategy': 'breakout', 'bull_bb_std_mult': 3.5462649702236115, 'bull_rsi_os': 55, 'bull_rsi_ob': 54, 'bull_adx_thresh': 10.953326248008693, 'bull_atr_min_pct': 0.0031438447456604993, 'bull_atr_max_pct': 0.04230120521457362, 'bull_tp_mult': 2.8118026774111677, 'bull_tsl_mult': 0.7946430304175616, 'bull_time_stop': 53, 'bull_use_sma': False, 'bull_use_ema': True, 'bull_use_atr': False, 'bull_use_adx': True, 'bull_use_spike': True, 'bull_rsi_required': False, 'bear_strategy': 'breakout', 'bear_bb_std_mult': 1.4892083407921948, 'bear_rsi_os': 25, 'bear_rsi_ob': 48, 'bear_adx_thresh': 12.660805074310115, 'bear_atr_min_pct': 0.025670261922751614, 'bear_atr_max_pct': 0.14334019939127507, 'bear_tp_mult': 2.0548488894921944, 'bear_tsl_mult': 0.7340671331351519, 'bear_time_stop': 28, 'bear_use_sma': False, 'bear_use_ema': False, 'bear_use_atr': True, 'bear_use_adx': False, 'bear_use_spike': True, 'bear_rsi_required': True, 'sideways_strategy': 'mean_reversion', 'sideways_bb_std_mult': 1.5221772304826846, 'sideways_rsi_os': 34, 'sideways_rsi_ob': 58, 'sideways_adx_thresh': 24.101205672758674, 'sideways_atr_min_pct': 0.006557959862943696, 'sideways_atr_max_pct': 0.010133938771230613, 'sideways_tp_mult': 1.9168155340272344, 'sideways_tsl_mult': 0.89434969884969, 'sideways_time_stop': 56, 'sideways_use_sma': True, 'sideways_use_ema': True, 'sideways_use_atr': False, 'sideways_use_adx': False, 'sideways_use_spike': True, 'sideways_rsi_required': False}.
[I 2025-08-31 10:53:57,167] Trial 503 finished with values: [-1000000000.0, 1000000000.0] and parameters: {'p_sma': 44, 'p_std': 38, 'p_atr': 21, 'p_adx': 21, 'rsi_period': 36, 'ema1': 23, 'ema2': 52, 'slip_atr_k': 0.008391803861264473, 'slip_spread_k': 0.7240783830142704, 'spread_hl_frac': 0.017347061469060735, 'bb_std_mult': 1.4501390335340703, 'rsi_os': 34, 'rsi_ob': 75, 'vol_spike': 0.08326223939774675, 'adx_thresh': 20.526529360030093, 'atr_min_pct': 0.01932249946646283, 'atr_max_pct': 0.10483112735918014, 'tp_mult': 2.8403455851334063, 'tsl_mult': 0.9416617738890349, 'strategy': 'mean_reversion', 'time_stop': 162, 'use_sma': False, 'use_atr': False, 'use_adx': False, 'use_ema': False, 'use_spike': False, 'rsi_required': False, 'edge_k': 0.3888859367276607, 'edge_cap': 0.7470992148546375, 'bull_strategy': 'breakout', 'bull_bb_std_mult': 3.5953827542688104, 'bull_rsi_os': 33, 'bull_rsi_ob': 45, 'bull_adx_thresh': 6.3191224179681384, 'bull_atr_min_pct': 0.010874762428302657, 'bull_atr_max_pct': 0.03787375597174306, 'bull_tp_mult': 2.744963267026181, 'bull_tsl_mult': 0.8953035986449296, 'bull_time_stop': 65, 'bull_use_sma': False, 'bull_use_ema': True, 'bull_use_atr': False, 'bull_use_adx': True, 'bull_use_spike': False, 'bull_rsi_required': False, 'bear_strategy': 'breakout', 'bear_bb_std_mult': 1.3799506590722002, 'bear_rsi_os': 23, 'bear_rsi_ob': 55, 'bear_adx_thresh': 14.00668538741044, 'bear_atr_min_pct': 0.02430392890746249, 'bear_atr_max_pct': 0.10640947393941098, 'bear_tp_mult': 1.654970411245684, 'bear_tsl_mult': 0.732694987308691, 'bear_time_stop': 27, 'bear_use_sma': False, 'bear_use_ema': False, 'bear_use_atr': True, 'bear_use_adx': True, 'bear_use_spike': True, 'bear_rsi_required': True, 'sideways_strategy': 'mean_reversion', 'sideways_bb_std_mult': 2.519292449606014, 'sideways_rsi_os': 52, 'sideways_rsi_ob': 60, 'sideways_adx_thresh': 34.52560001049912, 'sideways_atr_min_pct': 0.006301764563560595, 'sideways_atr_max_pct': 0.017064537853478053, 'sideways_tp_mult': 1.767870727906055, 'sideways_tsl_mult': 0.5327088609749934, 'sideways_time_stop': 273, 'sideways_use_sma': True, 'sideways_use_ema': False, 'sideways_use_atr': False, 'sideways_use_adx': False, 'sideways_use_spike': True, 'sideways_rsi_required': False}.
[I 2025-08-31 10:53:57,510] Trial 504 finished with values: [-1000000000.0, 1000000000.0] and parameters: {'p_sma': 42, 'p_std': 57, 'p_atr': 22, 'p_adx': 19, 'rsi_period': 36, 'ema1': 23, 'ema2': 58, 'slip_atr_k': 8.334051021701436e-06, 'slip_spread_k': 0.26032726032750575, 'spread_hl_frac': 0.0228987875943341, 'bb_std_mult': 2.500470363244346, 'rsi_os': 37, 'rsi_ob': 65, 'vol_spike': 0.0014848884130748419, 'adx_thresh': 26.96007913533282, 'atr_min_pct': 0.01912558045427186, 'atr_max_pct': 0.04645504681755754, 'tp_mult': 1.0763954677666479, 'tsl_mult': 0.6929438105305888, 'strategy': 'mean_reversion', 'time_stop': 162, 'use_sma': False, 'use_atr': False, 'use_adx': False, 'use_ema': False, 'use_spike': False, 'rsi_required': False, 'edge_k': 1.5250814322600676, 'edge_cap': 0.2167582959929297, 'bull_strategy': 'breakout', 'bull_bb_std_mult': 3.4249242090549585, 'bull_rsi_os': 18, 'bull_rsi_ob': 45, 'bull_adx_thresh': 12.346114099787364, 'bull_atr_min_pct': 0.006781687847501668, 'bull_atr_max_pct': 0.03843408631398829, 'bull_tp_mult': 2.802025955463299, 'bull_tsl_mult': 0.12086343089796774, 'bull_time_stop': 67, 'bull_use_sma': False, 'bull_use_ema': True, 'bull_use_atr': False, 'bull_use_adx': True, 'bull_use_spike': True, 'bull_rsi_required': False, 'bear_strategy': 'mean_reversion', 'bear_bb_std_mult': 1.2845618714434424, 'bear_rsi_os': 23, 'bear_rsi_ob': 91, 'bear_adx_thresh': 14.280431144681216, 'bear_atr_min_pct': 0.027582470275088554, 'bear_atr_max_pct': 0.13976582469995472, 'bear_tp_mult': 2.0367404279629318, 'bear_tsl_mult': 0.1384533260193408, 'bear_time_stop': 38, 'bear_use_sma': False, 'bear_use_ema': False, 'bear_use_atr': True, 'bear_use_adx': False, 'bear_use_spike': True, 'bear_rsi_required': True, 'sideways_strategy': 'mean_reversion', 'sideways_bb_std_mult': 3.098437198859092, 'sideways_rsi_os': 34, 'sideways_rsi_ob': 59, 'sideways_adx_thresh': 28.449791737452728, 'sideways_atr_min_pct': 0.009322939868873822, 'sideways_atr_max_pct': 0.010015351360174986, 'sideways_tp_mult': 1.98891395630897, 'sideways_tsl_mult': 0.8877336803702836, 'sideways_time_stop': 113, 'sideways_use_sma': True, 'sideways_use_ema': False, 'sideways_use_atr': False, 'sideways_use_adx': False, 'sideways_use_spike': True, 'sideways_rsi_required': False}.
