[I 2025-08-31 10:37:02,891] Trial 369 finished with values: [-1000000000.0, 1000000000.0] and parameters: {'p_sma': 23, 'p_std': 37, 'p_atr': 28, 'p_adx': 8, 'rsi_period': 75, 'ema1': 23, 'ema2': 22, 'slip_atr_k': 0.0199375800230642, 'slip_spread_k': 0.4410969356361162, 'spread_hl_frac': 0.007909736020527889, 'bb_std_mult': 2.9305615926919764, 'rsi_os': 43, 'rsi_ob': 66, 'vol_spike': 0.1439925014681146, 'adx_thresh': 7.7999664560125055, 'atr_min_pct': 0.028465905168468794, 'atr_max_pct': 0.09525209759589345, 'tp_mult': 1.1156848967197641, 'tsl_mult': 0.7258420919259507, 'strategy': 'mean_reversion', 'time_stop': 161, 'use_sma': False, 'use_atr': False, 'use_adx': False, 'use_ema': False, 'use_spike': True, 'rsi_required': True, 'edge_k': 1.7963525571767294, 'edge_cap': 0.1495665990759386, 'bull_strategy': 'breakout', 'bull_bb_std_mult': 1.135471578429565, 'bull_rsi_os': 28, 'bull_rsi_ob': 76, 'bull_adx_thresh': 12.046272373602658, 'bull_atr_min_pct': 0.019384816101983917, 'bull_atr_max_pct': 0.09222428716034914, 'bull_tp_mult': 1.6162159585879625, 'bull_tsl_mult': 0.8739757890728889, 'bull_time_stop': 10, 'bull_use_sma': True, 'bull_use_ema': True, 'bull_use_atr': True, 'bull_use_adx': False, 'bull_use_spike': True, 'bull_rsi_required': False, 'bear_strategy': 'breakout', 'bear_bb_std_mult': 2.370430034437387, 'bear_rsi_os': 28, 'bear_rsi_ob': 61, 'bear_adx_thresh': 31.963598449479363, 'bear_atr_min_pct': 0.01502593376586235, 'bear_atr_max_pct': 0.11787148250515532, 'bear_tp_mult': 2.022782960207913, 'bear_tsl_mult': 0.15856742169580396, 'bear_time_stop': 149, 'bear_use_sma': False, 'bear_use_ema': False, 'bear_use_atr': True, 'bear_use_adx': True, 'bear_use_spike': True, 'bear_rsi_required': False, 'sideways_strategy': 'breakout', 'sideways_bb_std_mult': 2.5756068213523635, 'sideways_rsi_os': 33, 'sideways_rsi_ob': 82, 'sideways_adx_thresh': 16.087377282569726, 'sideways_atr_min_pct': 0.0025649645216129398, 'sideways_atr_max_pct': 0.01736005245561435, 'sideways_tp_mult': 1.1998487917296043, 'sideways_tsl_mult': 0.9996365153638747, 'sideways_time_stop': 109, 'sideways_use_sma': True, 'sideways_use_ema': False, 'sideways_use_atr': False, 'sideways_use_adx': False, 'sideways_use_spike': False, 'sideways_rsi_required': False}.
[I 2025-08-31 10:37:03,030] Trial 370 finished with values: [-0.026006900034798885, 0.026412640090084833] and parameters: {'p_sma': 48, 'p_std': 30, 'p_atr': 16, 'p_adx': 17, 'rsi_period': 25, 'ema1': 8, 'ema2': 34, 'slip_atr_k': 0.061698733800884815, 'slip_spread_k': 0.2864947992787063, 'spread_hl_frac': 0.03636777861223625, 'bb_std_mult': 3.314912268719712, 'rsi_os': 42, 'rsi_ob': 54, 'vol_spike': 0.09929481113517541, 'adx_thresh': 6.415357368419306, 'atr_min_pct': 0.02067021227282987, 'atr_max_pct': 0.09678645062859365, 'tp_mult': 2.7072966648773513, 'tsl_mult': 0.7283031099049054, 'strategy': 'mean_reversion', 'time_stop': 189, 'use_sma': False, 'use_atr': False, 'use_adx': False, 'use_ema': False, 'use_spike': False, 'rsi_required': True, 'edge_k': 1.8915743176843385, 'edge_cap': 0.14871036939032614, 'bull_strategy': 'breakout', 'bull_bb_std_mult': 1.1523854305893984, 'bull_rsi_os': 17, 'bull_rsi_ob': 61, 'bull_adx_thresh': 17.8045062082656, 'bull_atr_min_pct': 0.004120102058803217, 'bull_atr_max_pct': 0.11827179349608553, 'bull_tp_mult': 1.5922783177955506, 'bull_tsl_mult': 0.08707498745330794, 'bull_time_stop': 156, 'bull_use_sma': True, 'bull_use_ema': True, 'bull_use_atr': True, 'bull_use_adx': False, 'bull_use_spike': True, 'bull_rsi_required': False, 'bear_strategy': 'breakout', 'bear_bb_std_mult': 2.0244307101804653, 'bear_rsi_os': 28, 'bear_rsi_ob': 56, 'bear_adx_thresh': 8.629713628074487, 'bear_atr_min_pct': 0.02766072645847042, 'bear_atr_max_pct': 0.13295056587946402, 'bear_tp_mult': 2.6910997471343268, 'bear_tsl_mult': 0.03990298792405039, 'bear_time_stop': 143, 'bear_use_sma': False, 'bear_use_ema': False, 'bear_use_atr': True, 'bear_use_adx': True, 'bear_use_spike': True, 'bear_rsi_required': False, 'sideways_strategy': 'breakout', 'sideways_bb_std_mult': 1.812874374164805, 'sideways_rsi_os': 35, 'sideways_rsi_ob': 47, 'sideways_adx_thresh': 16.04923206483653, 'sideways_atr_min_pct': 0.0027525455188904925, 'sideways_atr_max_pct': 0.014036096345180936, 'sideways_tp_mult': 1.7983839938680488, 'sideways_tsl_mult': 0.18018543858904107, 'sideways_time_stop': 71, 'sideways_use_sma': True, 'sideways_use_ema': False, 'sideways_use_atr': False, 'sideways_use_adx': False, 'sideways_use_spike': False, 'sideways_rsi_required': False}.
[I 2025-08-31 10:37:03,656] Trial 371 finished with values: [-1000000000.0, 1000000000.0] and parameters: {'p_sma': 18, 'p_std': 7, 'p_atr': 18, 'p_adx': 13, 'rsi_period': 19, 'ema1': 8, 'ema2': 18, 'slip_atr_k': 0.061803629696642354, 'slip_spread_k': 0.2817101978531657, 'spread_hl_frac': 0.029834147625015357, 'bb_std_mult': 2.683230450244372, 'rsi_os': 49, 'rsi_ob': 74, 'vol_spike': 0.21031657205703386, 'adx_thresh': 6.617062025722117, 'atr_min_pct': 0.02994910177513986, 'atr_max_pct': 0.039315850094640836, 'tp_mult': 2.8109585876814687, 'tsl_mult': 0.05521043369188755, 'strategy': 'mean_reversion', 'time_stop': 18, 'use_sma': False, 'use_atr': False, 'use_adx': False, 'use_ema': False, 'use_spike': False, 'rsi_required': True, 'edge_k': 1.9054258256332, 'edge_cap': 0.3279841447791543, 'bull_strategy': 'breakout', 'bull_bb_std_mult': 2.0664357346081506, 'bull_rsi_os': 26, 'bull_rsi_ob': 71, 'bull_adx_thresh': 18.147845610721706, 'bull_atr_min_pct': 0.026206713479433576, 'bull_atr_max_pct': 0.11880303980948669, 'bull_tp_mult': 1.8745771594033833, 'bull_tsl_mult': 0.082789852572304, 'bull_time_stop': 23, 'bull_use_sma': True, 'bull_use_ema': True, 'bull_use_atr': True, 'bull_use_adx': False, 'bull_use_spike': True, 'bull_rsi_required': False, 'bear_strategy': 'breakout', 'bear_bb_std_mult': 2.039399350563704, 'bear_rsi_os': 28, 'bear_rsi_ob': 61, 'bear_adx_thresh': 8.619879985117858, 'bear_atr_min_pct': 0.024096059438160084, 'bear_atr_max_pct': 0.09980520252370353, 'bear_tp_mult': 2.609061444045368, 'bear_tsl_mult': 0.7504555544557558, 'bear_time_stop': 15, 'bear_use_sma': False, 'bear_use_ema': False, 'bear_use_atr': False, 'bear_use_adx': True, 'bear_use_spike': True, 'bear_rsi_required': True, 'sideways_strategy': 'breakout', 'sideways_bb_std_mult': 2.5586828400943107, 'sideways_rsi_os': 35, 'sideways_rsi_ob': 49, 'sideways_adx_thresh': 23.42732891313396, 'sideways_atr_min_pct': 0.004835003925112683, 'sideways_atr_max_pct': 0.14824660863462197, 'sideways_tp_mult': 1.1981828013855107, 'sideways_tsl_mult': 0.18372468233099903, 'sideways_time_stop': 110, 'sideways_use_sma': True, 'sideways_use_ema': False, 'sideways_use_atr': False, 'sideways_use_adx': False, 'sideways_use_spike': False, 'sideways_rsi_required': False}.
[I 2025-08-31 10:37:04,395] Trial 372 finished with values: [-1000000000.0, 1000000000.0] and parameters: {'p_sma': 23, 'p_std': 47, 'p_atr': 29, 'p_adx': 21, 'rsi_period': 22, 'ema1': 29, 'ema2': 32, 'slip_atr_k': 0.01988828304013983, 'slip_spread_k': 0.2830548478995318, 'spread_hl_frac': 0.010193781419629806, 'bb_std_mult': 1.8153569836869614, 'rsi_os': 31, 'rsi_ob': 75, 'vol_spike': 0.14475680923853315, 'adx_thresh': 7.613734761497124, 'atr_min_pct': 0.019928419013637295, 'atr_max_pct': 0.07232458411501205, 'tp_mult': 1.1340154993595983, 'tsl_mult': 0.711263397621437, 'strategy': 'mean_reversion', 'time_stop': 15, 'use_sma': False, 'use_atr': False, 'use_adx': False, 'use_ema': False, 'use_spike': False, 'rsi_required': True, 'edge_k': 1.6521602494588594, 'edge_cap': 0.0991762005744112, 'bull_strategy': 'breakout', 'bull_bb_std_mult': 0.5883885307086916, 'bull_rsi_os': 28, 'bull_rsi_ob': 76, 'bull_adx_thresh': 12.276948008888265, 'bull_atr_min_pct': 0.019498789905704375, 'bull_atr_max_pct': 0.111147209393689, 'bull_tp_mult': 1.1898785069307414, 'bull_tsl_mult': 0.029309637883224757, 'bull_time_stop': 11, 'bull_use_sma': True, 'bull_use_ema': True, 'bull_use_atr': True, 'bull_use_adx': False, 'bull_use_spike': True, 'bull_rsi_required': False, 'bear_strategy': 'breakout', 'bear_bb_std_mult': 1.9548397646200493, 'bear_rsi_os': 22, 'bear_rsi_ob': 56, 'bear_adx_thresh': 8.701774321468958, 'bear_atr_min_pct': 0.014926213455438144, 'bear_atr_max_pct': 0.11710845629295395, 'bear_tp_mult': 2.6878572006820622, 'bear_tsl_mult': 0.3470319770519936, 'bear_time_stop': 42, 'bear_use_sma': False, 'bear_use_ema': False, 'bear_use_atr': False, 'bear_use_adx': True, 'bear_use_spike': True, 'bear_rsi_required': True, 'sideways_strategy': 'breakout', 'sideways_bb_std_mult': 2.9007847424597415, 'sideways_rsi_os': 35, 'sideways_rsi_ob': 49, 'sideways_adx_thresh': 27.874111644674997, 'sideways_atr_min_pct': 0.004757882151893341, 'sideways_atr_max_pct': 0.14973113815769445, 'sideways_tp_mult': 1.192478716757103, 'sideways_tsl_mult': 0.796822347808212, 'sideways_time_stop': 128, 'sideways_use_sma': True, 'sideways_use_ema': False, 'sideways_use_atr': False, 'sideways_use_adx': False, 'sideways_use_spike': False, 'sideways_rsi_required': False}.
[I 2025-08-31 10:37:36,879] Trial 373 finished with values: [-1000000000.0, 1000000000.0] and parameters: {'p_sma': 7, 'p_std': 55, 'p_atr': 27, 'p_adx': 7, 'rsi_period': 22, 'ema1': 17, 'ema2': 37, 'slip_atr_k': 0.005106002818884708, 'slip_spread_k': 0.49852175203436, 'spread_hl_frac': 0.029713191460475286, 'bb_std_mult': 3.293753975574732, 'rsi_os': 38, 'rsi_ob': 74, 'vol_spike': 0.21125158141146738, 'adx_thresh': 6.916896427781225, 'atr_min_pct': 0.019735112937057684, 'atr_max_pct': 0.06756482637343175, 'tp_mult': 2.8129959726876423, 'tsl_mult': 0.7070172812769868, 'strategy': 'mean_reversion', 'time_stop': 15, 'use_sma': False, 'use_atr': False, 'use_adx': True, 'use_ema': False, 'use_spike': False, 'rsi_required': True, 'edge_k': 1.910652239764854, 'edge_cap': 0.09749717792973987, 'bull_strategy': 'breakout', 'bull_bb_std_mult': 3.029161814295106, 'bull_rsi_os': 40, 'bull_rsi_ob': 74, 'bull_adx_thresh': 6.413806850524125, 'bull_atr_min_pct': 0.0028771035940206562, 'bull_atr_max_pct': 0.11905853608336173, 'bull_tp_mult': 1.2383145616295965, 'bull_tsl_mult': 0.128374040672262, 'bull_time_stop': 170, 'bull_use_sma': True, 'bull_use_ema': False, 'bull_use_atr': True, 'bull_use_adx': True, 'bull_use_spike': True, 'bull_rsi_required': True, 'bear_strategy': 'mean_reversion', 'bear_bb_std_mult': 1.9587422995220942, 'bear_rsi_os': 30, 'bear_rsi_ob': 56, 'bear_adx_thresh': 8.689309683613729, 'bear_atr_min_pct': 0.01724360978628111, 'bear_atr_max_pct': 0.010456225658413767, 'bear_tp_mult': 2.691402025957449, 'bear_tsl_mult': 0.13789185004688723, 'bear_time_stop': 15, 'bear_use_sma': False, 'bear_use_ema': False, 'bear_use_atr': False, 'bear_use_adx': False, 'bear_use_spike': True, 'bear_rsi_required': True, 'sideways_strategy': 'breakout', 'sideways_bb_std_mult': 2.923410321689322, 'sideways_rsi_os': 35, 'sideways_rsi_ob': 47, 'sideways_adx_thresh': 27.709227282235272, 'sideways_atr_min_pct': 0.0046509113946706536, 'sideways_atr_max_pct': 0.14716620003555952, 'sideways_tp_mult': 1.1241376691298297, 'sideways_tsl_mult': 0.6633939394165168, 'sideways_time_stop': 131, 'sideways_use_sma': True, 'sideways_use_ema': False, 'sideways_use_atr': False, 'sideways_use_adx': False, 'sideways_use_spike': False, 'sideways_rsi_required': False}.
[I 2025-08-31 10:37:37,164] Trial 376 finished with values: [-1000000000.0, 1000000000.0] and parameters: {'p_sma': 17, 'p_std': 60, 'p_atr': 17, 'p_adx': 8, 'rsi_period': 54, 'ema1': 13, 'ema2': 59, 'slip_atr_k': 0.07190231737971686, 'slip_spread_k': 0.22568393517169172, 'spread_hl_frac': 0.027012085830352642, 'bb_std_mult': 2.539327361558571, 'rsi_os': 40, 'rsi_ob': 74, 'vol_spike': 0.21954141594260548, 'adx_thresh': 9.518105495840231, 'atr_min_pct': 0.018682318660323563, 'atr_max_pct': 0.08357730273255777, 'tp_mult': 2.1863398885676046, 'tsl_mult': 0.2560202860676517, 'strategy': 'mean_reversion', 'time_stop': 154, 'use_sma': True, 'use_atr': False, 'use_adx': True, 'use_ema': False, 'use_spike': True, 'rsi_required': True, 'edge_k': 1.6799156915546176, 'edge_cap': 0.12627141644668682, 'bull_strategy': 'mean_reversion', 'bull_bb_std_mult': 3.01611848328197, 'bull_rsi_os': 44, 'bull_rsi_ob': 54, 'bull_adx_thresh': 10.925508687685616, 'bull_atr_min_pct': 0.0030059951531056293, 'bull_atr_max_pct': 0.12643738830913814, 'bull_tp_mult': 1.2353206496638012, 'bull_tsl_mult': 0.12624854562228777, 'bull_time_stop': 57, 'bull_use_sma': True, 'bull_use_ema': False, 'bull_use_atr': True, 'bull_use_adx': True, 'bull_use_spike': False, 'bull_rsi_required': True, 'bear_strategy': 'mean_reversion', 'bear_bb_std_mult': 0.5037683606461179, 'bear_rsi_os': 30, 'bear_rsi_ob': 58, 'bear_adx_thresh': 12.396224273793614, 'bear_atr_min_pct': 0.01679545670866975, 'bear_atr_max_pct': 0.12474789654306707, 'bear_tp_mult': 2.575853886274588, 'bear_tsl_mult': 0.13941035912069277, 'bear_time_stop': 98, 'bear_use_sma': False, 'bear_use_ema': True, 'bear_use_atr': True, 'bear_use_adx': False, 'bear_use_spike': False, 'bear_rsi_required': True, 'sideways_strategy': 'breakout', 'sideways_bb_std_mult': 2.6424089107859126, 'sideways_rsi_os': 34, 'sideways_rsi_ob': 85, 'sideways_adx_thresh': 14.954846876794864, 'sideways_atr_min_pct': 0.003503015452416587, 'sideways_atr_max_pct': 0.04544085675872561, 'sideways_tp_mult': 1.254159690633439, 'sideways_tsl_mult': 0.14246311041970655, 'sideways_time_stop': 62, 'sideways_use_sma': True, 'sideways_use_ema': False, 'sideways_use_atr': False, 'sideways_use_adx': False, 'sideways_use_spike': True, 'sideways_rsi_required': True}.
[I 2025-08-31 10:37:37,407] Trial 375 finished with values: [-0.010086164470962333, 0.009779610662276478] and parameters: {'p_sma': 22, 'p_std': 55, 'p_atr': 7, 'p_adx': 14, 'rsi_period': 23, 'ema1': 13, 'ema2': 37, 'slip_atr_k': 0.1677946270670711, 'slip_spread_k': 0.33489010436811817, 'spread_hl_frac': 0.027037941636351773, 'bb_std_mult': 2.5748741894520943, 'rsi_os': 38, 'rsi_ob': 81, 'vol_spike': 0.19664473156917855, 'adx_thresh': 9.62983552429491, 'atr_min_pct': 0.01997522370529249, 'atr_max_pct': 0.06881228099839674, 'tp_mult': 2.2592999172718606, 'tsl_mult': 0.7656405775191082, 'strategy': 'mean_reversion', 'time_stop': 77, 'use_sma': True, 'use_atr': False, 'use_adx': True, 'use_ema': False, 'use_spike': True, 'rsi_required': True, 'edge_k': 1.5462843329361295, 'edge_cap': 0.10508615265671234, 'bull_strategy': 'mean_reversion', 'bull_bb_std_mult': 0.9724304212028214, 'bull_rsi_os': 21, 'bull_rsi_ob': 78, 'bull_adx_thresh': 10.718056318677602, 'bull_atr_min_pct': 0.003349646281103946, 'bull_atr_max_pct': 0.1113483184092453, 'bull_tp_mult': 1.1834806060535028, 'bull_tsl_mult': 0.37179451819890363, 'bull_time_stop': 10, 'bull_use_sma': True, 'bull_use_ema': False, 'bull_use_atr': True, 'bull_use_adx': True, 'bull_use_spike': True, 'bull_rsi_required': True, 'bear_strategy': 'mean_reversion', 'bear_bb_std_mult': 1.6477441095125023, 'bear_rsi_os': 49, 'bear_rsi_ob': 58, 'bear_adx_thresh': 30.93920814512515, 'bear_atr_min_pct': 0.016533839958023926, 'bear_atr_max_pct': 0.12529037591483114, 'bear_tp_mult': 2.4662514977726184, 'bear_tsl_mult': 0.35023673334123306, 'bear_time_stop': 99, 'bear_use_sma': False, 'bear_use_ema': True, 'bear_use_atr': False, 'bear_use_adx': False, 'bear_use_spike': True, 'bear_rsi_required': True, 'sideways_strategy': 'breakout', 'sideways_bb_std_mult': 2.9015433552574343, 'sideways_rsi_os': 34, 'sideways_rsi_ob': 85, 'sideways_adx_thresh': 27.76444434660275, 'sideways_atr_min_pct': 0.011730262741701608, 'sideways_atr_max_pct': 0.012662660987114204, 'sideways_tp_mult': 1.118585351221203, 'sideways_tsl_mult': 0.7955816902997308, 'sideways_time_stop': 259, 'sideways_use_sma': True, 'sideways_use_ema': False, 'sideways_use_atr': False, 'sideways_use_adx': False, 'sideways_use_spike': True, 'sideways_rsi_required': True}.
[I 2025-08-31 10:37:37,580] Trial 374 finished with values: [-0.0036023071838099385, 0.0036409812196895263] and parameters: {'p_sma': 22, 'p_std': 60, 'p_atr': 18, 'p_adx': 14, 'rsi_period': 19, 'ema1': 13, 'ema2': 16, 'slip_atr_k': 0.005228562946883397, 'slip_spread_k': 0.27793748393816897, 'spread_hl_frac': 0.047815074680633333, 'bb_std_mult': 2.7161333454654972, 'rsi_os': 38, 'rsi_ob': 74, 'vol_spike': 0.03375710891660531, 'adx_thresh': 19.91518570958015, 'atr_min_pct': 0.01985249525343592, 'atr_max_pct': 0.032436809899755496, 'tp_mult': 2.2690383945659782, 'tsl_mult': 0.705805268274143, 'strategy': 'mean_reversion', 'time_stop': 155, 'use_sma': False, 'use_atr': False, 'use_adx': True, 'use_ema': False, 'use_spike': False, 'rsi_required': True, 'edge_k': 0.7756005302495167, 'edge_cap': 0.10377683123086923, 'bull_strategy': 'mean_reversion', 'bull_bb_std_mult': 3.450387699239567, 'bull_rsi_os': 26, 'bull_rsi_ob': 83, 'bull_adx_thresh': 6.198567567677351, 'bull_atr_min_pct': 0.002806972518432644, 'bull_atr_max_pct': 0.11139852581548915, 'bull_tp_mult': 2.086458075089424, 'bull_tsl_mult': 0.37862542614295674, 'bull_time_stop': 23, 'bull_use_sma': True, 'bull_use_ema': False, 'bull_use_atr': True, 'bull_use_adx': True, 'bull_use_spike': True, 'bull_rsi_required': True, 'bear_strategy': 'mean_reversion', 'bear_bb_std_mult': 1.9240511270113199, 'bear_rsi_os': 30, 'bear_rsi_ob': 59, 'bear_adx_thresh': 12.184169880551186, 'bear_atr_min_pct': 0.017027027631271983, 'bear_atr_max_pct': 0.12521333047718072, 'bear_tp_mult': 1.4626442852785608, 'bear_tsl_mult': 0.7523295598999518, 'bear_time_stop': 15, 'bear_use_sma': False, 'bear_use_ema': True, 'bear_use_atr': False, 'bear_use_adx': False, 'bear_use_spike': True, 'bear_rsi_required': True, 'sideways_strategy': 'breakout', 'sideways_bb_std_mult': 2.915181815627867, 'sideways_rsi_os': 35, 'sideways_rsi_ob': 93, 'sideways_adx_thresh': 18.657916314841955, 'sideways_atr_min_pct': 0.006516161269966781, 'sideways_atr_max_pct': 0.1491445663443285, 'sideways_tp_mult': 1.2595839316301392, 'sideways_tsl_mult': 0.8093259014474169, 'sideways_time_stop': 129, 'sideways_use_sma': True, 'sideways_use_ema': False, 'sideways_use_atr': False, 'sideways_use_adx': False, 'sideways_use_spike': True, 'sideways_rsi_required': False}.
[I 2025-08-31 10:38:09,645] Trial 377 finished with values: [-1000000000.0, 1000000000.0] and parameters: {'p_sma': 17, 'p_std': 34, 'p_atr': 11, 'p_adx': 8, 'rsi_period': 20, 'ema1': 13, 'ema2': 59, 'slip_atr_k': 0.07193421039891328, 'slip_spread_k': 0.23058779756193787, 'spread_hl_frac': 0.02716940550856449, 'bb_std_mult': 2.56188977968259, 'rsi_os': 40, 'rsi_ob': 77, 'vol_spike': 0.21861526456493074, 'adx_thresh': 19.09333657026503, 'atr_min_pct': 0.017138139345162708, 'atr_max_pct': 0.04987185177678111, 'tp_mult': 2.8841318120179076, 'tsl_mult': 0.24415302324178173, 'strategy': 'mean_reversion', 'time_stop': 139, 'use_sma': True, 'use_atr': True, 'use_adx': True, 'use_ema': True, 'use_spike': True, 'rsi_required': True, 'edge_k': 0.7684423315014739, 'edge_cap': 0.4691739458118431, 'bull_strategy': 'mean_reversion', 'bull_bb_std_mult': 0.9713679785305912, 'bull_rsi_os': 20, 'bull_rsi_ob': 54, 'bull_adx_thresh': 10.94987520925749, 'bull_atr_min_pct': 0.015195234902446168, 'bull_atr_max_pct': 0.12634261581775058, 'bull_tp_mult': 1.1652483610603874, 'bull_tsl_mult': 0.3814189996322897, 'bull_time_stop': 229, 'bull_use_sma': False, 'bull_use_ema': False, 'bull_use_atr': False, 'bull_use_adx': True, 'bull_use_spike': False, 'bull_rsi_required': True, 'bear_strategy': 'mean_reversion', 'bear_bb_std_mult': 0.8828940325097319, 'bear_rsi_os': 49, 'bear_rsi_ob': 52, 'bear_adx_thresh': 22.998939788343687, 'bear_atr_min_pct': 0.016563757965621265, 'bear_atr_max_pct': 0.02933268957395517, 'bear_tp_mult': 2.893574917516292, 'bear_tsl_mult': 0.7857294462692264, 'bear_time_stop': 61, 'bear_use_sma': False, 'bear_use_ema': True, 'bear_use_atr': True, 'bear_use_adx': False, 'bear_use_spike': False, 'bear_rsi_required': True, 'sideways_strategy': 'breakout', 'sideways_bb_std_mult': 2.6390206660922835, 'sideways_rsi_os': 34, 'sideways_rsi_ob': 85, 'sideways_adx_thresh': 32.61042845759308, 'sideways_atr_min_pct': 0.020951103446619743, 'sideways_atr_max_pct': 0.013367746349298675, 'sideways_tp_mult': 1.247715741696756, 'sideways_tsl_mult': 0.7761016324285724, 'sideways_time_stop': 169, 'sideways_use_sma': True, 'sideways_use_ema': False, 'sideways_use_atr': False, 'sideways_use_adx': False, 'sideways_use_spike': True, 'sideways_rsi_required': True}.
