[I 2025-08-31 10:19:11,443] Trial 216 finished with values: [-1000000000.0, 1000000000.0] and parameters: {'p_sma': 22, 'p_std': 35, 'p_atr': 17, 'p_adx': 7, 'rsi_period': 23, 'ema1': 5, 'ema2': 58, 'slip_atr_k': 0.06316912323075025, 'slip_spread_k': 0.29595719153323913, 'spread_hl_frac': 0.029063974617472347, 'bb_std_mult': 1.732088546008213, 'rsi_os': 42, 'rsi_ob': 77, 'vol_spike': 0.19600278596481843, 'adx_thresh': 7.998520962711776, 'atr_min_pct': 0.021755523529486013, 'atr_max_pct': 0.0335547471752046, 'tp_mult': 2.7602618051891814, 'tsl_mult': 0.9969500197003509, 'strategy': 'mean_reversion', 'time_stop': 138, 'use_sma': False, 'use_atr': False, 'use_adx': True, 'use_ema': False, 'use_spike': True, 'rsi_required': True, 'edge_k': 1.020106046587048, 'edge_cap': 0.1784779463247314, 'bull_strategy': 'breakout', 'bull_bb_std_mult': 1.1324241458225845, 'bull_rsi_os': 40, 'bull_rsi_ob': 53, 'bull_adx_thresh': 10.348344680734284, 'bull_atr_min_pct': 0.015461802949593383, 'bull_atr_max_pct': 0.11601373235149545, 'bull_tp_mult': 2.8234041576116904, 'bull_tsl_mult': 0.08594514037824699, 'bull_time_stop': 123, 'bull_use_sma': True, 'bull_use_ema': True, 'bull_use_atr': True, 'bull_use_adx': True, 'bull_use_spike': True, 'bull_rsi_required': False, 'bear_strategy': 'breakout', 'bear_bb_std_mult': 0.855002895111441, 'bear_rsi_os': 28, 'bear_rsi_ob': 57, 'bear_adx_thresh': 7.816950962951026, 'bear_atr_min_pct': 0.020899544644940656, 'bear_atr_max_pct': 0.12294700996115564, 'bear_tp_mult': 2.7578577572520775, 'bear_tsl_mult': 0.006302551488333641, 'bear_time_stop': 181, 'bear_use_sma': False, 'bear_use_ema': False, 'bear_use_atr': True, 'bear_use_adx': False, 'bear_use_spike': True, 'bear_rsi_required': True, 'sideways_strategy': 'breakout', 'sideways_bb_std_mult': 2.3933176541875345, 'sideways_rsi_os': 43, 'sideways_rsi_ob': 83, 'sideways_adx_thresh': 14.77194905806577, 'sideways_atr_min_pct': 0.002796765932547036, 'sideways_atr_max_pct': 0.014152388911310283, 'sideways_tp_mult': 2.6098146294919724, 'sideways_tsl_mult': 0.7908174390184253, 'sideways_time_stop': 295, 'sideways_use_sma': True, 'sideways_use_ema': False, 'sideways_use_atr': False, 'sideways_use_adx': False, 'sideways_use_spike': True, 'sideways_rsi_required': False}.
[I 2025-08-31 10:19:11,527] Trial 217 finished with values: [-1000000000.0, 1000000000.0] and parameters: {'p_sma': 23, 'p_std': 33, 'p_atr': 17, 'p_adx': 8, 'rsi_period': 21, 'ema1': 9, 'ema2': 58, 'slip_atr_k': 0.07301447671897643, 'slip_spread_k': 0.23641571883020324, 'spread_hl_frac': 0.029525260746317217, 'bb_std_mult': 2.292033184630811, 'rsi_os': 6, 'rsi_ob': 95, 'vol_spike': 0.1969108501388433, 'adx_thresh': 8.242870198440476, 'atr_min_pct': 0.02155855037414788, 'atr_max_pct': 0.034222953972752206, 'tp_mult': 2.7813441588590955, 'tsl_mult': 0.06966609378019112, 'strategy': 'mean_reversion', 'time_stop': 136, 'use_sma': False, 'use_atr': False, 'use_adx': False, 'use_ema': False, 'use_spike': True, 'rsi_required': True, 'edge_k': 1.7534980453300895, 'edge_cap': 0.17978628773082517, 'bull_strategy': 'breakout', 'bull_bb_std_mult': 1.115424134533376, 'bull_rsi_os': 40, 'bull_rsi_ob': 54, 'bull_adx_thresh': 10.463031664047403, 'bull_atr_min_pct': 0.029904616961629354, 'bull_atr_max_pct': 0.09013127826691514, 'bull_tp_mult': 1.2113827941365176, 'bull_tsl_mult': 0.41508483391267464, 'bull_time_stop': 100, 'bull_use_sma': True, 'bull_use_ema': True, 'bull_use_atr': True, 'bull_use_adx': False, 'bull_use_spike': True, 'bull_rsi_required': False, 'bear_strategy': 'breakout', 'bear_bb_std_mult': 2.040247756738659, 'bear_rsi_os': 28, 'bear_rsi_ob': 56, 'bear_adx_thresh': 7.676472540617067, 'bear_atr_min_pct': 0.018466558145647655, 'bear_atr_max_pct': 0.12358997789578056, 'bear_tp_mult': 2.7925101585097463, 'bear_tsl_mult': 0.02153026991583537, 'bear_time_stop': 33, 'bear_use_sma': True, 'bear_use_ema': True, 'bear_use_atr': True, 'bear_use_adx': False, 'bear_use_spike': True, 'bear_rsi_required': False, 'sideways_strategy': 'breakout', 'sideways_bb_std_mult': 2.542236132963008, 'sideways_rsi_os': 33, 'sideways_rsi_ob': 83, 'sideways_adx_thresh': 14.77986810723245, 'sideways_atr_min_pct': 0.0025055712239930193, 'sideways_atr_max_pct': 0.014252484782443897, 'sideways_tp_mult': 1.1942304143163318, 'sideways_tsl_mult': 0.7889006528964643, 'sideways_time_stop': 244, 'sideways_use_sma': True, 'sideways_use_ema': False, 'sideways_use_atr': False, 'sideways_use_adx': True, 'sideways_use_spike': True, 'sideways_rsi_required': False}.
[I 2025-08-31 10:19:43,583] Trial 219 finished with values: [-1000000000.0, 1000000000.0] and parameters: {'p_sma': 48, 'p_std': 33, 'p_atr': 17, 'p_adx': 9, 'rsi_period': 21, 'ema1': 12, 'ema2': 58, 'slip_atr_k': 0.07283116960886343, 'slip_spread_k': 0.24998881725305958, 'spread_hl_frac': 0.02966541763651146, 'bb_std_mult': 3.0219767948358327, 'rsi_os': 6, 'rsi_ob': 84, 'vol_spike': 0.21968097256077238, 'adx_thresh': 9.218467172681304, 'atr_min_pct': 0.020753940095288713, 'atr_max_pct': 0.044776234126455476, 'tp_mult': 2.7972224124926632, 'tsl_mult': 0.49925930079689673, 'strategy': 'mean_reversion', 'time_stop': 135, 'use_sma': False, 'use_atr': False, 'use_adx': True, 'use_ema': False, 'use_spike': True, 'rsi_required': True, 'edge_k': 1.761304010201596, 'edge_cap': 0.17950103432511696, 'bull_strategy': 'breakout', 'bull_bb_std_mult': 1.0420019939706224, 'bull_rsi_os': 50, 'bull_rsi_ob': 53, 'bull_adx_thresh': 10.88234684412128, 'bull_atr_min_pct': 0.010196492618064953, 'bull_atr_max_pct': 0.13601323620886321, 'bull_tp_mult': 1.9888605458924293, 'bull_tsl_mult': 0.5545006051631359, 'bull_time_stop': 283, 'bull_use_sma': True, 'bull_use_ema': True, 'bull_use_atr': True, 'bull_use_adx': False, 'bull_use_spike': False, 'bull_rsi_required': False, 'bear_strategy': 'breakout', 'bear_bb_std_mult': 3.281905811745883, 'bear_rsi_os': 28, 'bear_rsi_ob': 68, 'bear_adx_thresh': 8.11470073779288, 'bear_atr_min_pct': 0.018225991075000864, 'bear_atr_max_pct': 0.07837384542620388, 'bear_tp_mult': 1.493099453262177, 'bear_tsl_mult': 0.025011706657434074, 'bear_time_stop': 29, 'bear_use_sma': True, 'bear_use_ema': False, 'bear_use_atr': False, 'bear_use_adx': False, 'bear_use_spike': True, 'bear_rsi_required': False, 'sideways_strategy': 'breakout', 'sideways_bb_std_mult': 2.5915620935880304, 'sideways_rsi_os': 40, 'sideways_rsi_ob': 85, 'sideways_adx_thresh': 14.815581299372692, 'sideways_atr_min_pct': 0.007964738357207062, 'sideways_atr_max_pct': 0.012896779019153069, 'sideways_tp_mult': 1.1777755898314772, 'sideways_tsl_mult': 0.6382138433300687, 'sideways_time_stop': 241, 'sideways_use_sma': True, 'sideways_use_ema': False, 'sideways_use_atr': True, 'sideways_use_adx': True, 'sideways_use_spike': True, 'sideways_rsi_required': False}.
[I 2025-08-31 10:19:43,921] Trial 221 finished with values: [-0.007374185262343458, 0.007145182830916103] and parameters: {'p_sma': 18, 'p_std': 31, 'p_atr': 17, 'p_adx': 18, 'rsi_period': 45, 'ema1': 12, 'ema2': 59, 'slip_atr_k': 0.07263824128660736, 'slip_spread_k': 0.2523366393776866, 'spread_hl_frac': 0.027489652839843975, 'bb_std_mult': 3.0990313749723857, 'rsi_os': 39, 'rsi_ob': 83, 'vol_spike': 0.05443374842719087, 'adx_thresh': 9.139637880586127, 'atr_min_pct': 0.02050766069409786, 'atr_max_pct': 0.044542316177411126, 'tp_mult': 2.8148885093895295, 'tsl_mult': 0.4851091877224934, 'strategy': 'mean_reversion', 'time_stop': 233, 'use_sma': False, 'use_atr': False, 'use_adx': True, 'use_ema': False, 'use_spike': True, 'rsi_required': True, 'edge_k': 0.8216731984702631, 'edge_cap': 0.21489621276762685, 'bull_strategy': 'breakout', 'bull_bb_std_mult': 1.9087968431374454, 'bull_rsi_os': 43, 'bull_rsi_ob': 75, 'bull_adx_thresh': 19.89290956634369, 'bull_atr_min_pct': 0.002446122761223987, 'bull_atr_max_pct': 0.10025321398829672, 'bull_tp_mult': 2.6463881853645677, 'bull_tsl_mult': 0.49507544090498046, 'bull_time_stop': 23, 'bull_use_sma': False, 'bull_use_ema': True, 'bull_use_atr': False, 'bull_use_adx': False, 'bull_use_spike': False, 'bull_rsi_required': False, 'bear_strategy': 'mean_reversion', 'bear_bb_std_mult': 1.380147435405079, 'bear_rsi_os': 30, 'bear_rsi_ob': 67, 'bear_adx_thresh': 8.33726608020395, 'bear_atr_min_pct': 0.015125047474715232, 'bear_atr_max_pct': 0.1195102556345463, 'bear_tp_mult': 1.075068925892719, 'bear_tsl_mult': 0.05309822062673948, 'bear_time_stop': 34, 'bear_use_sma': True, 'bear_use_ema': False, 'bear_use_atr': False, 'bear_use_adx': False, 'bear_use_spike': True, 'bear_rsi_required': False, 'sideways_strategy': 'breakout', 'sideways_bb_std_mult': 2.151536456225258, 'sideways_rsi_os': 46, 'sideways_rsi_ob': 85, 'sideways_adx_thresh': 15.12259857655289, 'sideways_atr_min_pct': 0.0042105513317755566, 'sideways_atr_max_pct': 0.0706998295728857, 'sideways_tp_mult': 1.3918233117122119, 'sideways_tsl_mult': 0.22986842633723975, 'sideways_time_stop': 239, 'sideways_use_sma': True, 'sideways_use_ema': False, 'sideways_use_atr': True, 'sideways_use_adx': True, 'sideways_use_spike': True, 'sideways_rsi_required': False}.
[I 2025-08-31 10:19:44,057] Trial 218 finished with values: [-0.002898565743896686, 0.00401621575478198] and parameters: {'p_sma': 28, 'p_std': 5, 'p_atr': 22, 'p_adx': 9, 'rsi_period': 21, 'ema1': 18, 'ema2': 58, 'slip_atr_k': 0.057011717424042596, 'slip_spread_k': 0.23527343763200095, 'spread_hl_frac': 0.027580465844886885, 'bb_std_mult': 3.097561872042585, 'rsi_os': 41, 'rsi_ob': 76, 'vol_spike': 0.21788197621603242, 'adx_thresh': 24.480790202850795, 'atr_min_pct': 0.020292657638329173, 'atr_max_pct': 0.04513708531126566, 'tp_mult': 2.806094431604597, 'tsl_mult': 0.49021512739318523, 'strategy': 'mean_reversion', 'time_stop': 137, 'use_sma': False, 'use_atr': False, 'use_adx': False, 'use_ema': False, 'use_spike': True, 'rsi_required': True, 'edge_k': 1.021847080030527, 'edge_cap': 0.2185665233264258, 'bull_strategy': 'breakout', 'bull_bb_std_mult': 2.4054255533741147, 'bull_rsi_os': 38, 'bull_rsi_ob': 55, 'bull_adx_thresh': 10.887330841193075, 'bull_atr_min_pct': 0.02112530849747301, 'bull_atr_max_pct': 0.09054928186612188, 'bull_tp_mult': 2.4869799072348595, 'bull_tsl_mult': 0.1638434424522826, 'bull_time_stop': 5, 'bull_use_sma': True, 'bull_use_ema': True, 'bull_use_atr': True, 'bull_use_adx': False, 'bull_use_spike': True, 'bull_rsi_required': False, 'bear_strategy': 'breakout', 'bear_bb_std_mult': 3.3123412174862636, 'bear_rsi_os': 28, 'bear_rsi_ob': 72, 'bear_adx_thresh': 8.31277063747511, 'bear_atr_min_pct': 0.017914146048670632, 'bear_atr_max_pct': 0.07937604479880904, 'bear_tp_mult': 2.5866805298871722, 'bear_tsl_mult': 0.021195161491805142, 'bear_time_stop': 211, 'bear_use_sma': True, 'bear_use_ema': True, 'bear_use_atr': True, 'bear_use_adx': False, 'bear_use_spike': True, 'bear_rsi_required': False, 'sideways_strategy': 'breakout', 'sideways_bb_std_mult': 2.7669389985840844, 'sideways_rsi_os': 33, 'sideways_rsi_ob': 82, 'sideways_adx_thresh': 14.872587396335431, 'sideways_atr_min_pct': 0.002040338096095664, 'sideways_atr_max_pct': 0.013803584036107064, 'sideways_tp_mult': 1.1684428389473125, 'sideways_tsl_mult': 0.9965835693393612, 'sideways_time_stop': 238, 'sideways_use_sma': True, 'sideways_use_ema': False, 'sideways_use_atr': False, 'sideways_use_adx': True, 'sideways_use_spike': True, 'sideways_rsi_required': False}.
[I 2025-08-31 10:19:44,058] Trial 220 finished with values: [-0.008566223016953867, 0.008341519630130663] and parameters: {'p_sma': 18, 'p_std': 45, 'p_atr': 17, 'p_adx': 9, 'rsi_period': 21, 'ema1': 12, 'ema2': 58, 'slip_atr_k': 0.07175512737140899, 'slip_spread_k': 0.24047752458558053, 'spread_hl_frac': 0.029904219735147973, 'bb_std_mult': 1.9695886691939002, 'rsi_os': 43, 'rsi_ob': 74, 'vol_spike': 0.2056011235410755, 'adx_thresh': 13.48250754674343, 'atr_min_pct': 0.02042535773519045, 'atr_max_pct': 0.04484795991347829, 'tp_mult': 2.809640093796782, 'tsl_mult': 0.07765821479170049, 'strategy': 'mean_reversion', 'time_stop': 136, 'use_sma': False, 'use_atr': False, 'use_adx': True, 'use_ema': False, 'use_spike': True, 'rsi_required': True, 'edge_k': 1.751463758587234, 'edge_cap': 0.21013454755102573, 'bull_strategy': 'breakout', 'bull_bb_std_mult': 1.9180964688280255, 'bull_rsi_os': 38, 'bull_rsi_ob': 76, 'bull_adx_thresh': 11.03650342315568, 'bull_atr_min_pct': 0.002350429487739527, 'bull_atr_max_pct': 0.13644823669713912, 'bull_tp_mult': 1.8327696236727986, 'bull_tsl_mult': 0.41467651010647844, 'bull_time_stop': 146, 'bull_use_sma': True, 'bull_use_ema': True, 'bull_use_atr': True, 'bull_use_adx': False, 'bull_use_spike': False, 'bull_rsi_required': False, 'bear_strategy': 'breakout', 'bear_bb_std_mult': 3.0391239749243093, 'bear_rsi_os': 29, 'bear_rsi_ob': 56, 'bear_adx_thresh': 8.273638504578235, 'bear_atr_min_pct': 0.014816256709090092, 'bear_atr_max_pct': 0.12940776608789867, 'bear_tp_mult': 2.5845148060981655, 'bear_tsl_mult': 0.06865690293414915, 'bear_time_stop': 35, 'bear_use_sma': True, 'bear_use_ema': False, 'bear_use_atr': False, 'bear_use_adx': False, 'bear_use_spike': True, 'bear_rsi_required': False, 'sideways_strategy': 'breakout', 'sideways_bb_std_mult': 2.5916486364532654, 'sideways_rsi_os': 33, 'sideways_rsi_ob': 85, 'sideways_adx_thresh': 29.488642876926384, 'sideways_atr_min_pct': 0.004270410979629104, 'sideways_atr_max_pct': 0.10951213324147235, 'sideways_tp_mult': 2.684921527713216, 'sideways_tsl_mult': 0.8418527849505688, 'sideways_time_stop': 247, 'sideways_use_sma': True, 'sideways_use_ema': False, 'sideways_use_atr': True, 'sideways_use_adx': True, 'sideways_use_spike': True, 'sideways_rsi_required': False}.
[I 2025-08-31 10:19:44,608] Trial 224 finished with values: [-1000000000.0, 1000000000.0] and parameters: {'p_sma': 54, 'p_std': 46, 'p_atr': 24, 'p_adx': 8, 'rsi_period': 25, 'ema1': 13, 'ema2': 60, 'slip_atr_k': 0.0672745047270207, 'slip_spread_k': 0.3889461212779609, 'spread_hl_frac': 0.02754580870550901, 'bb_std_mult': 3.08052874685327, 'rsi_os': 13, 'rsi_ob': 76, 'vol_spike': 0.21753254655887463, 'adx_thresh': 8.61853922460682, 'atr_min_pct': 0.020157827587675856, 'atr_max_pct': 0.01983535871410514, 'tp_mult': 2.745993555359475, 'tsl_mult': 0.9337040036261609, 'strategy': 'mean_reversion', 'time_stop': 148, 'use_sma': False, 'use_atr': True, 'use_adx': True, 'use_ema': True, 'use_spike': True, 'rsi_required': True, 'edge_k': 1.6965120682241137, 'edge_cap': 0.15825203563487011, 'bull_strategy': 'breakout', 'bull_bb_std_mult': 2.4116573493564615, 'bull_rsi_os': 43, 'bull_rsi_ob': 74, 'bull_adx_thresh': 7.692163130826803, 'bull_atr_min_pct': 0.004292219826619855, 'bull_atr_max_pct': 0.10206770554335642, 'bull_tp_mult': 1.8098587305382117, 'bull_tsl_mult': 0.1392246947975906, 'bull_time_stop': 148, 'bull_use_sma': False, 'bull_use_ema': True, 'bull_use_atr': True, 'bull_use_adx': False, 'bull_use_spike': False, 'bull_rsi_required': False, 'bear_strategy': 'breakout', 'bear_bb_std_mult': 1.4035093695456387, 'bear_rsi_os': 30, 'bear_rsi_ob': 66, 'bear_adx_thresh': 6.768930373213494, 'bear_atr_min_pct': 0.016912535992031772, 'bear_atr_max_pct': 0.1297502136063916, 'bear_tp_mult': 2.5940938709368826, 'bear_tsl_mult': 0.08403565762598822, 'bear_time_stop': 32, 'bear_use_sma': True, 'bear_use_ema': False, 'bear_use_atr': False, 'bear_use_adx': False, 'bear_use_spike': True, 'bear_rsi_required': False, 'sideways_strategy': 'breakout', 'sideways_bb_std_mult': 2.6375665643291892, 'sideways_rsi_os': 40, 'sideways_rsi_ob': 85, 'sideways_adx_thresh': 13.142417795383874, 'sideways_atr_min_pct': 0.0038976230787199748, 'sideways_atr_max_pct': 0.11703855383172543, 'sideways_tp_mult': 1.237474686994406, 'sideways_tsl_mult': 0.8373092009856009, 'sideways_time_stop': 263, 'sideways_use_sma': True, 'sideways_use_ema': False, 'sideways_use_atr': False, 'sideways_use_adx': True, 'sideways_use_spike': True, 'sideways_rsi_required': False}.
[I 2025-08-31 10:20:15,559] Trial 225 finished with values: [-1000000000.0, 1000000000.0] and parameters: {'p_sma': 54, 'p_std': 31, 'p_atr': 11, 'p_adx': 8, 'rsi_period': 67, 'ema1': 13, 'ema2': 60, 'slip_atr_k': 0.0670366904900272, 'slip_spread_k': 0.3600059441029098, 'spread_hl_frac': 0.026193683551100768, 'bb_std_mult': 2.6500848500802943, 'rsi_os': 25, 'rsi_ob': 76, 'vol_spike': 0.2171577465219926, 'adx_thresh': 13.822977350658178, 'atr_min_pct': 0.019937740213561303, 'atr_max_pct': 0.026632084861100164, 'tp_mult': 2.8190108360802326, 'tsl_mult': 0.2666418313880854, 'strategy': 'mean_reversion', 'time_stop': 239, 'use_sma': False, 'use_atr': True, 'use_adx': True, 'use_ema': True, 'use_spike': True, 'rsi_required': True, 'edge_k': 1.6705129457954682, 'edge_cap': 0.2113512842135058, 'bull_strategy': 'breakout', 'bull_bb_std_mult': 3.084730054526829, 'bull_rsi_os': 42, 'bull_rsi_ob': 74, 'bull_adx_thresh': 23.14695753842751, 'bull_atr_min_pct': 0.02394528016701663, 'bull_atr_max_pct': 0.14202052710573343, 'bull_tp_mult': 2.298906532742327, 'bull_tsl_mult': 0.1629492077409213, 'bull_time_stop': 5, 'bull_use_sma': False, 'bull_use_ema': True, 'bull_use_atr': True, 'bull_use_adx': False, 'bull_use_spike': False, 'bull_rsi_required': False, 'bear_strategy': 'breakout', 'bear_bb_std_mult': 2.1299380891298734, 'bear_rsi_os': 29, 'bear_rsi_ob': 56, 'bear_adx_thresh': 6.6788539715709225, 'bear_atr_min_pct': 0.01657522493204844, 'bear_atr_max_pct': 0.11999119110974893, 'bear_tp_mult': 2.623927751996804, 'bear_tsl_mult': 0.08420578510205244, 'bear_time_stop': 36, 'bear_use_sma': True, 'bear_use_ema': False, 'bear_use_atr': False, 'bear_use_adx': False, 'bear_use_spike': True, 'bear_rsi_required': False, 'sideways_strategy': 'breakout', 'sideways_bb_std_mult': 2.7465492968020127, 'sideways_rsi_os': 46, 'sideways_rsi_ob': 85, 'sideways_adx_thresh': 13.310049182378341, 'sideways_atr_min_pct': 0.004190202856072724, 'sideways_atr_max_pct': 0.09797657409379697, 'sideways_tp_mult': 1.2548917648122568, 'sideways_tsl_mult': 0.12848392952444976, 'sideways_time_stop': 272, 'sideways_use_sma': True, 'sideways_use_ema': False, 'sideways_use_atr': False, 'sideways_use_adx': True, 'sideways_use_spike': True, 'sideways_rsi_required': False}.
[I 2025-08-31 10:20:15,824] Trial 222 finished with values: [-0.00953931099844918, 0.009309830038868781] and parameters: {'p_sma': 28, 'p_std': 46, 'p_atr': 17, 'p_adx': 7, 'rsi_period': 73, 'ema1': 13, 'ema2': 60, 'slip_atr_k': 0.06631977159328885, 'slip_spread_k': 0.5485089676399317, 'spread_hl_frac': 0.027229249032439663, 'bb_std_mult': 1.2193572779626354, 'rsi_os': 13, 'rsi_ob': 79, 'vol_spike': 0.2062247674541056, 'adx_thresh': 23.4383094171054, 'atr_min_pct': 0.0198927351212504, 'atr_max_pct': 0.0475654698238219, 'tp_mult': 2.745961249247267, 'tsl_mult': 0.2233599990585921, 'strategy': 'mean_reversion', 'time_stop': 234, 'use_sma': False, 'use_atr': True, 'use_adx': True, 'use_ema': True, 'use_spike': True, 'rsi_required': True, 'edge_k': 0.8168880198622245, 'edge_cap': 0.13088456469332696, 'bull_strategy': 'breakout', 'bull_bb_std_mult': 1.0190967268492854, 'bull_rsi_os': 38, 'bull_rsi_ob': 74, 'bull_adx_thresh': 23.201040390558102, 'bull_atr_min_pct': 0.002516152854699915, 'bull_atr_max_pct': 0.14918140454191076, 'bull_tp_mult': 2.4804380735360603, 'bull_tsl_mult': 0.12803442628924405, 'bull_time_stop': 113, 'bull_use_sma': False, 'bull_use_ema': True, 'bull_use_atr': False, 'bull_use_adx': True, 'bull_use_spike': True, 'bull_rsi_required': False, 'bear_strategy': 'mean_reversion', 'bear_bb_std_mult': 2.1192280989560643, 'bear_rsi_os': 30, 'bear_rsi_ob': 59, 'bear_adx_thresh': 6.816386038924456, 'bear_atr_min_pct': 0.01521314936858623, 'bear_atr_max_pct': 0.08312843326784604, 'bear_tp_mult': 2.59310184878522, 'bear_tsl_mult': 0.06638421114160098, 'bear_time_stop': 198, 'bear_use_sma': False, 'bear_use_ema': False, 'bear_use_atr': True, 'bear_use_adx': False, 'bear_use_spike': True, 'bear_rsi_required': True, 'sideways_strategy': 'breakout', 'sideways_bb_std_mult': 2.1605235030886067, 'sideways_rsi_os': 46, 'sideways_rsi_ob': 85, 'sideways_adx_thresh': 22.9683011619025, 'sideways_atr_min_pct': 0.004009511837631231, 'sideways_atr_max_pct': 0.09624691833646577, 'sideways_tp_mult': 2.9419034953314243, 'sideways_tsl_mult': 0.3841199138075301, 'sideways_time_stop': 262, 'sideways_use_sma': True, 'sideways_use_ema': False, 'sideways_use_atr': True, 'sideways_use_adx': False, 'sideways_use_spike': True, 'sideways_rsi_required': False}.
