[I 2025-08-31 11:04:25,718] Trial 585 finished with values: [-1000000000.0, 1000000000.0] and parameters: {'p_sma': 32, 'p_std': 16, 'p_atr': 25, 'p_adx': 22, 'rsi_period': 34, 'ema1': 5, 'ema2': 15, 'slip_atr_k': 0.0219859290499081, 'slip_spread_k': 0.5272200019061801, 'spread_hl_frac': 0.021542301155325367, 'bb_std_mult': 0.7170314763852211, 'rsi_os': 26, 'rsi_ob': 80, 'vol_spike': 0.10051284687747282, 'adx_thresh': 11.376239102523298, 'atr_min_pct': 0.022460909788841858, 'atr_max_pct': 0.053522221592015265, 'tp_mult': 2.96023942231938, 'tsl_mult': 0.0475562933699647, 'strategy': 'breakout', 'time_stop': 78, 'use_sma': True, 'use_atr': True, 'use_adx': False, 'use_ema': True, 'use_spike': False, 'rsi_required': False, 'edge_k': 1.5479154138039213, 'edge_cap': 0.69936795164078, 'bull_strategy': 'mean_reversion', 'bull_bb_std_mult': 1.992120477911965, 'bull_rsi_os': 40, 'bull_rsi_ob': 58, 'bull_adx_thresh': 27.928779899745408, 'bull_atr_min_pct': 0.009956979613826222, 'bull_atr_max_pct': 0.03396363366132913, 'bull_tp_mult': 2.965845820267488, 'bull_tsl_mult': 0.2926042389009895, 'bull_time_stop': 44, 'bull_use_sma': False, 'bull_use_ema': True, 'bull_use_atr': False, 'bull_use_adx': True, 'bull_use_spike': False, 'bull_rsi_required': False, 'bear_strategy': 'mean_reversion', 'bear_bb_std_mult': 1.6590095817874027, 'bear_rsi_os': 46, 'bear_rsi_ob': 56, 'bear_adx_thresh': 11.651111404907049, 'bear_atr_min_pct': 0.010984205395208207, 'bear_atr_max_pct': 0.13169703401312877, 'bear_tp_mult': 2.6369215683342944, 'bear_tsl_mult': 0.8511721664143972, 'bear_time_stop': 103, 'bear_use_sma': False, 'bear_use_ema': False, 'bear_use_atr': True, 'bear_use_adx': False, 'bear_use_spike': True, 'bear_rsi_required': False, 'sideways_strategy': 'mean_reversion', 'sideways_bb_std_mult': 1.2090793814708243, 'sideways_rsi_os': 42, 'sideways_rsi_ob': 61, 'sideways_adx_thresh': 26.402142692242194, 'sideways_atr_min_pct': 0.003742574359943743, 'sideways_atr_max_pct': 0.0960520157994856, 'sideways_tp_mult': 1.623733069247716, 'sideways_tsl_mult': 0.8319493437988478, 'sideways_time_stop': 172, 'sideways_use_sma': True, 'sideways_use_ema': True, 'sideways_use_atr': False, 'sideways_use_adx': False, 'sideways_use_spike': True, 'sideways_rsi_required': False}.
[I 2025-08-31 11:04:25,873] Trial 588 finished with values: [-1000000000.0, 1000000000.0] and parameters: {'p_sma': 32, 'p_std': 16, 'p_atr': 25, 'p_adx': 23, 'rsi_period': 32, 'ema1': 5, 'ema2': 15, 'slip_atr_k': 0.023716489089791105, 'slip_spread_k': 0.4954133357005176, 'spread_hl_frac': 0.022014270919751836, 'bb_std_mult': 0.7752737201605099, 'rsi_os': 26, 'rsi_ob': 79, 'vol_spike': 0.09794802109618281, 'adx_thresh': 11.36363867528662, 'atr_min_pct': 0.022242611718282915, 'atr_max_pct': 0.0519132548749722, 'tp_mult': 2.944423312846576, 'tsl_mult': 0.031019708210952658, 'strategy': 'breakout', 'time_stop': 74, 'use_sma': True, 'use_atr': True, 'use_adx': False, 'use_ema': True, 'use_spike': False, 'rsi_required': False, 'edge_k': 1.4697998347311632, 'edge_cap': 0.6848518757636812, 'bull_strategy': 'mean_reversion', 'bull_bb_std_mult': 1.8802697960508514, 'bull_rsi_os': 41, 'bull_rsi_ob': 61, 'bull_adx_thresh': 27.742939733846885, 'bull_atr_min_pct': 0.011969378939140128, 'bull_atr_max_pct': 0.03307933517863962, 'bull_tp_mult': 2.929092668147954, 'bull_tsl_mult': 0.2789824688807069, 'bull_time_stop': 36, 'bull_use_sma': False, 'bull_use_ema': True, 'bull_use_atr': False, 'bull_use_adx': True, 'bull_use_spike': False, 'bull_rsi_required': False, 'bear_strategy': 'mean_reversion', 'bear_bb_std_mult': 1.7531751321784168, 'bear_rsi_os': 46, 'bear_rsi_ob': 56, 'bear_adx_thresh': 12.066808371147179, 'bear_atr_min_pct': 0.011348845539302023, 'bear_atr_max_pct': 0.132652896243054, 'bear_tp_mult': 2.719546629730363, 'bear_tsl_mult': 0.846726892486928, 'bear_time_stop': 97, 'bear_use_sma': False, 'bear_use_ema': False, 'bear_use_atr': True, 'bear_use_adx': False, 'bear_use_spike': True, 'bear_rsi_required': False, 'sideways_strategy': 'mean_reversion', 'sideways_bb_std_mult': 1.1656288735363616, 'sideways_rsi_os': 39, 'sideways_rsi_ob': 61, 'sideways_adx_thresh': 25.983317437691788, 'sideways_atr_min_pct': 0.004276013496362264, 'sideways_atr_max_pct': 0.1034168526970354, 'sideways_tp_mult': 1.6254297579305517, 'sideways_tsl_mult': 0.8562403821283031, 'sideways_time_stop': 151, 'sideways_use_sma': True, 'sideways_use_ema': True, 'sideways_use_atr': False, 'sideways_use_adx': False, 'sideways_use_spike': True, 'sideways_rsi_required': False}.
[I 2025-08-31 11:04:25,873] Trial 586 finished with values: [0.005721245252664042, 0.0025195672743694056] and parameters: {'p_sma': 34, 'p_std': 16, 'p_atr': 25, 'p_adx': 22, 'rsi_period': 34, 'ema1': 5, 'ema2': 15, 'slip_atr_k': 0.025896003297134387, 'slip_spread_k': 0.48991586047274477, 'spread_hl_frac': 0.021223867153362132, 'bb_std_mult': 0.7537818678660336, 'rsi_os': 30, 'rsi_ob': 80, 'vol_spike': 0.09216059565460129, 'adx_thresh': 11.437432916002322, 'atr_min_pct': 0.02235163004160857, 'atr_max_pct': 0.05236095318615104, 'tp_mult': 2.961932578055451, 'tsl_mult': 0.04831251645478846, 'strategy': 'breakout', 'time_stop': 79, 'use_sma': True, 'use_atr': True, 'use_adx': False, 'use_ema': True, 'use_spike': False, 'rsi_required': False, 'edge_k': 1.4660809384286477, 'edge_cap': 0.7034306424667325, 'bull_strategy': 'mean_reversion', 'bull_bb_std_mult': 1.9538484904763613, 'bull_rsi_os': 41, 'bull_rsi_ob': 61, 'bull_adx_thresh': 27.834106799460436, 'bull_atr_min_pct': 0.011957443611378493, 'bull_atr_max_pct': 0.03375276892510117, 'bull_tp_mult': 2.938232747849814, 'bull_tsl_mult': 0.22682768029378703, 'bull_time_stop': 34, 'bull_use_sma': False, 'bull_use_ema': True, 'bull_use_atr': False, 'bull_use_adx': True, 'bull_use_spike': False, 'bull_rsi_required': False, 'bear_strategy': 'mean_reversion', 'bear_bb_std_mult': 1.6307894225401087, 'bear_rsi_os': 49, 'bear_rsi_ob': 56, 'bear_adx_thresh': 11.91434324433028, 'bear_atr_min_pct': 0.005222771384190925, 'bear_atr_max_pct': 0.1315201340210883, 'bear_tp_mult': 2.6445568335882657, 'bear_tsl_mult': 0.8563647682863674, 'bear_time_stop': 102, 'bear_use_sma': False, 'bear_use_ema': False, 'bear_use_atr': True, 'bear_use_adx': False, 'bear_use_spike': True, 'bear_rsi_required': False, 'sideways_strategy': 'mean_reversion', 'sideways_bb_std_mult': 1.1625220784150196, 'sideways_rsi_os': 39, 'sideways_rsi_ob': 61, 'sideways_adx_thresh': 26.551158429935526, 'sideways_atr_min_pct': 0.003728814495901912, 'sideways_atr_max_pct': 0.10193077116298006, 'sideways_tp_mult': 1.6163969480701732, 'sideways_tsl_mult': 0.8293164847942301, 'sideways_time_stop': 175, 'sideways_use_sma': True, 'sideways_use_ema': True, 'sideways_use_atr': False, 'sideways_use_adx': False, 'sideways_use_spike': True, 'sideways_rsi_required': False}.
[I 2025-08-31 11:04:25,951] Trial 587 finished with values: [-0.05438880034331428, 0.054050364279699135] and parameters: {'p_sma': 36, 'p_std': 19, 'p_atr': 25, 'p_adx': 22, 'rsi_period': 33, 'ema1': 5, 'ema2': 15, 'slip_atr_k': 0.02414644160124316, 'slip_spread_k': 0.5288175078306467, 'spread_hl_frac': 0.021900467731492356, 'bb_std_mult': 0.7579625986986704, 'rsi_os': 26, 'rsi_ob': 80, 'vol_spike': 0.10392321585961696, 'adx_thresh': 11.189751553248017, 'atr_min_pct': 0.02219254831745951, 'atr_max_pct': 0.05269690847656835, 'tp_mult': 2.9633082376777566, 'tsl_mult': 0.026613523276747597, 'strategy': 'breakout', 'time_stop': 75, 'use_sma': True, 'use_atr': True, 'use_adx': False, 'use_ema': True, 'use_spike': False, 'rsi_required': False, 'edge_k': 1.4743538867327564, 'edge_cap': 0.7081270272159876, 'bull_strategy': 'mean_reversion', 'bull_bb_std_mult': 1.7197321886875823, 'bull_rsi_os': 41, 'bull_rsi_ob': 59, 'bull_adx_thresh': 27.63374026759946, 'bull_atr_min_pct': 0.012057559768075791, 'bull_atr_max_pct': 0.032925354226166235, 'bull_tp_mult': 2.9395500072595344, 'bull_tsl_mult': 0.2957646057319089, 'bull_time_stop': 33, 'bull_use_sma': False, 'bull_use_ema': True, 'bull_use_atr': False, 'bull_use_adx': True, 'bull_use_spike': False, 'bull_rsi_required': False, 'bear_strategy': 'mean_reversion', 'bear_bb_std_mult': 1.6207494011334544, 'bear_rsi_os': 49, 'bear_rsi_ob': 56, 'bear_adx_thresh': 11.691058784440962, 'bear_atr_min_pct': 0.0025841552041510527, 'bear_atr_max_pct': 0.1284150704172284, 'bear_tp_mult': 2.7152287033958675, 'bear_tsl_mult': 0.8259879127857329, 'bear_time_stop': 95, 'bear_use_sma': False, 'bear_use_ema': False, 'bear_use_atr': True, 'bear_use_adx': False, 'bear_use_spike': True, 'bear_rsi_required': False, 'sideways_strategy': 'mean_reversion', 'sideways_bb_std_mult': 1.154221661629165, 'sideways_rsi_os': 39, 'sideways_rsi_ob': 61, 'sideways_adx_thresh': 26.901862887148088, 'sideways_atr_min_pct': 0.0038996320496652213, 'sideways_atr_max_pct': 0.10121667181031593, 'sideways_tp_mult': 1.6288387779652849, 'sideways_tsl_mult': 0.8530282264090217, 'sideways_time_stop': 152, 'sideways_use_sma': True, 'sideways_use_ema': True, 'sideways_use_atr': False, 'sideways_use_adx': False, 'sideways_use_spike': True, 'sideways_rsi_required': False}.
[I 2025-08-31 11:04:58,727] Trial 589 finished with values: [-1000000000.0, 1000000000.0] and parameters: {'p_sma': 36, 'p_std': 19, 'p_atr': 25, 'p_adx': 23, 'rsi_period': 32, 'ema1': 5, 'ema2': 17, 'slip_atr_k': 0.024073496442306115, 'slip_spread_k': 0.48314133862313796, 'spread_hl_frac': 0.020060226984978644, 'bb_std_mult': 0.7702051493250007, 'rsi_os': 26, 'rsi_ob': 79, 'vol_spike': 0.10632641939398658, 'adx_thresh': 12.262959738909355, 'atr_min_pct': 0.02382557355545017, 'atr_max_pct': 0.0513192231205884, 'tp_mult': 2.956211937431619, 'tsl_mult': 0.02626149092647906, 'strategy': 'breakout', 'time_stop': 75, 'use_sma': True, 'use_atr': True, 'use_adx': False, 'use_ema': True, 'use_spike': False, 'rsi_required': False, 'edge_k': 1.4652406631039323, 'edge_cap': 0.664695992952393, 'bull_strategy': 'mean_reversion', 'bull_bb_std_mult': 1.899204279766303, 'bull_rsi_os': 41, 'bull_rsi_ob': 61, 'bull_adx_thresh': 27.60490813713654, 'bull_atr_min_pct': 0.012077708810938156, 'bull_atr_max_pct': 0.02930023397029031, 'bull_tp_mult': 2.933634578787495, 'bull_tsl_mult': 0.22688363286012359, 'bull_time_stop': 34, 'bull_use_sma': False, 'bull_use_ema': True, 'bull_use_atr': False, 'bull_use_adx': True, 'bull_use_spike': False, 'bull_rsi_required': False, 'bear_strategy': 'mean_reversion', 'bear_bb_std_mult': 1.6124023315870992, 'bear_rsi_os': 49, 'bear_rsi_ob': 55, 'bear_adx_thresh': 12.162859965719493, 'bear_atr_min_pct': 0.007135289563824568, 'bear_atr_max_pct': 0.1327748262690448, 'bear_tp_mult': 2.646824894775717, 'bear_tsl_mult': 0.8104513539668674, 'bear_time_stop': 98, 'bear_use_sma': False, 'bear_use_ema': False, 'bear_use_atr': True, 'bear_use_adx': False, 'bear_use_spike': True, 'bear_rsi_required': False, 'sideways_strategy': 'mean_reversion', 'sideways_bb_std_mult': 1.1661919836346215, 'sideways_rsi_os': 39, 'sideways_rsi_ob': 58, 'sideways_adx_thresh': 26.196793048687645, 'sideways_atr_min_pct': 0.004631877939472773, 'sideways_atr_max_pct': 0.10225925413749376, 'sideways_tp_mult': 1.5847867739941777, 'sideways_tsl_mult': 0.8548818692911945, 'sideways_time_stop': 149, 'sideways_use_sma': True, 'sideways_use_ema': True, 'sideways_use_atr': False, 'sideways_use_adx': False, 'sideways_use_spike': True, 'sideways_rsi_required': False}.
[I 2025-08-31 11:04:59,003] Trial 592 finished with values: [-0.001029425353603064, 0.006822266467368798] and parameters: {'p_sma': 37, 'p_std': 14, 'p_atr': 24, 'p_adx': 22, 'rsi_period': 35, 'ema1': 6, 'ema2': 14, 'slip_atr_k': 0.03096154406918693, 'slip_spread_k': 0.444639658169636, 'spread_hl_frac': 0.018364529811592804, 'bb_std_mult': 0.5746910242533172, 'rsi_os': 30, 'rsi_ob': 79, 'vol_spike': 0.0816432380301644, 'adx_thresh': 11.99632900368851, 'atr_min_pct': 0.023845229601023865, 'atr_max_pct': 0.04946058768857992, 'tp_mult': 2.943568062017927, 'tsl_mult': 0.01828845403366877, 'strategy': 'breakout', 'time_stop': 84, 'use_sma': True, 'use_atr': True, 'use_adx': False, 'use_ema': True, 'use_spike': False, 'rsi_required': False, 'edge_k': 1.5697154378838873, 'edge_cap': 0.6649894789507419, 'bull_strategy': 'mean_reversion', 'bull_bb_std_mult': 2.027826151237537, 'bull_rsi_os': 42, 'bull_rsi_ob': 63, 'bull_adx_thresh': 30.60568230027218, 'bull_atr_min_pct': 0.011882784717798805, 'bull_atr_max_pct': 0.03730539150690476, 'bull_tp_mult': 2.903245947382728, 'bull_tsl_mult': 0.2217207807872848, 'bull_time_stop': 30, 'bull_use_sma': False, 'bull_use_ema': True, 'bull_use_atr': False, 'bull_use_adx': True, 'bull_use_spike': False, 'bull_rsi_required': False, 'bear_strategy': 'mean_reversion', 'bear_bb_std_mult': 1.7636953381016987, 'bear_rsi_os': 50, 'bear_rsi_ob': 55, 'bear_adx_thresh': 11.787788179155978, 'bear_atr_min_pct': 0.004941526304642016, 'bear_atr_max_pct': 0.13355931540067714, 'bear_tp_mult': 2.6305188565837794, 'bear_tsl_mult': 0.8121630854464917, 'bear_time_stop': 111, 'bear_use_sma': False, 'bear_use_ema': False, 'bear_use_atr': True, 'bear_use_adx': False, 'bear_use_spike': True, 'bear_rsi_required': False, 'sideways_strategy': 'mean_reversion', 'sideways_bb_std_mult': 1.098192525422666, 'sideways_rsi_os': 40, 'sideways_rsi_ob': 61, 'sideways_adx_thresh': 28.066439019373014, 'sideways_atr_min_pct': 0.004806367993948025, 'sideways_atr_max_pct': 0.09689973832087773, 'sideways_tp_mult': 1.6126197525774126, 'sideways_tsl_mult': 0.8645177159447719, 'sideways_time_stop': 180, 'sideways_use_sma': True, 'sideways_use_ema': True, 'sideways_use_atr': False, 'sideways_use_adx': False, 'sideways_use_spike': True, 'sideways_rsi_required': False}.
[I 2025-08-31 11:04:59,191] Trial 591 finished with values: [-0.004153295328607642, 0.006288232289757155] and parameters: {'p_sma': 36, 'p_std': 15, 'p_atr': 26, 'p_adx': 23, 'rsi_period': 35, 'ema1': 5, 'ema2': 13, 'slip_atr_k': 0.023266719111291898, 'slip_spread_k': 0.48150954478774327, 'spread_hl_frac': 0.021983396976123223, 'bb_std_mult': 0.9867721675249785, 'rsi_os': 30, 'rsi_ob': 79, 'vol_spike': 0.07963778912948133, 'adx_thresh': 11.361203196626963, 'atr_min_pct': 0.023728256760378354, 'atr_max_pct': 0.05098231545989532, 'tp_mult': 2.9467579530879466, 'tsl_mult': 0.022023641933257915, 'strategy': 'breakout', 'time_stop': 54, 'use_sma': True, 'use_atr': True, 'use_adx': False, 'use_ema': True, 'use_spike': False, 'rsi_required': False, 'edge_k': 1.5412830799689958, 'edge_cap': 0.6891189174124001, 'bull_strategy': 'mean_reversion', 'bull_bb_std_mult': 2.0579721971518032, 'bull_rsi_os': 42, 'bull_rsi_ob': 63, 'bull_adx_thresh': 30.81586673709165, 'bull_atr_min_pct': 0.011891319027686361, 'bull_atr_max_pct': 0.03592394865783938, 'bull_tp_mult': 2.902419925906893, 'bull_tsl_mult': 0.2243874138170686, 'bull_time_stop': 32, 'bull_use_sma': False, 'bull_use_ema': True, 'bull_use_atr': False, 'bull_use_adx': True, 'bull_use_spike': False, 'bull_rsi_required': False, 'bear_strategy': 'mean_reversion', 'bear_bb_std_mult': 1.7881702996631788, 'bear_rsi_os': 49, 'bear_rsi_ob': 55, 'bear_adx_thresh': 11.70725633660005, 'bear_atr_min_pct': 0.00501089760237155, 'bear_atr_max_pct': 0.1337391266361336, 'bear_tp_mult': 2.6133993553223496, 'bear_tsl_mult': 0.8068291901632589, 'bear_time_stop': 108, 'bear_use_sma': False, 'bear_use_ema': False, 'bear_use_atr': True, 'bear_use_adx': False, 'bear_use_spike': True, 'bear_rsi_required': False, 'sideways_strategy': 'mean_reversion', 'sideways_bb_std_mult': 1.1165957157831254, 'sideways_rsi_os': 39, 'sideways_rsi_ob': 62, 'sideways_adx_thresh': 28.084136396764865, 'sideways_atr_min_pct': 0.0048092883445682464, 'sideways_atr_max_pct': 0.0951642252258714, 'sideways_tp_mult': 1.543597122949208, 'sideways_tsl_mult': 0.8669798175744576, 'sideways_time_stop': 178, 'sideways_use_sma': True, 'sideways_use_ema': True, 'sideways_use_atr': False, 'sideways_use_adx': False, 'sideways_use_spike': True, 'sideways_rsi_required': False}.
[I 2025-08-31 11:04:59,262] Trial 590 finished with values: [-0.0029565370122127677, 0.005885877109995893] and parameters: {'p_sma': 37, 'p_std': 15, 'p_atr': 26, 'p_adx': 23, 'rsi_period': 35, 'ema1': 5, 'ema2': 14, 'slip_atr_k': 0.019640278333225816, 'slip_spread_k': 0.504142592417727, 'spread_hl_frac': 0.018602021255272622, 'bb_std_mult': 0.8578682947742894, 'rsi_os': 30, 'rsi_ob': 81, 'vol_spike': 0.08058022104437662, 'adx_thresh': 10.885142432308463, 'atr_min_pct': 0.02365564260307853, 'atr_max_pct': 0.050828579082839304, 'tp_mult': 2.9499588686927924, 'tsl_mult': 0.017095152119067564, 'strategy': 'breakout', 'time_stop': 106, 'use_sma': True, 'use_atr': True, 'use_adx': False, 'use_ema': True, 'use_spike': False, 'rsi_required': False, 'edge_k': 1.565692783624037, 'edge_cap': 0.6645675301073605, 'bull_strategy': 'mean_reversion', 'bull_bb_std_mult': 1.9054469332200765, 'bull_rsi_os': 42, 'bull_rsi_ob': 59, 'bull_adx_thresh': 30.825794043818195, 'bull_atr_min_pct': 0.012952205833689476, 'bull_atr_max_pct': 0.03631547505565455, 'bull_tp_mult': 2.9063118250351754, 'bull_tsl_mult': 0.22552720743990973, 'bull_time_stop': 32, 'bull_use_sma': False, 'bull_use_ema': True, 'bull_use_atr': False, 'bull_use_adx': True, 'bull_use_spike': False, 'bull_rsi_required': False, 'bear_strategy': 'mean_reversion', 'bear_bb_std_mult': 1.799959463077736, 'bear_rsi_os': 49, 'bear_rsi_ob': 55, 'bear_adx_thresh': 11.679618671382684, 'bear_atr_min_pct': 0.004856065515230469, 'bear_atr_max_pct': 0.13322114209821448, 'bear_tp_mult': 2.6355725737774223, 'bear_tsl_mult': 0.814378871211428, 'bear_time_stop': 115, 'bear_use_sma': False, 'bear_use_ema': False, 'bear_use_atr': True, 'bear_use_adx': False, 'bear_use_spike': True, 'bear_rsi_required': False, 'sideways_strategy': 'mean_reversion', 'sideways_bb_std_mult': 1.0992022681857319, 'sideways_rsi_os': 39, 'sideways_rsi_ob': 62, 'sideways_adx_thresh': 27.790706612661143, 'sideways_atr_min_pct': 0.004761720792867047, 'sideways_atr_max_pct': 0.1004610770056826, 'sideways_tp_mult': 1.5559215094425716, 'sideways_tsl_mult': 0.8633994667085145, 'sideways_time_stop': 182, 'sideways_use_sma': True, 'sideways_use_ema': True, 'sideways_use_atr': False, 'sideways_use_adx': False, 'sideways_use_spike': True, 'sideways_rsi_required': False}.
[I 2025-08-31 11:05:31,159] Trial 595 finished with values: [0.002080203672119474, 0.005841350128140296] and parameters: {'p_sma': 35, 'p_std': 14, 'p_atr': 28, 'p_adx': 23, 'rsi_period': 35, 'ema1': 6, 'ema2': 14, 'slip_atr_k': 0.03198922608205711, 'slip_spread_k': 0.44017754940805304, 'spread_hl_frac': 0.02067291481533987, 'bb_std_mult': 0.6566618144662058, 'rsi_os': 28, 'rsi_ob': 82, 'vol_spike': 0.0923017642957792, 'adx_thresh': 11.065464197916057, 'atr_min_pct': 0.02215511525415003, 'atr_max_pct': 0.04975637776727144, 'tp_mult': 2.9349640481532404, 'tsl_mult': 0.07617857322654589, 'strategy': 'breakout', 'time_stop': 83, 'use_sma': True, 'use_atr': True, 'use_adx': False, 'use_ema': True, 'use_spike': False, 'rsi_required': False, 'edge_k': 1.5732724861515166, 'edge_cap': 0.6811813171694772, 'bull_strategy': 'mean_reversion', 'bull_bb_std_mult': 1.9886855209922696, 'bull_rsi_os': 42, 'bull_rsi_ob': 62, 'bull_adx_thresh': 30.7201961885274, 'bull_atr_min_pct': 0.009187952909116646, 'bull_atr_max_pct': 0.03522803229746931, 'bull_tp_mult': 2.9023541987396486, 'bull_tsl_mult': 0.21178039779774993, 'bull_time_stop': 33, 'bull_use_sma': False, 'bull_use_ema': True, 'bull_use_atr': False, 'bull_use_adx': True, 'bull_use_spike': False, 'bull_rsi_required': False, 'bear_strategy': 'mean_reversion', 'bear_bb_std_mult': 1.7771472613811603, 'bear_rsi_os': 51, 'bear_rsi_ob': 54, 'bear_adx_thresh': 10.404079097747365, 'bear_atr_min_pct': 0.005014419027701512, 'bear_atr_max_pct': 0.133861567022766, 'bear_tp_mult': 2.6420299944746763, 'bear_tsl_mult': 0.8570711244154889, 'bear_time_stop': 108, 'bear_use_sma': False, 'bear_use_ema': False, 'bear_use_atr': True, 'bear_use_adx': False, 'bear_use_spike': True, 'bear_rsi_required': False, 'sideways_strategy': 'mean_reversion', 'sideways_bb_std_mult': 1.3144016744358766, 'sideways_rsi_os': 39, 'sideways_rsi_ob': 62, 'sideways_adx_thresh': 27.14626350804872, 'sideways_atr_min_pct': 0.00444464601922519, 'sideways_atr_max_pct': 0.0990930135298766, 'sideways_tp_mult': 1.5621654802715634, 'sideways_tsl_mult': 0.8645343232996399, 'sideways_time_stop': 180, 'sideways_use_sma': True, 'sideways_use_ema': True, 'sideways_use_atr': False, 'sideways_use_adx': False, 'sideways_use_spike': True, 'sideways_rsi_required': False}.
