[I 2025-08-31 10:06:15,333] Trial 117 finished with values: [-0.08393881540733983, 0.08385736500492035] and parameters: {'p_sma': 29, 'p_std': 15, 'p_atr': 30, 'p_adx': 27, 'rsi_period': 59, 'ema1': 25, 'ema2': 10, 'slip_atr_k': 0.19666871597720295, 'slip_spread_k': 0.7277278831192874, 'spread_hl_frac': 0.03309060420163474, 'bb_std_mult': 3.219824051172598, 'rsi_os': 34, 'rsi_ob': 79, 'vol_spike': 0.1703397608596936, 'adx_thresh': 8.527526349119753, 'atr_min_pct': 0.012081380501713635, 'atr_max_pct': 0.11644548861558465, 'tp_mult': 1.6938107202305155, 'tsl_mult': 0.7201148260801108, 'strategy': 'mean_reversion', 'time_stop': 150, 'use_sma': True, 'use_atr': False, 'use_adx': True, 'use_ema': False, 'use_spike': False, 'rsi_required': False, 'edge_k': 1.5483055112173514, 'edge_cap': 0.9670617605935856, 'bull_strategy': 'mean_reversion', 'bull_bb_std_mult': 3.249375731944632, 'bull_rsi_os': 32, 'bull_rsi_ob': 95, 'bull_adx_thresh': 5.975999459441953, 'bull_atr_min_pct': 6.7138429764000435e-06, 'bull_atr_max_pct': 0.09205693811676148, 'bull_tp_mult': 1.077415600737062, 'bull_tsl_mult': 0.8907973014193955, 'bull_time_stop': 42, 'bull_use_sma': True, 'bull_use_ema': False, 'bull_use_atr': True, 'bull_use_adx': False, 'bull_use_spike': True, 'bull_rsi_required': True, 'bear_strategy': 'breakout', 'bear_bb_std_mult': 0.8996114148520902, 'bear_rsi_os': 52, 'bear_rsi_ob': 88, 'bear_adx_thresh': 22.010598979754334, 'bear_atr_min_pct': 0.011113431986573268, 'bear_atr_max_pct': 0.05760980948770401, 'bear_tp_mult': 2.8170166567260897, 'bear_tsl_mult': 0.6303528806256692, 'bear_time_stop': 175, 'bear_use_sma': False, 'bear_use_ema': False, 'bear_use_atr': True, 'bear_use_adx': False, 'bear_use_spike': False, 'bear_rsi_required': False, 'sideways_strategy': 'mean_reversion', 'sideways_bb_std_mult': 0.8272721089963256, 'sideways_rsi_os': 16, 'sideways_rsi_ob': 54, 'sideways_adx_thresh': 12.120090421638722, 'sideways_atr_min_pct': 0.017213152281791547, 'sideways_atr_max_pct': 0.02962245735003205, 'sideways_tp_mult': 2.307384305200402, 'sideways_tsl_mult': 0.4220704205976603, 'sideways_time_stop': 155, 'sideways_use_sma': False, 'sideways_use_ema': True, 'sideways_use_atr': False, 'sideways_use_adx': False, 'sideways_use_spike': False, 'sideways_rsi_required': True}.
[I 2025-08-31 10:06:15,712] Trial 120 finished with values: [-1000000000.0, 1000000000.0] and parameters: {'p_sma': 9, 'p_std': 24, 'p_atr': 28, 'p_adx': 27, 'rsi_period': 58, 'ema1': 23, 'ema2': 11, 'slip_atr_k': 0.20117721381719308, 'slip_spread_k': 0.7998468119181851, 'spread_hl_frac': 0.038688941073637566, 'bb_std_mult': 3.3388518485514864, 'rsi_os': 17, 'rsi_ob': 60, 'vol_spike': 0.19091860991732945, 'adx_thresh': 16.992997236556427, 'atr_min_pct': 0.02027223154872431, 'atr_max_pct': 0.010266029088945694, 'tp_mult': 2.2420151444539442, 'tsl_mult': 0.23315210692168103, 'strategy': 'breakout', 'time_stop': 266, 'use_sma': True, 'use_atr': False, 'use_adx': True, 'use_ema': False, 'use_spike': False, 'rsi_required': False, 'edge_k': 1.270295203940511, 'edge_cap': 0.8946558045224404, 'bull_strategy': 'breakout', 'bull_bb_std_mult': 0.9172571904168173, 'bull_rsi_os': 36, 'bull_rsi_ob': 71, 'bull_adx_thresh': 24.26386937189078, 'bull_atr_min_pct': 0.02160848248635313, 'bull_atr_max_pct': 0.08186568100526988, 'bull_tp_mult': 1.1264767638244373, 'bull_tsl_mult': 0.7425221126900048, 'bull_time_stop': 59, 'bull_use_sma': True, 'bull_use_ema': False, 'bull_use_atr': True, 'bull_use_adx': True, 'bull_use_spike': True, 'bull_rsi_required': True, 'bear_strategy': 'breakout', 'bear_bb_std_mult': 1.820532780925714, 'bear_rsi_os': 52, 'bear_rsi_ob': 91, 'bear_adx_thresh': 17.543242824528527, 'bear_atr_min_pct': 0.029447808943861953, 'bear_atr_max_pct': 0.056677085456605214, 'bear_tp_mult': 2.8194627345231713, 'bear_tsl_mult': 0.6299388995191626, 'bear_time_stop': 131, 'bear_use_sma': False, 'bear_use_ema': False, 'bear_use_atr': True, 'bear_use_adx': False, 'bear_use_spike': False, 'bear_rsi_required': True, 'sideways_strategy': 'mean_reversion', 'sideways_bb_std_mult': 2.040537173034741, 'sideways_rsi_os': 16, 'sideways_rsi_ob': 58, 'sideways_adx_thresh': 14.053345222575325, 'sideways_atr_min_pct': 0.01188404999556894, 'sideways_atr_max_pct': 0.024566012593505847, 'sideways_tp_mult': 2.307743310766784, 'sideways_tsl_mult': 0.45410458510213747, 'sideways_time_stop': 266, 'sideways_use_sma': True, 'sideways_use_ema': False, 'sideways_use_atr': False, 'sideways_use_adx': False, 'sideways_use_spike': False, 'sideways_rsi_required': True}.
[I 2025-08-31 10:06:45,048] Trial 121 finished with values: [-1000000000.0, 1000000000.0] and parameters: {'p_sma': 9, 'p_std': 17, 'p_atr': 23, 'p_adx': 28, 'rsi_period': 55, 'ema1': 23, 'ema2': 11, 'slip_atr_k': 0.1674507236589139, 'slip_spread_k': 0.7975765119868116, 'spread_hl_frac': 0.03762734279150551, 'bb_std_mult': 3.0607040160207792, 'rsi_os': 17, 'rsi_ob': 95, 'vol_spike': 0.12558284786023488, 'adx_thresh': 21.17811875527213, 'atr_min_pct': 0.011048958736045172, 'atr_max_pct': 0.011153683630067857, 'tp_mult': 1.617416257350548, 'tsl_mult': 0.6740045030382328, 'strategy': 'breakout', 'time_stop': 266, 'use_sma': True, 'use_atr': True, 'use_adx': True, 'use_ema': True, 'use_spike': False, 'rsi_required': False, 'edge_k': 1.3985341445753932, 'edge_cap': 0.11619887203629148, 'bull_strategy': 'breakout', 'bull_bb_std_mult': 1.7557124728977949, 'bull_rsi_os': 55, 'bull_rsi_ob': 92, 'bull_adx_thresh': 14.837068889751485, 'bull_atr_min_pct': 0.0034433243102259276, 'bull_atr_max_pct': 0.06275368948270837, 'bull_tp_mult': 1.1477478604991442, 'bull_tsl_mult': 0.675596941881098, 'bull_time_stop': 59, 'bull_use_sma': True, 'bull_use_ema': False, 'bull_use_atr': True, 'bull_use_adx': True, 'bull_use_spike': True, 'bull_rsi_required': True, 'bear_strategy': 'breakout', 'bear_bb_std_mult': 0.6977715897202774, 'bear_rsi_os': 54, 'bear_rsi_ob': 91, 'bear_adx_thresh': 17.632755038346545, 'bear_atr_min_pct': 0.009041212575160794, 'bear_atr_max_pct': 0.04996353586847707, 'bear_tp_mult': 2.5089098633869558, 'bear_tsl_mult': 0.03462525893119717, 'bear_time_stop': 141, 'bear_use_sma': False, 'bear_use_ema': False, 'bear_use_atr': True, 'bear_use_adx': False, 'bear_use_spike': False, 'bear_rsi_required': True, 'sideways_strategy': 'mean_reversion', 'sideways_bb_std_mult': 0.9206839284065876, 'sideways_rsi_os': 52, 'sideways_rsi_ob': 88, 'sideways_adx_thresh': 13.937249191807208, 'sideways_atr_min_pct': 0.012197133110131594, 'sideways_atr_max_pct': 0.14982721561285978, 'sideways_tp_mult': 2.911002638896951, 'sideways_tsl_mult': 0.4579019301323741, 'sideways_time_stop': 242, 'sideways_use_sma': True, 'sideways_use_ema': False, 'sideways_use_atr': False, 'sideways_use_adx': False, 'sideways_use_spike': False, 'sideways_rsi_required': True}.
[I 2025-08-31 10:06:45,587] Trial 118 finished with values: [-0.008150832906019034, 0.007874324958430845] and parameters: {'p_sma': 20, 'p_std': 30, 'p_atr': 14, 'p_adx': 27, 'rsi_period': 28, 'ema1': 24, 'ema2': 10, 'slip_atr_k': 0.19802374629152691, 'slip_spread_k': 0.8141062751347946, 'spread_hl_frac': 0.0022372968608256848, 'bb_std_mult': 0.7218109871273894, 'rsi_os': 34, 'rsi_ob': 60, 'vol_spike': 0.2041087723470496, 'adx_thresh': 8.813769037385434, 'atr_min_pct': 0.008880172340524371, 'atr_max_pct': 0.06786138900742855, 'tp_mult': 2.7173718176503643, 'tsl_mult': 0.7211015093714054, 'strategy': 'breakout', 'time_stop': 105, 'use_sma': True, 'use_atr': False, 'use_adx': True, 'use_ema': False, 'use_spike': False, 'rsi_required': False, 'edge_k': 1.6858171815360605, 'edge_cap': 0.9726400200583003, 'bull_strategy': 'mean_reversion', 'bull_bb_std_mult': 1.0622060053544775, 'bull_rsi_os': 8, 'bull_rsi_ob': 75, 'bull_adx_thresh': 14.429652306674727, 'bull_atr_min_pct': 0.0034255849150191925, 'bull_atr_max_pct': 0.01981529120543982, 'bull_tp_mult': 1.105946992092592, 'bull_tsl_mult': 0.1016606902872299, 'bull_time_stop': 41, 'bull_use_sma': True, 'bull_use_ema': False, 'bull_use_atr': True, 'bull_use_adx': True, 'bull_use_spike': True, 'bull_rsi_required': True, 'bear_strategy': 'breakout', 'bear_bb_std_mult': 1.8332482350021648, 'bear_rsi_os': 54, 'bear_rsi_ob': 90, 'bear_adx_thresh': 17.60104477773787, 'bear_atr_min_pct': 0.008731836577229743, 'bear_atr_max_pct': 0.0588274010942962, 'bear_tp_mult': 2.539695758999363, 'bear_tsl_mult': 0.4450732742783984, 'bear_time_stop': 140, 'bear_use_sma': False, 'bear_use_ema': False, 'bear_use_atr': True, 'bear_use_adx': False, 'bear_use_spike': False, 'bear_rsi_required': True, 'sideways_strategy': 'mean_reversion', 'sideways_bb_std_mult': 0.9389304638334518, 'sideways_rsi_os': 16, 'sideways_rsi_ob': 54, 'sideways_adx_thresh': 13.98244978769612, 'sideways_atr_min_pct': 0.011927004915743734, 'sideways_atr_max_pct': 0.02503398322110111, 'sideways_tp_mult': 1.095590473269782, 'sideways_tsl_mult': 0.8332991218828563, 'sideways_time_stop': 157, 'sideways_use_sma': False, 'sideways_use_ema': True, 'sideways_use_atr': False, 'sideways_use_adx': False, 'sideways_use_spike': False, 'sideways_rsi_required': True}.
[I 2025-08-31 10:06:46,210] Trial 119 finished with values: [-1000000000.0, 1000000000.0] and parameters: {'p_sma': 9, 'p_std': 30, 'p_atr': 30, 'p_adx': 27, 'rsi_period': 29, 'ema1': 23, 'ema2': 10, 'slip_atr_k': 0.16134965378134306, 'slip_spread_k': 0.3962616205124485, 'spread_hl_frac': 0.03845767817097446, 'bb_std_mult': 3.0556747171895955, 'rsi_os': 15, 'rsi_ob': 60, 'vol_spike': 0.20171925650958622, 'adx_thresh': 8.3583919567624, 'atr_min_pct': 0.012293460995760508, 'atr_max_pct': 0.01375286190425086, 'tp_mult': 1.8567043149968843, 'tsl_mult': 0.7163758942865381, 'strategy': 'breakout', 'time_stop': 104, 'use_sma': True, 'use_atr': False, 'use_adx': True, 'use_ema': False, 'use_spike': False, 'rsi_required': False, 'edge_k': 1.380485684614117, 'edge_cap': 0.8959219368993276, 'bull_strategy': 'breakout', 'bull_bb_std_mult': 0.9289915361129324, 'bull_rsi_os': 36, 'bull_rsi_ob': 57, 'bull_adx_thresh': 13.641116392604978, 'bull_atr_min_pct': 0.010970468525644601, 'bull_atr_max_pct': 0.11221174983113952, 'bull_tp_mult': 2.191638897154176, 'bull_tsl_mult': 0.6782757631310584, 'bull_time_stop': 41, 'bull_use_sma': True, 'bull_use_ema': False, 'bull_use_atr': True, 'bull_use_adx': True, 'bull_use_spike': True, 'bull_rsi_required': True, 'bear_strategy': 'breakout', 'bear_bb_std_mult': 2.946039381941496, 'bear_rsi_os': 49, 'bear_rsi_ob': 91, 'bear_adx_thresh': 17.414910046604394, 'bear_atr_min_pct': 0.027339157496680574, 'bear_atr_max_pct': 0.05889983286564114, 'bear_tp_mult': 2.6056174142780693, 'bear_tsl_mult': 0.629369006522348, 'bear_time_stop': 142, 'bear_use_sma': False, 'bear_use_ema': False, 'bear_use_atr': True, 'bear_use_adx': False, 'bear_use_spike': False, 'bear_rsi_required': True, 'sideways_strategy': 'mean_reversion', 'sideways_bb_std_mult': 0.9260565446778842, 'sideways_rsi_os': 23, 'sideways_rsi_ob': 54, 'sideways_adx_thresh': 11.559378364955538, 'sideways_atr_min_pct': 0.014074533496664368, 'sideways_atr_max_pct': 0.1407802479163992, 'sideways_tp_mult': 2.314396022640965, 'sideways_tsl_mult': 0.40851294933616356, 'sideways_time_stop': 166, 'sideways_use_sma': True, 'sideways_use_ema': True, 'sideways_use_atr': False, 'sideways_use_adx': False, 'sideways_use_spike': False, 'sideways_rsi_required': True}.
[I 2025-08-31 10:06:46,587] Trial 122 finished with values: [-1000000000.0, 1000000000.0] and parameters: {'p_sma': 5, 'p_std': 41, 'p_atr': 23, 'p_adx': 29, 'rsi_period': 23, 'ema1': 24, 'ema2': 12, 'slip_atr_k': 0.1663277690630877, 'slip_spread_k': 0.6950234558101068, 'spread_hl_frac': 0.04056337117660704, 'bb_std_mult': 2.1043087350146346, 'rsi_os': 23, 'rsi_ob': 64, 'vol_spike': 0.12408703979827575, 'adx_thresh': 21.020775348270163, 'atr_min_pct': 0.01597408009556945, 'atr_max_pct': 0.06666063664542658, 'tp_mult': 2.0900267440200944, 'tsl_mult': 0.6861642356373512, 'strategy': 'breakout', 'time_stop': 257, 'use_sma': True, 'use_atr': True, 'use_adx': True, 'use_ema': True, 'use_spike': False, 'rsi_required': False, 'edge_k': 0.506187268572774, 'edge_cap': 0.19832427082466858, 'bull_strategy': 'breakout', 'bull_bb_std_mult': 1.8030584424763831, 'bull_rsi_os': 39, 'bull_rsi_ob': 93, 'bull_adx_thresh': 27.900991160962874, 'bull_atr_min_pct': 0.010366587891512659, 'bull_atr_max_pct': 0.06422072215693489, 'bull_tp_mult': 2.3070728391316986, 'bull_tsl_mult': 0.8009678843369079, 'bull_time_stop': 21, 'bull_use_sma': True, 'bull_use_ema': False, 'bull_use_atr': True, 'bull_use_adx': True, 'bull_use_spike': False, 'bull_rsi_required': True, 'bear_strategy': 'breakout', 'bear_bb_std_mult': 2.954242379977064, 'bear_rsi_os': 54, 'bear_rsi_ob': 74, 'bear_adx_thresh': 19.425386171539497, 'bear_atr_min_pct': 0.008656652696837111, 'bear_atr_max_pct': 0.06385736427983307, 'bear_tp_mult': 2.521854728403101, 'bear_tsl_mult': 0.036693062914563535, 'bear_time_stop': 300, 'bear_use_sma': True, 'bear_use_ema': False, 'bear_use_atr': True, 'bear_use_adx': False, 'bear_use_spike': True, 'bear_rsi_required': True, 'sideways_strategy': 'mean_reversion', 'sideways_bb_std_mult': 0.9590468887216493, 'sideways_rsi_os': 24, 'sideways_rsi_ob': 78, 'sideways_adx_thresh': 13.602744973132086, 'sideways_atr_min_pct': 0.018298740115262994, 'sideways_atr_max_pct': 0.13934956504556142, 'sideways_tp_mult': 1.9497215366666367, 'sideways_tsl_mult': 0.8308603215395621, 'sideways_time_stop': 167, 'sideways_use_sma': False, 'sideways_use_ema': True, 'sideways_use_atr': False, 'sideways_use_adx': True, 'sideways_use_spike': False, 'sideways_rsi_required': True}.
[I 2025-08-31 10:07:17,587] Trial 124 finished with values: [-1000000000.0, 1000000000.0] and parameters: {'p_sma': 21, 'p_std': 30, 'p_atr': 14, 'p_adx': 26, 'rsi_period': 28, 'ema1': 25, 'ema2': 12, 'slip_atr_k': 0.22455903666477756, 'slip_spread_k': 0.8520977839384427, 'spread_hl_frac': 0.0022042108720071274, 'bb_std_mult': 0.5070419650396932, 'rsi_os': 37, 'rsi_ob': 64, 'vol_spike': 0.20411014055543406, 'adx_thresh': 8.394077404565811, 'atr_min_pct': 0.0033438002456161403, 'atr_max_pct': 0.06712992719020988, 'tp_mult': 2.7286418322315162, 'tsl_mult': 0.39815763088595624, 'strategy': 'breakout', 'time_stop': 109, 'use_sma': False, 'use_atr': False, 'use_adx': True, 'use_ema': False, 'use_spike': False, 'rsi_required': True, 'edge_k': 1.8999679266911165, 'edge_cap': 0.8374780161701973, 'bull_strategy': 'mean_reversion', 'bull_bb_std_mult': 1.2067922539882288, 'bull_rsi_os': 19, 'bull_rsi_ob': 75, 'bull_adx_thresh': 16.747728587991546, 'bull_atr_min_pct': 0.004859972577665393, 'bull_atr_max_pct': 0.0976751938557282, 'bull_tp_mult': 2.146677099483199, 'bull_tsl_mult': 0.10681383186471594, 'bull_time_stop': 101, 'bull_use_sma': True, 'bull_use_ema': False, 'bull_use_atr': True, 'bull_use_adx': True, 'bull_use_spike': True, 'bull_rsi_required': True, 'bear_strategy': 'breakout', 'bear_bb_std_mult': 2.017457541742804, 'bear_rsi_os': 55, 'bear_rsi_ob': 72, 'bear_adx_thresh': 15.85662075402529, 'bear_atr_min_pct': 0.007351043937084875, 'bear_atr_max_pct': 0.11542207113364353, 'bear_tp_mult': 2.537043433206107, 'bear_tsl_mult': 0.41461983247570716, 'bear_time_stop': 144, 'bear_use_sma': False, 'bear_use_ema': False, 'bear_use_atr': True, 'bear_use_adx': False, 'bear_use_spike': True, 'bear_rsi_required': True, 'sideways_strategy': 'breakout', 'sideways_bb_std_mult': 1.5460579359062023, 'sideways_rsi_os': 14, 'sideways_rsi_ob': 50, 'sideways_adx_thresh': 12.80331047267875, 'sideways_atr_min_pct': 0.010866706635104882, 'sideways_atr_max_pct': 0.014093613068382837, 'sideways_tp_mult': 1.1334673982975136, 'sideways_tsl_mult': 0.8355402977409083, 'sideways_time_stop': 167, 'sideways_use_sma': False, 'sideways_use_ema': True, 'sideways_use_atr': False, 'sideways_use_adx': False, 'sideways_use_spike': False, 'sideways_rsi_required': True}.
[I 2025-08-31 10:07:17,791] Trial 123 finished with values: [-1000000000.0, 1000000000.0] and parameters: {'p_sma': 5, 'p_std': 37, 'p_atr': 29, 'p_adx': 9, 'rsi_period': 38, 'ema1': 24, 'ema2': 12, 'slip_atr_k': 0.05582634115249516, 'slip_spread_k': 0.5924787095180122, 'spread_hl_frac': 0.04042015460572755, 'bb_std_mult': 2.659634545381487, 'rsi_os': 23, 'rsi_ob': 59, 'vol_spike': 0.2758273446006383, 'adx_thresh': 23.799469412837514, 'atr_min_pct': 0.010178301835846226, 'atr_max_pct': 0.08800632995962637, 'tp_mult': 1.8570221331127632, 'tsl_mult': 0.7518549219604899, 'strategy': 'breakout', 'time_stop': 158, 'use_sma': False, 'use_atr': False, 'use_adx': True, 'use_ema': False, 'use_spike': True, 'rsi_required': True, 'edge_k': 0.1038728243958833, 'edge_cap': 0.21703570858906057, 'bull_strategy': 'mean_reversion', 'bull_bb_std_mult': 2.8056476339807324, 'bull_rsi_os': 39, 'bull_rsi_ob': 61, 'bull_adx_thresh': 25.926615922660748, 'bull_atr_min_pct': 0.010954516223084885, 'bull_atr_max_pct': 0.013715883266464148, 'bull_tp_mult': 1.0126879054714049, 'bull_tsl_mult': 0.8020497453296398, 'bull_time_stop': 80, 'bull_use_sma': True, 'bull_use_ema': False, 'bull_use_atr': True, 'bull_use_adx': False, 'bull_use_spike': False, 'bull_rsi_required': True, 'bear_strategy': 'breakout', 'bear_bb_std_mult': 2.9698925155225964, 'bear_rsi_os': 49, 'bear_rsi_ob': 92, 'bear_adx_thresh': 22.817250950753376, 'bear_atr_min_pct': 0.00750577043764914, 'bear_atr_max_pct': 0.0637484486907991, 'bear_tp_mult': 2.6092765943401948, 'bear_tsl_mult': 0.6600629971896834, 'bear_time_stop': 216, 'bear_use_sma': True, 'bear_use_ema': False, 'bear_use_atr': True, 'bear_use_adx': True, 'bear_use_spike': True, 'bear_rsi_required': False, 'sideways_strategy': 'breakout', 'sideways_bb_std_mult': 3.4203137133572623, 'sideways_rsi_os': 23, 'sideways_rsi_ob': 79, 'sideways_adx_thresh': 11.35074819138751, 'sideways_atr_min_pct': 0.018401144026950284, 'sideways_atr_max_pct': 0.09497373522801417, 'sideways_tp_mult': 1.9423024879241766, 'sideways_tsl_mult': 0.8520726973879285, 'sideways_time_stop': 175, 'sideways_use_sma': False, 'sideways_use_ema': True, 'sideways_use_atr': True, 'sideways_use_adx': True, 'sideways_use_spike': False, 'sideways_rsi_required': True}.
[I 2025-08-31 10:07:17,934] Trial 125 finished with values: [-0.011601759657735022, 0.012636131429898329] and parameters: {'p_sma': 20, 'p_std': 32, 'p_atr': 14, 'p_adx': 26, 'rsi_period': 24, 'ema1': 26, 'ema2': 12, 'slip_atr_k': 0.19913522759587032, 'slip_spread_k': 0.8644800168524599, 'spread_hl_frac': 0.0019746640715107232, 'bb_std_mult': 0.6536151551018496, 'rsi_os': 37, 'rsi_ob': 61, 'vol_spike': 0.1599050440560489, 'adx_thresh': 10.178209076628411, 'atr_min_pct': 0.0014033147876340041, 'atr_max_pct': 0.06728657132314858, 'tp_mult': 2.7324239618379904, 'tsl_mult': 0.5774783741301525, 'strategy': 'breakout', 'time_stop': 92, 'use_sma': False, 'use_atr': False, 'use_adx': False, 'use_ema': False, 'use_spike': True, 'rsi_required': True, 'edge_k': 0.33679448423744573, 'edge_cap': 0.19620581952282778, 'bull_strategy': 'mean_reversion', 'bull_bb_std_mult': 1.122284877721351, 'bull_rsi_os': 13, 'bull_rsi_ob': 75, 'bull_adx_thresh': 16.56119528921006, 'bull_atr_min_pct': 0.0038470509077900544, 'bull_atr_max_pct': 0.12393447805671637, 'bull_tp_mult': 2.07124304713052, 'bull_tsl_mult': 0.09670593426590096, 'bull_time_stop': 79, 'bull_use_sma': True, 'bull_use_ema': False, 'bull_use_atr': True, 'bull_use_adx': True, 'bull_use_spike': True, 'bull_rsi_required': True, 'bear_strategy': 'mean_reversion', 'bear_bb_std_mult': 1.684329410208335, 'bear_rsi_os': 55, 'bear_rsi_ob': 65, 'bear_adx_thresh': 14.810982938935702, 'bear_atr_min_pct': 0.007140978416530283, 'bear_atr_max_pct': 0.06352316190259746, 'bear_tp_mult': 2.3731389939378817, 'bear_tsl_mult': 0.43545376017208953, 'bear_time_stop': 162, 'bear_use_sma': False, 'bear_use_ema': False, 'bear_use_atr': True, 'bear_use_adx': True, 'bear_use_spike': True, 'bear_rsi_required': True, 'sideways_strategy': 'breakout', 'sideways_bb_std_mult': 1.5822611732002558, 'sideways_rsi_os': 14, 'sideways_rsi_ob': 50, 'sideways_adx_thresh': 15.382103922096793, 'sideways_atr_min_pct': 0.010506135677149128, 'sideways_atr_max_pct': 0.014391359182946957, 'sideways_tp_mult': 1.1574698690844532, 'sideways_tsl_mult': 0.8364161237059347, 'sideways_time_stop': 174, 'sideways_use_sma': False, 'sideways_use_ema': True, 'sideways_use_atr': True, 'sideways_use_adx': False, 'sideways_use_spike': False, 'sideways_rsi_required': True}.
