[I 2025-08-31 09:57:01,171] Trial 46 finished with values: [-1000000000.0, 1000000000.0] and parameters: {'p_sma': 40, 'p_std': 20, 'p_atr': 29, 'p_adx': 14, 'rsi_period': 40, 'ema1': 6, 'ema2': 23, 'slip_atr_k': 0.0875236459528659, 'slip_spread_k': 0.9504864903910348, 'spread_hl_frac': 0.024451376583500738, 'bb_std_mult': 3.453316836001917, 'rsi_os': 11, 'rsi_ob': 94, 'vol_spike': 0.08909553888473325, 'adx_thresh': 26.555212794665362, 'atr_min_pct': 0.002546705581423203, 'atr_max_pct': 0.14070674550911583, 'tp_mult': 1.2028553468578127, 'tsl_mult': 0.9300142671750815, 'strategy': 'breakout', 'time_stop': 300, 'use_sma': True, 'use_atr': False, 'use_adx': True, 'use_ema': False, 'use_spike': False, 'rsi_required': False, 'edge_k': 1.4774577434765104, 'edge_cap': 0.44650506180557975, 'bull_strategy': 'mean_reversion', 'bull_bb_std_mult': 0.6831664856489212, 'bull_rsi_os': 26, 'bull_rsi_ob': 95, 'bull_adx_thresh': 30.524313429388716, 'bull_atr_min_pct': 0.0021852526657079457, 'bull_atr_max_pct': 0.034464820385658235, 'bull_tp_mult': 2.881984011358781, 'bull_tsl_mult': 0.7518424035583302, 'bull_time_stop': 272, 'bull_use_sma': False, 'bull_use_ema': True, 'bull_use_atr': True, 'bull_use_adx': False, 'bull_use_spike': True, 'bull_rsi_required': False, 'bear_strategy': 'breakout', 'bear_bb_std_mult': 2.353778141710964, 'bear_rsi_os': 17, 'bear_rsi_ob': 49, 'bear_adx_thresh': 26.166259891766998, 'bear_atr_min_pct': 0.021172694737960743, 'bear_atr_max_pct': 0.09633893026209829, 'bear_tp_mult': 1.8280120585120359, 'bear_tsl_mult': 0.9970501476307625, 'bear_time_stop': 120, 'bear_use_sma': False, 'bear_use_ema': False, 'bear_use_atr': True, 'bear_use_adx': False, 'bear_use_spike': True, 'bear_rsi_required': False, 'sideways_strategy': 'mean_reversion', 'sideways_bb_std_mult': 0.7754479161775365, 'sideways_rsi_os': 8, 'sideways_rsi_ob': 54, 'sideways_adx_thresh': 23.333614577538125, 'sideways_atr_min_pct': 0.013863697938631538, 'sideways_atr_max_pct': 0.010571984651626246, 'sideways_tp_mult': 1.5214692908873801, 'sideways_tsl_mult': 0.42267235573699646, 'sideways_time_stop': 159, 'sideways_use_sma': False, 'sideways_use_ema': True, 'sideways_use_atr': True, 'sideways_use_adx': False, 'sideways_use_spike': False, 'sideways_rsi_required': True}.
[I 2025-08-31 09:57:01,381] Trial 44 finished with values: [-1000000000.0, 1000000000.0] and parameters: {'p_sma': 12, 'p_std': 18, 'p_atr': 29, 'p_adx': 14, 'rsi_period': 71, 'ema1': 5, 'ema2': 24, 'slip_atr_k': 0.2143440960255516, 'slip_spread_k': 0.9534286924208595, 'spread_hl_frac': 0.02363777318751138, 'bb_std_mult': 0.5564514245377243, 'rsi_os': 10, 'rsi_ob': 49, 'vol_spike': 0.033227695748247035, 'adx_thresh': 11.331537687678251, 'atr_min_pct': 0.015572432268538385, 'atr_max_pct': 0.05927541559925516, 'tp_mult': 1.1728106243553762, 'tsl_mult': 0.9017292595007427, 'strategy': 'breakout', 'time_stop': 7, 'use_sma': True, 'use_atr': False, 'use_adx': True, 'use_ema': False, 'use_spike': False, 'rsi_required': False, 'edge_k': 1.293193300538748, 'edge_cap': 0.2401194805557637, 'bull_strategy': 'mean_reversion', 'bull_bb_std_mult': 3.1655741846185528, 'bull_rsi_os': 36, 'bull_rsi_ob': 95, 'bull_adx_thresh': 23.614938079984256, 'bull_atr_min_pct': 0.002135563710419003, 'bull_atr_max_pct': 0.03957755624002534, 'bull_tp_mult': 2.853699778711911, 'bull_tsl_mult': 0.7607700361248055, 'bull_time_stop': 256, 'bull_use_sma': False, 'bull_use_ema': True, 'bull_use_atr': True, 'bull_use_adx': False, 'bull_use_spike': True, 'bull_rsi_required': False, 'bear_strategy': 'breakout', 'bear_bb_std_mult': 0.636562827531159, 'bear_rsi_os': 17, 'bear_rsi_ob': 48, 'bear_adx_thresh': 25.998166385299797, 'bear_atr_min_pct': 0.01688255520295394, 'bear_atr_max_pct': 0.09707383991995686, 'bear_tp_mult': 2.307191008417544, 'bear_tsl_mult': 0.25846724007933364, 'bear_time_stop': 120, 'bear_use_sma': False, 'bear_use_ema': False, 'bear_use_atr': True, 'bear_use_adx': False, 'bear_use_spike': False, 'bear_rsi_required': False, 'sideways_strategy': 'mean_reversion', 'sideways_bb_std_mult': 0.7457030723474937, 'sideways_rsi_os': 7, 'sideways_rsi_ob': 47, 'sideways_adx_thresh': 32.273816546586886, 'sideways_atr_min_pct': 0.013396528993209422, 'sideways_atr_max_pct': 0.011452496803741965, 'sideways_tp_mult': 2.976779354825202, 'sideways_tsl_mult': 0.42455473261616894, 'sideways_time_stop': 163, 'sideways_use_sma': False, 'sideways_use_ema': True, 'sideways_use_atr': True, 'sideways_use_adx': False, 'sideways_use_spike': True, 'sideways_rsi_required': True}.
[I 2025-08-31 09:57:35,383] Trial 50 finished with values: [-1000000000.0, 1000000000.0] and parameters: {'p_sma': 59, 'p_std': 15, 'p_atr': 13, 'p_adx': 30, 'rsi_period': 84, 'ema1': 9, 'ema2': 18, 'slip_atr_k': 0.2418768902666238, 'slip_spread_k': 0.5939115471210653, 'spread_hl_frac': 0.03978698059875743, 'bb_std_mult': 1.905857804122586, 'rsi_os': 7, 'rsi_ob': 55, 'vol_spike': 0.19363584266450448, 'adx_thresh': 28.72874814402493, 'atr_min_pct': 0.028613675547372194, 'atr_max_pct': 0.13460329418329103, 'tp_mult': 2.6096929930229513, 'tsl_mult': 0.4808723275934912, 'strategy': 'breakout', 'time_stop': 141, 'use_sma': True, 'use_atr': False, 'use_adx': False, 'use_ema': True, 'use_spike': False, 'rsi_required': True, 'edge_k': 1.7798004227511863, 'edge_cap': 0.7397193739463406, 'bull_strategy': 'mean_reversion', 'bull_bb_std_mult': 3.488065691574123, 'bull_rsi_os': 12, 'bull_rsi_ob': 90, 'bull_adx_thresh': 20.54011661440426, 'bull_atr_min_pct': 0.016861571140750462, 'bull_atr_max_pct': 0.0842862997585374, 'bull_tp_mult': 1.8387261987476389, 'bull_tsl_mult': 0.6635002316639944, 'bull_time_stop': 186, 'bull_use_sma': True, 'bull_use_ema': True, 'bull_use_atr': False, 'bull_use_adx': False, 'bull_use_spike': False, 'bull_rsi_required': False, 'bear_strategy': 'mean_reversion', 'bear_bb_std_mult': 2.699956371035794, 'bear_rsi_os': 7, 'bear_rsi_ob': 52, 'bear_adx_thresh': 34.49727715149499, 'bear_atr_min_pct': 0.008056231811650508, 'bear_atr_max_pct': 0.03286857984529771, 'bear_tp_mult': 1.9998020730603718, 'bear_tsl_mult': 0.6429234114271606, 'bear_time_stop': 197, 'bear_use_sma': True, 'bear_use_ema': True, 'bear_use_atr': True, 'bear_use_adx': False, 'bear_use_spike': False, 'bear_rsi_required': False, 'sideways_strategy': 'breakout', 'sideways_bb_std_mult': 3.4195060859112996, 'sideways_rsi_os': 46, 'sideways_rsi_ob': 74, 'sideways_adx_thresh': 11.655980048401497, 'sideways_atr_min_pct': 0.0241337214939662, 'sideways_atr_max_pct': 0.1472631470188367, 'sideways_tp_mult': 1.7746082696250205, 'sideways_tsl_mult': 0.6828843995194398, 'sideways_time_stop': 128, 'sideways_use_sma': False, 'sideways_use_ema': False, 'sideways_use_atr': False, 'sideways_use_adx': True, 'sideways_use_spike': False, 'sideways_rsi_required': False}.
[I 2025-08-31 09:57:35,822] Trial 49 finished with values: [-1000000000.0, 1000000000.0] and parameters: {'p_sma': 14, 'p_std': 15, 'p_atr': 16, 'p_adx': 30, 'rsi_period': 30, 'ema1': 9, 'ema2': 18, 'slip_atr_k': 0.2122534731164848, 'slip_spread_k': 0.5933228129628891, 'spread_hl_frac': 0.027696318624890224, 'bb_std_mult': 0.574342527036088, 'rsi_os': 8, 'rsi_ob': 89, 'vol_spike': 0.1487207129606796, 'adx_thresh': 29.61518475041812, 'atr_min_pct': 0.02868251353882885, 'atr_max_pct': 0.08676071052202539, 'tp_mult': 2.643732397650209, 'tsl_mult': 0.2513891833362197, 'strategy': 'breakout', 'time_stop': 264, 'use_sma': True, 'use_atr': False, 'use_adx': False, 'use_ema': False, 'use_spike': False, 'rsi_required': True, 'edge_k': 0.4265324087601595, 'edge_cap': 0.9968375297901385, 'bull_strategy': 'mean_reversion', 'bull_bb_std_mult': 3.3740134027136692, 'bull_rsi_os': 14, 'bull_rsi_ob': 63, 'bull_adx_thresh': 28.007378685811325, 'bull_atr_min_pct': 0.0050847312200400195, 'bull_atr_max_pct': 0.04291013198098928, 'bull_tp_mult': 2.1539754612610036, 'bull_tsl_mult': 0.3874356486109491, 'bull_time_stop': 191, 'bull_use_sma': True, 'bull_use_ema': True, 'bull_use_atr': False, 'bull_use_adx': False, 'bull_use_spike': False, 'bull_rsi_required': False, 'bear_strategy': 'mean_reversion', 'bear_bb_std_mult': 2.653831856028225, 'bear_rsi_os': 7, 'bear_rsi_ob': 47, 'bear_adx_thresh': 34.872945175046226, 'bear_atr_min_pct': 0.008154886845959358, 'bear_atr_max_pct': 0.07556951893552277, 'bear_tp_mult': 2.006691376429063, 'bear_tsl_mult': 0.28762786868163065, 'bear_time_stop': 203, 'bear_use_sma': False, 'bear_use_ema': True, 'bear_use_atr': True, 'bear_use_adx': False, 'bear_use_spike': False, 'bear_rsi_required': False, 'sideways_strategy': 'breakout', 'sideways_bb_std_mult': 3.36806322888569, 'sideways_rsi_os': 26, 'sideways_rsi_ob': 81, 'sideways_adx_thresh': 11.86844869053645, 'sideways_atr_min_pct': 0.024885666906354534, 'sideways_atr_max_pct': 0.14497214737299347, 'sideways_tp_mult': 1.776070371180566, 'sideways_tsl_mult': 0.49294249266020396, 'sideways_time_stop': 132, 'sideways_use_sma': False, 'sideways_use_ema': False, 'sideways_use_atr': False, 'sideways_use_adx': False, 'sideways_use_spike': True, 'sideways_rsi_required': False}.
[I 2025-08-31 09:57:36,118] Trial 48 finished with values: [-0.043426436335389784, 0.043555358222542084] and parameters: {'p_sma': 60, 'p_std': 16, 'p_atr': 7, 'p_adx': 13, 'rsi_period': 33, 'ema1': 26, 'ema2': 19, 'slip_atr_k': 0.21473465898926666, 'slip_spread_k': 0.9648078193451256, 'spread_hl_frac': 0.02781691044713174, 'bb_std_mult': 0.6534563604056391, 'rsi_os': 8, 'rsi_ob': 55, 'vol_spike': 0.1612806163184479, 'adx_thresh': 34.61204083682295, 'atr_min_pct': 0.028709894679524717, 'atr_max_pct': 0.13885953975808749, 'tp_mult': 2.9990386330406804, 'tsl_mult': 0.48412106772432184, 'strategy': 'breakout', 'time_stop': 101, 'use_sma': True, 'use_atr': False, 'use_adx': False, 'use_ema': False, 'use_spike': False, 'rsi_required': True, 'edge_k': 1.4598311295654103, 'edge_cap': 0.761828084617316, 'bull_strategy': 'mean_reversion', 'bull_bb_std_mult': 0.9850816453713709, 'bull_rsi_os': 14, 'bull_rsi_ob': 91, 'bull_adx_thresh': 28.493335124329995, 'bull_atr_min_pct': 0.005425524162778762, 'bull_atr_max_pct': 0.04386474612844282, 'bull_tp_mult': 1.8510896040875346, 'bull_tsl_mult': 0.6594149606063328, 'bull_time_stop': 179, 'bull_use_sma': False, 'bull_use_ema': True, 'bull_use_atr': False, 'bull_use_adx': False, 'bull_use_spike': True, 'bull_rsi_required': False, 'bear_strategy': 'breakout', 'bear_bb_std_mult': 2.3166898999097367, 'bear_rsi_os': 20, 'bear_rsi_ob': 52, 'bear_adx_thresh': 6.648840375528058, 'bear_atr_min_pct': 0.0037425056560106296, 'bear_atr_max_pct': 0.09749181506558595, 'bear_tp_mult': 1.8291990110455942, 'bear_tsl_mult': 0.28218660493025405, 'bear_time_stop': 195, 'bear_use_sma': False, 'bear_use_ema': True, 'bear_use_atr': True, 'bear_use_adx': False, 'bear_use_spike': False, 'bear_rsi_required': False, 'sideways_strategy': 'breakout', 'sideways_bb_std_mult': 0.7545448496314531, 'sideways_rsi_os': 50, 'sideways_rsi_ob': 52, 'sideways_adx_thresh': 23.28145500844384, 'sideways_atr_min_pct': 0.014204110317909314, 'sideways_atr_max_pct': 0.146859767978405, 'sideways_tp_mult': 1.0373985464837572, 'sideways_tsl_mult': 0.9926966343839991, 'sideways_time_stop': 125, 'sideways_use_sma': False, 'sideways_use_ema': True, 'sideways_use_atr': False, 'sideways_use_adx': False, 'sideways_use_spike': False, 'sideways_rsi_required': False}.
[I 2025-08-31 09:57:36,264] Trial 47 finished with values: [-1000000000.0, 1000000000.0] and parameters: {'p_sma': 58, 'p_std': 22, 'p_atr': 15, 'p_adx': 30, 'rsi_period': 37, 'ema1': 26, 'ema2': 18, 'slip_atr_k': 0.2157718130801829, 'slip_spread_k': 0.9525825892674464, 'spread_hl_frac': 0.025889399014272046, 'bb_std_mult': 3.4109588361723464, 'rsi_os': 7, 'rsi_ob': 45, 'vol_spike': 0.08665955979156242, 'adx_thresh': 29.659706286626832, 'atr_min_pct': 0.006415073451515544, 'atr_max_pct': 0.06968937161997858, 'tp_mult': 2.557367812279747, 'tsl_mult': 0.4684088067503191, 'strategy': 'breakout', 'time_stop': 298, 'use_sma': True, 'use_atr': False, 'use_adx': False, 'use_ema': False, 'use_spike': False, 'rsi_required': True, 'edge_k': 1.3019040224534615, 'edge_cap': 0.2795961604482252, 'bull_strategy': 'mean_reversion', 'bull_bb_std_mult': 0.6204820432074347, 'bull_rsi_os': 36, 'bull_rsi_ob': 89, 'bull_adx_thresh': 28.238950104520754, 'bull_atr_min_pct': 0.00551995991762967, 'bull_atr_max_pct': 0.042062006881191105, 'bull_tp_mult': 2.880132359070615, 'bull_tsl_mult': 0.3956792018434117, 'bull_time_stop': 194, 'bull_use_sma': False, 'bull_use_ema': True, 'bull_use_atr': False, 'bull_use_adx': False, 'bull_use_spike': True, 'bull_rsi_required': False, 'bear_strategy': 'breakout', 'bear_bb_std_mult': 2.3329383846499088, 'bear_rsi_os': 20, 'bear_rsi_ob': 52, 'bear_adx_thresh': 30.58710458743962, 'bear_atr_min_pct': 0.02162598772911506, 'bear_atr_max_pct': 0.09948094407563518, 'bear_tp_mult': 1.8515862323981231, 'bear_tsl_mult': 0.5106777090530973, 'bear_time_stop': 133, 'bear_use_sma': False, 'bear_use_ema': True, 'bear_use_atr': True, 'bear_use_adx': False, 'bear_use_spike': True, 'bear_rsi_required': False, 'sideways_strategy': 'breakout', 'sideways_bb_std_mult': 0.7316948169820469, 'sideways_rsi_os': 8, 'sideways_rsi_ob': 54, 'sideways_adx_thresh': 23.459137921058442, 'sideways_atr_min_pct': 0.013810033490287109, 'sideways_atr_max_pct': 0.14430317067194254, 'sideways_tp_mult': 1.0260380802548994, 'sideways_tsl_mult': 0.49931322672628103, 'sideways_time_stop': 159, 'sideways_use_sma': False, 'sideways_use_ema': True, 'sideways_use_atr': True, 'sideways_use_adx': False, 'sideways_use_spike': False, 'sideways_rsi_required': True}.
[I 2025-08-31 09:58:11,832] Trial 51 finished with values: [-0.026101576397019932, 0.025629510378320623] and parameters: {'p_sma': 46, 'p_std': 22, 'p_atr': 7, 'p_adx': 16, 'rsi_period': 65, 'ema1': 26, 'ema2': 20, 'slip_atr_k': 0.23351171515256783, 'slip_spread_k': 0.47038621754375476, 'spread_hl_frac': 0.026956532648471924, 'bb_std_mult': 3.4188857469708527, 'rsi_os': 21, 'rsi_ob': 88, 'vol_spike': 0.15699620573642087, 'adx_thresh': 22.123285132017976, 'atr_min_pct': 0.01703702253277093, 'atr_max_pct': 0.14413580501692996, 'tp_mult': 2.9909777960965664, 'tsl_mult': 0.6941065490895784, 'strategy': 'mean_reversion', 'time_stop': 262, 'use_sma': True, 'use_atr': False, 'use_adx': False, 'use_ema': False, 'use_spike': False, 'rsi_required': True, 'edge_k': 0.40538522474107386, 'edge_cap': 0.5293474920544728, 'bull_strategy': 'mean_reversion', 'bull_bb_std_mult': 1.1276848830808122, 'bull_rsi_os': 16, 'bull_rsi_ob': 91, 'bull_adx_thresh': 27.9126948723325, 'bull_atr_min_pct': 0.004867002350590852, 'bull_atr_max_pct': 0.10179633761106635, 'bull_tp_mult': 1.1932942765029466, 'bull_tsl_mult': 0.8767798660802838, 'bull_time_stop': 163, 'bull_use_sma': True, 'bull_use_ema': False, 'bull_use_atr': False, 'bull_use_adx': False, 'bull_use_spike': False, 'bull_rsi_required': True, 'bear_strategy': 'breakout', 'bear_bb_std_mult': 1.9263269815230717, 'bear_rsi_os': 20, 'bear_rsi_ob': 47, 'bear_adx_thresh': 6.52280797749694, 'bear_atr_min_pct': 0.005021220098212159, 'bear_atr_max_pct': 0.0743900709668396, 'bear_tp_mult': 2.470686330170934, 'bear_tsl_mult': 0.30901271476338005, 'bear_time_stop': 137, 'bear_use_sma': False, 'bear_use_ema': True, 'bear_use_atr': False, 'bear_use_adx': False, 'bear_use_spike': False, 'bear_rsi_required': False, 'sideways_strategy': 'breakout', 'sideways_bb_std_mult': 2.9933209955399995, 'sideways_rsi_os': 15, 'sideways_rsi_ob': 61, 'sideways_adx_thresh': 16.09463053870688, 'sideways_atr_min_pct': 0.007823066086265377, 'sideways_atr_max_pct': 0.04713999701101389, 'sideways_tp_mult': 2.666897375375483, 'sideways_tsl_mult': 0.990233695526124, 'sideways_time_stop': 276, 'sideways_use_sma': False, 'sideways_use_ema': False, 'sideways_use_atr': False, 'sideways_use_adx': False, 'sideways_use_spike': True, 'sideways_rsi_required': False}.
[I 2025-08-31 09:58:12,005] Trial 53 finished with values: [-0.008791036922843554, 0.008793462414787146] and parameters: {'p_sma': 9, 'p_std': 26, 'p_atr': 28, 'p_adx': 16, 'rsi_period': 64, 'ema1': 21, 'ema2': 40, 'slip_atr_k': 0.23030591799390598, 'slip_spread_k': 0.47311004345189783, 'spread_hl_frac': 0.012819292783587673, 'bb_std_mult': 3.4066141545866038, 'rsi_os': 21, 'rsi_ob': 68, 'vol_spike': 0.1246958555432569, 'adx_thresh': 17.009611707112658, 'atr_min_pct': 0.01997226412176557, 'atr_max_pct': 0.14349626742360894, 'tp_mult': 1.452214223829799, 'tsl_mult': 0.057222856977027836, 'strategy': 'mean_reversion', 'time_stop': 285, 'use_sma': True, 'use_atr': True, 'use_adx': True, 'use_ema': True, 'use_spike': False, 'rsi_required': True, 'edge_k': 1.3659110746391865, 'edge_cap': 0.35681932744185163, 'bull_strategy': 'breakout', 'bull_bb_std_mult': 1.1455898158617555, 'bull_rsi_os': 32, 'bull_rsi_ob': 81, 'bull_adx_thresh': 33.24265261043366, 'bull_atr_min_pct': 2.7022903611501216e-05, 'bull_atr_max_pct': 0.09961141900561937, 'bull_tp_mult': 1.198307354533446, 'bull_tsl_mult': 0.05643999401468469, 'bull_time_stop': 75, 'bull_use_sma': True, 'bull_use_ema': False, 'bull_use_atr': False, 'bull_use_adx': True, 'bull_use_spike': False, 'bull_rsi_required': True, 'bear_strategy': 'breakout', 'bear_bb_std_mult': 1.0318898431647494, 'bear_rsi_os': 23, 'bear_rsi_ob': 46, 'bear_adx_thresh': 7.494790661276402, 'bear_atr_min_pct': 0.024690706382649048, 'bear_atr_max_pct': 0.049457645071003246, 'bear_tp_mult': 2.4354969373321067, 'bear_tsl_mult': 0.49764399743319915, 'bear_time_stop': 136, 'bear_use_sma': True, 'bear_use_ema': False, 'bear_use_atr': False, 'bear_use_adx': True, 'bear_use_spike': True, 'bear_rsi_required': True, 'sideways_strategy': 'breakout', 'sideways_bb_std_mult': 2.9176728323541905, 'sideways_rsi_os': 31, 'sideways_rsi_ob': 89, 'sideways_adx_thresh': 15.832558581014851, 'sideways_atr_min_pct': 0.007091645194033729, 'sideways_atr_max_pct': 0.046298989076057964, 'sideways_tp_mult': 2.679711663403753, 'sideways_tsl_mult': 0.5152307290667418, 'sideways_time_stop': 270, 'sideways_use_sma': False, 'sideways_use_ema': True, 'sideways_use_atr': False, 'sideways_use_adx': True, 'sideways_use_spike': True, 'sideways_rsi_required': False}.
[I 2025-08-31 09:58:12,291] Trial 54 finished with values: [-0.02989106875791736, 0.02976054603268226] and parameters: {'p_sma': 34, 'p_std': 25, 'p_atr': 28, 'p_adx': 16, 'rsi_period': 81, 'ema1': 29, 'ema2': 34, 'slip_atr_k': 0.23028382338545617, 'slip_spread_k': 0.8037176381601245, 'spread_hl_frac': 0.011932926669278206, 'bb_std_mult': 3.48848243130449, 'rsi_os': 21, 'rsi_ob': 63, 'vol_spike': 0.2542636112903875, 'adx_thresh': 14.213597964590148, 'atr_min_pct': 0.017799901982125287, 'atr_max_pct': 0.12538513946937532, 'tp_mult': 1.7305693424913946, 'tsl_mult': 0.7060514257475656, 'strategy': 'mean_reversion', 'time_stop': 286, 'use_sma': True, 'use_atr': False, 'use_adx': True, 'use_ema': True, 'use_spike': False, 'rsi_required': True, 'edge_k': 0.5661385118243113, 'edge_cap': 0.34522454550972315, 'bull_strategy': 'mean_reversion', 'bull_bb_std_mult': 2.392738461544498, 'bull_rsi_os': 25, 'bull_rsi_ob': 51, 'bull_adx_thresh': 33.44553574329179, 'bull_atr_min_pct': 0.0010371209099847654, 'bull_atr_max_pct': 0.10968703323703949, 'bull_tp_mult': 2.9862538240190846, 'bull_tsl_mult': 0.8247525199262045, 'bull_time_stop': 120, 'bull_use_sma': True, 'bull_use_ema': False, 'bull_use_atr': False, 'bull_use_adx': False, 'bull_use_spike': False, 'bull_rsi_required': True, 'bear_strategy': 'breakout', 'bear_bb_std_mult': 1.9413077090619908, 'bear_rsi_os': 14, 'bear_rsi_ob': 46, 'bear_adx_thresh': 9.797188658343815, 'bear_atr_min_pct': 0.024490615901441568, 'bear_atr_max_pct': 0.06717474853270494, 'bear_tp_mult': 2.4857173895893805, 'bear_tsl_mult': 0.13275641716347447, 'bear_time_stop': 97, 'bear_use_sma': True, 'bear_use_ema': False, 'bear_use_atr': False, 'bear_use_adx': True, 'bear_use_spike': False, 'bear_rsi_required': False, 'sideways_strategy': 'breakout', 'sideways_bb_std_mult': 1.1141587209527406, 'sideways_rsi_os': 11, 'sideways_rsi_ob': 45, 'sideways_adx_thresh': 15.466154700908929, 'sideways_atr_min_pct': 0.01647378555841428, 'sideways_atr_max_pct': 0.01603267972952403, 'sideways_tp_mult': 2.150791820348495, 'sideways_tsl_mult': 0.010332772976447857, 'sideways_time_stop': 90, 'sideways_use_sma': False, 'sideways_use_ema': True, 'sideways_use_atr': False, 'sideways_use_adx': True, 'sideways_use_spike': True, 'sideways_rsi_required': False}.
