2025-08-31 09:50:55,125 WARNING: DATA SANITY: Extreme jumps >20*ATR200: 42
[I 2025-08-31 09:50:55,139] A new study created in memory with name: no-name-e4829a87-0b1a-4fdc-bb32-66575d209ae8
[I 2025-08-31 09:51:31,089] Trial 1 finished with values: [-1000000000.0, 1000000000.0] and parameters: {'p_sma': 47, 'p_std': 48, 'p_atr': 17, 'p_adx': 21, 'rsi_period': 7, 'ema1': 11, 'ema2': 18, 'slip_atr_k': 0.1350423775587485, 'slip_spread_k': 0.06244137366447311, 'spread_hl_frac': 0.027565918243000226, 'bb_std_mult': 2.6701769643191056, 'rsi_os': 14, 'rsi_ob': 53, 'vol_spike': 0.1592516567064673, 'adx_thresh': 12.491880042166168, 'atr_min_pct': 0.011901580989182398, 'atr_max_pct': 0.09905579209126124, 'tp_mult': 1.9711114818246989, 'tsl_mult': 0.7586493110499355, 'strategy': 'mean_reversion', 'time_stop': 109, 'use_sma': False, 'use_atr': True, 'use_adx': True, 'use_ema': True, 'use_spike': True, 'rsi_required': True, 'edge_k': 1.1580963359515688, 'edge_cap': 0.4796056582214183, 'bull_strategy': 'breakout', 'bull_bb_std_mult': 3.5584300485148743, 'bull_rsi_os': 18, 'bull_rsi_ob': 57, 'bull_adx_thresh': 16.691027888979086, 'bull_atr_min_pct': 0.011330551849212124, 'bull_atr_max_pct': 0.02674367242343078, 'bull_tp_mult': 1.0411739484167033, 'bull_tsl_mult': 0.06188414800149211, 'bull_time_stop': 73, 'bull_use_sma': True, 'bull_use_ema': False, 'bull_use_atr': False, 'bull_use_adx': False, 'bull_use_spike': True, 'bull_rsi_required': False, 'bear_strategy': 'breakout', 'bear_bb_std_mult': 0.5389823999194326, 'bear_rsi_os': 54, 'bear_rsi_ob': 46, 'bear_adx_thresh': 12.61814127403846, 'bear_atr_min_pct': 0.026892223972391566, 'bear_atr_max_pct': 0.07987564313090473, 'bear_tp_mult': 1.2550773618093325, 'bear_tsl_mult': 0.4016318479293013, 'bear_time_stop': 270, 'bear_use_sma': True, 'bear_use_ema': True, 'bear_use_atr': True, 'bear_use_adx': False, 'bear_use_spike': False, 'bear_rsi_required': False, 'sideways_strategy': 'breakout', 'sideways_bb_std_mult': 0.9466224250078208, 'sideways_rsi_os': 26, 'sideways_rsi_ob': 46, 'sideways_adx_thresh': 27.1355826017028, 'sideways_atr_min_pct': 0.01902534649981833, 'sideways_atr_max_pct': 0.04615885459260033, 'sideways_tp_mult': 2.06359839695448, 'sideways_tsl_mult': 0.9694103081769028, 'sideways_time_stop': 234, 'sideways_use_sma': True, 'sideways_use_ema': False, 'sideways_use_atr': False, 'sideways_use_adx': True, 'sideways_use_spike': False, 'sideways_rsi_required': False}.
[I 2025-08-31 09:51:31,091] Trial 0 finished with values: [-1000000000.0, 1000000000.0] and parameters: {'p_sma': 43, 'p_std': 34, 'p_atr': 9, 'p_adx': 11, 'rsi_period': 70, 'ema1': 15, 'ema2': 34, 'slip_atr_k': 0.16904479874318562, 'slip_spread_k': 0.21985850464875634, 'spread_hl_frac': 0.007815154053000095, 'bb_std_mult': 3.367227642268859, 'rsi_os': 55, 'rsi_ob': 65, 'vol_spike': 0.04827924313003261, 'adx_thresh': 18.673506505441473, 'atr_min_pct': 0.001086325479821658, 'atr_max_pct': 0.09256471702684083, 'tp_mult': 1.6253527387429427, 'tsl_mult': 0.20305190527549422, 'strategy': 'breakout', 'time_stop': 162, 'use_sma': True, 'use_atr': True, 'use_adx': True, 'use_ema': False, 'use_spike': False, 'rsi_required': True, 'edge_k': 1.325351641514177, 'edge_cap': 0.8299928358294572, 'bull_strategy': 'mean_reversion', 'bull_bb_std_mult': 0.9045304497650448, 'bull_rsi_os': 27, 'bull_rsi_ob': 89, 'bull_adx_thresh': 10.565197219269333, 'bull_atr_min_pct': 0.016450051826149562, 'bull_atr_max_pct': 0.07915280408826589, 'bull_tp_mult': 1.0892817001087254, 'bull_tsl_mult': 0.6948980981644547, 'bull_time_stop': 143, 'bull_use_sma': True, 'bull_use_ema': True, 'bull_use_atr': False, 'bull_use_adx': False, 'bull_use_spike': True, 'bull_rsi_required': False, 'bear_strategy': 'breakout', 'bear_bb_std_mult': 3.4433047117525772, 'bear_rsi_os': 42, 'bear_rsi_ob': 57, 'bear_adx_thresh': 27.198934800035072, 'bear_atr_min_pct': 0.01178364600606451, 'bear_atr_max_pct': 0.0622758054548506, 'bear_tp_mult': 1.7992088905961203, 'bear_tsl_mult': 0.011647138888367214, 'bear_time_stop': 66, 'bear_use_sma': False, 'bear_use_ema': True, 'bear_use_atr': False, 'bear_use_adx': True, 'bear_use_spike': False, 'bear_rsi_required': False, 'sideways_strategy': 'breakout', 'sideways_bb_std_mult': 3.568075642232469, 'sideways_rsi_os': 7, 'sideways_rsi_ob': 91, 'sideways_adx_thresh': 12.701057217815494, 'sideways_atr_min_pct': 0.01863766155552414, 'sideways_atr_max_pct': 0.040477103477668745, 'sideways_tp_mult': 1.746954210189642, 'sideways_tsl_mult': 0.6471887399123113, 'sideways_time_stop': 103, 'sideways_use_sma': False, 'sideways_use_ema': False, 'sideways_use_atr': True, 'sideways_use_adx': False, 'sideways_use_spike': True, 'sideways_rsi_required': False}.
[I 2025-08-31 09:51:31,203] Trial 4 finished with values: [-1000000000.0, 1000000000.0] and parameters: {'p_sma': 17, 'p_std': 41, 'p_atr': 24, 'p_adx': 9, 'rsi_period': 30, 'ema1': 20, 'ema2': 48, 'slip_atr_k': 0.01978822395510582, 'slip_spread_k': 0.38450858147430933, 'spread_hl_frac': 0.025282582556936484, 'bb_std_mult': 2.266117228290016, 'rsi_os': 49, 'rsi_ob': 47, 'vol_spike': 0.05246300795910138, 'adx_thresh': 21.42831722800955, 'atr_min_pct': 0.0011030627237003953, 'atr_max_pct': 0.13157587523101202, 'tp_mult': 1.68529697986562, 'tsl_mult': 0.8502465159443385, 'strategy': 'mean_reversion', 'time_stop': 89, 'use_sma': False, 'use_atr': True, 'use_adx': True, 'use_ema': False, 'use_spike': True, 'rsi_required': False, 'edge_k': 0.7160020762641914, 'edge_cap': 0.28435790438347613, 'bull_strategy': 'breakout', 'bull_bb_std_mult': 0.9689438481592514, 'bull_rsi_os': 42, 'bull_rsi_ob': 83, 'bull_adx_thresh': 19.19119353001679, 'bull_atr_min_pct': 0.0007629356008020216, 'bull_atr_max_pct': 0.11817504580848734, 'bull_tp_mult': 2.271048292417789, 'bull_tsl_mult': 0.8958620920093405, 'bull_time_stop': 244, 'bull_use_sma': True, 'bull_use_ema': False, 'bull_use_atr': True, 'bull_use_adx': False, 'bull_use_spike': False, 'bull_rsi_required': True, 'bear_strategy': 'mean_reversion', 'bear_bb_std_mult': 0.9226872345238778, 'bear_rsi_os': 18, 'bear_rsi_ob': 64, 'bear_adx_thresh': 24.01214709144258, 'bear_atr_min_pct': 0.007342834387368562, 'bear_atr_max_pct': 0.026916682693786362, 'bear_tp_mult': 2.8447556705462462, 'bear_tsl_mult': 0.03924647121023506, 'bear_time_stop': 294, 'bear_use_sma': True, 'bear_use_ema': False, 'bear_use_atr': False, 'bear_use_adx': True, 'bear_use_spike': False, 'bear_rsi_required': True, 'sideways_strategy': 'breakout', 'sideways_bb_std_mult': 0.6312344126634148, 'sideways_rsi_os': 53, 'sideways_rsi_ob': 65, 'sideways_adx_thresh': 33.937401098831074, 'sideways_atr_min_pct': 0.005446139808989075, 'sideways_atr_max_pct': 0.13605757099279214, 'sideways_tp_mult': 2.197916035391118, 'sideways_tsl_mult': 0.9552769106758219, 'sideways_time_stop': 100, 'sideways_use_sma': True, 'sideways_use_ema': False, 'sideways_use_atr': True, 'sideways_use_adx': True, 'sideways_use_spike': False, 'sideways_rsi_required': False}.
[I 2025-08-31 09:51:31,269] Trial 5 finished with values: [-1000000000.0, 1000000000.0] and parameters: {'p_sma': 53, 'p_std': 54, 'p_atr': 17, 'p_adx': 24, 'rsi_period': 14, 'ema1': 20, 'ema2': 39, 'slip_atr_k': 0.06902141083976071, 'slip_spread_k': 0.21036807882091335, 'spread_hl_frac': 0.026404077033055647, 'bb_std_mult': 1.9929287642366198, 'rsi_os': 52, 'rsi_ob': 69, 'vol_spike': 0.09913806673824842, 'adx_thresh': 5.401317998066765, 'atr_min_pct': 0.004061342161185697, 'atr_max_pct': 0.09391922253492832, 'tp_mult': 1.1739321146253447, 'tsl_mult': 0.16559190538806012, 'strategy': 'mean_reversion', 'time_stop': 131, 'use_sma': True, 'use_atr': True, 'use_adx': False, 'use_ema': True, 'use_spike': False, 'rsi_required': False, 'edge_k': 1.6529661268746405, 'edge_cap': 0.7901482328930317, 'bull_strategy': 'mean_reversion', 'bull_bb_std_mult': 2.5492358501568155, 'bull_rsi_os': 44, 'bull_rsi_ob': 55, 'bull_adx_thresh': 34.843335157990865, 'bull_atr_min_pct': 0.0295366402748073, 'bull_atr_max_pct': 0.060304954164123965, 'bull_tp_mult': 1.24503532277599, 'bull_tsl_mult': 0.45307986202260964, 'bull_time_stop': 108, 'bull_use_sma': True, 'bull_use_ema': False, 'bull_use_atr': True, 'bull_use_adx': True, 'bull_use_spike': True, 'bull_rsi_required': True, 'bear_strategy': 'breakout', 'bear_bb_std_mult': 1.9986909997764712, 'bear_rsi_os': 39, 'bear_rsi_ob': 57, 'bear_adx_thresh': 32.88759727316753, 'bear_atr_min_pct': 0.01770210272149745, 'bear_atr_max_pct': 0.12237063724717127, 'bear_tp_mult': 1.1965260889775615, 'bear_tsl_mult': 0.07690637149295732, 'bear_time_stop': 210, 'bear_use_sma': False, 'bear_use_ema': False, 'bear_use_atr': False, 'bear_use_adx': False, 'bear_use_spike': True, 'bear_rsi_required': False, 'sideways_strategy': 'mean_reversion', 'sideways_bb_std_mult': 3.291443444217959, 'sideways_rsi_os': 25, 'sideways_rsi_ob': 71, 'sideways_adx_thresh': 29.564100395020354, 'sideways_atr_min_pct': 0.028780099849749434, 'sideways_atr_max_pct': 0.051070589757722586, 'sideways_tp_mult': 1.5667249867871207, 'sideways_tsl_mult': 0.9335958374007193, 'sideways_time_stop': 158, 'sideways_use_sma': True, 'sideways_use_ema': False, 'sideways_use_atr': True, 'sideways_use_adx': False, 'sideways_use_spike': True, 'sideways_rsi_required': True}.
[I 2025-08-31 09:51:31,640] Trial 2 finished with values: [-1000000000.0, 1000000000.0] and parameters: {'p_sma': 42, 'p_std': 6, 'p_atr': 18, 'p_adx': 12, 'rsi_period': 28, 'ema1': 8, 'ema2': 39, 'slip_atr_k': 0.09539073172123783, 'slip_spread_k': 0.15934677717152423, 'spread_hl_frac': 0.03826045700368225, 'bb_std_mult': 2.8594666726379896, 'rsi_os': 35, 'rsi_ob': 51, 'vol_spike': 0.07190960595063467, 'adx_thresh': 27.6223112610652, 'atr_min_pct': 0.0277384535308486, 'atr_max_pct': 0.11445240703661583, 'tp_mult': 2.801021751093321, 'tsl_mult': 0.22633549352759164, 'strategy': 'breakout', 'time_stop': 114, 'use_sma': False, 'use_atr': True, 'use_adx': True, 'use_ema': False, 'use_spike': True, 'rsi_required': True, 'edge_k': 0.0995730869167688, 'edge_cap': 0.28709847329413624, 'bull_strategy': 'breakout', 'bull_bb_std_mult': 1.6578338932527528, 'bull_rsi_os': 26, 'bull_rsi_ob': 51, 'bull_adx_thresh': 13.555752598594182, 'bull_atr_min_pct': 0.018017956580895913, 'bull_atr_max_pct': 0.05658326633939302, 'bull_tp_mult': 2.0999277138152577, 'bull_tsl_mult': 0.6978153569234662, 'bull_time_stop': 85, 'bull_use_sma': True, 'bull_use_ema': False, 'bull_use_atr': False, 'bull_use_adx': True, 'bull_use_spike': False, 'bull_rsi_required': False, 'bear_strategy': 'mean_reversion', 'bear_bb_std_mult': 0.7913664835785096, 'bear_rsi_os': 47, 'bear_rsi_ob': 71, 'bear_adx_thresh': 18.907980353713615, 'bear_atr_min_pct': 0.006627734164044711, 'bear_atr_max_pct': 0.04381078953259982, 'bear_tp_mult': 1.4452665053385771, 'bear_tsl_mult': 0.9055065611850314, 'bear_time_stop': 269, 'bear_use_sma': True, 'bear_use_ema': True, 'bear_use_atr': False, 'bear_use_adx': True, 'bear_use_spike': False, 'bear_rsi_required': True, 'sideways_strategy': 'mean_reversion', 'sideways_bb_std_mult': 1.8921915917209005, 'sideways_rsi_os': 53, 'sideways_rsi_ob': 76, 'sideways_adx_thresh': 9.308814034597198, 'sideways_atr_min_pct': 0.02615918096681525, 'sideways_atr_max_pct': 0.13540729050355998, 'sideways_tp_mult': 1.0881219696977706, 'sideways_tsl_mult': 0.16569214017243827, 'sideways_time_stop': 32, 'sideways_use_sma': True, 'sideways_use_ema': True, 'sideways_use_atr': True, 'sideways_use_adx': True, 'sideways_use_spike': True, 'sideways_rsi_required': False}.
[I 2025-08-31 09:51:31,739] Trial 3 finished with values: [-1000000000.0, 1000000000.0] and parameters: {'p_sma': 24, 'p_std': 6, 'p_atr': 19, 'p_adx': 23, 'rsi_period': 52, 'ema1': 11, 'ema2': 38, 'slip_atr_k': 0.12876200831081502, 'slip_spread_k': 0.809944013943678, 'spread_hl_frac': 0.0035464275546506054, 'bb_std_mult': 0.9545860917016453, 'rsi_os': 34, 'rsi_ob': 85, 'vol_spike': 0.11063633521275892, 'adx_thresh': 27.6680950516085, 'atr_min_pct': 0.004691449515329878, 'atr_max_pct': 0.0405398039671876, 'tp_mult': 2.780086615404034, 'tsl_mult': 0.8488152771105361, 'strategy': 'breakout', 'time_stop': 172, 'use_sma': True, 'use_atr': True, 'use_adx': False, 'use_ema': True, 'use_spike': True, 'rsi_required': False, 'edge_k': 0.07973320560068808, 'edge_cap': 0.330440590522405, 'bull_strategy': 'breakout', 'bull_bb_std_mult': 3.3445241914365793, 'bull_rsi_os': 44, 'bull_rsi_ob': 53, 'bull_adx_thresh': 22.752359120225332, 'bull_atr_min_pct': 0.015583044136235399, 'bull_atr_max_pct': 0.13205125105801416, 'bull_tp_mult': 1.3256248863114952, 'bull_tsl_mult': 0.5190992849931971, 'bull_time_stop': 291, 'bull_use_sma': True, 'bull_use_ema': True, 'bull_use_atr': True, 'bull_use_adx': True, 'bull_use_spike': True, 'bull_rsi_required': True, 'bear_strategy': 'breakout', 'bear_bb_std_mult': 1.2307792211976998, 'bear_rsi_os': 23, 'bear_rsi_ob': 78, 'bear_adx_thresh': 8.933258754871952, 'bear_atr_min_pct': 0.021367147188962064, 'bear_atr_max_pct': 0.1463186189375788, 'bear_tp_mult': 2.8839702469995325, 'bear_tsl_mult': 0.2510872304421994, 'bear_time_stop': 223, 'bear_use_sma': True, 'bear_use_ema': False, 'bear_use_atr': False, 'bear_use_adx': True, 'bear_use_spike': True, 'bear_rsi_required': True, 'sideways_strategy': 'mean_reversion', 'sideways_bb_std_mult': 1.5463351884007943, 'sideways_rsi_os': 21, 'sideways_rsi_ob': 92, 'sideways_adx_thresh': 11.530271486724908, 'sideways_atr_min_pct': 0.021176094417801487, 'sideways_atr_max_pct': 0.049343257153700845, 'sideways_tp_mult': 1.3897749666255372, 'sideways_tsl_mult': 0.42343396486599305, 'sideways_time_stop': 67, 'sideways_use_sma': False, 'sideways_use_ema': False, 'sideways_use_atr': False, 'sideways_use_adx': False, 'sideways_use_spike': True, 'sideways_rsi_required': False}.
[I 2025-08-31 09:52:06,272] Trial 7 finished with values: [-1000000000.0, 1000000000.0] and parameters: {'p_sma': 15, 'p_std': 35, 'p_atr': 22, 'p_adx': 29, 'rsi_period': 68, 'ema1': 21, 'ema2': 10, 'slip_atr_k': 0.04786074118381245, 'slip_spread_k': 0.9082556223335243, 'spread_hl_frac': 0.0033376092029476835, 'bb_std_mult': 0.6987978497909316, 'rsi_os': 9, 'rsi_ob': 63, 'vol_spike': 0.21297573358165742, 'adx_thresh': 11.864992400606928, 'atr_min_pct': 0.014279524169592486, 'atr_max_pct': 0.10945297812621836, 'tp_mult': 2.012057438088746, 'tsl_mult': 0.7439118071060961, 'strategy': 'breakout', 'time_stop': 42, 'use_sma': False, 'use_atr': True, 'use_adx': True, 'use_ema': False, 'use_spike': True, 'rsi_required': False, 'edge_k': 0.17843101374602588, 'edge_cap': 0.1546813894046842, 'bull_strategy': 'breakout', 'bull_bb_std_mult': 0.9350159395092283, 'bull_rsi_os': 12, 'bull_rsi_ob': 50, 'bull_adx_thresh': 9.85731493764959, 'bull_atr_min_pct': 0.023181389139785888, 'bull_atr_max_pct': 0.044314487841417394, 'bull_tp_mult': 2.187132082948758, 'bull_tsl_mult': 0.9685609863883393, 'bull_time_stop': 136, 'bull_use_sma': False, 'bull_use_ema': False, 'bull_use_atr': False, 'bull_use_adx': True, 'bull_use_spike': True, 'bull_rsi_required': False, 'bear_strategy': 'mean_reversion', 'bear_bb_std_mult': 1.6151131274229005, 'bear_rsi_os': 51, 'bear_rsi_ob': 64, 'bear_adx_thresh': 23.025608285352707, 'bear_atr_min_pct': 0.01472963982509404, 'bear_atr_max_pct': 0.042374124076197034, 'bear_tp_mult': 1.3755460634514143, 'bear_tsl_mult': 0.5774643740795465, 'bear_time_stop': 184, 'bear_use_sma': False, 'bear_use_ema': True, 'bear_use_atr': False, 'bear_use_adx': True, 'bear_use_spike': False, 'bear_rsi_required': False, 'sideways_strategy': 'breakout', 'sideways_bb_std_mult': 1.7830335554574488, 'sideways_rsi_os': 44, 'sideways_rsi_ob': 77, 'sideways_adx_thresh': 24.39986424068823, 'sideways_atr_min_pct': 0.01262051372081476, 'sideways_atr_max_pct': 0.0490364785533128, 'sideways_tp_mult': 2.7956070839591622, 'sideways_tsl_mult': 0.6585675461700499, 'sideways_time_stop': 168, 'sideways_use_sma': False, 'sideways_use_ema': False, 'sideways_use_atr': True, 'sideways_use_adx': False, 'sideways_use_spike': False, 'sideways_rsi_required': True}.
[I 2025-08-31 09:52:07,231] Trial 8 finished with values: [-1000000000.0, 1000000000.0] and parameters: {'p_sma': 38, 'p_std': 12, 'p_atr': 9, 'p_adx': 29, 'rsi_period': 75, 'ema1': 22, 'ema2': 17, 'slip_atr_k': 0.14520555953412395, 'slip_spread_k': 0.028304875516185324, 'spread_hl_frac': 0.03724894663262143, 'bb_std_mult': 1.7169020858343893, 'rsi_os': 40, 'rsi_ob': 84, 'vol_spike': 0.13673792686728925, 'adx_thresh': 22.7383566559492, 'atr_min_pct': 0.008335691426720505, 'atr_max_pct': 0.06209079443383447, 'tp_mult': 2.584430539598086, 'tsl_mult': 0.8223274410830337, 'strategy': 'mean_reversion', 'time_stop': 119, 'use_sma': False, 'use_atr': True, 'use_adx': False, 'use_ema': True, 'use_spike': False, 'rsi_required': True, 'edge_k': 0.4663971475124107, 'edge_cap': 0.7321234524805021, 'bull_strategy': 'breakout', 'bull_bb_std_mult': 3.5767608223662837, 'bull_rsi_os': 10, 'bull_rsi_ob': 88, 'bull_adx_thresh': 12.566032271158111, 'bull_atr_min_pct': 0.02959527661848034, 'bull_atr_max_pct': 0.037563946201260336, 'bull_tp_mult': 1.657114964899037, 'bull_tsl_mult': 0.3460532388590376, 'bull_time_stop': 77, 'bull_use_sma': False, 'bull_use_ema': True, 'bull_use_atr': True, 'bull_use_adx': False, 'bull_use_spike': False, 'bull_rsi_required': False, 'bear_strategy': 'mean_reversion', 'bear_bb_std_mult': 1.5263099863135232, 'bear_rsi_os': 21, 'bear_rsi_ob': 82, 'bear_adx_thresh': 19.104074308158275, 'bear_atr_min_pct': 0.020255231554196642, 'bear_atr_max_pct': 0.10298152278193504, 'bear_tp_mult': 2.3735805807551293, 'bear_tsl_mult': 0.9727609641494139, 'bear_time_stop': 147, 'bear_use_sma': False, 'bear_use_ema': True, 'bear_use_atr': False, 'bear_use_adx': True, 'bear_use_spike': True, 'bear_rsi_required': True, 'sideways_strategy': 'breakout', 'sideways_bb_std_mult': 2.419016741913226, 'sideways_rsi_os': 28, 'sideways_rsi_ob': 84, 'sideways_adx_thresh': 6.605169691252816, 'sideways_atr_min_pct': 0.0017106767308532566, 'sideways_atr_max_pct': 0.1033486288269466, 'sideways_tp_mult': 1.7058299554261418, 'sideways_tsl_mult': 0.6770847339377439, 'sideways_time_stop': 224, 'sideways_use_sma': True, 'sideways_use_ema': False, 'sideways_use_atr': True, 'sideways_use_adx': False, 'sideways_use_spike': False, 'sideways_rsi_required': True}.
[I 2025-08-31 09:52:07,485] Trial 9 finished with values: [-1000000000.0, 1000000000.0] and parameters: {'p_sma': 32, 'p_std': 16, 'p_atr': 13, 'p_adx': 17, 'rsi_period': 60, 'ema1': 26, 'ema2': 60, 'slip_atr_k': 0.029441871419710997, 'slip_spread_k': 0.0551751622352068, 'spread_hl_frac': 0.02944173293294087, 'bb_std_mult': 2.3062631898525696, 'rsi_os': 5, 'rsi_ob': 71, 'vol_spike': 0.10281293095015705, 'adx_thresh': 34.397823976032804, 'atr_min_pct': 0.009425446526907017, 'atr_max_pct': 0.0944026079418187, 'tp_mult': 2.747022383114108, 'tsl_mult': 0.8604421106713733, 'strategy': 'mean_reversion', 'time_stop': 86, 'use_sma': True, 'use_atr': False, 'use_adx': False, 'use_ema': True, 'use_spike': True, 'rsi_required': False, 'edge_k': 0.9491680710247057, 'edge_cap': 0.4197036100831074, 'bull_strategy': 'breakout', 'bull_bb_std_mult': 0.599230891781735, 'bull_rsi_os': 15, 'bull_rsi_ob': 61, 'bull_adx_thresh': 13.668327032205788, 'bull_atr_min_pct': 0.01253118084982971, 'bull_atr_max_pct': 0.12296733309630745, 'bull_tp_mult': 2.55977906807443, 'bull_tsl_mult': 0.12490251196696311, 'bull_time_stop': 156, 'bull_use_sma': False, 'bull_use_ema': True, 'bull_use_atr': False, 'bull_use_adx': False, 'bull_use_spike': False, 'bull_rsi_required': False, 'bear_strategy': 'breakout', 'bear_bb_std_mult': 2.1700999883318195, 'bear_rsi_os': 34, 'bear_rsi_ob': 76, 'bear_adx_thresh': 11.633562601610269, 'bear_atr_min_pct': 0.015900664091487767, 'bear_atr_max_pct': 0.06647384008937203, 'bear_tp_mult': 2.0840893591812453, 'bear_tsl_mult': 0.8751375505403064, 'bear_time_stop': 68, 'bear_use_sma': False, 'bear_use_ema': True, 'bear_use_atr': True, 'bear_use_adx': True, 'bear_use_spike': True, 'bear_rsi_required': False, 'sideways_strategy': 'breakout', 'sideways_bb_std_mult': 2.0969573511259956, 'sideways_rsi_os': 29, 'sideways_rsi_ob': 64, 'sideways_adx_thresh': 11.949128980422882, 'sideways_atr_min_pct': 0.005428270330762117, 'sideways_atr_max_pct': 0.06844993709219699, 'sideways_tp_mult': 2.581663809133419, 'sideways_tsl_mult': 0.20757757537366728, 'sideways_time_stop': 227, 'sideways_use_sma': False, 'sideways_use_ema': False, 'sideways_use_atr': False, 'sideways_use_adx': True, 'sideways_use_spike': False, 'sideways_rsi_required': True}.
