[I 2025-08-31 10:32:12,189] Trial 330 finished with values: [-1000000000.0, 1000000000.0] and parameters: {'p_sma': 21, 'p_std': 34, 'p_atr': 22, 'p_adx': 22, 'rsi_period': 46, 'ema1': 13, 'ema2': 59, 'slip_atr_k': 0.06891905524985364, 'slip_spread_k': 0.39216682084289983, 'spread_hl_frac': 0.0071802546320476855, 'bb_std_mult': 2.3571614513443633, 'rsi_os': 40, 'rsi_ob': 90, 'vol_spike': 0.017942462385948293, 'adx_thresh': 12.535928818176611, 'atr_min_pct': 0.02069207052464599, 'atr_max_pct': 0.0384637841595138, 'tp_mult': 2.753228424253607, 'tsl_mult': 0.15651995721739936, 'strategy': 'mean_reversion', 'time_stop': 142, 'use_sma': False, 'use_atr': False, 'use_adx': True, 'use_ema': False, 'use_spike': True, 'rsi_required': True, 'edge_k': 0.49115147248251767, 'edge_cap': 0.6282694414178749, 'bull_strategy': 'breakout', 'bull_bb_std_mult': 1.5039470663666723, 'bull_rsi_os': 42, 'bull_rsi_ob': 74, 'bull_adx_thresh': 10.808864478480057, 'bull_atr_min_pct': 0.003359987609593553, 'bull_atr_max_pct': 0.045935408066677494, 'bull_tp_mult': 1.0692687050686809, 'bull_tsl_mult': 0.12112860797789946, 'bull_time_stop': 18, 'bull_use_sma': True, 'bull_use_ema': True, 'bull_use_atr': True, 'bull_use_adx': False, 'bull_use_spike': True, 'bull_rsi_required': False, 'bear_strategy': 'breakout', 'bear_bb_std_mult': 0.8191377341222528, 'bear_rsi_os': 28, 'bear_rsi_ob': 58, 'bear_adx_thresh': 5.958407080772675, 'bear_atr_min_pct': 0.025905626883799653, 'bear_atr_max_pct': 0.1272503647062125, 'bear_tp_mult': 1.342397082394605, 'bear_tsl_mult': 0.16956689982849338, 'bear_time_stop': 41, 'bear_use_sma': False, 'bear_use_ema': False, 'bear_use_atr': True, 'bear_use_adx': True, 'bear_use_spike': True, 'bear_rsi_required': False, 'sideways_strategy': 'breakout', 'sideways_bb_std_mult': 2.448421632836883, 'sideways_rsi_os': 36, 'sideways_rsi_ob': 83, 'sideways_adx_thresh': 19.795574481598656, 'sideways_atr_min_pct': 0.013587166965670246, 'sideways_atr_max_pct': 0.013438624855479378, 'sideways_tp_mult': 1.0804510048695573, 'sideways_tsl_mult': 0.1579530953816538, 'sideways_time_stop': 257, 'sideways_use_sma': True, 'sideways_use_ema': False, 'sideways_use_atr': False, 'sideways_use_adx': False, 'sideways_use_spike': True, 'sideways_rsi_required': False}.
[I 2025-08-31 10:32:44,148] Trial 336 finished with values: [-1000000000.0, 1000000000.0] and parameters: {'p_sma': 18, 'p_std': 6, 'p_atr': 21, 'p_adx': 8, 'rsi_period': 71, 'ema1': 25, 'ema2': 59, 'slip_atr_k': 0.24045830168018667, 'slip_spread_k': 0.2749565989322501, 'spread_hl_frac': 0.028441138085821684, 'bb_std_mult': 2.4575668402363955, 'rsi_os': 45, 'rsi_ob': 74, 'vol_spike': 0.017224262135454027, 'adx_thresh': 7.792368163967221, 'atr_min_pct': 0.01879771823057747, 'atr_max_pct': 0.08682184436254288, 'tp_mult': 1.010375205017815, 'tsl_mult': 0.7672060270423413, 'strategy': 'breakout', 'time_stop': 260, 'use_sma': False, 'use_atr': False, 'use_adx': True, 'use_ema': False, 'use_spike': True, 'rsi_required': True, 'edge_k': 1.7053051019546501, 'edge_cap': 0.5194097623954163, 'bull_strategy': 'mean_reversion', 'bull_bb_std_mult': 1.0499662848262525, 'bull_rsi_os': 43, 'bull_rsi_ob': 74, 'bull_adx_thresh': 8.749191743603104, 'bull_atr_min_pct': 0.012999577117399937, 'bull_atr_max_pct': 0.10398655135096228, 'bull_tp_mult': 1.2104526817130303, 'bull_tsl_mult': 0.07456201969843582, 'bull_time_stop': 5, 'bull_use_sma': True, 'bull_use_ema': True, 'bull_use_atr': True, 'bull_use_adx': True, 'bull_use_spike': True, 'bull_rsi_required': False, 'bear_strategy': 'breakout', 'bear_bb_std_mult': 1.8385068311836092, 'bear_rsi_os': 31, 'bear_rsi_ob': 66, 'bear_adx_thresh': 25.0270342883655, 'bear_atr_min_pct': 0.015878349841190183, 'bear_atr_max_pct': 0.11845542995496278, 'bear_tp_mult': 2.5188893730102975, 'bear_tsl_mult': 0.1512853329818635, 'bear_time_stop': 30, 'bear_use_sma': False, 'bear_use_ema': False, 'bear_use_atr': True, 'bear_use_adx': False, 'bear_use_spike': True, 'bear_rsi_required': True, 'sideways_strategy': 'breakout', 'sideways_bb_std_mult': 2.024563215618843, 'sideways_rsi_os': 32, 'sideways_rsi_ob': 84, 'sideways_adx_thresh': 27.272812031037795, 'sideways_atr_min_pct': 0.013687942342492225, 'sideways_atr_max_pct': 0.09834856087457544, 'sideways_tp_mult': 1.6485788657548284, 'sideways_tsl_mult': 0.8188921768572169, 'sideways_time_stop': 273, 'sideways_use_sma': True, 'sideways_use_ema': False, 'sideways_use_atr': True, 'sideways_use_adx': False, 'sideways_use_spike': True, 'sideways_rsi_required': False}.
[I 2025-08-31 10:32:44,602] Trial 334 finished with values: [-1000000000.0, 1000000000.0] and parameters: {'p_sma': 46, 'p_std': 34, 'p_atr': 22, 'p_adx': 7, 'rsi_period': 47, 'ema1': 25, 'ema2': 57, 'slip_atr_k': 0.16242764946464192, 'slip_spread_k': 0.27090843047941837, 'spread_hl_frac': 0.04110705675799728, 'bb_std_mult': 2.6578764814106632, 'rsi_os': 45, 'rsi_ob': 77, 'vol_spike': 0.2466876101291815, 'adx_thresh': 24.054182532068246, 'atr_min_pct': 0.01908113666809466, 'atr_max_pct': 0.08796375341448925, 'tp_mult': 1.9358625520323895, 'tsl_mult': 0.7100520927706087, 'strategy': 'mean_reversion', 'time_stop': 157, 'use_sma': False, 'use_atr': False, 'use_adx': True, 'use_ema': False, 'use_spike': True, 'rsi_required': True, 'edge_k': 1.6310548576180457, 'edge_cap': 0.7282554447104467, 'bull_strategy': 'breakout', 'bull_bb_std_mult': 0.9549521591106808, 'bull_rsi_os': 43, 'bull_rsi_ob': 74, 'bull_adx_thresh': 11.017999323366602, 'bull_atr_min_pct': 0.012951880138469827, 'bull_atr_max_pct': 0.07365227250281642, 'bull_tp_mult': 1.0689304172429537, 'bull_tsl_mult': 0.13921068579833884, 'bull_time_stop': 210, 'bull_use_sma': True, 'bull_use_ema': True, 'bull_use_atr': True, 'bull_use_adx': False, 'bull_use_spike': True, 'bull_rsi_required': False, 'bear_strategy': 'mean_reversion', 'bear_bb_std_mult': 1.8615833723132567, 'bear_rsi_os': 31, 'bear_rsi_ob': 48, 'bear_adx_thresh': 29.00166626102541, 'bear_atr_min_pct': 0.01884536111403975, 'bear_atr_max_pct': 0.11898221220455472, 'bear_tp_mult': 2.7063289850052645, 'bear_tsl_mult': 0.15189055213984462, 'bear_time_stop': 39, 'bear_use_sma': True, 'bear_use_ema': False, 'bear_use_atr': True, 'bear_use_adx': False, 'bear_use_spike': True, 'bear_rsi_required': False, 'sideways_strategy': 'breakout', 'sideways_bb_std_mult': 2.5959723495864075, 'sideways_rsi_os': 39, 'sideways_rsi_ob': 85, 'sideways_adx_thresh': 10.254995900075992, 'sideways_atr_min_pct': 0.004463833500909235, 'sideways_atr_max_pct': 0.019372989043823674, 'sideways_tp_mult': 2.883085118337468, 'sideways_tsl_mult': 0.8234251996695893, 'sideways_time_stop': 265, 'sideways_use_sma': False, 'sideways_use_ema': False, 'sideways_use_atr': True, 'sideways_use_adx': True, 'sideways_use_spike': True, 'sideways_rsi_required': False}.
[I 2025-08-31 10:32:44,730] Trial 335 finished with values: [-0.011856188154211522, 0.011742113271352581] and parameters: {'p_sma': 22, 'p_std': 34, 'p_atr': 21, 'p_adx': 8, 'rsi_period': 26, 'ema1': 13, 'ema2': 58, 'slip_atr_k': 0.06407830884690832, 'slip_spread_k': 0.2742127869808414, 'spread_hl_frac': 0.04115825985797014, 'bb_std_mult': 2.710454211580645, 'rsi_os': 6, 'rsi_ob': 91, 'vol_spike': 0.23175657405774452, 'adx_thresh': 7.567804797698865, 'atr_min_pct': 0.0190425343211102, 'atr_max_pct': 0.1289113435978182, 'tp_mult': 1.8794208901466236, 'tsl_mult': 0.6405523563640323, 'strategy': 'breakout', 'time_stop': 158, 'use_sma': False, 'use_atr': False, 'use_adx': True, 'use_ema': False, 'use_spike': True, 'rsi_required': True, 'edge_k': 1.7133251720300324, 'edge_cap': 0.17865011896694857, 'bull_strategy': 'breakout', 'bull_bb_std_mult': 1.5045813728597666, 'bull_rsi_os': 43, 'bull_rsi_ob': 72, 'bull_adx_thresh': 11.582949692625544, 'bull_atr_min_pct': 0.0022545479181788042, 'bull_atr_max_pct': 0.0886025832838632, 'bull_tp_mult': 1.22041451426581, 'bull_tsl_mult': 0.07476699381038815, 'bull_time_stop': 5, 'bull_use_sma': True, 'bull_use_ema': True, 'bull_use_atr': True, 'bull_use_adx': True, 'bull_use_spike': True, 'bull_rsi_required': False, 'bear_strategy': 'mean_reversion', 'bear_bb_std_mult': 1.7649783269839787, 'bear_rsi_os': 30, 'bear_rsi_ob': 60, 'bear_adx_thresh': 31.478757391852668, 'bear_atr_min_pct': 0.015628886992321407, 'bear_atr_max_pct': 0.09608003986227834, 'bear_tp_mult': 1.120292148725791, 'bear_tsl_mult': 0.14872713738723148, 'bear_time_stop': 41, 'bear_use_sma': False, 'bear_use_ema': False, 'bear_use_atr': True, 'bear_use_adx': False, 'bear_use_spike': True, 'bear_rsi_required': True, 'sideways_strategy': 'breakout', 'sideways_bb_std_mult': 3.371887956128494, 'sideways_rsi_os': 49, 'sideways_rsi_ob': 85, 'sideways_adx_thresh': 9.390589788454953, 'sideways_atr_min_pct': 0.009127602412778851, 'sideways_atr_max_pct': 0.015081802944241378, 'sideways_tp_mult': 1.0852691154078546, 'sideways_tsl_mult': 0.8212372850204919, 'sideways_time_stop': 266, 'sideways_use_sma': False, 'sideways_use_ema': False, 'sideways_use_atr': True, 'sideways_use_adx': False, 'sideways_use_spike': True, 'sideways_rsi_required': False}.
[I 2025-08-31 10:32:44,819] Trial 337 finished with values: [-1000000000.0, 1000000000.0] and parameters: {'p_sma': 46, 'p_std': 34, 'p_atr': 10, 'p_adx': 8, 'rsi_period': 52, 'ema1': 24, 'ema2': 58, 'slip_atr_k': 0.061138881717872906, 'slip_spread_k': 0.2685964040251546, 'spread_hl_frac': 0.028794819115007135, 'bb_std_mult': 2.464223718808658, 'rsi_os': 45, 'rsi_ob': 77, 'vol_spike': 0.2997116609196871, 'adx_thresh': 7.626276181201022, 'atr_min_pct': 0.00578052399706935, 'atr_max_pct': 0.043630682530610934, 'tp_mult': 1.8751136420395114, 'tsl_mult': 0.6424079976058388, 'strategy': 'breakout', 'time_stop': 153, 'use_sma': False, 'use_atr': False, 'use_adx': True, 'use_ema': False, 'use_spike': True, 'rsi_required': True, 'edge_k': 1.6905089533374824, 'edge_cap': 0.31530040021018635, 'bull_strategy': 'mean_reversion', 'bull_bb_std_mult': 3.5366571682914727, 'bull_rsi_os': 43, 'bull_rsi_ob': 76, 'bull_adx_thresh': 11.571790776881086, 'bull_atr_min_pct': 0.004655063644082427, 'bull_atr_max_pct': 0.08840790875643054, 'bull_tp_mult': 1.2100241630675148, 'bull_tsl_mult': 0.07072530279660065, 'bull_time_stop': 209, 'bull_use_sma': True, 'bull_use_ema': True, 'bull_use_atr': True, 'bull_use_adx': True, 'bull_use_spike': True, 'bull_rsi_required': False, 'bear_strategy': 'breakout', 'bear_bb_std_mult': 3.3149653795529836, 'bear_rsi_os': 25, 'bear_rsi_ob': 56, 'bear_adx_thresh': 20.027322036531082, 'bear_atr_min_pct': 0.01586050745035664, 'bear_atr_max_pct': 0.11991340097828677, 'bear_tp_mult': 2.5510210634424775, 'bear_tsl_mult': 0.14717556471865975, 'bear_time_stop': 30, 'bear_use_sma': False, 'bear_use_ema': False, 'bear_use_atr': True, 'bear_use_adx': False, 'bear_use_spike': True, 'bear_rsi_required': True, 'sideways_strategy': 'breakout', 'sideways_bb_std_mult': 3.570347400471511, 'sideways_rsi_os': 45, 'sideways_rsi_ob': 84, 'sideways_adx_thresh': 10.357632457707357, 'sideways_atr_min_pct': 0.0023663704455762166, 'sideways_atr_max_pct': 0.09866612626475699, 'sideways_tp_mult': 1.1762768242325552, 'sideways_tsl_mult': 0.8092318428457945, 'sideways_time_stop': 274, 'sideways_use_sma': False, 'sideways_use_ema': False, 'sideways_use_atr': True, 'sideways_use_adx': False, 'sideways_use_spike': True, 'sideways_rsi_required': False}.
[I 2025-08-31 10:33:15,725] Trial 338 finished with values: [-1000000000.0, 1000000000.0] and parameters: {'p_sma': 23, 'p_std': 34, 'p_atr': 24, 'p_adx': 17, 'rsi_period': 25, 'ema1': 24, 'ema2': 58, 'slip_atr_k': 0.06428639582983284, 'slip_spread_k': 0.2575921045050939, 'spread_hl_frac': 0.02907377660802222, 'bb_std_mult': 2.6488144896274317, 'rsi_os': 42, 'rsi_ob': 77, 'vol_spike': 0.23180167069294882, 'adx_thresh': 29.874750764302696, 'atr_min_pct': 0.014426740781065431, 'atr_max_pct': 0.04354726208420207, 'tp_mult': 1.6665339702132358, 'tsl_mult': 0.6360276913747132, 'strategy': 'mean_reversion', 'time_stop': 217, 'use_sma': False, 'use_atr': False, 'use_adx': False, 'use_ema': False, 'use_spike': False, 'rsi_required': False, 'edge_k': 0.8861551799028974, 'edge_cap': 0.14468593353872805, 'bull_strategy': 'breakout', 'bull_bb_std_mult': 2.441056552306364, 'bull_rsi_os': 43, 'bull_rsi_ob': 76, 'bull_adx_thresh': 15.76237800782931, 'bull_atr_min_pct': 0.0045398087714470115, 'bull_atr_max_pct': 0.08186138429008775, 'bull_tp_mult': 1.1818924258825385, 'bull_tsl_mult': 0.09432433820347892, 'bull_time_stop': 11, 'bull_use_sma': True, 'bull_use_ema': True, 'bull_use_atr': True, 'bull_use_adx': True, 'bull_use_spike': False, 'bull_rsi_required': False, 'bear_strategy': 'breakout', 'bear_bb_std_mult': 2.1728603690440687, 'bear_rsi_os': 30, 'bear_rsi_ob': 60, 'bear_adx_thresh': 9.36815878200473, 'bear_atr_min_pct': 0.016897596842533842, 'bear_atr_max_pct': 0.01374965760057445, 'bear_tp_mult': 1.8980733802572645, 'bear_tsl_mult': 0.5477972053403178, 'bear_time_stop': 204, 'bear_use_sma': False, 'bear_use_ema': False, 'bear_use_atr': True, 'bear_use_adx': False, 'bear_use_spike': False, 'bear_rsi_required': True, 'sideways_strategy': 'mean_reversion', 'sideways_bb_std_mult': 3.345356069283056, 'sideways_rsi_os': 35, 'sideways_rsi_ob': 75, 'sideways_adx_thresh': 5.722499332060332, 'sideways_atr_min_pct': 0.008961905112872816, 'sideways_atr_max_pct': 0.01571816452676318, 'sideways_tp_mult': 1.1617899300806585, 'sideways_tsl_mult': 0.7882400925289805, 'sideways_time_stop': 265, 'sideways_use_sma': False, 'sideways_use_ema': False, 'sideways_use_atr': False, 'sideways_use_adx': False, 'sideways_use_spike': False, 'sideways_rsi_required': False}.
[I 2025-08-31 10:33:17,413] Trial 341 finished with values: [-1000000000.0, 1000000000.0] and parameters: {'p_sma': 27, 'p_std': 37, 'p_atr': 11, 'p_adx': 19, 'rsi_period': 24, 'ema1': 12, 'ema2': 52, 'slip_atr_k': 0.07901719588477484, 'slip_spread_k': 0.7206826880913477, 'spread_hl_frac': 0.02968796173503218, 'bb_std_mult': 2.8613843593413586, 'rsi_os': 47, 'rsi_ob': 70, 'vol_spike': 0.0011263911224141665, 'adx_thresh': 18.409835808119944, 'atr_min_pct': 0.02022045380800139, 'atr_max_pct': 0.113765299429754, 'tp_mult': 1.6511276607180259, 'tsl_mult': 0.6703361049513166, 'strategy': 'mean_reversion', 'time_stop': 97, 'use_sma': True, 'use_atr': True, 'use_adx': False, 'use_ema': True, 'use_spike': False, 'rsi_required': False, 'edge_k': 1.8233652871407917, 'edge_cap': 0.14432844980925713, 'bull_strategy': 'breakout', 'bull_bb_std_mult': 3.106858629098673, 'bull_rsi_os': 41, 'bull_rsi_ob': 75, 'bull_adx_thresh': 9.73454797824661, 'bull_atr_min_pct': 0.005136178307500787, 'bull_atr_max_pct': 0.08157111943011003, 'bull_tp_mult': 1.1637193937356929, 'bull_tsl_mult': 0.09776512122729084, 'bull_time_stop': 221, 'bull_use_sma': False, 'bull_use_ema': True, 'bull_use_atr': False, 'bull_use_adx': True, 'bull_use_spike': False, 'bull_rsi_required': False, 'bear_strategy': 'breakout', 'bear_bb_std_mult': 2.156506840788942, 'bear_rsi_os': 29, 'bear_rsi_ob': 57, 'bear_adx_thresh': 7.031401619920085, 'bear_atr_min_pct': 0.016652258427103044, 'bear_atr_max_pct': 0.04593269253990443, 'bear_tp_mult': 2.6425349728852177, 'bear_tsl_mult': 0.9477495229453698, 'bear_time_stop': 22, 'bear_use_sma': False, 'bear_use_ema': True, 'bear_use_atr': False, 'bear_use_adx': False, 'bear_use_spike': False, 'bear_rsi_required': True, 'sideways_strategy': 'mean_reversion', 'sideways_bb_std_mult': 1.534843333862797, 'sideways_rsi_os': 34, 'sideways_rsi_ob': 81, 'sideways_adx_thresh': 13.887438080805357, 'sideways_atr_min_pct': 0.0024496927091530877, 'sideways_atr_max_pct': 0.015891885185033195, 'sideways_tp_mult': 2.2978971660348027, 'sideways_tsl_mult': 0.7862042333023501, 'sideways_time_stop': 123, 'sideways_use_sma': True, 'sideways_use_ema': True, 'sideways_use_atr': False, 'sideways_use_adx': False, 'sideways_use_spike': False, 'sideways_rsi_required': True}.
[I 2025-08-31 10:33:17,659] Trial 339 finished with values: [-1000000000.0, 1000000000.0] and parameters: {'p_sma': 53, 'p_std': 33, 'p_atr': 17, 'p_adx': 19, 'rsi_period': 23, 'ema1': 30, 'ema2': 50, 'slip_atr_k': 0.05728304422319505, 'slip_spread_k': 0.6918502660678155, 'spread_hl_frac': 0.0291004085400661, 'bb_std_mult': 3.0129374591907983, 'rsi_os': 42, 'rsi_ob': 70, 'vol_spike': 0.2140063273907432, 'adx_thresh': 16.097934996437026, 'atr_min_pct': 0.005861456019995362, 'atr_max_pct': 0.042600341726737066, 'tp_mult': 1.980530256610089, 'tsl_mult': 0.6235864570157776, 'strategy': 'mean_reversion', 'time_stop': 150, 'use_sma': True, 'use_atr': True, 'use_adx': False, 'use_ema': True, 'use_spike': False, 'rsi_required': False, 'edge_k': 0.20355309338427507, 'edge_cap': 0.14452890721106806, 'bull_strategy': 'mean_reversion', 'bull_bb_std_mult': 2.423598691490829, 'bull_rsi_os': 42, 'bull_rsi_ob': 76, 'bull_adx_thresh': 34.53649153841553, 'bull_atr_min_pct': 0.004482736306471485, 'bull_atr_max_pct': 0.06765126520905232, 'bull_tp_mult': 1.177480450738233, 'bull_tsl_mult': 0.09387995346983621, 'bull_time_stop': 221, 'bull_use_sma': False, 'bull_use_ema': True, 'bull_use_atr': False, 'bull_use_adx': True, 'bull_use_spike': False, 'bull_rsi_required': False, 'bear_strategy': 'breakout', 'bear_bb_std_mult': 2.1502858324520955, 'bear_rsi_os': 12, 'bear_rsi_ob': 57, 'bear_adx_thresh': 8.169889725227982, 'bear_atr_min_pct': 0.016809723078613004, 'bear_atr_max_pct': 0.047048986949376245, 'bear_tp_mult': 2.6479146637709374, 'bear_tsl_mult': 0.5437533161065213, 'bear_time_stop': 110, 'bear_use_sma': False, 'bear_use_ema': True, 'bear_use_atr': True, 'bear_use_adx': False, 'bear_use_spike': False, 'bear_rsi_required': True, 'sideways_strategy': 'mean_reversion', 'sideways_bb_std_mult': 2.747668265679845, 'sideways_rsi_os': 33, 'sideways_rsi_ob': 64, 'sideways_adx_thresh': 12.130269455626866, 'sideways_atr_min_pct': 0.0023870849213550424, 'sideways_atr_max_pct': 0.016308315307770063, 'sideways_tp_mult': 1.1476452550965066, 'sideways_tsl_mult': 0.5638784559504006, 'sideways_time_stop': 253, 'sideways_use_sma': True, 'sideways_use_ema': True, 'sideways_use_atr': False, 'sideways_use_adx': False, 'sideways_use_spike': False, 'sideways_rsi_required': True}.
[I 2025-08-31 10:33:17,900] Trial 340 finished with values: [-1000000000.0, 1000000000.0] and parameters: {'p_sma': 31, 'p_std': 33, 'p_atr': 10, 'p_adx': 7, 'rsi_period': 36, 'ema1': 12, 'ema2': 58, 'slip_atr_k': 0.05881984707042752, 'slip_spread_k': 0.1927924375340907, 'spread_hl_frac': 0.029084748454073585, 'bb_std_mult': 2.193605647518109, 'rsi_os': 42, 'rsi_ob': 85, 'vol_spike': 0.2993673410744565, 'adx_thresh': 5.976820243183701, 'atr_min_pct': 0.014512240514905034, 'atr_max_pct': 0.043401180729927595, 'tp_mult': 2.039467295889219, 'tsl_mult': 0.6275206125340076, 'strategy': 'mean_reversion', 'time_stop': 98, 'use_sma': True, 'use_atr': True, 'use_adx': False, 'use_ema': True, 'use_spike': False, 'rsi_required': False, 'edge_k': 1.8205697566691506, 'edge_cap': 0.8266761865197059, 'bull_strategy': 'mean_reversion', 'bull_bb_std_mult': 2.4010580345454717, 'bull_rsi_os': 42, 'bull_rsi_ob': 58, 'bull_adx_thresh': 9.50324224813043, 'bull_atr_min_pct': 0.004509818948788028, 'bull_atr_max_pct': 0.06803014071394621, 'bull_tp_mult': 1.1767558408190166, 'bull_tsl_mult': 0.31771212508745883, 'bull_time_stop': 220, 'bull_use_sma': False, 'bull_use_ema': True, 'bull_use_atr': False, 'bull_use_adx': True, 'bull_use_spike': False, 'bull_rsi_required': False, 'bear_strategy': 'breakout', 'bear_bb_std_mult': 2.145850030325141, 'bear_rsi_os': 27, 'bear_rsi_ob': 85, 'bear_adx_thresh': 9.320788568861017, 'bear_atr_min_pct': 0.016649866126926264, 'bear_atr_max_pct': 0.022415826461173037, 'bear_tp_mult': 2.6446701439674696, 'bear_tsl_mult': 0.9612390645454134, 'bear_time_stop': 205, 'bear_use_sma': False, 'bear_use_ema': True, 'bear_use_atr': True, 'bear_use_adx': False, 'bear_use_spike': False, 'bear_rsi_required': True, 'sideways_strategy': 'mean_reversion', 'sideways_bb_std_mult': 2.7447741053237835, 'sideways_rsi_os': 45, 'sideways_rsi_ob': 81, 'sideways_adx_thresh': 17.013015596090728, 'sideways_atr_min_pct': 0.01880644801271312, 'sideways_atr_max_pct': 0.016123763851080972, 'sideways_tp_mult': 1.1730190477098157, 'sideways_tsl_mult': 0.2859834552116858, 'sideways_time_stop': 275, 'sideways_use_sma': True, 'sideways_use_ema': True, 'sideways_use_atr': False, 'sideways_use_adx': False, 'sideways_use_spike': False, 'sideways_rsi_required': True}.
