[I 2025-08-31 11:00:29,963] Trial 560 finished with values: [0.004156932835684968, 0.002646066435736254] and parameters: {'p_sma': 33, 'p_std': 17, 'p_atr': 26, 'p_adx': 20, 'rsi_period': 35, 'ema1': 5, 'ema2': 17, 'slip_atr_k': 0.019265215113105225, 'slip_spread_k': 0.4912018742810731, 'spread_hl_frac': 0.023119341403319414, 'bb_std_mult': 0.7621312411051392, 'rsi_os': 28, 'rsi_ob': 79, 'vol_spike': 0.09218148832878274, 'adx_thresh': 10.613835573202628, 'atr_min_pct': 0.02143106992369438, 'atr_max_pct': 0.04968783165702812, 'tp_mult': 2.931640468740282, 'tsl_mult': 0.049603175022549795, 'strategy': 'breakout', 'time_stop': 63, 'use_sma': True, 'use_atr': True, 'use_adx': False, 'use_ema': True, 'use_spike': False, 'rsi_required': False, 'edge_k': 1.4816797405391156, 'edge_cap': 0.7085511484868641, 'bull_strategy': 'mean_reversion', 'bull_bb_std_mult': 1.8765724888193795, 'bull_rsi_os': 42, 'bull_rsi_ob': 61, 'bull_adx_thresh': 28.147313019220135, 'bull_atr_min_pct': 0.010786282246789142, 'bull_atr_max_pct': 0.037060378731177776, 'bull_tp_mult': 2.950090910278795, 'bull_tsl_mult': 0.25037092686709306, 'bull_time_stop': 46, 'bull_use_sma': False, 'bull_use_ema': True, 'bull_use_atr': False, 'bull_use_adx': True, 'bull_use_spike': False, 'bull_rsi_required': False, 'bear_strategy': 'mean_reversion', 'bear_bb_std_mult': 1.5085814501808752, 'bear_rsi_os': 49, 'bear_rsi_ob': 55, 'bear_adx_thresh': 12.908893973568908, 'bear_atr_min_pct': 0.005911490184032234, 'bear_atr_max_pct': 0.1318455340073179, 'bear_tp_mult': 2.7103252226363126, 'bear_tsl_mult': 0.8326367488531856, 'bear_time_stop': 98, 'bear_use_sma': False, 'bear_use_ema': False, 'bear_use_atr': True, 'bear_use_adx': False, 'bear_use_spike': True, 'bear_rsi_required': False, 'sideways_strategy': 'mean_reversion', 'sideways_bb_std_mult': 1.2049947290162626, 'sideways_rsi_os': 39, 'sideways_rsi_ob': 58, 'sideways_adx_thresh': 25.210608561040754, 'sideways_atr_min_pct': 0.004631171170149913, 'sideways_atr_max_pct': 0.10018612954817052, 'sideways_tp_mult': 1.6877102628359957, 'sideways_tsl_mult': 0.8642461649343933, 'sideways_time_stop': 161, 'sideways_use_sma': True, 'sideways_use_ema': True, 'sideways_use_atr': False, 'sideways_use_adx': False, 'sideways_use_spike': True, 'sideways_rsi_required': False}.
[I 2025-08-31 11:00:30,192] Trial 557 finished with values: [-1000000000.0, 1000000000.0] and parameters: {'p_sma': 43, 'p_std': 20, 'p_atr': 11, 'p_adx': 20, 'rsi_period': 41, 'ema1': 5, 'ema2': 15, 'slip_atr_k': 0.21865014243327757, 'slip_spread_k': 0.2804853032192746, 'spread_hl_frac': 0.022686125550707745, 'bb_std_mult': 2.384090330275351, 'rsi_os': 25, 'rsi_ob': 75, 'vol_spike': 0.22023841810076378, 'adx_thresh': 8.165347842172258, 'atr_min_pct': 0.021262957285640795, 'atr_max_pct': 0.022685674423930283, 'tp_mult': 2.894810598279302, 'tsl_mult': 0.8415099013727527, 'strategy': 'breakout', 'time_stop': 146, 'use_sma': True, 'use_atr': True, 'use_adx': False, 'use_ema': True, 'use_spike': False, 'rsi_required': False, 'edge_k': 0.6728939669221398, 'edge_cap': 0.2550449783489971, 'bull_strategy': 'mean_reversion', 'bull_bb_std_mult': 2.8281028255272473, 'bull_rsi_os': 43, 'bull_rsi_ob': 76, 'bull_adx_thresh': 10.57522669755696, 'bull_atr_min_pct': 0.0041476321363012785, 'bull_atr_max_pct': 0.03500247988111879, 'bull_tp_mult': 2.9175472707783765, 'bull_tsl_mult': 0.09326169764170261, 'bull_time_stop': 41, 'bull_use_sma': False, 'bull_use_ema': True, 'bull_use_atr': False, 'bull_use_adx': True, 'bull_use_spike': False, 'bull_rsi_required': False, 'bear_strategy': 'breakout', 'bear_bb_std_mult': 1.360503051687397, 'bear_rsi_os': 50, 'bear_rsi_ob': 55, 'bear_adx_thresh': 16.22299384945646, 'bear_atr_min_pct': 0.012151447142963392, 'bear_atr_max_pct': 0.13619660355441096, 'bear_tp_mult': 2.8881152742999836, 'bear_tsl_mult': 0.34390192317710166, 'bear_time_stop': 281, 'bear_use_sma': False, 'bear_use_ema': False, 'bear_use_atr': True, 'bear_use_adx': True, 'bear_use_spike': True, 'bear_rsi_required': False, 'sideways_strategy': 'mean_reversion', 'sideways_bb_std_mult': 2.6678362516342973, 'sideways_rsi_os': 39, 'sideways_rsi_ob': 57, 'sideways_adx_thresh': 13.97281619109184, 'sideways_atr_min_pct': 0.005556638427110369, 'sideways_atr_max_pct': 0.09991816053698327, 'sideways_tp_mult': 1.8880840335897793, 'sideways_tsl_mult': 0.8727225882166447, 'sideways_time_stop': 145, 'sideways_use_sma': True, 'sideways_use_ema': True, 'sideways_use_atr': False, 'sideways_use_adx': False, 'sideways_use_spike': True, 'sideways_rsi_required': False}.
[I 2025-08-31 11:00:30,414] Trial 558 finished with values: [-1000000000.0, 1000000000.0] and parameters: {'p_sma': 43, 'p_std': 43, 'p_atr': 26, 'p_adx': 20, 'rsi_period': 38, 'ema1': 21, 'ema2': 14, 'slip_atr_k': 0.00462289381052419, 'slip_spread_k': 0.7491097217979795, 'spread_hl_frac': 0.024364117810961847, 'bb_std_mult': 2.666898732407327, 'rsi_os': 16, 'rsi_ob': 79, 'vol_spike': 0.22116225807231224, 'adx_thresh': 28.82296249315675, 'atr_min_pct': 0.007344981580024837, 'atr_max_pct': 0.0668184971741866, 'tp_mult': 2.887851272507104, 'tsl_mult': 0.9309059849245986, 'strategy': 'breakout', 'time_stop': 145, 'use_sma': False, 'use_atr': True, 'use_adx': False, 'use_ema': True, 'use_spike': False, 'rsi_required': False, 'edge_k': 1.754858806540515, 'edge_cap': 0.1941454186996615, 'bull_strategy': 'breakout', 'bull_bb_std_mult': 2.5489468697730766, 'bull_rsi_os': 43, 'bull_rsi_ob': 77, 'bull_adx_thresh': 9.96998991845181, 'bull_atr_min_pct': 0.003941849185048366, 'bull_atr_max_pct': 0.143250225935825, 'bull_tp_mult': 2.7251076361106894, 'bull_tsl_mult': 0.2831748453555002, 'bull_time_stop': 44, 'bull_use_sma': False, 'bull_use_ema': True, 'bull_use_atr': False, 'bull_use_adx': True, 'bull_use_spike': False, 'bull_rsi_required': False, 'bear_strategy': 'breakout', 'bear_bb_std_mult': 1.3840455769115343, 'bear_rsi_os': 50, 'bear_rsi_ob': 87, 'bear_adx_thresh': 13.099263419328125, 'bear_atr_min_pct': 0.005594244886919493, 'bear_atr_max_pct': 0.13143540461542141, 'bear_tp_mult': 2.8924294885754644, 'bear_tsl_mult': 0.41945863047024395, 'bear_time_stop': 22, 'bear_use_sma': False, 'bear_use_ema': False, 'bear_use_atr': True, 'bear_use_adx': True, 'bear_use_spike': True, 'bear_rsi_required': False, 'sideways_strategy': 'mean_reversion', 'sideways_bb_std_mult': 1.8380164552069431, 'sideways_rsi_os': 53, 'sideways_rsi_ob': 57, 'sideways_adx_thresh': 24.475775203726307, 'sideways_atr_min_pct': 0.004326771237258229, 'sideways_atr_max_pct': 0.08547923333677444, 'sideways_tp_mult': 2.022892980737068, 'sideways_tsl_mult': 0.6351679504855517, 'sideways_time_stop': 265, 'sideways_use_sma': True, 'sideways_use_ema': True, 'sideways_use_atr': False, 'sideways_use_adx': False, 'sideways_use_spike': True, 'sideways_rsi_required': False}.
[I 2025-08-31 11:01:03,288] Trial 561 finished with values: [0.003514968120205131, 0.002976675007823209] and parameters: {'p_sma': 40, 'p_std': 17, 'p_atr': 23, 'p_adx': 20, 'rsi_period': 36, 'ema1': 5, 'ema2': 15, 'slip_atr_k': 0.020428863887484498, 'slip_spread_k': 0.48776286703137967, 'spread_hl_frac': 0.022226910637062315, 'bb_std_mult': 0.7578216693481177, 'rsi_os': 53, 'rsi_ob': 75, 'vol_spike': 0.08328402873440591, 'adx_thresh': 9.734506113974861, 'atr_min_pct': 0.021097943935969535, 'atr_max_pct': 0.04300701948609373, 'tp_mult': 2.970105093746607, 'tsl_mult': 0.07468404620920904, 'strategy': 'breakout', 'time_stop': 62, 'use_sma': True, 'use_atr': True, 'use_adx': False, 'use_ema': True, 'use_spike': False, 'rsi_required': False, 'edge_k': 1.4920640256148547, 'edge_cap': 0.6701888059498213, 'bull_strategy': 'mean_reversion', 'bull_bb_std_mult': 2.0796173838989818, 'bull_rsi_os': 42, 'bull_rsi_ob': 77, 'bull_adx_thresh': 28.283392939237647, 'bull_atr_min_pct': 0.011165117573002332, 'bull_atr_max_pct': 0.03420398713072054, 'bull_tp_mult': 2.9899369783443293, 'bull_tsl_mult': 0.6546842623758814, 'bull_time_stop': 48, 'bull_use_sma': False, 'bull_use_ema': True, 'bull_use_atr': False, 'bull_use_adx': True, 'bull_use_spike': False, 'bull_rsi_required': False, 'bear_strategy': 'mean_reversion', 'bear_bb_std_mult': 1.5161361334728074, 'bear_rsi_os': 48, 'bear_rsi_ob': 55, 'bear_adx_thresh': 19.67631769542884, 'bear_atr_min_pct': 0.005925635527347614, 'bear_atr_max_pct': 0.13153885897560386, 'bear_tp_mult': 2.7107248661974324, 'bear_tsl_mult': 0.7649878182787943, 'bear_time_stop': 96, 'bear_use_sma': False, 'bear_use_ema': False, 'bear_use_atr': True, 'bear_use_adx': False, 'bear_use_spike': True, 'bear_rsi_required': False, 'sideways_strategy': 'mean_reversion', 'sideways_bb_std_mult': 1.194998412358625, 'sideways_rsi_os': 40, 'sideways_rsi_ob': 55, 'sideways_adx_thresh': 10.558119792425183, 'sideways_atr_min_pct': 0.004382521621242859, 'sideways_atr_max_pct': 0.10179575156549417, 'sideways_tp_mult': 1.8225899422009075, 'sideways_tsl_mult': 0.8642781617057632, 'sideways_time_stop': 147, 'sideways_use_sma': True, 'sideways_use_ema': True, 'sideways_use_atr': False, 'sideways_use_adx': False, 'sideways_use_spike': True, 'sideways_rsi_required': False}.
[I 2025-08-31 11:01:03,823] Trial 564 finished with values: [-0.0026940876823736692, 0.006916680370023845] and parameters: {'p_sma': 34, 'p_std': 16, 'p_atr': 27, 'p_adx': 21, 'rsi_period': 32, 'ema1': 5, 'ema2': 17, 'slip_atr_k': 0.028102427627988785, 'slip_spread_k': 0.4899620223863133, 'spread_hl_frac': 0.02104002042931213, 'bb_std_mult': 0.7513684283342412, 'rsi_os': 28, 'rsi_ob': 80, 'vol_spike': 0.09317833277451269, 'adx_thresh': 11.82058987760663, 'atr_min_pct': 0.022446493265486096, 'atr_max_pct': 0.05396579656930517, 'tp_mult': 2.947969252763797, 'tsl_mult': 0.12759188672339272, 'strategy': 'breakout', 'time_stop': 66, 'use_sma': True, 'use_atr': True, 'use_adx': False, 'use_ema': True, 'use_spike': False, 'rsi_required': False, 'edge_k': 1.3933030361065246, 'edge_cap': 0.7031942204177828, 'bull_strategy': 'mean_reversion', 'bull_bb_std_mult': 1.917518859091093, 'bull_rsi_os': 41, 'bull_rsi_ob': 62, 'bull_adx_thresh': 28.265558365879166, 'bull_atr_min_pct': 0.010891524143798006, 'bull_atr_max_pct': 0.03183691410588794, 'bull_tp_mult': 2.985215991494661, 'bull_tsl_mult': 0.2624398996050294, 'bull_time_stop': 43, 'bull_use_sma': False, 'bull_use_ema': True, 'bull_use_atr': False, 'bull_use_adx': True, 'bull_use_spike': False, 'bull_rsi_required': False, 'bear_strategy': 'mean_reversion', 'bear_bb_std_mult': 1.7043617203764123, 'bear_rsi_os': 47, 'bear_rsi_ob': 56, 'bear_adx_thresh': 11.378069870888327, 'bear_atr_min_pct': 0.005620055618636448, 'bear_atr_max_pct': 0.13056823874485124, 'bear_tp_mult': 2.719476985604623, 'bear_tsl_mult': 0.8491018922194821, 'bear_time_stop': 118, 'bear_use_sma': False, 'bear_use_ema': False, 'bear_use_atr': True, 'bear_use_adx': False, 'bear_use_spike': True, 'bear_rsi_required': False, 'sideways_strategy': 'mean_reversion', 'sideways_bb_std_mult': 1.2012284650988843, 'sideways_rsi_os': 40, 'sideways_rsi_ob': 58, 'sideways_adx_thresh': 25.24844759837538, 'sideways_atr_min_pct': 0.004182929796322968, 'sideways_atr_max_pct': 0.10215829876245558, 'sideways_tp_mult': 1.648523530785388, 'sideways_tsl_mult': 0.8482456873438107, 'sideways_time_stop': 161, 'sideways_use_sma': True, 'sideways_use_ema': True, 'sideways_use_atr': False, 'sideways_use_adx': False, 'sideways_use_spike': True, 'sideways_rsi_required': False}.
[I 2025-08-31 11:01:04,278] Trial 562 finished with values: [-0.0034072814974813737, 0.005554380856724476] and parameters: {'p_sma': 34, 'p_std': 16, 'p_atr': 27, 'p_adx': 20, 'rsi_period': 31, 'ema1': 5, 'ema2': 17, 'slip_atr_k': 0.03130803534908731, 'slip_spread_k': 0.49603100053468574, 'spread_hl_frac': 0.021010343575873898, 'bb_std_mult': 0.7631431086006265, 'rsi_os': 28, 'rsi_ob': 80, 'vol_spike': 0.09640577808585812, 'adx_thresh': 11.660452964031245, 'atr_min_pct': 0.022099765998918303, 'atr_max_pct': 0.05384983788881607, 'tp_mult': 2.9503571585356356, 'tsl_mult': 0.12829162098538469, 'strategy': 'breakout', 'time_stop': 62, 'use_sma': True, 'use_atr': True, 'use_adx': False, 'use_ema': True, 'use_spike': False, 'rsi_required': False, 'edge_k': 1.5070819460803555, 'edge_cap': 0.7141679523455522, 'bull_strategy': 'mean_reversion', 'bull_bb_std_mult': 1.878021024150758, 'bull_rsi_os': 41, 'bull_rsi_ob': 61, 'bull_adx_thresh': 28.241581238066193, 'bull_atr_min_pct': 0.011005266972292701, 'bull_atr_max_pct': 0.032291374833932976, 'bull_tp_mult': 2.970385272811455, 'bull_tsl_mult': 0.2438555085181061, 'bull_time_stop': 35, 'bull_use_sma': False, 'bull_use_ema': True, 'bull_use_atr': False, 'bull_use_adx': True, 'bull_use_spike': False, 'bull_rsi_required': False, 'bear_strategy': 'mean_reversion', 'bear_bb_std_mult': 1.6042270239864769, 'bear_rsi_os': 48, 'bear_rsi_ob': 56, 'bear_adx_thresh': 11.377464716310161, 'bear_atr_min_pct': 0.005770534243798036, 'bear_atr_max_pct': 0.13065817609308847, 'bear_tp_mult': 2.70556065308139, 'bear_tsl_mult': 0.8378142174352817, 'bear_time_stop': 96, 'bear_use_sma': False, 'bear_use_ema': False, 'bear_use_atr': True, 'bear_use_adx': False, 'bear_use_spike': True, 'bear_rsi_required': False, 'sideways_strategy': 'mean_reversion', 'sideways_bb_std_mult': 1.1756621746013627, 'sideways_rsi_os': 40, 'sideways_rsi_ob': 58, 'sideways_adx_thresh': 25.51581129462673, 'sideways_atr_min_pct': 0.004285332698061799, 'sideways_atr_max_pct': 0.09963744117725161, 'sideways_tp_mult': 1.6537366164639178, 'sideways_tsl_mult': 0.8433168811157201, 'sideways_time_stop': 164, 'sideways_use_sma': True, 'sideways_use_ema': True, 'sideways_use_atr': False, 'sideways_use_adx': False, 'sideways_use_spike': True, 'sideways_rsi_required': False}.
[I 2025-08-31 11:01:04,278] Trial 563 finished with values: [0.00026071928547444223, 0.006192959662238731] and parameters: {'p_sma': 33, 'p_std': 16, 'p_atr': 26, 'p_adx': 21, 'rsi_period': 30, 'ema1': 5, 'ema2': 17, 'slip_atr_k': 0.03016129201408598, 'slip_spread_k': 0.4987332749824241, 'spread_hl_frac': 0.020474464849878023, 'bb_std_mult': 0.8230747142835656, 'rsi_os': 28, 'rsi_ob': 80, 'vol_spike': 0.09134256834835042, 'adx_thresh': 11.508174742004265, 'atr_min_pct': 0.022929115589638085, 'atr_max_pct': 0.053663663064761585, 'tp_mult': 2.9807670822898196, 'tsl_mult': 0.08902516296619509, 'strategy': 'breakout', 'time_stop': 61, 'use_sma': True, 'use_atr': True, 'use_adx': False, 'use_ema': True, 'use_spike': False, 'rsi_required': False, 'edge_k': 1.4911610406820008, 'edge_cap': 0.7122735867509346, 'bull_strategy': 'mean_reversion', 'bull_bb_std_mult': 1.8450976675082713, 'bull_rsi_os': 41, 'bull_rsi_ob': 61, 'bull_adx_thresh': 28.252988970482665, 'bull_atr_min_pct': 0.011374188117654966, 'bull_atr_max_pct': 0.03293109114431096, 'bull_tp_mult': 2.988843525723475, 'bull_tsl_mult': 0.25217845401230826, 'bull_time_stop': 40, 'bull_use_sma': False, 'bull_use_ema': True, 'bull_use_atr': False, 'bull_use_adx': True, 'bull_use_spike': False, 'bull_rsi_required': False, 'bear_strategy': 'mean_reversion', 'bear_bb_std_mult': 1.6028647467028965, 'bear_rsi_os': 48, 'bear_rsi_ob': 56, 'bear_adx_thresh': 12.09479364320219, 'bear_atr_min_pct': 0.005676626150116361, 'bear_atr_max_pct': 0.1301333857612935, 'bear_tp_mult': 2.7139318382599624, 'bear_tsl_mult': 0.8256994180077922, 'bear_time_stop': 115, 'bear_use_sma': False, 'bear_use_ema': False, 'bear_use_atr': True, 'bear_use_adx': False, 'bear_use_spike': True, 'bear_rsi_required': False, 'sideways_strategy': 'mean_reversion', 'sideways_bb_std_mult': 1.1935411403271114, 'sideways_rsi_os': 40, 'sideways_rsi_ob': 58, 'sideways_adx_thresh': 25.486294825651395, 'sideways_atr_min_pct': 0.004218710654305585, 'sideways_atr_max_pct': 0.10212572965435836, 'sideways_tp_mult': 1.6551475908359043, 'sideways_tsl_mult': 0.8631559900388416, 'sideways_time_stop': 161, 'sideways_use_sma': True, 'sideways_use_ema': True, 'sideways_use_atr': False, 'sideways_use_adx': False, 'sideways_use_spike': True, 'sideways_rsi_required': False}.
[I 2025-08-31 11:01:37,748] Trial 568 finished with values: [-0.0023467681762594506, 0.00619213966266234] and parameters: {'p_sma': 34, 'p_std': 16, 'p_atr': 27, 'p_adx': 20, 'rsi_period': 32, 'ema1': 5, 'ema2': 17, 'slip_atr_k': 0.02519282190143609, 'slip_spread_k': 0.49266711718898787, 'spread_hl_frac': 0.019653076437581827, 'bb_std_mult': 0.7759330375635044, 'rsi_os': 27, 'rsi_ob': 80, 'vol_spike': 0.09307209252076468, 'adx_thresh': 11.497364088999547, 'atr_min_pct': 0.02215227547588409, 'atr_max_pct': 0.05384418460810454, 'tp_mult': 2.9861955987408826, 'tsl_mult': 0.04545539035875722, 'strategy': 'breakout', 'time_stop': 64, 'use_sma': True, 'use_atr': True, 'use_adx': False, 'use_ema': True, 'use_spike': False, 'rsi_required': False, 'edge_k': 1.4917317937190393, 'edge_cap': 0.7098046455339522, 'bull_strategy': 'mean_reversion', 'bull_bb_std_mult': 1.9504591007556078, 'bull_rsi_os': 41, 'bull_rsi_ob': 61, 'bull_adx_thresh': 28.0489242760332, 'bull_atr_min_pct': 0.01065853835568686, 'bull_atr_max_pct': 0.03339789840419813, 'bull_tp_mult': 2.9772656645746918, 'bull_tsl_mult': 0.2486706463637113, 'bull_time_stop': 39, 'bull_use_sma': False, 'bull_use_ema': True, 'bull_use_atr': False, 'bull_use_adx': True, 'bull_use_spike': False, 'bull_rsi_required': False, 'bear_strategy': 'mean_reversion', 'bear_bb_std_mult': 1.6929669185124763, 'bear_rsi_os': 48, 'bear_rsi_ob': 55, 'bear_adx_thresh': 12.080497225912985, 'bear_atr_min_pct': 0.0055895578001834735, 'bear_atr_max_pct': 0.13025513360512364, 'bear_tp_mult': 2.7144562171408197, 'bear_tsl_mult': 0.8395285068910981, 'bear_time_stop': 85, 'bear_use_sma': False, 'bear_use_ema': False, 'bear_use_atr': True, 'bear_use_adx': False, 'bear_use_spike': True, 'bear_rsi_required': False, 'sideways_strategy': 'mean_reversion', 'sideways_bb_std_mult': 1.2113748401254922, 'sideways_rsi_os': 40, 'sideways_rsi_ob': 58, 'sideways_adx_thresh': 25.81779347589997, 'sideways_atr_min_pct': 0.0042892199070080055, 'sideways_atr_max_pct': 0.10178938761821626, 'sideways_tp_mult': 1.6705424886253384, 'sideways_tsl_mult': 0.8494671469049261, 'sideways_time_stop': 162, 'sideways_use_sma': True, 'sideways_use_ema': True, 'sideways_use_atr': False, 'sideways_use_adx': False, 'sideways_use_spike': True, 'sideways_rsi_required': False}.
[I 2025-08-31 11:01:38,168] Trial 565 finished with values: [-0.0013612504236653056, 0.003921760677694564] and parameters: {'p_sma': 34, 'p_std': 18, 'p_atr': 27, 'p_adx': 20, 'rsi_period': 32, 'ema1': 5, 'ema2': 17, 'slip_atr_k': 0.028366968654221628, 'slip_spread_k': 0.49310636982787936, 'spread_hl_frac': 0.022041272952088433, 'bb_std_mult': 0.781752493841406, 'rsi_os': 29, 'rsi_ob': 80, 'vol_spike': 0.08796479725000296, 'adx_thresh': 11.126677155229952, 'atr_min_pct': 0.022304233750255354, 'atr_max_pct': 0.055078827059107195, 'tp_mult': 2.990016246103225, 'tsl_mult': 0.06433130859274322, 'strategy': 'breakout', 'time_stop': 58, 'use_sma': True, 'use_atr': True, 'use_adx': False, 'use_ema': True, 'use_spike': False, 'rsi_required': False, 'edge_k': 1.4940613931298565, 'edge_cap': 0.7039591078609075, 'bull_strategy': 'mean_reversion', 'bull_bb_std_mult': 1.7409641635882758, 'bull_rsi_os': 41, 'bull_rsi_ob': 61, 'bull_adx_thresh': 28.223312872382575, 'bull_atr_min_pct': 0.01071301379660856, 'bull_atr_max_pct': 0.032281527240546795, 'bull_tp_mult': 2.968023458259685, 'bull_tsl_mult': 0.24281131000019412, 'bull_time_stop': 37, 'bull_use_sma': False, 'bull_use_ema': True, 'bull_use_atr': False, 'bull_use_adx': True, 'bull_use_spike': False, 'bull_rsi_required': False, 'bear_strategy': 'mean_reversion', 'bear_bb_std_mult': 1.6165438914432944, 'bear_rsi_os': 48, 'bear_rsi_ob': 56, 'bear_adx_thresh': 11.279660358251263, 'bear_atr_min_pct': 0.005767980057775884, 'bear_atr_max_pct': 0.1304947443976034, 'bear_tp_mult': 2.7033411087664443, 'bear_tsl_mult': 0.846319559805387, 'bear_time_stop': 97, 'bear_use_sma': False, 'bear_use_ema': False, 'bear_use_atr': True, 'bear_use_adx': False, 'bear_use_spike': True, 'bear_rsi_required': False, 'sideways_strategy': 'mean_reversion', 'sideways_bb_std_mult': 1.186975495156841, 'sideways_rsi_os': 40, 'sideways_rsi_ob': 58, 'sideways_adx_thresh': 25.42358482093288, 'sideways_atr_min_pct': 0.004058931596713231, 'sideways_atr_max_pct': 0.10196891299731198, 'sideways_tp_mult': 1.5787987768496001, 'sideways_tsl_mult': 0.8477268107159714, 'sideways_time_stop': 162, 'sideways_use_sma': True, 'sideways_use_ema': True, 'sideways_use_atr': False, 'sideways_use_adx': False, 'sideways_use_spike': True, 'sideways_rsi_required': False}.
