[I 2025-08-31 10:25:01,698] Trial 269 finished with values: [-1000000000.0, 1000000000.0] and parameters: {'p_sma': 19, 'p_std': 33, 'p_atr': 23, 'p_adx': 7, 'rsi_period': 29, 'ema1': 13, 'ema2': 33, 'slip_atr_k': 0.08180387514090191, 'slip_spread_k': 0.5912363005081368, 'spread_hl_frac': 0.027381034447356716, 'bb_std_mult': 2.74390683988515, 'rsi_os': 44, 'rsi_ob': 76, 'vol_spike': 0.29164228836832573, 'adx_thresh': 22.674673296033156, 'atr_min_pct': 0.019810062250905855, 'atr_max_pct': 0.11040480045514287, 'tp_mult': 2.7705340430066574, 'tsl_mult': 0.8631819693315603, 'strategy': 'mean_reversion', 'time_stop': 5, 'use_sma': False, 'use_atr': False, 'use_adx': False, 'use_ema': False, 'use_spike': True, 'rsi_required': True, 'edge_k': 1.6446212922818688, 'edge_cap': 0.0616935536877717, 'bull_strategy': 'breakout', 'bull_bb_std_mult': 2.5540115333659834, 'bull_rsi_os': 46, 'bull_rsi_ob': 47, 'bull_adx_thresh': 11.16563274821202, 'bull_atr_min_pct': 0.003344592457649817, 'bull_atr_max_pct': 0.035425510559248585, 'bull_tp_mult': 1.250358472213214, 'bull_tsl_mult': 0.08369906775643175, 'bull_time_stop': 6, 'bull_use_sma': True, 'bull_use_ema': True, 'bull_use_atr': True, 'bull_use_adx': True, 'bull_use_spike': True, 'bull_rsi_required': False, 'bear_strategy': 'breakout', 'bear_bb_std_mult': 2.123655409970924, 'bear_rsi_os': 13, 'bear_rsi_ob': 57, 'bear_adx_thresh': 8.119769148726572, 'bear_atr_min_pct': 0.018669480303302236, 'bear_atr_max_pct': 0.1216314731858966, 'bear_tp_mult': 2.7097342509051585, 'bear_tsl_mult': 0.16503706044438143, 'bear_time_stop': 191, 'bear_use_sma': False, 'bear_use_ema': True, 'bear_use_atr': True, 'bear_use_adx': False, 'bear_use_spike': True, 'bear_rsi_required': True, 'sideways_strategy': 'breakout', 'sideways_bb_std_mult': 2.579923775033575, 'sideways_rsi_os': 32, 'sideways_rsi_ob': 86, 'sideways_adx_thresh': 29.8414428360889, 'sideways_atr_min_pct': 0.024337615284472078, 'sideways_atr_max_pct': 0.10126140745487008, 'sideways_tp_mult': 1.3296356662172106, 'sideways_tsl_mult': 0.9136309996490166, 'sideways_time_stop': 268, 'sideways_use_sma': False, 'sideways_use_ema': False, 'sideways_use_atr': False, 'sideways_use_adx': False, 'sideways_use_spike': True, 'sideways_rsi_required': False}.
[I 2025-08-31 10:25:05,049] Trial 270 finished with values: [-0.011496378353542447, 0.012003765594003889] and parameters: {'p_sma': 30, 'p_std': 33, 'p_atr': 10, 'p_adx': 7, 'rsi_period': 15, 'ema1': 12, 'ema2': 25, 'slip_atr_k': 0.06873461442722166, 'slip_spread_k': 0.2649776131854214, 'spread_hl_frac': 0.026819567287687338, 'bb_std_mult': 2.468231210930549, 'rsi_os': 43, 'rsi_ob': 76, 'vol_spike': 0.1323507586237271, 'adx_thresh': 22.69254422222255, 'atr_min_pct': 0.019889884136040068, 'atr_max_pct': 0.05041644624989913, 'tp_mult': 2.760840749060694, 'tsl_mult': 0.8667822156671343, 'strategy': 'mean_reversion', 'time_stop': 151, 'use_sma': False, 'use_atr': False, 'use_adx': False, 'use_ema': False, 'use_spike': True, 'rsi_required': True, 'edge_k': 0.5023656653623214, 'edge_cap': 0.23040329395269202, 'bull_strategy': 'breakout', 'bull_bb_std_mult': 1.2588040689744047, 'bull_rsi_os': 39, 'bull_rsi_ob': 74, 'bull_adx_thresh': 10.988186181209553, 'bull_atr_min_pct': 0.00350852747359499, 'bull_atr_max_pct': 0.06873264531092659, 'bull_tp_mult': 1.2376942537731244, 'bull_tsl_mult': 0.45297654227667694, 'bull_time_stop': 215, 'bull_use_sma': True, 'bull_use_ema': True, 'bull_use_atr': True, 'bull_use_adx': True, 'bull_use_spike': True, 'bull_rsi_required': False, 'bear_strategy': 'breakout', 'bear_bb_std_mult': 2.1466319829737257, 'bear_rsi_os': 30, 'bear_rsi_ob': 57, 'bear_adx_thresh': 8.62547305690701, 'bear_atr_min_pct': 0.018431574257216504, 'bear_atr_max_pct': 0.12158566541859535, 'bear_tp_mult': 2.0670414339316463, 'bear_tsl_mult': 0.9471360914732906, 'bear_time_stop': 28, 'bear_use_sma': False, 'bear_use_ema': True, 'bear_use_atr': True, 'bear_use_adx': False, 'bear_use_spike': True, 'bear_rsi_required': True, 'sideways_strategy': 'breakout', 'sideways_bb_std_mult': 2.287162452640799, 'sideways_rsi_os': 33, 'sideways_rsi_ob': 83, 'sideways_adx_thresh': 30.172378953460367, 'sideways_atr_min_pct': 0.0034685842099109222, 'sideways_atr_max_pct': 0.11848227900529028, 'sideways_tp_mult': 1.2673888893533987, 'sideways_tsl_mult': 0.7526544412457778, 'sideways_time_stop': 253, 'sideways_use_sma': True, 'sideways_use_ema': False, 'sideways_use_atr': False, 'sideways_use_adx': False, 'sideways_use_spike': True, 'sideways_rsi_required': False}.
[I 2025-08-31 10:25:08,260] Trial 272 finished with values: [-0.01035729162033927, 0.011266276237553828] and parameters: {'p_sma': 18, 'p_std': 36, 'p_atr': 9, 'p_adx': 30, 'rsi_period': 29, 'ema1': 12, 'ema2': 56, 'slip_atr_k': 0.06828435150386321, 'slip_spread_k': 0.5949931253662626, 'spread_hl_frac': 0.029131776142942586, 'bb_std_mult': 2.652457706960828, 'rsi_os': 40, 'rsi_ob': 82, 'vol_spike': 0.2808665933037745, 'adx_thresh': 9.671917911255422, 'atr_min_pct': 0.020326671730294715, 'atr_max_pct': 0.11103676297327064, 'tp_mult': 2.8251654885484716, 'tsl_mult': 0.8519272520053025, 'strategy': 'mean_reversion', 'time_stop': 6, 'use_sma': False, 'use_atr': True, 'use_adx': True, 'use_ema': True, 'use_spike': True, 'rsi_required': True, 'edge_k': 1.7155669594322465, 'edge_cap': 0.5804267206264165, 'bull_strategy': 'breakout', 'bull_bb_std_mult': 0.6808156859175805, 'bull_rsi_os': 46, 'bull_rsi_ob': 74, 'bull_adx_thresh': 11.28697309760167, 'bull_atr_min_pct': 0.003120270005802679, 'bull_atr_max_pct': 0.03590044104983167, 'bull_tp_mult': 2.7676573929264032, 'bull_tsl_mult': 0.1473793843432822, 'bull_time_stop': 196, 'bull_use_sma': True, 'bull_use_ema': True, 'bull_use_atr': True, 'bull_use_adx': False, 'bull_use_spike': True, 'bull_rsi_required': False, 'bear_strategy': 'breakout', 'bear_bb_std_mult': 1.945199776665519, 'bear_rsi_os': 13, 'bear_rsi_ob': 57, 'bear_adx_thresh': 8.842417294300239, 'bear_atr_min_pct': 0.005344524072674361, 'bear_atr_max_pct': 0.010815215792758487, 'bear_tp_mult': 2.6679217856118855, 'bear_tsl_mult': 0.10686829083443418, 'bear_time_stop': 27, 'bear_use_sma': True, 'bear_use_ema': True, 'bear_use_atr': True, 'bear_use_adx': False, 'bear_use_spike': True, 'bear_rsi_required': False, 'sideways_strategy': 'breakout', 'sideways_bb_std_mult': 2.5609686086551373, 'sideways_rsi_os': 32, 'sideways_rsi_ob': 85, 'sideways_adx_thresh': 12.164488718708293, 'sideways_atr_min_pct': 0.02325851053396533, 'sideways_atr_max_pct': 0.10145755603023751, 'sideways_tp_mult': 2.261957336046082, 'sideways_tsl_mult': 0.0673081855115305, 'sideways_time_stop': 263, 'sideways_use_sma': True, 'sideways_use_ema': False, 'sideways_use_atr': False, 'sideways_use_adx': True, 'sideways_use_spike': True, 'sideways_rsi_required': False}.
[I 2025-08-31 10:25:38,427] Trial 274 finished with values: [-1000000000.0, 1000000000.0] and parameters: {'p_sma': 30, 'p_std': 54, 'p_atr': 16, 'p_adx': 15, 'rsi_period': 16, 'ema1': 12, 'ema2': 57, 'slip_atr_k': 0.06944228366759961, 'slip_spread_k': 0.269131624077516, 'spread_hl_frac': 0.02948697166453495, 'bb_std_mult': 2.6723887516302733, 'rsi_os': 9, 'rsi_ob': 74, 'vol_spike': 0.060457504816261484, 'adx_thresh': 9.412867947398595, 'atr_min_pct': 0.02035584825186437, 'atr_max_pct': 0.050379509383741826, 'tp_mult': 1.9272841466342943, 'tsl_mult': 0.8090361396022638, 'strategy': 'mean_reversion', 'time_stop': 130, 'use_sma': False, 'use_atr': True, 'use_adx': True, 'use_ema': True, 'use_spike': True, 'rsi_required': True, 'edge_k': 0.0011093872862890652, 'edge_cap': 0.5826817158242681, 'bull_strategy': 'breakout', 'bull_bb_std_mult': 0.7688313341488298, 'bull_rsi_os': 42, 'bull_rsi_ob': 74, 'bull_adx_thresh': 9.904567794500736, 'bull_atr_min_pct': 0.0040857621689811075, 'bull_atr_max_pct': 0.06839189844354934, 'bull_tp_mult': 2.3956273782721604, 'bull_tsl_mult': 0.41573398303797354, 'bull_time_stop': 73, 'bull_use_sma': True, 'bull_use_ema': True, 'bull_use_atr': True, 'bull_use_adx': False, 'bull_use_spike': False, 'bull_rsi_required': False, 'bear_strategy': 'mean_reversion', 'bear_bb_std_mult': 2.2973680536494454, 'bear_rsi_os': 43, 'bear_rsi_ob': 54, 'bear_adx_thresh': 23.506759963474494, 'bear_atr_min_pct': 0.017634016652877536, 'bear_atr_max_pct': 0.12914018568706054, 'bear_tp_mult': 2.048865284874141, 'bear_tsl_mult': 0.1206453900050554, 'bear_time_stop': 28, 'bear_use_sma': True, 'bear_use_ema': False, 'bear_use_atr': False, 'bear_use_adx': False, 'bear_use_spike': True, 'bear_rsi_required': False, 'sideways_strategy': 'breakout', 'sideways_bb_std_mult': 2.7062847818794307, 'sideways_rsi_os': 35, 'sideways_rsi_ob': 85, 'sideways_adx_thresh': 13.581793088126219, 'sideways_atr_min_pct': 0.0032829849832414653, 'sideways_atr_max_pct': 0.014715646337738478, 'sideways_tp_mult': 1.2523296916391595, 'sideways_tsl_mult': 0.28360649639618446, 'sideways_time_stop': 279, 'sideways_use_sma': True, 'sideways_use_ema': False, 'sideways_use_atr': False, 'sideways_use_adx': True, 'sideways_use_spike': True, 'sideways_rsi_required': False}.
[I 2025-08-31 10:25:38,883] Trial 275 finished with values: [-1000000000.0, 1000000000.0] and parameters: {'p_sma': 18, 'p_std': 54, 'p_atr': 25, 'p_adx': 25, 'rsi_period': 13, 'ema1': 12, 'ema2': 56, 'slip_atr_k': 0.04590127304809953, 'slip_spread_k': 0.338366660947391, 'spread_hl_frac': 0.031079763941496173, 'bb_std_mult': 2.6981511387010944, 'rsi_os': 9, 'rsi_ob': 74, 'vol_spike': 0.2070265816015354, 'adx_thresh': 9.637900010344689, 'atr_min_pct': 0.01877757206053729, 'atr_max_pct': 0.02711853445161482, 'tp_mult': 2.836457841029098, 'tsl_mult': 0.8384427559908327, 'strategy': 'mean_reversion', 'time_stop': 132, 'use_sma': False, 'use_atr': True, 'use_adx': True, 'use_ema': True, 'use_spike': True, 'rsi_required': False, 'edge_k': 1.7357593837841025, 'edge_cap': 0.582896263524659, 'bull_strategy': 'breakout', 'bull_bb_std_mult': 1.1256066728927885, 'bull_rsi_os': 42, 'bull_rsi_ob': 73, 'bull_adx_thresh': 9.699031889472042, 'bull_atr_min_pct': 0.007630555512160761, 'bull_atr_max_pct': 0.13704914363106396, 'bull_tp_mult': 1.1548766146251386, 'bull_tsl_mult': 0.14154403302237337, 'bull_time_stop': 195, 'bull_use_sma': False, 'bull_use_ema': True, 'bull_use_atr': False, 'bull_use_adx': False, 'bull_use_spike': False, 'bull_rsi_required': False, 'bear_strategy': 'mean_reversion', 'bear_bb_std_mult': 1.938222332996797, 'bear_rsi_os': 46, 'bear_rsi_ob': 58, 'bear_adx_thresh': 23.645708863244703, 'bear_atr_min_pct': 0.015505075397288645, 'bear_atr_max_pct': 0.025796997208036174, 'bear_tp_mult': 1.7001261520820976, 'bear_tsl_mult': 0.10464998194075156, 'bear_time_stop': 41, 'bear_use_sma': True, 'bear_use_ema': False, 'bear_use_atr': False, 'bear_use_adx': True, 'bear_use_spike': False, 'bear_rsi_required': False, 'sideways_strategy': 'mean_reversion', 'sideways_bb_std_mult': 2.6647012082371595, 'sideways_rsi_os': 34, 'sideways_rsi_ob': 84, 'sideways_adx_thresh': 24.819582772163677, 'sideways_atr_min_pct': 0.02319739971293154, 'sideways_atr_max_pct': 0.014007468576191872, 'sideways_tp_mult': 1.2441684499594063, 'sideways_tsl_mult': 0.8302263565943208, 'sideways_time_stop': 279, 'sideways_use_sma': True, 'sideways_use_ema': False, 'sideways_use_atr': True, 'sideways_use_adx': True, 'sideways_use_spike': True, 'sideways_rsi_required': False}.
[I 2025-08-31 10:25:38,976] Trial 273 finished with values: [-0.011804084401699555, 0.011839422655934191] and parameters: {'p_sma': 18, 'p_std': 36, 'p_atr': 9, 'p_adx': 7, 'rsi_period': 28, 'ema1': 29, 'ema2': 55, 'slip_atr_k': 0.11460726238772655, 'slip_spread_k': 0.34242219888640574, 'spread_hl_frac': 0.017971405074361846, 'bb_std_mult': 2.769558346104215, 'rsi_os': 43, 'rsi_ob': 74, 'vol_spike': 0.1323092496012414, 'adx_thresh': 5.260012865551813, 'atr_min_pct': 0.020259484919362743, 'atr_max_pct': 0.050567850022868226, 'tp_mult': 2.8302468750489282, 'tsl_mult': 0.8252572844306794, 'strategy': 'mean_reversion', 'time_stop': 131, 'use_sma': False, 'use_atr': True, 'use_adx': True, 'use_ema': True, 'use_spike': True, 'rsi_required': True, 'edge_k': 0.15948699407466715, 'edge_cap': 0.114215675478494, 'bull_strategy': 'breakout', 'bull_bb_std_mult': 0.7679523783948724, 'bull_rsi_os': 42, 'bull_rsi_ob': 74, 'bull_adx_thresh': 11.347333524313324, 'bull_atr_min_pct': 0.0028344210086989046, 'bull_atr_max_pct': 0.07364400965901047, 'bull_tp_mult': 2.3608646334623673, 'bull_tsl_mult': 0.16713480025342203, 'bull_time_stop': 108, 'bull_use_sma': True, 'bull_use_ema': True, 'bull_use_atr': True, 'bull_use_adx': False, 'bull_use_spike': True, 'bull_rsi_required': False, 'bear_strategy': 'mean_reversion', 'bear_bb_std_mult': 2.325280651174527, 'bear_rsi_os': 46, 'bear_rsi_ob': 69, 'bear_adx_thresh': 7.565323289605386, 'bear_atr_min_pct': 0.015640434075175774, 'bear_atr_max_pct': 0.12960454087841616, 'bear_tp_mult': 2.6688431179169543, 'bear_tsl_mult': 0.10672730914652998, 'bear_time_stop': 27, 'bear_use_sma': True, 'bear_use_ema': False, 'bear_use_atr': False, 'bear_use_adx': False, 'bear_use_spike': True, 'bear_rsi_required': False, 'sideways_strategy': 'breakout', 'sideways_bb_std_mult': 2.6769622282188745, 'sideways_rsi_os': 32, 'sideways_rsi_ob': 85, 'sideways_adx_thresh': 21.95433684705122, 'sideways_atr_min_pct': 0.003330117372956422, 'sideways_atr_max_pct': 0.017431056403522563, 'sideways_tp_mult': 1.7585505187651587, 'sideways_tsl_mult': 0.06321630168041537, 'sideways_time_stop': 281, 'sideways_use_sma': True, 'sideways_use_ema': False, 'sideways_use_atr': False, 'sideways_use_adx': True, 'sideways_use_spike': True, 'sideways_rsi_required': False}.
[I 2025-08-31 10:25:39,804] Trial 276 finished with values: [-0.016760850723326115, 0.016803883672988303] and parameters: {'p_sma': 16, 'p_std': 34, 'p_atr': 16, 'p_adx': 9, 'rsi_period': 12, 'ema1': 11, 'ema2': 57, 'slip_atr_k': 0.11535072256811735, 'slip_spread_k': 0.9018124445318209, 'spread_hl_frac': 0.03018252732076389, 'bb_std_mult': 2.686393216281249, 'rsi_os': 9, 'rsi_ob': 74, 'vol_spike': 0.206906523681578, 'adx_thresh': 8.552941602698857, 'atr_min_pct': 0.018889078517571337, 'atr_max_pct': 0.0510420465466627, 'tp_mult': 2.7167371467970094, 'tsl_mult': 0.4958407343442384, 'strategy': 'mean_reversion', 'time_stop': 213, 'use_sma': False, 'use_atr': True, 'use_adx': True, 'use_ema': True, 'use_spike': True, 'rsi_required': False, 'edge_k': 1.063001995876541, 'edge_cap': 0.6609611641138383, 'bull_strategy': 'breakout', 'bull_bb_std_mult': 0.7514205596677181, 'bull_rsi_os': 42, 'bull_rsi_ob': 61, 'bull_adx_thresh': 9.713527424986488, 'bull_atr_min_pct': 0.0042318522276662, 'bull_atr_max_pct': 0.1353073187148716, 'bull_tp_mult': 1.1658657983814036, 'bull_tsl_mult': 0.10830790470490909, 'bull_time_stop': 159, 'bull_use_sma': False, 'bull_use_ema': True, 'bull_use_atr': False, 'bull_use_adx': False, 'bull_use_spike': False, 'bull_rsi_required': False, 'bear_strategy': 'mean_reversion', 'bear_bb_std_mult': 2.304464245932081, 'bear_rsi_os': 46, 'bear_rsi_ob': 54, 'bear_adx_thresh': 7.463121926023947, 'bear_atr_min_pct': 0.015577770318431489, 'bear_atr_max_pct': 0.025033379278676826, 'bear_tp_mult': 2.666155324668146, 'bear_tsl_mult': 0.7085344269326279, 'bear_time_stop': 41, 'bear_use_sma': True, 'bear_use_ema': False, 'bear_use_atr': False, 'bear_use_adx': True, 'bear_use_spike': False, 'bear_rsi_required': False, 'sideways_strategy': 'mean_reversion', 'sideways_bb_std_mult': 2.668856695754149, 'sideways_rsi_os': 34, 'sideways_rsi_ob': 84, 'sideways_adx_thresh': 32.02797974252512, 'sideways_atr_min_pct': 0.0031503592524386136, 'sideways_atr_max_pct': 0.014299009987432965, 'sideways_tp_mult': 1.7843971025705627, 'sideways_tsl_mult': 0.48267974811631537, 'sideways_time_stop': 278, 'sideways_use_sma': True, 'sideways_use_ema': False, 'sideways_use_atr': True, 'sideways_use_adx': True, 'sideways_use_spike': True, 'sideways_rsi_required': False}.
[I 2025-08-31 10:26:11,593] Trial 279 finished with values: [-0.03386707006560319, 0.0338026960203432] and parameters: {'p_sma': 51, 'p_std': 25, 'p_atr': 17, 'p_adx': 9, 'rsi_period': 56, 'ema1': 13, 'ema2': 41, 'slip_atr_k': 0.06204686705968562, 'slip_spread_k': 0.91080371490753, 'spread_hl_frac': 0.04207218583524895, 'bb_std_mult': 2.5021918867133923, 'rsi_os': 32, 'rsi_ob': 80, 'vol_spike': 0.2302924226170094, 'adx_thresh': 32.398035311641834, 'atr_min_pct': 0.019013425801594017, 'atr_max_pct': 0.038643417854868155, 'tp_mult': 1.7597140897403798, 'tsl_mult': 0.5422835491948242, 'strategy': 'mean_reversion', 'time_stop': 300, 'use_sma': False, 'use_atr': False, 'use_adx': True, 'use_ema': False, 'use_spike': True, 'rsi_required': False, 'edge_k': 1.2178778239130952, 'edge_cap': 0.5224602723083948, 'bull_strategy': 'breakout', 'bull_bb_std_mult': 2.3355565179011872, 'bull_rsi_os': 18, 'bull_rsi_ob': 66, 'bull_adx_thresh': 24.884842895488624, 'bull_atr_min_pct': 0.010943760898578802, 'bull_atr_max_pct': 0.07935443919780066, 'bull_tp_mult': 2.2327042965044512, 'bull_tsl_mult': 0.11379758910811491, 'bull_time_stop': 26, 'bull_use_sma': False, 'bull_use_ema': True, 'bull_use_atr': False, 'bull_use_adx': True, 'bull_use_spike': True, 'bull_rsi_required': False, 'bear_strategy': 'breakout', 'bear_bb_std_mult': 2.054026640649648, 'bear_rsi_os': 39, 'bear_rsi_ob': 74, 'bear_adx_thresh': 7.351198184348552, 'bear_atr_min_pct': 0.025479781843788872, 'bear_atr_max_pct': 0.09329436723394316, 'bear_tp_mult': 1.0640624069476754, 'bear_tsl_mult': 0.1433923053550552, 'bear_time_stop': 39, 'bear_use_sma': False, 'bear_use_ema': False, 'bear_use_atr': True, 'bear_use_adx': True, 'bear_use_spike': False, 'bear_rsi_required': True, 'sideways_strategy': 'mean_reversion', 'sideways_bb_std_mult': 2.4260571801695, 'sideways_rsi_os': 37, 'sideways_rsi_ob': 82, 'sideways_adx_thresh': 15.970727993974654, 'sideways_atr_min_pct': 0.0015838828310649217, 'sideways_atr_max_pct': 0.08156381654746575, 'sideways_tp_mult': 1.1129991099685896, 'sideways_tsl_mult': 0.8437683654220175, 'sideways_time_stop': 126, 'sideways_use_sma': True, 'sideways_use_ema': False, 'sideways_use_atr': True, 'sideways_use_adx': False, 'sideways_use_spike': True, 'sideways_rsi_required': False}.
[I 2025-08-31 10:26:11,594] Trial 278 finished with values: [-0.03886839985035517, 0.03859574225373523] and parameters: {'p_sma': 24, 'p_std': 37, 'p_atr': 12, 'p_adx': 9, 'rsi_period': 7, 'ema1': 11, 'ema2': 46, 'slip_atr_k': 0.0625800462526601, 'slip_spread_k': 0.9220135057538005, 'spread_hl_frac': 0.024690100486482985, 'bb_std_mult': 2.802111057708845, 'rsi_os': 42, 'rsi_ob': 75, 'vol_spike': 0.19983740137556483, 'adx_thresh': 5.206019531893844, 'atr_min_pct': 0.019043267836528092, 'atr_max_pct': 0.03903133949672298, 'tp_mult': 2.4474704557805502, 'tsl_mult': 0.5136395095775432, 'strategy': 'mean_reversion', 'time_stop': 38, 'use_sma': False, 'use_atr': False, 'use_adx': True, 'use_ema': False, 'use_spike': True, 'rsi_required': False, 'edge_k': 1.3379128166971288, 'edge_cap': 0.7453905978603981, 'bull_strategy': 'breakout', 'bull_bb_std_mult': 0.9710897704181055, 'bull_rsi_os': 19, 'bull_rsi_ob': 76, 'bull_adx_thresh': 10.497903437882481, 'bull_atr_min_pct': 0.002502150321209094, 'bull_atr_max_pct': 0.07378287000730306, 'bull_tp_mult': 2.924455331052117, 'bull_tsl_mult': 0.3904154478612968, 'bull_time_stop': 108, 'bull_use_sma': True, 'bull_use_ema': True, 'bull_use_atr': False, 'bull_use_adx': True, 'bull_use_spike': True, 'bull_rsi_required': False, 'bear_strategy': 'breakout', 'bear_bb_std_mult': 0.9742814975727132, 'bear_rsi_os': 41, 'bear_rsi_ob': 69, 'bear_adx_thresh': 7.482967901407356, 'bear_atr_min_pct': 0.004345422143417519, 'bear_atr_max_pct': 0.07615210601557051, 'bear_tp_mult': 1.0813978747830568, 'bear_tsl_mult': 0.6997313409797488, 'bear_time_stop': 36, 'bear_use_sma': False, 'bear_use_ema': False, 'bear_use_atr': True, 'bear_use_adx': True, 'bear_use_spike': True, 'bear_rsi_required': True, 'sideways_strategy': 'mean_reversion', 'sideways_bb_std_mult': 2.7932047452370634, 'sideways_rsi_os': 37, 'sideways_rsi_ob': 88, 'sideways_adx_thresh': 22.136634369050498, 'sideways_atr_min_pct': 0.003985286116408499, 'sideways_atr_max_pct': 0.058454377936794026, 'sideways_tp_mult': 1.4398579355741479, 'sideways_tsl_mult': 0.680707173584863, 'sideways_time_stop': 262, 'sideways_use_sma': True, 'sideways_use_ema': False, 'sideways_use_atr': False, 'sideways_use_adx': False, 'sideways_use_spike': True, 'sideways_rsi_required': False}.
