[I 2025-08-31 10:38:10,874] Trial 378 finished with values: [-0.011129749615907514, 0.011438372281757371] and parameters: {'p_sma': 22, 'p_std': 34, 'p_atr': 17, 'p_adx': 14, 'rsi_period': 20, 'ema1': 13, 'ema2': 16, 'slip_atr_k': 0.08200856118820436, 'slip_spread_k': 0.25809739609035687, 'spread_hl_frac': 0.03197024776817303, 'bb_std_mult': 2.7643354661598862, 'rsi_os': 20, 'rsi_ob': 76, 'vol_spike': 0.2797439410553709, 'adx_thresh': 18.8375405128023, 'atr_min_pct': 0.016999644979975387, 'atr_max_pct': 0.04972627508025915, 'tp_mult': 2.8918140613143524, 'tsl_mult': 0.7573657248540352, 'strategy': 'mean_reversion', 'time_stop': 272, 'use_sma': True, 'use_atr': True, 'use_adx': True, 'use_ema': True, 'use_spike': True, 'rsi_required': True, 'edge_k': 0.7321318107156789, 'edge_cap': 0.5987214789317122, 'bull_strategy': 'mean_reversion', 'bull_bb_std_mult': 0.8979086773981113, 'bull_rsi_os': 40, 'bull_rsi_ob': 66, 'bull_adx_thresh': 16.214398905967563, 'bull_atr_min_pct': 0.003755638352230744, 'bull_atr_max_pct': 0.07731303438070049, 'bull_tp_mult': 1.0183818834091451, 'bull_tsl_mult': 0.05477308731365202, 'bull_time_stop': 295, 'bull_use_sma': False, 'bull_use_ema': True, 'bull_use_atr': False, 'bull_use_adx': True, 'bull_use_spike': True, 'bull_rsi_required': False, 'bear_strategy': 'breakout', 'bear_bb_std_mult': 2.9633488541744812, 'bear_rsi_os': 26, 'bear_rsi_ob': 58, 'bear_adx_thresh': 27.941852960609353, 'bear_atr_min_pct': 0.01635811235942166, 'bear_atr_max_pct': 0.12133443996703698, 'bear_tp_mult': 2.8598865805068368, 'bear_tsl_mult': 0.19795753260063667, 'bear_time_stop': 28, 'bear_use_sma': True, 'bear_use_ema': True, 'bear_use_atr': True, 'bear_use_adx': False, 'bear_use_spike': True, 'bear_rsi_required': True, 'sideways_strategy': 'breakout', 'sideways_bb_std_mult': 2.7778530205132306, 'sideways_rsi_os': 32, 'sideways_rsi_ob': 84, 'sideways_adx_thresh': 18.193554108281806, 'sideways_atr_min_pct': 0.00029385493325067083, 'sideways_atr_max_pct': 0.013359124066912637, 'sideways_tp_mult': 1.2583755294749397, 'sideways_tsl_mult': 0.7728496035674657, 'sideways_time_stop': 146, 'sideways_use_sma': True, 'sideways_use_ema': True, 'sideways_use_atr': False, 'sideways_use_adx': True, 'sideways_use_spike': True, 'sideways_rsi_required': True}.
[I 2025-08-31 10:38:11,124] Trial 380 finished with values: [-1000000000.0, 1000000000.0] and parameters: {'p_sma': 12, 'p_std': 34, 'p_atr': 19, 'p_adx': 18, 'rsi_period': 35, 'ema1': 21, 'ema2': 26, 'slip_atr_k': 0.07877243456170824, 'slip_spread_k': 0.2521375803470604, 'spread_hl_frac': 0.0459729651955702, 'bb_std_mult': 2.6276020921875856, 'rsi_os': 21, 'rsi_ob': 77, 'vol_spike': 0.0677336367060109, 'adx_thresh': 13.812132919652772, 'atr_min_pct': 0.025148374412191435, 'atr_max_pct': 0.05107677785128179, 'tp_mult': 2.9979250081586732, 'tsl_mult': 0.6050571058991668, 'strategy': 'mean_reversion', 'time_stop': 270, 'use_sma': False, 'use_atr': True, 'use_adx': True, 'use_ema': True, 'use_spike': True, 'rsi_required': True, 'edge_k': 1.7552850845960057, 'edge_cap': 0.18178820519096567, 'bull_strategy': 'breakout', 'bull_bb_std_mult': 0.9148961968122452, 'bull_rsi_os': 40, 'bull_rsi_ob': 74, 'bull_adx_thresh': 25.19156987546192, 'bull_atr_min_pct': 0.024486212210503955, 'bull_atr_max_pct': 0.06670092728687298, 'bull_tp_mult': 1.022372304061843, 'bull_tsl_mult': 0.25513866068353014, 'bull_time_stop': 229, 'bull_use_sma': False, 'bull_use_ema': True, 'bull_use_atr': False, 'bull_use_adx': True, 'bull_use_spike': False, 'bull_rsi_required': False, 'bear_strategy': 'breakout', 'bear_bb_std_mult': 2.10959287446539, 'bear_rsi_os': 43, 'bear_rsi_ob': 57, 'bear_adx_thresh': 23.16891044909046, 'bear_atr_min_pct': 0.018163546854870975, 'bear_atr_max_pct': 0.12217499113897329, 'bear_tp_mult': 1.4590055923949958, 'bear_tsl_mult': 0.10544008566826951, 'bear_time_stop': 67, 'bear_use_sma': True, 'bear_use_ema': False, 'bear_use_atr': True, 'bear_use_adx': False, 'bear_use_spike': False, 'bear_rsi_required': True, 'sideways_strategy': 'breakout', 'sideways_bb_std_mult': 2.505000702716458, 'sideways_rsi_os': 47, 'sideways_rsi_ob': 84, 'sideways_adx_thresh': 14.097263761507257, 'sideways_atr_min_pct': 0.0003919540010977004, 'sideways_atr_max_pct': 0.11573102579801063, 'sideways_tp_mult': 2.64565948692541, 'sideways_tsl_mult': 0.7761572209136047, 'sideways_time_stop': 254, 'sideways_use_sma': True, 'sideways_use_ema': True, 'sideways_use_atr': False, 'sideways_use_adx': True, 'sideways_use_spike': True, 'sideways_rsi_required': False}.
[I 2025-08-31 10:38:11,256] Trial 379 finished with values: [-1000000000.0, 1000000000.0] and parameters: {'p_sma': 20, 'p_std': 34, 'p_atr': 17, 'p_adx': 8, 'rsi_period': 51, 'ema1': 11, 'ema2': 60, 'slip_atr_k': 0.07995072520822327, 'slip_spread_k': 0.2586598155626725, 'spread_hl_frac': 0.028695198140297355, 'bb_std_mult': 2.7795920704875554, 'rsi_os': 21, 'rsi_ob': 77, 'vol_spike': 0.06845448126213872, 'adx_thresh': 20.23706903275238, 'atr_min_pct': 0.025092358125244157, 'atr_max_pct': 0.05171838802356245, 'tp_mult': 2.9943569586281775, 'tsl_mult': 0.4073770306375792, 'strategy': 'mean_reversion', 'time_stop': 139, 'use_sma': False, 'use_atr': True, 'use_adx': True, 'use_ema': True, 'use_spike': True, 'rsi_required': True, 'edge_k': 1.7289695487624295, 'edge_cap': 0.4621078196513847, 'bull_strategy': 'breakout', 'bull_bb_std_mult': 0.8969088987246191, 'bull_rsi_os': 53, 'bull_rsi_ob': 66, 'bull_adx_thresh': 18.99708691882943, 'bull_atr_min_pct': 0.017188513477805333, 'bull_atr_max_pct': 0.06654021877802622, 'bull_tp_mult': 2.0790735023327205, 'bull_tsl_mult': 0.05006067295389405, 'bull_time_stop': 85, 'bull_use_sma': False, 'bull_use_ema': True, 'bull_use_atr': False, 'bull_use_adx': True, 'bull_use_spike': True, 'bull_rsi_required': False, 'bear_strategy': 'breakout', 'bear_bb_std_mult': 2.1059601393389453, 'bear_rsi_os': 26, 'bear_rsi_ob': 59, 'bear_adx_thresh': 22.91958448425852, 'bear_atr_min_pct': 0.026977432015494535, 'bear_atr_max_pct': 0.029970269788413134, 'bear_tp_mult': 1.042013478609496, 'bear_tsl_mult': 0.20246013086108666, 'bear_time_stop': 62, 'bear_use_sma': True, 'bear_use_ema': False, 'bear_use_atr': True, 'bear_use_adx': False, 'bear_use_spike': True, 'bear_rsi_required': True, 'sideways_strategy': 'breakout', 'sideways_bb_std_mult': 2.4916072420428783, 'sideways_rsi_os': 32, 'sideways_rsi_ob': 84, 'sideways_adx_thresh': 21.665792078301106, 'sideways_atr_min_pct': 0.000325508569674976, 'sideways_atr_max_pct': 0.015009652107312593, 'sideways_tp_mult': 2.650413549204979, 'sideways_tsl_mult': 0.5889116786436581, 'sideways_time_stop': 147, 'sideways_use_sma': True, 'sideways_use_ema': True, 'sideways_use_atr': False, 'sideways_use_adx': True, 'sideways_use_spike': True, 'sideways_rsi_required': False}.
[I 2025-08-31 10:38:44,168] Trial 383 finished with values: [-1000000000.0, 1000000000.0] and parameters: {'p_sma': 52, 'p_std': 35, 'p_atr': 18, 'p_adx': 7, 'rsi_period': 24, 'ema1': 12, 'ema2': 20, 'slip_atr_k': 0.0645418399458504, 'slip_spread_k': 0.6681823972857759, 'spread_hl_frac': 0.02895719694941159, 'bb_std_mult': 2.4829862982834983, 'rsi_os': 42, 'rsi_ob': 75, 'vol_spike': 0.2282156566136555, 'adx_thresh': 8.712129189053243, 'atr_min_pct': 0.021399587552061596, 'atr_max_pct': 0.1389487799740194, 'tp_mult': 2.8334502176826244, 'tsl_mult': 0.5550161450885439, 'strategy': 'breakout', 'time_stop': 146, 'use_sma': False, 'use_atr': False, 'use_adx': True, 'use_ema': False, 'use_spike': True, 'rsi_required': False, 'edge_k': 1.4188622297124749, 'edge_cap': 0.20308836923600765, 'bull_strategy': 'breakout', 'bull_bb_std_mult': 1.0543851294847109, 'bull_rsi_os': 53, 'bull_rsi_ob': 77, 'bull_adx_thresh': 11.758717161677476, 'bull_atr_min_pct': 0.0054033038188403965, 'bull_atr_max_pct': 0.0632255313507807, 'bull_tp_mult': 2.085675574634239, 'bull_tsl_mult': 0.29369049650717666, 'bull_time_stop': 287, 'bull_use_sma': True, 'bull_use_ema': True, 'bull_use_atr': True, 'bull_use_adx': True, 'bull_use_spike': True, 'bull_rsi_required': False, 'bear_strategy': 'breakout', 'bear_bb_std_mult': 3.368755773293059, 'bear_rsi_os': 29, 'bear_rsi_ob': 59, 'bear_adx_thresh': 33.14456946274262, 'bear_atr_min_pct': 0.017595896942441153, 'bear_atr_max_pct': 0.05618216375239765, 'bear_tp_mult': 2.6501616880301566, 'bear_tsl_mult': 0.16116913255682358, 'bear_time_stop': 38, 'bear_use_sma': False, 'bear_use_ema': False, 'bear_use_atr': True, 'bear_use_adx': False, 'bear_use_spike': True, 'bear_rsi_required': True, 'sideways_strategy': 'mean_reversion', 'sideways_bb_std_mult': 3.0838946897812787, 'sideways_rsi_os': 32, 'sideways_rsi_ob': 87, 'sideways_adx_thresh': 21.32911075137083, 'sideways_atr_min_pct': 0.006541066844639863, 'sideways_atr_max_pct': 0.016691649017404952, 'sideways_tp_mult': 2.4764187714540427, 'sideways_tsl_mult': 0.5921939210933911, 'sideways_time_stop': 272, 'sideways_use_sma': False, 'sideways_use_ema': False, 'sideways_use_atr': False, 'sideways_use_adx': False, 'sideways_use_spike': True, 'sideways_rsi_required': False}.
[I 2025-08-31 10:38:44,412] Trial 382 finished with values: [-1000000000.0, 1000000000.0] and parameters: {'p_sma': 20, 'p_std': 16, 'p_atr': 15, 'p_adx': 16, 'rsi_period': 68, 'ema1': 22, 'ema2': 42, 'slip_atr_k': 0.08993143931792023, 'slip_spread_k': 0.10626459517253423, 'spread_hl_frac': 0.028783632959696336, 'bb_std_mult': 2.6175377559643898, 'rsi_os': 21, 'rsi_ob': 57, 'vol_spike': 0.07084501922287786, 'adx_thresh': 17.024836296921265, 'atr_min_pct': 0.018690641829016235, 'atr_max_pct': 0.13720488820241747, 'tp_mult': 2.9955656925258833, 'tsl_mult': 0.5497564348178472, 'strategy': 'mean_reversion', 'time_stop': 169, 'use_sma': False, 'use_atr': False, 'use_adx': True, 'use_ema': False, 'use_spike': True, 'rsi_required': True, 'edge_k': 1.7301872594658843, 'edge_cap': 0.18285820616898202, 'bull_strategy': 'breakout', 'bull_bb_std_mult': 1.9741541655126806, 'bull_rsi_os': 24, 'bull_rsi_ob': 94, 'bull_adx_thresh': 22.714201635217552, 'bull_atr_min_pct': 0.004301870575774359, 'bull_atr_max_pct': 0.14502596257748085, 'bull_tp_mult': 2.1081640584950625, 'bull_tsl_mult': 0.6992990494196708, 'bull_time_stop': 32, 'bull_use_sma': True, 'bull_use_ema': True, 'bull_use_atr': True, 'bull_use_adx': True, 'bull_use_spike': True, 'bull_rsi_required': False, 'bear_strategy': 'breakout', 'bear_bb_std_mult': 2.1132535398451116, 'bear_rsi_os': 41, 'bear_rsi_ob': 57, 'bear_adx_thresh': 7.186524093948456, 'bear_atr_min_pct': 0.017668115475992247, 'bear_atr_max_pct': 0.05758490466173666, 'bear_tp_mult': 2.19535643073471, 'bear_tsl_mult': 0.10857133513854056, 'bear_time_stop': 299, 'bear_use_sma': True, 'bear_use_ema': False, 'bear_use_atr': True, 'bear_use_adx': False, 'bear_use_spike': True, 'bear_rsi_required': True, 'sideways_strategy': 'breakout', 'sideways_bb_std_mult': 2.523221821519636, 'sideways_rsi_os': 15, 'sideways_rsi_ob': 87, 'sideways_adx_thresh': 7.23072014957666, 'sideways_atr_min_pct': 0.00630070816472114, 'sideways_atr_max_pct': 0.01700143650200271, 'sideways_tp_mult': 2.6521613539693893, 'sideways_tsl_mult': 0.8580961501433474, 'sideways_time_stop': 251, 'sideways_use_sma': False, 'sideways_use_ema': False, 'sideways_use_atr': False, 'sideways_use_adx': True, 'sideways_use_spike': True, 'sideways_rsi_required': False}.
[I 2025-08-31 10:38:44,583] Trial 384 finished with values: [-1000000000.0, 1000000000.0] and parameters: {'p_sma': 29, 'p_std': 22, 'p_atr': 15, 'p_adx': 7, 'rsi_period': 24, 'ema1': 12, 'ema2': 58, 'slip_atr_k': 0.17530429509997933, 'slip_spread_k': 0.09989711014743169, 'spread_hl_frac': 0.012438326002326132, 'bb_std_mult': 2.4840758116909925, 'rsi_os': 42, 'rsi_ob': 73, 'vol_spike': 0.20934132415157836, 'adx_thresh': 21.23565155905254, 'atr_min_pct': 0.011006436331936362, 'atr_max_pct': 0.08042478677035578, 'tp_mult': 2.784867198663856, 'tsl_mult': 0.547237271755024, 'strategy': 'breakout', 'time_stop': 147, 'use_sma': False, 'use_atr': False, 'use_adx': True, 'use_ema': False, 'use_spike': True, 'rsi_required': False, 'edge_k': 1.848491800817303, 'edge_cap': 0.5040862878100888, 'bull_strategy': 'breakout', 'bull_bb_std_mult': 1.381789835733765, 'bull_rsi_os': 24, 'bull_rsi_ob': 77, 'bull_adx_thresh': 11.533974860438434, 'bull_atr_min_pct': 0.005828168073534931, 'bull_atr_max_pct': 0.10215641063937775, 'bull_tp_mult': 2.451486543951876, 'bull_tsl_mult': 0.7036911911412291, 'bull_time_stop': 137, 'bull_use_sma': True, 'bull_use_ema': True, 'bull_use_atr': True, 'bull_use_adx': True, 'bull_use_spike': True, 'bull_rsi_required': False, 'bear_strategy': 'breakout', 'bear_bb_std_mult': 1.9067286238102532, 'bear_rsi_os': 29, 'bear_rsi_ob': 94, 'bear_adx_thresh': 5.037216604190869, 'bear_atr_min_pct': 0.01759121178039786, 'bear_atr_max_pct': 0.11933402557338307, 'bear_tp_mult': 2.7422679372463015, 'bear_tsl_mult': 0.5151786185113217, 'bear_time_stop': 39, 'bear_use_sma': False, 'bear_use_ema': False, 'bear_use_atr': True, 'bear_use_adx': False, 'bear_use_spike': True, 'bear_rsi_required': False, 'sideways_strategy': 'mean_reversion', 'sideways_bb_std_mult': 2.71392243810797, 'sideways_rsi_os': 15, 'sideways_rsi_ob': 57, 'sideways_adx_thresh': 6.569316227142981, 'sideways_atr_min_pct': 0.006526545871886235, 'sideways_atr_max_pct': 0.131908210990464, 'sideways_tp_mult': 1.164891387921807, 'sideways_tsl_mult': 0.8566664309326129, 'sideways_time_stop': 273, 'sideways_use_sma': False, 'sideways_use_ema': False, 'sideways_use_atr': True, 'sideways_use_adx': False, 'sideways_use_spike': True, 'sideways_rsi_required': False}.
[I 2025-08-31 10:38:44,792] Trial 381 finished with values: [-1000000000.0, 1000000000.0] and parameters: {'p_sma': 20, 'p_std': 34, 'p_atr': 15, 'p_adx': 7, 'rsi_period': 70, 'ema1': 12, 'ema2': 46, 'slip_atr_k': 0.06361880972424495, 'slip_spread_k': 0.2634647886462443, 'spread_hl_frac': 0.028737286572027086, 'bb_std_mult': 2.6570383980213603, 'rsi_os': 21, 'rsi_ob': 57, 'vol_spike': 0.0671400497058065, 'adx_thresh': 20.140522426884015, 'atr_min_pct': 0.021337000648349543, 'atr_max_pct': 0.04655741890448134, 'tp_mult': 2.837756905669565, 'tsl_mult': 0.6116658541723735, 'strategy': 'mean_reversion', 'time_stop': 144, 'use_sma': False, 'use_atr': False, 'use_adx': True, 'use_ema': False, 'use_spike': True, 'rsi_required': True, 'edge_k': 1.7346101788595925, 'edge_cap': 0.17587629233392693, 'bull_strategy': 'breakout', 'bull_bb_std_mult': 3.4688051514248626, 'bull_rsi_os': 40, 'bull_rsi_ob': 92, 'bull_adx_thresh': 22.72002145693112, 'bull_atr_min_pct': 0.003998372298479766, 'bull_atr_max_pct': 0.14536338960174544, 'bull_tp_mult': 1.103082518120513, 'bull_tsl_mult': 0.2548223259018554, 'bull_time_stop': 31, 'bull_use_sma': True, 'bull_use_ema': True, 'bull_use_atr': True, 'bull_use_adx': True, 'bull_use_spike': True, 'bull_rsi_required': False, 'bear_strategy': 'breakout', 'bear_bb_std_mult': 2.0878562226368724, 'bear_rsi_os': 26, 'bear_rsi_ob': 94, 'bear_adx_thresh': 10.936585016445765, 'bear_atr_min_pct': 0.0180949664724211, 'bear_atr_max_pct': 0.056790035796759064, 'bear_tp_mult': 2.6526114455087306, 'bear_tsl_mult': 0.11093820705066065, 'bear_time_stop': 40, 'bear_use_sma': True, 'bear_use_ema': False, 'bear_use_atr': True, 'bear_use_adx': False, 'bear_use_spike': True, 'bear_rsi_required': True, 'sideways_strategy': 'breakout', 'sideways_bb_std_mult': 2.767862310812421, 'sideways_rsi_os': 36, 'sideways_rsi_ob': 87, 'sideways_adx_thresh': 21.51497331136089, 'sideways_atr_min_pct': 0.0003524340373778599, 'sideways_atr_max_pct': 0.14423512018416568, 'sideways_tp_mult': 2.132929796528651, 'sideways_tsl_mult': 0.8586078760438259, 'sideways_time_stop': 254, 'sideways_use_sma': True, 'sideways_use_ema': True, 'sideways_use_atr': False, 'sideways_use_adx': True, 'sideways_use_spike': True, 'sideways_rsi_required': False}.
[I 2025-08-31 10:38:45,538] Trial 387 finished with values: [-1000000000.0, 1000000000.0] and parameters: {'p_sma': 60, 'p_std': 19, 'p_atr': 16, 'p_adx': 9, 'rsi_period': 44, 'ema1': 7, 'ema2': 27, 'slip_atr_k': 0.1325855856008532, 'slip_spread_k': 0.3078380014194951, 'spread_hl_frac': 0.04782624461369477, 'bb_std_mult': 2.5685899922530635, 'rsi_os': 41, 'rsi_ob': 48, 'vol_spike': 0.03366255996963874, 'adx_thresh': 32.30533875033933, 'atr_min_pct': 0.014997486016524944, 'atr_max_pct': 0.03320820566547421, 'tp_mult': 2.8430703479256616, 'tsl_mult': 0.6250731921752847, 'strategy': 'mean_reversion', 'time_stop': 156, 'use_sma': False, 'use_atr': False, 'use_adx': False, 'use_ema': False, 'use_spike': False, 'rsi_required': True, 'edge_k': 0.08446460413632717, 'edge_cap': 0.8405134156409564, 'bull_strategy': 'breakout', 'bull_bb_std_mult': 2.3008772323460382, 'bull_rsi_os': 41, 'bull_rsi_ob': 75, 'bull_adx_thresh': 12.847787211131616, 'bull_atr_min_pct': 0.008141485034082827, 'bull_atr_max_pct': 0.07286750435927117, 'bull_tp_mult': 2.375245245537406, 'bull_tsl_mult': 0.5587342197082106, 'bull_time_stop': 199, 'bull_use_sma': True, 'bull_use_ema': True, 'bull_use_atr': True, 'bull_use_adx': False, 'bull_use_spike': True, 'bull_rsi_required': False, 'bear_strategy': 'breakout', 'bear_bb_std_mult': 2.0036568491677444, 'bear_rsi_os': 31, 'bear_rsi_ob': 47, 'bear_adx_thresh': 20.484624529631596, 'bear_atr_min_pct': 0.016974224673207895, 'bear_atr_max_pct': 0.06716002102113577, 'bear_tp_mult': 1.5240051485566308, 'bear_tsl_mult': 0.4279899082561406, 'bear_time_stop': 30, 'bear_use_sma': False, 'bear_use_ema': False, 'bear_use_atr': True, 'bear_use_adx': True, 'bear_use_spike': True, 'bear_rsi_required': False, 'sideways_strategy': 'breakout', 'sideways_bb_std_mult': 2.5994582029958226, 'sideways_rsi_os': 25, 'sideways_rsi_ob': 83, 'sideways_adx_thresh': 15.661406569786163, 'sideways_atr_min_pct': 0.0021183981812110475, 'sideways_atr_max_pct': 0.09541297150924553, 'sideways_tp_mult': 1.2275605879105287, 'sideways_tsl_mult': 0.6269515989848631, 'sideways_time_stop': 214, 'sideways_use_sma': True, 'sideways_use_ema': False, 'sideways_use_atr': False, 'sideways_use_adx': False, 'sideways_use_spike': True, 'sideways_rsi_required': False}.
[I 2025-08-31 10:39:16,530] Trial 388 finished with values: [-0.010904472465779302, 0.010763209631548773] and parameters: {'p_sma': 25, 'p_std': 33, 'p_atr': 20, 'p_adx': 9, 'rsi_period': 72, 'ema1': 9, 'ema2': 58, 'slip_atr_k': 0.0695871847267121, 'slip_spread_k': 0.3064588024661302, 'spread_hl_frac': 0.02574316646033114, 'bb_std_mult': 2.5696462777252185, 'rsi_os': 41, 'rsi_ob': 86, 'vol_spike': 0.03248541226231508, 'adx_thresh': 32.130740185579306, 'atr_min_pct': 0.019688710477499972, 'atr_max_pct': 0.03293635766210486, 'tp_mult': 1.567993886111855, 'tsl_mult': 0.31599706015274126, 'strategy': 'mean_reversion', 'time_stop': 228, 'use_sma': False, 'use_atr': False, 'use_adx': False, 'use_ema': False, 'use_spike': False, 'rsi_required': True, 'edge_k': 1.6455110135276851, 'edge_cap': 0.714080986286546, 'bull_strategy': 'breakout', 'bull_bb_std_mult': 3.254489371116085, 'bull_rsi_os': 41, 'bull_rsi_ob': 60, 'bull_adx_thresh': 12.871221131231527, 'bull_atr_min_pct': 0.002444965473023154, 'bull_atr_max_pct': 0.07061091203444861, 'bull_tp_mult': 1.2563350075405388, 'bull_tsl_mult': 0.06898503830914378, 'bull_time_stop': 199, 'bull_use_sma': True, 'bull_use_ema': True, 'bull_use_atr': True, 'bull_use_adx': False, 'bull_use_spike': False, 'bull_rsi_required': False, 'bear_strategy': 'breakout', 'bear_bb_std_mult': 2.271550558478636, 'bear_rsi_os': 32, 'bear_rsi_ob': 55, 'bear_adx_thresh': 26.495803865189853, 'bear_atr_min_pct': 0.02845225508593143, 'bear_atr_max_pct': 0.06592563050147536, 'bear_tp_mult': 2.5375072004290344, 'bear_tsl_mult': 0.14192826468887634, 'bear_time_stop': 77, 'bear_use_sma': False, 'bear_use_ema': False, 'bear_use_atr': False, 'bear_use_adx': True, 'bear_use_spike': False, 'bear_rsi_required': False, 'sideways_strategy': 'breakout', 'sideways_bb_std_mult': 2.677060694965705, 'sideways_rsi_os': 33, 'sideways_rsi_ob': 93, 'sideways_adx_thresh': 15.432446327086826, 'sideways_atr_min_pct': 0.00995139181954804, 'sideways_atr_max_pct': 0.02189803507004458, 'sideways_tp_mult': 1.722353457170152, 'sideways_tsl_mult': 0.8085367489590021, 'sideways_time_stop': 219, 'sideways_use_sma': True, 'sideways_use_ema': False, 'sideways_use_atr': True, 'sideways_use_adx': False, 'sideways_use_spike': False, 'sideways_rsi_required': False}.
