[I 2025-08-31 11:33:32,870] Trial 794 finished with values: [-1000000000.0, 1000000000.0] and parameters: {'p_sma': 36, 'p_std': 17, 'p_atr': 27, 'p_adx': 22, 'rsi_period': 73, 'ema1': 6, 'ema2': 53, 'slip_atr_k': 0.020365916870752638, 'slip_spread_k': 0.18604561505798556, 'spread_hl_frac': 0.04372284165680652, 'bb_std_mult': 1.3632842956011153, 'rsi_os': 17, 'rsi_ob': 80, 'vol_spike': 0.026311893308616288, 'adx_thresh': 10.371357777388608, 'atr_min_pct': 0.02996220248990764, 'atr_max_pct': 0.05603966094219764, 'tp_mult': 2.9989662474158534, 'tsl_mult': 0.8542944147235416, 'strategy': 'breakout', 'time_stop': 81, 'use_sma': True, 'use_atr': True, 'use_adx': False, 'use_ema': True, 'use_spike': False, 'rsi_required': False, 'edge_k': 1.4049774530773818, 'edge_cap': 0.7304420321534935, 'bull_strategy': 'mean_reversion', 'bull_bb_std_mult': 2.01056295799949, 'bull_rsi_os': 36, 'bull_rsi_ob': 61, 'bull_adx_thresh': 27.287513338278984, 'bull_atr_min_pct': 0.013088618124970886, 'bull_atr_max_pct': 0.09905210495834825, 'bull_tp_mult': 2.849421146732811, 'bull_tsl_mult': 0.37622164069505765, 'bull_time_stop': 166, 'bull_use_sma': False, 'bull_use_ema': True, 'bull_use_atr': True, 'bull_use_adx': True, 'bull_use_spike': False, 'bull_rsi_required': False, 'bear_strategy': 'mean_reversion', 'bear_bb_std_mult': 1.782012793331003, 'bear_rsi_os': 35, 'bear_rsi_ob': 50, 'bear_adx_thresh': 12.302408270853743, 'bear_atr_min_pct': 0.0298415872024545, 'bear_atr_max_pct': 0.1395274494936127, 'bear_tp_mult': 1.8590106578582462, 'bear_tsl_mult': 0.9332408196447002, 'bear_time_stop': 101, 'bear_use_sma': True, 'bear_use_ema': True, 'bear_use_atr': True, 'bear_use_adx': False, 'bear_use_spike': False, 'bear_rsi_required': False, 'sideways_strategy': 'mean_reversion', 'sideways_bb_std_mult': 1.0008224692674896, 'sideways_rsi_os': 24, 'sideways_rsi_ob': 61, 'sideways_adx_thresh': 11.511611608012851, 'sideways_atr_min_pct': 0.008177749318604655, 'sideways_atr_max_pct': 0.14989732051589924, 'sideways_tp_mult': 1.62953454279349, 'sideways_tsl_mult': 0.8380121188149883, 'sideways_time_stop': 300, 'sideways_use_sma': True, 'sideways_use_ema': True, 'sideways_use_atr': True, 'sideways_use_adx': True, 'sideways_use_spike': True, 'sideways_rsi_required': True}.
[I 2025-08-31 11:33:32,883] Trial 793 finished with values: [-1000000000.0, 1000000000.0] and parameters: {'p_sma': 55, 'p_std': 13, 'p_atr': 29, 'p_adx': 21, 'rsi_period': 37, 'ema1': 8, 'ema2': 14, 'slip_atr_k': 0.22289477187069873, 'slip_spread_k': 0.4470476903663423, 'spread_hl_frac': 0.033264829453680325, 'bb_std_mult': 0.5845185602762262, 'rsi_os': 49, 'rsi_ob': 81, 'vol_spike': 0.0258704949422653, 'adx_thresh': 10.370694675796473, 'atr_min_pct': 0.027538343227908817, 'atr_max_pct': 0.0547708653016686, 'tp_mult': 2.997067036319088, 'tsl_mult': 0.09099569754442782, 'strategy': 'breakout', 'time_stop': 79, 'use_sma': True, 'use_atr': True, 'use_adx': False, 'use_ema': True, 'use_spike': False, 'rsi_required': False, 'edge_k': 1.3943251908422014, 'edge_cap': 0.7305536160309576, 'bull_strategy': 'mean_reversion', 'bull_bb_std_mult': 1.913886435238431, 'bull_rsi_os': 43, 'bull_rsi_ob': 61, 'bull_adx_thresh': 27.27752571032312, 'bull_atr_min_pct': 0.01099854545293111, 'bull_atr_max_pct': 0.033821082568914654, 'bull_tp_mult': 2.8990439244119113, 'bull_tsl_mult': 0.3301877924267801, 'bull_time_stop': 54, 'bull_use_sma': False, 'bull_use_ema': True, 'bull_use_atr': False, 'bull_use_adx': False, 'bull_use_spike': False, 'bull_rsi_required': False, 'bear_strategy': 'mean_reversion', 'bear_bb_std_mult': 3.536041623452344, 'bear_rsi_os': 51, 'bear_rsi_ob': 92, 'bear_adx_thresh': 12.267245833709424, 'bear_atr_min_pct': 0.0201644844050286, 'bear_atr_max_pct': 0.13494141973102375, 'bear_tp_mult': 2.3958843034360617, 'bear_tsl_mult': 0.932073831114418, 'bear_time_stop': 100, 'bear_use_sma': True, 'bear_use_ema': True, 'bear_use_atr': True, 'bear_use_adx': True, 'bear_use_spike': False, 'bear_rsi_required': False, 'sideways_strategy': 'mean_reversion', 'sideways_bb_std_mult': 3.445203642460013, 'sideways_rsi_os': 42, 'sideways_rsi_ob': 71, 'sideways_adx_thresh': 26.350967208809934, 'sideways_atr_min_pct': 0.01471980553789074, 'sideways_atr_max_pct': 0.04656575987806057, 'sideways_tp_mult': 1.6279060951057276, 'sideways_tsl_mult': 0.8393514359330715, 'sideways_time_stop': 300, 'sideways_use_sma': True, 'sideways_use_ema': True, 'sideways_use_atr': True, 'sideways_use_adx': True, 'sideways_use_spike': True, 'sideways_rsi_required': True}.
[I 2025-08-31 11:33:33,106] Trial 792 finished with values: [-1000000000.0, 1000000000.0] and parameters: {'p_sma': 26, 'p_std': 29, 'p_atr': 27, 'p_adx': 22, 'rsi_period': 82, 'ema1': 8, 'ema2': 26, 'slip_atr_k': 0.02636098454696936, 'slip_spread_k': 0.18714857615854485, 'spread_hl_frac': 0.03596221283224017, 'bb_std_mult': 0.6943867732094754, 'rsi_os': 46, 'rsi_ob': 81, 'vol_spike': 0.11219760466426816, 'adx_thresh': 10.327975594574824, 'atr_min_pct': 0.022465150847381248, 'atr_max_pct': 0.06407551076482718, 'tp_mult': 2.9201796807980664, 'tsl_mult': 0.8529895046439401, 'strategy': 'breakout', 'time_stop': 80, 'use_sma': True, 'use_atr': True, 'use_adx': True, 'use_ema': True, 'use_spike': False, 'rsi_required': True, 'edge_k': 1.4078310050797374, 'edge_cap': 0.5687471141348793, 'bull_strategy': 'mean_reversion', 'bull_bb_std_mult': 1.922263298823075, 'bull_rsi_os': 24, 'bull_rsi_ob': 53, 'bull_adx_thresh': 27.198879305190342, 'bull_atr_min_pct': 0.012565772410988192, 'bull_atr_max_pct': 0.08138630385097936, 'bull_tp_mult': 1.332202936853737, 'bull_tsl_mult': 0.835576553742517, 'bull_time_stop': 52, 'bull_use_sma': False, 'bull_use_ema': True, 'bull_use_atr': False, 'bull_use_adx': True, 'bull_use_spike': False, 'bull_rsi_required': False, 'bear_strategy': 'mean_reversion', 'bear_bb_std_mult': 1.7988688580541088, 'bear_rsi_os': 51, 'bear_rsi_ob': 55, 'bear_adx_thresh': 9.536170882373264, 'bear_atr_min_pct': 0.001726948409889133, 'bear_atr_max_pct': 0.055803898076141195, 'bear_tp_mult': 2.727843211341508, 'bear_tsl_mult': 0.981132268000961, 'bear_time_stop': 69, 'bear_use_sma': True, 'bear_use_ema': True, 'bear_use_atr': True, 'bear_use_adx': False, 'bear_use_spike': False, 'bear_rsi_required': False, 'sideways_strategy': 'breakout', 'sideways_bb_std_mult': 1.0055617453719825, 'sideways_rsi_os': 21, 'sideways_rsi_ob': 80, 'sideways_adx_thresh': 29.423650883012463, 'sideways_atr_min_pct': 0.014920948025566495, 'sideways_atr_max_pct': 0.06951252488708956, 'sideways_tp_mult': 1.6333995448130862, 'sideways_tsl_mult': 0.8454605310091217, 'sideways_time_stop': 94, 'sideways_use_sma': False, 'sideways_use_ema': True, 'sideways_use_atr': True, 'sideways_use_adx': True, 'sideways_use_spike': True, 'sideways_rsi_required': False}.
[I 2025-08-31 11:33:33,694] Trial 795 finished with values: [-1000000000.0, 1000000000.0] and parameters: {'p_sma': 28, 'p_std': 26, 'p_atr': 27, 'p_adx': 16, 'rsi_period': 37, 'ema1': 6, 'ema2': 26, 'slip_atr_k': 0.14669117310513702, 'slip_spread_k': 0.425329080907683, 'spread_hl_frac': 0.020973319590420897, 'bb_std_mult': 1.327790794945281, 'rsi_os': 33, 'rsi_ob': 60, 'vol_spike': 0.024198950298498112, 'adx_thresh': 10.299614778395734, 'atr_min_pct': 0.02047984598106431, 'atr_max_pct': 0.05502845803408938, 'tp_mult': 2.897684534559516, 'tsl_mult': 0.036778567834529485, 'strategy': 'breakout', 'time_stop': 83, 'use_sma': True, 'use_atr': True, 'use_adx': False, 'use_ema': True, 'use_spike': False, 'rsi_required': False, 'edge_k': 1.2353702159333608, 'edge_cap': 0.7235868148335687, 'bull_strategy': 'mean_reversion', 'bull_bb_std_mult': 0.5003595120175348, 'bull_rsi_os': 41, 'bull_rsi_ob': 46, 'bull_adx_thresh': 27.02532868630272, 'bull_atr_min_pct': 0.013158462094931043, 'bull_atr_max_pct': 0.03402804211683668, 'bull_tp_mult': 1.9552305179450875, 'bull_tsl_mult': 0.24978786534508726, 'bull_time_stop': 30, 'bull_use_sma': False, 'bull_use_ema': True, 'bull_use_atr': True, 'bull_use_adx': True, 'bull_use_spike': False, 'bull_rsi_required': True, 'bear_strategy': 'mean_reversion', 'bear_bb_std_mult': 0.9687499880356139, 'bear_rsi_os': 52, 'bear_rsi_ob': 54, 'bear_adx_thresh': 18.31347193796301, 'bear_atr_min_pct': 0.010636994884629105, 'bear_atr_max_pct': 0.14293519094833873, 'bear_tp_mult': 1.765005176539376, 'bear_tsl_mult': 0.9791782426024355, 'bear_time_stop': 66, 'bear_use_sma': True, 'bear_use_ema': True, 'bear_use_atr': True, 'bear_use_adx': False, 'bear_use_spike': False, 'bear_rsi_required': False, 'sideways_strategy': 'mean_reversion', 'sideways_bb_std_mult': 1.0113406436342363, 'sideways_rsi_os': 42, 'sideways_rsi_ob': 66, 'sideways_adx_thresh': 29.557644935967296, 'sideways_atr_min_pct': 0.014084204080103814, 'sideways_atr_max_pct': 0.14998215790826624, 'sideways_tp_mult': 2.382033777148964, 'sideways_tsl_mult': 0.8645994955952536, 'sideways_time_stop': 166, 'sideways_use_sma': True, 'sideways_use_ema': True, 'sideways_use_atr': True, 'sideways_use_adx': True, 'sideways_use_spike': False, 'sideways_rsi_required': True}.
[I 2025-08-31 11:34:07,160] Trial 796 finished with values: [-1000000000.0, 1000000000.0] and parameters: {'p_sma': 34, 'p_std': 26, 'p_atr': 28, 'p_adx': 11, 'rsi_period': 30, 'ema1': 6, 'ema2': 26, 'slip_atr_k': 0.120162246376684, 'slip_spread_k': 0.4295310507094616, 'spread_hl_frac': 0.012475836729664971, 'bb_std_mult': 0.6800018560060184, 'rsi_os': 32, 'rsi_ob': 70, 'vol_spike': 0.03348862696927307, 'adx_thresh': 11.049885489525595, 'atr_min_pct': 0.009064303393545201, 'atr_max_pct': 0.06414375948252403, 'tp_mult': 1.7183023484261113, 'tsl_mult': 0.4004198464742394, 'strategy': 'breakout', 'time_stop': 91, 'use_sma': True, 'use_atr': True, 'use_adx': False, 'use_ema': True, 'use_spike': False, 'rsi_required': False, 'edge_k': 1.5947130424606095, 'edge_cap': 0.6511366651006537, 'bull_strategy': 'mean_reversion', 'bull_bb_std_mult': 1.5934624991864408, 'bull_rsi_os': 41, 'bull_rsi_ob': 87, 'bull_adx_thresh': 34.446912598059626, 'bull_atr_min_pct': 0.012319284061339773, 'bull_atr_max_pct': 0.03084321610088, 'bull_tp_mult': 2.8326223439538087, 'bull_tsl_mult': 0.6491262879482353, 'bull_time_stop': 33, 'bull_use_sma': False, 'bull_use_ema': True, 'bull_use_atr': False, 'bull_use_adx': True, 'bull_use_spike': False, 'bull_rsi_required': True, 'bear_strategy': 'mean_reversion', 'bear_bb_std_mult': 2.3190316428175684, 'bear_rsi_os': 52, 'bear_rsi_ob': 53, 'bear_adx_thresh': 9.692180543259866, 'bear_atr_min_pct': 0.010663474192881384, 'bear_atr_max_pct': 0.014711439252103567, 'bear_tp_mult': 1.261722875821365, 'bear_tsl_mult': 0.8436350429885546, 'bear_time_stop': 109, 'bear_use_sma': False, 'bear_use_ema': False, 'bear_use_atr': True, 'bear_use_adx': False, 'bear_use_spike': True, 'bear_rsi_required': False, 'sideways_strategy': 'mean_reversion', 'sideways_bb_std_mult': 1.0090165790576848, 'sideways_rsi_os': 20, 'sideways_rsi_ob': 61, 'sideways_adx_thresh': 28.50870542082272, 'sideways_atr_min_pct': 0.017136720026031442, 'sideways_atr_max_pct': 0.10380782917490367, 'sideways_tp_mult': 1.5825436347556243, 'sideways_tsl_mult': 0.8753704990831439, 'sideways_time_stop': 177, 'sideways_use_sma': True, 'sideways_use_ema': True, 'sideways_use_atr': False, 'sideways_use_adx': False, 'sideways_use_spike': False, 'sideways_rsi_required': False}.
[I 2025-08-31 11:34:07,525] Trial 797 finished with values: [-1000000000.0, 1000000000.0] and parameters: {'p_sma': 34, 'p_std': 27, 'p_atr': 28, 'p_adx': 11, 'rsi_period': 30, 'ema1': 6, 'ema2': 26, 'slip_atr_k': 0.08620969006645926, 'slip_spread_k': 0.4201956236804253, 'spread_hl_frac': 0.04593299098595889, 'bb_std_mult': 1.8714917764406784, 'rsi_os': 32, 'rsi_ob': 83, 'vol_spike': 0.10456251802903391, 'adx_thresh': 12.002161481381972, 'atr_min_pct': 0.022228275093992222, 'atr_max_pct': 0.06341793095255863, 'tp_mult': 2.8746430831379493, 'tsl_mult': 0.07645074032689095, 'strategy': 'breakout', 'time_stop': 90, 'use_sma': True, 'use_atr': True, 'use_adx': False, 'use_ema': True, 'use_spike': False, 'rsi_required': False, 'edge_k': 1.6145869748420396, 'edge_cap': 0.6515544447006472, 'bull_strategy': 'mean_reversion', 'bull_bb_std_mult': 2.5493228130014463, 'bull_rsi_os': 41, 'bull_rsi_ob': 53, 'bull_adx_thresh': 26.78397796554416, 'bull_atr_min_pct': 0.019632884594548084, 'bull_atr_max_pct': 0.051949386806085206, 'bull_tp_mult': 2.8414526238063593, 'bull_tsl_mult': 0.25886461997963883, 'bull_time_stop': 51, 'bull_use_sma': False, 'bull_use_ema': True, 'bull_use_atr': False, 'bull_use_adx': True, 'bull_use_spike': False, 'bull_rsi_required': True, 'bear_strategy': 'mean_reversion', 'bear_bb_std_mult': 1.4702856567609215, 'bear_rsi_os': 8, 'bear_rsi_ob': 95, 'bear_adx_thresh': 8.368703749531342, 'bear_atr_min_pct': 0.005260736455124515, 'bear_atr_max_pct': 0.14298685220039073, 'bear_tp_mult': 2.6107111176447617, 'bear_tsl_mult': 0.8453751473270299, 'bear_time_stop': 213, 'bear_use_sma': False, 'bear_use_ema': False, 'bear_use_atr': True, 'bear_use_adx': False, 'bear_use_spike': True, 'bear_rsi_required': False, 'sideways_strategy': 'mean_reversion', 'sideways_bb_std_mult': 1.0104325667479985, 'sideways_rsi_os': 22, 'sideways_rsi_ob': 65, 'sideways_adx_thresh': 27.20270171214915, 'sideways_atr_min_pct': 0.01829503948677346, 'sideways_atr_max_pct': 0.11299755878760216, 'sideways_tp_mult': 2.394893971626299, 'sideways_tsl_mult': 0.17137769906502182, 'sideways_time_stop': 167, 'sideways_use_sma': True, 'sideways_use_ema': True, 'sideways_use_atr': False, 'sideways_use_adx': False, 'sideways_use_spike': False, 'sideways_rsi_required': False}.
[I 2025-08-31 11:34:07,629] Trial 798 finished with values: [-1000000000.0, 1000000000.0] and parameters: {'p_sma': 34, 'p_std': 11, 'p_atr': 28, 'p_adx': 27, 'rsi_period': 57, 'ema1': 6, 'ema2': 20, 'slip_atr_k': 0.12066851853924214, 'slip_spread_k': 0.7393080935276327, 'spread_hl_frac': 0.01814696048455851, 'bb_std_mult': 0.6659608318676347, 'rsi_os': 33, 'rsi_ob': 83, 'vol_spike': 0.03315637899662657, 'adx_thresh': 11.274036854294872, 'atr_min_pct': 0.000569559027299188, 'atr_max_pct': 0.06226903052857946, 'tp_mult': 2.8558730172956897, 'tsl_mult': 0.08073638061407315, 'strategy': 'breakout', 'time_stop': 184, 'use_sma': True, 'use_atr': True, 'use_adx': False, 'use_ema': True, 'use_spike': False, 'rsi_required': False, 'edge_k': 1.2390091762139488, 'edge_cap': 0.6536374025483419, 'bull_strategy': 'mean_reversion', 'bull_bb_std_mult': 2.5493722823537603, 'bull_rsi_os': 41, 'bull_rsi_ob': 46, 'bull_adx_thresh': 34.551412514446895, 'bull_atr_min_pct': 0.013350778533497929, 'bull_atr_max_pct': 0.10406507705529808, 'bull_tp_mult': 2.8394256743687976, 'bull_tsl_mult': 0.24889219035676105, 'bull_time_stop': 30, 'bull_use_sma': False, 'bull_use_ema': True, 'bull_use_atr': True, 'bull_use_adx': True, 'bull_use_spike': False, 'bull_rsi_required': True, 'bear_strategy': 'mean_reversion', 'bear_bb_std_mult': 1.4728172837704145, 'bear_rsi_os': 15, 'bear_rsi_ob': 53, 'bear_adx_thresh': 18.52759608681445, 'bear_atr_min_pct': 0.005826466770873354, 'bear_atr_max_pct': 0.14416913252054578, 'bear_tp_mult': 2.6141775613150893, 'bear_tsl_mult': 0.845215182784353, 'bear_time_stop': 111, 'bear_use_sma': False, 'bear_use_ema': False, 'bear_use_atr': True, 'bear_use_adx': False, 'bear_use_spike': True, 'bear_rsi_required': False, 'sideways_strategy': 'mean_reversion', 'sideways_bb_std_mult': 1.497871750330157, 'sideways_rsi_os': 40, 'sideways_rsi_ob': 60, 'sideways_adx_thresh': 27.395094576759316, 'sideways_atr_min_pct': 0.013012306540317879, 'sideways_atr_max_pct': 0.10407156313432896, 'sideways_tp_mult': 1.580089307786551, 'sideways_tsl_mult': 0.5324472853077648, 'sideways_time_stop': 177, 'sideways_use_sma': True, 'sideways_use_ema': True, 'sideways_use_atr': False, 'sideways_use_adx': False, 'sideways_use_spike': False, 'sideways_rsi_required': False}.
[I 2025-08-31 11:34:07,832] Trial 799 finished with values: [-1000000000.0, 1000000000.0] and parameters: {'p_sma': 34, 'p_std': 47, 'p_atr': 28, 'p_adx': 27, 'rsi_period': 57, 'ema1': 28, 'ema2': 20, 'slip_atr_k': 0.039222066317207135, 'slip_spread_k': 0.49687055839174765, 'spread_hl_frac': 0.0005047908212198193, 'bb_std_mult': 0.8293034696211438, 'rsi_os': 26, 'rsi_ob': 83, 'vol_spike': 0.013997698044318052, 'adx_thresh': 24.522898420792142, 'atr_min_pct': 0.021964996284530587, 'atr_max_pct': 0.06180768356880109, 'tp_mult': 2.859041345959464, 'tsl_mult': 0.07482740045318537, 'strategy': 'breakout', 'time_stop': 90, 'use_sma': True, 'use_atr': True, 'use_adx': False, 'use_ema': True, 'use_spike': False, 'rsi_required': False, 'edge_k': 1.5918164527087066, 'edge_cap': 0.6795058600427621, 'bull_strategy': 'mean_reversion', 'bull_bb_std_mult': 0.8023172643132204, 'bull_rsi_os': 18, 'bull_rsi_ob': 64, 'bull_adx_thresh': 25.685430813953495, 'bull_atr_min_pct': 0.01970087829574966, 'bull_atr_max_pct': 0.030497741176463394, 'bull_tp_mult': 2.811885635759581, 'bull_tsl_mult': 0.7686268252635157, 'bull_time_stop': 193, 'bull_use_sma': False, 'bull_use_ema': True, 'bull_use_atr': False, 'bull_use_adx': True, 'bull_use_spike': False, 'bull_rsi_required': True, 'bear_strategy': 'mean_reversion', 'bear_bb_std_mult': 1.459435929599311, 'bear_rsi_os': 8, 'bear_rsi_ob': 79, 'bear_adx_thresh': 8.245323969659387, 'bear_atr_min_pct': 0.0053707788712639695, 'bear_atr_max_pct': 0.05083778303881996, 'bear_tp_mult': 2.621354305955524, 'bear_tsl_mult': 0.8427506379814802, 'bear_time_stop': 111, 'bear_use_sma': False, 'bear_use_ema': False, 'bear_use_atr': True, 'bear_use_adx': False, 'bear_use_spike': True, 'bear_rsi_required': False, 'sideways_strategy': 'mean_reversion', 'sideways_bb_std_mult': 0.952430856396232, 'sideways_rsi_os': 40, 'sideways_rsi_ob': 92, 'sideways_adx_thresh': 27.307065509551293, 'sideways_atr_min_pct': 0.01747860394213211, 'sideways_atr_max_pct': 0.1034608775867448, 'sideways_tp_mult': 1.5781970957611715, 'sideways_tsl_mult': 0.567389282952534, 'sideways_time_stop': 199, 'sideways_use_sma': True, 'sideways_use_ema': True, 'sideways_use_atr': False, 'sideways_use_adx': False, 'sideways_use_spike': False, 'sideways_rsi_required': False}.
[I 2025-08-31 11:34:41,790] Trial 802 finished with values: [-1000000000.0, 1000000000.0] and parameters: {'p_sma': 10, 'p_std': 16, 'p_atr': 15, 'p_adx': 10, 'rsi_period': 78, 'ema1': 5, 'ema2': 16, 'slip_atr_k': 0.049611190621365556, 'slip_spread_k': 0.5824186222021681, 'spread_hl_frac': 0.02299570528391105, 'bb_std_mult': 0.590104860891516, 'rsi_os': 26, 'rsi_ob': 85, 'vol_spike': 0.1241720237561302, 'adx_thresh': 9.758792883331656, 'atr_min_pct': 0.021041817777717187, 'atr_max_pct': 0.1009939588182423, 'tp_mult': 2.934324479958641, 'tsl_mult': 0.5137177890451208, 'strategy': 'breakout', 'time_stop': 104, 'use_sma': True, 'use_atr': True, 'use_adx': False, 'use_ema': True, 'use_spike': False, 'rsi_required': False, 'edge_k': 1.485021803634736, 'edge_cap': 0.6825890546271622, 'bull_strategy': 'mean_reversion', 'bull_bb_std_mult': 0.7823240142674239, 'bull_rsi_os': 33, 'bull_rsi_ob': 64, 'bull_adx_thresh': 28.784998468705123, 'bull_atr_min_pct': 0.015651019131635958, 'bull_atr_max_pct': 0.03934564647601175, 'bull_tp_mult': 2.2543690460452335, 'bull_tsl_mult': 0.7759069215075083, 'bull_time_stop': 147, 'bull_use_sma': False, 'bull_use_ema': False, 'bull_use_atr': False, 'bull_use_adx': True, 'bull_use_spike': False, 'bull_rsi_required': False, 'bear_strategy': 'mean_reversion', 'bear_bb_std_mult': 3.15330288540326, 'bear_rsi_os': 53, 'bear_rsi_ob': 61, 'bear_adx_thresh': 11.1483526182681, 'bear_atr_min_pct': 0.006306002973478804, 'bear_atr_max_pct': 0.1276534868020425, 'bear_tp_mult': 2.7194014646836515, 'bear_tsl_mult': 0.8964944316876058, 'bear_time_stop': 206, 'bear_use_sma': False, 'bear_use_ema': False, 'bear_use_atr': False, 'bear_use_adx': False, 'bear_use_spike': True, 'bear_rsi_required': False, 'sideways_strategy': 'mean_reversion', 'sideways_bb_std_mult': 1.6661348687852202, 'sideways_rsi_os': 37, 'sideways_rsi_ob': 93, 'sideways_adx_thresh': 25.657137523869707, 'sideways_atr_min_pct': 0.004863675510455604, 'sideways_atr_max_pct': 0.04119907626266848, 'sideways_tp_mult': 1.488596316781847, 'sideways_tsl_mult': 0.808477658383778, 'sideways_time_stop': 159, 'sideways_use_sma': True, 'sideways_use_ema': True, 'sideways_use_atr': False, 'sideways_use_adx': False, 'sideways_use_spike': True, 'sideways_rsi_required': False}.
