[I 2025-08-31 10:58:15,959] Trial 538 finished with values: [-1000000000.0, 1000000000.0] and parameters: {'p_sma': 41, 'p_std': 38, 'p_atr': 21, 'p_adx': 22, 'rsi_period': 37, 'ema1': 21, 'ema2': 58, 'slip_atr_k': 0.014752861261864272, 'slip_spread_k': 0.2919913687231458, 'spread_hl_frac': 0.02557965640147373, 'bb_std_mult': 0.8508660589997648, 'rsi_os': 37, 'rsi_ob': 77, 'vol_spike': 0.021388922866680815, 'adx_thresh': 10.16725338478125, 'atr_min_pct': 0.026697501898851807, 'atr_max_pct': 0.04548456694574325, 'tp_mult': 2.7840255699087044, 'tsl_mult': 0.42423019326890177, 'strategy': 'breakout', 'time_stop': 249, 'use_sma': True, 'use_atr': True, 'use_adx': False, 'use_ema': True, 'use_spike': False, 'rsi_required': False, 'edge_k': 0.18177027954829894, 'edge_cap': 0.17552144037042652, 'bull_strategy': 'mean_reversion', 'bull_bb_std_mult': 3.4296968990285075, 'bull_rsi_os': 32, 'bull_rsi_ob': 79, 'bull_adx_thresh': 5.788837779108018, 'bull_atr_min_pct': 0.003315054087141279, 'bull_atr_max_pct': 0.133139790851382, 'bull_tp_mult': 2.855932818308499, 'bull_tsl_mult': 0.39849068392231196, 'bull_time_stop': 61, 'bull_use_sma': False, 'bull_use_ema': True, 'bull_use_atr': False, 'bull_use_adx': True, 'bull_use_spike': True, 'bull_rsi_required': False, 'bear_strategy': 'mean_reversion', 'bear_bb_std_mult': 1.2641620649577658, 'bear_rsi_os': 12, 'bear_rsi_ob': 62, 'bear_adx_thresh': 30.978531704843654, 'bear_atr_min_pct': 0.0013277498201303226, 'bear_atr_max_pct': 0.13315835264812623, 'bear_tp_mult': 2.162095956783524, 'bear_tsl_mult': 0.5127323964248771, 'bear_time_stop': 48, 'bear_use_sma': False, 'bear_use_ema': False, 'bear_use_atr': True, 'bear_use_adx': False, 'bear_use_spike': True, 'bear_rsi_required': False, 'sideways_strategy': 'mean_reversion', 'sideways_bb_std_mult': 2.2289231102393394, 'sideways_rsi_os': 42, 'sideways_rsi_ob': 73, 'sideways_adx_thresh': 13.545866825308877, 'sideways_atr_min_pct': 0.0073377690646314365, 'sideways_atr_max_pct': 0.024081944055860248, 'sideways_tp_mult': 1.9757293502488291, 'sideways_tsl_mult': 0.3464997428284373, 'sideways_time_stop': 72, 'sideways_use_sma': True, 'sideways_use_ema': True, 'sideways_use_atr': False, 'sideways_use_adx': False, 'sideways_use_spike': True, 'sideways_rsi_required': False}.
[I 2025-08-31 10:58:16,070] Trial 539 finished with values: [-0.03250570875048486, 0.03221701913303115] and parameters: {'p_sma': 32, 'p_std': 49, 'p_atr': 24, 'p_adx': 22, 'rsi_period': 55, 'ema1': 21, 'ema2': 48, 'slip_atr_k': 0.00445300803112977, 'slip_spread_k': 0.7095156131079263, 'spread_hl_frac': 0.025599017588045704, 'bb_std_mult': 2.129684833240608, 'rsi_os': 36, 'rsi_ob': 77, 'vol_spike': 0.2143225468241957, 'adx_thresh': 27.869396867508982, 'atr_min_pct': 0.0268605709230747, 'atr_max_pct': 0.04520910567496733, 'tp_mult': 1.9277502282091572, 'tsl_mult': 0.6307319330802984, 'strategy': 'breakout', 'time_stop': 166, 'use_sma': True, 'use_atr': False, 'use_adx': False, 'use_ema': False, 'use_spike': False, 'rsi_required': False, 'edge_k': 1.7743154399595824, 'edge_cap': 0.17623131714776194, 'bull_strategy': 'breakout', 'bull_bb_std_mult': 3.499890817137505, 'bull_rsi_os': 46, 'bull_rsi_ob': 92, 'bull_adx_thresh': 33.95391853759806, 'bull_atr_min_pct': 0.0032413169401414752, 'bull_atr_max_pct': 0.03993636948017284, 'bull_tp_mult': 2.9561864195606353, 'bull_tsl_mult': 0.14075369487224665, 'bull_time_stop': 60, 'bull_use_sma': False, 'bull_use_ema': True, 'bull_use_atr': False, 'bull_use_adx': True, 'bull_use_spike': True, 'bull_rsi_required': False, 'bear_strategy': 'breakout', 'bear_bb_std_mult': 1.3000871103539893, 'bear_rsi_os': 21, 'bear_rsi_ob': 53, 'bear_adx_thresh': 14.670765142415473, 'bear_atr_min_pct': 0.00018017491832151254, 'bear_atr_max_pct': 0.1424855263596172, 'bear_tp_mult': 1.8663081362435674, 'bear_tsl_mult': 0.7044571232996013, 'bear_time_stop': 48, 'bear_use_sma': False, 'bear_use_ema': False, 'bear_use_atr': True, 'bear_use_adx': False, 'bear_use_spike': True, 'bear_rsi_required': True, 'sideways_strategy': 'mean_reversion', 'sideways_bb_std_mult': 2.0251638009809887, 'sideways_rsi_os': 12, 'sideways_rsi_ob': 56, 'sideways_adx_thresh': 14.216484846575543, 'sideways_atr_min_pct': 0.0101839757180257, 'sideways_atr_max_pct': 0.024283961419015412, 'sideways_tp_mult': 1.9099245174713277, 'sideways_tsl_mult': 0.8536207987145591, 'sideways_time_stop': 71, 'sideways_use_sma': True, 'sideways_use_ema': True, 'sideways_use_atr': False, 'sideways_use_adx': False, 'sideways_use_spike': True, 'sideways_rsi_required': False}.
[I 2025-08-31 10:58:16,954] Trial 543 finished with values: [-1000000000.0, 1000000000.0] and parameters: {'p_sma': 42, 'p_std': 36, 'p_atr': 24, 'p_adx': 21, 'rsi_period': 40, 'ema1': 23, 'ema2': 46, 'slip_atr_k': 0.016253226809052036, 'slip_spread_k': 0.3070744047603614, 'spread_hl_frac': 0.02657051030122335, 'bb_std_mult': 3.22368587756109, 'rsi_os': 36, 'rsi_ob': 46, 'vol_spike': 0.21876479906335608, 'adx_thresh': 24.220885695623807, 'atr_min_pct': 0.006429438089746019, 'atr_max_pct': 0.03858402424763784, 'tp_mult': 2.890525842875488, 'tsl_mult': 0.6422287985434567, 'strategy': 'mean_reversion', 'time_stop': 168, 'use_sma': False, 'use_atr': False, 'use_adx': False, 'use_ema': False, 'use_spike': False, 'rsi_required': False, 'edge_k': 1.5884283939104793, 'edge_cap': 0.5230814871655276, 'bull_strategy': 'breakout', 'bull_bb_std_mult': 3.3296632420028285, 'bull_rsi_os': 46, 'bull_rsi_ob': 92, 'bull_adx_thresh': 19.63993235222902, 'bull_atr_min_pct': 0.0024519493393367594, 'bull_atr_max_pct': 0.12339258129939229, 'bull_tp_mult': 2.914062391981532, 'bull_tsl_mult': 0.10043723915471435, 'bull_time_stop': 69, 'bull_use_sma': False, 'bull_use_ema': True, 'bull_use_atr': False, 'bull_use_adx': True, 'bull_use_spike': False, 'bull_rsi_required': False, 'bear_strategy': 'breakout', 'bear_bb_std_mult': 3.2141411825757435, 'bear_rsi_os': 38, 'bear_rsi_ob': 53, 'bear_adx_thresh': 13.664071563191555, 'bear_atr_min_pct': 0.0034285713960133263, 'bear_atr_max_pct': 0.13680919121428328, 'bear_tp_mult': 2.400803667831128, 'bear_tsl_mult': 0.509596539645077, 'bear_time_stop': 28, 'bear_use_sma': False, 'bear_use_ema': False, 'bear_use_atr': True, 'bear_use_adx': True, 'bear_use_spike': True, 'bear_rsi_required': True, 'sideways_strategy': 'mean_reversion', 'sideways_bb_std_mult': 2.589592351641993, 'sideways_rsi_os': 26, 'sideways_rsi_ob': 53, 'sideways_adx_thresh': 14.723459105503203, 'sideways_atr_min_pct': 0.013148412554495798, 'sideways_atr_max_pct': 0.016710319684920403, 'sideways_tp_mult': 1.959570273383395, 'sideways_tsl_mult': 0.8518366814501844, 'sideways_time_stop': 250, 'sideways_use_sma': True, 'sideways_use_ema': False, 'sideways_use_atr': False, 'sideways_use_adx': False, 'sideways_use_spike': True, 'sideways_rsi_required': False}.
[I 2025-08-31 10:58:16,962] Trial 542 finished with values: [-1000000000.0, 1000000000.0] and parameters: {'p_sma': 41, 'p_std': 36, 'p_atr': 21, 'p_adx': 29, 'rsi_period': 40, 'ema1': 23, 'ema2': 57, 'slip_atr_k': 0.014997275016961756, 'slip_spread_k': 0.2800018990260724, 'spread_hl_frac': 0.02558324405710023, 'bb_std_mult': 3.2311650364079547, 'rsi_os': 36, 'rsi_ob': 77, 'vol_spike': 0.23359833838364688, 'adx_thresh': 34.5174848355211, 'atr_min_pct': 0.018986779038465462, 'atr_max_pct': 0.015804737201280394, 'tp_mult': 1.9319983321970868, 'tsl_mult': 0.6331977654364739, 'strategy': 'mean_reversion', 'time_stop': 57, 'use_sma': False, 'use_atr': False, 'use_adx': False, 'use_ema': False, 'use_spike': False, 'rsi_required': False, 'edge_k': 1.7430073268930881, 'edge_cap': 0.17600724222684302, 'bull_strategy': 'breakout', 'bull_bb_std_mult': 3.463869709931884, 'bull_rsi_os': 46, 'bull_rsi_ob': 93, 'bull_adx_thresh': 13.167270670694254, 'bull_atr_min_pct': 0.002742392877509969, 'bull_atr_max_pct': 0.12458970815928982, 'bull_tp_mult': 1.4653236003702852, 'bull_tsl_mult': 0.49760658945880676, 'bull_time_stop': 55, 'bull_use_sma': False, 'bull_use_ema': True, 'bull_use_atr': False, 'bull_use_adx': True, 'bull_use_spike': True, 'bull_rsi_required': False, 'bear_strategy': 'breakout', 'bear_bb_std_mult': 1.3267565658829783, 'bear_rsi_os': 38, 'bear_rsi_ob': 53, 'bear_adx_thresh': 33.05510671186842, 'bear_atr_min_pct': 0.012983149080278589, 'bear_atr_max_pct': 0.1420391194363937, 'bear_tp_mult': 2.7082464630224075, 'bear_tsl_mult': 0.08637185862082261, 'bear_time_stop': 28, 'bear_use_sma': False, 'bear_use_ema': False, 'bear_use_atr': True, 'bear_use_adx': True, 'bear_use_spike': True, 'bear_rsi_required': True, 'sideways_strategy': 'mean_reversion', 'sideways_bb_std_mult': 2.613997580564364, 'sideways_rsi_os': 36, 'sideways_rsi_ob': 55, 'sideways_adx_thresh': 19.484417239292256, 'sideways_atr_min_pct': 0.010325762794415981, 'sideways_atr_max_pct': 0.01677681987884632, 'sideways_tp_mult': 1.9387066068020555, 'sideways_tsl_mult': 0.8996273673775835, 'sideways_time_stop': 232, 'sideways_use_sma': True, 'sideways_use_ema': False, 'sideways_use_atr': False, 'sideways_use_adx': False, 'sideways_use_spike': True, 'sideways_rsi_required': False}.
[I 2025-08-31 10:58:45,850] Trial 544 finished with values: [-0.011491249148961602, 0.011590464615734966] and parameters: {'p_sma': 42, 'p_std': 41, 'p_atr': 22, 'p_adx': 21, 'rsi_period': 40, 'ema1': 30, 'ema2': 46, 'slip_atr_k': 0.009274231087208519, 'slip_spread_k': 0.4664272649484292, 'spread_hl_frac': 0.02645243362035153, 'bb_std_mult': 2.5905441863525414, 'rsi_os': 23, 'rsi_ob': 85, 'vol_spike': 0.10870277229737545, 'adx_thresh': 8.319636768618304, 'atr_min_pct': 0.0024733704041754612, 'atr_max_pct': 0.03927917297874963, 'tp_mult': 1.8689281837735898, 'tsl_mult': 0.3386964942426034, 'strategy': 'mean_reversion', 'time_stop': 169, 'use_sma': False, 'use_atr': False, 'use_adx': False, 'use_ema': False, 'use_spike': False, 'rsi_required': False, 'edge_k': 0.27957660390514194, 'edge_cap': 0.20508414336630718, 'bull_strategy': 'breakout', 'bull_bb_std_mult': 3.5481490146172368, 'bull_rsi_os': 35, 'bull_rsi_ob': 76, 'bull_adx_thresh': 19.519445280505497, 'bull_atr_min_pct': 0.0021762042509492897, 'bull_atr_max_pct': 0.0426688723427766, 'bull_tp_mult': 2.948598439654497, 'bull_tsl_mult': 0.10151768398681195, 'bull_time_stop': 69, 'bull_use_sma': False, 'bull_use_ema': False, 'bull_use_atr': False, 'bull_use_adx': False, 'bull_use_spike': False, 'bull_rsi_required': True, 'bear_strategy': 'breakout', 'bear_bb_std_mult': 3.18524905082852, 'bear_rsi_os': 24, 'bear_rsi_ob': 53, 'bear_adx_thresh': 12.504610439872582, 'bear_atr_min_pct': 0.02222481676894185, 'bear_atr_max_pct': 0.10220631897123972, 'bear_tp_mult': 2.684857923894601, 'bear_tsl_mult': 0.691054008980502, 'bear_time_stop': 27, 'bear_use_sma': True, 'bear_use_ema': False, 'bear_use_atr': False, 'bear_use_adx': True, 'bear_use_spike': True, 'bear_rsi_required': True, 'sideways_strategy': 'mean_reversion', 'sideways_bb_std_mult': 2.5974949527158806, 'sideways_rsi_os': 36, 'sideways_rsi_ob': 54, 'sideways_adx_thresh': 14.651153720270496, 'sideways_atr_min_pct': 0.012872561046504229, 'sideways_atr_max_pct': 0.017019884160235726, 'sideways_tp_mult': 2.5662898241799663, 'sideways_tsl_mult': 0.8706725168507558, 'sideways_time_stop': 252, 'sideways_use_sma': True, 'sideways_use_ema': False, 'sideways_use_atr': True, 'sideways_use_adx': True, 'sideways_use_spike': False, 'sideways_rsi_required': False}.
[I 2025-08-31 10:58:46,274] Trial 545 finished with values: [-0.005663219002263742, 0.0069942844052722445] and parameters: {'p_sma': 42, 'p_std': 39, 'p_atr': 22, 'p_adx': 21, 'rsi_period': 40, 'ema1': 29, 'ema2': 33, 'slip_atr_k': 0.011217003231778613, 'slip_spread_k': 0.2783668884727911, 'spread_hl_frac': 0.023115924987538873, 'bb_std_mult': 2.500608506109937, 'rsi_os': 32, 'rsi_ob': 85, 'vol_spike': 0.2300449406216386, 'adx_thresh': 34.59250534725465, 'atr_min_pct': 0.02159724313926631, 'atr_max_pct': 0.03463321552741529, 'tp_mult': 2.895566255104873, 'tsl_mult': 0.34644774845882853, 'strategy': 'mean_reversion', 'time_stop': 67, 'use_sma': False, 'use_atr': False, 'use_adx': False, 'use_ema': False, 'use_spike': False, 'rsi_required': False, 'edge_k': 1.0099989885441083, 'edge_cap': 0.5181371903632784, 'bull_strategy': 'breakout', 'bull_bb_std_mult': 3.5368601593568716, 'bull_rsi_os': 14, 'bull_rsi_ob': 70, 'bull_adx_thresh': 12.99742780797403, 'bull_atr_min_pct': 0.002271625621455044, 'bull_atr_max_pct': 0.0427273112357702, 'bull_tp_mult': 1.4450773062799502, 'bull_tsl_mult': 0.09800424037886588, 'bull_time_stop': 69, 'bull_use_sma': False, 'bull_use_ema': False, 'bull_use_atr': False, 'bull_use_adx': False, 'bull_use_spike': False, 'bull_rsi_required': True, 'bear_strategy': 'breakout', 'bear_bb_std_mult': 3.456167260742477, 'bear_rsi_os': 24, 'bear_rsi_ob': 56, 'bear_adx_thresh': 20.5737267102625, 'bear_atr_min_pct': 0.007879913911470825, 'bear_atr_max_pct': 0.09004723572152937, 'bear_tp_mult': 2.88813671650999, 'bear_tsl_mult': 0.10032658215686753, 'bear_time_stop': 27, 'bear_use_sma': True, 'bear_use_ema': False, 'bear_use_atr': False, 'bear_use_adx': True, 'bear_use_spike': True, 'bear_rsi_required': True, 'sideways_strategy': 'mean_reversion', 'sideways_bb_std_mult': 2.6044500463545215, 'sideways_rsi_os': 27, 'sideways_rsi_ob': 59, 'sideways_adx_thresh': 19.3304847139878, 'sideways_atr_min_pct': 0.014274397455088874, 'sideways_atr_max_pct': 0.14518705367610557, 'sideways_tp_mult': 1.6840483555874295, 'sideways_tsl_mult': 0.8997614338781923, 'sideways_time_stop': 146, 'sideways_use_sma': False, 'sideways_use_ema': False, 'sideways_use_atr': True, 'sideways_use_adx': True, 'sideways_use_spike': False, 'sideways_rsi_required': False}.
[I 2025-08-31 10:58:49,145] Trial 546 finished with values: [-1000000000.0, 1000000000.0] and parameters: {'p_sma': 44, 'p_std': 41, 'p_atr': 22, 'p_adx': 21, 'rsi_period': 39, 'ema1': 29, 'ema2': 52, 'slip_atr_k': 0.00025719011149416993, 'slip_spread_k': 0.37083333701742327, 'spread_hl_frac': 0.023127683273201624, 'bb_std_mult': 2.579184778450958, 'rsi_os': 22, 'rsi_ob': 89, 'vol_spike': 0.1116323176190715, 'adx_thresh': 34.585944551365095, 'atr_min_pct': 0.02062305686655672, 'atr_max_pct': 0.035792474114056436, 'tp_mult': 1.2187036619903502, 'tsl_mult': 0.34599384011048173, 'strategy': 'mean_reversion', 'time_stop': 85, 'use_sma': False, 'use_atr': False, 'use_adx': False, 'use_ema': False, 'use_spike': False, 'rsi_required': False, 'edge_k': 0.2507623237904535, 'edge_cap': 0.6381647591457864, 'bull_strategy': 'breakout', 'bull_bb_std_mult': 3.550226367023491, 'bull_rsi_os': 14, 'bull_rsi_ob': 76, 'bull_adx_thresh': 11.681846669097672, 'bull_atr_min_pct': 0.0052514177910939555, 'bull_atr_max_pct': 0.10811058105132147, 'bull_tp_mult': 2.8992989825540914, 'bull_tsl_mult': 0.35737680364883007, 'bull_time_stop': 110, 'bull_use_sma': False, 'bull_use_ema': False, 'bull_use_atr': False, 'bull_use_adx': False, 'bull_use_spike': True, 'bull_rsi_required': True, 'bear_strategy': 'breakout', 'bear_bb_std_mult': 3.4585873497924915, 'bear_rsi_os': 24, 'bear_rsi_ob': 56, 'bear_adx_thresh': 12.691136562591657, 'bear_atr_min_pct': 0.02339311578664102, 'bear_atr_max_pct': 0.07447700688665025, 'bear_tp_mult': 1.7379489157953227, 'bear_tsl_mult': 0.7478631879745374, 'bear_time_stop': 32, 'bear_use_sma': True, 'bear_use_ema': False, 'bear_use_atr': False, 'bear_use_adx': True, 'bear_use_spike': True, 'bear_rsi_required': True, 'sideways_strategy': 'mean_reversion', 'sideways_bb_std_mult': 2.667306906134428, 'sideways_rsi_os': 37, 'sideways_rsi_ob': 77, 'sideways_adx_thresh': 14.416420701421513, 'sideways_atr_min_pct': 0.014249716790439779, 'sideways_atr_max_pct': 0.1424759226898983, 'sideways_tp_mult': 2.4155219200249807, 'sideways_tsl_mult': 0.9032285846110576, 'sideways_time_stop': 254, 'sideways_use_sma': False, 'sideways_use_ema': False, 'sideways_use_atr': True, 'sideways_use_adx': True, 'sideways_use_spike': False, 'sideways_rsi_required': False}.
[I 2025-08-31 10:58:49,470] Trial 547 finished with values: [-0.014152131848952587, 0.014251557551380986] and parameters: {'p_sma': 44, 'p_std': 39, 'p_atr': 22, 'p_adx': 21, 'rsi_period': 39, 'ema1': 29, 'ema2': 33, 'slip_atr_k': 0.0001720557096951444, 'slip_spread_k': 0.3649350304472738, 'spread_hl_frac': 0.04155119971155223, 'bb_std_mult': 2.6385897396259788, 'rsi_os': 32, 'rsi_ob': 87, 'vol_spike': 0.10756420253089485, 'adx_thresh': 16.376115092342527, 'atr_min_pct': 0.01806347943899994, 'atr_max_pct': 0.03504850056707668, 'tp_mult': 2.8292736101812346, 'tsl_mult': 0.33196211601917786, 'strategy': 'mean_reversion', 'time_stop': 153, 'use_sma': False, 'use_atr': False, 'use_adx': False, 'use_ema': False, 'use_spike': False, 'rsi_required': False, 'edge_k': 1.7094688520102008, 'edge_cap': 0.1484159945050051, 'bull_strategy': 'breakout', 'bull_bb_std_mult': 3.5528051640094627, 'bull_rsi_os': 14, 'bull_rsi_ob': 90, 'bull_adx_thresh': 14.896985794110854, 'bull_atr_min_pct': 0.0019525787787403796, 'bull_atr_max_pct': 0.0418477480486884, 'bull_tp_mult': 2.7145268987810485, 'bull_tsl_mult': 0.8214691473934708, 'bull_time_stop': 138, 'bull_use_sma': False, 'bull_use_ema': False, 'bull_use_atr': False, 'bull_use_adx': False, 'bull_use_spike': False, 'bull_rsi_required': True, 'bear_strategy': 'breakout', 'bear_bb_std_mult': 1.4790664015688215, 'bear_rsi_os': 24, 'bear_rsi_ob': 86, 'bear_adx_thresh': 28.156938425461743, 'bear_atr_min_pct': 0.006399098150320508, 'bear_atr_max_pct': 0.07243896017277884, 'bear_tp_mult': 1.5766057179709991, 'bear_tsl_mult': 0.2415265655865403, 'bear_time_stop': 24, 'bear_use_sma': True, 'bear_use_ema': True, 'bear_use_atr': False, 'bear_use_adx': False, 'bear_use_spike': True, 'bear_rsi_required': True, 'sideways_strategy': 'mean_reversion', 'sideways_bb_std_mult': 2.45939406519104, 'sideways_rsi_os': 17, 'sideways_rsi_ob': 89, 'sideways_adx_thresh': 9.252945730854513, 'sideways_atr_min_pct': 0.006512288238092809, 'sideways_atr_max_pct': 0.14627377963004695, 'sideways_tp_mult': 2.8444502572132593, 'sideways_tsl_mult': 0.9150799823487372, 'sideways_time_stop': 255, 'sideways_use_sma': False, 'sideways_use_ema': False, 'sideways_use_atr': True, 'sideways_use_adx': True, 'sideways_use_spike': False, 'sideways_rsi_required': False}.
[I 2025-08-31 10:58:50,535] Trial 551 finished with values: [-1000000000.0, 1000000000.0] and parameters: {'p_sma': 60, 'p_std': 37, 'p_atr': 23, 'p_adx': 19, 'rsi_period': 44, 'ema1': 23, 'ema2': 56, 'slip_atr_k': 0.12170388447461956, 'slip_spread_k': 0.19339852432817567, 'spread_hl_frac': 0.03697400532128076, 'bb_std_mult': 1.5063217021025088, 'rsi_os': 35, 'rsi_ob': 45, 'vol_spike': 0.22861447912134464, 'adx_thresh': 9.82509239741017, 'atr_min_pct': 0.021722410295310007, 'atr_max_pct': 0.13650327969145432, 'tp_mult': 2.910952716265663, 'tsl_mult': 0.7593369231919629, 'strategy': 'mean_reversion', 'time_stop': 76, 'use_sma': False, 'use_atr': False, 'use_adx': False, 'use_ema': False, 'use_spike': False, 'rsi_required': False, 'edge_k': 0.839817503015706, 'edge_cap': 0.5658752004031544, 'bull_strategy': 'breakout', 'bull_bb_std_mult': 3.1991251074872133, 'bull_rsi_os': 45, 'bull_rsi_ob': 77, 'bull_adx_thresh': 9.804172747418612, 'bull_atr_min_pct': 0.004655381195639968, 'bull_atr_max_pct': 0.09776530807704692, 'bull_tp_mult': 2.6266533292671363, 'bull_tsl_mult': 0.12577971699883084, 'bull_time_stop': 233, 'bull_use_sma': False, 'bull_use_ema': True, 'bull_use_atr': False, 'bull_use_adx': True, 'bull_use_spike': True, 'bull_rsi_required': False, 'bear_strategy': 'breakout', 'bear_bb_std_mult': 3.5904113899693173, 'bear_rsi_os': 22, 'bear_rsi_ob': 66, 'bear_adx_thresh': 34.99641450053189, 'bear_atr_min_pct': 0.026076140700208857, 'bear_atr_max_pct': 0.10930412704434066, 'bear_tp_mult': 2.963695057162465, 'bear_tsl_mult': 0.12328997847996756, 'bear_time_stop': 138, 'bear_use_sma': False, 'bear_use_ema': True, 'bear_use_atr': True, 'bear_use_adx': False, 'bear_use_spike': False, 'bear_rsi_required': True, 'sideways_strategy': 'mean_reversion', 'sideways_bb_std_mult': 0.7444518096319412, 'sideways_rsi_os': 34, 'sideways_rsi_ob': 63, 'sideways_adx_thresh': 15.36717311901634, 'sideways_atr_min_pct': 0.015437447258183513, 'sideways_atr_max_pct': 0.012358649098928646, 'sideways_tp_mult': 2.460161589331224, 'sideways_tsl_mult': 0.8753213670070512, 'sideways_time_stop': 276, 'sideways_use_sma': True, 'sideways_use_ema': False, 'sideways_use_atr': False, 'sideways_use_adx': False, 'sideways_use_spike': True, 'sideways_rsi_required': True}.
