[I 2025-08-31 10:46:50,891] Trial 450 finished with values: [-0.0035429739764154533, 0.0046585036528471995] and parameters: {'p_sma': 45, 'p_std': 37, 'p_atr': 23, 'p_adx': 14, 'rsi_period': 40, 'ema1': 20, 'ema2': 21, 'slip_atr_k': 0.0005617487461589965, 'slip_spread_k': 0.585608334392511, 'spread_hl_frac': 0.02368841885488236, 'bb_std_mult': 2.4203460949213564, 'rsi_os': 37, 'rsi_ob': 74, 'vol_spike': 0.2208488828935052, 'adx_thresh': 21.051812881513097, 'atr_min_pct': 0.001219892431541289, 'atr_max_pct': 0.018241672438086394, 'tp_mult': 1.366527537305902, 'tsl_mult': 0.665019236498803, 'strategy': 'breakout', 'time_stop': 163, 'use_sma': True, 'use_atr': False, 'use_adx': False, 'use_ema': False, 'use_spike': False, 'rsi_required': False, 'edge_k': 1.161641574079334, 'edge_cap': 0.17795388316938424, 'bull_strategy': 'breakout', 'bull_bb_std_mult': 3.592846430610321, 'bull_rsi_os': 45, 'bull_rsi_ob': 80, 'bull_adx_thresh': 19.19964804762055, 'bull_atr_min_pct': 0.004594244816908883, 'bull_atr_max_pct': 0.02268382286319082, 'bull_tp_mult': 2.9750103111986226, 'bull_tsl_mult': 0.637180316768192, 'bull_time_stop': 58, 'bull_use_sma': False, 'bull_use_ema': True, 'bull_use_atr': False, 'bull_use_adx': True, 'bull_use_spike': True, 'bull_rsi_required': False, 'bear_strategy': 'breakout', 'bear_bb_std_mult': 1.4503108066143262, 'bear_rsi_os': 22, 'bear_rsi_ob': 52, 'bear_adx_thresh': 14.732677494178137, 'bear_atr_min_pct': 0.024499435074855684, 'bear_atr_max_pct': 0.14472679998136567, 'bear_tp_mult': 2.7580518884006886, 'bear_tsl_mult': 0.0798988832676831, 'bear_time_stop': 268, 'bear_use_sma': True, 'bear_use_ema': False, 'bear_use_atr': True, 'bear_use_adx': False, 'bear_use_spike': True, 'bear_rsi_required': True, 'sideways_strategy': 'mean_reversion', 'sideways_bb_std_mult': 2.557322720163462, 'sideways_rsi_os': 42, 'sideways_rsi_ob': 57, 'sideways_adx_thresh': 5.902599489636303, 'sideways_atr_min_pct': 0.0049845427009015345, 'sideways_atr_max_pct': 0.02617216954278658, 'sideways_tp_mult': 1.7991995133325147, 'sideways_tsl_mult': 0.9079705943364588, 'sideways_time_stop': 299, 'sideways_use_sma': True, 'sideways_use_ema': False, 'sideways_use_atr': False, 'sideways_use_adx': True, 'sideways_use_spike': False, 'sideways_rsi_required': True}.
[I 2025-08-31 10:47:22,139] Trial 453 finished with values: [-0.008656949135900094, 0.00887368257155803] and parameters: {'p_sma': 41, 'p_std': 39, 'p_atr': 21, 'p_adx': 15, 'rsi_period': 43, 'ema1': 20, 'ema2': 31, 'slip_atr_k': 0.012182168551650534, 'slip_spread_k': 0.6901788797110426, 'spread_hl_frac': 0.023820286588619875, 'bb_std_mult': 2.517451546013927, 'rsi_os': 37, 'rsi_ob': 45, 'vol_spike': 0.2193944081513593, 'adx_thresh': 9.081094448874145, 'atr_min_pct': 0.02297949989231584, 'atr_max_pct': 0.04018073888013069, 'tp_mult': 1.372324300900118, 'tsl_mult': 0.6926239429559128, 'strategy': 'breakout', 'time_stop': 158, 'use_sma': False, 'use_atr': True, 'use_adx': False, 'use_ema': True, 'use_spike': False, 'rsi_required': False, 'edge_k': 0.3327217667496466, 'edge_cap': 0.2816424580845557, 'bull_strategy': 'breakout', 'bull_bb_std_mult': 3.44009400235943, 'bull_rsi_os': 46, 'bull_rsi_ob': 79, 'bull_adx_thresh': 10.575307630873526, 'bull_atr_min_pct': 0.0036201979667194305, 'bull_atr_max_pct': 0.03782701207722952, 'bull_tp_mult': 2.994776594703147, 'bull_tsl_mult': 0.6407025363735305, 'bull_time_stop': 49, 'bull_use_sma': False, 'bull_use_ema': False, 'bull_use_atr': False, 'bull_use_adx': False, 'bull_use_spike': True, 'bull_rsi_required': True, 'bear_strategy': 'breakout', 'bear_bb_std_mult': 1.5682221451448537, 'bear_rsi_os': 22, 'bear_rsi_ob': 55, 'bear_adx_thresh': 14.446908679968216, 'bear_atr_min_pct': 0.02466273211321105, 'bear_atr_max_pct': 0.1339717283871323, 'bear_tp_mult': 2.7215597720052163, 'bear_tsl_mult': 0.09112309832170364, 'bear_time_stop': 41, 'bear_use_sma': True, 'bear_use_ema': False, 'bear_use_atr': True, 'bear_use_adx': False, 'bear_use_spike': True, 'bear_rsi_required': False, 'sideways_strategy': 'mean_reversion', 'sideways_bb_std_mult': 2.6578449673829283, 'sideways_rsi_os': 42, 'sideways_rsi_ob': 57, 'sideways_adx_thresh': 33.31819829305286, 'sideways_atr_min_pct': 0.0051390681053381645, 'sideways_atr_max_pct': 0.018095054629557593, 'sideways_tp_mult': 1.8103474522747323, 'sideways_tsl_mult': 0.9140971334397784, 'sideways_time_stop': 260, 'sideways_use_sma': True, 'sideways_use_ema': False, 'sideways_use_atr': False, 'sideways_use_adx': True, 'sideways_use_spike': False, 'sideways_rsi_required': False}.
[I 2025-08-31 10:47:22,732] Trial 454 finished with values: [-0.006142215786772098, 0.007065664067722821] and parameters: {'p_sma': 44, 'p_std': 41, 'p_atr': 21, 'p_adx': 20, 'rsi_period': 41, 'ema1': 24, 'ema2': 21, 'slip_atr_k': 0.011043012253848182, 'slip_spread_k': 0.2650164779215439, 'spread_hl_frac': 0.021026299530318374, 'bb_std_mult': 2.505514594051121, 'rsi_os': 37, 'rsi_ob': 74, 'vol_spike': 0.21913004668306263, 'adx_thresh': 26.772369580629963, 'atr_min_pct': 0.026502945489035798, 'atr_max_pct': 0.03942566093000298, 'tp_mult': 1.3608950190691709, 'tsl_mult': 0.6829981256025263, 'strategy': 'mean_reversion', 'time_stop': 158, 'use_sma': False, 'use_atr': True, 'use_adx': False, 'use_ema': True, 'use_spike': False, 'rsi_required': False, 'edge_k': 0.34180471736214146, 'edge_cap': 0.1760015288426852, 'bull_strategy': 'breakout', 'bull_bb_std_mult': 3.524785734637989, 'bull_rsi_os': 51, 'bull_rsi_ob': 79, 'bull_adx_thresh': 21.137210418582438, 'bull_atr_min_pct': 0.0035591724800155037, 'bull_atr_max_pct': 0.05179259303182722, 'bull_tp_mult': 2.778261349281073, 'bull_tsl_mult': 0.15510345465393824, 'bull_time_stop': 66, 'bull_use_sma': False, 'bull_use_ema': False, 'bull_use_atr': False, 'bull_use_adx': False, 'bull_use_spike': True, 'bull_rsi_required': True, 'bear_strategy': 'breakout', 'bear_bb_std_mult': 1.5915645543669668, 'bear_rsi_os': 22, 'bear_rsi_ob': 55, 'bear_adx_thresh': 11.946063081713989, 'bear_atr_min_pct': 0.024793685283208088, 'bear_atr_max_pct': 0.13461303873684935, 'bear_tp_mult': 2.742149464050468, 'bear_tsl_mult': 0.4783085796329999, 'bear_time_stop': 165, 'bear_use_sma': True, 'bear_use_ema': False, 'bear_use_atr': True, 'bear_use_adx': False, 'bear_use_spike': True, 'bear_rsi_required': False, 'sideways_strategy': 'mean_reversion', 'sideways_bb_std_mult': 2.60003367101161, 'sideways_rsi_os': 37, 'sideways_rsi_ob': 57, 'sideways_adx_thresh': 33.60218717579247, 'sideways_atr_min_pct': 0.005118246647229283, 'sideways_atr_max_pct': 0.05793870028396727, 'sideways_tp_mult': 1.8119482219490928, 'sideways_tsl_mult': 0.911445442967577, 'sideways_time_stop': 260, 'sideways_use_sma': True, 'sideways_use_ema': False, 'sideways_use_atr': False, 'sideways_use_adx': True, 'sideways_use_spike': True, 'sideways_rsi_required': False}.
[I 2025-08-31 10:47:22,865] Trial 451 finished with values: [-0.008237835219602085, 0.008526946796902616] and parameters: {'p_sma': 41, 'p_std': 37, 'p_atr': 21, 'p_adx': 15, 'rsi_period': 38, 'ema1': 20, 'ema2': 21, 'slip_atr_k': 0.009845204115048417, 'slip_spread_k': 0.22299155855729044, 'spread_hl_frac': 0.023964763503873075, 'bb_std_mult': 1.652990665074224, 'rsi_os': 37, 'rsi_ob': 74, 'vol_spike': 0.21762636608213715, 'adx_thresh': 9.103525454974402, 'atr_min_pct': 0.026453663830332028, 'atr_max_pct': 0.03984650240364926, 'tp_mult': 1.3769909686180588, 'tsl_mult': 0.7340731195127115, 'strategy': 'mean_reversion', 'time_stop': 159, 'use_sma': False, 'use_atr': False, 'use_adx': False, 'use_ema': False, 'use_spike': False, 'rsi_required': False, 'edge_k': 0.3407220114074385, 'edge_cap': 0.16999738280162024, 'bull_strategy': 'breakout', 'bull_bb_std_mult': 3.5838585363875275, 'bull_rsi_os': 46, 'bull_rsi_ob': 77, 'bull_adx_thresh': 10.519648622625159, 'bull_atr_min_pct': 0.0035923499100583766, 'bull_atr_max_pct': 0.03967597010260083, 'bull_tp_mult': 2.781745206105847, 'bull_tsl_mult': 0.11342382859707038, 'bull_time_stop': 49, 'bull_use_sma': False, 'bull_use_ema': True, 'bull_use_atr': False, 'bull_use_adx': False, 'bull_use_spike': True, 'bull_rsi_required': False, 'bear_strategy': 'breakout', 'bear_bb_std_mult': 1.5470055677681778, 'bear_rsi_os': 22, 'bear_rsi_ob': 54, 'bear_adx_thresh': 12.712843439187257, 'bear_atr_min_pct': 0.0246547377743637, 'bear_atr_max_pct': 0.13811106971510168, 'bear_tp_mult': 2.7383963500636823, 'bear_tsl_mult': 0.9048620269605919, 'bear_time_stop': 263, 'bear_use_sma': True, 'bear_use_ema': False, 'bear_use_atr': True, 'bear_use_adx': False, 'bear_use_spike': True, 'bear_rsi_required': False, 'sideways_strategy': 'mean_reversion', 'sideways_bb_std_mult': 2.499216277973275, 'sideways_rsi_os': 47, 'sideways_rsi_ob': 57, 'sideways_adx_thresh': 5.763623954990965, 'sideways_atr_min_pct': 0.004973700108673559, 'sideways_atr_max_pct': 0.10743070029212305, 'sideways_tp_mult': 1.8794301530979296, 'sideways_tsl_mult': 0.9112148156107337, 'sideways_time_stop': 211, 'sideways_use_sma': True, 'sideways_use_ema': False, 'sideways_use_atr': False, 'sideways_use_adx': True, 'sideways_use_spike': True, 'sideways_rsi_required': False}.
[I 2025-08-31 10:47:23,071] Trial 452 finished with values: [-0.02690567970611335, 0.02687729310560346] and parameters: {'p_sma': 41, 'p_std': 42, 'p_atr': 21, 'p_adx': 18, 'rsi_period': 40, 'ema1': 24, 'ema2': 21, 'slip_atr_k': 0.009775167784568918, 'slip_spread_k': 0.4900740045647519, 'spread_hl_frac': 0.02378825606526984, 'bb_std_mult': 2.52324785064582, 'rsi_os': 37, 'rsi_ob': 73, 'vol_spike': 0.2193441826275195, 'adx_thresh': 8.980302014394029, 'atr_min_pct': 0.002060043072312558, 'atr_max_pct': 0.0400569127004167, 'tp_mult': 1.8481347600078784, 'tsl_mult': 0.6831194548371163, 'strategy': 'mean_reversion', 'time_stop': 159, 'use_sma': False, 'use_atr': False, 'use_adx': False, 'use_ema': False, 'use_spike': False, 'rsi_required': False, 'edge_k': 1.76402818269138, 'edge_cap': 0.1748687376943956, 'bull_strategy': 'breakout', 'bull_bb_std_mult': 3.5416322135674334, 'bull_rsi_os': 46, 'bull_rsi_ob': 79, 'bull_adx_thresh': 10.395283788642624, 'bull_atr_min_pct': 0.00031730325707720296, 'bull_atr_max_pct': 0.050849160449866294, 'bull_tp_mult': 2.9652580833472357, 'bull_tsl_mult': 0.1487386980150657, 'bull_time_stop': 53, 'bull_use_sma': False, 'bull_use_ema': False, 'bull_use_atr': False, 'bull_use_adx': False, 'bull_use_spike': True, 'bull_rsi_required': True, 'bear_strategy': 'breakout', 'bear_bb_std_mult': 1.6107063340663368, 'bear_rsi_os': 22, 'bear_rsi_ob': 54, 'bear_adx_thresh': 12.133307309110082, 'bear_atr_min_pct': 0.02468495585761136, 'bear_atr_max_pct': 0.13790627056638807, 'bear_tp_mult': 2.7590326416395308, 'bear_tsl_mult': 0.0799248826632333, 'bear_time_stop': 263, 'bear_use_sma': True, 'bear_use_ema': False, 'bear_use_atr': True, 'bear_use_adx': False, 'bear_use_spike': True, 'bear_rsi_required': False, 'sideways_strategy': 'mean_reversion', 'sideways_bb_std_mult': 2.661262631073949, 'sideways_rsi_os': 26, 'sideways_rsi_ob': 57, 'sideways_adx_thresh': 33.562159759843674, 'sideways_atr_min_pct': 0.006216886689600348, 'sideways_atr_max_pct': 0.017003824097334495, 'sideways_tp_mult': 1.9067489836971647, 'sideways_tsl_mult': 0.8720614398719239, 'sideways_time_stop': 211, 'sideways_use_sma': True, 'sideways_use_ema': False, 'sideways_use_atr': False, 'sideways_use_adx': True, 'sideways_use_spike': True, 'sideways_rsi_required': False}.
[I 2025-08-31 10:47:55,732] Trial 458 finished with values: [-1000000000.0, 1000000000.0] and parameters: {'p_sma': 43, 'p_std': 41, 'p_atr': 22, 'p_adx': 20, 'rsi_period': 35, 'ema1': 25, 'ema2': 58, 'slip_atr_k': 0.0005616513212198676, 'slip_spread_k': 0.31182313646738313, 'spread_hl_frac': 0.021774905930683666, 'bb_std_mult': 2.5450099131376156, 'rsi_os': 33, 'rsi_ob': 76, 'vol_spike': 0.2403917354756743, 'adx_thresh': 9.58159801686636, 'atr_min_pct': 0.02863071596914215, 'atr_max_pct': 0.07168950530563224, 'tp_mult': 1.6122354593787218, 'tsl_mult': 0.6793216718833914, 'strategy': 'breakout', 'time_stop': 180, 'use_sma': False, 'use_atr': True, 'use_adx': False, 'use_ema': True, 'use_spike': False, 'rsi_required': False, 'edge_k': 1.7284287543209857, 'edge_cap': 0.19037432637253515, 'bull_strategy': 'breakout', 'bull_bb_std_mult': 3.4622952702909675, 'bull_rsi_os': 48, 'bull_rsi_ob': 78, 'bull_adx_thresh': 21.01089649659795, 'bull_atr_min_pct': 0.0063524984666660875, 'bull_atr_max_pct': 0.0542314396195539, 'bull_tp_mult': 2.901004661522065, 'bull_tsl_mult': 0.1505721496032428, 'bull_time_stop': 65, 'bull_use_sma': False, 'bull_use_ema': True, 'bull_use_atr': False, 'bull_use_adx': True, 'bull_use_spike': True, 'bull_rsi_required': False, 'bear_strategy': 'breakout', 'bear_bb_std_mult': 1.4083147958551556, 'bear_rsi_os': 24, 'bear_rsi_ob': 55, 'bear_adx_thresh': 15.519225989818109, 'bear_atr_min_pct': 0.025853046664738994, 'bear_atr_max_pct': 0.14215388066121054, 'bear_tp_mult': 2.7053655518563327, 'bear_tsl_mult': 0.12133761242401526, 'bear_time_stop': 165, 'bear_use_sma': False, 'bear_use_ema': False, 'bear_use_atr': False, 'bear_use_adx': False, 'bear_use_spike': True, 'bear_rsi_required': True, 'sideways_strategy': 'mean_reversion', 'sideways_bb_std_mult': 3.1665814558200815, 'sideways_rsi_os': 36, 'sideways_rsi_ob': 60, 'sideways_adx_thresh': 20.390643915380064, 'sideways_atr_min_pct': 0.006496058807291368, 'sideways_atr_max_pct': 0.02094246514608645, 'sideways_tp_mult': 1.9482624347390964, 'sideways_tsl_mult': 0.874421411506478, 'sideways_time_stop': 123, 'sideways_use_sma': False, 'sideways_use_ema': False, 'sideways_use_atr': True, 'sideways_use_adx': False, 'sideways_use_spike': True, 'sideways_rsi_required': False}.
[I 2025-08-31 10:47:56,034] Trial 455 finished with values: [-1000000000.0, 1000000000.0] and parameters: {'p_sma': 44, 'p_std': 42, 'p_atr': 21, 'p_adx': 20, 'rsi_period': 41, 'ema1': 23, 'ema2': 23, 'slip_atr_k': 0.008698899148441743, 'slip_spread_k': 0.16964669410337835, 'spread_hl_frac': 0.021348674644130636, 'bb_std_mult': 2.537066376667897, 'rsi_os': 33, 'rsi_ob': 73, 'vol_spike': 0.2202381466952467, 'adx_thresh': 21.04948203114423, 'atr_min_pct': 0.02876304255271352, 'atr_max_pct': 0.04030244675663288, 'tp_mult': 2.137475325207521, 'tsl_mult': 0.7414810012945316, 'strategy': 'mean_reversion', 'time_stop': 151, 'use_sma': False, 'use_atr': False, 'use_adx': False, 'use_ema': False, 'use_spike': False, 'rsi_required': False, 'edge_k': 1.7381085549698947, 'edge_cap': 0.1689536868772257, 'bull_strategy': 'breakout', 'bull_bb_std_mult': 3.518165489534973, 'bull_rsi_os': 13, 'bull_rsi_ob': 80, 'bull_adx_thresh': 10.399126831436417, 'bull_atr_min_pct': 0.007803261769060578, 'bull_atr_max_pct': 0.040139876600072205, 'bull_tp_mult': 2.775266511810495, 'bull_tsl_mult': 0.15245960527766983, 'bull_time_stop': 65, 'bull_use_sma': False, 'bull_use_ema': True, 'bull_use_atr': False, 'bull_use_adx': False, 'bull_use_spike': True, 'bull_rsi_required': False, 'bear_strategy': 'breakout', 'bear_bb_std_mult': 1.288126392765943, 'bear_rsi_os': 22, 'bear_rsi_ob': 54, 'bear_adx_thresh': 12.090754641271188, 'bear_atr_min_pct': 0.02460716934599224, 'bear_atr_max_pct': 0.139298418190801, 'bear_tp_mult': 2.7808985426382, 'bear_tsl_mult': 0.11882618025540417, 'bear_time_stop': 38, 'bear_use_sma': True, 'bear_use_ema': False, 'bear_use_atr': True, 'bear_use_adx': False, 'bear_use_spike': True, 'bear_rsi_required': False, 'sideways_strategy': 'mean_reversion', 'sideways_bb_std_mult': 2.6381982179476897, 'sideways_rsi_os': 35, 'sideways_rsi_ob': 59, 'sideways_adx_thresh': 19.102847479242957, 'sideways_atr_min_pct': 0.006011133366961895, 'sideways_atr_max_pct': 0.027864973366507298, 'sideways_tp_mult': 1.9169170259361774, 'sideways_tsl_mult': 0.8756330189114347, 'sideways_time_stop': 34, 'sideways_use_sma': True, 'sideways_use_ema': False, 'sideways_use_atr': False, 'sideways_use_adx': True, 'sideways_use_spike': True, 'sideways_rsi_required': False}.
[I 2025-08-31 10:47:56,316] Trial 457 finished with values: [-1000000000.0, 1000000000.0] and parameters: {'p_sma': 44, 'p_std': 39, 'p_atr': 23, 'p_adx': 20, 'rsi_period': 35, 'ema1': 23, 'ema2': 58, 'slip_atr_k': 0.00819906152407232, 'slip_spread_k': 0.16711988490911905, 'spread_hl_frac': 0.021188332692279557, 'bb_std_mult': 2.5340867060170753, 'rsi_os': 33, 'rsi_ob': 73, 'vol_spike': 0.2844548909452075, 'adx_thresh': 21.45686869969263, 'atr_min_pct': 0.00023771228428037458, 'atr_max_pct': 0.03768680734746008, 'tp_mult': 1.6227359811120252, 'tsl_mult': 0.6808590369322246, 'strategy': 'mean_reversion', 'time_stop': 180, 'use_sma': False, 'use_atr': True, 'use_adx': False, 'use_ema': True, 'use_spike': False, 'rsi_required': False, 'edge_k': 1.4477584299277466, 'edge_cap': 0.1890820634912806, 'bull_strategy': 'breakout', 'bull_bb_std_mult': 3.3277256357108276, 'bull_rsi_os': 44, 'bull_rsi_ob': 78, 'bull_adx_thresh': 5.44565965369666, 'bull_atr_min_pct': 0.007699119552324207, 'bull_atr_max_pct': 0.05117929317528415, 'bull_tp_mult': 2.904860352521456, 'bull_tsl_mult': 0.15576212718593002, 'bull_time_stop': 67, 'bull_use_sma': False, 'bull_use_ema': True, 'bull_use_atr': False, 'bull_use_adx': True, 'bull_use_spike': True, 'bull_rsi_required': False, 'bear_strategy': 'breakout', 'bear_bb_std_mult': 1.3252996831042858, 'bear_rsi_os': 25, 'bear_rsi_ob': 54, 'bear_adx_thresh': 12.213817324934631, 'bear_atr_min_pct': 0.024861996525516933, 'bear_atr_max_pct': 0.14175142640009863, 'bear_tp_mult': 2.9071268946971056, 'bear_tsl_mult': 0.48105023848606415, 'bear_time_stop': 49, 'bear_use_sma': False, 'bear_use_ema': False, 'bear_use_atr': False, 'bear_use_adx': False, 'bear_use_spike': True, 'bear_rsi_required': True, 'sideways_strategy': 'mean_reversion', 'sideways_bb_std_mult': 2.62367406436202, 'sideways_rsi_os': 35, 'sideways_rsi_ob': 60, 'sideways_adx_thresh': 18.98368527184829, 'sideways_atr_min_pct': 0.006433032651008751, 'sideways_atr_max_pct': 0.0934025509335101, 'sideways_tp_mult': 1.9206817723651926, 'sideways_tsl_mult': 0.868702594659312, 'sideways_time_stop': 300, 'sideways_use_sma': False, 'sideways_use_ema': False, 'sideways_use_atr': True, 'sideways_use_adx': False, 'sideways_use_spike': True, 'sideways_rsi_required': False}.
[I 2025-08-31 10:47:56,470] Trial 456 finished with values: [-1000000000.0, 1000000000.0] and parameters: {'p_sma': 44, 'p_std': 39, 'p_atr': 22, 'p_adx': 20, 'rsi_period': 41, 'ema1': 25, 'ema2': 35, 'slip_atr_k': 0.008827015905773547, 'slip_spread_k': 0.233240924024861, 'spread_hl_frac': 0.023628150840287774, 'bb_std_mult': 2.5194289300700135, 'rsi_os': 37, 'rsi_ob': 73, 'vol_spike': 0.2200433954834641, 'adx_thresh': 9.73929225123184, 'atr_min_pct': 0.020374170617438653, 'atr_max_pct': 0.13548415716090068, 'tp_mult': 2.843510631073961, 'tsl_mult': 0.7396733798456867, 'strategy': 'mean_reversion', 'time_stop': 150, 'use_sma': False, 'use_atr': False, 'use_adx': False, 'use_ema': False, 'use_spike': False, 'rsi_required': False, 'edge_k': 1.7403111555017678, 'edge_cap': 0.17743961617971435, 'bull_strategy': 'breakout', 'bull_bb_std_mult': 3.3356724904869846, 'bull_rsi_os': 44, 'bull_rsi_ob': 78, 'bull_adx_thresh': 19.323619151454523, 'bull_atr_min_pct': 0.027914758561784804, 'bull_atr_max_pct': 0.05318000136165346, 'bull_tp_mult': 2.776256303535088, 'bull_tsl_mult': 0.8380980816278655, 'bull_time_stop': 66, 'bull_use_sma': False, 'bull_use_ema': True, 'bull_use_atr': False, 'bull_use_adx': False, 'bull_use_spike': True, 'bull_rsi_required': False, 'bear_strategy': 'breakout', 'bear_bb_std_mult': 1.3144811114184896, 'bear_rsi_os': 22, 'bear_rsi_ob': 54, 'bear_adx_thresh': 12.270815997134052, 'bear_atr_min_pct': 0.025934086906857556, 'bear_atr_max_pct': 0.13865705132698625, 'bear_tp_mult': 2.7635549645709063, 'bear_tsl_mult': 0.07172415414111527, 'bear_time_stop': 50, 'bear_use_sma': True, 'bear_use_ema': False, 'bear_use_atr': True, 'bear_use_adx': False, 'bear_use_spike': True, 'bear_rsi_required': False, 'sideways_strategy': 'mean_reversion', 'sideways_bb_std_mult': 2.6302880155558803, 'sideways_rsi_os': 35, 'sideways_rsi_ob': 59, 'sideways_adx_thresh': 20.621307682676782, 'sideways_atr_min_pct': 0.006210120741697422, 'sideways_atr_max_pct': 0.09201758822209694, 'sideways_tp_mult': 1.9141947736596938, 'sideways_tsl_mult': 0.8674892378456651, 'sideways_time_stop': 209, 'sideways_use_sma': False, 'sideways_use_ema': False, 'sideways_use_atr': True, 'sideways_use_adx': True, 'sideways_use_spike': True, 'sideways_rsi_required': False}.
