[I 2025-08-31 10:13:44,102] Trial 174 finished with values: [-1000000000.0, 1000000000.0] and parameters: {'p_sma': 42, 'p_std': 42, 'p_atr': 9, 'p_adx': 14, 'rsi_period': 20, 'ema1': 14, 'ema2': 25, 'slip_atr_k': 0.20634978691768627, 'slip_spread_k': 0.4768977702376162, 'spread_hl_frac': 0.022353748053463192, 'bb_std_mult': 1.4048623197615768, 'rsi_os': 40, 'rsi_ob': 76, 'vol_spike': 0.2011511664645414, 'adx_thresh': 27.755774450061963, 'atr_min_pct': 0.009160807851084387, 'atr_max_pct': 0.05119301639213572, 'tp_mult': 2.5169584692344493, 'tsl_mult': 0.7142268568179451, 'strategy': 'breakout', 'time_stop': 105, 'use_sma': True, 'use_atr': True, 'use_adx': True, 'use_ema': True, 'use_spike': False, 'rsi_required': True, 'edge_k': 0.42825113343792043, 'edge_cap': 0.42148801485075865, 'bull_strategy': 'mean_reversion', 'bull_bb_std_mult': 0.894519987809213, 'bull_rsi_os': 45, 'bull_rsi_ob': 67, 'bull_adx_thresh': 22.43411786225527, 'bull_atr_min_pct': 0.022675823029414767, 'bull_atr_max_pct': 0.06621303757706737, 'bull_tp_mult': 2.335359528384338, 'bull_tsl_mult': 0.1329346306135048, 'bull_time_stop': 241, 'bull_use_sma': False, 'bull_use_ema': False, 'bull_use_atr': False, 'bull_use_adx': True, 'bull_use_spike': True, 'bull_rsi_required': True, 'bear_strategy': 'breakout', 'bear_bb_std_mult': 3.498036519255762, 'bear_rsi_os': 29, 'bear_rsi_ob': 54, 'bear_adx_thresh': 16.192814508884695, 'bear_atr_min_pct': 0.01054193304302242, 'bear_atr_max_pct': 0.1284361327388164, 'bear_tp_mult': 2.4810013005357767, 'bear_tsl_mult': 0.8706079623489085, 'bear_time_stop': 39, 'bear_use_sma': False, 'bear_use_ema': False, 'bear_use_atr': False, 'bear_use_adx': False, 'bear_use_spike': True, 'bear_rsi_required': True, 'sideways_strategy': 'breakout', 'sideways_bb_std_mult': 1.3089984796676415, 'sideways_rsi_os': 6, 'sideways_rsi_ob': 66, 'sideways_adx_thresh': 14.641127200063824, 'sideways_atr_min_pct': 0.025774783867801174, 'sideways_atr_max_pct': 0.11467925076539096, 'sideways_tp_mult': 1.1608552924443512, 'sideways_tsl_mult': 0.8234040419516202, 'sideways_time_stop': 5, 'sideways_use_sma': True, 'sideways_use_ema': False, 'sideways_use_atr': False, 'sideways_use_adx': False, 'sideways_use_spike': False, 'sideways_rsi_required': True}.
[I 2025-08-31 10:13:44,619] Trial 173 finished with values: [-1000000000.0, 1000000000.0] and parameters: {'p_sma': 56, 'p_std': 55, 'p_atr': 16, 'p_adx': 11, 'rsi_period': 20, 'ema1': 14, 'ema2': 10, 'slip_atr_k': 0.011375941199157094, 'slip_spread_k': 0.47716520389446176, 'spread_hl_frac': 0.02271292695318717, 'bb_std_mult': 2.49680892627127, 'rsi_os': 40, 'rsi_ob': 76, 'vol_spike': 0.2085829675979724, 'adx_thresh': 26.66357877224056, 'atr_min_pct': 0.00668819570641308, 'atr_max_pct': 0.051037914281360924, 'tp_mult': 2.6369126947080597, 'tsl_mult': 0.7072303144719386, 'strategy': 'breakout', 'time_stop': 177, 'use_sma': True, 'use_atr': True, 'use_adx': True, 'use_ema': True, 'use_spike': False, 'rsi_required': True, 'edge_k': 0.46665414246287795, 'edge_cap': 0.473134569084726, 'bull_strategy': 'mean_reversion', 'bull_bb_std_mult': 3.3847330959610495, 'bull_rsi_os': 5, 'bull_rsi_ob': 55, 'bull_adx_thresh': 6.988156448225897, 'bull_atr_min_pct': 0.02700819348936185, 'bull_atr_max_pct': 0.0663297278403395, 'bull_tp_mult': 2.345644334221461, 'bull_tsl_mult': 0.2896476029877385, 'bull_time_stop': 24, 'bull_use_sma': False, 'bull_use_ema': False, 'bull_use_atr': False, 'bull_use_adx': True, 'bull_use_spike': True, 'bull_rsi_required': True, 'bear_strategy': 'breakout', 'bear_bb_std_mult': 3.475045269501069, 'bear_rsi_os': 31, 'bear_rsi_ob': 54, 'bear_adx_thresh': 15.82489835808035, 'bear_atr_min_pct': 0.008343364031330984, 'bear_atr_max_pct': 0.12788139868252102, 'bear_tp_mult': 1.8002053442645394, 'bear_tsl_mult': 0.3256462000460613, 'bear_time_stop': 61, 'bear_use_sma': False, 'bear_use_ema': False, 'bear_use_atr': False, 'bear_use_adx': False, 'bear_use_spike': True, 'bear_rsi_required': True, 'sideways_strategy': 'breakout', 'sideways_bb_std_mult': 1.0951941543858885, 'sideways_rsi_os': 28, 'sideways_rsi_ob': 67, 'sideways_adx_thresh': 28.477932499664224, 'sideways_atr_min_pct': 0.025541183142050047, 'sideways_atr_max_pct': 0.09841552471548279, 'sideways_tp_mult': 1.2214616529914089, 'sideways_tsl_mult': 0.07675018796016858, 'sideways_time_stop': 5, 'sideways_use_sma': True, 'sideways_use_ema': False, 'sideways_use_atr': False, 'sideways_use_adx': False, 'sideways_use_spike': False, 'sideways_rsi_required': True}.
[I 2025-08-31 10:13:45,235] Trial 172 finished with values: [-1000000000.0, 1000000000.0] and parameters: {'p_sma': 60, 'p_std': 58, 'p_atr': 21, 'p_adx': 13, 'rsi_period': 28, 'ema1': 13, 'ema2': 28, 'slip_atr_k': 0.20441366739015537, 'slip_spread_k': 0.2318712503203363, 'spread_hl_frac': 0.022760547763539255, 'bb_std_mult': 2.5128291937892593, 'rsi_os': 43, 'rsi_ob': 76, 'vol_spike': 0.07551529119062728, 'adx_thresh': 27.109509754694987, 'atr_min_pct': 0.006686625543481865, 'atr_max_pct': 0.062235664493661746, 'tp_mult': 2.524404327526516, 'tsl_mult': 0.7049919925484163, 'strategy': 'breakout', 'time_stop': 183, 'use_sma': True, 'use_atr': True, 'use_adx': True, 'use_ema': True, 'use_spike': False, 'rsi_required': True, 'edge_k': 1.749679770837345, 'edge_cap': 0.43103117314601797, 'bull_strategy': 'mean_reversion', 'bull_bb_std_mult': 2.6401184916414775, 'bull_rsi_os': 5, 'bull_rsi_ob': 78, 'bull_adx_thresh': 5.091201071890556, 'bull_atr_min_pct': 0.00526220964461778, 'bull_atr_max_pct': 0.06529975599901723, 'bull_tp_mult': 1.1974966859334712, 'bull_tsl_mult': 0.43835568103365485, 'bull_time_stop': 273, 'bull_use_sma': False, 'bull_use_ema': False, 'bull_use_atr': False, 'bull_use_adx': True, 'bull_use_spike': True, 'bull_rsi_required': True, 'bear_strategy': 'breakout', 'bear_bb_std_mult': 1.312568899733244, 'bear_rsi_os': 29, 'bear_rsi_ob': 54, 'bear_adx_thresh': 25.33343834672042, 'bear_atr_min_pct': 0.010416109782072802, 'bear_atr_max_pct': 0.12755437363063063, 'bear_tp_mult': 1.4101988122290976, 'bear_tsl_mult': 0.32463178103352935, 'bear_time_stop': 38, 'bear_use_sma': False, 'bear_use_ema': False, 'bear_use_atr': False, 'bear_use_adx': False, 'bear_use_spike': True, 'bear_rsi_required': True, 'sideways_strategy': 'breakout', 'sideways_bb_std_mult': 2.499940662444737, 'sideways_rsi_os': 27, 'sideways_rsi_ob': 66, 'sideways_adx_thresh': 28.0229706187017, 'sideways_atr_min_pct': 0.0264407608354469, 'sideways_atr_max_pct': 0.05501970105476454, 'sideways_tp_mult': 1.2275846706200273, 'sideways_tsl_mult': 0.8223026833272893, 'sideways_time_stop': 7, 'sideways_use_sma': True, 'sideways_use_ema': True, 'sideways_use_atr': False, 'sideways_use_adx': False, 'sideways_use_spike': True, 'sideways_rsi_required': True}.
[I 2025-08-31 10:13:45,370] Trial 171 finished with values: [-0.008734077549830688, 0.008427328382651552] and parameters: {'p_sma': 37, 'p_std': 54, 'p_atr': 16, 'p_adx': 13, 'rsi_period': 28, 'ema1': 11, 'ema2': 52, 'slip_atr_k': 0.2060945237575616, 'slip_spread_k': 0.47706862969220715, 'spread_hl_frac': 0.018270750148768305, 'bb_std_mult': 0.706834066578943, 'rsi_os': 40, 'rsi_ob': 76, 'vol_spike': 0.07932861175895403, 'adx_thresh': 26.769001043768768, 'atr_min_pct': 0.006592790876617825, 'atr_max_pct': 0.06009039225000391, 'tp_mult': 2.659368325367337, 'tsl_mult': 0.7057422763116585, 'strategy': 'breakout', 'time_stop': 106, 'use_sma': True, 'use_atr': True, 'use_adx': True, 'use_ema': True, 'use_spike': False, 'rsi_required': True, 'edge_k': 1.6165512044619488, 'edge_cap': 0.3316594006652479, 'bull_strategy': 'mean_reversion', 'bull_bb_std_mult': 1.020529405792447, 'bull_rsi_os': 6, 'bull_rsi_ob': 82, 'bull_adx_thresh': 11.627350275935097, 'bull_atr_min_pct': 0.0031011446122702693, 'bull_atr_max_pct': 0.06496759868743604, 'bull_tp_mult': 1.1653668488495383, 'bull_tsl_mult': 0.11529370613849152, 'bull_time_stop': 10, 'bull_use_sma': False, 'bull_use_ema': False, 'bull_use_atr': False, 'bull_use_adx': True, 'bull_use_spike': True, 'bull_rsi_required': True, 'bear_strategy': 'breakout', 'bear_bb_std_mult': 3.519864766804481, 'bear_rsi_os': 35, 'bear_rsi_ob': 55, 'bear_adx_thresh': 34.19889996119904, 'bear_atr_min_pct': 0.008261441152379322, 'bear_atr_max_pct': 0.10655251198613458, 'bear_tp_mult': 1.220762417981755, 'bear_tsl_mult': 0.9504968198370625, 'bear_time_stop': 26, 'bear_use_sma': False, 'bear_use_ema': False, 'bear_use_atr': False, 'bear_use_adx': False, 'bear_use_spike': True, 'bear_rsi_required': True, 'sideways_strategy': 'breakout', 'sideways_bb_std_mult': 1.0764990992877708, 'sideways_rsi_os': 5, 'sideways_rsi_ob': 66, 'sideways_adx_thresh': 27.48430323716928, 'sideways_atr_min_pct': 0.02722010652331718, 'sideways_atr_max_pct': 0.12555441229555553, 'sideways_tp_mult': 1.4173332027601742, 'sideways_tsl_mult': 0.8182337803463021, 'sideways_time_stop': 9, 'sideways_use_sma': True, 'sideways_use_ema': True, 'sideways_use_atr': True, 'sideways_use_adx': False, 'sideways_use_spike': True, 'sideways_rsi_required': True}.
[I 2025-08-31 10:14:18,329] Trial 175 finished with values: [-1000000000.0, 1000000000.0] and parameters: {'p_sma': 57, 'p_std': 34, 'p_atr': 21, 'p_adx': 11, 'rsi_period': 22, 'ema1': 11, 'ema2': 10, 'slip_atr_k': 0.10403348783541051, 'slip_spread_k': 0.24242716717800378, 'spread_hl_frac': 0.005141142802254679, 'bb_std_mult': 2.5122333900915055, 'rsi_os': 45, 'rsi_ob': 76, 'vol_spike': 0.22341791392678936, 'adx_thresh': 8.076153220782144, 'atr_min_pct': 0.006798568402152939, 'atr_max_pct': 0.10273634322508576, 'tp_mult': 1.367902211377995, 'tsl_mult': 0.4548571527088182, 'strategy': 'breakout', 'time_stop': 46, 'use_sma': True, 'use_atr': True, 'use_adx': True, 'use_ema': True, 'use_spike': False, 'rsi_required': True, 'edge_k': 1.6036546847364943, 'edge_cap': 0.4405558734685939, 'bull_strategy': 'breakout', 'bull_bb_std_mult': 3.001240616812613, 'bull_rsi_os': 5, 'bull_rsi_ob': 78, 'bull_adx_thresh': 17.926232140297948, 'bull_atr_min_pct': 0.0051618129908081005, 'bull_atr_max_pct': 0.07317540209260426, 'bull_tp_mult': 2.693394456083165, 'bull_tsl_mult': 0.25168200464655055, 'bull_time_stop': 10, 'bull_use_sma': False, 'bull_use_ema': False, 'bull_use_atr': False, 'bull_use_adx': True, 'bull_use_spike': True, 'bull_rsi_required': True, 'bear_strategy': 'mean_reversion', 'bear_bb_std_mult': 1.1949401903034007, 'bear_rsi_os': 35, 'bear_rsi_ob': 55, 'bear_adx_thresh': 34.49871328003705, 'bear_atr_min_pct': 0.010168507262511074, 'bear_atr_max_pct': 0.13139428550182242, 'bear_tp_mult': 1.394871132389915, 'bear_tsl_mult': 0.33403488108015256, 'bear_time_stop': 27, 'bear_use_sma': False, 'bear_use_ema': False, 'bear_use_atr': True, 'bear_use_adx': False, 'bear_use_spike': True, 'bear_rsi_required': True, 'sideways_strategy': 'breakout', 'sideways_bb_std_mult': 1.5049474650530401, 'sideways_rsi_os': 28, 'sideways_rsi_ob': 69, 'sideways_adx_thresh': 27.755649372739988, 'sideways_atr_min_pct': 0.02662501525532372, 'sideways_atr_max_pct': 0.021432782187294885, 'sideways_tp_mult': 1.2378466960003647, 'sideways_tsl_mult': 0.7741121473951863, 'sideways_time_stop': 9, 'sideways_use_sma': True, 'sideways_use_ema': True, 'sideways_use_atr': False, 'sideways_use_adx': False, 'sideways_use_spike': False, 'sideways_rsi_required': True}.
[I 2025-08-31 10:14:18,486] Trial 176 finished with values: [-1000000000.0, 1000000000.0] and parameters: {'p_sma': 60, 'p_std': 58, 'p_atr': 21, 'p_adx': 10, 'rsi_period': 22, 'ema1': 12, 'ema2': 56, 'slip_atr_k': 0.07717579926378985, 'slip_spread_k': 0.24639484754627294, 'spread_hl_frac': 0.005394129329835519, 'bb_std_mult': 0.7033494985855768, 'rsi_os': 38, 'rsi_ob': 74, 'vol_spike': 0.2050134997166635, 'adx_thresh': 8.221315969712252, 'atr_min_pct': 0.00858544950229579, 'atr_max_pct': 0.04793898114012241, 'tp_mult': 1.3596206638161468, 'tsl_mult': 0.6229066877571352, 'strategy': 'breakout', 'time_stop': 99, 'use_sma': True, 'use_atr': False, 'use_adx': True, 'use_ema': False, 'use_spike': False, 'rsi_required': True, 'edge_k': 1.7441447299845474, 'edge_cap': 0.3808737968530598, 'bull_strategy': 'breakout', 'bull_bb_std_mult': 3.015571810391586, 'bull_rsi_os': 24, 'bull_rsi_ob': 74, 'bull_adx_thresh': 12.543986735023859, 'bull_atr_min_pct': 0.024584304003801273, 'bull_atr_max_pct': 0.07323887587064307, 'bull_tp_mult': 2.4428451518577994, 'bull_tsl_mult': 0.44149197970592513, 'bull_time_stop': 10, 'bull_use_sma': True, 'bull_use_ema': True, 'bull_use_atr': True, 'bull_use_adx': True, 'bull_use_spike': True, 'bull_rsi_required': False, 'bear_strategy': 'mean_reversion', 'bear_bb_std_mult': 1.322237556872674, 'bear_rsi_os': 33, 'bear_rsi_ob': 55, 'bear_adx_thresh': 8.627024378001757, 'bear_atr_min_pct': 0.010472466904476807, 'bear_atr_max_pct': 0.12317011865580829, 'bear_tp_mult': 2.632305296521765, 'bear_tsl_mult': 0.39037297888052397, 'bear_time_stop': 286, 'bear_use_sma': False, 'bear_use_ema': False, 'bear_use_atr': True, 'bear_use_adx': False, 'bear_use_spike': True, 'bear_rsi_required': True, 'sideways_strategy': 'breakout', 'sideways_bb_std_mult': 1.4961801807742787, 'sideways_rsi_os': 5, 'sideways_rsi_ob': 69, 'sideways_adx_thresh': 34.171998750403255, 'sideways_atr_min_pct': 0.02768372125011737, 'sideways_atr_max_pct': 0.020608797390096176, 'sideways_tp_mult': 2.6232619105108834, 'sideways_tsl_mult': 0.7722002139081323, 'sideways_time_stop': 16, 'sideways_use_sma': True, 'sideways_use_ema': True, 'sideways_use_atr': True, 'sideways_use_adx': False, 'sideways_use_spike': False, 'sideways_rsi_required': True}.
[I 2025-08-31 10:14:18,493] Trial 178 finished with values: [-1000000000.0, 1000000000.0] and parameters: {'p_sma': 21, 'p_std': 37, 'p_atr': 17, 'p_adx': 11, 'rsi_period': 22, 'ema1': 12, 'ema2': 13, 'slip_atr_k': 0.043344159230201476, 'slip_spread_k': 0.3069583853751693, 'spread_hl_frac': 0.017904481624123756, 'bb_std_mult': 0.6994433213076453, 'rsi_os': 38, 'rsi_ob': 74, 'vol_spike': 0.11110223370182251, 'adx_thresh': 8.153178952257253, 'atr_min_pct': 0.009977143578543667, 'atr_max_pct': 0.04785498571145337, 'tp_mult': 2.8344370272262025, 'tsl_mult': 0.24505503029777637, 'strategy': 'breakout', 'time_stop': 34, 'use_sma': True, 'use_atr': False, 'use_adx': True, 'use_ema': False, 'use_spike': True, 'rsi_required': True, 'edge_k': 0.6092086268048684, 'edge_cap': 0.3814912761861708, 'bull_strategy': 'breakout', 'bull_bb_std_mult': 2.7824658088402736, 'bull_rsi_os': 22, 'bull_rsi_ob': 74, 'bull_adx_thresh': 12.423324381184381, 'bull_atr_min_pct': 0.015540126566351821, 'bull_atr_max_pct': 0.069763999418124, 'bull_tp_mult': 1.993103578265047, 'bull_tsl_mult': 0.07109693088512845, 'bull_time_stop': 118, 'bull_use_sma': True, 'bull_use_ema': True, 'bull_use_atr': True, 'bull_use_adx': True, 'bull_use_spike': True, 'bull_rsi_required': False, 'bear_strategy': 'mean_reversion', 'bear_bb_std_mult': 3.366593339013005, 'bear_rsi_os': 27, 'bear_rsi_ob': 60, 'bear_adx_thresh': 34.677885940565176, 'bear_atr_min_pct': 0.00855770651126717, 'bear_atr_max_pct': 0.13093372795593766, 'bear_tp_mult': 2.686296341450079, 'bear_tsl_mult': 0.3785824570749854, 'bear_time_stop': 18, 'bear_use_sma': False, 'bear_use_ema': False, 'bear_use_atr': True, 'bear_use_adx': False, 'bear_use_spike': True, 'bear_rsi_required': True, 'sideways_strategy': 'breakout', 'sideways_bb_std_mult': 1.3989322515960663, 'sideways_rsi_os': 13, 'sideways_rsi_ob': 69, 'sideways_adx_thresh': 22.8474386796202, 'sideways_atr_min_pct': 0.026613877610426318, 'sideways_atr_max_pct': 0.020704647138388405, 'sideways_tp_mult': 1.4134437747113617, 'sideways_tsl_mult': 0.9183290150842451, 'sideways_time_stop': 14, 'sideways_use_sma': True, 'sideways_use_ema': True, 'sideways_use_atr': True, 'sideways_use_adx': False, 'sideways_use_spike': False, 'sideways_rsi_required': False}.
[I 2025-08-31 10:14:18,614] Trial 177 finished with values: [-0.009671663509283834, 0.009563735677815132] and parameters: {'p_sma': 26, 'p_std': 50, 'p_atr': 22, 'p_adx': 11, 'rsi_period': 22, 'ema1': 11, 'ema2': 12, 'slip_atr_k': 0.21665049999462385, 'slip_spread_k': 0.29316853254174635, 'spread_hl_frac': 0.04499962400982282, 'bb_std_mult': 0.6936024887196393, 'rsi_os': 38, 'rsi_ob': 74, 'vol_spike': 0.2226833912359537, 'adx_thresh': 8.14363466337159, 'atr_min_pct': 0.008344512487511228, 'atr_max_pct': 0.10403177800939087, 'tp_mult': 1.1421621142736718, 'tsl_mult': 0.2491903063719878, 'strategy': 'breakout', 'time_stop': 33, 'use_sma': True, 'use_atr': False, 'use_adx': True, 'use_ema': False, 'use_spike': True, 'rsi_required': True, 'edge_k': 1.6094462963190554, 'edge_cap': 0.3794711912681097, 'bull_strategy': 'breakout', 'bull_bb_std_mult': 0.9428805744462694, 'bull_rsi_os': 11, 'bull_rsi_ob': 59, 'bull_adx_thresh': 12.376136968331537, 'bull_atr_min_pct': 0.002846713142453475, 'bull_atr_max_pct': 0.07376964792649016, 'bull_tp_mult': 1.1371766598910917, 'bull_tsl_mult': 0.0464100860958128, 'bull_time_stop': 12, 'bull_use_sma': True, 'bull_use_ema': True, 'bull_use_atr': True, 'bull_use_adx': True, 'bull_use_spike': True, 'bull_rsi_required': False, 'bear_strategy': 'mean_reversion', 'bear_bb_std_mult': 3.562761323395807, 'bear_rsi_os': 33, 'bear_rsi_ob': 60, 'bear_adx_thresh': 17.18197729917868, 'bear_atr_min_pct': 0.009270492727873437, 'bear_atr_max_pct': 0.11252411489197658, 'bear_tp_mult': 2.628333748813615, 'bear_tsl_mult': 0.3831689260244086, 'bear_time_stop': 53, 'bear_use_sma': False, 'bear_use_ema': False, 'bear_use_atr': True, 'bear_use_adx': False, 'bear_use_spike': True, 'bear_rsi_required': True, 'sideways_strategy': 'breakout', 'sideways_bb_std_mult': 1.401185967170968, 'sideways_rsi_os': 13, 'sideways_rsi_ob': 63, 'sideways_adx_thresh': 34.15936580145474, 'sideways_atr_min_pct': 0.027795867668306332, 'sideways_atr_max_pct': 0.02049512957775372, 'sideways_tp_mult': 2.61195001292805, 'sideways_tsl_mult': 0.00826251040452658, 'sideways_time_stop': 17, 'sideways_use_sma': True, 'sideways_use_ema': True, 'sideways_use_atr': True, 'sideways_use_adx': False, 'sideways_use_spike': False, 'sideways_rsi_required': False}.
[I 2025-08-31 10:14:51,439] Trial 180 finished with values: [-1000000000.0, 1000000000.0] and parameters: {'p_sma': 53, 'p_std': 35, 'p_atr': 7, 'p_adx': 10, 'rsi_period': 25, 'ema1': 11, 'ema2': 52, 'slip_atr_k': 0.2155785524012426, 'slip_spread_k': 0.27820782075089284, 'spread_hl_frac': 0.004587685718777092, 'bb_std_mult': 1.9524221648007223, 'rsi_os': 40, 'rsi_ob': 71, 'vol_spike': 0.1903959520060109, 'adx_thresh': 34.81844805769128, 'atr_min_pct': 0.005729103134890877, 'atr_max_pct': 0.055829555498757455, 'tp_mult': 2.9224494021913476, 'tsl_mult': 0.6364857908121817, 'strategy': 'breakout', 'time_stop': 70, 'use_sma': False, 'use_atr': False, 'use_adx': False, 'use_ema': False, 'use_spike': True, 'rsi_required': True, 'edge_k': 1.8124115592521601, 'edge_cap': 0.2650872770783406, 'bull_strategy': 'mean_reversion', 'bull_bb_std_mult': 3.542140100354313, 'bull_rsi_os': 11, 'bull_rsi_ob': 52, 'bull_adx_thresh': 19.424396002552186, 'bull_atr_min_pct': 0.020620968600076756, 'bull_atr_max_pct': 0.14663499618909553, 'bull_tp_mult': 1.1502617373323427, 'bull_tsl_mult': 0.11435339264587302, 'bull_time_stop': 24, 'bull_use_sma': True, 'bull_use_ema': False, 'bull_use_atr': True, 'bull_use_adx': True, 'bull_use_spike': True, 'bull_rsi_required': True, 'bear_strategy': 'breakout', 'bear_bb_std_mult': 2.062841968613225, 'bear_rsi_os': 33, 'bear_rsi_ob': 57, 'bear_adx_thresh': 13.385594377864344, 'bear_atr_min_pct': 0.012903805627461275, 'bear_atr_max_pct': 0.14830510073813952, 'bear_tp_mult': 2.5052389131494324, 'bear_tsl_mult': 0.25795605589991444, 'bear_time_stop': 13, 'bear_use_sma': False, 'bear_use_ema': True, 'bear_use_atr': True, 'bear_use_adx': True, 'bear_use_spike': True, 'bear_rsi_required': True, 'sideways_strategy': 'breakout', 'sideways_bb_std_mult': 1.349382176057081, 'sideways_rsi_os': 30, 'sideways_rsi_ob': 73, 'sideways_adx_thresh': 15.815727651151303, 'sideways_atr_min_pct': 0.028525211219359324, 'sideways_atr_max_pct': 0.130005505518448, 'sideways_tp_mult': 1.1267563444950746, 'sideways_tsl_mult': 0.23137893365320916, 'sideways_time_stop': 230, 'sideways_use_sma': True, 'sideways_use_ema': False, 'sideways_use_atr': False, 'sideways_use_adx': False, 'sideways_use_spike': True, 'sideways_rsi_required': False}.
