[I 2025-08-31 09:55:52,041] Trial 34 finished with values: [-1000000000.0, 1000000000.0] and parameters: {'p_sma': 27, 'p_std': 30, 'p_atr': 27, 'p_adx': 18, 'rsi_period': 20, 'ema1': 28, 'ema2': 44, 'slip_atr_k': 0.18102695468499425, 'slip_spread_k': 0.8370523262816774, 'spread_hl_frac': 0.006117545713398519, 'bb_std_mult': 3.251937241050503, 'rsi_os': 46, 'rsi_ob': 54, 'vol_spike': 0.2679612361629124, 'adx_thresh': 20.389030582034344, 'atr_min_pct': 0.0264826888100223, 'atr_max_pct': 0.12053500722174698, 'tp_mult': 1.606488917546532, 'tsl_mult': 0.20199273771094683, 'strategy': 'breakout', 'time_stop': 271, 'use_sma': True, 'use_atr': False, 'use_adx': True, 'use_ema': False, 'use_spike': False, 'rsi_required': True, 'edge_k': 1.1359039251032172, 'edge_cap': 0.9270631760834375, 'bull_strategy': 'mean_reversion', 'bull_bb_std_mult': 2.0575630228599615, 'bull_rsi_os': 30, 'bull_rsi_ob': 46, 'bull_adx_thresh': 26.531627564962236, 'bull_atr_min_pct': 0.018940951100470227, 'bull_atr_max_pct': 0.05191134795722571, 'bull_tp_mult': 2.6819098680376294, 'bull_tsl_mult': 0.4367107142271237, 'bull_time_stop': 92, 'bull_use_sma': True, 'bull_use_ema': False, 'bull_use_atr': False, 'bull_use_adx': False, 'bull_use_spike': False, 'bull_rsi_required': True, 'bear_strategy': 'breakout', 'bear_bb_std_mult': 2.872578164442102, 'bear_rsi_os': 14, 'bear_rsi_ob': 59, 'bear_adx_thresh': 8.258279235500625, 'bear_atr_min_pct': 0.02912210882012651, 'bear_atr_max_pct': 0.08574321185361425, 'bear_tp_mult': 1.9233796446265163, 'bear_tsl_mult': 0.1040800913126898, 'bear_time_stop': 236, 'bear_use_sma': True, 'bear_use_ema': True, 'bear_use_atr': False, 'bear_use_adx': False, 'bear_use_spike': False, 'bear_rsi_required': False, 'sideways_strategy': 'breakout', 'sideways_bb_std_mult': 0.5280795526887074, 'sideways_rsi_os': 16, 'sideways_rsi_ob': 49, 'sideways_adx_thresh': 5.882238955275007, 'sideways_atr_min_pct': 0.018436074516320212, 'sideways_atr_max_pct': 0.02404264186141109, 'sideways_tp_mult': 2.228202545284142, 'sideways_tsl_mult': 0.8740532605367339, 'sideways_time_stop': 86, 'sideways_use_sma': False, 'sideways_use_ema': True, 'sideways_use_atr': False, 'sideways_use_adx': True, 'sideways_use_spike': True, 'sideways_rsi_required': False}.
[I 2025-08-31 09:55:52,402] Trial 40 finished with values: [-1000000000.0, 1000000000.0] and parameters: {'p_sma': 48, 'p_std': 37, 'p_atr': 20, 'p_adx': 22, 'rsi_period': 78, 'ema1': 12, 'ema2': 31, 'slip_atr_k': 0.059966508837494756, 'slip_spread_k': 0.2784853694694046, 'spread_hl_frac': 0.018494752037991464, 'bb_std_mult': 2.7948213610113335, 'rsi_os': 54, 'rsi_ob': 61, 'vol_spike': 0.27635462420115864, 'adx_thresh': 11.382982967032452, 'atr_min_pct': 0.0007630109775905568, 'atr_max_pct': 0.10771939412221886, 'tp_mult': 1.3502394737605794, 'tsl_mult': 0.14022528243699206, 'strategy': 'mean_reversion', 'time_stop': 237, 'use_sma': True, 'use_atr': True, 'use_adx': False, 'use_ema': False, 'use_spike': True, 'rsi_required': False, 'edge_k': 0.7874525807804311, 'edge_cap': 0.8288148310023513, 'bull_strategy': 'breakout', 'bull_bb_std_mult': 1.7930512244607373, 'bull_rsi_os': 47, 'bull_rsi_ob': 84, 'bull_adx_thresh': 17.505314669723155, 'bull_atr_min_pct': 0.0023319909567322107, 'bull_atr_max_pct': 0.06919602477685927, 'bull_tp_mult': 2.0192449660770193, 'bull_tsl_mult': 0.2338938067472453, 'bull_time_stop': 137, 'bull_use_sma': False, 'bull_use_ema': False, 'bull_use_atr': True, 'bull_use_adx': True, 'bull_use_spike': False, 'bull_rsi_required': True, 'bear_strategy': 'mean_reversion', 'bear_bb_std_mult': 0.8207374605145195, 'bear_rsi_os': 9, 'bear_rsi_ob': 71, 'bear_adx_thresh': 10.731977478588433, 'bear_atr_min_pct': 0.026296975792001267, 'bear_atr_max_pct': 0.10471196938492848, 'bear_tp_mult': 2.1466710148277675, 'bear_tsl_mult': 0.23726648441066658, 'bear_time_stop': 291, 'bear_use_sma': True, 'bear_use_ema': False, 'bear_use_atr': True, 'bear_use_adx': True, 'bear_use_spike': False, 'bear_rsi_required': True, 'sideways_strategy': 'mean_reversion', 'sideways_bb_std_mult': 0.9988667959003916, 'sideways_rsi_os': 23, 'sideways_rsi_ob': 49, 'sideways_adx_thresh': 7.736436339650869, 'sideways_atr_min_pct': 0.02672243137302346, 'sideways_atr_max_pct': 0.05920918004992786, 'sideways_tp_mult': 1.6245275822627177, 'sideways_tsl_mult': 0.27804871178543955, 'sideways_time_stop': 35, 'sideways_use_sma': True, 'sideways_use_ema': False, 'sideways_use_atr': True, 'sideways_use_adx': True, 'sideways_use_spike': True, 'sideways_rsi_required': True}.
[I 2025-08-31 09:56:25,544] Trial 41 finished with values: [-1000000000.0, 1000000000.0] and parameters: {'p_sma': 17, 'p_std': 46, 'p_atr': 25, 'p_adx': 12, 'rsi_period': 54, 'ema1': 18, 'ema2': 32, 'slip_atr_k': 0.004311039627897528, 'slip_spread_k': 0.7666362373142392, 'spread_hl_frac': 0.011716978156084886, 'bb_std_mult': 2.0894825614422046, 'rsi_os': 18, 'rsi_ob': 75, 'vol_spike': 0.13533939464433906, 'adx_thresh': 15.706286548301458, 'atr_min_pct': 0.004339114931298365, 'atr_max_pct': 0.03376132143962054, 'tp_mult': 1.1056259756271902, 'tsl_mult': 0.6883924775391373, 'strategy': 'mean_reversion', 'time_stop': 65, 'use_sma': False, 'use_atr': True, 'use_adx': False, 'use_ema': False, 'use_spike': True, 'rsi_required': True, 'edge_k': 1.3843731598738402, 'edge_cap': 0.19498541305591682, 'bull_strategy': 'mean_reversion', 'bull_bb_std_mult': 2.694951834712971, 'bull_rsi_os': 51, 'bull_rsi_ob': 86, 'bull_adx_thresh': 32.41239048360012, 'bull_atr_min_pct': 0.012872047058581072, 'bull_atr_max_pct': 0.13719803182577245, 'bull_tp_mult': 1.2484769571391316, 'bull_tsl_mult': 0.9214557977169042, 'bull_time_stop': 63, 'bull_use_sma': True, 'bull_use_ema': False, 'bull_use_atr': False, 'bull_use_adx': True, 'bull_use_spike': True, 'bull_rsi_required': True, 'bear_strategy': 'mean_reversion', 'bear_bb_std_mult': 1.2285106454151733, 'bear_rsi_os': 19, 'bear_rsi_ob': 81, 'bear_adx_thresh': 12.987355203827601, 'bear_atr_min_pct': 0.02256879165568161, 'bear_atr_max_pct': 0.1286010388524198, 'bear_tp_mult': 1.3521134540331257, 'bear_tsl_mult': 0.48590899840898094, 'bear_time_stop': 82, 'bear_use_sma': True, 'bear_use_ema': False, 'bear_use_atr': True, 'bear_use_adx': False, 'bear_use_spike': True, 'bear_rsi_required': True, 'sideways_strategy': 'breakout', 'sideways_bb_std_mult': 1.575488206432403, 'sideways_rsi_os': 41, 'sideways_rsi_ob': 53, 'sideways_adx_thresh': 26.313352659236532, 'sideways_atr_min_pct': 0.029705185375385405, 'sideways_atr_max_pct': 0.05673244039946539, 'sideways_tp_mult': 1.3937860789069076, 'sideways_tsl_mult': 0.45193247988671886, 'sideways_time_stop': 290, 'sideways_use_sma': False, 'sideways_use_ema': False, 'sideways_use_atr': False, 'sideways_use_adx': True, 'sideways_use_spike': True, 'sideways_rsi_required': False}.
[I 2025-08-31 09:56:26,070] Trial 39 finished with values: [-1000000000.0, 1000000000.0] and parameters: {'p_sma': 19, 'p_std': 37, 'p_atr': 20, 'p_adx': 22, 'rsi_period': 78, 'ema1': 12, 'ema2': 32, 'slip_atr_k': 0.18690289167981466, 'slip_spread_k': 0.3074425289130398, 'spread_hl_frac': 0.04389270798484757, 'bb_std_mult': 2.8450639254249412, 'rsi_os': 18, 'rsi_ob': 60, 'vol_spike': 0.27068452578295343, 'adx_thresh': 26.884177662389813, 'atr_min_pct': 0.009536447311855281, 'atr_max_pct': 0.10801342500435487, 'tp_mult': 1.3520516748812517, 'tsl_mult': 0.13171819390921333, 'strategy': 'mean_reversion', 'time_stop': 234, 'use_sma': True, 'use_atr': True, 'use_adx': False, 'use_ema': False, 'use_spike': True, 'rsi_required': True, 'edge_k': 0.7907009678952162, 'edge_cap': 0.6747451131461566, 'bull_strategy': 'mean_reversion', 'bull_bb_std_mult': 2.6980439352170973, 'bull_rsi_os': 48, 'bull_rsi_ob': 85, 'bull_adx_thresh': 15.507737473206117, 'bull_atr_min_pct': 0.01381033588936336, 'bull_atr_max_pct': 0.06746482824423804, 'bull_tp_mult': 2.026707423458064, 'bull_tsl_mult': 0.9178864059288774, 'bull_time_stop': 147, 'bull_use_sma': True, 'bull_use_ema': False, 'bull_use_atr': False, 'bull_use_adx': True, 'bull_use_spike': False, 'bull_rsi_required': True, 'bear_strategy': 'mean_reversion', 'bear_bb_std_mult': 3.317641713738474, 'bear_rsi_os': 10, 'bear_rsi_ob': 73, 'bear_adx_thresh': 10.671764648757199, 'bear_atr_min_pct': 0.026165351546759995, 'bear_atr_max_pct': 0.028661484076916745, 'bear_tp_mult': 2.1474623560135426, 'bear_tsl_mult': 0.23791026386795522, 'bear_time_stop': 296, 'bear_use_sma': True, 'bear_use_ema': False, 'bear_use_atr': True, 'bear_use_adx': True, 'bear_use_spike': False, 'bear_rsi_required': True, 'sideways_strategy': 'breakout', 'sideways_bb_std_mult': 1.0126696437303704, 'sideways_rsi_os': 22, 'sideways_rsi_ob': 49, 'sideways_adx_thresh': 13.676470629704514, 'sideways_atr_min_pct': 0.029306440547839808, 'sideways_atr_max_pct': 0.1250071903736758, 'sideways_tp_mult': 1.7503632373184415, 'sideways_tsl_mult': 0.28244017446500974, 'sideways_time_stop': 46, 'sideways_use_sma': False, 'sideways_use_ema': False, 'sideways_use_atr': False, 'sideways_use_adx': True, 'sideways_use_spike': True, 'sideways_rsi_required': False}.
[I 2025-08-31 09:56:26,314] Trial 37 finished with values: [-1000000000.0, 1000000000.0] and parameters: {'p_sma': 28, 'p_std': 12, 'p_atr': 20, 'p_adx': 17, 'rsi_period': 78, 'ema1': 28, 'ema2': 31, 'slip_atr_k': 0.1147834183892196, 'slip_spread_k': 0.30468706893190683, 'spread_hl_frac': 0.033449643978258344, 'bb_std_mult': 2.8272684634667984, 'rsi_os': 27, 'rsi_ob': 60, 'vol_spike': 0.2686319881975807, 'adx_thresh': 15.33328942006631, 'atr_min_pct': 0.0264975669029352, 'atr_max_pct': 0.10600160951998827, 'tp_mult': 2.0657320851018453, 'tsl_mult': 0.20351888977927496, 'strategy': 'mean_reversion', 'time_stop': 183, 'use_sma': False, 'use_atr': True, 'use_adx': True, 'use_ema': True, 'use_spike': True, 'rsi_required': True, 'edge_k': 1.109961968214156, 'edge_cap': 0.8154860816905293, 'bull_strategy': 'breakout', 'bull_bb_std_mult': 2.684285201042453, 'bull_rsi_os': 29, 'bull_rsi_ob': 86, 'bull_adx_thresh': 32.17369470918052, 'bull_atr_min_pct': 0.02568700230710951, 'bull_atr_max_pct': 0.07191192711549747, 'bull_tp_mult': 1.5246699938466837, 'bull_tsl_mult': 0.5678012191542596, 'bull_time_stop': 62, 'bull_use_sma': True, 'bull_use_ema': False, 'bull_use_atr': False, 'bull_use_adx': True, 'bull_use_spike': False, 'bull_rsi_required': True, 'bear_strategy': 'breakout', 'bear_bb_std_mult': 3.305255346841869, 'bear_rsi_os': 47, 'bear_rsi_ob': 73, 'bear_adx_thresh': 13.099987349801857, 'bear_atr_min_pct': 0.026143159952623903, 'bear_atr_max_pct': 0.10549025147131176, 'bear_tp_mult': 2.1276613461292464, 'bear_tsl_mult': 0.3626549004779167, 'bear_time_stop': 56, 'bear_use_sma': True, 'bear_use_ema': True, 'bear_use_atr': False, 'bear_use_adx': True, 'bear_use_spike': False, 'bear_rsi_required': True, 'sideways_strategy': 'breakout', 'sideways_bb_std_mult': 0.5059423094237232, 'sideways_rsi_os': 9, 'sideways_rsi_ob': 49, 'sideways_adx_thresh': 28.486961906342955, 'sideways_atr_min_pct': 0.017818326238872757, 'sideways_atr_max_pct': 0.020070221646010196, 'sideways_tp_mult': 2.027216486038227, 'sideways_tsl_mult': 0.7189170676272193, 'sideways_time_stop': 195, 'sideways_use_sma': True, 'sideways_use_ema': True, 'sideways_use_atr': False, 'sideways_use_adx': True, 'sideways_use_spike': False, 'sideways_rsi_required': False}.
[I 2025-08-31 09:56:26,415] Trial 38 finished with values: [-1000000000.0, 1000000000.0] and parameters: {'p_sma': 19, 'p_std': 33, 'p_atr': 20, 'p_adx': 22, 'rsi_period': 78, 'ema1': 18, 'ema2': 35, 'slip_atr_k': 0.1841164845307966, 'slip_spread_k': 0.2874494749414918, 'spread_hl_frac': 0.0006475181549393458, 'bb_std_mult': 2.8560171965928083, 'rsi_os': 18, 'rsi_ob': 60, 'vol_spike': 0.2695580935703758, 'adx_thresh': 11.45963673906445, 'atr_min_pct': 0.011776608984240756, 'atr_max_pct': 0.1060352652347604, 'tp_mult': 1.3116932856407553, 'tsl_mult': 0.20427638915293056, 'strategy': 'mean_reversion', 'time_stop': 65, 'use_sma': False, 'use_atr': True, 'use_adx': True, 'use_ema': False, 'use_spike': True, 'rsi_required': True, 'edge_k': 1.111748267234279, 'edge_cap': 0.685895249697134, 'bull_strategy': 'breakout', 'bull_bb_std_mult': 2.6925811894962255, 'bull_rsi_os': 29, 'bull_rsi_ob': 86, 'bull_adx_thresh': 17.302759090414092, 'bull_atr_min_pct': 0.014077641844889, 'bull_atr_max_pct': 0.06873893633557834, 'bull_tp_mult': 1.4045215023861002, 'bull_tsl_mult': 0.27282803792274646, 'bull_time_stop': 131, 'bull_use_sma': True, 'bull_use_ema': False, 'bull_use_atr': False, 'bull_use_adx': True, 'bull_use_spike': False, 'bull_rsi_required': True, 'bear_strategy': 'mean_reversion', 'bear_bb_std_mult': 0.5531943792049603, 'bear_rsi_os': 10, 'bear_rsi_ob': 71, 'bear_adx_thresh': 12.354125572241042, 'bear_atr_min_pct': 0.02699378435227434, 'bear_atr_max_pct': 0.13131333373798354, 'bear_tp_mult': 2.159190311017463, 'bear_tsl_mult': 0.005228284114918491, 'bear_time_stop': 294, 'bear_use_sma': True, 'bear_use_ema': False, 'bear_use_atr': True, 'bear_use_adx': True, 'bear_use_spike': False, 'bear_rsi_required': True, 'sideways_strategy': 'breakout', 'sideways_bb_std_mult': 1.5276482744574214, 'sideways_rsi_os': 20, 'sideways_rsi_ob': 50, 'sideways_adx_thresh': 26.709922601117512, 'sideways_atr_min_pct': 0.02785064928979141, 'sideways_atr_max_pct': 0.12479155540550882, 'sideways_tp_mult': 1.3105286596297563, 'sideways_tsl_mult': 0.29428374876722285, 'sideways_time_stop': 206, 'sideways_use_sma': True, 'sideways_use_ema': True, 'sideways_use_atr': False, 'sideways_use_adx': True, 'sideways_use_spike': True, 'sideways_rsi_required': False}.
[I 2025-08-31 09:56:26,635] Trial 42 finished with values: [-1000000000.0, 1000000000.0] and parameters: {'p_sma': 12, 'p_std': 5, 'p_atr': 25, 'p_adx': 10, 'rsi_period': 72, 'ema1': 13, 'ema2': 37, 'slip_atr_k': 0.14590613403180513, 'slip_spread_k': 0.2953266910754873, 'spread_hl_frac': 0.030365031035041186, 'bb_std_mult': 1.1198069929325443, 'rsi_os': 33, 'rsi_ob': 48, 'vol_spike': 0.03485308216121813, 'adx_thresh': 7.618616256098752, 'atr_min_pct': 0.013855084058919111, 'atr_max_pct': 0.04766200328417711, 'tp_mult': 2.0587914557695193, 'tsl_mult': 0.07191250361133582, 'strategy': 'mean_reversion', 'time_stop': 236, 'use_sma': False, 'use_atr': False, 'use_adx': True, 'use_ema': True, 'use_spike': True, 'rsi_required': False, 'edge_k': 0.7941761919709496, 'edge_cap': 0.6506876430092516, 'bull_strategy': 'breakout', 'bull_bb_std_mult': 3.1079640204034, 'bull_rsi_os': 41, 'bull_rsi_ob': 86, 'bull_adx_thresh': 22.72713581160232, 'bull_atr_min_pct': 0.025534522356019596, 'bull_atr_max_pct': 0.0654430716728031, 'bull_tp_mult': 1.4768970144604947, 'bull_tsl_mult': 0.6081428399417903, 'bull_time_stop': 24, 'bull_use_sma': True, 'bull_use_ema': False, 'bull_use_atr': True, 'bull_use_adx': True, 'bull_use_spike': False, 'bull_rsi_required': True, 'bear_strategy': 'breakout', 'bear_bb_std_mult': 0.5036009206384975, 'bear_rsi_os': 48, 'bear_rsi_ob': 64, 'bear_adx_thresh': 17.182263572375184, 'bear_atr_min_pct': 0.016875125002915745, 'bear_atr_max_pct': 0.1437724937692066, 'bear_tp_mult': 2.322413473808228, 'bear_tsl_mult': 0.22996817393136476, 'bear_time_stop': 166, 'bear_use_sma': True, 'bear_use_ema': False, 'bear_use_atr': False, 'bear_use_adx': True, 'bear_use_spike': False, 'bear_rsi_required': True, 'sideways_strategy': 'mean_reversion', 'sideways_bb_std_mult': 2.1934772106238403, 'sideways_rsi_os': 20, 'sideways_rsi_ob': 48, 'sideways_adx_thresh': 13.739117107137734, 'sideways_atr_min_pct': 0.02086708711718549, 'sideways_atr_max_pct': 0.12200327138561468, 'sideways_tp_mult': 2.0046347949083345, 'sideways_tsl_mult': 0.6154848927488166, 'sideways_time_stop': 51, 'sideways_use_sma': True, 'sideways_use_ema': False, 'sideways_use_atr': True, 'sideways_use_adx': True, 'sideways_use_spike': True, 'sideways_rsi_required': True}.
[I 2025-08-31 09:57:00,363] Trial 45 finished with values: [-1000000000.0, 1000000000.0] and parameters: {'p_sma': 37, 'p_std': 19, 'p_atr': 29, 'p_adx': 15, 'rsi_period': 72, 'ema1': 6, 'ema2': 24, 'slip_atr_k': 0.08637605711686355, 'slip_spread_k': 0.11544187865947841, 'spread_hl_frac': 0.02333845375677119, 'bb_std_mult': 3.439718621904023, 'rsi_os': 13, 'rsi_ob': 94, 'vol_spike': 0.23029154373627814, 'adx_thresh': 18.190599959673612, 'atr_min_pct': 0.0021682400298087667, 'atr_max_pct': 0.04920356385843082, 'tp_mult': 1.1409472989159377, 'tsl_mult': 0.9918600884359849, 'strategy': 'breakout', 'time_stop': 263, 'use_sma': True, 'use_atr': False, 'use_adx': True, 'use_ema': False, 'use_spike': False, 'rsi_required': False, 'edge_k': 0.0043558642894996336, 'edge_cap': 0.44040769318278394, 'bull_strategy': 'mean_reversion', 'bull_bb_std_mult': 3.1227551385148664, 'bull_rsi_os': 5, 'bull_rsi_ob': 95, 'bull_adx_thresh': 23.14404267867195, 'bull_atr_min_pct': 0.0018476382563721455, 'bull_atr_max_pct': 0.034220965236203243, 'bull_tp_mult': 2.853436288178994, 'bull_tsl_mult': 0.7496403721631906, 'bull_time_stop': 258, 'bull_use_sma': False, 'bull_use_ema': True, 'bull_use_atr': True, 'bull_use_adx': False, 'bull_use_spike': True, 'bull_rsi_required': False, 'bear_strategy': 'breakout', 'bear_bb_std_mult': 1.4072553228182034, 'bear_rsi_os': 17, 'bear_rsi_ob': 49, 'bear_adx_thresh': 25.860727173233705, 'bear_atr_min_pct': 0.017505919312397415, 'bear_atr_max_pct': 0.1443108961961438, 'bear_tp_mult': 2.9361606908205173, 'bear_tsl_mult': 0.8341604960810696, 'bear_time_stop': 126, 'bear_use_sma': False, 'bear_use_ema': False, 'bear_use_atr': True, 'bear_use_adx': False, 'bear_use_spike': True, 'bear_rsi_required': False, 'sideways_strategy': 'mean_reversion', 'sideways_bb_std_mult': 3.076968838332313, 'sideways_rsi_os': 8, 'sideways_rsi_ob': 47, 'sideways_adx_thresh': 32.40805719228737, 'sideways_atr_min_pct': 0.02046972740458005, 'sideways_atr_max_pct': 0.010959121011321724, 'sideways_tp_mult': 1.5401537824141605, 'sideways_tsl_mult': 0.44463521465129424, 'sideways_time_stop': 102, 'sideways_use_sma': False, 'sideways_use_ema': False, 'sideways_use_atr': True, 'sideways_use_adx': False, 'sideways_use_spike': True, 'sideways_rsi_required': True}.
[I 2025-08-31 09:57:00,886] Trial 43 finished with values: [-0.054696136531203976, 0.05478258393586665] and parameters: {'p_sma': 36, 'p_std': 8, 'p_atr': 25, 'p_adx': 9, 'rsi_period': 72, 'ema1': 7, 'ema2': 39, 'slip_atr_k': 0.14355703045502533, 'slip_spread_k': 0.14073693258684683, 'spread_hl_frac': 0.023127006041332932, 'bb_std_mult': 1.243605821990186, 'rsi_os': 33, 'rsi_ob': 45, 'vol_spike': 0.08566156573817921, 'adx_thresh': 7.374656072118802, 'atr_min_pct': 0.0064060786226612584, 'atr_max_pct': 0.07272848684755596, 'tp_mult': 2.0479576445760945, 'tsl_mult': 0.9804012367817345, 'strategy': 'breakout', 'time_stop': 292, 'use_sma': False, 'use_atr': False, 'use_adx': True, 'use_ema': True, 'use_spike': True, 'rsi_required': False, 'edge_k': 1.2965269037154374, 'edge_cap': 0.2679171043948175, 'bull_strategy': 'breakout', 'bull_bb_std_mult': 3.0743032764819005, 'bull_rsi_os': 41, 'bull_rsi_ob': 95, 'bull_adx_thresh': 23.657916468632475, 'bull_atr_min_pct': 0.0019042894447201047, 'bull_atr_max_pct': 0.034649735062932355, 'bull_tp_mult': 1.4846466772329956, 'bull_tsl_mult': 0.6018708359179274, 'bull_time_stop': 255, 'bull_use_sma': False, 'bull_use_ema': False, 'bull_use_atr': True, 'bull_use_adx': False, 'bull_use_spike': True, 'bull_rsi_required': True, 'bear_strategy': 'breakout', 'bear_bb_std_mult': 0.5874369041668255, 'bear_rsi_os': 51, 'bear_rsi_ob': 66, 'bear_adx_thresh': 30.805324160146007, 'bear_atr_min_pct': 0.01778533025792034, 'bear_atr_max_pct': 0.14916798812962018, 'bear_tp_mult': 2.7648774498865665, 'bear_tsl_mult': 0.018785387465482806, 'bear_time_stop': 164, 'bear_use_sma': False, 'bear_use_ema': False, 'bear_use_atr': False, 'bear_use_adx': False, 'bear_use_spike': True, 'bear_rsi_required': False, 'sideways_strategy': 'mean_reversion', 'sideways_bb_std_mult': 2.2147058733167375, 'sideways_rsi_os': 8, 'sideways_rsi_ob': 54, 'sideways_adx_thresh': 10.028742667384895, 'sideways_atr_min_pct': 0.021681328267598256, 'sideways_atr_max_pct': 0.08544296446257589, 'sideways_tp_mult': 2.023763121153957, 'sideways_tsl_mult': 0.6117181922802997, 'sideways_time_stop': 161, 'sideways_use_sma': True, 'sideways_use_ema': True, 'sideways_use_atr': True, 'sideways_use_adx': False, 'sideways_use_spike': False, 'sideways_rsi_required': True}.
