[I 2025-08-31 10:08:53,834] Trial 135 finished with values: [-0.013571248299271255, 0.01388453386183796] and parameters: {'p_sma': 22, 'p_std': 30, 'p_atr': 13, 'p_adx': 27, 'rsi_period': 9, 'ema1': 10, 'ema2': 13, 'slip_atr_k': 0.18741864753541765, 'slip_spread_k': 0.8124939326657357, 'spread_hl_frac': 0.002746174203082473, 'bb_std_mult': 1.184570345261032, 'rsi_os': 35, 'rsi_ob': 60, 'vol_spike': 0.2146409772049941, 'adx_thresh': 9.157386361992252, 'atr_min_pct': 0.007145104370143172, 'atr_max_pct': 0.08129538497716418, 'tp_mult': 2.6054826828147135, 'tsl_mult': 0.5185398903801214, 'strategy': 'breakout', 'time_stop': 121, 'use_sma': True, 'use_atr': False, 'use_adx': True, 'use_ema': False, 'use_spike': False, 'rsi_required': False, 'edge_k': 1.718992273566911, 'edge_cap': 0.9537070904491974, 'bull_strategy': 'mean_reversion', 'bull_bb_std_mult': 1.3853186342488233, 'bull_rsi_os': 10, 'bull_rsi_ob': 72, 'bull_adx_thresh': 12.825888266502188, 'bull_atr_min_pct': 0.004579132947112291, 'bull_atr_max_pct': 0.1399101847164796, 'bull_tp_mult': 1.7727985973220055, 'bull_tsl_mult': 0.030490790860250958, 'bull_time_stop': 181, 'bull_use_sma': True, 'bull_use_ema': False, 'bull_use_atr': True, 'bull_use_adx': True, 'bull_use_spike': True, 'bull_rsi_required': True, 'bear_strategy': 'breakout', 'bear_bb_std_mult': 1.5600665327700787, 'bear_rsi_os': 53, 'bear_rsi_ob': 90, 'bear_adx_thresh': 18.83859481015525, 'bear_atr_min_pct': 0.002979825206931944, 'bear_atr_max_pct': 0.04967662688939878, 'bear_tp_mult': 2.2954425623589034, 'bear_tsl_mult': 0.46599447913267344, 'bear_time_stop': 137, 'bear_use_sma': False, 'bear_use_ema': True, 'bear_use_atr': True, 'bear_use_adx': False, 'bear_use_spike': False, 'bear_rsi_required': True, 'sideways_strategy': 'mean_reversion', 'sideways_bb_std_mult': 0.506878215935108, 'sideways_rsi_os': 42, 'sideways_rsi_ob': 68, 'sideways_adx_thresh': 13.216106812586991, 'sideways_atr_min_pct': 0.009704689006528103, 'sideways_atr_max_pct': 0.014665646471302004, 'sideways_tp_mult': 1.1004954674267908, 'sideways_tsl_mult': 0.7365049506842893, 'sideways_time_stop': 161, 'sideways_use_sma': True, 'sideways_use_ema': False, 'sideways_use_atr': False, 'sideways_use_adx': False, 'sideways_use_spike': False, 'sideways_rsi_required': True}.
[I 2025-08-31 10:08:54,681] Trial 137 finished with values: [-1000000000.0, 1000000000.0] and parameters: {'p_sma': 22, 'p_std': 45, 'p_atr': 13, 'p_adx': 27, 'rsi_period': 9, 'ema1': 6, 'ema2': 33, 'slip_atr_k': 0.18655451231031714, 'slip_spread_k': 0.8188584299869486, 'spread_hl_frac': 0.008219781454800443, 'bb_std_mult': 1.4780189114131437, 'rsi_os': 29, 'rsi_ob': 58, 'vol_spike': 0.17433576758871827, 'adx_thresh': 5.10876460339958, 'atr_min_pct': 0.003305056865302021, 'atr_max_pct': 0.08193908948037236, 'tp_mult': 2.9176513190520854, 'tsl_mult': 0.28020079863361314, 'strategy': 'breakout', 'time_stop': 137, 'use_sma': False, 'use_atr': False, 'use_adx': True, 'use_ema': False, 'use_spike': False, 'rsi_required': False, 'edge_k': 0.3603360529847973, 'edge_cap': 0.380390799270166, 'bull_strategy': 'breakout', 'bull_bb_std_mult': 1.1576420647163792, 'bull_rsi_os': 8, 'bull_rsi_ob': 74, 'bull_adx_thresh': 13.30865360298339, 'bull_atr_min_pct': 0.004507345691749861, 'bull_atr_max_pct': 0.05258624725518265, 'bull_tp_mult': 1.8109504891850523, 'bull_tsl_mult': 0.15160039976847062, 'bull_time_stop': 28, 'bull_use_sma': True, 'bull_use_ema': False, 'bull_use_atr': True, 'bull_use_adx': True, 'bull_use_spike': True, 'bull_rsi_required': True, 'bear_strategy': 'breakout', 'bear_bb_std_mult': 1.5406689241071307, 'bear_rsi_os': 54, 'bear_rsi_ob': 89, 'bear_adx_thresh': 18.886340678994703, 'bear_atr_min_pct': 0.0034438452623956756, 'bear_atr_max_pct': 0.04949303159714372, 'bear_tp_mult': 2.284809183107052, 'bear_tsl_mult': 0.4939550287763009, 'bear_time_stop': 137, 'bear_use_sma': False, 'bear_use_ema': True, 'bear_use_atr': True, 'bear_use_adx': False, 'bear_use_spike': True, 'bear_rsi_required': True, 'sideways_strategy': 'mean_reversion', 'sideways_bb_std_mult': 2.3241838920792173, 'sideways_rsi_os': 16, 'sideways_rsi_ob': 53, 'sideways_adx_thresh': 33.46074141369097, 'sideways_atr_min_pct': 0.0068196962516410935, 'sideways_atr_max_pct': 0.024290665205974588, 'sideways_tp_mult': 1.1004121993663363, 'sideways_tsl_mult': 0.9783282457250897, 'sideways_time_stop': 286, 'sideways_use_sma': True, 'sideways_use_ema': False, 'sideways_use_atr': False, 'sideways_use_adx': False, 'sideways_use_spike': False, 'sideways_rsi_required': True}.
[I 2025-08-31 10:08:54,916] Trial 136 finished with values: [-1000000000.0, 1000000000.0] and parameters: {'p_sma': 21, 'p_std': 33, 'p_atr': 13, 'p_adx': 27, 'rsi_period': 23, 'ema1': 10, 'ema2': 13, 'slip_atr_k': 0.18897705039420376, 'slip_spread_k': 0.8191454866802249, 'spread_hl_frac': 0.01051141431744689, 'bb_std_mult': 1.2800474836035496, 'rsi_os': 31, 'rsi_ob': 58, 'vol_spike': 0.1491868416079302, 'adx_thresh': 8.826159435683167, 'atr_min_pct': 0.003211510983673666, 'atr_max_pct': 0.05982731233599773, 'tp_mult': 2.6181185627647254, 'tsl_mult': 0.8937094057766276, 'strategy': 'breakout', 'time_stop': 141, 'use_sma': True, 'use_atr': False, 'use_adx': True, 'use_ema': False, 'use_spike': False, 'rsi_required': False, 'edge_k': 0.8272830778846529, 'edge_cap': 0.950764483108015, 'bull_strategy': 'breakout', 'bull_bb_std_mult': 1.1401523377377152, 'bull_rsi_os': 8, 'bull_rsi_ob': 72, 'bull_adx_thresh': 12.970737654103027, 'bull_atr_min_pct': 0.004557262020437911, 'bull_atr_max_pct': 0.04855101261257644, 'bull_tp_mult': 1.174907944746399, 'bull_tsl_mult': 0.039575605351773124, 'bull_time_stop': 54, 'bull_use_sma': True, 'bull_use_ema': False, 'bull_use_atr': True, 'bull_use_adx': True, 'bull_use_spike': True, 'bull_rsi_required': True, 'bear_strategy': 'breakout', 'bear_bb_std_mult': 1.5583991160571227, 'bear_rsi_os': 54, 'bear_rsi_ob': 90, 'bear_adx_thresh': 18.597086674579018, 'bear_atr_min_pct': 0.004245578183743562, 'bear_atr_max_pct': 0.06529133858665553, 'bear_tp_mult': 1.6577498102760018, 'bear_tsl_mult': 0.49619321873348066, 'bear_time_stop': 131, 'bear_use_sma': False, 'bear_use_ema': True, 'bear_use_atr': True, 'bear_use_adx': False, 'bear_use_spike': True, 'bear_rsi_required': True, 'sideways_strategy': 'mean_reversion', 'sideways_bb_std_mult': 2.0824543706011944, 'sideways_rsi_os': 55, 'sideways_rsi_ob': 74, 'sideways_adx_thresh': 25.389519644135426, 'sideways_atr_min_pct': 0.00948636013691731, 'sideways_atr_max_pct': 0.015134812337735564, 'sideways_tp_mult': 1.102606798821499, 'sideways_tsl_mult': 0.7378792108113841, 'sideways_time_stop': 162, 'sideways_use_sma': True, 'sideways_use_ema': True, 'sideways_use_atr': False, 'sideways_use_adx': False, 'sideways_use_spike': False, 'sideways_rsi_required': True}.
[I 2025-08-31 10:08:55,012] Trial 138 finished with values: [-1000000000.0, 1000000000.0] and parameters: {'p_sma': 22, 'p_std': 34, 'p_atr': 13, 'p_adx': 27, 'rsi_period': 24, 'ema1': 6, 'ema2': 13, 'slip_atr_k': 0.18697313495243764, 'slip_spread_k': 0.9246734096595097, 'spread_hl_frac': 0.0025983181243547956, 'bb_std_mult': 0.8709446435395802, 'rsi_os': 29, 'rsi_ob': 86, 'vol_spike': 0.17739398377357105, 'adx_thresh': 8.692729162633723, 'atr_min_pct': 0.024449106094930423, 'atr_max_pct': 0.08211698099583742, 'tp_mult': 2.591965252458141, 'tsl_mult': 0.2846499013715682, 'strategy': 'breakout', 'time_stop': 136, 'use_sma': False, 'use_atr': False, 'use_adx': True, 'use_ema': False, 'use_spike': False, 'rsi_required': True, 'edge_k': 1.9841184454930554, 'edge_cap': 0.9474069826628627, 'bull_strategy': 'mean_reversion', 'bull_bb_std_mult': 1.3928590421602984, 'bull_rsi_os': 8, 'bull_rsi_ob': 76, 'bull_adx_thresh': 12.910237609458433, 'bull_atr_min_pct': 0.004607051036840245, 'bull_atr_max_pct': 0.016238467773286278, 'bull_tp_mult': 1.1761131672236045, 'bull_tsl_mult': 0.03696127525686363, 'bull_time_stop': 29, 'bull_use_sma': True, 'bull_use_ema': False, 'bull_use_atr': True, 'bull_use_adx': True, 'bull_use_spike': True, 'bull_rsi_required': True, 'bear_strategy': 'breakout', 'bear_bb_std_mult': 1.5018215399681427, 'bear_rsi_os': 55, 'bear_rsi_ob': 89, 'bear_adx_thresh': 18.671888207672747, 'bear_atr_min_pct': 0.016116310560169326, 'bear_atr_max_pct': 0.05006761412408339, 'bear_tp_mult': 2.461806725789663, 'bear_tsl_mult': 0.39805199176913, 'bear_time_stop': 137, 'bear_use_sma': False, 'bear_use_ema': True, 'bear_use_atr': True, 'bear_use_adx': False, 'bear_use_spike': True, 'bear_rsi_required': True, 'sideways_strategy': 'breakout', 'sideways_bb_std_mult': 1.318315402066169, 'sideways_rsi_os': 38, 'sideways_rsi_ob': 53, 'sideways_adx_thresh': 13.63083694144386, 'sideways_atr_min_pct': 0.011859468798956435, 'sideways_atr_max_pct': 0.02438194641331951, 'sideways_tp_mult': 1.2671373554874674, 'sideways_tsl_mult': 0.8756077715297403, 'sideways_time_stop': 141, 'sideways_use_sma': True, 'sideways_use_ema': True, 'sideways_use_atr': False, 'sideways_use_adx': False, 'sideways_use_spike': False, 'sideways_rsi_required': True}.
[I 2025-08-31 10:09:27,225] Trial 140 finished with values: [-0.008035456895711057, 0.008905298279246777] and parameters: {'p_sma': 22, 'p_std': 33, 'p_atr': 16, 'p_adx': 12, 'rsi_period': 23, 'ema1': 9, 'ema2': 13, 'slip_atr_k': 0.1892171865572645, 'slip_spread_k': 0.9291694315344472, 'spread_hl_frac': 0.0033321075364367947, 'bb_std_mult': 0.8408659310821927, 'rsi_os': 41, 'rsi_ob': 73, 'vol_spike': 0.187355910192376, 'adx_thresh': 8.974783327964042, 'atr_min_pct': 0.008624692456267354, 'atr_max_pct': 0.053995111917479834, 'tp_mult': 2.6435694228368676, 'tsl_mult': 0.6983859276498828, 'strategy': 'breakout', 'time_stop': 121, 'use_sma': True, 'use_atr': False, 'use_adx': True, 'use_ema': False, 'use_spike': False, 'rsi_required': True, 'edge_k': 1.747924047571684, 'edge_cap': 0.4320206880456334, 'bull_strategy': 'mean_reversion', 'bull_bb_std_mult': 1.0087964798402649, 'bull_rsi_os': 9, 'bull_rsi_ob': 76, 'bull_adx_thresh': 12.764964225255149, 'bull_atr_min_pct': 0.0033302936208273537, 'bull_atr_max_pct': 0.0859313551890647, 'bull_tp_mult': 1.9418813711015115, 'bull_tsl_mult': 0.05240688861154185, 'bull_time_stop': 6, 'bull_use_sma': True, 'bull_use_ema': False, 'bull_use_atr': True, 'bull_use_adx': True, 'bull_use_spike': True, 'bull_rsi_required': True, 'bear_strategy': 'breakout', 'bear_bb_std_mult': 1.9116241713265072, 'bear_rsi_os': 30, 'bear_rsi_ob': 90, 'bear_adx_thresh': 18.23313235269936, 'bear_atr_min_pct': 0.00449112042005152, 'bear_atr_max_pct': 0.06527263583542987, 'bear_tp_mult': 2.4589415765664526, 'bear_tsl_mult': 0.3958757281373951, 'bear_time_stop': 258, 'bear_use_sma': False, 'bear_use_ema': False, 'bear_use_atr': True, 'bear_use_adx': False, 'bear_use_spike': True, 'bear_rsi_required': True, 'sideways_strategy': 'breakout', 'sideways_bb_std_mult': 1.3172374475430608, 'sideways_rsi_os': 55, 'sideways_rsi_ob': 74, 'sideways_adx_thresh': 13.466490288485076, 'sideways_atr_min_pct': 0.011711208041730965, 'sideways_atr_max_pct': 0.01684286297819485, 'sideways_tp_mult': 1.250207518364946, 'sideways_tsl_mult': 0.8150298476772153, 'sideways_time_stop': 230, 'sideways_use_sma': True, 'sideways_use_ema': True, 'sideways_use_atr': False, 'sideways_use_adx': False, 'sideways_use_spike': False, 'sideways_rsi_required': True}.
[I 2025-08-31 10:09:27,237] Trial 141 finished with values: [-0.010489670778909721, 0.010228162274010608] and parameters: {'p_sma': 18, 'p_std': 34, 'p_atr': 16, 'p_adx': 19, 'rsi_period': 26, 'ema1': 24, 'ema2': 11, 'slip_atr_k': 0.19826334893318576, 'slip_spread_k': 0.9345427160676787, 'spread_hl_frac': 0.002885690213175276, 'bb_std_mult': 0.8522460649290702, 'rsi_os': 41, 'rsi_ob': 84, 'vol_spike': 0.21111445783540683, 'adx_thresh': 8.966578877012193, 'atr_min_pct': 0.008692532213833428, 'atr_max_pct': 0.069326875896349, 'tp_mult': 2.651154342402618, 'tsl_mult': 0.17520485538470665, 'strategy': 'breakout', 'time_stop': 123, 'use_sma': False, 'use_atr': False, 'use_adx': True, 'use_ema': False, 'use_spike': False, 'rsi_required': True, 'edge_k': 1.7572471712759172, 'edge_cap': 0.9539333701098757, 'bull_strategy': 'mean_reversion', 'bull_bb_std_mult': 1.002094169171243, 'bull_rsi_os': 9, 'bull_rsi_ob': 76, 'bull_adx_thresh': 13.828165541025378, 'bull_atr_min_pct': 0.003056281863352924, 'bull_atr_max_pct': 0.1289687804619431, 'bull_tp_mult': 1.1169117334552858, 'bull_tsl_mult': 0.21702024779986834, 'bull_time_stop': 6, 'bull_use_sma': True, 'bull_use_ema': False, 'bull_use_atr': True, 'bull_use_adx': True, 'bull_use_spike': True, 'bull_rsi_required': True, 'bear_strategy': 'breakout', 'bear_bb_std_mult': 1.9485660164792538, 'bear_rsi_os': 52, 'bear_rsi_ob': 80, 'bear_adx_thresh': 15.475830786491883, 'bear_atr_min_pct': 0.010258917120832914, 'bear_atr_max_pct': 0.05173880953458852, 'bear_tp_mult': 2.464790975024647, 'bear_tsl_mult': 0.3939053013373665, 'bear_time_stop': 287, 'bear_use_sma': False, 'bear_use_ema': False, 'bear_use_atr': True, 'bear_use_adx': False, 'bear_use_spike': False, 'bear_rsi_required': True, 'sideways_strategy': 'breakout', 'sideways_bb_std_mult': 1.6058481635891633, 'sideways_rsi_os': 18, 'sideways_rsi_ob': 57, 'sideways_adx_thresh': 13.466131142676758, 'sideways_atr_min_pct': 0.011907630794468164, 'sideways_atr_max_pct': 0.017853075768165715, 'sideways_tp_mult': 1.1757063057109507, 'sideways_tsl_mult': 0.862434483087337, 'sideways_time_stop': 142, 'sideways_use_sma': False, 'sideways_use_ema': True, 'sideways_use_atr': False, 'sideways_use_adx': False, 'sideways_use_spike': False, 'sideways_rsi_required': True}.
[I 2025-08-31 10:09:27,515] Trial 139 finished with values: [-1000000000.0, 1000000000.0] and parameters: {'p_sma': 22, 'p_std': 34, 'p_atr': 13, 'p_adx': 27, 'rsi_period': 31, 'ema1': 6, 'ema2': 33, 'slip_atr_k': 0.1876106973137222, 'slip_spread_k': 0.818790974654226, 'spread_hl_frac': 0.002881546128602831, 'bb_std_mult': 0.8431315737248664, 'rsi_os': 31, 'rsi_ob': 65, 'vol_spike': 0.21293569069439325, 'adx_thresh': 8.798134888922807, 'atr_min_pct': 0.008698276574281922, 'atr_max_pct': 0.0811430734343925, 'tp_mult': 2.626232794417763, 'tsl_mult': 0.5166081749582844, 'strategy': 'breakout', 'time_stop': 137, 'use_sma': False, 'use_atr': False, 'use_adx': True, 'use_ema': False, 'use_spike': False, 'rsi_required': True, 'edge_k': 1.7109618216813387, 'edge_cap': 0.95508016669493, 'bull_strategy': 'mean_reversion', 'bull_bb_std_mult': 1.1549886685391277, 'bull_rsi_os': 8, 'bull_rsi_ob': 74, 'bull_adx_thresh': 12.936299403502378, 'bull_atr_min_pct': 0.004518561923604433, 'bull_atr_max_pct': 0.086887358009049, 'bull_tp_mult': 1.1157444463268784, 'bull_tsl_mult': 0.05795750782437411, 'bull_time_stop': 109, 'bull_use_sma': True, 'bull_use_ema': False, 'bull_use_atr': True, 'bull_use_adx': True, 'bull_use_spike': True, 'bull_rsi_required': True, 'bear_strategy': 'breakout', 'bear_bb_std_mult': 1.942875087317817, 'bear_rsi_os': 55, 'bear_rsi_ob': 89, 'bear_adx_thresh': 15.656691706070045, 'bear_atr_min_pct': 0.016305655162607992, 'bear_atr_max_pct': 0.06543216375303164, 'bear_tp_mult': 2.454193408202757, 'bear_tsl_mult': 0.5001881917023341, 'bear_time_stop': 130, 'bear_use_sma': False, 'bear_use_ema': False, 'bear_use_atr': True, 'bear_use_adx': False, 'bear_use_spike': True, 'bear_rsi_required': True, 'sideways_strategy': 'breakout', 'sideways_bb_std_mult': 2.326904382225484, 'sideways_rsi_os': 18, 'sideways_rsi_ob': 53, 'sideways_adx_thresh': 13.605168531110785, 'sideways_atr_min_pct': 0.009570845024136142, 'sideways_atr_max_pct': 0.02463043742436516, 'sideways_tp_mult': 1.257883966867895, 'sideways_tsl_mult': 0.872665513763794, 'sideways_time_stop': 141, 'sideways_use_sma': True, 'sideways_use_ema': True, 'sideways_use_atr': False, 'sideways_use_adx': False, 'sideways_use_spike': False, 'sideways_rsi_required': True}.
[I 2025-08-31 10:09:27,593] Trial 142 finished with values: [-1000000000.0, 1000000000.0] and parameters: {'p_sma': 18, 'p_std': 27, 'p_atr': 16, 'p_adx': 19, 'rsi_period': 30, 'ema1': 13, 'ema2': 60, 'slip_atr_k': 0.19891488741852323, 'slip_spread_k': 0.2375167306107973, 'spread_hl_frac': 0.0030167943189388187, 'bb_std_mult': 0.7373009444243006, 'rsi_os': 36, 'rsi_ob': 59, 'vol_spike': 0.21114527629047716, 'adx_thresh': 11.079508416786618, 'atr_min_pct': 0.008578939498939753, 'atr_max_pct': 0.05288061932861236, 'tp_mult': 2.659676311028625, 'tsl_mult': 0.7024717384039261, 'strategy': 'breakout', 'time_stop': 119, 'use_sma': True, 'use_atr': False, 'use_adx': True, 'use_ema': False, 'use_spike': False, 'rsi_required': True, 'edge_k': 1.743859318081616, 'edge_cap': 0.982115330510177, 'bull_strategy': 'mean_reversion', 'bull_bb_std_mult': 0.980601129165402, 'bull_rsi_os': 10, 'bull_rsi_ob': 74, 'bull_adx_thresh': 13.994578586526172, 'bull_atr_min_pct': 0.005281343014001341, 'bull_atr_max_pct': 0.08653755889645272, 'bull_tp_mult': 1.4796212520188958, 'bull_tsl_mult': 0.21333295430656235, 'bull_time_stop': 184, 'bull_use_sma': True, 'bull_use_ema': False, 'bull_use_atr': True, 'bull_use_adx': True, 'bull_use_spike': True, 'bull_rsi_required': True, 'bear_strategy': 'breakout', 'bear_bb_std_mult': 1.9330539702043972, 'bear_rsi_os': 30, 'bear_rsi_ob': 87, 'bear_adx_thresh': 15.677138023387588, 'bear_atr_min_pct': 0.010291353073144688, 'bear_atr_max_pct': 0.056830341479379376, 'bear_tp_mult': 2.563269586386427, 'bear_tsl_mult': 0.12079171980871894, 'bear_time_stop': 261, 'bear_use_sma': False, 'bear_use_ema': False, 'bear_use_atr': True, 'bear_use_adx': False, 'bear_use_spike': False, 'bear_rsi_required': True, 'sideways_strategy': 'breakout', 'sideways_bb_std_mult': 3.1475696189997113, 'sideways_rsi_os': 10, 'sideways_rsi_ob': 48, 'sideways_adx_thresh': 15.157700379355443, 'sideways_atr_min_pct': 0.02745340328949515, 'sideways_atr_max_pct': 0.017326550238202815, 'sideways_tp_mult': 1.1485904424290765, 'sideways_tsl_mult': 0.8151334251086618, 'sideways_time_stop': 186, 'sideways_use_sma': False, 'sideways_use_ema': True, 'sideways_use_atr': False, 'sideways_use_adx': False, 'sideways_use_spike': False, 'sideways_rsi_required': True}.
[I 2025-08-31 10:09:59,993] Trial 144 finished with values: [-0.004944279987883937, 0.005351199734430757] and parameters: {'p_sma': 20, 'p_std': 36, 'p_atr': 16, 'p_adx': 11, 'rsi_period': 21, 'ema1': 12, 'ema2': 11, 'slip_atr_k': 0.19835437499833164, 'slip_spread_k': 0.2430172595528216, 'spread_hl_frac': 0.0032752586438108537, 'bb_std_mult': 0.7450826909545551, 'rsi_os': 41, 'rsi_ob': 73, 'vol_spike': 0.2103644538351296, 'adx_thresh': 8.023368924645721, 'atr_min_pct': 0.008666805049879189, 'atr_max_pct': 0.052909901225987786, 'tp_mult': 2.6639354837771867, 'tsl_mult': 0.6966935119057088, 'strategy': 'breakout', 'time_stop': 122, 'use_sma': True, 'use_atr': False, 'use_adx': True, 'use_ema': False, 'use_spike': False, 'rsi_required': True, 'edge_k': 1.740723772327399, 'edge_cap': 0.41813587682230824, 'bull_strategy': 'mean_reversion', 'bull_bb_std_mult': 0.9803307711508352, 'bull_rsi_os': 9, 'bull_rsi_ob': 74, 'bull_adx_thresh': 12.062612251257228, 'bull_atr_min_pct': 0.0033879273554092704, 'bull_atr_max_pct': 0.07151601085028762, 'bull_tp_mult': 1.133080936206693, 'bull_tsl_mult': 0.059435750769065196, 'bull_time_stop': 12, 'bull_use_sma': True, 'bull_use_ema': False, 'bull_use_atr': True, 'bull_use_adx': True, 'bull_use_spike': True, 'bull_rsi_required': True, 'bear_strategy': 'breakout', 'bear_bb_std_mult': 1.9506662874749376, 'bear_rsi_os': 30, 'bear_rsi_ob': 56, 'bear_adx_thresh': 17.13625019257621, 'bear_atr_min_pct': 0.010057938994790731, 'bear_atr_max_pct': 0.12695945300967895, 'bear_tp_mult': 2.5738362621366564, 'bear_tsl_mult': 0.3718011639663926, 'bear_time_stop': 19, 'bear_use_sma': False, 'bear_use_ema': False, 'bear_use_atr': True, 'bear_use_adx': False, 'bear_use_spike': True, 'bear_rsi_required': True, 'sideways_strategy': 'breakout', 'sideways_bb_std_mult': 1.265926730775723, 'sideways_rsi_os': 10, 'sideways_rsi_ob': 68, 'sideways_adx_thresh': 15.138615141115865, 'sideways_atr_min_pct': 0.027220477099017877, 'sideways_atr_max_pct': 0.01730215879642262, 'sideways_tp_mult': 1.1788046541018613, 'sideways_tsl_mult': 0.8109717813469477, 'sideways_time_stop': 5, 'sideways_use_sma': True, 'sideways_use_ema': True, 'sideways_use_atr': False, 'sideways_use_adx': False, 'sideways_use_spike': False, 'sideways_rsi_required': True}.
