[I 2025-08-31 10:10:00,260] Trial 146 finished with values: [-0.010065387209770793, 0.009781812549591026] and parameters: {'p_sma': 26, 'p_std': 31, 'p_atr': 16, 'p_adx': 12, 'rsi_period': 26, 'ema1': 5, 'ema2': 11, 'slip_atr_k': 0.1967225602292042, 'slip_spread_k': 0.5055685351929584, 'spread_hl_frac': 0.001239085765681298, 'bb_std_mult': 0.6010374521860714, 'rsi_os': 41, 'rsi_ob': 73, 'vol_spike': 0.20576886140129524, 'adx_thresh': 9.4063874547102, 'atr_min_pct': 0.007302147482389545, 'atr_max_pct': 0.0695702907179788, 'tp_mult': 2.757049729455811, 'tsl_mult': 0.6743359295589689, 'strategy': 'breakout', 'time_stop': 103, 'use_sma': True, 'use_atr': False, 'use_adx': True, 'use_ema': False, 'use_spike': False, 'rsi_required': True, 'edge_k': 1.7768085651214272, 'edge_cap': 0.40539214714717065, 'bull_strategy': 'mean_reversion', 'bull_bb_std_mult': 2.4528994091617413, 'bull_rsi_os': 7, 'bull_rsi_ob': 76, 'bull_adx_thresh': 14.037838514719141, 'bull_atr_min_pct': 0.003257860771814767, 'bull_atr_max_pct': 0.07300581263093149, 'bull_tp_mult': 1.9502660761718735, 'bull_tsl_mult': 0.13594317200121092, 'bull_time_stop': 13, 'bull_use_sma': True, 'bull_use_ema': False, 'bull_use_atr': True, 'bull_use_adx': True, 'bull_use_spike': True, 'bull_rsi_required': True, 'bear_strategy': 'breakout', 'bear_bb_std_mult': 1.8214445912219097, 'bear_rsi_os': 26, 'bear_rsi_ob': 56, 'bear_adx_thresh': 17.009535858103366, 'bear_atr_min_pct': 0.009807339696087419, 'bear_atr_max_pct': 0.06008268461523342, 'bear_tp_mult': 2.572095464461355, 'bear_tsl_mult': 0.40249589273353925, 'bear_time_stop': 200, 'bear_use_sma': False, 'bear_use_ema': False, 'bear_use_atr': True, 'bear_use_adx': False, 'bear_use_spike': True, 'bear_rsi_required': True, 'sideways_strategy': 'breakout', 'sideways_bb_std_mult': 2.4675322714686168, 'sideways_rsi_os': 53, 'sideways_rsi_ob': 67, 'sideways_adx_thresh': 12.45239282717204, 'sideways_atr_min_pct': 0.01105135122033554, 'sideways_atr_max_pct': 0.08652062401456483, 'sideways_tp_mult': 1.217624539951999, 'sideways_tsl_mult': 0.7925052033641236, 'sideways_time_stop': 240, 'sideways_use_sma': True, 'sideways_use_ema': True, 'sideways_use_atr': False, 'sideways_use_adx': False, 'sideways_use_spike': False, 'sideways_rsi_required': True}.
[I 2025-08-31 10:10:00,466] Trial 145 finished with values: [-0.008850464487889287, 0.008596395035867652] and parameters: {'p_sma': 18, 'p_std': 27, 'p_atr': 16, 'p_adx': 25, 'rsi_period': 21, 'ema1': 9, 'ema2': 11, 'slip_atr_k': 0.19901170637527626, 'slip_spread_k': 0.8070622177198766, 'spread_hl_frac': 0.003497660413559202, 'bb_std_mult': 0.5878490029507125, 'rsi_os': 41, 'rsi_ob': 74, 'vol_spike': 0.20815816454542116, 'adx_thresh': 10.921905048969457, 'atr_min_pct': 0.007657114215821538, 'atr_max_pct': 0.0691773444566407, 'tp_mult': 2.6576445434912626, 'tsl_mult': 0.6970564247832777, 'strategy': 'breakout', 'time_stop': 120, 'use_sma': True, 'use_atr': False, 'use_adx': True, 'use_ema': False, 'use_spike': False, 'rsi_required': True, 'edge_k': 1.752142341029075, 'edge_cap': 0.42693866645620554, 'bull_strategy': 'mean_reversion', 'bull_bb_std_mult': 1.0080517925280659, 'bull_rsi_os': 7, 'bull_rsi_ob': 76, 'bull_adx_thresh': 13.923685235663578, 'bull_atr_min_pct': 0.00324525309492325, 'bull_atr_max_pct': 0.02283442011361833, 'bull_tp_mult': 1.121194462145329, 'bull_tsl_mult': 0.08620937313530769, 'bull_time_stop': 7, 'bull_use_sma': True, 'bull_use_ema': False, 'bull_use_atr': True, 'bull_use_adx': True, 'bull_use_spike': True, 'bull_rsi_required': True, 'bear_strategy': 'breakout', 'bear_bb_std_mult': 1.7964634614383481, 'bear_rsi_os': 31, 'bear_rsi_ob': 93, 'bear_adx_thresh': 16.982215624026566, 'bear_atr_min_pct': 0.009495234709088285, 'bear_atr_max_pct': 0.12740020219654166, 'bear_tp_mult': 2.5632468298969355, 'bear_tsl_mult': 0.3718044355220309, 'bear_time_stop': 261, 'bear_use_sma': False, 'bear_use_ema': False, 'bear_use_atr': True, 'bear_use_adx': False, 'bear_use_spike': True, 'bear_rsi_required': True, 'sideways_strategy': 'breakout', 'sideways_bb_std_mult': 0.5054269851836788, 'sideways_rsi_os': 54, 'sideways_rsi_ob': 48, 'sideways_adx_thresh': 14.932919749209788, 'sideways_atr_min_pct': 0.012501401971541693, 'sideways_atr_max_pct': 0.018491230354092374, 'sideways_tp_mult': 1.1817009655147241, 'sideways_tsl_mult': 0.8125812261537103, 'sideways_time_stop': 237, 'sideways_use_sma': True, 'sideways_use_ema': True, 'sideways_use_atr': False, 'sideways_use_adx': False, 'sideways_use_spike': False, 'sideways_rsi_required': True}.
[I 2025-08-31 10:10:00,594] Trial 143 finished with values: [-0.01391364471627543, 0.013654023437035393] and parameters: {'p_sma': 21, 'p_std': 27, 'p_atr': 16, 'p_adx': 12, 'rsi_period': 15, 'ema1': 9, 'ema2': 11, 'slip_atr_k': 0.19675238594792985, 'slip_spread_k': 0.759591817796084, 'spread_hl_frac': 0.002978757187866334, 'bb_std_mult': 0.5907114503498938, 'rsi_os': 40, 'rsi_ob': 72, 'vol_spike': 0.1875223175957015, 'adx_thresh': 11.361279209830439, 'atr_min_pct': 0.008581848898900558, 'atr_max_pct': 0.05280243071355204, 'tp_mult': 2.6497587385136434, 'tsl_mult': 0.6947211899685487, 'strategy': 'breakout', 'time_stop': 103, 'use_sma': True, 'use_atr': False, 'use_adx': True, 'use_ema': False, 'use_spike': False, 'rsi_required': True, 'edge_k': 1.765636124299667, 'edge_cap': 0.41801741382988283, 'bull_strategy': 'mean_reversion', 'bull_bb_std_mult': 1.1129983064024969, 'bull_rsi_os': 10, 'bull_rsi_ob': 74, 'bull_adx_thresh': 14.028440822870822, 'bull_atr_min_pct': 0.002951093707951866, 'bull_atr_max_pct': 0.08724481339091295, 'bull_tp_mult': 2.105816188199862, 'bull_tsl_mult': 0.12776729767083847, 'bull_time_stop': 6, 'bull_use_sma': True, 'bull_use_ema': False, 'bull_use_atr': True, 'bull_use_adx': True, 'bull_use_spike': True, 'bull_rsi_required': True, 'bear_strategy': 'breakout', 'bear_bb_std_mult': 1.9617426571645211, 'bear_rsi_os': 51, 'bear_rsi_ob': 80, 'bear_adx_thresh': 17.141825942690925, 'bear_atr_min_pct': 0.010174608593363608, 'bear_atr_max_pct': 0.055677298572171616, 'bear_tp_mult': 2.571687099776007, 'bear_tsl_mult': 0.40300886963651145, 'bear_time_stop': 254, 'bear_use_sma': False, 'bear_use_ema': False, 'bear_use_atr': True, 'bear_use_adx': False, 'bear_use_spike': True, 'bear_rsi_required': True, 'sideways_strategy': 'breakout', 'sideways_bb_std_mult': 1.109140755328662, 'sideways_rsi_os': 54, 'sideways_rsi_ob': 48, 'sideways_adx_thresh': 14.927980437738468, 'sideways_atr_min_pct': 0.011004277850887699, 'sideways_atr_max_pct': 0.01676206164992936, 'sideways_tp_mult': 1.1414004908105442, 'sideways_tsl_mult': 0.8104710582939441, 'sideways_time_stop': 186, 'sideways_use_sma': True, 'sideways_use_ema': True, 'sideways_use_atr': False, 'sideways_use_adx': False, 'sideways_use_spike': False, 'sideways_rsi_required': True}.
[I 2025-08-31 10:10:30,728] Trial 150 finished with values: [-0.006702551241819843, 0.006467490160573976] and parameters: {'p_sma': 20, 'p_std': 36, 'p_atr': 16, 'p_adx': 13, 'rsi_period': 21, 'ema1': 10, 'ema2': 14, 'slip_atr_k': 0.19740536912855253, 'slip_spread_k': 0.1530098214044039, 'spread_hl_frac': 0.0041343178523522844, 'bb_std_mult': 0.5598716552651222, 'rsi_os': 41, 'rsi_ob': 73, 'vol_spike': 0.2204013247621577, 'adx_thresh': 7.984636488699493, 'atr_min_pct': 0.006661705581276863, 'atr_max_pct': 0.048873516241295226, 'tp_mult': 2.763187602807596, 'tsl_mult': 0.6941093615814192, 'strategy': 'mean_reversion', 'time_stop': 120, 'use_sma': True, 'use_atr': False, 'use_adx': True, 'use_ema': False, 'use_spike': False, 'rsi_required': True, 'edge_k': 1.7803684416600167, 'edge_cap': 0.4198273966114436, 'bull_strategy': 'mean_reversion', 'bull_bb_std_mult': 2.4584646555868583, 'bull_rsi_os': 13, 'bull_rsi_ob': 71, 'bull_adx_thresh': 10.973341282918362, 'bull_atr_min_pct': 0.003328588186042166, 'bull_atr_max_pct': 0.07214542396774733, 'bull_tp_mult': 1.2489010551874675, 'bull_tsl_mult': 0.022649321153246735, 'bull_time_stop': 6, 'bull_use_sma': False, 'bull_use_ema': False, 'bull_use_atr': True, 'bull_use_adx': True, 'bull_use_spike': True, 'bull_rsi_required': True, 'bear_strategy': 'breakout', 'bear_bb_std_mult': 2.1532165790603877, 'bear_rsi_os': 31, 'bear_rsi_ob': 58, 'bear_adx_thresh': 16.966308447899618, 'bear_atr_min_pct': 0.010569611819856212, 'bear_atr_max_pct': 0.12371932777918364, 'bear_tp_mult': 2.589330517174504, 'bear_tsl_mult': 0.17823539296038476, 'bear_time_stop': 11, 'bear_use_sma': False, 'bear_use_ema': False, 'bear_use_atr': False, 'bear_use_adx': False, 'bear_use_spike': True, 'bear_rsi_required': True, 'sideways_strategy': 'breakout', 'sideways_bb_std_mult': 1.270074634600087, 'sideways_rsi_os': 7, 'sideways_rsi_ob': 67, 'sideways_adx_thresh': 17.80339270800099, 'sideways_atr_min_pct': 0.028638219592239573, 'sideways_atr_max_pct': 0.010557316658281496, 'sideways_tp_mult': 1.3833139432996289, 'sideways_tsl_mult': 0.8019713758402169, 'sideways_time_stop': 25, 'sideways_use_sma': True, 'sideways_use_ema': False, 'sideways_use_atr': False, 'sideways_use_adx': False, 'sideways_use_spike': False, 'sideways_rsi_required': True}.
[I 2025-08-31 10:10:30,987] Trial 147 finished with values: [-1000000000.0, 1000000000.0] and parameters: {'p_sma': 26, 'p_std': 36, 'p_atr': 16, 'p_adx': 12, 'rsi_period': 21, 'ema1': 12, 'ema2': 15, 'slip_atr_k': 0.08252557864168511, 'slip_spread_k': 0.1379331291679735, 'spread_hl_frac': 0.0038443931560660917, 'bb_std_mult': 0.7231541785353791, 'rsi_os': 41, 'rsi_ob': 73, 'vol_spike': 0.21886693537191343, 'adx_thresh': 7.822596043401675, 'atr_min_pct': 0.0069988923758458055, 'atr_max_pct': 0.05030504878261084, 'tp_mult': 2.4714911368444907, 'tsl_mult': 0.6674532754607961, 'strategy': 'mean_reversion', 'time_stop': 131, 'use_sma': True, 'use_atr': False, 'use_adx': True, 'use_ema': False, 'use_spike': False, 'rsi_required': True, 'edge_k': 1.7866761918385556, 'edge_cap': 0.43030690772705593, 'bull_strategy': 'mean_reversion', 'bull_bb_std_mult': 0.9252151115753999, 'bull_rsi_os': 13, 'bull_rsi_ob': 69, 'bull_adx_thresh': 10.805685212940002, 'bull_atr_min_pct': 0.024497136769144875, 'bull_atr_max_pct': 0.0718509027589462, 'bull_tp_mult': 1.2697170999860876, 'bull_tsl_mult': 0.024778061607862757, 'bull_time_stop': 5, 'bull_use_sma': True, 'bull_use_ema': False, 'bull_use_atr': True, 'bull_use_adx': True, 'bull_use_spike': True, 'bull_rsi_required': True, 'bear_strategy': 'breakout', 'bear_bb_std_mult': 2.1134546031159744, 'bear_rsi_os': 31, 'bear_rsi_ob': 56, 'bear_adx_thresh': 17.166986718123155, 'bear_atr_min_pct': 0.009980071301419388, 'bear_atr_max_pct': 0.1307586718777718, 'bear_tp_mult': 2.638733152727092, 'bear_tsl_mult': 0.2748070218603218, 'bear_time_stop': 9, 'bear_use_sma': False, 'bear_use_ema': False, 'bear_use_atr': True, 'bear_use_adx': False, 'bear_use_spike': True, 'bear_rsi_required': True, 'sideways_strategy': 'breakout', 'sideways_bb_std_mult': 1.2358482137684217, 'sideways_rsi_os': 7, 'sideways_rsi_ob': 67, 'sideways_adx_thresh': 18.259071068358924, 'sideways_atr_min_pct': 0.024123922755579848, 'sideways_atr_max_pct': 0.012396849097570054, 'sideways_tp_mult': 1.3697397888884149, 'sideways_tsl_mult': 0.7784697036322045, 'sideways_time_stop': 5, 'sideways_use_sma': True, 'sideways_use_ema': False, 'sideways_use_atr': False, 'sideways_use_adx': False, 'sideways_use_spike': False, 'sideways_rsi_required': True}.
[I 2025-08-31 10:10:31,221] Trial 148 finished with values: [-1000000000.0, 1000000000.0] and parameters: {'p_sma': 16, 'p_std': 36, 'p_atr': 16, 'p_adx': 12, 'rsi_period': 21, 'ema1': 12, 'ema2': 31, 'slip_atr_k': 0.19886360227158784, 'slip_spread_k': 0.17141505704905574, 'spread_hl_frac': 0.003752833898725791, 'bb_std_mult': 0.5749837874240095, 'rsi_os': 41, 'rsi_ob': 75, 'vol_spike': 0.2068881189628108, 'adx_thresh': 7.625820592337741, 'atr_min_pct': 0.0075992138806765235, 'atr_max_pct': 0.04947573998285977, 'tp_mult': 2.4860928276570604, 'tsl_mult': 0.6813684577149169, 'strategy': 'mean_reversion', 'time_stop': 122, 'use_sma': True, 'use_atr': False, 'use_adx': True, 'use_ema': False, 'use_spike': False, 'rsi_required': True, 'edge_k': 1.7778886660558946, 'edge_cap': 0.4193241476881139, 'bull_strategy': 'mean_reversion', 'bull_bb_std_mult': 1.0434526079472208, 'bull_rsi_os': 13, 'bull_rsi_ob': 73, 'bull_adx_thresh': 10.968048184310646, 'bull_atr_min_pct': 0.0034006474936281975, 'bull_atr_max_pct': 0.07090426383722787, 'bull_tp_mult': 1.27564640485692, 'bull_tsl_mult': 0.06637507068633434, 'bull_time_stop': 5, 'bull_use_sma': False, 'bull_use_ema': False, 'bull_use_atr': True, 'bull_use_adx': True, 'bull_use_spike': True, 'bull_rsi_required': True, 'bear_strategy': 'breakout', 'bear_bb_std_mult': 2.133349614707321, 'bear_rsi_os': 28, 'bear_rsi_ob': 55, 'bear_adx_thresh': 16.899588177223237, 'bear_atr_min_pct': 0.009827585780975905, 'bear_atr_max_pct': 0.13403935822838237, 'bear_tp_mult': 2.6442013893678045, 'bear_tsl_mult': 0.26738726026270815, 'bear_time_stop': 6, 'bear_use_sma': False, 'bear_use_ema': False, 'bear_use_atr': True, 'bear_use_adx': False, 'bear_use_spike': True, 'bear_rsi_required': True, 'sideways_strategy': 'breakout', 'sideways_bb_std_mult': 1.2357090388146887, 'sideways_rsi_os': 7, 'sideways_rsi_ob': 67, 'sideways_adx_thresh': 18.081186919658524, 'sideways_atr_min_pct': 0.02996874212080932, 'sideways_atr_max_pct': 0.01398662940193076, 'sideways_tp_mult': 1.3577232074954537, 'sideways_tsl_mult': 0.7928550962607698, 'sideways_time_stop': 26, 'sideways_use_sma': True, 'sideways_use_ema': False, 'sideways_use_atr': False, 'sideways_use_adx': False, 'sideways_use_spike': False, 'sideways_rsi_required': True}.
[I 2025-08-31 10:10:31,467] Trial 149 finished with values: [-0.006938470442244382, 0.006705979343353893] and parameters: {'p_sma': 20, 'p_std': 39, 'p_atr': 16, 'p_adx': 10, 'rsi_period': 15, 'ema1': 12, 'ema2': 15, 'slip_atr_k': 0.19504113452019736, 'slip_spread_k': 0.15992958985330885, 'spread_hl_frac': 0.0037514711754178037, 'bb_std_mult': 0.5779178417758556, 'rsi_os': 41, 'rsi_ob': 74, 'vol_spike': 0.2277481870524163, 'adx_thresh': 8.009556163436383, 'atr_min_pct': 0.007560497461642751, 'atr_max_pct': 0.04821668862084154, 'tp_mult': 2.6681497944369332, 'tsl_mult': 0.6872666037395863, 'strategy': 'mean_reversion', 'time_stop': 121, 'use_sma': True, 'use_atr': False, 'use_adx': True, 'use_ema': False, 'use_spike': False, 'rsi_required': True, 'edge_k': 1.7573476321442227, 'edge_cap': 0.41844808036235454, 'bull_strategy': 'mean_reversion', 'bull_bb_std_mult': 0.9945847554729792, 'bull_rsi_os': 10, 'bull_rsi_ob': 70, 'bull_adx_thresh': 10.742804712754808, 'bull_atr_min_pct': 0.003296903392978988, 'bull_atr_max_pct': 0.07459661482172437, 'bull_tp_mult': 1.9522369520994425, 'bull_tsl_mult': 0.0779394208730156, 'bull_time_stop': 8, 'bull_use_sma': False, 'bull_use_ema': False, 'bull_use_atr': True, 'bull_use_adx': True, 'bull_use_spike': True, 'bull_rsi_required': True, 'bear_strategy': 'breakout', 'bear_bb_std_mult': 2.1377333935214953, 'bear_rsi_os': 28, 'bear_rsi_ob': 55, 'bear_adx_thresh': 17.051076505281724, 'bear_atr_min_pct': 0.009535192146392086, 'bear_atr_max_pct': 0.1262187820993519, 'bear_tp_mult': 2.5985567124315527, 'bear_tsl_mult': 0.17136828921905672, 'bear_time_stop': 7, 'bear_use_sma': False, 'bear_use_ema': False, 'bear_use_atr': True, 'bear_use_adx': False, 'bear_use_spike': True, 'bear_rsi_required': True, 'sideways_strategy': 'breakout', 'sideways_bb_std_mult': 1.2412081400522827, 'sideways_rsi_os': 7, 'sideways_rsi_ob': 67, 'sideways_adx_thresh': 16.06915693143666, 'sideways_atr_min_pct': 0.02911912976563297, 'sideways_atr_max_pct': 0.01195470599703695, 'sideways_tp_mult': 1.2029466157478785, 'sideways_tsl_mult': 0.7894174593179151, 'sideways_time_stop': 8, 'sideways_use_sma': True, 'sideways_use_ema': False, 'sideways_use_atr': False, 'sideways_use_adx': False, 'sideways_use_spike': True, 'sideways_rsi_required': True}.
[I 2025-08-31 10:11:03,203] Trial 151 finished with values: [-1000000000.0, 1000000000.0] and parameters: {'p_sma': 16, 'p_std': 39, 'p_atr': 18, 'p_adx': 13, 'rsi_period': 21, 'ema1': 12, 'ema2': 44, 'slip_atr_k': 0.09260508001207592, 'slip_spread_k': 0.1948335228366223, 'spread_hl_frac': 0.004027623601729461, 'bb_std_mult': 0.9741542906150429, 'rsi_os': 42, 'rsi_ob': 75, 'vol_spike': 0.22036129152763007, 'adx_thresh': 7.919202139697476, 'atr_min_pct': 0.0073561551476708145, 'atr_max_pct': 0.0486895926047091, 'tp_mult': 2.687137646835927, 'tsl_mult': 0.6603798209407902, 'strategy': 'mean_reversion', 'time_stop': 123, 'use_sma': True, 'use_atr': False, 'use_adx': True, 'use_ema': False, 'use_spike': False, 'rsi_required': True, 'edge_k': 1.7890909238514627, 'edge_cap': 0.45831214532646003, 'bull_strategy': 'mean_reversion', 'bull_bb_std_mult': 0.9252784786046336, 'bull_rsi_os': 13, 'bull_rsi_ob': 70, 'bull_adx_thresh': 11.206874808120116, 'bull_atr_min_pct': 0.02345011583916068, 'bull_atr_max_pct': 0.07271422507349391, 'bull_tp_mult': 1.2864878426082693, 'bull_tsl_mult': 0.08470134643606385, 'bull_time_stop': 10, 'bull_use_sma': False, 'bull_use_ema': False, 'bull_use_atr': True, 'bull_use_adx': True, 'bull_use_spike': True, 'bull_rsi_required': True, 'bear_strategy': 'breakout', 'bear_bb_std_mult': 2.091316808511411, 'bear_rsi_os': 31, 'bear_rsi_ob': 56, 'bear_adx_thresh': 17.986201468528552, 'bear_atr_min_pct': 0.010732022358776476, 'bear_atr_max_pct': 0.12590690394018442, 'bear_tp_mult': 2.659180874823078, 'bear_tsl_mult': 0.3592938927815341, 'bear_time_stop': 5, 'bear_use_sma': False, 'bear_use_ema': False, 'bear_use_atr': False, 'bear_use_adx': False, 'bear_use_spike': True, 'bear_rsi_required': True, 'sideways_strategy': 'breakout', 'sideways_bb_std_mult': 1.2684652562995242, 'sideways_rsi_os': 7, 'sideways_rsi_ob': 67, 'sideways_adx_thresh': 16.19759669500397, 'sideways_atr_min_pct': 0.025102790559597035, 'sideways_atr_max_pct': 0.011978832003542262, 'sideways_tp_mult': 1.336608220096588, 'sideways_tsl_mult': 0.7806261886393566, 'sideways_time_stop': 5, 'sideways_use_sma': True, 'sideways_use_ema': False, 'sideways_use_atr': True, 'sideways_use_adx': False, 'sideways_use_spike': True, 'sideways_rsi_required': True}.
[I 2025-08-31 10:11:04,068] Trial 152 finished with values: [-1000000000.0, 1000000000.0] and parameters: {'p_sma': 16, 'p_std': 39, 'p_atr': 18, 'p_adx': 10, 'rsi_period': 26, 'ema1': 7, 'ema2': 14, 'slip_atr_k': 0.21257089729449427, 'slip_spread_k': 0.17677920573155909, 'spread_hl_frac': 0.004188025541411809, 'bb_std_mult': 0.809343313865517, 'rsi_os': 41, 'rsi_ob': 75, 'vol_spike': 0.208930752439218, 'adx_thresh': 7.834762471134731, 'atr_min_pct': 0.007339348162985254, 'atr_max_pct': 0.045353501416487065, 'tp_mult': 2.690494925715531, 'tsl_mult': 0.6813028221172508, 'strategy': 'breakout', 'time_stop': 119, 'use_sma': True, 'use_atr': False, 'use_adx': True, 'use_ema': False, 'use_spike': True, 'rsi_required': True, 'edge_k': 1.7911327796614502, 'edge_cap': 0.4511580480871886, 'bull_strategy': 'mean_reversion', 'bull_bb_std_mult': 0.9887551236282178, 'bull_rsi_os': 7, 'bull_rsi_ob': 71, 'bull_adx_thresh': 12.040478174280892, 'bull_atr_min_pct': 0.0033742307115307187, 'bull_atr_max_pct': 0.07541854038839363, 'bull_tp_mult': 1.1978159479358996, 'bull_tsl_mult': 0.08370545933357236, 'bull_time_stop': 14, 'bull_use_sma': False, 'bull_use_ema': False, 'bull_use_atr': False, 'bull_use_adx': True, 'bull_use_spike': True, 'bull_rsi_required': True, 'bear_strategy': 'breakout', 'bear_bb_std_mult': 2.1542456445535474, 'bear_rsi_os': 28, 'bear_rsi_ob': 54, 'bear_adx_thresh': 17.841112704810204, 'bear_atr_min_pct': 0.009606311813437648, 'bear_atr_max_pct': 0.125227761565029, 'bear_tp_mult': 1.759945789179807, 'bear_tsl_mult': 0.3447843350695716, 'bear_time_stop': 23, 'bear_use_sma': False, 'bear_use_ema': False, 'bear_use_atr': False, 'bear_use_adx': False, 'bear_use_spike': True, 'bear_rsi_required': True, 'sideways_strategy': 'breakout', 'sideways_bb_std_mult': 1.5934344191807486, 'sideways_rsi_os': 9, 'sideways_rsi_ob': 68, 'sideways_adx_thresh': 16.056405043152505, 'sideways_atr_min_pct': 0.02882552235382553, 'sideways_atr_max_pct': 0.010410130232334199, 'sideways_tp_mult': 1.1853070103709664, 'sideways_tsl_mult': 0.8478609757267612, 'sideways_time_stop': 16, 'sideways_use_sma': True, 'sideways_use_ema': False, 'sideways_use_atr': True, 'sideways_use_adx': False, 'sideways_use_spike': True, 'sideways_rsi_required': True}.
