[I 2025-08-31 10:21:18,696] Trial 234 finished with values: [-0.0064253860615833824, 0.006324461982237906] and parameters: {'p_sma': 58, 'p_std': 43, 'p_atr': 19, 'p_adx': 16, 'rsi_period': 23, 'ema1': 12, 'ema2': 58, 'slip_atr_k': 0.0701217752268118, 'slip_spread_k': 0.28988766825812184, 'spread_hl_frac': 0.04900180345127067, 'bb_std_mult': 2.555161825488591, 'rsi_os': 41, 'rsi_ob': 89, 'vol_spike': 0.20637699082167063, 'adx_thresh': 13.005702754953568, 'atr_min_pct': 0.01565674244172638, 'atr_max_pct': 0.09116384102702747, 'tp_mult': 1.039109132016057, 'tsl_mult': 0.3380845019927646, 'strategy': 'mean_reversion', 'time_stop': 11, 'use_sma': False, 'use_atr': False, 'use_adx': True, 'use_ema': False, 'use_spike': True, 'rsi_required': True, 'edge_k': 0.6463493092292001, 'edge_cap': 0.7021519273557089, 'bull_strategy': 'breakout', 'bull_bb_std_mult': 0.9937532958841304, 'bull_rsi_os': 44, 'bull_rsi_ob': 74, 'bull_adx_thresh': 17.443123749426324, 'bull_atr_min_pct': 0.004128178457132899, 'bull_atr_max_pct': 0.07399721612877912, 'bull_tp_mult': 2.9606479088929887, 'bull_tsl_mult': 0.08369080085162349, 'bull_time_stop': 236, 'bull_use_sma': True, 'bull_use_ema': True, 'bull_use_atr': True, 'bull_use_adx': False, 'bull_use_spike': True, 'bull_rsi_required': False, 'bear_strategy': 'breakout', 'bear_bb_std_mult': 1.9708086545104493, 'bear_rsi_os': 21, 'bear_rsi_ob': 48, 'bear_adx_thresh': 7.343891043292478, 'bear_atr_min_pct': 0.017703875403393597, 'bear_atr_max_pct': 0.10797659929411105, 'bear_tp_mult': 1.7372006988305315, 'bear_tsl_mult': 0.13705435988156384, 'bear_time_stop': 215, 'bear_use_sma': True, 'bear_use_ema': False, 'bear_use_atr': True, 'bear_use_adx': False, 'bear_use_spike': True, 'bear_rsi_required': False, 'sideways_strategy': 'breakout', 'sideways_bb_std_mult': 2.5072082598542895, 'sideways_rsi_os': 25, 'sideways_rsi_ob': 86, 'sideways_adx_thresh': 15.556656089101685, 'sideways_atr_min_pct': 0.003168993247293051, 'sideways_atr_max_pct': 0.012797835785582396, 'sideways_tp_mult': 1.265596365031603, 'sideways_tsl_mult': 0.0657697415586983, 'sideways_time_stop': 267, 'sideways_use_sma': True, 'sideways_use_ema': False, 'sideways_use_atr': False, 'sideways_use_adx': True, 'sideways_use_spike': True, 'sideways_rsi_required': False}.
[I 2025-08-31 10:21:20,110] Trial 237 finished with values: [-0.006601576123685171, 0.006677833191698454] and parameters: {'p_sma': 58, 'p_std': 59, 'p_atr': 17, 'p_adx': 7, 'rsi_period': 82, 'ema1': 13, 'ema2': 58, 'slip_atr_k': 0.07198323469719405, 'slip_spread_k': 0.5210791968975854, 'spread_hl_frac': 0.030141494719467657, 'bb_std_mult': 2.5651477241693827, 'rsi_os': 41, 'rsi_ob': 90, 'vol_spike': 0.02830751910844799, 'adx_thresh': 8.44005550995739, 'atr_min_pct': 0.023385449580946214, 'atr_max_pct': 0.10159912478900622, 'tp_mult': 2.3184918013491385, 'tsl_mult': 0.3398923213771122, 'strategy': 'mean_reversion', 'time_stop': 134, 'use_sma': False, 'use_atr': True, 'use_adx': True, 'use_ema': True, 'use_spike': True, 'rsi_required': True, 'edge_k': 0.6254763170939135, 'edge_cap': 0.19373598063015657, 'bull_strategy': 'breakout', 'bull_bb_std_mult': 0.9721292959399442, 'bull_rsi_os': 46, 'bull_rsi_ob': 73, 'bull_adx_thresh': 10.742129145021122, 'bull_atr_min_pct': 0.0037160780689367845, 'bull_atr_max_pct': 0.06686954823185302, 'bull_tp_mult': 1.205951345794345, 'bull_tsl_mult': 0.07870200892280754, 'bull_time_stop': 14, 'bull_use_sma': True, 'bull_use_ema': True, 'bull_use_atr': True, 'bull_use_adx': False, 'bull_use_spike': False, 'bull_rsi_required': False, 'bear_strategy': 'breakout', 'bear_bb_std_mult': 1.4389009972465627, 'bear_rsi_os': 29, 'bear_rsi_ob': 58, 'bear_adx_thresh': 6.150404374023013, 'bear_atr_min_pct': 0.016118937837607563, 'bear_atr_max_pct': 0.12465765489256456, 'bear_tp_mult': 2.641845503356029, 'bear_tsl_mult': 0.13396948080289883, 'bear_time_stop': 192, 'bear_use_sma': True, 'bear_use_ema': False, 'bear_use_atr': False, 'bear_use_adx': True, 'bear_use_spike': True, 'bear_rsi_required': False, 'sideways_strategy': 'breakout', 'sideways_bb_std_mult': 2.4930378641000543, 'sideways_rsi_os': 53, 'sideways_rsi_ob': 86, 'sideways_adx_thresh': 15.255829624011646, 'sideways_atr_min_pct': 0.003401334600605252, 'sideways_atr_max_pct': 0.015181743111317841, 'sideways_tp_mult': 2.9448990333536234, 'sideways_tsl_mult': 0.8405735059115442, 'sideways_time_stop': 269, 'sideways_use_sma': True, 'sideways_use_ema': False, 'sideways_use_atr': False, 'sideways_use_adx': True, 'sideways_use_spike': True, 'sideways_rsi_required': False}.
[I 2025-08-31 10:21:20,476] Trial 235 finished with values: [-1000000000.0, 1000000000.0] and parameters: {'p_sma': 21, 'p_std': 34, 'p_atr': 19, 'p_adx': 16, 'rsi_period': 23, 'ema1': 13, 'ema2': 58, 'slip_atr_k': 0.06868407924943379, 'slip_spread_k': 0.5223875545861818, 'spread_hl_frac': 0.03050623870082457, 'bb_std_mult': 2.704558532957657, 'rsi_os': 41, 'rsi_ob': 75, 'vol_spike': 0.20796306417654156, 'adx_thresh': 23.497022218937985, 'atr_min_pct': 0.017979481780033023, 'atr_max_pct': 0.09151755591136321, 'tp_mult': 2.78436687088057, 'tsl_mult': 0.5799928780351901, 'strategy': 'mean_reversion', 'time_stop': 133, 'use_sma': False, 'use_atr': False, 'use_adx': True, 'use_ema': False, 'use_spike': True, 'rsi_required': True, 'edge_k': 1.7351011866408304, 'edge_cap': 0.19758815915726896, 'bull_strategy': 'breakout', 'bull_bb_std_mult': 0.9869656288537735, 'bull_rsi_os': 47, 'bull_rsi_ob': 78, 'bull_adx_thresh': 23.97070269788101, 'bull_atr_min_pct': 0.0038990711164040718, 'bull_atr_max_pct': 0.05574697755764607, 'bull_tp_mult': 2.965346601329683, 'bull_tsl_mult': 0.08537411461883367, 'bull_time_stop': 13, 'bull_use_sma': True, 'bull_use_ema': True, 'bull_use_atr': True, 'bull_use_adx': False, 'bull_use_spike': False, 'bull_rsi_required': False, 'bear_strategy': 'breakout', 'bear_bb_std_mult': 1.943521292047959, 'bear_rsi_os': 29, 'bear_rsi_ob': 64, 'bear_adx_thresh': 7.26864205025561, 'bear_atr_min_pct': 0.018792538932882477, 'bear_atr_max_pct': 0.12435482913787467, 'bear_tp_mult': 2.653815863212024, 'bear_tsl_mult': 0.8250224288384316, 'bear_time_stop': 44, 'bear_use_sma': True, 'bear_use_ema': False, 'bear_use_atr': True, 'bear_use_adx': True, 'bear_use_spike': True, 'bear_rsi_required': False, 'sideways_strategy': 'breakout', 'sideways_bb_std_mult': 2.522365760658613, 'sideways_rsi_os': 27, 'sideways_rsi_ob': 86, 'sideways_adx_thresh': 14.160639438290788, 'sideways_atr_min_pct': 0.0034832779801400307, 'sideways_atr_max_pct': 0.012101530289434025, 'sideways_tp_mult': 1.1718292302232192, 'sideways_tsl_mult': 0.7093415192562442, 'sideways_time_stop': 268, 'sideways_use_sma': True, 'sideways_use_ema': False, 'sideways_use_atr': False, 'sideways_use_adx': True, 'sideways_use_spike': True, 'sideways_rsi_required': False}.
[I 2025-08-31 10:21:20,570] Trial 236 finished with values: [-1000000000.0, 1000000000.0] and parameters: {'p_sma': 21, 'p_std': 36, 'p_atr': 17, 'p_adx': 7, 'rsi_period': 23, 'ema1': 13, 'ema2': 58, 'slip_atr_k': 0.07140677807668529, 'slip_spread_k': 0.2982162104335573, 'spread_hl_frac': 0.028773891845537754, 'bb_std_mult': 2.053089351139178, 'rsi_os': 41, 'rsi_ob': 75, 'vol_spike': 0.2078221075033417, 'adx_thresh': 13.049556276161987, 'atr_min_pct': 0.01576913939216656, 'atr_max_pct': 0.09795102212148915, 'tp_mult': 2.2397371354682165, 'tsl_mult': 0.4322879863263449, 'strategy': 'mean_reversion', 'time_stop': 134, 'use_sma': False, 'use_atr': True, 'use_adx': True, 'use_ema': True, 'use_spike': True, 'rsi_required': True, 'edge_k': 1.2943901802142486, 'edge_cap': 0.07556287969684378, 'bull_strategy': 'breakout', 'bull_bb_std_mult': 0.9877102423497952, 'bull_rsi_os': 43, 'bull_rsi_ob': 73, 'bull_adx_thresh': 10.83197760956854, 'bull_atr_min_pct': 0.02512504984435189, 'bull_atr_max_pct': 0.07255475825202545, 'bull_tp_mult': 2.594307806831912, 'bull_tsl_mult': 0.08664865474532085, 'bull_time_stop': 14, 'bull_use_sma': True, 'bull_use_ema': True, 'bull_use_atr': True, 'bull_use_adx': False, 'bull_use_spike': False, 'bull_rsi_required': False, 'bear_strategy': 'breakout', 'bear_bb_std_mult': 1.9905023964724224, 'bear_rsi_os': 29, 'bear_rsi_ob': 64, 'bear_adx_thresh': 7.356939041937004, 'bear_atr_min_pct': 0.015921691043135112, 'bear_atr_max_pct': 0.10763780655580972, 'bear_tp_mult': 2.2506421213428554, 'bear_tsl_mult': 0.1785297698676402, 'bear_time_stop': 23, 'bear_use_sma': True, 'bear_use_ema': False, 'bear_use_atr': True, 'bear_use_adx': True, 'bear_use_spike': True, 'bear_rsi_required': False, 'sideways_strategy': 'breakout', 'sideways_bb_std_mult': 2.500937445676063, 'sideways_rsi_os': 30, 'sideways_rsi_ob': 86, 'sideways_adx_thresh': 15.299751170936744, 'sideways_atr_min_pct': 0.003561068474923156, 'sideways_atr_max_pct': 0.013250338689001273, 'sideways_tp_mult': 1.2683356213046575, 'sideways_tsl_mult': 0.8427860545491298, 'sideways_time_stop': 268, 'sideways_use_sma': True, 'sideways_use_ema': False, 'sideways_use_atr': False, 'sideways_use_adx': True, 'sideways_use_spike': True, 'sideways_rsi_required': False}.
[I 2025-08-31 10:21:51,331] Trial 239 finished with values: [-1000000000.0, 1000000000.0] and parameters: {'p_sma': 21, 'p_std': 59, 'p_atr': 17, 'p_adx': 16, 'rsi_period': 24, 'ema1': 13, 'ema2': 58, 'slip_atr_k': 0.07200123681624526, 'slip_spread_k': 0.3186059244881442, 'spread_hl_frac': 0.03041504071876185, 'bb_std_mult': 2.0278775954434596, 'rsi_os': 40, 'rsi_ob': 76, 'vol_spike': 0.14205378387953604, 'adx_thresh': 23.558799648016254, 'atr_min_pct': 0.020829309381823306, 'atr_max_pct': 0.09920096179668704, 'tp_mult': 2.801646481987539, 'tsl_mult': 0.6282208880149214, 'strategy': 'mean_reversion', 'time_stop': 133, 'use_sma': False, 'use_atr': True, 'use_adx': True, 'use_ema': True, 'use_spike': True, 'rsi_required': True, 'edge_k': 0.5751981021416714, 'edge_cap': 0.19431450655072838, 'bull_strategy': 'breakout', 'bull_bb_std_mult': 1.0059479240392897, 'bull_rsi_os': 45, 'bull_rsi_ob': 73, 'bull_adx_thresh': 33.0748307061711, 'bull_atr_min_pct': 0.0038693349741517192, 'bull_atr_max_pct': 0.042223208353326644, 'bull_tp_mult': 2.5988196300873727, 'bull_tsl_mult': 0.30111092475715157, 'bull_time_stop': 206, 'bull_use_sma': True, 'bull_use_ema': True, 'bull_use_atr': True, 'bull_use_adx': False, 'bull_use_spike': False, 'bull_rsi_required': False, 'bear_strategy': 'breakout', 'bear_bb_std_mult': 1.993031289658161, 'bear_rsi_os': 6, 'bear_rsi_ob': 48, 'bear_adx_thresh': 7.4060309105136, 'bear_atr_min_pct': 0.016073398606609595, 'bear_atr_max_pct': 0.07447532627524556, 'bear_tp_mult': 2.6503441807831383, 'bear_tsl_mult': 0.13368601240952588, 'bear_time_stop': 213, 'bear_use_sma': True, 'bear_use_ema': False, 'bear_use_atr': False, 'bear_use_adx': True, 'bear_use_spike': True, 'bear_rsi_required': False, 'sideways_strategy': 'breakout', 'sideways_bb_std_mult': 2.5147663096817396, 'sideways_rsi_os': 25, 'sideways_rsi_ob': 86, 'sideways_adx_thresh': 19.08263091860333, 'sideways_atr_min_pct': 0.003742240062268047, 'sideways_atr_max_pct': 0.01000447766282643, 'sideways_tp_mult': 1.2680746424766578, 'sideways_tsl_mult': 0.8430610063632891, 'sideways_time_stop': 266, 'sideways_use_sma': True, 'sideways_use_ema': False, 'sideways_use_atr': False, 'sideways_use_adx': True, 'sideways_use_spike': True, 'sideways_rsi_required': False}.
[I 2025-08-31 10:21:51,649] Trial 241 finished with values: [-1000000000.0, 1000000000.0] and parameters: {'p_sma': 20, 'p_std': 60, 'p_atr': 17, 'p_adx': 8, 'rsi_period': 53, 'ema1': 19, 'ema2': 60, 'slip_atr_k': 0.06347886135290395, 'slip_spread_k': 0.33069904946454093, 'spread_hl_frac': 0.04990819692021345, 'bb_std_mult': 2.5288065228481367, 'rsi_os': 43, 'rsi_ob': 76, 'vol_spike': 0.21338079468895954, 'adx_thresh': 8.624481626368317, 'atr_min_pct': 0.02055208768150997, 'atr_max_pct': 0.048735756610477576, 'tp_mult': 2.322783286712199, 'tsl_mult': 0.7035061577794574, 'strategy': 'mean_reversion', 'time_stop': 175, 'use_sma': False, 'use_atr': True, 'use_adx': True, 'use_ema': True, 'use_spike': True, 'rsi_required': True, 'edge_k': 0.6280766424831685, 'edge_cap': 0.8117424153647184, 'bull_strategy': 'breakout', 'bull_bb_std_mult': 1.0596153669814807, 'bull_rsi_os': 46, 'bull_rsi_ob': 74, 'bull_adx_thresh': 17.37440108498001, 'bull_atr_min_pct': 0.025934993649899526, 'bull_atr_max_pct': 0.10519885326246259, 'bull_tp_mult': 2.6582934435099705, 'bull_tsl_mult': 0.30829120184948433, 'bull_time_stop': 204, 'bull_use_sma': False, 'bull_use_ema': True, 'bull_use_atr': True, 'bull_use_adx': True, 'bull_use_spike': True, 'bull_rsi_required': False, 'bear_strategy': 'breakout', 'bear_bb_std_mult': 3.1577297227041257, 'bear_rsi_os': 21, 'bear_rsi_ob': 55, 'bear_adx_thresh': 5.982169749378616, 'bear_atr_min_pct': 0.017083972555241293, 'bear_atr_max_pct': 0.12259616662796771, 'bear_tp_mult': 1.7457492505419785, 'bear_tsl_mult': 0.1477482479511245, 'bear_time_stop': 42, 'bear_use_sma': False, 'bear_use_ema': False, 'bear_use_atr': False, 'bear_use_adx': False, 'bear_use_spike': True, 'bear_rsi_required': True, 'sideways_strategy': 'breakout', 'sideways_bb_std_mult': 2.7059193198757923, 'sideways_rsi_os': 38, 'sideways_rsi_ob': 84, 'sideways_adx_thresh': 15.357279491653934, 'sideways_atr_min_pct': 0.01932795798736202, 'sideways_atr_max_pct': 0.11259086828814698, 'sideways_tp_mult': 2.8668773600428437, 'sideways_tsl_mult': 0.8234608264683584, 'sideways_time_stop': 278, 'sideways_use_sma': True, 'sideways_use_ema': False, 'sideways_use_atr': False, 'sideways_use_adx': False, 'sideways_use_spike': True, 'sideways_rsi_required': False}.
[I 2025-08-31 10:21:51,680] Trial 240 finished with values: [-1000000000.0, 1000000000.0] and parameters: {'p_sma': 21, 'p_std': 36, 'p_atr': 17, 'p_adx': 7, 'rsi_period': 9, 'ema1': 30, 'ema2': 59, 'slip_atr_k': 0.08014660427439706, 'slip_spread_k': 0.3234471056739402, 'spread_hl_frac': 0.028700125855984773, 'bb_std_mult': 2.03423687339442, 'rsi_os': 40, 'rsi_ob': 76, 'vol_spike': 0.029174372550857586, 'adx_thresh': 29.912173186281095, 'atr_min_pct': 0.023708924174618354, 'atr_max_pct': 0.10006362997173118, 'tp_mult': 2.2385850019563516, 'tsl_mult': 0.5359219477989892, 'strategy': 'mean_reversion', 'time_stop': 151, 'use_sma': False, 'use_atr': True, 'use_adx': True, 'use_ema': True, 'use_spike': True, 'rsi_required': True, 'edge_k': 1.7057609185377647, 'edge_cap': 0.14227674847958602, 'bull_strategy': 'breakout', 'bull_bb_std_mult': 1.0776368097458977, 'bull_rsi_os': 45, 'bull_rsi_ob': 74, 'bull_adx_thresh': 10.828241009421761, 'bull_atr_min_pct': 0.003761484978795548, 'bull_atr_max_pct': 0.10664330675927756, 'bull_tp_mult': 2.707514945879264, 'bull_tsl_mult': 0.06983015197089511, 'bull_time_stop': 113, 'bull_use_sma': False, 'bull_use_ema': True, 'bull_use_atr': True, 'bull_use_adx': False, 'bull_use_spike': False, 'bull_rsi_required': False, 'bear_strategy': 'breakout', 'bear_bb_std_mult': 2.0117111887953176, 'bear_rsi_os': 38, 'bear_rsi_ob': 49, 'bear_adx_thresh': 7.786658020316449, 'bear_atr_min_pct': 0.016131216169262295, 'bear_atr_max_pct': 0.10691731302833526, 'bear_tp_mult': 2.61964618962806, 'bear_tsl_mult': 0.1409555438874908, 'bear_time_stop': 29, 'bear_use_sma': False, 'bear_use_ema': False, 'bear_use_atr': False, 'bear_use_adx': True, 'bear_use_spike': True, 'bear_rsi_required': False, 'sideways_strategy': 'breakout', 'sideways_bb_std_mult': 2.5506532284777346, 'sideways_rsi_os': 25, 'sideways_rsi_ob': 84, 'sideways_adx_thresh': 15.218811583350533, 'sideways_atr_min_pct': 0.0192625247605691, 'sideways_atr_max_pct': 0.015317751385526629, 'sideways_tp_mult': 2.9326336823026757, 'sideways_tsl_mult': 0.9973511046396607, 'sideways_time_stop': 279, 'sideways_use_sma': True, 'sideways_use_ema': False, 'sideways_use_atr': False, 'sideways_use_adx': False, 'sideways_use_spike': True, 'sideways_rsi_required': False}.
[I 2025-08-31 10:21:51,786] Trial 238 finished with values: [-1000000000.0, 1000000000.0] and parameters: {'p_sma': 21, 'p_std': 36, 'p_atr': 17, 'p_adx': 7, 'rsi_period': 82, 'ema1': 13, 'ema2': 58, 'slip_atr_k': 0.06986533321482002, 'slip_spread_k': 0.15563825941089088, 'spread_hl_frac': 0.030431895223470253, 'bb_std_mult': 2.5357802543054175, 'rsi_os': 40, 'rsi_ob': 90, 'vol_spike': 0.0675303748266739, 'adx_thresh': 13.235810789627084, 'atr_min_pct': 0.023297141391878058, 'atr_max_pct': 0.10224856644836143, 'tp_mult': 2.2337533716408777, 'tsl_mult': 0.4431749023429913, 'strategy': 'mean_reversion', 'time_stop': 132, 'use_sma': False, 'use_atr': True, 'use_adx': True, 'use_ema': True, 'use_spike': True, 'rsi_required': True, 'edge_k': 0.5480112213434907, 'edge_cap': 0.7013752739755305, 'bull_strategy': 'breakout', 'bull_bb_std_mult': 0.9961115934545058, 'bull_rsi_os': 45, 'bull_rsi_ob': 73, 'bull_adx_thresh': 10.790634958618215, 'bull_atr_min_pct': 0.019580313668637484, 'bull_atr_max_pct': 0.07760343521548897, 'bull_tp_mult': 2.6487883387955344, 'bull_tsl_mult': 0.0861010749684876, 'bull_time_stop': 161, 'bull_use_sma': True, 'bull_use_ema': True, 'bull_use_atr': True, 'bull_use_adx': False, 'bull_use_spike': False, 'bull_rsi_required': False, 'bear_strategy': 'breakout', 'bear_bb_std_mult': 1.4801198908385023, 'bear_rsi_os': 21, 'bear_rsi_ob': 49, 'bear_adx_thresh': 7.448054054198611, 'bear_atr_min_pct': 0.01624131781274556, 'bear_atr_max_pct': 0.09880991853730459, 'bear_tp_mult': 1.9885075721054168, 'bear_tsl_mult': 0.14107345368448465, 'bear_time_stop': 40, 'bear_use_sma': True, 'bear_use_ema': False, 'bear_use_atr': False, 'bear_use_adx': True, 'bear_use_spike': True, 'bear_rsi_required': False, 'sideways_strategy': 'breakout', 'sideways_bb_std_mult': 2.5183288366470684, 'sideways_rsi_os': 43, 'sideways_rsi_ob': 86, 'sideways_adx_thresh': 15.261809979125482, 'sideways_atr_min_pct': 0.01924544304563713, 'sideways_atr_max_pct': 0.013085975720207258, 'sideways_tp_mult': 2.918329624924313, 'sideways_tsl_mult': 0.7139878523867618, 'sideways_time_stop': 268, 'sideways_use_sma': True, 'sideways_use_ema': False, 'sideways_use_atr': False, 'sideways_use_adx': True, 'sideways_use_spike': True, 'sideways_rsi_required': False}.
[I 2025-08-31 10:21:52,290] Trial 244 finished with values: [-1000000000.0, 1000000000.0] and parameters: {'p_sma': 57, 'p_std': 56, 'p_atr': 17, 'p_adx': 8, 'rsi_period': 21, 'ema1': 12, 'ema2': 59, 'slip_atr_k': 0.06540087834057169, 'slip_spread_k': 0.2607196989486457, 'spread_hl_frac': 0.025830043050914294, 'bb_std_mult': 2.784075918842185, 'rsi_os': 42, 'rsi_ob': 45, 'vol_spike': 0.06744040827488919, 'adx_thresh': 7.781204269652808, 'atr_min_pct': 0.026159714820478346, 'atr_max_pct': 0.025323543634590176, 'tp_mult': 1.575599655840596, 'tsl_mult': 0.7585473137129124, 'strategy': 'mean_reversion', 'time_stop': 84, 'use_sma': False, 'use_atr': False, 'use_adx': True, 'use_ema': False, 'use_spike': True, 'rsi_required': True, 'edge_k': 1.6506936927813811, 'edge_cap': 0.10378932482586625, 'bull_strategy': 'breakout', 'bull_bb_std_mult': 1.6057848876971492, 'bull_rsi_os': 40, 'bull_rsi_ob': 85, 'bull_adx_thresh': 10.116802823499045, 'bull_atr_min_pct': 0.027465314657316102, 'bull_atr_max_pct': 0.06663080384787011, 'bull_tp_mult': 1.1883425930059293, 'bull_tsl_mult': 0.2627785352135915, 'bull_time_stop': 291, 'bull_use_sma': True, 'bull_use_ema': True, 'bull_use_atr': False, 'bull_use_adx': True, 'bull_use_spike': True, 'bull_rsi_required': False, 'bear_strategy': 'mean_reversion', 'bear_bb_std_mult': 2.2040734757125797, 'bear_rsi_os': 28, 'bear_rsi_ob': 58, 'bear_adx_thresh': 24.428182022907208, 'bear_atr_min_pct': 0.01656496618640327, 'bear_atr_max_pct': 0.14709529626654522, 'bear_tp_mult': 2.008099740327562, 'bear_tsl_mult': 0.16459337188707296, 'bear_time_stop': 31, 'bear_use_sma': False, 'bear_use_ema': False, 'bear_use_atr': True, 'bear_use_adx': False, 'bear_use_spike': True, 'bear_rsi_required': True, 'sideways_strategy': 'breakout', 'sideways_bb_std_mult': 2.6828899773189416, 'sideways_rsi_os': 43, 'sideways_rsi_ob': 84, 'sideways_adx_thresh': 14.620282324261051, 'sideways_atr_min_pct': 0.0029462623869760686, 'sideways_atr_max_pct': 0.016596835663403628, 'sideways_tp_mult': 2.8221687871495535, 'sideways_tsl_mult': 0.07383744511050122, 'sideways_time_stop': 259, 'sideways_use_sma': True, 'sideways_use_ema': False, 'sideways_use_atr': True, 'sideways_use_adx': False, 'sideways_use_spike': True, 'sideways_rsi_required': False}.
