[I 2025-08-31 11:20:44,152] Trial 702 finished with values: [-1000000000.0, 1000000000.0] and parameters: {'p_sma': 38, 'p_std': 21, 'p_atr': 9, 'p_adx': 20, 'rsi_period': 36, 'ema1': 16, 'ema2': 11, 'slip_atr_k': 0.18886182912705968, 'slip_spread_k': 0.5186318517108658, 'spread_hl_frac': 0.02380485875876343, 'bb_std_mult': 0.757537337629986, 'rsi_os': 23, 'rsi_ob': 81, 'vol_spike': 0.1344976703662528, 'adx_thresh': 11.601322359361617, 'atr_min_pct': 0.023724538088181556, 'atr_max_pct': 0.10959292616021381, 'tp_mult': 2.937820039736648, 'tsl_mult': 0.0665565999388813, 'strategy': 'breakout', 'time_stop': 74, 'use_sma': True, 'use_atr': True, 'use_adx': False, 'use_ema': True, 'use_spike': False, 'rsi_required': False, 'edge_k': 1.4620547926906515, 'edge_cap': 0.8356771258695177, 'bull_strategy': 'mean_reversion', 'bull_bb_std_mult': 2.2429715496259055, 'bull_rsi_os': 8, 'bull_rsi_ob': 65, 'bull_adx_thresh': 29.722743507324033, 'bull_atr_min_pct': 0.012164661810883862, 'bull_atr_max_pct': 0.032030315547017144, 'bull_tp_mult': 2.563186784738927, 'bull_tsl_mult': 0.6870791553495516, 'bull_time_stop': 49, 'bull_use_sma': False, 'bull_use_ema': False, 'bull_use_atr': False, 'bull_use_adx': True, 'bull_use_spike': False, 'bull_rsi_required': True, 'bear_strategy': 'mean_reversion', 'bear_bb_std_mult': 3.4009338994586065, 'bear_rsi_os': 14, 'bear_rsi_ob': 52, 'bear_adx_thresh': 10.377145840285433, 'bear_atr_min_pct': 0.007361665018503992, 'bear_atr_max_pct': 0.12877979262010364, 'bear_tp_mult': 2.6595615635804335, 'bear_tsl_mult': 0.6604739343682954, 'bear_time_stop': 238, 'bear_use_sma': False, 'bear_use_ema': False, 'bear_use_atr': False, 'bear_use_adx': False, 'bear_use_spike': True, 'bear_rsi_required': False, 'sideways_strategy': 'mean_reversion', 'sideways_bb_std_mult': 1.1201865376882458, 'sideways_rsi_os': 40, 'sideways_rsi_ob': 65, 'sideways_adx_thresh': 7.460471078244719, 'sideways_atr_min_pct': 0.0063834905680183384, 'sideways_atr_max_pct': 0.09191093030014433, 'sideways_tp_mult': 2.7078120874200975, 'sideways_tsl_mult': 0.3785323953421661, 'sideways_time_stop': 169, 'sideways_use_sma': True, 'sideways_use_ema': True, 'sideways_use_atr': False, 'sideways_use_adx': False, 'sideways_use_spike': False, 'sideways_rsi_required': True}.
[I 2025-08-31 11:20:44,836] Trial 704 finished with values: [-0.061752779522821544, 0.06141852091663699] and parameters: {'p_sma': 54, 'p_std': 58, 'p_atr': 28, 'p_adx': 23, 'rsi_period': 62, 'ema1': 17, 'ema2': 44, 'slip_atr_k': 0.014163766284011168, 'slip_spread_k': 0.47198174789214836, 'spread_hl_frac': 0.021367885532289216, 'bb_std_mult': 3.3776456712563006, 'rsi_os': 26, 'rsi_ob': 81, 'vol_spike': 0.05832782001243479, 'adx_thresh': 16.55385285538815, 'atr_min_pct': 0.015171355833039354, 'atr_max_pct': 0.09479058549133726, 'tp_mult': 2.9218158388837625, 'tsl_mult': 0.19409653120713732, 'strategy': 'breakout', 'time_stop': 90, 'use_sma': True, 'use_atr': True, 'use_adx': False, 'use_ema': True, 'use_spike': False, 'rsi_required': False, 'edge_k': 1.4518610814242707, 'edge_cap': 0.6946856940310104, 'bull_strategy': 'mean_reversion', 'bull_bb_std_mult': 2.238972791954382, 'bull_rsi_os': 42, 'bull_rsi_ob': 67, 'bull_adx_thresh': 29.910428949051017, 'bull_atr_min_pct': 0.012445284181073444, 'bull_atr_max_pct': 0.032372805279411984, 'bull_tp_mult': 2.9054806187103943, 'bull_tsl_mult': 0.9112291736893621, 'bull_time_stop': 48, 'bull_use_sma': False, 'bull_use_ema': True, 'bull_use_atr': False, 'bull_use_adx': False, 'bull_use_spike': False, 'bull_rsi_required': True, 'bear_strategy': 'mean_reversion', 'bear_bb_std_mult': 1.6050122379699439, 'bear_rsi_os': 53, 'bear_rsi_ob': 53, 'bear_adx_thresh': 10.961952529225346, 'bear_atr_min_pct': 0.0014556469223118377, 'bear_atr_max_pct': 0.12830423654849815, 'bear_tp_mult': 2.8518217225713003, 'bear_tsl_mult': 0.9373712866754671, 'bear_time_stop': 72, 'bear_use_sma': False, 'bear_use_ema': False, 'bear_use_atr': True, 'bear_use_adx': True, 'bear_use_spike': True, 'bear_rsi_required': False, 'sideways_strategy': 'mean_reversion', 'sideways_bb_std_mult': 2.139916901223247, 'sideways_rsi_os': 55, 'sideways_rsi_ob': 46, 'sideways_adx_thresh': 27.927895005866006, 'sideways_atr_min_pct': 0.005555949029991746, 'sideways_atr_max_pct': 0.10634386542278756, 'sideways_tp_mult': 2.9121902623124294, 'sideways_tsl_mult': 0.9071056767032569, 'sideways_time_stop': 169, 'sideways_use_sma': True, 'sideways_use_ema': True, 'sideways_use_atr': False, 'sideways_use_adx': False, 'sideways_use_spike': False, 'sideways_rsi_required': True}.
[I 2025-08-31 11:20:44,837] Trial 701 finished with values: [-0.10902186985056905, 0.10873662754418459] and parameters: {'p_sma': 38, 'p_std': 24, 'p_atr': 29, 'p_adx': 20, 'rsi_period': 36, 'ema1': 5, 'ema2': 43, 'slip_atr_k': 0.17663038724250457, 'slip_spread_k': 0.5627684966442807, 'spread_hl_frac': 0.02346155103377139, 'bb_std_mult': 0.7571712558084951, 'rsi_os': 24, 'rsi_ob': 84, 'vol_spike': 0.1420768172898414, 'adx_thresh': 11.937780964838131, 'atr_min_pct': 0.0239241263350987, 'atr_max_pct': 0.14261768550799664, 'tp_mult': 2.918628869171087, 'tsl_mult': 0.06423036424604926, 'strategy': 'breakout', 'time_stop': 72, 'use_sma': True, 'use_atr': True, 'use_adx': False, 'use_ema': True, 'use_spike': False, 'rsi_required': False, 'edge_k': 1.5326385473786601, 'edge_cap': 0.6608249811735006, 'bull_strategy': 'mean_reversion', 'bull_bb_std_mult': 1.2887484628348327, 'bull_rsi_os': 41, 'bull_rsi_ob': 64, 'bull_adx_thresh': 27.438465172284236, 'bull_atr_min_pct': 0.013876509409266182, 'bull_atr_max_pct': 0.03224389240203534, 'bull_tp_mult': 2.3927867384951007, 'bull_tsl_mult': 0.24570983751553033, 'bull_time_stop': 253, 'bull_use_sma': False, 'bull_use_ema': False, 'bull_use_atr': False, 'bull_use_adx': True, 'bull_use_spike': False, 'bull_rsi_required': True, 'bear_strategy': 'mean_reversion', 'bear_bb_std_mult': 2.5624632974365427, 'bear_rsi_os': 39, 'bear_rsi_ob': 53, 'bear_adx_thresh': 5.535354135843463, 'bear_atr_min_pct': 0.001430207253005111, 'bear_atr_max_pct': 0.11241089872850457, 'bear_tp_mult': 2.0171313154199604, 'bear_tsl_mult': 0.9356261071605092, 'bear_time_stop': 188, 'bear_use_sma': False, 'bear_use_ema': False, 'bear_use_atr': True, 'bear_use_adx': False, 'bear_use_spike': True, 'bear_rsi_required': False, 'sideways_strategy': 'mean_reversion', 'sideways_bb_std_mult': 1.0831347977042338, 'sideways_rsi_os': 28, 'sideways_rsi_ob': 66, 'sideways_adx_thresh': 29.90055753760052, 'sideways_atr_min_pct': 0.025510044417518685, 'sideways_atr_max_pct': 0.03926936504456253, 'sideways_tp_mult': 2.911995841836069, 'sideways_tsl_mult': 0.3825241829900763, 'sideways_time_stop': 158, 'sideways_use_sma': True, 'sideways_use_ema': True, 'sideways_use_atr': True, 'sideways_use_adx': False, 'sideways_use_spike': False, 'sideways_rsi_required': False}.
[I 2025-08-31 11:21:18,778] Trial 705 finished with values: [-0.02921258726083875, 0.029017616910909323] and parameters: {'p_sma': 31, 'p_std': 11, 'p_atr': 29, 'p_adx': 23, 'rsi_period': 31, 'ema1': 17, 'ema2': 44, 'slip_atr_k': 0.012826181512011158, 'slip_spread_k': 0.7781592976452553, 'spread_hl_frac': 0.02166392690712989, 'bb_std_mult': 1.7086331873534246, 'rsi_os': 28, 'rsi_ob': 84, 'vol_spike': 0.0370440232968396, 'adx_thresh': 16.38704445945951, 'atr_min_pct': 5.6368864308964026e-05, 'atr_max_pct': 0.12898549189195085, 'tp_mult': 2.9647823162338134, 'tsl_mult': 0.900206908572303, 'strategy': 'breakout', 'time_stop': 90, 'use_sma': True, 'use_atr': True, 'use_adx': False, 'use_ema': True, 'use_spike': False, 'rsi_required': False, 'edge_k': 1.4527679331959262, 'edge_cap': 0.38633319523699844, 'bull_strategy': 'mean_reversion', 'bull_bb_std_mult': 2.204240529252449, 'bull_rsi_os': 42, 'bull_rsi_ob': 65, 'bull_adx_thresh': 32.84126903282997, 'bull_atr_min_pct': 0.00013908231308150387, 'bull_atr_max_pct': 0.13797888965599636, 'bull_tp_mult': 2.4914151514130887, 'bull_tsl_mult': 0.9124642213582981, 'bull_time_stop': 52, 'bull_use_sma': False, 'bull_use_ema': True, 'bull_use_atr': False, 'bull_use_adx': True, 'bull_use_spike': False, 'bull_rsi_required': True, 'bear_strategy': 'mean_reversion', 'bear_bb_std_mult': 1.7069958112842654, 'bear_rsi_os': 53, 'bear_rsi_ob': 53, 'bear_adx_thresh': 11.60402353110316, 'bear_atr_min_pct': 0.0035862443771862897, 'bear_atr_max_pct': 0.11190179303349601, 'bear_tp_mult': 2.0047115334895618, 'bear_tsl_mult': 0.9621087867122257, 'bear_time_stop': 74, 'bear_use_sma': False, 'bear_use_ema': False, 'bear_use_atr': True, 'bear_use_adx': False, 'bear_use_spike': True, 'bear_rsi_required': False, 'sideways_strategy': 'mean_reversion', 'sideways_bb_std_mult': 1.1046573960019526, 'sideways_rsi_os': 55, 'sideways_rsi_ob': 64, 'sideways_adx_thresh': 17.581118228642154, 'sideways_atr_min_pct': 0.0056412296055539865, 'sideways_atr_max_pct': 0.03907329651191383, 'sideways_tp_mult': 1.729511064990655, 'sideways_tsl_mult': 0.9056780451251147, 'sideways_time_stop': 168, 'sideways_use_sma': True, 'sideways_use_ema': True, 'sideways_use_atr': False, 'sideways_use_adx': False, 'sideways_use_spike': False, 'sideways_rsi_required': False}.
[I 2025-08-31 11:21:18,996] Trial 706 finished with values: [-1000000000.0, 1000000000.0] and parameters: {'p_sma': 52, 'p_std': 11, 'p_atr': 28, 'p_adx': 23, 'rsi_period': 59, 'ema1': 6, 'ema2': 28, 'slip_atr_k': 0.03945464752414554, 'slip_spread_k': 0.6145657944543499, 'spread_hl_frac': 0.021544499397041103, 'bb_std_mult': 3.4452098761600576, 'rsi_os': 24, 'rsi_ob': 84, 'vol_spike': 0.10015487129990766, 'adx_thresh': 10.163023305514457, 'atr_min_pct': 0.0220075486318405, 'atr_max_pct': 0.14322703549919458, 'tp_mult': 2.8638755593655376, 'tsl_mult': 0.3903759075681726, 'strategy': 'breakout', 'time_stop': 91, 'use_sma': True, 'use_atr': True, 'use_adx': False, 'use_ema': True, 'use_spike': False, 'rsi_required': False, 'edge_k': 1.4144494501428326, 'edge_cap': 0.052721334369347506, 'bull_strategy': 'mean_reversion', 'bull_bb_std_mult': 2.4462875101096806, 'bull_rsi_os': 42, 'bull_rsi_ob': 94, 'bull_adx_thresh': 31.867655949077687, 'bull_atr_min_pct': 0.013910621783441738, 'bull_atr_max_pct': 0.026808316474292042, 'bull_tp_mult': 2.843164882567425, 'bull_tsl_mult': 0.24409162044573735, 'bull_time_stop': 284, 'bull_use_sma': False, 'bull_use_ema': True, 'bull_use_atr': False, 'bull_use_adx': True, 'bull_use_spike': False, 'bull_rsi_required': False, 'bear_strategy': 'mean_reversion', 'bear_bb_std_mult': 1.6507176061266287, 'bear_rsi_os': 55, 'bear_rsi_ob': 45, 'bear_adx_thresh': 11.448716772770057, 'bear_atr_min_pct': 0.009310629643071435, 'bear_atr_max_pct': 0.14207646251051428, 'bear_tp_mult': 1.1178313085572666, 'bear_tsl_mult': 0.5963382337683092, 'bear_time_stop': 108, 'bear_use_sma': False, 'bear_use_ema': False, 'bear_use_atr': True, 'bear_use_adx': False, 'bear_use_spike': True, 'bear_rsi_required': False, 'sideways_strategy': 'mean_reversion', 'sideways_bb_std_mult': 2.141030305622383, 'sideways_rsi_os': 44, 'sideways_rsi_ob': 47, 'sideways_adx_thresh': 27.447405764401434, 'sideways_atr_min_pct': 0.01267621651502713, 'sideways_atr_max_pct': 0.10668163233415771, 'sideways_tp_mult': 2.897025652659446, 'sideways_tsl_mult': 0.902721517533312, 'sideways_time_stop': 167, 'sideways_use_sma': False, 'sideways_use_ema': True, 'sideways_use_atr': False, 'sideways_use_adx': False, 'sideways_use_spike': True, 'sideways_rsi_required': False}.
[I 2025-08-31 11:21:19,099] Trial 707 finished with values: [-1000000000.0, 1000000000.0] and parameters: {'p_sma': 37, 'p_std': 11, 'p_atr': 29, 'p_adx': 21, 'rsi_period': 31, 'ema1': 5, 'ema2': 40, 'slip_atr_k': 0.038999807306449585, 'slip_spread_k': 0.07850020876148073, 'spread_hl_frac': 0.04702299210393765, 'bb_std_mult': 0.5942131376443408, 'rsi_os': 22, 'rsi_ob': 86, 'vol_spike': 0.2803517742836726, 'adx_thresh': 32.08956918556232, 'atr_min_pct': 0.02207897306085765, 'atr_max_pct': 0.078115569326212, 'tp_mult': 2.9708647728516078, 'tsl_mult': 0.08825856885638213, 'strategy': 'breakout', 'time_stop': 87, 'use_sma': True, 'use_atr': True, 'use_adx': False, 'use_ema': True, 'use_spike': False, 'rsi_required': False, 'edge_k': 1.395389976421961, 'edge_cap': 0.9145663732965961, 'bull_strategy': 'mean_reversion', 'bull_bb_std_mult': 1.7265517294397812, 'bull_rsi_os': 44, 'bull_rsi_ob': 56, 'bull_adx_thresh': 22.76734701954304, 'bull_atr_min_pct': 0.011726117318959338, 'bull_atr_max_pct': 0.13763503567521387, 'bull_tp_mult': 2.853259412533953, 'bull_tsl_mult': 0.24005182716437798, 'bull_time_stop': 31, 'bull_use_sma': False, 'bull_use_ema': True, 'bull_use_atr': False, 'bull_use_adx': True, 'bull_use_spike': False, 'bull_rsi_required': False, 'bear_strategy': 'mean_reversion', 'bear_bb_std_mult': 1.6327314264544486, 'bear_rsi_os': 55, 'bear_rsi_ob': 80, 'bear_adx_thresh': 9.505247718890345, 'bear_atr_min_pct': 0.009122550042358764, 'bear_atr_max_pct': 0.14140085412480077, 'bear_tp_mult': 2.555479205952909, 'bear_tsl_mult': 0.9150476420072019, 'bear_time_stop': 89, 'bear_use_sma': False, 'bear_use_ema': False, 'bear_use_atr': True, 'bear_use_adx': False, 'bear_use_spike': True, 'bear_rsi_required': False, 'sideways_strategy': 'mean_reversion', 'sideways_bb_std_mult': 3.350038605002096, 'sideways_rsi_os': 41, 'sideways_rsi_ob': 64, 'sideways_adx_thresh': 27.463247019003212, 'sideways_atr_min_pct': 0.015813859330447055, 'sideways_atr_max_pct': 0.09679558457868649, 'sideways_tp_mult': 1.6641965795157077, 'sideways_tsl_mult': 0.9018246567049932, 'sideways_time_stop': 143, 'sideways_use_sma': False, 'sideways_use_ema': True, 'sideways_use_atr': False, 'sideways_use_adx': False, 'sideways_use_spike': True, 'sideways_rsi_required': False}.
[I 2025-08-31 11:21:19,302] Trial 708 finished with values: [-1000000000.0, 1000000000.0] and parameters: {'p_sma': 52, 'p_std': 27, 'p_atr': 29, 'p_adx': 29, 'rsi_period': 59, 'ema1': 5, 'ema2': 31, 'slip_atr_k': 0.011112234604315527, 'slip_spread_k': 0.09174487582682372, 'spread_hl_frac': 0.03628208507646971, 'bb_std_mult': 0.597095650534565, 'rsi_os': 22, 'rsi_ob': 51, 'vol_spike': 0.10349460542238507, 'adx_thresh': 12.648596068145093, 'atr_min_pct': 0.02281792621151185, 'atr_max_pct': 0.06499487184994719, 'tp_mult': 2.8657741740238145, 'tsl_mult': 0.3827220419695096, 'strategy': 'breakout', 'time_stop': 285, 'use_sma': True, 'use_atr': True, 'use_adx': False, 'use_ema': True, 'use_spike': False, 'rsi_required': False, 'edge_k': 1.422703108627693, 'edge_cap': 0.3675052257580589, 'bull_strategy': 'mean_reversion', 'bull_bb_std_mult': 1.7192084548796638, 'bull_rsi_os': 43, 'bull_rsi_ob': 53, 'bull_adx_thresh': 31.967570146311516, 'bull_atr_min_pct': 0.00014275332467585979, 'bull_atr_max_pct': 0.03927319074315891, 'bull_tp_mult': 1.8597429851757339, 'bull_tsl_mult': 0.18484580988933685, 'bull_time_stop': 284, 'bull_use_sma': False, 'bull_use_ema': True, 'bull_use_atr': False, 'bull_use_adx': True, 'bull_use_spike': False, 'bull_rsi_required': False, 'bear_strategy': 'mean_reversion', 'bear_bb_std_mult': 1.720471321448793, 'bear_rsi_os': 55, 'bear_rsi_ob': 46, 'bear_adx_thresh': 18.40548048841869, 'bear_atr_min_pct': 0.02918733397229377, 'bear_atr_max_pct': 0.14224917167068304, 'bear_tp_mult': 2.515727544671151, 'bear_tsl_mult': 0.9101587732133788, 'bear_time_stop': 291, 'bear_use_sma': False, 'bear_use_ema': False, 'bear_use_atr': True, 'bear_use_adx': False, 'bear_use_spike': True, 'bear_rsi_required': False, 'sideways_strategy': 'mean_reversion', 'sideways_bb_std_mult': 0.9272960189766742, 'sideways_rsi_os': 43, 'sideways_rsi_ob': 48, 'sideways_adx_thresh': 27.416123539476903, 'sideways_atr_min_pct': 0.026053349738078255, 'sideways_atr_max_pct': 0.09735923284266773, 'sideways_tp_mult': 1.640738809846206, 'sideways_tsl_mult': 0.13363521235200115, 'sideways_time_stop': 122, 'sideways_use_sma': False, 'sideways_use_ema': True, 'sideways_use_atr': False, 'sideways_use_adx': False, 'sideways_use_spike': True, 'sideways_rsi_required': False}.
[I 2025-08-31 11:21:52,933] Trial 711 finished with values: [-1000000000.0, 1000000000.0] and parameters: {'p_sma': 50, 'p_std': 9, 'p_atr': 27, 'p_adx': 15, 'rsi_period': 78, 'ema1': 6, 'ema2': 23, 'slip_atr_k': 0.1678341171394923, 'slip_spread_k': 0.4253308677378832, 'spread_hl_frac': 0.01998077899695915, 'bb_std_mult': 0.9540990208227698, 'rsi_os': 32, 'rsi_ob': 50, 'vol_spike': 0.08506982832524515, 'adx_thresh': 14.890822981149798, 'atr_min_pct': 0.007260354072585885, 'atr_max_pct': 0.06426205014777579, 'tp_mult': 2.880135900172793, 'tsl_mult': 0.14655022663897682, 'strategy': 'breakout', 'time_stop': 100, 'use_sma': True, 'use_atr': True, 'use_adx': False, 'use_ema': True, 'use_spike': False, 'rsi_required': False, 'edge_k': 0.41209933003504795, 'edge_cap': 0.7539480936993458, 'bull_strategy': 'mean_reversion', 'bull_bb_std_mult': 1.8284019455781153, 'bull_rsi_os': 35, 'bull_rsi_ob': 61, 'bull_adx_thresh': 26.861289977140668, 'bull_atr_min_pct': 0.027401415848970864, 'bull_atr_max_pct': 0.11249594475318907, 'bull_tp_mult': 1.8762840647174457, 'bull_tsl_mult': 0.3576211342274687, 'bull_time_stop': 44, 'bull_use_sma': False, 'bull_use_ema': True, 'bull_use_atr': False, 'bull_use_adx': False, 'bull_use_spike': False, 'bull_rsi_required': False, 'bear_strategy': 'mean_reversion', 'bear_bb_std_mult': 1.4997153747706264, 'bear_rsi_os': 51, 'bear_rsi_ob': 63, 'bear_adx_thresh': 9.997487582175992, 'bear_atr_min_pct': 0.010934766868596436, 'bear_atr_max_pct': 0.13311235070061705, 'bear_tp_mult': 2.6974856101129046, 'bear_tsl_mult': 0.2784265871787679, 'bear_time_stop': 106, 'bear_use_sma': True, 'bear_use_ema': False, 'bear_use_atr': True, 'bear_use_adx': True, 'bear_use_spike': True, 'bear_rsi_required': False, 'sideways_strategy': 'mean_reversion', 'sideways_bb_std_mult': 1.1602380830226053, 'sideways_rsi_os': 11, 'sideways_rsi_ob': 74, 'sideways_adx_thresh': 25.968059307760722, 'sideways_atr_min_pct': 0.02686090442308315, 'sideways_atr_max_pct': 0.10390763976325026, 'sideways_tp_mult': 1.5115631176995603, 'sideways_tsl_mult': 0.8344000269234677, 'sideways_time_stop': 35, 'sideways_use_sma': True, 'sideways_use_ema': True, 'sideways_use_atr': False, 'sideways_use_adx': True, 'sideways_use_spike': True, 'sideways_rsi_required': False}.
[I 2025-08-31 11:21:53,537] Trial 712 finished with values: [-1000000000.0, 1000000000.0] and parameters: {'p_sma': 35, 'p_std': 6, 'p_atr': 27, 'p_adx': 15, 'rsi_period': 33, 'ema1': 6, 'ema2': 26, 'slip_atr_k': 0.019483596154087134, 'slip_spread_k': 0.43455370862795323, 'spread_hl_frac': 0.04277339545495777, 'bb_std_mult': 0.6996311206049665, 'rsi_os': 33, 'rsi_ob': 63, 'vol_spike': 0.06741751261852685, 'adx_thresh': 28.468797771023745, 'atr_min_pct': 0.021636846813867763, 'atr_max_pct': 0.06423065911446142, 'tp_mult': 1.2049754319009618, 'tsl_mult': 0.13780548905231416, 'strategy': 'breakout', 'time_stop': 97, 'use_sma': True, 'use_atr': True, 'use_adx': False, 'use_ema': True, 'use_spike': False, 'rsi_required': False, 'edge_k': 1.5036350099219555, 'edge_cap': 0.7387851824175135, 'bull_strategy': 'mean_reversion', 'bull_bb_std_mult': 2.5273272599157917, 'bull_rsi_os': 15, 'bull_rsi_ob': 61, 'bull_adx_thresh': 26.73058510017054, 'bull_atr_min_pct': 0.013272036427787388, 'bull_atr_max_pct': 0.08379544969979495, 'bull_tp_mult': 1.9951124764551322, 'bull_tsl_mult': 0.3409366373474924, 'bull_time_stop': 44, 'bull_use_sma': False, 'bull_use_ema': True, 'bull_use_atr': False, 'bull_use_adx': False, 'bull_use_spike': False, 'bull_rsi_required': False, 'bear_strategy': 'mean_reversion', 'bear_bb_std_mult': 1.5221567156259392, 'bear_rsi_os': 50, 'bear_rsi_ob': 51, 'bear_adx_thresh': 9.845433067306827, 'bear_atr_min_pct': 0.010811714565851133, 'bear_atr_max_pct': 0.13228389819168948, 'bear_tp_mult': 2.7104615684501794, 'bear_tsl_mult': 0.5592719116892513, 'bear_time_stop': 145, 'bear_use_sma': True, 'bear_use_ema': False, 'bear_use_atr': True, 'bear_use_adx': True, 'bear_use_spike': True, 'bear_rsi_required': False, 'sideways_strategy': 'mean_reversion', 'sideways_bb_std_mult': 1.1910221050797076, 'sideways_rsi_os': 11, 'sideways_rsi_ob': 61, 'sideways_adx_thresh': 25.996614218086762, 'sideways_atr_min_pct': 0.023847974846487735, 'sideways_atr_max_pct': 0.06206227649285651, 'sideways_tp_mult': 2.4479620552839854, 'sideways_tsl_mult': 0.8448083596037644, 'sideways_time_stop': 160, 'sideways_use_sma': True, 'sideways_use_ema': True, 'sideways_use_atr': False, 'sideways_use_adx': True, 'sideways_use_spike': True, 'sideways_rsi_required': False}.
