[I 2025-08-31 10:51:44,895] Trial 486 finished with values: [-1000000000.0, 1000000000.0] and parameters: {'p_sma': 45, 'p_std': 38, 'p_atr': 23, 'p_adx': 19, 'rsi_period': 39, 'ema1': 22, 'ema2': 57, 'slip_atr_k': 0.0008189699262289376, 'slip_spread_k': 0.20652413315328505, 'spread_hl_frac': 0.024650334833808834, 'bb_std_mult': 2.654238699174635, 'rsi_os': 35, 'rsi_ob': 58, 'vol_spike': 0.22277927700367495, 'adx_thresh': 9.316258940087815, 'atr_min_pct': 0.013685869959705136, 'atr_max_pct': 0.03431921156238614, 'tp_mult': 2.4636065370634834, 'tsl_mult': 0.7162173280291402, 'strategy': 'mean_reversion', 'time_stop': 152, 'use_sma': False, 'use_atr': False, 'use_adx': False, 'use_ema': False, 'use_spike': False, 'rsi_required': False, 'edge_k': 1.7175425200036472, 'edge_cap': 0.24749225386934362, 'bull_strategy': 'breakout', 'bull_bb_std_mult': 3.485769997806706, 'bull_rsi_os': 35, 'bull_rsi_ob': 77, 'bull_adx_thresh': 9.280938472867707, 'bull_atr_min_pct': 0.02014924999540691, 'bull_atr_max_pct': 0.04661335714217844, 'bull_tp_mult': 2.9233291991422776, 'bull_tsl_mult': 0.9806682267488369, 'bull_time_stop': 61, 'bull_use_sma': False, 'bull_use_ema': True, 'bull_use_atr': False, 'bull_use_adx': True, 'bull_use_spike': False, 'bull_rsi_required': False, 'bear_strategy': 'mean_reversion', 'bear_bb_std_mult': 1.3705794072164657, 'bear_rsi_os': 23, 'bear_rsi_ob': 53, 'bear_adx_thresh': 14.243033116886753, 'bear_atr_min_pct': 0.02501494440951255, 'bear_atr_max_pct': 0.1327842738620656, 'bear_tp_mult': 2.820284921033482, 'bear_tsl_mult': 0.11709481173113606, 'bear_time_stop': 233, 'bear_use_sma': True, 'bear_use_ema': False, 'bear_use_atr': True, 'bear_use_adx': False, 'bear_use_spike': True, 'bear_rsi_required': True, 'sideways_strategy': 'mean_reversion', 'sideways_bb_std_mult': 2.59565446347501, 'sideways_rsi_os': 35, 'sideways_rsi_ob': 57, 'sideways_adx_thresh': 11.79921704447358, 'sideways_atr_min_pct': 0.00533003047844457, 'sideways_atr_max_pct': 0.022668368604900117, 'sideways_tp_mult': 1.8652965503787349, 'sideways_tsl_mult': 0.8616551616524004, 'sideways_time_stop': 264, 'sideways_use_sma': True, 'sideways_use_ema': False, 'sideways_use_atr': False, 'sideways_use_adx': True, 'sideways_use_spike': False, 'sideways_rsi_required': False}.
[I 2025-08-31 10:51:45,665] Trial 489 finished with values: [-1000000000.0, 1000000000.0] and parameters: {'p_sma': 41, 'p_std': 14, 'p_atr': 22, 'p_adx': 20, 'rsi_period': 37, 'ema1': 22, 'ema2': 41, 'slip_atr_k': 0.0011009290749076114, 'slip_spread_k': 0.31827088494254785, 'spread_hl_frac': 0.02458905985840477, 'bb_std_mult': 1.2237886721457185, 'rsi_os': 35, 'rsi_ob': 55, 'vol_spike': 0.038805307194289526, 'adx_thresh': 7.1443467100451725, 'atr_min_pct': 0.02076921602779772, 'atr_max_pct': 0.12418442497373475, 'tp_mult': 2.916392525839843, 'tsl_mult': 0.8717325431536986, 'strategy': 'mean_reversion', 'time_stop': 162, 'use_sma': False, 'use_atr': True, 'use_adx': False, 'use_ema': False, 'use_spike': False, 'rsi_required': False, 'edge_k': 1.7092598946163338, 'edge_cap': 0.24589947486262315, 'bull_strategy': 'breakout', 'bull_bb_std_mult': 3.2681836917936584, 'bull_rsi_os': 29, 'bull_rsi_ob': 94, 'bull_adx_thresh': 32.943890522133934, 'bull_atr_min_pct': 0.024087162842523005, 'bull_atr_max_pct': 0.04716567863306409, 'bull_tp_mult': 2.7542271356211403, 'bull_tsl_mult': 0.16645750458002292, 'bull_time_stop': 60, 'bull_use_sma': False, 'bull_use_ema': True, 'bull_use_atr': False, 'bull_use_adx': False, 'bull_use_spike': False, 'bull_rsi_required': False, 'bear_strategy': 'mean_reversion', 'bear_bb_std_mult': 1.43946659205586, 'bear_rsi_os': 21, 'bear_rsi_ob': 93, 'bear_adx_thresh': 13.759431561231905, 'bear_atr_min_pct': 0.026005157893579118, 'bear_atr_max_pct': 0.1405516397732744, 'bear_tp_mult': 2.8323462921379603, 'bear_tsl_mult': 0.88605476617191, 'bear_time_stop': 60, 'bear_use_sma': True, 'bear_use_ema': True, 'bear_use_atr': False, 'bear_use_adx': False, 'bear_use_spike': True, 'bear_rsi_required': False, 'sideways_strategy': 'mean_reversion', 'sideways_bb_std_mult': 0.5053143868247316, 'sideways_rsi_os': 16, 'sideways_rsi_ob': 55, 'sideways_adx_thresh': 6.198409795388972, 'sideways_atr_min_pct': 0.005341148600062977, 'sideways_atr_max_pct': 0.09931231497289067, 'sideways_tp_mult': 1.847051894745305, 'sideways_tsl_mult': 0.8661896320875628, 'sideways_time_stop': 104, 'sideways_use_sma': False, 'sideways_use_ema': False, 'sideways_use_atr': False, 'sideways_use_adx': True, 'sideways_use_spike': True, 'sideways_rsi_required': False}.
[I 2025-08-31 10:51:45,809] Trial 488 finished with values: [-1000000000.0, 1000000000.0] and parameters: {'p_sma': 40, 'p_std': 15, 'p_atr': 22, 'p_adx': 19, 'rsi_period': 39, 'ema1': 22, 'ema2': 45, 'slip_atr_k': 0.0007794159577972861, 'slip_spread_k': 0.3171436108020197, 'spread_hl_frac': 0.008756122550337989, 'bb_std_mult': 2.4780886361420733, 'rsi_os': 35, 'rsi_ob': 77, 'vol_spike': 0.15481880134711715, 'adx_thresh': 8.766670567050257, 'atr_min_pct': 0.0193364960188731, 'atr_max_pct': 0.03510538733565541, 'tp_mult': 1.9697872521045883, 'tsl_mult': 0.7094395504573404, 'strategy': 'mean_reversion', 'time_stop': 62, 'use_sma': False, 'use_atr': True, 'use_adx': False, 'use_ema': False, 'use_spike': False, 'rsi_required': False, 'edge_k': 1.7236157280470612, 'edge_cap': 0.31874272206458976, 'bull_strategy': 'breakout', 'bull_bb_std_mult': 3.26590180669096, 'bull_rsi_os': 43, 'bull_rsi_ob': 82, 'bull_adx_thresh': 10.048662370529996, 'bull_atr_min_pct': 0.018858973834996996, 'bull_atr_max_pct': 0.044875298562037744, 'bull_tp_mult': 2.9188433754178145, 'bull_tsl_mult': 0.09806885664013232, 'bull_time_stop': 61, 'bull_use_sma': False, 'bull_use_ema': True, 'bull_use_atr': False, 'bull_use_adx': False, 'bull_use_spike': True, 'bull_rsi_required': False, 'bear_strategy': 'mean_reversion', 'bear_bb_std_mult': 1.4587790374199363, 'bear_rsi_os': 22, 'bear_rsi_ob': 54, 'bear_adx_thresh': 14.219534254828334, 'bear_atr_min_pct': 0.026135789132528446, 'bear_atr_max_pct': 0.1377281582316192, 'bear_tp_mult': 1.2779908193326084, 'bear_tsl_mult': 0.315662600404526, 'bear_time_stop': 12, 'bear_use_sma': True, 'bear_use_ema': False, 'bear_use_atr': True, 'bear_use_adx': False, 'bear_use_spike': False, 'bear_rsi_required': False, 'sideways_strategy': 'mean_reversion', 'sideways_bb_std_mult': 2.578874572858171, 'sideways_rsi_os': 38, 'sideways_rsi_ob': 55, 'sideways_adx_thresh': 13.386774313998433, 'sideways_atr_min_pct': 0.005312548537169348, 'sideways_atr_max_pct': 0.08500587835376401, 'sideways_tp_mult': 1.8298925377211719, 'sideways_tsl_mult': 0.8605944564828191, 'sideways_time_stop': 262, 'sideways_use_sma': False, 'sideways_use_ema': False, 'sideways_use_atr': False, 'sideways_use_adx': True, 'sideways_use_spike': True, 'sideways_rsi_required': False}.
[I 2025-08-31 10:51:46,070] Trial 487 finished with values: [-1000000000.0, 1000000000.0] and parameters: {'p_sma': 47, 'p_std': 15, 'p_atr': 22, 'p_adx': 19, 'rsi_period': 39, 'ema1': 22, 'ema2': 45, 'slip_atr_k': 0.00015982028431285535, 'slip_spread_k': 0.3178446537697871, 'spread_hl_frac': 0.009033788180642831, 'bb_std_mult': 2.649790970911355, 'rsi_os': 35, 'rsi_ob': 58, 'vol_spike': 0.15722981941505648, 'adx_thresh': 29.48308670256356, 'atr_min_pct': 0.02086920320154702, 'atr_max_pct': 0.12916829316317022, 'tp_mult': 2.016062308893223, 'tsl_mult': 0.7165199347357725, 'strategy': 'mean_reversion', 'time_stop': 175, 'use_sma': False, 'use_atr': True, 'use_adx': False, 'use_ema': False, 'use_spike': False, 'rsi_required': False, 'edge_k': 1.8767267489820414, 'edge_cap': 0.16558373894646072, 'bull_strategy': 'breakout', 'bull_bb_std_mult': 3.487455416993424, 'bull_rsi_os': 50, 'bull_rsi_ob': 82, 'bull_adx_thresh': 9.233207386722118, 'bull_atr_min_pct': 0.020052718897636934, 'bull_atr_max_pct': 0.04587657430526949, 'bull_tp_mult': 2.91713845744912, 'bull_tsl_mult': 0.9699077650653786, 'bull_time_stop': 61, 'bull_use_sma': False, 'bull_use_ema': True, 'bull_use_atr': False, 'bull_use_adx': False, 'bull_use_spike': False, 'bull_rsi_required': False, 'bear_strategy': 'mean_reversion', 'bear_bb_std_mult': 1.4369377806995447, 'bear_rsi_os': 23, 'bear_rsi_ob': 54, 'bear_adx_thresh': 14.169962583220627, 'bear_atr_min_pct': 0.02510639616126546, 'bear_atr_max_pct': 0.13666845744804068, 'bear_tp_mult': 2.870772538128018, 'bear_tsl_mult': 0.07414433680040594, 'bear_time_stop': 126, 'bear_use_sma': True, 'bear_use_ema': False, 'bear_use_atr': True, 'bear_use_adx': False, 'bear_use_spike': True, 'bear_rsi_required': False, 'sideways_strategy': 'mean_reversion', 'sideways_bb_std_mult': 2.5921256843147944, 'sideways_rsi_os': 35, 'sideways_rsi_ob': 56, 'sideways_adx_thresh': 13.311566953918039, 'sideways_atr_min_pct': 0.0053248960800928065, 'sideways_atr_max_pct': 0.11349373310059407, 'sideways_tp_mult': 1.8401818722012522, 'sideways_tsl_mult': 0.6372168366585466, 'sideways_time_stop': 265, 'sideways_use_sma': False, 'sideways_use_ema': False, 'sideways_use_atr': False, 'sideways_use_adx': True, 'sideways_use_spike': True, 'sideways_rsi_required': False}.
[I 2025-08-31 10:52:17,149] Trial 493 finished with values: [-0.006402115923948792, 0.006540633137932993] and parameters: {'p_sma': 45, 'p_std': 36, 'p_atr': 21, 'p_adx': 20, 'rsi_period': 44, 'ema1': 22, 'ema2': 20, 'slip_atr_k': 0.006294422854589915, 'slip_spread_k': 0.12184513069003056, 'spread_hl_frac': 0.026100090342155786, 'bb_std_mult': 2.4885020457572513, 'rsi_os': 33, 'rsi_ob': 76, 'vol_spike': 0.012716796419750875, 'adx_thresh': 7.928172549369054, 'atr_min_pct': 0.019885509721954502, 'atr_max_pct': 0.021925044589121076, 'tp_mult': 2.1640602758815324, 'tsl_mult': 0.36196239367325683, 'strategy': 'mean_reversion', 'time_stop': 34, 'use_sma': False, 'use_atr': False, 'use_adx': False, 'use_ema': True, 'use_spike': False, 'rsi_required': False, 'edge_k': 1.759903796864426, 'edge_cap': 0.22732573741597972, 'bull_strategy': 'breakout', 'bull_bb_std_mult': 3.5370863171500466, 'bull_rsi_os': 43, 'bull_rsi_ob': 85, 'bull_adx_thresh': 11.339967816868551, 'bull_atr_min_pct': 0.003344883891084814, 'bull_atr_max_pct': 0.040840575397294306, 'bull_tp_mult': 2.8412128442366753, 'bull_tsl_mult': 0.14496868309590985, 'bull_time_stop': 70, 'bull_use_sma': False, 'bull_use_ema': False, 'bull_use_atr': False, 'bull_use_adx': True, 'bull_use_spike': True, 'bull_rsi_required': True, 'bear_strategy': 'breakout', 'bear_bb_std_mult': 1.1845826964286796, 'bear_rsi_os': 25, 'bear_rsi_ob': 52, 'bear_adx_thresh': 13.35839941431039, 'bear_atr_min_pct': 0.0234590445636039, 'bear_atr_max_pct': 0.13998670240545985, 'bear_tp_mult': 2.234847432829684, 'bear_tsl_mult': 0.09739798024803059, 'bear_time_stop': 76, 'bear_use_sma': False, 'bear_use_ema': True, 'bear_use_atr': False, 'bear_use_adx': False, 'bear_use_spike': True, 'bear_rsi_required': True, 'sideways_strategy': 'mean_reversion', 'sideways_bb_std_mult': 2.766441468100518, 'sideways_rsi_os': 45, 'sideways_rsi_ob': 57, 'sideways_adx_thresh': 23.851691504860035, 'sideways_atr_min_pct': 0.0072260862636497145, 'sideways_atr_max_pct': 0.012673932585076991, 'sideways_tp_mult': 1.9974776637284595, 'sideways_tsl_mult': 0.8861777537599158, 'sideways_time_stop': 254, 'sideways_use_sma': True, 'sideways_use_ema': False, 'sideways_use_atr': True, 'sideways_use_adx': False, 'sideways_use_spike': False, 'sideways_rsi_required': False}.
[I 2025-08-31 10:52:17,911] Trial 492 finished with values: [-1000000000.0, 1000000000.0] and parameters: {'p_sma': 47, 'p_std': 36, 'p_atr': 24, 'p_adx': 20, 'rsi_period': 38, 'ema1': 22, 'ema2': 47, 'slip_atr_k': 0.005438115636109817, 'slip_spread_k': 0.8408145490127423, 'spread_hl_frac': 0.02586876882990435, 'bb_std_mult': 1.8647792292286558, 'rsi_os': 33, 'rsi_ob': 95, 'vol_spike': 0.17999202679211737, 'adx_thresh': 29.29118850794935, 'atr_min_pct': 0.01868660716854697, 'atr_max_pct': 0.06570735234755097, 'tp_mult': 2.16951080308386, 'tsl_mult': 0.6824536593628887, 'strategy': 'mean_reversion', 'time_stop': 157, 'use_sma': False, 'use_atr': False, 'use_adx': False, 'use_ema': True, 'use_spike': False, 'rsi_required': False, 'edge_k': 0.4688254834652632, 'edge_cap': 0.16889215925409137, 'bull_strategy': 'breakout', 'bull_bb_std_mult': 3.5295739182803776, 'bull_rsi_os': 43, 'bull_rsi_ob': 87, 'bull_adx_thresh': 27.20900972791564, 'bull_atr_min_pct': 0.026604443667639834, 'bull_atr_max_pct': 0.04103167613194729, 'bull_tp_mult': 2.8501797841123104, 'bull_tsl_mult': 0.6597850045932263, 'bull_time_stop': 70, 'bull_use_sma': False, 'bull_use_ema': False, 'bull_use_atr': False, 'bull_use_adx': True, 'bull_use_spike': True, 'bull_rsi_required': True, 'bear_strategy': 'breakout', 'bear_bb_std_mult': 1.578475583775929, 'bear_rsi_os': 25, 'bear_rsi_ob': 49, 'bear_adx_thresh': 15.956105770564621, 'bear_atr_min_pct': 0.02410278386440299, 'bear_atr_max_pct': 0.136996585801448, 'bear_tp_mult': 2.2314877456496043, 'bear_tsl_mult': 0.095647104900091, 'bear_time_stop': 173, 'bear_use_sma': False, 'bear_use_ema': False, 'bear_use_atr': False, 'bear_use_adx': False, 'bear_use_spike': True, 'bear_rsi_required': True, 'sideways_strategy': 'mean_reversion', 'sideways_bb_std_mult': 1.0380707130258569, 'sideways_rsi_os': 45, 'sideways_rsi_ob': 57, 'sideways_adx_thresh': 27.074491624791083, 'sideways_atr_min_pct': 0.013312932128430129, 'sideways_atr_max_pct': 0.013267725211841497, 'sideways_tp_mult': 1.886662672665834, 'sideways_tsl_mult': 0.886996617449163, 'sideways_time_stop': 271, 'sideways_use_sma': True, 'sideways_use_ema': False, 'sideways_use_atr': True, 'sideways_use_adx': False, 'sideways_use_spike': True, 'sideways_rsi_required': False}.
[I 2025-08-31 10:52:17,987] Trial 491 finished with values: [-1000000000.0, 1000000000.0] and parameters: {'p_sma': 47, 'p_std': 36, 'p_atr': 22, 'p_adx': 20, 'rsi_period': 46, 'ema1': 22, 'ema2': 30, 'slip_atr_k': 0.006584772644813459, 'slip_spread_k': 0.3143285707710205, 'spread_hl_frac': 0.025766563408575333, 'bb_std_mult': 1.8560225093486356, 'rsi_os': 34, 'rsi_ob': 74, 'vol_spike': 0.013429376982427882, 'adx_thresh': 7.61539362033742, 'atr_min_pct': 0.018414212032364805, 'atr_max_pct': 0.041720608031116234, 'tp_mult': 2.165339994616908, 'tsl_mult': 0.6812290792078206, 'strategy': 'mean_reversion', 'time_stop': 51, 'use_sma': False, 'use_atr': True, 'use_adx': False, 'use_ema': True, 'use_spike': False, 'rsi_required': False, 'edge_k': 0.7408111277454865, 'edge_cap': 0.17371069677838266, 'bull_strategy': 'breakout', 'bull_bb_std_mult': 3.5177176963245174, 'bull_rsi_os': 43, 'bull_rsi_ob': 76, 'bull_adx_thresh': 10.022298055873211, 'bull_atr_min_pct': 0.018750484266227312, 'bull_atr_max_pct': 0.040111195316629746, 'bull_tp_mult': 2.8483885455458253, 'bull_tsl_mult': 0.9678827273713605, 'bull_time_stop': 69, 'bull_use_sma': False, 'bull_use_ema': False, 'bull_use_atr': False, 'bull_use_adx': False, 'bull_use_spike': True, 'bull_rsi_required': True, 'bear_strategy': 'breakout', 'bear_bb_std_mult': 1.6061389297674884, 'bear_rsi_os': 21, 'bear_rsi_ob': 52, 'bear_adx_thresh': 13.305257238503025, 'bear_atr_min_pct': 0.02351842406220552, 'bear_atr_max_pct': 0.13693990974564704, 'bear_tp_mult': 2.4239551174105296, 'bear_tsl_mult': 0.07528092337233436, 'bear_time_stop': 32, 'bear_use_sma': False, 'bear_use_ema': False, 'bear_use_atr': True, 'bear_use_adx': False, 'bear_use_spike': True, 'bear_rsi_required': False, 'sideways_strategy': 'mean_reversion', 'sideways_bb_std_mult': 2.6745150087885543, 'sideways_rsi_os': 45, 'sideways_rsi_ob': 57, 'sideways_adx_thresh': 26.62138934560175, 'sideways_atr_min_pct': 0.007223384301610002, 'sideways_atr_max_pct': 0.08968974746376106, 'sideways_tp_mult': 2.0867118720156563, 'sideways_tsl_mult': 0.9492435982407377, 'sideways_time_stop': 78, 'sideways_use_sma': False, 'sideways_use_ema': False, 'sideways_use_atr': True, 'sideways_use_adx': False, 'sideways_use_spike': True, 'sideways_rsi_required': False}.
[I 2025-08-31 10:52:18,243] Trial 490 finished with values: [-1000000000.0, 1000000000.0] and parameters: {'p_sma': 40, 'p_std': 53, 'p_atr': 22, 'p_adx': 20, 'rsi_period': 38, 'ema1': 22, 'ema2': 30, 'slip_atr_k': 0.0006345663992117956, 'slip_spread_k': 0.32096140416575974, 'spread_hl_frac': 0.02448027803454435, 'bb_std_mult': 1.8332175443130425, 'rsi_os': 35, 'rsi_ob': 77, 'vol_spike': 0.10035563026968844, 'adx_thresh': 29.444346199410237, 'atr_min_pct': 0.018666921978460562, 'atr_max_pct': 0.04140185780297429, 'tp_mult': 2.9255988437291207, 'tsl_mult': 0.6728859841583168, 'strategy': 'mean_reversion', 'time_stop': 241, 'use_sma': False, 'use_atr': True, 'use_adx': False, 'use_ema': False, 'use_spike': False, 'rsi_required': False, 'edge_k': 0.0804257463677458, 'edge_cap': 0.3171642103433715, 'bull_strategy': 'breakout', 'bull_bb_std_mult': 3.272777349185313, 'bull_rsi_os': 43, 'bull_rsi_ob': 76, 'bull_adx_thresh': 27.29179598431992, 'bull_atr_min_pct': 0.02640628427984349, 'bull_atr_max_pct': 0.04070609204024998, 'bull_tp_mult': 2.999795779596906, 'bull_tsl_mult': 0.16539881522191227, 'bull_time_stop': 69, 'bull_use_sma': False, 'bull_use_ema': False, 'bull_use_atr': False, 'bull_use_adx': False, 'bull_use_spike': True, 'bull_rsi_required': True, 'bear_strategy': 'breakout', 'bear_bb_std_mult': 1.5702971940056978, 'bear_rsi_os': 22, 'bear_rsi_ob': 54, 'bear_adx_thresh': 13.765105473354055, 'bear_atr_min_pct': 0.023550716747412194, 'bear_atr_max_pct': 0.13922464070656257, 'bear_tp_mult': 1.2925242031367281, 'bear_tsl_mult': 0.048363443029918574, 'bear_time_stop': 78, 'bear_use_sma': True, 'bear_use_ema': True, 'bear_use_atr': False, 'bear_use_adx': False, 'bear_use_spike': True, 'bear_rsi_required': False, 'sideways_strategy': 'mean_reversion', 'sideways_bb_std_mult': 2.6605653673980445, 'sideways_rsi_os': 18, 'sideways_rsi_ob': 56, 'sideways_adx_thresh': 26.69091911936819, 'sideways_atr_min_pct': 0.007297680902807371, 'sideways_atr_max_pct': 0.05390832658548202, 'sideways_tp_mult': 1.8458656640117908, 'sideways_tsl_mult': 0.05877496847689012, 'sideways_time_stop': 273, 'sideways_use_sma': False, 'sideways_use_ema': False, 'sideways_use_atr': True, 'sideways_use_adx': True, 'sideways_use_spike': True, 'sideways_rsi_required': False}.
[I 2025-08-31 10:52:49,663] Trial 495 finished with values: [-1000000000.0, 1000000000.0] and parameters: {'p_sma': 45, 'p_std': 51, 'p_atr': 21, 'p_adx': 20, 'rsi_period': 43, 'ema1': 21, 'ema2': 20, 'slip_atr_k': 0.015237695200026269, 'slip_spread_k': 0.9837509432390252, 'spread_hl_frac': 0.007187893213789213, 'bb_std_mult': 2.989038621896059, 'rsi_os': 36, 'rsi_ob': 72, 'vol_spike': 0.2162454808893526, 'adx_thresh': 10.121371050271582, 'atr_min_pct': 0.02243978291310536, 'atr_max_pct': 0.13967735683993707, 'tp_mult': 2.862378064555917, 'tsl_mult': 0.3640143412075626, 'strategy': 'mean_reversion', 'time_stop': 163, 'use_sma': False, 'use_atr': False, 'use_adx': False, 'use_ema': False, 'use_spike': False, 'rsi_required': False, 'edge_k': 1.360196641349539, 'edge_cap': 0.2181586997820255, 'bull_strategy': 'breakout', 'bull_bb_std_mult': 3.3671958437841485, 'bull_rsi_os': 45, 'bull_rsi_ob': 61, 'bull_adx_thresh': 11.566776293971934, 'bull_atr_min_pct': 0.005028512242981875, 'bull_atr_max_pct': 0.04211073285301889, 'bull_tp_mult': 2.9992530959220316, 'bull_tsl_mult': 0.31749738244984604, 'bull_time_stop': 46, 'bull_use_sma': False, 'bull_use_ema': True, 'bull_use_atr': False, 'bull_use_adx': True, 'bull_use_spike': True, 'bull_rsi_required': False, 'bear_strategy': 'breakout', 'bear_bb_std_mult': 1.1698867757659048, 'bear_rsi_os': 22, 'bear_rsi_ob': 56, 'bear_adx_thresh': 12.766657662921762, 'bear_atr_min_pct': 0.02711991625567026, 'bear_atr_max_pct': 0.14918402375091433, 'bear_tp_mult': 1.5543656547287183, 'bear_tsl_mult': 0.03974472362051752, 'bear_time_stop': 44, 'bear_use_sma': False, 'bear_use_ema': True, 'bear_use_atr': True, 'bear_use_adx': False, 'bear_use_spike': False, 'bear_rsi_required': True, 'sideways_strategy': 'mean_reversion', 'sideways_bb_std_mult': 3.521873240919421, 'sideways_rsi_os': 18, 'sideways_rsi_ob': 58, 'sideways_adx_thresh': 22.08374180731205, 'sideways_atr_min_pct': 0.004731097154353124, 'sideways_atr_max_pct': 0.05519925631165677, 'sideways_tp_mult': 1.9839463378261735, 'sideways_tsl_mult': 0.26868058146695073, 'sideways_time_stop': 253, 'sideways_use_sma': True, 'sideways_use_ema': False, 'sideways_use_atr': False, 'sideways_use_adx': False, 'sideways_use_spike': False, 'sideways_rsi_required': False}.
