[I 2025-08-31 10:35:59,143] Trial 361 finished with values: [-0.02341137070480559, 0.023407587635962006] and parameters: {'p_sma': 21, 'p_std': 33, 'p_atr': 13, 'p_adx': 29, 'rsi_period': 57, 'ema1': 12, 'ema2': 58, 'slip_atr_k': 0.1547929918202769, 'slip_spread_k': 0.7839939137006529, 'spread_hl_frac': 0.0430923810744464, 'bb_std_mult': 0.5021215871299511, 'rsi_os': 44, 'rsi_ob': 63, 'vol_spike': 0.21323016400045183, 'adx_thresh': 9.884743412722152, 'atr_min_pct': 0.004850389009874483, 'atr_max_pct': 0.14771801774014287, 'tp_mult': 2.0820700210784806, 'tsl_mult': 0.5736656223823294, 'strategy': 'mean_reversion', 'time_stop': 145, 'use_sma': True, 'use_atr': True, 'use_adx': False, 'use_ema': True, 'use_spike': True, 'rsi_required': True, 'edge_k': 1.1328610738451739, 'edge_cap': 0.27957165733922806, 'bull_strategy': 'breakout', 'bull_bb_std_mult': 2.159896530213568, 'bull_rsi_os': 41, 'bull_rsi_ob': 74, 'bull_adx_thresh': 28.817055630964894, 'bull_atr_min_pct': 0.007212619333561933, 'bull_atr_max_pct': 0.03382734335730088, 'bull_tp_mult': 2.314403501649059, 'bull_tsl_mult': 0.20160555075905284, 'bull_time_stop': 5, 'bull_use_sma': True, 'bull_use_ema': True, 'bull_use_atr': True, 'bull_use_adx': True, 'bull_use_spike': True, 'bull_rsi_required': False, 'bear_strategy': 'breakout', 'bear_bb_std_mult': 1.9944390585602216, 'bear_rsi_os': 37, 'bear_rsi_ob': 57, 'bear_adx_thresh': 14.511601020547324, 'bear_atr_min_pct': 0.0018015647015433688, 'bear_atr_max_pct': 0.03484906344995082, 'bear_tp_mult': 2.3244973590543534, 'bear_tsl_mult': 0.125575649874644, 'bear_time_stop': 25, 'bear_use_sma': True, 'bear_use_ema': False, 'bear_use_atr': True, 'bear_use_adx': False, 'bear_use_spike': True, 'bear_rsi_required': True, 'sideways_strategy': 'breakout', 'sideways_bb_std_mult': 2.6774103440035737, 'sideways_rsi_os': 34, 'sideways_rsi_ob': 58, 'sideways_adx_thresh': 20.483758551856766, 'sideways_atr_min_pct': 0.0033451528531446267, 'sideways_atr_max_pct': 0.010170993804516299, 'sideways_tp_mult': 2.215222837133237, 'sideways_tsl_mult': 0.2489104056513733, 'sideways_time_stop': 267, 'sideways_use_sma': True, 'sideways_use_ema': False, 'sideways_use_atr': False, 'sideways_use_adx': True, 'sideways_use_spike': True, 'sideways_rsi_required': True}.
[I 2025-08-31 10:35:59,782] Trial 359 finished with values: [-1000000000.0, 1000000000.0] and parameters: {'p_sma': 21, 'p_std': 36, 'p_atr': 17, 'p_adx': 10, 'rsi_period': 57, 'ema1': 12, 'ema2': 55, 'slip_atr_k': 0.06856912045754476, 'slip_spread_k': 0.5676850433220186, 'spread_hl_frac': 0.030269395190755263, 'bb_std_mult': 3.1046648146851634, 'rsi_os': 12, 'rsi_ob': 56, 'vol_spike': 0.18813205001663152, 'adx_thresh': 33.70686014406125, 'atr_min_pct': 0.025907779813720548, 'atr_max_pct': 0.12353262747049307, 'tp_mult': 1.2806769677684198, 'tsl_mult': 0.6866696975157898, 'strategy': 'mean_reversion', 'time_stop': 137, 'use_sma': False, 'use_atr': True, 'use_adx': True, 'use_ema': True, 'use_spike': True, 'rsi_required': True, 'edge_k': 1.2055518161449978, 'edge_cap': 0.16665496965599264, 'bull_strategy': 'mean_reversion', 'bull_bb_std_mult': 0.9110573587462194, 'bull_rsi_os': 43, 'bull_rsi_ob': 77, 'bull_adx_thresh': 28.841638149983538, 'bull_atr_min_pct': 0.007260487002561241, 'bull_atr_max_pct': 0.039616479730327475, 'bull_tp_mult': 1.7870959034318683, 'bull_tsl_mult': 0.10632012964103985, 'bull_time_stop': 5, 'bull_use_sma': True, 'bull_use_ema': True, 'bull_use_atr': True, 'bull_use_adx': True, 'bull_use_spike': True, 'bull_rsi_required': False, 'bear_strategy': 'breakout', 'bear_bb_std_mult': 2.473981140165543, 'bear_rsi_os': 37, 'bear_rsi_ob': 58, 'bear_adx_thresh': 7.874778342953451, 'bear_atr_min_pct': 0.017321865910824488, 'bear_atr_max_pct': 0.05994016014357895, 'bear_tp_mult': 2.535285027366166, 'bear_tsl_mult': 0.13363424837083382, 'bear_time_stop': 6, 'bear_use_sma': True, 'bear_use_ema': True, 'bear_use_atr': True, 'bear_use_adx': False, 'bear_use_spike': True, 'bear_rsi_required': False, 'sideways_strategy': 'breakout', 'sideways_bb_std_mult': 0.6785125313433031, 'sideways_rsi_os': 35, 'sideways_rsi_ob': 88, 'sideways_adx_thresh': 13.201117906037224, 'sideways_atr_min_pct': 0.0038073542744966496, 'sideways_atr_max_pct': 0.05235426547418888, 'sideways_tp_mult': 1.2896102491413644, 'sideways_tsl_mult': 0.7213174897144061, 'sideways_time_stop': 98, 'sideways_use_sma': True, 'sideways_use_ema': True, 'sideways_use_atr': False, 'sideways_use_adx': True, 'sideways_use_spike': True, 'sideways_rsi_required': False}.
[I 2025-08-31 10:35:59,987] Trial 360 finished with values: [-1000000000.0, 1000000000.0] and parameters: {'p_sma': 21, 'p_std': 36, 'p_atr': 13, 'p_adx': 10, 'rsi_period': 57, 'ema1': 15, 'ema2': 59, 'slip_atr_k': 0.07663555878275137, 'slip_spread_k': 0.7815404100495573, 'spread_hl_frac': 0.030655350872037405, 'bb_std_mult': 1.1692720459988521, 'rsi_os': 12, 'rsi_ob': 76, 'vol_spike': 0.20297186425231475, 'adx_thresh': 15.126255246273754, 'atr_min_pct': 0.02574179347306675, 'atr_max_pct': 0.03536590535643944, 'tp_mult': 2.807779096549341, 'tsl_mult': 0.11146998147497583, 'strategy': 'mean_reversion', 'time_stop': 132, 'use_sma': True, 'use_atr': True, 'use_adx': True, 'use_ema': True, 'use_spike': True, 'rsi_required': True, 'edge_k': 1.7217226419091975, 'edge_cap': 0.6515931609955183, 'bull_strategy': 'breakout', 'bull_bb_std_mult': 1.033121510622671, 'bull_rsi_os': 43, 'bull_rsi_ob': 75, 'bull_adx_thresh': 8.720602052644935, 'bull_atr_min_pct': 0.028449815058795777, 'bull_atr_max_pct': 0.07501083062207331, 'bull_tp_mult': 1.7828953603872861, 'bull_tsl_mult': 0.1496584338415839, 'bull_time_stop': 49, 'bull_use_sma': True, 'bull_use_ema': True, 'bull_use_atr': True, 'bull_use_adx': True, 'bull_use_spike': True, 'bull_rsi_required': False, 'bear_strategy': 'breakout', 'bear_bb_std_mult': 2.098011330639934, 'bear_rsi_os': 33, 'bear_rsi_ob': 76, 'bear_adx_thresh': 14.705268408458089, 'bear_atr_min_pct': 0.017300849882978562, 'bear_atr_max_pct': 0.1441601364863221, 'bear_tp_mult': 1.950154024091882, 'bear_tsl_mult': 0.6619682081773954, 'bear_time_stop': 25, 'bear_use_sma': True, 'bear_use_ema': False, 'bear_use_atr': True, 'bear_use_adx': False, 'bear_use_spike': True, 'bear_rsi_required': True, 'sideways_strategy': 'breakout', 'sideways_bb_std_mult': 1.6324866886108513, 'sideways_rsi_os': 34, 'sideways_rsi_ob': 84, 'sideways_adx_thresh': 13.200780137037007, 'sideways_atr_min_pct': 0.003917165830245171, 'sideways_atr_max_pct': 0.06704154842383259, 'sideways_tp_mult': 1.2982147130213046, 'sideways_tsl_mult': 0.7258758158809046, 'sideways_time_stop': 99, 'sideways_use_sma': True, 'sideways_use_ema': True, 'sideways_use_atr': False, 'sideways_use_adx': True, 'sideways_use_spike': True, 'sideways_rsi_required': True}.
[I 2025-08-31 10:36:00,870] Trial 363 finished with values: [-1000000000.0, 1000000000.0] and parameters: {'p_sma': 19, 'p_std': 32, 'p_atr': 19, 'p_adx': 29, 'rsi_period': 57, 'ema1': 11, 'ema2': 58, 'slip_atr_k': 0.09630304568830053, 'slip_spread_k': 0.9668475292928251, 'spread_hl_frac': 0.017915722825594012, 'bb_std_mult': 0.5097351591255121, 'rsi_os': 44, 'rsi_ob': 45, 'vol_spike': 0.2031072884641153, 'adx_thresh': 10.125600579624837, 'atr_min_pct': 0.005144563021029277, 'atr_max_pct': 0.03522506260232746, 'tp_mult': 2.498757203865155, 'tsl_mult': 0.5786667010441614, 'strategy': 'breakout', 'time_stop': 294, 'use_sma': True, 'use_atr': True, 'use_adx': True, 'use_ema': True, 'use_spike': True, 'rsi_required': True, 'edge_k': 1.2014784635470568, 'edge_cap': 0.16671582304823718, 'bull_strategy': 'breakout', 'bull_bb_std_mult': 0.9375791133116611, 'bull_rsi_os': 42, 'bull_rsi_ob': 51, 'bull_adx_thresh': 8.933619590479529, 'bull_atr_min_pct': 0.0182541820498444, 'bull_atr_max_pct': 0.033990943326931596, 'bull_tp_mult': 2.687229825557014, 'bull_tsl_mult': 0.11012209144210501, 'bull_time_stop': 38, 'bull_use_sma': True, 'bull_use_ema': True, 'bull_use_atr': True, 'bull_use_adx': True, 'bull_use_spike': True, 'bull_rsi_required': False, 'bear_strategy': 'breakout', 'bear_bb_std_mult': 1.0425361893853242, 'bear_rsi_os': 31, 'bear_rsi_ob': 78, 'bear_adx_thresh': 7.686091507689736, 'bear_atr_min_pct': 0.01747718428838837, 'bear_atr_max_pct': 0.1290741262137984, 'bear_tp_mult': 1.666668545973487, 'bear_tsl_mult': 0.1267318620711133, 'bear_time_stop': 34, 'bear_use_sma': True, 'bear_use_ema': False, 'bear_use_atr': True, 'bear_use_adx': False, 'bear_use_spike': True, 'bear_rsi_required': True, 'sideways_strategy': 'breakout', 'sideways_bb_std_mult': 1.6052371000916827, 'sideways_rsi_os': 34, 'sideways_rsi_ob': 45, 'sideways_adx_thresh': 31.775879971058885, 'sideways_atr_min_pct': 0.0032519599202384423, 'sideways_atr_max_pct': 0.06775873431520787, 'sideways_tp_mult': 1.3079352567962075, 'sideways_tsl_mult': 0.9572037703476605, 'sideways_time_stop': 93, 'sideways_use_sma': False, 'sideways_use_ema': True, 'sideways_use_atr': True, 'sideways_use_adx': True, 'sideways_use_spike': True, 'sideways_rsi_required': True}.
[I 2025-08-31 10:36:31,676] Trial 367 finished with values: [-0.02712714517583137, 0.02712450155976885] and parameters: {'p_sma': 19, 'p_std': 39, 'p_atr': 15, 'p_adx': 9, 'rsi_period': 49, 'ema1': 13, 'ema2': 29, 'slip_atr_k': 0.0855177119513949, 'slip_spread_k': 0.9406468753858046, 'spread_hl_frac': 0.02750859993646021, 'bb_std_mult': 1.9738840808615254, 'rsi_os': 40, 'rsi_ob': 73, 'vol_spike': 0.21847099887079963, 'adx_thresh': 8.64421591654229, 'atr_min_pct': 0.018003163589534934, 'atr_max_pct': 0.05021589110803177, 'tp_mult': 2.749461953427046, 'tsl_mult': 0.8144719929360527, 'strategy': 'breakout', 'time_stop': 146, 'use_sma': False, 'use_atr': False, 'use_adx': True, 'use_ema': False, 'use_spike': True, 'rsi_required': False, 'edge_k': 0.5292915477551575, 'edge_cap': 0.12603826739261526, 'bull_strategy': 'breakout', 'bull_bb_std_mult': 1.068542982374272, 'bull_rsi_os': 23, 'bull_rsi_ob': 49, 'bull_adx_thresh': 10.176034664435456, 'bull_atr_min_pct': 0.0020241882645223672, 'bull_atr_max_pct': 0.08477115740751942, 'bull_tp_mult': 1.236713144959102, 'bull_tsl_mult': 0.059563288779496515, 'bull_time_stop': 182, 'bull_use_sma': False, 'bull_use_ema': False, 'bull_use_atr': False, 'bull_use_adx': True, 'bull_use_spike': False, 'bull_rsi_required': True, 'bear_strategy': 'mean_reversion', 'bear_bb_std_mult': 2.2138353396500854, 'bear_rsi_os': 25, 'bear_rsi_ob': 55, 'bear_adx_thresh': 5.573918209249269, 'bear_atr_min_pct': 0.020333328662932033, 'bear_atr_max_pct': 0.12133362249850589, 'bear_tp_mult': 2.808280893704924, 'bear_tsl_mult': 0.10052093980376782, 'bear_time_stop': 175, 'bear_use_sma': False, 'bear_use_ema': False, 'bear_use_atr': True, 'bear_use_adx': False, 'bear_use_spike': False, 'bear_rsi_required': True, 'sideways_strategy': 'mean_reversion', 'sideways_bb_std_mult': 2.3817331123569145, 'sideways_rsi_os': 35, 'sideways_rsi_ob': 90, 'sideways_adx_thresh': 14.321562801171572, 'sideways_atr_min_pct': 0.0018183420554693502, 'sideways_atr_max_pct': 0.015395026492749365, 'sideways_tp_mult': 2.0752405191876706, 'sideways_tsl_mult': 0.8316363767625459, 'sideways_time_stop': 276, 'sideways_use_sma': False, 'sideways_use_ema': False, 'sideways_use_atr': True, 'sideways_use_adx': False, 'sideways_use_spike': True, 'sideways_rsi_required': False}.
[I 2025-08-31 10:36:32,379] Trial 366 finished with values: [-0.009296200088137474, 0.009302162602546746] and parameters: {'p_sma': 10, 'p_std': 32, 'p_atr': 19, 'p_adx': 20, 'rsi_period': 27, 'ema1': 5, 'ema2': 40, 'slip_atr_k': 0.096832049720665, 'slip_spread_k': 0.9604048345046732, 'spread_hl_frac': 0.028267005930894904, 'bb_std_mult': 1.703646259207102, 'rsi_os': 15, 'rsi_ob': 72, 'vol_spike': 0.007328899210913731, 'adx_thresh': 17.75360845989934, 'atr_min_pct': 0.018088601656867903, 'atr_max_pct': 0.036352863181071636, 'tp_mult': 2.749658090867825, 'tsl_mult': 0.65486185773096, 'strategy': 'breakout', 'time_stop': 129, 'use_sma': False, 'use_atr': False, 'use_adx': True, 'use_ema': False, 'use_spike': True, 'rsi_required': False, 'edge_k': 0.2819726352402997, 'edge_cap': 0.5443347557418458, 'bull_strategy': 'breakout', 'bull_bb_std_mult': 2.5918246833292877, 'bull_rsi_os': 42, 'bull_rsi_ob': 45, 'bull_adx_thresh': 10.03889314581145, 'bull_atr_min_pct': 0.021197781963093007, 'bull_atr_max_pct': 0.07115555986361746, 'bull_tp_mult': 2.9634465996586963, 'bull_tsl_mult': 0.47651785472972086, 'bull_time_stop': 38, 'bull_use_sma': False, 'bull_use_ema': False, 'bull_use_atr': False, 'bull_use_adx': True, 'bull_use_spike': False, 'bull_rsi_required': True, 'bear_strategy': 'mean_reversion', 'bear_bb_std_mult': 2.2067269800547935, 'bear_rsi_os': 47, 'bear_rsi_ob': 50, 'bear_adx_thresh': 5.937238730397642, 'bear_atr_min_pct': 0.019683587197297958, 'bear_atr_max_pct': 0.1286057000239214, 'bear_tp_mult': 2.9983973701025404, 'bear_tsl_mult': 0.1560901718231271, 'bear_time_stop': 175, 'bear_use_sma': False, 'bear_use_ema': False, 'bear_use_atr': True, 'bear_use_adx': False, 'bear_use_spike': False, 'bear_rsi_required': True, 'sideways_strategy': 'mean_reversion', 'sideways_bb_std_mult': 2.3757008290597117, 'sideways_rsi_os': 33, 'sideways_rsi_ob': 51, 'sideways_adx_thresh': 31.418306566793614, 'sideways_atr_min_pct': 0.0018120664622946453, 'sideways_atr_max_pct': 0.022834789575360233, 'sideways_tp_mult': 1.4366635661417266, 'sideways_tsl_mult': 0.8350960254710822, 'sideways_time_stop': 85, 'sideways_use_sma': False, 'sideways_use_ema': False, 'sideways_use_atr': True, 'sideways_use_adx': False, 'sideways_use_spike': True, 'sideways_rsi_required': False}.
[I 2025-08-31 10:36:32,560] Trial 365 finished with values: [-0.026823295939983782, 0.02691529632728857] and parameters: {'p_sma': 50, 'p_std': 37, 'p_atr': 28, 'p_adx': 24, 'rsi_period': 27, 'ema1': 11, 'ema2': 57, 'slip_atr_k': 0.050086851396395196, 'slip_spread_k': 0.9395942887337867, 'spread_hl_frac': 0.027951934131294702, 'bb_std_mult': 1.7189742293855725, 'rsi_os': 40, 'rsi_ob': 76, 'vol_spike': 0.20482263876370618, 'adx_thresh': 14.943644255682333, 'atr_min_pct': 0.012258159271185565, 'atr_max_pct': 0.03693318739527902, 'tp_mult': 2.7554842993736606, 'tsl_mult': 0.8218820234853388, 'strategy': 'breakout', 'time_stop': 130, 'use_sma': False, 'use_atr': False, 'use_adx': True, 'use_ema': False, 'use_spike': True, 'rsi_required': False, 'edge_k': 1.7115374478810503, 'edge_cap': 0.15450994804858498, 'bull_strategy': 'breakout', 'bull_bb_std_mult': 1.288781307130748, 'bull_rsi_os': 42, 'bull_rsi_ob': 68, 'bull_adx_thresh': 10.203811424365085, 'bull_atr_min_pct': 0.0019488962572572243, 'bull_atr_max_pct': 0.07424903112053077, 'bull_tp_mult': 1.306496232876126, 'bull_tsl_mult': 0.8804715083703707, 'bull_time_stop': 181, 'bull_use_sma': False, 'bull_use_ema': True, 'bull_use_atr': False, 'bull_use_adx': True, 'bull_use_spike': False, 'bull_rsi_required': False, 'bear_strategy': 'breakout', 'bear_bb_std_mult': 2.2225543403162593, 'bear_rsi_os': 47, 'bear_rsi_ob': 54, 'bear_adx_thresh': 5.8909815619598245, 'bear_atr_min_pct': 0.019918929868420775, 'bear_atr_max_pct': 0.12743481572696141, 'bear_tp_mult': 2.620358710468405, 'bear_tsl_mult': 0.6695855723902652, 'bear_time_stop': 34, 'bear_use_sma': False, 'bear_use_ema': False, 'bear_use_atr': True, 'bear_use_adx': False, 'bear_use_spike': False, 'bear_rsi_required': True, 'sideways_strategy': 'mean_reversion', 'sideways_bb_std_mult': 2.4923540876106074, 'sideways_rsi_os': 33, 'sideways_rsi_ob': 91, 'sideways_adx_thresh': 14.378227537744856, 'sideways_atr_min_pct': 0.014899718319219976, 'sideways_atr_max_pct': 0.06744415215006273, 'sideways_tp_mult': 1.3101765989776541, 'sideways_tsl_mult': 0.5370809135754011, 'sideways_time_stop': 83, 'sideways_use_sma': False, 'sideways_use_ema': False, 'sideways_use_atr': True, 'sideways_use_adx': False, 'sideways_use_spike': True, 'sideways_rsi_required': False}.
[I 2025-08-31 10:36:32,795] Trial 364 finished with values: [-1000000000.0, 1000000000.0] and parameters: {'p_sma': 19, 'p_std': 32, 'p_atr': 16, 'p_adx': 9, 'rsi_period': 27, 'ema1': 5, 'ema2': 22, 'slip_atr_k': 0.09686194740663129, 'slip_spread_k': 0.3162685087797634, 'spread_hl_frac': 0.028152558760110455, 'bb_std_mult': 2.3181140046265236, 'rsi_os': 43, 'rsi_ob': 66, 'vol_spike': 0.007762400457929836, 'adx_thresh': 8.724017930714531, 'atr_min_pct': 0.0278602196770958, 'atr_max_pct': 0.03647470515706975, 'tp_mult': 2.7551852393977057, 'tsl_mult': 0.7327878722022797, 'strategy': 'breakout', 'time_stop': 88, 'use_sma': False, 'use_atr': False, 'use_adx': True, 'use_ema': False, 'use_spike': True, 'rsi_required': False, 'edge_k': 0.524980584581766, 'edge_cap': 0.5360642228722987, 'bull_strategy': 'breakout', 'bull_bb_std_mult': 1.1530435327983566, 'bull_rsi_os': 42, 'bull_rsi_ob': 51, 'bull_adx_thresh': 8.88942379279374, 'bull_atr_min_pct': 0.028694395719945184, 'bull_atr_max_pct': 0.09312670443077661, 'bull_tp_mult': 1.6151479983141392, 'bull_tsl_mult': 0.11287717981172461, 'bull_time_stop': 157, 'bull_use_sma': True, 'bull_use_ema': True, 'bull_use_atr': True, 'bull_use_adx': True, 'bull_use_spike': True, 'bull_rsi_required': False, 'bear_strategy': 'breakout', 'bear_bb_std_mult': 1.0464536679566925, 'bear_rsi_os': 25, 'bear_rsi_ob': 65, 'bear_adx_thresh': 7.6834527424373364, 'bear_atr_min_pct': 0.019295139223350095, 'bear_atr_max_pct': 0.12784506525245828, 'bear_tp_mult': 2.0189386893945573, 'bear_tsl_mult': 0.09223982384176777, 'bear_time_stop': 35, 'bear_use_sma': False, 'bear_use_ema': False, 'bear_use_atr': True, 'bear_use_adx': False, 'bear_use_spike': True, 'bear_rsi_required': False, 'sideways_strategy': 'mean_reversion', 'sideways_bb_std_mult': 2.375024911612366, 'sideways_rsi_os': 33, 'sideways_rsi_ob': 82, 'sideways_adx_thresh': 13.143829079289242, 'sideways_atr_min_pct': 0.002851455076330862, 'sideways_atr_max_pct': 0.03792290736824776, 'sideways_tp_mult': 1.3001744218265046, 'sideways_tsl_mult': 0.8374205671870598, 'sideways_time_stop': 69, 'sideways_use_sma': False, 'sideways_use_ema': True, 'sideways_use_atr': True, 'sideways_use_adx': False, 'sideways_use_spike': True, 'sideways_rsi_required': False}.
[I 2025-08-31 10:36:33,321] Trial 368 finished with values: [-1000000000.0, 1000000000.0] and parameters: {'p_sma': 50, 'p_std': 14, 'p_atr': 18, 'p_adx': 17, 'rsi_period': 25, 'ema1': 8, 'ema2': 57, 'slip_atr_k': 0.05305851599947821, 'slip_spread_k': 0.33785937112404063, 'spread_hl_frac': 0.03656212329374857, 'bb_std_mult': 2.84223117835593, 'rsi_os': 54, 'rsi_ob': 54, 'vol_spike': 0.09538273189041727, 'adx_thresh': 8.227962642220662, 'atr_min_pct': 0.020631598567103206, 'atr_max_pct': 0.13121803044286257, 'tp_mult': 2.7046085964381894, 'tsl_mult': 0.6544284182605367, 'strategy': 'mean_reversion', 'time_stop': 89, 'use_sma': False, 'use_atr': False, 'use_adx': False, 'use_ema': False, 'use_spike': True, 'rsi_required': False, 'edge_k': 0.27618638515363847, 'edge_cap': 0.8668905756806824, 'bull_strategy': 'breakout', 'bull_bb_std_mult': 1.2733710320432605, 'bull_rsi_os': 44, 'bull_rsi_ob': 70, 'bull_adx_thresh': 14.611040396938101, 'bull_atr_min_pct': 0.025940670961030487, 'bull_atr_max_pct': 0.09489943446641486, 'bull_tp_mult': 2.5698797608637918, 'bull_tsl_mult': 0.08640142104915595, 'bull_time_stop': 154, 'bull_use_sma': True, 'bull_use_ema': True, 'bull_use_atr': True, 'bull_use_adx': False, 'bull_use_spike': True, 'bull_rsi_required': False, 'bear_strategy': 'breakout', 'bear_bb_std_mult': 2.0237430306670876, 'bear_rsi_os': 34, 'bear_rsi_ob': 54, 'bear_adx_thresh': 6.904403241692062, 'bear_atr_min_pct': 0.00024920797700046966, 'bear_atr_max_pct': 0.13310110858662802, 'bear_tp_mult': 2.61657176535706, 'bear_tsl_mult': 0.03412479370985799, 'bear_time_stop': 148, 'bear_use_sma': False, 'bear_use_ema': False, 'bear_use_atr': True, 'bear_use_adx': True, 'bear_use_spike': True, 'bear_rsi_required': False, 'sideways_strategy': 'mean_reversion', 'sideways_bb_std_mult': 2.5775472984376355, 'sideways_rsi_os': 33, 'sideways_rsi_ob': 83, 'sideways_adx_thresh': 23.56101870892371, 'sideways_atr_min_pct': 0.01499359654800839, 'sideways_atr_max_pct': 0.01762498729574487, 'sideways_tp_mult': 1.457746778585658, 'sideways_tsl_mult': 0.4874224349196054, 'sideways_time_stop': 108, 'sideways_use_sma': True, 'sideways_use_ema': False, 'sideways_use_atr': False, 'sideways_use_adx': False, 'sideways_use_spike': True, 'sideways_rsi_required': False}.
