[I 2025-08-31 10:14:51,602] Trial 181 finished with values: [-0.0206409188715726, 0.0201994353456426] and parameters: {'p_sma': 54, 'p_std': 33, 'p_atr': 7, 'p_adx': 10, 'rsi_period': 25, 'ema1': 11, 'ema2': 17, 'slip_atr_k': 0.20130969417249348, 'slip_spread_k': 0.44417480901513406, 'spread_hl_frac': 0.004452409683144495, 'bb_std_mult': 0.9381370645694054, 'rsi_os': 7, 'rsi_ob': 74, 'vol_spike': 0.2328854950219864, 'adx_thresh': 7.393040100478372, 'atr_min_pct': 0.025584548091061803, 'atr_max_pct': 0.056014016508266117, 'tp_mult': 1.1482061357261202, 'tsl_mult': 0.6443793764810549, 'strategy': 'breakout', 'time_stop': 76, 'use_sma': False, 'use_atr': False, 'use_adx': False, 'use_ema': False, 'use_spike': True, 'rsi_required': True, 'edge_k': 0.9878023888018405, 'edge_cap': 0.26308515934982135, 'bull_strategy': 'mean_reversion', 'bull_bb_std_mult': 0.9530082620410574, 'bull_rsi_os': 52, 'bull_rsi_ob': 50, 'bull_adx_thresh': 10.96543266636961, 'bull_atr_min_pct': 0.0030330748627746475, 'bull_atr_max_pct': 0.13333341661851533, 'bull_tp_mult': 1.1536129877975494, 'bull_tsl_mult': 0.639657982988033, 'bull_time_stop': 265, 'bull_use_sma': True, 'bull_use_ema': False, 'bull_use_atr': True, 'bull_use_adx': True, 'bull_use_spike': True, 'bull_rsi_required': True, 'bear_strategy': 'breakout', 'bear_bb_std_mult': 3.59346829465379, 'bear_rsi_os': 31, 'bear_rsi_ob': 51, 'bear_adx_thresh': 16.908463313242972, 'bear_atr_min_pct': 0.018460521089929845, 'bear_atr_max_pct': 0.14292088204883435, 'bear_tp_mult': 1.5856041752013863, 'bear_tsl_mult': 0.4212082679592722, 'bear_time_stop': 14, 'bear_use_sma': False, 'bear_use_ema': True, 'bear_use_atr': True, 'bear_use_adx': True, 'bear_use_spike': True, 'bear_rsi_required': True, 'sideways_strategy': 'breakout', 'sideways_bb_std_mult': 1.0412938144980917, 'sideways_rsi_os': 39, 'sideways_rsi_ob': 74, 'sideways_adx_thresh': 14.305865383108195, 'sideways_atr_min_pct': 0.02849548862558736, 'sideways_atr_max_pct': 0.1283243650048152, 'sideways_tp_mult': 1.1375589163462783, 'sideways_tsl_mult': 0.17380029395558522, 'sideways_time_stop': 232, 'sideways_use_sma': True, 'sideways_use_ema': False, 'sideways_use_atr': False, 'sideways_use_adx': False, 'sideways_use_spike': True, 'sideways_rsi_required': False}.
[I 2025-08-31 10:14:51,773] Trial 179 finished with values: [-0.01655827855674774, 0.016208838490590443] and parameters: {'p_sma': 19, 'p_std': 33, 'p_atr': 11, 'p_adx': 10, 'rsi_period': 25, 'ema1': 11, 'ema2': 17, 'slip_atr_k': 0.21522300901935437, 'slip_spread_k': 0.28049864628336707, 'spread_hl_frac': 0.004567239900455125, 'bb_std_mult': 0.8089892125950581, 'rsi_os': 40, 'rsi_ob': 71, 'vol_spike': 0.2330119743644423, 'adx_thresh': 7.376514442663558, 'atr_min_pct': 0.009239951563598355, 'atr_max_pct': 0.05544963812488168, 'tp_mult': 2.694794421026867, 'tsl_mult': 0.6420970195838882, 'strategy': 'breakout', 'time_stop': 114, 'use_sma': False, 'use_atr': False, 'use_adx': False, 'use_ema': False, 'use_spike': True, 'rsi_required': True, 'edge_k': 0.27915823672538465, 'edge_cap': 0.3473036774634464, 'bull_strategy': 'mean_reversion', 'bull_bb_std_mult': 0.9564411964957615, 'bull_rsi_os': 18, 'bull_rsi_ob': 58, 'bull_adx_thresh': 13.742047833463097, 'bull_atr_min_pct': 0.00313929618703708, 'bull_atr_max_pct': 0.13148829707052212, 'bull_tp_mult': 1.1508079582625317, 'bull_tsl_mult': 0.12083548677675691, 'bull_time_stop': 24, 'bull_use_sma': True, 'bull_use_ema': False, 'bull_use_atr': True, 'bull_use_adx': True, 'bull_use_spike': True, 'bull_rsi_required': True, 'bear_strategy': 'breakout', 'bear_bb_std_mult': 1.9183479397884209, 'bear_rsi_os': 36, 'bear_rsi_ob': 57, 'bear_adx_thresh': 19.303654827963353, 'bear_atr_min_pct': 0.009434876040533693, 'bear_atr_max_pct': 0.10793291250891546, 'bear_tp_mult': 1.5974435265890095, 'bear_tsl_mult': 0.25082075286583005, 'bear_time_stop': 18, 'bear_use_sma': False, 'bear_use_ema': True, 'bear_use_atr': True, 'bear_use_adx': True, 'bear_use_spike': True, 'bear_rsi_required': True, 'sideways_strategy': 'breakout', 'sideways_bb_std_mult': 1.334065346390063, 'sideways_rsi_os': 40, 'sideways_rsi_ob': 74, 'sideways_adx_thresh': 14.053727402921186, 'sideways_atr_min_pct': 0.028357873548987157, 'sideways_atr_max_pct': 0.12788400481407966, 'sideways_tp_mult': 1.0726179528388597, 'sideways_tsl_mult': 0.0037183502373867583, 'sideways_time_stop': 35, 'sideways_use_sma': True, 'sideways_use_ema': False, 'sideways_use_atr': False, 'sideways_use_adx': False, 'sideways_use_spike': True, 'sideways_rsi_required': False}.
[I 2025-08-31 10:14:51,856] Trial 182 finished with values: [-0.010978137301080326, 0.010710041746032364] and parameters: {'p_sma': 25, 'p_std': 50, 'p_atr': 22, 'p_adx': 9, 'rsi_period': 19, 'ema1': 11, 'ema2': 30, 'slip_atr_k': 0.21662721920566433, 'slip_spread_k': 0.27276988423732645, 'spread_hl_frac': 0.0037346730638583648, 'bb_std_mult': 0.9378527476442244, 'rsi_os': 41, 'rsi_ob': 71, 'vol_spike': 0.19863225132461787, 'adx_thresh': 7.374409270578766, 'atr_min_pct': 0.00012718708117417585, 'atr_max_pct': 0.055345609626668055, 'tp_mult': 2.933565006360939, 'tsl_mult': 0.6687318331012879, 'strategy': 'breakout', 'time_stop': 74, 'use_sma': True, 'use_atr': False, 'use_adx': False, 'use_ema': False, 'use_spike': True, 'rsi_required': True, 'edge_k': 1.803324972504223, 'edge_cap': 0.2645594541063581, 'bull_strategy': 'mean_reversion', 'bull_bb_std_mult': 0.9486251912113489, 'bull_rsi_os': 52, 'bull_rsi_ob': 59, 'bull_adx_thresh': 13.67157239410109, 'bull_atr_min_pct': 0.0032103085608406793, 'bull_atr_max_pct': 0.07494639829150528, 'bull_tp_mult': 1.1383313323394064, 'bull_tsl_mult': 0.6340353843246648, 'bull_time_stop': 254, 'bull_use_sma': True, 'bull_use_ema': False, 'bull_use_atr': True, 'bull_use_adx': True, 'bull_use_spike': True, 'bull_rsi_required': True, 'bear_strategy': 'breakout', 'bear_bb_std_mult': 3.559882681578194, 'bear_rsi_os': 24, 'bear_rsi_ob': 51, 'bear_adx_thresh': 19.32935152212285, 'bear_atr_min_pct': 0.009434374792916148, 'bear_atr_max_pct': 0.12348956980643479, 'bear_tp_mult': 1.232073899265698, 'bear_tsl_mult': 0.20773968896222406, 'bear_time_stop': 12, 'bear_use_sma': False, 'bear_use_ema': True, 'bear_use_atr': True, 'bear_use_adx': True, 'bear_use_spike': True, 'bear_rsi_required': True, 'sideways_strategy': 'breakout', 'sideways_bb_std_mult': 3.021711425629001, 'sideways_rsi_os': 11, 'sideways_rsi_ob': 63, 'sideways_adx_thresh': 15.783988057274282, 'sideways_atr_min_pct': 0.028612106069768897, 'sideways_atr_max_pct': 0.12216479164874748, 'sideways_tp_mult': 1.1329994069327833, 'sideways_tsl_mult': 0.15314011547342582, 'sideways_time_stop': 33, 'sideways_use_sma': True, 'sideways_use_ema': False, 'sideways_use_atr': False, 'sideways_use_adx': False, 'sideways_use_spike': True, 'sideways_rsi_required': False}.
[I 2025-08-31 10:15:23,552] Trial 184 finished with values: [-1000000000.0, 1000000000.0] and parameters: {'p_sma': 18, 'p_std': 35, 'p_atr': 15, 'p_adx': 17, 'rsi_period': 19, 'ema1': 12, 'ema2': 12, 'slip_atr_k': 0.18236162168295586, 'slip_spread_k': 0.21619930235268783, 'spread_hl_frac': 0.0033305314771576422, 'bb_std_mult': 1.7633112783646303, 'rsi_os': 49, 'rsi_ob': 73, 'vol_spike': 0.19978296450738894, 'adx_thresh': 8.689320237831723, 'atr_min_pct': 9.167725757118841e-05, 'atr_max_pct': 0.06391199872176416, 'tp_mult': 2.681015363308597, 'tsl_mult': 0.7491247074869001, 'strategy': 'breakout', 'time_stop': 47, 'use_sma': True, 'use_atr': False, 'use_adx': True, 'use_ema': False, 'use_spike': False, 'rsi_required': True, 'edge_k': 0.2505368989999198, 'edge_cap': 0.34953158627302094, 'bull_strategy': 'mean_reversion', 'bull_bb_std_mult': 1.0498979393558252, 'bull_rsi_os': 9, 'bull_rsi_ob': 58, 'bull_adx_thresh': 11.88911841539011, 'bull_atr_min_pct': 0.013190321370401561, 'bull_atr_max_pct': 0.07323258653067213, 'bull_tp_mult': 1.1153884253634059, 'bull_tsl_mult': 0.00117410550382252, 'bull_time_stop': 5, 'bull_use_sma': True, 'bull_use_ema': True, 'bull_use_atr': True, 'bull_use_adx': True, 'bull_use_spike': True, 'bull_rsi_required': False, 'bear_strategy': 'breakout', 'bear_bb_std_mult': 1.9276858347089088, 'bear_rsi_os': 31, 'bear_rsi_ob': 57, 'bear_adx_thresh': 19.37576041929768, 'bear_atr_min_pct': 0.009278913651115654, 'bear_atr_max_pct': 0.12348572938337865, 'bear_tp_mult': 2.618414199848558, 'bear_tsl_mult': 0.7892039775894083, 'bear_time_stop': 23, 'bear_use_sma': False, 'bear_use_ema': False, 'bear_use_atr': True, 'bear_use_adx': False, 'bear_use_spike': True, 'bear_rsi_required': True, 'sideways_strategy': 'breakout', 'sideways_bb_std_mult': 1.2690281511374641, 'sideways_rsi_os': 11, 'sideways_rsi_ob': 66, 'sideways_adx_thresh': 14.475776296034653, 'sideways_atr_min_pct': 0.027688404349182138, 'sideways_atr_max_pct': 0.12272808980346087, 'sideways_tp_mult': 1.331984643185893, 'sideways_tsl_mult': 0.30082604988826644, 'sideways_time_stop': 38, 'sideways_use_sma': True, 'sideways_use_ema': True, 'sideways_use_atr': False, 'sideways_use_adx': False, 'sideways_use_spike': False, 'sideways_rsi_required': True}.
[I 2025-08-31 10:15:23,983] Trial 185 finished with values: [-1000000000.0, 1000000000.0] and parameters: {'p_sma': 18, 'p_std': 38, 'p_atr': 15, 'p_adx': 9, 'rsi_period': 20, 'ema1': 12, 'ema2': 30, 'slip_atr_k': 0.18259817396361683, 'slip_spread_k': 0.2123649515606399, 'spread_hl_frac': 0.00215851756339038, 'bb_std_mult': 2.2564684038942806, 'rsi_os': 41, 'rsi_ob': 90, 'vol_spike': 0.1998790046361273, 'adx_thresh': 25.932396080130253, 'atr_min_pct': 0.00832538909970632, 'atr_max_pct': 0.018618796232702406, 'tp_mult': 2.6850499998540607, 'tsl_mult': 0.9667218836475389, 'strategy': 'breakout', 'time_stop': 121, 'use_sma': True, 'use_atr': False, 'use_adx': True, 'use_ema': False, 'use_spike': False, 'rsi_required': True, 'edge_k': 1.85223596514225, 'edge_cap': 0.6101044068901414, 'bull_strategy': 'mean_reversion', 'bull_bb_std_mult': 1.061374627781594, 'bull_rsi_os': 9, 'bull_rsi_ob': 62, 'bull_adx_thresh': 12.529714252749237, 'bull_atr_min_pct': 0.01769075024317795, 'bull_atr_max_pct': 0.07473798915048316, 'bull_tp_mult': 1.0503305696791667, 'bull_tsl_mult': 0.04022413203936133, 'bull_time_stop': 218, 'bull_use_sma': True, 'bull_use_ema': True, 'bull_use_atr': True, 'bull_use_adx': True, 'bull_use_spike': True, 'bull_rsi_required': False, 'bear_strategy': 'breakout', 'bear_bb_std_mult': 3.102778577459568, 'bear_rsi_os': 31, 'bear_rsi_ob': 59, 'bear_adx_thresh': 17.38490431130323, 'bear_atr_min_pct': 0.0209700274282247, 'bear_atr_max_pct': 0.12485047771493608, 'bear_tp_mult': 1.2297068037428702, 'bear_tsl_mult': 0.8966052838824705, 'bear_time_stop': 24, 'bear_use_sma': False, 'bear_use_ema': False, 'bear_use_atr': False, 'bear_use_adx': False, 'bear_use_spike': True, 'bear_rsi_required': True, 'sideways_strategy': 'breakout', 'sideways_bb_std_mult': 1.2626242082215984, 'sideways_rsi_os': 11, 'sideways_rsi_ob': 66, 'sideways_adx_thresh': 15.7405636840425, 'sideways_atr_min_pct': 0.025155829079277266, 'sideways_atr_max_pct': 0.1050427902904331, 'sideways_tp_mult': 1.3383471956056268, 'sideways_tsl_mult': 0.14281819950807945, 'sideways_time_stop': 11, 'sideways_use_sma': True, 'sideways_use_ema': True, 'sideways_use_atr': True, 'sideways_use_adx': False, 'sideways_use_spike': False, 'sideways_rsi_required': True}.
[I 2025-08-31 10:15:24,136] Trial 186 finished with values: [-1000000000.0, 1000000000.0] and parameters: {'p_sma': 50, 'p_std': 35, 'p_atr': 15, 'p_adx': 12, 'rsi_period': 19, 'ema1': 12, 'ema2': 12, 'slip_atr_k': 0.13939438957162653, 'slip_spread_k': 0.2168253654379937, 'spread_hl_frac': 0.003487373229500604, 'bb_std_mult': 0.7073965141174435, 'rsi_os': 49, 'rsi_ob': 73, 'vol_spike': 0.1995579030146873, 'adx_thresh': 33.38544211868393, 'atr_min_pct': 0.008204134181362021, 'atr_max_pct': 0.028525456562026576, 'tp_mult': 2.693779023532089, 'tsl_mult': 0.3763081780532106, 'strategy': 'breakout', 'time_stop': 123, 'use_sma': True, 'use_atr': False, 'use_adx': True, 'use_ema': False, 'use_spike': False, 'rsi_required': True, 'edge_k': 0.5316533827161449, 'edge_cap': 0.6158975437777257, 'bull_strategy': 'mean_reversion', 'bull_bb_std_mult': 1.7091333873981254, 'bull_rsi_os': 9, 'bull_rsi_ob': 73, 'bull_adx_thresh': 11.7260718241309, 'bull_atr_min_pct': 0.025400322952076865, 'bull_atr_max_pct': 0.07398548426223447, 'bull_tp_mult': 1.0922747684614742, 'bull_tsl_mult': 0.0026152172834912127, 'bull_time_stop': 252, 'bull_use_sma': True, 'bull_use_ema': False, 'bull_use_atr': True, 'bull_use_adx': True, 'bull_use_spike': True, 'bull_rsi_required': True, 'bear_strategy': 'breakout', 'bear_bb_std_mult': 2.1714454091562945, 'bear_rsi_os': 24, 'bear_rsi_ob': 59, 'bear_adx_thresh': 17.067547630474124, 'bear_atr_min_pct': 0.011076621470175574, 'bear_atr_max_pct': 0.13214523640312226, 'bear_tp_mult': 1.7015083801471977, 'bear_tsl_mult': 0.2157017666513435, 'bear_time_stop': 29, 'bear_use_sma': False, 'bear_use_ema': False, 'bear_use_atr': False, 'bear_use_adx': False, 'bear_use_spike': True, 'bear_rsi_required': True, 'sideways_strategy': 'breakout', 'sideways_bb_std_mult': 3.599884976424999, 'sideways_rsi_os': 11, 'sideways_rsi_ob': 66, 'sideways_adx_thresh': 21.211729754769593, 'sideways_atr_min_pct': 0.02612171769250514, 'sideways_atr_max_pct': 0.1214977065403803, 'sideways_tp_mult': 1.1773642618368163, 'sideways_tsl_mult': 0.3047421929796152, 'sideways_time_stop': 11, 'sideways_use_sma': True, 'sideways_use_ema': True, 'sideways_use_atr': True, 'sideways_use_adx': False, 'sideways_use_spike': False, 'sideways_rsi_required': True}.
[I 2025-08-31 10:15:24,216] Trial 183 finished with values: [-0.018044493440569798, 0.01771564566482905] and parameters: {'p_sma': 26, 'p_std': 38, 'p_atr': 15, 'p_adx': 9, 'rsi_period': 19, 'ema1': 11, 'ema2': 12, 'slip_atr_k': 0.24238089849741506, 'slip_spread_k': 0.21797489022578725, 'spread_hl_frac': 0.025990382863879728, 'bb_std_mult': 0.7842717066978335, 'rsi_os': 7, 'rsi_ob': 83, 'vol_spike': 0.23438914774847916, 'adx_thresh': 7.395886186889063, 'atr_min_pct': 0.00011613823146219837, 'atr_max_pct': 0.05456670997324289, 'tp_mult': 2.6869759633702, 'tsl_mult': 0.6576692241336245, 'strategy': 'breakout', 'time_stop': 53, 'use_sma': True, 'use_atr': False, 'use_adx': False, 'use_ema': False, 'use_spike': False, 'rsi_required': True, 'edge_k': 0.2778843233236662, 'edge_cap': 0.35076376071752147, 'bull_strategy': 'mean_reversion', 'bull_bb_std_mult': 0.8814711204041354, 'bull_rsi_os': 52, 'bull_rsi_ob': 49, 'bull_adx_thresh': 13.834213601623638, 'bull_atr_min_pct': 0.0029433772574007245, 'bull_atr_max_pct': 0.07564259688585726, 'bull_tp_mult': 1.1178602605533954, 'bull_tsl_mult': 0.9855684956768086, 'bull_time_stop': 263, 'bull_use_sma': True, 'bull_use_ema': False, 'bull_use_atr': True, 'bull_use_adx': True, 'bull_use_spike': True, 'bull_rsi_required': True, 'bear_strategy': 'breakout', 'bear_bb_std_mult': 3.572359681484982, 'bear_rsi_os': 31, 'bear_rsi_ob': 51, 'bear_adx_thresh': 19.2405580951228, 'bear_atr_min_pct': 0.009395866903564, 'bear_atr_max_pct': 0.14258983542519665, 'bear_tp_mult': 1.6007529900426787, 'bear_tsl_mult': 0.21016524769866154, 'bear_time_stop': 21, 'bear_use_sma': False, 'bear_use_ema': True, 'bear_use_atr': True, 'bear_use_adx': True, 'bear_use_spike': True, 'bear_rsi_required': True, 'sideways_strategy': 'breakout', 'sideways_bb_std_mult': 2.2340726108561233, 'sideways_rsi_os': 10, 'sideways_rsi_ob': 63, 'sideways_adx_thresh': 30.2185575073911, 'sideways_atr_min_pct': 0.029368162010762713, 'sideways_atr_max_pct': 0.12499158059261326, 'sideways_tp_mult': 1.0724647885743446, 'sideways_tsl_mult': 0.30300423666496423, 'sideways_time_stop': 37, 'sideways_use_sma': True, 'sideways_use_ema': True, 'sideways_use_atr': False, 'sideways_use_adx': False, 'sideways_use_spike': False, 'sideways_rsi_required': True}.
[I 2025-08-31 10:15:24,663] Trial 190 finished with values: [-1000000000.0, 1000000000.0] and parameters: {'p_sma': 20, 'p_std': 53, 'p_atr': 22, 'p_adx': 12, 'rsi_period': 14, 'ema1': 13, 'ema2': 23, 'slip_atr_k': 0.20991725467204547, 'slip_spread_k': 0.19212928041012028, 'spread_hl_frac': 0.04515671323838193, 'bb_std_mult': 2.7070205251463815, 'rsi_os': 9, 'rsi_ob': 49, 'vol_spike': 0.22057793844455548, 'adx_thresh': 10.960184800542715, 'atr_min_pct': 0.010313700464019764, 'atr_max_pct': 0.050923929527637656, 'tp_mult': 2.3958582957477654, 'tsl_mult': 0.7180755973387033, 'strategy': 'mean_reversion', 'time_stop': 113, 'use_sma': True, 'use_atr': True, 'use_adx': True, 'use_ema': True, 'use_spike': False, 'rsi_required': True, 'edge_k': 1.7688588196040154, 'edge_cap': 0.39921604656530035, 'bull_strategy': 'mean_reversion', 'bull_bb_std_mult': 2.320993538172734, 'bull_rsi_os': 11, 'bull_rsi_ob': 72, 'bull_adx_thresh': 21.5594111159038, 'bull_atr_min_pct': 0.014004437045044248, 'bull_atr_max_pct': 0.07902055546425513, 'bull_tp_mult': 1.0576313625729408, 'bull_tsl_mult': 0.5271608219372298, 'bull_time_stop': 19, 'bull_use_sma': False, 'bull_use_ema': False, 'bull_use_atr': False, 'bull_use_adx': True, 'bull_use_spike': True, 'bull_rsi_required': True, 'bear_strategy': 'mean_reversion', 'bear_bb_std_mult': 0.587664382050435, 'bear_rsi_os': 39, 'bear_rsi_ob': 61, 'bear_adx_thresh': 16.08721738818099, 'bear_atr_min_pct': 0.00785433675426657, 'bear_atr_max_pct': 0.12856510888456504, 'bear_tp_mult': 1.0129994990787172, 'bear_tsl_mult': 0.7465644123156836, 'bear_time_stop': 10, 'bear_use_sma': False, 'bear_use_ema': False, 'bear_use_atr': True, 'bear_use_adx': False, 'bear_use_spike': True, 'bear_rsi_required': True, 'sideways_strategy': 'breakout', 'sideways_bb_std_mult': 1.1993829558320357, 'sideways_rsi_os': 9, 'sideways_rsi_ob': 93, 'sideways_adx_thresh': 16.099683037870577, 'sideways_atr_min_pct': 0.026931180793944524, 'sideways_atr_max_pct': 0.09118323634008842, 'sideways_tp_mult': 1.7136684894007232, 'sideways_tsl_mult': 0.3524300581938472, 'sideways_time_stop': 17, 'sideways_use_sma': True, 'sideways_use_ema': True, 'sideways_use_atr': False, 'sideways_use_adx': False, 'sideways_use_spike': False, 'sideways_rsi_required': True}.
[I 2025-08-31 10:15:54,386] Trial 189 finished with values: [-0.021266984491117524, 0.021045042889104835] and parameters: {'p_sma': 38, 'p_std': 37, 'p_atr': 16, 'p_adx': 11, 'rsi_period': 27, 'ema1': 13, 'ema2': 10, 'slip_atr_k': 0.20226966592006193, 'slip_spread_k': 0.2654464275317537, 'spread_hl_frac': 0.02000751109827069, 'bb_std_mult': 0.7778495962403122, 'rsi_os': 44, 'rsi_ob': 49, 'vol_spike': 0.06095649533548296, 'adx_thresh': 6.314710081612969, 'atr_min_pct': 0.01049069447892192, 'atr_max_pct': 0.050693438009428556, 'tp_mult': 2.4109378881972763, 'tsl_mult': 0.674075435066793, 'strategy': 'breakout', 'time_stop': 136, 'use_sma': True, 'use_atr': True, 'use_adx': True, 'use_ema': True, 'use_spike': False, 'rsi_required': True, 'edge_k': 1.155508752910647, 'edge_cap': 0.39603311351248, 'bull_strategy': 'mean_reversion', 'bull_bb_std_mult': 0.895411308844982, 'bull_rsi_os': 7, 'bull_rsi_ob': 72, 'bull_adx_thresh': 13.14929685908306, 'bull_atr_min_pct': 0.0024094388022482334, 'bull_atr_max_pct': 0.06915273221038795, 'bull_tp_mult': 1.213615468700875, 'bull_tsl_mult': 0.04291923069121283, 'bull_time_stop': 139, 'bull_use_sma': False, 'bull_use_ema': False, 'bull_use_atr': False, 'bull_use_adx': True, 'bull_use_spike': True, 'bull_rsi_required': True, 'bear_strategy': 'mean_reversion', 'bear_bb_std_mult': 0.5998637751779408, 'bear_rsi_os': 18, 'bear_rsi_ob': 52, 'bear_adx_thresh': 18.242333100051965, 'bear_atr_min_pct': 0.007858391139351339, 'bear_atr_max_pct': 0.11421224488180608, 'bear_tp_mult': 2.522964524776656, 'bear_tsl_mult': 0.1271720068135001, 'bear_time_stop': 11, 'bear_use_sma': False, 'bear_use_ema': False, 'bear_use_atr': True, 'bear_use_adx': False, 'bear_use_spike': True, 'bear_rsi_required': True, 'sideways_strategy': 'breakout', 'sideways_bb_std_mult': 3.041092119853892, 'sideways_rsi_os': 10, 'sideways_rsi_ob': 63, 'sideways_adx_thresh': 30.591433217947117, 'sideways_atr_min_pct': 0.027134464586067365, 'sideways_atr_max_pct': 0.015466697961863285, 'sideways_tp_mult': 1.1276915642968637, 'sideways_tsl_mult': 0.3513861087916556, 'sideways_time_stop': 255, 'sideways_use_sma': True, 'sideways_use_ema': True, 'sideways_use_atr': False, 'sideways_use_adx': False, 'sideways_use_spike': False, 'sideways_rsi_required': True}.
