[I 2025-08-31 11:19:36,742] Trial 696 finished with values: [-1000000000.0, 1000000000.0] and parameters: {'p_sma': 57, 'p_std': 28, 'p_atr': 29, 'p_adx': 21, 'rsi_period': 38, 'ema1': 6, 'ema2': 47, 'slip_atr_k': 0.018977721396442156, 'slip_spread_k': 0.4301241131862624, 'spread_hl_frac': 0.037173122937601485, 'bb_std_mult': 0.5568699685395315, 'rsi_os': 29, 'rsi_ob': 83, 'vol_spike': 0.2894585549282659, 'adx_thresh': 10.039829390163526, 'atr_min_pct': 0.022048785701105383, 'atr_max_pct': 0.054842060859049045, 'tp_mult': 1.4925197661956346, 'tsl_mult': 0.13932405671304904, 'strategy': 'breakout', 'time_stop': 68, 'use_sma': True, 'use_atr': True, 'use_adx': False, 'use_ema': True, 'use_spike': False, 'rsi_required': False, 'edge_k': 1.587039938236213, 'edge_cap': 0.9630269933114926, 'bull_strategy': 'mean_reversion', 'bull_bb_std_mult': 1.7909631245847017, 'bull_rsi_os': 43, 'bull_rsi_ob': 62, 'bull_adx_thresh': 25.280013342149058, 'bull_atr_min_pct': 0.011040921025094385, 'bull_atr_max_pct': 0.02433366738912852, 'bull_tp_mult': 2.998401975169893, 'bull_tsl_mult': 0.46748845857539983, 'bull_time_stop': 57, 'bull_use_sma': False, 'bull_use_ema': True, 'bull_use_atr': False, 'bull_use_adx': True, 'bull_use_spike': False, 'bull_rsi_required': True, 'bear_strategy': 'mean_reversion', 'bear_bb_std_mult': 2.722548017382417, 'bear_rsi_os': 16, 'bear_rsi_ob': 64, 'bear_adx_thresh': 20.05135026784977, 'bear_atr_min_pct': 0.005668483715826391, 'bear_atr_max_pct': 0.08810806228107983, 'bear_tp_mult': 2.752426590458839, 'bear_tsl_mult': 0.8794500420225906, 'bear_time_stop': 96, 'bear_use_sma': True, 'bear_use_ema': True, 'bear_use_atr': True, 'bear_use_adx': False, 'bear_use_spike': False, 'bear_rsi_required': False, 'sideways_strategy': 'mean_reversion', 'sideways_bb_std_mult': 1.0657449290644287, 'sideways_rsi_os': 8, 'sideways_rsi_ob': 62, 'sideways_adx_thresh': 26.47764997197026, 'sideways_atr_min_pct': 0.02847983628548735, 'sideways_atr_max_pct': 0.10246606817540943, 'sideways_tp_mult': 1.5908626587163464, 'sideways_tsl_mult': 0.8757560070194101, 'sideways_time_stop': 174, 'sideways_use_sma': True, 'sideways_use_ema': True, 'sideways_use_atr': False, 'sideways_use_adx': True, 'sideways_use_spike': False, 'sideways_rsi_required': False}.
[I 2025-08-31 11:19:37,475] Trial 693 finished with values: [-1000000000.0, 1000000000.0] and parameters: {'p_sma': 34, 'p_std': 14, 'p_atr': 28, 'p_adx': 22, 'rsi_period': 29, 'ema1': 18, 'ema2': 11, 'slip_atr_k': 0.15030090953889713, 'slip_spread_k': 0.459727634762903, 'spread_hl_frac': 0.022131429840648982, 'bb_std_mult': 0.683020592028127, 'rsi_os': 31, 'rsi_ob': 84, 'vol_spike': 0.2860585809829237, 'adx_thresh': 10.671700657943566, 'atr_min_pct': 0.020638702403628216, 'atr_max_pct': 0.12272506390423972, 'tp_mult': 2.961169736088939, 'tsl_mult': 0.11601121757423244, 'strategy': 'breakout', 'time_stop': 82, 'use_sma': True, 'use_atr': True, 'use_adx': False, 'use_ema': True, 'use_spike': False, 'rsi_required': False, 'edge_k': 0.9296354303187481, 'edge_cap': 0.7184451209573186, 'bull_strategy': 'mean_reversion', 'bull_bb_std_mult': 1.3842911446861876, 'bull_rsi_os': 32, 'bull_rsi_ob': 62, 'bull_adx_thresh': 26.074329841894542, 'bull_atr_min_pct': 0.012947746947200118, 'bull_atr_max_pct': 0.029115293347454142, 'bull_tp_mult': 2.813556609930467, 'bull_tsl_mult': 0.21597983117979588, 'bull_time_stop': 57, 'bull_use_sma': False, 'bull_use_ema': True, 'bull_use_atr': False, 'bull_use_adx': True, 'bull_use_spike': False, 'bull_rsi_required': False, 'bear_strategy': 'mean_reversion', 'bear_bb_std_mult': 1.5575228146329057, 'bear_rsi_os': 6, 'bear_rsi_ob': 84, 'bear_adx_thresh': 10.658545690947621, 'bear_atr_min_pct': 0.013695264693169937, 'bear_atr_max_pct': 0.022664085683280724, 'bear_tp_mult': 2.7558215876513983, 'bear_tsl_mult': 0.8578182517373983, 'bear_time_stop': 96, 'bear_use_sma': False, 'bear_use_ema': True, 'bear_use_atr': True, 'bear_use_adx': False, 'bear_use_spike': False, 'bear_rsi_required': False, 'sideways_strategy': 'mean_reversion', 'sideways_bb_std_mult': 0.9676110620576184, 'sideways_rsi_os': 5, 'sideways_rsi_ob': 69, 'sideways_adx_thresh': 25.11822479237741, 'sideways_atr_min_pct': 0.0048219579453231765, 'sideways_atr_max_pct': 0.12079348831803902, 'sideways_tp_mult': 2.4903415440104926, 'sideways_tsl_mult': 0.8753014687126323, 'sideways_time_stop': 176, 'sideways_use_sma': True, 'sideways_use_ema': True, 'sideways_use_atr': False, 'sideways_use_adx': False, 'sideways_use_spike': True, 'sideways_rsi_required': False}.
[I 2025-08-31 11:19:37,648] Trial 695 finished with values: [-1000000000.0, 1000000000.0] and parameters: {'p_sma': 57, 'p_std': 13, 'p_atr': 14, 'p_adx': 21, 'rsi_period': 29, 'ema1': 6, 'ema2': 18, 'slip_atr_k': 0.15113236439199493, 'slip_spread_k': 0.47750962043673306, 'spread_hl_frac': 0.019993249989681747, 'bb_std_mult': 0.5457905130370841, 'rsi_os': 25, 'rsi_ob': 83, 'vol_spike': 0.047914838964702916, 'adx_thresh': 21.76166545044739, 'atr_min_pct': 0.009927045922228196, 'atr_max_pct': 0.0665880045256901, 'tp_mult': 2.249734820777536, 'tsl_mult': 0.12330776624351439, 'strategy': 'breakout', 'time_stop': 82, 'use_sma': True, 'use_atr': True, 'use_adx': False, 'use_ema': True, 'use_spike': False, 'rsi_required': False, 'edge_k': 1.6036093585689615, 'edge_cap': 0.9676666336844453, 'bull_strategy': 'mean_reversion', 'bull_bb_std_mult': 0.635781523269318, 'bull_rsi_os': 43, 'bull_rsi_ob': 62, 'bull_adx_thresh': 25.83634132293516, 'bull_atr_min_pct': 0.011052713022119253, 'bull_atr_max_pct': 0.03603598290224032, 'bull_tp_mult': 2.9627458067800805, 'bull_tsl_mult': 0.21752018202449533, 'bull_time_stop': 58, 'bull_use_sma': False, 'bull_use_ema': True, 'bull_use_atr': False, 'bull_use_adx': True, 'bull_use_spike': False, 'bull_rsi_required': False, 'bear_strategy': 'mean_reversion', 'bear_bb_std_mult': 1.5398826429572738, 'bear_rsi_os': 41, 'bear_rsi_ob': 55, 'bear_adx_thresh': 8.816085566973186, 'bear_atr_min_pct': 0.012023153020101582, 'bear_atr_max_pct': 0.08719833928333975, 'bear_tp_mult': 1.3472930582869498, 'bear_tsl_mult': 0.8826997930181004, 'bear_time_stop': 95, 'bear_use_sma': True, 'bear_use_ema': True, 'bear_use_atr': True, 'bear_use_adx': False, 'bear_use_spike': False, 'bear_rsi_required': False, 'sideways_strategy': 'mean_reversion', 'sideways_bb_std_mult': 1.017269065795969, 'sideways_rsi_os': 19, 'sideways_rsi_ob': 62, 'sideways_adx_thresh': 26.592500519197394, 'sideways_atr_min_pct': 0.004879279349807598, 'sideways_atr_max_pct': 0.10439615645828178, 'sideways_tp_mult': 1.572843555253336, 'sideways_tsl_mult': 0.17966189628394796, 'sideways_time_stop': 176, 'sideways_use_sma': True, 'sideways_use_ema': True, 'sideways_use_atr': False, 'sideways_use_adx': True, 'sideways_use_spike': True, 'sideways_rsi_required': False}.
[I 2025-08-31 11:19:37,906] Trial 694 finished with values: [-1000000000.0, 1000000000.0] and parameters: {'p_sma': 33, 'p_std': 47, 'p_atr': 28, 'p_adx': 21, 'rsi_period': 56, 'ema1': 9, 'ema2': 37, 'slip_atr_k': 0.02788475242000884, 'slip_spread_k': 0.4282715690980138, 'spread_hl_frac': 0.004576092796264378, 'bb_std_mult': 0.6483929369303686, 'rsi_os': 30, 'rsi_ob': 54, 'vol_spike': 0.2697893146809721, 'adx_thresh': 10.593444319519108, 'atr_min_pct': 0.0045791545893992605, 'atr_max_pct': 0.08176207831910105, 'tp_mult': 2.0504160124863775, 'tsl_mult': 0.1197202996335131, 'strategy': 'breakout', 'time_stop': 80, 'use_sma': True, 'use_atr': True, 'use_adx': False, 'use_ema': True, 'use_spike': False, 'rsi_required': False, 'edge_k': 1.5853414688249765, 'edge_cap': 0.7087405762753201, 'bull_strategy': 'mean_reversion', 'bull_bb_std_mult': 2.058626368483834, 'bull_rsi_os': 54, 'bull_rsi_ob': 62, 'bull_adx_thresh': 25.712439852341383, 'bull_atr_min_pct': 0.01106199549390505, 'bull_atr_max_pct': 0.03589543528021715, 'bull_tp_mult': 2.9732291074529367, 'bull_tsl_mult': 0.21294874638878436, 'bull_time_stop': 225, 'bull_use_sma': False, 'bull_use_ema': True, 'bull_use_atr': False, 'bull_use_adx': True, 'bull_use_spike': False, 'bull_rsi_required': False, 'bear_strategy': 'mean_reversion', 'bear_bb_std_mult': 0.8990601052121301, 'bear_rsi_os': 8, 'bear_rsi_ob': 55, 'bear_adx_thresh': 12.343062418968334, 'bear_atr_min_pct': 0.005404506268330667, 'bear_atr_max_pct': 0.06924823625273757, 'bear_tp_mult': 2.749910205019579, 'bear_tsl_mult': 0.8770710913923336, 'bear_time_stop': 99, 'bear_use_sma': True, 'bear_use_ema': True, 'bear_use_atr': True, 'bear_use_adx': False, 'bear_use_spike': False, 'bear_rsi_required': False, 'sideways_strategy': 'mean_reversion', 'sideways_bb_std_mult': 0.9913700441930271, 'sideways_rsi_os': 39, 'sideways_rsi_ob': 62, 'sideways_adx_thresh': 26.563681835864184, 'sideways_atr_min_pct': 8.484697474333072e-06, 'sideways_atr_max_pct': 0.10388697814949048, 'sideways_tp_mult': 1.6639135537836247, 'sideways_tsl_mult': 0.8719203038457964, 'sideways_time_stop': 181, 'sideways_use_sma': True, 'sideways_use_ema': True, 'sideways_use_atr': False, 'sideways_use_adx': True, 'sideways_use_spike': True, 'sideways_rsi_required': False}.
[I 2025-08-31 11:20:11,280] Trial 698 finished with values: [-1000000000.0, 1000000000.0] and parameters: {'p_sma': 36, 'p_std': 10, 'p_atr': 30, 'p_adx': 21, 'rsi_period': 56, 'ema1': 5, 'ema2': 20, 'slip_atr_k': 0.024001936599415498, 'slip_spread_k': 0.49028412901652174, 'spread_hl_frac': 0.0414505673470522, 'bb_std_mult': 0.5012110211568799, 'rsi_os': 30, 'rsi_ob': 83, 'vol_spike': 0.047382726284326146, 'adx_thresh': 11.554889140957576, 'atr_min_pct': 0.022966697919908872, 'atr_max_pct': 0.052957426937864024, 'tp_mult': 2.8874618927269693, 'tsl_mult': 0.4712801825574858, 'strategy': 'breakout', 'time_stop': 222, 'use_sma': True, 'use_atr': True, 'use_adx': False, 'use_ema': True, 'use_spike': False, 'rsi_required': False, 'edge_k': 1.5373160030876392, 'edge_cap': 0.6947912513168696, 'bull_strategy': 'mean_reversion', 'bull_bb_std_mult': 2.6234747390258466, 'bull_rsi_os': 41, 'bull_rsi_ob': 61, 'bull_adx_thresh': 27.7062737009074, 'bull_atr_min_pct': 0.011386386461493425, 'bull_atr_max_pct': 0.10547920332563278, 'bull_tp_mult': 2.9100672871218527, 'bull_tsl_mult': 0.26016978943849545, 'bull_time_stop': 51, 'bull_use_sma': False, 'bull_use_ema': True, 'bull_use_atr': False, 'bull_use_adx': True, 'bull_use_spike': False, 'bull_rsi_required': False, 'bear_strategy': 'mean_reversion', 'bear_bb_std_mult': 1.5022897277273195, 'bear_rsi_os': 41, 'bear_rsi_ob': 55, 'bear_adx_thresh': 8.89318953896084, 'bear_atr_min_pct': 0.011915086772691985, 'bear_atr_max_pct': 0.13180613913465644, 'bear_tp_mult': 2.394043974728988, 'bear_tsl_mult': 0.6372809732107525, 'bear_time_stop': 100, 'bear_use_sma': True, 'bear_use_ema': False, 'bear_use_atr': False, 'bear_use_adx': False, 'bear_use_spike': True, 'bear_rsi_required': False, 'sideways_strategy': 'mean_reversion', 'sideways_bb_std_mult': 1.0080054949729222, 'sideways_rsi_os': 42, 'sideways_rsi_ob': 61, 'sideways_adx_thresh': 26.587842561300555, 'sideways_atr_min_pct': 0.019315995348268167, 'sideways_atr_max_pct': 0.1093945472287616, 'sideways_tp_mult': 1.5648129312307533, 'sideways_tsl_mult': 0.2645068916144904, 'sideways_time_stop': 178, 'sideways_use_sma': True, 'sideways_use_ema': True, 'sideways_use_atr': True, 'sideways_use_adx': True, 'sideways_use_spike': True, 'sideways_rsi_required': False}.
[I 2025-08-31 11:20:11,856] Trial 697 finished with values: [-1000000000.0, 1000000000.0] and parameters: {'p_sma': 36, 'p_std': 14, 'p_atr': 8, 'p_adx': 16, 'rsi_period': 37, 'ema1': 18, 'ema2': 20, 'slip_atr_k': 0.22179969149474643, 'slip_spread_k': 0.48944921381403506, 'spread_hl_frac': 0.02071202172604251, 'bb_std_mult': 0.5025306379782106, 'rsi_os': 6, 'rsi_ob': 83, 'vol_spike': 0.17170311559157805, 'adx_thresh': 11.759245291635324, 'atr_min_pct': 0.020725836717375615, 'atr_max_pct': 0.05309742086068579, 'tp_mult': 2.9039276996000036, 'tsl_mult': 0.06575125261620657, 'strategy': 'breakout', 'time_stop': 232, 'use_sma': True, 'use_atr': True, 'use_adx': False, 'use_ema': True, 'use_spike': False, 'rsi_required': False, 'edge_k': 1.5387154003909136, 'edge_cap': 0.6728572425102383, 'bull_strategy': 'mean_reversion', 'bull_bb_std_mult': 2.732766750512379, 'bull_rsi_os': 24, 'bull_rsi_ob': 62, 'bull_adx_thresh': 26.007431636246814, 'bull_atr_min_pct': 0.023900381100421423, 'bull_atr_max_pct': 0.01803819345473215, 'bull_tp_mult': 2.8273845946149208, 'bull_tsl_mult': 0.2097308216919307, 'bull_time_stop': 33, 'bull_use_sma': False, 'bull_use_ema': True, 'bull_use_atr': False, 'bull_use_adx': True, 'bull_use_spike': False, 'bull_rsi_required': False, 'bear_strategy': 'mean_reversion', 'bear_bb_std_mult': 0.909500566543846, 'bear_rsi_os': 52, 'bear_rsi_ob': 55, 'bear_adx_thresh': 5.357119087693686, 'bear_atr_min_pct': 0.01247459434476717, 'bear_atr_max_pct': 0.08217719202027375, 'bear_tp_mult': 2.6795592471132235, 'bear_tsl_mult': 0.8544883451521467, 'bear_time_stop': 158, 'bear_use_sma': False, 'bear_use_ema': True, 'bear_use_atr': True, 'bear_use_adx': False, 'bear_use_spike': False, 'bear_rsi_required': False, 'sideways_strategy': 'mean_reversion', 'sideways_bb_std_mult': 1.0137881903890595, 'sideways_rsi_os': 39, 'sideways_rsi_ob': 52, 'sideways_adx_thresh': 30.04399601669426, 'sideways_atr_min_pct': 0.005188805773475418, 'sideways_atr_max_pct': 0.13476263874177502, 'sideways_tp_mult': 1.5666386781326498, 'sideways_tsl_mult': 0.7358108098395427, 'sideways_time_stop': 175, 'sideways_use_sma': True, 'sideways_use_ema': True, 'sideways_use_atr': True, 'sideways_use_adx': False, 'sideways_use_spike': True, 'sideways_rsi_required': False}.
[I 2025-08-31 11:20:12,123] Trial 699 finished with values: [-1000000000.0, 1000000000.0] and parameters: {'p_sma': 32, 'p_std': 23, 'p_atr': 9, 'p_adx': 21, 'rsi_period': 36, 'ema1': 5, 'ema2': 33, 'slip_atr_k': 0.17719670240512425, 'slip_spread_k': 0.491309057949451, 'spread_hl_frac': 0.012935816694238607, 'bb_std_mult': 1.9461605490183236, 'rsi_os': 12, 'rsi_ob': 60, 'vol_spike': 0.1698017836028386, 'adx_thresh': 11.838852753731171, 'atr_min_pct': 0.02370658610077787, 'atr_max_pct': 0.052990894702043725, 'tp_mult': 1.6226924083367213, 'tsl_mult': 0.06587729198029316, 'strategy': 'breakout', 'time_stop': 74, 'use_sma': True, 'use_atr': True, 'use_adx': False, 'use_ema': True, 'use_spike': False, 'rsi_required': False, 'edge_k': 1.5338395464807009, 'edge_cap': 0.6724937416394069, 'bull_strategy': 'mean_reversion', 'bull_bb_std_mult': 1.2817282057942054, 'bull_rsi_os': 41, 'bull_rsi_ob': 64, 'bull_adx_thresh': 27.90428502475443, 'bull_atr_min_pct': 0.019648230668046034, 'bull_atr_max_pct': 0.03291740523852177, 'bull_tp_mult': 1.3586771420330614, 'bull_tsl_mult': 0.417876249409116, 'bull_time_stop': 214, 'bull_use_sma': False, 'bull_use_ema': False, 'bull_use_atr': False, 'bull_use_adx': True, 'bull_use_spike': False, 'bull_rsi_required': False, 'bear_strategy': 'mean_reversion', 'bear_bb_std_mult': 1.4703530276391492, 'bear_rsi_os': 52, 'bear_rsi_ob': 55, 'bear_adx_thresh': 12.078811748117658, 'bear_atr_min_pct': 0.007266492197291427, 'bear_atr_max_pct': 0.13016158887080054, 'bear_tp_mult': 2.672933647338576, 'bear_tsl_mult': 0.32434771761044556, 'bear_time_stop': 99, 'bear_use_sma': False, 'bear_use_ema': False, 'bear_use_atr': False, 'bear_use_adx': False, 'bear_use_spike': True, 'bear_rsi_required': False, 'sideways_strategy': 'mean_reversion', 'sideways_bb_std_mult': 1.0896580047209308, 'sideways_rsi_os': 39, 'sideways_rsi_ob': 52, 'sideways_adx_thresh': 7.56342892066548, 'sideways_atr_min_pct': 0.006615077765818683, 'sideways_atr_max_pct': 0.11022356721749554, 'sideways_tp_mult': 1.4594981170828607, 'sideways_tsl_mult': 0.8629661959476812, 'sideways_time_stop': 158, 'sideways_use_sma': True, 'sideways_use_ema': True, 'sideways_use_atr': True, 'sideways_use_adx': False, 'sideways_use_spike': True, 'sideways_rsi_required': False}.
[I 2025-08-31 11:20:12,193] Trial 700 finished with values: [-1000000000.0, 1000000000.0] and parameters: {'p_sma': 9, 'p_std': 20, 'p_atr': 8, 'p_adx': 20, 'rsi_period': 34, 'ema1': 5, 'ema2': 13, 'slip_atr_k': 0.02604279205514235, 'slip_spread_k': 0.17816917898752616, 'spread_hl_frac': 0.02335742814270332, 'bb_std_mult': 0.7462407918901076, 'rsi_os': 7, 'rsi_ob': 83, 'vol_spike': 0.13521283579464732, 'adx_thresh': 11.895039068111714, 'atr_min_pct': 0.028269737189613803, 'atr_max_pct': 0.10518254954903596, 'tp_mult': 1.9860424270490216, 'tsl_mult': 0.06395739328843245, 'strategy': 'breakout', 'time_stop': 224, 'use_sma': True, 'use_atr': True, 'use_adx': False, 'use_ema': True, 'use_spike': False, 'rsi_required': False, 'edge_k': 1.5330571793969698, 'edge_cap': 0.67103093243445, 'bull_strategy': 'mean_reversion', 'bull_bb_std_mult': 1.2746671981575466, 'bull_rsi_os': 13, 'bull_rsi_ob': 60, 'bull_adx_thresh': 27.654547749602617, 'bull_atr_min_pct': 0.024695568057206158, 'bull_atr_max_pct': 0.039772983111420884, 'bull_tp_mult': 1.3707650743631126, 'bull_tsl_mult': 0.2639741399619814, 'bull_time_stop': 252, 'bull_use_sma': False, 'bull_use_ema': False, 'bull_use_atr': False, 'bull_use_adx': True, 'bull_use_spike': False, 'bull_rsi_required': False, 'bear_strategy': 'mean_reversion', 'bear_bb_std_mult': 1.442564676828356, 'bear_rsi_os': 39, 'bear_rsi_ob': 93, 'bear_adx_thresh': 9.962877972018271, 'bear_atr_min_pct': 0.013201774090654393, 'bear_atr_max_pct': 0.1313049268346497, 'bear_tp_mult': 1.5434278364097944, 'bear_tsl_mult': 0.6616326201702185, 'bear_time_stop': 241, 'bear_use_sma': False, 'bear_use_ema': False, 'bear_use_atr': False, 'bear_use_adx': False, 'bear_use_spike': True, 'bear_rsi_required': False, 'sideways_strategy': 'mean_reversion', 'sideways_bb_std_mult': 0.7776983887988211, 'sideways_rsi_os': 17, 'sideways_rsi_ob': 89, 'sideways_adx_thresh': 23.38626723694359, 'sideways_atr_min_pct': 0.006338022776977249, 'sideways_atr_max_pct': 0.11007767896212867, 'sideways_tp_mult': 1.4894728992023953, 'sideways_tsl_mult': 0.08657724739360062, 'sideways_time_stop': 104, 'sideways_use_sma': True, 'sideways_use_ema': True, 'sideways_use_atr': True, 'sideways_use_adx': False, 'sideways_use_spike': True, 'sideways_rsi_required': False}.
[I 2025-08-31 11:20:44,000] Trial 703 finished with values: [-1000000000.0, 1000000000.0] and parameters: {'p_sma': 11, 'p_std': 19, 'p_atr': 7, 'p_adx': 11, 'rsi_period': 62, 'ema1': 6, 'ema2': 10, 'slip_atr_k': 0.01831129555560533, 'slip_spread_k': 0.5142420277516062, 'spread_hl_frac': 0.023648490739234314, 'bb_std_mult': 1.313800685293979, 'rsi_os': 33, 'rsi_ob': 81, 'vol_spike': 0.25759726434607055, 'adx_thresh': 19.781721475193322, 'atr_min_pct': 0.028318008469531496, 'atr_max_pct': 0.10942565455799133, 'tp_mult': 2.925397155506647, 'tsl_mult': 0.9604174439338271, 'strategy': 'breakout', 'time_stop': 245, 'use_sma': True, 'use_atr': True, 'use_adx': False, 'use_ema': True, 'use_spike': False, 'rsi_required': False, 'edge_k': 0.04956360002715843, 'edge_cap': 0.6944857330056228, 'bull_strategy': 'mean_reversion', 'bull_bb_std_mult': 3.06423477917365, 'bull_rsi_os': 40, 'bull_rsi_ob': 87, 'bull_adx_thresh': 29.841911775101398, 'bull_atr_min_pct': 0.02897404747789817, 'bull_atr_max_pct': 0.1490000668909226, 'bull_tp_mult': 2.9105353640047076, 'bull_tsl_mult': 0.9464525224757709, 'bull_time_stop': 38, 'bull_use_sma': False, 'bull_use_ema': False, 'bull_use_atr': False, 'bull_use_adx': False, 'bull_use_spike': False, 'bull_rsi_required': True, 'bear_strategy': 'mean_reversion', 'bear_bb_std_mult': 1.4469199644041761, 'bear_rsi_os': 11, 'bear_rsi_ob': 53, 'bear_adx_thresh': 27.574474107404466, 'bear_atr_min_pct': 0.0015905751571223294, 'bear_atr_max_pct': 0.1003115610728205, 'bear_tp_mult': 1.2686938691221947, 'bear_tsl_mult': 0.9322508590546802, 'bear_time_stop': 187, 'bear_use_sma': False, 'bear_use_ema': False, 'bear_use_atr': True, 'bear_use_adx': True, 'bear_use_spike': True, 'bear_rsi_required': False, 'sideways_strategy': 'mean_reversion', 'sideways_bb_std_mult': 3.568125904986206, 'sideways_rsi_os': 48, 'sideways_rsi_ob': 66, 'sideways_adx_thresh': 24.337485930543835, 'sideways_atr_min_pct': 0.010815312701693131, 'sideways_atr_max_pct': 0.09481898008260359, 'sideways_tp_mult': 2.96003606578914, 'sideways_tsl_mult': 0.661761189475402, 'sideways_time_stop': 195, 'sideways_use_sma': True, 'sideways_use_ema': True, 'sideways_use_atr': False, 'sideways_use_adx': False, 'sideways_use_spike': False, 'sideways_rsi_required': True}.
