[I 2025-08-31 10:28:20,583] Trial 298 finished with values: [-1000000000.0, 1000000000.0] and parameters: {'p_sma': 12, 'p_std': 47, 'p_atr': 17, 'p_adx': 8, 'rsi_period': 32, 'ema1': 20, 'ema2': 57, 'slip_atr_k': 0.1043388326048566, 'slip_spread_k': 0.24436913809594493, 'spread_hl_frac': 0.02178626612204178, 'bb_std_mult': 2.6852938026991047, 'rsi_os': 41, 'rsi_ob': 56, 'vol_spike': 0.22729582132088105, 'adx_thresh': 34.981639095860885, 'atr_min_pct': 0.019302052418252776, 'atr_max_pct': 0.053179276967114414, 'tp_mult': 1.2068835882420303, 'tsl_mult': 0.5039183081163113, 'strategy': 'mean_reversion', 'time_stop': 145, 'use_sma': False, 'use_atr': False, 'use_adx': True, 'use_ema': False, 'use_spike': True, 'rsi_required': True, 'edge_k': 1.791276153047197, 'edge_cap': 0.7067147566718739, 'bull_strategy': 'breakout', 'bull_bb_std_mult': 0.965130720269455, 'bull_rsi_os': 40, 'bull_rsi_ob': 88, 'bull_adx_thresh': 23.638970746623208, 'bull_atr_min_pct': 0.0026350065150804076, 'bull_atr_max_pct': 0.07039004173726993, 'bull_tp_mult': 1.2460671538156536, 'bull_tsl_mult': 0.1363918922038734, 'bull_time_stop': 9, 'bull_use_sma': True, 'bull_use_ema': True, 'bull_use_atr': True, 'bull_use_adx': True, 'bull_use_spike': True, 'bull_rsi_required': False, 'bear_strategy': 'breakout', 'bear_bb_std_mult': 2.143687547914073, 'bear_rsi_os': 30, 'bear_rsi_ob': 58, 'bear_adx_thresh': 6.794850104380826, 'bear_atr_min_pct': 0.023736633274431044, 'bear_atr_max_pct': 0.12835671236655044, 'bear_tp_mult': 2.7912931280487583, 'bear_tsl_mult': 0.07907290566692163, 'bear_time_stop': 45, 'bear_use_sma': False, 'bear_use_ema': True, 'bear_use_atr': True, 'bear_use_adx': False, 'bear_use_spike': True, 'bear_rsi_required': True, 'sideways_strategy': 'breakout', 'sideways_bb_std_mult': 2.6260296221072106, 'sideways_rsi_os': 32, 'sideways_rsi_ob': 92, 'sideways_adx_thresh': 20.895604390866893, 'sideways_atr_min_pct': 0.002547027416451361, 'sideways_atr_max_pct': 0.054671345972840374, 'sideways_tp_mult': 1.497694689344479, 'sideways_tsl_mult': 0.729325319280229, 'sideways_time_stop': 199, 'sideways_use_sma': True, 'sideways_use_ema': False, 'sideways_use_atr': False, 'sideways_use_adx': False, 'sideways_use_spike': True, 'sideways_rsi_required': False}.
[I 2025-08-31 10:28:20,939] Trial 296 finished with values: [-0.026825758948508693, 0.026701567011000762] and parameters: {'p_sma': 41, 'p_std': 52, 'p_atr': 17, 'p_adx': 8, 'rsi_period': 20, 'ema1': 7, 'ema2': 58, 'slip_atr_k': 0.06854882885689344, 'slip_spread_k': 0.24384689729889508, 'spread_hl_frac': 0.021893765663057063, 'bb_std_mult': 2.8348817330506373, 'rsi_os': 14, 'rsi_ob': 94, 'vol_spike': 0.22683706188133215, 'adx_thresh': 7.952562864610963, 'atr_min_pct': 0.028254631320129044, 'atr_max_pct': 0.036164562004250535, 'tp_mult': 1.1963596044811096, 'tsl_mult': 0.9760398989963286, 'strategy': 'mean_reversion', 'time_stop': 165, 'use_sma': False, 'use_atr': False, 'use_adx': True, 'use_ema': False, 'use_spike': True, 'rsi_required': False, 'edge_k': 1.618523710988231, 'edge_cap': 0.6938593490251304, 'bull_strategy': 'breakout', 'bull_bb_std_mult': 0.9385726409674915, 'bull_rsi_os': 46, 'bull_rsi_ob': 71, 'bull_adx_thresh': 20.49671462961319, 'bull_atr_min_pct': 0.006395107365050837, 'bull_atr_max_pct': 0.06990404392076224, 'bull_tp_mult': 1.173453623733084, 'bull_tsl_mult': 0.3540662442193213, 'bull_time_stop': 5, 'bull_use_sma': True, 'bull_use_ema': True, 'bull_use_atr': False, 'bull_use_adx': True, 'bull_use_spike': True, 'bull_rsi_required': False, 'bear_strategy': 'mean_reversion', 'bear_bb_std_mult': 2.7979681822387095, 'bear_rsi_os': 30, 'bear_rsi_ob': 81, 'bear_adx_thresh': 14.127870483271057, 'bear_atr_min_pct': 0.02315707540122437, 'bear_atr_max_pct': 0.13164354348826043, 'bear_tp_mult': 2.5655614115574825, 'bear_tsl_mult': 0.16347643227791686, 'bear_time_stop': 225, 'bear_use_sma': False, 'bear_use_ema': False, 'bear_use_atr': True, 'bear_use_adx': True, 'bear_use_spike': True, 'bear_rsi_required': True, 'sideways_strategy': 'mean_reversion', 'sideways_bb_std_mult': 2.6324573831972167, 'sideways_rsi_os': 32, 'sideways_rsi_ob': 73, 'sideways_adx_thresh': 14.45859104938512, 'sideways_atr_min_pct': 0.0025103103603917416, 'sideways_atr_max_pct': 0.02293659809518827, 'sideways_tp_mult': 1.278800110298743, 'sideways_tsl_mult': 0.12482413601776449, 'sideways_time_stop': 60, 'sideways_use_sma': True, 'sideways_use_ema': False, 'sideways_use_atr': False, 'sideways_use_adx': False, 'sideways_use_spike': True, 'sideways_rsi_required': False}.
[I 2025-08-31 10:28:21,735] Trial 299 finished with values: [-0.01702034166933486, 0.016931172838207963] and parameters: {'p_sma': 19, 'p_std': 37, 'p_atr': 17, 'p_adx': 8, 'rsi_period': 67, 'ema1': 13, 'ema2': 58, 'slip_atr_k': 0.1365997895316885, 'slip_spread_k': 0.2515449350784118, 'spread_hl_frac': 0.027283941959088207, 'bb_std_mult': 2.702231756779516, 'rsi_os': 41, 'rsi_ob': 64, 'vol_spike': 0.10768538708958458, 'adx_thresh': 34.93920400400868, 'atr_min_pct': 0.019376679381205943, 'atr_max_pct': 0.06004488291755772, 'tp_mult': 1.1796450449317817, 'tsl_mult': 0.07831651731270639, 'strategy': 'mean_reversion', 'time_stop': 145, 'use_sma': False, 'use_atr': False, 'use_adx': True, 'use_ema': False, 'use_spike': True, 'rsi_required': True, 'edge_k': 1.7915791721143846, 'edge_cap': 0.19119993972296762, 'bull_strategy': 'breakout', 'bull_bb_std_mult': 0.9530988066289684, 'bull_rsi_os': 40, 'bull_rsi_ob': 72, 'bull_adx_thresh': 9.418971550147539, 'bull_atr_min_pct': 0.002045188693500952, 'bull_atr_max_pct': 0.08534502643675923, 'bull_tp_mult': 1.277859464994969, 'bull_tsl_mult': 0.12835584863717214, 'bull_time_stop': 9, 'bull_use_sma': True, 'bull_use_ema': True, 'bull_use_atr': True, 'bull_use_adx': True, 'bull_use_spike': True, 'bull_rsi_required': False, 'bear_strategy': 'breakout', 'bear_bb_std_mult': 2.6507817116964505, 'bear_rsi_os': 29, 'bear_rsi_ob': 81, 'bear_adx_thresh': 6.499827800429573, 'bear_atr_min_pct': 0.017004910843440888, 'bear_atr_max_pct': 0.1305532850963818, 'bear_tp_mult': 1.559592954794812, 'bear_tsl_mult': 0.08500286709474009, 'bear_time_stop': 181, 'bear_use_sma': False, 'bear_use_ema': True, 'bear_use_atr': True, 'bear_use_adx': False, 'bear_use_spike': True, 'bear_rsi_required': True, 'sideways_strategy': 'breakout', 'sideways_bb_std_mult': 2.602033916872176, 'sideways_rsi_os': 32, 'sideways_rsi_ob': 90, 'sideways_adx_thresh': 15.539028304634927, 'sideways_atr_min_pct': 0.0025413995075678716, 'sideways_atr_max_pct': 0.021158301238425062, 'sideways_tp_mult': 2.784779847483281, 'sideways_tsl_mult': 0.8019055075778231, 'sideways_time_stop': 89, 'sideways_use_sma': True, 'sideways_use_ema': False, 'sideways_use_atr': False, 'sideways_use_adx': False, 'sideways_use_spike': True, 'sideways_rsi_required': False}.
[I 2025-08-31 10:28:22,303] Trial 301 finished with values: [-1000000000.0, 1000000000.0] and parameters: {'p_sma': 48, 'p_std': 30, 'p_atr': 17, 'p_adx': 9, 'rsi_period': 24, 'ema1': 13, 'ema2': 48, 'slip_atr_k': 0.07771621287938353, 'slip_spread_k': 0.08698049775807992, 'spread_hl_frac': 0.017057529478473707, 'bb_std_mult': 2.512865597361992, 'rsi_os': 48, 'rsi_ob': 75, 'vol_spike': 0.027266024548902215, 'adx_thresh': 6.980186647767508, 'atr_min_pct': 0.02737744429622235, 'atr_max_pct': 0.025743568197301746, 'tp_mult': 1.8244524418359418, 'tsl_mult': 0.07511460543248177, 'strategy': 'mean_reversion', 'time_stop': 127, 'use_sma': False, 'use_atr': False, 'use_adx': True, 'use_ema': False, 'use_spike': True, 'rsi_required': True, 'edge_k': 1.613127051983854, 'edge_cap': 0.8477559152488263, 'bull_strategy': 'breakout', 'bull_bb_std_mult': 1.3450418758887537, 'bull_rsi_os': 49, 'bull_rsi_ob': 71, 'bull_adx_thresh': 6.57710137537987, 'bull_atr_min_pct': 0.002002433125204402, 'bull_atr_max_pct': 0.06417924557868673, 'bull_tp_mult': 2.007882924381089, 'bull_tsl_mult': 0.711618238861977, 'bull_time_stop': 35, 'bull_use_sma': True, 'bull_use_ema': True, 'bull_use_atr': True, 'bull_use_adx': True, 'bull_use_spike': True, 'bull_rsi_required': False, 'bear_strategy': 'breakout', 'bear_bb_std_mult': 2.6714160239263265, 'bear_rsi_os': 48, 'bear_rsi_ob': 56, 'bear_adx_thresh': 24.487431180530564, 'bear_atr_min_pct': 0.017021371477622418, 'bear_atr_max_pct': 0.13091856516303343, 'bear_tp_mult': 2.7334088093387385, 'bear_tsl_mult': 0.5785071989938423, 'bear_time_stop': 248, 'bear_use_sma': False, 'bear_use_ema': False, 'bear_use_atr': True, 'bear_use_adx': False, 'bear_use_spike': True, 'bear_rsi_required': True, 'sideways_strategy': 'breakout', 'sideways_bb_std_mult': 2.6075269105663703, 'sideways_rsi_os': 33, 'sideways_rsi_ob': 89, 'sideways_adx_thresh': 19.045104712527184, 'sideways_atr_min_pct': 0.003252752779296583, 'sideways_atr_max_pct': 0.12661999496679982, 'sideways_tp_mult': 1.2771384249186533, 'sideways_tsl_mult': 0.12338466018769645, 'sideways_time_stop': 238, 'sideways_use_sma': True, 'sideways_use_ema': False, 'sideways_use_atr': False, 'sideways_use_adx': False, 'sideways_use_spike': True, 'sideways_rsi_required': False}.
[I 2025-08-31 10:28:22,411] Trial 303 finished with values: [-1000000000.0, 1000000000.0] and parameters: {'p_sma': 49, 'p_std': 21, 'p_atr': 25, 'p_adx': 16, 'rsi_period': 24, 'ema1': 12, 'ema2': 36, 'slip_atr_k': 0.061207803094082316, 'slip_spread_k': 0.08839858087922636, 'spread_hl_frac': 0.049028963798792714, 'bb_std_mult': 2.543680691957361, 'rsi_os': 43, 'rsi_ob': 46, 'vol_spike': 0.07383755119857861, 'adx_thresh': 6.935826258263546, 'atr_min_pct': 0.020688477533925543, 'atr_max_pct': 0.043176211950563585, 'tp_mult': 1.599268406681337, 'tsl_mult': 0.8876802208738138, 'strategy': 'mean_reversion', 'time_stop': 251, 'use_sma': False, 'use_atr': False, 'use_adx': True, 'use_ema': False, 'use_spike': True, 'rsi_required': True, 'edge_k': 1.704430632135512, 'edge_cap': 0.09113634169790868, 'bull_strategy': 'breakout', 'bull_bb_std_mult': 3.3062933449219196, 'bull_rsi_os': 32, 'bull_rsi_ob': 60, 'bull_adx_thresh': 9.948641926208055, 'bull_atr_min_pct': 0.005114049918464217, 'bull_atr_max_pct': 0.06501689971700991, 'bull_tp_mult': 2.7253956047726153, 'bull_tsl_mult': 0.04565884556852188, 'bull_time_stop': 287, 'bull_use_sma': True, 'bull_use_ema': True, 'bull_use_atr': True, 'bull_use_adx': True, 'bull_use_spike': True, 'bull_rsi_required': False, 'bear_strategy': 'breakout', 'bear_bb_std_mult': 1.2026095559292673, 'bear_rsi_os': 48, 'bear_rsi_ob': 53, 'bear_adx_thresh': 5.0951406575487574, 'bear_atr_min_pct': 0.003750034303363849, 'bear_atr_max_pct': 0.0799536888937237, 'bear_tp_mult': 2.6820001988382915, 'bear_tsl_mult': 0.5740809262569551, 'bear_time_stop': 250, 'bear_use_sma': False, 'bear_use_ema': False, 'bear_use_atr': True, 'bear_use_adx': False, 'bear_use_spike': True, 'bear_rsi_required': True, 'sideways_strategy': 'breakout', 'sideways_bb_std_mult': 2.58258535568752, 'sideways_rsi_os': 30, 'sideways_rsi_ob': 87, 'sideways_adx_thresh': 15.927836700974039, 'sideways_atr_min_pct': 0.0033744817303935967, 'sideways_atr_max_pct': 0.01565885921428339, 'sideways_tp_mult': 1.157976380397515, 'sideways_tsl_mult': 0.8534550567922669, 'sideways_time_stop': 291, 'sideways_use_sma': False, 'sideways_use_ema': False, 'sideways_use_atr': False, 'sideways_use_adx': False, 'sideways_use_spike': True, 'sideways_rsi_required': False}.
[I 2025-08-31 10:28:22,991] Trial 304 finished with values: [-1000000000.0, 1000000000.0] and parameters: {'p_sma': 22, 'p_std': 8, 'p_atr': 16, 'p_adx': 16, 'rsi_period': 22, 'ema1': 12, 'ema2': 59, 'slip_atr_k': 0.05913039566809691, 'slip_spread_k': 0.16643591312093242, 'spread_hl_frac': 0.04365304779960599, 'bb_std_mult': 2.6027022685113907, 'rsi_os': 21, 'rsi_ob': 47, 'vol_spike': 0.19240265042487129, 'adx_thresh': 27.869723693548366, 'atr_min_pct': 0.019126546379763524, 'atr_max_pct': 0.09600270193627364, 'tp_mult': 2.853287763165456, 'tsl_mult': 0.47913717569226616, 'strategy': 'mean_reversion', 'time_stop': 252, 'use_sma': False, 'use_atr': False, 'use_adx': False, 'use_ema': False, 'use_spike': True, 'rsi_required': True, 'edge_k': 0.0683232957336094, 'edge_cap': 0.29155051457269054, 'bull_strategy': 'breakout', 'bull_bb_std_mult': 2.1046602033510426, 'bull_rsi_os': 22, 'bull_rsi_ob': 77, 'bull_adx_thresh': 33.54175468137771, 'bull_atr_min_pct': 0.01604292922346557, 'bull_atr_max_pct': 0.07281443626208407, 'bull_tp_mult': 1.2270405954437005, 'bull_tsl_mult': 0.6859871392583481, 'bull_time_stop': 280, 'bull_use_sma': True, 'bull_use_ema': True, 'bull_use_atr': True, 'bull_use_adx': True, 'bull_use_spike': False, 'bull_rsi_required': False, 'bear_strategy': 'breakout', 'bear_bb_std_mult': 1.27013842463669, 'bear_rsi_os': 20, 'bear_rsi_ob': 53, 'bear_adx_thresh': 7.765219683805885, 'bear_atr_min_pct': 0.0037076870659376628, 'bear_atr_max_pct': 0.12131931130443165, 'bear_tp_mult': 2.682917657548242, 'bear_tsl_mult': 0.878383327875744, 'bear_time_stop': 42, 'bear_use_sma': False, 'bear_use_ema': False, 'bear_use_atr': True, 'bear_use_adx': False, 'bear_use_spike': True, 'bear_rsi_required': True, 'sideways_strategy': 'breakout', 'sideways_bb_std_mult': 1.7895755294030953, 'sideways_rsi_os': 29, 'sideways_rsi_ob': 45, 'sideways_adx_thresh': 6.4212582608216735, 'sideways_atr_min_pct': 0.012812986246306435, 'sideways_atr_max_pct': 0.015124497764991637, 'sideways_tp_mult': 1.212901254748682, 'sideways_tsl_mult': 0.886630328895781, 'sideways_time_stop': 292, 'sideways_use_sma': False, 'sideways_use_ema': False, 'sideways_use_atr': False, 'sideways_use_adx': False, 'sideways_use_spike': True, 'sideways_rsi_required': False}.
[I 2025-08-31 10:28:27,192] Trial 306 finished with values: [-1000000000.0, 1000000000.0] and parameters: {'p_sma': 20, 'p_std': 33, 'p_atr': 28, 'p_adx': 9, 'rsi_period': 21, 'ema1': 15, 'ema2': 57, 'slip_atr_k': 0.07093913424245127, 'slip_spread_k': 0.265368295141877, 'spread_hl_frac': 0.04683414549888688, 'bb_std_mult': 2.630188404204681, 'rsi_os': 54, 'rsi_ob': 76, 'vol_spike': 0.012157499021956009, 'adx_thresh': 26.429293866192268, 'atr_min_pct': 0.026314840494966223, 'atr_max_pct': 0.03426917555002895, 'tp_mult': 1.4839426145365369, 'tsl_mult': 0.8342875965715073, 'strategy': 'mean_reversion', 'time_stop': 154, 'use_sma': False, 'use_atr': False, 'use_adx': True, 'use_ema': False, 'use_spike': True, 'rsi_required': True, 'edge_k': 1.1617351147904782, 'edge_cap': 0.2318321564975397, 'bull_strategy': 'breakout', 'bull_bb_std_mult': 1.4478153433327867, 'bull_rsi_os': 20, 'bull_rsi_ob': 75, 'bull_adx_thresh': 11.340451294149265, 'bull_atr_min_pct': 0.023184254957020527, 'bull_atr_max_pct': 0.07709612041476628, 'bull_tp_mult': 1.8535255349795463, 'bull_tsl_mult': 0.07676181422778809, 'bull_time_stop': 22, 'bull_use_sma': True, 'bull_use_ema': True, 'bull_use_atr': True, 'bull_use_adx': True, 'bull_use_spike': True, 'bull_rsi_required': False, 'bear_strategy': 'breakout', 'bear_bb_std_mult': 1.614464646146649, 'bear_rsi_os': 38, 'bear_rsi_ob': 95, 'bear_adx_thresh': 33.71111510106668, 'bear_atr_min_pct': 0.020117031089369516, 'bear_atr_max_pct': 0.06673178960112394, 'bear_tp_mult': 2.6195604486024413, 'bear_tsl_mult': 0.15484280357582714, 'bear_time_stop': 16, 'bear_use_sma': False, 'bear_use_ema': True, 'bear_use_atr': True, 'bear_use_adx': False, 'bear_use_spike': True, 'bear_rsi_required': True, 'sideways_strategy': 'breakout', 'sideways_bb_std_mult': 3.5228159998597595, 'sideways_rsi_os': 36, 'sideways_rsi_ob': 48, 'sideways_adx_thresh': 26.848451006348146, 'sideways_atr_min_pct': 0.01819869638214005, 'sideways_atr_max_pct': 0.11521542241021697, 'sideways_tp_mult': 1.5484613166710761, 'sideways_tsl_mult': 0.5786937952248926, 'sideways_time_stop': 230, 'sideways_use_sma': True, 'sideways_use_ema': False, 'sideways_use_atr': False, 'sideways_use_adx': False, 'sideways_use_spike': True, 'sideways_rsi_required': False}.
[I 2025-08-31 10:28:45,200] Trial 300 finished with values: [-0.03507540019038202, 0.03526127838806513] and parameters: {'p_sma': 22, 'p_std': 9, 'p_atr': 17, 'p_adx': 8, 'rsi_period': 25, 'ema1': 20, 'ema2': 57, 'slip_atr_k': 0.1357629073811913, 'slip_spread_k': 0.24914779455194275, 'spread_hl_frac': 0.047148248582675543, 'bb_std_mult': 2.7175346613015487, 'rsi_os': 14, 'rsi_ob': 85, 'vol_spike': 0.025436226884040736, 'adx_thresh': 7.775077525996349, 'atr_min_pct': 0.019340493203079415, 'atr_max_pct': 0.13724407411106077, 'tp_mult': 2.19643693242855, 'tsl_mult': 0.528674536581959, 'strategy': 'mean_reversion', 'time_stop': 80, 'use_sma': False, 'use_atr': False, 'use_adx': True, 'use_ema': False, 'use_spike': True, 'rsi_required': True, 'edge_k': 1.7905417836178386, 'edge_cap': 0.19325445295473415, 'bull_strategy': 'breakout', 'bull_bb_std_mult': 1.3236301862568607, 'bull_rsi_os': 22, 'bull_rsi_ob': 67, 'bull_adx_thresh': 9.307436359067406, 'bull_atr_min_pct': 0.015612986333727664, 'bull_atr_max_pct': 0.06551241802882926, 'bull_tp_mult': 1.245981107123824, 'bull_tsl_mult': 0.043478022855670574, 'bull_time_stop': 6, 'bull_use_sma': True, 'bull_use_ema': True, 'bull_use_atr': True, 'bull_use_adx': True, 'bull_use_spike': True, 'bull_rsi_required': False, 'bear_strategy': 'breakout', 'bear_bb_std_mult': 1.985130187181962, 'bear_rsi_os': 29, 'bear_rsi_ob': 83, 'bear_adx_thresh': 7.76300395285797, 'bear_atr_min_pct': 0.01696186667896284, 'bear_atr_max_pct': 0.130934177614663, 'bear_tp_mult': 2.6699027130705555, 'bear_tsl_mult': 0.08976924050304488, 'bear_time_stop': 181, 'bear_use_sma': False, 'bear_use_ema': True, 'bear_use_atr': True, 'bear_use_adx': False, 'bear_use_spike': True, 'bear_rsi_required': True, 'sideways_strategy': 'breakout', 'sideways_bb_std_mult': 2.6265790261301665, 'sideways_rsi_os': 29, 'sideways_rsi_ob': 48, 'sideways_adx_thresh': 5.004878781844347, 'sideways_atr_min_pct': 0.002911052141780115, 'sideways_atr_max_pct': 0.022223416645643326, 'sideways_tp_mult': 1.259215393911692, 'sideways_tsl_mult': 0.8030511313295694, 'sideways_time_stop': 290, 'sideways_use_sma': True, 'sideways_use_ema': False, 'sideways_use_atr': False, 'sideways_use_adx': False, 'sideways_use_spike': True, 'sideways_rsi_required': False}.
[I 2025-08-31 10:28:45,935] Trial 302 finished with values: [-1000000000.0, 1000000000.0] and parameters: {'p_sma': 24, 'p_std': 13, 'p_atr': 17, 'p_adx': 9, 'rsi_period': 24, 'ema1': 13, 'ema2': 58, 'slip_atr_k': 0.06015113336191448, 'slip_spread_k': 0.26236274659178327, 'spread_hl_frac': 0.04905732228719822, 'bb_std_mult': 2.4877449660464825, 'rsi_os': 42, 'rsi_ob': 76, 'vol_spike': 0.19321733387362808, 'adx_thresh': 6.580421340702015, 'atr_min_pct': 0.019255485492769776, 'atr_max_pct': 0.05871901922362438, 'tp_mult': 2.8534273802303582, 'tsl_mult': 0.894969905681785, 'strategy': 'mean_reversion', 'time_stop': 151, 'use_sma': False, 'use_atr': False, 'use_adx': True, 'use_ema': False, 'use_spike': True, 'rsi_required': True, 'edge_k': 1.788629465949833, 'edge_cap': 0.0903191060141347, 'bull_strategy': 'breakout', 'bull_bb_std_mult': 3.3059812765616563, 'bull_rsi_os': 49, 'bull_rsi_ob': 67, 'bull_adx_thresh': 33.417713861779724, 'bull_atr_min_pct': 0.005081551987203698, 'bull_atr_max_pct': 0.06429440364549902, 'bull_tp_mult': 1.57662169108136, 'bull_tsl_mult': 0.05376069325323206, 'bull_time_stop': 185, 'bull_use_sma': True, 'bull_use_ema': True, 'bull_use_atr': True, 'bull_use_adx': True, 'bull_use_spike': True, 'bull_rsi_required': False, 'bear_strategy': 'breakout', 'bear_bb_std_mult': 1.2663715757780054, 'bear_rsi_os': 10, 'bear_rsi_ob': 75, 'bear_adx_thresh': 22.748699868908528, 'bear_atr_min_pct': 0.01702737487669747, 'bear_atr_max_pct': 0.07929362496904584, 'bear_tp_mult': 1.5612290825962043, 'bear_tsl_mult': 0.09211529232656504, 'bear_time_stop': 16, 'bear_use_sma': False, 'bear_use_ema': True, 'bear_use_atr': True, 'bear_use_adx': False, 'bear_use_spike': True, 'bear_rsi_required': True, 'sideways_strategy': 'breakout', 'sideways_bb_std_mult': 1.8493335106297941, 'sideways_rsi_os': 30, 'sideways_rsi_ob': 82, 'sideways_adx_thresh': 15.927106641371003, 'sideways_atr_min_pct': 0.01653737956434979, 'sideways_atr_max_pct': 0.03939847065842338, 'sideways_tp_mult': 1.2089605839295765, 'sideways_tsl_mult': 0.7962567789947406, 'sideways_time_stop': 292, 'sideways_use_sma': True, 'sideways_use_ema': False, 'sideways_use_atr': False, 'sideways_use_adx': False, 'sideways_use_spike': True, 'sideways_rsi_required': False}.
