[I 2025-08-31 11:46:07,980] Trial 873 finished with values: [-1000000000.0, 1000000000.0] and parameters: {'p_sma': 37, 'p_std': 28, 'p_atr': 29, 'p_adx': 20, 'rsi_period': 34, 'ema1': 14, 'ema2': 18, 'slip_atr_k': 0.012295452780593435, 'slip_spread_k': 0.43844734519567485, 'spread_hl_frac': 0.01747648776305181, 'bb_std_mult': 0.716415776924309, 'rsi_os': 29, 'rsi_ob': 80, 'vol_spike': 0.2868502192440728, 'adx_thresh': 9.331990289890387, 'atr_min_pct': 0.024105203053773026, 'atr_max_pct': 0.08717209023836249, 'tp_mult': 1.2694371068604644, 'tsl_mult': 0.7666791010171534, 'strategy': 'breakout', 'time_stop': 219, 'use_sma': True, 'use_atr': False, 'use_adx': True, 'use_ema': True, 'use_spike': False, 'rsi_required': True, 'edge_k': 0.22864252066271873, 'edge_cap': 0.05035330989302178, 'bull_strategy': 'mean_reversion', 'bull_bb_std_mult': 2.0436136112837278, 'bull_rsi_os': 40, 'bull_rsi_ob': 60, 'bull_adx_thresh': 24.39985815421033, 'bull_atr_min_pct': 0.027577396348515602, 'bull_atr_max_pct': 0.024814281378903638, 'bull_tp_mult': 1.0420156982079165, 'bull_tsl_mult': 0.54664598682112, 'bull_time_stop': 186, 'bull_use_sma': False, 'bull_use_ema': True, 'bull_use_atr': False, 'bull_use_adx': True, 'bull_use_spike': True, 'bull_rsi_required': False, 'bear_strategy': 'breakout', 'bear_bb_std_mult': 1.738550971433346, 'bear_rsi_os': 51, 'bear_rsi_ob': 75, 'bear_adx_thresh': 10.76549129479068, 'bear_atr_min_pct': 0.012144402004486361, 'bear_atr_max_pct': 0.06244741528474204, 'bear_tp_mult': 2.1044250467832963, 'bear_tsl_mult': 0.8945669819177313, 'bear_time_stop': 97, 'bear_use_sma': False, 'bear_use_ema': False, 'bear_use_atr': True, 'bear_use_adx': False, 'bear_use_spike': False, 'bear_rsi_required': False, 'sideways_strategy': 'breakout', 'sideways_bb_std_mult': 1.4605178100631842, 'sideways_rsi_os': 40, 'sideways_rsi_ob': 62, 'sideways_adx_thresh': 7.2826080739362755, 'sideways_atr_min_pct': 0.005645717481807741, 'sideways_atr_max_pct': 0.14368043746233267, 'sideways_tp_mult': 1.515055906665109, 'sideways_tsl_mult': 0.867763652426798, 'sideways_time_stop': 147, 'sideways_use_sma': False, 'sideways_use_ema': False, 'sideways_use_atr': True, 'sideways_use_adx': False, 'sideways_use_spike': True, 'sideways_rsi_required': False}.
[I 2025-08-31 11:46:08,304] Trial 876 finished with values: [-1000000000.0, 1000000000.0] and parameters: {'p_sma': 37, 'p_std': 53, 'p_atr': 24, 'p_adx': 20, 'rsi_period': 29, 'ema1': 14, 'ema2': 18, 'slip_atr_k': 0.03056275345182404, 'slip_spread_k': 0.49436827429428276, 'spread_hl_frac': 0.017403838366001446, 'bb_std_mult': 1.6038192776206657, 'rsi_os': 30, 'rsi_ob': 80, 'vol_spike': 0.286574694641058, 'adx_thresh': 31.306142391682403, 'atr_min_pct': 0.0023173134570598653, 'atr_max_pct': 0.08319436066609079, 'tp_mult': 2.906954514242193, 'tsl_mult': 0.11659579149849413, 'strategy': 'breakout', 'time_stop': 61, 'use_sma': False, 'use_atr': False, 'use_adx': True, 'use_ema': False, 'use_spike': False, 'rsi_required': True, 'edge_k': 1.4699646359699372, 'edge_cap': 0.6929898802725903, 'bull_strategy': 'mean_reversion', 'bull_bb_std_mult': 2.157074465010875, 'bull_rsi_os': 14, 'bull_rsi_ob': 52, 'bull_adx_thresh': 23.827064112647907, 'bull_atr_min_pct': 0.011899849562875977, 'bull_atr_max_pct': 0.03285593219237471, 'bull_tp_mult': 2.0542240388898647, 'bull_tsl_mult': 0.3069890155496958, 'bull_time_stop': 135, 'bull_use_sma': False, 'bull_use_ema': True, 'bull_use_atr': True, 'bull_use_adx': True, 'bull_use_spike': False, 'bull_rsi_required': True, 'bear_strategy': 'breakout', 'bear_bb_std_mult': 1.734742192868169, 'bear_rsi_os': 54, 'bear_rsi_ob': 51, 'bear_adx_thresh': 15.201281398932007, 'bear_atr_min_pct': 0.027881037404165608, 'bear_atr_max_pct': 0.1356830026559798, 'bear_tp_mult': 2.8187684690063497, 'bear_tsl_mult': 0.25085852198116876, 'bear_time_stop': 277, 'bear_use_sma': False, 'bear_use_ema': True, 'bear_use_atr': True, 'bear_use_adx': False, 'bear_use_spike': False, 'bear_rsi_required': True, 'sideways_strategy': 'breakout', 'sideways_bb_std_mult': 0.7116235420063182, 'sideways_rsi_os': 40, 'sideways_rsi_ob': 79, 'sideways_adx_thresh': 28.248761360964092, 'sideways_atr_min_pct': 0.005478989845401536, 'sideways_atr_max_pct': 0.14297646456875585, 'sideways_tp_mult': 1.4868493140082393, 'sideways_tsl_mult': 0.6624999659413394, 'sideways_time_stop': 152, 'sideways_use_sma': False, 'sideways_use_ema': False, 'sideways_use_atr': True, 'sideways_use_adx': False, 'sideways_use_spike': False, 'sideways_rsi_required': False}.
[I 2025-08-31 11:46:08,310] Trial 875 finished with values: [-1000000000.0, 1000000000.0] and parameters: {'p_sma': 36, 'p_std': 6, 'p_atr': 24, 'p_adx': 29, 'rsi_period': 34, 'ema1': 30, 'ema2': 18, 'slip_atr_k': 0.012700228946177164, 'slip_spread_k': 0.48470933795083054, 'spread_hl_frac': 0.008717493824467473, 'bb_std_mult': 0.7740739886554081, 'rsi_os': 29, 'rsi_ob': 80, 'vol_spike': 0.15528103760552373, 'adx_thresh': 13.486576247201274, 'atr_min_pct': 0.0019802523209317743, 'atr_max_pct': 0.08671920086080843, 'tp_mult': 2.9222599686001245, 'tsl_mult': 0.7789573608484097, 'strategy': 'breakout', 'time_stop': 196, 'use_sma': True, 'use_atr': False, 'use_adx': True, 'use_ema': True, 'use_spike': False, 'rsi_required': True, 'edge_k': 1.5723868370937621, 'edge_cap': 0.6913408258075043, 'bull_strategy': 'mean_reversion', 'bull_bb_std_mult': 2.1599491740396757, 'bull_rsi_os': 22, 'bull_rsi_ob': 55, 'bull_adx_thresh': 18.288868725657334, 'bull_atr_min_pct': 0.01751989057146663, 'bull_atr_max_pct': 0.08234117657634527, 'bull_tp_mult': 2.8311045524452565, 'bull_tsl_mult': 0.1709509646675721, 'bull_time_stop': 45, 'bull_use_sma': False, 'bull_use_ema': True, 'bull_use_atr': True, 'bull_use_adx': True, 'bull_use_spike': True, 'bull_rsi_required': False, 'bear_strategy': 'breakout', 'bear_bb_std_mult': 2.7189466128174873, 'bear_rsi_os': 43, 'bear_rsi_ob': 56, 'bear_adx_thresh': 10.774793227931879, 'bear_atr_min_pct': 0.02769168391275211, 'bear_atr_max_pct': 0.1450245326104074, 'bear_tp_mult': 2.656835654460875, 'bear_tsl_mult': 0.8098073709697289, 'bear_time_stop': 99, 'bear_use_sma': False, 'bear_use_ema': False, 'bear_use_atr': True, 'bear_use_adx': False, 'bear_use_spike': False, 'bear_rsi_required': False, 'sideways_strategy': 'breakout', 'sideways_bb_std_mult': 0.7263129432135265, 'sideways_rsi_os': 40, 'sideways_rsi_ob': 62, 'sideways_adx_thresh': 27.163517949336168, 'sideways_atr_min_pct': 0.005584398819309162, 'sideways_atr_max_pct': 0.12948750105247078, 'sideways_tp_mult': 1.4763695292992591, 'sideways_tsl_mult': 0.8549042907108751, 'sideways_time_stop': 146, 'sideways_use_sma': False, 'sideways_use_ema': False, 'sideways_use_atr': True, 'sideways_use_adx': False, 'sideways_use_spike': True, 'sideways_rsi_required': True}.
[I 2025-08-31 11:46:08,471] Trial 874 finished with values: [-1000000000.0, 1000000000.0] and parameters: {'p_sma': 35, 'p_std': 57, 'p_atr': 29, 'p_adx': 20, 'rsi_period': 53, 'ema1': 28, 'ema2': 18, 'slip_atr_k': 0.2092251376320729, 'slip_spread_k': 0.6920500958130263, 'spread_hl_frac': 0.023591019765131158, 'bb_std_mult': 3.5154776626296873, 'rsi_os': 30, 'rsi_ob': 87, 'vol_spike': 0.06203362277585125, 'adx_thresh': 9.385426654850258, 'atr_min_pct': 0.02317390634215202, 'atr_max_pct': 0.09224308489875566, 'tp_mult': 2.912768827048051, 'tsl_mult': 0.12173662986588323, 'strategy': 'breakout', 'time_stop': 69, 'use_sma': True, 'use_atr': False, 'use_adx': True, 'use_ema': True, 'use_spike': False, 'rsi_required': True, 'edge_k': 1.5023886915584272, 'edge_cap': 0.37366551922500313, 'bull_strategy': 'mean_reversion', 'bull_bb_std_mult': 2.017598178592353, 'bull_rsi_os': 43, 'bull_rsi_ob': 88, 'bull_adx_thresh': 18.07772669412546, 'bull_atr_min_pct': 0.012705947516928015, 'bull_atr_max_pct': 0.024169846590458267, 'bull_tp_mult': 2.291063730213135, 'bull_tsl_mult': 0.23081717586831016, 'bull_time_stop': 286, 'bull_use_sma': False, 'bull_use_ema': True, 'bull_use_atr': False, 'bull_use_adx': True, 'bull_use_spike': True, 'bull_rsi_required': False, 'bear_strategy': 'breakout', 'bear_bb_std_mult': 0.8618899030565275, 'bear_rsi_os': 46, 'bear_rsi_ob': 75, 'bear_adx_thresh': 10.549509422945592, 'bear_atr_min_pct': 0.003262574647529633, 'bear_atr_max_pct': 0.13680548873162093, 'bear_tp_mult': 2.6472830982651616, 'bear_tsl_mult': 0.7028596953510086, 'bear_time_stop': 234, 'bear_use_sma': False, 'bear_use_ema': False, 'bear_use_atr': True, 'bear_use_adx': False, 'bear_use_spike': False, 'bear_rsi_required': False, 'sideways_strategy': 'breakout', 'sideways_bb_std_mult': 1.31363508437343, 'sideways_rsi_os': 40, 'sideways_rsi_ob': 47, 'sideways_adx_thresh': 27.24262130764834, 'sideways_atr_min_pct': 0.005629633468682572, 'sideways_atr_max_pct': 0.07728735744109387, 'sideways_tp_mult': 1.4787984026427643, 'sideways_tsl_mult': 0.8161701456810899, 'sideways_time_stop': 76, 'sideways_use_sma': False, 'sideways_use_ema': False, 'sideways_use_atr': True, 'sideways_use_adx': False, 'sideways_use_spike': True, 'sideways_rsi_required': False}.
[I 2025-08-31 11:46:43,055] Trial 880 finished with values: [-1000000000.0, 1000000000.0] and parameters: {'p_sma': 33, 'p_std': 18, 'p_atr': 28, 'p_adx': 18, 'rsi_period': 35, 'ema1': 5, 'ema2': 17, 'slip_atr_k': 0.026635535500919814, 'slip_spread_k': 0.03185294283802431, 'spread_hl_frac': 0.00020715675801110875, 'bb_std_mult': 3.1903369214193047, 'rsi_os': 32, 'rsi_ob': 70, 'vol_spike': 0.13407138119033984, 'adx_thresh': 11.306937633241981, 'atr_min_pct': 0.0009833147624821702, 'atr_max_pct': 0.03146499322335733, 'tp_mult': 2.3074760467138673, 'tsl_mult': 0.9079757137949813, 'strategy': 'breakout', 'time_stop': 91, 'use_sma': False, 'use_atr': True, 'use_adx': False, 'use_ema': False, 'use_spike': True, 'rsi_required': False, 'edge_k': 1.5301922369174483, 'edge_cap': 0.7058702206401513, 'bull_strategy': 'mean_reversion', 'bull_bb_std_mult': 2.104478579811153, 'bull_rsi_os': 45, 'bull_rsi_ob': 61, 'bull_adx_thresh': 27.038997432268093, 'bull_atr_min_pct': 0.01345322324971861, 'bull_atr_max_pct': 0.03740397731606553, 'bull_tp_mult': 1.955248646346156, 'bull_tsl_mult': 0.2537897593439541, 'bull_time_stop': 59, 'bull_use_sma': True, 'bull_use_ema': False, 'bull_use_atr': False, 'bull_use_adx': False, 'bull_use_spike': False, 'bull_rsi_required': True, 'bear_strategy': 'mean_reversion', 'bear_bb_std_mult': 1.5025557474171318, 'bear_rsi_os': 19, 'bear_rsi_ob': 54, 'bear_adx_thresh': 20.661957701347447, 'bear_atr_min_pct': 0.023133759057027754, 'bear_atr_max_pct': 0.12946230045332524, 'bear_tp_mult': 1.1517451453337708, 'bear_tsl_mult': 0.8592440311020141, 'bear_time_stop': 213, 'bear_use_sma': False, 'bear_use_ema': True, 'bear_use_atr': False, 'bear_use_adx': True, 'bear_use_spike': True, 'bear_rsi_required': True, 'sideways_strategy': 'mean_reversion', 'sideways_bb_std_mult': 1.297115911157551, 'sideways_rsi_os': 19, 'sideways_rsi_ob': 60, 'sideways_adx_thresh': 30.08862000385787, 'sideways_atr_min_pct': 0.020912875805801014, 'sideways_atr_max_pct': 0.04904403986424527, 'sideways_tp_mult': 2.553567091658744, 'sideways_tsl_mult': 0.02803265503434016, 'sideways_time_stop': 51, 'sideways_use_sma': True, 'sideways_use_ema': True, 'sideways_use_atr': False, 'sideways_use_adx': False, 'sideways_use_spike': False, 'sideways_rsi_required': False}.
[I 2025-08-31 11:46:43,680] Trial 877 finished with values: [-1000000000.0, 1000000000.0] and parameters: {'p_sma': 33, 'p_std': 13, 'p_atr': 27, 'p_adx': 12, 'rsi_period': 82, 'ema1': 5, 'ema2': 16, 'slip_atr_k': 0.025551076574859773, 'slip_spread_k': 0.07404202947800959, 'spread_hl_frac': 0.04072436388245616, 'bb_std_mult': 0.5036232128737645, 'rsi_os': 33, 'rsi_ob': 70, 'vol_spike': 0.028859354476155244, 'adx_thresh': 11.381993955577617, 'atr_min_pct': 0.021687967102941956, 'atr_max_pct': 0.07597904183450345, 'tp_mult': 2.835154875241617, 'tsl_mult': 0.13363492621158965, 'strategy': 'breakout', 'time_stop': 94, 'use_sma': False, 'use_atr': True, 'use_adx': False, 'use_ema': False, 'use_spike': True, 'rsi_required': False, 'edge_k': 1.1761433515837862, 'edge_cap': 0.7097213572720975, 'bull_strategy': 'mean_reversion', 'bull_bb_std_mult': 2.1168815301639103, 'bull_rsi_os': 35, 'bull_rsi_ob': 88, 'bull_adx_thresh': 22.359960996854994, 'bull_atr_min_pct': 0.01275479355858253, 'bull_atr_max_pct': 0.03413723784271154, 'bull_tp_mult': 1.964291519607875, 'bull_tsl_mult': 0.8072935807668905, 'bull_time_stop': 55, 'bull_use_sma': True, 'bull_use_ema': False, 'bull_use_atr': False, 'bull_use_adx': True, 'bull_use_spike': False, 'bull_rsi_required': False, 'bear_strategy': 'mean_reversion', 'bear_bb_std_mult': 0.9316734762254548, 'bear_rsi_os': 53, 'bear_rsi_ob': 54, 'bear_adx_thresh': 9.243150992617586, 'bear_atr_min_pct': 0.023126641913219344, 'bear_atr_max_pct': 0.1295096906213084, 'bear_tp_mult': 2.6087833967404377, 'bear_tsl_mult': 0.4346751352195781, 'bear_time_stop': 90, 'bear_use_sma': False, 'bear_use_ema': False, 'bear_use_atr': False, 'bear_use_adx': False, 'bear_use_spike': True, 'bear_rsi_required': True, 'sideways_strategy': 'mean_reversion', 'sideways_bb_std_mult': 1.2862081593118952, 'sideways_rsi_os': 44, 'sideways_rsi_ob': 89, 'sideways_adx_thresh': 11.552027706427944, 'sideways_atr_min_pct': 0.004576913472321322, 'sideways_atr_max_pct': 0.09954754778604194, 'sideways_tp_mult': 2.7618408998698616, 'sideways_tsl_mult': 0.018623769366207743, 'sideways_time_stop': 52, 'sideways_use_sma': True, 'sideways_use_ema': True, 'sideways_use_atr': False, 'sideways_use_adx': False, 'sideways_use_spike': True, 'sideways_rsi_required': False}.
