[I 2025-08-31 10:03:03,115] Trial 88 finished with values: [-1000000000.0, 1000000000.0] and parameters: {'p_sma': 10, 'p_std': 40, 'p_atr': 8, 'p_adx': 27, 'rsi_period': 66, 'ema1': 16, 'ema2': 51, 'slip_atr_k': 0.1788423849673466, 'slip_spread_k': 0.6741885267752222, 'spread_hl_frac': 0.03602723167488298, 'bb_std_mult': 2.96000150685261, 'rsi_os': 44, 'rsi_ob': 59, 'vol_spike': 0.26097892243107285, 'adx_thresh': 17.491002636143236, 'atr_min_pct': 0.0075305924171026025, 'atr_max_pct': 0.04080518280795528, 'tp_mult': 1.6566318142535164, 'tsl_mult': 0.9631543192776764, 'strategy': 'mean_reversion', 'time_stop': 255, 'use_sma': True, 'use_atr': False, 'use_adx': True, 'use_ema': False, 'use_spike': False, 'rsi_required': False, 'edge_k': 1.438958223351276, 'edge_cap': 0.05499524076841056, 'bull_strategy': 'mean_reversion', 'bull_bb_std_mult': 0.7260785301013684, 'bull_rsi_os': 33, 'bull_rsi_ob': 54, 'bull_adx_thresh': 30.42331937933949, 'bull_atr_min_pct': 0.0043094149400893745, 'bull_atr_max_pct': 0.024024737454416297, 'bull_tp_mult': 1.0116820128033377, 'bull_tsl_mult': 0.7250447683102756, 'bull_time_stop': 16, 'bull_use_sma': True, 'bull_use_ema': True, 'bull_use_atr': True, 'bull_use_adx': False, 'bull_use_spike': False, 'bull_rsi_required': False, 'bear_strategy': 'breakout', 'bear_bb_std_mult': 2.6511872064260493, 'bear_rsi_os': 45, 'bear_rsi_ob': 92, 'bear_adx_thresh': 14.054065960705064, 'bear_atr_min_pct': 0.009437056166448018, 'bear_atr_max_pct': 0.016333732792043462, 'bear_tp_mult': 2.7343281079629254, 'bear_tsl_mult': 0.6311243672709954, 'bear_time_stop': 117, 'bear_use_sma': True, 'bear_use_ema': False, 'bear_use_atr': False, 'bear_use_adx': False, 'bear_use_spike': False, 'bear_rsi_required': False, 'sideways_strategy': 'mean_reversion', 'sideways_bb_std_mult': 0.9102657065343321, 'sideways_rsi_os': 17, 'sideways_rsi_ob': 85, 'sideways_adx_thresh': 14.895866305334234, 'sideways_atr_min_pct': 0.017943837982386298, 'sideways_atr_max_pct': 0.07780609464849148, 'sideways_tp_mult': 2.2795294127731216, 'sideways_tsl_mult': 0.32381857723112906, 'sideways_time_stop': 234, 'sideways_use_sma': False, 'sideways_use_ema': False, 'sideways_use_atr': True, 'sideways_use_adx': True, 'sideways_use_spike': False, 'sideways_rsi_required': True}.
[I 2025-08-31 10:03:03,481] Trial 92 finished with values: [-1000000000.0, 1000000000.0] and parameters: {'p_sma': 10, 'p_std': 23, 'p_atr': 21, 'p_adx': 27, 'rsi_period': 7, 'ema1': 20, 'ema2': 17, 'slip_atr_k': 0.0025944759632365033, 'slip_spread_k': 0.6777915085411952, 'spread_hl_frac': 0.03920714151134005, 'bb_std_mult': 2.5029571038570912, 'rsi_os': 17, 'rsi_ob': 81, 'vol_spike': 0.26118683461564934, 'adx_thresh': 15.920311057485598, 'atr_min_pct': 0.005334203948877294, 'atr_max_pct': 0.11854031486847205, 'tp_mult': 2.111083350951148, 'tsl_mult': 0.8080985595307874, 'strategy': 'breakout', 'time_stop': 116, 'use_sma': True, 'use_atr': True, 'use_adx': True, 'use_ema': True, 'use_spike': False, 'rsi_required': False, 'edge_k': 1.8294506611404349, 'edge_cap': 0.779777893701552, 'bull_strategy': 'breakout', 'bull_bb_std_mult': 1.1832705853539065, 'bull_rsi_os': 36, 'bull_rsi_ob': 87, 'bull_adx_thresh': 9.105769748478473, 'bull_atr_min_pct': 0.004061841067845488, 'bull_atr_max_pct': 0.021740291840220215, 'bull_tp_mult': 1.9352912207796908, 'bull_tsl_mult': 0.21860763600961797, 'bull_time_stop': 13, 'bull_use_sma': True, 'bull_use_ema': False, 'bull_use_atr': True, 'bull_use_adx': False, 'bull_use_spike': False, 'bull_rsi_required': True, 'bear_strategy': 'mean_reversion', 'bear_bb_std_mult': 2.9292972307200875, 'bear_rsi_os': 42, 'bear_rsi_ob': 91, 'bear_adx_thresh': 30.052836434191732, 'bear_atr_min_pct': 0.026682610056523757, 'bear_atr_max_pct': 0.05321636895563968, 'bear_tp_mult': 2.9242356956066087, 'bear_tsl_mult': 0.6506595565754221, 'bear_time_stop': 110, 'bear_use_sma': True, 'bear_use_ema': False, 'bear_use_atr': False, 'bear_use_adx': False, 'bear_use_spike': False, 'bear_rsi_required': False, 'sideways_strategy': 'mean_reversion', 'sideways_bb_std_mult': 2.3564941825315127, 'sideways_rsi_os': 16, 'sideways_rsi_ob': 75, 'sideways_adx_thresh': 18.69132416782665, 'sideways_atr_min_pct': 0.028122802772622822, 'sideways_atr_max_pct': 0.030889912610548992, 'sideways_tp_mult': 2.2647785944905534, 'sideways_tsl_mult': 0.32502559702184064, 'sideways_time_stop': 154, 'sideways_use_sma': False, 'sideways_use_ema': False, 'sideways_use_atr': False, 'sideways_use_adx': True, 'sideways_use_spike': False, 'sideways_rsi_required': True}.
[I 2025-08-31 10:03:03,862] Trial 90 finished with values: [-0.01099256412004046, 0.011041906662999713] and parameters: {'p_sma': 21, 'p_std': 10, 'p_atr': 8, 'p_adx': 8, 'rsi_period': 63, 'ema1': 22, 'ema2': 47, 'slip_atr_k': 0.09951140556847421, 'slip_spread_k': 0.682131212938519, 'spread_hl_frac': 0.039448670709750194, 'bb_std_mult': 3.367914527115697, 'rsi_os': 39, 'rsi_ob': 92, 'vol_spike': 0.2589462758122709, 'adx_thresh': 20.56017233723122, 'atr_min_pct': 0.01641376674033294, 'atr_max_pct': 0.11859996498863125, 'tp_mult': 1.669256946519034, 'tsl_mult': 0.9700697741492746, 'strategy': 'mean_reversion', 'time_stop': 255, 'use_sma': False, 'use_atr': False, 'use_adx': True, 'use_ema': False, 'use_spike': False, 'rsi_required': False, 'edge_k': 1.5655031740157364, 'edge_cap': 0.7894393503890698, 'bull_strategy': 'breakout', 'bull_bb_std_mult': 0.7202580932527279, 'bull_rsi_os': 37, 'bull_rsi_ob': 90, 'bull_adx_thresh': 30.729125000903263, 'bull_atr_min_pct': 0.004117558903649515, 'bull_atr_max_pct': 0.023029285053034827, 'bull_tp_mult': 1.0119877684959246, 'bull_tsl_mult': 0.8543659289596743, 'bull_time_stop': 12, 'bull_use_sma': True, 'bull_use_ema': True, 'bull_use_atr': True, 'bull_use_adx': True, 'bull_use_spike': False, 'bull_rsi_required': False, 'bear_strategy': 'breakout', 'bear_bb_std_mult': 2.8575259794046026, 'bear_rsi_os': 46, 'bear_rsi_ob': 92, 'bear_adx_thresh': 29.378432700127895, 'bear_atr_min_pct': 0.02643923460473972, 'bear_atr_max_pct': 0.01586085914180283, 'bear_tp_mult': 2.406280173848086, 'bear_tsl_mult': 0.6397020077402139, 'bear_time_stop': 113, 'bear_use_sma': False, 'bear_use_ema': False, 'bear_use_atr': True, 'bear_use_adx': False, 'bear_use_spike': False, 'bear_rsi_required': True, 'sideways_strategy': 'mean_reversion', 'sideways_bb_std_mult': 0.9248398604034958, 'sideways_rsi_os': 17, 'sideways_rsi_ob': 86, 'sideways_adx_thresh': 18.492258316359592, 'sideways_atr_min_pct': 0.028070481056305732, 'sideways_atr_max_pct': 0.03080075403701051, 'sideways_tp_mult': 2.500607729343796, 'sideways_tsl_mult': 0.09208046363072742, 'sideways_time_stop': 234, 'sideways_use_sma': True, 'sideways_use_ema': True, 'sideways_use_atr': False, 'sideways_use_adx': False, 'sideways_use_spike': False, 'sideways_rsi_required': True}.
[I 2025-08-31 10:03:36,285] Trial 93 finished with values: [-1000000000.0, 1000000000.0] and parameters: {'p_sma': 10, 'p_std': 10, 'p_atr': 19, 'p_adx': 29, 'rsi_period': 11, 'ema1': 20, 'ema2': 16, 'slip_atr_k': 0.09883908509680156, 'slip_spread_k': 0.6167743902855141, 'spread_hl_frac': 0.03947920626553882, 'bb_std_mult': 3.50366284784704, 'rsi_os': 38, 'rsi_ob': 92, 'vol_spike': 0.26120214223587207, 'adx_thresh': 15.834884943089433, 'atr_min_pct': 0.005450832490753638, 'atr_max_pct': 0.11860115937773463, 'tp_mult': 2.106729769875989, 'tsl_mult': 0.8017595135733514, 'strategy': 'mean_reversion', 'time_stop': 278, 'use_sma': True, 'use_atr': True, 'use_adx': True, 'use_ema': True, 'use_spike': False, 'rsi_required': False, 'edge_k': 1.5844506655649029, 'edge_cap': 0.47215832251584594, 'bull_strategy': 'breakout', 'bull_bb_std_mult': 1.331297996236259, 'bull_rsi_os': 38, 'bull_rsi_ob': 65, 'bull_adx_thresh': 31.933189200900497, 'bull_atr_min_pct': 0.004160462840426227, 'bull_atr_max_pct': 0.022976531823038694, 'bull_tp_mult': 1.3866477581858905, 'bull_tsl_mult': 0.86030000166257, 'bull_time_stop': 12, 'bull_use_sma': True, 'bull_use_ema': False, 'bull_use_atr': True, 'bull_use_adx': True, 'bull_use_spike': False, 'bull_rsi_required': True, 'bear_strategy': 'mean_reversion', 'bear_bb_std_mult': 2.8645898156832694, 'bear_rsi_os': 37, 'bear_rsi_ob': 89, 'bear_adx_thresh': 11.636213633727815, 'bear_atr_min_pct': 0.0188900106881397, 'bear_atr_max_pct': 0.05268524180266036, 'bear_tp_mult': 2.730187995075944, 'bear_tsl_mult': 0.7191844449531056, 'bear_time_stop': 217, 'bear_use_sma': True, 'bear_use_ema': False, 'bear_use_atr': False, 'bear_use_adx': False, 'bear_use_spike': False, 'bear_rsi_required': True, 'sideways_strategy': 'mean_reversion', 'sideways_bb_std_mult': 2.52927413032605, 'sideways_rsi_os': 17, 'sideways_rsi_ob': 53, 'sideways_adx_thresh': 18.496823381151565, 'sideways_atr_min_pct': 0.02604864017644612, 'sideways_atr_max_pct': 0.031234656260844228, 'sideways_tp_mult': 1.431579374648234, 'sideways_tsl_mult': 0.33106592961066145, 'sideways_time_stop': 193, 'sideways_use_sma': False, 'sideways_use_ema': False, 'sideways_use_atr': False, 'sideways_use_adx': True, 'sideways_use_spike': False, 'sideways_rsi_required': True}.
[I 2025-08-31 10:03:36,962] Trial 95 finished with values: [-1000000000.0, 1000000000.0] and parameters: {'p_sma': 5, 'p_std': 7, 'p_atr': 17, 'p_adx': 29, 'rsi_period': 14, 'ema1': 20, 'ema2': 58, 'slip_atr_k': 0.15793758487888823, 'slip_spread_k': 0.7081357941987131, 'spread_hl_frac': 0.03911872059774334, 'bb_std_mult': 3.503312942026295, 'rsi_os': 20, 'rsi_ob': 92, 'vol_spike': 0.04790818873671039, 'adx_thresh': 20.526951465550884, 'atr_min_pct': 1.4283045246185622e-07, 'atr_max_pct': 0.05652989982388744, 'tp_mult': 1.788565566289073, 'tsl_mult': 0.6544290661594465, 'strategy': 'breakout', 'time_stop': 293, 'use_sma': False, 'use_atr': False, 'use_adx': False, 'use_ema': False, 'use_spike': False, 'rsi_required': False, 'edge_k': 1.582654175499867, 'edge_cap': 0.23595146037930126, 'bull_strategy': 'breakout', 'bull_bb_std_mult': 0.5701917944830859, 'bull_rsi_os': 30, 'bull_rsi_ob': 64, 'bull_adx_thresh': 27.005955500528156, 'bull_atr_min_pct': 0.011909091696416373, 'bull_atr_max_pct': 0.10582258898315236, 'bull_tp_mult': 1.1437809048190395, 'bull_tsl_mult': 0.7785916529512544, 'bull_time_stop': 116, 'bull_use_sma': True, 'bull_use_ema': False, 'bull_use_atr': True, 'bull_use_adx': True, 'bull_use_spike': False, 'bull_rsi_required': True, 'bear_strategy': 'breakout', 'bear_bb_std_mult': 2.8416955392613787, 'bear_rsi_os': 29, 'bear_rsi_ob': 88, 'bear_adx_thresh': 22.40991649343962, 'bear_atr_min_pct': 0.029199364743892734, 'bear_atr_max_pct': 0.03130147383932883, 'bear_tp_mult': 2.3936170986213354, 'bear_tsl_mult': 0.722930737362093, 'bear_time_stop': 253, 'bear_use_sma': True, 'bear_use_ema': False, 'bear_use_atr': True, 'bear_use_adx': True, 'bear_use_spike': False, 'bear_rsi_required': True, 'sideways_strategy': 'mean_reversion', 'sideways_bb_std_mult': 1.2643910515518608, 'sideways_rsi_os': 15, 'sideways_rsi_ob': 58, 'sideways_adx_thresh': 20.595973687283664, 'sideways_atr_min_pct': 0.01452380314821883, 'sideways_atr_max_pct': 0.11670365850730996, 'sideways_tp_mult': 1.4408954163714438, 'sideways_tsl_mult': 0.6017904197123098, 'sideways_time_stop': 165, 'sideways_use_sma': True, 'sideways_use_ema': True, 'sideways_use_atr': False, 'sideways_use_adx': True, 'sideways_use_spike': False, 'sideways_rsi_required': True}.
[I 2025-08-31 10:03:37,085] Trial 94 finished with values: [-1000000000.0, 1000000000.0] and parameters: {'p_sma': 49, 'p_std': 10, 'p_atr': 17, 'p_adx': 29, 'rsi_period': 11, 'ema1': 20, 'ema2': 16, 'slip_atr_k': 0.15717086784432155, 'slip_spread_k': 0.7844173603786493, 'spread_hl_frac': 0.04128268164557754, 'bb_std_mult': 3.5148282142851848, 'rsi_os': 17, 'rsi_ob': 82, 'vol_spike': 0.03895061747119312, 'adx_thresh': 20.480271220525914, 'atr_min_pct': 0.005353688482541575, 'atr_max_pct': 0.05484754946840011, 'tp_mult': 1.7728577897226043, 'tsl_mult': 0.7363380211785372, 'strategy': 'breakout', 'time_stop': 296, 'use_sma': True, 'use_atr': True, 'use_adx': True, 'use_ema': True, 'use_spike': False, 'rsi_required': False, 'edge_k': 1.571782839853921, 'edge_cap': 0.9662032127394271, 'bull_strategy': 'breakout', 'bull_bb_std_mult': 1.3449973171674507, 'bull_rsi_os': 37, 'bull_rsi_ob': 87, 'bull_adx_thresh': 31.93734990974447, 'bull_atr_min_pct': 0.014852634417540348, 'bull_atr_max_pct': 0.022687912933304043, 'bull_tp_mult': 1.9371043858536618, 'bull_tsl_mult': 0.27712827566148424, 'bull_time_stop': 64, 'bull_use_sma': True, 'bull_use_ema': False, 'bull_use_atr': True, 'bull_use_adx': True, 'bull_use_spike': False, 'bull_rsi_required': True, 'bear_strategy': 'mean_reversion', 'bear_bb_std_mult': 2.764426080411355, 'bear_rsi_os': 37, 'bear_rsi_ob': 89, 'bear_adx_thresh': 11.895659350335627, 'bear_atr_min_pct': 0.028919113500486798, 'bear_atr_max_pct': 0.05470984707016936, 'bear_tp_mult': 2.9111238894667637, 'bear_tsl_mult': 0.059325406330774155, 'bear_time_stop': 106, 'bear_use_sma': True, 'bear_use_ema': False, 'bear_use_atr': True, 'bear_use_adx': False, 'bear_use_spike': False, 'bear_rsi_required': True, 'sideways_strategy': 'mean_reversion', 'sideways_bb_std_mult': 2.5983195975043443, 'sideways_rsi_os': 15, 'sideways_rsi_ob': 59, 'sideways_adx_thresh': 6.249889026686789, 'sideways_atr_min_pct': 0.025721654081210105, 'sideways_atr_max_pct': 0.031030411191306437, 'sideways_tp_mult': 2.1211808223722914, 'sideways_tsl_mult': 0.08433590757438669, 'sideways_time_stop': 197, 'sideways_use_sma': False, 'sideways_use_ema': True, 'sideways_use_atr': False, 'sideways_use_adx': True, 'sideways_use_spike': False, 'sideways_rsi_required': True}.
[I 2025-08-31 10:03:37,392] Trial 96 finished with values: [-1000000000.0, 1000000000.0] and parameters: {'p_sma': 49, 'p_std': 8, 'p_atr': 17, 'p_adx': 29, 'rsi_period': 12, 'ema1': 20, 'ema2': 16, 'slip_atr_k': 0.16437486962223605, 'slip_spread_k': 0.6156850473530356, 'spread_hl_frac': 0.042978600476348924, 'bb_std_mult': 3.467412252129276, 'rsi_os': 39, 'rsi_ob': 92, 'vol_spike': 0.052087604355982225, 'adx_thresh': 20.542883763701223, 'atr_min_pct': 0.015232941095525438, 'atr_max_pct': 0.057750611861955514, 'tp_mult': 1.771194823450099, 'tsl_mult': 0.6637896235549392, 'strategy': 'breakout', 'time_stop': 292, 'use_sma': False, 'use_atr': False, 'use_adx': False, 'use_ema': False, 'use_spike': False, 'rsi_required': False, 'edge_k': 1.4876493273045857, 'edge_cap': 0.49373543023718436, 'bull_strategy': 'breakout', 'bull_bb_std_mult': 1.3129091039688472, 'bull_rsi_os': 37, 'bull_rsi_ob': 63, 'bull_adx_thresh': 32.14388502910357, 'bull_atr_min_pct': 0.02213907579601935, 'bull_atr_max_pct': 0.04713583006296556, 'bull_tp_mult': 1.1607367096454775, 'bull_tsl_mult': 0.8616787327613216, 'bull_time_stop': 236, 'bull_use_sma': True, 'bull_use_ema': False, 'bull_use_atr': True, 'bull_use_adx': True, 'bull_use_spike': True, 'bull_rsi_required': True, 'bear_strategy': 'breakout', 'bear_bb_std_mult': 2.7773811226848784, 'bear_rsi_os': 47, 'bear_rsi_ob': 89, 'bear_adx_thresh': 33.6563066955308, 'bear_atr_min_pct': 0.029100537092707147, 'bear_atr_max_pct': 0.03147801988303583, 'bear_tp_mult': 2.411694072160143, 'bear_tsl_mult': 0.7256814447957256, 'bear_time_stop': 125, 'bear_use_sma': True, 'bear_use_ema': False, 'bear_use_atr': True, 'bear_use_adx': True, 'bear_use_spike': False, 'bear_rsi_required': True, 'sideways_strategy': 'mean_reversion', 'sideways_bb_std_mult': 3.5104477267849417, 'sideways_rsi_os': 17, 'sideways_rsi_ob': 58, 'sideways_adx_thresh': 6.47729917943216, 'sideways_atr_min_pct': 0.0263704378834464, 'sideways_atr_max_pct': 0.11960797754489691, 'sideways_tp_mult': 2.117175238965983, 'sideways_tsl_mult': 0.10831448271305444, 'sideways_time_stop': 130, 'sideways_use_sma': True, 'sideways_use_ema': True, 'sideways_use_atr': False, 'sideways_use_adx': True, 'sideways_use_spike': False, 'sideways_rsi_required': True}.
[I 2025-08-31 10:04:09,158] Trial 100 finished with values: [-1000000000.0, 1000000000.0] and parameters: {'p_sma': 17, 'p_std': 38, 'p_atr': 27, 'p_adx': 30, 'rsi_period': 21, 'ema1': 14, 'ema2': 11, 'slip_atr_k': 0.025997026043598215, 'slip_spread_k': 0.7156429117212101, 'spread_hl_frac': 0.03306370153112295, 'bb_std_mult': 3.3764911156087045, 'rsi_os': 27, 'rsi_ob': 74, 'vol_spike': 0.016414771936449135, 'adx_thresh': 7.5379839275189795, 'atr_min_pct': 0.012567039179603993, 'atr_max_pct': 0.015178489435745526, 'tp_mult': 1.7208070730995784, 'tsl_mult': 0.6109155639841476, 'strategy': 'breakout', 'time_stop': 269, 'use_sma': True, 'use_atr': False, 'use_adx': True, 'use_ema': False, 'use_spike': True, 'rsi_required': False, 'edge_k': 1.342596307155424, 'edge_cap': 0.9982431421850895, 'bull_strategy': 'mean_reversion', 'bull_bb_std_mult': 1.037362633695798, 'bull_rsi_os': 49, 'bull_rsi_ob': 90, 'bull_adx_thresh': 11.352757578659906, 'bull_atr_min_pct': 0.0014815783269257721, 'bull_atr_max_pct': 0.018928539875157996, 'bull_tp_mult': 1.076506908104903, 'bull_tsl_mult': 0.5334614648881956, 'bull_time_stop': 38, 'bull_use_sma': True, 'bull_use_ema': True, 'bull_use_atr': True, 'bull_use_adx': False, 'bull_use_spike': True, 'bull_rsi_required': False, 'bear_strategy': 'breakout', 'bear_bb_std_mult': 2.5075824258789625, 'bear_rsi_os': 51, 'bear_rsi_ob': 67, 'bear_adx_thresh': 21.969551173307273, 'bear_atr_min_pct': 0.022751297344905615, 'bear_atr_max_pct': 0.04034553414762395, 'bear_tp_mult': 1.0911571169909404, 'bear_tsl_mult': 0.5571457290852176, 'bear_time_stop': 282, 'bear_use_sma': False, 'bear_use_ema': True, 'bear_use_atr': True, 'bear_use_adx': False, 'bear_use_spike': True, 'bear_rsi_required': False, 'sideways_strategy': 'mean_reversion', 'sideways_bb_std_mult': 3.228344468316637, 'sideways_rsi_os': 49, 'sideways_rsi_ob': 72, 'sideways_adx_thresh': 8.349691189570745, 'sideways_atr_min_pct': 0.01664336625024616, 'sideways_atr_max_pct': 0.04932657620868035, 'sideways_tp_mult': 1.3088889229235385, 'sideways_tsl_mult': 0.20545358464767893, 'sideways_time_stop': 140, 'sideways_use_sma': False, 'sideways_use_ema': True, 'sideways_use_atr': True, 'sideways_use_adx': False, 'sideways_use_spike': False, 'sideways_rsi_required': True}.
[I 2025-08-31 10:04:09,377] Trial 99 finished with values: [-0.036002325983639505, 0.03609824835192719] and parameters: {'p_sma': 17, 'p_std': 5, 'p_atr': 24, 'p_adx': 24, 'rsi_period': 32, 'ema1': 22, 'ema2': 11, 'slip_atr_k': 0.016963534495738536, 'slip_spread_k': 0.617457647667141, 'spread_hl_frac': 0.043868140409758234, 'bb_std_mult': 3.595486256347414, 'rsi_os': 26, 'rsi_ob': 55, 'vol_spike': 0.2435894015370764, 'adx_thresh': 5.711146724508852, 'atr_min_pct': 0.010123043908563063, 'atr_max_pct': 0.0783793863729767, 'tp_mult': 1.7303056133764914, 'tsl_mult': 0.32399817940661035, 'strategy': 'breakout', 'time_stop': 269, 'use_sma': False, 'use_atr': False, 'use_adx': False, 'use_ema': False, 'use_spike': False, 'rsi_required': False, 'edge_k': 1.4824194221879732, 'edge_cap': 0.6972195499655556, 'bull_strategy': 'mean_reversion', 'bull_bb_std_mult': 1.4791589599891801, 'bull_rsi_os': 5, 'bull_rsi_ob': 84, 'bull_adx_thresh': 21.796421307282493, 'bull_atr_min_pct': 0.0015625780448069726, 'bull_atr_max_pct': 0.11652246611192596, 'bull_tp_mult': 1.0631175995857924, 'bull_tsl_mult': 0.8958953325870174, 'bull_time_stop': 245, 'bull_use_sma': True, 'bull_use_ema': True, 'bull_use_atr': True, 'bull_use_adx': False, 'bull_use_spike': True, 'bull_rsi_required': False, 'bear_strategy': 'breakout', 'bear_bb_std_mult': 0.7808837987643935, 'bear_rsi_os': 47, 'bear_rsi_ob': 94, 'bear_adx_thresh': 31.98870105335669, 'bear_atr_min_pct': 0.015402864247447537, 'bear_atr_max_pct': 0.04221958093717973, 'bear_tp_mult': 2.435065276637837, 'bear_tsl_mult': 0.6014879056896802, 'bear_time_stop': 125, 'bear_use_sma': False, 'bear_use_ema': True, 'bear_use_atr': True, 'bear_use_adx': True, 'bear_use_spike': True, 'bear_rsi_required': False, 'sideways_strategy': 'mean_reversion', 'sideways_bb_std_mult': 3.540930013993113, 'sideways_rsi_os': 49, 'sideways_rsi_ob': 72, 'sideways_adx_thresh': 21.644996440361343, 'sideways_atr_min_pct': 0.013570979157121688, 'sideways_atr_max_pct': 0.1298961008092069, 'sideways_tp_mult': 2.490761795843187, 'sideways_tsl_mult': 0.19632511944948522, 'sideways_time_stop': 131, 'sideways_use_sma': True, 'sideways_use_ema': True, 'sideways_use_atr': True, 'sideways_use_adx': False, 'sideways_use_spike': False, 'sideways_rsi_required': True}.
