[I 2025-08-31 10:22:55,800] Trial 249 finished with values: [-1000000000.0, 1000000000.0] and parameters: {'p_sma': 39, 'p_std': 17, 'p_atr': 16, 'p_adx': 21, 'rsi_period': 70, 'ema1': 12, 'ema2': 57, 'slip_atr_k': 0.06485833801496632, 'slip_spread_k': 0.2788272790215702, 'spread_hl_frac': 0.013060116202284755, 'bb_std_mult': 2.407605230629297, 'rsi_os': 11, 'rsi_ob': 66, 'vol_spike': 0.20189334435749431, 'adx_thresh': 9.326072387347924, 'atr_min_pct': 0.017499489697566338, 'atr_max_pct': 0.037894747326422465, 'tp_mult': 1.0448466796547025, 'tsl_mult': 0.6913730883198421, 'strategy': 'mean_reversion', 'time_stop': 148, 'use_sma': False, 'use_atr': False, 'use_adx': False, 'use_ema': False, 'use_spike': True, 'rsi_required': True, 'edge_k': 1.8115434591451547, 'edge_cap': 0.10222039405200159, 'bull_strategy': 'breakout', 'bull_bb_std_mult': 1.7460785321459176, 'bull_rsi_os': 44, 'bull_rsi_ob': 80, 'bull_adx_thresh': 26.539383530824786, 'bull_atr_min_pct': 0.004740750518453592, 'bull_atr_max_pct': 0.08341063615732382, 'bull_tp_mult': 1.149193309569336, 'bull_tsl_mult': 0.6156217881286243, 'bull_time_stop': 277, 'bull_use_sma': True, 'bull_use_ema': True, 'bull_use_atr': True, 'bull_use_adx': True, 'bull_use_spike': True, 'bull_rsi_required': False, 'bear_strategy': 'breakout', 'bear_bb_std_mult': 0.6668783550538298, 'bear_rsi_os': 31, 'bear_rsi_ob': 56, 'bear_adx_thresh': 6.579934178100846, 'bear_atr_min_pct': 0.01785168663466211, 'bear_atr_max_pct': 0.04106080251501038, 'bear_tp_mult': 2.5525642421198826, 'bear_tsl_mult': 0.11133199050904061, 'bear_time_stop': 33, 'bear_use_sma': False, 'bear_use_ema': True, 'bear_use_atr': True, 'bear_use_adx': False, 'bear_use_spike': True, 'bear_rsi_required': True, 'sideways_strategy': 'breakout', 'sideways_bb_std_mult': 3.4629072845240056, 'sideways_rsi_os': 34, 'sideways_rsi_ob': 85, 'sideways_adx_thresh': 13.874739609853345, 'sideways_atr_min_pct': 0.004530881395399624, 'sideways_atr_max_pct': 0.01939447580857951, 'sideways_tp_mult': 2.5258913212054352, 'sideways_tsl_mult': 0.8253682676355152, 'sideways_time_stop': 67, 'sideways_use_sma': False, 'sideways_use_ema': False, 'sideways_use_atr': False, 'sideways_use_adx': False, 'sideways_use_spike': True, 'sideways_rsi_required': False}.
[I 2025-08-31 10:22:57,288] Trial 253 finished with values: [-1000000000.0, 1000000000.0] and parameters: {'p_sma': 43, 'p_std': 11, 'p_atr': 18, 'p_adx': 7, 'rsi_period': 29, 'ema1': 29, 'ema2': 27, 'slip_atr_k': 0.05278045595455099, 'slip_spread_k': 0.27379224010251424, 'spread_hl_frac': 0.01144284704536765, 'bb_std_mult': 2.378088990589161, 'rsi_os': 41, 'rsi_ob': 74, 'vol_spike': 0.16883747529828275, 'adx_thresh': 33.472272727987644, 'atr_min_pct': 0.020432103907022756, 'atr_max_pct': 0.0376311066031857, 'tp_mult': 2.7975420952341805, 'tsl_mult': 0.6794989979293143, 'strategy': 'mean_reversion', 'time_stop': 138, 'use_sma': False, 'use_atr': False, 'use_adx': True, 'use_ema': False, 'use_spike': True, 'rsi_required': True, 'edge_k': 1.7025434423815744, 'edge_cap': 0.14417475091290152, 'bull_strategy': 'breakout', 'bull_bb_std_mult': 3.59595860623896, 'bull_rsi_os': 27, 'bull_rsi_ob': 80, 'bull_adx_thresh': 11.789540228290381, 'bull_atr_min_pct': 0.011624560318157309, 'bull_atr_max_pct': 0.05005972019646168, 'bull_tp_mult': 2.237820428246619, 'bull_tsl_mult': 0.9338901991226671, 'bull_time_stop': 132, 'bull_use_sma': True, 'bull_use_ema': True, 'bull_use_atr': True, 'bull_use_adx': True, 'bull_use_spike': True, 'bull_rsi_required': False, 'bear_strategy': 'breakout', 'bear_bb_std_mult': 2.085896352625279, 'bear_rsi_os': 32, 'bear_rsi_ob': 56, 'bear_adx_thresh': 8.181849601700732, 'bear_atr_min_pct': 0.005985468773111359, 'bear_atr_max_pct': 0.12309096057658567, 'bear_tp_mult': 1.7976755246649285, 'bear_tsl_mult': 0.12732011440371666, 'bear_time_stop': 48, 'bear_use_sma': True, 'bear_use_ema': False, 'bear_use_atr': True, 'bear_use_adx': False, 'bear_use_spike': True, 'bear_rsi_required': True, 'sideways_strategy': 'breakout', 'sideways_bb_std_mult': 3.1903097003392276, 'sideways_rsi_os': 52, 'sideways_rsi_ob': 83, 'sideways_adx_thresh': 20.149519071015888, 'sideways_atr_min_pct': 0.0038246446574791183, 'sideways_atr_max_pct': 0.018377598475780545, 'sideways_tp_mult': 1.8943030605783382, 'sideways_tsl_mult': 0.8515288055516887, 'sideways_time_stop': 273, 'sideways_use_sma': True, 'sideways_use_ema': False, 'sideways_use_atr': False, 'sideways_use_adx': True, 'sideways_use_spike': True, 'sideways_rsi_required': False}.
[I 2025-08-31 10:23:28,619] Trial 255 finished with values: [-0.05821278556539833, 0.05817149426263824] and parameters: {'p_sma': 20, 'p_std': 45, 'p_atr': 18, 'p_adx': 17, 'rsi_period': 69, 'ema1': 16, 'ema2': 43, 'slip_atr_k': 0.0727109252998871, 'slip_spread_k': 0.27215150694938983, 'spread_hl_frac': 0.027359864676231187, 'bb_std_mult': 2.3533939340135674, 'rsi_os': 41, 'rsi_ob': 73, 'vol_spike': 0.1510286442037554, 'adx_thresh': 9.084090038938616, 'atr_min_pct': 0.019678979248197753, 'atr_max_pct': 0.036840360452298895, 'tp_mult': 2.730308281603378, 'tsl_mult': 0.628832615162121, 'strategy': 'mean_reversion', 'time_stop': 26, 'use_sma': False, 'use_atr': False, 'use_adx': True, 'use_ema': False, 'use_spike': True, 'rsi_required': False, 'edge_k': 1.6911787746490983, 'edge_cap': 0.1261080534924102, 'bull_strategy': 'breakout', 'bull_bb_std_mult': 2.744041200377045, 'bull_rsi_os': 43, 'bull_rsi_ob': 68, 'bull_adx_thresh': 17.959984976482747, 'bull_atr_min_pct': 0.0031094376769699146, 'bull_atr_max_pct': 0.07043494043710051, 'bull_tp_mult': 1.6817446944019703, 'bull_tsl_mult': 0.6593487957548441, 'bull_time_stop': 175, 'bull_use_sma': True, 'bull_use_ema': True, 'bull_use_atr': False, 'bull_use_adx': True, 'bull_use_spike': False, 'bull_rsi_required': False, 'bear_strategy': 'breakout', 'bear_bb_std_mult': 0.7584497935696808, 'bear_rsi_os': 28, 'bear_rsi_ob': 56, 'bear_adx_thresh': 27.76454225159126, 'bear_atr_min_pct': 0.017262832450622736, 'bear_atr_max_pct': 0.1498264369986312, 'bear_tp_mult': 2.67485020991224, 'bear_tsl_mult': 0.1801151968099406, 'bear_time_stop': 39, 'bear_use_sma': True, 'bear_use_ema': False, 'bear_use_atr': True, 'bear_use_adx': True, 'bear_use_spike': False, 'bear_rsi_required': True, 'sideways_strategy': 'mean_reversion', 'sideways_bb_std_mult': 3.2970233224856518, 'sideways_rsi_os': 52, 'sideways_rsi_ob': 46, 'sideways_adx_thresh': 32.63042679788498, 'sideways_atr_min_pct': 0.0014289391232880071, 'sideways_atr_max_pct': 0.010017368678004884, 'sideways_tp_mult': 2.352054181621478, 'sideways_tsl_mult': 0.8667047736057403, 'sideways_time_stop': 274, 'sideways_use_sma': True, 'sideways_use_ema': False, 'sideways_use_atr': False, 'sideways_use_adx': True, 'sideways_use_spike': True, 'sideways_rsi_required': False}.
[I 2025-08-31 10:23:29,240] Trial 254 finished with values: [-1000000000.0, 1000000000.0] and parameters: {'p_sma': 20, 'p_std': 12, 'p_atr': 18, 'p_adx': 17, 'rsi_period': 61, 'ema1': 16, 'ema2': 43, 'slip_atr_k': 0.06257542552665683, 'slip_spread_k': 0.23225553879303779, 'spread_hl_frac': 0.027201017728689995, 'bb_std_mult': 1.2204793165277015, 'rsi_os': 11, 'rsi_ob': 68, 'vol_spike': 0.08062335774666157, 'adx_thresh': 14.422680335443232, 'atr_min_pct': 0.019721322506561733, 'atr_max_pct': 0.08904937454337795, 'tp_mult': 2.803885324050453, 'tsl_mult': 0.9550779626421952, 'strategy': 'mean_reversion', 'time_stop': 160, 'use_sma': False, 'use_atr': False, 'use_adx': True, 'use_ema': False, 'use_spike': True, 'rsi_required': True, 'edge_k': 1.6932697204226927, 'edge_cap': 0.1352985575656649, 'bull_strategy': 'breakout', 'bull_bb_std_mult': 2.8394165419964024, 'bull_rsi_os': 47, 'bull_rsi_ob': 80, 'bull_adx_thresh': 11.293509515427992, 'bull_atr_min_pct': 0.017638953462120535, 'bull_atr_max_pct': 0.04943365122429933, 'bull_tp_mult': 1.511437303776791, 'bull_tsl_mult': 0.6096342068972838, 'bull_time_stop': 175, 'bull_use_sma': True, 'bull_use_ema': True, 'bull_use_atr': True, 'bull_use_adx': True, 'bull_use_spike': True, 'bull_rsi_required': False, 'bear_strategy': 'breakout', 'bear_bb_std_mult': 1.3776264932133202, 'bear_rsi_os': 31, 'bear_rsi_ob': 56, 'bear_adx_thresh': 27.66762449492918, 'bear_atr_min_pct': 0.017273263767153924, 'bear_atr_max_pct': 0.11933313658661258, 'bear_tp_mult': 2.1136510748049795, 'bear_tsl_mult': 0.11042750773239002, 'bear_time_stop': 47, 'bear_use_sma': True, 'bear_use_ema': False, 'bear_use_atr': True, 'bear_use_adx': False, 'bear_use_spike': True, 'bear_rsi_required': True, 'sideways_strategy': 'breakout', 'sideways_bb_std_mult': 2.6585334736238995, 'sideways_rsi_os': 31, 'sideways_rsi_ob': 83, 'sideways_adx_thresh': 9.69271380548521, 'sideways_atr_min_pct': 0.0036943261110986294, 'sideways_atr_max_pct': 0.0475966805574842, 'sideways_tp_mult': 1.2155057385703545, 'sideways_tsl_mult': 0.8591079154330101, 'sideways_time_stop': 212, 'sideways_use_sma': True, 'sideways_use_ema': False, 'sideways_use_atr': False, 'sideways_use_adx': True, 'sideways_use_spike': True, 'sideways_rsi_required': False}.
[I 2025-08-31 10:23:29,461] Trial 256 finished with values: [-0.03667048744265344, 0.03666006521885527] and parameters: {'p_sma': 20, 'p_std': 45, 'p_atr': 18, 'p_adx': 7, 'rsi_period': 62, 'ema1': 27, 'ema2': 39, 'slip_atr_k': 0.0736617581044456, 'slip_spread_k': 0.3464013632811537, 'spread_hl_frac': 0.02967810235197985, 'bb_std_mult': 2.327554789336888, 'rsi_os': 41, 'rsi_ob': 68, 'vol_spike': 0.0831103560385985, 'adx_thresh': 14.540630993404424, 'atr_min_pct': 0.003884034045176338, 'atr_max_pct': 0.04814251784682046, 'tp_mult': 2.7989183159051843, 'tsl_mult': 0.4918087312303503, 'strategy': 'mean_reversion', 'time_stop': 160, 'use_sma': False, 'use_atr': True, 'use_adx': True, 'use_ema': True, 'use_spike': True, 'rsi_required': False, 'edge_k': 1.690476043740164, 'edge_cap': 0.13082117203014848, 'bull_strategy': 'breakout', 'bull_bb_std_mult': 0.8671257990967423, 'bull_rsi_os': 17, 'bull_rsi_ob': 45, 'bull_adx_thresh': 8.832967074681797, 'bull_atr_min_pct': 0.01763812004073184, 'bull_atr_max_pct': 0.07671697028141539, 'bull_tp_mult': 1.3778382890511873, 'bull_tsl_mult': 0.062433941213775566, 'bull_time_stop': 189, 'bull_use_sma': True, 'bull_use_ema': True, 'bull_use_atr': False, 'bull_use_adx': True, 'bull_use_spike': False, 'bull_rsi_required': False, 'bear_strategy': 'breakout', 'bear_bb_std_mult': 0.7578586601929902, 'bear_rsi_os': 28, 'bear_rsi_ob': 59, 'bear_adx_thresh': 28.452269029438874, 'bear_atr_min_pct': 0.01724065313531031, 'bear_atr_max_pct': 0.08883163714486399, 'bear_tp_mult': 2.1478873867330877, 'bear_tsl_mult': 0.17615541024490813, 'bear_time_stop': 47, 'bear_use_sma': True, 'bear_use_ema': False, 'bear_use_atr': True, 'bear_use_adx': True, 'bear_use_spike': False, 'bear_rsi_required': True, 'sideways_strategy': 'mean_reversion', 'sideways_bb_std_mult': 1.7338862000407254, 'sideways_rsi_os': 48, 'sideways_rsi_ob': 87, 'sideways_adx_thresh': 34.08190682001392, 'sideways_atr_min_pct': 0.0020992240657751156, 'sideways_atr_max_pct': 0.01640393260469958, 'sideways_tp_mult': 2.3477676387169493, 'sideways_tsl_mult': 0.8657591841214435, 'sideways_time_stop': 273, 'sideways_use_sma': True, 'sideways_use_ema': False, 'sideways_use_atr': False, 'sideways_use_adx': True, 'sideways_use_spike': True, 'sideways_rsi_required': False}.
[I 2025-08-31 10:23:29,550] Trial 257 finished with values: [-0.11391530783258619, 0.11387533756109852] and parameters: {'p_sma': 20, 'p_std': 7, 'p_atr': 18, 'p_adx': 8, 'rsi_period': 12, 'ema1': 27, 'ema2': 60, 'slip_atr_k': 0.07430540073143369, 'slip_spread_k': 0.026150351466557198, 'spread_hl_frac': 0.02957599319945747, 'bb_std_mult': 2.644296948451766, 'rsi_os': 25, 'rsi_ob': 73, 'vol_spike': 0.035888602989035734, 'adx_thresh': 34.43823866619457, 'atr_min_pct': 0.018294815327377662, 'atr_max_pct': 0.04673633342587742, 'tp_mult': 2.7191550572459637, 'tsl_mult': 0.3336607372158038, 'strategy': 'mean_reversion', 'time_stop': 157, 'use_sma': False, 'use_atr': True, 'use_adx': True, 'use_ema': True, 'use_spike': True, 'rsi_required': False, 'edge_k': 0.21436380519562492, 'edge_cap': 0.1588728778800857, 'bull_strategy': 'breakout', 'bull_bb_std_mult': 2.855859176854511, 'bull_rsi_os': 39, 'bull_rsi_ob': 50, 'bull_adx_thresh': 11.134377994984513, 'bull_atr_min_pct': 0.017666026922724506, 'bull_atr_max_pct': 0.07506923677833961, 'bull_tp_mult': 1.3769961839188265, 'bull_tsl_mult': 0.07020947444028137, 'bull_time_stop': 12, 'bull_use_sma': True, 'bull_use_ema': True, 'bull_use_atr': False, 'bull_use_adx': False, 'bull_use_spike': False, 'bull_rsi_required': False, 'bear_strategy': 'breakout', 'bear_bb_std_mult': 0.7855052592527458, 'bear_rsi_os': 9, 'bear_rsi_ob': 59, 'bear_adx_thresh': 31.51270762285884, 'bear_atr_min_pct': 0.017149120407343475, 'bear_atr_max_pct': 0.11852300973638003, 'bear_tp_mult': 2.688952245747174, 'bear_tsl_mult': 0.1881958175389728, 'bear_time_stop': 38, 'bear_use_sma': True, 'bear_use_ema': False, 'bear_use_atr': False, 'bear_use_adx': True, 'bear_use_spike': False, 'bear_rsi_required': False, 'sideways_strategy': 'mean_reversion', 'sideways_bb_std_mult': 2.672185428298432, 'sideways_rsi_os': 31, 'sideways_rsi_ob': 46, 'sideways_adx_thresh': 15.669515974081586, 'sideways_atr_min_pct': 0.0014622798613009634, 'sideways_atr_max_pct': 0.015113023810538369, 'sideways_tp_mult': 1.1645009342192718, 'sideways_tsl_mult': 0.8753719510613931, 'sideways_time_stop': 263, 'sideways_use_sma': True, 'sideways_use_ema': False, 'sideways_use_atr': True, 'sideways_use_adx': True, 'sideways_use_spike': True, 'sideways_rsi_required': False}.
[I 2025-08-31 10:24:01,324] Trial 258 finished with values: [-0.03367450638869163, 0.033476236374869184] and parameters: {'p_sma': 18, 'p_std': 35, 'p_atr': 8, 'p_adx': 23, 'rsi_period': 61, 'ema1': 10, 'ema2': 38, 'slip_atr_k': 0.14653307835167664, 'slip_spread_k': 0.5450836722220712, 'spread_hl_frac': 0.029439950607080163, 'bb_std_mult': 2.9814726497193322, 'rsi_os': 47, 'rsi_ob': 86, 'vol_spike': 0.20934348203701086, 'adx_thresh': 34.30556194595241, 'atr_min_pct': 0.01858530484453513, 'atr_max_pct': 0.1396026070941515, 'tp_mult': 2.138359851309498, 'tsl_mult': 0.3351394867643671, 'strategy': 'mean_reversion', 'time_stop': 156, 'use_sma': False, 'use_atr': True, 'use_adx': True, 'use_ema': True, 'use_spike': True, 'rsi_required': False, 'edge_k': 1.7437985794907664, 'edge_cap': 0.7746942915054457, 'bull_strategy': 'breakout', 'bull_bb_std_mult': 2.8782736080300575, 'bull_rsi_os': 25, 'bull_rsi_ob': 50, 'bull_adx_thresh': 8.970292406847138, 'bull_atr_min_pct': 0.026225366142758416, 'bull_atr_max_pct': 0.07605423579259972, 'bull_tp_mult': 1.129323681341123, 'bull_tsl_mult': 0.5706650071445738, 'bull_time_stop': 12, 'bull_use_sma': True, 'bull_use_ema': True, 'bull_use_atr': True, 'bull_use_adx': False, 'bull_use_spike': True, 'bull_rsi_required': False, 'bear_strategy': 'breakout', 'bear_bb_std_mult': 1.0916922357435623, 'bear_rsi_os': 36, 'bear_rsi_ob': 79, 'bear_adx_thresh': 28.76813158121962, 'bear_atr_min_pct': 0.016552917433452066, 'bear_atr_max_pct': 0.1403554138114214, 'bear_tp_mult': 2.635636029901678, 'bear_tsl_mult': 0.1913895882697048, 'bear_time_stop': 20, 'bear_use_sma': False, 'bear_use_ema': False, 'bear_use_atr': True, 'bear_use_adx': False, 'bear_use_spike': True, 'bear_rsi_required': False, 'sideways_strategy': 'mean_reversion', 'sideways_bb_std_mult': 2.6466173399769066, 'sideways_rsi_os': 48, 'sideways_rsi_ob': 61, 'sideways_adx_thresh': 15.655479561548214, 'sideways_atr_min_pct': 0.0035019362564746863, 'sideways_atr_max_pct': 0.015627989152072936, 'sideways_tp_mult': 1.198239528028805, 'sideways_tsl_mult': 0.7823434589964267, 'sideways_time_stop': 249, 'sideways_use_sma': True, 'sideways_use_ema': False, 'sideways_use_atr': True, 'sideways_use_adx': False, 'sideways_use_spike': True, 'sideways_rsi_required': False}.
[I 2025-08-31 10:24:02,056] Trial 259 finished with values: [-1000000000.0, 1000000000.0] and parameters: {'p_sma': 32, 'p_std': 35, 'p_atr': 17, 'p_adx': 8, 'rsi_period': 47, 'ema1': 10, 'ema2': 39, 'slip_atr_k': 0.08721813265373422, 'slip_spread_k': 0.30821915308969206, 'spread_hl_frac': 0.009220569734372637, 'bb_std_mult': 3.16324914157473, 'rsi_os': 25, 'rsi_ob': 78, 'vol_spike': 0.03810533179505267, 'adx_thresh': 10.077632636330238, 'atr_min_pct': 0.01842862052615814, 'atr_max_pct': 0.04746930893910096, 'tp_mult': 2.8675360459226247, 'tsl_mult': 0.008421195160743578, 'strategy': 'mean_reversion', 'time_stop': 139, 'use_sma': False, 'use_atr': True, 'use_adx': True, 'use_ema': True, 'use_spike': True, 'rsi_required': False, 'edge_k': 1.7639952298081856, 'edge_cap': 0.16257376160345047, 'bull_strategy': 'breakout', 'bull_bb_std_mult': 1.0238608084415364, 'bull_rsi_os': 24, 'bull_rsi_ob': 50, 'bull_adx_thresh': 9.011357517918714, 'bull_atr_min_pct': 0.020603908420009715, 'bull_atr_max_pct': 0.07651539328302412, 'bull_tp_mult': 1.3821968898645278, 'bull_tsl_mult': 0.9088651983532614, 'bull_time_stop': 11, 'bull_use_sma': True, 'bull_use_ema': True, 'bull_use_atr': False, 'bull_use_adx': False, 'bull_use_spike': False, 'bull_rsi_required': False, 'bear_strategy': 'mean_reversion', 'bear_bb_std_mult': 2.0194843308941035, 'bear_rsi_os': 36, 'bear_rsi_ob': 59, 'bear_adx_thresh': 9.46831585888528, 'bear_atr_min_pct': 0.01664335473834364, 'bear_atr_max_pct': 0.12727229875123777, 'bear_tp_mult': 2.6462459322330076, 'bear_tsl_mult': 0.1844062672094679, 'bear_time_stop': 26, 'bear_use_sma': False, 'bear_use_ema': False, 'bear_use_atr': False, 'bear_use_adx': True, 'bear_use_spike': False, 'bear_rsi_required': False, 'sideways_strategy': 'mean_reversion', 'sideways_bb_std_mult': 1.7469312274454865, 'sideways_rsi_os': 21, 'sideways_rsi_ob': 61, 'sideways_adx_thresh': 15.703445667924093, 'sideways_atr_min_pct': 0.00223496571838394, 'sideways_atr_max_pct': 0.015790635220518906, 'sideways_tp_mult': 1.167078480486146, 'sideways_tsl_mult': 0.6215390032719402, 'sideways_time_stop': 263, 'sideways_use_sma': True, 'sideways_use_ema': False, 'sideways_use_atr': True, 'sideways_use_adx': False, 'sideways_use_spike': True, 'sideways_rsi_required': False}.
[I 2025-08-31 10:24:02,082] Trial 261 finished with values: [-1000000000.0, 1000000000.0] and parameters: {'p_sma': 18, 'p_std': 35, 'p_atr': 17, 'p_adx': 23, 'rsi_period': 23, 'ema1': 10, 'ema2': 59, 'slip_atr_k': 0.06895407729709431, 'slip_spread_k': 0.30817621814766877, 'spread_hl_frac': 0.009633260316781994, 'bb_std_mult': 2.463542631710327, 'rsi_os': 46, 'rsi_ob': 79, 'vol_spike': 0.093764220437623, 'adx_thresh': 10.149579799360508, 'atr_min_pct': 0.004990293181850946, 'atr_max_pct': 0.04359974166922939, 'tp_mult': 2.886933001898953, 'tsl_mult': 0.5681402849849573, 'strategy': 'mean_reversion', 'time_stop': 139, 'use_sma': False, 'use_atr': False, 'use_adx': True, 'use_ema': False, 'use_spike': True, 'rsi_required': True, 'edge_k': 1.7530577730925427, 'edge_cap': 0.2197460095414434, 'bull_strategy': 'breakout', 'bull_bb_std_mult': 0.9545418234554375, 'bull_rsi_os': 25, 'bull_rsi_ob': 75, 'bull_adx_thresh': 9.4017667203045, 'bull_atr_min_pct': 0.012635979425351768, 'bull_atr_max_pct': 0.10911319812098264, 'bull_tp_mult': 1.1205394377048394, 'bull_tsl_mult': 0.9124471459982899, 'bull_time_stop': 19, 'bull_use_sma': False, 'bull_use_ema': True, 'bull_use_atr': True, 'bull_use_adx': False, 'bull_use_spike': True, 'bull_rsi_required': False, 'bear_strategy': 'mean_reversion', 'bear_bb_std_mult': 2.009238793024917, 'bear_rsi_os': 30, 'bear_rsi_ob': 67, 'bear_adx_thresh': 9.533018034046258, 'bear_atr_min_pct': 0.016474474752651253, 'bear_atr_max_pct': 0.12765011559346573, 'bear_tp_mult': 1.4528534225616618, 'bear_tsl_mult': 0.13567801944203622, 'bear_time_stop': 20, 'bear_use_sma': False, 'bear_use_ema': False, 'bear_use_atr': False, 'bear_use_adx': False, 'bear_use_spike': True, 'bear_rsi_required': False, 'sideways_strategy': 'breakout', 'sideways_bb_std_mult': 2.77227362266822, 'sideways_rsi_os': 37, 'sideways_rsi_ob': 82, 'sideways_adx_thresh': 16.45215744896851, 'sideways_atr_min_pct': 0.003334540966102219, 'sideways_atr_max_pct': 0.012980011549804804, 'sideways_tp_mult': 1.286389218353773, 'sideways_tsl_mult': 0.7891824635333519, 'sideways_time_stop': 249, 'sideways_use_sma': True, 'sideways_use_ema': False, 'sideways_use_atr': True, 'sideways_use_adx': False, 'sideways_use_spike': True, 'sideways_rsi_required': False}.
