[I 2025-08-31 10:11:04,361] Trial 154 finished with values: [-1000000000.0, 1000000000.0] and parameters: {'p_sma': 20, 'p_std': 39, 'p_atr': 18, 'p_adx': 10, 'rsi_period': 26, 'ema1': 10, 'ema2': 45, 'slip_atr_k': 0.041783976771690934, 'slip_spread_k': 0.4221254090249672, 'spread_hl_frac': 0.006080226407367214, 'bb_std_mult': 1.0698618046252464, 'rsi_os': 42, 'rsi_ob': 73, 'vol_spike': 0.2275152371051644, 'adx_thresh': 8.07547957626666, 'atr_min_pct': 0.009395050738241676, 'atr_max_pct': 0.0451394173175239, 'tp_mult': 2.6728207199908405, 'tsl_mult': 0.6535333407331343, 'strategy': 'breakout', 'time_stop': 117, 'use_sma': True, 'use_atr': True, 'use_adx': True, 'use_ema': True, 'use_spike': True, 'rsi_required': True, 'edge_k': 0.6754566698899869, 'edge_cap': 0.44810027164849664, 'bull_strategy': 'mean_reversion', 'bull_bb_std_mult': 2.4725759177924096, 'bull_rsi_os': 9, 'bull_rsi_ob': 70, 'bull_adx_thresh': 11.984898740552914, 'bull_atr_min_pct': 0.012322962439773212, 'bull_atr_max_pct': 0.07497439706138032, 'bull_tp_mult': 1.1365519366162364, 'bull_tsl_mult': 0.09066766286032182, 'bull_time_stop': 14, 'bull_use_sma': False, 'bull_use_ema': False, 'bull_use_atr': False, 'bull_use_adx': True, 'bull_use_spike': True, 'bull_rsi_required': True, 'bear_strategy': 'mean_reversion', 'bear_bb_std_mult': 2.038072015507474, 'bear_rsi_os': 30, 'bear_rsi_ob': 58, 'bear_adx_thresh': 18.104208175277687, 'bear_atr_min_pct': 0.010647949890941148, 'bear_atr_max_pct': 0.1261111586235264, 'bear_tp_mult': 2.5952104857019447, 'bear_tsl_mult': 0.3606188076660818, 'bear_time_stop': 58, 'bear_use_sma': False, 'bear_use_ema': False, 'bear_use_atr': False, 'bear_use_adx': False, 'bear_use_spike': True, 'bear_rsi_required': True, 'sideways_strategy': 'breakout', 'sideways_bb_std_mult': 1.312642078453319, 'sideways_rsi_os': 9, 'sideways_rsi_ob': 71, 'sideways_adx_thresh': 17.436609692555084, 'sideways_atr_min_pct': 0.029052677189438995, 'sideways_atr_max_pct': 0.08381322363578642, 'sideways_tp_mult': 1.2102125080456647, 'sideways_tsl_mult': 0.8546056294199192, 'sideways_time_stop': 13, 'sideways_use_sma': True, 'sideways_use_ema': True, 'sideways_use_atr': True, 'sideways_use_adx': False, 'sideways_use_spike': True, 'sideways_rsi_required': True}.
[I 2025-08-31 10:11:04,531] Trial 153 finished with values: [-1000000000.0, 1000000000.0] and parameters: {'p_sma': 20, 'p_std': 40, 'p_atr': 18, 'p_adx': 10, 'rsi_period': 25, 'ema1': 5, 'ema2': 14, 'slip_atr_k': 0.2127072432516, 'slip_spread_k': 0.3319168307644723, 'spread_hl_frac': 0.0011367122934389678, 'bb_std_mult': 1.0039277185416715, 'rsi_os': 43, 'rsi_ob': 76, 'vol_spike': 0.22684181984237378, 'adx_thresh': 9.40058534692935, 'atr_min_pct': 0.00963255293915836, 'atr_max_pct': 0.04592877051847178, 'tp_mult': 2.8214726553612364, 'tsl_mult': 0.6554095708128543, 'strategy': 'breakout', 'time_stop': 116, 'use_sma': True, 'use_atr': True, 'use_adx': True, 'use_ema': True, 'use_spike': True, 'rsi_required': True, 'edge_k': 0.6920789456628238, 'edge_cap': 0.46246357169347624, 'bull_strategy': 'mean_reversion', 'bull_bb_std_mult': 2.4856596317373882, 'bull_rsi_os': 9, 'bull_rsi_ob': 71, 'bull_adx_thresh': 12.170938135959664, 'bull_atr_min_pct': 0.003776686679052314, 'bull_atr_max_pct': 0.06757909017092739, 'bull_tp_mult': 1.9118925532356326, 'bull_tsl_mult': 0.0763192386005965, 'bull_time_stop': 15, 'bull_use_sma': False, 'bull_use_ema': False, 'bull_use_atr': False, 'bull_use_adx': True, 'bull_use_spike': True, 'bull_rsi_required': False, 'bear_strategy': 'mean_reversion', 'bear_bb_std_mult': 1.8754109187376944, 'bear_rsi_os': 30, 'bear_rsi_ob': 58, 'bear_adx_thresh': 18.0893853202323, 'bear_atr_min_pct': 0.010885052183152086, 'bear_atr_max_pct': 0.12522726116500607, 'bear_tp_mult': 2.603376281815222, 'bear_tsl_mult': 0.3575775688709631, 'bear_time_stop': 36, 'bear_use_sma': False, 'bear_use_ema': False, 'bear_use_atr': False, 'bear_use_adx': False, 'bear_use_spike': True, 'bear_rsi_required': True, 'sideways_strategy': 'breakout', 'sideways_bb_std_mult': 1.3162358964070624, 'sideways_rsi_os': 9, 'sideways_rsi_ob': 70, 'sideways_adx_thresh': 17.49208215954842, 'sideways_atr_min_pct': 0.021422566031842505, 'sideways_atr_max_pct': 0.010039110339890947, 'sideways_tp_mult': 1.190653227659129, 'sideways_tsl_mult': 0.8495550384252307, 'sideways_time_stop': 14, 'sideways_use_sma': True, 'sideways_use_ema': True, 'sideways_use_atr': True, 'sideways_use_adx': False, 'sideways_use_spike': True, 'sideways_rsi_required': True}.
[I 2025-08-31 10:11:36,495] Trial 155 finished with values: [-1000000000.0, 1000000000.0] and parameters: {'p_sma': 18, 'p_std': 39, 'p_atr': 17, 'p_adx': 10, 'rsi_period': 19, 'ema1': 15, 'ema2': 14, 'slip_atr_k': 0.20700116397696927, 'slip_spread_k': 0.5105176501161018, 'spread_hl_frac': 0.0013937594731183763, 'bb_std_mult': 0.8215772493290763, 'rsi_os': 40, 'rsi_ob': 73, 'vol_spike': 0.20750935897433972, 'adx_thresh': 9.103680294859188, 'atr_min_pct': 0.009746388176196098, 'atr_max_pct': 0.04329199310909849, 'tp_mult': 2.5825908766810404, 'tsl_mult': 0.7416374103159443, 'strategy': 'breakout', 'time_stop': 116, 'use_sma': True, 'use_atr': True, 'use_adx': True, 'use_ema': True, 'use_spike': True, 'rsi_required': True, 'edge_k': 0.7333615808473697, 'edge_cap': 0.3965374390927534, 'bull_strategy': 'breakout', 'bull_bb_std_mult': 2.490420901747085, 'bull_rsi_os': 9, 'bull_rsi_ob': 71, 'bull_adx_thresh': 12.11312240930084, 'bull_atr_min_pct': 0.003943188679121562, 'bull_atr_max_pct': 0.07683699876560252, 'bull_tp_mult': 1.9559606695435214, 'bull_tsl_mult': 0.057755053058766985, 'bull_time_stop': 13, 'bull_use_sma': True, 'bull_use_ema': True, 'bull_use_atr': False, 'bull_use_adx': True, 'bull_use_spike': True, 'bull_rsi_required': False, 'bear_strategy': 'mean_reversion', 'bear_bb_std_mult': 1.8642764863125798, 'bear_rsi_os': 30, 'bear_rsi_ob': 58, 'bear_adx_thresh': 17.905952900153178, 'bear_atr_min_pct': 0.009101523533872516, 'bear_atr_max_pct': 0.1208227528426116, 'bear_tp_mult': 2.5912968770630083, 'bear_tsl_mult': 0.17098005881545503, 'bear_time_stop': 34, 'bear_use_sma': False, 'bear_use_ema': False, 'bear_use_atr': False, 'bear_use_adx': False, 'bear_use_spike': True, 'bear_rsi_required': True, 'sideways_strategy': 'breakout', 'sideways_bb_std_mult': 1.3799542729652479, 'sideways_rsi_os': 10, 'sideways_rsi_ob': 70, 'sideways_adx_thresh': 15.772671451657995, 'sideways_atr_min_pct': 0.021866858379069504, 'sideways_atr_max_pct': 0.010261060463608883, 'sideways_tp_mult': 1.1923552577141938, 'sideways_tsl_mult': 0.8565861589741494, 'sideways_time_stop': 15, 'sideways_use_sma': True, 'sideways_use_ema': True, 'sideways_use_atr': False, 'sideways_use_adx': False, 'sideways_use_spike': False, 'sideways_rsi_required': True}.
[I 2025-08-31 10:11:36,757] Trial 156 finished with values: [-1000000000.0, 1000000000.0] and parameters: {'p_sma': 18, 'p_std': 38, 'p_atr': 17, 'p_adx': 10, 'rsi_period': 18, 'ema1': 15, 'ema2': 11, 'slip_atr_k': 0.0630922350263236, 'slip_spread_k': 0.32304537561891483, 'spread_hl_frac': 0.00643351559429093, 'bb_std_mult': 1.0852872898177077, 'rsi_os': 39, 'rsi_ob': 73, 'vol_spike': 0.22809026572136304, 'adx_thresh': 9.411746090920559, 'atr_min_pct': 0.009374676295899591, 'atr_max_pct': 0.04108301563213327, 'tp_mult': 2.7431699187902274, 'tsl_mult': 0.70369457511804, 'strategy': 'breakout', 'time_stop': 132, 'use_sma': True, 'use_atr': True, 'use_adx': True, 'use_ema': True, 'use_spike': True, 'rsi_required': True, 'edge_k': 0.6988034398956188, 'edge_cap': 0.40452032372229113, 'bull_strategy': 'breakout', 'bull_bb_std_mult': 2.513860107335792, 'bull_rsi_os': 9, 'bull_rsi_ob': 76, 'bull_adx_thresh': 9.38979135561008, 'bull_atr_min_pct': 0.012333277140616718, 'bull_atr_max_pct': 0.07765702310405806, 'bull_tp_mult': 1.8836649344487453, 'bull_tsl_mult': 0.02419927376316012, 'bull_time_stop': 18, 'bull_use_sma': True, 'bull_use_ema': True, 'bull_use_atr': True, 'bull_use_adx': True, 'bull_use_spike': True, 'bull_rsi_required': False, 'bear_strategy': 'mean_reversion', 'bear_bb_std_mult': 1.889448609675908, 'bear_rsi_os': 30, 'bear_rsi_ob': 58, 'bear_adx_thresh': 16.566934161030787, 'bear_atr_min_pct': 0.0081159345552843, 'bear_atr_max_pct': 0.12129461712306279, 'bear_tp_mult': 1.0932324820987602, 'bear_tsl_mult': 0.19489569590440647, 'bear_time_stop': 57, 'bear_use_sma': False, 'bear_use_ema': False, 'bear_use_atr': True, 'bear_use_adx': True, 'bear_use_spike': True, 'bear_rsi_required': True, 'sideways_strategy': 'breakout', 'sideways_bb_std_mult': 1.3797340611206164, 'sideways_rsi_os': 10, 'sideways_rsi_ob': 70, 'sideways_adx_thresh': 17.308204290018924, 'sideways_atr_min_pct': 0.022037550757578225, 'sideways_atr_max_pct': 0.0844693285416364, 'sideways_tp_mult': 1.205892346778161, 'sideways_tsl_mult': 0.7386656437281398, 'sideways_time_stop': 11, 'sideways_use_sma': True, 'sideways_use_ema': True, 'sideways_use_atr': False, 'sideways_use_adx': False, 'sideways_use_spike': False, 'sideways_rsi_required': False}.
[I 2025-08-31 10:11:36,917] Trial 157 finished with values: [-1000000000.0, 1000000000.0] and parameters: {'p_sma': 18, 'p_std': 36, 'p_atr': 17, 'p_adx': 11, 'rsi_period': 23, 'ema1': 15, 'ema2': 11, 'slip_atr_k': 0.2046879211987005, 'slip_spread_k': 0.04395320148041679, 'spread_hl_frac': 0.0011595077448578075, 'bb_std_mult': 0.5004265223262501, 'rsi_os': 39, 'rsi_ob': 69, 'vol_spike': 0.19419692991572182, 'adx_thresh': 9.280248335313985, 'atr_min_pct': 0.0063457764302605815, 'atr_max_pct': 0.03975175119561598, 'tp_mult': 2.601788539160183, 'tsl_mult': 0.7038036396596337, 'strategy': 'breakout', 'time_stop': 132, 'use_sma': True, 'use_atr': False, 'use_adx': True, 'use_ema': False, 'use_spike': False, 'rsi_required': True, 'edge_k': 1.7189382441712513, 'edge_cap': 0.3644175094458515, 'bull_strategy': 'breakout', 'bull_bb_std_mult': 3.1600978763749725, 'bull_rsi_os': 9, 'bull_rsi_ob': 76, 'bull_adx_thresh': 9.629832076508437, 'bull_atr_min_pct': 0.0039792887241055595, 'bull_atr_max_pct': 0.06739724333900672, 'bull_tp_mult': 2.6170510765251365, 'bull_tsl_mult': 0.0578940852199486, 'bull_time_stop': 17, 'bull_use_sma': True, 'bull_use_ema': True, 'bull_use_atr': True, 'bull_use_adx': True, 'bull_use_spike': True, 'bull_rsi_required': False, 'bear_strategy': 'breakout', 'bear_bb_std_mult': 1.8961138059801097, 'bear_rsi_os': 26, 'bear_rsi_ob': 58, 'bear_adx_thresh': 16.596445574307243, 'bear_atr_min_pct': 0.008994729547929913, 'bear_atr_max_pct': 0.1206632703122068, 'bear_tp_mult': 2.5734985347094423, 'bear_tsl_mult': 0.17077830222367937, 'bear_time_stop': 31, 'bear_use_sma': False, 'bear_use_ema': False, 'bear_use_atr': True, 'bear_use_adx': True, 'bear_use_spike': True, 'bear_rsi_required': True, 'sideways_strategy': 'breakout', 'sideways_bb_std_mult': 1.3925683512279075, 'sideways_rsi_os': 11, 'sideways_rsi_ob': 65, 'sideways_adx_thresh': 26.410875989492332, 'sideways_atr_min_pct': 0.022394068634683167, 'sideways_atr_max_pct': 0.017581542434697044, 'sideways_tp_mult': 1.2575267890038768, 'sideways_tsl_mult': 0.8254468289601016, 'sideways_time_stop': 12, 'sideways_use_sma': True, 'sideways_use_ema': True, 'sideways_use_atr': False, 'sideways_use_adx': False, 'sideways_use_spike': False, 'sideways_rsi_required': False}.
[I 2025-08-31 10:11:37,053] Trial 158 finished with values: [-1000000000.0, 1000000000.0] and parameters: {'p_sma': 21, 'p_std': 36, 'p_atr': 17, 'p_adx': 11, 'rsi_period': 19, 'ema1': 15, 'ema2': 11, 'slip_atr_k': 0.06044173346900171, 'slip_spread_k': 0.00015677304164010697, 'spread_hl_frac': 0.0015599962458845683, 'bb_std_mult': 0.8053966422897567, 'rsi_os': 39, 'rsi_ob': 70, 'vol_spike': 0.19571400251172547, 'adx_thresh': 31.293391742043248, 'atr_min_pct': 0.007847782966570608, 'atr_max_pct': 0.05352086193980755, 'tp_mult': 2.5744832164555875, 'tsl_mult': 0.7403601323286724, 'strategy': 'breakout', 'time_stop': 133, 'use_sma': True, 'use_atr': False, 'use_adx': True, 'use_ema': False, 'use_spike': False, 'rsi_required': True, 'edge_k': 1.7391522865451112, 'edge_cap': 0.39941069537338614, 'bull_strategy': 'breakout', 'bull_bb_std_mult': 2.2274268767442633, 'bull_rsi_os': 11, 'bull_rsi_ob': 76, 'bull_adx_thresh': 9.479400468051372, 'bull_atr_min_pct': 0.02908291034060783, 'bull_atr_max_pct': 0.07775177698606632, 'bull_tp_mult': 1.2344014416759377, 'bull_tsl_mult': 0.022055358952576633, 'bull_time_stop': 18, 'bull_use_sma': True, 'bull_use_ema': True, 'bull_use_atr': True, 'bull_use_adx': True, 'bull_use_spike': True, 'bull_rsi_required': False, 'bear_strategy': 'breakout', 'bear_bb_std_mult': 1.7957353418722484, 'bear_rsi_os': 26, 'bear_rsi_ob': 53, 'bear_adx_thresh': 16.739827541563304, 'bear_atr_min_pct': 0.009118671019311523, 'bear_atr_max_pct': 0.12063782570242655, 'bear_tp_mult': 1.3589749433259137, 'bear_tsl_mult': 0.18950895799216097, 'bear_time_stop': 46, 'bear_use_sma': False, 'bear_use_ema': True, 'bear_use_atr': True, 'bear_use_adx': True, 'bear_use_spike': True, 'bear_rsi_required': True, 'sideways_strategy': 'breakout', 'sideways_bb_std_mult': 1.1431607796322334, 'sideways_rsi_os': 10, 'sideways_rsi_ob': 64, 'sideways_adx_thresh': 26.45763861824375, 'sideways_atr_min_pct': 0.022328573916520204, 'sideways_atr_max_pct': 0.01886954169548277, 'sideways_tp_mult': 1.2585904746422587, 'sideways_tsl_mult': 0.7371040228727951, 'sideways_time_stop': 10, 'sideways_use_sma': True, 'sideways_use_ema': True, 'sideways_use_atr': False, 'sideways_use_adx': False, 'sideways_use_spike': False, 'sideways_rsi_required': False}.
[I 2025-08-31 10:12:08,565] Trial 160 finished with values: [-1000000000.0, 1000000000.0] and parameters: {'p_sma': 45, 'p_std': 36, 'p_atr': 16, 'p_adx': 11, 'rsi_period': 22, 'ema1': 18, 'ema2': 22, 'slip_atr_k': 0.10878083364731135, 'slip_spread_k': 0.3680372888869259, 'spread_hl_frac': 0.008268275108383336, 'bb_std_mult': 0.7416749008069493, 'rsi_os': 46, 'rsi_ob': 69, 'vol_spike': 0.2169639686947779, 'adx_thresh': 5.90583450473533, 'atr_min_pct': 0.007995738776297074, 'atr_max_pct': 0.05228134633266177, 'tp_mult': 2.5969040084492208, 'tsl_mult': 0.3300274109067581, 'strategy': 'breakout', 'time_stop': 144, 'use_sma': True, 'use_atr': False, 'use_adx': False, 'use_ema': False, 'use_spike': False, 'rsi_required': True, 'edge_k': 0.20978910566188358, 'edge_cap': 0.36540865343868245, 'bull_strategy': 'mean_reversion', 'bull_bb_std_mult': 1.9692626561429887, 'bull_rsi_os': 7, 'bull_rsi_ob': 73, 'bull_adx_thresh': 9.861249248571898, 'bull_atr_min_pct': 0.00731186456247456, 'bull_atr_max_pct': 0.08216414303552724, 'bull_tp_mult': 1.2414295223107612, 'bull_tsl_mult': 0.02060930621420099, 'bull_time_stop': 21, 'bull_use_sma': True, 'bull_use_ema': False, 'bull_use_atr': True, 'bull_use_adx': True, 'bull_use_spike': True, 'bull_rsi_required': True, 'bear_strategy': 'breakout', 'bear_bb_std_mult': 1.80922079440398, 'bear_rsi_os': 26, 'bear_rsi_ob': 60, 'bear_adx_thresh': 28.044853922949628, 'bear_atr_min_pct': 0.012136610430222742, 'bear_atr_max_pct': 0.12981705592318618, 'bear_tp_mult': 1.9676264668832142, 'bear_tsl_mult': 0.22784574824956444, 'bear_time_stop': 47, 'bear_use_sma': False, 'bear_use_ema': True, 'bear_use_atr': True, 'bear_use_adx': True, 'bear_use_spike': True, 'bear_rsi_required': True, 'sideways_strategy': 'breakout', 'sideways_bb_std_mult': 1.1641182194246793, 'sideways_rsi_os': 11, 'sideways_rsi_ob': 65, 'sideways_adx_thresh': 31.438104533480242, 'sideways_atr_min_pct': 0.02308497232008207, 'sideways_atr_max_pct': 0.017218750721973354, 'sideways_tp_mult': 1.2732672069769733, 'sideways_tsl_mult': 0.7604000580587661, 'sideways_time_stop': 27, 'sideways_use_sma': True, 'sideways_use_ema': True, 'sideways_use_atr': False, 'sideways_use_adx': False, 'sideways_use_spike': False, 'sideways_rsi_required': False}.
[I 2025-08-31 10:12:09,199] Trial 161 finished with values: [-1000000000.0, 1000000000.0] and parameters: {'p_sma': 45, 'p_std': 36, 'p_atr': 16, 'p_adx': 11, 'rsi_period': 20, 'ema1': 11, 'ema2': 42, 'slip_atr_k': 0.19299807793464874, 'slip_spread_k': 0.3697298373505388, 'spread_hl_frac': 0.016834349052578912, 'bb_std_mult': 0.7729807646485936, 'rsi_os': 46, 'rsi_ob': 70, 'vol_spike': 0.21624588438899614, 'adx_thresh': 5.760625684605117, 'atr_min_pct': 0.008119808011322878, 'atr_max_pct': 0.05428789565381584, 'tp_mult': 2.7618971580002523, 'tsl_mult': 0.7315141736017274, 'strategy': 'breakout', 'time_stop': 146, 'use_sma': False, 'use_atr': False, 'use_adx': False, 'use_ema': False, 'use_spike': False, 'rsi_required': True, 'edge_k': 0.17391515401630264, 'edge_cap': 0.48797142227826995, 'bull_strategy': 'mean_reversion', 'bull_bb_std_mult': 1.9943046880307447, 'bull_rsi_os': 7, 'bull_rsi_ob': 73, 'bull_adx_thresh': 8.586937514944056, 'bull_atr_min_pct': 0.01892555877336584, 'bull_atr_max_pct': 0.08051191051879783, 'bull_tp_mult': 1.0926576391208163, 'bull_tsl_mult': 0.02254953627244729, 'bull_time_stop': 162, 'bull_use_sma': True, 'bull_use_ema': False, 'bull_use_atr': True, 'bull_use_adx': True, 'bull_use_spike': True, 'bull_rsi_required': True, 'bear_strategy': 'breakout', 'bear_bb_std_mult': 1.7880398081700926, 'bear_rsi_os': 33, 'bear_rsi_ob': 53, 'bear_adx_thresh': 15.308929263954923, 'bear_atr_min_pct': 0.011612175837342283, 'bear_atr_max_pct': 0.12876235079351936, 'bear_tp_mult': 2.4906699912507007, 'bear_tsl_mult': 0.24583734040088498, 'bear_time_stop': 45, 'bear_use_sma': False, 'bear_use_ema': True, 'bear_use_atr': True, 'bear_use_adx': False, 'bear_use_spike': True, 'bear_rsi_required': True, 'sideways_strategy': 'breakout', 'sideways_bb_std_mult': 1.1595458151113727, 'sideways_rsi_os': 6, 'sideways_rsi_ob': 66, 'sideways_adx_thresh': 31.04917908675492, 'sideways_atr_min_pct': 0.02374415888073948, 'sideways_atr_max_pct': 0.01846622086106452, 'sideways_tp_mult': 1.2857257037753136, 'sideways_tsl_mult': 0.7630200717229905, 'sideways_time_stop': 28, 'sideways_use_sma': True, 'sideways_use_ema': True, 'sideways_use_atr': False, 'sideways_use_adx': False, 'sideways_use_spike': False, 'sideways_rsi_required': True}.
[I 2025-08-31 10:12:09,295] Trial 159 finished with values: [-1000000000.0, 1000000000.0] and parameters: {'p_sma': 45, 'p_std': 36, 'p_atr': 17, 'p_adx': 11, 'rsi_period': 23, 'ema1': 10, 'ema2': 11, 'slip_atr_k': 0.10925470239068681, 'slip_spread_k': 0.04976667553831712, 'spread_hl_frac': 0.006587886223623454, 'bb_std_mult': 0.7497471824756612, 'rsi_os': 39, 'rsi_ob': 70, 'vol_spike': 0.21622797539793695, 'adx_thresh': 31.087207380440823, 'atr_min_pct': 0.007996976020490898, 'atr_max_pct': 0.05442190409691932, 'tp_mult': 2.731726243085149, 'tsl_mult': 0.7353772969150105, 'strategy': 'breakout', 'time_stop': 130, 'use_sma': True, 'use_atr': False, 'use_adx': False, 'use_ema': False, 'use_spike': False, 'rsi_required': True, 'edge_k': 1.6478374776700777, 'edge_cap': 0.4098777738296513, 'bull_strategy': 'breakout', 'bull_bb_std_mult': 3.157243453122626, 'bull_rsi_os': 7, 'bull_rsi_ob': 76, 'bull_adx_thresh': 8.970305166705883, 'bull_atr_min_pct': 0.018881852784515, 'bull_atr_max_pct': 0.05862038556213532, 'bull_tp_mult': 1.107005165277623, 'bull_tsl_mult': 0.018694219965956563, 'bull_time_stop': 22, 'bull_use_sma': True, 'bull_use_ema': True, 'bull_use_atr': True, 'bull_use_adx': True, 'bull_use_spike': True, 'bull_rsi_required': True, 'bear_strategy': 'breakout', 'bear_bb_std_mult': 1.8019874118183512, 'bear_rsi_os': 26, 'bear_rsi_ob': 53, 'bear_adx_thresh': 29.606510417940836, 'bear_atr_min_pct': 0.011370555277605858, 'bear_atr_max_pct': 0.11694759468917855, 'bear_tp_mult': 1.1314540394058388, 'bear_tsl_mult': 0.23222343239280333, 'bear_time_stop': 46, 'bear_use_sma': False, 'bear_use_ema': True, 'bear_use_atr': True, 'bear_use_adx': True, 'bear_use_spike': True, 'bear_rsi_required': True, 'sideways_strategy': 'breakout', 'sideways_bb_std_mult': 1.166611151193782, 'sideways_rsi_os': 6, 'sideways_rsi_ob': 65, 'sideways_adx_thresh': 16.47817145537635, 'sideways_atr_min_pct': 0.026928871509300217, 'sideways_atr_max_pct': 0.01675039501076431, 'sideways_tp_mult': 1.284372022170232, 'sideways_tsl_mult': 0.7450030742551448, 'sideways_time_stop': 29, 'sideways_use_sma': True, 'sideways_use_ema': True, 'sideways_use_atr': False, 'sideways_use_adx': False, 'sideways_use_spike': False, 'sideways_rsi_required': False}.
