[I 2025-08-31 10:50:39,875] Trial 480 finished with values: [-0.007215194632365418, 0.007351909054392577] and parameters: {'p_sma': 44, 'p_std': 10, 'p_atr': 22, 'p_adx': 20, 'rsi_period': 38, 'ema1': 22, 'ema2': 58, 'slip_atr_k': 0.000427736126155361, 'slip_spread_k': 0.5587870016940879, 'spread_hl_frac': 0.026041206014751163, 'bb_std_mult': 2.604182684167054, 'rsi_os': 32, 'rsi_ob': 74, 'vol_spike': 0.0906129134227732, 'adx_thresh': 13.222334430687049, 'atr_min_pct': 0.0068999432141179234, 'atr_max_pct': 0.041025570357197436, 'tp_mult': 1.9036561426685679, 'tsl_mult': 0.6738801252530171, 'strategy': 'mean_reversion', 'time_stop': 23, 'use_sma': False, 'use_atr': True, 'use_adx': False, 'use_ema': True, 'use_spike': False, 'rsi_required': False, 'edge_k': 0.23573284928228444, 'edge_cap': 0.6507529490464925, 'bull_strategy': 'breakout', 'bull_bb_std_mult': 3.374669548839318, 'bull_rsi_os': 45, 'bull_rsi_ob': 59, 'bull_adx_thresh': 28.361993023039624, 'bull_atr_min_pct': 0.003520281407076381, 'bull_atr_max_pct': 0.03874565706993468, 'bull_tp_mult': 2.8886664592621, 'bull_tsl_mult': 0.11059096209193447, 'bull_time_stop': 51, 'bull_use_sma': False, 'bull_use_ema': False, 'bull_use_atr': False, 'bull_use_adx': False, 'bull_use_spike': False, 'bull_rsi_required': True, 'bear_strategy': 'breakout', 'bear_bb_std_mult': 1.6344541263884116, 'bear_rsi_os': 22, 'bear_rsi_ob': 88, 'bear_adx_thresh': 11.715081626249194, 'bear_atr_min_pct': 0.023641879791822477, 'bear_atr_max_pct': 0.1387546262361198, 'bear_tp_mult': 2.3607573899748213, 'bear_tsl_mult': 0.09760747436063022, 'bear_time_stop': 216, 'bear_use_sma': True, 'bear_use_ema': True, 'bear_use_atr': True, 'bear_use_adx': False, 'bear_use_spike': True, 'bear_rsi_required': False, 'sideways_strategy': 'mean_reversion', 'sideways_bb_std_mult': 2.083580259528559, 'sideways_rsi_os': 34, 'sideways_rsi_ob': 57, 'sideways_adx_thresh': 24.6603766172613, 'sideways_atr_min_pct': 0.005814295120573694, 'sideways_atr_max_pct': 0.01652461286457902, 'sideways_tp_mult': 1.8850025266843498, 'sideways_tsl_mult': 0.5568838978981722, 'sideways_time_stop': 226, 'sideways_use_sma': True, 'sideways_use_ema': False, 'sideways_use_atr': False, 'sideways_use_adx': True, 'sideways_use_spike': False, 'sideways_rsi_required': False}.
[I 2025-08-31 10:50:40,103] Trial 478 finished with values: [-0.00733228396982577, 0.0073849632721620425] and parameters: {'p_sma': 45, 'p_std': 40, 'p_atr': 22, 'p_adx': 20, 'rsi_period': 36, 'ema1': 23, 'ema2': 53, 'slip_atr_k': 0.003964224801491252, 'slip_spread_k': 0.6745553984927349, 'spread_hl_frac': 0.03741317873089138, 'bb_std_mult': 1.0696589556530864, 'rsi_os': 35, 'rsi_ob': 79, 'vol_spike': 0.21571986414706756, 'adx_thresh': 9.938476419112366, 'atr_min_pct': 0.021566743928684403, 'atr_max_pct': 0.09801350858605909, 'tp_mult': 2.494637339480424, 'tsl_mult': 0.17420601021009535, 'strategy': 'mean_reversion', 'time_stop': 149, 'use_sma': False, 'use_atr': False, 'use_adx': False, 'use_ema': True, 'use_spike': False, 'rsi_required': False, 'edge_k': 0.15447928634283492, 'edge_cap': 0.27273743061578404, 'bull_strategy': 'breakout', 'bull_bb_std_mult': 3.597820372182019, 'bull_rsi_os': 48, 'bull_rsi_ob': 52, 'bull_adx_thresh': 11.6366579568469, 'bull_atr_min_pct': 0.0036258231874883094, 'bull_atr_max_pct': 0.04071622663938618, 'bull_tp_mult': 2.816730425458868, 'bull_tsl_mult': 0.4530477828905829, 'bull_time_stop': 52, 'bull_use_sma': False, 'bull_use_ema': False, 'bull_use_atr': False, 'bull_use_adx': True, 'bull_use_spike': True, 'bull_rsi_required': True, 'bear_strategy': 'breakout', 'bear_bb_std_mult': 1.5355322157104652, 'bear_rsi_os': 22, 'bear_rsi_ob': 83, 'bear_adx_thresh': 11.673679210717498, 'bear_atr_min_pct': 0.023576053388257134, 'bear_atr_max_pct': 0.1387973856265258, 'bear_tp_mult': 2.783104190067773, 'bear_tsl_mult': 0.019740185409724414, 'bear_time_stop': 25, 'bear_use_sma': False, 'bear_use_ema': True, 'bear_use_atr': True, 'bear_use_adx': False, 'bear_use_spike': True, 'bear_rsi_required': True, 'sideways_strategy': 'mean_reversion', 'sideways_bb_std_mult': 3.011995475381228, 'sideways_rsi_os': 34, 'sideways_rsi_ob': 61, 'sideways_adx_thresh': 12.99665621829696, 'sideways_atr_min_pct': 0.004914657077437298, 'sideways_atr_max_pct': 0.01493084130611619, 'sideways_tp_mult': 1.896617284297561, 'sideways_tsl_mult': 0.8838611455060478, 'sideways_time_stop': 256, 'sideways_use_sma': True, 'sideways_use_ema': False, 'sideways_use_atr': False, 'sideways_use_adx': False, 'sideways_use_spike': False, 'sideways_rsi_required': False}.
[I 2025-08-31 10:50:40,225] Trial 479 finished with values: [-0.002680605331911834, 0.0029097583317942593] and parameters: {'p_sma': 44, 'p_std': 39, 'p_atr': 24, 'p_adx': 20, 'rsi_period': 36, 'ema1': 22, 'ema2': 47, 'slip_atr_k': 0.0005969641703714881, 'slip_spread_k': 0.27890090306589205, 'spread_hl_frac': 0.026195150953467534, 'bb_std_mult': 2.644512705862405, 'rsi_os': 31, 'rsi_ob': 79, 'vol_spike': 0.216298966063342, 'adx_thresh': 13.06016760779314, 'atr_min_pct': 0.016621163150229726, 'atr_max_pct': 0.06520394926388187, 'tp_mult': 2.8348720048324774, 'tsl_mult': 0.6728696997522017, 'strategy': 'mean_reversion', 'time_stop': 27, 'use_sma': False, 'use_atr': False, 'use_adx': False, 'use_ema': True, 'use_spike': False, 'rsi_required': False, 'edge_k': 0.14187147249354348, 'edge_cap': 0.1918368192808267, 'bull_strategy': 'breakout', 'bull_bb_std_mult': 3.4421385500527837, 'bull_rsi_os': 44, 'bull_rsi_ob': 78, 'bull_adx_thresh': 9.248822286411883, 'bull_atr_min_pct': 0.003704163556010571, 'bull_atr_max_pct': 0.043994543656785595, 'bull_tp_mult': 2.6706126107287513, 'bull_tsl_mult': 0.4516949530334211, 'bull_time_stop': 50, 'bull_use_sma': False, 'bull_use_ema': False, 'bull_use_atr': False, 'bull_use_adx': True, 'bull_use_spike': False, 'bull_rsi_required': True, 'bear_strategy': 'breakout', 'bear_bb_std_mult': 1.6065698355832816, 'bear_rsi_os': 23, 'bear_rsi_ob': 93, 'bear_adx_thresh': 14.870535749060537, 'bear_atr_min_pct': 0.025007971517103898, 'bear_atr_max_pct': 0.13953103510898904, 'bear_tp_mult': 1.671830539820653, 'bear_tsl_mult': 0.8453790820933904, 'bear_time_stop': 37, 'bear_use_sma': False, 'bear_use_ema': True, 'bear_use_atr': True, 'bear_use_adx': False, 'bear_use_spike': True, 'bear_rsi_required': True, 'sideways_strategy': 'mean_reversion', 'sideways_bb_std_mult': 2.4321785910881086, 'sideways_rsi_os': 16, 'sideways_rsi_ob': 57, 'sideways_adx_thresh': 12.014461555480867, 'sideways_atr_min_pct': 0.00471449236894096, 'sideways_atr_max_pct': 0.13534616374438224, 'sideways_tp_mult': 1.8782078233120048, 'sideways_tsl_mult': 0.9092008831652209, 'sideways_time_stop': 255, 'sideways_use_sma': True, 'sideways_use_ema': False, 'sideways_use_atr': False, 'sideways_use_adx': False, 'sideways_use_spike': False, 'sideways_rsi_required': False}.
[I 2025-08-31 10:50:40,434] Trial 477 finished with values: [-0.002162257111427812, 0.002397464639884836] and parameters: {'p_sma': 46, 'p_std': 40, 'p_atr': 21, 'p_adx': 20, 'rsi_period': 36, 'ema1': 22, 'ema2': 43, 'slip_atr_k': 0.005635128657151552, 'slip_spread_k': 0.052559583625885586, 'spread_hl_frac': 0.022955135021566982, 'bb_std_mult': 1.034308076925177, 'rsi_os': 36, 'rsi_ob': 79, 'vol_spike': 0.021893410249333833, 'adx_thresh': 25.91235846488767, 'atr_min_pct': 0.02138264444594125, 'atr_max_pct': 0.0379603033985954, 'tp_mult': 2.87985491950213, 'tsl_mult': 0.396105102581254, 'strategy': 'mean_reversion', 'time_stop': 150, 'use_sma': False, 'use_atr': False, 'use_adx': False, 'use_ema': True, 'use_spike': False, 'rsi_required': False, 'edge_k': 0.24375049989460107, 'edge_cap': 0.1854054110972346, 'bull_strategy': 'breakout', 'bull_bb_std_mult': 3.4518041632001886, 'bull_rsi_os': 14, 'bull_rsi_ob': 77, 'bull_adx_thresh': 10.757614347437913, 'bull_atr_min_pct': 0.003480872913608035, 'bull_atr_max_pct': 0.035007897400423524, 'bull_tp_mult': 2.8188496163237753, 'bull_tsl_mult': 0.9813855052454932, 'bull_time_stop': 62, 'bull_use_sma': False, 'bull_use_ema': False, 'bull_use_atr': False, 'bull_use_adx': True, 'bull_use_spike': True, 'bull_rsi_required': True, 'bear_strategy': 'breakout', 'bear_bb_std_mult': 1.5052896009947947, 'bear_rsi_os': 25, 'bear_rsi_ob': 53, 'bear_adx_thresh': 12.796552049800649, 'bear_atr_min_pct': 0.024209519888284542, 'bear_atr_max_pct': 0.13947659671789345, 'bear_tp_mult': 2.786046571665606, 'bear_tsl_mult': 0.7844254090036984, 'bear_time_stop': 216, 'bear_use_sma': False, 'bear_use_ema': True, 'bear_use_atr': True, 'bear_use_adx': False, 'bear_use_spike': True, 'bear_rsi_required': True, 'sideways_strategy': 'mean_reversion', 'sideways_bb_std_mult': 2.5864832849204076, 'sideways_rsi_os': 35, 'sideways_rsi_ob': 60, 'sideways_adx_thresh': 12.774058019777952, 'sideways_atr_min_pct': 0.0068582439134250855, 'sideways_atr_max_pct': 0.09871404028634026, 'sideways_tp_mult': 1.8905786348184133, 'sideways_tsl_mult': 0.9089898149176855, 'sideways_time_stop': 258, 'sideways_use_sma': True, 'sideways_use_ema': False, 'sideways_use_atr': False, 'sideways_use_adx': False, 'sideways_use_spike': True, 'sideways_rsi_required': False}.
[I 2025-08-31 10:50:41,066] Trial 482 finished with values: [-1000000000.0, 1000000000.0] and parameters: {'p_sma': 43, 'p_std': 20, 'p_atr': 20, 'p_adx': 21, 'rsi_period': 41, 'ema1': 19, 'ema2': 50, 'slip_atr_k': 0.012030228394526863, 'slip_spread_k': 0.2762283848220442, 'spread_hl_frac': 0.025873953795359464, 'bb_std_mult': 3.2552598471714593, 'rsi_os': 31, 'rsi_ob': 87, 'vol_spike': 0.23307235534431386, 'adx_thresh': 7.81237642308324, 'atr_min_pct': 0.029577260408824444, 'atr_max_pct': 0.013515445338196902, 'tp_mult': 2.8111694982583586, 'tsl_mult': 0.9194654690610131, 'strategy': 'breakout', 'time_stop': 72, 'use_sma': True, 'use_atr': False, 'use_adx': False, 'use_ema': False, 'use_spike': False, 'rsi_required': False, 'edge_k': 1.7688220687412288, 'edge_cap': 0.19133805255340336, 'bull_strategy': 'mean_reversion', 'bull_bb_std_mult': 3.431043449764983, 'bull_rsi_os': 44, 'bull_rsi_ob': 76, 'bull_adx_thresh': 17.62065416046221, 'bull_atr_min_pct': 0.004502972692419364, 'bull_atr_max_pct': 0.05024528957617828, 'bull_tp_mult': 2.871191941487994, 'bull_tsl_mult': 0.5988763697938592, 'bull_time_stop': 85, 'bull_use_sma': False, 'bull_use_ema': True, 'bull_use_atr': False, 'bull_use_adx': True, 'bull_use_spike': True, 'bull_rsi_required': False, 'bear_strategy': 'breakout', 'bear_bb_std_mult': 1.3175075992392764, 'bear_rsi_os': 24, 'bear_rsi_ob': 75, 'bear_adx_thresh': 15.010696500422213, 'bear_atr_min_pct': 0.02506376707643906, 'bear_atr_max_pct': 0.1422829421739675, 'bear_tp_mult': 1.609803707059842, 'bear_tsl_mult': 0.7839836420148465, 'bear_time_stop': 160, 'bear_use_sma': False, 'bear_use_ema': False, 'bear_use_atr': True, 'bear_use_adx': True, 'bear_use_spike': True, 'bear_rsi_required': True, 'sideways_strategy': 'mean_reversion', 'sideways_bb_std_mult': 2.4767740162783634, 'sideways_rsi_os': 36, 'sideways_rsi_ob': 59, 'sideways_adx_thresh': 14.732970649527111, 'sideways_atr_min_pct': 0.006068877024298056, 'sideways_atr_max_pct': 0.018323999446364148, 'sideways_tp_mult': 1.9489916345775415, 'sideways_tsl_mult': 0.9116390476184599, 'sideways_time_stop': 271, 'sideways_use_sma': True, 'sideways_use_ema': True, 'sideways_use_atr': False, 'sideways_use_adx': False, 'sideways_use_spike': True, 'sideways_rsi_required': True}.
[I 2025-08-31 10:51:12,317] Trial 484 finished with values: [-1000000000.0, 1000000000.0] and parameters: {'p_sma': 43, 'p_std': 12, 'p_atr': 20, 'p_adx': 21, 'rsi_period': 41, 'ema1': 22, 'ema2': 24, 'slip_atr_k': 0.009685442489418054, 'slip_spread_k': 0.04934437910992018, 'spread_hl_frac': 0.024895051747632402, 'bb_std_mult': 3.5467139271627977, 'rsi_os': 37, 'rsi_ob': 75, 'vol_spike': 0.2765213477674147, 'adx_thresh': 30.88426970367173, 'atr_min_pct': 0.017301470502961182, 'atr_max_pct': 0.03182543566182839, 'tp_mult': 2.817247139228304, 'tsl_mult': 0.21233528453931289, 'strategy': 'breakout', 'time_stop': 201, 'use_sma': True, 'use_atr': False, 'use_adx': False, 'use_ema': False, 'use_spike': False, 'rsi_required': False, 'edge_k': 1.7876816221397196, 'edge_cap': 0.1901767485215612, 'bull_strategy': 'mean_reversion', 'bull_bb_std_mult': 3.431912073374066, 'bull_rsi_os': 47, 'bull_rsi_ob': 78, 'bull_adx_thresh': 17.66246109955937, 'bull_atr_min_pct': 0.0044580510280402014, 'bull_atr_max_pct': 0.04402840428323634, 'bull_tp_mult': 2.657063715958642, 'bull_tsl_mult': 0.20198732243327883, 'bull_time_stop': 54, 'bull_use_sma': False, 'bull_use_ema': True, 'bull_use_atr': False, 'bull_use_adx': True, 'bull_use_spike': True, 'bull_rsi_required': False, 'bear_strategy': 'breakout', 'bear_bb_std_mult': 1.2627399606391951, 'bear_rsi_os': 24, 'bear_rsi_ob': 56, 'bear_adx_thresh': 15.024088817107833, 'bear_atr_min_pct': 0.024775945401440985, 'bear_atr_max_pct': 0.1421779707088531, 'bear_tp_mult': 1.510588822542531, 'bear_tsl_mult': 0.7913334357633083, 'bear_time_stop': 143, 'bear_use_sma': False, 'bear_use_ema': False, 'bear_use_atr': True, 'bear_use_adx': True, 'bear_use_spike': False, 'bear_rsi_required': True, 'sideways_strategy': 'mean_reversion', 'sideways_bb_std_mult': 0.8073424574829526, 'sideways_rsi_os': 36, 'sideways_rsi_ob': 58, 'sideways_adx_thresh': 14.347681040588093, 'sideways_atr_min_pct': 0.006090403505142695, 'sideways_atr_max_pct': 0.018943283822444517, 'sideways_tp_mult': 1.9523820077050915, 'sideways_tsl_mult': 0.9094336647074182, 'sideways_time_stop': 151, 'sideways_use_sma': True, 'sideways_use_ema': True, 'sideways_use_atr': False, 'sideways_use_adx': False, 'sideways_use_spike': True, 'sideways_rsi_required': True}.
[I 2025-08-31 10:51:12,697] Trial 481 finished with values: [-1000000000.0, 1000000000.0] and parameters: {'p_sma': 43, 'p_std': 39, 'p_atr': 23, 'p_adx': 21, 'rsi_period': 34, 'ema1': 23, 'ema2': 26, 'slip_atr_k': 0.01078919358913405, 'slip_spread_k': 0.2770090403824945, 'spread_hl_frac': 0.026197760980806842, 'bb_std_mult': 1.0348299105140928, 'rsi_os': 37, 'rsi_ob': 53, 'vol_spike': 0.022509571715245896, 'adx_thresh': 9.289649523572011, 'atr_min_pct': 0.013886989042707926, 'atr_max_pct': 0.0313764333418642, 'tp_mult': 2.48425827007492, 'tsl_mult': 0.20847322712528893, 'strategy': 'breakout', 'time_stop': 154, 'use_sma': False, 'use_atr': False, 'use_adx': False, 'use_ema': False, 'use_spike': False, 'rsi_required': False, 'edge_k': 1.7925484693913933, 'edge_cap': 0.18936440416302908, 'bull_strategy': 'mean_reversion', 'bull_bb_std_mult': 3.5973940284088672, 'bull_rsi_os': 17, 'bull_rsi_ob': 78, 'bull_adx_thresh': 33.51283585594766, 'bull_atr_min_pct': 0.004082804394041367, 'bull_atr_max_pct': 0.049968983617277224, 'bull_tp_mult': 2.677189613827512, 'bull_tsl_mult': 0.5191152809011275, 'bull_time_stop': 51, 'bull_use_sma': False, 'bull_use_ema': True, 'bull_use_atr': False, 'bull_use_adx': True, 'bull_use_spike': True, 'bull_rsi_required': False, 'bear_strategy': 'breakout', 'bear_bb_std_mult': 1.3137530563039863, 'bear_rsi_os': 24, 'bear_rsi_ob': 86, 'bear_adx_thresh': 14.916066061681567, 'bear_atr_min_pct': 0.024808391371744953, 'bear_atr_max_pct': 0.13235142914706516, 'bear_tp_mult': 2.6780603429718774, 'bear_tsl_mult': 0.11993868515620515, 'bear_time_stop': 103, 'bear_use_sma': False, 'bear_use_ema': False, 'bear_use_atr': True, 'bear_use_adx': True, 'bear_use_spike': True, 'bear_rsi_required': True, 'sideways_strategy': 'mean_reversion', 'sideways_bb_std_mult': 2.4223670145278517, 'sideways_rsi_os': 20, 'sideways_rsi_ob': 59, 'sideways_adx_thresh': 14.962598620411685, 'sideways_atr_min_pct': 0.00465086135577612, 'sideways_atr_max_pct': 0.014918791130481945, 'sideways_tp_mult': 1.944052259067002, 'sideways_tsl_mult': 0.9082472256516485, 'sideways_time_stop': 179, 'sideways_use_sma': True, 'sideways_use_ema': True, 'sideways_use_atr': False, 'sideways_use_adx': False, 'sideways_use_spike': False, 'sideways_rsi_required': True}.
[I 2025-08-31 10:51:12,893] Trial 483 finished with values: [-1000000000.0, 1000000000.0] and parameters: {'p_sma': 43, 'p_std': 37, 'p_atr': 23, 'p_adx': 21, 'rsi_period': 41, 'ema1': 23, 'ema2': 57, 'slip_atr_k': 0.009922385314135335, 'slip_spread_k': 0.6315926649565615, 'spread_hl_frac': 0.04025309115697236, 'bb_std_mult': 2.67652700851823, 'rsi_os': 37, 'rsi_ob': 75, 'vol_spike': 0.2754815923406002, 'adx_thresh': 9.040303154171472, 'atr_min_pct': 0.013940293577786486, 'atr_max_pct': 0.03034944822205332, 'tp_mult': 2.9515349587715827, 'tsl_mult': 0.21249315038130157, 'strategy': 'breakout', 'time_stop': 152, 'use_sma': True, 'use_atr': False, 'use_adx': False, 'use_ema': False, 'use_spike': False, 'rsi_required': False, 'edge_k': 0.6663461558891834, 'edge_cap': 0.19045804998313784, 'bull_strategy': 'mean_reversion', 'bull_bb_std_mult': 3.437805224986118, 'bull_rsi_os': 31, 'bull_rsi_ob': 78, 'bull_adx_thresh': 9.059933323876466, 'bull_atr_min_pct': 0.004378112506355921, 'bull_atr_max_pct': 0.054766851886592735, 'bull_tp_mult': 2.6687769718792422, 'bull_tsl_mult': 0.5533421246246589, 'bull_time_stop': 85, 'bull_use_sma': False, 'bull_use_ema': True, 'bull_use_atr': False, 'bull_use_adx': True, 'bull_use_spike': False, 'bull_rsi_required': False, 'bear_strategy': 'breakout', 'bear_bb_std_mult': 1.3280202510289174, 'bear_rsi_os': 23, 'bear_rsi_ob': 75, 'bear_adx_thresh': 14.80023118176246, 'bear_atr_min_pct': 0.02502122487064361, 'bear_atr_max_pct': 0.13297116996352545, 'bear_tp_mult': 2.6843426407908795, 'bear_tsl_mult': 0.13231048552336183, 'bear_time_stop': 233, 'bear_use_sma': False, 'bear_use_ema': False, 'bear_use_atr': True, 'bear_use_adx': True, 'bear_use_spike': True, 'bear_rsi_required': True, 'sideways_strategy': 'mean_reversion', 'sideways_bb_std_mult': 2.426613949906943, 'sideways_rsi_os': 35, 'sideways_rsi_ob': 59, 'sideways_adx_thresh': 14.917794710126984, 'sideways_atr_min_pct': 0.00605621571211387, 'sideways_atr_max_pct': 0.024639127568985925, 'sideways_tp_mult': 1.9490410979197494, 'sideways_tsl_mult': 0.8624952988480694, 'sideways_time_stop': 266, 'sideways_use_sma': True, 'sideways_use_ema': True, 'sideways_use_atr': False, 'sideways_use_adx': False, 'sideways_use_spike': True, 'sideways_rsi_required': True}.
[I 2025-08-31 10:51:13,888] Trial 485 finished with values: [-1000000000.0, 1000000000.0] and parameters: {'p_sma': 43, 'p_std': 38, 'p_atr': 23, 'p_adx': 19, 'rsi_period': 39, 'ema1': 22, 'ema2': 57, 'slip_atr_k': 0.023026123746538646, 'slip_spread_k': 0.20512676598637253, 'spread_hl_frac': 0.009099298336280249, 'bb_std_mult': 2.6455555476934567, 'rsi_os': 33, 'rsi_ob': 58, 'vol_spike': 0.15007486588004496, 'adx_thresh': 9.191070862922524, 'atr_min_pct': 0.028011209347392478, 'atr_max_pct': 0.03100854704021165, 'tp_mult': 2.823808242633286, 'tsl_mult': 0.7140438309904285, 'strategy': 'mean_reversion', 'time_stop': 173, 'use_sma': False, 'use_atr': False, 'use_adx': False, 'use_ema': False, 'use_spike': False, 'rsi_required': False, 'edge_k': 1.7104058389579535, 'edge_cap': 0.4528024245091523, 'bull_strategy': 'breakout', 'bull_bb_std_mult': 3.465478767361489, 'bull_rsi_os': 14, 'bull_rsi_ob': 82, 'bull_adx_thresh': 9.011039047546191, 'bull_atr_min_pct': 0.00938966890910577, 'bull_atr_max_pct': 0.044011464860092206, 'bull_tp_mult': 2.6838810234573103, 'bull_tsl_mult': 0.09642534047798629, 'bull_time_stop': 61, 'bull_use_sma': False, 'bull_use_ema': True, 'bull_use_atr': False, 'bull_use_adx': True, 'bull_use_spike': True, 'bull_rsi_required': False, 'bear_strategy': 'mean_reversion', 'bear_bb_std_mult': 1.3385687499648369, 'bear_rsi_os': 23, 'bear_rsi_ob': 54, 'bear_adx_thresh': 14.45384857796991, 'bear_atr_min_pct': 0.02485216446068948, 'bear_atr_max_pct': 0.1364951403517535, 'bear_tp_mult': 2.6797212155310155, 'bear_tsl_mult': 0.8413876981132874, 'bear_time_stop': 105, 'bear_use_sma': False, 'bear_use_ema': False, 'bear_use_atr': True, 'bear_use_adx': False, 'bear_use_spike': False, 'bear_rsi_required': True, 'sideways_strategy': 'mean_reversion', 'sideways_bb_std_mult': 1.8078139079650284, 'sideways_rsi_os': 35, 'sideways_rsi_ob': 59, 'sideways_adx_thresh': 10.123565142398588, 'sideways_atr_min_pct': 0.005239286538570039, 'sideways_atr_max_pct': 0.010046810545410232, 'sideways_tp_mult': 1.7766215967820138, 'sideways_tsl_mult': 0.868876577898714, 'sideways_time_stop': 264, 'sideways_use_sma': True, 'sideways_use_ema': False, 'sideways_use_atr': False, 'sideways_use_adx': False, 'sideways_use_spike': True, 'sideways_rsi_required': False}.
