[I 2025-08-31 11:07:47,492] Trial 611 finished with values: [-1000000000.0, 1000000000.0] and parameters: {'p_sma': 38, 'p_std': 12, 'p_atr': 29, 'p_adx': 22, 'rsi_period': 33, 'ema1': 5, 'ema2': 27, 'slip_atr_k': 0.01856689151631889, 'slip_spread_k': 0.4555297590454818, 'spread_hl_frac': 0.022365481714810443, 'bb_std_mult': 0.5488534939178875, 'rsi_os': 25, 'rsi_ob': 83, 'vol_spike': 0.11588882315042714, 'adx_thresh': 10.835509350323898, 'atr_min_pct': 0.021520866443724158, 'atr_max_pct': 0.06079465392582212, 'tp_mult': 2.952180265674906, 'tsl_mult': 0.11502483492571589, 'strategy': 'breakout', 'time_stop': 86, 'use_sma': True, 'use_atr': True, 'use_adx': False, 'use_ema': True, 'use_spike': False, 'rsi_required': False, 'edge_k': 1.5221643322892582, 'edge_cap': 0.751658815298297, 'bull_strategy': 'mean_reversion', 'bull_bb_std_mult': 2.530969416681305, 'bull_rsi_os': 41, 'bull_rsi_ob': 63, 'bull_adx_thresh': 26.924005293408605, 'bull_atr_min_pct': 0.013503276181938417, 'bull_atr_max_pct': 0.032699694054636554, 'bull_tp_mult': 2.9249640149432143, 'bull_tsl_mult': 0.23959895169752587, 'bull_time_stop': 51, 'bull_use_sma': False, 'bull_use_ema': False, 'bull_use_atr': False, 'bull_use_adx': False, 'bull_use_spike': False, 'bull_rsi_required': True, 'bear_strategy': 'mean_reversion', 'bear_bb_std_mult': 1.5619634273532457, 'bear_rsi_os': 53, 'bear_rsi_ob': 52, 'bear_adx_thresh': 10.10093814407284, 'bear_atr_min_pct': 0.01355795975826502, 'bear_atr_max_pct': 0.1379219919451006, 'bear_tp_mult': 1.9104223876853312, 'bear_tsl_mult': 0.9346682909265979, 'bear_time_stop': 100, 'bear_use_sma': False, 'bear_use_ema': True, 'bear_use_atr': False, 'bear_use_adx': False, 'bear_use_spike': False, 'bear_rsi_required': False, 'sideways_strategy': 'mean_reversion', 'sideways_bb_std_mult': 0.9169968682316525, 'sideways_rsi_os': 43, 'sideways_rsi_ob': 64, 'sideways_adx_thresh': 27.41842792564319, 'sideways_atr_min_pct': 0.006025110296067097, 'sideways_atr_max_pct': 0.11166837616598348, 'sideways_tp_mult': 1.4503759883851948, 'sideways_tsl_mult': 0.7103098633835547, 'sideways_time_stop': 167, 'sideways_use_sma': True, 'sideways_use_ema': True, 'sideways_use_atr': True, 'sideways_use_adx': False, 'sideways_use_spike': False, 'sideways_rsi_required': True}.
[I 2025-08-31 11:08:19,652] Trial 614 finished with values: [-0.11145027893702841, 0.1113680605535795] and parameters: {'p_sma': 29, 'p_std': 11, 'p_atr': 28, 'p_adx': 21, 'rsi_period': 33, 'ema1': 5, 'ema2': 22, 'slip_atr_k': 0.01779210825052064, 'slip_spread_k': 0.4569611692584167, 'spread_hl_frac': 0.0213630857815635, 'bb_std_mult': 0.617420116382015, 'rsi_os': 31, 'rsi_ob': 84, 'vol_spike': 0.11697435078541915, 'adx_thresh': 11.444049061254537, 'atr_min_pct': 0.022460942048936304, 'atr_max_pct': 0.06073903289891163, 'tp_mult': 2.9636475615446973, 'tsl_mult': 0.11826513033417504, 'strategy': 'breakout', 'time_stop': 82, 'use_sma': True, 'use_atr': True, 'use_adx': False, 'use_ema': True, 'use_spike': False, 'rsi_required': False, 'edge_k': 1.4333236592816234, 'edge_cap': 0.7570165071649875, 'bull_strategy': 'mean_reversion', 'bull_bb_std_mult': 1.5632952692724038, 'bull_rsi_os': 41, 'bull_rsi_ob': 63, 'bull_adx_thresh': 26.683471480639483, 'bull_atr_min_pct': 0.013753263189722918, 'bull_atr_max_pct': 0.029930766527958542, 'bull_tp_mult': 2.925267061820975, 'bull_tsl_mult': 0.24953343469383307, 'bull_time_stop': 41, 'bull_use_sma': False, 'bull_use_ema': True, 'bull_use_atr': False, 'bull_use_adx': True, 'bull_use_spike': False, 'bull_rsi_required': False, 'bear_strategy': 'mean_reversion', 'bear_bb_std_mult': 1.5378708867647986, 'bear_rsi_os': 53, 'bear_rsi_ob': 52, 'bear_adx_thresh': 9.7349401906844, 'bear_atr_min_pct': 0.0006786454093593644, 'bear_atr_max_pct': 0.014951859001686676, 'bear_tp_mult': 1.5269992992401327, 'bear_tsl_mult': 0.900971144867726, 'bear_time_stop': 106, 'bear_use_sma': False, 'bear_use_ema': False, 'bear_use_atr': True, 'bear_use_adx': True, 'bear_use_spike': True, 'bear_rsi_required': False, 'sideways_strategy': 'mean_reversion', 'sideways_bb_std_mult': 0.9924054220025975, 'sideways_rsi_os': 40, 'sideways_rsi_ob': 64, 'sideways_adx_thresh': 27.345719538610943, 'sideways_atr_min_pct': 0.00633347334632106, 'sideways_atr_max_pct': 0.10728507659920476, 'sideways_tp_mult': 1.5176265284062593, 'sideways_tsl_mult': 0.8884394111536926, 'sideways_time_stop': 164, 'sideways_use_sma': True, 'sideways_use_ema': True, 'sideways_use_atr': True, 'sideways_use_adx': False, 'sideways_use_spike': False, 'sideways_rsi_required': False}.
[I 2025-08-31 11:08:19,760] Trial 613 finished with values: [-1000000000.0, 1000000000.0] and parameters: {'p_sma': 38, 'p_std': 10, 'p_atr': 29, 'p_adx': 21, 'rsi_period': 34, 'ema1': 5, 'ema2': 29, 'slip_atr_k': 0.01745454070962857, 'slip_spread_k': 0.4638935650648302, 'spread_hl_frac': 0.02119185110167122, 'bb_std_mult': 0.6062117747000634, 'rsi_os': 31, 'rsi_ob': 84, 'vol_spike': 0.03966033425705802, 'adx_thresh': 11.04089661158869, 'atr_min_pct': 0.02152892912038173, 'atr_max_pct': 0.06286793477716977, 'tp_mult': 2.9662576405481893, 'tsl_mult': 0.10785644489207483, 'strategy': 'breakout', 'time_stop': 81, 'use_sma': True, 'use_atr': True, 'use_adx': False, 'use_ema': True, 'use_spike': False, 'rsi_required': False, 'edge_k': 1.4425080930597214, 'edge_cap': 0.6993210722512652, 'bull_strategy': 'mean_reversion', 'bull_bb_std_mult': 1.576967900852072, 'bull_rsi_os': 41, 'bull_rsi_ob': 63, 'bull_adx_thresh': 27.076069255953854, 'bull_atr_min_pct': 0.013042340649149359, 'bull_atr_max_pct': 0.029921181764024102, 'bull_tp_mult': 2.9325854968974423, 'bull_tsl_mult': 0.23522760676248672, 'bull_time_stop': 49, 'bull_use_sma': False, 'bull_use_ema': False, 'bull_use_atr': False, 'bull_use_adx': True, 'bull_use_spike': False, 'bull_rsi_required': False, 'bear_strategy': 'mean_reversion', 'bear_bb_std_mult': 1.556658623737607, 'bear_rsi_os': 53, 'bear_rsi_ob': 51, 'bear_adx_thresh': 9.585401817113716, 'bear_atr_min_pct': 0.0072894775390178615, 'bear_atr_max_pct': 0.1384298488974161, 'bear_tp_mult': 1.9536056043260093, 'bear_tsl_mult': 0.8946850548115703, 'bear_time_stop': 92, 'bear_use_sma': False, 'bear_use_ema': False, 'bear_use_atr': True, 'bear_use_adx': True, 'bear_use_spike': True, 'bear_rsi_required': False, 'sideways_strategy': 'mean_reversion', 'sideways_bb_std_mult': 0.9882459426698633, 'sideways_rsi_os': 40, 'sideways_rsi_ob': 63, 'sideways_adx_thresh': 27.380445097076525, 'sideways_atr_min_pct': 0.02101682154988458, 'sideways_atr_max_pct': 0.10659413406589673, 'sideways_tp_mult': 1.4473008507935627, 'sideways_tsl_mult': 0.21550887288365178, 'sideways_time_stop': 164, 'sideways_use_sma': True, 'sideways_use_ema': True, 'sideways_use_atr': True, 'sideways_use_adx': False, 'sideways_use_spike': True, 'sideways_rsi_required': False}.
[I 2025-08-31 11:08:19,953] Trial 616 finished with values: [-1000000000.0, 1000000000.0] and parameters: {'p_sma': 28, 'p_std': 11, 'p_atr': 28, 'p_adx': 21, 'rsi_period': 33, 'ema1': 5, 'ema2': 22, 'slip_atr_k': 0.017657104881223545, 'slip_spread_k': 0.4807085671392893, 'spread_hl_frac': 0.021403126565612277, 'bb_std_mult': 0.6692232281600508, 'rsi_os': 27, 'rsi_ob': 84, 'vol_spike': 0.06311624947011693, 'adx_thresh': 11.128692114634402, 'atr_min_pct': 0.021344534485463463, 'atr_max_pct': 0.06308093206085985, 'tp_mult': 2.9150809723376123, 'tsl_mult': 0.13709011004378224, 'strategy': 'breakout', 'time_stop': 80, 'use_sma': True, 'use_atr': True, 'use_adx': False, 'use_ema': True, 'use_spike': False, 'rsi_required': False, 'edge_k': 1.4489230538172295, 'edge_cap': 0.7579062185083367, 'bull_strategy': 'mean_reversion', 'bull_bb_std_mult': 2.748048525847559, 'bull_rsi_os': 42, 'bull_rsi_ob': 62, 'bull_adx_thresh': 25.90391698460028, 'bull_atr_min_pct': 0.012541962373281939, 'bull_atr_max_pct': 0.03677927747305139, 'bull_tp_mult': 2.8905652100960713, 'bull_tsl_mult': 0.26957830816707007, 'bull_time_stop': 41, 'bull_use_sma': False, 'bull_use_ema': True, 'bull_use_atr': False, 'bull_use_adx': True, 'bull_use_spike': False, 'bull_rsi_required': False, 'bear_strategy': 'mean_reversion', 'bear_bb_std_mult': 1.5251318191075418, 'bear_rsi_os': 52, 'bear_rsi_ob': 51, 'bear_adx_thresh': 9.66783596771129, 'bear_atr_min_pct': 0.009673587233074673, 'bear_atr_max_pct': 0.052863640267813164, 'bear_tp_mult': 1.9478890708924381, 'bear_tsl_mult': 0.9046466359511199, 'bear_time_stop': 107, 'bear_use_sma': True, 'bear_use_ema': False, 'bear_use_atr': True, 'bear_use_adx': True, 'bear_use_spike': True, 'bear_rsi_required': False, 'sideways_strategy': 'mean_reversion', 'sideways_bb_std_mult': 1.002060730698451, 'sideways_rsi_os': 40, 'sideways_rsi_ob': 63, 'sideways_adx_thresh': 26.446666068282312, 'sideways_atr_min_pct': 0.02577850794799244, 'sideways_atr_max_pct': 0.1060813918249911, 'sideways_tp_mult': 1.5372288170627184, 'sideways_tsl_mult': 0.8797160572403782, 'sideways_time_stop': 172, 'sideways_use_sma': False, 'sideways_use_ema': True, 'sideways_use_atr': False, 'sideways_use_adx': True, 'sideways_use_spike': True, 'sideways_rsi_required': False}.
[I 2025-08-31 11:08:20,089] Trial 615 finished with values: [-0.11885128588449623, 0.1187265066178251] and parameters: {'p_sma': 29, 'p_std': 11, 'p_atr': 28, 'p_adx': 21, 'rsi_period': 34, 'ema1': 5, 'ema2': 20, 'slip_atr_k': 0.017013268606008162, 'slip_spread_k': 0.4843618498313636, 'spread_hl_frac': 0.02147469005928403, 'bb_std_mult': 0.6068831090974623, 'rsi_os': 31, 'rsi_ob': 84, 'vol_spike': 0.039778584822114424, 'adx_thresh': 11.082140504077366, 'atr_min_pct': 0.022420791083667752, 'atr_max_pct': 0.06537781677349336, 'tp_mult': 2.962700047519453, 'tsl_mult': 0.1277807693611483, 'strategy': 'breakout', 'time_stop': 83, 'use_sma': True, 'use_atr': True, 'use_adx': False, 'use_ema': True, 'use_spike': False, 'rsi_required': False, 'edge_k': 1.4489569474653512, 'edge_cap': 0.6962528347539194, 'bull_strategy': 'mean_reversion', 'bull_bb_std_mult': 2.426879608395432, 'bull_rsi_os': 42, 'bull_rsi_ob': 62, 'bull_adx_thresh': 27.32721696959519, 'bull_atr_min_pct': 0.012379021000647483, 'bull_atr_max_pct': 0.03664957198146788, 'bull_tp_mult': 2.863137491291759, 'bull_tsl_mult': 0.2729522177456536, 'bull_time_stop': 41, 'bull_use_sma': False, 'bull_use_ema': True, 'bull_use_atr': False, 'bull_use_adx': True, 'bull_use_spike': False, 'bull_rsi_required': False, 'bear_strategy': 'mean_reversion', 'bear_bb_std_mult': 1.525399879926783, 'bear_rsi_os': 54, 'bear_rsi_ob': 51, 'bear_adx_thresh': 9.312352706683997, 'bear_atr_min_pct': 0.000874539682996456, 'bear_atr_max_pct': 0.09737109464280343, 'bear_tp_mult': 2.698078828251262, 'bear_tsl_mult': 0.9068369081989, 'bear_time_stop': 91, 'bear_use_sma': True, 'bear_use_ema': False, 'bear_use_atr': True, 'bear_use_adx': True, 'bear_use_spike': True, 'bear_rsi_required': False, 'sideways_strategy': 'mean_reversion', 'sideways_bb_std_mult': 0.9913677481424171, 'sideways_rsi_os': 40, 'sideways_rsi_ob': 62, 'sideways_adx_thresh': 26.506730752303437, 'sideways_atr_min_pct': 0.01160079769590015, 'sideways_atr_max_pct': 0.10721695197889873, 'sideways_tp_mult': 1.5367673259369516, 'sideways_tsl_mult': 0.6115578861694294, 'sideways_time_stop': 173, 'sideways_use_sma': False, 'sideways_use_ema': True, 'sideways_use_atr': False, 'sideways_use_adx': True, 'sideways_use_spike': True, 'sideways_rsi_required': False}.
[I 2025-08-31 11:08:53,023] Trial 618 finished with values: [-1000000000.0, 1000000000.0] and parameters: {'p_sma': 28, 'p_std': 9, 'p_atr': 28, 'p_adx': 21, 'rsi_period': 34, 'ema1': 5, 'ema2': 20, 'slip_atr_k': 0.024179154168686573, 'slip_spread_k': 0.4799756129458463, 'spread_hl_frac': 0.022532960483883348, 'bb_std_mult': 0.6364156087513388, 'rsi_os': 24, 'rsi_ob': 84, 'vol_spike': 0.1429247426368445, 'adx_thresh': 10.647576564767387, 'atr_min_pct': 0.022496438428596745, 'atr_max_pct': 0.0653576258870536, 'tp_mult': 2.9135868771652524, 'tsl_mult': 0.09478861914473556, 'strategy': 'breakout', 'time_stop': 83, 'use_sma': True, 'use_atr': True, 'use_adx': False, 'use_ema': True, 'use_spike': False, 'rsi_required': False, 'edge_k': 1.4745846638531093, 'edge_cap': 0.7322159055907506, 'bull_strategy': 'mean_reversion', 'bull_bb_std_mult': 1.4348602641708, 'bull_rsi_os': 42, 'bull_rsi_ob': 62, 'bull_adx_thresh': 26.120481132672317, 'bull_atr_min_pct': 0.012418910571664962, 'bull_atr_max_pct': 0.03557982526022087, 'bull_tp_mult': 2.8742114411993214, 'bull_tsl_mult': 0.2687235754205222, 'bull_time_stop': 44, 'bull_use_sma': False, 'bull_use_ema': True, 'bull_use_atr': False, 'bull_use_adx': True, 'bull_use_spike': False, 'bull_rsi_required': False, 'bear_strategy': 'mean_reversion', 'bear_bb_std_mult': 1.6212577931731809, 'bear_rsi_os': 52, 'bear_rsi_ob': 53, 'bear_adx_thresh': 9.373405778731156, 'bear_atr_min_pct': 0.010654419353938394, 'bear_atr_max_pct': 0.09727477379208668, 'bear_tp_mult': 1.6298514701653684, 'bear_tsl_mult': 0.9142062408464003, 'bear_time_stop': 92, 'bear_use_sma': True, 'bear_use_ema': False, 'bear_use_atr': True, 'bear_use_adx': False, 'bear_use_spike': True, 'bear_rsi_required': False, 'sideways_strategy': 'mean_reversion', 'sideways_bb_std_mult': 1.0289321912374032, 'sideways_rsi_os': 41, 'sideways_rsi_ob': 63, 'sideways_adx_thresh': 26.39577665187389, 'sideways_atr_min_pct': 0.005513601667921181, 'sideways_atr_max_pct': 0.10634200727687401, 'sideways_tp_mult': 1.5191546714010706, 'sideways_tsl_mult': 0.2665422026838331, 'sideways_time_stop': 172, 'sideways_use_sma': False, 'sideways_use_ema': True, 'sideways_use_atr': False, 'sideways_use_adx': True, 'sideways_use_spike': True, 'sideways_rsi_required': False}.
[I 2025-08-31 11:08:53,310] Trial 620 finished with values: [-1000000000.0, 1000000000.0] and parameters: {'p_sma': 27, 'p_std': 13, 'p_atr': 28, 'p_adx': 21, 'rsi_period': 36, 'ema1': 6, 'ema2': 36, 'slip_atr_k': 0.025740782863559394, 'slip_spread_k': 0.4345633742336023, 'spread_hl_frac': 0.022304823398559655, 'bb_std_mult': 0.6472052861047, 'rsi_os': 24, 'rsi_ob': 84, 'vol_spike': 0.14568907899577027, 'adx_thresh': 11.557491015529857, 'atr_min_pct': 0.02191140600325721, 'atr_max_pct': 0.0678072640274156, 'tp_mult': 2.905953816785893, 'tsl_mult': 0.09349737696860874, 'strategy': 'breakout', 'time_stop': 99, 'use_sma': True, 'use_atr': True, 'use_adx': False, 'use_ema': True, 'use_spike': False, 'rsi_required': False, 'edge_k': 1.4943274860111537, 'edge_cap': 0.7358587022403927, 'bull_strategy': 'mean_reversion', 'bull_bb_std_mult': 2.130331981416204, 'bull_rsi_os': 42, 'bull_rsi_ob': 65, 'bull_adx_thresh': 25.962603887018044, 'bull_atr_min_pct': 0.01222601483819778, 'bull_atr_max_pct': 0.025335400081404377, 'bull_tp_mult': 2.8850359675611204, 'bull_tsl_mult': 0.22008721113653973, 'bull_time_stop': 51, 'bull_use_sma': False, 'bull_use_ema': True, 'bull_use_atr': False, 'bull_use_adx': True, 'bull_use_spike': False, 'bull_rsi_required': False, 'bear_strategy': 'mean_reversion', 'bear_bb_std_mult': 1.6159951957789842, 'bear_rsi_os': 52, 'bear_rsi_ob': 53, 'bear_adx_thresh': 10.43021538828707, 'bear_atr_min_pct': 0.010593178009358065, 'bear_atr_max_pct': 0.03544020445577184, 'bear_tp_mult': 2.664746461411094, 'bear_tsl_mult': 0.9142288193991938, 'bear_time_stop': 83, 'bear_use_sma': False, 'bear_use_ema': False, 'bear_use_atr': True, 'bear_use_adx': False, 'bear_use_spike': True, 'bear_rsi_required': False, 'sideways_strategy': 'mean_reversion', 'sideways_bb_std_mult': 1.0370998468678772, 'sideways_rsi_os': 42, 'sideways_rsi_ob': 63, 'sideways_adx_thresh': 28.428441084138527, 'sideways_atr_min_pct': 0.005476722612345661, 'sideways_atr_max_pct': 0.10840617495263223, 'sideways_tp_mult': 1.572532543898214, 'sideways_tsl_mult': 0.5504573220626607, 'sideways_time_stop': 164, 'sideways_use_sma': True, 'sideways_use_ema': True, 'sideways_use_atr': False, 'sideways_use_adx': False, 'sideways_use_spike': True, 'sideways_rsi_required': False}.
[I 2025-08-31 11:08:53,598] Trial 619 finished with values: [-1000000000.0, 1000000000.0] and parameters: {'p_sma': 30, 'p_std': 9, 'p_atr': 28, 'p_adx': 21, 'rsi_period': 36, 'ema1': 6, 'ema2': 25, 'slip_atr_k': 0.024994985804980798, 'slip_spread_k': 0.4326282133992501, 'spread_hl_frac': 0.022708089217935823, 'bb_std_mult': 0.6277614785278779, 'rsi_os': 24, 'rsi_ob': 85, 'vol_spike': 0.14564366714644547, 'adx_thresh': 10.666136555791244, 'atr_min_pct': 0.02243317346231651, 'atr_max_pct': 0.06771452422236426, 'tp_mult': 2.9052235031438913, 'tsl_mult': 0.09222363309769933, 'strategy': 'breakout', 'time_stop': 85, 'use_sma': True, 'use_atr': True, 'use_adx': False, 'use_ema': True, 'use_spike': False, 'rsi_required': False, 'edge_k': 1.4864645216482162, 'edge_cap': 0.7347449278495305, 'bull_strategy': 'mean_reversion', 'bull_bb_std_mult': 1.422382441644488, 'bull_rsi_os': 42, 'bull_rsi_ob': 62, 'bull_adx_thresh': 25.630204005772036, 'bull_atr_min_pct': 0.012286042103094866, 'bull_atr_max_pct': 0.02435514799458368, 'bull_tp_mult': 2.8531357640251924, 'bull_tsl_mult': 0.2158876665658436, 'bull_time_stop': 44, 'bull_use_sma': False, 'bull_use_ema': True, 'bull_use_atr': False, 'bull_use_adx': True, 'bull_use_spike': False, 'bull_rsi_required': False, 'bear_strategy': 'mean_reversion', 'bear_bb_std_mult': 1.645953068766602, 'bear_rsi_os': 54, 'bear_rsi_ob': 53, 'bear_adx_thresh': 10.499042105979452, 'bear_atr_min_pct': 0.01052636777744528, 'bear_atr_max_pct': 0.13298439935888898, 'bear_tp_mult': 1.1075624593172235, 'bear_tsl_mult': 0.9155570030314089, 'bear_time_stop': 91, 'bear_use_sma': False, 'bear_use_ema': False, 'bear_use_atr': True, 'bear_use_adx': False, 'bear_use_spike': True, 'bear_rsi_required': False, 'sideways_strategy': 'mean_reversion', 'sideways_bb_std_mult': 1.0186866850134275, 'sideways_rsi_os': 42, 'sideways_rsi_ob': 62, 'sideways_adx_thresh': 26.280536329783985, 'sideways_atr_min_pct': 0.012249692481340734, 'sideways_atr_max_pct': 0.10677373954500116, 'sideways_tp_mult': 1.5353244831770296, 'sideways_tsl_mult': 0.4679032059071032, 'sideways_time_stop': 172, 'sideways_use_sma': True, 'sideways_use_ema': True, 'sideways_use_atr': False, 'sideways_use_adx': False, 'sideways_use_spike': True, 'sideways_rsi_required': False}.
[I 2025-08-31 11:08:53,789] Trial 617 finished with values: [-1000000000.0, 1000000000.0] and parameters: {'p_sma': 29, 'p_std': 11, 'p_atr': 28, 'p_adx': 21, 'rsi_period': 34, 'ema1': 5, 'ema2': 29, 'slip_atr_k': 0.01820607478797949, 'slip_spread_k': 0.4764381009337187, 'spread_hl_frac': 0.02282587335854067, 'bb_std_mult': 0.6320367611981474, 'rsi_os': 31, 'rsi_ob': 84, 'vol_spike': 0.06339607951212803, 'adx_thresh': 10.625232746359906, 'atr_min_pct': 0.02124955562539634, 'atr_max_pct': 0.06379576395549455, 'tp_mult': 2.9088806971333536, 'tsl_mult': 0.09713013479370888, 'strategy': 'breakout', 'time_stop': 79, 'use_sma': True, 'use_atr': True, 'use_adx': False, 'use_ema': True, 'use_spike': False, 'rsi_required': False, 'edge_k': 1.4625902326737759, 'edge_cap': 0.6995228387825866, 'bull_strategy': 'mean_reversion', 'bull_bb_std_mult': 2.1326021822498773, 'bull_rsi_os': 42, 'bull_rsi_ob': 62, 'bull_adx_thresh': 26.105784738201027, 'bull_atr_min_pct': 0.012707989945829811, 'bull_atr_max_pct': 0.03709127573411662, 'bull_tp_mult': 2.8700068220217174, 'bull_tsl_mult': 0.21955271156051104, 'bull_time_stop': 43, 'bull_use_sma': False, 'bull_use_ema': True, 'bull_use_atr': False, 'bull_use_adx': True, 'bull_use_spike': False, 'bull_rsi_required': False, 'bear_strategy': 'mean_reversion', 'bear_bb_std_mult': 1.5277672841078653, 'bear_rsi_os': 52, 'bear_rsi_ob': 51, 'bear_adx_thresh': 9.510835667840771, 'bear_atr_min_pct': 0.008305792063890566, 'bear_atr_max_pct': 0.05217261511436454, 'bear_tp_mult': 2.6861407729533733, 'bear_tsl_mult': 0.9108352408089448, 'bear_time_stop': 92, 'bear_use_sma': True, 'bear_use_ema': False, 'bear_use_atr': True, 'bear_use_adx': True, 'bear_use_spike': True, 'bear_rsi_required': False, 'sideways_strategy': 'mean_reversion', 'sideways_bb_std_mult': 0.9917580239237288, 'sideways_rsi_os': 40, 'sideways_rsi_ob': 63, 'sideways_adx_thresh': 26.20930809912738, 'sideways_atr_min_pct': 0.011770546369922193, 'sideways_atr_max_pct': 0.1064505369578203, 'sideways_tp_mult': 1.5448210379083946, 'sideways_tsl_mult': 0.8795951536910348, 'sideways_time_stop': 172, 'sideways_use_sma': False, 'sideways_use_ema': True, 'sideways_use_atr': False, 'sideways_use_adx': True, 'sideways_use_spike': True, 'sideways_rsi_required': False}.
