[I 2025-08-31 10:07:18,145] Trial 126 finished with values: [-1000000000.0, 1000000000.0] and parameters: {'p_sma': 20, 'p_std': 31, 'p_atr': 14, 'p_adx': 26, 'rsi_period': 26, 'ema1': 25, 'ema2': 12, 'slip_atr_k': 0.20188358063246017, 'slip_spread_k': 0.8773453245315743, 'spread_hl_frac': 0.0013087194457737598, 'bb_std_mult': 0.6657491246982862, 'rsi_os': 37, 'rsi_ob': 61, 'vol_spike': 0.1859980022677758, 'adx_thresh': 10.039905535025161, 'atr_min_pct': 0.0020129739476043174, 'atr_max_pct': 0.07166370868192355, 'tp_mult': 2.710815808970736, 'tsl_mult': 0.5734022190270132, 'strategy': 'breakout', 'time_stop': 94, 'use_sma': False, 'use_atr': False, 'use_adx': False, 'use_ema': False, 'use_spike': True, 'rsi_required': True, 'edge_k': 1.8351656710252238, 'edge_cap': 0.9167022654110443, 'bull_strategy': 'mean_reversion', 'bull_bb_std_mult': 1.2017915742172294, 'bull_rsi_os': 21, 'bull_rsi_ob': 75, 'bull_adx_thresh': 16.956335779068162, 'bull_atr_min_pct': 0.006063074384721672, 'bull_atr_max_pct': 0.12610058745073652, 'bull_tp_mult': 2.06109184979467, 'bull_tsl_mult': 0.10565700722277202, 'bull_time_stop': 80, 'bull_use_sma': False, 'bull_use_ema': False, 'bull_use_atr': True, 'bull_use_adx': True, 'bull_use_spike': True, 'bull_rsi_required': True, 'bear_strategy': 'mean_reversion', 'bear_bb_std_mult': 2.012701630266296, 'bear_rsi_os': 55, 'bear_rsi_ob': 86, 'bear_adx_thresh': 15.14276148217827, 'bear_atr_min_pct': 0.007382891396823902, 'bear_atr_max_pct': 0.062085373690175534, 'bear_tp_mult': 2.3635379891592576, 'bear_tsl_mult': 0.4126233540898157, 'bear_time_stop': 149, 'bear_use_sma': False, 'bear_use_ema': False, 'bear_use_atr': False, 'bear_use_adx': True, 'bear_use_spike': False, 'bear_rsi_required': True, 'sideways_strategy': 'breakout', 'sideways_bb_std_mult': 1.458022656359343, 'sideways_rsi_os': 15, 'sideways_rsi_ob': 51, 'sideways_adx_thresh': 15.352708060873141, 'sideways_atr_min_pct': 0.010728635471224943, 'sideways_atr_max_pct': 0.019352372800632053, 'sideways_tp_mult': 1.157267969110107, 'sideways_tsl_mult': 0.9418123024949628, 'sideways_time_stop': 177, 'sideways_use_sma': False, 'sideways_use_ema': True, 'sideways_use_atr': True, 'sideways_use_adx': False, 'sideways_use_spike': True, 'sideways_rsi_required': True}.
[I 2025-08-31 10:07:50,454] Trial 127 finished with values: [-1000000000.0, 1000000000.0] and parameters: {'p_sma': 19, 'p_std': 32, 'p_atr': 12, 'p_adx': 26, 'rsi_period': 33, 'ema1': 26, 'ema2': 49, 'slip_atr_k': 0.20443127795914037, 'slip_spread_k': 0.863030510828033, 'spread_hl_frac': 0.0020002125644557624, 'bb_std_mult': 0.637753490538802, 'rsi_os': 32, 'rsi_ob': 63, 'vol_spike': 0.15811775146173768, 'adx_thresh': 9.63554505503729, 'atr_min_pct': 0.001466513897473553, 'atr_max_pct': 0.06187583915915677, 'tp_mult': 2.7088691658962163, 'tsl_mult': 0.9037358781822251, 'strategy': 'breakout', 'time_stop': 124, 'use_sma': True, 'use_atr': False, 'use_adx': False, 'use_ema': False, 'use_spike': True, 'rsi_required': True, 'edge_k': 1.8215942449848237, 'edge_cap': 0.9158093070291079, 'bull_strategy': 'mean_reversion', 'bull_bb_std_mult': 1.0599125058361543, 'bull_rsi_os': 6, 'bull_rsi_ob': 75, 'bull_adx_thresh': 14.503841921953686, 'bull_atr_min_pct': 0.006247337580119396, 'bull_atr_max_pct': 0.0206267250210714, 'bull_tp_mult': 1.400621577390646, 'bull_tsl_mult': 0.17448850034169516, 'bull_time_stop': 67, 'bull_use_sma': False, 'bull_use_ema': False, 'bull_use_atr': True, 'bull_use_adx': True, 'bull_use_spike': True, 'bull_rsi_required': True, 'bear_strategy': 'mean_reversion', 'bear_bb_std_mult': 1.8420614539878628, 'bear_rsi_os': 22, 'bear_rsi_ob': 86, 'bear_adx_thresh': 10.720816698809275, 'bear_atr_min_pct': 0.004663998914274763, 'bear_atr_max_pct': 0.061454073499548414, 'bear_tp_mult': 2.443268616880388, 'bear_tsl_mult': 0.43578089578116286, 'bear_time_stop': 150, 'bear_use_sma': False, 'bear_use_ema': False, 'bear_use_atr': False, 'bear_use_adx': True, 'bear_use_spike': False, 'bear_rsi_required': True, 'sideways_strategy': 'breakout', 'sideways_bb_std_mult': 1.8435016794330907, 'sideways_rsi_os': 12, 'sideways_rsi_ob': 50, 'sideways_adx_thresh': 15.545952802361727, 'sideways_atr_min_pct': 0.010150518639865685, 'sideways_atr_max_pct': 0.021068958556186134, 'sideways_tp_mult': 1.2211442670724206, 'sideways_tsl_mult': 0.900518374262566, 'sideways_time_stop': 161, 'sideways_use_sma': False, 'sideways_use_ema': True, 'sideways_use_atr': True, 'sideways_use_adx': False, 'sideways_use_spike': True, 'sideways_rsi_required': True}.
[I 2025-08-31 10:07:50,787] Trial 128 finished with values: [-1000000000.0, 1000000000.0] and parameters: {'p_sma': 19, 'p_std': 32, 'p_atr': 10, 'p_adx': 26, 'rsi_period': 34, 'ema1': 26, 'ema2': 40, 'slip_atr_k': 0.2206142932198662, 'slip_spread_k': 0.8776768972184066, 'spread_hl_frac': 0.006411701007121636, 'bb_std_mult': 0.6857811915264171, 'rsi_os': 33, 'rsi_ob': 61, 'vol_spike': 0.19429563590266624, 'adx_thresh': 10.091478618508376, 'atr_min_pct': 0.001138786655184007, 'atr_max_pct': 0.07340045349440928, 'tp_mult': 2.7219963211487896, 'tsl_mult': 0.5793049092481785, 'strategy': 'breakout', 'time_stop': 93, 'use_sma': True, 'use_atr': False, 'use_adx': False, 'use_ema': False, 'use_spike': True, 'rsi_required': False, 'edge_k': 1.8366383917176758, 'edge_cap': 0.7229961643850146, 'bull_strategy': 'mean_reversion', 'bull_bb_std_mult': 1.0685413645171005, 'bull_rsi_os': 14, 'bull_rsi_ob': 75, 'bull_adx_thresh': 14.540341148304705, 'bull_atr_min_pct': 0.003726097532851521, 'bull_atr_max_pct': 0.024961304542983155, 'bull_tp_mult': 2.553198900005031, 'bull_tsl_mult': 0.08822568528148778, 'bull_time_stop': 91, 'bull_use_sma': False, 'bull_use_ema': True, 'bull_use_atr': True, 'bull_use_adx': True, 'bull_use_spike': True, 'bull_rsi_required': False, 'bear_strategy': 'mean_reversion', 'bear_bb_std_mult': 1.8593427508448437, 'bear_rsi_os': 32, 'bear_rsi_ob': 86, 'bear_adx_thresh': 12.754294952035622, 'bear_atr_min_pct': 0.01208676021681862, 'bear_atr_max_pct': 0.06873198519743758, 'bear_tp_mult': 2.334366363566869, 'bear_tsl_mult': 0.5129137175741364, 'bear_time_stop': 164, 'bear_use_sma': False, 'bear_use_ema': False, 'bear_use_atr': False, 'bear_use_adx': True, 'bear_use_spike': False, 'bear_rsi_required': True, 'sideways_strategy': 'mean_reversion', 'sideways_bb_std_mult': 1.457011728201073, 'sideways_rsi_os': 14, 'sideways_rsi_ob': 50, 'sideways_adx_thresh': 14.163799891435174, 'sideways_atr_min_pct': 0.008683687971697635, 'sideways_atr_max_pct': 0.020946297434710607, 'sideways_tp_mult': 1.1992159028588343, 'sideways_tsl_mult': 0.8935082530425846, 'sideways_time_stop': 175, 'sideways_use_sma': False, 'sideways_use_ema': True, 'sideways_use_atr': True, 'sideways_use_adx': False, 'sideways_use_spike': True, 'sideways_rsi_required': True}.
[I 2025-08-31 10:07:51,080] Trial 129 finished with values: [-1000000000.0, 1000000000.0] and parameters: {'p_sma': 19, 'p_std': 32, 'p_atr': 14, 'p_adx': 26, 'rsi_period': 34, 'ema1': 26, 'ema2': 36, 'slip_atr_k': 0.20746578821762074, 'slip_spread_k': 0.8784335992529888, 'spread_hl_frac': 0.000347766296147588, 'bb_std_mult': 0.658987696520694, 'rsi_os': 33, 'rsi_ob': 61, 'vol_spike': 0.16289836046176967, 'adx_thresh': 10.166474720154843, 'atr_min_pct': 0.017923262138669464, 'atr_max_pct': 0.07394536692834802, 'tp_mult': 2.549638376157306, 'tsl_mult': 0.5828841920424912, 'strategy': 'breakout', 'time_stop': 94, 'use_sma': True, 'use_atr': False, 'use_adx': False, 'use_ema': False, 'use_spike': True, 'rsi_required': False, 'edge_k': 1.8523493913151334, 'edge_cap': 0.9225929301234921, 'bull_strategy': 'mean_reversion', 'bull_bb_std_mult': 1.2660523026190984, 'bull_rsi_os': 6, 'bull_rsi_ob': 75, 'bull_adx_thresh': 14.984766215982546, 'bull_atr_min_pct': 0.005872401211298917, 'bull_atr_max_pct': 0.02120953998302418, 'bull_tp_mult': 1.3483695110141476, 'bull_tsl_mult': 0.17732039473640274, 'bull_time_stop': 88, 'bull_use_sma': False, 'bull_use_ema': True, 'bull_use_atr': False, 'bull_use_adx': True, 'bull_use_spike': True, 'bull_rsi_required': False, 'bear_strategy': 'mean_reversion', 'bear_bb_std_mult': 1.7357898177237778, 'bear_rsi_os': 22, 'bear_rsi_ob': 85, 'bear_adx_thresh': 15.035945158147364, 'bear_atr_min_pct': 0.0057871401042004925, 'bear_atr_max_pct': 0.07126893260784695, 'bear_tp_mult': 2.1914857593999972, 'bear_tsl_mult': 0.4347382687785578, 'bear_time_stop': 150, 'bear_use_sma': False, 'bear_use_ema': False, 'bear_use_atr': False, 'bear_use_adx': True, 'bear_use_spike': False, 'bear_rsi_required': True, 'sideways_strategy': 'mean_reversion', 'sideways_bb_std_mult': 1.4390952708671712, 'sideways_rsi_os': 12, 'sideways_rsi_ob': 50, 'sideways_adx_thresh': 15.420439362289622, 'sideways_atr_min_pct': 0.0102645568184526, 'sideways_atr_max_pct': 0.0199203886234082, 'sideways_tp_mult': 1.0619395091111925, 'sideways_tsl_mult': 0.8971932459450439, 'sideways_time_stop': 177, 'sideways_use_sma': False, 'sideways_use_ema': True, 'sideways_use_atr': True, 'sideways_use_adx': False, 'sideways_use_spike': True, 'sideways_rsi_required': False}.
[I 2025-08-31 10:07:51,152] Trial 130 finished with values: [-1000000000.0, 1000000000.0] and parameters: {'p_sma': 19, 'p_std': 26, 'p_atr': 15, 'p_adx': 26, 'rsi_period': 33, 'ema1': 26, 'ema2': 36, 'slip_atr_k': 0.22152313078973937, 'slip_spread_k': 0.8396070061756644, 'spread_hl_frac': 0.005288491630171647, 'bb_std_mult': 0.757226745897133, 'rsi_os': 33, 'rsi_ob': 63, 'vol_spike': 0.16172440857346804, 'adx_thresh': 6.526022402863022, 'atr_min_pct': 0.006015150300335077, 'atr_max_pct': 0.07481223410081159, 'tp_mult': 2.5378035566315047, 'tsl_mult': 0.6390180296216631, 'strategy': 'breakout', 'time_stop': 110, 'use_sma': True, 'use_atr': True, 'use_adx': False, 'use_ema': True, 'use_spike': False, 'rsi_required': False, 'edge_k': 1.8258442643438437, 'edge_cap': 0.7405652951753278, 'bull_strategy': 'mean_reversion', 'bull_bb_std_mult': 1.0973839105866017, 'bull_rsi_os': 6, 'bull_rsi_ob': 78, 'bull_adx_thresh': 14.632784490912188, 'bull_atr_min_pct': 0.0061677249808022375, 'bull_atr_max_pct': 0.02559383230385896, 'bull_tp_mult': 1.3461141368567378, 'bull_tsl_mult': 0.17744944776312094, 'bull_time_stop': 91, 'bull_use_sma': False, 'bull_use_ema': True, 'bull_use_atr': False, 'bull_use_adx': True, 'bull_use_spike': True, 'bull_rsi_required': False, 'bear_strategy': 'mean_reversion', 'bear_bb_std_mult': 1.700006146212658, 'bear_rsi_os': 22, 'bear_rsi_ob': 65, 'bear_adx_thresh': 16.232219605409124, 'bear_atr_min_pct': 0.012211834931499299, 'bear_atr_max_pct': 0.059947052339164614, 'bear_tp_mult': 2.1824113821418605, 'bear_tsl_mult': 0.442500308686813, 'bear_time_stop': 165, 'bear_use_sma': False, 'bear_use_ema': False, 'bear_use_atr': False, 'bear_use_adx': False, 'bear_use_spike': False, 'bear_rsi_required': True, 'sideways_strategy': 'mean_reversion', 'sideways_bb_std_mult': 1.4644263861845235, 'sideways_rsi_os': 12, 'sideways_rsi_ob': 50, 'sideways_adx_thresh': 14.34210005950892, 'sideways_atr_min_pct': 0.008693932053276154, 'sideways_atr_max_pct': 0.019836360957949464, 'sideways_tp_mult': 1.0587877399286982, 'sideways_tsl_mult': 0.6988891715912885, 'sideways_time_stop': 149, 'sideways_use_sma': False, 'sideways_use_ema': True, 'sideways_use_atr': False, 'sideways_use_adx': False, 'sideways_use_spike': True, 'sideways_rsi_required': False}.
[I 2025-08-31 10:08:22,160] Trial 133 finished with values: [-1000000000.0, 1000000000.0] and parameters: {'p_sma': 24, 'p_std': 29, 'p_atr': 15, 'p_adx': 28, 'rsi_period': 19, 'ema1': 24, 'ema2': 10, 'slip_atr_k': 0.19493122617255398, 'slip_spread_k': 0.8440927838683707, 'spread_hl_frac': 0.004615961963360102, 'bb_std_mult': 0.9231757823264857, 'rsi_os': 35, 'rsi_ob': 67, 'vol_spike': 0.09242715942628499, 'adx_thresh': 6.7535170897549595, 'atr_min_pct': 0.0044845899603535066, 'atr_max_pct': 0.07735666104306388, 'tp_mult': 2.7845474852059953, 'tsl_mult': 0.6195083486721737, 'strategy': 'mean_reversion', 'time_stop': 111, 'use_sma': True, 'use_atr': True, 'use_adx': True, 'use_ema': True, 'use_spike': False, 'rsi_required': False, 'edge_k': 1.9084269027064544, 'edge_cap': 0.8755296403400804, 'bull_strategy': 'mean_reversion', 'bull_bb_std_mult': 2.118214986585241, 'bull_rsi_os': 11, 'bull_rsi_ob': 78, 'bull_adx_thresh': 16.08755130884706, 'bull_atr_min_pct': 0.008840196971936328, 'bull_atr_max_pct': 0.10358930592866697, 'bull_tp_mult': 2.5018484696670025, 'bull_tsl_mult': 0.12846545647238902, 'bull_time_stop': 286, 'bull_use_sma': True, 'bull_use_ema': False, 'bull_use_atr': False, 'bull_use_adx': True, 'bull_use_spike': True, 'bull_rsi_required': True, 'bear_strategy': 'breakout', 'bear_bb_std_mult': 1.690316332559633, 'bear_rsi_os': 34, 'bear_rsi_ob': 90, 'bear_adx_thresh': 16.781307561869106, 'bear_atr_min_pct': 0.014098893527647031, 'bear_atr_max_pct': 0.05305327826564146, 'bear_tp_mult': 1.5366405525855118, 'bear_tsl_mult': 0.3849849575472116, 'bear_time_stop': 171, 'bear_use_sma': False, 'bear_use_ema': True, 'bear_use_atr': True, 'bear_use_adx': False, 'bear_use_spike': False, 'bear_rsi_required': True, 'sideways_strategy': 'mean_reversion', 'sideways_bb_std_mult': 1.651074690473417, 'sideways_rsi_os': 36, 'sideways_rsi_ob': 91, 'sideways_adx_thresh': 12.67687158739487, 'sideways_atr_min_pct': 0.011492464516560748, 'sideways_atr_max_pct': 0.13079849825238513, 'sideways_tp_mult': 1.3027963870472412, 'sideways_tsl_mult': 0.8104225964400613, 'sideways_time_stop': 186, 'sideways_use_sma': False, 'sideways_use_ema': False, 'sideways_use_atr': False, 'sideways_use_adx': False, 'sideways_use_spike': False, 'sideways_rsi_required': False}.
[I 2025-08-31 10:08:22,532] Trial 132 finished with values: [-1000000000.0, 1000000000.0] and parameters: {'p_sma': 24, 'p_std': 30, 'p_atr': 15, 'p_adx': 28, 'rsi_period': 18, 'ema1': 25, 'ema2': 10, 'slip_atr_k': 0.2117127038242757, 'slip_spread_k': 0.841876621627663, 'spread_hl_frac': 0.005095933277659524, 'bb_std_mult': 1.1517792345979627, 'rsi_os': 35, 'rsi_ob': 67, 'vol_spike': 0.21705997677525016, 'adx_thresh': 7.0401009093189, 'atr_min_pct': 0.017552948972857287, 'atr_max_pct': 0.07851021164671476, 'tp_mult': 2.7835341918620067, 'tsl_mult': 0.6183911223105827, 'strategy': 'mean_reversion', 'time_stop': 109, 'use_sma': True, 'use_atr': True, 'use_adx': True, 'use_ema': True, 'use_spike': False, 'rsi_required': False, 'edge_k': 1.6877374554989937, 'edge_cap': 0.7590893442968264, 'bull_strategy': 'mean_reversion', 'bull_bb_std_mult': 1.2483243682258816, 'bull_rsi_os': 11, 'bull_rsi_ob': 79, 'bull_adx_thresh': 11.421250887036454, 'bull_atr_min_pct': 0.008906547126942336, 'bull_atr_max_pct': 0.1389371132638117, 'bull_tp_mult': 1.339286513820576, 'bull_tsl_mult': 0.04048418694614975, 'bull_time_stop': 177, 'bull_use_sma': True, 'bull_use_ema': True, 'bull_use_atr': False, 'bull_use_adx': True, 'bull_use_spike': True, 'bull_rsi_required': False, 'bear_strategy': 'breakout', 'bear_bb_std_mult': 1.6783266598649382, 'bear_rsi_os': 53, 'bear_rsi_ob': 82, 'bear_adx_thresh': 14.537274345519036, 'bear_atr_min_pct': 0.0017185258337646774, 'bear_atr_max_pct': 0.07230707986400219, 'bear_tp_mult': 2.1791747383493467, 'bear_tsl_mult': 0.4696430958889497, 'bear_time_stop': 162, 'bear_use_sma': False, 'bear_use_ema': False, 'bear_use_atr': True, 'bear_use_adx': False, 'bear_use_spike': False, 'bear_rsi_required': True, 'sideways_strategy': 'mean_reversion', 'sideways_bb_std_mult': 1.676014678725153, 'sideways_rsi_os': 42, 'sideways_rsi_ob': 52, 'sideways_adx_thresh': 13.1502620120622, 'sideways_atr_min_pct': 0.007721364147351833, 'sideways_atr_max_pct': 0.024976047764705585, 'sideways_tp_mult': 1.015101993259567, 'sideways_tsl_mult': 0.7731730863933368, 'sideways_time_stop': 150, 'sideways_use_sma': False, 'sideways_use_ema': False, 'sideways_use_atr': False, 'sideways_use_adx': False, 'sideways_use_spike': False, 'sideways_rsi_required': False}.
[I 2025-08-31 10:08:22,677] Trial 131 finished with values: [-1000000000.0, 1000000000.0] and parameters: {'p_sma': 24, 'p_std': 30, 'p_atr': 15, 'p_adx': 28, 'rsi_period': 16, 'ema1': 25, 'ema2': 10, 'slip_atr_k': 0.21953162301951995, 'slip_spread_k': 0.8449034513059579, 'spread_hl_frac': 0.005377644656643504, 'bb_std_mult': 0.9070886831998608, 'rsi_os': 34, 'rsi_ob': 61, 'vol_spike': 0.15097255312689564, 'adx_thresh': 6.382818100382737, 'atr_min_pct': 0.017629327257719266, 'atr_max_pct': 0.07537051177664437, 'tp_mult': 2.5438746881156193, 'tsl_mult': 0.6454198371725686, 'strategy': 'mean_reversion', 'time_stop': 112, 'use_sma': True, 'use_atr': True, 'use_adx': True, 'use_ema': True, 'use_spike': False, 'rsi_required': False, 'edge_k': 1.6784637299512128, 'edge_cap': 0.7296539529675039, 'bull_strategy': 'mean_reversion', 'bull_bb_std_mult': 1.2807465463935868, 'bull_rsi_os': 11, 'bull_rsi_ob': 72, 'bull_adx_thresh': 16.186166593743966, 'bull_atr_min_pct': 0.00853209956289183, 'bull_atr_max_pct': 0.02501628404998974, 'bull_tp_mult': 1.3425541057325217, 'bull_tsl_mult': 0.08579842448454697, 'bull_time_stop': 56, 'bull_use_sma': True, 'bull_use_ema': True, 'bull_use_atr': False, 'bull_use_adx': True, 'bull_use_spike': True, 'bull_rsi_required': False, 'bear_strategy': 'breakout', 'bear_bb_std_mult': 1.6818026638669166, 'bear_rsi_os': 53, 'bear_rsi_ob': 85, 'bear_adx_thresh': 16.411388758684595, 'bear_atr_min_pct': 0.001063602195406724, 'bear_atr_max_pct': 0.068403471421797, 'bear_tp_mult': 1.641580164025454, 'bear_tsl_mult': 0.46386419718742267, 'bear_time_stop': 161, 'bear_use_sma': False, 'bear_use_ema': False, 'bear_use_atr': True, 'bear_use_adx': False, 'bear_use_spike': False, 'bear_rsi_required': True, 'sideways_strategy': 'mean_reversion', 'sideways_bb_std_mult': 1.6678097132474363, 'sideways_rsi_os': 42, 'sideways_rsi_ob': 69, 'sideways_adx_thresh': 14.421880812718893, 'sideways_atr_min_pct': 0.008739047393495463, 'sideways_atr_max_pct': 0.013687256857466752, 'sideways_tp_mult': 1.055857891164434, 'sideways_tsl_mult': 0.6981606247762336, 'sideways_time_stop': 162, 'sideways_use_sma': False, 'sideways_use_ema': True, 'sideways_use_atr': False, 'sideways_use_adx': False, 'sideways_use_spike': False, 'sideways_rsi_required': False}.
[I 2025-08-31 10:08:22,748] Trial 134 finished with values: [-0.009340944345207158, 0.010491193652660701] and parameters: {'p_sma': 23, 'p_std': 29, 'p_atr': 15, 'p_adx': 27, 'rsi_period': 17, 'ema1': 10, 'ema2': 10, 'slip_atr_k': 0.197040807136112, 'slip_spread_k': 0.8177949519730762, 'spread_hl_frac': 0.0030155160136669653, 'bb_std_mult': 0.9177751579636104, 'rsi_os': 36, 'rsi_ob': 66, 'vol_spike': 0.14873175795330829, 'adx_thresh': 8.98486236847936, 'atr_min_pct': 0.004640236112351052, 'atr_max_pct': 0.08275801256131565, 'tp_mult': 2.7888606126134694, 'tsl_mult': 0.6110540046513375, 'strategy': 'mean_reversion', 'time_stop': 136, 'use_sma': True, 'use_atr': False, 'use_adx': True, 'use_ema': False, 'use_spike': False, 'rsi_required': False, 'edge_k': 0.3613050302260561, 'edge_cap': 0.9550841301218019, 'bull_strategy': 'mean_reversion', 'bull_bb_std_mult': 1.150228298328225, 'bull_rsi_os': 12, 'bull_rsi_ob': 72, 'bull_adx_thresh': 16.144246343883083, 'bull_atr_min_pct': 0.0045817197895639886, 'bull_atr_max_pct': 0.05357124547050332, 'bull_tp_mult': 2.504436252825755, 'bull_tsl_mult': 0.05566185371922217, 'bull_time_stop': 176, 'bull_use_sma': True, 'bull_use_ema': False, 'bull_use_atr': True, 'bull_use_adx': True, 'bull_use_spike': True, 'bull_rsi_required': True, 'bear_strategy': 'breakout', 'bear_bb_std_mult': 1.6202285255903621, 'bear_rsi_os': 53, 'bear_rsi_ob': 80, 'bear_adx_thresh': 18.897772477755474, 'bear_atr_min_pct': 0.0016052449277426106, 'bear_atr_max_pct': 0.049638171032658246, 'bear_tp_mult': 2.5813474599060378, 'bear_tsl_mult': 0.4709018918138624, 'bear_time_stop': 161, 'bear_use_sma': False, 'bear_use_ema': True, 'bear_use_atr': True, 'bear_use_adx': False, 'bear_use_spike': False, 'bear_rsi_required': True, 'sideways_strategy': 'mean_reversion', 'sideways_bb_std_mult': 1.654892788413981, 'sideways_rsi_os': 40, 'sideways_rsi_ob': 70, 'sideways_adx_thresh': 12.94084763240195, 'sideways_atr_min_pct': 0.011230595657354, 'sideways_atr_max_pct': 0.13043938509674574, 'sideways_tp_mult': 1.0150720807320244, 'sideways_tsl_mult': 0.7718901891048535, 'sideways_time_stop': 159, 'sideways_use_sma': True, 'sideways_use_ema': False, 'sideways_use_atr': False, 'sideways_use_adx': False, 'sideways_use_spike': False, 'sideways_rsi_required': True}.
