[I 2025-08-31 10:59:20,175] Trial 548 finished with values: [-1000000000.0, 1000000000.0] and parameters: {'p_sma': 44, 'p_std': 39, 'p_atr': 22, 'p_adx': 18, 'rsi_period': 44, 'ema1': 22, 'ema2': 56, 'slip_atr_k': 0.004524610419882835, 'slip_spread_k': 0.37659754857979, 'spread_hl_frac': 0.01685475779497341, 'bb_std_mult': 2.945079032542077, 'rsi_os': 32, 'rsi_ob': 73, 'vol_spike': 0.22782565227453258, 'adx_thresh': 7.399969182382671, 'atr_min_pct': 0.004011709192249019, 'atr_max_pct': 0.11820964217777735, 'tp_mult': 1.4683909533562818, 'tsl_mult': 0.6734436821725889, 'strategy': 'mean_reversion', 'time_stop': 153, 'use_sma': False, 'use_atr': False, 'use_adx': False, 'use_ema': False, 'use_spike': False, 'rsi_required': False, 'edge_k': 0.5077242151593169, 'edge_cap': 0.41434796908892435, 'bull_strategy': 'breakout', 'bull_bb_std_mult': 0.5816355328277616, 'bull_rsi_os': 45, 'bull_rsi_ob': 81, 'bull_adx_thresh': 11.908101263887618, 'bull_atr_min_pct': 0.0219745038753199, 'bull_atr_max_pct': 0.10848353578124216, 'bull_tp_mult': 2.2239376573833978, 'bull_tsl_mult': 0.112094835065357, 'bull_time_stop': 203, 'bull_use_sma': False, 'bull_use_ema': False, 'bull_use_atr': False, 'bull_use_adx': False, 'bull_use_spike': True, 'bull_rsi_required': True, 'bear_strategy': 'breakout', 'bear_bb_std_mult': 1.575520897837753, 'bear_rsi_os': 24, 'bear_rsi_ob': 56, 'bear_adx_thresh': 34.9576087090999, 'bear_atr_min_pct': 0.008003676993702722, 'bear_atr_max_pct': 0.14633531087512108, 'bear_tp_mult': 1.3515406163887596, 'bear_tsl_mult': 0.024303264404235747, 'bear_time_stop': 33, 'bear_use_sma': True, 'bear_use_ema': True, 'bear_use_atr': False, 'bear_use_adx': False, 'bear_use_spike': True, 'bear_rsi_required': True, 'sideways_strategy': 'mean_reversion', 'sideways_bb_std_mult': 2.481624928684592, 'sideways_rsi_os': 33, 'sideways_rsi_ob': 60, 'sideways_adx_thresh': 28.89064362366488, 'sideways_atr_min_pct': 0.006054427737428738, 'sideways_atr_max_pct': 0.012514347491810131, 'sideways_tp_mult': 2.8381175887315813, 'sideways_tsl_mult': 0.12390279799387266, 'sideways_time_stop': 57, 'sideways_use_sma': False, 'sideways_use_ema': False, 'sideways_use_atr': True, 'sideways_use_adx': True, 'sideways_use_spike': False, 'sideways_rsi_required': False}.
[I 2025-08-31 10:59:21,112] Trial 549 finished with values: [-1000000000.0, 1000000000.0] and parameters: {'p_sma': 46, 'p_std': 37, 'p_atr': 23, 'p_adx': 18, 'rsi_period': 44, 'ema1': 27, 'ema2': 53, 'slip_atr_k': 0.00019011173597853698, 'slip_spread_k': 0.03412202953942284, 'spread_hl_frac': 0.0233593225280409, 'bb_std_mult': 2.481416810327444, 'rsi_os': 33, 'rsi_ob': 73, 'vol_spike': 0.2290072041124476, 'adx_thresh': 7.49980425479703, 'atr_min_pct': 0.02271711164436611, 'atr_max_pct': 0.13519125570009025, 'tp_mult': 2.8421582622734354, 'tsl_mult': 0.6612585920096018, 'strategy': 'mean_reversion', 'time_stop': 154, 'use_sma': False, 'use_atr': False, 'use_adx': False, 'use_ema': False, 'use_spike': False, 'rsi_required': False, 'edge_k': 1.709434697970736, 'edge_cap': 0.6459018813551272, 'bull_strategy': 'breakout', 'bull_bb_std_mult': 0.5984570254320536, 'bull_rsi_os': 45, 'bull_rsi_ob': 54, 'bull_adx_thresh': 11.741863281401574, 'bull_atr_min_pct': 0.020999559175490977, 'bull_atr_max_pct': 0.04653117734792001, 'bull_tp_mult': 1.6706989519812934, 'bull_tsl_mult': 0.8185646364984478, 'bull_time_stop': 289, 'bull_use_sma': False, 'bull_use_ema': True, 'bull_use_atr': False, 'bull_use_adx': True, 'bull_use_spike': True, 'bull_rsi_required': False, 'bear_strategy': 'breakout', 'bear_bb_std_mult': 1.4695708840399964, 'bear_rsi_os': 24, 'bear_rsi_ob': 84, 'bear_adx_thresh': 25.549225627809818, 'bear_atr_min_pct': 0.0048133484417006, 'bear_atr_max_pct': 0.07335864532570752, 'bear_tp_mult': 1.5778496087229241, 'bear_tsl_mult': 0.10428531150660791, 'bear_time_stop': 34, 'bear_use_sma': False, 'bear_use_ema': True, 'bear_use_atr': False, 'bear_use_adx': False, 'bear_use_spike': False, 'bear_rsi_required': True, 'sideways_strategy': 'mean_reversion', 'sideways_bb_std_mult': 2.4721098673890616, 'sideways_rsi_os': 33, 'sideways_rsi_ob': 59, 'sideways_adx_thresh': 14.31457667899264, 'sideways_atr_min_pct': 0.015235843902763552, 'sideways_atr_max_pct': 0.08905668715851459, 'sideways_tp_mult': 2.8984139191968294, 'sideways_tsl_mult': 0.32141289609278567, 'sideways_time_stop': 60, 'sideways_use_sma': False, 'sideways_use_ema': False, 'sideways_use_atr': True, 'sideways_use_adx': False, 'sideways_use_spike': False, 'sideways_rsi_required': True}.
[I 2025-08-31 10:59:21,347] Trial 550 finished with values: [-1000000000.0, 1000000000.0] and parameters: {'p_sma': 46, 'p_std': 39, 'p_atr': 23, 'p_adx': 19, 'rsi_period': 44, 'ema1': 23, 'ema2': 31, 'slip_atr_k': 0.006176155385377593, 'slip_spread_k': 0.19833168810176172, 'spread_hl_frac': 0.03374526226891309, 'bb_std_mult': 1.5145335163901357, 'rsi_os': 32, 'rsi_ob': 70, 'vol_spike': 0.14773563843479273, 'adx_thresh': 8.952591136764967, 'atr_min_pct': 0.019413694067106992, 'atr_max_pct': 0.042479897841382626, 'tp_mult': 2.8357060459903276, 'tsl_mult': 0.72248310715198, 'strategy': 'mean_reversion', 'time_stop': 153, 'use_sma': False, 'use_atr': False, 'use_adx': False, 'use_ema': False, 'use_spike': False, 'rsi_required': False, 'edge_k': 1.6911231227341168, 'edge_cap': 0.1499516956467803, 'bull_strategy': 'breakout', 'bull_bb_std_mult': 3.199998705453754, 'bull_rsi_os': 45, 'bull_rsi_ob': 64, 'bull_adx_thresh': 14.85406264527228, 'bull_atr_min_pct': 0.020914842117210113, 'bull_atr_max_pct': 0.04592193522841155, 'bull_tp_mult': 1.6803329856728224, 'bull_tsl_mult': 0.2095137131558033, 'bull_time_stop': 56, 'bull_use_sma': False, 'bull_use_ema': True, 'bull_use_atr': False, 'bull_use_adx': True, 'bull_use_spike': True, 'bull_rsi_required': False, 'bear_strategy': 'breakout', 'bear_bb_std_mult': 3.359562941504247, 'bear_rsi_os': 22, 'bear_rsi_ob': 81, 'bear_adx_thresh': 20.84310208356208, 'bear_atr_min_pct': 0.007572712698486582, 'bear_atr_max_pct': 0.03284817280657522, 'bear_tp_mult': 2.346555019814517, 'bear_tsl_mult': 0.1261111931323453, 'bear_time_stop': 128, 'bear_use_sma': False, 'bear_use_ema': True, 'bear_use_atr': True, 'bear_use_adx': False, 'bear_use_spike': False, 'bear_rsi_required': True, 'sideways_strategy': 'mean_reversion', 'sideways_bb_std_mult': 2.466289369806147, 'sideways_rsi_os': 34, 'sideways_rsi_ob': 63, 'sideways_adx_thresh': 9.052170409815139, 'sideways_atr_min_pct': 0.028144185458234112, 'sideways_atr_max_pct': 0.012847505058147655, 'sideways_tp_mult': 1.4736508352178257, 'sideways_tsl_mult': 0.11647052356412141, 'sideways_time_stop': 222, 'sideways_use_sma': False, 'sideways_use_ema': False, 'sideways_use_atr': False, 'sideways_use_adx': False, 'sideways_use_spike': True, 'sideways_rsi_required': True}.
[I 2025-08-31 10:59:22,345] Trial 552 finished with values: [-1000000000.0, 1000000000.0] and parameters: {'p_sma': 8, 'p_std': 55, 'p_atr': 10, 'p_adx': 30, 'rsi_period': 44, 'ema1': 15, 'ema2': 59, 'slip_atr_k': 0.10152150502494739, 'slip_spread_k': 0.8168483171953222, 'spread_hl_frac': 0.02452200995397162, 'bb_std_mult': 2.5173910382555156, 'rsi_os': 8, 'rsi_ob': 94, 'vol_spike': 0.1621795411676326, 'adx_thresh': 7.468343630586128, 'atr_min_pct': 0.01955521261932, 'atr_max_pct': 0.1176879306538329, 'tp_mult': 2.832816233559233, 'tsl_mult': 0.6595353115015737, 'strategy': 'mean_reversion', 'time_stop': 179, 'use_sma': False, 'use_atr': False, 'use_adx': False, 'use_ema': False, 'use_spike': False, 'rsi_required': False, 'edge_k': 1.805433660095743, 'edge_cap': 0.20522187897417737, 'bull_strategy': 'breakout', 'bull_bb_std_mult': 1.5304499866048717, 'bull_rsi_os': 44, 'bull_rsi_ob': 51, 'bull_adx_thresh': 12.533349157194884, 'bull_atr_min_pct': 0.015093872466802405, 'bull_atr_max_pct': 0.04579010560029079, 'bull_tp_mult': 2.8423028801921646, 'bull_tsl_mult': 0.2078714895100462, 'bull_time_stop': 247, 'bull_use_sma': False, 'bull_use_ema': True, 'bull_use_atr': False, 'bull_use_adx': True, 'bull_use_spike': True, 'bull_rsi_required': False, 'bear_strategy': 'mean_reversion', 'bear_bb_std_mult': 1.3982593857406276, 'bear_rsi_os': 22, 'bear_rsi_ob': 46, 'bear_adx_thresh': 14.131075004724927, 'bear_atr_min_pct': 0.029530972932216758, 'bear_atr_max_pct': 0.09002862194618748, 'bear_tp_mult': 2.825701411072574, 'bear_tsl_mult': 0.09955511277570195, 'bear_time_stop': 130, 'bear_use_sma': False, 'bear_use_ema': False, 'bear_use_atr': True, 'bear_use_adx': False, 'bear_use_spike': True, 'bear_rsi_required': True, 'sideways_strategy': 'mean_reversion', 'sideways_bb_std_mult': 2.733550131877201, 'sideways_rsi_os': 33, 'sideways_rsi_ob': 59, 'sideways_adx_thresh': 13.004915342416657, 'sideways_atr_min_pct': 0.026563065758645123, 'sideways_atr_max_pct': 0.1299736216714782, 'sideways_tp_mult': 1.859100696595812, 'sideways_tsl_mult': 0.6726421193080808, 'sideways_time_stop': 61, 'sideways_use_sma': False, 'sideways_use_ema': False, 'sideways_use_atr': False, 'sideways_use_adx': False, 'sideways_use_spike': True, 'sideways_rsi_required': False}.
[I 2025-08-31 10:59:54,690] Trial 553 finished with values: [-1000000000.0, 1000000000.0] and parameters: {'p_sma': 8, 'p_std': 55, 'p_atr': 22, 'p_adx': 19, 'rsi_period': 36, 'ema1': 22, 'ema2': 59, 'slip_atr_k': 0.008559818194508951, 'slip_spread_k': 0.8249171644030386, 'spread_hl_frac': 0.024253683371833777, 'bb_std_mult': 1.207767192867359, 'rsi_os': 34, 'rsi_ob': 76, 'vol_spike': 0.21070927976901535, 'adx_thresh': 8.90463414089995, 'atr_min_pct': 0.019720543816512982, 'atr_max_pct': 0.1256716352529462, 'tp_mult': 2.8436742306479283, 'tsl_mult': 0.7209728563806874, 'strategy': 'mean_reversion', 'time_stop': 175, 'use_sma': True, 'use_atr': False, 'use_adx': False, 'use_ema': False, 'use_spike': False, 'rsi_required': False, 'edge_k': 1.0016695618058489, 'edge_cap': 0.1524621030524085, 'bull_strategy': 'mean_reversion', 'bull_bb_std_mult': 2.9627126494961242, 'bull_rsi_os': 44, 'bull_rsi_ob': 54, 'bull_adx_thresh': 15.858295742369652, 'bull_atr_min_pct': 0.006272074186309101, 'bull_atr_max_pct': 0.04602035410987387, 'bull_tp_mult': 2.840816380691966, 'bull_tsl_mult': 0.07602588237902998, 'bull_time_stop': 51, 'bull_use_sma': False, 'bull_use_ema': True, 'bull_use_atr': False, 'bull_use_adx': True, 'bull_use_spike': True, 'bull_rsi_required': False, 'bear_strategy': 'mean_reversion', 'bear_bb_std_mult': 3.364036646385614, 'bear_rsi_os': 15, 'bear_rsi_ob': 54, 'bear_adx_thresh': 13.714866579019422, 'bear_atr_min_pct': 0.02532032534801363, 'bear_atr_max_pct': 0.08541772340044451, 'bear_tp_mult': 2.799986939786308, 'bear_tsl_mult': 0.1477099682790079, 'bear_time_stop': 43, 'bear_use_sma': False, 'bear_use_ema': False, 'bear_use_atr': True, 'bear_use_adx': False, 'bear_use_spike': False, 'bear_rsi_required': True, 'sideways_strategy': 'mean_reversion', 'sideways_bb_std_mult': 2.7509883557787194, 'sideways_rsi_os': 34, 'sideways_rsi_ob': 59, 'sideways_adx_thresh': 12.994749731254652, 'sideways_atr_min_pct': 0.017208064030459734, 'sideways_atr_max_pct': 0.1287955326032998, 'sideways_tp_mult': 1.8551222936543061, 'sideways_tsl_mult': 0.08137492742831598, 'sideways_time_stop': 216, 'sideways_use_sma': True, 'sideways_use_ema': False, 'sideways_use_atr': False, 'sideways_use_adx': False, 'sideways_use_spike': True, 'sideways_rsi_required': True}.
[I 2025-08-31 10:59:56,080] Trial 554 finished with values: [-1000000000.0, 1000000000.0] and parameters: {'p_sma': 12, 'p_std': 57, 'p_atr': 30, 'p_adx': 19, 'rsi_period': 42, 'ema1': 22, 'ema2': 31, 'slip_atr_k': 0.008429699444771378, 'slip_spread_k': 0.31312244717975074, 'spread_hl_frac': 0.015349589179440343, 'bb_std_mult': 1.184494727269736, 'rsi_os': 34, 'rsi_ob': 76, 'vol_spike': 0.17543509531566784, 'adx_thresh': 8.933318535298294, 'atr_min_pct': 0.019505178908678245, 'atr_max_pct': 0.04248593472963539, 'tp_mult': 2.819542848717734, 'tsl_mult': 5.324564886222127e-06, 'strategy': 'breakout', 'time_stop': 180, 'use_sma': True, 'use_atr': False, 'use_adx': False, 'use_ema': False, 'use_spike': False, 'rsi_required': False, 'edge_k': 1.8145067352235993, 'edge_cap': 0.8862371788587415, 'bull_strategy': 'mean_reversion', 'bull_bb_std_mult': 1.3758414595706623, 'bull_rsi_os': 26, 'bull_rsi_ob': 64, 'bull_adx_thresh': 10.557996600958337, 'bull_atr_min_pct': 0.006352215629661729, 'bull_atr_max_pct': 0.04545866456326848, 'bull_tp_mult': 2.8397893900662403, 'bull_tsl_mult': 0.20909587373130317, 'bull_time_stop': 248, 'bull_use_sma': False, 'bull_use_ema': True, 'bull_use_atr': False, 'bull_use_adx': True, 'bull_use_spike': False, 'bull_rsi_required': False, 'bear_strategy': 'mean_reversion', 'bear_bb_std_mult': 1.3956832683103815, 'bear_rsi_os': 15, 'bear_rsi_ob': 54, 'bear_adx_thresh': 13.533245428790615, 'bear_atr_min_pct': 0.02524203473952856, 'bear_atr_max_pct': 0.1370597345201134, 'bear_tp_mult': 2.815864082977015, 'bear_tsl_mult': 0.14006162191515875, 'bear_time_stop': 126, 'bear_use_sma': False, 'bear_use_ema': False, 'bear_use_atr': True, 'bear_use_adx': False, 'bear_use_spike': True, 'bear_rsi_required': True, 'sideways_strategy': 'mean_reversion', 'sideways_bb_std_mult': 2.7189076703379245, 'sideways_rsi_os': 34, 'sideways_rsi_ob': 57, 'sideways_adx_thresh': 23.216472733734925, 'sideways_atr_min_pct': 0.027917475122712962, 'sideways_atr_max_pct': 0.014782233761627451, 'sideways_tp_mult': 1.4944641771424299, 'sideways_tsl_mult': 0.84860058211612, 'sideways_time_stop': 155, 'sideways_use_sma': True, 'sideways_use_ema': True, 'sideways_use_atr': False, 'sideways_use_adx': False, 'sideways_use_spike': True, 'sideways_rsi_required': False}.
[I 2025-08-31 10:59:56,557] Trial 555 finished with values: [-1000000000.0, 1000000000.0] and parameters: {'p_sma': 45, 'p_std': 20, 'p_atr': 22, 'p_adx': 20, 'rsi_period': 37, 'ema1': 22, 'ema2': 59, 'slip_atr_k': 0.10127340765116186, 'slip_spread_k': 0.5590581080888395, 'spread_hl_frac': 0.024304609352822026, 'bb_std_mult': 0.5374085507608932, 'rsi_os': 16, 'rsi_ob': 76, 'vol_spike': 0.2110970181897877, 'adx_thresh': 8.351764771702607, 'atr_min_pct': 0.0195557379441555, 'atr_max_pct': 0.06332465604699834, 'tp_mult': 2.8122564994287886, 'tsl_mult': 0.9322788488091842, 'strategy': 'breakout', 'time_stop': 66, 'use_sma': True, 'use_atr': False, 'use_adx': False, 'use_ema': False, 'use_spike': False, 'rsi_required': False, 'edge_k': 1.7982833136802685, 'edge_cap': 0.47259445886902235, 'bull_strategy': 'mean_reversion', 'bull_bb_std_mult': 2.9400676521586444, 'bull_rsi_os': 43, 'bull_rsi_ob': 77, 'bull_adx_thresh': 10.646094395655917, 'bull_atr_min_pct': 0.006363917600613354, 'bull_atr_max_pct': 0.035682994243245406, 'bull_tp_mult': 2.8518284490258927, 'bull_tsl_mult': 0.28369867400233495, 'bull_time_stop': 40, 'bull_use_sma': False, 'bull_use_ema': True, 'bull_use_atr': False, 'bull_use_adx': True, 'bull_use_spike': False, 'bull_rsi_required': False, 'bear_strategy': 'mean_reversion', 'bear_bb_std_mult': 1.3975885330718318, 'bear_rsi_os': 50, 'bear_rsi_ob': 45, 'bear_adx_thresh': 16.28558302475788, 'bear_atr_min_pct': 0.025409266654608822, 'bear_atr_max_pct': 0.08633014698241824, 'bear_tp_mult': 2.8090178582940086, 'bear_tsl_mult': 0.14762626372100734, 'bear_time_stop': 43, 'bear_use_sma': False, 'bear_use_ema': False, 'bear_use_atr': True, 'bear_use_adx': False, 'bear_use_spike': True, 'bear_rsi_required': False, 'sideways_strategy': 'mean_reversion', 'sideways_bb_std_mult': 2.741299435893867, 'sideways_rsi_os': 53, 'sideways_rsi_ob': 57, 'sideways_adx_thresh': 12.732963298965817, 'sideways_atr_min_pct': 0.026547474193919222, 'sideways_atr_max_pct': 0.08600573152888237, 'sideways_tp_mult': 1.8705318002340237, 'sideways_tsl_mult': 0.4220689813849361, 'sideways_time_stop': 151, 'sideways_use_sma': True, 'sideways_use_ema': True, 'sideways_use_atr': False, 'sideways_use_adx': False, 'sideways_use_spike': True, 'sideways_rsi_required': False}.
[I 2025-08-31 10:59:56,646] Trial 556 finished with values: [0.002115480560121341, 0.006591532138811635] and parameters: {'p_sma': 34, 'p_std': 25, 'p_atr': 22, 'p_adx': 20, 'rsi_period': 37, 'ema1': 5, 'ema2': 14, 'slip_atr_k': 0.009508271653128819, 'slip_spread_k': 0.5089928569434875, 'spread_hl_frac': 0.023864077241135487, 'bb_std_mult': 0.5532915928769004, 'rsi_os': 28, 'rsi_ob': 76, 'vol_spike': 0.08641404129602658, 'adx_thresh': 8.982812838154244, 'atr_min_pct': 0.020545117582920398, 'atr_max_pct': 0.04892155860255514, 'tp_mult': 2.8905232330793065, 'tsl_mult': 0.04365199507779932, 'strategy': 'breakout', 'time_stop': 65, 'use_sma': True, 'use_atr': True, 'use_adx': False, 'use_ema': True, 'use_spike': False, 'rsi_required': False, 'edge_k': 1.4987931743486969, 'edge_cap': 0.702478247673474, 'bull_strategy': 'mean_reversion', 'bull_bb_std_mult': 2.100609758958239, 'bull_rsi_os': 43, 'bull_rsi_ob': 59, 'bull_adx_thresh': 28.112008163474908, 'bull_atr_min_pct': 0.006462610198707176, 'bull_atr_max_pct': 0.03774399743819074, 'bull_tp_mult': 2.9986371650367953, 'bull_tsl_mult': 0.2829380194235205, 'bull_time_stop': 52, 'bull_use_sma': False, 'bull_use_ema': True, 'bull_use_atr': False, 'bull_use_adx': True, 'bull_use_spike': False, 'bull_rsi_required': False, 'bear_strategy': 'mean_reversion', 'bear_bb_std_mult': 1.7489721031817813, 'bear_rsi_os': 50, 'bear_rsi_ob': 54, 'bear_adx_thresh': 13.447272390483969, 'bear_atr_min_pct': 0.0057643605887258125, 'bear_atr_max_pct': 0.13833679869417118, 'bear_tp_mult': 2.701604378254789, 'bear_tsl_mult': 0.841932451717173, 'bear_time_stop': 86, 'bear_use_sma': False, 'bear_use_ema': False, 'bear_use_atr': True, 'bear_use_adx': False, 'bear_use_spike': True, 'bear_rsi_required': False, 'sideways_strategy': 'mean_reversion', 'sideways_bb_std_mult': 1.1724322197949277, 'sideways_rsi_os': 39, 'sideways_rsi_ob': 57, 'sideways_adx_thresh': 24.865057640827445, 'sideways_atr_min_pct': 0.004374870811357321, 'sideways_atr_max_pct': 0.08558747607569499, 'sideways_tp_mult': 1.8766266276857526, 'sideways_tsl_mult': 0.8710043576706922, 'sideways_time_stop': 158, 'sideways_use_sma': True, 'sideways_use_ema': True, 'sideways_use_atr': False, 'sideways_use_adx': False, 'sideways_use_spike': True, 'sideways_rsi_required': False}.
[I 2025-08-31 11:00:28,477] Trial 559 finished with values: [-0.01360872892143905, 0.013423430179808016] and parameters: {'p_sma': 58, 'p_std': 35, 'p_atr': 26, 'p_adx': 20, 'rsi_period': 39, 'ema1': 21, 'ema2': 25, 'slip_atr_k': 0.1075806755956969, 'slip_spread_k': 0.5073462167055391, 'spread_hl_frac': 0.04753745211625417, 'bb_std_mult': 3.0439715856983502, 'rsi_os': 25, 'rsi_ob': 66, 'vol_spike': 0.087004056276706, 'adx_thresh': 13.346056754612146, 'atr_min_pct': 0.02059572662650253, 'atr_max_pct': 0.06586699537386027, 'tp_mult': 2.0314741291410043, 'tsl_mult': 0.03795618728352568, 'strategy': 'mean_reversion', 'time_stop': 144, 'use_sma': False, 'use_atr': True, 'use_adx': False, 'use_ema': True, 'use_spike': False, 'rsi_required': False, 'edge_k': 1.7609166129167644, 'edge_cap': 0.19074174701711713, 'bull_strategy': 'breakout', 'bull_bb_std_mult': 2.100331639815668, 'bull_rsi_os': 43, 'bull_rsi_ob': 76, 'bull_adx_thresh': 9.767120095180239, 'bull_atr_min_pct': 0.0040174825279551355, 'bull_atr_max_pct': 0.040864640670950865, 'bull_tp_mult': 2.7362038823507175, 'bull_tsl_mult': 0.10911148429348694, 'bull_time_stop': 76, 'bull_use_sma': False, 'bull_use_ema': True, 'bull_use_atr': False, 'bull_use_adx': True, 'bull_use_spike': True, 'bull_rsi_required': False, 'bear_strategy': 'breakout', 'bear_bb_std_mult': 2.69965813637602, 'bear_rsi_os': 20, 'bear_rsi_ob': 73, 'bear_adx_thresh': 14.260789667663868, 'bear_atr_min_pct': 0.011745270780878201, 'bear_atr_max_pct': 0.06029036841462171, 'bear_tp_mult': 2.24475361213143, 'bear_tsl_mult': 0.42416530193178464, 'bear_time_stop': 255, 'bear_use_sma': False, 'bear_use_ema': False, 'bear_use_atr': True, 'bear_use_adx': True, 'bear_use_spike': True, 'bear_rsi_required': False, 'sideways_strategy': 'mean_reversion', 'sideways_bb_std_mult': 1.5766005576971553, 'sideways_rsi_os': 46, 'sideways_rsi_ob': 56, 'sideways_adx_thresh': 24.78899878811375, 'sideways_atr_min_pct': 0.005131555914537032, 'sideways_atr_max_pct': 0.04256482875376843, 'sideways_tp_mult': 1.6986680497177977, 'sideways_tsl_mult': 0.8787123808860297, 'sideways_time_stop': 266, 'sideways_use_sma': True, 'sideways_use_ema': False, 'sideways_use_atr': False, 'sideways_use_adx': False, 'sideways_use_spike': True, 'sideways_rsi_required': False}.
