[I 2025-08-31 11:30:38,141] Trial 773 finished with values: [-1000000000.0, 1000000000.0] and parameters: {'p_sma': 24, 'p_std': 7, 'p_atr': 27, 'p_adx': 19, 'rsi_period': 30, 'ema1': 18, 'ema2': 26, 'slip_atr_k': 0.03368167424461275, 'slip_spread_k': 0.48406035982652884, 'spread_hl_frac': 0.04126305192094825, 'bb_std_mult': 0.6121069319069623, 'rsi_os': 35, 'rsi_ob': 80, 'vol_spike': 0.11989895480213303, 'adx_thresh': 31.95106514772433, 'atr_min_pct': 0.010188512256613854, 'atr_max_pct': 0.027171814854872772, 'tp_mult': 2.2219044930650873, 'tsl_mult': 0.12591406616005305, 'strategy': 'breakout', 'time_stop': 85, 'use_sma': True, 'use_atr': True, 'use_adx': True, 'use_ema': True, 'use_spike': False, 'rsi_required': True, 'edge_k': 1.9519486882320816, 'edge_cap': 0.6916916722853634, 'bull_strategy': 'mean_reversion', 'bull_bb_std_mult': 1.7015300109065274, 'bull_rsi_os': 42, 'bull_rsi_ob': 63, 'bull_adx_thresh': 20.129265735542557, 'bull_atr_min_pct': 0.011739096013595362, 'bull_atr_max_pct': 0.010113303417288014, 'bull_tp_mult': 2.9574513019573305, 'bull_tsl_mult': 0.44171540141932086, 'bull_time_stop': 41, 'bull_use_sma': False, 'bull_use_ema': False, 'bull_use_atr': True, 'bull_use_adx': False, 'bull_use_spike': False, 'bull_rsi_required': False, 'bear_strategy': 'mean_reversion', 'bear_bb_std_mult': 1.3674840807891204, 'bear_rsi_os': 50, 'bear_rsi_ob': 53, 'bear_adx_thresh': 16.558599445546506, 'bear_atr_min_pct': 0.022555192094327388, 'bear_atr_max_pct': 0.14017203071530324, 'bear_tp_mult': 1.067856413706635, 'bear_tsl_mult': 0.8898625275147818, 'bear_time_stop': 104, 'bear_use_sma': False, 'bear_use_ema': True, 'bear_use_atr': True, 'bear_use_adx': True, 'bear_use_spike': False, 'bear_rsi_required': False, 'sideways_strategy': 'breakout', 'sideways_bb_std_mult': 2.096076289300929, 'sideways_rsi_os': 54, 'sideways_rsi_ob': 54, 'sideways_adx_thresh': 25.994521292462192, 'sideways_atr_min_pct': 0.015583773571789694, 'sideways_atr_max_pct': 0.11041798981737865, 'sideways_tp_mult': 1.587355807170066, 'sideways_tsl_mult': 0.8867702641768609, 'sideways_time_stop': 38, 'sideways_use_sma': False, 'sideways_use_ema': True, 'sideways_use_atr': True, 'sideways_use_adx': False, 'sideways_use_spike': True, 'sideways_rsi_required': False}.
[I 2025-08-31 11:31:11,771] Trial 778 finished with values: [-0.04944580527960929, 0.04899188041548233] and parameters: {'p_sma': 37, 'p_std': 20, 'p_atr': 29, 'p_adx': 21, 'rsi_period': 36, 'ema1': 6, 'ema2': 41, 'slip_atr_k': 0.17013746986908013, 'slip_spread_k': 0.42614422774491395, 'spread_hl_frac': 0.02328937207081881, 'bb_std_mult': 0.7380627770308318, 'rsi_os': 27, 'rsi_ob': 82, 'vol_spike': 0.09865108097087807, 'adx_thresh': 34.914342387984604, 'atr_min_pct': 0.005067674881964773, 'atr_max_pct': 0.06538447497028638, 'tp_mult': 2.963715260064074, 'tsl_mult': 0.1130046916977933, 'strategy': 'breakout', 'time_stop': 97, 'use_sma': True, 'use_atr': True, 'use_adx': False, 'use_ema': True, 'use_spike': True, 'rsi_required': False, 'edge_k': 1.1635410902715306, 'edge_cap': 0.6421431357024187, 'bull_strategy': 'mean_reversion', 'bull_bb_std_mult': 0.5581028264034502, 'bull_rsi_os': 40, 'bull_rsi_ob': 62, 'bull_adx_thresh': 25.335249471921554, 'bull_atr_min_pct': 0.012767745723859851, 'bull_atr_max_pct': 0.026799764028831972, 'bull_tp_mult': 2.865726711957387, 'bull_tsl_mult': 0.49685538213135727, 'bull_time_stop': 30, 'bull_use_sma': True, 'bull_use_ema': True, 'bull_use_atr': False, 'bull_use_adx': True, 'bull_use_spike': False, 'bull_rsi_required': True, 'bear_strategy': 'mean_reversion', 'bear_bb_std_mult': 1.5793940622470894, 'bear_rsi_os': 53, 'bear_rsi_ob': 69, 'bear_adx_thresh': 9.06586301668248, 'bear_atr_min_pct': 0.004073703213029944, 'bear_atr_max_pct': 0.13135095671441674, 'bear_tp_mult': 2.7194133038575177, 'bear_tsl_mult': 0.5694174154156857, 'bear_time_stop': 294, 'bear_use_sma': True, 'bear_use_ema': False, 'bear_use_atr': True, 'bear_use_adx': False, 'bear_use_spike': True, 'bear_rsi_required': False, 'sideways_strategy': 'mean_reversion', 'sideways_bb_std_mult': 1.0580391061931311, 'sideways_rsi_os': 41, 'sideways_rsi_ob': 63, 'sideways_adx_thresh': 27.91843131593446, 'sideways_atr_min_pct': 0.004343069034270777, 'sideways_atr_max_pct': 0.10248028456725827, 'sideways_tp_mult': 1.641729090941288, 'sideways_tsl_mult': 0.6129181234237235, 'sideways_time_stop': 191, 'sideways_use_sma': True, 'sideways_use_ema': True, 'sideways_use_atr': False, 'sideways_use_adx': True, 'sideways_use_spike': False, 'sideways_rsi_required': True}.
[I 2025-08-31 11:31:11,983] Trial 775 finished with values: [-1000000000.0, 1000000000.0] and parameters: {'p_sma': 15, 'p_std': 7, 'p_atr': 20, 'p_adx': 21, 'rsi_period': 54, 'ema1': 5, 'ema2': 50, 'slip_atr_k': 0.03470590313634009, 'slip_spread_k': 0.4872089988184023, 'spread_hl_frac': 0.023381103215361316, 'bb_std_mult': 0.7320013317027083, 'rsi_os': 19, 'rsi_ob': 82, 'vol_spike': 0.10047031074908648, 'adx_thresh': 9.812712987696845, 'atr_min_pct': 0.02065087079688738, 'atr_max_pct': 0.11186473673766761, 'tp_mult': 2.851037962586342, 'tsl_mult': 0.11205485580364043, 'strategy': 'breakout', 'time_stop': 93, 'use_sma': True, 'use_atr': True, 'use_adx': True, 'use_ema': True, 'use_spike': True, 'rsi_required': False, 'edge_k': 0.6310076032777466, 'edge_cap': 0.6891578307274177, 'bull_strategy': 'mean_reversion', 'bull_bb_std_mult': 1.6973750288364224, 'bull_rsi_os': 42, 'bull_rsi_ob': 63, 'bull_adx_thresh': 20.155101750642498, 'bull_atr_min_pct': 0.011938390346927633, 'bull_atr_max_pct': 0.059632184787559245, 'bull_tp_mult': 2.874946569739559, 'bull_tsl_mult': 0.4944018309552389, 'bull_time_stop': 245, 'bull_use_sma': True, 'bull_use_ema': True, 'bull_use_atr': False, 'bull_use_adx': False, 'bull_use_spike': False, 'bull_rsi_required': True, 'bear_strategy': 'mean_reversion', 'bear_bb_std_mult': 1.583837888764514, 'bear_rsi_os': 5, 'bear_rsi_ob': 54, 'bear_adx_thresh': 10.291770257689398, 'bear_atr_min_pct': 0.004781479184341435, 'bear_atr_max_pct': 0.14180748538448248, 'bear_tp_mult': 2.6471453672759684, 'bear_tsl_mult': 0.9082828435761511, 'bear_time_stop': 80, 'bear_use_sma': False, 'bear_use_ema': True, 'bear_use_atr': True, 'bear_use_adx': True, 'bear_use_spike': False, 'bear_rsi_required': False, 'sideways_strategy': 'mean_reversion', 'sideways_bb_std_mult': 0.9643274863331419, 'sideways_rsi_os': 10, 'sideways_rsi_ob': 95, 'sideways_adx_thresh': 25.914667951579634, 'sideways_atr_min_pct': 0.024533560816886096, 'sideways_atr_max_pct': 0.1109066998312203, 'sideways_tp_mult': 1.5826941155913563, 'sideways_tsl_mult': 0.8846027604598956, 'sideways_time_stop': 161, 'sideways_use_sma': False, 'sideways_use_ema': True, 'sideways_use_atr': True, 'sideways_use_adx': False, 'sideways_use_spike': False, 'sideways_rsi_required': False}.
[I 2025-08-31 11:31:12,280] Trial 776 finished with values: [-0.06786553603439005, 0.06729742277486107] and parameters: {'p_sma': 15, 'p_std': 12, 'p_atr': 29, 'p_adx': 21, 'rsi_period': 36, 'ema1': 16, 'ema2': 12, 'slip_atr_k': 0.2300546354032582, 'slip_spread_k': 0.8836731136260627, 'spread_hl_frac': 0.014160894456193915, 'bb_std_mult': 0.8068178293189201, 'rsi_os': 27, 'rsi_ob': 82, 'vol_spike': 0.07175564529435749, 'adx_thresh': 14.061493662590898, 'atr_min_pct': 0.00981419575652306, 'atr_max_pct': 0.026894290934525403, 'tp_mult': 1.5275230345470427, 'tsl_mult': 0.06143929152383766, 'strategy': 'breakout', 'time_stop': 114, 'use_sma': True, 'use_atr': True, 'use_adx': False, 'use_ema': True, 'use_spike': False, 'rsi_required': False, 'edge_k': 0.6343918083615772, 'edge_cap': 0.36526512677680445, 'bull_strategy': 'mean_reversion', 'bull_bb_std_mult': 2.2750232597113986, 'bull_rsi_os': 41, 'bull_rsi_ob': 63, 'bull_adx_thresh': 32.97916855383122, 'bull_atr_min_pct': 0.011913558489457049, 'bull_atr_max_pct': 0.060134330434866004, 'bull_tp_mult': 2.8683560321515826, 'bull_tsl_mult': 0.22278166845404088, 'bull_time_stop': 90, 'bull_use_sma': False, 'bull_use_ema': True, 'bull_use_atr': False, 'bull_use_adx': True, 'bull_use_spike': False, 'bull_rsi_required': True, 'bear_strategy': 'mean_reversion', 'bear_bb_std_mult': 1.5752825652159352, 'bear_rsi_os': 52, 'bear_rsi_ob': 68, 'bear_adx_thresh': 8.973664009572575, 'bear_atr_min_pct': 0.00381094410808302, 'bear_atr_max_pct': 0.13766190499852018, 'bear_tp_mult': 2.9994796783015802, 'bear_tsl_mult': 0.9142426868738762, 'bear_time_stop': 77, 'bear_use_sma': True, 'bear_use_ema': False, 'bear_use_atr': True, 'bear_use_adx': False, 'bear_use_spike': True, 'bear_rsi_required': False, 'sideways_strategy': 'mean_reversion', 'sideways_bb_std_mult': 1.4304160686106062, 'sideways_rsi_os': 41, 'sideways_rsi_ob': 50, 'sideways_adx_thresh': 22.070427216276514, 'sideways_atr_min_pct': 0.004270511734833925, 'sideways_atr_max_pct': 0.0750763747012702, 'sideways_tp_mult': 1.6586164625948132, 'sideways_tsl_mult': 0.41615215106374387, 'sideways_time_stop': 156, 'sideways_use_sma': True, 'sideways_use_ema': True, 'sideways_use_atr': False, 'sideways_use_adx': True, 'sideways_use_spike': False, 'sideways_rsi_required': True}.
[I 2025-08-31 11:31:12,357] Trial 777 finished with values: [-0.05129142384937291, 0.051137215353088496] and parameters: {'p_sma': 24, 'p_std': 12, 'p_atr': 29, 'p_adx': 21, 'rsi_period': 52, 'ema1': 16, 'ema2': 41, 'slip_atr_k': 0.22835164060147126, 'slip_spread_k': 0.8842326527991357, 'spread_hl_frac': 0.03194356003668319, 'bb_std_mult': 0.7490622966574538, 'rsi_os': 15, 'rsi_ob': 82, 'vol_spike': 0.07182856974239943, 'adx_thresh': 31.727422009891452, 'atr_min_pct': 0.016988661168034273, 'atr_max_pct': 0.0280521919441939, 'tp_mult': 2.2425674774752955, 'tsl_mult': 0.11025388983613157, 'strategy': 'breakout', 'time_stop': 98, 'use_sma': True, 'use_atr': True, 'use_adx': False, 'use_ema': True, 'use_spike': False, 'rsi_required': False, 'edge_k': 0.1898059762047215, 'edge_cap': 0.8315685801260531, 'bull_strategy': 'mean_reversion', 'bull_bb_std_mult': 2.250800470559999, 'bull_rsi_os': 41, 'bull_rsi_ob': 63, 'bull_adx_thresh': 25.194814473990647, 'bull_atr_min_pct': 0.011888867952533253, 'bull_atr_max_pct': 0.029681391468684922, 'bull_tp_mult': 2.8728031157165983, 'bull_tsl_mult': 0.434645656341266, 'bull_time_stop': 62, 'bull_use_sma': False, 'bull_use_ema': True, 'bull_use_atr': False, 'bull_use_adx': True, 'bull_use_spike': False, 'bull_rsi_required': True, 'bear_strategy': 'mean_reversion', 'bear_bb_std_mult': 1.5867743680978592, 'bear_rsi_os': 53, 'bear_rsi_ob': 52, 'bear_adx_thresh': 8.305221455914378, 'bear_atr_min_pct': 0.004749422045539141, 'bear_atr_max_pct': 0.063807414944294, 'bear_tp_mult': 2.2221410416616054, 'bear_tsl_mult': 0.9129382677798809, 'bear_time_stop': 110, 'bear_use_sma': True, 'bear_use_ema': False, 'bear_use_atr': True, 'bear_use_adx': False, 'bear_use_spike': True, 'bear_rsi_required': False, 'sideways_strategy': 'mean_reversion', 'sideways_bb_std_mult': 0.7965963525453734, 'sideways_rsi_os': 39, 'sideways_rsi_ob': 50, 'sideways_adx_thresh': 26.69062529194919, 'sideways_atr_min_pct': 0.004251215744218335, 'sideways_atr_max_pct': 0.10258314601060449, 'sideways_tp_mult': 1.0632298192630514, 'sideways_tsl_mult': 0.8659537005243987, 'sideways_time_stop': 160, 'sideways_use_sma': True, 'sideways_use_ema': True, 'sideways_use_atr': False, 'sideways_use_adx': True, 'sideways_use_spike': False, 'sideways_rsi_required': True}.
[I 2025-08-31 11:31:47,469] Trial 779 finished with values: [-1000000000.0, 1000000000.0] and parameters: {'p_sma': 29, 'p_std': 12, 'p_atr': 13, 'p_adx': 21, 'rsi_period': 16, 'ema1': 16, 'ema2': 49, 'slip_atr_k': 0.029090438347112196, 'slip_spread_k': 0.4670559606703859, 'spread_hl_frac': 0.022779987962546905, 'bb_std_mult': 0.7885092576225954, 'rsi_os': 23, 'rsi_ob': 64, 'vol_spike': 0.14670681653607695, 'adx_thresh': 9.64535993002039, 'atr_min_pct': 0.02196685177593809, 'atr_max_pct': 0.10618225894616644, 'tp_mult': 1.6018566880979033, 'tsl_mult': 0.06403360293409562, 'strategy': 'breakout', 'time_stop': 78, 'use_sma': True, 'use_atr': True, 'use_adx': False, 'use_ema': True, 'use_spike': False, 'rsi_required': False, 'edge_k': 0.6852847758040786, 'edge_cap': 0.07279903597633947, 'bull_strategy': 'mean_reversion', 'bull_bb_std_mult': 2.2839066299574586, 'bull_rsi_os': 39, 'bull_rsi_ob': 93, 'bull_adx_thresh': 6.606396441030643, 'bull_atr_min_pct': 0.010172474634817172, 'bull_atr_max_pct': 0.060305968063073076, 'bull_tp_mult': 2.883143806292578, 'bull_tsl_mult': 0.201750476006031, 'bull_time_stop': 200, 'bull_use_sma': False, 'bull_use_ema': True, 'bull_use_atr': False, 'bull_use_adx': True, 'bull_use_spike': False, 'bull_rsi_required': True, 'bear_strategy': 'mean_reversion', 'bear_bb_std_mult': 1.5366597338126067, 'bear_rsi_os': 5, 'bear_rsi_ob': 56, 'bear_adx_thresh': 10.570980937684773, 'bear_atr_min_pct': 0.007815044793424101, 'bear_atr_max_pct': 0.13701905716951235, 'bear_tp_mult': 2.2242155230636897, 'bear_tsl_mult': 0.9152503030972946, 'bear_time_stop': 79, 'bear_use_sma': False, 'bear_use_ema': False, 'bear_use_atr': True, 'bear_use_adx': False, 'bear_use_spike': True, 'bear_rsi_required': False, 'sideways_strategy': 'mean_reversion', 'sideways_bb_std_mult': 0.7897749091962853, 'sideways_rsi_os': 10, 'sideways_rsi_ob': 51, 'sideways_adx_thresh': 26.984379335144276, 'sideways_atr_min_pct': 0.019011978319184206, 'sideways_atr_max_pct': 0.10753096250638984, 'sideways_tp_mult': 2.2391518280213707, 'sideways_tsl_mult': 0.8640519446856728, 'sideways_time_stop': 162, 'sideways_use_sma': True, 'sideways_use_ema': True, 'sideways_use_atr': False, 'sideways_use_adx': False, 'sideways_use_spike': False, 'sideways_rsi_required': False}.
[I 2025-08-31 11:31:47,905] Trial 782 finished with values: [-1000000000.0, 1000000000.0] and parameters: {'p_sma': 40, 'p_std': 18, 'p_atr': 13, 'p_adx': 22, 'rsi_period': 35, 'ema1': 27, 'ema2': 18, 'slip_atr_k': 0.01053846087830937, 'slip_spread_k': 0.45569023652286356, 'spread_hl_frac': 0.005125428396195321, 'bb_std_mult': 1.5493353355918726, 'rsi_os': 24, 'rsi_ob': 64, 'vol_spike': 0.09040668230182096, 'adx_thresh': 12.457496431264213, 'atr_min_pct': 0.005840655226432049, 'atr_max_pct': 0.054272853580446104, 'tp_mult': 2.890826902836687, 'tsl_mult': 0.05575954926115961, 'strategy': 'breakout', 'time_stop': 263, 'use_sma': True, 'use_atr': True, 'use_adx': False, 'use_ema': True, 'use_spike': False, 'rsi_required': False, 'edge_k': 1.4735621187312717, 'edge_cap': 0.6195520503205922, 'bull_strategy': 'mean_reversion', 'bull_bb_std_mult': 1.8057541428938986, 'bull_rsi_os': 44, 'bull_rsi_ob': 67, 'bull_adx_thresh': 5.023959636352561, 'bull_atr_min_pct': 0.01025786568476933, 'bull_atr_max_pct': 0.03747583431563215, 'bull_tp_mult': 2.924005406786274, 'bull_tsl_mult': 0.20587456198313084, 'bull_time_stop': 58, 'bull_use_sma': False, 'bull_use_ema': True, 'bull_use_atr': False, 'bull_use_adx': True, 'bull_use_spike': False, 'bull_rsi_required': False, 'bear_strategy': 'mean_reversion', 'bear_bb_std_mult': 1.5061228302411642, 'bear_rsi_os': 49, 'bear_rsi_ob': 93, 'bear_adx_thresh': 25.190593267065243, 'bear_atr_min_pct': 0.028972652359775364, 'bear_atr_max_pct': 0.09576759087369728, 'bear_tp_mult': 2.7665009720312925, 'bear_tsl_mult': 0.8649949386968577, 'bear_time_stop': 252, 'bear_use_sma': False, 'bear_use_ema': False, 'bear_use_atr': True, 'bear_use_adx': False, 'bear_use_spike': True, 'bear_rsi_required': False, 'sideways_strategy': 'mean_reversion', 'sideways_bb_std_mult': 1.3384010430899116, 'sideways_rsi_os': 38, 'sideways_rsi_ob': 75, 'sideways_adx_thresh': 27.07282967755151, 'sideways_atr_min_pct': 0.02757312234489391, 'sideways_atr_max_pct': 0.10697508132098964, 'sideways_tp_mult': 1.4439663413231991, 'sideways_tsl_mult': 0.9204717905259229, 'sideways_time_stop': 126, 'sideways_use_sma': True, 'sideways_use_ema': True, 'sideways_use_atr': False, 'sideways_use_adx': False, 'sideways_use_spike': True, 'sideways_rsi_required': False}.
[I 2025-08-31 11:31:48,071] Trial 780 finished with values: [-1000000000.0, 1000000000.0] and parameters: {'p_sma': 11, 'p_std': 12, 'p_atr': 26, 'p_adx': 22, 'rsi_period': 36, 'ema1': 17, 'ema2': 12, 'slip_atr_k': 0.010236066689282073, 'slip_spread_k': 0.5249316668708085, 'spread_hl_frac': 0.019957296018045412, 'bb_std_mult': 1.4402796671140248, 'rsi_os': 34, 'rsi_ob': 64, 'vol_spike': 0.0746388492619347, 'adx_thresh': 13.947349582628732, 'atr_min_pct': 0.022058881917420413, 'atr_max_pct': 0.14557995562894752, 'tp_mult': 1.6240806905898657, 'tsl_mult': 0.05771723894710979, 'strategy': 'breakout', 'time_stop': 260, 'use_sma': True, 'use_atr': True, 'use_adx': False, 'use_ema': True, 'use_spike': False, 'rsi_required': False, 'edge_k': 0.1922465198797031, 'edge_cap': 0.7408978852720055, 'bull_strategy': 'mean_reversion', 'bull_bb_std_mult': 2.260763035931564, 'bull_rsi_os': 44, 'bull_rsi_ob': 59, 'bull_adx_thresh': 32.85036784217412, 'bull_atr_min_pct': 0.014850890261270842, 'bull_atr_max_pct': 0.030114007532919276, 'bull_tp_mult': 2.9275662292492606, 'bull_tsl_mult': 0.19730658437987916, 'bull_time_stop': 233, 'bull_use_sma': False, 'bull_use_ema': True, 'bull_use_atr': False, 'bull_use_adx': True, 'bull_use_spike': False, 'bull_rsi_required': False, 'bear_strategy': 'mean_reversion', 'bear_bb_std_mult': 1.5123276185518202, 'bear_rsi_os': 52, 'bear_rsi_ob': 52, 'bear_adx_thresh': 25.280939078225586, 'bear_atr_min_pct': 0.013970569267307085, 'bear_atr_max_pct': 0.13726487354407943, 'bear_tp_mult': 1.4398510922962986, 'bear_tsl_mult': 0.9218556001531678, 'bear_time_stop': 111, 'bear_use_sma': True, 'bear_use_ema': False, 'bear_use_atr': True, 'bear_use_adx': False, 'bear_use_spike': True, 'bear_rsi_required': False, 'sideways_strategy': 'mean_reversion', 'sideways_bb_std_mult': 1.3724900127032709, 'sideways_rsi_os': 38, 'sideways_rsi_ob': 67, 'sideways_adx_thresh': 26.758619415687416, 'sideways_atr_min_pct': 0.0052632347238161376, 'sideways_atr_max_pct': 0.07875914944341343, 'sideways_tp_mult': 2.499041540762451, 'sideways_tsl_mult': 0.8646480179467807, 'sideways_time_stop': 155, 'sideways_use_sma': True, 'sideways_use_ema': True, 'sideways_use_atr': False, 'sideways_use_adx': True, 'sideways_use_spike': True, 'sideways_rsi_required': True}.
[I 2025-08-31 11:31:48,232] Trial 781 finished with values: [-1000000000.0, 1000000000.0] and parameters: {'p_sma': 40, 'p_std': 52, 'p_atr': 11, 'p_adx': 23, 'rsi_period': 17, 'ema1': 27, 'ema2': 48, 'slip_atr_k': 0.10578800406292159, 'slip_spread_k': 0.5300527873758338, 'spread_hl_frac': 0.006564442161246138, 'bb_std_mult': 0.6792575890458713, 'rsi_os': 23, 'rsi_ob': 87, 'vol_spike': 0.05734360773812279, 'adx_thresh': 10.783940759726807, 'atr_min_pct': 0.005720195672228041, 'atr_max_pct': 0.06278511699046498, 'tp_mult': 2.890953977313223, 'tsl_mult': 0.05692039814882836, 'strategy': 'breakout', 'time_stop': 261, 'use_sma': True, 'use_atr': True, 'use_adx': False, 'use_ema': True, 'use_spike': False, 'rsi_required': False, 'edge_k': 1.4510606210325492, 'edge_cap': 0.06763068263555477, 'bull_strategy': 'mean_reversion', 'bull_bb_std_mult': 1.3490309123336655, 'bull_rsi_os': 32, 'bull_rsi_ob': 60, 'bull_adx_thresh': 28.29201972844643, 'bull_atr_min_pct': 0.011244943339602794, 'bull_atr_max_pct': 0.03783648011003955, 'bull_tp_mult': 1.75792226956822, 'bull_tsl_mult': 0.28170012970266445, 'bull_time_stop': 59, 'bull_use_sma': False, 'bull_use_ema': True, 'bull_use_atr': False, 'bull_use_adx': True, 'bull_use_spike': False, 'bull_rsi_required': False, 'bear_strategy': 'mean_reversion', 'bear_bb_std_mult': 1.520051828977933, 'bear_rsi_os': 54, 'bear_rsi_ob': 78, 'bear_adx_thresh': 10.703042585050458, 'bear_atr_min_pct': 0.013992889808036098, 'bear_atr_max_pct': 0.13715870299493346, 'bear_tp_mult': 1.5426745612074748, 'bear_tsl_mult': 0.8661218316123914, 'bear_time_stop': 179, 'bear_use_sma': False, 'bear_use_ema': False, 'bear_use_atr': True, 'bear_use_adx': False, 'bear_use_spike': True, 'bear_rsi_required': False, 'sideways_strategy': 'mean_reversion', 'sideways_bb_std_mult': 1.3586597824085802, 'sideways_rsi_os': 39, 'sideways_rsi_ob': 64, 'sideways_adx_thresh': 34.116369429516205, 'sideways_atr_min_pct': 0.005351965595177777, 'sideways_atr_max_pct': 0.10658305643646573, 'sideways_tp_mult': 1.542194625175485, 'sideways_tsl_mult': 0.004023744268844387, 'sideways_time_stop': 129, 'sideways_use_sma': True, 'sideways_use_ema': True, 'sideways_use_atr': False, 'sideways_use_adx': False, 'sideways_use_spike': True, 'sideways_rsi_required': False}.
