[I 2025-08-31 11:15:37,454] Trial 668 finished with values: [-1000000000.0, 1000000000.0] and parameters: {'p_sma': 33, 'p_std': 9, 'p_atr': 29, 'p_adx': 20, 'rsi_period': 35, 'ema1': 5, 'ema2': 36, 'slip_atr_k': 0.15813357921482432, 'slip_spread_k': 0.43783281680541286, 'spread_hl_frac': 0.01935148044816772, 'bb_std_mult': 0.6076762175358924, 'rsi_os': 31, 'rsi_ob': 83, 'vol_spike': 0.16661272031974364, 'adx_thresh': 11.618289259810918, 'atr_min_pct': 0.029931280988218716, 'atr_max_pct': 0.06233600418066712, 'tp_mult': 2.964546624011935, 'tsl_mult': 0.06298433035045523, 'strategy': 'breakout', 'time_stop': 92, 'use_sma': True, 'use_atr': True, 'use_adx': False, 'use_ema': True, 'use_spike': False, 'rsi_required': False, 'edge_k': 1.4806861696547775, 'edge_cap': 0.6900477609973373, 'bull_strategy': 'mean_reversion', 'bull_bb_std_mult': 2.6835744020317653, 'bull_rsi_os': 23, 'bull_rsi_ob': 61, 'bull_adx_thresh': 27.460490554520707, 'bull_atr_min_pct': 0.01224557297810819, 'bull_atr_max_pct': 0.11427867064932132, 'bull_tp_mult': 2.9018358467752563, 'bull_tsl_mult': 0.20645581024766957, 'bull_time_stop': 132, 'bull_use_sma': False, 'bull_use_ema': True, 'bull_use_atr': False, 'bull_use_adx': False, 'bull_use_spike': False, 'bull_rsi_required': True, 'bear_strategy': 'mean_reversion', 'bear_bb_std_mult': 2.4991851612161975, 'bear_rsi_os': 50, 'bear_rsi_ob': 51, 'bear_adx_thresh': 26.62417619896693, 'bear_atr_min_pct': 0.009139419169676376, 'bear_atr_max_pct': 0.13722816269735244, 'bear_tp_mult': 2.688003728853016, 'bear_tsl_mult': 0.8787446654085438, 'bear_time_stop': 111, 'bear_use_sma': False, 'bear_use_ema': True, 'bear_use_atr': True, 'bear_use_adx': False, 'bear_use_spike': False, 'bear_rsi_required': False, 'sideways_strategy': 'mean_reversion', 'sideways_bb_std_mult': 0.7646477653207172, 'sideways_rsi_os': 38, 'sideways_rsi_ob': 66, 'sideways_adx_thresh': 27.47831091457635, 'sideways_atr_min_pct': 0.00985090965557967, 'sideways_atr_max_pct': 0.09824295443507117, 'sideways_tp_mult': 1.5495736875005615, 'sideways_tsl_mult': 0.06283514118162337, 'sideways_time_stop': 157, 'sideways_use_sma': False, 'sideways_use_ema': True, 'sideways_use_atr': False, 'sideways_use_adx': False, 'sideways_use_spike': False, 'sideways_rsi_required': False}.
[I 2025-08-31 11:15:37,731] Trial 665 finished with values: [-1000000000.0, 1000000000.0] and parameters: {'p_sma': 37, 'p_std': 13, 'p_atr': 29, 'p_adx': 29, 'rsi_period': 35, 'ema1': 5, 'ema2': 39, 'slip_atr_k': 0.24910289465176955, 'slip_spread_k': 0.5102991642121991, 'spread_hl_frac': 0.023488152240606873, 'bb_std_mult': 0.6331456221568537, 'rsi_os': 18, 'rsi_ob': 83, 'vol_spike': 0.052614723307364775, 'adx_thresh': 25.126946635128242, 'atr_min_pct': 0.02094484587598375, 'atr_max_pct': 0.06295578052948961, 'tp_mult': 2.455938750750624, 'tsl_mult': 0.10225041411240571, 'strategy': 'breakout', 'time_stop': 93, 'use_sma': True, 'use_atr': True, 'use_adx': False, 'use_ema': True, 'use_spike': False, 'rsi_required': False, 'edge_k': 1.4761640478955047, 'edge_cap': 0.6598786438947327, 'bull_strategy': 'mean_reversion', 'bull_bb_std_mult': 1.4489892815013181, 'bull_rsi_os': 21, 'bull_rsi_ob': 62, 'bull_adx_thresh': 27.292417345328214, 'bull_atr_min_pct': 0.012745692754598937, 'bull_atr_max_pct': 0.03074118228106172, 'bull_tp_mult': 2.2151068844253636, 'bull_tsl_mult': 0.2165719321358641, 'bull_time_stop': 175, 'bull_use_sma': False, 'bull_use_ema': True, 'bull_use_atr': False, 'bull_use_adx': False, 'bull_use_spike': False, 'bull_rsi_required': False, 'bear_strategy': 'mean_reversion', 'bear_bb_std_mult': 1.6554495403284804, 'bear_rsi_os': 50, 'bear_rsi_ob': 87, 'bear_adx_thresh': 28.695676737414285, 'bear_atr_min_pct': 0.011218158569359841, 'bear_atr_max_pct': 0.1318365088517209, 'bear_tp_mult': 1.498075920813343, 'bear_tsl_mult': 0.8851994231178979, 'bear_time_stop': 102, 'bear_use_sma': False, 'bear_use_ema': False, 'bear_use_atr': True, 'bear_use_adx': False, 'bear_use_spike': True, 'bear_rsi_required': False, 'sideways_strategy': 'mean_reversion', 'sideways_bb_std_mult': 0.8385724829078087, 'sideways_rsi_os': 38, 'sideways_rsi_ob': 62, 'sideways_adx_thresh': 28.282598166461774, 'sideways_atr_min_pct': 0.022932588737377538, 'sideways_atr_max_pct': 0.10266139401527374, 'sideways_tp_mult': 2.186949848575822, 'sideways_tsl_mult': 0.47948653180750644, 'sideways_time_stop': 156, 'sideways_use_sma': False, 'sideways_use_ema': True, 'sideways_use_atr': False, 'sideways_use_adx': False, 'sideways_use_spike': True, 'sideways_rsi_required': False}.
[I 2025-08-31 11:15:37,893] Trial 666 finished with values: [-0.05477828104387139, 0.05431213438028278] and parameters: {'p_sma': 37, 'p_std': 13, 'p_atr': 29, 'p_adx': 15, 'rsi_period': 35, 'ema1': 5, 'ema2': 39, 'slip_atr_k': 0.13450326362547352, 'slip_spread_k': 0.506484553137297, 'spread_hl_frac': 0.01911227966039089, 'bb_std_mult': 0.6268272912064351, 'rsi_os': 31, 'rsi_ob': 83, 'vol_spike': 0.1249520427203075, 'adx_thresh': 11.697743318445518, 'atr_min_pct': 0.021086228252458504, 'atr_max_pct': 0.058853831135019186, 'tp_mult': 2.4516123831893926, 'tsl_mult': 0.09394015826378654, 'strategy': 'breakout', 'time_stop': 93, 'use_sma': True, 'use_atr': True, 'use_adx': False, 'use_ema': True, 'use_spike': False, 'rsi_required': False, 'edge_k': 1.5201966289318027, 'edge_cap': 0.6612876145609482, 'bull_strategy': 'mean_reversion', 'bull_bb_std_mult': 2.351701182655624, 'bull_rsi_os': 41, 'bull_rsi_ob': 62, 'bull_adx_thresh': 26.89978714994336, 'bull_atr_min_pct': 0.011723060231782103, 'bull_atr_max_pct': 0.029281777965530224, 'bull_tp_mult': 1.577984006278859, 'bull_tsl_mult': 0.20341238474691453, 'bull_time_stop': 57, 'bull_use_sma': False, 'bull_use_ema': True, 'bull_use_atr': False, 'bull_use_adx': False, 'bull_use_spike': False, 'bull_rsi_required': False, 'bear_strategy': 'mean_reversion', 'bear_bb_std_mult': 1.6536255928833625, 'bear_rsi_os': 50, 'bear_rsi_ob': 51, 'bear_adx_thresh': 10.075580139770848, 'bear_atr_min_pct': 0.0036569811270522733, 'bear_atr_max_pct': 0.1324543362310177, 'bear_tp_mult': 2.6839397444274864, 'bear_tsl_mult': 0.8925101227475771, 'bear_time_stop': 101, 'bear_use_sma': False, 'bear_use_ema': False, 'bear_use_atr': True, 'bear_use_adx': False, 'bear_use_spike': True, 'bear_rsi_required': False, 'sideways_strategy': 'mean_reversion', 'sideways_bb_std_mult': 0.8300334658679545, 'sideways_rsi_os': 38, 'sideways_rsi_ob': 91, 'sideways_adx_thresh': 28.129295633637426, 'sideways_atr_min_pct': 0.004777834297349754, 'sideways_atr_max_pct': 0.09830680101638004, 'sideways_tp_mult': 2.1652604600991188, 'sideways_tsl_mult': 0.8945033325916025, 'sideways_time_stop': 156, 'sideways_use_sma': False, 'sideways_use_ema': True, 'sideways_use_atr': False, 'sideways_use_adx': False, 'sideways_use_spike': True, 'sideways_rsi_required': False}.
[I 2025-08-31 11:16:11,194] Trial 669 finished with values: [-1000000000.0, 1000000000.0] and parameters: {'p_sma': 33, 'p_std': 9, 'p_atr': 28, 'p_adx': 20, 'rsi_period': 13, 'ema1': 5, 'ema2': 32, 'slip_atr_k': 0.1341170969182123, 'slip_spread_k': 0.4355428780088316, 'spread_hl_frac': 0.010062009537333341, 'bb_std_mult': 0.6134123183364065, 'rsi_os': 31, 'rsi_ob': 83, 'vol_spike': 0.12379076701293047, 'adx_thresh': 11.864492005885179, 'atr_min_pct': 0.021004060455191736, 'atr_max_pct': 0.06299758160168714, 'tp_mult': 1.8362385953184939, 'tsl_mult': 0.06376251315207555, 'strategy': 'breakout', 'time_stop': 70, 'use_sma': True, 'use_atr': True, 'use_adx': False, 'use_ema': True, 'use_spike': False, 'rsi_required': False, 'edge_k': 1.5090427249940583, 'edge_cap': 0.6895958822297433, 'bull_strategy': 'mean_reversion', 'bull_bb_std_mult': 2.4894998790270915, 'bull_rsi_os': 21, 'bull_rsi_ob': 62, 'bull_adx_thresh': 27.67203943219358, 'bull_atr_min_pct': 0.01270056609338518, 'bull_atr_max_pct': 0.035105243638854054, 'bull_tp_mult': 2.11506343612185, 'bull_tsl_mult': 0.20686948343165673, 'bull_time_stop': 56, 'bull_use_sma': False, 'bull_use_ema': True, 'bull_use_atr': False, 'bull_use_adx': True, 'bull_use_spike': False, 'bull_rsi_required': True, 'bear_strategy': 'mean_reversion', 'bear_bb_std_mult': 1.4717355793468445, 'bear_rsi_os': 50, 'bear_rsi_ob': 85, 'bear_adx_thresh': 9.895180297573994, 'bear_atr_min_pct': 0.0028568360401667946, 'bear_atr_max_pct': 0.137325574783515, 'bear_tp_mult': 2.6735155155940196, 'bear_tsl_mult': 0.8591732214394715, 'bear_time_stop': 101, 'bear_use_sma': False, 'bear_use_ema': True, 'bear_use_atr': True, 'bear_use_adx': False, 'bear_use_spike': False, 'bear_rsi_required': False, 'sideways_strategy': 'mean_reversion', 'sideways_bb_std_mult': 1.0458017932071024, 'sideways_rsi_os': 38, 'sideways_rsi_ob': 91, 'sideways_adx_thresh': 26.728286240467774, 'sideways_atr_min_pct': 0.009896636709787368, 'sideways_atr_max_pct': 0.09333944772755713, 'sideways_tp_mult': 1.5493533874547751, 'sideways_tsl_mult': 0.058719003967987626, 'sideways_time_stop': 181, 'sideways_use_sma': False, 'sideways_use_ema': True, 'sideways_use_atr': False, 'sideways_use_adx': False, 'sideways_use_spike': False, 'sideways_rsi_required': False}.
[I 2025-08-31 11:16:11,522] Trial 671 finished with values: [-1000000000.0, 1000000000.0] and parameters: {'p_sma': 39, 'p_std': 15, 'p_atr': 28, 'p_adx': 23, 'rsi_period': 31, 'ema1': 5, 'ema2': 19, 'slip_atr_k': 0.013751306961197533, 'slip_spread_k': 0.4774527131034693, 'spread_hl_frac': 0.010600260569608076, 'bb_std_mult': 0.6033879530380196, 'rsi_os': 33, 'rsi_ob': 85, 'vol_spike': 0.1756245967031166, 'adx_thresh': 9.95050127244674, 'atr_min_pct': 0.022460897628057492, 'atr_max_pct': 0.05839806236941117, 'tp_mult': 2.9156584863858526, 'tsl_mult': 0.04283198697494196, 'strategy': 'breakout', 'time_stop': 71, 'use_sma': True, 'use_atr': True, 'use_adx': False, 'use_ema': True, 'use_spike': False, 'rsi_required': False, 'edge_k': 1.456689646073467, 'edge_cap': 0.7252724395754607, 'bull_strategy': 'mean_reversion', 'bull_bb_std_mult': 2.312790614866293, 'bull_rsi_os': 43, 'bull_rsi_ob': 62, 'bull_adx_thresh': 25.78818172485865, 'bull_atr_min_pct': 0.010921851196138562, 'bull_atr_max_pct': 0.010630219700415916, 'bull_tp_mult': 2.109030185394469, 'bull_tsl_mult': 0.2586872642196915, 'bull_time_stop': 55, 'bull_use_sma': False, 'bull_use_ema': True, 'bull_use_atr': False, 'bull_use_adx': True, 'bull_use_spike': False, 'bull_rsi_required': False, 'bear_strategy': 'mean_reversion', 'bear_bb_std_mult': 1.0152297355123887, 'bear_rsi_os': 9, 'bear_rsi_ob': 94, 'bear_adx_thresh': 11.610345188661913, 'bear_atr_min_pct': 0.0006828719397770824, 'bear_atr_max_pct': 0.09325585440504117, 'bear_tp_mult': 2.778267228806265, 'bear_tsl_mult': 0.8645015123359362, 'bear_time_stop': 100, 'bear_use_sma': False, 'bear_use_ema': False, 'bear_use_atr': True, 'bear_use_adx': True, 'bear_use_spike': True, 'bear_rsi_required': False, 'sideways_strategy': 'mean_reversion', 'sideways_bb_std_mult': 1.0743220989806237, 'sideways_rsi_os': 40, 'sideways_rsi_ob': 61, 'sideways_adx_thresh': 24.72540962515756, 'sideways_atr_min_pct': 0.006022788050145672, 'sideways_atr_max_pct': 0.10996015009356545, 'sideways_tp_mult': 1.4737343656305408, 'sideways_tsl_mult': 0.8512406609003227, 'sideways_time_stop': 171, 'sideways_use_sma': True, 'sideways_use_ema': True, 'sideways_use_atr': False, 'sideways_use_adx': False, 'sideways_use_spike': True, 'sideways_rsi_required': False}.
[I 2025-08-31 11:16:11,603] Trial 670 finished with values: [-0.03864887383256643, 0.038418577171744565] and parameters: {'p_sma': 6, 'p_std': 15, 'p_atr': 28, 'p_adx': 25, 'rsi_period': 37, 'ema1': 5, 'ema2': 19, 'slip_atr_k': 0.013894192085068376, 'slip_spread_k': 0.46980769787415627, 'spread_hl_frac': 0.010674096931536882, 'bb_std_mult': 0.5983729210697146, 'rsi_os': 28, 'rsi_ob': 83, 'vol_spike': 0.05186047555777629, 'adx_thresh': 9.965378537642206, 'atr_min_pct': 0.001899918838691568, 'atr_max_pct': 0.0585233318801497, 'tp_mult': 2.928248486476772, 'tsl_mult': 0.13290668395402344, 'strategy': 'breakout', 'time_stop': 69, 'use_sma': True, 'use_atr': True, 'use_adx': False, 'use_ema': True, 'use_spike': False, 'rsi_required': False, 'edge_k': 1.5094617069420655, 'edge_cap': 0.7218676973534339, 'bull_strategy': 'mean_reversion', 'bull_bb_std_mult': 2.3380613401118797, 'bull_rsi_os': 43, 'bull_rsi_ob': 62, 'bull_adx_thresh': 25.983717411149374, 'bull_atr_min_pct': 0.012606515796160057, 'bull_atr_max_pct': 0.034499967027480614, 'bull_tp_mult': 2.222677609580984, 'bull_tsl_mult': 0.2617386304272615, 'bull_time_stop': 54, 'bull_use_sma': False, 'bull_use_ema': True, 'bull_use_atr': False, 'bull_use_adx': True, 'bull_use_spike': False, 'bull_rsi_required': False, 'bear_strategy': 'mean_reversion', 'bear_bb_std_mult': 1.451142946798081, 'bear_rsi_os': 50, 'bear_rsi_ob': 68, 'bear_adx_thresh': 28.74632786222746, 'bear_atr_min_pct': 0.00041776387055719386, 'bear_atr_max_pct': 0.04757937208800276, 'bear_tp_mult': 2.727769590827191, 'bear_tsl_mult': 0.8533222261100804, 'bear_time_stop': 100, 'bear_use_sma': False, 'bear_use_ema': False, 'bear_use_atr': True, 'bear_use_adx': True, 'bear_use_spike': True, 'bear_rsi_required': False, 'sideways_strategy': 'mean_reversion', 'sideways_bb_std_mult': 1.0371463740289664, 'sideways_rsi_os': 40, 'sideways_rsi_ob': 51, 'sideways_adx_thresh': 24.368942626246056, 'sideways_atr_min_pct': 0.019833533284838133, 'sideways_atr_max_pct': 0.10602821447240025, 'sideways_tp_mult': 1.5306362276475238, 'sideways_tsl_mult': 0.8517990688724943, 'sideways_time_stop': 172, 'sideways_use_sma': True, 'sideways_use_ema': True, 'sideways_use_atr': False, 'sideways_use_adx': False, 'sideways_use_spike': True, 'sideways_rsi_required': False}.
[I 2025-08-31 11:16:11,746] Trial 672 finished with values: [-1000000000.0, 1000000000.0] and parameters: {'p_sma': 27, 'p_std': 15, 'p_atr': 28, 'p_adx': 25, 'rsi_period': 31, 'ema1': 27, 'ema2': 49, 'slip_atr_k': 0.10764559683810321, 'slip_spread_k': 0.4737782684875413, 'spread_hl_frac': 0.03893143307645437, 'bb_std_mult': 0.5893695044468346, 'rsi_os': 15, 'rsi_ob': 85, 'vol_spike': 0.023000623748893362, 'adx_thresh': 9.901588722006599, 'atr_min_pct': 0.011394679191749146, 'atr_max_pct': 0.05522134645183546, 'tp_mult': 2.917316414127333, 'tsl_mult': 0.06148539142197677, 'strategy': 'breakout', 'time_stop': 71, 'use_sma': True, 'use_atr': True, 'use_adx': False, 'use_ema': True, 'use_spike': False, 'rsi_required': False, 'edge_k': 1.5295321739682448, 'edge_cap': 0.7195560294548351, 'bull_strategy': 'mean_reversion', 'bull_bb_std_mult': 0.7380399121129513, 'bull_rsi_os': 43, 'bull_rsi_ob': 63, 'bull_adx_thresh': 25.98716293550699, 'bull_atr_min_pct': 0.012752163145915636, 'bull_atr_max_pct': 0.03424090168510996, 'bull_tp_mult': 2.885649221506986, 'bull_tsl_mult': 0.3326009687842695, 'bull_time_stop': 90, 'bull_use_sma': False, 'bull_use_ema': True, 'bull_use_atr': False, 'bull_use_adx': True, 'bull_use_spike': False, 'bull_rsi_required': True, 'bear_strategy': 'mean_reversion', 'bear_bb_std_mult': 2.4070008245769543, 'bear_rsi_os': 52, 'bear_rsi_ob': 92, 'bear_adx_thresh': 25.632574385354438, 'bear_atr_min_pct': 0.0028895146324553296, 'bear_atr_max_pct': 0.09321650475066535, 'bear_tp_mult': 2.611194237429647, 'bear_tsl_mult': 0.8507981223451405, 'bear_time_stop': 88, 'bear_use_sma': False, 'bear_use_ema': True, 'bear_use_atr': True, 'bear_use_adx': True, 'bear_use_spike': False, 'bear_rsi_required': False, 'sideways_strategy': 'mean_reversion', 'sideways_bb_std_mult': 1.0580708427985377, 'sideways_rsi_os': 24, 'sideways_rsi_ob': 65, 'sideways_adx_thresh': 26.70906540857221, 'sideways_atr_min_pct': 0.019802026561942018, 'sideways_atr_max_pct': 0.10545982124155448, 'sideways_tp_mult': 2.6095778607909126, 'sideways_tsl_mult': 0.8567673113492048, 'sideways_time_stop': 171, 'sideways_use_sma': True, 'sideways_use_ema': True, 'sideways_use_atr': False, 'sideways_use_adx': False, 'sideways_use_spike': False, 'sideways_rsi_required': False}.
[I 2025-08-31 11:16:44,608] Trial 676 finished with values: [-1000000000.0, 1000000000.0] and parameters: {'p_sma': 15, 'p_std': 21, 'p_atr': 27, 'p_adx': 22, 'rsi_period': 37, 'ema1': 8, 'ema2': 30, 'slip_atr_k': 0.021761527283392784, 'slip_spread_k': 0.5448777487913682, 'spread_hl_frac': 0.02210228008745829, 'bb_std_mult': 0.7469533472834932, 'rsi_os': 29, 'rsi_ob': 81, 'vol_spike': 0.14499802894031774, 'adx_thresh': 10.769802099719449, 'atr_min_pct': 0.02332269936241884, 'atr_max_pct': 0.07064118853640039, 'tp_mult': 2.960952014516588, 'tsl_mult': 0.12885122832756996, 'strategy': 'breakout', 'time_stop': 78, 'use_sma': True, 'use_atr': True, 'use_adx': False, 'use_ema': True, 'use_spike': False, 'rsi_required': False, 'edge_k': 1.5603215826922185, 'edge_cap': 0.8020957746585489, 'bull_strategy': 'mean_reversion', 'bull_bb_std_mult': 2.1546449658485503, 'bull_rsi_os': 38, 'bull_rsi_ob': 60, 'bull_adx_thresh': 26.56052964809341, 'bull_atr_min_pct': 0.012065884490339468, 'bull_atr_max_pct': 0.12127185042681009, 'bull_tp_mult': 2.820665001136869, 'bull_tsl_mult': 0.23330920336382155, 'bull_time_stop': 293, 'bull_use_sma': False, 'bull_use_ema': False, 'bull_use_atr': False, 'bull_use_adx': True, 'bull_use_spike': False, 'bull_rsi_required': False, 'bear_strategy': 'mean_reversion', 'bear_bb_std_mult': 1.5253481783238112, 'bear_rsi_os': 5, 'bear_rsi_ob': 55, 'bear_adx_thresh': 18.940590128170705, 'bear_atr_min_pct': 0.007452471555805057, 'bear_atr_max_pct': 0.036959559963767014, 'bear_tp_mult': 1.874495686273023, 'bear_tsl_mult': 0.9234997182991556, 'bear_time_stop': 92, 'bear_use_sma': True, 'bear_use_ema': False, 'bear_use_atr': True, 'bear_use_adx': False, 'bear_use_spike': True, 'bear_rsi_required': False, 'sideways_strategy': 'mean_reversion', 'sideways_bb_std_mult': 0.9529230762854748, 'sideways_rsi_os': 42, 'sideways_rsi_ob': 63, 'sideways_adx_thresh': 25.335285735374928, 'sideways_atr_min_pct': 0.006815176537193152, 'sideways_atr_max_pct': 0.10742571573134141, 'sideways_tp_mult': 2.3390822759452385, 'sideways_tsl_mult': 0.8724712432805882, 'sideways_time_stop': 179, 'sideways_use_sma': True, 'sideways_use_ema': True, 'sideways_use_atr': False, 'sideways_use_adx': True, 'sideways_use_spike': True, 'sideways_rsi_required': False}.
[I 2025-08-31 11:16:45,165] Trial 673 finished with values: [-0.06158364251799542, 0.06197883167266894] and parameters: {'p_sma': 5, 'p_std': 15, 'p_atr': 28, 'p_adx': 25, 'rsi_period': 72, 'ema1': 5, 'ema2': 30, 'slip_atr_k': 0.015538845669509577, 'slip_spread_k': 0.47645231421631723, 'spread_hl_frac': 0.021870564734703894, 'bb_std_mult': 0.5545497021440812, 'rsi_os': 33, 'rsi_ob': 81, 'vol_spike': 0.1094759015027727, 'adx_thresh': 9.986175270922171, 'atr_min_pct': 0.02201391473514684, 'atr_max_pct': 0.07157906219255343, 'tp_mult': 2.921434977428008, 'tsl_mult': 0.03811454316483574, 'strategy': 'breakout', 'time_stop': 71, 'use_sma': True, 'use_atr': True, 'use_adx': False, 'use_ema': True, 'use_spike': False, 'rsi_required': False, 'edge_k': 1.5457048984697421, 'edge_cap': 0.7301338197639649, 'bull_strategy': 'mean_reversion', 'bull_bb_std_mult': 2.141699507001848, 'bull_rsi_os': 43, 'bull_rsi_ob': 64, 'bull_adx_thresh': 25.588841073627265, 'bull_atr_min_pct': 0.010782768772468889, 'bull_atr_max_pct': 0.09084536736994067, 'bull_tp_mult': 1.7421392095104045, 'bull_tsl_mult': 0.2656466788688382, 'bull_time_stop': 293, 'bull_use_sma': False, 'bull_use_ema': True, 'bull_use_atr': False, 'bull_use_adx': True, 'bull_use_spike': False, 'bull_rsi_required': False, 'bear_strategy': 'mean_reversion', 'bear_bb_std_mult': 0.9837795102362517, 'bear_rsi_os': 53, 'bear_rsi_ob': 47, 'bear_adx_thresh': 23.393990714522857, 'bear_atr_min_pct': 0.0004975523706360219, 'bear_atr_max_pct': 0.046720377801441504, 'bear_tp_mult': 2.772660456723578, 'bear_tsl_mult': 0.9245546761250046, 'bear_time_stop': 90, 'bear_use_sma': True, 'bear_use_ema': False, 'bear_use_atr': True, 'bear_use_adx': True, 'bear_use_spike': True, 'bear_rsi_required': False, 'sideways_strategy': 'mean_reversion', 'sideways_bb_std_mult': 1.1333563180407853, 'sideways_rsi_os': 41, 'sideways_rsi_ob': 61, 'sideways_adx_thresh': 25.10230285178558, 'sideways_atr_min_pct': 0.006110883242636949, 'sideways_atr_max_pct': 0.11035369059510199, 'sideways_tp_mult': 2.3424086989213566, 'sideways_tsl_mult': 0.8484136117294622, 'sideways_time_stop': 172, 'sideways_use_sma': True, 'sideways_use_ema': True, 'sideways_use_atr': False, 'sideways_use_adx': True, 'sideways_use_spike': True, 'sideways_rsi_required': False}.
