[I 2025-08-31 10:28:48,855] Trial 305 finished with values: [-1000000000.0, 1000000000.0] and parameters: {'p_sma': 23, 'p_std': 26, 'p_atr': 8, 'p_adx': 15, 'rsi_period': 22, 'ema1': 5, 'ema2': 55, 'slip_atr_k': 0.07239348451342692, 'slip_spread_k': 0.2711421380061455, 'spread_hl_frac': 0.024880041214891842, 'bb_std_mult': 2.6262681459738206, 'rsi_os': 39, 'rsi_ob': 76, 'vol_spike': 0.19545709033969125, 'adx_thresh': 33.013008924777736, 'atr_min_pct': 0.004109960057514992, 'atr_max_pct': 0.04184353389904982, 'tp_mult': 2.847596137425971, 'tsl_mult': 0.5282526033672633, 'strategy': 'mean_reversion', 'time_stop': 184, 'use_sma': False, 'use_atr': False, 'use_adx': False, 'use_ema': False, 'use_spike': True, 'rsi_required': True, 'edge_k': 0.9321305484724547, 'edge_cap': 0.22491557836286002, 'bull_strategy': 'breakout', 'bull_bb_std_mult': 1.119224958048337, 'bull_rsi_os': 53, 'bull_rsi_ob': 77, 'bull_adx_thresh': 25.85254805163686, 'bull_atr_min_pct': 0.0292826739639327, 'bull_atr_max_pct': 0.07256302471928014, 'bull_tp_mult': 2.5516548662431227, 'bull_tsl_mult': 0.8553532779221353, 'bull_time_stop': 23, 'bull_use_sma': True, 'bull_use_ema': True, 'bull_use_atr': True, 'bull_use_adx': True, 'bull_use_spike': False, 'bull_rsi_required': False, 'bear_strategy': 'breakout', 'bear_bb_std_mult': 1.982032071193938, 'bear_rsi_os': 35, 'bear_rsi_ob': 47, 'bear_adx_thresh': 33.81603776109333, 'bear_atr_min_pct': 0.018135037889609396, 'bear_atr_max_pct': 0.08950508836498955, 'bear_tp_mult': 1.4180448979347489, 'bear_tsl_mult': 0.1582770562369913, 'bear_time_stop': 239, 'bear_use_sma': False, 'bear_use_ema': False, 'bear_use_atr': True, 'bear_use_adx': False, 'bear_use_spike': True, 'bear_rsi_required': True, 'sideways_strategy': 'breakout', 'sideways_bb_std_mult': 2.8431536654436265, 'sideways_rsi_os': 29, 'sideways_rsi_ob': 83, 'sideways_adx_thresh': 8.047727460032085, 'sideways_atr_min_pct': 0.012660454141411849, 'sideways_atr_max_pct': 0.014904804391491559, 'sideways_tp_mult': 1.2126394790110584, 'sideways_tsl_mult': 0.8095398503712694, 'sideways_time_stop': 229, 'sideways_use_sma': True, 'sideways_use_ema': False, 'sideways_use_atr': False, 'sideways_use_adx': False, 'sideways_use_spike': True, 'sideways_rsi_required': False}.
[I 2025-08-31 10:28:56,145] Trial 307 finished with values: [-0.008733022708400262, 0.008767038013751064] and parameters: {'p_sma': 24, 'p_std': 13, 'p_atr': 18, 'p_adx': 7, 'rsi_period': 26, 'ema1': 10, 'ema2': 60, 'slip_atr_k': 0.07233283262527862, 'slip_spread_k': 0.3027640616306936, 'spread_hl_frac': 0.02521765430403199, 'bb_std_mult': 2.4875926748894908, 'rsi_os': 39, 'rsi_ob': 83, 'vol_spike': 0.22169473606697343, 'adx_thresh': 9.944792371493232, 'atr_min_pct': 0.02026916015245598, 'atr_max_pct': 0.04187910254640512, 'tp_mult': 2.7652324910771866, 'tsl_mult': 0.5287420556549552, 'strategy': 'mean_reversion', 'time_stop': 150, 'use_sma': False, 'use_atr': False, 'use_adx': False, 'use_ema': False, 'use_spike': True, 'rsi_required': True, 'edge_k': 0.9491002238078977, 'edge_cap': 0.14485294792143869, 'bull_strategy': 'breakout', 'bull_bb_std_mult': 1.1248188248462878, 'bull_rsi_os': 34, 'bull_rsi_ob': 73, 'bull_adx_thresh': 25.72814412704222, 'bull_atr_min_pct': 0.0037084369448658976, 'bull_atr_max_pct': 0.07274219625331346, 'bull_tp_mult': 1.1980704259255663, 'bull_tsl_mult': 0.8310950110514698, 'bull_time_stop': 11, 'bull_use_sma': True, 'bull_use_ema': True, 'bull_use_atr': True, 'bull_use_adx': True, 'bull_use_spike': True, 'bull_rsi_required': False, 'bear_strategy': 'breakout', 'bear_bb_std_mult': 2.058593339786306, 'bear_rsi_os': 11, 'bear_rsi_ob': 57, 'bear_adx_thresh': 21.521874058881796, 'bear_atr_min_pct': 0.01810401999274296, 'bear_atr_max_pct': 0.1238616904490791, 'bear_tp_mult': 2.3852410172576217, 'bear_tsl_mult': 0.17683970072108712, 'bear_time_stop': 285, 'bear_use_sma': False, 'bear_use_ema': False, 'bear_use_atr': True, 'bear_use_adx': False, 'bear_use_spike': True, 'bear_rsi_required': True, 'sideways_strategy': 'breakout', 'sideways_bb_std_mult': 2.830403673726411, 'sideways_rsi_os': 38, 'sideways_rsi_ob': 83, 'sideways_adx_thresh': 25.96697947598193, 'sideways_atr_min_pct': 0.016068019199116823, 'sideways_atr_max_pct': 0.10554648985906992, 'sideways_tp_mult': 1.2482671378140067, 'sideways_tsl_mult': 0.7535158599840331, 'sideways_time_stop': 286, 'sideways_use_sma': True, 'sideways_use_ema': False, 'sideways_use_atr': False, 'sideways_use_adx': False, 'sideways_use_spike': True, 'sideways_rsi_required': False}.
[I 2025-08-31 10:29:21,347] Trial 308 finished with values: [-0.01360839796820068, 0.013534539052314054] and parameters: {'p_sma': 59, 'p_std': 35, 'p_atr': 18, 'p_adx': 10, 'rsi_period': 59, 'ema1': 10, 'ema2': 60, 'slip_atr_k': 0.08600818682672408, 'slip_spread_k': 0.6437069135080898, 'spread_hl_frac': 0.025304356202274107, 'bb_std_mult': 2.504243350319957, 'rsi_os': 42, 'rsi_ob': 76, 'vol_spike': 0.22121539713159416, 'adx_thresh': 9.570441007042078, 'atr_min_pct': 0.02032683325258703, 'atr_max_pct': 0.05806347853275859, 'tp_mult': 2.7651985673895876, 'tsl_mult': 0.2638986163047431, 'strategy': 'mean_reversion', 'time_stop': 129, 'use_sma': False, 'use_atr': False, 'use_adx': False, 'use_ema': False, 'use_spike': True, 'rsi_required': False, 'edge_k': 1.7604129275632954, 'edge_cap': 0.13943464010056406, 'bull_strategy': 'breakout', 'bull_bb_std_mult': 1.0928758079636305, 'bull_rsi_os': 41, 'bull_rsi_ob': 73, 'bull_adx_thresh': 26.150184469807044, 'bull_atr_min_pct': 0.0033847801358987467, 'bull_atr_max_pct': 0.07216003454635815, 'bull_tp_mult': 1.7655537589369896, 'bull_tsl_mult': 0.1647154373459868, 'bull_time_stop': 14, 'bull_use_sma': True, 'bull_use_ema': True, 'bull_use_atr': True, 'bull_use_adx': True, 'bull_use_spike': False, 'bull_rsi_required': False, 'bear_strategy': 'breakout', 'bear_bb_std_mult': 2.0669450088643773, 'bear_rsi_os': 35, 'bear_rsi_ob': 55, 'bear_adx_thresh': 5.815067652670115, 'bear_atr_min_pct': 0.017962097187691848, 'bear_atr_max_pct': 0.03749609986785062, 'bear_tp_mult': 2.4984936442929553, 'bear_tsl_mult': 0.15647591133771235, 'bear_time_stop': 169, 'bear_use_sma': False, 'bear_use_ema': False, 'bear_use_atr': True, 'bear_use_adx': False, 'bear_use_spike': True, 'bear_rsi_required': True, 'sideways_strategy': 'mean_reversion', 'sideways_bb_std_mult': 2.8048931627032148, 'sideways_rsi_os': 53, 'sideways_rsi_ob': 83, 'sideways_adx_thresh': 14.743965189977033, 'sideways_atr_min_pct': 0.01615759500676934, 'sideways_atr_max_pct': 0.07852476515484016, 'sideways_tp_mult': 1.2091150761513052, 'sideways_tsl_mult': 0.8078698397460431, 'sideways_time_stop': 286, 'sideways_use_sma': True, 'sideways_use_ema': False, 'sideways_use_atr': False, 'sideways_use_adx': False, 'sideways_use_spike': True, 'sideways_rsi_required': False}.
[I 2025-08-31 10:29:21,600] Trial 309 finished with values: [-1000000000.0, 1000000000.0] and parameters: {'p_sma': 59, 'p_std': 26, 'p_atr': 8, 'p_adx': 29, 'rsi_period': 59, 'ema1': 12, 'ema2': 60, 'slip_atr_k': 0.08797540857474512, 'slip_spread_k': 0.66197780761166, 'spread_hl_frac': 0.010585177831549726, 'bb_std_mult': 2.3750974079971123, 'rsi_os': 39, 'rsi_ob': 78, 'vol_spike': 0.22271772828032674, 'adx_thresh': 9.928049840460012, 'atr_min_pct': 0.003921939680215553, 'atr_max_pct': 0.0403379883040729, 'tp_mult': 2.767970959131874, 'tsl_mult': 0.9380010184655856, 'strategy': 'mean_reversion', 'time_stop': 142, 'use_sma': False, 'use_atr': False, 'use_adx': False, 'use_ema': False, 'use_spike': True, 'rsi_required': False, 'edge_k': 1.6567456714928124, 'edge_cap': 0.14619850568297496, 'bull_strategy': 'breakout', 'bull_bb_std_mult': 1.1321196411203471, 'bull_rsi_os': 34, 'bull_rsi_ob': 73, 'bull_adx_thresh': 10.378787851839146, 'bull_atr_min_pct': 0.010378068354546535, 'bull_atr_max_pct': 0.07216456186882765, 'bull_tp_mult': 1.202235997862156, 'bull_tsl_mult': 0.11562782504520586, 'bull_time_stop': 15, 'bull_use_sma': True, 'bull_use_ema': True, 'bull_use_atr': True, 'bull_use_adx': True, 'bull_use_spike': False, 'bull_rsi_required': False, 'bear_strategy': 'breakout', 'bear_bb_std_mult': 2.408117123819188, 'bear_rsi_os': 24, 'bear_rsi_ob': 55, 'bear_adx_thresh': 9.699864816001059, 'bear_atr_min_pct': 0.01799427292422961, 'bear_atr_max_pct': 0.1236850557780164, 'bear_tp_mult': 2.634180687514668, 'bear_tsl_mult': 0.17842978021364225, 'bear_time_stop': 280, 'bear_use_sma': False, 'bear_use_ema': False, 'bear_use_atr': True, 'bear_use_adx': True, 'bear_use_spike': False, 'bear_rsi_required': True, 'sideways_strategy': 'mean_reversion', 'sideways_bb_std_mult': 2.8006363236355787, 'sideways_rsi_os': 38, 'sideways_rsi_ob': 84, 'sideways_adx_thresh': 7.8603847100646895, 'sideways_atr_min_pct': 0.008133306828786987, 'sideways_atr_max_pct': 0.1328309337876491, 'sideways_tp_mult': 1.9707898014926308, 'sideways_tsl_mult': 0.757471831424446, 'sideways_time_stop': 283, 'sideways_use_sma': True, 'sideways_use_ema': False, 'sideways_use_atr': False, 'sideways_use_adx': False, 'sideways_use_spike': True, 'sideways_rsi_required': False}.
[I 2025-08-31 10:29:24,816] Trial 310 finished with values: [-0.0023147687093971747, 0.003443473039790082] and parameters: {'p_sma': 17, 'p_std': 32, 'p_atr': 18, 'p_adx': 7, 'rsi_period': 26, 'ema1': 28, 'ema2': 60, 'slip_atr_k': 0.01032717840688202, 'slip_spread_k': 0.30732758474220345, 'spread_hl_frac': 0.035301485110960644, 'bb_std_mult': 1.0575942523209854, 'rsi_os': 43, 'rsi_ob': 78, 'vol_spike': 0.22302357596918632, 'adx_thresh': 9.758550374790524, 'atr_min_pct': 0.020226872079049982, 'atr_max_pct': 0.02107475677451211, 'tp_mult': 2.769163617267739, 'tsl_mult': 0.58381071126069, 'strategy': 'mean_reversion', 'time_stop': 130, 'use_sma': False, 'use_atr': False, 'use_adx': True, 'use_ema': False, 'use_spike': True, 'rsi_required': False, 'edge_k': 1.6647516805217946, 'edge_cap': 0.875841404135686, 'bull_strategy': 'breakout', 'bull_bb_std_mult': 1.5628714730283975, 'bull_rsi_os': 37, 'bull_rsi_ob': 86, 'bull_adx_thresh': 10.275300930576112, 'bull_atr_min_pct': 0.010198663070996412, 'bull_atr_max_pct': 0.09850751399270226, 'bull_tp_mult': 2.43289090105824, 'bull_tsl_mult': 0.7450222602357377, 'bull_time_stop': 12, 'bull_use_sma': True, 'bull_use_ema': True, 'bull_use_atr': True, 'bull_use_adx': False, 'bull_use_spike': True, 'bull_rsi_required': False, 'bear_strategy': 'breakout', 'bear_bb_std_mult': 3.1636259746042477, 'bear_rsi_os': 27, 'bear_rsi_ob': 57, 'bear_adx_thresh': 21.353219511978175, 'bear_atr_min_pct': 0.014634803301427338, 'bear_atr_max_pct': 0.10546814762411465, 'bear_tp_mult': 2.365578092441692, 'bear_tsl_mult': 0.1849054308003756, 'bear_time_stop': 51, 'bear_use_sma': True, 'bear_use_ema': False, 'bear_use_atr': False, 'bear_use_adx': True, 'bear_use_spike': False, 'bear_rsi_required': False, 'sideways_strategy': 'mean_reversion', 'sideways_bb_std_mult': 2.46294457053702, 'sideways_rsi_os': 38, 'sideways_rsi_ob': 84, 'sideways_adx_thresh': 14.772806245397696, 'sideways_atr_min_pct': 0.00370401182676172, 'sideways_atr_max_pct': 0.10588777613965072, 'sideways_tp_mult': 2.580337713205414, 'sideways_tsl_mult': 0.3156353198548971, 'sideways_time_stop': 284, 'sideways_use_sma': False, 'sideways_use_ema': False, 'sideways_use_atr': False, 'sideways_use_adx': True, 'sideways_use_spike': True, 'sideways_rsi_required': False}.
[I 2025-08-31 10:29:28,364] Trial 311 finished with values: [-1000000000.0, 1000000000.0] and parameters: {'p_sma': 18, 'p_std': 56, 'p_atr': 23, 'p_adx': 10, 'rsi_period': 26, 'ema1': 18, 'ema2': 42, 'slip_atr_k': 0.029159170382636268, 'slip_spread_k': 0.2974036558777422, 'spread_hl_frac': 0.012027233261923748, 'bb_std_mult': 1.0440297009003046, 'rsi_os': 43, 'rsi_ob': 73, 'vol_spike': 0.15471931885628842, 'adx_thresh': 8.031397837649969, 'atr_min_pct': 0.012978490816834626, 'atr_max_pct': 0.04435345760075904, 'tp_mult': 2.7739441810945564, 'tsl_mult': 0.7761780696293645, 'strategy': 'mean_reversion', 'time_stop': 139, 'use_sma': False, 'use_atr': False, 'use_adx': True, 'use_ema': False, 'use_spike': True, 'rsi_required': False, 'edge_k': 1.9243082785435803, 'edge_cap': 0.14554439886875525, 'bull_strategy': 'breakout', 'bull_bb_std_mult': 3.417404650230914, 'bull_rsi_os': 39, 'bull_rsi_ob': 73, 'bull_adx_thresh': 22.392052826489074, 'bull_atr_min_pct': 0.0033002408992023895, 'bull_atr_max_pct': 0.06850553788462353, 'bull_tp_mult': 2.4284942880570646, 'bull_tsl_mult': 0.16065115649817047, 'bull_time_stop': 143, 'bull_use_sma': True, 'bull_use_ema': True, 'bull_use_atr': True, 'bull_use_adx': False, 'bull_use_spike': True, 'bull_rsi_required': False, 'bear_strategy': 'breakout', 'bear_bb_std_mult': 3.460812625786502, 'bear_rsi_os': 26, 'bear_rsi_ob': 79, 'bear_adx_thresh': 9.706427557780644, 'bear_atr_min_pct': 0.014668362381988086, 'bear_atr_max_pct': 0.031202102773278687, 'bear_tp_mult': 2.3965404826966785, 'bear_tsl_mult': 0.180697432301605, 'bear_time_stop': 288, 'bear_use_sma': True, 'bear_use_ema': False, 'bear_use_atr': False, 'bear_use_adx': True, 'bear_use_spike': False, 'bear_rsi_required': False, 'sideways_strategy': 'mean_reversion', 'sideways_bb_std_mult': 3.231037218755353, 'sideways_rsi_os': 38, 'sideways_rsi_ob': 84, 'sideways_adx_thresh': 15.03396618992189, 'sideways_atr_min_pct': 0.0044272877898731125, 'sideways_atr_max_pct': 0.013065396998525377, 'sideways_tp_mult': 1.9523917810864257, 'sideways_tsl_mult': 0.3152513771649139, 'sideways_time_stop': 285, 'sideways_use_sma': False, 'sideways_use_ema': False, 'sideways_use_atr': False, 'sideways_use_adx': True, 'sideways_use_spike': True, 'sideways_rsi_required': False}.
[I 2025-08-31 10:29:59,742] Trial 312 finished with values: [-0.004582479766102154, 0.004954267333574714] and parameters: {'p_sma': 17, 'p_std': 33, 'p_atr': 19, 'p_adx': 7, 'rsi_period': 26, 'ema1': 19, 'ema2': 59, 'slip_atr_k': 0.0775363762351136, 'slip_spread_k': 0.30365503203470096, 'spread_hl_frac': 0.012089298718964959, 'bb_std_mult': 2.3730164279620403, 'rsi_os': 45, 'rsi_ob': 78, 'vol_spike': 0.21020165748533218, 'adx_thresh': 10.295070535634993, 'atr_min_pct': 0.021322313184919253, 'atr_max_pct': 0.04356462678933761, 'tp_mult': 2.1243713697481814, 'tsl_mult': 0.5792897426839823, 'strategy': 'mean_reversion', 'time_stop': 142, 'use_sma': False, 'use_atr': True, 'use_adx': True, 'use_ema': True, 'use_spike': True, 'rsi_required': False, 'edge_k': 1.7081805642673265, 'edge_cap': 0.1633145812079716, 'bull_strategy': 'breakout', 'bull_bb_std_mult': 3.441210627951493, 'bull_rsi_os': 37, 'bull_rsi_ob': 75, 'bull_adx_thresh': 16.950362438969904, 'bull_atr_min_pct': 0.003997670931947002, 'bull_atr_max_pct': 0.06774125114765932, 'bull_tp_mult': 1.4913088770297045, 'bull_tsl_mult': 0.11429143192404553, 'bull_time_stop': 14, 'bull_use_sma': False, 'bull_use_ema': True, 'bull_use_atr': False, 'bull_use_adx': False, 'bull_use_spike': True, 'bull_rsi_required': False, 'bear_strategy': 'breakout', 'bear_bb_std_mult': 3.1349318265585966, 'bear_rsi_os': 44, 'bear_rsi_ob': 93, 'bear_adx_thresh': 21.370550128064743, 'bear_atr_min_pct': 0.014607704798012308, 'bear_atr_max_pct': 0.10413376221494566, 'bear_tp_mult': 2.347978950808707, 'bear_tsl_mult': 0.17948190131240105, 'bear_time_stop': 281, 'bear_use_sma': True, 'bear_use_ema': False, 'bear_use_atr': False, 'bear_use_adx': True, 'bear_use_spike': False, 'bear_rsi_required': False, 'sideways_strategy': 'mean_reversion', 'sideways_bb_std_mult': 2.6966032044246773, 'sideways_rsi_os': 38, 'sideways_rsi_ob': 84, 'sideways_adx_thresh': 15.269085967852625, 'sideways_atr_min_pct': 0.0038426805145467344, 'sideways_atr_max_pct': 0.012825040125178953, 'sideways_tp_mult': 2.5593440944806303, 'sideways_tsl_mult': 0.8206680740801107, 'sideways_time_stop': 283, 'sideways_use_sma': False, 'sideways_use_ema': False, 'sideways_use_atr': True, 'sideways_use_adx': True, 'sideways_use_spike': True, 'sideways_rsi_required': False}.
[I 2025-08-31 10:29:59,905] Trial 313 finished with values: [-1000000000.0, 1000000000.0] and parameters: {'p_sma': 17, 'p_std': 37, 'p_atr': 18, 'p_adx': 30, 'rsi_period': 25, 'ema1': 22, 'ema2': 59, 'slip_atr_k': 0.030463824412523405, 'slip_spread_k': 0.29789227336154295, 'spread_hl_frac': 0.03555816378758468, 'bb_std_mult': 2.5651252637989717, 'rsi_os': 40, 'rsi_ob': 75, 'vol_spike': 0.14438376303462816, 'adx_thresh': 29.30173209530647, 'atr_min_pct': 0.020238555811036167, 'atr_max_pct': 0.04358671849117192, 'tp_mult': 1.4439349156962493, 'tsl_mult': 0.5895681501970019, 'strategy': 'mean_reversion', 'time_stop': 62, 'use_sma': False, 'use_atr': True, 'use_adx': True, 'use_ema': True, 'use_spike': True, 'rsi_required': True, 'edge_k': 1.6798941032607626, 'edge_cap': 0.16248890461854257, 'bull_strategy': 'breakout', 'bull_bb_std_mult': 1.9446232918935027, 'bull_rsi_os': 37, 'bull_rsi_ob': 87, 'bull_adx_thresh': 31.454801501593018, 'bull_atr_min_pct': 0.003898958049728182, 'bull_atr_max_pct': 0.06808362427232674, 'bull_tp_mult': 1.3307065271474823, 'bull_tsl_mult': 0.5469950789710367, 'bull_time_stop': 143, 'bull_use_sma': False, 'bull_use_ema': True, 'bull_use_atr': False, 'bull_use_adx': False, 'bull_use_spike': True, 'bull_rsi_required': False, 'bear_strategy': 'breakout', 'bear_bb_std_mult': 2.2000127345212186, 'bear_rsi_os': 26, 'bear_rsi_ob': 57, 'bear_adx_thresh': 26.955812837427636, 'bear_atr_min_pct': 0.01630182176749597, 'bear_atr_max_pct': 0.11558436125798599, 'bear_tp_mult': 1.6351889039976202, 'bear_tsl_mult': 0.2055254601973618, 'bear_time_stop': 38, 'bear_use_sma': True, 'bear_use_ema': False, 'bear_use_atr': False, 'bear_use_adx': True, 'bear_use_spike': False, 'bear_rsi_required': False, 'sideways_strategy': 'breakout', 'sideways_bb_std_mult': 2.6765597346389605, 'sideways_rsi_os': 33, 'sideways_rsi_ob': 80, 'sideways_adx_thresh': 13.817795528711759, 'sideways_atr_min_pct': 0.006117972823729636, 'sideways_atr_max_pct': 0.09089183099053452, 'sideways_tp_mult': 1.8610255021749893, 'sideways_tsl_mult': 0.8430364276655432, 'sideways_time_stop': 244, 'sideways_use_sma': False, 'sideways_use_ema': False, 'sideways_use_atr': True, 'sideways_use_adx': True, 'sideways_use_spike': True, 'sideways_rsi_required': False}.
[I 2025-08-31 10:30:00,635] Trial 314 finished with values: [-1000000000.0, 1000000000.0] and parameters: {'p_sma': 20, 'p_std': 56, 'p_atr': 23, 'p_adx': 7, 'rsi_period': 26, 'ema1': 21, 'ema2': 59, 'slip_atr_k': 0.007214250603883629, 'slip_spread_k': 0.29408803759225216, 'spread_hl_frac': 0.034608115782536975, 'bb_std_mult': 1.4857000096109594, 'rsi_os': 44, 'rsi_ob': 73, 'vol_spike': 0.1535836252371093, 'adx_thresh': 8.177419859860342, 'atr_min_pct': 0.0015854974626042448, 'atr_max_pct': 0.04332132803883798, 'tp_mult': 2.7121249880673832, 'tsl_mult': 0.57439128385926, 'strategy': 'mean_reversion', 'time_stop': 141, 'use_sma': False, 'use_atr': False, 'use_adx': True, 'use_ema': False, 'use_spike': True, 'rsi_required': True, 'edge_k': 1.702424167964013, 'edge_cap': 0.1474241025433354, 'bull_strategy': 'breakout', 'bull_bb_std_mult': 1.0033826562367212, 'bull_rsi_os': 37, 'bull_rsi_ob': 75, 'bull_adx_thresh': 11.326649494477815, 'bull_atr_min_pct': 0.003785790626496241, 'bull_atr_max_pct': 0.06828052516689903, 'bull_tp_mult': 1.1323437036340667, 'bull_tsl_mult': 0.8254690996698343, 'bull_time_stop': 29, 'bull_use_sma': True, 'bull_use_ema': True, 'bull_use_atr': True, 'bull_use_adx': False, 'bull_use_spike': True, 'bull_rsi_required': False, 'bear_strategy': 'mean_reversion', 'bear_bb_std_mult': 3.429220328946116, 'bear_rsi_os': 27, 'bear_rsi_ob': 57, 'bear_adx_thresh': 21.358232778863666, 'bear_atr_min_pct': 0.014576571130104733, 'bear_atr_max_pct': 0.10409289358732082, 'bear_tp_mult': 2.72375563281969, 'bear_tsl_mult': 0.20290675656786014, 'bear_time_stop': 95, 'bear_use_sma': True, 'bear_use_ema': False, 'bear_use_atr': False, 'bear_use_adx': True, 'bear_use_spike': False, 'bear_rsi_required': False, 'sideways_strategy': 'breakout', 'sideways_bb_std_mult': 2.690376805613775, 'sideways_rsi_os': 33, 'sideways_rsi_ob': 80, 'sideways_adx_thresh': 15.139505807472624, 'sideways_atr_min_pct': 0.024758295200386013, 'sideways_atr_max_pct': 0.10661430319869487, 'sideways_tp_mult': 1.8739085418559003, 'sideways_tsl_mult': 0.9384003743633236, 'sideways_time_stop': 236, 'sideways_use_sma': False, 'sideways_use_ema': False, 'sideways_use_atr': True, 'sideways_use_adx': True, 'sideways_use_spike': True, 'sideways_rsi_required': False}.
