[I 2025-08-31 10:33:50,996] Trial 342 finished with values: [-0.013511926365882054, 0.013805815076677755] and parameters: {'p_sma': 27, 'p_std': 24, 'p_atr': 17, 'p_adx': 19, 'rsi_period': 7, 'ema1': 30, 'ema2': 44, 'slip_atr_k': 0.07602867609826595, 'slip_spread_k': 0.20304948629375824, 'spread_hl_frac': 0.045342858311988386, 'bb_std_mult': 2.6042016838231365, 'rsi_os': 43, 'rsi_ob': 73, 'vol_spike': 0.21565736608611147, 'adx_thresh': 22.078327088275508, 'atr_min_pct': 0.0008196999559595772, 'atr_max_pct': 0.1077467479357441, 'tp_mult': 1.4021466831114113, 'tsl_mult': 0.5789506413099026, 'strategy': 'mean_reversion', 'time_stop': 26, 'use_sma': True, 'use_atr': True, 'use_adx': False, 'use_ema': True, 'use_spike': False, 'rsi_required': False, 'edge_k': 1.7644948826117748, 'edge_cap': 0.12813767423965833, 'bull_strategy': 'breakout', 'bull_bb_std_mult': 1.1098118055733575, 'bull_rsi_os': 42, 'bull_rsi_ob': 65, 'bull_adx_thresh': 9.582419730562656, 'bull_atr_min_pct': 0.005085224446862817, 'bull_atr_max_pct': 0.05276226849097482, 'bull_tp_mult': 1.1447395033134593, 'bull_tsl_mult': 0.3279839820997243, 'bull_time_stop': 118, 'bull_use_sma': False, 'bull_use_ema': False, 'bull_use_atr': False, 'bull_use_adx': True, 'bull_use_spike': False, 'bull_rsi_required': True, 'bear_strategy': 'breakout', 'bear_bb_std_mult': 2.0366945207869422, 'bear_rsi_os': 27, 'bear_rsi_ob': 74, 'bear_adx_thresh': 8.09388636254533, 'bear_atr_min_pct': 0.01684717928845638, 'bear_atr_max_pct': 0.0447457244663551, 'bear_tp_mult': 2.6511865940285446, 'bear_tsl_mult': 0.3140381514624516, 'bear_time_stop': 123, 'bear_use_sma': False, 'bear_use_ema': True, 'bear_use_atr': False, 'bear_use_adx': False, 'bear_use_spike': False, 'bear_rsi_required': True, 'sideways_strategy': 'mean_reversion', 'sideways_bb_std_mult': 2.719711039262732, 'sideways_rsi_os': 34, 'sideways_rsi_ob': 82, 'sideways_adx_thresh': 13.699831533229748, 'sideways_atr_min_pct': 0.0022285065748051855, 'sideways_atr_max_pct': 0.01365261410471545, 'sideways_tp_mult': 2.2894949505934408, 'sideways_tsl_mult': 0.28794509543493696, 'sideways_time_stop': 262, 'sideways_use_sma': True, 'sideways_use_ema': True, 'sideways_use_atr': False, 'sideways_use_adx': False, 'sideways_use_spike': False, 'sideways_rsi_required': True}.
[I 2025-08-31 10:33:51,112] Trial 345 finished with values: [-1000000000.0, 1000000000.0] and parameters: {'p_sma': 19, 'p_std': 36, 'p_atr': 16, 'p_adx': 10, 'rsi_period': 20, 'ema1': 10, 'ema2': 44, 'slip_atr_k': 0.2493789036816246, 'slip_spread_k': 0.02561825480777491, 'spread_hl_frac': 0.026616014531006555, 'bb_std_mult': 2.60835446399598, 'rsi_os': 39, 'rsi_ob': 73, 'vol_spike': 0.22353411120582115, 'adx_thresh': 28.22232243244409, 'atr_min_pct': 0.0009009847896134602, 'atr_max_pct': 0.04791576178712616, 'tp_mult': 1.7264042791375172, 'tsl_mult': 0.19095216365177176, 'strategy': 'mean_reversion', 'time_stop': 136, 'use_sma': False, 'use_atr': False, 'use_adx': True, 'use_ema': False, 'use_spike': True, 'rsi_required': True, 'edge_k': 1.769014584792969, 'edge_cap': 0.11410342801587857, 'bull_strategy': 'breakout', 'bull_bb_std_mult': 1.0893389983205777, 'bull_rsi_os': 41, 'bull_rsi_ob': 69, 'bull_adx_thresh': 7.746590730930684, 'bull_atr_min_pct': 0.006074150633760191, 'bull_atr_max_pct': 0.05229041095425281, 'bull_tp_mult': 1.1402761491034892, 'bull_tsl_mult': 0.4002470081934636, 'bull_time_stop': 27, 'bull_use_sma': True, 'bull_use_ema': False, 'bull_use_atr': True, 'bull_use_adx': False, 'bull_use_spike': True, 'bull_rsi_required': True, 'bear_strategy': 'breakout', 'bear_bb_std_mult': 2.0254182726413514, 'bear_rsi_os': 28, 'bear_rsi_ob': 87, 'bear_adx_thresh': 7.108459094683793, 'bear_atr_min_pct': 0.01805748150843067, 'bear_atr_max_pct': 0.05373763157950333, 'bear_tp_mult': 2.156869796895375, 'bear_tsl_mult': 0.1789806934386437, 'bear_time_stop': 220, 'bear_use_sma': True, 'bear_use_ema': False, 'bear_use_atr': False, 'bear_use_adx': True, 'bear_use_spike': True, 'bear_rsi_required': False, 'sideways_strategy': 'breakout', 'sideways_bb_std_mult': 2.529356699983104, 'sideways_rsi_os': 19, 'sideways_rsi_ob': 72, 'sideways_adx_thresh': 14.574166730724501, 'sideways_atr_min_pct': 0.005461445924249939, 'sideways_atr_max_pct': 0.12377133451763983, 'sideways_tp_mult': 1.2553460890941504, 'sideways_tsl_mult': 0.7458307694900608, 'sideways_time_stop': 43, 'sideways_use_sma': True, 'sideways_use_ema': False, 'sideways_use_atr': False, 'sideways_use_adx': True, 'sideways_use_spike': True, 'sideways_rsi_required': False}.
[I 2025-08-31 10:33:51,402] Trial 343 finished with values: [-1000000000.0, 1000000000.0] and parameters: {'p_sma': 19, 'p_std': 44, 'p_atr': 17, 'p_adx': 7, 'rsi_period': 83, 'ema1': 12, 'ema2': 50, 'slip_atr_k': 0.05698869621059586, 'slip_spread_k': 0.2239728373778601, 'spread_hl_frac': 0.033147612384860616, 'bb_std_mult': 2.6120196000211386, 'rsi_os': 39, 'rsi_ob': 75, 'vol_spike': 0.13752706731599723, 'adx_thresh': 16.308094846116745, 'atr_min_pct': 0.01941610912399945, 'atr_max_pct': 0.04809256643396809, 'tp_mult': 2.803140310948118, 'tsl_mult': 0.2092445339050082, 'strategy': 'mean_reversion', 'time_stop': 149, 'use_sma': True, 'use_atr': True, 'use_adx': True, 'use_ema': True, 'use_spike': True, 'rsi_required': True, 'edge_k': 1.7695775927154855, 'edge_cap': 0.11905243179600414, 'bull_strategy': 'mean_reversion', 'bull_bb_std_mult': 1.1026294777218977, 'bull_rsi_os': 42, 'bull_rsi_ob': 59, 'bull_adx_thresh': 24.14189748777133, 'bull_atr_min_pct': 0.023757994905279144, 'bull_atr_max_pct': 0.06798211501714453, 'bull_tp_mult': 1.1171566291765287, 'bull_tsl_mult': 0.05589403840358098, 'bull_time_stop': 24, 'bull_use_sma': False, 'bull_use_ema': False, 'bull_use_atr': False, 'bull_use_adx': True, 'bull_use_spike': True, 'bull_rsi_required': True, 'bear_strategy': 'breakout', 'bear_bb_std_mult': 3.124500121247091, 'bear_rsi_os': 23, 'bear_rsi_ob': 87, 'bear_adx_thresh': 8.008113668080037, 'bear_atr_min_pct': 0.018095347302653678, 'bear_atr_max_pct': 0.08776195569349128, 'bear_tp_mult': 1.8403609929248903, 'bear_tsl_mult': 0.1811547161569079, 'bear_time_stop': 220, 'bear_use_sma': False, 'bear_use_ema': False, 'bear_use_atr': True, 'bear_use_adx': False, 'bear_use_spike': True, 'bear_rsi_required': True, 'sideways_strategy': 'breakout', 'sideways_bb_std_mult': 2.743122440166358, 'sideways_rsi_os': 33, 'sideways_rsi_ob': 83, 'sideways_adx_thresh': 12.237739425616201, 'sideways_atr_min_pct': 0.020361100631312273, 'sideways_atr_max_pct': 0.04193463478933807, 'sideways_tp_mult': 1.3533155128995809, 'sideways_tsl_mult': 0.3558428495665452, 'sideways_time_stop': 274, 'sideways_use_sma': True, 'sideways_use_ema': True, 'sideways_use_atr': False, 'sideways_use_adx': False, 'sideways_use_spike': True, 'sideways_rsi_required': True}.
[I 2025-08-31 10:33:51,545] Trial 344 finished with values: [-1000000000.0, 1000000000.0] and parameters: {'p_sma': 35, 'p_std': 24, 'p_atr': 16, 'p_adx': 7, 'rsi_period': 20, 'ema1': 6, 'ema2': 44, 'slip_atr_k': 0.10370337408733463, 'slip_spread_k': 0.18011075439475666, 'spread_hl_frac': 0.02682092489500474, 'bb_std_mult': 1.6109155604287817, 'rsi_os': 43, 'rsi_ob': 75, 'vol_spike': 0.2044773569606917, 'adx_thresh': 9.40547584353368, 'atr_min_pct': 0.017494627010892667, 'atr_max_pct': 0.048329172478174275, 'tp_mult': 1.717333639782818, 'tsl_mult': 0.18411787405522606, 'strategy': 'mean_reversion', 'time_stop': 69, 'use_sma': False, 'use_atr': False, 'use_adx': True, 'use_ema': False, 'use_spike': True, 'rsi_required': True, 'edge_k': 1.3126186998203904, 'edge_cap': 0.11668585592760398, 'bull_strategy': 'breakout', 'bull_bb_std_mult': 1.0957280974943895, 'bull_rsi_os': 42, 'bull_rsi_ob': 48, 'bull_adx_thresh': 7.500798498035568, 'bull_atr_min_pct': 0.011279244033917429, 'bull_atr_max_pct': 0.0735199201238783, 'bull_tp_mult': 1.1331334758221183, 'bull_tsl_mult': 0.5909148076961538, 'bull_time_stop': 24, 'bull_use_sma': True, 'bull_use_ema': False, 'bull_use_atr': True, 'bull_use_adx': True, 'bull_use_spike': True, 'bull_rsi_required': True, 'bear_strategy': 'breakout', 'bear_bb_std_mult': 3.1331844298637934, 'bear_rsi_os': 27, 'bear_rsi_ob': 55, 'bear_adx_thresh': 10.323079452065453, 'bear_atr_min_pct': 0.006105240820598016, 'bear_atr_max_pct': 0.05297405805042844, 'bear_tp_mult': 2.751612818860456, 'bear_tsl_mult': 0.17645379444280615, 'bear_time_stop': 51, 'bear_use_sma': True, 'bear_use_ema': False, 'bear_use_atr': False, 'bear_use_adx': False, 'bear_use_spike': True, 'bear_rsi_required': True, 'sideways_strategy': 'breakout', 'sideways_bb_std_mult': 0.9973547797092153, 'sideways_rsi_os': 41, 'sideways_rsi_ob': 86, 'sideways_adx_thresh': 17.184835617783683, 'sideways_atr_min_pct': 0.020208955648706336, 'sideways_atr_max_pct': 0.01353545533388501, 'sideways_tp_mult': 1.3518753491515136, 'sideways_tsl_mult': 0.2786041126964087, 'sideways_time_stop': 262, 'sideways_use_sma': True, 'sideways_use_ema': False, 'sideways_use_atr': False, 'sideways_use_adx': True, 'sideways_use_spike': True, 'sideways_rsi_required': False}.
[I 2025-08-31 10:34:23,676] Trial 346 finished with values: [-1000000000.0, 1000000000.0] and parameters: {'p_sma': 35, 'p_std': 18, 'p_atr': 16, 'p_adx': 9, 'rsi_period': 20, 'ema1': 27, 'ema2': 48, 'slip_atr_k': 0.11097017484001179, 'slip_spread_k': 0.02745008161095719, 'spread_hl_frac': 0.027117705449568458, 'bb_std_mult': 2.5282563608995274, 'rsi_os': 39, 'rsi_ob': 75, 'vol_spike': 0.2234040043722823, 'adx_thresh': 25.02567499209585, 'atr_min_pct': 0.019581394565726155, 'atr_max_pct': 0.07743245239593607, 'tp_mult': 2.7958286212079377, 'tsl_mult': 0.6946390298048857, 'strategy': 'breakout', 'time_stop': 39, 'use_sma': False, 'use_atr': False, 'use_adx': True, 'use_ema': False, 'use_spike': True, 'rsi_required': True, 'edge_k': 1.6607479894304118, 'edge_cap': 0.16583567681734643, 'bull_strategy': 'breakout', 'bull_bb_std_mult': 0.9911400707511121, 'bull_rsi_os': 40, 'bull_rsi_ob': 73, 'bull_adx_thresh': 12.849045835326558, 'bull_atr_min_pct': 0.011188742475165877, 'bull_atr_max_pct': 0.07849660213607226, 'bull_tp_mult': 1.1330671900410203, 'bull_tsl_mult': 0.03445528252295976, 'bull_time_stop': 24, 'bull_use_sma': True, 'bull_use_ema': False, 'bull_use_atr': True, 'bull_use_adx': False, 'bull_use_spike': True, 'bull_rsi_required': True, 'bear_strategy': 'breakout', 'bear_bb_std_mult': 1.4470511068705743, 'bear_rsi_os': 40, 'bear_rsi_ob': 83, 'bear_adx_thresh': 10.172754432957166, 'bear_atr_min_pct': 0.017721202019442592, 'bear_atr_max_pct': 0.11075719101371731, 'bear_tp_mult': 1.837044119967139, 'bear_tsl_mult': 0.18107995819352632, 'bear_time_stop': 220, 'bear_use_sma': True, 'bear_use_ema': False, 'bear_use_atr': True, 'bear_use_adx': True, 'bear_use_spike': True, 'bear_rsi_required': False, 'sideways_strategy': 'breakout', 'sideways_bb_std_mult': 2.533660627568319, 'sideways_rsi_os': 32, 'sideways_rsi_ob': 86, 'sideways_adx_thresh': 14.714630628889134, 'sideways_atr_min_pct': 0.005369561187284844, 'sideways_atr_max_pct': 0.03339851179129076, 'sideways_tp_mult': 2.8258400425683474, 'sideways_tsl_mult': 0.8577802869887526, 'sideways_time_stop': 191, 'sideways_use_sma': True, 'sideways_use_ema': False, 'sideways_use_atr': False, 'sideways_use_adx': True, 'sideways_use_spike': True, 'sideways_rsi_required': False}.
[I 2025-08-31 10:34:23,987] Trial 347 finished with values: [-1000000000.0, 1000000000.0] and parameters: {'p_sma': 35, 'p_std': 31, 'p_atr': 14, 'p_adx': 9, 'rsi_period': 22, 'ema1': 26, 'ema2': 41, 'slip_atr_k': 0.10465747853225363, 'slip_spread_k': 0.06581071974744296, 'spread_hl_frac': 0.03788047765908512, 'bb_std_mult': 1.604664029831855, 'rsi_os': 8, 'rsi_ob': 53, 'vol_spike': 0.2053770284092209, 'adx_thresh': 24.997173277183492, 'atr_min_pct': 0.017860756771736465, 'atr_max_pct': 0.07569212088966647, 'tp_mult': 2.789629013930724, 'tsl_mult': 0.7923936576891122, 'strategy': 'breakout', 'time_stop': 53, 'use_sma': False, 'use_atr': False, 'use_adx': True, 'use_ema': False, 'use_spike': True, 'rsi_required': True, 'edge_k': 1.3099205946179515, 'edge_cap': 0.16281667453092347, 'bull_strategy': 'breakout', 'bull_bb_std_mult': 0.9818133946491622, 'bull_rsi_os': 40, 'bull_rsi_ob': 73, 'bull_adx_thresh': 27.582803395532785, 'bull_atr_min_pct': 0.00885531941051728, 'bull_atr_max_pct': 0.07535850769341192, 'bull_tp_mult': 2.5265032452645153, 'bull_tsl_mult': 0.7718915969867959, 'bull_time_stop': 12, 'bull_use_sma': True, 'bull_use_ema': True, 'bull_use_atr': True, 'bull_use_adx': True, 'bull_use_spike': True, 'bull_rsi_required': False, 'bear_strategy': 'mean_reversion', 'bear_bb_std_mult': 2.8243101306139438, 'bear_rsi_os': 17, 'bear_rsi_ob': 55, 'bear_adx_thresh': 20.986517998369635, 'bear_atr_min_pct': 0.0061060684326799015, 'bear_atr_max_pct': 0.08783061311641505, 'bear_tp_mult': 2.739241213962212, 'bear_tsl_mult': 0.823730128138529, 'bear_time_stop': 23, 'bear_use_sma': True, 'bear_use_ema': False, 'bear_use_atr': True, 'bear_use_adx': False, 'bear_use_spike': True, 'bear_rsi_required': True, 'sideways_strategy': 'breakout', 'sideways_bb_std_mult': 0.9996742952558275, 'sideways_rsi_os': 54, 'sideways_rsi_ob': 86, 'sideways_adx_thresh': 29.029035676897344, 'sideways_atr_min_pct': 0.02049423659595167, 'sideways_atr_max_pct': 0.012786548947985117, 'sideways_tp_mult': 1.5760366914879205, 'sideways_tsl_mult': 0.8559363863644718, 'sideways_time_stop': 271, 'sideways_use_sma': True, 'sideways_use_ema': False, 'sideways_use_atr': False, 'sideways_use_adx': True, 'sideways_use_spike': True, 'sideways_rsi_required': False}.
[I 2025-08-31 10:34:24,154] Trial 349 finished with values: [-1000000000.0, 1000000000.0] and parameters: {'p_sma': 16, 'p_std': 51, 'p_atr': 17, 'p_adx': 9, 'rsi_period': 22, 'ema1': 18, 'ema2': 60, 'slip_atr_k': 0.14449028843386832, 'slip_spread_k': 0.29157961584383185, 'spread_hl_frac': 0.027869084926478622, 'bb_std_mult': 2.5144330391417657, 'rsi_os': 40, 'rsi_ob': 75, 'vol_spike': 0.2546351038551596, 'adx_thresh': 11.193339932552618, 'atr_min_pct': 0.020181645154447203, 'atr_max_pct': 0.041200524638991265, 'tp_mult': 2.6870814252719435, 'tsl_mult': 0.781853746423868, 'strategy': 'breakout', 'time_stop': 41, 'use_sma': False, 'use_atr': False, 'use_adx': True, 'use_ema': False, 'use_spike': True, 'rsi_required': True, 'edge_k': 1.677404981599717, 'edge_cap': 0.16416735241162983, 'bull_strategy': 'breakout', 'bull_bb_std_mult': 0.9735529931247046, 'bull_rsi_os': 40, 'bull_rsi_ob': 73, 'bull_adx_thresh': 21.788474277241505, 'bull_atr_min_pct': 0.0037947343211485155, 'bull_atr_max_pct': 0.0785237144191753, 'bull_tp_mult': 1.2242909090313636, 'bull_tsl_mult': 0.7800313815411536, 'bull_time_stop': 260, 'bull_use_sma': True, 'bull_use_ema': True, 'bull_use_atr': True, 'bull_use_adx': False, 'bull_use_spike': True, 'bull_rsi_required': False, 'bear_strategy': 'mean_reversion', 'bear_bb_std_mult': 2.830047901345563, 'bear_rsi_os': 9, 'bear_rsi_ob': 63, 'bear_adx_thresh': 7.380293964178139, 'bear_atr_min_pct': 0.015207011255589438, 'bear_atr_max_pct': 0.1235610318700442, 'bear_tp_mult': 2.092507580512402, 'bear_tsl_mult': 0.13244624083185993, 'bear_time_stop': 233, 'bear_use_sma': False, 'bear_use_ema': False, 'bear_use_atr': True, 'bear_use_adx': True, 'bear_use_spike': True, 'bear_rsi_required': False, 'sideways_strategy': 'breakout', 'sideways_bb_std_mult': 2.6640786384635207, 'sideways_rsi_os': 36, 'sideways_rsi_ob': 79, 'sideways_adx_thresh': 29.10683201194997, 'sideways_atr_min_pct': 0.003450654142111573, 'sideways_atr_max_pct': 0.02126739626469701, 'sideways_tp_mult': 1.2196865214574029, 'sideways_tsl_mult': 0.8461927431656007, 'sideways_time_stop': 210, 'sideways_use_sma': True, 'sideways_use_ema': False, 'sideways_use_atr': False, 'sideways_use_adx': False, 'sideways_use_spike': True, 'sideways_rsi_required': False}.
[I 2025-08-31 10:34:24,341] Trial 348 finished with values: [-0.003665714956309407, 0.00725171562170084] and parameters: {'p_sma': 20, 'p_std': 49, 'p_atr': 13, 'p_adx': 8, 'rsi_period': 23, 'ema1': 6, 'ema2': 60, 'slip_atr_k': 0.0668899621692056, 'slip_spread_k': 0.2913609912327328, 'spread_hl_frac': 0.027059304507852294, 'bb_std_mult': 3.247300592303257, 'rsi_os': 40, 'rsi_ob': 75, 'vol_spike': 0.20542900573658265, 'adx_thresh': 11.068671117047906, 'atr_min_pct': 0.01793987248882912, 'atr_max_pct': 0.036639868835126994, 'tp_mult': 1.2782921327341152, 'tsl_mult': 0.7988045036479664, 'strategy': 'breakout', 'time_stop': 127, 'use_sma': False, 'use_atr': False, 'use_adx': True, 'use_ema': False, 'use_spike': True, 'rsi_required': True, 'edge_k': 1.671198006294115, 'edge_cap': 0.16470543338029955, 'bull_strategy': 'breakout', 'bull_bb_std_mult': 1.0013466771225041, 'bull_rsi_os': 40, 'bull_rsi_ob': 73, 'bull_adx_thresh': 21.268712487620792, 'bull_atr_min_pct': 0.018198925810797656, 'bull_atr_max_pct': 0.09351104967093561, 'bull_tp_mult': 1.2385698828670422, 'bull_tsl_mult': 0.7676767925405032, 'bull_time_stop': 14, 'bull_use_sma': True, 'bull_use_ema': True, 'bull_use_atr': True, 'bull_use_adx': True, 'bull_use_spike': True, 'bull_rsi_required': False, 'bear_strategy': 'mean_reversion', 'bear_bb_std_mult': 1.9779069272153398, 'bear_rsi_os': 30, 'bear_rsi_ob': 55, 'bear_adx_thresh': 7.272703185782007, 'bear_atr_min_pct': 0.005101160236073985, 'bear_atr_max_pct': 0.12311796269879417, 'bear_tp_mult': 1.7820112136349533, 'bear_tsl_mult': 0.44766312916387907, 'bear_time_stop': 48, 'bear_use_sma': True, 'bear_use_ema': False, 'bear_use_atr': True, 'bear_use_adx': False, 'bear_use_spike': True, 'bear_rsi_required': True, 'sideways_strategy': 'breakout', 'sideways_bb_std_mult': 2.5641139056434863, 'sideways_rsi_os': 26, 'sideways_rsi_ob': 77, 'sideways_adx_thresh': 34.91143989239163, 'sideways_atr_min_pct': 0.003312053198925336, 'sideways_atr_max_pct': 0.012716530807559408, 'sideways_tp_mult': 1.2197939164029148, 'sideways_tsl_mult': 0.8521668204638043, 'sideways_time_stop': 190, 'sideways_use_sma': True, 'sideways_use_ema': False, 'sideways_use_atr': False, 'sideways_use_adx': True, 'sideways_use_spike': True, 'sideways_rsi_required': False}.
[I 2025-08-31 10:34:24,918] Trial 351 finished with values: [-1000000000.0, 1000000000.0] and parameters: {'p_sma': 16, 'p_std': 21, 'p_atr': 25, 'p_adx': 8, 'rsi_period': 64, 'ema1': 16, 'ema2': 60, 'slip_atr_k': 0.22611804385698536, 'slip_spread_k': 0.6032805808733915, 'spread_hl_frac': 0.02451509958014038, 'bb_std_mult': 1.372024704177353, 'rsi_os': 41, 'rsi_ob': 76, 'vol_spike': 0.21123481821953144, 'adx_thresh': 27.292880396238743, 'atr_min_pct': 0.024056469709334057, 'atr_max_pct': 0.016986649741120435, 'tp_mult': 2.918575109476312, 'tsl_mult': 0.752248636654073, 'strategy': 'mean_reversion', 'time_stop': 125, 'use_sma': False, 'use_atr': False, 'use_adx': True, 'use_ema': False, 'use_spike': True, 'rsi_required': True, 'edge_k': 0.36911184430422916, 'edge_cap': 0.19101578649101966, 'bull_strategy': 'breakout', 'bull_bb_std_mult': 0.8415802139545469, 'bull_rsi_os': 41, 'bull_rsi_ob': 89, 'bull_adx_thresh': 21.471726580708307, 'bull_atr_min_pct': 0.02997489622347864, 'bull_atr_max_pct': 0.060993040007555156, 'bull_tp_mult': 2.269718140266257, 'bull_tsl_mult': 0.1341239154302858, 'bull_time_stop': 14, 'bull_use_sma': True, 'bull_use_ema': True, 'bull_use_atr': True, 'bull_use_adx': True, 'bull_use_spike': True, 'bull_rsi_required': False, 'bear_strategy': 'mean_reversion', 'bear_bb_std_mult': 1.544995935252841, 'bear_rsi_os': 14, 'bear_rsi_ob': 70, 'bear_adx_thresh': 8.951738868029738, 'bear_atr_min_pct': 0.012720654023813461, 'bear_atr_max_pct': 0.12270687678154721, 'bear_tp_mult': 1.7881948062502258, 'bear_tsl_mult': 0.48548780015430215, 'bear_time_stop': 31, 'bear_use_sma': False, 'bear_use_ema': False, 'bear_use_atr': True, 'bear_use_adx': False, 'bear_use_spike': True, 'bear_rsi_required': True, 'sideways_strategy': 'breakout', 'sideways_bb_std_mult': 2.576354299069098, 'sideways_rsi_os': 28, 'sideways_rsi_ob': 84, 'sideways_adx_thresh': 25.15299762228944, 'sideways_atr_min_pct': 0.00329514707899903, 'sideways_atr_max_pct': 0.05827245711804667, 'sideways_tp_mult': 1.2294080834556538, 'sideways_tsl_mult': 0.8978282842583885, 'sideways_time_stop': 199, 'sideways_use_sma': False, 'sideways_use_ema': False, 'sideways_use_atr': True, 'sideways_use_adx': False, 'sideways_use_spike': True, 'sideways_rsi_required': False}.
