[I 2025-08-31 10:17:00,278] Trial 197 finished with values: [-1000000000.0, 1000000000.0] and parameters: {'p_sma': 19, 'p_std': 33, 'p_atr': 19, 'p_adx': 7, 'rsi_period': 28, 'ema1': 12, 'ema2': 59, 'slip_atr_k': 0.07011143100803174, 'slip_spread_k': 0.29934546809059726, 'spread_hl_frac': 0.028968261546438345, 'bb_std_mult': 2.581451415950335, 'rsi_os': 41, 'rsi_ob': 77, 'vol_spike': 0.21152528663497092, 'adx_thresh': 9.625301342425034, 'atr_min_pct': 0.022852749993151452, 'atr_max_pct': 0.03565752488583272, 'tp_mult': 2.95167346993174, 'tsl_mult': 0.6645982281394238, 'strategy': 'mean_reversion', 'time_stop': 156, 'use_sma': False, 'use_atr': False, 'use_adx': False, 'use_ema': False, 'use_spike': True, 'rsi_required': True, 'edge_k': 1.695128557630635, 'edge_cap': 0.14039471407878973, 'bull_strategy': 'breakout', 'bull_bb_std_mult': 1.0174994537457935, 'bull_rsi_os': 41, 'bull_rsi_ob': 77, 'bull_adx_thresh': 9.811281143005289, 'bull_atr_min_pct': 0.00810517292520308, 'bull_atr_max_pct': 0.11176869258800978, 'bull_tp_mult': 1.2522021315709513, 'bull_tsl_mult': 0.1597685015794968, 'bull_time_stop': 25, 'bull_use_sma': True, 'bull_use_ema': True, 'bull_use_atr': True, 'bull_use_adx': True, 'bull_use_spike': True, 'bull_rsi_required': False, 'bear_strategy': 'breakout', 'bear_bb_std_mult': 2.174158994727747, 'bear_rsi_os': 29, 'bear_rsi_ob': 63, 'bear_adx_thresh': 9.187939150299748, 'bear_atr_min_pct': 0.015063286763181732, 'bear_atr_max_pct': 0.11841639748569356, 'bear_tp_mult': 2.7062929201743295, 'bear_tsl_mult': 0.14458889229178434, 'bear_time_stop': 40, 'bear_use_sma': False, 'bear_use_ema': True, 'bear_use_atr': True, 'bear_use_adx': True, 'bear_use_spike': True, 'bear_rsi_required': True, 'sideways_strategy': 'breakout', 'sideways_bb_std_mult': 2.663513860852519, 'sideways_rsi_os': 35, 'sideways_rsi_ob': 84, 'sideways_adx_thresh': 14.856924385438937, 'sideways_atr_min_pct': 0.0031495023661387233, 'sideways_atr_max_pct': 0.012413926611546913, 'sideways_tp_mult': 1.2918920139382473, 'sideways_tsl_mult': 0.8626559668099263, 'sideways_time_stop': 265, 'sideways_use_sma': True, 'sideways_use_ema': False, 'sideways_use_atr': False, 'sideways_use_adx': False, 'sideways_use_spike': True, 'sideways_rsi_required': False}.
[I 2025-08-31 10:17:00,692] Trial 198 finished with values: [-1000000000.0, 1000000000.0] and parameters: {'p_sma': 31, 'p_std': 34, 'p_atr': 20, 'p_adx': 7, 'rsi_period': 27, 'ema1': 11, 'ema2': 59, 'slip_atr_k': 0.06811042223969917, 'slip_spread_k': 0.3137680327297797, 'spread_hl_frac': 0.028333951324706758, 'bb_std_mult': 2.5985005509385286, 'rsi_os': 43, 'rsi_ob': 75, 'vol_spike': 0.21252733199869067, 'adx_thresh': 10.466986691262543, 'atr_min_pct': 0.01940034850463058, 'atr_max_pct': 0.04255549851543979, 'tp_mult': 2.9220337873010567, 'tsl_mult': 0.6123030316071285, 'strategy': 'mean_reversion', 'time_stop': 156, 'use_sma': False, 'use_atr': False, 'use_adx': False, 'use_ema': False, 'use_spike': True, 'rsi_required': True, 'edge_k': 1.6020769431426019, 'edge_cap': 0.13408716337917567, 'bull_strategy': 'breakout', 'bull_bb_std_mult': 1.0867051430025438, 'bull_rsi_os': 41, 'bull_rsi_ob': 77, 'bull_adx_thresh': 9.984557718568665, 'bull_atr_min_pct': 0.004096285159453171, 'bull_atr_max_pct': 0.06541975049163093, 'bull_tp_mult': 1.2423383208946719, 'bull_tsl_mult': 0.13232737453631277, 'bull_time_stop': 169, 'bull_use_sma': True, 'bull_use_ema': True, 'bull_use_atr': True, 'bull_use_adx': True, 'bull_use_spike': True, 'bull_rsi_required': False, 'bear_strategy': 'breakout', 'bear_bb_std_mult': 2.258375631404743, 'bear_rsi_os': 28, 'bear_rsi_ob': 60, 'bear_adx_thresh': 11.280464273889853, 'bear_atr_min_pct': 0.016985990647343754, 'bear_atr_max_pct': 0.1185385974406389, 'bear_tp_mult': 2.7225997719759434, 'bear_tsl_mult': 0.14778233497665685, 'bear_time_stop': 36, 'bear_use_sma': False, 'bear_use_ema': True, 'bear_use_atr': True, 'bear_use_adx': True, 'bear_use_spike': True, 'bear_rsi_required': True, 'sideways_strategy': 'breakout', 'sideways_bb_std_mult': 2.693121737455404, 'sideways_rsi_os': 34, 'sideways_rsi_ob': 81, 'sideways_adx_thresh': 14.110024165296357, 'sideways_atr_min_pct': 0.0034320382928061527, 'sideways_atr_max_pct': 0.013417045888745842, 'sideways_tp_mult': 1.301418015497229, 'sideways_tsl_mult': 0.8544044841693299, 'sideways_time_stop': 271, 'sideways_use_sma': True, 'sideways_use_ema': False, 'sideways_use_atr': False, 'sideways_use_adx': False, 'sideways_use_spike': True, 'sideways_rsi_required': False}.
[I 2025-08-31 10:17:00,828] Trial 200 finished with values: [-1000000000.0, 1000000000.0] and parameters: {'p_sma': 17, 'p_std': 32, 'p_atr': 18, 'p_adx': 8, 'rsi_period': 27, 'ema1': 11, 'ema2': 56, 'slip_atr_k': 0.06660278222929829, 'slip_spread_k': 0.3469838310949508, 'spread_hl_frac': 0.02383677497202035, 'bb_std_mult': 2.916961981365014, 'rsi_os': 43, 'rsi_ob': 75, 'vol_spike': 0.21119872086272962, 'adx_thresh': 10.630030145707435, 'atr_min_pct': 0.019200973854320187, 'atr_max_pct': 0.04260145490109831, 'tp_mult': 2.8904289170229625, 'tsl_mult': 0.59759280931937, 'strategy': 'mean_reversion', 'time_stop': 143, 'use_sma': False, 'use_atr': True, 'use_adx': False, 'use_ema': True, 'use_spike': True, 'rsi_required': True, 'edge_k': 1.6205242344366397, 'edge_cap': 0.17859396445634118, 'bull_strategy': 'breakout', 'bull_bb_std_mult': 1.2008327081495582, 'bull_rsi_os': 42, 'bull_rsi_ob': 79, 'bull_adx_thresh': 8.368375549611864, 'bull_atr_min_pct': 0.004970308236976424, 'bull_atr_max_pct': 0.06460677920840208, 'bull_tp_mult': 1.2428702333298118, 'bull_tsl_mult': 0.13272828165066214, 'bull_time_stop': 29, 'bull_use_sma': True, 'bull_use_ema': True, 'bull_use_atr': True, 'bull_use_adx': True, 'bull_use_spike': True, 'bull_rsi_required': False, 'bear_strategy': 'breakout', 'bear_bb_std_mult': 2.1838739975491865, 'bear_rsi_os': 29, 'bear_rsi_ob': 60, 'bear_adx_thresh': 9.312538868473045, 'bear_atr_min_pct': 0.019709165193535882, 'bear_atr_max_pct': 0.11854726167019008, 'bear_tp_mult': 2.735262751590882, 'bear_tsl_mult': 0.11927677612306326, 'bear_time_stop': 230, 'bear_use_sma': False, 'bear_use_ema': True, 'bear_use_atr': True, 'bear_use_adx': True, 'bear_use_spike': True, 'bear_rsi_required': True, 'sideways_strategy': 'breakout', 'sideways_bb_std_mult': 2.61624302756053, 'sideways_rsi_os': 36, 'sideways_rsi_ob': 81, 'sideways_adx_thresh': 31.89118924754191, 'sideways_atr_min_pct': 0.005770062479827683, 'sideways_atr_max_pct': 0.01041175154856631, 'sideways_tp_mult': 1.2679834911768915, 'sideways_tsl_mult': 0.8539348841328523, 'sideways_time_stop': 281, 'sideways_use_sma': True, 'sideways_use_ema': False, 'sideways_use_atr': False, 'sideways_use_adx': False, 'sideways_use_spike': True, 'sideways_rsi_required': False}.
[I 2025-08-31 10:17:33,187] Trial 204 finished with values: [-1000000000.0, 1000000000.0] and parameters: {'p_sma': 22, 'p_std': 33, 'p_atr': 18, 'p_adx': 8, 'rsi_period': 24, 'ema1': 14, 'ema2': 57, 'slip_atr_k': 0.052592600515840006, 'slip_spread_k': 0.3102796306941351, 'spread_hl_frac': 0.026393758809050597, 'bb_std_mult': 2.161429927475287, 'rsi_os': 40, 'rsi_ob': 77, 'vol_spike': 0.20405023540077288, 'adx_thresh': 28.772251246830876, 'atr_min_pct': 0.018781462213223823, 'atr_max_pct': 0.04015657300573576, 'tp_mult': 2.8229173721442367, 'tsl_mult': 0.632992913798221, 'strategy': 'mean_reversion', 'time_stop': 141, 'use_sma': False, 'use_atr': False, 'use_adx': True, 'use_ema': False, 'use_spike': True, 'rsi_required': True, 'edge_k': 1.0850110575793892, 'edge_cap': 0.05354187834606175, 'bull_strategy': 'breakout', 'bull_bb_std_mult': 1.1502748499212654, 'bull_rsi_os': 44, 'bull_rsi_ob': 75, 'bull_adx_thresh': 10.699069802250174, 'bull_atr_min_pct': 0.02888701564451595, 'bull_atr_max_pct': 0.06730024528675325, 'bull_tp_mult': 1.18440781618104, 'bull_tsl_mult': 0.10560101723570028, 'bull_time_stop': 212, 'bull_use_sma': True, 'bull_use_ema': True, 'bull_use_atr': True, 'bull_use_adx': True, 'bull_use_spike': True, 'bull_rsi_required': False, 'bear_strategy': 'breakout', 'bear_bb_std_mult': 2.2003913933323074, 'bear_rsi_os': 27, 'bear_rsi_ob': 58, 'bear_adx_thresh': 6.3986517011804445, 'bear_atr_min_pct': 0.014100734027861847, 'bear_atr_max_pct': 0.10137017774272976, 'bear_tp_mult': 2.672923909822528, 'bear_tsl_mult': 0.10975709069962808, 'bear_time_stop': 205, 'bear_use_sma': False, 'bear_use_ema': False, 'bear_use_atr': False, 'bear_use_adx': False, 'bear_use_spike': True, 'bear_rsi_required': True, 'sideways_strategy': 'breakout', 'sideways_bb_std_mult': 2.430958206827858, 'sideways_rsi_os': 32, 'sideways_rsi_ob': 86, 'sideways_adx_thresh': 5.974982679452715, 'sideways_atr_min_pct': 0.0006976327458316882, 'sideways_atr_max_pct': 0.01606045996392603, 'sideways_tp_mult': 2.560406184596628, 'sideways_tsl_mult': 0.7808678330686492, 'sideways_time_stop': 239, 'sideways_use_sma': True, 'sideways_use_ema': False, 'sideways_use_atr': False, 'sideways_use_adx': False, 'sideways_use_spike': True, 'sideways_rsi_required': False}.
[I 2025-08-31 10:17:33,480] Trial 202 finished with values: [-1000000000.0, 1000000000.0] and parameters: {'p_sma': 17, 'p_std': 33, 'p_atr': 18, 'p_adx': 8, 'rsi_period': 27, 'ema1': 11, 'ema2': 56, 'slip_atr_k': 0.024790983333608088, 'slip_spread_k': 0.317985946974486, 'spread_hl_frac': 0.024140095600898692, 'bb_std_mult': 2.763032567283068, 'rsi_os': 38, 'rsi_ob': 75, 'vol_spike': 0.18326180995685004, 'adx_thresh': 28.370591456862066, 'atr_min_pct': 0.019423433152701015, 'atr_max_pct': 0.042629365165829415, 'tp_mult': 2.8834521975242056, 'tsl_mult': 0.6129396229213612, 'strategy': 'mean_reversion', 'time_stop': 141, 'use_sma': False, 'use_atr': True, 'use_adx': True, 'use_ema': True, 'use_spike': True, 'rsi_required': True, 'edge_k': 1.612007443776692, 'edge_cap': 0.11897938002772193, 'bull_strategy': 'breakout', 'bull_bb_std_mult': 2.2644670879119984, 'bull_rsi_os': 45, 'bull_rsi_ob': 84, 'bull_adx_thresh': 8.286083104450082, 'bull_atr_min_pct': 0.005554723363088955, 'bull_atr_max_pct': 0.0677698858691824, 'bull_tp_mult': 1.2310211215925824, 'bull_tsl_mult': 0.10624553466853079, 'bull_time_stop': 167, 'bull_use_sma': True, 'bull_use_ema': True, 'bull_use_atr': True, 'bull_use_adx': True, 'bull_use_spike': True, 'bull_rsi_required': False, 'bear_strategy': 'breakout', 'bear_bb_std_mult': 2.229816295997229, 'bear_rsi_os': 25, 'bear_rsi_ob': 59, 'bear_adx_thresh': 11.466237663557521, 'bear_atr_min_pct': 0.013945671307221977, 'bear_atr_max_pct': 0.09186211638059105, 'bear_tp_mult': 2.664293081053791, 'bear_tsl_mult': 0.12863228481414019, 'bear_time_stop': 236, 'bear_use_sma': False, 'bear_use_ema': False, 'bear_use_atr': False, 'bear_use_adx': False, 'bear_use_spike': True, 'bear_rsi_required': True, 'sideways_strategy': 'breakout', 'sideways_bb_std_mult': 2.8181604361785886, 'sideways_rsi_os': 31, 'sideways_rsi_ob': 81, 'sideways_adx_thresh': 14.218473963181648, 'sideways_atr_min_pct': 0.005648235027387606, 'sideways_atr_max_pct': 0.015567900968276139, 'sideways_tp_mult': 1.798074936957473, 'sideways_tsl_mult': 0.2651243185518173, 'sideways_time_stop': 284, 'sideways_use_sma': True, 'sideways_use_ema': False, 'sideways_use_atr': False, 'sideways_use_adx': False, 'sideways_use_spike': True, 'sideways_rsi_required': False}.
[I 2025-08-31 10:17:33,491] Trial 203 finished with values: [-1000000000.0, 1000000000.0] and parameters: {'p_sma': 17, 'p_std': 31, 'p_atr': 18, 'p_adx': 8, 'rsi_period': 24, 'ema1': 14, 'ema2': 56, 'slip_atr_k': 0.024159133258842364, 'slip_spread_k': 0.3300177212875831, 'spread_hl_frac': 0.02404871133752216, 'bb_std_mult': 2.1665771229952178, 'rsi_os': 38, 'rsi_ob': 77, 'vol_spike': 0.1173088650310141, 'adx_thresh': 9.516525762917045, 'atr_min_pct': 0.01831868942609843, 'atr_max_pct': 0.04248701372787795, 'tp_mult': 2.8784765162111614, 'tsl_mult': 0.5999349748847694, 'strategy': 'mean_reversion', 'time_stop': 140, 'use_sma': False, 'use_atr': True, 'use_adx': True, 'use_ema': True, 'use_spike': True, 'rsi_required': True, 'edge_k': 0.1093058310447994, 'edge_cap': 0.09535926620190305, 'bull_strategy': 'breakout', 'bull_bb_std_mult': 1.2017743118111694, 'bull_rsi_os': 44, 'bull_rsi_ob': 84, 'bull_adx_thresh': 10.67939635312286, 'bull_atr_min_pct': 0.028707107654567104, 'bull_atr_max_pct': 0.06819150949837757, 'bull_tp_mult': 2.3924056274156613, 'bull_tsl_mult': 0.10633794630685302, 'bull_time_stop': 192, 'bull_use_sma': True, 'bull_use_ema': True, 'bull_use_atr': True, 'bull_use_adx': True, 'bull_use_spike': True, 'bull_rsi_required': False, 'bear_strategy': 'breakout', 'bear_bb_std_mult': 2.1415054153453252, 'bear_rsi_os': 12, 'bear_rsi_ob': 58, 'bear_adx_thresh': 5.449208720524799, 'bear_atr_min_pct': 0.014171946884450398, 'bear_atr_max_pct': 0.08680617739992537, 'bear_tp_mult': 2.6572802502673643, 'bear_tsl_mult': 0.12427976790784621, 'bear_time_stop': 229, 'bear_use_sma': False, 'bear_use_ema': False, 'bear_use_atr': False, 'bear_use_adx': False, 'bear_use_spike': True, 'bear_rsi_required': True, 'sideways_strategy': 'breakout', 'sideways_bb_std_mult': 2.8097998853240744, 'sideways_rsi_os': 32, 'sideways_rsi_ob': 87, 'sideways_adx_thresh': 24.71670453420534, 'sideways_atr_min_pct': 0.0005512203448048143, 'sideways_atr_max_pct': 0.010032188371331942, 'sideways_tp_mult': 1.3717081407063911, 'sideways_tsl_mult': 0.26365530995874803, 'sideways_time_stop': 287, 'sideways_use_sma': True, 'sideways_use_ema': False, 'sideways_use_atr': False, 'sideways_use_adx': False, 'sideways_use_spike': True, 'sideways_rsi_required': False}.
[I 2025-08-31 10:17:33,673] Trial 201 finished with values: [-1000000000.0, 1000000000.0] and parameters: {'p_sma': 17, 'p_std': 32, 'p_atr': 18, 'p_adx': 8, 'rsi_period': 71, 'ema1': 11, 'ema2': 55, 'slip_atr_k': 0.020939532053538157, 'slip_spread_k': 0.3233645400475372, 'spread_hl_frac': 0.02580107969902641, 'bb_std_mult': 2.162170118960672, 'rsi_os': 11, 'rsi_ob': 75, 'vol_spike': 0.183282733007887, 'adx_thresh': 8.952069518908965, 'atr_min_pct': 0.018417710460721666, 'atr_max_pct': 0.04361569678934479, 'tp_mult': 2.8896424174923276, 'tsl_mult': 0.596983861456215, 'strategy': 'mean_reversion', 'time_stop': 142, 'use_sma': False, 'use_atr': True, 'use_adx': True, 'use_ema': True, 'use_spike': True, 'rsi_required': True, 'edge_k': 0.11803781125623614, 'edge_cap': 0.11276667203730634, 'bull_strategy': 'breakout', 'bull_bb_std_mult': 2.229283633978495, 'bull_rsi_os': 45, 'bull_rsi_ob': 75, 'bull_adx_thresh': 8.405789938844826, 'bull_atr_min_pct': 0.004703976985343771, 'bull_atr_max_pct': 0.04528747360542706, 'bull_tp_mult': 1.1970583263599113, 'bull_tsl_mult': 0.10782314721544874, 'bull_time_stop': 28, 'bull_use_sma': True, 'bull_use_ema': True, 'bull_use_atr': True, 'bull_use_adx': True, 'bull_use_spike': True, 'bull_rsi_required': False, 'bear_strategy': 'breakout', 'bear_bb_std_mult': 2.2355966724354848, 'bear_rsi_os': 25, 'bear_rsi_ob': 58, 'bear_adx_thresh': 11.493048367938137, 'bear_atr_min_pct': 0.016989721280613292, 'bear_atr_max_pct': 0.10319586982166817, 'bear_tp_mult': 2.6729222099176635, 'bear_tsl_mult': 0.12059401895217754, 'bear_time_stop': 224, 'bear_use_sma': False, 'bear_use_ema': False, 'bear_use_atr': False, 'bear_use_adx': False, 'bear_use_spike': True, 'bear_rsi_required': True, 'sideways_strategy': 'breakout', 'sideways_bb_std_mult': 2.8464722584635958, 'sideways_rsi_os': 31, 'sideways_rsi_ob': 87, 'sideways_adx_thresh': 34.892587115184625, 'sideways_atr_min_pct': 0.00583182199588784, 'sideways_atr_max_pct': 0.010729850048657216, 'sideways_tp_mult': 1.3226919817637073, 'sideways_tsl_mult': 0.7806868623677887, 'sideways_time_stop': 289, 'sideways_use_sma': True, 'sideways_use_ema': False, 'sideways_use_atr': False, 'sideways_use_adx': False, 'sideways_use_spike': True, 'sideways_rsi_required': False}.
[I 2025-08-31 10:18:05,817] Trial 205 finished with values: [-1000000000.0, 1000000000.0] and parameters: {'p_sma': 33, 'p_std': 31, 'p_atr': 18, 'p_adx': 8, 'rsi_period': 80, 'ema1': 12, 'ema2': 54, 'slip_atr_k': 0.02448556020547816, 'slip_spread_k': 0.2757706012911914, 'spread_hl_frac': 0.02697123906866367, 'bb_std_mult': 2.738373929327241, 'rsi_os': 38, 'rsi_ob': 75, 'vol_spike': 0.044237259680262916, 'adx_thresh': 8.590180401432235, 'atr_min_pct': 0.018171945017204694, 'atr_max_pct': 0.04062907922595495, 'tp_mult': 2.8546247811987877, 'tsl_mult': 0.1970121885360796, 'strategy': 'mean_reversion', 'time_stop': 149, 'use_sma': False, 'use_atr': True, 'use_adx': True, 'use_ema': True, 'use_spike': True, 'rsi_required': True, 'edge_k': 1.7202966521759546, 'edge_cap': 0.073964313338782, 'bull_strategy': 'breakout', 'bull_bb_std_mult': 0.9470238389700306, 'bull_rsi_os': 46, 'bull_rsi_ob': 60, 'bull_adx_thresh': 34.055530036986355, 'bull_atr_min_pct': 0.0045296087573611366, 'bull_atr_max_pct': 0.12134238996000957, 'bull_tp_mult': 1.221501140838589, 'bull_tsl_mult': 0.10288530023686747, 'bull_time_stop': 10, 'bull_use_sma': False, 'bull_use_ema': True, 'bull_use_atr': True, 'bull_use_adx': True, 'bull_use_spike': True, 'bull_rsi_required': False, 'bear_strategy': 'breakout', 'bear_bb_std_mult': 2.107717937370444, 'bear_rsi_os': 25, 'bear_rsi_ob': 58, 'bear_adx_thresh': 5.446025793773289, 'bear_atr_min_pct': 0.022245811113196245, 'bear_atr_max_pct': 0.12650411359555458, 'bear_tp_mult': 2.65736623514704, 'bear_tsl_mult': 0.1733583318922039, 'bear_time_stop': 241, 'bear_use_sma': False, 'bear_use_ema': False, 'bear_use_atr': True, 'bear_use_adx': False, 'bear_use_spike': True, 'bear_rsi_required': True, 'sideways_strategy': 'breakout', 'sideways_bb_std_mult': 2.8198748025168503, 'sideways_rsi_os': 29, 'sideways_rsi_ob': 89, 'sideways_adx_thresh': 8.596998279955093, 'sideways_atr_min_pct': 0.005263497455036958, 'sideways_atr_max_pct': 0.01022875154833482, 'sideways_tp_mult': 1.2175531921060456, 'sideways_tsl_mult': 0.10582442507783396, 'sideways_time_stop': 289, 'sideways_use_sma': True, 'sideways_use_ema': False, 'sideways_use_atr': False, 'sideways_use_adx': False, 'sideways_use_spike': True, 'sideways_rsi_required': False}.
[I 2025-08-31 10:18:05,824] Trial 207 finished with values: [-1000000000.0, 1000000000.0] and parameters: {'p_sma': 20, 'p_std': 32, 'p_atr': 18, 'p_adx': 8, 'rsi_period': 77, 'ema1': 12, 'ema2': 53, 'slip_atr_k': 0.0778533058304581, 'slip_spread_k': 0.2797125020421855, 'spread_hl_frac': 0.0190009664534024, 'bb_std_mult': 2.074955338680121, 'rsi_os': 40, 'rsi_ob': 76, 'vol_spike': 0.10389315598034986, 'adx_thresh': 9.043965756646136, 'atr_min_pct': 0.02042923667054947, 'atr_max_pct': 0.03239262272434566, 'tp_mult': 2.810323789861102, 'tsl_mult': 0.6670346472708187, 'strategy': 'mean_reversion', 'time_stop': 149, 'use_sma': False, 'use_atr': False, 'use_adx': True, 'use_ema': False, 'use_spike': True, 'rsi_required': True, 'edge_k': 1.7163039244651714, 'edge_cap': 0.215904514244958, 'bull_strategy': 'breakout', 'bull_bb_std_mult': 0.9804224273167232, 'bull_rsi_os': 54, 'bull_rsi_ob': 74, 'bull_adx_thresh': 9.261933284046911, 'bull_atr_min_pct': 0.003489528920503277, 'bull_atr_max_pct': 0.07562485259528547, 'bull_tp_mult': 1.3038083965705112, 'bull_tsl_mult': 0.09446055580388385, 'bull_time_stop': 9, 'bull_use_sma': False, 'bull_use_ema': True, 'bull_use_atr': True, 'bull_use_adx': True, 'bull_use_spike': True, 'bull_rsi_required': False, 'bear_strategy': 'breakout', 'bear_bb_std_mult': 2.1142604757391923, 'bear_rsi_os': 30, 'bear_rsi_ob': 75, 'bear_adx_thresh': 7.124895247210567, 'bear_atr_min_pct': 0.017376486365545916, 'bear_atr_max_pct': 0.12120166026766467, 'bear_tp_mult': 2.632553064069138, 'bear_tsl_mult': 0.16513750816218173, 'bear_time_stop': 42, 'bear_use_sma': False, 'bear_use_ema': False, 'bear_use_atr': True, 'bear_use_adx': False, 'bear_use_spike': True, 'bear_rsi_required': True, 'sideways_strategy': 'breakout', 'sideways_bb_std_mult': 2.4523849620578995, 'sideways_rsi_os': 39, 'sideways_rsi_ob': 79, 'sideways_adx_thresh': 15.474516109022968, 'sideways_atr_min_pct': 0.004907931191777843, 'sideways_atr_max_pct': 0.14385280920699675, 'sideways_tp_mult': 2.8917950639760237, 'sideways_tsl_mult': 0.8095556841242657, 'sideways_time_stop': 253, 'sideways_use_sma': True, 'sideways_use_ema': False, 'sideways_use_atr': True, 'sideways_use_adx': False, 'sideways_use_spike': True, 'sideways_rsi_required': False}.
