[I 2025-08-31 11:37:07,427] Trial 817 finished with values: [-1000000000.0, 1000000000.0] and parameters: {'p_sma': 39, 'p_std': 11, 'p_atr': 27, 'p_adx': 12, 'rsi_period': 28, 'ema1': 5, 'ema2': 40, 'slip_atr_k': 0.1005355853321982, 'slip_spread_k': 0.4436225762558752, 'spread_hl_frac': 0.002534916589588078, 'bb_std_mult': 0.5511801203866651, 'rsi_os': 38, 'rsi_ob': 68, 'vol_spike': 0.25107664377876493, 'adx_thresh': 9.456039692537848, 'atr_min_pct': 0.021795430762605986, 'atr_max_pct': 0.07110261487313438, 'tp_mult': 1.5558295735299925, 'tsl_mult': 0.03885466334607179, 'strategy': 'breakout', 'time_stop': 96, 'use_sma': True, 'use_atr': True, 'use_adx': False, 'use_ema': True, 'use_spike': False, 'rsi_required': False, 'edge_k': 1.5428536705849125, 'edge_cap': 0.7290875872446716, 'bull_strategy': 'mean_reversion', 'bull_bb_std_mult': 3.122398220386854, 'bull_rsi_os': 44, 'bull_rsi_ob': 63, 'bull_adx_thresh': 26.916845324805873, 'bull_atr_min_pct': 0.012636471052602398, 'bull_atr_max_pct': 0.04216509970449513, 'bull_tp_mult': 2.579671465834677, 'bull_tsl_mult': 0.7076291101088457, 'bull_time_stop': 224, 'bull_use_sma': False, 'bull_use_ema': True, 'bull_use_atr': False, 'bull_use_adx': True, 'bull_use_spike': False, 'bull_rsi_required': True, 'bear_strategy': 'mean_reversion', 'bear_bb_std_mult': 1.5010484196002754, 'bear_rsi_os': 49, 'bear_rsi_ob': 52, 'bear_adx_thresh': 10.601668004307559, 'bear_atr_min_pct': 0.02172128515932644, 'bear_atr_max_pct': 0.13894753628863207, 'bear_tp_mult': 2.661660617613469, 'bear_tsl_mult': 0.9226845189076096, 'bear_time_stop': 95, 'bear_use_sma': False, 'bear_use_ema': True, 'bear_use_atr': False, 'bear_use_adx': False, 'bear_use_spike': False, 'bear_rsi_required': False, 'sideways_strategy': 'mean_reversion', 'sideways_bb_std_mult': 3.051882918635222, 'sideways_rsi_os': 15, 'sideways_rsi_ob': 62, 'sideways_adx_thresh': 26.837701329344885, 'sideways_atr_min_pct': 0.008786135611763285, 'sideways_atr_max_pct': 0.10398649026262294, 'sideways_tp_mult': 1.4254467297423137, 'sideways_tsl_mult': 0.19652376950316985, 'sideways_time_stop': 154, 'sideways_use_sma': True, 'sideways_use_ema': True, 'sideways_use_atr': False, 'sideways_use_adx': False, 'sideways_use_spike': False, 'sideways_rsi_required': True}.
[I 2025-08-31 11:37:07,525] Trial 819 finished with values: [-1000000000.0, 1000000000.0] and parameters: {'p_sma': 42, 'p_std': 17, 'p_atr': 26, 'p_adx': 20, 'rsi_period': 35, 'ema1': 24, 'ema2': 15, 'slip_atr_k': 0.008391083639805952, 'slip_spread_k': 0.49234562208416416, 'spread_hl_frac': 0.02253427698284429, 'bb_std_mult': 1.0238946782701204, 'rsi_os': 31, 'rsi_ob': 68, 'vol_spike': 0.07953800422059648, 'adx_thresh': 28.58940420522274, 'atr_min_pct': 0.022319121269981854, 'atr_max_pct': 0.05505575982032131, 'tp_mult': 2.9647763827594917, 'tsl_mult': 0.09838235668130095, 'strategy': 'breakout', 'time_stop': 75, 'use_sma': True, 'use_atr': True, 'use_adx': False, 'use_ema': True, 'use_spike': False, 'rsi_required': False, 'edge_k': 0.801448133562252, 'edge_cap': 0.7241942948927279, 'bull_strategy': 'mean_reversion', 'bull_bb_std_mult': 2.806980592462954, 'bull_rsi_os': 44, 'bull_rsi_ob': 82, 'bull_adx_thresh': 14.301385561807795, 'bull_atr_min_pct': 0.012974921403884088, 'bull_atr_max_pct': 0.10736706397814874, 'bull_tp_mult': 2.9401311528825245, 'bull_tsl_mult': 0.6822017322787279, 'bull_time_stop': 115, 'bull_use_sma': False, 'bull_use_ema': True, 'bull_use_atr': True, 'bull_use_adx': False, 'bull_use_spike': False, 'bull_rsi_required': True, 'bear_strategy': 'mean_reversion', 'bear_bb_std_mult': 2.465111817050388, 'bear_rsi_os': 41, 'bear_rsi_ob': 54, 'bear_adx_thresh': 27.71042295067859, 'bear_atr_min_pct': 0.0018775484881851812, 'bear_atr_max_pct': 0.13448164181539599, 'bear_tp_mult': 2.166295953204197, 'bear_tsl_mult': 0.9276323621768892, 'bear_time_stop': 89, 'bear_use_sma': False, 'bear_use_ema': True, 'bear_use_atr': False, 'bear_use_adx': True, 'bear_use_spike': False, 'bear_rsi_required': False, 'sideways_strategy': 'mean_reversion', 'sideways_bb_std_mult': 0.9048906373547461, 'sideways_rsi_os': 52, 'sideways_rsi_ob': 62, 'sideways_adx_thresh': 31.21142444334719, 'sideways_atr_min_pct': 0.005645572216788476, 'sideways_atr_max_pct': 0.10662830245948197, 'sideways_tp_mult': 1.655352349189847, 'sideways_tsl_mult': 0.8502992870841032, 'sideways_time_stop': 87, 'sideways_use_sma': True, 'sideways_use_ema': True, 'sideways_use_atr': False, 'sideways_use_adx': False, 'sideways_use_spike': False, 'sideways_rsi_required': True}.
[I 2025-08-31 11:37:44,615] Trial 824 finished with values: [-1000000000.0, 1000000000.0] and parameters: {'p_sma': 48, 'p_std': 14, 'p_atr': 30, 'p_adx': 17, 'rsi_period': 67, 'ema1': 5, 'ema2': 30, 'slip_atr_k': 0.09030877222714792, 'slip_spread_k': 0.40310411980268135, 'spread_hl_frac': 0.01686599685385405, 'bb_std_mult': 0.7812308865169997, 'rsi_os': 5, 'rsi_ob': 95, 'vol_spike': 0.10340870699900032, 'adx_thresh': 12.12116491539957, 'atr_min_pct': 0.021238062095152447, 'atr_max_pct': 0.06570569043895934, 'tp_mult': 1.0489972083043537, 'tsl_mult': 0.145717748576998, 'strategy': 'breakout', 'time_stop': 83, 'use_sma': True, 'use_atr': True, 'use_adx': False, 'use_ema': True, 'use_spike': True, 'rsi_required': False, 'edge_k': 1.481291672959157, 'edge_cap': 0.6942558749270408, 'bull_strategy': 'mean_reversion', 'bull_bb_std_mult': 1.795290325484674, 'bull_rsi_os': 42, 'bull_rsi_ob': 51, 'bull_adx_thresh': 27.541117816941526, 'bull_atr_min_pct': 0.007018263166038307, 'bull_atr_max_pct': 0.13338607153416066, 'bull_tp_mult': 2.7835612858724774, 'bull_tsl_mult': 0.24232987754656457, 'bull_time_stop': 45, 'bull_use_sma': True, 'bull_use_ema': False, 'bull_use_atr': False, 'bull_use_adx': True, 'bull_use_spike': False, 'bull_rsi_required': False, 'bear_strategy': 'mean_reversion', 'bear_bb_std_mult': 1.7043476898806438, 'bear_rsi_os': 51, 'bear_rsi_ob': 53, 'bear_adx_thresh': 12.07059405774337, 'bear_atr_min_pct': 0.006381819527921677, 'bear_atr_max_pct': 0.09147563108878326, 'bear_tp_mult': 2.7231382015474157, 'bear_tsl_mult': 0.23627647108040073, 'bear_time_stop': 82, 'bear_use_sma': False, 'bear_use_ema': False, 'bear_use_atr': True, 'bear_use_adx': False, 'bear_use_spike': True, 'bear_rsi_required': False, 'sideways_strategy': 'mean_reversion', 'sideways_bb_std_mult': 2.0657359501675923, 'sideways_rsi_os': 25, 'sideways_rsi_ob': 63, 'sideways_adx_thresh': 9.336879874832656, 'sideways_atr_min_pct': 0.023787039114619712, 'sideways_atr_max_pct': 0.0949847512144505, 'sideways_tp_mult': 1.519523678609439, 'sideways_tsl_mult': 0.04837109948109086, 'sideways_time_stop': 240, 'sideways_use_sma': True, 'sideways_use_ema': True, 'sideways_use_atr': False, 'sideways_use_adx': False, 'sideways_use_spike': True, 'sideways_rsi_required': False}.
[I 2025-08-31 11:37:45,333] Trial 823 finished with values: [-1000000000.0, 1000000000.0] and parameters: {'p_sma': 26, 'p_std': 13, 'p_atr': 28, 'p_adx': 19, 'rsi_period': 34, 'ema1': 5, 'ema2': 11, 'slip_atr_k': 0.036190649668796884, 'slip_spread_k': 0.3993871987588497, 'spread_hl_frac': 0.00983937357907214, 'bb_std_mult': 0.7088568544990185, 'rsi_os': 14, 'rsi_ob': 61, 'vol_spike': 0.18877873235017237, 'adx_thresh': 12.03567426775691, 'atr_min_pct': 0.02030794975935952, 'atr_max_pct': 0.08637008294945434, 'tp_mult': 2.9948678660601136, 'tsl_mult': 0.9213587761278161, 'strategy': 'breakout', 'time_stop': 60, 'use_sma': True, 'use_atr': True, 'use_adx': False, 'use_ema': True, 'use_spike': True, 'rsi_required': False, 'edge_k': 1.4813567871364686, 'edge_cap': 0.843068980294761, 'bull_strategy': 'mean_reversion', 'bull_bb_std_mult': 1.4600132971655557, 'bull_rsi_os': 55, 'bull_rsi_ob': 58, 'bull_adx_thresh': 21.8855102644895, 'bull_atr_min_pct': 0.006943455532655169, 'bull_atr_max_pct': 0.034403296625816135, 'bull_tp_mult': 2.771213481453349, 'bull_tsl_mult': 0.24440829432250682, 'bull_time_stop': 58, 'bull_use_sma': True, 'bull_use_ema': False, 'bull_use_atr': False, 'bull_use_adx': True, 'bull_use_spike': False, 'bull_rsi_required': False, 'bear_strategy': 'mean_reversion', 'bear_bb_std_mult': 1.3218732460946003, 'bear_rsi_os': 36, 'bear_rsi_ob': 53, 'bear_adx_thresh': 15.965389486390016, 'bear_atr_min_pct': 0.012842389544780172, 'bear_atr_max_pct': 0.08850234740889847, 'bear_tp_mult': 1.4137698523315958, 'bear_tsl_mult': 0.9051281173308542, 'bear_time_stop': 101, 'bear_use_sma': False, 'bear_use_ema': False, 'bear_use_atr': True, 'bear_use_adx': False, 'bear_use_spike': True, 'bear_rsi_required': False, 'sideways_strategy': 'mean_reversion', 'sideways_bb_std_mult': 0.9701560380046761, 'sideways_rsi_os': 42, 'sideways_rsi_ob': 63, 'sideways_adx_thresh': 25.431262428628564, 'sideways_atr_min_pct': 0.02842526123650048, 'sideways_atr_max_pct': 0.08643469308938449, 'sideways_tp_mult': 1.515223579082782, 'sideways_tsl_mult': 0.7396860929571494, 'sideways_time_stop': 236, 'sideways_use_sma': True, 'sideways_use_ema': True, 'sideways_use_atr': False, 'sideways_use_adx': False, 'sideways_use_spike': True, 'sideways_rsi_required': False}.
[I 2025-08-31 11:37:45,702] Trial 821 finished with values: [-1000000000.0, 1000000000.0] and parameters: {'p_sma': 48, 'p_std': 11, 'p_atr': 26, 'p_adx': 19, 'rsi_period': 37, 'ema1': 5, 'ema2': 39, 'slip_atr_k': 0.03639213447102778, 'slip_spread_k': 0.4717921473857932, 'spread_hl_frac': 0.019856146047796296, 'bb_std_mult': 0.7101063152817342, 'rsi_os': 10, 'rsi_ob': 86, 'vol_spike': 0.18943233997747286, 'adx_thresh': 9.530661550870128, 'atr_min_pct': 0.022239676311443992, 'atr_max_pct': 0.0651409704089058, 'tp_mult': 1.6781512684698214, 'tsl_mult': 0.09218279798168276, 'strategy': 'breakout', 'time_stop': 80, 'use_sma': True, 'use_atr': True, 'use_adx': False, 'use_ema': True, 'use_spike': False, 'rsi_required': False, 'edge_k': 1.477252926266042, 'edge_cap': 0.8599189702729313, 'bull_strategy': 'mean_reversion', 'bull_bb_std_mult': 1.347376778558501, 'bull_rsi_os': 44, 'bull_rsi_ob': 60, 'bull_adx_thresh': 24.47706032999781, 'bull_atr_min_pct': 0.020589181691451658, 'bull_atr_max_pct': 0.13298820722716653, 'bull_tp_mult': 2.796389840078215, 'bull_tsl_mult': 0.19769120159552878, 'bull_time_stop': 45, 'bull_use_sma': False, 'bull_use_ema': True, 'bull_use_atr': False, 'bull_use_adx': True, 'bull_use_spike': False, 'bull_rsi_required': False, 'bear_strategy': 'mean_reversion', 'bear_bb_std_mult': 1.866101206378201, 'bear_rsi_os': 44, 'bear_rsi_ob': 53, 'bear_adx_thresh': 10.538405482228649, 'bear_atr_min_pct': 0.007489277921492278, 'bear_atr_max_pct': 0.09131848485771209, 'bear_tp_mult': 2.7117268052802888, 'bear_tsl_mult': 0.9418838798484382, 'bear_time_stop': 85, 'bear_use_sma': False, 'bear_use_ema': False, 'bear_use_atr': False, 'bear_use_adx': False, 'bear_use_spike': True, 'bear_rsi_required': False, 'sideways_strategy': 'mean_reversion', 'sideways_bb_std_mult': 3.2498136611383197, 'sideways_rsi_os': 42, 'sideways_rsi_ob': 47, 'sideways_adx_thresh': 25.53123598857527, 'sideways_atr_min_pct': 0.00637035470014402, 'sideways_atr_max_pct': 0.1061944775280909, 'sideways_tp_mult': 1.755767539685602, 'sideways_tsl_mult': 0.8952659198578701, 'sideways_time_stop': 240, 'sideways_use_sma': True, 'sideways_use_ema': True, 'sideways_use_atr': False, 'sideways_use_adx': False, 'sideways_use_spike': True, 'sideways_rsi_required': False}.
[I 2025-08-31 11:37:45,904] Trial 822 finished with values: [-0.019474895904722733, 0.01986562334238101] and parameters: {'p_sma': 36, 'p_std': 11, 'p_atr': 26, 'p_adx': 17, 'rsi_period': 28, 'ema1': 5, 'ema2': 12, 'slip_atr_k': 0.03575359380636357, 'slip_spread_k': 0.39587622658219057, 'spread_hl_frac': 0.03934284405825599, 'bb_std_mult': 0.7066214466921044, 'rsi_os': 38, 'rsi_ob': 61, 'vol_spike': 0.10531326221187524, 'adx_thresh': 12.230849237009426, 'atr_min_pct': 0.022340798605267793, 'atr_max_pct': 0.060473045424094936, 'tp_mult': 1.6733786505672752, 'tsl_mult': 0.14278465226321202, 'strategy': 'breakout', 'time_stop': 83, 'use_sma': True, 'use_atr': True, 'use_adx': False, 'use_ema': True, 'use_spike': False, 'rsi_required': False, 'edge_k': 1.4701269786184037, 'edge_cap': 0.7269775316501043, 'bull_strategy': 'mean_reversion', 'bull_bb_std_mult': 1.3400833229108842, 'bull_rsi_os': 34, 'bull_rsi_ob': 84, 'bull_adx_thresh': 21.798952943706354, 'bull_atr_min_pct': 0.011940707073302671, 'bull_atr_max_pct': 0.05665564509756496, 'bull_tp_mult': 2.781309050876039, 'bull_tsl_mult': 0.6946278548595175, 'bull_time_stop': 47, 'bull_use_sma': False, 'bull_use_ema': True, 'bull_use_atr': False, 'bull_use_adx': True, 'bull_use_spike': False, 'bull_rsi_required': False, 'bear_strategy': 'mean_reversion', 'bear_bb_std_mult': 1.1869197138846832, 'bear_rsi_os': 49, 'bear_rsi_ob': 53, 'bear_adx_thresh': 28.675308628759417, 'bear_atr_min_pct': 0.0035389722292586082, 'bear_atr_max_pct': 0.059652625525660904, 'bear_tp_mult': 2.531730124208416, 'bear_tsl_mult': 0.002972453312182974, 'bear_time_stop': 91, 'bear_use_sma': False, 'bear_use_ema': False, 'bear_use_atr': True, 'bear_use_adx': False, 'bear_use_spike': True, 'bear_rsi_required': False, 'sideways_strategy': 'mean_reversion', 'sideways_bb_std_mult': 0.9023260642412952, 'sideways_rsi_os': 17, 'sideways_rsi_ob': 63, 'sideways_adx_thresh': 27.634374271425177, 'sideways_atr_min_pct': 0.0065637262790724325, 'sideways_atr_max_pct': 0.10575762184106687, 'sideways_tp_mult': 1.7538676581286747, 'sideways_tsl_mult': 0.9139123013074649, 'sideways_time_stop': 179, 'sideways_use_sma': True, 'sideways_use_ema': True, 'sideways_use_atr': False, 'sideways_use_adx': False, 'sideways_use_spike': True, 'sideways_rsi_required': False}.
[I 2025-08-31 11:38:22,567] Trial 825 finished with values: [-1000000000.0, 1000000000.0] and parameters: {'p_sma': 35, 'p_std': 14, 'p_atr': 28, 'p_adx': 19, 'rsi_period': 34, 'ema1': 5, 'ema2': 11, 'slip_atr_k': 0.029450822540980977, 'slip_spread_k': 0.6228262954982895, 'spread_hl_frac': 0.03892621630605417, 'bb_std_mult': 0.6926732426563026, 'rsi_os': 32, 'rsi_ob': 83, 'vol_spike': 0.12827065943170268, 'adx_thresh': 10.16361066504889, 'atr_min_pct': 0.02563533804891134, 'atr_max_pct': 0.06069391529831723, 'tp_mult': 2.994824941115327, 'tsl_mult': 0.06072042871433069, 'strategy': 'breakout', 'time_stop': 90, 'use_sma': True, 'use_atr': True, 'use_adx': False, 'use_ema': True, 'use_spike': False, 'rsi_required': False, 'edge_k': 1.0064387656140839, 'edge_cap': 0.844237789439032, 'bull_strategy': 'mean_reversion', 'bull_bb_std_mult': 2.0351756671787866, 'bull_rsi_os': 42, 'bull_rsi_ob': 58, 'bull_adx_thresh': 26.19316678014977, 'bull_atr_min_pct': 0.011579544107402362, 'bull_atr_max_pct': 0.1156214937095778, 'bull_tp_mult': 2.8756147036696804, 'bull_tsl_mult': 0.2232060450265041, 'bull_time_stop': 62, 'bull_use_sma': False, 'bull_use_ema': True, 'bull_use_atr': False, 'bull_use_adx': True, 'bull_use_spike': False, 'bull_rsi_required': False, 'bear_strategy': 'mean_reversion', 'bear_bb_std_mult': 1.4016919726207768, 'bear_rsi_os': 37, 'bear_rsi_ob': 56, 'bear_adx_thresh': 28.90547036505697, 'bear_atr_min_pct': 0.012979630165512372, 'bear_atr_max_pct': 0.059287441121093076, 'bear_tp_mult': 2.54720462057662, 'bear_tsl_mult': 0.5826413661260671, 'bear_time_stop': 280, 'bear_use_sma': False, 'bear_use_ema': False, 'bear_use_atr': True, 'bear_use_adx': False, 'bear_use_spike': True, 'bear_rsi_required': False, 'sideways_strategy': 'mean_reversion', 'sideways_bb_std_mult': 1.26884641195636, 'sideways_rsi_os': 16, 'sideways_rsi_ob': 60, 'sideways_adx_thresh': 24.44276755803456, 'sideways_atr_min_pct': 0.006253565016629422, 'sideways_atr_max_pct': 0.12264890712164242, 'sideways_tp_mult': 1.7633216847814213, 'sideways_tsl_mult': 0.7369154236912578, 'sideways_time_stop': 180, 'sideways_use_sma': True, 'sideways_use_ema': True, 'sideways_use_atr': False, 'sideways_use_adx': False, 'sideways_use_spike': True, 'sideways_rsi_required': False}.
[I 2025-08-31 11:38:23,126] Trial 828 finished with values: [-1000000000.0, 1000000000.0] and parameters: {'p_sma': 56, 'p_std': 13, 'p_atr': 28, 'p_adx': 18, 'rsi_period': 32, 'ema1': 19, 'ema2': 22, 'slip_atr_k': 0.02602341729741937, 'slip_spread_k': 0.6217930516071237, 'spread_hl_frac': 0.022139906155511656, 'bb_std_mult': 1.7871580271127574, 'rsi_os': 31, 'rsi_ob': 82, 'vol_spike': 0.2700263170466324, 'adx_thresh': 20.891770703964674, 'atr_min_pct': 0.01222093602024165, 'atr_max_pct': 0.06237658634949681, 'tp_mult': 2.949356348682657, 'tsl_mult': 0.06334373807052407, 'strategy': 'breakout', 'time_stop': 108, 'use_sma': True, 'use_atr': True, 'use_adx': False, 'use_ema': True, 'use_spike': False, 'rsi_required': False, 'edge_k': 1.4145709573203153, 'edge_cap': 0.48253909348041385, 'bull_strategy': 'mean_reversion', 'bull_bb_std_mult': 2.2129706044828596, 'bull_rsi_os': 42, 'bull_rsi_ob': 67, 'bull_adx_thresh': 32.29749263341477, 'bull_atr_min_pct': 0.011368021644083293, 'bull_atr_max_pct': 0.03765131321136081, 'bull_tp_mult': 2.87960396214888, 'bull_tsl_mult': 0.2219155727471455, 'bull_time_stop': 36, 'bull_use_sma': False, 'bull_use_ema': True, 'bull_use_atr': False, 'bull_use_adx': True, 'bull_use_spike': False, 'bull_rsi_required': False, 'bear_strategy': 'mean_reversion', 'bear_bb_std_mult': 2.9040032793366506, 'bear_rsi_os': 54, 'bear_rsi_ob': 56, 'bear_adx_thresh': 17.174875088525287, 'bear_atr_min_pct': 0.01976100081711357, 'bear_atr_max_pct': 0.0188129505799592, 'bear_tp_mult': 2.57862564192898, 'bear_tsl_mult': 0.380536065171011, 'bear_time_stop': 239, 'bear_use_sma': False, 'bear_use_ema': False, 'bear_use_atr': True, 'bear_use_adx': False, 'bear_use_spike': True, 'bear_rsi_required': False, 'sideways_strategy': 'mean_reversion', 'sideways_bb_std_mult': 0.8371126906800799, 'sideways_rsi_os': 40, 'sideways_rsi_ob': 60, 'sideways_adx_thresh': 18.610498556721144, 'sideways_atr_min_pct': 0.016421948721376495, 'sideways_atr_max_pct': 0.1266830309226574, 'sideways_tp_mult': 1.5728607614285959, 'sideways_tsl_mult': 0.8289219912456798, 'sideways_time_stop': 165, 'sideways_use_sma': True, 'sideways_use_ema': True, 'sideways_use_atr': False, 'sideways_use_adx': False, 'sideways_use_spike': True, 'sideways_rsi_required': False}.
[I 2025-08-31 11:38:23,274] Trial 827 finished with values: [-1000000000.0, 1000000000.0] and parameters: {'p_sma': 56, 'p_std': 12, 'p_atr': 28, 'p_adx': 22, 'rsi_period': 31, 'ema1': 7, 'ema2': 10, 'slip_atr_k': 0.028257854628203287, 'slip_spread_k': 0.4812860187274004, 'spread_hl_frac': 0.02179809170340534, 'bb_std_mult': 1.780056961978853, 'rsi_os': 51, 'rsi_ob': 83, 'vol_spike': 0.09607506131007293, 'adx_thresh': 10.29868955911779, 'atr_min_pct': 0.022829635098140285, 'atr_max_pct': 0.060392877610284404, 'tp_mult': 2.938589246311837, 'tsl_mult': 0.0028714947738859298, 'strategy': 'breakout', 'time_stop': 50, 'use_sma': True, 'use_atr': True, 'use_adx': False, 'use_ema': True, 'use_spike': False, 'rsi_required': False, 'edge_k': 1.5843919878706965, 'edge_cap': 0.9997662272557395, 'bull_strategy': 'mean_reversion', 'bull_bb_std_mult': 1.6079154344221052, 'bull_rsi_os': 42, 'bull_rsi_ob': 64, 'bull_adx_thresh': 26.068978380623832, 'bull_atr_min_pct': 0.011758482946611531, 'bull_atr_max_pct': 0.037401019585209694, 'bull_tp_mult': 2.4110841580629936, 'bull_tsl_mult': 0.22218446277154094, 'bull_time_stop': 37, 'bull_use_sma': False, 'bull_use_ema': True, 'bull_use_atr': False, 'bull_use_adx': True, 'bull_use_spike': False, 'bull_rsi_required': False, 'bear_strategy': 'mean_reversion', 'bear_bb_std_mult': 1.4058837851596921, 'bear_rsi_os': 14, 'bear_rsi_ob': 56, 'bear_adx_thresh': 9.68596402668255, 'bear_atr_min_pct': 0.019410423053281604, 'bear_atr_max_pct': 0.1459724109452731, 'bear_tp_mult': 2.033114689656479, 'bear_tsl_mult': 0.5823079934273842, 'bear_time_stop': 106, 'bear_use_sma': False, 'bear_use_ema': False, 'bear_use_atr': True, 'bear_use_adx': False, 'bear_use_spike': True, 'bear_rsi_required': False, 'sideways_strategy': 'mean_reversion', 'sideways_bb_std_mult': 1.5513417098622595, 'sideways_rsi_os': 40, 'sideways_rsi_ob': 60, 'sideways_adx_thresh': 25.900373214224565, 'sideways_atr_min_pct': 0.005038469307835885, 'sideways_atr_max_pct': 0.1264856154600317, 'sideways_tp_mult': 1.5752673098028163, 'sideways_tsl_mult': 0.8239098446148538, 'sideways_time_stop': 27, 'sideways_use_sma': True, 'sideways_use_ema': True, 'sideways_use_atr': False, 'sideways_use_adx': False, 'sideways_use_spike': True, 'sideways_rsi_required': False}.
