[I 2025-08-31 11:14:29,192] Trial 660 finished with values: [-1000000000.0, 1000000000.0] and parameters: {'p_sma': 34, 'p_std': 11, 'p_atr': 30, 'p_adx': 20, 'rsi_period': 75, 'ema1': 5, 'ema2': 25, 'slip_atr_k': 0.02700091464853381, 'slip_spread_k': 0.534345506331437, 'spread_hl_frac': 0.023326951733018943, 'bb_std_mult': 0.7933877583768949, 'rsi_os': 55, 'rsi_ob': 86, 'vol_spike': 0.0579622886427648, 'adx_thresh': 22.48664906379961, 'atr_min_pct': 0.00542281700546076, 'atr_max_pct': 0.059728187371375446, 'tp_mult': 1.1071630770314966, 'tsl_mult': 0.12546483507016531, 'strategy': 'breakout', 'time_stop': 72, 'use_sma': True, 'use_atr': True, 'use_adx': False, 'use_ema': True, 'use_spike': False, 'rsi_required': False, 'edge_k': 1.553148514645555, 'edge_cap': 0.7324310221762405, 'bull_strategy': 'mean_reversion', 'bull_bb_std_mult': 2.4040625901581056, 'bull_rsi_os': 33, 'bull_rsi_ob': 65, 'bull_adx_thresh': 26.21123508733433, 'bull_atr_min_pct': 0.012793706406008899, 'bull_atr_max_pct': 0.022109517930052176, 'bull_tp_mult': 2.9000016712939627, 'bull_tsl_mult': 0.19330375556012647, 'bull_time_stop': 44, 'bull_use_sma': False, 'bull_use_ema': True, 'bull_use_atr': False, 'bull_use_adx': True, 'bull_use_spike': False, 'bull_rsi_required': True, 'bear_strategy': 'mean_reversion', 'bear_bb_std_mult': 1.587328696598527, 'bear_rsi_os': 54, 'bear_rsi_ob': 91, 'bear_adx_thresh': 33.78046370697729, 'bear_atr_min_pct': 0.004340059111313122, 'bear_atr_max_pct': 0.14065377720362876, 'bear_tp_mult': 1.804474983942781, 'bear_tsl_mult': 0.8762295155773625, 'bear_time_stop': 115, 'bear_use_sma': False, 'bear_use_ema': True, 'bear_use_atr': True, 'bear_use_adx': False, 'bear_use_spike': False, 'bear_rsi_required': False, 'sideways_strategy': 'mean_reversion', 'sideways_bb_std_mult': 1.112176962916274, 'sideways_rsi_os': 40, 'sideways_rsi_ob': 45, 'sideways_adx_thresh': 25.917967116317435, 'sideways_atr_min_pct': 0.005819412385786089, 'sideways_atr_max_pct': 0.10006638866566712, 'sideways_tp_mult': 1.5911845042847392, 'sideways_tsl_mult': 0.8432582743398953, 'sideways_time_stop': 187, 'sideways_use_sma': True, 'sideways_use_ema': True, 'sideways_use_atr': True, 'sideways_use_adx': False, 'sideways_use_spike': False, 'sideways_rsi_required': True}.
[I 2025-08-31 11:14:29,629] Trial 659 finished with values: [-1000000000.0, 1000000000.0] and parameters: {'p_sma': 31, 'p_std': 11, 'p_atr': 27, 'p_adx': 17, 'rsi_period': 64, 'ema1': 5, 'ema2': 19, 'slip_atr_k': 0.02642780829021362, 'slip_spread_k': 0.5365652539451536, 'spread_hl_frac': 0.022870561362385917, 'bb_std_mult': 0.7922645770361523, 'rsi_os': 48, 'rsi_ob': 82, 'vol_spike': 0.05978167550166755, 'adx_thresh': 10.773240433478826, 'atr_min_pct': 0.02417984714101954, 'atr_max_pct': 0.055503175933560536, 'tp_mult': 2.928475661178252, 'tsl_mult': 0.13315713603262605, 'strategy': 'breakout', 'time_stop': 95, 'use_sma': True, 'use_atr': True, 'use_adx': False, 'use_ema': True, 'use_spike': False, 'rsi_required': False, 'edge_k': 1.5413892245607375, 'edge_cap': 0.6251862270570798, 'bull_strategy': 'mean_reversion', 'bull_bb_std_mult': 2.4171767045469523, 'bull_rsi_os': 33, 'bull_rsi_ob': 65, 'bull_adx_thresh': 26.17582444340239, 'bull_atr_min_pct': 0.011026639604755683, 'bull_atr_max_pct': 0.02043343461853018, 'bull_tp_mult': 2.916640834316143, 'bull_tsl_mult': 0.19327410878974216, 'bull_time_stop': 45, 'bull_use_sma': False, 'bull_use_ema': True, 'bull_use_atr': False, 'bull_use_adx': True, 'bull_use_spike': False, 'bull_rsi_required': True, 'bear_strategy': 'mean_reversion', 'bear_bb_std_mult': 1.561450836779835, 'bear_rsi_os': 54, 'bear_rsi_ob': 70, 'bear_adx_thresh': 11.29051792966695, 'bear_atr_min_pct': 0.019568285391762287, 'bear_atr_max_pct': 0.09521898195401739, 'bear_tp_mult': 2.469258434715798, 'bear_tsl_mult': 0.8833269057335952, 'bear_time_stop': 118, 'bear_use_sma': False, 'bear_use_ema': True, 'bear_use_atr': True, 'bear_use_adx': False, 'bear_use_spike': False, 'bear_rsi_required': False, 'sideways_strategy': 'mean_reversion', 'sideways_bb_std_mult': 1.0286257113165898, 'sideways_rsi_os': 39, 'sideways_rsi_ob': 49, 'sideways_adx_thresh': 25.032170707200788, 'sideways_atr_min_pct': 0.005990565948430525, 'sideways_atr_max_pct': 0.10104548759717324, 'sideways_tp_mult': 1.590420920803679, 'sideways_tsl_mult': 0.8408524264052548, 'sideways_time_stop': 187, 'sideways_use_sma': True, 'sideways_use_ema': True, 'sideways_use_atr': True, 'sideways_use_adx': False, 'sideways_use_spike': False, 'sideways_rsi_required': True}.
[I 2025-08-31 11:14:29,763] Trial 658 finished with values: [-1000000000.0, 1000000000.0] and parameters: {'p_sma': 35, 'p_std': 11, 'p_atr': 28, 'p_adx': 17, 'rsi_period': 76, 'ema1': 7, 'ema2': 10, 'slip_atr_k': 0.026581109272157198, 'slip_spread_k': 0.5240557997852884, 'spread_hl_frac': 0.022897404348580258, 'bb_std_mult': 0.7674532298143648, 'rsi_os': 26, 'rsi_ob': 82, 'vol_spike': 0.13913917222055378, 'adx_thresh': 14.365763781967269, 'atr_min_pct': 0.02170945844469188, 'atr_max_pct': 0.06169291533953195, 'tp_mult': 1.1058710584573803, 'tsl_mult': 0.06457250454021932, 'strategy': 'breakout', 'time_stop': 78, 'use_sma': True, 'use_atr': True, 'use_adx': False, 'use_ema': True, 'use_spike': False, 'rsi_required': False, 'edge_k': 1.3785688164130099, 'edge_cap': 0.7316018571374348, 'bull_strategy': 'mean_reversion', 'bull_bb_std_mult': 1.5314837501163405, 'bull_rsi_os': 11, 'bull_rsi_ob': 61, 'bull_adx_thresh': 26.358603487034056, 'bull_atr_min_pct': 0.014083701331069155, 'bull_atr_max_pct': 0.03207413315708442, 'bull_tp_mult': 2.8589659554253193, 'bull_tsl_mult': 0.3155077724854295, 'bull_time_stop': 46, 'bull_use_sma': False, 'bull_use_ema': True, 'bull_use_atr': False, 'bull_use_adx': True, 'bull_use_spike': False, 'bull_rsi_required': False, 'bear_strategy': 'mean_reversion', 'bear_bb_std_mult': 1.5914181173814632, 'bear_rsi_os': 55, 'bear_rsi_ob': 54, 'bear_adx_thresh': 10.867816356658379, 'bear_atr_min_pct': 0.01012419911374535, 'bear_atr_max_pct': 0.1412008616019551, 'bear_tp_mult': 1.809845654382554, 'bear_tsl_mult': 0.9039513374420056, 'bear_time_stop': 118, 'bear_use_sma': False, 'bear_use_ema': False, 'bear_use_atr': False, 'bear_use_adx': False, 'bear_use_spike': True, 'bear_rsi_required': False, 'sideways_strategy': 'mean_reversion', 'sideways_bb_std_mult': 1.1152572703501151, 'sideways_rsi_os': 42, 'sideways_rsi_ob': 64, 'sideways_adx_thresh': 26.078822870099376, 'sideways_atr_min_pct': 0.0050105716674337854, 'sideways_atr_max_pct': 0.10458044545466737, 'sideways_tp_mult': 2.7876523397209847, 'sideways_tsl_mult': 0.7207541686539716, 'sideways_time_stop': 189, 'sideways_use_sma': True, 'sideways_use_ema': True, 'sideways_use_atr': True, 'sideways_use_adx': False, 'sideways_use_spike': True, 'sideways_rsi_required': True}.
[I 2025-08-31 11:14:29,973] Trial 657 finished with values: [-1000000000.0, 1000000000.0] and parameters: {'p_sma': 34, 'p_std': 12, 'p_atr': 28, 'p_adx': 21, 'rsi_period': 76, 'ema1': 6, 'ema2': 25, 'slip_atr_k': 0.09239259456018543, 'slip_spread_k': 0.41471446595121164, 'spread_hl_frac': 0.020883034423390127, 'bb_std_mult': 0.7783252866451669, 'rsi_os': 55, 'rsi_ob': 86, 'vol_spike': 0.07808488380952003, 'adx_thresh': 10.836327654444121, 'atr_min_pct': 0.024237593626754678, 'atr_max_pct': 0.06015401571239756, 'tp_mult': 1.1070975338963875, 'tsl_mult': 0.17478499409717851, 'strategy': 'breakout', 'time_stop': 81, 'use_sma': True, 'use_atr': True, 'use_adx': False, 'use_ema': True, 'use_spike': False, 'rsi_required': False, 'edge_k': 1.5588985073110944, 'edge_cap': 0.7054069860321632, 'bull_strategy': 'mean_reversion', 'bull_bb_std_mult': 1.5657247012858257, 'bull_rsi_os': 41, 'bull_rsi_ob': 59, 'bull_adx_thresh': 28.33840441873809, 'bull_atr_min_pct': 0.014756500829245275, 'bull_atr_max_pct': 0.03280817058042043, 'bull_tp_mult': 2.862839467911139, 'bull_tsl_mult': 0.31402301420886536, 'bull_time_stop': 161, 'bull_use_sma': False, 'bull_use_ema': True, 'bull_use_atr': False, 'bull_use_adx': True, 'bull_use_spike': False, 'bull_rsi_required': False, 'bear_strategy': 'mean_reversion', 'bear_bb_std_mult': 1.599221967774962, 'bear_rsi_os': 52, 'bear_rsi_ob': 54, 'bear_adx_thresh': 11.208170522043297, 'bear_atr_min_pct': 0.02034468915809028, 'bear_atr_max_pct': 0.139899202793501, 'bear_tp_mult': 2.7520907861581025, 'bear_tsl_mult': 0.9057304265506152, 'bear_time_stop': 114, 'bear_use_sma': True, 'bear_use_ema': False, 'bear_use_atr': False, 'bear_use_adx': False, 'bear_use_spike': True, 'bear_rsi_required': False, 'sideways_strategy': 'mean_reversion', 'sideways_bb_std_mult': 1.112374036397901, 'sideways_rsi_os': 40, 'sideways_rsi_ob': 64, 'sideways_adx_thresh': 25.799881859525215, 'sideways_atr_min_pct': 0.0052572731312755085, 'sideways_atr_max_pct': 0.1053575400864893, 'sideways_tp_mult': 1.5894209356977156, 'sideways_tsl_mult': 0.8974859191237793, 'sideways_time_stop': 186, 'sideways_use_sma': True, 'sideways_use_ema': True, 'sideways_use_atr': True, 'sideways_use_adx': True, 'sideways_use_spike': True, 'sideways_rsi_required': True}.
[I 2025-08-31 11:15:03,572] Trial 664 finished with values: [-1000000000.0, 1000000000.0] and parameters: {'p_sma': 30, 'p_std': 16, 'p_atr': 27, 'p_adx': 13, 'rsi_period': 33, 'ema1': 6, 'ema2': 33, 'slip_atr_k': 0.18503571124610077, 'slip_spread_k': 0.47082870860174614, 'spread_hl_frac': 0.034474638366649296, 'bb_std_mult': 0.6718468518395108, 'rsi_os': 29, 'rsi_ob': 84, 'vol_spike': 0.035374081746859784, 'adx_thresh': 12.346554007690347, 'atr_min_pct': 0.020777334949028115, 'atr_max_pct': 0.05524202953635354, 'tp_mult': 2.575606178472434, 'tsl_mult': 0.08994376457815664, 'strategy': 'breakout', 'time_stop': 86, 'use_sma': True, 'use_atr': True, 'use_adx': False, 'use_ema': True, 'use_spike': False, 'rsi_required': False, 'edge_k': 1.421475025898905, 'edge_cap': 0.724299644311764, 'bull_strategy': 'mean_reversion', 'bull_bb_std_mult': 2.981912693812576, 'bull_rsi_os': 41, 'bull_rsi_ob': 64, 'bull_adx_thresh': 26.706585124470507, 'bull_atr_min_pct': 0.013402053027179442, 'bull_atr_max_pct': 0.03788039685064225, 'bull_tp_mult': 2.928067388268976, 'bull_tsl_mult': 0.24566108466508724, 'bull_time_stop': 40, 'bull_use_sma': False, 'bull_use_ema': False, 'bull_use_atr': False, 'bull_use_adx': True, 'bull_use_spike': False, 'bull_rsi_required': False, 'bear_strategy': 'mean_reversion', 'bear_bb_std_mult': 1.6997917757332193, 'bear_rsi_os': 50, 'bear_rsi_ob': 77, 'bear_adx_thresh': 9.125076005644278, 'bear_atr_min_pct': 0.012901042946872303, 'bear_atr_max_pct': 0.10766548124517351, 'bear_tp_mult': 2.636545939001094, 'bear_tsl_mult': 0.8529775356002423, 'bear_time_stop': 90, 'bear_use_sma': False, 'bear_use_ema': False, 'bear_use_atr': True, 'bear_use_adx': False, 'bear_use_spike': True, 'bear_rsi_required': False, 'sideways_strategy': 'mean_reversion', 'sideways_bb_std_mult': 0.9769807559071431, 'sideways_rsi_os': 39, 'sideways_rsi_ob': 71, 'sideways_adx_thresh': 26.94609798268684, 'sideways_atr_min_pct': 0.006290220113759406, 'sideways_atr_max_pct': 0.11230091079561015, 'sideways_tp_mult': 1.4210417333757044, 'sideways_tsl_mult': 0.22967956946886992, 'sideways_time_stop': 166, 'sideways_use_sma': True, 'sideways_use_ema': True, 'sideways_use_atr': False, 'sideways_use_adx': False, 'sideways_use_spike': True, 'sideways_rsi_required': False}.
[I 2025-08-31 11:15:03,573] Trial 663 finished with values: [-1000000000.0, 1000000000.0] and parameters: {'p_sma': 40, 'p_std': 13, 'p_atr': 27, 'p_adx': 13, 'rsi_period': 29, 'ema1': 6, 'ema2': 34, 'slip_atr_k': 0.020745667074356978, 'slip_spread_k': 0.45928175853563474, 'spread_hl_frac': 0.01746048797325369, 'bb_std_mult': 0.7044276071632019, 'rsi_os': 11, 'rsi_ob': 84, 'vol_spike': 0.041945589074278714, 'adx_thresh': 12.282998980849097, 'atr_min_pct': 0.02207827731217604, 'atr_max_pct': 0.056674406009119715, 'tp_mult': 2.876179208512118, 'tsl_mult': 0.08541213828150973, 'strategy': 'breakout', 'time_stop': 82, 'use_sma': True, 'use_atr': True, 'use_adx': False, 'use_ema': True, 'use_spike': False, 'rsi_required': False, 'edge_k': 1.4103035985882229, 'edge_cap': 0.7500002555103276, 'bull_strategy': 'mean_reversion', 'bull_bb_std_mult': 3.139422965067056, 'bull_rsi_os': 43, 'bull_rsi_ob': 59, 'bull_adx_thresh': 24.790173245235415, 'bull_atr_min_pct': 0.01336961933603782, 'bull_atr_max_pct': 0.03697211319810121, 'bull_tp_mult': 2.954571292532212, 'bull_tsl_mult': 0.2401697194039797, 'bull_time_stop': 258, 'bull_use_sma': False, 'bull_use_ema': False, 'bull_use_atr': False, 'bull_use_adx': True, 'bull_use_spike': False, 'bull_rsi_required': False, 'bear_strategy': 'mean_reversion', 'bear_bb_std_mult': 1.5216255410449602, 'bear_rsi_os': 53, 'bear_rsi_ob': 49, 'bear_adx_thresh': 30.395165405957407, 'bear_atr_min_pct': 0.012461784235079947, 'bear_atr_max_pct': 0.10193833877579606, 'bear_tp_mult': 2.616894161170383, 'bear_tsl_mult': 0.9246445930186047, 'bear_time_stop': 77, 'bear_use_sma': False, 'bear_use_ema': False, 'bear_use_atr': True, 'bear_use_adx': False, 'bear_use_spike': True, 'bear_rsi_required': False, 'sideways_strategy': 'mean_reversion', 'sideways_bb_std_mult': 0.9845971652190164, 'sideways_rsi_os': 39, 'sideways_rsi_ob': 61, 'sideways_adx_thresh': 29.450398567368037, 'sideways_atr_min_pct': 0.024110594139037947, 'sideways_atr_max_pct': 0.10193961437652065, 'sideways_tp_mult': 1.6233786824774323, 'sideways_tsl_mult': 0.9444785951197117, 'sideways_time_stop': 165, 'sideways_use_sma': True, 'sideways_use_ema': True, 'sideways_use_atr': False, 'sideways_use_adx': False, 'sideways_use_spike': True, 'sideways_rsi_required': False}.
[I 2025-08-31 11:15:03,881] Trial 662 finished with values: [-1000000000.0, 1000000000.0] and parameters: {'p_sma': 37, 'p_std': 13, 'p_atr': 28, 'p_adx': 13, 'rsi_period': 61, 'ema1': 6, 'ema2': 40, 'slip_atr_k': 0.01945412722468812, 'slip_spread_k': 0.46569622215870526, 'spread_hl_frac': 0.03454165957085788, 'bb_std_mult': 0.6976800338892133, 'rsi_os': 51, 'rsi_ob': 84, 'vol_spike': 0.11911853550753672, 'adx_thresh': 12.493780930797126, 'atr_min_pct': 0.014620139886960141, 'atr_max_pct': 0.056102684517271365, 'tp_mult': 2.886496483135812, 'tsl_mult': 0.08655340283474866, 'strategy': 'breakout', 'time_stop': 82, 'use_sma': True, 'use_atr': True, 'use_adx': False, 'use_ema': True, 'use_spike': False, 'rsi_required': False, 'edge_k': 1.3980942538708958, 'edge_cap': 0.7472750809926512, 'bull_strategy': 'mean_reversion', 'bull_bb_std_mult': 1.5261336412696243, 'bull_rsi_os': 41, 'bull_rsi_ob': 59, 'bull_adx_thresh': 26.975481491999528, 'bull_atr_min_pct': 0.013765261968295335, 'bull_atr_max_pct': 0.03809424299114343, 'bull_tp_mult': 2.9558611753371196, 'bull_tsl_mult': 0.24954867596187846, 'bull_time_stop': 54, 'bull_use_sma': False, 'bull_use_ema': False, 'bull_use_atr': False, 'bull_use_adx': True, 'bull_use_spike': False, 'bull_rsi_required': False, 'bear_strategy': 'mean_reversion', 'bear_bb_std_mult': 1.7003470178719786, 'bear_rsi_os': 53, 'bear_rsi_ob': 54, 'bear_adx_thresh': 10.611815919457559, 'bear_atr_min_pct': 0.011186989511448999, 'bear_atr_max_pct': 0.1322531172768122, 'bear_tp_mult': 1.1793552958129145, 'bear_tsl_mult': 0.9155091632424635, 'bear_time_stop': 122, 'bear_use_sma': False, 'bear_use_ema': False, 'bear_use_atr': False, 'bear_use_adx': False, 'bear_use_spike': True, 'bear_rsi_required': False, 'sideways_strategy': 'mean_reversion', 'sideways_bb_std_mult': 0.9872441569322672, 'sideways_rsi_os': 39, 'sideways_rsi_ob': 62, 'sideways_adx_thresh': 26.209441231933166, 'sideways_atr_min_pct': 0.005072256333382868, 'sideways_atr_max_pct': 0.10229790234598983, 'sideways_tp_mult': 1.6373271341241469, 'sideways_tsl_mult': 0.9414221175798052, 'sideways_time_stop': 166, 'sideways_use_sma': True, 'sideways_use_ema': True, 'sideways_use_atr': False, 'sideways_use_adx': False, 'sideways_use_spike': True, 'sideways_rsi_required': False}.
[I 2025-08-31 11:15:04,137] Trial 661 finished with values: [-0.011544748432073315, 0.012475070741436247] and parameters: {'p_sma': 31, 'p_std': 13, 'p_atr': 27, 'p_adx': 17, 'rsi_period': 33, 'ema1': 6, 'ema2': 44, 'slip_atr_k': 0.020604479205869542, 'slip_spread_k': 0.5190423999492066, 'spread_hl_frac': 0.01780143282493396, 'bb_std_mult': 0.6824367921695987, 'rsi_os': 26, 'rsi_ob': 82, 'vol_spike': 0.04310052332633848, 'adx_thresh': 10.681318925346723, 'atr_min_pct': 0.014476299780109518, 'atr_max_pct': 0.059096194608619285, 'tp_mult': 2.567915121153254, 'tsl_mult': 0.08554435588776091, 'strategy': 'breakout', 'time_stop': 89, 'use_sma': True, 'use_atr': True, 'use_adx': False, 'use_ema': True, 'use_spike': False, 'rsi_required': False, 'edge_k': 1.3931936527911495, 'edge_cap': 0.7548263552831416, 'bull_strategy': 'mean_reversion', 'bull_bb_std_mult': 1.5571702424444225, 'bull_rsi_os': 25, 'bull_rsi_ob': 59, 'bull_adx_thresh': 26.76609143149764, 'bull_atr_min_pct': 0.01409934564979273, 'bull_atr_max_pct': 0.03800322477009219, 'bull_tp_mult': 2.955364235139655, 'bull_tsl_mult': 0.309746432562368, 'bull_time_stop': 176, 'bull_use_sma': False, 'bull_use_ema': True, 'bull_use_atr': False, 'bull_use_adx': True, 'bull_use_spike': False, 'bull_rsi_required': False, 'bear_strategy': 'mean_reversion', 'bear_bb_std_mult': 1.697090463770797, 'bear_rsi_os': 54, 'bear_rsi_ob': 54, 'bear_adx_thresh': 22.335192590674726, 'bear_atr_min_pct': 0.003891130951805516, 'bear_atr_max_pct': 0.1334140453220917, 'bear_tp_mult': 2.484384845714973, 'bear_tsl_mult': 0.900216486161206, 'bear_time_stop': 121, 'bear_use_sma': False, 'bear_use_ema': False, 'bear_use_atr': False, 'bear_use_adx': False, 'bear_use_spike': True, 'bear_rsi_required': False, 'sideways_strategy': 'mean_reversion', 'sideways_bb_std_mult': 1.036693413677321, 'sideways_rsi_os': 39, 'sideways_rsi_ob': 49, 'sideways_adx_thresh': 28.23250759496327, 'sideways_atr_min_pct': 0.00521479898666253, 'sideways_atr_max_pct': 0.10248846063024003, 'sideways_tp_mult': 1.6382883905273515, 'sideways_tsl_mult': 0.8932781802757662, 'sideways_time_stop': 164, 'sideways_use_sma': True, 'sideways_use_ema': True, 'sideways_use_atr': False, 'sideways_use_adx': False, 'sideways_use_spike': True, 'sideways_rsi_required': True}.
[I 2025-08-31 11:15:37,385] Trial 667 finished with values: [-1000000000.0, 1000000000.0] and parameters: {'p_sma': 55, 'p_std': 6, 'p_atr': 29, 'p_adx': 20, 'rsi_period': 35, 'ema1': 5, 'ema2': 45, 'slip_atr_k': 0.20596406450537563, 'slip_spread_k': 0.5102599742529055, 'spread_hl_frac': 0.018978557456827912, 'bb_std_mult': 0.5012343209046165, 'rsi_os': 18, 'rsi_ob': 81, 'vol_spike': 0.016296527407529765, 'adx_thresh': 15.480692083141989, 'atr_min_pct': 0.029376505961464072, 'atr_max_pct': 0.0633642665652931, 'tp_mult': 2.9620123263498113, 'tsl_mult': 0.10149141599745273, 'strategy': 'breakout', 'time_stop': 90, 'use_sma': True, 'use_atr': True, 'use_adx': False, 'use_ema': True, 'use_spike': False, 'rsi_required': False, 'edge_k': 1.4675535266642428, 'edge_cap': 0.655236273139221, 'bull_strategy': 'mean_reversion', 'bull_bb_std_mult': 2.678606191776786, 'bull_rsi_os': 31, 'bull_rsi_ob': 61, 'bull_adx_thresh': 27.378448605733233, 'bull_atr_min_pct': 0.011787849580034758, 'bull_atr_max_pct': 0.02880665721576974, 'bull_tp_mult': 2.8247048980216256, 'bull_tsl_mult': 0.21272170851461375, 'bull_time_stop': 112, 'bull_use_sma': False, 'bull_use_ema': True, 'bull_use_atr': False, 'bull_use_adx': False, 'bull_use_spike': False, 'bull_rsi_required': False, 'bear_strategy': 'mean_reversion', 'bear_bb_std_mult': 1.5156193977094128, 'bear_rsi_os': 51, 'bear_rsi_ob': 88, 'bear_adx_thresh': 22.38232300867462, 'bear_atr_min_pct': 0.0068465327230094325, 'bear_atr_max_pct': 0.06679187018742186, 'bear_tp_mult': 2.694039305013076, 'bear_tsl_mult': 0.9459092866574582, 'bear_time_stop': 101, 'bear_use_sma': False, 'bear_use_ema': False, 'bear_use_atr': True, 'bear_use_adx': False, 'bear_use_spike': True, 'bear_rsi_required': False, 'sideways_strategy': 'mean_reversion', 'sideways_bb_std_mult': 0.828448784370831, 'sideways_rsi_os': 44, 'sideways_rsi_ob': 67, 'sideways_adx_thresh': 27.486036605837164, 'sideways_atr_min_pct': 0.014886573225587714, 'sideways_atr_max_pct': 0.09826723351214976, 'sideways_tp_mult': 1.5523591085108772, 'sideways_tsl_mult': 0.8930724366267957, 'sideways_time_stop': 154, 'sideways_use_sma': False, 'sideways_use_ema': True, 'sideways_use_atr': False, 'sideways_use_adx': False, 'sideways_use_spike': True, 'sideways_rsi_required': False}.
