[I 2025-08-31 09:54:37,386] Trial 25 finished with values: [-0.023860279441832444, 0.023614009861018467] and parameters: {'p_sma': 31, 'p_std': 29, 'p_atr': 26, 'p_adx': 11, 'rsi_period': 44, 'ema1': 25, 'ema2': 34, 'slip_atr_k': 0.18226129919846007, 'slip_spread_k': 0.8117702550091344, 'spread_hl_frac': 0.009428732361176024, 'bb_std_mult': 3.5983448648078427, 'rsi_os': 14, 'rsi_ob': 63, 'vol_spike': 0.23441935506891382, 'adx_thresh': 13.272932416459431, 'atr_min_pct': 0.026652338667717632, 'atr_max_pct': 0.127546381355347, 'tp_mult': 1.7711258617069712, 'tsl_mult': 0.27306562335175677, 'strategy': 'breakout', 'time_stop': 244, 'use_sma': True, 'use_atr': False, 'use_adx': True, 'use_ema': False, 'use_spike': False, 'rsi_required': True, 'edge_k': 1.220885150072718, 'edge_cap': 0.8827731272344939, 'bull_strategy': 'mean_reversion', 'bull_bb_std_mult': 2.4162525104096013, 'bull_rsi_os': 26, 'bull_rsi_ob': 89, 'bull_adx_thresh': 30.496434644215853, 'bull_atr_min_pct': 0.002143432511336404, 'bull_atr_max_pct': 0.10703674291138418, 'bull_tp_mult': 2.791607224520388, 'bull_tsl_mult': 0.8104714292676316, 'bull_time_stop': 292, 'bull_use_sma': True, 'bull_use_ema': False, 'bull_use_atr': False, 'bull_use_adx': False, 'bull_use_spike': False, 'bull_rsi_required': True, 'bear_strategy': 'breakout', 'bear_bb_std_mult': 2.2941462297775366, 'bear_rsi_os': 32, 'bear_rsi_ob': 92, 'bear_adx_thresh': 14.549959510252467, 'bear_atr_min_pct': 0.010861678966868786, 'bear_atr_max_pct': 0.13782764610181533, 'bear_tp_mult': 2.239446702722405, 'bear_tsl_mult': 0.4135670541629848, 'bear_time_stop': 155, 'bear_use_sma': True, 'bear_use_ema': False, 'bear_use_atr': True, 'bear_use_adx': False, 'bear_use_spike': False, 'bear_rsi_required': False, 'sideways_strategy': 'breakout', 'sideways_bb_std_mult': 0.9917757726532941, 'sideways_rsi_os': 12, 'sideways_rsi_ob': 62, 'sideways_adx_thresh': 14.078522194292344, 'sideways_atr_min_pct': 0.0172133347660517, 'sideways_atr_max_pct': 0.03540059009428238, 'sideways_tp_mult': 1.8663651048255554, 'sideways_tsl_mult': 0.7924020748446057, 'sideways_time_stop': 68, 'sideways_use_sma': False, 'sideways_use_ema': True, 'sideways_use_atr': False, 'sideways_use_adx': True, 'sideways_use_spike': True, 'sideways_rsi_required': False}.
[I 2025-08-31 09:54:37,667] Trial 31 finished with values: [-1000000000.0, 1000000000.0] and parameters: {'p_sma': 12, 'p_std': 60, 'p_atr': 23, 'p_adx': 13, 'rsi_period': 78, 'ema1': 28, 'ema2': 13, 'slip_atr_k': 0.2169552664494, 'slip_spread_k': 0.8956960335954806, 'spread_hl_frac': 0.031880431779628925, 'bb_std_mult': 1.6073663292901004, 'rsi_os': 29, 'rsi_ob': 50, 'vol_spike': 0.26325355793054017, 'adx_thresh': 9.29209945369562, 'atr_min_pct': 0.029908356420214888, 'atr_max_pct': 0.02912758471003045, 'tp_mult': 2.409555287807323, 'tsl_mult': 0.08972383259823608, 'strategy': 'breakout', 'time_stop': 220, 'use_sma': True, 'use_atr': False, 'use_adx': False, 'use_ema': False, 'use_spike': False, 'rsi_required': False, 'edge_k': 1.5435703304943056, 'edge_cap': 0.07218020333115521, 'bull_strategy': 'mean_reversion', 'bull_bb_std_mult': 3.292557469722497, 'bull_rsi_os': 21, 'bull_rsi_ob': 67, 'bull_adx_thresh': 31.186359088202135, 'bull_atr_min_pct': 0.0004908946034541221, 'bull_atr_max_pct': 0.026453667675684862, 'bull_tp_mult': 2.3345626777349153, 'bull_tsl_mult': 0.9774662874758127, 'bull_time_stop': 60, 'bull_use_sma': False, 'bull_use_ema': False, 'bull_use_atr': True, 'bull_use_adx': True, 'bull_use_spike': False, 'bull_rsi_required': True, 'bear_strategy': 'mean_reversion', 'bear_bb_std_mult': 2.7979923191981504, 'bear_rsi_os': 16, 'bear_rsi_ob': 86, 'bear_adx_thresh': 9.229264406044287, 'bear_atr_min_pct': 0.019526423411966115, 'bear_atr_max_pct': 0.0794819955664207, 'bear_tp_mult': 2.5704737265920246, 'bear_tsl_mult': 0.2768658037638638, 'bear_time_stop': 32, 'bear_use_sma': True, 'bear_use_ema': False, 'bear_use_atr': True, 'bear_use_adx': False, 'bear_use_spike': True, 'bear_rsi_required': True, 'sideways_strategy': 'mean_reversion', 'sideways_bb_std_mult': 0.8241267100596532, 'sideways_rsi_os': 35, 'sideways_rsi_ob': 52, 'sideways_adx_thresh': 34.002423806840426, 'sideways_atr_min_pct': 0.02110189637168435, 'sideways_atr_max_pct': 0.11169736150638884, 'sideways_tp_mult': 1.695167733160187, 'sideways_tsl_mult': 0.5590078176121006, 'sideways_time_stop': 9, 'sideways_use_sma': False, 'sideways_use_ema': True, 'sideways_use_atr': False, 'sideways_use_adx': True, 'sideways_use_spike': True, 'sideways_rsi_required': True}.
[I 2025-08-31 09:55:13,608] Trial 30 finished with values: [-1000000000.0, 1000000000.0] and parameters: {'p_sma': 20, 'p_std': 60, 'p_atr': 24, 'p_adx': 26, 'rsi_period': 39, 'ema1': 23, 'ema2': 13, 'slip_atr_k': 0.22278876189726948, 'slip_spread_k': 0.8864138504236786, 'spread_hl_frac': 0.049862321219266, 'bb_std_mult': 1.551875088392637, 'rsi_os': 30, 'rsi_ob': 50, 'vol_spike': 0.19663133380527703, 'adx_thresh': 9.49596835797123, 'atr_min_pct': 0.02927664397288294, 'atr_max_pct': 0.1371866554887493, 'tp_mult': 2.371002613089607, 'tsl_mult': 0.0852902612603368, 'strategy': 'breakout', 'time_stop': 216, 'use_sma': True, 'use_atr': False, 'use_adx': False, 'use_ema': False, 'use_spike': False, 'rsi_required': False, 'edge_k': 1.5625434303826373, 'edge_cap': 0.10328587190161753, 'bull_strategy': 'mean_reversion', 'bull_bb_std_mult': 3.272952489975544, 'bull_rsi_os': 20, 'bull_rsi_ob': 66, 'bull_adx_thresh': 31.51810278102729, 'bull_atr_min_pct': 0.0004576232171070345, 'bull_atr_max_pct': 0.025198475694435778, 'bull_tp_mult': 2.381883806291511, 'bull_tsl_mult': 0.9735977792334036, 'bull_time_stop': 169, 'bull_use_sma': False, 'bull_use_ema': False, 'bull_use_atr': True, 'bull_use_adx': True, 'bull_use_spike': False, 'bull_rsi_required': True, 'bear_strategy': 'mean_reversion', 'bear_bb_std_mult': 3.1756805751752575, 'bear_rsi_os': 35, 'bear_rsi_ob': 87, 'bear_adx_thresh': 10.895856318849251, 'bear_atr_min_pct': 0.01939620566113599, 'bear_atr_max_pct': 0.0967325222933838, 'bear_tp_mult': 2.5792933609901993, 'bear_tsl_mult': 0.29783538900918916, 'bear_time_stop': 180, 'bear_use_sma': True, 'bear_use_ema': False, 'bear_use_atr': True, 'bear_use_adx': False, 'bear_use_spike': True, 'bear_rsi_required': True, 'sideways_strategy': 'mean_reversion', 'sideways_bb_std_mult': 0.7845044675356003, 'sideways_rsi_os': 18, 'sideways_rsi_ob': 72, 'sideways_adx_thresh': 19.134273810980098, 'sideways_atr_min_pct': 0.014625417658034249, 'sideways_atr_max_pct': 0.11300935821386174, 'sideways_tp_mult': 2.9075944212420475, 'sideways_tsl_mult': 0.578632716803116, 'sideways_time_stop': 9, 'sideways_use_sma': False, 'sideways_use_ema': True, 'sideways_use_atr': False, 'sideways_use_adx': True, 'sideways_use_spike': True, 'sideways_rsi_required': True}.
[I 2025-08-31 09:55:14,703] Trial 29 finished with values: [-0.021794192025302084, 0.021658751513945425] and parameters: {'p_sma': 29, 'p_std': 28, 'p_atr': 27, 'p_adx': 18, 'rsi_period': 76, 'ema1': 23, 'ema2': 32, 'slip_atr_k': 0.2236847763545514, 'slip_spread_k': 0.8838978871265697, 'spread_hl_frac': 0.03258141608764864, 'bb_std_mult': 1.4558868397320666, 'rsi_os': 32, 'rsi_ob': 51, 'vol_spike': 0.2590841368867366, 'adx_thresh': 10.292698951143532, 'atr_min_pct': 0.029949681788027795, 'atr_max_pct': 0.12147953348604865, 'tp_mult': 2.3587231729125477, 'tsl_mult': 0.4916248346166915, 'strategy': 'breakout', 'time_stop': 266, 'use_sma': True, 'use_atr': False, 'use_adx': False, 'use_ema': False, 'use_spike': False, 'rsi_required': False, 'edge_k': 1.6318127325884744, 'edge_cap': 0.8997032131619238, 'bull_strategy': 'mean_reversion', 'bull_bb_std_mult': 3.242803310768477, 'bull_rsi_os': 50, 'bull_rsi_ob': 46, 'bull_adx_thresh': 30.723846830793292, 'bull_atr_min_pct': 0.001574057487582755, 'bull_atr_max_pct': 0.010745774177450481, 'bull_tp_mult': 2.7981219994418014, 'bull_tsl_mult': 0.8434547610114779, 'bull_time_stop': 173, 'bull_use_sma': False, 'bull_use_ema': False, 'bull_use_atr': True, 'bull_use_adx': True, 'bull_use_spike': False, 'bull_rsi_required': True, 'bear_strategy': 'mean_reversion', 'bear_bb_std_mult': 3.1997889568471076, 'bear_rsi_os': 17, 'bear_rsi_ob': 85, 'bear_adx_thresh': 9.101396770372851, 'bear_atr_min_pct': 0.019168052280108146, 'bear_atr_max_pct': 0.09640988610032217, 'bear_tp_mult': 2.2244704837541427, 'bear_tsl_mult': 0.31588664397325067, 'bear_time_stop': 170, 'bear_use_sma': True, 'bear_use_ema': False, 'bear_use_atr': True, 'bear_use_adx': False, 'bear_use_spike': True, 'bear_rsi_required': True, 'sideways_strategy': 'mean_reversion', 'sideways_bb_std_mult': 0.918864926800774, 'sideways_rsi_os': 35, 'sideways_rsi_ob': 52, 'sideways_adx_thresh': 34.588041368275626, 'sideways_atr_min_pct': 0.015385409893189561, 'sideways_atr_max_pct': 0.03594000196474204, 'sideways_tp_mult': 2.947787840788804, 'sideways_tsl_mult': 0.5643076034834749, 'sideways_time_stop': 198, 'sideways_use_sma': False, 'sideways_use_ema': True, 'sideways_use_atr': False, 'sideways_use_adx': True, 'sideways_use_spike': True, 'sideways_rsi_required': True}.
[I 2025-08-31 09:55:15,027] Trial 28 finished with values: [-1000000000.0, 1000000000.0] and parameters: {'p_sma': 31, 'p_std': 29, 'p_atr': 27, 'p_adx': 27, 'rsi_period': 67, 'ema1': 26, 'ema2': 14, 'slip_atr_k': 0.22023907290024208, 'slip_spread_k': 0.8677485179242745, 'spread_hl_frac': 0.049359613403543064, 'bb_std_mult': 3.579692194412475, 'rsi_os': 10, 'rsi_ob': 51, 'vol_spike': 0.2454581418539911, 'adx_thresh': 13.169166155323317, 'atr_min_pct': 0.029951194948493194, 'atr_max_pct': 0.11785109550179146, 'tp_mult': 1.2270809910907965, 'tsl_mult': 0.5446436019233429, 'strategy': 'breakout', 'time_stop': 212, 'use_sma': True, 'use_atr': False, 'use_adx': True, 'use_ema': False, 'use_spike': False, 'rsi_required': False, 'edge_k': 1.5723814947078525, 'edge_cap': 0.8806387100856775, 'bull_strategy': 'mean_reversion', 'bull_bb_std_mult': 2.489453853062802, 'bull_rsi_os': 23, 'bull_rsi_ob': 45, 'bull_adx_thresh': 30.228140223946987, 'bull_atr_min_pct': 0.009384764621310191, 'bull_atr_max_pct': 0.023745153348633377, 'bull_tp_mult': 2.7763766970337582, 'bull_tsl_mult': 0.8383246460848437, 'bull_time_stop': 291, 'bull_use_sma': True, 'bull_use_ema': False, 'bull_use_atr': True, 'bull_use_adx': False, 'bull_use_spike': False, 'bull_rsi_required': True, 'bear_strategy': 'breakout', 'bear_bb_std_mult': 2.118707997065501, 'bear_rsi_os': 18, 'bear_rsi_ob': 95, 'bear_adx_thresh': 15.02613465481929, 'bear_atr_min_pct': 0.010266040031650037, 'bear_atr_max_pct': 0.07615336544671746, 'bear_tp_mult': 1.9532606750167205, 'bear_tsl_mult': 0.4486768632948308, 'bear_time_stop': 40, 'bear_use_sma': True, 'bear_use_ema': False, 'bear_use_atr': True, 'bear_use_adx': False, 'bear_use_spike': True, 'bear_rsi_required': False, 'sideways_strategy': 'mean_reversion', 'sideways_bb_std_mult': 0.8902259733081752, 'sideways_rsi_os': 33, 'sideways_rsi_ob': 64, 'sideways_adx_thresh': 17.731088171433296, 'sideways_atr_min_pct': 0.015494427949147852, 'sideways_atr_max_pct': 0.03029926924265889, 'sideways_tp_mult': 2.252966876486504, 'sideways_tsl_mult': 0.5597231027207993, 'sideways_time_stop': 14, 'sideways_use_sma': False, 'sideways_use_ema': True, 'sideways_use_atr': False, 'sideways_use_adx': True, 'sideways_use_spike': True, 'sideways_rsi_required': False}.
[I 2025-08-31 09:55:15,215] Trial 32 finished with values: [-1000000000.0, 1000000000.0] and parameters: {'p_sma': 36, 'p_std': 28, 'p_atr': 27, 'p_adx': 26, 'rsi_period': 18, 'ema1': 23, 'ema2': 43, 'slip_atr_k': 0.18468838330781534, 'slip_spread_k': 0.8563280339881388, 'spread_hl_frac': 0.049197027831552886, 'bb_std_mult': 2.4720783538142093, 'rsi_os': 47, 'rsi_ob': 66, 'vol_spike': 0.2066877358425561, 'adx_thresh': 19.85923500349958, 'atr_min_pct': 0.027610691474369772, 'atr_max_pct': 0.13919007937278688, 'tp_mult': 2.9423812540426297, 'tsl_mult': 0.07106706021909213, 'strategy': 'breakout', 'time_stop': 274, 'use_sma': True, 'use_atr': False, 'use_adx': True, 'use_ema': False, 'use_spike': False, 'rsi_required': True, 'edge_k': 1.6774295844577005, 'edge_cap': 0.9302095870063453, 'bull_strategy': 'mean_reversion', 'bull_bb_std_mult': 1.9452030006884222, 'bull_rsi_os': 21, 'bull_rsi_ob': 46, 'bull_adx_thresh': 26.26046232232971, 'bull_atr_min_pct': 0.021158218319926394, 'bull_atr_max_pct': 0.05005103631585446, 'bull_tp_mult': 2.6766476912560426, 'bull_tsl_mult': 0.45375961390577957, 'bull_time_stop': 98, 'bull_use_sma': True, 'bull_use_ema': False, 'bull_use_atr': False, 'bull_use_adx': False, 'bull_use_spike': False, 'bull_rsi_required': True, 'bear_strategy': 'breakout', 'bear_bb_std_mult': 1.907350203041031, 'bear_rsi_os': 37, 'bear_rsi_ob': 60, 'bear_adx_thresh': 8.99917995059559, 'bear_atr_min_pct': 0.014681592133130262, 'bear_atr_max_pct': 0.058190287118875826, 'bear_tp_mult': 1.5921750824676997, 'bear_tsl_mult': 0.09185123399121159, 'bear_time_stop': 233, 'bear_use_sma': True, 'bear_use_ema': True, 'bear_use_atr': False, 'bear_use_adx': False, 'bear_use_spike': False, 'bear_rsi_required': False, 'sideways_strategy': 'breakout', 'sideways_bb_std_mult': 0.7720134211807501, 'sideways_rsi_os': 16, 'sideways_rsi_ob': 82, 'sideways_adx_thresh': 5.59543364639193, 'sideways_atr_min_pct': 0.019045678297697544, 'sideways_atr_max_pct': 0.03859351096934663, 'sideways_tp_mult': 2.277273537691076, 'sideways_tsl_mult': 0.8857575576572857, 'sideways_time_stop': 140, 'sideways_use_sma': False, 'sideways_use_ema': True, 'sideways_use_atr': False, 'sideways_use_adx': True, 'sideways_use_spike': True, 'sideways_rsi_required': False}.
[I 2025-08-31 09:55:51,451] Trial 35 finished with values: [-1000000000.0, 1000000000.0] and parameters: {'p_sma': 47, 'p_std': 27, 'p_atr': 28, 'p_adx': 18, 'rsi_period': 13, 'ema1': 28, 'ema2': 44, 'slip_atr_k': 0.24708548519148182, 'slip_spread_k': 0.935932669622762, 'spread_hl_frac': 0.005153030127276706, 'bb_std_mult': 2.5876617003105737, 'rsi_os': 36, 'rsi_ob': 54, 'vol_spike': 0.21778230522063596, 'adx_thresh': 20.438219892734402, 'atr_min_pct': 0.027207476768940884, 'atr_max_pct': 0.1385775815444393, 'tp_mult': 1.5922853929086673, 'tsl_mult': 0.0017841615055761845, 'strategy': 'breakout', 'time_stop': 271, 'use_sma': False, 'use_atr': True, 'use_adx': True, 'use_ema': True, 'use_spike': False, 'rsi_required': True, 'edge_k': 1.6860234347792113, 'edge_cap': 0.9339098622031381, 'bull_strategy': 'breakout', 'bull_bb_std_mult': 2.041542096426245, 'bull_rsi_os': 38, 'bull_rsi_ob': 93, 'bull_adx_thresh': 26.474358899252323, 'bull_atr_min_pct': 0.019446212279084617, 'bull_atr_max_pct': 0.011022905456152046, 'bull_tp_mult': 2.6561911688582303, 'bull_tsl_mult': 0.4625920842253433, 'bull_time_stop': 106, 'bull_use_sma': True, 'bull_use_ema': False, 'bull_use_atr': False, 'bull_use_adx': False, 'bull_use_spike': False, 'bull_rsi_required': True, 'bear_strategy': 'breakout', 'bear_bb_std_mult': 2.9013364434175086, 'bear_rsi_os': 13, 'bear_rsi_ob': 61, 'bear_adx_thresh': 8.320638172589618, 'bear_atr_min_pct': 0.02943751873410297, 'bear_atr_max_pct': 0.08581829227892714, 'bear_tp_mult': 1.5609451865271358, 'bear_tsl_mult': 0.081481854303247, 'bear_time_stop': 224, 'bear_use_sma': True, 'bear_use_ema': True, 'bear_use_atr': False, 'bear_use_adx': False, 'bear_use_spike': False, 'bear_rsi_required': False, 'sideways_strategy': 'breakout', 'sideways_bb_std_mult': 0.6197961409129518, 'sideways_rsi_os': 48, 'sideways_rsi_ob': 45, 'sideways_adx_thresh': 31.181491552372044, 'sideways_atr_min_pct': 0.018874639091744673, 'sideways_atr_max_pct': 0.04009239821444201, 'sideways_tp_mult': 1.9531673542597252, 'sideways_tsl_mult': 0.71472286907088, 'sideways_time_stop': 146, 'sideways_use_sma': True, 'sideways_use_ema': True, 'sideways_use_atr': False, 'sideways_use_adx': True, 'sideways_use_spike': False, 'sideways_rsi_required': False}.
[I 2025-08-31 09:55:51,652] Trial 36 finished with values: [-1000000000.0, 1000000000.0] and parameters: {'p_sma': 43, 'p_std': 11, 'p_atr': 15, 'p_adx': 18, 'rsi_period': 7, 'ema1': 28, 'ema2': 55, 'slip_atr_k': 0.10962784884299176, 'slip_spread_k': 0.9466505589170904, 'spread_hl_frac': 0.00218049707096752, 'bb_std_mult': 3.266974616565995, 'rsi_os': 36, 'rsi_ob': 53, 'vol_spike': 0.26401175082546846, 'adx_thresh': 20.09855526293734, 'atr_min_pct': 0.02620153073107353, 'atr_max_pct': 0.12143855183924654, 'tp_mult': 1.6408110090017216, 'tsl_mult': 0.18933731788717845, 'strategy': 'breakout', 'time_stop': 179, 'use_sma': False, 'use_atr': True, 'use_adx': True, 'use_ema': True, 'use_spike': True, 'rsi_required': True, 'edge_k': 1.1392413161591766, 'edge_cap': 0.8126438606377057, 'bull_strategy': 'breakout', 'bull_bb_std_mult': 2.211962956916331, 'bull_rsi_os': 29, 'bull_rsi_ob': 92, 'bull_adx_thresh': 32.50032854046509, 'bull_atr_min_pct': 0.025908048167552107, 'bull_atr_max_pct': 0.015013823931521574, 'bull_tp_mult': 1.581274529570413, 'bull_tsl_mult': 0.5563707113484555, 'bull_time_stop': 59, 'bull_use_sma': True, 'bull_use_ema': False, 'bull_use_atr': False, 'bull_use_adx': False, 'bull_use_spike': False, 'bull_rsi_required': True, 'bear_strategy': 'breakout', 'bear_bb_std_mult': 2.9040932535234902, 'bear_rsi_os': 46, 'bear_rsi_ob': 59, 'bear_adx_thresh': 7.844128007500471, 'bear_atr_min_pct': 0.02966563802637148, 'bear_atr_max_pct': 0.08587671633919391, 'bear_tp_mult': 1.924913162571521, 'bear_tsl_mult': 0.34132670781756086, 'bear_time_stop': 248, 'bear_use_sma': True, 'bear_use_ema': True, 'bear_use_atr': False, 'bear_use_adx': True, 'bear_use_spike': False, 'bear_rsi_required': False, 'sideways_strategy': 'breakout', 'sideways_bb_std_mult': 0.5608068777291715, 'sideways_rsi_os': 9, 'sideways_rsi_ob': 45, 'sideways_adx_thresh': 31.5637180762618, 'sideways_atr_min_pct': 0.018468067134480015, 'sideways_atr_max_pct': 0.021690460114857587, 'sideways_tp_mult': 2.0638334384025274, 'sideways_tsl_mult': 0.713518492229384, 'sideways_time_stop': 85, 'sideways_use_sma': True, 'sideways_use_ema': True, 'sideways_use_atr': False, 'sideways_use_adx': True, 'sideways_use_spike': False, 'sideways_rsi_required': False}.
[I 2025-08-31 09:55:51,806] Trial 33 finished with values: [-1000000000.0, 1000000000.0] and parameters: {'p_sma': 29, 'p_std': 29, 'p_atr': 27, 'p_adx': 17, 'rsi_period': 24, 'ema1': 28, 'ema2': 43, 'slip_atr_k': 0.10798748611316455, 'slip_spread_k': 0.6399056824863346, 'spread_hl_frac': 0.0011206685634599124, 'bb_std_mult': 2.396244195598495, 'rsi_os': 47, 'rsi_ob': 66, 'vol_spike': 0.22058198727093642, 'adx_thresh': 19.936531375212894, 'atr_min_pct': 0.027368789616871652, 'atr_max_pct': 0.12015309532440137, 'tp_mult': 1.6211370947291486, 'tsl_mult': 0.20245698047001265, 'strategy': 'breakout', 'time_stop': 179, 'use_sma': False, 'use_atr': True, 'use_adx': True, 'use_ema': True, 'use_spike': False, 'rsi_required': True, 'edge_k': 1.1238299918080494, 'edge_cap': 0.9053170875119151, 'bull_strategy': 'breakout', 'bull_bb_std_mult': 1.9945297224875844, 'bull_rsi_os': 28, 'bull_rsi_ob': 92, 'bull_adx_thresh': 26.270730001032724, 'bull_atr_min_pct': 0.018386578846735314, 'bull_atr_max_pct': 0.05166167614281666, 'bull_tp_mult': 2.6695467067398777, 'bull_tsl_mult': 0.497346759526238, 'bull_time_stop': 97, 'bull_use_sma': True, 'bull_use_ema': False, 'bull_use_atr': False, 'bull_use_adx': False, 'bull_use_spike': False, 'bull_rsi_required': True, 'bear_strategy': 'breakout', 'bear_bb_std_mult': 2.8094618772742868, 'bear_rsi_os': 26, 'bear_rsi_ob': 59, 'bear_adx_thresh': 8.505164841918239, 'bear_atr_min_pct': 0.01452344188493791, 'bear_atr_max_pct': 0.05523772751571565, 'bear_tp_mult': 1.5829041866724054, 'bear_tsl_mult': 0.0976573080782478, 'bear_time_stop': 233, 'bear_use_sma': True, 'bear_use_ema': True, 'bear_use_atr': False, 'bear_use_adx': True, 'bear_use_spike': False, 'bear_rsi_required': False, 'sideways_strategy': 'breakout', 'sideways_bb_std_mult': 1.4788568734803866, 'sideways_rsi_os': 35, 'sideways_rsi_ob': 86, 'sideways_adx_thresh': 27.622480869804885, 'sideways_atr_min_pct': 0.017538827162202068, 'sideways_atr_max_pct': 0.03915762299973767, 'sideways_tp_mult': 2.233052492106987, 'sideways_tsl_mult': 0.8682183903118446, 'sideways_time_stop': 204, 'sideways_use_sma': True, 'sideways_use_ema': True, 'sideways_use_atr': False, 'sideways_use_adx': True, 'sideways_use_spike': False, 'sideways_rsi_required': False}.
