[I 2025-08-31 10:53:57,633] Trial 505 finished with values: [-1000000000.0, 1000000000.0] and parameters: {'p_sma': 41, 'p_std': 23, 'p_atr': 20, 'p_adx': 19, 'rsi_period': 37, 'ema1': 23, 'ema2': 58, 'slip_atr_k': 0.010061755822700509, 'slip_spread_k': 0.4444019780192809, 'spread_hl_frac': 0.022585128900432003, 'bb_std_mult': 1.4339505505939776, 'rsi_os': 34, 'rsi_ob': 74, 'vol_spike': 0.1388168680593755, 'adx_thresh': 11.057553013142853, 'atr_min_pct': 0.011879568289025604, 'atr_max_pct': 0.048142656291312834, 'tp_mult': 1.4243776883368682, 'tsl_mult': 0.7458565515252765, 'strategy': 'mean_reversion', 'time_stop': 94, 'use_sma': False, 'use_atr': False, 'use_adx': False, 'use_ema': False, 'use_spike': False, 'rsi_required': False, 'edge_k': 1.2977535577985844, 'edge_cap': 0.16458978694644144, 'bull_strategy': 'breakout', 'bull_bb_std_mult': 3.42757180561442, 'bull_rsi_os': 52, 'bull_rsi_ob': 58, 'bull_adx_thresh': 31.260253288768347, 'bull_atr_min_pct': 0.02162071411388126, 'bull_atr_max_pct': 0.039193153924925554, 'bull_tp_mult': 2.767992467642914, 'bull_tsl_mult': 0.10344805286527248, 'bull_time_stop': 66, 'bull_use_sma': False, 'bull_use_ema': True, 'bull_use_atr': False, 'bull_use_adx': True, 'bull_use_spike': False, 'bull_rsi_required': False, 'bear_strategy': 'breakout', 'bear_bb_std_mult': 1.390475619333941, 'bear_rsi_os': 23, 'bear_rsi_ob': 65, 'bear_adx_thresh': 14.336128399442854, 'bear_atr_min_pct': 0.02443366233199728, 'bear_atr_max_pct': 0.13959030172495782, 'bear_tp_mult': 1.4200056814876043, 'bear_tsl_mult': 0.13943768459747938, 'bear_time_stop': 37, 'bear_use_sma': False, 'bear_use_ema': False, 'bear_use_atr': True, 'bear_use_adx': False, 'bear_use_spike': True, 'bear_rsi_required': True, 'sideways_strategy': 'mean_reversion', 'sideways_bb_std_mult': 1.5244285359630703, 'sideways_rsi_os': 52, 'sideways_rsi_ob': 59, 'sideways_adx_thresh': 13.836150983263659, 'sideways_atr_min_pct': 0.009483416186174546, 'sideways_atr_max_pct': 0.03232752929539, 'sideways_tp_mult': 1.9733424245643663, 'sideways_tsl_mult': 0.8590479025807444, 'sideways_time_stop': 119, 'sideways_use_sma': True, 'sideways_use_ema': False, 'sideways_use_atr': False, 'sideways_use_adx': False, 'sideways_use_spike': True, 'sideways_rsi_required': False}.
[I 2025-08-31 10:53:57,742] Trial 502 finished with values: [-0.0024127284568092877, 0.0037631226788653075] and parameters: {'p_sma': 44, 'p_std': 38, 'p_atr': 22, 'p_adx': 21, 'rsi_period': 37, 'ema1': 22, 'ema2': 59, 'slip_atr_k': 0.004605993586686966, 'slip_spread_k': 0.29577310564577336, 'spread_hl_frac': 0.04597838981805817, 'bb_std_mult': 2.537846462003405, 'rsi_os': 32, 'rsi_ob': 69, 'vol_spike': 0.06283548079954865, 'adx_thresh': 20.563943504217793, 'atr_min_pct': 0.01758670499680738, 'atr_max_pct': 0.04660191799878294, 'tp_mult': 2.2228583214677182, 'tsl_mult': 0.29620508398264256, 'strategy': 'breakout', 'time_stop': 148, 'use_sma': False, 'use_atr': False, 'use_adx': False, 'use_ema': False, 'use_spike': False, 'rsi_required': False, 'edge_k': 1.75632959882011, 'edge_cap': 0.7466393111415873, 'bull_strategy': 'breakout', 'bull_bb_std_mult': 3.5997363135336755, 'bull_rsi_os': 12, 'bull_rsi_ob': 85, 'bull_adx_thresh': 21.11406414240354, 'bull_atr_min_pct': 0.0030599870023677467, 'bull_atr_max_pct': 0.03828285445964499, 'bull_tp_mult': 2.757554879929811, 'bull_tsl_mult': 0.11470524040285995, 'bull_time_stop': 65, 'bull_use_sma': False, 'bull_use_ema': True, 'bull_use_atr': False, 'bull_use_adx': True, 'bull_use_spike': False, 'bull_rsi_required': False, 'bear_strategy': 'breakout', 'bear_bb_std_mult': 1.271285862417339, 'bear_rsi_os': 50, 'bear_rsi_ob': 48, 'bear_adx_thresh': 13.50085085250489, 'bear_atr_min_pct': 0.02273615633691211, 'bear_atr_max_pct': 0.13481810419061116, 'bear_tp_mult': 1.4416201438032734, 'bear_tsl_mult': 0.13702699577792746, 'bear_time_stop': 27, 'bear_use_sma': False, 'bear_use_ema': False, 'bear_use_atr': True, 'bear_use_adx': False, 'bear_use_spike': True, 'bear_rsi_required': True, 'sideways_strategy': 'mean_reversion', 'sideways_bb_std_mult': 1.5127733495455369, 'sideways_rsi_os': 42, 'sideways_rsi_ob': 61, 'sideways_adx_thresh': 14.227350081209702, 'sideways_atr_min_pct': 0.006470004792380926, 'sideways_atr_max_pct': 0.010059458322476336, 'sideways_tp_mult': 1.7946883569894014, 'sideways_tsl_mult': 0.8849720420653565, 'sideways_time_stop': 277, 'sideways_use_sma': True, 'sideways_use_ema': False, 'sideways_use_atr': False, 'sideways_use_adx': False, 'sideways_use_spike': True, 'sideways_rsi_required': False}.
[I 2025-08-31 10:54:28,520] Trial 509 finished with values: [-1000000000.0, 1000000000.0] and parameters: {'p_sma': 46, 'p_std': 44, 'p_atr': 22, 'p_adx': 22, 'rsi_period': 45, 'ema1': 21, 'ema2': 57, 'slip_atr_k': 0.005042683345045151, 'slip_spread_k': 0.2984742441298654, 'spread_hl_frac': 0.012256377386142013, 'bb_std_mult': 2.596201148611001, 'rsi_os': 31, 'rsi_ob': 78, 'vol_spike': 0.22670001114319338, 'adx_thresh': 12.608196273373082, 'atr_min_pct': 0.01765322365591391, 'atr_max_pct': 0.08215623574680453, 'tp_mult': 2.0932672518877817, 'tsl_mult': 0.7011723457882476, 'strategy': 'breakout', 'time_stop': 80, 'use_sma': False, 'use_atr': True, 'use_adx': False, 'use_ema': True, 'use_spike': False, 'rsi_required': False, 'edge_k': 1.6958762590247316, 'edge_cap': 0.17329822639270087, 'bull_strategy': 'mean_reversion', 'bull_bb_std_mult': 3.5362639791196733, 'bull_rsi_os': 47, 'bull_rsi_ob': 77, 'bull_adx_thresh': 9.822191960257786, 'bull_atr_min_pct': 0.0038132422078369435, 'bull_atr_max_pct': 0.047382051667794745, 'bull_tp_mult': 2.944486873886318, 'bull_tsl_mult': 0.4660694683168023, 'bull_time_stop': 132, 'bull_use_sma': False, 'bull_use_ema': False, 'bull_use_atr': False, 'bull_use_adx': False, 'bull_use_spike': True, 'bull_rsi_required': True, 'bear_strategy': 'breakout', 'bear_bb_std_mult': 1.3330957257688467, 'bear_rsi_os': 25, 'bear_rsi_ob': 81, 'bear_adx_thresh': 15.562825236084002, 'bear_atr_min_pct': 0.02521132547009545, 'bear_atr_max_pct': 0.14427037960472583, 'bear_tp_mult': 2.106501927303838, 'bear_tsl_mult': 0.6791035845575324, 'bear_time_stop': 51, 'bear_use_sma': True, 'bear_use_ema': False, 'bear_use_atr': False, 'bear_use_adx': False, 'bear_use_spike': False, 'bear_rsi_required': False, 'sideways_strategy': 'mean_reversion', 'sideways_bb_std_mult': 1.6768557530598405, 'sideways_rsi_os': 39, 'sideways_rsi_ob': 57, 'sideways_adx_thresh': 7.7032132807115445, 'sideways_atr_min_pct': 0.02556960496312823, 'sideways_atr_max_pct': 0.021054852121165764, 'sideways_tp_mult': 1.8737529003248312, 'sideways_tsl_mult': 0.936915808381112, 'sideways_time_stop': 166, 'sideways_use_sma': False, 'sideways_use_ema': False, 'sideways_use_atr': True, 'sideways_use_adx': True, 'sideways_use_spike': False, 'sideways_rsi_required': True}.
[I 2025-08-31 10:54:28,683] Trial 507 finished with values: [-1000000000.0, 1000000000.0] and parameters: {'p_sma': 46, 'p_std': 39, 'p_atr': 20, 'p_adx': 19, 'rsi_period': 40, 'ema1': 21, 'ema2': 56, 'slip_atr_k': 0.010303574330508247, 'slip_spread_k': 0.29574542447232244, 'spread_hl_frac': 0.023946677374339483, 'bb_std_mult': 2.5996950888933608, 'rsi_os': 34, 'rsi_ob': 78, 'vol_spike': 0.13868515057012812, 'adx_thresh': 12.45611068288683, 'atr_min_pct': 0.011798727209360427, 'atr_max_pct': 0.06157585313136026, 'tp_mult': 2.1023357413059034, 'tsl_mult': 0.744753155148542, 'strategy': 'mean_reversion', 'time_stop': 276, 'use_sma': False, 'use_atr': True, 'use_adx': False, 'use_ema': True, 'use_spike': False, 'rsi_required': False, 'edge_k': 1.2841320004333614, 'edge_cap': 0.1622225718516491, 'bull_strategy': 'breakout', 'bull_bb_std_mult': 3.486921604287145, 'bull_rsi_os': 47, 'bull_rsi_ob': 77, 'bull_adx_thresh': 9.746599645573692, 'bull_atr_min_pct': 0.0057324980562885154, 'bull_atr_max_pct': 0.04687732432131668, 'bull_tp_mult': 2.9358017385922484, 'bull_tsl_mult': 0.11044901303512732, 'bull_time_stop': 119, 'bull_use_sma': False, 'bull_use_ema': False, 'bull_use_atr': False, 'bull_use_adx': False, 'bull_use_spike': True, 'bull_rsi_required': True, 'bear_strategy': 'breakout', 'bear_bb_std_mult': 1.4228315941014955, 'bear_rsi_os': 18, 'bear_rsi_ob': 77, 'bear_adx_thresh': 15.372466837788444, 'bear_atr_min_pct': 0.025387923261113773, 'bear_atr_max_pct': 0.14411381950494628, 'bear_tp_mult': 2.107725846605677, 'bear_tsl_mult': 0.07145603017333554, 'bear_time_stop': 52, 'bear_use_sma': True, 'bear_use_ema': False, 'bear_use_atr': False, 'bear_use_adx': False, 'bear_use_spike': True, 'bear_rsi_required': False, 'sideways_strategy': 'mean_reversion', 'sideways_bb_std_mult': 1.439639038655308, 'sideways_rsi_os': 36, 'sideways_rsi_ob': 59, 'sideways_adx_thresh': 13.982031145678281, 'sideways_atr_min_pct': 0.005509641410545661, 'sideways_atr_max_pct': 0.015531060182854639, 'sideways_tp_mult': 2.0512992529807326, 'sideways_tsl_mult': 0.10850251281466283, 'sideways_time_stop': 278, 'sideways_use_sma': False, 'sideways_use_ema': False, 'sideways_use_atr': True, 'sideways_use_adx': True, 'sideways_use_spike': False, 'sideways_rsi_required': False}.
[I 2025-08-31 10:54:29,052] Trial 508 finished with values: [-1000000000.0, 1000000000.0] and parameters: {'p_sma': 46, 'p_std': 37, 'p_atr': 24, 'p_adx': 21, 'rsi_period': 40, 'ema1': 21, 'ema2': 56, 'slip_atr_k': 0.2215690054008021, 'slip_spread_k': 0.29460763530235357, 'spread_hl_frac': 0.011713056420478677, 'bb_std_mult': 2.394910980464273, 'rsi_os': 16, 'rsi_ob': 78, 'vol_spike': 0.22518035507627276, 'adx_thresh': 7.88112401180563, 'atr_min_pct': 0.017735931117218356, 'atr_max_pct': 0.03962733857325473, 'tp_mult': 2.096465547957715, 'tsl_mult': 0.2693974044903317, 'strategy': 'mean_reversion', 'time_stop': 10, 'use_sma': False, 'use_atr': True, 'use_adx': False, 'use_ema': True, 'use_spike': False, 'rsi_required': False, 'edge_k': 1.7698880360663538, 'edge_cap': 0.5533602769623113, 'bull_strategy': 'mean_reversion', 'bull_bb_std_mult': 3.526832702253329, 'bull_rsi_os': 47, 'bull_rsi_ob': 92, 'bull_adx_thresh': 9.814406777574062, 'bull_atr_min_pct': 0.003836632139582364, 'bull_atr_max_pct': 0.046441877470677455, 'bull_tp_mult': 2.930535521324526, 'bull_tsl_mult': 0.115979293468569, 'bull_time_stop': 115, 'bull_use_sma': False, 'bull_use_ema': False, 'bull_use_atr': False, 'bull_use_adx': False, 'bull_use_spike': True, 'bull_rsi_required': True, 'bear_strategy': 'breakout', 'bear_bb_std_mult': 1.432863503393987, 'bear_rsi_os': 51, 'bear_rsi_ob': 48, 'bear_adx_thresh': 11.210772254178005, 'bear_atr_min_pct': 0.02537480724279546, 'bear_atr_max_pct': 0.14451120760760303, 'bear_tp_mult': 2.930103654105679, 'bear_tsl_mult': 0.5510583147387377, 'bear_time_stop': 288, 'bear_use_sma': True, 'bear_use_ema': False, 'bear_use_atr': False, 'bear_use_adx': False, 'bear_use_spike': False, 'bear_rsi_required': False, 'sideways_strategy': 'mean_reversion', 'sideways_bb_std_mult': 2.7106664182234055, 'sideways_rsi_os': 36, 'sideways_rsi_ob': 57, 'sideways_adx_thresh': 25.928270046044716, 'sideways_atr_min_pct': 0.012390803951338628, 'sideways_atr_max_pct': 0.02041616055241463, 'sideways_tp_mult': 1.8770415238618774, 'sideways_tsl_mult': 0.3964237582517549, 'sideways_time_stop': 293, 'sideways_use_sma': False, 'sideways_use_ema': False, 'sideways_use_atr': True, 'sideways_use_adx': True, 'sideways_use_spike': False, 'sideways_rsi_required': True}.
[I 2025-08-31 10:54:29,363] Trial 506 finished with values: [-1000000000.0, 1000000000.0] and parameters: {'p_sma': 41, 'p_std': 43, 'p_atr': 20, 'p_adx': 19, 'rsi_period': 37, 'ema1': 23, 'ema2': 56, 'slip_atr_k': 0.010399981621312705, 'slip_spread_k': 0.9230304275976784, 'spread_hl_frac': 0.011722346394024889, 'bb_std_mult': 1.3368695323190285, 'rsi_os': 31, 'rsi_ob': 74, 'vol_spike': 0.22927657437427193, 'adx_thresh': 17.314676391949753, 'atr_min_pct': 0.019306351707831376, 'atr_max_pct': 0.04729882126435154, 'tp_mult': 1.0774918942807594, 'tsl_mult': 0.6967887517127926, 'strategy': 'mean_reversion', 'time_stop': 276, 'use_sma': False, 'use_atr': False, 'use_adx': False, 'use_ema': False, 'use_spike': False, 'rsi_required': False, 'edge_k': 1.7768946017853229, 'edge_cap': 0.16183977723305, 'bull_strategy': 'breakout', 'bull_bb_std_mult': 3.417829384052384, 'bull_rsi_os': 46, 'bull_rsi_ob': 77, 'bull_adx_thresh': 31.37844879669052, 'bull_atr_min_pct': 0.005878022607456648, 'bull_atr_max_pct': 0.04628668721361129, 'bull_tp_mult': 2.9368905551331657, 'bull_tsl_mult': 0.11308192373238676, 'bull_time_stop': 65, 'bull_use_sma': False, 'bull_use_ema': True, 'bull_use_atr': False, 'bull_use_adx': False, 'bull_use_spike': True, 'bull_rsi_required': False, 'bear_strategy': 'breakout', 'bear_bb_std_mult': 1.262428550264035, 'bear_rsi_os': 20, 'bear_rsi_ob': 55, 'bear_adx_thresh': 11.091046817543845, 'bear_atr_min_pct': 0.024484995965864585, 'bear_atr_max_pct': 0.13954400139073397, 'bear_tp_mult': 2.0563812665830254, 'bear_tsl_mult': 0.07466189968399373, 'bear_time_stop': 36, 'bear_use_sma': True, 'bear_use_ema': False, 'bear_use_atr': False, 'bear_use_adx': False, 'bear_use_spike': True, 'bear_rsi_required': False, 'sideways_strategy': 'mean_reversion', 'sideways_bb_std_mult': 1.4404908980284097, 'sideways_rsi_os': 43, 'sideways_rsi_ob': 59, 'sideways_adx_thresh': 5.00935802382663, 'sideways_atr_min_pct': 0.005489584292133703, 'sideways_atr_max_pct': 0.020053464485713116, 'sideways_tp_mult': 1.8720552794378955, 'sideways_tsl_mult': 0.942011685021108, 'sideways_time_stop': 115, 'sideways_use_sma': True, 'sideways_use_ema': False, 'sideways_use_atr': True, 'sideways_use_adx': True, 'sideways_use_spike': True, 'sideways_rsi_required': False}.
[I 2025-08-31 10:55:00,278] Trial 512 finished with values: [-0.03705657668267637, 0.03695419493880082] and parameters: {'p_sma': 44, 'p_std': 17, 'p_atr': 22, 'p_adx': 22, 'rsi_period': 38, 'ema1': 22, 'ema2': 59, 'slip_atr_k': 0.014809550464035972, 'slip_spread_k': 0.5372189148031408, 'spread_hl_frac': 0.014420446512744649, 'bb_std_mult': 1.1348009939525527, 'rsi_os': 36, 'rsi_ob': 76, 'vol_spike': 0.07510999113459924, 'adx_thresh': 17.2709246349227, 'atr_min_pct': 0.020644199383785342, 'atr_max_pct': 0.043385152134890935, 'tp_mult': 2.8838305298972315, 'tsl_mult': 0.6431391367996424, 'strategy': 'mean_reversion', 'time_stop': 149, 'use_sma': True, 'use_atr': False, 'use_adx': False, 'use_ema': False, 'use_spike': False, 'rsi_required': False, 'edge_k': 0.7814569420669637, 'edge_cap': 0.8714064881013979, 'bull_strategy': 'breakout', 'bull_bb_std_mult': 3.5990236962329085, 'bull_rsi_os': 5, 'bull_rsi_ob': 76, 'bull_adx_thresh': 21.294994470185465, 'bull_atr_min_pct': 0.0015099494518850867, 'bull_atr_max_pct': 0.04129582477656503, 'bull_tp_mult': 2.8903039217921207, 'bull_tsl_mult': 0.16204653696978413, 'bull_time_stop': 59, 'bull_use_sma': False, 'bull_use_ema': True, 'bull_use_atr': False, 'bull_use_adx': True, 'bull_use_spike': True, 'bull_rsi_required': False, 'bear_strategy': 'mean_reversion', 'bear_bb_std_mult': 1.5000834561724659, 'bear_rsi_os': 21, 'bear_rsi_ob': 53, 'bear_adx_thresh': 13.044844468013178, 'bear_atr_min_pct': 0.024516685104566387, 'bear_atr_max_pct': 0.013463930668331958, 'bear_tp_mult': 2.706903578945364, 'bear_tsl_mult': 0.10286693247434993, 'bear_time_stop': 273, 'bear_use_sma': False, 'bear_use_ema': False, 'bear_use_atr': True, 'bear_use_adx': True, 'bear_use_spike': True, 'bear_rsi_required': True, 'sideways_strategy': 'mean_reversion', 'sideways_bb_std_mult': 2.6195238557967486, 'sideways_rsi_os': 43, 'sideways_rsi_ob': 61, 'sideways_adx_thresh': 14.172375335693534, 'sideways_atr_min_pct': 0.005785890117671669, 'sideways_atr_max_pct': 0.1194599836486527, 'sideways_tp_mult': 2.1948798446446904, 'sideways_tsl_mult': 0.49738843519315945, 'sideways_time_stop': 86, 'sideways_use_sma': True, 'sideways_use_ema': False, 'sideways_use_atr': False, 'sideways_use_adx': False, 'sideways_use_spike': True, 'sideways_rsi_required': False}.
[I 2025-08-31 10:55:00,916] Trial 511 finished with values: [-0.008299106499175868, 0.008347262092069726] and parameters: {'p_sma': 42, 'p_std': 37, 'p_atr': 22, 'p_adx': 21, 'rsi_period': 40, 'ema1': 22, 'ema2': 40, 'slip_atr_k': 0.030043442470824383, 'slip_spread_k': 0.2704022442819579, 'spread_hl_frac': 0.04654286118963918, 'bb_std_mult': 3.591103756029365, 'rsi_os': 36, 'rsi_ob': 74, 'vol_spike': 0.21624057890725973, 'adx_thresh': 6.704504269538449, 'atr_min_pct': 0.025713216296409862, 'atr_max_pct': 0.09390245641170364, 'tp_mult': 2.879786623034688, 'tsl_mult': 0.8545587203051269, 'strategy': 'mean_reversion', 'time_stop': 220, 'use_sma': False, 'use_atr': False, 'use_adx': False, 'use_ema': False, 'use_spike': False, 'rsi_required': False, 'edge_k': 1.759236631026419, 'edge_cap': 0.8069716956486661, 'bull_strategy': 'breakout', 'bull_bb_std_mult': 3.598841257154966, 'bull_rsi_os': 44, 'bull_rsi_ob': 85, 'bull_adx_thresh': 25.695856924071848, 'bull_atr_min_pct': 0.002676121575354626, 'bull_atr_max_pct': 0.04592207830756313, 'bull_tp_mult': 2.906029867502362, 'bull_tsl_mult': 0.18219389655860835, 'bull_time_stop': 78, 'bull_use_sma': False, 'bull_use_ema': True, 'bull_use_atr': False, 'bull_use_adx': True, 'bull_use_spike': True, 'bull_rsi_required': False, 'bear_strategy': 'mean_reversion', 'bear_bb_std_mult': 1.2382726861345437, 'bear_rsi_os': 51, 'bear_rsi_ob': 55, 'bear_adx_thresh': 13.634286722405077, 'bear_atr_min_pct': 0.02460852587945096, 'bear_atr_max_pct': 0.049079173273233585, 'bear_tp_mult': 1.1415206665420556, 'bear_tsl_mult': 0.6480472716499364, 'bear_time_stop': 134, 'bear_use_sma': False, 'bear_use_ema': False, 'bear_use_atr': True, 'bear_use_adx': False, 'bear_use_spike': True, 'bear_rsi_required': True, 'sideways_strategy': 'mean_reversion', 'sideways_bb_std_mult': 2.698615405405061, 'sideways_rsi_os': 55, 'sideways_rsi_ob': 56, 'sideways_adx_thresh': 12.928288415913187, 'sideways_atr_min_pct': 0.011179672726136812, 'sideways_atr_max_pct': 0.13215473995860508, 'sideways_tp_mult': 1.936213815587831, 'sideways_tsl_mult': 0.5034076841301641, 'sideways_time_stop': 292, 'sideways_use_sma': True, 'sideways_use_ema': False, 'sideways_use_atr': False, 'sideways_use_adx': False, 'sideways_use_spike': True, 'sideways_rsi_required': False}.
[I 2025-08-31 10:55:01,008] Trial 510 finished with values: [-1000000000.0, 1000000000.0] and parameters: {'p_sma': 44, 'p_std': 38, 'p_atr': 22, 'p_adx': 21, 'rsi_period': 34, 'ema1': 22, 'ema2': 17, 'slip_atr_k': 1.3730936442413514e-05, 'slip_spread_k': 0.26870676583913233, 'spread_hl_frac': 0.023859168954756746, 'bb_std_mult': 3.4673442436807878, 'rsi_os': 36, 'rsi_ob': 88, 'vol_spike': 0.23056376033075027, 'adx_thresh': 6.879600377117031, 'atr_min_pct': 0.004548903076421539, 'atr_max_pct': 0.040323531885795766, 'tp_mult': 2.876198765295386, 'tsl_mult': 0.28477523798965243, 'strategy': 'mean_reversion', 'time_stop': 147, 'use_sma': False, 'use_atr': False, 'use_adx': False, 'use_ema': False, 'use_spike': False, 'rsi_required': False, 'edge_k': 1.7629952001733786, 'edge_cap': 0.1530235685347286, 'bull_strategy': 'breakout', 'bull_bb_std_mult': 3.5954688308261638, 'bull_rsi_os': 45, 'bull_rsi_ob': 77, 'bull_adx_thresh': 11.510767281595555, 'bull_atr_min_pct': 0.023166456563293983, 'bull_atr_max_pct': 0.04629951234594692, 'bull_tp_mult': 2.58177859409877, 'bull_tsl_mult': 0.9298730322588207, 'bull_time_stop': 57, 'bull_use_sma': False, 'bull_use_ema': True, 'bull_use_atr': False, 'bull_use_adx': True, 'bull_use_spike': True, 'bull_rsi_required': False, 'bear_strategy': 'breakout', 'bear_bb_std_mult': 1.4937854775673913, 'bear_rsi_os': 21, 'bear_rsi_ob': 48, 'bear_adx_thresh': 11.265858556795118, 'bear_atr_min_pct': 0.025488949553858522, 'bear_atr_max_pct': 0.13580867051462736, 'bear_tp_mult': 2.72757192746979, 'bear_tsl_mult': 0.10076320880505424, 'bear_time_stop': 213, 'bear_use_sma': True, 'bear_use_ema': False, 'bear_use_atr': False, 'bear_use_adx': False, 'bear_use_spike': True, 'bear_rsi_required': True, 'sideways_strategy': 'mean_reversion', 'sideways_bb_std_mult': 2.6139187326618325, 'sideways_rsi_os': 36, 'sideways_rsi_ob': 56, 'sideways_adx_thresh': 14.226609274709071, 'sideways_atr_min_pct': 0.008478756413988917, 'sideways_atr_max_pct': 0.015796394270646316, 'sideways_tp_mult': 2.068947369626043, 'sideways_tsl_mult': 0.5016709316417725, 'sideways_time_stop': 139, 'sideways_use_sma': True, 'sideways_use_ema': False, 'sideways_use_atr': True, 'sideways_use_adx': True, 'sideways_use_spike': True, 'sideways_rsi_required': False}.
