[I 2025-08-31 09:52:07,777] Trial 6 finished with values: [-1000000000.0, 1000000000.0] and parameters: {'p_sma': 38, 'p_std': 34, 'p_atr': 25, 'p_adx': 24, 'rsi_period': 57, 'ema1': 24, 'ema2': 57, 'slip_atr_k': 0.08279647382787703, 'slip_spread_k': 0.6293542708370357, 'spread_hl_frac': 0.016871227068873517, 'bb_std_mult': 1.3166456922674317, 'rsi_os': 28, 'rsi_ob': 69, 'vol_spike': 0.24364691070662897, 'adx_thresh': 9.567158407974617, 'atr_min_pct': 0.016014626287107352, 'atr_max_pct': 0.07569492463802147, 'tp_mult': 2.204982662079157, 'tsl_mult': 0.7992273348311567, 'strategy': 'mean_reversion', 'time_stop': 133, 'use_sma': False, 'use_atr': False, 'use_adx': False, 'use_ema': False, 'use_spike': True, 'rsi_required': True, 'edge_k': 0.3860665356250701, 'edge_cap': 0.7155893647105995, 'bull_strategy': 'mean_reversion', 'bull_bb_std_mult': 1.8658537506620327, 'bull_rsi_os': 42, 'bull_rsi_ob': 68, 'bull_adx_thresh': 25.090366703436562, 'bull_atr_min_pct': 0.015672666780409586, 'bull_atr_max_pct': 0.043268407661231786, 'bull_tp_mult': 1.7430761621123918, 'bull_tsl_mult': 0.1390296232598015, 'bull_time_stop': 196, 'bull_use_sma': False, 'bull_use_ema': True, 'bull_use_atr': True, 'bull_use_adx': True, 'bull_use_spike': True, 'bull_rsi_required': True, 'bear_strategy': 'breakout', 'bear_bb_std_mult': 3.5948347064973736, 'bear_rsi_os': 55, 'bear_rsi_ob': 66, 'bear_adx_thresh': 16.064843344271072, 'bear_atr_min_pct': 0.00370575726020966, 'bear_atr_max_pct': 0.049561794070946456, 'bear_tp_mult': 2.6479126171594185, 'bear_tsl_mult': 0.5406553053093862, 'bear_time_stop': 13, 'bear_use_sma': True, 'bear_use_ema': True, 'bear_use_atr': False, 'bear_use_adx': False, 'bear_use_spike': True, 'bear_rsi_required': True, 'sideways_strategy': 'mean_reversion', 'sideways_bb_std_mult': 1.819556681388812, 'sideways_rsi_os': 17, 'sideways_rsi_ob': 51, 'sideways_adx_thresh': 8.852212350721969, 'sideways_atr_min_pct': 0.024555065696544035, 'sideways_atr_max_pct': 0.09682793188578515, 'sideways_tp_mult': 1.225944770436845, 'sideways_tsl_mult': 0.11639895303072278, 'sideways_time_stop': 32, 'sideways_use_sma': True, 'sideways_use_ema': False, 'sideways_use_atr': False, 'sideways_use_adx': False, 'sideways_use_spike': True, 'sideways_rsi_required': True}.
[I 2025-08-31 09:52:42,393] Trial 11 finished with values: [-1000000000.0, 1000000000.0] and parameters: {'p_sma': 54, 'p_std': 56, 'p_atr': 22, 'p_adx': 8, 'rsi_period': 61, 'ema1': 15, 'ema2': 20, 'slip_atr_k': 0.019462712965080287, 'slip_spread_k': 0.5297382576451408, 'spread_hl_frac': 0.04594660416278892, 'bb_std_mult': 2.84303795857392, 'rsi_os': 41, 'rsi_ob': 73, 'vol_spike': 0.05586600017341729, 'adx_thresh': 30.88872593550023, 'atr_min_pct': 0.022990690390872877, 'atr_max_pct': 0.08991326785760073, 'tp_mult': 2.2260439665549674, 'tsl_mult': 0.5998916667274353, 'strategy': 'mean_reversion', 'time_stop': 24, 'use_sma': True, 'use_atr': True, 'use_adx': False, 'use_ema': True, 'use_spike': True, 'rsi_required': False, 'edge_k': 1.8691815855551055, 'edge_cap': 0.5353923758395571, 'bull_strategy': 'breakout', 'bull_bb_std_mult': 3.0598376738148736, 'bull_rsi_os': 7, 'bull_rsi_ob': 59, 'bull_adx_thresh': 28.560540598331407, 'bull_atr_min_pct': 0.022425132457442543, 'bull_atr_max_pct': 0.06236434509705369, 'bull_tp_mult': 1.868075584132265, 'bull_tsl_mult': 0.16041663738746026, 'bull_time_stop': 177, 'bull_use_sma': False, 'bull_use_ema': True, 'bull_use_atr': False, 'bull_use_adx': True, 'bull_use_spike': True, 'bull_rsi_required': False, 'bear_strategy': 'mean_reversion', 'bear_bb_std_mult': 1.7533358500406822, 'bear_rsi_os': 24, 'bear_rsi_ob': 93, 'bear_adx_thresh': 28.60122457370973, 'bear_atr_min_pct': 0.00626089944571167, 'bear_atr_max_pct': 0.01622134756730566, 'bear_tp_mult': 1.516001222581132, 'bear_tsl_mult': 0.6271446707467948, 'bear_time_stop': 21, 'bear_use_sma': False, 'bear_use_ema': False, 'bear_use_atr': True, 'bear_use_adx': True, 'bear_use_spike': True, 'bear_rsi_required': True, 'sideways_strategy': 'mean_reversion', 'sideways_bb_std_mult': 3.1897987184791097, 'sideways_rsi_os': 51, 'sideways_rsi_ob': 77, 'sideways_adx_thresh': 10.073040192062862, 'sideways_atr_min_pct': 0.005829141710819573, 'sideways_atr_max_pct': 0.09318160463735108, 'sideways_tp_mult': 2.697475752236508, 'sideways_tsl_mult': 0.35513422278849116, 'sideways_time_stop': 256, 'sideways_use_sma': False, 'sideways_use_ema': False, 'sideways_use_atr': False, 'sideways_use_adx': False, 'sideways_use_spike': False, 'sideways_rsi_required': False}.
[I 2025-08-31 09:52:43,193] Trial 10 finished with values: [-1000000000.0, 1000000000.0] and parameters: {'p_sma': 15, 'p_std': 29, 'p_atr': 8, 'p_adx': 7, 'rsi_period': 35, 'ema1': 28, 'ema2': 35, 'slip_atr_k': 0.022801965978252597, 'slip_spread_k': 0.9237930166143071, 'spread_hl_frac': 0.007122726082444686, 'bb_std_mult': 3.4372913947894657, 'rsi_os': 5, 'rsi_ob': 63, 'vol_spike': 0.1726849393856682, 'adx_thresh': 32.00058855583483, 'atr_min_pct': 0.018945196262988278, 'atr_max_pct': 0.06253143817052534, 'tp_mult': 1.5294877152485962, 'tsl_mult': 0.12954003921477342, 'strategy': 'mean_reversion', 'time_stop': 291, 'use_sma': False, 'use_atr': False, 'use_adx': False, 'use_ema': True, 'use_spike': False, 'rsi_required': True, 'edge_k': 0.22326105973963073, 'edge_cap': 0.762376128289204, 'bull_strategy': 'mean_reversion', 'bull_bb_std_mult': 2.139883034063289, 'bull_rsi_os': 24, 'bull_rsi_ob': 54, 'bull_adx_thresh': 21.752354645175757, 'bull_atr_min_pct': 0.02914896061024045, 'bull_atr_max_pct': 0.03523576363128503, 'bull_tp_mult': 2.7573696827164182, 'bull_tsl_mult': 0.004085020295326647, 'bull_time_stop': 110, 'bull_use_sma': False, 'bull_use_ema': False, 'bull_use_atr': False, 'bull_use_adx': False, 'bull_use_spike': True, 'bull_rsi_required': True, 'bear_strategy': 'mean_reversion', 'bear_bb_std_mult': 2.4653127133156607, 'bear_rsi_os': 22, 'bear_rsi_ob': 74, 'bear_adx_thresh': 20.85021517646461, 'bear_atr_min_pct': 0.011578586077143507, 'bear_atr_max_pct': 0.04171131384921848, 'bear_tp_mult': 2.3657473404088707, 'bear_tsl_mult': 0.19020121693744974, 'bear_time_stop': 207, 'bear_use_sma': False, 'bear_use_ema': True, 'bear_use_atr': True, 'bear_use_adx': True, 'bear_use_spike': False, 'bear_rsi_required': False, 'sideways_strategy': 'breakout', 'sideways_bb_std_mult': 1.8232032510143652, 'sideways_rsi_os': 54, 'sideways_rsi_ob': 91, 'sideways_adx_thresh': 29.70725022418408, 'sideways_atr_min_pct': 0.0009996764239270039, 'sideways_atr_max_pct': 0.1466362045025766, 'sideways_tp_mult': 1.1316442965319171, 'sideways_tsl_mult': 0.1291676246891159, 'sideways_time_stop': 300, 'sideways_use_sma': True, 'sideways_use_ema': False, 'sideways_use_atr': False, 'sideways_use_adx': False, 'sideways_use_spike': False, 'sideways_rsi_required': True}.
[I 2025-08-31 09:52:43,386] Trial 12 finished with values: [-1000000000.0, 1000000000.0] and parameters: {'p_sma': 59, 'p_std': 50, 'p_atr': 18, 'p_adx': 12, 'rsi_period': 63, 'ema1': 10, 'ema2': 44, 'slip_atr_k': 0.13080044312402017, 'slip_spread_k': 0.5332818560539179, 'spread_hl_frac': 0.03561606507970438, 'bb_std_mult': 0.9663742728053635, 'rsi_os': 41, 'rsi_ob': 89, 'vol_spike': 0.0619817874189698, 'adx_thresh': 9.292858245930118, 'atr_min_pct': 0.02831805458652324, 'atr_max_pct': 0.14934578321485756, 'tp_mult': 1.0688179035363317, 'tsl_mult': 0.4209635735628863, 'strategy': 'mean_reversion', 'time_stop': 157, 'use_sma': False, 'use_atr': False, 'use_adx': True, 'use_ema': True, 'use_spike': True, 'rsi_required': True, 'edge_k': 0.6392094385512941, 'edge_cap': 0.3705644374269268, 'bull_strategy': 'mean_reversion', 'bull_bb_std_mult': 2.292864053796368, 'bull_rsi_os': 17, 'bull_rsi_ob': 83, 'bull_adx_thresh': 11.741121839646633, 'bull_atr_min_pct': 0.003586082587910382, 'bull_atr_max_pct': 0.09857365509618202, 'bull_tp_mult': 2.912293377631393, 'bull_tsl_mult': 0.8661921263780364, 'bull_time_stop': 124, 'bull_use_sma': False, 'bull_use_ema': False, 'bull_use_atr': True, 'bull_use_adx': True, 'bull_use_spike': False, 'bull_rsi_required': False, 'bear_strategy': 'mean_reversion', 'bear_bb_std_mult': 2.741056715111869, 'bear_rsi_os': 15, 'bear_rsi_ob': 68, 'bear_adx_thresh': 21.570312416718902, 'bear_atr_min_pct': 0.00019825988152168405, 'bear_atr_max_pct': 0.015617157375646224, 'bear_tp_mult': 2.0535187611835486, 'bear_tsl_mult': 0.5847335347080984, 'bear_time_stop': 178, 'bear_use_sma': True, 'bear_use_ema': False, 'bear_use_atr': True, 'bear_use_adx': False, 'bear_use_spike': False, 'bear_rsi_required': True, 'sideways_strategy': 'mean_reversion', 'sideways_bb_std_mult': 0.6327985132361282, 'sideways_rsi_os': 21, 'sideways_rsi_ob': 55, 'sideways_adx_thresh': 16.4059934026257, 'sideways_atr_min_pct': 0.018616268915332808, 'sideways_atr_max_pct': 0.02599146472007968, 'sideways_tp_mult': 1.472667028509672, 'sideways_tsl_mult': 0.16509393101786984, 'sideways_time_stop': 242, 'sideways_use_sma': True, 'sideways_use_ema': True, 'sideways_use_atr': False, 'sideways_use_adx': True, 'sideways_use_spike': False, 'sideways_rsi_required': True}.
[I 2025-08-31 09:52:43,967] Trial 13 finished with values: [-0.024725025716096805, 0.024333738011089314] and parameters: {'p_sma': 6, 'p_std': 23, 'p_atr': 7, 'p_adx': 15, 'rsi_period': 84, 'ema1': 15, 'ema2': 27, 'slip_atr_k': 0.21798213049912551, 'slip_spread_k': 0.4386236247261631, 'spread_hl_frac': 0.013827595774641998, 'bb_std_mult': 3.582820291734078, 'rsi_os': 20, 'rsi_ob': 94, 'vol_spike': 0.014942869215729758, 'adx_thresh': 17.97668789293116, 'atr_min_pct': 0.020529025265928327, 'atr_max_pct': 0.14881036319189078, 'tp_mult': 1.1657523055974504, 'tsl_mult': 0.40237677753223944, 'strategy': 'breakout', 'time_stop': 262, 'use_sma': True, 'use_atr': False, 'use_adx': True, 'use_ema': False, 'use_spike': False, 'rsi_required': True, 'edge_k': 1.8665766842511706, 'edge_cap': 0.9889565960130093, 'bull_strategy': 'mean_reversion', 'bull_bb_std_mult': 1.3840830942805882, 'bull_rsi_os': 34, 'bull_rsi_ob': 79, 'bull_adx_thresh': 5.672653556862137, 'bull_atr_min_pct': 0.003892503737176551, 'bull_atr_max_pct': 0.08932672259861615, 'bull_tp_mult': 2.8248899683002278, 'bull_tsl_mult': 0.7699092828374114, 'bull_time_stop': 189, 'bull_use_sma': True, 'bull_use_ema': True, 'bull_use_atr': False, 'bull_use_adx': False, 'bull_use_spike': True, 'bull_rsi_required': False, 'bear_strategy': 'breakout', 'bear_bb_std_mult': 3.2514519265368507, 'bear_rsi_os': 7, 'bear_rsi_ob': 50, 'bear_adx_thresh': 32.99438936093075, 'bear_atr_min_pct': 6.266503948551203e-05, 'bear_atr_max_pct': 0.1000551275218318, 'bear_tp_mult': 1.7662871931248505, 'bear_tsl_mult': 0.31078582876733946, 'bear_time_stop': 112, 'bear_use_sma': False, 'bear_use_ema': False, 'bear_use_atr': True, 'bear_use_adx': False, 'bear_use_spike': False, 'bear_rsi_required': False, 'sideways_strategy': 'breakout', 'sideways_bb_std_mult': 3.4937707312833965, 'sideways_rsi_os': 9, 'sideways_rsi_ob': 95, 'sideways_adx_thresh': 17.585661182866115, 'sideways_atr_min_pct': 0.015920595040688122, 'sideways_atr_max_pct': 0.010746607912715186, 'sideways_tp_mult': 2.4399069673424756, 'sideways_tsl_mult': 0.4513313991079051, 'sideways_time_stop': 108, 'sideways_use_sma': False, 'sideways_use_ema': True, 'sideways_use_atr': True, 'sideways_use_adx': False, 'sideways_use_spike': True, 'sideways_rsi_required': False}.
[I 2025-08-31 09:52:43,967] Trial 15 finished with values: [-1000000000.0, 1000000000.0] and parameters: {'p_sma': 27, 'p_std': 22, 'p_atr': 29, 'p_adx': 16, 'rsi_period': 83, 'ema1': 30, 'ema2': 27, 'slip_atr_k': 0.22970184655336856, 'slip_spread_k': 0.7107466153318747, 'spread_hl_frac': 0.014825678390779397, 'bb_std_mult': 3.574754788955156, 'rsi_os': 20, 'rsi_ob': 94, 'vol_spike': 0.29736925453599083, 'adx_thresh': 15.046768760268069, 'atr_min_pct': 0.028510929233241812, 'atr_max_pct': 0.010547382948192616, 'tp_mult': 1.0139231956695656, 'tsl_mult': 0.3793363864801183, 'strategy': 'breakout', 'time_stop': 209, 'use_sma': True, 'use_atr': False, 'use_adx': True, 'use_ema': False, 'use_spike': False, 'rsi_required': True, 'edge_k': 1.3801429255017277, 'edge_cap': 0.9583278603016878, 'bull_strategy': 'mean_reversion', 'bull_bb_std_mult': 2.6943021373198146, 'bull_rsi_os': 55, 'bull_rsi_ob': 95, 'bull_adx_thresh': 5.243954767951383, 'bull_atr_min_pct': 2.3929902390083455e-05, 'bull_atr_max_pct': 0.012919932876175586, 'bull_tp_mult': 2.935884830921841, 'bull_tsl_mult': 0.7407979570314145, 'bull_time_stop': 10, 'bull_use_sma': True, 'bull_use_ema': True, 'bull_use_atr': False, 'bull_use_adx': False, 'bull_use_spike': False, 'bull_rsi_required': False, 'bear_strategy': 'breakout', 'bear_bb_std_mult': 3.0326661573325913, 'bear_rsi_os': 5, 'bear_rsi_ob': 50, 'bear_adx_thresh': 33.339475778864525, 'bear_atr_min_pct': 0.02965650426460582, 'bear_atr_max_pct': 0.09228569446226657, 'bear_tp_mult': 1.8052467861722667, 'bear_tsl_mult': 0.325698488379231, 'bear_time_stop': 119, 'bear_use_sma': True, 'bear_use_ema': False, 'bear_use_atr': True, 'bear_use_adx': False, 'bear_use_spike': False, 'bear_rsi_required': False, 'sideways_strategy': 'breakout', 'sideways_bb_std_mult': 0.5489420318805536, 'sideways_rsi_os': 7, 'sideways_rsi_ob': 49, 'sideways_adx_thresh': 18.021569404723262, 'sideways_atr_min_pct': 0.015696521230603753, 'sideways_atr_max_pct': 0.010455968277663194, 'sideways_tp_mult': 2.123098305208106, 'sideways_tsl_mult': 0.6448200486899789, 'sideways_time_stop': 100, 'sideways_use_sma': False, 'sideways_use_ema': True, 'sideways_use_atr': False, 'sideways_use_adx': True, 'sideways_use_spike': True, 'sideways_rsi_required': False}.
[I 2025-08-31 09:52:43,974] Trial 16 finished with values: [-1000000000.0, 1000000000.0] and parameters: {'p_sma': 7, 'p_std': 25, 'p_atr': 28, 'p_adx': 18, 'rsi_period': 84, 'ema1': 5, 'ema2': 28, 'slip_atr_k': 0.2489575759673524, 'slip_spread_k': 0.7253450135027173, 'spread_hl_frac': 0.016295069057027965, 'bb_std_mult': 3.361688787805053, 'rsi_os': 20, 'rsi_ob': 56, 'vol_spike': 0.0023345757751716545, 'adx_thresh': 16.359582811194954, 'atr_min_pct': 0.022590577498698788, 'atr_max_pct': 0.014942076264027368, 'tp_mult': 1.474129203609977, 'tsl_mult': 0.4082350385730299, 'strategy': 'breakout', 'time_stop': 233, 'use_sma': True, 'use_atr': False, 'use_adx': True, 'use_ema': False, 'use_spike': False, 'rsi_required': True, 'edge_k': 1.444967108651162, 'edge_cap': 0.973241471488937, 'bull_strategy': 'mean_reversion', 'bull_bb_std_mult': 1.397038057684706, 'bull_rsi_os': 54, 'bull_rsi_ob': 94, 'bull_adx_thresh': 5.125220445750429, 'bull_atr_min_pct': 0.007747041252510514, 'bull_atr_max_pct': 0.019247097284999785, 'bull_tp_mult': 1.0707176522699773, 'bull_tsl_mult': 0.6984945594990569, 'bull_time_stop': 11, 'bull_use_sma': True, 'bull_use_ema': True, 'bull_use_atr': False, 'bull_use_adx': False, 'bull_use_spike': False, 'bull_rsi_required': True, 'bear_strategy': 'breakout', 'bear_bb_std_mult': 3.4598437228494157, 'bear_rsi_os': 6, 'bear_rsi_ob': 48, 'bear_adx_thresh': 5.643935047010693, 'bear_atr_min_pct': 0.02811958340644312, 'bear_atr_max_pct': 0.08916748298878668, 'bear_tp_mult': 1.7433943148371593, 'bear_tsl_mult': 0.3897115303564432, 'bear_time_stop': 106, 'bear_use_sma': True, 'bear_use_ema': False, 'bear_use_atr': True, 'bear_use_adx': False, 'bear_use_spike': False, 'bear_rsi_required': False, 'sideways_strategy': 'breakout', 'sideways_bb_std_mult': 1.1667328315823877, 'sideways_rsi_os': 39, 'sideways_rsi_ob': 46, 'sideways_adx_thresh': 21.435376815670306, 'sideways_atr_min_pct': 0.01291152642269311, 'sideways_atr_max_pct': 0.018942838549718254, 'sideways_tp_mult': 2.1151107870821297, 'sideways_tsl_mult': 0.6339101732347172, 'sideways_time_stop': 112, 'sideways_use_sma': False, 'sideways_use_ema': True, 'sideways_use_atr': True, 'sideways_use_adx': True, 'sideways_use_spike': True, 'sideways_rsi_required': False}.
[I 2025-08-31 09:53:20,802] Trial 14 finished with values: [-0.00857866829678966, 0.008486790340954944] and parameters: {'p_sma': 7, 'p_std': 24, 'p_atr': 29, 'p_adx': 15, 'rsi_period': 84, 'ema1': 29, 'ema2': 28, 'slip_atr_k': 0.23427731855861378, 'slip_spread_k': 0.9963186998940371, 'spread_hl_frac': 0.015071503961851095, 'bb_std_mult': 3.590060307040945, 'rsi_os': 17, 'rsi_ob': 57, 'vol_spike': 0.2873662747900438, 'adx_thresh': 15.356149314200596, 'atr_min_pct': 0.02975531155002619, 'atr_max_pct': 0.14987255387267784, 'tp_mult': 1.33247890794194, 'tsl_mult': 0.005826571793205726, 'strategy': 'breakout', 'time_stop': 293, 'use_sma': True, 'use_atr': False, 'use_adx': True, 'use_ema': False, 'use_spike': False, 'rsi_required': True, 'edge_k': 1.3531917326726284, 'edge_cap': 0.9797879972350171, 'bull_strategy': 'mean_reversion', 'bull_bb_std_mult': 2.6892953217460227, 'bull_rsi_os': 30, 'bull_rsi_ob': 95, 'bull_adx_thresh': 33.34406326446084, 'bull_atr_min_pct': 0.0002570902851925308, 'bull_atr_max_pct': 0.012389169247216794, 'bull_tp_mult': 2.882512973363443, 'bull_tsl_mult': 0.7338495971897085, 'bull_time_stop': 22, 'bull_use_sma': True, 'bull_use_ema': False, 'bull_use_atr': False, 'bull_use_adx': False, 'bull_use_spike': False, 'bull_rsi_required': True, 'bear_strategy': 'breakout', 'bear_bb_std_mult': 2.8039498079118053, 'bear_rsi_os': 11, 'bear_rsi_ob': 46, 'bear_adx_thresh': 6.444349926816624, 'bear_atr_min_pct': 0.02887346432638402, 'bear_atr_max_pct': 0.09338804539161605, 'bear_tp_mult': 1.923820205766795, 'bear_tsl_mult': 0.25939186746699294, 'bear_time_stop': 124, 'bear_use_sma': True, 'bear_use_ema': False, 'bear_use_atr': True, 'bear_use_adx': False, 'bear_use_spike': False, 'bear_rsi_required': False, 'sideways_strategy': 'breakout', 'sideways_bb_std_mult': 0.5086274446651131, 'sideways_rsi_os': 7, 'sideways_rsi_ob': 46, 'sideways_adx_thresh': 20.09366908220087, 'sideways_atr_min_pct': 0.01614386093539117, 'sideways_atr_max_pct': 0.01551833818206444, 'sideways_tp_mult': 2.0048400001829902, 'sideways_tsl_mult': 0.6411794166971644, 'sideways_time_stop': 112, 'sideways_use_sma': False, 'sideways_use_ema': True, 'sideways_use_atr': False, 'sideways_use_adx': True, 'sideways_use_spike': True, 'sideways_rsi_required': False}.
[I 2025-08-31 09:53:22,215] Trial 19 finished with values: [-1000000000.0, 1000000000.0] and parameters: {'p_sma': 6, 'p_std': 18, 'p_atr': 11, 'p_adx': 14, 'rsi_period': 73, 'ema1': 16, 'ema2': 29, 'slip_atr_k': 0.18225488581011168, 'slip_spread_k': 0.375582897276108, 'spread_hl_frac': 0.00980908856842547, 'bb_std_mult': 3.1468334428013276, 'rsi_os': 24, 'rsi_ob': 79, 'vol_spike': 0.009688567231331808, 'adx_thresh': 18.347550725139655, 'atr_min_pct': 0.021051860882529867, 'atr_max_pct': 0.14710212606623146, 'tp_mult': 1.2924457078403275, 'tsl_mult': 0.01788663656178069, 'strategy': 'breakout', 'time_stop': 300, 'use_sma': True, 'use_atr': False, 'use_adx': True, 'use_ema': False, 'use_spike': False, 'rsi_required': True, 'edge_k': 1.8873755533743466, 'edge_cap': 0.8893609250963636, 'bull_strategy': 'mean_reversion', 'bull_bb_std_mult': 1.28388840729328, 'bull_rsi_os': 34, 'bull_rsi_ob': 73, 'bull_adx_thresh': 8.768446661607577, 'bull_atr_min_pct': 0.0067733325791108755, 'bull_atr_max_pct': 0.08845205455340241, 'bull_tp_mult': 2.4924155727329933, 'bull_tsl_mult': 0.6090873935007131, 'bull_time_stop': 211, 'bull_use_sma': True, 'bull_use_ema': True, 'bull_use_atr': False, 'bull_use_adx': False, 'bull_use_spike': True, 'bull_rsi_required': False, 'bear_strategy': 'breakout', 'bear_bb_std_mult': 3.10195554562711, 'bear_rsi_os': 12, 'bear_rsi_ob': 55, 'bear_adx_thresh': 28.505330978519183, 'bear_atr_min_pct': 0.00030882090754688965, 'bear_atr_max_pct': 0.11857673792916573, 'bear_tp_mult': 1.6852834485245705, 'bear_tsl_mult': 0.767559006323951, 'bear_time_stop': 68, 'bear_use_sma': False, 'bear_use_ema': False, 'bear_use_atr': True, 'bear_use_adx': False, 'bear_use_spike': False, 'bear_rsi_required': False, 'sideways_strategy': 'breakout', 'sideways_bb_std_mult': 2.554436112228397, 'sideways_rsi_os': 5, 'sideways_rsi_ob': 95, 'sideways_adx_thresh': 15.102409448800767, 'sideways_atr_min_pct': 0.010540386185013045, 'sideways_atr_max_pct': 0.030366519035575114, 'sideways_tp_mult': 2.44952230328375, 'sideways_tsl_mult': 0.3407727106105895, 'sideways_time_stop': 182, 'sideways_use_sma': False, 'sideways_use_ema': True, 'sideways_use_atr': True, 'sideways_use_adx': False, 'sideways_use_spike': True, 'sideways_rsi_required': False}.
