[I 2025-08-31 10:42:28,868] Trial 416 finished with values: [-1000000000.0, 1000000000.0] and parameters: {'p_sma': 24, 'p_std': 37, 'p_atr': 22, 'p_adx': 20, 'rsi_period': 40, 'ema1': 28, 'ema2': 58, 'slip_atr_k': 0.041237480001324156, 'slip_spread_k': 0.39656422923870716, 'spread_hl_frac': 0.032814380701286464, 'bb_std_mult': 2.557414438690895, 'rsi_os': 18, 'rsi_ob': 91, 'vol_spike': 0.21907480533113113, 'adx_thresh': 9.16648761997694, 'atr_min_pct': 0.019923752080240352, 'atr_max_pct': 0.04242124732767063, 'tp_mult': 2.828287651298561, 'tsl_mult': 0.6805992080859735, 'strategy': 'mean_reversion', 'time_stop': 216, 'use_sma': False, 'use_atr': False, 'use_adx': False, 'use_ema': False, 'use_spike': False, 'rsi_required': False, 'edge_k': 1.7318611018291885, 'edge_cap': 0.8251607452581888, 'bull_strategy': 'breakout', 'bull_bb_std_mult': 2.630271219296097, 'bull_rsi_os': 33, 'bull_rsi_ob': 63, 'bull_adx_thresh': 9.296725506379707, 'bull_atr_min_pct': 0.023583268096435798, 'bull_atr_max_pct': 0.06759215479741278, 'bull_tp_mult': 2.7926382679536546, 'bull_tsl_mult': 0.03133651490858792, 'bull_time_stop': 20, 'bull_use_sma': False, 'bull_use_ema': True, 'bull_use_atr': False, 'bull_use_adx': True, 'bull_use_spike': True, 'bull_rsi_required': False, 'bear_strategy': 'breakout', 'bear_bb_std_mult': 2.4391516939200715, 'bear_rsi_os': 17, 'bear_rsi_ob': 49, 'bear_adx_thresh': 8.80907351035553, 'bear_atr_min_pct': 0.017793982714631822, 'bear_atr_max_pct': 0.13661932239948454, 'bear_tp_mult': 2.7097217123127773, 'bear_tsl_mult': 0.6923911885995524, 'bear_time_stop': 237, 'bear_use_sma': False, 'bear_use_ema': False, 'bear_use_atr': True, 'bear_use_adx': False, 'bear_use_spike': True, 'bear_rsi_required': True, 'sideways_strategy': 'mean_reversion', 'sideways_bb_std_mult': 2.616297168855533, 'sideways_rsi_os': 19, 'sideways_rsi_ob': 79, 'sideways_adx_thresh': 10.935765841190133, 'sideways_atr_min_pct': 0.0014728009436727936, 'sideways_atr_max_pct': 0.012599615850682665, 'sideways_tp_mult': 1.2844900409415945, 'sideways_tsl_mult': 0.705005462291528, 'sideways_time_stop': 194, 'sideways_use_sma': True, 'sideways_use_ema': False, 'sideways_use_atr': False, 'sideways_use_adx': False, 'sideways_use_spike': True, 'sideways_rsi_required': False}.
[I 2025-08-31 10:42:29,114] Trial 417 finished with values: [-1000000000.0, 1000000000.0] and parameters: {'p_sma': 11, 'p_std': 36, 'p_atr': 26, 'p_adx': 22, 'rsi_period': 21, 'ema1': 21, 'ema2': 58, 'slip_atr_k': 0.04383377763980838, 'slip_spread_k': 0.27484149327603546, 'spread_hl_frac': 0.03286621581931626, 'bb_std_mult': 2.571267816118852, 'rsi_os': 44, 'rsi_ob': 78, 'vol_spike': 0.04908956561190672, 'adx_thresh': 34.20272561277394, 'atr_min_pct': 0.019746185442743636, 'atr_max_pct': 0.04206914926432401, 'tp_mult': 2.85282621033171, 'tsl_mult': 0.6875735783207051, 'strategy': 'mean_reversion', 'time_stop': 145, 'use_sma': False, 'use_atr': True, 'use_adx': False, 'use_ema': True, 'use_spike': False, 'rsi_required': True, 'edge_k': 1.5597770059909855, 'edge_cap': 0.3003312914086693, 'bull_strategy': 'breakout', 'bull_bb_std_mult': 2.6382341233320052, 'bull_rsi_os': 40, 'bull_rsi_ob': 76, 'bull_adx_thresh': 9.225523268782645, 'bull_atr_min_pct': 0.0036651677933586405, 'bull_atr_max_pct': 0.0301579237102046, 'bull_tp_mult': 2.727781970011733, 'bull_tsl_mult': 0.030562054636747715, 'bull_time_stop': 21, 'bull_use_sma': False, 'bull_use_ema': True, 'bull_use_atr': False, 'bull_use_adx': True, 'bull_use_spike': True, 'bull_rsi_required': False, 'bear_strategy': 'breakout', 'bear_bb_std_mult': 2.1682969811689996, 'bear_rsi_os': 12, 'bear_rsi_ob': 54, 'bear_adx_thresh': 13.347934337627596, 'bear_atr_min_pct': 0.02361786722373592, 'bear_atr_max_pct': 0.1481037810496163, 'bear_tp_mult': 2.5631947877485515, 'bear_tsl_mult': 0.11878384176627399, 'bear_time_stop': 35, 'bear_use_sma': True, 'bear_use_ema': False, 'bear_use_atr': True, 'bear_use_adx': False, 'bear_use_spike': True, 'bear_rsi_required': True, 'sideways_strategy': 'breakout', 'sideways_bb_std_mult': 2.630295105593476, 'sideways_rsi_os': 20, 'sideways_rsi_ob': 85, 'sideways_adx_thresh': 14.526932629008382, 'sideways_atr_min_pct': 0.005567917805561122, 'sideways_atr_max_pct': 0.07701242936657016, 'sideways_tp_mult': 1.3222265501018682, 'sideways_tsl_mult': 0.8770497991074953, 'sideways_time_stop': 58, 'sideways_use_sma': True, 'sideways_use_ema': False, 'sideways_use_atr': False, 'sideways_use_adx': True, 'sideways_use_spike': True, 'sideways_rsi_required': False}.
[I 2025-08-31 10:42:29,370] Trial 415 finished with values: [-0.10174554545724146, 0.10167242256431656] and parameters: {'p_sma': 45, 'p_std': 37, 'p_atr': 17, 'p_adx': 25, 'rsi_period': 21, 'ema1': 28, 'ema2': 58, 'slip_atr_k': 0.11223543569793505, 'slip_spread_k': 0.3944566103054927, 'spread_hl_frac': 0.02517876258180785, 'bb_std_mult': 2.5724193453771553, 'rsi_os': 44, 'rsi_ob': 84, 'vol_spike': 0.22173570350267185, 'adx_thresh': 9.056608169563923, 'atr_min_pct': 0.019902864532585322, 'atr_max_pct': 0.042840812360892065, 'tp_mult': 1.4415833674651464, 'tsl_mult': 0.6868467223544833, 'strategy': 'mean_reversion', 'time_stop': 235, 'use_sma': False, 'use_atr': False, 'use_adx': False, 'use_ema': False, 'use_spike': False, 'rsi_required': False, 'edge_k': 1.749121497240325, 'edge_cap': 0.8249419694728976, 'bull_strategy': 'breakout', 'bull_bb_std_mult': 1.2295699938201494, 'bull_rsi_os': 44, 'bull_rsi_ob': 64, 'bull_adx_thresh': 10.449833347805857, 'bull_atr_min_pct': 0.00442752425754111, 'bull_atr_max_pct': 0.04807919462394264, 'bull_tp_mult': 2.802908050309584, 'bull_tsl_mult': 0.0257750661021888, 'bull_time_stop': 63, 'bull_use_sma': False, 'bull_use_ema': True, 'bull_use_atr': False, 'bull_use_adx': True, 'bull_use_spike': True, 'bull_rsi_required': False, 'bear_strategy': 'breakout', 'bear_bb_std_mult': 2.1600762998150524, 'bear_rsi_os': 30, 'bear_rsi_ob': 54, 'bear_adx_thresh': 29.709789815087625, 'bear_atr_min_pct': 0.011936997598967956, 'bear_atr_max_pct': 0.1178887707356419, 'bear_tp_mult': 1.872187613703662, 'bear_tsl_mult': 0.16710588978913643, 'bear_time_stop': 35, 'bear_use_sma': False, 'bear_use_ema': False, 'bear_use_atr': True, 'bear_use_adx': False, 'bear_use_spike': True, 'bear_rsi_required': True, 'sideways_strategy': 'mean_reversion', 'sideways_bb_std_mult': 2.614679633892564, 'sideways_rsi_os': 35, 'sideways_rsi_ob': 85, 'sideways_adx_thresh': 11.048966853011532, 'sideways_atr_min_pct': 0.0013306004299375009, 'sideways_atr_max_pct': 0.012583381537269317, 'sideways_tp_mult': 1.292843921036101, 'sideways_tsl_mult': 0.8827217605512094, 'sideways_time_stop': 267, 'sideways_use_sma': True, 'sideways_use_ema': False, 'sideways_use_atr': False, 'sideways_use_adx': False, 'sideways_use_spike': True, 'sideways_rsi_required': False}.
[I 2025-08-31 10:42:29,498] Trial 414 finished with values: [0.0001293701558688909, 0.0014755458081778562] and parameters: {'p_sma': 44, 'p_std': 37, 'p_atr': 22, 'p_adx': 20, 'rsi_period': 40, 'ema1': 22, 'ema2': 58, 'slip_atr_k': 0.000729048732765275, 'slip_spread_k': 0.2780126060262142, 'spread_hl_frac': 0.0250393591616544, 'bb_std_mult': 2.5457871325719093, 'rsi_os': 35, 'rsi_ob': 75, 'vol_spike': 0.22012920603168248, 'adx_thresh': 8.838951684728613, 'atr_min_pct': 0.019706128180274042, 'atr_max_pct': 0.04141243856689719, 'tp_mult': 2.832547027833226, 'tsl_mult': 0.6857294392338662, 'strategy': 'mean_reversion', 'time_stop': 153, 'use_sma': False, 'use_atr': False, 'use_adx': False, 'use_ema': False, 'use_spike': False, 'rsi_required': False, 'edge_k': 1.7476467160368447, 'edge_cap': 0.1764886448238349, 'bull_strategy': 'breakout', 'bull_bb_std_mult': 3.526533335000761, 'bull_rsi_os': 44, 'bull_rsi_ob': 77, 'bull_adx_thresh': 10.486870586075518, 'bull_atr_min_pct': 0.003849532153662256, 'bull_atr_max_pct': 0.04311556674207607, 'bull_tp_mult': 2.8566322214713415, 'bull_tsl_mult': 0.1180327687654025, 'bull_time_stop': 62, 'bull_use_sma': False, 'bull_use_ema': True, 'bull_use_atr': False, 'bull_use_adx': True, 'bull_use_spike': True, 'bull_rsi_required': False, 'bear_strategy': 'breakout', 'bear_bb_std_mult': 1.4128066729574034, 'bear_rsi_os': 23, 'bear_rsi_ob': 55, 'bear_adx_thresh': 13.780774854555345, 'bear_atr_min_pct': 0.02503577727221183, 'bear_atr_max_pct': 0.13752845189902843, 'bear_tp_mult': 2.711367862497672, 'bear_tsl_mult': 0.11693295852420796, 'bear_time_stop': 35, 'bear_use_sma': False, 'bear_use_ema': False, 'bear_use_atr': True, 'bear_use_adx': False, 'bear_use_spike': True, 'bear_rsi_required': True, 'sideways_strategy': 'mean_reversion', 'sideways_bb_std_mult': 2.6252618945586494, 'sideways_rsi_os': 35, 'sideways_rsi_ob': 58, 'sideways_adx_thresh': 14.312963459784577, 'sideways_atr_min_pct': 0.005409524727959817, 'sideways_atr_max_pct': 0.012671850144509039, 'sideways_tp_mult': 1.9058804141589545, 'sideways_tsl_mult': 0.8782429103030323, 'sideways_time_stop': 266, 'sideways_use_sma': True, 'sideways_use_ema': False, 'sideways_use_atr': False, 'sideways_use_adx': False, 'sideways_use_spike': True, 'sideways_rsi_required': False}.
[I 2025-08-31 10:43:00,197] Trial 419 finished with values: [-0.021996995259756624, 0.02195857206458169] and parameters: {'p_sma': 45, 'p_std': 59, 'p_atr': 17, 'p_adx': 18, 'rsi_period': 48, 'ema1': 13, 'ema2': 51, 'slip_atr_k': 0.15988005747891804, 'slip_spread_k': 0.6178866900265032, 'spread_hl_frac': 0.04989521565819863, 'bb_std_mult': 1.2709041911470849, 'rsi_os': 35, 'rsi_ob': 75, 'vol_spike': 0.12754175050910158, 'adx_thresh': 7.770252113822554, 'atr_min_pct': 0.018114635756948206, 'atr_max_pct': 0.04226053117813798, 'tp_mult': 2.7524742769896795, 'tsl_mult': 0.6585519447356788, 'strategy': 'breakout', 'time_stop': 210, 'use_sma': False, 'use_atr': False, 'use_adx': True, 'use_ema': False, 'use_spike': True, 'rsi_required': True, 'edge_k': 1.7495269956898158, 'edge_cap': 0.19034604723570325, 'bull_strategy': 'breakout', 'bull_bb_std_mult': 1.2275683253876777, 'bull_rsi_os': 44, 'bull_rsi_ob': 77, 'bull_adx_thresh': 7.050897956216273, 'bull_atr_min_pct': 0.0018868804519066914, 'bull_atr_max_pct': 0.07138791564442751, 'bull_tp_mult': 1.0939913180160947, 'bull_tsl_mult': 0.11727253081667782, 'bull_time_stop': 149, 'bull_use_sma': True, 'bull_use_ema': True, 'bull_use_atr': True, 'bull_use_adx': True, 'bull_use_spike': False, 'bull_rsi_required': False, 'bear_strategy': 'breakout', 'bear_bb_std_mult': 1.4928473094771257, 'bear_rsi_os': 24, 'bear_rsi_ob': 58, 'bear_adx_thresh': 19.89918898461537, 'bear_atr_min_pct': 0.016316018453202998, 'bear_atr_max_pct': 0.02116632385715686, 'bear_tp_mult': 1.1735101300937347, 'bear_tsl_mult': 0.8191333674785468, 'bear_time_stop': 211, 'bear_use_sma': False, 'bear_use_ema': False, 'bear_use_atr': True, 'bear_use_adx': True, 'bear_use_spike': False, 'bear_rsi_required': True, 'sideways_strategy': 'breakout', 'sideways_bb_std_mult': 2.5689769494118995, 'sideways_rsi_os': 17, 'sideways_rsi_ob': 59, 'sideways_adx_thresh': 14.310525364748536, 'sideways_atr_min_pct': 0.014424997103446956, 'sideways_atr_max_pct': 0.013094499530289896, 'sideways_tp_mult': 1.2297431164877628, 'sideways_tsl_mult': 0.8142544253659248, 'sideways_time_stop': 274, 'sideways_use_sma': True, 'sideways_use_ema': False, 'sideways_use_atr': False, 'sideways_use_adx': False, 'sideways_use_spike': False, 'sideways_rsi_required': False}.
[I 2025-08-31 10:43:00,882] Trial 420 finished with values: [-1000000000.0, 1000000000.0] and parameters: {'p_sma': 47, 'p_std': 49, 'p_atr': 9, 'p_adx': 9, 'rsi_period': 27, 'ema1': 13, 'ema2': 59, 'slip_atr_k': 0.06263149590488225, 'slip_spread_k': 0.8305114172934966, 'spread_hl_frac': 0.02844063718856777, 'bb_std_mult': 1.2847461565673925, 'rsi_os': 41, 'rsi_ob': 75, 'vol_spike': 0.2102542806215037, 'adx_thresh': 7.917815896125652, 'atr_min_pct': 0.018224432803197417, 'atr_max_pct': 0.041718097706860365, 'tp_mult': 2.761894430520267, 'tsl_mult': 0.6364448499187486, 'strategy': 'breakout', 'time_stop': 124, 'use_sma': False, 'use_atr': True, 'use_adx': True, 'use_ema': True, 'use_spike': True, 'rsi_required': True, 'edge_k': 1.6722867230795673, 'edge_cap': 0.11533251156822247, 'bull_strategy': 'breakout', 'bull_bb_std_mult': 1.013497355759718, 'bull_rsi_os': 43, 'bull_rsi_ob': 78, 'bull_adx_thresh': 23.77497292902477, 'bull_atr_min_pct': 0.021338855472650874, 'bull_atr_max_pct': 0.0833722788761007, 'bull_tp_mult': 2.1916500701245893, 'bull_tsl_mult': 0.12033344853529937, 'bull_time_stop': 15, 'bull_use_sma': True, 'bull_use_ema': True, 'bull_use_atr': True, 'bull_use_adx': True, 'bull_use_spike': False, 'bull_rsi_required': False, 'bear_strategy': 'breakout', 'bear_bb_std_mult': 2.0639786496714243, 'bear_rsi_os': 27, 'bear_rsi_ob': 76, 'bear_adx_thresh': 9.140610389043196, 'bear_atr_min_pct': 0.01635330184189501, 'bear_atr_max_pct': 0.09708573752434402, 'bear_tp_mult': 2.4806309439843828, 'bear_tsl_mult': 0.8214727736190602, 'bear_time_stop': 41, 'bear_use_sma': False, 'bear_use_ema': False, 'bear_use_atr': True, 'bear_use_adx': True, 'bear_use_spike': False, 'bear_rsi_required': True, 'sideways_strategy': 'breakout', 'sideways_bb_std_mult': 0.7327227200986755, 'sideways_rsi_os': 35, 'sideways_rsi_ob': 82, 'sideways_adx_thresh': 28.534944291106328, 'sideways_atr_min_pct': 0.003541538917518793, 'sideways_atr_max_pct': 0.05087419919278873, 'sideways_tp_mult': 1.2384075259392666, 'sideways_tsl_mult': 0.8151023879785749, 'sideways_time_stop': 274, 'sideways_use_sma': True, 'sideways_use_ema': False, 'sideways_use_atr': False, 'sideways_use_adx': False, 'sideways_use_spike': False, 'sideways_rsi_required': False}.
[I 2025-08-31 10:43:01,117] Trial 421 finished with values: [-1000000000.0, 1000000000.0] and parameters: {'p_sma': 44, 'p_std': 39, 'p_atr': 22, 'p_adx': 18, 'rsi_period': 41, 'ema1': 22, 'ema2': 55, 'slip_atr_k': 0.0007822267563536583, 'slip_spread_k': 0.6126484552801958, 'spread_hl_frac': 0.02327130558411357, 'bb_std_mult': 2.2096455270672406, 'rsi_os': 35, 'rsi_ob': 69, 'vol_spike': 0.2300127492419742, 'adx_thresh': 29.139069910409532, 'atr_min_pct': 0.021950355798516005, 'atr_max_pct': 0.04064615155462609, 'tp_mult': 2.9401684320841706, 'tsl_mult': 0.7005355184585683, 'strategy': 'breakout', 'time_stop': 166, 'use_sma': False, 'use_atr': True, 'use_adx': False, 'use_ema': True, 'use_spike': False, 'rsi_required': False, 'edge_k': 1.855488687768134, 'edge_cap': 0.20301317700392282, 'bull_strategy': 'breakout', 'bull_bb_std_mult': 3.5211296130820093, 'bull_rsi_os': 46, 'bull_rsi_ob': 79, 'bull_adx_thresh': 9.42792539289805, 'bull_atr_min_pct': 0.005575013410727293, 'bull_atr_max_pct': 0.04278959383413458, 'bull_tp_mult': 2.8697445742959857, 'bull_tsl_mult': 0.14928323546916328, 'bull_time_stop': 63, 'bull_use_sma': False, 'bull_use_ema': True, 'bull_use_atr': False, 'bull_use_adx': True, 'bull_use_spike': True, 'bull_rsi_required': False, 'bear_strategy': 'breakout', 'bear_bb_std_mult': 1.425864148089742, 'bear_rsi_os': 22, 'bear_rsi_ob': 53, 'bear_adx_thresh': 13.949245507236533, 'bear_atr_min_pct': 0.026855306694799335, 'bear_atr_max_pct': 0.1413877171896973, 'bear_tp_mult': 2.7930031396973733, 'bear_tsl_mult': 0.07906595306132674, 'bear_time_stop': 45, 'bear_use_sma': False, 'bear_use_ema': False, 'bear_use_atr': True, 'bear_use_adx': True, 'bear_use_spike': False, 'bear_rsi_required': True, 'sideways_strategy': 'mean_reversion', 'sideways_bb_std_mult': 1.869182666965509, 'sideways_rsi_os': 37, 'sideways_rsi_ob': 55, 'sideways_adx_thresh': 12.686786125102644, 'sideways_atr_min_pct': 0.005824615428332097, 'sideways_atr_max_pct': 0.04984534152886527, 'sideways_tp_mult': 1.9015585754588307, 'sideways_tsl_mult': 0.9509134229642997, 'sideways_time_stop': 275, 'sideways_use_sma': False, 'sideways_use_ema': False, 'sideways_use_atr': False, 'sideways_use_adx': False, 'sideways_use_spike': False, 'sideways_rsi_required': False}.
[I 2025-08-31 10:43:01,328] Trial 418 finished with values: [-1000000000.0, 1000000000.0] and parameters: {'p_sma': 23, 'p_std': 6, 'p_atr': 18, 'p_adx': 9, 'rsi_period': 21, 'ema1': 19, 'ema2': 51, 'slip_atr_k': 0.06170602018720818, 'slip_spread_k': 0.2773626004217991, 'spread_hl_frac': 0.02526227558955392, 'bb_std_mult': 2.536757242568187, 'rsi_os': 27, 'rsi_ob': 74, 'vol_spike': 0.20941859854899292, 'adx_thresh': 7.763022308347677, 'atr_min_pct': 0.017933625096689297, 'atr_max_pct': 0.04090737461257815, 'tp_mult': 2.7509979638621065, 'tsl_mult': 0.6486130951278908, 'strategy': 'mean_reversion', 'time_stop': 176, 'use_sma': False, 'use_atr': True, 'use_adx': False, 'use_ema': True, 'use_spike': False, 'rsi_required': True, 'edge_k': 0.8043546878460516, 'edge_cap': 0.6738468943607182, 'bull_strategy': 'breakout', 'bull_bb_std_mult': 1.2279418124105808, 'bull_rsi_os': 40, 'bull_rsi_ob': 72, 'bull_adx_thresh': 11.438543128736423, 'bull_atr_min_pct': 0.022999440380962438, 'bull_atr_max_pct': 0.06454495007625907, 'bull_tp_mult': 1.1169085850809992, 'bull_tsl_mult': 0.11844134071211074, 'bull_time_stop': 149, 'bull_use_sma': True, 'bull_use_ema': True, 'bull_use_atr': False, 'bull_use_adx': True, 'bull_use_spike': True, 'bull_rsi_required': False, 'bear_strategy': 'breakout', 'bear_bb_std_mult': 2.1633709926921507, 'bear_rsi_os': 27, 'bear_rsi_ob': 54, 'bear_adx_thresh': 29.95596924766243, 'bear_atr_min_pct': 0.013420396988718513, 'bear_atr_max_pct': 0.11670046733214605, 'bear_tp_mult': 2.574704389100889, 'bear_tsl_mult': 0.2556633849316925, 'bear_time_stop': 38, 'bear_use_sma': True, 'bear_use_ema': False, 'bear_use_atr': True, 'bear_use_adx': True, 'bear_use_spike': True, 'bear_rsi_required': True, 'sideways_strategy': 'breakout', 'sideways_bb_std_mult': 0.6466370752346868, 'sideways_rsi_os': 35, 'sideways_rsi_ob': 92, 'sideways_adx_thresh': 14.092866377019375, 'sideways_atr_min_pct': 0.005214528813935756, 'sideways_atr_max_pct': 0.03629670197790632, 'sideways_tp_mult': 1.220547415291952, 'sideways_tsl_mult': 0.8472062211758837, 'sideways_time_stop': 273, 'sideways_use_sma': True, 'sideways_use_ema': False, 'sideways_use_atr': False, 'sideways_use_adx': True, 'sideways_use_spike': True, 'sideways_rsi_required': False}.
[I 2025-08-31 10:43:34,426] Trial 423 finished with values: [-1000000000.0, 1000000000.0] and parameters: {'p_sma': 44, 'p_std': 39, 'p_atr': 22, 'p_adx': 22, 'rsi_period': 41, 'ema1': 22, 'ema2': 57, 'slip_atr_k': 0.0008851869170909742, 'slip_spread_k': 0.26087960027243356, 'spread_hl_frac': 0.02339857903356786, 'bb_std_mult': 2.3383632168408823, 'rsi_os': 33, 'rsi_ob': 77, 'vol_spike': 0.2287493649905578, 'adx_thresh': 10.400042968533056, 'atr_min_pct': 0.021274708162658622, 'atr_max_pct': 0.038649877478879616, 'tp_mult': 2.921456651725617, 'tsl_mult': 0.6981602174180177, 'strategy': 'mean_reversion', 'time_stop': 164, 'use_sma': True, 'use_atr': False, 'use_adx': False, 'use_ema': False, 'use_spike': False, 'rsi_required': False, 'edge_k': 1.85469858720916, 'edge_cap': 0.21220256039467528, 'bull_strategy': 'mean_reversion', 'bull_bb_std_mult': 3.5353054960213797, 'bull_rsi_os': 46, 'bull_rsi_ob': 79, 'bull_adx_thresh': 9.294694585580746, 'bull_atr_min_pct': 0.004909145483958432, 'bull_atr_max_pct': 0.04310131952608105, 'bull_tp_mult': 2.871976317751735, 'bull_tsl_mult': 0.15824353396797364, 'bull_time_stop': 59, 'bull_use_sma': False, 'bull_use_ema': False, 'bull_use_atr': False, 'bull_use_adx': True, 'bull_use_spike': True, 'bull_rsi_required': True, 'bear_strategy': 'breakout', 'bear_bb_std_mult': 1.4224174232875053, 'bear_rsi_os': 22, 'bear_rsi_ob': 53, 'bear_adx_thresh': 13.67498465177108, 'bear_atr_min_pct': 0.027218039226335977, 'bear_atr_max_pct': 0.14144876048060248, 'bear_tp_mult': 2.7896228029788626, 'bear_tsl_mult': 0.08671438324446779, 'bear_time_stop': 257, 'bear_use_sma': True, 'bear_use_ema': False, 'bear_use_atr': True, 'bear_use_adx': False, 'bear_use_spike': True, 'bear_rsi_required': True, 'sideways_strategy': 'mean_reversion', 'sideways_bb_std_mult': 3.070348629849711, 'sideways_rsi_os': 37, 'sideways_rsi_ob': 54, 'sideways_adx_thresh': 12.652114581388323, 'sideways_atr_min_pct': 0.0059165115267693635, 'sideways_atr_max_pct': 0.010022417897062614, 'sideways_tp_mult': 1.8934339781033886, 'sideways_tsl_mult': 0.9491379271477414, 'sideways_time_stop': 281, 'sideways_use_sma': False, 'sideways_use_ema': True, 'sideways_use_atr': False, 'sideways_use_adx': True, 'sideways_use_spike': True, 'sideways_rsi_required': True}.
