[I 2025-08-31 09:53:22,554] Trial 17 finished with values: [-1000000000.0, 1000000000.0] and parameters: {'p_sma': 6, 'p_std': 23, 'p_atr': 11, 'p_adx': 14, 'rsi_period': 82, 'ema1': 15, 'ema2': 29, 'slip_atr_k': 0.2364844059662991, 'slip_spread_k': 0.40521438231177165, 'spread_hl_frac': 0.015255682582354133, 'bb_std_mult': 3.279530841644411, 'rsi_os': 23, 'rsi_ob': 83, 'vol_spike': 0.0003692140551276018, 'adx_thresh': 17.595047541244693, 'atr_min_pct': 0.021558489378161138, 'atr_max_pct': 0.14998156189119755, 'tp_mult': 1.5147923034080404, 'tsl_mult': 0.023462135509735305, 'strategy': 'breakout', 'time_stop': 278, 'use_sma': True, 'use_atr': False, 'use_adx': True, 'use_ema': False, 'use_spike': False, 'rsi_required': True, 'edge_k': 1.8972289703341465, 'edge_cap': 0.9974278125287379, 'bull_strategy': 'mean_reversion', 'bull_bb_std_mult': 1.5418492381295081, 'bull_rsi_os': 32, 'bull_rsi_ob': 72, 'bull_adx_thresh': 6.08106357234205, 'bull_atr_min_pct': 0.00612561140370739, 'bull_atr_max_pct': 0.093496821030608, 'bull_tp_mult': 2.461301923617479, 'bull_tsl_mult': 0.6566182599616291, 'bull_time_stop': 222, 'bull_use_sma': True, 'bull_use_ema': True, 'bull_use_atr': False, 'bull_use_adx': False, 'bull_use_spike': True, 'bull_rsi_required': False, 'bear_strategy': 'breakout', 'bear_bb_std_mult': 3.527147550508409, 'bear_rsi_os': 8, 'bear_rsi_ob': 56, 'bear_adx_thresh': 28.244416668523304, 'bear_atr_min_pct': 0.0006096611297463328, 'bear_atr_max_pct': 0.11506061862571468, 'bear_tp_mult': 1.7408139602403008, 'bear_tsl_mult': 0.7160430745284243, 'bear_time_stop': 91, 'bear_use_sma': False, 'bear_use_ema': False, 'bear_use_atr': True, 'bear_use_adx': False, 'bear_use_spike': False, 'bear_rsi_required': False, 'sideways_strategy': 'breakout', 'sideways_bb_std_mult': 2.772384013724533, 'sideways_rsi_os': 5, 'sideways_rsi_ob': 95, 'sideways_adx_thresh': 22.07550828737343, 'sideways_atr_min_pct': 0.01173969650708434, 'sideways_atr_max_pct': 0.012037498052583695, 'sideways_tp_mult': 2.431537851418885, 'sideways_tsl_mult': 0.5040119892236282, 'sideways_time_stop': 120, 'sideways_use_sma': False, 'sideways_use_ema': True, 'sideways_use_atr': True, 'sideways_use_adx': False, 'sideways_use_spike': True, 'sideways_rsi_required': False}.
[I 2025-08-31 09:53:22,655] Trial 18 finished with values: [-1000000000.0, 1000000000.0] and parameters: {'p_sma': 6, 'p_std': 24, 'p_atr': 11, 'p_adx': 15, 'rsi_period': 83, 'ema1': 16, 'ema2': 27, 'slip_atr_k': 0.23656298401457632, 'slip_spread_k': 0.3753138314588257, 'spread_hl_frac': 0.013584565017243649, 'bb_std_mult': 3.2789593967175277, 'rsi_os': 24, 'rsi_ob': 79, 'vol_spike': 0.0035886328777399445, 'adx_thresh': 17.11239945301087, 'atr_min_pct': 0.021469538594819797, 'atr_max_pct': 0.14809543320994276, 'tp_mult': 1.4198231419387386, 'tsl_mult': 0.5967553450068426, 'strategy': 'breakout', 'time_stop': 292, 'use_sma': True, 'use_atr': False, 'use_adx': True, 'use_ema': False, 'use_spike': False, 'rsi_required': True, 'edge_k': 1.9864571682144294, 'edge_cap': 0.9872237785780598, 'bull_strategy': 'mean_reversion', 'bull_bb_std_mult': 1.4480391670649682, 'bull_rsi_os': 33, 'bull_rsi_ob': 74, 'bull_adx_thresh': 5.523319542279141, 'bull_atr_min_pct': 0.007021611125122732, 'bull_atr_max_pct': 0.08685236853598889, 'bull_tp_mult': 2.5170131959862925, 'bull_tsl_mult': 0.693634481094675, 'bull_time_stop': 222, 'bull_use_sma': True, 'bull_use_ema': True, 'bull_use_atr': False, 'bull_use_adx': False, 'bull_use_spike': True, 'bull_rsi_required': False, 'bear_strategy': 'breakout', 'bear_bb_std_mult': 3.548814150548412, 'bear_rsi_os': 5, 'bear_rsi_ob': 55, 'bear_adx_thresh': 28.225885816212894, 'bear_atr_min_pct': 0.000655291893764294, 'bear_atr_max_pct': 0.11016769671703136, 'bear_tp_mult': 1.741591001321726, 'bear_tsl_mult': 0.7171329434835676, 'bear_time_stop': 103, 'bear_use_sma': False, 'bear_use_ema': False, 'bear_use_atr': True, 'bear_use_adx': False, 'bear_use_spike': False, 'bear_rsi_required': False, 'sideways_strategy': 'breakout', 'sideways_bb_std_mult': 3.5847795727904757, 'sideways_rsi_os': 6, 'sideways_rsi_ob': 95, 'sideways_adx_thresh': 20.75193486520604, 'sideways_atr_min_pct': 0.011764739851978862, 'sideways_atr_max_pct': 0.018379836762347196, 'sideways_tp_mult': 2.4369913660913656, 'sideways_tsl_mult': 0.5405799352901431, 'sideways_time_stop': 123, 'sideways_use_sma': False, 'sideways_use_ema': True, 'sideways_use_atr': True, 'sideways_use_adx': False, 'sideways_use_spike': True, 'sideways_rsi_required': False}.
[I 2025-08-31 09:53:59,741] Trial 20 finished with values: [-1000000000.0, 1000000000.0] and parameters: {'p_sma': 9, 'p_std': 19, 'p_atr': 30, 'p_adx': 15, 'rsi_period': 75, 'ema1': 30, 'ema2': 27, 'slip_atr_k': 0.19867217985437283, 'slip_spread_k': 0.41180961128888505, 'spread_hl_frac': 0.019721020616879466, 'bb_std_mult': 3.061927006528634, 'rsi_os': 23, 'rsi_ob': 57, 'vol_spike': 0.28615701900327556, 'adx_thresh': 24.19992806516605, 'atr_min_pct': 0.02394565546894243, 'atr_max_pct': 0.14301306109283815, 'tp_mult': 1.3674934718563814, 'tsl_mult': 0.9973655748895641, 'strategy': 'breakout', 'time_stop': 283, 'use_sma': True, 'use_atr': False, 'use_adx': True, 'use_ema': False, 'use_spike': False, 'rsi_required': True, 'edge_k': 1.9666131536718723, 'edge_cap': 0.5909060467321277, 'bull_strategy': 'mean_reversion', 'bull_bb_std_mult': 2.890130415277028, 'bull_rsi_os': 33, 'bull_rsi_ob': 76, 'bull_adx_thresh': 34.79507183412709, 'bull_atr_min_pct': 0.004640887916149348, 'bull_atr_max_pct': 0.1496177059249379, 'bull_tp_mult': 2.548137722591539, 'bull_tsl_mult': 0.5698659800657513, 'bull_time_stop': 33, 'bull_use_sma': True, 'bull_use_ema': False, 'bull_use_atr': False, 'bull_use_adx': False, 'bull_use_spike': False, 'bull_rsi_required': True, 'bear_strategy': 'breakout', 'bear_bb_std_mult': 2.969825850791338, 'bear_rsi_os': 11, 'bear_rsi_ob': 54, 'bear_adx_thresh': 5.131895681824308, 'bear_atr_min_pct': 0.02312203735235778, 'bear_atr_max_pct': 0.1192600772737871, 'bear_tp_mult': 1.0199910624607638, 'bear_tsl_mult': 0.7367286506237594, 'bear_time_stop': 92, 'bear_use_sma': True, 'bear_use_ema': False, 'bear_use_atr': True, 'bear_use_adx': False, 'bear_use_spike': False, 'bear_rsi_required': False, 'sideways_strategy': 'breakout', 'sideways_bb_std_mult': 2.616805217313682, 'sideways_rsi_os': 13, 'sideways_rsi_ob': 56, 'sideways_adx_thresh': 21.33786103748096, 'sideways_atr_min_pct': 0.011244346930531765, 'sideways_atr_max_pct': 0.07120215252623194, 'sideways_tp_mult': 2.4378674222079395, 'sideways_tsl_mult': 0.7859852041302167, 'sideways_time_stop': 186, 'sideways_use_sma': False, 'sideways_use_ema': True, 'sideways_use_atr': False, 'sideways_use_adx': True, 'sideways_use_spike': True, 'sideways_rsi_required': False}.
[I 2025-08-31 09:53:59,938] Trial 21 finished with values: [-1000000000.0, 1000000000.0] and parameters: {'p_sma': 23, 'p_std': 43, 'p_atr': 30, 'p_adx': 20, 'rsi_period': 79, 'ema1': 30, 'ema2': 24, 'slip_atr_k': 0.20241694515259717, 'slip_spread_k': 0.9926103663450991, 'spread_hl_frac': 0.021631495915034535, 'bb_std_mult': 3.0533951442671685, 'rsi_os': 14, 'rsi_ob': 57, 'vol_spike': 0.29307442350383617, 'adx_thresh': 24.03385843420089, 'atr_min_pct': 0.024616870500446017, 'atr_max_pct': 0.12944778142209346, 'tp_mult': 1.9129777439408837, 'tsl_mult': 0.027952235561750527, 'strategy': 'breakout', 'time_stop': 252, 'use_sma': True, 'use_atr': False, 'use_adx': True, 'use_ema': False, 'use_spike': False, 'rsi_required': True, 'edge_k': 0.9654162323011053, 'edge_cap': 0.5931929510676537, 'bull_strategy': 'mean_reversion', 'bull_bb_std_mult': 2.8617670931988073, 'bull_rsi_os': 34, 'bull_rsi_ob': 75, 'bull_adx_thresh': 33.51763537892004, 'bull_atr_min_pct': 0.004462490994850631, 'bull_atr_max_pct': 0.07581165501125334, 'bull_tp_mult': 2.61784131635887, 'bull_tsl_mult': 0.33435836535277835, 'bull_time_stop': 41, 'bull_use_sma': True, 'bull_use_ema': False, 'bull_use_atr': False, 'bull_use_adx': False, 'bull_use_spike': False, 'bull_rsi_required': True, 'bear_strategy': 'breakout', 'bear_bb_std_mult': 2.519800471960721, 'bear_rsi_os': 11, 'bear_rsi_ob': 45, 'bear_adx_thresh': 6.292999863485939, 'bear_atr_min_pct': 0.02381540503128472, 'bear_atr_max_pct': 0.11070286147242604, 'bear_tp_mult': 1.0110304618858754, 'bear_tsl_mult': 0.15115645210562045, 'bear_time_stop': 127, 'bear_use_sma': True, 'bear_use_ema': False, 'bear_use_atr': True, 'bear_use_adx': False, 'bear_use_spike': False, 'bear_rsi_required': False, 'sideways_strategy': 'breakout', 'sideways_bb_std_mult': 1.3373430560491364, 'sideways_rsi_os': 14, 'sideways_rsi_ob': 58, 'sideways_adx_thresh': 21.899344578512803, 'sideways_atr_min_pct': 0.009599479519316154, 'sideways_atr_max_pct': 0.06921001661009248, 'sideways_tp_mult': 1.844001331973469, 'sideways_tsl_mult': 0.7832983898826068, 'sideways_time_stop': 61, 'sideways_use_sma': False, 'sideways_use_ema': True, 'sideways_use_atr': False, 'sideways_use_adx': True, 'sideways_use_spike': True, 'sideways_rsi_required': False}.
[I 2025-08-31 09:54:00,622] Trial 23 finished with values: [-1000000000.0, 1000000000.0] and parameters: {'p_sma': 25, 'p_std': 42, 'p_atr': 30, 'p_adx': 20, 'rsi_period': 46, 'ema1': 25, 'ema2': 51, 'slip_atr_k': 0.20379475883524523, 'slip_spread_k': 0.9986874131425671, 'spread_hl_frac': 0.02137664249727872, 'bb_std_mult': 2.99092475377838, 'rsi_os': 16, 'rsi_ob': 58, 'vol_spike': 0.28754197147875443, 'adx_thresh': 23.786811370783084, 'atr_min_pct': 0.02508850022382181, 'atr_max_pct': 0.13110100395263236, 'tp_mult': 1.840632301862727, 'tsl_mult': 0.31020434521104445, 'strategy': 'breakout', 'time_stop': 251, 'use_sma': True, 'use_atr': False, 'use_adx': True, 'use_ema': False, 'use_spike': False, 'rsi_required': True, 'edge_k': 0.991581826652287, 'edge_cap': 0.6179377229886535, 'bull_strategy': 'mean_reversion', 'bull_bb_std_mult': 2.8916796567463985, 'bull_rsi_os': 37, 'bull_rsi_ob': 79, 'bull_adx_thresh': 34.163274513428, 'bull_atr_min_pct': 0.0040435419083886225, 'bull_atr_max_pct': 0.1108198511201715, 'bull_tp_mult': 2.7393445473300115, 'bull_tsl_mult': 0.34703962360052654, 'bull_time_stop': 41, 'bull_use_sma': True, 'bull_use_ema': False, 'bull_use_atr': False, 'bull_use_adx': False, 'bull_use_spike': False, 'bull_rsi_required': True, 'bear_strategy': 'breakout', 'bear_bb_std_mult': 2.6112654038393472, 'bear_rsi_os': 28, 'bear_rsi_ob': 45, 'bear_adx_thresh': 6.1427977366359965, 'bear_atr_min_pct': 0.025811468296015872, 'bear_atr_max_pct': 0.13331378447276246, 'bear_tp_mult': 2.227640431597419, 'bear_tsl_mult': 0.1832189085955036, 'bear_time_stop': 145, 'bear_use_sma': True, 'bear_use_ema': False, 'bear_use_atr': True, 'bear_use_adx': False, 'bear_use_spike': False, 'bear_rsi_required': False, 'sideways_strategy': 'breakout', 'sideways_bb_std_mult': 1.2347213644204467, 'sideways_rsi_os': 13, 'sideways_rsi_ob': 58, 'sideways_adx_thresh': 25.168140140792865, 'sideways_atr_min_pct': 0.022486158436838505, 'sideways_atr_max_pct': 0.06713867067293551, 'sideways_tp_mult': 1.9505273547761797, 'sideways_tsl_mult': 0.8055710658670135, 'sideways_time_stop': 66, 'sideways_use_sma': False, 'sideways_use_ema': True, 'sideways_use_atr': False, 'sideways_use_adx': True, 'sideways_use_spike': True, 'sideways_rsi_required': False}.
[I 2025-08-31 09:54:00,868] Trial 22 finished with values: [-1000000000.0, 1000000000.0] and parameters: {'p_sma': 22, 'p_std': 39, 'p_atr': 30, 'p_adx': 20, 'rsi_period': 47, 'ema1': 30, 'ema2': 49, 'slip_atr_k': 0.20236918413574234, 'slip_spread_k': 0.9931803258427995, 'spread_hl_frac': 0.021183710156124066, 'bb_std_mult': 2.6180645752006058, 'rsi_os': 15, 'rsi_ob': 59, 'vol_spike': 0.2953830230232383, 'adx_thresh': 5.673486868710528, 'atr_min_pct': 0.026522180292308076, 'atr_max_pct': 0.131171397312793, 'tp_mult': 1.7643125760105423, 'tsl_mult': 0.30196847781153074, 'strategy': 'breakout', 'time_stop': 250, 'use_sma': True, 'use_atr': False, 'use_adx': True, 'use_ema': False, 'use_spike': False, 'rsi_required': True, 'edge_k': 0.9745644605421968, 'edge_cap': 0.6076101177865855, 'bull_strategy': 'mean_reversion', 'bull_bb_std_mult': 2.920676454770101, 'bull_rsi_os': 38, 'bull_rsi_ob': 79, 'bull_adx_thresh': 34.050521658771, 'bull_atr_min_pct': 0.00276426627662065, 'bull_atr_max_pct': 0.14979420738488486, 'bull_tp_mult': 2.9928178417683156, 'bull_tsl_mult': 0.31074570102363835, 'bull_time_stop': 41, 'bull_use_sma': True, 'bull_use_ema': False, 'bull_use_atr': False, 'bull_use_adx': False, 'bull_use_spike': False, 'bull_rsi_required': True, 'bear_strategy': 'breakout', 'bear_bb_std_mult': 2.5210900305381725, 'bear_rsi_os': 31, 'bear_rsi_ob': 51, 'bear_adx_thresh': 5.125211064538575, 'bear_atr_min_pct': 0.02394595297155572, 'bear_atr_max_pct': 0.13614493158065527, 'bear_tp_mult': 1.023758732494453, 'bear_tsl_mult': 0.16396272082980817, 'bear_time_stop': 144, 'bear_use_sma': True, 'bear_use_ema': False, 'bear_use_atr': True, 'bear_use_adx': False, 'bear_use_spike': False, 'bear_rsi_required': False, 'sideways_strategy': 'breakout', 'sideways_bb_std_mult': 1.290885992522779, 'sideways_rsi_os': 11, 'sideways_rsi_ob': 59, 'sideways_adx_thresh': 24.784110132136078, 'sideways_atr_min_pct': 0.008478479729662088, 'sideways_atr_max_pct': 0.07483783625010848, 'sideways_tp_mult': 1.8741355055784867, 'sideways_tsl_mult': 0.8032882590786841, 'sideways_time_stop': 65, 'sideways_use_sma': False, 'sideways_use_ema': True, 'sideways_use_atr': False, 'sideways_use_adx': True, 'sideways_use_spike': True, 'sideways_rsi_required': False}.
[I 2025-08-31 09:54:36,113] Trial 24 finished with values: [-0.03284424072833647, 0.032900564289371735] and parameters: {'p_sma': 32, 'p_std': 29, 'p_atr': 27, 'p_adx': 10, 'rsi_period': 70, 'ema1': 25, 'ema2': 34, 'slip_atr_k': 0.1618344163785435, 'slip_spread_k': 0.8033264902106221, 'spread_hl_frac': 0.009567242516360817, 'bb_std_mult': 3.584219703729167, 'rsi_os': 14, 'rsi_ob': 63, 'vol_spike': 0.2484718261379985, 'adx_thresh': 13.995683107344677, 'atr_min_pct': 0.025412656571988834, 'atr_max_pct': 0.12571978776066034, 'tp_mult': 1.742942403916621, 'tsl_mult': 0.2649725134920089, 'strategy': 'breakout', 'time_stop': 252, 'use_sma': True, 'use_atr': False, 'use_adx': True, 'use_ema': False, 'use_spike': False, 'rsi_required': True, 'edge_k': 1.2668127713521102, 'edge_cap': 0.859962312891722, 'bull_strategy': 'mean_reversion', 'bull_bb_std_mult': 2.4909013240339375, 'bull_rsi_os': 25, 'bull_rsi_ob': 89, 'bull_adx_thresh': 28.739687893955413, 'bull_atr_min_pct': 0.0016205924774896092, 'bull_atr_max_pct': 0.10824705667396181, 'bull_tp_mult': 2.9995399755115786, 'bull_tsl_mult': 0.8066198594276072, 'bull_time_stop': 293, 'bull_use_sma': True, 'bull_use_ema': False, 'bull_use_atr': False, 'bull_use_adx': False, 'bull_use_spike': False, 'bull_rsi_required': True, 'bear_strategy': 'breakout', 'bear_bb_std_mult': 2.2845860139493355, 'bear_rsi_os': 29, 'bear_rsi_ob': 95, 'bear_adx_thresh': 15.424169713384362, 'bear_atr_min_pct': 0.011688502269163886, 'bear_atr_max_pct': 0.06715079875083918, 'bear_tp_mult': 2.214462050118402, 'bear_tsl_mult': 0.4238912443071633, 'bear_time_stop': 158, 'bear_use_sma': True, 'bear_use_ema': False, 'bear_use_atr': True, 'bear_use_adx': False, 'bear_use_spike': False, 'bear_rsi_required': False, 'sideways_strategy': 'breakout', 'sideways_bb_std_mult': 1.064978054663035, 'sideways_rsi_os': 12, 'sideways_rsi_ob': 63, 'sideways_adx_thresh': 13.993804655482034, 'sideways_atr_min_pct': 0.016272193261236325, 'sideways_atr_max_pct': 0.03476300220893694, 'sideways_tp_mult': 1.8469179767840431, 'sideways_tsl_mult': 0.7870911321114276, 'sideways_time_stop': 76, 'sideways_use_sma': False, 'sideways_use_ema': True, 'sideways_use_atr': False, 'sideways_use_adx': True, 'sideways_use_spike': True, 'sideways_rsi_required': False}.
[I 2025-08-31 09:54:36,548] Trial 27 finished with values: [-1000000000.0, 1000000000.0] and parameters: {'p_sma': 11, 'p_std': 13, 'p_atr': 26, 'p_adx': 11, 'rsi_period': 68, 'ema1': 27, 'ema2': 22, 'slip_atr_k': 0.16442220445125472, 'slip_spread_k': 0.7775368338189658, 'spread_hl_frac': 0.009405704921895339, 'bb_std_mult': 3.588953605342367, 'rsi_os': 10, 'rsi_ob': 46, 'vol_spike': 0.24562310604269724, 'adx_thresh': 13.81478641412798, 'atr_min_pct': 0.01858876156540753, 'atr_max_pct': 0.11592125127590025, 'tp_mult': 1.244391339720541, 'tsl_mult': 0.12797189636251216, 'strategy': 'breakout', 'time_stop': 202, 'use_sma': True, 'use_atr': False, 'use_adx': True, 'use_ema': False, 'use_spike': False, 'rsi_required': False, 'edge_k': 1.2346215627240773, 'edge_cap': 0.8608475132995681, 'bull_strategy': 'mean_reversion', 'bull_bb_std_mult': 2.3926487171244784, 'bull_rsi_os': 26, 'bull_rsi_ob': 90, 'bull_adx_thresh': 29.603979918252925, 'bull_atr_min_pct': 0.009892847968253444, 'bull_atr_max_pct': 0.074256156673457, 'bull_tp_mult': 2.788071210731179, 'bull_tsl_mult': 0.7875163756607536, 'bull_time_stop': 266, 'bull_use_sma': True, 'bull_use_ema': False, 'bull_use_atr': True, 'bull_use_adx': False, 'bull_use_spike': False, 'bull_rsi_required': True, 'bear_strategy': 'breakout', 'bear_bb_std_mult': 2.179156042389591, 'bear_rsi_os': 41, 'bear_rsi_ob': 92, 'bear_adx_thresh': 14.445632910603914, 'bear_atr_min_pct': 0.010311361189539778, 'bear_atr_max_pct': 0.06923401020574496, 'bear_tp_mult': 1.9069601763462494, 'bear_tsl_mult': 0.42429436485195027, 'bear_time_stop': 50, 'bear_use_sma': True, 'bear_use_ema': False, 'bear_use_atr': True, 'bear_use_adx': False, 'bear_use_spike': True, 'bear_rsi_required': False, 'sideways_strategy': 'mean_reversion', 'sideways_bb_std_mult': 0.9223169265253344, 'sideways_rsi_os': 10, 'sideways_rsi_ob': 67, 'sideways_adx_thresh': 17.83372566895481, 'sideways_atr_min_pct': 0.01604573436357676, 'sideways_atr_max_pct': 0.03189185563539962, 'sideways_tp_mult': 2.2937827622313405, 'sideways_tsl_mult': 0.02961623326869639, 'sideways_time_stop': 136, 'sideways_use_sma': False, 'sideways_use_ema': True, 'sideways_use_atr': False, 'sideways_use_adx': True, 'sideways_use_spike': True, 'sideways_rsi_required': False}.
[I 2025-08-31 09:54:36,961] Trial 26 finished with values: [-0.024288079676869856, 0.024047941113722063] and parameters: {'p_sma': 31, 'p_std': 31, 'p_atr': 26, 'p_adx': 10, 'rsi_period': 69, 'ema1': 27, 'ema2': 10, 'slip_atr_k': 0.1613629373664961, 'slip_spread_k': 0.8322149552827525, 'spread_hl_frac': 0.009917651082168156, 'bb_std_mult': 3.5519911715018466, 'rsi_os': 13, 'rsi_ob': 45, 'vol_spike': 0.199185760639734, 'adx_thresh': 14.079905718775837, 'atr_min_pct': 0.02973380219516121, 'atr_max_pct': 0.12315347157651077, 'tp_mult': 1.6930466941143272, 'tsl_mult': 0.17096503075080144, 'strategy': 'breakout', 'time_stop': 207, 'use_sma': True, 'use_atr': False, 'use_adx': True, 'use_ema': False, 'use_spike': False, 'rsi_required': False, 'edge_k': 1.2306404429313462, 'edge_cap': 0.8626424078648489, 'bull_strategy': 'mean_reversion', 'bull_bb_std_mult': 2.3640668544263814, 'bull_rsi_os': 25, 'bull_rsi_ob': 89, 'bull_adx_thresh': 30.237631424398877, 'bull_atr_min_pct': 0.001898078637355024, 'bull_atr_max_pct': 0.07155114602589688, 'bull_tp_mult': 2.986975014904338, 'bull_tsl_mult': 0.8491793812811166, 'bull_time_stop': 272, 'bull_use_sma': True, 'bull_use_ema': False, 'bull_use_atr': True, 'bull_use_adx': False, 'bull_use_spike': False, 'bull_rsi_required': True, 'bear_strategy': 'breakout', 'bear_bb_std_mult': 2.2094112757108606, 'bear_rsi_os': 40, 'bear_rsi_ob': 93, 'bear_adx_thresh': 15.200318804971449, 'bear_atr_min_pct': 0.009903633698370485, 'bear_atr_max_pct': 0.06991550065231647, 'bear_tp_mult': 2.0000537335884627, 'bear_tsl_mult': 0.4588578134277672, 'bear_time_stop': 53, 'bear_use_sma': True, 'bear_use_ema': False, 'bear_use_atr': True, 'bear_use_adx': False, 'bear_use_spike': True, 'bear_rsi_required': False, 'sideways_strategy': 'mean_reversion', 'sideways_bb_std_mult': 0.8554320936112394, 'sideways_rsi_os': 34, 'sideways_rsi_ob': 66, 'sideways_adx_thresh': 14.374299638899672, 'sideways_atr_min_pct': 0.015974760409579722, 'sideways_atr_max_pct': 0.03471881372300764, 'sideways_tp_mult': 2.9905978853533357, 'sideways_tsl_mult': 0.03725208875866426, 'sideways_time_stop': 140, 'sideways_use_sma': False, 'sideways_use_ema': True, 'sideways_use_atr': False, 'sideways_use_adx': True, 'sideways_use_spike': True, 'sideways_rsi_required': False}.
