[I 2025-08-31 10:44:40,261] Trial 430 finished with values: [-1000000000.0, 1000000000.0] and parameters: {'p_sma': 46, 'p_std': 38, 'p_atr': 23, 'p_adx': 20, 'rsi_period': 44, 'ema1': 23, 'ema2': 55, 'slip_atr_k': 0.007896496639166417, 'slip_spread_k': 0.7619927690562753, 'spread_hl_frac': 0.022207938570138502, 'bb_std_mult': 2.366558675493687, 'rsi_os': 36, 'rsi_ob': 72, 'vol_spike': 0.2417426097045577, 'adx_thresh': 11.65746097481555, 'atr_min_pct': 0.02045811006789936, 'atr_max_pct': 0.03687741531389995, 'tp_mult': 2.8780788797783696, 'tsl_mult': 0.6877634729246102, 'strategy': 'breakout', 'time_stop': 159, 'use_sma': False, 'use_atr': False, 'use_adx': False, 'use_ema': False, 'use_spike': False, 'rsi_required': False, 'edge_k': 1.8104884042526401, 'edge_cap': 0.20163071219207454, 'bull_strategy': 'breakout', 'bull_bb_std_mult': 3.5957083102462404, 'bull_rsi_os': 45, 'bull_rsi_ob': 78, 'bull_adx_thresh': 20.060257745811764, 'bull_atr_min_pct': 0.004054537681688972, 'bull_atr_max_pct': 0.028277601089689568, 'bull_tp_mult': 2.755063645396501, 'bull_tsl_mult': 0.19452230575676405, 'bull_time_stop': 63, 'bull_use_sma': False, 'bull_use_ema': True, 'bull_use_atr': False, 'bull_use_adx': True, 'bull_use_spike': False, 'bull_rsi_required': False, 'bear_strategy': 'mean_reversion', 'bear_bb_std_mult': 1.4907054501064034, 'bear_rsi_os': 19, 'bear_rsi_ob': 54, 'bear_adx_thresh': 14.429916719151064, 'bear_atr_min_pct': 0.023205010967710396, 'bear_atr_max_pct': 0.13866822262643072, 'bear_tp_mult': 2.762150371723509, 'bear_tsl_mult': 0.07024562015339014, 'bear_time_stop': 40, 'bear_use_sma': False, 'bear_use_ema': True, 'bear_use_atr': True, 'bear_use_adx': False, 'bear_use_spike': True, 'bear_rsi_required': True, 'sideways_strategy': 'mean_reversion', 'sideways_bb_std_mult': 1.768710388293666, 'sideways_rsi_os': 38, 'sideways_rsi_ob': 61, 'sideways_adx_thresh': 13.48896329657976, 'sideways_atr_min_pct': 0.007189859883847203, 'sideways_atr_max_pct': 0.01637761242516631, 'sideways_tp_mult': 1.9574686786064437, 'sideways_tsl_mult': 0.9128162797877954, 'sideways_time_stop': 269, 'sideways_use_sma': True, 'sideways_use_ema': False, 'sideways_use_atr': False, 'sideways_use_adx': False, 'sideways_use_spike': False, 'sideways_rsi_required': False}.
[I 2025-08-31 10:44:40,337] Trial 432 finished with values: [-0.0010193205459154697, 0.0020563238840434622] and parameters: {'p_sma': 45, 'p_std': 38, 'p_atr': 23, 'p_adx': 16, 'rsi_period': 39, 'ema1': 23, 'ema2': 54, 'slip_atr_k': 0.0004977609914799471, 'slip_spread_k': 0.17826135945789834, 'spread_hl_frac': 0.022172262475548123, 'bb_std_mult': 2.2555640496227096, 'rsi_os': 36, 'rsi_ob': 79, 'vol_spike': 0.2255608778913035, 'adx_thresh': 27.711518757322402, 'atr_min_pct': 0.0004716329198562706, 'atr_max_pct': 0.03372308306284358, 'tp_mult': 2.8724031190732835, 'tsl_mult': 0.6816462820694399, 'strategy': 'breakout', 'time_stop': 157, 'use_sma': False, 'use_atr': False, 'use_adx': False, 'use_ema': False, 'use_spike': False, 'rsi_required': False, 'edge_k': 1.7878163020885518, 'edge_cap': 0.19184567606596456, 'bull_strategy': 'breakout', 'bull_bb_std_mult': 3.522003924577028, 'bull_rsi_os': 45, 'bull_rsi_ob': 78, 'bull_adx_thresh': 9.547360620396146, 'bull_atr_min_pct': 0.0041205862962903315, 'bull_atr_max_pct': 0.02767543522050308, 'bull_tp_mult': 2.993457807983263, 'bull_tsl_mult': 0.1345705801481616, 'bull_time_stop': 48, 'bull_use_sma': False, 'bull_use_ema': True, 'bull_use_atr': False, 'bull_use_adx': True, 'bull_use_spike': True, 'bull_rsi_required': False, 'bear_strategy': 'breakout', 'bear_bb_std_mult': 1.4937418472251525, 'bear_rsi_os': 24, 'bear_rsi_ob': 54, 'bear_adx_thresh': 12.86294033755896, 'bear_atr_min_pct': 0.02292623437498124, 'bear_atr_max_pct': 0.1439700109570062, 'bear_tp_mult': 2.7663880311019424, 'bear_tsl_mult': 0.06445208883529893, 'bear_time_stop': 40, 'bear_use_sma': False, 'bear_use_ema': False, 'bear_use_atr': True, 'bear_use_adx': False, 'bear_use_spike': False, 'bear_rsi_required': True, 'sideways_strategy': 'mean_reversion', 'sideways_bb_std_mult': 2.771424841210365, 'sideways_rsi_os': 36, 'sideways_rsi_ob': 58, 'sideways_adx_thresh': 13.467944745787806, 'sideways_atr_min_pct': 0.005361708524932825, 'sideways_atr_max_pct': 0.012895602373778785, 'sideways_tp_mult': 1.8667951370796332, 'sideways_tsl_mult': 0.9684075780624156, 'sideways_time_stop': 267, 'sideways_use_sma': True, 'sideways_use_ema': False, 'sideways_use_atr': False, 'sideways_use_adx': False, 'sideways_use_spike': False, 'sideways_rsi_required': False}.
[I 2025-08-31 10:45:12,647] Trial 434 finished with values: [-1000000000.0, 1000000000.0] and parameters: {'p_sma': 45, 'p_std': 37, 'p_atr': 23, 'p_adx': 19, 'rsi_period': 45, 'ema1': 23, 'ema2': 57, 'slip_atr_k': 0.00020643836599179078, 'slip_spread_k': 0.7674069488222421, 'spread_hl_frac': 0.024820361669954178, 'bb_std_mult': 2.389119349783052, 'rsi_os': 36, 'rsi_ob': 55, 'vol_spike': 0.2221396084300154, 'adx_thresh': 28.349148709609015, 'atr_min_pct': 0.020262110433945105, 'atr_max_pct': 0.12582670601261864, 'tp_mult': 2.8567779687101544, 'tsl_mult': 0.6880052409850459, 'strategy': 'breakout', 'time_stop': 155, 'use_sma': False, 'use_atr': False, 'use_adx': False, 'use_ema': False, 'use_spike': False, 'rsi_required': False, 'edge_k': 1.7795512811218586, 'edge_cap': 0.18775735544706895, 'bull_strategy': 'breakout', 'bull_bb_std_mult': 3.547571406856429, 'bull_rsi_os': 45, 'bull_rsi_ob': 78, 'bull_adx_thresh': 24.48215555443055, 'bull_atr_min_pct': 0.020625767558129136, 'bull_atr_max_pct': 0.01860788709520542, 'bull_tp_mult': 2.766279877170278, 'bull_tsl_mult': 0.14284379535260094, 'bull_time_stop': 64, 'bull_use_sma': False, 'bull_use_ema': True, 'bull_use_atr': False, 'bull_use_adx': True, 'bull_use_spike': False, 'bull_rsi_required': False, 'bear_strategy': 'breakout', 'bear_bb_std_mult': 1.487821668246345, 'bear_rsi_os': 24, 'bear_rsi_ob': 54, 'bear_adx_thresh': 13.150616613107156, 'bear_atr_min_pct': 0.028070394098945732, 'bear_atr_max_pct': 0.14228834840101268, 'bear_tp_mult': 2.7527935502929584, 'bear_tsl_mult': 0.09264709609325883, 'bear_time_stop': 195, 'bear_use_sma': False, 'bear_use_ema': False, 'bear_use_atr': True, 'bear_use_adx': True, 'bear_use_spike': True, 'bear_rsi_required': True, 'sideways_strategy': 'mean_reversion', 'sideways_bb_std_mult': 2.6406656008178984, 'sideways_rsi_os': 24, 'sideways_rsi_ob': 65, 'sideways_adx_thresh': 12.316188299229271, 'sideways_atr_min_pct': 0.005245623819556953, 'sideways_atr_max_pct': 0.014944068867317284, 'sideways_tp_mult': 1.8412589368170038, 'sideways_tsl_mult': 0.9892702177565782, 'sideways_time_stop': 268, 'sideways_use_sma': True, 'sideways_use_ema': False, 'sideways_use_atr': False, 'sideways_use_adx': False, 'sideways_use_spike': False, 'sideways_rsi_required': False}.
[I 2025-08-31 10:45:13,069] Trial 435 finished with values: [-1000000000.0, 1000000000.0] and parameters: {'p_sma': 42, 'p_std': 38, 'p_atr': 22, 'p_adx': 16, 'rsi_period': 39, 'ema1': 19, 'ema2': 15, 'slip_atr_k': 0.0015324514787611212, 'slip_spread_k': 0.6516528711469078, 'spread_hl_frac': 0.02482224985982375, 'bb_std_mult': 2.412876938290839, 'rsi_os': 36, 'rsi_ob': 76, 'vol_spike': 0.22895628385741126, 'adx_thresh': 28.122282178513487, 'atr_min_pct': 0.02033607079531914, 'atr_max_pct': 0.04011312048614794, 'tp_mult': 2.9618178381333924, 'tsl_mult': 0.6765560465214717, 'strategy': 'mean_reversion', 'time_stop': 167, 'use_sma': False, 'use_atr': False, 'use_adx': False, 'use_ema': False, 'use_spike': False, 'rsi_required': False, 'edge_k': 1.7922545151585139, 'edge_cap': 0.18378366148000133, 'bull_strategy': 'breakout', 'bull_bb_std_mult': 3.5546972630318097, 'bull_rsi_os': 45, 'bull_rsi_ob': 81, 'bull_adx_thresh': 10.593335551802193, 'bull_atr_min_pct': 0.029523677111270477, 'bull_atr_max_pct': 0.028264563193674527, 'bull_tp_mult': 2.814273154557882, 'bull_tsl_mult': 0.13700561702084885, 'bull_time_stop': 69, 'bull_use_sma': False, 'bull_use_ema': True, 'bull_use_atr': False, 'bull_use_adx': True, 'bull_use_spike': True, 'bull_rsi_required': False, 'bear_strategy': 'breakout', 'bear_bb_std_mult': 1.4970126255240126, 'bear_rsi_os': 24, 'bear_rsi_ob': 54, 'bear_adx_thresh': 13.189131468998273, 'bear_atr_min_pct': 0.028794972017530687, 'bear_atr_max_pct': 0.13526857186943825, 'bear_tp_mult': 2.743469410010985, 'bear_tsl_mult': 0.10643814571363946, 'bear_time_stop': 194, 'bear_use_sma': True, 'bear_use_ema': False, 'bear_use_atr': True, 'bear_use_adx': True, 'bear_use_spike': True, 'bear_rsi_required': True, 'sideways_strategy': 'mean_reversion', 'sideways_bb_std_mult': 1.4578178388821699, 'sideways_rsi_os': 48, 'sideways_rsi_ob': 64, 'sideways_adx_thresh': 13.82552815497, 'sideways_atr_min_pct': 0.00542013059151609, 'sideways_atr_max_pct': 0.016567146945497595, 'sideways_tp_mult': 1.84014323505734, 'sideways_tsl_mult': 0.9711894809078248, 'sideways_time_stop': 269, 'sideways_use_sma': True, 'sideways_use_ema': False, 'sideways_use_atr': False, 'sideways_use_adx': True, 'sideways_use_spike': True, 'sideways_rsi_required': False}.
[I 2025-08-31 10:45:13,417] Trial 436 finished with values: [-0.0019875786752748814, 0.0024479182117893043] and parameters: {'p_sma': 42, 'p_std': 37, 'p_atr': 22, 'p_adx': 13, 'rsi_period': 41, 'ema1': 20, 'ema2': 57, 'slip_atr_k': 0.001970998711539624, 'slip_spread_k': 0.3582966620355227, 'spread_hl_frac': 0.025020849123980723, 'bb_std_mult': 2.405418491226629, 'rsi_os': 35, 'rsi_ob': 55, 'vol_spike': 0.22566611554488863, 'adx_thresh': 28.070590826611586, 'atr_min_pct': 0.019595950076408505, 'atr_max_pct': 0.040036253191415676, 'tp_mult': 2.950955566291933, 'tsl_mult': 0.6773294082323599, 'strategy': 'mean_reversion', 'time_stop': 172, 'use_sma': False, 'use_atr': True, 'use_adx': False, 'use_ema': True, 'use_spike': False, 'rsi_required': False, 'edge_k': 1.7879980376081313, 'edge_cap': 0.19413442732754918, 'bull_strategy': 'breakout', 'bull_bb_std_mult': 3.362838350386917, 'bull_rsi_os': 47, 'bull_rsi_ob': 79, 'bull_adx_thresh': 10.364015553804055, 'bull_atr_min_pct': 0.0038703430896857814, 'bull_atr_max_pct': 0.04636829466734953, 'bull_tp_mult': 2.835730726316816, 'bull_tsl_mult': 0.1379219862549555, 'bull_time_stop': 68, 'bull_use_sma': False, 'bull_use_ema': True, 'bull_use_atr': False, 'bull_use_adx': True, 'bull_use_spike': True, 'bull_rsi_required': False, 'bear_strategy': 'breakout', 'bear_bb_std_mult': 1.4518143680318838, 'bear_rsi_os': 24, 'bear_rsi_ob': 54, 'bear_adx_thresh': 13.466476576312797, 'bear_atr_min_pct': 0.026224791091575772, 'bear_atr_max_pct': 0.14203596381471878, 'bear_tp_mult': 2.7269921257038745, 'bear_tsl_mult': 0.10677069022318032, 'bear_time_stop': 51, 'bear_use_sma': True, 'bear_use_ema': False, 'bear_use_atr': True, 'bear_use_adx': True, 'bear_use_spike': True, 'bear_rsi_required': True, 'sideways_strategy': 'mean_reversion', 'sideways_bb_std_mult': 2.6540956582831767, 'sideways_rsi_os': 36, 'sideways_rsi_ob': 63, 'sideways_adx_thresh': 13.884928230378291, 'sideways_atr_min_pct': 0.006369395751250686, 'sideways_atr_max_pct': 0.1119618179496768, 'sideways_tp_mult': 1.8390985896415912, 'sideways_tsl_mult': 0.8965869174964667, 'sideways_time_stop': 158, 'sideways_use_sma': False, 'sideways_use_ema': False, 'sideways_use_atr': False, 'sideways_use_adx': True, 'sideways_use_spike': True, 'sideways_rsi_required': False}.
[I 2025-08-31 10:45:13,643] Trial 437 finished with values: [-1000000000.0, 1000000000.0] and parameters: {'p_sma': 42, 'p_std': 37, 'p_atr': 22, 'p_adx': 19, 'rsi_period': 39, 'ema1': 19, 'ema2': 57, 'slip_atr_k': 6.353127961574313e-05, 'slip_spread_k': 0.3664834749134475, 'spread_hl_frac': 0.02477930634203025, 'bb_std_mult': 1.3663880071412657, 'rsi_os': 35, 'rsi_ob': 94, 'vol_spike': 0.22589917324963213, 'adx_thresh': 27.328844289036685, 'atr_min_pct': 0.019656537691366188, 'atr_max_pct': 0.040896522857562304, 'tp_mult': 2.949995222766801, 'tsl_mult': 0.6782189544918229, 'strategy': 'mean_reversion', 'time_stop': 173, 'use_sma': False, 'use_atr': True, 'use_adx': False, 'use_ema': True, 'use_spike': False, 'rsi_required': False, 'edge_k': 1.779825995268384, 'edge_cap': 0.17689221866811483, 'bull_strategy': 'breakout', 'bull_bb_std_mult': 3.5209381708935568, 'bull_rsi_os': 47, 'bull_rsi_ob': 81, 'bull_adx_thresh': 10.4189395454939, 'bull_atr_min_pct': 0.029304504994617654, 'bull_atr_max_pct': 0.04525993505364243, 'bull_tp_mult': 2.8240079131881224, 'bull_tsl_mult': 0.13300189928557354, 'bull_time_stop': 66, 'bull_use_sma': False, 'bull_use_ema': True, 'bull_use_atr': False, 'bull_use_adx': True, 'bull_use_spike': True, 'bull_rsi_required': False, 'bear_strategy': 'breakout', 'bear_bb_std_mult': 1.2397343778569667, 'bear_rsi_os': 23, 'bear_rsi_ob': 54, 'bear_adx_thresh': 13.157986060234505, 'bear_atr_min_pct': 0.024207033291171708, 'bear_atr_max_pct': 0.14330056303866825, 'bear_tp_mult': 2.7338530066917635, 'bear_tsl_mult': 0.08590015507222643, 'bear_time_stop': 53, 'bear_use_sma': True, 'bear_use_ema': False, 'bear_use_atr': True, 'bear_use_adx': True, 'bear_use_spike': True, 'bear_rsi_required': True, 'sideways_strategy': 'mean_reversion', 'sideways_bb_std_mult': 3.2810349972564223, 'sideways_rsi_os': 36, 'sideways_rsi_ob': 60, 'sideways_adx_thresh': 13.663413968788847, 'sideways_atr_min_pct': 0.00539845015482814, 'sideways_atr_max_pct': 0.013023710247535698, 'sideways_tp_mult': 1.8487314176930503, 'sideways_tsl_mult': 0.8881142053046911, 'sideways_time_stop': 261, 'sideways_use_sma': True, 'sideways_use_ema': False, 'sideways_use_atr': False, 'sideways_use_adx': True, 'sideways_use_spike': True, 'sideways_rsi_required': False}.
[I 2025-08-31 10:45:45,180] Trial 440 finished with values: [-1000000000.0, 1000000000.0] and parameters: {'p_sma': 42, 'p_std': 40, 'p_atr': 22, 'p_adx': 17, 'rsi_period': 41, 'ema1': 21, 'ema2': 57, 'slip_atr_k': 0.01714898759566688, 'slip_spread_k': 0.33173658301905984, 'spread_hl_frac': 0.022962099639585724, 'bb_std_mult': 2.4787475492828097, 'rsi_os': 35, 'rsi_ob': 75, 'vol_spike': 0.22575357154291842, 'adx_thresh': 9.473533092801675, 'atr_min_pct': 0.019459517816575875, 'atr_max_pct': 0.0335548192736659, 'tp_mult': 2.955028539932551, 'tsl_mult': 0.6736996073045831, 'strategy': 'mean_reversion', 'time_stop': 173, 'use_sma': False, 'use_atr': True, 'use_adx': False, 'use_ema': True, 'use_spike': False, 'rsi_required': False, 'edge_k': 0.9586524362600535, 'edge_cap': 0.1912953968510291, 'bull_strategy': 'breakout', 'bull_bb_std_mult': 3.397789993615301, 'bull_rsi_os': 47, 'bull_rsi_ob': 79, 'bull_adx_thresh': 27.57654585680338, 'bull_atr_min_pct': 0.02701807594799274, 'bull_atr_max_pct': 0.04666667884122601, 'bull_tp_mult': 2.886071054196538, 'bull_tsl_mult': 0.15760589225562774, 'bull_time_stop': 55, 'bull_use_sma': False, 'bull_use_ema': False, 'bull_use_atr': False, 'bull_use_adx': True, 'bull_use_spike': True, 'bull_rsi_required': True, 'bear_strategy': 'breakout', 'bear_bb_std_mult': 1.2363679850730307, 'bear_rsi_os': 23, 'bear_rsi_ob': 55, 'bear_adx_thresh': 14.00833154164584, 'bear_atr_min_pct': 0.02630896021058659, 'bear_atr_max_pct': 0.1349902809785566, 'bear_tp_mult': 2.832052774850351, 'bear_tsl_mult': 0.10729993419276913, 'bear_time_stop': 121, 'bear_use_sma': True, 'bear_use_ema': False, 'bear_use_atr': True, 'bear_use_adx': False, 'bear_use_spike': True, 'bear_rsi_required': True, 'sideways_strategy': 'mean_reversion', 'sideways_bb_std_mult': 2.445813301415523, 'sideways_rsi_os': 36, 'sideways_rsi_ob': 59, 'sideways_adx_thresh': 13.96348231277925, 'sideways_atr_min_pct': 0.006457136419515017, 'sideways_atr_max_pct': 0.013015794112009748, 'sideways_tp_mult': 1.9048339706210216, 'sideways_tsl_mult': 0.8963264268113179, 'sideways_time_stop': 186, 'sideways_use_sma': False, 'sideways_use_ema': False, 'sideways_use_atr': False, 'sideways_use_adx': True, 'sideways_use_spike': True, 'sideways_rsi_required': False}.
[I 2025-08-31 10:45:45,722] Trial 441 finished with values: [-1000000000.0, 1000000000.0] and parameters: {'p_sma': 44, 'p_std': 40, 'p_atr': 21, 'p_adx': 17, 'rsi_period': 40, 'ema1': 21, 'ema2': 57, 'slip_atr_k': 0.011498496396915508, 'slip_spread_k': 0.3300471083162844, 'spread_hl_frac': 0.022935121086607602, 'bb_std_mult': 2.498497877798761, 'rsi_os': 34, 'rsi_ob': 75, 'vol_spike': 0.22247604686568964, 'adx_thresh': 9.482261524174925, 'atr_min_pct': 0.021722163315446567, 'atr_max_pct': 0.03329727601884915, 'tp_mult': 2.8366976801248134, 'tsl_mult': 0.7264765435932576, 'strategy': 'mean_reversion', 'time_stop': 154, 'use_sma': False, 'use_atr': True, 'use_adx': False, 'use_ema': True, 'use_spike': False, 'rsi_required': False, 'edge_k': 1.8700479538660815, 'edge_cap': 0.1937776588928685, 'bull_strategy': 'breakout', 'bull_bb_std_mult': 3.4004050655403244, 'bull_rsi_os': 47, 'bull_rsi_ob': 79, 'bull_adx_thresh': 32.24592203004725, 'bull_atr_min_pct': 0.027138018395678084, 'bull_atr_max_pct': 0.052835617298567825, 'bull_tp_mult': 2.889259386113555, 'bull_tsl_mult': 0.15480843515154, 'bull_time_stop': 53, 'bull_use_sma': False, 'bull_use_ema': False, 'bull_use_atr': False, 'bull_use_adx': True, 'bull_use_spike': True, 'bull_rsi_required': True, 'bear_strategy': 'breakout', 'bear_bb_std_mult': 1.5737793481523852, 'bear_rsi_os': 22, 'bear_rsi_ob': 55, 'bear_adx_thresh': 14.375215500940836, 'bear_atr_min_pct': 0.026138279249921584, 'bear_atr_max_pct': 0.13531416767206136, 'bear_tp_mult': 2.712101934952067, 'bear_tsl_mult': 0.1037578988070162, 'bear_time_stop': 70, 'bear_use_sma': False, 'bear_use_ema': False, 'bear_use_atr': True, 'bear_use_adx': False, 'bear_use_spike': False, 'bear_rsi_required': True, 'sideways_strategy': 'mean_reversion', 'sideways_bb_std_mult': 2.758803433999689, 'sideways_rsi_os': 36, 'sideways_rsi_ob': 56, 'sideways_adx_thresh': 13.977872537170208, 'sideways_atr_min_pct': 0.006430359743722537, 'sideways_atr_max_pct': 0.1297085678622365, 'sideways_tp_mult': 1.9266627705758301, 'sideways_tsl_mult': 0.895243584494926, 'sideways_time_stop': 259, 'sideways_use_sma': False, 'sideways_use_ema': False, 'sideways_use_atr': False, 'sideways_use_adx': False, 'sideways_use_spike': True, 'sideways_rsi_required': False}.
[I 2025-08-31 10:45:45,724] Trial 439 finished with values: [-1000000000.0, 1000000000.0] and parameters: {'p_sma': 42, 'p_std': 40, 'p_atr': 22, 'p_adx': 19, 'rsi_period': 41, 'ema1': 21, 'ema2': 54, 'slip_atr_k': 0.015636972887272615, 'slip_spread_k': 0.3309068884120283, 'spread_hl_frac': 0.022988498147548803, 'bb_std_mult': 1.4075546081199395, 'rsi_os': 35, 'rsi_ob': 75, 'vol_spike': 0.22438559089884483, 'adx_thresh': 14.34807201596833, 'atr_min_pct': 0.02191349490128507, 'atr_max_pct': 0.042492008933629304, 'tp_mult': 2.0558572255261867, 'tsl_mult': 0.6944184844293285, 'strategy': 'mean_reversion', 'time_stop': 154, 'use_sma': False, 'use_atr': True, 'use_adx': False, 'use_ema': True, 'use_spike': False, 'rsi_required': False, 'edge_k': 1.8828122912854788, 'edge_cap': 0.1896663146911935, 'bull_strategy': 'breakout', 'bull_bb_std_mult': 3.372237158361629, 'bull_rsi_os': 47, 'bull_rsi_ob': 77, 'bull_adx_thresh': 10.11292936131165, 'bull_atr_min_pct': 0.025590669920237216, 'bull_atr_max_pct': 0.04189285560239274, 'bull_tp_mult': 2.6887936349087305, 'bull_tsl_mult': 0.15737691850711727, 'bull_time_stop': 58, 'bull_use_sma': False, 'bull_use_ema': False, 'bull_use_atr': False, 'bull_use_adx': True, 'bull_use_spike': True, 'bull_rsi_required': True, 'bear_strategy': 'breakout', 'bear_bb_std_mult': 1.2784088777684073, 'bear_rsi_os': 22, 'bear_rsi_ob': 55, 'bear_adx_thresh': 14.109315794173137, 'bear_atr_min_pct': 0.026092196454622477, 'bear_atr_max_pct': 0.13498097161030395, 'bear_tp_mult': 2.732704641448419, 'bear_tsl_mult': 0.1142307772496597, 'bear_time_stop': 283, 'bear_use_sma': False, 'bear_use_ema': False, 'bear_use_atr': True, 'bear_use_adx': False, 'bear_use_spike': True, 'bear_rsi_required': True, 'sideways_strategy': 'mean_reversion', 'sideways_bb_std_mult': 2.780886778252031, 'sideways_rsi_os': 36, 'sideways_rsi_ob': 59, 'sideways_adx_thresh': 13.919778905142769, 'sideways_atr_min_pct': 0.006360819291992489, 'sideways_atr_max_pct': 0.012540769606540795, 'sideways_tp_mult': 1.8999280429670022, 'sideways_tsl_mult': 0.8935625129220134, 'sideways_time_stop': 188, 'sideways_use_sma': False, 'sideways_use_ema': False, 'sideways_use_atr': False, 'sideways_use_adx': False, 'sideways_use_spike': True, 'sideways_rsi_required': False}.
