[I 2025-08-31 10:15:54,669] Trial 188 finished with values: [-1000000000.0, 1000000000.0] and parameters: {'p_sma': 25, 'p_std': 54, 'p_atr': 25, 'p_adx': 12, 'rsi_period': 18, 'ema1': 13, 'ema2': 11, 'slip_atr_k': 0.19123605631507654, 'slip_spread_k': 0.2544923284007245, 'spread_hl_frac': 0.04248473306027188, 'bb_std_mult': 0.693448534331418, 'rsi_os': 9, 'rsi_ob': 74, 'vol_spike': 0.22127874630732355, 'adx_thresh': 32.71034342109533, 'atr_min_pct': 0.010289255897056586, 'atr_max_pct': 0.046647917099290406, 'tp_mult': 1.1909029389193497, 'tsl_mult': 0.38814539351204475, 'strategy': 'breakout', 'time_stop': 127, 'use_sma': True, 'use_atr': True, 'use_adx': True, 'use_ema': True, 'use_spike': False, 'rsi_required': True, 'edge_k': 0.9505567951338778, 'edge_cap': 0.401735452413946, 'bull_strategy': 'mean_reversion', 'bull_bb_std_mult': 0.877228414258385, 'bull_rsi_os': 8, 'bull_rsi_ob': 72, 'bull_adx_thresh': 20.953235993511907, 'bull_atr_min_pct': 0.003486901297489446, 'bull_atr_max_pct': 0.062268230232822505, 'bull_tp_mult': 2.1919967269725853, 'bull_tsl_mult': 0.5274578436286175, 'bull_time_stop': 248, 'bull_use_sma': False, 'bull_use_ema': False, 'bull_use_atr': False, 'bull_use_adx': True, 'bull_use_spike': True, 'bull_rsi_required': True, 'bear_strategy': 'mean_reversion', 'bear_bb_std_mult': 1.027198677119113, 'bear_rsi_os': 18, 'bear_rsi_ob': 70, 'bear_adx_thresh': 16.497901041666772, 'bear_atr_min_pct': 0.007780467548692093, 'bear_atr_max_pct': 0.1328555200622359, 'bear_tp_mult': 2.5870178456685053, 'bear_tsl_mult': 0.9907437563290609, 'bear_time_stop': 10, 'bear_use_sma': False, 'bear_use_ema': False, 'bear_use_atr': True, 'bear_use_adx': False, 'bear_use_spike': True, 'bear_rsi_required': True, 'sideways_strategy': 'breakout', 'sideways_bb_std_mult': 1.1960931107558193, 'sideways_rsi_os': 10, 'sideways_rsi_ob': 70, 'sideways_adx_thresh': 27.20631785259724, 'sideways_atr_min_pct': 0.026197509479986954, 'sideways_atr_max_pct': 0.13344862686606074, 'sideways_tp_mult': 1.6791903658340441, 'sideways_tsl_mult': 0.8763495642095462, 'sideways_time_stop': 249, 'sideways_use_sma': True, 'sideways_use_ema': True, 'sideways_use_atr': False, 'sideways_use_adx': False, 'sideways_use_spike': False, 'sideways_rsi_required': True}.
[I 2025-08-31 10:15:54,893] Trial 187 finished with values: [-1000000000.0, 1000000000.0] and parameters: {'p_sma': 50, 'p_std': 38, 'p_atr': 16, 'p_adx': 12, 'rsi_period': 19, 'ema1': 13, 'ema2': 30, 'slip_atr_k': 0.20891702260805092, 'slip_spread_k': 0.20106241110541537, 'spread_hl_frac': 0.021253637219101295, 'bb_std_mult': 0.6988644953840322, 'rsi_os': 44, 'rsi_ob': 48, 'vol_spike': 0.2211476335299134, 'adx_thresh': 12.628065578451391, 'atr_min_pct': 0.007931356738224956, 'atr_max_pct': 0.09528690042315559, 'tp_mult': 2.4137970184501385, 'tsl_mult': 0.7245993088938676, 'strategy': 'breakout', 'time_stop': 123, 'use_sma': True, 'use_atr': False, 'use_adx': True, 'use_ema': False, 'use_spike': False, 'rsi_required': True, 'edge_k': 1.1755501417835448, 'edge_cap': 0.6107126650110287, 'bull_strategy': 'mean_reversion', 'bull_bb_std_mult': 1.6749900180759396, 'bull_rsi_os': 7, 'bull_rsi_ob': 62, 'bull_adx_thresh': 12.569464118190515, 'bull_atr_min_pct': 0.014409371258015195, 'bull_atr_max_pct': 0.07918800043076016, 'bull_tp_mult': 1.0519407737947155, 'bull_tsl_mult': 0.5289227593033419, 'bull_time_stop': 136, 'bull_use_sma': True, 'bull_use_ema': False, 'bull_use_atr': False, 'bull_use_adx': True, 'bull_use_spike': True, 'bull_rsi_required': True, 'bear_strategy': 'mean_reversion', 'bear_bb_std_mult': 1.012362290609188, 'bear_rsi_os': 27, 'bear_rsi_ob': 59, 'bear_adx_thresh': 17.280340922067545, 'bear_atr_min_pct': 0.01122729001623673, 'bear_atr_max_pct': 0.1330785813208422, 'bear_tp_mult': 1.0157949703628737, 'bear_tsl_mult': 0.8935344027251888, 'bear_time_stop': 11, 'bear_use_sma': False, 'bear_use_ema': False, 'bear_use_atr': False, 'bear_use_adx': False, 'bear_use_spike': True, 'bear_rsi_required': True, 'sideways_strategy': 'breakout', 'sideways_bb_std_mult': 3.0014530833790567, 'sideways_rsi_os': 12, 'sideways_rsi_ob': 70, 'sideways_adx_thresh': 15.58453799065778, 'sideways_atr_min_pct': 0.029329078460316783, 'sideways_atr_max_pct': 0.06090424899610554, 'sideways_tp_mult': 1.6953348276284703, 'sideways_tsl_mult': 0.8371415060881215, 'sideways_time_stop': 247, 'sideways_use_sma': True, 'sideways_use_ema': True, 'sideways_use_atr': True, 'sideways_use_adx': False, 'sideways_use_spike': False, 'sideways_rsi_required': True}.
[I 2025-08-31 10:15:55,758] Trial 191 finished with values: [-1000000000.0, 1000000000.0] and parameters: {'p_sma': 21, 'p_std': 40, 'p_atr': 25, 'p_adx': 20, 'rsi_period': 27, 'ema1': 13, 'ema2': 10, 'slip_atr_k': 0.19060892264000134, 'slip_spread_k': 0.26327664435926806, 'spread_hl_frac': 0.01467832254605667, 'bb_std_mult': 1.6251901359087124, 'rsi_os': 44, 'rsi_ob': 80, 'vol_spike': 0.2899837529599708, 'adx_thresh': 31.86950098400252, 'atr_min_pct': 0.009040425000144533, 'atr_max_pct': 0.0858470199393101, 'tp_mult': 2.1788981497799953, 'tsl_mult': 0.40787017887765703, 'strategy': 'breakout', 'time_stop': 128, 'use_sma': True, 'use_atr': False, 'use_adx': True, 'use_ema': False, 'use_spike': False, 'rsi_required': True, 'edge_k': 0.7483493170608256, 'edge_cap': 0.48002189309883614, 'bull_strategy': 'breakout', 'bull_bb_std_mult': 2.082669451104797, 'bull_rsi_os': 48, 'bull_rsi_ob': 69, 'bull_adx_thresh': 12.651559123068997, 'bull_atr_min_pct': 0.011731643234010939, 'bull_atr_max_pct': 0.0690327016756559, 'bull_tp_mult': 2.192388284966084, 'bull_tsl_mult': 0.0774855984037075, 'bull_time_stop': 15, 'bull_use_sma': False, 'bull_use_ema': False, 'bull_use_atr': False, 'bull_use_adx': True, 'bull_use_spike': True, 'bull_rsi_required': True, 'bear_strategy': 'mean_reversion', 'bear_bb_std_mult': 1.867230117760183, 'bear_rsi_os': 27, 'bear_rsi_ob': 70, 'bear_adx_thresh': 10.191050853273403, 'bear_atr_min_pct': 0.011068428985966376, 'bear_atr_max_pct': 0.11413983554622861, 'bear_tp_mult': 1.8680312256348162, 'bear_tsl_mult': 0.09782376213855865, 'bear_time_stop': 27, 'bear_use_sma': False, 'bear_use_ema': False, 'bear_use_atr': True, 'bear_use_adx': False, 'bear_use_spike': True, 'bear_rsi_required': True, 'sideways_strategy': 'breakout', 'sideways_bb_std_mult': 3.076504796809294, 'sideways_rsi_os': 10, 'sideways_rsi_ob': 70, 'sideways_adx_thresh': 9.256805716669012, 'sideways_atr_min_pct': 0.026157618068281843, 'sideways_atr_max_pct': 0.08010622330252141, 'sideways_tp_mult': 1.1737459700831752, 'sideways_tsl_mult': 0.8372832526689068, 'sideways_time_stop': 5, 'sideways_use_sma': True, 'sideways_use_ema': True, 'sideways_use_atr': False, 'sideways_use_adx': False, 'sideways_use_spike': False, 'sideways_rsi_required': True}.
[I 2025-08-31 10:16:26,914] Trial 195 finished with values: [-0.00096886149556763, 0.001871906026313559] and parameters: {'p_sma': 20, 'p_std': 34, 'p_atr': 17, 'p_adx': 8, 'rsi_period': 23, 'ema1': 12, 'ema2': 59, 'slip_atr_k': 0.06810697629791103, 'slip_spread_k': 0.28068983367984274, 'spread_hl_frac': 0.02803099233648957, 'bb_std_mult': 2.578320232373888, 'rsi_os': 41, 'rsi_ob': 75, 'vol_spike': 0.2102696832859328, 'adx_thresh': 8.718205845397277, 'atr_min_pct': 0.019486238780359842, 'atr_max_pct': 0.043311768623936875, 'tp_mult': 2.794475616098988, 'tsl_mult': 0.6667828864068372, 'strategy': 'mean_reversion', 'time_stop': 141, 'use_sma': False, 'use_atr': False, 'use_adx': True, 'use_ema': False, 'use_spike': True, 'rsi_required': True, 'edge_k': 1.717538372155465, 'edge_cap': 0.1468063742349806, 'bull_strategy': 'breakout', 'bull_bb_std_mult': 1.020741309519098, 'bull_rsi_os': 42, 'bull_rsi_ob': 75, 'bull_adx_thresh': 10.789142269339786, 'bull_atr_min_pct': 0.0035868455539229, 'bull_atr_max_pct': 0.07121168325116482, 'bull_tp_mult': 1.1886288295131153, 'bull_tsl_mult': 0.09671444553524063, 'bull_time_stop': 14, 'bull_use_sma': True, 'bull_use_ema': True, 'bull_use_atr': True, 'bull_use_adx': True, 'bull_use_spike': True, 'bull_rsi_required': False, 'bear_strategy': 'breakout', 'bear_bb_std_mult': 2.06361181833126, 'bear_rsi_os': 29, 'bear_rsi_ob': 57, 'bear_adx_thresh': 7.765868287544885, 'bear_atr_min_pct': 0.01698065779469387, 'bear_atr_max_pct': 0.12423898139588806, 'bear_tp_mult': 2.6345756167279877, 'bear_tsl_mult': 0.14532331910819374, 'bear_time_stop': 32, 'bear_use_sma': False, 'bear_use_ema': False, 'bear_use_atr': True, 'bear_use_adx': False, 'bear_use_spike': True, 'bear_rsi_required': True, 'sideways_strategy': 'breakout', 'sideways_bb_std_mult': 2.6217542956529396, 'sideways_rsi_os': 34, 'sideways_rsi_ob': 84, 'sideways_adx_thresh': 14.927371051762478, 'sideways_atr_min_pct': 0.003162449956194498, 'sideways_atr_max_pct': 0.01321448689616174, 'sideways_tp_mult': 1.2263937055928513, 'sideways_tsl_mult': 0.8172461082349456, 'sideways_time_stop': 265, 'sideways_use_sma': True, 'sideways_use_ema': False, 'sideways_use_atr': False, 'sideways_use_adx': False, 'sideways_use_spike': True, 'sideways_rsi_required': False}.
[I 2025-08-31 10:16:27,968] Trial 192 finished with values: [-1000000000.0, 1000000000.0] and parameters: {'p_sma': 21, 'p_std': 50, 'p_atr': 17, 'p_adx': 11, 'rsi_period': 22, 'ema1': 12, 'ema2': 11, 'slip_atr_k': 0.190015925983537, 'slip_spread_k': 0.2610922136589715, 'spread_hl_frac': 0.00196118470559508, 'bb_std_mult': 1.6493764955143047, 'rsi_os': 55, 'rsi_ob': 78, 'vol_spike': 0.02998802265741203, 'adx_thresh': 12.157721688674453, 'atr_min_pct': 0.007714324552902668, 'atr_max_pct': 0.04613266936274625, 'tp_mult': 2.7772622184036946, 'tsl_mult': 0.11469612752051228, 'strategy': 'breakout', 'time_stop': 123, 'use_sma': True, 'use_atr': False, 'use_adx': True, 'use_ema': False, 'use_spike': False, 'rsi_required': True, 'edge_k': 1.8779159493934463, 'edge_cap': 0.5472927342293736, 'bull_strategy': 'breakout', 'bull_bb_std_mult': 2.9080464815855867, 'bull_rsi_os': 48, 'bull_rsi_ob': 76, 'bull_adx_thresh': 10.935673813179935, 'bull_atr_min_pct': 0.0037385877653998275, 'bull_atr_max_pct': 0.06107808971187281, 'bull_tp_mult': 1.190996004546373, 'bull_tsl_mult': 0.959228374011885, 'bull_time_stop': 14, 'bull_use_sma': True, 'bull_use_ema': False, 'bull_use_atr': True, 'bull_use_adx': True, 'bull_use_spike': True, 'bull_rsi_required': True, 'bear_strategy': 'breakout', 'bear_bb_std_mult': 2.066859881246816, 'bear_rsi_os': 16, 'bear_rsi_ob': 57, 'bear_adx_thresh': 30.573344231119947, 'bear_atr_min_pct': 0.024600678033609054, 'bear_atr_max_pct': 0.12338671505260984, 'bear_tp_mult': 1.8559871893219877, 'bear_tsl_mult': 0.9785498512316059, 'bear_time_stop': 29, 'bear_use_sma': False, 'bear_use_ema': False, 'bear_use_atr': True, 'bear_use_adx': False, 'bear_use_spike': True, 'bear_rsi_required': True, 'sideways_strategy': 'breakout', 'sideways_bb_std_mult': 1.9977172974764599, 'sideways_rsi_os': 12, 'sideways_rsi_ob': 70, 'sideways_adx_thresh': 27.12490254075604, 'sideways_atr_min_pct': 0.0042532171877464765, 'sideways_atr_max_pct': 0.06002937678054386, 'sideways_tp_mult': 2.990741222628373, 'sideways_tsl_mult': 0.8190520081310539, 'sideways_time_stop': 10, 'sideways_use_sma': True, 'sideways_use_ema': True, 'sideways_use_atr': True, 'sideways_use_adx': False, 'sideways_use_spike': False, 'sideways_rsi_required': True}.
[I 2025-08-31 10:16:28,387] Trial 193 finished with values: [-0.013625349966921552, 0.013436358804980756] and parameters: {'p_sma': 19, 'p_std': 50, 'p_atr': 17, 'p_adx': 11, 'rsi_period': 22, 'ema1': 12, 'ema2': 13, 'slip_atr_k': 0.19881729737143444, 'slip_spread_k': 0.29298737173583894, 'spread_hl_frac': 0.002376206898953337, 'bb_std_mult': 1.661831645447433, 'rsi_os': 41, 'rsi_ob': 78, 'vol_spike': 0.2076188637546991, 'adx_thresh': 30.33352806506356, 'atr_min_pct': 0.008928349725496837, 'atr_max_pct': 0.03665753039892888, 'tp_mult': 2.5728940046329174, 'tsl_mult': 0.4131997228400828, 'strategy': 'breakout', 'time_stop': 154, 'use_sma': True, 'use_atr': False, 'use_adx': True, 'use_ema': False, 'use_spike': True, 'rsi_required': True, 'edge_k': 1.871155941181657, 'edge_cap': 0.5431577951726227, 'bull_strategy': 'breakout', 'bull_bb_std_mult': 1.0037922916076385, 'bull_rsi_os': 6, 'bull_rsi_ob': 77, 'bull_adx_thresh': 12.51189629836497, 'bull_atr_min_pct': 0.0021823775771344887, 'bull_atr_max_pct': 0.07087794848940412, 'bull_tp_mult': 1.4298696311607175, 'bull_tsl_mult': 0.0764202001868014, 'bull_time_stop': 199, 'bull_use_sma': True, 'bull_use_ema': False, 'bull_use_atr': True, 'bull_use_adx': True, 'bull_use_spike': True, 'bull_rsi_required': True, 'bear_strategy': 'breakout', 'bear_bb_std_mult': 2.081200318181079, 'bear_rsi_os': 16, 'bear_rsi_ob': 57, 'bear_adx_thresh': 12.334009923106375, 'bear_atr_min_pct': 0.012424194966125793, 'bear_atr_max_pct': 0.12363859548666074, 'bear_tp_mult': 2.0902379063127468, 'bear_tsl_mult': 0.08963838341339675, 'bear_time_stop': 17, 'bear_use_sma': False, 'bear_use_ema': False, 'bear_use_atr': False, 'bear_use_adx': False, 'bear_use_spike': True, 'bear_rsi_required': True, 'sideways_strategy': 'breakout', 'sideways_bb_std_mult': 2.0011286433528346, 'sideways_rsi_os': 13, 'sideways_rsi_ob': 84, 'sideways_adx_thresh': 15.372860507672396, 'sideways_atr_min_pct': 0.02552840982876125, 'sideways_atr_max_pct': 0.02290910936805391, 'sideways_tp_mult': 1.4757763740531429, 'sideways_tsl_mult': 0.826040645889434, 'sideways_time_stop': 61, 'sideways_use_sma': True, 'sideways_use_ema': True, 'sideways_use_atr': True, 'sideways_use_adx': False, 'sideways_use_spike': True, 'sideways_rsi_required': False}.
[I 2025-08-31 10:16:28,497] Trial 194 finished with values: [-1000000000.0, 1000000000.0] and parameters: {'p_sma': 21, 'p_std': 40, 'p_atr': 17, 'p_adx': 11, 'rsi_period': 22, 'ema1': 12, 'ema2': 10, 'slip_atr_k': 0.03408622741022091, 'slip_spread_k': 0.2875728881837301, 'spread_hl_frac': 0.0023518203265216558, 'bb_std_mult': 2.6022755173709715, 'rsi_os': 41, 'rsi_ob': 80, 'vol_spike': 0.21349033486291252, 'adx_thresh': 8.395147159783729, 'atr_min_pct': 0.0269689408555103, 'atr_max_pct': 0.05235209239479555, 'tp_mult': 2.1562600887601366, 'tsl_mult': 0.35665049219088496, 'strategy': 'mean_reversion', 'time_stop': 156, 'use_sma': False, 'use_atr': False, 'use_adx': True, 'use_ema': False, 'use_spike': True, 'rsi_required': True, 'edge_k': 1.7315205065971249, 'edge_cap': 0.1511785128934066, 'bull_strategy': 'breakout', 'bull_bb_std_mult': 1.0104489678484987, 'bull_rsi_os': 10, 'bull_rsi_ob': 75, 'bull_adx_thresh': 7.015885602067586, 'bull_atr_min_pct': 0.004090499292910819, 'bull_atr_max_pct': 0.07090002565504905, 'bull_tp_mult': 1.43716356271337, 'bull_tsl_mult': 0.07442454553838007, 'bull_time_stop': 15, 'bull_use_sma': True, 'bull_use_ema': True, 'bull_use_atr': True, 'bull_use_adx': True, 'bull_use_spike': True, 'bull_rsi_required': False, 'bear_strategy': 'breakout', 'bear_bb_std_mult': 2.0667976746623182, 'bear_rsi_os': 16, 'bear_rsi_ob': 55, 'bear_adx_thresh': 12.196496029986172, 'bear_atr_min_pct': 0.00995357445228465, 'bear_atr_max_pct': 0.12435183159339054, 'bear_tp_mult': 2.6332436854829635, 'bear_tsl_mult': 0.088575173326563, 'bear_time_stop': 29, 'bear_use_sma': False, 'bear_use_ema': False, 'bear_use_atr': True, 'bear_use_adx': False, 'bear_use_spike': True, 'bear_rsi_required': True, 'sideways_strategy': 'breakout', 'sideways_bb_std_mult': 1.4194867909851137, 'sideways_rsi_os': 34, 'sideways_rsi_ob': 95, 'sideways_adx_thresh': 14.764987527985635, 'sideways_atr_min_pct': 0.003861279637153499, 'sideways_atr_max_pct': 0.013041895118102262, 'sideways_tp_mult': 1.4781350382065015, 'sideways_tsl_mult': 0.8213216878754159, 'sideways_time_stop': 5, 'sideways_use_sma': True, 'sideways_use_ema': True, 'sideways_use_atr': False, 'sideways_use_adx': False, 'sideways_use_spike': True, 'sideways_rsi_required': True}.
[I 2025-08-31 10:16:28,912] Trial 196 finished with values: [-1000000000.0, 1000000000.0] and parameters: {'p_sma': 20, 'p_std': 34, 'p_atr': 19, 'p_adx': 7, 'rsi_period': 24, 'ema1': 12, 'ema2': 59, 'slip_atr_k': 0.035275493315787484, 'slip_spread_k': 0.2893529637513561, 'spread_hl_frac': 0.028033405186286477, 'bb_std_mult': 2.8066159283389385, 'rsi_os': 51, 'rsi_ob': 78, 'vol_spike': 0.21224586245667668, 'adx_thresh': 9.749510481835248, 'atr_min_pct': 0.022845781519040067, 'atr_max_pct': 0.03783220793738404, 'tp_mult': 2.964701649136067, 'tsl_mult': 0.6137097291973183, 'strategy': 'mean_reversion', 'time_stop': 154, 'use_sma': False, 'use_atr': False, 'use_adx': False, 'use_ema': False, 'use_spike': True, 'rsi_required': True, 'edge_k': 1.6864464391445226, 'edge_cap': 0.14026842810122264, 'bull_strategy': 'breakout', 'bull_bb_std_mult': 1.090810321821414, 'bull_rsi_os': 47, 'bull_rsi_ob': 77, 'bull_adx_thresh': 9.931627444402455, 'bull_atr_min_pct': 0.00399976373422088, 'bull_atr_max_pct': 0.07157752669248982, 'bull_tp_mult': 1.4377410714005663, 'bull_tsl_mult': 0.1463703935847323, 'bull_time_stop': 18, 'bull_use_sma': True, 'bull_use_ema': True, 'bull_use_atr': True, 'bull_use_adx': True, 'bull_use_spike': True, 'bull_rsi_required': False, 'bear_strategy': 'breakout', 'bear_bb_std_mult': 2.2981091862259615, 'bear_rsi_os': 16, 'bear_rsi_ob': 61, 'bear_adx_thresh': 7.7903810893201815, 'bear_atr_min_pct': 0.024452123737757143, 'bear_atr_max_pct': 0.12231317742698825, 'bear_tp_mult': 2.7604900034454865, 'bear_tsl_mult': 0.1484745880545183, 'bear_time_stop': 52, 'bear_use_sma': False, 'bear_use_ema': True, 'bear_use_atr': True, 'bear_use_adx': False, 'bear_use_spike': True, 'bear_rsi_required': True, 'sideways_strategy': 'breakout', 'sideways_bb_std_mult': 2.715061121515393, 'sideways_rsi_os': 34, 'sideways_rsi_ob': 84, 'sideways_adx_thresh': 13.792167539537168, 'sideways_atr_min_pct': 0.003427211121665096, 'sideways_atr_max_pct': 0.012245371384297347, 'sideways_tp_mult': 1.234552375554864, 'sideways_tsl_mult': 0.8325886100534412, 'sideways_time_stop': 267, 'sideways_use_sma': True, 'sideways_use_ema': False, 'sideways_use_atr': False, 'sideways_use_adx': False, 'sideways_use_spike': True, 'sideways_rsi_required': False}.
[I 2025-08-31 10:17:00,267] Trial 199 finished with values: [-1000000000.0, 1000000000.0] and parameters: {'p_sma': 42, 'p_std': 34, 'p_atr': 19, 'p_adx': 8, 'rsi_period': 24, 'ema1': 11, 'ema2': 59, 'slip_atr_k': 0.09014143672367375, 'slip_spread_k': 0.3449055433194502, 'spread_hl_frac': 0.028407745373999076, 'bb_std_mult': 2.9071081664465694, 'rsi_os': 43, 'rsi_ob': 77, 'vol_spike': 0.21150358625306442, 'adx_thresh': 10.58952650856102, 'atr_min_pct': 0.01985678578509103, 'atr_max_pct': 0.03769692950412845, 'tp_mult': 2.8986628436938187, 'tsl_mult': 0.6018732076138218, 'strategy': 'mean_reversion', 'time_stop': 148, 'use_sma': False, 'use_atr': False, 'use_adx': False, 'use_ema': False, 'use_spike': True, 'rsi_required': True, 'edge_k': 1.5999765513087032, 'edge_cap': 0.17101712264478489, 'bull_strategy': 'breakout', 'bull_bb_std_mult': 1.0972095761149696, 'bull_rsi_os': 42, 'bull_rsi_ob': 79, 'bull_adx_thresh': 9.991094925757356, 'bull_atr_min_pct': 0.00509515953767615, 'bull_atr_max_pct': 0.06509266446613503, 'bull_tp_mult': 1.30010197195908, 'bull_tsl_mult': 0.14979102141327227, 'bull_time_stop': 21, 'bull_use_sma': True, 'bull_use_ema': True, 'bull_use_atr': True, 'bull_use_adx': True, 'bull_use_spike': True, 'bull_rsi_required': False, 'bear_strategy': 'breakout', 'bear_bb_std_mult': 2.2820572805228014, 'bear_rsi_os': 28, 'bear_rsi_ob': 60, 'bear_adx_thresh': 7.988752455269919, 'bear_atr_min_pct': 0.01969861316438195, 'bear_atr_max_pct': 0.11868202957207988, 'bear_tp_mult': 2.7149324995355375, 'bear_tsl_mult': 0.1515619156452622, 'bear_time_stop': 50, 'bear_use_sma': False, 'bear_use_ema': True, 'bear_use_atr': True, 'bear_use_adx': True, 'bear_use_spike': True, 'bear_rsi_required': True, 'sideways_strategy': 'breakout', 'sideways_bb_std_mult': 2.6654204741678287, 'sideways_rsi_os': 36, 'sideways_rsi_ob': 90, 'sideways_adx_thresh': 13.69945265473824, 'sideways_atr_min_pct': 0.002377063904652894, 'sideways_atr_max_pct': 0.012233549636343046, 'sideways_tp_mult': 1.248556274411355, 'sideways_tsl_mult': 0.8657702919630327, 'sideways_time_stop': 268, 'sideways_use_sma': True, 'sideways_use_ema': False, 'sideways_use_atr': False, 'sideways_use_adx': False, 'sideways_use_spike': True, 'sideways_rsi_required': False}.
