[I 2025-08-31 10:12:09,449] Trial 162 finished with values: [-0.009215636200577082, 0.009680930713546579] and parameters: {'p_sma': 54, 'p_std': 59, 'p_atr': 16, 'p_adx': 11, 'rsi_period': 22, 'ema1': 7, 'ema2': 23, 'slip_atr_k': 0.12313500779959195, 'slip_spread_k': 0.1299059282517993, 'spread_hl_frac': 0.003125286104898423, 'bb_std_mult': 0.7225601216759272, 'rsi_os': 42, 'rsi_ob': 72, 'vol_spike': 0.21540838616143124, 'adx_thresh': 7.086725547199288, 'atr_min_pct': 0.008168508322142404, 'atr_max_pct': 0.055886286058475176, 'tp_mult': 2.7720168645544794, 'tsl_mult': 0.6927230709386925, 'strategy': 'mean_reversion', 'time_stop': 48, 'use_sma': False, 'use_atr': False, 'use_adx': False, 'use_ema': False, 'use_spike': False, 'rsi_required': True, 'edge_k': 1.6599198349947892, 'edge_cap': 0.4921801554914968, 'bull_strategy': 'mean_reversion', 'bull_bb_std_mult': 0.8094072179295746, 'bull_rsi_os': 7, 'bull_rsi_ob': 82, 'bull_adx_thresh': 10.464788576950383, 'bull_atr_min_pct': 0.0026206841021396404, 'bull_atr_max_pct': 0.055080723447496954, 'bull_tp_mult': 1.143777411867646, 'bull_tsl_mult': 0.05262389680820293, 'bull_time_stop': 23, 'bull_use_sma': True, 'bull_use_ema': False, 'bull_use_atr': True, 'bull_use_adx': True, 'bull_use_spike': True, 'bull_rsi_required': True, 'bear_strategy': 'breakout', 'bear_bb_std_mult': 1.9766347225552507, 'bear_rsi_os': 33, 'bear_rsi_ob': 55, 'bear_adx_thresh': 32.44294624460006, 'bear_atr_min_pct': 0.01166667479794281, 'bear_atr_max_pct': 0.1291326564466971, 'bear_tp_mult': 2.491730311382601, 'bear_tsl_mult': 0.22548550702477255, 'bear_time_stop': 17, 'bear_use_sma': False, 'bear_use_ema': True, 'bear_use_atr': True, 'bear_use_adx': False, 'bear_use_spike': True, 'bear_rsi_required': True, 'sideways_strategy': 'breakout', 'sideways_bb_std_mult': 2.47968733355579, 'sideways_rsi_os': 6, 'sideways_rsi_ob': 66, 'sideways_adx_thresh': 22.78277746947145, 'sideways_atr_min_pct': 0.027177055743733865, 'sideways_atr_max_pct': 0.07670978488348482, 'sideways_tp_mult': 1.4987302357098982, 'sideways_tsl_mult': 0.8051786159331312, 'sideways_time_stop': 22, 'sideways_use_sma': True, 'sideways_use_ema': True, 'sideways_use_atr': False, 'sideways_use_adx': False, 'sideways_use_spike': False, 'sideways_rsi_required': True}.
[I 2025-08-31 10:12:39,777] Trial 165 finished with values: [-0.010949135787730158, 0.01065310573781779] and parameters: {'p_sma': 23, 'p_std': 38, 'p_atr': 16, 'p_adx': 12, 'rsi_period': 15, 'ema1': 9, 'ema2': 12, 'slip_atr_k': 0.19745217040127952, 'slip_spread_k': 0.12033916561508562, 'spread_hl_frac': 0.024829546431331954, 'bb_std_mult': 0.6349775940511353, 'rsi_os': 42, 'rsi_ob': 72, 'vol_spike': 0.20703784541363318, 'adx_thresh': 7.077214250043851, 'atr_min_pct': 0.008935724926889396, 'atr_max_pct': 0.057048272156498325, 'tp_mult': 2.6387028864921316, 'tsl_mult': 0.6850783767284376, 'strategy': 'mean_reversion', 'time_stop': 47, 'use_sma': True, 'use_atr': False, 'use_adx': True, 'use_ema': False, 'use_spike': False, 'rsi_required': True, 'edge_k': 1.873834401967556, 'edge_cap': 0.42977554587518246, 'bull_strategy': 'mean_reversion', 'bull_bb_std_mult': 3.3670792851452007, 'bull_rsi_os': 10, 'bull_rsi_ob': 82, 'bull_adx_thresh': 6.691182655295329, 'bull_atr_min_pct': 0.0028740269584548537, 'bull_atr_max_pct': 0.06047766011119231, 'bull_tp_mult': 1.44319736070377, 'bull_tsl_mult': 0.10681736419394902, 'bull_time_stop': 8, 'bull_use_sma': True, 'bull_use_ema': False, 'bull_use_atr': True, 'bull_use_adx': True, 'bull_use_spike': True, 'bull_rsi_required': True, 'bear_strategy': 'breakout', 'bear_bb_std_mult': 1.9766240370318076, 'bear_rsi_os': 32, 'bear_rsi_ob': 55, 'bear_adx_thresh': 17.247430533541728, 'bear_atr_min_pct': 0.010344930130830939, 'bear_atr_max_pct': 0.13625725614036052, 'bear_tp_mult': 1.2282614482372756, 'bear_tsl_mult': 0.8767596680133642, 'bear_time_stop': 74, 'bear_use_sma': False, 'bear_use_ema': False, 'bear_use_atr': True, 'bear_use_adx': False, 'bear_use_spike': True, 'bear_rsi_required': True, 'sideways_strategy': 'breakout', 'sideways_bb_std_mult': 1.2850100513705225, 'sideways_rsi_os': 8, 'sideways_rsi_ob': 68, 'sideways_adx_thresh': 14.808451097716114, 'sideways_atr_min_pct': 0.02052351384656789, 'sideways_atr_max_pct': 0.08954220230266759, 'sideways_tp_mult': 1.1427992352363996, 'sideways_tsl_mult': 0.7978346811920893, 'sideways_time_stop': 21, 'sideways_use_sma': True, 'sideways_use_ema': False, 'sideways_use_atr': False, 'sideways_use_adx': False, 'sideways_use_spike': False, 'sideways_rsi_required': True}.
[I 2025-08-31 10:12:39,898] Trial 166 finished with values: [-0.017252727401319445, 0.0169560299009015] and parameters: {'p_sma': 23, 'p_std': 38, 'p_atr': 15, 'p_adx': 12, 'rsi_period': 17, 'ema1': 8, 'ema2': 38, 'slip_atr_k': 0.17984209895330922, 'slip_spread_k': 0.11791264697755838, 'spread_hl_frac': 0.0031488154388581817, 'bb_std_mult': 0.6049464719162843, 'rsi_os': 42, 'rsi_ob': 74, 'vol_spike': 0.0224466460479065, 'adx_thresh': 6.876462660957123, 'atr_min_pct': 0.021910118854327417, 'atr_max_pct': 0.05728465263419187, 'tp_mult': 1.0916983773984745, 'tsl_mult': 0.14718142918589594, 'strategy': 'mean_reversion', 'time_stop': 16, 'use_sma': False, 'use_atr': False, 'use_adx': True, 'use_ema': False, 'use_spike': False, 'rsi_required': True, 'edge_k': 1.8870291217149568, 'edge_cap': 0.4330961049976185, 'bull_strategy': 'mean_reversion', 'bull_bb_std_mult': 0.8102830136454757, 'bull_rsi_os': 10, 'bull_rsi_ob': 47, 'bull_adx_thresh': 10.522865036056162, 'bull_atr_min_pct': 0.0024957795621460954, 'bull_atr_max_pct': 0.06076219989827124, 'bull_tp_mult': 1.7083523852643565, 'bull_tsl_mult': 0.0487288419627179, 'bull_time_stop': 227, 'bull_use_sma': True, 'bull_use_ema': False, 'bull_use_atr': True, 'bull_use_adx': True, 'bull_use_spike': True, 'bull_rsi_required': True, 'bear_strategy': 'breakout', 'bear_bb_std_mult': 1.981985039681855, 'bear_rsi_os': 28, 'bear_rsi_ob': 56, 'bear_adx_thresh': 26.463464435482763, 'bear_atr_min_pct': 0.017983055408652034, 'bear_atr_max_pct': 0.13378749574345095, 'bear_tp_mult': 2.674880147324727, 'bear_tsl_mult': 0.29194664024809985, 'bear_time_stop': 15, 'bear_use_sma': False, 'bear_use_ema': False, 'bear_use_atr': True, 'bear_use_adx': False, 'bear_use_spike': True, 'bear_rsi_required': True, 'sideways_strategy': 'breakout', 'sideways_bb_std_mult': 1.273680782249326, 'sideways_rsi_os': 8, 'sideways_rsi_ob': 68, 'sideways_adx_thresh': 15.11665733334881, 'sideways_atr_min_pct': 0.02810132546258396, 'sideways_atr_max_pct': 0.08763409168075458, 'sideways_tp_mult': 2.827795664938555, 'sideways_tsl_mult': 0.7952875322089169, 'sideways_time_stop': 20, 'sideways_use_sma': True, 'sideways_use_ema': False, 'sideways_use_atr': False, 'sideways_use_adx': False, 'sideways_use_spike': False, 'sideways_rsi_required': True}.
[I 2025-08-31 10:12:40,153] Trial 164 finished with values: [-0.011517567600183742, 0.011225520506443825] and parameters: {'p_sma': 23, 'p_std': 41, 'p_atr': 16, 'p_adx': 12, 'rsi_period': 16, 'ema1': 10, 'ema2': 12, 'slip_atr_k': 0.19640204182150228, 'slip_spread_k': 0.10827716514241795, 'spread_hl_frac': 5.8502074666212656e-05, 'bb_std_mult': 0.5807376962391688, 'rsi_os': 42, 'rsi_ob': 72, 'vol_spike': 0.20607608582348283, 'adx_thresh': 6.618088052155388, 'atr_min_pct': 0.008658157200674036, 'atr_max_pct': 0.05892131183177564, 'tp_mult': 2.642532653268536, 'tsl_mult': 0.6944668886113264, 'strategy': 'mean_reversion', 'time_stop': 105, 'use_sma': True, 'use_atr': False, 'use_adx': True, 'use_ema': False, 'use_spike': False, 'rsi_required': True, 'edge_k': 1.6489760662555368, 'edge_cap': 0.4289660329946753, 'bull_strategy': 'mean_reversion', 'bull_bb_std_mult': 3.3669025056578894, 'bull_rsi_os': 10, 'bull_rsi_ob': 82, 'bull_adx_thresh': 11.388977123558805, 'bull_atr_min_pct': 0.002668954465899298, 'bull_atr_max_pct': 0.0967158921382345, 'bull_tp_mult': 1.5493029430055076, 'bull_tsl_mult': 0.05536909962179779, 'bull_time_stop': 9, 'bull_use_sma': True, 'bull_use_ema': False, 'bull_use_atr': True, 'bull_use_adx': True, 'bull_use_spike': True, 'bull_rsi_required': True, 'bear_strategy': 'breakout', 'bear_bb_std_mult': 1.9702034160748272, 'bear_rsi_os': 29, 'bear_rsi_ob': 55, 'bear_adx_thresh': 25.416332554958224, 'bear_atr_min_pct': 0.01022568787552969, 'bear_atr_max_pct': 0.11772371941880685, 'bear_tp_mult': 2.562250713220692, 'bear_tsl_mult': 0.39810332645381163, 'bear_time_stop': 72, 'bear_use_sma': False, 'bear_use_ema': False, 'bear_use_atr': True, 'bear_use_adx': False, 'bear_use_spike': True, 'bear_rsi_required': True, 'sideways_strategy': 'breakout', 'sideways_bb_std_mult': 2.4860466692170435, 'sideways_rsi_os': 8, 'sideways_rsi_ob': 68, 'sideways_adx_thresh': 14.968469183708962, 'sideways_atr_min_pct': 0.027315544769665592, 'sideways_atr_max_pct': 0.014550232572997963, 'sideways_tp_mult': 2.775336826880759, 'sideways_tsl_mult': 0.8036165552788144, 'sideways_time_stop': 20, 'sideways_use_sma': True, 'sideways_use_ema': True, 'sideways_use_atr': False, 'sideways_use_adx': False, 'sideways_use_spike': False, 'sideways_rsi_required': True}.
[I 2025-08-31 10:12:40,378] Trial 163 finished with values: [-1000000000.0, 1000000000.0] and parameters: {'p_sma': 23, 'p_std': 37, 'p_atr': 16, 'p_adx': 9, 'rsi_period': 16, 'ema1': 10, 'ema2': 49, 'slip_atr_k': 0.19282543713691658, 'slip_spread_k': 0.11312898443960778, 'spread_hl_frac': 1.8630115620780693e-06, 'bb_std_mult': 0.8790043613757379, 'rsi_os': 42, 'rsi_ob': 72, 'vol_spike': 0.02294355564575329, 'adx_thresh': 6.954145075846148, 'atr_min_pct': 0.008893788031733026, 'atr_max_pct': 0.03697079982660602, 'tp_mult': 2.7605958835662143, 'tsl_mult': 0.6832319792820021, 'strategy': 'mean_reversion', 'time_stop': 126, 'use_sma': False, 'use_atr': False, 'use_adx': False, 'use_ema': False, 'use_spike': False, 'rsi_required': True, 'edge_k': 1.655740508461482, 'edge_cap': 0.49877342882651854, 'bull_strategy': 'mean_reversion', 'bull_bb_std_mult': 0.8212347033184351, 'bull_rsi_os': 12, 'bull_rsi_ob': 73, 'bull_adx_thresh': 10.50008945598892, 'bull_atr_min_pct': 0.018762479974076936, 'bull_atr_max_pct': 0.0561478279977359, 'bull_tp_mult': 1.7009820211045013, 'bull_tsl_mult': 0.5894265001033194, 'bull_time_stop': 228, 'bull_use_sma': True, 'bull_use_ema': False, 'bull_use_atr': True, 'bull_use_adx': True, 'bull_use_spike': True, 'bull_rsi_required': True, 'bear_strategy': 'breakout', 'bear_bb_std_mult': 1.9878823736480578, 'bear_rsi_os': 32, 'bear_rsi_ob': 56, 'bear_adx_thresh': 15.796133585074362, 'bear_atr_min_pct': 0.011563788503101594, 'bear_atr_max_pct': 0.11671506160937609, 'bear_tp_mult': 2.5553278616665867, 'bear_tsl_mult': 0.2935125409913272, 'bear_time_stop': 70, 'bear_use_sma': False, 'bear_use_ema': False, 'bear_use_atr': True, 'bear_use_adx': False, 'bear_use_spike': True, 'bear_rsi_required': True, 'sideways_strategy': 'breakout', 'sideways_bb_std_mult': 1.2134318082817788, 'sideways_rsi_os': 8, 'sideways_rsi_ob': 68, 'sideways_adx_thresh': 16.801975104451877, 'sideways_atr_min_pct': 0.02067173816806453, 'sideways_atr_max_pct': 0.0681890224612034, 'sideways_tp_mult': 1.510290749445709, 'sideways_tsl_mult': 0.7957538498117624, 'sideways_time_stop': 22, 'sideways_use_sma': True, 'sideways_use_ema': True, 'sideways_use_atr': False, 'sideways_use_adx': False, 'sideways_use_spike': False, 'sideways_rsi_required': True}.
[I 2025-08-31 10:13:12,545] Trial 167 finished with values: [-0.013482777114108835, 0.01320895909197714] and parameters: {'p_sma': 23, 'p_std': 38, 'p_atr': 15, 'p_adx': 12, 'rsi_period': 17, 'ema1': 13, 'ema2': 12, 'slip_atr_k': 0.12405010452666357, 'slip_spread_k': 0.13170214961260185, 'spread_hl_frac': 0.00028641127702707216, 'bb_std_mult': 0.6154631046360117, 'rsi_os': 42, 'rsi_ob': 72, 'vol_spike': 0.0069088084998936705, 'adx_thresh': 6.995494792885406, 'atr_min_pct': 0.02119328424620611, 'atr_max_pct': 0.05794258946341348, 'tp_mult': 1.0876272714752462, 'tsl_mult': 0.16088815691451636, 'strategy': 'mean_reversion', 'time_stop': 20, 'use_sma': False, 'use_atr': False, 'use_adx': True, 'use_ema': False, 'use_spike': False, 'rsi_required': True, 'edge_k': 1.700392296689048, 'edge_cap': 0.3754903428515813, 'bull_strategy': 'mean_reversion', 'bull_bb_std_mult': 0.8164383453479347, 'bull_rsi_os': 12, 'bull_rsi_ob': 45, 'bull_adx_thresh': 10.25575568687238, 'bull_atr_min_pct': 0.002610227846111793, 'bull_atr_max_pct': 0.08407972179695776, 'bull_tp_mult': 1.549103520045924, 'bull_tsl_mult': 0.05531069151757606, 'bull_time_stop': 10, 'bull_use_sma': True, 'bull_use_ema': False, 'bull_use_atr': True, 'bull_use_adx': True, 'bull_use_spike': True, 'bull_rsi_required': True, 'bear_strategy': 'breakout', 'bear_bb_std_mult': 1.980854539969086, 'bear_rsi_os': 28, 'bear_rsi_ob': 56, 'bear_adx_thresh': 32.57150786248182, 'bear_atr_min_pct': 0.009598947846156683, 'bear_atr_max_pct': 0.13526034719333177, 'bear_tp_mult': 1.4828185927643744, 'bear_tsl_mult': 0.295743807427888, 'bear_time_stop': 72, 'bear_use_sma': False, 'bear_use_ema': False, 'bear_use_atr': True, 'bear_use_adx': False, 'bear_use_spike': True, 'bear_rsi_required': True, 'sideways_strategy': 'breakout', 'sideways_bb_std_mult': 1.2797575668619987, 'sideways_rsi_os': 8, 'sideways_rsi_ob': 68, 'sideways_adx_thresh': 15.156871805523068, 'sideways_atr_min_pct': 0.028271616972761676, 'sideways_atr_max_pct': 0.07589093666896739, 'sideways_tp_mult': 1.5645247554084498, 'sideways_tsl_mult': 0.795871476115013, 'sideways_time_stop': 21, 'sideways_use_sma': True, 'sideways_use_ema': True, 'sideways_use_atr': False, 'sideways_use_adx': False, 'sideways_use_spike': False, 'sideways_rsi_required': True}.
[I 2025-08-31 10:13:12,967] Trial 168 finished with values: [-1000000000.0, 1000000000.0] and parameters: {'p_sma': 20, 'p_std': 60, 'p_atr': 15, 'p_adx': 13, 'rsi_period': 24, 'ema1': 7, 'ema2': 49, 'slip_atr_k': 0.19450260238800463, 'slip_spread_k': 0.07396510490896693, 'spread_hl_frac': 0.00019392877448625497, 'bb_std_mult': 0.8953622656549738, 'rsi_os': 42, 'rsi_ob': 72, 'vol_spike': 0.008142505782733789, 'adx_thresh': 24.58421097626852, 'atr_min_pct': 0.021136936781424254, 'atr_max_pct': 0.0595340206575061, 'tp_mult': 2.646042581129133, 'tsl_mult': 0.6890356442071766, 'strategy': 'mean_reversion', 'time_stop': 126, 'use_sma': True, 'use_atr': False, 'use_adx': True, 'use_ema': False, 'use_spike': False, 'rsi_required': True, 'edge_k': 1.6592543149150087, 'edge_cap': 0.32757340945022806, 'bull_strategy': 'mean_reversion', 'bull_bb_std_mult': 0.9927516176386527, 'bull_rsi_os': 15, 'bull_rsi_ob': 81, 'bull_adx_thresh': 11.543466578514547, 'bull_atr_min_pct': 0.009679666422157236, 'bull_atr_max_pct': 0.06963176090785864, 'bull_tp_mult': 1.1592385562452643, 'bull_tsl_mult': 0.10227538528345245, 'bull_time_stop': 7, 'bull_use_sma': True, 'bull_use_ema': False, 'bull_use_atr': True, 'bull_use_adx': True, 'bull_use_spike': True, 'bull_rsi_required': True, 'bear_strategy': 'breakout', 'bear_bb_std_mult': 2.01399269551784, 'bear_rsi_os': 32, 'bear_rsi_ob': 56, 'bear_adx_thresh': 17.376703150937708, 'bear_atr_min_pct': 0.009771950482072729, 'bear_atr_max_pct': 0.13630615814146121, 'bear_tp_mult': 2.5445863659679184, 'bear_tsl_mult': 0.9380776089560334, 'bear_time_stop': 16, 'bear_use_sma': False, 'bear_use_ema': False, 'bear_use_atr': True, 'bear_use_adx': False, 'bear_use_spike': True, 'bear_rsi_required': True, 'sideways_strategy': 'breakout', 'sideways_bb_std_mult': 1.2219288241970025, 'sideways_rsi_os': 8, 'sideways_rsi_ob': 71, 'sideways_adx_thresh': 16.694882375368415, 'sideways_atr_min_pct': 0.027201794483910993, 'sideways_atr_max_pct': 0.07553619535801212, 'sideways_tp_mult': 1.532838624376749, 'sideways_tsl_mult': 0.8037665540315451, 'sideways_time_stop': 5, 'sideways_use_sma': True, 'sideways_use_ema': True, 'sideways_use_atr': True, 'sideways_use_adx': False, 'sideways_use_spike': True, 'sideways_rsi_required': True}.
[I 2025-08-31 10:13:13,147] Trial 170 finished with values: [-0.00932666319038622, 0.009044258717300253] and parameters: {'p_sma': 36, 'p_std': 42, 'p_atr': 15, 'p_adx': 12, 'rsi_period': 28, 'ema1': 13, 'ema2': 27, 'slip_atr_k': 0.12606267383094097, 'slip_spread_k': 0.2284472392526049, 'spread_hl_frac': 0.02542495503766055, 'bb_std_mult': 2.573178904442763, 'rsi_os': 40, 'rsi_ob': 76, 'vol_spike': 0.2029247295426837, 'adx_thresh': 26.22943349791923, 'atr_min_pct': 0.00898658274175848, 'atr_max_pct': 0.05982089073151017, 'tp_mult': 2.647527397593621, 'tsl_mult': 0.6731933447153522, 'strategy': 'mean_reversion', 'time_stop': 185, 'use_sma': True, 'use_atr': True, 'use_adx': True, 'use_ema': True, 'use_spike': False, 'rsi_required': True, 'edge_k': 1.6843895670365956, 'edge_cap': 0.3761307934988909, 'bull_strategy': 'mean_reversion', 'bull_bb_std_mult': 3.340850619380085, 'bull_rsi_os': 5, 'bull_rsi_ob': 81, 'bull_adx_thresh': 11.796689493557821, 'bull_atr_min_pct': 0.0026871416526229822, 'bull_atr_max_pct': 0.06574198830133719, 'bull_tp_mult': 1.5397461332774274, 'bull_tsl_mult': 0.06726814712849165, 'bull_time_stop': 271, 'bull_use_sma': False, 'bull_use_ema': False, 'bull_use_atr': False, 'bull_use_adx': True, 'bull_use_spike': True, 'bull_rsi_required': True, 'bear_strategy': 'breakout', 'bear_bb_std_mult': 2.0386498844177043, 'bear_rsi_os': 33, 'bear_rsi_ob': 60, 'bear_adx_thresh': 32.53578282904159, 'bear_atr_min_pct': 0.008519918001669294, 'bear_atr_max_pct': 0.13621146841209575, 'bear_tp_mult': 1.4130828539257043, 'bear_tsl_mult': 0.8724661336321788, 'bear_time_stop': 17, 'bear_use_sma': False, 'bear_use_ema': False, 'bear_use_atr': True, 'bear_use_adx': False, 'bear_use_spike': True, 'bear_rsi_required': True, 'sideways_strategy': 'breakout', 'sideways_bb_std_mult': 1.3097675251132976, 'sideways_rsi_os': 6, 'sideways_rsi_ob': 71, 'sideways_adx_thresh': 22.542557593759078, 'sideways_atr_min_pct': 0.02732779518016721, 'sideways_atr_max_pct': 0.07961909725464901, 'sideways_tp_mult': 1.2295063158871298, 'sideways_tsl_mult': 0.8072211450920768, 'sideways_time_stop': 6, 'sideways_use_sma': True, 'sideways_use_ema': True, 'sideways_use_atr': False, 'sideways_use_adx': False, 'sideways_use_spike': True, 'sideways_rsi_required': True}.
[I 2025-08-31 10:13:13,148] Trial 169 finished with values: [-0.014068282959236234, 0.013785212278891052] and parameters: {'p_sma': 36, 'p_std': 35, 'p_atr': 16, 'p_adx': 13, 'rsi_period': 17, 'ema1': 13, 'ema2': 49, 'slip_atr_k': 0.19448283271477113, 'slip_spread_k': 0.08083635479074419, 'spread_hl_frac': 0.024982441515275698, 'bb_std_mult': 0.8687475161439044, 'rsi_os': 42, 'rsi_ob': 72, 'vol_spike': 0.07945975933627566, 'adx_thresh': 29.5037382434987, 'atr_min_pct': 0.020950294988128497, 'atr_max_pct': 0.06077222538325665, 'tp_mult': 2.664604147620876, 'tsl_mult': 0.6852228328133727, 'strategy': 'mean_reversion', 'time_stop': 213, 'use_sma': True, 'use_atr': False, 'use_adx': True, 'use_ema': False, 'use_spike': False, 'rsi_required': True, 'edge_k': 1.684036422271866, 'edge_cap': 0.5091778060991484, 'bull_strategy': 'mean_reversion', 'bull_bb_std_mult': 1.0027329028893541, 'bull_rsi_os': 16, 'bull_rsi_ob': 81, 'bull_adx_thresh': 11.619000302144636, 'bull_atr_min_pct': 0.0031961164663920714, 'bull_atr_max_pct': 0.06930517142806822, 'bull_tp_mult': 1.5417824775257807, 'bull_tsl_mult': 0.06544729352068439, 'bull_time_stop': 274, 'bull_use_sma': True, 'bull_use_ema': False, 'bull_use_atr': True, 'bull_use_adx': True, 'bull_use_spike': True, 'bull_rsi_required': True, 'bear_strategy': 'breakout', 'bear_bb_std_mult': 2.0390450512527405, 'bear_rsi_os': 29, 'bear_rsi_ob': 56, 'bear_adx_thresh': 17.398934229732358, 'bear_atr_min_pct': 0.021906324856531514, 'bear_atr_max_pct': 0.13678382207687328, 'bear_tp_mult': 2.5408926598570787, 'bear_tsl_mult': 0.945018523211395, 'bear_time_stop': 24, 'bear_use_sma': False, 'bear_use_ema': False, 'bear_use_atr': True, 'bear_use_adx': False, 'bear_use_spike': True, 'bear_rsi_required': True, 'sideways_strategy': 'breakout', 'sideways_bb_std_mult': 3.2906042918477443, 'sideways_rsi_os': 32, 'sideways_rsi_ob': 71, 'sideways_adx_thresh': 16.660203073484702, 'sideways_atr_min_pct': 0.02736827642855743, 'sideways_atr_max_pct': 0.0749966402090699, 'sideways_tp_mult': 1.5972091223927483, 'sideways_tsl_mult': 0.8022254964498479, 'sideways_time_stop': 20, 'sideways_use_sma': True, 'sideways_use_ema': True, 'sideways_use_atr': False, 'sideways_use_adx': False, 'sideways_use_spike': True, 'sideways_rsi_required': True}.
