[I 2025-08-31 11:09:27,634] Trial 622 finished with values: [-1000000000.0, 1000000000.0] and parameters: {'p_sma': 31, 'p_std': 13, 'p_atr': 28, 'p_adx': 22, 'rsi_period': 35, 'ema1': 6, 'ema2': 28, 'slip_atr_k': 0.022071413263063326, 'slip_spread_k': 0.4386392830372078, 'spread_hl_frac': 0.022844504461003882, 'bb_std_mult': 0.5550456008476536, 'rsi_os': 31, 'rsi_ob': 85, 'vol_spike': 0.13465562740191228, 'adx_thresh': 10.393515583994123, 'atr_min_pct': 0.02130815711507418, 'atr_max_pct': 0.05873078563152354, 'tp_mult': 2.96008998149043, 'tsl_mult': 0.10258673270773264, 'strategy': 'breakout', 'time_stop': 87, 'use_sma': True, 'use_atr': True, 'use_adx': False, 'use_ema': True, 'use_spike': False, 'rsi_required': False, 'edge_k': 1.5671578226589176, 'edge_cap': 0.6821302763835211, 'bull_strategy': 'mean_reversion', 'bull_bb_std_mult': 2.38066868550274, 'bull_rsi_os': 40, 'bull_rsi_ob': 64, 'bull_adx_thresh': 27.37836125347637, 'bull_atr_min_pct': 0.014015536243880227, 'bull_atr_max_pct': 0.03792009340464427, 'bull_tp_mult': 2.4188932263204754, 'bull_tsl_mult': 0.20670195110239767, 'bull_time_stop': 50, 'bull_use_sma': False, 'bull_use_ema': True, 'bull_use_atr': False, 'bull_use_adx': True, 'bull_use_spike': False, 'bull_rsi_required': True, 'bear_strategy': 'mean_reversion', 'bear_bb_std_mult': 1.5062864172862467, 'bear_rsi_os': 54, 'bear_rsi_ob': 53, 'bear_adx_thresh': 10.337454464868472, 'bear_atr_min_pct': 0.008754303700358118, 'bear_atr_max_pct': 0.13385454556532725, 'bear_tp_mult': 1.3115789514765146, 'bear_tsl_mult': 0.8931458455659332, 'bear_time_stop': 97, 'bear_use_sma': False, 'bear_use_ema': True, 'bear_use_atr': True, 'bear_use_adx': False, 'bear_use_spike': True, 'bear_rsi_required': False, 'sideways_strategy': 'mean_reversion', 'sideways_bb_std_mult': 0.8901974558840682, 'sideways_rsi_os': 39, 'sideways_rsi_ob': 62, 'sideways_adx_thresh': 26.760356892590316, 'sideways_atr_min_pct': 0.007812640872444114, 'sideways_atr_max_pct': 0.10439356435401527, 'sideways_tp_mult': 1.5536217732573843, 'sideways_tsl_mult': 0.8747541439198729, 'sideways_time_stop': 185, 'sideways_use_sma': True, 'sideways_use_ema': True, 'sideways_use_atr': False, 'sideways_use_adx': False, 'sideways_use_spike': True, 'sideways_rsi_required': False}.
[I 2025-08-31 11:09:27,991] Trial 621 finished with values: [-1000000000.0, 1000000000.0] and parameters: {'p_sma': 37, 'p_std': 13, 'p_atr': 28, 'p_adx': 27, 'rsi_period': 35, 'ema1': 6, 'ema2': 34, 'slip_atr_k': 0.02410399376471449, 'slip_spread_k': 0.4347836428322107, 'spread_hl_frac': 0.022849942072465778, 'bb_std_mult': 0.7173123274208698, 'rsi_os': 31, 'rsi_ob': 85, 'vol_spike': 0.13751297236439253, 'adx_thresh': 10.50931193662036, 'atr_min_pct': 0.021247491105717903, 'atr_max_pct': 0.0595571625370229, 'tp_mult': 2.9062646140837276, 'tsl_mult': 0.09975543075223531, 'strategy': 'breakout', 'time_stop': 90, 'use_sma': True, 'use_atr': True, 'use_adx': False, 'use_ema': True, 'use_spike': False, 'rsi_required': False, 'edge_k': 1.390354428838088, 'edge_cap': 0.6767056825668464, 'bull_strategy': 'mean_reversion', 'bull_bb_std_mult': 2.608640633392928, 'bull_rsi_os': 6, 'bull_rsi_ob': 65, 'bull_adx_thresh': 27.504797674592826, 'bull_atr_min_pct': 0.011998319087815562, 'bull_atr_max_pct': 0.03705580989186547, 'bull_tp_mult': 2.3613312474547965, 'bull_tsl_mult': 0.21346643740479626, 'bull_time_stop': 51, 'bull_use_sma': False, 'bull_use_ema': True, 'bull_use_atr': False, 'bull_use_adx': True, 'bull_use_spike': False, 'bull_rsi_required': False, 'bear_strategy': 'mean_reversion', 'bear_bb_std_mult': 1.6226434172789514, 'bear_rsi_os': 52, 'bear_rsi_ob': 53, 'bear_adx_thresh': 10.603726694123914, 'bear_atr_min_pct': 0.008636094006885371, 'bear_atr_max_pct': 0.06336056678587255, 'bear_tp_mult': 2.681127670359924, 'bear_tsl_mult': 0.8883565740411175, 'bear_time_stop': 85, 'bear_use_sma': False, 'bear_use_ema': False, 'bear_use_atr': True, 'bear_use_adx': False, 'bear_use_spike': True, 'bear_rsi_required': False, 'sideways_strategy': 'mean_reversion', 'sideways_bb_std_mult': 1.046052210292949, 'sideways_rsi_os': 42, 'sideways_rsi_ob': 63, 'sideways_adx_thresh': 27.033337786067, 'sideways_atr_min_pct': 0.007875362482501837, 'sideways_atr_max_pct': 0.10868983232398807, 'sideways_tp_mult': 1.5663971310437355, 'sideways_tsl_mult': 0.8780648810967552, 'sideways_time_stop': 184, 'sideways_use_sma': True, 'sideways_use_ema': True, 'sideways_use_atr': False, 'sideways_use_adx': False, 'sideways_use_spike': True, 'sideways_rsi_required': False}.
[I 2025-08-31 11:09:28,197] Trial 623 finished with values: [-1000000000.0, 1000000000.0] and parameters: {'p_sma': 39, 'p_std': 13, 'p_atr': 29, 'p_adx': 27, 'rsi_period': 35, 'ema1': 6, 'ema2': 19, 'slip_atr_k': 0.015592884658064146, 'slip_spread_k': 0.4778422778949954, 'spread_hl_frac': 0.022561694870927726, 'bb_std_mult': 0.6937905731328534, 'rsi_os': 31, 'rsi_ob': 83, 'vol_spike': 0.050005285797071544, 'adx_thresh': 10.487926288818867, 'atr_min_pct': 0.021254036384247322, 'atr_max_pct': 0.05814425701315282, 'tp_mult': 2.9364507195658724, 'tsl_mult': 0.10006308764941571, 'strategy': 'breakout', 'time_stop': 78, 'use_sma': True, 'use_atr': True, 'use_adx': False, 'use_ema': True, 'use_spike': False, 'rsi_required': False, 'edge_k': 1.569283412434632, 'edge_cap': 0.6723897790017513, 'bull_strategy': 'mean_reversion', 'bull_bb_std_mult': 2.706406346659145, 'bull_rsi_os': 40, 'bull_rsi_ob': 64, 'bull_adx_thresh': 27.423341738504696, 'bull_atr_min_pct': 0.013924680636738164, 'bull_atr_max_pct': 0.03795869334536986, 'bull_tp_mult': 2.1637394335743543, 'bull_tsl_mult': 0.1968409056207419, 'bull_time_stop': 52, 'bull_use_sma': False, 'bull_use_ema': True, 'bull_use_atr': False, 'bull_use_adx': True, 'bull_use_spike': False, 'bull_rsi_required': True, 'bear_strategy': 'mean_reversion', 'bear_bb_std_mult': 1.507690140633681, 'bear_rsi_os': 51, 'bear_rsi_ob': 53, 'bear_adx_thresh': 10.407362678496066, 'bear_atr_min_pct': 0.0076225723122305255, 'bear_atr_max_pct': 0.01017219881530998, 'bear_tp_mult': 2.6666629232264847, 'bear_tsl_mult': 0.8864127617051802, 'bear_time_stop': 97, 'bear_use_sma': False, 'bear_use_ema': True, 'bear_use_atr': True, 'bear_use_adx': False, 'bear_use_spike': True, 'bear_rsi_required': False, 'sideways_strategy': 'mean_reversion', 'sideways_bb_std_mult': 1.0577099988763183, 'sideways_rsi_os': 40, 'sideways_rsi_ob': 63, 'sideways_adx_thresh': 26.937742796101237, 'sideways_atr_min_pct': 0.024381717951966246, 'sideways_atr_max_pct': 0.10385652665171831, 'sideways_tp_mult': 1.5897940254884226, 'sideways_tsl_mult': 0.1635597782198897, 'sideways_time_stop': 181, 'sideways_use_sma': True, 'sideways_use_ema': True, 'sideways_use_atr': False, 'sideways_use_adx': False, 'sideways_use_spike': True, 'sideways_rsi_required': False}.
[I 2025-08-31 11:09:28,208] Trial 624 finished with values: [-1000000000.0, 1000000000.0] and parameters: {'p_sma': 37, 'p_std': 13, 'p_atr': 27, 'p_adx': 27, 'rsi_period': 36, 'ema1': 6, 'ema2': 32, 'slip_atr_k': 0.024072173868521382, 'slip_spread_k': 0.4483577247158926, 'spread_hl_frac': 0.020386235141077416, 'bb_std_mult': 0.5337111192192086, 'rsi_os': 27, 'rsi_ob': 83, 'vol_spike': 0.04738405995317858, 'adx_thresh': 10.32476337786828, 'atr_min_pct': 0.021982071436901302, 'atr_max_pct': 0.057807074042808444, 'tp_mult': 2.955082964005131, 'tsl_mult': 0.15646933217832257, 'strategy': 'breakout', 'time_stop': 76, 'use_sma': True, 'use_atr': True, 'use_adx': False, 'use_ema': True, 'use_spike': False, 'rsi_required': False, 'edge_k': 1.5765100662085119, 'edge_cap': 0.6701130871126026, 'bull_strategy': 'mean_reversion', 'bull_bb_std_mult': 2.6297909560959276, 'bull_rsi_os': 6, 'bull_rsi_ob': 64, 'bull_adx_thresh': 27.340551356478876, 'bull_atr_min_pct': 0.011848098601114089, 'bull_atr_max_pct': 0.03525182830666911, 'bull_tp_mult': 2.361533279386832, 'bull_tsl_mult': 0.1955117695799799, 'bull_time_stop': 53, 'bull_use_sma': False, 'bull_use_ema': True, 'bull_use_atr': False, 'bull_use_adx': True, 'bull_use_spike': False, 'bull_rsi_required': True, 'bear_strategy': 'mean_reversion', 'bear_bb_std_mult': 1.6076086923527233, 'bear_rsi_os': 55, 'bear_rsi_ob': 53, 'bear_adx_thresh': 10.224632396512007, 'bear_atr_min_pct': 0.0024449094499342694, 'bear_atr_max_pct': 0.13280412584804502, 'bear_tp_mult': 1.3132809597829085, 'bear_tsl_mult': 0.95259794797558, 'bear_time_stop': 109, 'bear_use_sma': False, 'bear_use_ema': True, 'bear_use_atr': True, 'bear_use_adx': False, 'bear_use_spike': True, 'bear_rsi_required': False, 'sideways_strategy': 'mean_reversion', 'sideways_bb_std_mult': 0.8776661494240252, 'sideways_rsi_os': 39, 'sideways_rsi_ob': 62, 'sideways_adx_thresh': 26.802028437978645, 'sideways_atr_min_pct': 0.007791279263716797, 'sideways_atr_max_pct': 0.11453643548140387, 'sideways_tp_mult': 1.480281997608318, 'sideways_tsl_mult': 0.8729621140079415, 'sideways_time_stop': 183, 'sideways_use_sma': True, 'sideways_use_ema': True, 'sideways_use_atr': False, 'sideways_use_adx': False, 'sideways_use_spike': True, 'sideways_rsi_required': False}.
[I 2025-08-31 11:10:00,383] Trial 626 finished with values: [-0.05330662140009368, 0.05349465499998236] and parameters: {'p_sma': 38, 'p_std': 14, 'p_atr': 29, 'p_adx': 22, 'rsi_period': 32, 'ema1': 5, 'ema2': 26, 'slip_atr_k': 0.016292134872134365, 'slip_spread_k': 0.4589770080590797, 'spread_hl_frac': 0.019732151057219552, 'bb_std_mult': 0.7152593767801391, 'rsi_os': 27, 'rsi_ob': 83, 'vol_spike': 0.02833712403169278, 'adx_thresh': 11.624556381408409, 'atr_min_pct': 0.021881784935144418, 'atr_max_pct': 0.0587921528717458, 'tp_mult': 2.955238551459631, 'tsl_mult': 0.146406005097985, 'strategy': 'breakout', 'time_stop': 75, 'use_sma': True, 'use_atr': True, 'use_adx': False, 'use_ema': True, 'use_spike': False, 'rsi_required': False, 'edge_k': 1.5782455266300255, 'edge_cap': 0.7126071155461723, 'bull_strategy': 'mean_reversion', 'bull_bb_std_mult': 2.8655596493048305, 'bull_rsi_os': 19, 'bull_rsi_ob': 64, 'bull_adx_thresh': 26.53523578400983, 'bull_atr_min_pct': 0.013005114106782277, 'bull_atr_max_pct': 0.034084647136300106, 'bull_tp_mult': 2.9358232988163424, 'bull_tsl_mult': 0.28528958717929576, 'bull_time_stop': 216, 'bull_use_sma': False, 'bull_use_ema': True, 'bull_use_atr': False, 'bull_use_adx': False, 'bull_use_spike': False, 'bull_rsi_required': True, 'bear_strategy': 'mean_reversion', 'bear_bb_std_mult': 1.5874349490833248, 'bear_rsi_os': 51, 'bear_rsi_ob': 53, 'bear_adx_thresh': 24.152176939635133, 'bear_atr_min_pct': 0.0023655624651092947, 'bear_atr_max_pct': 0.011276497134166424, 'bear_tp_mult': 1.0411732128529991, 'bear_tsl_mult': 0.9479044469756397, 'bear_time_stop': 108, 'bear_use_sma': False, 'bear_use_ema': False, 'bear_use_atr': True, 'bear_use_adx': False, 'bear_use_spike': True, 'bear_rsi_required': False, 'sideways_strategy': 'mean_reversion', 'sideways_bb_std_mult': 1.0684250816114678, 'sideways_rsi_os': 41, 'sideways_rsi_ob': 64, 'sideways_adx_thresh': 26.880514734650927, 'sideways_atr_min_pct': 0.01882871437457258, 'sideways_atr_max_pct': 0.11427083383468553, 'sideways_tp_mult': 1.5986403677742567, 'sideways_tsl_mult': 0.8474702437981328, 'sideways_time_stop': 179, 'sideways_use_sma': True, 'sideways_use_ema': True, 'sideways_use_atr': False, 'sideways_use_adx': False, 'sideways_use_spike': False, 'sideways_rsi_required': False}.
[I 2025-08-31 11:10:00,519] Trial 628 finished with values: [-1000000000.0, 1000000000.0] and parameters: {'p_sma': 26, 'p_std': 14, 'p_atr': 29, 'p_adx': 22, 'rsi_period': 33, 'ema1': 5, 'ema2': 26, 'slip_atr_k': 0.017096409034493585, 'slip_spread_k': 0.46143744456713864, 'spread_hl_frac': 0.02076046675231079, 'bb_std_mult': 0.7255634208655788, 'rsi_os': 5, 'rsi_ob': 82, 'vol_spike': 0.029585446709428115, 'adx_thresh': 11.398743299616429, 'atr_min_pct': 0.022684431997467572, 'atr_max_pct': 0.06148105840174289, 'tp_mult': 2.997394446392483, 'tsl_mult': 0.13076517670932394, 'strategy': 'breakout', 'time_stop': 99, 'use_sma': True, 'use_atr': True, 'use_adx': False, 'use_ema': True, 'use_spike': False, 'rsi_required': False, 'edge_k': 1.408645586615329, 'edge_cap': 0.7125870415935924, 'bull_strategy': 'mean_reversion', 'bull_bb_std_mult': 2.886904082044797, 'bull_rsi_os': 22, 'bull_rsi_ob': 61, 'bull_adx_thresh': 26.58154932417884, 'bull_atr_min_pct': 0.013007039365786562, 'bull_atr_max_pct': 0.0331744049293764, 'bull_tp_mult': 2.9410119330775166, 'bull_tsl_mult': 0.29472626016561365, 'bull_time_stop': 271, 'bull_use_sma': False, 'bull_use_ema': True, 'bull_use_atr': False, 'bull_use_adx': False, 'bull_use_spike': False, 'bull_rsi_required': False, 'bear_strategy': 'mean_reversion', 'bear_bb_std_mult': 1.5219268091036589, 'bear_rsi_os': 53, 'bear_rsi_ob': 53, 'bear_adx_thresh': 9.722961002954934, 'bear_atr_min_pct': 0.020394834767149136, 'bear_atr_max_pct': 0.13860729104828304, 'bear_tp_mult': 2.719717333521628, 'bear_tsl_mult': 0.8842115489616273, 'bear_time_stop': 107, 'bear_use_sma': False, 'bear_use_ema': False, 'bear_use_atr': False, 'bear_use_adx': False, 'bear_use_spike': False, 'bear_rsi_required': False, 'sideways_strategy': 'mean_reversion', 'sideways_bb_std_mult': 0.8318413097229597, 'sideways_rsi_os': 41, 'sideways_rsi_ob': 64, 'sideways_adx_thresh': 28.07316188342653, 'sideways_atr_min_pct': 0.018540767838836757, 'sideways_atr_max_pct': 0.10364711371326629, 'sideways_tp_mult': 1.5884639839903665, 'sideways_tsl_mult': 0.19188335823089359, 'sideways_time_stop': 163, 'sideways_use_sma': True, 'sideways_use_ema': True, 'sideways_use_atr': True, 'sideways_use_adx': False, 'sideways_use_spike': False, 'sideways_rsi_required': True}.
[I 2025-08-31 11:10:00,606] Trial 627 finished with values: [-1000000000.0, 1000000000.0] and parameters: {'p_sma': 26, 'p_std': 10, 'p_atr': 29, 'p_adx': 21, 'rsi_period': 32, 'ema1': 5, 'ema2': 26, 'slip_atr_k': 0.014592003101848647, 'slip_spread_k': 0.4123949128432999, 'spread_hl_frac': 0.02186615413313454, 'bb_std_mult': 0.7361375246580668, 'rsi_os': 28, 'rsi_ob': 82, 'vol_spike': 0.02884938028707215, 'adx_thresh': 11.40294644674851, 'atr_min_pct': 0.02262623710212167, 'atr_max_pct': 0.060031702513620326, 'tp_mult': 2.9616465708645463, 'tsl_mult': 0.07706106984424704, 'strategy': 'breakout', 'time_stop': 94, 'use_sma': True, 'use_atr': True, 'use_adx': False, 'use_ema': True, 'use_spike': False, 'rsi_required': False, 'edge_k': 1.5039443334456322, 'edge_cap': 0.7120988275760748, 'bull_strategy': 'mean_reversion', 'bull_bb_std_mult': 2.1796721387058864, 'bull_rsi_os': 41, 'bull_rsi_ob': 61, 'bull_adx_thresh': 26.721076656240342, 'bull_atr_min_pct': 0.012925081412884077, 'bull_atr_max_pct': 0.03194847306625519, 'bull_tp_mult': 2.2941466490780265, 'bull_tsl_mult': 0.2982604644506081, 'bull_time_stop': 45, 'bull_use_sma': False, 'bull_use_ema': True, 'bull_use_atr': False, 'bull_use_adx': False, 'bull_use_spike': False, 'bull_rsi_required': False, 'bear_strategy': 'mean_reversion', 'bear_bb_std_mult': 1.5155226050992174, 'bear_rsi_os': 51, 'bear_rsi_ob': 50, 'bear_adx_thresh': 10.995671723457313, 'bear_atr_min_pct': 0.011849846184033466, 'bear_atr_max_pct': 0.03901855601866548, 'bear_tp_mult': 2.7173900536859192, 'bear_tsl_mult': 0.9291260433551951, 'bear_time_stop': 101, 'bear_use_sma': False, 'bear_use_ema': False, 'bear_use_atr': False, 'bear_use_adx': False, 'bear_use_spike': False, 'bear_rsi_required': False, 'sideways_strategy': 'mean_reversion', 'sideways_bb_std_mult': 0.9397587626128271, 'sideways_rsi_os': 41, 'sideways_rsi_ob': 62, 'sideways_adx_thresh': 28.084807235756358, 'sideways_atr_min_pct': 0.006747077353918246, 'sideways_atr_max_pct': 0.10407622048570049, 'sideways_tp_mult': 1.594333881491518, 'sideways_tsl_mult': 0.8541645887607772, 'sideways_time_stop': 160, 'sideways_use_sma': True, 'sideways_use_ema': True, 'sideways_use_atr': True, 'sideways_use_adx': False, 'sideways_use_spike': False, 'sideways_rsi_required': True}.
[I 2025-08-31 11:10:00,785] Trial 625 finished with values: [-1000000000.0, 1000000000.0] and parameters: {'p_sma': 39, 'p_std': 13, 'p_atr': 29, 'p_adx': 22, 'rsi_period': 36, 'ema1': 6, 'ema2': 35, 'slip_atr_k': 0.017046425842609188, 'slip_spread_k': 0.45709081283779895, 'spread_hl_frac': 0.02111881499921667, 'bb_std_mult': 0.7317447241395896, 'rsi_os': 27, 'rsi_ob': 83, 'vol_spike': 0.046207497736610446, 'adx_thresh': 10.386659184030998, 'atr_min_pct': 0.022170708051727727, 'atr_max_pct': 0.05912923009717954, 'tp_mult': 2.9555136480280333, 'tsl_mult': 0.13557536953203392, 'strategy': 'breakout', 'time_stop': 93, 'use_sma': True, 'use_atr': True, 'use_adx': False, 'use_ema': True, 'use_spike': False, 'rsi_required': False, 'edge_k': 1.4027104611404477, 'edge_cap': 0.670331533783166, 'bull_strategy': 'mean_reversion', 'bull_bb_std_mult': 2.881307380855649, 'bull_rsi_os': 41, 'bull_rsi_ob': 65, 'bull_adx_thresh': 26.4788706793747, 'bull_atr_min_pct': 0.011903781277602485, 'bull_atr_max_pct': 0.03357177176159109, 'bull_tp_mult': 2.941255019737941, 'bull_tsl_mult': 0.2981288960775169, 'bull_time_stop': 103, 'bull_use_sma': False, 'bull_use_ema': True, 'bull_use_atr': False, 'bull_use_adx': False, 'bull_use_spike': False, 'bull_rsi_required': False, 'bear_strategy': 'mean_reversion', 'bear_bb_std_mult': 1.6031854880019971, 'bear_rsi_os': 51, 'bear_rsi_ob': 53, 'bear_adx_thresh': 10.381792901300706, 'bear_atr_min_pct': 0.0076020355277627485, 'bear_atr_max_pct': 0.1351787200026445, 'bear_tp_mult': 2.7167161010064667, 'bear_tsl_mult': 0.9476700017555855, 'bear_time_stop': 110, 'bear_use_sma': False, 'bear_use_ema': False, 'bear_use_atr': True, 'bear_use_adx': False, 'bear_use_spike': True, 'bear_rsi_required': False, 'sideways_strategy': 'mean_reversion', 'sideways_bb_std_mult': 1.0756827338372603, 'sideways_rsi_os': 41, 'sideways_rsi_ob': 64, 'sideways_adx_thresh': 28.000248187863527, 'sideways_atr_min_pct': 0.01852990075130525, 'sideways_atr_max_pct': 0.10398417239312026, 'sideways_tp_mult': 1.5857057770007534, 'sideways_tsl_mult': 0.3061739552381092, 'sideways_time_stop': 179, 'sideways_use_sma': True, 'sideways_use_ema': True, 'sideways_use_atr': False, 'sideways_use_adx': False, 'sideways_use_spike': True, 'sideways_rsi_required': False}.
[I 2025-08-31 11:10:33,757] Trial 630 finished with values: [-1000000000.0, 1000000000.0] and parameters: {'p_sma': 35, 'p_std': 10, 'p_atr': 27, 'p_adx': 21, 'rsi_period': 37, 'ema1': 5, 'ema2': 31, 'slip_atr_k': 0.020752832239449414, 'slip_spread_k': 0.4874072904940936, 'spread_hl_frac': 0.02148180590330668, 'bb_std_mult': 0.6079794140692794, 'rsi_os': 28, 'rsi_ob': 86, 'vol_spike': 0.11965819600114418, 'adx_thresh': 11.16664495770217, 'atr_min_pct': 0.02223391651174554, 'atr_max_pct': 0.06420044093004545, 'tp_mult': 2.897948847590354, 'tsl_mult': 0.0747575330070718, 'strategy': 'breakout', 'time_stop': 87, 'use_sma': True, 'use_atr': True, 'use_adx': False, 'use_ema': True, 'use_spike': False, 'rsi_required': False, 'edge_k': 1.5098223138309785, 'edge_cap': 0.6508770812706279, 'bull_strategy': 'mean_reversion', 'bull_bb_std_mult': 2.198227852301169, 'bull_rsi_os': 53, 'bull_rsi_ob': 61, 'bull_adx_thresh': 25.081834908066888, 'bull_atr_min_pct': 0.011774245341872281, 'bull_atr_max_pct': 0.02837332176476374, 'bull_tp_mult': 2.0093564722360053, 'bull_tsl_mult': 0.25087580280359784, 'bull_time_stop': 40, 'bull_use_sma': False, 'bull_use_ema': False, 'bull_use_atr': False, 'bull_use_adx': True, 'bull_use_spike': False, 'bull_rsi_required': False, 'bear_strategy': 'mean_reversion', 'bear_bb_std_mult': 1.49771650550786, 'bear_rsi_os': 55, 'bear_rsi_ob': 52, 'bear_adx_thresh': 11.161835707183847, 'bear_atr_min_pct': 0.012079393865765467, 'bear_atr_max_pct': 0.1358254654063737, 'bear_tp_mult': 2.0007606099657957, 'bear_tsl_mult': 0.8704941145892877, 'bear_time_stop': 101, 'bear_use_sma': False, 'bear_use_ema': False, 'bear_use_atr': True, 'bear_use_adx': False, 'bear_use_spike': True, 'bear_rsi_required': False, 'sideways_strategy': 'mean_reversion', 'sideways_bb_std_mult': 0.9384963697483885, 'sideways_rsi_os': 44, 'sideways_rsi_ob': 62, 'sideways_adx_thresh': 27.741510903333317, 'sideways_atr_min_pct': 0.006719209350210486, 'sideways_atr_max_pct': 0.10969859580484449, 'sideways_tp_mult': 1.4825045938904218, 'sideways_tsl_mult': 0.14235796850243704, 'sideways_time_stop': 158, 'sideways_use_sma': True, 'sideways_use_ema': True, 'sideways_use_atr': False, 'sideways_use_adx': False, 'sideways_use_spike': True, 'sideways_rsi_required': False}.
