[I 2025-08-31 11:17:53,934] Trial 684 finished with values: [-1000000000.0, 1000000000.0] and parameters: {'p_sma': 39, 'p_std': 12, 'p_atr': 10, 'p_adx': 20, 'rsi_period': 48, 'ema1': 5, 'ema2': 21, 'slip_atr_k': 0.04737137518478554, 'slip_spread_k': 0.49984095777196363, 'spread_hl_frac': 0.01663897425351278, 'bb_std_mult': 0.8243633598779458, 'rsi_os': 27, 'rsi_ob': 87, 'vol_spike': 0.1850813214738208, 'adx_thresh': 13.585518257007802, 'atr_min_pct': 0.003462321698323516, 'atr_max_pct': 0.06117385397671586, 'tp_mult': 2.879184316061347, 'tsl_mult': 0.0856662420562257, 'strategy': 'breakout', 'time_stop': 77, 'use_sma': True, 'use_atr': True, 'use_adx': False, 'use_ema': True, 'use_spike': False, 'rsi_required': False, 'edge_k': 1.5052381323598683, 'edge_cap': 0.68475774664795, 'bull_strategy': 'mean_reversion', 'bull_bb_std_mult': 2.581238274830048, 'bull_rsi_os': 40, 'bull_rsi_ob': 57, 'bull_adx_thresh': 27.103295145018112, 'bull_atr_min_pct': 0.011679047027451804, 'bull_atr_max_pct': 0.09742650552840423, 'bull_tp_mult': 2.437077418675648, 'bull_tsl_mult': 0.18496272279260362, 'bull_time_stop': 242, 'bull_use_sma': False, 'bull_use_ema': False, 'bull_use_atr': False, 'bull_use_adx': False, 'bull_use_spike': False, 'bull_rsi_required': False, 'bear_strategy': 'mean_reversion', 'bear_bb_std_mult': 1.4993537206076257, 'bear_rsi_os': 51, 'bear_rsi_ob': 74, 'bear_adx_thresh': 31.36761531816356, 'bear_atr_min_pct': 0.022074864558257835, 'bear_atr_max_pct': 0.1348204015816623, 'bear_tp_mult': 1.6341645481277303, 'bear_tsl_mult': 0.8951936023338152, 'bear_time_stop': 97, 'bear_use_sma': False, 'bear_use_ema': False, 'bear_use_atr': True, 'bear_use_adx': False, 'bear_use_spike': True, 'bear_rsi_required': False, 'sideways_strategy': 'mean_reversion', 'sideways_bb_std_mult': 0.8700211965136087, 'sideways_rsi_os': 42, 'sideways_rsi_ob': 61, 'sideways_adx_thresh': 27.17206390552127, 'sideways_atr_min_pct': 0.00842236915259826, 'sideways_atr_max_pct': 0.10041422089893473, 'sideways_tp_mult': 1.653500864229929, 'sideways_tsl_mult': 0.9122880229607525, 'sideways_time_stop': 150, 'sideways_use_sma': True, 'sideways_use_ema': True, 'sideways_use_atr': False, 'sideways_use_adx': False, 'sideways_use_spike': True, 'sideways_rsi_required': False}.
[I 2025-08-31 11:18:27,973] Trial 687 finished with values: [-1000000000.0, 1000000000.0] and parameters: {'p_sma': 29, 'p_std': 25, 'p_atr': 27, 'p_adx': 26, 'rsi_period': 37, 'ema1': 26, 'ema2': 24, 'slip_atr_k': 0.24087280086670337, 'slip_spread_k': 0.14040923933218236, 'spread_hl_frac': 0.02371190674672575, 'bb_std_mult': 0.5660935386115995, 'rsi_os': 30, 'rsi_ob': 82, 'vol_spike': 0.011859397408442773, 'adx_thresh': 23.55713594568832, 'atr_min_pct': 0.0007299200316097307, 'atr_max_pct': 0.0634637882319467, 'tp_mult': 2.998455070091496, 'tsl_mult': 0.051700870523277764, 'strategy': 'breakout', 'time_stop': 111, 'use_sma': True, 'use_atr': True, 'use_adx': False, 'use_ema': True, 'use_spike': False, 'rsi_required': False, 'edge_k': 1.463197977818398, 'edge_cap': 0.7665108321955391, 'bull_strategy': 'mean_reversion', 'bull_bb_std_mult': 2.4751667112343263, 'bull_rsi_os': 27, 'bull_rsi_ob': 61, 'bull_adx_thresh': 28.667341637406405, 'bull_atr_min_pct': 0.013714768993438807, 'bull_atr_max_pct': 0.038833634307402054, 'bull_tp_mult': 2.8786428988305612, 'bull_tsl_mult': 0.23833356732001848, 'bull_time_stop': 34, 'bull_use_sma': False, 'bull_use_ema': True, 'bull_use_atr': False, 'bull_use_adx': True, 'bull_use_spike': False, 'bull_rsi_required': False, 'bear_strategy': 'mean_reversion', 'bear_bb_std_mult': 1.6244924990975633, 'bear_rsi_os': 55, 'bear_rsi_ob': 54, 'bear_adx_thresh': 9.829211684168277, 'bear_atr_min_pct': 0.009065537125091689, 'bear_atr_max_pct': 0.13124926791489808, 'bear_tp_mult': 2.365004743075588, 'bear_tsl_mult': 0.8729442612346097, 'bear_time_stop': 103, 'bear_use_sma': False, 'bear_use_ema': False, 'bear_use_atr': True, 'bear_use_adx': False, 'bear_use_spike': True, 'bear_rsi_required': False, 'sideways_strategy': 'mean_reversion', 'sideways_bb_std_mult': 1.0890794547708795, 'sideways_rsi_os': 39, 'sideways_rsi_ob': 71, 'sideways_adx_thresh': 27.96998405699451, 'sideways_atr_min_pct': 0.007434637916032866, 'sideways_atr_max_pct': 0.10040046642800131, 'sideways_tp_mult': 1.6144864355093846, 'sideways_tsl_mult': 0.8334711264964648, 'sideways_time_stop': 163, 'sideways_use_sma': False, 'sideways_use_ema': True, 'sideways_use_atr': False, 'sideways_use_adx': False, 'sideways_use_spike': True, 'sideways_rsi_required': False}.
[I 2025-08-31 11:18:28,327] Trial 688 finished with values: [-1000000000.0, 1000000000.0] and parameters: {'p_sma': 30, 'p_std': 14, 'p_atr': 27, 'p_adx': 30, 'rsi_period': 81, 'ema1': 26, 'ema2': 24, 'slip_atr_k': 0.23514310263739244, 'slip_spread_k': 0.14668537460315967, 'spread_hl_frac': 0.006971416422418466, 'bb_std_mult': 0.55312722475654, 'rsi_os': 9, 'rsi_ob': 82, 'vol_spike': 0.15937801302107657, 'adx_thresh': 17.741936196929288, 'atr_min_pct': 0.013414454978826875, 'atr_max_pct': 0.06275691683542366, 'tp_mult': 1.3078951693960275, 'tsl_mult': 0.10459220133893485, 'strategy': 'breakout', 'time_stop': 193, 'use_sma': True, 'use_atr': True, 'use_adx': False, 'use_ema': True, 'use_spike': False, 'rsi_required': False, 'edge_k': 1.4360779079994395, 'edge_cap': 0.6052226790844691, 'bull_strategy': 'mean_reversion', 'bull_bb_std_mult': 1.7368510168242046, 'bull_rsi_os': 41, 'bull_rsi_ob': 63, 'bull_adx_thresh': 28.49773720321992, 'bull_atr_min_pct': 0.013441782840974326, 'bull_atr_max_pct': 0.03987379578477237, 'bull_tp_mult': 2.822987347065214, 'bull_tsl_mult': 0.23849146112447428, 'bull_time_stop': 169, 'bull_use_sma': False, 'bull_use_ema': True, 'bull_use_atr': False, 'bull_use_adx': True, 'bull_use_spike': False, 'bull_rsi_required': False, 'bear_strategy': 'mean_reversion', 'bear_bb_std_mult': 1.6348588210528356, 'bear_rsi_os': 52, 'bear_rsi_ob': 54, 'bear_adx_thresh': 20.97230777492602, 'bear_atr_min_pct': 0.006546429244095188, 'bear_atr_max_pct': 0.07715767930674343, 'bear_tp_mult': 1.7569321768982913, 'bear_tsl_mult': 0.979882555355081, 'bear_time_stop': 104, 'bear_use_sma': False, 'bear_use_ema': False, 'bear_use_atr': True, 'bear_use_adx': False, 'bear_use_spike': True, 'bear_rsi_required': False, 'sideways_strategy': 'mean_reversion', 'sideways_bb_std_mult': 1.0799460785232948, 'sideways_rsi_os': 14, 'sideways_rsi_ob': 64, 'sideways_adx_thresh': 28.678368101605795, 'sideways_atr_min_pct': 0.006276586069558837, 'sideways_atr_max_pct': 0.10883470877123752, 'sideways_tp_mult': 1.6179997795894576, 'sideways_tsl_mult': 0.8337250089370176, 'sideways_time_stop': 164, 'sideways_use_sma': False, 'sideways_use_ema': True, 'sideways_use_atr': False, 'sideways_use_adx': False, 'sideways_use_spike': True, 'sideways_rsi_required': False}.
[I 2025-08-31 11:18:28,468] Trial 685 finished with values: [-1000000000.0, 1000000000.0] and parameters: {'p_sma': 25, 'p_std': 12, 'p_atr': 12, 'p_adx': 20, 'rsi_period': 84, 'ema1': 5, 'ema2': 36, 'slip_atr_k': 0.032054299875222354, 'slip_spread_k': 0.14617833022926285, 'spread_hl_frac': 0.022880241506366243, 'bb_std_mult': 0.6306671899000318, 'rsi_os': 9, 'rsi_ob': 82, 'vol_spike': 0.08284108500260386, 'adx_thresh': 13.505236229636289, 'atr_min_pct': 0.021504893087925823, 'atr_max_pct': 0.06103116923291909, 'tp_mult': 1.5385491379628142, 'tsl_mult': 0.08978540394701089, 'strategy': 'breakout', 'time_stop': 77, 'use_sma': True, 'use_atr': True, 'use_adx': False, 'use_ema': True, 'use_spike': False, 'rsi_required': False, 'edge_k': 1.4924670670826816, 'edge_cap': 0.6125057939328482, 'bull_strategy': 'mean_reversion', 'bull_bb_std_mult': 2.224708486987057, 'bull_rsi_os': 27, 'bull_rsi_ob': 63, 'bull_adx_thresh': 28.6572363311758, 'bull_atr_min_pct': 0.013215735911719179, 'bull_atr_max_pct': 0.13060508710293364, 'bull_tp_mult': 2.874923892005333, 'bull_tsl_mult': 0.2518608830468921, 'bull_time_stop': 235, 'bull_use_sma': False, 'bull_use_ema': True, 'bull_use_atr': False, 'bull_use_adx': False, 'bull_use_spike': False, 'bull_rsi_required': False, 'bear_strategy': 'mean_reversion', 'bear_bb_std_mult': 3.120611735856214, 'bear_rsi_os': 51, 'bear_rsi_ob': 54, 'bear_adx_thresh': 21.072210668501548, 'bear_atr_min_pct': 0.009997919546720288, 'bear_atr_max_pct': 0.13457187055198963, 'bear_tp_mult': 2.709707462903251, 'bear_tsl_mult': 0.9049514318755194, 'bear_time_stop': 80, 'bear_use_sma': False, 'bear_use_ema': False, 'bear_use_atr': True, 'bear_use_adx': False, 'bear_use_spike': True, 'bear_rsi_required': False, 'sideways_strategy': 'mean_reversion', 'sideways_bb_std_mult': 0.8818567086716405, 'sideways_rsi_os': 43, 'sideways_rsi_ob': 63, 'sideways_adx_thresh': 28.884194698489324, 'sideways_atr_min_pct': 0.005549658558293594, 'sideways_atr_max_pct': 0.1003270679957113, 'sideways_tp_mult': 1.015199446865416, 'sideways_tsl_mult': 0.6282564849438264, 'sideways_time_stop': 166, 'sideways_use_sma': False, 'sideways_use_ema': True, 'sideways_use_atr': False, 'sideways_use_adx': False, 'sideways_use_spike': True, 'sideways_rsi_required': False}.
[I 2025-08-31 11:18:28,634] Trial 686 finished with values: [-1000000000.0, 1000000000.0] and parameters: {'p_sma': 25, 'p_std': 12, 'p_atr': 27, 'p_adx': 22, 'rsi_period': 15, 'ema1': 5, 'ema2': 22, 'slip_atr_k': 0.013480524626432611, 'slip_spread_k': 0.44996943766163205, 'spread_hl_frac': 0.023315860529194963, 'bb_std_mult': 0.8518922598198955, 'rsi_os': 46, 'rsi_ob': 82, 'vol_spike': 0.07848584123405028, 'adx_thresh': 13.44638697908538, 'atr_min_pct': 0.021536670749979246, 'atr_max_pct': 0.06126908511695526, 'tp_mult': 2.9993431586793533, 'tsl_mult': 0.09668119550054063, 'strategy': 'breakout', 'time_stop': 111, 'use_sma': True, 'use_atr': True, 'use_adx': False, 'use_ema': True, 'use_spike': False, 'rsi_required': False, 'edge_k': 1.5047193362517328, 'edge_cap': 0.7734308839160658, 'bull_strategy': 'mean_reversion', 'bull_bb_std_mult': 2.0125797475532723, 'bull_rsi_os': 40, 'bull_rsi_ob': 58, 'bull_adx_thresh': 28.649070781969563, 'bull_atr_min_pct': 0.011985240775425446, 'bull_atr_max_pct': 0.030586195938502387, 'bull_tp_mult': 2.8774317404921006, 'bull_tsl_mult': 0.18706872545433095, 'bull_time_stop': 50, 'bull_use_sma': False, 'bull_use_ema': False, 'bull_use_atr': False, 'bull_use_adx': False, 'bull_use_spike': False, 'bull_rsi_required': False, 'bear_strategy': 'mean_reversion', 'bear_bb_std_mult': 0.791986914535288, 'bear_rsi_os': 51, 'bear_rsi_ob': 50, 'bear_adx_thresh': 21.26671480817425, 'bear_atr_min_pct': 0.014617189334735256, 'bear_atr_max_pct': 0.10514336124884474, 'bear_tp_mult': 1.7406564442880583, 'bear_tsl_mult': 0.8912163732802645, 'bear_time_stop': 104, 'bear_use_sma': False, 'bear_use_ema': False, 'bear_use_atr': True, 'bear_use_adx': False, 'bear_use_spike': True, 'bear_rsi_required': False, 'sideways_strategy': 'mean_reversion', 'sideways_bb_std_mult': 0.9324064278114101, 'sideways_rsi_os': 14, 'sideways_rsi_ob': 63, 'sideways_adx_thresh': 27.64157170605764, 'sideways_atr_min_pct': 0.007478255289787921, 'sideways_atr_max_pct': 0.09992707908628874, 'sideways_tp_mult': 1.6000834324763606, 'sideways_tsl_mult': 0.921927161620525, 'sideways_time_stop': 164, 'sideways_use_sma': False, 'sideways_use_ema': True, 'sideways_use_atr': False, 'sideways_use_adx': False, 'sideways_use_spike': True, 'sideways_rsi_required': False}.
[I 2025-08-31 11:19:01,244] Trial 692 finished with values: [-1000000000.0, 1000000000.0] and parameters: {'p_sma': 31, 'p_std': 45, 'p_atr': 29, 'p_adx': 21, 'rsi_period': 35, 'ema1': 7, 'ema2': 27, 'slip_atr_k': 0.0191512767610095, 'slip_spread_k': 0.4574747343161862, 'spread_hl_frac': 0.02224030444453102, 'bb_std_mult': 0.7331173809086428, 'rsi_os': 33, 'rsi_ob': 52, 'vol_spike': 0.11711815593744154, 'adx_thresh': 10.827203020440288, 'atr_min_pct': 0.02109867965213355, 'atr_max_pct': 0.05765325462204472, 'tp_mult': 2.527215913870146, 'tsl_mult': 0.053420164608270086, 'strategy': 'breakout', 'time_stop': 88, 'use_sma': True, 'use_atr': True, 'use_adx': False, 'use_ema': True, 'use_spike': False, 'rsi_required': False, 'edge_k': 1.4283706753640544, 'edge_cap': 0.746055760662233, 'bull_strategy': 'mean_reversion', 'bull_bb_std_mult': 1.6059509901355318, 'bull_rsi_os': 39, 'bull_rsi_ob': 60, 'bull_adx_thresh': 26.884695218720786, 'bull_atr_min_pct': 0.012585852576234718, 'bull_atr_max_pct': 0.03381302348260337, 'bull_tp_mult': 2.9596205311627557, 'bull_tsl_mult': 0.22812441961012023, 'bull_time_stop': 270, 'bull_use_sma': False, 'bull_use_ema': True, 'bull_use_atr': False, 'bull_use_adx': True, 'bull_use_spike': False, 'bull_rsi_required': True, 'bear_strategy': 'mean_reversion', 'bear_bb_std_mult': 0.5901714736027912, 'bear_rsi_os': 54, 'bear_rsi_ob': 52, 'bear_adx_thresh': 17.736633151613145, 'bear_atr_min_pct': 0.02772403550472074, 'bear_atr_max_pct': 0.13766671851995077, 'bear_tp_mult': 2.801462744406571, 'bear_tsl_mult': 0.9209296978871859, 'bear_time_stop': 112, 'bear_use_sma': False, 'bear_use_ema': False, 'bear_use_atr': True, 'bear_use_adx': True, 'bear_use_spike': True, 'bear_rsi_required': False, 'sideways_strategy': 'mean_reversion', 'sideways_bb_std_mult': 0.647899375936859, 'sideways_rsi_os': 38, 'sideways_rsi_ob': 60, 'sideways_adx_thresh': 10.461280201583394, 'sideways_atr_min_pct': 0.022305639833052962, 'sideways_atr_max_pct': 0.10758615638322012, 'sideways_tp_mult': 1.5351530368753683, 'sideways_tsl_mult': 0.9640210690240278, 'sideways_time_stop': 90, 'sideways_use_sma': True, 'sideways_use_ema': True, 'sideways_use_atr': False, 'sideways_use_adx': False, 'sideways_use_spike': False, 'sideways_rsi_required': True}.
[I 2025-08-31 11:19:01,514] Trial 691 finished with values: [-1000000000.0, 1000000000.0] and parameters: {'p_sma': 34, 'p_std': 16, 'p_atr': 28, 'p_adx': 11, 'rsi_period': 35, 'ema1': 7, 'ema2': 22, 'slip_atr_k': 0.013523485476215586, 'slip_spread_k': 0.45252313219388907, 'spread_hl_frac': 0.022461922672862056, 'bb_std_mult': 0.708839794699859, 'rsi_os': 53, 'rsi_ob': 85, 'vol_spike': 0.11497018292569156, 'adx_thresh': 26.463490004207348, 'atr_min_pct': 0.02098039971547131, 'atr_max_pct': 0.05900653377014169, 'tp_mult': 2.8946857649401183, 'tsl_mult': 0.9975537272952646, 'strategy': 'breakout', 'time_stop': 88, 'use_sma': True, 'use_atr': True, 'use_adx': False, 'use_ema': True, 'use_spike': False, 'rsi_required': False, 'edge_k': 0.6013289016643666, 'edge_cap': 0.7368972615804456, 'bull_strategy': 'mean_reversion', 'bull_bb_std_mult': 1.4079867765082716, 'bull_rsi_os': 39, 'bull_rsi_ob': 58, 'bull_adx_thresh': 26.8189303221827, 'bull_atr_min_pct': 0.012141338890589272, 'bull_atr_max_pct': 0.029610174776289244, 'bull_tp_mult': 2.174556627787683, 'bull_tsl_mult': 0.5897730946446691, 'bull_time_stop': 42, 'bull_use_sma': False, 'bull_use_ema': False, 'bull_use_atr': False, 'bull_use_adx': True, 'bull_use_spike': False, 'bull_rsi_required': False, 'bear_strategy': 'mean_reversion', 'bear_bb_std_mult': 1.558527215901395, 'bear_rsi_os': 54, 'bear_rsi_ob': 52, 'bear_adx_thresh': 10.576352747106885, 'bear_atr_min_pct': 0.014595884577145404, 'bear_atr_max_pct': 0.13732366780580585, 'bear_tp_mult': 2.7868120365611997, 'bear_tsl_mult': 0.8597475516826774, 'bear_time_stop': 85, 'bear_use_sma': False, 'bear_use_ema': False, 'bear_use_atr': True, 'bear_use_adx': True, 'bear_use_spike': True, 'bear_rsi_required': False, 'sideways_strategy': 'mean_reversion', 'sideways_bb_std_mult': 0.6308167911447866, 'sideways_rsi_os': 5, 'sideways_rsi_ob': 69, 'sideways_adx_thresh': 25.512290723291535, 'sideways_atr_min_pct': 0.004661596102851778, 'sideways_atr_max_pct': 0.10710668473647729, 'sideways_tp_mult': 1.5163377201655992, 'sideways_tsl_mult': 0.9624070025350526, 'sideways_time_stop': 136, 'sideways_use_sma': True, 'sideways_use_ema': True, 'sideways_use_atr': False, 'sideways_use_adx': False, 'sideways_use_spike': True, 'sideways_rsi_required': True}.
[I 2025-08-31 11:19:02,038] Trial 689 finished with values: [-1000000000.0, 1000000000.0] and parameters: {'p_sma': 30, 'p_std': 16, 'p_atr': 27, 'p_adx': 22, 'rsi_period': 81, 'ema1': 5, 'ema2': 22, 'slip_atr_k': 0.23402182561338347, 'slip_spread_k': 0.45633796923727826, 'spread_hl_frac': 0.000352872891208493, 'bb_std_mult': 0.6373437531742617, 'rsi_os': 31, 'rsi_ob': 85, 'vol_spike': 0.1620238041615339, 'adx_thresh': 10.872319107111906, 'atr_min_pct': 0.02148051827270071, 'atr_max_pct': 0.05772783216675475, 'tp_mult': 2.9570826611961243, 'tsl_mult': 0.10517081252007313, 'strategy': 'breakout', 'time_stop': 79, 'use_sma': True, 'use_atr': True, 'use_adx': False, 'use_ema': True, 'use_spike': False, 'rsi_required': False, 'edge_k': 0.9231838563366772, 'edge_cap': 0.7414513033258889, 'bull_strategy': 'mean_reversion', 'bull_bb_std_mult': 2.0051464683404414, 'bull_rsi_os': 19, 'bull_rsi_ob': 49, 'bull_adx_thresh': 26.991935498993087, 'bull_atr_min_pct': 0.013100475750625343, 'bull_atr_max_pct': 0.13047678722940703, 'bull_tp_mult': 2.174833001338535, 'bull_tsl_mult': 0.21979032345105995, 'bull_time_stop': 42, 'bull_use_sma': False, 'bull_use_ema': True, 'bull_use_atr': False, 'bull_use_adx': True, 'bull_use_spike': False, 'bull_rsi_required': False, 'bear_strategy': 'mean_reversion', 'bear_bb_std_mult': 3.0999888023994684, 'bear_rsi_os': 52, 'bear_rsi_ob': 82, 'bear_adx_thresh': 30.21392995532189, 'bear_atr_min_pct': 0.0063944161868144805, 'bear_atr_max_pct': 0.07713390119568668, 'bear_tp_mult': 2.7054395648968104, 'bear_tsl_mult': 0.9115265248997791, 'bear_time_stop': 111, 'bear_use_sma': False, 'bear_use_ema': False, 'bear_use_atr': True, 'bear_use_adx': False, 'bear_use_spike': True, 'bear_rsi_required': False, 'sideways_strategy': 'mean_reversion', 'sideways_bb_std_mult': 0.9597985047840629, 'sideways_rsi_os': 38, 'sideways_rsi_ob': 60, 'sideways_adx_thresh': 25.446371606511928, 'sideways_atr_min_pct': 0.027760178522597635, 'sideways_atr_max_pct': 0.12088780065345389, 'sideways_tp_mult': 1.5436774749239799, 'sideways_tsl_mult': 0.45422543783633784, 'sideways_time_stop': 168, 'sideways_use_sma': False, 'sideways_use_ema': True, 'sideways_use_atr': False, 'sideways_use_adx': False, 'sideways_use_spike': True, 'sideways_rsi_required': False}.
[I 2025-08-31 11:19:02,204] Trial 690 finished with values: [-1000000000.0, 1000000000.0] and parameters: {'p_sma': 33, 'p_std': 12, 'p_atr': 28, 'p_adx': 22, 'rsi_period': 35, 'ema1': 9, 'ema2': 27, 'slip_atr_k': 0.11974788995139114, 'slip_spread_k': 0.45613788778439085, 'spread_hl_frac': 0.02258474707890399, 'bb_std_mult': 0.6404340848777798, 'rsi_os': 32, 'rsi_ob': 85, 'vol_spike': 0.14993642062874335, 'adx_thresh': 11.003261148781412, 'atr_min_pct': 0.004820908689183539, 'atr_max_pct': 0.05800401891358941, 'tp_mult': 2.949424842493579, 'tsl_mult': 0.0974648803620385, 'strategy': 'breakout', 'time_stop': 79, 'use_sma': True, 'use_atr': True, 'use_adx': False, 'use_ema': True, 'use_spike': False, 'rsi_required': False, 'edge_k': 0.5995524580743767, 'edge_cap': 0.7193076223641636, 'bull_strategy': 'mean_reversion', 'bull_bb_std_mult': 0.6586457189535901, 'bull_rsi_os': 54, 'bull_rsi_ob': 63, 'bull_adx_thresh': 26.830321401679807, 'bull_atr_min_pct': 0.012900360181155205, 'bull_atr_max_pct': 0.129569771540504, 'bull_tp_mult': 2.9671457689015446, 'bull_tsl_mult': 0.5880362949342424, 'bull_time_stop': 44, 'bull_use_sma': False, 'bull_use_ema': True, 'bull_use_atr': False, 'bull_use_adx': True, 'bull_use_spike': False, 'bull_rsi_required': False, 'bear_strategy': 'mean_reversion', 'bear_bb_std_mult': 0.5852456894238334, 'bear_rsi_os': 6, 'bear_rsi_ob': 78, 'bear_adx_thresh': 34.275745432986, 'bear_atr_min_pct': 0.014648754350619037, 'bear_atr_max_pct': 0.13771720550097227, 'bear_tp_mult': 2.787298699918799, 'bear_tsl_mult': 0.916664589134899, 'bear_time_stop': 84, 'bear_use_sma': False, 'bear_use_ema': False, 'bear_use_atr': True, 'bear_use_adx': True, 'bear_use_spike': True, 'bear_rsi_required': False, 'sideways_strategy': 'mean_reversion', 'sideways_bb_std_mult': 0.9675803020997789, 'sideways_rsi_os': 22, 'sideways_rsi_ob': 60, 'sideways_adx_thresh': 25.41061284090072, 'sideways_atr_min_pct': 0.004679529659151917, 'sideways_atr_max_pct': 0.10523236117763933, 'sideways_tp_mult': 1.5219650560366946, 'sideways_tsl_mult': 0.5257098294691248, 'sideways_time_stop': 25, 'sideways_use_sma': True, 'sideways_use_ema': True, 'sideways_use_atr': False, 'sideways_use_adx': False, 'sideways_use_spike': True, 'sideways_rsi_required': True}.
