[I 2025-08-31 11:01:38,168] Trial 566 finished with values: [0.0016282801905758149, 0.0028320626538653913] and parameters: {'p_sma': 34, 'p_std': 17, 'p_atr': 27, 'p_adx': 20, 'rsi_period': 32, 'ema1': 5, 'ema2': 17, 'slip_atr_k': 0.027449913398189134, 'slip_spread_k': 0.48231573481991413, 'spread_hl_frac': 0.021552522720268072, 'bb_std_mult': 0.801727952395211, 'rsi_os': 27, 'rsi_ob': 80, 'vol_spike': 0.09171632126458518, 'adx_thresh': 11.64922076874292, 'atr_min_pct': 0.02246648252134053, 'atr_max_pct': 0.05306982789249114, 'tp_mult': 2.9983944588079954, 'tsl_mult': 0.057737787140884705, 'strategy': 'breakout', 'time_stop': 61, 'use_sma': True, 'use_atr': True, 'use_adx': False, 'use_ema': True, 'use_spike': False, 'rsi_required': False, 'edge_k': 1.5126581710414453, 'edge_cap': 0.7112229327746988, 'bull_strategy': 'mean_reversion', 'bull_bb_std_mult': 1.8756180303487415, 'bull_rsi_os': 39, 'bull_rsi_ob': 61, 'bull_adx_thresh': 28.152917597586704, 'bull_atr_min_pct': 0.010767344013007316, 'bull_atr_max_pct': 0.033907861077701884, 'bull_tp_mult': 2.9922935215851787, 'bull_tsl_mult': 0.28768103568394554, 'bull_time_stop': 35, 'bull_use_sma': False, 'bull_use_ema': True, 'bull_use_atr': False, 'bull_use_adx': True, 'bull_use_spike': False, 'bull_rsi_required': False, 'bear_strategy': 'mean_reversion', 'bear_bb_std_mult': 1.7085667469816386, 'bear_rsi_os': 48, 'bear_rsi_ob': 55, 'bear_adx_thresh': 12.086967001119508, 'bear_atr_min_pct': 0.005806356662130373, 'bear_atr_max_pct': 0.13119751309069588, 'bear_tp_mult': 2.68004164378922, 'bear_tsl_mult': 0.8369421712950684, 'bear_time_stop': 97, 'bear_use_sma': False, 'bear_use_ema': False, 'bear_use_atr': True, 'bear_use_adx': False, 'bear_use_spike': True, 'bear_rsi_required': False, 'sideways_strategy': 'mean_reversion', 'sideways_bb_std_mult': 1.187446429034792, 'sideways_rsi_os': 40, 'sideways_rsi_ob': 58, 'sideways_adx_thresh': 25.637116761189507, 'sideways_atr_min_pct': 0.004270569354385254, 'sideways_atr_max_pct': 0.10137631087241451, 'sideways_tp_mult': 1.663782650518714, 'sideways_tsl_mult': 0.8457548534767352, 'sideways_time_stop': 165, 'sideways_use_sma': True, 'sideways_use_ema': True, 'sideways_use_atr': False, 'sideways_use_adx': False, 'sideways_use_spike': True, 'sideways_rsi_required': False}.
[I 2025-08-31 11:01:38,279] Trial 567 finished with values: [0.004951069088302118, 0.0020857454332296795] and parameters: {'p_sma': 34, 'p_std': 18, 'p_atr': 27, 'p_adx': 20, 'rsi_period': 33, 'ema1': 5, 'ema2': 17, 'slip_atr_k': 0.02695169416971552, 'slip_spread_k': 0.4929418689001154, 'spread_hl_frac': 0.021091111465001384, 'bb_std_mult': 0.766235972710078, 'rsi_os': 28, 'rsi_ob': 80, 'vol_spike': 0.09532545388166491, 'adx_thresh': 11.795790218532732, 'atr_min_pct': 0.022566046289551944, 'atr_max_pct': 0.05341224998815813, 'tp_mult': 2.9922347997876244, 'tsl_mult': 0.072635042360804, 'strategy': 'breakout', 'time_stop': 62, 'use_sma': True, 'use_atr': True, 'use_adx': False, 'use_ema': True, 'use_spike': False, 'rsi_required': False, 'edge_k': 1.504333362908421, 'edge_cap': 0.6942064522883336, 'bull_strategy': 'mean_reversion', 'bull_bb_std_mult': 1.8248781459450356, 'bull_rsi_os': 41, 'bull_rsi_ob': 60, 'bull_adx_thresh': 28.48441842348402, 'bull_atr_min_pct': 0.010622250236906465, 'bull_atr_max_pct': 0.03223091641948543, 'bull_tp_mult': 2.9806578447051164, 'bull_tsl_mult': 0.25226953628036647, 'bull_time_stop': 39, 'bull_use_sma': False, 'bull_use_ema': True, 'bull_use_atr': False, 'bull_use_adx': True, 'bull_use_spike': False, 'bull_rsi_required': False, 'bear_strategy': 'mean_reversion', 'bear_bb_std_mult': 1.7270541982297036, 'bear_rsi_os': 48, 'bear_rsi_ob': 55, 'bear_adx_thresh': 11.353159586259931, 'bear_atr_min_pct': 0.005896724385163077, 'bear_atr_max_pct': 0.1309904291131237, 'bear_tp_mult': 2.692197063854135, 'bear_tsl_mult': 0.8464900341617755, 'bear_time_stop': 99, 'bear_use_sma': False, 'bear_use_ema': False, 'bear_use_atr': True, 'bear_use_adx': False, 'bear_use_spike': True, 'bear_rsi_required': False, 'sideways_strategy': 'mean_reversion', 'sideways_bb_std_mult': 1.198887079551283, 'sideways_rsi_os': 40, 'sideways_rsi_ob': 58, 'sideways_adx_thresh': 25.345070450382995, 'sideways_atr_min_pct': 0.004214576564150219, 'sideways_atr_max_pct': 0.10194159379699319, 'sideways_tp_mult': 1.5805365058601406, 'sideways_tsl_mult': 0.841374628814517, 'sideways_time_stop': 161, 'sideways_use_sma': True, 'sideways_use_ema': True, 'sideways_use_atr': False, 'sideways_use_adx': False, 'sideways_use_spike': True, 'sideways_rsi_required': False}.
[I 2025-08-31 11:02:12,090] Trial 571 finished with values: [0.005580924272584165, 0.002195351463725103] and parameters: {'p_sma': 34, 'p_std': 17, 'p_atr': 25, 'p_adx': 21, 'rsi_period': 33, 'ema1': 5, 'ema2': 17, 'slip_atr_k': 0.026357633828124016, 'slip_spread_k': 0.4955614070392526, 'spread_hl_frac': 0.021620155896626404, 'bb_std_mult': 0.7960915426977178, 'rsi_os': 28, 'rsi_ob': 80, 'vol_spike': 0.096590145266631, 'adx_thresh': 11.868479075510228, 'atr_min_pct': 0.022326871405251334, 'atr_max_pct': 0.053017756790786005, 'tp_mult': 2.9857919183078154, 'tsl_mult': 0.06424718745218974, 'strategy': 'breakout', 'time_stop': 65, 'use_sma': True, 'use_atr': True, 'use_adx': False, 'use_ema': True, 'use_spike': False, 'rsi_required': False, 'edge_k': 1.481455921142112, 'edge_cap': 0.7074871453254736, 'bull_strategy': 'mean_reversion', 'bull_bb_std_mult': 1.8599804434785985, 'bull_rsi_os': 41, 'bull_rsi_ob': 60, 'bull_adx_thresh': 28.558589692298924, 'bull_atr_min_pct': 0.01066045013349507, 'bull_atr_max_pct': 0.032483346803782995, 'bull_tp_mult': 2.9756094295786446, 'bull_tsl_mult': 0.25033085723735066, 'bull_time_stop': 40, 'bull_use_sma': False, 'bull_use_ema': True, 'bull_use_atr': False, 'bull_use_adx': True, 'bull_use_spike': False, 'bull_rsi_required': False, 'bear_strategy': 'mean_reversion', 'bear_bb_std_mult': 1.6280952736018195, 'bear_rsi_os': 48, 'bear_rsi_ob': 56, 'bear_adx_thresh': 11.81613921576706, 'bear_atr_min_pct': 0.00596997598835469, 'bear_atr_max_pct': 0.1301539987561809, 'bear_tp_mult': 2.6957369156722204, 'bear_tsl_mult': 0.8500343053232896, 'bear_time_stop': 98, 'bear_use_sma': False, 'bear_use_ema': False, 'bear_use_atr': True, 'bear_use_adx': False, 'bear_use_spike': True, 'bear_rsi_required': False, 'sideways_strategy': 'mean_reversion', 'sideways_bb_std_mult': 1.1732165682428168, 'sideways_rsi_os': 40, 'sideways_rsi_ob': 58, 'sideways_adx_thresh': 25.73021755464193, 'sideways_atr_min_pct': 0.004147660861476023, 'sideways_atr_max_pct': 0.10304836227973978, 'sideways_tp_mult': 1.649956152592847, 'sideways_tsl_mult': 0.8441354928812917, 'sideways_time_stop': 159, 'sideways_use_sma': True, 'sideways_use_ema': True, 'sideways_use_atr': False, 'sideways_use_adx': False, 'sideways_use_spike': True, 'sideways_rsi_required': False}.
[I 2025-08-31 11:02:12,228] Trial 572 finished with values: [-0.002318382385882445, 0.005103111307893283] and parameters: {'p_sma': 34, 'p_std': 18, 'p_atr': 27, 'p_adx': 20, 'rsi_period': 32, 'ema1': 5, 'ema2': 17, 'slip_atr_k': 0.029087980556054077, 'slip_spread_k': 0.49595052638915393, 'spread_hl_frac': 0.020255575845192813, 'bb_std_mult': 0.7756921154418989, 'rsi_os': 28, 'rsi_ob': 82, 'vol_spike': 0.09471471457221438, 'adx_thresh': 12.057192303457947, 'atr_min_pct': 0.02312465321099839, 'atr_max_pct': 0.0566844492000414, 'tp_mult': 2.9998330014219294, 'tsl_mult': 0.06948415334914779, 'strategy': 'breakout', 'time_stop': 65, 'use_sma': True, 'use_atr': True, 'use_adx': False, 'use_ema': True, 'use_spike': False, 'rsi_required': False, 'edge_k': 1.4959083890346554, 'edge_cap': 0.6895677734138332, 'bull_strategy': 'mean_reversion', 'bull_bb_std_mult': 1.8588428948176925, 'bull_rsi_os': 39, 'bull_rsi_ob': 60, 'bull_adx_thresh': 28.279993494422936, 'bull_atr_min_pct': 0.01055305636666275, 'bull_atr_max_pct': 0.02978063769333242, 'bull_tp_mult': 2.9943779757947495, 'bull_tsl_mult': 0.2595701537027327, 'bull_time_stop': 35, 'bull_use_sma': False, 'bull_use_ema': True, 'bull_use_atr': False, 'bull_use_adx': True, 'bull_use_spike': False, 'bull_rsi_required': False, 'bear_strategy': 'mean_reversion', 'bear_bb_std_mult': 1.746460758592695, 'bear_rsi_os': 48, 'bear_rsi_ob': 56, 'bear_adx_thresh': 10.6661941907832, 'bear_atr_min_pct': 0.005778141457704314, 'bear_atr_max_pct': 0.13006734564122596, 'bear_tp_mult': 2.647200837094829, 'bear_tsl_mult': 0.8469629403686049, 'bear_time_stop': 95, 'bear_use_sma': False, 'bear_use_ema': False, 'bear_use_atr': True, 'bear_use_adx': False, 'bear_use_spike': True, 'bear_rsi_required': False, 'sideways_strategy': 'mean_reversion', 'sideways_bb_std_mult': 1.1890581638196265, 'sideways_rsi_os': 41, 'sideways_rsi_ob': 58, 'sideways_adx_thresh': 25.708109346098624, 'sideways_atr_min_pct': 0.00409396910110991, 'sideways_atr_max_pct': 0.10237485467818681, 'sideways_tp_mult': 1.5794211434038348, 'sideways_tsl_mult': 0.8375818306052636, 'sideways_time_stop': 159, 'sideways_use_sma': True, 'sideways_use_ema': True, 'sideways_use_atr': False, 'sideways_use_adx': False, 'sideways_use_spike': True, 'sideways_rsi_required': False}.
[I 2025-08-31 11:02:12,577] Trial 569 finished with values: [-0.0033684464273840975, 0.005678161207432943] and parameters: {'p_sma': 33, 'p_std': 17, 'p_atr': 27, 'p_adx': 20, 'rsi_period': 33, 'ema1': 5, 'ema2': 17, 'slip_atr_k': 0.028457718067524895, 'slip_spread_k': 0.492670814198478, 'spread_hl_frac': 0.02138456280017908, 'bb_std_mult': 0.7860391792210266, 'rsi_os': 28, 'rsi_ob': 81, 'vol_spike': 0.09410013607102737, 'adx_thresh': 11.706545488877763, 'atr_min_pct': 0.022316232279054105, 'atr_max_pct': 0.053321681642916556, 'tp_mult': 2.9911396295927344, 'tsl_mult': 0.07283180968359912, 'strategy': 'breakout', 'time_stop': 61, 'use_sma': True, 'use_atr': True, 'use_adx': False, 'use_ema': True, 'use_spike': False, 'rsi_required': False, 'edge_k': 1.4966992409289623, 'edge_cap': 0.7092308017497673, 'bull_strategy': 'mean_reversion', 'bull_bb_std_mult': 1.873617006600443, 'bull_rsi_os': 39, 'bull_rsi_ob': 61, 'bull_adx_thresh': 28.260982070756224, 'bull_atr_min_pct': 0.010599266198116837, 'bull_atr_max_pct': 0.033427578533938476, 'bull_tp_mult': 2.9965995908760283, 'bull_tsl_mult': 0.25296345288553845, 'bull_time_stop': 38, 'bull_use_sma': False, 'bull_use_ema': True, 'bull_use_atr': False, 'bull_use_adx': True, 'bull_use_spike': False, 'bull_rsi_required': False, 'bear_strategy': 'mean_reversion', 'bear_bb_std_mult': 1.6171270482276363, 'bear_rsi_os': 48, 'bear_rsi_ob': 55, 'bear_adx_thresh': 11.453429822007148, 'bear_atr_min_pct': 0.005700965194651476, 'bear_atr_max_pct': 0.1295107664586839, 'bear_tp_mult': 2.713371512313031, 'bear_tsl_mult': 0.8335576010301144, 'bear_time_stop': 98, 'bear_use_sma': False, 'bear_use_ema': False, 'bear_use_atr': True, 'bear_use_adx': False, 'bear_use_spike': True, 'bear_rsi_required': False, 'sideways_strategy': 'mean_reversion', 'sideways_bb_std_mult': 1.2281168345010423, 'sideways_rsi_os': 40, 'sideways_rsi_ob': 58, 'sideways_adx_thresh': 25.773774926516108, 'sideways_atr_min_pct': 0.004367297143280602, 'sideways_atr_max_pct': 0.10111987401876668, 'sideways_tp_mult': 1.6518429800497672, 'sideways_tsl_mult': 0.8525172328275678, 'sideways_time_stop': 166, 'sideways_use_sma': True, 'sideways_use_ema': True, 'sideways_use_atr': False, 'sideways_use_adx': False, 'sideways_use_spike': True, 'sideways_rsi_required': False}.
[I 2025-08-31 11:02:12,686] Trial 570 finished with values: [0.0037018539719577692, 0.004056297812327345] and parameters: {'p_sma': 34, 'p_std': 17, 'p_atr': 25, 'p_adx': 20, 'rsi_period': 32, 'ema1': 5, 'ema2': 17, 'slip_atr_k': 0.027301461059731975, 'slip_spread_k': 0.49551296399881317, 'spread_hl_frac': 0.021177938768855084, 'bb_std_mult': 0.7953132540761125, 'rsi_os': 28, 'rsi_ob': 80, 'vol_spike': 0.09564587482355344, 'adx_thresh': 11.426722485128572, 'atr_min_pct': 0.022243886841226725, 'atr_max_pct': 0.053355971478621506, 'tp_mult': 2.98764462726203, 'tsl_mult': 0.0626378545119676, 'strategy': 'breakout', 'time_stop': 60, 'use_sma': True, 'use_atr': True, 'use_adx': False, 'use_ema': True, 'use_spike': False, 'rsi_required': False, 'edge_k': 1.4900211242438859, 'edge_cap': 0.708541492225977, 'bull_strategy': 'mean_reversion', 'bull_bb_std_mult': 1.8562895237919033, 'bull_rsi_os': 41, 'bull_rsi_ob': 61, 'bull_adx_thresh': 28.198623785334334, 'bull_atr_min_pct': 0.01059637504326198, 'bull_atr_max_pct': 0.03182590440848862, 'bull_tp_mult': 2.996082184775768, 'bull_tsl_mult': 0.25620620607653266, 'bull_time_stop': 36, 'bull_use_sma': False, 'bull_use_ema': True, 'bull_use_atr': False, 'bull_use_adx': True, 'bull_use_spike': False, 'bull_rsi_required': False, 'bear_strategy': 'mean_reversion', 'bear_bb_std_mult': 1.6013073102436142, 'bear_rsi_os': 48, 'bear_rsi_ob': 56, 'bear_adx_thresh': 11.697829180864675, 'bear_atr_min_pct': 0.005825092938520184, 'bear_atr_max_pct': 0.1314955279277134, 'bear_tp_mult': 2.7055519327559647, 'bear_tsl_mult': 0.8367351197400463, 'bear_time_stop': 100, 'bear_use_sma': False, 'bear_use_ema': False, 'bear_use_atr': True, 'bear_use_adx': False, 'bear_use_spike': True, 'bear_rsi_required': False, 'sideways_strategy': 'mean_reversion', 'sideways_bb_std_mult': 1.199382282237231, 'sideways_rsi_os': 40, 'sideways_rsi_ob': 58, 'sideways_adx_thresh': 25.845551811085905, 'sideways_atr_min_pct': 0.004206904436849865, 'sideways_atr_max_pct': 0.10109205418535211, 'sideways_tp_mult': 1.5866217105298277, 'sideways_tsl_mult': 0.845081187853513, 'sideways_time_stop': 160, 'sideways_use_sma': True, 'sideways_use_ema': True, 'sideways_use_atr': False, 'sideways_use_adx': False, 'sideways_use_spike': True, 'sideways_rsi_required': False}.
[I 2025-08-31 11:02:46,738] Trial 576 finished with values: [-1000000000.0, 1000000000.0] and parameters: {'p_sma': 36, 'p_std': 17, 'p_atr': 25, 'p_adx': 22, 'rsi_period': 32, 'ema1': 5, 'ema2': 18, 'slip_atr_k': 0.025534468027253027, 'slip_spread_k': 0.5129254627027309, 'spread_hl_frac': 0.019940182934527914, 'bb_std_mult': 0.8184026925840447, 'rsi_os': 27, 'rsi_ob': 81, 'vol_spike': 0.10062408838820003, 'adx_thresh': 12.169464725279738, 'atr_min_pct': 0.0236759297854769, 'atr_max_pct': 0.05992197598955494, 'tp_mult': 2.9880072007972833, 'tsl_mult': 0.06575018131354891, 'strategy': 'breakout', 'time_stop': 72, 'use_sma': True, 'use_atr': True, 'use_adx': False, 'use_ema': True, 'use_spike': False, 'rsi_required': False, 'edge_k': 1.450960261662987, 'edge_cap': 0.7234174963085995, 'bull_strategy': 'mean_reversion', 'bull_bb_std_mult': 1.8339845986975043, 'bull_rsi_os': 39, 'bull_rsi_ob': 59, 'bull_adx_thresh': 28.850271139291912, 'bull_atr_min_pct': 0.010386070405694841, 'bull_atr_max_pct': 0.03156084401904639, 'bull_tp_mult': 2.9516817297997697, 'bull_tsl_mult': 0.2401577934292193, 'bull_time_stop': 38, 'bull_use_sma': False, 'bull_use_ema': True, 'bull_use_atr': False, 'bull_use_adx': True, 'bull_use_spike': False, 'bull_rsi_required': False, 'bear_strategy': 'mean_reversion', 'bear_bb_std_mult': 1.7435323943361665, 'bear_rsi_os': 47, 'bear_rsi_ob': 57, 'bear_adx_thresh': 10.169064729568646, 'bear_atr_min_pct': 0.006490925364480189, 'bear_atr_max_pct': 0.1305597268119926, 'bear_tp_mult': 2.6569098825192374, 'bear_tsl_mult': 0.86523569247665, 'bear_time_stop': 93, 'bear_use_sma': False, 'bear_use_ema': False, 'bear_use_atr': True, 'bear_use_adx': False, 'bear_use_spike': True, 'bear_rsi_required': False, 'sideways_strategy': 'mean_reversion', 'sideways_bb_std_mult': 1.1386712041624865, 'sideways_rsi_os': 41, 'sideways_rsi_ob': 60, 'sideways_adx_thresh': 26.437114079291057, 'sideways_atr_min_pct': 0.004072223961256382, 'sideways_atr_max_pct': 0.10398192187925093, 'sideways_tp_mult': 1.571649514777919, 'sideways_tsl_mult': 0.8364745453955729, 'sideways_time_stop': 158, 'sideways_use_sma': True, 'sideways_use_ema': True, 'sideways_use_atr': False, 'sideways_use_adx': False, 'sideways_use_spike': True, 'sideways_rsi_required': False}.
[I 2025-08-31 11:02:46,984] Trial 573 finished with values: [-1000000000.0, 1000000000.0] and parameters: {'p_sma': 33, 'p_std': 17, 'p_atr': 25, 'p_adx': 22, 'rsi_period': 32, 'ema1': 5, 'ema2': 18, 'slip_atr_k': 0.028113331481144973, 'slip_spread_k': 0.5126929974368052, 'spread_hl_frac': 0.02039333662353205, 'bb_std_mult': 0.818477746367492, 'rsi_os': 28, 'rsi_ob': 81, 'vol_spike': 0.09426685969973925, 'adx_thresh': 12.212953605764769, 'atr_min_pct': 0.02297417122544646, 'atr_max_pct': 0.05731045575741385, 'tp_mult': 2.9985032026765936, 'tsl_mult': 0.06712217090938365, 'strategy': 'breakout', 'time_stop': 71, 'use_sma': True, 'use_atr': True, 'use_adx': False, 'use_ema': True, 'use_spike': False, 'rsi_required': False, 'edge_k': 1.4912810318355607, 'edge_cap': 0.7026137302779416, 'bull_strategy': 'mean_reversion', 'bull_bb_std_mult': 1.8608990638981018, 'bull_rsi_os': 39, 'bull_rsi_ob': 60, 'bull_adx_thresh': 28.965276338562674, 'bull_atr_min_pct': 0.010501378149610753, 'bull_atr_max_pct': 0.03089257601569636, 'bull_tp_mult': 2.9982185059809923, 'bull_tsl_mult': 0.25540186216916994, 'bull_time_stop': 36, 'bull_use_sma': False, 'bull_use_ema': True, 'bull_use_atr': False, 'bull_use_adx': True, 'bull_use_spike': False, 'bull_rsi_required': False, 'bear_strategy': 'mean_reversion', 'bear_bb_std_mult': 1.7465307168338398, 'bear_rsi_os': 47, 'bear_rsi_ob': 56, 'bear_adx_thresh': 10.72904306977198, 'bear_atr_min_pct': 0.00670909084991456, 'bear_atr_max_pct': 0.12885035410552503, 'bear_tp_mult': 2.652861734790268, 'bear_tsl_mult': 0.8415240262740158, 'bear_time_stop': 101, 'bear_use_sma': False, 'bear_use_ema': False, 'bear_use_atr': True, 'bear_use_adx': False, 'bear_use_spike': True, 'bear_rsi_required': False, 'sideways_strategy': 'mean_reversion', 'sideways_bb_std_mult': 1.208326256863461, 'sideways_rsi_os': 41, 'sideways_rsi_ob': 58, 'sideways_adx_thresh': 26.266464886182384, 'sideways_atr_min_pct': 0.004148440791393366, 'sideways_atr_max_pct': 0.10393726751822344, 'sideways_tp_mult': 1.5893357245353334, 'sideways_tsl_mult': 0.8504995083957136, 'sideways_time_stop': 158, 'sideways_use_sma': True, 'sideways_use_ema': True, 'sideways_use_atr': False, 'sideways_use_adx': False, 'sideways_use_spike': True, 'sideways_rsi_required': False}.
[I 2025-08-31 11:02:46,984] Trial 574 finished with values: [-0.006864291323573357, 0.015548542270644772] and parameters: {'p_sma': 33, 'p_std': 17, 'p_atr': 25, 'p_adx': 22, 'rsi_period': 31, 'ema1': 5, 'ema2': 18, 'slip_atr_k': 0.028276412893132798, 'slip_spread_k': 0.5105351952993364, 'spread_hl_frac': 0.020655258222843545, 'bb_std_mult': 0.8010143291961687, 'rsi_os': 27, 'rsi_ob': 81, 'vol_spike': 0.09929356091052743, 'adx_thresh': 12.121974414925713, 'atr_min_pct': 0.023017697852983878, 'atr_max_pct': 0.0559617222161135, 'tp_mult': 2.99900800008545, 'tsl_mult': 0.06361125187460527, 'strategy': 'breakout', 'time_stop': 50, 'use_sma': True, 'use_atr': True, 'use_adx': False, 'use_ema': True, 'use_spike': False, 'rsi_required': False, 'edge_k': 1.4743087657352578, 'edge_cap': 0.684731041883017, 'bull_strategy': 'mean_reversion', 'bull_bb_std_mult': 1.8333969322396204, 'bull_rsi_os': 38, 'bull_rsi_ob': 59, 'bull_adx_thresh': 27.812959408618667, 'bull_atr_min_pct': 0.010511990486139676, 'bull_atr_max_pct': 0.03035584128523245, 'bull_tp_mult': 2.9978509424131556, 'bull_tsl_mult': 0.23509799249343669, 'bull_time_stop': 37, 'bull_use_sma': False, 'bull_use_ema': True, 'bull_use_atr': False, 'bull_use_adx': True, 'bull_use_spike': False, 'bull_rsi_required': False, 'bear_strategy': 'mean_reversion', 'bear_bb_std_mult': 1.7366416854226605, 'bear_rsi_os': 49, 'bear_rsi_ob': 57, 'bear_adx_thresh': 10.454733292456487, 'bear_atr_min_pct': 0.00453930115521633, 'bear_atr_max_pct': 0.12973237265782492, 'bear_tp_mult': 2.650889598003341, 'bear_tsl_mult': 0.8651936975843839, 'bear_time_stop': 99, 'bear_use_sma': False, 'bear_use_ema': False, 'bear_use_atr': True, 'bear_use_adx': False, 'bear_use_spike': True, 'bear_rsi_required': False, 'sideways_strategy': 'mean_reversion', 'sideways_bb_std_mult': 1.1366358379012698, 'sideways_rsi_os': 41, 'sideways_rsi_ob': 60, 'sideways_adx_thresh': 26.14221141715531, 'sideways_atr_min_pct': 0.004339925430242709, 'sideways_atr_max_pct': 0.10429865374082756, 'sideways_tp_mult': 1.5988712415609407, 'sideways_tsl_mult': 0.8398810175725935, 'sideways_time_stop': 156, 'sideways_use_sma': True, 'sideways_use_ema': True, 'sideways_use_atr': False, 'sideways_use_adx': False, 'sideways_use_spike': True, 'sideways_rsi_required': False}.
