[I 2025-08-31 11:23:02,760] Trial 718 finished with values: [-0.0018295521786574342, 0.008746980864558234] and parameters: {'p_sma': 37, 'p_std': 54, 'p_atr': 28, 'p_adx': 20, 'rsi_period': 38, 'ema1': 5, 'ema2': 18, 'slip_atr_k': 0.025572720718674433, 'slip_spread_k': 0.5032537932297819, 'spread_hl_frac': 0.03997845179494007, 'bb_std_mult': 1.6107572821332137, 'rsi_os': 26, 'rsi_ob': 57, 'vol_spike': 0.12071136503822136, 'adx_thresh': 11.161341357986823, 'atr_min_pct': 0.008320194112581416, 'atr_max_pct': 0.05858268334204964, 'tp_mult': 1.5701667859514365, 'tsl_mult': 0.11813069445083496, 'strategy': 'breakout', 'time_stop': 66, 'use_sma': True, 'use_atr': True, 'use_adx': False, 'use_ema': True, 'use_spike': False, 'rsi_required': False, 'edge_k': 1.2004317230272452, 'edge_cap': 0.695542375773736, 'bull_strategy': 'mean_reversion', 'bull_bb_std_mult': 3.0040283351670265, 'bull_rsi_os': 20, 'bull_rsi_ob': 59, 'bull_adx_thresh': 28.070899870668782, 'bull_atr_min_pct': 0.012336446348215256, 'bull_atr_max_pct': 0.03686990389134945, 'bull_tp_mult': 2.896645048999567, 'bull_tsl_mult': 0.4787155388963016, 'bull_time_stop': 56, 'bull_use_sma': False, 'bull_use_ema': True, 'bull_use_atr': False, 'bull_use_adx': True, 'bull_use_spike': False, 'bull_rsi_required': False, 'bear_strategy': 'mean_reversion', 'bear_bb_std_mult': 3.5084249896761666, 'bear_rsi_os': 53, 'bear_rsi_ob': 67, 'bear_adx_thresh': 12.396576602642897, 'bear_atr_min_pct': 0.004410524485415081, 'bear_atr_max_pct': 0.13647281880093723, 'bear_tp_mult': 2.082247990113642, 'bear_tsl_mult': 0.8934633075828502, 'bear_time_stop': 202, 'bear_use_sma': False, 'bear_use_ema': False, 'bear_use_atr': False, 'bear_use_adx': False, 'bear_use_spike': True, 'bear_rsi_required': False, 'sideways_strategy': 'mean_reversion', 'sideways_bb_std_mult': 0.9397975275086702, 'sideways_rsi_os': 46, 'sideways_rsi_ob': 50, 'sideways_adx_thresh': 27.052124255169304, 'sideways_atr_min_pct': 0.021235234350883148, 'sideways_atr_max_pct': 0.0995973810404941, 'sideways_tp_mult': 2.2194629963768246, 'sideways_tsl_mult': 0.8614744149496191, 'sideways_time_stop': 182, 'sideways_use_sma': True, 'sideways_use_ema': True, 'sideways_use_atr': True, 'sideways_use_adx': False, 'sideways_use_spike': True, 'sideways_rsi_required': False}.
[I 2025-08-31 11:23:03,545] Trial 721 finished with values: [-1000000000.0, 1000000000.0] and parameters: {'p_sma': 27, 'p_std': 54, 'p_atr': 28, 'p_adx': 20, 'rsi_period': 70, 'ema1': 15, 'ema2': 38, 'slip_atr_k': 0.0341863671089071, 'slip_spread_k': 0.5295341005881841, 'spread_hl_frac': 0.02210574665858635, 'bb_std_mult': 1.0815745413633908, 'rsi_os': 28, 'rsi_ob': 57, 'vol_spike': 0.1789125076394971, 'adx_thresh': 30.03265201846252, 'atr_min_pct': 0.022646572199337016, 'atr_max_pct': 0.014018022802237115, 'tp_mult': 2.9989205418790403, 'tsl_mult': 0.08842663163744813, 'strategy': 'breakout', 'time_stop': 85, 'use_sma': True, 'use_atr': True, 'use_adx': False, 'use_ema': True, 'use_spike': False, 'rsi_required': False, 'edge_k': 1.2572430760934195, 'edge_cap': 0.3296520360656344, 'bull_strategy': 'mean_reversion', 'bull_bb_std_mult': 1.4857017637704186, 'bull_rsi_os': 7, 'bull_rsi_ob': 60, 'bull_adx_thresh': 34.68085838512614, 'bull_atr_min_pct': 0.016224158019098475, 'bull_atr_max_pct': 0.031188463487087297, 'bull_tp_mult': 2.945909987680841, 'bull_tsl_mult': 0.2248880707350064, 'bull_time_stop': 54, 'bull_use_sma': False, 'bull_use_ema': True, 'bull_use_atr': False, 'bull_use_adx': True, 'bull_use_spike': False, 'bull_rsi_required': True, 'bear_strategy': 'mean_reversion', 'bear_bb_std_mult': 2.3387849471770816, 'bear_rsi_os': 54, 'bear_rsi_ob': 85, 'bear_adx_thresh': 25.31975172975361, 'bear_atr_min_pct': 0.004766222638947538, 'bear_atr_max_pct': 0.1388287426722531, 'bear_tp_mult': 1.6727158230356638, 'bear_tsl_mult': 0.8643160162537311, 'bear_time_stop': 114, 'bear_use_sma': False, 'bear_use_ema': False, 'bear_use_atr': True, 'bear_use_adx': False, 'bear_use_spike': True, 'bear_rsi_required': False, 'sideways_strategy': 'mean_reversion', 'sideways_bb_std_mult': 0.889996448169994, 'sideways_rsi_os': 42, 'sideways_rsi_ob': 63, 'sideways_adx_thresh': 26.7438525729403, 'sideways_atr_min_pct': 0.006199600537910556, 'sideways_atr_max_pct': 0.1181762906115782, 'sideways_tp_mult': 2.800984695682065, 'sideways_tsl_mult': 0.8866787781132229, 'sideways_time_stop': 170, 'sideways_use_sma': True, 'sideways_use_ema': True, 'sideways_use_atr': False, 'sideways_use_adx': False, 'sideways_use_spike': False, 'sideways_rsi_required': False}.
[I 2025-08-31 11:23:33,529] Trial 723 finished with values: [-0.11078667075052417, 0.11044965100432719] and parameters: {'p_sma': 38, 'p_std': 18, 'p_atr': 11, 'p_adx': 20, 'rsi_period': 36, 'ema1': 7, 'ema2': 36, 'slip_atr_k': 0.09013193154249949, 'slip_spread_k': 0.6367887237050984, 'spread_hl_frac': 0.02219031541717484, 'bb_std_mult': 1.6496286874245518, 'rsi_os': 31, 'rsi_ob': 88, 'vol_spike': 0.1532956704584185, 'adx_thresh': 33.58576446536398, 'atr_min_pct': 0.006542943119930422, 'atr_max_pct': 0.06823406264376461, 'tp_mult': 2.19613675515283, 'tsl_mult': 0.09296920451733348, 'strategy': 'breakout', 'time_stop': 83, 'use_sma': True, 'use_atr': True, 'use_adx': False, 'use_ema': True, 'use_spike': False, 'rsi_required': False, 'edge_k': 1.9941233542304384, 'edge_cap': 0.6382078140842066, 'bull_strategy': 'mean_reversion', 'bull_bb_std_mult': 2.3115584986517614, 'bull_rsi_os': 52, 'bull_rsi_ob': 60, 'bull_adx_thresh': 27.353027513223655, 'bull_atr_min_pct': 0.007312086693808111, 'bull_atr_max_pct': 0.03007809525896448, 'bull_tp_mult': 2.9578677314634176, 'bull_tsl_mult': 0.22911998790790533, 'bull_time_stop': 38, 'bull_use_sma': False, 'bull_use_ema': True, 'bull_use_atr': False, 'bull_use_adx': False, 'bull_use_spike': False, 'bull_rsi_required': True, 'bear_strategy': 'mean_reversion', 'bear_bb_std_mult': 1.4631923530830855, 'bear_rsi_os': 54, 'bear_rsi_ob': 86, 'bear_adx_thresh': 11.72238481023449, 'bear_atr_min_pct': 0.00238433512319239, 'bear_atr_max_pct': 0.13308454754088664, 'bear_tp_mult': 1.9153730900054216, 'bear_tsl_mult': 0.3950370179556778, 'bear_time_stop': 100, 'bear_use_sma': True, 'bear_use_ema': False, 'bear_use_atr': True, 'bear_use_adx': True, 'bear_use_spike': True, 'bear_rsi_required': False, 'sideways_strategy': 'mean_reversion', 'sideways_bb_std_mult': 0.8852157879996476, 'sideways_rsi_os': 38, 'sideways_rsi_ob': 63, 'sideways_adx_thresh': 22.541377618055378, 'sideways_atr_min_pct': 0.00464256310152039, 'sideways_atr_max_pct': 0.11822168908972182, 'sideways_tp_mult': 2.7855495004389486, 'sideways_tsl_mult': 0.8238787335901611, 'sideways_time_stop': 172, 'sideways_use_sma': False, 'sideways_use_ema': True, 'sideways_use_atr': False, 'sideways_use_adx': True, 'sideways_use_spike': False, 'sideways_rsi_required': True}.
[I 2025-08-31 11:23:34,205] Trial 724 finished with values: [-1000000000.0, 1000000000.0] and parameters: {'p_sma': 27, 'p_std': 17, 'p_atr': 12, 'p_adx': 20, 'rsi_period': 74, 'ema1': 6, 'ema2': 38, 'slip_atr_k': 0.011540229205321457, 'slip_spread_k': 0.4474081851908483, 'spread_hl_frac': 0.022301657569575174, 'bb_std_mult': 0.7693653533859854, 'rsi_os': 48, 'rsi_ob': 85, 'vol_spike': 0.041765900301861725, 'adx_thresh': 24.367350186272795, 'atr_min_pct': 0.02609668413165945, 'atr_max_pct': 0.056751158235398606, 'tp_mult': 2.893013909444989, 'tsl_mult': 0.44666412839902725, 'strategy': 'breakout', 'time_stop': 86, 'use_sma': True, 'use_atr': True, 'use_adx': False, 'use_ema': True, 'use_spike': False, 'rsi_required': False, 'edge_k': 1.5677783052656726, 'edge_cap': 0.3365577343447854, 'bull_strategy': 'mean_reversion', 'bull_bb_std_mult': 1.4752677965267194, 'bull_rsi_os': 7, 'bull_rsi_ob': 60, 'bull_adx_thresh': 18.034825141576935, 'bull_atr_min_pct': 0.016233121434822233, 'bull_atr_max_pct': 0.030265646578698176, 'bull_tp_mult': 2.964989394926003, 'bull_tsl_mult': 0.2249786570980083, 'bull_time_stop': 39, 'bull_use_sma': False, 'bull_use_ema': False, 'bull_use_atr': False, 'bull_use_adx': False, 'bull_use_spike': False, 'bull_rsi_required': True, 'bear_strategy': 'mean_reversion', 'bear_bb_std_mult': 1.4512231813199157, 'bear_rsi_os': 54, 'bear_rsi_ob': 69, 'bear_adx_thresh': 11.033898467782892, 'bear_atr_min_pct': 0.02099387890476982, 'bear_atr_max_pct': 0.13229457896807953, 'bear_tp_mult': 2.735497468318329, 'bear_tsl_mult': 0.8645733565276018, 'bear_time_stop': 111, 'bear_use_sma': True, 'bear_use_ema': False, 'bear_use_atr': True, 'bear_use_adx': True, 'bear_use_spike': True, 'bear_rsi_required': False, 'sideways_strategy': 'mean_reversion', 'sideways_bb_std_mult': 0.7310557267670639, 'sideways_rsi_os': 42, 'sideways_rsi_ob': 63, 'sideways_adx_thresh': 28.383966103862793, 'sideways_atr_min_pct': 0.0066846594125451065, 'sideways_atr_max_pct': 0.10891659465615258, 'sideways_tp_mult': 1.5793803467146386, 'sideways_tsl_mult': 0.35617610192056604, 'sideways_time_stop': 170, 'sideways_use_sma': False, 'sideways_use_ema': True, 'sideways_use_atr': False, 'sideways_use_adx': True, 'sideways_use_spike': False, 'sideways_rsi_required': True}.
[I 2025-08-31 11:23:34,573] Trial 722 finished with values: [-0.14542816318387908, 0.14521601375467627] and parameters: {'p_sma': 60, 'p_std': 17, 'p_atr': 11, 'p_adx': 20, 'rsi_period': 34, 'ema1': 15, 'ema2': 36, 'slip_atr_k': 0.12619524774319357, 'slip_spread_k': 0.8459261312428532, 'spread_hl_frac': 0.039889791087126716, 'bb_std_mult': 0.7971526182556172, 'rsi_os': 5, 'rsi_ob': 57, 'vol_spike': 0.057904447641327766, 'adx_thresh': 19.156011607950674, 'atr_min_pct': 0.023222144679866805, 'atr_max_pct': 0.09953862457284576, 'tp_mult': 2.892214036885749, 'tsl_mult': 0.25003526282761956, 'strategy': 'breakout', 'time_stop': 294, 'use_sma': True, 'use_atr': True, 'use_adx': False, 'use_ema': True, 'use_spike': False, 'rsi_required': False, 'edge_k': 1.5712530937992928, 'edge_cap': 0.34061982931942614, 'bull_strategy': 'mean_reversion', 'bull_bb_std_mult': 1.4876612929185682, 'bull_rsi_os': 41, 'bull_rsi_ob': 46, 'bull_adx_thresh': 25.17632648193836, 'bull_atr_min_pct': 0.007342996685918667, 'bull_atr_max_pct': 0.023717925343421715, 'bull_tp_mult': 2.959165831023558, 'bull_tsl_mult': 0.7504297987674649, 'bull_time_stop': 182, 'bull_use_sma': False, 'bull_use_ema': True, 'bull_use_atr': False, 'bull_use_adx': False, 'bull_use_spike': False, 'bull_rsi_required': True, 'bear_strategy': 'mean_reversion', 'bear_bb_std_mult': 2.4558752144860136, 'bear_rsi_os': 54, 'bear_rsi_ob': 52, 'bear_adx_thresh': 16.70094907723957, 'bear_atr_min_pct': 0.002474404416537111, 'bear_atr_max_pct': 0.13446410056992616, 'bear_tp_mult': 1.694942234078716, 'bear_tsl_mult': 0.9997745446875891, 'bear_time_stop': 113, 'bear_use_sma': True, 'bear_use_ema': False, 'bear_use_atr': True, 'bear_use_adx': True, 'bear_use_spike': True, 'bear_rsi_required': False, 'sideways_strategy': 'mean_reversion', 'sideways_bb_std_mult': 0.9039573311413911, 'sideways_rsi_os': 38, 'sideways_rsi_ob': 62, 'sideways_adx_thresh': 28.215258653808256, 'sideways_atr_min_pct': 0.006817205599495483, 'sideways_atr_max_pct': 0.10830246406905567, 'sideways_tp_mult': 1.686507704070618, 'sideways_tsl_mult': 0.8276047191070286, 'sideways_time_stop': 173, 'sideways_use_sma': False, 'sideways_use_ema': True, 'sideways_use_atr': False, 'sideways_use_adx': True, 'sideways_use_spike': False, 'sideways_rsi_required': True}.
[I 2025-08-31 11:23:35,968] Trial 725 finished with values: [-0.09008282148557467, 0.08995444967378051] and parameters: {'p_sma': 60, 'p_std': 18, 'p_atr': 7, 'p_adx': 21, 'rsi_period': 34, 'ema1': 7, 'ema2': 36, 'slip_atr_k': 0.011850268667509049, 'slip_spread_k': 0.4493729052525126, 'spread_hl_frac': 0.02259474248567615, 'bb_std_mult': 0.7857101691875485, 'rsi_os': 15, 'rsi_ob': 53, 'vol_spike': 0.1505645916324577, 'adx_thresh': 9.83958517777747, 'atr_min_pct': 0.021433806644894027, 'atr_max_pct': 0.055601047482572934, 'tp_mult': 2.913131475931187, 'tsl_mult': 0.0776700887885216, 'strategy': 'breakout', 'time_stop': 5, 'use_sma': True, 'use_atr': True, 'use_adx': False, 'use_ema': True, 'use_spike': False, 'rsi_required': False, 'edge_k': 1.4725601627311928, 'edge_cap': 0.7329200738886015, 'bull_strategy': 'mean_reversion', 'bull_bb_std_mult': 2.079388068214463, 'bull_rsi_os': 40, 'bull_rsi_ob': 64, 'bull_adx_thresh': 18.05637151617776, 'bull_atr_min_pct': 0.022233407816678277, 'bull_atr_max_pct': 0.022990326273854222, 'bull_tp_mult': 2.9683132832496195, 'bull_tsl_mult': 0.7512066741735183, 'bull_time_stop': 38, 'bull_use_sma': False, 'bull_use_ema': False, 'bull_use_atr': False, 'bull_use_adx': False, 'bull_use_spike': False, 'bull_rsi_required': True, 'bear_strategy': 'mean_reversion', 'bear_bb_std_mult': 0.5182289467528136, 'bear_rsi_os': 53, 'bear_rsi_ob': 52, 'bear_adx_thresh': 11.763034142040942, 'bear_atr_min_pct': 0.0022893639747911115, 'bear_atr_max_pct': 0.1324603847726862, 'bear_tp_mult': 2.718504821799284, 'bear_tsl_mult': 0.3888631322520163, 'bear_time_stop': 101, 'bear_use_sma': True, 'bear_use_ema': False, 'bear_use_atr': True, 'bear_use_adx': True, 'bear_use_spike': True, 'bear_rsi_required': False, 'sideways_strategy': 'mean_reversion', 'sideways_bb_std_mult': 1.1218705637164212, 'sideways_rsi_os': 38, 'sideways_rsi_ob': 63, 'sideways_adx_thresh': 6.651264094457844, 'sideways_atr_min_pct': 0.00456753716187547, 'sideways_atr_max_pct': 0.10861883397121536, 'sideways_tp_mult': 1.6831816084461233, 'sideways_tsl_mult': 0.824353478652889, 'sideways_time_stop': 170, 'sideways_use_sma': False, 'sideways_use_ema': True, 'sideways_use_atr': False, 'sideways_use_adx': True, 'sideways_use_spike': False, 'sideways_rsi_required': True}.
[I 2025-08-31 11:24:10,126] Trial 727 finished with values: [-0.02180134516304766, 0.022209592785631456] and parameters: {'p_sma': 60, 'p_std': 12, 'p_atr': 29, 'p_adx': 21, 'rsi_period': 34, 'ema1': 5, 'ema2': 25, 'slip_atr_k': 0.019523880163618876, 'slip_spread_k': 0.8519803919868264, 'spread_hl_frac': 0.020793197655174817, 'bb_std_mult': 0.6405685293148156, 'rsi_os': 32, 'rsi_ob': 83, 'vol_spike': 0.06088271098908501, 'adx_thresh': 18.893877604113296, 'atr_min_pct': 0.024773506330979557, 'atr_max_pct': 0.06118291397926943, 'tp_mult': 2.9179537801878226, 'tsl_mult': 0.823260516093468, 'strategy': 'breakout', 'time_stop': 300, 'use_sma': True, 'use_atr': True, 'use_adx': False, 'use_ema': True, 'use_spike': False, 'rsi_required': False, 'edge_k': 1.4585585501375604, 'edge_cap': 0.5015279260514158, 'bull_strategy': 'mean_reversion', 'bull_bb_std_mult': 2.6615150823113396, 'bull_rsi_os': 40, 'bull_rsi_ob': 89, 'bull_adx_thresh': 25.316150387976233, 'bull_atr_min_pct': 0.013435313218024061, 'bull_atr_max_pct': 0.02313859446979652, 'bull_tp_mult': 1.5921909146511857, 'bull_tsl_mult': 0.7369261644062998, 'bull_time_stop': 47, 'bull_use_sma': False, 'bull_use_ema': True, 'bull_use_atr': False, 'bull_use_adx': True, 'bull_use_spike': False, 'bull_rsi_required': False, 'bear_strategy': 'mean_reversion', 'bear_bb_std_mult': 1.6615772588828153, 'bear_rsi_os': 51, 'bear_rsi_ob': 52, 'bear_adx_thresh': 29.541025435438996, 'bear_atr_min_pct': 0.0032807284786461007, 'bear_atr_max_pct': 0.02570091118103008, 'bear_tp_mult': 2.7102916280538194, 'bear_tsl_mult': 0.2540656365446295, 'bear_time_stop': 101, 'bear_use_sma': False, 'bear_use_ema': False, 'bear_use_atr': True, 'bear_use_adx': False, 'bear_use_spike': True, 'bear_rsi_required': False, 'sideways_strategy': 'mean_reversion', 'sideways_bb_std_mult': 1.096551414089212, 'sideways_rsi_os': 41, 'sideways_rsi_ob': 60, 'sideways_adx_thresh': 25.570516757911694, 'sideways_atr_min_pct': 0.014555269176406349, 'sideways_atr_max_pct': 0.1056753562433631, 'sideways_tp_mult': 1.5048220441551092, 'sideways_tsl_mult': 0.9275652779985222, 'sideways_time_stop': 164, 'sideways_use_sma': True, 'sideways_use_ema': True, 'sideways_use_atr': False, 'sideways_use_adx': False, 'sideways_use_spike': True, 'sideways_rsi_required': False}.
[I 2025-08-31 11:24:10,570] Trial 729 finished with values: [-1000000000.0, 1000000000.0] and parameters: {'p_sma': 12, 'p_std': 8, 'p_atr': 30, 'p_adx': 14, 'rsi_period': 36, 'ema1': 5, 'ema2': 25, 'slip_atr_k': 0.10944899482350809, 'slip_spread_k': 0.46837684607913216, 'spread_hl_frac': 0.020820309950936804, 'bb_std_mult': 2.9980671537995156, 'rsi_os': 33, 'rsi_ob': 83, 'vol_spike': 0.03039356509088048, 'adx_thresh': 10.406841923754806, 'atr_min_pct': 0.010950328829497803, 'atr_max_pct': 0.0851172089079311, 'tp_mult': 2.4209666444958033, 'tsl_mult': 0.8216699333663481, 'strategy': 'breakout', 'time_stop': 73, 'use_sma': True, 'use_atr': True, 'use_adx': False, 'use_ema': True, 'use_spike': False, 'rsi_required': False, 'edge_k': 1.4546283759250276, 'edge_cap': 0.4990147614229201, 'bull_strategy': 'mean_reversion', 'bull_bb_std_mult': 2.3850041124570365, 'bull_rsi_os': 39, 'bull_rsi_ob': 62, 'bull_adx_thresh': 26.304170047213862, 'bull_atr_min_pct': 0.013448512542447714, 'bull_atr_max_pct': 0.0402983966284804, 'bull_tp_mult': 2.827804615222664, 'bull_tsl_mult': 0.8483797084466234, 'bull_time_stop': 263, 'bull_use_sma': False, 'bull_use_ema': True, 'bull_use_atr': False, 'bull_use_adx': True, 'bull_use_spike': False, 'bull_rsi_required': False, 'bear_strategy': 'mean_reversion', 'bear_bb_std_mult': 1.6604129512902588, 'bear_rsi_os': 51, 'bear_rsi_ob': 77, 'bear_adx_thresh': 29.704020675051865, 'bear_atr_min_pct': 0.005347008632812358, 'bear_atr_max_pct': 0.05020132600371447, 'bear_tp_mult': 2.7001889131070556, 'bear_tsl_mult': 0.9099213749744997, 'bear_time_stop': 224, 'bear_use_sma': False, 'bear_use_ema': False, 'bear_use_atr': True, 'bear_use_adx': False, 'bear_use_spike': True, 'bear_rsi_required': False, 'sideways_strategy': 'mean_reversion', 'sideways_bb_std_mult': 1.0582954580985249, 'sideways_rsi_os': 41, 'sideways_rsi_ob': 60, 'sideways_adx_thresh': 25.38618840614038, 'sideways_atr_min_pct': 0.005424008753731924, 'sideways_atr_max_pct': 0.10493722499280457, 'sideways_tp_mult': 1.504476259380822, 'sideways_tsl_mult': 0.21527803666423811, 'sideways_time_stop': 163, 'sideways_use_sma': True, 'sideways_use_ema': True, 'sideways_use_atr': False, 'sideways_use_adx': False, 'sideways_use_spike': True, 'sideways_rsi_required': False}.
[I 2025-08-31 11:24:10,850] Trial 728 finished with values: [-0.06664921947777547, 0.06653625301775697] and parameters: {'p_sma': 14, 'p_std': 8, 'p_atr': 29, 'p_adx': 21, 'rsi_period': 36, 'ema1': 5, 'ema2': 42, 'slip_atr_k': 0.017137844745714906, 'slip_spread_k': 0.46237164519212487, 'spread_hl_frac': 0.0236308155897167, 'bb_std_mult': 0.6401541747265802, 'rsi_os': 20, 'rsi_ob': 83, 'vol_spike': 0.016210602193530863, 'adx_thresh': 10.549667032309396, 'atr_min_pct': 0.021441020042090014, 'atr_max_pct': 0.054290449169091086, 'tp_mult': 2.9148900014988395, 'tsl_mult': 0.22897701275457272, 'strategy': 'breakout', 'time_stop': 73, 'use_sma': True, 'use_atr': True, 'use_adx': False, 'use_ema': True, 'use_spike': False, 'rsi_required': False, 'edge_k': 1.4658800710131121, 'edge_cap': 0.4416757287026843, 'bull_strategy': 'mean_reversion', 'bull_bb_std_mult': 2.105185044919563, 'bull_rsi_os': 41, 'bull_rsi_ob': 64, 'bull_adx_thresh': 26.182697088504874, 'bull_atr_min_pct': 0.02233671462226631, 'bull_atr_max_pct': 0.040232181592605595, 'bull_tp_mult': 2.822347714188323, 'bull_tsl_mult': 0.24824026789005996, 'bull_time_stop': 46, 'bull_use_sma': False, 'bull_use_ema': False, 'bull_use_atr': False, 'bull_use_adx': True, 'bull_use_spike': False, 'bull_rsi_required': False, 'bear_strategy': 'mean_reversion', 'bear_bb_std_mult': 1.653325015639037, 'bear_rsi_os': 51, 'bear_rsi_ob': 88, 'bear_adx_thresh': 25.991863657093447, 'bear_atr_min_pct': 0.0008957700163393228, 'bear_atr_max_pct': 0.0541202708454076, 'bear_tp_mult': 2.7164794955584566, 'bear_tsl_mult': 0.8972172211853024, 'bear_time_stop': 104, 'bear_use_sma': False, 'bear_use_ema': False, 'bear_use_atr': True, 'bear_use_adx': False, 'bear_use_spike': True, 'bear_rsi_required': False, 'sideways_strategy': 'mean_reversion', 'sideways_bb_std_mult': 1.132993168279297, 'sideways_rsi_os': 41, 'sideways_rsi_ob': 62, 'sideways_adx_thresh': 25.399883790435183, 'sideways_atr_min_pct': 0.005662391756030402, 'sideways_atr_max_pct': 0.10537924299063732, 'sideways_tp_mult': 1.5031477491052776, 'sideways_tsl_mult': 0.598093702379412, 'sideways_time_stop': 154, 'sideways_use_sma': True, 'sideways_use_ema': True, 'sideways_use_atr': False, 'sideways_use_adx': False, 'sideways_use_spike': True, 'sideways_rsi_required': False}.
