[I 2025-08-31 11:44:18,918] Trial 861 finished with values: [-0.17093348774972605, 0.17049563983360305] and parameters: {'p_sma': 34, 'p_std': 16, 'p_atr': 27, 'p_adx': 21, 'rsi_period': 32, 'ema1': 5, 'ema2': 20, 'slip_atr_k': 0.17106248779463779, 'slip_spread_k': 0.8125750129764424, 'spread_hl_frac': 0.032729781577670834, 'bb_std_mult': 1.9380288350094572, 'rsi_os': 31, 'rsi_ob': 88, 'vol_spike': 0.12016148896561706, 'adx_thresh': 10.745952351845942, 'atr_min_pct': 0.027044833088157652, 'atr_max_pct': 0.07878011790366767, 'tp_mult': 2.9307664129785427, 'tsl_mult': 0.12043376135117599, 'strategy': 'breakout', 'time_stop': 296, 'use_sma': False, 'use_atr': True, 'use_adx': False, 'use_ema': False, 'use_spike': False, 'rsi_required': False, 'edge_k': 1.4335957562346642, 'edge_cap': 0.7158615293326815, 'bull_strategy': 'mean_reversion', 'bull_bb_std_mult': 2.127246931558099, 'bull_rsi_os': 25, 'bull_rsi_ob': 61, 'bull_adx_thresh': 6.5207880325813985, 'bull_atr_min_pct': 0.008978546640012098, 'bull_atr_max_pct': 0.027841491102982785, 'bull_tp_mult': 1.8848941187512542, 'bull_tsl_mult': 0.6639238153633751, 'bull_time_stop': 142, 'bull_use_sma': False, 'bull_use_ema': True, 'bull_use_atr': False, 'bull_use_adx': True, 'bull_use_spike': False, 'bull_rsi_required': False, 'bear_strategy': 'mean_reversion', 'bear_bb_std_mult': 1.219999291215664, 'bear_rsi_os': 52, 'bear_rsi_ob': 53, 'bear_adx_thresh': 19.013722087441963, 'bear_atr_min_pct': 1.596193611365978e-05, 'bear_atr_max_pct': 0.13252230105022295, 'bear_tp_mult': 2.7540079588330655, 'bear_tsl_mult': 0.7392839257316051, 'bear_time_stop': 140, 'bear_use_sma': False, 'bear_use_ema': False, 'bear_use_atr': True, 'bear_use_adx': False, 'bear_use_spike': True, 'bear_rsi_required': True, 'sideways_strategy': 'mean_reversion', 'sideways_bb_std_mult': 0.5978127157518316, 'sideways_rsi_os': 11, 'sideways_rsi_ob': 93, 'sideways_adx_thresh': 34.528516145135924, 'sideways_atr_min_pct': 0.02928582347933928, 'sideways_atr_max_pct': 0.11939784520129854, 'sideways_tp_mult': 2.178805426427829, 'sideways_tsl_mult': 0.8838602851210332, 'sideways_time_stop': 162, 'sideways_use_sma': True, 'sideways_use_ema': True, 'sideways_use_atr': False, 'sideways_use_adx': False, 'sideways_use_spike': True, 'sideways_rsi_required': False}.
[I 2025-08-31 11:44:55,067] Trial 868 finished with values: [-0.00911300784638025, 0.008960278230968411] and parameters: {'p_sma': 37, 'p_std': 20, 'p_atr': 28, 'p_adx': 20, 'rsi_period': 77, 'ema1': 15, 'ema2': 19, 'slip_atr_k': 0.019431516937595737, 'slip_spread_k': 0.35869212333218004, 'spread_hl_frac': 0.013330766473329985, 'bb_std_mult': 2.0694485194901615, 'rsi_os': 30, 'rsi_ob': 92, 'vol_spike': 0.013093426625147814, 'adx_thresh': 10.243458546445924, 'atr_min_pct': 0.005338650365835812, 'atr_max_pct': 0.07656411676180364, 'tp_mult': 1.0774241238036921, 'tsl_mult': 0.18416053093310453, 'strategy': 'breakout', 'time_stop': 87, 'use_sma': True, 'use_atr': False, 'use_adx': False, 'use_ema': True, 'use_spike': True, 'rsi_required': False, 'edge_k': 0.7553490534167784, 'edge_cap': 0.6756050197304941, 'bull_strategy': 'mean_reversion', 'bull_bb_std_mult': 2.2015376353201117, 'bull_rsi_os': 29, 'bull_rsi_ob': 49, 'bull_adx_thresh': 5.458839229455684, 'bull_atr_min_pct': 0.013939991428464188, 'bull_atr_max_pct': 0.030752968290858364, 'bull_tp_mult': 1.3823568108788609, 'bull_tsl_mult': 0.2122740660089449, 'bull_time_stop': 66, 'bull_use_sma': True, 'bull_use_ema': False, 'bull_use_atr': True, 'bull_use_adx': True, 'bull_use_spike': True, 'bull_rsi_required': False, 'bear_strategy': 'breakout', 'bear_bb_std_mult': 1.4344138041881924, 'bear_rsi_os': 50, 'bear_rsi_ob': 51, 'bear_adx_thresh': 9.847177120978287, 'bear_atr_min_pct': 0.009495649143725611, 'bear_atr_max_pct': 0.04102661333866082, 'bear_tp_mult': 1.2465703763696725, 'bear_tsl_mult': 0.9212939435148405, 'bear_time_stop': 121, 'bear_use_sma': False, 'bear_use_ema': False, 'bear_use_atr': False, 'bear_use_adx': False, 'bear_use_spike': True, 'bear_rsi_required': False, 'sideways_strategy': 'mean_reversion', 'sideways_bb_std_mult': 0.5526310127547427, 'sideways_rsi_os': 45, 'sideways_rsi_ob': 64, 'sideways_adx_thresh': 27.36236363984804, 'sideways_atr_min_pct': 0.0035253422152066345, 'sideways_atr_max_pct': 0.037608586851203496, 'sideways_tp_mult': 2.5246048634724048, 'sideways_tsl_mult': 0.8614057102279172, 'sideways_time_stop': 168, 'sideways_use_sma': True, 'sideways_use_ema': False, 'sideways_use_atr': False, 'sideways_use_adx': False, 'sideways_use_spike': True, 'sideways_rsi_required': False}.
[I 2025-08-31 11:44:55,206] Trial 867 finished with values: [-1000000000.0, 1000000000.0] and parameters: {'p_sma': 33, 'p_std': 11, 'p_atr': 19, 'p_adx': 21, 'rsi_period': 37, 'ema1': 15, 'ema2': 15, 'slip_atr_k': 0.018909624628719063, 'slip_spread_k': 0.3681357317015489, 'spread_hl_frac': 0.04426688220900213, 'bb_std_mult': 0.5489471158244869, 'rsi_os': 32, 'rsi_ob': 79, 'vol_spike': 0.14551937548990998, 'adx_thresh': 10.209060642763697, 'atr_min_pct': 0.021918584197235705, 'atr_max_pct': 0.0740327885442992, 'tp_mult': 2.830742744164637, 'tsl_mult': 0.05099726269620286, 'strategy': 'breakout', 'time_stop': 88, 'use_sma': True, 'use_atr': False, 'use_adx': False, 'use_ema': True, 'use_spike': False, 'rsi_required': False, 'edge_k': 1.4999377498445101, 'edge_cap': 0.5481080876516835, 'bull_strategy': 'mean_reversion', 'bull_bb_std_mult': 2.182654464246932, 'bull_rsi_os': 29, 'bull_rsi_ob': 59, 'bull_adx_thresh': 6.393111292615416, 'bull_atr_min_pct': 0.014992491489656999, 'bull_atr_max_pct': 0.13663994339497967, 'bull_tp_mult': 2.943067412980653, 'bull_tsl_mult': 0.20535637411905644, 'bull_time_stop': 66, 'bull_use_sma': False, 'bull_use_ema': False, 'bull_use_atr': True, 'bull_use_adx': True, 'bull_use_spike': False, 'bull_rsi_required': False, 'bear_strategy': 'breakout', 'bear_bb_std_mult': 1.4211317752860229, 'bear_rsi_os': 39, 'bear_rsi_ob': 91, 'bear_adx_thresh': 18.845368994428284, 'bear_atr_min_pct': 0.009488850057470768, 'bear_atr_max_pct': 0.08530001360617992, 'bear_tp_mult': 2.7226261550151256, 'bear_tsl_mult': 0.9244102037171266, 'bear_time_stop': 123, 'bear_use_sma': False, 'bear_use_ema': False, 'bear_use_atr': False, 'bear_use_adx': False, 'bear_use_spike': True, 'bear_rsi_required': False, 'sideways_strategy': 'mean_reversion', 'sideways_bb_std_mult': 0.6365784681319151, 'sideways_rsi_os': 54, 'sideways_rsi_ob': 61, 'sideways_adx_thresh': 29.026025735747993, 'sideways_atr_min_pct': 0.010386075239856768, 'sideways_atr_max_pct': 0.10524896053243432, 'sideways_tp_mult': 2.3530978953464183, 'sideways_tsl_mult': 0.8312856270106147, 'sideways_time_stop': 170, 'sideways_use_sma': True, 'sideways_use_ema': False, 'sideways_use_atr': False, 'sideways_use_adx': False, 'sideways_use_spike': True, 'sideways_rsi_required': False}.
[I 2025-08-31 11:44:55,504] Trial 866 finished with values: [-1000000000.0, 1000000000.0] and parameters: {'p_sma': 34, 'p_std': 11, 'p_atr': 28, 'p_adx': 21, 'rsi_period': 77, 'ema1': 5, 'ema2': 21, 'slip_atr_k': 0.01877907178133917, 'slip_spread_k': 0.4558305803339856, 'spread_hl_frac': 0.022499599531247725, 'bb_std_mult': 0.7244482154658853, 'rsi_os': 32, 'rsi_ob': 79, 'vol_spike': 0.12518082932458016, 'adx_thresh': 12.507753975579437, 'atr_min_pct': 0.014524129977684055, 'atr_max_pct': 0.07287083699615872, 'tp_mult': 2.4759493403083495, 'tsl_mult': 0.9916901413801218, 'strategy': 'breakout', 'time_stop': 81, 'use_sma': True, 'use_atr': True, 'use_adx': False, 'use_ema': True, 'use_spike': False, 'rsi_required': False, 'edge_k': 1.3860105422432718, 'edge_cap': 0.6730805146009484, 'bull_strategy': 'mean_reversion', 'bull_bb_std_mult': 2.206415753071359, 'bull_rsi_os': 28, 'bull_rsi_ob': 85, 'bull_adx_thresh': 26.158750255287508, 'bull_atr_min_pct': 0.025821658896901023, 'bull_atr_max_pct': 0.03242323442673369, 'bull_tp_mult': 2.9237245208041345, 'bull_tsl_mult': 0.6656542239779057, 'bull_time_stop': 66, 'bull_use_sma': False, 'bull_use_ema': False, 'bull_use_atr': False, 'bull_use_adx': True, 'bull_use_spike': False, 'bull_rsi_required': False, 'bear_strategy': 'mean_reversion', 'bear_bb_std_mult': 1.4089660488176994, 'bear_rsi_os': 51, 'bear_rsi_ob': 70, 'bear_adx_thresh': 22.243680893809792, 'bear_atr_min_pct': 0.010987050001261534, 'bear_atr_max_pct': 0.1376797189143983, 'bear_tp_mult': 2.726462725601235, 'bear_tsl_mult': 0.9202932748403322, 'bear_time_stop': 124, 'bear_use_sma': False, 'bear_use_ema': False, 'bear_use_atr': False, 'bear_use_adx': False, 'bear_use_spike': True, 'bear_rsi_required': False, 'sideways_strategy': 'mean_reversion', 'sideways_bb_std_mult': 0.6653402291695658, 'sideways_rsi_os': 54, 'sideways_rsi_ob': 64, 'sideways_adx_thresh': 19.524681786431902, 'sideways_atr_min_pct': 0.0037377144599650292, 'sideways_atr_max_pct': 0.10503360431515947, 'sideways_tp_mult': 2.1695666293153084, 'sideways_tsl_mult': 0.831373360558604, 'sideways_time_stop': 167, 'sideways_use_sma': True, 'sideways_use_ema': True, 'sideways_use_atr': False, 'sideways_use_adx': False, 'sideways_use_spike': True, 'sideways_rsi_required': False}.
[I 2025-08-31 11:44:55,761] Trial 865 finished with values: [-1000000000.0, 1000000000.0] and parameters: {'p_sma': 33, 'p_std': 51, 'p_atr': 28, 'p_adx': 21, 'rsi_period': 37, 'ema1': 5, 'ema2': 20, 'slip_atr_k': 0.023712122078501853, 'slip_spread_k': 0.5208275162655669, 'spread_hl_frac': 0.01323742031505279, 'bb_std_mult': 0.617336606106804, 'rsi_os': 31, 'rsi_ob': 88, 'vol_spike': 0.1189986314836109, 'adx_thresh': 6.511645939937862, 'atr_min_pct': 0.0219648719679127, 'atr_max_pct': 0.0723400681238722, 'tp_mult': 2.96512295121865, 'tsl_mult': 0.5783364665152099, 'strategy': 'breakout', 'time_stop': 74, 'use_sma': False, 'use_atr': True, 'use_adx': False, 'use_ema': False, 'use_spike': False, 'rsi_required': False, 'edge_k': 0.7506263445321423, 'edge_cap': 0.7162764427296324, 'bull_strategy': 'mean_reversion', 'bull_bb_std_mult': 2.1316576134869893, 'bull_rsi_os': 6, 'bull_rsi_ob': 86, 'bull_adx_thresh': 25.88286920217875, 'bull_atr_min_pct': 0.01390698817538427, 'bull_atr_max_pct': 0.1193613679339354, 'bull_tp_mult': 2.9270374102903567, 'bull_tsl_mult': 0.38573465786308925, 'bull_time_stop': 67, 'bull_use_sma': False, 'bull_use_ema': True, 'bull_use_atr': False, 'bull_use_adx': True, 'bull_use_spike': False, 'bull_rsi_required': False, 'bear_strategy': 'mean_reversion', 'bear_bb_std_mult': 1.4584319933730818, 'bear_rsi_os': 50, 'bear_rsi_ob': 54, 'bear_adx_thresh': 26.00500140908209, 'bear_atr_min_pct': 0.0066536963093728994, 'bear_atr_max_pct': 0.01607380300352268, 'bear_tp_mult': 1.2440921118636756, 'bear_tsl_mult': 0.9296695188329089, 'bear_time_stop': 265, 'bear_use_sma': False, 'bear_use_ema': False, 'bear_use_atr': True, 'bear_use_adx': False, 'bear_use_spike': True, 'bear_rsi_required': True, 'sideways_strategy': 'mean_reversion', 'sideways_bb_std_mult': 0.6269753013480337, 'sideways_rsi_os': 41, 'sideways_rsi_ob': 60, 'sideways_adx_thresh': 28.76107595705542, 'sideways_atr_min_pct': 0.006743186929268426, 'sideways_atr_max_pct': 0.10463818057855748, 'sideways_tp_mult': 1.658029777785594, 'sideways_tsl_mult': 0.5486175847507013, 'sideways_time_stop': 167, 'sideways_use_sma': True, 'sideways_use_ema': True, 'sideways_use_atr': False, 'sideways_use_adx': False, 'sideways_use_spike': True, 'sideways_rsi_required': False}.
[I 2025-08-31 11:45:32,250] Trial 872 finished with values: [-1000000000.0, 1000000000.0] and parameters: {'p_sma': 35, 'p_std': 30, 'p_atr': 29, 'p_adx': 15, 'rsi_period': 55, 'ema1': 6, 'ema2': 23, 'slip_atr_k': 0.19936470551387325, 'slip_spread_k': 0.4147980336507331, 'spread_hl_frac': 0.04707025472661301, 'bb_std_mult': 2.836535822157927, 'rsi_os': 30, 'rsi_ob': 78, 'vol_spike': 0.1929830895195752, 'adx_thresh': 29.207179898877506, 'atr_min_pct': 0.0036726609796124497, 'atr_max_pct': 0.048065465649399584, 'tp_mult': 2.9997155193952447, 'tsl_mult': 0.09287608140633041, 'strategy': 'mean_reversion', 'time_stop': 209, 'use_sma': True, 'use_atr': True, 'use_adx': False, 'use_ema': True, 'use_spike': True, 'rsi_required': False, 'edge_k': 0.858877292975652, 'edge_cap': 0.7422036679830716, 'bull_strategy': 'breakout', 'bull_bb_std_mult': 2.040190777504078, 'bull_rsi_os': 8, 'bull_rsi_ob': 64, 'bull_adx_thresh': 28.312592045593846, 'bull_atr_min_pct': 0.015831353439554517, 'bull_atr_max_pct': 0.1466714695188707, 'bull_tp_mult': 2.9967034596387214, 'bull_tsl_mult': 0.26572788219609095, 'bull_time_stop': 159, 'bull_use_sma': True, 'bull_use_ema': True, 'bull_use_atr': False, 'bull_use_adx': False, 'bull_use_spike': True, 'bull_rsi_required': True, 'bear_strategy': 'mean_reversion', 'bear_bb_std_mult': 1.5827643061089272, 'bear_rsi_os': 33, 'bear_rsi_ob': 55, 'bear_adx_thresh': 11.795812725063989, 'bear_atr_min_pct': 0.01433983154635514, 'bear_atr_max_pct': 0.14083350525270882, 'bear_tp_mult': 2.689474958499697, 'bear_tsl_mult': 0.8665010774003931, 'bear_time_stop': 108, 'bear_use_sma': True, 'bear_use_ema': True, 'bear_use_atr': True, 'bear_use_adx': True, 'bear_use_spike': True, 'bear_rsi_required': False, 'sideways_strategy': 'mean_reversion', 'sideways_bb_std_mult': 1.309515375752481, 'sideways_rsi_os': 5, 'sideways_rsi_ob': 62, 'sideways_adx_thresh': 26.3075934463433, 'sideways_atr_min_pct': 0.007556624609189391, 'sideways_atr_max_pct': 0.09931799048978673, 'sideways_tp_mult': 1.6001128133223526, 'sideways_tsl_mult': 0.5897861477969485, 'sideways_time_stop': 177, 'sideways_use_sma': True, 'sideways_use_ema': True, 'sideways_use_atr': False, 'sideways_use_adx': True, 'sideways_use_spike': False, 'sideways_rsi_required': True}.
[I 2025-08-31 11:45:32,285] Trial 869 finished with values: [-1000000000.0, 1000000000.0] and parameters: {'p_sma': 35, 'p_std': 8, 'p_atr': 28, 'p_adx': 19, 'rsi_period': 37, 'ema1': 17, 'ema2': 23, 'slip_atr_k': 0.22552297002850108, 'slip_spread_k': 0.4631935194432144, 'spread_hl_frac': 0.011579721105445435, 'bb_std_mult': 3.410452141515785, 'rsi_os': 32, 'rsi_ob': 79, 'vol_spike': 0.11460433084033055, 'adx_thresh': 11.090399722684579, 'atr_min_pct': 0.014758521929877989, 'atr_max_pct': 0.07404589014293651, 'tp_mult': 2.998405980778505, 'tsl_mult': 0.3248660866857811, 'strategy': 'mean_reversion', 'time_stop': 81, 'use_sma': True, 'use_atr': True, 'use_adx': False, 'use_ema': True, 'use_spike': False, 'rsi_required': False, 'edge_k': 1.6346835523020933, 'edge_cap': 0.741314035386785, 'bull_strategy': 'breakout', 'bull_bb_std_mult': 2.090506282974828, 'bull_rsi_os': 16, 'bull_rsi_ob': 63, 'bull_adx_thresh': 26.831947252439893, 'bull_atr_min_pct': 0.012014264540102152, 'bull_atr_max_pct': 0.03912053655179869, 'bull_tp_mult': 2.919091963109124, 'bull_tsl_mult': 0.2765104202581841, 'bull_time_stop': 36, 'bull_use_sma': False, 'bull_use_ema': True, 'bull_use_atr': False, 'bull_use_adx': True, 'bull_use_spike': False, 'bull_rsi_required': False, 'bear_strategy': 'mean_reversion', 'bear_bb_std_mult': 1.6078826787895253, 'bear_rsi_os': 14, 'bear_rsi_ob': 70, 'bear_adx_thresh': 11.821435368029524, 'bear_atr_min_pct': 0.015373466952301414, 'bear_atr_max_pct': 0.016073342783300956, 'bear_tp_mult': 2.680182999031786, 'bear_tsl_mult': 0.8728202714836903, 'bear_time_stop': 110, 'bear_use_sma': True, 'bear_use_ema': False, 'bear_use_atr': True, 'bear_use_adx': False, 'bear_use_spike': True, 'bear_rsi_required': False, 'sideways_strategy': 'mean_reversion', 'sideways_bb_std_mult': 1.3807347749200392, 'sideways_rsi_os': 39, 'sideways_rsi_ob': 59, 'sideways_adx_thresh': 23.47177083722274, 'sideways_atr_min_pct': 0.006676442381424657, 'sideways_atr_max_pct': 0.1047448752363754, 'sideways_tp_mult': 1.437645203086443, 'sideways_tsl_mult': 0.5441227326431157, 'sideways_time_stop': 177, 'sideways_use_sma': True, 'sideways_use_ema': True, 'sideways_use_atr': False, 'sideways_use_adx': True, 'sideways_use_spike': True, 'sideways_rsi_required': False}.
[I 2025-08-31 11:45:32,553] Trial 870 finished with values: [-1000000000.0, 1000000000.0] and parameters: {'p_sma': 35, 'p_std': 30, 'p_atr': 28, 'p_adx': 19, 'rsi_period': 37, 'ema1': 6, 'ema2': 23, 'slip_atr_k': 0.010446446884641913, 'slip_spread_k': 0.4551515319513272, 'spread_hl_frac': 0.023323246760879348, 'bb_std_mult': 0.722802030906532, 'rsi_os': 32, 'rsi_ob': 79, 'vol_spike': 0.11146868374942083, 'adx_thresh': 12.413212710129464, 'atr_min_pct': 0.022469204729403693, 'atr_max_pct': 0.0899642740366965, 'tp_mult': 2.9982537420981585, 'tsl_mult': 0.0896562459855662, 'strategy': 'mean_reversion', 'time_stop': 222, 'use_sma': True, 'use_atr': True, 'use_adx': False, 'use_ema': True, 'use_spike': False, 'rsi_required': False, 'edge_k': 1.5232399150507574, 'edge_cap': 0.7370816198521951, 'bull_strategy': 'breakout', 'bull_bb_std_mult': 2.053498104157161, 'bull_rsi_os': 40, 'bull_rsi_ob': 63, 'bull_adx_thresh': 28.20864640661317, 'bull_atr_min_pct': 0.02583867454671118, 'bull_atr_max_pct': 0.023812365782193007, 'bull_tp_mult': 2.9110918117027964, 'bull_tsl_mult': 0.5451833401973961, 'bull_time_stop': 289, 'bull_use_sma': False, 'bull_use_ema': True, 'bull_use_atr': False, 'bull_use_adx': True, 'bull_use_spike': False, 'bull_rsi_required': False, 'bear_strategy': 'mean_reversion', 'bear_bb_std_mult': 0.5948863441179508, 'bear_rsi_os': 14, 'bear_rsi_ob': 70, 'bear_adx_thresh': 25.77030931339246, 'bear_atr_min_pct': 0.012395133419873689, 'bear_atr_max_pct': 0.13837335110530777, 'bear_tp_mult': 2.089581714642666, 'bear_tsl_mult': 0.7081202304488732, 'bear_time_stop': 265, 'bear_use_sma': True, 'bear_use_ema': False, 'bear_use_atr': True, 'bear_use_adx': False, 'bear_use_spike': True, 'bear_rsi_required': False, 'sideways_strategy': 'mean_reversion', 'sideways_bb_std_mult': 1.3139857543904676, 'sideways_rsi_os': 39, 'sideways_rsi_ob': 45, 'sideways_adx_thresh': 32.43018344432612, 'sideways_atr_min_pct': 0.015390582787280681, 'sideways_atr_max_pct': 0.10577590120061897, 'sideways_tp_mult': 1.429549137966665, 'sideways_tsl_mult': 0.8173941580085404, 'sideways_time_stop': 176, 'sideways_use_sma': True, 'sideways_use_ema': True, 'sideways_use_atr': False, 'sideways_use_adx': True, 'sideways_use_spike': True, 'sideways_rsi_required': False}.
[I 2025-08-31 11:45:32,665] Trial 871 finished with values: [-1000000000.0, 1000000000.0] and parameters: {'p_sma': 35, 'p_std': 28, 'p_atr': 29, 'p_adx': 15, 'rsi_period': 37, 'ema1': 6, 'ema2': 22, 'slip_atr_k': 0.2119814160657678, 'slip_spread_k': 0.6959740732489608, 'spread_hl_frac': 0.01956617520491756, 'bb_std_mult': 3.4637124574905087, 'rsi_os': 29, 'rsi_ob': 78, 'vol_spike': 0.11719105951579124, 'adx_thresh': 9.367007293873916, 'atr_min_pct': 0.009504645089027465, 'atr_max_pct': 0.0899394364186787, 'tp_mult': 2.9993977847568294, 'tsl_mult': 0.08351081432828816, 'strategy': 'mean_reversion', 'time_stop': 220, 'use_sma': True, 'use_atr': True, 'use_adx': False, 'use_ema': True, 'use_spike': False, 'rsi_required': False, 'edge_k': 1.6337280840806394, 'edge_cap': 0.7480152827196204, 'bull_strategy': 'breakout', 'bull_bb_std_mult': 2.0464399500590096, 'bull_rsi_os': 43, 'bull_rsi_ob': 63, 'bull_adx_thresh': 15.504302649800639, 'bull_atr_min_pct': 0.012677135872982716, 'bull_atr_max_pct': 0.039703772403234944, 'bull_tp_mult': 2.897867730884228, 'bull_tsl_mult': 0.27106813831942794, 'bull_time_stop': 37, 'bull_use_sma': False, 'bull_use_ema': True, 'bull_use_atr': False, 'bull_use_adx': False, 'bull_use_spike': True, 'bull_rsi_required': False, 'bear_strategy': 'mean_reversion', 'bear_bb_std_mult': 1.5985105376661521, 'bear_rsi_os': 14, 'bear_rsi_ob': 56, 'bear_adx_thresh': 7.005827313004952, 'bear_atr_min_pct': 0.014500482047045578, 'bear_atr_max_pct': 0.05265870659194645, 'bear_tp_mult': 2.11110963945549, 'bear_tsl_mult': 0.8129528344874968, 'bear_time_stop': 107, 'bear_use_sma': True, 'bear_use_ema': False, 'bear_use_atr': True, 'bear_use_adx': True, 'bear_use_spike': True, 'bear_rsi_required': False, 'sideways_strategy': 'mean_reversion', 'sideways_bb_std_mult': 1.4011412038611568, 'sideways_rsi_os': 5, 'sideways_rsi_ob': 45, 'sideways_adx_thresh': 26.386886097691065, 'sideways_atr_min_pct': 0.006989418193638435, 'sideways_atr_max_pct': 0.06016997176490027, 'sideways_tp_mult': 1.4335496761691287, 'sideways_tsl_mult': 0.8114562536534208, 'sideways_time_stop': 177, 'sideways_use_sma': True, 'sideways_use_ema': True, 'sideways_use_atr': False, 'sideways_use_adx': True, 'sideways_use_spike': True, 'sideways_rsi_required': True}.
