[I 2025-08-31 11:43:00,831] Trial 853 finished with values: [0.0014618616536887785, 0.004555785987631028] and parameters: {'p_sma': 36, 'p_std': 14, 'p_atr': 28, 'p_adx': 22, 'rsi_period': 49, 'ema1': 26, 'ema2': 25, 'slip_atr_k': 0.015063398695285222, 'slip_spread_k': 0.810964008910968, 'spread_hl_frac': 0.044651870832252846, 'bb_std_mult': 0.646521032375201, 'rsi_os': 32, 'rsi_ob': 87, 'vol_spike': 0.08278953955370273, 'adx_thresh': 32.46676218520431, 'atr_min_pct': 0.02296593042654699, 'atr_max_pct': 0.07621296646313769, 'tp_mult': 2.9687762598579153, 'tsl_mult': 0.11598794427775255, 'strategy': 'breakout', 'time_stop': 62, 'use_sma': True, 'use_atr': True, 'use_adx': True, 'use_ema': True, 'use_spike': False, 'rsi_required': True, 'edge_k': 0.5757525180713075, 'edge_cap': 0.7410003306508497, 'bull_strategy': 'mean_reversion', 'bull_bb_std_mult': 2.0878198613312278, 'bull_rsi_os': 42, 'bull_rsi_ob': 90, 'bull_adx_thresh': 22.847325962724202, 'bull_atr_min_pct': 0.013236992681019936, 'bull_atr_max_pct': 0.03526234946265693, 'bull_tp_mult': 2.9413408208025458, 'bull_tsl_mult': 0.20630786028998693, 'bull_time_stop': 236, 'bull_use_sma': False, 'bull_use_ema': True, 'bull_use_atr': False, 'bull_use_adx': True, 'bull_use_spike': False, 'bull_rsi_required': False, 'bear_strategy': 'mean_reversion', 'bear_bb_std_mult': 1.53277153608086, 'bear_rsi_os': 54, 'bear_rsi_ob': 57, 'bear_adx_thresh': 11.000774552135656, 'bear_atr_min_pct': 0.006031124857478787, 'bear_atr_max_pct': 0.12751511093702683, 'bear_tp_mult': 2.8787670834188694, 'bear_tsl_mult': 0.9165211242527986, 'bear_time_stop': 110, 'bear_use_sma': False, 'bear_use_ema': False, 'bear_use_atr': True, 'bear_use_adx': False, 'bear_use_spike': False, 'bear_rsi_required': False, 'sideways_strategy': 'breakout', 'sideways_bb_std_mult': 0.7536523127406556, 'sideways_rsi_os': 42, 'sideways_rsi_ob': 61, 'sideways_adx_thresh': 27.044877277294376, 'sideways_atr_min_pct': 0.01045796889701858, 'sideways_atr_max_pct': 0.1006676851628517, 'sideways_tp_mult': 2.708115820631353, 'sideways_tsl_mult': 0.8329529809123015, 'sideways_time_stop': 101, 'sideways_use_sma': False, 'sideways_use_ema': True, 'sideways_use_atr': True, 'sideways_use_adx': False, 'sideways_use_spike': True, 'sideways_rsi_required': False}.
[I 2025-08-31 11:43:01,147] Trial 854 finished with values: [-1000000000.0, 1000000000.0] and parameters: {'p_sma': 36, 'p_std': 55, 'p_atr': 28, 'p_adx': 16, 'rsi_period': 71, 'ema1': 20, 'ema2': 27, 'slip_atr_k': 0.015430361458525488, 'slip_spread_k': 0.5596910905414414, 'spread_hl_frac': 0.021720901325567726, 'bb_std_mult': 3.0076381647431587, 'rsi_os': 32, 'rsi_ob': 78, 'vol_spike': 0.16494562696564757, 'adx_thresh': 14.785648367708884, 'atr_min_pct': 0.027859134908515715, 'atr_max_pct': 0.07329407583554941, 'tp_mult': 2.8790131081936083, 'tsl_mult': 0.06854651687254198, 'strategy': 'breakout', 'time_stop': 63, 'use_sma': True, 'use_atr': True, 'use_adx': True, 'use_ema': True, 'use_spike': False, 'rsi_required': True, 'edge_k': 1.539876049958334, 'edge_cap': 0.6381504020013974, 'bull_strategy': 'mean_reversion', 'bull_bb_std_mult': 2.085867369088271, 'bull_rsi_os': 38, 'bull_rsi_ob': 62, 'bull_adx_thresh': 27.287611531415212, 'bull_atr_min_pct': 0.029670154940803148, 'bull_atr_max_pct': 0.11360167017238317, 'bull_tp_mult': 1.6353665060511309, 'bull_tsl_mult': 0.29212841159576214, 'bull_time_stop': 212, 'bull_use_sma': False, 'bull_use_ema': False, 'bull_use_atr': False, 'bull_use_adx': True, 'bull_use_spike': False, 'bull_rsi_required': False, 'bear_strategy': 'mean_reversion', 'bear_bb_std_mult': 1.5338883431088122, 'bear_rsi_os': 53, 'bear_rsi_ob': 67, 'bear_adx_thresh': 8.620234495757112, 'bear_atr_min_pct': 0.005516441432480482, 'bear_atr_max_pct': 0.1270272764913238, 'bear_tp_mult': 2.8792668329861026, 'bear_tsl_mult': 0.21411674362188304, 'bear_time_stop': 82, 'bear_use_sma': True, 'bear_use_ema': False, 'bear_use_atr': True, 'bear_use_adx': False, 'bear_use_spike': False, 'bear_rsi_required': False, 'sideways_strategy': 'breakout', 'sideways_bb_std_mult': 2.326293466956915, 'sideways_rsi_os': 48, 'sideways_rsi_ob': 61, 'sideways_adx_thresh': 26.773699048591915, 'sideways_atr_min_pct': 0.00587729015859981, 'sideways_atr_max_pct': 0.03282636411441978, 'sideways_tp_mult': 2.0401913131488083, 'sideways_tsl_mult': 0.46896196339629836, 'sideways_time_stop': 112, 'sideways_use_sma': False, 'sideways_use_ema': True, 'sideways_use_atr': True, 'sideways_use_adx': True, 'sideways_use_spike': True, 'sideways_rsi_required': False}.
[I 2025-08-31 11:43:40,285] Trial 859 finished with values: [-1000000000.0, 1000000000.0] and parameters: {'p_sma': 36, 'p_std': 15, 'p_atr': 27, 'p_adx': 30, 'rsi_period': 49, 'ema1': 6, 'ema2': 17, 'slip_atr_k': 0.016872938184610577, 'slip_spread_k': 0.7807909521086844, 'spread_hl_frac': 0.014850759511614324, 'bb_std_mult': 0.6760540524080472, 'rsi_os': 31, 'rsi_ob': 91, 'vol_spike': 0.10254409287218579, 'adx_thresh': 21.49174954802113, 'atr_min_pct': 0.02048178536562173, 'atr_max_pct': 0.02952980171615388, 'tp_mult': 2.884830377804602, 'tsl_mult': 0.08927461430410552, 'strategy': 'breakout', 'time_stop': 67, 'use_sma': True, 'use_atr': True, 'use_adx': True, 'use_ema': True, 'use_spike': False, 'rsi_required': True, 'edge_k': 0.5924779816229357, 'edge_cap': 0.6388701006529071, 'bull_strategy': 'mean_reversion', 'bull_bb_std_mult': 2.197241575555537, 'bull_rsi_os': 41, 'bull_rsi_ob': 56, 'bull_adx_thresh': 27.807144163645507, 'bull_atr_min_pct': 0.025038537806616676, 'bull_atr_max_pct': 0.11374486888108563, 'bull_tp_mult': 1.6251146619526105, 'bull_tsl_mult': 0.7285809087471742, 'bull_time_stop': 41, 'bull_use_sma': False, 'bull_use_ema': True, 'bull_use_atr': False, 'bull_use_adx': True, 'bull_use_spike': True, 'bull_rsi_required': False, 'bear_strategy': 'mean_reversion', 'bear_bb_std_mult': 1.5288857909468194, 'bear_rsi_os': 53, 'bear_rsi_ob': 57, 'bear_adx_thresh': 17.655611971881985, 'bear_atr_min_pct': 0.02069836368261149, 'bear_atr_max_pct': 0.13662609660151132, 'bear_tp_mult': 2.73002763354669, 'bear_tsl_mult': 0.8814005224631603, 'bear_time_stop': 246, 'bear_use_sma': True, 'bear_use_ema': False, 'bear_use_atr': True, 'bear_use_adx': False, 'bear_use_spike': False, 'bear_rsi_required': False, 'sideways_strategy': 'breakout', 'sideways_bb_std_mult': 1.4224247209840148, 'sideways_rsi_os': 42, 'sideways_rsi_ob': 91, 'sideways_adx_thresh': 25.851704650544697, 'sideways_atr_min_pct': 0.006073674696475601, 'sideways_atr_max_pct': 0.10149309076138985, 'sideways_tp_mult': 1.560398881031009, 'sideways_tsl_mult': 0.8019514835464121, 'sideways_time_stop': 164, 'sideways_use_sma': False, 'sideways_use_ema': True, 'sideways_use_atr': True, 'sideways_use_adx': True, 'sideways_use_spike': True, 'sideways_rsi_required': False}.
[I 2025-08-31 11:43:40,315] Trial 860 finished with values: [-1000000000.0, 1000000000.0] and parameters: {'p_sma': 36, 'p_std': 14, 'p_atr': 10, 'p_adx': 25, 'rsi_period': 49, 'ema1': 10, 'ema2': 17, 'slip_atr_k': 0.031951262065688914, 'slip_spread_k': 0.48157963059955833, 'spread_hl_frac': 0.02284981701541646, 'bb_std_mult': 1.1048637930063383, 'rsi_os': 31, 'rsi_ob': 71, 'vol_spike': 0.04090244952676288, 'adx_thresh': 22.951758382770237, 'atr_min_pct': 0.020296097849944933, 'atr_max_pct': 0.07690608650435353, 'tp_mult': 2.999823700963193, 'tsl_mult': 0.15481199471292276, 'strategy': 'breakout', 'time_stop': 234, 'use_sma': True, 'use_atr': True, 'use_adx': False, 'use_ema': True, 'use_spike': False, 'rsi_required': False, 'edge_k': 1.4891825344679104, 'edge_cap': 0.9593017444757524, 'bull_strategy': 'mean_reversion', 'bull_bb_std_mult': 2.1822739399624846, 'bull_rsi_os': 41, 'bull_rsi_ob': 91, 'bull_adx_thresh': 27.732663657270905, 'bull_atr_min_pct': 0.018421474700110005, 'bull_atr_max_pct': 0.03613377780833666, 'bull_tp_mult': 2.8840907402209552, 'bull_tsl_mult': 0.24697642758963223, 'bull_time_stop': 42, 'bull_use_sma': False, 'bull_use_ema': True, 'bull_use_atr': False, 'bull_use_adx': True, 'bull_use_spike': True, 'bull_rsi_required': False, 'bear_strategy': 'mean_reversion', 'bear_bb_std_mult': 1.3887700497631363, 'bear_rsi_os': 35, 'bear_rsi_ob': 57, 'bear_adx_thresh': 9.550520984828145, 'bear_atr_min_pct': 0.008121403361785514, 'bear_atr_max_pct': 0.14698976037177997, 'bear_tp_mult': 2.8008363677363515, 'bear_tsl_mult': 0.8846911353091492, 'bear_time_stop': 94, 'bear_use_sma': False, 'bear_use_ema': False, 'bear_use_atr': True, 'bear_use_adx': False, 'bear_use_spike': True, 'bear_rsi_required': False, 'sideways_strategy': 'mean_reversion', 'sideways_bb_std_mult': 0.625774290269165, 'sideways_rsi_os': 42, 'sideways_rsi_ob': 62, 'sideways_adx_thresh': 25.75152612743928, 'sideways_atr_min_pct': 0.02755612856907761, 'sideways_atr_max_pct': 0.10162187846312068, 'sideways_tp_mult': 2.877541036035882, 'sideways_tsl_mult': 0.42711432576936026, 'sideways_time_stop': 289, 'sideways_use_sma': True, 'sideways_use_ema': True, 'sideways_use_atr': False, 'sideways_use_adx': False, 'sideways_use_spike': True, 'sideways_rsi_required': False}.
[I 2025-08-31 11:43:40,533] Trial 858 finished with values: [-1000000000.0, 1000000000.0] and parameters: {'p_sma': 36, 'p_std': 14, 'p_atr': 27, 'p_adx': 25, 'rsi_period': 49, 'ema1': 5, 'ema2': 14, 'slip_atr_k': 0.15486726848587395, 'slip_spread_k': 0.5723694976466407, 'spread_hl_frac': 0.049922911796686564, 'bb_std_mult': 0.6752150571102166, 'rsi_os': 31, 'rsi_ob': 87, 'vol_spike': 0.1015211962497185, 'adx_thresh': 10.407644065538928, 'atr_min_pct': 4.216668242495655e-05, 'atr_max_pct': 0.020588078359168184, 'tp_mult': 2.8813076880892665, 'tsl_mult': 0.4372472930056483, 'strategy': 'breakout', 'time_stop': 293, 'use_sma': True, 'use_atr': True, 'use_adx': True, 'use_ema': True, 'use_spike': False, 'rsi_required': True, 'edge_k': 1.4760756709022946, 'edge_cap': 0.6435758811218434, 'bull_strategy': 'mean_reversion', 'bull_bb_std_mult': 2.0287804747189613, 'bull_rsi_os': 19, 'bull_rsi_ob': 91, 'bull_adx_thresh': 27.606115068771267, 'bull_atr_min_pct': 0.02506778887424831, 'bull_atr_max_pct': 0.03582177545449983, 'bull_tp_mult': 1.448182936509184, 'bull_tsl_mult': 0.24758856550486, 'bull_time_stop': 42, 'bull_use_sma': False, 'bull_use_ema': True, 'bull_use_atr': False, 'bull_use_adx': True, 'bull_use_spike': True, 'bull_rsi_required': False, 'bear_strategy': 'mean_reversion', 'bear_bb_std_mult': 1.530060053911949, 'bear_rsi_os': 53, 'bear_rsi_ob': 53, 'bear_adx_thresh': 9.176146809957592, 'bear_atr_min_pct': 0.008195564460650492, 'bear_atr_max_pct': 0.13394779816134464, 'bear_tp_mult': 2.4949516595078163, 'bear_tsl_mult': 0.8810345353222494, 'bear_time_stop': 288, 'bear_use_sma': True, 'bear_use_ema': False, 'bear_use_atr': True, 'bear_use_adx': False, 'bear_use_spike': False, 'bear_rsi_required': False, 'sideways_strategy': 'breakout', 'sideways_bb_std_mult': 1.242143535072109, 'sideways_rsi_os': 27, 'sideways_rsi_ob': 62, 'sideways_adx_thresh': 25.70917463912123, 'sideways_atr_min_pct': 0.005991163899761623, 'sideways_atr_max_pct': 0.10173481130403902, 'sideways_tp_mult': 1.5678549248220017, 'sideways_tsl_mult': 0.9381321487806606, 'sideways_time_stop': 163, 'sideways_use_sma': False, 'sideways_use_ema': True, 'sideways_use_atr': True, 'sideways_use_adx': True, 'sideways_use_spike': True, 'sideways_rsi_required': False}.
[I 2025-08-31 11:43:40,727] Trial 857 finished with values: [-1000000000.0, 1000000000.0] and parameters: {'p_sma': 36, 'p_std': 16, 'p_atr': 20, 'p_adx': 25, 'rsi_period': 32, 'ema1': 5, 'ema2': 14, 'slip_atr_k': 0.23642609165739953, 'slip_spread_k': 0.972473307704734, 'spread_hl_frac': 0.045149254193104296, 'bb_std_mult': 0.6671320905314592, 'rsi_os': 31, 'rsi_ob': 78, 'vol_spike': 0.10033154584172861, 'adx_thresh': 10.471420137686096, 'atr_min_pct': 0.026941624661803252, 'atr_max_pct': 0.08729067493532772, 'tp_mult': 2.874728925633721, 'tsl_mult': 0.06916540790382336, 'strategy': 'breakout', 'time_stop': 291, 'use_sma': True, 'use_atr': True, 'use_adx': True, 'use_ema': True, 'use_spike': False, 'rsi_required': True, 'edge_k': 1.5539431935330286, 'edge_cap': 0.9543031131197399, 'bull_strategy': 'mean_reversion', 'bull_bb_std_mult': 2.0607200944915234, 'bull_rsi_os': 38, 'bull_rsi_ob': 61, 'bull_adx_thresh': 27.118509053812488, 'bull_atr_min_pct': 0.011467069624755771, 'bull_atr_max_pct': 0.03618685945120024, 'bull_tp_mult': 1.892547950780417, 'bull_tsl_mult': 0.24380792878909963, 'bull_time_stop': 49, 'bull_use_sma': False, 'bull_use_ema': True, 'bull_use_atr': False, 'bull_use_adx': True, 'bull_use_spike': False, 'bull_rsi_required': False, 'bear_strategy': 'mean_reversion', 'bear_bb_std_mult': 1.5383335526919468, 'bear_rsi_os': 52, 'bear_rsi_ob': 57, 'bear_adx_thresh': 23.530635269588707, 'bear_atr_min_pct': 0.008216245873259928, 'bear_atr_max_pct': 0.127200965392927, 'bear_tp_mult': 2.4978102444176518, 'bear_tsl_mult': 0.8856625021270201, 'bear_time_stop': 10, 'bear_use_sma': False, 'bear_use_ema': False, 'bear_use_atr': True, 'bear_use_adx': False, 'bear_use_spike': False, 'bear_rsi_required': False, 'sideways_strategy': 'breakout', 'sideways_bb_std_mult': 1.472970384478782, 'sideways_rsi_os': 42, 'sideways_rsi_ob': 91, 'sideways_adx_thresh': 24.598197076532426, 'sideways_atr_min_pct': 0.027291622400755583, 'sideways_atr_max_pct': 0.09635353943411325, 'sideways_tp_mult': 1.5705985337586374, 'sideways_tsl_mult': 0.8486528400770358, 'sideways_time_stop': 114, 'sideways_use_sma': False, 'sideways_use_ema': True, 'sideways_use_atr': True, 'sideways_use_adx': False, 'sideways_use_spike': True, 'sideways_rsi_required': False}.
[I 2025-08-31 11:44:17,404] Trial 864 finished with values: [-0.01205803570941466, 0.011892947551054155] and parameters: {'p_sma': 34, 'p_std': 50, 'p_atr': 7, 'p_adx': 27, 'rsi_period': 30, 'ema1': 6, 'ema2': 21, 'slip_atr_k': 0.012033091601579178, 'slip_spread_k': 0.8230928978253469, 'spread_hl_frac': 0.020839355441512414, 'bb_std_mult': 1.9566545009967395, 'rsi_os': 30, 'rsi_ob': 87, 'vol_spike': 0.08370198243289446, 'adx_thresh': 12.627446651389068, 'atr_min_pct': 0.02121869451675453, 'atr_max_pct': 0.07957226881108143, 'tp_mult': 2.9286839602691055, 'tsl_mult': 0.4073239519366951, 'strategy': 'mean_reversion', 'time_stop': 101, 'use_sma': False, 'use_atr': False, 'use_adx': False, 'use_ema': False, 'use_spike': True, 'rsi_required': False, 'edge_k': 1.4388960236271935, 'edge_cap': 0.7265207805557301, 'bull_strategy': 'breakout', 'bull_bb_std_mult': 2.1338055308243455, 'bull_rsi_os': 43, 'bull_rsi_ob': 64, 'bull_adx_thresh': 29.657092303822857, 'bull_atr_min_pct': 0.011326150788888503, 'bull_atr_max_pct': 0.08483308993005535, 'bull_tp_mult': 2.860759460677775, 'bull_tsl_mult': 0.22283157541644796, 'bull_time_stop': 55, 'bull_use_sma': True, 'bull_use_ema': True, 'bull_use_atr': False, 'bull_use_adx': False, 'bull_use_spike': False, 'bull_rsi_required': True, 'bear_strategy': 'breakout', 'bear_bb_std_mult': 1.1261752510268088, 'bear_rsi_os': 51, 'bear_rsi_ob': 79, 'bear_adx_thresh': 7.8680540457775034, 'bear_atr_min_pct': 0.0007600619901340869, 'bear_atr_max_pct': 0.0982176604467294, 'bear_tp_mult': 1.7866333620827057, 'bear_tsl_mult': 0.9075705544744839, 'bear_time_stop': 90, 'bear_use_sma': False, 'bear_use_ema': True, 'bear_use_atr': True, 'bear_use_adx': True, 'bear_use_spike': True, 'bear_rsi_required': True, 'sideways_strategy': 'mean_reversion', 'sideways_bb_std_mult': 0.6931397542620983, 'sideways_rsi_os': 39, 'sideways_rsi_ob': 66, 'sideways_adx_thresh': 27.784575243894118, 'sideways_atr_min_pct': 0.004314850420567734, 'sideways_atr_max_pct': 0.1089820024749083, 'sideways_tp_mult': 2.261552491950859, 'sideways_tsl_mult': 0.8880342889397328, 'sideways_time_stop': 84, 'sideways_use_sma': True, 'sideways_use_ema': False, 'sideways_use_atr': False, 'sideways_use_adx': False, 'sideways_use_spike': False, 'sideways_rsi_required': True}.
[I 2025-08-31 11:44:17,769] Trial 863 finished with values: [-1000000000.0, 1000000000.0] and parameters: {'p_sma': 34, 'p_std': 16, 'p_atr': 27, 'p_adx': 28, 'rsi_period': 46, 'ema1': 5, 'ema2': 20, 'slip_atr_k': 0.02335063572516905, 'slip_spread_k': 0.512359820920524, 'spread_hl_frac': 0.021247794645888628, 'bb_std_mult': 0.6240431717996873, 'rsi_os': 31, 'rsi_ob': 88, 'vol_spike': 0.0941018066664827, 'adx_thresh': 6.28016270600104, 'atr_min_pct': 0.02107272779713154, 'atr_max_pct': 0.08054261404897296, 'tp_mult': 2.521161573109061, 'tsl_mult': 0.5751891503886186, 'strategy': 'mean_reversion', 'time_stop': 73, 'use_sma': False, 'use_atr': True, 'use_adx': False, 'use_ema': False, 'use_spike': False, 'rsi_required': False, 'edge_k': 1.4219914682956856, 'edge_cap': 0.7147402846451886, 'bull_strategy': 'breakout', 'bull_bb_std_mult': 2.1244654783593653, 'bull_rsi_os': 53, 'bull_rsi_ob': 61, 'bull_adx_thresh': 25.853064979367304, 'bull_atr_min_pct': 0.01021056421882989, 'bull_atr_max_pct': 0.11864598929406814, 'bull_tp_mult': 2.350615318380627, 'bull_tsl_mult': 0.5940799283853613, 'bull_time_stop': 50, 'bull_use_sma': False, 'bull_use_ema': True, 'bull_use_atr': False, 'bull_use_adx': False, 'bull_use_spike': False, 'bull_rsi_required': True, 'bear_strategy': 'mean_reversion', 'bear_bb_std_mult': 3.0121020362781894, 'bear_rsi_os': 52, 'bear_rsi_ob': 53, 'bear_adx_thresh': 11.345240817615721, 'bear_atr_min_pct': 0.006784447440537879, 'bear_atr_max_pct': 0.13198164062798057, 'bear_tp_mult': 2.758811375173545, 'bear_tsl_mult': 0.02658124828451791, 'bear_time_stop': 183, 'bear_use_sma': False, 'bear_use_ema': True, 'bear_use_atr': True, 'bear_use_adx': True, 'bear_use_spike': True, 'bear_rsi_required': True, 'sideways_strategy': 'mean_reversion', 'sideways_bb_std_mult': 0.678431010864299, 'sideways_rsi_os': 41, 'sideways_rsi_ob': 94, 'sideways_adx_thresh': 24.71086065833549, 'sideways_atr_min_pct': 0.0292215240684382, 'sideways_atr_max_pct': 0.10846494369329351, 'sideways_tp_mult': 2.6073847082073724, 'sideways_tsl_mult': 0.8891132066227538, 'sideways_time_stop': 34, 'sideways_use_sma': True, 'sideways_use_ema': True, 'sideways_use_atr': False, 'sideways_use_adx': False, 'sideways_use_spike': False, 'sideways_rsi_required': True}.
[I 2025-08-31 11:44:18,796] Trial 862 finished with values: [-0.14815524249283696, 0.14803522865170723] and parameters: {'p_sma': 34, 'p_std': 16, 'p_atr': 27, 'p_adx': 21, 'rsi_period': 33, 'ema1': 5, 'ema2': 21, 'slip_atr_k': 0.17340949477184106, 'slip_spread_k': 0.5170882718905084, 'spread_hl_frac': 0.02073598880686256, 'bb_std_mult': 0.6378181922269888, 'rsi_os': 31, 'rsi_ob': 89, 'vol_spike': 0.08151366015686541, 'adx_thresh': 24.74818561182836, 'atr_min_pct': 0.013259053420506772, 'atr_max_pct': 0.0803852208629273, 'tp_mult': 2.4655539957797057, 'tsl_mult': 0.9971342854178166, 'strategy': 'breakout', 'time_stop': 75, 'use_sma': False, 'use_atr': True, 'use_adx': False, 'use_ema': False, 'use_spike': False, 'rsi_required': False, 'edge_k': 1.3461043400345927, 'edge_cap': 0.7209311457401893, 'bull_strategy': 'mean_reversion', 'bull_bb_std_mult': 2.025813762194176, 'bull_rsi_os': 44, 'bull_rsi_ob': 68, 'bull_adx_thresh': 26.24288622829955, 'bull_atr_min_pct': 0.011297880491350472, 'bull_atr_max_pct': 0.10221486724305123, 'bull_tp_mult': 2.8654144220633815, 'bull_tsl_mult': 0.9881323923584997, 'bull_time_stop': 53, 'bull_use_sma': False, 'bull_use_ema': True, 'bull_use_atr': False, 'bull_use_adx': True, 'bull_use_spike': False, 'bull_rsi_required': False, 'bear_strategy': 'mean_reversion', 'bear_bb_std_mult': 1.471780283182717, 'bear_rsi_os': 52, 'bear_rsi_ob': 53, 'bear_adx_thresh': 24.519160864062346, 'bear_atr_min_pct': 0.0005179137793876144, 'bear_atr_max_pct': 0.13257897320344791, 'bear_tp_mult': 2.764031124863366, 'bear_tsl_mult': 0.9060116456353177, 'bear_time_stop': 10, 'bear_use_sma': False, 'bear_use_ema': False, 'bear_use_atr': True, 'bear_use_adx': False, 'bear_use_spike': True, 'bear_rsi_required': True, 'sideways_strategy': 'mean_reversion', 'sideways_bb_std_mult': 0.7188682590872721, 'sideways_rsi_os': 27, 'sideways_rsi_ob': 54, 'sideways_adx_thresh': 24.903759090448172, 'sideways_atr_min_pct': 0.004288571878822065, 'sideways_atr_max_pct': 0.11913735789370777, 'sideways_tp_mult': 1.6740774594940575, 'sideways_tsl_mult': 0.8839102552725138, 'sideways_time_stop': 162, 'sideways_use_sma': True, 'sideways_use_ema': True, 'sideways_use_atr': False, 'sideways_use_adx': False, 'sideways_use_spike': True, 'sideways_rsi_required': False}.
