[I 2025-08-31 11:12:50,341] Trial 645 finished with values: [-1000000000.0, 1000000000.0] and parameters: {'p_sma': 32, 'p_std': 14, 'p_atr': 29, 'p_adx': 21, 'rsi_period': 79, 'ema1': 5, 'ema2': 21, 'slip_atr_k': 0.24512331658150413, 'slip_spread_k': 0.4906246247901606, 'spread_hl_frac': 0.03575045550089233, 'bb_std_mult': 0.70947283662328, 'rsi_os': 49, 'rsi_ob': 84, 'vol_spike': 0.06609730628158003, 'adx_thresh': 11.177944056594999, 'atr_min_pct': 0.022365903955663683, 'atr_max_pct': 0.05766656050778173, 'tp_mult': 2.9598525801221287, 'tsl_mult': 0.14880115688147677, 'strategy': 'breakout', 'time_stop': 88, 'use_sma': True, 'use_atr': True, 'use_adx': False, 'use_ema': True, 'use_spike': False, 'rsi_required': False, 'edge_k': 1.4435388195544667, 'edge_cap': 0.6532141465389281, 'bull_strategy': 'mean_reversion', 'bull_bb_std_mult': 2.570586304945625, 'bull_rsi_os': 40, 'bull_rsi_ob': 64, 'bull_adx_thresh': 25.650983264862163, 'bull_atr_min_pct': 0.011398503963186188, 'bull_atr_max_pct': 0.038256481839162686, 'bull_tp_mult': 2.960532430969034, 'bull_tsl_mult': 0.2822233393736314, 'bull_time_stop': 192, 'bull_use_sma': False, 'bull_use_ema': True, 'bull_use_atr': False, 'bull_use_adx': False, 'bull_use_spike': False, 'bull_rsi_required': False, 'bear_strategy': 'mean_reversion', 'bear_bb_std_mult': 1.5612282978184493, 'bear_rsi_os': 51, 'bear_rsi_ob': 52, 'bear_adx_thresh': 27.20494067928592, 'bear_atr_min_pct': 0.021457512209986956, 'bear_atr_max_pct': 0.13782962746039, 'bear_tp_mult': 2.6580322902531, 'bear_tsl_mult': 0.933249857030626, 'bear_time_stop': 89, 'bear_use_sma': False, 'bear_use_ema': False, 'bear_use_atr': False, 'bear_use_adx': False, 'bear_use_spike': True, 'bear_rsi_required': False, 'sideways_strategy': 'mean_reversion', 'sideways_bb_std_mult': 0.9866421057024777, 'sideways_rsi_os': 40, 'sideways_rsi_ob': 61, 'sideways_adx_thresh': 27.496471690230642, 'sideways_atr_min_pct': 0.013760856667326633, 'sideways_atr_max_pct': 0.10805665863575893, 'sideways_tp_mult': 1.456034683917073, 'sideways_tsl_mult': 0.4322062825328906, 'sideways_time_stop': 161, 'sideways_use_sma': True, 'sideways_use_ema': True, 'sideways_use_atr': True, 'sideways_use_adx': False, 'sideways_use_spike': True, 'sideways_rsi_required': False}.
[I 2025-08-31 11:13:22,781] Trial 651 finished with values: [-1000000000.0, 1000000000.0] and parameters: {'p_sma': 38, 'p_std': 15, 'p_atr': 27, 'p_adx': 24, 'rsi_period': 32, 'ema1': 5, 'ema2': 32, 'slip_atr_k': 0.020332300584915516, 'slip_spread_k': 0.47807657062134434, 'spread_hl_frac': 0.019483159383715407, 'bb_std_mult': 0.6594206267522965, 'rsi_os': 30, 'rsi_ob': 82, 'vol_spike': 0.16317850276198162, 'adx_thresh': 11.614905035087325, 'atr_min_pct': 0.02269666634522579, 'atr_max_pct': 0.06346386054836314, 'tp_mult': 1.6674499808219079, 'tsl_mult': 0.10456206844244226, 'strategy': 'breakout', 'time_stop': 75, 'use_sma': True, 'use_atr': True, 'use_adx': False, 'use_ema': True, 'use_spike': False, 'rsi_required': False, 'edge_k': 1.5140259543517505, 'edge_cap': 0.6821527603713623, 'bull_strategy': 'mean_reversion', 'bull_bb_std_mult': 2.10792349342516, 'bull_rsi_os': 40, 'bull_rsi_ob': 61, 'bull_adx_thresh': 25.592131133182235, 'bull_atr_min_pct': 0.012960953022279778, 'bull_atr_max_pct': 0.03487566990699622, 'bull_tp_mult': 1.630932851496354, 'bull_tsl_mult': 0.2544279410472554, 'bull_time_stop': 197, 'bull_use_sma': False, 'bull_use_ema': False, 'bull_use_atr': False, 'bull_use_adx': True, 'bull_use_spike': False, 'bull_rsi_required': True, 'bear_strategy': 'mean_reversion', 'bear_bb_std_mult': 0.7055914869331357, 'bear_rsi_os': 51, 'bear_rsi_ob': 89, 'bear_adx_thresh': 10.26165631693031, 'bear_atr_min_pct': 0.00815254408284782, 'bear_atr_max_pct': 0.1328742918574528, 'bear_tp_mult': 2.19874847446865, 'bear_tsl_mult': 0.9088203050059216, 'bear_time_stop': 97, 'bear_use_sma': False, 'bear_use_ema': True, 'bear_use_atr': True, 'bear_use_adx': False, 'bear_use_spike': False, 'bear_rsi_required': False, 'sideways_strategy': 'mean_reversion', 'sideways_bb_std_mult': 1.1259706738431436, 'sideways_rsi_os': 38, 'sideways_rsi_ob': 69, 'sideways_adx_thresh': 25.490571410745563, 'sideways_atr_min_pct': 0.0057132706118745045, 'sideways_atr_max_pct': 0.10044256980087762, 'sideways_tp_mult': 1.5600507999376656, 'sideways_tsl_mult': 0.6472931586074523, 'sideways_time_stop': 147, 'sideways_use_sma': True, 'sideways_use_ema': True, 'sideways_use_atr': False, 'sideways_use_adx': False, 'sideways_use_spike': False, 'sideways_rsi_required': False}.
[I 2025-08-31 11:13:23,029] Trial 652 finished with values: [-1000000000.0, 1000000000.0] and parameters: {'p_sma': 28, 'p_std': 9, 'p_atr': 27, 'p_adx': 24, 'rsi_period': 37, 'ema1': 5, 'ema2': 28, 'slip_atr_k': 0.02159829247886615, 'slip_spread_k': 0.4524048249176654, 'spread_hl_frac': 0.01963998510350651, 'bb_std_mult': 0.6362134076648756, 'rsi_os': 30, 'rsi_ob': 83, 'vol_spike': 0.1727236423980723, 'adx_thresh': 12.516248956887464, 'atr_min_pct': 0.02288337447611354, 'atr_max_pct': 0.06592540684764613, 'tp_mult': 2.9226612678681008, 'tsl_mult': 0.11302894112676015, 'strategy': 'breakout', 'time_stop': 102, 'use_sma': True, 'use_atr': True, 'use_adx': False, 'use_ema': True, 'use_spike': False, 'rsi_required': False, 'edge_k': 1.486460476823456, 'edge_cap': 0.6807675805214816, 'bull_strategy': 'mean_reversion', 'bull_bb_std_mult': 2.223859050794191, 'bull_rsi_os': 29, 'bull_rsi_ob': 60, 'bull_adx_thresh': 27.878035769073577, 'bull_atr_min_pct': 0.01291834154069604, 'bull_atr_max_pct': 0.035154998503539536, 'bull_tp_mult': 1.9720878350260795, 'bull_tsl_mult': 0.2478613291540845, 'bull_time_stop': 282, 'bull_use_sma': False, 'bull_use_ema': False, 'bull_use_atr': False, 'bull_use_adx': True, 'bull_use_spike': False, 'bull_rsi_required': True, 'bear_strategy': 'mean_reversion', 'bear_bb_std_mult': 0.5546843051159966, 'bear_rsi_os': 55, 'bear_rsi_ob': 74, 'bear_adx_thresh': 19.447123089531537, 'bear_atr_min_pct': 0.008391681987576106, 'bear_atr_max_pct': 0.01656895716771105, 'bear_tp_mult': 2.1304002774344495, 'bear_tsl_mult': 0.8710125089529123, 'bear_time_stop': 96, 'bear_use_sma': False, 'bear_use_ema': True, 'bear_use_atr': True, 'bear_use_adx': False, 'bear_use_spike': False, 'bear_rsi_required': False, 'sideways_strategy': 'mean_reversion', 'sideways_bb_std_mult': 1.117002221933572, 'sideways_rsi_os': 38, 'sideways_rsi_ob': 62, 'sideways_adx_thresh': 26.39342430399924, 'sideways_atr_min_pct': 0.006592737096686868, 'sideways_atr_max_pct': 0.11677209381918825, 'sideways_tp_mult': 1.5701801266268753, 'sideways_tsl_mult': 0.8700065741728703, 'sideways_time_stop': 147, 'sideways_use_sma': False, 'sideways_use_ema': True, 'sideways_use_atr': False, 'sideways_use_adx': False, 'sideways_use_spike': False, 'sideways_rsi_required': False}.
[I 2025-08-31 11:13:23,140] Trial 650 finished with values: [-0.006718725194689412, 0.01016063914525874] and parameters: {'p_sma': 29, 'p_std': 14, 'p_atr': 29, 'p_adx': 21, 'rsi_period': 37, 'ema1': 5, 'ema2': 27, 'slip_atr_k': 0.01569281383883647, 'slip_spread_k': 0.4807022384460806, 'spread_hl_frac': 0.022177736573293545, 'bb_std_mult': 0.6362880122709139, 'rsi_os': 30, 'rsi_ob': 82, 'vol_spike': 0.07218954887872896, 'adx_thresh': 11.26405017458325, 'atr_min_pct': 0.02251549225920605, 'atr_max_pct': 0.06659777455732879, 'tp_mult': 2.370742861545739, 'tsl_mult': 0.08046014864225443, 'strategy': 'breakout', 'time_stop': 103, 'use_sma': True, 'use_atr': True, 'use_adx': False, 'use_ema': True, 'use_spike': False, 'rsi_required': False, 'edge_k': 1.4698963163010377, 'edge_cap': 0.6759433151469334, 'bull_strategy': 'mean_reversion', 'bull_bb_std_mult': 2.2836317698577187, 'bull_rsi_os': 40, 'bull_rsi_ob': 63, 'bull_adx_thresh': 27.81348319469661, 'bull_atr_min_pct': 0.012085074784392273, 'bull_atr_max_pct': 0.026238987731153587, 'bull_tp_mult': 2.0550612683441787, 'bull_tsl_mult': 0.2571402092776662, 'bull_time_stop': 195, 'bull_use_sma': False, 'bull_use_ema': False, 'bull_use_atr': False, 'bull_use_adx': True, 'bull_use_spike': False, 'bull_rsi_required': False, 'bear_strategy': 'mean_reversion', 'bear_bb_std_mult': 1.4834822245021586, 'bear_rsi_os': 51, 'bear_rsi_ob': 53, 'bear_adx_thresh': 10.379894535734891, 'bear_atr_min_pct': 0.0039076090364775894, 'bear_atr_max_pct': 0.13348608435514164, 'bear_tp_mult': 2.643079893865395, 'bear_tsl_mult': 0.9479933967612387, 'bear_time_stop': 96, 'bear_use_sma': False, 'bear_use_ema': False, 'bear_use_atr': True, 'bear_use_adx': False, 'bear_use_spike': True, 'bear_rsi_required': False, 'sideways_strategy': 'mean_reversion', 'sideways_bb_std_mult': 0.8840853983562245, 'sideways_rsi_os': 40, 'sideways_rsi_ob': 62, 'sideways_adx_thresh': 26.535312766528993, 'sideways_atr_min_pct': 0.005716204775424585, 'sideways_atr_max_pct': 0.09440593643614928, 'sideways_tp_mult': 1.5657234859594635, 'sideways_tsl_mult': 0.8703533673343442, 'sideways_time_stop': 173, 'sideways_use_sma': True, 'sideways_use_ema': True, 'sideways_use_atr': False, 'sideways_use_adx': False, 'sideways_use_spike': True, 'sideways_rsi_required': False}.
[I 2025-08-31 11:13:23,249] Trial 649 finished with values: [-0.07565042007064826, 0.07545338259749255] and parameters: {'p_sma': 38, 'p_std': 14, 'p_atr': 29, 'p_adx': 12, 'rsi_period': 37, 'ema1': 5, 'ema2': 22, 'slip_atr_k': 0.020619249931193878, 'slip_spread_k': 0.4916196740698938, 'spread_hl_frac': 0.021779356279559764, 'bb_std_mult': 0.7416213634007682, 'rsi_os': 13, 'rsi_ob': 82, 'vol_spike': 0.07080275431724477, 'adx_thresh': 11.444476958634361, 'atr_min_pct': 0.022593891987541356, 'atr_max_pct': 0.06536686595121954, 'tp_mult': 2.96175884734168, 'tsl_mult': 0.10963406632000634, 'strategy': 'breakout', 'time_stop': 102, 'use_sma': True, 'use_atr': True, 'use_adx': False, 'use_ema': True, 'use_spike': False, 'rsi_required': False, 'edge_k': 1.4920518616119907, 'edge_cap': 0.6771475516036225, 'bull_strategy': 'mean_reversion', 'bull_bb_std_mult': 2.2806540474677193, 'bull_rsi_os': 8, 'bull_rsi_ob': 63, 'bull_adx_thresh': 27.152760300310792, 'bull_atr_min_pct': 0.012925191178627445, 'bull_atr_max_pct': 0.03519279411062005, 'bull_tp_mult': 2.8509325062406736, 'bull_tsl_mult': 0.26244255664973887, 'bull_time_stop': 141, 'bull_use_sma': False, 'bull_use_ema': True, 'bull_use_atr': False, 'bull_use_adx': False, 'bull_use_spike': False, 'bull_rsi_required': False, 'bear_strategy': 'mean_reversion', 'bear_bb_std_mult': 1.4754795784532575, 'bear_rsi_os': 51, 'bear_rsi_ob': 53, 'bear_adx_thresh': 24.805936333880126, 'bear_atr_min_pct': 0.001976822910610166, 'bear_atr_max_pct': 0.1359420642328278, 'bear_tp_mult': 2.193219745700165, 'bear_tsl_mult': 0.9634193916367859, 'bear_time_stop': 96, 'bear_use_sma': False, 'bear_use_ema': False, 'bear_use_atr': True, 'bear_use_adx': False, 'bear_use_spike': True, 'bear_rsi_required': False, 'sideways_strategy': 'mean_reversion', 'sideways_bb_std_mult': 1.021643140357671, 'sideways_rsi_os': 41, 'sideways_rsi_ob': 62, 'sideways_adx_thresh': 27.615364483017228, 'sideways_atr_min_pct': 0.006918297779006582, 'sideways_atr_max_pct': 0.1083371049248753, 'sideways_tp_mult': 1.5241582952027362, 'sideways_tsl_mult': 0.8658791884135377, 'sideways_time_stop': 165, 'sideways_use_sma': True, 'sideways_use_ema': True, 'sideways_use_atr': False, 'sideways_use_adx': False, 'sideways_use_spike': True, 'sideways_rsi_required': False}.
[I 2025-08-31 11:13:55,851] Trial 653 finished with values: [-1000000000.0, 1000000000.0] and parameters: {'p_sma': 28, 'p_std': 9, 'p_atr': 27, 'p_adx': 21, 'rsi_period': 67, 'ema1': 5, 'ema2': 28, 'slip_atr_k': 0.014942243666215636, 'slip_spread_k': 0.4479789760774108, 'spread_hl_frac': 0.04994719109409515, 'bb_std_mult': 0.6141690052028651, 'rsi_os': 32, 'rsi_ob': 83, 'vol_spike': 0.07291762823085131, 'adx_thresh': 10.148473242723176, 'atr_min_pct': 0.02338711132071034, 'atr_max_pct': 0.06465337317717498, 'tp_mult': 2.389683163850048, 'tsl_mult': 0.11002255957418414, 'strategy': 'breakout', 'time_stop': 103, 'use_sma': True, 'use_atr': True, 'use_adx': False, 'use_ema': True, 'use_spike': False, 'rsi_required': False, 'edge_k': 1.6015259370676387, 'edge_cap': 0.7038846657047708, 'bull_strategy': 'mean_reversion', 'bull_bb_std_mult': 1.6911969882463482, 'bull_rsi_os': 29, 'bull_rsi_ob': 62, 'bull_adx_thresh': 27.845941157931037, 'bull_atr_min_pct': 0.012138509145284164, 'bull_atr_max_pct': 0.025855222153154982, 'bull_tp_mult': 1.9401379184056753, 'bull_tsl_mult': 0.2282301503151226, 'bull_time_stop': 49, 'bull_use_sma': False, 'bull_use_ema': True, 'bull_use_atr': False, 'bull_use_adx': True, 'bull_use_spike': False, 'bull_rsi_required': False, 'bear_strategy': 'mean_reversion', 'bear_bb_std_mult': 3.2714230534609103, 'bear_rsi_os': 52, 'bear_rsi_ob': 53, 'bear_adx_thresh': 32.59879118191161, 'bear_atr_min_pct': 0.029955380617395284, 'bear_atr_max_pct': 0.1350814324071438, 'bear_tp_mult': 2.6811317074132677, 'bear_tsl_mult': 0.8780870798007504, 'bear_time_stop': 106, 'bear_use_sma': True, 'bear_use_ema': False, 'bear_use_atr': True, 'bear_use_adx': True, 'bear_use_spike': True, 'bear_rsi_required': False, 'sideways_strategy': 'mean_reversion', 'sideways_bb_std_mult': 0.9215420839149832, 'sideways_rsi_os': 43, 'sideways_rsi_ob': 63, 'sideways_adx_thresh': 26.784166572401208, 'sideways_atr_min_pct': 0.006796687106998818, 'sideways_atr_max_pct': 0.11639245290351653, 'sideways_tp_mult': 1.5181635423581057, 'sideways_tsl_mult': 0.8733731751172341, 'sideways_time_stop': 176, 'sideways_use_sma': False, 'sideways_use_ema': True, 'sideways_use_atr': False, 'sideways_use_adx': True, 'sideways_use_spike': True, 'sideways_rsi_required': False}.
[I 2025-08-31 11:13:56,099] Trial 655 finished with values: [-1000000000.0, 1000000000.0] and parameters: {'p_sma': 34, 'p_std': 12, 'p_atr': 30, 'p_adx': 21, 'rsi_period': 35, 'ema1': 6, 'ema2': 37, 'slip_atr_k': 0.18128510201897174, 'slip_spread_k': 0.4173753477256484, 'spread_hl_frac': 0.021102542480516358, 'bb_std_mult': 0.5628045406269173, 'rsi_os': 32, 'rsi_ob': 83, 'vol_spike': 0.07845519982228528, 'adx_thresh': 10.150600304343824, 'atr_min_pct': 0.02166605426762643, 'atr_max_pct': 0.060062297744456386, 'tp_mult': 2.93503009445994, 'tsl_mult': 0.17395426048342832, 'strategy': 'breakout', 'time_stop': 72, 'use_sma': True, 'use_atr': True, 'use_adx': False, 'use_ema': True, 'use_spike': False, 'rsi_required': False, 'edge_k': 1.6022322324819795, 'edge_cap': 0.701008414926229, 'bull_strategy': 'mean_reversion', 'bull_bb_std_mult': 1.3922950587991285, 'bull_rsi_os': 43, 'bull_rsi_ob': 62, 'bull_adx_thresh': 28.356778107801958, 'bull_atr_min_pct': 0.012046061180505373, 'bull_atr_max_pct': 0.13529263091135063, 'bull_tp_mult': 1.5213967693758854, 'bull_tsl_mult': 0.2278413568976502, 'bull_time_stop': 53, 'bull_use_sma': False, 'bull_use_ema': True, 'bull_use_atr': False, 'bull_use_adx': True, 'bull_use_spike': False, 'bull_rsi_required': False, 'bear_strategy': 'mean_reversion', 'bear_bb_std_mult': 1.6449805423625428, 'bear_rsi_os': 52, 'bear_rsi_ob': 54, 'bear_adx_thresh': 27.94244096767452, 'bear_atr_min_pct': 0.020214707883421633, 'bear_atr_max_pct': 0.13484798240090143, 'bear_tp_mult': 2.7406264446345583, 'bear_tsl_mult': 0.8580863495252729, 'bear_time_stop': 106, 'bear_use_sma': True, 'bear_use_ema': False, 'bear_use_atr': True, 'bear_use_adx': True, 'bear_use_spike': True, 'bear_rsi_required': False, 'sideways_strategy': 'mean_reversion', 'sideways_bb_std_mult': 0.9179118863177318, 'sideways_rsi_os': 41, 'sideways_rsi_ob': 63, 'sideways_adx_thresh': 25.598249701924342, 'sideways_atr_min_pct': 0.016104116074772353, 'sideways_atr_max_pct': 0.11268238921418773, 'sideways_tp_mult': 1.5156221811651722, 'sideways_tsl_mult': 0.8923324751974921, 'sideways_time_stop': 176, 'sideways_use_sma': True, 'sideways_use_ema': True, 'sideways_use_atr': False, 'sideways_use_adx': True, 'sideways_use_spike': True, 'sideways_rsi_required': False}.
[I 2025-08-31 11:13:56,345] Trial 654 finished with values: [-1000000000.0, 1000000000.0] and parameters: {'p_sma': 39, 'p_std': 11, 'p_atr': 28, 'p_adx': 21, 'rsi_period': 37, 'ema1': 16, 'ema2': 27, 'slip_atr_k': 0.013296179567182022, 'slip_spread_k': 0.44740611512507655, 'spread_hl_frac': 0.022309775922852375, 'bb_std_mult': 0.5653633914216869, 'rsi_os': 32, 'rsi_ob': 86, 'vol_spike': 0.07038473077137296, 'adx_thresh': 14.243600418961124, 'atr_min_pct': 0.021743726339349092, 'atr_max_pct': 0.06232535831160781, 'tp_mult': 1.4250340225996685, 'tsl_mult': 0.06597686282453921, 'strategy': 'breakout', 'time_stop': 80, 'use_sma': True, 'use_atr': True, 'use_adx': False, 'use_ema': True, 'use_spike': False, 'rsi_required': False, 'edge_k': 1.360784487443836, 'edge_cap': 0.7045560728009095, 'bull_strategy': 'mean_reversion', 'bull_bb_std_mult': 1.6806791997295003, 'bull_rsi_os': 52, 'bull_rsi_ob': 63, 'bull_adx_thresh': 28.214770574363996, 'bull_atr_min_pct': 0.0123999992832697, 'bull_atr_max_pct': 0.02678963854533113, 'bull_tp_mult': 2.84344553609203, 'bull_tsl_mult': 0.21541817464601878, 'bull_time_stop': 51, 'bull_use_sma': False, 'bull_use_ema': True, 'bull_use_atr': False, 'bull_use_adx': True, 'bull_use_spike': False, 'bull_rsi_required': False, 'bear_strategy': 'mean_reversion', 'bear_bb_std_mult': 1.475457270500995, 'bear_rsi_os': 52, 'bear_rsi_ob': 53, 'bear_adx_thresh': 24.685017442340037, 'bear_atr_min_pct': 0.020296014790071443, 'bear_atr_max_pct': 0.05828126649438987, 'bear_tp_mult': 2.6840685705777747, 'bear_tsl_mult': 0.9020150351779684, 'bear_time_stop': 106, 'bear_use_sma': True, 'bear_use_ema': False, 'bear_use_atr': True, 'bear_use_adx': True, 'bear_use_spike': True, 'bear_rsi_required': False, 'sideways_strategy': 'mean_reversion', 'sideways_bb_std_mult': 0.901580807007325, 'sideways_rsi_os': 41, 'sideways_rsi_ob': 63, 'sideways_adx_thresh': 26.54010132374403, 'sideways_atr_min_pct': 0.00498377393098269, 'sideways_atr_max_pct': 0.105537487654008, 'sideways_tp_mult': 1.508731286777932, 'sideways_tsl_mult': 0.6019791027769302, 'sideways_time_stop': 175, 'sideways_use_sma': True, 'sideways_use_ema': True, 'sideways_use_atr': False, 'sideways_use_adx': True, 'sideways_use_spike': True, 'sideways_rsi_required': False}.
[I 2025-08-31 11:13:56,345] Trial 656 finished with values: [-1000000000.0, 1000000000.0] and parameters: {'p_sma': 35, 'p_std': 12, 'p_atr': 28, 'p_adx': 21, 'rsi_period': 68, 'ema1': 6, 'ema2': 10, 'slip_atr_k': 0.013998810085570496, 'slip_spread_k': 0.4176726343083732, 'spread_hl_frac': 0.020738516543531225, 'bb_std_mult': 0.5652396140731957, 'rsi_os': 7, 'rsi_ob': 83, 'vol_spike': 0.11334301168326255, 'adx_thresh': 9.9038356123311, 'atr_min_pct': 0.021627076188156714, 'atr_max_pct': 0.0602931205912433, 'tp_mult': 1.4226304891377253, 'tsl_mult': 0.1824964479646649, 'strategy': 'breakout', 'time_stop': 80, 'use_sma': True, 'use_atr': True, 'use_adx': False, 'use_ema': True, 'use_spike': False, 'rsi_required': False, 'edge_k': 1.5836927126192943, 'edge_cap': 0.7025905169714302, 'bull_strategy': 'mean_reversion', 'bull_bb_std_mult': 1.6858742467615961, 'bull_rsi_os': 43, 'bull_rsi_ob': 61, 'bull_adx_thresh': 28.62699967329, 'bull_atr_min_pct': 0.01377171009005949, 'bull_atr_max_pct': 0.032241461696180335, 'bull_tp_mult': 2.8616054310733996, 'bull_tsl_mult': 0.2263450400221585, 'bull_time_stop': 120, 'bull_use_sma': False, 'bull_use_ema': True, 'bull_use_atr': False, 'bull_use_adx': True, 'bull_use_spike': False, 'bull_rsi_required': False, 'bear_strategy': 'mean_reversion', 'bear_bb_std_mult': 3.257809487922385, 'bear_rsi_os': 52, 'bear_rsi_ob': 80, 'bear_adx_thresh': 9.85516444872311, 'bear_atr_min_pct': 0.013916540241201467, 'bear_atr_max_pct': 0.058314662621795264, 'bear_tp_mult': 2.7381427607522024, 'bear_tsl_mult': 0.9064816329804648, 'bear_time_stop': 107, 'bear_use_sma': True, 'bear_use_ema': False, 'bear_use_atr': False, 'bear_use_adx': True, 'bear_use_spike': True, 'bear_rsi_required': False, 'sideways_strategy': 'mean_reversion', 'sideways_bb_std_mult': 0.9108570818267431, 'sideways_rsi_os': 42, 'sideways_rsi_ob': 64, 'sideways_adx_thresh': 25.566477540824987, 'sideways_atr_min_pct': 0.004947458585592848, 'sideways_atr_max_pct': 0.1045227970265415, 'sideways_tp_mult': 1.49488228764909, 'sideways_tsl_mult': 0.10143848740240075, 'sideways_time_stop': 154, 'sideways_use_sma': False, 'sideways_use_ema': True, 'sideways_use_atr': True, 'sideways_use_adx': True, 'sideways_use_spike': True, 'sideways_rsi_required': False}.
