[I 2025-08-31 10:31:06,929] Trial 324 finished with values: [-0.10152896889753615, 0.10158326714729525] and parameters: {'p_sma': 33, 'p_std': 36, 'p_atr': 17, 'p_adx': 9, 'rsi_period': 21, 'ema1': 12, 'ema2': 60, 'slip_atr_k': 0.013325132839951667, 'slip_spread_k': 0.2742250641459885, 'spread_hl_frac': 0.023164561655078807, 'bb_std_mult': 1.2947287997408923, 'rsi_os': 30, 'rsi_ob': 77, 'vol_spike': 0.21629569969273862, 'adx_thresh': 31.679118764664217, 'atr_min_pct': 0.024803662210968132, 'atr_max_pct': 0.045892111469523586, 'tp_mult': 2.3092800636543798, 'tsl_mult': 0.021091381692194044, 'strategy': 'mean_reversion', 'time_stop': 284, 'use_sma': False, 'use_atr': False, 'use_adx': False, 'use_ema': False, 'use_spike': True, 'rsi_required': False, 'edge_k': 0.6498451560691683, 'edge_cap': 0.1332141524391178, 'bull_strategy': 'breakout', 'bull_bb_std_mult': 1.2028652956296062, 'bull_rsi_os': 30, 'bull_rsi_ob': 79, 'bull_adx_thresh': 10.331321457471415, 'bull_atr_min_pct': 0.02670465863189647, 'bull_atr_max_pct': 0.07098526032910511, 'bull_tp_mult': 2.890960820528928, 'bull_tsl_mult': 0.10393032300754175, 'bull_time_stop': 251, 'bull_use_sma': True, 'bull_use_ema': True, 'bull_use_atr': True, 'bull_use_adx': True, 'bull_use_spike': False, 'bull_rsi_required': False, 'bear_strategy': 'breakout', 'bear_bb_std_mult': 2.1742994250759518, 'bear_rsi_os': 29, 'bear_rsi_ob': 62, 'bear_adx_thresh': 7.648493648618908, 'bear_atr_min_pct': 0.024867460106016162, 'bear_atr_max_pct': 0.1340386270781434, 'bear_tp_mult': 2.6067871141929264, 'bear_tsl_mult': 0.9151207043879923, 'bear_time_stop': 44, 'bear_use_sma': False, 'bear_use_ema': True, 'bear_use_atr': True, 'bear_use_adx': False, 'bear_use_spike': True, 'bear_rsi_required': True, 'sideways_strategy': 'mean_reversion', 'sideways_bb_std_mult': 2.3187187254488872, 'sideways_rsi_os': 37, 'sideways_rsi_ob': 82, 'sideways_adx_thresh': 14.49831508500722, 'sideways_atr_min_pct': 0.0011895501491105882, 'sideways_atr_max_pct': 0.010332239675269028, 'sideways_tp_mult': 1.2590227651200743, 'sideways_tsl_mult': 0.8768482644485491, 'sideways_time_stop': 277, 'sideways_use_sma': True, 'sideways_use_ema': False, 'sideways_use_atr': False, 'sideways_use_adx': False, 'sideways_use_spike': True, 'sideways_rsi_required': False}.
[I 2025-08-31 10:31:38,886] Trial 326 finished with values: [-0.007373276077624169, 0.0074848353522322985] and parameters: {'p_sma': 46, 'p_std': 36, 'p_atr': 21, 'p_adx': 9, 'rsi_period': 77, 'ema1': 28, 'ema2': 60, 'slip_atr_k': 0.07152133994992575, 'slip_spread_k': 0.2683652312442688, 'spread_hl_frac': 0.02781861533449818, 'bb_std_mult': 2.351906470794485, 'rsi_os': 30, 'rsi_ob': 77, 'vol_spike': 0.12387517330764192, 'adx_thresh': 24.070236930831467, 'atr_min_pct': 0.014788985508613408, 'atr_max_pct': 0.04705880078096538, 'tp_mult': 2.0588259345864897, 'tsl_mult': 0.5546228849268111, 'strategy': 'mean_reversion', 'time_stop': 225, 'use_sma': False, 'use_atr': False, 'use_adx': False, 'use_ema': False, 'use_spike': True, 'rsi_required': False, 'edge_k': 0.3025664286678923, 'edge_cap': 0.12999611014686194, 'bull_strategy': 'breakout', 'bull_bb_std_mult': 3.5264759789456783, 'bull_rsi_os': 41, 'bull_rsi_ob': 77, 'bull_adx_thresh': 9.79179326762578, 'bull_atr_min_pct': 0.0030867433985092845, 'bull_atr_max_pct': 0.04597702373591481, 'bull_tp_mult': 1.2760679117165274, 'bull_tsl_mult': 0.19035572150227065, 'bull_time_stop': 18, 'bull_use_sma': True, 'bull_use_ema': True, 'bull_use_atr': False, 'bull_use_adx': True, 'bull_use_spike': False, 'bull_rsi_required': False, 'bear_strategy': 'breakout', 'bear_bb_std_mult': 0.5385399230467987, 'bear_rsi_os': 28, 'bear_rsi_ob': 58, 'bear_adx_thresh': 7.832351848495918, 'bear_atr_min_pct': 0.007011734250020116, 'bear_atr_max_pct': 0.13443031697128446, 'bear_tp_mult': 1.3249865064846502, 'bear_tsl_mult': 0.1155036451936782, 'bear_time_stop': 27, 'bear_use_sma': False, 'bear_use_ema': False, 'bear_use_atr': True, 'bear_use_adx': True, 'bear_use_spike': False, 'bear_rsi_required': True, 'sideways_strategy': 'mean_reversion', 'sideways_bb_std_mult': 2.4634005463537347, 'sideways_rsi_os': 31, 'sideways_rsi_ob': 92, 'sideways_adx_thresh': 14.491514274625665, 'sideways_atr_min_pct': 0.002964994187748424, 'sideways_atr_max_pct': 0.062157630288757024, 'sideways_tp_mult': 2.9908237617580364, 'sideways_tsl_mult': 0.8243425087658575, 'sideways_time_stop': 253, 'sideways_use_sma': True, 'sideways_use_ema': False, 'sideways_use_atr': False, 'sideways_use_adx': False, 'sideways_use_spike': True, 'sideways_rsi_required': False}.
[I 2025-08-31 10:31:39,306] Trial 328 finished with values: [-1000000000.0, 1000000000.0] and parameters: {'p_sma': 14, 'p_std': 31, 'p_atr': 18, 'p_adx': 21, 'rsi_period': 79, 'ema1': 11, 'ema2': 24, 'slip_atr_k': 0.057342093591537455, 'slip_spread_k': 0.22836665011854693, 'spread_hl_frac': 0.027752268844075955, 'bb_std_mult': 2.278731914062818, 'rsi_os': 28, 'rsi_ob': 74, 'vol_spike': 0.20878969723672627, 'adx_thresh': 13.698562965173341, 'atr_min_pct': 0.019886754183048486, 'atr_max_pct': 0.04873912968837333, 'tp_mult': 2.870535865518465, 'tsl_mult': 0.6120812229769219, 'strategy': 'mean_reversion', 'time_stop': 133, 'use_sma': False, 'use_atr': True, 'use_adx': True, 'use_ema': True, 'use_spike': True, 'rsi_required': True, 'edge_k': 1.611585539410369, 'edge_cap': 0.1129610159318129, 'bull_strategy': 'breakout', 'bull_bb_std_mult': 1.0726296396899295, 'bull_rsi_os': 14, 'bull_rsi_ob': 76, 'bull_adx_thresh': 9.918442748326376, 'bull_atr_min_pct': 0.0030478856192233334, 'bull_atr_max_pct': 0.06223556168000525, 'bull_tp_mult': 2.8049832667065466, 'bull_tsl_mult': 0.1840108035154316, 'bull_time_stop': 167, 'bull_use_sma': False, 'bull_use_ema': True, 'bull_use_atr': False, 'bull_use_adx': True, 'bull_use_spike': True, 'bull_rsi_required': False, 'bear_strategy': 'breakout', 'bear_bb_std_mult': 2.5676271362476584, 'bear_rsi_os': 18, 'bear_rsi_ob': 58, 'bear_adx_thresh': 34.99335547586167, 'bear_atr_min_pct': 0.017394678720800364, 'bear_atr_max_pct': 0.12508578987028285, 'bear_tp_mult': 2.6530724121995837, 'bear_tsl_mult': 0.11601432640994525, 'bear_time_stop': 34, 'bear_use_sma': False, 'bear_use_ema': False, 'bear_use_atr': False, 'bear_use_adx': True, 'bear_use_spike': False, 'bear_rsi_required': True, 'sideways_strategy': 'breakout', 'sideways_bb_std_mult': 2.7375592194495586, 'sideways_rsi_os': 31, 'sideways_rsi_ob': 94, 'sideways_adx_thresh': 24.343202658090636, 'sideways_atr_min_pct': 0.003086146408914406, 'sideways_atr_max_pct': 0.047750179337088736, 'sideways_tp_mult': 2.989847881353962, 'sideways_tsl_mult': 0.5169223767784289, 'sideways_time_stop': 182, 'sideways_use_sma': True, 'sideways_use_ema': False, 'sideways_use_atr': False, 'sideways_use_adx': False, 'sideways_use_spike': True, 'sideways_rsi_required': False}.
[I 2025-08-31 10:31:39,614] Trial 327 finished with values: [-0.010951860983390738, 0.011762958128979189] and parameters: {'p_sma': 21, 'p_std': 16, 'p_atr': 17, 'p_adx': 9, 'rsi_period': 24, 'ema1': 11, 'ema2': 60, 'slip_atr_k': 0.07230898274142823, 'slip_spread_k': 0.151905000154738, 'spread_hl_frac': 0.027845041642913664, 'bb_std_mult': 2.263397672256262, 'rsi_os': 36, 'rsi_ob': 65, 'vol_spike': 0.21743331177170988, 'adx_thresh': 9.739612506401889, 'atr_min_pct': 0.01968027444293404, 'atr_max_pct': 0.04882304897190421, 'tp_mult': 2.3161281188887948, 'tsl_mult': 0.6189673057368272, 'strategy': 'mean_reversion', 'time_stop': 133, 'use_sma': False, 'use_atr': True, 'use_adx': True, 'use_ema': True, 'use_spike': True, 'rsi_required': True, 'edge_k': 1.0883540924845585, 'edge_cap': 0.11046031996645625, 'bull_strategy': 'breakout', 'bull_bb_std_mult': 0.6315035682688508, 'bull_rsi_os': 51, 'bull_rsi_ob': 76, 'bull_adx_thresh': 10.313431253612075, 'bull_atr_min_pct': 0.02779193280954445, 'bull_atr_max_pct': 0.07080799191483708, 'bull_tp_mult': 1.1129690618320782, 'bull_tsl_mult': 0.11272770568144132, 'bull_time_stop': 20, 'bull_use_sma': False, 'bull_use_ema': True, 'bull_use_atr': False, 'bull_use_adx': True, 'bull_use_spike': True, 'bull_rsi_required': False, 'bear_strategy': 'breakout', 'bear_bb_std_mult': 2.567997884582884, 'bear_rsi_os': 28, 'bear_rsi_ob': 58, 'bear_adx_thresh': 7.748216838462577, 'bear_atr_min_pct': 0.017492921559695472, 'bear_atr_max_pct': 0.134691301314902, 'bear_tp_mult': 2.554723593822432, 'bear_tsl_mult': 0.10839131448478032, 'bear_time_stop': 44, 'bear_use_sma': False, 'bear_use_ema': False, 'bear_use_atr': True, 'bear_use_adx': True, 'bear_use_spike': False, 'bear_rsi_required': True, 'sideways_strategy': 'breakout', 'sideways_bb_std_mult': 2.4318020544243706, 'sideways_rsi_os': 36, 'sideways_rsi_ob': 62, 'sideways_adx_thresh': 24.27745138550668, 'sideways_atr_min_pct': 0.003010819354179914, 'sideways_atr_max_pct': 0.04879775430444818, 'sideways_tp_mult': 2.4671636170972207, 'sideways_tsl_mult': 0.7571358386311237, 'sideways_time_stop': 226, 'sideways_use_sma': True, 'sideways_use_ema': False, 'sideways_use_atr': False, 'sideways_use_adx': False, 'sideways_use_spike': True, 'sideways_rsi_required': False}.
[I 2025-08-31 10:31:39,866] Trial 325 finished with values: [-0.04299446340179858, 0.042951746181928555] and parameters: {'p_sma': 14, 'p_std': 30, 'p_atr': 18, 'p_adx': 9, 'rsi_period': 21, 'ema1': 11, 'ema2': 24, 'slip_atr_k': 0.07216931569103019, 'slip_spread_k': 0.41135321314519496, 'spread_hl_frac': 0.02654795502059641, 'bb_std_mult': 2.374460508313669, 'rsi_os': 18, 'rsi_ob': 83, 'vol_spike': 0.12267448156832375, 'adx_thresh': 31.29865734886276, 'atr_min_pct': 0.019762471400636687, 'atr_max_pct': 0.0474101849168708, 'tp_mult': 2.7433719873042457, 'tsl_mult': 0.028751372964823607, 'strategy': 'mean_reversion', 'time_stop': 280, 'use_sma': False, 'use_atr': False, 'use_adx': False, 'use_ema': False, 'use_spike': True, 'rsi_required': False, 'edge_k': 0.6387900069063192, 'edge_cap': 0.13251852098635003, 'bull_strategy': 'breakout', 'bull_bb_std_mult': 1.1985174865835373, 'bull_rsi_os': 41, 'bull_rsi_ob': 77, 'bull_adx_thresh': 12.232588473987374, 'bull_atr_min_pct': 0.02740873203708425, 'bull_atr_max_pct': 0.12136413765682355, 'bull_tp_mult': 1.2787371609491995, 'bull_tsl_mult': 0.11218553379523255, 'bull_time_stop': 293, 'bull_use_sma': True, 'bull_use_ema': True, 'bull_use_atr': True, 'bull_use_adx': True, 'bull_use_spike': False, 'bull_rsi_required': False, 'bear_strategy': 'breakout', 'bear_bb_std_mult': 1.1008594184367353, 'bear_rsi_os': 29, 'bear_rsi_ob': 52, 'bear_adx_thresh': 7.698115677984598, 'bear_atr_min_pct': 0.007048770594058186, 'bear_atr_max_pct': 0.1257136580033809, 'bear_tp_mult': 2.600999486138907, 'bear_tsl_mult': 0.11030810571810287, 'bear_time_stop': 26, 'bear_use_sma': False, 'bear_use_ema': True, 'bear_use_atr': True, 'bear_use_adx': True, 'bear_use_spike': True, 'bear_rsi_required': True, 'sideways_strategy': 'mean_reversion', 'sideways_bb_std_mult': 2.44952892535292, 'sideways_rsi_os': 31, 'sideways_rsi_ob': 62, 'sideways_adx_thresh': 19.79279104484246, 'sideways_atr_min_pct': 0.0010227860702486861, 'sideways_atr_max_pct': 0.012178700024493526, 'sideways_tp_mult': 2.1479411715219316, 'sideways_tsl_mult': 0.505622020593013, 'sideways_time_stop': 283, 'sideways_use_sma': True, 'sideways_use_ema': False, 'sideways_use_atr': False, 'sideways_use_adx': False, 'sideways_use_spike': True, 'sideways_rsi_required': False}.
[I 2025-08-31 10:31:40,467] Trial 331 finished with values: [-1000000000.0, 1000000000.0] and parameters: {'p_sma': 20, 'p_std': 28, 'p_atr': 16, 'p_adx': 22, 'rsi_period': 23, 'ema1': 13, 'ema2': 31, 'slip_atr_k': 0.07044484743827013, 'slip_spread_k': 0.34677747477685783, 'spread_hl_frac': 0.026146919316202485, 'bb_std_mult': 2.5548991580944, 'rsi_os': 50, 'rsi_ob': 48, 'vol_spike': 0.11878538759143543, 'adx_thresh': 8.888010427417523, 'atr_min_pct': 0.020994862707812707, 'atr_max_pct': 0.039351000737946173, 'tp_mult': 1.0685894332840618, 'tsl_mult': 0.15938614251337418, 'strategy': 'mean_reversion', 'time_stop': 224, 'use_sma': False, 'use_atr': False, 'use_adx': True, 'use_ema': False, 'use_spike': True, 'rsi_required': True, 'edge_k': 0.3208910273318051, 'edge_cap': 0.7536131853099169, 'bull_strategy': 'breakout', 'bull_bb_std_mult': 2.251770174570222, 'bull_rsi_os': 42, 'bull_rsi_ob': 74, 'bull_adx_thresh': 29.602450780639593, 'bull_atr_min_pct': 0.0031974934763935145, 'bull_atr_max_pct': 0.12179339604319778, 'bull_tp_mult': 1.2684062117102095, 'bull_tsl_mult': 0.0736140513062038, 'bull_time_stop': 18, 'bull_use_sma': True, 'bull_use_ema': True, 'bull_use_atr': True, 'bull_use_adx': False, 'bull_use_spike': True, 'bull_rsi_required': False, 'bear_strategy': 'breakout', 'bear_bb_std_mult': 2.0270435842823114, 'bear_rsi_os': 42, 'bear_rsi_ob': 58, 'bear_adx_thresh': 6.396616162459253, 'bear_atr_min_pct': 0.016617856530747818, 'bear_atr_max_pct': 0.12441589691952973, 'bear_tp_mult': 1.3276096729385962, 'bear_tsl_mult': 0.1703550619588132, 'bear_time_stop': 27, 'bear_use_sma': False, 'bear_use_ema': False, 'bear_use_atr': True, 'bear_use_adx': False, 'bear_use_spike': True, 'bear_rsi_required': False, 'sideways_strategy': 'breakout', 'sideways_bb_std_mult': 2.9847115098306634, 'sideways_rsi_os': 23, 'sideways_rsi_ob': 87, 'sideways_adx_thresh': 15.119315242839699, 'sideways_atr_min_pct': 0.02392079305618336, 'sideways_atr_max_pct': 0.0632540591621581, 'sideways_tp_mult': 1.310165811873786, 'sideways_tsl_mult': 0.6140781279792502, 'sideways_time_stop': 258, 'sideways_use_sma': True, 'sideways_use_ema': False, 'sideways_use_atr': False, 'sideways_use_adx': False, 'sideways_use_spike': True, 'sideways_rsi_required': False}.
[I 2025-08-31 10:32:11,566] Trial 329 finished with values: [-1000000000.0, 1000000000.0] and parameters: {'p_sma': 13, 'p_std': 28, 'p_atr': 18, 'p_adx': 8, 'rsi_period': 81, 'ema1': 11, 'ema2': 60, 'slip_atr_k': 0.14959138169359876, 'slip_spread_k': 0.3570176901550997, 'spread_hl_frac': 0.02751383206325663, 'bb_std_mult': 2.3640799944743236, 'rsi_os': 36, 'rsi_ob': 65, 'vol_spike': 0.20799780330634798, 'adx_thresh': 12.79525952763457, 'atr_min_pct': 0.0025570633328478917, 'atr_max_pct': 0.03902917909113262, 'tp_mult': 2.8858769584475383, 'tsl_mult': 0.7246031647763456, 'strategy': 'mean_reversion', 'time_stop': 132, 'use_sma': False, 'use_atr': True, 'use_adx': True, 'use_ema': True, 'use_spike': True, 'rsi_required': True, 'edge_k': 0.5973776250741039, 'edge_cap': 0.5562923914991257, 'bull_strategy': 'breakout', 'bull_bb_std_mult': 0.5118209425877689, 'bull_rsi_os': 41, 'bull_rsi_ob': 62, 'bull_adx_thresh': 10.08571300835781, 'bull_atr_min_pct': 0.0033505608113183942, 'bull_atr_max_pct': 0.11481069831528183, 'bull_tp_mult': 1.275989063361901, 'bull_tsl_mult': 0.11785180466084855, 'bull_time_stop': 19, 'bull_use_sma': False, 'bull_use_ema': True, 'bull_use_atr': False, 'bull_use_adx': True, 'bull_use_spike': True, 'bull_rsi_required': False, 'bear_strategy': 'breakout', 'bear_bb_std_mult': 1.9396919133492336, 'bear_rsi_os': 28, 'bear_rsi_ob': 58, 'bear_adx_thresh': 6.539471647296022, 'bear_atr_min_pct': 0.017384518038858224, 'bear_atr_max_pct': 0.12490735588169928, 'bear_tp_mult': 2.6477358002781806, 'bear_tsl_mult': 0.11172439788111499, 'bear_time_stop': 34, 'bear_use_sma': False, 'bear_use_ema': False, 'bear_use_atr': False, 'bear_use_adx': True, 'bear_use_spike': False, 'bear_rsi_required': True, 'sideways_strategy': 'breakout', 'sideways_bb_std_mult': 2.6218854764901605, 'sideways_rsi_os': 22, 'sideways_rsi_ob': 83, 'sideways_adx_thresh': 19.75333377260845, 'sideways_atr_min_pct': 0.0030369287749593844, 'sideways_atr_max_pct': 0.0629309755258918, 'sideways_tp_mult': 2.419269767590077, 'sideways_tsl_mult': 0.7877555531672289, 'sideways_time_stop': 257, 'sideways_use_sma': True, 'sideways_use_ema': False, 'sideways_use_atr': False, 'sideways_use_adx': False, 'sideways_use_spike': True, 'sideways_rsi_required': False}.
[I 2025-08-31 10:32:11,934] Trial 332 finished with values: [-0.013347359250654556, 0.01328188621819284] and parameters: {'p_sma': 20, 'p_std': 11, 'p_atr': 26, 'p_adx': 7, 'rsi_period': 77, 'ema1': 28, 'ema2': 57, 'slip_atr_k': 0.0690407717602722, 'slip_spread_k': 0.3597516967728126, 'spread_hl_frac': 0.02950645079893166, 'bb_std_mult': 2.5452429517620545, 'rsi_os': 38, 'rsi_ob': 78, 'vol_spike': 0.24635332694211284, 'adx_thresh': 8.730773265937884, 'atr_min_pct': 0.02098600815270009, 'atr_max_pct': 0.03876951496224629, 'tp_mult': 1.9314802840765866, 'tsl_mult': 0.5570306501568061, 'strategy': 'mean_reversion', 'time_stop': 141, 'use_sma': False, 'use_atr': False, 'use_adx': True, 'use_ema': False, 'use_spike': True, 'rsi_required': True, 'edge_k': 1.639613668449037, 'edge_cap': 0.7763656395872968, 'bull_strategy': 'breakout', 'bull_bb_std_mult': 0.9354162601232596, 'bull_rsi_os': 42, 'bull_rsi_ob': 62, 'bull_adx_thresh': 11.029982976978328, 'bull_atr_min_pct': 0.003100052908749707, 'bull_atr_max_pct': 0.11383223379671521, 'bull_tp_mult': 1.0732897403511055, 'bull_tsl_mult': 0.14369211989829117, 'bull_time_stop': 19, 'bull_use_sma': True, 'bull_use_ema': True, 'bull_use_atr': True, 'bull_use_adx': False, 'bull_use_spike': True, 'bull_rsi_required': False, 'bear_strategy': 'mean_reversion', 'bear_bb_std_mult': 1.943385251231233, 'bear_rsi_os': 21, 'bear_rsi_ob': 50, 'bear_adx_thresh': 6.321748658262001, 'bear_atr_min_pct': 0.01846188372150539, 'bear_atr_max_pct': 0.1278948984798794, 'bear_tp_mult': 2.695919725759185, 'bear_tsl_mult': 0.6133344830261426, 'bear_time_stop': 37, 'bear_use_sma': True, 'bear_use_ema': False, 'bear_use_atr': True, 'bear_use_adx': False, 'bear_use_spike': True, 'bear_rsi_required': False, 'sideways_strategy': 'breakout', 'sideways_bb_std_mult': 2.621592798798095, 'sideways_rsi_os': 39, 'sideways_rsi_ob': 87, 'sideways_adx_thresh': 17.874421142062662, 'sideways_atr_min_pct': 0.004539104403047759, 'sideways_atr_max_pct': 0.019593257653574957, 'sideways_tp_mult': 2.867163229866157, 'sideways_tsl_mult': 0.20699467379861808, 'sideways_time_stop': 256, 'sideways_use_sma': True, 'sideways_use_ema': False, 'sideways_use_atr': False, 'sideways_use_adx': True, 'sideways_use_spike': True, 'sideways_rsi_required': False}.
[I 2025-08-31 10:32:12,013] Trial 333 finished with values: [-1000000000.0, 1000000000.0] and parameters: {'p_sma': 22, 'p_std': 11, 'p_atr': 26, 'p_adx': 14, 'rsi_period': 26, 'ema1': 13, 'ema2': 57, 'slip_atr_k': 0.05175000867234139, 'slip_spread_k': 0.45605386919589, 'spread_hl_frac': 0.0189971614598166, 'bb_std_mult': 2.6929912252179093, 'rsi_os': 41, 'rsi_ob': 75, 'vol_spike': 0.16469202835858626, 'adx_thresh': 24.357561870151212, 'atr_min_pct': 0.011412985290053983, 'atr_max_pct': 0.1276832739378674, 'tp_mult': 2.7853881964559526, 'tsl_mult': 0.5544765393508029, 'strategy': 'mean_reversion', 'time_stop': 141, 'use_sma': False, 'use_atr': False, 'use_adx': True, 'use_ema': False, 'use_spike': True, 'rsi_required': True, 'edge_k': 0.5779658747081549, 'edge_cap': 0.179878015534339, 'bull_strategy': 'breakout', 'bull_bb_std_mult': 2.948531252120965, 'bull_rsi_os': 41, 'bull_rsi_ob': 72, 'bull_adx_thresh': 10.884238946583544, 'bull_atr_min_pct': 0.011998692736052495, 'bull_atr_max_pct': 0.04587238022646738, 'bull_tp_mult': 1.071904202856286, 'bull_tsl_mult': 0.8929781993462609, 'bull_time_stop': 43, 'bull_use_sma': True, 'bull_use_ema': True, 'bull_use_atr': True, 'bull_use_adx': True, 'bull_use_spike': True, 'bull_rsi_required': False, 'bear_strategy': 'mean_reversion', 'bear_bb_std_mult': 1.7436419439474709, 'bear_rsi_os': 15, 'bear_rsi_ob': 54, 'bear_adx_thresh': 29.19599355516346, 'bear_atr_min_pct': 0.018718483630322344, 'bear_atr_max_pct': 0.12732808759982217, 'bear_tp_mult': 2.6878337245750705, 'bear_tsl_mult': 0.2721246383877043, 'bear_time_stop': 37, 'bear_use_sma': True, 'bear_use_ema': False, 'bear_use_atr': False, 'bear_use_adx': False, 'bear_use_spike': True, 'bear_rsi_required': True, 'sideways_strategy': 'breakout', 'sideways_bb_std_mult': 2.6199439772883655, 'sideways_rsi_os': 39, 'sideways_rsi_ob': 85, 'sideways_adx_thresh': 9.724061095280884, 'sideways_atr_min_pct': 0.029977200711811, 'sideways_atr_max_pct': 0.12027077962825614, 'sideways_tp_mult': 1.0766703614985191, 'sideways_tsl_mult': 0.8272358449109817, 'sideways_time_stop': 265, 'sideways_use_sma': False, 'sideways_use_ema': False, 'sideways_use_atr': True, 'sideways_use_adx': True, 'sideways_use_spike': True, 'sideways_rsi_required': False}.
