[I 2025-08-31 09:58:12,467] Trial 52 finished with values: [-0.1018236204057601, 0.10177731904975182] and parameters: {'p_sma': 47, 'p_std': 25, 'p_atr': 22, 'p_adx': 12, 'rsi_period': 63, 'ema1': 20, 'ema2': 20, 'slip_atr_k': 0.2297670312782905, 'slip_spread_k': 0.8319416970991439, 'spread_hl_frac': 0.013126856912372727, 'bb_std_mult': 3.434291754859391, 'rsi_os': 21, 'rsi_ob': 69, 'vol_spike': 0.17925399684660387, 'adx_thresh': 22.025907896802476, 'atr_min_pct': 0.020088518915414064, 'atr_max_pct': 0.1435211774707414, 'tp_mult': 2.9893633738016683, 'tsl_mult': 0.04879500873457676, 'strategy': 'mean_reversion', 'time_stop': 284, 'use_sma': True, 'use_atr': False, 'use_adx': False, 'use_ema': False, 'use_spike': False, 'rsi_required': True, 'edge_k': 1.416736171436671, 'edge_cap': 0.5116126239261876, 'bull_strategy': 'mean_reversion', 'bull_bb_std_mult': 1.696288005509098, 'bull_rsi_os': 31, 'bull_rsi_ob': 91, 'bull_adx_thresh': 33.36348206042043, 'bull_atr_min_pct': 0.005544572186256349, 'bull_atr_max_pct': 0.09970600386934785, 'bull_tp_mult': 1.1813184864409205, 'bull_tsl_mult': 0.0715739750319645, 'bull_time_stop': 168, 'bull_use_sma': True, 'bull_use_ema': False, 'bull_use_atr': False, 'bull_use_adx': False, 'bull_use_spike': True, 'bull_rsi_required': True, 'bear_strategy': 'breakout', 'bear_bb_std_mult': 1.077481643982655, 'bear_rsi_os': 14, 'bear_rsi_ob': 53, 'bear_adx_thresh': 23.2509599205977, 'bear_atr_min_pct': 0.0034595899125881274, 'bear_atr_max_pct': 0.10237668684464087, 'bear_tp_mult': 2.4408835720970807, 'bear_tsl_mult': 0.4899310973930182, 'bear_time_stop': 106, 'bear_use_sma': True, 'bear_use_ema': False, 'bear_use_atr': False, 'bear_use_adx': True, 'bear_use_spike': False, 'bear_rsi_required': False, 'sideways_strategy': 'breakout', 'sideways_bb_std_mult': 3.07989484722893, 'sideways_rsi_os': 15, 'sideways_rsi_ob': 61, 'sideways_adx_thresh': 15.588775856658279, 'sideways_atr_min_pct': 2.973698883378291e-05, 'sideways_atr_max_pct': 0.04772157268607721, 'sideways_tp_mult': 2.5703837714896434, 'sideways_tsl_mult': 0.050785975061612254, 'sideways_time_stop': 112, 'sideways_use_sma': False, 'sideways_use_ema': True, 'sideways_use_atr': False, 'sideways_use_adx': True, 'sideways_use_spike': True, 'sideways_rsi_required': False}.
[I 2025-08-31 09:58:45,392] Trial 55 finished with values: [-1000000000.0, 1000000000.0] and parameters: {'p_sma': 8, 'p_std': 26, 'p_atr': 28, 'p_adx': 16, 'rsi_period': 80, 'ema1': 29, 'ema2': 26, 'slip_atr_k': 0.2279008330229162, 'slip_spread_k': 0.9056555414158046, 'spread_hl_frac': 0.017309214008547347, 'bb_std_mult': 0.8664105011154237, 'rsi_os': 26, 'rsi_ob': 52, 'vol_spike': 0.25487210060070675, 'adx_thresh': 14.875506867703105, 'atr_min_pct': 0.023409534709453766, 'atr_max_pct': 0.14962067986801192, 'tp_mult': 1.418269125269406, 'tsl_mult': 0.04925145854929025, 'strategy': 'mean_reversion', 'time_stop': 285, 'use_sma': False, 'use_atr': True, 'use_adx': True, 'use_ema': True, 'use_spike': False, 'rsi_required': True, 'edge_k': 0.5011292919123909, 'edge_cap': 0.34476443094538844, 'bull_strategy': 'breakout', 'bull_bb_std_mult': 2.3091826177141117, 'bull_rsi_os': 32, 'bull_rsi_ob': 51, 'bull_adx_thresh': 33.345131073095445, 'bull_atr_min_pct': 0.0032960190369693146, 'bull_atr_max_pct': 0.05941559995542138, 'bull_tp_mult': 2.779057717983643, 'bull_tsl_mult': 0.1894746364232296, 'bull_time_stop': 6, 'bull_use_sma': True, 'bull_use_ema': False, 'bull_use_atr': False, 'bull_use_adx': True, 'bull_use_spike': False, 'bull_rsi_required': True, 'bear_strategy': 'breakout', 'bear_bb_std_mult': 1.047282180318489, 'bear_rsi_os': 14, 'bear_rsi_ob': 45, 'bear_adx_thresh': 9.481628492486067, 'bear_atr_min_pct': 0.02779880266802729, 'bear_atr_max_pct': 0.09004451543246861, 'bear_tp_mult': 1.179333550921406, 'bear_tsl_mult': 0.2078474366027685, 'bear_time_stop': 110, 'bear_use_sma': True, 'bear_use_ema': False, 'bear_use_atr': True, 'bear_use_adx': True, 'bear_use_spike': False, 'bear_rsi_required': True, 'sideways_strategy': 'breakout', 'sideways_bb_std_mult': 0.6458965749736785, 'sideways_rsi_os': 5, 'sideways_rsi_ob': 45, 'sideways_adx_thresh': 29.463472582021083, 'sideways_atr_min_pct': 0.0026529411172529927, 'sideways_atr_max_pct': 0.027071420534166876, 'sideways_tp_mult': 2.334285921984397, 'sideways_tsl_mult': 0.02468268737077134, 'sideways_time_stop': 108, 'sideways_use_sma': True, 'sideways_use_ema': True, 'sideways_use_atr': False, 'sideways_use_adx': True, 'sideways_use_spike': True, 'sideways_rsi_required': False}.
[I 2025-08-31 09:58:46,173] Trial 56 finished with values: [-1000000000.0, 1000000000.0] and parameters: {'p_sma': 8, 'p_std': 25, 'p_atr': 28, 'p_adx': 16, 'rsi_period': 82, 'ema1': 29, 'ema2': 26, 'slip_atr_k': 0.03984375894236808, 'slip_spread_k': 0.8991809072629655, 'spread_hl_frac': 0.012381622461905068, 'bb_std_mult': 0.8092789950353847, 'rsi_os': 26, 'rsi_ob': 52, 'vol_spike': 0.12477599748726156, 'adx_thresh': 16.63866248802816, 'atr_min_pct': 0.023515918595539118, 'atr_max_pct': 0.1498024283621639, 'tp_mult': 1.4971407998351944, 'tsl_mult': 0.05754393063647538, 'strategy': 'mean_reversion', 'time_stop': 285, 'use_sma': False, 'use_atr': True, 'use_adx': True, 'use_ema': True, 'use_spike': False, 'rsi_required': True, 'edge_k': 0.2469965339751693, 'edge_cap': 0.35017207067441714, 'bull_strategy': 'breakout', 'bull_bb_std_mult': 2.35429587623558, 'bull_rsi_os': 31, 'bull_rsi_ob': 51, 'bull_adx_thresh': 32.906109712778694, 'bull_atr_min_pct': 0.003091583855053072, 'bull_atr_max_pct': 0.12121296756272544, 'bull_tp_mult': 2.9501699896881473, 'bull_tsl_mult': 0.0687235211166275, 'bull_time_stop': 6, 'bull_use_sma': True, 'bull_use_ema': False, 'bull_use_atr': False, 'bull_use_adx': True, 'bull_use_spike': False, 'bull_rsi_required': True, 'bear_strategy': 'breakout', 'bear_bb_std_mult': 3.261405482751886, 'bear_rsi_os': 14, 'bear_rsi_ob': 45, 'bear_adx_thresh': 23.221152115270442, 'bear_atr_min_pct': 0.027974130308379745, 'bear_atr_max_pct': 0.11136397068863657, 'bear_tp_mult': 1.1509133531778675, 'bear_tsl_mult': 0.1421920120426028, 'bear_time_stop': 101, 'bear_use_sma': True, 'bear_use_ema': False, 'bear_use_atr': True, 'bear_use_adx': True, 'bear_use_spike': False, 'bear_rsi_required': True, 'sideways_strategy': 'breakout', 'sideways_bb_std_mult': 0.6460340745294646, 'sideways_rsi_os': 5, 'sideways_rsi_ob': 67, 'sideways_adx_thresh': 19.892898547653896, 'sideways_atr_min_pct': 0.0035097565791434113, 'sideways_atr_max_pct': 0.02697627147652073, 'sideways_tp_mult': 2.1413919062091207, 'sideways_tsl_mult': 0.054062997676825264, 'sideways_time_stop': 113, 'sideways_use_sma': True, 'sideways_use_ema': True, 'sideways_use_atr': False, 'sideways_use_adx': True, 'sideways_use_spike': True, 'sideways_rsi_required': False}.
[I 2025-08-31 09:58:46,378] Trial 57 finished with values: [-1000000000.0, 1000000000.0] and parameters: {'p_sma': 9, 'p_std': 32, 'p_atr': 26, 'p_adx': 13, 'rsi_period': 50, 'ema1': 29, 'ema2': 26, 'slip_atr_k': 0.05203703954681578, 'slip_spread_k': 0.9074576585139305, 'spread_hl_frac': 0.012607825194325297, 'bb_std_mult': 3.205107940222504, 'rsi_os': 12, 'rsi_ob': 69, 'vol_spike': 0.28043375327299724, 'adx_thresh': 12.627759694872061, 'atr_min_pct': 0.02346813019762963, 'atr_max_pct': 0.14985529708103887, 'tp_mult': 1.4757667813936106, 'tsl_mult': 0.058200106898364454, 'strategy': 'breakout', 'time_stop': 283, 'use_sma': False, 'use_atr': True, 'use_adx': True, 'use_ema': False, 'use_spike': True, 'rsi_required': True, 'edge_k': 0.28541454295480795, 'edge_cap': 0.9648557637963954, 'bull_strategy': 'breakout', 'bull_bb_std_mult': 1.6419714582121403, 'bull_rsi_os': 31, 'bull_rsi_ob': 80, 'bull_adx_thresh': 7.9585049271602255, 'bull_atr_min_pct': 0.003371422173093575, 'bull_atr_max_pct': 0.05767938054296945, 'bull_tp_mult': 2.824713064048794, 'bull_tsl_mult': 0.04438482168008606, 'bull_time_stop': 18, 'bull_use_sma': True, 'bull_use_ema': False, 'bull_use_atr': False, 'bull_use_adx': True, 'bull_use_spike': False, 'bull_rsi_required': True, 'bear_strategy': 'mean_reversion', 'bear_bb_std_mult': 3.214767468369185, 'bear_rsi_os': 12, 'bear_rsi_ob': 50, 'bear_adx_thresh': 22.84757754423206, 'bear_atr_min_pct': 0.02787094185522301, 'bear_atr_max_pct': 0.11024734517419973, 'bear_tp_mult': 1.6736829759783272, 'bear_tsl_mult': 0.9235452531068262, 'bear_time_stop': 83, 'bear_use_sma': True, 'bear_use_ema': False, 'bear_use_atr': True, 'bear_use_adx': True, 'bear_use_spike': False, 'bear_rsi_required': True, 'sideways_strategy': 'breakout', 'sideways_bb_std_mult': 0.637125555513165, 'sideways_rsi_os': 5, 'sideways_rsi_ob': 69, 'sideways_adx_thresh': 19.194240215506962, 'sideways_atr_min_pct': 0.003320709576964429, 'sideways_atr_max_pct': 0.026418456294254176, 'sideways_tp_mult': 2.366524427296502, 'sideways_tsl_mult': 0.7585172276529656, 'sideways_time_stop': 109, 'sideways_use_sma': True, 'sideways_use_ema': True, 'sideways_use_atr': False, 'sideways_use_adx': True, 'sideways_use_spike': True, 'sideways_rsi_required': False}.
[I 2025-08-31 09:58:46,513] Trial 58 finished with values: [-1000000000.0, 1000000000.0] and parameters: {'p_sma': 9, 'p_std': 53, 'p_atr': 10, 'p_adx': 19, 'rsi_period': 81, 'ema1': 29, 'ema2': 25, 'slip_atr_k': 0.04858765832725291, 'slip_spread_k': 0.9096133643117963, 'spread_hl_frac': 0.015792811854580847, 'bb_std_mult': 3.241346797415173, 'rsi_os': 17, 'rsi_ob': 77, 'vol_spike': 0.11894021739538391, 'adx_thresh': 16.861321830857698, 'atr_min_pct': 0.023642036080319014, 'atr_max_pct': 0.08351092251092912, 'tp_mult': 1.432251599190963, 'tsl_mult': 0.00014597542203330632, 'strategy': 'breakout', 'time_stop': 40, 'use_sma': False, 'use_atr': True, 'use_adx': True, 'use_ema': True, 'use_spike': True, 'rsi_required': True, 'edge_k': 1.2312905463275323, 'edge_cap': 0.9487291211103027, 'bull_strategy': 'breakout', 'bull_bb_std_mult': 2.194854370143903, 'bull_rsi_os': 32, 'bull_rsi_ob': 81, 'bull_adx_thresh': 7.016485586045009, 'bull_atr_min_pct': 0.0035843892246683324, 'bull_atr_max_pct': 0.057077616144164206, 'bull_tp_mult': 2.7594837479008616, 'bull_tsl_mult': 0.7187643641512443, 'bull_time_stop': 17, 'bull_use_sma': True, 'bull_use_ema': False, 'bull_use_atr': False, 'bull_use_adx': True, 'bull_use_spike': False, 'bull_rsi_required': True, 'bear_strategy': 'mean_reversion', 'bear_bb_std_mult': 3.1260174748796157, 'bear_rsi_os': 24, 'bear_rsi_ob': 45, 'bear_adx_thresh': 7.329907981003818, 'bear_atr_min_pct': 0.027496577941634567, 'bear_atr_max_pct': 0.09063578646492618, 'bear_tp_mult': 1.1849882558880764, 'bear_tsl_mult': 0.2068335989535947, 'bear_time_stop': 8, 'bear_use_sma': True, 'bear_use_ema': False, 'bear_use_atr': True, 'bear_use_adx': False, 'bear_use_spike': False, 'bear_rsi_required': True, 'sideways_strategy': 'breakout', 'sideways_bb_std_mult': 0.6407421642224421, 'sideways_rsi_os': 5, 'sideways_rsi_ob': 90, 'sideways_adx_thresh': 29.66087568743916, 'sideways_atr_min_pct': 0.004926280229989472, 'sideways_atr_max_pct': 0.027994775554875284, 'sideways_tp_mult': 2.3425781910101424, 'sideways_tsl_mult': 0.7565906690856115, 'sideways_time_stop': 112, 'sideways_use_sma': True, 'sideways_use_ema': True, 'sideways_use_atr': False, 'sideways_use_adx': True, 'sideways_use_spike': True, 'sideways_rsi_required': False}.
[I 2025-08-31 09:58:46,805] Trial 62 finished with values: [-1000000000.0, 1000000000.0] and parameters: {'p_sma': 5, 'p_std': 9, 'p_atr': 30, 'p_adx': 24, 'rsi_period': 75, 'ema1': 24, 'ema2': 60, 'slip_atr_k': 0.2499201546604447, 'slip_spread_k': 0.9949020331384638, 'spread_hl_frac': 0.003907332768862647, 'bb_std_mult': 2.9892545581182373, 'rsi_os': 39, 'rsi_ob': 65, 'vol_spike': 0.2882096008046454, 'adx_thresh': 18.41571597904996, 'atr_min_pct': 0.02962940152766426, 'atr_max_pct': 0.02230056963956545, 'tp_mult': 1.027234996364561, 'tsl_mult': 0.09730964353407379, 'strategy': 'breakout', 'time_stop': 83, 'use_sma': True, 'use_atr': False, 'use_adx': True, 'use_ema': False, 'use_spike': False, 'rsi_required': False, 'edge_k': 1.775555157179634, 'edge_cap': 0.9065996603405779, 'bull_strategy': 'mean_reversion', 'bull_bb_std_mult': 2.971744855875255, 'bull_rsi_os': 27, 'bull_rsi_ob': 58, 'bull_adx_thresh': 34.61136004389733, 'bull_atr_min_pct': 7.457301783531754e-05, 'bull_atr_max_pct': 0.13398613915649132, 'bull_tp_mult': 2.9109987714375185, 'bull_tsl_mult': 0.5068984481194224, 'bull_time_stop': 78, 'bull_use_sma': False, 'bull_use_ema': True, 'bull_use_atr': True, 'bull_use_adx': False, 'bull_use_spike': False, 'bull_rsi_required': False, 'bear_strategy': 'breakout', 'bear_bb_std_mult': 1.7532175760870192, 'bear_rsi_os': 32, 'bear_rsi_ob': 57, 'bear_adx_thresh': 18.979570186587843, 'bear_atr_min_pct': 0.013343813199905786, 'bear_atr_max_pct': 0.12370746218319233, 'bear_tp_mult': 1.4222209532384216, 'bear_tsl_mult': 0.8011820763110378, 'bear_time_stop': 149, 'bear_use_sma': True, 'bear_use_ema': False, 'bear_use_atr': True, 'bear_use_adx': False, 'bear_use_spike': True, 'bear_rsi_required': False, 'sideways_strategy': 'mean_reversion', 'sideways_bb_std_mult': 0.9256409639997787, 'sideways_rsi_os': 31, 'sideways_rsi_ob': 51, 'sideways_adx_thresh': 8.308483876947719, 'sideways_atr_min_pct': 0.012237410688020242, 'sideways_atr_max_pct': 0.016181263194357375, 'sideways_tp_mult': 1.9151494910333136, 'sideways_tsl_mult': 0.8362989161617477, 'sideways_time_stop': 175, 'sideways_use_sma': False, 'sideways_use_ema': False, 'sideways_use_atr': True, 'sideways_use_adx': True, 'sideways_use_spike': False, 'sideways_rsi_required': True}.
[I 2025-08-31 09:59:16,648] Trial 59 finished with values: [-1000000000.0, 1000000000.0] and parameters: {'p_sma': 5, 'p_std': 50, 'p_atr': 26, 'p_adx': 7, 'rsi_period': 74, 'ema1': 29, 'ema2': 29, 'slip_atr_k': 0.24757045709217926, 'slip_spread_k': 0.21107105994858355, 'spread_hl_frac': 0.04031304652722313, 'bb_std_mult': 3.151810496759368, 'rsi_os': 12, 'rsi_ob': 76, 'vol_spike': 0.2334054927906542, 'adx_thresh': 32.92072884252855, 'atr_min_pct': 0.0298974622882196, 'atr_max_pct': 0.13378665597605732, 'tp_mult': 1.4665673591418442, 'tsl_mult': 0.10303497128927583, 'strategy': 'breakout', 'time_stop': 38, 'use_sma': True, 'use_atr': True, 'use_adx': True, 'use_ema': False, 'use_spike': True, 'rsi_required': True, 'edge_k': 0.31580847451486715, 'edge_cap': 0.9575177177920785, 'bull_strategy': 'breakout', 'bull_bb_std_mult': 2.9809118448301373, 'bull_rsi_os': 19, 'bull_rsi_ob': 82, 'bull_adx_thresh': 9.95591766570249, 'bull_atr_min_pct': 0.00018340988393652857, 'bull_atr_max_pct': 0.12628898667074512, 'bull_tp_mult': 2.423285291339934, 'bull_tsl_mult': 0.926827522227729, 'bull_time_stop': 24, 'bull_use_sma': True, 'bull_use_ema': False, 'bull_use_atr': False, 'bull_use_adx': True, 'bull_use_spike': False, 'bull_rsi_required': True, 'bear_strategy': 'mean_reversion', 'bear_bb_std_mult': 3.1856787154107407, 'bear_rsi_os': 8, 'bear_rsi_ob': 50, 'bear_adx_thresh': 17.76411822001183, 'bear_atr_min_pct': 0.02808865375700651, 'bear_atr_max_pct': 0.11090465634067911, 'bear_tp_mult': 1.7028736433184513, 'bear_tsl_mult': 0.37750976361671945, 'bear_time_stop': 81, 'bear_use_sma': True, 'bear_use_ema': False, 'bear_use_atr': True, 'bear_use_adx': False, 'bear_use_spike': True, 'bear_rsi_required': True, 'sideways_strategy': 'breakout', 'sideways_bb_std_mult': 1.6843880481971687, 'sideways_rsi_os': 55, 'sideways_rsi_ob': 69, 'sideways_adx_thresh': 8.961815661211672, 'sideways_atr_min_pct': 0.017257017592898778, 'sideways_atr_max_pct': 0.09057235492631374, 'sideways_tp_mult': 1.945642836176025, 'sideways_tsl_mult': 0.9201961519681445, 'sideways_time_stop': 93, 'sideways_use_sma': False, 'sideways_use_ema': False, 'sideways_use_atr': True, 'sideways_use_adx': True, 'sideways_use_spike': True, 'sideways_rsi_required': False}.
[I 2025-08-31 09:59:16,871] Trial 60 finished with values: [-0.0266619209530089, 0.026635432869769948] and parameters: {'p_sma': 10, 'p_std': 31, 'p_atr': 26, 'p_adx': 19, 'rsi_period': 75, 'ema1': 24, 'ema2': 29, 'slip_atr_k': 0.2485174529851623, 'slip_spread_k': 0.20931323989441109, 'spread_hl_frac': 0.04184782231445572, 'bb_std_mult': 3.171142077877665, 'rsi_os': 12, 'rsi_ob': 72, 'vol_spike': 0.2825868207795165, 'adx_thresh': 12.371503180291118, 'atr_min_pct': 0.029746606003812442, 'atr_max_pct': 0.09826812091340151, 'tp_mult': 1.02388677085125, 'tsl_mult': 0.09766793387246993, 'strategy': 'breakout', 'time_stop': 119, 'use_sma': True, 'use_atr': False, 'use_adx': True, 'use_ema': False, 'use_spike': True, 'rsi_required': True, 'edge_k': 1.2096104229277334, 'edge_cap': 0.9538411576823074, 'bull_strategy': 'mean_reversion', 'bull_bb_std_mult': 2.5717888300432827, 'bull_rsi_os': 23, 'bull_rsi_ob': 56, 'bull_adx_thresh': 10.427130121248116, 'bull_atr_min_pct': 6.577734641608282e-05, 'bull_atr_max_pct': 0.08121089831795839, 'bull_tp_mult': 2.5961895933696213, 'bull_tsl_mult': 0.7228345401967131, 'bull_time_stop': 27, 'bull_use_sma': True, 'bull_use_ema': False, 'bull_use_atr': False, 'bull_use_adx': False, 'bull_use_spike': False, 'bull_rsi_required': True, 'bear_strategy': 'mean_reversion', 'bear_bb_std_mult': 1.7662337437694489, 'bear_rsi_os': 23, 'bear_rsi_ob': 49, 'bear_adx_thresh': 18.069166055237936, 'bear_atr_min_pct': 0.024972373081431798, 'bear_atr_max_pct': 0.048285790352266045, 'bear_tp_mult': 1.4679059342414356, 'bear_tsl_mult': 0.9098327984611205, 'bear_time_stop': 273, 'bear_use_sma': True, 'bear_use_ema': False, 'bear_use_atr': True, 'bear_use_adx': False, 'bear_use_spike': True, 'bear_rsi_required': False, 'sideways_strategy': 'breakout', 'sideways_bb_std_mult': 1.9581646463842675, 'sideways_rsi_os': 11, 'sideways_rsi_ob': 89, 'sideways_adx_thresh': 9.710548407778468, 'sideways_atr_min_pct': 0.019903545042644924, 'sideways_atr_max_pct': 0.01640532108824436, 'sideways_tp_mult': 1.9189247072419147, 'sideways_tsl_mult': 0.7475397701605119, 'sideways_time_stop': 94, 'sideways_use_sma': False, 'sideways_use_ema': False, 'sideways_use_atr': True, 'sideways_use_adx': True, 'sideways_use_spike': True, 'sideways_rsi_required': False}.
[I 2025-08-31 09:59:17,134] Trial 61 finished with values: [-1000000000.0, 1000000000.0] and parameters: {'p_sma': 5, 'p_std': 48, 'p_atr': 9, 'p_adx': 7, 'rsi_period': 75, 'ema1': 27, 'ema2': 29, 'slip_atr_k': 0.2478955840177863, 'slip_spread_k': 0.9798640042413841, 'spread_hl_frac': 0.004104536413893682, 'bb_std_mult': 3.108946025146071, 'rsi_os': 16, 'rsi_ob': 65, 'vol_spike': 0.2996954165890907, 'adx_thresh': 16.46385834479988, 'atr_min_pct': 0.029924730685785716, 'atr_max_pct': 0.09868628504810859, 'tp_mult': 2.1589171988240823, 'tsl_mult': 0.10820317464109348, 'strategy': 'breakout', 'time_stop': 194, 'use_sma': True, 'use_atr': False, 'use_adx': True, 'use_ema': False, 'use_spike': True, 'rsi_required': True, 'edge_k': 1.2087717825809354, 'edge_cap': 0.949914675166595, 'bull_strategy': 'mean_reversion', 'bull_bb_std_mult': 2.563200989326518, 'bull_rsi_os': 23, 'bull_rsi_ob': 88, 'bull_adx_thresh': 14.898397203979084, 'bull_atr_min_pct': 0.028196704340259872, 'bull_atr_max_pct': 0.13110733310390876, 'bull_tp_mult': 2.428588589711325, 'bull_tsl_mult': 0.5047679192488795, 'bull_time_stop': 26, 'bull_use_sma': True, 'bull_use_ema': False, 'bull_use_atr': True, 'bull_use_adx': False, 'bull_use_spike': False, 'bull_rsi_required': True, 'bear_strategy': 'mean_reversion', 'bear_bb_std_mult': 3.0487307916992115, 'bear_rsi_os': 25, 'bear_rsi_ob': 57, 'bear_adx_thresh': 7.306584901984249, 'bear_atr_min_pct': 0.025116525522369506, 'bear_atr_max_pct': 0.04684394278962488, 'bear_tp_mult': 1.4405374589046518, 'bear_tsl_mult': 0.3816217545052799, 'bear_time_stop': 267, 'bear_use_sma': True, 'bear_use_ema': False, 'bear_use_atr': True, 'bear_use_adx': False, 'bear_use_spike': True, 'bear_rsi_required': False, 'sideways_strategy': 'breakout', 'sideways_bb_std_mult': 1.9144692902866998, 'sideways_rsi_os': 30, 'sideways_rsi_ob': 47, 'sideways_adx_thresh': 9.487304468603801, 'sideways_atr_min_pct': 0.016861768561684823, 'sideways_atr_max_pct': 0.017488178334426233, 'sideways_tp_mult': 1.1677649222743063, 'sideways_tsl_mult': 0.9152094388074933, 'sideways_time_stop': 258, 'sideways_use_sma': False, 'sideways_use_ema': False, 'sideways_use_atr': True, 'sideways_use_adx': True, 'sideways_use_spike': True, 'sideways_rsi_required': True}.
