[I 2025-08-31 11:40:22,996] Trial 838 finished with values: [-1000000000.0, 1000000000.0] and parameters: {'p_sma': 35, 'p_std': 8, 'p_atr': 28, 'p_adx': 20, 'rsi_period': 35, 'ema1': 5, 'ema2': 16, 'slip_atr_k': 0.007248094945155912, 'slip_spread_k': 0.4648449586506499, 'spread_hl_frac': 0.02274965524904825, 'bb_std_mult': 2.2743368672426523, 'rsi_os': 31, 'rsi_ob': 89, 'vol_spike': 0.151503918801323, 'adx_thresh': 9.933726511974522, 'atr_min_pct': 0.021277183713357704, 'atr_max_pct': 0.055689879620248864, 'tp_mult': 2.896469218660653, 'tsl_mult': 0.831069179435574, 'strategy': 'breakout', 'time_stop': 245, 'use_sma': True, 'use_atr': True, 'use_adx': False, 'use_ema': True, 'use_spike': False, 'rsi_required': False, 'edge_k': 1.9169823353703834, 'edge_cap': 0.3565196179728709, 'bull_strategy': 'mean_reversion', 'bull_bb_std_mult': 2.43109746847276, 'bull_rsi_os': 48, 'bull_rsi_ob': 62, 'bull_adx_thresh': 28.854072378454013, 'bull_atr_min_pct': 0.014485212991297807, 'bull_atr_max_pct': 0.0525710450835891, 'bull_tp_mult': 2.855493197501421, 'bull_tsl_mult': 0.26262650091010553, 'bull_time_stop': 65, 'bull_use_sma': False, 'bull_use_ema': True, 'bull_use_atr': False, 'bull_use_adx': True, 'bull_use_spike': False, 'bull_rsi_required': False, 'bear_strategy': 'mean_reversion', 'bear_bb_std_mult': 1.5243151528638075, 'bear_rsi_os': 53, 'bear_rsi_ob': 55, 'bear_adx_thresh': 12.401192127321757, 'bear_atr_min_pct': 0.027058287535559656, 'bear_atr_max_pct': 0.1351316701606314, 'bear_tp_mult': 2.9555332986378984, 'bear_tsl_mult': 0.9456538741578598, 'bear_time_stop': 133, 'bear_use_sma': False, 'bear_use_ema': False, 'bear_use_atr': True, 'bear_use_adx': False, 'bear_use_spike': True, 'bear_rsi_required': False, 'sideways_strategy': 'mean_reversion', 'sideways_bb_std_mult': 1.0438584920837413, 'sideways_rsi_os': 37, 'sideways_rsi_ob': 80, 'sideways_adx_thresh': 24.082314235442134, 'sideways_atr_min_pct': 0.0193220855718318, 'sideways_atr_max_pct': 0.13299318202561353, 'sideways_tp_mult': 1.5523125255127603, 'sideways_tsl_mult': 0.9567734482411738, 'sideways_time_stop': 163, 'sideways_use_sma': True, 'sideways_use_ema': True, 'sideways_use_atr': False, 'sideways_use_adx': False, 'sideways_use_spike': True, 'sideways_rsi_required': False}.
[I 2025-08-31 11:40:23,330] Trial 839 finished with values: [-1000000000.0, 1000000000.0] and parameters: {'p_sma': 36, 'p_std': 18, 'p_atr': 28, 'p_adx': 20, 'rsi_period': 80, 'ema1': 5, 'ema2': 16, 'slip_atr_k': 0.007566348742518833, 'slip_spread_k': 0.47027691099180136, 'spread_hl_frac': 0.022995653406656276, 'bb_std_mult': 1.4743157943460972, 'rsi_os': 31, 'rsi_ob': 88, 'vol_spike': 0.11015457515795882, 'adx_thresh': 9.565075489907173, 'atr_min_pct': 0.008603123327049798, 'atr_max_pct': 0.05586963219877329, 'tp_mult': 2.959040002799077, 'tsl_mult': 0.8401271062791076, 'strategy': 'breakout', 'time_stop': 45, 'use_sma': True, 'use_atr': True, 'use_adx': False, 'use_ema': True, 'use_spike': False, 'rsi_required': False, 'edge_k': 1.096967210259445, 'edge_cap': 0.7811887142059639, 'bull_strategy': 'mean_reversion', 'bull_bb_std_mult': 1.7170287948179104, 'bull_rsi_os': 43, 'bull_rsi_ob': 62, 'bull_adx_thresh': 19.357030330571078, 'bull_atr_min_pct': 0.009617737870669227, 'bull_atr_max_pct': 0.03985252351659558, 'bull_tp_mult': 2.865987019271341, 'bull_tsl_mult': 0.9192106803154527, 'bull_time_stop': 55, 'bull_use_sma': False, 'bull_use_ema': True, 'bull_use_atr': False, 'bull_use_adx': True, 'bull_use_spike': False, 'bull_rsi_required': False, 'bear_strategy': 'mean_reversion', 'bear_bb_std_mult': 1.494395951844462, 'bear_rsi_os': 12, 'bear_rsi_ob': 55, 'bear_adx_thresh': 12.062353552595027, 'bear_atr_min_pct': 0.010170083836335914, 'bear_atr_max_pct': 0.13572402049692672, 'bear_tp_mult': 2.839788535025292, 'bear_tsl_mult': 0.9541521470630508, 'bear_time_stop': 168, 'bear_use_sma': False, 'bear_use_ema': False, 'bear_use_atr': True, 'bear_use_adx': False, 'bear_use_spike': True, 'bear_rsi_required': False, 'sideways_strategy': 'mean_reversion', 'sideways_bb_std_mult': 1.0311809167131611, 'sideways_rsi_os': 37, 'sideways_rsi_ob': 59, 'sideways_adx_thresh': 26.342586028810334, 'sideways_atr_min_pct': 0.005985923421747793, 'sideways_atr_max_pct': 0.09761723423408164, 'sideways_tp_mult': 2.8321735578181273, 'sideways_tsl_mult': 0.8664312972554751, 'sideways_time_stop': 167, 'sideways_use_sma': True, 'sideways_use_ema': True, 'sideways_use_atr': False, 'sideways_use_adx': False, 'sideways_use_spike': True, 'sideways_rsi_required': False}.
[I 2025-08-31 11:40:23,482] Trial 837 finished with values: [-1000000000.0, 1000000000.0] and parameters: {'p_sma': 35, 'p_std': 6, 'p_atr': 28, 'p_adx': 20, 'rsi_period': 39, 'ema1': 20, 'ema2': 31, 'slip_atr_k': 0.007363781211206777, 'slip_spread_k': 0.4640187893362935, 'spread_hl_frac': 0.02477489186485676, 'bb_std_mult': 2.2946786240047192, 'rsi_os': 31, 'rsi_ob': 89, 'vol_spike': 0.07604627698664305, 'adx_thresh': 19.292101482712543, 'atr_min_pct': 0.021262928754409664, 'atr_max_pct': 0.1072360749950256, 'tp_mult': 2.9045991954874704, 'tsl_mult': 0.5282898628999285, 'strategy': 'breakout', 'time_stop': 34, 'use_sma': True, 'use_atr': True, 'use_adx': False, 'use_ema': True, 'use_spike': False, 'rsi_required': False, 'edge_k': 1.417991024057643, 'edge_cap': 0.7700668085647828, 'bull_strategy': 'mean_reversion', 'bull_bb_std_mult': 2.649925402506049, 'bull_rsi_os': 48, 'bull_rsi_ob': 50, 'bull_adx_thresh': 29.093508498458263, 'bull_atr_min_pct': 0.013761530083125657, 'bull_atr_max_pct': 0.05397540581192674, 'bull_tp_mult': 2.8432191454162563, 'bull_tsl_mult': 0.2611854136765867, 'bull_time_stop': 58, 'bull_use_sma': False, 'bull_use_ema': True, 'bull_use_atr': False, 'bull_use_adx': True, 'bull_use_spike': False, 'bull_rsi_required': False, 'bear_strategy': 'mean_reversion', 'bear_bb_std_mult': 1.3318952452196804, 'bear_rsi_os': 53, 'bear_rsi_ob': 55, 'bear_adx_thresh': 12.590494107917989, 'bear_atr_min_pct': 0.02315694969027857, 'bear_atr_max_pct': 0.1420873584365974, 'bear_tp_mult': 2.7416256212990926, 'bear_tsl_mult': 0.8996980411882816, 'bear_time_stop': 220, 'bear_use_sma': False, 'bear_use_ema': False, 'bear_use_atr': True, 'bear_use_adx': False, 'bear_use_spike': True, 'bear_rsi_required': False, 'sideways_strategy': 'mean_reversion', 'sideways_bb_std_mult': 1.0415599368195514, 'sideways_rsi_os': 38, 'sideways_rsi_ob': 75, 'sideways_adx_thresh': 24.023530684485806, 'sideways_atr_min_pct': 0.005678994209964332, 'sideways_atr_max_pct': 0.08121394107892643, 'sideways_tp_mult': 1.5326493821284444, 'sideways_tsl_mult': 0.8904157387289191, 'sideways_time_stop': 141, 'sideways_use_sma': True, 'sideways_use_ema': True, 'sideways_use_atr': False, 'sideways_use_adx': False, 'sideways_use_spike': True, 'sideways_rsi_required': False}.
[I 2025-08-31 11:40:23,659] Trial 840 finished with values: [-1000000000.0, 1000000000.0] and parameters: {'p_sma': 35, 'p_std': 43, 'p_atr': 28, 'p_adx': 20, 'rsi_period': 38, 'ema1': 5, 'ema2': 23, 'slip_atr_k': 0.006566904183345197, 'slip_spread_k': 0.4839312199690767, 'spread_hl_frac': 0.02263342011944396, 'bb_std_mult': 2.1672247697659692, 'rsi_os': 31, 'rsi_ob': 88, 'vol_spike': 0.07757521542456108, 'adx_thresh': 9.941343655983305, 'atr_min_pct': 0.023529825106039567, 'atr_max_pct': 0.1069780743521773, 'tp_mult': 2.9997580399645836, 'tsl_mult': 0.06937716693462447, 'strategy': 'breakout', 'time_stop': 45, 'use_sma': True, 'use_atr': True, 'use_adx': False, 'use_ema': True, 'use_spike': False, 'rsi_required': False, 'edge_k': 1.5959707516159223, 'edge_cap': 0.7853369269552231, 'bull_strategy': 'mean_reversion', 'bull_bb_std_mult': 1.780468317796411, 'bull_rsi_os': 50, 'bull_rsi_ob': 62, 'bull_adx_thresh': 29.09567498390392, 'bull_atr_min_pct': 0.009773200423817215, 'bull_atr_max_pct': 0.04124302403127185, 'bull_tp_mult': 2.900824837833325, 'bull_tsl_mult': 0.24745258024388675, 'bull_time_stop': 62, 'bull_use_sma': False, 'bull_use_ema': True, 'bull_use_atr': False, 'bull_use_adx': True, 'bull_use_spike': False, 'bull_rsi_required': False, 'bear_strategy': 'mean_reversion', 'bear_bb_std_mult': 1.4757247530205546, 'bear_rsi_os': 12, 'bear_rsi_ob': 55, 'bear_adx_thresh': 12.114183036920208, 'bear_atr_min_pct': 0.026712352531539734, 'bear_atr_max_pct': 0.13448944111625408, 'bear_tp_mult': 2.690534189959594, 'bear_tsl_mult': 0.948548404919328, 'bear_time_stop': 132, 'bear_use_sma': False, 'bear_use_ema': False, 'bear_use_atr': True, 'bear_use_adx': False, 'bear_use_spike': True, 'bear_rsi_required': False, 'sideways_strategy': 'mean_reversion', 'sideways_bb_std_mult': 2.886511344905955, 'sideways_rsi_os': 37, 'sideways_rsi_ob': 67, 'sideways_adx_thresh': 26.48375308982919, 'sideways_atr_min_pct': 0.006948218477469029, 'sideways_atr_max_pct': 0.10838840043591445, 'sideways_tp_mult': 1.535266249654445, 'sideways_tsl_mult': 0.8586350071224235, 'sideways_time_stop': 163, 'sideways_use_sma': True, 'sideways_use_ema': True, 'sideways_use_atr': False, 'sideways_use_adx': False, 'sideways_use_spike': True, 'sideways_rsi_required': False}.
[I 2025-08-31 11:41:01,509] Trial 844 finished with values: [-1000000000.0, 1000000000.0] and parameters: {'p_sma': 35, 'p_std': 15, 'p_atr': 13, 'p_adx': 19, 'rsi_period': 33, 'ema1': 6, 'ema2': 38, 'slip_atr_k': 0.020974500991095216, 'slip_spread_k': 0.1021043682226575, 'spread_hl_frac': 0.020311280988459614, 'bb_std_mult': 3.2605486567604016, 'rsi_os': 31, 'rsi_ob': 87, 'vol_spike': 0.29234951606826337, 'adx_thresh': 11.145016346114915, 'atr_min_pct': 0.021937287080522942, 'atr_max_pct': 0.06794153144369453, 'tp_mult': 2.8603499451872785, 'tsl_mult': 0.4854205782324743, 'strategy': 'breakout', 'time_stop': 70, 'use_sma': True, 'use_atr': True, 'use_adx': False, 'use_ema': True, 'use_spike': False, 'rsi_required': False, 'edge_k': 1.5146575206510526, 'edge_cap': 0.8849126635686747, 'bull_strategy': 'mean_reversion', 'bull_bb_std_mult': 2.1852236473756426, 'bull_rsi_os': 45, 'bull_rsi_ob': 63, 'bull_adx_thresh': 26.72104911704243, 'bull_atr_min_pct': 0.021744520768413184, 'bull_atr_max_pct': 0.12396738205516289, 'bull_tp_mult': 2.9187441887453334, 'bull_tsl_mult': 0.2303327033196741, 'bull_time_stop': 78, 'bull_use_sma': False, 'bull_use_ema': True, 'bull_use_atr': False, 'bull_use_adx': True, 'bull_use_spike': False, 'bull_rsi_required': True, 'bear_strategy': 'mean_reversion', 'bear_bb_std_mult': 1.7046304143637019, 'bear_rsi_os': 54, 'bear_rsi_ob': 51, 'bear_adx_thresh': 11.24020435232778, 'bear_atr_min_pct': 0.0027096137559533885, 'bear_atr_max_pct': 0.10233497770300368, 'bear_tp_mult': 2.787988611303358, 'bear_tsl_mult': 0.9243325361464093, 'bear_time_stop': 115, 'bear_use_sma': False, 'bear_use_ema': True, 'bear_use_atr': True, 'bear_use_adx': False, 'bear_use_spike': False, 'bear_rsi_required': False, 'sideways_strategy': 'mean_reversion', 'sideways_bb_std_mult': 1.1824954080588586, 'sideways_rsi_os': 44, 'sideways_rsi_ob': 61, 'sideways_adx_thresh': 22.68191968785197, 'sideways_atr_min_pct': 0.00370093123175022, 'sideways_atr_max_pct': 0.10757596934046074, 'sideways_tp_mult': 1.6636563056348515, 'sideways_tsl_mult': 0.8069809123845386, 'sideways_time_stop': 41, 'sideways_use_sma': True, 'sideways_use_ema': True, 'sideways_use_atr': False, 'sideways_use_adx': False, 'sideways_use_spike': False, 'sideways_rsi_required': False}.
[I 2025-08-31 11:41:01,510] Trial 841 finished with values: [-1000000000.0, 1000000000.0] and parameters: {'p_sma': 35, 'p_std': 19, 'p_atr': 28, 'p_adx': 20, 'rsi_period': 39, 'ema1': 6, 'ema2': 54, 'slip_atr_k': 0.0196995512636894, 'slip_spread_k': 0.4291207745527951, 'spread_hl_frac': 0.021360305909476133, 'bb_std_mult': 0.9408960918521687, 'rsi_os': 31, 'rsi_ob': 88, 'vol_spike': 0.10928141531486663, 'adx_thresh': 10.900213066246978, 'atr_min_pct': 0.008663373091778965, 'atr_max_pct': 0.024106455054939628, 'tp_mult': 1.2385281113748592, 'tsl_mult': 0.21317236578001403, 'strategy': 'breakout', 'time_stop': 31, 'use_sma': True, 'use_atr': True, 'use_adx': False, 'use_ema': True, 'use_spike': False, 'rsi_required': False, 'edge_k': 1.592614218754764, 'edge_cap': 0.5085345659924557, 'bull_strategy': 'mean_reversion', 'bull_bb_std_mult': 1.7437256330477828, 'bull_rsi_os': 47, 'bull_rsi_ob': 62, 'bull_adx_thresh': 19.283650407331056, 'bull_atr_min_pct': 0.012289864128367259, 'bull_atr_max_pct': 0.04082782657801788, 'bull_tp_mult': 2.908883935778558, 'bull_tsl_mult': 0.921661566138315, 'bull_time_stop': 58, 'bull_use_sma': False, 'bull_use_ema': True, 'bull_use_atr': False, 'bull_use_adx': True, 'bull_use_spike': False, 'bull_rsi_required': False, 'bear_strategy': 'mean_reversion', 'bear_bb_std_mult': 1.4638378636750873, 'bear_rsi_os': 34, 'bear_rsi_ob': 55, 'bear_adx_thresh': 11.732752800359467, 'bear_atr_min_pct': 0.010390656038635603, 'bear_atr_max_pct': 0.13411494943736482, 'bear_tp_mult': 2.703502358056933, 'bear_tsl_mult': 0.8223062694850958, 'bear_time_stop': 171, 'bear_use_sma': False, 'bear_use_ema': False, 'bear_use_atr': True, 'bear_use_adx': False, 'bear_use_spike': True, 'bear_rsi_required': False, 'sideways_strategy': 'mean_reversion', 'sideways_bb_std_mult': 1.1837316658449524, 'sideways_rsi_os': 37, 'sideways_rsi_ob': 59, 'sideways_adx_thresh': 22.32269072715428, 'sideways_atr_min_pct': 0.0045422357056507075, 'sideways_atr_max_pct': 0.0809436397515516, 'sideways_tp_mult': 2.8200981167442594, 'sideways_tsl_mult': 0.855651932300624, 'sideways_time_stop': 229, 'sideways_use_sma': True, 'sideways_use_ema': True, 'sideways_use_atr': False, 'sideways_use_adx': False, 'sideways_use_spike': True, 'sideways_rsi_required': False}.
[I 2025-08-31 11:41:01,848] Trial 843 finished with values: [0.0025813822314559864, 0.0055751057485059425] and parameters: {'p_sma': 35, 'p_std': 15, 'p_atr': 28, 'p_adx': 16, 'rsi_period': 33, 'ema1': 6, 'ema2': 54, 'slip_atr_k': 0.019526797605064556, 'slip_spread_k': 0.42211476020219824, 'spread_hl_frac': 0.020372885601535756, 'bb_std_mult': 0.7919523012570279, 'rsi_os': 31, 'rsi_ob': 88, 'vol_spike': 0.0814287622740518, 'adx_thresh': 10.804586333486357, 'atr_min_pct': 0.022069463505945807, 'atr_max_pct': 0.10385644149000925, 'tp_mult': 1.2545077567636427, 'tsl_mult': 0.0608217374044149, 'strategy': 'breakout', 'time_stop': 70, 'use_sma': True, 'use_atr': True, 'use_adx': False, 'use_ema': True, 'use_spike': False, 'rsi_required': False, 'edge_k': 1.5904241879200949, 'edge_cap': 0.6975688711288885, 'bull_strategy': 'mean_reversion', 'bull_bb_std_mult': 2.1856142682965456, 'bull_rsi_os': 45, 'bull_rsi_ob': 63, 'bull_adx_thresh': 26.92230681597431, 'bull_atr_min_pct': 0.0265676241600008, 'bull_atr_max_pct': 0.02874250900566451, 'bull_tp_mult': 2.9216939559737596, 'bull_tsl_mult': 0.23454684456301467, 'bull_time_stop': 86, 'bull_use_sma': False, 'bull_use_ema': True, 'bull_use_atr': False, 'bull_use_adx': True, 'bull_use_spike': False, 'bull_rsi_required': False, 'bear_strategy': 'mean_reversion', 'bear_bb_std_mult': 1.4486766281535184, 'bear_rsi_os': 35, 'bear_rsi_ob': 51, 'bear_adx_thresh': 15.140900859091715, 'bear_atr_min_pct': 0.004238842568392706, 'bear_atr_max_pct': 0.132876542762899, 'bear_tp_mult': 2.6885627641412277, 'bear_tsl_mult': 0.8173785609425501, 'bear_time_stop': 116, 'bear_use_sma': False, 'bear_use_ema': False, 'bear_use_atr': True, 'bear_use_adx': False, 'bear_use_spike': True, 'bear_rsi_required': False, 'sideways_strategy': 'mean_reversion', 'sideways_bb_std_mult': 1.1858804050861997, 'sideways_rsi_os': 40, 'sideways_rsi_ob': 61, 'sideways_adx_thresh': 25.498344670692532, 'sideways_atr_min_pct': 0.004511899558844066, 'sideways_atr_max_pct': 0.07312584381016878, 'sideways_tp_mult': 1.619431034483707, 'sideways_tsl_mult': 0.8614074915233799, 'sideways_time_stop': 204, 'sideways_use_sma': True, 'sideways_use_ema': True, 'sideways_use_atr': False, 'sideways_use_adx': False, 'sideways_use_spike': True, 'sideways_rsi_required': False}.
[I 2025-08-31 11:41:01,952] Trial 842 finished with values: [-1000000000.0, 1000000000.0] and parameters: {'p_sma': 35, 'p_std': 46, 'p_atr': 28, 'p_adx': 20, 'rsi_period': 39, 'ema1': 6, 'ema2': 54, 'slip_atr_k': 0.019800438527707288, 'slip_spread_k': 0.4283134549769898, 'spread_hl_frac': 0.021070645729571787, 'bb_std_mult': 0.7545723662472957, 'rsi_os': 31, 'rsi_ob': 88, 'vol_spike': 0.12450250286487746, 'adx_thresh': 10.992553780058197, 'atr_min_pct': 0.02366510513753472, 'atr_max_pct': 0.1339954586663954, 'tp_mult': 2.8214159475411815, 'tsl_mult': 0.05410363960985148, 'strategy': 'breakout', 'time_stop': 55, 'use_sma': True, 'use_atr': True, 'use_adx': False, 'use_ema': True, 'use_spike': False, 'rsi_required': False, 'edge_k': 1.594648859026191, 'edge_cap': 0.7638949083732991, 'bull_strategy': 'mean_reversion', 'bull_bb_std_mult': 1.741389655085814, 'bull_rsi_os': 30, 'bull_rsi_ob': 63, 'bull_adx_thresh': 26.77907098767778, 'bull_atr_min_pct': 0.02654721643940705, 'bull_atr_max_pct': 0.029176820106087582, 'bull_tp_mult': 2.9146663192397266, 'bull_tsl_mult': 0.23718398071499722, 'bull_time_stop': 86, 'bull_use_sma': False, 'bull_use_ema': True, 'bull_use_atr': False, 'bull_use_adx': True, 'bull_use_spike': False, 'bull_rsi_required': False, 'bear_strategy': 'mean_reversion', 'bear_bb_std_mult': 1.2846524024003974, 'bear_rsi_os': 17, 'bear_rsi_ob': 55, 'bear_adx_thresh': 15.498441566623864, 'bear_atr_min_pct': 0.0030354804747636543, 'bear_atr_max_pct': 0.13327662427974615, 'bear_tp_mult': 2.689068024762536, 'bear_tsl_mult': 0.8273747363009004, 'bear_time_stop': 117, 'bear_use_sma': False, 'bear_use_ema': False, 'bear_use_atr': True, 'bear_use_adx': False, 'bear_use_spike': True, 'bear_rsi_required': False, 'sideways_strategy': 'mean_reversion', 'sideways_bb_std_mult': 0.9367782099224441, 'sideways_rsi_os': 40, 'sideways_rsi_ob': 67, 'sideways_adx_thresh': 25.280458953373664, 'sideways_atr_min_pct': 0.007031280199067033, 'sideways_atr_max_pct': 0.027656595931388146, 'sideways_tp_mult': 1.5393994316185422, 'sideways_tsl_mult': 0.5172613954931766, 'sideways_time_stop': 20, 'sideways_use_sma': True, 'sideways_use_ema': True, 'sideways_use_atr': False, 'sideways_use_adx': False, 'sideways_use_spike': True, 'sideways_rsi_required': False}.
[I 2025-08-31 11:41:40,408] Trial 847 finished with values: [-1000000000.0, 1000000000.0] and parameters: {'p_sma': 34, 'p_std': 13, 'p_atr': 29, 'p_adx': 23, 'rsi_period': 34, 'ema1': 18, 'ema2': 19, 'slip_atr_k': 0.16410923077155906, 'slip_spread_k': 0.868929612491861, 'spread_hl_frac': 0.031911678685722616, 'bb_std_mult': 0.6259548193408474, 'rsi_os': 30, 'rsi_ob': 78, 'vol_spike': 0.2449422796895397, 'adx_thresh': 23.666573475547384, 'atr_min_pct': 0.010626049990932189, 'atr_max_pct': 0.0819675901217054, 'tp_mult': 2.9256893447043373, 'tsl_mult': 0.028268911418574974, 'strategy': 'breakout', 'time_stop': 10, 'use_sma': True, 'use_atr': True, 'use_adx': True, 'use_ema': True, 'use_spike': True, 'rsi_required': True, 'edge_k': 0.7085229784012499, 'edge_cap': 0.8184545123400666, 'bull_strategy': 'mean_reversion', 'bull_bb_std_mult': 2.0899652928436967, 'bull_rsi_os': 9, 'bull_rsi_ob': 60, 'bull_adx_thresh': 28.499802379994392, 'bull_atr_min_pct': 0.012185589781598697, 'bull_atr_max_pct': 0.09548241137324626, 'bull_tp_mult': 2.476856060826522, 'bull_tsl_mult': 0.19389466078009154, 'bull_time_stop': 44, 'bull_use_sma': True, 'bull_use_ema': False, 'bull_use_atr': True, 'bull_use_adx': False, 'bull_use_spike': False, 'bull_rsi_required': True, 'bear_strategy': 'mean_reversion', 'bear_bb_std_mult': 1.5743676432114109, 'bear_rsi_os': 49, 'bear_rsi_ob': 52, 'bear_adx_thresh': 10.39665492239518, 'bear_atr_min_pct': 0.0039422370499488085, 'bear_atr_max_pct': 0.12945805140616362, 'bear_tp_mult': 2.638082234324814, 'bear_tsl_mult': 0.8871265692308231, 'bear_time_stop': 100, 'bear_use_sma': True, 'bear_use_ema': True, 'bear_use_atr': False, 'bear_use_adx': True, 'bear_use_spike': False, 'bear_rsi_required': False, 'sideways_strategy': 'breakout', 'sideways_bb_std_mult': 3.3802045346828886, 'sideways_rsi_os': 47, 'sideways_rsi_ob': 62, 'sideways_adx_thresh': 27.65137762683487, 'sideways_atr_min_pct': 0.005195159166314451, 'sideways_atr_max_pct': 0.09321107871483297, 'sideways_tp_mult': 1.6211118841260084, 'sideways_tsl_mult': 0.8489735385146452, 'sideways_time_stop': 155, 'sideways_use_sma': False, 'sideways_use_ema': True, 'sideways_use_atr': True, 'sideways_use_adx': True, 'sideways_use_spike': False, 'sideways_rsi_required': False}.
