[I 2025-08-31 11:32:21,519] Trial 785 finished with values: [-0.04006396329044837, 0.040103049045186294] and parameters: {'p_sma': 31, 'p_std': 52, 'p_atr': 28, 'p_adx': 18, 'rsi_period': 7, 'ema1': 14, 'ema2': 33, 'slip_atr_k': 0.016700093302666245, 'slip_spread_k': 0.44599902471503866, 'spread_hl_frac': 0.0065940093928189315, 'bb_std_mult': 0.6584207677992242, 'rsi_os': 53, 'rsi_ob': 87, 'vol_spike': 0.05631917435409275, 'adx_thresh': 10.90841310825447, 'atr_min_pct': 0.025147913278314817, 'atr_max_pct': 0.0927582430763073, 'tp_mult': 2.937179063042148, 'tsl_mult': 0.08947636311112514, 'strategy': 'breakout', 'time_stop': 64, 'use_sma': True, 'use_atr': True, 'use_adx': False, 'use_ema': True, 'use_spike': False, 'rsi_required': False, 'edge_k': 1.4381192745244884, 'edge_cap': 0.4280595365733064, 'bull_strategy': 'mean_reversion', 'bull_bb_std_mult': 2.829134276333069, 'bull_rsi_os': 38, 'bull_rsi_ob': 50, 'bull_adx_thresh': 28.535063923084373, 'bull_atr_min_pct': 0.02150274026828946, 'bull_atr_max_pct': 0.03536051281703564, 'bull_tp_mult': 2.8163619547495213, 'bull_tsl_mult': 0.2723705752656754, 'bull_time_stop': 48, 'bull_use_sma': False, 'bull_use_ema': True, 'bull_use_atr': True, 'bull_use_adx': True, 'bull_use_spike': False, 'bull_rsi_required': False, 'bear_strategy': 'mean_reversion', 'bear_bb_std_mult': 0.6701906943231708, 'bear_rsi_os': 54, 'bear_rsi_ob': 86, 'bear_adx_thresh': 22.878704164285743, 'bear_atr_min_pct': 7.419486549277259e-05, 'bear_atr_max_pct': 0.13006779486503525, 'bear_tp_mult': 2.6907522027038646, 'bear_tsl_mult': 0.8788746936565182, 'bear_time_stop': 87, 'bear_use_sma': False, 'bear_use_ema': False, 'bear_use_atr': False, 'bear_use_adx': False, 'bear_use_spike': True, 'bear_rsi_required': False, 'sideways_strategy': 'mean_reversion', 'sideways_bb_std_mult': 1.0819327905677696, 'sideways_rsi_os': 30, 'sideways_rsi_ob': 72, 'sideways_adx_thresh': 33.875383139609596, 'sideways_atr_min_pct': 0.0064110130007687775, 'sideways_atr_max_pct': 0.08869211437538516, 'sideways_tp_mult': 1.5467339571833425, 'sideways_tsl_mult': 0.8325289430019592, 'sideways_time_stop': 166, 'sideways_use_sma': True, 'sideways_use_ema': True, 'sideways_use_atr': False, 'sideways_use_adx': False, 'sideways_use_spike': True, 'sideways_rsi_required': False}.
[I 2025-08-31 11:32:22,146] Trial 783 finished with values: [-1000000000.0, 1000000000.0] and parameters: {'p_sma': 54, 'p_std': 18, 'p_atr': 28, 'p_adx': 23, 'rsi_period': 35, 'ema1': 27, 'ema2': 45, 'slip_atr_k': 0.009736022849599554, 'slip_spread_k': 0.9289236292556226, 'spread_hl_frac': 0.0200460866549154, 'bb_std_mult': 1.5539282818307067, 'rsi_os': 32, 'rsi_ob': 85, 'vol_spike': 0.15553297442108124, 'adx_thresh': 15.874292144381101, 'atr_min_pct': 0.021336766798963448, 'atr_max_pct': 0.1451293067158917, 'tp_mult': 2.896578744312721, 'tsl_mult': 0.16979171384038022, 'strategy': 'breakout', 'time_stop': 227, 'use_sma': True, 'use_atr': True, 'use_adx': False, 'use_ema': True, 'use_spike': False, 'rsi_required': False, 'edge_k': 1.4634128464342966, 'edge_cap': 0.7189291353520254, 'bull_strategy': 'mean_reversion', 'bull_bb_std_mult': 1.2360391423167367, 'bull_rsi_os': 51, 'bull_rsi_ob': 59, 'bull_adx_thresh': 7.509658715386404, 'bull_atr_min_pct': 0.024196384850763496, 'bull_atr_max_pct': 0.035577841844480505, 'bull_tp_mult': 2.3867210729688977, 'bull_tsl_mult': 0.28196684797858884, 'bull_time_stop': 56, 'bull_use_sma': False, 'bull_use_ema': True, 'bull_use_atr': False, 'bull_use_adx': True, 'bull_use_spike': False, 'bull_rsi_required': False, 'bear_strategy': 'mean_reversion', 'bear_bb_std_mult': 2.730972797469872, 'bear_rsi_os': 9, 'bear_rsi_ob': 80, 'bear_adx_thresh': 25.039076600582113, 'bear_atr_min_pct': 0.014154080466753116, 'bear_atr_max_pct': 0.027529940627434038, 'bear_tp_mult': 2.769739749243244, 'bear_tsl_mult': 0.8666744817186297, 'bear_time_stop': 253, 'bear_use_sma': False, 'bear_use_ema': False, 'bear_use_atr': True, 'bear_use_adx': False, 'bear_use_spike': True, 'bear_rsi_required': False, 'sideways_strategy': 'mean_reversion', 'sideways_bb_std_mult': 1.1105981079654845, 'sideways_rsi_os': 38, 'sideways_rsi_ob': 64, 'sideways_adx_thresh': 27.820805801095982, 'sideways_atr_min_pct': 0.005433416974557878, 'sideways_atr_max_pct': 0.09881627509541496, 'sideways_tp_mult': 1.4506149109767097, 'sideways_tsl_mult': 0.07891197301060815, 'sideways_time_stop': 167, 'sideways_use_sma': True, 'sideways_use_ema': True, 'sideways_use_atr': False, 'sideways_use_adx': False, 'sideways_use_spike': True, 'sideways_rsi_required': False}.
[I 2025-08-31 11:32:22,376] Trial 786 finished with values: [-0.07286897649238233, 0.07275720965688182] and parameters: {'p_sma': 58, 'p_std': 15, 'p_atr': 28, 'p_adx': 20, 'rsi_period': 38, 'ema1': 14, 'ema2': 17, 'slip_atr_k': 0.01607292246165753, 'slip_spread_k': 0.4910445505072325, 'spread_hl_frac': 0.024262129602228642, 'bb_std_mult': 2.954722956461018, 'rsi_os': 8, 'rsi_ob': 84, 'vol_spike': 0.27436819992901207, 'adx_thresh': 15.973123836712823, 'atr_min_pct': 0.021364819323051877, 'atr_max_pct': 0.05964674311944625, 'tp_mult': 1.8464399749045795, 'tsl_mult': 0.16154738852711228, 'strategy': 'breakout', 'time_stop': 65, 'use_sma': True, 'use_atr': True, 'use_adx': False, 'use_ema': True, 'use_spike': False, 'rsi_required': False, 'edge_k': 0.0006651494109151113, 'edge_cap': 0.4320779155624151, 'bull_strategy': 'mean_reversion', 'bull_bb_std_mult': 2.705423594542635, 'bull_rsi_os': 26, 'bull_rsi_ob': 68, 'bull_adx_thresh': 7.400851201935543, 'bull_atr_min_pct': 0.012782197139221543, 'bull_atr_max_pct': 0.09161712090626924, 'bull_tp_mult': 1.7081311768720935, 'bull_tsl_mult': 0.2285903950288885, 'bull_time_stop': 187, 'bull_use_sma': False, 'bull_use_ema': False, 'bull_use_atr': True, 'bull_use_adx': True, 'bull_use_spike': False, 'bull_rsi_required': False, 'bear_strategy': 'mean_reversion', 'bear_bb_std_mult': 1.4230389629425928, 'bear_rsi_os': 42, 'bear_rsi_ob': 88, 'bear_adx_thresh': 22.639474419072943, 'bear_atr_min_pct': 8.072309212906435e-05, 'bear_atr_max_pct': 0.12931756203620465, 'bear_tp_mult': 2.6790421603135375, 'bear_tsl_mult': 0.26509894898398345, 'bear_time_stop': 88, 'bear_use_sma': False, 'bear_use_ema': False, 'bear_use_atr': False, 'bear_use_adx': False, 'bear_use_spike': True, 'bear_rsi_required': False, 'sideways_strategy': 'mean_reversion', 'sideways_bb_std_mult': 1.092468044903932, 'sideways_rsi_os': 40, 'sideways_rsi_ob': 63, 'sideways_adx_thresh': 33.27409809430567, 'sideways_atr_min_pct': 0.026256572463879385, 'sideways_atr_max_pct': 0.09797889654677652, 'sideways_tp_mult': 1.5414898399338415, 'sideways_tsl_mult': 0.4563444318797295, 'sideways_time_stop': 173, 'sideways_use_sma': True, 'sideways_use_ema': True, 'sideways_use_atr': False, 'sideways_use_adx': False, 'sideways_use_spike': True, 'sideways_rsi_required': False}.
[I 2025-08-31 11:32:22,466] Trial 784 finished with values: [-1000000000.0, 1000000000.0] and parameters: {'p_sma': 31, 'p_std': 15, 'p_atr': 28, 'p_adx': 23, 'rsi_period': 39, 'ema1': 17, 'ema2': 39, 'slip_atr_k': 0.10524916118080627, 'slip_spread_k': 0.5063108331283273, 'spread_hl_frac': 0.0201854617442618, 'bb_std_mult': 1.720928681483235, 'rsi_os': 34, 'rsi_ob': 84, 'vol_spike': 0.15840462718645548, 'adx_thresh': 20.32719900607018, 'atr_min_pct': 0.022937286934882107, 'atr_max_pct': 0.13241448301470038, 'tp_mult': 2.9190444354968865, 'tsl_mult': 0.16864822935540363, 'strategy': 'breakout', 'time_stop': 66, 'use_sma': True, 'use_atr': True, 'use_adx': False, 'use_ema': True, 'use_spike': False, 'rsi_required': False, 'edge_k': 1.4880485032820618, 'edge_cap': 0.9814379603739005, 'bull_strategy': 'mean_reversion', 'bull_bb_std_mult': 1.2418829134923222, 'bull_rsi_os': 31, 'bull_rsi_ob': 59, 'bull_adx_thresh': 26.32508033331948, 'bull_atr_min_pct': 0.018328339190139792, 'bull_atr_max_pct': 0.038367059000736004, 'bull_tp_mult': 2.9173965062219214, 'bull_tsl_mult': 0.28226805495193746, 'bull_time_stop': 213, 'bull_use_sma': False, 'bull_use_ema': True, 'bull_use_atr': False, 'bull_use_adx': True, 'bull_use_spike': False, 'bull_rsi_required': False, 'bear_strategy': 'mean_reversion', 'bear_bb_std_mult': 3.293473929053291, 'bear_rsi_os': 54, 'bear_rsi_ob': 87, 'bear_adx_thresh': 5.119543103513072, 'bear_atr_min_pct': 0.021244985316070435, 'bear_atr_max_pct': 0.027796883842155798, 'bear_tp_mult': 2.6698353082464314, 'bear_tsl_mult': 0.8760462110384739, 'bear_time_stop': 90, 'bear_use_sma': False, 'bear_use_ema': False, 'bear_use_atr': False, 'bear_use_adx': False, 'bear_use_spike': True, 'bear_rsi_required': False, 'sideways_strategy': 'mean_reversion', 'sideways_bb_std_mult': 1.1199645691245115, 'sideways_rsi_os': 39, 'sideways_rsi_ob': 63, 'sideways_adx_thresh': 24.52429186240849, 'sideways_atr_min_pct': 0.026100944462554187, 'sideways_atr_max_pct': 0.09822119775462845, 'sideways_tp_mult': 1.5447626904679503, 'sideways_tsl_mult': 0.0792757957131976, 'sideways_time_stop': 224, 'sideways_use_sma': True, 'sideways_use_ema': True, 'sideways_use_atr': False, 'sideways_use_adx': False, 'sideways_use_spike': True, 'sideways_rsi_required': False}.
[I 2025-08-31 11:32:58,118] Trial 787 finished with values: [-1000000000.0, 1000000000.0] and parameters: {'p_sma': 34, 'p_std': 14, 'p_atr': 30, 'p_adx': 24, 'rsi_period': 38, 'ema1': 6, 'ema2': 45, 'slip_atr_k': 0.01653460105623502, 'slip_spread_k': 0.934235909496519, 'spread_hl_frac': 0.021945487780934025, 'bb_std_mult': 2.8635671387863777, 'rsi_os': 6, 'rsi_ob': 66, 'vol_spike': 0.1579550336511409, 'adx_thresh': 20.220388471905547, 'atr_min_pct': 0.02147755497844686, 'atr_max_pct': 0.06012744355531432, 'tp_mult': 2.9609659866983624, 'tsl_mult': 0.4905107306076407, 'strategy': 'breakout', 'time_stop': 229, 'use_sma': True, 'use_atr': True, 'use_adx': False, 'use_ema': True, 'use_spike': True, 'rsi_required': False, 'edge_k': 0.022629121505200134, 'edge_cap': 0.911246496516771, 'bull_strategy': 'mean_reversion', 'bull_bb_std_mult': 0.7065815009175749, 'bull_rsi_os': 28, 'bull_rsi_ob': 65, 'bull_adx_thresh': 26.43137412930868, 'bull_atr_min_pct': 0.024193979602975896, 'bull_atr_max_pct': 0.08825198051051014, 'bull_tp_mult': 1.4150083384380963, 'bull_tsl_mult': 0.22884530906657066, 'bull_time_stop': 44, 'bull_use_sma': True, 'bull_use_ema': False, 'bull_use_atr': False, 'bull_use_adx': True, 'bull_use_spike': False, 'bull_rsi_required': False, 'bear_strategy': 'mean_reversion', 'bear_bb_std_mult': 1.4066795916172885, 'bear_rsi_os': 11, 'bear_rsi_ob': 87, 'bear_adx_thresh': 5.169046895479811, 'bear_atr_min_pct': 0.0011591301727521142, 'bear_atr_max_pct': 0.13397656068239752, 'bear_tp_mult': 2.117644614387826, 'bear_tsl_mult': 0.2703557418236981, 'bear_time_stop': 94, 'bear_use_sma': False, 'bear_use_ema': False, 'bear_use_atr': True, 'bear_use_adx': False, 'bear_use_spike': True, 'bear_rsi_required': False, 'sideways_strategy': 'mean_reversion', 'sideways_bb_std_mult': 1.9844368044706406, 'sideways_rsi_os': 41, 'sideways_rsi_ob': 62, 'sideways_adx_thresh': 27.829533972490513, 'sideways_atr_min_pct': 0.010565056963690502, 'sideways_atr_max_pct': 0.0997529879940505, 'sideways_tp_mult': 1.6958086257527882, 'sideways_tsl_mult': 0.4417352228508673, 'sideways_time_stop': 148, 'sideways_use_sma': True, 'sideways_use_ema': True, 'sideways_use_atr': False, 'sideways_use_adx': False, 'sideways_use_spike': True, 'sideways_rsi_required': False}.
[I 2025-08-31 11:32:58,456] Trial 790 finished with values: [-0.03776724173056123, 0.03770749007667827] and parameters: {'p_sma': 36, 'p_std': 10, 'p_atr': 19, 'p_adx': 19, 'rsi_period': 33, 'ema1': 5, 'ema2': 10, 'slip_atr_k': 0.026751476726953397, 'slip_spread_k': 0.4715814923467264, 'spread_hl_frac': 0.022231665529760244, 'bb_std_mult': 0.5939068886407661, 'rsi_os': 20, 'rsi_ob': 83, 'vol_spike': 0.1343423117677634, 'adx_thresh': 5.009520106920176, 'atr_min_pct': 0.020372950607521083, 'atr_max_pct': 0.05093081572629335, 'tp_mult': 2.9690114624655317, 'tsl_mult': 0.3739002598998875, 'strategy': 'breakout', 'time_stop': 74, 'use_sma': True, 'use_atr': True, 'use_adx': True, 'use_ema': True, 'use_spike': True, 'rsi_required': True, 'edge_k': 1.5453535752957774, 'edge_cap': 0.7766093446201738, 'bull_strategy': 'mean_reversion', 'bull_bb_std_mult': 2.454521439901065, 'bull_rsi_os': 43, 'bull_rsi_ob': 62, 'bull_adx_thresh': 27.69654065857455, 'bull_atr_min_pct': 0.0011771246001632124, 'bull_atr_max_pct': 0.08808281566988893, 'bull_tp_mult': 2.997445712012858, 'bull_tsl_mult': 0.6055736062350712, 'bull_time_stop': 44, 'bull_use_sma': True, 'bull_use_ema': False, 'bull_use_atr': False, 'bull_use_adx': False, 'bull_use_spike': False, 'bull_rsi_required': False, 'bear_strategy': 'mean_reversion', 'bear_bb_std_mult': 1.6372697738490427, 'bear_rsi_os': 13, 'bear_rsi_ob': 56, 'bear_adx_thresh': 26.344795078657057, 'bear_atr_min_pct': 0.0027828139696683164, 'bear_atr_max_pct': 0.13258757573830482, 'bear_tp_mult': 1.1930705292873447, 'bear_tsl_mult': 0.7989191618460615, 'bear_time_stop': 94, 'bear_use_sma': False, 'bear_use_ema': False, 'bear_use_atr': True, 'bear_use_adx': True, 'bear_use_spike': True, 'bear_rsi_required': False, 'sideways_strategy': 'breakout', 'sideways_bb_std_mult': 0.8622601995310173, 'sideways_rsi_os': 28, 'sideways_rsi_ob': 62, 'sideways_adx_thresh': 17.247733408154268, 'sideways_atr_min_pct': 0.0288127460904744, 'sideways_atr_max_pct': 0.10366834305836803, 'sideways_tp_mult': 2.3144594793941073, 'sideways_tsl_mult': 0.29795206895822557, 'sideways_time_stop': 174, 'sideways_use_sma': False, 'sideways_use_ema': True, 'sideways_use_atr': False, 'sideways_use_adx': False, 'sideways_use_spike': True, 'sideways_rsi_required': False}.
[I 2025-08-31 11:32:58,654] Trial 788 finished with values: [-0.0330108531933373, 0.03266777923907887] and parameters: {'p_sma': 38, 'p_std': 15, 'p_atr': 19, 'p_adx': 20, 'rsi_period': 39, 'ema1': 5, 'ema2': 22, 'slip_atr_k': 0.015988307293833506, 'slip_spread_k': 0.5074445137390301, 'spread_hl_frac': 0.024494994908578798, 'bb_std_mult': 2.924371862199608, 'rsi_os': 20, 'rsi_ob': 66, 'vol_spike': 0.1118909050374673, 'adx_thresh': 11.927339695176718, 'atr_min_pct': 0.022922990383778038, 'atr_max_pct': 0.06803481497258577, 'tp_mult': 2.9731289864424397, 'tsl_mult': 0.4346530623922169, 'strategy': 'breakout', 'time_stop': 73, 'use_sma': True, 'use_atr': True, 'use_adx': True, 'use_ema': True, 'use_spike': True, 'rsi_required': True, 'edge_k': 1.5465625697367293, 'edge_cap': 0.6732842841220372, 'bull_strategy': 'mean_reversion', 'bull_bb_std_mult': 2.4177745259184653, 'bull_rsi_os': 26, 'bull_rsi_ob': 65, 'bull_adx_thresh': 26.404289357499216, 'bull_atr_min_pct': 0.027008873443770013, 'bull_atr_max_pct': 0.08965579154769113, 'bull_tp_mult': 2.9382234693900298, 'bull_tsl_mult': 0.23334062558684138, 'bull_time_stop': 44, 'bull_use_sma': True, 'bull_use_ema': False, 'bull_use_atr': False, 'bull_use_adx': True, 'bull_use_spike': False, 'bull_rsi_required': False, 'bear_strategy': 'mean_reversion', 'bear_bb_std_mult': 1.4128959212433516, 'bear_rsi_os': 51, 'bear_rsi_ob': 56, 'bear_adx_thresh': 31.87240774305516, 'bear_atr_min_pct': 0.0029816574884454186, 'bear_atr_max_pct': 0.1323210882926869, 'bear_tp_mult': 2.6602967136939517, 'bear_tsl_mult': 0.4348593971229673, 'bear_time_stop': 95, 'bear_use_sma': False, 'bear_use_ema': False, 'bear_use_atr': False, 'bear_use_adx': False, 'bear_use_spike': True, 'bear_rsi_required': False, 'sideways_strategy': 'breakout', 'sideways_bb_std_mult': 0.8773982891379865, 'sideways_rsi_os': 7, 'sideways_rsi_ob': 89, 'sideways_adx_thresh': 25.077438697242798, 'sideways_atr_min_pct': 0.02620620063818746, 'sideways_atr_max_pct': 0.09631846607789732, 'sideways_tp_mult': 1.6954865928128255, 'sideways_tsl_mult': 0.9070565578184839, 'sideways_time_stop': 148, 'sideways_use_sma': False, 'sideways_use_ema': True, 'sideways_use_atr': False, 'sideways_use_adx': False, 'sideways_use_spike': True, 'sideways_rsi_required': False}.
[I 2025-08-31 11:32:58,824] Trial 789 finished with values: [-1000000000.0, 1000000000.0] and parameters: {'p_sma': 38, 'p_std': 10, 'p_atr': 26, 'p_adx': 19, 'rsi_period': 39, 'ema1': 5, 'ema2': 29, 'slip_atr_k': 0.025486145772620056, 'slip_spread_k': 0.47242384815340954, 'spread_hl_frac': 0.02207980423760878, 'bb_std_mult': 0.9568548177216429, 'rsi_os': 30, 'rsi_ob': 66, 'vol_spike': 0.28264291503185635, 'adx_thresh': 19.93931901145173, 'atr_min_pct': 0.006970184111894281, 'atr_max_pct': 0.06757600975216514, 'tp_mult': 2.968138636997919, 'tsl_mult': 0.09132477878742434, 'strategy': 'breakout', 'time_stop': 22, 'use_sma': True, 'use_atr': True, 'use_adx': True, 'use_ema': True, 'use_spike': True, 'rsi_required': True, 'edge_k': 1.5076039811199822, 'edge_cap': 0.5748129257807636, 'bull_strategy': 'mean_reversion', 'bull_bb_std_mult': 3.0409618976372923, 'bull_rsi_os': 43, 'bull_rsi_ob': 65, 'bull_adx_thresh': 26.180472657532317, 'bull_atr_min_pct': 0.010815637469288068, 'bull_atr_max_pct': 0.026453843145210612, 'bull_tp_mult': 2.913924147748487, 'bull_tsl_mult': 0.8187654546951577, 'bull_time_stop': 45, 'bull_use_sma': True, 'bull_use_ema': True, 'bull_use_atr': False, 'bull_use_adx': False, 'bull_use_spike': False, 'bull_rsi_required': False, 'bear_strategy': 'mean_reversion', 'bear_bb_std_mult': 1.108059284118747, 'bear_rsi_os': 11, 'bear_rsi_ob': 56, 'bear_adx_thresh': 9.356434752861206, 'bear_atr_min_pct': 0.0009179506982951845, 'bear_atr_max_pct': 0.13348118206641577, 'bear_tp_mult': 2.727726228128572, 'bear_tsl_mult': 0.8934250208149839, 'bear_time_stop': 97, 'bear_use_sma': False, 'bear_use_ema': False, 'bear_use_atr': True, 'bear_use_adx': True, 'bear_use_spike': True, 'bear_rsi_required': False, 'sideways_strategy': 'breakout', 'sideways_bb_std_mult': 0.8835434022002732, 'sideways_rsi_os': 41, 'sideways_rsi_ob': 62, 'sideways_adx_thresh': 25.02381895306756, 'sideways_atr_min_pct': 0.0063169198538200735, 'sideways_atr_max_pct': 0.06948630397601874, 'sideways_tp_mult': 1.6995778196313904, 'sideways_tsl_mult': 0.2955335590703315, 'sideways_time_stop': 148, 'sideways_use_sma': False, 'sideways_use_ema': True, 'sideways_use_atr': False, 'sideways_use_adx': False, 'sideways_use_spike': True, 'sideways_rsi_required': False}.
[I 2025-08-31 11:32:59,773] Trial 791 finished with values: [-1000000000.0, 1000000000.0] and parameters: {'p_sma': 36, 'p_std': 10, 'p_atr': 26, 'p_adx': 22, 'rsi_period': 73, 'ema1': 5, 'ema2': 29, 'slip_atr_k': 0.024571143378830665, 'slip_spread_k': 0.46927347365140953, 'spread_hl_frac': 0.02397616663615408, 'bb_std_mult': 3.5944395655273897, 'rsi_os': 38, 'rsi_ob': 81, 'vol_spike': 0.1860185816025908, 'adx_thresh': 15.04620308974094, 'atr_min_pct': 0.029322952593259385, 'atr_max_pct': 0.016748395684279063, 'tp_mult': 2.9482413559938454, 'tsl_mult': 0.3209575653192662, 'strategy': 'breakout', 'time_stop': 75, 'use_sma': True, 'use_atr': True, 'use_adx': True, 'use_ema': True, 'use_spike': True, 'rsi_required': True, 'edge_k': 1.5405750152744013, 'edge_cap': 0.7695589286117761, 'bull_strategy': 'mean_reversion', 'bull_bb_std_mult': 1.906620044258352, 'bull_rsi_os': 43, 'bull_rsi_ob': 62, 'bull_adx_thresh': 27.721449270438477, 'bull_atr_min_pct': 0.0010746591419575043, 'bull_atr_max_pct': 0.03152517954784294, 'bull_tp_mult': 2.9384422085273814, 'bull_tsl_mult': 0.8318567762599283, 'bull_time_stop': 49, 'bull_use_sma': True, 'bull_use_ema': True, 'bull_use_atr': False, 'bull_use_adx': False, 'bull_use_spike': False, 'bull_rsi_required': False, 'bear_strategy': 'mean_reversion', 'bear_bb_std_mult': 1.787280853797708, 'bear_rsi_os': 51, 'bear_rsi_ob': 56, 'bear_adx_thresh': 12.403123571481384, 'bear_atr_min_pct': 0.02003036259062943, 'bear_atr_max_pct': 0.05547748189677927, 'bear_tp_mult': 1.1840153219652758, 'bear_tsl_mult': 0.8049439102677723, 'bear_time_stop': 101, 'bear_use_sma': False, 'bear_use_ema': True, 'bear_use_atr': True, 'bear_use_adx': True, 'bear_use_spike': False, 'bear_rsi_required': False, 'sideways_strategy': 'breakout', 'sideways_bb_std_mult': 3.456267357352255, 'sideways_rsi_os': 28, 'sideways_rsi_ob': 62, 'sideways_adx_thresh': 24.94141422269549, 'sideways_atr_min_pct': 0.006330644028003422, 'sideways_atr_max_pct': 0.030902009409280992, 'sideways_tp_mult': 1.4789860071961958, 'sideways_tsl_mult': 0.8446688870840449, 'sideways_time_stop': 184, 'sideways_use_sma': False, 'sideways_use_ema': True, 'sideways_use_atr': False, 'sideways_use_adx': False, 'sideways_use_spike': True, 'sideways_rsi_required': False}.
