[I 2025-08-31 11:06:38,641] Trial 604 finished with values: [0.007566785522402197, 0.0022239148526031014] and parameters: {'p_sma': 35, 'p_std': 13, 'p_atr': 28, 'p_adx': 21, 'rsi_period': 35, 'ema1': 5, 'ema2': 19, 'slip_atr_k': 0.01842591290024154, 'slip_spread_k': 0.4734982858793275, 'spread_hl_frac': 0.022095522424975457, 'bb_std_mult': 0.6472864263607238, 'rsi_os': 31, 'rsi_ob': 83, 'vol_spike': 0.09724913016394302, 'adx_thresh': 10.859844096053932, 'atr_min_pct': 0.021752803228146503, 'atr_max_pct': 0.059578194229416896, 'tp_mult': 2.9371524120019505, 'tsl_mult': 0.092995573510357, 'strategy': 'breakout', 'time_stop': 82, 'use_sma': True, 'use_atr': True, 'use_adx': False, 'use_ema': True, 'use_spike': False, 'rsi_required': False, 'edge_k': 1.5006032926726556, 'edge_cap': 0.708962280173081, 'bull_strategy': 'mean_reversion', 'bull_bb_std_mult': 2.1088058430657144, 'bull_rsi_os': 42, 'bull_rsi_ob': 62, 'bull_adx_thresh': 27.016288990785227, 'bull_atr_min_pct': 0.012497956154190856, 'bull_atr_max_pct': 0.0344897912456773, 'bull_tp_mult': 2.9154491131153417, 'bull_tsl_mult': 0.2372611928226896, 'bull_time_stop': 47, 'bull_use_sma': False, 'bull_use_ema': True, 'bull_use_atr': False, 'bull_use_adx': True, 'bull_use_spike': False, 'bull_rsi_required': False, 'bear_strategy': 'mean_reversion', 'bear_bb_std_mult': 1.5400837072965525, 'bear_rsi_os': 52, 'bear_rsi_ob': 54, 'bear_adx_thresh': 10.26105516762525, 'bear_atr_min_pct': 0.006169319697708631, 'bear_atr_max_pct': 0.13504380704274996, 'bear_tp_mult': 2.692186387071427, 'bear_tsl_mult': 0.8946159653527893, 'bear_time_stop': 100, 'bear_use_sma': False, 'bear_use_ema': False, 'bear_use_atr': True, 'bear_use_adx': False, 'bear_use_spike': True, 'bear_rsi_required': False, 'sideways_strategy': 'mean_reversion', 'sideways_bb_std_mult': 1.0231635345374714, 'sideways_rsi_os': 40, 'sideways_rsi_ob': 62, 'sideways_adx_thresh': 26.61560213114572, 'sideways_atr_min_pct': 0.005439278809140756, 'sideways_atr_max_pct': 0.10499373024746728, 'sideways_tp_mult': 1.554696100748923, 'sideways_tsl_mult': 0.8658808304436153, 'sideways_time_stop': 167, 'sideways_use_sma': True, 'sideways_use_ema': True, 'sideways_use_atr': False, 'sideways_use_adx': False, 'sideways_use_spike': True, 'sideways_rsi_required': False}.
[I 2025-08-31 11:06:38,811] Trial 602 finished with values: [-1000000000.0, 1000000000.0] and parameters: {'p_sma': 31, 'p_std': 13, 'p_atr': 28, 'p_adx': 23, 'rsi_period': 35, 'ema1': 6, 'ema2': 13, 'slip_atr_k': 0.030780954160933193, 'slip_spread_k': 0.4526094262454834, 'spread_hl_frac': 0.01784238562889596, 'bb_std_mult': 0.6568493332715746, 'rsi_os': 30, 'rsi_ob': 81, 'vol_spike': 0.09421585423461211, 'adx_thresh': 11.987215036952232, 'atr_min_pct': 0.02187715913811468, 'atr_max_pct': 0.049295058984549354, 'tp_mult': 2.928500556812409, 'tsl_mult': 0.07132702198647427, 'strategy': 'breakout', 'time_stop': 83, 'use_sma': True, 'use_atr': True, 'use_adx': False, 'use_ema': True, 'use_spike': False, 'rsi_required': False, 'edge_k': 1.5846926981349516, 'edge_cap': 0.7181891029203631, 'bull_strategy': 'mean_reversion', 'bull_bb_std_mult': 2.0415855719626728, 'bull_rsi_os': 42, 'bull_rsi_ob': 63, 'bull_adx_thresh': 26.623937486043822, 'bull_atr_min_pct': 0.012331120885488888, 'bull_atr_max_pct': 0.035275527691293926, 'bull_tp_mult': 2.9051544848369244, 'bull_tsl_mult': 0.21500591989929366, 'bull_time_stop': 47, 'bull_use_sma': False, 'bull_use_ema': True, 'bull_use_atr': False, 'bull_use_adx': True, 'bull_use_spike': False, 'bull_rsi_required': False, 'bear_strategy': 'mean_reversion', 'bear_bb_std_mult': 1.5671706290506062, 'bear_rsi_os': 50, 'bear_rsi_ob': 54, 'bear_adx_thresh': 10.083968778121305, 'bear_atr_min_pct': 0.006119278426018181, 'bear_atr_max_pct': 0.13430928363819492, 'bear_tp_mult': 2.6894607854550965, 'bear_tsl_mult': 0.8305372913384758, 'bear_time_stop': 115, 'bear_use_sma': False, 'bear_use_ema': False, 'bear_use_atr': True, 'bear_use_adx': False, 'bear_use_spike': True, 'bear_rsi_required': False, 'sideways_strategy': 'mean_reversion', 'sideways_bb_std_mult': 1.033130609648851, 'sideways_rsi_os': 40, 'sideways_rsi_ob': 62, 'sideways_adx_thresh': 27.35454546832838, 'sideways_atr_min_pct': 0.004750734216017089, 'sideways_atr_max_pct': 0.09734024932093042, 'sideways_tp_mult': 1.5217737871920818, 'sideways_tsl_mult': 0.819868003526863, 'sideways_time_stop': 177, 'sideways_use_sma': True, 'sideways_use_ema': True, 'sideways_use_atr': False, 'sideways_use_adx': False, 'sideways_use_spike': True, 'sideways_rsi_required': False}.
[I 2025-08-31 11:07:12,815] Trial 607 finished with values: [-1000000000.0, 1000000000.0] and parameters: {'p_sma': 30, 'p_std': 11, 'p_atr': 28, 'p_adx': 21, 'rsi_period': 35, 'ema1': 5, 'ema2': 23, 'slip_atr_k': 0.01980407221607069, 'slip_spread_k': 0.4333319425256061, 'spread_hl_frac': 0.022062592917665127, 'bb_std_mult': 0.6507046925240235, 'rsi_os': 31, 'rsi_ob': 84, 'vol_spike': 0.12208360572935249, 'adx_thresh': 10.699273395652087, 'atr_min_pct': 0.021710830090082896, 'atr_max_pct': 0.06314471980086804, 'tp_mult': 2.9411950300464165, 'tsl_mult': 0.11314875845797379, 'strategy': 'breakout', 'time_stop': 88, 'use_sma': True, 'use_atr': True, 'use_adx': False, 'use_ema': True, 'use_spike': False, 'rsi_required': False, 'edge_k': 1.511507659572736, 'edge_cap': 0.7292712621024793, 'bull_strategy': 'mean_reversion', 'bull_bb_std_mult': 2.252391166863563, 'bull_rsi_os': 42, 'bull_rsi_ob': 64, 'bull_adx_thresh': 26.33692682351989, 'bull_atr_min_pct': 0.013664651361323265, 'bull_atr_max_pct': 0.0346769633494439, 'bull_tp_mult': 2.9216391344933976, 'bull_tsl_mult': 0.21184216382898316, 'bull_time_stop': 48, 'bull_use_sma': False, 'bull_use_ema': True, 'bull_use_atr': False, 'bull_use_adx': False, 'bull_use_spike': False, 'bull_rsi_required': True, 'bear_strategy': 'mean_reversion', 'bear_bb_std_mult': 1.5635875221310644, 'bear_rsi_os': 52, 'bear_rsi_ob': 52, 'bear_adx_thresh': 9.907721593059966, 'bear_atr_min_pct': 0.0019008480827958103, 'bear_atr_max_pct': 0.13608845103789827, 'bear_tp_mult': 2.7581261362064993, 'bear_tsl_mult': 0.9072245724181828, 'bear_time_stop': 95, 'bear_use_sma': False, 'bear_use_ema': True, 'bear_use_atr': True, 'bear_use_adx': False, 'bear_use_spike': False, 'bear_rsi_required': False, 'sideways_strategy': 'mean_reversion', 'sideways_bb_std_mult': 0.9954482382553136, 'sideways_rsi_os': 41, 'sideways_rsi_ob': 63, 'sideways_adx_thresh': 26.719141873865375, 'sideways_atr_min_pct': 0.005770665885915451, 'sideways_atr_max_pct': 0.10928816167064713, 'sideways_tp_mult': 1.496222850139598, 'sideways_tsl_mult': 0.5268578908114823, 'sideways_time_stop': 169, 'sideways_use_sma': True, 'sideways_use_ema': True, 'sideways_use_atr': False, 'sideways_use_adx': False, 'sideways_use_spike': True, 'sideways_rsi_required': True}.
[I 2025-08-31 11:07:13,226] Trial 605 finished with values: [-1000000000.0, 1000000000.0] and parameters: {'p_sma': 33, 'p_std': 17, 'p_atr': 26, 'p_adx': 21, 'rsi_period': 35, 'ema1': 5, 'ema2': 15, 'slip_atr_k': 0.020612839755010506, 'slip_spread_k': 0.4712619998562225, 'spread_hl_frac': 0.022307650127263146, 'bb_std_mult': 0.6631127011140455, 'rsi_os': 28, 'rsi_ob': 79, 'vol_spike': 0.07434788544106487, 'adx_thresh': 12.142334731740512, 'atr_min_pct': 0.021877026989447403, 'atr_max_pct': 0.05409922519383097, 'tp_mult': 2.9222393120493297, 'tsl_mult': 0.06396775279911356, 'strategy': 'breakout', 'time_stop': 89, 'use_sma': True, 'use_atr': True, 'use_adx': False, 'use_ema': True, 'use_spike': False, 'rsi_required': False, 'edge_k': 1.513375172773755, 'edge_cap': 0.7184563256897026, 'bull_strategy': 'mean_reversion', 'bull_bb_std_mult': 1.806862744756065, 'bull_rsi_os': 38, 'bull_rsi_ob': 62, 'bull_adx_thresh': 26.81095607938477, 'bull_atr_min_pct': 0.012622702967013316, 'bull_atr_max_pct': 0.034009572410139445, 'bull_tp_mult': 2.923634007184934, 'bull_tsl_mult': 0.21442253659372548, 'bull_time_stop': 46, 'bull_use_sma': False, 'bull_use_ema': True, 'bull_use_atr': False, 'bull_use_adx': True, 'bull_use_spike': False, 'bull_rsi_required': False, 'bear_strategy': 'mean_reversion', 'bear_bb_std_mult': 1.8183062809228052, 'bear_rsi_os': 47, 'bear_rsi_ob': 54, 'bear_adx_thresh': 10.715546457840757, 'bear_atr_min_pct': 0.006175052952732299, 'bear_atr_max_pct': 0.13597556213270615, 'bear_tp_mult': 2.7426590458852664, 'bear_tsl_mult': 0.8259580144346641, 'bear_time_stop': 114, 'bear_use_sma': False, 'bear_use_ema': False, 'bear_use_atr': True, 'bear_use_adx': False, 'bear_use_spike': True, 'bear_rsi_required': False, 'sideways_strategy': 'mean_reversion', 'sideways_bb_std_mult': 1.298167877612338, 'sideways_rsi_os': 38, 'sideways_rsi_ob': 62, 'sideways_adx_thresh': 26.437036737013937, 'sideways_atr_min_pct': 0.005513885207687317, 'sideways_atr_max_pct': 0.10485591909786075, 'sideways_tp_mult': 1.5688999290146273, 'sideways_tsl_mult': 0.8694646494808094, 'sideways_time_stop': 175, 'sideways_use_sma': True, 'sideways_use_ema': True, 'sideways_use_atr': False, 'sideways_use_adx': False, 'sideways_use_spike': True, 'sideways_rsi_required': False}.
[I 2025-08-31 11:07:13,352] Trial 606 finished with values: [-1000000000.0, 1000000000.0] and parameters: {'p_sma': 33, 'p_std': 17, 'p_atr': 26, 'p_adx': 21, 'rsi_period': 36, 'ema1': 5, 'ema2': 15, 'slip_atr_k': 0.021926830282900444, 'slip_spread_k': 0.5052191224947062, 'spread_hl_frac': 0.02206919282969576, 'bb_std_mult': 0.6802297268775294, 'rsi_os': 29, 'rsi_ob': 79, 'vol_spike': 0.08459715547244014, 'adx_thresh': 13.641410081879492, 'atr_min_pct': 0.022080010020835768, 'atr_max_pct': 0.054757898569838884, 'tp_mult': 2.9233941161739074, 'tsl_mult': 0.0643563191248636, 'strategy': 'breakout', 'time_stop': 78, 'use_sma': True, 'use_atr': True, 'use_adx': False, 'use_ema': True, 'use_spike': False, 'rsi_required': False, 'edge_k': 1.445191643014843, 'edge_cap': 0.7205839252951446, 'bull_strategy': 'mean_reversion', 'bull_bb_std_mult': 1.9051859809416154, 'bull_rsi_os': 42, 'bull_rsi_ob': 61, 'bull_adx_thresh': 26.17537846190543, 'bull_atr_min_pct': 0.012579566139367362, 'bull_atr_max_pct': 0.0336152193282341, 'bull_tp_mult': 2.8846344808721396, 'bull_tsl_mult': 0.24024363083340922, 'bull_time_stop': 46, 'bull_use_sma': False, 'bull_use_ema': True, 'bull_use_atr': False, 'bull_use_adx': True, 'bull_use_spike': False, 'bull_rsi_required': False, 'bear_strategy': 'mean_reversion', 'bear_bb_std_mult': 1.8209167999801117, 'bear_rsi_os': 13, 'bear_rsi_ob': 54, 'bear_adx_thresh': 18.666468778271646, 'bear_atr_min_pct': 0.00607021344785166, 'bear_atr_max_pct': 0.1363331913246858, 'bear_tp_mult': 2.749554581355648, 'bear_tsl_mult': 0.8400568988436011, 'bear_time_stop': 113, 'bear_use_sma': False, 'bear_use_ema': False, 'bear_use_atr': True, 'bear_use_adx': False, 'bear_use_spike': True, 'bear_rsi_required': False, 'sideways_strategy': 'mean_reversion', 'sideways_bb_std_mult': 1.281500953977897, 'sideways_rsi_os': 38, 'sideways_rsi_ob': 61, 'sideways_adx_thresh': 26.639145266621785, 'sideways_atr_min_pct': 0.005583752093898679, 'sideways_atr_max_pct': 0.10461208632187091, 'sideways_tp_mult': 1.563351740220289, 'sideways_tsl_mult': 0.8678540657458871, 'sideways_time_stop': 173, 'sideways_use_sma': True, 'sideways_use_ema': True, 'sideways_use_atr': False, 'sideways_use_adx': False, 'sideways_use_spike': True, 'sideways_rsi_required': False}.
[I 2025-08-31 11:07:13,521] Trial 608 finished with values: [-1000000000.0, 1000000000.0] and parameters: {'p_sma': 37, 'p_std': 12, 'p_atr': 28, 'p_adx': 22, 'rsi_period': 36, 'ema1': 5, 'ema2': 24, 'slip_atr_k': 0.02101840018981202, 'slip_spread_k': 0.42419070904219336, 'spread_hl_frac': 0.022050935793129715, 'bb_std_mult': 0.5521256531286008, 'rsi_os': 23, 'rsi_ob': 83, 'vol_spike': 0.07391115345955723, 'adx_thresh': 10.705932290007256, 'atr_min_pct': 0.021931005350410235, 'atr_max_pct': 0.06298814261240238, 'tp_mult': 2.925965399958252, 'tsl_mult': 0.09590639980038489, 'strategy': 'breakout', 'time_stop': 91, 'use_sma': True, 'use_atr': True, 'use_adx': False, 'use_ema': True, 'use_spike': False, 'rsi_required': False, 'edge_k': 1.5093464118970654, 'edge_cap': 0.7543414242072302, 'bull_strategy': 'mean_reversion', 'bull_bb_std_mult': 2.23911183148119, 'bull_rsi_os': 42, 'bull_rsi_ob': 64, 'bull_adx_thresh': 26.084725937518748, 'bull_atr_min_pct': 0.01354261225395633, 'bull_atr_max_pct': 0.03175117717839258, 'bull_tp_mult': 2.910981058802653, 'bull_tsl_mult': 0.21820873076530575, 'bull_time_stop': 48, 'bull_use_sma': False, 'bull_use_ema': True, 'bull_use_atr': False, 'bull_use_adx': False, 'bull_use_spike': False, 'bull_rsi_required': True, 'bear_strategy': 'mean_reversion', 'bear_bb_std_mult': 1.5530066862654908, 'bear_rsi_os': 52, 'bear_rsi_ob': 50, 'bear_adx_thresh': 10.050993677621845, 'bear_atr_min_pct': 0.013551796512683957, 'bear_atr_max_pct': 0.1356991229600185, 'bear_tp_mult': 2.7527622886738383, 'bear_tsl_mult': 0.934140992807434, 'bear_time_stop': 99, 'bear_use_sma': False, 'bear_use_ema': True, 'bear_use_atr': False, 'bear_use_adx': False, 'bear_use_spike': False, 'bear_rsi_required': False, 'sideways_strategy': 'mean_reversion', 'sideways_bb_std_mult': 0.9271863991489204, 'sideways_rsi_os': 41, 'sideways_rsi_ob': 64, 'sideways_adx_thresh': 26.758257885510403, 'sideways_atr_min_pct': 0.005823965098324102, 'sideways_atr_max_pct': 0.11006245875728815, 'sideways_tp_mult': 1.481110717739474, 'sideways_tsl_mult': 0.04532335273086707, 'sideways_time_stop': 168, 'sideways_use_sma': True, 'sideways_use_ema': True, 'sideways_use_atr': False, 'sideways_use_adx': False, 'sideways_use_spike': True, 'sideways_rsi_required': True}.
[I 2025-08-31 11:07:46,746] Trial 610 finished with values: [-1000000000.0, 1000000000.0] and parameters: {'p_sma': 39, 'p_std': 12, 'p_atr': 29, 'p_adx': 22, 'rsi_period': 36, 'ema1': 7, 'ema2': 22, 'slip_atr_k': 0.020605060590239265, 'slip_spread_k': 0.43284275936171, 'spread_hl_frac': 0.02219250412374596, 'bb_std_mult': 0.5770270805995928, 'rsi_os': 29, 'rsi_ob': 83, 'vol_spike': 0.054733062536193845, 'adx_thresh': 10.705090781845778, 'atr_min_pct': 0.021531789280819037, 'atr_max_pct': 0.06168083458205379, 'tp_mult': 2.9249996730973433, 'tsl_mult': 0.11854348563321655, 'strategy': 'breakout', 'time_stop': 92, 'use_sma': True, 'use_atr': True, 'use_adx': False, 'use_ema': True, 'use_spike': False, 'rsi_required': False, 'edge_k': 1.5257871408703643, 'edge_cap': 0.6985560135302443, 'bull_strategy': 'mean_reversion', 'bull_bb_std_mult': 2.4940538417973865, 'bull_rsi_os': 41, 'bull_rsi_ob': 65, 'bull_adx_thresh': 27.05189254217706, 'bull_atr_min_pct': 0.013141681929500418, 'bull_atr_max_pct': 0.03193182901726476, 'bull_tp_mult': 2.87541509479561, 'bull_tsl_mult': 0.23312658998386324, 'bull_time_stop': 48, 'bull_use_sma': False, 'bull_use_ema': False, 'bull_use_atr': False, 'bull_use_adx': False, 'bull_use_spike': False, 'bull_rsi_required': True, 'bear_strategy': 'mean_reversion', 'bear_bb_std_mult': 1.59126149959655, 'bear_rsi_os': 52, 'bear_rsi_ob': 52, 'bear_adx_thresh': 10.14035473437485, 'bear_atr_min_pct': 0.013534222126934593, 'bear_atr_max_pct': 0.07730699237669536, 'bear_tp_mult': 2.679029060830952, 'bear_tsl_mult': 0.9346523486827373, 'bear_time_stop': 101, 'bear_use_sma': False, 'bear_use_ema': True, 'bear_use_atr': False, 'bear_use_adx': False, 'bear_use_spike': False, 'bear_rsi_required': False, 'sideways_strategy': 'mean_reversion', 'sideways_bb_std_mult': 0.9214888769032826, 'sideways_rsi_os': 43, 'sideways_rsi_ob': 65, 'sideways_adx_thresh': 27.510081488684914, 'sideways_atr_min_pct': 0.005899473585299975, 'sideways_atr_max_pct': 0.11085096374061677, 'sideways_tp_mult': 1.4741817679699887, 'sideways_tsl_mult': 0.5732408376970582, 'sideways_time_stop': 167, 'sideways_use_sma': True, 'sideways_use_ema': True, 'sideways_use_atr': False, 'sideways_use_adx': False, 'sideways_use_spike': False, 'sideways_rsi_required': True}.
[I 2025-08-31 11:07:47,247] Trial 609 finished with values: [-1000000000.0, 1000000000.0] and parameters: {'p_sma': 38, 'p_std': 12, 'p_atr': 29, 'p_adx': 22, 'rsi_period': 36, 'ema1': 7, 'ema2': 29, 'slip_atr_k': 0.01973760602944245, 'slip_spread_k': 0.4662551731135218, 'spread_hl_frac': 0.02217708391984868, 'bb_std_mult': 0.5007241249917824, 'rsi_os': 23, 'rsi_ob': 83, 'vol_spike': 0.07344928831133894, 'adx_thresh': 10.755660001927817, 'atr_min_pct': 0.021634014081987268, 'atr_max_pct': 0.06182235212050312, 'tp_mult': 2.9218520081405197, 'tsl_mult': 0.1101325450328551, 'strategy': 'breakout', 'time_stop': 93, 'use_sma': True, 'use_atr': True, 'use_adx': False, 'use_ema': True, 'use_spike': False, 'rsi_required': False, 'edge_k': 1.535392088325528, 'edge_cap': 0.7205685894695226, 'bull_strategy': 'mean_reversion', 'bull_bb_std_mult': 2.311938560792552, 'bull_rsi_os': 42, 'bull_rsi_ob': 63, 'bull_adx_thresh': 27.00264916427192, 'bull_atr_min_pct': 0.01313412145014046, 'bull_atr_max_pct': 0.03151509418698677, 'bull_tp_mult': 2.934706733295007, 'bull_tsl_mult': 0.23871389630664774, 'bull_time_stop': 48, 'bull_use_sma': False, 'bull_use_ema': False, 'bull_use_atr': False, 'bull_use_adx': False, 'bull_use_spike': False, 'bull_rsi_required': False, 'bear_strategy': 'mean_reversion', 'bear_bb_std_mult': 1.5502119817336362, 'bear_rsi_os': 53, 'bear_rsi_ob': 52, 'bear_adx_thresh': 9.873060177314368, 'bear_atr_min_pct': 0.012472304601100437, 'bear_atr_max_pct': 0.13731478717579595, 'bear_tp_mult': 2.7419262320161213, 'bear_tsl_mult': 0.9354503961052207, 'bear_time_stop': 100, 'bear_use_sma': False, 'bear_use_ema': False, 'bear_use_atr': False, 'bear_use_adx': False, 'bear_use_spike': False, 'bear_rsi_required': False, 'sideways_strategy': 'mean_reversion', 'sideways_bb_std_mult': 0.9035462716147427, 'sideways_rsi_os': 43, 'sideways_rsi_ob': 65, 'sideways_adx_thresh': 27.340428910603645, 'sideways_atr_min_pct': 0.005816465359838211, 'sideways_atr_max_pct': 0.11113280483630669, 'sideways_tp_mult': 1.4939207841457696, 'sideways_tsl_mult': 0.0022355946213747924, 'sideways_time_stop': 168, 'sideways_use_sma': True, 'sideways_use_ema': True, 'sideways_use_atr': False, 'sideways_use_adx': False, 'sideways_use_spike': True, 'sideways_rsi_required': True}.
[I 2025-08-31 11:07:47,479] Trial 612 finished with values: [-1000000000.0, 1000000000.0] and parameters: {'p_sma': 38, 'p_std': 12, 'p_atr': 29, 'p_adx': 22, 'rsi_period': 34, 'ema1': 7, 'ema2': 26, 'slip_atr_k': 0.018392002508739253, 'slip_spread_k': 0.4595416674550436, 'spread_hl_frac': 0.02123630130944072, 'bb_std_mult': 0.5584969550463017, 'rsi_os': 31, 'rsi_ob': 83, 'vol_spike': 0.054721821274073684, 'adx_thresh': 10.712646714066592, 'atr_min_pct': 0.02160837009490609, 'atr_max_pct': 0.061421933785382674, 'tp_mult': 2.9574679344231716, 'tsl_mult': 0.11758172537047766, 'strategy': 'breakout', 'time_stop': 94, 'use_sma': True, 'use_atr': True, 'use_adx': False, 'use_ema': True, 'use_spike': False, 'rsi_required': False, 'edge_k': 1.544282447864207, 'edge_cap': 0.7013884975670407, 'bull_strategy': 'mean_reversion', 'bull_bb_std_mult': 2.5307428332634014, 'bull_rsi_os': 41, 'bull_rsi_ob': 63, 'bull_adx_thresh': 26.902144398289074, 'bull_atr_min_pct': 0.013493626484720665, 'bull_atr_max_pct': 0.03012194943776614, 'bull_tp_mult': 2.914622124766839, 'bull_tsl_mult': 0.23972285456658868, 'bull_time_stop': 49, 'bull_use_sma': False, 'bull_use_ema': False, 'bull_use_atr': False, 'bull_use_adx': True, 'bull_use_spike': False, 'bull_rsi_required': False, 'bear_strategy': 'mean_reversion', 'bear_bb_std_mult': 1.541046806197483, 'bear_rsi_os': 53, 'bear_rsi_ob': 52, 'bear_adx_thresh': 9.750139163890585, 'bear_atr_min_pct': 0.012877054624356246, 'bear_atr_max_pct': 0.047919499492437054, 'bear_tp_mult': 1.2053241506246217, 'bear_tsl_mult': 0.9033681922518765, 'bear_time_stop': 105, 'bear_use_sma': False, 'bear_use_ema': False, 'bear_use_atr': False, 'bear_use_adx': False, 'bear_use_spike': False, 'bear_rsi_required': False, 'sideways_strategy': 'mean_reversion', 'sideways_bb_std_mult': 0.9592411708613107, 'sideways_rsi_os': 40, 'sideways_rsi_ob': 65, 'sideways_adx_thresh': 27.20280721118605, 'sideways_atr_min_pct': 0.006110923474505095, 'sideways_atr_max_pct': 0.11269075649296623, 'sideways_tp_mult': 1.4492778284853955, 'sideways_tsl_mult': 0.885810851956603, 'sideways_time_stop': 165, 'sideways_use_sma': True, 'sideways_use_ema': True, 'sideways_use_atr': True, 'sideways_use_adx': False, 'sideways_use_spike': False, 'sideways_rsi_required': True}.
