[I 2025-08-31 10:39:17,220] Trial 385 finished with values: [-1000000000.0, 1000000000.0] and parameters: {'p_sma': 33, 'p_std': 52, 'p_atr': 15, 'p_adx': 9, 'rsi_period': 70, 'ema1': 10, 'ema2': 42, 'slip_atr_k': 0.13110927344651244, 'slip_spread_k': 0.315276140527148, 'spread_hl_frac': 0.04804313873046067, 'bb_std_mult': 2.5820369833763457, 'rsi_os': 5, 'rsi_ob': 59, 'vol_spike': 0.2924363699678094, 'adx_thresh': 8.082590907337075, 'atr_min_pct': 0.01340476396883462, 'atr_max_pct': 0.020769221616394093, 'tp_mult': 2.7803466645809087, 'tsl_mult': 0.6278291643361211, 'strategy': 'mean_reversion', 'time_stop': 153, 'use_sma': False, 'use_atr': False, 'use_adx': True, 'use_ema': False, 'use_spike': True, 'rsi_required': True, 'edge_k': 0.42671442383221336, 'edge_cap': 0.5071336373708829, 'bull_strategy': 'breakout', 'bull_bb_std_mult': 1.96870197414708, 'bull_rsi_os': 24, 'bull_rsi_ob': 75, 'bull_adx_thresh': 9.626611667617409, 'bull_atr_min_pct': 0.004198689490918861, 'bull_atr_max_pct': 0.06940162630124141, 'bull_tp_mult': 2.4832825695188165, 'bull_tsl_mult': 0.8042941644323032, 'bull_time_stop': 19, 'bull_use_sma': True, 'bull_use_ema': True, 'bull_use_atr': True, 'bull_use_adx': True, 'bull_use_spike': True, 'bull_rsi_required': False, 'bear_strategy': 'breakout', 'bear_bb_std_mult': 2.7292386399091635, 'bear_rsi_os': 31, 'bear_rsi_ob': 95, 'bear_adx_thresh': 6.652585494843683, 'bear_atr_min_pct': 0.017017209519796846, 'bear_atr_max_pct': 0.04268031654833559, 'bear_tp_mult': 2.192891117805219, 'bear_tsl_mult': 0.9301738939553887, 'bear_time_stop': 20, 'bear_use_sma': False, 'bear_use_ema': False, 'bear_use_atr': True, 'bear_use_adx': False, 'bear_use_spike': True, 'bear_rsi_required': False, 'sideways_strategy': 'breakout', 'sideways_bb_std_mult': 2.722054715544741, 'sideways_rsi_os': 15, 'sideways_rsi_ob': 83, 'sideways_adx_thresh': 15.516378658729801, 'sideways_atr_min_pct': 0.021954753749700472, 'sideways_atr_max_pct': 0.08745395791106116, 'sideways_tp_mult': 1.1590939945374281, 'sideways_tsl_mult': 0.3317225059219826, 'sideways_time_stop': 263, 'sideways_use_sma': True, 'sideways_use_ema': False, 'sideways_use_atr': True, 'sideways_use_adx': False, 'sideways_use_spike': True, 'sideways_rsi_required': False}.
[I 2025-08-31 10:39:17,496] Trial 386 finished with values: [-1000000000.0, 1000000000.0] and parameters: {'p_sma': 29, 'p_std': 33, 'p_atr': 20, 'p_adx': 28, 'rsi_period': 82, 'ema1': 12, 'ema2': 58, 'slip_atr_k': 0.17553269392872087, 'slip_spread_k': 0.30417259504793476, 'spread_hl_frac': 0.02648060894945005, 'bb_std_mult': 2.5724011893547627, 'rsi_os': 41, 'rsi_ob': 72, 'vol_spike': 0.29079865013552764, 'adx_thresh': 8.161062317479331, 'atr_min_pct': 0.015105117735588716, 'atr_max_pct': 0.10126133183738184, 'tp_mult': 1.5825281129044537, 'tsl_mult': 0.3090729215734089, 'strategy': 'mean_reversion', 'time_stop': 229, 'use_sma': False, 'use_atr': False, 'use_adx': True, 'use_ema': False, 'use_spike': False, 'rsi_required': True, 'edge_k': 1.6361980440910278, 'edge_cap': 0.13472064565741826, 'bull_strategy': 'breakout', 'bull_bb_std_mult': 2.2865926424945933, 'bull_rsi_os': 41, 'bull_rsi_ob': 46, 'bull_adx_thresh': 9.50843300254996, 'bull_atr_min_pct': 0.003974890935121354, 'bull_atr_max_pct': 0.07115923842584931, 'bull_tp_mult': 1.10354431252618, 'bull_tsl_mult': 0.8093698359498369, 'bull_time_stop': 104, 'bull_use_sma': True, 'bull_use_ema': True, 'bull_use_atr': True, 'bull_use_adx': True, 'bull_use_spike': True, 'bull_rsi_required': False, 'bear_strategy': 'breakout', 'bear_bb_std_mult': 1.8978388638553754, 'bear_rsi_os': 31, 'bear_rsi_ob': 53, 'bear_adx_thresh': 26.475654145380457, 'bear_atr_min_pct': 0.005299343439985643, 'bear_atr_max_pct': 0.06483124816709632, 'bear_tp_mult': 2.5184268567323627, 'bear_tsl_mult': 0.5262611976087178, 'bear_time_stop': 31, 'bear_use_sma': False, 'bear_use_ema': False, 'bear_use_atr': True, 'bear_use_adx': False, 'bear_use_spike': True, 'bear_rsi_required': False, 'sideways_strategy': 'breakout', 'sideways_bb_std_mult': 3.4600785999797963, 'sideways_rsi_os': 36, 'sideways_rsi_ob': 81, 'sideways_adx_thresh': 15.410744842957644, 'sideways_atr_min_pct': 0.022038435094700087, 'sideways_atr_max_pct': 0.010197754812991375, 'sideways_tp_mult': 1.141218404624329, 'sideways_tsl_mult': 0.3331283496907324, 'sideways_time_stop': 263, 'sideways_use_sma': True, 'sideways_use_ema': False, 'sideways_use_atr': True, 'sideways_use_adx': False, 'sideways_use_spike': True, 'sideways_rsi_required': False}.
[I 2025-08-31 10:39:17,750] Trial 389 finished with values: [-1000000000.0, 1000000000.0] and parameters: {'p_sma': 25, 'p_std': 33, 'p_atr': 24, 'p_adx': 8, 'rsi_period': 72, 'ema1': 6, 'ema2': 57, 'slip_atr_k': 0.06945850226928915, 'slip_spread_k': 0.3034110391215751, 'spread_hl_frac': 0.01397241337716981, 'bb_std_mult': 2.5702479376569802, 'rsi_os': 33, 'rsi_ob': 59, 'vol_spike': 0.19876788226233036, 'adx_thresh': 10.920220245916797, 'atr_min_pct': 0.013841710913619314, 'atr_max_pct': 0.10158465039679095, 'tp_mult': 2.375805906630751, 'tsl_mult': 0.3184199258449548, 'strategy': 'mean_reversion', 'time_stop': 117, 'use_sma': False, 'use_atr': False, 'use_adx': True, 'use_ema': False, 'use_spike': True, 'rsi_required': True, 'edge_k': 1.6784971515022902, 'edge_cap': 0.8885250710921389, 'bull_strategy': 'breakout', 'bull_bb_std_mult': 0.9904654275258522, 'bull_rsi_os': 15, 'bull_rsi_ob': 60, 'bull_adx_thresh': 10.516556040076091, 'bull_atr_min_pct': 0.004996374391750904, 'bull_atr_max_pct': 0.07056231574507142, 'bull_tp_mult': 1.287720130585613, 'bull_tsl_mult': 0.9999953031935542, 'bull_time_stop': 20, 'bull_use_sma': True, 'bull_use_ema': True, 'bull_use_atr': True, 'bull_use_adx': True, 'bull_use_spike': False, 'bull_rsi_required': False, 'bear_strategy': 'mean_reversion', 'bear_bb_std_mult': 2.02484877777221, 'bear_rsi_os': 39, 'bear_rsi_ob': 82, 'bear_adx_thresh': 25.77267626863736, 'bear_atr_min_pct': 0.02573307365373905, 'bear_atr_max_pct': 0.016594698962374393, 'bear_tp_mult': 2.5348090202280997, 'bear_tsl_mult': 0.9316638337804262, 'bear_time_stop': 20, 'bear_use_sma': False, 'bear_use_ema': False, 'bear_use_atr': False, 'bear_use_adx': False, 'bear_use_spike': False, 'bear_rsi_required': True, 'sideways_strategy': 'breakout', 'sideways_bb_std_mult': 0.7722078684543883, 'sideways_rsi_os': 44, 'sideways_rsi_ob': 83, 'sideways_adx_thresh': 14.829353659777569, 'sideways_atr_min_pct': 0.003153005092638528, 'sideways_atr_max_pct': 0.02062121186730341, 'sideways_tp_mult': 1.3528692617292117, 'sideways_tsl_mult': 0.8104401837566637, 'sideways_time_stop': 263, 'sideways_use_sma': True, 'sideways_use_ema': False, 'sideways_use_atr': True, 'sideways_use_adx': False, 'sideways_use_spike': False, 'sideways_rsi_required': False}.
[I 2025-08-31 10:39:48,316] Trial 391 finished with values: [-1000000000.0, 1000000000.0] and parameters: {'p_sma': 5, 'p_std': 36, 'p_atr': 23, 'p_adx': 28, 'rsi_period': 22, 'ema1': 14, 'ema2': 30, 'slip_atr_k': 0.11855236487450181, 'slip_spread_k': 0.2955645277745108, 'spread_hl_frac': 0.03133087574265104, 'bb_std_mult': 2.6737339809541085, 'rsi_os': 47, 'rsi_ob': 75, 'vol_spike': 0.15928120922877473, 'adx_thresh': 11.050517881587725, 'atr_min_pct': 0.020439456288723335, 'atr_max_pct': 0.0907735773829895, 'tp_mult': 2.7308720099438566, 'tsl_mult': 0.6787193371836332, 'strategy': 'breakout', 'time_stop': 134, 'use_sma': False, 'use_atr': False, 'use_adx': True, 'use_ema': False, 'use_spike': True, 'rsi_required': False, 'edge_k': 0.03699497498291404, 'edge_cap': 0.12424400952756381, 'bull_strategy': 'mean_reversion', 'bull_bb_std_mult': 2.8060400273371173, 'bull_rsi_os': 44, 'bull_rsi_ob': 56, 'bull_adx_thresh': 10.70395474811405, 'bull_atr_min_pct': 0.0035078979655887663, 'bull_atr_max_pct': 0.05826441772211782, 'bull_tp_mult': 1.2053187225289799, 'bull_tsl_mult': 0.10140548419524766, 'bull_time_stop': 70, 'bull_use_sma': True, 'bull_use_ema': False, 'bull_use_atr': True, 'bull_use_adx': True, 'bull_use_spike': False, 'bull_rsi_required': True, 'bear_strategy': 'mean_reversion', 'bear_bb_std_mult': 2.048574371360221, 'bear_rsi_os': 27, 'bear_rsi_ob': 85, 'bear_adx_thresh': 8.009351419257582, 'bear_atr_min_pct': 0.025882912578187613, 'bear_atr_max_pct': 0.12434345711309439, 'bear_tp_mult': 1.6053058300735483, 'bear_tsl_mult': 0.06934705315308398, 'bear_time_stop': 168, 'bear_use_sma': False, 'bear_use_ema': True, 'bear_use_atr': True, 'bear_use_adx': False, 'bear_use_spike': False, 'bear_rsi_required': True, 'sideways_strategy': 'mean_reversion', 'sideways_bb_std_mult': 3.4970931303159496, 'sideways_rsi_os': 35, 'sideways_rsi_ob': 81, 'sideways_adx_thresh': 14.765176745270832, 'sideways_atr_min_pct': 0.024516398848726702, 'sideways_atr_max_pct': 0.010742426973686922, 'sideways_tp_mult': 2.79567970861277, 'sideways_tsl_mult': 0.9287776832001753, 'sideways_time_stop': 181, 'sideways_use_sma': True, 'sideways_use_ema': False, 'sideways_use_atr': False, 'sideways_use_adx': False, 'sideways_use_spike': False, 'sideways_rsi_required': False}.
[I 2025-08-31 10:39:48,516] Trial 393 finished with values: [-0.025421942285381416, 0.02531112002942065] and parameters: {'p_sma': 18, 'p_std': 44, 'p_atr': 18, 'p_adx': 8, 'rsi_period': 22, 'ema1': 11, 'ema2': 56, 'slip_atr_k': 0.07590590383693473, 'slip_spread_k': 0.27805474680480535, 'spread_hl_frac': 0.011161179606731814, 'bb_std_mult': 3.466959315401888, 'rsi_os': 8, 'rsi_ob': 49, 'vol_spike': 0.2159568948305981, 'adx_thresh': 9.002247971077189, 'atr_min_pct': 0.029136880215616855, 'atr_max_pct': 0.038235333147599034, 'tp_mult': 1.5113455762155885, 'tsl_mult': 0.6633192343795097, 'strategy': 'breakout', 'time_stop': 135, 'use_sma': True, 'use_atr': False, 'use_adx': True, 'use_ema': False, 'use_spike': True, 'rsi_required': False, 'edge_k': 1.799463318599169, 'edge_cap': 0.1568331174597385, 'bull_strategy': 'breakout', 'bull_bb_std_mult': 3.147805166929957, 'bull_rsi_os': 44, 'bull_rsi_ob': 89, 'bull_adx_thresh': 11.320292205485481, 'bull_atr_min_pct': 0.0015876263759574917, 'bull_atr_max_pct': 0.05864800118695322, 'bull_tp_mult': 1.2016046660276944, 'bull_tsl_mult': 0.17208447560127066, 'bull_time_stop': 71, 'bull_use_sma': True, 'bull_use_ema': False, 'bull_use_atr': True, 'bull_use_adx': True, 'bull_use_spike': True, 'bull_rsi_required': True, 'bear_strategy': 'mean_reversion', 'bear_bb_std_mult': 3.269783305459998, 'bear_rsi_os': 15, 'bear_rsi_ob': 84, 'bear_adx_thresh': 9.56015325760966, 'bear_atr_min_pct': 0.018980449696410703, 'bear_atr_max_pct': 0.12551978045060455, 'bear_tp_mult': 2.5853754050803133, 'bear_tsl_mult': 0.16781286729482764, 'bear_time_stop': 276, 'bear_use_sma': False, 'bear_use_ema': True, 'bear_use_atr': True, 'bear_use_adx': False, 'bear_use_spike': True, 'bear_rsi_required': True, 'sideways_strategy': 'mean_reversion', 'sideways_bb_std_mult': 2.587587161952797, 'sideways_rsi_os': 34, 'sideways_rsi_ob': 78, 'sideways_adx_thresh': 14.111735606693655, 'sideways_atr_min_pct': 0.0028428203086841705, 'sideways_atr_max_pct': 0.012385359665324178, 'sideways_tp_mult': 1.2544301894328866, 'sideways_tsl_mult': 0.88365728887497, 'sideways_time_stop': 277, 'sideways_use_sma': False, 'sideways_use_ema': False, 'sideways_use_atr': False, 'sideways_use_adx': False, 'sideways_use_spike': True, 'sideways_rsi_required': True}.
[I 2025-08-31 10:39:48,907] Trial 392 finished with values: [-1000000000.0, 1000000000.0] and parameters: {'p_sma': 15, 'p_std': 36, 'p_atr': 18, 'p_adx': 8, 'rsi_period': 22, 'ema1': 27, 'ema2': 60, 'slip_atr_k': 0.055230721383407615, 'slip_spread_k': 0.005967562260654535, 'spread_hl_frac': 0.01982337050184725, 'bb_std_mult': 2.665510401990842, 'rsi_os': 43, 'rsi_ob': 75, 'vol_spike': 0.0407942048884752, 'adx_thresh': 25.955895410533614, 'atr_min_pct': 0.02012517920241474, 'atr_max_pct': 0.03848765471308283, 'tp_mult': 2.7161652896899704, 'tsl_mult': 0.6855482401781752, 'strategy': 'breakout', 'time_stop': 117, 'use_sma': True, 'use_atr': False, 'use_adx': True, 'use_ema': False, 'use_spike': True, 'rsi_required': False, 'edge_k': 1.7947310600811623, 'edge_cap': 0.08024500901406895, 'bull_strategy': 'mean_reversion', 'bull_bb_std_mult': 0.9983463252823195, 'bull_rsi_os': 44, 'bull_rsi_ob': 74, 'bull_adx_thresh': 26.504989392087218, 'bull_atr_min_pct': 0.0049366419877275945, 'bull_atr_max_pct': 0.07549518706533617, 'bull_tp_mult': 1.2838154272355322, 'bull_tsl_mult': 0.1757490762504449, 'bull_time_stop': 70, 'bull_use_sma': True, 'bull_use_ema': False, 'bull_use_atr': True, 'bull_use_adx': True, 'bull_use_spike': False, 'bull_rsi_required': True, 'bear_strategy': 'mean_reversion', 'bear_bb_std_mult': 2.042567529168596, 'bear_rsi_os': 27, 'bear_rsi_ob': 69, 'bear_adx_thresh': 9.722906357305021, 'bear_atr_min_pct': 0.018885666019098656, 'bear_atr_max_pct': 0.07659260165376532, 'bear_tp_mult': 1.7210697840008575, 'bear_tsl_mult': 0.16074286767868332, 'bear_time_stop': 186, 'bear_use_sma': False, 'bear_use_ema': True, 'bear_use_atr': False, 'bear_use_adx': False, 'bear_use_spike': False, 'bear_rsi_required': True, 'sideways_strategy': 'mean_reversion', 'sideways_bb_std_mult': 2.289769768939157, 'sideways_rsi_os': 35, 'sideways_rsi_ob': 80, 'sideways_adx_thresh': 14.82212847788454, 'sideways_atr_min_pct': 0.02513239042776719, 'sideways_atr_max_pct': 0.01977017542598758, 'sideways_tp_mult': 1.2549804267696107, 'sideways_tsl_mult': 0.09672461838306856, 'sideways_time_stop': 277, 'sideways_use_sma': True, 'sideways_use_ema': False, 'sideways_use_atr': False, 'sideways_use_adx': False, 'sideways_use_spike': False, 'sideways_rsi_required': True}.
[I 2025-08-31 10:39:48,994] Trial 390 finished with values: [-1000000000.0, 1000000000.0] and parameters: {'p_sma': 40, 'p_std': 52, 'p_atr': 23, 'p_adx': 28, 'rsi_period': 22, 'ema1': 14, 'ema2': 56, 'slip_atr_k': 0.057179282217232, 'slip_spread_k': 0.003458450585708095, 'spread_hl_frac': 0.01930818946397092, 'bb_std_mult': 2.662272648975293, 'rsi_os': 17, 'rsi_ob': 75, 'vol_spike': 0.27082316209392726, 'adx_thresh': 10.730946687868713, 'atr_min_pct': 0.02029858709643709, 'atr_max_pct': 0.10172719097507231, 'tp_mult': 2.8087123655255755, 'tsl_mult': 0.6837575918704807, 'strategy': 'mean_reversion', 'time_stop': 31, 'use_sma': False, 'use_atr': False, 'use_adx': True, 'use_ema': False, 'use_spike': True, 'rsi_required': True, 'edge_k': 1.6746046565504344, 'edge_cap': 0.1321341262430998, 'bull_strategy': 'breakout', 'bull_bb_std_mult': 0.6834448063731056, 'bull_rsi_os': 15, 'bull_rsi_ob': 75, 'bull_adx_thresh': 26.697033364749394, 'bull_atr_min_pct': 0.004987476348035886, 'bull_atr_max_pct': 0.14985881872852652, 'bull_tp_mult': 1.3029636370455644, 'bull_tsl_mult': 0.09527208802755946, 'bull_time_stop': 20, 'bull_use_sma': True, 'bull_use_ema': False, 'bull_use_atr': True, 'bull_use_adx': True, 'bull_use_spike': True, 'bull_rsi_required': True, 'bear_strategy': 'mean_reversion', 'bear_bb_std_mult': 2.760133240594028, 'bear_rsi_os': 20, 'bear_rsi_ob': 66, 'bear_adx_thresh': 6.871217239801806, 'bear_atr_min_pct': 0.022503216230157174, 'bear_atr_max_pct': 0.042173871121051525, 'bear_tp_mult': 2.6057281609518457, 'bear_tsl_mult': 0.16176804544449191, 'bear_time_stop': 20, 'bear_use_sma': False, 'bear_use_ema': True, 'bear_use_atr': True, 'bear_use_adx': False, 'bear_use_spike': True, 'bear_rsi_required': True, 'sideways_strategy': 'breakout', 'sideways_bb_std_mult': 2.5827957104144503, 'sideways_rsi_os': 35, 'sideways_rsi_ob': 52, 'sideways_adx_thresh': 14.655047962174914, 'sideways_atr_min_pct': 0.024770854207274033, 'sideways_atr_max_pct': 0.08742970953440118, 'sideways_tp_mult': 1.3550810971062588, 'sideways_tsl_mult': 0.8078599201934791, 'sideways_time_stop': 262, 'sideways_use_sma': True, 'sideways_use_ema': False, 'sideways_use_atr': False, 'sideways_use_adx': False, 'sideways_use_spike': True, 'sideways_rsi_required': False}.
[I 2025-08-31 10:39:49,582] Trial 397 finished with values: [-1000000000.0, 1000000000.0] and parameters: {'p_sma': 21, 'p_std': 31, 'p_atr': 8, 'p_adx': 8, 'rsi_period': 62, 'ema1': 11, 'ema2': 59, 'slip_atr_k': 0.06137266154356701, 'slip_spread_k': 0.33106918034831023, 'spread_hl_frac': 0.02776406045473812, 'bb_std_mult': 2.512106302971531, 'rsi_os': 51, 'rsi_ob': 78, 'vol_spike': 0.26030263659817354, 'adx_thresh': 32.92770049804083, 'atr_min_pct': 0.01884792069647707, 'atr_max_pct': 0.05525694239027852, 'tp_mult': 2.7800898860619414, 'tsl_mult': 0.5111217809006994, 'strategy': 'mean_reversion', 'time_stop': 141, 'use_sma': False, 'use_atr': True, 'use_adx': False, 'use_ema': True, 'use_spike': True, 'rsi_required': True, 'edge_k': 1.6931977145026085, 'edge_cap': 0.1628565194658283, 'bull_strategy': 'breakout', 'bull_bb_std_mult': 1.0678909368554852, 'bull_rsi_os': 32, 'bull_rsi_ob': 72, 'bull_adx_thresh': 28.05075277883104, 'bull_atr_min_pct': 0.01630454830934428, 'bull_atr_max_pct': 0.07477035681473174, 'bull_tp_mult': 1.2183486912334465, 'bull_tsl_mult': 0.132340125749388, 'bull_time_stop': 13, 'bull_use_sma': False, 'bull_use_ema': True, 'bull_use_atr': False, 'bull_use_adx': False, 'bull_use_spike': True, 'bull_rsi_required': False, 'bear_strategy': 'breakout', 'bear_bb_std_mult': 1.176040985727432, 'bear_rsi_os': 29, 'bear_rsi_ob': 56, 'bear_adx_thresh': 7.476824577154287, 'bear_atr_min_pct': 0.003123508043924597, 'bear_atr_max_pct': 0.03836431835485591, 'bear_tp_mult': 2.7795644280624883, 'bear_tsl_mult': 0.2870457887284322, 'bear_time_stop': 229, 'bear_use_sma': True, 'bear_use_ema': False, 'bear_use_atr': True, 'bear_use_adx': True, 'bear_use_spike': True, 'bear_rsi_required': True, 'sideways_strategy': 'breakout', 'sideways_bb_std_mult': 2.6653171130172395, 'sideways_rsi_os': 33, 'sideways_rsi_ob': 60, 'sideways_adx_thresh': 16.430925976093867, 'sideways_atr_min_pct': 0.008457611609216428, 'sideways_atr_max_pct': 0.14118129365941734, 'sideways_tp_mult': 1.202851556234055, 'sideways_tsl_mult': 0.0424710846379352, 'sideways_time_stop': 30, 'sideways_use_sma': False, 'sideways_use_ema': True, 'sideways_use_atr': False, 'sideways_use_adx': True, 'sideways_use_spike': True, 'sideways_rsi_required': False}.
[I 2025-08-31 10:39:49,583] Trial 394 finished with values: [-1000000000.0, 1000000000.0] and parameters: {'p_sma': 18, 'p_std': 31, 'p_atr': 18, 'p_adx': 8, 'rsi_period': 10, 'ema1': 11, 'ema2': 60, 'slip_atr_k': 0.05672513633253376, 'slip_spread_k': 0.7432080327857392, 'spread_hl_frac': 0.019731054157958824, 'bb_std_mult': 2.518422444136412, 'rsi_os': 7, 'rsi_ob': 46, 'vol_spike': 0.27204863683982183, 'adx_thresh': 8.768717008589043, 'atr_min_pct': 0.012749297695046813, 'atr_max_pct': 0.03902837900875141, 'tp_mult': 2.7924959577607837, 'tsl_mult': 0.5039029970044321, 'strategy': 'mean_reversion', 'time_stop': 138, 'use_sma': True, 'use_atr': True, 'use_adx': True, 'use_ema': False, 'use_spike': True, 'rsi_required': True, 'edge_k': 1.8008943697749433, 'edge_cap': 0.16064713665172214, 'bull_strategy': 'breakout', 'bull_bb_std_mult': 1.0658172881314478, 'bull_rsi_os': 43, 'bull_rsi_ob': 80, 'bull_adx_thresh': 11.272633629080868, 'bull_atr_min_pct': 0.014454952098957495, 'bull_atr_max_pct': 0.07515867971668244, 'bull_tp_mult': 1.1513317882135685, 'bull_tsl_mult': 0.21730716799506972, 'bull_time_stop': 16, 'bull_use_sma': False, 'bull_use_ema': False, 'bull_use_atr': False, 'bull_use_adx': True, 'bull_use_spike': True, 'bull_rsi_required': True, 'bear_strategy': 'breakout', 'bear_bb_std_mult': 3.05666688712216, 'bear_rsi_os': 30, 'bear_rsi_ob': 60, 'bear_adx_thresh': 9.281242890586315, 'bear_atr_min_pct': 0.018839963224398078, 'bear_atr_max_pct': 0.03904812074777614, 'bear_tp_mult': 2.5843529713237547, 'bear_tsl_mult': 0.29592525433045513, 'bear_time_stop': 129, 'bear_use_sma': False, 'bear_use_ema': True, 'bear_use_atr': True, 'bear_use_adx': False, 'bear_use_spike': True, 'bear_rsi_required': True, 'sideways_strategy': 'breakout', 'sideways_bb_std_mult': 2.5878504508438294, 'sideways_rsi_os': 34, 'sideways_rsi_ob': 82, 'sideways_adx_thresh': 13.99739005847113, 'sideways_atr_min_pct': 0.02356221275832148, 'sideways_atr_max_pct': 0.01456253289832056, 'sideways_tp_mult': 1.197127655965952, 'sideways_tsl_mult': 0.08464607765375443, 'sideways_time_stop': 278, 'sideways_use_sma': False, 'sideways_use_ema': False, 'sideways_use_atr': False, 'sideways_use_adx': False, 'sideways_use_spike': True, 'sideways_rsi_required': True}.
