[I 2025-08-31 10:18:06,015] Trial 206 finished with values: [-1000000000.0, 1000000000.0] and parameters: {'p_sma': 20, 'p_std': 7, 'p_atr': 18, 'p_adx': 8, 'rsi_period': 36, 'ema1': 12, 'ema2': 54, 'slip_atr_k': 0.07820763243136007, 'slip_spread_k': 0.2709935837055276, 'spread_hl_frac': 0.030505396115050275, 'bb_std_mult': 1.9537241085522616, 'rsi_os': 40, 'rsi_ob': 75, 'vol_spike': 0.1303298798575951, 'adx_thresh': 8.874607877455173, 'atr_min_pct': 0.01680510884572685, 'atr_max_pct': 0.03936902070544585, 'tp_mult': 2.84161385552361, 'tsl_mult': 0.18137585055000027, 'strategy': 'mean_reversion', 'time_stop': 151, 'use_sma': False, 'use_atr': False, 'use_adx': True, 'use_ema': False, 'use_spike': True, 'rsi_required': True, 'edge_k': 1.7136001672345853, 'edge_cap': 0.10699150616923617, 'bull_strategy': 'breakout', 'bull_bb_std_mult': 0.9481308375090951, 'bull_rsi_os': 54, 'bull_rsi_ob': 75, 'bull_adx_thresh': 34.10965360970944, 'bull_atr_min_pct': 0.006757536302069352, 'bull_atr_max_pct': 0.045096655546593874, 'bull_tp_mult': 1.2934517608539546, 'bull_tsl_mult': 0.20195028700432793, 'bull_time_stop': 9, 'bull_use_sma': False, 'bull_use_ema': True, 'bull_use_atr': True, 'bull_use_adx': True, 'bull_use_spike': True, 'bull_rsi_required': False, 'bear_strategy': 'breakout', 'bear_bb_std_mult': 2.0920305195246276, 'bear_rsi_os': 30, 'bear_rsi_ob': 75, 'bear_adx_thresh': 8.646261744296936, 'bear_atr_min_pct': 0.022250677777815028, 'bear_atr_max_pct': 0.12740832459575935, 'bear_tp_mult': 2.614381102237791, 'bear_tsl_mult': 0.1639968202457629, 'bear_time_stop': 40, 'bear_use_sma': False, 'bear_use_ema': False, 'bear_use_atr': True, 'bear_use_adx': False, 'bear_use_spike': True, 'bear_rsi_required': True, 'sideways_strategy': 'breakout', 'sideways_bb_std_mult': 2.5596850022810385, 'sideways_rsi_os': 29, 'sideways_rsi_ob': 76, 'sideways_adx_thresh': 10.242789581857437, 'sideways_atr_min_pct': 0.004878903784218463, 'sideways_atr_max_pct': 0.06569052430869565, 'sideways_tp_mult': 1.2086344718420567, 'sideways_tsl_mult': 0.808630977683087, 'sideways_time_stop': 260, 'sideways_use_sma': True, 'sideways_use_ema': False, 'sideways_use_atr': True, 'sideways_use_adx': False, 'sideways_use_spike': True, 'sideways_rsi_required': False}.
[I 2025-08-31 10:18:06,104] Trial 208 finished with values: [-1000000000.0, 1000000000.0] and parameters: {'p_sma': 20, 'p_std': 35, 'p_atr': 20, 'p_adx': 7, 'rsi_period': 79, 'ema1': 13, 'ema2': 54, 'slip_atr_k': 0.0819410733867869, 'slip_spread_k': 0.2768441955600018, 'spread_hl_frac': 0.027268537845016313, 'bb_std_mult': 2.432360732281001, 'rsi_os': 40, 'rsi_ob': 76, 'vol_spike': 0.09626833098055321, 'adx_thresh': 8.889534893685223, 'atr_min_pct': 0.01710394603379928, 'atr_max_pct': 0.039406528249043414, 'tp_mult': 2.8334099132032, 'tsl_mult': 0.6674965743744521, 'strategy': 'mean_reversion', 'time_stop': 146, 'use_sma': False, 'use_atr': False, 'use_adx': True, 'use_ema': False, 'use_spike': True, 'rsi_required': True, 'edge_k': 1.7253110225731514, 'edge_cap': 0.08604936869969591, 'bull_strategy': 'breakout', 'bull_bb_std_mult': 2.160950947583985, 'bull_rsi_os': 55, 'bull_rsi_ob': 74, 'bull_adx_thresh': 9.137196039133743, 'bull_atr_min_pct': 0.026995390088280433, 'bull_atr_max_pct': 0.07665109158619747, 'bull_tp_mult': 1.3124366352823502, 'bull_tsl_mult': 0.18872998307295757, 'bull_time_stop': 10, 'bull_use_sma': False, 'bull_use_ema': True, 'bull_use_atr': False, 'bull_use_adx': True, 'bull_use_spike': True, 'bull_rsi_required': False, 'bear_strategy': 'mean_reversion', 'bear_bb_std_mult': 2.1388425395875696, 'bear_rsi_os': 8, 'bear_rsi_ob': 82, 'bear_adx_thresh': 7.347936936956807, 'bear_atr_min_pct': 0.022203205146100823, 'bear_atr_max_pct': 0.1264458802948331, 'bear_tp_mult': 2.6269197707935, 'bear_tsl_mult': 0.1688978512995125, 'bear_time_stop': 41, 'bear_use_sma': False, 'bear_use_ema': False, 'bear_use_atr': True, 'bear_use_adx': False, 'bear_use_spike': True, 'bear_rsi_required': True, 'sideways_strategy': 'breakout', 'sideways_bb_std_mult': 2.9352824495377163, 'sideways_rsi_os': 29, 'sideways_rsi_ob': 76, 'sideways_adx_thresh': 25.734077850126162, 'sideways_atr_min_pct': 0.0064759274067662485, 'sideways_atr_max_pct': 0.06518178371736354, 'sideways_tp_mult': 1.2075880948443458, 'sideways_tsl_mult': 0.09819071548834035, 'sideways_time_stop': 258, 'sideways_use_sma': True, 'sideways_use_ema': False, 'sideways_use_atr': True, 'sideways_use_adx': False, 'sideways_use_spike': True, 'sideways_rsi_required': False}.
[I 2025-08-31 10:18:06,719] Trial 211 finished with values: [-1000000000.0, 1000000000.0] and parameters: {'p_sma': 36, 'p_std': 34, 'p_atr': 20, 'p_adx': 9, 'rsi_period': 42, 'ema1': 13, 'ema2': 57, 'slip_atr_k': 0.048947786870159334, 'slip_spread_k': 0.24362300615131346, 'spread_hl_frac': 0.02070314787890618, 'bb_std_mult': 2.4300116726778986, 'rsi_os': 41, 'rsi_ob': 46, 'vol_spike': 0.2040298942406408, 'adx_thresh': 9.861338132707221, 'atr_min_pct': 0.016127484592427008, 'atr_max_pct': 0.035909077477900044, 'tp_mult': 2.978022078534371, 'tsl_mult': 0.554418606586563, 'strategy': 'mean_reversion', 'time_stop': 161, 'use_sma': False, 'use_atr': False, 'use_adx': True, 'use_ema': False, 'use_spike': True, 'rsi_required': True, 'edge_k': 1.662839004987484, 'edge_cap': 0.24712689376139108, 'bull_strategy': 'breakout', 'bull_bb_std_mult': 1.0461773974685908, 'bull_rsi_os': 51, 'bull_rsi_ob': 76, 'bull_adx_thresh': 11.288154565124515, 'bull_atr_min_pct': 0.0029642539269845555, 'bull_atr_max_pct': 0.12930455066896823, 'bull_tp_mult': 1.1906947920840036, 'bull_tsl_mult': 0.12956380272012213, 'bull_time_stop': 18, 'bull_use_sma': True, 'bull_use_ema': True, 'bull_use_atr': False, 'bull_use_adx': True, 'bull_use_spike': True, 'bull_rsi_required': False, 'bear_strategy': 'mean_reversion', 'bear_bb_std_mult': 1.9888673701057962, 'bear_rsi_os': 7, 'bear_rsi_ob': 81, 'bear_adx_thresh': 10.242238346794704, 'bear_atr_min_pct': 0.015693049249388583, 'bear_atr_max_pct': 0.12148670653176395, 'bear_tp_mult': 1.9316478272419564, 'bear_tsl_mult': 0.14563815512949638, 'bear_time_stop': 54, 'bear_use_sma': False, 'bear_use_ema': False, 'bear_use_atr': True, 'bear_use_adx': False, 'bear_use_spike': True, 'bear_rsi_required': True, 'sideways_strategy': 'breakout', 'sideways_bb_std_mult': 2.926019823876993, 'sideways_rsi_os': 26, 'sideways_rsi_ob': 94, 'sideways_adx_thresh': 25.646764976030877, 'sideways_atr_min_pct': 0.0066935651530626444, 'sideways_atr_max_pct': 0.01722568127133034, 'sideways_tp_mult': 1.248721282703717, 'sideways_tsl_mult': 0.04040232897584256, 'sideways_time_stop': 259, 'sideways_use_sma': True, 'sideways_use_ema': False, 'sideways_use_atr': False, 'sideways_use_adx': False, 'sideways_use_spike': True, 'sideways_rsi_required': False}.
[I 2025-08-31 10:18:37,908] Trial 209 finished with values: [-0.010439138816206839, 0.010532945399923247] and parameters: {'p_sma': 22, 'p_std': 35, 'p_atr': 20, 'p_adx': 7, 'rsi_period': 30, 'ema1': 17, 'ema2': 51, 'slip_atr_k': 0.08395934428927024, 'slip_spread_k': 0.2413422553094597, 'spread_hl_frac': 0.020309692720277467, 'bb_std_mult': 1.9551293626980897, 'rsi_os': 41, 'rsi_ob': 84, 'vol_spike': 0.1962103194120203, 'adx_thresh': 9.961805781507652, 'atr_min_pct': 0.01702511456186144, 'atr_max_pct': 0.03963513541612863, 'tp_mult': 2.791814636237304, 'tsl_mult': 0.561075676268457, 'strategy': 'mean_reversion', 'time_stop': 137, 'use_sma': False, 'use_atr': False, 'use_adx': True, 'use_ema': False, 'use_spike': True, 'rsi_required': True, 'edge_k': 1.7600588977450728, 'edge_cap': 0.24610589761163137, 'bull_strategy': 'breakout', 'bull_bb_std_mult': 2.1599898823320642, 'bull_rsi_os': 50, 'bull_rsi_ob': 76, 'bull_adx_thresh': 11.09598488905426, 'bull_atr_min_pct': 0.0028491992109815414, 'bull_atr_max_pct': 0.07258630113857434, 'bull_tp_mult': 2.8481211258301085, 'bull_tsl_mult': 0.2017122984464087, 'bull_time_stop': 18, 'bull_use_sma': True, 'bull_use_ema': True, 'bull_use_atr': False, 'bull_use_adx': True, 'bull_use_spike': True, 'bull_rsi_required': False, 'bear_strategy': 'mean_reversion', 'bear_bb_std_mult': 2.025118269636146, 'bear_rsi_os': 41, 'bear_rsi_ob': 57, 'bear_adx_thresh': 8.639206561348633, 'bear_atr_min_pct': 0.020898076206093727, 'bear_atr_max_pct': 0.12595989752689765, 'bear_tp_mult': 2.7557746307145714, 'bear_tsl_mult': 0.06767885345618961, 'bear_time_stop': 199, 'bear_use_sma': False, 'bear_use_ema': False, 'bear_use_atr': True, 'bear_use_adx': False, 'bear_use_spike': True, 'bear_rsi_required': True, 'sideways_strategy': 'breakout', 'sideways_bb_std_mult': 2.5477942612048134, 'sideways_rsi_os': 26, 'sideways_rsi_ob': 75, 'sideways_adx_thresh': 23.768382112188917, 'sideways_atr_min_pct': 0.0026166677935861066, 'sideways_atr_max_pct': 0.018324762270504537, 'sideways_tp_mult': 1.1982786449360714, 'sideways_tsl_mult': 0.792270669057432, 'sideways_time_stop': 275, 'sideways_use_sma': True, 'sideways_use_ema': False, 'sideways_use_atr': True, 'sideways_use_adx': False, 'sideways_use_spike': True, 'sideways_rsi_required': False}.
[I 2025-08-31 10:18:37,962] Trial 212 finished with values: [-1000000000.0, 1000000000.0] and parameters: {'p_sma': 15, 'p_std': 34, 'p_atr': 19, 'p_adx': 9, 'rsi_period': 23, 'ema1': 17, 'ema2': 60, 'slip_atr_k': 0.05608558894929034, 'slip_spread_k': 0.30445935697691207, 'spread_hl_frac': 0.020533073116203726, 'bb_std_mult': 1.3748115753861663, 'rsi_os': 28, 'rsi_ob': 74, 'vol_spike': 0.19197261874504196, 'adx_thresh': 9.829097981851438, 'atr_min_pct': 0.02438197697839795, 'atr_max_pct': 0.02835248484928468, 'tp_mult': 2.9861644101923943, 'tsl_mult': 0.63727912861876, 'strategy': 'mean_reversion', 'time_stop': 205, 'use_sma': False, 'use_atr': False, 'use_adx': True, 'use_ema': False, 'use_spike': True, 'rsi_required': True, 'edge_k': 1.6687273364544417, 'edge_cap': 0.24762572789719317, 'bull_strategy': 'breakout', 'bull_bb_std_mult': 2.761839607749452, 'bull_rsi_os': 49, 'bull_rsi_ob': 76, 'bull_adx_thresh': 11.197297623033755, 'bull_atr_min_pct': 0.0218069387389986, 'bull_atr_max_pct': 0.07183325377662832, 'bull_tp_mult': 1.168625888897733, 'bull_tsl_mult': 0.23563359110419724, 'bull_time_stop': 19, 'bull_use_sma': True, 'bull_use_ema': True, 'bull_use_atr': False, 'bull_use_adx': True, 'bull_use_spike': True, 'bull_rsi_required': False, 'bear_strategy': 'mean_reversion', 'bear_bb_std_mult': 0.5005410453283408, 'bear_rsi_os': 42, 'bear_rsi_ob': 57, 'bear_adx_thresh': 10.225859230068732, 'bear_atr_min_pct': 0.015841498577960245, 'bear_atr_max_pct': 0.11326291346911675, 'bear_tp_mult': 2.6949683170088874, 'bear_tsl_mult': 0.1870042151781252, 'bear_time_stop': 79, 'bear_use_sma': False, 'bear_use_ema': False, 'bear_use_atr': True, 'bear_use_adx': True, 'bear_use_spike': True, 'bear_rsi_required': True, 'sideways_strategy': 'breakout', 'sideways_bb_std_mult': 2.252607582548061, 'sideways_rsi_os': 37, 'sideways_rsi_ob': 94, 'sideways_adx_thresh': 7.187571245375276, 'sideways_atr_min_pct': 0.001195854156128552, 'sideways_atr_max_pct': 0.017958900253783328, 'sideways_tp_mult': 1.2909195752463751, 'sideways_tsl_mult': 0.04308969798165313, 'sideways_time_stop': 275, 'sideways_use_sma': True, 'sideways_use_ema': False, 'sideways_use_atr': False, 'sideways_use_adx': False, 'sideways_use_spike': True, 'sideways_rsi_required': False}.
[I 2025-08-31 10:18:38,113] Trial 210 finished with values: [-0.0012943656968049666, 0.0020814634037565165] and parameters: {'p_sma': 47, 'p_std': 35, 'p_atr': 20, 'p_adx': 7, 'rsi_period': 36, 'ema1': 13, 'ema2': 57, 'slip_atr_k': 0.08208970517199611, 'slip_spread_k': 0.2969292449121792, 'spread_hl_frac': 0.030380811401682205, 'bb_std_mult': 2.291040005672395, 'rsi_os': 41, 'rsi_ob': 87, 'vol_spike': 0.09707140864630467, 'adx_thresh': 9.759378924960831, 'atr_min_pct': 0.017078980443173027, 'atr_max_pct': 0.03396663277477665, 'tp_mult': 2.794779916140829, 'tsl_mult': 0.22239379719300262, 'strategy': 'mean_reversion', 'time_stop': 160, 'use_sma': False, 'use_atr': False, 'use_adx': True, 'use_ema': False, 'use_spike': True, 'rsi_required': True, 'edge_k': 1.7677516889803266, 'edge_cap': 0.2467272352505857, 'bull_strategy': 'breakout', 'bull_bb_std_mult': 2.736847258519226, 'bull_rsi_os': 50, 'bull_rsi_ob': 76, 'bull_adx_thresh': 11.109894254931207, 'bull_atr_min_pct': 0.027505880524736022, 'bull_atr_max_pct': 0.14992692617262937, 'bull_tp_mult': 1.2734416077018713, 'bull_tsl_mult': 0.3244262782821873, 'bull_time_stop': 20, 'bull_use_sma': True, 'bull_use_ema': True, 'bull_use_atr': False, 'bull_use_adx': True, 'bull_use_spike': True, 'bull_rsi_required': False, 'bear_strategy': 'mean_reversion', 'bear_bb_std_mult': 2.0150080027158137, 'bear_rsi_os': 10, 'bear_rsi_ob': 57, 'bear_adx_thresh': 10.565938403914537, 'bear_atr_min_pct': 2.607475528543929e-05, 'bear_atr_max_pct': 0.12650402773894248, 'bear_tp_mult': 1.935907185674765, 'bear_tsl_mult': 0.07276678683054472, 'bear_time_stop': 55, 'bear_use_sma': False, 'bear_use_ema': False, 'bear_use_atr': True, 'bear_use_adx': False, 'bear_use_spike': True, 'bear_rsi_required': True, 'sideways_strategy': 'breakout', 'sideways_bb_std_mult': 2.9161135436565595, 'sideways_rsi_os': 30, 'sideways_rsi_ob': 77, 'sideways_adx_thresh': 29.292281072796143, 'sideways_atr_min_pct': 0.0013168703168699898, 'sideways_atr_max_pct': 0.01780199495027139, 'sideways_tp_mult': 2.7360001740339595, 'sideways_tsl_mult': 0.653537554625641, 'sideways_time_stop': 277, 'sideways_use_sma': True, 'sideways_use_ema': False, 'sideways_use_atr': True, 'sideways_use_adx': False, 'sideways_use_spike': True, 'sideways_rsi_required': False}.
[I 2025-08-31 10:18:39,059] Trial 213 finished with values: [-1000000000.0, 1000000000.0] and parameters: {'p_sma': 19, 'p_std': 35, 'p_atr': 19, 'p_adx': 7, 'rsi_period': 25, 'ema1': 17, 'ema2': 52, 'slip_atr_k': 0.10005969844756418, 'slip_spread_k': 0.295924303783705, 'spread_hl_frac': 0.016090000596639488, 'bb_std_mult': 1.5480184166875375, 'rsi_os': 45, 'rsi_ob': 87, 'vol_spike': 0.0851486907816129, 'adx_thresh': 8.005121477343712, 'atr_min_pct': 0.024458998658877837, 'atr_max_pct': 0.04530032044359317, 'tp_mult': 2.7815876225706324, 'tsl_mult': 0.31312022090128067, 'strategy': 'mean_reversion', 'time_stop': 202, 'use_sma': False, 'use_atr': False, 'use_adx': True, 'use_ema': False, 'use_spike': True, 'rsi_required': True, 'edge_k': 1.8011609564620075, 'edge_cap': 0.29265827257087484, 'bull_strategy': 'breakout', 'bull_bb_std_mult': 3.3019899818079956, 'bull_rsi_os': 49, 'bull_rsi_ob': 65, 'bull_adx_thresh': 10.340790101111734, 'bull_atr_min_pct': 0.003526336344646213, 'bull_atr_max_pct': 0.07143450866902373, 'bull_tp_mult': 2.848513910120272, 'bull_tsl_mult': 0.33134448241035735, 'bull_time_stop': 36, 'bull_use_sma': True, 'bull_use_ema': True, 'bull_use_atr': True, 'bull_use_adx': True, 'bull_use_spike': True, 'bull_rsi_required': False, 'bear_strategy': 'breakout', 'bear_bb_std_mult': 2.02133840644172, 'bear_rsi_os': 43, 'bear_rsi_ob': 57, 'bear_adx_thresh': 9.6754329187278, 'bear_atr_min_pct': 0.02090980355777254, 'bear_atr_max_pct': 0.11294333018445402, 'bear_tp_mult': 2.752213818466051, 'bear_tsl_mult': 0.19004796324387596, 'bear_time_stop': 62, 'bear_use_sma': False, 'bear_use_ema': False, 'bear_use_atr': True, 'bear_use_adx': True, 'bear_use_spike': True, 'bear_rsi_required': True, 'sideways_strategy': 'breakout', 'sideways_bb_std_mult': 2.3832008244113667, 'sideways_rsi_os': 38, 'sideways_rsi_ob': 91, 'sideways_adx_thresh': 6.922159050139939, 'sideways_atr_min_pct': 0.0013032752621534157, 'sideways_atr_max_pct': 0.014582567380268995, 'sideways_tp_mult': 1.300213148080735, 'sideways_tsl_mult': 0.8856356818352971, 'sideways_time_stop': 296, 'sideways_use_sma': True, 'sideways_use_ema': False, 'sideways_use_atr': False, 'sideways_use_adx': False, 'sideways_use_spike': True, 'sideways_rsi_required': False}.
[I 2025-08-31 10:19:10,938] Trial 214 finished with values: [-1000000000.0, 1000000000.0] and parameters: {'p_sma': 15, 'p_std': 35, 'p_atr': 17, 'p_adx': 7, 'rsi_period': 23, 'ema1': 17, 'ema2': 60, 'slip_atr_k': 0.06217332617271151, 'slip_spread_k': 0.3105000695303118, 'spread_hl_frac': 0.01553956777802335, 'bb_std_mult': 2.3013207048693696, 'rsi_os': 42, 'rsi_ob': 77, 'vol_spike': 0.19380016677126574, 'adx_thresh': 8.021508655660295, 'atr_min_pct': 0.022010170181580697, 'atr_max_pct': 0.029201233465035253, 'tp_mult': 2.787993478037281, 'tsl_mult': 0.6350851393523841, 'strategy': 'mean_reversion', 'time_stop': 146, 'use_sma': False, 'use_atr': False, 'use_adx': True, 'use_ema': False, 'use_spike': True, 'rsi_required': True, 'edge_k': 1.7664949175148388, 'edge_cap': 0.30440532084444694, 'bull_strategy': 'breakout', 'bull_bb_std_mult': 1.1215743807352747, 'bull_rsi_os': 40, 'bull_rsi_ob': 66, 'bull_adx_thresh': 10.484220844483367, 'bull_atr_min_pct': 0.003504441471004779, 'bull_atr_max_pct': 0.07934998283593207, 'bull_tp_mult': 2.8796934966495735, 'bull_tsl_mult': 0.592155743136905, 'bull_time_stop': 103, 'bull_use_sma': True, 'bull_use_ema': True, 'bull_use_atr': True, 'bull_use_adx': True, 'bull_use_spike': True, 'bull_rsi_required': False, 'bear_strategy': 'breakout', 'bear_bb_std_mult': 2.0367679744871037, 'bear_rsi_os': 29, 'bear_rsi_ob': 57, 'bear_adx_thresh': 7.803159308190755, 'bear_atr_min_pct': 0.01902187851287682, 'bear_atr_max_pct': 0.11324312907704384, 'bear_tp_mult': 2.760747512154249, 'bear_tsl_mult': 0.06948597564877625, 'bear_time_stop': 278, 'bear_use_sma': False, 'bear_use_ema': False, 'bear_use_atr': True, 'bear_use_adx': True, 'bear_use_spike': True, 'bear_rsi_required': True, 'sideways_strategy': 'breakout', 'sideways_bb_std_mult': 2.3847213293451492, 'sideways_rsi_os': 37, 'sideways_rsi_ob': 83, 'sideways_adx_thresh': 23.854084377229604, 'sideways_atr_min_pct': 0.0027988368580449266, 'sideways_atr_max_pct': 0.015241644716287025, 'sideways_tp_mult': 1.3067043157455234, 'sideways_tsl_mult': 0.934311716981194, 'sideways_time_stop': 279, 'sideways_use_sma': True, 'sideways_use_ema': False, 'sideways_use_atr': False, 'sideways_use_adx': False, 'sideways_use_spike': True, 'sideways_rsi_required': False}.
[I 2025-08-31 10:19:11,120] Trial 215 finished with values: [-0.006513438339119548, 0.006457003563502498] and parameters: {'p_sma': 47, 'p_std': 35, 'p_atr': 17, 'p_adx': 7, 'rsi_period': 73, 'ema1': 9, 'ema2': 50, 'slip_atr_k': 0.07295207715287559, 'slip_spread_k': 0.23482635840156574, 'spread_hl_frac': 0.015667961032246137, 'bb_std_mult': 1.7527799042072711, 'rsi_os': 42, 'rsi_ob': 84, 'vol_spike': 0.19762679672619546, 'adx_thresh': 8.239748510914062, 'atr_min_pct': 0.02216343204199909, 'atr_max_pct': 0.03358065718821817, 'tp_mult': 2.75897909671091, 'tsl_mult': 0.4962177206426268, 'strategy': 'mean_reversion', 'time_stop': 134, 'use_sma': False, 'use_atr': False, 'use_adx': True, 'use_ema': False, 'use_spike': True, 'rsi_required': True, 'edge_k': 1.7533673692405205, 'edge_cap': 0.20626269213365706, 'bull_strategy': 'breakout', 'bull_bb_std_mult': 1.1061320483220936, 'bull_rsi_os': 38, 'bull_rsi_ob': 66, 'bull_adx_thresh': 10.408878317912375, 'bull_atr_min_pct': 0.0035185803068745903, 'bull_atr_max_pct': 0.0908028785917565, 'bull_tp_mult': 1.2504565510973429, 'bull_tsl_mult': 0.08896054476194372, 'bull_time_stop': 146, 'bull_use_sma': True, 'bull_use_ema': True, 'bull_use_atr': True, 'bull_use_adx': True, 'bull_use_spike': True, 'bull_rsi_required': False, 'bear_strategy': 'breakout', 'bear_bb_std_mult': 1.4379939512060145, 'bear_rsi_os': 29, 'bear_rsi_ob': 72, 'bear_adx_thresh': 8.452239308958703, 'bear_atr_min_pct': 0.021486045561190083, 'bear_atr_max_pct': 0.12462296458000151, 'bear_tp_mult': 2.5906708328850727, 'bear_tsl_mult': 0.07243028943157905, 'bear_time_stop': 34, 'bear_use_sma': False, 'bear_use_ema': False, 'bear_use_atr': True, 'bear_use_adx': False, 'bear_use_spike': True, 'bear_rsi_required': True, 'sideways_strategy': 'breakout', 'sideways_bb_std_mult': 2.388921746854006, 'sideways_rsi_os': 33, 'sideways_rsi_ob': 83, 'sideways_adx_thresh': 14.710595042572653, 'sideways_atr_min_pct': 0.0028422096949060637, 'sideways_atr_max_pct': 0.014331969990270976, 'sideways_tp_mult': 2.669363812990075, 'sideways_tsl_mult': 0.7900682462489987, 'sideways_time_stop': 243, 'sideways_use_sma': True, 'sideways_use_ema': False, 'sideways_use_atr': False, 'sideways_use_adx': False, 'sideways_use_spike': True, 'sideways_rsi_required': False}.
