[I 2025-08-31 11:38:23,469] Trial 826 finished with values: [-1000000000.0, 1000000000.0] and parameters: {'p_sma': 36, 'p_std': 15, 'p_atr': 28, 'p_adx': 22, 'rsi_period': 31, 'ema1': 7, 'ema2': 43, 'slip_atr_k': 0.02876931748677801, 'slip_spread_k': 0.4814915274076731, 'spread_hl_frac': 0.0043477556504630775, 'bb_std_mult': 0.6477226721047056, 'rsi_os': 32, 'rsi_ob': 83, 'vol_spike': 0.09682755655830162, 'adx_thresh': 10.333975743496172, 'atr_min_pct': 0.0063552320849860535, 'atr_max_pct': 0.062178896756449546, 'tp_mult': 1.4464963833890394, 'tsl_mult': 0.08325522697186968, 'strategy': 'breakout', 'time_stop': 110, 'use_sma': True, 'use_atr': True, 'use_adx': False, 'use_ema': True, 'use_spike': False, 'rsi_required': False, 'edge_k': 1.6390439858153245, 'edge_cap': 0.6014944087621777, 'bull_strategy': 'mean_reversion', 'bull_bb_std_mult': 2.8926540761539563, 'bull_rsi_os': 41, 'bull_rsi_ob': 66, 'bull_adx_thresh': 26.148567953591794, 'bull_atr_min_pct': 0.011909057558732799, 'bull_atr_max_pct': 0.03710734782539514, 'bull_tp_mult': 2.092072075927798, 'bull_tsl_mult': 0.2179137417902309, 'bull_time_stop': 38, 'bull_use_sma': False, 'bull_use_ema': True, 'bull_use_atr': False, 'bull_use_adx': True, 'bull_use_spike': False, 'bull_rsi_required': False, 'bear_strategy': 'mean_reversion', 'bear_bb_std_mult': 2.9247753720659766, 'bear_rsi_os': 52, 'bear_rsi_ob': 56, 'bear_adx_thresh': 9.625626042321489, 'bear_atr_min_pct': 0.007478513014449344, 'bear_atr_max_pct': 0.037008617789429654, 'bear_tp_mult': 2.5726190183723965, 'bear_tsl_mult': 0.5792906291973848, 'bear_time_stop': 107, 'bear_use_sma': False, 'bear_use_ema': False, 'bear_use_atr': True, 'bear_use_adx': False, 'bear_use_spike': True, 'bear_rsi_required': False, 'sideways_strategy': 'mean_reversion', 'sideways_bb_std_mult': 1.5913572584292788, 'sideways_rsi_os': 26, 'sideways_rsi_ob': 60, 'sideways_adx_thresh': 27.882572940591885, 'sideways_atr_min_pct': 0.006450879604631564, 'sideways_atr_max_pct': 0.11631285708143455, 'sideways_tp_mult': 1.5751038484649802, 'sideways_tsl_mult': 0.9118860814396414, 'sideways_time_stop': 180, 'sideways_use_sma': True, 'sideways_use_ema': True, 'sideways_use_atr': False, 'sideways_use_adx': False, 'sideways_use_spike': True, 'sideways_rsi_required': False}.
[I 2025-08-31 11:39:03,902] Trial 829 finished with values: [-0.011300936993031585, 0.012761403575221934] and parameters: {'p_sma': 28, 'p_std': 20, 'p_atr': 27, 'p_adx': 22, 'rsi_period': 32, 'ema1': 7, 'ema2': 51, 'slip_atr_k': 0.026124189182745883, 'slip_spread_k': 0.7145708065735915, 'spread_hl_frac': 0.02063291667095116, 'bb_std_mult': 1.7755463059935988, 'rsi_os': 28, 'rsi_ob': 81, 'vol_spike': 0.04754853346396297, 'adx_thresh': 17.633800361144857, 'atr_min_pct': 0.024769588726600275, 'atr_max_pct': 0.12774896797635524, 'tp_mult': 2.3450534803062633, 'tsl_mult': 0.07631762916257859, 'strategy': 'breakout', 'time_stop': 118, 'use_sma': True, 'use_atr': True, 'use_adx': True, 'use_ema': True, 'use_spike': False, 'rsi_required': True, 'edge_k': 1.633190183018006, 'edge_cap': 0.48237024723788136, 'bull_strategy': 'mean_reversion', 'bull_bb_std_mult': 3.26043249065763, 'bull_rsi_os': 41, 'bull_rsi_ob': 64, 'bull_adx_thresh': 18.579553531029738, 'bull_atr_min_pct': 0.010816853352394408, 'bull_atr_max_pct': 0.029674194353695334, 'bull_tp_mult': 2.408253431182685, 'bull_tsl_mult': 0.17437993249951972, 'bull_time_stop': 37, 'bull_use_sma': False, 'bull_use_ema': True, 'bull_use_atr': False, 'bull_use_adx': True, 'bull_use_spike': False, 'bull_rsi_required': False, 'bear_strategy': 'mean_reversion', 'bear_bb_std_mult': 2.6333714522934524, 'bear_rsi_os': 52, 'bear_rsi_ob': 62, 'bear_adx_thresh': 7.744685936863766, 'bear_atr_min_pct': 0.004905138258615844, 'bear_atr_max_pct': 0.04598616026800712, 'bear_tp_mult': 2.6377272211151257, 'bear_tsl_mult': 0.9045938007890608, 'bear_time_stop': 106, 'bear_use_sma': True, 'bear_use_ema': False, 'bear_use_atr': True, 'bear_use_adx': False, 'bear_use_spike': True, 'bear_rsi_required': False, 'sideways_strategy': 'breakout', 'sideways_bb_std_mult': 0.8175977200004401, 'sideways_rsi_os': 40, 'sideways_rsi_ob': 65, 'sideways_adx_thresh': 6.892817693915985, 'sideways_atr_min_pct': 0.00488545384502113, 'sideways_atr_max_pct': 0.11555866750242862, 'sideways_tp_mult': 1.5856620678136175, 'sideways_tsl_mult': 0.8227117759653445, 'sideways_time_stop': 166, 'sideways_use_sma': False, 'sideways_use_ema': True, 'sideways_use_atr': True, 'sideways_use_adx': True, 'sideways_use_spike': True, 'sideways_rsi_required': False}.
[I 2025-08-31 11:39:04,386] Trial 831 finished with values: [-0.056142541732359885, 0.05654007742259675] and parameters: {'p_sma': 9, 'p_std': 23, 'p_atr': 27, 'p_adx': 28, 'rsi_period': 37, 'ema1': 6, 'ema2': 37, 'slip_atr_k': 0.00787599129502748, 'slip_spread_k': 0.5052107150194145, 'spread_hl_frac': 0.03409871549127477, 'bb_std_mult': 3.1643548788886977, 'rsi_os': 21, 'rsi_ob': 91, 'vol_spike': 0.01789038497990461, 'adx_thresh': 10.862512086876176, 'atr_min_pct': 0.024869485481876785, 'atr_max_pct': 0.05054447573539969, 'tp_mult': 2.8334940052273825, 'tsl_mult': 0.08583050524237922, 'strategy': 'breakout', 'time_stop': 17, 'use_sma': True, 'use_atr': True, 'use_adx': True, 'use_ema': True, 'use_spike': False, 'rsi_required': True, 'edge_k': 1.3600653809434766, 'edge_cap': 0.5986675518243275, 'bull_strategy': 'mean_reversion', 'bull_bb_std_mult': 3.239321457188997, 'bull_rsi_os': 41, 'bull_rsi_ob': 66, 'bull_adx_thresh': 30.21197268438627, 'bull_atr_min_pct': 0.01082219062283552, 'bull_atr_max_pct': 0.12825182913350594, 'bull_tp_mult': 2.966563783064451, 'bull_tsl_mult': 0.17539632813900163, 'bull_time_stop': 256, 'bull_use_sma': False, 'bull_use_ema': False, 'bull_use_atr': True, 'bull_use_adx': False, 'bull_use_spike': False, 'bull_rsi_required': False, 'bear_strategy': 'mean_reversion', 'bear_bb_std_mult': 2.611524870001, 'bear_rsi_os': 52, 'bear_rsi_ob': 50, 'bear_adx_thresh': 19.712122523382195, 'bear_atr_min_pct': 0.0007168900220056156, 'bear_atr_max_pct': 0.046813552200421334, 'bear_tp_mult': 1.1037161738625323, 'bear_tsl_mult': 0.2959912989557611, 'bear_time_stop': 99, 'bear_use_sma': True, 'bear_use_ema': False, 'bear_use_atr': True, 'bear_use_adx': True, 'bear_use_spike': True, 'bear_rsi_required': False, 'sideways_strategy': 'breakout', 'sideways_bb_std_mult': 1.094700460352235, 'sideways_rsi_os': 37, 'sideways_rsi_ob': 65, 'sideways_adx_thresh': 26.21290229292919, 'sideways_atr_min_pct': 0.004484743647129926, 'sideways_atr_max_pct': 0.10110473313974874, 'sideways_tp_mult': 1.6048556405641583, 'sideways_tsl_mult': 0.14857684690598733, 'sideways_time_stop': 171, 'sideways_use_sma': False, 'sideways_use_ema': True, 'sideways_use_atr': True, 'sideways_use_adx': True, 'sideways_use_spike': True, 'sideways_rsi_required': False}.
[I 2025-08-31 11:39:04,418] Trial 832 finished with values: [-0.04602155056976953, 0.047412993626438055] and parameters: {'p_sma': 28, 'p_std': 29, 'p_atr': 27, 'p_adx': 24, 'rsi_period': 39, 'ema1': 6, 'ema2': 32, 'slip_atr_k': 0.111291673588669, 'slip_spread_k': 0.5114124670520327, 'spread_hl_frac': 0.023392854606945762, 'bb_std_mult': 0.8421993827931249, 'rsi_os': 55, 'rsi_ob': 81, 'vol_spike': 0.017280562598951166, 'adx_thresh': 10.69711953144122, 'atr_min_pct': 0.02062820226529619, 'atr_max_pct': 0.04960233670134755, 'tp_mult': 2.8402696401055283, 'tsl_mult': 0.2678417042723613, 'strategy': 'breakout', 'time_stop': 87, 'use_sma': True, 'use_atr': True, 'use_adx': True, 'use_ema': True, 'use_spike': True, 'rsi_required': True, 'edge_k': 1.5287433658264302, 'edge_cap': 0.6777214927749224, 'bull_strategy': 'mean_reversion', 'bull_bb_std_mult': 2.4898059196722246, 'bull_rsi_os': 40, 'bull_rsi_ob': 62, 'bull_adx_thresh': 30.11363415497486, 'bull_atr_min_pct': 0.010615809955664999, 'bull_atr_max_pct': 0.03198128855377586, 'bull_tp_mult': 2.9654575882145737, 'bull_tsl_mult': 0.27140945389273186, 'bull_time_stop': 163, 'bull_use_sma': True, 'bull_use_ema': False, 'bull_use_atr': True, 'bull_use_adx': False, 'bull_use_spike': False, 'bull_rsi_required': False, 'bear_strategy': 'mean_reversion', 'bear_bb_std_mult': 0.7140989940878839, 'bear_rsi_os': 46, 'bear_rsi_ob': 75, 'bear_adx_thresh': 6.383490144177708, 'bear_atr_min_pct': 0.004675320210405109, 'bear_atr_max_pct': 0.010061669850370075, 'bear_tp_mult': 2.6404439098362595, 'bear_tsl_mult': 0.5155528529541178, 'bear_time_stop': 101, 'bear_use_sma': True, 'bear_use_ema': False, 'bear_use_atr': True, 'bear_use_adx': True, 'bear_use_spike': True, 'bear_rsi_required': False, 'sideways_strategy': 'breakout', 'sideways_bb_std_mult': 1.0962296676952192, 'sideways_rsi_os': 49, 'sideways_rsi_ob': 65, 'sideways_adx_thresh': 26.01701493519074, 'sideways_atr_min_pct': 0.0008398656676429986, 'sideways_atr_max_pct': 0.11018312717095528, 'sideways_tp_mult': 2.4847863934724983, 'sideways_tsl_mult': 0.8829119506190016, 'sideways_time_stop': 64, 'sideways_use_sma': False, 'sideways_use_ema': True, 'sideways_use_atr': True, 'sideways_use_adx': True, 'sideways_use_spike': True, 'sideways_rsi_required': False}.
[I 2025-08-31 11:39:04,788] Trial 830 finished with values: [0.006772779255187267, 0.0041633678255214] and parameters: {'p_sma': 37, 'p_std': 20, 'p_atr': 27, 'p_adx': 22, 'rsi_period': 37, 'ema1': 6, 'ema2': 44, 'slip_atr_k': 0.008345809833822307, 'slip_spread_k': 0.47779973158928407, 'spread_hl_frac': 0.004225535197899703, 'bb_std_mult': 0.6389857545645701, 'rsi_os': 33, 'rsi_ob': 81, 'vol_spike': 0.03809594080714552, 'adx_thresh': 10.62523542808928, 'atr_min_pct': 0.020593095738153426, 'atr_max_pct': 0.08097739075973681, 'tp_mult': 2.8341685122938363, 'tsl_mult': 0.07996668476617858, 'strategy': 'breakout', 'time_stop': 34, 'use_sma': True, 'use_atr': True, 'use_adx': True, 'use_ema': True, 'use_spike': False, 'rsi_required': True, 'edge_k': 1.1006426656851374, 'edge_cap': 0.5956394747368481, 'bull_strategy': 'mean_reversion', 'bull_bb_std_mult': 1.618236201360878, 'bull_rsi_os': 15, 'bull_rsi_ob': 64, 'bull_adx_thresh': 18.798634346272856, 'bull_atr_min_pct': 0.01003317896870114, 'bull_atr_max_pct': 0.14652022077001048, 'bull_tp_mult': 2.844051336971781, 'bull_tsl_mult': 0.1787369911420903, 'bull_time_stop': 54, 'bull_use_sma': False, 'bull_use_ema': True, 'bull_use_atr': False, 'bull_use_adx': False, 'bull_use_spike': False, 'bull_rsi_required': False, 'bear_strategy': 'mean_reversion', 'bear_bb_std_mult': 1.588655005693917, 'bear_rsi_os': 52, 'bear_rsi_ob': 65, 'bear_adx_thresh': 6.3633295423371035, 'bear_atr_min_pct': 0.004821284367372866, 'bear_atr_max_pct': 0.10137590660151795, 'bear_tp_mult': 2.6389834844601667, 'bear_tsl_mult': 0.2891845687718927, 'bear_time_stop': 107, 'bear_use_sma': False, 'bear_use_ema': False, 'bear_use_atr': True, 'bear_use_adx': True, 'bear_use_spike': True, 'bear_rsi_required': False, 'sideways_strategy': 'breakout', 'sideways_bb_std_mult': 1.1043962398873433, 'sideways_rsi_os': 49, 'sideways_rsi_ob': 61, 'sideways_adx_thresh': 26.136711898082556, 'sideways_atr_min_pct': 0.005076449703472909, 'sideways_atr_max_pct': 0.07367754609415583, 'sideways_tp_mult': 1.4708181702918108, 'sideways_tsl_mult': 0.886843752846438, 'sideways_time_stop': 173, 'sideways_use_sma': False, 'sideways_use_ema': True, 'sideways_use_atr': True, 'sideways_use_adx': True, 'sideways_use_spike': True, 'sideways_rsi_required': False}.
[I 2025-08-31 11:39:45,556] Trial 834 finished with values: [-1000000000.0, 1000000000.0] and parameters: {'p_sma': 41, 'p_std': 57, 'p_atr': 29, 'p_adx': 21, 'rsi_period': 51, 'ema1': 25, 'ema2': 24, 'slip_atr_k': 0.1795008136337716, 'slip_spread_k': 0.13504293694688158, 'spread_hl_frac': 0.02463269284003062, 'bb_std_mult': 0.5015647503389601, 'rsi_os': 33, 'rsi_ob': 93, 'vol_spike': 0.1350261252231254, 'adx_thresh': 33.04112160272641, 'atr_min_pct': 0.004341779932299061, 'atr_max_pct': 0.09422269434167994, 'tp_mult': 1.8328059646828174, 'tsl_mult': 0.1110431660460404, 'strategy': 'breakout', 'time_stop': 78, 'use_sma': True, 'use_atr': True, 'use_adx': False, 'use_ema': True, 'use_spike': False, 'rsi_required': False, 'edge_k': 0.2682217890267852, 'edge_cap': 0.7477359291314204, 'bull_strategy': 'mean_reversion', 'bull_bb_std_mult': 3.0345859436764555, 'bull_rsi_os': 15, 'bull_rsi_ob': 61, 'bull_adx_thresh': 27.929516245560137, 'bull_atr_min_pct': 0.02894133850173354, 'bull_atr_max_pct': 0.140449120359244, 'bull_tp_mult': 1.5824133273665235, 'bull_tsl_mult': 0.324079326219481, 'bull_time_stop': 298, 'bull_use_sma': False, 'bull_use_ema': True, 'bull_use_atr': False, 'bull_use_adx': True, 'bull_use_spike': False, 'bull_rsi_required': False, 'bear_strategy': 'mean_reversion', 'bear_bb_std_mult': 2.2686289937518604, 'bear_rsi_os': 51, 'bear_rsi_ob': 72, 'bear_adx_thresh': 9.12809930832615, 'bear_atr_min_pct': 0.006715224074359907, 'bear_atr_max_pct': 0.12749497804159457, 'bear_tp_mult': 2.762546010880851, 'bear_tsl_mult': 0.8589952348958105, 'bear_time_stop': 93, 'bear_use_sma': False, 'bear_use_ema': False, 'bear_use_atr': True, 'bear_use_adx': False, 'bear_use_spike': True, 'bear_rsi_required': False, 'sideways_strategy': 'mean_reversion', 'sideways_bb_std_mult': 0.9844034987533051, 'sideways_rsi_os': 41, 'sideways_rsi_ob': 52, 'sideways_adx_thresh': 27.11463186738666, 'sideways_atr_min_pct': 0.005385048196567059, 'sideways_atr_max_pct': 0.10384744026507041, 'sideways_tp_mult': 1.4666498486826203, 'sideways_tsl_mult': 0.40294851084184063, 'sideways_time_stop': 294, 'sideways_use_sma': True, 'sideways_use_ema': True, 'sideways_use_atr': False, 'sideways_use_adx': False, 'sideways_use_spike': True, 'sideways_rsi_required': True}.
[I 2025-08-31 11:39:46,024] Trial 836 finished with values: [-1000000000.0, 1000000000.0] and parameters: {'p_sma': 35, 'p_std': 16, 'p_atr': 28, 'p_adx': 21, 'rsi_period': 39, 'ema1': 20, 'ema2': 28, 'slip_atr_k': 0.013239454652343156, 'slip_spread_k': 0.465015012860385, 'spread_hl_frac': 0.024610841827279076, 'bb_std_mult': 2.7953808671147504, 'rsi_os': 30, 'rsi_ob': 89, 'vol_spike': 0.0643746324387429, 'adx_thresh': 11.643209377171575, 'atr_min_pct': 0.01711399910119328, 'atr_max_pct': 0.07913102356424762, 'tp_mult': 2.5876560988378214, 'tsl_mult': 0.12070148950455206, 'strategy': 'breakout', 'time_stop': 75, 'use_sma': True, 'use_atr': True, 'use_adx': False, 'use_ema': True, 'use_spike': False, 'rsi_required': False, 'edge_k': 1.563786933359622, 'edge_cap': 0.671384951019457, 'bull_strategy': 'mean_reversion', 'bull_bb_std_mult': 2.9935923499169284, 'bull_rsi_os': 45, 'bull_rsi_ob': 61, 'bull_adx_thresh': 20.83784363081732, 'bull_atr_min_pct': 0.013383498079049014, 'bull_atr_max_pct': 0.033771839088570794, 'bull_tp_mult': 1.5709049564288493, 'bull_tsl_mult': 0.2502695118893895, 'bull_time_stop': 178, 'bull_use_sma': False, 'bull_use_ema': True, 'bull_use_atr': False, 'bull_use_adx': True, 'bull_use_spike': False, 'bull_rsi_required': False, 'bear_strategy': 'mean_reversion', 'bear_bb_std_mult': 1.3453419464022702, 'bear_rsi_os': 51, 'bear_rsi_ob': 54, 'bear_adx_thresh': 13.007108394033871, 'bear_atr_min_pct': 0.011336975299322335, 'bear_atr_max_pct': 0.14209195680895345, 'bear_tp_mult': 1.7182070524479343, 'bear_tsl_mult': 0.8580017470241383, 'bear_time_stop': 259, 'bear_use_sma': False, 'bear_use_ema': False, 'bear_use_atr': True, 'bear_use_adx': False, 'bear_use_spike': True, 'bear_rsi_required': False, 'sideways_strategy': 'mean_reversion', 'sideways_bb_std_mult': 1.3025240371817075, 'sideways_rsi_os': 38, 'sideways_rsi_ob': 53, 'sideways_adx_thresh': 28.718566716175342, 'sideways_atr_min_pct': 0.00526194065386189, 'sideways_atr_max_pct': 0.10342276989129691, 'sideways_tp_mult': 1.479184185444516, 'sideways_tsl_mult': 0.8933202321174183, 'sideways_time_stop': 140, 'sideways_use_sma': True, 'sideways_use_ema': True, 'sideways_use_atr': False, 'sideways_use_adx': False, 'sideways_use_spike': True, 'sideways_rsi_required': False}.
[I 2025-08-31 11:39:46,252] Trial 833 finished with values: [-1000000000.0, 1000000000.0] and parameters: {'p_sma': 38, 'p_std': 49, 'p_atr': 11, 'p_adx': 21, 'rsi_period': 35, 'ema1': 25, 'ema2': 44, 'slip_atr_k': 0.21790921724107992, 'slip_spread_k': 0.13068782914452998, 'spread_hl_frac': 0.02462735732217275, 'bb_std_mult': 1.6586179587414, 'rsi_os': 33, 'rsi_ob': 81, 'vol_spike': 0.037363158039600664, 'adx_thresh': 22.46487300763247, 'atr_min_pct': 0.0210740715890326, 'atr_max_pct': 0.05774475377796303, 'tp_mult': 2.9015096481710096, 'tsl_mult': 0.5378827664799838, 'strategy': 'breakout', 'time_stop': 91, 'use_sma': True, 'use_atr': True, 'use_adx': False, 'use_ema': True, 'use_spike': True, 'rsi_required': False, 'edge_k': 1.5283511849614417, 'edge_cap': 0.6804297396684128, 'bull_strategy': 'mean_reversion', 'bull_bb_std_mult': 2.639732902609112, 'bull_rsi_os': 17, 'bull_rsi_ob': 61, 'bull_adx_thresh': 27.577271767663287, 'bull_atr_min_pct': 0.013396720858714333, 'bull_atr_max_pct': 0.03328323306892795, 'bull_tp_mult': 2.833512723037104, 'bull_tsl_mult': 0.2699151219396587, 'bull_time_stop': 177, 'bull_use_sma': True, 'bull_use_ema': True, 'bull_use_atr': False, 'bull_use_adx': False, 'bull_use_spike': False, 'bull_rsi_required': False, 'bear_strategy': 'mean_reversion', 'bear_bb_std_mult': 0.7239514350994931, 'bear_rsi_os': 51, 'bear_rsi_ob': 66, 'bear_adx_thresh': 6.5538221743631, 'bear_atr_min_pct': 0.015555194865665343, 'bear_atr_max_pct': 0.14186327966052698, 'bear_tp_mult': 2.7504806543873883, 'bear_tsl_mult': 0.8588056390186105, 'bear_time_stop': 92, 'bear_use_sma': False, 'bear_use_ema': False, 'bear_use_atr': True, 'bear_use_adx': True, 'bear_use_spike': True, 'bear_rsi_required': False, 'sideways_strategy': 'mean_reversion', 'sideways_bb_std_mult': 0.6834157570628938, 'sideways_rsi_os': 38, 'sideways_rsi_ob': 49, 'sideways_adx_thresh': 27.077954888195944, 'sideways_atr_min_pct': 0.0006328485907375492, 'sideways_atr_max_pct': 0.13239334231901054, 'sideways_tp_mult': 2.292705671412311, 'sideways_tsl_mult': 0.8782935551669284, 'sideways_time_stop': 172, 'sideways_use_sma': True, 'sideways_use_ema': True, 'sideways_use_atr': False, 'sideways_use_adx': False, 'sideways_use_spike': True, 'sideways_rsi_required': True}.
[I 2025-08-31 11:39:46,503] Trial 835 finished with values: [-1000000000.0, 1000000000.0] and parameters: {'p_sma': 38, 'p_std': 9, 'p_atr': 11, 'p_adx': 21, 'rsi_period': 9, 'ema1': 5, 'ema2': 31, 'slip_atr_k': 0.014815540091718059, 'slip_spread_k': 0.4643780651445296, 'spread_hl_frac': 0.024632622069657033, 'bb_std_mult': 0.5965763071157636, 'rsi_os': 30, 'rsi_ob': 86, 'vol_spike': 0.13274380116995915, 'adx_thresh': 30.46520566911123, 'atr_min_pct': 0.021629666496430815, 'atr_max_pct': 0.07914064177762713, 'tp_mult': 2.1280473127558808, 'tsl_mult': 0.5410871047537386, 'strategy': 'breakout', 'time_stop': 77, 'use_sma': True, 'use_atr': True, 'use_adx': False, 'use_ema': True, 'use_spike': False, 'rsi_required': False, 'edge_k': 1.4214267999722328, 'edge_cap': 0.30126535718104797, 'bull_strategy': 'mean_reversion', 'bull_bb_std_mult': 2.6647771532695717, 'bull_rsi_os': 43, 'bull_rsi_ob': 61, 'bull_adx_thresh': 27.643641601957775, 'bull_atr_min_pct': 0.014394380434357807, 'bull_atr_max_pct': 0.1445376662552257, 'bull_tp_mult': 2.8523263753562045, 'bull_tsl_mult': 0.45614079170920446, 'bull_time_stop': 54, 'bull_use_sma': False, 'bull_use_ema': True, 'bull_use_atr': False, 'bull_use_adx': True, 'bull_use_spike': False, 'bull_rsi_required': False, 'bear_strategy': 'mean_reversion', 'bear_bb_std_mult': 1.5880085462030522, 'bear_rsi_os': 51, 'bear_rsi_ob': 81, 'bear_adx_thresh': 32.35049431665806, 'bear_atr_min_pct': 0.009541733571143171, 'bear_atr_max_pct': 0.14174527983736646, 'bear_tp_mult': 2.3513595978521438, 'bear_tsl_mult': 0.8595263597189597, 'bear_time_stop': 95, 'bear_use_sma': False, 'bear_use_ema': False, 'bear_use_atr': True, 'bear_use_adx': False, 'bear_use_spike': True, 'bear_rsi_required': False, 'sideways_strategy': 'mean_reversion', 'sideways_bb_std_mult': 1.0042093863041337, 'sideways_rsi_os': 41, 'sideways_rsi_ob': 52, 'sideways_adx_thresh': 17.07158448072906, 'sideways_atr_min_pct': 0.005584822761281973, 'sideways_atr_max_pct': 0.10249731659175212, 'sideways_tp_mult': 1.4633752166466292, 'sideways_tsl_mult': 0.40007412518931834, 'sideways_time_stop': 174, 'sideways_use_sma': True, 'sideways_use_ema': True, 'sideways_use_atr': False, 'sideways_use_adx': False, 'sideways_use_spike': True, 'sideways_rsi_required': True}.
