[I 2025-08-31 10:43:34,608] Trial 422 finished with values: [-1000000000.0, 1000000000.0] and parameters: {'p_sma': 44, 'p_std': 39, 'p_atr': 22, 'p_adx': 24, 'rsi_period': 40, 'ema1': 22, 'ema2': 55, 'slip_atr_k': 0.0018413892423714013, 'slip_spread_k': 0.2136450633314122, 'spread_hl_frac': 0.022994189459742298, 'bb_std_mult': 2.416946784333449, 'rsi_os': 35, 'rsi_ob': 74, 'vol_spike': 0.2304026434201879, 'adx_thresh': 9.431038926645737, 'atr_min_pct': 0.02219234012611171, 'atr_max_pct': 0.039850194962942995, 'tp_mult': 2.9381937689377673, 'tsl_mult': 0.7075709703309221, 'strategy': 'mean_reversion', 'time_stop': 163, 'use_sma': False, 'use_atr': True, 'use_adx': False, 'use_ema': True, 'use_spike': False, 'rsi_required': False, 'edge_k': 1.8661462351127032, 'edge_cap': 0.21796055080400792, 'bull_strategy': 'breakout', 'bull_bb_std_mult': 3.530177774685755, 'bull_rsi_os': 46, 'bull_rsi_ob': 79, 'bull_adx_thresh': 8.231128281100677, 'bull_atr_min_pct': 0.005006557706193819, 'bull_atr_max_pct': 0.03754383619842078, 'bull_tp_mult': 2.8661279035229756, 'bull_tsl_mult': 0.1452479778962299, 'bull_time_stop': 56, 'bull_use_sma': False, 'bull_use_ema': False, 'bull_use_atr': False, 'bull_use_adx': True, 'bull_use_spike': True, 'bull_rsi_required': True, 'bear_strategy': 'breakout', 'bear_bb_std_mult': 1.4130634209398858, 'bear_rsi_os': 23, 'bear_rsi_ob': 53, 'bear_adx_thresh': 13.83953782978986, 'bear_atr_min_pct': 0.02685363727587738, 'bear_atr_max_pct': 0.1405418083389722, 'bear_tp_mult': 2.8037977724666647, 'bear_tsl_mult': 0.04810832506789757, 'bear_time_stop': 49, 'bear_use_sma': False, 'bear_use_ema': False, 'bear_use_atr': True, 'bear_use_adx': False, 'bear_use_spike': True, 'bear_rsi_required': True, 'sideways_strategy': 'mean_reversion', 'sideways_bb_std_mult': 0.5951806314884047, 'sideways_rsi_os': 36, 'sideways_rsi_ob': 55, 'sideways_adx_thresh': 12.828682787898925, 'sideways_atr_min_pct': 0.005996293845194333, 'sideways_atr_max_pct': 0.010537707600269838, 'sideways_tp_mult': 1.9115614701575283, 'sideways_tsl_mult': 0.9310053290419964, 'sideways_time_stop': 273, 'sideways_use_sma': False, 'sideways_use_ema': False, 'sideways_use_atr': False, 'sideways_use_adx': False, 'sideways_use_spike': True, 'sideways_rsi_required': False}.
[I 2025-08-31 10:43:35,103] Trial 425 finished with values: [-1000000000.0, 1000000000.0] and parameters: {'p_sma': 43, 'p_std': 39, 'p_atr': 22, 'p_adx': 21, 'rsi_period': 37, 'ema1': 24, 'ema2': 56, 'slip_atr_k': 0.003957829148963836, 'slip_spread_k': 0.9987132425975738, 'spread_hl_frac': 0.023770829902419542, 'bb_std_mult': 2.331375133113085, 'rsi_os': 33, 'rsi_ob': 77, 'vol_spike': 0.2290636864975662, 'adx_thresh': 10.258300176466863, 'atr_min_pct': 0.021218577559884655, 'atr_max_pct': 0.03622392209295615, 'tp_mult': 2.9003912806808723, 'tsl_mult': 0.7055125706414964, 'strategy': 'mean_reversion', 'time_stop': 164, 'use_sma': True, 'use_atr': False, 'use_adx': False, 'use_ema': False, 'use_spike': False, 'rsi_required': False, 'edge_k': 1.8403363619026698, 'edge_cap': 0.23182209232618292, 'bull_strategy': 'mean_reversion', 'bull_bb_std_mult': 3.4516885728898528, 'bull_rsi_os': 46, 'bull_rsi_ob': 80, 'bull_adx_thresh': 8.513433904393834, 'bull_atr_min_pct': 0.00507686677475702, 'bull_atr_max_pct': 0.037282793290435205, 'bull_tp_mult': 2.8381055960167587, 'bull_tsl_mult': 0.1447715278119737, 'bull_time_stop': 55, 'bull_use_sma': False, 'bull_use_ema': False, 'bull_use_atr': False, 'bull_use_adx': False, 'bull_use_spike': True, 'bull_rsi_required': True, 'bear_strategy': 'breakout', 'bear_bb_std_mult': 1.4002466328030914, 'bear_rsi_os': 23, 'bear_rsi_ob': 51, 'bear_adx_thresh': 15.023271906398808, 'bear_atr_min_pct': 0.024137976805312576, 'bear_atr_max_pct': 0.13811104238230204, 'bear_tp_mult': 2.837486004991443, 'bear_tsl_mult': 0.08617168773052175, 'bear_time_stop': 48, 'bear_use_sma': False, 'bear_use_ema': True, 'bear_use_atr': False, 'bear_use_adx': False, 'bear_use_spike': True, 'bear_rsi_required': False, 'sideways_strategy': 'mean_reversion', 'sideways_bb_std_mult': 1.0971925279407158, 'sideways_rsi_os': 36, 'sideways_rsi_ob': 54, 'sideways_adx_thresh': 13.256109215147257, 'sideways_atr_min_pct': 0.005965436552052228, 'sideways_atr_max_pct': 0.010071693426185245, 'sideways_tp_mult': 1.9286240858226642, 'sideways_tsl_mult': 0.9713218986028263, 'sideways_time_stop': 282, 'sideways_use_sma': False, 'sideways_use_ema': True, 'sideways_use_atr': True, 'sideways_use_adx': False, 'sideways_use_spike': True, 'sideways_rsi_required': True}.
[I 2025-08-31 10:43:35,226] Trial 424 finished with values: [-1000000000.0, 1000000000.0] and parameters: {'p_sma': 43, 'p_std': 39, 'p_atr': 22, 'p_adx': 24, 'rsi_period': 37, 'ema1': 21, 'ema2': 56, 'slip_atr_k': 0.004761784317217315, 'slip_spread_k': 0.25337315759577683, 'spread_hl_frac': 0.024435771154570806, 'bb_std_mult': 2.299663925619465, 'rsi_os': 33, 'rsi_ob': 67, 'vol_spike': 0.23198023000302292, 'adx_thresh': 9.96201906045792, 'atr_min_pct': 0.021098795146719952, 'atr_max_pct': 0.03647635391057824, 'tp_mult': 2.908621008223032, 'tsl_mult': 0.703886616533125, 'strategy': 'mean_reversion', 'time_stop': 161, 'use_sma': True, 'use_atr': False, 'use_adx': False, 'use_ema': False, 'use_spike': False, 'rsi_required': False, 'edge_k': 1.8273001453696898, 'edge_cap': 0.21967860539311718, 'bull_strategy': 'mean_reversion', 'bull_bb_std_mult': 3.435997461312983, 'bull_rsi_os': 46, 'bull_rsi_ob': 79, 'bull_adx_thresh': 8.83208613376294, 'bull_atr_min_pct': 0.004944737925266588, 'bull_atr_max_pct': 0.03705431940789507, 'bull_tp_mult': 2.9431185956874786, 'bull_tsl_mult': 0.16761785846539434, 'bull_time_stop': 81, 'bull_use_sma': False, 'bull_use_ema': False, 'bull_use_atr': False, 'bull_use_adx': False, 'bull_use_spike': True, 'bull_rsi_required': True, 'bear_strategy': 'breakout', 'bear_bb_std_mult': 1.3942467798538045, 'bear_rsi_os': 23, 'bear_rsi_ob': 52, 'bear_adx_thresh': 13.700202240357932, 'bear_atr_min_pct': 0.02483458536054054, 'bear_atr_max_pct': 0.13855509326730975, 'bear_tp_mult': 2.7673807333231313, 'bear_tsl_mult': 0.052517458654031124, 'bear_time_stop': 47, 'bear_use_sma': True, 'bear_use_ema': False, 'bear_use_atr': True, 'bear_use_adx': False, 'bear_use_spike': True, 'bear_rsi_required': False, 'sideways_strategy': 'mean_reversion', 'sideways_bb_std_mult': 3.59074169668881, 'sideways_rsi_os': 37, 'sideways_rsi_ob': 53, 'sideways_adx_thresh': 12.971299219582834, 'sideways_atr_min_pct': 0.0059393378860480885, 'sideways_atr_max_pct': 0.034622414530566074, 'sideways_tp_mult': 1.9248380538514613, 'sideways_tsl_mult': 0.9405470643971676, 'sideways_time_stop': 281, 'sideways_use_sma': True, 'sideways_use_ema': True, 'sideways_use_atr': True, 'sideways_use_adx': True, 'sideways_use_spike': True, 'sideways_rsi_required': True}.
[I 2025-08-31 10:44:08,222] Trial 428 finished with values: [-1000000000.0, 1000000000.0] and parameters: {'p_sma': 43, 'p_std': 38, 'p_atr': 21, 'p_adx': 20, 'rsi_period': 37, 'ema1': 21, 'ema2': 56, 'slip_atr_k': 0.007952929467035207, 'slip_spread_k': 0.2479397932547197, 'spread_hl_frac': 0.02382473724369318, 'bb_std_mult': 2.1121174660070836, 'rsi_os': 34, 'rsi_ob': 76, 'vol_spike': 0.23604997770620692, 'adx_thresh': 9.049226093663158, 'atr_min_pct': 0.020992640674277724, 'atr_max_pct': 0.03867742518472102, 'tp_mult': 2.908386736728591, 'tsl_mult': 0.6945758102397463, 'strategy': 'mean_reversion', 'time_stop': 160, 'use_sma': False, 'use_atr': False, 'use_adx': False, 'use_ema': False, 'use_spike': False, 'rsi_required': False, 'edge_k': 1.780987663120976, 'edge_cap': 0.20030572277343656, 'bull_strategy': 'breakout', 'bull_bb_std_mult': 3.41541876011894, 'bull_rsi_os': 45, 'bull_rsi_ob': 78, 'bull_adx_thresh': 9.791436491666271, 'bull_atr_min_pct': 0.005584203802866987, 'bull_atr_max_pct': 0.04969690485184037, 'bull_tp_mult': 2.928641724349208, 'bull_tsl_mult': 0.17980924399829706, 'bull_time_stop': 77, 'bull_use_sma': False, 'bull_use_ema': True, 'bull_use_atr': False, 'bull_use_adx': False, 'bull_use_spike': True, 'bull_rsi_required': False, 'bear_strategy': 'mean_reversion', 'bear_bb_std_mult': 1.3162458605933913, 'bear_rsi_os': 21, 'bear_rsi_ob': 52, 'bear_adx_thresh': 12.849145525703461, 'bear_atr_min_pct': 0.02507754905081521, 'bear_atr_max_pct': 0.13686887702921213, 'bear_tp_mult': 2.7856816287589403, 'bear_tsl_mult': 0.09432365958767941, 'bear_time_stop': 56, 'bear_use_sma': False, 'bear_use_ema': False, 'bear_use_atr': False, 'bear_use_adx': False, 'bear_use_spike': True, 'bear_rsi_required': False, 'sideways_strategy': 'mean_reversion', 'sideways_bb_std_mult': 2.542119655346828, 'sideways_rsi_os': 37, 'sideways_rsi_ob': 57, 'sideways_adx_thresh': 13.365215879039292, 'sideways_atr_min_pct': 0.00683747376007539, 'sideways_atr_max_pct': 0.041874278952453714, 'sideways_tp_mult': 1.9851715578178297, 'sideways_tsl_mult': 0.9232076061838912, 'sideways_time_stop': 259, 'sideways_use_sma': True, 'sideways_use_ema': False, 'sideways_use_atr': True, 'sideways_use_adx': False, 'sideways_use_spike': True, 'sideways_rsi_required': False}.
[I 2025-08-31 10:44:08,459] Trial 429 finished with values: [-1000000000.0, 1000000000.0] and parameters: {'p_sma': 46, 'p_std': 40, 'p_atr': 21, 'p_adx': 21, 'rsi_period': 43, 'ema1': 22, 'ema2': 55, 'slip_atr_k': 0.00944622695261174, 'slip_spread_k': 0.285077386596336, 'spread_hl_frac': 0.024272414043765216, 'bb_std_mult': 2.378923449352892, 'rsi_os': 36, 'rsi_ob': 72, 'vol_spike': 0.23675235930656738, 'adx_thresh': 31.26638876654777, 'atr_min_pct': 0.020781890228675624, 'atr_max_pct': 0.03938560812732546, 'tp_mult': 2.877936620562431, 'tsl_mult': 0.6971323221121356, 'strategy': 'mean_reversion', 'time_stop': 169, 'use_sma': False, 'use_atr': False, 'use_adx': False, 'use_ema': False, 'use_spike': False, 'rsi_required': False, 'edge_k': 1.810727829035459, 'edge_cap': 0.2060118310609539, 'bull_strategy': 'breakout', 'bull_bb_std_mult': 3.586891783497738, 'bull_rsi_os': 45, 'bull_rsi_ob': 78, 'bull_adx_thresh': 10.044139439665907, 'bull_atr_min_pct': 0.005530381730797791, 'bull_atr_max_pct': 0.050794519077785705, 'bull_tp_mult': 2.738435580060376, 'bull_tsl_mult': 0.17384807912535105, 'bull_time_stop': 78, 'bull_use_sma': False, 'bull_use_ema': True, 'bull_use_atr': False, 'bull_use_adx': True, 'bull_use_spike': False, 'bull_rsi_required': False, 'bear_strategy': 'mean_reversion', 'bear_bb_std_mult': 1.3067624081127394, 'bear_rsi_os': 21, 'bear_rsi_ob': 53, 'bear_adx_thresh': 14.401367216329197, 'bear_atr_min_pct': 0.025111540332238332, 'bear_atr_max_pct': 0.13601673600450248, 'bear_tp_mult': 2.736155423872109, 'bear_tsl_mult': 0.1006337394372305, 'bear_time_stop': 42, 'bear_use_sma': False, 'bear_use_ema': True, 'bear_use_atr': False, 'bear_use_adx': False, 'bear_use_spike': True, 'bear_rsi_required': True, 'sideways_strategy': 'mean_reversion', 'sideways_bb_std_mult': 0.9380370162486535, 'sideways_rsi_os': 37, 'sideways_rsi_ob': 62, 'sideways_adx_thresh': 13.174803482410237, 'sideways_atr_min_pct': 0.006971065202610571, 'sideways_atr_max_pct': 0.015525302193115731, 'sideways_tp_mult': 1.9876976114296985, 'sideways_tsl_mult': 0.9164165873858601, 'sideways_time_stop': 171, 'sideways_use_sma': True, 'sideways_use_ema': False, 'sideways_use_atr': False, 'sideways_use_adx': False, 'sideways_use_spike': True, 'sideways_rsi_required': False}.
[I 2025-08-31 10:44:08,822] Trial 427 finished with values: [-1000000000.0, 1000000000.0] and parameters: {'p_sma': 43, 'p_std': 40, 'p_atr': 21, 'p_adx': 21, 'rsi_period': 37, 'ema1': 24, 'ema2': 56, 'slip_atr_k': 0.007865507945989936, 'slip_spread_k': 0.46001573621546127, 'spread_hl_frac': 0.023996845047304753, 'bb_std_mult': 2.308159020419149, 'rsi_os': 32, 'rsi_ob': 67, 'vol_spike': 0.23571155893332382, 'adx_thresh': 15.60524444861722, 'atr_min_pct': 0.020576425961661093, 'atr_max_pct': 0.03706121631441816, 'tp_mult': 2.907252581594728, 'tsl_mult': 0.7150083407246076, 'strategy': 'mean_reversion', 'time_stop': 159, 'use_sma': True, 'use_atr': False, 'use_adx': False, 'use_ema': False, 'use_spike': False, 'rsi_required': False, 'edge_k': 1.821442262851953, 'edge_cap': 0.22678236284230271, 'bull_strategy': 'mean_reversion', 'bull_bb_std_mult': 3.434749040577708, 'bull_rsi_os': 46, 'bull_rsi_ob': 80, 'bull_adx_thresh': 8.775519350306292, 'bull_atr_min_pct': 0.004522293431889731, 'bull_atr_max_pct': 0.03198661204249629, 'bull_tp_mult': 2.9475077730439248, 'bull_tsl_mult': 0.17348403922568897, 'bull_time_stop': 79, 'bull_use_sma': False, 'bull_use_ema': True, 'bull_use_atr': False, 'bull_use_adx': False, 'bull_use_spike': True, 'bull_rsi_required': False, 'bear_strategy': 'mean_reversion', 'bear_bb_std_mult': 1.3766426634251434, 'bear_rsi_os': 21, 'bear_rsi_ob': 52, 'bear_adx_thresh': 14.941598298717713, 'bear_atr_min_pct': 0.02183038210486155, 'bear_atr_max_pct': 0.1391303037232294, 'bear_tp_mult': 2.841490773176397, 'bear_tsl_mult': 0.07988873612100583, 'bear_time_stop': 45, 'bear_use_sma': False, 'bear_use_ema': True, 'bear_use_atr': False, 'bear_use_adx': False, 'bear_use_spike': True, 'bear_rsi_required': False, 'sideways_strategy': 'mean_reversion', 'sideways_bb_std_mult': 2.5234771646702474, 'sideways_rsi_os': 38, 'sideways_rsi_ob': 57, 'sideways_adx_thresh': 13.433423445334732, 'sideways_atr_min_pct': 0.007114798669346285, 'sideways_atr_max_pct': 0.08234566324139565, 'sideways_tp_mult': 1.9849446449887471, 'sideways_tsl_mult': 0.9087221413694213, 'sideways_time_stop': 40, 'sideways_use_sma': True, 'sideways_use_ema': True, 'sideways_use_atr': True, 'sideways_use_adx': False, 'sideways_use_spike': True, 'sideways_rsi_required': True}.
[I 2025-08-31 10:44:09,089] Trial 426 finished with values: [-1000000000.0, 1000000000.0] and parameters: {'p_sma': 43, 'p_std': 38, 'p_atr': 21, 'p_adx': 21, 'rsi_period': 37, 'ema1': 24, 'ema2': 56, 'slip_atr_k': 0.007175563260407738, 'slip_spread_k': 0.24490389588127592, 'spread_hl_frac': 0.023799493918143594, 'bb_std_mult': 2.269697994646224, 'rsi_os': 34, 'rsi_ob': 67, 'vol_spike': 0.23386059206719068, 'adx_thresh': 10.159434584125695, 'atr_min_pct': 0.021074040940469198, 'atr_max_pct': 0.036512066098916565, 'tp_mult': 2.89085921878959, 'tsl_mult': 0.7140877877812033, 'strategy': 'mean_reversion', 'time_stop': 160, 'use_sma': True, 'use_atr': False, 'use_adx': False, 'use_ema': False, 'use_spike': False, 'rsi_required': False, 'edge_k': 1.8118442665715055, 'edge_cap': 0.24298221033118128, 'bull_strategy': 'mean_reversion', 'bull_bb_std_mult': 3.4595167780741116, 'bull_rsi_os': 45, 'bull_rsi_ob': 78, 'bull_adx_thresh': 8.890381050034282, 'bull_atr_min_pct': 0.005580722252692001, 'bull_atr_max_pct': 0.02565963967592544, 'bull_tp_mult': 2.939763062132318, 'bull_tsl_mult': 0.17486905966279176, 'bull_time_stop': 48, 'bull_use_sma': False, 'bull_use_ema': True, 'bull_use_atr': False, 'bull_use_adx': False, 'bull_use_spike': True, 'bull_rsi_required': False, 'bear_strategy': 'mean_reversion', 'bear_bb_std_mult': 1.3333328371627835, 'bear_rsi_os': 21, 'bear_rsi_ob': 54, 'bear_adx_thresh': 15.141233749461321, 'bear_atr_min_pct': 0.025282426300898417, 'bear_atr_max_pct': 0.1378410488527104, 'bear_tp_mult': 2.7536232655649138, 'bear_tsl_mult': 0.06308298015497943, 'bear_time_stop': 45, 'bear_use_sma': False, 'bear_use_ema': True, 'bear_use_atr': False, 'bear_use_adx': False, 'bear_use_spike': True, 'bear_rsi_required': False, 'sideways_strategy': 'mean_reversion', 'sideways_bb_std_mult': 1.0870224679540983, 'sideways_rsi_os': 37, 'sideways_rsi_ob': 58, 'sideways_adx_thresh': 13.286691322290542, 'sideways_atr_min_pct': 0.006949404186429435, 'sideways_atr_max_pct': 0.0404493401467691, 'sideways_tp_mult': 1.9737118495087818, 'sideways_tsl_mult': 0.9286416638049805, 'sideways_time_stop': 259, 'sideways_use_sma': True, 'sideways_use_ema': True, 'sideways_use_atr': True, 'sideways_use_adx': False, 'sideways_use_spike': True, 'sideways_rsi_required': True}.
[I 2025-08-31 10:44:39,766] Trial 431 finished with values: [-1000000000.0, 1000000000.0] and parameters: {'p_sma': 45, 'p_std': 38, 'p_atr': 23, 'p_adx': 23, 'rsi_period': 39, 'ema1': 23, 'ema2': 56, 'slip_atr_k': 0.004548903929105954, 'slip_spread_k': 0.18716049132126408, 'spread_hl_frac': 0.022288073201167876, 'bb_std_mult': 3.41223231804146, 'rsi_os': 32, 'rsi_ob': 50, 'vol_spike': 0.22591752742067636, 'adx_thresh': 11.69314467654948, 'atr_min_pct': 0.004429774870211373, 'atr_max_pct': 0.03617945868291715, 'tp_mult': 2.869159001869303, 'tsl_mult': 0.7163768813099705, 'strategy': 'breakout', 'time_stop': 158, 'use_sma': False, 'use_atr': False, 'use_adx': False, 'use_ema': False, 'use_spike': False, 'rsi_required': False, 'edge_k': 1.7868056975127138, 'edge_cap': 0.2512943573616384, 'bull_strategy': 'breakout', 'bull_bb_std_mult': 3.4788710030365166, 'bull_rsi_os': 45, 'bull_rsi_ob': 78, 'bull_adx_thresh': 9.580321954773709, 'bull_atr_min_pct': 0.009096121656763496, 'bull_atr_max_pct': 0.055609502422794846, 'bull_tp_mult': 2.994015189011994, 'bull_tsl_mult': 0.18946067933431904, 'bull_time_stop': 49, 'bull_use_sma': False, 'bull_use_ema': True, 'bull_use_atr': False, 'bull_use_adx': True, 'bull_use_spike': True, 'bull_rsi_required': False, 'bear_strategy': 'breakout', 'bear_bb_std_mult': 1.4700537010410375, 'bear_rsi_os': 20, 'bear_rsi_ob': 53, 'bear_adx_thresh': 12.494021738254018, 'bear_atr_min_pct': 0.023056748213400438, 'bear_atr_max_pct': 0.13905935116107412, 'bear_tp_mult': 2.7762003471559717, 'bear_tsl_mult': 0.0682225257468882, 'bear_time_stop': 41, 'bear_use_sma': False, 'bear_use_ema': False, 'bear_use_atr': True, 'bear_use_adx': False, 'bear_use_spike': False, 'bear_rsi_required': True, 'sideways_strategy': 'mean_reversion', 'sideways_bb_std_mult': 2.0193675102858206, 'sideways_rsi_os': 38, 'sideways_rsi_ob': 58, 'sideways_adx_thresh': 11.850630070452691, 'sideways_atr_min_pct': 0.00517512507802914, 'sideways_atr_max_pct': 0.012791245002322009, 'sideways_tp_mult': 1.863685044095679, 'sideways_tsl_mult': 0.9664427784320564, 'sideways_time_stop': 267, 'sideways_use_sma': True, 'sideways_use_ema': False, 'sideways_use_atr': False, 'sideways_use_adx': False, 'sideways_use_spike': False, 'sideways_rsi_required': False}.
[I 2025-08-31 10:44:40,107] Trial 433 finished with values: [-1000000000.0, 1000000000.0] and parameters: {'p_sma': 45, 'p_std': 38, 'p_atr': 23, 'p_adx': 23, 'rsi_period': 45, 'ema1': 23, 'ema2': 57, 'slip_atr_k': 0.0014542675254066615, 'slip_spread_k': 0.5115091453732491, 'spread_hl_frac': 0.021730658639200373, 'bb_std_mult': 3.395971207945516, 'rsi_os': 36, 'rsi_ob': 79, 'vol_spike': 0.24307949786614974, 'adx_thresh': 8.687720957303556, 'atr_min_pct': 0.011653746340001032, 'atr_max_pct': 0.038948143257258705, 'tp_mult': 2.8702085406703146, 'tsl_mult': 0.6758373119989846, 'strategy': 'breakout', 'time_stop': 156, 'use_sma': False, 'use_atr': False, 'use_adx': False, 'use_ema': False, 'use_spike': False, 'rsi_required': False, 'edge_k': 1.7945162090348816, 'edge_cap': 0.19747598346050116, 'bull_strategy': 'breakout', 'bull_bb_std_mult': 3.5073862643553864, 'bull_rsi_os': 45, 'bull_rsi_ob': 78, 'bull_adx_thresh': 9.919520039899954, 'bull_atr_min_pct': 0.010515817157058984, 'bull_atr_max_pct': 0.05537635329992559, 'bull_tp_mult': 2.7730409395762856, 'bull_tsl_mult': 0.1351819805166506, 'bull_time_stop': 61, 'bull_use_sma': False, 'bull_use_ema': True, 'bull_use_atr': False, 'bull_use_adx': True, 'bull_use_spike': False, 'bull_rsi_required': False, 'bear_strategy': 'breakout', 'bear_bb_std_mult': 1.5121821820644703, 'bear_rsi_os': 19, 'bear_rsi_ob': 54, 'bear_adx_thresh': 12.62474095330975, 'bear_atr_min_pct': 0.022867634951140664, 'bear_atr_max_pct': 0.14321095375679052, 'bear_tp_mult': 2.7595212768330133, 'bear_tsl_mult': 0.06781650072682786, 'bear_time_stop': 39, 'bear_use_sma': False, 'bear_use_ema': False, 'bear_use_atr': True, 'bear_use_adx': False, 'bear_use_spike': False, 'bear_rsi_required': True, 'sideways_strategy': 'mean_reversion', 'sideways_bb_std_mult': 3.4177437631745624, 'sideways_rsi_os': 36, 'sideways_rsi_ob': 51, 'sideways_adx_thresh': 13.785270383042374, 'sideways_atr_min_pct': 0.005442326886798025, 'sideways_atr_max_pct': 0.013594063627831637, 'sideways_tp_mult': 1.8783193705451098, 'sideways_tsl_mult': 0.985275256160599, 'sideways_time_stop': 267, 'sideways_use_sma': True, 'sideways_use_ema': False, 'sideways_use_atr': False, 'sideways_use_adx': False, 'sideways_use_spike': False, 'sideways_rsi_required': False}.
