[I 2025-08-31 10:45:45,740] Trial 438 finished with values: [-0.002988491347022282, 0.0032126674470748483] and parameters: {'p_sma': 41, 'p_std': 38, 'p_atr': 22, 'p_adx': 19, 'rsi_period': 40, 'ema1': 19, 'ema2': 57, 'slip_atr_k': 0.012101489956963188, 'slip_spread_k': 0.922476309533544, 'spread_hl_frac': 0.024866052001116024, 'bb_std_mult': 2.1890126399782535, 'rsi_os': 35, 'rsi_ob': 64, 'vol_spike': 0.22450657758053136, 'adx_thresh': 27.486836318470864, 'atr_min_pct': 0.019572304581821243, 'atr_max_pct': 0.13467630791225424, 'tp_mult': 2.941499669643756, 'tsl_mult': 0.6747640945334518, 'strategy': 'mean_reversion', 'time_stop': 168, 'use_sma': False, 'use_atr': True, 'use_adx': False, 'use_ema': True, 'use_spike': False, 'rsi_required': False, 'edge_k': 0.3508712809337683, 'edge_cap': 0.18400492488578438, 'bull_strategy': 'breakout', 'bull_bb_std_mult': 3.372917976068711, 'bull_rsi_os': 45, 'bull_rsi_ob': 81, 'bull_adx_thresh': 10.2415995011727, 'bull_atr_min_pct': 0.003877441456715293, 'bull_atr_max_pct': 0.04690931832989698, 'bull_tp_mult': 2.6982488874105703, 'bull_tsl_mult': 0.140558584179478, 'bull_time_stop': 67, 'bull_use_sma': False, 'bull_use_ema': False, 'bull_use_atr': False, 'bull_use_adx': True, 'bull_use_spike': True, 'bull_rsi_required': False, 'bear_strategy': 'breakout', 'bear_bb_std_mult': 1.5798513792758406, 'bear_rsi_os': 23, 'bear_rsi_ob': 55, 'bear_adx_thresh': 13.266712621535545, 'bear_atr_min_pct': 0.02622770591512113, 'bear_atr_max_pct': 0.14677419142204778, 'bear_tp_mult': 2.8363127947307802, 'bear_tsl_mult': 0.10530372826259565, 'bear_time_stop': 264, 'bear_use_sma': True, 'bear_use_ema': False, 'bear_use_atr': True, 'bear_use_adx': True, 'bear_use_spike': True, 'bear_rsi_required': True, 'sideways_strategy': 'mean_reversion', 'sideways_bb_std_mult': 2.2122297051076436, 'sideways_rsi_os': 36, 'sideways_rsi_ob': 59, 'sideways_adx_thresh': 13.941472862705735, 'sideways_atr_min_pct': 0.00636020853675484, 'sideways_atr_max_pct': 0.012810547146248411, 'sideways_tp_mult': 1.8833389108799723, 'sideways_tsl_mult': 0.9527799082190552, 'sideways_time_stop': 157, 'sideways_use_sma': False, 'sideways_use_ema': False, 'sideways_use_atr': False, 'sideways_use_adx': True, 'sideways_use_spike': True, 'sideways_rsi_required': False}.
[I 2025-08-31 10:46:17,604] Trial 443 finished with values: [-1000000000.0, 1000000000.0] and parameters: {'p_sma': 44, 'p_std': 38, 'p_atr': 22, 'p_adx': 16, 'rsi_period': 42, 'ema1': 22, 'ema2': 56, 'slip_atr_k': 0.005581266467084435, 'slip_spread_k': 0.29021892093546375, 'spread_hl_frac': 0.024388666661748337, 'bb_std_mult': 2.49189175534492, 'rsi_os': 34, 'rsi_ob': 86, 'vol_spike': 0.2231390478899576, 'adx_thresh': 8.513090620401037, 'atr_min_pct': 0.019583003119735834, 'atr_max_pct': 0.07492562101813517, 'tp_mult': 2.8479228744493708, 'tsl_mult': 0.7105421035831974, 'strategy': 'mean_reversion', 'time_stop': 167, 'use_sma': False, 'use_atr': False, 'use_adx': False, 'use_ema': False, 'use_spike': False, 'rsi_required': False, 'edge_k': 1.7682553928682867, 'edge_cap': 0.20664518242896315, 'bull_strategy': 'breakout', 'bull_bb_std_mult': 3.478262238383736, 'bull_rsi_os': 44, 'bull_rsi_ob': 77, 'bull_adx_thresh': 14.365867414675266, 'bull_atr_min_pct': 0.003985056291674402, 'bull_atr_max_pct': 0.03459347085356652, 'bull_tp_mult': 2.8378012583271954, 'bull_tsl_mult': 0.12934926032272845, 'bull_time_stop': 72, 'bull_use_sma': False, 'bull_use_ema': True, 'bull_use_atr': False, 'bull_use_adx': False, 'bull_use_spike': True, 'bull_rsi_required': False, 'bear_strategy': 'breakout', 'bear_bb_std_mult': 1.3557750986527317, 'bear_rsi_os': 24, 'bear_rsi_ob': 53, 'bear_adx_thresh': 13.468764122315129, 'bear_atr_min_pct': 0.025555401991510525, 'bear_atr_max_pct': 0.1464404281741643, 'bear_tp_mult': 2.791791260955865, 'bear_tsl_mult': 0.10852002532244623, 'bear_time_stop': 35, 'bear_use_sma': False, 'bear_use_ema': False, 'bear_use_atr': False, 'bear_use_adx': False, 'bear_use_spike': False, 'bear_rsi_required': False, 'sideways_strategy': 'mean_reversion', 'sideways_bb_std_mult': 2.650747778909964, 'sideways_rsi_os': 5, 'sideways_rsi_ob': 62, 'sideways_adx_thresh': 14.361776636619945, 'sideways_atr_min_pct': 0.0057835364925687876, 'sideways_atr_max_pct': 0.13801888376521781, 'sideways_tp_mult': 1.9395735711615694, 'sideways_tsl_mult': 0.889539052666004, 'sideways_time_stop': 48, 'sideways_use_sma': True, 'sideways_use_ema': False, 'sideways_use_atr': True, 'sideways_use_adx': False, 'sideways_use_spike': True, 'sideways_rsi_required': False}.
[I 2025-08-31 10:46:17,778] Trial 442 finished with values: [-1000000000.0, 1000000000.0] and parameters: {'p_sma': 44, 'p_std': 38, 'p_atr': 21, 'p_adx': 25, 'rsi_period': 42, 'ema1': 22, 'ema2': 57, 'slip_atr_k': 0.0127168745855998, 'slip_spread_k': 0.28415284054110823, 'spread_hl_frac': 0.023316845730294203, 'bb_std_mult': 2.441872221815709, 'rsi_os': 34, 'rsi_ob': 80, 'vol_spike': 0.22295409386793355, 'adx_thresh': 14.122774633338864, 'atr_min_pct': 0.019581877114245277, 'atr_max_pct': 0.08460912625735659, 'tp_mult': 2.8402534466108746, 'tsl_mult': 0.6995051810850813, 'strategy': 'mean_reversion', 'time_stop': 156, 'use_sma': False, 'use_atr': False, 'use_adx': False, 'use_ema': False, 'use_spike': False, 'rsi_required': False, 'edge_k': 1.9371472645496846, 'edge_cap': 0.21217465955152764, 'bull_strategy': 'breakout', 'bull_bb_std_mult': 3.370371366751251, 'bull_rsi_os': 44, 'bull_rsi_ob': 77, 'bull_adx_thresh': 32.27562635143252, 'bull_atr_min_pct': 0.004004865499031318, 'bull_atr_max_pct': 0.0429127038297495, 'bull_tp_mult': 2.902366424269735, 'bull_tsl_mult': 0.9270163237099015, 'bull_time_stop': 72, 'bull_use_sma': False, 'bull_use_ema': True, 'bull_use_atr': False, 'bull_use_adx': True, 'bull_use_spike': True, 'bull_rsi_required': False, 'bear_strategy': 'breakout', 'bear_bb_std_mult': 1.3668417200402974, 'bear_rsi_os': 24, 'bear_rsi_ob': 55, 'bear_adx_thresh': 14.158432419965267, 'bear_atr_min_pct': 0.02538634920743398, 'bear_atr_max_pct': 0.1407802944135311, 'bear_tp_mult': 2.7179910921919226, 'bear_tsl_mult': 0.10761949052836792, 'bear_time_stop': 134, 'bear_use_sma': False, 'bear_use_ema': False, 'bear_use_atr': True, 'bear_use_adx': False, 'bear_use_spike': False, 'bear_rsi_required': True, 'sideways_strategy': 'mean_reversion', 'sideways_bb_std_mult': 2.7609941813735017, 'sideways_rsi_os': 36, 'sideways_rsi_ob': 56, 'sideways_adx_thresh': 14.168444012675666, 'sideways_atr_min_pct': 0.005591337423970175, 'sideways_atr_max_pct': 0.1123199795305724, 'sideways_tp_mult': 1.9519966169826488, 'sideways_tsl_mult': 0.8987515287966876, 'sideways_time_stop': 91, 'sideways_use_sma': False, 'sideways_use_ema': False, 'sideways_use_atr': False, 'sideways_use_adx': False, 'sideways_use_spike': True, 'sideways_rsi_required': False}.
[I 2025-08-31 10:46:18,251] Trial 445 finished with values: [-1000000000.0, 1000000000.0] and parameters: {'p_sma': 47, 'p_std': 38, 'p_atr': 22, 'p_adx': 13, 'rsi_period': 42, 'ema1': 22, 'ema2': 57, 'slip_atr_k': 0.005712675313132524, 'slip_spread_k': 0.2691611884725079, 'spread_hl_frac': 0.024539460308833354, 'bb_std_mult': 2.4740232524695065, 'rsi_os': 34, 'rsi_ob': 64, 'vol_spike': 0.22110119874044992, 'adx_thresh': 8.577431573500254, 'atr_min_pct': 0.01942985648906964, 'atr_max_pct': 0.11531700140833089, 'tp_mult': 2.842256105473975, 'tsl_mult': 0.7079651813429584, 'strategy': 'mean_reversion', 'time_stop': 167, 'use_sma': False, 'use_atr': False, 'use_adx': False, 'use_ema': False, 'use_spike': False, 'rsi_required': False, 'edge_k': 1.9958111860743843, 'edge_cap': 0.18044646605326886, 'bull_strategy': 'mean_reversion', 'bull_bb_std_mult': 3.482520240864082, 'bull_rsi_os': 44, 'bull_rsi_ob': 77, 'bull_adx_thresh': 29.636427983918118, 'bull_atr_min_pct': 0.01836810877793524, 'bull_atr_max_pct': 0.0333025753367796, 'bull_tp_mult': 2.830555119636546, 'bull_tsl_mult': 0.12407196340402951, 'bull_time_stop': 68, 'bull_use_sma': False, 'bull_use_ema': True, 'bull_use_atr': False, 'bull_use_adx': True, 'bull_use_spike': True, 'bull_rsi_required': False, 'bear_strategy': 'breakout', 'bear_bb_std_mult': 1.349069353026023, 'bear_rsi_os': 24, 'bear_rsi_ob': 53, 'bear_adx_thresh': 13.595095597455588, 'bear_atr_min_pct': 0.02535433125307156, 'bear_atr_max_pct': 0.1410803494540416, 'bear_tp_mult': 2.778271863447736, 'bear_tsl_mult': 0.1082986364911777, 'bear_time_stop': 35, 'bear_use_sma': False, 'bear_use_ema': True, 'bear_use_atr': False, 'bear_use_adx': False, 'bear_use_spike': False, 'bear_rsi_required': True, 'sideways_strategy': 'mean_reversion', 'sideways_bb_std_mult': 1.6967571813670945, 'sideways_rsi_os': 35, 'sideways_rsi_ob': 58, 'sideways_adx_thresh': 14.40762501094782, 'sideways_atr_min_pct': 0.0056537313828116005, 'sideways_atr_max_pct': 0.12303913749775594, 'sideways_tp_mult': 1.9414195669720586, 'sideways_tsl_mult': 0.8784371567439241, 'sideways_time_stop': 277, 'sideways_use_sma': True, 'sideways_use_ema': True, 'sideways_use_atr': True, 'sideways_use_adx': False, 'sideways_use_spike': True, 'sideways_rsi_required': False}.
[I 2025-08-31 10:46:18,534] Trial 444 finished with values: [-1000000000.0, 1000000000.0] and parameters: {'p_sma': 47, 'p_std': 38, 'p_atr': 22, 'p_adx': 13, 'rsi_period': 42, 'ema1': 22, 'ema2': 18, 'slip_atr_k': 0.0056218331976840225, 'slip_spread_k': 0.2909532345731244, 'spread_hl_frac': 0.024677439644326546, 'bb_std_mult': 1.7663534325511598, 'rsi_os': 35, 'rsi_ob': 64, 'vol_spike': 0.2297037104614011, 'adx_thresh': 17.685659870767918, 'atr_min_pct': 0.01970739031092156, 'atr_max_pct': 0.07897474683955584, 'tp_mult': 2.8532199816656645, 'tsl_mult': 0.7125560027669174, 'strategy': 'mean_reversion', 'time_stop': 154, 'use_sma': False, 'use_atr': False, 'use_adx': False, 'use_ema': False, 'use_spike': False, 'rsi_required': False, 'edge_k': 1.9344750411850273, 'edge_cap': 0.21158027504694807, 'bull_strategy': 'mean_reversion', 'bull_bb_std_mult': 3.500708398024717, 'bull_rsi_os': 44, 'bull_rsi_ob': 77, 'bull_adx_thresh': 9.330224230760534, 'bull_atr_min_pct': 0.004012722319363161, 'bull_atr_max_pct': 0.03263307097443138, 'bull_tp_mult': 2.834568075020692, 'bull_tsl_mult': 0.48765408451979975, 'bull_time_stop': 72, 'bull_use_sma': False, 'bull_use_ema': True, 'bull_use_atr': False, 'bull_use_adx': True, 'bull_use_spike': True, 'bull_rsi_required': False, 'bear_strategy': 'breakout', 'bear_bb_std_mult': 1.3589357880917836, 'bear_rsi_os': 24, 'bear_rsi_ob': 55, 'bear_adx_thresh': 13.596659632122696, 'bear_atr_min_pct': 0.025434983950262335, 'bear_atr_max_pct': 0.14060072780585833, 'bear_tp_mult': 2.71221711821056, 'bear_tsl_mult': 0.10608232797141268, 'bear_time_stop': 155, 'bear_use_sma': False, 'bear_use_ema': True, 'bear_use_atr': False, 'bear_use_adx': False, 'bear_use_spike': False, 'bear_rsi_required': True, 'sideways_strategy': 'mean_reversion', 'sideways_bb_std_mult': 1.9524775957454035, 'sideways_rsi_os': 35, 'sideways_rsi_ob': 58, 'sideways_adx_thresh': 25.264208604400118, 'sideways_atr_min_pct': 0.005712047827832868, 'sideways_atr_max_pct': 0.10371690918365953, 'sideways_tp_mult': 1.8836565052712384, 'sideways_tsl_mult': 0.8809906407194819, 'sideways_time_stop': 49, 'sideways_use_sma': True, 'sideways_use_ema': True, 'sideways_use_atr': True, 'sideways_use_adx': False, 'sideways_use_spike': True, 'sideways_rsi_required': False}.
[I 2025-08-31 10:46:19,281] Trial 446 finished with values: [-1000000000.0, 1000000000.0] and parameters: {'p_sma': 47, 'p_std': 37, 'p_atr': 22, 'p_adx': 26, 'rsi_period': 39, 'ema1': 21, 'ema2': 33, 'slip_atr_k': 0.004961694889081382, 'slip_spread_k': 0.9094297886066594, 'spread_hl_frac': 0.025444365458588396, 'bb_std_mult': 0.9573669368667495, 'rsi_os': 35, 'rsi_ob': 47, 'vol_spike': 0.23037107387662553, 'adx_thresh': 16.63298440550136, 'atr_min_pct': 0.019061604159208503, 'atr_max_pct': 0.1324881768796589, 'tp_mult': 2.8830594005522423, 'tsl_mult': 0.0023190386638772265, 'strategy': 'mean_reversion', 'time_stop': 154, 'use_sma': True, 'use_atr': False, 'use_adx': False, 'use_ema': False, 'use_spike': False, 'rsi_required': False, 'edge_k': 1.072963340591542, 'edge_cap': 0.22888789444749402, 'bull_strategy': 'mean_reversion', 'bull_bb_std_mult': 3.4895290778490953, 'bull_rsi_os': 45, 'bull_rsi_ob': 78, 'bull_adx_thresh': 9.56497454047169, 'bull_atr_min_pct': 0.018123388594167976, 'bull_atr_max_pct': 0.048092191168355364, 'bull_tp_mult': 2.8325577193066516, 'bull_tsl_mult': 0.12746500379615, 'bull_time_stop': 43, 'bull_use_sma': False, 'bull_use_ema': True, 'bull_use_atr': False, 'bull_use_adx': True, 'bull_use_spike': False, 'bull_rsi_required': False, 'bear_strategy': 'mean_reversion', 'bear_bb_std_mult': 1.4339205437411826, 'bear_rsi_os': 23, 'bear_rsi_ob': 51, 'bear_adx_thresh': 13.606438420836563, 'bear_atr_min_pct': 0.023757568616891624, 'bear_atr_max_pct': 0.13758492589632865, 'bear_tp_mult': 2.8246105392485035, 'bear_tsl_mult': 0.86483795231336, 'bear_time_stop': 252, 'bear_use_sma': False, 'bear_use_ema': True, 'bear_use_atr': True, 'bear_use_adx': True, 'bear_use_spike': True, 'bear_rsi_required': True, 'sideways_strategy': 'mean_reversion', 'sideways_bb_std_mult': 1.9464532274640554, 'sideways_rsi_os': 44, 'sideways_rsi_ob': 58, 'sideways_adx_thresh': 12.427910466581848, 'sideways_atr_min_pct': 0.005007013601235111, 'sideways_atr_max_pct': 0.1234223570015606, 'sideways_tp_mult': 2.014955875869794, 'sideways_tsl_mult': 0.8738050298360001, 'sideways_time_stop': 199, 'sideways_use_sma': True, 'sideways_use_ema': True, 'sideways_use_atr': False, 'sideways_use_adx': False, 'sideways_use_spike': True, 'sideways_rsi_required': True}.
[I 2025-08-31 10:46:49,477] Trial 449 finished with values: [-1000000000.0, 1000000000.0] and parameters: {'p_sma': 45, 'p_std': 37, 'p_atr': 23, 'p_adx': 14, 'rsi_period': 40, 'ema1': 23, 'ema2': 54, 'slip_atr_k': 9.386801916150386e-05, 'slip_spread_k': 0.25781423930682046, 'spread_hl_frac': 0.025328518590057927, 'bb_std_mult': 2.430105447539515, 'rsi_os': 35, 'rsi_ob': 78, 'vol_spike': 0.23369896495358783, 'adx_thresh': 5.85183143669048, 'atr_min_pct': 0.006128334821443444, 'atr_max_pct': 0.043340106058134556, 'tp_mult': 2.9188625478952503, 'tsl_mult': 0.6658490889444921, 'strategy': 'breakout', 'time_stop': 163, 'use_sma': True, 'use_atr': False, 'use_adx': False, 'use_ema': False, 'use_spike': False, 'rsi_required': False, 'edge_k': 1.084135162986145, 'edge_cap': 0.18116469839726876, 'bull_strategy': 'breakout', 'bull_bb_std_mult': 3.5665283515368476, 'bull_rsi_os': 45, 'bull_rsi_ob': 78, 'bull_adx_thresh': 16.43979822039992, 'bull_atr_min_pct': 0.004640976904511095, 'bull_atr_max_pct': 0.023346379308202377, 'bull_tp_mult': 2.906229520615705, 'bull_tsl_mult': 0.1323613722449642, 'bull_time_stop': 60, 'bull_use_sma': False, 'bull_use_ema': True, 'bull_use_atr': False, 'bull_use_adx': True, 'bull_use_spike': False, 'bull_rsi_required': False, 'bear_strategy': 'mean_reversion', 'bear_bb_std_mult': 1.4382212254066296, 'bear_rsi_os': 22, 'bear_rsi_ob': 52, 'bear_adx_thresh': 14.87150609060882, 'bear_atr_min_pct': 0.023608513940399353, 'bear_atr_max_pct': 0.1369593009207746, 'bear_tp_mult': 2.809102425146841, 'bear_tsl_mult': 0.031025844416382675, 'bear_time_stop': 58, 'bear_use_sma': False, 'bear_use_ema': False, 'bear_use_atr': True, 'bear_use_adx': True, 'bear_use_spike': True, 'bear_rsi_required': True, 'sideways_strategy': 'mean_reversion', 'sideways_bb_std_mult': 2.5795440653520103, 'sideways_rsi_os': 41, 'sideways_rsi_ob': 59, 'sideways_adx_thresh': 12.558613416790651, 'sideways_atr_min_pct': 0.007640010143834018, 'sideways_atr_max_pct': 0.0100490082852877, 'sideways_tp_mult': 2.0252268972345937, 'sideways_tsl_mult': 0.9022064068343361, 'sideways_time_stop': 156, 'sideways_use_sma': True, 'sideways_use_ema': False, 'sideways_use_atr': False, 'sideways_use_adx': False, 'sideways_use_spike': False, 'sideways_rsi_required': True}.
[I 2025-08-31 10:46:50,173] Trial 448 finished with values: [-1000000000.0, 1000000000.0] and parameters: {'p_sma': 46, 'p_std': 37, 'p_atr': 23, 'p_adx': 14, 'rsi_period': 39, 'ema1': 20, 'ema2': 54, 'slip_atr_k': 6.287180547814093e-05, 'slip_spread_k': 0.21353878901399648, 'spread_hl_frac': 0.025635215403508844, 'bb_std_mult': 1.7730477754597482, 'rsi_os': 35, 'rsi_ob': 77, 'vol_spike': 0.22965258337972747, 'adx_thresh': 23.735472115379984, 'atr_min_pct': 0.01886706753255864, 'atr_max_pct': 0.04382859667087428, 'tp_mult': 2.8958909971076636, 'tsl_mult': 0.65919820419716, 'strategy': 'mean_reversion', 'time_stop': 153, 'use_sma': True, 'use_atr': False, 'use_adx': False, 'use_ema': False, 'use_spike': False, 'rsi_required': False, 'edge_k': 0.40965013238618564, 'edge_cap': 0.2286267651314435, 'bull_strategy': 'breakout', 'bull_bb_std_mult': 3.5914080237279453, 'bull_rsi_os': 45, 'bull_rsi_ob': 80, 'bull_adx_thresh': 9.443151323594163, 'bull_atr_min_pct': 0.004623960586299418, 'bull_atr_max_pct': 0.048066305837755466, 'bull_tp_mult': 2.8569943790448296, 'bull_tsl_mult': 0.11949267991707876, 'bull_time_stop': 60, 'bull_use_sma': False, 'bull_use_ema': True, 'bull_use_atr': False, 'bull_use_adx': True, 'bull_use_spike': False, 'bull_rsi_required': False, 'bear_strategy': 'mean_reversion', 'bear_bb_std_mult': 1.447425995355454, 'bear_rsi_os': 23, 'bear_rsi_ob': 51, 'bear_adx_thresh': 12.76662553489092, 'bear_atr_min_pct': 0.023970847031455394, 'bear_atr_max_pct': 0.14520376796301043, 'bear_tp_mult': 2.722543393271928, 'bear_tsl_mult': 0.8637536320629837, 'bear_time_stop': 30, 'bear_use_sma': False, 'bear_use_ema': False, 'bear_use_atr': True, 'bear_use_adx': True, 'bear_use_spike': True, 'bear_rsi_required': True, 'sideways_strategy': 'mean_reversion', 'sideways_bb_std_mult': 2.2499848123024977, 'sideways_rsi_os': 22, 'sideways_rsi_ob': 58, 'sideways_adx_thresh': 25.276114311730893, 'sideways_atr_min_pct': 0.004880330928322916, 'sideways_atr_max_pct': 0.10201311564395923, 'sideways_tp_mult': 1.8719144034403516, 'sideways_tsl_mult': 0.9075117839513263, 'sideways_time_stop': 253, 'sideways_use_sma': True, 'sideways_use_ema': False, 'sideways_use_atr': False, 'sideways_use_adx': False, 'sideways_use_spike': True, 'sideways_rsi_required': True}.
[I 2025-08-31 10:46:50,738] Trial 447 finished with values: [-1000000000.0, 1000000000.0] and parameters: {'p_sma': 46, 'p_std': 37, 'p_atr': 22, 'p_adx': 26, 'rsi_period': 39, 'ema1': 21, 'ema2': 18, 'slip_atr_k': 0.005067901954579832, 'slip_spread_k': 0.8970734313291076, 'spread_hl_frac': 0.025062800101244988, 'bb_std_mult': 3.0487635013263343, 'rsi_os': 35, 'rsi_ob': 60, 'vol_spike': 0.22861283069591365, 'adx_thresh': 5.993036862972071, 'atr_min_pct': 0.01994461629847817, 'atr_max_pct': 0.07902019127315185, 'tp_mult': 2.9104894594978825, 'tsl_mult': 0.6589599016593434, 'strategy': 'mean_reversion', 'time_stop': 162, 'use_sma': True, 'use_atr': False, 'use_adx': False, 'use_ema': False, 'use_spike': False, 'rsi_required': False, 'edge_k': 1.3996480937895983, 'edge_cap': 0.23815271517541275, 'bull_strategy': 'mean_reversion', 'bull_bb_std_mult': 3.5960040072268162, 'bull_rsi_os': 45, 'bull_rsi_ob': 77, 'bull_adx_thresh': 16.5973438005297, 'bull_atr_min_pct': 0.00840831245704734, 'bull_atr_max_pct': 0.04811836454749514, 'bull_tp_mult': 2.840366082751165, 'bull_tsl_mult': 0.13089212633894867, 'bull_time_stop': 44, 'bull_use_sma': False, 'bull_use_ema': True, 'bull_use_atr': False, 'bull_use_adx': True, 'bull_use_spike': False, 'bull_rsi_required': False, 'bear_strategy': 'mean_reversion', 'bear_bb_std_mult': 1.4291284183222572, 'bear_rsi_os': 23, 'bear_rsi_ob': 52, 'bear_adx_thresh': 13.666069606078397, 'bear_atr_min_pct': 0.02445069076336994, 'bear_atr_max_pct': 0.137619828234138, 'bear_tp_mult': 2.7577294615942014, 'bear_tsl_mult': 0.05590460479371845, 'bear_time_stop': 267, 'bear_use_sma': False, 'bear_use_ema': True, 'bear_use_atr': True, 'bear_use_adx': True, 'bear_use_spike': True, 'bear_rsi_required': True, 'sideways_strategy': 'mean_reversion', 'sideways_bb_std_mult': 2.5405693921963017, 'sideways_rsi_os': 26, 'sideways_rsi_ob': 58, 'sideways_adx_thresh': 12.478017362095564, 'sideways_atr_min_pct': 0.006117677900236923, 'sideways_atr_max_pct': 0.11696333882656446, 'sideways_tp_mult': 1.8809902286756983, 'sideways_tsl_mult': 0.8851355678615974, 'sideways_time_stop': 221, 'sideways_use_sma': True, 'sideways_use_ema': True, 'sideways_use_atr': False, 'sideways_use_adx': False, 'sideways_use_spike': True, 'sideways_rsi_required': True}.
