[I 2025-08-31 10:49:35,095] Trial 470 finished with values: [-1000000000.0, 1000000000.0] and parameters: {'p_sma': 42, 'p_std': 36, 'p_atr': 22, 'p_adx': 19, 'rsi_period': 40, 'ema1': 21, 'ema2': 57, 'slip_atr_k': 0.01702582491945484, 'slip_spread_k': 0.288981772505513, 'spread_hl_frac': 0.006147250604040581, 'bb_std_mult': 2.511351375438796, 'rsi_os': 33, 'rsi_ob': 75, 'vol_spike': 0.2536291285519811, 'adx_thresh': 19.629663970125012, 'atr_min_pct': 0.019890087751720197, 'atr_max_pct': 0.02546733246280579, 'tp_mult': 2.3936643412454455, 'tsl_mult': 0.6966118810199583, 'strategy': 'mean_reversion', 'time_stop': 157, 'use_sma': False, 'use_atr': False, 'use_adx': False, 'use_ema': False, 'use_spike': False, 'rsi_required': False, 'edge_k': 1.1842961280169986, 'edge_cap': 0.17173682168730295, 'bull_strategy': 'breakout', 'bull_bb_std_mult': 3.544875350032007, 'bull_rsi_os': 46, 'bull_rsi_ob': 68, 'bull_adx_thresh': 9.968270221349176, 'bull_atr_min_pct': 0.004567340089156935, 'bull_atr_max_pct': 0.01558314358711646, 'bull_tp_mult': 2.9751967419720553, 'bull_tsl_mult': 0.1325269275952889, 'bull_time_stop': 75, 'bull_use_sma': False, 'bull_use_ema': True, 'bull_use_atr': False, 'bull_use_adx': False, 'bull_use_spike': True, 'bull_rsi_required': False, 'bear_strategy': 'breakout', 'bear_bb_std_mult': 1.5520033050866766, 'bear_rsi_os': 24, 'bear_rsi_ob': 78, 'bear_adx_thresh': 13.993810320855193, 'bear_atr_min_pct': 0.02555068816690853, 'bear_atr_max_pct': 0.14074618772102948, 'bear_tp_mult': 2.8750686273852453, 'bear_tsl_mult': 0.37643356074694756, 'bear_time_stop': 27, 'bear_use_sma': True, 'bear_use_ema': False, 'bear_use_atr': True, 'bear_use_adx': True, 'bear_use_spike': True, 'bear_rsi_required': False, 'sideways_strategy': 'mean_reversion', 'sideways_bb_std_mult': 0.5615794324455632, 'sideways_rsi_os': 35, 'sideways_rsi_ob': 58, 'sideways_adx_thresh': 30.723232152159454, 'sideways_atr_min_pct': 0.005785012291433858, 'sideways_atr_max_pct': 0.06530886247318504, 'sideways_tp_mult': 2.03925980182851, 'sideways_tsl_mult': 0.8663417598733145, 'sideways_time_stop': 273, 'sideways_use_sma': True, 'sideways_use_ema': False, 'sideways_use_atr': False, 'sideways_use_adx': True, 'sideways_use_spike': True, 'sideways_rsi_required': False}.
[I 2025-08-31 10:49:35,162] Trial 469 finished with values: [-1000000000.0, 1000000000.0] and parameters: {'p_sma': 42, 'p_std': 36, 'p_atr': 22, 'p_adx': 19, 'rsi_period': 40, 'ema1': 20, 'ema2': 56, 'slip_atr_k': 0.005405427238802124, 'slip_spread_k': 0.5925291145291484, 'spread_hl_frac': 0.024625381718330553, 'bb_std_mult': 2.023128812471556, 'rsi_os': 35, 'rsi_ob': 62, 'vol_spike': 0.2523627020262594, 'adx_thresh': 19.427004263914103, 'atr_min_pct': 0.0014284883296617479, 'atr_max_pct': 0.026303739123146222, 'tp_mult': 1.1553665365310477, 'tsl_mult': 0.08804843849692828, 'strategy': 'mean_reversion', 'time_stop': 157, 'use_sma': False, 'use_atr': False, 'use_adx': False, 'use_ema': False, 'use_spike': False, 'rsi_required': False, 'edge_k': 1.7621999605890657, 'edge_cap': 0.850504826654511, 'bull_strategy': 'breakout', 'bull_bb_std_mult': 3.5479843877690866, 'bull_rsi_os': 54, 'bull_rsi_ob': 79, 'bull_adx_thresh': 23.181872688060395, 'bull_atr_min_pct': 0.014398865975762617, 'bull_atr_max_pct': 0.01610238905853443, 'bull_tp_mult': 2.96054719711908, 'bull_tsl_mult': 0.1281773611983471, 'bull_time_stop': 75, 'bull_use_sma': False, 'bull_use_ema': True, 'bull_use_atr': False, 'bull_use_adx': True, 'bull_use_spike': True, 'bull_rsi_required': False, 'bear_strategy': 'breakout', 'bear_bb_std_mult': 1.216424577243384, 'bear_rsi_os': 24, 'bear_rsi_ob': 55, 'bear_adx_thresh': 15.417430721124113, 'bear_atr_min_pct': 0.025604462364920758, 'bear_atr_max_pct': 0.1357572940639612, 'bear_tp_mult': 2.748387162133094, 'bear_tsl_mult': 0.3698543836738009, 'bear_time_stop': 241, 'bear_use_sma': False, 'bear_use_ema': False, 'bear_use_atr': True, 'bear_use_adx': True, 'bear_use_spike': True, 'bear_rsi_required': True, 'sideways_strategy': 'mean_reversion', 'sideways_bb_std_mult': 2.1920675750103142, 'sideways_rsi_os': 40, 'sideways_rsi_ob': 58, 'sideways_adx_thresh': 14.545097557223691, 'sideways_atr_min_pct': 0.007912411380359585, 'sideways_atr_max_pct': 0.04466308873308357, 'sideways_tp_mult': 2.031694403932961, 'sideways_tsl_mult': 0.8599175698353381, 'sideways_time_stop': 278, 'sideways_use_sma': True, 'sideways_use_ema': False, 'sideways_use_atr': False, 'sideways_use_adx': False, 'sideways_use_spike': True, 'sideways_rsi_required': False}.
[I 2025-08-31 10:49:35,321] Trial 471 finished with values: [-1000000000.0, 1000000000.0] and parameters: {'p_sma': 43, 'p_std': 36, 'p_atr': 22, 'p_adx': 19, 'rsi_period': 44, 'ema1': 20, 'ema2': 56, 'slip_atr_k': 0.006338103250648389, 'slip_spread_k': 0.802784707730779, 'spread_hl_frac': 0.02402932840570316, 'bb_std_mult': 1.9092388213107412, 'rsi_os': 32, 'rsi_ob': 92, 'vol_spike': 0.23521850670128178, 'adx_thresh': 10.680471976533033, 'atr_min_pct': 0.019852210584178014, 'atr_max_pct': 0.14436967804041734, 'tp_mult': 1.7022290846693746, 'tsl_mult': 0.6959497362625185, 'strategy': 'mean_reversion', 'time_stop': 156, 'use_sma': False, 'use_atr': False, 'use_adx': False, 'use_ema': False, 'use_spike': False, 'rsi_required': False, 'edge_k': 1.1575753309691157, 'edge_cap': 0.17168854204693512, 'bull_strategy': 'breakout', 'bull_bb_std_mult': 3.5555429758072536, 'bull_rsi_os': 46, 'bull_rsi_ob': 49, 'bull_adx_thresh': 30.135607829144767, 'bull_atr_min_pct': 0.014934691868775841, 'bull_atr_max_pct': 0.04265972487343194, 'bull_tp_mult': 2.9621989133638316, 'bull_tsl_mult': 0.22327618054589266, 'bull_time_stop': 72, 'bull_use_sma': False, 'bull_use_ema': True, 'bull_use_atr': False, 'bull_use_adx': False, 'bull_use_spike': True, 'bull_rsi_required': False, 'bear_strategy': 'breakout', 'bear_bb_std_mult': 1.2380888011924251, 'bear_rsi_os': 20, 'bear_rsi_ob': 55, 'bear_adx_thresh': 14.043065479005275, 'bear_atr_min_pct': 0.025579963198269783, 'bear_atr_max_pct': 0.1361039208294326, 'bear_tp_mult': 2.7127109704273047, 'bear_tsl_mult': 0.6208133704040902, 'bear_time_stop': 278, 'bear_use_sma': True, 'bear_use_ema': False, 'bear_use_atr': True, 'bear_use_adx': False, 'bear_use_spike': True, 'bear_rsi_required': False, 'sideways_strategy': 'mean_reversion', 'sideways_bb_std_mult': 1.5890003764060103, 'sideways_rsi_os': 54, 'sideways_rsi_ob': 58, 'sideways_adx_thresh': 7.1606028516166695, 'sideways_atr_min_pct': 0.005907126721444241, 'sideways_atr_max_pct': 0.020322509935506897, 'sideways_tp_mult': 1.9597686993032246, 'sideways_tsl_mult': 0.8753420482954738, 'sideways_time_stop': 280, 'sideways_use_sma': False, 'sideways_use_ema': False, 'sideways_use_atr': True, 'sideways_use_adx': True, 'sideways_use_spike': True, 'sideways_rsi_required': False}.
[I 2025-08-31 10:49:35,323] Trial 468 finished with values: [-1000000000.0, 1000000000.0] and parameters: {'p_sma': 43, 'p_std': 37, 'p_atr': 22, 'p_adx': 19, 'rsi_period': 40, 'ema1': 20, 'ema2': 56, 'slip_atr_k': 0.017316119094171162, 'slip_spread_k': 0.29929125274629015, 'spread_hl_frac': 0.024397867647166782, 'bb_std_mult': 2.47402499002564, 'rsi_os': 34, 'rsi_ob': 90, 'vol_spike': 0.2363831017358032, 'adx_thresh': 10.610992790554018, 'atr_min_pct': 0.0011861982267835046, 'atr_max_pct': 0.043471520815211176, 'tp_mult': 2.833094146248661, 'tsl_mult': 0.6934819912895234, 'strategy': 'mean_reversion', 'time_stop': 158, 'use_sma': False, 'use_atr': True, 'use_adx': False, 'use_ema': False, 'use_spike': False, 'rsi_required': False, 'edge_k': 1.038859436453717, 'edge_cap': 0.5283849929414314, 'bull_strategy': 'breakout', 'bull_bb_std_mult': 3.4959491025752105, 'bull_rsi_os': 21, 'bull_rsi_ob': 79, 'bull_adx_thresh': 23.3367954731231, 'bull_atr_min_pct': 0.011603807710249943, 'bull_atr_max_pct': 0.05650083624459073, 'bull_tp_mult': 2.959164965854626, 'bull_tsl_mult': 0.12988230650204502, 'bull_time_stop': 74, 'bull_use_sma': False, 'bull_use_ema': True, 'bull_use_atr': False, 'bull_use_adx': True, 'bull_use_spike': True, 'bull_rsi_required': False, 'bear_strategy': 'breakout', 'bear_bb_std_mult': 1.4124094659751159, 'bear_rsi_os': 21, 'bear_rsi_ob': 70, 'bear_adx_thresh': 13.253915680186305, 'bear_atr_min_pct': 0.025772095447839465, 'bear_atr_max_pct': 0.13572140683976344, 'bear_tp_mult': 2.7160538466313957, 'bear_tsl_mult': 0.1276939842972124, 'bear_time_stop': 184, 'bear_use_sma': False, 'bear_use_ema': False, 'bear_use_atr': False, 'bear_use_adx': False, 'bear_use_spike': False, 'bear_rsi_required': True, 'sideways_strategy': 'mean_reversion', 'sideways_bb_std_mult': 2.514619158278493, 'sideways_rsi_os': 7, 'sideways_rsi_ob': 58, 'sideways_adx_thresh': 14.459052378263923, 'sideways_atr_min_pct': 0.007944302741397655, 'sideways_atr_max_pct': 0.06457264156025512, 'sideways_tp_mult': 2.009228501240259, 'sideways_tsl_mult': 0.864138837611709, 'sideways_time_stop': 280, 'sideways_use_sma': True, 'sideways_use_ema': False, 'sideways_use_atr': False, 'sideways_use_adx': False, 'sideways_use_spike': True, 'sideways_rsi_required': False}.
[I 2025-08-31 10:49:35,951] Trial 472 finished with values: [-1000000000.0, 1000000000.0] and parameters: {'p_sma': 48, 'p_std': 41, 'p_atr': 21, 'p_adx': 19, 'rsi_period': 43, 'ema1': 19, 'ema2': 16, 'slip_atr_k': 0.005725875003752929, 'slip_spread_k': 0.3220910942273198, 'spread_hl_frac': 0.02410567362607209, 'bb_std_mult': 2.548450461175471, 'rsi_os': 36, 'rsi_ob': 49, 'vol_spike': 0.217152340195686, 'adx_thresh': 10.574507084686246, 'atr_min_pct': 0.005287661416340779, 'atr_max_pct': 0.11087127515335891, 'tp_mult': 1.6945443542073562, 'tsl_mult': 0.053105916723465096, 'strategy': 'mean_reversion', 'time_stop': 149, 'use_sma': False, 'use_atr': False, 'use_adx': False, 'use_ema': False, 'use_spike': False, 'rsi_required': False, 'edge_k': 1.0379881666884834, 'edge_cap': 0.8531877308337055, 'bull_strategy': 'breakout', 'bull_bb_std_mult': 3.5802209366770903, 'bull_rsi_os': 21, 'bull_rsi_ob': 90, 'bull_adx_thresh': 30.275096074634156, 'bull_atr_min_pct': 0.005884089128328298, 'bull_atr_max_pct': 0.05831567663747468, 'bull_tp_mult': 2.738230559355702, 'bull_tsl_mult': 0.72346729576477, 'bull_time_stop': 68, 'bull_use_sma': False, 'bull_use_ema': True, 'bull_use_atr': False, 'bull_use_adx': True, 'bull_use_spike': True, 'bull_rsi_required': False, 'bear_strategy': 'breakout', 'bear_bb_std_mult': 1.4591050585309926, 'bear_rsi_os': 20, 'bear_rsi_ob': 55, 'bear_adx_thresh': 13.123308080141978, 'bear_atr_min_pct': 0.024975055460202965, 'bear_atr_max_pct': 0.1470971614189609, 'bear_tp_mult': 2.7403789750342185, 'bear_tsl_mult': 0.6156979406999699, 'bear_time_stop': 182, 'bear_use_sma': False, 'bear_use_ema': False, 'bear_use_atr': True, 'bear_use_adx': False, 'bear_use_spike': True, 'bear_rsi_required': True, 'sideways_strategy': 'mean_reversion', 'sideways_bb_std_mult': 2.5293776591464345, 'sideways_rsi_os': 40, 'sideways_rsi_ob': 60, 'sideways_adx_thresh': 14.616543424168126, 'sideways_atr_min_pct': 0.006696529161342861, 'sideways_atr_max_pct': 0.012527725258531828, 'sideways_tp_mult': 1.9581750587487974, 'sideways_tsl_mult': 0.881578859231352, 'sideways_time_stop': 236, 'sideways_use_sma': False, 'sideways_use_ema': False, 'sideways_use_atr': True, 'sideways_use_adx': False, 'sideways_use_spike': True, 'sideways_rsi_required': False}.
[I 2025-08-31 10:50:07,177] Trial 473 finished with values: [-0.004783802645411228, 0.005001866669522937] and parameters: {'p_sma': 43, 'p_std': 41, 'p_atr': 21, 'p_adx': 19, 'rsi_period': 43, 'ema1': 19, 'ema2': 16, 'slip_atr_k': 0.005663479854965556, 'slip_spread_k': 0.5513657504872634, 'spread_hl_frac': 0.024015421598862746, 'bb_std_mult': 2.56724296540523, 'rsi_os': 36, 'rsi_ob': 84, 'vol_spike': 0.24080922090765236, 'adx_thresh': 10.679258463665237, 'atr_min_pct': 0.02143532222496734, 'atr_max_pct': 0.03780283750627676, 'tp_mult': 2.8228046820009376, 'tsl_mult': 0.6719180519807786, 'strategy': 'mean_reversion', 'time_stop': 24, 'use_sma': False, 'use_atr': False, 'use_adx': False, 'use_ema': False, 'use_spike': False, 'rsi_required': False, 'edge_k': 1.7197739246035326, 'edge_cap': 0.533305318229648, 'bull_strategy': 'breakout', 'bull_bb_std_mult': 3.4660608103583725, 'bull_rsi_os': 48, 'bull_rsi_ob': 90, 'bull_adx_thresh': 25.288975914557195, 'bull_atr_min_pct': 0.0034617285328711342, 'bull_atr_max_pct': 0.055757617367393465, 'bull_tp_mult': 2.740864177310878, 'bull_tsl_mult': 0.8643301626443739, 'bull_time_stop': 66, 'bull_use_sma': False, 'bull_use_ema': True, 'bull_use_atr': False, 'bull_use_adx': True, 'bull_use_spike': True, 'bull_rsi_required': False, 'bear_strategy': 'breakout', 'bear_bb_std_mult': 1.463320698901, 'bear_rsi_os': 21, 'bear_rsi_ob': 67, 'bear_adx_thresh': 11.615321083401938, 'bear_atr_min_pct': 0.02424282193159588, 'bear_atr_max_pct': 0.13682555644892494, 'bear_tp_mult': 1.6751290143106052, 'bear_tsl_mult': 0.13314693176167164, 'bear_time_stop': 181, 'bear_use_sma': True, 'bear_use_ema': False, 'bear_use_atr': True, 'bear_use_adx': False, 'bear_use_spike': True, 'bear_rsi_required': True, 'sideways_strategy': 'mean_reversion', 'sideways_bb_std_mult': 2.5109144104801393, 'sideways_rsi_os': 53, 'sideways_rsi_ob': 60, 'sideways_adx_thresh': 12.924332512886346, 'sideways_atr_min_pct': 0.007029456612835921, 'sideways_atr_max_pct': 0.07085377616182899, 'sideways_tp_mult': 1.9558187692721574, 'sideways_tsl_mult': 0.8774057571516489, 'sideways_time_stop': 163, 'sideways_use_sma': False, 'sideways_use_ema': False, 'sideways_use_atr': True, 'sideways_use_adx': True, 'sideways_use_spike': True, 'sideways_rsi_required': False}.
[I 2025-08-31 10:50:07,410] Trial 475 finished with values: [-1000000000.0, 1000000000.0] and parameters: {'p_sma': 48, 'p_std': 18, 'p_atr': 21, 'p_adx': 20, 'rsi_period': 42, 'ema1': 23, 'ema2': 43, 'slip_atr_k': 0.00690052998317773, 'slip_spread_k': 0.258365653466293, 'spread_hl_frac': 0.02302104521551971, 'bb_std_mult': 2.553876740506807, 'rsi_os': 36, 'rsi_ob': 82, 'vol_spike': 0.05710432369960873, 'adx_thresh': 25.646126164255378, 'atr_min_pct': 0.009951959801736262, 'atr_max_pct': 0.03730559996379166, 'tp_mult': 2.8808061729138688, 'tsl_mult': 0.4032345122838812, 'strategy': 'mean_reversion', 'time_stop': 150, 'use_sma': False, 'use_atr': False, 'use_adx': False, 'use_ema': False, 'use_spike': False, 'rsi_required': False, 'edge_k': 0.8651563153386049, 'edge_cap': 0.48936506740900704, 'bull_strategy': 'breakout', 'bull_bb_std_mult': 3.452007902668392, 'bull_rsi_os': 23, 'bull_rsi_ob': 77, 'bull_adx_thresh': 10.628974533668888, 'bull_atr_min_pct': 0.005305005239899617, 'bull_atr_max_pct': 0.03506652637774355, 'bull_tp_mult': 2.7342068832331186, 'bull_tsl_mult': 0.8554146056430315, 'bull_time_stop': 67, 'bull_use_sma': False, 'bull_use_ema': True, 'bull_use_atr': False, 'bull_use_adx': True, 'bull_use_spike': True, 'bull_rsi_required': False, 'bear_strategy': 'breakout', 'bear_bb_std_mult': 1.4565962053683805, 'bear_rsi_os': 25, 'bear_rsi_ob': 53, 'bear_adx_thresh': 13.831561169960011, 'bear_atr_min_pct': 0.024271714274473544, 'bear_atr_max_pct': 0.14641804502512185, 'bear_tp_mult': 1.752858251667445, 'bear_tsl_mult': 0.4495588733534389, 'bear_time_stop': 84, 'bear_use_sma': False, 'bear_use_ema': False, 'bear_use_atr': True, 'bear_use_adx': False, 'bear_use_spike': True, 'bear_rsi_required': True, 'sideways_strategy': 'mean_reversion', 'sideways_bb_std_mult': 2.5850299508494277, 'sideways_rsi_os': 14, 'sideways_rsi_ob': 60, 'sideways_adx_thresh': 13.980369113081569, 'sideways_atr_min_pct': 0.006765358350673192, 'sideways_atr_max_pct': 0.012537418456776575, 'sideways_tp_mult': 1.9269744664666628, 'sideways_tsl_mult': 0.8954170027575197, 'sideways_time_stop': 162, 'sideways_use_sma': False, 'sideways_use_ema': False, 'sideways_use_atr': True, 'sideways_use_adx': False, 'sideways_use_spike': True, 'sideways_rsi_required': False}.
[I 2025-08-31 10:50:07,667] Trial 474 finished with values: [-1000000000.0, 1000000000.0] and parameters: {'p_sma': 46, 'p_std': 40, 'p_atr': 21, 'p_adx': 20, 'rsi_period': 42, 'ema1': 25, 'ema2': 28, 'slip_atr_k': 0.0052020885449857255, 'slip_spread_k': 0.25641014112187255, 'spread_hl_frac': 0.02336716760119442, 'bb_std_mult': 2.552145804607709, 'rsi_os': 36, 'rsi_ob': 85, 'vol_spike': 0.16438680211606352, 'adx_thresh': 9.928745979863653, 'atr_min_pct': 0.02420940961219036, 'atr_max_pct': 0.0383249748474715, 'tp_mult': 2.869297425355212, 'tsl_mult': 0.05716879176471745, 'strategy': 'mean_reversion', 'time_stop': 190, 'use_sma': False, 'use_atr': False, 'use_adx': False, 'use_ema': False, 'use_spike': False, 'rsi_required': False, 'edge_k': 0.032840113370978474, 'edge_cap': 0.9261118392962765, 'bull_strategy': 'breakout', 'bull_bb_std_mult': 3.5926988635072954, 'bull_rsi_os': 45, 'bull_rsi_ob': 77, 'bull_adx_thresh': 25.202637786037265, 'bull_atr_min_pct': 0.013394568073511578, 'bull_atr_max_pct': 0.035127682105723756, 'bull_tp_mult': 2.814938131526612, 'bull_tsl_mult': 0.10184994197734369, 'bull_time_stop': 64, 'bull_use_sma': False, 'bull_use_ema': True, 'bull_use_atr': False, 'bull_use_adx': True, 'bull_use_spike': True, 'bull_rsi_required': False, 'bear_strategy': 'breakout', 'bear_bb_std_mult': 1.4767242539809322, 'bear_rsi_os': 25, 'bear_rsi_ob': 63, 'bear_adx_thresh': 12.897968336329294, 'bear_atr_min_pct': 0.024287554597561028, 'bear_atr_max_pct': 0.14717710138139653, 'bear_tp_mult': 2.7651307477830533, 'bear_tsl_mult': 0.41811265825897836, 'bear_time_stop': 201, 'bear_use_sma': False, 'bear_use_ema': False, 'bear_use_atr': True, 'bear_use_adx': False, 'bear_use_spike': True, 'bear_rsi_required': True, 'sideways_strategy': 'mean_reversion', 'sideways_bb_std_mult': 2.7851414148246953, 'sideways_rsi_os': 13, 'sideways_rsi_ob': 60, 'sideways_adx_thresh': 12.907228495740066, 'sideways_atr_min_pct': 0.006904345798041799, 'sideways_atr_max_pct': 0.0801470813303979, 'sideways_tp_mult': 1.8933184368915268, 'sideways_tsl_mult': 0.884164259291378, 'sideways_time_stop': 240, 'sideways_use_sma': False, 'sideways_use_ema': False, 'sideways_use_atr': True, 'sideways_use_adx': False, 'sideways_use_spike': True, 'sideways_rsi_required': False}.
[I 2025-08-31 10:50:08,695] Trial 476 finished with values: [-1000000000.0, 1000000000.0] and parameters: {'p_sma': 46, 'p_std': 40, 'p_atr': 21, 'p_adx': 20, 'rsi_period': 36, 'ema1': 26, 'ema2': 28, 'slip_atr_k': 0.004735095700396811, 'slip_spread_k': 0.2520230888614668, 'spread_hl_frac': 0.023331055868687632, 'bb_std_mult': 1.5574823704423904, 'rsi_os': 35, 'rsi_ob': 78, 'vol_spike': 0.21673619699945235, 'adx_thresh': 25.84484780238323, 'atr_min_pct': 0.021578542566640397, 'atr_max_pct': 0.09836492276370354, 'tp_mult': 2.8882493791550576, 'tsl_mult': 0.670948652673564, 'strategy': 'mean_reversion', 'time_stop': 255, 'use_sma': False, 'use_atr': False, 'use_adx': False, 'use_ema': True, 'use_spike': False, 'rsi_required': False, 'edge_k': 1.7245648790443024, 'edge_cap': 0.4843048985863209, 'bull_strategy': 'breakout', 'bull_bb_std_mult': 3.464295497861963, 'bull_rsi_os': 48, 'bull_rsi_ob': 52, 'bull_adx_thresh': 15.750992671570666, 'bull_atr_min_pct': 0.013398989760526978, 'bull_atr_max_pct': 0.04479597789188144, 'bull_tp_mult': 2.811952136653712, 'bull_tsl_mult': 0.27088849858557834, 'bull_time_stop': 63, 'bull_use_sma': False, 'bull_use_ema': False, 'bull_use_atr': False, 'bull_use_adx': True, 'bull_use_spike': True, 'bull_rsi_required': True, 'bear_strategy': 'breakout', 'bear_bb_std_mult': 1.5204373120446717, 'bear_rsi_os': 23, 'bear_rsi_ob': 83, 'bear_adx_thresh': 12.787633687507784, 'bear_atr_min_pct': 0.02424676139518892, 'bear_atr_max_pct': 0.14071414569306592, 'bear_tp_mult': 1.69430199787845, 'bear_tsl_mult': 0.33419481492783454, 'bear_time_stop': 36, 'bear_use_sma': False, 'bear_use_ema': True, 'bear_use_atr': True, 'bear_use_adx': False, 'bear_use_spike': True, 'bear_rsi_required': True, 'sideways_strategy': 'mean_reversion', 'sideways_bb_std_mult': 2.87456210086561, 'sideways_rsi_os': 13, 'sideways_rsi_ob': 60, 'sideways_adx_thresh': 13.766903321566355, 'sideways_atr_min_pct': 0.004845489218422096, 'sideways_atr_max_pct': 0.08079413649043503, 'sideways_tp_mult': 1.9113342565296225, 'sideways_tsl_mult': 0.8902234916984149, 'sideways_time_stop': 258, 'sideways_use_sma': True, 'sideways_use_ema': False, 'sideways_use_atr': False, 'sideways_use_adx': False, 'sideways_use_spike': True, 'sideways_rsi_required': False}.
