[I 2025-08-31 11:21:53,753] Trial 709 finished with values: [-1000000000.0, 1000000000.0] and parameters: {'p_sma': 29, 'p_std': 11, 'p_atr': 27, 'p_adx': 21, 'rsi_period': 59, 'ema1': 5, 'ema2': 23, 'slip_atr_k': 0.20868794841919147, 'slip_spread_k': 0.07351048116955833, 'spread_hl_frac': 0.0466767190007812, 'bb_std_mult': 0.5989698590717449, 'rsi_os': 21, 'rsi_ob': 86, 'vol_spike': 0.10014564213870095, 'adx_thresh': 12.678942764433232, 'atr_min_pct': 0.022067876370894194, 'atr_max_pct': 0.0650554872513226, 'tp_mult': 2.6288046069104603, 'tsl_mult': 0.14714618619980568, 'strategy': 'breakout', 'time_stop': 262, 'use_sma': True, 'use_atr': True, 'use_adx': False, 'use_ema': True, 'use_spike': False, 'rsi_required': False, 'edge_k': 1.3863556271303072, 'edge_cap': 0.7607370487127619, 'bull_strategy': 'mean_reversion', 'bull_bb_std_mult': 2.4740126107391607, 'bull_rsi_os': 35, 'bull_rsi_ob': 94, 'bull_adx_thresh': 24.07237868242765, 'bull_atr_min_pct': 0.027615379334845622, 'bull_atr_max_pct': 0.027117371745123218, 'bull_tp_mult': 2.8551237639902185, 'bull_tsl_mult': 0.341374427594177, 'bull_time_stop': 32, 'bull_use_sma': False, 'bull_use_ema': True, 'bull_use_atr': False, 'bull_use_adx': True, 'bull_use_spike': False, 'bull_rsi_required': False, 'bear_strategy': 'mean_reversion', 'bear_bb_std_mult': 1.5373089390529346, 'bear_rsi_os': 13, 'bear_rsi_ob': 61, 'bear_adx_thresh': 9.357877967980226, 'bear_atr_min_pct': 0.010866019518681692, 'bear_atr_max_pct': 0.02888366342555019, 'bear_tp_mult': 1.1435199854280862, 'bear_tsl_mult': 0.5929604901722757, 'bear_time_stop': 90, 'bear_use_sma': False, 'bear_use_ema': False, 'bear_use_atr': True, 'bear_use_adx': False, 'bear_use_spike': True, 'bear_rsi_required': False, 'sideways_strategy': 'mean_reversion', 'sideways_bb_std_mult': 1.653090440251009, 'sideways_rsi_os': 44, 'sideways_rsi_ob': 48, 'sideways_adx_thresh': 21.710527540123596, 'sideways_atr_min_pct': 0.0052751158485983, 'sideways_atr_max_pct': 0.06226501815859077, 'sideways_tp_mult': 1.5012435211039143, 'sideways_tsl_mult': 0.13631312649282484, 'sideways_time_stop': 155, 'sideways_use_sma': False, 'sideways_use_ema': True, 'sideways_use_atr': False, 'sideways_use_adx': False, 'sideways_use_spike': True, 'sideways_rsi_required': False}.
[I 2025-08-31 11:21:54,059] Trial 710 finished with values: [-1000000000.0, 1000000000.0] and parameters: {'p_sma': 40, 'p_std': 9, 'p_atr': 27, 'p_adx': 22, 'rsi_period': 33, 'ema1': 6, 'ema2': 23, 'slip_atr_k': 0.16395297890956376, 'slip_spread_k': 0.409782209266532, 'spread_hl_frac': 0.04377250405442732, 'bb_std_mult': 0.7006246525818091, 'rsi_os': 32, 'rsi_ob': 82, 'vol_spike': 0.00036053161790941535, 'adx_thresh': 22.993607093438545, 'atr_min_pct': 0.009327154570555073, 'atr_max_pct': 0.06346690128356942, 'tp_mult': 2.880161335675699, 'tsl_mult': 0.8750791008140741, 'strategy': 'breakout', 'time_stop': 64, 'use_sma': True, 'use_atr': True, 'use_adx': False, 'use_ema': True, 'use_spike': False, 'rsi_required': False, 'edge_k': 1.49592938955695, 'edge_cap': 0.7359546452108862, 'bull_strategy': 'mean_reversion', 'bull_bb_std_mult': 2.508065177372125, 'bull_rsi_os': 31, 'bull_rsi_ob': 69, 'bull_adx_thresh': 26.4731672904406, 'bull_atr_min_pct': 0.008161679317259005, 'bull_atr_max_pct': 0.039042927430400554, 'bull_tp_mult': 1.4794126134106296, 'bull_tsl_mult': 0.6526176078572599, 'bull_time_stop': 124, 'bull_use_sma': False, 'bull_use_ema': True, 'bull_use_atr': False, 'bull_use_adx': False, 'bull_use_spike': False, 'bull_rsi_required': False, 'bear_strategy': 'mean_reversion', 'bear_bb_std_mult': 1.5239331254954835, 'bear_rsi_os': 50, 'bear_rsi_ob': 63, 'bear_adx_thresh': 9.986774426090836, 'bear_atr_min_pct': 0.019315110424710503, 'bear_atr_max_pct': 0.1353129269482493, 'bear_tp_mult': 1.450954827784928, 'bear_tsl_mult': 0.8760255930256313, 'bear_time_stop': 106, 'bear_use_sma': True, 'bear_use_ema': False, 'bear_use_atr': True, 'bear_use_adx': True, 'bear_use_spike': True, 'bear_rsi_required': False, 'sideways_strategy': 'mean_reversion', 'sideways_bb_std_mult': 1.204091728617965, 'sideways_rsi_os': 20, 'sideways_rsi_ob': 74, 'sideways_adx_thresh': 26.053086016315, 'sideways_atr_min_pct': 0.026976161404301483, 'sideways_atr_max_pct': 0.10286981525875777, 'sideways_tp_mult': 2.4380740775375513, 'sideways_tsl_mult': 0.839646184691807, 'sideways_time_stop': 205, 'sideways_use_sma': True, 'sideways_use_ema': True, 'sideways_use_atr': False, 'sideways_use_adx': True, 'sideways_use_spike': True, 'sideways_rsi_required': False}.
[I 2025-08-31 11:22:28,062] Trial 713 finished with values: [-1000000000.0, 1000000000.0] and parameters: {'p_sma': 35, 'p_std': 13, 'p_atr': 27, 'p_adx': 22, 'rsi_period': 33, 'ema1': 6, 'ema2': 35, 'slip_atr_k': 0.020044919356923034, 'slip_spread_k': 0.47402712481915454, 'spread_hl_frac': 0.0017228803566095435, 'bb_std_mult': 0.6881271603386943, 'rsi_os': 29, 'rsi_ob': 82, 'vol_spike': 0.06877648747899162, 'adx_thresh': 9.847634698722976, 'atr_min_pct': 0.02165677591107241, 'atr_max_pct': 0.08904262690626973, 'tp_mult': 1.7142286729608731, 'tsl_mult': 0.03334477615414474, 'strategy': 'breakout', 'time_stop': 201, 'use_sma': True, 'use_atr': True, 'use_adx': False, 'use_ema': True, 'use_spike': False, 'rsi_required': False, 'edge_k': 1.4966030761896465, 'edge_cap': 0.7160858291838775, 'bull_strategy': 'mean_reversion', 'bull_bb_std_mult': 3.236580627224771, 'bull_rsi_os': 44, 'bull_rsi_ob': 63, 'bull_adx_thresh': 20.349035648360047, 'bull_atr_min_pct': 0.012807647548162316, 'bull_atr_max_pct': 0.1178533716118005, 'bull_tp_mult': 1.6521970282140848, 'bull_tsl_mult': 0.5131055803080321, 'bull_time_stop': 122, 'bull_use_sma': False, 'bull_use_ema': True, 'bull_use_atr': False, 'bull_use_adx': True, 'bull_use_spike': False, 'bull_rsi_required': False, 'bear_strategy': 'mean_reversion', 'bear_bb_std_mult': 1.557994943885068, 'bear_rsi_os': 50, 'bear_rsi_ob': 73, 'bear_adx_thresh': 24.197005467356735, 'bear_atr_min_pct': 0.019290270598293295, 'bear_atr_max_pct': 0.1367980098345281, 'bear_tp_mult': 2.5895290087237894, 'bear_tsl_mult': 0.3646541824386016, 'bear_time_stop': 144, 'bear_use_sma': False, 'bear_use_ema': True, 'bear_use_atr': True, 'bear_use_adx': False, 'bear_use_spike': False, 'bear_rsi_required': False, 'sideways_strategy': 'mean_reversion', 'sideways_bb_std_mult': 1.0458513377821574, 'sideways_rsi_os': 40, 'sideways_rsi_ob': 61, 'sideways_adx_thresh': 5.389080690288775, 'sideways_atr_min_pct': 0.005209103721287373, 'sideways_atr_max_pct': 0.10253831312396235, 'sideways_tp_mult': 1.6063106747579186, 'sideways_tsl_mult': 0.2914201277116491, 'sideways_time_stop': 153, 'sideways_use_sma': True, 'sideways_use_ema': True, 'sideways_use_atr': False, 'sideways_use_adx': False, 'sideways_use_spike': True, 'sideways_rsi_required': False}.
[I 2025-08-31 11:22:28,104] Trial 716 finished with values: [-1000000000.0, 1000000000.0] and parameters: {'p_sma': 32, 'p_std': 15, 'p_atr': 28, 'p_adx': 24, 'rsi_period': 38, 'ema1': 8, 'ema2': 32, 'slip_atr_k': 0.21572909380204464, 'slip_spread_k': 0.4748519290687014, 'spread_hl_frac': 0.0017400282972847604, 'bb_std_mult': 2.070093321045631, 'rsi_os': 29, 'rsi_ob': 82, 'vol_spike': 0.11326469862377425, 'adx_thresh': 5.397153705139269, 'atr_min_pct': 0.020709091114604554, 'atr_max_pct': 0.08905348493943473, 'tp_mult': 2.9515461636237084, 'tsl_mult': 0.08577489436353082, 'strategy': 'breakout', 'time_stop': 18, 'use_sma': True, 'use_atr': True, 'use_adx': False, 'use_ema': True, 'use_spike': False, 'rsi_required': False, 'edge_k': 1.0997678843759497, 'edge_cap': 0.7191297740295032, 'bull_strategy': 'mean_reversion', 'bull_bb_std_mult': 3.1490299965869877, 'bull_rsi_os': 23, 'bull_rsi_ob': 63, 'bull_adx_thresh': 14.257392065367775, 'bull_atr_min_pct': 0.012492175155790878, 'bull_atr_max_pct': 0.03441366571824993, 'bull_tp_mult': 2.9269578762482547, 'bull_tsl_mult': 0.5647250004455724, 'bull_time_stop': 93, 'bull_use_sma': False, 'bull_use_ema': True, 'bull_use_atr': False, 'bull_use_adx': True, 'bull_use_spike': False, 'bull_rsi_required': False, 'bear_strategy': 'mean_reversion', 'bear_bb_std_mult': 1.419596703978093, 'bear_rsi_os': 52, 'bear_rsi_ob': 54, 'bear_adx_thresh': 10.762475144457701, 'bear_atr_min_pct': 4.629983026485651e-06, 'bear_atr_max_pct': 0.1456188532277985, 'bear_tp_mult': 2.6094504768558466, 'bear_tsl_mult': 0.3606058426743177, 'bear_time_stop': 118, 'bear_use_sma': False, 'bear_use_ema': True, 'bear_use_atr': False, 'bear_use_adx': False, 'bear_use_spike': False, 'bear_rsi_required': False, 'sideways_strategy': 'mean_reversion', 'sideways_bb_std_mult': 1.0290284122439755, 'sideways_rsi_os': 40, 'sideways_rsi_ob': 61, 'sideways_adx_thresh': 24.774524815147178, 'sideways_atr_min_pct': 0.007222943165987234, 'sideways_atr_max_pct': 0.1148508046080833, 'sideways_tp_mult': 1.6091078201702191, 'sideways_tsl_mult': 0.037797807281140405, 'sideways_time_stop': 227, 'sideways_use_sma': True, 'sideways_use_ema': True, 'sideways_use_atr': False, 'sideways_use_adx': False, 'sideways_use_spike': True, 'sideways_rsi_required': True}.
[I 2025-08-31 11:22:28,345] Trial 715 finished with values: [-1000000000.0, 1000000000.0] and parameters: {'p_sma': 32, 'p_std': 16, 'p_atr': 28, 'p_adx': 22, 'rsi_period': 38, 'ema1': 28, 'ema2': 32, 'slip_atr_k': 0.21513872938653333, 'slip_spread_k': 0.6782210555547769, 'spread_hl_frac': 0.033440201690758335, 'bb_std_mult': 2.0521526901832896, 'rsi_os': 27, 'rsi_ob': 82, 'vol_spike': 0.12262755484941938, 'adx_thresh': 10.326786453470943, 'atr_min_pct': 0.02081369160516439, 'atr_max_pct': 0.05926914747839435, 'tp_mult': 2.968403473225385, 'tsl_mult': 0.0397988686676424, 'strategy': 'breakout', 'time_stop': 202, 'use_sma': True, 'use_atr': True, 'use_adx': False, 'use_ema': True, 'use_spike': False, 'rsi_required': False, 'edge_k': 1.1202373018677982, 'edge_cap': 0.7130147837730773, 'bull_strategy': 'mean_reversion', 'bull_bb_std_mult': 2.8552267466065135, 'bull_rsi_os': 37, 'bull_rsi_ob': 59, 'bull_adx_thresh': 26.4262810603334, 'bull_atr_min_pct': 0.01244111702079215, 'bull_atr_max_pct': 0.035003423835510625, 'bull_tp_mult': 2.9170992277798806, 'bull_tsl_mult': 0.44722086367724695, 'bull_time_stop': 160, 'bull_use_sma': False, 'bull_use_ema': True, 'bull_use_atr': False, 'bull_use_adx': True, 'bull_use_spike': False, 'bull_rsi_required': False, 'bear_strategy': 'mean_reversion', 'bear_bb_std_mult': 1.5798988529916187, 'bear_rsi_os': 37, 'bear_rsi_ob': 54, 'bear_adx_thresh': 12.339616932364406, 'bear_atr_min_pct': 0.019589643455025684, 'bear_atr_max_pct': 0.013453980787170208, 'bear_tp_mult': 2.6103798687550004, 'bear_tsl_mult': 0.837280457749821, 'bear_time_stop': 122, 'bear_use_sma': False, 'bear_use_ema': True, 'bear_use_atr': False, 'bear_use_adx': False, 'bear_use_spike': False, 'bear_rsi_required': False, 'sideways_strategy': 'mean_reversion', 'sideways_bb_std_mult': 1.0237950919840295, 'sideways_rsi_os': 40, 'sideways_rsi_ob': 61, 'sideways_adx_thresh': 24.726857542811786, 'sideways_atr_min_pct': 0.005850040386292593, 'sideways_atr_max_pct': 0.07831304468113809, 'sideways_tp_mult': 1.4368537275274347, 'sideways_tsl_mult': 0.8594384015204833, 'sideways_time_stop': 181, 'sideways_use_sma': True, 'sideways_use_ema': True, 'sideways_use_atr': False, 'sideways_use_adx': False, 'sideways_use_spike': True, 'sideways_rsi_required': True}.
[I 2025-08-31 11:22:28,417] Trial 714 finished with values: [-1000000000.0, 1000000000.0] and parameters: {'p_sma': 40, 'p_std': 15, 'p_atr': 28, 'p_adx': 22, 'rsi_period': 38, 'ema1': 8, 'ema2': 32, 'slip_atr_k': 0.21012172745716642, 'slip_spread_k': 0.48140123225773174, 'spread_hl_frac': 0.020227618271275123, 'bb_std_mult': 0.6889652120925286, 'rsi_os': 54, 'rsi_ob': 65, 'vol_spike': 0.12329092965965432, 'adx_thresh': 23.205045935107847, 'atr_min_pct': 0.02081102568894163, 'atr_max_pct': 0.08999760009012789, 'tp_mult': 2.6196221921036744, 'tsl_mult': 0.03148586658509328, 'strategy': 'breakout', 'time_stop': 65, 'use_sma': True, 'use_atr': True, 'use_adx': False, 'use_ema': True, 'use_spike': False, 'rsi_required': False, 'edge_k': 1.2023662371893942, 'edge_cap': 0.720837601736684, 'bull_strategy': 'mean_reversion', 'bull_bb_std_mult': 0.5419326402811377, 'bull_rsi_os': 50, 'bull_rsi_ob': 63, 'bull_adx_thresh': 28.168798123632705, 'bull_atr_min_pct': 0.012375882288705412, 'bull_atr_max_pct': 0.036013944478443874, 'bull_tp_mult': 2.8906304821816016, 'bull_tsl_mult': 0.27171154741168163, 'bull_time_stop': 135, 'bull_use_sma': False, 'bull_use_ema': True, 'bull_use_atr': False, 'bull_use_adx': True, 'bull_use_spike': False, 'bull_rsi_required': False, 'bear_strategy': 'mean_reversion', 'bear_bb_std_mult': 1.0980151624127745, 'bear_rsi_os': 18, 'bear_rsi_ob': 73, 'bear_adx_thresh': 32.186517124649896, 'bear_atr_min_pct': 0.006152218726724158, 'bear_atr_max_pct': 0.1369029312583534, 'bear_tp_mult': 2.6278349295492, 'bear_tsl_mult': 0.7901459472132876, 'bear_time_stop': 90, 'bear_use_sma': False, 'bear_use_ema': True, 'bear_use_atr': False, 'bear_use_adx': False, 'bear_use_spike': False, 'bear_rsi_required': False, 'sideways_strategy': 'mean_reversion', 'sideways_bb_std_mult': 3.066549198516729, 'sideways_rsi_os': 46, 'sideways_rsi_ob': 79, 'sideways_adx_thresh': 26.776703626055884, 'sideways_atr_min_pct': 0.02091656179131921, 'sideways_atr_max_pct': 0.10248300229769464, 'sideways_tp_mult': 1.4361596821488307, 'sideways_tsl_mult': 0.8622077233751645, 'sideways_time_stop': 183, 'sideways_use_sma': True, 'sideways_use_ema': True, 'sideways_use_atr': False, 'sideways_use_adx': False, 'sideways_use_spike': True, 'sideways_rsi_required': False}.
[I 2025-08-31 11:23:02,373] Trial 720 finished with values: [-1000000000.0, 1000000000.0] and parameters: {'p_sma': 36, 'p_std': 13, 'p_atr': 29, 'p_adx': 21, 'rsi_period': 35, 'ema1': 5, 'ema2': 29, 'slip_atr_k': 0.0283529055527196, 'slip_spread_k': 0.5006131393789364, 'spread_hl_frac': 0.018195690475109147, 'bb_std_mult': 0.8444831313896237, 'rsi_os': 38, 'rsi_ob': 84, 'vol_spike': 0.07810597435813742, 'adx_thresh': 10.941333146016154, 'atr_min_pct': 0.027445377314755375, 'atr_max_pct': 0.05569405570938623, 'tp_mult': 2.9284641699077616, 'tsl_mult': 0.11128756879407302, 'strategy': 'breakout', 'time_stop': 76, 'use_sma': True, 'use_atr': True, 'use_adx': False, 'use_ema': True, 'use_spike': False, 'rsi_required': False, 'edge_k': 1.6064275347211865, 'edge_cap': 0.6870119254896822, 'bull_strategy': 'mean_reversion', 'bull_bb_std_mult': 1.9536385064847506, 'bull_rsi_os': 43, 'bull_rsi_ob': 51, 'bull_adx_thresh': 27.381022273690196, 'bull_atr_min_pct': 0.011578424368595191, 'bull_atr_max_pct': 0.03686835893374912, 'bull_tp_mult': 2.8034570753178643, 'bull_tsl_mult': 0.47868645969022283, 'bull_time_stop': 147, 'bull_use_sma': False, 'bull_use_ema': False, 'bull_use_atr': False, 'bull_use_adx': True, 'bull_use_spike': False, 'bull_rsi_required': False, 'bear_strategy': 'mean_reversion', 'bear_bb_std_mult': 0.6606260610523043, 'bear_rsi_os': 52, 'bear_rsi_ob': 55, 'bear_adx_thresh': 12.363239161919854, 'bear_atr_min_pct': 0.00817226067545368, 'bear_atr_max_pct': 0.01787417243106435, 'bear_tp_mult': 2.0663094296863007, 'bear_tsl_mult': 0.887205907364266, 'bear_time_stop': 196, 'bear_use_sma': False, 'bear_use_ema': False, 'bear_use_atr': True, 'bear_use_adx': False, 'bear_use_spike': True, 'bear_rsi_required': False, 'sideways_strategy': 'mean_reversion', 'sideways_bb_std_mult': 0.9507870028805899, 'sideways_rsi_os': 29, 'sideways_rsi_ob': 76, 'sideways_adx_thresh': 20.16194647980228, 'sideways_atr_min_pct': 0.004510434320858479, 'sideways_atr_max_pct': 0.07279884857363966, 'sideways_tp_mult': 2.998693175897448, 'sideways_tsl_mult': 0.8902028647587643, 'sideways_time_stop': 161, 'sideways_use_sma': True, 'sideways_use_ema': True, 'sideways_use_atr': True, 'sideways_use_adx': False, 'sideways_use_spike': True, 'sideways_rsi_required': False}.
[I 2025-08-31 11:23:02,483] Trial 717 finished with values: [-0.002142868297911993, 0.008883373252864717] and parameters: {'p_sma': 33, 'p_std': 14, 'p_atr': 28, 'p_adx': 20, 'rsi_period': 53, 'ema1': 5, 'ema2': 50, 'slip_atr_k': 0.028386782795360853, 'slip_spread_k': 0.5067968201940813, 'spread_hl_frac': 0.015039223850184627, 'bb_std_mult': 2.893796980548072, 'rsi_os': 27, 'rsi_ob': 65, 'vol_spike': 0.17765303572693364, 'adx_thresh': 25.838553591496648, 'atr_min_pct': 0.022702277677133315, 'atr_max_pct': 0.11355490015724097, 'tp_mult': 2.9955838675313164, 'tsl_mult': 0.11174943161604295, 'strategy': 'breakout', 'time_stop': 82, 'use_sma': True, 'use_atr': True, 'use_adx': False, 'use_ema': True, 'use_spike': False, 'rsi_required': False, 'edge_k': 0.21060740782257292, 'edge_cap': 0.7054179452300845, 'bull_strategy': 'mean_reversion', 'bull_bb_std_mult': 2.861880709585507, 'bull_rsi_os': 43, 'bull_rsi_ob': 59, 'bull_adx_thresh': 28.196122422609154, 'bull_atr_min_pct': 0.010318631124376289, 'bull_atr_max_pct': 0.03662119060388711, 'bull_tp_mult': 2.877454805084752, 'bull_tsl_mult': 0.26403223773039325, 'bull_time_stop': 56, 'bull_use_sma': False, 'bull_use_ema': True, 'bull_use_atr': False, 'bull_use_adx': True, 'bull_use_spike': False, 'bull_rsi_required': False, 'bear_strategy': 'mean_reversion', 'bear_bb_std_mult': 1.5861934348098434, 'bear_rsi_os': 44, 'bear_rsi_ob': 54, 'bear_adx_thresh': 12.452088171705013, 'bear_atr_min_pct': 0.0044598561365378694, 'bear_atr_max_pct': 0.1384007327240326, 'bear_tp_mult': 2.659241904825509, 'bear_tsl_mult': 0.8417238584904772, 'bear_time_stop': 198, 'bear_use_sma': False, 'bear_use_ema': False, 'bear_use_atr': False, 'bear_use_adx': False, 'bear_use_spike': True, 'bear_rsi_required': False, 'sideways_strategy': 'mean_reversion', 'sideways_bb_std_mult': 1.3917284918604378, 'sideways_rsi_os': 46, 'sideways_rsi_ob': 76, 'sideways_adx_thresh': 34.20593429560308, 'sideways_atr_min_pct': 0.006033484647827935, 'sideways_atr_max_pct': 0.03299360886407784, 'sideways_tp_mult': 1.538303585241877, 'sideways_tsl_mult': 0.8680530524599402, 'sideways_time_stop': 161, 'sideways_use_sma': True, 'sideways_use_ema': True, 'sideways_use_atr': True, 'sideways_use_adx': False, 'sideways_use_spike': True, 'sideways_rsi_required': False}.
[I 2025-08-31 11:23:02,594] Trial 719 finished with values: [-0.0030872207856790235, 0.007140970101158799] and parameters: {'p_sma': 7, 'p_std': 14, 'p_atr': 28, 'p_adx': 21, 'rsi_period': 34, 'ema1': 5, 'ema2': 40, 'slip_atr_k': 0.02562819437093985, 'slip_spread_k': 0.5118546541348057, 'spread_hl_frac': 0.006256603511678772, 'bb_std_mult': 0.6393647926235753, 'rsi_os': 38, 'rsi_ob': 95, 'vol_spike': 0.17870209019078323, 'adx_thresh': 11.193502766887358, 'atr_min_pct': 0.007929862878496258, 'atr_max_pct': 0.060424182650275125, 'tp_mult': 1.0516104410490308, 'tsl_mult': 0.10539858130109007, 'strategy': 'breakout', 'time_stop': 65, 'use_sma': True, 'use_atr': True, 'use_adx': False, 'use_ema': True, 'use_spike': False, 'rsi_required': False, 'edge_k': 0.8161289758678552, 'edge_cap': 0.6873429504700806, 'bull_strategy': 'mean_reversion', 'bull_bb_std_mult': 1.6055424754133183, 'bull_rsi_os': 43, 'bull_rsi_ob': 61, 'bull_adx_thresh': 28.162773029400817, 'bull_atr_min_pct': 0.010398873184197601, 'bull_atr_max_pct': 0.08948910347881112, 'bull_tp_mult': 2.87928772718301, 'bull_tsl_mult': 0.19779007393167353, 'bull_time_stop': 58, 'bull_use_sma': False, 'bull_use_ema': True, 'bull_use_atr': False, 'bull_use_adx': True, 'bull_use_spike': False, 'bull_rsi_required': False, 'bear_strategy': 'mean_reversion', 'bear_bb_std_mult': 3.593839928253599, 'bear_rsi_os': 52, 'bear_rsi_ob': 55, 'bear_adx_thresh': 8.578371727498984, 'bear_atr_min_pct': 0.00428395032344661, 'bear_atr_max_pct': 0.13901497707677918, 'bear_tp_mult': 2.665045763221518, 'bear_tsl_mult': 0.7913054696393478, 'bear_time_stop': 93, 'bear_use_sma': False, 'bear_use_ema': False, 'bear_use_atr': True, 'bear_use_adx': False, 'bear_use_spike': True, 'bear_rsi_required': False, 'sideways_strategy': 'mean_reversion', 'sideways_bb_std_mult': 1.967362639871919, 'sideways_rsi_os': 7, 'sideways_rsi_ob': 79, 'sideways_adx_thresh': 26.679221957649887, 'sideways_atr_min_pct': 0.017018460412059802, 'sideways_atr_max_pct': 0.13899329357767107, 'sideways_tp_mult': 1.5535354620275323, 'sideways_tsl_mult': 0.8893262761554904, 'sideways_time_stop': 162, 'sideways_use_sma': True, 'sideways_use_ema': True, 'sideways_use_atr': True, 'sideways_use_adx': False, 'sideways_use_spike': True, 'sideways_rsi_required': False}.
