[I 2025-08-31 10:21:52,664] Trial 246 finished with values: [-1000000000.0, 1000000000.0] and parameters: {'p_sma': 47, 'p_std': 34, 'p_atr': 18, 'p_adx': 14, 'rsi_period': 21, 'ema1': 11, 'ema2': 60, 'slip_atr_k': 0.07694272797172366, 'slip_spread_k': 0.28270339639881054, 'spread_hl_frac': 0.02543442894589169, 'bb_std_mult': 1.8127725480139283, 'rsi_os': 42, 'rsi_ob': 51, 'vol_spike': 0.11458851151188197, 'adx_thresh': 31.765786524702502, 'atr_min_pct': 0.02267778930194901, 'atr_max_pct': 0.021489900897687406, 'tp_mult': 2.8430432574987394, 'tsl_mult': 0.6188043065381522, 'strategy': 'mean_reversion', 'time_stop': 141, 'use_sma': False, 'use_atr': False, 'use_adx': True, 'use_ema': False, 'use_spike': True, 'rsi_required': True, 'edge_k': 0.4464285765410442, 'edge_cap': 0.15109972551026823, 'bull_strategy': 'breakout', 'bull_bb_std_mult': 0.9156852156367159, 'bull_rsi_os': 39, 'bull_rsi_ob': 75, 'bull_adx_thresh': 9.52375609486129, 'bull_atr_min_pct': 0.009378514147324189, 'bull_atr_max_pct': 0.07016802927761698, 'bull_tp_mult': 1.1464514320496653, 'bull_tsl_mult': 0.0975583581879667, 'bull_time_stop': 300, 'bull_use_sma': True, 'bull_use_ema': True, 'bull_use_atr': True, 'bull_use_adx': True, 'bull_use_spike': True, 'bull_rsi_required': False, 'bear_strategy': 'breakout', 'bear_bb_std_mult': 3.332023979336874, 'bear_rsi_os': 30, 'bear_rsi_ob': 58, 'bear_adx_thresh': 9.072715324245229, 'bear_atr_min_pct': 0.017249672937278165, 'bear_atr_max_pct': 0.1255240002320201, 'bear_tp_mult': 1.329975584624165, 'bear_tsl_mult': 0.12095877832627135, 'bear_time_stop': 193, 'bear_use_sma': False, 'bear_use_ema': False, 'bear_use_atr': True, 'bear_use_adx': False, 'bear_use_spike': True, 'bear_rsi_required': True, 'sideways_strategy': 'breakout', 'sideways_bb_std_mult': 1.905380466376367, 'sideways_rsi_os': 36, 'sideways_rsi_ob': 82, 'sideways_adx_thresh': 14.231040011153462, 'sideways_atr_min_pct': 0.002563313318476532, 'sideways_atr_max_pct': 0.13936577427077879, 'sideways_tp_mult': 1.2370378910074584, 'sideways_tsl_mult': 0.6518114213978223, 'sideways_time_stop': 205, 'sideways_use_sma': True, 'sideways_use_ema': False, 'sideways_use_atr': True, 'sideways_use_adx': False, 'sideways_use_spike': True, 'sideways_rsi_required': False}.
[I 2025-08-31 10:22:22,605] Trial 245 finished with values: [-1000000000.0, 1000000000.0] and parameters: {'p_sma': 58, 'p_std': 34, 'p_atr': 17, 'p_adx': 24, 'rsi_period': 22, 'ema1': 11, 'ema2': 59, 'slip_atr_k': 0.12177884267457299, 'slip_spread_k': 0.25286344555861845, 'spread_hl_frac': 0.02633418090484193, 'bb_std_mult': 1.7714013960329014, 'rsi_os': 42, 'rsi_ob': 53, 'vol_spike': 0.21660317829181056, 'adx_thresh': 7.683055655916048, 'atr_min_pct': 0.022077421906813284, 'atr_max_pct': 0.02310158863393417, 'tp_mult': 1.466459002906987, 'tsl_mult': 0.6509790272395839, 'strategy': 'mean_reversion', 'time_stop': 142, 'use_sma': False, 'use_atr': False, 'use_adx': True, 'use_ema': False, 'use_spike': True, 'rsi_required': True, 'edge_k': 1.6437733206950362, 'edge_cap': 0.1547021758610577, 'bull_strategy': 'breakout', 'bull_bb_std_mult': 0.9333000939316056, 'bull_rsi_os': 41, 'bull_rsi_ob': 85, 'bull_adx_thresh': 10.058523801479478, 'bull_atr_min_pct': 0.009390853657547826, 'bull_atr_max_pct': 0.06797477374931053, 'bull_tp_mult': 1.2058898355773395, 'bull_tsl_mult': 0.09799913697830304, 'bull_time_stop': 18, 'bull_use_sma': True, 'bull_use_ema': True, 'bull_use_atr': False, 'bull_use_adx': True, 'bull_use_spike': True, 'bull_rsi_required': False, 'bear_strategy': 'mean_reversion', 'bear_bb_std_mult': 2.1895570638353834, 'bear_rsi_os': 29, 'bear_rsi_ob': 58, 'bear_adx_thresh': 8.995524064305938, 'bear_atr_min_pct': 0.016802295998960524, 'bear_atr_max_pct': 0.12610920296057654, 'bear_tp_mult': 2.6161313026676103, 'bear_tsl_mult': 0.1587285684431994, 'bear_time_stop': 254, 'bear_use_sma': False, 'bear_use_ema': False, 'bear_use_atr': True, 'bear_use_adx': False, 'bear_use_spike': True, 'bear_rsi_required': True, 'sideways_strategy': 'breakout', 'sideways_bb_std_mult': 2.68007626593059, 'sideways_rsi_os': 36, 'sideways_rsi_ob': 83, 'sideways_adx_thresh': 14.310739258172914, 'sideways_atr_min_pct': 0.002900890348458671, 'sideways_atr_max_pct': 0.1411930027682269, 'sideways_tp_mult': 1.8473216075243302, 'sideways_tsl_mult': 0.8112142668676556, 'sideways_time_stop': 204, 'sideways_use_sma': True, 'sideways_use_ema': False, 'sideways_use_atr': True, 'sideways_use_adx': False, 'sideways_use_spike': True, 'sideways_rsi_required': False}.
[I 2025-08-31 10:22:22,801] Trial 242 finished with values: [-0.012912835063366712, 0.013220297347682671] and parameters: {'p_sma': 21, 'p_std': 34, 'p_atr': 17, 'p_adx': 8, 'rsi_period': 22, 'ema1': 11, 'ema2': 60, 'slip_atr_k': 0.07799698884100587, 'slip_spread_k': 0.2295499428173432, 'spread_hl_frac': 0.02570487595955023, 'bb_std_mult': 2.5604734733804535, 'rsi_os': 43, 'rsi_ob': 82, 'vol_spike': 0.2131618262804104, 'adx_thresh': 8.436657789650539, 'atr_min_pct': 0.02238599336897101, 'atr_max_pct': 0.14708789174711978, 'tp_mult': 2.8592973406925863, 'tsl_mult': 0.5260467654065974, 'strategy': 'mean_reversion', 'time_stop': 152, 'use_sma': False, 'use_atr': False, 'use_adx': True, 'use_ema': False, 'use_spike': True, 'rsi_required': True, 'edge_k': 0.7722781752969871, 'edge_cap': 0.6738450675683447, 'bull_strategy': 'breakout', 'bull_bb_std_mult': 1.0896139520124788, 'bull_rsi_os': 41, 'bull_rsi_ob': 74, 'bull_adx_thresh': 10.029481408473057, 'bull_atr_min_pct': 0.002133351846916761, 'bull_atr_max_pct': 0.06784917886124982, 'bull_tp_mult': 1.2213403605855957, 'bull_tsl_mult': 0.3285664287778759, 'bull_time_stop': 232, 'bull_use_sma': False, 'bull_use_ema': True, 'bull_use_atr': True, 'bull_use_adx': True, 'bull_use_spike': True, 'bull_rsi_required': False, 'bear_strategy': 'breakout', 'bear_bb_std_mult': 2.170934927664668, 'bear_rsi_os': 29, 'bear_rsi_ob': 58, 'bear_adx_thresh': 7.871753019572982, 'bear_atr_min_pct': 0.017257335450106194, 'bear_atr_max_pct': 0.09855557630050912, 'bear_tp_mult': 2.603676611047721, 'bear_tsl_mult': 0.15546413498789988, 'bear_time_stop': 27, 'bear_use_sma': False, 'bear_use_ema': False, 'bear_use_atr': False, 'bear_use_adx': False, 'bear_use_spike': True, 'bear_rsi_required': True, 'sideways_strategy': 'breakout', 'sideways_bb_std_mult': 1.8801105622201244, 'sideways_rsi_os': 39, 'sideways_rsi_ob': 84, 'sideways_adx_thresh': 15.355761235642536, 'sideways_atr_min_pct': 0.0028518505085939234, 'sideways_atr_max_pct': 0.11266537010676204, 'sideways_tp_mult': 2.943519544800873, 'sideways_tsl_mult': 0.8128752755875372, 'sideways_time_stop': 259, 'sideways_use_sma': True, 'sideways_use_ema': False, 'sideways_use_atr': False, 'sideways_use_adx': False, 'sideways_use_spike': True, 'sideways_rsi_required': False}.
[I 2025-08-31 10:22:23,210] Trial 243 finished with values: [-0.023397877730557015, 0.02331502525380953] and parameters: {'p_sma': 58, 'p_std': 33, 'p_atr': 17, 'p_adx': 8, 'rsi_period': 21, 'ema1': 12, 'ema2': 59, 'slip_atr_k': 0.06623277519800981, 'slip_spread_k': 0.25662356936581593, 'spread_hl_frac': 0.025700395463831377, 'bb_std_mult': 1.873637080875971, 'rsi_os': 42, 'rsi_ob': 77, 'vol_spike': 0.014273176859424141, 'adx_thresh': 8.334487491645762, 'atr_min_pct': 0.02244400101294072, 'atr_max_pct': 0.14598677551978761, 'tp_mult': 2.8472421371626275, 'tsl_mult': 0.756444202150556, 'strategy': 'mean_reversion', 'time_stop': 61, 'use_sma': False, 'use_atr': False, 'use_adx': True, 'use_ema': False, 'use_spike': True, 'rsi_required': True, 'edge_k': 0.44802606198363726, 'edge_cap': 0.10613256352816541, 'bull_strategy': 'breakout', 'bull_bb_std_mult': 2.0341811851925504, 'bull_rsi_os': 41, 'bull_rsi_ob': 87, 'bull_adx_thresh': 25.5657183993443, 'bull_atr_min_pct': 0.0024920964313045247, 'bull_atr_max_pct': 0.06708335912477328, 'bull_tp_mult': 1.219608485579555, 'bull_tsl_mult': 0.09550706197578704, 'bull_time_stop': 225, 'bull_use_sma': True, 'bull_use_ema': True, 'bull_use_atr': False, 'bull_use_adx': True, 'bull_use_spike': True, 'bull_rsi_required': False, 'bear_strategy': 'mean_reversion', 'bear_bb_std_mult': 1.4613912609621957, 'bear_rsi_os': 29, 'bear_rsi_ob': 58, 'bear_adx_thresh': 7.964948522303316, 'bear_atr_min_pct': 0.016693527169960153, 'bear_atr_max_pct': 0.11650184282745693, 'bear_tp_mult': 1.9643732209695184, 'bear_tsl_mult': 0.15726034140952452, 'bear_time_stop': 274, 'bear_use_sma': False, 'bear_use_ema': False, 'bear_use_atr': True, 'bear_use_adx': False, 'bear_use_spike': True, 'bear_rsi_required': True, 'sideways_strategy': 'breakout', 'sideways_bb_std_mult': 2.5709177073617173, 'sideways_rsi_os': 43, 'sideways_rsi_ob': 84, 'sideways_adx_thresh': 14.379856424933786, 'sideways_atr_min_pct': 0.0029365506779846554, 'sideways_atr_max_pct': 0.1491473234210494, 'sideways_tp_mult': 2.5220482355892937, 'sideways_tsl_mult': 0.8274039274241827, 'sideways_time_stop': 257, 'sideways_use_sma': True, 'sideways_use_ema': False, 'sideways_use_atr': True, 'sideways_use_adx': False, 'sideways_use_spike': True, 'sideways_rsi_required': False}.
[I 2025-08-31 10:22:24,576] Trial 247 finished with values: [-0.04465470110789915, 0.04471223164736395] and parameters: {'p_sma': 52, 'p_std': 9, 'p_atr': 17, 'p_adx': 9, 'rsi_period': 24, 'ema1': 11, 'ema2': 57, 'slip_atr_k': 0.12067995930105214, 'slip_spread_k': 0.015143173890398709, 'spread_hl_frac': 0.04481352609423992, 'bb_std_mult': 1.8830338872873236, 'rsi_os': 27, 'rsi_ob': 77, 'vol_spike': 0.21722942881939322, 'adx_thresh': 9.640567678991754, 'atr_min_pct': 0.021324548621751094, 'atr_max_pct': 0.10500347312081108, 'tp_mult': 1.0293554107330074, 'tsl_mult': 0.9148027732205763, 'strategy': 'mean_reversion', 'time_stop': 12, 'use_sma': False, 'use_atr': False, 'use_adx': False, 'use_ema': False, 'use_spike': True, 'rsi_required': True, 'edge_k': 0.757290324629021, 'edge_cap': 0.5905815322698357, 'bull_strategy': 'breakout', 'bull_bb_std_mult': 2.0204298662055247, 'bull_rsi_os': 41, 'bull_rsi_ob': 75, 'bull_adx_thresh': 10.207219001033147, 'bull_atr_min_pct': 0.002312495642621022, 'bull_atr_max_pct': 0.11887047380265262, 'bull_tp_mult': 1.2095371130548633, 'bull_tsl_mult': 0.11802486978571262, 'bull_time_stop': 232, 'bull_use_sma': True, 'bull_use_ema': True, 'bull_use_atr': True, 'bull_use_adx': True, 'bull_use_spike': True, 'bull_rsi_required': False, 'bear_strategy': 'mean_reversion', 'bear_bb_std_mult': 0.6737374465214749, 'bear_rsi_os': 29, 'bear_rsi_ob': 57, 'bear_adx_thresh': 26.808625512883275, 'bear_atr_min_pct': 0.017990250858004386, 'bear_atr_max_pct': 0.11606865918530172, 'bear_tp_mult': 1.530843173369481, 'bear_tsl_mult': 0.1524193042611451, 'bear_time_stop': 21, 'bear_use_sma': False, 'bear_use_ema': True, 'bear_use_atr': True, 'bear_use_adx': False, 'bear_use_spike': True, 'bear_rsi_required': True, 'sideways_strategy': 'breakout', 'sideways_bb_std_mult': 2.5913943981135503, 'sideways_rsi_os': 41, 'sideways_rsi_ob': 85, 'sideways_adx_thresh': 14.284369645964475, 'sideways_atr_min_pct': 0.003062245271902681, 'sideways_atr_max_pct': 0.07969614988185093, 'sideways_tp_mult': 1.6040861110017686, 'sideways_tsl_mult': 0.8120959173826733, 'sideways_time_stop': 256, 'sideways_use_sma': True, 'sideways_use_ema': False, 'sideways_use_atr': False, 'sideways_use_adx': False, 'sideways_use_spike': True, 'sideways_rsi_required': False}.
[I 2025-08-31 10:22:25,092] Trial 251 finished with values: [-1000000000.0, 1000000000.0] and parameters: {'p_sma': 39, 'p_std': 48, 'p_atr': 16, 'p_adx': 22, 'rsi_period': 25, 'ema1': 12, 'ema2': 21, 'slip_atr_k': 0.0001662042777629963, 'slip_spread_k': 0.2842830689110907, 'spread_hl_frac': 0.028431502240953803, 'bb_std_mult': 2.4311772837978545, 'rsi_os': 37, 'rsi_ob': 89, 'vol_spike': 0.20523539760632395, 'adx_thresh': 16.502403156380137, 'atr_min_pct': 0.029201451992493316, 'atr_max_pct': 0.015275188009358204, 'tp_mult': 2.799912804734672, 'tsl_mult': 0.7906178050587351, 'strategy': 'mean_reversion', 'time_stop': 146, 'use_sma': False, 'use_atr': False, 'use_adx': False, 'use_ema': False, 'use_spike': True, 'rsi_required': False, 'edge_k': 0.6571556053450432, 'edge_cap': 0.17275773098551087, 'bull_strategy': 'breakout', 'bull_bb_std_mult': 1.1858333779577412, 'bull_rsi_os': 20, 'bull_rsi_ob': 77, 'bull_adx_thresh': 22.270669736796364, 'bull_atr_min_pct': 0.004648842169025882, 'bull_atr_max_pct': 0.11369833150677053, 'bull_tp_mult': 1.604220255960442, 'bull_tsl_mult': 0.7038081654109375, 'bull_time_stop': 5, 'bull_use_sma': True, 'bull_use_ema': True, 'bull_use_atr': True, 'bull_use_adx': True, 'bull_use_spike': True, 'bull_rsi_required': False, 'bear_strategy': 'breakout', 'bear_bb_std_mult': 3.2364107375063886, 'bear_rsi_os': 45, 'bear_rsi_ob': 55, 'bear_adx_thresh': 6.563867333366508, 'bear_atr_min_pct': 0.00020661363975866057, 'bear_atr_max_pct': 0.12131301221241633, 'bear_tp_mult': 2.554314842572749, 'bear_tsl_mult': 0.1127282300729395, 'bear_time_stop': 33, 'bear_use_sma': False, 'bear_use_ema': True, 'bear_use_atr': True, 'bear_use_adx': False, 'bear_use_spike': True, 'bear_rsi_required': True, 'sideways_strategy': 'mean_reversion', 'sideways_bb_std_mult': 3.4606867256536047, 'sideways_rsi_os': 32, 'sideways_rsi_ob': 88, 'sideways_adx_thresh': 5.444582020372586, 'sideways_atr_min_pct': 0.004161405256085268, 'sideways_atr_max_pct': 0.019757782345204304, 'sideways_tp_mult': 1.3467769873478188, 'sideways_tsl_mult': 0.9583146309275918, 'sideways_time_stop': 99, 'sideways_use_sma': False, 'sideways_use_ema': False, 'sideways_use_atr': False, 'sideways_use_adx': False, 'sideways_use_spike': True, 'sideways_rsi_required': False}.
[I 2025-08-31 10:22:25,499] Trial 252 finished with values: [-1000000000.0, 1000000000.0] and parameters: {'p_sma': 19, 'p_std': 17, 'p_atr': 26, 'p_adx': 9, 'rsi_period': 76, 'ema1': 7, 'ema2': 35, 'slip_atr_k': 0.007104677565405032, 'slip_spread_k': 0.2991743929797736, 'spread_hl_frac': 0.013582699746877432, 'bb_std_mult': 2.6735756055560227, 'rsi_os': 39, 'rsi_ob': 47, 'vol_spike': 0.20192523517076452, 'adx_thresh': 27.25908706891323, 'atr_min_pct': 0.015309701066500342, 'atr_max_pct': 0.041679285458796844, 'tp_mult': 2.7314986287010563, 'tsl_mult': 0.14038004924048314, 'strategy': 'mean_reversion', 'time_stop': 246, 'use_sma': False, 'use_atr': False, 'use_adx': True, 'use_ema': False, 'use_spike': True, 'rsi_required': True, 'edge_k': 0.9189499632349348, 'edge_cap': 0.18788013983055696, 'bull_strategy': 'breakout', 'bull_bb_std_mult': 1.8148772826795694, 'bull_rsi_os': 44, 'bull_rsi_ob': 75, 'bull_adx_thresh': 6.032361564838144, 'bull_atr_min_pct': 0.0034997797522365696, 'bull_atr_max_pct': 0.06256557101062976, 'bull_tp_mult': 1.1593516294715591, 'bull_tsl_mult': 0.06386098195206084, 'bull_time_stop': 17, 'bull_use_sma': False, 'bull_use_ema': True, 'bull_use_atr': True, 'bull_use_adx': True, 'bull_use_spike': True, 'bull_rsi_required': False, 'bear_strategy': 'breakout', 'bear_bb_std_mult': 1.255459268933846, 'bear_rsi_os': 13, 'bear_rsi_ob': 77, 'bear_adx_thresh': 32.77863626399869, 'bear_atr_min_pct': 0.017844499634602516, 'bear_atr_max_pct': 0.12951876147224206, 'bear_tp_mult': 2.964791004160798, 'bear_tsl_mult': 0.19476867626118727, 'bear_time_stop': 293, 'bear_use_sma': False, 'bear_use_ema': False, 'bear_use_atr': True, 'bear_use_adx': False, 'bear_use_spike': False, 'bear_rsi_required': True, 'sideways_strategy': 'breakout', 'sideways_bb_std_mult': 2.76543907050996, 'sideways_rsi_os': 28, 'sideways_rsi_ob': 80, 'sideways_adx_thresh': 21.23122510045761, 'sideways_atr_min_pct': 0.0045457447306908256, 'sideways_atr_max_pct': 0.015300777448340347, 'sideways_tp_mult': 1.7299703463579874, 'sideways_tsl_mult': 0.7656177877558175, 'sideways_time_stop': 68, 'sideways_use_sma': False, 'sideways_use_ema': False, 'sideways_use_atr': False, 'sideways_use_adx': False, 'sideways_use_spike': True, 'sideways_rsi_required': False}.
[I 2025-08-31 10:22:55,398] Trial 250 finished with values: [-1000000000.0, 1000000000.0] and parameters: {'p_sma': 35, 'p_std': 32, 'p_atr': 16, 'p_adx': 9, 'rsi_period': 25, 'ema1': 12, 'ema2': 20, 'slip_atr_k': 0.05062924816286138, 'slip_spread_k': 0.2864534746033249, 'spread_hl_frac': 0.013296878260284785, 'bb_std_mult': 2.1085608415872525, 'rsi_os': 27, 'rsi_ob': 75, 'vol_spike': 0.16743781280244727, 'adx_thresh': 16.001003086012076, 'atr_min_pct': 0.01637786615014034, 'atr_max_pct': 0.10530704741522282, 'tp_mult': 1.2422860176394996, 'tsl_mult': 0.6833402995060948, 'strategy': 'mean_reversion', 'time_stop': 146, 'use_sma': False, 'use_atr': False, 'use_adx': False, 'use_ema': False, 'use_spike': True, 'rsi_required': True, 'edge_k': 1.7155802839618894, 'edge_cap': 0.17262205499646713, 'bull_strategy': 'breakout', 'bull_bb_std_mult': 1.1483992258404547, 'bull_rsi_os': 44, 'bull_rsi_ob': 77, 'bull_adx_thresh': 11.857517010180755, 'bull_atr_min_pct': 0.004748308193820485, 'bull_atr_max_pct': 0.06361541512895758, 'bull_tp_mult': 1.8823303948556747, 'bull_tsl_mult': 0.9401196808577128, 'bull_time_stop': 14, 'bull_use_sma': True, 'bull_use_ema': True, 'bull_use_atr': True, 'bull_use_adx': True, 'bull_use_spike': True, 'bull_rsi_required': False, 'bear_strategy': 'breakout', 'bear_bb_std_mult': 2.081325744557818, 'bear_rsi_os': 31, 'bear_rsi_ob': 56, 'bear_adx_thresh': 6.30549837876728, 'bear_atr_min_pct': 0.01799902541065613, 'bear_atr_max_pct': 0.13013902938382044, 'bear_tp_mult': 2.543208807782815, 'bear_tsl_mult': 0.13278055033543465, 'bear_time_stop': 33, 'bear_use_sma': False, 'bear_use_ema': True, 'bear_use_atr': True, 'bear_use_adx': False, 'bear_use_spike': True, 'bear_rsi_required': True, 'sideways_strategy': 'breakout', 'sideways_bb_std_mult': 3.3939730845596054, 'sideways_rsi_os': 41, 'sideways_rsi_ob': 85, 'sideways_adx_thresh': 14.002677230321979, 'sideways_atr_min_pct': 0.0042065480660123476, 'sideways_atr_max_pct': 0.056486564577107504, 'sideways_tp_mult': 1.6104152631649251, 'sideways_tsl_mult': 0.9728693387687255, 'sideways_time_stop': 86, 'sideways_use_sma': False, 'sideways_use_ema': False, 'sideways_use_atr': False, 'sideways_use_adx': False, 'sideways_use_spike': True, 'sideways_rsi_required': False}.
[I 2025-08-31 10:22:55,501] Trial 248 finished with values: [-1000000000.0, 1000000000.0] and parameters: {'p_sma': 35, 'p_std': 52, 'p_atr': 26, 'p_adx': 9, 'rsi_period': 25, 'ema1': 12, 'ema2': 21, 'slip_atr_k': 0.06454194781088267, 'slip_spread_k': 0.23219487161668045, 'spread_hl_frac': 0.04841971750081448, 'bb_std_mult': 1.232965101212953, 'rsi_os': 11, 'rsi_ob': 89, 'vol_spike': 0.20199603594239313, 'adx_thresh': 11.960527182298298, 'atr_min_pct': 0.02907462684238691, 'atr_max_pct': 0.08495451708881725, 'tp_mult': 1.243895530889507, 'tsl_mult': 0.12605125307507248, 'strategy': 'mean_reversion', 'time_stop': 12, 'use_sma': False, 'use_atr': False, 'use_adx': False, 'use_ema': False, 'use_spike': True, 'rsi_required': True, 'edge_k': 1.8110605666287434, 'edge_cap': 0.10099451437660668, 'bull_strategy': 'breakout', 'bull_bb_std_mult': 1.766286779672121, 'bull_rsi_os': 44, 'bull_rsi_ob': 77, 'bull_adx_thresh': 11.804948352793808, 'bull_atr_min_pct': 0.004707209111986234, 'bull_atr_max_pct': 0.11823417848475237, 'bull_tp_mult': 1.1697376542893219, 'bull_tsl_mult': 0.1204291486308155, 'bull_time_stop': 238, 'bull_use_sma': False, 'bull_use_ema': True, 'bull_use_atr': True, 'bull_use_adx': True, 'bull_use_spike': True, 'bull_rsi_required': False, 'bear_strategy': 'breakout', 'bear_bb_std_mult': 2.0950515620342425, 'bear_rsi_os': 31, 'bear_rsi_ob': 57, 'bear_adx_thresh': 32.8241599071693, 'bear_atr_min_pct': 0.018027917325348287, 'bear_atr_max_pct': 0.040670403067147844, 'bear_tp_mult': 1.148363475850187, 'bear_tsl_mult': 0.13248089598425958, 'bear_time_stop': 31, 'bear_use_sma': False, 'bear_use_ema': True, 'bear_use_atr': True, 'bear_use_adx': False, 'bear_use_spike': True, 'bear_rsi_required': True, 'sideways_strategy': 'breakout', 'sideways_bb_std_mult': 2.571654655276124, 'sideways_rsi_os': 39, 'sideways_rsi_ob': 84, 'sideways_adx_thresh': 13.9898217106456, 'sideways_atr_min_pct': 0.004431275041877427, 'sideways_atr_max_pct': 0.02012093467493826, 'sideways_tp_mult': 1.2151750742546281, 'sideways_tsl_mult': 0.17176892182921594, 'sideways_time_stop': 95, 'sideways_use_sma': False, 'sideways_use_ema': False, 'sideways_use_atr': False, 'sideways_use_adx': False, 'sideways_use_spike': True, 'sideways_rsi_required': False}.
