[I 2025-08-31 10:30:01,108] Trial 315 finished with values: [-1000000000.0, 1000000000.0] and parameters: {'p_sma': 19, 'p_std': 32, 'p_atr': 18, 'p_adx': 7, 'rsi_period': 54, 'ema1': 29, 'ema2': 32, 'slip_atr_k': 0.23385243064445588, 'slip_spread_k': 0.30242249846818714, 'spread_hl_frac': 0.031073989008886967, 'bb_std_mult': 2.6446329148748418, 'rsi_os': 34, 'rsi_ob': 75, 'vol_spike': 0.21240068921352134, 'adx_thresh': 8.362153509580867, 'atr_min_pct': 0.020383689744698803, 'atr_max_pct': 0.04250056949522227, 'tp_mult': 2.1332537215225305, 'tsl_mult': 0.5961703423587912, 'strategy': 'mean_reversion', 'time_stop': 173, 'use_sma': False, 'use_atr': True, 'use_adx': True, 'use_ema': True, 'use_spike': True, 'rsi_required': True, 'edge_k': 1.7106852392432306, 'edge_cap': 0.8009056019156913, 'bull_strategy': 'breakout', 'bull_bb_std_mult': 1.021345899681825, 'bull_rsi_os': 37, 'bull_rsi_ob': 86, 'bull_adx_thresh': 32.030242648441366, 'bull_atr_min_pct': 0.0038764980647766666, 'bull_atr_max_pct': 0.07608690511497096, 'bull_tp_mult': 2.1425819846561427, 'bull_tsl_mult': 0.514256700507936, 'bull_time_stop': 65, 'bull_use_sma': False, 'bull_use_ema': True, 'bull_use_atr': False, 'bull_use_adx': False, 'bull_use_spike': True, 'bull_rsi_required': False, 'bear_strategy': 'mean_reversion', 'bear_bb_std_mult': 3.1894131905301926, 'bear_rsi_os': 27, 'bear_rsi_ob': 57, 'bear_adx_thresh': 7.1145012776909455, 'bear_atr_min_pct': 0.02148830639493864, 'bear_atr_max_pct': 0.11690795832189817, 'bear_tp_mult': 1.4952935255237003, 'bear_tsl_mult': 0.1414810155057772, 'bear_time_stop': 36, 'bear_use_sma': True, 'bear_use_ema': False, 'bear_use_atr': False, 'bear_use_adx': False, 'bear_use_spike': True, 'bear_rsi_required': False, 'sideways_strategy': 'breakout', 'sideways_bb_std_mult': 2.6940938969667743, 'sideways_rsi_os': 33, 'sideways_rsi_ob': 86, 'sideways_adx_thresh': 13.81303588937441, 'sideways_atr_min_pct': 0.0036484218741156846, 'sideways_atr_max_pct': 0.09191821573570624, 'sideways_tp_mult': 1.8540937012251701, 'sideways_tsl_mult': 0.844483456597136, 'sideways_time_stop': 242, 'sideways_use_sma': False, 'sideways_use_ema': False, 'sideways_use_atr': True, 'sideways_use_adx': True, 'sideways_use_spike': True, 'sideways_rsi_required': False}.
[I 2025-08-31 10:30:01,607] Trial 316 finished with values: [-1000000000.0, 1000000000.0] and parameters: {'p_sma': 17, 'p_std': 32, 'p_atr': 27, 'p_adx': 24, 'rsi_period': 20, 'ema1': 16, 'ema2': 59, 'slip_atr_k': 0.07738013851157939, 'slip_spread_k': 0.3045714750607326, 'spread_hl_frac': 0.03458363277959882, 'bb_std_mult': 1.4759414335016885, 'rsi_os': 34, 'rsi_ob': 50, 'vol_spike': 0.21033661515951363, 'adx_thresh': 8.392533312673015, 'atr_min_pct': 0.021470945111749056, 'atr_max_pct': 0.0436341631747847, 'tp_mult': 2.113618314406891, 'tsl_mult': 0.5941446627476773, 'strategy': 'mean_reversion', 'time_stop': 196, 'use_sma': False, 'use_atr': True, 'use_adx': True, 'use_ema': True, 'use_spike': True, 'rsi_required': True, 'edge_k': 0.23819333036063828, 'edge_cap': 0.1569669676444333, 'bull_strategy': 'breakout', 'bull_bb_std_mult': 1.0047027439385716, 'bull_rsi_os': 43, 'bull_rsi_ob': 75, 'bull_adx_thresh': 31.633497728392385, 'bull_atr_min_pct': 0.004095936193165574, 'bull_atr_max_pct': 0.07631048952705141, 'bull_tp_mult': 1.3317733258625752, 'bull_tsl_mult': 0.08384242886161206, 'bull_time_stop': 132, 'bull_use_sma': False, 'bull_use_ema': True, 'bull_use_atr': False, 'bull_use_adx': False, 'bull_use_spike': True, 'bull_rsi_required': False, 'bear_strategy': 'mean_reversion', 'bear_bb_std_mult': 3.211759822222438, 'bear_rsi_os': 5, 'bear_rsi_ob': 57, 'bear_adx_thresh': 27.036245756295024, 'bear_atr_min_pct': 0.0009476161369395882, 'bear_atr_max_pct': 0.10384769162714227, 'bear_tp_mult': 2.9755105770950108, 'bear_tsl_mult': 0.20349452270624255, 'bear_time_stop': 258, 'bear_use_sma': True, 'bear_use_ema': False, 'bear_use_atr': True, 'bear_use_adx': False, 'bear_use_spike': True, 'bear_rsi_required': False, 'sideways_strategy': 'breakout', 'sideways_bb_std_mult': 2.6773229643382486, 'sideways_rsi_os': 34, 'sideways_rsi_ob': 86, 'sideways_adx_thresh': 33.16758222201523, 'sideways_atr_min_pct': 0.0038058040139530413, 'sideways_atr_max_pct': 0.02610043555437199, 'sideways_tp_mult': 1.1552015943012803, 'sideways_tsl_mult': 0.8440943468522399, 'sideways_time_stop': 300, 'sideways_use_sma': False, 'sideways_use_ema': False, 'sideways_use_atr': True, 'sideways_use_adx': True, 'sideways_use_spike': True, 'sideways_rsi_required': False}.
[I 2025-08-31 10:30:31,944] Trial 319 finished with values: [-1000000000.0, 1000000000.0] and parameters: {'p_sma': 17, 'p_std': 33, 'p_atr': 16, 'p_adx': 8, 'rsi_period': 23, 'ema1': 19, 'ema2': 35, 'slip_atr_k': 0.046442717842289566, 'slip_spread_k': 0.27241294637388563, 'spread_hl_frac': 0.030084960836249494, 'bb_std_mult': 2.7576195126225365, 'rsi_os': 16, 'rsi_ob': 55, 'vol_spike': 0.267484296240055, 'adx_thresh': 10.311415329966374, 'atr_min_pct': 0.01833180907134935, 'atr_max_pct': 0.04062529897040106, 'tp_mult': 2.828422285599728, 'tsl_mult': 0.7490214196936757, 'strategy': 'mean_reversion', 'time_stop': 147, 'use_sma': False, 'use_atr': False, 'use_adx': True, 'use_ema': False, 'use_spike': True, 'rsi_required': True, 'edge_k': 1.7532519127110173, 'edge_cap': 0.16752690065488188, 'bull_strategy': 'breakout', 'bull_bb_std_mult': 1.5909843513230382, 'bull_rsi_os': 47, 'bull_rsi_ob': 74, 'bull_adx_thresh': 5.061378704990526, 'bull_atr_min_pct': 0.016695163587609682, 'bull_atr_max_pct': 0.0756744173856101, 'bull_tp_mult': 1.1943972610623876, 'bull_tsl_mult': 0.08881069275583335, 'bull_time_stop': 12, 'bull_use_sma': True, 'bull_use_ema': True, 'bull_use_atr': True, 'bull_use_adx': True, 'bull_use_spike': True, 'bull_rsi_required': False, 'bear_strategy': 'breakout', 'bear_bb_std_mult': 2.0767559098542567, 'bear_rsi_os': 44, 'bear_rsi_ob': 56, 'bear_adx_thresh': 8.65715951227667, 'bear_atr_min_pct': 0.013388899067115819, 'bear_atr_max_pct': 0.12689050808587118, 'bear_tp_mult': 1.7291894811487636, 'bear_tsl_mult': 0.0020461568487768478, 'bear_time_stop': 55, 'bear_use_sma': False, 'bear_use_ema': False, 'bear_use_atr': True, 'bear_use_adx': False, 'bear_use_spike': True, 'bear_rsi_required': True, 'sideways_strategy': 'breakout', 'sideways_bb_std_mult': 2.5472317216904066, 'sideways_rsi_os': 35, 'sideways_rsi_ob': 59, 'sideways_adx_thresh': 16.598117558120666, 'sideways_atr_min_pct': 0.0037373623897111294, 'sideways_atr_max_pct': 0.01859266227846709, 'sideways_tp_mult': 1.2960441193493875, 'sideways_tsl_mult': 0.44060719844077195, 'sideways_time_stop': 249, 'sideways_use_sma': True, 'sideways_use_ema': False, 'sideways_use_atr': False, 'sideways_use_adx': False, 'sideways_use_spike': True, 'sideways_rsi_required': False}.
[I 2025-08-31 10:30:32,608] Trial 318 finished with values: [-1000000000.0, 1000000000.0] and parameters: {'p_sma': 19, 'p_std': 33, 'p_atr': 20, 'p_adx': 8, 'rsi_period': 42, 'ema1': 11, 'ema2': 58, 'slip_atr_k': 0.06417959760338608, 'slip_spread_k': 0.3128083248910286, 'spread_hl_frac': 0.027807462696067473, 'bb_std_mult': 2.7684642799767456, 'rsi_os': 41, 'rsi_ob': 74, 'vol_spike': 0.20902662410140174, 'adx_thresh': 10.320762036407368, 'atr_min_pct': 0.02154333531741303, 'atr_max_pct': 0.04144269880279345, 'tp_mult': 2.820359417831748, 'tsl_mult': 0.5958224700882496, 'strategy': 'mean_reversion', 'time_stop': 197, 'use_sma': False, 'use_atr': False, 'use_adx': True, 'use_ema': False, 'use_spike': True, 'rsi_required': True, 'edge_k': 1.7452697757490732, 'edge_cap': 0.15602857278605786, 'bull_strategy': 'breakout', 'bull_bb_std_mult': 1.572835054660142, 'bull_rsi_os': 44, 'bull_rsi_ob': 64, 'bull_adx_thresh': 17.1814204519511, 'bull_atr_min_pct': 0.004730257541352819, 'bull_atr_max_pct': 0.12956086398508943, 'bull_tp_mult': 2.159378914329359, 'bull_tsl_mult': 0.5080592060916722, 'bull_time_stop': 33, 'bull_use_sma': True, 'bull_use_ema': True, 'bull_use_atr': True, 'bull_use_adx': True, 'bull_use_spike': True, 'bull_rsi_required': False, 'bear_strategy': 'breakout', 'bear_bb_std_mult': 2.0893709636502824, 'bear_rsi_os': 8, 'bear_rsi_ob': 56, 'bear_adx_thresh': 8.53988672802452, 'bear_atr_min_pct': 0.021485064439341055, 'bear_atr_max_pct': 0.14031162159245766, 'bear_tp_mult': 1.198667809781278, 'bear_tsl_mult': 0.1402252889375981, 'bear_time_stop': 56, 'bear_use_sma': False, 'bear_use_ema': False, 'bear_use_atr': True, 'bear_use_adx': False, 'bear_use_spike': True, 'bear_rsi_required': True, 'sideways_strategy': 'breakout', 'sideways_bb_std_mult': 0.5393114763921791, 'sideways_rsi_os': 51, 'sideways_rsi_ob': 76, 'sideways_adx_thresh': 12.99815759229014, 'sideways_atr_min_pct': 0.003913895143379385, 'sideways_atr_max_pct': 0.026271050367019683, 'sideways_tp_mult': 2.237164988621335, 'sideways_tsl_mult': 0.4560132464887945, 'sideways_time_stop': 245, 'sideways_use_sma': True, 'sideways_use_ema': False, 'sideways_use_atr': False, 'sideways_use_adx': False, 'sideways_use_spike': True, 'sideways_rsi_required': False}.
[I 2025-08-31 10:30:32,801] Trial 317 finished with values: [-0.021212862743518635, 0.02194064540971478] and parameters: {'p_sma': 19, 'p_std': 32, 'p_atr': 19, 'p_adx': 7, 'rsi_period': 42, 'ema1': 19, 'ema2': 34, 'slip_atr_k': 0.04607951857231614, 'slip_spread_k': 0.30960896112192193, 'spread_hl_frac': 0.031024283188816674, 'bb_std_mult': 1.4376271596960382, 'rsi_os': 23, 'rsi_ob': 68, 'vol_spike': 0.08934180163806751, 'adx_thresh': 10.621966142371559, 'atr_min_pct': 0.0018805329644282411, 'atr_max_pct': 0.04159278128978693, 'tp_mult': 2.823242063627598, 'tsl_mult': 0.7456924053759241, 'strategy': 'mean_reversion', 'time_stop': 199, 'use_sma': False, 'use_atr': False, 'use_adx': True, 'use_ema': False, 'use_spike': True, 'rsi_required': True, 'edge_k': 1.7418068255278731, 'edge_cap': 0.1553120280789992, 'bull_strategy': 'breakout', 'bull_bb_std_mult': 1.6361258240669418, 'bull_rsi_os': 45, 'bull_rsi_ob': 75, 'bull_adx_thresh': 11.228819589724587, 'bull_atr_min_pct': 0.0013385725500460076, 'bull_atr_max_pct': 0.1295490512574604, 'bull_tp_mult': 2.1383789555341606, 'bull_tsl_mult': 0.5067039015546677, 'bull_time_stop': 28, 'bull_use_sma': True, 'bull_use_ema': True, 'bull_use_atr': True, 'bull_use_adx': True, 'bull_use_spike': True, 'bull_rsi_required': False, 'bear_strategy': 'mean_reversion', 'bear_bb_std_mult': 1.3579120398948645, 'bear_rsi_os': 31, 'bear_rsi_ob': 93, 'bear_adx_thresh': 8.501355043494598, 'bear_atr_min_pct': 0.0008808718130452683, 'bear_atr_max_pct': 0.102483800536468, 'bear_tp_mult': 1.2038798761127274, 'bear_tsl_mult': 0.00023198906532689856, 'bear_time_stop': 81, 'bear_use_sma': False, 'bear_use_ema': False, 'bear_use_atr': True, 'bear_use_adx': False, 'bear_use_spike': True, 'bear_rsi_required': True, 'sideways_strategy': 'breakout', 'sideways_bb_std_mult': 2.530978320048906, 'sideways_rsi_os': 34, 'sideways_rsi_ob': 60, 'sideways_adx_thresh': 15.627415961352492, 'sideways_atr_min_pct': 0.003793771483313557, 'sideways_atr_max_pct': 0.016740926290480698, 'sideways_tp_mult': 2.5859748071355426, 'sideways_tsl_mult': 0.65149042935462, 'sideways_time_stop': 245, 'sideways_use_sma': True, 'sideways_use_ema': False, 'sideways_use_atr': True, 'sideways_use_adx': False, 'sideways_use_spike': True, 'sideways_rsi_required': False}.
[I 2025-08-31 10:30:33,536] Trial 320 finished with values: [-0.02272075870670709, 0.022674724695955783] and parameters: {'p_sma': 20, 'p_std': 35, 'p_atr': 16, 'p_adx': 8, 'rsi_period': 23, 'ema1': 12, 'ema2': 58, 'slip_atr_k': 0.06377966861778148, 'slip_spread_k': 0.5279342277930112, 'spread_hl_frac': 0.029935085253056905, 'bb_std_mult': 2.7767443286365276, 'rsi_os': 23, 'rsi_ob': 68, 'vol_spike': 0.20032221123638436, 'adx_thresh': 21.49890148101744, 'atr_min_pct': 0.018325209382345404, 'atr_max_pct': 0.04096836127181193, 'tp_mult': 2.8236358656114646, 'tsl_mult': 0.7299893116629675, 'strategy': 'mean_reversion', 'time_stop': 148, 'use_sma': False, 'use_atr': False, 'use_adx': True, 'use_ema': False, 'use_spike': True, 'rsi_required': True, 'edge_k': 1.2638681650470265, 'edge_cap': 0.16716168724362682, 'bull_strategy': 'breakout', 'bull_bb_std_mult': 3.211070910690311, 'bull_rsi_os': 45, 'bull_rsi_ob': 83, 'bull_adx_thresh': 17.28434734105731, 'bull_atr_min_pct': 0.0013003706945556256, 'bull_atr_max_pct': 0.07947270112667933, 'bull_tp_mult': 1.9273727285760098, 'bull_tsl_mult': 0.7532419057708406, 'bull_time_stop': 12, 'bull_use_sma': True, 'bull_use_ema': True, 'bull_use_atr': True, 'bull_use_adx': True, 'bull_use_spike': True, 'bull_rsi_required': False, 'bear_strategy': 'breakout', 'bear_bb_std_mult': 2.0921257706151866, 'bear_rsi_os': 44, 'bear_rsi_ob': 56, 'bear_adx_thresh': 8.514276206436573, 'bear_atr_min_pct': 0.01356624491566956, 'bear_atr_max_pct': 0.12142162105311874, 'bear_tp_mult': 2.9226727002638584, 'bear_tsl_mult': 0.9974735148782472, 'bear_time_stop': 51, 'bear_use_sma': False, 'bear_use_ema': False, 'bear_use_atr': True, 'bear_use_adx': False, 'bear_use_spike': True, 'bear_rsi_required': True, 'sideways_strategy': 'breakout', 'sideways_bb_std_mult': 2.554248706688081, 'sideways_rsi_os': 35, 'sideways_rsi_ob': 84, 'sideways_adx_thresh': 16.563197738811823, 'sideways_atr_min_pct': 0.015536393447999928, 'sideways_atr_max_pct': 0.08424891454148681, 'sideways_tp_mult': 2.0432290224198564, 'sideways_tsl_mult': 0.4484437921304062, 'sideways_time_stop': 80, 'sideways_use_sma': True, 'sideways_use_ema': False, 'sideways_use_atr': False, 'sideways_use_adx': False, 'sideways_use_spike': True, 'sideways_rsi_required': False}.
[I 2025-08-31 10:31:05,710] Trial 321 finished with values: [-1000000000.0, 1000000000.0] and parameters: {'p_sma': 25, 'p_std': 34, 'p_atr': 17, 'p_adx': 8, 'rsi_period': 42, 'ema1': 12, 'ema2': 56, 'slip_atr_k': 0.0648478802230006, 'slip_spread_k': 0.9801717481435919, 'spread_hl_frac': 0.008813879161245444, 'bb_std_mult': 2.4687012138854714, 'rsi_os': 41, 'rsi_ob': 88, 'vol_spike': 0.08830941743483793, 'adx_thresh': 9.334151858091868, 'atr_min_pct': 0.01871119385789174, 'atr_max_pct': 0.045079764819844874, 'tp_mult': 2.9468011295919307, 'tsl_mult': 0.7361813399176109, 'strategy': 'mean_reversion', 'time_stop': 243, 'use_sma': False, 'use_atr': False, 'use_adx': True, 'use_ema': False, 'use_spike': True, 'rsi_required': True, 'edge_k': 0.7110710733736508, 'edge_cap': 0.3323730185804496, 'bull_strategy': 'breakout', 'bull_bb_std_mult': 0.9232647810269197, 'bull_rsi_os': 30, 'bull_rsi_ob': 46, 'bull_adx_thresh': 16.762890609772818, 'bull_atr_min_pct': 0.021924340361519436, 'bull_atr_max_pct': 0.09924561179975465, 'bull_tp_mult': 1.491414138821326, 'bull_tsl_mult': 0.6519216896714055, 'bull_time_stop': 31, 'bull_use_sma': True, 'bull_use_ema': True, 'bull_use_atr': True, 'bull_use_adx': True, 'bull_use_spike': True, 'bull_rsi_required': False, 'bear_strategy': 'breakout', 'bear_bb_std_mult': 2.2511258459914236, 'bear_rsi_os': 31, 'bear_rsi_ob': 59, 'bear_adx_thresh': 8.41425086036507, 'bear_atr_min_pct': 0.016218916754720314, 'bear_atr_max_pct': 0.12286323334671168, 'bear_tp_mult': 2.3626628111538404, 'bear_tsl_mult': 0.7665112135089196, 'bear_time_stop': 82, 'bear_use_sma': False, 'bear_use_ema': True, 'bear_use_atr': True, 'bear_use_adx': False, 'bear_use_spike': True, 'bear_rsi_required': True, 'sideways_strategy': 'breakout', 'sideways_bb_std_mult': 0.6102470810457252, 'sideways_rsi_os': 51, 'sideways_rsi_ob': 84, 'sideways_adx_thresh': 26.111357400913136, 'sideways_atr_min_pct': 0.0018124778537393714, 'sideways_atr_max_pct': 0.08367817693102922, 'sideways_tp_mult': 2.557689037551839, 'sideways_tsl_mult': 0.8254495496024954, 'sideways_time_stop': 134, 'sideways_use_sma': True, 'sideways_use_ema': False, 'sideways_use_atr': False, 'sideways_use_adx': False, 'sideways_use_spike': True, 'sideways_rsi_required': False}.
[I 2025-08-31 10:31:06,418] Trial 322 finished with values: [-0.12510754654667866, 0.1251184370806696] and parameters: {'p_sma': 32, 'p_std': 35, 'p_atr': 19, 'p_adx': 13, 'rsi_period': 21, 'ema1': 12, 'ema2': 26, 'slip_atr_k': 0.07761270903677947, 'slip_spread_k': 0.7535201884576386, 'spread_hl_frac': 0.026570259018439225, 'bb_std_mult': 2.9123003886194465, 'rsi_os': 19, 'rsi_ob': 68, 'vol_spike': 0.2002771232148576, 'adx_thresh': 19.44019620856487, 'atr_min_pct': 0.01868814149210092, 'atr_max_pct': 0.04551561575917581, 'tp_mult': 2.7056996971600578, 'tsl_mult': 0.7086333263573864, 'strategy': 'mean_reversion', 'time_stop': 282, 'use_sma': False, 'use_atr': False, 'use_adx': False, 'use_ema': False, 'use_spike': True, 'rsi_required': False, 'edge_k': 1.828581652178346, 'edge_cap': 0.8745950121152275, 'bull_strategy': 'breakout', 'bull_bb_std_mult': 1.2009370509722586, 'bull_rsi_os': 45, 'bull_rsi_ob': 52, 'bull_adx_thresh': 12.208687371882993, 'bull_atr_min_pct': 0.019097307456289417, 'bull_atr_max_pct': 0.10892854428128264, 'bull_tp_mult': 1.918603051835128, 'bull_tsl_mult': 0.7365034277631276, 'bull_time_stop': 251, 'bull_use_sma': True, 'bull_use_ema': True, 'bull_use_atr': True, 'bull_use_adx': True, 'bull_use_spike': False, 'bull_rsi_required': False, 'bear_strategy': 'breakout', 'bear_bb_std_mult': 2.2498041911162843, 'bear_rsi_os': 29, 'bear_rsi_ob': 59, 'bear_adx_thresh': 10.932459389117204, 'bear_atr_min_pct': 0.024550613414416993, 'bear_atr_max_pct': 0.12073583075317597, 'bear_tp_mult': 2.603408678526198, 'bear_tsl_mult': 0.678280107685021, 'bear_time_stop': 66, 'bear_use_sma': False, 'bear_use_ema': True, 'bear_use_atr': True, 'bear_use_adx': False, 'bear_use_spike': True, 'bear_rsi_required': True, 'sideways_strategy': 'mean_reversion', 'sideways_bb_std_mult': 1.9250021236517254, 'sideways_rsi_os': 37, 'sideways_rsi_ob': 82, 'sideways_adx_thresh': 15.688236859796783, 'sideways_atr_min_pct': 0.0011298465351014613, 'sideways_atr_max_pct': 0.010281823862556893, 'sideways_tp_mult': 1.254930241659148, 'sideways_tsl_mult': 0.8746965042133827, 'sideways_time_stop': 278, 'sideways_use_sma': True, 'sideways_use_ema': False, 'sideways_use_atr': False, 'sideways_use_adx': False, 'sideways_use_spike': True, 'sideways_rsi_required': False}.
[I 2025-08-31 10:31:06,569] Trial 323 finished with values: [-0.09234474004761672, 0.09230032608238559] and parameters: {'p_sma': 22, 'p_std': 36, 'p_atr': 7, 'p_adx': 9, 'rsi_period': 21, 'ema1': 12, 'ema2': 56, 'slip_atr_k': 0.0734551383843709, 'slip_spread_k': 0.5237842857053956, 'spread_hl_frac': 0.014508630564893765, 'bb_std_mult': 1.1058929836720703, 'rsi_os': 30, 'rsi_ob': 81, 'vol_spike': 0.19920833377592487, 'adx_thresh': 9.038918688996917, 'atr_min_pct': 0.01760744217195417, 'atr_max_pct': 0.04503157453838148, 'tp_mult': 2.7119191078731815, 'tsl_mult': 0.031560929932764215, 'strategy': 'mean_reversion', 'time_stop': 239, 'use_sma': False, 'use_atr': False, 'use_adx': False, 'use_ema': False, 'use_spike': True, 'rsi_required': False, 'edge_k': 1.3849237679858386, 'edge_cap': 0.13442590902848253, 'bull_strategy': 'breakout', 'bull_bb_std_mult': 1.1961500142116934, 'bull_rsi_os': 42, 'bull_rsi_ob': 77, 'bull_adx_thresh': 12.156806478334175, 'bull_atr_min_pct': 0.022052939260921813, 'bull_atr_max_pct': 0.09814587966428442, 'bull_tp_mult': 1.4705629103605617, 'bull_tsl_mult': 0.7386260671083194, 'bull_time_stop': 11, 'bull_use_sma': True, 'bull_use_ema': True, 'bull_use_atr': True, 'bull_use_adx': True, 'bull_use_spike': False, 'bull_rsi_required': False, 'bear_strategy': 'breakout', 'bear_bb_std_mult': 0.5607544431355833, 'bear_rsi_os': 29, 'bear_rsi_ob': 62, 'bear_adx_thresh': 7.361877447884023, 'bear_atr_min_pct': 0.0070282226886398715, 'bear_atr_max_pct': 0.12063656196389817, 'bear_tp_mult': 2.6091846118489213, 'bear_tsl_mult': 0.1282530110177493, 'bear_time_stop': 26, 'bear_use_sma': False, 'bear_use_ema': True, 'bear_use_atr': True, 'bear_use_adx': False, 'bear_use_spike': True, 'bear_rsi_required': True, 'sideways_strategy': 'mean_reversion', 'sideways_bb_std_mult': 2.482446014404436, 'sideways_rsi_os': 37, 'sideways_rsi_ob': 92, 'sideways_adx_thresh': 14.632575840382708, 'sideways_atr_min_pct': 0.0016819986160412613, 'sideways_atr_max_pct': 0.010256055438394432, 'sideways_tp_mult': 2.0106385652098653, 'sideways_tsl_mult': 0.8699466261224003, 'sideways_time_stop': 283, 'sideways_use_sma': True, 'sideways_use_ema': False, 'sideways_use_atr': False, 'sideways_use_adx': False, 'sideways_use_spike': True, 'sideways_rsi_required': False}.
