[I 2025-08-31 09:59:17,955] Trial 63 finished with values: [-1000000000.0, 1000000000.0] and parameters: {'p_sma': 52, 'p_std': 31, 'p_atr': 26, 'p_adx': 7, 'rsi_period': 84, 'ema1': 27, 'ema2': 29, 'slip_atr_k': 0.1932471103725471, 'slip_spread_k': 0.040186944760373544, 'spread_hl_frac': 0.007878940010160946, 'bb_std_mult': 3.1128584535624544, 'rsi_os': 51, 'rsi_ob': 57, 'vol_spike': 0.28197959110631365, 'adx_thresh': 32.37166720889435, 'atr_min_pct': 0.02564340992735766, 'atr_max_pct': 0.09572380225290043, 'tp_mult': 1.2944339418196333, 'tsl_mult': 0.6356500668841634, 'strategy': 'breakout', 'time_stop': 143, 'use_sma': True, 'use_atr': False, 'use_adx': True, 'use_ema': False, 'use_spike': False, 'rsi_required': True, 'edge_k': 1.0416239905296887, 'edge_cap': 0.857660197483661, 'bull_strategy': 'mean_reversion', 'bull_bb_std_mult': 2.5984389935052543, 'bull_rsi_os': 39, 'bull_rsi_ob': 88, 'bull_adx_thresh': 10.268253421128152, 'bull_atr_min_pct': 0.007517671626775485, 'bull_atr_max_pct': 0.019676421821137133, 'bull_tp_mult': 2.3851099770060733, 'bull_tsl_mult': 0.8428738258803754, 'bull_time_stop': 27, 'bull_use_sma': True, 'bull_use_ema': False, 'bull_use_atr': False, 'bull_use_adx': False, 'bull_use_spike': True, 'bull_rsi_required': True, 'bear_strategy': 'breakout', 'bear_bb_std_mult': 3.4094385670755463, 'bear_rsi_os': 5, 'bear_rsi_ob': 82, 'bear_adx_thresh': 7.352762200945652, 'bear_atr_min_pct': 0.02550253903378642, 'bear_atr_max_pct': 0.08168082234527325, 'bear_tp_mult': 2.066608627941591, 'bear_tsl_mult': 0.3598651544149809, 'bear_time_stop': 170, 'bear_use_sma': False, 'bear_use_ema': False, 'bear_use_atr': True, 'bear_use_adx': False, 'bear_use_spike': True, 'bear_rsi_required': False, 'sideways_strategy': 'breakout', 'sideways_bb_std_mult': 1.6775421543391187, 'sideways_rsi_os': 41, 'sideways_rsi_ob': 47, 'sideways_adx_thresh': 34.66974605736286, 'sideways_atr_min_pct': 0.01983874749499048, 'sideways_atr_max_pct': 0.09049831703273543, 'sideways_tp_mult': 1.6321707380907546, 'sideways_tsl_mult': 0.5943292760309314, 'sideways_time_stop': 251, 'sideways_use_sma': False, 'sideways_use_ema': False, 'sideways_use_atr': True, 'sideways_use_adx': False, 'sideways_use_spike': True, 'sideways_rsi_required': False}.
[I 2025-08-31 09:59:50,147] Trial 64 finished with values: [-1000000000.0, 1000000000.0] and parameters: {'p_sma': 14, 'p_std': 23, 'p_atr': 29, 'p_adx': 15, 'rsi_period': 84, 'ema1': 27, 'ema2': 21, 'slip_atr_k': 0.23492076166337117, 'slip_spread_k': 0.4725582197804241, 'spread_hl_frac': 0.019177328873594097, 'bb_std_mult': 3.3142283126550174, 'rsi_os': 15, 'rsi_ob': 81, 'vol_spike': 0.2988217400590948, 'adx_thresh': 10.466031871703274, 'atr_min_pct': 0.027865279695319836, 'atr_max_pct': 0.1441607686961077, 'tp_mult': 1.2706704087880487, 'tsl_mult': 0.03225338512102094, 'strategy': 'breakout', 'time_stop': 259, 'use_sma': True, 'use_atr': False, 'use_adx': True, 'use_ema': False, 'use_spike': False, 'rsi_required': True, 'edge_k': 1.1966108023847941, 'edge_cap': 0.860577350585071, 'bull_strategy': 'mean_reversion', 'bull_bb_std_mult': 2.8140044317632755, 'bull_rsi_os': 9, 'bull_rsi_ob': 88, 'bull_adx_thresh': 31.37110686262925, 'bull_atr_min_pct': 0.01076696363873402, 'bull_atr_max_pct': 0.14307853582454366, 'bull_tp_mult': 1.7174187606971545, 'bull_tsl_mult': 0.8749644320121621, 'bull_time_stop': 45, 'bull_use_sma': True, 'bull_use_ema': False, 'bull_use_atr': False, 'bull_use_adx': False, 'bull_use_spike': True, 'bull_rsi_required': True, 'bear_strategy': 'breakout', 'bear_bb_std_mult': 3.423976193974834, 'bear_rsi_os': 5, 'bear_rsi_ob': 47, 'bear_adx_thresh': 6.814815249664766, 'bear_atr_min_pct': 0.025460496728400568, 'bear_atr_max_pct': 0.07285117346638123, 'bear_tp_mult': 2.0461806096074078, 'bear_tsl_mult': 0.3456127031594974, 'bear_time_stop': 135, 'bear_use_sma': False, 'bear_use_ema': False, 'bear_use_atr': False, 'bear_use_adx': False, 'bear_use_spike': False, 'bear_rsi_required': False, 'sideways_strategy': 'breakout', 'sideways_bb_std_mult': 1.976298262871867, 'sideways_rsi_os': 11, 'sideways_rsi_ob': 47, 'sideways_adx_thresh': 10.536902641934407, 'sideways_atr_min_pct': 0.01974803629348163, 'sideways_atr_max_pct': 0.04496119794120376, 'sideways_tp_mult': 1.6361426616639612, 'sideways_tsl_mult': 0.2078805521587912, 'sideways_time_stop': 275, 'sideways_use_sma': False, 'sideways_use_ema': True, 'sideways_use_atr': False, 'sideways_use_adx': False, 'sideways_use_spike': True, 'sideways_rsi_required': False}.
[I 2025-08-31 09:59:50,326] Trial 66 finished with values: [-0.022623136637332064, 0.022489525166410822] and parameters: {'p_sma': 14, 'p_std': 21, 'p_atr': 13, 'p_adx': 15, 'rsi_period': 84, 'ema1': 27, 'ema2': 54, 'slip_atr_k': 0.2370980770201424, 'slip_spread_k': 0.45618128098171623, 'spread_hl_frac': 0.007350305759122607, 'bb_std_mult': 3.3460432680225174, 'rsi_os': 20, 'rsi_ob': 57, 'vol_spike': 0.29967611086415596, 'adx_thresh': 13.163653792511964, 'atr_min_pct': 0.028073102945767734, 'atr_max_pct': 0.14350549654391898, 'tp_mult': 1.295345986646792, 'tsl_mult': 0.02717018760980994, 'strategy': 'breakout', 'time_stop': 266, 'use_sma': True, 'use_atr': False, 'use_adx': False, 'use_ema': False, 'use_spike': False, 'rsi_required': False, 'edge_k': 1.5162841480452116, 'edge_cap': 0.8523572846017407, 'bull_strategy': 'mean_reversion', 'bull_bb_std_mult': 1.327646704827051, 'bull_rsi_os': 35, 'bull_rsi_ob': 93, 'bull_adx_thresh': 31.500950851114037, 'bull_atr_min_pct': 0.0010420184892456909, 'bull_atr_max_pct': 0.018089470598667143, 'bull_tp_mult': 2.2416604435531395, 'bull_tsl_mult': 0.8777689609203401, 'bull_time_stop': 47, 'bull_use_sma': True, 'bull_use_ema': False, 'bull_use_atr': False, 'bull_use_adx': False, 'bull_use_spike': True, 'bull_rsi_required': True, 'bear_strategy': 'breakout', 'bear_bb_std_mult': 2.437075943672065, 'bear_rsi_os': 5, 'bear_rsi_ob': 77, 'bear_adx_thresh': 6.176475924273491, 'bear_atr_min_pct': 0.02984643730153111, 'bear_atr_max_pct': 0.019104827979853127, 'bear_tp_mult': 2.0411389125610597, 'bear_tsl_mult': 0.32957516134232107, 'bear_time_stop': 139, 'bear_use_sma': False, 'bear_use_ema': True, 'bear_use_atr': False, 'bear_use_adx': False, 'bear_use_spike': False, 'bear_rsi_required': False, 'sideways_strategy': 'mean_reversion', 'sideways_bb_std_mult': 2.740442364603697, 'sideways_rsi_os': 42, 'sideways_rsi_ob': 56, 'sideways_adx_thresh': 7.498159237710841, 'sideways_atr_min_pct': 0.0072501773990716984, 'sideways_atr_max_pct': 0.03567663411976897, 'sideways_tp_mult': 2.713857498567194, 'sideways_tsl_mult': 0.6773243804697968, 'sideways_time_stop': 77, 'sideways_use_sma': False, 'sideways_use_ema': True, 'sideways_use_atr': False, 'sideways_use_adx': False, 'sideways_use_spike': True, 'sideways_rsi_required': False}.
[I 2025-08-31 09:59:50,433] Trial 67 finished with values: [-1000000000.0, 1000000000.0] and parameters: {'p_sma': 16, 'p_std': 22, 'p_atr': 29, 'p_adx': 15, 'rsi_period': 84, 'ema1': 30, 'ema2': 22, 'slip_atr_k': 0.23682294497141784, 'slip_spread_k': 0.5033454030524688, 'spread_hl_frac': 0.01986518728238366, 'bb_std_mult': 3.3248212046857155, 'rsi_os': 22, 'rsi_ob': 88, 'vol_spike': 0.23364701951291503, 'adx_thresh': 25.335919064422065, 'atr_min_pct': 0.028218184954538265, 'atr_max_pct': 0.14393723291247457, 'tp_mult': 1.2579753310018165, 'tsl_mult': 0.3543075923218765, 'strategy': 'breakout', 'time_stop': 263, 'use_sma': True, 'use_atr': False, 'use_adx': False, 'use_ema': False, 'use_spike': False, 'rsi_required': False, 'edge_k': 1.3576891847155725, 'edge_cap': 0.39620047801669434, 'bull_strategy': 'mean_reversion', 'bull_bb_std_mult': 1.2233787460759569, 'bull_rsi_os': 35, 'bull_rsi_ob': 70, 'bull_adx_thresh': 31.337955741460355, 'bull_atr_min_pct': 0.00874531843048512, 'bull_atr_max_pct': 0.029463568288013033, 'bull_tp_mult': 2.2472395195858788, 'bull_tsl_mult': 0.6474110089668034, 'bull_time_stop': 52, 'bull_use_sma': False, 'bull_use_ema': True, 'bull_use_atr': False, 'bull_use_adx': False, 'bull_use_spike': False, 'bull_rsi_required': False, 'bear_strategy': 'breakout', 'bear_bb_std_mult': 2.4573122325909313, 'bear_rsi_os': 43, 'bear_rsi_ob': 47, 'bear_adx_thresh': 5.87754499004123, 'bear_atr_min_pct': 0.028641117627330234, 'bear_atr_max_pct': 0.07766887374937374, 'bear_tp_mult': 2.030898412731136, 'bear_tsl_mult': 0.3175190833590935, 'bear_time_stop': 134, 'bear_use_sma': False, 'bear_use_ema': True, 'bear_use_atr': False, 'bear_use_adx': False, 'bear_use_spike': False, 'bear_rsi_required': False, 'sideways_strategy': 'mean_reversion', 'sideways_bb_std_mult': 2.7407871212613104, 'sideways_rsi_os': 13, 'sideways_rsi_ob': 80, 'sideways_adx_thresh': 25.726254213580724, 'sideways_atr_min_pct': 0.007823197769051788, 'sideways_atr_max_pct': 0.04302064157763126, 'sideways_tp_mult': 2.7025014478359695, 'sideways_tsl_mult': 0.671792406194772, 'sideways_time_stop': 73, 'sideways_use_sma': False, 'sideways_use_ema': True, 'sideways_use_atr': False, 'sideways_use_adx': False, 'sideways_use_spike': True, 'sideways_rsi_required': False}.
[I 2025-08-31 09:59:50,518] Trial 65 finished with values: [-1000000000.0, 1000000000.0] and parameters: {'p_sma': 14, 'p_std': 21, 'p_atr': 13, 'p_adx': 15, 'rsi_period': 84, 'ema1': 27, 'ema2': 41, 'slip_atr_k': 0.23740281301492325, 'slip_spread_k': 0.4346068300213083, 'spread_hl_frac': 0.0073973031667628935, 'bb_std_mult': 3.3652801223515065, 'rsi_os': 15, 'rsi_ob': 58, 'vol_spike': 0.296773619677602, 'adx_thresh': 10.540043433331077, 'atr_min_pct': 0.027845846339601438, 'atr_max_pct': 0.14183844357894837, 'tp_mult': 1.2755972559574442, 'tsl_mult': 0.3687599127664084, 'strategy': 'breakout', 'time_stop': 261, 'use_sma': True, 'use_atr': False, 'use_adx': True, 'use_ema': False, 'use_spike': False, 'rsi_required': True, 'edge_k': 1.3621174871591888, 'edge_cap': 0.856724651522905, 'bull_strategy': 'mean_reversion', 'bull_bb_std_mult': 3.5844156222262553, 'bull_rsi_os': 17, 'bull_rsi_ob': 70, 'bull_adx_thresh': 31.385958430031913, 'bull_atr_min_pct': 0.007862447402161896, 'bull_atr_max_pct': 0.018518124978747955, 'bull_tp_mult': 2.2639423312739986, 'bull_tsl_mult': 0.8784387319734606, 'bull_time_stop': 42, 'bull_use_sma': True, 'bull_use_ema': False, 'bull_use_atr': False, 'bull_use_adx': False, 'bull_use_spike': True, 'bull_rsi_required': True, 'bear_strategy': 'breakout', 'bear_bb_std_mult': 3.0279302037059432, 'bear_rsi_os': 44, 'bear_rsi_ob': 78, 'bear_adx_thresh': 6.914153788383861, 'bear_atr_min_pct': 0.028853908419139755, 'bear_atr_max_pct': 0.020885059003363744, 'bear_tp_mult': 2.780014617315728, 'bear_tsl_mult': 0.3283155815636567, 'bear_time_stop': 134, 'bear_use_sma': False, 'bear_use_ema': True, 'bear_use_atr': False, 'bear_use_adx': False, 'bear_use_spike': False, 'bear_rsi_required': False, 'sideways_strategy': 'breakout', 'sideways_bb_std_mult': 2.943829025029182, 'sideways_rsi_os': 41, 'sideways_rsi_ob': 79, 'sideways_adx_thresh': 6.987576160731431, 'sideways_atr_min_pct': 0.007143517805025472, 'sideways_atr_max_pct': 0.04500621732477163, 'sideways_tp_mult': 2.537707401016959, 'sideways_tsl_mult': 0.6722060554730761, 'sideways_time_stop': 275, 'sideways_use_sma': False, 'sideways_use_ema': True, 'sideways_use_atr': False, 'sideways_use_adx': False, 'sideways_use_spike': True, 'sideways_rsi_required': False}.
[I 2025-08-31 10:00:23,002] Trial 71 finished with values: [-1000000000.0, 1000000000.0] and parameters: {'p_sma': 7, 'p_std': 27, 'p_atr': 18, 'p_adx': 25, 'rsi_period': 26, 'ema1': 25, 'ema2': 37, 'slip_atr_k': 0.20936723119780057, 'slip_spread_k': 0.7010536073429452, 'spread_hl_frac': 0.03366571146878984, 'bb_std_mult': 3.536809704877843, 'rsi_os': 19, 'rsi_ob': 91, 'vol_spike': 0.25695719464685657, 'adx_thresh': 13.744878376222264, 'atr_min_pct': 0.012847172586917997, 'atr_max_pct': 0.12806405570883492, 'tp_mult': 1.565709503315731, 'tsl_mult': 0.775883150610984, 'strategy': 'breakout', 'time_stop': 245, 'use_sma': True, 'use_atr': False, 'use_adx': True, 'use_ema': True, 'use_spike': False, 'rsi_required': False, 'edge_k': 1.6116633650902537, 'edge_cap': 0.9986380915003256, 'bull_strategy': 'mean_reversion', 'bull_bb_std_mult': 3.4485408716325026, 'bull_rsi_os': 44, 'bull_rsi_ob': 93, 'bull_adx_thresh': 34.97940841867216, 'bull_atr_min_pct': 0.02057791766696513, 'bull_atr_max_pct': 0.01557995465245693, 'bull_tp_mult': 2.931978974767955, 'bull_tsl_mult': 0.9984105624736592, 'bull_time_stop': 233, 'bull_use_sma': False, 'bull_use_ema': True, 'bull_use_atr': True, 'bull_use_adx': False, 'bull_use_spike': False, 'bull_rsi_required': False, 'bear_strategy': 'breakout', 'bear_bb_std_mult': 2.799292679384621, 'bear_rsi_os': 54, 'bear_rsi_ob': 54, 'bear_adx_thresh': 5.008011519628308, 'bear_atr_min_pct': 0.029793278399152467, 'bear_atr_max_pct': 0.06201666161501505, 'bear_tp_mult': 2.240695403746857, 'bear_tsl_mult': 0.6625373661428118, 'bear_time_stop': 114, 'bear_use_sma': True, 'bear_use_ema': False, 'bear_use_atr': True, 'bear_use_adx': False, 'bear_use_spike': False, 'bear_rsi_required': False, 'sideways_strategy': 'mean_reversion', 'sideways_bb_std_mult': 2.360471079312765, 'sideways_rsi_os': 52, 'sideways_rsi_ob': 51, 'sideways_adx_thresh': 27.610461001649632, 'sideways_atr_min_pct': 0.015200647956576982, 'sideways_atr_max_pct': 0.035066216110520854, 'sideways_tp_mult': 1.83336343688645, 'sideways_tsl_mult': 0.6354060244311026, 'sideways_time_stop': 145, 'sideways_use_sma': False, 'sideways_use_ema': True, 'sideways_use_atr': False, 'sideways_use_adx': True, 'sideways_use_spike': False, 'sideways_rsi_required': True}.
[I 2025-08-31 10:00:23,499] Trial 68 finished with values: [-1000000000.0, 1000000000.0] and parameters: {'p_sma': 7, 'p_std': 35, 'p_atr': 23, 'p_adx': 28, 'rsi_period': 58, 'ema1': 30, 'ema2': 56, 'slip_atr_k': 0.20799361553603823, 'slip_spread_k': 0.8683226306574465, 'spread_hl_frac': 0.03602722992213204, 'bb_std_mult': 3.508420207622173, 'rsi_os': 22, 'rsi_ob': 88, 'vol_spike': 0.2747609364653893, 'adx_thresh': 25.143763530410013, 'atr_min_pct': 0.012613579324142692, 'atr_max_pct': 0.14216056741743008, 'tp_mult': 2.8129434483284, 'tsl_mult': 0.7839961568637641, 'strategy': 'breakout', 'time_stop': 163, 'use_sma': True, 'use_atr': False, 'use_adx': False, 'use_ema': False, 'use_spike': False, 'rsi_required': False, 'edge_k': 0.8829884861378409, 'edge_cap': 0.39430565649745875, 'bull_strategy': 'mean_reversion', 'bull_bb_std_mult': 1.2561757040095647, 'bull_rsi_os': 34, 'bull_rsi_ob': 93, 'bull_adx_thresh': 29.842470364599585, 'bull_atr_min_pct': 0.0012923028993060655, 'bull_atr_max_pct': 0.09297775011783127, 'bull_tp_mult': 2.927325212429767, 'bull_tsl_mult': 0.7884740274666404, 'bull_time_stop': 48, 'bull_use_sma': False, 'bull_use_ema': True, 'bull_use_atr': False, 'bull_use_adx': False, 'bull_use_spike': False, 'bull_rsi_required': False, 'bear_strategy': 'breakout', 'bear_bb_std_mult': 2.4560126427092226, 'bear_rsi_os': 11, 'bear_rsi_ob': 47, 'bear_adx_thresh': 5.635679666694875, 'bear_atr_min_pct': 0.02895980256567776, 'bear_atr_max_pct': 0.0818875550941978, 'bear_tp_mult': 2.7843615382086013, 'bear_tsl_mult': 0.3071116573875966, 'bear_time_stop': 139, 'bear_use_sma': True, 'bear_use_ema': True, 'bear_use_atr': False, 'bear_use_adx': False, 'bear_use_spike': False, 'bear_rsi_required': False, 'sideways_strategy': 'mean_reversion', 'sideways_bb_std_mult': 2.7717847092706287, 'sideways_rsi_os': 13, 'sideways_rsi_ob': 51, 'sideways_adx_thresh': 16.845035951168434, 'sideways_atr_min_pct': 0.015078504872071626, 'sideways_atr_max_pct': 0.033727991009831954, 'sideways_tp_mult': 2.749521801298978, 'sideways_tsl_mult': 0.6689416537637694, 'sideways_time_stop': 146, 'sideways_use_sma': False, 'sideways_use_ema': True, 'sideways_use_atr': False, 'sideways_use_adx': True, 'sideways_use_spike': False, 'sideways_rsi_required': False}.
[I 2025-08-31 10:00:23,726] Trial 70 finished with values: [-0.008156699342422136, 0.007947933926185246] and parameters: {'p_sma': 7, 'p_std': 20, 'p_atr': 30, 'p_adx': 28, 'rsi_period': 58, 'ema1': 22, 'ema2': 10, 'slip_atr_k': 0.17192621462434104, 'slip_spread_k': 0.6987556899399741, 'spread_hl_frac': 0.035334467041064424, 'bb_std_mult': 3.5257715089545343, 'rsi_os': 19, 'rsi_ob': 58, 'vol_spike': 0.25495604145049944, 'adx_thresh': 19.159075527974693, 'atr_min_pct': 0.011854223946121987, 'atr_max_pct': 0.12608215260129355, 'tp_mult': 1.8424071945980731, 'tsl_mult': 0.7830404424716322, 'strategy': 'breakout', 'time_stop': 275, 'use_sma': True, 'use_atr': False, 'use_adx': True, 'use_ema': False, 'use_spike': False, 'rsi_required': False, 'edge_k': 1.501603764122416, 'edge_cap': 0.9979412347240912, 'bull_strategy': 'mean_reversion', 'bull_bb_std_mult': 0.8454945421676305, 'bull_rsi_os': 34, 'bull_rsi_ob': 93, 'bull_adx_thresh': 29.75638565631787, 'bull_atr_min_pct': 0.0011063575915194173, 'bull_atr_max_pct': 0.01806594517350968, 'bull_tp_mult': 1.0336165512241329, 'bull_tsl_mult': 0.79383262795294, 'bull_time_stop': 35, 'bull_use_sma': True, 'bull_use_ema': False, 'bull_use_atr': True, 'bull_use_adx': False, 'bull_use_spike': False, 'bull_rsi_required': True, 'bear_strategy': 'breakout', 'bear_bb_std_mult': 2.5965867774078544, 'bear_rsi_os': 53, 'bear_rsi_ob': 91, 'bear_adx_thresh': 20.712475632590298, 'bear_atr_min_pct': 0.029867318476838555, 'bear_atr_max_pct': 0.020183655724742004, 'bear_tp_mult': 2.7117882914383364, 'bear_tsl_mult': 0.6413434649320348, 'bear_time_stop': 113, 'bear_use_sma': True, 'bear_use_ema': False, 'bear_use_atr': True, 'bear_use_adx': False, 'bear_use_spike': False, 'bear_rsi_required': False, 'sideways_strategy': 'mean_reversion', 'sideways_bb_std_mult': 0.8749786599959071, 'sideways_rsi_os': 18, 'sideways_rsi_ob': 56, 'sideways_adx_thresh': 13.044924692790403, 'sideways_atr_min_pct': 0.015003336497634065, 'sideways_atr_max_pct': 0.035957698387261885, 'sideways_tp_mult': 2.0805852295446408, 'sideways_tsl_mult': 0.527141009227862, 'sideways_time_stop': 140, 'sideways_use_sma': False, 'sideways_use_ema': True, 'sideways_use_atr': False, 'sideways_use_adx': True, 'sideways_use_spike': False, 'sideways_rsi_required': True}.
[I 2025-08-31 10:00:23,739] Trial 69 finished with values: [-0.023438294966902862, 0.023363825708474884] and parameters: {'p_sma': 15, 'p_std': 21, 'p_atr': 30, 'p_adx': 17, 'rsi_period': 43, 'ema1': 21, 'ema2': 16, 'slip_atr_k': 0.20703081931467712, 'slip_spread_k': 0.7144927717528404, 'spread_hl_frac': 0.035991201919476454, 'bb_std_mult': 3.5097143599329694, 'rsi_os': 44, 'rsi_ob': 58, 'vol_spike': 0.2574988750040548, 'adx_thresh': 25.52632556444516, 'atr_min_pct': 0.0274821982547099, 'atr_max_pct': 0.1264284534439877, 'tp_mult': 2.3395870779324595, 'tsl_mult': 0.7855858887382193, 'strategy': 'breakout', 'time_stop': 166, 'use_sma': True, 'use_atr': False, 'use_adx': True, 'use_ema': False, 'use_spike': False, 'rsi_required': False, 'edge_k': 0.9054485063319545, 'edge_cap': 0.9951511605568089, 'bull_strategy': 'mean_reversion', 'bull_bb_std_mult': 3.4382932139172624, 'bull_rsi_os': 35, 'bull_rsi_ob': 93, 'bull_adx_thresh': 12.478379629905138, 'bull_atr_min_pct': 0.0014137019342480633, 'bull_atr_max_pct': 0.017228118130689606, 'bull_tp_mult': 2.7361966944014062, 'bull_tsl_mult': 0.7863291542606772, 'bull_time_stop': 49, 'bull_use_sma': False, 'bull_use_ema': True, 'bull_use_atr': False, 'bull_use_adx': False, 'bull_use_spike': False, 'bull_rsi_required': False, 'bear_strategy': 'breakout', 'bear_bb_std_mult': 2.4539857765983237, 'bear_rsi_os': 40, 'bear_rsi_ob': 76, 'bear_adx_thresh': 5.640801917974683, 'bear_atr_min_pct': 0.028976759193380667, 'bear_atr_max_pct': 0.03742439118135474, 'bear_tp_mult': 2.7702096039826443, 'bear_tsl_mult': 0.6796760596020416, 'bear_time_stop': 113, 'bear_use_sma': True, 'bear_use_ema': True, 'bear_use_atr': True, 'bear_use_adx': False, 'bear_use_spike': False, 'bear_rsi_required': False, 'sideways_strategy': 'mean_reversion', 'sideways_bb_std_mult': 2.715935347192515, 'sideways_rsi_os': 13, 'sideways_rsi_ob': 56, 'sideways_adx_thresh': 16.66462921942022, 'sideways_atr_min_pct': 0.015091550386403965, 'sideways_atr_max_pct': 0.03555913335170627, 'sideways_tp_mult': 2.0909067820184624, 'sideways_tsl_mult': 0.6601873945518478, 'sideways_time_stop': 146, 'sideways_use_sma': False, 'sideways_use_ema': True, 'sideways_use_atr': False, 'sideways_use_adx': True, 'sideways_use_spike': False, 'sideways_rsi_required': False}.
