[I 2025-08-31 11:10:33,992] Trial 629 finished with values: [-1000000000.0, 1000000000.0] and parameters: {'p_sma': 26, 'p_std': 10, 'p_atr': 27, 'p_adx': 21, 'rsi_period': 33, 'ema1': 5, 'ema2': 35, 'slip_atr_k': 0.01648353446748399, 'slip_spread_k': 0.4835909910933863, 'spread_hl_frac': 0.021478760662230215, 'bb_std_mult': 0.5823603863270418, 'rsi_os': 28, 'rsi_ob': 82, 'vol_spike': 0.12612224186523635, 'adx_thresh': 11.230513469308569, 'atr_min_pct': 0.022670769080968645, 'atr_max_pct': 0.06525396220116014, 'tp_mult': 2.9978995263320902, 'tsl_mult': 0.0741172405305973, 'strategy': 'breakout', 'time_stop': 98, 'use_sma': True, 'use_atr': True, 'use_adx': False, 'use_ema': True, 'use_spike': False, 'rsi_required': False, 'edge_k': 1.5082140265706003, 'edge_cap': 0.7265768842626105, 'bull_strategy': 'mean_reversion', 'bull_bb_std_mult': 1.652775675923652, 'bull_rsi_os': 41, 'bull_rsi_ob': 62, 'bull_adx_thresh': 25.047322294619125, 'bull_atr_min_pct': 0.013143230657078188, 'bull_atr_max_pct': 0.02787674088673306, 'bull_tp_mult': 2.9345251103830803, 'bull_tsl_mult': 0.25644324926634315, 'bull_time_stop': 181, 'bull_use_sma': False, 'bull_use_ema': False, 'bull_use_atr': False, 'bull_use_adx': False, 'bull_use_spike': False, 'bull_rsi_required': False, 'bear_strategy': 'mean_reversion', 'bear_bb_std_mult': 2.9912790735971244, 'bear_rsi_os': 53, 'bear_rsi_ob': 50, 'bear_adx_thresh': 29.030470928252285, 'bear_atr_min_pct': 0.011749457256413624, 'bear_atr_max_pct': 0.13866550462894522, 'bear_tp_mult': 1.2487550674149697, 'bear_tsl_mult': 0.8780715489748375, 'bear_time_stop': 105, 'bear_use_sma': False, 'bear_use_ema': False, 'bear_use_atr': False, 'bear_use_adx': False, 'bear_use_spike': False, 'bear_rsi_required': False, 'sideways_strategy': 'mean_reversion', 'sideways_bb_std_mult': 0.8328786972227233, 'sideways_rsi_os': 41, 'sideways_rsi_ob': 62, 'sideways_adx_thresh': 27.71593214008094, 'sideways_atr_min_pct': 0.021725011506167333, 'sideways_atr_max_pct': 0.10281397094085021, 'sideways_tp_mult': 1.420612772712944, 'sideways_tsl_mult': 0.19677592996968923, 'sideways_time_stop': 162, 'sideways_use_sma': True, 'sideways_use_ema': True, 'sideways_use_atr': True, 'sideways_use_adx': False, 'sideways_use_spike': True, 'sideways_rsi_required': True}.
[I 2025-08-31 11:10:34,128] Trial 632 finished with values: [-0.01831153102734584, 0.019370682263636037] and parameters: {'p_sma': 31, 'p_std': 11, 'p_atr': 27, 'p_adx': 21, 'rsi_period': 37, 'ema1': 5, 'ema2': 31, 'slip_atr_k': 0.022046183095424263, 'slip_spread_k': 0.49493955043797616, 'spread_hl_frac': 0.021741676343415662, 'bb_std_mult': 0.5996285735840496, 'rsi_os': 25, 'rsi_ob': 82, 'vol_spike': 0.11442663992583366, 'adx_thresh': 11.958798477230747, 'atr_min_pct': 0.021838316124447425, 'atr_max_pct': 0.06471070230236434, 'tp_mult': 2.8989611585071784, 'tsl_mult': 0.07796468752193676, 'strategy': 'breakout', 'time_stop': 88, 'use_sma': True, 'use_atr': True, 'use_adx': False, 'use_ema': True, 'use_spike': False, 'rsi_required': False, 'edge_k': 1.464663786579337, 'edge_cap': 0.7332349460381796, 'bull_strategy': 'mean_reversion', 'bull_bb_std_mult': 2.2738209269789786, 'bull_rsi_os': 43, 'bull_rsi_ob': 62, 'bull_adx_thresh': 25.371153292130675, 'bull_atr_min_pct': 0.013275183080703702, 'bull_atr_max_pct': 0.028468681670584677, 'bull_tp_mult': 2.89170921081074, 'bull_tsl_mult': 0.24291768077612302, 'bull_time_stop': 224, 'bull_use_sma': False, 'bull_use_ema': False, 'bull_use_atr': False, 'bull_use_adx': True, 'bull_use_spike': False, 'bull_rsi_required': False, 'bear_strategy': 'mean_reversion', 'bear_bb_std_mult': 1.6374565437546367, 'bear_rsi_os': 54, 'bear_rsi_ob': 51, 'bear_adx_thresh': 19.837197245134547, 'bear_atr_min_pct': 0.0036076128816157245, 'bear_atr_max_pct': 0.1358309028905602, 'bear_tp_mult': 2.6413659456740124, 'bear_tsl_mult': 0.8809461720067724, 'bear_time_stop': 97, 'bear_use_sma': True, 'bear_use_ema': False, 'bear_use_atr': True, 'bear_use_adx': False, 'bear_use_spike': True, 'bear_rsi_required': False, 'sideways_strategy': 'mean_reversion', 'sideways_bb_std_mult': 0.9545086948865469, 'sideways_rsi_os': 39, 'sideways_rsi_ob': 62, 'sideways_adx_thresh': 25.601494764279142, 'sideways_atr_min_pct': 0.021783258761390218, 'sideways_atr_max_pct': 0.11045747313993709, 'sideways_tp_mult': 1.4898603749777388, 'sideways_tsl_mult': 0.8904180267619753, 'sideways_time_stop': 168, 'sideways_use_sma': False, 'sideways_use_ema': True, 'sideways_use_atr': False, 'sideways_use_adx': True, 'sideways_use_spike': True, 'sideways_rsi_required': False}.
[I 2025-08-31 11:10:34,145] Trial 631 finished with values: [-0.07553240365965741, 0.07541147285197988] and parameters: {'p_sma': 35, 'p_std': 10, 'p_atr': 27, 'p_adx': 21, 'rsi_period': 36, 'ema1': 5, 'ema2': 24, 'slip_atr_k': 0.02268479682939839, 'slip_spread_k': 0.4840886689614464, 'spread_hl_frac': 0.020272801757604063, 'bb_std_mult': 0.6029311603328547, 'rsi_os': 26, 'rsi_ob': 83, 'vol_spike': 0.12029035170641442, 'adx_thresh': 11.885109884228887, 'atr_min_pct': 0.022030738390189174, 'atr_max_pct': 0.06453433651996875, 'tp_mult': 2.9984560346938935, 'tsl_mult': 0.07762390268578062, 'strategy': 'breakout', 'time_stop': 87, 'use_sma': True, 'use_atr': True, 'use_adx': False, 'use_ema': True, 'use_spike': False, 'rsi_required': False, 'edge_k': 1.5170642086090702, 'edge_cap': 0.7698335935431934, 'bull_strategy': 'mean_reversion', 'bull_bb_std_mult': 1.6198919352360244, 'bull_rsi_os': 43, 'bull_rsi_ob': 62, 'bull_adx_thresh': 25.431600461095872, 'bull_atr_min_pct': 0.011835777553250576, 'bull_atr_max_pct': 0.11585558736253482, 'bull_tp_mult': 2.944489306179953, 'bull_tsl_mult': 0.25015648798990064, 'bull_time_stop': 102, 'bull_use_sma': False, 'bull_use_ema': False, 'bull_use_atr': False, 'bull_use_adx': True, 'bull_use_spike': False, 'bull_rsi_required': False, 'bear_strategy': 'mean_reversion', 'bear_bb_std_mult': 1.6245986984463574, 'bear_rsi_os': 52, 'bear_rsi_ob': 52, 'bear_adx_thresh': 26.11721676270833, 'bear_atr_min_pct': 0.0013491921547472644, 'bear_atr_max_pct': 0.04401449608884181, 'bear_tp_mult': 2.4298098852388317, 'bear_tsl_mult': 0.9207730279239479, 'bear_time_stop': 102, 'bear_use_sma': False, 'bear_use_ema': False, 'bear_use_atr': True, 'bear_use_adx': False, 'bear_use_spike': True, 'bear_rsi_required': False, 'sideways_strategy': 'mean_reversion', 'sideways_bb_std_mult': 0.9455337571548407, 'sideways_rsi_os': 44, 'sideways_rsi_ob': 62, 'sideways_adx_thresh': 26.113943496121596, 'sideways_atr_min_pct': 0.02329985799001779, 'sideways_atr_max_pct': 0.11064305426133321, 'sideways_tp_mult': 1.4943795883594129, 'sideways_tsl_mult': 0.31195023822370216, 'sideways_time_stop': 168, 'sideways_use_sma': True, 'sideways_use_ema': True, 'sideways_use_atr': False, 'sideways_use_adx': False, 'sideways_use_spike': True, 'sideways_rsi_required': False}.
[I 2025-08-31 11:11:07,228] Trial 635 finished with values: [-1000000000.0, 1000000000.0] and parameters: {'p_sma': 40, 'p_std': 8, 'p_atr': 28, 'p_adx': 22, 'rsi_period': 69, 'ema1': 6, 'ema2': 24, 'slip_atr_k': 0.02664661251687607, 'slip_spread_k': 0.3968061815068271, 'spread_hl_frac': 0.02043899609503389, 'bb_std_mult': 0.6588745907674491, 'rsi_os': 47, 'rsi_ob': 83, 'vol_spike': 0.05621520704353763, 'adx_thresh': 11.908939375793064, 'atr_min_pct': 0.021407919533254327, 'atr_max_pct': 0.06175970153961605, 'tp_mult': 2.921226891708289, 'tsl_mult': 0.12130381857546495, 'strategy': 'breakout', 'time_stop': 73, 'use_sma': True, 'use_atr': True, 'use_adx': False, 'use_ema': True, 'use_spike': False, 'rsi_required': False, 'edge_k': 1.5449871511713655, 'edge_cap': 0.7643190064323877, 'bull_strategy': 'mean_reversion', 'bull_bb_std_mult': 1.4947418214451758, 'bull_rsi_os': 43, 'bull_rsi_ob': 63, 'bull_adx_thresh': 27.445544888809778, 'bull_atr_min_pct': 0.014351540412723867, 'bull_atr_max_pct': 0.034293870624796614, 'bull_tp_mult': 2.8698885835670263, 'bull_tsl_mult': 0.23426692411639874, 'bull_time_stop': 54, 'bull_use_sma': False, 'bull_use_ema': True, 'bull_use_atr': False, 'bull_use_adx': True, 'bull_use_spike': False, 'bull_rsi_required': False, 'bear_strategy': 'mean_reversion', 'bear_bb_std_mult': 3.0676021281647445, 'bear_rsi_os': 52, 'bear_rsi_ob': 76, 'bear_adx_thresh': 9.324170852968106, 'bear_atr_min_pct': 0.0012683078394419654, 'bear_atr_max_pct': 0.04170775784853796, 'bear_tp_mult': 1.694718662907896, 'bear_tsl_mult': 0.9170110042690454, 'bear_time_stop': 85, 'bear_use_sma': False, 'bear_use_ema': True, 'bear_use_atr': True, 'bear_use_adx': True, 'bear_use_spike': True, 'bear_rsi_required': False, 'sideways_strategy': 'mean_reversion', 'sideways_bb_std_mult': 1.0071252433984241, 'sideways_rsi_os': 39, 'sideways_rsi_ob': 61, 'sideways_adx_thresh': 26.16295272391851, 'sideways_atr_min_pct': 0.029023581875027626, 'sideways_atr_max_pct': 0.1008144815196671, 'sideways_tp_mult': 1.5276317589459203, 'sideways_tsl_mult': 0.9005168067613967, 'sideways_time_stop': 168, 'sideways_use_sma': True, 'sideways_use_ema': True, 'sideways_use_atr': False, 'sideways_use_adx': False, 'sideways_use_spike': True, 'sideways_rsi_required': False}.
[I 2025-08-31 11:11:07,832] Trial 633 finished with values: [-0.06814025586712213, 0.06827604382808146] and parameters: {'p_sma': 36, 'p_std': 8, 'p_atr': 27, 'p_adx': 25, 'rsi_period': 11, 'ema1': 5, 'ema2': 23, 'slip_atr_k': 0.02563319825752888, 'slip_spread_k': 0.4067985832037873, 'spread_hl_frac': 0.020261005414425253, 'bb_std_mult': 0.5133234921112517, 'rsi_os': 25, 'rsi_ob': 83, 'vol_spike': 0.1674935607714544, 'adx_thresh': 11.869751583410599, 'atr_min_pct': 0.023128134031293768, 'atr_max_pct': 0.06906838874700283, 'tp_mult': 2.9054093146854316, 'tsl_mult': 0.11683755819345938, 'strategy': 'breakout', 'time_stop': 75, 'use_sma': True, 'use_atr': True, 'use_adx': False, 'use_ema': True, 'use_spike': False, 'rsi_required': False, 'edge_k': 1.5335335670384451, 'edge_cap': 0.7726351472481023, 'bull_strategy': 'mean_reversion', 'bull_bb_std_mult': 1.6453935283745031, 'bull_rsi_os': 34, 'bull_rsi_ob': 62, 'bull_adx_thresh': 27.418524709505053, 'bull_atr_min_pct': 0.012384397821518778, 'bull_atr_max_pct': 0.13928602921232675, 'bull_tp_mult': 2.9009590916604693, 'bull_tsl_mult': 0.24881061821175662, 'bull_time_stop': 264, 'bull_use_sma': False, 'bull_use_ema': False, 'bull_use_atr': False, 'bull_use_adx': True, 'bull_use_spike': False, 'bull_rsi_required': False, 'bear_strategy': 'mean_reversion', 'bear_bb_std_mult': 2.992173237893981, 'bear_rsi_os': 52, 'bear_rsi_ob': 82, 'bear_adx_thresh': 29.422074482245442, 'bear_atr_min_pct': 0.0013013399330655063, 'bear_atr_max_pct': 0.04304330896397295, 'bear_tp_mult': 2.6624422573383217, 'bear_tsl_mult': 0.9180958843604824, 'bear_time_stop': 95, 'bear_use_sma': True, 'bear_use_ema': False, 'bear_use_atr': True, 'bear_use_adx': True, 'bear_use_spike': True, 'bear_rsi_required': False, 'sideways_strategy': 'mean_reversion', 'sideways_bb_std_mult': 0.9388451962547083, 'sideways_rsi_os': 39, 'sideways_rsi_ob': 62, 'sideways_adx_thresh': 25.982159505687587, 'sideways_atr_min_pct': 0.0052976407308885694, 'sideways_atr_max_pct': 0.10115570113319328, 'sideways_tp_mult': 1.421990309336794, 'sideways_tsl_mult': 0.8968572641033077, 'sideways_time_stop': 167, 'sideways_use_sma': False, 'sideways_use_ema': True, 'sideways_use_atr': False, 'sideways_use_adx': True, 'sideways_use_spike': True, 'sideways_rsi_required': False}.
[I 2025-08-31 11:11:07,833] Trial 634 finished with values: [-1000000000.0, 1000000000.0] and parameters: {'p_sma': 30, 'p_std': 8, 'p_atr': 27, 'p_adx': 21, 'rsi_period': 10, 'ema1': 7, 'ema2': 23, 'slip_atr_k': 0.02653362700897654, 'slip_spread_k': 0.5091692190072667, 'spread_hl_frac': 0.02043481735713035, 'bb_std_mult': 0.6686652295844595, 'rsi_os': 25, 'rsi_ob': 83, 'vol_spike': 0.11073687304632165, 'adx_thresh': 12.10774471895763, 'atr_min_pct': 0.021233919757183514, 'atr_max_pct': 0.06931936840447708, 'tp_mult': 2.8938665940804804, 'tsl_mult': 0.11721062697921317, 'strategy': 'breakout', 'time_stop': 76, 'use_sma': True, 'use_atr': True, 'use_adx': False, 'use_ema': True, 'use_spike': False, 'rsi_required': False, 'edge_k': 1.4690695847260624, 'edge_cap': 0.6992654384886167, 'bull_strategy': 'mean_reversion', 'bull_bb_std_mult': 1.3182019596624384, 'bull_rsi_os': 34, 'bull_rsi_ob': 62, 'bull_adx_thresh': 27.13179738480684, 'bull_atr_min_pct': 0.01397527056820874, 'bull_atr_max_pct': 0.10165894097505979, 'bull_tp_mult': 2.8977971516396934, 'bull_tsl_mult': 0.23782786200093742, 'bull_time_stop': 53, 'bull_use_sma': False, 'bull_use_ema': True, 'bull_use_atr': False, 'bull_use_adx': True, 'bull_use_spike': False, 'bull_rsi_required': False, 'bear_strategy': 'mean_reversion', 'bear_bb_std_mult': 1.6612677675344851, 'bear_rsi_os': 52, 'bear_rsi_ob': 64, 'bear_adx_thresh': 9.473588404598978, 'bear_atr_min_pct': 0.009725159090260296, 'bear_atr_max_pct': 0.08281572387008236, 'bear_tp_mult': 2.775493038146088, 'bear_tsl_mult': 0.9265943697045417, 'bear_time_stop': 94, 'bear_use_sma': True, 'bear_use_ema': False, 'bear_use_atr': True, 'bear_use_adx': True, 'bear_use_spike': True, 'bear_rsi_required': False, 'sideways_strategy': 'mean_reversion', 'sideways_bb_std_mult': 0.9851286463793186, 'sideways_rsi_os': 39, 'sideways_rsi_ob': 61, 'sideways_adx_thresh': 26.009808493815108, 'sideways_atr_min_pct': 0.005264695851958804, 'sideways_atr_max_pct': 0.1092446154566927, 'sideways_tp_mult': 1.4998142780601333, 'sideways_tsl_mult': 0.40592743032930706, 'sideways_time_stop': 168, 'sideways_use_sma': False, 'sideways_use_ema': True, 'sideways_use_atr': False, 'sideways_use_adx': True, 'sideways_use_spike': True, 'sideways_rsi_required': False}.
[I 2025-08-31 11:11:07,924] Trial 636 finished with values: [-1000000000.0, 1000000000.0] and parameters: {'p_sma': 30, 'p_std': 7, 'p_atr': 28, 'p_adx': 30, 'rsi_period': 59, 'ema1': 7, 'ema2': 38, 'slip_atr_k': 0.02861642806107994, 'slip_spread_k': 0.42362617810273817, 'spread_hl_frac': 0.02244664757096063, 'bb_std_mult': 0.505774823733249, 'rsi_os': 53, 'rsi_ob': 86, 'vol_spike': 0.10897509803661004, 'adx_thresh': 10.197098682521935, 'atr_min_pct': 0.021379096554565054, 'atr_max_pct': 0.0690539009343417, 'tp_mult': 2.9251884446010283, 'tsl_mult': 0.12237806508943949, 'strategy': 'breakout', 'time_stop': 78, 'use_sma': True, 'use_atr': True, 'use_adx': False, 'use_ema': True, 'use_spike': False, 'rsi_required': False, 'edge_k': 1.5418626855633384, 'edge_cap': 0.6979408190103298, 'bull_strategy': 'mean_reversion', 'bull_bb_std_mult': 1.3165776487652767, 'bull_rsi_os': 16, 'bull_rsi_ob': 63, 'bull_adx_thresh': 27.91729419198114, 'bull_atr_min_pct': 0.014290920423158299, 'bull_atr_max_pct': 0.10375072572986035, 'bull_tp_mult': 1.4112142018722538, 'bull_tsl_mult': 0.22842067304010147, 'bull_time_stop': 53, 'bull_use_sma': False, 'bull_use_ema': True, 'bull_use_atr': False, 'bull_use_adx': True, 'bull_use_spike': False, 'bull_rsi_required': False, 'bear_strategy': 'mean_reversion', 'bear_bb_std_mult': 1.5552036758666026, 'bear_rsi_os': 54, 'bear_rsi_ob': 79, 'bear_adx_thresh': 9.493166481482028, 'bear_atr_min_pct': 0.006943202298531155, 'bear_atr_max_pct': 0.11207148402527446, 'bear_tp_mult': 2.774839907651753, 'bear_tsl_mult': 0.8987687537259239, 'bear_time_stop': 82, 'bear_use_sma': True, 'bear_use_ema': True, 'bear_use_atr': True, 'bear_use_adx': True, 'bear_use_spike': True, 'bear_rsi_required': False, 'sideways_strategy': 'mean_reversion', 'sideways_bb_std_mult': 1.0606227585454318, 'sideways_rsi_os': 39, 'sideways_rsi_ob': 65, 'sideways_adx_thresh': 26.11470827307818, 'sideways_atr_min_pct': 0.005353767390328355, 'sideways_atr_max_pct': 0.10069867962472956, 'sideways_tp_mult': 1.5339153147931788, 'sideways_tsl_mult': 0.020895393323046352, 'sideways_time_stop': 174, 'sideways_use_sma': False, 'sideways_use_ema': True, 'sideways_use_atr': False, 'sideways_use_adx': True, 'sideways_use_spike': True, 'sideways_rsi_required': False}.
[I 2025-08-31 11:11:40,248] Trial 640 finished with values: [-1000000000.0, 1000000000.0] and parameters: {'p_sma': 32, 'p_std': 15, 'p_atr': 28, 'p_adx': 26, 'rsi_period': 31, 'ema1': 5, 'ema2': 41, 'slip_atr_k': 0.17230386697693104, 'slip_spread_k': 0.46882502246962227, 'spread_hl_frac': 0.022973435622595673, 'bb_std_mult': 0.6759527182557796, 'rsi_os': 32, 'rsi_ob': 84, 'vol_spike': 0.1810711489916361, 'adx_thresh': 10.270565160151047, 'atr_min_pct': 0.02283106288048798, 'atr_max_pct': 0.058791321508605124, 'tp_mult': 2.9547440352595293, 'tsl_mult': 0.09777759040254509, 'strategy': 'breakout', 'time_stop': 84, 'use_sma': True, 'use_atr': True, 'use_adx': False, 'use_ema': True, 'use_spike': False, 'rsi_required': False, 'edge_k': 1.3694978278713394, 'edge_cap': 0.6940647021517032, 'bull_strategy': 'mean_reversion', 'bull_bb_std_mult': 2.4431651075258003, 'bull_rsi_os': 18, 'bull_rsi_ob': 60, 'bull_adx_thresh': 26.457739489346448, 'bull_atr_min_pct': 0.012399045114557278, 'bull_atr_max_pct': 0.1471128413903331, 'bull_tp_mult': 2.857413298693345, 'bull_tsl_mult': 0.18975720160875592, 'bull_time_stop': 46, 'bull_use_sma': False, 'bull_use_ema': True, 'bull_use_atr': False, 'bull_use_adx': True, 'bull_use_spike': False, 'bull_rsi_required': True, 'bear_strategy': 'mean_reversion', 'bear_bb_std_mult': 1.4847328371283621, 'bear_rsi_os': 51, 'bear_rsi_ob': 54, 'bear_adx_thresh': 10.660067650601249, 'bear_atr_min_pct': 0.014462823448789686, 'bear_atr_max_pct': 0.13256319752203913, 'bear_tp_mult': 2.2760345927437573, 'bear_tsl_mult': 0.8931914239929029, 'bear_time_stop': 110, 'bear_use_sma': False, 'bear_use_ema': False, 'bear_use_atr': False, 'bear_use_adx': False, 'bear_use_spike': False, 'bear_rsi_required': False, 'sideways_strategy': 'mean_reversion', 'sideways_bb_std_mult': 1.087158751862602, 'sideways_rsi_os': 43, 'sideways_rsi_ob': 63, 'sideways_adx_thresh': 25.169099388678905, 'sideways_atr_min_pct': 0.008997716388502781, 'sideways_atr_max_pct': 0.10751294370405917, 'sideways_tp_mult': 1.5696764054092833, 'sideways_tsl_mult': 0.5830110850040277, 'sideways_time_stop': 154, 'sideways_use_sma': True, 'sideways_use_ema': True, 'sideways_use_atr': True, 'sideways_use_adx': False, 'sideways_use_spike': False, 'sideways_rsi_required': False}.
[I 2025-08-31 11:11:40,736] Trial 639 finished with values: [-1000000000.0, 1000000000.0] and parameters: {'p_sma': 37, 'p_std': 12, 'p_atr': 28, 'p_adx': 21, 'rsi_period': 31, 'ema1': 5, 'ema2': 41, 'slip_atr_k': 0.11501065695199876, 'slip_spread_k': 0.4640318219085977, 'spread_hl_frac': 0.023035491762700012, 'bb_std_mult': 0.6459223992784349, 'rsi_os': 22, 'rsi_ob': 85, 'vol_spike': 0.15653876715841294, 'adx_thresh': 10.422933584741347, 'atr_min_pct': 0.021181542565283686, 'atr_max_pct': 0.05854336756041597, 'tp_mult': 2.9357644141909196, 'tsl_mult': 0.09544356126334604, 'strategy': 'breakout', 'time_stop': 82, 'use_sma': True, 'use_atr': True, 'use_adx': False, 'use_ema': True, 'use_spike': False, 'rsi_required': False, 'edge_k': 1.4902398690603842, 'edge_cap': 0.6870940574405388, 'bull_strategy': 'mean_reversion', 'bull_bb_std_mult': 2.488379864873113, 'bull_rsi_os': 50, 'bull_rsi_ob': 61, 'bull_adx_thresh': 26.184178594371062, 'bull_atr_min_pct': 0.01252178872156601, 'bull_atr_max_pct': 0.030876601517975912, 'bull_tp_mult': 2.540171969811304, 'bull_tsl_mult': 0.2663081443326228, 'bull_time_stop': 45, 'bull_use_sma': False, 'bull_use_ema': True, 'bull_use_atr': False, 'bull_use_adx': True, 'bull_use_spike': False, 'bull_rsi_required': True, 'bear_strategy': 'mean_reversion', 'bear_bb_std_mult': 0.8163043837034814, 'bear_rsi_os': 54, 'bear_rsi_ob': 54, 'bear_adx_thresh': 9.960535839034009, 'bear_atr_min_pct': 6.848414761378811e-05, 'bear_atr_max_pct': 0.1330783813474515, 'bear_tp_mult': 2.3084691795764978, 'bear_tsl_mult': 0.8937770398875642, 'bear_time_stop': 86, 'bear_use_sma': False, 'bear_use_ema': True, 'bear_use_atr': True, 'bear_use_adx': False, 'bear_use_spike': False, 'bear_rsi_required': False, 'sideways_strategy': 'mean_reversion', 'sideways_bb_std_mult': 1.0616576528017083, 'sideways_rsi_os': 42, 'sideways_rsi_ob': 66, 'sideways_adx_thresh': 27.03377765510477, 'sideways_atr_min_pct': 0.006217868754606633, 'sideways_atr_max_pct': 0.10579813939807635, 'sideways_tp_mult': 1.5587559693572106, 'sideways_tsl_mult': 0.28528152756994957, 'sideways_time_stop': 155, 'sideways_use_sma': True, 'sideways_use_ema': True, 'sideways_use_atr': False, 'sideways_use_adx': False, 'sideways_use_spike': False, 'sideways_rsi_required': False}.
