[I 2025-09-01 08:12:02,903] Trial 296 finished with values: [-1000000000.0, 1000000000.0] and parameters: {'p_sma': 24, 'p_std': 28, 'p_atr': 23, 'p_adx': 13, 'rsi_period': 73, 'ema1': 18, 'ema2': 12, 'slip_atr_k': 0.01169206488868084, 'slip_spread_k': 0.9149566099157078, 'spread_hl_frac': 0.013868526888413632, 'bb_std_mult': 2.1044152112692918, 'rsi_os': 16, 'rsi_ob': 46, 'vol_spike': 0.06643849766914262, 'adx_thresh': 25.363697477363115, 'atr_min_pct': 0.004054450705438472, 'atr_max_pct': 0.12746482745607465, 'tp_mult': 1.9557152821493247, 'tsl_mult': 0.06532395146373088, 'strategy': 'breakout', 'time_stop': 205, 'use_sma': True, 'use_atr': False, 'use_adx': True, 'use_ema': True, 'use_spike': True, 'rsi_required': True, 'edge_k': 0.19039483271567753, 'edge_cap': 0.4760880727104578, 'bull_strategy': 'breakout', 'bull_bb_std_mult': 1.278865052010912, 'bull_rsi_os': 49, 'bull_rsi_ob': 52, 'bull_adx_thresh': 5.1957381826494835, 'bull_atr_min_pct': 0.024529700492954956, 'bull_atr_max_pct': 0.01045211278739637, 'bull_tp_mult': 1.5409920334615068, 'bull_tsl_mult': 0.5760360762114324, 'bull_time_stop': 121, 'bull_use_sma': False, 'bull_use_ema': True, 'bull_use_atr': False, 'bull_use_adx': False, 'bull_use_spike': False, 'bull_rsi_required': True, 'bear_strategy': 'breakout', 'bear_bb_std_mult': 3.5995431332073604, 'bear_rsi_os': 26, 'bear_rsi_ob': 88, 'bear_adx_thresh': 5.754166805349335, 'bear_atr_min_pct': 0.007278898619487829, 'bear_atr_max_pct': 0.10599932644173365, 'bear_tp_mult': 2.957761375428834, 'bear_tsl_mult': 0.1303847335935846, 'bear_time_stop': 283, 'bear_use_sma': True, 'bear_use_ema': False, 'bear_use_atr': False, 'bear_use_adx': True, 'bear_use_spike': False, 'bear_rsi_required': False, 'sideways_strategy': 'breakout', 'sideways_bb_std_mult': 0.7355223784699513, 'sideways_rsi_os': 7, 'sideways_rsi_ob': 74, 'sideways_adx_thresh': 16.149892972106855, 'sideways_atr_min_pct': 0.02270307496441363, 'sideways_atr_max_pct': 0.052837253412390595, 'sideways_tp_mult': 1.2596701610481669, 'sideways_tsl_mult': 0.7522709347110599, 'sideways_time_stop': 297, 'sideways_use_sma': True, 'sideways_use_ema': True, 'sideways_use_atr': True, 'sideways_use_adx': True, 'sideways_use_spike': False, 'sideways_rsi_required': False}.
[I 2025-09-01 08:12:02,915] Trial 299 finished with values: [-0.010154415341030343, 0.011631736992150404] and parameters: {'p_sma': 28, 'p_std': 54, 'p_atr': 22, 'p_adx': 13, 'rsi_period': 61, 'ema1': 16, 'ema2': 12, 'slip_atr_k': 0.12003892976941788, 'slip_spread_k': 0.833934815521264, 'spread_hl_frac': 0.017605681923016682, 'bb_std_mult': 2.8483009634046055, 'rsi_os': 16, 'rsi_ob': 91, 'vol_spike': 0.2162298434637462, 'adx_thresh': 8.898604044571222, 'atr_min_pct': 0.004062453696610183, 'atr_max_pct': 0.033812660129500294, 'tp_mult': 1.9700831238869716, 'tsl_mult': 0.0502808348545577, 'strategy': 'breakout', 'time_stop': 247, 'use_sma': False, 'use_atr': False, 'use_adx': True, 'use_ema': True, 'use_spike': True, 'rsi_required': True, 'edge_k': 0.2368853705095193, 'edge_cap': 0.678570182092856, 'bull_strategy': 'breakout', 'bull_bb_std_mult': 3.3667111420860283, 'bull_rsi_os': 9, 'bull_rsi_ob': 48, 'bull_adx_thresh': 11.1464928169859, 'bull_atr_min_pct': 0.003778133224117835, 'bull_atr_max_pct': 0.02438935389511626, 'bull_tp_mult': 1.5461310663841612, 'bull_tsl_mult': 0.5798923395694993, 'bull_time_stop': 120, 'bull_use_sma': True, 'bull_use_ema': False, 'bull_use_atr': False, 'bull_use_adx': False, 'bull_use_spike': False, 'bull_rsi_required': False, 'bear_strategy': 'mean_reversion', 'bear_bb_std_mult': 1.392992792268868, 'bear_rsi_os': 46, 'bear_rsi_ob': 80, 'bear_adx_thresh': 5.621894470534641, 'bear_atr_min_pct': 0.005570203008497775, 'bear_atr_max_pct': 0.1052946278442302, 'bear_tp_mult': 2.1625717724790223, 'bear_tsl_mult': 0.08293707332971056, 'bear_time_stop': 295, 'bear_use_sma': True, 'bear_use_ema': False, 'bear_use_atr': False, 'bear_use_adx': False, 'bear_use_spike': False, 'bear_rsi_required': False, 'sideways_strategy': 'breakout', 'sideways_bb_std_mult': 0.7883830466109304, 'sideways_rsi_os': 7, 'sideways_rsi_ob': 90, 'sideways_adx_thresh': 23.264911893316683, 'sideways_atr_min_pct': 0.028578722749003617, 'sideways_atr_max_pct': 0.01292569692302505, 'sideways_tp_mult': 1.2375640852386267, 'sideways_tsl_mult': 0.16019664029139719, 'sideways_time_stop': 137, 'sideways_use_sma': True, 'sideways_use_ema': True, 'sideways_use_atr': True, 'sideways_use_adx': True, 'sideways_use_spike': False, 'sideways_rsi_required': False}.
[I 2025-09-01 08:12:03,063] Trial 297 finished with values: [-1000000000.0, 1000000000.0] and parameters: {'p_sma': 33, 'p_std': 47, 'p_atr': 11, 'p_adx': 19, 'rsi_period': 63, 'ema1': 18, 'ema2': 24, 'slip_atr_k': 0.09453146300319867, 'slip_spread_k': 0.829151714607057, 'spread_hl_frac': 0.014349648414168449, 'bb_std_mult': 2.787423867055787, 'rsi_os': 33, 'rsi_ob': 51, 'vol_spike': 0.07950904983320557, 'adx_thresh': 9.043515289098252, 'atr_min_pct': 0.0027590679661132654, 'atr_max_pct': 0.03553421989534738, 'tp_mult': 2.1458964083822187, 'tsl_mult': 0.019184089707277942, 'strategy': 'breakout', 'time_stop': 212, 'use_sma': True, 'use_atr': False, 'use_adx': True, 'use_ema': True, 'use_spike': True, 'rsi_required': True, 'edge_k': 0.18595522736573022, 'edge_cap': 0.5195630460465747, 'bull_strategy': 'breakout', 'bull_bb_std_mult': 3.0206748882866123, 'bull_rsi_os': 53, 'bull_rsi_ob': 92, 'bull_adx_thresh': 7.975351628888727, 'bull_atr_min_pct': 0.017148068491720594, 'bull_atr_max_pct': 0.024902608299050805, 'bull_tp_mult': 2.246795067992769, 'bull_tsl_mult': 0.27007750208341585, 'bull_time_stop': 77, 'bull_use_sma': True, 'bull_use_ema': False, 'bull_use_atr': False, 'bull_use_adx': False, 'bull_use_spike': False, 'bull_rsi_required': False, 'bear_strategy': 'mean_reversion', 'bear_bb_std_mult': 2.108246683463111, 'bear_rsi_os': 46, 'bear_rsi_ob': 80, 'bear_adx_thresh': 5.667319940585734, 'bear_atr_min_pct': 0.00726833042770365, 'bear_atr_max_pct': 0.020570723531440432, 'bear_tp_mult': 2.7140328532053593, 'bear_tsl_mult': 0.20530421370304652, 'bear_time_stop': 295, 'bear_use_sma': True, 'bear_use_ema': False, 'bear_use_atr': False, 'bear_use_adx': False, 'bear_use_spike': False, 'bear_rsi_required': False, 'sideways_strategy': 'breakout', 'sideways_bb_std_mult': 0.7762646501227144, 'sideways_rsi_os': 7, 'sideways_rsi_ob': 95, 'sideways_adx_thresh': 32.46979350750148, 'sideways_atr_min_pct': 0.02855599295509588, 'sideways_atr_max_pct': 0.0480315087983784, 'sideways_tp_mult': 1.2800225193706165, 'sideways_tsl_mult': 0.33082637694964534, 'sideways_time_stop': 231, 'sideways_use_sma': True, 'sideways_use_ema': True, 'sideways_use_atr': True, 'sideways_use_adx': True, 'sideways_use_spike': False, 'sideways_rsi_required': False}.
[I 2025-09-01 08:12:50,432] Trial 300 finished with values: [-1000000000.0, 1000000000.0] and parameters: {'p_sma': 28, 'p_std': 28, 'p_atr': 28, 'p_adx': 11, 'rsi_period': 22, 'ema1': 19, 'ema2': 24, 'slip_atr_k': 0.03733950370767915, 'slip_spread_k': 0.9735428253596866, 'spread_hl_frac': 0.03717288582892284, 'bb_std_mult': 1.910117225847417, 'rsi_os': 54, 'rsi_ob': 57, 'vol_spike': 0.07766911276569596, 'adx_thresh': 30.579658323724008, 'atr_min_pct': 0.005231723071329643, 'atr_max_pct': 0.1349698589645849, 'tp_mult': 1.6054280825968317, 'tsl_mult': 0.061997285995898876, 'strategy': 'breakout', 'time_stop': 215, 'use_sma': True, 'use_atr': False, 'use_adx': True, 'use_ema': True, 'use_spike': True, 'rsi_required': True, 'edge_k': 0.1898363657519115, 'edge_cap': 0.6946746129440421, 'bull_strategy': 'breakout', 'bull_bb_std_mult': 2.8757448315643788, 'bull_rsi_os': 49, 'bull_rsi_ob': 51, 'bull_adx_thresh': 15.758966625964621, 'bull_atr_min_pct': 0.007702052507709909, 'bull_atr_max_pct': 0.07978278715634511, 'bull_tp_mult': 1.5703943550129293, 'bull_tsl_mult': 0.6047164285339907, 'bull_time_stop': 237, 'bull_use_sma': True, 'bull_use_ema': True, 'bull_use_atr': False, 'bull_use_adx': False, 'bull_use_spike': False, 'bull_rsi_required': False, 'bear_strategy': 'mean_reversion', 'bear_bb_std_mult': 1.4144985161793509, 'bear_rsi_os': 45, 'bear_rsi_ob': 77, 'bear_adx_thresh': 5.576341140196069, 'bear_atr_min_pct': 0.007376506890369194, 'bear_atr_max_pct': 0.055592821510336274, 'bear_tp_mult': 2.161521404894042, 'bear_tsl_mult': 0.15849553962286778, 'bear_time_stop': 295, 'bear_use_sma': True, 'bear_use_ema': False, 'bear_use_atr': False, 'bear_use_adx': False, 'bear_use_spike': False, 'bear_rsi_required': False, 'sideways_strategy': 'breakout', 'sideways_bb_std_mult': 0.7786481214236138, 'sideways_rsi_os': 34, 'sideways_rsi_ob': 95, 'sideways_adx_thresh': 13.67663584964222, 'sideways_atr_min_pct': 0.029983404200925108, 'sideways_atr_max_pct': 0.10736047254769358, 'sideways_tp_mult': 1.237539186984309, 'sideways_tsl_mult': 0.0877198279049996, 'sideways_time_stop': 247, 'sideways_use_sma': True, 'sideways_use_ema': True, 'sideways_use_atr': True, 'sideways_use_adx': True, 'sideways_use_spike': False, 'sideways_rsi_required': False}.
[I 2025-09-01 08:12:53,503] Trial 301 finished with values: [-0.016021343200850025, 0.015935956731462083] and parameters: {'p_sma': 33, 'p_std': 57, 'p_atr': 24, 'p_adx': 9, 'rsi_period': 22, 'ema1': 20, 'ema2': 14, 'slip_atr_k': 0.09742460589999827, 'slip_spread_k': 0.1903314845747509, 'spread_hl_frac': 0.049556790680499965, 'bb_std_mult': 2.9099296560380807, 'rsi_os': 33, 'rsi_ob': 57, 'vol_spike': 0.07557974516315322, 'adx_thresh': 27.543392358699045, 'atr_min_pct': 0.005054359971282073, 'atr_max_pct': 0.040655736822749235, 'tp_mult': 1.6149823858089492, 'tsl_mult': 0.5650425166651353, 'strategy': 'breakout', 'time_stop': 215, 'use_sma': False, 'use_atr': False, 'use_adx': True, 'use_ema': True, 'use_spike': True, 'rsi_required': True, 'edge_k': 0.19502871539597108, 'edge_cap': 0.3891833287177542, 'bull_strategy': 'breakout', 'bull_bb_std_mult': 2.9101473450675117, 'bull_rsi_os': 46, 'bull_rsi_ob': 65, 'bull_adx_thresh': 8.063026619696235, 'bull_atr_min_pct': 0.0021991093430889274, 'bull_atr_max_pct': 0.04065521432139494, 'bull_tp_mult': 2.248132891971406, 'bull_tsl_mult': 0.6052383687908538, 'bull_time_stop': 86, 'bull_use_sma': True, 'bull_use_ema': True, 'bull_use_atr': False, 'bull_use_adx': False, 'bull_use_spike': False, 'bull_rsi_required': False, 'bear_strategy': 'mean_reversion', 'bear_bb_std_mult': 1.8472678061906393, 'bear_rsi_os': 45, 'bear_rsi_ob': 81, 'bear_adx_thresh': 23.50343336299028, 'bear_atr_min_pct': 0.007325621496899804, 'bear_atr_max_pct': 0.0782903909475132, 'bear_tp_mult': 2.2536685410556303, 'bear_tsl_mult': 0.2522885919247245, 'bear_time_stop': 295, 'bear_use_sma': True, 'bear_use_ema': False, 'bear_use_atr': True, 'bear_use_adx': False, 'bear_use_spike': False, 'bear_rsi_required': False, 'sideways_strategy': 'breakout', 'sideways_bb_std_mult': 0.6592825879857478, 'sideways_rsi_os': 21, 'sideways_rsi_ob': 70, 'sideways_adx_thresh': 17.959539065431798, 'sideways_atr_min_pct': 0.02734178038279463, 'sideways_atr_max_pct': 0.048397814723980144, 'sideways_tp_mult': 2.045701093986816, 'sideways_tsl_mult': 0.13016453540625744, 'sideways_time_stop': 246, 'sideways_use_sma': True, 'sideways_use_ema': True, 'sideways_use_atr': True, 'sideways_use_adx': False, 'sideways_use_spike': True, 'sideways_rsi_required': False}.
[I 2025-09-01 08:12:53,900] Trial 303 finished with values: [-1000000000.0, 1000000000.0] and parameters: {'p_sma': 28, 'p_std': 57, 'p_atr': 24, 'p_adx': 26, 'rsi_period': 58, 'ema1': 10, 'ema2': 59, 'slip_atr_k': 0.23598725499485956, 'slip_spread_k': 0.9626071691485125, 'spread_hl_frac': 0.010485155297274468, 'bb_std_mult': 2.51905191686823, 'rsi_os': 30, 'rsi_ob': 80, 'vol_spike': 0.05808031279347678, 'adx_thresh': 31.433399938062713, 'atr_min_pct': 0.00527957148105597, 'atr_max_pct': 0.13710192954380665, 'tp_mult': 1.6085230425802723, 'tsl_mult': 0.11162259289345053, 'strategy': 'breakout', 'time_stop': 80, 'use_sma': False, 'use_atr': True, 'use_adx': True, 'use_ema': True, 'use_spike': True, 'rsi_required': True, 'edge_k': 0.3259429077608829, 'edge_cap': 0.1720862217371902, 'bull_strategy': 'mean_reversion', 'bull_bb_std_mult': 2.8737094750207888, 'bull_rsi_os': 28, 'bull_rsi_ob': 51, 'bull_adx_thresh': 16.51069914873921, 'bull_atr_min_pct': 0.005499122744121089, 'bull_atr_max_pct': 0.020472366295211313, 'bull_tp_mult': 1.5899058648899669, 'bull_tsl_mult': 0.6076811497818178, 'bull_time_stop': 87, 'bull_use_sma': True, 'bull_use_ema': True, 'bull_use_atr': False, 'bull_use_adx': False, 'bull_use_spike': False, 'bull_rsi_required': False, 'bear_strategy': 'mean_reversion', 'bear_bb_std_mult': 1.6699360562501921, 'bear_rsi_os': 44, 'bear_rsi_ob': 77, 'bear_adx_thresh': 21.368975545624046, 'bear_atr_min_pct': 0.007836962009293116, 'bear_atr_max_pct': 0.0663681623742996, 'bear_tp_mult': 2.2359093260151086, 'bear_tsl_mult': 0.160504001747432, 'bear_time_stop': 300, 'bear_use_sma': True, 'bear_use_ema': False, 'bear_use_atr': True, 'bear_use_adx': False, 'bear_use_spike': False, 'bear_rsi_required': False, 'sideways_strategy': 'mean_reversion', 'sideways_bb_std_mult': 0.5942670583149977, 'sideways_rsi_os': 34, 'sideways_rsi_ob': 85, 'sideways_adx_thresh': 17.75254161383775, 'sideways_atr_min_pct': 0.006723790681793561, 'sideways_atr_max_pct': 0.014751995252755279, 'sideways_tp_mult': 2.810411531355297, 'sideways_tsl_mult': 0.968545778334579, 'sideways_time_stop': 126, 'sideways_use_sma': True, 'sideways_use_ema': True, 'sideways_use_atr': False, 'sideways_use_adx': False, 'sideways_use_spike': True, 'sideways_rsi_required': False}.
[I 2025-09-01 08:12:54,235] Trial 302 finished with values: [-0.030944745931877127, 0.031929380122027534] and parameters: {'p_sma': 33, 'p_std': 57, 'p_atr': 29, 'p_adx': 29, 'rsi_period': 21, 'ema1': 10, 'ema2': 14, 'slip_atr_k': 0.19725988370249742, 'slip_spread_k': 0.9744918777082734, 'spread_hl_frac': 0.04037773466558366, 'bb_std_mult': 1.8796102601440847, 'rsi_os': 30, 'rsi_ob': 51, 'vol_spike': 0.07838940500884611, 'adx_thresh': 31.3623239538816, 'atr_min_pct': 0.005286389593233585, 'atr_max_pct': 0.13512384273594186, 'tp_mult': 1.616163699816936, 'tsl_mult': 0.10048213609198096, 'strategy': 'breakout', 'time_stop': 212, 'use_sma': False, 'use_atr': False, 'use_adx': True, 'use_ema': True, 'use_spike': True, 'rsi_required': True, 'edge_k': 0.7343645645160447, 'edge_cap': 0.520985358808034, 'bull_strategy': 'breakout', 'bull_bb_std_mult': 3.158575012495786, 'bull_rsi_os': 28, 'bull_rsi_ob': 46, 'bull_adx_thresh': 8.116832996944524, 'bull_atr_min_pct': 0.004267595836145578, 'bull_atr_max_pct': 0.10227694168938894, 'bull_tp_mult': 1.5938337283463844, 'bull_tsl_mult': 0.6148663028468789, 'bull_time_stop': 58, 'bull_use_sma': True, 'bull_use_ema': True, 'bull_use_atr': False, 'bull_use_adx': False, 'bull_use_spike': False, 'bull_rsi_required': False, 'bear_strategy': 'mean_reversion', 'bear_bb_std_mult': 1.8529999298130944, 'bear_rsi_os': 45, 'bear_rsi_ob': 81, 'bear_adx_thresh': 5.043879893038295, 'bear_atr_min_pct': 0.004575840492683494, 'bear_atr_max_pct': 0.09393659034675042, 'bear_tp_mult': 2.7165707179157788, 'bear_tsl_mult': 0.3413285084342961, 'bear_time_stop': 186, 'bear_use_sma': True, 'bear_use_ema': False, 'bear_use_atr': True, 'bear_use_adx': False, 'bear_use_spike': False, 'bear_rsi_required': False, 'sideways_strategy': 'breakout', 'sideways_bb_std_mult': 0.8665410946875474, 'sideways_rsi_os': 21, 'sideways_rsi_ob': 95, 'sideways_adx_thresh': 32.41174831421896, 'sideways_atr_min_pct': 0.02762061066328832, 'sideways_atr_max_pct': 0.047761214718184765, 'sideways_tp_mult': 2.8188121798155805, 'sideways_tsl_mult': 0.21262769125065792, 'sideways_time_stop': 236, 'sideways_use_sma': True, 'sideways_use_ema': True, 'sideways_use_atr': True, 'sideways_use_adx': False, 'sideways_use_spike': True, 'sideways_rsi_required': False}.
[I 2025-09-01 08:13:42,852] Trial 307 finished with values: [-1000000000.0, 1000000000.0] and parameters: {'p_sma': 27, 'p_std': 52, 'p_atr': 14, 'p_adx': 24, 'rsi_period': 51, 'ema1': 11, 'ema2': 21, 'slip_atr_k': 0.077766074246771, 'slip_spread_k': 0.7465179651375247, 'spread_hl_frac': 0.015376490459697929, 'bb_std_mult': 2.3652023312402286, 'rsi_os': 19, 'rsi_ob': 63, 'vol_spike': 0.08869560666167206, 'adx_thresh': 28.270144622130708, 'atr_min_pct': 0.01010206311267289, 'atr_max_pct': 0.059175806652424605, 'tp_mult': 1.732871816402243, 'tsl_mult': 0.024962195187187966, 'strategy': 'breakout', 'time_stop': 277, 'use_sma': False, 'use_atr': False, 'use_adx': True, 'use_ema': True, 'use_spike': True, 'rsi_required': True, 'edge_k': 1.5689825433068172, 'edge_cap': 0.9008513861005294, 'bull_strategy': 'breakout', 'bull_bb_std_mult': 0.5898741686782127, 'bull_rsi_os': 48, 'bull_rsi_ob': 90, 'bull_adx_thresh': 9.620958835329745, 'bull_atr_min_pct': 0.02650558372928504, 'bull_atr_max_pct': 0.08475278835421918, 'bull_tp_mult': 1.6944479812970632, 'bull_tsl_mult': 0.5629864051460862, 'bull_time_stop': 61, 'bull_use_sma': True, 'bull_use_ema': False, 'bull_use_atr': False, 'bull_use_adx': False, 'bull_use_spike': True, 'bull_rsi_required': False, 'bear_strategy': 'mean_reversion', 'bear_bb_std_mult': 1.723775513774521, 'bear_rsi_os': 49, 'bear_rsi_ob': 78, 'bear_adx_thresh': 6.15735920382105, 'bear_atr_min_pct': 0.02172872674861653, 'bear_atr_max_pct': 0.09818299381270752, 'bear_tp_mult': 2.106510860095569, 'bear_tsl_mult': 0.028906641917148073, 'bear_time_stop': 63, 'bear_use_sma': True, 'bear_use_ema': False, 'bear_use_atr': False, 'bear_use_adx': False, 'bear_use_spike': False, 'bear_rsi_required': False, 'sideways_strategy': 'breakout', 'sideways_bb_std_mult': 1.0965816569442646, 'sideways_rsi_os': 5, 'sideways_rsi_ob': 88, 'sideways_adx_thresh': 10.515172158420802, 'sideways_atr_min_pct': 0.02938315417265126, 'sideways_atr_max_pct': 0.021404962134549815, 'sideways_tp_mult': 1.4261015524444582, 'sideways_tsl_mult': 0.19463963076782623, 'sideways_time_stop': 207, 'sideways_use_sma': True, 'sideways_use_ema': True, 'sideways_use_atr': True, 'sideways_use_adx': True, 'sideways_use_spike': False, 'sideways_rsi_required': True}.
[I 2025-09-01 08:13:44,152] Trial 306 finished with values: [-0.008555834171032117, 0.008609712566455029] and parameters: {'p_sma': 29, 'p_std': 5, 'p_atr': 14, 'p_adx': 7, 'rsi_period': 13, 'ema1': 11, 'ema2': 40, 'slip_atr_k': 0.03211879402118537, 'slip_spread_k': 0.3812062171572246, 'spread_hl_frac': 0.0402369364017499, 'bb_std_mult': 2.3678121965482672, 'rsi_os': 5, 'rsi_ob': 75, 'vol_spike': 0.09046996463533792, 'adx_thresh': 28.40181787837689, 'atr_min_pct': 0.004431923617351739, 'atr_max_pct': 0.10417536354494436, 'tp_mult': 2.3965584568053844, 'tsl_mult': 0.332427236299029, 'strategy': 'breakout', 'time_stop': 25, 'use_sma': False, 'use_atr': False, 'use_adx': True, 'use_ema': True, 'use_spike': True, 'rsi_required': True, 'edge_k': 0.2547601849728449, 'edge_cap': 0.2429494197766327, 'bull_strategy': 'breakout', 'bull_bb_std_mult': 0.6079186120183595, 'bull_rsi_os': 48, 'bull_rsi_ob': 80, 'bull_adx_thresh': 7.040217471150161, 'bull_atr_min_pct': 0.00435465230210711, 'bull_atr_max_pct': 0.013974116250276936, 'bull_tp_mult': 1.3957958075287729, 'bull_tsl_mult': 0.5625821249124275, 'bull_time_stop': 267, 'bull_use_sma': True, 'bull_use_ema': False, 'bull_use_atr': False, 'bull_use_adx': False, 'bull_use_spike': True, 'bull_rsi_required': False, 'bear_strategy': 'mean_reversion', 'bear_bb_std_mult': 1.7275784977925528, 'bear_rsi_os': 49, 'bear_rsi_ob': 78, 'bear_adx_thresh': 6.1803905930432474, 'bear_atr_min_pct': 0.018300026835819237, 'bear_atr_max_pct': 0.04831599921811837, 'bear_tp_mult': 2.09520196544053, 'bear_tsl_mult': 0.023904662141628855, 'bear_time_stop': 300, 'bear_use_sma': True, 'bear_use_ema': False, 'bear_use_atr': False, 'bear_use_adx': False, 'bear_use_spike': False, 'bear_rsi_required': False, 'sideways_strategy': 'breakout', 'sideways_bb_std_mult': 0.8672365096789385, 'sideways_rsi_os': 5, 'sideways_rsi_ob': 92, 'sideways_adx_thresh': 10.574994428021917, 'sideways_atr_min_pct': 0.02443654558611036, 'sideways_atr_max_pct': 0.012425507758358087, 'sideways_tp_mult': 1.1456028946149681, 'sideways_tsl_mult': 0.19170812568301987, 'sideways_time_stop': 256, 'sideways_use_sma': True, 'sideways_use_ema': True, 'sideways_use_atr': True, 'sideways_use_adx': True, 'sideways_use_spike': False, 'sideways_rsi_required': True}.
