[I 2025-09-01 08:49:36,263] Trial 504 finished with values: [-1000000000.0, 1000000000.0] and parameters: {'p_sma': 54, 'p_std': 36, 'p_atr': 20, 'p_adx': 16, 'rsi_period': 41, 'ema1': 8, 'ema2': 60, 'slip_atr_k': 0.010810747236913668, 'slip_spread_k': 0.1217235190556193, 'spread_hl_frac': 0.019033656084770322, 'bb_std_mult': 2.640887358415112, 'rsi_os': 47, 'rsi_ob': 48, 'vol_spike': 0.009570665000333014, 'adx_thresh': 34.98232152428722, 'atr_min_pct': 0.010561707389435912, 'atr_max_pct': 0.08710533348260514, 'tp_mult': 1.2295150576499179, 'tsl_mult': 0.15803164140139567, 'strategy': 'mean_reversion', 'time_stop': 55, 'use_sma': False, 'use_atr': True, 'use_adx': False, 'use_ema': False, 'use_spike': False, 'rsi_required': False, 'edge_k': 0.9656535500029054, 'edge_cap': 0.28220828799393, 'bull_strategy': 'mean_reversion', 'bull_bb_std_mult': 2.429049014224693, 'bull_rsi_os': 38, 'bull_rsi_ob': 54, 'bull_adx_thresh': 10.176343597577514, 'bull_atr_min_pct': 0.021138013165096028, 'bull_atr_max_pct': 0.07651103424569758, 'bull_tp_mult': 1.1288194627254315, 'bull_tsl_mult': 0.7802986440827854, 'bull_time_stop': 187, 'bull_use_sma': True, 'bull_use_ema': True, 'bull_use_atr': True, 'bull_use_adx': True, 'bull_use_spike': True, 'bull_rsi_required': False, 'bear_strategy': 'mean_reversion', 'bear_bb_std_mult': 3.24991814671895, 'bear_rsi_os': 42, 'bear_rsi_ob': 91, 'bear_adx_thresh': 13.515741045970293, 'bear_atr_min_pct': 0.022593892988336625, 'bear_atr_max_pct': 0.041838395481460025, 'bear_tp_mult': 2.743859175040512, 'bear_tsl_mult': 0.23234437467657396, 'bear_time_stop': 203, 'bear_use_sma': False, 'bear_use_ema': True, 'bear_use_atr': True, 'bear_use_adx': True, 'bear_use_spike': True, 'bear_rsi_required': True, 'sideways_strategy': 'mean_reversion', 'sideways_bb_std_mult': 1.2773075875675386, 'sideways_rsi_os': 11, 'sideways_rsi_ob': 61, 'sideways_adx_thresh': 33.00093678802203, 'sideways_atr_min_pct': 0.008312999625534126, 'sideways_atr_max_pct': 0.08476831755520266, 'sideways_tp_mult': 2.4780123894128505, 'sideways_tsl_mult': 0.5598829126709717, 'sideways_time_stop': 154, 'sideways_use_sma': False, 'sideways_use_ema': False, 'sideways_use_atr': True, 'sideways_use_adx': False, 'sideways_use_spike': True, 'sideways_rsi_required': True}.
[I 2025-09-01 08:49:36,328] Trial 505 finished with values: [-1000000000.0, 1000000000.0] and parameters: {'p_sma': 50, 'p_std': 36, 'p_atr': 20, 'p_adx': 16, 'rsi_period': 41, 'ema1': 8, 'ema2': 60, 'slip_atr_k': 0.23919877666479805, 'slip_spread_k': 0.11392931254151607, 'spread_hl_frac': 0.01901003916217188, 'bb_std_mult': 2.659461326390416, 'rsi_os': 47, 'rsi_ob': 47, 'vol_spike': 0.011455259880746589, 'adx_thresh': 33.77804370194574, 'atr_min_pct': 0.011797642635114642, 'atr_max_pct': 0.08705269110658848, 'tp_mult': 1.3285458232893022, 'tsl_mult': 0.16702798608288527, 'strategy': 'mean_reversion', 'time_stop': 42, 'use_sma': False, 'use_atr': True, 'use_adx': False, 'use_ema': False, 'use_spike': False, 'rsi_required': False, 'edge_k': 0.8700963558393325, 'edge_cap': 0.31151207520213864, 'bull_strategy': 'mean_reversion', 'bull_bb_std_mult': 2.445034779985344, 'bull_rsi_os': 38, 'bull_rsi_ob': 54, 'bull_adx_thresh': 10.183139994861497, 'bull_atr_min_pct': 0.021471005837260568, 'bull_atr_max_pct': 0.08155841574715404, 'bull_tp_mult': 1.1376173988873028, 'bull_tsl_mult': 0.7799634909369276, 'bull_time_stop': 185, 'bull_use_sma': True, 'bull_use_ema': True, 'bull_use_atr': True, 'bull_use_adx': True, 'bull_use_spike': True, 'bull_rsi_required': False, 'bear_strategy': 'mean_reversion', 'bear_bb_std_mult': 3.229856659688648, 'bear_rsi_os': 38, 'bear_rsi_ob': 91, 'bear_adx_thresh': 13.41553111016168, 'bear_atr_min_pct': 0.02735044557006565, 'bear_atr_max_pct': 0.04045498365059646, 'bear_tp_mult': 2.7105488830264237, 'bear_tsl_mult': 0.23374273770583615, 'bear_time_stop': 219, 'bear_use_sma': False, 'bear_use_ema': True, 'bear_use_atr': True, 'bear_use_adx': True, 'bear_use_spike': True, 'bear_rsi_required': True, 'sideways_strategy': 'mean_reversion', 'sideways_bb_std_mult': 1.2677662670145926, 'sideways_rsi_os': 11, 'sideways_rsi_ob': 61, 'sideways_adx_thresh': 24.891661199975267, 'sideways_atr_min_pct': 0.008264950587767392, 'sideways_atr_max_pct': 0.07298323807035781, 'sideways_tp_mult': 2.4673596343368622, 'sideways_tsl_mult': 0.5575518344620666, 'sideways_time_stop': 155, 'sideways_use_sma': False, 'sideways_use_ema': False, 'sideways_use_atr': True, 'sideways_use_adx': False, 'sideways_use_spike': True, 'sideways_rsi_required': True}.
[I 2025-09-01 08:49:37,631] Trial 509 finished with values: [-1000000000.0, 1000000000.0] and parameters: {'p_sma': 51, 'p_std': 38, 'p_atr': 20, 'p_adx': 17, 'rsi_period': 37, 'ema1': 8, 'ema2': 59, 'slip_atr_k': 0.20006693133574183, 'slip_spread_k': 0.1299239146894187, 'spread_hl_frac': 0.019979524519505982, 'bb_std_mult': 2.5310314463903985, 'rsi_os': 50, 'rsi_ob': 94, 'vol_spike': 0.010559683861437321, 'adx_thresh': 33.29484268964469, 'atr_min_pct': 0.014850237876574489, 'atr_max_pct': 0.09351998170598574, 'tp_mult': 1.3198804158738087, 'tsl_mult': 0.18339367257188594, 'strategy': 'mean_reversion', 'time_stop': 41, 'use_sma': False, 'use_atr': False, 'use_adx': False, 'use_ema': False, 'use_spike': False, 'rsi_required': False, 'edge_k': 0.9390288397750929, 'edge_cap': 0.315932176466865, 'bull_strategy': 'breakout', 'bull_bb_std_mult': 2.3045309911995226, 'bull_rsi_os': 40, 'bull_rsi_ob': 53, 'bull_adx_thresh': 10.056808753825136, 'bull_atr_min_pct': 0.019993314608014463, 'bull_atr_max_pct': 0.08304906197870345, 'bull_tp_mult': 1.0398965962784492, 'bull_tsl_mult': 0.7953999104287335, 'bull_time_stop': 175, 'bull_use_sma': True, 'bull_use_ema': True, 'bull_use_atr': True, 'bull_use_adx': True, 'bull_use_spike': True, 'bull_rsi_required': False, 'bear_strategy': 'mean_reversion', 'bear_bb_std_mult': 3.365439320612371, 'bear_rsi_os': 43, 'bear_rsi_ob': 88, 'bear_adx_thresh': 12.163264385003819, 'bear_atr_min_pct': 0.015995326376635508, 'bear_atr_max_pct': 0.04651308510846397, 'bear_tp_mult': 2.693206799014994, 'bear_tsl_mult': 0.19044503853921346, 'bear_time_stop': 207, 'bear_use_sma': False, 'bear_use_ema': False, 'bear_use_atr': True, 'bear_use_adx': True, 'bear_use_spike': True, 'bear_rsi_required': True, 'sideways_strategy': 'breakout', 'sideways_bb_std_mult': 1.3363132388635548, 'sideways_rsi_os': 11, 'sideways_rsi_ob': 62, 'sideways_adx_thresh': 11.041014567720755, 'sideways_atr_min_pct': 0.006932392510568792, 'sideways_atr_max_pct': 0.0792751698590475, 'sideways_tp_mult': 2.3942340805698366, 'sideways_tsl_mult': 0.5165726267293935, 'sideways_time_stop': 165, 'sideways_use_sma': False, 'sideways_use_ema': False, 'sideways_use_atr': True, 'sideways_use_adx': False, 'sideways_use_spike': True, 'sideways_rsi_required': True}.
[I 2025-09-01 08:50:19,878] Trial 506 finished with values: [-1000000000.0, 1000000000.0] and parameters: {'p_sma': 54, 'p_std': 38, 'p_atr': 20, 'p_adx': 16, 'rsi_period': 41, 'ema1': 8, 'ema2': 59, 'slip_atr_k': 0.19682381493666132, 'slip_spread_k': 0.1188426409761907, 'spread_hl_frac': 0.019298630765325897, 'bb_std_mult': 2.647508481768398, 'rsi_os': 47, 'rsi_ob': 92, 'vol_spike': 0.00916589659803707, 'adx_thresh': 33.286203637204956, 'atr_min_pct': 0.015056609636127724, 'atr_max_pct': 0.08686029104354114, 'tp_mult': 1.2358967124123765, 'tsl_mult': 0.16297598695065368, 'strategy': 'mean_reversion', 'time_stop': 43, 'use_sma': False, 'use_atr': False, 'use_adx': False, 'use_ema': False, 'use_spike': False, 'rsi_required': False, 'edge_k': 0.9483586749256413, 'edge_cap': 0.3064976875787899, 'bull_strategy': 'breakout', 'bull_bb_std_mult': 2.4394355281591853, 'bull_rsi_os': 40, 'bull_rsi_ob': 55, 'bull_adx_thresh': 10.120764081754661, 'bull_atr_min_pct': 0.019997147116573626, 'bull_atr_max_pct': 0.07602024800761847, 'bull_tp_mult': 1.1294319058759923, 'bull_tsl_mult': 0.8134484335196069, 'bull_time_stop': 174, 'bull_use_sma': True, 'bull_use_ema': True, 'bull_use_atr': True, 'bull_use_adx': True, 'bull_use_spike': True, 'bull_rsi_required': False, 'bear_strategy': 'mean_reversion', 'bear_bb_std_mult': 3.2171270260908553, 'bear_rsi_os': 39, 'bear_rsi_ob': 91, 'bear_adx_thresh': 12.279208481199193, 'bear_atr_min_pct': 0.005963342889752667, 'bear_atr_max_pct': 0.04541679750793755, 'bear_tp_mult': 2.723188682480735, 'bear_tsl_mult': 0.2232343703333376, 'bear_time_stop': 207, 'bear_use_sma': False, 'bear_use_ema': False, 'bear_use_atr': True, 'bear_use_adx': True, 'bear_use_spike': True, 'bear_rsi_required': True, 'sideways_strategy': 'mean_reversion', 'sideways_bb_std_mult': 1.2805999073366725, 'sideways_rsi_os': 11, 'sideways_rsi_ob': 61, 'sideways_adx_thresh': 34.530035336082044, 'sideways_atr_min_pct': 0.008705573218443563, 'sideways_atr_max_pct': 0.07295955998640252, 'sideways_tp_mult': 2.450215514429538, 'sideways_tsl_mult': 0.514195235260785, 'sideways_time_stop': 153, 'sideways_use_sma': False, 'sideways_use_ema': False, 'sideways_use_atr': True, 'sideways_use_adx': False, 'sideways_use_spike': True, 'sideways_rsi_required': True}.
[I 2025-09-01 08:50:20,161] Trial 508 finished with values: [-1000000000.0, 1000000000.0] and parameters: {'p_sma': 50, 'p_std': 38, 'p_atr': 20, 'p_adx': 16, 'rsi_period': 42, 'ema1': 8, 'ema2': 59, 'slip_atr_k': 0.24308617257039628, 'slip_spread_k': 0.1306864566552772, 'spread_hl_frac': 0.0193452793392512, 'bb_std_mult': 2.542235189412011, 'rsi_os': 48, 'rsi_ob': 94, 'vol_spike': 0.012173305472744205, 'adx_thresh': 33.27655822047581, 'atr_min_pct': 0.011507108886244177, 'atr_max_pct': 0.08448312153532588, 'tp_mult': 1.2982406409960023, 'tsl_mult': 0.16850213990403023, 'strategy': 'mean_reversion', 'time_stop': 45, 'use_sma': False, 'use_atr': False, 'use_adx': False, 'use_ema': False, 'use_spike': False, 'rsi_required': False, 'edge_k': 0.8634583457784099, 'edge_cap': 0.3106557428430902, 'bull_strategy': 'breakout', 'bull_bb_std_mult': 2.2369283168222887, 'bull_rsi_os': 40, 'bull_rsi_ob': 55, 'bull_adx_thresh': 10.375333068920922, 'bull_atr_min_pct': 0.021475131137037435, 'bull_atr_max_pct': 0.08176614437158133, 'bull_tp_mult': 1.1386475656249582, 'bull_tsl_mult': 0.7129908289772142, 'bull_time_stop': 175, 'bull_use_sma': True, 'bull_use_ema': True, 'bull_use_atr': True, 'bull_use_adx': True, 'bull_use_spike': True, 'bull_rsi_required': False, 'bear_strategy': 'mean_reversion', 'bear_bb_std_mult': 3.344219308261964, 'bear_rsi_os': 55, 'bear_rsi_ob': 88, 'bear_adx_thresh': 12.327962716287592, 'bear_atr_min_pct': 0.021352963086574327, 'bear_atr_max_pct': 0.04652848544030225, 'bear_tp_mult': 2.7978976835684177, 'bear_tsl_mult': 0.2305678861865497, 'bear_time_stop': 220, 'bear_use_sma': False, 'bear_use_ema': False, 'bear_use_atr': True, 'bear_use_adx': True, 'bear_use_spike': True, 'bear_rsi_required': True, 'sideways_strategy': 'breakout', 'sideways_bb_std_mult': 1.3334063983110063, 'sideways_rsi_os': 11, 'sideways_rsi_ob': 59, 'sideways_adx_thresh': 34.58345097728869, 'sideways_atr_min_pct': 0.008939670906470753, 'sideways_atr_max_pct': 0.07440183934638255, 'sideways_tp_mult': 2.4051081099282405, 'sideways_tsl_mult': 0.5065863119297839, 'sideways_time_stop': 154, 'sideways_use_sma': False, 'sideways_use_ema': False, 'sideways_use_atr': True, 'sideways_use_adx': False, 'sideways_use_spike': True, 'sideways_rsi_required': True}.
[I 2025-09-01 08:50:20,605] Trial 507 finished with values: [-1000000000.0, 1000000000.0] and parameters: {'p_sma': 50, 'p_std': 38, 'p_atr': 20, 'p_adx': 17, 'rsi_period': 42, 'ema1': 8, 'ema2': 59, 'slip_atr_k': 0.012047208252241495, 'slip_spread_k': 0.1350295007197388, 'spread_hl_frac': 0.019331609483133116, 'bb_std_mult': 2.5443273959595607, 'rsi_os': 47, 'rsi_ob': 94, 'vol_spike': 0.008825021514711713, 'adx_thresh': 33.8930505513897, 'atr_min_pct': 0.011558993322395652, 'atr_max_pct': 0.08509951416058041, 'tp_mult': 1.2207273203733016, 'tsl_mult': 0.1510429944730877, 'strategy': 'mean_reversion', 'time_stop': 44, 'use_sma': False, 'use_atr': True, 'use_adx': False, 'use_ema': False, 'use_spike': False, 'rsi_required': False, 'edge_k': 0.9723867591568057, 'edge_cap': 0.30177963047267664, 'bull_strategy': 'mean_reversion', 'bull_bb_std_mult': 2.447001888073547, 'bull_rsi_os': 40, 'bull_rsi_ob': 55, 'bull_adx_thresh': 10.02989810283295, 'bull_atr_min_pct': 0.021560280691073304, 'bull_atr_max_pct': 0.08210877443436676, 'bull_tp_mult': 1.0451140528527814, 'bull_tsl_mult': 0.79251633186284, 'bull_time_stop': 174, 'bull_use_sma': True, 'bull_use_ema': True, 'bull_use_atr': True, 'bull_use_adx': True, 'bull_use_spike': True, 'bull_rsi_required': False, 'bear_strategy': 'mean_reversion', 'bear_bb_std_mult': 3.1710658855937206, 'bear_rsi_os': 31, 'bear_rsi_ob': 90, 'bear_adx_thresh': 12.195765976728214, 'bear_atr_min_pct': 0.01599445540748179, 'bear_atr_max_pct': 0.045402028543296544, 'bear_tp_mult': 2.6846755227837593, 'bear_tsl_mult': 0.19566981076892054, 'bear_time_stop': 205, 'bear_use_sma': False, 'bear_use_ema': True, 'bear_use_atr': True, 'bear_use_adx': True, 'bear_use_spike': True, 'bear_rsi_required': True, 'sideways_strategy': 'mean_reversion', 'sideways_bb_std_mult': 1.3388632777786222, 'sideways_rsi_os': 11, 'sideways_rsi_ob': 62, 'sideways_adx_thresh': 25.08937764819632, 'sideways_atr_min_pct': 0.008586324049728011, 'sideways_atr_max_pct': 0.07299497717307675, 'sideways_tp_mult': 2.4318970537022766, 'sideways_tsl_mult': 0.5126624812776223, 'sideways_time_stop': 153, 'sideways_use_sma': False, 'sideways_use_ema': False, 'sideways_use_atr': True, 'sideways_use_adx': False, 'sideways_use_spike': True, 'sideways_rsi_required': True}.
[I 2025-09-01 08:50:22,247] Trial 510 finished with values: [-1000000000.0, 1000000000.0] and parameters: {'p_sma': 50, 'p_std': 38, 'p_atr': 21, 'p_adx': 17, 'rsi_period': 42, 'ema1': 8, 'ema2': 59, 'slip_atr_k': 0.23190855939339688, 'slip_spread_k': 0.13233356720680683, 'spread_hl_frac': 0.017302012991743214, 'bb_std_mult': 2.528702458371451, 'rsi_os': 48, 'rsi_ob': 53, 'vol_spike': 0.012652493397864463, 'adx_thresh': 33.96455350180465, 'atr_min_pct': 0.015176788015742411, 'atr_max_pct': 0.09116691399837056, 'tp_mult': 1.2430537419562264, 'tsl_mult': 0.14526270531787763, 'strategy': 'mean_reversion', 'time_stop': 52, 'use_sma': False, 'use_atr': False, 'use_adx': False, 'use_ema': False, 'use_spike': False, 'rsi_required': False, 'edge_k': 0.8488013667009715, 'edge_cap': 0.3071007229711245, 'bull_strategy': 'breakout', 'bull_bb_std_mult': 2.2707821576592266, 'bull_rsi_os': 40, 'bull_rsi_ob': 55, 'bull_adx_thresh': 10.063729215928648, 'bull_atr_min_pct': 0.020006863024061516, 'bull_atr_max_pct': 0.077167168298398, 'bull_tp_mult': 1.1653866117042553, 'bull_tsl_mult': 0.8211970714560523, 'bull_time_stop': 180, 'bull_use_sma': True, 'bull_use_ema': True, 'bull_use_atr': True, 'bull_use_adx': True, 'bull_use_spike': True, 'bull_rsi_required': False, 'bear_strategy': 'mean_reversion', 'bear_bb_std_mult': 3.3592947256481263, 'bear_rsi_os': 55, 'bear_rsi_ob': 90, 'bear_adx_thresh': 12.34246746901512, 'bear_atr_min_pct': 0.01785469541709552, 'bear_atr_max_pct': 0.04491738857207398, 'bear_tp_mult': 2.803316756110878, 'bear_tsl_mult': 0.19897356972116853, 'bear_time_stop': 220, 'bear_use_sma': False, 'bear_use_ema': False, 'bear_use_atr': True, 'bear_use_adx': True, 'bear_use_spike': True, 'bear_rsi_required': True, 'sideways_strategy': 'breakout', 'sideways_bb_std_mult': 1.3189337825309653, 'sideways_rsi_os': 10, 'sideways_rsi_ob': 59, 'sideways_adx_thresh': 12.028289181697359, 'sideways_atr_min_pct': 0.007126573358934819, 'sideways_atr_max_pct': 0.0784634823177984, 'sideways_tp_mult': 2.4254121057471094, 'sideways_tsl_mult': 0.5853627044551707, 'sideways_time_stop': 153, 'sideways_use_sma': False, 'sideways_use_ema': False, 'sideways_use_atr': True, 'sideways_use_adx': False, 'sideways_use_spike': True, 'sideways_rsi_required': True}.
[I 2025-09-01 08:50:23,019] Trial 514 finished with values: [-1000000000.0, 1000000000.0] and parameters: {'p_sma': 43, 'p_std': 35, 'p_atr': 11, 'p_adx': 16, 'rsi_period': 40, 'ema1': 7, 'ema2': 58, 'slip_atr_k': 0.01119149222532083, 'slip_spread_k': 0.15250565105504982, 'spread_hl_frac': 0.022424343167541706, 'bb_std_mult': 2.597726466357309, 'rsi_os': 50, 'rsi_ob': 57, 'vol_spike': 0.0051618223687233955, 'adx_thresh': 34.359356502589, 'atr_min_pct': 0.02127786578633408, 'atr_max_pct': 0.09451746625582101, 'tp_mult': 1.1905621631272238, 'tsl_mult': 0.18315306946005652, 'strategy': 'mean_reversion', 'time_stop': 57, 'use_sma': False, 'use_atr': False, 'use_adx': False, 'use_ema': False, 'use_spike': False, 'rsi_required': False, 'edge_k': 0.9278983907224048, 'edge_cap': 0.2737195294738507, 'bull_strategy': 'breakout', 'bull_bb_std_mult': 2.401420609947729, 'bull_rsi_os': 41, 'bull_rsi_ob': 53, 'bull_adx_thresh': 11.001119509917123, 'bull_atr_min_pct': 0.02079598034515543, 'bull_atr_max_pct': 0.07557659031257288, 'bull_tp_mult': 1.1848885626773167, 'bull_tsl_mult': 0.8531524772670985, 'bull_time_stop': 181, 'bull_use_sma': False, 'bull_use_ema': True, 'bull_use_atr': True, 'bull_use_adx': True, 'bull_use_spike': True, 'bull_rsi_required': True, 'bear_strategy': 'breakout', 'bear_bb_std_mult': 3.2852482122646314, 'bear_rsi_os': 14, 'bear_rsi_ob': 88, 'bear_adx_thresh': 11.566552602673841, 'bear_atr_min_pct': 0.0057855802101189095, 'bear_atr_max_pct': 0.040606145909421486, 'bear_tp_mult': 2.799974050560802, 'bear_tsl_mult': 0.24663794295581765, 'bear_time_stop': 222, 'bear_use_sma': False, 'bear_use_ema': False, 'bear_use_atr': True, 'bear_use_adx': True, 'bear_use_spike': True, 'bear_rsi_required': True, 'sideways_strategy': 'breakout', 'sideways_bb_std_mult': 1.4230383781524627, 'sideways_rsi_os': 10, 'sideways_rsi_ob': 63, 'sideways_adx_thresh': 26.157498791696348, 'sideways_atr_min_pct': 0.0072127090469552195, 'sideways_atr_max_pct': 0.06766574090843594, 'sideways_tp_mult': 2.3610403634537556, 'sideways_tsl_mult': 0.6352049427743838, 'sideways_time_stop': 162, 'sideways_use_sma': False, 'sideways_use_ema': False, 'sideways_use_atr': True, 'sideways_use_adx': False, 'sideways_use_spike': True, 'sideways_rsi_required': True}.
[I 2025-09-01 08:51:04,353] Trial 512 finished with values: [-1000000000.0, 1000000000.0] and parameters: {'p_sma': 23, 'p_std': 36, 'p_atr': 14, 'p_adx': 17, 'rsi_period': 42, 'ema1': 7, 'ema2': 60, 'slip_atr_k': 0.23082486705743882, 'slip_spread_k': 0.15414854111586274, 'spread_hl_frac': 0.017133147633813003, 'bb_std_mult': 2.544810609432416, 'rsi_os': 48, 'rsi_ob': 53, 'vol_spike': 0.01395816991881401, 'adx_thresh': 34.180138764968895, 'atr_min_pct': 0.013009013967830281, 'atr_max_pct': 0.09439290628156245, 'tp_mult': 1.195040217014701, 'tsl_mult': 0.18569144689410183, 'strategy': 'mean_reversion', 'time_stop': 55, 'use_sma': False, 'use_atr': False, 'use_adx': False, 'use_ema': False, 'use_spike': False, 'rsi_required': False, 'edge_k': 0.841576004045812, 'edge_cap': 0.27505825998843925, 'bull_strategy': 'breakout', 'bull_bb_std_mult': 2.298530748109186, 'bull_rsi_os': 40, 'bull_rsi_ob': 54, 'bull_adx_thresh': 11.10341617382531, 'bull_atr_min_pct': 0.020759505880877396, 'bull_atr_max_pct': 0.07559433011611336, 'bull_tp_mult': 1.1725386593040423, 'bull_tsl_mult': 0.8555833912639093, 'bull_time_stop': 192, 'bull_use_sma': True, 'bull_use_ema': True, 'bull_use_atr': True, 'bull_use_adx': True, 'bull_use_spike': True, 'bull_rsi_required': False, 'bear_strategy': 'mean_reversion', 'bear_bb_std_mult': 3.319545746605393, 'bear_rsi_os': 23, 'bear_rsi_ob': 88, 'bear_adx_thresh': 12.82644869543172, 'bear_atr_min_pct': 0.017266667339189863, 'bear_atr_max_pct': 0.038798647314681335, 'bear_tp_mult': 2.8049321452039258, 'bear_tsl_mult': 0.2047171549159099, 'bear_time_stop': 220, 'bear_use_sma': False, 'bear_use_ema': False, 'bear_use_atr': True, 'bear_use_adx': True, 'bear_use_spike': True, 'bear_rsi_required': True, 'sideways_strategy': 'breakout', 'sideways_bb_std_mult': 1.3991936259271154, 'sideways_rsi_os': 10, 'sideways_rsi_ob': 63, 'sideways_adx_thresh': 27.17694804568886, 'sideways_atr_min_pct': 0.007387422509965889, 'sideways_atr_max_pct': 0.07830856661142122, 'sideways_tp_mult': 2.3767703743271085, 'sideways_tsl_mult': 0.41066362018678937, 'sideways_time_stop': 163, 'sideways_use_sma': False, 'sideways_use_ema': False, 'sideways_use_atr': True, 'sideways_use_adx': False, 'sideways_use_spike': True, 'sideways_rsi_required': True}.
