[I 2025-09-01 07:45:03,441] Trial 146 finished with values: [-0.020277134816737985, 0.020348870584909716] and parameters: {'p_sma': 46, 'p_std': 48, 'p_atr': 20, 'p_adx': 13, 'rsi_period': 45, 'ema1': 12, 'ema2': 12, 'slip_atr_k': 0.0030547720957169178, 'slip_spread_k': 0.42888957482432805, 'spread_hl_frac': 0.04843070337347637, 'bb_std_mult': 2.7551505939628047, 'rsi_os': 46, 'rsi_ob': 87, 'vol_spike': 0.014128573309325357, 'adx_thresh': 28.6400720409787, 'atr_min_pct': 0.020533515030823762, 'atr_max_pct': 0.10263391017055137, 'tp_mult': 1.612385612629546, 'tsl_mult': 0.8642318506617184, 'strategy': 'breakout', 'time_stop': 109, 'use_sma': False, 'use_atr': False, 'use_adx': True, 'use_ema': False, 'use_spike': False, 'rsi_required': True, 'edge_k': 1.9283593544912114, 'edge_cap': 0.16252380883513, 'bull_strategy': 'breakout', 'bull_bb_std_mult': 2.6197363698034493, 'bull_rsi_os': 8, 'bull_rsi_ob': 51, 'bull_adx_thresh': 13.840048970223975, 'bull_atr_min_pct': 0.0014931884811021847, 'bull_atr_max_pct': 0.055776800999692316, 'bull_tp_mult': 1.2365605857841897, 'bull_tsl_mult': 0.40744491904292635, 'bull_time_stop': 15, 'bull_use_sma': True, 'bull_use_ema': True, 'bull_use_atr': False, 'bull_use_adx': False, 'bull_use_spike': False, 'bull_rsi_required': False, 'bear_strategy': 'mean_reversion', 'bear_bb_std_mult': 2.027372362001433, 'bear_rsi_os': 51, 'bear_rsi_ob': 61, 'bear_adx_thresh': 22.43144064248972, 'bear_atr_min_pct': 0.011468951636147631, 'bear_atr_max_pct': 0.11068391727225892, 'bear_tp_mult': 1.5823507883045096, 'bear_tsl_mult': 0.15294678868021427, 'bear_time_stop': 94, 'bear_use_sma': True, 'bear_use_ema': False, 'bear_use_atr': False, 'bear_use_adx': False, 'bear_use_spike': False, 'bear_rsi_required': False, 'sideways_strategy': 'breakout', 'sideways_bb_std_mult': 0.9778672362189371, 'sideways_rsi_os': 42, 'sideways_rsi_ob': 46, 'sideways_adx_thresh': 13.585939081474146, 'sideways_atr_min_pct': 0.016023013366339923, 'sideways_atr_max_pct': 0.09586586451418655, 'sideways_tp_mult': 1.23786230123558, 'sideways_tsl_mult': 0.16444198812946798, 'sideways_time_stop': 82, 'sideways_use_sma': True, 'sideways_use_ema': False, 'sideways_use_atr': True, 'sideways_use_adx': True, 'sideways_use_spike': False, 'sideways_rsi_required': False}.
[I 2025-09-01 07:45:03,829] Trial 143 finished with values: [-1000000000.0, 1000000000.0] and parameters: {'p_sma': 44, 'p_std': 49, 'p_atr': 27, 'p_adx': 13, 'rsi_period': 43, 'ema1': 11, 'ema2': 10, 'slip_atr_k': 0.005067559101949764, 'slip_spread_k': 0.4126312377741868, 'spread_hl_frac': 0.01879648149891383, 'bb_std_mult': 2.634038924225876, 'rsi_os': 50, 'rsi_ob': 87, 'vol_spike': 0.00037367459764268106, 'adx_thresh': 31.398216049856288, 'atr_min_pct': 0.02548775563815843, 'atr_max_pct': 0.04369358222075457, 'tp_mult': 1.495458512620213, 'tsl_mult': 0.6488614237313678, 'strategy': 'breakout', 'time_stop': 115, 'use_sma': False, 'use_atr': True, 'use_adx': True, 'use_ema': True, 'use_spike': True, 'rsi_required': True, 'edge_k': 1.9891564983560075, 'edge_cap': 0.15953650247760842, 'bull_strategy': 'mean_reversion', 'bull_bb_std_mult': 2.6077753423249606, 'bull_rsi_os': 14, 'bull_rsi_ob': 57, 'bull_adx_thresh': 17.538826828067055, 'bull_atr_min_pct': 0.00379755988905043, 'bull_atr_max_pct': 0.05586830475186996, 'bull_tp_mult': 1.2245421051117362, 'bull_tsl_mult': 0.39518769254020847, 'bull_time_stop': 15, 'bull_use_sma': True, 'bull_use_ema': True, 'bull_use_atr': False, 'bull_use_adx': False, 'bull_use_spike': False, 'bull_rsi_required': False, 'bear_strategy': 'mean_reversion', 'bear_bb_std_mult': 1.9856740154007624, 'bear_rsi_os': 50, 'bear_rsi_ob': 64, 'bear_adx_thresh': 14.332927927699837, 'bear_atr_min_pct': 0.011888203727531455, 'bear_atr_max_pct': 0.11074841615111447, 'bear_tp_mult': 1.8158888526235053, 'bear_tsl_mult': 0.12784668354784018, 'bear_time_stop': 111, 'bear_use_sma': True, 'bear_use_ema': False, 'bear_use_atr': False, 'bear_use_adx': False, 'bear_use_spike': False, 'bear_rsi_required': True, 'sideways_strategy': 'breakout', 'sideways_bb_std_mult': 1.1691709033362365, 'sideways_rsi_os': 46, 'sideways_rsi_ob': 47, 'sideways_adx_thresh': 13.679731540309197, 'sideways_atr_min_pct': 0.01656987963984708, 'sideways_atr_max_pct': 0.014353168046423562, 'sideways_tp_mult': 1.8322071902126145, 'sideways_tsl_mult': 0.1688067339310072, 'sideways_time_stop': 103, 'sideways_use_sma': True, 'sideways_use_ema': True, 'sideways_use_atr': False, 'sideways_use_adx': True, 'sideways_use_spike': False, 'sideways_rsi_required': False}.
[I 2025-09-01 07:45:03,995] Trial 144 finished with values: [-1000000000.0, 1000000000.0] and parameters: {'p_sma': 46, 'p_std': 48, 'p_atr': 22, 'p_adx': 13, 'rsi_period': 42, 'ema1': 11, 'ema2': 10, 'slip_atr_k': 0.01635088759003191, 'slip_spread_k': 0.4237233316730282, 'spread_hl_frac': 0.04838715692871341, 'bb_std_mult': 2.665644577875567, 'rsi_os': 46, 'rsi_ob': 83, 'vol_spike': 0.01302642982419116, 'adx_thresh': 34.63745580072031, 'atr_min_pct': 0.024989362780414706, 'atr_max_pct': 0.14241955977797321, 'tp_mult': 1.6070980383144398, 'tsl_mult': 0.6680659387185632, 'strategy': 'breakout', 'time_stop': 87, 'use_sma': False, 'use_atr': True, 'use_adx': True, 'use_ema': True, 'use_spike': True, 'rsi_required': False, 'edge_k': 1.9866905151030496, 'edge_cap': 0.18699715464934727, 'bull_strategy': 'mean_reversion', 'bull_bb_std_mult': 1.9338382887479721, 'bull_rsi_os': 14, 'bull_rsi_ob': 57, 'bull_adx_thresh': 17.244579764384092, 'bull_atr_min_pct': 0.003609412151765546, 'bull_atr_max_pct': 0.13229941008533347, 'bull_tp_mult': 1.2195144352521572, 'bull_tsl_mult': 0.40418075843476214, 'bull_time_stop': 42, 'bull_use_sma': True, 'bull_use_ema': True, 'bull_use_atr': False, 'bull_use_adx': False, 'bull_use_spike': False, 'bull_rsi_required': False, 'bear_strategy': 'mean_reversion', 'bear_bb_std_mult': 2.0077383126486703, 'bear_rsi_os': 50, 'bear_rsi_ob': 61, 'bear_adx_thresh': 13.852625997087568, 'bear_atr_min_pct': 0.009857466266122175, 'bear_atr_max_pct': 0.11057476737065078, 'bear_tp_mult': 1.598065358545676, 'bear_tsl_mult': 0.13514709879055045, 'bear_time_stop': 112, 'bear_use_sma': True, 'bear_use_ema': False, 'bear_use_atr': False, 'bear_use_adx': False, 'bear_use_spike': False, 'bear_rsi_required': True, 'sideways_strategy': 'breakout', 'sideways_bb_std_mult': 1.1228825632136954, 'sideways_rsi_os': 47, 'sideways_rsi_ob': 47, 'sideways_adx_thresh': 15.270693064626439, 'sideways_atr_min_pct': 0.01688548642056169, 'sideways_atr_max_pct': 0.09480663792681289, 'sideways_tp_mult': 1.8260464201248074, 'sideways_tsl_mult': 0.17021755151995957, 'sideways_time_stop': 93, 'sideways_use_sma': False, 'sideways_use_ema': True, 'sideways_use_atr': False, 'sideways_use_adx': True, 'sideways_use_spike': False, 'sideways_rsi_required': False}.
[I 2025-09-01 07:45:43,910] Trial 148 finished with values: [-1000000000.0, 1000000000.0] and parameters: {'p_sma': 42, 'p_std': 43, 'p_atr': 12, 'p_adx': 16, 'rsi_period': 38, 'ema1': 11, 'ema2': 10, 'slip_atr_k': 0.028234001359796562, 'slip_spread_k': 0.4026561712143043, 'spread_hl_frac': 0.020700229647716784, 'bb_std_mult': 2.6626865771178765, 'rsi_os': 42, 'rsi_ob': 83, 'vol_spike': 0.08468312252616432, 'adx_thresh': 31.46537060221334, 'atr_min_pct': 0.02752635182838094, 'atr_max_pct': 0.12184352040693738, 'tp_mult': 2.0029572293628917, 'tsl_mult': 0.9693154790315648, 'strategy': 'mean_reversion', 'time_stop': 68, 'use_sma': False, 'use_atr': False, 'use_adx': True, 'use_ema': False, 'use_spike': False, 'rsi_required': False, 'edge_k': 1.8753070907912643, 'edge_cap': 0.18159860127871963, 'bull_strategy': 'breakout', 'bull_bb_std_mult': 0.6993205111702816, 'bull_rsi_os': 22, 'bull_rsi_ob': 57, 'bull_adx_thresh': 20.80967644719754, 'bull_atr_min_pct': 0.023629882517671785, 'bull_atr_max_pct': 0.05764297349621701, 'bull_tp_mult': 1.3834519383791526, 'bull_tsl_mult': 0.48617056883554854, 'bull_time_stop': 65, 'bull_use_sma': True, 'bull_use_ema': True, 'bull_use_atr': True, 'bull_use_adx': True, 'bull_use_spike': False, 'bull_rsi_required': False, 'bear_strategy': 'mean_reversion', 'bear_bb_std_mult': 1.8958592066612534, 'bear_rsi_os': 49, 'bear_rsi_ob': 66, 'bear_adx_thresh': 21.84286044197863, 'bear_atr_min_pct': 0.006765116785724542, 'bear_atr_max_pct': 0.09605958103828727, 'bear_tp_mult': 1.47766828269052, 'bear_tsl_mult': 0.11375859847117378, 'bear_time_stop': 107, 'bear_use_sma': True, 'bear_use_ema': False, 'bear_use_atr': False, 'bear_use_adx': True, 'bear_use_spike': True, 'bear_rsi_required': False, 'sideways_strategy': 'breakout', 'sideways_bb_std_mult': 1.1681226247242336, 'sideways_rsi_os': 26, 'sideways_rsi_ob': 47, 'sideways_adx_thresh': 16.45802429415661, 'sideways_atr_min_pct': 0.017946874459535342, 'sideways_atr_max_pct': 0.01814001885042754, 'sideways_tp_mult': 2.238160355662018, 'sideways_tsl_mult': 0.25858526899319745, 'sideways_time_stop': 107, 'sideways_use_sma': False, 'sideways_use_ema': False, 'sideways_use_atr': True, 'sideways_use_adx': True, 'sideways_use_spike': False, 'sideways_rsi_required': False}.
[I 2025-09-01 07:45:44,838] Trial 147 finished with values: [-0.024269635387785038, 0.024221244101181236] and parameters: {'p_sma': 42, 'p_std': 44, 'p_atr': 27, 'p_adx': 16, 'rsi_period': 51, 'ema1': 12, 'ema2': 10, 'slip_atr_k': 0.027752654077094256, 'slip_spread_k': 0.41843164349674516, 'spread_hl_frac': 0.020537701810388345, 'bb_std_mult': 2.641666635260077, 'rsi_os': 42, 'rsi_ob': 86, 'vol_spike': 0.06726003040517856, 'adx_thresh': 28.7099087764434, 'atr_min_pct': 0.025868133021763173, 'atr_max_pct': 0.07354597520675293, 'tp_mult': 1.4294524807898152, 'tsl_mult': 0.8670594725405538, 'strategy': 'breakout', 'time_stop': 101, 'use_sma': False, 'use_atr': False, 'use_adx': True, 'use_ema': False, 'use_spike': False, 'rsi_required': False, 'edge_k': 1.8948568746265704, 'edge_cap': 0.1846922372873261, 'bull_strategy': 'breakout', 'bull_bb_std_mult': 2.603822465775135, 'bull_rsi_os': 8, 'bull_rsi_ob': 57, 'bull_adx_thresh': 23.0356594718988, 'bull_atr_min_pct': 0.00010238921171859885, 'bull_atr_max_pct': 0.05693304611366172, 'bull_tp_mult': 1.4641821976792615, 'bull_tsl_mult': 0.47904277440748333, 'bull_time_stop': 25, 'bull_use_sma': True, 'bull_use_ema': True, 'bull_use_atr': False, 'bull_use_adx': False, 'bull_use_spike': False, 'bull_rsi_required': False, 'bear_strategy': 'mean_reversion', 'bear_bb_std_mult': 1.8926154626405047, 'bear_rsi_os': 49, 'bear_rsi_ob': 63, 'bear_adx_thresh': 22.52628415370236, 'bear_atr_min_pct': 0.011256755207227279, 'bear_atr_max_pct': 0.09640036161869692, 'bear_tp_mult': 1.3503955343586667, 'bear_tsl_mult': 0.12268121077306099, 'bear_time_stop': 109, 'bear_use_sma': True, 'bear_use_ema': False, 'bear_use_atr': False, 'bear_use_adx': False, 'bear_use_spike': False, 'bear_rsi_required': False, 'sideways_strategy': 'breakout', 'sideways_bb_std_mult': 1.1930841234903826, 'sideways_rsi_os': 44, 'sideways_rsi_ob': 46, 'sideways_adx_thresh': 16.267193110227566, 'sideways_atr_min_pct': 0.017667490839401796, 'sideways_atr_max_pct': 0.1499530673633962, 'sideways_tp_mult': 2.2846071085565516, 'sideways_tsl_mult': 0.24125176996061495, 'sideways_time_stop': 81, 'sideways_use_sma': False, 'sideways_use_ema': False, 'sideways_use_atr': True, 'sideways_use_adx': True, 'sideways_use_spike': False, 'sideways_rsi_required': False}.
[I 2025-09-01 07:45:45,394] Trial 150 finished with values: [-0.02403091067081875, 0.02509899691225794] and parameters: {'p_sma': 42, 'p_std': 43, 'p_atr': 12, 'p_adx': 16, 'rsi_period': 40, 'ema1': 12, 'ema2': 11, 'slip_atr_k': 0.02896638881431116, 'slip_spread_k': 0.36120459406118155, 'spread_hl_frac': 0.020443394069823505, 'bb_std_mult': 2.8618712338478587, 'rsi_os': 42, 'rsi_ob': 85, 'vol_spike': 0.08502137285267707, 'adx_thresh': 28.8337778039239, 'atr_min_pct': 0.02611321981483061, 'atr_max_pct': 0.07472974129836372, 'tp_mult': 1.0301910453071552, 'tsl_mult': 0.7061959053844249, 'strategy': 'mean_reversion', 'time_stop': 100, 'use_sma': True, 'use_atr': False, 'use_adx': True, 'use_ema': False, 'use_spike': False, 'rsi_required': False, 'edge_k': 1.8691463918173337, 'edge_cap': 0.795943711139048, 'bull_strategy': 'breakout', 'bull_bb_std_mult': 1.6621208274567318, 'bull_rsi_os': 22, 'bull_rsi_ob': 53, 'bull_adx_thresh': 22.79630726567072, 'bull_atr_min_pct': 7.475476024620085e-05, 'bull_atr_max_pct': 0.05925159731739042, 'bull_tp_mult': 1.4669431465443332, 'bull_tsl_mult': 0.4821481593430752, 'bull_time_stop': 56, 'bull_use_sma': True, 'bull_use_ema': True, 'bull_use_atr': True, 'bull_use_adx': True, 'bull_use_spike': False, 'bull_rsi_required': False, 'bear_strategy': 'mean_reversion', 'bear_bb_std_mult': 1.86591978450003, 'bear_rsi_os': 48, 'bear_rsi_ob': 66, 'bear_adx_thresh': 21.779982705281824, 'bear_atr_min_pct': 0.008060916127546652, 'bear_atr_max_pct': 0.09575300824011385, 'bear_tp_mult': 1.4839832236622348, 'bear_tsl_mult': 0.252368167559891, 'bear_time_stop': 103, 'bear_use_sma': True, 'bear_use_ema': False, 'bear_use_atr': False, 'bear_use_adx': True, 'bear_use_spike': True, 'bear_rsi_required': False, 'sideways_strategy': 'breakout', 'sideways_bb_std_mult': 0.8333613380537328, 'sideways_rsi_os': 43, 'sideways_rsi_ob': 45, 'sideways_adx_thresh': 16.71128773267046, 'sideways_atr_min_pct': 0.0183008940888579, 'sideways_atr_max_pct': 0.01820299793967199, 'sideways_tp_mult': 2.2553657617288714, 'sideways_tsl_mult': 0.24552784636586267, 'sideways_time_stop': 85, 'sideways_use_sma': False, 'sideways_use_ema': False, 'sideways_use_atr': True, 'sideways_use_adx': True, 'sideways_use_spike': False, 'sideways_rsi_required': False}.
[I 2025-09-01 07:45:45,712] Trial 149 finished with values: [-1000000000.0, 1000000000.0] and parameters: {'p_sma': 40, 'p_std': 44, 'p_atr': 12, 'p_adx': 16, 'rsi_period': 40, 'ema1': 10, 'ema2': 11, 'slip_atr_k': 0.02593595300123694, 'slip_spread_k': 0.20405322957694627, 'spread_hl_frac': 0.036511331212893454, 'bb_std_mult': 2.9133230930651126, 'rsi_os': 42, 'rsi_ob': 85, 'vol_spike': 0.08545598007404659, 'adx_thresh': 32.14718326746189, 'atr_min_pct': 0.02755125934594857, 'atr_max_pct': 0.07068856710209023, 'tp_mult': 1.0821349515343983, 'tsl_mult': 0.585718862648014, 'strategy': 'mean_reversion', 'time_stop': 102, 'use_sma': True, 'use_atr': False, 'use_adx': True, 'use_ema': False, 'use_spike': False, 'rsi_required': False, 'edge_k': 1.8703594790992626, 'edge_cap': 0.05087465445253603, 'bull_strategy': 'breakout', 'bull_bb_std_mult': 2.1622275121653427, 'bull_rsi_os': 20, 'bull_rsi_ob': 91, 'bull_adx_thresh': 21.734516366854464, 'bull_atr_min_pct': 0.025184997424154816, 'bull_atr_max_pct': 0.11022311342332487, 'bull_tp_mult': 1.371117437365887, 'bull_tsl_mult': 0.4824016483226826, 'bull_time_stop': 27, 'bull_use_sma': True, 'bull_use_ema': True, 'bull_use_atr': True, 'bull_use_adx': True, 'bull_use_spike': False, 'bull_rsi_required': False, 'bear_strategy': 'mean_reversion', 'bear_bb_std_mult': 1.834497480918806, 'bear_rsi_os': 48, 'bear_rsi_ob': 66, 'bear_adx_thresh': 11.461526030884592, 'bear_atr_min_pct': 0.007077457928253865, 'bear_atr_max_pct': 0.10433307306212841, 'bear_tp_mult': 1.4897290245146584, 'bear_tsl_mult': 0.21747958344851417, 'bear_time_stop': 105, 'bear_use_sma': True, 'bear_use_ema': False, 'bear_use_atr': False, 'bear_use_adx': True, 'bear_use_spike': True, 'bear_rsi_required': False, 'sideways_strategy': 'breakout', 'sideways_bb_std_mult': 1.2902388390698287, 'sideways_rsi_os': 43, 'sideways_rsi_ob': 45, 'sideways_adx_thresh': 16.715539111234957, 'sideways_atr_min_pct': 0.018137053356073282, 'sideways_atr_max_pct': 0.018533360949591272, 'sideways_tp_mult': 1.3960243161094517, 'sideways_tsl_mult': 0.2399436178069108, 'sideways_time_stop': 74, 'sideways_use_sma': False, 'sideways_use_ema': False, 'sideways_use_atr': True, 'sideways_use_adx': True, 'sideways_use_spike': False, 'sideways_rsi_required': False}.
[I 2025-09-01 07:46:27,548] Trial 153 finished with values: [-1000000000.0, 1000000000.0] and parameters: {'p_sma': 48, 'p_std': 46, 'p_atr': 28, 'p_adx': 18, 'rsi_period': 41, 'ema1': 10, 'ema2': 12, 'slip_atr_k': 0.04127133883792086, 'slip_spread_k': 0.10492353293222562, 'spread_hl_frac': 0.01547918899499391, 'bb_std_mult': 2.7601011369742667, 'rsi_os': 48, 'rsi_ob': 81, 'vol_spike': 0.03482007851347573, 'adx_thresh': 32.485367467776044, 'atr_min_pct': 0.027339436953852443, 'atr_max_pct': 0.11033151309903053, 'tp_mult': 2.333517808885334, 'tsl_mult': 0.5241147495826529, 'strategy': 'breakout', 'time_stop': 118, 'use_sma': False, 'use_atr': False, 'use_adx': True, 'use_ema': False, 'use_spike': False, 'rsi_required': False, 'edge_k': 1.9435211997824413, 'edge_cap': 0.22160092406784407, 'bull_strategy': 'breakout', 'bull_bb_std_mult': 2.170684863071018, 'bull_rsi_os': 6, 'bull_rsi_ob': 91, 'bull_adx_thresh': 21.662765519909357, 'bull_atr_min_pct': 0.01663646129509292, 'bull_atr_max_pct': 0.0247194037119711, 'bull_tp_mult': 1.0103781414003388, 'bull_tsl_mult': 0.5232143938761665, 'bull_time_stop': 70, 'bull_use_sma': True, 'bull_use_ema': False, 'bull_use_atr': False, 'bull_use_adx': False, 'bull_use_spike': False, 'bull_rsi_required': False, 'bear_strategy': 'mean_reversion', 'bear_bb_std_mult': 1.8135912271713326, 'bear_rsi_os': 54, 'bear_rsi_ob': 84, 'bear_adx_thresh': 20.415660590334717, 'bear_atr_min_pct': 0.008298473700700412, 'bear_atr_max_pct': 0.10492987971126588, 'bear_tp_mult': 1.3381046037884385, 'bear_tsl_mult': 0.07077102348182002, 'bear_time_stop': 122, 'bear_use_sma': True, 'bear_use_ema': True, 'bear_use_atr': False, 'bear_use_adx': False, 'bear_use_spike': False, 'bear_rsi_required': False, 'sideways_strategy': 'breakout', 'sideways_bb_std_mult': 1.270126989020742, 'sideways_rsi_os': 18, 'sideways_rsi_ob': 48, 'sideways_adx_thresh': 17.283407250364384, 'sideways_atr_min_pct': 0.018583784523265777, 'sideways_atr_max_pct': 0.08748690486973482, 'sideways_tp_mult': 2.938973607290243, 'sideways_tsl_mult': 0.29581306091316706, 'sideways_time_stop': 129, 'sideways_use_sma': False, 'sideways_use_ema': False, 'sideways_use_atr': True, 'sideways_use_adx': True, 'sideways_use_spike': False, 'sideways_rsi_required': False}.
[I 2025-09-01 07:46:28,556] Trial 152 finished with values: [-1000000000.0, 1000000000.0] and parameters: {'p_sma': 47, 'p_std': 46, 'p_atr': 21, 'p_adx': 18, 'rsi_period': 39, 'ema1': 12, 'ema2': 12, 'slip_atr_k': 0.03556136437528151, 'slip_spread_k': 0.35717015148545944, 'spread_hl_frac': 0.014976116943897546, 'bb_std_mult': 2.8807039337153184, 'rsi_os': 43, 'rsi_ob': 81, 'vol_spike': 0.03562938934432619, 'adx_thresh': 32.79136427738247, 'atr_min_pct': 0.02676879635591736, 'atr_max_pct': 0.11490844926159052, 'tp_mult': 1.3113264316621007, 'tsl_mult': 0.6930887836371152, 'strategy': 'mean_reversion', 'time_stop': 119, 'use_sma': True, 'use_atr': False, 'use_adx': True, 'use_ema': False, 'use_spike': False, 'rsi_required': False, 'edge_k': 1.7501021718026848, 'edge_cap': 0.2309548534045167, 'bull_strategy': 'breakout', 'bull_bb_std_mult': 2.456433771719364, 'bull_rsi_os': 20, 'bull_rsi_ob': 54, 'bull_adx_thresh': 10.332057319579961, 'bull_atr_min_pct': 0.0065444387061393255, 'bull_atr_max_pct': 0.03202986837011371, 'bull_tp_mult': 1.5867068015688535, 'bull_tsl_mult': 0.5316552328277182, 'bull_time_stop': 57, 'bull_use_sma': True, 'bull_use_ema': False, 'bull_use_atr': True, 'bull_use_adx': True, 'bull_use_spike': False, 'bull_rsi_required': False, 'bear_strategy': 'mean_reversion', 'bear_bb_std_mult': 1.8219793401098396, 'bear_rsi_os': 53, 'bear_rsi_ob': 83, 'bear_adx_thresh': 11.65227570449498, 'bear_atr_min_pct': 0.008475397577491744, 'bear_atr_max_pct': 0.10559695631913575, 'bear_tp_mult': 1.461398581372253, 'bear_tsl_mult': 0.23211838629815773, 'bear_time_stop': 75, 'bear_use_sma': True, 'bear_use_ema': True, 'bear_use_atr': False, 'bear_use_adx': True, 'bear_use_spike': True, 'bear_rsi_required': False, 'sideways_strategy': 'breakout', 'sideways_bb_std_mult': 1.2906236730845908, 'sideways_rsi_os': 42, 'sideways_rsi_ob': 45, 'sideways_adx_thresh': 17.08213211819573, 'sideways_atr_min_pct': 0.018594070828106546, 'sideways_atr_max_pct': 0.08764014664854908, 'sideways_tp_mult': 2.950700879250299, 'sideways_tsl_mult': 0.13741643044843835, 'sideways_time_stop': 126, 'sideways_use_sma': False, 'sideways_use_ema': False, 'sideways_use_atr': True, 'sideways_use_adx': True, 'sideways_use_spike': False, 'sideways_rsi_required': False}.
