[I 2025-09-01 07:57:06,662] Trial 216 finished with values: [-0.059127495342810255, 0.05898299288126619] and parameters: {'p_sma': 30, 'p_std': 49, 'p_atr': 7, 'p_adx': 29, 'rsi_period': 56, 'ema1': 14, 'ema2': 16, 'slip_atr_k': 0.18367406869908753, 'slip_spread_k': 0.9022904522262412, 'spread_hl_frac': 0.01439567201657458, 'bb_std_mult': 2.029358375214663, 'rsi_os': 35, 'rsi_ob': 95, 'vol_spike': 0.05189328169509759, 'adx_thresh': 28.706918477304416, 'atr_min_pct': 0.003426420990881601, 'atr_max_pct': 0.09340462585441243, 'tp_mult': 1.9606340730771015, 'tsl_mult': 0.05210182952345533, 'strategy': 'breakout', 'time_stop': 219, 'use_sma': False, 'use_atr': False, 'use_adx': True, 'use_ema': True, 'use_spike': True, 'rsi_required': True, 'edge_k': 0.3897900182087771, 'edge_cap': 0.22777883475944377, 'bull_strategy': 'breakout', 'bull_bb_std_mult': 3.1853597814927492, 'bull_rsi_os': 46, 'bull_rsi_ob': 49, 'bull_adx_thresh': 8.71090419877132, 'bull_atr_min_pct': 0.0025544859064322188, 'bull_atr_max_pct': 0.10714231717611714, 'bull_tp_mult': 1.5120326131181714, 'bull_tsl_mult': 0.6614875503911648, 'bull_time_stop': 78, 'bull_use_sma': True, 'bull_use_ema': False, 'bull_use_atr': False, 'bull_use_adx': False, 'bull_use_spike': False, 'bull_rsi_required': False, 'bear_strategy': 'mean_reversion', 'bear_bb_std_mult': 1.7664075703199669, 'bear_rsi_os': 44, 'bear_rsi_ob': 77, 'bear_adx_thresh': 5.558968044922593, 'bear_atr_min_pct': 0.005037193823738162, 'bear_atr_max_pct': 0.0743847995099969, 'bear_tp_mult': 2.221086589372857, 'bear_tsl_mult': 0.07172938702816056, 'bear_time_stop': 286, 'bear_use_sma': True, 'bear_use_ema': False, 'bear_use_atr': True, 'bear_use_adx': False, 'bear_use_spike': False, 'bear_rsi_required': False, 'sideways_strategy': 'breakout', 'sideways_bb_std_mult': 0.8651403904207764, 'sideways_rsi_os': 5, 'sideways_rsi_ob': 94, 'sideways_adx_thresh': 7.222518267339508, 'sideways_atr_min_pct': 0.028904362952682873, 'sideways_atr_max_pct': 0.016256856138762633, 'sideways_tp_mult': 1.3695354753931308, 'sideways_tsl_mult': 0.3146928465133444, 'sideways_time_stop': 162, 'sideways_use_sma': True, 'sideways_use_ema': True, 'sideways_use_atr': True, 'sideways_use_adx': True, 'sideways_use_spike': False, 'sideways_rsi_required': False}.
[I 2025-09-01 07:57:06,977] Trial 217 finished with values: [-0.0060056433018033095, 0.010002991931030153] and parameters: {'p_sma': 30, 'p_std': 51, 'p_atr': 23, 'p_adx': 29, 'rsi_period': 61, 'ema1': 14, 'ema2': 16, 'slip_atr_k': 0.07434887756809445, 'slip_spread_k': 0.8790306966258326, 'spread_hl_frac': 0.013772915255907037, 'bb_std_mult': 2.0476945957186774, 'rsi_os': 32, 'rsi_ob': 93, 'vol_spike': 0.046512734167519845, 'adx_thresh': 7.68590853840967, 'atr_min_pct': 0.006675289209630678, 'atr_max_pct': 0.08156565829783204, 'tp_mult': 1.7842338975013015, 'tsl_mult': 0.054035719601168035, 'strategy': 'breakout', 'time_stop': 221, 'use_sma': False, 'use_atr': False, 'use_adx': True, 'use_ema': True, 'use_spike': True, 'rsi_required': True, 'edge_k': 0.08358494537604833, 'edge_cap': 0.2304469514817822, 'bull_strategy': 'breakout', 'bull_bb_std_mult': 3.1523584408090786, 'bull_rsi_os': 46, 'bull_rsi_ob': 49, 'bull_adx_thresh': 8.636632101326398, 'bull_atr_min_pct': 0.0038580912350565507, 'bull_atr_max_pct': 0.02348840855730961, 'bull_tp_mult': 1.504077088468773, 'bull_tsl_mult': 0.6568871093054175, 'bull_time_stop': 77, 'bull_use_sma': True, 'bull_use_ema': False, 'bull_use_atr': False, 'bull_use_adx': False, 'bull_use_spike': False, 'bull_rsi_required': False, 'bear_strategy': 'mean_reversion', 'bear_bb_std_mult': 1.76045483489809, 'bear_rsi_os': 45, 'bear_rsi_ob': 76, 'bear_adx_thresh': 6.979940824736563, 'bear_atr_min_pct': 0.005221445044883846, 'bear_atr_max_pct': 0.144402061970348, 'bear_tp_mult': 2.123210978830466, 'bear_tsl_mult': 0.07363021300344297, 'bear_time_stop': 288, 'bear_use_sma': True, 'bear_use_ema': False, 'bear_use_atr': True, 'bear_use_adx': False, 'bear_use_spike': False, 'bear_rsi_required': False, 'sideways_strategy': 'breakout', 'sideways_bb_std_mult': 0.8667168068216209, 'sideways_rsi_os': 10, 'sideways_rsi_ob': 94, 'sideways_adx_thresh': 21.020820470579537, 'sideways_atr_min_pct': 0.028736480423761184, 'sideways_atr_max_pct': 0.018273124385765553, 'sideways_tp_mult': 1.3670466716788563, 'sideways_tsl_mult': 0.31165659083063935, 'sideways_time_stop': 150, 'sideways_use_sma': True, 'sideways_use_ema': True, 'sideways_use_atr': True, 'sideways_use_adx': True, 'sideways_use_spike': False, 'sideways_rsi_required': False}.
[I 2025-09-01 07:57:07,158] Trial 218 finished with values: [-1000000000.0, 1000000000.0] and parameters: {'p_sma': 28, 'p_std': 51, 'p_atr': 23, 'p_adx': 30, 'rsi_period': 57, 'ema1': 14, 'ema2': 26, 'slip_atr_k': 0.06983859622084891, 'slip_spread_k': 0.8961117409525827, 'spread_hl_frac': 0.013501133038232277, 'bb_std_mult': 3.3145172338346742, 'rsi_os': 34, 'rsi_ob': 90, 'vol_spike': 0.050455624302196675, 'adx_thresh': 26.928885584662076, 'atr_min_pct': 0.0033135500648747507, 'atr_max_pct': 0.09209389855584593, 'tp_mult': 1.9738837613958342, 'tsl_mult': 0.05303386607796018, 'strategy': 'breakout', 'time_stop': 232, 'use_sma': False, 'use_atr': False, 'use_adx': True, 'use_ema': True, 'use_spike': True, 'rsi_required': True, 'edge_k': 0.3685833509813333, 'edge_cap': 0.22973492615202187, 'bull_strategy': 'breakout', 'bull_bb_std_mult': 3.1458956478876345, 'bull_rsi_os': 46, 'bull_rsi_ob': 70, 'bull_adx_thresh': 8.555621944266582, 'bull_atr_min_pct': 0.009134296851467537, 'bull_atr_max_pct': 0.023340784096114113, 'bull_tp_mult': 1.6536953296190908, 'bull_tsl_mult': 0.5766527477190707, 'bull_time_stop': 78, 'bull_use_sma': True, 'bull_use_ema': False, 'bull_use_atr': False, 'bull_use_adx': False, 'bull_use_spike': False, 'bull_rsi_required': False, 'bear_strategy': 'mean_reversion', 'bear_bb_std_mult': 1.7698754996507364, 'bear_rsi_os': 44, 'bear_rsi_ob': 79, 'bear_adx_thresh': 5.645983649103059, 'bear_atr_min_pct': 0.005006541631890996, 'bear_atr_max_pct': 0.08393469662220411, 'bear_tp_mult': 2.2199969926834404, 'bear_tsl_mult': 0.07209715084090029, 'bear_time_stop': 287, 'bear_use_sma': True, 'bear_use_ema': False, 'bear_use_atr': True, 'bear_use_adx': False, 'bear_use_spike': False, 'bear_rsi_required': False, 'sideways_strategy': 'breakout', 'sideways_bb_std_mult': 0.8832645016078225, 'sideways_rsi_os': 8, 'sideways_rsi_ob': 94, 'sideways_adx_thresh': 7.305875386362684, 'sideways_atr_min_pct': 0.029003918200813026, 'sideways_atr_max_pct': 0.13990367366178857, 'sideways_tp_mult': 1.359461643725008, 'sideways_tsl_mult': 0.020989445103560336, 'sideways_time_stop': 153, 'sideways_use_sma': True, 'sideways_use_ema': True, 'sideways_use_atr': True, 'sideways_use_adx': True, 'sideways_use_spike': False, 'sideways_rsi_required': False}.
[I 2025-09-01 07:57:49,948] Trial 221 finished with values: [-1000000000.0, 1000000000.0] and parameters: {'p_sma': 28, 'p_std': 59, 'p_atr': 23, 'p_adx': 27, 'rsi_period': 52, 'ema1': 15, 'ema2': 25, 'slip_atr_k': 0.10063420343573548, 'slip_spread_k': 0.9320312169254987, 'spread_hl_frac': 0.00517193458215464, 'bb_std_mult': 3.3260077033142834, 'rsi_os': 19, 'rsi_ob': 92, 'vol_spike': 0.07762470332058605, 'adx_thresh': 27.106256239139476, 'atr_min_pct': 0.0032730579893546228, 'atr_max_pct': 0.14173309473603005, 'tp_mult': 2.0226966359818443, 'tsl_mult': 0.01189400248529282, 'strategy': 'breakout', 'time_stop': 233, 'use_sma': False, 'use_atr': False, 'use_adx': True, 'use_ema': True, 'use_spike': True, 'rsi_required': True, 'edge_k': 0.3126735884802374, 'edge_cap': 0.2677931956586607, 'bull_strategy': 'breakout', 'bull_bb_std_mult': 3.0404602637677014, 'bull_rsi_os': 43, 'bull_rsi_ob': 77, 'bull_adx_thresh': 7.506847775066975, 'bull_atr_min_pct': 0.013518405254608625, 'bull_atr_max_pct': 0.08852463976228736, 'bull_tp_mult': 1.667456497355053, 'bull_tsl_mult': 0.571411589658374, 'bull_time_stop': 53, 'bull_use_sma': True, 'bull_use_ema': False, 'bull_use_atr': False, 'bull_use_adx': False, 'bull_use_spike': False, 'bull_rsi_required': False, 'bear_strategy': 'mean_reversion', 'bear_bb_std_mult': 1.7109372344454774, 'bear_rsi_os': 48, 'bear_rsi_ob': 80, 'bear_adx_thresh': 5.818044227150111, 'bear_atr_min_pct': 0.006407311919634076, 'bear_atr_max_pct': 0.08353301949872148, 'bear_tp_mult': 2.1888317919431874, 'bear_tsl_mult': 0.1120536807668954, 'bear_time_stop': 279, 'bear_use_sma': True, 'bear_use_ema': False, 'bear_use_atr': True, 'bear_use_adx': False, 'bear_use_spike': False, 'bear_rsi_required': False, 'sideways_strategy': 'breakout', 'sideways_bb_std_mult': 0.7882708062483554, 'sideways_rsi_os': 11, 'sideways_rsi_ob': 93, 'sideways_adx_thresh': 10.434976060061274, 'sideways_atr_min_pct': 0.02922005609415619, 'sideways_atr_max_pct': 0.010111688889885735, 'sideways_tp_mult': 1.3367407072442348, 'sideways_tsl_mult': 0.13082240378694301, 'sideways_time_stop': 185, 'sideways_use_sma': True, 'sideways_use_ema': True, 'sideways_use_atr': True, 'sideways_use_adx': True, 'sideways_use_spike': False, 'sideways_rsi_required': False}.
[I 2025-09-01 07:57:49,990] Trial 219 finished with values: [-0.014484410255233504, 0.016949264867518844] and parameters: {'p_sma': 33, 'p_std': 59, 'p_atr': 23, 'p_adx': 30, 'rsi_period': 53, 'ema1': 15, 'ema2': 26, 'slip_atr_k': 0.18409555194729063, 'slip_spread_k': 0.9060328727117191, 'spread_hl_frac': 0.010728426573580375, 'bb_std_mult': 2.0240895828766385, 'rsi_os': 32, 'rsi_ob': 92, 'vol_spike': 0.07684759493434129, 'adx_thresh': 7.434135334981084, 'atr_min_pct': 0.006445189232779151, 'atr_max_pct': 0.08112118756799518, 'tp_mult': 1.9634508768664982, 'tsl_mult': 0.011107629134586641, 'strategy': 'breakout', 'time_stop': 222, 'use_sma': False, 'use_atr': False, 'use_adx': True, 'use_ema': True, 'use_spike': True, 'rsi_required': True, 'edge_k': 0.3172933756863656, 'edge_cap': 0.22129030052834653, 'bull_strategy': 'breakout', 'bull_bb_std_mult': 3.0451228513927306, 'bull_rsi_os': 44, 'bull_rsi_ob': 70, 'bull_adx_thresh': 8.512629972702412, 'bull_atr_min_pct': 0.0045129733898697086, 'bull_atr_max_pct': 0.021485287736151, 'bull_tp_mult': 1.6721368752290675, 'bull_tsl_mult': 0.5785528239551506, 'bull_time_stop': 54, 'bull_use_sma': True, 'bull_use_ema': False, 'bull_use_atr': False, 'bull_use_adx': False, 'bull_use_spike': False, 'bull_rsi_required': False, 'bear_strategy': 'mean_reversion', 'bear_bb_std_mult': 1.741973498699343, 'bear_rsi_os': 44, 'bear_rsi_ob': 76, 'bear_adx_thresh': 5.841609918604931, 'bear_atr_min_pct': 0.0049230607446546296, 'bear_atr_max_pct': 0.08241110221368338, 'bear_tp_mult': 2.2167018935113543, 'bear_tsl_mult': 0.02812132035667724, 'bear_time_stop': 276, 'bear_use_sma': True, 'bear_use_ema': False, 'bear_use_atr': True, 'bear_use_adx': False, 'bear_use_spike': False, 'bear_rsi_required': False, 'sideways_strategy': 'breakout', 'sideways_bb_std_mult': 0.8450355223036343, 'sideways_rsi_os': 11, 'sideways_rsi_ob': 94, 'sideways_adx_thresh': 10.250101272518753, 'sideways_atr_min_pct': 0.029194591586344795, 'sideways_atr_max_pct': 0.010738026026323486, 'sideways_tp_mult': 1.369561251971457, 'sideways_tsl_mult': 0.12898014739340366, 'sideways_time_stop': 210, 'sideways_use_sma': True, 'sideways_use_ema': True, 'sideways_use_atr': True, 'sideways_use_adx': True, 'sideways_use_spike': False, 'sideways_rsi_required': False}.
[I 2025-09-01 07:57:50,212] Trial 220 finished with values: [-0.02079105889178756, 0.021110124643019215] and parameters: {'p_sma': 33, 'p_std': 56, 'p_atr': 9, 'p_adx': 30, 'rsi_period': 52, 'ema1': 15, 'ema2': 41, 'slip_atr_k': 0.09921847983767199, 'slip_spread_k': 0.9327235548144787, 'spread_hl_frac': 0.010320552882227677, 'bb_std_mult': 2.3744402867500547, 'rsi_os': 33, 'rsi_ob': 61, 'vol_spike': 0.07506158480768507, 'adx_thresh': 26.831331420321007, 'atr_min_pct': 0.003505925335670377, 'atr_max_pct': 0.141558253468359, 'tp_mult': 1.753617993726141, 'tsl_mult': 0.005475828405842986, 'strategy': 'breakout', 'time_stop': 233, 'use_sma': False, 'use_atr': False, 'use_adx': True, 'use_ema': True, 'use_spike': True, 'rsi_required': True, 'edge_k': 0.3242822946537287, 'edge_cap': 0.2643988341430985, 'bull_strategy': 'breakout', 'bull_bb_std_mult': 3.050969614921929, 'bull_rsi_os': 43, 'bull_rsi_ob': 76, 'bull_adx_thresh': 7.646128185889285, 'bull_atr_min_pct': 0.004528965233521288, 'bull_atr_max_pct': 0.021083574539852726, 'bull_tp_mult': 1.671251269124594, 'bull_tsl_mult': 0.5754137042582776, 'bull_time_stop': 54, 'bull_use_sma': True, 'bull_use_ema': False, 'bull_use_atr': False, 'bull_use_adx': False, 'bull_use_spike': False, 'bull_rsi_required': False, 'bear_strategy': 'mean_reversion', 'bear_bb_std_mult': 1.904894445465714, 'bear_rsi_os': 42, 'bear_rsi_ob': 80, 'bear_adx_thresh': 5.973891594830604, 'bear_atr_min_pct': 0.0057094560996978246, 'bear_atr_max_pct': 0.083619923295903, 'bear_tp_mult': 2.2045699443267877, 'bear_tsl_mult': 0.032346523233549515, 'bear_time_stop': 280, 'bear_use_sma': True, 'bear_use_ema': False, 'bear_use_atr': True, 'bear_use_adx': False, 'bear_use_spike': False, 'bear_rsi_required': False, 'sideways_strategy': 'breakout', 'sideways_bb_std_mult': 0.7922076422491336, 'sideways_rsi_os': 11, 'sideways_rsi_ob': 93, 'sideways_adx_thresh': 9.397280535362063, 'sideways_atr_min_pct': 0.024040715715395167, 'sideways_atr_max_pct': 0.010044037847592394, 'sideways_tp_mult': 1.343817699341075, 'sideways_tsl_mult': 0.02064943602602401, 'sideways_time_stop': 185, 'sideways_use_sma': True, 'sideways_use_ema': True, 'sideways_use_atr': True, 'sideways_use_adx': True, 'sideways_use_spike': False, 'sideways_rsi_required': False}.
[I 2025-09-01 07:57:50,380] Trial 222 finished with values: [-1000000000.0, 1000000000.0] and parameters: {'p_sma': 27, 'p_std': 59, 'p_atr': 23, 'p_adx': 26, 'rsi_period': 53, 'ema1': 22, 'ema2': 24, 'slip_atr_k': 0.08221021652777406, 'slip_spread_k': 0.9348490133888748, 'spread_hl_frac': 0.03082384368361758, 'bb_std_mult': 1.8294429613713976, 'rsi_os': 19, 'rsi_ob': 62, 'vol_spike': 0.07306231915487886, 'adx_thresh': 29.014606328115512, 'atr_min_pct': 0.004551069891050061, 'atr_max_pct': 0.14248104759265443, 'tp_mult': 2.0270088034707374, 'tsl_mult': 0.010849464849364825, 'strategy': 'breakout', 'time_stop': 228, 'use_sma': False, 'use_atr': False, 'use_adx': True, 'use_ema': True, 'use_spike': True, 'rsi_required': True, 'edge_k': 0.30410524007516115, 'edge_cap': 0.2673157049223782, 'bull_strategy': 'breakout', 'bull_bb_std_mult': 3.055724653037454, 'bull_rsi_os': 44, 'bull_rsi_ob': 76, 'bull_adx_thresh': 7.755960577433536, 'bull_atr_min_pct': 0.004467840008706838, 'bull_atr_max_pct': 0.01700827566891415, 'bull_tp_mult': 1.637746345973038, 'bull_tsl_mult': 0.6119893800850265, 'bull_time_stop': 52, 'bull_use_sma': True, 'bull_use_ema': False, 'bull_use_atr': False, 'bull_use_adx': False, 'bull_use_spike': False, 'bull_rsi_required': False, 'bear_strategy': 'mean_reversion', 'bear_bb_std_mult': 1.7033803162785237, 'bear_rsi_os': 42, 'bear_rsi_ob': 80, 'bear_adx_thresh': 6.211569377498348, 'bear_atr_min_pct': 0.018196374587414674, 'bear_atr_max_pct': 0.09073830092040477, 'bear_tp_mult': 2.1875098028160576, 'bear_tsl_mult': 0.11611622080369326, 'bear_time_stop': 279, 'bear_use_sma': True, 'bear_use_ema': False, 'bear_use_atr': True, 'bear_use_adx': False, 'bear_use_spike': False, 'bear_rsi_required': False, 'sideways_strategy': 'breakout', 'sideways_bb_std_mult': 0.9408503396681386, 'sideways_rsi_os': 6, 'sideways_rsi_ob': 95, 'sideways_adx_thresh': 10.315209793952649, 'sideways_atr_min_pct': 0.024002944227473146, 'sideways_atr_max_pct': 0.010640550907336843, 'sideways_tp_mult': 1.258613288235935, 'sideways_tsl_mult': 0.124084230142384, 'sideways_time_stop': 240, 'sideways_use_sma': True, 'sideways_use_ema': True, 'sideways_use_atr': True, 'sideways_use_adx': True, 'sideways_use_spike': False, 'sideways_rsi_required': False}.
[I 2025-09-01 07:58:31,843] Trial 225 finished with values: [-1000000000.0, 1000000000.0] and parameters: {'p_sma': 27, 'p_std': 58, 'p_atr': 24, 'p_adx': 26, 'rsi_period': 59, 'ema1': 22, 'ema2': 22, 'slip_atr_k': 0.0008783707976078552, 'slip_spread_k': 0.8685144634588711, 'spread_hl_frac': 0.0013630854270255833, 'bb_std_mult': 1.8345300551361274, 'rsi_os': 31, 'rsi_ob': 91, 'vol_spike': 0.06933043088856647, 'adx_thresh': 28.103273430636687, 'atr_min_pct': 0.004482880323364757, 'atr_max_pct': 0.08663746128112583, 'tp_mult': 1.926122926432006, 'tsl_mult': 0.07033319667659017, 'strategy': 'breakout', 'time_stop': 242, 'use_sma': False, 'use_atr': False, 'use_adx': True, 'use_ema': True, 'use_spike': True, 'rsi_required': True, 'edge_k': 0.25619775336689343, 'edge_cap': 0.2412617094332237, 'bull_strategy': 'breakout', 'bull_bb_std_mult': 0.8461721012187244, 'bull_rsi_os': 48, 'bull_rsi_ob': 47, 'bull_adx_thresh': 7.803572972335532, 'bull_atr_min_pct': 0.003707643270408539, 'bull_atr_max_pct': 0.01741950679356178, 'bull_tp_mult': 1.5622553296355137, 'bull_tsl_mult': 0.6110375933793002, 'bull_time_stop': 62, 'bull_use_sma': True, 'bull_use_ema': False, 'bull_use_atr': False, 'bull_use_adx': False, 'bull_use_spike': False, 'bull_rsi_required': False, 'bear_strategy': 'mean_reversion', 'bear_bb_std_mult': 1.8239685893102817, 'bear_rsi_os': 45, 'bear_rsi_ob': 78, 'bear_adx_thresh': 6.566091551324228, 'bear_atr_min_pct': 0.007631356658702809, 'bear_atr_max_pct': 0.09078762168058885, 'bear_tp_mult': 2.1624423844635627, 'bear_tsl_mult': 0.8470134590045584, 'bear_time_stop': 291, 'bear_use_sma': True, 'bear_use_ema': False, 'bear_use_atr': True, 'bear_use_adx': False, 'bear_use_spike': False, 'bear_rsi_required': False, 'sideways_strategy': 'breakout', 'sideways_bb_std_mult': 0.9610764281123434, 'sideways_rsi_os': 6, 'sideways_rsi_ob': 95, 'sideways_adx_thresh': 9.561738535011994, 'sideways_atr_min_pct': 0.02723656162350062, 'sideways_atr_max_pct': 0.11099507748798505, 'sideways_tp_mult': 1.2543463233046421, 'sideways_tsl_mult': 0.06790053736845507, 'sideways_time_stop': 239, 'sideways_use_sma': True, 'sideways_use_ema': True, 'sideways_use_atr': True, 'sideways_use_adx': True, 'sideways_use_spike': False, 'sideways_rsi_required': False}.
[I 2025-09-01 07:58:32,240] Trial 226 finished with values: [-0.00043730712743128564, 0.0024724969480776388] and parameters: {'p_sma': 28, 'p_std': 23, 'p_atr': 24, 'p_adx': 7, 'rsi_period': 59, 'ema1': 7, 'ema2': 21, 'slip_atr_k': 0.00041177568298344624, 'slip_spread_k': 0.8720641527848026, 'spread_hl_frac': 4.5649734711425416e-07, 'bb_std_mult': 2.1679622359115513, 'rsi_os': 31, 'rsi_ob': 88, 'vol_spike': 0.06737506258490002, 'adx_thresh': 28.48650905327454, 'atr_min_pct': 0.00406011641393594, 'atr_max_pct': 0.1334587982414214, 'tp_mult': 1.6859863417632268, 'tsl_mult': 0.03680747340758364, 'strategy': 'breakout', 'time_stop': 249, 'use_sma': False, 'use_atr': False, 'use_adx': True, 'use_ema': True, 'use_spike': True, 'rsi_required': True, 'edge_k': 0.26406792798237294, 'edge_cap': 0.24382059383429136, 'bull_strategy': 'breakout', 'bull_bb_std_mult': 2.894645081369094, 'bull_rsi_os': 48, 'bull_rsi_ob': 66, 'bull_adx_thresh': 9.697672079045144, 'bull_atr_min_pct': 0.0037736534008467244, 'bull_atr_max_pct': 0.030314356152605193, 'bull_tp_mult': 1.5544187483047374, 'bull_tsl_mult': 0.6134062963669339, 'bull_time_stop': 59, 'bull_use_sma': True, 'bull_use_ema': False, 'bull_use_atr': False, 'bull_use_adx': False, 'bull_use_spike': False, 'bull_rsi_required': False, 'bear_strategy': 'mean_reversion', 'bear_bb_std_mult': 3.194163025891787, 'bear_rsi_os': 45, 'bear_rsi_ob': 78, 'bear_adx_thresh': 6.51793239410358, 'bear_atr_min_pct': 0.007824060549442787, 'bear_atr_max_pct': 0.07913814018765535, 'bear_tp_mult': 2.153737924177675, 'bear_tsl_mult': 0.044028537347077346, 'bear_time_stop': 293, 'bear_use_sma': True, 'bear_use_ema': False, 'bear_use_atr': True, 'bear_use_adx': False, 'bear_use_spike': False, 'bear_rsi_required': False, 'sideways_strategy': 'breakout', 'sideways_bb_std_mult': 0.9404687855084382, 'sideways_rsi_os': 6, 'sideways_rsi_ob': 92, 'sideways_adx_thresh': 18.395632553219805, 'sideways_atr_min_pct': 0.026507434065400938, 'sideways_atr_max_pct': 0.11116073951447625, 'sideways_tp_mult': 1.4501536857688255, 'sideways_tsl_mult': 0.04834157518642192, 'sideways_time_stop': 135, 'sideways_use_sma': True, 'sideways_use_ema': True, 'sideways_use_atr': True, 'sideways_use_adx': True, 'sideways_use_spike': False, 'sideways_rsi_required': False}.
