[I 2025-09-01 08:55:44,224] Trial 543 finished with values: [-1000000000.0, 1000000000.0] and parameters: {'p_sma': 57, 'p_std': 36, 'p_atr': 30, 'p_adx': 15, 'rsi_period': 39, 'ema1': 8, 'ema2': 60, 'slip_atr_k': 0.00898701406135162, 'slip_spread_k': 0.16594692719101795, 'spread_hl_frac': 0.023013418718727696, 'bb_std_mult': 2.5985933243043466, 'rsi_os': 48, 'rsi_ob': 90, 'vol_spike': 0.0055923399559884325, 'adx_thresh': 34.1799850568585, 'atr_min_pct': 0.0203598385862638, 'atr_max_pct': 0.08803894075309648, 'tp_mult': 1.3575606714632518, 'tsl_mult': 0.8442713621280533, 'strategy': 'mean_reversion', 'time_stop': 38, 'use_sma': False, 'use_atr': True, 'use_adx': False, 'use_ema': False, 'use_spike': False, 'rsi_required': False, 'edge_k': 0.9449284763714976, 'edge_cap': 0.2698654008846062, 'bull_strategy': 'mean_reversion', 'bull_bb_std_mult': 2.439044036387964, 'bull_rsi_os': 38, 'bull_rsi_ob': 53, 'bull_adx_thresh': 34.138043224946536, 'bull_atr_min_pct': 0.01963368372027403, 'bull_atr_max_pct': 0.07940108144466863, 'bull_tp_mult': 1.1286605439353488, 'bull_tsl_mult': 0.7279887827524633, 'bull_time_stop': 170, 'bull_use_sma': True, 'bull_use_ema': True, 'bull_use_atr': True, 'bull_use_adx': True, 'bull_use_spike': True, 'bull_rsi_required': False, 'bear_strategy': 'breakout', 'bear_bb_std_mult': 3.211300457651097, 'bear_rsi_os': 43, 'bear_rsi_ob': 85, 'bear_adx_thresh': 12.031760876864558, 'bear_atr_min_pct': 0.005510657681535648, 'bear_atr_max_pct': 0.13505724454620885, 'bear_tp_mult': 2.664357041757394, 'bear_tsl_mult': 0.23512240197431933, 'bear_time_stop': 173, 'bear_use_sma': False, 'bear_use_ema': False, 'bear_use_atr': True, 'bear_use_adx': True, 'bear_use_spike': True, 'bear_rsi_required': True, 'sideways_strategy': 'mean_reversion', 'sideways_bb_std_mult': 2.8180576444810645, 'sideways_rsi_os': 10, 'sideways_rsi_ob': 65, 'sideways_adx_thresh': 10.157190843670357, 'sideways_atr_min_pct': 0.007654729374428012, 'sideways_atr_max_pct': 0.09276460147216446, 'sideways_tp_mult': 2.4091642172172683, 'sideways_tsl_mult': 0.43239069017210185, 'sideways_time_stop': 252, 'sideways_use_sma': False, 'sideways_use_ema': False, 'sideways_use_atr': True, 'sideways_use_adx': False, 'sideways_use_spike': True, 'sideways_rsi_required': True}.
[I 2025-09-01 08:55:44,471] Trial 541 finished with values: [-1000000000.0, 1000000000.0] and parameters: {'p_sma': 42, 'p_std': 37, 'p_atr': 30, 'p_adx': 16, 'rsi_period': 39, 'ema1': 8, 'ema2': 60, 'slip_atr_k': 0.19243406323602988, 'slip_spread_k': 0.15637728727183217, 'spread_hl_frac': 0.04790078515212507, 'bb_std_mult': 2.601097695490959, 'rsi_os': 48, 'rsi_ob': 92, 'vol_spike': 0.012375932338654564, 'adx_thresh': 33.32361401908507, 'atr_min_pct': 0.02372397414322132, 'atr_max_pct': 0.08844014968798634, 'tp_mult': 1.365877607250671, 'tsl_mult': 0.17876172181312255, 'strategy': 'mean_reversion', 'time_stop': 39, 'use_sma': False, 'use_atr': True, 'use_adx': False, 'use_ema': False, 'use_spike': False, 'rsi_required': False, 'edge_k': 0.9560114205486673, 'edge_cap': 0.2660667834893941, 'bull_strategy': 'mean_reversion', 'bull_bb_std_mult': 2.4365820804636567, 'bull_rsi_os': 39, 'bull_rsi_ob': 55, 'bull_adx_thresh': 34.27779333772836, 'bull_atr_min_pct': 0.02113869317362439, 'bull_atr_max_pct': 0.07300237433238912, 'bull_tp_mult': 1.1199138079798971, 'bull_tsl_mult': 0.07080857323889661, 'bull_time_stop': 170, 'bull_use_sma': False, 'bull_use_ema': True, 'bull_use_atr': True, 'bull_use_adx': True, 'bull_use_spike': True, 'bull_rsi_required': True, 'bear_strategy': 'breakout', 'bear_bb_std_mult': 3.337920285022199, 'bear_rsi_os': 41, 'bear_rsi_ob': 88, 'bear_adx_thresh': 12.052824950457227, 'bear_atr_min_pct': 0.005440134347448508, 'bear_atr_max_pct': 0.04054292178342147, 'bear_tp_mult': 2.866372412781653, 'bear_tsl_mult': 0.23045888057217842, 'bear_time_stop': 221, 'bear_use_sma': False, 'bear_use_ema': False, 'bear_use_atr': True, 'bear_use_adx': True, 'bear_use_spike': True, 'bear_rsi_required': True, 'sideways_strategy': 'breakout', 'sideways_bb_std_mult': 2.2085101845400175, 'sideways_rsi_os': 10, 'sideways_rsi_ob': 63, 'sideways_adx_thresh': 10.240785773656272, 'sideways_atr_min_pct': 0.008810585163633398, 'sideways_atr_max_pct': 0.07667071108644397, 'sideways_tp_mult': 2.4087800167430062, 'sideways_tsl_mult': 0.4282783365088065, 'sideways_time_stop': 288, 'sideways_use_sma': False, 'sideways_use_ema': False, 'sideways_use_atr': True, 'sideways_use_adx': False, 'sideways_use_spike': True, 'sideways_rsi_required': True}.
[I 2025-09-01 08:55:44,749] Trial 540 finished with values: [-1000000000.0, 1000000000.0] and parameters: {'p_sma': 46, 'p_std': 35, 'p_atr': 21, 'p_adx': 16, 'rsi_period': 41, 'ema1': 9, 'ema2': 58, 'slip_atr_k': 0.0077358348529818766, 'slip_spread_k': 0.050787897841506155, 'spread_hl_frac': 0.01818043506060864, 'bb_std_mult': 0.510567492826774, 'rsi_os': 47, 'rsi_ob': 92, 'vol_spike': 0.013726102559712502, 'adx_thresh': 34.43506195387278, 'atr_min_pct': 0.014558084338032564, 'atr_max_pct': 0.09213389223200819, 'tp_mult': 1.3676967772792394, 'tsl_mult': 0.8431675608631725, 'strategy': 'mean_reversion', 'time_stop': 63, 'use_sma': False, 'use_atr': False, 'use_adx': False, 'use_ema': False, 'use_spike': False, 'rsi_required': False, 'edge_k': 0.8760943583628437, 'edge_cap': 0.26917165820419486, 'bull_strategy': 'breakout', 'bull_bb_std_mult': 2.447776061906546, 'bull_rsi_os': 40, 'bull_rsi_ob': 56, 'bull_adx_thresh': 10.962854810322234, 'bull_atr_min_pct': 0.021009815492098752, 'bull_atr_max_pct': 0.0772970119716949, 'bull_tp_mult': 1.1057227508969933, 'bull_tsl_mult': 0.06297707471727071, 'bull_time_stop': 186, 'bull_use_sma': False, 'bull_use_ema': True, 'bull_use_atr': True, 'bull_use_adx': True, 'bull_use_spike': True, 'bull_rsi_required': True, 'bear_strategy': 'breakout', 'bear_bb_std_mult': 3.444556960956791, 'bear_rsi_os': 41, 'bear_rsi_ob': 87, 'bear_adx_thresh': 14.681312971303885, 'bear_atr_min_pct': 0.022316327379946998, 'bear_atr_max_pct': 0.04064499187190797, 'bear_tp_mult': 2.743093276030089, 'bear_tsl_mult': 0.22030642548037252, 'bear_time_stop': 209, 'bear_use_sma': False, 'bear_use_ema': False, 'bear_use_atr': True, 'bear_use_adx': True, 'bear_use_spike': True, 'bear_rsi_required': True, 'sideways_strategy': 'breakout', 'sideways_bb_std_mult': 1.3411729743320748, 'sideways_rsi_os': 10, 'sideways_rsi_ob': 65, 'sideways_adx_thresh': 30.448106608948066, 'sideways_atr_min_pct': 0.006220856037434818, 'sideways_atr_max_pct': 0.07645816801487369, 'sideways_tp_mult': 2.380111294913468, 'sideways_tsl_mult': 0.5224356681771191, 'sideways_time_stop': 146, 'sideways_use_sma': False, 'sideways_use_ema': False, 'sideways_use_atr': True, 'sideways_use_adx': False, 'sideways_use_spike': True, 'sideways_rsi_required': True}.
[I 2025-09-01 08:55:44,935] Trial 542 finished with values: [-1000000000.0, 1000000000.0] and parameters: {'p_sma': 18, 'p_std': 36, 'p_atr': 21, 'p_adx': 15, 'rsi_period': 39, 'ema1': 8, 'ema2': 60, 'slip_atr_k': 0.15085351268027075, 'slip_spread_k': 0.15996584558240193, 'spread_hl_frac': 0.03931439602007232, 'bb_std_mult': 2.592609316849969, 'rsi_os': 48, 'rsi_ob': 90, 'vol_spike': 0.006153847497344945, 'adx_thresh': 34.464666779445494, 'atr_min_pct': 0.02393265688877578, 'atr_max_pct': 0.08865209025568671, 'tp_mult': 1.3636520598093764, 'tsl_mult': 0.1853994423085373, 'strategy': 'mean_reversion', 'time_stop': 291, 'use_sma': False, 'use_atr': True, 'use_adx': False, 'use_ema': False, 'use_spike': False, 'rsi_required': False, 'edge_k': 1.0165606148074449, 'edge_cap': 0.2660254478846435, 'bull_strategy': 'mean_reversion', 'bull_bb_std_mult': 2.4245413288339743, 'bull_rsi_os': 39, 'bull_rsi_ob': 92, 'bull_adx_thresh': 11.038369589179036, 'bull_atr_min_pct': 0.01980263823476809, 'bull_atr_max_pct': 0.07790591580755402, 'bull_tp_mult': 1.1303166652038519, 'bull_tsl_mult': 0.7237463552046319, 'bull_time_stop': 170, 'bull_use_sma': True, 'bull_use_ema': True, 'bull_use_atr': True, 'bull_use_adx': True, 'bull_use_spike': True, 'bull_rsi_required': False, 'bear_strategy': 'breakout', 'bear_bb_std_mult': 3.205951586424252, 'bear_rsi_os': 36, 'bear_rsi_ob': 85, 'bear_adx_thresh': 12.25875515434652, 'bear_atr_min_pct': 0.006362813442677223, 'bear_atr_max_pct': 0.04098912107074041, 'bear_tp_mult': 2.6634714349144373, 'bear_tsl_mult': 0.2357338944544829, 'bear_time_stop': 79, 'bear_use_sma': False, 'bear_use_ema': False, 'bear_use_atr': True, 'bear_use_adx': True, 'bear_use_spike': True, 'bear_rsi_required': True, 'sideways_strategy': 'mean_reversion', 'sideways_bb_std_mult': 2.053527085304905, 'sideways_rsi_os': 10, 'sideways_rsi_ob': 65, 'sideways_adx_thresh': 11.028559957383642, 'sideways_atr_min_pct': 0.00786823560533913, 'sideways_atr_max_pct': 0.09374108560307601, 'sideways_tp_mult': 2.3984503382341247, 'sideways_tsl_mult': 0.6264600045674698, 'sideways_time_stop': 143, 'sideways_use_sma': False, 'sideways_use_ema': False, 'sideways_use_atr': True, 'sideways_use_adx': False, 'sideways_use_spike': True, 'sideways_rsi_required': True}.
[I 2025-09-01 08:55:46,190] Trial 545 finished with values: [-1000000000.0, 1000000000.0] and parameters: {'p_sma': 49, 'p_std': 35, 'p_atr': 21, 'p_adx': 16, 'rsi_period': 44, 'ema1': 24, 'ema2': 60, 'slip_atr_k': 0.16434018429915032, 'slip_spread_k': 0.05141721125137043, 'spread_hl_frac': 0.024446648129101446, 'bb_std_mult': 2.698452247540752, 'rsi_os': 47, 'rsi_ob': 46, 'vol_spike': 0.014376480226095186, 'adx_thresh': 34.27468536857798, 'atr_min_pct': 0.019015896185278443, 'atr_max_pct': 0.0968733287433874, 'tp_mult': 1.299290554202775, 'tsl_mult': 0.3681338915034523, 'strategy': 'mean_reversion', 'time_stop': 52, 'use_sma': False, 'use_atr': False, 'use_adx': False, 'use_ema': False, 'use_spike': False, 'rsi_required': False, 'edge_k': 0.9116449376149561, 'edge_cap': 0.7703499106338444, 'bull_strategy': 'breakout', 'bull_bb_std_mult': 2.0944592656717105, 'bull_rsi_os': 40, 'bull_rsi_ob': 56, 'bull_adx_thresh': 11.016848761349596, 'bull_atr_min_pct': 0.01978294426710945, 'bull_atr_max_pct': 0.07772302892546894, 'bull_tp_mult': 1.1694371603399938, 'bull_tsl_mult': 0.8083998540340573, 'bull_time_stop': 184, 'bull_use_sma': True, 'bull_use_ema': True, 'bull_use_atr': True, 'bull_use_adx': True, 'bull_use_spike': True, 'bull_rsi_required': False, 'bear_strategy': 'mean_reversion', 'bear_bb_std_mult': 3.0618237980144354, 'bear_rsi_os': 34, 'bear_rsi_ob': 47, 'bear_adx_thresh': 14.45417451683455, 'bear_atr_min_pct': 0.006289719033509549, 'bear_atr_max_pct': 0.0427524079998173, 'bear_tp_mult': 2.733432842994648, 'bear_tsl_mult': 0.27291140090057175, 'bear_time_stop': 194, 'bear_use_sma': False, 'bear_use_ema': True, 'bear_use_atr': True, 'bear_use_adx': True, 'bear_use_spike': True, 'bear_rsi_required': True, 'sideways_strategy': 'breakout', 'sideways_bb_std_mult': 1.3869422447869846, 'sideways_rsi_os': 26, 'sideways_rsi_ob': 59, 'sideways_adx_thresh': 11.049863519628609, 'sideways_atr_min_pct': 0.009838389166521503, 'sideways_atr_max_pct': 0.07288259055662975, 'sideways_tp_mult': 2.460331682938452, 'sideways_tsl_mult': 0.8949985020176602, 'sideways_time_stop': 145, 'sideways_use_sma': False, 'sideways_use_ema': False, 'sideways_use_atr': True, 'sideways_use_adx': False, 'sideways_use_spike': True, 'sideways_rsi_required': True}.
[I 2025-09-01 08:56:25,818] Trial 546 finished with values: [-1000000000.0, 1000000000.0] and parameters: {'p_sma': 39, 'p_std': 37, 'p_atr': 21, 'p_adx': 27, 'rsi_period': 16, 'ema1': 27, 'ema2': 60, 'slip_atr_k': 0.012795152895291604, 'slip_spread_k': 0.0949565932866911, 'spread_hl_frac': 0.04357961135170804, 'bb_std_mult': 2.692582889929417, 'rsi_os': 45, 'rsi_ob': 55, 'vol_spike': 0.004800031175350883, 'adx_thresh': 33.541112820290664, 'atr_min_pct': 0.025304996877472324, 'atr_max_pct': 0.09701487917282964, 'tp_mult': 1.2074098007613574, 'tsl_mult': 0.7446247478291225, 'strategy': 'mean_reversion', 'time_stop': 137, 'use_sma': False, 'use_atr': False, 'use_adx': False, 'use_ema': False, 'use_spike': False, 'rsi_required': False, 'edge_k': 0.914791506014245, 'edge_cap': 0.5478922932052028, 'bull_strategy': 'breakout', 'bull_bb_std_mult': 2.542229003563727, 'bull_rsi_os': 38, 'bull_rsi_ob': 77, 'bull_adx_thresh': 9.634801588495698, 'bull_atr_min_pct': 0.019702845514716516, 'bull_atr_max_pct': 0.07631141518569173, 'bull_tp_mult': 1.1769813650394043, 'bull_tsl_mult': 0.3254059755689619, 'bull_time_stop': 180, 'bull_use_sma': True, 'bull_use_ema': True, 'bull_use_atr': True, 'bull_use_adx': True, 'bull_use_spike': True, 'bull_rsi_required': False, 'bear_strategy': 'mean_reversion', 'bear_bb_std_mult': 3.3971788588767153, 'bear_rsi_os': 37, 'bear_rsi_ob': 90, 'bear_adx_thresh': 12.338224862412574, 'bear_atr_min_pct': 0.006508788662368007, 'bear_atr_max_pct': 0.0341027408255488, 'bear_tp_mult': 2.7111793448071855, 'bear_tsl_mult': 0.20222853779621486, 'bear_time_stop': 193, 'bear_use_sma': False, 'bear_use_ema': True, 'bear_use_atr': True, 'bear_use_adx': True, 'bear_use_spike': True, 'bear_rsi_required': True, 'sideways_strategy': 'mean_reversion', 'sideways_bb_std_mult': 3.0583990005640764, 'sideways_rsi_os': 25, 'sideways_rsi_ob': 61, 'sideways_adx_thresh': 11.219395632464265, 'sideways_atr_min_pct': 0.009941544715081824, 'sideways_atr_max_pct': 0.08711807457758793, 'sideways_tp_mult': 2.303560526461368, 'sideways_tsl_mult': 0.4552815838675361, 'sideways_time_stop': 172, 'sideways_use_sma': False, 'sideways_use_ema': False, 'sideways_use_atr': True, 'sideways_use_adx': False, 'sideways_use_spike': True, 'sideways_rsi_required': True}.
[I 2025-09-01 08:56:26,085] Trial 544 finished with values: [-1000000000.0, 1000000000.0] and parameters: {'p_sma': 49, 'p_std': 37, 'p_atr': 11, 'p_adx': 16, 'rsi_period': 16, 'ema1': 8, 'ema2': 60, 'slip_atr_k': 0.01334673805029354, 'slip_spread_k': 0.050175514531487816, 'spread_hl_frac': 0.024830304386301266, 'bb_std_mult': 2.6871238236569344, 'rsi_os': 48, 'rsi_ob': 92, 'vol_spike': 0.012425036089804624, 'adx_thresh': 33.547611056073805, 'atr_min_pct': 0.025124474026391615, 'atr_max_pct': 0.02749999089334044, 'tp_mult': 1.2150746526423295, 'tsl_mult': 0.1855893743960541, 'strategy': 'mean_reversion', 'time_stop': 51, 'use_sma': False, 'use_atr': True, 'use_adx': False, 'use_ema': False, 'use_spike': False, 'rsi_required': False, 'edge_k': 1.5331689820301535, 'edge_cap': 0.5450048337421322, 'bull_strategy': 'mean_reversion', 'bull_bb_std_mult': 2.084576840600494, 'bull_rsi_os': 40, 'bull_rsi_ob': 56, 'bull_adx_thresh': 10.898000772780287, 'bull_atr_min_pct': 0.021001565373856675, 'bull_atr_max_pct': 0.0726095255551587, 'bull_tp_mult': 1.1754144759116287, 'bull_tsl_mult': 0.05786675447048656, 'bull_time_stop': 187, 'bull_use_sma': False, 'bull_use_ema': True, 'bull_use_atr': True, 'bull_use_adx': True, 'bull_use_spike': True, 'bull_rsi_required': True, 'bear_strategy': 'breakout', 'bear_bb_std_mult': 3.4035396447927773, 'bear_rsi_os': 17, 'bear_rsi_ob': 88, 'bear_adx_thresh': 12.064554657665358, 'bear_atr_min_pct': 0.001942805567903069, 'bear_atr_max_pct': 0.041538968732357115, 'bear_tp_mult': 2.728507205855742, 'bear_tsl_mult': 0.1978007455294569, 'bear_time_stop': 230, 'bear_use_sma': False, 'bear_use_ema': True, 'bear_use_atr': True, 'bear_use_adx': True, 'bear_use_spike': True, 'bear_rsi_required': True, 'sideways_strategy': 'breakout', 'sideways_bb_std_mult': 3.522705030504935, 'sideways_rsi_os': 10, 'sideways_rsi_ob': 62, 'sideways_adx_thresh': 30.03051454721168, 'sideways_atr_min_pct': 0.008524662134768447, 'sideways_atr_max_pct': 0.07572656096569567, 'sideways_tp_mult': 2.4479103203142074, 'sideways_tsl_mult': 0.6294785672337571, 'sideways_time_stop': 164, 'sideways_use_sma': False, 'sideways_use_ema': False, 'sideways_use_atr': True, 'sideways_use_adx': False, 'sideways_use_spike': True, 'sideways_rsi_required': True}.
[I 2025-09-01 08:56:26,618] Trial 547 finished with values: [-1000000000.0, 1000000000.0] and parameters: {'p_sma': 49, 'p_std': 39, 'p_atr': 10, 'p_adx': 17, 'rsi_period': 43, 'ema1': 29, 'ema2': 60, 'slip_atr_k': 0.1320913407338386, 'slip_spread_k': 0.7288666843341857, 'spread_hl_frac': 0.043272937472348116, 'bb_std_mult': 2.6930646912241563, 'rsi_os': 45, 'rsi_ob': 94, 'vol_spike': 0.016810266180106104, 'adx_thresh': 33.641205903747434, 'atr_min_pct': 0.017048106632580468, 'atr_max_pct': 0.09600165064687725, 'tp_mult': 1.206359888064194, 'tsl_mult': 0.1339304478974508, 'strategy': 'mean_reversion', 'time_stop': 56, 'use_sma': False, 'use_atr': False, 'use_adx': False, 'use_ema': False, 'use_spike': False, 'rsi_required': False, 'edge_k': 0.9095408109039569, 'edge_cap': 0.9969012518162039, 'bull_strategy': 'breakout', 'bull_bb_std_mult': 2.5237635834535586, 'bull_rsi_os': 38, 'bull_rsi_ob': 93, 'bull_adx_thresh': 10.700302392407012, 'bull_atr_min_pct': 0.02289092906517702, 'bull_atr_max_pct': 0.07329064647966925, 'bull_tp_mult': 1.241699989902862, 'bull_tsl_mult': 0.7008816834720165, 'bull_time_stop': 179, 'bull_use_sma': True, 'bull_use_ema': True, 'bull_use_atr': True, 'bull_use_adx': True, 'bull_use_spike': True, 'bull_rsi_required': False, 'bear_strategy': 'mean_reversion', 'bear_bb_std_mult': 3.153288465158017, 'bear_rsi_os': 44, 'bear_rsi_ob': 90, 'bear_adx_thresh': 13.391073127277982, 'bear_atr_min_pct': 0.006339833995777257, 'bear_atr_max_pct': 0.12317493870439022, 'bear_tp_mult': 2.7148220545642956, 'bear_tsl_mult': 0.2739894507377808, 'bear_time_stop': 229, 'bear_use_sma': False, 'bear_use_ema': True, 'bear_use_atr': True, 'bear_use_adx': True, 'bear_use_spike': True, 'bear_rsi_required': True, 'sideways_strategy': 'breakout', 'sideways_bb_std_mult': 1.4102189328979957, 'sideways_rsi_os': 55, 'sideways_rsi_ob': 61, 'sideways_adx_thresh': 11.119384350972673, 'sideways_atr_min_pct': 0.007241617334487702, 'sideways_atr_max_pct': 0.0737788414052766, 'sideways_tp_mult': 2.469346991127741, 'sideways_tsl_mult': 0.5553505104346368, 'sideways_time_stop': 163, 'sideways_use_sma': False, 'sideways_use_ema': False, 'sideways_use_atr': True, 'sideways_use_adx': False, 'sideways_use_spike': True, 'sideways_rsi_required': True}.
[I 2025-09-01 08:56:27,126] Trial 548 finished with values: [-1000000000.0, 1000000000.0] and parameters: {'p_sma': 22, 'p_std': 37, 'p_atr': 20, 'p_adx': 17, 'rsi_period': 17, 'ema1': 7, 'ema2': 56, 'slip_atr_k': 0.01348292018030172, 'slip_spread_k': 0.07935474678172386, 'spread_hl_frac': 0.02201089120272139, 'bb_std_mult': 2.507408798040692, 'rsi_os': 45, 'rsi_ob': 95, 'vol_spike': 0.007827619084995605, 'adx_thresh': 34.9916484292769, 'atr_min_pct': 0.011915652701716292, 'atr_max_pct': 0.09313541408655122, 'tp_mult': 1.2205828779403685, 'tsl_mult': 0.1931356383406574, 'strategy': 'mean_reversion', 'time_stop': 166, 'use_sma': False, 'use_atr': False, 'use_adx': False, 'use_ema': False, 'use_spike': False, 'rsi_required': False, 'edge_k': 0.8285531962451548, 'edge_cap': 0.48927524645781345, 'bull_strategy': 'breakout', 'bull_bb_std_mult': 0.8240799589740078, 'bull_rsi_os': 38, 'bull_rsi_ob': 57, 'bull_adx_thresh': 10.501164480786432, 'bull_atr_min_pct': 0.022986176813527555, 'bull_atr_max_pct': 0.07434964654414165, 'bull_tp_mult': 1.1783556607712855, 'bull_tsl_mult': 0.37910457572490297, 'bull_time_stop': 178, 'bull_use_sma': True, 'bull_use_ema': True, 'bull_use_atr': True, 'bull_use_adx': True, 'bull_use_spike': True, 'bull_rsi_required': False, 'bear_strategy': 'mean_reversion', 'bear_bb_std_mult': 3.4008175285124396, 'bear_rsi_os': 44, 'bear_rsi_ob': 90, 'bear_adx_thresh': 13.385234548334742, 'bear_atr_min_pct': 0.0017027827005497882, 'bear_atr_max_pct': 0.044509501856567185, 'bear_tp_mult': 2.7839173423795964, 'bear_tsl_mult': 0.19040451136246153, 'bear_time_stop': 233, 'bear_use_sma': False, 'bear_use_ema': True, 'bear_use_atr': True, 'bear_use_adx': True, 'bear_use_spike': True, 'bear_rsi_required': True, 'sideways_strategy': 'breakout', 'sideways_bb_std_mult': 3.359912846001948, 'sideways_rsi_os': 52, 'sideways_rsi_ob': 60, 'sideways_adx_thresh': 11.437732523185325, 'sideways_atr_min_pct': 0.0072376531439573835, 'sideways_atr_max_pct': 0.08741965604726855, 'sideways_tp_mult': 2.3054701988507826, 'sideways_tsl_mult': 0.5549660553572675, 'sideways_time_stop': 171, 'sideways_use_sma': False, 'sideways_use_ema': False, 'sideways_use_atr': True, 'sideways_use_adx': False, 'sideways_use_spike': True, 'sideways_rsi_required': True}.
