[I 2025-09-01 08:30:09,023] Trial 395 finished with values: [-1000000000.0, 1000000000.0] and parameters: {'p_sma': 25, 'p_std': 41, 'p_atr': 21, 'p_adx': 15, 'rsi_period': 19, 'ema1': 9, 'ema2': 12, 'slip_atr_k': 0.017380437559329127, 'slip_spread_k': 0.9261712099357163, 'spread_hl_frac': 0.014175268016821646, 'bb_std_mult': 2.5783666766584226, 'rsi_os': 30, 'rsi_ob': 80, 'vol_spike': 0.07018776141877851, 'adx_thresh': 31.323416341591837, 'atr_min_pct': 0.003777151734221735, 'atr_max_pct': 0.12320359433908394, 'tp_mult': 1.4214706263216907, 'tsl_mult': 0.07387890923864028, 'strategy': 'breakout', 'time_stop': 250, 'use_sma': False, 'use_atr': False, 'use_adx': True, 'use_ema': False, 'use_spike': True, 'rsi_required': True, 'edge_k': 0.06386564834062397, 'edge_cap': 0.18992544869786293, 'bull_strategy': 'breakout', 'bull_bb_std_mult': 3.4093816736868323, 'bull_rsi_os': 33, 'bull_rsi_ob': 60, 'bull_adx_thresh': 28.51871563010955, 'bull_atr_min_pct': 0.003372875159339847, 'bull_atr_max_pct': 0.06430606371503327, 'bull_tp_mult': 2.7384870996218367, 'bull_tsl_mult': 0.618218355196148, 'bull_time_stop': 274, 'bull_use_sma': True, 'bull_use_ema': False, 'bull_use_atr': False, 'bull_use_adx': False, 'bull_use_spike': False, 'bull_rsi_required': False, 'bear_strategy': 'mean_reversion', 'bear_bb_std_mult': 1.1605199756296338, 'bear_rsi_os': 45, 'bear_rsi_ob': 80, 'bear_adx_thresh': 11.43005922148786, 'bear_atr_min_pct': 0.007132717017975903, 'bear_atr_max_pct': 0.0757269394193939, 'bear_tp_mult': 2.01987714610384, 'bear_tsl_mult': 0.0867447736920952, 'bear_time_stop': 286, 'bear_use_sma': True, 'bear_use_ema': False, 'bear_use_atr': False, 'bear_use_adx': False, 'bear_use_spike': False, 'bear_rsi_required': False, 'sideways_strategy': 'breakout', 'sideways_bb_std_mult': 0.8111507236975504, 'sideways_rsi_os': 28, 'sideways_rsi_ob': 90, 'sideways_adx_thresh': 10.581698910356751, 'sideways_atr_min_pct': 0.02137811652838936, 'sideways_atr_max_pct': 0.061136769523910686, 'sideways_tp_mult': 1.9283609247097784, 'sideways_tsl_mult': 0.18145919635058325, 'sideways_time_stop': 51, 'sideways_use_sma': True, 'sideways_use_ema': False, 'sideways_use_atr': True, 'sideways_use_adx': True, 'sideways_use_spike': False, 'sideways_rsi_required': False}.
[I 2025-09-01 08:30:09,883] Trial 398 finished with values: [-1000000000.0, 1000000000.0] and parameters: {'p_sma': 21, 'p_std': 55, 'p_atr': 28, 'p_adx': 11, 'rsi_period': 57, 'ema1': 17, 'ema2': 12, 'slip_atr_k': 0.06104491029475767, 'slip_spread_k': 0.642884861779446, 'spread_hl_frac': 0.015715673399578745, 'bb_std_mult': 0.8450544654698211, 'rsi_os': 53, 'rsi_ob': 75, 'vol_spike': 0.05640014929925781, 'adx_thresh': 23.79389180756929, 'atr_min_pct': 1.241165892320456e-05, 'atr_max_pct': 0.12167676457050769, 'tp_mult': 1.682403070298115, 'tsl_mult': 0.07145009339472992, 'strategy': 'mean_reversion', 'time_stop': 243, 'use_sma': False, 'use_atr': False, 'use_adx': False, 'use_ema': True, 'use_spike': True, 'rsi_required': True, 'edge_k': 0.1625756531909741, 'edge_cap': 0.7292981936339308, 'bull_strategy': 'breakout', 'bull_bb_std_mult': 3.585219563008393, 'bull_rsi_os': 48, 'bull_rsi_ob': 85, 'bull_adx_thresh': 6.639065258305064, 'bull_atr_min_pct': 0.004388987157015813, 'bull_atr_max_pct': 0.06439011738862378, 'bull_tp_mult': 2.2830319939334296, 'bull_tsl_mult': 0.9827012437725076, 'bull_time_stop': 42, 'bull_use_sma': True, 'bull_use_ema': True, 'bull_use_atr': True, 'bull_use_adx': True, 'bull_use_spike': True, 'bull_rsi_required': False, 'bear_strategy': 'mean_reversion', 'bear_bb_std_mult': 1.8121380324570995, 'bear_rsi_os': 45, 'bear_rsi_ob': 79, 'bear_adx_thresh': 6.382914709340124, 'bear_atr_min_pct': 0.007139516363546744, 'bear_atr_max_pct': 0.0849535309940111, 'bear_tp_mult': 2.313421364544045, 'bear_tsl_mult': 0.08290936902509558, 'bear_time_stop': 300, 'bear_use_sma': True, 'bear_use_ema': False, 'bear_use_atr': False, 'bear_use_adx': True, 'bear_use_spike': True, 'bear_rsi_required': False, 'sideways_strategy': 'breakout', 'sideways_bb_std_mult': 0.5018466331969, 'sideways_rsi_os': 7, 'sideways_rsi_ob': 55, 'sideways_adx_thresh': 14.251283237650101, 'sideways_atr_min_pct': 0.02233970641571706, 'sideways_atr_max_pct': 0.010174319933940563, 'sideways_tp_mult': 1.3169852965374924, 'sideways_tsl_mult': 0.049241035548631115, 'sideways_time_stop': 24, 'sideways_use_sma': True, 'sideways_use_ema': True, 'sideways_use_atr': True, 'sideways_use_adx': True, 'sideways_use_spike': False, 'sideways_rsi_required': False}.
[I 2025-09-01 08:30:09,891] Trial 400 finished with values: [-1000000000.0, 1000000000.0] and parameters: {'p_sma': 28, 'p_std': 47, 'p_atr': 17, 'p_adx': 11, 'rsi_period': 57, 'ema1': 15, 'ema2': 31, 'slip_atr_k': 0.06382295257306088, 'slip_spread_k': 0.018832015324790063, 'spread_hl_frac': 0.016087368117883378, 'bb_std_mult': 1.9764894948543204, 'rsi_os': 53, 'rsi_ob': 92, 'vol_spike': 0.23618064586190207, 'adx_thresh': 27.45437149784355, 'atr_min_pct': 0.005494324659671402, 'atr_max_pct': 0.12709644597300618, 'tp_mult': 1.6884803983481536, 'tsl_mult': 0.8813994564181455, 'strategy': 'mean_reversion', 'time_stop': 150, 'use_sma': False, 'use_atr': True, 'use_adx': False, 'use_ema': True, 'use_spike': True, 'rsi_required': True, 'edge_k': 0.40484843707219853, 'edge_cap': 0.2707409798769839, 'bull_strategy': 'mean_reversion', 'bull_bb_std_mult': 2.315932222601078, 'bull_rsi_os': 38, 'bull_rsi_ob': 47, 'bull_adx_thresh': 6.489096418308977, 'bull_atr_min_pct': 0.02914309173607329, 'bull_atr_max_pct': 0.05575713231236095, 'bull_tp_mult': 2.6728366095045395, 'bull_tsl_mult': 0.5501360656394878, 'bull_time_stop': 59, 'bull_use_sma': True, 'bull_use_ema': True, 'bull_use_atr': True, 'bull_use_adx': True, 'bull_use_spike': True, 'bull_rsi_required': False, 'bear_strategy': 'mean_reversion', 'bear_bb_std_mult': 1.8143865428002626, 'bear_rsi_os': 46, 'bear_rsi_ob': 78, 'bear_adx_thresh': 6.533265377909616, 'bear_atr_min_pct': 0.00015761232069136204, 'bear_atr_max_pct': 0.145686312174766, 'bear_tp_mult': 2.1614022346069373, 'bear_tsl_mult': 0.07397642809524191, 'bear_time_stop': 294, 'bear_use_sma': False, 'bear_use_ema': True, 'bear_use_atr': True, 'bear_use_adx': True, 'bear_use_spike': True, 'bear_rsi_required': False, 'sideways_strategy': 'mean_reversion', 'sideways_bb_std_mult': 1.0130412367659989, 'sideways_rsi_os': 7, 'sideways_rsi_ob': 93, 'sideways_adx_thresh': 30.929684661453038, 'sideways_atr_min_pct': 0.02239087784299597, 'sideways_atr_max_pct': 0.010276928574898408, 'sideways_tp_mult': 1.321204226545933, 'sideways_tsl_mult': 0.0459192917607797, 'sideways_time_stop': 107, 'sideways_use_sma': True, 'sideways_use_ema': True, 'sideways_use_atr': False, 'sideways_use_adx': True, 'sideways_use_spike': False, 'sideways_rsi_required': False}.
[I 2025-09-01 08:30:48,144] Trial 397 finished with values: [-1000000000.0, 1000000000.0] and parameters: {'p_sma': 25, 'p_std': 41, 'p_atr': 21, 'p_adx': 11, 'rsi_period': 57, 'ema1': 12, 'ema2': 12, 'slip_atr_k': 0.06059751138882046, 'slip_spread_k': 0.9348592337772754, 'spread_hl_frac': 0.014174062395976352, 'bb_std_mult': 1.9862306330097168, 'rsi_os': 10, 'rsi_ob': 85, 'vol_spike': 0.2382059245216363, 'adx_thresh': 7.344970246475258, 'atr_min_pct': 0.01616572486852667, 'atr_max_pct': 0.12172098127036815, 'tp_mult': 1.662540067446092, 'tsl_mult': 0.8624784287476113, 'strategy': 'breakout', 'time_stop': 249, 'use_sma': False, 'use_atr': False, 'use_adx': True, 'use_ema': False, 'use_spike': True, 'rsi_required': True, 'edge_k': 0.5330656685339974, 'edge_cap': 0.48036346329374274, 'bull_strategy': 'breakout', 'bull_bb_std_mult': 2.7619343402392094, 'bull_rsi_os': 37, 'bull_rsi_ob': 45, 'bull_adx_thresh': 6.626976438415222, 'bull_atr_min_pct': 0.00423124419596269, 'bull_atr_max_pct': 0.0500414439047822, 'bull_tp_mult': 2.3318624874391674, 'bull_tsl_mult': 0.6102587694273789, 'bull_time_stop': 256, 'bull_use_sma': True, 'bull_use_ema': False, 'bull_use_atr': False, 'bull_use_adx': False, 'bull_use_spike': False, 'bull_rsi_required': False, 'bear_strategy': 'mean_reversion', 'bear_bb_std_mult': 1.775980214320446, 'bear_rsi_os': 45, 'bear_rsi_ob': 91, 'bear_adx_thresh': 5.4560252597559336, 'bear_atr_min_pct': 0.0073789469912761444, 'bear_atr_max_pct': 0.029643663984024106, 'bear_tp_mult': 2.1541647754613833, 'bear_tsl_mult': 0.08007370932089855, 'bear_time_stop': 291, 'bear_use_sma': True, 'bear_use_ema': False, 'bear_use_atr': False, 'bear_use_adx': True, 'bear_use_spike': False, 'bear_rsi_required': False, 'sideways_strategy': 'breakout', 'sideways_bb_std_mult': 1.6607858195672, 'sideways_rsi_os': 25, 'sideways_rsi_ob': 93, 'sideways_adx_thresh': 11.463000632751893, 'sideways_atr_min_pct': 0.02238883106636887, 'sideways_atr_max_pct': 0.015611439247699786, 'sideways_tp_mult': 1.6039168438170814, 'sideways_tsl_mult': 0.17958269190872314, 'sideways_time_stop': 213, 'sideways_use_sma': True, 'sideways_use_ema': False, 'sideways_use_atr': True, 'sideways_use_adx': True, 'sideways_use_spike': False, 'sideways_rsi_required': False}.
[I 2025-09-01 08:30:49,660] Trial 399 finished with values: [-1000000000.0, 1000000000.0] and parameters: {'p_sma': 25, 'p_std': 52, 'p_atr': 28, 'p_adx': 18, 'rsi_period': 57, 'ema1': 28, 'ema2': 12, 'slip_atr_k': 0.017937964999374306, 'slip_spread_k': 0.7686544197461841, 'spread_hl_frac': 0.03931364078735125, 'bb_std_mult': 2.8015184798461004, 'rsi_os': 25, 'rsi_ob': 92, 'vol_spike': 0.08302302772832529, 'adx_thresh': 26.39155936253395, 'atr_min_pct': 0.016314907336343283, 'atr_max_pct': 0.11910512715947696, 'tp_mult': 1.4141061318193326, 'tsl_mult': 0.07435897104921278, 'strategy': 'mean_reversion', 'time_stop': 205, 'use_sma': False, 'use_atr': False, 'use_adx': False, 'use_ema': True, 'use_spike': True, 'rsi_required': True, 'edge_k': 0.15869473149719465, 'edge_cap': 0.9119162382779118, 'bull_strategy': 'breakout', 'bull_bb_std_mult': 2.134526601046483, 'bull_rsi_os': 39, 'bull_rsi_ob': 53, 'bull_adx_thresh': 6.7914256146986745, 'bull_atr_min_pct': 0.008377267074768355, 'bull_atr_max_pct': 0.0549871930909324, 'bull_tp_mult': 2.682687620297398, 'bull_tsl_mult': 0.6108330667359221, 'bull_time_stop': 57, 'bull_use_sma': True, 'bull_use_ema': True, 'bull_use_atr': True, 'bull_use_adx': True, 'bull_use_spike': True, 'bull_rsi_required': False, 'bear_strategy': 'mean_reversion', 'bear_bb_std_mult': 1.8115929419461667, 'bear_rsi_os': 45, 'bear_rsi_ob': 81, 'bear_adx_thresh': 6.557329671118553, 'bear_atr_min_pct': 0.010752374954907287, 'bear_atr_max_pct': 0.05329989076649435, 'bear_tp_mult': 2.693133596289651, 'bear_tsl_mult': 0.8635555656001939, 'bear_time_stop': 253, 'bear_use_sma': True, 'bear_use_ema': False, 'bear_use_atr': False, 'bear_use_adx': True, 'bear_use_spike': True, 'bear_rsi_required': False, 'sideways_strategy': 'breakout', 'sideways_bb_std_mult': 0.8288302950620935, 'sideways_rsi_os': 50, 'sideways_rsi_ob': 93, 'sideways_adx_thresh': 19.4819280733198, 'sideways_atr_min_pct': 0.025603946615561715, 'sideways_atr_max_pct': 0.012395196875645022, 'sideways_tp_mult': 1.326009202197716, 'sideways_tsl_mult': 0.03999003470556025, 'sideways_time_stop': 63, 'sideways_use_sma': True, 'sideways_use_ema': True, 'sideways_use_atr': False, 'sideways_use_adx': True, 'sideways_use_spike': False, 'sideways_rsi_required': False}.
[I 2025-09-01 08:30:51,966] Trial 402 finished with values: [-0.011015558917052637, 0.010810643081499672] and parameters: {'p_sma': 29, 'p_std': 44, 'p_atr': 19, 'p_adx': 13, 'rsi_period': 60, 'ema1': 26, 'ema2': 14, 'slip_atr_k': 0.009578493644361294, 'slip_spread_k': 0.9047693482768078, 'spread_hl_frac': 0.013294698106308726, 'bb_std_mult': 2.8086008929701416, 'rsi_os': 16, 'rsi_ob': 61, 'vol_spike': 0.08255480369644755, 'adx_thresh': 20.204118112612438, 'atr_min_pct': 0.002633742884018777, 'atr_max_pct': 0.11855240014939299, 'tp_mult': 1.8622060125489526, 'tsl_mult': 0.019941602704532962, 'strategy': 'breakout', 'time_stop': 209, 'use_sma': True, 'use_atr': False, 'use_adx': True, 'use_ema': True, 'use_spike': True, 'rsi_required': True, 'edge_k': 0.29689361691347294, 'edge_cap': 0.8411790659316203, 'bull_strategy': 'breakout', 'bull_bb_std_mult': 2.1330778529284347, 'bull_rsi_os': 51, 'bull_rsi_ob': 62, 'bull_adx_thresh': 8.244134906613372, 'bull_atr_min_pct': 0.0022484351738944214, 'bull_atr_max_pct': 0.0673153921276552, 'bull_tp_mult': 1.6216552506521673, 'bull_tsl_mult': 0.6043463446463483, 'bull_time_stop': 76, 'bull_use_sma': False, 'bull_use_ema': True, 'bull_use_atr': False, 'bull_use_adx': False, 'bull_use_spike': False, 'bull_rsi_required': True, 'bear_strategy': 'breakout', 'bear_bb_std_mult': 1.890473608935869, 'bear_rsi_os': 20, 'bear_rsi_ob': 81, 'bear_adx_thresh': 5.040886037825371, 'bear_atr_min_pct': 0.004432415564344172, 'bear_atr_max_pct': 0.07928510683287607, 'bear_tp_mult': 2.265951923574623, 'bear_tsl_mult': 0.13719518404608572, 'bear_time_stop': 279, 'bear_use_sma': True, 'bear_use_ema': False, 'bear_use_atr': True, 'bear_use_adx': False, 'bear_use_spike': False, 'bear_rsi_required': False, 'sideways_strategy': 'breakout', 'sideways_bb_std_mult': 2.9073057614584776, 'sideways_rsi_os': 6, 'sideways_rsi_ob': 60, 'sideways_adx_thresh': 11.752775718479006, 'sideways_atr_min_pct': 0.025529320147298234, 'sideways_atr_max_pct': 0.022657277129587736, 'sideways_tp_mult': 1.2688368302175685, 'sideways_tsl_mult': 0.2246016466367578, 'sideways_time_stop': 66, 'sideways_use_sma': True, 'sideways_use_ema': True, 'sideways_use_atr': True, 'sideways_use_adx': True, 'sideways_use_spike': False, 'sideways_rsi_required': True}.
[I 2025-09-01 08:30:51,967] Trial 401 finished with values: [-1000000000.0, 1000000000.0] and parameters: {'p_sma': 28, 'p_std': 47, 'p_atr': 17, 'p_adx': 18, 'rsi_period': 58, 'ema1': 15, 'ema2': 14, 'slip_atr_k': 0.008724125698698997, 'slip_spread_k': 0.17175479436831953, 'spread_hl_frac': 0.0478305493048605, 'bb_std_mult': 2.8065420585707344, 'rsi_os': 20, 'rsi_ob': 84, 'vol_spike': 0.23594405462514959, 'adx_thresh': 7.347308097569041, 'atr_min_pct': 0.014266696907821456, 'atr_max_pct': 0.12596260088059202, 'tp_mult': 1.8761034480803214, 'tsl_mult': 0.7825440172838789, 'strategy': 'breakout', 'time_stop': 15, 'use_sma': True, 'use_atr': True, 'use_adx': True, 'use_ema': True, 'use_spike': True, 'rsi_required': True, 'edge_k': 0.2954028557025344, 'edge_cap': 0.8754777676737916, 'bull_strategy': 'mean_reversion', 'bull_bb_std_mult': 1.8781076837057622, 'bull_rsi_os': 38, 'bull_rsi_ob': 53, 'bull_adx_thresh': 6.532978704493608, 'bull_atr_min_pct': 0.029233555107777472, 'bull_atr_max_pct': 0.06846750769457918, 'bull_tp_mult': 2.830944674383147, 'bull_tsl_mult': 0.8314199868555954, 'bull_time_stop': 56, 'bull_use_sma': False, 'bull_use_ema': True, 'bull_use_atr': False, 'bull_use_adx': False, 'bull_use_spike': False, 'bull_rsi_required': True, 'bear_strategy': 'breakout', 'bear_bb_std_mult': 1.8804042342506941, 'bear_rsi_os': 14, 'bear_rsi_ob': 81, 'bear_adx_thresh': 6.780375229170535, 'bear_atr_min_pct': 0.0008785564953008359, 'bear_atr_max_pct': 0.029502034986328973, 'bear_tp_mult': 1.7118068408228988, 'bear_tsl_mult': 0.13655182824135187, 'bear_time_stop': 74, 'bear_use_sma': False, 'bear_use_ema': True, 'bear_use_atr': True, 'bear_use_adx': False, 'bear_use_spike': False, 'bear_rsi_required': False, 'sideways_strategy': 'mean_reversion', 'sideways_bb_std_mult': 1.0215998481874757, 'sideways_rsi_os': 22, 'sideways_rsi_ob': 93, 'sideways_adx_thresh': 14.85729902051841, 'sideways_atr_min_pct': 0.02516349609476563, 'sideways_atr_max_pct': 0.022482629969999907, 'sideways_tp_mult': 1.0875708581043688, 'sideways_tsl_mult': 0.2350674760014087, 'sideways_time_stop': 5, 'sideways_use_sma': True, 'sideways_use_ema': True, 'sideways_use_atr': False, 'sideways_use_adx': True, 'sideways_use_spike': False, 'sideways_rsi_required': False}.
[I 2025-09-01 08:31:36,510] Trial 405 finished with values: [-1000000000.0, 1000000000.0] and parameters: {'p_sma': 55, 'p_std': 38, 'p_atr': 20, 'p_adx': 19, 'rsi_period': 49, 'ema1': 14, 'ema2': 20, 'slip_atr_k': 0.07450503177501662, 'slip_spread_k': 0.9005111197454183, 'spread_hl_frac': 0.023592636622887474, 'bb_std_mult': 1.3092405898443378, 'rsi_os': 33, 'rsi_ob': 52, 'vol_spike': 0.1729456562528357, 'adx_thresh': 28.8240723198871, 'atr_min_pct': 0.003938095661013099, 'atr_max_pct': 0.10457693287915155, 'tp_mult': 1.6256607518559787, 'tsl_mult': 0.050593634496761346, 'strategy': 'breakout', 'time_stop': 228, 'use_sma': False, 'use_atr': False, 'use_adx': True, 'use_ema': True, 'use_spike': False, 'rsi_required': False, 'edge_k': 0.23180109468894416, 'edge_cap': 0.1653326836155351, 'bull_strategy': 'breakout', 'bull_bb_std_mult': 3.0143606532637888, 'bull_rsi_os': 21, 'bull_rsi_ob': 70, 'bull_adx_thresh': 8.900944760549455, 'bull_atr_min_pct': 0.027602348239680767, 'bull_atr_max_pct': 0.05921917128126877, 'bull_tp_mult': 1.4324516273359396, 'bull_tsl_mult': 0.5779437026527894, 'bull_time_stop': 203, 'bull_use_sma': True, 'bull_use_ema': False, 'bull_use_atr': False, 'bull_use_adx': False, 'bull_use_spike': False, 'bull_rsi_required': False, 'bear_strategy': 'mean_reversion', 'bear_bb_std_mult': 1.4387072916172907, 'bear_rsi_os': 35, 'bear_rsi_ob': 77, 'bear_adx_thresh': 34.22877823999518, 'bear_atr_min_pct': 0.008286984104404878, 'bear_atr_max_pct': 0.1002510992969493, 'bear_tp_mult': 1.4486470076577205, 'bear_tsl_mult': 0.10320243238303585, 'bear_time_stop': 269, 'bear_use_sma': True, 'bear_use_ema': False, 'bear_use_atr': False, 'bear_use_adx': False, 'bear_use_spike': False, 'bear_rsi_required': True, 'sideways_strategy': 'breakout', 'sideways_bb_std_mult': 1.7625391777359143, 'sideways_rsi_os': 8, 'sideways_rsi_ob': 95, 'sideways_adx_thresh': 16.08979070484491, 'sideways_atr_min_pct': 0.028962874029607726, 'sideways_atr_max_pct': 0.014700611343038563, 'sideways_tp_mult': 1.1981201152982202, 'sideways_tsl_mult': 0.4487025530660574, 'sideways_time_stop': 191, 'sideways_use_sma': False, 'sideways_use_ema': True, 'sideways_use_atr': True, 'sideways_use_adx': False, 'sideways_use_spike': True, 'sideways_rsi_required': False}.
[I 2025-09-01 08:31:36,859] Trial 406 finished with values: [-0.010841600103623228, 0.010886604398548268] and parameters: {'p_sma': 23, 'p_std': 38, 'p_atr': 20, 'p_adx': 10, 'rsi_period': 53, 'ema1': 20, 'ema2': 20, 'slip_atr_k': 0.0525688715352936, 'slip_spread_k': 0.8969785429049635, 'spread_hl_frac': 0.012799299336087403, 'bb_std_mult': 1.6955463813367118, 'rsi_os': 33, 'rsi_ob': 45, 'vol_spike': 0.24592994912274807, 'adx_thresh': 15.67393331268956, 'atr_min_pct': 0.008933631991511148, 'atr_max_pct': 0.11416028229678134, 'tp_mult': 1.9425335704053577, 'tsl_mult': 0.04346590655438726, 'strategy': 'breakout', 'time_stop': 230, 'use_sma': False, 'use_atr': False, 'use_adx': True, 'use_ema': True, 'use_spike': False, 'rsi_required': False, 'edge_k': 0.233543448289076, 'edge_cap': 0.07948694257407268, 'bull_strategy': 'breakout', 'bull_bb_std_mult': 0.5198211417035996, 'bull_rsi_os': 26, 'bull_rsi_ob': 80, 'bull_adx_thresh': 7.201756051170463, 'bull_atr_min_pct': 0.002383445312602531, 'bull_atr_max_pct': 0.05928399995628563, 'bull_tp_mult': 1.4567933035435716, 'bull_tsl_mult': 0.5687579264673842, 'bull_time_stop': 71, 'bull_use_sma': True, 'bull_use_ema': False, 'bull_use_atr': False, 'bull_use_adx': False, 'bull_use_spike': False, 'bull_rsi_required': False, 'bear_strategy': 'mean_reversion', 'bear_bb_std_mult': 1.714319485756621, 'bear_rsi_os': 48, 'bear_rsi_ob': 95, 'bear_adx_thresh': 19.46204811338391, 'bear_atr_min_pct': 0.00842405855826323, 'bear_atr_max_pct': 0.09188819463607155, 'bear_tp_mult': 2.0929451564415884, 'bear_tsl_mult': 0.46693343174518254, 'bear_time_stop': 235, 'bear_use_sma': True, 'bear_use_ema': False, 'bear_use_atr': False, 'bear_use_adx': False, 'bear_use_spike': False, 'bear_rsi_required': True, 'sideways_strategy': 'breakout', 'sideways_bb_std_mult': 1.2165570532527283, 'sideways_rsi_os': 48, 'sideways_rsi_ob': 95, 'sideways_adx_thresh': 34.34463207484161, 'sideways_atr_min_pct': 0.02999274142886833, 'sideways_atr_max_pct': 0.1227172096856466, 'sideways_tp_mult': 1.4800433844438088, 'sideways_tsl_mult': 0.1616219458965983, 'sideways_time_stop': 202, 'sideways_use_sma': False, 'sideways_use_ema': True, 'sideways_use_atr': True, 'sideways_use_adx': False, 'sideways_use_spike': True, 'sideways_rsi_required': False}.
