[I 2025-09-01 08:33:01,865] Trial 413 finished with values: [-0.020525076920108187, 0.02039526147644075] and parameters: {'p_sma': 27, 'p_std': 12, 'p_atr': 10, 'p_adx': 14, 'rsi_period': 59, 'ema1': 5, 'ema2': 11, 'slip_atr_k': 0.044334644503836444, 'slip_spread_k': 0.8173296146648631, 'spread_hl_frac': 0.015541175859151301, 'bb_std_mult': 2.2020909266516884, 'rsi_os': 18, 'rsi_ob': 67, 'vol_spike': 0.07437504783461976, 'adx_thresh': 32.01166606397338, 'atr_min_pct': 0.005265877826185456, 'atr_max_pct': 0.1252822495820065, 'tp_mult': 2.4044030134532832, 'tsl_mult': 0.08928093687840678, 'strategy': 'mean_reversion', 'time_stop': 27, 'use_sma': False, 'use_atr': False, 'use_adx': False, 'use_ema': True, 'use_spike': True, 'rsi_required': True, 'edge_k': 0.14144577179840817, 'edge_cap': 0.5728655981894594, 'bull_strategy': 'breakout', 'bull_bb_std_mult': 3.2370348136124405, 'bull_rsi_os': 45, 'bull_rsi_ob': 46, 'bull_adx_thresh': 5.038738521538287, 'bull_atr_min_pct': 0.0027808680322685742, 'bull_atr_max_pct': 0.06518849025244479, 'bull_tp_mult': 1.4889807878836685, 'bull_tsl_mult': 0.6615815550715903, 'bull_time_stop': 65, 'bull_use_sma': True, 'bull_use_ema': False, 'bull_use_atr': True, 'bull_use_adx': True, 'bull_use_spike': True, 'bull_rsi_required': False, 'bear_strategy': 'mean_reversion', 'bear_bb_std_mult': 2.4305437043587643, 'bear_rsi_os': 46, 'bear_rsi_ob': 83, 'bear_adx_thresh': 21.957897354319158, 'bear_atr_min_pct': 0.014786512000613327, 'bear_atr_max_pct': 0.03478973602359489, 'bear_tp_mult': 1.5998274755698776, 'bear_tsl_mult': 0.5688404589522784, 'bear_time_stop': 294, 'bear_use_sma': False, 'bear_use_ema': True, 'bear_use_atr': False, 'bear_use_adx': False, 'bear_use_spike': True, 'bear_rsi_required': False, 'sideways_strategy': 'mean_reversion', 'sideways_bb_std_mult': 1.0784211103725545, 'sideways_rsi_os': 16, 'sideways_rsi_ob': 94, 'sideways_adx_thresh': 5.015974006258478, 'sideways_atr_min_pct': 0.0023403179670298674, 'sideways_atr_max_pct': 0.019825154675857156, 'sideways_tp_mult': 1.291921142983705, 'sideways_tsl_mult': 0.279342274899745, 'sideways_time_stop': 244, 'sideways_use_sma': True, 'sideways_use_ema': True, 'sideways_use_atr': False, 'sideways_use_adx': True, 'sideways_use_spike': False, 'sideways_rsi_required': False}.
[I 2025-09-01 08:33:45,517] Trial 415 finished with values: [-1000000000.0, 1000000000.0] and parameters: {'p_sma': 41, 'p_std': 17, 'p_atr': 18, 'p_adx': 30, 'rsi_period': 32, 'ema1': 13, 'ema2': 39, 'slip_atr_k': 0.013797827557738715, 'slip_spread_k': 0.9634047475987176, 'spread_hl_frac': 0.041298264681327745, 'bb_std_mult': 2.6932765221417503, 'rsi_os': 6, 'rsi_ob': 92, 'vol_spike': 0.07455182011519387, 'adx_thresh': 31.904451217752115, 'atr_min_pct': 0.023098113259165266, 'atr_max_pct': 0.13354319285230803, 'tp_mult': 1.4974680140282621, 'tsl_mult': 0.4554005370070497, 'strategy': 'breakout', 'time_stop': 253, 'use_sma': False, 'use_atr': False, 'use_adx': True, 'use_ema': False, 'use_spike': True, 'rsi_required': True, 'edge_k': 0.2529167839082305, 'edge_cap': 0.2165503956971248, 'bull_strategy': 'breakout', 'bull_bb_std_mult': 3.1692019397055105, 'bull_rsi_os': 41, 'bull_rsi_ob': 89, 'bull_adx_thresh': 9.338147935575298, 'bull_atr_min_pct': 0.020190828550682133, 'bull_atr_max_pct': 0.0704432705133441, 'bull_tp_mult': 1.7085433372990493, 'bull_tsl_mult': 0.5983005187369144, 'bull_time_stop': 62, 'bull_use_sma': True, 'bull_use_ema': False, 'bull_use_atr': False, 'bull_use_adx': False, 'bull_use_spike': False, 'bull_rsi_required': False, 'bear_strategy': 'mean_reversion', 'bear_bb_std_mult': 1.7472626201759425, 'bear_rsi_os': 52, 'bear_rsi_ob': 83, 'bear_adx_thresh': 5.0362407317593725, 'bear_atr_min_pct': 0.02671136434813333, 'bear_atr_max_pct': 0.09981381288490104, 'bear_tp_mult': 2.2033835070159093, 'bear_tsl_mult': 0.5791358042695797, 'bear_time_stop': 295, 'bear_use_sma': True, 'bear_use_ema': False, 'bear_use_atr': False, 'bear_use_adx': True, 'bear_use_spike': False, 'bear_rsi_required': False, 'sideways_strategy': 'breakout', 'sideways_bb_std_mult': 1.056274350782181, 'sideways_rsi_os': 5, 'sideways_rsi_ob': 94, 'sideways_adx_thresh': 10.313420360656112, 'sideways_atr_min_pct': 0.028422464476362857, 'sideways_atr_max_pct': 0.018925129462255975, 'sideways_tp_mult': 2.1820535102764915, 'sideways_tsl_mult': 0.06798870764782888, 'sideways_time_stop': 269, 'sideways_use_sma': True, 'sideways_use_ema': False, 'sideways_use_atr': True, 'sideways_use_adx': True, 'sideways_use_spike': False, 'sideways_rsi_required': False}.
[I 2025-09-01 08:33:45,826] Trial 417 finished with values: [-1000000000.0, 1000000000.0] and parameters: {'p_sma': 41, 'p_std': 7, 'p_atr': 19, 'p_adx': 19, 'rsi_period': 59, 'ema1': 13, 'ema2': 15, 'slip_atr_k': 0.07792979200292491, 'slip_spread_k': 0.9504372674553189, 'spread_hl_frac': 0.015289744378163122, 'bb_std_mult': 2.689067058125269, 'rsi_os': 28, 'rsi_ob': 95, 'vol_spike': 0.18148950003504008, 'adx_thresh': 29.486021397779723, 'atr_min_pct': 0.01221622106905191, 'atr_max_pct': 0.11595251352485628, 'tp_mult': 1.9223100437604441, 'tsl_mult': 0.02498733660390894, 'strategy': 'breakout', 'time_stop': 246, 'use_sma': False, 'use_atr': False, 'use_adx': True, 'use_ema': False, 'use_spike': True, 'rsi_required': True, 'edge_k': 0.12901763566146102, 'edge_cap': 0.677935687364551, 'bull_strategy': 'breakout', 'bull_bb_std_mult': 2.4602319382368507, 'bull_rsi_os': 6, 'bull_rsi_ob': 89, 'bull_adx_thresh': 9.104105988259958, 'bull_atr_min_pct': 0.015003859037395918, 'bull_atr_max_pct': 0.056069800565784804, 'bull_tp_mult': 1.5274961782673995, 'bull_tsl_mult': 0.6011404145066376, 'bull_time_stop': 62, 'bull_use_sma': True, 'bull_use_ema': True, 'bull_use_atr': False, 'bull_use_adx': False, 'bull_use_spike': False, 'bull_rsi_required': False, 'bear_strategy': 'mean_reversion', 'bear_bb_std_mult': 0.5764871080048721, 'bear_rsi_os': 12, 'bear_rsi_ob': 83, 'bear_adx_thresh': 25.02575924989472, 'bear_atr_min_pct': 0.011957554220385734, 'bear_atr_max_pct': 0.09978113060594833, 'bear_tp_mult': 2.203585419364224, 'bear_tsl_mult': 0.9733496736700356, 'bear_time_stop': 295, 'bear_use_sma': True, 'bear_use_ema': False, 'bear_use_atr': False, 'bear_use_adx': True, 'bear_use_spike': False, 'bear_rsi_required': False, 'sideways_strategy': 'breakout', 'sideways_bb_std_mult': 2.607457509591951, 'sideways_rsi_os': 15, 'sideways_rsi_ob': 81, 'sideways_adx_thresh': 10.31219909089082, 'sideways_atr_min_pct': 0.007972544592412922, 'sideways_atr_max_pct': 0.07936761327826901, 'sideways_tp_mult': 2.9993451402117994, 'sideways_tsl_mult': 0.30241563864501925, 'sideways_time_stop': 223, 'sideways_use_sma': True, 'sideways_use_ema': False, 'sideways_use_atr': True, 'sideways_use_adx': True, 'sideways_use_spike': False, 'sideways_rsi_required': False}.
[I 2025-09-01 08:33:45,835] Trial 416 finished with values: [-1000000000.0, 1000000000.0] and parameters: {'p_sma': 19, 'p_std': 45, 'p_atr': 18, 'p_adx': 29, 'rsi_period': 59, 'ema1': 13, 'ema2': 42, 'slip_atr_k': 0.043791277309295114, 'slip_spread_k': 0.8720515846731313, 'spread_hl_frac': 0.015582339743072668, 'bb_std_mult': 2.7002268641593536, 'rsi_os': 6, 'rsi_ob': 95, 'vol_spike': 0.07747658477952828, 'adx_thresh': 29.482211659679823, 'atr_min_pct': 0.0035619710318087403, 'atr_max_pct': 0.1392531287035389, 'tp_mult': 2.4121078489284975, 'tsl_mult': 0.03357249112870016, 'strategy': 'breakout', 'time_stop': 243, 'use_sma': False, 'use_atr': False, 'use_adx': False, 'use_ema': False, 'use_spike': True, 'rsi_required': True, 'edge_k': 1.050138229592425, 'edge_cap': 0.21379606353078734, 'bull_strategy': 'breakout', 'bull_bb_std_mult': 3.153448646348598, 'bull_rsi_os': 35, 'bull_rsi_ob': 55, 'bull_adx_thresh': 25.81107642795925, 'bull_atr_min_pct': 0.003967603375709901, 'bull_atr_max_pct': 0.05699286372568138, 'bull_tp_mult': 1.3251797407091592, 'bull_tsl_mult': 0.6657145345653459, 'bull_time_stop': 61, 'bull_use_sma': True, 'bull_use_ema': False, 'bull_use_atr': True, 'bull_use_adx': False, 'bull_use_spike': True, 'bull_rsi_required': False, 'bear_strategy': 'mean_reversion', 'bear_bb_std_mult': 1.9623538786475716, 'bear_rsi_os': 44, 'bear_rsi_ob': 83, 'bear_adx_thresh': 5.019698544711654, 'bear_atr_min_pct': 0.009251666470422335, 'bear_atr_max_pct': 0.09910609236805189, 'bear_tp_mult': 2.148809419319131, 'bear_tsl_mult': 0.5489157627215417, 'bear_time_stop': 294, 'bear_use_sma': True, 'bear_use_ema': False, 'bear_use_atr': False, 'bear_use_adx': True, 'bear_use_spike': True, 'bear_rsi_required': False, 'sideways_strategy': 'breakout', 'sideways_bb_std_mult': 1.0733664617627878, 'sideways_rsi_os': 5, 'sideways_rsi_ob': 94, 'sideways_adx_thresh': 10.335209938211793, 'sideways_atr_min_pct': 0.028651160891657892, 'sideways_atr_max_pct': 0.019304789393569215, 'sideways_tp_mult': 1.295118627641559, 'sideways_tsl_mult': 0.8215585556850025, 'sideways_time_stop': 224, 'sideways_use_sma': True, 'sideways_use_ema': False, 'sideways_use_atr': True, 'sideways_use_adx': True, 'sideways_use_spike': False, 'sideways_rsi_required': False}.
[I 2025-09-01 08:33:46,107] Trial 418 finished with values: [-1000000000.0, 1000000000.0] and parameters: {'p_sma': 28, 'p_std': 53, 'p_atr': 21, 'p_adx': 28, 'rsi_period': 79, 'ema1': 13, 'ema2': 15, 'slip_atr_k': 0.014420561215003598, 'slip_spread_k': 0.9612753981781886, 'spread_hl_frac': 0.014232758022989749, 'bb_std_mult': 1.8841712532286228, 'rsi_os': 26, 'rsi_ob': 91, 'vol_spike': 0.067977221152147, 'adx_thresh': 21.015242206415014, 'atr_min_pct': 0.0036625092745890533, 'atr_max_pct': 0.11379037444493914, 'tp_mult': 1.7067208928252542, 'tsl_mult': 0.001328321561520518, 'strategy': 'breakout', 'time_stop': 246, 'use_sma': False, 'use_atr': True, 'use_adx': True, 'use_ema': False, 'use_spike': True, 'rsi_required': True, 'edge_k': 0.10769594950640166, 'edge_cap': 0.17944814535613957, 'bull_strategy': 'mean_reversion', 'bull_bb_std_mult': 1.299395952911206, 'bull_rsi_os': 52, 'bull_rsi_ob': 72, 'bull_adx_thresh': 9.164661311422407, 'bull_atr_min_pct': 0.0015090670902039136, 'bull_atr_max_pct': 0.06971333827510245, 'bull_tp_mult': 1.3622089540962206, 'bull_tsl_mult': 0.5927741179529457, 'bull_time_stop': 60, 'bull_use_sma': True, 'bull_use_ema': True, 'bull_use_atr': False, 'bull_use_adx': False, 'bull_use_spike': False, 'bull_rsi_required': False, 'bear_strategy': 'mean_reversion', 'bear_bb_std_mult': 0.6002155740135693, 'bear_rsi_os': 37, 'bear_rsi_ob': 53, 'bear_adx_thresh': 5.032611216931707, 'bear_atr_min_pct': 0.007766167134873242, 'bear_atr_max_pct': 0.09990222067043524, 'bear_tp_mult': 2.2011730792490543, 'bear_tsl_mult': 0.9691047245181021, 'bear_time_stop': 160, 'bear_use_sma': True, 'bear_use_ema': False, 'bear_use_atr': False, 'bear_use_adx': True, 'bear_use_spike': False, 'bear_rsi_required': False, 'sideways_strategy': 'breakout', 'sideways_bb_std_mult': 0.7283016663559967, 'sideways_rsi_os': 5, 'sideways_rsi_ob': 93, 'sideways_adx_thresh': 10.95546764601075, 'sideways_atr_min_pct': 0.0286729359500531, 'sideways_atr_max_pct': 0.10779941803644424, 'sideways_tp_mult': 1.2098763390928462, 'sideways_tsl_mult': 0.30250468866927277, 'sideways_time_stop': 224, 'sideways_use_sma': True, 'sideways_use_ema': False, 'sideways_use_atr': True, 'sideways_use_adx': True, 'sideways_use_spike': False, 'sideways_rsi_required': False}.
[I 2025-09-01 08:34:28,700] Trial 421 finished with values: [-1000000000.0, 1000000000.0] and parameters: {'p_sma': 29, 'p_std': 50, 'p_atr': 24, 'p_adx': 12, 'rsi_period': 48, 'ema1': 19, 'ema2': 55, 'slip_atr_k': 0.0925228131270259, 'slip_spread_k': 0.2729198136253692, 'spread_hl_frac': 0.03496879369215541, 'bb_std_mult': 2.0616257162153215, 'rsi_os': 22, 'rsi_ob': 69, 'vol_spike': 0.29097412240300463, 'adx_thresh': 28.361676929334635, 'atr_min_pct': 0.004548330967782044, 'atr_max_pct': 0.12467951635342772, 'tp_mult': 1.7512998789271503, 'tsl_mult': 0.05835421289488202, 'strategy': 'breakout', 'time_stop': 217, 'use_sma': True, 'use_atr': False, 'use_adx': True, 'use_ema': True, 'use_spike': True, 'rsi_required': False, 'edge_k': 0.6964030170838704, 'edge_cap': 0.2747805030884879, 'bull_strategy': 'breakout', 'bull_bb_std_mult': 2.8149199844063326, 'bull_rsi_os': 30, 'bull_rsi_ob': 82, 'bull_adx_thresh': 8.396165267901992, 'bull_atr_min_pct': 0.0038762716053540045, 'bull_atr_max_pct': 0.05259160637554239, 'bull_tp_mult': 1.5786027941568894, 'bull_tsl_mult': 0.21655757415067706, 'bull_time_stop': 171, 'bull_use_sma': False, 'bull_use_ema': True, 'bull_use_atr': False, 'bull_use_adx': False, 'bull_use_spike': False, 'bull_rsi_required': True, 'bear_strategy': 'breakout', 'bear_bb_std_mult': 1.6521014319395086, 'bear_rsi_os': 48, 'bear_rsi_ob': 80, 'bear_adx_thresh': 5.943912905471618, 'bear_atr_min_pct': 0.0068038420375097575, 'bear_atr_max_pct': 0.08158276980742166, 'bear_tp_mult': 2.112732970266555, 'bear_tsl_mult': 0.6155760469736989, 'bear_time_stop': 275, 'bear_use_sma': True, 'bear_use_ema': False, 'bear_use_atr': True, 'bear_use_adx': False, 'bear_use_spike': False, 'bear_rsi_required': False, 'sideways_strategy': 'breakout', 'sideways_bb_std_mult': 3.3067255879366098, 'sideways_rsi_os': 7, 'sideways_rsi_ob': 91, 'sideways_adx_thresh': 17.51823003548313, 'sideways_atr_min_pct': 0.024009060392846702, 'sideways_atr_max_pct': 0.014669716507365546, 'sideways_tp_mult': 1.3680456087345858, 'sideways_tsl_mult': 0.19856968754619503, 'sideways_time_stop': 96, 'sideways_use_sma': False, 'sideways_use_ema': True, 'sideways_use_atr': False, 'sideways_use_adx': False, 'sideways_use_spike': True, 'sideways_rsi_required': False}.
[I 2025-09-01 08:34:29,344] Trial 422 finished with values: [-1000000000.0, 1000000000.0] and parameters: {'p_sma': 34, 'p_std': 19, 'p_atr': 24, 'p_adx': 12, 'rsi_period': 48, 'ema1': 19, 'ema2': 16, 'slip_atr_k': 0.06903658967154719, 'slip_spread_k': 0.06690577685157939, 'spread_hl_frac': 0.03490764819599879, 'bb_std_mult': 1.4578073601991344, 'rsi_os': 38, 'rsi_ob': 58, 'vol_spike': 0.28854427114432235, 'adx_thresh': 26.96456104991083, 'atr_min_pct': 0.004568452068143868, 'atr_max_pct': 0.12422193108894128, 'tp_mult': 1.7410533171519214, 'tsl_mult': 0.05724070133886316, 'strategy': 'breakout', 'time_stop': 215, 'use_sma': True, 'use_atr': False, 'use_adx': True, 'use_ema': True, 'use_spike': True, 'rsi_required': False, 'edge_k': 0.3204515450486255, 'edge_cap': 0.27897018783075744, 'bull_strategy': 'breakout', 'bull_bb_std_mult': 2.804332826722256, 'bull_rsi_os': 48, 'bull_rsi_ob': 82, 'bull_adx_thresh': 8.217201110190269, 'bull_atr_min_pct': 0.006947578401443695, 'bull_atr_max_pct': 0.063707789583248, 'bull_tp_mult': 1.1739485440598383, 'bull_tsl_mult': 0.6265545842496489, 'bull_time_stop': 72, 'bull_use_sma': False, 'bull_use_ema': True, 'bull_use_atr': False, 'bull_use_adx': False, 'bull_use_spike': False, 'bull_rsi_required': True, 'bear_strategy': 'breakout', 'bear_bb_std_mult': 1.6198038363856693, 'bear_rsi_os': 48, 'bear_rsi_ob': 78, 'bear_adx_thresh': 7.018414579003377, 'bear_atr_min_pct': 0.024650650839688773, 'bear_atr_max_pct': 0.0816104088672859, 'bear_tp_mult': 2.248235516857235, 'bear_tsl_mult': 0.6632427569590975, 'bear_time_stop': 41, 'bear_use_sma': True, 'bear_use_ema': False, 'bear_use_atr': True, 'bear_use_adx': False, 'bear_use_spike': False, 'bear_rsi_required': False, 'sideways_strategy': 'breakout', 'sideways_bb_std_mult': 1.1409471836406737, 'sideways_rsi_os': 7, 'sideways_rsi_ob': 91, 'sideways_adx_thresh': 25.904537462967696, 'sideways_atr_min_pct': 0.023147478418986702, 'sideways_atr_max_pct': 0.11816467976105731, 'sideways_tp_mult': 1.3663443619097408, 'sideways_tsl_mult': 0.9152537110345944, 'sideways_time_stop': 113, 'sideways_use_sma': False, 'sideways_use_ema': True, 'sideways_use_atr': False, 'sideways_use_adx': False, 'sideways_use_spike': True, 'sideways_rsi_required': False}.
[I 2025-09-01 08:34:29,661] Trial 419 finished with values: [-1000000000.0, 1000000000.0] and parameters: {'p_sma': 34, 'p_std': 24, 'p_atr': 21, 'p_adx': 29, 'rsi_period': 71, 'ema1': 19, 'ema2': 18, 'slip_atr_k': 0.008890735004059415, 'slip_spread_k': 0.8743931699575966, 'spread_hl_frac': 0.014132994670696935, 'bb_std_mult': 1.875748401685969, 'rsi_os': 22, 'rsi_ob': 68, 'vol_spike': 0.06810311075254437, 'adx_thresh': 26.16435566318617, 'atr_min_pct': 0.0037587149391749386, 'atr_max_pct': 0.12489875661091102, 'tp_mult': 2.074319595012481, 'tsl_mult': 0.06332299121777188, 'strategy': 'breakout', 'time_stop': 216, 'use_sma': True, 'use_atr': True, 'use_adx': True, 'use_ema': True, 'use_spike': True, 'rsi_required': False, 'edge_k': 0.7143671616168468, 'edge_cap': 0.1854888175982185, 'bull_strategy': 'mean_reversion', 'bull_bb_std_mult': 1.3062631010153534, 'bull_rsi_os': 48, 'bull_rsi_ob': 52, 'bull_adx_thresh': 8.356068373143623, 'bull_atr_min_pct': 0.0015182186547868983, 'bull_atr_max_pct': 0.05213354341427884, 'bull_tp_mult': 1.3708024722330885, 'bull_tsl_mult': 0.6284405032224472, 'bull_time_stop': 195, 'bull_use_sma': False, 'bull_use_ema': True, 'bull_use_atr': False, 'bull_use_adx': False, 'bull_use_spike': False, 'bull_rsi_required': True, 'bear_strategy': 'breakout', 'bear_bb_std_mult': 2.650901014390292, 'bear_rsi_os': 48, 'bear_rsi_ob': 78, 'bear_adx_thresh': 5.629499016740086, 'bear_atr_min_pct': 0.007669629958021523, 'bear_atr_max_pct': 0.14308527449290342, 'bear_tp_mult': 2.12121809583569, 'bear_tsl_mult': 0.06545069423328953, 'bear_time_stop': 287, 'bear_use_sma': True, 'bear_use_ema': False, 'bear_use_atr': True, 'bear_use_adx': False, 'bear_use_spike': False, 'bear_rsi_required': False, 'sideways_strategy': 'breakout', 'sideways_bb_std_mult': 0.7344350307732986, 'sideways_rsi_os': 8, 'sideways_rsi_ob': 71, 'sideways_adx_thresh': 11.18336176625772, 'sideways_atr_min_pct': 0.01039181972237632, 'sideways_atr_max_pct': 0.014676438981590847, 'sideways_tp_mult': 1.6997096478884886, 'sideways_tsl_mult': 0.1895413313114415, 'sideways_time_stop': 300, 'sideways_use_sma': False, 'sideways_use_ema': True, 'sideways_use_atr': True, 'sideways_use_adx': False, 'sideways_use_spike': True, 'sideways_rsi_required': False}.
[I 2025-09-01 08:34:29,879] Trial 420 finished with values: [-1000000000.0, 1000000000.0] and parameters: {'p_sma': 10, 'p_std': 25, 'p_atr': 24, 'p_adx': 29, 'rsi_period': 44, 'ema1': 11, 'ema2': 47, 'slip_atr_k': 0.008766318683035155, 'slip_spread_k': 0.7035411585246936, 'spread_hl_frac': 0.03508294682863281, 'bb_std_mult': 1.456697005779982, 'rsi_os': 30, 'rsi_ob': 76, 'vol_spike': 0.0548219690584979, 'adx_thresh': 26.85332627732355, 'atr_min_pct': 0.004728429306517167, 'atr_max_pct': 0.10672078167018847, 'tp_mult': 1.747779147813125, 'tsl_mult': 0.055271967760408804, 'strategy': 'breakout', 'time_stop': 283, 'use_sma': True, 'use_atr': False, 'use_adx': True, 'use_ema': True, 'use_spike': True, 'rsi_required': False, 'edge_k': 0.3279567581796775, 'edge_cap': 0.23190744589642642, 'bull_strategy': 'breakout', 'bull_bb_std_mult': 3.061223512917764, 'bull_rsi_os': 47, 'bull_rsi_ob': 51, 'bull_adx_thresh': 8.208984977312017, 'bull_atr_min_pct': 0.004154841501747204, 'bull_atr_max_pct': 0.053489554657023514, 'bull_tp_mult': 1.5454130213222461, 'bull_tsl_mult': 0.6266179729228425, 'bull_time_stop': 50, 'bull_use_sma': False, 'bull_use_ema': True, 'bull_use_atr': False, 'bull_use_adx': False, 'bull_use_spike': False, 'bull_rsi_required': True, 'bear_strategy': 'breakout', 'bear_bb_std_mult': 1.6208238878647865, 'bear_rsi_os': 48, 'bear_rsi_ob': 71, 'bear_adx_thresh': 5.949225259234993, 'bear_atr_min_pct': 0.006829053944283884, 'bear_atr_max_pct': 0.08222099501459965, 'bear_tp_mult': 2.1201030436689985, 'bear_tsl_mult': 0.06719561713623168, 'bear_time_stop': 135, 'bear_use_sma': True, 'bear_use_ema': False, 'bear_use_atr': True, 'bear_use_adx': False, 'bear_use_spike': False, 'bear_rsi_required': False, 'sideways_strategy': 'breakout', 'sideways_bb_std_mult': 1.16522891210329, 'sideways_rsi_os': 7, 'sideways_rsi_ob': 91, 'sideways_adx_thresh': 12.637799391557968, 'sideways_atr_min_pct': 0.0231175920390751, 'sideways_atr_max_pct': 0.015492173568298075, 'sideways_tp_mult': 1.697957390922574, 'sideways_tsl_mult': 0.19165013674028675, 'sideways_time_stop': 34, 'sideways_use_sma': False, 'sideways_use_ema': True, 'sideways_use_atr': False, 'sideways_use_adx': False, 'sideways_use_spike': True, 'sideways_rsi_required': False}.
