[I 2025-09-01 08:10:34,505] Trial 288 finished with values: [-0.019365325212029716, 0.019326243978773017] and parameters: {'p_sma': 9, 'p_std': 21, 'p_atr': 25, 'p_adx': 20, 'rsi_period': 55, 'ema1': 29, 'ema2': 16, 'slip_atr_k': 0.18005961415448035, 'slip_spread_k': 0.8798369079968283, 'spread_hl_frac': 0.015964655686700007, 'bb_std_mult': 2.9982279282571156, 'rsi_os': 32, 'rsi_ob': 87, 'vol_spike': 0.05364867423466778, 'adx_thresh': 26.99680339330363, 'atr_min_pct': 0.001690003309898976, 'atr_max_pct': 0.13185476568631738, 'tp_mult': 2.4851425306949064, 'tsl_mult': 0.04356456644317676, 'strategy': 'breakout', 'time_stop': 261, 'use_sma': False, 'use_atr': False, 'use_adx': True, 'use_ema': True, 'use_spike': True, 'rsi_required': True, 'edge_k': 1.7526928603138408, 'edge_cap': 0.19000366071015548, 'bull_strategy': 'breakout', 'bull_bb_std_mult': 2.791100953294339, 'bull_rsi_os': 47, 'bull_rsi_ob': 58, 'bull_adx_thresh': 7.559971799794177, 'bull_atr_min_pct': 0.0014609741034019037, 'bull_atr_max_pct': 0.1271820491331755, 'bull_tp_mult': 1.6281035050705963, 'bull_tsl_mult': 0.9664907489457775, 'bull_time_stop': 53, 'bull_use_sma': True, 'bull_use_ema': True, 'bull_use_atr': False, 'bull_use_adx': False, 'bull_use_spike': True, 'bull_rsi_required': False, 'bear_strategy': 'mean_reversion', 'bear_bb_std_mult': 2.5060734778166944, 'bear_rsi_os': 47, 'bear_rsi_ob': 49, 'bear_adx_thresh': 6.370194367091355, 'bear_atr_min_pct': 0.013200731963238857, 'bear_atr_max_pct': 0.08465487114961422, 'bear_tp_mult': 2.0544349452790183, 'bear_tsl_mult': 0.046676555659781294, 'bear_time_stop': 277, 'bear_use_sma': True, 'bear_use_ema': False, 'bear_use_atr': True, 'bear_use_adx': False, 'bear_use_spike': False, 'bear_rsi_required': False, 'sideways_strategy': 'breakout', 'sideways_bb_std_mult': 0.9196678602890318, 'sideways_rsi_os': 6, 'sideways_rsi_ob': 93, 'sideways_adx_thresh': 12.568507095466796, 'sideways_atr_min_pct': 0.011687326776342152, 'sideways_atr_max_pct': 0.010203665766693713, 'sideways_tp_mult': 2.9915003732192975, 'sideways_tsl_mult': 0.18301344856649449, 'sideways_time_stop': 267, 'sideways_use_sma': True, 'sideways_use_ema': True, 'sideways_use_atr': True, 'sideways_use_adx': True, 'sideways_use_spike': False, 'sideways_rsi_required': True}.
[I 2025-09-01 08:10:34,490] Trial 289 finished with values: [-1000000000.0, 1000000000.0] and parameters: {'p_sma': 59, 'p_std': 50, 'p_atr': 19, 'p_adx': 27, 'rsi_period': 59, 'ema1': 14, 'ema2': 21, 'slip_atr_k': 0.041882260505945984, 'slip_spread_k': 0.8762161740262759, 'spread_hl_frac': 0.046910464427452586, 'bb_std_mult': 3.0227484726079146, 'rsi_os': 29, 'rsi_ob': 85, 'vol_spike': 0.04988927432725615, 'adx_thresh': 7.914963150039183, 'atr_min_pct': 0.0038337346661578443, 'atr_max_pct': 0.13238837831318082, 'tp_mult': 2.9852483710662208, 'tsl_mult': 0.0778949183922516, 'strategy': 'breakout', 'time_stop': 259, 'use_sma': False, 'use_atr': True, 'use_adx': False, 'use_ema': True, 'use_spike': True, 'rsi_required': True, 'edge_k': 1.5243081472725017, 'edge_cap': 0.18859604866340332, 'bull_strategy': 'mean_reversion', 'bull_bb_std_mult': 0.892574585804464, 'bull_rsi_os': 47, 'bull_rsi_ob': 68, 'bull_adx_thresh': 7.62996717902417, 'bull_atr_min_pct': 0.003987874547334152, 'bull_atr_max_pct': 0.07448584451805274, 'bull_tp_mult': 2.572284363468648, 'bull_tsl_mult': 0.5496977826909235, 'bull_time_stop': 78, 'bull_use_sma': True, 'bull_use_ema': True, 'bull_use_atr': False, 'bull_use_adx': False, 'bull_use_spike': False, 'bull_rsi_required': False, 'bear_strategy': 'mean_reversion', 'bear_bb_std_mult': 3.432899035561949, 'bear_rsi_os': 47, 'bear_rsi_ob': 78, 'bear_adx_thresh': 6.454231766067179, 'bear_atr_min_pct': 0.007657415254265889, 'bear_atr_max_pct': 0.028329330014986415, 'bear_tp_mult': 2.0516159576423245, 'bear_tsl_mult': 0.041712955583479566, 'bear_time_stop': 300, 'bear_use_sma': True, 'bear_use_ema': False, 'bear_use_atr': True, 'bear_use_adx': False, 'bear_use_spike': False, 'bear_rsi_required': False, 'sideways_strategy': 'breakout', 'sideways_bb_std_mult': 0.9374296909968072, 'sideways_rsi_os': 6, 'sideways_rsi_ob': 93, 'sideways_adx_thresh': 11.381203910523869, 'sideways_atr_min_pct': 0.011757263204433543, 'sideways_atr_max_pct': 0.010030462023209537, 'sideways_tp_mult': 1.9180619994302635, 'sideways_tsl_mult': 0.8119642721375722, 'sideways_time_stop': 210, 'sideways_use_sma': True, 'sideways_use_ema': True, 'sideways_use_atr': True, 'sideways_use_adx': False, 'sideways_use_spike': False, 'sideways_rsi_required': True}.
[I 2025-09-01 08:10:34,916] Trial 291 finished with values: [-1000000000.0, 1000000000.0] and parameters: {'p_sma': 30, 'p_std': 45, 'p_atr': 19, 'p_adx': 20, 'rsi_period': 59, 'ema1': 14, 'ema2': 16, 'slip_atr_k': 0.1293245644708776, 'slip_spread_k': 0.9028378175091507, 'spread_hl_frac': 0.013105789996192682, 'bb_std_mult': 1.738378758575585, 'rsi_os': 29, 'rsi_ob': 94, 'vol_spike': 0.05464302516373258, 'adx_thresh': 29.73759610703478, 'atr_min_pct': 0.00582460356637232, 'atr_max_pct': 0.1314418067977773, 'tp_mult': 2.9909155070280375, 'tsl_mult': 0.07391752487435399, 'strategy': 'breakout', 'time_stop': 198, 'use_sma': False, 'use_atr': True, 'use_adx': False, 'use_ema': True, 'use_spike': True, 'rsi_required': True, 'edge_k': 0.2793131477977834, 'edge_cap': 0.15249378938870284, 'bull_strategy': 'mean_reversion', 'bull_bb_std_mult': 2.7822039043530182, 'bull_rsi_os': 37, 'bull_rsi_ob': 62, 'bull_adx_thresh': 6.920482544869325, 'bull_atr_min_pct': 0.003030631619945253, 'bull_atr_max_pct': 0.14326043647759795, 'bull_tp_mult': 1.5009174593402468, 'bull_tsl_mult': 0.5538232812995614, 'bull_time_stop': 52, 'bull_use_sma': False, 'bull_use_ema': True, 'bull_use_atr': False, 'bull_use_adx': False, 'bull_use_spike': False, 'bull_rsi_required': True, 'bear_strategy': 'breakout', 'bear_bb_std_mult': 1.7577279600862972, 'bear_rsi_os': 47, 'bear_rsi_ob': 78, 'bear_adx_thresh': 34.20095290336752, 'bear_atr_min_pct': 0.008271926801241706, 'bear_atr_max_pct': 0.12891407074180317, 'bear_tp_mult': 2.1334711060652043, 'bear_tsl_mult': 0.10334612808662422, 'bear_time_stop': 277, 'bear_use_sma': False, 'bear_use_ema': True, 'bear_use_atr': True, 'bear_use_adx': True, 'bear_use_spike': False, 'bear_rsi_required': False, 'sideways_strategy': 'breakout', 'sideways_bb_std_mult': 1.0165468622777616, 'sideways_rsi_os': 24, 'sideways_rsi_ob': 93, 'sideways_adx_thresh': 21.28218422048935, 'sideways_atr_min_pct': 0.0055582364132958795, 'sideways_atr_max_pct': 0.12094529120434944, 'sideways_tp_mult': 1.2050281352814485, 'sideways_tsl_mult': 0.178561721055199, 'sideways_time_stop': 188, 'sideways_use_sma': True, 'sideways_use_ema': True, 'sideways_use_atr': True, 'sideways_use_adx': False, 'sideways_use_spike': False, 'sideways_rsi_required': True}.
[I 2025-09-01 08:10:35,068] Trial 290 finished with values: [-1000000000.0, 1000000000.0] and parameters: {'p_sma': 30, 'p_std': 44, 'p_atr': 19, 'p_adx': 18, 'rsi_period': 59, 'ema1': 14, 'ema2': 16, 'slip_atr_k': 0.04486573362210913, 'slip_spread_k': 0.002342087922215852, 'spread_hl_frac': 0.045802002618573694, 'bb_std_mult': 1.801784756058643, 'rsi_os': 30, 'rsi_ob': 85, 'vol_spike': 0.18368734099187561, 'adx_thresh': 18.78366361736028, 'atr_min_pct': 0.013602155017383969, 'atr_max_pct': 0.13159056148111004, 'tp_mult': 2.0112046755095374, 'tsl_mult': 0.08306876775041726, 'strategy': 'breakout', 'time_stop': 287, 'use_sma': False, 'use_atr': True, 'use_adx': False, 'use_ema': True, 'use_spike': True, 'rsi_required': True, 'edge_k': 0.27871756311503215, 'edge_cap': 0.18660810014474444, 'bull_strategy': 'mean_reversion', 'bull_bb_std_mult': 0.878924425108069, 'bull_rsi_os': 47, 'bull_rsi_ob': 47, 'bull_adx_thresh': 6.908794366149715, 'bull_atr_min_pct': 0.002986099931499436, 'bull_atr_max_pct': 0.012455032012874633, 'bull_tp_mult': 1.4957971941853547, 'bull_tsl_mult': 0.6311776330975714, 'bull_time_stop': 51, 'bull_use_sma': True, 'bull_use_ema': True, 'bull_use_atr': False, 'bull_use_adx': False, 'bull_use_spike': False, 'bull_rsi_required': False, 'bear_strategy': 'mean_reversion', 'bear_bb_std_mult': 2.6349360097310566, 'bear_rsi_os': 47, 'bear_rsi_ob': 94, 'bear_adx_thresh': 6.257369147912714, 'bear_atr_min_pct': 0.026321849947926777, 'bear_atr_max_pct': 0.01602830535810136, 'bear_tp_mult': 2.132938110624652, 'bear_tsl_mult': 0.09931512002951062, 'bear_time_stop': 20, 'bear_use_sma': False, 'bear_use_ema': True, 'bear_use_atr': True, 'bear_use_adx': False, 'bear_use_spike': False, 'bear_rsi_required': False, 'sideways_strategy': 'mean_reversion', 'sideways_bb_std_mult': 0.907669222157656, 'sideways_rsi_os': 8, 'sideways_rsi_ob': 93, 'sideways_adx_thresh': 20.00169263837097, 'sideways_atr_min_pct': 0.029327962364846003, 'sideways_atr_max_pct': 0.010060989383608764, 'sideways_tp_mult': 1.2052441592973417, 'sideways_tsl_mult': 0.9031951702593919, 'sideways_time_stop': 216, 'sideways_use_sma': True, 'sideways_use_ema': True, 'sideways_use_atr': True, 'sideways_use_adx': False, 'sideways_use_spike': False, 'sideways_rsi_required': True}.
[I 2025-09-01 08:11:21,170] Trial 294 finished with values: [-0.010646922004074466, 0.01051705566557823] and parameters: {'p_sma': 30, 'p_std': 44, 'p_atr': 20, 'p_adx': 23, 'rsi_period': 52, 'ema1': 17, 'ema2': 11, 'slip_atr_k': 0.00027076062076354234, 'slip_spread_k': 0.8604288230174384, 'spread_hl_frac': 0.034370805445828115, 'bb_std_mult': 2.565497663636255, 'rsi_os': 18, 'rsi_ob': 71, 'vol_spike': 0.07157024491228499, 'adx_thresh': 28.613678119260904, 'atr_min_pct': 0.02085878555849923, 'atr_max_pct': 0.12102308278430365, 'tp_mult': 1.673538556581124, 'tsl_mult': 0.007472308576412012, 'strategy': 'mean_reversion', 'time_stop': 247, 'use_sma': False, 'use_atr': False, 'use_adx': True, 'use_ema': True, 'use_spike': True, 'rsi_required': True, 'edge_k': 0.35606146311283504, 'edge_cap': 0.21137399912039995, 'bull_strategy': 'breakout', 'bull_bb_std_mult': 3.0430522899358796, 'bull_rsi_os': 42, 'bull_rsi_ob': 46, 'bull_adx_thresh': 6.131628902328916, 'bull_atr_min_pct': 0.002318109164756647, 'bull_atr_max_pct': 0.12147653191988753, 'bull_tp_mult': 1.7328800055133202, 'bull_tsl_mult': 0.6477946232988994, 'bull_time_stop': 70, 'bull_use_sma': True, 'bull_use_ema': False, 'bull_use_atr': True, 'bull_use_adx': True, 'bull_use_spike': False, 'bull_rsi_required': False, 'bear_strategy': 'mean_reversion', 'bear_bb_std_mult': 1.8966450948644515, 'bear_rsi_os': 42, 'bear_rsi_ob': 94, 'bear_adx_thresh': 31.345208361373984, 'bear_atr_min_pct': 0.009041641828756565, 'bear_atr_max_pct': 0.1470063998591229, 'bear_tp_mult': 2.2848162388469135, 'bear_tsl_mult': 0.12070612951334575, 'bear_time_stop': 18, 'bear_use_sma': True, 'bear_use_ema': True, 'bear_use_atr': False, 'bear_use_adx': False, 'bear_use_spike': True, 'bear_rsi_required': True, 'sideways_strategy': 'mean_reversion', 'sideways_bb_std_mult': 3.2958572753813633, 'sideways_rsi_os': 8, 'sideways_rsi_ob': 94, 'sideways_adx_thresh': 6.657578071044956, 'sideways_atr_min_pct': 0.025941454417911264, 'sideways_atr_max_pct': 0.022371735384926456, 'sideways_tp_mult': 1.762344817039728, 'sideways_tsl_mult': 0.060043243539858134, 'sideways_time_stop': 219, 'sideways_use_sma': True, 'sideways_use_ema': True, 'sideways_use_atr': True, 'sideways_use_adx': True, 'sideways_use_spike': False, 'sideways_rsi_required': False}.
[I 2025-09-01 08:11:21,417] Trial 292 finished with values: [-1000000000.0, 1000000000.0] and parameters: {'p_sma': 30, 'p_std': 44, 'p_atr': 20, 'p_adx': 30, 'rsi_period': 73, 'ema1': 21, 'ema2': 27, 'slip_atr_k': 0.0005636465391740855, 'slip_spread_k': 0.9149540425802867, 'spread_hl_frac': 0.013349864307656788, 'bb_std_mult': 2.122715054769184, 'rsi_os': 21, 'rsi_ob': 95, 'vol_spike': 0.0666847926313989, 'adx_thresh': 29.61410982187081, 'atr_min_pct': 0.017549098086668692, 'atr_max_pct': 0.12734586248742408, 'tp_mult': 1.674555446091389, 'tsl_mult': 0.08176309782467364, 'strategy': 'mean_reversion', 'time_stop': 203, 'use_sma': False, 'use_atr': False, 'use_adx': False, 'use_ema': True, 'use_spike': True, 'rsi_required': True, 'edge_k': 0.27086390352275397, 'edge_cap': 0.14226800380062826, 'bull_strategy': 'breakout', 'bull_bb_std_mult': 3.1413317014784377, 'bull_rsi_os': 36, 'bull_rsi_ob': 62, 'bull_adx_thresh': 31.054864092416285, 'bull_atr_min_pct': 0.0030923590858516954, 'bull_atr_max_pct': 0.12016292552952046, 'bull_tp_mult': 1.4970150083395772, 'bull_tsl_mult': 0.6359522194188646, 'bull_time_stop': 67, 'bull_use_sma': False, 'bull_use_ema': True, 'bull_use_atr': True, 'bull_use_adx': True, 'bull_use_spike': False, 'bull_rsi_required': True, 'bear_strategy': 'breakout', 'bear_bb_std_mult': 1.7636584994388238, 'bear_rsi_os': 49, 'bear_rsi_ob': 78, 'bear_adx_thresh': 31.650152483493954, 'bear_atr_min_pct': 0.012232846575245763, 'bear_atr_max_pct': 0.01573487124564009, 'bear_tp_mult': 1.68768462180169, 'bear_tsl_mult': 0.10907232732223737, 'bear_time_stop': 283, 'bear_use_sma': False, 'bear_use_ema': True, 'bear_use_atr': True, 'bear_use_adx': True, 'bear_use_spike': True, 'bear_rsi_required': True, 'sideways_strategy': 'breakout', 'sideways_bb_std_mult': 1.0294357670766436, 'sideways_rsi_os': 23, 'sideways_rsi_ob': 94, 'sideways_adx_thresh': 16.11725836639082, 'sideways_atr_min_pct': 0.0036041465133417345, 'sideways_atr_max_pct': 0.01448859844557257, 'sideways_tp_mult': 1.7194940638409308, 'sideways_tsl_mult': 0.06025932823805186, 'sideways_time_stop': 216, 'sideways_use_sma': True, 'sideways_use_ema': True, 'sideways_use_atr': True, 'sideways_use_adx': True, 'sideways_use_spike': False, 'sideways_rsi_required': False}.
[I 2025-09-01 08:11:22,105] Trial 293 finished with values: [-1000000000.0, 1000000000.0] and parameters: {'p_sma': 30, 'p_std': 46, 'p_atr': 20, 'p_adx': 30, 'rsi_period': 63, 'ema1': 21, 'ema2': 55, 'slip_atr_k': 0.012298380408033202, 'slip_spread_k': 0.9069076727506488, 'spread_hl_frac': 0.014059119773758936, 'bb_std_mult': 1.8183519574904814, 'rsi_os': 21, 'rsi_ob': 94, 'vol_spike': 0.06797217423942385, 'adx_thresh': 29.76697276888363, 'atr_min_pct': 0.0025502416152145815, 'atr_max_pct': 0.12647286145796252, 'tp_mult': 1.179334815439948, 'tsl_mult': 0.8477078365853004, 'strategy': 'mean_reversion', 'time_stop': 287, 'use_sma': False, 'use_atr': False, 'use_adx': False, 'use_ema': True, 'use_spike': True, 'rsi_required': True, 'edge_k': 0.28215613601257483, 'edge_cap': 0.15208598787712807, 'bull_strategy': 'breakout', 'bull_bb_std_mult': 3.022859490070204, 'bull_rsi_os': 37, 'bull_rsi_ob': 52, 'bull_adx_thresh': 31.329831232258016, 'bull_atr_min_pct': 0.0029181109154520248, 'bull_atr_max_pct': 0.04934694019026151, 'bull_tp_mult': 1.5001998512199137, 'bull_tsl_mult': 0.6390021577398795, 'bull_time_stop': 67, 'bull_use_sma': False, 'bull_use_ema': True, 'bull_use_atr': True, 'bull_use_adx': True, 'bull_use_spike': False, 'bull_rsi_required': True, 'bear_strategy': 'breakout', 'bear_bb_std_mult': 1.9086763329853729, 'bear_rsi_os': 5, 'bear_rsi_ob': 94, 'bear_adx_thresh': 5.8428711948458245, 'bear_atr_min_pct': 0.008335909941361675, 'bear_atr_max_pct': 0.019685176756721177, 'bear_tp_mult': 1.6739845339281447, 'bear_tsl_mult': 0.10390908818645493, 'bear_time_stop': 20, 'bear_use_sma': False, 'bear_use_ema': True, 'bear_use_atr': True, 'bear_use_adx': True, 'bear_use_spike': True, 'bear_rsi_required': True, 'sideways_strategy': 'breakout', 'sideways_bb_std_mult': 1.015654562482564, 'sideways_rsi_os': 8, 'sideways_rsi_ob': 94, 'sideways_adx_thresh': 9.45629050571225, 'sideways_atr_min_pct': 0.022657704316211853, 'sideways_atr_max_pct': 0.08401104769940831, 'sideways_tp_mult': 1.2760368063882925, 'sideways_tsl_mult': 0.06029748661750121, 'sideways_time_stop': 295, 'sideways_use_sma': True, 'sideways_use_ema': True, 'sideways_use_atr': True, 'sideways_use_adx': True, 'sideways_use_spike': False, 'sideways_rsi_required': False}.
[I 2025-09-01 08:11:22,121] Trial 295 finished with values: [-1000000000.0, 1000000000.0] and parameters: {'p_sma': 13, 'p_std': 58, 'p_atr': 20, 'p_adx': 30, 'rsi_period': 63, 'ema1': 18, 'ema2': 27, 'slip_atr_k': 0.09313539086293161, 'slip_spread_k': 0.8631046083254095, 'spread_hl_frac': 0.013523394368530336, 'bb_std_mult': 2.1187271520177835, 'rsi_os': 35, 'rsi_ob': 95, 'vol_spike': 0.06731295365334143, 'adx_thresh': 25.304525005324265, 'atr_min_pct': 0.002618162803489652, 'atr_max_pct': 0.12576766063050943, 'tp_mult': 1.6782074422878626, 'tsl_mult': 0.009047818188765433, 'strategy': 'mean_reversion', 'time_stop': 206, 'use_sma': True, 'use_atr': False, 'use_adx': True, 'use_ema': True, 'use_spike': True, 'rsi_required': True, 'edge_k': 0.1963423111107696, 'edge_cap': 0.2127873234598503, 'bull_strategy': 'breakout', 'bull_bb_std_mult': 1.6034709462790213, 'bull_rsi_os': 43, 'bull_rsi_ob': 76, 'bull_adx_thresh': 30.827205152520683, 'bull_atr_min_pct': 0.013906185756226186, 'bull_atr_max_pct': 0.049491087362617994, 'bull_tp_mult': 2.4227793716579047, 'bull_tsl_mult': 0.27665241541692165, 'bull_time_stop': 70, 'bull_use_sma': False, 'bull_use_ema': False, 'bull_use_atr': True, 'bull_use_adx': True, 'bull_use_spike': False, 'bull_rsi_required': True, 'bear_strategy': 'breakout', 'bear_bb_std_mult': 2.065877576806871, 'bear_rsi_os': 13, 'bear_rsi_ob': 79, 'bear_adx_thresh': 31.6255835575185, 'bear_atr_min_pct': 0.008907738877246555, 'bear_atr_max_pct': 0.0986432949160429, 'bear_tp_mult': 2.097383923614568, 'bear_tsl_mult': 0.1202233160122257, 'bear_time_stop': 283, 'bear_use_sma': True, 'bear_use_ema': False, 'bear_use_atr': False, 'bear_use_adx': False, 'bear_use_spike': True, 'bear_rsi_required': True, 'sideways_strategy': 'breakout', 'sideways_bb_std_mult': 0.8268761182195813, 'sideways_rsi_os': 8, 'sideways_rsi_ob': 94, 'sideways_adx_thresh': 9.44069040353514, 'sideways_atr_min_pct': 0.0005303412046706955, 'sideways_atr_max_pct': 0.05968122625326925, 'sideways_tp_mult': 1.2830638525294744, 'sideways_tsl_mult': 0.6554950794233773, 'sideways_time_stop': 296, 'sideways_use_sma': True, 'sideways_use_ema': True, 'sideways_use_atr': True, 'sideways_use_adx': True, 'sideways_use_spike': False, 'sideways_rsi_required': False}.
[I 2025-09-01 08:12:02,314] Trial 298 finished with values: [-0.0016189510674883278, 0.00795226587124822] and parameters: {'p_sma': 38, 'p_std': 54, 'p_atr': 22, 'p_adx': 19, 'rsi_period': 61, 'ema1': 16, 'ema2': 12, 'slip_atr_k': 0.05028016925236253, 'slip_spread_k': 0.8418614494288177, 'spread_hl_frac': 0.011739538364194729, 'bb_std_mult': 2.8208669768953287, 'rsi_os': 17, 'rsi_ob': 91, 'vol_spike': 0.21335129650137044, 'adx_thresh': 8.95445253066575, 'atr_min_pct': 0.003975687233526296, 'atr_max_pct': 0.08623779377157381, 'tp_mult': 1.9640498973261127, 'tsl_mult': 0.04346957951347142, 'strategy': 'breakout', 'time_stop': 247, 'use_sma': False, 'use_atr': False, 'use_adx': True, 'use_ema': True, 'use_spike': True, 'rsi_required': True, 'edge_k': 0.2380198657367336, 'edge_cap': 0.2781310415461621, 'bull_strategy': 'breakout', 'bull_bb_std_mult': 3.3799439290635966, 'bull_rsi_os': 9, 'bull_rsi_ob': 45, 'bull_adx_thresh': 34.18196022803417, 'bull_atr_min_pct': 0.0036799142501827684, 'bull_atr_max_pct': 0.027872737393907332, 'bull_tp_mult': 1.5423523336800289, 'bull_tsl_mult': 0.5774047273671646, 'bull_time_stop': 77, 'bull_use_sma': True, 'bull_use_ema': False, 'bull_use_atr': False, 'bull_use_adx': False, 'bull_use_spike': False, 'bull_rsi_required': False, 'bear_strategy': 'mean_reversion', 'bear_bb_std_mult': 2.129562546048022, 'bear_rsi_os': 46, 'bear_rsi_ob': 80, 'bear_adx_thresh': 5.62093155732914, 'bear_atr_min_pct': 0.005788453795808627, 'bear_atr_max_pct': 0.0722208523722182, 'bear_tp_mult': 2.1794869968096093, 'bear_tsl_mult': 0.0759607114668274, 'bear_time_stop': 295, 'bear_use_sma': True, 'bear_use_ema': False, 'bear_use_atr': False, 'bear_use_adx': False, 'bear_use_spike': False, 'bear_rsi_required': False, 'sideways_strategy': 'breakout', 'sideways_bb_std_mult': 1.0907692342450452, 'sideways_rsi_os': 7, 'sideways_rsi_ob': 77, 'sideways_adx_thresh': 6.006885395642335, 'sideways_atr_min_pct': 0.02860900153846945, 'sideways_atr_max_pct': 0.09692976608665277, 'sideways_tp_mult': 2.698101027510024, 'sideways_tsl_mult': 0.15618989266265396, 'sideways_time_stop': 102, 'sideways_use_sma': True, 'sideways_use_ema': True, 'sideways_use_atr': True, 'sideways_use_adx': True, 'sideways_use_spike': False, 'sideways_rsi_required': False}.
