[I 2025-09-01 07:50:42,412] Trial 181 finished with values: [-1000000000.0, 1000000000.0] and parameters: {'p_sma': 17, 'p_std': 50, 'p_atr': 22, 'p_adx': 19, 'rsi_period': 52, 'ema1': 14, 'ema2': 15, 'slip_atr_k': 0.08146759644387222, 'slip_spread_k': 0.8116412495362371, 'spread_hl_frac': 0.011115988381051396, 'bb_std_mult': 2.5086603893528303, 'rsi_os': 25, 'rsi_ob': 93, 'vol_spike': 0.05791640639760494, 'adx_thresh': 27.940594734081287, 'atr_min_pct': 0.0020264344561327706, 'atr_max_pct': 0.1278021875221153, 'tp_mult': 1.827831755540639, 'tsl_mult': 0.08199441947158773, 'strategy': 'breakout', 'time_stop': 223, 'use_sma': False, 'use_atr': False, 'use_adx': True, 'use_ema': True, 'use_spike': True, 'rsi_required': True, 'edge_k': 0.23073571899855572, 'edge_cap': 0.24344510491728055, 'bull_strategy': 'breakout', 'bull_bb_std_mult': 2.877924179341417, 'bull_rsi_os': 49, 'bull_rsi_ob': 48, 'bull_adx_thresh': 7.3155571700101305, 'bull_atr_min_pct': 0.026178281287412054, 'bull_atr_max_pct': 0.06161596429962593, 'bull_tp_mult': 1.5288308746167512, 'bull_tsl_mult': 0.8515528329188289, 'bull_time_stop': 70, 'bull_use_sma': True, 'bull_use_ema': True, 'bull_use_atr': False, 'bull_use_adx': False, 'bull_use_spike': False, 'bull_rsi_required': False, 'bear_strategy': 'mean_reversion', 'bear_bb_std_mult': 1.7554080061056405, 'bear_rsi_os': 46, 'bear_rsi_ob': 79, 'bear_adx_thresh': 5.7281741625643505, 'bear_atr_min_pct': 0.005387776687331793, 'bear_atr_max_pct': 0.08840558519593912, 'bear_tp_mult': 2.1124978773855494, 'bear_tsl_mult': 0.10604938864802045, 'bear_time_stop': 299, 'bear_use_sma': True, 'bear_use_ema': False, 'bear_use_atr': False, 'bear_use_adx': False, 'bear_use_spike': False, 'bear_rsi_required': True, 'sideways_strategy': 'breakout', 'sideways_bb_std_mult': 0.7203262631915168, 'sideways_rsi_os': 6, 'sideways_rsi_ob': 86, 'sideways_adx_thresh': 11.973135311179945, 'sideways_atr_min_pct': 0.02513111217980912, 'sideways_atr_max_pct': 0.020543033251594407, 'sideways_tp_mult': 1.345440755492715, 'sideways_tsl_mult': 0.11382205356315327, 'sideways_time_stop': 210, 'sideways_use_sma': True, 'sideways_use_ema': True, 'sideways_use_atr': True, 'sideways_use_adx': True, 'sideways_use_spike': False, 'sideways_rsi_required': False}.
[I 2025-09-01 07:50:43,023] Trial 182 finished with values: [0.006511856073538658, 0.002898362673894437] and parameters: {'p_sma': 29, 'p_std': 56, 'p_atr': 22, 'p_adx': 30, 'rsi_period': 58, 'ema1': 14, 'ema2': 15, 'slip_atr_k': 0.0006146268169471801, 'slip_spread_k': 0.9369759206115614, 'spread_hl_frac': 0.012697080463583066, 'bb_std_mult': 1.9701196639850882, 'rsi_os': 25, 'rsi_ob': 93, 'vol_spike': 0.05876690016464092, 'adx_thresh': 27.82530825572512, 'atr_min_pct': 0.0041900505354468464, 'atr_max_pct': 0.1272321429081537, 'tp_mult': 1.7906935210291837, 'tsl_mult': 0.07210555163086535, 'strategy': 'breakout', 'time_stop': 223, 'use_sma': False, 'use_atr': False, 'use_adx': True, 'use_ema': True, 'use_spike': True, 'rsi_required': True, 'edge_k': 0.19303058284620744, 'edge_cap': 0.22485298477695903, 'bull_strategy': 'breakout', 'bull_bb_std_mult': 3.0955082145565807, 'bull_rsi_os': 48, 'bull_rsi_ob': 47, 'bull_adx_thresh': 7.7214802495951, 'bull_atr_min_pct': 0.0033193987007656815, 'bull_atr_max_pct': 0.018153074140927497, 'bull_tp_mult': 1.5360488099208827, 'bull_tsl_mult': 0.6071742837494116, 'bull_time_stop': 74, 'bull_use_sma': True, 'bull_use_ema': False, 'bull_use_atr': False, 'bull_use_adx': False, 'bull_use_spike': False, 'bull_rsi_required': False, 'bear_strategy': 'mean_reversion', 'bear_bb_std_mult': 1.796477239599534, 'bear_rsi_os': 45, 'bear_rsi_ob': 80, 'bear_adx_thresh': 5.908887964451418, 'bear_atr_min_pct': 0.005210302761063558, 'bear_atr_max_pct': 0.08790125589815093, 'bear_tp_mult': 2.107014042986688, 'bear_tsl_mult': 0.05825016636578095, 'bear_time_stop': 288, 'bear_use_sma': True, 'bear_use_ema': False, 'bear_use_atr': True, 'bear_use_adx': False, 'bear_use_spike': False, 'bear_rsi_required': False, 'sideways_strategy': 'breakout', 'sideways_bb_std_mult': 0.9210868192404315, 'sideways_rsi_os': 6, 'sideways_rsi_ob': 94, 'sideways_adx_thresh': 11.969721884258744, 'sideways_atr_min_pct': 0.024945616551158695, 'sideways_atr_max_pct': 0.020787194281753255, 'sideways_tp_mult': 1.340285479599076, 'sideways_tsl_mult': 0.101200489677035, 'sideways_time_stop': 210, 'sideways_use_sma': True, 'sideways_use_ema': True, 'sideways_use_atr': True, 'sideways_use_adx': True, 'sideways_use_spike': False, 'sideways_rsi_required': False}.
[I 2025-09-01 07:50:43,285] Trial 179 finished with values: [-0.26721910204740673, 0.2671459121964172] and parameters: {'p_sma': 45, 'p_std': 19, 'p_atr': 20, 'p_adx': 15, 'rsi_period': 23, 'ema1': 29, 'ema2': 45, 'slip_atr_k': 0.02144563526682542, 'slip_spread_k': 0.5198378340443741, 'spread_hl_frac': 0.003302058942400505, 'bb_std_mult': 3.3176802438155786, 'rsi_os': 46, 'rsi_ob': 82, 'vol_spike': 0.059589994316543535, 'adx_thresh': 32.9778454693807, 'atr_min_pct': 0.009824258278230191, 'atr_max_pct': 0.0597247933875984, 'tp_mult': 2.4474517814508934, 'tsl_mult': 0.2552104746568858, 'strategy': 'breakout', 'time_stop': 138, 'use_sma': False, 'use_atr': False, 'use_adx': True, 'use_ema': True, 'use_spike': True, 'rsi_required': False, 'edge_k': 0.23561381122443703, 'edge_cap': 0.1607648883149605, 'bull_strategy': 'breakout', 'bull_bb_std_mult': 0.9967527593312553, 'bull_rsi_os': 17, 'bull_rsi_ob': 85, 'bull_adx_thresh': 22.416554269885477, 'bull_atr_min_pct': 0.027279506620858898, 'bull_atr_max_pct': 0.056496639920366354, 'bull_tp_mult': 1.350031534871717, 'bull_tsl_mult': 0.38863814597412444, 'bull_time_stop': 40, 'bull_use_sma': True, 'bull_use_ema': True, 'bull_use_atr': False, 'bull_use_adx': False, 'bull_use_spike': False, 'bull_rsi_required': False, 'bear_strategy': 'mean_reversion', 'bear_bb_std_mult': 1.9952851756068155, 'bear_rsi_os': 49, 'bear_rsi_ob': 60, 'bear_adx_thresh': 9.627588764271483, 'bear_atr_min_pct': 0.0068301104664291856, 'bear_atr_max_pct': 0.10417168867940071, 'bear_tp_mult': 1.2742576693931553, 'bear_tsl_mult': 0.9514214359593005, 'bear_time_stop': 115, 'bear_use_sma': True, 'bear_use_ema': False, 'bear_use_atr': False, 'bear_use_adx': False, 'bear_use_spike': False, 'bear_rsi_required': True, 'sideways_strategy': 'breakout', 'sideways_bb_std_mult': 1.2245814193527684, 'sideways_rsi_os': 43, 'sideways_rsi_ob': 47, 'sideways_adx_thresh': 16.40774248004156, 'sideways_atr_min_pct': 3.601207591909586e-05, 'sideways_atr_max_pct': 0.02073469834748627, 'sideways_tp_mult': 1.3250092497560997, 'sideways_tsl_mult': 0.12725436297939507, 'sideways_time_stop': 205, 'sideways_use_sma': False, 'sideways_use_ema': True, 'sideways_use_atr': True, 'sideways_use_adx': True, 'sideways_use_spike': False, 'sideways_rsi_required': False}.
[I 2025-09-01 07:51:25,431] Trial 185 finished with values: [0.007210188111691274, 0.003224173501870947] and parameters: {'p_sma': 28, 'p_std': 56, 'p_atr': 23, 'p_adx': 30, 'rsi_period': 58, 'ema1': 15, 'ema2': 21, 'slip_atr_k': 9.039133404571567e-05, 'slip_spread_k': 0.9351088800561427, 'spread_hl_frac': 0.012246094882433778, 'bb_std_mult': 1.9819233481177956, 'rsi_os': 21, 'rsi_ob': 92, 'vol_spike': 0.07316002036845029, 'adx_thresh': 27.079391536344673, 'atr_min_pct': 0.004193943597808582, 'atr_max_pct': 0.1292714068158136, 'tp_mult': 1.9303794668929959, 'tsl_mult': 0.04398981842212361, 'strategy': 'breakout', 'time_stop': 218, 'use_sma': False, 'use_atr': False, 'use_adx': True, 'use_ema': True, 'use_spike': True, 'rsi_required': True, 'edge_k': 0.22971098077855642, 'edge_cap': 0.2254066495282273, 'bull_strategy': 'breakout', 'bull_bb_std_mult': 3.1023820367109445, 'bull_rsi_os': 47, 'bull_rsi_ob': 47, 'bull_adx_thresh': 8.309309251238295, 'bull_atr_min_pct': 0.0036672174190748807, 'bull_atr_max_pct': 0.018239651458360873, 'bull_tp_mult': 1.552878070240923, 'bull_tsl_mult': 0.616179703707868, 'bull_time_stop': 75, 'bull_use_sma': True, 'bull_use_ema': False, 'bull_use_atr': False, 'bull_use_adx': False, 'bull_use_spike': False, 'bull_rsi_required': False, 'bear_strategy': 'mean_reversion', 'bear_bb_std_mult': 1.7666487548544691, 'bear_rsi_os': 45, 'bear_rsi_ob': 80, 'bear_adx_thresh': 6.216771307356321, 'bear_atr_min_pct': 0.004576899796355289, 'bear_atr_max_pct': 0.08130071065830918, 'bear_tp_mult': 2.1419333515285017, 'bear_tsl_mult': 0.05212281725210663, 'bear_time_stop': 294, 'bear_use_sma': True, 'bear_use_ema': False, 'bear_use_atr': True, 'bear_use_adx': False, 'bear_use_spike': False, 'bear_rsi_required': False, 'sideways_strategy': 'breakout', 'sideways_bb_std_mult': 0.8979154902643486, 'sideways_rsi_os': 9, 'sideways_rsi_ob': 94, 'sideways_adx_thresh': 10.83391999815167, 'sideways_atr_min_pct': 0.02291289169636583, 'sideways_atr_max_pct': 0.021973424962195096, 'sideways_tp_mult': 1.4164180885265085, 'sideways_tsl_mult': 0.06733668539128733, 'sideways_time_stop': 218, 'sideways_use_sma': True, 'sideways_use_ema': True, 'sideways_use_atr': True, 'sideways_use_adx': True, 'sideways_use_spike': False, 'sideways_rsi_required': False}.
[I 2025-09-01 07:51:25,850] Trial 186 finished with values: [0.0065117166684336425, 0.004209326676478658] and parameters: {'p_sma': 28, 'p_std': 57, 'p_atr': 24, 'p_adx': 30, 'rsi_period': 59, 'ema1': 15, 'ema2': 18, 'slip_atr_k': 0.0006639466722656126, 'slip_spread_k': 0.9529259813667807, 'spread_hl_frac': 0.012420019526018062, 'bb_std_mult': 1.9368592643492335, 'rsi_os': 34, 'rsi_ob': 92, 'vol_spike': 0.0726071036753076, 'adx_thresh': 27.131863661134645, 'atr_min_pct': 0.004096128162335485, 'atr_max_pct': 0.13266237954077564, 'tp_mult': 1.9538406757247166, 'tsl_mult': 0.04921784853227426, 'strategy': 'breakout', 'time_stop': 217, 'use_sma': False, 'use_atr': False, 'use_adx': True, 'use_ema': True, 'use_spike': True, 'rsi_required': True, 'edge_k': 0.11573830988298518, 'edge_cap': 0.260665481089896, 'bull_strategy': 'breakout', 'bull_bb_std_mult': 3.458764775645747, 'bull_rsi_os': 47, 'bull_rsi_ob': 47, 'bull_adx_thresh': 8.0835525757867, 'bull_atr_min_pct': 0.003117743876072685, 'bull_atr_max_pct': 0.018734117339757887, 'bull_tp_mult': 1.514494276942292, 'bull_tsl_mult': 0.5954342702236826, 'bull_time_stop': 75, 'bull_use_sma': True, 'bull_use_ema': False, 'bull_use_atr': False, 'bull_use_adx': False, 'bull_use_spike': False, 'bull_rsi_required': False, 'bear_strategy': 'mean_reversion', 'bear_bb_std_mult': 1.7639090343918178, 'bear_rsi_os': 45, 'bear_rsi_ob': 80, 'bear_adx_thresh': 6.197108814113164, 'bear_atr_min_pct': 0.004348597213451153, 'bear_atr_max_pct': 0.08100992179522393, 'bear_tp_mult': 2.1558741486300983, 'bear_tsl_mult': 0.045784531679726154, 'bear_time_stop': 291, 'bear_use_sma': True, 'bear_use_ema': False, 'bear_use_atr': True, 'bear_use_adx': False, 'bear_use_spike': False, 'bear_rsi_required': False, 'sideways_strategy': 'breakout', 'sideways_bb_std_mult': 0.7716776434795105, 'sideways_rsi_os': 9, 'sideways_rsi_ob': 94, 'sideways_adx_thresh': 11.35839304460544, 'sideways_atr_min_pct': 0.029053639430346452, 'sideways_atr_max_pct': 0.025955640483613946, 'sideways_tp_mult': 1.4062795420013101, 'sideways_tsl_mult': 0.058600439777325486, 'sideways_time_stop': 215, 'sideways_use_sma': True, 'sideways_use_ema': True, 'sideways_use_atr': True, 'sideways_use_adx': True, 'sideways_use_spike': False, 'sideways_rsi_required': False}.
[I 2025-09-01 07:51:26,164] Trial 184 finished with values: [-1000000000.0, 1000000000.0] and parameters: {'p_sma': 28, 'p_std': 54, 'p_atr': 24, 'p_adx': 14, 'rsi_period': 8, 'ema1': 8, 'ema2': 14, 'slip_atr_k': 9.713496317270698e-05, 'slip_spread_k': 0.9264490273432477, 'spread_hl_frac': 0.03682267581467874, 'bb_std_mult': 1.7676184444878322, 'rsi_os': 34, 'rsi_ob': 59, 'vol_spike': 0.07492315859472229, 'adx_thresh': 27.199997574141516, 'atr_min_pct': 0.016937285466153557, 'atr_max_pct': 0.050311095589694155, 'tp_mult': 2.572008807288341, 'tsl_mult': 0.044130492748259975, 'strategy': 'breakout', 'time_stop': 70, 'use_sma': False, 'use_atr': False, 'use_adx': True, 'use_ema': True, 'use_spike': True, 'rsi_required': True, 'edge_k': 0.33816023395647743, 'edge_cap': 0.5842604646532107, 'bull_strategy': 'breakout', 'bull_bb_std_mult': 2.885885890358533, 'bull_rsi_os': 43, 'bull_rsi_ob': 84, 'bull_adx_thresh': 6.144110714651871, 'bull_atr_min_pct': 0.0037657330351016293, 'bull_atr_max_pct': 0.0645285677580285, 'bull_tp_mult': 1.6026422844398809, 'bull_tsl_mult': 0.5990854394343075, 'bull_time_stop': 87, 'bull_use_sma': True, 'bull_use_ema': True, 'bull_use_atr': False, 'bull_use_adx': False, 'bull_use_spike': False, 'bull_rsi_required': False, 'bear_strategy': 'mean_reversion', 'bear_bb_std_mult': 2.6046105903364594, 'bear_rsi_os': 47, 'bear_rsi_ob': 80, 'bear_adx_thresh': 6.034774303586727, 'bear_atr_min_pct': 0.006873493111469991, 'bear_atr_max_pct': 0.1291581942091681, 'bear_tp_mult': 2.1525906510690893, 'bear_tsl_mult': 0.07164089942541238, 'bear_time_stop': 273, 'bear_use_sma': True, 'bear_use_ema': False, 'bear_use_atr': True, 'bear_use_adx': False, 'bear_use_spike': False, 'bear_rsi_required': True, 'sideways_strategy': 'breakout', 'sideways_bb_std_mult': 1.3383821528039854, 'sideways_rsi_os': 7, 'sideways_rsi_ob': 94, 'sideways_adx_thresh': 10.743555971200914, 'sideways_atr_min_pct': 0.029398817434332626, 'sideways_atr_max_pct': 0.024501562982208087, 'sideways_tp_mult': 1.390069267336467, 'sideways_tsl_mult': 0.0006463638794639015, 'sideways_time_stop': 214, 'sideways_use_sma': True, 'sideways_use_ema': True, 'sideways_use_atr': True, 'sideways_use_adx': True, 'sideways_use_spike': False, 'sideways_rsi_required': False}.
[I 2025-09-01 07:51:26,389] Trial 183 finished with values: [-0.003912314927463911, 0.010579669616393934] and parameters: {'p_sma': 29, 'p_std': 50, 'p_atr': 22, 'p_adx': 15, 'rsi_period': 7, 'ema1': 8, 'ema2': 13, 'slip_atr_k': 0.0011533913482153872, 'slip_spread_k': 0.8241287731903507, 'spread_hl_frac': 0.03215840372418825, 'bb_std_mult': 1.9693763462372489, 'rsi_os': 25, 'rsi_ob': 59, 'vol_spike': 0.07158230270793386, 'adx_thresh': 27.40025471862775, 'atr_min_pct': 0.0167923061077477, 'atr_max_pct': 0.0640213262306551, 'tp_mult': 2.377634978185514, 'tsl_mult': 0.0791803256222622, 'strategy': 'breakout', 'time_stop': 247, 'use_sma': False, 'use_atr': False, 'use_adx': True, 'use_ema': True, 'use_spike': True, 'rsi_required': True, 'edge_k': 0.22949065830112655, 'edge_cap': 0.5939018485241983, 'bull_strategy': 'breakout', 'bull_bb_std_mult': 3.451587932579119, 'bull_rsi_os': 47, 'bull_rsi_ob': 85, 'bull_adx_thresh': 7.083920972292278, 'bull_atr_min_pct': 0.0035934192976938163, 'bull_atr_max_pct': 0.06167510533551594, 'bull_tp_mult': 1.5349031759949658, 'bull_tsl_mult': 0.5926213160012284, 'bull_time_stop': 94, 'bull_use_sma': True, 'bull_use_ema': True, 'bull_use_atr': False, 'bull_use_adx': False, 'bull_use_spike': False, 'bull_rsi_required': False, 'bear_strategy': 'mean_reversion', 'bear_bb_std_mult': 1.7735077554589807, 'bear_rsi_os': 47, 'bear_rsi_ob': 79, 'bear_adx_thresh': 5.80939927643192, 'bear_atr_min_pct': 0.0052536256405473665, 'bear_atr_max_pct': 0.1325919560317712, 'bear_tp_mult': 2.104577843668908, 'bear_tsl_mult': 0.051540699823990864, 'bear_time_stop': 288, 'bear_use_sma': True, 'bear_use_ema': False, 'bear_use_atr': True, 'bear_use_adx': False, 'bear_use_spike': False, 'bear_rsi_required': True, 'sideways_strategy': 'breakout', 'sideways_bb_std_mult': 1.3811467751012418, 'sideways_rsi_os': 7, 'sideways_rsi_ob': 87, 'sideways_adx_thresh': 10.896549175965312, 'sideways_atr_min_pct': 0.024855453443255446, 'sideways_atr_max_pct': 0.021037509972481383, 'sideways_tp_mult': 1.3385181149046668, 'sideways_tsl_mult': 0.06326626504377547, 'sideways_time_stop': 223, 'sideways_use_sma': True, 'sideways_use_ema': True, 'sideways_use_atr': True, 'sideways_use_adx': True, 'sideways_use_spike': False, 'sideways_rsi_required': False}.
[I 2025-09-01 07:52:06,414] Trial 189 finished with values: [-0.00016911570096800332, 0.004774090076122376] and parameters: {'p_sma': 29, 'p_std': 56, 'p_atr': 23, 'p_adx': 30, 'rsi_period': 57, 'ema1': 15, 'ema2': 21, 'slip_atr_k': 0.00014595500328201048, 'slip_spread_k': 0.9587008904663993, 'spread_hl_frac': 0.012954791502000854, 'bb_std_mult': 1.990390872218727, 'rsi_os': 33, 'rsi_ob': 91, 'vol_spike': 0.07366017401637127, 'adx_thresh': 26.088420245806205, 'atr_min_pct': 0.004428395666013407, 'atr_max_pct': 0.1303852997135466, 'tp_mult': 1.9471497229696209, 'tsl_mult': 0.06636395541253846, 'strategy': 'breakout', 'time_stop': 217, 'use_sma': False, 'use_atr': False, 'use_adx': True, 'use_ema': True, 'use_spike': True, 'rsi_required': True, 'edge_k': 0.13960771414515916, 'edge_cap': 0.23719834076786805, 'bull_strategy': 'breakout', 'bull_bb_std_mult': 3.459614128069734, 'bull_rsi_os': 47, 'bull_rsi_ob': 47, 'bull_adx_thresh': 8.047479895302816, 'bull_atr_min_pct': 0.003453742110081034, 'bull_atr_max_pct': 0.016873882817351516, 'bull_tp_mult': 1.5061003029577325, 'bull_tsl_mult': 0.6097707367577218, 'bull_time_stop': 75, 'bull_use_sma': True, 'bull_use_ema': False, 'bull_use_atr': False, 'bull_use_adx': False, 'bull_use_spike': False, 'bull_rsi_required': False, 'bear_strategy': 'mean_reversion', 'bear_bb_std_mult': 1.765030225501335, 'bear_rsi_os': 45, 'bear_rsi_ob': 78, 'bear_adx_thresh': 5.329593395964126, 'bear_atr_min_pct': 0.004664728908080066, 'bear_atr_max_pct': 0.08016161791151614, 'bear_tp_mult': 2.1692844710304597, 'bear_tsl_mult': 0.04603635588027727, 'bear_time_stop': 287, 'bear_use_sma': True, 'bear_use_ema': False, 'bear_use_atr': True, 'bear_use_adx': False, 'bear_use_spike': False, 'bear_rsi_required': False, 'sideways_strategy': 'breakout', 'sideways_bb_std_mult': 0.875588087616189, 'sideways_rsi_os': 9, 'sideways_rsi_ob': 95, 'sideways_adx_thresh': 10.841369229978225, 'sideways_atr_min_pct': 0.024205382385620526, 'sideways_atr_max_pct': 0.02217886582409406, 'sideways_tp_mult': 1.5407472385222123, 'sideways_tsl_mult': 0.06414429720436772, 'sideways_time_stop': 184, 'sideways_use_sma': True, 'sideways_use_ema': True, 'sideways_use_atr': True, 'sideways_use_adx': True, 'sideways_use_spike': False, 'sideways_rsi_required': False}.
[I 2025-09-01 07:52:07,001] Trial 190 finished with values: [-0.0008880314501779063, 0.005706269131274559] and parameters: {'p_sma': 29, 'p_std': 58, 'p_atr': 23, 'p_adx': 30, 'rsi_period': 58, 'ema1': 15, 'ema2': 21, 'slip_atr_k': 0.0005092115863616306, 'slip_spread_k': 0.953779315058911, 'spread_hl_frac': 0.01260747783326879, 'bb_std_mult': 1.9647862606443915, 'rsi_os': 31, 'rsi_ob': 91, 'vol_spike': 0.07148528100294431, 'adx_thresh': 27.94335835522824, 'atr_min_pct': 0.004065788188922741, 'atr_max_pct': 0.1317095191374323, 'tp_mult': 1.9407426157862588, 'tsl_mult': 0.06872411581627433, 'strategy': 'breakout', 'time_stop': 246, 'use_sma': False, 'use_atr': False, 'use_adx': True, 'use_ema': True, 'use_spike': True, 'rsi_required': True, 'edge_k': 0.13688593649731073, 'edge_cap': 0.23280526963405845, 'bull_strategy': 'breakout', 'bull_bb_std_mult': 3.0753288785355237, 'bull_rsi_os': 47, 'bull_rsi_ob': 47, 'bull_adx_thresh': 8.19330274797784, 'bull_atr_min_pct': 0.004840132736084425, 'bull_atr_max_pct': 0.01851651884887488, 'bull_tp_mult': 1.5474891851004655, 'bull_tsl_mult': 0.5908845005984378, 'bull_time_stop': 75, 'bull_use_sma': True, 'bull_use_ema': False, 'bull_use_atr': False, 'bull_use_adx': False, 'bull_use_spike': False, 'bull_rsi_required': False, 'bear_strategy': 'mean_reversion', 'bear_bb_std_mult': 1.649565882950289, 'bear_rsi_os': 45, 'bear_rsi_ob': 78, 'bear_adx_thresh': 6.229811642937224, 'bear_atr_min_pct': 0.004193032268971936, 'bear_atr_max_pct': 0.0801953013882889, 'bear_tp_mult': 2.151242990075613, 'bear_tsl_mult': 0.05113344490803297, 'bear_time_stop': 292, 'bear_use_sma': True, 'bear_use_ema': False, 'bear_use_atr': True, 'bear_use_adx': False, 'bear_use_spike': False, 'bear_rsi_required': False, 'sideways_strategy': 'breakout', 'sideways_bb_std_mult': 0.7558230350159528, 'sideways_rsi_os': 9, 'sideways_rsi_ob': 93, 'sideways_adx_thresh': 9.71168739825735, 'sideways_atr_min_pct': 0.026922702876602363, 'sideways_atr_max_pct': 0.02400346631435138, 'sideways_tp_mult': 1.5753095813313156, 'sideways_tsl_mult': 0.05833395254984753, 'sideways_time_stop': 226, 'sideways_use_sma': True, 'sideways_use_ema': True, 'sideways_use_atr': True, 'sideways_use_adx': True, 'sideways_use_spike': False, 'sideways_rsi_required': False}.
