[I 2025-09-01 07:24:34,624] Trial 27 finished with values: [-1000000000.0, 1000000000.0] and parameters: {'p_sma': 50, 'p_std': 53, 'p_atr': 12, 'p_adx': 25, 'rsi_period': 52, 'ema1': 9, 'ema2': 14, 'slip_atr_k': 0.11057111073833256, 'slip_spread_k': 0.8075280806788596, 'spread_hl_frac': 0.007516136245761074, 'bb_std_mult': 1.91174458485745, 'rsi_os': 17, 'rsi_ob': 45, 'vol_spike': 0.1604521499786809, 'adx_thresh': 21.459444887048413, 'atr_min_pct': 0.00025552134312880996, 'atr_max_pct': 0.11557867279242043, 'tp_mult': 1.6465014650982883, 'tsl_mult': 0.09877613515874946, 'strategy': 'mean_reversion', 'time_stop': 75, 'use_sma': False, 'use_atr': False, 'use_adx': False, 'use_ema': False, 'use_spike': False, 'rsi_required': False, 'edge_k': 1.399021903861108, 'edge_cap': 0.27850005097756403, 'bull_strategy': 'breakout', 'bull_bb_std_mult': 2.2027634640469285, 'bull_rsi_os': 21, 'bull_rsi_ob': 77, 'bull_adx_thresh': 9.637293284188296, 'bull_atr_min_pct': 0.011438234061198246, 'bull_atr_max_pct': 0.14714458771459643, 'bull_tp_mult': 1.932697695594196, 'bull_tsl_mult': 0.8312853899580447, 'bull_time_stop': 92, 'bull_use_sma': False, 'bull_use_ema': False, 'bull_use_atr': True, 'bull_use_adx': True, 'bull_use_spike': True, 'bull_rsi_required': True, 'bear_strategy': 'breakout', 'bear_bb_std_mult': 2.184233270563604, 'bear_rsi_os': 52, 'bear_rsi_ob': 60, 'bear_adx_thresh': 7.852041843988346, 'bear_atr_min_pct': 0.017987550361256634, 'bear_atr_max_pct': 0.09982991219359541, 'bear_tp_mult': 1.6296157176319448, 'bear_tsl_mult': 0.5414736041334801, 'bear_time_stop': 39, 'bear_use_sma': False, 'bear_use_ema': False, 'bear_use_atr': False, 'bear_use_adx': False, 'bear_use_spike': True, 'bear_rsi_required': False, 'sideways_strategy': 'mean_reversion', 'sideways_bb_std_mult': 2.1292587163555106, 'sideways_rsi_os': 10, 'sideways_rsi_ob': 63, 'sideways_adx_thresh': 29.957576223390973, 'sideways_atr_min_pct': 0.012531763850532875, 'sideways_atr_max_pct': 0.08991662686004007, 'sideways_tp_mult': 1.2568846696842964, 'sideways_tsl_mult': 0.38242627571166876, 'sideways_time_stop': 56, 'sideways_use_sma': False, 'sideways_use_ema': False, 'sideways_use_atr': True, 'sideways_use_adx': False, 'sideways_use_spike': True, 'sideways_rsi_required': True}.
[I 2025-09-01 07:24:34,904] Trial 28 finished with values: [-1000000000.0, 1000000000.0] and parameters: {'p_sma': 39, 'p_std': 53, 'p_atr': 17, 'p_adx': 26, 'rsi_period': 53, 'ema1': 16, 'ema2': 14, 'slip_atr_k': 0.13918913428207152, 'slip_spread_k': 0.7813481096139536, 'spread_hl_frac': 0.018309834329513847, 'bb_std_mult': 1.8948679117698237, 'rsi_os': 41, 'rsi_ob': 45, 'vol_spike': 0.2218296849950373, 'adx_thresh': 21.01696114632228, 'atr_min_pct': 0.029887493092535626, 'atr_max_pct': 0.11177838101070207, 'tp_mult': 1.6819990074453903, 'tsl_mult': 0.28811083021896683, 'strategy': 'mean_reversion', 'time_stop': 65, 'use_sma': False, 'use_atr': False, 'use_adx': False, 'use_ema': False, 'use_spike': False, 'rsi_required': False, 'edge_k': 0.9168666226814038, 'edge_cap': 0.27995443259111985, 'bull_strategy': 'breakout', 'bull_bb_std_mult': 2.2152272958804144, 'bull_rsi_os': 21, 'bull_rsi_ob': 76, 'bull_adx_thresh': 27.73154675721796, 'bull_atr_min_pct': 0.019990338984556433, 'bull_atr_max_pct': 0.14123537957331994, 'bull_tp_mult': 1.961986856889664, 'bull_tsl_mult': 0.38957473270147525, 'bull_time_stop': 173, 'bull_use_sma': False, 'bull_use_ema': False, 'bull_use_atr': True, 'bull_use_adx': True, 'bull_use_spike': True, 'bull_rsi_required': True, 'bear_strategy': 'breakout', 'bear_bb_std_mult': 2.1946650720301575, 'bear_rsi_os': 52, 'bear_rsi_ob': 76, 'bear_adx_thresh': 32.87563055522337, 'bear_atr_min_pct': 0.01913322143908289, 'bear_atr_max_pct': 0.1007567972928513, 'bear_tp_mult': 1.6015831323487462, 'bear_tsl_mult': 0.48709145837851164, 'bear_time_stop': 125, 'bear_use_sma': False, 'bear_use_ema': False, 'bear_use_atr': False, 'bear_use_adx': False, 'bear_use_spike': True, 'bear_rsi_required': False, 'sideways_strategy': 'mean_reversion', 'sideways_bb_std_mult': 2.12962569809192, 'sideways_rsi_os': 8, 'sideways_rsi_ob': 63, 'sideways_adx_thresh': 30.90499569002941, 'sideways_atr_min_pct': 0.014328162542457112, 'sideways_atr_max_pct': 0.14804869373740837, 'sideways_tp_mult': 1.1730510876067757, 'sideways_tsl_mult': 0.4025670462894566, 'sideways_time_stop': 59, 'sideways_use_sma': False, 'sideways_use_ema': False, 'sideways_use_atr': True, 'sideways_use_adx': False, 'sideways_use_spike': True, 'sideways_rsi_required': True}.
[I 2025-09-01 07:25:12,836] Trial 31 finished with values: [-1000000000.0, 1000000000.0] and parameters: {'p_sma': 38, 'p_std': 15, 'p_atr': 28, 'p_adx': 16, 'rsi_period': 36, 'ema1': 16, 'ema2': 14, 'slip_atr_k': 0.14019685364558754, 'slip_spread_k': 0.5377376505910038, 'spread_hl_frac': 0.016564777538621848, 'bb_std_mult': 0.5874197353686913, 'rsi_os': 32, 'rsi_ob': 73, 'vol_spike': 0.22111492528967805, 'adx_thresh': 9.160234173338058, 'atr_min_pct': 0.029930020976097, 'atr_max_pct': 0.0684278404549554, 'tp_mult': 1.7934544668573822, 'tsl_mult': 0.31380529717105127, 'strategy': 'breakout', 'time_stop': 136, 'use_sma': False, 'use_atr': True, 'use_adx': False, 'use_ema': False, 'use_spike': True, 'rsi_required': True, 'edge_k': 0.9834885991265965, 'edge_cap': 0.26961495961767123, 'bull_strategy': 'mean_reversion', 'bull_bb_std_mult': 2.7819118780590113, 'bull_rsi_os': 30, 'bull_rsi_ob': 57, 'bull_adx_thresh': 20.243215873044836, 'bull_atr_min_pct': 0.018904629386933387, 'bull_atr_max_pct': 0.09678561206294657, 'bull_tp_mult': 1.8985244883668142, 'bull_tsl_mult': 0.3810053276169395, 'bull_time_stop': 127, 'bull_use_sma': False, 'bull_use_ema': True, 'bull_use_atr': False, 'bull_use_adx': False, 'bull_use_spike': True, 'bull_rsi_required': True, 'bear_strategy': 'breakout', 'bear_bb_std_mult': 3.1350057723810334, 'bear_rsi_os': 35, 'bear_rsi_ob': 86, 'bear_adx_thresh': 13.875371981531725, 'bear_atr_min_pct': 0.023573813586938625, 'bear_atr_max_pct': 0.06827896249944294, 'bear_tp_mult': 2.106319468728473, 'bear_tsl_mult': 0.9826695915395068, 'bear_time_stop': 127, 'bear_use_sma': False, 'bear_use_ema': False, 'bear_use_atr': False, 'bear_use_adx': False, 'bear_use_spike': False, 'bear_rsi_required': True, 'sideways_strategy': 'mean_reversion', 'sideways_bb_std_mult': 2.7237832500895944, 'sideways_rsi_os': 9, 'sideways_rsi_ob': 76, 'sideways_adx_thresh': 19.626462124881996, 'sideways_atr_min_pct': 0.00014032198582027318, 'sideways_atr_max_pct': 0.010959085946169414, 'sideways_tp_mult': 2.173252734177693, 'sideways_tsl_mult': 0.7292230320257064, 'sideways_time_stop': 36, 'sideways_use_sma': True, 'sideways_use_ema': False, 'sideways_use_atr': False, 'sideways_use_adx': False, 'sideways_use_spike': True, 'sideways_rsi_required': True}.
[I 2025-09-01 07:25:13,809] Trial 29 finished with values: [-1000000000.0, 1000000000.0] and parameters: {'p_sma': 50, 'p_std': 34, 'p_atr': 17, 'p_adx': 16, 'rsi_period': 53, 'ema1': 16, 'ema2': 15, 'slip_atr_k': 0.11812772427161894, 'slip_spread_k': 0.7694766133936031, 'spread_hl_frac': 0.017623403104287408, 'bb_std_mult': 0.6079208746650394, 'rsi_os': 31, 'rsi_ob': 45, 'vol_spike': 0.21765262910770145, 'adx_thresh': 20.773772320269515, 'atr_min_pct': 0.0007550255228956377, 'atr_max_pct': 0.11401196716868979, 'tp_mult': 1.7357696965010063, 'tsl_mult': 0.26029226358143276, 'strategy': 'breakout', 'time_stop': 126, 'use_sma': False, 'use_atr': False, 'use_adx': False, 'use_ema': False, 'use_spike': False, 'rsi_required': False, 'edge_k': 0.9437469456709456, 'edge_cap': 0.3023709808569785, 'bull_strategy': 'breakout', 'bull_bb_std_mult': 2.2310667872292167, 'bull_rsi_os': 31, 'bull_rsi_ob': 76, 'bull_adx_thresh': 20.37546202615094, 'bull_atr_min_pct': 0.020353819896767645, 'bull_atr_max_pct': 0.06619599852823481, 'bull_tp_mult': 1.8873488906874918, 'bull_tsl_mult': 0.3716646253130039, 'bull_time_stop': 126, 'bull_use_sma': False, 'bull_use_ema': True, 'bull_use_atr': False, 'bull_use_adx': False, 'bull_use_spike': True, 'bull_rsi_required': True, 'bear_strategy': 'breakout', 'bear_bb_std_mult': 3.129529120108456, 'bear_rsi_os': 32, 'bear_rsi_ob': 75, 'bear_adx_thresh': 13.137876823674027, 'bear_atr_min_pct': 0.011099069821182191, 'bear_atr_max_pct': 0.10308836339505353, 'bear_tp_mult': 1.5999735354319635, 'bear_tsl_mult': 0.9802933514033358, 'bear_time_stop': 128, 'bear_use_sma': False, 'bear_use_ema': False, 'bear_use_atr': False, 'bear_use_adx': False, 'bear_use_spike': False, 'bear_rsi_required': False, 'sideways_strategy': 'mean_reversion', 'sideways_bb_std_mult': 2.1292952605265514, 'sideways_rsi_os': 8, 'sideways_rsi_ob': 62, 'sideways_adx_thresh': 29.051931229260365, 'sideways_atr_min_pct': 0.014700311995536381, 'sideways_atr_max_pct': 0.1486482080821599, 'sideways_tp_mult': 1.2468389981716888, 'sideways_tsl_mult': 0.39772811901065663, 'sideways_time_stop': 43, 'sideways_use_sma': False, 'sideways_use_ema': False, 'sideways_use_atr': True, 'sideways_use_adx': False, 'sideways_use_spike': True, 'sideways_rsi_required': True}.
[I 2025-09-01 07:25:13,841] Trial 32 finished with values: [-1000000000.0, 1000000000.0] and parameters: {'p_sma': 31, 'p_std': 34, 'p_atr': 27, 'p_adx': 15, 'rsi_period': 36, 'ema1': 21, 'ema2': 43, 'slip_atr_k': 0.06909092878243046, 'slip_spread_k': 0.5305664513570739, 'spread_hl_frac': 0.0004802923439066945, 'bb_std_mult': 0.8116207388794502, 'rsi_os': 32, 'rsi_ob': 64, 'vol_spike': 0.19780380808707493, 'adx_thresh': 9.125893803063558, 'atr_min_pct': 0.012055160395220709, 'atr_max_pct': 0.13249678613551952, 'tp_mult': 1.0181467564684636, 'tsl_mult': 0.2681141779480065, 'strategy': 'breakout', 'time_stop': 129, 'use_sma': False, 'use_atr': True, 'use_adx': False, 'use_ema': False, 'use_spike': True, 'rsi_required': True, 'edge_k': 0.5340540598340806, 'edge_cap': 0.3160509683743981, 'bull_strategy': 'mean_reversion', 'bull_bb_std_mult': 0.88581552651308, 'bull_rsi_os': 30, 'bull_rsi_ob': 57, 'bull_adx_thresh': 20.348565780050023, 'bull_atr_min_pct': 0.005196887045763992, 'bull_atr_max_pct': 0.0657018628464595, 'bull_tp_mult': 2.6438097533509444, 'bull_tsl_mult': 0.00872523996262864, 'bull_time_stop': 120, 'bull_use_sma': False, 'bull_use_ema': True, 'bull_use_atr': False, 'bull_use_adx': False, 'bull_use_spike': False, 'bull_rsi_required': True, 'bear_strategy': 'breakout', 'bear_bb_std_mult': 3.2133976134216193, 'bear_rsi_os': 34, 'bear_rsi_ob': 87, 'bear_adx_thresh': 18.932996244316627, 'bear_atr_min_pct': 0.009330183705054913, 'bear_atr_max_pct': 0.06573778663397617, 'bear_tp_mult': 2.5467542358243866, 'bear_tsl_mult': 0.3268948689604424, 'bear_time_stop': 100, 'bear_use_sma': False, 'bear_use_ema': False, 'bear_use_atr': True, 'bear_use_adx': False, 'bear_use_spike': False, 'bear_rsi_required': True, 'sideways_strategy': 'mean_reversion', 'sideways_bb_std_mult': 2.71524931576722, 'sideways_rsi_os': 17, 'sideways_rsi_ob': 48, 'sideways_adx_thresh': 20.358887352957186, 'sideways_atr_min_pct': 0.0005870725741826746, 'sideways_atr_max_pct': 0.06658431448814912, 'sideways_tp_mult': 1.4758707768465165, 'sideways_tsl_mult': 0.9034024984728265, 'sideways_time_stop': 166, 'sideways_use_sma': True, 'sideways_use_ema': False, 'sideways_use_atr': False, 'sideways_use_adx': False, 'sideways_use_spike': True, 'sideways_rsi_required': True}.
[I 2025-09-01 07:25:14,037] Trial 30 finished with values: [-0.007742922759232496, 0.007765239974972948] and parameters: {'p_sma': 50, 'p_std': 34, 'p_atr': 17, 'p_adx': 16, 'rsi_period': 36, 'ema1': 16, 'ema2': 14, 'slip_atr_k': 0.1347842400597753, 'slip_spread_k': 0.5484772161874079, 'spread_hl_frac': 0.016954338636608272, 'bb_std_mult': 0.6024453635725029, 'rsi_os': 11, 'rsi_ob': 74, 'vol_spike': 0.23010791924092505, 'adx_thresh': 22.723262902001352, 'atr_min_pct': 0.028875636430329435, 'atr_max_pct': 0.11419952937014481, 'tp_mult': 1.6657538304255723, 'tsl_mult': 0.25195757606087865, 'strategy': 'breakout', 'time_stop': 137, 'use_sma': False, 'use_atr': False, 'use_adx': False, 'use_ema': False, 'use_spike': False, 'rsi_required': False, 'edge_k': 0.9574569386563831, 'edge_cap': 0.2714056572611469, 'bull_strategy': 'breakout', 'bull_bb_std_mult': 2.7444720879384366, 'bull_rsi_os': 31, 'bull_rsi_ob': 56, 'bull_adx_thresh': 20.621350331335545, 'bull_atr_min_pct': 0.003951258803415795, 'bull_atr_max_pct': 0.06490657630844916, 'bull_tp_mult': 1.917826591174524, 'bull_tsl_mult': 0.007974573000745055, 'bull_time_stop': 172, 'bull_use_sma': False, 'bull_use_ema': True, 'bull_use_atr': False, 'bull_use_adx': False, 'bull_use_spike': True, 'bull_rsi_required': True, 'bear_strategy': 'breakout', 'bear_bb_std_mult': 2.1357246073464555, 'bear_rsi_os': 37, 'bear_rsi_ob': 59, 'bear_adx_thresh': 7.926163129782951, 'bear_atr_min_pct': 0.029955912772319668, 'bear_atr_max_pct': 0.06435457187615287, 'bear_tp_mult': 1.022344872403908, 'bear_tsl_mult': 0.4779410949939579, 'bear_time_stop': 127, 'bear_use_sma': False, 'bear_use_ema': False, 'bear_use_atr': False, 'bear_use_adx': False, 'bear_use_spike': False, 'bear_rsi_required': False, 'sideways_strategy': 'mean_reversion', 'sideways_bb_std_mult': 2.7102748079424086, 'sideways_rsi_os': 40, 'sideways_rsi_ob': 48, 'sideways_adx_thresh': 29.56367046286502, 'sideways_atr_min_pct': 0.014764930909349657, 'sideways_atr_max_pct': 0.01115139489565832, 'sideways_tp_mult': 1.1714371681676052, 'sideways_tsl_mult': 0.5452752657878731, 'sideways_time_stop': 50, 'sideways_use_sma': False, 'sideways_use_ema': False, 'sideways_use_atr': True, 'sideways_use_adx': False, 'sideways_use_spike': True, 'sideways_rsi_required': True}.
[I 2025-09-01 07:25:55,920] Trial 35 finished with values: [-0.024473923627837624, 0.02436932631548786] and parameters: {'p_sma': 57, 'p_std': 15, 'p_atr': 16, 'p_adx': 14, 'rsi_period': 23, 'ema1': 23, 'ema2': 33, 'slip_atr_k': 0.1575237934720706, 'slip_spread_k': 0.24508903905629714, 'spread_hl_frac': 0.03146631317149693, 'bb_std_mult': 0.8462544750076473, 'rsi_os': 20, 'rsi_ob': 57, 'vol_spike': 0.28598354088752875, 'adx_thresh': 24.382913986777314, 'atr_min_pct': 0.019302449923382384, 'atr_max_pct': 0.13843246183400573, 'tp_mult': 2.2229108412870473, 'tsl_mult': 0.42797407448583796, 'strategy': 'breakout', 'time_stop': 91, 'use_sma': True, 'use_atr': False, 'use_adx': False, 'use_ema': False, 'use_spike': False, 'rsi_required': False, 'edge_k': 1.2876338946245562, 'edge_cap': 0.05383336282537565, 'bull_strategy': 'breakout', 'bull_bb_std_mult': 1.8591062369873113, 'bull_rsi_os': 5, 'bull_rsi_ob': 53, 'bull_adx_thresh': 22.637013337793025, 'bull_atr_min_pct': 0.0033955819611387102, 'bull_atr_max_pct': 0.08850945242942514, 'bull_tp_mult': 1.3775432372974505, 'bull_tsl_mult': 0.08654221052062643, 'bull_time_stop': 300, 'bull_use_sma': False, 'bull_use_ema': True, 'bull_use_atr': False, 'bull_use_adx': False, 'bull_use_spike': False, 'bull_rsi_required': True, 'bear_strategy': 'mean_reversion', 'bear_bb_std_mult': 0.5679619733809571, 'bear_rsi_os': 27, 'bear_rsi_ob': 61, 'bear_adx_thresh': 29.820595664490856, 'bear_atr_min_pct': 0.029411507390710013, 'bear_atr_max_pct': 0.050729567958548334, 'bear_tp_mult': 1.027515487492614, 'bear_tsl_mult': 0.12966738993273763, 'bear_time_stop': 202, 'bear_use_sma': True, 'bear_use_ema': True, 'bear_use_atr': True, 'bear_use_adx': True, 'bear_use_spike': False, 'bear_rsi_required': False, 'sideways_strategy': 'mean_reversion', 'sideways_bb_std_mult': 3.148876993661781, 'sideways_rsi_os': 38, 'sideways_rsi_ob': 78, 'sideways_adx_thresh': 32.04134156763412, 'sideways_atr_min_pct': 0.01896339540522448, 'sideways_atr_max_pct': 0.04417422713959666, 'sideways_tp_mult': 1.419549594450841, 'sideways_tsl_mult': 0.5549362653664668, 'sideways_time_stop': 259, 'sideways_use_sma': False, 'sideways_use_ema': False, 'sideways_use_atr': True, 'sideways_use_adx': True, 'sideways_use_spike': False, 'sideways_rsi_required': True}.
[I 2025-09-01 07:25:57,625] Trial 36 finished with values: [-0.036296296663707484, 0.03618415794898249] and parameters: {'p_sma': 60, 'p_std': 6, 'p_atr': 16, 'p_adx': 13, 'rsi_period': 34, 'ema1': 19, 'ema2': 34, 'slip_atr_k': 0.1536434625469629, 'slip_spread_k': 0.2989142739811428, 'spread_hl_frac': 0.03008415378932379, 'bb_std_mult': 0.8336448950268047, 'rsi_os': 20, 'rsi_ob': 58, 'vol_spike': 0.2812097622130426, 'adx_thresh': 24.353438957355173, 'atr_min_pct': 0.018498274229074102, 'atr_max_pct': 0.09594652688579422, 'tp_mult': 2.1657614053465206, 'tsl_mult': 0.43977883489422726, 'strategy': 'breakout', 'time_stop': 89, 'use_sma': True, 'use_atr': False, 'use_adx': False, 'use_ema': False, 'use_spike': False, 'rsi_required': False, 'edge_k': 1.601908561068441, 'edge_cap': 0.0774939733877904, 'bull_strategy': 'breakout', 'bull_bb_std_mult': 1.2619820645047857, 'bull_rsi_os': 9, 'bull_rsi_ob': 53, 'bull_adx_thresh': 22.247496061750187, 'bull_atr_min_pct': 0.003175902738426495, 'bull_atr_max_pct': 0.08670593382300668, 'bull_tp_mult': 2.4990912514674264, 'bull_tsl_mult': 0.11849409911824932, 'bull_time_stop': 224, 'bull_use_sma': False, 'bull_use_ema': True, 'bull_use_atr': False, 'bull_use_adx': False, 'bull_use_spike': False, 'bull_rsi_required': True, 'bear_strategy': 'mean_reversion', 'bear_bb_std_mult': 0.6726758621112425, 'bear_rsi_os': 25, 'bear_rsi_ob': 61, 'bear_adx_thresh': 8.349938112902992, 'bear_atr_min_pct': 0.02971936252301299, 'bear_atr_max_pct': 0.050448834455804184, 'bear_tp_mult': 1.0386906369429707, 'bear_tsl_mult': 0.16065924773136836, 'bear_time_stop': 201, 'bear_use_sma': True, 'bear_use_ema': True, 'bear_use_atr': True, 'bear_use_adx': True, 'bear_use_spike': False, 'bear_rsi_required': False, 'sideways_strategy': 'mean_reversion', 'sideways_bb_std_mult': 3.18044728797536, 'sideways_rsi_os': 40, 'sideways_rsi_ob': 77, 'sideways_adx_thresh': 32.413543572257325, 'sideways_atr_min_pct': 0.018627831324085548, 'sideways_atr_max_pct': 0.040945473301238225, 'sideways_tp_mult': 1.386110177182784, 'sideways_tsl_mult': 0.5733251779607155, 'sideways_time_stop': 25, 'sideways_use_sma': False, 'sideways_use_ema': False, 'sideways_use_atr': True, 'sideways_use_adx': True, 'sideways_use_spike': False, 'sideways_rsi_required': True}.
[I 2025-09-01 07:25:57,626] Trial 34 finished with values: [-1000000000.0, 1000000000.0] and parameters: {'p_sma': 33, 'p_std': 57, 'p_atr': 25, 'p_adx': 20, 'rsi_period': 46, 'ema1': 5, 'ema2': 10, 'slip_atr_k': 0.06535495624948064, 'slip_spread_k': 0.6912015336813142, 'spread_hl_frac': 0.00010681536854914922, 'bb_std_mult': 1.4963489407782795, 'rsi_os': 20, 'rsi_ob': 91, 'vol_spike': 0.13369692857796422, 'adx_thresh': 24.412221834078846, 'atr_min_pct': 0.02796569605463026, 'atr_max_pct': 0.13528297789526622, 'tp_mult': 1.0513193925428055, 'tsl_mult': 0.00012297174854223204, 'strategy': 'mean_reversion', 'time_stop': 195, 'use_sma': False, 'use_atr': True, 'use_adx': False, 'use_ema': False, 'use_spike': True, 'rsi_required': True, 'edge_k': 0.5671430679231544, 'edge_cap': 0.43347547897358873, 'bull_strategy': 'mean_reversion', 'bull_bb_std_mult': 3.3421050646976456, 'bull_rsi_os': 38, 'bull_rsi_ob': 64, 'bull_adx_thresh': 22.811733575011033, 'bull_atr_min_pct': 0.0028600728875433825, 'bull_atr_max_pct': 0.030623432082224428, 'bull_tp_mult': 2.6058412858276863, 'bull_tsl_mult': 0.02576125223031389, 'bull_time_stop': 174, 'bull_use_sma': False, 'bull_use_ema': False, 'bull_use_atr': True, 'bull_use_adx': True, 'bull_use_spike': False, 'bull_rsi_required': True, 'bear_strategy': 'breakout', 'bear_bb_std_mult': 3.355207372517264, 'bear_rsi_os': 44, 'bear_rsi_ob': 61, 'bear_adx_thresh': 19.00184993333344, 'bear_atr_min_pct': 0.02078203392362557, 'bear_atr_max_pct': 0.04322621109431778, 'bear_tp_mult': 1.0137371160000515, 'bear_tsl_mult': 0.3408820235656108, 'bear_time_stop': 63, 'bear_use_sma': False, 'bear_use_ema': False, 'bear_use_atr': True, 'bear_use_adx': False, 'bear_use_spike': True, 'bear_rsi_required': True, 'sideways_strategy': 'mean_reversion', 'sideways_bb_std_mult': 2.52787905336947, 'sideways_rsi_os': 18, 'sideways_rsi_ob': 48, 'sideways_adx_thresh': 26.19279043072982, 'sideways_atr_min_pct': 0.018130098427799786, 'sideways_atr_max_pct': 0.06895873613033428, 'sideways_tp_mult': 1.4929270693521826, 'sideways_tsl_mult': 0.8956265593379459, 'sideways_time_stop': 171, 'sideways_use_sma': True, 'sideways_use_ema': False, 'sideways_use_atr': False, 'sideways_use_adx': False, 'sideways_use_spike': True, 'sideways_rsi_required': True}.
