[I 2025-09-01 08:02:03,475] Trial 246 finished with values: [-1000000000.0, 1000000000.0] and parameters: {'p_sma': 28, 'p_std': 57, 'p_atr': 21, 'p_adx': 24, 'rsi_period': 48, 'ema1': 15, 'ema2': 13, 'slip_atr_k': 0.00935861293658194, 'slip_spread_k': 0.8546649747207399, 'spread_hl_frac': 0.014361142038854179, 'bb_std_mult': 1.9610692672498666, 'rsi_os': 34, 'rsi_ob': 90, 'vol_spike': 0.0995572080465402, 'adx_thresh': 16.002837307597733, 'atr_min_pct': 0.0037242447408176067, 'atr_max_pct': 0.13428000611452912, 'tp_mult': 2.6974790729642235, 'tsl_mult': 0.0779275887581514, 'strategy': 'breakout', 'time_stop': 226, 'use_sma': True, 'use_atr': True, 'use_adx': True, 'use_ema': True, 'use_spike': True, 'rsi_required': True, 'edge_k': 0.28723900734193314, 'edge_cap': 0.24704118956624807, 'bull_strategy': 'mean_reversion', 'bull_bb_std_mult': 3.0360923874101577, 'bull_rsi_os': 45, 'bull_rsi_ob': 74, 'bull_adx_thresh': 29.974501648574396, 'bull_atr_min_pct': 0.0035645593010250253, 'bull_atr_max_pct': 0.014349710877024704, 'bull_tp_mult': 1.4916480546636515, 'bull_tsl_mult': 0.5935997755814766, 'bull_time_stop': 63, 'bull_use_sma': True, 'bull_use_ema': True, 'bull_use_atr': False, 'bull_use_adx': False, 'bull_use_spike': False, 'bull_rsi_required': False, 'bear_strategy': 'mean_reversion', 'bear_bb_std_mult': 1.972163346388073, 'bear_rsi_os': 47, 'bear_rsi_ob': 79, 'bear_adx_thresh': 5.03660387287268, 'bear_atr_min_pct': 0.00797214985370322, 'bear_atr_max_pct': 0.09898391138832578, 'bear_tp_mult': 2.088802787875537, 'bear_tsl_mult': 0.10338735189190978, 'bear_time_stop': 239, 'bear_use_sma': True, 'bear_use_ema': True, 'bear_use_atr': False, 'bear_use_adx': False, 'bear_use_spike': False, 'bear_rsi_required': False, 'sideways_strategy': 'breakout', 'sideways_bb_std_mult': 1.8906438601384647, 'sideways_rsi_os': 5, 'sideways_rsi_ob': 92, 'sideways_adx_thresh': 10.57649592540421, 'sideways_atr_min_pct': 0.022794284048285283, 'sideways_atr_max_pct': 0.05594815568846919, 'sideways_tp_mult': 1.5740483867994342, 'sideways_tsl_mult': 0.17495722412744621, 'sideways_time_stop': 159, 'sideways_use_sma': True, 'sideways_use_ema': True, 'sideways_use_atr': True, 'sideways_use_adx': True, 'sideways_use_spike': False, 'sideways_rsi_required': False}.
[I 2025-09-01 08:02:03,899] Trial 245 finished with values: [-1000000000.0, 1000000000.0] and parameters: {'p_sma': 30, 'p_std': 47, 'p_atr': 21, 'p_adx': 21, 'rsi_period': 47, 'ema1': 15, 'ema2': 13, 'slip_atr_k': 0.0006061133087368046, 'slip_spread_k': 0.868475747867813, 'spread_hl_frac': 0.01466052388092477, 'bb_std_mult': 1.9524109014785638, 'rsi_os': 34, 'rsi_ob': 90, 'vol_spike': 0.06250407806756315, 'adx_thresh': 28.33214346249804, 'atr_min_pct': 0.0038325123613514762, 'atr_max_pct': 0.037014316516053365, 'tp_mult': 1.832013997259979, 'tsl_mult': 0.07934295586158084, 'strategy': 'breakout', 'time_stop': 227, 'use_sma': True, 'use_atr': True, 'use_adx': True, 'use_ema': True, 'use_spike': True, 'rsi_required': True, 'edge_k': 0.28046645088983996, 'edge_cap': 0.9339659610393032, 'bull_strategy': 'mean_reversion', 'bull_bb_std_mult': 3.4135963774841063, 'bull_rsi_os': 45, 'bull_rsi_ob': 93, 'bull_adx_thresh': 6.509724213993248, 'bull_atr_min_pct': 0.0034465550560181693, 'bull_atr_max_pct': 0.01432450416420282, 'bull_tp_mult': 1.4882577738314495, 'bull_tsl_mult': 0.5933908261834738, 'bull_time_stop': 235, 'bull_use_sma': True, 'bull_use_ema': True, 'bull_use_atr': False, 'bull_use_adx': False, 'bull_use_spike': False, 'bull_rsi_required': False, 'bear_strategy': 'mean_reversion', 'bear_bb_std_mult': 1.8077427904045542, 'bear_rsi_os': 47, 'bear_rsi_ob': 79, 'bear_adx_thresh': 5.010219131417763, 'bear_atr_min_pct': 0.00841231811223419, 'bear_atr_max_pct': 0.0986196263574761, 'bear_tp_mult': 2.113596966093928, 'bear_tsl_mult': 0.10535325679828844, 'bear_time_stop': 35, 'bear_use_sma': True, 'bear_use_ema': True, 'bear_use_atr': False, 'bear_use_adx': False, 'bear_use_spike': False, 'bear_rsi_required': False, 'sideways_strategy': 'breakout', 'sideways_bb_std_mult': 0.9035377946136732, 'sideways_rsi_os': 5, 'sideways_rsi_ob': 92, 'sideways_adx_thresh': 9.88544595692278, 'sideways_atr_min_pct': 0.003781324885445487, 'sideways_atr_max_pct': 0.01011633633661532, 'sideways_tp_mult': 1.9648651133160429, 'sideways_tsl_mult': 0.17099477388376588, 'sideways_time_stop': 160, 'sideways_use_sma': True, 'sideways_use_ema': True, 'sideways_use_atr': True, 'sideways_use_adx': True, 'sideways_use_spike': False, 'sideways_rsi_required': False}.
[I 2025-09-01 08:02:03,929] Trial 243 finished with values: [-1000000000.0, 1000000000.0] and parameters: {'p_sma': 28, 'p_std': 14, 'p_atr': 21, 'p_adx': 10, 'rsi_period': 54, 'ema1': 28, 'ema2': 48, 'slip_atr_k': 0.07728200119229015, 'slip_spread_k': 0.912820155303289, 'spread_hl_frac': 0.010296180534168729, 'bb_std_mult': 1.97117531739542, 'rsi_os': 34, 'rsi_ob': 91, 'vol_spike': 0.09113708085972973, 'adx_thresh': 27.610423204027278, 'atr_min_pct': 0.0037411568461180283, 'atr_max_pct': 0.13271926674425408, 'tp_mult': 1.1294425911953758, 'tsl_mult': 0.08603836465388862, 'strategy': 'breakout', 'time_stop': 194, 'use_sma': False, 'use_atr': True, 'use_adx': True, 'use_ema': True, 'use_spike': True, 'rsi_required': True, 'edge_k': 0.12728976480612303, 'edge_cap': 0.9273414826521889, 'bull_strategy': 'mean_reversion', 'bull_bb_std_mult': 3.216269529676072, 'bull_rsi_os': 49, 'bull_rsi_ob': 50, 'bull_adx_thresh': 7.925553677013366, 'bull_atr_min_pct': 0.004048827850807901, 'bull_atr_max_pct': 0.0378755091740682, 'bull_tp_mult': 1.504573304221795, 'bull_tsl_mult': 0.5606852708086918, 'bull_time_stop': 82, 'bull_use_sma': True, 'bull_use_ema': False, 'bull_use_atr': False, 'bull_use_adx': False, 'bull_use_spike': False, 'bull_rsi_required': False, 'bear_strategy': 'mean_reversion', 'bear_bb_std_mult': 1.325260937082338, 'bear_rsi_os': 8, 'bear_rsi_ob': 79, 'bear_adx_thresh': 6.298480691318287, 'bear_atr_min_pct': 0.008631316424200092, 'bear_atr_max_pct': 0.0977412883300038, 'bear_tp_mult': 2.0337482484183527, 'bear_tsl_mult': 0.04145245805746261, 'bear_time_stop': 294, 'bear_use_sma': True, 'bear_use_ema': True, 'bear_use_atr': False, 'bear_use_adx': False, 'bear_use_spike': False, 'bear_rsi_required': False, 'sideways_strategy': 'breakout', 'sideways_bb_std_mult': 1.1681673217602013, 'sideways_rsi_os': 6, 'sideways_rsi_ob': 94, 'sideways_adx_thresh': 10.472904713319675, 'sideways_atr_min_pct': 0.027438090389147414, 'sideways_atr_max_pct': 0.05654242553021553, 'sideways_tp_mult': 1.5874845641248418, 'sideways_tsl_mult': 0.05483109460289703, 'sideways_time_stop': 66, 'sideways_use_sma': True, 'sideways_use_ema': True, 'sideways_use_atr': True, 'sideways_use_adx': True, 'sideways_use_spike': False, 'sideways_rsi_required': False}.
[I 2025-09-01 08:02:04,127] Trial 244 finished with values: [-1000000000.0, 1000000000.0] and parameters: {'p_sma': 28, 'p_std': 58, 'p_atr': 21, 'p_adx': 24, 'rsi_period': 56, 'ema1': 14, 'ema2': 50, 'slip_atr_k': 0.008778312493884194, 'slip_spread_k': 0.8610601834172672, 'spread_hl_frac': 0.009898511432388443, 'bb_std_mult': 1.9866923416337379, 'rsi_os': 33, 'rsi_ob': 90, 'vol_spike': 0.06614968279689515, 'adx_thresh': 15.82266258628926, 'atr_min_pct': 0.0037266756236936987, 'atr_max_pct': 0.13607234442547972, 'tp_mult': 1.9514560830382068, 'tsl_mult': 0.08307140626763876, 'strategy': 'breakout', 'time_stop': 225, 'use_sma': False, 'use_atr': True, 'use_adx': True, 'use_ema': True, 'use_spike': True, 'rsi_required': True, 'edge_k': 0.28268504864427946, 'edge_cap': 0.24315357920763442, 'bull_strategy': 'mean_reversion', 'bull_bb_std_mult': 3.3919769927622743, 'bull_rsi_os': 49, 'bull_rsi_ob': 61, 'bull_adx_thresh': 7.508112049811029, 'bull_atr_min_pct': 0.004230790015897054, 'bull_atr_max_pct': 0.02656968237060621, 'bull_tp_mult': 1.4851298236442263, 'bull_tsl_mult': 0.5885264830576342, 'bull_time_stop': 65, 'bull_use_sma': True, 'bull_use_ema': False, 'bull_use_atr': False, 'bull_use_adx': False, 'bull_use_spike': False, 'bull_rsi_required': False, 'bear_strategy': 'mean_reversion', 'bear_bb_std_mult': 0.6051499127097875, 'bear_rsi_os': 48, 'bear_rsi_ob': 78, 'bear_adx_thresh': 5.4237146534449865, 'bear_atr_min_pct': 0.0034569019338698995, 'bear_atr_max_pct': 0.08583016382450889, 'bear_tp_mult': 2.2058082706096878, 'bear_tsl_mult': 0.07570365366006401, 'bear_time_stop': 284, 'bear_use_sma': True, 'bear_use_ema': True, 'bear_use_atr': False, 'bear_use_adx': False, 'bear_use_spike': False, 'bear_rsi_required': False, 'sideways_strategy': 'breakout', 'sideways_bb_std_mult': 1.875223253988239, 'sideways_rsi_os': 6, 'sideways_rsi_ob': 93, 'sideways_adx_thresh': 9.907874805402201, 'sideways_atr_min_pct': 0.028538153784544235, 'sideways_atr_max_pct': 0.014760699512299143, 'sideways_tp_mult': 1.2874962706211748, 'sideways_tsl_mult': 0.14565654251240634, 'sideways_time_stop': 219, 'sideways_use_sma': True, 'sideways_use_ema': True, 'sideways_use_atr': True, 'sideways_use_adx': True, 'sideways_use_spike': False, 'sideways_rsi_required': False}.
[I 2025-09-01 08:02:49,231] Trial 247 finished with values: [-0.009335763369423877, 0.009329676820015653] and parameters: {'p_sma': 30, 'p_std': 55, 'p_atr': 22, 'p_adx': 10, 'rsi_period': 57, 'ema1': 10, 'ema2': 39, 'slip_atr_k': 0.2204218759776068, 'slip_spread_k': 0.865883334838079, 'spread_hl_frac': 0.014502254914655562, 'bb_std_mult': 2.0653337116147226, 'rsi_os': 32, 'rsi_ob': 79, 'vol_spike': 0.05986497656700312, 'adx_thresh': 13.800094049465555, 'atr_min_pct': 0.00471123725137788, 'atr_max_pct': 0.14782745769162078, 'tp_mult': 1.8190133197708747, 'tsl_mult': 0.04429763890842631, 'strategy': 'breakout', 'time_stop': 190, 'use_sma': False, 'use_atr': False, 'use_adx': True, 'use_ema': True, 'use_spike': True, 'rsi_required': True, 'edge_k': 0.16111777666181543, 'edge_cap': 0.23182227029998112, 'bull_strategy': 'breakout', 'bull_bb_std_mult': 0.7392359652597333, 'bull_rsi_os': 49, 'bull_rsi_ob': 82, 'bull_adx_thresh': 6.5249375740665645, 'bull_atr_min_pct': 0.002774232356780686, 'bull_atr_max_pct': 0.025492422666799713, 'bull_tp_mult': 2.3935975523887656, 'bull_tsl_mult': 0.5842822871598561, 'bull_time_stop': 66, 'bull_use_sma': True, 'bull_use_ema': True, 'bull_use_atr': False, 'bull_use_adx': False, 'bull_use_spike': False, 'bull_rsi_required': False, 'bear_strategy': 'mean_reversion', 'bear_bb_std_mult': 1.7903744661616958, 'bear_rsi_os': 46, 'bear_rsi_ob': 79, 'bear_adx_thresh': 5.525134655789772, 'bear_atr_min_pct': 0.01945118545908492, 'bear_atr_max_pct': 0.09885529791582673, 'bear_tp_mult': 2.171443249863024, 'bear_tsl_mult': 0.08323552734189253, 'bear_time_stop': 300, 'bear_use_sma': True, 'bear_use_ema': False, 'bear_use_atr': False, 'bear_use_adx': False, 'bear_use_spike': False, 'bear_rsi_required': False, 'sideways_strategy': 'breakout', 'sideways_bb_std_mult': 0.900044993539218, 'sideways_rsi_os': 6, 'sideways_rsi_ob': 95, 'sideways_adx_thresh': 9.88022877247823, 'sideways_atr_min_pct': 0.02093937501463386, 'sideways_atr_max_pct': 0.010160632281369923, 'sideways_tp_mult': 1.2708181528137952, 'sideways_tsl_mult': 0.9690976573864666, 'sideways_time_stop': 282, 'sideways_use_sma': True, 'sideways_use_ema': True, 'sideways_use_atr': True, 'sideways_use_adx': True, 'sideways_use_spike': False, 'sideways_rsi_required': False}.
[I 2025-09-01 08:02:49,626] Trial 249 finished with values: [-0.009824208547215663, 0.00981099393729522] and parameters: {'p_sma': 30, 'p_std': 55, 'p_atr': 19, 'p_adx': 29, 'rsi_period': 62, 'ema1': 21, 'ema2': 15, 'slip_atr_k': 0.22148395613045632, 'slip_spread_k': 0.8637240598439904, 'spread_hl_frac': 0.015548855672920095, 'bb_std_mult': 2.429644612170798, 'rsi_os': 32, 'rsi_ob': 94, 'vol_spike': 0.0565368543313781, 'adx_thresh': 14.500750986631747, 'atr_min_pct': 0.00463522094912942, 'atr_max_pct': 0.12257531327009008, 'tp_mult': 1.7995597229734754, 'tsl_mult': 0.04686547377665194, 'strategy': 'breakout', 'time_stop': 244, 'use_sma': False, 'use_atr': False, 'use_adx': True, 'use_ema': True, 'use_spike': True, 'rsi_required': True, 'edge_k': 0.166865219409512, 'edge_cap': 0.23644221920196243, 'bull_strategy': 'breakout', 'bull_bb_std_mult': 2.751698247893111, 'bull_rsi_os': 54, 'bull_rsi_ob': 69, 'bull_adx_thresh': 8.592742004406492, 'bull_atr_min_pct': 0.0027291174566154612, 'bull_atr_max_pct': 0.0729205433337897, 'bull_tp_mult': 1.5674830298688174, 'bull_tsl_mult': 0.6393827678410404, 'bull_time_stop': 67, 'bull_use_sma': True, 'bull_use_ema': True, 'bull_use_atr': False, 'bull_use_adx': False, 'bull_use_spike': False, 'bull_rsi_required': False, 'bear_strategy': 'mean_reversion', 'bear_bb_std_mult': 0.6322111152345558, 'bear_rsi_os': 46, 'bear_rsi_ob': 78, 'bear_adx_thresh': 31.55228291619689, 'bear_atr_min_pct': 0.019501603234300863, 'bear_atr_max_pct': 0.09681891537007455, 'bear_tp_mult': 2.211441510082273, 'bear_tsl_mult': 0.08652710208853506, 'bear_time_stop': 221, 'bear_use_sma': True, 'bear_use_ema': False, 'bear_use_atr': False, 'bear_use_adx': False, 'bear_use_spike': False, 'bear_rsi_required': True, 'sideways_strategy': 'breakout', 'sideways_bb_std_mult': 0.8539148850830074, 'sideways_rsi_os': 6, 'sideways_rsi_ob': 95, 'sideways_adx_thresh': 21.97481733227845, 'sideways_atr_min_pct': 0.0285515550323027, 'sideways_atr_max_pct': 0.0910461357858228, 'sideways_tp_mult': 2.732091659842715, 'sideways_tsl_mult': 0.2111529009238, 'sideways_time_stop': 228, 'sideways_use_sma': True, 'sideways_use_ema': True, 'sideways_use_atr': True, 'sideways_use_adx': True, 'sideways_use_spike': False, 'sideways_rsi_required': False}.
[I 2025-09-01 08:02:49,643] Trial 248 finished with values: [-0.004183375343623785, 0.005948601473264858] and parameters: {'p_sma': 30, 'p_std': 37, 'p_atr': 19, 'p_adx': 22, 'rsi_period': 57, 'ema1': 16, 'ema2': 17, 'slip_atr_k': 0.04149268217830368, 'slip_spread_k': 0.8630062607424731, 'spread_hl_frac': 0.013837845278259688, 'bb_std_mult': 1.1392993800195435, 'rsi_os': 32, 'rsi_ob': 48, 'vol_spike': 0.0552352412870524, 'adx_thresh': 29.951246226709593, 'atr_min_pct': 0.004652686167816133, 'atr_max_pct': 0.12368260024983749, 'tp_mult': 1.6161198387721898, 'tsl_mult': 0.04730755681315378, 'strategy': 'breakout', 'time_stop': 246, 'use_sma': False, 'use_atr': False, 'use_adx': True, 'use_ema': True, 'use_spike': True, 'rsi_required': True, 'edge_k': 0.1879779898043886, 'edge_cap': 0.2898164086171801, 'bull_strategy': 'breakout', 'bull_bb_std_mult': 2.7482659023244485, 'bull_rsi_os': 47, 'bull_rsi_ob': 82, 'bull_adx_thresh': 7.532297277889145, 'bull_atr_min_pct': 0.0026946515691516656, 'bull_atr_max_pct': 0.025042912385891083, 'bull_tp_mult': 1.5653966362899738, 'bull_tsl_mult': 0.6422055952545307, 'bull_time_stop': 66, 'bull_use_sma': True, 'bull_use_ema': True, 'bull_use_atr': False, 'bull_use_adx': False, 'bull_use_spike': False, 'bull_rsi_required': False, 'bear_strategy': 'mean_reversion', 'bear_bb_std_mult': 1.867092338978816, 'bear_rsi_os': 46, 'bear_rsi_ob': 82, 'bear_adx_thresh': 5.618536782972047, 'bear_atr_min_pct': 0.007409372963805693, 'bear_atr_max_pct': 0.09789152588315239, 'bear_tp_mult': 2.2095953704318743, 'bear_tsl_mult': 0.07455393270752411, 'bear_time_stop': 300, 'bear_use_sma': True, 'bear_use_ema': False, 'bear_use_atr': False, 'bear_use_adx': False, 'bear_use_spike': False, 'bear_rsi_required': True, 'sideways_strategy': 'breakout', 'sideways_bb_std_mult': 0.849690780727718, 'sideways_rsi_os': 6, 'sideways_rsi_ob': 95, 'sideways_adx_thresh': 6.6427426754933645, 'sideways_atr_min_pct': 0.028482893955643473, 'sideways_atr_max_pct': 0.015594348243266816, 'sideways_tp_mult': 1.2604633427265424, 'sideways_tsl_mult': 0.2060205886487897, 'sideways_time_stop': 138, 'sideways_use_sma': True, 'sideways_use_ema': True, 'sideways_use_atr': True, 'sideways_use_adx': True, 'sideways_use_spike': False, 'sideways_rsi_required': False}.
[I 2025-09-01 08:02:49,877] Trial 250 finished with values: [-0.04786098426722041, 0.0477007099153465] and parameters: {'p_sma': 29, 'p_std': 11, 'p_atr': 19, 'p_adx': 29, 'rsi_period': 62, 'ema1': 10, 'ema2': 39, 'slip_atr_k': 0.22102587622560213, 'slip_spread_k': 0.9274166355245288, 'spread_hl_frac': 0.015398741499897508, 'bb_std_mult': 2.9381813903582117, 'rsi_os': 31, 'rsi_ob': 66, 'vol_spike': 0.05636580400763337, 'adx_thresh': 14.181173440866457, 'atr_min_pct': 0.004643150298256548, 'atr_max_pct': 0.04218632303619208, 'tp_mult': 1.6123549863392004, 'tsl_mult': 0.03839001335871368, 'strategy': 'breakout', 'time_stop': 245, 'use_sma': False, 'use_atr': False, 'use_adx': True, 'use_ema': True, 'use_spike': True, 'rsi_required': True, 'edge_k': 0.1808816511718066, 'edge_cap': 0.1984937934885347, 'bull_strategy': 'breakout', 'bull_bb_std_mult': 1.2232241392063263, 'bull_rsi_os': 46, 'bull_rsi_ob': 48, 'bull_adx_thresh': 8.51258842818505, 'bull_atr_min_pct': 0.0027440185641494684, 'bull_atr_max_pct': 0.11830669327570295, 'bull_tp_mult': 1.5648308537310458, 'bull_tsl_mult': 0.6399232648510373, 'bull_time_stop': 49, 'bull_use_sma': True, 'bull_use_ema': True, 'bull_use_atr': False, 'bull_use_adx': False, 'bull_use_spike': False, 'bull_rsi_required': False, 'bear_strategy': 'mean_reversion', 'bear_bb_std_mult': 1.6780120135261867, 'bear_rsi_os': 46, 'bear_rsi_ob': 83, 'bear_adx_thresh': 34.04555066641206, 'bear_atr_min_pct': 0.007384275464093619, 'bear_atr_max_pct': 0.09748820451247478, 'bear_tp_mult': 2.154535543979114, 'bear_tsl_mult': 0.08829067077985783, 'bear_time_stop': 300, 'bear_use_sma': True, 'bear_use_ema': False, 'bear_use_atr': True, 'bear_use_adx': False, 'bear_use_spike': False, 'bear_rsi_required': True, 'sideways_strategy': 'breakout', 'sideways_bb_std_mult': 0.841732634449027, 'sideways_rsi_os': 8, 'sideways_rsi_ob': 95, 'sideways_adx_thresh': 17.497955291901864, 'sideways_atr_min_pct': 0.028683858116093086, 'sideways_atr_max_pct': 0.09049258967046668, 'sideways_tp_mult': 2.749534973378866, 'sideways_tsl_mult': 0.8488082607761804, 'sideways_time_stop': 230, 'sideways_use_sma': True, 'sideways_use_ema': True, 'sideways_use_atr': True, 'sideways_use_adx': True, 'sideways_use_spike': False, 'sideways_rsi_required': False}.
[I 2025-09-01 08:03:37,598] Trial 252 finished with values: [-1000000000.0, 1000000000.0] and parameters: {'p_sma': 32, 'p_std': 60, 'p_atr': 10, 'p_adx': 30, 'rsi_period': 60, 'ema1': 6, 'ema2': 14, 'slip_atr_k': 0.09524539437741292, 'slip_spread_k': 0.9190370292176895, 'spread_hl_frac': 0.015077395934855695, 'bb_std_mult': 3.198446632664516, 'rsi_os': 26, 'rsi_ob': 66, 'vol_spike': 0.047220771545024354, 'adx_thresh': 26.667842108684045, 'atr_min_pct': 0.0031930978319440174, 'atr_max_pct': 0.0838658252780713, 'tp_mult': 1.7711787834942412, 'tsl_mult': 0.02454760049159531, 'strategy': 'mean_reversion', 'time_stop': 259, 'use_sma': False, 'use_atr': False, 'use_adx': True, 'use_ema': True, 'use_spike': True, 'rsi_required': True, 'edge_k': 0.23482037845056294, 'edge_cap': 0.1964051793841533, 'bull_strategy': 'breakout', 'bull_bb_std_mult': 3.046777372222172, 'bull_rsi_os': 39, 'bull_rsi_ob': 48, 'bull_adx_thresh': 8.430101819978063, 'bull_atr_min_pct': 0.014978186173970408, 'bull_atr_max_pct': 0.10448667672397857, 'bull_tp_mult': 1.5713038654737923, 'bull_tsl_mult': 0.6050894692266707, 'bull_time_stop': 76, 'bull_use_sma': True, 'bull_use_ema': True, 'bull_use_atr': True, 'bull_use_adx': True, 'bull_use_spike': False, 'bull_rsi_required': False, 'bear_strategy': 'mean_reversion', 'bear_bb_std_mult': 1.7033503554639378, 'bear_rsi_os': 29, 'bear_rsi_ob': 83, 'bear_adx_thresh': 7.663914383611044, 'bear_atr_min_pct': 0.025164351127711884, 'bear_atr_max_pct': 0.09355130163755597, 'bear_tp_mult': 2.1337877656787905, 'bear_tsl_mult': 0.10448646621950879, 'bear_time_stop': 292, 'bear_use_sma': True, 'bear_use_ema': False, 'bear_use_atr': True, 'bear_use_adx': False, 'bear_use_spike': True, 'bear_rsi_required': False, 'sideways_strategy': 'breakout', 'sideways_bb_std_mult': 1.0634089184006215, 'sideways_rsi_os': 8, 'sideways_rsi_ob': 66, 'sideways_adx_thresh': 11.355233979867513, 'sideways_atr_min_pct': 0.02991136407463726, 'sideways_atr_max_pct': 0.02386557088156001, 'sideways_tp_mult': 1.496465637787475, 'sideways_tsl_mult': 0.1675052053228403, 'sideways_time_stop': 170, 'sideways_use_sma': True, 'sideways_use_ema': True, 'sideways_use_atr': True, 'sideways_use_adx': True, 'sideways_use_spike': False, 'sideways_rsi_required': False}.
