[I 2025-09-01 07:33:58,420] Trial 78 finished with values: [-0.04587461674578974, 0.04598827740889922] and parameters: {'p_sma': 49, 'p_std': 22, 'p_atr': 26, 'p_adx': 16, 'rsi_period': 69, 'ema1': 24, 'ema2': 23, 'slip_atr_k': 0.1787875000539895, 'slip_spread_k': 0.5434501631273868, 'spread_hl_frac': 0.005353111128652777, 'bb_std_mult': 0.8922450735740387, 'rsi_os': 12, 'rsi_ob': 89, 'vol_spike': 0.25380011717810214, 'adx_thresh': 23.662131549473887, 'atr_min_pct': 0.02431701651184015, 'atr_max_pct': 0.14981678437623033, 'tp_mult': 1.8927405493242542, 'tsl_mult': 0.13161396330763858, 'strategy': 'mean_reversion', 'time_stop': 169, 'use_sma': False, 'use_atr': False, 'use_adx': False, 'use_ema': True, 'use_spike': False, 'rsi_required': False, 'edge_k': 0.2660879289045849, 'edge_cap': 0.2428629730519158, 'bull_strategy': 'breakout', 'bull_bb_std_mult': 2.46109510582793, 'bull_rsi_os': 37, 'bull_rsi_ob': 70, 'bull_adx_thresh': 5.450499714471935, 'bull_atr_min_pct': 0.002095787123236265, 'bull_atr_max_pct': 0.06859264137670346, 'bull_tp_mult': 1.9616570174513241, 'bull_tsl_mult': 0.04502583058238918, 'bull_time_stop': 297, 'bull_use_sma': True, 'bull_use_ema': True, 'bull_use_atr': True, 'bull_use_adx': False, 'bull_use_spike': True, 'bull_rsi_required': False, 'bear_strategy': 'mean_reversion', 'bear_bb_std_mult': 3.2679360074494905, 'bear_rsi_os': 30, 'bear_rsi_ob': 69, 'bear_adx_thresh': 33.462335706373274, 'bear_atr_min_pct': 0.02452207870973798, 'bear_atr_max_pct': 0.10751170026447299, 'bear_tp_mult': 1.5448100505803852, 'bear_tsl_mult': 0.416588713784799, 'bear_time_stop': 133, 'bear_use_sma': True, 'bear_use_ema': False, 'bear_use_atr': False, 'bear_use_adx': False, 'bear_use_spike': False, 'bear_rsi_required': False, 'sideways_strategy': 'mean_reversion', 'sideways_bb_std_mult': 2.669475139880443, 'sideways_rsi_os': 5, 'sideways_rsi_ob': 94, 'sideways_adx_thresh': 31.553008962795825, 'sideways_atr_min_pct': 0.022230790165563223, 'sideways_atr_max_pct': 0.05412257347075232, 'sideways_tp_mult': 2.238496786654755, 'sideways_tsl_mult': 0.42980070118837066, 'sideways_time_stop': 252, 'sideways_use_sma': False, 'sideways_use_ema': True, 'sideways_use_atr': True, 'sideways_use_adx': False, 'sideways_use_spike': True, 'sideways_rsi_required': True}.
[I 2025-09-01 07:33:58,605] Trial 79 finished with values: [-1000000000.0, 1000000000.0] and parameters: {'p_sma': 11, 'p_std': 55, 'p_atr': 18, 'p_adx': 18, 'rsi_period': 45, 'ema1': 21, 'ema2': 13, 'slip_atr_k': 0.037731546498817006, 'slip_spread_k': 0.4699294770780326, 'spread_hl_frac': 0.004856302708457418, 'bb_std_mult': 0.6253394250103856, 'rsi_os': 34, 'rsi_ob': 90, 'vol_spike': 0.21875573487189215, 'adx_thresh': 23.815703620055757, 'atr_min_pct': 0.02246671877843095, 'atr_max_pct': 0.12427384021572374, 'tp_mult': 1.2683927298528794, 'tsl_mult': 0.3962191176745879, 'strategy': 'mean_reversion', 'time_stop': 241, 'use_sma': False, 'use_atr': False, 'use_adx': False, 'use_ema': True, 'use_spike': False, 'rsi_required': False, 'edge_k': 0.7276477189544736, 'edge_cap': 0.447916664218864, 'bull_strategy': 'breakout', 'bull_bb_std_mult': 3.136454537229144, 'bull_rsi_os': 26, 'bull_rsi_ob': 57, 'bull_adx_thresh': 20.79239623235259, 'bull_atr_min_pct': 0.009881165271047869, 'bull_atr_max_pct': 0.06819182594803376, 'bull_tp_mult': 1.0571726309825915, 'bull_tsl_mult': 0.00024569963321959855, 'bull_time_stop': 194, 'bull_use_sma': True, 'bull_use_ema': True, 'bull_use_atr': True, 'bull_use_adx': False, 'bull_use_spike': True, 'bull_rsi_required': False, 'bear_strategy': 'mean_reversion', 'bear_bb_std_mult': 3.2696376928722506, 'bear_rsi_os': 29, 'bear_rsi_ob': 63, 'bear_adx_thresh': 19.94682258254278, 'bear_atr_min_pct': 0.018670048026289437, 'bear_atr_max_pct': 0.06820443832150477, 'bear_tp_mult': 1.5454361635659462, 'bear_tsl_mult': 0.08984053467543612, 'bear_time_stop': 130, 'bear_use_sma': True, 'bear_use_ema': False, 'bear_use_atr': False, 'bear_use_adx': True, 'bear_use_spike': False, 'bear_rsi_required': False, 'sideways_strategy': 'mean_reversion', 'sideways_bb_std_mult': 1.0811766157684164, 'sideways_rsi_os': 33, 'sideways_rsi_ob': 94, 'sideways_adx_thresh': 31.723906732923385, 'sideways_atr_min_pct': 0.011582674129136179, 'sideways_atr_max_pct': 0.11681147542614427, 'sideways_tp_mult': 1.429128127314905, 'sideways_tsl_mult': 0.42563173624712547, 'sideways_time_stop': 216, 'sideways_use_sma': False, 'sideways_use_ema': True, 'sideways_use_atr': True, 'sideways_use_adx': False, 'sideways_use_spike': True, 'sideways_rsi_required': True}.
[I 2025-09-01 07:34:38,653] Trial 85 finished with values: [-1000000000.0, 1000000000.0] and parameters: {'p_sma': 18, 'p_std': 8, 'p_atr': 17, 'p_adx': 24, 'rsi_period': 35, 'ema1': 16, 'ema2': 13, 'slip_atr_k': 0.13770758942839068, 'slip_spread_k': 0.9461066186195068, 'spread_hl_frac': 0.013373858249325906, 'bb_std_mult': 1.8548720452968848, 'rsi_os': 33, 'rsi_ob': 60, 'vol_spike': 0.12027350987950569, 'adx_thresh': 13.18476344101946, 'atr_min_pct': 0.028136919610697007, 'atr_max_pct': 0.12644076656831937, 'tp_mult': 1.1580412122168537, 'tsl_mult': 0.20493735020549372, 'strategy': 'breakout', 'time_stop': 56, 'use_sma': True, 'use_atr': False, 'use_adx': False, 'use_ema': False, 'use_spike': False, 'rsi_required': False, 'edge_k': 0.7648832795125207, 'edge_cap': 0.4608424621174717, 'bull_strategy': 'breakout', 'bull_bb_std_mult': 2.106027080214323, 'bull_rsi_os': 33, 'bull_rsi_ob': 95, 'bull_adx_thresh': 22.579611057254656, 'bull_atr_min_pct': 0.009638951608761274, 'bull_atr_max_pct': 0.06454759097838343, 'bull_tp_mult': 1.1081471894743453, 'bull_tsl_mult': 0.5203667383836532, 'bull_time_stop': 19, 'bull_use_sma': False, 'bull_use_ema': True, 'bull_use_atr': False, 'bull_use_adx': True, 'bull_use_spike': False, 'bull_rsi_required': True, 'bear_strategy': 'breakout', 'bear_bb_std_mult': 2.6039925149966003, 'bear_rsi_os': 42, 'bear_rsi_ob': 62, 'bear_adx_thresh': 23.20484789865849, 'bear_atr_min_pct': 0.0265465940401615, 'bear_atr_max_pct': 0.11844813157123976, 'bear_tp_mult': 1.0746008717149682, 'bear_tsl_mult': 0.5530369118735007, 'bear_time_stop': 67, 'bear_use_sma': False, 'bear_use_ema': False, 'bear_use_atr': False, 'bear_use_adx': False, 'bear_use_spike': True, 'bear_rsi_required': False, 'sideways_strategy': 'mean_reversion', 'sideways_bb_std_mult': 2.484251034144711, 'sideways_rsi_os': 49, 'sideways_rsi_ob': 56, 'sideways_adx_thresh': 20.815755771758557, 'sideways_atr_min_pct': 0.019016383104191684, 'sideways_atr_max_pct': 0.11392921411358808, 'sideways_tp_mult': 1.713952182715326, 'sideways_tsl_mult': 0.8541797825595727, 'sideways_time_stop': 57, 'sideways_use_sma': False, 'sideways_use_ema': False, 'sideways_use_atr': True, 'sideways_use_adx': False, 'sideways_use_spike': False, 'sideways_rsi_required': True}.
[I 2025-09-01 07:34:39,092] Trial 84 finished with values: [-1000000000.0, 1000000000.0] and parameters: {'p_sma': 13, 'p_std': 11, 'p_atr': 17, 'p_adx': 24, 'rsi_period': 72, 'ema1': 13, 'ema2': 13, 'slip_atr_k': 0.24923913385808344, 'slip_spread_k': 0.5135227474351101, 'spread_hl_frac': 0.02339111633537263, 'bb_std_mult': 1.8068999041831089, 'rsi_os': 11, 'rsi_ob': 88, 'vol_spike': 0.1250017351864524, 'adx_thresh': 13.406438873750346, 'atr_min_pct': 0.012589190855996512, 'atr_max_pct': 0.12516489306373174, 'tp_mult': 1.1655912358255451, 'tsl_mult': 0.12834539769417086, 'strategy': 'breakout', 'time_stop': 125, 'use_sma': False, 'use_atr': False, 'use_adx': False, 'use_ema': False, 'use_spike': False, 'rsi_required': False, 'edge_k': 0.7564865880876748, 'edge_cap': 0.3177539557721081, 'bull_strategy': 'breakout', 'bull_bb_std_mult': 2.1344614246937317, 'bull_rsi_os': 32, 'bull_rsi_ob': 94, 'bull_adx_thresh': 22.049201990966164, 'bull_atr_min_pct': 0.018923004209898932, 'bull_atr_max_pct': 0.06347006753105283, 'bull_tp_mult': 1.7743673547821635, 'bull_tsl_mult': 0.3289741576968782, 'bull_time_stop': 189, 'bull_use_sma': False, 'bull_use_ema': True, 'bull_use_atr': False, 'bull_use_adx': False, 'bull_use_spike': True, 'bull_rsi_required': True, 'bear_strategy': 'breakout', 'bear_bb_std_mult': 0.7686015959475812, 'bear_rsi_os': 9, 'bear_rsi_ob': 77, 'bear_adx_thresh': 23.27177522252944, 'bear_atr_min_pct': 0.0010422722535187896, 'bear_atr_max_pct': 0.10647203153614089, 'bear_tp_mult': 1.0648017076236742, 'bear_tsl_mult': 0.957868686329583, 'bear_time_stop': 62, 'bear_use_sma': False, 'bear_use_ema': False, 'bear_use_atr': False, 'bear_use_adx': False, 'bear_use_spike': False, 'bear_rsi_required': False, 'sideways_strategy': 'mean_reversion', 'sideways_bb_std_mult': 2.681078001114521, 'sideways_rsi_os': 50, 'sideways_rsi_ob': 69, 'sideways_adx_thresh': 21.651014555645993, 'sideways_atr_min_pct': 0.014949783954474695, 'sideways_atr_max_pct': 0.0651812357470405, 'sideways_tp_mult': 1.7729393169911252, 'sideways_tsl_mult': 0.8243514777632162, 'sideways_time_stop': 156, 'sideways_use_sma': False, 'sideways_use_ema': False, 'sideways_use_atr': True, 'sideways_use_adx': False, 'sideways_use_spike': False, 'sideways_rsi_required': True}.
[I 2025-09-01 07:34:39,411] Trial 83 finished with values: [-1000000000.0, 1000000000.0] and parameters: {'p_sma': 13, 'p_std': 55, 'p_atr': 17, 'p_adx': 24, 'rsi_period': 35, 'ema1': 16, 'ema2': 13, 'slip_atr_k': 0.03698451035471116, 'slip_spread_k': 0.9428404059763189, 'spread_hl_frac': 0.023161121940684773, 'bb_std_mult': 1.7937572720447523, 'rsi_os': 12, 'rsi_ob': 69, 'vol_spike': 0.25389866484150875, 'adx_thresh': 13.595069118241469, 'atr_min_pct': 0.011476789269968198, 'atr_max_pct': 0.12686241547190197, 'tp_mult': 2.507841023729567, 'tsl_mult': 0.2215792088601224, 'strategy': 'breakout', 'time_stop': 57, 'use_sma': False, 'use_atr': False, 'use_adx': False, 'use_ema': False, 'use_spike': False, 'rsi_required': False, 'edge_k': 0.7481068694140864, 'edge_cap': 0.27718789848627806, 'bull_strategy': 'breakout', 'bull_bb_std_mult': 2.7359548669398466, 'bull_rsi_os': 33, 'bull_rsi_ob': 93, 'bull_adx_thresh': 22.125913897413156, 'bull_atr_min_pct': 0.009708134125860222, 'bull_atr_max_pct': 0.06445210667319563, 'bull_tp_mult': 1.0938150863218474, 'bull_tsl_mult': 0.32943925372486715, 'bull_time_stop': 173, 'bull_use_sma': False, 'bull_use_ema': True, 'bull_use_atr': False, 'bull_use_adx': False, 'bull_use_spike': True, 'bull_rsi_required': True, 'bear_strategy': 'breakout', 'bear_bb_std_mult': 2.581285077124383, 'bear_rsi_os': 9, 'bear_rsi_ob': 63, 'bear_adx_thresh': 18.287971131450554, 'bear_atr_min_pct': 0.014807560801103365, 'bear_atr_max_pct': 0.12113306800441123, 'bear_tp_mult': 1.0629399617901596, 'bear_tsl_mult': 0.5085187300063794, 'bear_time_stop': 70, 'bear_use_sma': False, 'bear_use_ema': False, 'bear_use_atr': False, 'bear_use_adx': False, 'bear_use_spike': False, 'bear_rsi_required': False, 'sideways_strategy': 'mean_reversion', 'sideways_bb_std_mult': 2.659088425941338, 'sideways_rsi_os': 50, 'sideways_rsi_ob': 55, 'sideways_adx_thresh': 30.075476588216645, 'sideways_atr_min_pct': 0.014579933100007604, 'sideways_atr_max_pct': 0.06755107989124226, 'sideways_tp_mult': 1.302760671317742, 'sideways_tsl_mult': 0.5489246725683751, 'sideways_time_stop': 271, 'sideways_use_sma': False, 'sideways_use_ema': False, 'sideways_use_atr': True, 'sideways_use_adx': False, 'sideways_use_spike': False, 'sideways_rsi_required': True}.
[I 2025-09-01 07:34:39,628] Trial 86 finished with values: [-1000000000.0, 1000000000.0] and parameters: {'p_sma': 45, 'p_std': 8, 'p_atr': 17, 'p_adx': 24, 'rsi_period': 72, 'ema1': 16, 'ema2': 16, 'slip_atr_k': 0.15049025811799596, 'slip_spread_k': 0.1675175241958307, 'spread_hl_frac': 0.029218648712204996, 'bb_std_mult': 1.8621264833608793, 'rsi_os': 11, 'rsi_ob': 69, 'vol_spike': 0.2721449208741249, 'adx_thresh': 12.723731754346307, 'atr_min_pct': 0.01228299771642068, 'atr_max_pct': 0.050726262315680226, 'tp_mult': 1.1233656252726276, 'tsl_mult': 0.22278387329509508, 'strategy': 'breakout', 'time_stop': 128, 'use_sma': True, 'use_atr': False, 'use_adx': False, 'use_ema': False, 'use_spike': False, 'rsi_required': True, 'edge_k': 1.035381260312244, 'edge_cap': 0.28434006152359453, 'bull_strategy': 'breakout', 'bull_bb_std_mult': 3.2673438886056445, 'bull_rsi_os': 33, 'bull_rsi_ob': 95, 'bull_adx_thresh': 21.984531597530875, 'bull_atr_min_pct': 0.019711681400314447, 'bull_atr_max_pct': 0.03873579214856052, 'bull_tp_mult': 1.7803252005598187, 'bull_tsl_mult': 0.334322779178829, 'bull_time_stop': 19, 'bull_use_sma': False, 'bull_use_ema': False, 'bull_use_atr': False, 'bull_use_adx': True, 'bull_use_spike': False, 'bull_rsi_required': True, 'bear_strategy': 'breakout', 'bear_bb_std_mult': 0.6825589128891241, 'bear_rsi_os': 43, 'bear_rsi_ob': 62, 'bear_adx_thresh': 26.51858537840746, 'bear_atr_min_pct': 0.0016867544269140444, 'bear_atr_max_pct': 0.13038462218385105, 'bear_tp_mult': 2.356196761167136, 'bear_tsl_mult': 0.554327848184541, 'bear_time_stop': 67, 'bear_use_sma': False, 'bear_use_ema': False, 'bear_use_atr': True, 'bear_use_adx': False, 'bear_use_spike': True, 'bear_rsi_required': False, 'sideways_strategy': 'breakout', 'sideways_bb_std_mult': 3.321224270158157, 'sideways_rsi_os': 49, 'sideways_rsi_ob': 55, 'sideways_adx_thresh': 21.726332214232414, 'sideways_atr_min_pct': 0.005934367581052551, 'sideways_atr_max_pct': 0.07728587968392493, 'sideways_tp_mult': 1.3189724053496263, 'sideways_tsl_mult': 0.5485640080076887, 'sideways_time_stop': 271, 'sideways_use_sma': True, 'sideways_use_ema': False, 'sideways_use_atr': False, 'sideways_use_adx': False, 'sideways_use_spike': False, 'sideways_rsi_required': False}.
[I 2025-09-01 07:35:19,677] Trial 89 finished with values: [-1000000000.0, 1000000000.0] and parameters: {'p_sma': 45, 'p_std': 15, 'p_atr': 11, 'p_adx': 11, 'rsi_period': 39, 'ema1': 18, 'ema2': 16, 'slip_atr_k': 0.11153231615386, 'slip_spread_k': 0.6363558485559402, 'spread_hl_frac': 0.007890099288773366, 'bb_std_mult': 1.5898241728106512, 'rsi_os': 23, 'rsi_ob': 93, 'vol_spike': 0.09287693955144377, 'adx_thresh': 30.712217192478192, 'atr_min_pct': 0.006204389502689405, 'atr_max_pct': 0.038423079230518555, 'tp_mult': 1.7078464063498175, 'tsl_mult': 0.8714202622860752, 'strategy': 'breakout', 'time_stop': 133, 'use_sma': True, 'use_atr': False, 'use_adx': True, 'use_ema': False, 'use_spike': False, 'rsi_required': True, 'edge_k': 0.9708646446375299, 'edge_cap': 0.7681170082667873, 'bull_strategy': 'breakout', 'bull_bb_std_mult': 2.5764659506319942, 'bull_rsi_os': 29, 'bull_rsi_ob': 78, 'bull_adx_thresh': 30.575168459691294, 'bull_atr_min_pct': 0.019750714746856197, 'bull_atr_max_pct': 0.039752103611134126, 'bull_tp_mult': 2.48094214202688, 'bull_tsl_mult': 0.7631637103164237, 'bull_time_stop': 167, 'bull_use_sma': False, 'bull_use_ema': False, 'bull_use_atr': False, 'bull_use_adx': True, 'bull_use_spike': False, 'bull_rsi_required': True, 'bear_strategy': 'breakout', 'bear_bb_std_mult': 0.674124391727255, 'bear_rsi_os': 26, 'bear_rsi_ob': 65, 'bear_adx_thresh': 21.657949513357636, 'bear_atr_min_pct': 0.01989896149491307, 'bear_atr_max_pct': 0.049313904106200825, 'bear_tp_mult': 2.3160163348510885, 'bear_tsl_mult': 0.8817495164399218, 'bear_time_stop': 152, 'bear_use_sma': False, 'bear_use_ema': False, 'bear_use_atr': True, 'bear_use_adx': False, 'bear_use_spike': True, 'bear_rsi_required': True, 'sideways_strategy': 'breakout', 'sideways_bb_std_mult': 2.212498597298699, 'sideways_rsi_os': 37, 'sideways_rsi_ob': 71, 'sideways_adx_thresh': 18.84906887858903, 'sideways_atr_min_pct': 0.006150489567314595, 'sideways_atr_max_pct': 0.02171810252886673, 'sideways_tp_mult': 1.1225724685963312, 'sideways_tsl_mult': 0.5917771505897992, 'sideways_time_stop': 67, 'sideways_use_sma': True, 'sideways_use_ema': False, 'sideways_use_atr': False, 'sideways_use_adx': True, 'sideways_use_spike': True, 'sideways_rsi_required': False}.
[I 2025-09-01 07:35:19,682] Trial 87 finished with values: [-1000000000.0, 1000000000.0] and parameters: {'p_sma': 16, 'p_std': 46, 'p_atr': 11, 'p_adx': 10, 'rsi_period': 7, 'ema1': 13, 'ema2': 16, 'slip_atr_k': 0.23601973635722023, 'slip_spread_k': 0.1690010869757862, 'spread_hl_frac': 0.023850394778926007, 'bb_std_mult': 2.1905780391026064, 'rsi_os': 23, 'rsi_ob': 68, 'vol_spike': 0.2708421695408473, 'adx_thresh': 14.683789281677921, 'atr_min_pct': 0.011493335670772334, 'atr_max_pct': 0.03389507696420651, 'tp_mult': 2.1550616067177475, 'tsl_mult': 0.24253049300737695, 'strategy': 'breakout', 'time_stop': 126, 'use_sma': False, 'use_atr': False, 'use_adx': False, 'use_ema': False, 'use_spike': False, 'rsi_required': True, 'edge_k': 0.9485009706900085, 'edge_cap': 0.2729248043258044, 'bull_strategy': 'breakout', 'bull_bb_std_mult': 3.2338981226766594, 'bull_rsi_os': 30, 'bull_rsi_ob': 78, 'bull_adx_thresh': 23.022977990934535, 'bull_atr_min_pct': 0.019451133391876152, 'bull_atr_max_pct': 0.037915419984788146, 'bull_tp_mult': 2.0642746675367714, 'bull_tsl_mult': 0.3291210969871037, 'bull_time_stop': 169, 'bull_use_sma': False, 'bull_use_ema': False, 'bull_use_atr': False, 'bull_use_adx': False, 'bull_use_spike': True, 'bull_rsi_required': True, 'bear_strategy': 'breakout', 'bear_bb_std_mult': 2.8129374168031913, 'bear_rsi_os': 9, 'bear_rsi_ob': 57, 'bear_adx_thresh': 5.722756005388598, 'bear_atr_min_pct': 0.014842746936773277, 'bear_atr_max_pct': 0.0462690668384322, 'bear_tp_mult': 1.0491821408669093, 'bear_tsl_mult': 0.2997141202334793, 'bear_time_stop': 150, 'bear_use_sma': False, 'bear_use_ema': False, 'bear_use_atr': True, 'bear_use_adx': False, 'bear_use_spike': False, 'bear_rsi_required': True, 'sideways_strategy': 'breakout', 'sideways_bb_std_mult': 2.208895792221655, 'sideways_rsi_os': 38, 'sideways_rsi_ob': 55, 'sideways_adx_thresh': 18.278184894250494, 'sideways_atr_min_pct': 0.014618324363418785, 'sideways_atr_max_pct': 0.06547017853918294, 'sideways_tp_mult': 1.311603006108874, 'sideways_tsl_mult': 0.5389181633371384, 'sideways_time_stop': 68, 'sideways_use_sma': True, 'sideways_use_ema': False, 'sideways_use_atr': False, 'sideways_use_adx': True, 'sideways_use_spike': True, 'sideways_rsi_required': False}.
[I 2025-09-01 07:35:20,500] Trial 88 finished with values: [-1000000000.0, 1000000000.0] and parameters: {'p_sma': 46, 'p_std': 17, 'p_atr': 15, 'p_adx': 11, 'rsi_period': 29, 'ema1': 18, 'ema2': 16, 'slip_atr_k': 0.148902731681578, 'slip_spread_k': 0.5026638718400058, 'spread_hl_frac': 0.008037658399784138, 'bb_std_mult': 2.211820428388858, 'rsi_os': 10, 'rsi_ob': 69, 'vol_spike': 0.09262924946105641, 'adx_thresh': 33.54563161485974, 'atr_min_pct': 0.006151852027384164, 'atr_max_pct': 0.03537755476843003, 'tp_mult': 2.1443601454582932, 'tsl_mult': 0.8490284158518021, 'strategy': 'breakout', 'time_stop': 97, 'use_sma': False, 'use_atr': False, 'use_adx': False, 'use_ema': False, 'use_spike': False, 'rsi_required': True, 'edge_k': 0.9580499837620292, 'edge_cap': 0.3776483183851704, 'bull_strategy': 'breakout', 'bull_bb_std_mult': 0.5153136938876763, 'bull_rsi_os': 29, 'bull_rsi_ob': 92, 'bull_adx_thresh': 16.223591197410336, 'bull_atr_min_pct': 0.020762978666751846, 'bull_atr_max_pct': 0.05753370984567121, 'bull_tp_mult': 2.503885237898264, 'bull_tsl_mult': 0.10631811160890071, 'bull_time_stop': 168, 'bull_use_sma': False, 'bull_use_ema': False, 'bull_use_atr': False, 'bull_use_adx': False, 'bull_use_spike': False, 'bull_rsi_required': True, 'bear_strategy': 'breakout', 'bear_bb_std_mult': 2.8128613131550635, 'bear_rsi_os': 12, 'bear_rsi_ob': 65, 'bear_adx_thresh': 26.69842630148373, 'bear_atr_min_pct': 0.014164518387674022, 'bear_atr_max_pct': 0.04728230420622702, 'bear_tp_mult': 2.361994153925429, 'bear_tsl_mult': 0.5063216260256757, 'bear_time_stop': 45, 'bear_use_sma': False, 'bear_use_ema': False, 'bear_use_atr': True, 'bear_use_adx': False, 'bear_use_spike': False, 'bear_rsi_required': True, 'sideways_strategy': 'breakout', 'sideways_bb_std_mult': 3.343000203052144, 'sideways_rsi_os': 53, 'sideways_rsi_ob': 49, 'sideways_adx_thresh': 18.21751067168971, 'sideways_atr_min_pct': 0.0177937371566563, 'sideways_atr_max_pct': 0.07046377614550475, 'sideways_tp_mult': 1.329275661434218, 'sideways_tsl_mult': 0.5350167905901652, 'sideways_time_stop': 275, 'sideways_use_sma': True, 'sideways_use_ema': False, 'sideways_use_atr': False, 'sideways_use_adx': True, 'sideways_use_spike': True, 'sideways_rsi_required': False}.
