[I 2025-09-01 07:36:49,337] Trial 102 finished with values: [-1000000000.0, 1000000000.0] and parameters: {'p_sma': 41, 'p_std': 38, 'p_atr': 19, 'p_adx': 29, 'rsi_period': 60, 'ema1': 15, 'ema2': 18, 'slip_atr_k': 0.09415545944086338, 'slip_spread_k': 0.6221677903540154, 'spread_hl_frac': 0.04961537197069758, 'bb_std_mult': 0.7704694296011648, 'rsi_os': 55, 'rsi_ob': 74, 'vol_spike': 0.1998522998453214, 'adx_thresh': 27.82289183883042, 'atr_min_pct': 0.014032007830950419, 'atr_max_pct': 0.11232475978441415, 'tp_mult': 1.8194198853138284, 'tsl_mult': 0.4742565341202716, 'strategy': 'mean_reversion', 'time_stop': 231, 'use_sma': False, 'use_atr': False, 'use_adx': False, 'use_ema': False, 'use_spike': False, 'rsi_required': False, 'edge_k': 0.8179255574029425, 'edge_cap': 0.22902741685155498, 'bull_strategy': 'breakout', 'bull_bb_std_mult': 1.9428618198684409, 'bull_rsi_os': 31, 'bull_rsi_ob': 59, 'bull_adx_thresh': 25.2543384329679, 'bull_atr_min_pct': 0.012343884255923608, 'bull_atr_max_pct': 0.1255464196606236, 'bull_tp_mult': 1.9308658059079342, 'bull_tsl_mult': 0.0013037530182253973, 'bull_time_stop': 118, 'bull_use_sma': False, 'bull_use_ema': True, 'bull_use_atr': True, 'bull_use_adx': True, 'bull_use_spike': True, 'bull_rsi_required': True, 'bear_strategy': 'breakout', 'bear_bb_std_mult': 0.9752586555532274, 'bear_rsi_os': 46, 'bear_rsi_ob': 90, 'bear_adx_thresh': 13.888418684178433, 'bear_atr_min_pct': 0.02778346309283221, 'bear_atr_max_pct': 0.027834232932130415, 'bear_tp_mult': 2.920970021790701, 'bear_tsl_mult': 0.5612467097634196, 'bear_time_stop': 106, 'bear_use_sma': False, 'bear_use_ema': False, 'bear_use_atr': False, 'bear_use_adx': False, 'bear_use_spike': True, 'bear_rsi_required': False, 'sideways_strategy': 'mean_reversion', 'sideways_bb_std_mult': 2.543477420063224, 'sideways_rsi_os': 35, 'sideways_rsi_ob': 86, 'sideways_adx_thresh': 28.310082839933163, 'sideways_atr_min_pct': 0.0007563770448192394, 'sideways_atr_max_pct': 0.02629614407694595, 'sideways_tp_mult': 1.164650340121077, 'sideways_tsl_mult': 0.377236064068722, 'sideways_time_stop': 42, 'sideways_use_sma': False, 'sideways_use_ema': False, 'sideways_use_atr': True, 'sideways_use_adx': True, 'sideways_use_spike': True, 'sideways_rsi_required': True}.
[I 2025-09-01 07:37:38,708] Trial 99 finished with values: [-1000000000.0, 1000000000.0] and parameters: {'p_sma': 48, 'p_std': 31, 'p_atr': 14, 'p_adx': 27, 'rsi_period': 32, 'ema1': 5, 'ema2': 12, 'slip_atr_k': 0.12584799107461128, 'slip_spread_k': 0.4405236930349963, 'spread_hl_frac': 0.037802580074384265, 'bb_std_mult': 0.6600381074308169, 'rsi_os': 15, 'rsi_ob': 72, 'vol_spike': 0.02566190967806986, 'adx_thresh': 26.57967726127567, 'atr_min_pct': 0.02928734273448045, 'atr_max_pct': 0.0931187126288368, 'tp_mult': 1.8136550824832116, 'tsl_mult': 0.47804500676488443, 'strategy': 'mean_reversion', 'time_stop': 231, 'use_sma': True, 'use_atr': False, 'use_adx': False, 'use_ema': False, 'use_spike': False, 'rsi_required': False, 'edge_k': 1.6909391512635796, 'edge_cap': 0.08253663495599811, 'bull_strategy': 'breakout', 'bull_bb_std_mult': 3.5218869752524355, 'bull_rsi_os': 35, 'bull_rsi_ob': 64, 'bull_adx_thresh': 17.853491058818562, 'bull_atr_min_pct': 0.005869380312828111, 'bull_atr_max_pct': 0.04482988105977445, 'bull_tp_mult': 2.708663868614047, 'bull_tsl_mult': 0.022614641156813997, 'bull_time_stop': 155, 'bull_use_sma': True, 'bull_use_ema': True, 'bull_use_atr': True, 'bull_use_adx': True, 'bull_use_spike': True, 'bull_rsi_required': False, 'bear_strategy': 'breakout', 'bear_bb_std_mult': 1.0131675295607663, 'bear_rsi_os': 33, 'bear_rsi_ob': 53, 'bear_adx_thresh': 24.218347835010146, 'bear_atr_min_pct': 0.028984850328876318, 'bear_atr_max_pct': 0.0801317727154587, 'bear_tp_mult': 1.1716083625327636, 'bear_tsl_mult': 0.4504076621410878, 'bear_time_stop': 120, 'bear_use_sma': True, 'bear_use_ema': False, 'bear_use_atr': False, 'bear_use_adx': False, 'bear_use_spike': True, 'bear_rsi_required': False, 'sideways_strategy': 'mean_reversion', 'sideways_bb_std_mult': 2.3522076899584605, 'sideways_rsi_os': 35, 'sideways_rsi_ob': 76, 'sideways_adx_thresh': 28.550634391918496, 'sideways_atr_min_pct': 0.02054135272556385, 'sideways_atr_max_pct': 0.02617694640134375, 'sideways_tp_mult': 1.2369794556739724, 'sideways_tsl_mult': 0.9074471559054303, 'sideways_time_stop': 115, 'sideways_use_sma': False, 'sideways_use_ema': False, 'sideways_use_atr': True, 'sideways_use_adx': False, 'sideways_use_spike': False, 'sideways_rsi_required': True}.
[I 2025-09-01 07:37:39,400] Trial 103 finished with values: [-1000000000.0, 1000000000.0] and parameters: {'p_sma': 24, 'p_std': 43, 'p_atr': 13, 'p_adx': 12, 'rsi_period': 82, 'ema1': 19, 'ema2': 39, 'slip_atr_k': 0.21679054620103932, 'slip_spread_k': 0.5566972713293806, 'spread_hl_frac': 0.024844055570266407, 'bb_std_mult': 0.8033642652590902, 'rsi_os': 9, 'rsi_ob': 72, 'vol_spike': 0.022155782843691574, 'adx_thresh': 16.972726853791205, 'atr_min_pct': 0.028079180832210386, 'atr_max_pct': 0.12054880939704204, 'tp_mult': 1.9001460496137164, 'tsl_mult': 0.08492524247371305, 'strategy': 'breakout', 'time_stop': 161, 'use_sma': False, 'use_atr': False, 'use_adx': False, 'use_ema': False, 'use_spike': False, 'rsi_required': False, 'edge_k': 0.8974563915109405, 'edge_cap': 0.6534930277347948, 'bull_strategy': 'breakout', 'bull_bb_std_mult': 0.9400616471263532, 'bull_rsi_os': 34, 'bull_rsi_ob': 56, 'bull_adx_thresh': 27.363799681833544, 'bull_atr_min_pct': 0.005791466559201926, 'bull_atr_max_pct': 0.14975893525152778, 'bull_tp_mult': 1.4836258115984977, 'bull_tsl_mult': 0.055917329251952676, 'bull_time_stop': 49, 'bull_use_sma': False, 'bull_use_ema': True, 'bull_use_atr': False, 'bull_use_adx': False, 'bull_use_spike': False, 'bull_rsi_required': True, 'bear_strategy': 'breakout', 'bear_bb_std_mult': 2.2040701146034567, 'bear_rsi_os': 34, 'bear_rsi_ob': 50, 'bear_adx_thresh': 12.232402758275875, 'bear_atr_min_pct': 0.02663375234297124, 'bear_atr_max_pct': 0.034879672468619116, 'bear_tp_mult': 1.0175008659215052, 'bear_tsl_mult': 0.4826606900752219, 'bear_time_stop': 121, 'bear_use_sma': False, 'bear_use_ema': False, 'bear_use_atr': False, 'bear_use_adx': False, 'bear_use_spike': False, 'bear_rsi_required': True, 'sideways_strategy': 'mean_reversion', 'sideways_bb_std_mult': 1.3432999602713456, 'sideways_rsi_os': 36, 'sideways_rsi_ob': 82, 'sideways_adx_thresh': 27.043270536759913, 'sideways_atr_min_pct': 0.026542284887165986, 'sideways_atr_max_pct': 0.01732939502479422, 'sideways_tp_mult': 1.2218036282877929, 'sideways_tsl_mult': 0.9271903702030808, 'sideways_time_stop': 59, 'sideways_use_sma': False, 'sideways_use_ema': False, 'sideways_use_atr': True, 'sideways_use_adx': False, 'sideways_use_spike': True, 'sideways_rsi_required': True}.
[I 2025-09-01 07:37:39,731] Trial 100 finished with values: [-1000000000.0, 1000000000.0] and parameters: {'p_sma': 60, 'p_std': 38, 'p_atr': 19, 'p_adx': 27, 'rsi_period': 83, 'ema1': 15, 'ema2': 46, 'slip_atr_k': 0.21859541752921935, 'slip_spread_k': 0.5584878709180776, 'spread_hl_frac': 0.021218490894406646, 'bb_std_mult': 0.8022219564300856, 'rsi_os': 9, 'rsi_ob': 75, 'vol_spike': 0.19992547372042035, 'adx_thresh': 27.754028230921307, 'atr_min_pct': 0.027907209858762935, 'atr_max_pct': 0.12027535357141272, 'tp_mult': 1.6276383727678339, 'tsl_mult': 0.2740177736844201, 'strategy': 'breakout', 'time_stop': 233, 'use_sma': False, 'use_atr': False, 'use_adx': False, 'use_ema': False, 'use_spike': False, 'rsi_required': False, 'edge_k': 1.9192965302384688, 'edge_cap': 0.6644673886021049, 'bull_strategy': 'breakout', 'bull_bb_std_mult': 0.6200369811787783, 'bull_rsi_os': 31, 'bull_rsi_ob': 65, 'bull_adx_thresh': 20.488649599007424, 'bull_atr_min_pct': 0.008470481961447448, 'bull_atr_max_pct': 0.03297876168050405, 'bull_tp_mult': 2.362045262069296, 'bull_tsl_mult': 0.062454687156928014, 'bull_time_stop': 188, 'bull_use_sma': False, 'bull_use_ema': True, 'bull_use_atr': False, 'bull_use_adx': False, 'bull_use_spike': True, 'bull_rsi_required': True, 'bear_strategy': 'breakout', 'bear_bb_std_mult': 1.0254647818644285, 'bear_rsi_os': 33, 'bear_rsi_ob': 68, 'bear_adx_thresh': 15.424556416668606, 'bear_atr_min_pct': 0.0277732948360584, 'bear_atr_max_pct': 0.026869577559837148, 'bear_tp_mult': 2.9085953008919763, 'bear_tsl_mult': 0.930627459905579, 'bear_time_stop': 123, 'bear_use_sma': False, 'bear_use_ema': False, 'bear_use_atr': False, 'bear_use_adx': False, 'bear_use_spike': False, 'bear_rsi_required': False, 'sideways_strategy': 'mean_reversion', 'sideways_bb_std_mult': 3.465028479724995, 'sideways_rsi_os': 36, 'sideways_rsi_ob': 59, 'sideways_adx_thresh': 14.376525718374857, 'sideways_atr_min_pct': 0.020426068694173186, 'sideways_atr_max_pct': 0.01789596831229362, 'sideways_tp_mult': 1.224049999638486, 'sideways_tsl_mult': 0.762297723222986, 'sideways_time_stop': 118, 'sideways_use_sma': False, 'sideways_use_ema': False, 'sideways_use_atr': True, 'sideways_use_adx': False, 'sideways_use_spike': True, 'sideways_rsi_required': True}.
[I 2025-09-01 07:37:40,010] Trial 101 finished with values: [-1000000000.0, 1000000000.0] and parameters: {'p_sma': 41, 'p_std': 38, 'p_atr': 19, 'p_adx': 12, 'rsi_period': 83, 'ema1': 15, 'ema2': 38, 'slip_atr_k': 0.0955021420995214, 'slip_spread_k': 0.5454832694567368, 'spread_hl_frac': 0.01072381084295768, 'bb_std_mult': 0.8035318704616187, 'rsi_os': 9, 'rsi_ob': 72, 'vol_spike': 0.18901914399619976, 'adx_thresh': 26.529033716839542, 'atr_min_pct': 0.014160258772668459, 'atr_max_pct': 0.09348668318611977, 'tp_mult': 1.8014009511484725, 'tsl_mult': 0.08733439570234913, 'strategy': 'breakout', 'time_stop': 165, 'use_sma': False, 'use_atr': False, 'use_adx': False, 'use_ema': False, 'use_spike': False, 'rsi_required': False, 'edge_k': 0.4730174960930282, 'edge_cap': 0.21118931175988992, 'bull_strategy': 'breakout', 'bull_bb_std_mult': 3.5522949109826447, 'bull_rsi_os': 31, 'bull_rsi_ob': 64, 'bull_adx_thresh': 25.2014249380554, 'bull_atr_min_pct': 0.025833746846392606, 'bull_atr_max_pct': 0.10408489324838369, 'bull_tp_mult': 1.4978766564634316, 'bull_tsl_mult': 0.056072462014242666, 'bull_time_stop': 50, 'bull_use_sma': False, 'bull_use_ema': True, 'bull_use_atr': False, 'bull_use_adx': False, 'bull_use_spike': True, 'bull_rsi_required': True, 'bear_strategy': 'breakout', 'bear_bb_std_mult': 1.0095430368883749, 'bear_rsi_os': 33, 'bear_rsi_ob': 70, 'bear_adx_thresh': 12.42680865663658, 'bear_atr_min_pct': 0.028132117507825266, 'bear_atr_max_pct': 0.025703605569972317, 'bear_tp_mult': 2.920788168369302, 'bear_tsl_mult': 0.4738554212956238, 'bear_time_stop': 120, 'bear_use_sma': False, 'bear_use_ema': False, 'bear_use_atr': False, 'bear_use_adx': False, 'bear_use_spike': False, 'bear_rsi_required': False, 'sideways_strategy': 'mean_reversion', 'sideways_bb_std_mult': 2.8432136986661467, 'sideways_rsi_os': 36, 'sideways_rsi_ob': 91, 'sideways_adx_thresh': 27.225116135874472, 'sideways_atr_min_pct': 0.020393586430681197, 'sideways_atr_max_pct': 0.02714170884456231, 'sideways_tp_mult': 1.2147133543811042, 'sideways_tsl_mult': 0.7669786586093804, 'sideways_time_stop': 235, 'sideways_use_sma': False, 'sideways_use_ema': False, 'sideways_use_atr': True, 'sideways_use_adx': False, 'sideways_use_spike': True, 'sideways_rsi_required': True}.
[I 2025-09-01 07:38:27,469] Trial 107 finished with values: [-1000000000.0, 1000000000.0] and parameters: {'p_sma': 51, 'p_std': 27, 'p_atr': 28, 'p_adx': 22, 'rsi_period': 33, 'ema1': 26, 'ema2': 11, 'slip_atr_k': 0.1420545563364608, 'slip_spread_k': 0.00041612622013648126, 'spread_hl_frac': 0.018773646980962892, 'bb_std_mult': 3.4070959130055867, 'rsi_os': 6, 'rsi_ob': 78, 'vol_spike': 0.23349797052587273, 'adx_thresh': 20.436037464985397, 'atr_min_pct': 0.028534050567735184, 'atr_max_pct': 0.10990521981343469, 'tp_mult': 2.296275306046206, 'tsl_mult': 0.02446197307996112, 'strategy': 'mean_reversion', 'time_stop': 138, 'use_sma': False, 'use_atr': False, 'use_adx': False, 'use_ema': False, 'use_spike': False, 'rsi_required': True, 'edge_k': 1.5422376254594536, 'edge_cap': 0.5677691280169349, 'bull_strategy': 'breakout', 'bull_bb_std_mult': 2.245147015022128, 'bull_rsi_os': 39, 'bull_rsi_ob': 51, 'bull_adx_thresh': 6.0771597361315735, 'bull_atr_min_pct': 0.013333244815342513, 'bull_atr_max_pct': 0.08417050216211035, 'bull_tp_mult': 2.878324336622146, 'bull_tsl_mult': 0.08574985921772281, 'bull_time_stop': 142, 'bull_use_sma': False, 'bull_use_ema': False, 'bull_use_atr': True, 'bull_use_adx': True, 'bull_use_spike': False, 'bull_rsi_required': True, 'bear_strategy': 'breakout', 'bear_bb_std_mult': 1.3658361816763167, 'bear_rsi_os': 37, 'bear_rsi_ob': 81, 'bear_adx_thresh': 16.78892678946471, 'bear_atr_min_pct': 0.02930179442584778, 'bear_atr_max_pct': 0.08989650474350576, 'bear_tp_mult': 2.8261374536553965, 'bear_tsl_mult': 0.5225394929486046, 'bear_time_stop': 143, 'bear_use_sma': False, 'bear_use_ema': False, 'bear_use_atr': True, 'bear_use_adx': False, 'bear_use_spike': True, 'bear_rsi_required': False, 'sideways_strategy': 'breakout', 'sideways_bb_std_mult': 0.9015055122015272, 'sideways_rsi_os': 42, 'sideways_rsi_ob': 47, 'sideways_adx_thresh': 6.2790456481959325, 'sideways_atr_min_pct': 0.02143214306648256, 'sideways_atr_max_pct': 0.013294349807475375, 'sideways_tp_mult': 2.943064082865239, 'sideways_tsl_mult': 0.619569684827015, 'sideways_time_stop': 156, 'sideways_use_sma': True, 'sideways_use_ema': False, 'sideways_use_atr': True, 'sideways_use_adx': True, 'sideways_use_spike': True, 'sideways_rsi_required': False}.
[I 2025-09-01 07:38:27,671] Trial 105 finished with values: [-0.01606552894741986, 0.016636965540470575] and parameters: {'p_sma': 43, 'p_std': 32, 'p_atr': 29, 'p_adx': 23, 'rsi_period': 34, 'ema1': 26, 'ema2': 11, 'slip_atr_k': 0.14154891589563118, 'slip_spread_k': 0.5263773574000836, 'spread_hl_frac': 0.010702078080507264, 'bb_std_mult': 2.8690710453409056, 'rsi_os': 9, 'rsi_ob': 77, 'vol_spike': 0.2831387638305753, 'adx_thresh': 20.390251746578038, 'atr_min_pct': 0.027402570132451756, 'atr_max_pct': 0.05298103289295544, 'tp_mult': 1.6355446473485986, 'tsl_mult': 0.974104281310098, 'strategy': 'breakout', 'time_stop': 263, 'use_sma': False, 'use_atr': False, 'use_adx': False, 'use_ema': False, 'use_spike': False, 'rsi_required': False, 'edge_k': 1.5347333822466194, 'edge_cap': 0.8504875051037261, 'bull_strategy': 'breakout', 'bull_bb_std_mult': 3.031354956132325, 'bull_rsi_os': 32, 'bull_rsi_ob': 75, 'bull_adx_thresh': 20.44393043884401, 'bull_atr_min_pct': 0.002791234022834584, 'bull_atr_max_pct': 0.10142965202092102, 'bull_tp_mult': 2.8437899743941824, 'bull_tsl_mult': 0.058634038754893966, 'bull_time_stop': 216, 'bull_use_sma': False, 'bull_use_ema': True, 'bull_use_atr': False, 'bull_use_adx': False, 'bull_use_spike': False, 'bull_rsi_required': True, 'bear_strategy': 'breakout', 'bear_bb_std_mult': 2.0825812645575725, 'bear_rsi_os': 37, 'bear_rsi_ob': 56, 'bear_adx_thresh': 27.444509952015004, 'bear_atr_min_pct': 0.028465999052661305, 'bear_atr_max_pct': 0.02455510173713716, 'bear_tp_mult': 1.0998839318149078, 'bear_tsl_mult': 0.9219021191595174, 'bear_time_stop': 13, 'bear_use_sma': False, 'bear_use_ema': False, 'bear_use_atr': False, 'bear_use_adx': False, 'bear_use_spike': False, 'bear_rsi_required': False, 'sideways_strategy': 'breakout', 'sideways_bb_std_mult': 2.859464988514482, 'sideways_rsi_os': 43, 'sideways_rsi_ob': 59, 'sideways_adx_thresh': 27.57486839692479, 'sideways_atr_min_pct': 0.008867081587540727, 'sideways_atr_max_pct': 0.03636157451128482, 'sideways_tp_mult': 1.613380182432046, 'sideways_tsl_mult': 0.7680921104861639, 'sideways_time_stop': 101, 'sideways_use_sma': False, 'sideways_use_ema': False, 'sideways_use_atr': True, 'sideways_use_adx': False, 'sideways_use_spike': True, 'sideways_rsi_required': True}.
[I 2025-09-01 07:38:27,916] Trial 104 finished with values: [-0.020329861415282036, 0.02023755703149218] and parameters: {'p_sma': 47, 'p_std': 27, 'p_atr': 19, 'p_adx': 23, 'rsi_period': 33, 'ema1': 26, 'ema2': 47, 'slip_atr_k': 0.13517050854597498, 'slip_spread_k': 0.5570362434495131, 'spread_hl_frac': 0.011273218946790058, 'bb_std_mult': 3.398032262996595, 'rsi_os': 9, 'rsi_ob': 77, 'vol_spike': 0.18952820792904404, 'adx_thresh': 20.139235150608013, 'atr_min_pct': 0.028198018720081233, 'atr_max_pct': 0.12036790969895265, 'tp_mult': 1.6240661482088652, 'tsl_mult': 0.026731621775395398, 'strategy': 'breakout', 'time_stop': 157, 'use_sma': False, 'use_atr': False, 'use_adx': False, 'use_ema': False, 'use_spike': False, 'rsi_required': False, 'edge_k': 1.892703719698726, 'edge_cap': 0.6720379558734209, 'bull_strategy': 'breakout', 'bull_bb_std_mult': 3.0474858276596204, 'bull_rsi_os': 31, 'bull_rsi_ob': 75, 'bull_adx_thresh': 20.375331688979593, 'bull_atr_min_pct': 0.002916832993493904, 'bull_atr_max_pct': 0.01576088051193518, 'bull_tp_mult': 2.366386365672561, 'bull_tsl_mult': 0.06352498025845046, 'bull_time_stop': 280, 'bull_use_sma': False, 'bull_use_ema': True, 'bull_use_atr': False, 'bull_use_adx': False, 'bull_use_spike': False, 'bull_rsi_required': True, 'bear_strategy': 'breakout', 'bear_bb_std_mult': 2.09307471106631, 'bear_rsi_os': 33, 'bear_rsi_ob': 68, 'bear_adx_thresh': 12.407975879571152, 'bear_atr_min_pct': 0.028409746406473278, 'bear_atr_max_pct': 0.0246766778474568, 'bear_tp_mult': 1.0238608895962786, 'bear_tsl_mult': 0.4750633369123508, 'bear_time_stop': 264, 'bear_use_sma': False, 'bear_use_ema': False, 'bear_use_atr': False, 'bear_use_adx': False, 'bear_use_spike': False, 'bear_rsi_required': False, 'sideways_strategy': 'mean_reversion', 'sideways_bb_std_mult': 2.857069464408551, 'sideways_rsi_os': 43, 'sideways_rsi_ob': 59, 'sideways_adx_thresh': 6.3959690290893985, 'sideways_atr_min_pct': 0.021622573728172556, 'sideways_atr_max_pct': 0.01624341537575063, 'sideways_tp_mult': 2.787408904951538, 'sideways_tsl_mult': 0.7954047385296636, 'sideways_time_stop': 58, 'sideways_use_sma': False, 'sideways_use_ema': False, 'sideways_use_atr': True, 'sideways_use_adx': False, 'sideways_use_spike': True, 'sideways_rsi_required': True}.
[I 2025-09-01 07:38:28,095] Trial 106 finished with values: [-1000000000.0, 1000000000.0] and parameters: {'p_sma': 47, 'p_std': 40, 'p_atr': 29, 'p_adx': 20, 'rsi_period': 33, 'ema1': 12, 'ema2': 11, 'slip_atr_k': 0.14338697227514624, 'slip_spread_k': 0.5272129039664981, 'spread_hl_frac': 0.019441772712812503, 'bb_std_mult': 0.5594254545374371, 'rsi_os': 6, 'rsi_ob': 77, 'vol_spike': 0.2339945380699998, 'adx_thresh': 20.345365123539196, 'atr_min_pct': 0.01484000512308836, 'atr_max_pct': 0.04695611753974027, 'tp_mult': 1.683005147764928, 'tsl_mult': 0.9722691236522074, 'strategy': 'breakout', 'time_stop': 140, 'use_sma': False, 'use_atr': False, 'use_adx': False, 'use_ema': False, 'use_spike': False, 'rsi_required': False, 'edge_k': 1.7822761303121908, 'edge_cap': 0.4628401464021047, 'bull_strategy': 'breakout', 'bull_bb_std_mult': 2.27336052950714, 'bull_rsi_os': 27, 'bull_rsi_ob': 75, 'bull_adx_thresh': 21.00919206928601, 'bull_atr_min_pct': 0.028107179295153217, 'bull_atr_max_pct': 0.026708199588767287, 'bull_tp_mult': 1.3066040894891793, 'bull_tsl_mult': 0.6549271944668227, 'bull_time_stop': 60, 'bull_use_sma': False, 'bull_use_ema': True, 'bull_use_atr': False, 'bull_use_adx': True, 'bull_use_spike': False, 'bull_rsi_required': True, 'bear_strategy': 'breakout', 'bear_bb_std_mult': 2.0908874835083413, 'bear_rsi_os': 37, 'bear_rsi_ob': 57, 'bear_adx_thresh': 28.34142988492416, 'bear_atr_min_pct': 0.028479983714257327, 'bear_atr_max_pct': 0.09293365620787868, 'bear_tp_mult': 1.0849529180830504, 'bear_tsl_mult': 0.3986475454649958, 'bear_time_stop': 16, 'bear_use_sma': False, 'bear_use_ema': False, 'bear_use_atr': True, 'bear_use_adx': False, 'bear_use_spike': True, 'bear_rsi_required': False, 'sideways_strategy': 'breakout', 'sideways_bb_std_mult': 0.8717722984555947, 'sideways_rsi_os': 42, 'sideways_rsi_ob': 90, 'sideways_adx_thresh': 6.026776759572822, 'sideways_atr_min_pct': 0.013835418327655724, 'sideways_atr_max_pct': 0.033005997807138775, 'sideways_tp_mult': 1.6213245246967145, 'sideways_tsl_mult': 0.22352460010191993, 'sideways_time_stop': 98, 'sideways_use_sma': False, 'sideways_use_ema': False, 'sideways_use_atr': True, 'sideways_use_adx': False, 'sideways_use_spike': True, 'sideways_rsi_required': False}.
