[I 2025-09-01 08:06:41,073] Trial 267 finished with values: [-0.05026611669616321, 0.05026035071521972] and parameters: {'p_sma': 34, 'p_std': 36, 'p_atr': 11, 'p_adx': 30, 'rsi_period': 60, 'ema1': 14, 'ema2': 36, 'slip_atr_k': 0.05648624956714042, 'slip_spread_k': 0.9564070952193915, 'spread_hl_frac': 0.016379350698241424, 'bb_std_mult': 3.386447734353882, 'rsi_os': 31, 'rsi_ob': 60, 'vol_spike': 0.1656458718063451, 'adx_thresh': 27.275383336191933, 'atr_min_pct': 0.005331242032346698, 'atr_max_pct': 0.12558383870790993, 'tp_mult': 1.904157851717407, 'tsl_mult': 0.08901358381182445, 'strategy': 'breakout', 'time_stop': 253, 'use_sma': False, 'use_atr': False, 'use_adx': True, 'use_ema': True, 'use_spike': True, 'rsi_required': True, 'edge_k': 0.3082589730644827, 'edge_cap': 0.2007171390054772, 'bull_strategy': 'breakout', 'bull_bb_std_mult': 2.6804394882417832, 'bull_rsi_os': 50, 'bull_rsi_ob': 46, 'bull_adx_thresh': 7.980005592263557, 'bull_atr_min_pct': 0.003964981682607766, 'bull_atr_max_pct': 0.1340614397159471, 'bull_tp_mult': 1.4374074615884287, 'bull_tsl_mult': 0.7514240673727715, 'bull_time_stop': 82, 'bull_use_sma': True, 'bull_use_ema': False, 'bull_use_atr': False, 'bull_use_adx': False, 'bull_use_spike': False, 'bull_rsi_required': False, 'bear_strategy': 'mean_reversion', 'bear_bb_std_mult': 2.0175362307421016, 'bear_rsi_os': 45, 'bear_rsi_ob': 81, 'bear_adx_thresh': 5.851305588636338, 'bear_atr_min_pct': 0.0028973812204271575, 'bear_atr_max_pct': 0.09613247526579433, 'bear_tp_mult': 2.1571754889188943, 'bear_tsl_mult': 0.14110703600160585, 'bear_time_stop': 284, 'bear_use_sma': True, 'bear_use_ema': False, 'bear_use_atr': False, 'bear_use_adx': False, 'bear_use_spike': False, 'bear_rsi_required': False, 'sideways_strategy': 'breakout', 'sideways_bb_std_mult': 3.199098612676922, 'sideways_rsi_os': 7, 'sideways_rsi_ob': 80, 'sideways_adx_thresh': 10.826626328197504, 'sideways_atr_min_pct': 0.023670348709801246, 'sideways_atr_max_pct': 0.01235811647642834, 'sideways_tp_mult': 2.454524093436284, 'sideways_tsl_mult': 0.2079686015509431, 'sideways_time_stop': 215, 'sideways_use_sma': True, 'sideways_use_ema': True, 'sideways_use_atr': False, 'sideways_use_adx': True, 'sideways_use_spike': False, 'sideways_rsi_required': False}.
[I 2025-09-01 08:06:41,452] Trial 271 finished with values: [-1000000000.0, 1000000000.0] and parameters: {'p_sma': 29, 'p_std': 19, 'p_atr': 18, 'p_adx': 21, 'rsi_period': 49, 'ema1': 14, 'ema2': 37, 'slip_atr_k': 0.20020410147061446, 'slip_spread_k': 0.84323955453975, 'spread_hl_frac': 0.016019526075550697, 'bb_std_mult': 3.3908778420462165, 'rsi_os': 28, 'rsi_ob': 59, 'vol_spike': 0.04522943833106654, 'adx_thresh': 30.28093006287064, 'atr_min_pct': 0.0032785297819801075, 'atr_max_pct': 0.074828428820471, 'tp_mult': 2.6052844254702228, 'tsl_mult': 0.06033734116756076, 'strategy': 'breakout', 'time_stop': 253, 'use_sma': False, 'use_atr': True, 'use_adx': True, 'use_ema': True, 'use_spike': True, 'rsi_required': True, 'edge_k': 0.31791519037689586, 'edge_cap': 0.20670714961701203, 'bull_strategy': 'mean_reversion', 'bull_bb_std_mult': 0.5208862421802698, 'bull_rsi_os': 39, 'bull_rsi_ob': 47, 'bull_adx_thresh': 6.5684877245504, 'bull_atr_min_pct': 0.004059117215258402, 'bull_atr_max_pct': 0.0911080164690315, 'bull_tp_mult': 1.4220137342552572, 'bull_tsl_mult': 0.2075834217638205, 'bull_time_stop': 70, 'bull_use_sma': True, 'bull_use_ema': False, 'bull_use_atr': False, 'bull_use_adx': False, 'bull_use_spike': False, 'bull_rsi_required': False, 'bear_strategy': 'mean_reversion', 'bear_bb_std_mult': 2.1739117479533836, 'bear_rsi_os': 46, 'bear_rsi_ob': 71, 'bear_adx_thresh': 8.619553664926482, 'bear_atr_min_pct': 0.0029904330397529776, 'bear_atr_max_pct': 0.10280215283862969, 'bear_tp_mult': 2.094970303310953, 'bear_tsl_mult': 0.7276411234780709, 'bear_time_stop': 248, 'bear_use_sma': True, 'bear_use_ema': True, 'bear_use_atr': False, 'bear_use_adx': False, 'bear_use_spike': False, 'bear_rsi_required': False, 'sideways_strategy': 'breakout', 'sideways_bb_std_mult': 1.0594811912115993, 'sideways_rsi_os': 32, 'sideways_rsi_ob': 80, 'sideways_adx_thresh': 12.078156815540448, 'sideways_atr_min_pct': 0.028053685160634903, 'sideways_atr_max_pct': 0.010021267467053658, 'sideways_tp_mult': 1.376747764269879, 'sideways_tsl_mult': 0.688933271136575, 'sideways_time_stop': 41, 'sideways_use_sma': True, 'sideways_use_ema': True, 'sideways_use_atr': True, 'sideways_use_adx': True, 'sideways_use_spike': False, 'sideways_rsi_required': False}.
[I 2025-09-01 08:07:38,745] Trial 272 finished with values: [-1000000000.0, 1000000000.0] and parameters: {'p_sma': 29, 'p_std': 58, 'p_atr': 28, 'p_adx': 22, 'rsi_period': 49, 'ema1': 26, 'ema2': 22, 'slip_atr_k': 0.006348010083790859, 'slip_spread_k': 0.9656205330473118, 'spread_hl_frac': 0.013893303973033202, 'bb_std_mult': 1.6341245769349153, 'rsi_os': 31, 'rsi_ob': 93, 'vol_spike': 0.04496988510656687, 'adx_thresh': 28.05318186125305, 'atr_min_pct': 0.005059414189840289, 'atr_max_pct': 0.07851421279131254, 'tp_mult': 2.8989553227923315, 'tsl_mult': 0.05870562130053168, 'strategy': 'breakout', 'time_stop': 220, 'use_sma': False, 'use_atr': True, 'use_adx': True, 'use_ema': True, 'use_spike': True, 'rsi_required': True, 'edge_k': 0.25833634665699545, 'edge_cap': 0.62625429275402, 'bull_strategy': 'mean_reversion', 'bull_bb_std_mult': 2.5868279889457844, 'bull_rsi_os': 45, 'bull_rsi_ob': 46, 'bull_adx_thresh': 29.48516341478122, 'bull_atr_min_pct': 0.0041139468032394605, 'bull_atr_max_pct': 0.13634226059521515, 'bull_tp_mult': 2.863457702018179, 'bull_tsl_mult': 0.6119908035620367, 'bull_time_stop': 65, 'bull_use_sma': True, 'bull_use_ema': True, 'bull_use_atr': False, 'bull_use_adx': False, 'bull_use_spike': False, 'bull_rsi_required': False, 'bear_strategy': 'mean_reversion', 'bear_bb_std_mult': 1.9276684129715234, 'bear_rsi_os': 47, 'bear_rsi_ob': 79, 'bear_adx_thresh': 6.235920909667705, 'bear_atr_min_pct': 0.004653115480551271, 'bear_atr_max_pct': 0.12332159925514365, 'bear_tp_mult': 2.1824878935783967, 'bear_tsl_mult': 0.1313910502405529, 'bear_time_stop': 290, 'bear_use_sma': True, 'bear_use_ema': True, 'bear_use_atr': False, 'bear_use_adx': False, 'bear_use_spike': False, 'bear_rsi_required': False, 'sideways_strategy': 'breakout', 'sideways_bb_std_mult': 0.6886816436859057, 'sideways_rsi_os': 7, 'sideways_rsi_ob': 82, 'sideways_adx_thresh': 10.828572714986018, 'sideways_atr_min_pct': 0.02801209501181922, 'sideways_atr_max_pct': 0.14645863678057697, 'sideways_tp_mult': 1.3809495922556745, 'sideways_tsl_mult': 0.21736458478519818, 'sideways_time_stop': 38, 'sideways_use_sma': True, 'sideways_use_ema': True, 'sideways_use_atr': True, 'sideways_use_adx': True, 'sideways_use_spike': False, 'sideways_rsi_required': False}.
[I 2025-09-01 08:07:39,340] Trial 273 finished with values: [-1000000000.0, 1000000000.0] and parameters: {'p_sma': 29, 'p_std': 18, 'p_atr': 18, 'p_adx': 8, 'rsi_period': 48, 'ema1': 23, 'ema2': 57, 'slip_atr_k': 0.005358679944705326, 'slip_spread_k': 0.8492197293649616, 'spread_hl_frac': 0.011250347246700512, 'bb_std_mult': 1.6561263575111032, 'rsi_os': 24, 'rsi_ob': 93, 'vol_spike': 0.16473655380946323, 'adx_thresh': 28.015746587091957, 'atr_min_pct': 0.004135722355614909, 'atr_max_pct': 0.05298125407293268, 'tp_mult': 1.6555007340822108, 'tsl_mult': 0.03588919281340378, 'strategy': 'breakout', 'time_stop': 222, 'use_sma': False, 'use_atr': True, 'use_adx': True, 'use_ema': True, 'use_spike': True, 'rsi_required': True, 'edge_k': 0.3446539169104452, 'edge_cap': 0.41688672263974214, 'bull_strategy': 'mean_reversion', 'bull_bb_std_mult': 3.066390428734009, 'bull_rsi_os': 44, 'bull_rsi_ob': 69, 'bull_adx_thresh': 6.5961407558719145, 'bull_atr_min_pct': 0.027981335594480822, 'bull_atr_max_pct': 0.07147619646161987, 'bull_tp_mult': 2.8508752895004745, 'bull_tsl_mult': 0.6131255550782757, 'bull_time_stop': 66, 'bull_use_sma': True, 'bull_use_ema': True, 'bull_use_atr': False, 'bull_use_adx': False, 'bull_use_spike': False, 'bull_rsi_required': False, 'bear_strategy': 'mean_reversion', 'bear_bb_std_mult': 1.9242436455497294, 'bear_rsi_os': 15, 'bear_rsi_ob': 79, 'bear_adx_thresh': 6.212917135632479, 'bear_atr_min_pct': 0.0041345187131453754, 'bear_atr_max_pct': 0.07704264785772517, 'bear_tp_mult': 2.182750339707205, 'bear_tsl_mult': 0.13096047526841018, 'bear_time_stop': 280, 'bear_use_sma': True, 'bear_use_ema': True, 'bear_use_atr': False, 'bear_use_adx': True, 'bear_use_spike': False, 'bear_rsi_required': False, 'sideways_strategy': 'breakout', 'sideways_bb_std_mult': 1.3107095682708776, 'sideways_rsi_os': 7, 'sideways_rsi_ob': 94, 'sideways_adx_thresh': 10.907552125194817, 'sideways_atr_min_pct': 0.028307272973929456, 'sideways_atr_max_pct': 0.015802956247529542, 'sideways_tp_mult': 1.3889204468365066, 'sideways_tsl_mult': 0.8767783255019024, 'sideways_time_stop': 38, 'sideways_use_sma': True, 'sideways_use_ema': True, 'sideways_use_atr': True, 'sideways_use_adx': True, 'sideways_use_spike': False, 'sideways_rsi_required': False}.
[I 2025-09-01 08:07:39,713] Trial 274 finished with values: [-1000000000.0, 1000000000.0] and parameters: {'p_sma': 29, 'p_std': 18, 'p_atr': 18, 'p_adx': 8, 'rsi_period': 49, 'ema1': 13, 'ema2': 57, 'slip_atr_k': 0.004213626567817683, 'slip_spread_k': 0.8955052565445897, 'spread_hl_frac': 0.0139956192844963, 'bb_std_mult': 1.312162098798045, 'rsi_os': 31, 'rsi_ob': 67, 'vol_spike': 0.07037246485605375, 'adx_thresh': 15.163197344635034, 'atr_min_pct': 0.004148750515847628, 'atr_max_pct': 0.012089216137283185, 'tp_mult': 1.0927673669992386, 'tsl_mult': 0.026911646229223145, 'strategy': 'breakout', 'time_stop': 222, 'use_sma': False, 'use_atr': True, 'use_adx': True, 'use_ema': True, 'use_spike': True, 'rsi_required': True, 'edge_k': 0.2616282853499501, 'edge_cap': 0.49276703795331206, 'bull_strategy': 'mean_reversion', 'bull_bb_std_mult': 1.3791184367888611, 'bull_rsi_os': 39, 'bull_rsi_ob': 49, 'bull_adx_thresh': 6.652637992791574, 'bull_atr_min_pct': 0.0032578507253291644, 'bull_atr_max_pct': 0.07034403228254879, 'bull_tp_mult': 2.1636392419468007, 'bull_tsl_mult': 0.8531376719987531, 'bull_time_stop': 64, 'bull_use_sma': True, 'bull_use_ema': True, 'bull_use_atr': False, 'bull_use_adx': False, 'bull_use_spike': False, 'bull_rsi_required': False, 'bear_strategy': 'mean_reversion', 'bear_bb_std_mult': 0.8296075151034337, 'bear_rsi_os': 47, 'bear_rsi_ob': 76, 'bear_adx_thresh': 8.495139811063606, 'bear_atr_min_pct': 0.014564951972483177, 'bear_atr_max_pct': 0.07584186069022107, 'bear_tp_mult': 2.2093671259356578, 'bear_tsl_mult': 0.7300291791271529, 'bear_time_stop': 296, 'bear_use_sma': True, 'bear_use_ema': True, 'bear_use_atr': True, 'bear_use_adx': True, 'bear_use_spike': False, 'bear_rsi_required': True, 'sideways_strategy': 'breakout', 'sideways_bb_std_mult': 3.502160929220178, 'sideways_rsi_os': 27, 'sideways_rsi_ob': 93, 'sideways_adx_thresh': 16.76601913104821, 'sideways_atr_min_pct': 0.028142955001226804, 'sideways_atr_max_pct': 0.01532801123996758, 'sideways_tp_mult': 1.3894300957505423, 'sideways_tsl_mult': 0.23138000533781078, 'sideways_time_stop': 64, 'sideways_use_sma': True, 'sideways_use_ema': True, 'sideways_use_atr': True, 'sideways_use_adx': True, 'sideways_use_spike': False, 'sideways_rsi_required': False}.
[I 2025-09-01 08:07:39,953] Trial 275 finished with values: [-1000000000.0, 1000000000.0] and parameters: {'p_sma': 28, 'p_std': 54, 'p_atr': 15, 'p_adx': 10, 'rsi_period': 46, 'ema1': 13, 'ema2': 23, 'slip_atr_k': 0.0052393842211514285, 'slip_spread_k': 0.08958074592256898, 'spread_hl_frac': 0.011454206902790934, 'bb_std_mult': 1.3536868081340536, 'rsi_os': 31, 'rsi_ob': 93, 'vol_spike': 0.1251516129245996, 'adx_thresh': 27.965592368331656, 'atr_min_pct': 0.004211861188295878, 'atr_max_pct': 0.052978188708193596, 'tp_mult': 1.6546905156772778, 'tsl_mult': 0.03203080117235252, 'strategy': 'breakout', 'time_stop': 242, 'use_sma': False, 'use_atr': False, 'use_adx': True, 'use_ema': True, 'use_spike': True, 'rsi_required': True, 'edge_k': 0.23757434970811234, 'edge_cap': 0.416100628505231, 'bull_strategy': 'breakout', 'bull_bb_std_mult': 2.5814540119977307, 'bull_rsi_os': 45, 'bull_rsi_ob': 71, 'bull_adx_thresh': 7.385740228384967, 'bull_atr_min_pct': 0.003207480080691697, 'bull_atr_max_pct': 0.017472594708240273, 'bull_tp_mult': 2.4696760091270886, 'bull_tsl_mult': 0.6122394342984201, 'bull_time_stop': 131, 'bull_use_sma': True, 'bull_use_ema': True, 'bull_use_atr': False, 'bull_use_adx': False, 'bull_use_spike': False, 'bull_rsi_required': False, 'bear_strategy': 'mean_reversion', 'bear_bb_std_mult': 3.3297364888625998, 'bear_rsi_os': 19, 'bear_rsi_ob': 76, 'bear_adx_thresh': 6.860587580628028, 'bear_atr_min_pct': 0.023140731504643818, 'bear_atr_max_pct': 0.08645278533242118, 'bear_tp_mult': 1.7460873795448735, 'bear_tsl_mult': 0.08444742674228246, 'bear_time_stop': 296, 'bear_use_sma': True, 'bear_use_ema': False, 'bear_use_atr': True, 'bear_use_adx': True, 'bear_use_spike': False, 'bear_rsi_required': True, 'sideways_strategy': 'breakout', 'sideways_bb_std_mult': 1.3279195920566083, 'sideways_rsi_os': 6, 'sideways_rsi_ob': 72, 'sideways_adx_thresh': 16.971528066315535, 'sideways_atr_min_pct': 0.029445195359300444, 'sideways_atr_max_pct': 0.01550121134730438, 'sideways_tp_mult': 1.2552966786984023, 'sideways_tsl_mult': 0.23477208914895506, 'sideways_time_stop': 62, 'sideways_use_sma': True, 'sideways_use_ema': True, 'sideways_use_atr': True, 'sideways_use_adx': True, 'sideways_use_spike': False, 'sideways_rsi_required': False}.
[I 2025-09-01 08:08:25,154] Trial 276 finished with values: [-1000000000.0, 1000000000.0] and parameters: {'p_sma': 31, 'p_std': 53, 'p_atr': 15, 'p_adx': 8, 'rsi_period': 46, 'ema1': 10, 'ema2': 10, 'slip_atr_k': 0.007002658747768902, 'slip_spread_k': 0.838941921068351, 'spread_hl_frac': 0.011123846849500794, 'bb_std_mult': 2.135444536031616, 'rsi_os': 35, 'rsi_ob': 89, 'vol_spike': 0.07077493168128979, 'adx_thresh': 31.342204433757058, 'atr_min_pct': 0.004521192875699802, 'atr_max_pct': 0.05385251643503464, 'tp_mult': 1.6483037246965777, 'tsl_mult': 0.026183800642398843, 'strategy': 'breakout', 'time_stop': 244, 'use_sma': False, 'use_atr': False, 'use_adx': True, 'use_ema': True, 'use_spike': True, 'rsi_required': True, 'edge_k': 0.1517585636001887, 'edge_cap': 0.9944914323560168, 'bull_strategy': 'breakout', 'bull_bb_std_mult': 3.0825922110823036, 'bull_rsi_os': 52, 'bull_rsi_ob': 64, 'bull_adx_thresh': 8.974177685178311, 'bull_atr_min_pct': 0.012759871829070287, 'bull_atr_max_pct': 0.015555447649995613, 'bull_tp_mult': 2.28889448986811, 'bull_tsl_mult': 0.6638170172250122, 'bull_time_stop': 133, 'bull_use_sma': True, 'bull_use_ema': True, 'bull_use_atr': False, 'bull_use_adx': False, 'bull_use_spike': False, 'bull_rsi_required': False, 'bear_strategy': 'mean_reversion', 'bear_bb_std_mult': 1.8142608850783963, 'bear_rsi_os': 16, 'bear_rsi_ob': 76, 'bear_adx_thresh': 29.707641569766132, 'bear_atr_min_pct': 0.020441566479372696, 'bear_atr_max_pct': 0.08256733238154881, 'bear_tp_mult': 2.221741654232014, 'bear_tsl_mult': 0.08961390904606675, 'bear_time_stop': 300, 'bear_use_sma': True, 'bear_use_ema': False, 'bear_use_atr': True, 'bear_use_adx': True, 'bear_use_spike': False, 'bear_rsi_required': True, 'sideways_strategy': 'breakout', 'sideways_bb_std_mult': 3.4778970421951625, 'sideways_rsi_os': 5, 'sideways_rsi_ob': 94, 'sideways_adx_thresh': 16.82619573917073, 'sideways_atr_min_pct': 0.02950049281106718, 'sideways_atr_max_pct': 0.01762232518751269, 'sideways_tp_mult': 2.5461960166573587, 'sideways_tsl_mult': 0.1645631777480986, 'sideways_time_stop': 108, 'sideways_use_sma': True, 'sideways_use_ema': True, 'sideways_use_atr': True, 'sideways_use_adx': True, 'sideways_use_spike': False, 'sideways_rsi_required': False}.
[I 2025-09-01 08:08:25,899] Trial 278 finished with values: [-1000000000.0, 1000000000.0] and parameters: {'p_sma': 31, 'p_std': 51, 'p_atr': 15, 'p_adx': 12, 'rsi_period': 81, 'ema1': 8, 'ema2': 10, 'slip_atr_k': 0.20572597618912206, 'slip_spread_k': 0.9356207494396287, 'spread_hl_frac': 0.04164703369711227, 'bb_std_mult': 2.2180434281242825, 'rsi_os': 34, 'rsi_ob': 91, 'vol_spike': 0.059640193507220406, 'adx_thresh': 17.22393945539701, 'atr_min_pct': 0.006036700284604939, 'atr_max_pct': 0.1450124275965012, 'tp_mult': 1.7631160116829194, 'tsl_mult': 0.15815701780628116, 'strategy': 'mean_reversion', 'time_stop': 185, 'use_sma': False, 'use_atr': False, 'use_adx': True, 'use_ema': True, 'use_spike': True, 'rsi_required': True, 'edge_k': 0.16050158846604357, 'edge_cap': 0.9935291566640586, 'bull_strategy': 'breakout', 'bull_bb_std_mult': 2.9611461995914845, 'bull_rsi_os': 19, 'bull_rsi_ob': 71, 'bull_adx_thresh': 9.067893879712306, 'bull_atr_min_pct': 0.01285051471105872, 'bull_atr_max_pct': 0.014978373805202172, 'bull_tp_mult': 2.325922138615739, 'bull_tsl_mult': 0.5923289663169067, 'bull_time_stop': 74, 'bull_use_sma': False, 'bull_use_ema': True, 'bull_use_atr': True, 'bull_use_adx': False, 'bull_use_spike': False, 'bull_rsi_required': True, 'bear_strategy': 'breakout', 'bear_bb_std_mult': 1.8062512823746748, 'bear_rsi_os': 43, 'bear_rsi_ob': 77, 'bear_adx_thresh': 5.0600836057485505, 'bear_atr_min_pct': 0.0068355805836266634, 'bear_atr_max_pct': 0.09978672849059947, 'bear_tp_mult': 1.7415018515469545, 'bear_tsl_mult': 0.09161226550754817, 'bear_time_stop': 178, 'bear_use_sma': False, 'bear_use_ema': False, 'bear_use_atr': True, 'bear_use_adx': False, 'bear_use_spike': True, 'bear_rsi_required': False, 'sideways_strategy': 'breakout', 'sideways_bb_std_mult': 0.8130418150251421, 'sideways_rsi_os': 5, 'sideways_rsi_ob': 72, 'sideways_adx_thresh': 9.58069817697897, 'sideways_atr_min_pct': 0.009283461993454853, 'sideways_atr_max_pct': 0.019634050453161193, 'sideways_tp_mult': 1.4466176726175957, 'sideways_tsl_mult': 0.07475779257093058, 'sideways_time_stop': 109, 'sideways_use_sma': True, 'sideways_use_ema': True, 'sideways_use_atr': True, 'sideways_use_adx': True, 'sideways_use_spike': False, 'sideways_rsi_required': False}.
[I 2025-09-01 08:08:25,923] Trial 279 finished with values: [-0.029093711800290856, 0.0289237037652975] and parameters: {'p_sma': 31, 'p_std': 38, 'p_atr': 17, 'p_adx': 17, 'rsi_period': 52, 'ema1': 16, 'ema2': 19, 'slip_atr_k': 0.20638855446679738, 'slip_spread_k': 0.9345903893327241, 'spread_hl_frac': 0.013281595551562322, 'bb_std_mult': 2.2150654205546982, 'rsi_os': 34, 'rsi_ob': 76, 'vol_spike': 0.061008591174869266, 'adx_thresh': 30.05889383000577, 'atr_min_pct': 0.0067003838704502786, 'atr_max_pct': 0.13496782111990002, 'tp_mult': 1.7579556801784137, 'tsl_mult': 0.06428478396905797, 'strategy': 'mean_reversion', 'time_stop': 32, 'use_sma': False, 'use_atr': False, 'use_adx': True, 'use_ema': True, 'use_spike': True, 'rsi_required': True, 'edge_k': 0.14521195794706004, 'edge_cap': 0.22567608762809657, 'bull_strategy': 'breakout', 'bull_bb_std_mult': 2.963650655490049, 'bull_rsi_os': 19, 'bull_rsi_ob': 53, 'bull_adx_thresh': 9.195755131429022, 'bull_atr_min_pct': 0.0023108579065663493, 'bull_atr_max_pct': 0.11241311621824188, 'bull_tp_mult': 2.925922439385917, 'bull_tsl_mult': 0.66499348567162, 'bull_time_stop': 76, 'bull_use_sma': False, 'bull_use_ema': True, 'bull_use_atr': True, 'bull_use_adx': True, 'bull_use_spike': False, 'bull_rsi_required': True, 'bear_strategy': 'breakout', 'bear_bb_std_mult': 0.9353221734938817, 'bear_rsi_os': 43, 'bear_rsi_ob': 48, 'bear_adx_thresh': 5.375198256233298, 'bear_atr_min_pct': 0.006680002612090954, 'bear_atr_max_pct': 0.03314104996896965, 'bear_tp_mult': 2.1220243873571576, 'bear_tsl_mult': 0.161639171409502, 'bear_time_stop': 194, 'bear_use_sma': False, 'bear_use_ema': False, 'bear_use_atr': True, 'bear_use_adx': False, 'bear_use_spike': True, 'bear_rsi_required': False, 'sideways_strategy': 'breakout', 'sideways_bb_std_mult': 0.8993746474054498, 'sideways_rsi_os': 5, 'sideways_rsi_ob': 61, 'sideways_adx_thresh': 11.57030779410876, 'sideways_atr_min_pct': 0.029973219656624826, 'sideways_atr_max_pct': 0.01917482243741643, 'sideways_tp_mult': 1.1747133407914963, 'sideways_tsl_mult': 0.1657675362281658, 'sideways_time_stop': 276, 'sideways_use_sma': True, 'sideways_use_ema': True, 'sideways_use_atr': True, 'sideways_use_adx': True, 'sideways_use_spike': False, 'sideways_rsi_required': False}.
