[I 2025-09-01 08:05:01,977] Trial 260 finished with values: [-1000000000.0, 1000000000.0] and parameters: {'p_sma': 5, 'p_std': 56, 'p_atr': 23, 'p_adx': 25, 'rsi_period': 54, 'ema1': 15, 'ema2': 46, 'slip_atr_k': 0.17787428785596102, 'slip_spread_k': 0.045504309342111915, 'spread_hl_frac': 0.012487629708397067, 'bb_std_mult': 1.2048120858571107, 'rsi_os': 53, 'rsi_ob': 88, 'vol_spike': 0.06645728528530001, 'adx_thresh': 6.569042128558795, 'atr_min_pct': 0.0042423637909097785, 'atr_max_pct': 0.06700669079544773, 'tp_mult': 1.698245278825981, 'tsl_mult': 0.14075019133298367, 'strategy': 'breakout', 'time_stop': 215, 'use_sma': False, 'use_atr': False, 'use_adx': True, 'use_ema': True, 'use_spike': True, 'rsi_required': True, 'edge_k': 0.1910086584494865, 'edge_cap': 0.17076765597096277, 'bull_strategy': 'breakout', 'bull_bb_std_mult': 3.007896748849142, 'bull_rsi_os': 35, 'bull_rsi_ob': 50, 'bull_adx_thresh': 9.612908619721864, 'bull_atr_min_pct': 0.003494950696386232, 'bull_atr_max_pct': 0.08623194822224571, 'bull_tp_mult': 2.6133076367912875, 'bull_tsl_mult': 0.897412079148359, 'bull_time_stop': 252, 'bull_use_sma': True, 'bull_use_ema': True, 'bull_use_atr': False, 'bull_use_adx': False, 'bull_use_spike': False, 'bull_rsi_required': False, 'bear_strategy': 'mean_reversion', 'bear_bb_std_mult': 1.8769465450865401, 'bear_rsi_os': 48, 'bear_rsi_ob': 78, 'bear_adx_thresh': 5.044343847454034, 'bear_atr_min_pct': 0.008801041318268817, 'bear_atr_max_pct': 0.09260460320157995, 'bear_tp_mult': 1.9608374884170336, 'bear_tsl_mult': 0.8291828556369494, 'bear_time_stop': 55, 'bear_use_sma': True, 'bear_use_ema': False, 'bear_use_atr': False, 'bear_use_adx': False, 'bear_use_spike': False, 'bear_rsi_required': False, 'sideways_strategy': 'breakout', 'sideways_bb_std_mult': 0.97891484635446, 'sideways_rsi_os': 17, 'sideways_rsi_ob': 94, 'sideways_adx_thresh': 25.41966578250686, 'sideways_atr_min_pct': 0.02666858094923727, 'sideways_atr_max_pct': 0.13013522469090116, 'sideways_tp_mult': 1.289400331839508, 'sideways_tsl_mult': 0.14226924681465394, 'sideways_time_stop': 224, 'sideways_use_sma': True, 'sideways_use_ema': True, 'sideways_use_atr': True, 'sideways_use_adx': True, 'sideways_use_spike': False, 'sideways_rsi_required': False}.
[I 2025-09-01 08:05:02,165] Trial 262 finished with values: [-1000000000.0, 1000000000.0] and parameters: {'p_sma': 29, 'p_std': 56, 'p_atr': 30, 'p_adx': 20, 'rsi_period': 26, 'ema1': 16, 'ema2': 18, 'slip_atr_k': 0.21414252073694526, 'slip_spread_k': 0.8086522724672267, 'spread_hl_frac': 0.01237501419169786, 'bb_std_mult': 1.2071870169288137, 'rsi_os': 37, 'rsi_ob': 62, 'vol_spike': 0.06404072132348286, 'adx_thresh': 29.3719770848149, 'atr_min_pct': 0.01914367186395066, 'atr_max_pct': 0.12945103514409098, 'tp_mult': 1.7095718761297636, 'tsl_mult': 0.07192220981280552, 'strategy': 'breakout', 'time_stop': 20, 'use_sma': False, 'use_atr': True, 'use_adx': True, 'use_ema': True, 'use_spike': True, 'rsi_required': True, 'edge_k': 0.5561933452016864, 'edge_cap': 0.17881307475656613, 'bull_strategy': 'mean_reversion', 'bull_bb_std_mult': 1.9884920017255554, 'bull_rsi_os': 23, 'bull_rsi_ob': 66, 'bull_adx_thresh': 6.080255463140367, 'bull_atr_min_pct': 0.019452437803022672, 'bull_atr_max_pct': 0.07645795740736375, 'bull_tp_mult': 1.5265646400135875, 'bull_tsl_mult': 0.5700915657833724, 'bull_time_stop': 58, 'bull_use_sma': True, 'bull_use_ema': True, 'bull_use_atr': False, 'bull_use_adx': False, 'bull_use_spike': False, 'bull_rsi_required': False, 'bear_strategy': 'mean_reversion', 'bear_bb_std_mult': 3.052507444931627, 'bear_rsi_os': 48, 'bear_rsi_ob': 85, 'bear_adx_thresh': 5.453647973106925, 'bear_atr_min_pct': 0.008772595019452458, 'bear_atr_max_pct': 0.09163309726272925, 'bear_tp_mult': 2.2702530937463608, 'bear_tsl_mult': 0.02240316795008024, 'bear_time_stop': 294, 'bear_use_sma': True, 'bear_use_ema': True, 'bear_use_atr': True, 'bear_use_adx': False, 'bear_use_spike': False, 'bear_rsi_required': False, 'sideways_strategy': 'breakout', 'sideways_bb_std_mult': 0.9646130200714766, 'sideways_rsi_os': 9, 'sideways_rsi_ob': 64, 'sideways_adx_thresh': 13.079593744254971, 'sideways_atr_min_pct': 0.024433613123620638, 'sideways_atr_max_pct': 0.07811688956402697, 'sideways_tp_mult': 2.885923666866759, 'sideways_tsl_mult': 0.14462355068985766, 'sideways_time_stop': 224, 'sideways_use_sma': True, 'sideways_use_ema': True, 'sideways_use_atr': True, 'sideways_use_adx': True, 'sideways_use_spike': False, 'sideways_rsi_required': False}.
[I 2025-09-01 08:05:52,289] Trial 265 finished with values: [-1000000000.0, 1000000000.0] and parameters: {'p_sma': 30, 'p_std': 47, 'p_atr': 22, 'p_adx': 29, 'rsi_period': 58, 'ema1': 17, 'ema2': 54, 'slip_atr_k': 0.21298600086207034, 'slip_spread_k': 0.18841290780367626, 'spread_hl_frac': 0.01448946337309729, 'bb_std_mult': 3.473659853838887, 'rsi_os': 33, 'rsi_ob': 69, 'vol_spike': 0.05995572646092686, 'adx_thresh': 31.29031394283482, 'atr_min_pct': 0.010941181432811016, 'atr_max_pct': 0.13028011921442123, 'tp_mult': 2.829386996653195, 'tsl_mult': 0.07929034028692433, 'strategy': 'breakout', 'time_stop': 9, 'use_sma': False, 'use_atr': False, 'use_adx': True, 'use_ema': True, 'use_spike': True, 'rsi_required': True, 'edge_k': 0.21001392171814093, 'edge_cap': 0.25265022183359015, 'bull_strategy': 'breakout', 'bull_bb_std_mult': 2.8498968843015495, 'bull_rsi_os': 46, 'bull_rsi_ob': 67, 'bull_adx_thresh': 7.756904879456263, 'bull_atr_min_pct': 0.01900149709175894, 'bull_atr_max_pct': 0.04031208890576883, 'bull_tp_mult': 1.520750000387986, 'bull_tsl_mult': 0.5757703050283174, 'bull_time_stop': 56, 'bull_use_sma': True, 'bull_use_ema': True, 'bull_use_atr': False, 'bull_use_adx': False, 'bull_use_spike': False, 'bull_rsi_required': False, 'bear_strategy': 'mean_reversion', 'bear_bb_std_mult': 0.7258052393664864, 'bear_rsi_os': 47, 'bear_rsi_ob': 46, 'bear_adx_thresh': 5.718211651664226, 'bear_atr_min_pct': 0.007910366362507542, 'bear_atr_max_pct': 0.10588397025245554, 'bear_tp_mult': 2.1831064107513645, 'bear_tsl_mult': 0.9539941403142254, 'bear_time_stop': 6, 'bear_use_sma': True, 'bear_use_ema': False, 'bear_use_atr': True, 'bear_use_adx': False, 'bear_use_spike': False, 'bear_rsi_required': True, 'sideways_strategy': 'breakout', 'sideways_bb_std_mult': 1.2193665466075871, 'sideways_rsi_os': 9, 'sideways_rsi_ob': 93, 'sideways_adx_thresh': 8.906802080523839, 'sideways_atr_min_pct': 0.029941723606286948, 'sideways_atr_max_pct': 0.07839083077556637, 'sideways_tp_mult': 1.4116196326203738, 'sideways_tsl_mult': 0.9313097365328249, 'sideways_time_stop': 130, 'sideways_use_sma': True, 'sideways_use_ema': True, 'sideways_use_atr': True, 'sideways_use_adx': True, 'sideways_use_spike': False, 'sideways_rsi_required': False}.
[I 2025-09-01 08:05:52,480] Trial 264 finished with values: [-1000000000.0, 1000000000.0] and parameters: {'p_sma': 27, 'p_std': 6, 'p_atr': 22, 'p_adx': 25, 'rsi_period': 26, 'ema1': 18, 'ema2': 33, 'slip_atr_k': 0.010255060438434783, 'slip_spread_k': 0.28342915718523054, 'spread_hl_frac': 0.014706764739006084, 'bb_std_mult': 1.8404039062873052, 'rsi_os': 52, 'rsi_ob': 69, 'vol_spike': 0.06104741496060343, 'adx_thresh': 29.457448200894845, 'atr_min_pct': 0.01903477598183817, 'atr_max_pct': 0.07212717430307093, 'tp_mult': 1.7137454791374453, 'tsl_mult': 0.09075902998007984, 'strategy': 'breakout', 'time_stop': 12, 'use_sma': False, 'use_atr': False, 'use_adx': True, 'use_ema': True, 'use_spike': True, 'rsi_required': True, 'edge_k': 0.05716146297477001, 'edge_cap': 0.18393572396156613, 'bull_strategy': 'breakout', 'bull_bb_std_mult': 3.115306150900689, 'bull_rsi_os': 46, 'bull_rsi_ob': 78, 'bull_adx_thresh': 9.67875726999362, 'bull_atr_min_pct': 0.010338389971320174, 'bull_atr_max_pct': 0.11511774725848983, 'bull_tp_mult': 1.5207136321598083, 'bull_tsl_mult': 0.5737430953943504, 'bull_time_stop': 56, 'bull_use_sma': True, 'bull_use_ema': True, 'bull_use_atr': False, 'bull_use_adx': False, 'bull_use_spike': False, 'bull_rsi_required': False, 'bear_strategy': 'mean_reversion', 'bear_bb_std_mult': 2.0304065913940272, 'bear_rsi_os': 48, 'bear_rsi_ob': 81, 'bear_adx_thresh': 5.603391893217061, 'bear_atr_min_pct': 0.00826429841575761, 'bear_atr_max_pct': 0.10448103422591878, 'bear_tp_mult': 2.98991648833017, 'bear_tsl_mult': 0.1429093089144531, 'bear_time_stop': 300, 'bear_use_sma': True, 'bear_use_ema': False, 'bear_use_atr': True, 'bear_use_adx': False, 'bear_use_spike': False, 'bear_rsi_required': False, 'sideways_strategy': 'breakout', 'sideways_bb_std_mult': 0.9045345703626602, 'sideways_rsi_os': 9, 'sideways_rsi_ob': 94, 'sideways_adx_thresh': 13.153910303390237, 'sideways_atr_min_pct': 0.02685418995453963, 'sideways_atr_max_pct': 0.042605985577221964, 'sideways_tp_mult': 1.4069181684219052, 'sideways_tsl_mult': 0.20227248978855678, 'sideways_time_stop': 22, 'sideways_use_sma': True, 'sideways_use_ema': True, 'sideways_use_atr': True, 'sideways_use_adx': True, 'sideways_use_spike': False, 'sideways_rsi_required': False}.
[I 2025-09-01 08:05:52,744] Trial 263 finished with values: [-1000000000.0, 1000000000.0] and parameters: {'p_sma': 27, 'p_std': 36, 'p_atr': 23, 'p_adx': 12, 'rsi_period': 78, 'ema1': 15, 'ema2': 18, 'slip_atr_k': 0.010072652830929188, 'slip_spread_k': 0.8850870275958497, 'spread_hl_frac': 0.012102499193638955, 'bb_std_mult': 1.9098005164407548, 'rsi_os': 52, 'rsi_ob': 88, 'vol_spike': 0.29108264302443837, 'adx_thresh': 29.473027213638566, 'atr_min_pct': 0.019844057384392502, 'atr_max_pct': 0.13044630879562577, 'tp_mult': 1.7021260609364397, 'tsl_mult': 0.08704849205417578, 'strategy': 'breakout', 'time_stop': 235, 'use_sma': False, 'use_atr': False, 'use_adx': True, 'use_ema': True, 'use_spike': True, 'rsi_required': True, 'edge_k': 0.20576100045472429, 'edge_cap': 0.25701614369864195, 'bull_strategy': 'breakout', 'bull_bb_std_mult': 2.8697332655382377, 'bull_rsi_os': 48, 'bull_rsi_ob': 50, 'bull_adx_thresh': 13.505750247910665, 'bull_atr_min_pct': 0.019125364736435238, 'bull_atr_max_pct': 0.07719642970640073, 'bull_tp_mult': 1.524898475378101, 'bull_tsl_mult': 0.5760113817258041, 'bull_time_stop': 57, 'bull_use_sma': True, 'bull_use_ema': True, 'bull_use_atr': False, 'bull_use_adx': False, 'bull_use_spike': False, 'bull_rsi_required': False, 'bear_strategy': 'mean_reversion', 'bear_bb_std_mult': 3.0820969471438793, 'bear_rsi_os': 48, 'bear_rsi_ob': 81, 'bear_adx_thresh': 5.071229092655065, 'bear_atr_min_pct': 0.007963404350862456, 'bear_atr_max_pct': 0.09213926178017734, 'bear_tp_mult': 2.2433692379807244, 'bear_tsl_mult': 0.020476796164689663, 'bear_time_stop': 5, 'bear_use_sma': True, 'bear_use_ema': False, 'bear_use_atr': False, 'bear_use_adx': False, 'bear_use_spike': False, 'bear_rsi_required': False, 'sideways_strategy': 'breakout', 'sideways_bb_std_mult': 1.9816245360819706, 'sideways_rsi_os': 5, 'sideways_rsi_ob': 93, 'sideways_adx_thresh': 9.074007658356253, 'sideways_atr_min_pct': 0.026636642805705508, 'sideways_atr_max_pct': 0.04040781156376477, 'sideways_tp_mult': 2.877196988644969, 'sideways_tsl_mult': 0.1510523300407036, 'sideways_time_stop': 14, 'sideways_use_sma': True, 'sideways_use_ema': True, 'sideways_use_atr': True, 'sideways_use_adx': True, 'sideways_use_spike': False, 'sideways_rsi_required': False}.
[I 2025-09-01 08:05:52,946] Trial 266 finished with values: [-1000000000.0, 1000000000.0] and parameters: {'p_sma': 27, 'p_std': 7, 'p_atr': 22, 'p_adx': 29, 'rsi_period': 60, 'ema1': 14, 'ema2': 11, 'slip_atr_k': 0.22850648690098113, 'slip_spread_k': 0.275273325901961, 'spread_hl_frac': 0.014417040977566237, 'bb_std_mult': 1.888615713537378, 'rsi_os': 33, 'rsi_ob': 91, 'vol_spike': 0.08605000424901114, 'adx_thresh': 25.350580471456137, 'atr_min_pct': 0.005236349509293088, 'atr_max_pct': 0.09149795548677703, 'tp_mult': 1.883813697493289, 'tsl_mult': 0.09238025464810165, 'strategy': 'breakout', 'time_stop': 6, 'use_sma': False, 'use_atr': False, 'use_adx': True, 'use_ema': True, 'use_spike': True, 'rsi_required': True, 'edge_k': 0.21153361460454045, 'edge_cap': 0.2518474550777825, 'bull_strategy': 'breakout', 'bull_bb_std_mult': 2.819403706316301, 'bull_rsi_os': 48, 'bull_rsi_ob': 78, 'bull_adx_thresh': 28.2594665634453, 'bull_atr_min_pct': 0.022114709521299732, 'bull_atr_max_pct': 0.021595260652636335, 'bull_tp_mult': 1.5133811775758863, 'bull_tsl_mult': 0.7092712159570249, 'bull_time_stop': 83, 'bull_use_sma': True, 'bull_use_ema': False, 'bull_use_atr': False, 'bull_use_adx': False, 'bull_use_spike': False, 'bull_rsi_required': False, 'bear_strategy': 'mean_reversion', 'bear_bb_std_mult': 0.7304017898116943, 'bear_rsi_os': 45, 'bear_rsi_ob': 81, 'bear_adx_thresh': 5.876070395145185, 'bear_atr_min_pct': 0.00788487933924877, 'bear_atr_max_pct': 0.09501548891064807, 'bear_tp_mult': 2.573341024751146, 'bear_tsl_mult': 0.9470296500374208, 'bear_time_stop': 6, 'bear_use_sma': True, 'bear_use_ema': False, 'bear_use_atr': True, 'bear_use_adx': False, 'bear_use_spike': False, 'bear_rsi_required': True, 'sideways_strategy': 'breakout', 'sideways_bb_std_mult': 3.1633517726306555, 'sideways_rsi_os': 7, 'sideways_rsi_ob': 68, 'sideways_adx_thresh': 33.41467018285219, 'sideways_atr_min_pct': 0.007634561759809477, 'sideways_atr_max_pct': 0.13641904065168994, 'sideways_tp_mult': 1.3136929984311743, 'sideways_tsl_mult': 0.19665750154430492, 'sideways_time_stop': 178, 'sideways_use_sma': True, 'sideways_use_ema': True, 'sideways_use_atr': False, 'sideways_use_adx': True, 'sideways_use_spike': False, 'sideways_rsi_required': False}.
[I 2025-09-01 08:05:53,853] Trial 269 finished with values: [-1000000000.0, 1000000000.0] and parameters: {'p_sma': 35, 'p_std': 28, 'p_atr': 7, 'p_adx': 9, 'rsi_period': 18, 'ema1': 7, 'ema2': 11, 'slip_atr_k': 0.05836779842052029, 'slip_spread_k': 0.9539558957294537, 'spread_hl_frac': 0.01641816728863766, 'bb_std_mult': 2.296689524701941, 'rsi_os': 20, 'rsi_ob': 50, 'vol_spike': 0.08601005786780107, 'adx_thresh': 5.578223894887778, 'atr_min_pct': 0.01812414349614381, 'atr_max_pct': 0.09244703244259198, 'tp_mult': 1.8979123875923214, 'tsl_mult': 0.05493658898923888, 'strategy': 'mean_reversion', 'time_stop': 253, 'use_sma': True, 'use_atr': False, 'use_adx': True, 'use_ema': True, 'use_spike': True, 'rsi_required': True, 'edge_k': 1.3220503557927854, 'edge_cap': 0.20612938293925506, 'bull_strategy': 'breakout', 'bull_bb_std_mult': 3.1584565203677837, 'bull_rsi_os': 25, 'bull_rsi_ob': 89, 'bull_adx_thresh': 8.05500343354322, 'bull_atr_min_pct': 0.01653383228872137, 'bull_atr_max_pct': 0.02153292752850968, 'bull_tp_mult': 1.7082307533689358, 'bull_tsl_mult': 0.5396896685321657, 'bull_time_stop': 83, 'bull_use_sma': True, 'bull_use_ema': False, 'bull_use_atr': True, 'bull_use_adx': True, 'bull_use_spike': False, 'bull_rsi_required': False, 'bear_strategy': 'mean_reversion', 'bear_bb_std_mult': 1.7882349128270922, 'bear_rsi_os': 45, 'bear_rsi_ob': 91, 'bear_adx_thresh': 5.9594686307710365, 'bear_atr_min_pct': 0.024159615392859924, 'bear_atr_max_pct': 0.09596639587138799, 'bear_tp_mult': 2.1649726220640195, 'bear_tsl_mult': 0.05978545828374537, 'bear_time_stop': 286, 'bear_use_sma': True, 'bear_use_ema': False, 'bear_use_atr': False, 'bear_use_adx': False, 'bear_use_spike': True, 'bear_rsi_required': False, 'sideways_strategy': 'breakout', 'sideways_bb_std_mult': 1.5966458165471231, 'sideways_rsi_os': 55, 'sideways_rsi_ob': 92, 'sideways_adx_thresh': 12.389112888069993, 'sideways_atr_min_pct': 0.029078474745721235, 'sideways_atr_max_pct': 0.01282390632253857, 'sideways_tp_mult': 1.2934595265163504, 'sideways_tsl_mult': 0.006006314735503782, 'sideways_time_stop': 198, 'sideways_use_sma': True, 'sideways_use_ema': True, 'sideways_use_atr': False, 'sideways_use_adx': True, 'sideways_use_spike': False, 'sideways_rsi_required': False}.
[I 2025-09-01 08:06:39,680] Trial 270 finished with values: [-1000000000.0, 1000000000.0] and parameters: {'p_sma': 35, 'p_std': 53, 'p_atr': 24, 'p_adx': 30, 'rsi_period': 19, 'ema1': 30, 'ema2': 12, 'slip_atr_k': 0.1061344814255144, 'slip_spread_k': 0.22693815868493344, 'spread_hl_frac': 0.016349007601695505, 'bb_std_mult': 2.279864375628953, 'rsi_os': 28, 'rsi_ob': 78, 'vol_spike': 0.07217339817150197, 'adx_thresh': 30.402437927846414, 'atr_min_pct': 0.0032711181723736214, 'atr_max_pct': 0.06202049555927788, 'tp_mult': 2.2397683212747768, 'tsl_mult': 0.0012472067173022044, 'strategy': 'mean_reversion', 'time_stop': 252, 'use_sma': True, 'use_atr': False, 'use_adx': True, 'use_ema': True, 'use_spike': True, 'rsi_required': True, 'edge_k': 0.3057268690156082, 'edge_cap': 0.20753990388966492, 'bull_strategy': 'breakout', 'bull_bb_std_mult': 2.6820484006247924, 'bull_rsi_os': 51, 'bull_rsi_ob': 74, 'bull_adx_thresh': 8.088121925288757, 'bull_atr_min_pct': 0.016382633277487697, 'bull_atr_max_pct': 0.09037219510824035, 'bull_tp_mult': 2.7513336089234004, 'bull_tsl_mult': 0.535861804050358, 'bull_time_stop': 71, 'bull_use_sma': True, 'bull_use_ema': False, 'bull_use_atr': True, 'bull_use_adx': True, 'bull_use_spike': False, 'bull_rsi_required': False, 'bear_strategy': 'mean_reversion', 'bear_bb_std_mult': 3.1904886534360073, 'bear_rsi_os': 46, 'bear_rsi_ob': 79, 'bear_adx_thresh': 26.367352197546474, 'bear_atr_min_pct': 0.007016986086975813, 'bear_atr_max_pct': 0.09652883196693403, 'bear_tp_mult': 2.094433359896811, 'bear_tsl_mult': 0.6196114870291424, 'bear_time_stop': 204, 'bear_use_sma': True, 'bear_use_ema': False, 'bear_use_atr': False, 'bear_use_adx': False, 'bear_use_spike': True, 'bear_rsi_required': False, 'sideways_strategy': 'breakout', 'sideways_bb_std_mult': 1.0466874145387148, 'sideways_rsi_os': 30, 'sideways_rsi_ob': 75, 'sideways_adx_thresh': 12.237425178571552, 'sideways_atr_min_pct': 0.025173739123931196, 'sideways_atr_max_pct': 0.012899894409929535, 'sideways_tp_mult': 2.6456014517798465, 'sideways_tsl_mult': 0.730664623038844, 'sideways_time_stop': 73, 'sideways_use_sma': True, 'sideways_use_ema': True, 'sideways_use_atr': True, 'sideways_use_adx': True, 'sideways_use_spike': False, 'sideways_rsi_required': False}.
[I 2025-09-01 08:06:40,444] Trial 268 finished with values: [-1000000000.0, 1000000000.0] and parameters: {'p_sma': 35, 'p_std': 25, 'p_atr': 8, 'p_adx': 21, 'rsi_period': 79, 'ema1': 21, 'ema2': 22, 'slip_atr_k': 0.05762909477206092, 'slip_spread_k': 0.8837315816953558, 'spread_hl_frac': 0.017073992071838837, 'bb_std_mult': 3.371759023174697, 'rsi_os': 20, 'rsi_ob': 60, 'vol_spike': 0.0434734184208478, 'adx_thresh': 27.348366284597514, 'atr_min_pct': 0.005332458205211496, 'atr_max_pct': 0.07793327397456436, 'tp_mult': 1.9334393693750127, 'tsl_mult': 0.05785114986847955, 'strategy': 'breakout', 'time_stop': 252, 'use_sma': True, 'use_atr': False, 'use_adx': True, 'use_ema': True, 'use_spike': True, 'rsi_required': True, 'edge_k': 1.4400862666301044, 'edge_cap': 0.5602395219914011, 'bull_strategy': 'breakout', 'bull_bb_std_mult': 1.6979969563626809, 'bull_rsi_os': 48, 'bull_rsi_ob': 46, 'bull_adx_thresh': 28.253071992035785, 'bull_atr_min_pct': 0.022201961415285333, 'bull_atr_max_pct': 0.021814957568667026, 'bull_tp_mult': 1.4362489517094623, 'bull_tsl_mult': 0.21067063426271293, 'bull_time_stop': 244, 'bull_use_sma': True, 'bull_use_ema': False, 'bull_use_atr': False, 'bull_use_adx': False, 'bull_use_spike': False, 'bull_rsi_required': False, 'bear_strategy': 'mean_reversion', 'bear_bb_std_mult': 2.4159309596011505, 'bear_rsi_os': 45, 'bear_rsi_ob': 80, 'bear_adx_thresh': 6.095521091722686, 'bear_atr_min_pct': 0.01673253881140927, 'bear_atr_max_pct': 0.09597608155676023, 'bear_tp_mult': 2.75079214614393, 'bear_tsl_mult': 0.05949101604173187, 'bear_time_stop': 203, 'bear_use_sma': True, 'bear_use_ema': False, 'bear_use_atr': False, 'bear_use_adx': False, 'bear_use_spike': False, 'bear_rsi_required': False, 'sideways_strategy': 'breakout', 'sideways_bb_std_mult': 1.0514619443923723, 'sideways_rsi_os': 55, 'sideways_rsi_ob': 92, 'sideways_adx_thresh': 11.924106615111114, 'sideways_atr_min_pct': 0.025472742413057137, 'sideways_atr_max_pct': 0.012226711138408416, 'sideways_tp_mult': 2.0165585866992553, 'sideways_tsl_mult': 0.1930413893221901, 'sideways_time_stop': 200, 'sideways_use_sma': True, 'sideways_use_ema': True, 'sideways_use_atr': False, 'sideways_use_adx': True, 'sideways_use_spike': False, 'sideways_rsi_required': False}.
