[I 2025-09-01 07:32:34,511] Trial 69 finished with values: [-1000000000.0, 1000000000.0] and parameters: {'p_sma': 39, 'p_std': 34, 'p_atr': 23, 'p_adx': 13, 'rsi_period': 41, 'ema1': 10, 'ema2': 57, 'slip_atr_k': 0.22411866774804093, 'slip_spread_k': 0.6089030358294465, 'spread_hl_frac': 0.017377004411652148, 'bb_std_mult': 1.0770662612469002, 'rsi_os': 38, 'rsi_ob': 64, 'vol_spike': 0.24125370117240313, 'adx_thresh': 18.029169449588228, 'atr_min_pct': 0.029247489786898874, 'atr_max_pct': 0.11593774647793263, 'tp_mult': 1.4676036074630376, 'tsl_mult': 0.05637260320805135, 'strategy': 'breakout', 'time_stop': 208, 'use_sma': True, 'use_atr': True, 'use_adx': False, 'use_ema': False, 'use_spike': True, 'rsi_required': True, 'edge_k': 0.6299650786063374, 'edge_cap': 0.9317492755233279, 'bull_strategy': 'mean_reversion', 'bull_bb_std_mult': 2.32483521146307, 'bull_rsi_os': 18, 'bull_rsi_ob': 59, 'bull_adx_thresh': 19.749185726758892, 'bull_atr_min_pct': 0.0073280795889844085, 'bull_atr_max_pct': 0.11730684316640866, 'bull_tp_mult': 1.7246462245763217, 'bull_tsl_mult': 0.4198177993380113, 'bull_time_stop': 50, 'bull_use_sma': False, 'bull_use_ema': False, 'bull_use_atr': False, 'bull_use_adx': True, 'bull_use_spike': True, 'bull_rsi_required': True, 'bear_strategy': 'breakout', 'bear_bb_std_mult': 2.468775063575194, 'bear_rsi_os': 45, 'bear_rsi_ob': 52, 'bear_adx_thresh': 34.93851868505442, 'bear_atr_min_pct': 0.01616225188681341, 'bear_atr_max_pct': 0.060343514285596936, 'bear_tp_mult': 1.7184573354652433, 'bear_tsl_mult': 0.4606405684848366, 'bear_time_stop': 297, 'bear_use_sma': False, 'bear_use_ema': False, 'bear_use_atr': True, 'bear_use_adx': True, 'bear_use_spike': True, 'bear_rsi_required': True, 'sideways_strategy': 'mean_reversion', 'sideways_bb_std_mult': 2.4144041354298533, 'sideways_rsi_os': 41, 'sideways_rsi_ob': 46, 'sideways_adx_thresh': 29.269287683996616, 'sideways_atr_min_pct': 0.009556682114585217, 'sideways_atr_max_pct': 0.04800553929411836, 'sideways_tp_mult': 1.0973628522286043, 'sideways_tsl_mult': 0.35950291650682503, 'sideways_time_stop': 181, 'sideways_use_sma': True, 'sideways_use_ema': False, 'sideways_use_atr': False, 'sideways_use_adx': False, 'sideways_use_spike': True, 'sideways_rsi_required': True}.
[I 2025-09-01 07:33:15,497] Trial 74 finished with values: [-1000000000.0, 1000000000.0] and parameters: {'p_sma': 58, 'p_std': 50, 'p_atr': 28, 'p_adx': 18, 'rsi_period': 34, 'ema1': 8, 'ema2': 10, 'slip_atr_k': 0.2104295903713922, 'slip_spread_k': 0.9861046686325885, 'spread_hl_frac': 0.03278317767724339, 'bb_std_mult': 2.352403854445625, 'rsi_os': 38, 'rsi_ob': 56, 'vol_spike': 0.024897130893025032, 'adx_thresh': 18.134991824055447, 'atr_min_pct': 0.029848794746200485, 'atr_max_pct': 0.10785250553771275, 'tp_mult': 1.6028203403305175, 'tsl_mult': 0.030181564495199487, 'strategy': 'breakout', 'time_stop': 92, 'use_sma': False, 'use_atr': True, 'use_adx': True, 'use_ema': False, 'use_spike': True, 'rsi_required': False, 'edge_k': 1.2611947760331501, 'edge_cap': 0.9015870361035185, 'bull_strategy': 'mean_reversion', 'bull_bb_std_mult': 3.529546376179388, 'bull_rsi_os': 32, 'bull_rsi_ob': 53, 'bull_adx_thresh': 19.70424580447235, 'bull_atr_min_pct': 0.0244006314982318, 'bull_atr_max_pct': 0.09032586108671879, 'bull_tp_mult': 2.147012788401444, 'bull_tsl_mult': 0.6322180223954228, 'bull_time_stop': 242, 'bull_use_sma': False, 'bull_use_ema': True, 'bull_use_atr': False, 'bull_use_adx': False, 'bull_use_spike': True, 'bull_rsi_required': True, 'bear_strategy': 'breakout', 'bear_bb_std_mult': 1.7449735861233477, 'bear_rsi_os': 39, 'bear_rsi_ob': 58, 'bear_adx_thresh': 28.78028649694034, 'bear_atr_min_pct': 0.02830181878530107, 'bear_atr_max_pct': 0.0950253822046513, 'bear_tp_mult': 1.1305453440006035, 'bear_tsl_mult': 0.19030863633611278, 'bear_time_stop': 173, 'bear_use_sma': False, 'bear_use_ema': True, 'bear_use_atr': False, 'bear_use_adx': False, 'bear_use_spike': False, 'bear_rsi_required': False, 'sideways_strategy': 'mean_reversion', 'sideways_bb_std_mult': 2.0284865949077218, 'sideways_rsi_os': 41, 'sideways_rsi_ob': 45, 'sideways_adx_thresh': 34.25378143349115, 'sideways_atr_min_pct': 0.0039247103639681764, 'sideways_atr_max_pct': 0.10095909229151596, 'sideways_tp_mult': 1.8944788202401461, 'sideways_tsl_mult': 0.6424502175623396, 'sideways_time_stop': 181, 'sideways_use_sma': False, 'sideways_use_ema': False, 'sideways_use_atr': True, 'sideways_use_adx': False, 'sideways_use_spike': True, 'sideways_rsi_required': False}.
[I 2025-09-01 07:33:15,969] Trial 75 finished with values: [-1000000000.0, 1000000000.0] and parameters: {'p_sma': 58, 'p_std': 50, 'p_atr': 17, 'p_adx': 28, 'rsi_period': 30, 'ema1': 8, 'ema2': 10, 'slip_atr_k': 0.20824989604818003, 'slip_spread_k': 0.12229199363650428, 'spread_hl_frac': 0.043595412117565034, 'bb_std_mult': 2.329877500119989, 'rsi_os': 5, 'rsi_ob': 56, 'vol_spike': 0.22793709236929507, 'adx_thresh': 17.951342927346865, 'atr_min_pct': 0.028563434761636863, 'atr_max_pct': 0.10879368383113049, 'tp_mult': 1.5896731600492333, 'tsl_mult': 0.1610403701284897, 'strategy': 'breakout', 'time_stop': 76, 'use_sma': False, 'use_atr': True, 'use_adx': True, 'use_ema': True, 'use_spike': True, 'rsi_required': False, 'edge_k': 1.2741073776665524, 'edge_cap': 0.28818206521517753, 'bull_strategy': 'mean_reversion', 'bull_bb_std_mult': 2.965428292880727, 'bull_rsi_os': 12, 'bull_rsi_ob': 62, 'bull_adx_thresh': 19.813109961928614, 'bull_atr_min_pct': 0.007208192864122478, 'bull_atr_max_pct': 0.09001447972786163, 'bull_tp_mult': 1.8429190323390177, 'bull_tsl_mult': 0.1880066433589728, 'bull_time_stop': 152, 'bull_use_sma': False, 'bull_use_ema': True, 'bull_use_atr': False, 'bull_use_adx': False, 'bull_use_spike': True, 'bull_rsi_required': True, 'bear_strategy': 'breakout', 'bear_bb_std_mult': 2.1560612113246322, 'bear_rsi_os': 48, 'bear_rsi_ob': 60, 'bear_adx_thresh': 8.793254253554407, 'bear_atr_min_pct': 0.016457183925426142, 'bear_atr_max_pct': 0.0578776241118422, 'bear_tp_mult': 2.0487199072826696, 'bear_tsl_mult': 0.5947479384459929, 'bear_time_stop': 173, 'bear_use_sma': False, 'bear_use_ema': True, 'bear_use_atr': True, 'bear_use_adx': False, 'bear_use_spike': False, 'bear_rsi_required': False, 'sideways_strategy': 'mean_reversion', 'sideways_bb_std_mult': 3.2359666044128037, 'sideways_rsi_os': 46, 'sideways_rsi_ob': 46, 'sideways_adx_thresh': 34.81813644203447, 'sideways_atr_min_pct': 0.013391041570355665, 'sideways_atr_max_pct': 0.0593950379531518, 'sideways_tp_mult': 2.9889756235549165, 'sideways_tsl_mult': 0.6370695182348791, 'sideways_time_stop': 186, 'sideways_use_sma': False, 'sideways_use_ema': True, 'sideways_use_atr': False, 'sideways_use_adx': False, 'sideways_use_spike': True, 'sideways_rsi_required': True}.
[I 2025-09-01 07:33:16,520] Trial 73 finished with values: [-1000000000.0, 1000000000.0] and parameters: {'p_sma': 8, 'p_std': 51, 'p_atr': 20, 'p_adx': 26, 'rsi_period': 69, 'ema1': 8, 'ema2': 10, 'slip_atr_k': 0.010888032866127231, 'slip_spread_k': 0.997279568248179, 'spread_hl_frac': 0.03324364289343852, 'bb_std_mult': 2.307010907003618, 'rsi_os': 10, 'rsi_ob': 71, 'vol_spike': 0.22668046793342383, 'adx_thresh': 17.8338896093398, 'atr_min_pct': 0.008756178039733564, 'atr_max_pct': 0.012112066452815512, 'tp_mult': 1.573633329713515, 'tsl_mult': 0.5932342589768027, 'strategy': 'breakout', 'time_stop': 129, 'use_sma': False, 'use_atr': True, 'use_adx': True, 'use_ema': False, 'use_spike': True, 'rsi_required': False, 'edge_k': 0.00774406011739337, 'edge_cap': 0.18084494601125273, 'bull_strategy': 'mean_reversion', 'bull_bb_std_mult': 1.0380236808917582, 'bull_rsi_os': 12, 'bull_rsi_ob': 51, 'bull_adx_thresh': 24.62227936659949, 'bull_atr_min_pct': 0.001971091963029436, 'bull_atr_max_pct': 0.09046199657176483, 'bull_tp_mult': 2.136431812636751, 'bull_tsl_mult': 0.6339886416642517, 'bull_time_stop': 240, 'bull_use_sma': False, 'bull_use_ema': True, 'bull_use_atr': False, 'bull_use_adx': False, 'bull_use_spike': True, 'bull_rsi_required': True, 'bear_strategy': 'breakout', 'bear_bb_std_mult': 1.7244202527822068, 'bear_rsi_os': 55, 'bear_rsi_ob': 59, 'bear_adx_thresh': 9.235692752548255, 'bear_atr_min_pct': 0.02454814745652429, 'bear_atr_max_pct': 0.057634085564831544, 'bear_tp_mult': 2.055486027798827, 'bear_tsl_mult': 0.6056563993125376, 'bear_time_stop': 232, 'bear_use_sma': False, 'bear_use_ema': True, 'bear_use_atr': False, 'bear_use_adx': False, 'bear_use_spike': False, 'bear_rsi_required': False, 'sideways_strategy': 'mean_reversion', 'sideways_bb_std_mult': 1.9627655239253925, 'sideways_rsi_os': 41, 'sideways_rsi_ob': 65, 'sideways_adx_thresh': 5.201230542648464, 'sideways_atr_min_pct': 0.02242588613677463, 'sideways_atr_max_pct': 0.0588668350737892, 'sideways_tp_mult': 1.9274264588441161, 'sideways_tsl_mult': 0.3475613035406865, 'sideways_time_stop': 179, 'sideways_use_sma': False, 'sideways_use_ema': False, 'sideways_use_atr': True, 'sideways_use_adx': False, 'sideways_use_spike': True, 'sideways_rsi_required': False}.
[I 2025-09-01 07:33:16,820] Trial 76 finished with values: [-1000000000.0, 1000000000.0] and parameters: {'p_sma': 50, 'p_std': 22, 'p_atr': 26, 'p_adx': 18, 'rsi_period': 20, 'ema1': 8, 'ema2': 10, 'slip_atr_k': 0.18480245984601978, 'slip_spread_k': 0.4554804789803869, 'spread_hl_frac': 0.03321995785814714, 'bb_std_mult': 1.3755118231378969, 'rsi_os': 52, 'rsi_ob': 71, 'vol_spike': 0.2232247707897595, 'adx_thresh': 10.33743225545849, 'atr_min_pct': 0.022824290321083532, 'atr_max_pct': 0.10876639894219245, 'tp_mult': 1.5853508027433165, 'tsl_mult': 0.14564077171221257, 'strategy': 'breakout', 'time_stop': 74, 'use_sma': False, 'use_atr': True, 'use_adx': True, 'use_ema': True, 'use_spike': True, 'rsi_required': False, 'edge_k': 0.013023549999038986, 'edge_cap': 0.19092646774494193, 'bull_strategy': 'mean_reversion', 'bull_bb_std_mult': 2.9427605952980853, 'bull_rsi_os': 32, 'bull_rsi_ob': 61, 'bull_adx_thresh': 24.35894334080595, 'bull_atr_min_pct': 0.024265440154370734, 'bull_atr_max_pct': 0.06939689600887754, 'bull_tp_mult': 1.0306009002205647, 'bull_tsl_mult': 0.19048355119607246, 'bull_time_stop': 246, 'bull_use_sma': False, 'bull_use_ema': True, 'bull_use_atr': False, 'bull_use_adx': False, 'bull_use_spike': True, 'bull_rsi_required': True, 'bear_strategy': 'breakout', 'bear_bb_std_mult': 1.631661478274804, 'bear_rsi_os': 49, 'bear_rsi_ob': 59, 'bear_adx_thresh': 20.033329194100105, 'bear_atr_min_pct': 0.02816882927573726, 'bear_atr_max_pct': 0.08300031138657579, 'bear_tp_mult': 1.1386339779199892, 'bear_tsl_mult': 0.5964051883022349, 'bear_time_stop': 132, 'bear_use_sma': False, 'bear_use_ema': True, 'bear_use_atr': False, 'bear_use_adx': False, 'bear_use_spike': False, 'bear_rsi_required': False, 'sideways_strategy': 'mean_reversion', 'sideways_bb_std_mult': 1.944527204174309, 'sideways_rsi_os': 45, 'sideways_rsi_ob': 95, 'sideways_adx_thresh': 34.8850875218518, 'sideways_atr_min_pct': 0.011381287916100788, 'sideways_atr_max_pct': 0.10166901553233021, 'sideways_tp_mult': 1.8737645814961632, 'sideways_tsl_mult': 0.4265136399589482, 'sideways_time_stop': 220, 'sideways_use_sma': False, 'sideways_use_ema': True, 'sideways_use_atr': True, 'sideways_use_adx': False, 'sideways_use_spike': True, 'sideways_rsi_required': False}.
[I 2025-09-01 07:33:17,262] Trial 77 finished with values: [-1000000000.0, 1000000000.0] and parameters: {'p_sma': 54, 'p_std': 36, 'p_atr': 20, 'p_adx': 26, 'rsi_period': 46, 'ema1': 24, 'ema2': 22, 'slip_atr_k': 0.15680974817802967, 'slip_spread_k': 0.09902664944868733, 'spread_hl_frac': 0.004942191606061963, 'bb_std_mult': 0.5986213633930593, 'rsi_os': 52, 'rsi_ob': 90, 'vol_spike': 0.22720696782439287, 'adx_thresh': 23.647331505911186, 'atr_min_pct': 0.02454033735993318, 'atr_max_pct': 0.01085920361729839, 'tp_mult': 1.8496661878436904, 'tsl_mult': 0.5741664435933473, 'strategy': 'breakout', 'time_stop': 76, 'use_sma': False, 'use_atr': False, 'use_adx': False, 'use_ema': True, 'use_spike': False, 'rsi_required': False, 'edge_k': 0.02737705026631554, 'edge_cap': 0.18667012857248513, 'bull_strategy': 'breakout', 'bull_bb_std_mult': 2.928660053373627, 'bull_rsi_os': 37, 'bull_rsi_ob': 61, 'bull_adx_thresh': 33.01638487211434, 'bull_atr_min_pct': 0.0020671052201412295, 'bull_atr_max_pct': 0.07003758985554001, 'bull_tp_mult': 1.9735251327937697, 'bull_tsl_mult': 0.18906030314514405, 'bull_time_stop': 150, 'bull_use_sma': False, 'bull_use_ema': True, 'bull_use_atr': False, 'bull_use_adx': False, 'bull_use_spike': True, 'bull_rsi_required': True, 'bear_strategy': 'breakout', 'bear_bb_std_mult': 3.3128812693175806, 'bear_rsi_os': 54, 'bear_rsi_ob': 59, 'bear_adx_thresh': 15.126787675166998, 'bear_atr_min_pct': 0.018959980936680075, 'bear_atr_max_pct': 0.08183734824606043, 'bear_tp_mult': 1.1946963866973794, 'bear_tsl_mult': 0.5946773828937546, 'bear_time_stop': 89, 'bear_use_sma': False, 'bear_use_ema': True, 'bear_use_atr': False, 'bear_use_adx': False, 'bear_use_spike': False, 'bear_rsi_required': False, 'sideways_strategy': 'mean_reversion', 'sideways_bb_std_mult': 3.1931846702783027, 'sideways_rsi_os': 47, 'sideways_rsi_ob': 65, 'sideways_adx_thresh': 31.334458359239843, 'sideways_atr_min_pct': 0.0022186591580336933, 'sideways_atr_max_pct': 0.057715171120429946, 'sideways_tp_mult': 2.291882935443238, 'sideways_tsl_mult': 0.1144361681388592, 'sideways_time_stop': 225, 'sideways_use_sma': False, 'sideways_use_ema': True, 'sideways_use_atr': True, 'sideways_use_adx': False, 'sideways_use_spike': True, 'sideways_rsi_required': True}.
[I 2025-09-01 07:33:17,369] Trial 81 finished with values: [-1000000000.0, 1000000000.0] and parameters: {'p_sma': 44, 'p_std': 30, 'p_atr': 18, 'p_adx': 16, 'rsi_period': 64, 'ema1': 21, 'ema2': 35, 'slip_atr_k': 0.09445890179847416, 'slip_spread_k': 0.3729145138130795, 'spread_hl_frac': 0.027931503447295492, 'bb_std_mult': 0.859462324335051, 'rsi_os': 42, 'rsi_ob': 47, 'vol_spike': 0.25346542360420204, 'adx_thresh': 30.562874026819166, 'atr_min_pct': 0.02723409724203027, 'atr_max_pct': 0.139243098231486, 'tp_mult': 1.720487607359077, 'tsl_mult': 0.28601211809922183, 'strategy': 'mean_reversion', 'time_stop': 240, 'use_sma': True, 'use_atr': False, 'use_adx': False, 'use_ema': False, 'use_spike': False, 'rsi_required': False, 'edge_k': 0.2811217018486476, 'edge_cap': 0.24171547868857118, 'bull_strategy': 'breakout', 'bull_bb_std_mult': 3.0774502269618225, 'bull_rsi_os': 26, 'bull_rsi_ob': 57, 'bull_adx_thresh': 17.532351933113915, 'bull_atr_min_pct': 0.029999250019022167, 'bull_atr_max_pct': 0.07776299008994544, 'bull_tp_mult': 1.9676175772441604, 'bull_tsl_mult': 0.021027786900900458, 'bull_time_stop': 195, 'bull_use_sma': True, 'bull_use_ema': False, 'bull_use_atr': True, 'bull_use_adx': True, 'bull_use_spike': False, 'bull_rsi_required': False, 'bear_strategy': 'mean_reversion', 'bear_bb_std_mult': 1.5236181098785937, 'bear_rsi_os': 28, 'bear_rsi_ob': 55, 'bear_adx_thresh': 16.205404457855096, 'bear_atr_min_pct': 0.008848836096119791, 'bear_atr_max_pct': 0.06630408333031644, 'bear_tp_mult': 2.9818634105394928, 'bear_tsl_mult': 0.4093469096667013, 'bear_time_stop': 123, 'bear_use_sma': True, 'bear_use_ema': False, 'bear_use_atr': False, 'bear_use_adx': True, 'bear_use_spike': True, 'bear_rsi_required': True, 'sideways_strategy': 'mean_reversion', 'sideways_bb_std_mult': 2.518643490127574, 'sideways_rsi_os': 33, 'sideways_rsi_ob': 83, 'sideways_adx_thresh': 28.201516741533712, 'sideways_atr_min_pct': 0.027018153514069394, 'sideways_atr_max_pct': 0.014410529389215929, 'sideways_tp_mult': 2.802651808836047, 'sideways_tsl_mult': 0.25830313319395026, 'sideways_time_stop': 244, 'sideways_use_sma': False, 'sideways_use_ema': False, 'sideways_use_atr': True, 'sideways_use_adx': True, 'sideways_use_spike': False, 'sideways_rsi_required': True}.
[I 2025-09-01 07:33:57,599] Trial 82 finished with values: [-1000000000.0, 1000000000.0] and parameters: {'p_sma': 49, 'p_std': 42, 'p_atr': 21, 'p_adx': 14, 'rsi_period': 44, 'ema1': 22, 'ema2': 17, 'slip_atr_k': 0.05687587635711387, 'slip_spread_k': 0.8625926090144783, 'spread_hl_frac': 0.0018902329888454347, 'bb_std_mult': 3.574288393209631, 'rsi_os': 16, 'rsi_ob': 58, 'vol_spike': 0.21564942868116027, 'adx_thresh': 23.834839533668518, 'atr_min_pct': 0.0014752890325103584, 'atr_max_pct': 0.11353787946742355, 'tp_mult': 1.2738957544716054, 'tsl_mult': 0.393831426357258, 'strategy': 'mean_reversion', 'time_stop': 172, 'use_sma': False, 'use_atr': False, 'use_adx': False, 'use_ema': False, 'use_spike': False, 'rsi_required': True, 'edge_k': 1.3457605787266411, 'edge_cap': 0.10658184224480438, 'bull_strategy': 'breakout', 'bull_bb_std_mult': 2.4730782903945494, 'bull_rsi_os': 53, 'bull_rsi_ob': 84, 'bull_adx_thresh': 14.342209038164142, 'bull_atr_min_pct': 0.02738517030877865, 'bull_atr_max_pct': 0.010108137822506538, 'bull_tp_mult': 1.3402166346667193, 'bull_tsl_mult': 0.2557825735329321, 'bull_time_stop': 299, 'bull_use_sma': True, 'bull_use_ema': True, 'bull_use_atr': True, 'bull_use_adx': False, 'bull_use_spike': True, 'bull_rsi_required': False, 'bear_strategy': 'mean_reversion', 'bear_bb_std_mult': 2.2603859213055655, 'bear_rsi_os': 36, 'bear_rsi_ob': 50, 'bear_adx_thresh': 10.770047602209022, 'bear_atr_min_pct': 0.021039883045363583, 'bear_atr_max_pct': 0.07028188866530113, 'bear_tp_mult': 2.669064857319858, 'bear_tsl_mult': 0.0720430253891915, 'bear_time_stop': 110, 'bear_use_sma': True, 'bear_use_ema': False, 'bear_use_atr': True, 'bear_use_adx': False, 'bear_use_spike': False, 'bear_rsi_required': False, 'sideways_strategy': 'breakout', 'sideways_bb_std_mult': 0.5492123985105719, 'sideways_rsi_os': 11, 'sideways_rsi_ob': 51, 'sideways_adx_thresh': 24.467852651278655, 'sideways_atr_min_pct': 0.011744333899753677, 'sideways_atr_max_pct': 0.08596229380122228, 'sideways_tp_mult': 1.431141173470238, 'sideways_tsl_mult': 0.4798295905233266, 'sideways_time_stop': 37, 'sideways_use_sma': True, 'sideways_use_ema': False, 'sideways_use_atr': False, 'sideways_use_adx': False, 'sideways_use_spike': True, 'sideways_rsi_required': True}.
[I 2025-09-01 07:33:57,598] Trial 80 finished with values: [-1000000000.0, 1000000000.0] and parameters: {'p_sma': 54, 'p_std': 30, 'p_atr': 18, 'p_adx': 14, 'rsi_period': 44, 'ema1': 24, 'ema2': 22, 'slip_atr_k': 0.0733987687902257, 'slip_spread_k': 0.5482685048927571, 'spread_hl_frac': 0.004451634015294869, 'bb_std_mult': 0.8816089741258242, 'rsi_os': 43, 'rsi_ob': 78, 'vol_spike': 0.21531677709428695, 'adx_thresh': 23.819741737044563, 'atr_min_pct': 0.02722861461112389, 'atr_max_pct': 0.13958299435192803, 'tp_mult': 1.2598323332620853, 'tsl_mult': 0.41911271087001545, 'strategy': 'mean_reversion', 'time_stop': 172, 'use_sma': False, 'use_atr': False, 'use_adx': False, 'use_ema': False, 'use_spike': False, 'rsi_required': False, 'edge_k': 1.3570946294053885, 'edge_cap': 0.11892264424351268, 'bull_strategy': 'breakout', 'bull_bb_std_mult': 3.1430538984380596, 'bull_rsi_os': 36, 'bull_rsi_ob': 68, 'bull_adx_thresh': 20.816764222003606, 'bull_atr_min_pct': 0.005932007549823452, 'bull_atr_max_pct': 0.13526861823354824, 'bull_tp_mult': 1.9770783050815717, 'bull_tsl_mult': 0.04251117738350976, 'bull_time_stop': 196, 'bull_use_sma': True, 'bull_use_ema': True, 'bull_use_atr': True, 'bull_use_adx': False, 'bull_use_spike': True, 'bull_rsi_required': False, 'bear_strategy': 'mean_reversion', 'bear_bb_std_mult': 3.270490910215513, 'bear_rsi_os': 16, 'bear_rsi_ob': 55, 'bear_adx_thresh': 33.411729185704296, 'bear_atr_min_pct': 0.018937259679534912, 'bear_atr_max_pct': 0.06995819968629866, 'bear_tp_mult': 1.2255639942595797, 'bear_tsl_mult': 0.42503122380639086, 'bear_time_stop': 89, 'bear_use_sma': True, 'bear_use_ema': False, 'bear_use_atr': False, 'bear_use_adx': True, 'bear_use_spike': False, 'bear_rsi_required': True, 'sideways_strategy': 'mean_reversion', 'sideways_bb_std_mult': 1.045030418830846, 'sideways_rsi_os': 6, 'sideways_rsi_ob': 52, 'sideways_adx_thresh': 31.796398818668855, 'sideways_atr_min_pct': 0.0029063659416723453, 'sideways_atr_max_pct': 0.054398912559816, 'sideways_tp_mult': 1.4309192048007489, 'sideways_tsl_mult': 0.9960828712191414, 'sideways_time_stop': 37, 'sideways_use_sma': False, 'sideways_use_ema': False, 'sideways_use_atr': True, 'sideways_use_adx': True, 'sideways_use_spike': True, 'sideways_rsi_required': True}.
