[I 2025-09-01 08:25:37,378] Trial 371 finished with values: [-1000000000.0, 1000000000.0] and parameters: {'p_sma': 28, 'p_std': 58, 'p_atr': 23, 'p_adx': 14, 'rsi_period': 59, 'ema1': 15, 'ema2': 56, 'slip_atr_k': 0.1698979069391876, 'slip_spread_k': 0.9510065037405027, 'spread_hl_frac': 0.015263127865835242, 'bb_std_mult': 2.057968290602962, 'rsi_os': 24, 'rsi_ob': 93, 'vol_spike': 0.06261981153207578, 'adx_thresh': 25.63812805285653, 'atr_min_pct': 0.0028756599197499308, 'atr_max_pct': 0.13758609424377474, 'tp_mult': 1.7134819736669291, 'tsl_mult': 0.0011277147187241099, 'strategy': 'breakout', 'time_stop': 243, 'use_sma': True, 'use_atr': False, 'use_adx': True, 'use_ema': True, 'use_spike': True, 'rsi_required': False, 'edge_k': 0.1290049101739512, 'edge_cap': 0.45601274942900377, 'bull_strategy': 'breakout', 'bull_bb_std_mult': 2.776778908867676, 'bull_rsi_os': 29, 'bull_rsi_ob': 47, 'bull_adx_thresh': 17.846574785226117, 'bull_atr_min_pct': 0.004174960007432964, 'bull_atr_max_pct': 0.021599480164046135, 'bull_tp_mult': 1.5396720751810427, 'bull_tsl_mult': 0.897149150124092, 'bull_time_stop': 103, 'bull_use_sma': False, 'bull_use_ema': False, 'bull_use_atr': False, 'bull_use_adx': False, 'bull_use_spike': False, 'bull_rsi_required': True, 'bear_strategy': 'breakout', 'bear_bb_std_mult': 2.107835072897759, 'bear_rsi_os': 46, 'bear_rsi_ob': 57, 'bear_adx_thresh': 5.643404468917516, 'bear_atr_min_pct': 0.019983469915425607, 'bear_atr_max_pct': 0.09797371008342776, 'bear_tp_mult': 2.0672756520601623, 'bear_tsl_mult': 0.6943830981532495, 'bear_time_stop': 148, 'bear_use_sma': False, 'bear_use_ema': False, 'bear_use_atr': True, 'bear_use_adx': False, 'bear_use_spike': False, 'bear_rsi_required': False, 'sideways_strategy': 'breakout', 'sideways_bb_std_mult': 1.3514734592148354, 'sideways_rsi_os': 51, 'sideways_rsi_ob': 92, 'sideways_adx_thresh': 16.444713414403317, 'sideways_atr_min_pct': 0.0272332032717266, 'sideways_atr_max_pct': 0.08942180834774781, 'sideways_tp_mult': 1.479911015078508, 'sideways_tsl_mult': 0.15621963987095785, 'sideways_time_stop': 151, 'sideways_use_sma': False, 'sideways_use_ema': True, 'sideways_use_atr': True, 'sideways_use_adx': True, 'sideways_use_spike': False, 'sideways_rsi_required': False}.
[I 2025-09-01 08:25:37,427] Trial 369 finished with values: [-0.008798678346312094, 0.008929108197911418] and parameters: {'p_sma': 27, 'p_std': 37, 'p_atr': 20, 'p_adx': 16, 'rsi_period': 59, 'ema1': 10, 'ema2': 20, 'slip_atr_k': 0.18748740702627462, 'slip_spread_k': 0.9795608402917724, 'spread_hl_frac': 0.017511031678382125, 'bb_std_mult': 2.169772828781335, 'rsi_os': 32, 'rsi_ob': 90, 'vol_spike': 0.06453555274561265, 'adx_thresh': 30.26689081588268, 'atr_min_pct': 0.005552192599077227, 'atr_max_pct': 0.13631095594391476, 'tp_mult': 1.7037122294711702, 'tsl_mult': 0.07350864611033256, 'strategy': 'breakout', 'time_stop': 242, 'use_sma': True, 'use_atr': False, 'use_adx': True, 'use_ema': True, 'use_spike': True, 'rsi_required': True, 'edge_k': 1.7297271886773302, 'edge_cap': 0.13800776944066157, 'bull_strategy': 'breakout', 'bull_bb_std_mult': 2.8020848183204885, 'bull_rsi_os': 25, 'bull_rsi_ob': 46, 'bull_adx_thresh': 8.913097171843061, 'bull_atr_min_pct': 0.0032177895323435785, 'bull_atr_max_pct': 0.14594771975501464, 'bull_tp_mult': 2.0603873808187316, 'bull_tsl_mult': 0.6246714362952632, 'bull_time_stop': 100, 'bull_use_sma': False, 'bull_use_ema': False, 'bull_use_atr': False, 'bull_use_adx': False, 'bull_use_spike': False, 'bull_rsi_required': True, 'bear_strategy': 'breakout', 'bear_bb_std_mult': 2.117177237675235, 'bear_rsi_os': 46, 'bear_rsi_ob': 77, 'bear_adx_thresh': 5.619482043357098, 'bear_atr_min_pct': 0.007466026055589454, 'bear_atr_max_pct': 0.0976186423455181, 'bear_tp_mult': 2.0735886172895364, 'bear_tsl_mult': 0.6735788422712244, 'bear_time_stop': 294, 'bear_use_sma': False, 'bear_use_ema': False, 'bear_use_atr': True, 'bear_use_adx': False, 'bear_use_spike': False, 'bear_rsi_required': False, 'sideways_strategy': 'breakout', 'sideways_bb_std_mult': 0.8753663192478269, 'sideways_rsi_os': 6, 'sideways_rsi_ob': 62, 'sideways_adx_thresh': 16.33428345947448, 'sideways_atr_min_pct': 0.027259218278282617, 'sideways_atr_max_pct': 0.0443232902960639, 'sideways_tp_mult': 1.8525161427565109, 'sideways_tsl_mult': 0.9995599015890333, 'sideways_time_stop': 213, 'sideways_use_sma': True, 'sideways_use_ema': True, 'sideways_use_atr': True, 'sideways_use_adx': True, 'sideways_use_spike': False, 'sideways_rsi_required': False}.
[I 2025-09-01 08:25:37,912] Trial 370 finished with values: [-0.017561502191367095, 0.017370141725528993] and parameters: {'p_sma': 28, 'p_std': 59, 'p_atr': 19, 'p_adx': 30, 'rsi_period': 62, 'ema1': 17, 'ema2': 42, 'slip_atr_k': 0.1872451360533018, 'slip_spread_k': 0.20682690070632842, 'spread_hl_frac': 0.03399121962670629, 'bb_std_mult': 1.9425145061190898, 'rsi_os': 32, 'rsi_ob': 90, 'vol_spike': 0.06393172570906676, 'adx_thresh': 19.457335111840344, 'atr_min_pct': 0.01942284345915161, 'atr_max_pct': 0.13541042714073526, 'tp_mult': 2.7089955483818517, 'tsl_mult': 0.0726248720414172, 'strategy': 'mean_reversion', 'time_stop': 249, 'use_sma': True, 'use_atr': False, 'use_adx': True, 'use_ema': True, 'use_spike': True, 'rsi_required': True, 'edge_k': 0.12252858712744356, 'edge_cap': 0.13955209326159587, 'bull_strategy': 'breakout', 'bull_bb_std_mult': 2.9738309000219285, 'bull_rsi_os': 35, 'bull_rsi_ob': 75, 'bull_adx_thresh': 9.04042796223052, 'bull_atr_min_pct': 0.001835018726801349, 'bull_atr_max_pct': 0.04848953625907826, 'bull_tp_mult': 1.372975252360613, 'bull_tsl_mult': 0.31325992702719363, 'bull_time_stop': 63, 'bull_use_sma': False, 'bull_use_ema': False, 'bull_use_atr': False, 'bull_use_adx': True, 'bull_use_spike': True, 'bull_rsi_required': True, 'bear_strategy': 'breakout', 'bear_bb_std_mult': 0.6764898283062248, 'bear_rsi_os': 46, 'bear_rsi_ob': 89, 'bear_adx_thresh': 5.560529784373696, 'bear_atr_min_pct': 0.023926941730688434, 'bear_atr_max_pct': 0.08069306099060804, 'bear_tp_mult': 2.0545909503497626, 'bear_tsl_mult': 0.9006667777863642, 'bear_time_stop': 295, 'bear_use_sma': False, 'bear_use_ema': False, 'bear_use_atr': True, 'bear_use_adx': False, 'bear_use_spike': False, 'bear_rsi_required': True, 'sideways_strategy': 'breakout', 'sideways_bb_std_mult': 0.8677777121545567, 'sideways_rsi_os': 13, 'sideways_rsi_ob': 94, 'sideways_adx_thresh': 5.963140900921944, 'sideways_atr_min_pct': 0.027301156835583384, 'sideways_atr_max_pct': 0.019918160599139288, 'sideways_tp_mult': 1.2819596820725367, 'sideways_tsl_mult': 0.1610769318749246, 'sideways_time_stop': 60, 'sideways_use_sma': True, 'sideways_use_ema': True, 'sideways_use_atr': True, 'sideways_use_adx': True, 'sideways_use_spike': False, 'sideways_rsi_required': False}.
[I 2025-09-01 08:25:38,090] Trial 372 finished with values: [-1000000000.0, 1000000000.0] and parameters: {'p_sma': 22, 'p_std': 58, 'p_atr': 19, 'p_adx': 30, 'rsi_period': 50, 'ema1': 14, 'ema2': 12, 'slip_atr_k': 0.20357091387473114, 'slip_spread_k': 0.9486694583681606, 'spread_hl_frac': 0.011506323698663012, 'bb_std_mult': 1.94363762727218, 'rsi_os': 21, 'rsi_ob': 55, 'vol_spike': 0.08706005474921244, 'adx_thresh': 25.79390126178977, 'atr_min_pct': 0.01736219208889628, 'atr_max_pct': 0.06820616605379479, 'tp_mult': 1.7243598592086893, 'tsl_mult': 0.015178231688136638, 'strategy': 'breakout', 'time_stop': 244, 'use_sma': True, 'use_atr': True, 'use_adx': True, 'use_ema': True, 'use_spike': True, 'rsi_required': False, 'edge_k': 0.35649361612245395, 'edge_cap': 0.14054594489606936, 'bull_strategy': 'mean_reversion', 'bull_bb_std_mult': 1.3927810119682256, 'bull_rsi_os': 29, 'bull_rsi_ob': 46, 'bull_adx_thresh': 16.06964265996872, 'bull_atr_min_pct': 0.004029624571631506, 'bull_atr_max_pct': 0.04721757791398127, 'bull_tp_mult': 1.548264066798931, 'bull_tsl_mult': 0.3119978450943407, 'bull_time_stop': 102, 'bull_use_sma': False, 'bull_use_ema': False, 'bull_use_atr': False, 'bull_use_adx': False, 'bull_use_spike': False, 'bull_rsi_required': True, 'bear_strategy': 'breakout', 'bear_bb_std_mult': 0.9896899578643139, 'bear_rsi_os': 46, 'bear_rsi_ob': 79, 'bear_adx_thresh': 9.114335504336509, 'bear_atr_min_pct': 0.01594209334669196, 'bear_atr_max_pct': 0.09871091473295657, 'bear_tp_mult': 2.0850093029996417, 'bear_tsl_mult': 0.1319300532095599, 'bear_time_stop': 295, 'bear_use_sma': True, 'bear_use_ema': False, 'bear_use_atr': True, 'bear_use_adx': False, 'bear_use_spike': False, 'bear_rsi_required': False, 'sideways_strategy': 'mean_reversion', 'sideways_bb_std_mult': 1.3269855744188803, 'sideways_rsi_os': 11, 'sideways_rsi_ob': 92, 'sideways_adx_thresh': 11.347478976442742, 'sideways_atr_min_pct': 0.028103677887686276, 'sideways_atr_max_pct': 0.04438946798981811, 'sideways_tp_mult': 1.8481114965570014, 'sideways_tsl_mult': 0.6918854999384109, 'sideways_time_stop': 151, 'sideways_use_sma': False, 'sideways_use_ema': True, 'sideways_use_atr': True, 'sideways_use_adx': True, 'sideways_use_spike': False, 'sideways_rsi_required': False}.
[I 2025-09-01 08:26:20,044] Trial 375 finished with values: [-1000000000.0, 1000000000.0] and parameters: {'p_sma': 51, 'p_std': 36, 'p_atr': 21, 'p_adx': 8, 'rsi_period': 77, 'ema1': 11, 'ema2': 58, 'slip_atr_k': 0.11236949431842899, 'slip_spread_k': 0.8651290541456357, 'spread_hl_frac': 0.008635677141911567, 'bb_std_mult': 1.4951323150835742, 'rsi_os': 5, 'rsi_ob': 72, 'vol_spike': 0.029477496586379142, 'adx_thresh': 29.772184621055082, 'atr_min_pct': 0.023861008598689414, 'atr_max_pct': 0.14986152934766947, 'tp_mult': 1.5853917524135022, 'tsl_mult': 0.2672514422696304, 'strategy': 'breakout', 'time_stop': 255, 'use_sma': False, 'use_atr': False, 'use_adx': True, 'use_ema': False, 'use_spike': True, 'rsi_required': True, 'edge_k': 0.2477310665044483, 'edge_cap': 0.2064798832634509, 'bull_strategy': 'breakout', 'bull_bb_std_mult': 3.205201723130774, 'bull_rsi_os': 37, 'bull_rsi_ob': 51, 'bull_adx_thresh': 7.971270557439707, 'bull_atr_min_pct': 0.026689989128071537, 'bull_atr_max_pct': 0.07829375973896453, 'bull_tp_mult': 2.5668276760658406, 'bull_tsl_mult': 0.650778230976052, 'bull_time_stop': 67, 'bull_use_sma': True, 'bull_use_ema': True, 'bull_use_atr': False, 'bull_use_adx': False, 'bull_use_spike': False, 'bull_rsi_required': False, 'bear_strategy': 'mean_reversion', 'bear_bb_std_mult': 1.8444230280881033, 'bear_rsi_os': 38, 'bear_rsi_ob': 80, 'bear_adx_thresh': 20.329089977609645, 'bear_atr_min_pct': 0.0057915694010575985, 'bear_atr_max_pct': 0.12761283326527612, 'bear_tp_mult': 2.1385291147262016, 'bear_tsl_mult': 0.07996442890318405, 'bear_time_stop': 273, 'bear_use_sma': True, 'bear_use_ema': True, 'bear_use_atr': False, 'bear_use_adx': False, 'bear_use_spike': False, 'bear_rsi_required': False, 'sideways_strategy': 'breakout', 'sideways_bb_std_mult': 0.5919295935154985, 'sideways_rsi_os': 5, 'sideways_rsi_ob': 89, 'sideways_adx_thresh': 15.452064637309135, 'sideways_atr_min_pct': 0.0294557685759563, 'sideways_atr_max_pct': 0.09856992146558616, 'sideways_tp_mult': 2.699603461571153, 'sideways_tsl_mult': 0.05334106389037488, 'sideways_time_stop': 41, 'sideways_use_sma': True, 'sideways_use_ema': False, 'sideways_use_atr': True, 'sideways_use_adx': True, 'sideways_use_spike': False, 'sideways_rsi_required': False}.
[I 2025-09-01 08:26:20,464] Trial 374 finished with values: [-0.010945584415505416, 0.010840290266848952] and parameters: {'p_sma': 29, 'p_std': 10, 'p_atr': 18, 'p_adx': 8, 'rsi_period': 53, 'ema1': 11, 'ema2': 33, 'slip_atr_k': 0.11070517822584262, 'slip_spread_k': 0.25245164201704406, 'spread_hl_frac': 0.007173179604490243, 'bb_std_mult': 2.7240643947774514, 'rsi_os': 19, 'rsi_ob': 55, 'vol_spike': 0.0351980722394714, 'adx_thresh': 34.85173859806612, 'atr_min_pct': 0.01727354423179115, 'atr_max_pct': 0.0550000903650887, 'tp_mult': 1.6132725877251737, 'tsl_mult': 0.2775137909898578, 'strategy': 'breakout', 'time_stop': 85, 'use_sma': False, 'use_atr': True, 'use_adx': True, 'use_ema': False, 'use_spike': True, 'rsi_required': True, 'edge_k': 1.2338972588393877, 'edge_cap': 0.9489397890523598, 'bull_strategy': 'mean_reversion', 'bull_bb_std_mult': 3.1987060913296608, 'bull_rsi_os': 48, 'bull_rsi_ob': 68, 'bull_adx_thresh': 24.840778722210032, 'bull_atr_min_pct': 0.002200035839457614, 'bull_atr_max_pct': 0.04728854813708786, 'bull_tp_mult': 1.6534585540595303, 'bull_tsl_mult': 0.6570187894763121, 'bull_time_stop': 65, 'bull_use_sma': True, 'bull_use_ema': True, 'bull_use_atr': False, 'bull_use_adx': False, 'bull_use_spike': False, 'bull_rsi_required': False, 'bear_strategy': 'mean_reversion', 'bear_bb_std_mult': 1.7760840812844823, 'bear_rsi_os': 30, 'bear_rsi_ob': 45, 'bear_adx_thresh': 13.980019522513878, 'bear_atr_min_pct': 0.011558458996409234, 'bear_atr_max_pct': 0.08168725725614825, 'bear_tp_mult': 2.128774412518991, 'bear_tsl_mult': 0.12591848476936565, 'bear_time_stop': 228, 'bear_use_sma': True, 'bear_use_ema': False, 'bear_use_atr': True, 'bear_use_adx': False, 'bear_use_spike': False, 'bear_rsi_required': False, 'sideways_strategy': 'mean_reversion', 'sideways_bb_std_mult': 0.5838233876318166, 'sideways_rsi_os': 10, 'sideways_rsi_ob': 76, 'sideways_adx_thresh': 11.211996953795305, 'sideways_atr_min_pct': 0.0280355994157205, 'sideways_atr_max_pct': 0.013806718163367685, 'sideways_tp_mult': 1.170773967591781, 'sideways_tsl_mult': 0.22786627980567684, 'sideways_time_stop': 40, 'sideways_use_sma': True, 'sideways_use_ema': False, 'sideways_use_atr': True, 'sideways_use_adx': True, 'sideways_use_spike': False, 'sideways_rsi_required': False}.
[I 2025-09-01 08:26:21,395] Trial 373 finished with values: [-0.058406180276983855, 0.058227801964735364] and parameters: {'p_sma': 29, 'p_std': 10, 'p_atr': 18, 'p_adx': 30, 'rsi_period': 52, 'ema1': 11, 'ema2': 10, 'slip_atr_k': 0.11148653574263999, 'slip_spread_k': 0.999868807001653, 'spread_hl_frac': 0.007034561497489555, 'bb_std_mult': 2.730066059153609, 'rsi_os': 21, 'rsi_ob': 72, 'vol_spike': 0.03157951641128007, 'adx_thresh': 34.89536407061096, 'atr_min_pct': 0.01162965133513985, 'atr_max_pct': 0.07869047555306186, 'tp_mult': 1.5925002058647932, 'tsl_mult': 0.055787951200706315, 'strategy': 'breakout', 'time_stop': 250, 'use_sma': False, 'use_atr': True, 'use_adx': True, 'use_ema': False, 'use_spike': True, 'rsi_required': True, 'edge_k': 0.8846681168208823, 'edge_cap': 0.9629735991636537, 'bull_strategy': 'mean_reversion', 'bull_bb_std_mult': 3.1695669647398406, 'bull_rsi_os': 32, 'bull_rsi_ob': 54, 'bull_adx_thresh': 7.998497632409721, 'bull_atr_min_pct': 0.017166639525704307, 'bull_atr_max_pct': 0.08716773598287014, 'bull_tp_mult': 1.6631565569742606, 'bull_tsl_mult': 0.6537093601710303, 'bull_time_stop': 66, 'bull_use_sma': True, 'bull_use_ema': True, 'bull_use_atr': False, 'bull_use_adx': False, 'bull_use_spike': False, 'bull_rsi_required': False, 'bear_strategy': 'mean_reversion', 'bear_bb_std_mult': 1.8650736415653202, 'bear_rsi_os': 40, 'bear_rsi_ob': 67, 'bear_adx_thresh': 5.989450961987727, 'bear_atr_min_pct': 0.00270570061329122, 'bear_atr_max_pct': 0.025722674683002898, 'bear_tp_mult': 2.128799641920821, 'bear_tsl_mult': 0.12840958565966926, 'bear_time_stop': 244, 'bear_use_sma': True, 'bear_use_ema': False, 'bear_use_atr': True, 'bear_use_adx': False, 'bear_use_spike': False, 'bear_rsi_required': False, 'sideways_strategy': 'mean_reversion', 'sideways_bb_std_mult': 0.5703290311451605, 'sideways_rsi_os': 10, 'sideways_rsi_ob': 94, 'sideways_adx_thresh': 11.02728150090878, 'sideways_atr_min_pct': 0.02950225912682831, 'sideways_atr_max_pct': 0.13246595545074907, 'sideways_tp_mult': 1.3536377135702025, 'sideways_tsl_mult': 0.34040974791162937, 'sideways_time_stop': 138, 'sideways_use_sma': True, 'sideways_use_ema': False, 'sideways_use_atr': True, 'sideways_use_adx': True, 'sideways_use_spike': False, 'sideways_rsi_required': False}.
[I 2025-09-01 08:26:21,812] Trial 376 finished with values: [-1000000000.0, 1000000000.0] and parameters: {'p_sma': 29, 'p_std': 51, 'p_atr': 21, 'p_adx': 22, 'rsi_period': 17, 'ema1': 22, 'ema2': 10, 'slip_atr_k': 0.1293368834420368, 'slip_spread_k': 0.8722246398064645, 'spread_hl_frac': 0.019578867880989347, 'bb_std_mult': 2.2664100422125704, 'rsi_os': 14, 'rsi_ob': 72, 'vol_spike': 0.05248256694272642, 'adx_thresh': 16.444730716145585, 'atr_min_pct': 0.004553242655275175, 'atr_max_pct': 0.13003366903699404, 'tp_mult': 1.1692293246125485, 'tsl_mult': 0.07072578594373527, 'strategy': 'breakout', 'time_stop': 255, 'use_sma': False, 'use_atr': False, 'use_adx': True, 'use_ema': False, 'use_spike': True, 'rsi_required': True, 'edge_k': 0.2571556828998157, 'edge_cap': 0.20384230759769148, 'bull_strategy': 'breakout', 'bull_bb_std_mult': 2.8865675343871433, 'bull_rsi_os': 42, 'bull_rsi_ob': 54, 'bull_adx_thresh': 17.005052203094266, 'bull_atr_min_pct': 0.003988965284254088, 'bull_atr_max_pct': 0.02608860183894446, 'bull_tp_mult': 1.6559509619397854, 'bull_tsl_mult': 0.5842104392912533, 'bull_time_stop': 89, 'bull_use_sma': True, 'bull_use_ema': True, 'bull_use_atr': False, 'bull_use_adx': False, 'bull_use_spike': False, 'bull_rsi_required': False, 'bear_strategy': 'mean_reversion', 'bear_bb_std_mult': 1.8536739925614223, 'bear_rsi_os': 9, 'bear_rsi_ob': 80, 'bear_adx_thresh': 13.779219863010177, 'bear_atr_min_pct': 0.0032016377517480334, 'bear_atr_max_pct': 0.09444914693021209, 'bear_tp_mult': 2.1419302031868046, 'bear_tsl_mult': 0.0819474236526622, 'bear_time_stop': 287, 'bear_use_sma': True, 'bear_use_ema': True, 'bear_use_atr': False, 'bear_use_adx': False, 'bear_use_spike': False, 'bear_rsi_required': False, 'sideways_strategy': 'breakout', 'sideways_bb_std_mult': 1.0351569203379514, 'sideways_rsi_os': 5, 'sideways_rsi_ob': 89, 'sideways_adx_thresh': 15.250975561403472, 'sideways_atr_min_pct': 0.029477787445064182, 'sideways_atr_max_pct': 0.13408798186666418, 'sideways_tp_mult': 1.1602042969268564, 'sideways_tsl_mult': 0.3304823733363168, 'sideways_time_stop': 206, 'sideways_use_sma': True, 'sideways_use_ema': False, 'sideways_use_atr': True, 'sideways_use_adx': True, 'sideways_use_spike': False, 'sideways_rsi_required': False}.
[I 2025-09-01 08:27:06,232] Trial 378 finished with values: [-0.06316111731459895, 0.06396642221698123] and parameters: {'p_sma': 30, 'p_std': 6, 'p_atr': 22, 'p_adx': 23, 'rsi_period': 14, 'ema1': 13, 'ema2': 13, 'slip_atr_k': 0.21584885207094023, 'slip_spread_k': 0.8827357123375035, 'spread_hl_frac': 0.009872023910795372, 'bb_std_mult': 2.4640604193436584, 'rsi_os': 31, 'rsi_ob': 88, 'vol_spike': 0.07590015864256873, 'adx_thresh': 16.65893070887535, 'atr_min_pct': 0.011518623730944892, 'atr_max_pct': 0.13219191349587459, 'tp_mult': 2.028128243549139, 'tsl_mult': 0.05461165008207934, 'strategy': 'breakout', 'time_stop': 224, 'use_sma': False, 'use_atr': False, 'use_adx': True, 'use_ema': True, 'use_spike': True, 'rsi_required': True, 'edge_k': 0.8887465502060976, 'edge_cap': 0.19897143557376545, 'bull_strategy': 'breakout', 'bull_bb_std_mult': 2.862945900368324, 'bull_rsi_os': 9, 'bull_rsi_ob': 88, 'bull_adx_thresh': 33.8823997654825, 'bull_atr_min_pct': 0.005048655247327118, 'bull_atr_max_pct': 0.08731585166313208, 'bull_tp_mult': 1.5190186927179985, 'bull_tsl_mult': 0.5948002038141627, 'bull_time_stop': 91, 'bull_use_sma': True, 'bull_use_ema': True, 'bull_use_atr': False, 'bull_use_adx': False, 'bull_use_spike': False, 'bull_rsi_required': False, 'bear_strategy': 'mean_reversion', 'bear_bb_std_mult': 1.7609270990558725, 'bear_rsi_os': 49, 'bear_rsi_ob': 67, 'bear_adx_thresh': 6.000209195321676, 'bear_atr_min_pct': 0.004896267738990496, 'bear_atr_max_pct': 0.0939263267633535, 'bear_tp_mult': 2.193779371943328, 'bear_tsl_mult': 0.06332872610496919, 'bear_time_stop': 36, 'bear_use_sma': True, 'bear_use_ema': False, 'bear_use_atr': False, 'bear_use_adx': True, 'bear_use_spike': False, 'bear_rsi_required': False, 'sideways_strategy': 'breakout', 'sideways_bb_std_mult': 0.9532465777181341, 'sideways_rsi_os': 6, 'sideways_rsi_ob': 93, 'sideways_adx_thresh': 10.383541075477831, 'sideways_atr_min_pct': 0.0035836997086432353, 'sideways_atr_max_pct': 0.1325167340939134, 'sideways_tp_mult': 2.122430746899031, 'sideways_tsl_mult': 0.7316582189679015, 'sideways_time_stop': 161, 'sideways_use_sma': True, 'sideways_use_ema': True, 'sideways_use_atr': True, 'sideways_use_adx': True, 'sideways_use_spike': False, 'sideways_rsi_required': False}.
