[I 2025-09-01 08:35:13,979] Trial 426 finished with values: [-1000000000.0, 1000000000.0] and parameters: {'p_sma': 32, 'p_std': 57, 'p_atr': 22, 'p_adx': 18, 'rsi_period': 53, 'ema1': 17, 'ema2': 24, 'slip_atr_k': 0.03360567637203359, 'slip_spread_k': 0.9397370030061929, 'spread_hl_frac': 0.012109465706793091, 'bb_std_mult': 2.0026668891163153, 'rsi_os': 14, 'rsi_ob': 93, 'vol_spike': 0.046326726628240195, 'adx_thresh': 9.391879951446786, 'atr_min_pct': 0.0029678016116282584, 'atr_max_pct': 0.1334531007989314, 'tp_mult': 1.650460594833778, 'tsl_mult': 0.5040060631222153, 'strategy': 'mean_reversion', 'time_stop': 262, 'use_sma': False, 'use_atr': False, 'use_adx': True, 'use_ema': True, 'use_spike': False, 'rsi_required': True, 'edge_k': 0.2526027219866883, 'edge_cap': 0.1579884828219535, 'bull_strategy': 'breakout', 'bull_bb_std_mult': 3.0302516260528654, 'bull_rsi_os': 36, 'bull_rsi_ob': 47, 'bull_adx_thresh': 7.574620864238821, 'bull_atr_min_pct': 0.005837182432435868, 'bull_atr_max_pct': 0.07301019650356766, 'bull_tp_mult': 2.0303199646902987, 'bull_tsl_mult': 0.24867391083979834, 'bull_time_stop': 282, 'bull_use_sma': True, 'bull_use_ema': False, 'bull_use_atr': False, 'bull_use_adx': True, 'bull_use_spike': False, 'bull_rsi_required': False, 'bear_strategy': 'mean_reversion', 'bear_bb_std_mult': 2.2467429434663595, 'bear_rsi_os': 33, 'bear_rsi_ob': 81, 'bear_adx_thresh': 6.276523259162308, 'bear_atr_min_pct': 0.004189360418952812, 'bear_atr_max_pct': 0.09310986040133501, 'bear_tp_mult': 2.0403287645141317, 'bear_tsl_mult': 0.09621248497918547, 'bear_time_stop': 183, 'bear_use_sma': True, 'bear_use_ema': True, 'bear_use_atr': False, 'bear_use_adx': False, 'bear_use_spike': False, 'bear_rsi_required': True, 'sideways_strategy': 'mean_reversion', 'sideways_bb_std_mult': 1.0134177528949628, 'sideways_rsi_os': 6, 'sideways_rsi_ob': 64, 'sideways_adx_thresh': 20.842558205331073, 'sideways_atr_min_pct': 0.02931158052220728, 'sideways_atr_max_pct': 0.127346072448957, 'sideways_tp_mult': 1.2353360729515934, 'sideways_tsl_mult': 0.16351624190809627, 'sideways_time_stop': 58, 'sideways_use_sma': True, 'sideways_use_ema': True, 'sideways_use_atr': True, 'sideways_use_adx': True, 'sideways_use_spike': False, 'sideways_rsi_required': False}.
[I 2025-09-01 08:35:14,007] Trial 424 finished with values: [-1000000000.0, 1000000000.0] and parameters: {'p_sma': 33, 'p_std': 57, 'p_atr': 21, 'p_adx': 29, 'rsi_period': 68, 'ema1': 11, 'ema2': 13, 'slip_atr_k': 0.006943243848738237, 'slip_spread_k': 0.8748186530122195, 'spread_hl_frac': 0.012205303982980384, 'bb_std_mult': 1.9922860475548139, 'rsi_os': 32, 'rsi_ob': 93, 'vol_spike': 0.0536958780794767, 'adx_thresh': 29.9448122951646, 'atr_min_pct': 0.005807886579376475, 'atr_max_pct': 0.10616328396437939, 'tp_mult': 2.079899863956482, 'tsl_mult': 0.338726268198831, 'strategy': 'breakout', 'time_stop': 283, 'use_sma': False, 'use_atr': True, 'use_adx': True, 'use_ema': True, 'use_spike': True, 'rsi_required': True, 'edge_k': 1.61669122788504, 'edge_cap': 0.23058965538328777, 'bull_strategy': 'mean_reversion', 'bull_bb_std_mult': 2.601234327343556, 'bull_rsi_os': 46, 'bull_rsi_ob': 51, 'bull_adx_thresh': 34.80650530822941, 'bull_atr_min_pct': 0.022013848252587898, 'bull_atr_max_pct': 0.05096711476586123, 'bull_tp_mult': 2.6053652881255975, 'bull_tsl_mult': 0.2524889766847615, 'bull_time_stop': 50, 'bull_use_sma': True, 'bull_use_ema': True, 'bull_use_atr': False, 'bull_use_adx': False, 'bull_use_spike': False, 'bull_rsi_required': False, 'bear_strategy': 'mean_reversion', 'bear_bb_std_mult': 2.6155110622452438, 'bear_rsi_os': 44, 'bear_rsi_ob': 78, 'bear_adx_thresh': 5.567070237255709, 'bear_atr_min_pct': 0.014009476602853805, 'bear_atr_max_pct': 0.09484271253689554, 'bear_tp_mult': 2.16961891882416, 'bear_tsl_mult': 0.06737744677045229, 'bear_time_stop': 134, 'bear_use_sma': True, 'bear_use_ema': True, 'bear_use_atr': True, 'bear_use_adx': False, 'bear_use_spike': False, 'bear_rsi_required': False, 'sideways_strategy': 'mean_reversion', 'sideways_bb_std_mult': 0.7700889293731721, 'sideways_rsi_os': 8, 'sideways_rsi_ob': 52, 'sideways_adx_thresh': 12.717742226198897, 'sideways_atr_min_pct': 0.024658776624889064, 'sideways_atr_max_pct': 0.012727683008468464, 'sideways_tp_mult': 1.240313395442284, 'sideways_tsl_mult': 0.1120526805630562, 'sideways_time_stop': 104, 'sideways_use_sma': True, 'sideways_use_ema': True, 'sideways_use_atr': True, 'sideways_use_adx': True, 'sideways_use_spike': False, 'sideways_rsi_required': False}.
[I 2025-09-01 08:35:14,406] Trial 423 finished with values: [-1000000000.0, 1000000000.0] and parameters: {'p_sma': 32, 'p_std': 57, 'p_atr': 22, 'p_adx': 29, 'rsi_period': 71, 'ema1': 11, 'ema2': 47, 'slip_atr_k': 0.011010145602080473, 'slip_spread_k': 0.936448510964102, 'spread_hl_frac': 0.0121284863517327, 'bb_std_mult': 2.1150817722982604, 'rsi_os': 39, 'rsi_ob': 50, 'vol_spike': 0.26438883201825836, 'adx_thresh': 26.950824232877924, 'atr_min_pct': 0.0031385147365919717, 'atr_max_pct': 0.13329513934564077, 'tp_mult': 1.6742104866882188, 'tsl_mult': 0.0702386974209964, 'strategy': 'breakout', 'time_stop': 259, 'use_sma': False, 'use_atr': True, 'use_adx': True, 'use_ema': True, 'use_spike': True, 'rsi_required': True, 'edge_k': 0.26630769096965246, 'edge_cap': 0.23329788135254168, 'bull_strategy': 'mean_reversion', 'bull_bb_std_mult': 1.5349523134128482, 'bull_rsi_os': 25, 'bull_rsi_ob': 51, 'bull_adx_thresh': 5.884999414179546, 'bull_atr_min_pct': 0.0032607972446900705, 'bull_atr_max_pct': 0.05779037961112576, 'bull_tp_mult': 1.4329253792816712, 'bull_tsl_mult': 0.08448521936617609, 'bull_time_stop': 194, 'bull_use_sma': True, 'bull_use_ema': True, 'bull_use_atr': False, 'bull_use_adx': False, 'bull_use_spike': False, 'bull_rsi_required': False, 'bear_strategy': 'mean_reversion', 'bear_bb_std_mult': 2.252560540592574, 'bear_rsi_os': 22, 'bear_rsi_ob': 78, 'bear_adx_thresh': 5.708102273053054, 'bear_atr_min_pct': 0.0025291128720547305, 'bear_atr_max_pct': 0.08986704109485938, 'bear_tp_mult': 2.2525075082061976, 'bear_tsl_mult': 0.0648295069727281, 'bear_time_stop': 143, 'bear_use_sma': True, 'bear_use_ema': True, 'bear_use_atr': True, 'bear_use_adx': False, 'bear_use_spike': False, 'bear_rsi_required': False, 'sideways_strategy': 'mean_reversion', 'sideways_bb_std_mult': 0.9845430210199979, 'sideways_rsi_os': 8, 'sideways_rsi_ob': 88, 'sideways_adx_thresh': 18.389499590870994, 'sideways_atr_min_pct': 0.023147393822422823, 'sideways_atr_max_pct': 0.012306137384676043, 'sideways_tp_mult': 2.6740179661983223, 'sideways_tsl_mult': 0.11959553107232923, 'sideways_time_stop': 33, 'sideways_use_sma': True, 'sideways_use_ema': True, 'sideways_use_atr': True, 'sideways_use_adx': True, 'sideways_use_spike': False, 'sideways_rsi_required': False}.
[I 2025-09-01 08:35:14,607] Trial 425 finished with values: [-0.002527720327236249, 0.00312549056493456] and parameters: {'p_sma': 32, 'p_std': 57, 'p_atr': 13, 'p_adx': 10, 'rsi_period': 55, 'ema1': 17, 'ema2': 13, 'slip_atr_k': 0.0002990571187096712, 'slip_spread_k': 0.9302843999996615, 'spread_hl_frac': 0.011840107036498664, 'bb_std_mult': 2.39676098251143, 'rsi_os': 32, 'rsi_ob': 93, 'vol_spike': 0.26235079366312875, 'adx_thresh': 9.467304067806124, 'atr_min_pct': 0.005673812077858936, 'atr_max_pct': 0.11764250038593477, 'tp_mult': 1.6592892922312525, 'tsl_mult': 0.07850514590263341, 'strategy': 'mean_reversion', 'time_stop': 261, 'use_sma': False, 'use_atr': False, 'use_adx': True, 'use_ema': True, 'use_spike': False, 'rsi_required': True, 'edge_k': 1.2891415147581518, 'edge_cap': 0.15192711679894103, 'bull_strategy': 'breakout', 'bull_bb_std_mult': 2.6143060973114927, 'bull_rsi_os': 36, 'bull_rsi_ob': 49, 'bull_adx_thresh': 12.998205706607255, 'bull_atr_min_pct': 0.003237833004017884, 'bull_atr_max_pct': 0.07292995696957173, 'bull_tp_mult': 1.4266600504413307, 'bull_tsl_mult': 0.9982989435186493, 'bull_time_stop': 32, 'bull_use_sma': True, 'bull_use_ema': False, 'bull_use_atr': False, 'bull_use_adx': True, 'bull_use_spike': False, 'bull_rsi_required': False, 'bear_strategy': 'mean_reversion', 'bear_bb_std_mult': 1.8367857679430821, 'bear_rsi_os': 44, 'bear_rsi_ob': 49, 'bear_adx_thresh': 5.542325961641031, 'bear_atr_min_pct': 0.006221454438853434, 'bear_atr_max_pct': 0.08954562954274395, 'bear_tp_mult': 2.752409566688332, 'bear_tsl_mult': 0.03271941710338676, 'bear_time_stop': 144, 'bear_use_sma': True, 'bear_use_ema': True, 'bear_use_atr': False, 'bear_use_adx': False, 'bear_use_spike': False, 'bear_rsi_required': True, 'sideways_strategy': 'mean_reversion', 'sideways_bb_std_mult': 1.0077887198631448, 'sideways_rsi_os': 6, 'sideways_rsi_ob': 64, 'sideways_adx_thresh': 8.013420755825292, 'sideways_atr_min_pct': 0.02662000288799289, 'sideways_atr_max_pct': 0.012293329499468812, 'sideways_tp_mult': 1.535605359509432, 'sideways_tsl_mult': 0.8416214658688408, 'sideways_time_stop': 79, 'sideways_use_sma': True, 'sideways_use_ema': True, 'sideways_use_atr': True, 'sideways_use_adx': True, 'sideways_use_spike': False, 'sideways_rsi_required': True}.
[I 2025-09-01 08:36:00,601] Trial 428 finished with values: [-1000000000.0, 1000000000.0] and parameters: {'p_sma': 28, 'p_std': 55, 'p_atr': 15, 'p_adx': 30, 'rsi_period': 64, 'ema1': 12, 'ema2': 10, 'slip_atr_k': 0.057281772272059904, 'slip_spread_k': 0.9182695956444209, 'spread_hl_frac': 0.026168125832435492, 'bb_std_mult': 2.1414358495485777, 'rsi_os': 15, 'rsi_ob': 50, 'vol_spike': 0.06288279722161952, 'adx_thresh': 12.308533603472046, 'atr_min_pct': 0.004007861921923467, 'atr_max_pct': 0.12045226783400781, 'tp_mult': 1.6783343010078369, 'tsl_mult': 0.07754685011595129, 'strategy': 'breakout', 'time_stop': 5, 'use_sma': False, 'use_atr': False, 'use_adx': True, 'use_ema': True, 'use_spike': True, 'rsi_required': True, 'edge_k': 0.17815453851501054, 'edge_cap': 0.19871090203983152, 'bull_strategy': 'breakout', 'bull_bb_std_mult': 2.7072561906280352, 'bull_rsi_os': 55, 'bull_rsi_ob': 49, 'bull_adx_thresh': 33.45923096099373, 'bull_atr_min_pct': 0.0032055458029204994, 'bull_atr_max_pct': 0.057231710871267084, 'bull_tp_mult': 1.441898824069987, 'bull_tsl_mult': 0.5557427189493186, 'bull_time_stop': 93, 'bull_use_sma': True, 'bull_use_ema': False, 'bull_use_atr': False, 'bull_use_adx': False, 'bull_use_spike': False, 'bull_rsi_required': False, 'bear_strategy': 'mean_reversion', 'bear_bb_std_mult': 1.8321469551217724, 'bear_rsi_os': 22, 'bear_rsi_ob': 80, 'bear_adx_thresh': 24.04951956251756, 'bear_atr_min_pct': 0.0026338559891108523, 'bear_atr_max_pct': 0.09015767772080902, 'bear_tp_mult': 2.287091729316705, 'bear_tsl_mult': 0.03201373084424206, 'bear_time_stop': 283, 'bear_use_sma': False, 'bear_use_ema': False, 'bear_use_atr': False, 'bear_use_adx': False, 'bear_use_spike': False, 'bear_rsi_required': False, 'sideways_strategy': 'breakout', 'sideways_bb_std_mult': 0.9827262460680184, 'sideways_rsi_os': 5, 'sideways_rsi_ob': 92, 'sideways_adx_thresh': 7.940182208137738, 'sideways_atr_min_pct': 0.026635406866707435, 'sideways_atr_max_pct': 0.14521354621784444, 'sideways_tp_mult': 1.425817504240774, 'sideways_tsl_mult': 0.8534083381749314, 'sideways_time_stop': 217, 'sideways_use_sma': True, 'sideways_use_ema': True, 'sideways_use_atr': True, 'sideways_use_adx': True, 'sideways_use_spike': False, 'sideways_rsi_required': True}.
[I 2025-09-01 08:36:01,052] Trial 430 finished with values: [-1000000000.0, 1000000000.0] and parameters: {'p_sma': 30, 'p_std': 55, 'p_atr': 23, 'p_adx': 16, 'rsi_period': 65, 'ema1': 12, 'ema2': 12, 'slip_atr_k': 0.003380195359072139, 'slip_spread_k': 0.8553526908733938, 'spread_hl_frac': 0.025966348585327603, 'bb_std_mult': 2.5694626415574437, 'rsi_os': 15, 'rsi_ob': 78, 'vol_spike': 0.10482199450169838, 'adx_thresh': 22.816453128571627, 'atr_min_pct': 0.003941620048798062, 'atr_max_pct': 0.11687279553288196, 'tp_mult': 2.2479897674588356, 'tsl_mult': 0.5444046041897165, 'strategy': 'breakout', 'time_stop': 271, 'use_sma': False, 'use_atr': False, 'use_adx': False, 'use_ema': True, 'use_spike': False, 'rsi_required': True, 'edge_k': 0.16385481232051669, 'edge_cap': 0.12505232823514076, 'bull_strategy': 'breakout', 'bull_bb_std_mult': 2.7336548166031394, 'bull_rsi_os': 44, 'bull_rsi_ob': 49, 'bull_adx_thresh': 11.301720653847626, 'bull_atr_min_pct': 0.005271828187156061, 'bull_atr_max_pct': 0.019574635314190333, 'bull_tp_mult': 1.536805994537125, 'bull_tsl_mult': 0.5634933865223359, 'bull_time_stop': 114, 'bull_use_sma': True, 'bull_use_ema': False, 'bull_use_atr': False, 'bull_use_adx': False, 'bull_use_spike': True, 'bull_rsi_required': False, 'bear_strategy': 'mean_reversion', 'bear_bb_std_mult': 1.9696486836491909, 'bear_rsi_os': 25, 'bear_rsi_ob': 49, 'bear_adx_thresh': 6.887976769651637, 'bear_atr_min_pct': 0.005277389503435671, 'bear_atr_max_pct': 0.08747457116978548, 'bear_tp_mult': 2.168512652635432, 'bear_tsl_mult': 0.117736203070679, 'bear_time_stop': 300, 'bear_use_sma': False, 'bear_use_ema': False, 'bear_use_atr': False, 'bear_use_adx': False, 'bear_use_spike': False, 'bear_rsi_required': False, 'sideways_strategy': 'breakout', 'sideways_bb_std_mult': 0.8520300825496818, 'sideways_rsi_os': 5, 'sideways_rsi_ob': 92, 'sideways_adx_thresh': 15.685021242152478, 'sideways_atr_min_pct': 0.004865521023338194, 'sideways_atr_max_pct': 0.016663242672686384, 'sideways_tp_mult': 1.522994173174394, 'sideways_tsl_mult': 0.20997992562114468, 'sideways_time_stop': 119, 'sideways_use_sma': True, 'sideways_use_ema': True, 'sideways_use_atr': True, 'sideways_use_adx': True, 'sideways_use_spike': False, 'sideways_rsi_required': True}.
[I 2025-09-01 08:36:01,341] Trial 427 finished with values: [0.002658577514813354, 0.006245917248090525] and parameters: {'p_sma': 28, 'p_std': 55, 'p_atr': 15, 'p_adx': 30, 'rsi_period': 51, 'ema1': 12, 'ema2': 27, 'slip_atr_k': 0.019447493292646258, 'slip_spread_k': 0.23207602049609738, 'spread_hl_frac': 0.04507988315174789, 'bb_std_mult': 2.1413030511447326, 'rsi_os': 20, 'rsi_ob': 65, 'vol_spike': 0.0637721170160732, 'adx_thresh': 27.648690674462888, 'atr_min_pct': 0.013190625017821306, 'atr_max_pct': 0.12050104563722147, 'tp_mult': 1.6718530976325354, 'tsl_mult': 0.08179057109911232, 'strategy': 'breakout', 'time_stop': 271, 'use_sma': False, 'use_atr': False, 'use_adx': True, 'use_ema': True, 'use_spike': True, 'rsi_required': True, 'edge_k': 0.1806638942125837, 'edge_cap': 0.19780126232744583, 'bull_strategy': 'breakout', 'bull_bb_std_mult': 2.7351607102259834, 'bull_rsi_os': 43, 'bull_rsi_ob': 59, 'bull_adx_thresh': 18.77329943255262, 'bull_atr_min_pct': 0.0029345060734979763, 'bull_atr_max_pct': 0.057845127364046595, 'bull_tp_mult': 1.5984703909957638, 'bull_tsl_mult': 0.5846490943188563, 'bull_time_stop': 84, 'bull_use_sma': True, 'bull_use_ema': False, 'bull_use_atr': False, 'bull_use_adx': False, 'bull_use_spike': False, 'bull_rsi_required': False, 'bear_strategy': 'mean_reversion', 'bear_bb_std_mult': 1.8294304010449032, 'bear_rsi_os': 47, 'bear_rsi_ob': 80, 'bear_adx_thresh': 6.95063073803585, 'bear_atr_min_pct': 0.0053753157022743, 'bear_atr_max_pct': 0.08975144317023073, 'bear_tp_mult': 2.2571729521332657, 'bear_tsl_mult': 0.024771056743503626, 'bear_time_stop': 283, 'bear_use_sma': False, 'bear_use_ema': False, 'bear_use_atr': False, 'bear_use_adx': False, 'bear_use_spike': False, 'bear_rsi_required': False, 'sideways_strategy': 'breakout', 'sideways_bb_std_mult': 0.9750087595384977, 'sideways_rsi_os': 54, 'sideways_rsi_ob': 88, 'sideways_adx_thresh': 13.711810626406189, 'sideways_atr_min_pct': 0.020403142186163584, 'sideways_atr_max_pct': 0.14496291672916822, 'sideways_tp_mult': 1.553268191484398, 'sideways_tsl_mult': 0.16948205722367476, 'sideways_time_stop': 80, 'sideways_use_sma': True, 'sideways_use_ema': True, 'sideways_use_atr': True, 'sideways_use_adx': True, 'sideways_use_spike': False, 'sideways_rsi_required': True}.
[I 2025-09-01 08:36:01,795] Trial 429 finished with values: [-1000000000.0, 1000000000.0] and parameters: {'p_sma': 28, 'p_std': 49, 'p_atr': 23, 'p_adx': 30, 'rsi_period': 55, 'ema1': 14, 'ema2': 10, 'slip_atr_k': 0.0002980956320787485, 'slip_spread_k': 0.8603400389819049, 'spread_hl_frac': 0.010687736099328401, 'bb_std_mult': 3.3518194964217387, 'rsi_os': 24, 'rsi_ob': 91, 'vol_spike': 0.06396359321711716, 'adx_thresh': 29.02773419014939, 'atr_min_pct': 0.0042028906074442, 'atr_max_pct': 0.11753849167518618, 'tp_mult': 1.6138402821339894, 'tsl_mult': 0.040538595859097845, 'strategy': 'breakout', 'time_stop': 226, 'use_sma': False, 'use_atr': False, 'use_adx': True, 'use_ema': True, 'use_spike': True, 'rsi_required': True, 'edge_k': 0.17854908499266442, 'edge_cap': 0.18832846598823028, 'bull_strategy': 'breakout', 'bull_bb_std_mult': 2.7370150158179136, 'bull_rsi_os': 55, 'bull_rsi_ob': 62, 'bull_adx_thresh': 10.45036608892485, 'bull_atr_min_pct': 0.0030760766095489153, 'bull_atr_max_pct': 0.019515280526788893, 'bull_tp_mult': 1.5992537809348595, 'bull_tsl_mult': 0.5614205321154468, 'bull_time_stop': 153, 'bull_use_sma': True, 'bull_use_ema': False, 'bull_use_atr': False, 'bull_use_adx': False, 'bull_use_spike': False, 'bull_rsi_required': False, 'bear_strategy': 'mean_reversion', 'bear_bb_std_mult': 1.8289205478503963, 'bear_rsi_os': 25, 'bear_rsi_ob': 80, 'bear_adx_thresh': 12.06912139816226, 'bear_atr_min_pct': 0.005498113550427867, 'bear_atr_max_pct': 0.09684923547462602, 'bear_tp_mult': 2.6235495243800444, 'bear_tsl_mult': 0.11777918225091302, 'bear_time_stop': 300, 'bear_use_sma': False, 'bear_use_ema': False, 'bear_use_atr': False, 'bear_use_adx': False, 'bear_use_spike': False, 'bear_rsi_required': False, 'sideways_strategy': 'breakout', 'sideways_bb_std_mult': 3.4435923142569083, 'sideways_rsi_os': 33, 'sideways_rsi_ob': 92, 'sideways_adx_thresh': 6.272339262463666, 'sideways_atr_min_pct': 0.020724538382079615, 'sideways_atr_max_pct': 0.016657890258428593, 'sideways_tp_mult': 2.910989727740791, 'sideways_tsl_mult': 0.21367558477051746, 'sideways_time_stop': 215, 'sideways_use_sma': True, 'sideways_use_ema': True, 'sideways_use_atr': True, 'sideways_use_adx': True, 'sideways_use_spike': False, 'sideways_rsi_required': True}.
[I 2025-09-01 08:36:44,847] Trial 434 finished with values: [-1000000000.0, 1000000000.0] and parameters: {'p_sma': 52, 'p_std': 60, 'p_atr': 13, 'p_adx': 20, 'rsi_period': 51, 'ema1': 13, 'ema2': 12, 'slip_atr_k': 0.018701759397588544, 'slip_spread_k': 0.23595521016976162, 'spread_hl_frac': 0.01365563528877562, 'bb_std_mult': 2.6299164953872625, 'rsi_os': 32, 'rsi_ob': 56, 'vol_spike': 0.05587035942227452, 'adx_thresh': 13.201120193216006, 'atr_min_pct': 0.017979761213314363, 'atr_max_pct': 0.12023188767476009, 'tp_mult': 2.668068994345403, 'tsl_mult': 0.1093287127421394, 'strategy': 'mean_reversion', 'time_stop': 58, 'use_sma': False, 'use_atr': False, 'use_adx': False, 'use_ema': False, 'use_spike': False, 'rsi_required': True, 'edge_k': 0.44860706020867325, 'edge_cap': 0.20736317161558235, 'bull_strategy': 'breakout', 'bull_bb_std_mult': 2.8584365067133524, 'bull_rsi_os': 44, 'bull_rsi_ob': 56, 'bull_adx_thresh': 32.69790094869225, 'bull_atr_min_pct': 0.018464897065601088, 'bull_atr_max_pct': 0.060229178655778884, 'bull_tp_mult': 1.6313447723532257, 'bull_tsl_mult': 0.5813463693352258, 'bull_time_stop': 82, 'bull_use_sma': True, 'bull_use_ema': True, 'bull_use_atr': True, 'bull_use_adx': True, 'bull_use_spike': True, 'bull_rsi_required': False, 'bear_strategy': 'mean_reversion', 'bear_bb_std_mult': 2.0240718266616673, 'bear_rsi_os': 46, 'bear_rsi_ob': 55, 'bear_adx_thresh': 5.498764733202699, 'bear_atr_min_pct': 0.00900066234593419, 'bear_atr_max_pct': 0.10343323433597956, 'bear_tp_mult': 2.0708833759967695, 'bear_tsl_mult': 0.998829376101062, 'bear_time_stop': 23, 'bear_use_sma': True, 'bear_use_ema': False, 'bear_use_atr': False, 'bear_use_adx': True, 'bear_use_spike': True, 'bear_rsi_required': True, 'sideways_strategy': 'breakout', 'sideways_bb_std_mult': 2.701039258726208, 'sideways_rsi_os': 54, 'sideways_rsi_ob': 78, 'sideways_adx_thresh': 30.112961806079632, 'sideways_atr_min_pct': 0.029171729866939854, 'sideways_atr_max_pct': 0.07036841438168544, 'sideways_tp_mult': 1.285310703703034, 'sideways_tsl_mult': 0.16664750165449177, 'sideways_time_stop': 84, 'sideways_use_sma': True, 'sideways_use_ema': False, 'sideways_use_atr': True, 'sideways_use_adx': True, 'sideways_use_spike': False, 'sideways_rsi_required': False}.
