[I 2025-09-01 08:20:30,570] Trial 340 finished with values: [-1000000000.0, 1000000000.0] and parameters: {'p_sma': 57, 'p_std': 39, 'p_atr': 24, 'p_adx': 13, 'rsi_period': 48, 'ema1': 16, 'ema2': 47, 'slip_atr_k': 0.24916916801629668, 'slip_spread_k': 0.789498625573281, 'spread_hl_frac': 0.015204811209057948, 'bb_std_mult': 2.615778199012714, 'rsi_os': 31, 'rsi_ob': 74, 'vol_spike': 0.062438231732238475, 'adx_thresh': 29.435114691376, 'atr_min_pct': 0.004208868503006823, 'atr_max_pct': 0.14261572188421334, 'tp_mult': 1.8487567261549467, 'tsl_mult': 0.2037062684928016, 'strategy': 'breakout', 'time_stop': 264, 'use_sma': False, 'use_atr': True, 'use_adx': True, 'use_ema': True, 'use_spike': True, 'rsi_required': True, 'edge_k': 0.2107427537226354, 'edge_cap': 0.34459549390552413, 'bull_strategy': 'mean_reversion', 'bull_bb_std_mult': 3.321401205208103, 'bull_rsi_os': 46, 'bull_rsi_ob': 50, 'bull_adx_thresh': 7.113643677056901, 'bull_atr_min_pct': 0.003641595006893274, 'bull_atr_max_pct': 0.06976810873008625, 'bull_tp_mult': 2.198467430454728, 'bull_tsl_mult': 0.5723708585972416, 'bull_time_stop': 61, 'bull_use_sma': True, 'bull_use_ema': True, 'bull_use_atr': False, 'bull_use_adx': False, 'bull_use_spike': False, 'bull_rsi_required': False, 'bear_strategy': 'mean_reversion', 'bear_bb_std_mult': 1.0594075334302868, 'bear_rsi_os': 46, 'bear_rsi_ob': 79, 'bear_adx_thresh': 24.6027874999223, 'bear_atr_min_pct': 0.018968634564688294, 'bear_atr_max_pct': 0.12445647592562137, 'bear_tp_mult': 2.2010444418907698, 'bear_tsl_mult': 0.7994776675618532, 'bear_time_stop': 177, 'bear_use_sma': True, 'bear_use_ema': False, 'bear_use_atr': False, 'bear_use_adx': False, 'bear_use_spike': False, 'bear_rsi_required': False, 'sideways_strategy': 'mean_reversion', 'sideways_bb_std_mult': 1.1502274862303712, 'sideways_rsi_os': 54, 'sideways_rsi_ob': 91, 'sideways_adx_thresh': 17.180224557294128, 'sideways_atr_min_pct': 0.012506276481401667, 'sideways_atr_max_pct': 0.03310315938560253, 'sideways_tp_mult': 1.350780254742102, 'sideways_tsl_mult': 0.16241952761152914, 'sideways_time_stop': 99, 'sideways_use_sma': True, 'sideways_use_ema': True, 'sideways_use_atr': False, 'sideways_use_adx': False, 'sideways_use_spike': True, 'sideways_rsi_required': False}.
[I 2025-09-01 08:20:30,732] Trial 342 finished with values: [-0.02021696723143318, 0.020118286405960882] and parameters: {'p_sma': 57, 'p_std': 12, 'p_atr': 18, 'p_adx': 13, 'rsi_period': 49, 'ema1': 11, 'ema2': 31, 'slip_atr_k': 0.13352363783234866, 'slip_spread_k': 0.7913138595367114, 'spread_hl_frac': 0.014899069755797453, 'bb_std_mult': 2.6717215919344843, 'rsi_os': 55, 'rsi_ob': 91, 'vol_spike': 0.10430107718011336, 'adx_thresh': 29.546640182643504, 'atr_min_pct': 0.00426604873296134, 'atr_max_pct': 0.14324167188599374, 'tp_mult': 1.8227052032458289, 'tsl_mult': 0.20579266510899108, 'strategy': 'breakout', 'time_stop': 266, 'use_sma': False, 'use_atr': False, 'use_adx': True, 'use_ema': True, 'use_spike': True, 'rsi_required': True, 'edge_k': 0.21276319575672148, 'edge_cap': 0.3435012716013059, 'bull_strategy': 'breakout', 'bull_bb_std_mult': 3.3176073068395975, 'bull_rsi_os': 46, 'bull_rsi_ob': 48, 'bull_adx_thresh': 7.075436736805635, 'bull_atr_min_pct': 0.003850046598226282, 'bull_atr_max_pct': 0.1047475780532068, 'bull_tp_mult': 2.125989161952836, 'bull_tsl_mult': 0.5736098005201623, 'bull_time_stop': 47, 'bull_use_sma': True, 'bull_use_ema': False, 'bull_use_atr': False, 'bull_use_adx': False, 'bull_use_spike': False, 'bull_rsi_required': False, 'bear_strategy': 'mean_reversion', 'bear_bb_std_mult': 1.7328464261357568, 'bear_rsi_os': 46, 'bear_rsi_ob': 79, 'bear_adx_thresh': 22.70688961359298, 'bear_atr_min_pct': 0.012653882553533263, 'bear_atr_max_pct': 0.08308592223976677, 'bear_tp_mult': 2.7777959462069295, 'bear_tsl_mult': 0.40670429214230164, 'bear_time_stop': 287, 'bear_use_sma': True, 'bear_use_ema': False, 'bear_use_atr': False, 'bear_use_adx': False, 'bear_use_spike': False, 'bear_rsi_required': False, 'sideways_strategy': 'breakout', 'sideways_bb_std_mult': 0.9849245245221964, 'sideways_rsi_os': 12, 'sideways_rsi_ob': 93, 'sideways_adx_thresh': 11.833970356553694, 'sideways_atr_min_pct': 0.027795056933358504, 'sideways_atr_max_pct': 0.01855075619049068, 'sideways_tp_mult': 1.191288983210992, 'sideways_tsl_mult': 0.3610350316976333, 'sideways_time_stop': 98, 'sideways_use_sma': True, 'sideways_use_ema': True, 'sideways_use_atr': False, 'sideways_use_adx': False, 'sideways_use_spike': True, 'sideways_rsi_required': False}.
[I 2025-09-01 08:21:12,271] Trial 345 finished with values: [-0.037730287609184954, 0.037487915129722056] and parameters: {'p_sma': 32, 'p_std': 8, 'p_atr': 13, 'p_adx': 24, 'rsi_period': 45, 'ema1': 20, 'ema2': 19, 'slip_atr_k': 0.24920781575766054, 'slip_spread_k': 0.049173629528214136, 'spread_hl_frac': 0.015770228586715947, 'bb_std_mult': 2.2271904890269267, 'rsi_os': 31, 'rsi_ob': 91, 'vol_spike': 0.04922393356014852, 'adx_thresh': 5.860208560951669, 'atr_min_pct': 0.004434778563189323, 'atr_max_pct': 0.13753704345152906, 'tp_mult': 1.8739755391041975, 'tsl_mult': 0.06677089376007919, 'strategy': 'breakout', 'time_stop': 252, 'use_sma': False, 'use_atr': False, 'use_adx': True, 'use_ema': True, 'use_spike': True, 'rsi_required': True, 'edge_k': 0.42769747787788726, 'edge_cap': 0.16015571971604275, 'bull_strategy': 'breakout', 'bull_bb_std_mult': 2.8994040194921, 'bull_rsi_os': 46, 'bull_rsi_ob': 93, 'bull_adx_thresh': 9.27171227344203, 'bull_atr_min_pct': 0.025900548067974767, 'bull_atr_max_pct': 0.06864339458248012, 'bull_tp_mult': 1.5614906825896782, 'bull_tsl_mult': 0.5865069520360392, 'bull_time_stop': 271, 'bull_use_sma': True, 'bull_use_ema': False, 'bull_use_atr': False, 'bull_use_adx': False, 'bull_use_spike': False, 'bull_rsi_required': False, 'bear_strategy': 'mean_reversion', 'bear_bb_std_mult': 1.7371637858381845, 'bear_rsi_os': 43, 'bear_rsi_ob': 80, 'bear_adx_thresh': 22.66912654534109, 'bear_atr_min_pct': 0.005543283672996444, 'bear_atr_max_pct': 0.1498095476529827, 'bear_tp_mult': 2.154951987681124, 'bear_tsl_mult': 0.09842637778126095, 'bear_time_stop': 284, 'bear_use_sma': True, 'bear_use_ema': False, 'bear_use_atr': True, 'bear_use_adx': False, 'bear_use_spike': False, 'bear_rsi_required': False, 'sideways_strategy': 'breakout', 'sideways_bb_std_mult': 1.0462103108202105, 'sideways_rsi_os': 6, 'sideways_rsi_ob': 92, 'sideways_adx_thresh': 21.42899800532473, 'sideways_atr_min_pct': 0.00748296358968908, 'sideways_atr_max_pct': 0.01000605610915729, 'sideways_tp_mult': 1.2412484062778828, 'sideways_tsl_mult': 0.1634190716107571, 'sideways_time_stop': 66, 'sideways_use_sma': True, 'sideways_use_ema': True, 'sideways_use_atr': True, 'sideways_use_adx': True, 'sideways_use_spike': False, 'sideways_rsi_required': False}.
[I 2025-09-01 08:21:12,785] Trial 346 finished with values: [-1000000000.0, 1000000000.0] and parameters: {'p_sma': 25, 'p_std': 54, 'p_atr': 27, 'p_adx': 30, 'rsi_period': 45, 'ema1': 14, 'ema2': 38, 'slip_atr_k': 0.08950006076437445, 'slip_spread_k': 0.8787112211693007, 'spread_hl_frac': 0.016303836498094307, 'bb_std_mult': 3.449760260089352, 'rsi_os': 32, 'rsi_ob': 91, 'vol_spike': 0.049662261437727465, 'adx_thresh': 26.0788747765315, 'atr_min_pct': 0.003438951269129027, 'atr_max_pct': 0.12513600723286059, 'tp_mult': 1.710401304607465, 'tsl_mult': 0.7972646783451321, 'strategy': 'breakout', 'time_stop': 231, 'use_sma': False, 'use_atr': False, 'use_adx': True, 'use_ema': True, 'use_spike': True, 'rsi_required': True, 'edge_k': 1.4309675940141129, 'edge_cap': 0.15714491560191157, 'bull_strategy': 'breakout', 'bull_bb_std_mult': 3.1539952491098613, 'bull_rsi_os': 46, 'bull_rsi_ob': 81, 'bull_adx_thresh': 8.575804511368794, 'bull_atr_min_pct': 0.018335080157893827, 'bull_atr_max_pct': 0.02307796715804452, 'bull_tp_mult': 1.5651894536960917, 'bull_tsl_mult': 0.5940340718798244, 'bull_time_stop': 142, 'bull_use_sma': True, 'bull_use_ema': False, 'bull_use_atr': False, 'bull_use_adx': False, 'bull_use_spike': False, 'bull_rsi_required': False, 'bear_strategy': 'mean_reversion', 'bear_bb_std_mult': 1.7132948429655208, 'bear_rsi_os': 44, 'bear_rsi_ob': 80, 'bear_adx_thresh': 5.017667628630678, 'bear_atr_min_pct': 0.014344491184182842, 'bear_atr_max_pct': 0.09070880360917606, 'bear_tp_mult': 2.126116610458645, 'bear_tsl_mult': 0.09820888496508233, 'bear_time_stop': 284, 'bear_use_sma': True, 'bear_use_ema': False, 'bear_use_atr': True, 'bear_use_adx': False, 'bear_use_spike': False, 'bear_rsi_required': False, 'sideways_strategy': 'breakout', 'sideways_bb_std_mult': 1.0088341813912742, 'sideways_rsi_os': 6, 'sideways_rsi_ob': 86, 'sideways_adx_thresh': 19.87329701711043, 'sideways_atr_min_pct': 0.029433641050665364, 'sideways_atr_max_pct': 0.010102737427215106, 'sideways_tp_mult': 2.613589814376083, 'sideways_tsl_mult': 0.8339948859149127, 'sideways_time_stop': 69, 'sideways_use_sma': True, 'sideways_use_ema': True, 'sideways_use_atr': True, 'sideways_use_adx': True, 'sideways_use_spike': False, 'sideways_rsi_required': False}.
[I 2025-09-01 08:21:13,099] Trial 344 finished with values: [-1000000000.0, 1000000000.0] and parameters: {'p_sma': 25, 'p_std': 54, 'p_atr': 18, 'p_adx': 13, 'rsi_period': 81, 'ema1': 16, 'ema2': 19, 'slip_atr_k': 0.00023474791591908233, 'slip_spread_k': 0.9626959774846615, 'spread_hl_frac': 0.016209804637224236, 'bb_std_mult': 2.6527529696483856, 'rsi_os': 31, 'rsi_ob': 84, 'vol_spike': 0.25886163735597123, 'adx_thresh': 29.58429140626956, 'atr_min_pct': 0.008206435180180343, 'atr_max_pct': 0.05807422375667409, 'tp_mult': 1.7122773837049157, 'tsl_mult': 0.19947059585741994, 'strategy': 'breakout', 'time_stop': 253, 'use_sma': False, 'use_atr': True, 'use_adx': True, 'use_ema': True, 'use_spike': True, 'rsi_required': True, 'edge_k': 0.20602804571746408, 'edge_cap': 0.15809413133078554, 'bull_strategy': 'mean_reversion', 'bull_bb_std_mult': 2.9991628353709507, 'bull_rsi_os': 18, 'bull_rsi_ob': 49, 'bull_adx_thresh': 27.0160326285425, 'bull_atr_min_pct': 0.01584484065312705, 'bull_atr_max_pct': 0.03762142830772851, 'bull_tp_mult': 2.1338844818535887, 'bull_tsl_mult': 0.587653812548599, 'bull_time_stop': 142, 'bull_use_sma': True, 'bull_use_ema': True, 'bull_use_atr': False, 'bull_use_adx': False, 'bull_use_spike': False, 'bull_rsi_required': False, 'bear_strategy': 'mean_reversion', 'bear_bb_std_mult': 1.703290034225605, 'bear_rsi_os': 43, 'bear_rsi_ob': 79, 'bear_adx_thresh': 26.747771899070113, 'bear_atr_min_pct': 0.012670035291879262, 'bear_atr_max_pct': 0.09162756447501409, 'bear_tp_mult': 2.2053876781601254, 'bear_tsl_mult': 0.7973917318737015, 'bear_time_stop': 196, 'bear_use_sma': True, 'bear_use_ema': False, 'bear_use_atr': False, 'bear_use_adx': False, 'bear_use_spike': False, 'bear_rsi_required': False, 'sideways_strategy': 'mean_reversion', 'sideways_bb_std_mult': 2.5408158759894506, 'sideways_rsi_os': 6, 'sideways_rsi_ob': 92, 'sideways_adx_thresh': 21.39398409519989, 'sideways_atr_min_pct': 0.02203833455427214, 'sideways_atr_max_pct': 0.012338591942145118, 'sideways_tp_mult': 2.6180760905003932, 'sideways_tsl_mult': 0.10723514299532436, 'sideways_time_stop': 112, 'sideways_use_sma': True, 'sideways_use_ema': True, 'sideways_use_atr': False, 'sideways_use_adx': True, 'sideways_use_spike': False, 'sideways_rsi_required': False}.
[I 2025-09-01 08:21:13,337] Trial 347 finished with values: [-1000000000.0, 1000000000.0] and parameters: {'p_sma': 32, 'p_std': 54, 'p_atr': 27, 'p_adx': 17, 'rsi_period': 59, 'ema1': 14, 'ema2': 37, 'slip_atr_k': 0.05424056103180365, 'slip_spread_k': 0.8753507442656612, 'spread_hl_frac': 0.012548080760726147, 'bb_std_mult': 3.0569052934455208, 'rsi_os': 26, 'rsi_ob': 91, 'vol_spike': 0.0468447635695126, 'adx_thresh': 28.009736429780446, 'atr_min_pct': 0.003558423990334675, 'atr_max_pct': 0.015040152185883185, 'tp_mult': 1.0634989277967168, 'tsl_mult': 0.9790029673245133, 'strategy': 'mean_reversion', 'time_stop': 253, 'use_sma': False, 'use_atr': False, 'use_adx': False, 'use_ema': True, 'use_spike': True, 'rsi_required': True, 'edge_k': 1.439870237047831, 'edge_cap': 0.910389255264429, 'bull_strategy': 'breakout', 'bull_bb_std_mult': 3.1449286712372517, 'bull_rsi_os': 50, 'bull_rsi_ob': 63, 'bull_adx_thresh': 9.346374267896163, 'bull_atr_min_pct': 0.010659922314942925, 'bull_atr_max_pct': 0.022848844781402027, 'bull_tp_mult': 1.566998765252285, 'bull_tsl_mult': 0.5914215012008511, 'bull_time_stop': 150, 'bull_use_sma': True, 'bull_use_ema': False, 'bull_use_atr': True, 'bull_use_adx': True, 'bull_use_spike': True, 'bull_rsi_required': False, 'bear_strategy': 'mean_reversion', 'bear_bb_std_mult': 1.8269820765704163, 'bear_rsi_os': 43, 'bear_rsi_ob': 81, 'bear_adx_thresh': 5.088654653716373, 'bear_atr_min_pct': 0.007707814850471211, 'bear_atr_max_pct': 0.10352551015341499, 'bear_tp_mult': 2.1477981905126167, 'bear_tsl_mult': 0.3076436999198632, 'bear_time_stop': 158, 'bear_use_sma': True, 'bear_use_ema': False, 'bear_use_atr': True, 'bear_use_adx': False, 'bear_use_spike': True, 'bear_rsi_required': True, 'sideways_strategy': 'breakout', 'sideways_bb_std_mult': 1.0606941560047736, 'sideways_rsi_os': 7, 'sideways_rsi_ob': 92, 'sideways_adx_thresh': 31.73668717141635, 'sideways_atr_min_pct': 0.029397780258802464, 'sideways_atr_max_pct': 0.01213814497013536, 'sideways_tp_mult': 2.273546295852077, 'sideways_tsl_mult': 0.5964511936211033, 'sideways_time_stop': 222, 'sideways_use_sma': True, 'sideways_use_ema': True, 'sideways_use_atr': True, 'sideways_use_adx': True, 'sideways_use_spike': False, 'sideways_rsi_required': False}.
[I 2025-09-01 08:21:56,751] Trial 348 finished with values: [-1000000000.0, 1000000000.0] and parameters: {'p_sma': 20, 'p_std': 54, 'p_atr': 17, 'p_adx': 20, 'rsi_period': 81, 'ema1': 9, 'ema2': 21, 'slip_atr_k': 0.054327531524931444, 'slip_spread_k': 0.8742504256484793, 'spread_hl_frac': 0.01656164156560047, 'bb_std_mult': 2.876985875000296, 'rsi_os': 27, 'rsi_ob': 87, 'vol_spike': 0.22871279221067853, 'adx_thresh': 24.812274845328062, 'atr_min_pct': 0.0034289696773973904, 'atr_max_pct': 0.062412794999118656, 'tp_mult': 1.6450667904676919, 'tsl_mult': 0.6262213404964305, 'strategy': 'mean_reversion', 'time_stop': 215, 'use_sma': False, 'use_atr': False, 'use_adx': False, 'use_ema': True, 'use_spike': True, 'rsi_required': True, 'edge_k': 0.25975050893050644, 'edge_cap': 0.19267521799357995, 'bull_strategy': 'breakout', 'bull_bb_std_mult': 3.140746720944395, 'bull_rsi_os': 50, 'bull_rsi_ob': 45, 'bull_adx_thresh': 14.100677799502495, 'bull_atr_min_pct': 0.015471147248134707, 'bull_atr_max_pct': 0.023135554884048865, 'bull_tp_mult': 1.4304712624063982, 'bull_tsl_mult': 0.7231944919662292, 'bull_time_stop': 14, 'bull_use_sma': True, 'bull_use_ema': True, 'bull_use_atr': True, 'bull_use_adx': True, 'bull_use_spike': True, 'bull_rsi_required': False, 'bear_strategy': 'mean_reversion', 'bear_bb_std_mult': 1.9898465873703501, 'bear_rsi_os': 44, 'bear_rsi_ob': 74, 'bear_adx_thresh': 27.068185426729848, 'bear_atr_min_pct': 0.007907846234320922, 'bear_atr_max_pct': 0.04489567867323097, 'bear_tp_mult': 2.1119897574017172, 'bear_tsl_mult': 0.8429833101394189, 'bear_time_stop': 289, 'bear_use_sma': True, 'bear_use_ema': False, 'bear_use_atr': True, 'bear_use_adx': False, 'bear_use_spike': True, 'bear_rsi_required': True, 'sideways_strategy': 'breakout', 'sideways_bb_std_mult': 3.5882718204841004, 'sideways_rsi_os': 27, 'sideways_rsi_ob': 93, 'sideways_adx_thresh': 19.96129803584449, 'sideways_atr_min_pct': 0.02210266572220564, 'sideways_atr_max_pct': 0.01285015806275662, 'sideways_tp_mult': 2.204820484963161, 'sideways_tsl_mult': 0.10616492659629782, 'sideways_time_stop': 226, 'sideways_use_sma': True, 'sideways_use_ema': True, 'sideways_use_atr': True, 'sideways_use_adx': True, 'sideways_use_spike': False, 'sideways_rsi_required': False}.
[I 2025-09-01 08:21:57,080] Trial 350 finished with values: [-0.020306897385098832, 0.02020200255601627] and parameters: {'p_sma': 30, 'p_std': 31, 'p_atr': 26, 'p_adx': 28, 'rsi_period': 58, 'ema1': 28, 'ema2': 12, 'slip_atr_k': 0.013081567287113046, 'slip_spread_k': 0.629742783118046, 'spread_hl_frac': 0.012558959628592334, 'bb_std_mult': 2.959585756823232, 'rsi_os': 15, 'rsi_ob': 87, 'vol_spike': 0.23114691316675512, 'adx_thresh': 28.283225716511843, 'atr_min_pct': 0.004936259476859617, 'atr_max_pct': 0.013931348439736063, 'tp_mult': 2.3434872841495387, 'tsl_mult': 0.05557713472514165, 'strategy': 'mean_reversion', 'time_stop': 219, 'use_sma': True, 'use_atr': False, 'use_adx': False, 'use_ema': True, 'use_spike': True, 'rsi_required': True, 'edge_k': 1.3160197875852022, 'edge_cap': 0.1935870664349563, 'bull_strategy': 'breakout', 'bull_bb_std_mult': 1.1162678443840113, 'bull_rsi_os': 50, 'bull_rsi_ob': 63, 'bull_adx_thresh': 14.540120728024364, 'bull_atr_min_pct': 0.0013804952769405211, 'bull_atr_max_pct': 0.09234188261556282, 'bull_tp_mult': 2.7686656651798844, 'bull_tsl_mult': 0.142156568514116, 'bull_time_stop': 76, 'bull_use_sma': False, 'bull_use_ema': True, 'bull_use_atr': True, 'bull_use_adx': True, 'bull_use_spike': True, 'bull_rsi_required': True, 'bear_strategy': 'breakout', 'bear_bb_std_mult': 1.8179888867266385, 'bear_rsi_os': 47, 'bear_rsi_ob': 75, 'bear_adx_thresh': 32.39933350517612, 'bear_atr_min_pct': 0.020898439142281552, 'bear_atr_max_pct': 0.05819471511212543, 'bear_tp_mult': 2.2495178214248903, 'bear_tsl_mult': 0.14529627437340548, 'bear_time_stop': 300, 'bear_use_sma': True, 'bear_use_ema': True, 'bear_use_atr': True, 'bear_use_adx': False, 'bear_use_spike': True, 'bear_rsi_required': True, 'sideways_strategy': 'breakout', 'sideways_bb_std_mult': 1.2642258310494257, 'sideways_rsi_os': 16, 'sideways_rsi_ob': 60, 'sideways_adx_thresh': 15.810467544574948, 'sideways_atr_min_pct': 0.024508814304930224, 'sideways_atr_max_pct': 0.01504226893628625, 'sideways_tp_mult': 1.4518855686909937, 'sideways_tsl_mult': 0.22047792237803152, 'sideways_time_stop': 222, 'sideways_use_sma': True, 'sideways_use_ema': True, 'sideways_use_atr': True, 'sideways_use_adx': True, 'sideways_use_spike': False, 'sideways_rsi_required': False}.
[I 2025-09-01 08:21:57,736] Trial 349 finished with values: [-1000000000.0, 1000000000.0] and parameters: {'p_sma': 28, 'p_std': 58, 'p_atr': 17, 'p_adx': 20, 'rsi_period': 62, 'ema1': 7, 'ema2': 28, 'slip_atr_k': 0.00020267440009141303, 'slip_spread_k': 0.9088981200573719, 'spread_hl_frac': 0.010651772591830762, 'bb_std_mult': 2.8594978819714516, 'rsi_os': 30, 'rsi_ob': 85, 'vol_spike': 0.22812828025051846, 'adx_thresh': 30.31173676866351, 'atr_min_pct': 0.0037067657333479122, 'atr_max_pct': 0.1325883440854624, 'tp_mult': 2.3481324464548945, 'tsl_mult': 0.05353768009094454, 'strategy': 'mean_reversion', 'time_stop': 208, 'use_sma': False, 'use_atr': False, 'use_adx': False, 'use_ema': True, 'use_spike': True, 'rsi_required': True, 'edge_k': 0.28032911714110614, 'edge_cap': 0.1980413472043045, 'bull_strategy': 'breakout', 'bull_bb_std_mult': 1.24013728801906, 'bull_rsi_os': 50, 'bull_rsi_ob': 45, 'bull_adx_thresh': 30.1697740570932, 'bull_atr_min_pct': 0.010610466287833048, 'bull_atr_max_pct': 0.03780836015042538, 'bull_tp_mult': 1.4176161889796042, 'bull_tsl_mult': 0.7181184351112189, 'bull_time_stop': 137, 'bull_use_sma': True, 'bull_use_ema': True, 'bull_use_atr': True, 'bull_use_adx': True, 'bull_use_spike': True, 'bull_rsi_required': False, 'bear_strategy': 'mean_reversion', 'bear_bb_std_mult': 1.8374622828610385, 'bear_rsi_os': 47, 'bear_rsi_ob': 78, 'bear_adx_thresh': 26.8436961234881, 'bear_atr_min_pct': 0.020790245360384207, 'bear_atr_max_pct': 0.05186033474660645, 'bear_tp_mult': 1.9702286171691368, 'bear_tsl_mult': 0.14470117928904663, 'bear_time_stop': 199, 'bear_use_sma': True, 'bear_use_ema': True, 'bear_use_atr': False, 'bear_use_adx': False, 'bear_use_spike': True, 'bear_rsi_required': True, 'sideways_strategy': 'breakout', 'sideways_bb_std_mult': 1.2631589732780446, 'sideways_rsi_os': 7, 'sideways_rsi_ob': 71, 'sideways_adx_thresh': 12.598202883097862, 'sideways_atr_min_pct': 0.029061641215818803, 'sideways_atr_max_pct': 0.013484934162010487, 'sideways_tp_mult': 2.112427469141656, 'sideways_tsl_mult': 0.59786888901426, 'sideways_time_stop': 220, 'sideways_use_sma': True, 'sideways_use_ema': True, 'sideways_use_atr': True, 'sideways_use_adx': True, 'sideways_use_spike': False, 'sideways_rsi_required': False}.
