[I 2025-09-01 08:43:22,421] Trial 469 finished with values: [0.004186376138767267, 0.0025733518087536437] and parameters: {'p_sma': 35, 'p_std': 34, 'p_atr': 19, 'p_adx': 16, 'rsi_period': 44, 'ema1': 8, 'ema2': 10, 'slip_atr_k': 0.025062611693028043, 'slip_spread_k': 0.21949822997818158, 'spread_hl_frac': 0.021312706335422472, 'bb_std_mult': 2.2796275579983316, 'rsi_os': 42, 'rsi_ob': 93, 'vol_spike': 0.03379373232623458, 'adx_thresh': 30.922814527915737, 'atr_min_pct': 0.009102611162708987, 'atr_max_pct': 0.09816706625308153, 'tp_mult': 1.4752302368102248, 'tsl_mult': 0.25301542696702434, 'strategy': 'mean_reversion', 'time_stop': 18, 'use_sma': False, 'use_atr': False, 'use_adx': False, 'use_ema': False, 'use_spike': False, 'rsi_required': False, 'edge_k': 0.703754883742877, 'edge_cap': 0.31195040475509245, 'bull_strategy': 'breakout', 'bull_bb_std_mult': 2.7138302232997846, 'bull_rsi_os': 42, 'bull_rsi_ob': 57, 'bull_adx_thresh': 11.836529731066117, 'bull_atr_min_pct': 0.01864101799137986, 'bull_atr_max_pct': 0.06761635984157237, 'bull_tp_mult': 1.2466196646651748, 'bull_tsl_mult': 0.9999385749688203, 'bull_time_stop': 150, 'bull_use_sma': True, 'bull_use_ema': True, 'bull_use_atr': True, 'bull_use_adx': True, 'bull_use_spike': True, 'bull_rsi_required': False, 'bear_strategy': 'mean_reversion', 'bear_bb_std_mult': 3.4779855950267713, 'bear_rsi_os': 39, 'bear_rsi_ob': 87, 'bear_adx_thresh': 9.382572927561618, 'bear_atr_min_pct': 0.005077085590295784, 'bear_atr_max_pct': 0.02957161786187597, 'bear_tp_mult': 2.834109766081593, 'bear_tsl_mult': 0.8095203573923201, 'bear_time_stop': 231, 'bear_use_sma': False, 'bear_use_ema': False, 'bear_use_atr': True, 'bear_use_adx': True, 'bear_use_spike': True, 'bear_rsi_required': True, 'sideways_strategy': 'breakout', 'sideways_bb_std_mult': 1.388817566958188, 'sideways_rsi_os': 15, 'sideways_rsi_ob': 69, 'sideways_adx_thresh': 12.89865786126349, 'sideways_atr_min_pct': 0.012958440147402057, 'sideways_atr_max_pct': 0.05746827922764895, 'sideways_tp_mult': 2.3280666967793278, 'sideways_tsl_mult': 0.434565823564579, 'sideways_time_stop': 143, 'sideways_use_sma': False, 'sideways_use_ema': False, 'sideways_use_atr': True, 'sideways_use_adx': False, 'sideways_use_spike': True, 'sideways_rsi_required': True}.
[I 2025-09-01 08:43:22,436] Trial 468 finished with values: [-1000000000.0, 1000000000.0] and parameters: {'p_sma': 35, 'p_std': 34, 'p_atr': 19, 'p_adx': 14, 'rsi_period': 44, 'ema1': 8, 'ema2': 10, 'slip_atr_k': 0.019684519699166948, 'slip_spread_k': 0.22692522644384389, 'spread_hl_frac': 0.021515767482385623, 'bb_std_mult': 2.398182183591551, 'rsi_os': 43, 'rsi_ob': 93, 'vol_spike': 0.032703913231412, 'adx_thresh': 30.853003202742993, 'atr_min_pct': 0.008867140086562243, 'atr_max_pct': 0.09945585482313452, 'tp_mult': 1.4299104895342267, 'tsl_mult': 0.24141689659266827, 'strategy': 'mean_reversion', 'time_stop': 23, 'use_sma': False, 'use_atr': False, 'use_adx': False, 'use_ema': False, 'use_spike': False, 'rsi_required': False, 'edge_k': 0.7717825784514497, 'edge_cap': 0.3156354910010052, 'bull_strategy': 'breakout', 'bull_bb_std_mult': 2.6980243580819763, 'bull_rsi_os': 42, 'bull_rsi_ob': 57, 'bull_adx_thresh': 11.967150783656507, 'bull_atr_min_pct': 0.018598065033617907, 'bull_atr_max_pct': 0.0746604250461467, 'bull_tp_mult': 1.261328872771772, 'bull_tsl_mult': 0.9964248371653508, 'bull_time_stop': 157, 'bull_use_sma': False, 'bull_use_ema': True, 'bull_use_atr': True, 'bull_use_adx': True, 'bull_use_spike': True, 'bull_rsi_required': True, 'bear_strategy': 'breakout', 'bear_bb_std_mult': 3.4902323969138473, 'bear_rsi_os': 41, 'bear_rsi_ob': 87, 'bear_adx_thresh': 9.490812949005457, 'bear_atr_min_pct': 0.004999359582042947, 'bear_atr_max_pct': 0.03083556288637687, 'bear_tp_mult': 2.8664485921465053, 'bear_tsl_mult': 0.784674815571674, 'bear_time_stop': 232, 'bear_use_sma': False, 'bear_use_ema': False, 'bear_use_atr': True, 'bear_use_adx': True, 'bear_use_spike': True, 'bear_rsi_required': True, 'sideways_strategy': 'breakout', 'sideways_bb_std_mult': 1.3836741739013778, 'sideways_rsi_os': 15, 'sideways_rsi_ob': 69, 'sideways_adx_thresh': 12.752958128888636, 'sideways_atr_min_pct': 0.027029096000268833, 'sideways_atr_max_pct': 0.07352255618772018, 'sideways_tp_mult': 2.3003195395486156, 'sideways_tsl_mult': 0.45345710664048794, 'sideways_time_stop': 146, 'sideways_use_sma': False, 'sideways_use_ema': False, 'sideways_use_atr': True, 'sideways_use_adx': False, 'sideways_use_spike': True, 'sideways_rsi_required': True}.
[I 2025-09-01 08:43:22,602] Trial 467 finished with values: [0.0073808779301425265, 0.0026189892651994826] and parameters: {'p_sma': 36, 'p_std': 34, 'p_atr': 19, 'p_adx': 16, 'rsi_period': 44, 'ema1': 8, 'ema2': 10, 'slip_atr_k': 0.02002157718572543, 'slip_spread_k': 0.21903307918497125, 'spread_hl_frac': 0.02109667329345928, 'bb_std_mult': 2.4153094441286753, 'rsi_os': 42, 'rsi_ob': 93, 'vol_spike': 0.02940896553545373, 'adx_thresh': 32.116893058802304, 'atr_min_pct': 0.008477385514507904, 'atr_max_pct': 0.09884495399903262, 'tp_mult': 1.4253532943612448, 'tsl_mult': 0.23600692929238223, 'strategy': 'mean_reversion', 'time_stop': 24, 'use_sma': False, 'use_atr': False, 'use_adx': False, 'use_ema': False, 'use_spike': False, 'rsi_required': False, 'edge_k': 0.7616238843561721, 'edge_cap': 0.3122968361065151, 'bull_strategy': 'breakout', 'bull_bb_std_mult': 2.6754348396089407, 'bull_rsi_os': 42, 'bull_rsi_ob': 57, 'bull_adx_thresh': 13.249130662865538, 'bull_atr_min_pct': 0.01819346082720751, 'bull_atr_max_pct': 0.0772014684672073, 'bull_tp_mult': 1.2718467040878563, 'bull_tsl_mult': 0.99937988108087, 'bull_time_stop': 156, 'bull_use_sma': True, 'bull_use_ema': True, 'bull_use_atr': True, 'bull_use_adx': True, 'bull_use_spike': True, 'bull_rsi_required': False, 'bear_strategy': 'mean_reversion', 'bear_bb_std_mult': 3.5350253436115073, 'bear_rsi_os': 41, 'bear_rsi_ob': 87, 'bear_adx_thresh': 9.125249679957005, 'bear_atr_min_pct': 0.004758298049675389, 'bear_atr_max_pct': 0.036466502160270586, 'bear_tp_mult': 2.858978000870465, 'bear_tsl_mult': 0.6828390308348311, 'bear_time_stop': 234, 'bear_use_sma': False, 'bear_use_ema': False, 'bear_use_atr': True, 'bear_use_adx': True, 'bear_use_spike': True, 'bear_rsi_required': True, 'sideways_strategy': 'mean_reversion', 'sideways_bb_std_mult': 1.3862491126514631, 'sideways_rsi_os': 14, 'sideways_rsi_ob': 69, 'sideways_adx_thresh': 12.821930421334933, 'sideways_atr_min_pct': 0.027938174456117463, 'sideways_atr_max_pct': 0.1045156982364037, 'sideways_tp_mult': 2.3190141316318154, 'sideways_tsl_mult': 0.43895649617749644, 'sideways_time_stop': 143, 'sideways_use_sma': False, 'sideways_use_ema': False, 'sideways_use_atr': True, 'sideways_use_adx': False, 'sideways_use_spike': True, 'sideways_rsi_required': True}.
[I 2025-09-01 08:44:07,234] Trial 473 finished with values: [-0.00898645977510626, 0.009800493040725548] and parameters: {'p_sma': 34, 'p_std': 32, 'p_atr': 19, 'p_adx': 15, 'rsi_period': 43, 'ema1': 10, 'ema2': 10, 'slip_atr_k': 0.027900150031310612, 'slip_spread_k': 0.1587321704809468, 'spread_hl_frac': 0.023817898517743116, 'bb_std_mult': 2.2774701361576923, 'rsi_os': 42, 'rsi_ob': 92, 'vol_spike': 0.034292538618920614, 'adx_thresh': 31.200320411203396, 'atr_min_pct': 0.007021027800978691, 'atr_max_pct': 0.1034822219823649, 'tp_mult': 1.355877206733953, 'tsl_mult': 0.2593904231323792, 'strategy': 'mean_reversion', 'time_stop': 15, 'use_sma': False, 'use_atr': False, 'use_adx': False, 'use_ema': False, 'use_spike': False, 'rsi_required': False, 'edge_k': 0.6972874033086434, 'edge_cap': 0.2937903620101375, 'bull_strategy': 'breakout', 'bull_bb_std_mult': 2.7323020352646155, 'bull_rsi_os': 44, 'bull_rsi_ob': 57, 'bull_adx_thresh': 13.304383593113748, 'bull_atr_min_pct': 0.01732586788411587, 'bull_atr_max_pct': 0.06612960255814346, 'bull_tp_mult': 1.3452131158304361, 'bull_tsl_mult': 0.9402456945304639, 'bull_time_stop': 148, 'bull_use_sma': True, 'bull_use_ema': True, 'bull_use_atr': True, 'bull_use_adx': True, 'bull_use_spike': True, 'bull_rsi_required': False, 'bear_strategy': 'mean_reversion', 'bear_bb_std_mult': 3.501624882429232, 'bear_rsi_os': 40, 'bear_rsi_ob': 86, 'bear_adx_thresh': 9.186978705866732, 'bear_atr_min_pct': 0.004097595061221908, 'bear_atr_max_pct': 0.028088488093508696, 'bear_tp_mult': 2.95949652092046, 'bear_tsl_mult': 0.10867731735537975, 'bear_time_stop': 244, 'bear_use_sma': False, 'bear_use_ema': False, 'bear_use_atr': True, 'bear_use_adx': True, 'bear_use_spike': True, 'bear_rsi_required': True, 'sideways_strategy': 'breakout', 'sideways_bb_std_mult': 1.5235499043671648, 'sideways_rsi_os': 14, 'sideways_rsi_ob': 70, 'sideways_adx_thresh': 12.913638437485092, 'sideways_atr_min_pct': 0.0009206140710979836, 'sideways_atr_max_pct': 0.10141195953562825, 'sideways_tp_mult': 2.1358550491451984, 'sideways_tsl_mult': 0.44127437865203933, 'sideways_time_stop': 132, 'sideways_use_sma': False, 'sideways_use_ema': False, 'sideways_use_atr': True, 'sideways_use_adx': False, 'sideways_use_spike': True, 'sideways_rsi_required': True}.
[I 2025-09-01 08:44:07,781] Trial 474 finished with values: [-0.006845957121222268, 0.008508528938635981] and parameters: {'p_sma': 36, 'p_std': 33, 'p_atr': 19, 'p_adx': 15, 'rsi_period': 43, 'ema1': 10, 'ema2': 10, 'slip_atr_k': 0.026373027214282065, 'slip_spread_k': 0.2068984843715984, 'spread_hl_frac': 0.020560631420344467, 'bb_std_mult': 2.3254551402908654, 'rsi_os': 42, 'rsi_ob': 92, 'vol_spike': 0.034105205580062886, 'adx_thresh': 31.031574332109635, 'atr_min_pct': 0.007097296721084128, 'atr_max_pct': 0.10357608206008033, 'tp_mult': 1.4958398629716845, 'tsl_mult': 0.2638873013939962, 'strategy': 'mean_reversion', 'time_stop': 13, 'use_sma': False, 'use_atr': False, 'use_adx': False, 'use_ema': False, 'use_spike': False, 'rsi_required': False, 'edge_k': 0.7019366609129415, 'edge_cap': 0.32902906745753246, 'bull_strategy': 'breakout', 'bull_bb_std_mult': 2.733983516505364, 'bull_rsi_os': 44, 'bull_rsi_ob': 57, 'bull_adx_thresh': 13.35732611217139, 'bull_atr_min_pct': 0.01693804798319985, 'bull_atr_max_pct': 0.06531087828627592, 'bull_tp_mult': 1.361350496084454, 'bull_tsl_mult': 0.9481956170449729, 'bull_time_stop': 148, 'bull_use_sma': True, 'bull_use_ema': True, 'bull_use_atr': True, 'bull_use_adx': True, 'bull_use_spike': True, 'bull_rsi_required': False, 'bear_strategy': 'mean_reversion', 'bear_bb_std_mult': 3.4967906903919865, 'bear_rsi_os': 40, 'bear_rsi_ob': 86, 'bear_adx_thresh': 8.992728273879644, 'bear_atr_min_pct': 0.003832173120292161, 'bear_atr_max_pct': 0.02979176950544587, 'bear_tp_mult': 2.9627784827184955, 'bear_tsl_mult': 0.11697761006934249, 'bear_time_stop': 243, 'bear_use_sma': False, 'bear_use_ema': False, 'bear_use_atr': True, 'bear_use_adx': True, 'bear_use_spike': True, 'bear_rsi_required': True, 'sideways_strategy': 'breakout', 'sideways_bb_std_mult': 1.5153153717599424, 'sideways_rsi_os': 14, 'sideways_rsi_ob': 70, 'sideways_adx_thresh': 12.911118882219023, 'sideways_atr_min_pct': 0.02808556694168297, 'sideways_atr_max_pct': 0.017228562556980673, 'sideways_tp_mult': 2.521032800231752, 'sideways_tsl_mult': 0.437885820086366, 'sideways_time_stop': 132, 'sideways_use_sma': False, 'sideways_use_ema': False, 'sideways_use_atr': True, 'sideways_use_adx': False, 'sideways_use_spike': True, 'sideways_rsi_required': True}.
[I 2025-09-01 08:44:07,995] Trial 471 finished with values: [-0.0014261522080718514, 0.006700604297274438] and parameters: {'p_sma': 35, 'p_std': 33, 'p_atr': 19, 'p_adx': 15, 'rsi_period': 44, 'ema1': 10, 'ema2': 10, 'slip_atr_k': 0.025213874314265083, 'slip_spread_k': 0.22528000606872225, 'spread_hl_frac': 0.021558505568817457, 'bb_std_mult': 2.435780577287697, 'rsi_os': 44, 'rsi_ob': 92, 'vol_spike': 0.03428111410059017, 'adx_thresh': 30.996305645152397, 'atr_min_pct': 0.007055267299055497, 'atr_max_pct': 0.09893555557231543, 'tp_mult': 1.4933840530916338, 'tsl_mult': 0.25892192705141315, 'strategy': 'mean_reversion', 'time_stop': 21, 'use_sma': False, 'use_atr': False, 'use_adx': False, 'use_ema': False, 'use_spike': False, 'rsi_required': False, 'edge_k': 0.6766295861412941, 'edge_cap': 0.3333623918121776, 'bull_strategy': 'breakout', 'bull_bb_std_mult': 2.7067227331821986, 'bull_rsi_os': 42, 'bull_rsi_ob': 59, 'bull_adx_thresh': 11.647090945299531, 'bull_atr_min_pct': 0.01866949327308545, 'bull_atr_max_pct': 0.06657993713704433, 'bull_tp_mult': 1.2557229212646943, 'bull_tsl_mult': 0.9413631163454409, 'bull_time_stop': 149, 'bull_use_sma': True, 'bull_use_ema': True, 'bull_use_atr': True, 'bull_use_adx': True, 'bull_use_spike': True, 'bull_rsi_required': False, 'bear_strategy': 'mean_reversion', 'bear_bb_std_mult': 3.4919131185297374, 'bear_rsi_os': 39, 'bear_rsi_ob': 87, 'bear_adx_thresh': 9.054440680476194, 'bear_atr_min_pct': 0.004884320415698099, 'bear_atr_max_pct': 0.02982979006684558, 'bear_tp_mult': 2.956704263491431, 'bear_tsl_mult': 0.78184125121787, 'bear_time_stop': 245, 'bear_use_sma': False, 'bear_use_ema': False, 'bear_use_atr': True, 'bear_use_adx': True, 'bear_use_spike': True, 'bear_rsi_required': True, 'sideways_strategy': 'breakout', 'sideways_bb_std_mult': 1.3773798918638365, 'sideways_rsi_os': 15, 'sideways_rsi_ob': 69, 'sideways_adx_thresh': 12.874644993484582, 'sideways_atr_min_pct': 0.0010619461858040902, 'sideways_atr_max_pct': 0.1005604125531934, 'sideways_tp_mult': 2.512740958565881, 'sideways_tsl_mult': 0.4454697209849898, 'sideways_time_stop': 134, 'sideways_use_sma': False, 'sideways_use_ema': False, 'sideways_use_atr': False, 'sideways_use_adx': False, 'sideways_use_spike': True, 'sideways_rsi_required': True}.
[I 2025-09-01 08:44:08,171] Trial 472 finished with values: [-0.005764524812862715, 0.007222152110782609] and parameters: {'p_sma': 34, 'p_std': 32, 'p_atr': 19, 'p_adx': 15, 'rsi_period': 43, 'ema1': 10, 'ema2': 10, 'slip_atr_k': 0.026322531642552, 'slip_spread_k': 0.16234442178519376, 'spread_hl_frac': 0.02383428591773005, 'bb_std_mult': 2.285805656286096, 'rsi_os': 42, 'rsi_ob': 92, 'vol_spike': 0.033622370934461326, 'adx_thresh': 30.925698473914807, 'atr_min_pct': 0.0072435811590891, 'atr_max_pct': 0.09821091054389518, 'tp_mult': 1.4773525003485066, 'tsl_mult': 0.2092422693689456, 'strategy': 'mean_reversion', 'time_stop': 23, 'use_sma': False, 'use_atr': False, 'use_adx': False, 'use_ema': False, 'use_spike': False, 'rsi_required': False, 'edge_k': 0.6803312783890827, 'edge_cap': 0.334385233076955, 'bull_strategy': 'breakout', 'bull_bb_std_mult': 2.7037689378652443, 'bull_rsi_os': 44, 'bull_rsi_ob': 59, 'bull_adx_thresh': 13.4177688875305, 'bull_atr_min_pct': 0.017069501658533815, 'bull_atr_max_pct': 0.06321924096717643, 'bull_tp_mult': 1.348104769260136, 'bull_tsl_mult': 0.9528089552209672, 'bull_time_stop': 150, 'bull_use_sma': True, 'bull_use_ema': True, 'bull_use_atr': True, 'bull_use_adx': True, 'bull_use_spike': True, 'bull_rsi_required': False, 'bear_strategy': 'mean_reversion', 'bear_bb_std_mult': 3.505087603617006, 'bear_rsi_os': 40, 'bear_rsi_ob': 86, 'bear_adx_thresh': 9.05427358085996, 'bear_atr_min_pct': 0.004265599164550892, 'bear_atr_max_pct': 0.028470348751562877, 'bear_tp_mult': 2.8299010648881757, 'bear_tsl_mult': 0.5283520572312495, 'bear_time_stop': 244, 'bear_use_sma': False, 'bear_use_ema': False, 'bear_use_atr': True, 'bear_use_adx': True, 'bear_use_spike': True, 'bear_rsi_required': True, 'sideways_strategy': 'breakout', 'sideways_bb_std_mult': 1.4895628395625726, 'sideways_rsi_os': 14, 'sideways_rsi_ob': 70, 'sideways_adx_thresh': 11.6335191287429, 'sideways_atr_min_pct': 0.001142883028066333, 'sideways_atr_max_pct': 0.10555681160716139, 'sideways_tp_mult': 2.517025253420899, 'sideways_tsl_mult': 0.43906753313903013, 'sideways_time_stop': 133, 'sideways_use_sma': False, 'sideways_use_ema': False, 'sideways_use_atr': True, 'sideways_use_adx': False, 'sideways_use_spike': True, 'sideways_rsi_required': True}.
[I 2025-09-01 08:44:52,743] Trial 478 finished with values: [0.010563811618715668, 0.003052447399579366] and parameters: {'p_sma': 33, 'p_std': 36, 'p_atr': 20, 'p_adx': 15, 'rsi_period': 47, 'ema1': 10, 'ema2': 10, 'slip_atr_k': 0.033879047013439, 'slip_spread_k': 0.18247844396938034, 'spread_hl_frac': 0.022243700012927567, 'bb_std_mult': 2.4678392208422757, 'rsi_os': 43, 'rsi_ob': 93, 'vol_spike': 0.030280518618442887, 'adx_thresh': 31.687639329830624, 'atr_min_pct': 0.008116709289893534, 'atr_max_pct': 0.09514408613211349, 'tp_mult': 1.3991092074131741, 'tsl_mult': 0.20276573334613487, 'strategy': 'mean_reversion', 'time_stop': 36, 'use_sma': False, 'use_atr': False, 'use_adx': False, 'use_ema': False, 'use_spike': False, 'rsi_required': False, 'edge_k': 0.7371768604836797, 'edge_cap': 0.3003081941310936, 'bull_strategy': 'breakout', 'bull_bb_std_mult': 2.587689551151425, 'bull_rsi_os': 42, 'bull_rsi_ob': 59, 'bull_adx_thresh': 11.764417225267541, 'bull_atr_min_pct': 0.018295508912311468, 'bull_atr_max_pct': 0.06475186953869214, 'bull_tp_mult': 1.2933591685695132, 'bull_tsl_mult': 0.9656634967512812, 'bull_time_stop': 166, 'bull_use_sma': True, 'bull_use_ema': True, 'bull_use_atr': True, 'bull_use_adx': True, 'bull_use_spike': True, 'bull_rsi_required': False, 'bear_strategy': 'mean_reversion', 'bear_bb_std_mult': 3.599844525327868, 'bear_rsi_os': 42, 'bear_rsi_ob': 89, 'bear_adx_thresh': 10.623841354270116, 'bear_atr_min_pct': 0.005119584565405803, 'bear_atr_max_pct': 0.03571588203592068, 'bear_tp_mult': 2.8787256019494247, 'bear_tsl_mult': 0.7539987240788089, 'bear_time_stop': 230, 'bear_use_sma': False, 'bear_use_ema': False, 'bear_use_atr': True, 'bear_use_adx': True, 'bear_use_spike': True, 'bear_rsi_required': True, 'sideways_strategy': 'breakout', 'sideways_bb_std_mult': 1.457901850717373, 'sideways_rsi_os': 12, 'sideways_rsi_ob': 64, 'sideways_adx_thresh': 32.01121879841043, 'sideways_atr_min_pct': 0.01118401278218476, 'sideways_atr_max_pct': 0.01716455270529309, 'sideways_tp_mult': 2.180462544713277, 'sideways_tsl_mult': 0.4861437474912943, 'sideways_time_stop': 146, 'sideways_use_sma': False, 'sideways_use_ema': False, 'sideways_use_atr': True, 'sideways_use_adx': False, 'sideways_use_spike': True, 'sideways_rsi_required': True}.
[I 2025-09-01 08:44:53,350] Trial 477 finished with values: [0.011947986315241188, 0.003732011962968821] and parameters: {'p_sma': 33, 'p_std': 35, 'p_atr': 20, 'p_adx': 15, 'rsi_period': 47, 'ema1': 10, 'ema2': 53, 'slip_atr_k': 0.015831441712567968, 'slip_spread_k': 0.25387836699039124, 'spread_hl_frac': 0.022093028699636627, 'bb_std_mult': 2.4117864560403226, 'rsi_os': 44, 'rsi_ob': 93, 'vol_spike': 0.017554601852197288, 'adx_thresh': 31.635084300382978, 'atr_min_pct': 0.008167028282225127, 'atr_max_pct': 0.09614049099371157, 'tp_mult': 1.3928673080360572, 'tsl_mult': 0.19802853436649467, 'strategy': 'mean_reversion', 'time_stop': 36, 'use_sma': False, 'use_atr': False, 'use_adx': False, 'use_ema': False, 'use_spike': False, 'rsi_required': False, 'edge_k': 0.7850088015942462, 'edge_cap': 0.2997054377497962, 'bull_strategy': 'breakout', 'bull_bb_std_mult': 2.632259060803853, 'bull_rsi_os': 41, 'bull_rsi_ob': 59, 'bull_adx_thresh': 11.938286773465673, 'bull_atr_min_pct': 0.01826507402881265, 'bull_atr_max_pct': 0.0647316448643976, 'bull_tp_mult': 1.29719567319233, 'bull_tsl_mult': 0.9698795634301763, 'bull_time_stop': 162, 'bull_use_sma': True, 'bull_use_ema': True, 'bull_use_atr': True, 'bull_use_adx': True, 'bull_use_spike': True, 'bull_rsi_required': False, 'bear_strategy': 'mean_reversion', 'bear_bb_std_mult': 3.4194315235410295, 'bear_rsi_os': 42, 'bear_rsi_ob': 89, 'bear_adx_thresh': 10.664869418687244, 'bear_atr_min_pct': 0.0048984401175357776, 'bear_atr_max_pct': 0.037457772665494674, 'bear_tp_mult': 2.882767286782593, 'bear_tsl_mult': 0.31381890450709216, 'bear_time_stop': 229, 'bear_use_sma': False, 'bear_use_ema': False, 'bear_use_atr': True, 'bear_use_adx': True, 'bear_use_spike': True, 'bear_rsi_required': True, 'sideways_strategy': 'breakout', 'sideways_bb_std_mult': 1.46037343336286, 'sideways_rsi_os': 12, 'sideways_rsi_ob': 64, 'sideways_adx_thresh': 11.719890606366151, 'sideways_atr_min_pct': 0.028441430652277524, 'sideways_atr_max_pct': 0.01663429322225086, 'sideways_tp_mult': 2.092260091874299, 'sideways_tsl_mult': 0.4875693106178889, 'sideways_time_stop': 144, 'sideways_use_sma': False, 'sideways_use_ema': False, 'sideways_use_atr': True, 'sideways_use_adx': False, 'sideways_use_spike': True, 'sideways_rsi_required': True}.
