[I 2025-09-01 08:53:25,428] Trial 533 finished with values: [-1000000000.0, 1000000000.0] and parameters: {'p_sma': 21, 'p_std': 22, 'p_atr': 20, 'p_adx': 17, 'rsi_period': 36, 'ema1': 8, 'ema2': 59, 'slip_atr_k': 0.01640676418644349, 'slip_spread_k': 0.13579444421737996, 'spread_hl_frac': 0.020577606827252893, 'bb_std_mult': 0.8893595258420477, 'rsi_os': 51, 'rsi_ob': 93, 'vol_spike': 0.02068158722508974, 'adx_thresh': 33.85809426846341, 'atr_min_pct': 0.013478901080711106, 'atr_max_pct': 0.08656819632038282, 'tp_mult': 1.3461915708109928, 'tsl_mult': 0.20425672945388634, 'strategy': 'mean_reversion', 'time_stop': 53, 'use_sma': False, 'use_atr': False, 'use_adx': False, 'use_ema': False, 'use_spike': False, 'rsi_required': False, 'edge_k': 0.9187118169742214, 'edge_cap': 0.3034760686114506, 'bull_strategy': 'breakout', 'bull_bb_std_mult': 2.504335666902484, 'bull_rsi_os': 41, 'bull_rsi_ob': 54, 'bull_adx_thresh': 10.19810516356354, 'bull_atr_min_pct': 0.01951862970990725, 'bull_atr_max_pct': 0.0811872298245091, 'bull_tp_mult': 1.1635115707446348, 'bull_tsl_mult': 0.9145472773498161, 'bull_time_stop': 187, 'bull_use_sma': False, 'bull_use_ema': True, 'bull_use_atr': True, 'bull_use_adx': True, 'bull_use_spike': True, 'bull_rsi_required': True, 'bear_strategy': 'mean_reversion', 'bear_bb_std_mult': 3.2953636217384923, 'bear_rsi_os': 6, 'bear_rsi_ob': 89, 'bear_adx_thresh': 12.50758282175711, 'bear_atr_min_pct': 0.023647839704966797, 'bear_atr_max_pct': 0.03790693601026724, 'bear_tp_mult': 2.8080864022988647, 'bear_tsl_mult': 0.24865538504998738, 'bear_time_stop': 216, 'bear_use_sma': False, 'bear_use_ema': False, 'bear_use_atr': True, 'bear_use_adx': True, 'bear_use_spike': True, 'bear_rsi_required': True, 'sideways_strategy': 'breakout', 'sideways_bb_std_mult': 2.532081931958461, 'sideways_rsi_os': 30, 'sideways_rsi_ob': 61, 'sideways_adx_thresh': 12.273834038597206, 'sideways_atr_min_pct': 0.007206573249992149, 'sideways_atr_max_pct': 0.0572886465125869, 'sideways_tp_mult': 2.4393697964950856, 'sideways_tsl_mult': 0.3780821282486051, 'sideways_time_stop': 170, 'sideways_use_sma': False, 'sideways_use_ema': False, 'sideways_use_atr': True, 'sideways_use_adx': False, 'sideways_use_spike': True, 'sideways_rsi_required': True}.
[I 2025-09-01 08:54:11,161] Trial 532 finished with values: [-1000000000.0, 1000000000.0] and parameters: {'p_sma': 11, 'p_std': 9, 'p_atr': 20, 'p_adx': 17, 'rsi_period': 35, 'ema1': 7, 'ema2': 59, 'slip_atr_k': 0.015758765877825258, 'slip_spread_k': 0.137120579179295, 'spread_hl_frac': 0.02134509070320231, 'bb_std_mult': 0.91151605640694, 'rsi_os': 45, 'rsi_ob': 93, 'vol_spike': 0.005220378251361092, 'adx_thresh': 33.944144802528896, 'atr_min_pct': 0.0012272729943608833, 'atr_max_pct': 0.08598513863770364, 'tp_mult': 1.3377401359225365, 'tsl_mult': 0.20483209829351, 'strategy': 'mean_reversion', 'time_stop': 43, 'use_sma': False, 'use_atr': False, 'use_adx': False, 'use_ema': False, 'use_spike': False, 'rsi_required': False, 'edge_k': 0.8273736014984756, 'edge_cap': 0.29945282401256584, 'bull_strategy': 'breakout', 'bull_bb_std_mult': 2.503000799253704, 'bull_rsi_os': 41, 'bull_rsi_ob': 54, 'bull_adx_thresh': 10.19883704643617, 'bull_atr_min_pct': 0.020302740928185476, 'bull_atr_max_pct': 0.08202437634435654, 'bull_tp_mult': 1.1652044465828253, 'bull_tsl_mult': 0.6966101777207999, 'bull_time_stop': 176, 'bull_use_sma': True, 'bull_use_ema': True, 'bull_use_atr': True, 'bull_use_adx': True, 'bull_use_spike': True, 'bull_rsi_required': False, 'bear_strategy': 'mean_reversion', 'bear_bb_std_mult': 3.257585531169624, 'bear_rsi_os': 21, 'bear_rsi_ob': 89, 'bear_adx_thresh': 12.820204763466315, 'bear_atr_min_pct': 0.02376960118499792, 'bear_atr_max_pct': 0.03555729433209526, 'bear_tp_mult': 2.814128954117894, 'bear_tsl_mult': 0.23442653798889018, 'bear_time_stop': 215, 'bear_use_sma': False, 'bear_use_ema': False, 'bear_use_atr': True, 'bear_use_adx': True, 'bear_use_spike': True, 'bear_rsi_required': True, 'sideways_strategy': 'breakout', 'sideways_bb_std_mult': 2.534822099359619, 'sideways_rsi_os': 11, 'sideways_rsi_ob': 61, 'sideways_adx_thresh': 12.40364320483437, 'sideways_atr_min_pct': 0.006977750818040557, 'sideways_atr_max_pct': 0.057057140728504555, 'sideways_tp_mult': 2.442328579827856, 'sideways_tsl_mult': 0.5058026520343722, 'sideways_time_stop': 167, 'sideways_use_sma': False, 'sideways_use_ema': False, 'sideways_use_atr': True, 'sideways_use_adx': False, 'sideways_use_spike': True, 'sideways_rsi_required': True}.
[I 2025-09-01 08:54:12,932] Trial 534 finished with values: [-1000000000.0, 1000000000.0] and parameters: {'p_sma': 10, 'p_std': 5, 'p_atr': 20, 'p_adx': 16, 'rsi_period': 41, 'ema1': 8, 'ema2': 59, 'slip_atr_k': 0.12173678874491764, 'slip_spread_k': 0.13486477918997977, 'spread_hl_frac': 0.021939077881576115, 'bb_std_mult': 2.4971350362621436, 'rsi_os': 45, 'rsi_ob': 93, 'vol_spike': 0.022738417613022605, 'adx_thresh': 33.76197525635426, 'atr_min_pct': 0.01331965581585681, 'atr_max_pct': 0.08502214955785035, 'tp_mult': 1.3231194516133573, 'tsl_mult': 0.20019828658983999, 'strategy': 'mean_reversion', 'time_stop': 32, 'use_sma': True, 'use_atr': False, 'use_adx': False, 'use_ema': False, 'use_spike': False, 'rsi_required': False, 'edge_k': 0.8310962715508691, 'edge_cap': 0.3026076817302762, 'bull_strategy': 'breakout', 'bull_bb_std_mult': 2.481540700835343, 'bull_rsi_os': 37, 'bull_rsi_ob': 54, 'bull_adx_thresh': 10.234590891030642, 'bull_atr_min_pct': 0.020308438917684267, 'bull_atr_max_pct': 0.08069982352372017, 'bull_tp_mult': 1.160013563118158, 'bull_tsl_mult': 0.34573851496390495, 'bull_time_stop': 177, 'bull_use_sma': False, 'bull_use_ema': True, 'bull_use_atr': True, 'bull_use_adx': True, 'bull_use_spike': True, 'bull_rsi_required': True, 'bear_strategy': 'mean_reversion', 'bear_bb_std_mult': 3.1251482261933, 'bear_rsi_os': 41, 'bear_rsi_ob': 89, 'bear_adx_thresh': 12.866483619988932, 'bear_atr_min_pct': 0.026468441409691425, 'bear_atr_max_pct': 0.03769392603785706, 'bear_tp_mult': 2.8654269425369505, 'bear_tsl_mult': 0.17306400465487312, 'bear_time_stop': 217, 'bear_use_sma': False, 'bear_use_ema': False, 'bear_use_atr': True, 'bear_use_adx': True, 'bear_use_spike': True, 'bear_rsi_required': True, 'sideways_strategy': 'breakout', 'sideways_bb_std_mult': 2.3738446918664065, 'sideways_rsi_os': 10, 'sideways_rsi_ob': 61, 'sideways_adx_thresh': 12.46095110764611, 'sideways_atr_min_pct': 0.006902157485546127, 'sideways_atr_max_pct': 0.06735876628926896, 'sideways_tp_mult': 2.5110767260529934, 'sideways_tsl_mult': 0.49884993642906866, 'sideways_time_stop': 142, 'sideways_use_sma': False, 'sideways_use_ema': False, 'sideways_use_atr': False, 'sideways_use_adx': False, 'sideways_use_spike': True, 'sideways_rsi_required': True}.
[I 2025-09-01 08:54:13,434] Trial 531 finished with values: [-1000000000.0, 1000000000.0] and parameters: {'p_sma': 14, 'p_std': 38, 'p_atr': 20, 'p_adx': 17, 'rsi_period': 42, 'ema1': 8, 'ema2': 59, 'slip_atr_k': 0.01735370549318076, 'slip_spread_k': 0.13661997420339336, 'spread_hl_frac': 0.0204600283246648, 'bb_std_mult': 0.9428549590239761, 'rsi_os': 46, 'rsi_ob': 94, 'vol_spike': 0.006571360296266764, 'adx_thresh': 33.90002230287847, 'atr_min_pct': 0.009925766977920915, 'atr_max_pct': 0.08381162639129282, 'tp_mult': 1.3225848015337816, 'tsl_mult': 0.6461207589726904, 'strategy': 'mean_reversion', 'time_stop': 43, 'use_sma': False, 'use_atr': False, 'use_adx': False, 'use_ema': False, 'use_spike': False, 'rsi_required': False, 'edge_k': 0.8306872695982741, 'edge_cap': 0.29774149873256295, 'bull_strategy': 'breakout', 'bull_bb_std_mult': 2.343847175400714, 'bull_rsi_os': 41, 'bull_rsi_ob': 54, 'bull_adx_thresh': 11.837985441726191, 'bull_atr_min_pct': 0.020443963575439643, 'bull_atr_max_pct': 0.08244650561456773, 'bull_tp_mult': 1.2335958347811902, 'bull_tsl_mult': 0.8421193768138313, 'bull_time_stop': 201, 'bull_use_sma': True, 'bull_use_ema': True, 'bull_use_atr': True, 'bull_use_adx': True, 'bull_use_spike': True, 'bull_rsi_required': False, 'bear_strategy': 'mean_reversion', 'bear_bb_std_mult': 3.289461509383065, 'bear_rsi_os': 21, 'bear_rsi_ob': 89, 'bear_adx_thresh': 13.028095086247335, 'bear_atr_min_pct': 0.023813187830074377, 'bear_atr_max_pct': 0.03688431437375101, 'bear_tp_mult': 2.8075617452492203, 'bear_tsl_mult': 0.25083774552910876, 'bear_time_stop': 220, 'bear_use_sma': False, 'bear_use_ema': False, 'bear_use_atr': True, 'bear_use_adx': True, 'bear_use_spike': True, 'bear_rsi_required': True, 'sideways_strategy': 'breakout', 'sideways_bb_std_mult': 2.7659614650066966, 'sideways_rsi_os': 11, 'sideways_rsi_ob': 65, 'sideways_adx_thresh': 12.268371897366091, 'sideways_atr_min_pct': 0.008657040219375967, 'sideways_atr_max_pct': 0.0687637062993212, 'sideways_tp_mult': 2.317354143719767, 'sideways_tsl_mult': 0.4923295434488871, 'sideways_time_stop': 157, 'sideways_use_sma': False, 'sideways_use_ema': False, 'sideways_use_atr': True, 'sideways_use_adx': False, 'sideways_use_spike': True, 'sideways_rsi_required': True}.
[I 2025-09-01 08:54:13,689] Trial 535 finished with values: [-1000000000.0, 1000000000.0] and parameters: {'p_sma': 10, 'p_std': 38, 'p_atr': 28, 'p_adx': 16, 'rsi_period': 42, 'ema1': 8, 'ema2': 59, 'slip_atr_k': 0.008243084483484684, 'slip_spread_k': 0.1286237739030737, 'spread_hl_frac': 0.003362403231425816, 'bb_std_mult': 2.5263033003626263, 'rsi_os': 46, 'rsi_ob': 92, 'vol_spike': 0.02128603400668845, 'adx_thresh': 32.98411229715237, 'atr_min_pct': 0.009960375470881347, 'atr_max_pct': 0.08547405697001298, 'tp_mult': 1.2560902543193413, 'tsl_mult': 0.16095094904258656, 'strategy': 'mean_reversion', 'time_stop': 31, 'use_sma': True, 'use_atr': False, 'use_adx': False, 'use_ema': False, 'use_spike': False, 'rsi_required': False, 'edge_k': 0.8228981433489605, 'edge_cap': 0.2624333516491766, 'bull_strategy': 'breakout', 'bull_bb_std_mult': 2.2496202449222373, 'bull_rsi_os': 41, 'bull_rsi_ob': 55, 'bull_adx_thresh': 9.904274990756825, 'bull_atr_min_pct': 0.02034941872918659, 'bull_atr_max_pct': 0.14307920443210398, 'bull_tp_mult': 1.1463310354648104, 'bull_tsl_mult': 0.18507419999489905, 'bull_time_stop': 179, 'bull_use_sma': True, 'bull_use_ema': True, 'bull_use_atr': True, 'bull_use_adx': True, 'bull_use_spike': True, 'bull_rsi_required': False, 'bear_strategy': 'mean_reversion', 'bear_bb_std_mult': 3.205204404870389, 'bear_rsi_os': 12, 'bear_rsi_ob': 89, 'bear_adx_thresh': 12.960861306250415, 'bear_atr_min_pct': 0.00010145013235899128, 'bear_atr_max_pct': 0.039649359682140096, 'bear_tp_mult': 2.7632826223467357, 'bear_tsl_mult': 0.17365760742717193, 'bear_time_stop': 218, 'bear_use_sma': False, 'bear_use_ema': False, 'bear_use_atr': True, 'bear_use_adx': True, 'bear_use_spike': True, 'bear_rsi_required': True, 'sideways_strategy': 'breakout', 'sideways_bb_std_mult': 1.3019324784721293, 'sideways_rsi_os': 11, 'sideways_rsi_ob': 64, 'sideways_adx_thresh': 12.137844949810658, 'sideways_atr_min_pct': 0.0069044387432847095, 'sideways_atr_max_pct': 0.07991383397489611, 'sideways_tp_mult': 2.374180239100752, 'sideways_tsl_mult': 0.49952758826089727, 'sideways_time_stop': 154, 'sideways_use_sma': False, 'sideways_use_ema': False, 'sideways_use_atr': False, 'sideways_use_adx': False, 'sideways_use_spike': True, 'sideways_rsi_required': True}.
[I 2025-09-01 08:54:58,123] Trial 539 finished with values: [-1000000000.0, 1000000000.0] and parameters: {'p_sma': 8, 'p_std': 34, 'p_atr': 9, 'p_adx': 15, 'rsi_period': 44, 'ema1': 9, 'ema2': 58, 'slip_atr_k': 0.16764310933277626, 'slip_spread_k': 0.11065994570690042, 'spread_hl_frac': 0.005855421004877685, 'bb_std_mult': 0.7750643905665202, 'rsi_os': 47, 'rsi_ob': 95, 'vol_spike': 2.0424449866015756e-05, 'adx_thresh': 34.94288536766101, 'atr_min_pct': 0.0109540709402002, 'atr_max_pct': 0.03171081586513803, 'tp_mult': 1.245766294849951, 'tsl_mult': 0.1346697342919752, 'strategy': 'mean_reversion', 'time_stop': 53, 'use_sma': False, 'use_atr': False, 'use_adx': False, 'use_ema': False, 'use_spike': False, 'rsi_required': False, 'edge_k': 0.903649236231022, 'edge_cap': 0.33469091314083477, 'bull_strategy': 'breakout', 'bull_bb_std_mult': 2.305623103899264, 'bull_rsi_os': 10, 'bull_rsi_ob': 56, 'bull_adx_thresh': 10.919684041462745, 'bull_atr_min_pct': 0.021905017153683565, 'bull_atr_max_pct': 0.12927264437748498, 'bull_tp_mult': 1.061110009290771, 'bull_tsl_mult': 0.13846460666040394, 'bull_time_stop': 164, 'bull_use_sma': True, 'bull_use_ema': True, 'bull_use_atr': True, 'bull_use_adx': True, 'bull_use_spike': True, 'bull_rsi_required': False, 'bear_strategy': 'mean_reversion', 'bear_bb_std_mult': 3.3410794165432236, 'bear_rsi_os': 43, 'bear_rsi_ob': 87, 'bear_adx_thresh': 11.336849169185022, 'bear_atr_min_pct': 0.012538885063120045, 'bear_atr_max_pct': 0.04658033384531226, 'bear_tp_mult': 2.7220693602710764, 'bear_tsl_mult': 0.21065055032272786, 'bear_time_stop': 207, 'bear_use_sma': False, 'bear_use_ema': False, 'bear_use_atr': True, 'bear_use_adx': True, 'bear_use_spike': True, 'bear_rsi_required': True, 'sideways_strategy': 'mean_reversion', 'sideways_bb_std_mult': 1.451710823069329, 'sideways_rsi_os': 12, 'sideways_rsi_ob': 63, 'sideways_adx_thresh': 11.64331484441349, 'sideways_atr_min_pct': 0.007695492388348437, 'sideways_atr_max_pct': 0.062467833589769255, 'sideways_tp_mult': 2.455996051872229, 'sideways_tsl_mult': 0.53455519793106, 'sideways_time_stop': 150, 'sideways_use_sma': False, 'sideways_use_ema': False, 'sideways_use_atr': True, 'sideways_use_adx': False, 'sideways_use_spike': True, 'sideways_rsi_required': True}.
[I 2025-09-01 08:54:58,823] Trial 538 finished with values: [-1000000000.0, 1000000000.0] and parameters: {'p_sma': 46, 'p_std': 34, 'p_atr': 8, 'p_adx': 16, 'rsi_period': 44, 'ema1': 9, 'ema2': 58, 'slip_atr_k': 0.00948601273964946, 'slip_spread_k': 0.12199122311742226, 'spread_hl_frac': 0.030216837385107245, 'bb_std_mult': 0.7885034661421249, 'rsi_os': 47, 'rsi_ob': 61, 'vol_spike': 0.014525765896141064, 'adx_thresh': 34.529095295359866, 'atr_min_pct': 0.0159427574097942, 'atr_max_pct': 0.09229791386099413, 'tp_mult': 1.2789209791815792, 'tsl_mult': 0.15798372915449171, 'strategy': 'mean_reversion', 'time_stop': 63, 'use_sma': True, 'use_atr': False, 'use_adx': False, 'use_ema': False, 'use_spike': False, 'rsi_required': False, 'edge_k': 0.8779341735273419, 'edge_cap': 0.3407404044451999, 'bull_strategy': 'breakout', 'bull_bb_std_mult': 2.2319689336120043, 'bull_rsi_os': 40, 'bull_rsi_ob': 56, 'bull_adx_thresh': 28.840984174446454, 'bull_atr_min_pct': 0.021718126424089827, 'bull_atr_max_pct': 0.07675040929618854, 'bull_tp_mult': 1.101068952709049, 'bull_tsl_mult': 0.1480709882939404, 'bull_time_stop': 186, 'bull_use_sma': True, 'bull_use_ema': True, 'bull_use_atr': True, 'bull_use_adx': True, 'bull_use_spike': True, 'bull_rsi_required': False, 'bear_strategy': 'mean_reversion', 'bear_bb_std_mult': 3.4392818403271326, 'bear_rsi_os': 43, 'bear_rsi_ob': 87, 'bear_adx_thresh': 11.271210613979212, 'bear_atr_min_pct': 0.02224699940453536, 'bear_atr_max_pct': 0.0467227177353109, 'bear_tp_mult': 2.7575639316460268, 'bear_tsl_mult': 0.21151713359823318, 'bear_time_stop': 208, 'bear_use_sma': False, 'bear_use_ema': False, 'bear_use_atr': True, 'bear_use_adx': True, 'bear_use_spike': True, 'bear_rsi_required': True, 'sideways_strategy': 'breakout', 'sideways_bb_std_mult': 3.5965177108371105, 'sideways_rsi_os': 12, 'sideways_rsi_ob': 63, 'sideways_adx_thresh': 11.625965194336702, 'sideways_atr_min_pct': 0.006000789506738756, 'sideways_atr_max_pct': 0.08137378817408786, 'sideways_tp_mult': 2.367057277882021, 'sideways_tsl_mult': 0.5233878338071422, 'sideways_time_stop': 154, 'sideways_use_sma': False, 'sideways_use_ema': False, 'sideways_use_atr': False, 'sideways_use_adx': False, 'sideways_use_spike': True, 'sideways_rsi_required': True}.
[I 2025-09-01 08:54:59,099] Trial 537 finished with values: [-1000000000.0, 1000000000.0] and parameters: {'p_sma': 7, 'p_std': 38, 'p_atr': 20, 'p_adx': 16, 'rsi_period': 42, 'ema1': 9, 'ema2': 58, 'slip_atr_k': 0.17478600287001506, 'slip_spread_k': 0.11342500278434615, 'spread_hl_frac': 0.0055959963395875376, 'bb_std_mult': 1.3335954609415421, 'rsi_os': 46, 'rsi_ob': 92, 'vol_spike': 0.01638360851504299, 'adx_thresh': 32.935386306467635, 'atr_min_pct': 0.015869525249827685, 'atr_max_pct': 0.09205394777366517, 'tp_mult': 1.2459686190325743, 'tsl_mult': 0.5828315445481052, 'strategy': 'mean_reversion', 'time_stop': 153, 'use_sma': False, 'use_atr': False, 'use_adx': False, 'use_ema': False, 'use_spike': False, 'rsi_required': False, 'edge_k': 0.8752670106908107, 'edge_cap': 0.3390280725892214, 'bull_strategy': 'breakout', 'bull_bb_std_mult': 2.3394960205434567, 'bull_rsi_os': 41, 'bull_rsi_ob': 55, 'bull_adx_thresh': 28.752190458253907, 'bull_atr_min_pct': 0.020889008608920134, 'bull_atr_max_pct': 0.07734643268023751, 'bull_tp_mult': 1.0733248997447626, 'bull_tsl_mult': 0.48428850563686643, 'bull_time_stop': 165, 'bull_use_sma': True, 'bull_use_ema': True, 'bull_use_atr': True, 'bull_use_adx': True, 'bull_use_spike': True, 'bull_rsi_required': False, 'bear_strategy': 'mean_reversion', 'bear_bb_std_mult': 3.3148272190182224, 'bear_rsi_os': 12, 'bear_rsi_ob': 87, 'bear_adx_thresh': 11.268399586280465, 'bear_atr_min_pct': 0.01937639798402314, 'bear_atr_max_pct': 0.040165121748599285, 'bear_tp_mult': 2.7426310951141235, 'bear_tsl_mult': 0.21260809696272406, 'bear_time_stop': 222, 'bear_use_sma': False, 'bear_use_ema': False, 'bear_use_atr': True, 'bear_use_adx': True, 'bear_use_spike': True, 'bear_rsi_required': True, 'sideways_strategy': 'breakout', 'sideways_bb_std_mult': 2.2038841445665027, 'sideways_rsi_os': 12, 'sideways_rsi_ob': 63, 'sideways_adx_thresh': 21.66046122133204, 'sideways_atr_min_pct': 0.006099944416978644, 'sideways_atr_max_pct': 0.08108134671662165, 'sideways_tp_mult': 2.3633802097909147, 'sideways_tsl_mult': 0.5238863134299735, 'sideways_time_stop': 153, 'sideways_use_sma': False, 'sideways_use_ema': False, 'sideways_use_atr': True, 'sideways_use_adx': False, 'sideways_use_spike': True, 'sideways_rsi_required': True}.
[I 2025-09-01 08:54:59,243] Trial 536 finished with values: [-1000000000.0, 1000000000.0] and parameters: {'p_sma': 46, 'p_std': 34, 'p_atr': 28, 'p_adx': 24, 'rsi_period': 41, 'ema1': 9, 'ema2': 58, 'slip_atr_k': 0.1921825659447915, 'slip_spread_k': 0.12102630819137447, 'spread_hl_frac': 0.018233238640525576, 'bb_std_mult': 0.7804559001727942, 'rsi_os': 46, 'rsi_ob': 94, 'vol_spike': 0.023479011410297273, 'adx_thresh': 32.978376810726864, 'atr_min_pct': 0.010512246999178217, 'atr_max_pct': 0.08253073537906817, 'tp_mult': 1.2667585159192085, 'tsl_mult': 0.15336833604666394, 'strategy': 'mean_reversion', 'time_stop': 63, 'use_sma': True, 'use_atr': False, 'use_adx': False, 'use_ema': False, 'use_spike': False, 'rsi_required': False, 'edge_k': 0.8686217654197103, 'edge_cap': 0.34334763126500956, 'bull_strategy': 'breakout', 'bull_bb_std_mult': 1.7489759553157092, 'bull_rsi_os': 37, 'bull_rsi_ob': 55, 'bull_adx_thresh': 29.002208422893823, 'bull_atr_min_pct': 0.02181302553600704, 'bull_atr_max_pct': 0.07301635900253205, 'bull_tp_mult': 1.0743016895445086, 'bull_tsl_mult': 0.18707808462930575, 'bull_time_stop': 178, 'bull_use_sma': False, 'bull_use_ema': True, 'bull_use_atr': True, 'bull_use_adx': True, 'bull_use_spike': True, 'bull_rsi_required': True, 'bear_strategy': 'mean_reversion', 'bear_bb_std_mult': 3.4259235303836935, 'bear_rsi_os': 41, 'bear_rsi_ob': 87, 'bear_adx_thresh': 11.288179331613051, 'bear_atr_min_pct': 0.005402125104135266, 'bear_atr_max_pct': 0.03895667097191513, 'bear_tp_mult': 2.8719459559324716, 'bear_tsl_mult': 0.1776283244897192, 'bear_time_stop': 208, 'bear_use_sma': False, 'bear_use_ema': False, 'bear_use_atr': True, 'bear_use_adx': True, 'bear_use_spike': True, 'bear_rsi_required': True, 'sideways_strategy': 'breakout', 'sideways_bb_std_mult': 1.3094325046155786, 'sideways_rsi_os': 51, 'sideways_rsi_ob': 63, 'sideways_adx_thresh': 11.886396285953758, 'sideways_atr_min_pct': 0.006238091307886145, 'sideways_atr_max_pct': 0.0804915905177732, 'sideways_tp_mult': 2.5211492583920703, 'sideways_tsl_mult': 0.6514940931213156, 'sideways_time_stop': 273, 'sideways_use_sma': False, 'sideways_use_ema': False, 'sideways_use_atr': False, 'sideways_use_adx': False, 'sideways_use_spike': True, 'sideways_rsi_required': True}.
