[I 2025-09-01 08:46:29,713] Trial 486 finished with values: [0.009917248738543272, 0.003168564412877326] and parameters: {'p_sma': 33, 'p_std': 35, 'p_atr': 20, 'p_adx': 16, 'rsi_period': 45, 'ema1': 9, 'ema2': 58, 'slip_atr_k': 0.01520626882105401, 'slip_spread_k': 0.18755298183360875, 'spread_hl_frac': 0.020950492126887453, 'bb_std_mult': 2.492747766967159, 'rsi_os': 45, 'rsi_ob': 93, 'vol_spike': 0.019893990300457236, 'adx_thresh': 33.99500942886068, 'atr_min_pct': 0.008270548720689087, 'atr_max_pct': 0.09276141986165068, 'tp_mult': 1.3830352271876496, 'tsl_mult': 0.19524044593592343, 'strategy': 'mean_reversion', 'time_stop': 36, 'use_sma': False, 'use_atr': False, 'use_adx': False, 'use_ema': False, 'use_spike': False, 'rsi_required': False, 'edge_k': 0.7925193396167448, 'edge_cap': 0.2962998599769394, 'bull_strategy': 'breakout', 'bull_bb_std_mult': 2.5963433753145893, 'bull_rsi_os': 40, 'bull_rsi_ob': 57, 'bull_adx_thresh': 11.328266924604769, 'bull_atr_min_pct': 0.01901305035806683, 'bull_atr_max_pct': 0.06737467164172081, 'bull_tp_mult': 1.2111857563067445, 'bull_tsl_mult': 0.9654656859745475, 'bull_time_stop': 165, 'bull_use_sma': True, 'bull_use_ema': True, 'bull_use_atr': True, 'bull_use_adx': True, 'bull_use_spike': True, 'bull_rsi_required': False, 'bear_strategy': 'mean_reversion', 'bear_bb_std_mult': 3.5949356298322095, 'bear_rsi_os': 43, 'bear_rsi_ob': 87, 'bear_adx_thresh': 11.077537899422538, 'bear_atr_min_pct': 0.004832595896335064, 'bear_atr_max_pct': 0.036230495166747784, 'bear_tp_mult': 2.830188036688054, 'bear_tsl_mult': 0.12340013058841401, 'bear_time_stop': 224, 'bear_use_sma': False, 'bear_use_ema': False, 'bear_use_atr': True, 'bear_use_adx': True, 'bear_use_spike': True, 'bear_rsi_required': True, 'sideways_strategy': 'breakout', 'sideways_bb_std_mult': 1.3778093877464896, 'sideways_rsi_os': 12, 'sideways_rsi_ob': 64, 'sideways_adx_thresh': 11.642518598311113, 'sideways_atr_min_pct': 0.006415129097725225, 'sideways_atr_max_pct': 0.05932909957671056, 'sideways_tp_mult': 2.3381828911287537, 'sideways_tsl_mult': 0.47976183016554175, 'sideways_time_stop': 143, 'sideways_use_sma': False, 'sideways_use_ema': False, 'sideways_use_atr': True, 'sideways_use_adx': False, 'sideways_use_spike': True, 'sideways_rsi_required': True}.
[I 2025-09-01 08:47:11,840] Trial 490 finished with values: [-1000000000.0, 1000000000.0] and parameters: {'p_sma': 34, 'p_std': 36, 'p_atr': 20, 'p_adx': 16, 'rsi_period': 45, 'ema1': 9, 'ema2': 59, 'slip_atr_k': 0.015074299198248813, 'slip_spread_k': 0.14113218459195911, 'spread_hl_frac': 0.019373818507439435, 'bb_std_mult': 2.560959960387976, 'rsi_os': 46, 'rsi_ob': 93, 'vol_spike': 0.016345229414117424, 'adx_thresh': 34.103783614078004, 'atr_min_pct': 0.00834707773192495, 'atr_max_pct': 0.0934402625275692, 'tp_mult': 1.3570592212252481, 'tsl_mult': 0.19060123426364164, 'strategy': 'mean_reversion', 'time_stop': 37, 'use_sma': True, 'use_atr': True, 'use_adx': False, 'use_ema': False, 'use_spike': False, 'rsi_required': False, 'edge_k': 0.8523292197251089, 'edge_cap': 0.28244282754868844, 'bull_strategy': 'mean_reversion', 'bull_bb_std_mult': 2.525175593452979, 'bull_rsi_os': 39, 'bull_rsi_ob': 56, 'bull_adx_thresh': 11.129992058028005, 'bull_atr_min_pct': 0.01959304046922137, 'bull_atr_max_pct': 0.06842010080256507, 'bull_tp_mult': 1.2157952376589223, 'bull_tsl_mult': 0.9616397256909, 'bull_time_stop': 174, 'bull_use_sma': False, 'bull_use_ema': True, 'bull_use_atr': True, 'bull_use_adx': True, 'bull_use_spike': True, 'bull_rsi_required': True, 'bear_strategy': 'breakout', 'bear_bb_std_mult': 3.40297360509829, 'bear_rsi_os': 19, 'bear_rsi_ob': 89, 'bear_adx_thresh': 11.267431942379632, 'bear_atr_min_pct': 0.015305851871864893, 'bear_atr_max_pct': 0.03935416036852256, 'bear_tp_mult': 2.797139165843716, 'bear_tsl_mult': 0.17786029864106562, 'bear_time_stop': 224, 'bear_use_sma': False, 'bear_use_ema': True, 'bear_use_atr': True, 'bear_use_adx': True, 'bear_use_spike': True, 'bear_rsi_required': True, 'sideways_strategy': 'mean_reversion', 'sideways_bb_std_mult': 1.3186218542757564, 'sideways_rsi_os': 12, 'sideways_rsi_ob': 63, 'sideways_adx_thresh': 11.334840581619805, 'sideways_atr_min_pct': 0.008583873862902621, 'sideways_atr_max_pct': 0.07588754943603405, 'sideways_tp_mult': 2.376179132093138, 'sideways_tsl_mult': 0.46811125115893193, 'sideways_time_stop': 152, 'sideways_use_sma': False, 'sideways_use_ema': False, 'sideways_use_atr': False, 'sideways_use_adx': False, 'sideways_use_spike': True, 'sideways_rsi_required': True}.
[I 2025-09-01 08:47:12,155] Trial 489 finished with values: [-1000000000.0, 1000000000.0] and parameters: {'p_sma': 34, 'p_std': 35, 'p_atr': 20, 'p_adx': 16, 'rsi_period': 45, 'ema1': 9, 'ema2': 58, 'slip_atr_k': 0.014217373740285637, 'slip_spread_k': 0.13796704998985046, 'spread_hl_frac': 0.01941501078903944, 'bb_std_mult': 2.510734507576793, 'rsi_os': 46, 'rsi_ob': 93, 'vol_spike': 0.014338632556299327, 'adx_thresh': 34.21545154511353, 'atr_min_pct': 0.0081888965819974, 'atr_max_pct': 0.09474344383346729, 'tp_mult': 1.3372271525931327, 'tsl_mult': 0.18903213741447372, 'strategy': 'mean_reversion', 'time_stop': 37, 'use_sma': True, 'use_atr': True, 'use_adx': False, 'use_ema': False, 'use_spike': False, 'rsi_required': False, 'edge_k': 0.7898879880024973, 'edge_cap': 0.2941768142646312, 'bull_strategy': 'mean_reversion', 'bull_bb_std_mult': 2.5138871378072665, 'bull_rsi_os': 39, 'bull_rsi_ob': 56, 'bull_adx_thresh': 11.197894271280566, 'bull_atr_min_pct': 0.019735266329081153, 'bull_atr_max_pct': 0.06830772073317005, 'bull_tp_mult': 1.202843146165223, 'bull_tsl_mult': 0.9642619651820327, 'bull_time_stop': 174, 'bull_use_sma': False, 'bull_use_ema': True, 'bull_use_atr': True, 'bull_use_adx': True, 'bull_use_spike': True, 'bull_rsi_required': True, 'bear_strategy': 'breakout', 'bear_bb_std_mult': 3.4361052194084425, 'bear_rsi_os': 8, 'bear_rsi_ob': 87, 'bear_adx_thresh': 11.277676729430148, 'bear_atr_min_pct': 0.005059773345229396, 'bear_atr_max_pct': 0.03989351921788122, 'bear_tp_mult': 2.79543577975723, 'bear_tsl_mult': 0.17301592318316805, 'bear_time_stop': 224, 'bear_use_sma': False, 'bear_use_ema': True, 'bear_use_atr': True, 'bear_use_adx': True, 'bear_use_spike': True, 'bear_rsi_required': True, 'sideways_strategy': 'mean_reversion', 'sideways_bb_std_mult': 1.344790608843751, 'sideways_rsi_os': 12, 'sideways_rsi_ob': 63, 'sideways_adx_thresh': 11.298553826531197, 'sideways_atr_min_pct': 0.006876401086264623, 'sideways_atr_max_pct': 0.0762260325454197, 'sideways_tp_mult': 2.383243248085831, 'sideways_tsl_mult': 0.49351130629441026, 'sideways_time_stop': 151, 'sideways_use_sma': False, 'sideways_use_ema': False, 'sideways_use_atr': False, 'sideways_use_adx': False, 'sideways_use_spike': True, 'sideways_rsi_required': True}.
[I 2025-09-01 08:47:12,505] Trial 487 finished with values: [0.011870948246155866, 0.002971146524526442] and parameters: {'p_sma': 35, 'p_std': 36, 'p_atr': 20, 'p_adx': 16, 'rsi_period': 45, 'ema1': 9, 'ema2': 59, 'slip_atr_k': 0.014720309565848085, 'slip_spread_k': 0.14423051460199213, 'spread_hl_frac': 0.01998061142838157, 'bb_std_mult': 2.513036316582071, 'rsi_os': 46, 'rsi_ob': 93, 'vol_spike': 0.016865768307656837, 'adx_thresh': 34.20389229421421, 'atr_min_pct': 0.008382032638672585, 'atr_max_pct': 0.09243570568338412, 'tp_mult': 1.3725537870254665, 'tsl_mult': 0.15320490323582864, 'strategy': 'mean_reversion', 'time_stop': 37, 'use_sma': False, 'use_atr': False, 'use_adx': False, 'use_ema': False, 'use_spike': False, 'rsi_required': False, 'edge_k': 0.853774199243668, 'edge_cap': 0.293329457753227, 'bull_strategy': 'breakout', 'bull_bb_std_mult': 2.215094915450715, 'bull_rsi_os': 39, 'bull_rsi_ob': 55, 'bull_adx_thresh': 11.101370104140733, 'bull_atr_min_pct': 0.019719008593522405, 'bull_atr_max_pct': 0.0770681307566419, 'bull_tp_mult': 1.207940513685917, 'bull_tsl_mult': 0.939328690766228, 'bull_time_stop': 173, 'bull_use_sma': True, 'bull_use_ema': True, 'bull_use_atr': True, 'bull_use_adx': True, 'bull_use_spike': True, 'bull_rsi_required': False, 'bear_strategy': 'mean_reversion', 'bear_bb_std_mult': 3.422483724965402, 'bear_rsi_os': 43, 'bear_rsi_ob': 87, 'bear_adx_thresh': 11.285669892316992, 'bear_atr_min_pct': 0.005126367265581542, 'bear_atr_max_pct': 0.037974441110357054, 'bear_tp_mult': 2.810106683395972, 'bear_tsl_mult': 0.1714888280938224, 'bear_time_stop': 223, 'bear_use_sma': False, 'bear_use_ema': False, 'bear_use_atr': True, 'bear_use_adx': True, 'bear_use_spike': True, 'bear_rsi_required': True, 'sideways_strategy': 'breakout', 'sideways_bb_std_mult': 1.3527988213570532, 'sideways_rsi_os': 12, 'sideways_rsi_ob': 63, 'sideways_adx_thresh': 11.562190011478735, 'sideways_atr_min_pct': 0.007177981618967176, 'sideways_atr_max_pct': 0.057434331047630426, 'sideways_tp_mult': 2.3628559357508516, 'sideways_tsl_mult': 0.5012136456324552, 'sideways_time_stop': 150, 'sideways_use_sma': False, 'sideways_use_ema': False, 'sideways_use_atr': True, 'sideways_use_adx': False, 'sideways_use_spike': True, 'sideways_rsi_required': True}.
[I 2025-09-01 08:47:12,652] Trial 488 finished with values: [0.014087936587997563, 0.002216131998389312] and parameters: {'p_sma': 36, 'p_std': 36, 'p_atr': 20, 'p_adx': 16, 'rsi_period': 45, 'ema1': 9, 'ema2': 58, 'slip_atr_k': 0.013153124783187253, 'slip_spread_k': 0.1423729349015776, 'spread_hl_frac': 0.019822920702103647, 'bb_std_mult': 2.5531835728660655, 'rsi_os': 46, 'rsi_ob': 93, 'vol_spike': 0.01638147140993541, 'adx_thresh': 34.12028205189946, 'atr_min_pct': 0.00822448532563372, 'atr_max_pct': 0.09401686156963641, 'tp_mult': 1.3377844266647476, 'tsl_mult': 0.18610048454213038, 'strategy': 'mean_reversion', 'time_stop': 40, 'use_sma': False, 'use_atr': False, 'use_adx': False, 'use_ema': False, 'use_spike': False, 'rsi_required': False, 'edge_k': 0.9112784041558452, 'edge_cap': 0.2915925210916894, 'bull_strategy': 'breakout', 'bull_bb_std_mult': 2.3730414327765623, 'bull_rsi_os': 39, 'bull_rsi_ob': 55, 'bull_adx_thresh': 11.30261767397699, 'bull_atr_min_pct': 0.019671452934216793, 'bull_atr_max_pct': 0.07682299666637943, 'bull_tp_mult': 1.2069823223282359, 'bull_tsl_mult': 0.9313103533330208, 'bull_time_stop': 173, 'bull_use_sma': True, 'bull_use_ema': True, 'bull_use_atr': True, 'bull_use_adx': True, 'bull_use_spike': True, 'bull_rsi_required': False, 'bear_strategy': 'mean_reversion', 'bear_bb_std_mult': 3.4231866095773245, 'bear_rsi_os': 43, 'bear_rsi_ob': 87, 'bear_adx_thresh': 11.392889884329854, 'bear_atr_min_pct': 0.005250967756680131, 'bear_atr_max_pct': 0.03935989529544217, 'bear_tp_mult': 2.8086173162076653, 'bear_tsl_mult': 0.18215296076757292, 'bear_time_stop': 224, 'bear_use_sma': False, 'bear_use_ema': False, 'bear_use_atr': True, 'bear_use_adx': True, 'bear_use_spike': True, 'bear_rsi_required': True, 'sideways_strategy': 'breakout', 'sideways_bb_std_mult': 1.3487954676819598, 'sideways_rsi_os': 12, 'sideways_rsi_ob': 63, 'sideways_adx_thresh': 11.842609616436546, 'sideways_atr_min_pct': 0.007307004189922072, 'sideways_atr_max_pct': 0.05694581289401128, 'sideways_tp_mult': 2.3714344569909582, 'sideways_tsl_mult': 0.4921884576573215, 'sideways_time_stop': 151, 'sideways_use_sma': False, 'sideways_use_ema': False, 'sideways_use_atr': True, 'sideways_use_adx': False, 'sideways_use_spike': True, 'sideways_rsi_required': True}.
[I 2025-09-01 08:47:13,686] Trial 491 finished with values: [-1000000000.0, 1000000000.0] and parameters: {'p_sma': 33, 'p_std': 37, 'p_atr': 20, 'p_adx': 14, 'rsi_period': 41, 'ema1': 9, 'ema2': 58, 'slip_atr_k': 0.012845474754618582, 'slip_spread_k': 0.14285037230433825, 'spread_hl_frac': 0.0199098917143035, 'bb_std_mult': 2.50798748944597, 'rsi_os': 46, 'rsi_ob': 47, 'vol_spike': 0.017931823058618276, 'adx_thresh': 33.533671215887516, 'atr_min_pct': 0.008973233076243325, 'atr_max_pct': 0.09070220264837002, 'tp_mult': 1.3903719390599998, 'tsl_mult': 0.15881668490716697, 'strategy': 'mean_reversion', 'time_stop': 38, 'use_sma': True, 'use_atr': True, 'use_adx': False, 'use_ema': False, 'use_spike': False, 'rsi_required': False, 'edge_k': 0.7816368842392184, 'edge_cap': 0.30340590413754465, 'bull_strategy': 'mean_reversion', 'bull_bb_std_mult': 2.5354295525698487, 'bull_rsi_os': 39, 'bull_rsi_ob': 56, 'bull_adx_thresh': 11.211189084062356, 'bull_atr_min_pct': 0.019099379471438763, 'bull_atr_max_pct': 0.0690883320147826, 'bull_tp_mult': 1.2018800899692363, 'bull_tsl_mult': 0.9656337178905826, 'bull_time_stop': 169, 'bull_use_sma': False, 'bull_use_ema': True, 'bull_use_atr': True, 'bull_use_adx': True, 'bull_use_spike': True, 'bull_rsi_required': True, 'bear_strategy': 'breakout', 'bear_bb_std_mult': 3.443007196523862, 'bear_rsi_os': 8, 'bear_rsi_ob': 90, 'bear_adx_thresh': 11.728442139246932, 'bear_atr_min_pct': 0.005549023172420973, 'bear_atr_max_pct': 0.037484409893844155, 'bear_tp_mult': 2.833215558123523, 'bear_tsl_mult': 0.16085911526937058, 'bear_time_stop': 226, 'bear_use_sma': False, 'bear_use_ema': True, 'bear_use_atr': True, 'bear_use_adx': True, 'bear_use_spike': True, 'bear_rsi_required': True, 'sideways_strategy': 'mean_reversion', 'sideways_bb_std_mult': 1.3494532093137306, 'sideways_rsi_os': 12, 'sideways_rsi_ob': 64, 'sideways_adx_thresh': 11.568070922094895, 'sideways_atr_min_pct': 0.006996518333991527, 'sideways_atr_max_pct': 0.06416654936675091, 'sideways_tp_mult': 2.4067397882202006, 'sideways_tsl_mult': 0.4941934298172281, 'sideways_time_stop': 150, 'sideways_use_sma': False, 'sideways_use_ema': False, 'sideways_use_atr': False, 'sideways_use_adx': False, 'sideways_use_spike': True, 'sideways_rsi_required': True}.
[I 2025-09-01 08:47:56,991] Trial 493 finished with values: [-1000000000.0, 1000000000.0] and parameters: {'p_sma': 33, 'p_std': 36, 'p_atr': 20, 'p_adx': 14, 'rsi_period': 41, 'ema1': 9, 'ema2': 57, 'slip_atr_k': 0.013444889143990545, 'slip_spread_k': 0.14775177315425794, 'spread_hl_frac': 0.02014146921087749, 'bb_std_mult': 2.497416735207184, 'rsi_os': 47, 'rsi_ob': 93, 'vol_spike': 0.01736689172133878, 'adx_thresh': 33.49303255188805, 'atr_min_pct': 0.009195900132321059, 'atr_max_pct': 0.09139107023343956, 'tp_mult': 1.3834027093262171, 'tsl_mult': 0.16085844387547252, 'strategy': 'mean_reversion', 'time_stop': 39, 'use_sma': True, 'use_atr': True, 'use_adx': False, 'use_ema': False, 'use_spike': False, 'rsi_required': False, 'edge_k': 0.803766868202504, 'edge_cap': 0.2961147359214648, 'bull_strategy': 'mean_reversion', 'bull_bb_std_mult': 2.5659853661567595, 'bull_rsi_os': 40, 'bull_rsi_ob': 56, 'bull_adx_thresh': 11.11277124945344, 'bull_atr_min_pct': 0.019094557986516384, 'bull_atr_max_pct': 0.06942794256586166, 'bull_tp_mult': 1.1622997785334068, 'bull_tsl_mult': 0.925433408119203, 'bull_time_stop': 168, 'bull_use_sma': False, 'bull_use_ema': True, 'bull_use_atr': True, 'bull_use_adx': True, 'bull_use_spike': True, 'bull_rsi_required': True, 'bear_strategy': 'breakout', 'bear_bb_std_mult': 3.5976098549031823, 'bear_rsi_os': 43, 'bear_rsi_ob': 90, 'bear_adx_thresh': 11.714422868146558, 'bear_atr_min_pct': 0.01658652759779935, 'bear_atr_max_pct': 0.03823541982648293, 'bear_tp_mult': 2.8341162231833765, 'bear_tsl_mult': 0.1409179690355544, 'bear_time_stop': 227, 'bear_use_sma': False, 'bear_use_ema': True, 'bear_use_atr': True, 'bear_use_adx': True, 'bear_use_spike': True, 'bear_rsi_required': True, 'sideways_strategy': 'mean_reversion', 'sideways_bb_std_mult': 1.3697570908177765, 'sideways_rsi_os': 12, 'sideways_rsi_ob': 64, 'sideways_adx_thresh': 32.06294385996681, 'sideways_atr_min_pct': 0.0060199684016855135, 'sideways_atr_max_pct': 0.06542161180728895, 'sideways_tp_mult': 2.416190714422962, 'sideways_tsl_mult': 0.47343929363618226, 'sideways_time_stop': 149, 'sideways_use_sma': False, 'sideways_use_ema': False, 'sideways_use_atr': False, 'sideways_use_adx': False, 'sideways_use_spike': True, 'sideways_rsi_required': True}.
[I 2025-09-01 08:47:57,616] Trial 492 finished with values: [-1000000000.0, 1000000000.0] and parameters: {'p_sma': 33, 'p_std': 36, 'p_atr': 20, 'p_adx': 14, 'rsi_period': 41, 'ema1': 9, 'ema2': 57, 'slip_atr_k': 0.01496821826403632, 'slip_spread_k': 0.1492995699941703, 'spread_hl_frac': 0.02021868333822912, 'bb_std_mult': 2.471242386352823, 'rsi_os': 45, 'rsi_ob': 94, 'vol_spike': 0.018324236648443296, 'adx_thresh': 33.684219205664306, 'atr_min_pct': 0.00914266781696917, 'atr_max_pct': 0.09159417320384025, 'tp_mult': 1.3744083834155372, 'tsl_mult': 0.17543707712469292, 'strategy': 'mean_reversion', 'time_stop': 39, 'use_sma': True, 'use_atr': True, 'use_adx': False, 'use_ema': False, 'use_spike': False, 'rsi_required': False, 'edge_k': 0.8036476596888622, 'edge_cap': 0.2922472638453976, 'bull_strategy': 'mean_reversion', 'bull_bb_std_mult': 2.5598769514960993, 'bull_rsi_os': 40, 'bull_rsi_ob': 56, 'bull_adx_thresh': 11.02970067174987, 'bull_atr_min_pct': 0.019035555123936884, 'bull_atr_max_pct': 0.06876314014670917, 'bull_tp_mult': 1.1572196503061447, 'bull_tsl_mult': 0.9247622766823742, 'bull_time_stop': 168, 'bull_use_sma': False, 'bull_use_ema': True, 'bull_use_atr': True, 'bull_use_adx': True, 'bull_use_spike': True, 'bull_rsi_required': True, 'bear_strategy': 'breakout', 'bear_bb_std_mult': 3.5991717424400145, 'bear_rsi_os': 36, 'bear_rsi_ob': 90, 'bear_adx_thresh': 11.98973178964982, 'bear_atr_min_pct': 0.024231122463170697, 'bear_atr_max_pct': 0.037727541460261915, 'bear_tp_mult': 2.8431028963219456, 'bear_tsl_mult': 0.15308594079570728, 'bear_time_stop': 228, 'bear_use_sma': False, 'bear_use_ema': False, 'bear_use_atr': True, 'bear_use_adx': True, 'bear_use_spike': True, 'bear_rsi_required': True, 'sideways_strategy': 'mean_reversion', 'sideways_bb_std_mult': 1.3482270653786497, 'sideways_rsi_os': 12, 'sideways_rsi_ob': 64, 'sideways_adx_thresh': 32.18350206084381, 'sideways_atr_min_pct': 0.006142903238107188, 'sideways_atr_max_pct': 0.06523611727397807, 'sideways_tp_mult': 2.4105208448760864, 'sideways_tsl_mult': 0.4677518027641924, 'sideways_time_stop': 145, 'sideways_use_sma': False, 'sideways_use_ema': False, 'sideways_use_atr': False, 'sideways_use_adx': False, 'sideways_use_spike': True, 'sideways_rsi_required': True}.
[I 2025-09-01 08:47:58,027] Trial 494 finished with values: [0.010688605411897978, 0.0021939626892250094] and parameters: {'p_sma': 37, 'p_std': 37, 'p_atr': 20, 'p_adx': 14, 'rsi_period': 42, 'ema1': 9, 'ema2': 57, 'slip_atr_k': 0.012734739425486294, 'slip_spread_k': 0.14258567428254923, 'spread_hl_frac': 0.020273053098490236, 'bb_std_mult': 2.523641712941207, 'rsi_os': 47, 'rsi_ob': 94, 'vol_spike': 0.008261466950896119, 'adx_thresh': 33.55712422394333, 'atr_min_pct': 0.00898954441132655, 'atr_max_pct': 0.09092007383948025, 'tp_mult': 1.3029317267139882, 'tsl_mult': 0.1830423638310826, 'strategy': 'mean_reversion', 'time_stop': 40, 'use_sma': False, 'use_atr': False, 'use_adx': False, 'use_ema': False, 'use_spike': False, 'rsi_required': False, 'edge_k': 0.9049253564155277, 'edge_cap': 0.2936486243738712, 'bull_strategy': 'breakout', 'bull_bb_std_mult': 2.3939132609202285, 'bull_rsi_os': 39, 'bull_rsi_ob': 55, 'bull_adx_thresh': 10.748869476414988, 'bull_atr_min_pct': 0.02046602485809452, 'bull_atr_max_pct': 0.07726490496738866, 'bull_tp_mult': 1.1572809363462762, 'bull_tsl_mult': 0.9263600539967343, 'bull_time_stop': 171, 'bull_use_sma': True, 'bull_use_ema': True, 'bull_use_atr': True, 'bull_use_adx': True, 'bull_use_spike': True, 'bull_rsi_required': False, 'bear_strategy': 'mean_reversion', 'bear_bb_std_mult': 3.3372855034369535, 'bear_rsi_os': 43, 'bear_rsi_ob': 90, 'bear_adx_thresh': 11.933923709463238, 'bear_atr_min_pct': 0.005424467237419272, 'bear_atr_max_pct': 0.042158812369913194, 'bear_tp_mult': 2.8330061679333727, 'bear_tsl_mult': 0.2063029249481433, 'bear_time_stop': 219, 'bear_use_sma': False, 'bear_use_ema': False, 'bear_use_atr': True, 'bear_use_adx': True, 'bear_use_spike': True, 'bear_rsi_required': True, 'sideways_strategy': 'breakout', 'sideways_bb_std_mult': 1.3555185467168558, 'sideways_rsi_os': 12, 'sideways_rsi_ob': 64, 'sideways_adx_thresh': 11.655154352824106, 'sideways_atr_min_pct': 0.007388800907998117, 'sideways_atr_max_pct': 0.0655579869171222, 'sideways_tp_mult': 2.400426723977811, 'sideways_tsl_mult': 0.5098939408288916, 'sideways_time_stop': 153, 'sideways_use_sma': False, 'sideways_use_ema': False, 'sideways_use_atr': True, 'sideways_use_adx': False, 'sideways_use_spike': True, 'sideways_rsi_required': True}.
