[I 2025-09-01 07:39:22,775] Trial 111 finished with values: [-1000000000.0, 1000000000.0] and parameters: {'p_sma': 54, 'p_std': 13, 'p_atr': 9, 'p_adx': 13, 'rsi_period': 30, 'ema1': 11, 'ema2': 50, 'slip_atr_k': 0.132199990519153, 'slip_spread_k': 0.6565099429446998, 'spread_hl_frac': 0.009304076432866147, 'bb_std_mult': 1.9799058984319813, 'rsi_os': 13, 'rsi_ob': 74, 'vol_spike': 0.2997450200085653, 'adx_thresh': 8.412331960936351, 'atr_min_pct': 0.027231061983048754, 'atr_max_pct': 0.11273471244730013, 'tp_mult': 1.7493185485778104, 'tsl_mult': 0.7172132457271028, 'strategy': 'breakout', 'time_stop': 266, 'use_sma': False, 'use_atr': True, 'use_adx': True, 'use_ema': True, 'use_spike': True, 'rsi_required': True, 'edge_k': 1.3215783465391977, 'edge_cap': 0.323233127566247, 'bull_strategy': 'mean_reversion', 'bull_bb_std_mult': 3.3354797284967175, 'bull_rsi_os': 36, 'bull_rsi_ob': 71, 'bull_adx_thresh': 21.54108272675372, 'bull_atr_min_pct': 0.011108460051655191, 'bull_atr_max_pct': 0.1425187121415446, 'bull_tp_mult': 1.9171878681656436, 'bull_tsl_mult': 0.6813204584360314, 'bull_time_stop': 215, 'bull_use_sma': False, 'bull_use_ema': False, 'bull_use_atr': False, 'bull_use_adx': False, 'bull_use_spike': True, 'bull_rsi_required': True, 'bear_strategy': 'breakout', 'bear_bb_std_mult': 1.445471689733533, 'bear_rsi_os': 51, 'bear_rsi_ob': 61, 'bear_adx_thresh': 30.722437329792534, 'bear_atr_min_pct': 0.005575326769545898, 'bear_atr_max_pct': 0.09932689783718218, 'bear_tp_mult': 1.9641041958716323, 'bear_tsl_mult': 0.2957245092971719, 'bear_time_stop': 180, 'bear_use_sma': False, 'bear_use_ema': True, 'bear_use_atr': False, 'bear_use_adx': True, 'bear_use_spike': False, 'bear_rsi_required': True, 'sideways_strategy': 'mean_reversion', 'sideways_bb_std_mult': 1.5623133338290394, 'sideways_rsi_os': 40, 'sideways_rsi_ob': 85, 'sideways_adx_thresh': 28.066247033246576, 'sideways_atr_min_pct': 0.025603412327801126, 'sideways_atr_max_pct': 0.021756673169551044, 'sideways_tp_mult': 1.5058342506433366, 'sideways_tsl_mult': 0.5731584881033687, 'sideways_time_stop': 79, 'sideways_use_sma': True, 'sideways_use_ema': True, 'sideways_use_atr': False, 'sideways_use_adx': True, 'sideways_use_spike': True, 'sideways_rsi_required': True}.
[I 2025-09-01 07:39:22,790] Trial 109 finished with values: [-1000000000.0, 1000000000.0] and parameters: {'p_sma': 54, 'p_std': 40, 'p_atr': 8, 'p_adx': 20, 'rsi_period': 35, 'ema1': 20, 'ema2': 15, 'slip_atr_k': 0.13289415197836194, 'slip_spread_k': 0.5280282551411021, 'spread_hl_frac': 0.02718972414483923, 'bb_std_mult': 0.5597895839911766, 'rsi_os': 25, 'rsi_ob': 75, 'vol_spike': 0.2907338280333086, 'adx_thresh': 8.360047407894598, 'atr_min_pct': 0.004871558202344252, 'atr_max_pct': 0.05578063531364293, 'tp_mult': 1.6922588118068167, 'tsl_mult': 0.42871273789905706, 'strategy': 'breakout', 'time_stop': 269, 'use_sma': False, 'use_atr': True, 'use_adx': True, 'use_ema': True, 'use_spike': True, 'rsi_required': False, 'edge_k': 0.5654130646946285, 'edge_cap': 0.3240988206452242, 'bull_strategy': 'mean_reversion', 'bull_bb_std_mult': 2.4095357966737962, 'bull_rsi_os': 22, 'bull_rsi_ob': 86, 'bull_adx_thresh': 14.988038165866492, 'bull_atr_min_pct': 0.028022231427421176, 'bull_atr_max_pct': 0.1419585282865658, 'bull_tp_mult': 2.0052428661196404, 'bull_tsl_mult': 0.7030819144902799, 'bull_time_stop': 211, 'bull_use_sma': False, 'bull_use_ema': False, 'bull_use_atr': False, 'bull_use_adx': False, 'bull_use_spike': True, 'bull_rsi_required': True, 'bear_strategy': 'breakout', 'bear_bb_std_mult': 1.4496263812474308, 'bear_rsi_os': 18, 'bear_rsi_ob': 57, 'bear_adx_thresh': 28.08333618193892, 'bear_atr_min_pct': 0.029718098971929018, 'bear_atr_max_pct': 0.015257101845247978, 'bear_tp_mult': 1.0990520046898127, 'bear_tsl_mult': 0.3903322893414353, 'bear_time_stop': 107, 'bear_use_sma': False, 'bear_use_ema': True, 'bear_use_atr': True, 'bear_use_adx': True, 'bear_use_spike': False, 'bear_rsi_required': True, 'sideways_strategy': 'breakout', 'sideways_bb_std_mult': 1.631895757906027, 'sideways_rsi_os': 14, 'sideways_rsi_ob': 51, 'sideways_adx_thresh': 16.535233463359084, 'sideways_atr_min_pct': 0.013715326687383346, 'sideways_atr_max_pct': 0.01008191698192089, 'sideways_tp_mult': 1.6127238490182316, 'sideways_tsl_mult': 0.6487634600370557, 'sideways_time_stop': 77, 'sideways_use_sma': False, 'sideways_use_ema': True, 'sideways_use_atr': False, 'sideways_use_adx': False, 'sideways_use_spike': True, 'sideways_rsi_required': False}.
[I 2025-09-01 07:39:22,798] Trial 110 finished with values: [-1000000000.0, 1000000000.0] and parameters: {'p_sma': 54, 'p_std': 13, 'p_atr': 23, 'p_adx': 20, 'rsi_period': 36, 'ema1': 20, 'ema2': 15, 'slip_atr_k': 0.13331391159336212, 'slip_spread_k': 0.47791438906392697, 'spread_hl_frac': 0.0021154902903754887, 'bb_std_mult': 0.9555483391418131, 'rsi_os': 40, 'rsi_ob': 75, 'vol_spike': 0.28431886054576094, 'adx_thresh': 15.241647592799632, 'atr_min_pct': 0.026976846464302033, 'atr_max_pct': 0.04755946994184809, 'tp_mult': 1.6880217879316344, 'tsl_mult': 0.4399589787035001, 'strategy': 'breakout', 'time_stop': 261, 'use_sma': False, 'use_atr': True, 'use_adx': True, 'use_ema': True, 'use_spike': True, 'rsi_required': False, 'edge_k': 1.8012094478385139, 'edge_cap': 0.3317857397849051, 'bull_strategy': 'mean_reversion', 'bull_bb_std_mult': 3.3494311566825394, 'bull_rsi_os': 28, 'bull_rsi_ob': 71, 'bull_adx_thresh': 21.173796669313255, 'bull_atr_min_pct': 0.01107994438433537, 'bull_atr_max_pct': 0.13937734434245597, 'bull_tp_mult': 1.3119885518736245, 'bull_tsl_mult': 0.0013122429860660222, 'bull_time_stop': 65, 'bull_use_sma': False, 'bull_use_ema': False, 'bull_use_atr': False, 'bull_use_adx': False, 'bull_use_spike': True, 'bull_rsi_required': True, 'bear_strategy': 'breakout', 'bear_bb_std_mult': 1.4230492668861798, 'bear_rsi_os': 18, 'bear_rsi_ob': 86, 'bear_adx_thresh': 28.627582129414442, 'bear_atr_min_pct': 0.02868108648384297, 'bear_atr_max_pct': 0.09855473711627903, 'bear_tp_mult': 1.0898330008792732, 'bear_tsl_mult': 0.39639913730409176, 'bear_time_stop': 97, 'bear_use_sma': False, 'bear_use_ema': True, 'bear_use_atr': True, 'bear_use_adx': True, 'bear_use_spike': False, 'bear_rsi_required': True, 'sideways_strategy': 'breakout', 'sideways_bb_std_mult': 1.5608726227644723, 'sideways_rsi_os': 40, 'sideways_rsi_ob': 52, 'sideways_adx_thresh': 27.840860803100288, 'sideways_atr_min_pct': 0.016242747265864797, 'sideways_atr_max_pct': 0.02118701788622209, 'sideways_tp_mult': 1.1537048103888146, 'sideways_tsl_mult': 0.14757690311806854, 'sideways_time_stop': 299, 'sideways_use_sma': False, 'sideways_use_ema': True, 'sideways_use_atr': False, 'sideways_use_adx': False, 'sideways_use_spike': True, 'sideways_rsi_required': False}.
[I 2025-09-01 07:39:23,000] Trial 108 finished with values: [-1000000000.0, 1000000000.0] and parameters: {'p_sma': 47, 'p_std': 20, 'p_atr': 23, 'p_adx': 13, 'rsi_period': 12, 'ema1': 16, 'ema2': 15, 'slip_atr_k': 0.13372111606145318, 'slip_spread_k': 0.3325722986043246, 'spread_hl_frac': 0.026739542642316975, 'bb_std_mult': 2.839834145299997, 'rsi_os': 40, 'rsi_ob': 75, 'vol_spike': 0.13778578497428737, 'adx_thresh': 8.811149775251492, 'atr_min_pct': 0.027256535254929277, 'atr_max_pct': 0.08022202484859134, 'tp_mult': 1.7532930134949436, 'tsl_mult': 0.7371829314320344, 'strategy': 'breakout', 'time_stop': 265, 'use_sma': False, 'use_atr': True, 'use_adx': True, 'use_ema': True, 'use_spike': True, 'rsi_required': False, 'edge_k': 1.795169742534862, 'edge_cap': 0.3334759039833239, 'bull_strategy': 'mean_reversion', 'bull_bb_std_mult': 3.355570714856349, 'bull_rsi_os': 42, 'bull_rsi_ob': 70, 'bull_adx_thresh': 7.90032451732287, 'bull_atr_min_pct': 0.011044931619608879, 'bull_atr_max_pct': 0.07513528171460498, 'bull_tp_mult': 1.2723692017697994, 'bull_tsl_mult': 0.5997969906234569, 'bull_time_stop': 212, 'bull_use_sma': False, 'bull_use_ema': True, 'bull_use_atr': False, 'bull_use_adx': False, 'bull_use_spike': True, 'bull_rsi_required': True, 'bear_strategy': 'breakout', 'bear_bb_std_mult': 2.6872182510276375, 'bear_rsi_os': 24, 'bear_rsi_ob': 56, 'bear_adx_thresh': 28.403494681896163, 'bear_atr_min_pct': 0.02863514502334618, 'bear_atr_max_pct': 0.017087105912923617, 'bear_tp_mult': 1.1035284985333955, 'bear_tsl_mult': 0.7576321689604696, 'bear_time_stop': 109, 'bear_use_sma': False, 'bear_use_ema': False, 'bear_use_atr': False, 'bear_use_adx': False, 'bear_use_spike': False, 'bear_rsi_required': True, 'sideways_strategy': 'breakout', 'sideways_bb_std_mult': 1.6337674808141536, 'sideways_rsi_os': 40, 'sideways_rsi_ob': 64, 'sideways_adx_thresh': 32.244950152602016, 'sideways_atr_min_pct': 0.008785640377543088, 'sideways_atr_max_pct': 0.022531300979536345, 'sideways_tp_mult': 1.1623529905908438, 'sideways_tsl_mult': 0.13071196297155457, 'sideways_time_stop': 81, 'sideways_use_sma': False, 'sideways_use_ema': True, 'sideways_use_atr': False, 'sideways_use_adx': False, 'sideways_use_spike': True, 'sideways_rsi_required': True}.
[I 2025-09-01 07:40:06,381] Trial 114 finished with values: [-1000000000.0, 1000000000.0] and parameters: {'p_sma': 44, 'p_std': 32, 'p_atr': 18, 'p_adx': 10, 'rsi_period': 28, 'ema1': 14, 'ema2': 17, 'slip_atr_k': 0.10864208387159442, 'slip_spread_k': 0.5819385370901398, 'spread_hl_frac': 0.015525147924796413, 'bb_std_mult': 0.5061233891406818, 'rsi_os': 12, 'rsi_ob': 79, 'vol_spike': 0.2767874519538219, 'adx_thresh': 31.218319677208584, 'atr_min_pct': 0.02991583199995814, 'atr_max_pct': 0.10560466311607347, 'tp_mult': 2.06024457137733, 'tsl_mult': 0.3079049538901864, 'strategy': 'mean_reversion', 'time_stop': 146, 'use_sma': True, 'use_atr': False, 'use_adx': False, 'use_ema': False, 'use_spike': False, 'rsi_required': False, 'edge_k': 1.0167162816923287, 'edge_cap': 0.7244645319851081, 'bull_strategy': 'breakout', 'bull_bb_std_mult': 2.6474389694851865, 'bull_rsi_os': 29, 'bull_rsi_ob': 82, 'bull_adx_thresh': 9.040702611993984, 'bull_atr_min_pct': 0.004687162137106165, 'bull_atr_max_pct': 0.07939015088935102, 'bull_tp_mult': 1.559973642640616, 'bull_tsl_mult': 0.033157964072847636, 'bull_time_stop': 204, 'bull_use_sma': True, 'bull_use_ema': True, 'bull_use_atr': True, 'bull_use_adx': True, 'bull_use_spike': True, 'bull_rsi_required': False, 'bear_strategy': 'mean_reversion', 'bear_bb_std_mult': 1.272378044663469, 'bear_rsi_os': 42, 'bear_rsi_ob': 55, 'bear_adx_thresh': 27.28680256757586, 'bear_atr_min_pct': 0.02930616081783191, 'bear_atr_max_pct': 0.037961052130941204, 'bear_tp_mult': 1.2015990573811783, 'bear_tsl_mult': 0.4246934091101046, 'bear_time_stop': 140, 'bear_use_sma': True, 'bear_use_ema': False, 'bear_use_atr': False, 'bear_use_adx': False, 'bear_use_spike': True, 'bear_rsi_required': False, 'sideways_strategy': 'mean_reversion', 'sideways_bb_std_mult': 2.47380702844233, 'sideways_rsi_os': 44, 'sideways_rsi_ob': 67, 'sideways_adx_thresh': 30.59479251657447, 'sideways_atr_min_pct': 0.012512013371866077, 'sideways_atr_max_pct': 0.03142165291962376, 'sideways_tp_mult': 2.1515612105880626, 'sideways_tsl_mult': 0.04736363145844896, 'sideways_time_stop': 48, 'sideways_use_sma': False, 'sideways_use_ema': False, 'sideways_use_atr': True, 'sideways_use_adx': False, 'sideways_use_spike': False, 'sideways_rsi_required': True}.
[I 2025-09-01 07:40:07,145] Trial 115 finished with values: [-0.01690421918723628, 0.0192569174386487] and parameters: {'p_sma': 44, 'p_std': 32, 'p_atr': 18, 'p_adx': 10, 'rsi_period': 55, 'ema1': 27, 'ema2': 17, 'slip_atr_k': 0.10769133054485353, 'slip_spread_k': 0.5805741387253435, 'spread_hl_frac': 0.014238709435598934, 'bb_std_mult': 0.6739276495809521, 'rsi_os': 30, 'rsi_ob': 73, 'vol_spike': 0.20625052990682785, 'adx_thresh': 9.976718973688183, 'atr_min_pct': 0.02891427776280868, 'atr_max_pct': 0.07065256742445164, 'tp_mult': 2.748644427944302, 'tsl_mult': 0.9131291427852626, 'strategy': 'mean_reversion', 'time_stop': 252, 'use_sma': True, 'use_atr': False, 'use_adx': False, 'use_ema': False, 'use_spike': False, 'rsi_required': False, 'edge_k': 0.6787862046017286, 'edge_cap': 0.7282330765004199, 'bull_strategy': 'breakout', 'bull_bb_std_mult': 2.755851892221953, 'bull_rsi_os': 33, 'bull_rsi_ob': 59, 'bull_adx_thresh': 8.972193983941752, 'bull_atr_min_pct': 0.004432886883013251, 'bull_atr_max_pct': 0.10198884769897236, 'bull_tp_mult': 1.7801738224689374, 'bull_tsl_mult': 0.024093996261141067, 'bull_time_stop': 201, 'bull_use_sma': True, 'bull_use_ema': True, 'bull_use_atr': True, 'bull_use_adx': True, 'bull_use_spike': True, 'bull_rsi_required': False, 'bear_strategy': 'mean_reversion', 'bear_bb_std_mult': 1.8159374118944949, 'bear_rsi_os': 31, 'bear_rsi_ob': 77, 'bear_adx_thresh': 27.478263108324967, 'bear_atr_min_pct': 0.002737817983947918, 'bear_atr_max_pct': 0.07510561344269061, 'bear_tp_mult': 1.1841858700129242, 'bear_tsl_mult': 0.43469689232206515, 'bear_time_stop': 139, 'bear_use_sma': True, 'bear_use_ema': False, 'bear_use_atr': False, 'bear_use_adx': False, 'bear_use_spike': True, 'bear_rsi_required': False, 'sideways_strategy': 'mean_reversion', 'sideways_bb_std_mult': 2.4565326313059317, 'sideways_rsi_os': 44, 'sideways_rsi_ob': 54, 'sideways_adx_thresh': 30.291795762113523, 'sideways_atr_min_pct': 0.02837660680759315, 'sideways_atr_max_pct': 0.030875490795382203, 'sideways_tp_mult': 2.1448027558437146, 'sideways_tsl_mult': 0.41233627350702806, 'sideways_time_stop': 46, 'sideways_use_sma': False, 'sideways_use_ema': False, 'sideways_use_atr': True, 'sideways_use_adx': False, 'sideways_use_spike': False, 'sideways_rsi_required': True}.
[I 2025-09-01 07:40:08,737] Trial 112 finished with values: [-0.07545048250688247, 0.0754067215081962] and parameters: {'p_sma': 43, 'p_std': 32, 'p_atr': 18, 'p_adx': 10, 'rsi_period': 13, 'ema1': 16, 'ema2': 17, 'slip_atr_k': 0.11449531252574892, 'slip_spread_k': 0.8209900555662063, 'spread_hl_frac': 0.01351931074364024, 'bb_std_mult': 2.8608702549178546, 'rsi_os': 11, 'rsi_ob': 79, 'vol_spike': 0.1427896725117943, 'adx_thresh': 22.56223588762674, 'atr_min_pct': 0.009598425304887654, 'atr_max_pct': 0.10463939465768075, 'tp_mult': 1.7660601829355416, 'tsl_mult': 0.3580281523535741, 'strategy': 'mean_reversion', 'time_stop': 147, 'use_sma': True, 'use_atr': False, 'use_adx': False, 'use_ema': False, 'use_spike': False, 'rsi_required': False, 'edge_k': 0.6698833126219557, 'edge_cap': 0.8551814241849527, 'bull_strategy': 'breakout', 'bull_bb_std_mult': 2.693650441846988, 'bull_rsi_os': 42, 'bull_rsi_ob': 58, 'bull_adx_thresh': 8.624827824107971, 'bull_atr_min_pct': 0.021781011311009596, 'bull_atr_max_pct': 0.07505311854193948, 'bull_tp_mult': 1.7783594061790395, 'bull_tsl_mult': 0.0364649566969183, 'bull_time_stop': 232, 'bull_use_sma': True, 'bull_use_ema': True, 'bull_use_atr': True, 'bull_use_adx': False, 'bull_use_spike': True, 'bull_rsi_required': False, 'bear_strategy': 'mean_reversion', 'bear_bb_std_mult': 2.73710065301096, 'bear_rsi_os': 42, 'bear_rsi_ob': 56, 'bear_adx_thresh': 17.94096299653019, 'bear_atr_min_pct': 0.002853787989158533, 'bear_atr_max_pct': 0.07406983632086592, 'bear_tp_mult': 1.207434051064466, 'bear_tsl_mult': 0.836207560916681, 'bear_time_stop': 135, 'bear_use_sma': True, 'bear_use_ema': False, 'bear_use_atr': False, 'bear_use_adx': False, 'bear_use_spike': False, 'bear_rsi_required': False, 'sideways_strategy': 'mean_reversion', 'sideways_bb_std_mult': 2.4829687370081817, 'sideways_rsi_os': 43, 'sideways_rsi_ob': 61, 'sideways_adx_thresh': 30.39391772310625, 'sideways_atr_min_pct': 0.028035563463773665, 'sideways_atr_max_pct': 0.03615628951941277, 'sideways_tp_mult': 1.012966833373425, 'sideways_tsl_mult': 0.4112547978849715, 'sideways_time_stop': 44, 'sideways_use_sma': False, 'sideways_use_ema': False, 'sideways_use_atr': True, 'sideways_use_adx': False, 'sideways_use_spike': False, 'sideways_rsi_required': True}.
[I 2025-09-01 07:40:08,750] Trial 113 finished with values: [-0.05953981611830528, 0.05950550933021515] and parameters: {'p_sma': 43, 'p_std': 32, 'p_atr': 18, 'p_adx': 15, 'rsi_period': 80, 'ema1': 14, 'ema2': 17, 'slip_atr_k': 0.10767380786941885, 'slip_spread_k': 0.5867090207269476, 'spread_hl_frac': 0.014095409643051126, 'bb_std_mult': 0.5026647105637609, 'rsi_os': 11, 'rsi_ob': 80, 'vol_spike': 0.2669392087251985, 'adx_thresh': 32.221523656385045, 'atr_min_pct': 0.02926821811147259, 'atr_max_pct': 0.06982099897908363, 'tp_mult': 2.0692184600391457, 'tsl_mult': 0.3480290859924322, 'strategy': 'mean_reversion', 'time_stop': 149, 'use_sma': True, 'use_atr': False, 'use_adx': False, 'use_ema': False, 'use_spike': False, 'rsi_required': False, 'edge_k': 1.0121218976427273, 'edge_cap': 0.8375373712541228, 'bull_strategy': 'breakout', 'bull_bb_std_mult': 2.702263237631737, 'bull_rsi_os': 33, 'bull_rsi_ob': 67, 'bull_adx_thresh': 28.921296900617, 'bull_atr_min_pct': 0.02175280422331165, 'bull_atr_max_pct': 0.09304437663037302, 'bull_tp_mult': 1.7940833053041754, 'bull_tsl_mult': 0.9973143293171427, 'bull_time_stop': 204, 'bull_use_sma': True, 'bull_use_ema': True, 'bull_use_atr': True, 'bull_use_adx': True, 'bull_use_spike': True, 'bull_rsi_required': False, 'bear_strategy': 'mean_reversion', 'bear_bb_std_mult': 3.1420706781918804, 'bear_rsi_os': 43, 'bear_rsi_ob': 55, 'bear_adx_thresh': 8.369291748937982, 'bear_atr_min_pct': 0.002854163104446996, 'bear_atr_max_pct': 0.13290117389771078, 'bear_tp_mult': 1.0498900265498028, 'bear_tsl_mult': 0.0027546308943781628, 'bear_time_stop': 134, 'bear_use_sma': True, 'bear_use_ema': False, 'bear_use_atr': False, 'bear_use_adx': False, 'bear_use_spike': True, 'bear_rsi_required': False, 'sideways_strategy': 'mean_reversion', 'sideways_bb_std_mult': 2.749502799852279, 'sideways_rsi_os': 43, 'sideways_rsi_ob': 46, 'sideways_adx_thresh': 30.5455980343778, 'sideways_atr_min_pct': 0.012133023227304167, 'sideways_atr_max_pct': 0.03680748584779713, 'sideways_tp_mult': 2.7014675764407317, 'sideways_tsl_mult': 0.6861090039198681, 'sideways_time_stop': 42, 'sideways_use_sma': False, 'sideways_use_ema': False, 'sideways_use_atr': True, 'sideways_use_adx': False, 'sideways_use_spike': False, 'sideways_rsi_required': True}.
[I 2025-09-01 07:40:09,159] Trial 116 finished with values: [-1000000000.0, 1000000000.0] and parameters: {'p_sma': 43, 'p_std': 47, 'p_atr': 27, 'p_adx': 23, 'rsi_period': 79, 'ema1': 17, 'ema2': 11, 'slip_atr_k': 0.11507267731565987, 'slip_spread_k': 0.8422121070540236, 'spread_hl_frac': 0.013485402391980416, 'bb_std_mult': 0.6994583388520728, 'rsi_os': 15, 'rsi_ob': 73, 'vol_spike': 0.2067215812890159, 'adx_thresh': 10.604831822636084, 'atr_min_pct': 0.028906940101130898, 'atr_max_pct': 0.01598738263380073, 'tp_mult': 2.375624708292232, 'tsl_mult': 0.351052786676446, 'strategy': 'mean_reversion', 'time_stop': 121, 'use_sma': True, 'use_atr': False, 'use_adx': False, 'use_ema': False, 'use_spike': False, 'rsi_required': True, 'edge_k': 0.6882719703188108, 'edge_cap': 0.14656097018176578, 'bull_strategy': 'breakout', 'bull_bb_std_mult': 2.7546070045993645, 'bull_rsi_os': 20, 'bull_rsi_ob': 58, 'bull_adx_thresh': 19.985551829016533, 'bull_atr_min_pct': 0.021288646242280242, 'bull_atr_max_pct': 0.11392225805048065, 'bull_tp_mult': 1.8155882693406573, 'bull_tsl_mult': 0.990510421018526, 'bull_time_stop': 140, 'bull_use_sma': True, 'bull_use_ema': True, 'bull_use_atr': True, 'bull_use_adx': False, 'bull_use_spike': True, 'bull_rsi_required': False, 'bear_strategy': 'mean_reversion', 'bear_bb_std_mult': 3.1120329408318392, 'bear_rsi_os': 7, 'bear_rsi_ob': 78, 'bear_adx_thresh': 32.126547046369154, 'bear_atr_min_pct': 0.010404889354033647, 'bear_atr_max_pct': 0.07768050230973694, 'bear_tp_mult': 1.0485060656926186, 'bear_tsl_mult': 0.508376766861094, 'bear_time_stop': 137, 'bear_use_sma': True, 'bear_use_ema': False, 'bear_use_atr': False, 'bear_use_adx': False, 'bear_use_spike': False, 'bear_rsi_required': False, 'sideways_strategy': 'mean_reversion', 'sideways_bb_std_mult': 3.0578547749788183, 'sideways_rsi_os': 38, 'sideways_rsi_ob': 46, 'sideways_adx_thresh': 30.05481406597759, 'sideways_atr_min_pct': 0.01975919214930116, 'sideways_atr_max_pct': 0.03608474822594117, 'sideways_tp_mult': 1.3529228655555428, 'sideways_tsl_mult': 0.4009323444166121, 'sideways_time_stop': 5, 'sideways_use_sma': True, 'sideways_use_ema': False, 'sideways_use_atr': True, 'sideways_use_adx': True, 'sideways_use_spike': False, 'sideways_rsi_required': True}.
