[I 2025-09-01 08:21:57,990] Trial 351 finished with values: [-0.015228925785827796, 0.01534102547425525] and parameters: {'p_sma': 28, 'p_std': 21, 'p_atr': 12, 'p_adx': 20, 'rsi_period': 57, 'ema1': 9, 'ema2': 21, 'slip_atr_k': 0.03754302627705693, 'slip_spread_k': 0.9053137901031829, 'spread_hl_frac': 0.010716133272994494, 'bb_std_mult': 2.176659732749407, 'rsi_os': 51, 'rsi_ob': 87, 'vol_spike': 0.28006073846304835, 'adx_thresh': 30.36241017186446, 'atr_min_pct': 0.00475028820161342, 'atr_max_pct': 0.08393477944412828, 'tp_mult': 1.9113696791378942, 'tsl_mult': 0.059058671033009144, 'strategy': 'breakout', 'time_stop': 199, 'use_sma': True, 'use_atr': False, 'use_adx': True, 'use_ema': True, 'use_spike': True, 'rsi_required': True, 'edge_k': 1.1230212046680303, 'edge_cap': 0.81362493749756, 'bull_strategy': 'breakout', 'bull_bb_std_mult': 1.6521482520426767, 'bull_rsi_os': 38, 'bull_rsi_ob': 46, 'bull_adx_thresh': 7.814155029843315, 'bull_atr_min_pct': 0.002572773154128401, 'bull_atr_max_pct': 0.11327107200123399, 'bull_tp_mult': 1.465696428228426, 'bull_tsl_mult': 0.5223837223330129, 'bull_time_stop': 66, 'bull_use_sma': False, 'bull_use_ema': True, 'bull_use_atr': False, 'bull_use_adx': False, 'bull_use_spike': False, 'bull_rsi_required': True, 'bear_strategy': 'breakout', 'bear_bb_std_mult': 3.1375926443657063, 'bear_rsi_os': 47, 'bear_rsi_ob': 83, 'bear_adx_thresh': 6.246991724982574, 'bear_atr_min_pct': 0.006471730527576271, 'bear_atr_max_pct': 0.12144630577765322, 'bear_tp_mult': 2.9349775731247796, 'bear_tsl_mult': 0.12102553504200156, 'bear_time_stop': 82, 'bear_use_sma': True, 'bear_use_ema': True, 'bear_use_atr': False, 'bear_use_adx': True, 'bear_use_spike': False, 'bear_rsi_required': False, 'sideways_strategy': 'breakout', 'sideways_bb_std_mult': 1.2807232398204669, 'sideways_rsi_os': 9, 'sideways_rsi_ob': 94, 'sideways_adx_thresh': 12.566213969656056, 'sideways_atr_min_pct': 0.02843938396649303, 'sideways_atr_max_pct': 0.021689178086805302, 'sideways_tp_mult': 1.4469241767276735, 'sideways_tsl_mult': 0.8852394277133404, 'sideways_time_stop': 216, 'sideways_use_sma': True, 'sideways_use_ema': True, 'sideways_use_atr': True, 'sideways_use_adx': True, 'sideways_use_spike': False, 'sideways_rsi_required': True}.
[I 2025-09-01 08:22:39,642] Trial 355 finished with values: [-1000000000.0, 1000000000.0] and parameters: {'p_sma': 17, 'p_std': 48, 'p_atr': 21, 'p_adx': 29, 'rsi_period': 53, 'ema1': 12, 'ema2': 18, 'slip_atr_k': 0.06174170200889123, 'slip_spread_k': 0.8329733740442362, 'spread_hl_frac': 0.013924491759145043, 'bb_std_mult': 1.759741885369031, 'rsi_os': 34, 'rsi_ob': 70, 'vol_spike': 0.06694317449228478, 'adx_thresh': 31.762742660107847, 'atr_min_pct': 0.018604594713419277, 'atr_max_pct': 0.14762413522617437, 'tp_mult': 1.110819698081337, 'tsl_mult': 0.02275048453434305, 'strategy': 'breakout', 'time_stop': 237, 'use_sma': False, 'use_atr': False, 'use_adx': True, 'use_ema': True, 'use_spike': True, 'rsi_required': False, 'edge_k': 0.04209039199395459, 'edge_cap': 0.10913635764285667, 'bull_strategy': 'breakout', 'bull_bb_std_mult': 2.93027477875345, 'bull_rsi_os': 48, 'bull_rsi_ob': 59, 'bull_adx_thresh': 6.367066758283007, 'bull_atr_min_pct': 0.0026570538898661525, 'bull_atr_max_pct': 0.03219479237881667, 'bull_tp_mult': 1.5243277714229408, 'bull_tsl_mult': 0.6413105842452747, 'bull_time_stop': 292, 'bull_use_sma': True, 'bull_use_ema': False, 'bull_use_atr': False, 'bull_use_adx': False, 'bull_use_spike': False, 'bull_rsi_required': False, 'bear_strategy': 'mean_reversion', 'bear_bb_std_mult': 1.9125536782966814, 'bear_rsi_os': 35, 'bear_rsi_ob': 47, 'bear_adx_thresh': 5.639177354872575, 'bear_atr_min_pct': 0.015388868789429053, 'bear_atr_max_pct': 0.10109270011486929, 'bear_tp_mult': 2.0272043215371283, 'bear_tsl_mult': 0.08012162229327142, 'bear_time_stop': 217, 'bear_use_sma': False, 'bear_use_ema': False, 'bear_use_atr': False, 'bear_use_adx': False, 'bear_use_spike': False, 'bear_rsi_required': False, 'sideways_strategy': 'breakout', 'sideways_bb_std_mult': 0.9243872426629464, 'sideways_rsi_os': 25, 'sideways_rsi_ob': 95, 'sideways_adx_thresh': 6.8251804924159, 'sideways_atr_min_pct': 0.014378578640691543, 'sideways_atr_max_pct': 0.03930061436493593, 'sideways_tp_mult': 2.7755512861593425, 'sideways_tsl_mult': 0.4264198251349328, 'sideways_time_stop': 18, 'sideways_use_sma': False, 'sideways_use_ema': True, 'sideways_use_atr': True, 'sideways_use_adx': True, 'sideways_use_spike': False, 'sideways_rsi_required': False}.
[I 2025-09-01 08:22:39,675] Trial 352 finished with values: [-0.005165027466942251, 0.005160275366775636] and parameters: {'p_sma': 28, 'p_std': 48, 'p_atr': 25, 'p_adx': 19, 'rsi_period': 55, 'ema1': 5, 'ema2': 28, 'slip_atr_k': 0.009238625208806714, 'slip_spread_k': 0.8379463844125247, 'spread_hl_frac': 0.025180472032032473, 'bb_std_mult': 1.949988890883177, 'rsi_os': 22, 'rsi_ob': 70, 'vol_spike': 0.1882544519468601, 'adx_thresh': 31.89735890832263, 'atr_min_pct': 0.018476224887872667, 'atr_max_pct': 0.1335138409514528, 'tp_mult': 1.9132482564880373, 'tsl_mult': 0.07177474716976463, 'strategy': 'breakout', 'time_stop': 239, 'use_sma': False, 'use_atr': False, 'use_adx': True, 'use_ema': True, 'use_spike': True, 'rsi_required': False, 'edge_k': 0.2709848437128198, 'edge_cap': 0.26053012598411146, 'bull_strategy': 'breakout', 'bull_bb_std_mult': 2.397408606326742, 'bull_rsi_os': 48, 'bull_rsi_ob': 90, 'bull_adx_thresh': 7.871798034597845, 'bull_atr_min_pct': 0.0025954734545791504, 'bull_atr_max_pct': 0.0972097277183645, 'bull_tp_mult': 2.925410434733301, 'bull_tsl_mult': 0.6106527517583609, 'bull_time_stop': 67, 'bull_use_sma': True, 'bull_use_ema': True, 'bull_use_atr': False, 'bull_use_adx': False, 'bull_use_spike': False, 'bull_rsi_required': False, 'bear_strategy': 'mean_reversion', 'bear_bb_std_mult': 2.0695769200478606, 'bear_rsi_os': 48, 'bear_rsi_ob': 87, 'bear_adx_thresh': 5.950297546500229, 'bear_atr_min_pct': 0.006373466836281809, 'bear_atr_max_pct': 0.09964545302489926, 'bear_tp_mult': 2.8552587955660584, 'bear_tsl_mult': 0.7539577178483481, 'bear_time_stop': 293, 'bear_use_sma': True, 'bear_use_ema': True, 'bear_use_atr': False, 'bear_use_adx': True, 'bear_use_spike': False, 'bear_rsi_required': False, 'sideways_strategy': 'breakout', 'sideways_bb_std_mult': 0.9351605328386695, 'sideways_rsi_os': 9, 'sideways_rsi_ob': 74, 'sideways_adx_thresh': 11.634659919334622, 'sideways_atr_min_pct': 0.028238516946167504, 'sideways_atr_max_pct': 0.021882102856384034, 'sideways_tp_mult': 1.125361151391321, 'sideways_tsl_mult': 0.5119353861580059, 'sideways_time_stop': 18, 'sideways_use_sma': False, 'sideways_use_ema': True, 'sideways_use_atr': True, 'sideways_use_adx': True, 'sideways_use_spike': False, 'sideways_rsi_required': True}.
[I 2025-09-01 08:22:40,265] Trial 353 finished with values: [-0.034458559570760716, 0.034371824213582404] and parameters: {'p_sma': 26, 'p_std': 21, 'p_atr': 12, 'p_adx': 19, 'rsi_period': 57, 'ema1': 12, 'ema2': 18, 'slip_atr_k': 0.0464738190562356, 'slip_spread_k': 0.294916198134508, 'spread_hl_frac': 0.013547963093540767, 'bb_std_mult': 2.3211207431765875, 'rsi_os': 22, 'rsi_ob': 70, 'vol_spike': 0.27973912808176227, 'adx_thresh': 27.157636904822645, 'atr_min_pct': 0.005842775377982028, 'atr_max_pct': 0.08041010959354214, 'tp_mult': 1.925682693126618, 'tsl_mult': 0.0744691275052971, 'strategy': 'breakout', 'time_stop': 195, 'use_sma': False, 'use_atr': False, 'use_adx': True, 'use_ema': True, 'use_spike': True, 'rsi_required': False, 'edge_k': 0.4765985995074361, 'edge_cap': 0.10705648606137685, 'bull_strategy': 'breakout', 'bull_bb_std_mult': 2.039175838372012, 'bull_rsi_os': 36, 'bull_rsi_ob': 84, 'bull_adx_thresh': 7.838330153697709, 'bull_atr_min_pct': 0.002731228259938723, 'bull_atr_max_pct': 0.12427586428962029, 'bull_tp_mult': 1.4688304517530393, 'bull_tsl_mult': 0.5392926321838329, 'bull_time_stop': 69, 'bull_use_sma': True, 'bull_use_ema': False, 'bull_use_atr': False, 'bull_use_adx': False, 'bull_use_spike': False, 'bull_rsi_required': False, 'bear_strategy': 'mean_reversion', 'bear_bb_std_mult': 0.8202506424376752, 'bear_rsi_os': 48, 'bear_rsi_ob': 92, 'bear_adx_thresh': 25.445480526836544, 'bear_atr_min_pct': 0.00411654922076579, 'bear_atr_max_pct': 0.07826631512014659, 'bear_tp_mult': 2.945125394163127, 'bear_tsl_mult': 0.12106127738604802, 'bear_time_stop': 293, 'bear_use_sma': False, 'bear_use_ema': False, 'bear_use_atr': False, 'bear_use_adx': True, 'bear_use_spike': False, 'bear_rsi_required': False, 'sideways_strategy': 'breakout', 'sideways_bb_std_mult': 1.5369287185923968, 'sideways_rsi_os': 9, 'sideways_rsi_ob': 94, 'sideways_adx_thresh': 6.908869208507046, 'sideways_atr_min_pct': 0.014276176242993752, 'sideways_atr_max_pct': 0.021627879810861818, 'sideways_tp_mult': 1.1132982301338334, 'sideways_tsl_mult': 0.9415816701971518, 'sideways_time_stop': 210, 'sideways_use_sma': False, 'sideways_use_ema': True, 'sideways_use_atr': True, 'sideways_use_adx': True, 'sideways_use_spike': False, 'sideways_rsi_required': True}.
[I 2025-09-01 08:22:40,919] Trial 354 finished with values: [-1000000000.0, 1000000000.0] and parameters: {'p_sma': 15, 'p_std': 43, 'p_atr': 21, 'p_adx': 25, 'rsi_period': 55, 'ema1': 12, 'ema2': 14, 'slip_atr_k': 0.17492571476915125, 'slip_spread_k': 0.8325736497356344, 'spread_hl_frac': 0.014101972414087173, 'bb_std_mult': 1.258014579162536, 'rsi_os': 41, 'rsi_ob': 70, 'vol_spike': 0.1214924379379371, 'adx_thresh': 11.961152116127723, 'atr_min_pct': 0.0028933514979942575, 'atr_max_pct': 0.12841478990580793, 'tp_mult': 2.882156574278894, 'tsl_mult': 0.7292672600965676, 'strategy': 'breakout', 'time_stop': 20, 'use_sma': False, 'use_atr': False, 'use_adx': True, 'use_ema': True, 'use_spike': True, 'rsi_required': False, 'edge_k': 0.2430171088268727, 'edge_cap': 0.26337671352277325, 'bull_strategy': 'breakout', 'bull_bb_std_mult': 2.413839329433675, 'bull_rsi_os': 43, 'bull_rsi_ob': 50, 'bull_adx_thresh': 6.128968056029341, 'bull_atr_min_pct': 0.002531469951512, 'bull_atr_max_pct': 0.12364498551563201, 'bull_tp_mult': 1.528940300530697, 'bull_tsl_mult': 0.6359865455070121, 'bull_time_stop': 82, 'bull_use_sma': True, 'bull_use_ema': False, 'bull_use_atr': False, 'bull_use_adx': False, 'bull_use_spike': False, 'bull_rsi_required': False, 'bear_strategy': 'mean_reversion', 'bear_bb_std_mult': 1.9126768175790554, 'bear_rsi_os': 32, 'bear_rsi_ob': 82, 'bear_adx_thresh': 5.778418849114502, 'bear_atr_min_pct': 0.025616734256313133, 'bear_atr_max_pct': 0.10093838387010023, 'bear_tp_mult': 1.8059605745084073, 'bear_tsl_mult': 0.07975681501828354, 'bear_time_stop': 70, 'bear_use_sma': False, 'bear_use_ema': False, 'bear_use_atr': False, 'bear_use_adx': False, 'bear_use_spike': False, 'bear_rsi_required': False, 'sideways_strategy': 'breakout', 'sideways_bb_std_mult': 1.500227726346364, 'sideways_rsi_os': 23, 'sideways_rsi_ob': 69, 'sideways_adx_thresh': 8.830070148443571, 'sideways_atr_min_pct': 0.02698211734957344, 'sideways_atr_max_pct': 0.0385852633348622, 'sideways_tp_mult': 1.310419035924968, 'sideways_tsl_mult': 0.25366108690303435, 'sideways_time_stop': 18, 'sideways_use_sma': False, 'sideways_use_ema': True, 'sideways_use_atr': True, 'sideways_use_adx': True, 'sideways_use_spike': False, 'sideways_rsi_required': False}.
[I 2025-09-01 08:23:22,501] Trial 357 finished with values: [-1000000000.0, 1000000000.0] and parameters: {'p_sma': 30, 'p_std': 43, 'p_atr': 11, 'p_adx': 30, 'rsi_period': 57, 'ema1': 6, 'ema2': 14, 'slip_atr_k': 0.015744017944764276, 'slip_spread_k': 0.8516255397048393, 'spread_hl_frac': 0.014089939773543298, 'bb_std_mult': 2.344896193265039, 'rsi_os': 17, 'rsi_ob': 95, 'vol_spike': 0.05696466286712966, 'adx_thresh': 28.618231399752037, 'atr_min_pct': 0.00630094565697498, 'atr_max_pct': 0.12843113615109952, 'tp_mult': 2.1213893805731545, 'tsl_mult': 0.11465530464252174, 'strategy': 'breakout', 'time_stop': 274, 'use_sma': False, 'use_atr': False, 'use_adx': True, 'use_ema': False, 'use_spike': True, 'rsi_required': True, 'edge_k': 0.479075904264885, 'edge_cap': 0.2874356271887002, 'bull_strategy': 'breakout', 'bull_bb_std_mult': 2.548380299879617, 'bull_rsi_os': 43, 'bull_rsi_ob': 50, 'bull_adx_thresh': 8.5205486099853, 'bull_atr_min_pct': 0.004580845542000944, 'bull_atr_max_pct': 0.012893602370236096, 'bull_tp_mult': 1.6113346966763755, 'bull_tsl_mult': 0.6791573057306282, 'bull_time_stop': 81, 'bull_use_sma': True, 'bull_use_ema': False, 'bull_use_atr': False, 'bull_use_adx': False, 'bull_use_spike': False, 'bull_rsi_required': False, 'bear_strategy': 'mean_reversion', 'bear_bb_std_mult': 1.924757568626993, 'bear_rsi_os': 32, 'bear_rsi_ob': 78, 'bear_adx_thresh': 7.219822706858265, 'bear_atr_min_pct': 0.02589245963332635, 'bear_atr_max_pct': 0.09329953567976565, 'bear_tp_mult': 2.094614513216579, 'bear_tsl_mult': 0.9747387445243947, 'bear_time_stop': 300, 'bear_use_sma': True, 'bear_use_ema': False, 'bear_use_atr': True, 'bear_use_adx': False, 'bear_use_spike': False, 'bear_rsi_required': False, 'sideways_strategy': 'breakout', 'sideways_bb_std_mult': 1.4709358277420446, 'sideways_rsi_os': 35, 'sideways_rsi_ob': 93, 'sideways_adx_thresh': 8.512222235356598, 'sideways_atr_min_pct': 0.02134354350426536, 'sideways_atr_max_pct': 0.1422090489578282, 'sideways_tp_mult': 1.3124544417412287, 'sideways_tsl_mult': 0.1273535714110367, 'sideways_time_stop': 82, 'sideways_use_sma': True, 'sideways_use_ema': False, 'sideways_use_atr': True, 'sideways_use_adx': True, 'sideways_use_spike': False, 'sideways_rsi_required': False}.
[I 2025-09-01 08:23:22,696] Trial 359 finished with values: [-1000000000.0, 1000000000.0] and parameters: {'p_sma': 30, 'p_std': 33, 'p_atr': 22, 'p_adx': 30, 'rsi_period': 9, 'ema1': 15, 'ema2': 49, 'slip_atr_k': 0.018763018242829346, 'slip_spread_k': 0.6901364368910459, 'spread_hl_frac': 0.01184849838663055, 'bb_std_mult': 2.5432716114676985, 'rsi_os': 17, 'rsi_ob': 95, 'vol_spike': 0.055920386139680645, 'adx_thresh': 28.854020214881647, 'atr_min_pct': 0.01280747535756475, 'atr_max_pct': 0.03898970428684315, 'tp_mult': 1.6502297495039826, 'tsl_mult': 0.10950914565856766, 'strategy': 'breakout', 'time_stop': 223, 'use_sma': True, 'use_atr': True, 'use_adx': True, 'use_ema': False, 'use_spike': False, 'rsi_required': True, 'edge_k': 0.1750002841022313, 'edge_cap': 0.2271138638661559, 'bull_strategy': 'mean_reversion', 'bull_bb_std_mult': 2.573843793945786, 'bull_rsi_os': 27, 'bull_rsi_ob': 65, 'bull_adx_thresh': 8.4894783634358, 'bull_atr_min_pct': 0.02101779149303966, 'bull_atr_max_pct': 0.07525648994233414, 'bull_tp_mult': 1.603823087136803, 'bull_tsl_mult': 0.3384476695776638, 'bull_time_stop': 58, 'bull_use_sma': False, 'bull_use_ema': True, 'bull_use_atr': False, 'bull_use_adx': False, 'bull_use_spike': False, 'bull_rsi_required': True, 'bear_strategy': 'breakout', 'bear_bb_std_mult': 2.004566528025885, 'bear_rsi_os': 50, 'bear_rsi_ob': 78, 'bear_adx_thresh': 7.2453106145328885, 'bear_atr_min_pct': 0.008170715619667885, 'bear_atr_max_pct': 0.08841961791680927, 'bear_tp_mult': 2.1664546657176733, 'bear_tsl_mult': 0.0374902229529719, 'bear_time_stop': 278, 'bear_use_sma': True, 'bear_use_ema': False, 'bear_use_atr': True, 'bear_use_adx': False, 'bear_use_spike': False, 'bear_rsi_required': False, 'sideways_strategy': 'mean_reversion', 'sideways_bb_std_mult': 0.8252828611371937, 'sideways_rsi_os': 5, 'sideways_rsi_ob': 93, 'sideways_adx_thresh': 23.687767138060316, 'sideways_atr_min_pct': 0.008694112742834596, 'sideways_atr_max_pct': 0.016119117467561023, 'sideways_tp_mult': 1.6344286350221315, 'sideways_tsl_mult': 0.047957410340255566, 'sideways_time_stop': 127, 'sideways_use_sma': True, 'sideways_use_ema': False, 'sideways_use_atr': True, 'sideways_use_adx': True, 'sideways_use_spike': False, 'sideways_rsi_required': False}.
[I 2025-09-01 08:23:22,862] Trial 356 finished with values: [-0.022256938678474225, 0.023269166413085563] and parameters: {'p_sma': 26, 'p_std': 42, 'p_atr': 11, 'p_adx': 25, 'rsi_period': 30, 'ema1': 15, 'ema2': 14, 'slip_atr_k': 0.043320080136208874, 'slip_spread_k': 0.8533454979301717, 'spread_hl_frac': 0.01387288784110623, 'bb_std_mult': 1.2284490925547442, 'rsi_os': 17, 'rsi_ob': 76, 'vol_spike': 0.20100586259930736, 'adx_thresh': 27.170612830406768, 'atr_min_pct': 0.010703764901176138, 'atr_max_pct': 0.12775701084169075, 'tp_mult': 1.6533555697631879, 'tsl_mult': 0.11719214224820323, 'strategy': 'breakout', 'time_stop': 71, 'use_sma': False, 'use_atr': False, 'use_adx': True, 'use_ema': False, 'use_spike': True, 'rsi_required': True, 'edge_k': 1.6350043309517268, 'edge_cap': 0.2935499414435632, 'bull_strategy': 'breakout', 'bull_bb_std_mult': 2.0297622744526644, 'bull_rsi_os': 27, 'bull_rsi_ob': 73, 'bull_adx_thresh': 8.495995039060498, 'bull_atr_min_pct': 0.0046815521101697625, 'bull_atr_max_pct': 0.013289019641156606, 'bull_tp_mult': 1.5923477508394788, 'bull_tsl_mult': 0.607070364831707, 'bull_time_stop': 231, 'bull_use_sma': True, 'bull_use_ema': False, 'bull_use_atr': False, 'bull_use_adx': False, 'bull_use_spike': False, 'bull_rsi_required': False, 'bear_strategy': 'mean_reversion', 'bear_bb_std_mult': 1.9205379893691463, 'bear_rsi_os': 50, 'bear_rsi_ob': 78, 'bear_adx_thresh': 7.234142967994702, 'bear_atr_min_pct': 0.00415124552455856, 'bear_atr_max_pct': 0.07842886543613135, 'bear_tp_mult': 2.1624993980974443, 'bear_tsl_mult': 0.04110422132360937, 'bear_time_stop': 300, 'bear_use_sma': True, 'bear_use_ema': False, 'bear_use_atr': True, 'bear_use_adx': False, 'bear_use_spike': False, 'bear_rsi_required': False, 'sideways_strategy': 'breakout', 'sideways_bb_std_mult': 1.5866751120625953, 'sideways_rsi_os': 5, 'sideways_rsi_ob': 93, 'sideways_adx_thresh': 8.704160548121433, 'sideways_atr_min_pct': 0.029998574489903354, 'sideways_atr_max_pct': 0.016663961122741197, 'sideways_tp_mult': 1.3172668162001595, 'sideways_tsl_mult': 0.1295629804130402, 'sideways_time_stop': 82, 'sideways_use_sma': True, 'sideways_use_ema': False, 'sideways_use_atr': True, 'sideways_use_adx': True, 'sideways_use_spike': False, 'sideways_rsi_required': False}.
[I 2025-09-01 08:23:23,163] Trial 358 finished with values: [-1000000000.0, 1000000000.0] and parameters: {'p_sma': 29, 'p_std': 41, 'p_atr': 22, 'p_adx': 30, 'rsi_period': 30, 'ema1': 19, 'ema2': 11, 'slip_atr_k': 0.0204491470031693, 'slip_spread_k': 0.8919868629390799, 'spread_hl_frac': 0.0027535951382380505, 'bb_std_mult': 2.5234382458929465, 'rsi_os': 36, 'rsi_ob': 77, 'vol_spike': 0.057698764798356006, 'adx_thresh': 28.794907540945903, 'atr_min_pct': 0.010770323307617513, 'atr_max_pct': 0.12965469876881847, 'tp_mult': 1.5873338842159281, 'tsl_mult': 0.11548293995622477, 'strategy': 'breakout', 'time_stop': 181, 'use_sma': False, 'use_atr': True, 'use_adx': True, 'use_ema': False, 'use_spike': False, 'rsi_required': True, 'edge_k': 0.1800240949597832, 'edge_cap': 0.22368926185542023, 'bull_strategy': 'mean_reversion', 'bull_bb_std_mult': 2.572015601010997, 'bull_rsi_os': 44, 'bull_rsi_ob': 50, 'bull_adx_thresh': 8.262833440983627, 'bull_atr_min_pct': 0.004556339194451858, 'bull_atr_max_pct': 0.05643423351271025, 'bull_tp_mult': 1.6060871232350693, 'bull_tsl_mult': 0.3406369355325475, 'bull_time_stop': 81, 'bull_use_sma': True, 'bull_use_ema': True, 'bull_use_atr': False, 'bull_use_adx': False, 'bull_use_spike': False, 'bull_rsi_required': False, 'bear_strategy': 'mean_reversion', 'bear_bb_std_mult': 1.3345985945247367, 'bear_rsi_os': 22, 'bear_rsi_ob': 82, 'bear_adx_thresh': 7.337072593644183, 'bear_atr_min_pct': 0.0054859351504146225, 'bear_atr_max_pct': 0.0738929037696974, 'bear_tp_mult': 2.161712782829618, 'bear_tsl_mult': 0.03722109592731613, 'bear_time_stop': 300, 'bear_use_sma': True, 'bear_use_ema': False, 'bear_use_atr': True, 'bear_use_adx': False, 'bear_use_spike': False, 'bear_rsi_required': False, 'sideways_strategy': 'mean_reversion', 'sideways_bb_std_mult': 1.130378971034546, 'sideways_rsi_os': 5, 'sideways_rsi_ob': 93, 'sideways_adx_thresh': 8.68452788460675, 'sideways_atr_min_pct': 0.006047562803001106, 'sideways_atr_max_pct': 0.016370694258351505, 'sideways_tp_mult': 1.3218613823168994, 'sideways_tsl_mult': 0.2459566722245654, 'sideways_time_stop': 85, 'sideways_use_sma': True, 'sideways_use_ema': False, 'sideways_use_atr': True, 'sideways_use_adx': True, 'sideways_use_spike': False, 'sideways_rsi_required': False}.
