[I 2025-09-01 08:57:50,140] Trial 556 finished with values: [-1000000000.0, 1000000000.0] and parameters: {'p_sma': 16, 'p_std': 11, 'p_atr': 12, 'p_adx': 16, 'rsi_period': 83, 'ema1': 6, 'ema2': 58, 'slip_atr_k': 0.007204518109117211, 'slip_spread_k': 0.10194242774347857, 'spread_hl_frac': 0.03257647174561768, 'bb_std_mult': 2.4640951378469484, 'rsi_os': 47, 'rsi_ob': 91, 'vol_spike': 0.008614274365358714, 'adx_thresh': 32.84148672116676, 'atr_min_pct': 0.022608128077924904, 'atr_max_pct': 0.04791458961543186, 'tp_mult': 2.7284322095020013, 'tsl_mult': 0.9993823090064643, 'strategy': 'mean_reversion', 'time_stop': 33, 'use_sma': False, 'use_atr': True, 'use_adx': False, 'use_ema': False, 'use_spike': False, 'rsi_required': False, 'edge_k': 1.4664462235598736, 'edge_cap': 0.2962297770584792, 'bull_strategy': 'mean_reversion', 'bull_bb_std_mult': 2.3142405749810107, 'bull_rsi_os': 15, 'bull_rsi_ob': 53, 'bull_adx_thresh': 9.68076531707454, 'bull_atr_min_pct': 0.019187758594077658, 'bull_atr_max_pct': 0.080253279160696, 'bull_tp_mult': 1.1222423983273075, 'bull_tsl_mult': 0.22224793909911295, 'bull_time_stop': 163, 'bull_use_sma': False, 'bull_use_ema': True, 'bull_use_atr': True, 'bull_use_adx': True, 'bull_use_spike': True, 'bull_rsi_required': True, 'bear_strategy': 'mean_reversion', 'bear_bb_std_mult': 3.276106022682872, 'bear_rsi_os': 43, 'bear_rsi_ob': 46, 'bear_adx_thresh': 10.817603788588798, 'bear_atr_min_pct': 0.00589989949917004, 'bear_atr_max_pct': 0.05408713148786856, 'bear_tp_mult': 1.885543475773691, 'bear_tsl_mult': 0.22143699628447727, 'bear_time_stop': 217, 'bear_use_sma': False, 'bear_use_ema': False, 'bear_use_atr': True, 'bear_use_adx': True, 'bear_use_spike': True, 'bear_rsi_required': True, 'sideways_strategy': 'mean_reversion', 'sideways_bb_std_mult': 1.1942095098605614, 'sideways_rsi_os': 13, 'sideways_rsi_ob': 64, 'sideways_adx_thresh': 12.51666445532207, 'sideways_atr_min_pct': 0.008631100413619246, 'sideways_atr_max_pct': 0.11008009933305365, 'sideways_tp_mult': 1.652257245352166, 'sideways_tsl_mult': 0.46375977268781704, 'sideways_time_stop': 150, 'sideways_use_sma': False, 'sideways_use_ema': False, 'sideways_use_atr': True, 'sideways_use_adx': False, 'sideways_use_spike': True, 'sideways_rsi_required': True}.
[I 2025-09-01 08:57:50,737] Trial 559 finished with values: [-1000000000.0, 1000000000.0] and parameters: {'p_sma': 41, 'p_std': 36, 'p_atr': 12, 'p_adx': 16, 'rsi_period': 82, 'ema1': 30, 'ema2': 60, 'slip_atr_k': 0.0070034152990494205, 'slip_spread_k': 0.0013494971240572418, 'spread_hl_frac': 0.03350974296234946, 'bb_std_mult': 1.5228710751633714, 'rsi_os': 49, 'rsi_ob': 94, 'vol_spike': 0.11276253557835267, 'adx_thresh': 32.75324243813433, 'atr_min_pct': 0.013926740723767192, 'atr_max_pct': 0.09802960994609196, 'tp_mult': 2.7306579490834104, 'tsl_mult': 0.1588446059404149, 'strategy': 'mean_reversion', 'time_stop': 38, 'use_sma': False, 'use_atr': True, 'use_adx': False, 'use_ema': False, 'use_spike': False, 'rsi_required': False, 'edge_k': 0.8760098744135901, 'edge_cap': 0.8679044227137634, 'bull_strategy': 'mean_reversion', 'bull_bb_std_mult': 0.735280765064338, 'bull_rsi_os': 40, 'bull_rsi_ob': 55, 'bull_adx_thresh': 28.016411800538123, 'bull_atr_min_pct': 0.019419708981647854, 'bull_atr_max_pct': 0.07547056656735902, 'bull_tp_mult': 1.0906923741180539, 'bull_tsl_mult': 0.9163855370180604, 'bull_time_stop': 189, 'bull_use_sma': False, 'bull_use_ema': True, 'bull_use_atr': True, 'bull_use_adx': True, 'bull_use_spike': True, 'bull_rsi_required': True, 'bear_strategy': 'breakout', 'bear_bb_std_mult': 2.9466112982031696, 'bear_rsi_os': 43, 'bear_rsi_ob': 88, 'bear_adx_thresh': 11.931769350698628, 'bear_atr_min_pct': 0.005716851995071468, 'bear_atr_max_pct': 0.052875626843093125, 'bear_tp_mult': 2.8461466847953925, 'bear_tsl_mult': 0.22256608442295495, 'bear_time_stop': 154, 'bear_use_sma': False, 'bear_use_ema': False, 'bear_use_atr': True, 'bear_use_adx': True, 'bear_use_spike': True, 'bear_rsi_required': True, 'sideways_strategy': 'breakout', 'sideways_bb_std_mult': 1.340278261742391, 'sideways_rsi_os': 11, 'sideways_rsi_ob': 77, 'sideways_adx_thresh': 10.665982535878387, 'sideways_atr_min_pct': 0.00681359323280097, 'sideways_atr_max_pct': 0.1006768394607005, 'sideways_tp_mult': 1.6669391845517372, 'sideways_tsl_mult': 0.46207909039069484, 'sideways_time_stop': 147, 'sideways_use_sma': False, 'sideways_use_ema': False, 'sideways_use_atr': True, 'sideways_use_adx': False, 'sideways_use_spike': True, 'sideways_rsi_required': True}.
[I 2025-09-01 08:57:51,908] Trial 560 finished with values: [-1000000000.0, 1000000000.0] and parameters: {'p_sma': 37, 'p_std': 34, 'p_atr': 21, 'p_adx': 16, 'rsi_period': 44, 'ema1': 8, 'ema2': 32, 'slip_atr_k': 0.007556113145114644, 'slip_spread_k': 0.29648301709124125, 'spread_hl_frac': 0.021362602204822976, 'bb_std_mult': 1.0043456977932663, 'rsi_os': 49, 'rsi_ob': 93, 'vol_spike': 0.0060961984224762724, 'adx_thresh': 32.77201512036724, 'atr_min_pct': 0.02254228124817257, 'atr_max_pct': 0.04485619485115881, 'tp_mult': 1.3748521051430624, 'tsl_mult': 0.21504463383577282, 'strategy': 'mean_reversion', 'time_stop': 146, 'use_sma': False, 'use_atr': True, 'use_adx': False, 'use_ema': False, 'use_spike': False, 'rsi_required': False, 'edge_k': 0.8994476029458115, 'edge_cap': 0.6246697932664873, 'bull_strategy': 'mean_reversion', 'bull_bb_std_mult': 2.4908751127630686, 'bull_rsi_os': 37, 'bull_rsi_ob': 88, 'bull_adx_thresh': 10.279457575110538, 'bull_atr_min_pct': 0.01927024941029281, 'bull_atr_max_pct': 0.08271066371243509, 'bull_tp_mult': 1.2057173465134914, 'bull_tsl_mult': 0.9162622104613487, 'bull_time_stop': 192, 'bull_use_sma': True, 'bull_use_ema': True, 'bull_use_atr': True, 'bull_use_adx': True, 'bull_use_spike': True, 'bull_rsi_required': False, 'bear_strategy': 'breakout', 'bear_bb_std_mult': 3.209747373575646, 'bear_rsi_os': 42, 'bear_rsi_ob': 88, 'bear_adx_thresh': 12.258969850748828, 'bear_atr_min_pct': 0.005660230723349728, 'bear_atr_max_pct': 0.0518550357131725, 'bear_tp_mult': 2.805417895145715, 'bear_tsl_mult': 0.2400958353238558, 'bear_time_stop': 221, 'bear_use_sma': False, 'bear_use_ema': False, 'bear_use_atr': True, 'bear_use_adx': True, 'bear_use_spike': True, 'bear_rsi_required': True, 'sideways_strategy': 'breakout', 'sideways_bb_std_mult': 1.204168507049387, 'sideways_rsi_os': 39, 'sideways_rsi_ob': 57, 'sideways_adx_thresh': 34.95238910515619, 'sideways_atr_min_pct': 0.00849660311550589, 'sideways_atr_max_pct': 0.07090473672646243, 'sideways_tp_mult': 2.6225752685962513, 'sideways_tsl_mult': 0.39030278905998156, 'sideways_time_stop': 151, 'sideways_use_sma': False, 'sideways_use_ema': False, 'sideways_use_atr': True, 'sideways_use_adx': False, 'sideways_use_spike': True, 'sideways_rsi_required': True}.
[I 2025-09-01 08:57:52,815] Trial 561 finished with values: [-1000000000.0, 1000000000.0] and parameters: {'p_sma': 41, 'p_std': 34, 'p_atr': 21, 'p_adx': 15, 'rsi_period': 44, 'ema1': 8, 'ema2': 60, 'slip_atr_k': 0.012975888431480042, 'slip_spread_k': 0.29261810677710764, 'spread_hl_frac': 0.0336803736303236, 'bb_std_mult': 2.6088676892947067, 'rsi_os': 48, 'rsi_ob': 49, 'vol_spike': 0.0060199308078263975, 'adx_thresh': 33.93986766059333, 'atr_min_pct': 0.010429940795623002, 'atr_max_pct': 0.08898000899200681, 'tp_mult': 1.262495216485281, 'tsl_mult': 0.20481019870394435, 'strategy': 'mean_reversion', 'time_stop': 39, 'use_sma': False, 'use_atr': False, 'use_adx': False, 'use_ema': False, 'use_spike': False, 'rsi_required': False, 'edge_k': 1.021443215057865, 'edge_cap': 0.2913825434626782, 'bull_strategy': 'breakout', 'bull_bb_std_mult': 2.0029884647990244, 'bull_rsi_os': 40, 'bull_rsi_ob': 86, 'bull_adx_thresh': 9.827037974291935, 'bull_atr_min_pct': 0.024385322000756476, 'bull_atr_max_pct': 0.0835704540357119, 'bull_tp_mult': 2.439776385471192, 'bull_tsl_mult': 0.8607889248776264, 'bull_time_stop': 196, 'bull_use_sma': True, 'bull_use_ema': True, 'bull_use_atr': True, 'bull_use_adx': True, 'bull_use_spike': True, 'bull_rsi_required': False, 'bear_strategy': 'breakout', 'bear_bb_std_mult': 3.4397739164933316, 'bear_rsi_os': 27, 'bear_rsi_ob': 86, 'bear_adx_thresh': 12.608365461014712, 'bear_atr_min_pct': 0.005855618276551345, 'bear_atr_max_pct': 0.03745468418780181, 'bear_tp_mult': 2.836193811144727, 'bear_tsl_mult': 0.24794215176768067, 'bear_time_stop': 222, 'bear_use_sma': False, 'bear_use_ema': False, 'bear_use_atr': True, 'bear_use_adx': True, 'bear_use_spike': True, 'bear_rsi_required': True, 'sideways_strategy': 'breakout', 'sideways_bb_std_mult': 1.366195150682354, 'sideways_rsi_os': 11, 'sideways_rsi_ob': 61, 'sideways_adx_thresh': 12.046178281085979, 'sideways_atr_min_pct': 0.0056047475234345355, 'sideways_atr_max_pct': 0.10178043763392111, 'sideways_tp_mult': 2.266895210706052, 'sideways_tsl_mult': 0.46103327340396094, 'sideways_time_stop': 152, 'sideways_use_sma': False, 'sideways_use_ema': False, 'sideways_use_atr': True, 'sideways_use_adx': False, 'sideways_use_spike': True, 'sideways_rsi_required': True}.
[I 2025-09-01 08:58:36,704] Trial 564 finished with values: [-1000000000.0, 1000000000.0] and parameters: {'p_sma': 20, 'p_std': 38, 'p_atr': 16, 'p_adx': 27, 'rsi_period': 13, 'ema1': 9, 'ema2': 38, 'slip_atr_k': 0.1051210962641466, 'slip_spread_k': 0.12481665052084595, 'spread_hl_frac': 0.01995944780418046, 'bb_std_mult': 2.618002535458681, 'rsi_os': 46, 'rsi_ob': 93, 'vol_spike': 0.18722334042808403, 'adx_thresh': 33.96134689092772, 'atr_min_pct': 0.010189811700727783, 'atr_max_pct': 0.01795592694525415, 'tp_mult': 1.2692201494316402, 'tsl_mult': 0.17901423015136245, 'strategy': 'mean_reversion', 'time_stop': 48, 'use_sma': False, 'use_atr': False, 'use_adx': False, 'use_ema': False, 'use_spike': False, 'rsi_required': False, 'edge_k': 1.0263762912132626, 'edge_cap': 0.36465303631886886, 'bull_strategy': 'breakout', 'bull_bb_std_mult': 2.3844166652301375, 'bull_rsi_os': 40, 'bull_rsi_ob': 81, 'bull_adx_thresh': 21.771354575051166, 'bull_atr_min_pct': 0.02498222123206802, 'bull_atr_max_pct': 0.08822854757571066, 'bull_tp_mult': 2.0812433384402125, 'bull_tsl_mult': 0.5008292902425358, 'bull_time_stop': 171, 'bull_use_sma': True, 'bull_use_ema': True, 'bull_use_atr': True, 'bull_use_adx': True, 'bull_use_spike': True, 'bull_rsi_required': False, 'bear_strategy': 'mean_reversion', 'bear_bb_std_mult': 1.3729259828083555, 'bear_rsi_os': 23, 'bear_rsi_ob': 86, 'bear_adx_thresh': 12.685339408582417, 'bear_atr_min_pct': 0.01066681424902427, 'bear_atr_max_pct': 0.03844439924448174, 'bear_tp_mult': 2.649818561363921, 'bear_tsl_mult': 0.9113276958968266, 'bear_time_stop': 223, 'bear_use_sma': False, 'bear_use_ema': True, 'bear_use_atr': True, 'bear_use_adx': True, 'bear_use_spike': True, 'bear_rsi_required': True, 'sideways_strategy': 'breakout', 'sideways_bb_std_mult': 2.286678844090305, 'sideways_rsi_os': 29, 'sideways_rsi_ob': 86, 'sideways_adx_thresh': 5.560110446455333, 'sideways_atr_min_pct': 0.005749334961718404, 'sideways_atr_max_pct': 0.062119304235572104, 'sideways_tp_mult': 2.2639557309199736, 'sideways_tsl_mult': 0.5758767981131814, 'sideways_time_stop': 167, 'sideways_use_sma': False, 'sideways_use_ema': False, 'sideways_use_atr': True, 'sideways_use_adx': False, 'sideways_use_spike': True, 'sideways_rsi_required': True}.
[I 2025-09-01 08:58:37,666] Trial 562 finished with values: [-1000000000.0, 1000000000.0] and parameters: {'p_sma': 60, 'p_std': 34, 'p_atr': 21, 'p_adx': 15, 'rsi_period': 45, 'ema1': 9, 'ema2': 60, 'slip_atr_k': 0.013465883094389671, 'slip_spread_k': 0.12281488194886636, 'spread_hl_frac': 0.03080342750891958, 'bb_std_mult': 2.6098953251191492, 'rsi_os': 10, 'rsi_ob': 93, 'vol_spike': 0.149866710090751, 'adx_thresh': 23.302637552545544, 'atr_min_pct': 0.02069648012835835, 'atr_max_pct': 0.08098163053378166, 'tp_mult': 1.253254837918957, 'tsl_mult': 0.9282351847409092, 'strategy': 'mean_reversion', 'time_stop': 46, 'use_sma': False, 'use_atr': False, 'use_adx': False, 'use_ema': False, 'use_spike': False, 'rsi_required': False, 'edge_k': 1.0743567167499894, 'edge_cap': 0.6151636773492568, 'bull_strategy': 'breakout', 'bull_bb_std_mult': 2.5054923608396447, 'bull_rsi_os': 40, 'bull_rsi_ob': 86, 'bull_adx_thresh': 10.462250262159447, 'bull_atr_min_pct': 0.020435795329698633, 'bull_atr_max_pct': 0.07558997109963832, 'bull_tp_mult': 2.4880835650792106, 'bull_tsl_mult': 0.9122685416506284, 'bull_time_stop': 190, 'bull_use_sma': True, 'bull_use_ema': True, 'bull_use_atr': True, 'bull_use_adx': True, 'bull_use_spike': True, 'bull_rsi_required': False, 'bear_strategy': 'breakout', 'bear_bb_std_mult': 3.3883323535754677, 'bear_rsi_os': 27, 'bear_rsi_ob': 86, 'bear_adx_thresh': 12.4276881910899, 'bear_atr_min_pct': 0.01697409462796054, 'bear_atr_max_pct': 0.03809961855119485, 'bear_tp_mult': 2.830564043706044, 'bear_tsl_mult': 0.2527803564600671, 'bear_time_stop': 222, 'bear_use_sma': False, 'bear_use_ema': False, 'bear_use_atr': True, 'bear_use_adx': True, 'bear_use_spike': True, 'bear_rsi_required': True, 'sideways_strategy': 'breakout', 'sideways_bb_std_mult': 1.361084568455913, 'sideways_rsi_os': 11, 'sideways_rsi_ob': 61, 'sideways_adx_thresh': 22.56555755215587, 'sideways_atr_min_pct': 0.005537199459001517, 'sideways_atr_max_pct': 0.10150608576467263, 'sideways_tp_mult': 2.2573644724633146, 'sideways_tsl_mult': 0.4531836239497371, 'sideways_time_stop': 148, 'sideways_use_sma': False, 'sideways_use_ema': False, 'sideways_use_atr': True, 'sideways_use_adx': False, 'sideways_use_spike': True, 'sideways_rsi_required': True}.
[I 2025-09-01 08:58:38,637] Trial 563 finished with values: [-1000000000.0, 1000000000.0] and parameters: {'p_sma': 38, 'p_std': 38, 'p_atr': 7, 'p_adx': 25, 'rsi_period': 26, 'ema1': 8, 'ema2': 59, 'slip_atr_k': 0.20390877229356935, 'slip_spread_k': 0.3697067391161223, 'spread_hl_frac': 0.019911534918227086, 'bb_std_mult': 3.57175068233789, 'rsi_os': 48, 'rsi_ob': 93, 'vol_spike': 0.18735616693445079, 'adx_thresh': 33.977587084359854, 'atr_min_pct': 0.006633458058287814, 'atr_max_pct': 0.08810327538499726, 'tp_mult': 1.2533466502047204, 'tsl_mult': 0.20420847695658514, 'strategy': 'mean_reversion', 'time_stop': 45, 'use_sma': False, 'use_atr': False, 'use_adx': False, 'use_ema': False, 'use_spike': False, 'rsi_required': False, 'edge_k': 0.7882805481957731, 'edge_cap': 0.31044790404947853, 'bull_strategy': 'breakout', 'bull_bb_std_mult': 1.9699234311868037, 'bull_rsi_os': 37, 'bull_rsi_ob': 79, 'bull_adx_thresh': 27.55256829131703, 'bull_atr_min_pct': 0.01320702132615097, 'bull_atr_max_pct': 0.137380521891198, 'bull_tp_mult': 1.1975676933313262, 'bull_tsl_mult': 0.7991035369176772, 'bull_time_stop': 196, 'bull_use_sma': True, 'bull_use_ema': True, 'bull_use_atr': True, 'bull_use_adx': True, 'bull_use_spike': True, 'bull_rsi_required': False, 'bear_strategy': 'breakout', 'bear_bb_std_mult': 3.2031444241260587, 'bear_rsi_os': 51, 'bear_rsi_ob': 66, 'bear_adx_thresh': 12.50930095192619, 'bear_atr_min_pct': 0.006589931283763544, 'bear_atr_max_pct': 0.03803200205265307, 'bear_tp_mult': 2.8250811495171826, 'bear_tsl_mult': 0.25669258625569363, 'bear_time_stop': 224, 'bear_use_sma': False, 'bear_use_ema': True, 'bear_use_atr': True, 'bear_use_adx': True, 'bear_use_spike': True, 'bear_rsi_required': True, 'sideways_strategy': 'breakout', 'sideways_bb_std_mult': 2.2791812894608374, 'sideways_rsi_os': 11, 'sideways_rsi_ob': 61, 'sideways_adx_thresh': 22.482721867681555, 'sideways_atr_min_pct': 0.005071852737891644, 'sideways_atr_max_pct': 0.09051588198580782, 'sideways_tp_mult': 2.268044780394273, 'sideways_tsl_mult': 0.5107810739382614, 'sideways_time_stop': 168, 'sideways_use_sma': False, 'sideways_use_ema': False, 'sideways_use_atr': True, 'sideways_use_adx': False, 'sideways_use_spike': True, 'sideways_rsi_required': True}.
[I 2025-09-01 08:58:38,932] Trial 565 finished with values: [-1000000000.0, 1000000000.0] and parameters: {'p_sma': 54, 'p_std': 37, 'p_atr': 7, 'p_adx': 15, 'rsi_period': 13, 'ema1': 9, 'ema2': 59, 'slip_atr_k': 0.013794281048191873, 'slip_spread_k': 0.1285975312389763, 'spread_hl_frac': 0.02352974293816996, 'bb_std_mult': 2.6061854922909755, 'rsi_os': 11, 'rsi_ob': 92, 'vol_spike': 0.02632849161054207, 'adx_thresh': 10.182823468349817, 'atr_min_pct': 0.01292792131629177, 'atr_max_pct': 0.09338036883426645, 'tp_mult': 1.3347266018224175, 'tsl_mult': 0.4942382196419713, 'strategy': 'mean_reversion', 'time_stop': 47, 'use_sma': False, 'use_atr': False, 'use_adx': False, 'use_ema': False, 'use_spike': False, 'rsi_required': False, 'edge_k': 1.5873474559976333, 'edge_cap': 0.7005703719851253, 'bull_strategy': 'breakout', 'bull_bb_std_mult': 2.40676677382714, 'bull_rsi_os': 39, 'bull_rsi_ob': 95, 'bull_adx_thresh': 11.244380526653426, 'bull_atr_min_pct': 0.020642331176179467, 'bull_atr_max_pct': 0.0882574879473136, 'bull_tp_mult': 2.233714966195414, 'bull_tsl_mult': 0.7831686104979458, 'bull_time_stop': 170, 'bull_use_sma': True, 'bull_use_ema': True, 'bull_use_atr': True, 'bull_use_adx': True, 'bull_use_spike': True, 'bull_rsi_required': False, 'bear_strategy': 'mean_reversion', 'bear_bb_std_mult': 3.038380476063032, 'bear_rsi_os': 13, 'bear_rsi_ob': 57, 'bear_adx_thresh': 12.560573441381072, 'bear_atr_min_pct': 0.0049049652099187446, 'bear_atr_max_pct': 0.038832857987536856, 'bear_tp_mult': 1.7666434913148994, 'bear_tsl_mult': 0.9072128024553487, 'bear_time_stop': 166, 'bear_use_sma': False, 'bear_use_ema': True, 'bear_use_atr': True, 'bear_use_adx': True, 'bear_use_spike': True, 'bear_rsi_required': True, 'sideways_strategy': 'breakout', 'sideways_bb_std_mult': 2.2727540630157606, 'sideways_rsi_os': 50, 'sideways_rsi_ob': 62, 'sideways_adx_thresh': 22.911165602784013, 'sideways_atr_min_pct': 0.007884575771080937, 'sideways_atr_max_pct': 0.0894540892704258, 'sideways_tp_mult': 2.3725828300317167, 'sideways_tsl_mult': 0.5808254971190336, 'sideways_time_stop': 156, 'sideways_use_sma': False, 'sideways_use_ema': False, 'sideways_use_atr': True, 'sideways_use_adx': False, 'sideways_use_spike': True, 'sideways_rsi_required': True}.
[I 2025-09-01 08:59:23,876] Trial 568 finished with values: [-1000000000.0, 1000000000.0] and parameters: {'p_sma': 56, 'p_std': 15, 'p_atr': 20, 'p_adx': 24, 'rsi_period': 37, 'ema1': 7, 'ema2': 60, 'slip_atr_k': 0.0154227907517499, 'slip_spread_k': 0.16650226367458196, 'spread_hl_frac': 0.026673512411467766, 'bb_std_mult': 0.7104245643349989, 'rsi_os': 46, 'rsi_ob': 95, 'vol_spike': 0.13464303764905533, 'adx_thresh': 5.860398410363551, 'atr_min_pct': 0.00954745426248024, 'atr_max_pct': 0.09183843443179068, 'tp_mult': 2.881745139740244, 'tsl_mult': 0.1296226872527843, 'strategy': 'mean_reversion', 'time_stop': 27, 'use_sma': True, 'use_atr': False, 'use_adx': False, 'use_ema': False, 'use_spike': False, 'rsi_required': False, 'edge_k': 0.8639304825207319, 'edge_cap': 0.3259017886572684, 'bull_strategy': 'breakout', 'bull_bb_std_mult': 2.2784164155537616, 'bull_rsi_os': 38, 'bull_rsi_ob': 90, 'bull_adx_thresh': 33.3852703428915, 'bull_atr_min_pct': 0.021273032575586714, 'bull_atr_max_pct': 0.11296423700437708, 'bull_tp_mult': 1.1375383140760895, 'bull_tsl_mult': 0.8273218583012253, 'bull_time_stop': 182, 'bull_use_sma': True, 'bull_use_ema': True, 'bull_use_atr': True, 'bull_use_adx': True, 'bull_use_spike': True, 'bull_rsi_required': False, 'bear_strategy': 'mean_reversion', 'bear_bb_std_mult': 3.346706747069851, 'bear_rsi_os': 15, 'bear_rsi_ob': 91, 'bear_adx_thresh': 17.561740499406593, 'bear_atr_min_pct': 0.01992805863082984, 'bear_atr_max_pct': 0.043242574825476325, 'bear_tp_mult': 2.897499604573397, 'bear_tsl_mult': 0.3099042554956475, 'bear_time_stop': 211, 'bear_use_sma': False, 'bear_use_ema': False, 'bear_use_atr': True, 'bear_use_adx': True, 'bear_use_spike': True, 'bear_rsi_required': True, 'sideways_strategy': 'breakout', 'sideways_bb_std_mult': 3.182079739146155, 'sideways_rsi_os': 12, 'sideways_rsi_ob': 59, 'sideways_adx_thresh': 11.636023077722852, 'sideways_atr_min_pct': 0.01055118208082447, 'sideways_atr_max_pct': 0.09453633670843326, 'sideways_tp_mult': 2.4021457382421048, 'sideways_tsl_mult': 0.989339285801007, 'sideways_time_stop': 265, 'sideways_use_sma': False, 'sideways_use_ema': False, 'sideways_use_atr': False, 'sideways_use_adx': False, 'sideways_use_spike': True, 'sideways_rsi_required': True}.
