[I 2025-09-01 07:43:40,516] Trial 138 finished with values: [-0.004998110850240711, 0.005138229187069948] and parameters: {'p_sma': 45, 'p_std': 42, 'p_atr': 20, 'p_adx': 15, 'rsi_period': 39, 'ema1': 12, 'ema2': 11, 'slip_atr_k': 0.018225448211304382, 'slip_spread_k': 0.5080170789256682, 'spread_hl_frac': 0.018596083414141068, 'bb_std_mult': 2.6875058062914077, 'rsi_os': 45, 'rsi_ob': 83, 'vol_spike': 0.012579608203453468, 'adx_thresh': 32.851107900068484, 'atr_min_pct': 0.027570238355746696, 'atr_max_pct': 0.11391307693446827, 'tp_mult': 1.6182655637338452, 'tsl_mult': 0.5155791103564461, 'strategy': 'breakout', 'time_stop': 117, 'use_sma': False, 'use_atr': False, 'use_adx': True, 'use_ema': False, 'use_spike': False, 'rsi_required': False, 'edge_k': 1.9964727688369037, 'edge_cap': 0.1706534652169062, 'bull_strategy': 'breakout', 'bull_bb_std_mult': 2.514828350308412, 'bull_rsi_os': 14, 'bull_rsi_ob': 55, 'bull_adx_thresh': 20.680651948378973, 'bull_atr_min_pct': 0.003435201350173213, 'bull_atr_max_pct': 0.059414837255834484, 'bull_tp_mult': 1.191185523895732, 'bull_tsl_mult': 0.4450798761234636, 'bull_time_stop': 43, 'bull_use_sma': True, 'bull_use_ema': True, 'bull_use_atr': False, 'bull_use_adx': False, 'bull_use_spike': False, 'bull_rsi_required': False, 'bear_strategy': 'mean_reversion', 'bear_bb_std_mult': 1.9930807309711673, 'bear_rsi_os': 48, 'bear_rsi_ob': 62, 'bear_adx_thresh': 15.670809165432214, 'bear_atr_min_pct': 0.009208883087136547, 'bear_atr_max_pct': 0.10245097980518218, 'bear_tp_mult': 1.3088315363606042, 'bear_tsl_mult': 0.12477900085225269, 'bear_time_stop': 115, 'bear_use_sma': True, 'bear_use_ema': False, 'bear_use_atr': False, 'bear_use_adx': False, 'bear_use_spike': False, 'bear_rsi_required': False, 'sideways_strategy': 'breakout', 'sideways_bb_std_mult': 1.082447944769245, 'sideways_rsi_os': 42, 'sideways_rsi_ob': 45, 'sideways_adx_thresh': 15.235233355015154, 'sideways_atr_min_pct': 0.01691940699679729, 'sideways_atr_max_pct': 0.010097917285193984, 'sideways_tp_mult': 1.1869608816746122, 'sideways_tsl_mult': 0.19395085031089487, 'sideways_time_stop': 87, 'sideways_use_sma': False, 'sideways_use_ema': False, 'sideways_use_atr': True, 'sideways_use_adx': True, 'sideways_use_spike': False, 'sideways_rsi_required': False}.
[I 2025-09-01 07:43:40,917] Trial 134 finished with values: [-0.08904740395647481, 0.08894857841516338] and parameters: {'p_sma': 11, 'p_std': 30, 'p_atr': 24, 'p_adx': 15, 'rsi_period': 35, 'ema1': 18, 'ema2': 14, 'slip_atr_k': 0.13997383788139725, 'slip_spread_k': 0.5142657851286166, 'spread_hl_frac': 0.01663632782716277, 'bb_std_mult': 2.4148043675651767, 'rsi_os': 45, 'rsi_ob': 66, 'vol_spike': 0.13090405733771981, 'adx_thresh': 12.046327187455688, 'atr_min_pct': 0.02191964316285349, 'atr_max_pct': 0.10730687026662206, 'tp_mult': 1.7102263274337741, 'tsl_mult': 0.8119155839153301, 'strategy': 'breakout', 'time_stop': 299, 'use_sma': False, 'use_atr': False, 'use_adx': False, 'use_ema': False, 'use_spike': False, 'rsi_required': False, 'edge_k': 0.8356729870563135, 'edge_cap': 0.4440263185291961, 'bull_strategy': 'breakout', 'bull_bb_std_mult': 2.417304048286714, 'bull_rsi_os': 10, 'bull_rsi_ob': 49, 'bull_adx_thresh': 11.775514795622628, 'bull_atr_min_pct': 0.002428497343923071, 'bull_atr_max_pct': 0.06257776692915773, 'bull_tp_mult': 2.1006708307224917, 'bull_tsl_mult': 0.017247813279560063, 'bull_time_stop': 190, 'bull_use_sma': True, 'bull_use_ema': True, 'bull_use_atr': False, 'bull_use_adx': False, 'bull_use_spike': True, 'bull_rsi_required': False, 'bear_strategy': 'mean_reversion', 'bear_bb_std_mult': 2.1289178937746778, 'bear_rsi_os': 46, 'bear_rsi_ob': 62, 'bear_adx_thresh': 9.313433957895947, 'bear_atr_min_pct': 0.00015462664549733066, 'bear_atr_max_pct': 0.11638653717676598, 'bear_tp_mult': 1.303337415708441, 'bear_tsl_mult': 0.32997616660782997, 'bear_time_stop': 197, 'bear_use_sma': True, 'bear_use_ema': False, 'bear_use_atr': False, 'bear_use_adx': False, 'bear_use_spike': False, 'bear_rsi_required': False, 'sideways_strategy': 'mean_reversion', 'sideways_bb_std_mult': 2.7801933895119975, 'sideways_rsi_os': 37, 'sideways_rsi_ob': 56, 'sideways_adx_thresh': 23.6838763012689, 'sideways_atr_min_pct': 0.012846878905025026, 'sideways_atr_max_pct': 0.010116151242311626, 'sideways_tp_mult': 1.07310538638674, 'sideways_tsl_mult': 0.9942039942302324, 'sideways_time_stop': 87, 'sideways_use_sma': False, 'sideways_use_ema': False, 'sideways_use_atr': True, 'sideways_use_adx': False, 'sideways_use_spike': True, 'sideways_rsi_required': True}.
[I 2025-09-01 07:43:41,161] Trial 137 finished with values: [-0.03749673316677382, 0.03740311078015415] and parameters: {'p_sma': 26, 'p_std': 31, 'p_atr': 16, 'p_adx': 19, 'rsi_period': 40, 'ema1': 12, 'ema2': 55, 'slip_atr_k': 0.06534533253094078, 'slip_spread_k': 0.13691136755705985, 'spread_hl_frac': 0.022328467321869237, 'bb_std_mult': 0.6737514923038581, 'rsi_os': 44, 'rsi_ob': 74, 'vol_spike': 0.1294772392835838, 'adx_thresh': 24.271848912451254, 'atr_min_pct': 0.006982425532653443, 'atr_max_pct': 0.11379811774765852, 'tp_mult': 2.200443495021061, 'tsl_mult': 0.004174521829654887, 'strategy': 'mean_reversion', 'time_stop': 178, 'use_sma': True, 'use_atr': False, 'use_adx': False, 'use_ema': False, 'use_spike': False, 'rsi_required': True, 'edge_k': 0.6173552420466979, 'edge_cap': 0.1596865979460228, 'bull_strategy': 'breakout', 'bull_bb_std_mult': 2.7992268828905553, 'bull_rsi_os': 33, 'bull_rsi_ob': 55, 'bull_adx_thresh': 21.411658245959785, 'bull_atr_min_pct': 0.0029347007270246733, 'bull_atr_max_pct': 0.06116077560001479, 'bull_tp_mult': 2.807492458115354, 'bull_tsl_mult': 0.02800663497770789, 'bull_time_stop': 188, 'bull_use_sma': True, 'bull_use_ema': False, 'bull_use_atr': True, 'bull_use_adx': True, 'bull_use_spike': True, 'bull_rsi_required': False, 'bear_strategy': 'mean_reversion', 'bear_bb_std_mult': 2.1418441113341653, 'bear_rsi_os': 48, 'bear_rsi_ob': 62, 'bear_adx_thresh': 18.49106393964221, 'bear_atr_min_pct': 0.017341235947125628, 'bear_atr_max_pct': 0.08376278310196887, 'bear_tp_mult': 1.115005421893765, 'bear_tsl_mult': 0.05407759644161236, 'bear_time_stop': 140, 'bear_use_sma': True, 'bear_use_ema': True, 'bear_use_atr': False, 'bear_use_adx': True, 'bear_use_spike': True, 'bear_rsi_required': False, 'sideways_strategy': 'mean_reversion', 'sideways_bb_std_mult': 0.5394162322801768, 'sideways_rsi_os': 37, 'sideways_rsi_ob': 74, 'sideways_adx_thresh': 29.527158534539335, 'sideways_atr_min_pct': 0.0013012271118547584, 'sideways_atr_max_pct': 0.01160183566967497, 'sideways_tp_mult': 1.1871421210217914, 'sideways_tsl_mult': 0.2230426950654122, 'sideways_time_stop': 61, 'sideways_use_sma': True, 'sideways_use_ema': False, 'sideways_use_atr': True, 'sideways_use_adx': True, 'sideways_use_spike': False, 'sideways_rsi_required': True}.
[I 2025-09-01 07:43:41,342] Trial 135 finished with values: [-0.030477097924166086, 0.030312445396705454] and parameters: {'p_sma': 45, 'p_std': 30, 'p_atr': 16, 'p_adx': 12, 'rsi_period': 34, 'ema1': 17, 'ema2': 14, 'slip_atr_k': 0.17359314491103928, 'slip_spread_k': 0.5727457242733437, 'spread_hl_frac': 0.016726186569318888, 'bb_std_mult': 0.8570131000043457, 'rsi_os': 44, 'rsi_ob': 65, 'vol_spike': 0.1191215859916881, 'adx_thresh': 24.40254650309051, 'atr_min_pct': 0.01717059920891587, 'atr_max_pct': 0.1067852783317419, 'tp_mult': 1.9057088402442395, 'tsl_mult': 0.8155674489611033, 'strategy': 'breakout', 'time_stop': 124, 'use_sma': True, 'use_atr': False, 'use_adx': False, 'use_ema': False, 'use_spike': False, 'rsi_required': False, 'edge_k': 0.856082272770512, 'edge_cap': 0.43604359356844835, 'bull_strategy': 'breakout', 'bull_bb_std_mult': 2.917182667459983, 'bull_rsi_os': 30, 'bull_rsi_ob': 49, 'bull_adx_thresh': 12.512155228415317, 'bull_atr_min_pct': 0.0027026528414508567, 'bull_atr_max_pct': 0.06263920720810807, 'bull_tp_mult': 2.7939504436884484, 'bull_tsl_mult': 0.027868178741619416, 'bull_time_stop': 188, 'bull_use_sma': True, 'bull_use_ema': False, 'bull_use_atr': False, 'bull_use_adx': False, 'bull_use_spike': True, 'bull_rsi_required': False, 'bear_strategy': 'mean_reversion', 'bear_bb_std_mult': 2.144783655707893, 'bear_rsi_os': 46, 'bear_rsi_ob': 62, 'bear_adx_thresh': 23.840895165596223, 'bear_atr_min_pct': 0.00021545711611272757, 'bear_atr_max_pct': 0.052052933257067176, 'bear_tp_mult': 1.1181890289959742, 'bear_tsl_mult': 0.19510037100405464, 'bear_time_stop': 157, 'bear_use_sma': True, 'bear_use_ema': True, 'bear_use_atr': True, 'bear_use_adx': False, 'bear_use_spike': False, 'bear_rsi_required': False, 'sideways_strategy': 'mean_reversion', 'sideways_bb_std_mult': 2.8137336987759927, 'sideways_rsi_os': 7, 'sideways_rsi_ob': 45, 'sideways_adx_thresh': 19.661920055286494, 'sideways_atr_min_pct': 0.02840232225358478, 'sideways_atr_max_pct': 0.010525604597644886, 'sideways_tp_mult': 1.0527288349469583, 'sideways_tsl_mult': 0.3430871642695933, 'sideways_time_stop': 88, 'sideways_use_sma': False, 'sideways_use_ema': False, 'sideways_use_atr': True, 'sideways_use_adx': False, 'sideways_use_spike': True, 'sideways_rsi_required': False}.
[I 2025-09-01 07:44:22,442] Trial 139 finished with values: [-1000000000.0, 1000000000.0] and parameters: {'p_sma': 45, 'p_std': 52, 'p_atr': 26, 'p_adx': 14, 'rsi_period': 47, 'ema1': 12, 'ema2': 11, 'slip_atr_k': 0.020388199781021424, 'slip_spread_k': 0.483269869172293, 'spread_hl_frac': 0.029195693388433315, 'bb_std_mult': 3.005987437676852, 'rsi_os': 45, 'rsi_ob': 84, 'vol_spike': 0.10092980588454858, 'adx_thresh': 32.817903292035446, 'atr_min_pct': 0.026486030536174696, 'atr_max_pct': 0.11251261376869093, 'tp_mult': 1.4584593339767877, 'tsl_mult': 0.8378220863553181, 'strategy': 'breakout', 'time_stop': 96, 'use_sma': False, 'use_atr': False, 'use_adx': True, 'use_ema': False, 'use_spike': False, 'rsi_required': False, 'edge_k': 1.8467397476299627, 'edge_cap': 0.13117956433994915, 'bull_strategy': 'breakout', 'bull_bb_std_mult': 2.515145550983305, 'bull_rsi_os': 13, 'bull_rsi_ob': 55, 'bull_adx_thresh': 20.550145101118652, 'bull_atr_min_pct': 0.0034387647766670735, 'bull_atr_max_pct': 0.05947282773654807, 'bull_tp_mult': 1.1574566919887852, 'bull_tsl_mult': 0.44321484280893686, 'bull_time_stop': 34, 'bull_use_sma': True, 'bull_use_ema': False, 'bull_use_atr': False, 'bull_use_adx': False, 'bull_use_spike': False, 'bull_rsi_required': False, 'bear_strategy': 'mean_reversion', 'bear_bb_std_mult': 2.072234019394676, 'bear_rsi_os': 54, 'bear_rsi_ob': 64, 'bear_adx_thresh': 15.74942650667249, 'bear_atr_min_pct': 0.009212503095419216, 'bear_atr_max_pct': 0.10231565568943479, 'bear_tp_mult': 1.5345377758099297, 'bear_tsl_mult': 0.04085141932971513, 'bear_time_stop': 84, 'bear_use_sma': True, 'bear_use_ema': True, 'bear_use_atr': True, 'bear_use_adx': True, 'bear_use_spike': False, 'bear_rsi_required': False, 'sideways_strategy': 'breakout', 'sideways_bb_std_mult': 1.034414668194183, 'sideways_rsi_os': 44, 'sideways_rsi_ob': 45, 'sideways_adx_thresh': 15.60159346835108, 'sideways_atr_min_pct': 0.01721801163841661, 'sideways_atr_max_pct': 0.012028770041987772, 'sideways_tp_mult': 1.1819201068413323, 'sideways_tsl_mult': 0.22076445915737128, 'sideways_time_stop': 106, 'sideways_use_sma': False, 'sideways_use_ema': False, 'sideways_use_atr': True, 'sideways_use_adx': True, 'sideways_use_spike': False, 'sideways_rsi_required': False}.
[I 2025-09-01 07:44:22,756] Trial 140 finished with values: [-0.014684308242001731, 0.014733600631793018] and parameters: {'p_sma': 45, 'p_std': 54, 'p_atr': 12, 'p_adx': 12, 'rsi_period': 46, 'ema1': 11, 'ema2': 11, 'slip_atr_k': 0.017164207117457902, 'slip_spread_k': 0.48232659036525977, 'spread_hl_frac': 0.018519025354310662, 'bb_std_mult': 2.638425580096252, 'rsi_os': 43, 'rsi_ob': 83, 'vol_spike': 0.10005691342642689, 'adx_thresh': 33.137375898593845, 'atr_min_pct': 0.023949150410672478, 'atr_max_pct': 0.1140149785119903, 'tp_mult': 1.4462978227286558, 'tsl_mult': 0.8724488478322494, 'strategy': 'breakout', 'time_stop': 94, 'use_sma': False, 'use_atr': True, 'use_adx': True, 'use_ema': False, 'use_spike': True, 'rsi_required': True, 'edge_k': 1.854777879652539, 'edge_cap': 0.16711280057215921, 'bull_strategy': 'mean_reversion', 'bull_bb_std_mult': 0.6913614639715011, 'bull_rsi_os': 12, 'bull_rsi_ob': 55, 'bull_adx_thresh': 34.95798319488589, 'bull_atr_min_pct': 0.0002748764458562177, 'bull_atr_max_pct': 0.059410364216347704, 'bull_tp_mult': 1.147111809816475, 'bull_tsl_mult': 0.4385765746683396, 'bull_time_stop': 36, 'bull_use_sma': True, 'bull_use_ema': False, 'bull_use_atr': False, 'bull_use_adx': False, 'bull_use_spike': False, 'bull_rsi_required': False, 'bear_strategy': 'mean_reversion', 'bear_bb_std_mult': 1.9881736114896877, 'bear_rsi_os': 54, 'bear_rsi_ob': 64, 'bear_adx_thresh': 18.40909605670678, 'bear_atr_min_pct': 0.009478309528777215, 'bear_atr_max_pct': 0.11138767140564143, 'bear_tp_mult': 1.5924038888581007, 'bear_tsl_mult': 0.05845876888234797, 'bear_time_stop': 82, 'bear_use_sma': True, 'bear_use_ema': True, 'bear_use_atr': True, 'bear_use_adx': True, 'bear_use_spike': False, 'bear_rsi_required': False, 'sideways_strategy': 'breakout', 'sideways_bb_std_mult': 1.1255210220457195, 'sideways_rsi_os': 44, 'sideways_rsi_ob': 47, 'sideways_adx_thresh': 15.56375199094284, 'sideways_atr_min_pct': 0.017038969904281727, 'sideways_atr_max_pct': 0.012741961339625896, 'sideways_tp_mult': 2.2106544178603333, 'sideways_tsl_mult': 0.2009446765959113, 'sideways_time_stop': 103, 'sideways_use_sma': True, 'sideways_use_ema': False, 'sideways_use_atr': False, 'sideways_use_adx': True, 'sideways_use_spike': False, 'sideways_rsi_required': False}.
[I 2025-09-01 07:44:23,271] Trial 141 finished with values: [-1000000000.0, 1000000000.0] and parameters: {'p_sma': 45, 'p_std': 54, 'p_atr': 23, 'p_adx': 14, 'rsi_period': 47, 'ema1': 11, 'ema2': 11, 'slip_atr_k': 0.018820731071875083, 'slip_spread_k': 0.48628909514938007, 'spread_hl_frac': 0.019295650698453914, 'bb_std_mult': 2.6938006998122996, 'rsi_os': 50, 'rsi_ob': 83, 'vol_spike': 0.01625739444333655, 'adx_thresh': 34.69764151068547, 'atr_min_pct': 0.02519183021353281, 'atr_max_pct': 0.09790623644164909, 'tp_mult': 1.493192262688311, 'tsl_mult': 0.7679289566445264, 'strategy': 'breakout', 'time_stop': 96, 'use_sma': False, 'use_atr': True, 'use_adx': True, 'use_ema': True, 'use_spike': True, 'rsi_required': False, 'edge_k': 1.9857137174322037, 'edge_cap': 0.12162707988756202, 'bull_strategy': 'mean_reversion', 'bull_bb_std_mult': 2.5359699006760783, 'bull_rsi_os': 14, 'bull_rsi_ob': 52, 'bull_adx_thresh': 34.85661624227414, 'bull_atr_min_pct': 0.003746761753231438, 'bull_atr_max_pct': 0.050918769381862995, 'bull_tp_mult': 1.195250721318582, 'bull_tsl_mult': 0.4486416682304468, 'bull_time_stop': 35, 'bull_use_sma': True, 'bull_use_ema': True, 'bull_use_atr': False, 'bull_use_adx': False, 'bull_use_spike': False, 'bull_rsi_required': False, 'bear_strategy': 'mean_reversion', 'bear_bb_std_mult': 1.9810620383113784, 'bear_rsi_os': 54, 'bear_rsi_ob': 64, 'bear_adx_thresh': 14.62597775552909, 'bear_atr_min_pct': 0.009707660957232767, 'bear_atr_max_pct': 0.10236781060333261, 'bear_tp_mult': 1.5175656392897108, 'bear_tsl_mult': 0.26693947050709965, 'bear_time_stop': 114, 'bear_use_sma': True, 'bear_use_ema': False, 'bear_use_atr': True, 'bear_use_adx': False, 'bear_use_spike': False, 'bear_rsi_required': True, 'sideways_strategy': 'breakout', 'sideways_bb_std_mult': 1.0400552833472465, 'sideways_rsi_os': 46, 'sideways_rsi_ob': 45, 'sideways_adx_thresh': 15.422658801922259, 'sideways_atr_min_pct': 0.017156261658546935, 'sideways_atr_max_pct': 0.013770857272512791, 'sideways_tp_mult': 1.1489753848916557, 'sideways_tsl_mult': 0.19403969172413477, 'sideways_time_stop': 102, 'sideways_use_sma': False, 'sideways_use_ema': True, 'sideways_use_atr': False, 'sideways_use_adx': True, 'sideways_use_spike': False, 'sideways_rsi_required': False}.
[I 2025-09-01 07:44:23,424] Trial 142 finished with values: [-1000000000.0, 1000000000.0] and parameters: {'p_sma': 45, 'p_std': 52, 'p_atr': 22, 'p_adx': 14, 'rsi_period': 43, 'ema1': 11, 'ema2': 10, 'slip_atr_k': 0.01734002205468989, 'slip_spread_k': 0.4891094157294671, 'spread_hl_frac': 0.018657949125035145, 'bb_std_mult': 2.6031371430988166, 'rsi_os': 50, 'rsi_ob': 82, 'vol_spike': 0.0007626415586248266, 'adx_thresh': 34.263879880697544, 'atr_min_pct': 0.02387914785238173, 'atr_max_pct': 0.14444296110868177, 'tp_mult': 1.4952501432583887, 'tsl_mult': 0.7661174999701125, 'strategy': 'breakout', 'time_stop': 83, 'use_sma': False, 'use_atr': True, 'use_adx': True, 'use_ema': True, 'use_spike': True, 'rsi_required': False, 'edge_k': 1.9863326372881511, 'edge_cap': 0.11647335949540193, 'bull_strategy': 'mean_reversion', 'bull_bb_std_mult': 2.5454063297306693, 'bull_rsi_os': 12, 'bull_rsi_ob': 54, 'bull_adx_thresh': 17.31545646874594, 'bull_atr_min_pct': 0.0034851022389135633, 'bull_atr_max_pct': 0.04990744138350194, 'bull_tp_mult': 1.1406352405599696, 'bull_tsl_mult': 0.44573173359345086, 'bull_time_stop': 43, 'bull_use_sma': True, 'bull_use_ema': True, 'bull_use_atr': False, 'bull_use_adx': False, 'bull_use_spike': False, 'bull_rsi_required': False, 'bear_strategy': 'mean_reversion', 'bear_bb_std_mult': 1.9343637067444364, 'bear_rsi_os': 52, 'bear_rsi_ob': 64, 'bear_adx_thresh': 14.149422810677319, 'bear_atr_min_pct': 0.00961062492470997, 'bear_atr_max_pct': 0.11065377564213885, 'bear_tp_mult': 1.3784140548427566, 'bear_tsl_mult': 0.09990766203259462, 'bear_time_stop': 114, 'bear_use_sma': True, 'bear_use_ema': False, 'bear_use_atr': True, 'bear_use_adx': False, 'bear_use_spike': False, 'bear_rsi_required': True, 'sideways_strategy': 'breakout', 'sideways_bb_std_mult': 1.1350178224228071, 'sideways_rsi_os': 46, 'sideways_rsi_ob': 47, 'sideways_adx_thresh': 15.126681722866355, 'sideways_atr_min_pct': 0.01690677877581894, 'sideways_atr_max_pct': 0.014613129618109164, 'sideways_tp_mult': 1.8342262238954268, 'sideways_tsl_mult': 0.20254933929505783, 'sideways_time_stop': 113, 'sideways_use_sma': False, 'sideways_use_ema': True, 'sideways_use_atr': False, 'sideways_use_adx': True, 'sideways_use_spike': False, 'sideways_rsi_required': False}.
[I 2025-09-01 07:45:02,386] Trial 145 finished with values: [-0.018570125561690687, 0.01845082954347323] and parameters: {'p_sma': 46, 'p_std': 48, 'p_atr': 20, 'p_adx': 13, 'rsi_period': 45, 'ema1': 10, 'ema2': 12, 'slip_atr_k': 0.005419202838053664, 'slip_spread_k': 0.5132184863033113, 'spread_hl_frac': 0.04859747139246406, 'bb_std_mult': 2.778439258596457, 'rsi_os': 46, 'rsi_ob': 87, 'vol_spike': 0.04887582798283498, 'adx_thresh': 33.07465896448033, 'atr_min_pct': 2.1171076896040267e-05, 'atr_max_pct': 0.03242957435231104, 'tp_mult': 1.6030040721619863, 'tsl_mult': 0.659695912633465, 'strategy': 'breakout', 'time_stop': 113, 'use_sma': False, 'use_atr': False, 'use_adx': True, 'use_ema': False, 'use_spike': False, 'rsi_required': True, 'edge_k': 1.9356909235280593, 'edge_cap': 0.14827281032145934, 'bull_strategy': 'breakout', 'bull_bb_std_mult': 2.319920891070625, 'bull_rsi_os': 17, 'bull_rsi_ob': 51, 'bull_adx_thresh': 27.969667431155983, 'bull_atr_min_pct': 0.0017304528200486134, 'bull_atr_max_pct': 0.01475288865762521, 'bull_tp_mult': 1.2451587169644691, 'bull_tsl_mult': 0.40637856641335723, 'bull_time_stop': 11, 'bull_use_sma': True, 'bull_use_ema': True, 'bull_use_atr': False, 'bull_use_adx': False, 'bull_use_spike': False, 'bull_rsi_required': False, 'bear_strategy': 'mean_reversion', 'bear_bb_std_mult': 2.0276918000315285, 'bear_rsi_os': 50, 'bear_rsi_ob': 61, 'bear_adx_thresh': 30.3233525078694, 'bear_atr_min_pct': 0.008712133708558004, 'bear_atr_max_pct': 0.09694421957680173, 'bear_tp_mult': 1.4082507521569096, 'bear_tsl_mult': 0.1536685903536898, 'bear_time_stop': 98, 'bear_use_sma': True, 'bear_use_ema': False, 'bear_use_atr': False, 'bear_use_adx': False, 'bear_use_spike': False, 'bear_rsi_required': False, 'sideways_strategy': 'breakout', 'sideways_bb_std_mult': 0.9613884510789164, 'sideways_rsi_os': 42, 'sideways_rsi_ob': 46, 'sideways_adx_thresh': 13.750876887796542, 'sideways_atr_min_pct': 0.016038479059934344, 'sideways_atr_max_pct': 0.0925528995988682, 'sideways_tp_mult': 1.3003703590999929, 'sideways_tsl_mult': 0.16445241945546674, 'sideways_time_stop': 93, 'sideways_use_sma': True, 'sideways_use_ema': False, 'sideways_use_atr': True, 'sideways_use_adx': True, 'sideways_use_spike': False, 'sideways_rsi_required': False}.
