[I 2025-09-01 08:44:53,850] Trial 476 finished with values: [-0.037313159053630085, 0.03717323383246503] and parameters: {'p_sma': 33, 'p_std': 36, 'p_atr': 20, 'p_adx': 15, 'rsi_period': 47, 'ema1': 10, 'ema2': 10, 'slip_atr_k': 0.2255472938258969, 'slip_spread_k': 0.17173247177701256, 'spread_hl_frac': 0.021950843003739517, 'bb_std_mult': 2.459313226991146, 'rsi_os': 44, 'rsi_ob': 93, 'vol_spike': 0.02933159554343849, 'adx_thresh': 31.420079863798332, 'atr_min_pct': 0.00800945027104936, 'atr_max_pct': 0.09656645054352554, 'tp_mult': 1.4732187289274135, 'tsl_mult': 0.2116569596881352, 'strategy': 'mean_reversion', 'time_stop': 34, 'use_sma': False, 'use_atr': False, 'use_adx': False, 'use_ema': False, 'use_spike': False, 'rsi_required': False, 'edge_k': 0.7320760572092432, 'edge_cap': 0.302910574409307, 'bull_strategy': 'breakout', 'bull_bb_std_mult': 2.6119483943756214, 'bull_rsi_os': 41, 'bull_rsi_ob': 59, 'bull_adx_thresh': 11.918465807666761, 'bull_atr_min_pct': 0.018198076959249958, 'bull_atr_max_pct': 0.06404333340277543, 'bull_tp_mult': 1.3044987308873592, 'bull_tsl_mult': 0.9625576677078529, 'bull_time_stop': 162, 'bull_use_sma': True, 'bull_use_ema': True, 'bull_use_atr': True, 'bull_use_adx': True, 'bull_use_spike': True, 'bull_rsi_required': False, 'bear_strategy': 'mean_reversion', 'bear_bb_std_mult': 3.595490156577705, 'bear_rsi_os': 42, 'bear_rsi_ob': 89, 'bear_adx_thresh': 10.548325727341645, 'bear_atr_min_pct': 0.004429435674088723, 'bear_atr_max_pct': 0.033830302060782295, 'bear_tp_mult': 2.8840736101847537, 'bear_tsl_mult': 0.09760815992584718, 'bear_time_stop': 228, 'bear_use_sma': False, 'bear_use_ema': False, 'bear_use_atr': True, 'bear_use_adx': True, 'bear_use_spike': True, 'bear_rsi_required': True, 'sideways_strategy': 'breakout', 'sideways_bb_std_mult': 1.4874177197190779, 'sideways_rsi_os': 12, 'sideways_rsi_ob': 71, 'sideways_adx_thresh': 11.644235411261144, 'sideways_atr_min_pct': 0.012766885894181942, 'sideways_atr_max_pct': 0.10394814622326286, 'sideways_tp_mult': 2.0846768321936047, 'sideways_tsl_mult': 0.4870880682832465, 'sideways_time_stop': 147, 'sideways_use_sma': False, 'sideways_use_ema': False, 'sideways_use_atr': True, 'sideways_use_adx': False, 'sideways_use_spike': True, 'sideways_rsi_required': True}.
[I 2025-09-01 08:44:53,850] Trial 475 finished with values: [0.008157317793512808, 0.003380921046069393] and parameters: {'p_sma': 34, 'p_std': 36, 'p_atr': 19, 'p_adx': 15, 'rsi_period': 44, 'ema1': 10, 'ema2': 10, 'slip_atr_k': 0.024811013537558792, 'slip_spread_k': 0.25086765009387973, 'spread_hl_frac': 0.020717000137863744, 'bb_std_mult': 2.4444395452239105, 'rsi_os': 44, 'rsi_ob': 93, 'vol_spike': 0.030330070681177282, 'adx_thresh': 30.86046792895595, 'atr_min_pct': 0.008073387619772545, 'atr_max_pct': 0.09720695136664145, 'tp_mult': 1.4898408516109503, 'tsl_mult': 0.2111259275632452, 'strategy': 'mean_reversion', 'time_stop': 22, 'use_sma': False, 'use_atr': False, 'use_adx': False, 'use_ema': False, 'use_spike': False, 'rsi_required': False, 'edge_k': 0.7226926216778885, 'edge_cap': 0.3325453341141808, 'bull_strategy': 'breakout', 'bull_bb_std_mult': 2.6990814809138257, 'bull_rsi_os': 44, 'bull_rsi_ob': 59, 'bull_adx_thresh': 11.614822470521215, 'bull_atr_min_pct': 0.018382931391692794, 'bull_atr_max_pct': 0.06463425994871325, 'bull_tp_mult': 1.3387483886673928, 'bull_tsl_mult': 0.9654708157974511, 'bull_time_stop': 167, 'bull_use_sma': True, 'bull_use_ema': True, 'bull_use_atr': True, 'bull_use_adx': True, 'bull_use_spike': True, 'bull_rsi_required': False, 'bear_strategy': 'mean_reversion', 'bear_bb_std_mult': 3.4827176149646113, 'bear_rsi_os': 42, 'bear_rsi_ob': 87, 'bear_adx_thresh': 10.503256120032162, 'bear_atr_min_pct': 0.00498630642486076, 'bear_atr_max_pct': 0.03551464001173468, 'bear_tp_mult': 2.8391304036101226, 'bear_tsl_mult': 0.12610642530514607, 'bear_time_stop': 230, 'bear_use_sma': False, 'bear_use_ema': False, 'bear_use_atr': True, 'bear_use_adx': True, 'bear_use_spike': True, 'bear_rsi_required': True, 'sideways_strategy': 'breakout', 'sideways_bb_std_mult': 1.368363873998909, 'sideways_rsi_os': 12, 'sideways_rsi_ob': 71, 'sideways_adx_thresh': 11.575633486229155, 'sideways_atr_min_pct': 0.013015083370440361, 'sideways_atr_max_pct': 0.017091125491837902, 'sideways_tp_mult': 2.1700523989375347, 'sideways_tsl_mult': 0.47614103339030406, 'sideways_time_stop': 134, 'sideways_use_sma': False, 'sideways_use_ema': False, 'sideways_use_atr': True, 'sideways_use_adx': False, 'sideways_use_spike': True, 'sideways_rsi_required': True}.
[I 2025-09-01 08:45:42,186] Trial 479 finished with values: [0.012343439235293019, 0.002829317842866101] and parameters: {'p_sma': 33, 'p_std': 35, 'p_atr': 20, 'p_adx': 15, 'rsi_period': 45, 'ema1': 10, 'ema2': 58, 'slip_atr_k': 0.0154833265892994, 'slip_spread_k': 0.17237267742147752, 'spread_hl_frac': 0.022382383863506997, 'bb_std_mult': 2.456006917270377, 'rsi_os': 44, 'rsi_ob': 93, 'vol_spike': 0.019948714924542886, 'adx_thresh': 33.63045309047208, 'atr_min_pct': 0.008186285604146656, 'atr_max_pct': 0.09674487777863562, 'tp_mult': 1.463540511985598, 'tsl_mult': 0.20236786750224206, 'strategy': 'mean_reversion', 'time_stop': 36, 'use_sma': False, 'use_atr': False, 'use_adx': False, 'use_ema': False, 'use_spike': False, 'rsi_required': False, 'edge_k': 0.7864075783020907, 'edge_cap': 0.3026028671301238, 'bull_strategy': 'breakout', 'bull_bb_std_mult': 2.590383785376766, 'bull_rsi_os': 41, 'bull_rsi_ob': 57, 'bull_adx_thresh': 11.816153330980034, 'bull_atr_min_pct': 0.01864545536304376, 'bull_atr_max_pct': 0.064644636245924, 'bull_tp_mult': 1.30560486305734, 'bull_tsl_mult': 0.9636047721949887, 'bull_time_stop': 163, 'bull_use_sma': True, 'bull_use_ema': True, 'bull_use_atr': True, 'bull_use_adx': True, 'bull_use_spike': True, 'bull_rsi_required': False, 'bear_strategy': 'mean_reversion', 'bear_bb_std_mult': 3.59561419665788, 'bear_rsi_os': 43, 'bear_rsi_ob': 87, 'bear_adx_thresh': 10.72398874988028, 'bear_atr_min_pct': 0.005159912763796015, 'bear_atr_max_pct': 0.035613758542201314, 'bear_tp_mult': 2.8839478745780966, 'bear_tsl_mult': 0.09028426522925359, 'bear_time_stop': 228, 'bear_use_sma': False, 'bear_use_ema': False, 'bear_use_atr': True, 'bear_use_adx': True, 'bear_use_spike': True, 'bear_rsi_required': True, 'sideways_strategy': 'breakout', 'sideways_bb_std_mult': 1.3691689339090307, 'sideways_rsi_os': 12, 'sideways_rsi_ob': 64, 'sideways_adx_thresh': 11.807155644490631, 'sideways_atr_min_pct': 0.007246471112679507, 'sideways_atr_max_pct': 0.05842375985949655, 'sideways_tp_mult': 2.336389787885118, 'sideways_tsl_mult': 0.4815977333699705, 'sideways_time_stop': 146, 'sideways_use_sma': False, 'sideways_use_ema': False, 'sideways_use_atr': True, 'sideways_use_adx': False, 'sideways_use_spike': True, 'sideways_rsi_required': True}.
[I 2025-09-01 08:45:42,220] Trial 481 finished with values: [0.009663805673347348, 0.0036664390472541776] and parameters: {'p_sma': 33, 'p_std': 34, 'p_atr': 20, 'p_adx': 16, 'rsi_period': 47, 'ema1': 10, 'ema2': 43, 'slip_atr_k': 0.01541208911445055, 'slip_spread_k': 0.21386838501111982, 'spread_hl_frac': 0.021288668833774917, 'bb_std_mult': 2.472404150610164, 'rsi_os': 44, 'rsi_ob': 93, 'vol_spike': 0.019449102916444565, 'adx_thresh': 18.074932080421945, 'atr_min_pct': 0.00806668373881766, 'atr_max_pct': 0.10317977783353888, 'tp_mult': 1.3988717951559106, 'tsl_mult': 0.19562637771965158, 'strategy': 'mean_reversion', 'time_stop': 36, 'use_sma': False, 'use_atr': False, 'use_adx': False, 'use_ema': False, 'use_spike': False, 'rsi_required': False, 'edge_k': 0.7846602207749797, 'edge_cap': 0.3503106717625897, 'bull_strategy': 'breakout', 'bull_bb_std_mult': 2.6135715586476, 'bull_rsi_os': 42, 'bull_rsi_ob': 57, 'bull_adx_thresh': 11.480404274804645, 'bull_atr_min_pct': 0.018918653291603638, 'bull_atr_max_pct': 0.06506812944836737, 'bull_tp_mult': 1.22274250504324, 'bull_tsl_mult': 0.9640024774946765, 'bull_time_stop': 165, 'bull_use_sma': True, 'bull_use_ema': True, 'bull_use_atr': True, 'bull_use_adx': True, 'bull_use_spike': True, 'bull_rsi_required': False, 'bear_strategy': 'mean_reversion', 'bear_bb_std_mult': 3.3876220089371905, 'bear_rsi_os': 42, 'bear_rsi_ob': 87, 'bear_adx_thresh': 10.484492727896672, 'bear_atr_min_pct': 0.005042838430938643, 'bear_atr_max_pct': 0.036921976492451866, 'bear_tp_mult': 2.915386079372247, 'bear_tsl_mult': 0.1298443893810372, 'bear_time_stop': 233, 'bear_use_sma': False, 'bear_use_ema': False, 'bear_use_atr': True, 'bear_use_adx': True, 'bear_use_spike': True, 'bear_rsi_required': True, 'sideways_strategy': 'breakout', 'sideways_bb_std_mult': 1.406007190121165, 'sideways_rsi_os': 13, 'sideways_rsi_ob': 64, 'sideways_adx_thresh': 11.547108434875437, 'sideways_atr_min_pct': 0.011213261558855832, 'sideways_atr_max_pct': 0.017786769022976722, 'sideways_tp_mult': 2.3601639282112123, 'sideways_tsl_mult': 0.4630359786614923, 'sideways_time_stop': 145, 'sideways_use_sma': False, 'sideways_use_ema': False, 'sideways_use_atr': True, 'sideways_use_adx': False, 'sideways_use_spike': True, 'sideways_rsi_required': True}.
[I 2025-09-01 08:45:42,576] Trial 482 finished with values: [0.01124485169050038, 0.003582698156903656] and parameters: {'p_sma': 33, 'p_std': 34, 'p_atr': 20, 'p_adx': 16, 'rsi_period': 47, 'ema1': 10, 'ema2': 59, 'slip_atr_k': 0.01568613084342164, 'slip_spread_k': 0.1867059926880758, 'spread_hl_frac': 0.020628823395987872, 'bb_std_mult': 2.4753574982217885, 'rsi_os': 44, 'rsi_ob': 93, 'vol_spike': 0.01931121960473082, 'adx_thresh': 33.194340498121285, 'atr_min_pct': 0.00802712322308171, 'atr_max_pct': 0.10248151722603697, 'tp_mult': 1.385365390620358, 'tsl_mult': 0.1948664328237758, 'strategy': 'mean_reversion', 'time_stop': 34, 'use_sma': False, 'use_atr': False, 'use_adx': False, 'use_ema': False, 'use_spike': False, 'rsi_required': False, 'edge_k': 0.7838930264020503, 'edge_cap': 0.35463475284339785, 'bull_strategy': 'breakout', 'bull_bb_std_mult': 2.6281378461085265, 'bull_rsi_os': 42, 'bull_rsi_ob': 57, 'bull_adx_thresh': 12.082025281006429, 'bull_atr_min_pct': 0.0191044272883528, 'bull_atr_max_pct': 0.06709475273837982, 'bull_tp_mult': 1.301494921074797, 'bull_tsl_mult': 0.9740060511392449, 'bull_time_stop': 167, 'bull_use_sma': True, 'bull_use_ema': True, 'bull_use_atr': True, 'bull_use_adx': True, 'bull_use_spike': True, 'bull_rsi_required': False, 'bear_strategy': 'mean_reversion', 'bear_bb_std_mult': 3.5308001772085027, 'bear_rsi_os': 42, 'bear_rsi_ob': 90, 'bear_adx_thresh': 10.25595849088562, 'bear_atr_min_pct': 0.004994884471112107, 'bear_atr_max_pct': 0.038506123640735114, 'bear_tp_mult': 2.8315063574344674, 'bear_tsl_mult': 0.25396312858036113, 'bear_time_stop': 234, 'bear_use_sma': False, 'bear_use_ema': False, 'bear_use_atr': True, 'bear_use_adx': True, 'bear_use_spike': True, 'bear_rsi_required': True, 'sideways_strategy': 'breakout', 'sideways_bb_std_mult': 1.3837743937457825, 'sideways_rsi_os': 13, 'sideways_rsi_ob': 64, 'sideways_adx_thresh': 12.045997714176636, 'sideways_atr_min_pct': 0.02823322376162083, 'sideways_atr_max_pct': 0.016218753501323242, 'sideways_tp_mult': 2.3329503674876997, 'sideways_tsl_mult': 0.47423580576454083, 'sideways_time_stop': 142, 'sideways_use_sma': False, 'sideways_use_ema': False, 'sideways_use_atr': True, 'sideways_use_adx': False, 'sideways_use_spike': True, 'sideways_rsi_required': True}.
[I 2025-09-01 08:45:42,867] Trial 480 finished with values: [0.01085835954939518, 0.0030902143592948096] and parameters: {'p_sma': 33, 'p_std': 36, 'p_atr': 20, 'p_adx': 15, 'rsi_period': 47, 'ema1': 10, 'ema2': 59, 'slip_atr_k': 0.015807854990235827, 'slip_spread_k': 0.17980494383012563, 'spread_hl_frac': 0.021946806952149525, 'bb_std_mult': 2.4711882369223694, 'rsi_os': 44, 'rsi_ob': 93, 'vol_spike': 0.027859044997993538, 'adx_thresh': 31.689007053196374, 'atr_min_pct': 0.008142583675201324, 'atr_max_pct': 0.09524123877232879, 'tp_mult': 1.3892341631677991, 'tsl_mult': 0.21683430833477346, 'strategy': 'mean_reversion', 'time_stop': 33, 'use_sma': False, 'use_atr': False, 'use_adx': False, 'use_ema': False, 'use_spike': False, 'rsi_required': False, 'edge_k': 0.7428791439004634, 'edge_cap': 0.30847245120544947, 'bull_strategy': 'breakout', 'bull_bb_std_mult': 2.6440891851554627, 'bull_rsi_os': 41, 'bull_rsi_ob': 57, 'bull_adx_thresh': 11.959391528112558, 'bull_atr_min_pct': 0.0181584394306585, 'bull_atr_max_pct': 0.06357822335185287, 'bull_tp_mult': 1.3013806355930218, 'bull_tsl_mult': 0.9669344414753803, 'bull_time_stop': 165, 'bull_use_sma': True, 'bull_use_ema': True, 'bull_use_atr': True, 'bull_use_adx': True, 'bull_use_spike': True, 'bull_rsi_required': False, 'bear_strategy': 'mean_reversion', 'bear_bb_std_mult': 3.4164558265270957, 'bear_rsi_os': 42, 'bear_rsi_ob': 87, 'bear_adx_thresh': 10.586169009069794, 'bear_atr_min_pct': 0.005092460056563267, 'bear_atr_max_pct': 0.035836906815786856, 'bear_tp_mult': 2.886211100864229, 'bear_tsl_mult': 0.3996526116039889, 'bear_time_stop': 227, 'bear_use_sma': False, 'bear_use_ema': False, 'bear_use_atr': True, 'bear_use_adx': True, 'bear_use_spike': True, 'bear_rsi_required': True, 'sideways_strategy': 'breakout', 'sideways_bb_std_mult': 1.3825174982829123, 'sideways_rsi_os': 12, 'sideways_rsi_ob': 64, 'sideways_adx_thresh': 31.388139309663927, 'sideways_atr_min_pct': 0.028351494645872263, 'sideways_atr_max_pct': 0.016986097715374845, 'sideways_tp_mult': 2.3346858776597212, 'sideways_tsl_mult': 0.488423584652044, 'sideways_time_stop': 146, 'sideways_use_sma': False, 'sideways_use_ema': False, 'sideways_use_atr': True, 'sideways_use_adx': False, 'sideways_use_spike': True, 'sideways_rsi_required': True}.
[I 2025-09-01 08:46:28,961] Trial 484 finished with values: [0.012788451812429047, 0.002784396422039317] and parameters: {'p_sma': 33, 'p_std': 35, 'p_atr': 20, 'p_adx': 16, 'rsi_period': 45, 'ema1': 9, 'ema2': 59, 'slip_atr_k': 0.014680059554952853, 'slip_spread_k': 0.17314587759501932, 'spread_hl_frac': 0.02045050001108086, 'bb_std_mult': 2.5067746204382204, 'rsi_os': 45, 'rsi_ob': 93, 'vol_spike': 0.018266713636536567, 'adx_thresh': 33.78837400892073, 'atr_min_pct': 0.008014379588353786, 'atr_max_pct': 0.09323220811976773, 'tp_mult': 1.3981615355390942, 'tsl_mult': 0.19159001310819926, 'strategy': 'mean_reversion', 'time_stop': 31, 'use_sma': False, 'use_atr': False, 'use_adx': False, 'use_ema': False, 'use_spike': False, 'rsi_required': False, 'edge_k': 0.790060426108665, 'edge_cap': 0.29702467932892096, 'bull_strategy': 'breakout', 'bull_bb_std_mult': 2.5985972629040255, 'bull_rsi_os': 40, 'bull_rsi_ob': 56, 'bull_adx_thresh': 12.12606578652214, 'bull_atr_min_pct': 0.01922281176848898, 'bull_atr_max_pct': 0.0658127532424961, 'bull_tp_mult': 1.2175113378055564, 'bull_tsl_mult': 0.9677573829113866, 'bull_time_stop': 165, 'bull_use_sma': True, 'bull_use_ema': True, 'bull_use_atr': True, 'bull_use_adx': True, 'bull_use_spike': True, 'bull_rsi_required': False, 'bear_strategy': 'mean_reversion', 'bear_bb_std_mult': 3.5520153466752187, 'bear_rsi_os': 43, 'bear_rsi_ob': 87, 'bear_adx_thresh': 11.22839662276806, 'bear_atr_min_pct': 0.005111061199174693, 'bear_atr_max_pct': 0.039070035952656776, 'bear_tp_mult': 2.8475237130912006, 'bear_tsl_mult': 0.12169345798203263, 'bear_time_stop': 234, 'bear_use_sma': False, 'bear_use_ema': False, 'bear_use_atr': True, 'bear_use_adx': True, 'bear_use_spike': True, 'bear_rsi_required': True, 'sideways_strategy': 'breakout', 'sideways_bb_std_mult': 1.3523644969597235, 'sideways_rsi_os': 12, 'sideways_rsi_ob': 64, 'sideways_adx_thresh': 11.684388609338042, 'sideways_atr_min_pct': 0.007379409365629553, 'sideways_atr_max_pct': 0.058232185617615936, 'sideways_tp_mult': 2.3346202024761737, 'sideways_tsl_mult': 0.47039239996488896, 'sideways_time_stop': 144, 'sideways_use_sma': False, 'sideways_use_ema': False, 'sideways_use_atr': True, 'sideways_use_adx': False, 'sideways_use_spike': True, 'sideways_rsi_required': True}.
[I 2025-09-01 08:46:29,186] Trial 485 finished with values: [0.011886286804061452, 0.0024094219117804638] and parameters: {'p_sma': 34, 'p_std': 35, 'p_atr': 20, 'p_adx': 15, 'rsi_period': 47, 'ema1': 10, 'ema2': 57, 'slip_atr_k': 0.015397149478231101, 'slip_spread_k': 0.17270674353097723, 'spread_hl_frac': 0.020981382936436498, 'bb_std_mult': 2.48831019939145, 'rsi_os': 45, 'rsi_ob': 93, 'vol_spike': 0.018704595877631475, 'adx_thresh': 33.9496495548532, 'atr_min_pct': 0.008197349650595154, 'atr_max_pct': 0.0956733838585112, 'tp_mult': 1.403453913747516, 'tsl_mult': 0.19611490560915873, 'strategy': 'mean_reversion', 'time_stop': 34, 'use_sma': False, 'use_atr': False, 'use_adx': False, 'use_ema': False, 'use_spike': False, 'rsi_required': False, 'edge_k': 0.7902526579372287, 'edge_cap': 0.29581084495489085, 'bull_strategy': 'breakout', 'bull_bb_std_mult': 2.5643617264198544, 'bull_rsi_os': 40, 'bull_rsi_ob': 56, 'bull_adx_thresh': 11.27657370989182, 'bull_atr_min_pct': 0.018894739306819765, 'bull_atr_max_pct': 0.06820786278456606, 'bull_tp_mult': 1.226474553160971, 'bull_tsl_mult': 0.9627574796319469, 'bull_time_stop': 169, 'bull_use_sma': True, 'bull_use_ema': True, 'bull_use_atr': True, 'bull_use_adx': True, 'bull_use_spike': True, 'bull_rsi_required': False, 'bear_strategy': 'mean_reversion', 'bear_bb_std_mult': 3.5542093735486504, 'bear_rsi_os': 43, 'bear_rsi_ob': 87, 'bear_adx_thresh': 10.824532622582806, 'bear_atr_min_pct': 0.005182621730077407, 'bear_atr_max_pct': 0.03790690306060375, 'bear_tp_mult': 2.850012702379601, 'bear_tsl_mult': 0.12133471431579576, 'bear_time_stop': 233, 'bear_use_sma': False, 'bear_use_ema': False, 'bear_use_atr': True, 'bear_use_adx': True, 'bear_use_spike': True, 'bear_rsi_required': True, 'sideways_strategy': 'breakout', 'sideways_bb_std_mult': 1.3785694250504759, 'sideways_rsi_os': 12, 'sideways_rsi_ob': 64, 'sideways_adx_thresh': 12.001168235607087, 'sideways_atr_min_pct': 0.007035617243841509, 'sideways_atr_max_pct': 0.06386992115201781, 'sideways_tp_mult': 2.343726006995907, 'sideways_tsl_mult': 0.47601878416211363, 'sideways_time_stop': 146, 'sideways_use_sma': False, 'sideways_use_ema': False, 'sideways_use_atr': True, 'sideways_use_adx': False, 'sideways_use_spike': True, 'sideways_rsi_required': True}.
[I 2025-09-01 08:46:29,483] Trial 483 finished with values: [0.013174845021656223, 0.0021111258563196902] and parameters: {'p_sma': 33, 'p_std': 35, 'p_atr': 20, 'p_adx': 15, 'rsi_period': 45, 'ema1': 9, 'ema2': 58, 'slip_atr_k': 0.01561127148518222, 'slip_spread_k': 0.14831069870686409, 'spread_hl_frac': 0.020321053257297196, 'bb_std_mult': 2.4941341656925724, 'rsi_os': 45, 'rsi_ob': 93, 'vol_spike': 0.019820558596400015, 'adx_thresh': 33.85871904764583, 'atr_min_pct': 0.008259089597322685, 'atr_max_pct': 0.09462399241893199, 'tp_mult': 1.4246424545092322, 'tsl_mult': 0.19126423962511885, 'strategy': 'mean_reversion', 'time_stop': 34, 'use_sma': False, 'use_atr': False, 'use_adx': False, 'use_ema': False, 'use_spike': False, 'rsi_required': False, 'edge_k': 0.7768280806369177, 'edge_cap': 0.30013978324437446, 'bull_strategy': 'breakout', 'bull_bb_std_mult': 2.5733265525851707, 'bull_rsi_os': 40, 'bull_rsi_ob': 57, 'bull_adx_thresh': 11.435599526843902, 'bull_atr_min_pct': 0.018973143418186247, 'bull_atr_max_pct': 0.06743303265738533, 'bull_tp_mult': 1.2131350675198105, 'bull_tsl_mult': 0.9665711746934976, 'bull_time_stop': 166, 'bull_use_sma': True, 'bull_use_ema': True, 'bull_use_atr': True, 'bull_use_adx': True, 'bull_use_spike': True, 'bull_rsi_required': False, 'bear_strategy': 'mean_reversion', 'bear_bb_std_mult': 3.5445119258816917, 'bear_rsi_os': 43, 'bear_rsi_ob': 87, 'bear_adx_thresh': 11.002828411347467, 'bear_atr_min_pct': 0.00524920463142242, 'bear_atr_max_pct': 0.03762121902284763, 'bear_tp_mult': 2.8421383197776904, 'bear_tsl_mult': 0.1231894776643891, 'bear_time_stop': 230, 'bear_use_sma': False, 'bear_use_ema': False, 'bear_use_atr': True, 'bear_use_adx': True, 'bear_use_spike': True, 'bear_rsi_required': True, 'sideways_strategy': 'breakout', 'sideways_bb_std_mult': 1.3610227207308234, 'sideways_rsi_os': 12, 'sideways_rsi_ob': 64, 'sideways_adx_thresh': 11.685002970188627, 'sideways_atr_min_pct': 0.007787236180751443, 'sideways_atr_max_pct': 0.07619559607733462, 'sideways_tp_mult': 2.3708113133216693, 'sideways_tsl_mult': 0.47353597540370057, 'sideways_time_stop': 145, 'sideways_use_sma': False, 'sideways_use_ema': False, 'sideways_use_atr': True, 'sideways_use_adx': False, 'sideways_use_spike': True, 'sideways_rsi_required': True}.
