[I 2025-09-01 08:18:58,606] Trial 335 finished with values: [-1000000000.0, 1000000000.0] and parameters: {'p_sma': 29, 'p_std': 46, 'p_atr': 20, 'p_adx': 11, 'rsi_period': 61, 'ema1': 15, 'ema2': 15, 'slip_atr_k': 0.028122617196667296, 'slip_spread_k': 0.8633568003985641, 'spread_hl_frac': 0.013560512181612144, 'bb_std_mult': 1.9972586770515732, 'rsi_os': 32, 'rsi_ob': 79, 'vol_spike': 0.270134146588347, 'adx_thresh': 15.20940136402086, 'atr_min_pct': 0.0011201153591804801, 'atr_max_pct': 0.08704179418100347, 'tp_mult': 1.947230183157475, 'tsl_mult': 0.057161471839177136, 'strategy': 'breakout', 'time_stop': 52, 'use_sma': False, 'use_atr': True, 'use_adx': False, 'use_ema': True, 'use_spike': True, 'rsi_required': True, 'edge_k': 0.33160041206188196, 'edge_cap': 0.7113764188800595, 'bull_strategy': 'mean_reversion', 'bull_bb_std_mult': 2.2982084857699707, 'bull_rsi_os': 26, 'bull_rsi_ob': 66, 'bull_adx_thresh': 7.907251933009778, 'bull_atr_min_pct': 0.0031763619228128894, 'bull_atr_max_pct': 0.020701473449524232, 'bull_tp_mult': 1.617233773464924, 'bull_tsl_mult': 0.6883733553990459, 'bull_time_stop': 78, 'bull_use_sma': True, 'bull_use_ema': True, 'bull_use_atr': True, 'bull_use_adx': True, 'bull_use_spike': True, 'bull_rsi_required': False, 'bear_strategy': 'mean_reversion', 'bear_bb_std_mult': 2.1788133585073353, 'bear_rsi_os': 7, 'bear_rsi_ob': 50, 'bear_adx_thresh': 6.106754860600354, 'bear_atr_min_pct': 0.00486082103350814, 'bear_atr_max_pct': 0.0943187334966515, 'bear_tp_mult': 2.178481418777228, 'bear_tsl_mult': 0.08380644910057114, 'bear_time_stop': 274, 'bear_use_sma': False, 'bear_use_ema': True, 'bear_use_atr': False, 'bear_use_adx': False, 'bear_use_spike': True, 'bear_rsi_required': True, 'sideways_strategy': 'mean_reversion', 'sideways_bb_std_mult': 0.8094844636275424, 'sideways_rsi_os': 8, 'sideways_rsi_ob': 92, 'sideways_adx_thresh': 10.900186264522015, 'sideways_atr_min_pct': 0.025151799115927492, 'sideways_atr_max_pct': 0.13785014769239012, 'sideways_tp_mult': 2.5339471110035587, 'sideways_tsl_mult': 0.40222263982086315, 'sideways_time_stop': 145, 'sideways_use_sma': True, 'sideways_use_ema': True, 'sideways_use_atr': True, 'sideways_use_adx': True, 'sideways_use_spike': False, 'sideways_rsi_required': False}.
[I 2025-09-01 08:18:59,082] Trial 334 finished with values: [-0.01220832275823125, 0.013006691241351018] and parameters: {'p_sma': 29, 'p_std': 53, 'p_atr': 9, 'p_adx': 30, 'rsi_period': 60, 'ema1': 27, 'ema2': 15, 'slip_atr_k': 0.04971657781806281, 'slip_spread_k': 0.34559423224599395, 'spread_hl_frac': 0.013571899382995366, 'bb_std_mult': 2.006639472877076, 'rsi_os': 33, 'rsi_ob': 79, 'vol_spike': 0.2867855670817024, 'adx_thresh': 13.03214600175994, 'atr_min_pct': 0.004823299737709472, 'atr_max_pct': 0.02788360567348455, 'tp_mult': 1.99137623387807, 'tsl_mult': 0.6490795030985003, 'strategy': 'breakout', 'time_stop': 36, 'use_sma': False, 'use_atr': False, 'use_adx': False, 'use_ema': True, 'use_spike': True, 'rsi_required': True, 'edge_k': 0.3225574642018151, 'edge_cap': 0.12901799789844887, 'bull_strategy': 'breakout', 'bull_bb_std_mult': 2.750902443981548, 'bull_rsi_os': 22, 'bull_rsi_ob': 45, 'bull_adx_thresh': 8.053520675883673, 'bull_atr_min_pct': 0.028711451309961222, 'bull_atr_max_pct': 0.05164121719520223, 'bull_tp_mult': 1.6252585867057439, 'bull_tsl_mult': 0.7435524912371371, 'bull_time_stop': 70, 'bull_use_sma': True, 'bull_use_ema': True, 'bull_use_atr': True, 'bull_use_adx': True, 'bull_use_spike': True, 'bull_rsi_required': False, 'bear_strategy': 'mean_reversion', 'bear_bb_std_mult': 1.5962288398845188, 'bear_rsi_os': 45, 'bear_rsi_ob': 81, 'bear_adx_thresh': 6.189599116705332, 'bear_atr_min_pct': 0.00472901521836418, 'bear_atr_max_pct': 0.0914263339409939, 'bear_tp_mult': 1.5607306738708417, 'bear_tsl_mult': 0.1142665211307242, 'bear_time_stop': 296, 'bear_use_sma': False, 'bear_use_ema': False, 'bear_use_atr': True, 'bear_use_adx': False, 'bear_use_spike': True, 'bear_rsi_required': True, 'sideways_strategy': 'breakout', 'sideways_bb_std_mult': 0.8159942925716888, 'sideways_rsi_os': 10, 'sideways_rsi_ob': 94, 'sideways_adx_thresh': 10.933662866017674, 'sideways_atr_min_pct': 0.02522123938676068, 'sideways_atr_max_pct': 0.014078157070194467, 'sideways_tp_mult': 1.279765094937405, 'sideways_tsl_mult': 0.00024863104450445483, 'sideways_time_stop': 211, 'sideways_use_sma': True, 'sideways_use_ema': True, 'sideways_use_atr': True, 'sideways_use_adx': True, 'sideways_use_spike': False, 'sideways_rsi_required': False}.
[I 2025-09-01 08:18:59,331] Trial 332 finished with values: [-1000000000.0, 1000000000.0] and parameters: {'p_sma': 12, 'p_std': 52, 'p_atr': 20, 'p_adx': 23, 'rsi_period': 54, 'ema1': 15, 'ema2': 10, 'slip_atr_k': 0.02376452803285587, 'slip_spread_k': 0.8429220912553975, 'spread_hl_frac': 0.013638195904097934, 'bb_std_mult': 2.01667798148432, 'rsi_os': 18, 'rsi_ob': 79, 'vol_spike': 0.055140054368896636, 'adx_thresh': 30.695853015418365, 'atr_min_pct': 0.001154029556076271, 'atr_max_pct': 0.12575739613243286, 'tp_mult': 1.9906585503581589, 'tsl_mult': 0.6730441557535464, 'strategy': 'breakout', 'time_stop': 244, 'use_sma': False, 'use_atr': False, 'use_adx': True, 'use_ema': True, 'use_spike': True, 'rsi_required': True, 'edge_k': 0.289841326413304, 'edge_cap': 0.3724961713872681, 'bull_strategy': 'breakout', 'bull_bb_std_mult': 2.7101522056527276, 'bull_rsi_os': 53, 'bull_rsi_ob': 57, 'bull_adx_thresh': 8.375813694652189, 'bull_atr_min_pct': 0.014611702249016896, 'bull_atr_max_pct': 0.02874548751717093, 'bull_tp_mult': 2.695536487353146, 'bull_tsl_mult': 0.6522269186136005, 'bull_time_stop': 249, 'bull_use_sma': True, 'bull_use_ema': True, 'bull_use_atr': False, 'bull_use_adx': False, 'bull_use_spike': False, 'bull_rsi_required': False, 'bear_strategy': 'mean_reversion', 'bear_bb_std_mult': 1.5634641843513424, 'bear_rsi_os': 45, 'bear_rsi_ob': 71, 'bear_adx_thresh': 12.158472187826654, 'bear_atr_min_pct': 0.008837417213648816, 'bear_atr_max_pct': 0.09646937085475905, 'bear_tp_mult': 2.0709646010725695, 'bear_tsl_mult': 4.0057694264961086e-05, 'bear_time_stop': 295, 'bear_use_sma': False, 'bear_use_ema': True, 'bear_use_atr': True, 'bear_use_adx': True, 'bear_use_spike': False, 'bear_rsi_required': False, 'sideways_strategy': 'breakout', 'sideways_bb_std_mult': 2.3970398010699814, 'sideways_rsi_os': 10, 'sideways_rsi_ob': 58, 'sideways_adx_thresh': 26.7111214949975, 'sideways_atr_min_pct': 0.028838235104752384, 'sideways_atr_max_pct': 0.1480719798484273, 'sideways_tp_mult': 1.5011491067866851, 'sideways_tsl_mult': 0.07781030450199508, 'sideways_time_stop': 134, 'sideways_use_sma': True, 'sideways_use_ema': True, 'sideways_use_atr': True, 'sideways_use_adx': True, 'sideways_use_spike': False, 'sideways_rsi_required': False}.
[I 2025-09-01 08:19:42,246] Trial 337 finished with values: [-1000000000.0, 1000000000.0] and parameters: {'p_sma': 28, 'p_std': 59, 'p_atr': 23, 'p_adx': 9, 'rsi_period': 65, 'ema1': 17, 'ema2': 60, 'slip_atr_k': 0.22885888278858393, 'slip_spread_k': 0.9361514656698985, 'spread_hl_frac': 0.011292467667883431, 'bb_std_mult': 3.285123016853567, 'rsi_os': 29, 'rsi_ob': 94, 'vol_spike': 0.2533023298807803, 'adx_thresh': 17.47630954437183, 'atr_min_pct': 0.0050392819825639595, 'atr_max_pct': 0.07546873823507019, 'tp_mult': 2.4408767806284755, 'tsl_mult': 0.47825202203884465, 'strategy': 'breakout', 'time_stop': 244, 'use_sma': True, 'use_atr': False, 'use_adx': True, 'use_ema': True, 'use_spike': True, 'rsi_required': True, 'edge_k': 0.6005188316425281, 'edge_cap': 0.21515087742986594, 'bull_strategy': 'breakout', 'bull_bb_std_mult': 2.7083573305003203, 'bull_rsi_os': 47, 'bull_rsi_ob': 57, 'bull_adx_thresh': 11.589249814658231, 'bull_atr_min_pct': 0.028021542310713122, 'bull_atr_max_pct': 0.05357939914121487, 'bull_tp_mult': 1.5355203152612216, 'bull_tsl_mult': 0.5438445295919231, 'bull_time_stop': 109, 'bull_use_sma': False, 'bull_use_ema': False, 'bull_use_atr': False, 'bull_use_adx': False, 'bull_use_spike': False, 'bull_rsi_required': True, 'bear_strategy': 'breakout', 'bear_bb_std_mult': 3.508404868979561, 'bear_rsi_os': 10, 'bear_rsi_ob': 69, 'bear_adx_thresh': 6.096660705037366, 'bear_atr_min_pct': 0.00726770010720184, 'bear_atr_max_pct': 0.09589153654443036, 'bear_tp_mult': 2.153252088990504, 'bear_tsl_mult': 0.020766094256013938, 'bear_time_stop': 296, 'bear_use_sma': True, 'bear_use_ema': False, 'bear_use_atr': False, 'bear_use_adx': False, 'bear_use_spike': False, 'bear_rsi_required': False, 'sideways_strategy': 'breakout', 'sideways_bb_std_mult': 2.9667696700224253, 'sideways_rsi_os': 5, 'sideways_rsi_ob': 95, 'sideways_adx_thresh': 26.961079687026178, 'sideways_atr_min_pct': 0.010886287171999173, 'sideways_atr_max_pct': 0.14870622099002584, 'sideways_tp_mult': 1.7955927880088565, 'sideways_tsl_mult': 0.19010183889365653, 'sideways_time_stop': 182, 'sideways_use_sma': True, 'sideways_use_ema': True, 'sideways_use_atr': True, 'sideways_use_adx': True, 'sideways_use_spike': False, 'sideways_rsi_required': True}.
[I 2025-09-01 08:19:42,238] Trial 338 finished with values: [-0.022839999561528157, 0.022777565613367603] and parameters: {'p_sma': 12, 'p_std': 24, 'p_atr': 23, 'p_adx': 9, 'rsi_period': 57, 'ema1': 24, 'ema2': 10, 'slip_atr_k': 0.06720638088119103, 'slip_spread_k': 0.9344153548992133, 'spread_hl_frac': 0.01279406525804008, 'bb_std_mult': 1.862957072491909, 'rsi_os': 35, 'rsi_ob': 81, 'vol_spike': 0.07259345917033434, 'adx_thresh': 30.88161559803086, 'atr_min_pct': 0.014843229558038611, 'atr_max_pct': 0.09555998258877382, 'tp_mult': 1.7457653895822969, 'tsl_mult': 0.02446662667307036, 'strategy': 'breakout', 'time_stop': 246, 'use_sma': True, 'use_atr': False, 'use_adx': True, 'use_ema': True, 'use_spike': True, 'rsi_required': True, 'edge_k': 1.688385900424982, 'edge_cap': 0.2162500098697389, 'bull_strategy': 'breakout', 'bull_bb_std_mult': 0.6971184074034245, 'bull_rsi_os': 51, 'bull_rsi_ob': 54, 'bull_adx_thresh': 25.347127394706455, 'bull_atr_min_pct': 0.0007647796675739971, 'bull_atr_max_pct': 0.02864391731312701, 'bull_tp_mult': 1.544878447865984, 'bull_tsl_mult': 0.655301421028569, 'bull_time_stop': 250, 'bull_use_sma': False, 'bull_use_ema': False, 'bull_use_atr': False, 'bull_use_adx': False, 'bull_use_spike': False, 'bull_rsi_required': True, 'bear_strategy': 'breakout', 'bear_bb_std_mult': 1.873356436469218, 'bear_rsi_os': 11, 'bear_rsi_ob': 69, 'bear_adx_thresh': 10.358418495011847, 'bear_atr_min_pct': 0.006960773992176294, 'bear_atr_max_pct': 0.09665635906646776, 'bear_tp_mult': 2.2556250901713577, 'bear_tsl_mult': 0.06047804781989311, 'bear_time_stop': 295, 'bear_use_sma': True, 'bear_use_ema': False, 'bear_use_atr': False, 'bear_use_adx': False, 'bear_use_spike': False, 'bear_rsi_required': False, 'sideways_strategy': 'breakout', 'sideways_bb_std_mult': 2.411780822809615, 'sideways_rsi_os': 5, 'sideways_rsi_ob': 95, 'sideways_adx_thresh': 26.387480585927225, 'sideways_atr_min_pct': 0.028601015521162794, 'sideways_atr_max_pct': 0.06423219728262847, 'sideways_tp_mult': 1.8849431257912415, 'sideways_tsl_mult': 0.18762975391801923, 'sideways_time_stop': 166, 'sideways_use_sma': True, 'sideways_use_ema': True, 'sideways_use_atr': True, 'sideways_use_adx': True, 'sideways_use_spike': False, 'sideways_rsi_required': True}.
[I 2025-09-01 08:19:42,864] Trial 336 finished with values: [-1000000000.0, 1000000000.0] and parameters: {'p_sma': 29, 'p_std': 46, 'p_atr': 24, 'p_adx': 11, 'rsi_period': 60, 'ema1': 15, 'ema2': 11, 'slip_atr_k': 0.11601664223497515, 'slip_spread_k': 0.9394637641790802, 'spread_hl_frac': 0.01270884951384964, 'bb_std_mult': 1.8741090989460054, 'rsi_os': 35, 'rsi_ob': 79, 'vol_spike': 0.05993124813486794, 'adx_thresh': 9.954797781797783, 'atr_min_pct': 0.022664139210115924, 'atr_max_pct': 0.075569141247123, 'tp_mult': 1.7464443720396543, 'tsl_mult': 0.028759466085322323, 'strategy': 'breakout', 'time_stop': 243, 'use_sma': False, 'use_atr': True, 'use_adx': True, 'use_ema': True, 'use_spike': True, 'rsi_required': True, 'edge_k': 0.3283663374688179, 'edge_cap': 0.214176548883038, 'bull_strategy': 'mean_reversion', 'bull_bb_std_mult': 2.70451199871882, 'bull_rsi_os': 53, 'bull_rsi_ob': 46, 'bull_adx_thresh': 29.347912850304635, 'bull_atr_min_pct': 0.0030699357737466737, 'bull_atr_max_pct': 0.08003065541867646, 'bull_tp_mult': 2.180840840930587, 'bull_tsl_mult': 0.17280757516392076, 'bull_time_stop': 248, 'bull_use_sma': True, 'bull_use_ema': True, 'bull_use_atr': False, 'bull_use_adx': True, 'bull_use_spike': False, 'bull_rsi_required': False, 'bear_strategy': 'mean_reversion', 'bear_bb_std_mult': 3.2775349572996224, 'bear_rsi_os': 41, 'bear_rsi_ob': 81, 'bear_adx_thresh': 10.715132584327932, 'bear_atr_min_pct': 0.004569733574694811, 'bear_atr_max_pct': 0.0954596788805463, 'bear_tp_mult': 2.1923268178819915, 'bear_tsl_mult': 0.0605148784006802, 'bear_time_stop': 295, 'bear_use_sma': False, 'bear_use_ema': True, 'bear_use_atr': False, 'bear_use_adx': False, 'bear_use_spike': False, 'bear_rsi_required': True, 'sideways_strategy': 'mean_reversion', 'sideways_bb_std_mult': 0.8276988931526762, 'sideways_rsi_os': 8, 'sideways_rsi_ob': 91, 'sideways_adx_thresh': 9.481200824663146, 'sideways_atr_min_pct': 0.028503330665438163, 'sideways_atr_max_pct': 0.014504484542851779, 'sideways_tp_mult': 1.2914673960765541, 'sideways_tsl_mult': 0.6736798125391805, 'sideways_time_stop': 121, 'sideways_use_sma': True, 'sideways_use_ema': True, 'sideways_use_atr': True, 'sideways_use_adx': True, 'sideways_use_spike': False, 'sideways_rsi_required': False}.
[I 2025-09-01 08:19:43,125] Trial 339 finished with values: [-1000000000.0, 1000000000.0] and parameters: {'p_sma': 30, 'p_std': 60, 'p_atr': 24, 'p_adx': 9, 'rsi_period': 56, 'ema1': 30, 'ema2': 12, 'slip_atr_k': 0.004905956920786699, 'slip_spread_k': 0.9327464429145751, 'spread_hl_frac': 0.011632521690022603, 'bb_std_mult': 1.6975523258734604, 'rsi_os': 55, 'rsi_ob': 94, 'vol_spike': 0.0731325568015227, 'adx_thresh': 22.37820599248876, 'atr_min_pct': 0.021375191314581123, 'atr_max_pct': 0.13531391374507362, 'tp_mult': 1.823970476885381, 'tsl_mult': 0.46892006986015866, 'strategy': 'breakout', 'time_stop': 265, 'use_sma': True, 'use_atr': False, 'use_adx': True, 'use_ema': True, 'use_spike': True, 'rsi_required': True, 'edge_k': 0.0006055797382211736, 'edge_cap': 0.34047677644360247, 'bull_strategy': 'breakout', 'bull_bb_std_mult': 2.206872971429204, 'bull_rsi_os': 51, 'bull_rsi_ob': 77, 'bull_adx_thresh': 29.312134756452473, 'bull_atr_min_pct': 0.003936238086109766, 'bull_atr_max_pct': 0.08066237015726845, 'bull_tp_mult': 1.532314476020947, 'bull_tsl_mult': 0.5536152426942507, 'bull_time_stop': 60, 'bull_use_sma': False, 'bull_use_ema': False, 'bull_use_atr': False, 'bull_use_adx': False, 'bull_use_spike': False, 'bull_rsi_required': True, 'bear_strategy': 'breakout', 'bear_bb_std_mult': 1.8610616359296528, 'bear_rsi_os': 27, 'bear_rsi_ob': 69, 'bear_adx_thresh': 5.5587275838735914, 'bear_atr_min_pct': 0.007097228750018877, 'bear_atr_max_pct': 0.08286178705285498, 'bear_tp_mult': 2.29384140013256, 'bear_tsl_mult': 0.058832719450428825, 'bear_time_stop': 300, 'bear_use_sma': True, 'bear_use_ema': False, 'bear_use_atr': False, 'bear_use_adx': False, 'bear_use_spike': False, 'bear_rsi_required': False, 'sideways_strategy': 'breakout', 'sideways_bb_std_mult': 1.1617838747549702, 'sideways_rsi_os': 5, 'sideways_rsi_ob': 91, 'sideways_adx_thresh': 19.10612223453418, 'sideways_atr_min_pct': 0.02695241175756991, 'sideways_atr_max_pct': 0.01836761162799384, 'sideways_tp_mult': 1.182180670271636, 'sideways_tsl_mult': 0.19787273706032105, 'sideways_time_stop': 119, 'sideways_use_sma': True, 'sideways_use_ema': True, 'sideways_use_atr': True, 'sideways_use_adx': False, 'sideways_use_spike': True, 'sideways_rsi_required': True}.
[I 2025-09-01 08:20:30,103] Trial 343 finished with values: [-1000000000.0, 1000000000.0] and parameters: {'p_sma': 28, 'p_std': 39, 'p_atr': 22, 'p_adx': 22, 'rsi_period': 48, 'ema1': 11, 'ema2': 46, 'slip_atr_k': 0.15568198772806013, 'slip_spread_k': 0.6555806270751753, 'spread_hl_frac': 0.01475834058546144, 'bb_std_mult': 2.7472679425998523, 'rsi_os': 23, 'rsi_ob': 71, 'vol_spike': 0.0820989776550928, 'adx_thresh': 28.630516856046235, 'atr_min_pct': 0.007068527387952333, 'atr_max_pct': 0.022910567953594578, 'tp_mult': 2.5656952141197316, 'tsl_mult': 0.4345261225356314, 'strategy': 'mean_reversion', 'time_stop': 60, 'use_sma': False, 'use_atr': False, 'use_adx': True, 'use_ema': True, 'use_spike': True, 'rsi_required': True, 'edge_k': 0.11077846614884623, 'edge_cap': 0.23934276149611475, 'bull_strategy': 'breakout', 'bull_bb_std_mult': 3.3262738822606543, 'bull_rsi_os': 30, 'bull_rsi_ob': 48, 'bull_adx_thresh': 7.137504244699738, 'bull_atr_min_pct': 0.003708244419085328, 'bull_atr_max_pct': 0.08397861144006544, 'bull_tp_mult': 1.6862861430501423, 'bull_tsl_mult': 0.5720616692110959, 'bull_time_stop': 87, 'bull_use_sma': True, 'bull_use_ema': True, 'bull_use_atr': False, 'bull_use_adx': False, 'bull_use_spike': False, 'bull_rsi_required': False, 'bear_strategy': 'mean_reversion', 'bear_bb_std_mult': 1.745471432328312, 'bear_rsi_os': 46, 'bear_rsi_ob': 79, 'bear_adx_thresh': 6.795344126325119, 'bear_atr_min_pct': 0.008218186108023976, 'bear_atr_max_pct': 0.036817276714844624, 'bear_tp_mult': 2.110010571395243, 'bear_tsl_mult': 0.16098496954274202, 'bear_time_stop': 177, 'bear_use_sma': True, 'bear_use_ema': False, 'bear_use_atr': True, 'bear_use_adx': False, 'bear_use_spike': False, 'bear_rsi_required': False, 'sideways_strategy': 'breakout', 'sideways_bb_std_mult': 0.9739990002484643, 'sideways_rsi_os': 32, 'sideways_rsi_ob': 93, 'sideways_adx_thresh': 17.190406109168745, 'sideways_atr_min_pct': 0.027754205451302753, 'sideways_atr_max_pct': 0.03438924633367229, 'sideways_tp_mult': 1.356175598502589, 'sideways_tsl_mult': 0.14609948935174755, 'sideways_time_stop': 98, 'sideways_use_sma': True, 'sideways_use_ema': True, 'sideways_use_atr': False, 'sideways_use_adx': False, 'sideways_use_spike': True, 'sideways_rsi_required': False}.
[I 2025-09-01 08:20:30,383] Trial 341 finished with values: [-0.054936802986015, 0.05470689579517606] and parameters: {'p_sma': 30, 'p_std': 30, 'p_atr': 24, 'p_adx': 13, 'rsi_period': 52, 'ema1': 16, 'ema2': 25, 'slip_atr_k': 0.11742880027768791, 'slip_spread_k': 0.7961072051904652, 'spread_hl_frac': 0.014626155699618539, 'bb_std_mult': 2.6330033594829847, 'rsi_os': 23, 'rsi_ob': 74, 'vol_spike': 0.061648189050157384, 'adx_thresh': 29.631842947045573, 'atr_min_pct': 0.00831251458564718, 'atr_max_pct': 0.14316204365050356, 'tp_mult': 2.800182288373441, 'tsl_mult': 0.43014291917922354, 'strategy': 'breakout', 'time_stop': 265, 'use_sma': False, 'use_atr': True, 'use_adx': True, 'use_ema': True, 'use_spike': True, 'rsi_required': True, 'edge_k': 0.10726476974776467, 'edge_cap': 0.2341199371647516, 'bull_strategy': 'mean_reversion', 'bull_bb_std_mult': 3.017396397824828, 'bull_rsi_os': 48, 'bull_rsi_ob': 77, 'bull_adx_thresh': 7.288479835390288, 'bull_atr_min_pct': 0.003874536079432545, 'bull_atr_max_pct': 0.04667949434437467, 'bull_tp_mult': 1.6853358411283748, 'bull_tsl_mult': 0.5753222233424099, 'bull_time_stop': 46, 'bull_use_sma': True, 'bull_use_ema': True, 'bull_use_atr': False, 'bull_use_adx': False, 'bull_use_spike': False, 'bull_rsi_required': False, 'bear_strategy': 'mean_reversion', 'bear_bb_std_mult': 3.2821135642216452, 'bear_rsi_os': 46, 'bear_rsi_ob': 79, 'bear_adx_thresh': 26.178638260366345, 'bear_atr_min_pct': 0.0028820838705248437, 'bear_atr_max_pct': 0.07648495480617494, 'bear_tp_mult': 2.191290929831498, 'bear_tsl_mult': 0.0428757934659241, 'bear_time_stop': 287, 'bear_use_sma': True, 'bear_use_ema': False, 'bear_use_atr': False, 'bear_use_adx': False, 'bear_use_spike': False, 'bear_rsi_required': False, 'sideways_strategy': 'mean_reversion', 'sideways_bb_std_mult': 0.98325514579077, 'sideways_rsi_os': 32, 'sideways_rsi_ob': 56, 'sideways_adx_thresh': 17.31769968904315, 'sideways_atr_min_pct': 0.027823811228612844, 'sideways_atr_max_pct': 0.017384720220606872, 'sideways_tp_mult': 1.1837735365076434, 'sideways_tsl_mult': 0.14465074142963213, 'sideways_time_stop': 190, 'sideways_use_sma': True, 'sideways_use_ema': True, 'sideways_use_atr': False, 'sideways_use_adx': False, 'sideways_use_spike': True, 'sideways_rsi_required': False}.
