[I 2025-09-01 08:56:28,319] Trial 549 finished with values: [-1000000000.0, 1000000000.0] and parameters: {'p_sma': 59, 'p_std': 39, 'p_atr': 20, 'p_adx': 17, 'rsi_period': 43, 'ema1': 22, 'ema2': 59, 'slip_atr_k': 0.01909467213542048, 'slip_spread_k': 0.17804153091254346, 'spread_hl_frac': 0.01700015407090007, 'bb_std_mult': 2.5026599126837277, 'rsi_os': 54, 'rsi_ob': 94, 'vol_spike': 0.0002705557974214696, 'adx_thresh': 33.43094501944293, 'atr_min_pct': 0.011816642226966793, 'atr_max_pct': 0.02662692880164748, 'tp_mult': 1.307321504864854, 'tsl_mult': 0.9694225922225561, 'strategy': 'mean_reversion', 'time_stop': 169, 'use_sma': True, 'use_atr': False, 'use_adx': False, 'use_ema': False, 'use_spike': False, 'rsi_required': False, 'edge_k': 0.8177900801749728, 'edge_cap': 0.9247061052895051, 'bull_strategy': 'breakout', 'bull_bb_std_mult': 0.8559020065266076, 'bull_rsi_os': 41, 'bull_rsi_ob': 84, 'bull_adx_thresh': 25.94482924255088, 'bull_atr_min_pct': 0.0207027641211968, 'bull_atr_max_pct': 0.07343765720776224, 'bull_tp_mult': 1.155904124211176, 'bull_tsl_mult': 0.7578656515808533, 'bull_time_stop': 175, 'bull_use_sma': True, 'bull_use_ema': True, 'bull_use_atr': True, 'bull_use_adx': True, 'bull_use_spike': True, 'bull_rsi_required': False, 'bear_strategy': 'mean_reversion', 'bear_bb_std_mult': 3.142492557458949, 'bear_rsi_os': 44, 'bear_rsi_ob': 91, 'bear_adx_thresh': 13.675803858358234, 'bear_atr_min_pct': 0.005157218430461758, 'bear_atr_max_pct': 0.04507206391765044, 'bear_tp_mult': 2.7846521526035155, 'bear_tsl_mult': 0.17380190970988443, 'bear_time_stop': 228, 'bear_use_sma': False, 'bear_use_ema': False, 'bear_use_atr': True, 'bear_use_adx': True, 'bear_use_spike': True, 'bear_rsi_required': True, 'sideways_strategy': 'breakout', 'sideways_bb_std_mult': 1.4589539749463813, 'sideways_rsi_os': 45, 'sideways_rsi_ob': 62, 'sideways_adx_thresh': 25.84570096181065, 'sideways_atr_min_pct': 0.007294536989026557, 'sideways_atr_max_pct': 0.07446047698819315, 'sideways_tp_mult': 2.448787027713335, 'sideways_tsl_mult': 0.5454401109516956, 'sideways_time_stop': 162, 'sideways_use_sma': False, 'sideways_use_ema': False, 'sideways_use_atr': False, 'sideways_use_adx': False, 'sideways_use_spike': True, 'sideways_rsi_required': True}.
[I 2025-09-01 08:56:28,551] Trial 552 finished with values: [-1000000000.0, 1000000000.0] and parameters: {'p_sma': 39, 'p_std': 39, 'p_atr': 20, 'p_adx': 15, 'rsi_period': 77, 'ema1': 21, 'ema2': 59, 'slip_atr_k': 0.019089824808696913, 'slip_spread_k': 0.5881767704177929, 'spread_hl_frac': 0.0010836267142546076, 'bb_std_mult': 2.544819309635689, 'rsi_os': 50, 'rsi_ob': 93, 'vol_spike': 0.023651831952108036, 'adx_thresh': 34.370673102071336, 'atr_min_pct': 0.01123261176040835, 'atr_max_pct': 0.09037161533779563, 'tp_mult': 1.3112377133091644, 'tsl_mult': 0.32436856981446294, 'strategy': 'mean_reversion', 'time_stop': 101, 'use_sma': True, 'use_atr': False, 'use_adx': False, 'use_ema': False, 'use_spike': False, 'rsi_required': False, 'edge_k': 0.8602320359244964, 'edge_cap': 0.9258159648340198, 'bull_strategy': 'breakout', 'bull_bb_std_mult': 2.2710835010065664, 'bull_rsi_os': 41, 'bull_rsi_ob': 54, 'bull_adx_thresh': 11.75703029413246, 'bull_atr_min_pct': 0.02057457683335991, 'bull_atr_max_pct': 0.08418376872349437, 'bull_tp_mult': 1.0107373023688355, 'bull_tsl_mult': 0.7451097325399979, 'bull_time_stop': 174, 'bull_use_sma': True, 'bull_use_ema': True, 'bull_use_atr': True, 'bull_use_adx': True, 'bull_use_spike': True, 'bull_rsi_required': False, 'bear_strategy': 'mean_reversion', 'bear_bb_std_mult': 3.3233950645787003, 'bear_rsi_os': 39, 'bear_rsi_ob': 68, 'bear_adx_thresh': 12.69884572036842, 'bear_atr_min_pct': 0.004969743571536557, 'bear_atr_max_pct': 0.03735437280841738, 'bear_tp_mult': 2.837623552856673, 'bear_tsl_mult': 0.1702702337060775, 'bear_time_stop': 215, 'bear_use_sma': False, 'bear_use_ema': False, 'bear_use_atr': True, 'bear_use_adx': True, 'bear_use_spike': True, 'bear_rsi_required': True, 'sideways_strategy': 'breakout', 'sideways_bb_std_mult': 1.2963337236321704, 'sideways_rsi_os': 34, 'sideways_rsi_ob': 62, 'sideways_adx_thresh': 26.614584346441966, 'sideways_atr_min_pct': 0.007861802217335147, 'sideways_atr_max_pct': 0.0540698249690819, 'sideways_tp_mult': 2.517581543395506, 'sideways_tsl_mult': 0.48212331833549643, 'sideways_time_stop': 159, 'sideways_use_sma': False, 'sideways_use_ema': False, 'sideways_use_atr': False, 'sideways_use_adx': False, 'sideways_use_spike': True, 'sideways_rsi_required': True}.
[I 2025-09-01 08:56:29,628] Trial 553 finished with values: [-1000000000.0, 1000000000.0] and parameters: {'p_sma': 52, 'p_std': 35, 'p_atr': 14, 'p_adx': 15, 'rsi_period': 77, 'ema1': 7, 'ema2': 59, 'slip_atr_k': 0.1819747980375698, 'slip_spread_k': 0.14543008878105995, 'spread_hl_frac': 0.018979330576321684, 'bb_std_mult': 2.57812691183336, 'rsi_os': 50, 'rsi_ob': 93, 'vol_spike': 0.022714339263783384, 'adx_thresh': 34.37158304067921, 'atr_min_pct': 0.015276241910210032, 'atr_max_pct': 0.08993628280518493, 'tp_mult': 1.3052803802428925, 'tsl_mult': 0.5252755340552118, 'strategy': 'mean_reversion', 'time_stop': 90, 'use_sma': True, 'use_atr': False, 'use_adx': False, 'use_ema': False, 'use_spike': False, 'rsi_required': False, 'edge_k': 1.8061133749409182, 'edge_cap': 0.31888827559467436, 'bull_strategy': 'breakout', 'bull_bb_std_mult': 0.9829001276870255, 'bull_rsi_os': 11, 'bull_rsi_ob': 54, 'bull_adx_thresh': 25.047968703104594, 'bull_atr_min_pct': 0.021631941216505062, 'bull_atr_max_pct': 0.08465294203281037, 'bull_tp_mult': 1.0479406213887805, 'bull_tsl_mult': 0.435614461282933, 'bull_time_stop': 159, 'bull_use_sma': True, 'bull_use_ema': True, 'bull_use_atr': True, 'bull_use_adx': True, 'bull_use_spike': True, 'bull_rsi_required': False, 'bear_strategy': 'mean_reversion', 'bear_bb_std_mult': 3.3477760731911435, 'bear_rsi_os': 39, 'bear_rsi_ob': 86, 'bear_adx_thresh': 11.790067568687268, 'bear_atr_min_pct': 0.012042990429094888, 'bear_atr_max_pct': 0.03587495225484933, 'bear_tp_mult': 1.5674594356262568, 'bear_tsl_mult': 0.1992976614815121, 'bear_time_stop': 203, 'bear_use_sma': False, 'bear_use_ema': False, 'bear_use_atr': True, 'bear_use_adx': True, 'bear_use_spike': True, 'bear_rsi_required': True, 'sideways_strategy': 'breakout', 'sideways_bb_std_mult': 1.303699450560829, 'sideways_rsi_os': 34, 'sideways_rsi_ob': 53, 'sideways_adx_thresh': 11.852763458576543, 'sideways_atr_min_pct': 0.00800046094836302, 'sideways_atr_max_pct': 0.0511696074157587, 'sideways_tp_mult': 2.5200078025730694, 'sideways_tsl_mult': 0.48385054016089774, 'sideways_time_stop': 156, 'sideways_use_sma': False, 'sideways_use_ema': False, 'sideways_use_atr': False, 'sideways_use_adx': False, 'sideways_use_spike': True, 'sideways_rsi_required': True}.
[I 2025-09-01 08:57:04,414] Trial 550 finished with values: [-1000000000.0, 1000000000.0] and parameters: {'p_sma': 21, 'p_std': 13, 'p_atr': 20, 'p_adx': 17, 'rsi_period': 77, 'ema1': 23, 'ema2': 56, 'slip_atr_k': 0.018804767217324467, 'slip_spread_k': 0.7321928221290983, 'spread_hl_frac': 0.016842469245839695, 'bb_std_mult': 2.5351861945067653, 'rsi_os': 45, 'rsi_ob': 95, 'vol_spike': 0.019898505709544878, 'adx_thresh': 34.869588651265836, 'atr_min_pct': 0.017644802610544172, 'atr_max_pct': 0.021594359264367972, 'tp_mult': 2.3034196457279337, 'tsl_mult': 0.13516222702543337, 'strategy': 'mean_reversion', 'time_stop': 104, 'use_sma': True, 'use_atr': False, 'use_adx': False, 'use_ema': False, 'use_spike': False, 'rsi_required': False, 'edge_k': 0.8212558850425654, 'edge_cap': 0.28799512801900207, 'bull_strategy': 'breakout', 'bull_bb_std_mult': 1.051300833833984, 'bull_rsi_os': 41, 'bull_rsi_ob': 83, 'bull_adx_thresh': 24.95726699561335, 'bull_atr_min_pct': 0.02284805658578112, 'bull_atr_max_pct': 0.12041950029360751, 'bull_tp_mult': 1.2316896128817785, 'bull_tsl_mult': 0.10710131443006399, 'bull_time_stop': 174, 'bull_use_sma': True, 'bull_use_ema': True, 'bull_use_atr': True, 'bull_use_adx': True, 'bull_use_spike': True, 'bull_rsi_required': False, 'bear_strategy': 'mean_reversion', 'bear_bb_std_mult': 3.341033518816488, 'bear_rsi_os': 44, 'bear_rsi_ob': 68, 'bear_adx_thresh': 13.399491943687796, 'bear_atr_min_pct': 0.014090333836802917, 'bear_atr_max_pct': 0.12518204122659327, 'bear_tp_mult': 2.7830076118874314, 'bear_tsl_mult': 0.17555560889991245, 'bear_time_stop': 203, 'bear_use_sma': False, 'bear_use_ema': False, 'bear_use_atr': True, 'bear_use_adx': True, 'bear_use_spike': True, 'bear_rsi_required': True, 'sideways_strategy': 'breakout', 'sideways_bb_std_mult': 1.4654396601427382, 'sideways_rsi_os': 37, 'sideways_rsi_ob': 60, 'sideways_adx_thresh': 23.941430244916067, 'sideways_atr_min_pct': 0.007342993420079965, 'sideways_atr_max_pct': 0.05070259713876056, 'sideways_tp_mult': 2.4905739147028934, 'sideways_tsl_mult': 0.5574456516171894, 'sideways_time_stop': 163, 'sideways_use_sma': False, 'sideways_use_ema': False, 'sideways_use_atr': False, 'sideways_use_adx': False, 'sideways_use_spike': True, 'sideways_rsi_required': True}.
[I 2025-09-01 08:57:05,424] Trial 551 finished with values: [-1000000000.0, 1000000000.0] and parameters: {'p_sma': 53, 'p_std': 35, 'p_atr': 20, 'p_adx': 17, 'rsi_period': 41, 'ema1': 7, 'ema2': 56, 'slip_atr_k': 0.019641284124237574, 'slip_spread_k': 0.07861426937935759, 'spread_hl_frac': 0.01912685577423904, 'bb_std_mult': 2.523849327998196, 'rsi_os': 8, 'rsi_ob': 58, 'vol_spike': 0.0006627750023667708, 'adx_thresh': 34.90320894721431, 'atr_min_pct': 0.0013749446748310863, 'atr_max_pct': 0.09250598769226374, 'tp_mult': 1.3118068811807544, 'tsl_mult': 0.982253135350162, 'strategy': 'mean_reversion', 'time_stop': 101, 'use_sma': True, 'use_atr': False, 'use_adx': False, 'use_ema': False, 'use_spike': False, 'rsi_required': False, 'edge_k': 1.8150752463930968, 'edge_cap': 0.3205343533698531, 'bull_strategy': 'breakout', 'bull_bb_std_mult': 1.0503275982769045, 'bull_rsi_os': 41, 'bull_rsi_ob': 52, 'bull_adx_thresh': 12.063681375962021, 'bull_atr_min_pct': 0.022536687848235232, 'bull_atr_max_pct': 0.08024563891539764, 'bull_tp_mult': 1.0433703447928349, 'bull_tsl_mult': 0.7611336700677017, 'bull_time_stop': 177, 'bull_use_sma': True, 'bull_use_ema': True, 'bull_use_atr': True, 'bull_use_adx': True, 'bull_use_spike': True, 'bull_rsi_required': False, 'bear_strategy': 'mean_reversion', 'bear_bb_std_mult': 3.335810865415883, 'bear_rsi_os': 39, 'bear_rsi_ob': 70, 'bear_adx_thresh': 13.328827314457826, 'bear_atr_min_pct': 0.011686256032181213, 'bear_atr_max_pct': 0.045443066703009356, 'bear_tp_mult': 2.7869388230511123, 'bear_tsl_mult': 0.17896990399196389, 'bear_time_stop': 214, 'bear_use_sma': False, 'bear_use_ema': False, 'bear_use_atr': True, 'bear_use_adx': True, 'bear_use_spike': True, 'bear_rsi_required': True, 'sideways_strategy': 'breakout', 'sideways_bb_std_mult': 1.4741426163783342, 'sideways_rsi_os': 37, 'sideways_rsi_ob': 60, 'sideways_adx_thresh': 12.669262909893813, 'sideways_atr_min_pct': 0.007752846217924805, 'sideways_atr_max_pct': 0.10962124528168649, 'sideways_tp_mult': 2.335786855218518, 'sideways_tsl_mult': 0.35003423308761095, 'sideways_time_stop': 158, 'sideways_use_sma': False, 'sideways_use_ema': False, 'sideways_use_atr': False, 'sideways_use_adx': False, 'sideways_use_spike': True, 'sideways_rsi_required': True}.
[I 2025-09-01 08:57:08,723] Trial 554 finished with values: [-1000000000.0, 1000000000.0] and parameters: {'p_sma': 44, 'p_std': 35, 'p_atr': 20, 'p_adx': 16, 'rsi_period': 33, 'ema1': 6, 'ema2': 57, 'slip_atr_k': 0.008265762075406944, 'slip_spread_k': 0.09980300571970559, 'spread_hl_frac': 0.025632240555910367, 'bb_std_mult': 2.480416876931138, 'rsi_os': 47, 'rsi_ob': 91, 'vol_spike': 0.01827752167373726, 'adx_thresh': 34.92197961437569, 'atr_min_pct': 0.018012386858449372, 'atr_max_pct': 0.04879926129849508, 'tp_mult': 1.2849747114787466, 'tsl_mult': 0.6917213902258432, 'strategy': 'mean_reversion', 'time_stop': 90, 'use_sma': False, 'use_atr': False, 'use_adx': False, 'use_ema': False, 'use_spike': False, 'rsi_required': False, 'edge_k': 0.9469105285319956, 'edge_cap': 0.7934479015817233, 'bull_strategy': 'breakout', 'bull_bb_std_mult': 1.362431640568769, 'bull_rsi_os': 39, 'bull_rsi_ob': 52, 'bull_adx_thresh': 25.270374139022042, 'bull_atr_min_pct': 0.02251490334113629, 'bull_atr_max_pct': 0.13318165286448885, 'bull_tp_mult': 1.048606942705847, 'bull_tsl_mult': 0.09850047118442296, 'bull_time_stop': 164, 'bull_use_sma': True, 'bull_use_ema': True, 'bull_use_atr': True, 'bull_use_adx': True, 'bull_use_spike': True, 'bull_rsi_required': False, 'bear_strategy': 'mean_reversion', 'bear_bb_std_mult': 3.2462334415089367, 'bear_rsi_os': 42, 'bear_rsi_ob': 88, 'bear_adx_thresh': 11.718490874790403, 'bear_atr_min_pct': 0.0183732061576559, 'bear_atr_max_pct': 0.01814768497864821, 'bear_tp_mult': 1.6664797541114562, 'bear_tsl_mult': 0.19829906959112636, 'bear_time_stop': 214, 'bear_use_sma': False, 'bear_use_ema': False, 'bear_use_atr': True, 'bear_use_adx': True, 'bear_use_spike': True, 'bear_rsi_required': True, 'sideways_strategy': 'mean_reversion', 'sideways_bb_std_mult': 2.8893442808364944, 'sideways_rsi_os': 13, 'sideways_rsi_ob': 64, 'sideways_adx_thresh': 12.61589925009427, 'sideways_atr_min_pct': 0.008986056905210926, 'sideways_atr_max_pct': 0.06662354868540266, 'sideways_tp_mult': 2.335933202425601, 'sideways_tsl_mult': 0.42507816696611017, 'sideways_time_stop': 152, 'sideways_use_sma': False, 'sideways_use_ema': False, 'sideways_use_atr': True, 'sideways_use_adx': False, 'sideways_use_spike': True, 'sideways_rsi_required': True}.
[I 2025-09-01 08:57:10,312] Trial 555 finished with values: [-1000000000.0, 1000000000.0] and parameters: {'p_sma': 16, 'p_std': 11, 'p_atr': 20, 'p_adx': 16, 'rsi_period': 40, 'ema1': 23, 'ema2': 58, 'slip_atr_k': 0.24578492192470705, 'slip_spread_k': 0.10263895696732914, 'spread_hl_frac': 0.016604951284589237, 'bb_std_mult': 2.4618206375547502, 'rsi_os': 47, 'rsi_ob': 91, 'vol_spike': 0.009797848659493498, 'adx_thresh': 22.243112328542253, 'atr_min_pct': 0.001342821877407899, 'atr_max_pct': 0.02187110080959405, 'tp_mult': 2.9539716885237057, 'tsl_mult': 0.15626226743349084, 'strategy': 'mean_reversion', 'time_stop': 31, 'use_sma': False, 'use_atr': False, 'use_adx': False, 'use_ema': False, 'use_spike': False, 'rsi_required': False, 'edge_k': 0.9694694836285522, 'edge_cap': 0.28784188557962215, 'bull_strategy': 'breakout', 'bull_bb_std_mult': 2.3249505176405423, 'bull_rsi_os': 5, 'bull_rsi_ob': 52, 'bull_adx_thresh': 12.183999869543065, 'bull_atr_min_pct': 0.02146080169806308, 'bull_atr_max_pct': 0.0794518591742529, 'bull_tp_mult': 1.111361377444377, 'bull_tsl_mult': 0.1055455502724928, 'bull_time_stop': 166, 'bull_use_sma': False, 'bull_use_ema': True, 'bull_use_atr': True, 'bull_use_adx': True, 'bull_use_spike': True, 'bull_rsi_required': True, 'bear_strategy': 'mean_reversion', 'bear_bb_std_mult': 3.3009047244877765, 'bear_rsi_os': 42, 'bear_rsi_ob': 88, 'bear_adx_thresh': 10.706965952338937, 'bear_atr_min_pct': 0.018013433431769796, 'bear_atr_max_pct': 0.04900106066854714, 'bear_tp_mult': 1.6541052334732533, 'bear_tsl_mult': 0.1687304279217323, 'bear_time_stop': 60, 'bear_use_sma': False, 'bear_use_ema': False, 'bear_use_atr': True, 'bear_use_adx': True, 'bear_use_spike': True, 'bear_rsi_required': True, 'sideways_strategy': 'mean_reversion', 'sideways_bb_std_mult': 2.4467537064488054, 'sideways_rsi_os': 37, 'sideways_rsi_ob': 58, 'sideways_adx_thresh': 12.645188250902486, 'sideways_atr_min_pct': 0.009032786239356013, 'sideways_atr_max_pct': 0.10984426137827998, 'sideways_tp_mult': 2.4188659881206926, 'sideways_tsl_mult': 0.3440751116913041, 'sideways_time_stop': 141, 'sideways_use_sma': False, 'sideways_use_ema': False, 'sideways_use_atr': True, 'sideways_use_adx': False, 'sideways_use_spike': True, 'sideways_rsi_required': True}.
[I 2025-09-01 08:57:11,135] Trial 558 finished with values: [-1000000000.0, 1000000000.0] and parameters: {'p_sma': 16, 'p_std': 18, 'p_atr': 12, 'p_adx': 26, 'rsi_period': 21, 'ema1': 5, 'ema2': 58, 'slip_atr_k': 0.008273955632115646, 'slip_spread_k': 0.14588350547856346, 'spread_hl_frac': 0.04149835802078536, 'bb_std_mult': 2.461415918588013, 'rsi_os': 51, 'rsi_ob': 94, 'vol_spike': 0.009980636022714718, 'adx_thresh': 33.16047815590637, 'atr_min_pct': 0.013827960461257803, 'atr_max_pct': 0.09802264430465248, 'tp_mult': 1.3500858084246208, 'tsl_mult': 0.15774350049889743, 'strategy': 'mean_reversion', 'time_stop': 32, 'use_sma': False, 'use_atr': True, 'use_adx': False, 'use_ema': False, 'use_spike': False, 'rsi_required': False, 'edge_k': 0.8695793973520103, 'edge_cap': 0.8791670221006174, 'bull_strategy': 'mean_reversion', 'bull_bb_std_mult': 2.172139636400631, 'bull_rsi_os': 15, 'bull_rsi_ob': 55, 'bull_adx_thresh': 9.987028809947276, 'bull_atr_min_pct': 0.020134352442644936, 'bull_atr_max_pct': 0.0756611435395317, 'bull_tp_mult': 1.1029415498949222, 'bull_tsl_mult': 0.2321029337819973, 'bull_time_stop': 186, 'bull_use_sma': False, 'bull_use_ema': True, 'bull_use_atr': True, 'bull_use_adx': True, 'bull_use_spike': True, 'bull_rsi_required': True, 'bear_strategy': 'mean_reversion', 'bear_bb_std_mult': 3.2659416206367524, 'bear_rsi_os': 43, 'bear_rsi_ob': 73, 'bear_adx_thresh': 10.74484949631881, 'bear_atr_min_pct': 0.005800541314870642, 'bear_atr_max_pct': 0.14010237290976496, 'bear_tp_mult': 1.2110515057717977, 'bear_tsl_mult': 0.22185052282893514, 'bear_time_stop': 94, 'bear_use_sma': False, 'bear_use_ema': False, 'bear_use_atr': True, 'bear_use_adx': True, 'bear_use_spike': True, 'bear_rsi_required': True, 'sideways_strategy': 'mean_reversion', 'sideways_bb_std_mult': 3.4327382820442556, 'sideways_rsi_os': 12, 'sideways_rsi_ob': 62, 'sideways_adx_thresh': 10.562777750640803, 'sideways_atr_min_pct': 0.006565496509710626, 'sideways_atr_max_pct': 0.14997082859762279, 'sideways_tp_mult': 2.4260548733464677, 'sideways_tsl_mult': 0.7067025459654763, 'sideways_time_stop': 140, 'sideways_use_sma': False, 'sideways_use_ema': False, 'sideways_use_atr': True, 'sideways_use_adx': False, 'sideways_use_spike': True, 'sideways_rsi_required': True}.
[I 2025-09-01 08:57:49,795] Trial 557 finished with values: [-1000000000.0, 1000000000.0] and parameters: {'p_sma': 44, 'p_std': 36, 'p_atr': 12, 'p_adx': 16, 'rsi_period': 33, 'ema1': 8, 'ema2': 58, 'slip_atr_k': 0.007800218480270932, 'slip_spread_k': 0.10197581349251277, 'spread_hl_frac': 0.04088552012162545, 'bb_std_mult': 2.5885265699560747, 'rsi_os': 46, 'rsi_ob': 91, 'vol_spike': 0.009900466251384948, 'adx_thresh': 32.87440399674923, 'atr_min_pct': 0.02230001168967332, 'atr_max_pct': 0.09779357591680951, 'tp_mult': 1.3939275867482155, 'tsl_mult': 0.42591573857637455, 'strategy': 'mean_reversion', 'time_stop': 32, 'use_sma': False, 'use_atr': True, 'use_adx': False, 'use_ema': False, 'use_spike': False, 'rsi_required': False, 'edge_k': 0.9543469704380354, 'edge_cap': 0.29887747412289656, 'bull_strategy': 'mean_reversion', 'bull_bb_std_mult': 1.6297558941943275, 'bull_rsi_os': 39, 'bull_rsi_ob': 55, 'bull_adx_thresh': 24.120080026493767, 'bull_atr_min_pct': 0.0193839946714407, 'bull_atr_max_pct': 0.0791360609909898, 'bull_tp_mult': 1.0956568303975869, 'bull_tsl_mult': 0.46882991666194296, 'bull_time_stop': 161, 'bull_use_sma': False, 'bull_use_ema': True, 'bull_use_atr': True, 'bull_use_adx': True, 'bull_use_spike': True, 'bull_rsi_required': True, 'bear_strategy': 'mean_reversion', 'bear_bb_std_mult': 3.27497204780221, 'bear_rsi_os': 42, 'bear_rsi_ob': 88, 'bear_adx_thresh': 11.755306385809652, 'bear_atr_min_pct': 0.018528968709009747, 'bear_atr_max_pct': 0.04856731396431294, 'bear_tp_mult': 1.6553421558545822, 'bear_tsl_mult': 0.22704576884984207, 'bear_time_stop': 67, 'bear_use_sma': False, 'bear_use_ema': False, 'bear_use_atr': True, 'bear_use_adx': True, 'bear_use_spike': True, 'bear_rsi_required': True, 'sideways_strategy': 'mean_reversion', 'sideways_bb_std_mult': 1.2045026810615544, 'sideways_rsi_os': 13, 'sideways_rsi_ob': 56, 'sideways_adx_thresh': 31.628034020973445, 'sideways_atr_min_pct': 0.009038367420292542, 'sideways_atr_max_pct': 0.06659269620861845, 'sideways_tp_mult': 2.6465823553583223, 'sideways_tsl_mult': 0.8740923278969814, 'sideways_time_stop': 140, 'sideways_use_sma': False, 'sideways_use_ema': False, 'sideways_use_atr': True, 'sideways_use_adx': False, 'sideways_use_spike': True, 'sideways_rsi_required': True}.
