[I 2025-09-01 07:52:07,002] Trial 187 finished with values: [0.0014439569182809198, 0.0044098844909406035] and parameters: {'p_sma': 29, 'p_std': 56, 'p_atr': 24, 'p_adx': 30, 'rsi_period': 58, 'ema1': 15, 'ema2': 22, 'slip_atr_k': 0.0017383556037245643, 'slip_spread_k': 0.9366139751700385, 'spread_hl_frac': 0.01252061990914242, 'bb_std_mult': 1.961840377430391, 'rsi_os': 19, 'rsi_ob': 92, 'vol_spike': 0.07298970953593883, 'adx_thresh': 27.191531200718998, 'atr_min_pct': 0.004328852986254521, 'atr_max_pct': 0.13347685672197923, 'tp_mult': 1.974931879585056, 'tsl_mult': 0.04409232851864799, 'strategy': 'breakout', 'time_stop': 216, 'use_sma': False, 'use_atr': False, 'use_adx': True, 'use_ema': True, 'use_spike': True, 'rsi_required': True, 'edge_k': 0.14047796290071946, 'edge_cap': 0.23679297333731325, 'bull_strategy': 'breakout', 'bull_bb_std_mult': 3.2733161366814585, 'bull_rsi_os': 47, 'bull_rsi_ob': 47, 'bull_adx_thresh': 6.835930805642958, 'bull_atr_min_pct': 0.003497460691191059, 'bull_atr_max_pct': 0.017755782917702915, 'bull_tp_mult': 1.5506144790691276, 'bull_tsl_mult': 0.6056250170804921, 'bull_time_stop': 74, 'bull_use_sma': True, 'bull_use_ema': False, 'bull_use_atr': False, 'bull_use_adx': False, 'bull_use_spike': False, 'bull_rsi_required': False, 'bear_strategy': 'mean_reversion', 'bear_bb_std_mult': 1.7737007018919095, 'bear_rsi_os': 45, 'bear_rsi_ob': 80, 'bear_adx_thresh': 6.12101269073897, 'bear_atr_min_pct': 0.00439873850281091, 'bear_atr_max_pct': 0.08214080429543057, 'bear_tp_mult': 2.1327704006398993, 'bear_tsl_mult': 0.05476269834419412, 'bear_time_stop': 291, 'bear_use_sma': True, 'bear_use_ema': False, 'bear_use_atr': True, 'bear_use_adx': False, 'bear_use_spike': False, 'bear_rsi_required': False, 'sideways_strategy': 'breakout', 'sideways_bb_std_mult': 0.8869251418965143, 'sideways_rsi_os': 7, 'sideways_rsi_ob': 94, 'sideways_adx_thresh': 11.246775810314947, 'sideways_atr_min_pct': 0.02927371792174766, 'sideways_atr_max_pct': 0.02408286778239049, 'sideways_tp_mult': 1.2877675505138304, 'sideways_tsl_mult': 0.030929780113011646, 'sideways_time_stop': 189, 'sideways_use_sma': True, 'sideways_use_ema': True, 'sideways_use_atr': True, 'sideways_use_adx': True, 'sideways_use_spike': False, 'sideways_rsi_required': False}.
[I 2025-09-01 07:52:07,421] Trial 188 finished with values: [0.004850052414630879, 0.0028715558798728144] and parameters: {'p_sma': 29, 'p_std': 56, 'p_atr': 23, 'p_adx': 30, 'rsi_period': 58, 'ema1': 15, 'ema2': 24, 'slip_atr_k': 0.001080045810846017, 'slip_spread_k': 0.9374695853611166, 'spread_hl_frac': 0.012890600625103176, 'bb_std_mult': 1.9953152065393533, 'rsi_os': 31, 'rsi_ob': 91, 'vol_spike': 0.07304498061064721, 'adx_thresh': 27.15489179992224, 'atr_min_pct': 0.004282942225828528, 'atr_max_pct': 0.13212154062212492, 'tp_mult': 1.9643832951554347, 'tsl_mult': 0.04742980414216417, 'strategy': 'breakout', 'time_stop': 218, 'use_sma': False, 'use_atr': False, 'use_adx': True, 'use_ema': True, 'use_spike': True, 'rsi_required': True, 'edge_k': 0.31535204560450725, 'edge_cap': 0.23598105703826458, 'bull_strategy': 'breakout', 'bull_bb_std_mult': 3.090679748339845, 'bull_rsi_os': 47, 'bull_rsi_ob': 47, 'bull_adx_thresh': 8.212947938738873, 'bull_atr_min_pct': 0.003542480451531691, 'bull_atr_max_pct': 0.016951297564359622, 'bull_tp_mult': 1.5535136264585747, 'bull_tsl_mult': 0.5955589478395094, 'bull_time_stop': 74, 'bull_use_sma': True, 'bull_use_ema': False, 'bull_use_atr': False, 'bull_use_adx': False, 'bull_use_spike': False, 'bull_rsi_required': False, 'bear_strategy': 'mean_reversion', 'bear_bb_std_mult': 1.6865938402249354, 'bear_rsi_os': 45, 'bear_rsi_ob': 80, 'bear_adx_thresh': 5.985132747684586, 'bear_atr_min_pct': 0.004462190395889657, 'bear_atr_max_pct': 0.08040054989993484, 'bear_tp_mult': 2.108782788245854, 'bear_tsl_mult': 0.046461534135658025, 'bear_time_stop': 292, 'bear_use_sma': True, 'bear_use_ema': False, 'bear_use_atr': True, 'bear_use_adx': False, 'bear_use_spike': False, 'bear_rsi_required': False, 'sideways_strategy': 'breakout', 'sideways_bb_std_mult': 0.7515951760871555, 'sideways_rsi_os': 8, 'sideways_rsi_ob': 94, 'sideways_adx_thresh': 11.202082325504897, 'sideways_atr_min_pct': 0.029128200937519333, 'sideways_atr_max_pct': 0.02671373153308921, 'sideways_tp_mult': 1.4114140081290618, 'sideways_tsl_mult': 0.06481644467483072, 'sideways_time_stop': 223, 'sideways_use_sma': True, 'sideways_use_ema': True, 'sideways_use_atr': True, 'sideways_use_adx': True, 'sideways_use_spike': False, 'sideways_rsi_required': False}.
[I 2025-09-01 07:52:45,802] Trial 191 finished with values: [-7.835029595537613e-05, 0.006544950962072273] and parameters: {'p_sma': 29, 'p_std': 56, 'p_atr': 23, 'p_adx': 30, 'rsi_period': 58, 'ema1': 15, 'ema2': 22, 'slip_atr_k': 0.003960903720504134, 'slip_spread_k': 0.9603745064597372, 'spread_hl_frac': 0.01282855564046545, 'bb_std_mult': 1.9646143842041903, 'rsi_os': 31, 'rsi_ob': 91, 'vol_spike': 0.07208609597145717, 'adx_thresh': 27.84189366817636, 'atr_min_pct': 0.004198678138864346, 'atr_max_pct': 0.1335506875990739, 'tp_mult': 1.9653418781171033, 'tsl_mult': 0.06331624607831166, 'strategy': 'breakout', 'time_stop': 238, 'use_sma': False, 'use_atr': False, 'use_adx': True, 'use_ema': True, 'use_spike': True, 'rsi_required': True, 'edge_k': 0.1308236381076082, 'edge_cap': 0.23568344979655295, 'bull_strategy': 'breakout', 'bull_bb_std_mult': 3.068736854946278, 'bull_rsi_os': 47, 'bull_rsi_ob': 47, 'bull_adx_thresh': 7.984948898051238, 'bull_atr_min_pct': 0.005802614447570688, 'bull_atr_max_pct': 0.02004494136826737, 'bull_tp_mult': 1.5479103320683654, 'bull_tsl_mult': 0.5889068354262614, 'bull_time_stop': 63, 'bull_use_sma': True, 'bull_use_ema': False, 'bull_use_atr': False, 'bull_use_adx': False, 'bull_use_spike': False, 'bull_rsi_required': False, 'bear_strategy': 'mean_reversion', 'bear_bb_std_mult': 1.6588975473266352, 'bear_rsi_os': 45, 'bear_rsi_ob': 80, 'bear_adx_thresh': 6.1435677426565185, 'bear_atr_min_pct': 0.004271577181935006, 'bear_atr_max_pct': 0.07970403872257784, 'bear_tp_mult': 2.1841792015527712, 'bear_tsl_mult': 0.058040443317456995, 'bear_time_stop': 290, 'bear_use_sma': True, 'bear_use_ema': False, 'bear_use_atr': True, 'bear_use_adx': False, 'bear_use_spike': False, 'bear_rsi_required': False, 'sideways_strategy': 'breakout', 'sideways_bb_std_mult': 0.8681700540208798, 'sideways_rsi_os': 9, 'sideways_rsi_ob': 95, 'sideways_adx_thresh': 10.711061354123407, 'sideways_atr_min_pct': 0.02431942628124163, 'sideways_atr_max_pct': 0.024118679476636578, 'sideways_tp_mult': 1.4320852339137538, 'sideways_tsl_mult': 0.05228470367189666, 'sideways_time_stop': 239, 'sideways_use_sma': True, 'sideways_use_ema': True, 'sideways_use_atr': True, 'sideways_use_adx': True, 'sideways_use_spike': False, 'sideways_rsi_required': False}.
[I 2025-09-01 07:52:46,297] Trial 193 finished with values: [0.0010257888680116345, 0.003944710262171044] and parameters: {'p_sma': 29, 'p_std': 56, 'p_atr': 23, 'p_adx': 30, 'rsi_period': 57, 'ema1': 15, 'ema2': 23, 'slip_atr_k': 0.004681951456009244, 'slip_spread_k': 0.9424282156682624, 'spread_hl_frac': 0.012898169613994257, 'bb_std_mult': 1.9817607903108896, 'rsi_os': 31, 'rsi_ob': 91, 'vol_spike': 0.07451825684316107, 'adx_thresh': 28.034760578013444, 'atr_min_pct': 0.004257151771680404, 'atr_max_pct': 0.13347137248148033, 'tp_mult': 1.9628752742194928, 'tsl_mult': 0.06536780944369265, 'strategy': 'breakout', 'time_stop': 238, 'use_sma': False, 'use_atr': False, 'use_adx': True, 'use_ema': True, 'use_spike': True, 'rsi_required': True, 'edge_k': 0.14484119949782698, 'edge_cap': 0.24224156866203778, 'bull_strategy': 'breakout', 'bull_bb_std_mult': 3.135505481550296, 'bull_rsi_os': 47, 'bull_rsi_ob': 47, 'bull_adx_thresh': 8.167494850559358, 'bull_atr_min_pct': 0.0034895707135293944, 'bull_atr_max_pct': 0.019399147216775478, 'bull_tp_mult': 1.5540922260136014, 'bull_tsl_mult': 0.5923027219947904, 'bull_time_stop': 75, 'bull_use_sma': True, 'bull_use_ema': False, 'bull_use_atr': False, 'bull_use_adx': False, 'bull_use_spike': False, 'bull_rsi_required': False, 'bear_strategy': 'mean_reversion', 'bear_bb_std_mult': 1.7778907312720844, 'bear_rsi_os': 45, 'bear_rsi_ob': 78, 'bear_adx_thresh': 6.116875049014958, 'bear_atr_min_pct': 0.004621381934693447, 'bear_atr_max_pct': 0.08648422289759798, 'bear_tp_mult': 2.1823000589597426, 'bear_tsl_mult': 0.04519110830114506, 'bear_time_stop': 291, 'bear_use_sma': True, 'bear_use_ema': False, 'bear_use_atr': True, 'bear_use_adx': False, 'bear_use_spike': False, 'bear_rsi_required': False, 'sideways_strategy': 'breakout', 'sideways_bb_std_mult': 0.847696642706344, 'sideways_rsi_os': 10, 'sideways_rsi_ob': 95, 'sideways_adx_thresh': 10.794398197124, 'sideways_atr_min_pct': 0.026742746077305275, 'sideways_atr_max_pct': 0.024179519454857853, 'sideways_tp_mult': 1.5281490821758337, 'sideways_tsl_mult': 0.06268525641044584, 'sideways_time_stop': 220, 'sideways_use_sma': True, 'sideways_use_ema': True, 'sideways_use_atr': True, 'sideways_use_adx': True, 'sideways_use_spike': False, 'sideways_rsi_required': False}.
[I 2025-09-01 07:52:46,307] Trial 194 finished with values: [0.0010925461762263389, 0.004076089235458876] and parameters: {'p_sma': 29, 'p_std': 56, 'p_atr': 23, 'p_adx': 30, 'rsi_period': 57, 'ema1': 15, 'ema2': 21, 'slip_atr_k': 0.005158743489059986, 'slip_spread_k': 0.95959863470178, 'spread_hl_frac': 0.012521969504144418, 'bb_std_mult': 1.9852942682395889, 'rsi_os': 31, 'rsi_ob': 91, 'vol_spike': 0.0731863564462522, 'adx_thresh': 28.298206302486943, 'atr_min_pct': 0.004228186201608105, 'atr_max_pct': 0.13292901421342113, 'tp_mult': 1.9699862603000506, 'tsl_mult': 0.07297209730501716, 'strategy': 'breakout', 'time_stop': 246, 'use_sma': False, 'use_atr': False, 'use_adx': True, 'use_ema': True, 'use_spike': True, 'rsi_required': True, 'edge_k': 0.15508905208676244, 'edge_cap': 0.22940324392435532, 'bull_strategy': 'breakout', 'bull_bb_std_mult': 3.0923540207110083, 'bull_rsi_os': 46, 'bull_rsi_ob': 46, 'bull_adx_thresh': 7.842196065038285, 'bull_atr_min_pct': 0.00354382738132771, 'bull_atr_max_pct': 0.018656011717786077, 'bull_tp_mult': 1.5057651595259318, 'bull_tsl_mult': 0.5903092896969102, 'bull_time_stop': 75, 'bull_use_sma': True, 'bull_use_ema': False, 'bull_use_atr': False, 'bull_use_adx': False, 'bull_use_spike': False, 'bull_rsi_required': False, 'bear_strategy': 'mean_reversion', 'bear_bb_std_mult': 1.6715198275473813, 'bear_rsi_os': 45, 'bear_rsi_ob': 78, 'bear_adx_thresh': 6.09188870354226, 'bear_atr_min_pct': 0.004525639869451956, 'bear_atr_max_pct': 0.08608867554991508, 'bear_tp_mult': 2.1961020511440816, 'bear_tsl_mult': 0.054465734085464776, 'bear_time_stop': 291, 'bear_use_sma': True, 'bear_use_ema': False, 'bear_use_atr': True, 'bear_use_adx': False, 'bear_use_spike': False, 'bear_rsi_required': False, 'sideways_strategy': 'breakout', 'sideways_bb_std_mult': 0.8835018724577131, 'sideways_rsi_os': 5, 'sideways_rsi_ob': 95, 'sideways_adx_thresh': 10.560056675097691, 'sideways_atr_min_pct': 0.02886075015419659, 'sideways_atr_max_pct': 0.023133386602693193, 'sideways_tp_mult': 1.536338138862784, 'sideways_tsl_mult': 0.03091363173796468, 'sideways_time_stop': 218, 'sideways_use_sma': True, 'sideways_use_ema': True, 'sideways_use_atr': True, 'sideways_use_adx': True, 'sideways_use_spike': False, 'sideways_rsi_required': False}.
[I 2025-09-01 07:52:46,571] Trial 192 finished with values: [0.0011197724314222501, 0.004343269227149263] and parameters: {'p_sma': 30, 'p_std': 56, 'p_atr': 23, 'p_adx': 30, 'rsi_period': 57, 'ema1': 15, 'ema2': 21, 'slip_atr_k': 0.004725154310491583, 'slip_spread_k': 0.9561881906096108, 'spread_hl_frac': 0.012812279265455513, 'bb_std_mult': 1.9923862258162137, 'rsi_os': 31, 'rsi_ob': 91, 'vol_spike': 0.0714697732324162, 'adx_thresh': 28.032017959155827, 'atr_min_pct': 0.00421283801914652, 'atr_max_pct': 0.13243888856014877, 'tp_mult': 1.9419031036403624, 'tsl_mult': 0.07263101928585854, 'strategy': 'breakout', 'time_stop': 247, 'use_sma': False, 'use_atr': False, 'use_adx': True, 'use_ema': True, 'use_spike': True, 'rsi_required': True, 'edge_k': 0.14270300746314857, 'edge_cap': 0.23583232410639798, 'bull_strategy': 'breakout', 'bull_bb_std_mult': 3.114664593963452, 'bull_rsi_os': 47, 'bull_rsi_ob': 47, 'bull_adx_thresh': 7.415610245553123, 'bull_atr_min_pct': 0.0035389290235180314, 'bull_atr_max_pct': 0.018742637886843487, 'bull_tp_mult': 1.5546969836148514, 'bull_tsl_mult': 0.5935714252286108, 'bull_time_stop': 74, 'bull_use_sma': True, 'bull_use_ema': False, 'bull_use_atr': False, 'bull_use_adx': False, 'bull_use_spike': False, 'bull_rsi_required': False, 'bear_strategy': 'mean_reversion', 'bear_bb_std_mult': 1.671888306289847, 'bear_rsi_os': 45, 'bear_rsi_ob': 78, 'bear_adx_thresh': 6.273715485322499, 'bear_atr_min_pct': 0.004524594692941959, 'bear_atr_max_pct': 0.07897134284376994, 'bear_tp_mult': 2.1913642565205596, 'bear_tsl_mult': 0.034372797778379635, 'bear_time_stop': 291, 'bear_use_sma': True, 'bear_use_ema': False, 'bear_use_atr': True, 'bear_use_adx': False, 'bear_use_spike': False, 'bear_rsi_required': False, 'sideways_strategy': 'breakout', 'sideways_bb_std_mult': 0.8883595689752607, 'sideways_rsi_os': 9, 'sideways_rsi_ob': 95, 'sideways_adx_thresh': 10.881169562205425, 'sideways_atr_min_pct': 0.02903672507024984, 'sideways_atr_max_pct': 0.02295182457803636, 'sideways_tp_mult': 1.5535868623702442, 'sideways_tsl_mult': 0.06342574955317715, 'sideways_time_stop': 225, 'sideways_use_sma': True, 'sideways_use_ema': True, 'sideways_use_atr': True, 'sideways_use_adx': True, 'sideways_use_spike': False, 'sideways_rsi_required': False}.
[I 2025-09-01 07:53:29,259] Trial 197 finished with values: [-0.0024760614116771107, 0.005667412265095476] and parameters: {'p_sma': 29, 'p_std': 57, 'p_atr': 23, 'p_adx': 30, 'rsi_period': 57, 'ema1': 15, 'ema2': 21, 'slip_atr_k': 0.005190651441677524, 'slip_spread_k': 0.9607173705107809, 'spread_hl_frac': 0.012505861855860967, 'bb_std_mult': 1.999003990917381, 'rsi_os': 31, 'rsi_ob': 92, 'vol_spike': 0.07173374492294125, 'adx_thresh': 27.892549312670432, 'atr_min_pct': 0.004228665941945784, 'atr_max_pct': 0.13156015641154883, 'tp_mult': 2.0363185989409454, 'tsl_mult': 0.0700221617565006, 'strategy': 'breakout', 'time_stop': 245, 'use_sma': False, 'use_atr': False, 'use_adx': True, 'use_ema': True, 'use_spike': True, 'rsi_required': True, 'edge_k': 0.15971705138880604, 'edge_cap': 0.2233855693077902, 'bull_strategy': 'breakout', 'bull_bb_std_mult': 3.087103781189532, 'bull_rsi_os': 47, 'bull_rsi_ob': 46, 'bull_adx_thresh': 8.16558257885536, 'bull_atr_min_pct': 0.002398284730834854, 'bull_atr_max_pct': 0.018035719325493298, 'bull_tp_mult': 1.5484588408980289, 'bull_tsl_mult': 0.5917358609490485, 'bull_time_stop': 72, 'bull_use_sma': True, 'bull_use_ema': False, 'bull_use_atr': False, 'bull_use_adx': False, 'bull_use_spike': False, 'bull_rsi_required': False, 'bear_strategy': 'mean_reversion', 'bear_bb_std_mult': 1.6699997727827296, 'bear_rsi_os': 44, 'bear_rsi_ob': 80, 'bear_adx_thresh': 6.199918672596534, 'bear_atr_min_pct': 0.004491808947783642, 'bear_atr_max_pct': 0.08018219876850269, 'bear_tp_mult': 2.1855214847274014, 'bear_tsl_mult': 0.05019446079064986, 'bear_time_stop': 291, 'bear_use_sma': True, 'bear_use_ema': False, 'bear_use_atr': True, 'bear_use_adx': False, 'bear_use_spike': False, 'bear_rsi_required': False, 'sideways_strategy': 'breakout', 'sideways_bb_std_mult': 0.7446692153903604, 'sideways_rsi_os': 9, 'sideways_rsi_ob': 93, 'sideways_adx_thresh': 10.75916321449302, 'sideways_atr_min_pct': 0.029120294094251972, 'sideways_atr_max_pct': 0.024040602216417323, 'sideways_tp_mult': 1.5218061784436263, 'sideways_tsl_mult': 0.06955101703001704, 'sideways_time_stop': 222, 'sideways_use_sma': True, 'sideways_use_ema': True, 'sideways_use_atr': True, 'sideways_use_adx': True, 'sideways_use_spike': False, 'sideways_rsi_required': False}.
[I 2025-09-01 07:53:30,038] Trial 196 finished with values: [-0.0003255846529094386, 0.005920082727886413] and parameters: {'p_sma': 29, 'p_std': 56, 'p_atr': 23, 'p_adx': 30, 'rsi_period': 61, 'ema1': 15, 'ema2': 21, 'slip_atr_k': 0.004601568060279703, 'slip_spread_k': 0.9551057293559427, 'spread_hl_frac': 0.012893347198633517, 'bb_std_mult': 1.9240129170511922, 'rsi_os': 31, 'rsi_ob': 91, 'vol_spike': 0.0719329963975487, 'adx_thresh': 28.07153348801599, 'atr_min_pct': 0.004157717213104959, 'atr_max_pct': 0.13691603481762143, 'tp_mult': 1.9755616104333686, 'tsl_mult': 0.06708727206446874, 'strategy': 'breakout', 'time_stop': 246, 'use_sma': False, 'use_atr': False, 'use_adx': True, 'use_ema': True, 'use_spike': True, 'rsi_required': True, 'edge_k': 0.14605648393167636, 'edge_cap': 0.2321576547767367, 'bull_strategy': 'breakout', 'bull_bb_std_mult': 3.1359874384843565, 'bull_rsi_os': 47, 'bull_rsi_ob': 46, 'bull_adx_thresh': 7.732388260928866, 'bull_atr_min_pct': 0.003875343036775993, 'bull_atr_max_pct': 0.018438646887854113, 'bull_tp_mult': 1.5557903211288848, 'bull_tsl_mult': 0.589962347270705, 'bull_time_stop': 63, 'bull_use_sma': True, 'bull_use_ema': False, 'bull_use_atr': False, 'bull_use_adx': False, 'bull_use_spike': False, 'bull_rsi_required': False, 'bear_strategy': 'mean_reversion', 'bear_bb_std_mult': 1.767230839491416, 'bear_rsi_os': 45, 'bear_rsi_ob': 78, 'bear_adx_thresh': 6.118916543530389, 'bear_atr_min_pct': 0.004768895360713846, 'bear_atr_max_pct': 0.08178075975012801, 'bear_tp_mult': 2.1877950305508067, 'bear_tsl_mult': 0.04941220686207234, 'bear_time_stop': 291, 'bear_use_sma': True, 'bear_use_ema': False, 'bear_use_atr': True, 'bear_use_adx': False, 'bear_use_spike': False, 'bear_rsi_required': False, 'sideways_strategy': 'breakout', 'sideways_bb_std_mult': 0.8888752493044535, 'sideways_rsi_os': 9, 'sideways_rsi_ob': 95, 'sideways_adx_thresh': 10.928006753736218, 'sideways_atr_min_pct': 0.02871975036060317, 'sideways_atr_max_pct': 0.024289634305004672, 'sideways_tp_mult': 1.5340100670952745, 'sideways_tsl_mult': 0.060951191847797834, 'sideways_time_stop': 217, 'sideways_use_sma': True, 'sideways_use_ema': True, 'sideways_use_atr': True, 'sideways_use_adx': True, 'sideways_use_spike': False, 'sideways_rsi_required': False}.
[I 2025-09-01 07:53:30,461] Trial 198 finished with values: [0.0030795209382246114, 0.004004751876141841] and parameters: {'p_sma': 29, 'p_std': 56, 'p_atr': 23, 'p_adx': 30, 'rsi_period': 56, 'ema1': 15, 'ema2': 21, 'slip_atr_k': 0.005422952973919985, 'slip_spread_k': 0.848371412833058, 'spread_hl_frac': 0.013464044598304263, 'bb_std_mult': 1.9743596021904681, 'rsi_os': 31, 'rsi_ob': 92, 'vol_spike': 0.07297053586298274, 'adx_thresh': 29.275657660277187, 'atr_min_pct': 0.003655224405715878, 'atr_max_pct': 0.1329327853111904, 'tp_mult': 1.9854838657002953, 'tsl_mult': 0.06615114294423761, 'strategy': 'breakout', 'time_stop': 237, 'use_sma': False, 'use_atr': False, 'use_adx': True, 'use_ema': True, 'use_spike': True, 'rsi_required': True, 'edge_k': 0.14687370155503365, 'edge_cap': 0.22884066854929314, 'bull_strategy': 'breakout', 'bull_bb_std_mult': 3.1072992464722113, 'bull_rsi_os': 47, 'bull_rsi_ob': 47, 'bull_adx_thresh': 8.365854960083878, 'bull_atr_min_pct': 0.005550369705402115, 'bull_atr_max_pct': 0.01749708969774777, 'bull_tp_mult': 1.542215540502163, 'bull_tsl_mult': 0.6068337512568259, 'bull_time_stop': 74, 'bull_use_sma': True, 'bull_use_ema': False, 'bull_use_atr': False, 'bull_use_adx': False, 'bull_use_spike': False, 'bull_rsi_required': False, 'bear_strategy': 'mean_reversion', 'bear_bb_std_mult': 1.7572465144727116, 'bear_rsi_os': 45, 'bear_rsi_ob': 78, 'bear_adx_thresh': 6.140305411643312, 'bear_atr_min_pct': 0.004285509526869667, 'bear_atr_max_pct': 0.0790232592440286, 'bear_tp_mult': 2.187576040079412, 'bear_tsl_mult': 0.05036024677296618, 'bear_time_stop': 290, 'bear_use_sma': True, 'bear_use_ema': False, 'bear_use_atr': True, 'bear_use_adx': False, 'bear_use_spike': False, 'bear_rsi_required': False, 'sideways_strategy': 'breakout', 'sideways_bb_std_mult': 0.8934062470455872, 'sideways_rsi_os': 9, 'sideways_rsi_ob': 93, 'sideways_adx_thresh': 11.174790860743586, 'sideways_atr_min_pct': 0.028861105449502582, 'sideways_atr_max_pct': 0.02534162746711576, 'sideways_tp_mult': 1.499921832516226, 'sideways_tsl_mult': 0.05732529223979525, 'sideways_time_stop': 221, 'sideways_use_sma': True, 'sideways_use_ema': True, 'sideways_use_atr': True, 'sideways_use_adx': True, 'sideways_use_spike': False, 'sideways_rsi_required': False}.
