[I 2025-09-01 07:35:20,932] Trial 90 finished with values: [-0.06355774618996934, 0.06348088316923352] and parameters: {'p_sma': 52, 'p_std': 35, 'p_atr': 11, 'p_adx': 11, 'rsi_period': 9, 'ema1': 18, 'ema2': 16, 'slip_atr_k': 0.20173913270309934, 'slip_spread_k': 0.503827807687572, 'spread_hl_frac': 0.007712851142584312, 'bb_std_mult': 1.6278075263554912, 'rsi_os': 50, 'rsi_ob': 52, 'vol_spike': 0.05324560762096418, 'adx_thresh': 21.209638473462707, 'atr_min_pct': 0.017932053395624967, 'atr_max_pct': 0.10502189879176606, 'tp_mult': 1.4041659969036173, 'tsl_mult': 0.6873671033203588, 'strategy': 'breakout', 'time_stop': 134, 'use_sma': False, 'use_atr': False, 'use_adx': True, 'use_ema': False, 'use_spike': False, 'rsi_required': True, 'edge_k': 0.9669672051393126, 'edge_cap': 0.7585660437304679, 'bull_strategy': 'breakout', 'bull_bb_std_mult': 2.570605204106147, 'bull_rsi_os': 29, 'bull_rsi_ob': 54, 'bull_adx_thresh': 10.926899213741157, 'bull_atr_min_pct': 0.0009082484384491238, 'bull_atr_max_pct': 0.05767044414238185, 'bull_tp_mult': 1.6480676765238156, 'bull_tsl_mult': 0.11498095963179174, 'bull_time_stop': 166, 'bull_use_sma': False, 'bull_use_ema': False, 'bull_use_atr': False, 'bull_use_adx': False, 'bull_use_spike': True, 'bull_rsi_required': True, 'bear_strategy': 'breakout', 'bear_bb_std_mult': 1.8871899937726697, 'bear_rsi_os': 35, 'bear_rsi_ob': 65, 'bear_adx_thresh': 5.623661346255099, 'bear_atr_min_pct': 0.020002573211424488, 'bear_atr_max_pct': 0.046255759868356706, 'bear_tp_mult': 1.8777170466460449, 'bear_tsl_mult': 0.8679107284136849, 'bear_time_stop': 153, 'bear_use_sma': False, 'bear_use_ema': True, 'bear_use_atr': True, 'bear_use_adx': True, 'bear_use_spike': False, 'bear_rsi_required': True, 'sideways_strategy': 'breakout', 'sideways_bb_std_mult': 2.213304656201525, 'sideways_rsi_os': 54, 'sideways_rsi_ob': 49, 'sideways_adx_thresh': 26.102702596848236, 'sideways_atr_min_pct': 0.01816144528340393, 'sideways_atr_max_pct': 0.13546907664064956, 'sideways_tp_mult': 1.1342113020414268, 'sideways_tsl_mult': 0.5944501890705771, 'sideways_time_stop': 19, 'sideways_use_sma': True, 'sideways_use_ema': False, 'sideways_use_atr': False, 'sideways_use_adx': True, 'sideways_use_spike': True, 'sideways_rsi_required': False}.
[I 2025-09-01 07:36:01,387] Trial 92 finished with values: [-1000000000.0, 1000000000.0] and parameters: {'p_sma': 51, 'p_std': 35, 'p_atr': 15, 'p_adx': 8, 'rsi_period': 48, 'ema1': 17, 'ema2': 44, 'slip_atr_k': 0.20137913895014856, 'slip_spread_k': 0.046018153087344194, 'spread_hl_frac': 0.035519850436041375, 'bb_std_mult': 2.550342014335813, 'rsi_os': 18, 'rsi_ob': 75, 'vol_spike': 0.055804428145633564, 'adx_thresh': 21.41406977999802, 'atr_min_pct': 0.02051360646653573, 'atr_max_pct': 0.02116512618738072, 'tp_mult': 2.9067177755024343, 'tsl_mult': 0.5317324040272796, 'strategy': 'breakout', 'time_stop': 33, 'use_sma': False, 'use_atr': True, 'use_adx': True, 'use_ema': True, 'use_spike': True, 'rsi_required': False, 'edge_k': 1.1175683099345763, 'edge_cap': 0.3807491628259295, 'bull_strategy': 'mean_reversion', 'bull_bb_std_mult': 1.3454837067813377, 'bull_rsi_os': 30, 'bull_rsi_ob': 47, 'bull_adx_thresh': 16.550590410640808, 'bull_atr_min_pct': 0.0038820602591231024, 'bull_atr_max_pct': 0.05851699292218964, 'bull_tp_mult': 1.6531401467002211, 'bull_tsl_mult': 0.14725137397645752, 'bull_time_stop': 178, 'bull_use_sma': False, 'bull_use_ema': True, 'bull_use_atr': False, 'bull_use_adx': False, 'bull_use_spike': True, 'bull_rsi_required': True, 'bear_strategy': 'breakout', 'bear_bb_std_mult': 1.939448570189086, 'bear_rsi_os': 21, 'bear_rsi_ob': 74, 'bear_adx_thresh': 10.077529369550609, 'bear_atr_min_pct': 0.02782077797806501, 'bear_atr_max_pct': 0.08749142898029433, 'bear_tp_mult': 1.2760363266350643, 'bear_tsl_mult': 0.5011458125990131, 'bear_time_stop': 165, 'bear_use_sma': False, 'bear_use_ema': True, 'bear_use_atr': False, 'bear_use_adx': True, 'bear_use_spike': False, 'bear_rsi_required': False, 'sideways_strategy': 'mean_reversion', 'sideways_bb_std_mult': 2.8115955815330373, 'sideways_rsi_os': 53, 'sideways_rsi_ob': 49, 'sideways_adx_thresh': 10.25121754349384, 'sideways_atr_min_pct': 0.008112034877274125, 'sideways_atr_max_pct': 0.13430826026860782, 'sideways_tp_mult': 2.3932784160974547, 'sideways_tsl_mult': 0.010309765784283498, 'sideways_time_stop': 19, 'sideways_use_sma': False, 'sideways_use_ema': True, 'sideways_use_atr': True, 'sideways_use_adx': False, 'sideways_use_spike': True, 'sideways_rsi_required': True}.
[I 2025-09-01 07:36:01,390] Trial 93 finished with values: [-1000000000.0, 1000000000.0] and parameters: {'p_sma': 32, 'p_std': 35, 'p_atr': 25, 'p_adx': 8, 'rsi_period': 49, 'ema1': 29, 'ema2': 44, 'slip_atr_k': 0.08591437915540082, 'slip_spread_k': 0.7292904471520921, 'spread_hl_frac': 0.030794417741682137, 'bb_std_mult': 0.5183065407651231, 'rsi_os': 30, 'rsi_ob': 52, 'vol_spike': 0.16818229668508597, 'adx_thresh': 22.312791426403415, 'atr_min_pct': 0.025803770766616274, 'atr_max_pct': 0.06310260885691543, 'tp_mult': 2.928219462094554, 'tsl_mult': 0.6702617211057713, 'strategy': 'breakout', 'time_stop': 147, 'use_sma': False, 'use_atr': True, 'use_adx': True, 'use_ema': True, 'use_spike': True, 'rsi_required': False, 'edge_k': 1.2029122774299303, 'edge_cap': 0.6087966734994419, 'bull_strategy': 'mean_reversion', 'bull_bb_std_mult': 1.6341661666019072, 'bull_rsi_os': 24, 'bull_rsi_ob': 54, 'bull_adx_thresh': 19.12687113163217, 'bull_atr_min_pct': 0.016927657236132387, 'bull_atr_max_pct': 0.07591936339375023, 'bull_tp_mult': 1.8779934756724799, 'bull_tsl_mult': 0.14628692817111696, 'bull_time_stop': 256, 'bull_use_sma': False, 'bull_use_ema': True, 'bull_use_atr': False, 'bull_use_adx': False, 'bull_use_spike': True, 'bull_rsi_required': True, 'bear_strategy': 'breakout', 'bear_bb_std_mult': 1.8636773925543584, 'bear_rsi_os': 35, 'bear_rsi_ob': 45, 'bear_adx_thresh': 7.600831046796739, 'bear_atr_min_pct': 0.0074485439256311275, 'bear_atr_max_pct': 0.1472732972235073, 'bear_tp_mult': 2.5230842969614167, 'bear_tsl_mult': 0.3519500644626582, 'bear_time_stop': 206, 'bear_use_sma': False, 'bear_use_ema': True, 'bear_use_atr': False, 'bear_use_adx': True, 'bear_use_spike': False, 'bear_rsi_required': False, 'sideways_strategy': 'mean_reversion', 'sideways_bb_std_mult': 3.1155702363184368, 'sideways_rsi_os': 30, 'sideways_rsi_ob': 57, 'sideways_adx_thresh': 29.662446923420724, 'sideways_atr_min_pct': 0.023490502942049966, 'sideways_atr_max_pct': 0.13455906861676176, 'sideways_tp_mult': 1.0582026790954902, 'sideways_tsl_mult': 0.7100625624804706, 'sideways_time_stop': 20, 'sideways_use_sma': False, 'sideways_use_ema': True, 'sideways_use_atr': True, 'sideways_use_adx': False, 'sideways_use_spike': True, 'sideways_rsi_required': True}.
[I 2025-09-01 07:36:01,641] Trial 91 finished with values: [-1000000000.0, 1000000000.0] and parameters: {'p_sma': 52, 'p_std': 34, 'p_atr': 15, 'p_adx': 21, 'rsi_period': 50, 'ema1': 17, 'ema2': 19, 'slip_atr_k': 0.15974044551910738, 'slip_spread_k': 0.5937516090339927, 'spread_hl_frac': 0.04559551832989692, 'bb_std_mult': 2.542482737035274, 'rsi_os': 17, 'rsi_ob': 74, 'vol_spike': 0.2354297041214077, 'adx_thresh': 33.80274568627258, 'atr_min_pct': 0.016538288581919906, 'atr_max_pct': 0.06229530128328426, 'tp_mult': 1.4137823418067827, 'tsl_mult': 0.6106586356084547, 'strategy': 'breakout', 'time_stop': 181, 'use_sma': False, 'use_atr': True, 'use_adx': True, 'use_ema': True, 'use_spike': True, 'rsi_required': False, 'edge_k': 1.435117351394576, 'edge_cap': 0.14148162313394996, 'bull_strategy': 'mean_reversion', 'bull_bb_std_mult': 1.7776351729985003, 'bull_rsi_os': 30, 'bull_rsi_ob': 46, 'bull_adx_thresh': 16.334559325579235, 'bull_atr_min_pct': 0.00803724212931772, 'bull_atr_max_pct': 0.05795986638249886, 'bull_tp_mult': 2.2930841708460123, 'bull_tsl_mult': 0.10366033515732433, 'bull_time_stop': 159, 'bull_use_sma': False, 'bull_use_ema': True, 'bull_use_atr': False, 'bull_use_adx': False, 'bull_use_spike': True, 'bull_rsi_required': True, 'bear_strategy': 'breakout', 'bear_bb_std_mult': 1.9556973778889588, 'bear_rsi_os': 22, 'bear_rsi_ob': 45, 'bear_adx_thresh': 10.161433338030456, 'bear_atr_min_pct': 0.02909018689100551, 'bear_atr_max_pct': 0.04105107587379388, 'bear_tp_mult': 1.880752317964088, 'bear_tsl_mult': 0.36867788440943516, 'bear_time_stop': 116, 'bear_use_sma': False, 'bear_use_ema': True, 'bear_use_atr': False, 'bear_use_adx': True, 'bear_use_spike': False, 'bear_rsi_required': False, 'sideways_strategy': 'mean_reversion', 'sideways_bb_std_mult': 1.4027216750565439, 'sideways_rsi_os': 54, 'sideways_rsi_ob': 62, 'sideways_adx_thresh': 11.392767129284628, 'sideways_atr_min_pct': 0.018195197041074508, 'sideways_atr_max_pct': 0.13303546819946382, 'sideways_tp_mult': 2.4350346010369126, 'sideways_tsl_mult': 0.7104423002065254, 'sideways_time_stop': 17, 'sideways_use_sma': False, 'sideways_use_ema': True, 'sideways_use_atr': True, 'sideways_use_adx': False, 'sideways_use_spike': True, 'sideways_rsi_required': True}.
[I 2025-09-01 07:36:02,384] Trial 94 finished with values: [-1000000000.0, 1000000000.0] and parameters: {'p_sma': 57, 'p_std': 24, 'p_atr': 16, 'p_adx': 30, 'rsi_period': 25, 'ema1': 29, 'ema2': 14, 'slip_atr_k': 0.15827446059506084, 'slip_spread_k': 0.5959843428087224, 'spread_hl_frac': 0.03029415747042914, 'bb_std_mult': 0.5496481982269976, 'rsi_os': 45, 'rsi_ob': 63, 'vol_spike': 0.16893937021864316, 'adx_thresh': 24.657897087971335, 'atr_min_pct': 0.026079561989313566, 'atr_max_pct': 0.0645895682882707, 'tp_mult': 1.53693205130543, 'tsl_mult': 0.18843731965341687, 'strategy': 'breakout', 'time_stop': 112, 'use_sma': False, 'use_atr': True, 'use_adx': False, 'use_ema': True, 'use_spike': True, 'rsi_required': False, 'edge_k': 1.099398667349423, 'edge_cap': 0.6098793453000599, 'bull_strategy': 'mean_reversion', 'bull_bb_std_mult': 2.871100632035604, 'bull_rsi_os': 26, 'bull_rsi_ob': 47, 'bull_adx_thresh': 19.201146122254308, 'bull_atr_min_pct': 0.0038889747799863445, 'bull_atr_max_pct': 0.052166307496192665, 'bull_tp_mult': 1.8566135111226516, 'bull_tsl_mult': 0.0364853228230495, 'bull_time_stop': 180, 'bull_use_sma': False, 'bull_use_ema': True, 'bull_use_atr': False, 'bull_use_adx': False, 'bull_use_spike': True, 'bull_rsi_required': True, 'bear_strategy': 'mean_reversion', 'bear_bb_std_mult': 2.3673366977038377, 'bear_rsi_os': 39, 'bear_rsi_ob': 74, 'bear_adx_thresh': 10.173219873111005, 'bear_atr_min_pct': 0.029878177260227637, 'bear_atr_max_pct': 0.08658545031078276, 'bear_tp_mult': 1.133329592264996, 'bear_tsl_mult': 0.1346948994223705, 'bear_time_stop': 26, 'bear_use_sma': False, 'bear_use_ema': True, 'bear_use_atr': False, 'bear_use_adx': True, 'bear_use_spike': False, 'bear_rsi_required': False, 'sideways_strategy': 'mean_reversion', 'sideways_bb_std_mult': 2.9452934644393394, 'sideways_rsi_os': 39, 'sideways_rsi_ob': 79, 'sideways_adx_thresh': 29.694017019126505, 'sideways_atr_min_pct': 0.007907179399838683, 'sideways_atr_max_pct': 0.014228538097161805, 'sideways_tp_mult': 1.051188081158876, 'sideways_tsl_mult': 0.46132099869183424, 'sideways_time_stop': 52, 'sideways_use_sma': False, 'sideways_use_ema': True, 'sideways_use_atr': True, 'sideways_use_adx': False, 'sideways_use_spike': True, 'sideways_rsi_required': True}.
[I 2025-09-01 07:36:47,773] Trial 98 finished with values: [-0.018599410377716286, 0.019090081923320578] and parameters: {'p_sma': 43, 'p_std': 31, 'p_atr': 16, 'p_adx': 17, 'rsi_period': 32, 'ema1': 12, 'ema2': 11, 'slip_atr_k': 0.13891803561107008, 'slip_spread_k': 0.26477257729442455, 'spread_hl_frac': 0.03880984221436966, 'bb_std_mult': 0.6721704039983337, 'rsi_os': 15, 'rsi_ob': 78, 'vol_spike': 0.14997710335011133, 'adx_thresh': 20.516211379559323, 'atr_min_pct': 0.029077242822228632, 'atr_max_pct': 0.13004195940864444, 'tp_mult': 2.220911136090355, 'tsl_mult': 0.9990659899117952, 'strategy': 'mean_reversion', 'time_stop': 116, 'use_sma': True, 'use_atr': False, 'use_adx': False, 'use_ema': False, 'use_spike': False, 'rsi_required': False, 'edge_k': 1.658752295367952, 'edge_cap': 0.07743875731087943, 'bull_strategy': 'breakout', 'bull_bb_std_mult': 2.2514720754159248, 'bull_rsi_os': 27, 'bull_rsi_ob': 75, 'bull_adx_thresh': 6.663394950718608, 'bull_atr_min_pct': 0.002917947898122486, 'bull_atr_max_pct': 0.045621943191067556, 'bull_tp_mult': 2.704692923227685, 'bull_tsl_mult': 0.025183625556314482, 'bull_time_stop': 278, 'bull_use_sma': True, 'bull_use_ema': True, 'bull_use_atr': True, 'bull_use_adx': True, 'bull_use_spike': False, 'bull_rsi_required': False, 'bear_strategy': 'mean_reversion', 'bear_bb_std_mult': 2.110047870938899, 'bear_rsi_os': 31, 'bear_rsi_ob': 53, 'bear_adx_thresh': 24.407628606165822, 'bear_atr_min_pct': 0.029171635038363813, 'bear_atr_max_pct': 0.09181196898651593, 'bear_tp_mult': 1.1731190663975422, 'bear_tsl_mult': 0.4474907174597457, 'bear_time_stop': 266, 'bear_use_sma': True, 'bear_use_ema': False, 'bear_use_atr': False, 'bear_use_adx': False, 'bear_use_spike': True, 'bear_rsi_required': False, 'sideways_strategy': 'mean_reversion', 'sideways_bb_std_mult': 1.8269752733762836, 'sideways_rsi_os': 43, 'sideways_rsi_ob': 89, 'sideways_adx_thresh': 30.732044015069622, 'sideways_atr_min_pct': 0.01895206316815537, 'sideways_atr_max_pct': 0.03701612735088505, 'sideways_tp_mult': 2.5068841973879348, 'sideways_tsl_mult': 0.4913152013739033, 'sideways_time_stop': 99, 'sideways_use_sma': False, 'sideways_use_ema': False, 'sideways_use_atr': True, 'sideways_use_adx': False, 'sideways_use_spike': False, 'sideways_rsi_required': True}.
[I 2025-09-01 07:36:48,298] Trial 95 finished with values: [-0.0117109357631765, 0.012322757147386494] and parameters: {'p_sma': 56, 'p_std': 60, 'p_atr': 16, 'p_adx': 17, 'rsi_period': 33, 'ema1': 19, 'ema2': 19, 'slip_atr_k': 0.12531193502069068, 'slip_spread_k': 0.5909100796033939, 'spread_hl_frac': 0.0021097675131536917, 'bb_std_mult': 0.6512448186892694, 'rsi_os': 15, 'rsi_ob': 78, 'vol_spike': 0.15197393748107152, 'adx_thresh': 26.519235125934756, 'atr_min_pct': 0.02927855188075076, 'atr_max_pct': 0.12969543833589056, 'tp_mult': 1.5467766914912373, 'tsl_mult': 0.19024413903645732, 'strategy': 'breakout', 'time_stop': 113, 'use_sma': True, 'use_atr': False, 'use_adx': False, 'use_ema': False, 'use_spike': False, 'rsi_required': False, 'edge_k': 0.4827084249496588, 'edge_cap': 0.5077391884167255, 'bull_strategy': 'breakout', 'bull_bb_std_mult': 1.8068786813115207, 'bull_rsi_os': 27, 'bull_rsi_ob': 51, 'bull_adx_thresh': 23.547863787140102, 'bull_atr_min_pct': 0.0030387897013632783, 'bull_atr_max_pct': 0.016100735031248925, 'bull_tp_mult': 2.2867456739914247, 'bull_tsl_mult': 0.03404859606463956, 'bull_time_stop': 155, 'bull_use_sma': True, 'bull_use_ema': True, 'bull_use_atr': False, 'bull_use_adx': False, 'bull_use_spike': True, 'bull_rsi_required': False, 'bear_strategy': 'mean_reversion', 'bear_bb_std_mult': 2.9492132138636555, 'bear_rsi_os': 39, 'bear_rsi_ob': 70, 'bear_adx_thresh': 24.230296244533154, 'bear_atr_min_pct': 0.029093716241578308, 'bear_atr_max_pct': 0.03953860322060087, 'bear_tp_mult': 1.125749703225138, 'bear_tsl_mult': 0.3686350591519592, 'bear_time_stop': 108, 'bear_use_sma': True, 'bear_use_ema': False, 'bear_use_atr': False, 'bear_use_adx': False, 'bear_use_spike': False, 'bear_rsi_required': False, 'sideways_strategy': 'mean_reversion', 'sideways_bb_std_mult': 1.4313263753297099, 'sideways_rsi_os': 39, 'sideways_rsi_ob': 78, 'sideways_adx_thresh': 28.399984476269065, 'sideways_atr_min_pct': 0.01913125720974844, 'sideways_atr_max_pct': 0.04467932097196109, 'sideways_tp_mult': 1.2348829762460218, 'sideways_tsl_mult': 0.48836578422527827, 'sideways_time_stop': 29, 'sideways_use_sma': False, 'sideways_use_ema': False, 'sideways_use_atr': True, 'sideways_use_adx': False, 'sideways_use_spike': True, 'sideways_rsi_required': True}.
[I 2025-09-01 07:36:48,320] Trial 97 finished with values: [-1000000000.0, 1000000000.0] and parameters: {'p_sma': 55, 'p_std': 24, 'p_atr': 16, 'p_adx': 17, 'rsi_period': 39, 'ema1': 5, 'ema2': 14, 'slip_atr_k': 0.12550917574730086, 'slip_spread_k': 0.43346091526656527, 'spread_hl_frac': 0.03821363565711312, 'bb_std_mult': 0.6521627357817731, 'rsi_os': 15, 'rsi_ob': 63, 'vol_spike': 0.15375237141386003, 'adx_thresh': 24.853965889753436, 'atr_min_pct': 0.02918831099729355, 'atr_max_pct': 0.1300730165453525, 'tp_mult': 1.5259953026360762, 'tsl_mult': 0.3149804934382, 'strategy': 'breakout', 'time_stop': 288, 'use_sma': True, 'use_atr': False, 'use_adx': False, 'use_ema': False, 'use_spike': False, 'rsi_required': False, 'edge_k': 1.6591098169044671, 'edge_cap': 0.5030490335452311, 'bull_strategy': 'breakout', 'bull_bb_std_mult': 2.8548703394616703, 'bull_rsi_os': 35, 'bull_rsi_ob': 50, 'bull_adx_thresh': 23.67750894242381, 'bull_atr_min_pct': 0.015527673381351685, 'bull_atr_max_pct': 0.05234702258723957, 'bull_tp_mult': 2.7309819847327566, 'bull_tsl_mult': 0.02367314083118304, 'bull_time_stop': 155, 'bull_use_sma': True, 'bull_use_ema': True, 'bull_use_atr': False, 'bull_use_adx': False, 'bull_use_spike': True, 'bull_rsi_required': False, 'bear_strategy': 'mean_reversion', 'bear_bb_std_mult': 1.2049487548141053, 'bear_rsi_os': 39, 'bear_rsi_ob': 53, 'bear_adx_thresh': 29.593077630104737, 'bear_atr_min_pct': 0.029977706748133878, 'bear_atr_max_pct': 0.05295620172706446, 'bear_tp_mult': 1.1337449628441527, 'bear_tsl_mult': 0.4514413461120942, 'bear_time_stop': 26, 'bear_use_sma': True, 'bear_use_ema': False, 'bear_use_atr': False, 'bear_use_adx': False, 'bear_use_spike': False, 'bear_rsi_required': False, 'sideways_strategy': 'mean_reversion', 'sideways_bb_std_mult': 1.8503701795972103, 'sideways_rsi_os': 39, 'sideways_rsi_ob': 78, 'sideways_adx_thresh': 30.890763010576322, 'sideways_atr_min_pct': 0.013179096746456906, 'sideways_atr_max_pct': 0.04422402704453548, 'sideways_tp_mult': 2.5461450480036683, 'sideways_tsl_mult': 0.4986321233215559, 'sideways_time_stop': 29, 'sideways_use_sma': False, 'sideways_use_ema': False, 'sideways_use_atr': True, 'sideways_use_adx': False, 'sideways_use_spike': False, 'sideways_rsi_required': True}.
[I 2025-09-01 07:36:48,670] Trial 96 finished with values: [-1000000000.0, 1000000000.0] and parameters: {'p_sma': 56, 'p_std': 60, 'p_atr': 16, 'p_adx': 17, 'rsi_period': 39, 'ema1': 5, 'ema2': 14, 'slip_atr_k': 0.15736331843132156, 'slip_spread_k': 0.2637065185187809, 'spread_hl_frac': 0.021197016897319464, 'bb_std_mult': 0.6616679580889772, 'rsi_os': 13, 'rsi_ob': 63, 'vol_spike': 0.1487719652363874, 'adx_thresh': 26.535473663976344, 'atr_min_pct': 0.01777237418918504, 'atr_max_pct': 0.1318266779818729, 'tp_mult': 1.5234216185341776, 'tsl_mult': 0.19041230883306, 'strategy': 'breakout', 'time_stop': 116, 'use_sma': True, 'use_atr': False, 'use_adx': False, 'use_ema': False, 'use_spike': False, 'rsi_required': False, 'edge_k': 0.4555688587981612, 'edge_cap': 0.5087115247855445, 'bull_strategy': 'breakout', 'bull_bb_std_mult': 3.4967210322978555, 'bull_rsi_os': 27, 'bull_rsi_ob': 64, 'bull_adx_thresh': 23.690507836172806, 'bull_atr_min_pct': 0.01516755351365817, 'bull_atr_max_pct': 0.044202344284939056, 'bull_tp_mult': 2.071138325475722, 'bull_tsl_mult': 0.02549908025817626, 'bull_time_stop': 155, 'bull_use_sma': True, 'bull_use_ema': True, 'bull_use_atr': False, 'bull_use_adx': False, 'bull_use_spike': True, 'bull_rsi_required': False, 'bear_strategy': 'mean_reversion', 'bear_bb_std_mult': 2.964613651657806, 'bear_rsi_os': 40, 'bear_rsi_ob': 70, 'bear_adx_thresh': 24.793936024921283, 'bear_atr_min_pct': 0.02915525535540122, 'bear_atr_max_pct': 0.040853220204254276, 'bear_tp_mult': 1.1354056516138908, 'bear_tsl_mult': 0.4610979460855735, 'bear_time_stop': 29, 'bear_use_sma': True, 'bear_use_ema': False, 'bear_use_atr': False, 'bear_use_adx': False, 'bear_use_spike': False, 'bear_rsi_required': False, 'sideways_strategy': 'mean_reversion', 'sideways_bb_std_mult': 3.491963126870433, 'sideways_rsi_os': 38, 'sideways_rsi_ob': 75, 'sideways_adx_thresh': 14.630208183029936, 'sideways_atr_min_pct': 0.01896918654913949, 'sideways_atr_max_pct': 0.044522825018333045, 'sideways_tp_mult': 1.230528083834903, 'sideways_tsl_mult': 0.4619426835091388, 'sideways_time_stop': 27, 'sideways_use_sma': False, 'sideways_use_ema': False, 'sideways_use_atr': True, 'sideways_use_adx': False, 'sideways_use_spike': True, 'sideways_rsi_required': True}.
