[I 2025-09-01 09:03:01,934] Trial 593 finished with values: [0.009397376968430127, 0.0024911490207488595] and parameters: {'p_sma': 43, 'p_std': 36, 'p_atr': 28, 'p_adx': 8, 'rsi_period': 23, 'ema1': 6, 'ema2': 59, 'slip_atr_k': 0.0054604852532056216, 'slip_spread_k': 0.26146491200390587, 'spread_hl_frac': 0.03159650523600235, 'bb_std_mult': 2.439635866560692, 'rsi_os': 12, 'rsi_ob': 93, 'vol_spike': 0.012868983155819875, 'adx_thresh': 34.9955327800786, 'atr_min_pct': 0.013452692103259951, 'atr_max_pct': 0.016989325621002804, 'tp_mult': 1.341352588492175, 'tsl_mult': 0.6149525419833259, 'strategy': 'mean_reversion', 'time_stop': 34, 'use_sma': False, 'use_atr': False, 'use_adx': False, 'use_ema': False, 'use_spike': False, 'rsi_required': False, 'edge_k': 0.9534760791789755, 'edge_cap': 0.28476332129595444, 'bull_strategy': 'breakout', 'bull_bb_std_mult': 1.5721405558482346, 'bull_rsi_os': 27, 'bull_rsi_ob': 73, 'bull_adx_thresh': 10.360726614592659, 'bull_atr_min_pct': 0.01507190148520253, 'bull_atr_max_pct': 0.07352226326201394, 'bull_tp_mult': 1.1052780570350076, 'bull_tsl_mult': 0.5053812460250419, 'bull_time_stop': 162, 'bull_use_sma': True, 'bull_use_ema': True, 'bull_use_atr': True, 'bull_use_adx': True, 'bull_use_spike': True, 'bull_rsi_required': False, 'bear_strategy': 'mean_reversion', 'bear_bb_std_mult': 1.3104029266357946, 'bear_rsi_os': 43, 'bear_rsi_ob': 87, 'bear_adx_thresh': 15.940494432197482, 'bear_atr_min_pct': 0.005421414138771406, 'bear_atr_max_pct': 0.03921584959851034, 'bear_tp_mult': 2.8608085912707786, 'bear_tsl_mult': 0.625409346095049, 'bear_time_stop': 219, 'bear_use_sma': False, 'bear_use_ema': False, 'bear_use_atr': True, 'bear_use_adx': True, 'bear_use_spike': True, 'bear_rsi_required': True, 'sideways_strategy': 'breakout', 'sideways_bb_std_mult': 1.498294407014857, 'sideways_rsi_os': 19, 'sideways_rsi_ob': 60, 'sideways_adx_thresh': 9.839675549405442, 'sideways_atr_min_pct': 0.007122154267480224, 'sideways_atr_max_pct': 0.09560715781291164, 'sideways_tp_mult': 2.4635331648390233, 'sideways_tsl_mult': 0.6209927874815204, 'sideways_time_stop': 153, 'sideways_use_sma': False, 'sideways_use_ema': False, 'sideways_use_atr': True, 'sideways_use_adx': False, 'sideways_use_spike': True, 'sideways_rsi_required': True}.
[I 2025-09-01 09:03:08,037] Trial 594 finished with values: [-0.002404834641641207, 0.007816532077881124] and parameters: {'p_sma': 48, 'p_std': 19, 'p_atr': 20, 'p_adx': 8, 'rsi_period': 23, 'ema1': 6, 'ema2': 59, 'slip_atr_k': 0.011202443324853805, 'slip_spread_k': 0.26865014828830336, 'spread_hl_frac': 0.017933332492449973, 'bb_std_mult': 3.2827940005165717, 'rsi_os': 5, 'rsi_ob': 93, 'vol_spike': 0.1271771311476892, 'adx_thresh': 21.583870988621328, 'atr_min_pct': 0.026237006616318004, 'atr_max_pct': 0.09219342008685652, 'tp_mult': 2.8132774471685478, 'tsl_mult': 0.16675246689479983, 'strategy': 'mean_reversion', 'time_stop': 36, 'use_sma': True, 'use_atr': False, 'use_adx': False, 'use_ema': False, 'use_spike': False, 'rsi_required': False, 'edge_k': 1.5031228395493192, 'edge_cap': 0.6529096874340558, 'bull_strategy': 'breakout', 'bull_bb_std_mult': 2.517977536773954, 'bull_rsi_os': 27, 'bull_rsi_ob': 55, 'bull_adx_thresh': 30.45585670789201, 'bull_atr_min_pct': 0.02376899396014199, 'bull_atr_max_pct': 0.07358032659033413, 'bull_tp_mult': 2.166231022539196, 'bull_tsl_mult': 0.43099289647659894, 'bull_time_stop': 161, 'bull_use_sma': True, 'bull_use_ema': True, 'bull_use_atr': True, 'bull_use_adx': True, 'bull_use_spike': True, 'bull_rsi_required': False, 'bear_strategy': 'mean_reversion', 'bear_bb_std_mult': 3.20502158611429, 'bear_rsi_os': 41, 'bear_rsi_ob': 85, 'bear_adx_thresh': 13.130484919394958, 'bear_atr_min_pct': 0.004464720649835921, 'bear_atr_max_pct': 0.036225544228972215, 'bear_tp_mult': 2.8767578431174154, 'bear_tsl_mult': 0.6220111264857633, 'bear_time_stop': 100, 'bear_use_sma': False, 'bear_use_ema': False, 'bear_use_atr': True, 'bear_use_adx': True, 'bear_use_spike': True, 'bear_rsi_required': True, 'sideways_strategy': 'breakout', 'sideways_bb_std_mult': 1.2215813313393127, 'sideways_rsi_os': 48, 'sideways_rsi_ob': 60, 'sideways_adx_thresh': 9.930246295026711, 'sideways_atr_min_pct': 0.0062616828977424595, 'sideways_atr_max_pct': 0.09519112592924292, 'sideways_tp_mult': 2.465088968936813, 'sideways_tsl_mult': 0.4464929179632772, 'sideways_time_stop': 248, 'sideways_use_sma': False, 'sideways_use_ema': False, 'sideways_use_atr': False, 'sideways_use_adx': False, 'sideways_use_spike': True, 'sideways_rsi_required': True}.
[I 2025-09-01 09:03:08,305] Trial 596 finished with values: [-1000000000.0, 1000000000.0] and parameters: {'p_sma': 20, 'p_std': 12, 'p_atr': 20, 'p_adx': 8, 'rsi_period': 39, 'ema1': 8, 'ema2': 59, 'slip_atr_k': 0.0831644098044022, 'slip_spread_k': 0.12153793820752712, 'spread_hl_frac': 0.045671378969260046, 'bb_std_mult': 3.2536230443141134, 'rsi_os': 12, 'rsi_ob': 52, 'vol_spike': 0.24241752255393967, 'adx_thresh': 17.144610642207407, 'atr_min_pct': 0.008652927986849574, 'atr_max_pct': 0.08236245022850325, 'tp_mult': 2.910036765033385, 'tsl_mult': 0.6138547058002424, 'strategy': 'mean_reversion', 'time_stop': 34, 'use_sma': True, 'use_atr': False, 'use_adx': False, 'use_ema': False, 'use_spike': False, 'rsi_required': False, 'edge_k': 0.9284394056352329, 'edge_cap': 0.8966799023305501, 'bull_strategy': 'breakout', 'bull_bb_std_mult': 2.31435844759958, 'bull_rsi_os': 40, 'bull_rsi_ob': 94, 'bull_adx_thresh': 10.171245237338185, 'bull_atr_min_pct': 0.029984708519321696, 'bull_atr_max_pct': 0.0845961988972776, 'bull_tp_mult': 1.1170041200633216, 'bull_tsl_mult': 0.499766168428504, 'bull_time_stop': 162, 'bull_use_sma': True, 'bull_use_ema': True, 'bull_use_atr': True, 'bull_use_adx': True, 'bull_use_spike': True, 'bull_rsi_required': False, 'bear_strategy': 'mean_reversion', 'bear_bb_std_mult': 0.8080093212726416, 'bear_rsi_os': 53, 'bear_rsi_ob': 85, 'bear_adx_thresh': 15.598070155400292, 'bear_atr_min_pct': 0.010980339457173138, 'bear_atr_max_pct': 0.1420526042204762, 'bear_tp_mult': 2.7443357638297603, 'bear_tsl_mult': 0.7363079760181588, 'bear_time_stop': 76, 'bear_use_sma': False, 'bear_use_ema': False, 'bear_use_atr': True, 'bear_use_adx': True, 'bear_use_spike': True, 'bear_rsi_required': True, 'sideways_strategy': 'breakout', 'sideways_bb_std_mult': 1.510550617557287, 'sideways_rsi_os': 13, 'sideways_rsi_ob': 61, 'sideways_adx_thresh': 21.952107446203257, 'sideways_atr_min_pct': 0.017816671660695196, 'sideways_atr_max_pct': 0.11752765139520409, 'sideways_tp_mult': 1.9804817449774708, 'sideways_tsl_mult': 0.48039338040225626, 'sideways_time_stop': 160, 'sideways_use_sma': False, 'sideways_use_ema': False, 'sideways_use_atr': False, 'sideways_use_adx': False, 'sideways_use_spike': True, 'sideways_rsi_required': True}.
[I 2025-09-01 09:03:13,055] Trial 597 finished with values: [-1000000000.0, 1000000000.0] and parameters: {'p_sma': 15, 'p_std': 35, 'p_atr': 20, 'p_adx': 16, 'rsi_period': 23, 'ema1': 21, 'ema2': 59, 'slip_atr_k': 0.15265487357362778, 'slip_spread_k': 0.6923087364378558, 'spread_hl_frac': 0.042426002905810584, 'bb_std_mult': 0.6029780511203444, 'rsi_os': 12, 'rsi_ob': 52, 'vol_spike': 0.0061366996305296986, 'adx_thresh': 21.461873539300495, 'atr_min_pct': 0.015338387250085172, 'atr_max_pct': 0.07739247998157478, 'tp_mult': 1.336281290502302, 'tsl_mult': 0.1685659524550529, 'strategy': 'mean_reversion', 'time_stop': 34, 'use_sma': False, 'use_atr': False, 'use_adx': False, 'use_ema': False, 'use_spike': False, 'rsi_required': False, 'edge_k': 1.3023318564025113, 'edge_cap': 0.6627003023181777, 'bull_strategy': 'breakout', 'bull_bb_std_mult': 2.334396808922388, 'bull_rsi_os': 40, 'bull_rsi_ob': 81, 'bull_adx_thresh': 10.98891084300239, 'bull_atr_min_pct': 0.010885212219611274, 'bull_atr_max_pct': 0.08583251789057329, 'bull_tp_mult': 1.0958012533061403, 'bull_tsl_mult': 0.48296320147708094, 'bull_time_stop': 167, 'bull_use_sma': True, 'bull_use_ema': True, 'bull_use_atr': True, 'bull_use_adx': True, 'bull_use_spike': True, 'bull_rsi_required': False, 'bear_strategy': 'mean_reversion', 'bear_bb_std_mult': 3.374785689512125, 'bear_rsi_os': 18, 'bear_rsi_ob': 85, 'bear_adx_thresh': 21.26021042737402, 'bear_atr_min_pct': 0.020594064266587005, 'bear_atr_max_pct': 0.032293631604842346, 'bear_tp_mult': 2.7735153271858195, 'bear_tsl_mult': 0.2680168630541862, 'bear_time_stop': 127, 'bear_use_sma': False, 'bear_use_ema': False, 'bear_use_atr': True, 'bear_use_adx': True, 'bear_use_spike': True, 'bear_rsi_required': True, 'sideways_strategy': 'breakout', 'sideways_bb_std_mult': 1.4946099570183284, 'sideways_rsi_os': 35, 'sideways_rsi_ob': 63, 'sideways_adx_thresh': 10.449578946500772, 'sideways_atr_min_pct': 0.009177955754803362, 'sideways_atr_max_pct': 0.0690641624229548, 'sideways_tp_mult': 2.4479599042790374, 'sideways_tsl_mult': 0.44641052148608656, 'sideways_time_stop': 159, 'sideways_use_sma': False, 'sideways_use_ema': False, 'sideways_use_atr': False, 'sideways_use_adx': False, 'sideways_use_spike': True, 'sideways_rsi_required': True}.
[I 2025-09-01 09:03:32,526] Trial 598 finished with values: [-0.06906084320538408, 0.0695801569772376] and parameters: {'p_sma': 37, 'p_std': 19, 'p_atr': 20, 'p_adx': 16, 'rsi_period': 23, 'ema1': 24, 'ema2': 59, 'slip_atr_k': 0.13456503025380193, 'slip_spread_k': 0.15321544331488385, 'spread_hl_frac': 0.04555020529985128, 'bb_std_mult': 3.2553833151510823, 'rsi_os': 9, 'rsi_ob': 93, 'vol_spike': 0.00568566738428087, 'adx_thresh': 33.44172060216487, 'atr_min_pct': 0.009941959918462341, 'atr_max_pct': 0.0920484228896655, 'tp_mult': 1.3222706450935031, 'tsl_mult': 0.3853965079186962, 'strategy': 'mean_reversion', 'time_stop': 59, 'use_sma': True, 'use_atr': False, 'use_adx': False, 'use_ema': False, 'use_spike': False, 'rsi_required': False, 'edge_k': 0.8856202608435816, 'edge_cap': 0.8078038884613957, 'bull_strategy': 'breakout', 'bull_bb_std_mult': 2.5812431020510043, 'bull_rsi_os': 16, 'bull_rsi_ob': 81, 'bull_adx_thresh': 18.382213527969704, 'bull_atr_min_pct': 5.087012432091441e-05, 'bull_atr_max_pct': 0.08418345572672759, 'bull_tp_mult': 1.8159313153457788, 'bull_tsl_mult': 0.297767503321558, 'bull_time_stop': 167, 'bull_use_sma': True, 'bull_use_ema': True, 'bull_use_atr': True, 'bull_use_adx': True, 'bull_use_spike': True, 'bull_rsi_required': False, 'bear_strategy': 'mean_reversion', 'bear_bb_std_mult': 0.8091997813393317, 'bear_rsi_os': 43, 'bear_rsi_ob': 91, 'bear_adx_thresh': 15.739910322912507, 'bear_atr_min_pct': 0.005564399713413822, 'bear_atr_max_pct': 0.12202387726681602, 'bear_tp_mult': 1.8391287598804198, 'bear_tsl_mult': 0.9516062716725606, 'bear_time_stop': 97, 'bear_use_sma': False, 'bear_use_ema': False, 'bear_use_atr': True, 'bear_use_adx': True, 'bear_use_spike': True, 'bear_rsi_required': True, 'sideways_strategy': 'breakout', 'sideways_bb_std_mult': 1.4850199977463188, 'sideways_rsi_os': 33, 'sideways_rsi_ob': 87, 'sideways_adx_thresh': 10.490591969173801, 'sideways_atr_min_pct': 0.009003449369442258, 'sideways_atr_max_pct': 0.06844363742575775, 'sideways_tp_mult': 2.486442887504194, 'sideways_tsl_mult': 0.443145215707301, 'sideways_time_stop': 258, 'sideways_use_sma': False, 'sideways_use_ema': False, 'sideways_use_atr': False, 'sideways_use_adx': False, 'sideways_use_spike': True, 'sideways_rsi_required': True}.
[I 2025-09-01 09:03:33,378] Trial 599 finished with values: [-1000000000.0, 1000000000.0] and parameters: {'p_sma': 37, 'p_std': 35, 'p_atr': 20, 'p_adx': 16, 'rsi_period': 69, 'ema1': 7, 'ema2': 60, 'slip_atr_k': 0.014073191152889634, 'slip_spread_k': 0.565468026663067, 'spread_hl_frac': 0.024098738979695576, 'bb_std_mult': 0.8391631021818828, 'rsi_os': 46, 'rsi_ob': 91, 'vol_spike': 0.21413650321214764, 'adx_thresh': 6.682164638226332, 'atr_min_pct': 0.00851865872418853, 'atr_max_pct': 0.08787513644220048, 'tp_mult': 1.3326342503857505, 'tsl_mult': 0.16798349823887807, 'strategy': 'mean_reversion', 'time_stop': 41, 'use_sma': False, 'use_atr': False, 'use_adx': False, 'use_ema': False, 'use_spike': False, 'rsi_required': False, 'edge_k': 0.8986754590506897, 'edge_cap': 0.33309902966425203, 'bull_strategy': 'breakout', 'bull_bb_std_mult': 2.3155238621117076, 'bull_rsi_os': 29, 'bull_rsi_ob': 56, 'bull_adx_thresh': 22.452813259402134, 'bull_atr_min_pct': 0.014685786189183389, 'bull_atr_max_pct': 0.0848984533431297, 'bull_tp_mult': 1.0979416377470768, 'bull_tsl_mult': 0.30531547046292884, 'bull_time_stop': 168, 'bull_use_sma': True, 'bull_use_ema': True, 'bull_use_atr': True, 'bull_use_adx': True, 'bull_use_spike': True, 'bull_rsi_required': False, 'bear_strategy': 'mean_reversion', 'bear_bb_std_mult': 0.8018565576708967, 'bear_rsi_os': 53, 'bear_rsi_ob': 88, 'bear_adx_thresh': 10.390806201874847, 'bear_atr_min_pct': 0.027163781981283185, 'bear_atr_max_pct': 0.14439260668767478, 'bear_tp_mult': 2.7771381587720025, 'bear_tsl_mult': 0.9523353554882146, 'bear_time_stop': 217, 'bear_use_sma': False, 'bear_use_ema': False, 'bear_use_atr': True, 'bear_use_adx': True, 'bear_use_spike': True, 'bear_rsi_required': True, 'sideways_strategy': 'breakout', 'sideways_bb_std_mult': 1.3649215844365548, 'sideways_rsi_os': 44, 'sideways_rsi_ob': 63, 'sideways_adx_thresh': 21.295990545768568, 'sideways_atr_min_pct': 0.008999655706373915, 'sideways_atr_max_pct': 0.06752695949404333, 'sideways_tp_mult': 2.4792241357625566, 'sideways_tsl_mult': 0.6953179092204697, 'sideways_time_stop': 160, 'sideways_use_sma': False, 'sideways_use_ema': False, 'sideways_use_atr': True, 'sideways_use_adx': False, 'sideways_use_spike': True, 'sideways_rsi_required': True}.
Starting optimization (600 trials, n_jobs=4) | multi-objective=True
Saved trials CSV -> runs/REAL_SPOT_LONG_US_ret/h14-15-16-17-18-19-20-22_r0.025_s911/trials_metrics.csv
Saved Pareto plot -> runs/REAL_SPOT_LONG_US_ret/h14-15-16-17-18-19-20-22_r0.025_s911/pareto_return_vs_drawdown.png
Top-K under DD cap: [495] (agg='median')
=== Selected trial(s) ===
top_k=1 selected_trial_numbers=[495] primary=495
ret%_train=0.06% dd%_train=-0.11% trades=9
ret%_test=0.10% dd%_test=-0.11% pnl_test=19.72 trades_test=16
Dumped TEST trades -> runs/REAL_SPOT_LONG_US_ret/h14-15-16-17-18-19-20-22_r0.025_s911/test_trades.csv
WFO fold 1: OOS PnL=0.00 trades=0 win_rate=0.00% avg=0.000000 ret%=0.00% maxDD=0.000000 maxDD%=0.00%
WFO fold 2: OOS PnL=5.77 trades=12 win_rate=50.00% avg=0.481111 ret%=0.03% maxDD=-21.210854 maxDD%=-0.11%
WFO fold 3: OOS PnL=13.95 trades=4 win_rate=75.00% avg=3.487314 ret%=0.07% maxDD=-1.821831 maxDD%=-0.01%
WFO fold 4: OOS PnL=0.00 trades=0 win_rate=0.00% avg=0.000000 ret%=0.00% maxDD=0.000000 maxDD%=0.00%
WFO fold 5: OOS PnL=0.00 trades=0 win_rate=0.00% avg=0.000000 ret%=0.00% maxDD=0.000000 maxDD%=0.00%
WFO fold 6: OOS PnL=0.00 trades=0 win_rate=0.00% avg=0.000000 ret%=0.00% maxDD=0.000000 maxDD%=0.00%
WFO summary: meanPnL=3.29 stdPnL=5.21 meanWR=20.83% meanAvg=0.661404 meanRet%=0.02% worstDD=-21.210854 worstDD%=-0.11% folds=6 trades=16
Wrote runs/REAL_SPOT_LONG_US_ret/h14-15-16-17-18-19-20-22_r0.025_s911/strategy_profile.json
=== ECHO SELECTED PARAMS (JSON) ===
{
  "adx_thresh": 34.20310408931557,
  "aggregate_params": "median",
  "atr_max_pct": 0.09195877693701981,
  "atr_min_pct": 0.009109678462030065,
  "bar_priority": "stop_first",
  "bb_std_mult": 2.5578684058767744,
  "bear_adx_thresh": 12.26459476618769,
  "bear_atr_max_pct": 0.04037616775485204,
  "bear_atr_min_pct": 0.005631829460009383,
  "bear_bb_std_mult": 3.3245913526052115,
  "bear_rsi_ob": 88,
  "bear_rsi_os": 43,
  "bear_rsi_required": true,
  "bear_strategy": "mean_reversion",
  "bear_time_stop": 219,
  "bear_tp_mult": 2.7718500950121863,
  "bear_tsl_mult": 0.19985163836237918,
  "bear_use_adx": true,
  "bear_use_atr": true,
  "bear_use_ema": false,
  "bear_use_sma": false,
  "bear_use_spike": true,
  "bull_adx_thresh": 10.713086271008951,
  "bull_atr_max_pct": 0.07726347321237802,
  "bull_atr_min_pct": 0.02049619176110359,
  "bull_bb_std_mult": 2.4226135112935494,
  "bull_rsi_ob": 55,
  "bull_rsi_os": 40,
  "bull_rsi_required": false,
  "bull_strategy": "breakout",
  "bull_time_stop": 177,
  "bull_tp_mult": 1.1396877901188327,
  "bull_tsl_mult": 0.916479534441945,
  "bull_use_adx": true,
  "bull_use_atr": true,
  "bull_use_ema": true,
  "bull_use_sma": true,
  "bull_use_spike": true,
  "cooldown_bars": 30,
  "daily_loss_limit_pct": 0.1,
  "edge_cap": 0.29136166716585604,
  "edge_k": 0.8764509463528523,
  "ema1": 8,
  "ema2": 60,
  "embargo_bars": 150,
  "fee": 0.0005,
  "fill_timing": "next_open",
  "include_hours_set": "{14, 15, 16, 17, 18, 19, 20, 22}",
  "lockout_bars": 100,
  "max_consec_losses": 7,
  "max_notional_pct_equity": 1.0,
  "min_notional": 5.0,
  "ml_thresh": 0.0,
  "objective": "multi",
  "p_adx": 16,
  "p_atr": 20,
  "p_sma": 37,
  "p_std": 36,
  "participation_cap": 1.0,
  "price_step": 0.0001,
  "proba_temp": 1.0,
  "qty_step": 0.0001,
  "regime_adapt": true,
  "regime_band": 0.006,
  "regime_fast": 50,
  "regime_overrides": {
    "bear": {
      "adx": 20.0,
      "allowed_sides": [
        "long",
        "short"
      ],
      "atr_range": [
        0.0015,
        0.06
      ],
      "bb_std_mult": 1.2571599337995167,
      "mode": "breakout",
      "rsi_required": true,
      "time_stop_bars": 122,
      "tp_mult": 1.7149673432024581,
      "tsl_mult": 0.25,
      "use_adx": true,
      "use_atr": true
    },
    "bull": {
      "adx": 18.0,
      "allowed_sides": [
        "long",
        "short"
      ],
      "atr_range": [
        0.0008,
        0.06
      ],
      "bb_std_mult": 2.0169431746748376,
      "mode": "mean_reversion",
      "rsi_required": false,
      "time_stop_bars": 214,
      "tp_mult": 1.9194251920826044,
      "tsl_mult": 0.6891458682949287,
      "use_adx": true,
      "use_atr": true
    },
    "sideways": {
      "adx": 15.0,
      "allowed_sides": [
        "long",
        "short"
      ],
      "atr_range": [
        0.001,
        0.14
      ],
      "bb_std_mult": 1.5828092896467827,
      "mode": "breakout",
      "rsi_required": true,
      "time_stop_bars": 235,
      "tp_mult": 2.341879695778944,
      "tsl_mult": 0.651967765830165,
      "use_adx": true,
      "use_atr": true
    }
  },
  "regime_slow": 200,
  "risk_min_stop_frac": 0.001,
  "risk_per_trade": 0.025,
  "risk_stop_atr_mult": 1.0,
  "round_exits": true,
  "rsi_key": "rsi42",
  "rsi_ob": 93,
  "rsi_os": 47,
  "rsi_period": 42,
  "rsi_required": false,
  "select_top_k": 1,
  "session_end": 24,
  "session_start": 0,
  "sides": "long",
  "sideways_adx_thresh": 11.634132063920509,
  "sideways_atr_max_pct": 0.08066438361446138,
  "sideways_atr_min_pct": 0.007656903017518948,
  "sideways_bb_std_mult": 1.3337187693672259,
  "sideways_rsi_ob": 62,
  "sideways_rsi_os": 11,
  "sideways_rsi_required": true,
  "sideways_strategy": "breakout",
  "sideways_time_stop": 154,
  "sideways_tp_mult": 2.4179457665536277,
  "sideways_tsl_mult": 0.5135629045739561,
  "sideways_use_adx": false,
  "sideways_use_atr": true,
  "sideways_use_ema": false,
  "sideways_use_sma": false,
  "sideways_use_spike": true,
  "slip_atr_k": 0.012337343538067508,
  "slip_spread_k": 0.12999020482128376,
  "slippage": 0.0004,
  "spread_hl_frac": 0.018639515736548776,
  "start_equity": 20000.0,
  "stop_extra_slip": 0.0,
  "strategy": "mean_reversion",
  "time_stop": 42,
  "tp_mult": 1.312331216624955,
  "tsl_mult": 0.17305695446206104,
  "use_adx": false,
  "use_atr": false,
  "use_ema": false,
  "use_ml": false,
  "use_sma": false,
  "use_spike": false,
  "vol_spike": 0.010753765858901691,
  "wfo_folds": 6
}
Wrote runs/REAL_SPOT_LONG_US_ret/h14-15-16-17-18-19-20-22_r0.025_s911/best_params.pkl
