[I 2025-09-01 07:53:30,600] Trial 195 finished with values: [0.004121981723613111, 0.003193667437764618] and parameters: {'p_sma': 29, 'p_std': 57, 'p_atr': 23, 'p_adx': 30, 'rsi_period': 58, 'ema1': 15, 'ema2': 21, 'slip_atr_k': 0.004059981067255865, 'slip_spread_k': 0.9587021919637226, 'spread_hl_frac': 0.012414246432128566, 'bb_std_mult': 1.961813251879506, 'rsi_os': 31, 'rsi_ob': 91, 'vol_spike': 0.07187221039821302, 'adx_thresh': 27.65684206424109, 'atr_min_pct': 0.0040422093299050605, 'atr_max_pct': 0.13619720137822353, 'tp_mult': 2.0234535737740384, 'tsl_mult': 0.06238224524855622, 'strategy': 'breakout', 'time_stop': 239, 'use_sma': False, 'use_atr': False, 'use_adx': True, 'use_ema': True, 'use_spike': True, 'rsi_required': True, 'edge_k': 0.1397723104963532, 'edge_cap': 0.23559325040692278, 'bull_strategy': 'breakout', 'bull_bb_std_mult': 3.115863156079844, 'bull_rsi_os': 47, 'bull_rsi_ob': 46, 'bull_adx_thresh': 8.355567376162925, 'bull_atr_min_pct': 0.003580528279349535, 'bull_atr_max_pct': 0.01936545876629272, 'bull_tp_mult': 1.5482369200995372, 'bull_tsl_mult': 0.608987074034851, 'bull_time_stop': 63, 'bull_use_sma': True, 'bull_use_ema': False, 'bull_use_atr': False, 'bull_use_adx': False, 'bull_use_spike': False, 'bull_rsi_required': False, 'bear_strategy': 'mean_reversion', 'bear_bb_std_mult': 1.7685345299081476, 'bear_rsi_os': 45, 'bear_rsi_ob': 78, 'bear_adx_thresh': 5.963115748677624, 'bear_atr_min_pct': 0.004477041145265582, 'bear_atr_max_pct': 0.07925158272463319, 'bear_tp_mult': 2.191944857696722, 'bear_tsl_mult': 0.05370268540164272, 'bear_time_stop': 290, 'bear_use_sma': True, 'bear_use_ema': False, 'bear_use_atr': True, 'bear_use_adx': False, 'bear_use_spike': False, 'bear_rsi_required': False, 'sideways_strategy': 'breakout', 'sideways_bb_std_mult': 0.8583771956452196, 'sideways_rsi_os': 9, 'sideways_rsi_ob': 95, 'sideways_adx_thresh': 10.995096872125394, 'sideways_atr_min_pct': 0.029196075927454306, 'sideways_atr_max_pct': 0.023492859962896066, 'sideways_tp_mult': 1.4041112473137893, 'sideways_tsl_mult': 0.05426734238751635, 'sideways_time_stop': 222, 'sideways_use_sma': True, 'sideways_use_ema': True, 'sideways_use_atr': True, 'sideways_use_adx': True, 'sideways_use_spike': False, 'sideways_rsi_required': False}.
[I 2025-09-01 07:54:11,471] Trial 200 finished with values: [0.0008351030011297667, 0.003636708130409358] and parameters: {'p_sma': 29, 'p_std': 56, 'p_atr': 23, 'p_adx': 30, 'rsi_period': 57, 'ema1': 15, 'ema2': 21, 'slip_atr_k': 0.005535601560298104, 'slip_spread_k': 0.9507422371663372, 'spread_hl_frac': 0.01254379500250265, 'bb_std_mult': 2.1048136503309522, 'rsi_os': 31, 'rsi_ob': 91, 'vol_spike': 0.07305246560538406, 'adx_thresh': 29.41660455794761, 'atr_min_pct': 0.0042891566689695175, 'atr_max_pct': 0.13321362151491858, 'tp_mult': 2.0172667299097347, 'tsl_mult': 0.07546500230569915, 'strategy': 'breakout', 'time_stop': 245, 'use_sma': False, 'use_atr': False, 'use_adx': True, 'use_ema': True, 'use_spike': True, 'rsi_required': True, 'edge_k': 0.1424371278399115, 'edge_cap': 0.23443184698591615, 'bull_strategy': 'breakout', 'bull_bb_std_mult': 3.0996881803741294, 'bull_rsi_os': 47, 'bull_rsi_ob': 47, 'bull_adx_thresh': 7.792015130129823, 'bull_atr_min_pct': 0.005512061760195958, 'bull_atr_max_pct': 0.02306681343712976, 'bull_tp_mult': 1.5070421314552493, 'bull_tsl_mult': 0.5937382766113072, 'bull_time_stop': 74, 'bull_use_sma': True, 'bull_use_ema': False, 'bull_use_atr': False, 'bull_use_adx': False, 'bull_use_spike': False, 'bull_rsi_required': False, 'bear_strategy': 'mean_reversion', 'bear_bb_std_mult': 1.6650084124704256, 'bear_rsi_os': 45, 'bear_rsi_ob': 80, 'bear_adx_thresh': 5.537498344405411, 'bear_atr_min_pct': 0.004521614593540529, 'bear_atr_max_pct': 0.08044877423249003, 'bear_tp_mult': 2.1902907935133027, 'bear_tsl_mult': 0.04705599051361721, 'bear_time_stop': 289, 'bear_use_sma': True, 'bear_use_ema': False, 'bear_use_atr': True, 'bear_use_adx': False, 'bear_use_spike': False, 'bear_rsi_required': False, 'sideways_strategy': 'breakout', 'sideways_bb_std_mult': 0.8658060103854839, 'sideways_rsi_os': 9, 'sideways_rsi_ob': 93, 'sideways_adx_thresh': 10.885880302283587, 'sideways_atr_min_pct': 0.029053974641202185, 'sideways_atr_max_pct': 0.023905408356558078, 'sideways_tp_mult': 1.524518858093489, 'sideways_tsl_mult': 0.07533254876971572, 'sideways_time_stop': 224, 'sideways_use_sma': True, 'sideways_use_ema': True, 'sideways_use_atr': True, 'sideways_use_adx': True, 'sideways_use_spike': False, 'sideways_rsi_required': False}.
[I 2025-09-01 07:54:11,672] Trial 201 finished with values: [0.003352552662201358, 0.003131403445810772] and parameters: {'p_sma': 29, 'p_std': 56, 'p_atr': 23, 'p_adx': 30, 'rsi_period': 57, 'ema1': 15, 'ema2': 22, 'slip_atr_k': 0.0070798402701966745, 'slip_spread_k': 0.950482295698665, 'spread_hl_frac': 0.012627565705969826, 'bb_std_mult': 2.0097583943495207, 'rsi_os': 31, 'rsi_ob': 91, 'vol_spike': 0.07477145060995886, 'adx_thresh': 29.44990277636965, 'atr_min_pct': 0.0039683799303893725, 'atr_max_pct': 0.13477188744428012, 'tp_mult': 1.9962948008902885, 'tsl_mult': 0.0715892546206082, 'strategy': 'breakout', 'time_stop': 236, 'use_sma': False, 'use_atr': False, 'use_adx': True, 'use_ema': True, 'use_spike': True, 'rsi_required': True, 'edge_k': 0.1500843693803891, 'edge_cap': 0.24138366876763276, 'bull_strategy': 'breakout', 'bull_bb_std_mult': 3.0989007042294925, 'bull_rsi_os': 47, 'bull_rsi_ob': 47, 'bull_adx_thresh': 8.16968018055815, 'bull_atr_min_pct': 0.0055933180315333245, 'bull_atr_max_pct': 0.018268576811063322, 'bull_tp_mult': 1.5507840640408015, 'bull_tsl_mult': 0.6071138384661675, 'bull_time_stop': 75, 'bull_use_sma': True, 'bull_use_ema': False, 'bull_use_atr': False, 'bull_use_adx': False, 'bull_use_spike': False, 'bull_rsi_required': False, 'bear_strategy': 'mean_reversion', 'bear_bb_std_mult': 1.6540525858288406, 'bear_rsi_os': 45, 'bear_rsi_ob': 78, 'bear_adx_thresh': 5.707123376172936, 'bear_atr_min_pct': 0.004462840563956055, 'bear_atr_max_pct': 0.07980969775936483, 'bear_tp_mult': 2.1932676031466474, 'bear_tsl_mult': 0.048951392008421045, 'bear_time_stop': 292, 'bear_use_sma': True, 'bear_use_ema': False, 'bear_use_atr': True, 'bear_use_adx': False, 'bear_use_spike': False, 'bear_rsi_required': False, 'sideways_strategy': 'breakout', 'sideways_bb_std_mult': 0.8932894165792884, 'sideways_rsi_os': 9, 'sideways_rsi_ob': 93, 'sideways_adx_thresh': 10.997309075401446, 'sideways_atr_min_pct': 0.02912023821101611, 'sideways_atr_max_pct': 0.018183445540996046, 'sideways_tp_mult': 1.5194901776283225, 'sideways_tsl_mult': 0.0633193813865337, 'sideways_time_stop': 224, 'sideways_use_sma': True, 'sideways_use_ema': True, 'sideways_use_atr': True, 'sideways_use_adx': True, 'sideways_use_spike': False, 'sideways_rsi_required': False}.
[I 2025-09-01 07:54:12,137] Trial 202 finished with values: [-0.0034539699469838814, 0.007132160454238187] and parameters: {'p_sma': 29, 'p_std': 56, 'p_atr': 23, 'p_adx': 30, 'rsi_period': 62, 'ema1': 15, 'ema2': 21, 'slip_atr_k': 0.004921442959814241, 'slip_spread_k': 0.9468960115522488, 'spread_hl_frac': 0.012537158418618754, 'bb_std_mult': 1.9444940243177589, 'rsi_os': 21, 'rsi_ob': 91, 'vol_spike': 0.07142572292236782, 'adx_thresh': 28.111578588154455, 'atr_min_pct': 0.003939903840017155, 'atr_max_pct': 0.13119527745016474, 'tp_mult': 1.9903363644837233, 'tsl_mult': 0.06868915634175556, 'strategy': 'breakout', 'time_stop': 245, 'use_sma': False, 'use_atr': False, 'use_adx': True, 'use_ema': True, 'use_spike': True, 'rsi_required': True, 'edge_k': 0.14679560771624175, 'edge_cap': 0.2392238507314253, 'bull_strategy': 'breakout', 'bull_bb_std_mult': 3.1111563022368567, 'bull_rsi_os': 47, 'bull_rsi_ob': 47, 'bull_adx_thresh': 8.200750499551583, 'bull_atr_min_pct': 0.005526158806953407, 'bull_atr_max_pct': 0.019360937416871924, 'bull_tp_mult': 1.5466997880769273, 'bull_tsl_mult': 0.6078125929204691, 'bull_time_stop': 73, 'bull_use_sma': True, 'bull_use_ema': False, 'bull_use_atr': False, 'bull_use_adx': False, 'bull_use_spike': False, 'bull_rsi_required': False, 'bear_strategy': 'mean_reversion', 'bear_bb_std_mult': 1.6388853355434805, 'bear_rsi_os': 45, 'bear_rsi_ob': 80, 'bear_adx_thresh': 6.160548823870386, 'bear_atr_min_pct': 0.004222397336926258, 'bear_atr_max_pct': 0.0804256439682429, 'bear_tp_mult': 2.147432104756038, 'bear_tsl_mult': 0.03705030623449225, 'bear_time_stop': 291, 'bear_use_sma': True, 'bear_use_ema': False, 'bear_use_atr': True, 'bear_use_adx': False, 'bear_use_spike': False, 'bear_rsi_required': False, 'sideways_strategy': 'breakout', 'sideways_bb_std_mult': 0.8653637048975173, 'sideways_rsi_os': 9, 'sideways_rsi_ob': 95, 'sideways_adx_thresh': 10.991946259407838, 'sideways_atr_min_pct': 0.02882569259061849, 'sideways_atr_max_pct': 0.024638011869368745, 'sideways_tp_mult': 1.5528615695618155, 'sideways_tsl_mult': 0.06776492122734905, 'sideways_time_stop': 227, 'sideways_use_sma': True, 'sideways_use_ema': True, 'sideways_use_atr': True, 'sideways_use_adx': True, 'sideways_use_spike': False, 'sideways_rsi_required': False}.
[I 2025-09-01 07:54:12,235] Trial 199 finished with values: [0.002590351593225737, 0.003875218799660933] and parameters: {'p_sma': 29, 'p_std': 56, 'p_atr': 23, 'p_adx': 30, 'rsi_period': 61, 'ema1': 15, 'ema2': 22, 'slip_atr_k': 0.006211251448142016, 'slip_spread_k': 0.9580075805381373, 'spread_hl_frac': 0.012945199973586586, 'bb_std_mult': 1.9581178481921506, 'rsi_os': 31, 'rsi_ob': 92, 'vol_spike': 0.07189109588161645, 'adx_thresh': 28.075524813706764, 'atr_min_pct': 0.004253333618055407, 'atr_max_pct': 0.13314826557425014, 'tp_mult': 1.9690271936600579, 'tsl_mult': 0.06168022182296032, 'strategy': 'breakout', 'time_stop': 236, 'use_sma': False, 'use_atr': False, 'use_adx': True, 'use_ema': True, 'use_spike': True, 'rsi_required': True, 'edge_k': 0.15505432518211684, 'edge_cap': 0.23765996817107746, 'bull_strategy': 'breakout', 'bull_bb_std_mult': 3.1245356629765806, 'bull_rsi_os': 47, 'bull_rsi_ob': 47, 'bull_adx_thresh': 8.031170708938076, 'bull_atr_min_pct': 0.005515764849103802, 'bull_atr_max_pct': 0.017306829180616417, 'bull_tp_mult': 1.5411358627497282, 'bull_tsl_mult': 0.6083043883081916, 'bull_time_stop': 75, 'bull_use_sma': True, 'bull_use_ema': False, 'bull_use_atr': False, 'bull_use_adx': False, 'bull_use_spike': False, 'bull_rsi_required': False, 'bear_strategy': 'mean_reversion', 'bear_bb_std_mult': 1.6632034845184587, 'bear_rsi_os': 45, 'bear_rsi_ob': 78, 'bear_adx_thresh': 5.546567844803236, 'bear_atr_min_pct': 0.004471583466141375, 'bear_atr_max_pct': 0.08165714335658249, 'bear_tp_mult': 2.189746409037411, 'bear_tsl_mult': 0.03710856350845018, 'bear_time_stop': 292, 'bear_use_sma': True, 'bear_use_ema': False, 'bear_use_atr': True, 'bear_use_adx': False, 'bear_use_spike': False, 'bear_rsi_required': False, 'sideways_strategy': 'breakout', 'sideways_bb_std_mult': 0.7467718425130622, 'sideways_rsi_os': 9, 'sideways_rsi_ob': 93, 'sideways_adx_thresh': 10.814734950899322, 'sideways_atr_min_pct': 0.029203496185321164, 'sideways_atr_max_pct': 0.023401774289788978, 'sideways_tp_mult': 1.4234058084198065, 'sideways_tsl_mult': 0.04971380184598609, 'sideways_time_stop': 225, 'sideways_use_sma': True, 'sideways_use_ema': True, 'sideways_use_atr': True, 'sideways_use_adx': True, 'sideways_use_spike': False, 'sideways_rsi_required': False}.
[I 2025-09-01 07:54:53,058] Trial 203 finished with values: [-0.0022630747418501684, 0.007498019900662791] and parameters: {'p_sma': 29, 'p_std': 57, 'p_atr': 23, 'p_adx': 30, 'rsi_period': 61, 'ema1': 15, 'ema2': 21, 'slip_atr_k': 0.007452094376207212, 'slip_spread_k': 0.9582413739112438, 'spread_hl_frac': 0.012636068007832152, 'bb_std_mult': 2.011127467133078, 'rsi_os': 31, 'rsi_ob': 92, 'vol_spike': 0.06359533024369468, 'adx_thresh': 29.188166599567303, 'atr_min_pct': 0.003811872670560127, 'atr_max_pct': 0.13346148417617076, 'tp_mult': 1.9833211504511599, 'tsl_mult': 0.06118911391580123, 'strategy': 'breakout', 'time_stop': 237, 'use_sma': False, 'use_atr': False, 'use_adx': True, 'use_ema': True, 'use_spike': True, 'rsi_required': True, 'edge_k': 0.14287662138688856, 'edge_cap': 0.24452502837360315, 'bull_strategy': 'breakout', 'bull_bb_std_mult': 3.1054499729046023, 'bull_rsi_os': 48, 'bull_rsi_ob': 46, 'bull_adx_thresh': 8.119377542370746, 'bull_atr_min_pct': 0.0041967550412160765, 'bull_atr_max_pct': 0.01928313173596316, 'bull_tp_mult': 1.497689352586215, 'bull_tsl_mult': 0.6157032785199279, 'bull_time_stop': 73, 'bull_use_sma': True, 'bull_use_ema': False, 'bull_use_atr': False, 'bull_use_adx': False, 'bull_use_spike': False, 'bull_rsi_required': False, 'bear_strategy': 'mean_reversion', 'bear_bb_std_mult': 1.6599811756777787, 'bear_rsi_os': 45, 'bear_rsi_ob': 78, 'bear_adx_thresh': 6.234368089025526, 'bear_atr_min_pct': 0.004613012679888603, 'bear_atr_max_pct': 0.08247691231839163, 'bear_tp_mult': 2.1728779260129185, 'bear_tsl_mult': 0.03249762341712592, 'bear_time_stop': 293, 'bear_use_sma': True, 'bear_use_ema': False, 'bear_use_atr': True, 'bear_use_adx': False, 'bear_use_spike': False, 'bear_rsi_required': False, 'sideways_strategy': 'breakout', 'sideways_bb_std_mult': 0.908648286954032, 'sideways_rsi_os': 9, 'sideways_rsi_ob': 95, 'sideways_adx_thresh': 9.929461283354952, 'sideways_atr_min_pct': 0.028971231299195137, 'sideways_atr_max_pct': 0.022761566619440857, 'sideways_tp_mult': 1.4079005792976953, 'sideways_tsl_mult': 0.05374133935746536, 'sideways_time_stop': 216, 'sideways_use_sma': True, 'sideways_use_ema': True, 'sideways_use_atr': True, 'sideways_use_adx': True, 'sideways_use_spike': False, 'sideways_rsi_required': False}.
[I 2025-09-01 07:54:53,085] Trial 204 finished with values: [0.002508745425856329, 0.00434399070250952] and parameters: {'p_sma': 29, 'p_std': 57, 'p_atr': 23, 'p_adx': 30, 'rsi_period': 61, 'ema1': 15, 'ema2': 21, 'slip_atr_k': 0.006618336098077013, 'slip_spread_k': 0.9504381776388438, 'spread_hl_frac': 0.012442835829064861, 'bb_std_mult': 1.9773739285797782, 'rsi_os': 31, 'rsi_ob': 93, 'vol_spike': 0.06519403940765721, 'adx_thresh': 29.401579599996012, 'atr_min_pct': 0.004355111035454738, 'atr_max_pct': 0.1332362228293599, 'tp_mult': 1.8643626224319014, 'tsl_mult': 0.06115623858972742, 'strategy': 'breakout', 'time_stop': 235, 'use_sma': False, 'use_atr': False, 'use_adx': True, 'use_ema': True, 'use_spike': True, 'rsi_required': True, 'edge_k': 0.16793985076018025, 'edge_cap': 0.23804953147987024, 'bull_strategy': 'breakout', 'bull_bb_std_mult': 3.074474308586337, 'bull_rsi_os': 49, 'bull_rsi_ob': 46, 'bull_adx_thresh': 8.266325887085546, 'bull_atr_min_pct': 0.004094780171206057, 'bull_atr_max_pct': 0.01898596493574591, 'bull_tp_mult': 1.4926585504811851, 'bull_tsl_mult': 0.64668321751605, 'bull_time_stop': 73, 'bull_use_sma': True, 'bull_use_ema': False, 'bull_use_atr': False, 'bull_use_adx': False, 'bull_use_spike': False, 'bull_rsi_required': False, 'bear_strategy': 'mean_reversion', 'bear_bb_std_mult': 1.6618828642739354, 'bear_rsi_os': 45, 'bear_rsi_ob': 78, 'bear_adx_thresh': 7.201166359876081, 'bear_atr_min_pct': 0.0044194278493733625, 'bear_atr_max_pct': 0.08082152265489158, 'bear_tp_mult': 2.188071966854834, 'bear_tsl_mult': 0.040474558502074695, 'bear_time_stop': 293, 'bear_use_sma': True, 'bear_use_ema': False, 'bear_use_atr': True, 'bear_use_adx': False, 'bear_use_spike': False, 'bear_rsi_required': False, 'sideways_strategy': 'breakout', 'sideways_bb_std_mult': 0.8729917516891708, 'sideways_rsi_os': 9, 'sideways_rsi_ob': 95, 'sideways_adx_thresh': 9.926118920155753, 'sideways_atr_min_pct': 0.029010837016255824, 'sideways_atr_max_pct': 0.022013632140983383, 'sideways_tp_mult': 1.4074044243569332, 'sideways_tsl_mult': 0.06295277847412223, 'sideways_time_stop': 229, 'sideways_use_sma': True, 'sideways_use_ema': True, 'sideways_use_atr': True, 'sideways_use_adx': True, 'sideways_use_spike': False, 'sideways_rsi_required': False}.
[I 2025-09-01 07:54:53,625] Trial 206 finished with values: [0.006938754489735466, 0.003032350395835746] and parameters: {'p_sma': 27, 'p_std': 56, 'p_atr': 24, 'p_adx': 28, 'rsi_period': 55, 'ema1': 14, 'ema2': 22, 'slip_atr_k': 0.007951334160592828, 'slip_spread_k': 0.8743405863556746, 'spread_hl_frac': 0.009803384361750787, 'bb_std_mult': 2.0932196438647606, 'rsi_os': 33, 'rsi_ob': 94, 'vol_spike': 0.06461569088544976, 'adx_thresh': 29.441665880858277, 'atr_min_pct': 0.003366957157395569, 'atr_max_pct': 0.12569320913479312, 'tp_mult': 1.9637753293806774, 'tsl_mult': 0.04273866595879752, 'strategy': 'breakout', 'time_stop': 238, 'use_sma': False, 'use_atr': False, 'use_adx': True, 'use_ema': True, 'use_spike': True, 'rsi_required': True, 'edge_k': 0.2915164804782906, 'edge_cap': 0.2563276270252404, 'bull_strategy': 'breakout', 'bull_bb_std_mult': 3.2674269699956797, 'bull_rsi_os': 49, 'bull_rsi_ob': 47, 'bull_adx_thresh': 7.560894163957471, 'bull_atr_min_pct': 0.0040376998731165075, 'bull_atr_max_pct': 0.024738340953214075, 'bull_tp_mult': 1.4914245788694516, 'bull_tsl_mult': 0.6505367585139584, 'bull_time_stop': 64, 'bull_use_sma': True, 'bull_use_ema': False, 'bull_use_atr': False, 'bull_use_adx': False, 'bull_use_spike': False, 'bull_rsi_required': False, 'bear_strategy': 'mean_reversion', 'bear_bb_std_mult': 1.7803039056236034, 'bear_rsi_os': 45, 'bear_rsi_ob': 78, 'bear_adx_thresh': 5.453067908980952, 'bear_atr_min_pct': 0.0037099838790432523, 'bear_atr_max_pct': 0.08347327927772255, 'bear_tp_mult': 2.2037805859234685, 'bear_tsl_mult': 0.13859335201490625, 'bear_time_stop': 283, 'bear_use_sma': True, 'bear_use_ema': False, 'bear_use_atr': True, 'bear_use_adx': False, 'bear_use_spike': False, 'bear_rsi_required': False, 'sideways_strategy': 'breakout', 'sideways_bb_std_mult': 0.9131746075357836, 'sideways_rsi_os': 6, 'sideways_rsi_ob': 93, 'sideways_adx_thresh': 9.874426308453138, 'sideways_atr_min_pct': 0.027439086361111496, 'sideways_atr_max_pct': 0.017615367207374395, 'sideways_tp_mult': 1.488092924122333, 'sideways_tsl_mult': 0.0254496748229008, 'sideways_time_stop': 196, 'sideways_use_sma': True, 'sideways_use_ema': True, 'sideways_use_atr': True, 'sideways_use_adx': True, 'sideways_use_spike': False, 'sideways_rsi_required': False}.
[I 2025-09-01 07:54:53,625] Trial 205 finished with values: [-0.0021383396867188376, 0.005095867969192961] and parameters: {'p_sma': 28, 'p_std': 58, 'p_atr': 23, 'p_adx': 29, 'rsi_period': 55, 'ema1': 14, 'ema2': 22, 'slip_atr_k': 0.009286985914161086, 'slip_spread_k': 0.8731141938784687, 'spread_hl_frac': 0.00980878898025193, 'bb_std_mult': 2.1171061265194604, 'rsi_os': 33, 'rsi_ob': 91, 'vol_spike': 0.06485693795630433, 'adx_thresh': 29.252195473945434, 'atr_min_pct': 0.003418305177166376, 'atr_max_pct': 0.13579498056808742, 'tp_mult': 1.9362915593724788, 'tsl_mult': 0.04257640998420231, 'strategy': 'breakout', 'time_stop': 237, 'use_sma': False, 'use_atr': False, 'use_adx': True, 'use_ema': True, 'use_spike': True, 'rsi_required': True, 'edge_k': 0.2940722897097311, 'edge_cap': 0.25340536228039773, 'bull_strategy': 'breakout', 'bull_bb_std_mult': 3.2065163571166004, 'bull_rsi_os': 49, 'bull_rsi_ob': 47, 'bull_adx_thresh': 7.530408486594802, 'bull_atr_min_pct': 0.004177424478741422, 'bull_atr_max_pct': 0.02295598268395328, 'bull_tp_mult': 1.4938139903167698, 'bull_tsl_mult': 0.64910016787204, 'bull_time_stop': 61, 'bull_use_sma': True, 'bull_use_ema': False, 'bull_use_atr': False, 'bull_use_adx': False, 'bull_use_spike': False, 'bull_rsi_required': False, 'bear_strategy': 'mean_reversion', 'bear_bb_std_mult': 1.7868505978473976, 'bear_rsi_os': 45, 'bear_rsi_ob': 78, 'bear_adx_thresh': 5.455113903987411, 'bear_atr_min_pct': 0.003375246084154412, 'bear_atr_max_pct': 0.08556905921015631, 'bear_tp_mult': 2.206929091572098, 'bear_tsl_mult': 0.13770424755151164, 'bear_time_stop': 282, 'bear_use_sma': True, 'bear_use_ema': False, 'bear_use_atr': True, 'bear_use_adx': False, 'bear_use_spike': False, 'bear_rsi_required': False, 'sideways_strategy': 'breakout', 'sideways_bb_std_mult': 0.8955675775789418, 'sideways_rsi_os': 6, 'sideways_rsi_ob': 93, 'sideways_adx_thresh': 9.634901766884402, 'sideways_atr_min_pct': 0.028445787163955356, 'sideways_atr_max_pct': 0.027173635023914306, 'sideways_tp_mult': 1.4124823949999261, 'sideways_tsl_mult': 0.031448273457228476, 'sideways_time_stop': 217, 'sideways_use_sma': True, 'sideways_use_ema': True, 'sideways_use_atr': True, 'sideways_use_adx': True, 'sideways_use_spike': False, 'sideways_rsi_required': False}.
