[I 2025-09-01 07:49:18,797] Trial 172 finished with values: [-1000000000.0, 1000000000.0] and parameters: {'p_sma': 40, 'p_std': 44, 'p_atr': 20, 'p_adx': 16, 'rsi_period': 59, 'ema1': 7, 'ema2': 30, 'slip_atr_k': 0.0012020092582165146, 'slip_spread_k': 0.5583669195948161, 'spread_hl_frac': 0.041790708695321505, 'bb_std_mult': 2.68944972600436, 'rsi_os': 49, 'rsi_ob': 86, 'vol_spike': 0.04078353335662557, 'adx_thresh': 32.4678723754461, 'atr_min_pct': 0.026626503010427807, 'atr_max_pct': 0.11033317181222402, 'tp_mult': 1.5381781276356215, 'tsl_mult': 0.41495488769883093, 'strategy': 'mean_reversion', 'time_stop': 205, 'use_sma': True, 'use_atr': True, 'use_adx': True, 'use_ema': False, 'use_spike': False, 'rsi_required': False, 'edge_k': 1.9576442897177342, 'edge_cap': 0.14940124698611992, 'bull_strategy': 'mean_reversion', 'bull_bb_std_mult': 2.814406846268083, 'bull_rsi_os': 14, 'bull_rsi_ob': 52, 'bull_adx_thresh': 21.190813379000712, 'bull_atr_min_pct': 0.02049311094365281, 'bull_atr_max_pct': 0.06363373502533788, 'bull_tp_mult': 2.5324099170618988, 'bull_tsl_mult': 0.41708522681668386, 'bull_time_stop': 55, 'bull_use_sma': True, 'bull_use_ema': False, 'bull_use_atr': True, 'bull_use_adx': True, 'bull_use_spike': False, 'bull_rsi_required': False, 'bear_strategy': 'mean_reversion', 'bear_bb_std_mult': 2.8744086444536117, 'bear_rsi_os': 41, 'bear_rsi_ob': 68, 'bear_adx_thresh': 25.381576028080286, 'bear_atr_min_pct': 0.008296224943441085, 'bear_atr_max_pct': 0.09403425081991512, 'bear_tp_mult': 2.526116325038328, 'bear_tsl_mult': 0.0671448578738087, 'bear_time_stop': 123, 'bear_use_sma': True, 'bear_use_ema': False, 'bear_use_atr': True, 'bear_use_adx': True, 'bear_use_spike': True, 'bear_rsi_required': False, 'sideways_strategy': 'breakout', 'sideways_bb_std_mult': 1.4869153916436262, 'sideways_rsi_os': 39, 'sideways_rsi_ob': 45, 'sideways_adx_thresh': 13.19641184909808, 'sideways_atr_min_pct': 0.015342581214141345, 'sideways_atr_max_pct': 0.012868205315023213, 'sideways_tp_mult': 1.7791204848959883, 'sideways_tsl_mult': 0.22977742205770352, 'sideways_time_stop': 259, 'sideways_use_sma': False, 'sideways_use_ema': False, 'sideways_use_atr': False, 'sideways_use_adx': True, 'sideways_use_spike': False, 'sideways_rsi_required': False}.
[I 2025-09-01 07:49:20,148] Trial 169 finished with values: [-1000000000.0, 1000000000.0] and parameters: {'p_sma': 10, 'p_std': 39, 'p_atr': 21, 'p_adx': 16, 'rsi_period': 16, 'ema1': 11, 'ema2': 29, 'slip_atr_k': 0.032925335041526796, 'slip_spread_k': 0.8715467745832475, 'spread_hl_frac': 0.014352464262304637, 'bb_std_mult': 2.1447719051350607, 'rsi_os': 49, 'rsi_ob': 54, 'vol_spike': 0.020207514080303378, 'adx_thresh': 32.08536658534354, 'atr_min_pct': 0.023014438341092583, 'atr_max_pct': 0.10873987177531902, 'tp_mult': 1.223749831336692, 'tsl_mult': 0.7857126821169917, 'strategy': 'mean_reversion', 'time_stop': 130, 'use_sma': True, 'use_atr': True, 'use_adx': True, 'use_ema': False, 'use_spike': False, 'rsi_required': False, 'edge_k': 1.9565529052583646, 'edge_cap': 0.7054057313825558, 'bull_strategy': 'mean_reversion', 'bull_bb_std_mult': 2.6528120698844035, 'bull_rsi_os': 11, 'bull_rsi_ob': 52, 'bull_adx_thresh': 32.4389832824326, 'bull_atr_min_pct': 0.003267507402528059, 'bull_atr_max_pct': 0.0524719509622627, 'bull_tp_mult': 1.4066701553510224, 'bull_tsl_mult': 0.5054640636161168, 'bull_time_stop': 60, 'bull_use_sma': True, 'bull_use_ema': True, 'bull_use_atr': True, 'bull_use_adx': True, 'bull_use_spike': False, 'bull_rsi_required': False, 'bear_strategy': 'mean_reversion', 'bear_bb_std_mult': 1.9719485558228274, 'bear_rsi_os': 44, 'bear_rsi_ob': 65, 'bear_adx_thresh': 29.1516293322599, 'bear_atr_min_pct': 0.007740958244855519, 'bear_atr_max_pct': 0.09345901314712732, 'bear_tp_mult': 2.5123584352452744, 'bear_tsl_mult': 0.17390585563676403, 'bear_time_stop': 45, 'bear_use_sma': True, 'bear_use_ema': False, 'bear_use_atr': False, 'bear_use_adx': True, 'bear_use_spike': True, 'bear_rsi_required': False, 'sideways_strategy': 'breakout', 'sideways_bb_std_mult': 1.4591525262645144, 'sideways_rsi_os': 5, 'sideways_rsi_ob': 48, 'sideways_adx_thresh': 15.05704479545238, 'sideways_atr_min_pct': 0.014946750739135732, 'sideways_atr_max_pct': 0.010380083612716126, 'sideways_tp_mult': 1.1412203029737789, 'sideways_tsl_mult': 0.17792642315481597, 'sideways_time_stop': 110, 'sideways_use_sma': False, 'sideways_use_ema': False, 'sideways_use_atr': False, 'sideways_use_adx': True, 'sideways_use_spike': False, 'sideways_rsi_required': False}.
[I 2025-09-01 07:49:20,149] Trial 173 finished with values: [-1000000000.0, 1000000000.0] and parameters: {'p_sma': 36, 'p_std': 45, 'p_atr': 20, 'p_adx': 16, 'rsi_period': 71, 'ema1': 13, 'ema2': 13, 'slip_atr_k': 0.24120787113416414, 'slip_spread_k': 0.555828477506699, 'spread_hl_frac': 0.02374834352961381, 'bb_std_mult': 1.2610231671192937, 'rsi_os': 32, 'rsi_ob': 86, 'vol_spike': 0.037471773785818265, 'adx_thresh': 34.152745725152556, 'atr_min_pct': 0.024317349337370224, 'atr_max_pct': 0.12165329927347057, 'tp_mult': 1.5279093090502753, 'tsl_mult': 0.23719977643644358, 'strategy': 'breakout', 'time_stop': 55, 'use_sma': False, 'use_atr': True, 'use_adx': True, 'use_ema': False, 'use_spike': True, 'rsi_required': True, 'edge_k': 1.9640853993535072, 'edge_cap': 0.21804303458970992, 'bull_strategy': 'mean_reversion', 'bull_bb_std_mult': 2.2470923789187496, 'bull_rsi_os': 11, 'bull_rsi_ob': 50, 'bull_adx_thresh': 19.26890295014614, 'bull_atr_min_pct': 0.014445147104548691, 'bull_atr_max_pct': 0.13025878445862818, 'bull_tp_mult': 2.9292092165976684, 'bull_tsl_mult': 0.42369399896537413, 'bull_time_stop': 30, 'bull_use_sma': True, 'bull_use_ema': False, 'bull_use_atr': False, 'bull_use_adx': False, 'bull_use_spike': False, 'bull_rsi_required': False, 'bear_strategy': 'mean_reversion', 'bear_bb_std_mult': 2.2502893803920463, 'bear_rsi_os': 46, 'bear_rsi_ob': 62, 'bear_adx_thresh': 5.075275519468478, 'bear_atr_min_pct': 0.0079733263111346, 'bear_atr_max_pct': 0.0943216317855492, 'bear_tp_mult': 1.3210675416395163, 'bear_tsl_mult': 0.633345152367536, 'bear_time_stop': 92, 'bear_use_sma': True, 'bear_use_ema': False, 'bear_use_atr': True, 'bear_use_adx': True, 'bear_use_spike': False, 'bear_rsi_required': False, 'sideways_strategy': 'breakout', 'sideways_bb_std_mult': 1.4181084382721338, 'sideways_rsi_os': 39, 'sideways_rsi_ob': 45, 'sideways_adx_thresh': 13.287266175780264, 'sideways_atr_min_pct': 0.015152662837536303, 'sideways_atr_max_pct': 0.06205998259550703, 'sideways_tp_mult': 2.589931983257033, 'sideways_tsl_mult': 0.2736377036840998, 'sideways_time_stop': 109, 'sideways_use_sma': True, 'sideways_use_ema': False, 'sideways_use_atr': False, 'sideways_use_adx': True, 'sideways_use_spike': False, 'sideways_rsi_required': False}.
[I 2025-09-01 07:49:20,668] Trial 177 finished with values: [-1000000000.0, 1000000000.0] and parameters: {'p_sma': 44, 'p_std': 47, 'p_atr': 20, 'p_adx': 15, 'rsi_period': 40, 'ema1': 13, 'ema2': 53, 'slip_atr_k': 0.01519579819688123, 'slip_spread_k': 0.25070215425554104, 'spread_hl_frac': 0.046433562110724455, 'bb_std_mult': 2.627808456134554, 'rsi_os': 45, 'rsi_ob': 83, 'vol_spike': 0.05212796272996237, 'adx_thresh': 33.094248491335634, 'atr_min_pct': 0.027805850050610866, 'atr_max_pct': 0.0266149697233085, 'tp_mult': 1.6819614887851562, 'tsl_mult': 0.6109901872439656, 'strategy': 'breakout', 'time_stop': 120, 'use_sma': False, 'use_atr': False, 'use_adx': True, 'use_ema': True, 'use_spike': False, 'rsi_required': True, 'edge_k': 1.9950065538611188, 'edge_cap': 0.9619051800752347, 'bull_strategy': 'breakout', 'bull_bb_std_mult': 0.569746645376972, 'bull_rsi_os': 45, 'bull_rsi_ob': 68, 'bull_adx_thresh': 9.295372215014408, 'bull_atr_min_pct': 0.022601359026602444, 'bull_atr_max_pct': 0.048589496781765634, 'bull_tp_mult': 1.1856129016779857, 'bull_tsl_mult': 0.3038985391427146, 'bull_time_stop': 103, 'bull_use_sma': True, 'bull_use_ema': True, 'bull_use_atr': False, 'bull_use_adx': False, 'bull_use_spike': False, 'bull_rsi_required': False, 'bear_strategy': 'mean_reversion', 'bear_bb_std_mult': 1.9150724272222004, 'bear_rsi_os': 24, 'bear_rsi_ob': 82, 'bear_adx_thresh': 7.872852028389352, 'bear_atr_min_pct': 0.00987718202916752, 'bear_atr_max_pct': 0.11413768423347312, 'bear_tp_mult': 1.9350976953702694, 'bear_tsl_mult': 0.11338044433601788, 'bear_time_stop': 100, 'bear_use_sma': True, 'bear_use_ema': True, 'bear_use_atr': False, 'bear_use_adx': False, 'bear_use_spike': False, 'bear_rsi_required': True, 'sideways_strategy': 'breakout', 'sideways_bb_std_mult': 1.0327407509411763, 'sideways_rsi_os': 41, 'sideways_rsi_ob': 72, 'sideways_adx_thresh': 14.082636887833548, 'sideways_atr_min_pct': 0.01709232056184336, 'sideways_atr_max_pct': 0.1303163914385215, 'sideways_tp_mult': 1.2207658989554786, 'sideways_tsl_mult': 0.9477535143532965, 'sideways_time_stop': 89, 'sideways_use_sma': True, 'sideways_use_ema': True, 'sideways_use_atr': True, 'sideways_use_adx': True, 'sideways_use_spike': False, 'sideways_rsi_required': False}.
[I 2025-09-01 07:49:58,433] Trial 174 finished with values: [-0.011100321321137252, 0.011141205295534263] and parameters: {'p_sma': 43, 'p_std': 7, 'p_atr': 20, 'p_adx': 15, 'rsi_period': 58, 'ema1': 13, 'ema2': 12, 'slip_atr_k': 0.014534574307971036, 'slip_spread_k': 0.5165228359063125, 'spread_hl_frac': 0.011300122435436467, 'bb_std_mult': 2.7073978780465646, 'rsi_os': 45, 'rsi_ob': 82, 'vol_spike': 0.0560058148835568, 'adx_thresh': 30.193709264181226, 'atr_min_pct': 0.027469058057605026, 'atr_max_pct': 0.06708030166294467, 'tp_mult': 1.213467498878778, 'tsl_mult': 0.4116788823915978, 'strategy': 'breakout', 'time_stop': 202, 'use_sma': False, 'use_atr': False, 'use_adx': True, 'use_ema': False, 'use_spike': False, 'rsi_required': True, 'edge_k': 1.9594064306616035, 'edge_cap': 0.15093805997476875, 'bull_strategy': 'breakout', 'bull_bb_std_mult': 2.2702872689788056, 'bull_rsi_os': 45, 'bull_rsi_ob': 50, 'bull_adx_thresh': 19.267814300427062, 'bull_atr_min_pct': 0.0034591157503678577, 'bull_atr_max_pct': 0.06425617173783893, 'bull_tp_mult': 2.528188335850187, 'bull_tsl_mult': 0.42081618436001716, 'bull_time_stop': 53, 'bull_use_sma': True, 'bull_use_ema': False, 'bull_use_atr': False, 'bull_use_adx': False, 'bull_use_spike': False, 'bull_rsi_required': False, 'bear_strategy': 'mean_reversion', 'bear_bb_std_mult': 1.9111022689723403, 'bear_rsi_os': 46, 'bear_rsi_ob': 68, 'bear_adx_thresh': 9.054068402024985, 'bear_atr_min_pct': 0.008095925091036535, 'bear_atr_max_pct': 0.09378366295250952, 'bear_tp_mult': 2.5217645447298422, 'bear_tsl_mult': 0.1126111233867181, 'bear_time_stop': 212, 'bear_use_sma': True, 'bear_use_ema': False, 'bear_use_atr': True, 'bear_use_adx': False, 'bear_use_spike': False, 'bear_rsi_required': False, 'sideways_strategy': 'breakout', 'sideways_bb_std_mult': 1.0199653190032374, 'sideways_rsi_os': 5, 'sideways_rsi_ob': 45, 'sideways_adx_thresh': 13.883840113426892, 'sideways_atr_min_pct': 0.01558619171992749, 'sideways_atr_max_pct': 0.0632975873181993, 'sideways_tp_mult': 2.5810005227224395, 'sideways_tsl_mult': 0.1788669809415431, 'sideways_time_stop': 264, 'sideways_use_sma': True, 'sideways_use_ema': False, 'sideways_use_atr': True, 'sideways_use_adx': True, 'sideways_use_spike': False, 'sideways_rsi_required': False}.
[I 2025-09-01 07:49:59,076] Trial 178 finished with values: [-0.0030053043848825567, 0.003948814042999728] and parameters: {'p_sma': 45, 'p_std': 41, 'p_atr': 22, 'p_adx': 15, 'rsi_period': 9, 'ema1': 10, 'ema2': 11, 'slip_atr_k': 0.014297567661631629, 'slip_spread_k': 0.5182158846162805, 'spread_hl_frac': 0.03162021299937401, 'bb_std_mult': 1.9827820702479686, 'rsi_os': 45, 'rsi_ob': 59, 'vol_spike': 0.012596132891123246, 'adx_thresh': 30.32499677239261, 'atr_min_pct': 0.01699744096865638, 'atr_max_pct': 0.05860422502580087, 'tp_mult': 2.4316673507298425, 'tsl_mult': 0.46387812121872923, 'strategy': 'breakout', 'time_stop': 80, 'use_sma': False, 'use_atr': False, 'use_adx': True, 'use_ema': False, 'use_spike': True, 'rsi_required': True, 'edge_k': 0.25169135489748806, 'edge_cap': 0.6274215864418069, 'bull_strategy': 'breakout', 'bull_bb_std_mult': 2.513994147805357, 'bull_rsi_os': 14, 'bull_rsi_ob': 85, 'bull_adx_thresh': 22.311257214330837, 'bull_atr_min_pct': 0.0035105502716690387, 'bull_atr_max_pct': 0.061382164028957534, 'bull_tp_mult': 1.5206465572852994, 'bull_tsl_mult': 0.5881940138846835, 'bull_time_stop': 99, 'bull_use_sma': True, 'bull_use_ema': True, 'bull_use_atr': False, 'bull_use_adx': False, 'bull_use_spike': False, 'bull_rsi_required': False, 'bear_strategy': 'mean_reversion', 'bear_bb_std_mult': 2.1999969783638935, 'bear_rsi_os': 49, 'bear_rsi_ob': 60, 'bear_adx_thresh': 8.827127905736988, 'bear_atr_min_pct': 0.008994262744233279, 'bear_atr_max_pct': 0.10346081012459853, 'bear_tp_mult': 1.280741156843355, 'bear_tsl_mult': 0.1476443285790343, 'bear_time_stop': 212, 'bear_use_sma': True, 'bear_use_ema': False, 'bear_use_atr': False, 'bear_use_adx': False, 'bear_use_spike': False, 'bear_rsi_required': False, 'sideways_strategy': 'breakout', 'sideways_bb_std_mult': 1.2159881785651825, 'sideways_rsi_os': 42, 'sideways_rsi_ob': 47, 'sideways_adx_thresh': 10.965536925790872, 'sideways_atr_min_pct': 0.015863806940519316, 'sideways_atr_max_pct': 0.015183912883528338, 'sideways_tp_mult': 1.2631726114348056, 'sideways_tsl_mult': 0.1841262606647885, 'sideways_time_stop': 212, 'sideways_use_sma': True, 'sideways_use_ema': False, 'sideways_use_atr': True, 'sideways_use_adx': True, 'sideways_use_spike': False, 'sideways_rsi_required': False}.
[I 2025-09-01 07:49:59,605] Trial 175 finished with values: [0.0009301311274720891, 0.002232265149721287] and parameters: {'p_sma': 29, 'p_std': 46, 'p_atr': 20, 'p_adx': 15, 'rsi_period': 53, 'ema1': 13, 'ema2': 12, 'slip_atr_k': 0.015514972145483039, 'slip_spread_k': 0.8741210921185182, 'spread_hl_frac': 0.014137409510985775, 'bb_std_mult': 2.6273543799200323, 'rsi_os': 32, 'rsi_ob': 83, 'vol_spike': 0.060369274949234636, 'adx_thresh': 29.973807532172287, 'atr_min_pct': 0.004394656984725678, 'atr_max_pct': 0.1206799326523468, 'tp_mult': 1.677582385401204, 'tsl_mult': 0.0712720015712558, 'strategy': 'breakout', 'time_stop': 248, 'use_sma': False, 'use_atr': False, 'use_adx': True, 'use_ema': True, 'use_spike': True, 'rsi_required': True, 'edge_k': 0.23634612859496207, 'edge_cap': 0.19864089958100006, 'bull_strategy': 'breakout', 'bull_bb_std_mult': 2.8667668102972668, 'bull_rsi_os': 45, 'bull_rsi_ob': 50, 'bull_adx_thresh': 7.606835484309997, 'bull_atr_min_pct': 0.003319771978220413, 'bull_atr_max_pct': 0.06025744400948881, 'bull_tp_mult': 1.535217641460721, 'bull_tsl_mult': 0.5919095721420958, 'bull_time_stop': 63, 'bull_use_sma': True, 'bull_use_ema': True, 'bull_use_atr': False, 'bull_use_adx': False, 'bull_use_spike': False, 'bull_rsi_required': False, 'bear_strategy': 'mean_reversion', 'bear_bb_std_mult': 1.904132276059988, 'bear_rsi_os': 46, 'bear_rsi_ob': 79, 'bear_adx_thresh': 5.000288080204669, 'bear_atr_min_pct': 0.007884241982915303, 'bear_atr_max_pct': 0.09851872531299548, 'bear_tp_mult': 2.1666295775482824, 'bear_tsl_mult': 0.10956223855080321, 'bear_time_stop': 299, 'bear_use_sma': True, 'bear_use_ema': False, 'bear_use_atr': False, 'bear_use_adx': False, 'bear_use_spike': False, 'bear_rsi_required': False, 'sideways_strategy': 'breakout', 'sideways_bb_std_mult': 1.02259694188818, 'sideways_rsi_os': 5, 'sideways_rsi_ob': 93, 'sideways_adx_thresh': 13.898822115725977, 'sideways_atr_min_pct': 0.029019515132910907, 'sideways_atr_max_pct': 0.010015307053735913, 'sideways_tp_mult': 1.2570483992388062, 'sideways_tsl_mult': 0.17857479611140864, 'sideways_time_stop': 90, 'sideways_use_sma': True, 'sideways_use_ema': True, 'sideways_use_atr': True, 'sideways_use_adx': True, 'sideways_use_spike': False, 'sideways_rsi_required': False}.
[I 2025-09-01 07:49:59,850] Trial 176 finished with values: [-0.01753169475708094, 0.017624133823186422] and parameters: {'p_sma': 18, 'p_std': 20, 'p_atr': 20, 'p_adx': 15, 'rsi_period': 53, 'ema1': 13, 'ema2': 12, 'slip_atr_k': 0.014364684221862047, 'slip_spread_k': 0.5124377350814988, 'spread_hl_frac': 0.03476201727524186, 'bb_std_mult': 2.626258982304588, 'rsi_os': 45, 'rsi_ob': 84, 'vol_spike': 0.05687021804571994, 'adx_thresh': 30.297514181062663, 'atr_min_pct': 0.021047406506823033, 'atr_max_pct': 0.05909161605162644, 'tp_mult': 2.436071891624401, 'tsl_mult': 0.5128209277362284, 'strategy': 'breakout', 'time_stop': 121, 'use_sma': False, 'use_atr': False, 'use_adx': True, 'use_ema': True, 'use_spike': False, 'rsi_required': True, 'edge_k': 1.997529581952468, 'edge_cap': 0.9740969241458068, 'bull_strategy': 'breakout', 'bull_bb_std_mult': 2.0633210594267988, 'bull_rsi_os': 45, 'bull_rsi_ob': 68, 'bull_adx_thresh': 5.192602241492672, 'bull_atr_min_pct': 0.001722176816203972, 'bull_atr_max_pct': 0.034639685851742506, 'bull_tp_mult': 1.6202827458976168, 'bull_tsl_mult': 0.38814597143509916, 'bull_time_stop': 101, 'bull_use_sma': True, 'bull_use_ema': True, 'bull_use_atr': False, 'bull_use_adx': False, 'bull_use_spike': False, 'bull_rsi_required': False, 'bear_strategy': 'mean_reversion', 'bear_bb_std_mult': 1.9163121671150798, 'bear_rsi_os': 13, 'bear_rsi_ob': 95, 'bear_adx_thresh': 7.885074887368949, 'bear_atr_min_pct': 0.009966640309489336, 'bear_atr_max_pct': 0.10312032113729101, 'bear_tp_mult': 2.8289575127289033, 'bear_tsl_mult': 0.11187833053413195, 'bear_time_stop': 300, 'bear_use_sma': True, 'bear_use_ema': True, 'bear_use_atr': False, 'bear_use_adx': False, 'bear_use_spike': False, 'bear_rsi_required': True, 'sideways_strategy': 'breakout', 'sideways_bb_std_mult': 0.9976617193683469, 'sideways_rsi_os': 41, 'sideways_rsi_ob': 92, 'sideways_adx_thresh': 14.153721758120925, 'sideways_atr_min_pct': 0.017353872392803796, 'sideways_atr_max_pct': 0.015912370723488077, 'sideways_tp_mult': 1.246593461127217, 'sideways_tsl_mult': 0.03333879645017657, 'sideways_time_stop': 97, 'sideways_use_sma': True, 'sideways_use_ema': True, 'sideways_use_atr': True, 'sideways_use_adx': True, 'sideways_use_spike': False, 'sideways_rsi_required': False}.
[I 2025-09-01 07:50:41,833] Trial 180 finished with values: [0.002426063229577391, 0.003893411353714307] and parameters: {'p_sma': 48, 'p_std': 41, 'p_atr': 24, 'p_adx': 15, 'rsi_period': 8, 'ema1': 9, 'ema2': 11, 'slip_atr_k': 0.0012117795426433275, 'slip_spread_k': 0.5304706274986083, 'spread_hl_frac': 0.034319436322649166, 'bb_std_mult': 1.978908922726572, 'rsi_os': 45, 'rsi_ob': 59, 'vol_spike': 0.06069454530240696, 'adx_thresh': 27.433504531744916, 'atr_min_pct': 0.016866853374614434, 'atr_max_pct': 0.05950849194505687, 'tp_mult': 2.438374238892036, 'tsl_mult': 0.47542096037929654, 'strategy': 'breakout', 'time_stop': 70, 'use_sma': False, 'use_atr': False, 'use_adx': True, 'use_ema': True, 'use_spike': True, 'rsi_required': True, 'edge_k': 0.32488304641890675, 'edge_cap': 0.5793671677645231, 'bull_strategy': 'breakout', 'bull_bb_std_mult': 2.5598934451393616, 'bull_rsi_os': 16, 'bull_rsi_ob': 85, 'bull_adx_thresh': 22.351509388725812, 'bull_atr_min_pct': 0.003521773669388262, 'bull_atr_max_pct': 0.06149096258685346, 'bull_tp_mult': 1.6164385019037348, 'bull_tsl_mult': 0.6607820042753837, 'bull_time_stop': 97, 'bull_use_sma': True, 'bull_use_ema': True, 'bull_use_atr': False, 'bull_use_adx': False, 'bull_use_spike': False, 'bull_rsi_required': False, 'bear_strategy': 'mean_reversion', 'bear_bb_std_mult': 2.3221761439991724, 'bear_rsi_os': 49, 'bear_rsi_ob': 59, 'bear_adx_thresh': 8.901039862947183, 'bear_atr_min_pct': 0.006846266891765678, 'bear_atr_max_pct': 0.11593580890881798, 'bear_tp_mult': 1.2770718413659463, 'bear_tsl_mult': 0.36855059629654685, 'bear_time_stop': 212, 'bear_use_sma': True, 'bear_use_ema': False, 'bear_use_atr': True, 'bear_use_adx': False, 'bear_use_spike': False, 'bear_rsi_required': True, 'sideways_strategy': 'breakout', 'sideways_bb_std_mult': 1.3668090905618246, 'sideways_rsi_os': 43, 'sideways_rsi_ob': 49, 'sideways_adx_thresh': 11.191694303908374, 'sideways_atr_min_pct': 0.014428255547802414, 'sideways_atr_max_pct': 0.02329483905120495, 'sideways_tp_mult': 1.3429508477060004, 'sideways_tsl_mult': 0.06249147653436976, 'sideways_time_stop': 215, 'sideways_use_sma': True, 'sideways_use_ema': True, 'sideways_use_atr': True, 'sideways_use_adx': True, 'sideways_use_spike': False, 'sideways_rsi_required': False}.
