[I 2025-09-01 07:27:42,558] Trial 43 finished with values: [-1000000000.0, 1000000000.0] and parameters: {'p_sma': 53, 'p_std': 29, 'p_atr': 14, 'p_adx': 10, 'rsi_period': 24, 'ema1': 27, 'ema2': 18, 'slip_atr_k': 0.13190105287570067, 'slip_spread_k': 0.028875616613714905, 'spread_hl_frac': 0.02189031736337681, 'bb_std_mult': 3.2608741250739217, 'rsi_os': 55, 'rsi_ob': 67, 'vol_spike': 0.229699923615628, 'adx_thresh': 22.98363645644703, 'atr_min_pct': 0.02744240460053743, 'atr_max_pct': 0.028940376762221262, 'tp_mult': 2.994253265462908, 'tsl_mult': 0.8995661389073899, 'strategy': 'breakout', 'time_stop': 13, 'use_sma': False, 'use_atr': False, 'use_adx': False, 'use_ema': False, 'use_spike': False, 'rsi_required': False, 'edge_k': 1.8366033987366905, 'edge_cap': 0.8150746076123687, 'bull_strategy': 'breakout', 'bull_bb_std_mult': 2.8111041461782706, 'bull_rsi_os': 34, 'bull_rsi_ob': 49, 'bull_adx_thresh': 14.776814340457113, 'bull_atr_min_pct': 0.026269598271626823, 'bull_atr_max_pct': 0.07390635875243984, 'bull_tp_mult': 2.0152398143271886, 'bull_tsl_mult': 0.46020050831428366, 'bull_time_stop': 267, 'bull_use_sma': True, 'bull_use_ema': True, 'bull_use_atr': False, 'bull_use_adx': False, 'bull_use_spike': True, 'bull_rsi_required': False, 'bear_strategy': 'mean_reversion', 'bear_bb_std_mult': 1.3100634757281626, 'bear_rsi_os': 14, 'bear_rsi_ob': 56, 'bear_adx_thresh': 24.357965064744995, 'bear_atr_min_pct': 0.027101557842509862, 'bear_atr_max_pct': 0.03379426973377123, 'bear_tp_mult': 2.793120174745074, 'bear_tsl_mult': 0.6408016751270733, 'bear_time_stop': 246, 'bear_use_sma': False, 'bear_use_ema': True, 'bear_use_atr': False, 'bear_use_adx': False, 'bear_use_spike': False, 'bear_rsi_required': False, 'sideways_strategy': 'breakout', 'sideways_bb_std_mult': 2.851296311802809, 'sideways_rsi_os': 37, 'sideways_rsi_ob': 81, 'sideways_adx_thresh': 24.678080050757423, 'sideways_atr_min_pct': 0.020170366558224635, 'sideways_atr_max_pct': 0.029362121825919144, 'sideways_tp_mult': 1.661007380370872, 'sideways_tsl_mult': 0.32171090200424324, 'sideways_time_stop': 67, 'sideways_use_sma': False, 'sideways_use_ema': False, 'sideways_use_atr': True, 'sideways_use_adx': True, 'sideways_use_spike': True, 'sideways_rsi_required': False}.
[I 2025-09-01 07:27:42,961] Trial 42 finished with values: [-1000000000.0, 1000000000.0] and parameters: {'p_sma': 48, 'p_std': 28, 'p_atr': 10, 'p_adx': 9, 'rsi_period': 77, 'ema1': 28, 'ema2': 25, 'slip_atr_k': 0.1301835367606443, 'slip_spread_k': 0.47650189726286474, 'spread_hl_frac': 0.035483927750630626, 'bb_std_mult': 0.5097225442761868, 'rsi_os': 9, 'rsi_ob': 66, 'vol_spike': 0.006626427475174973, 'adx_thresh': 27.3604896747427, 'atr_min_pct': 0.02781571166552824, 'atr_max_pct': 0.02939049351493911, 'tp_mult': 1.568279303815006, 'tsl_mult': 0.9353209328915295, 'strategy': 'breakout', 'time_stop': 7, 'use_sma': False, 'use_atr': False, 'use_adx': True, 'use_ema': True, 'use_spike': False, 'rsi_required': False, 'edge_k': 0.3821272735912252, 'edge_cap': 0.8218589869962656, 'bull_strategy': 'breakout', 'bull_bb_std_mult': 2.8534228744877206, 'bull_rsi_os': 35, 'bull_rsi_ob': 60, 'bull_adx_thresh': 13.363239371524902, 'bull_atr_min_pct': 0.008992895789388278, 'bull_atr_max_pct': 0.07347468776253832, 'bull_tp_mult': 2.030101626214386, 'bull_tsl_mult': 0.18264577112168334, 'bull_time_stop': 271, 'bull_use_sma': True, 'bull_use_ema': True, 'bull_use_atr': False, 'bull_use_adx': False, 'bull_use_spike': True, 'bull_rsi_required': False, 'bear_strategy': 'mean_reversion', 'bear_bb_std_mult': 1.391028196154588, 'bear_rsi_os': 30, 'bear_rsi_ob': 71, 'bear_adx_thresh': 25.24105034959792, 'bear_atr_min_pct': 0.027287903543998807, 'bear_atr_max_pct': 0.031156232922141966, 'bear_tp_mult': 1.2173422842173804, 'bear_tsl_mult': 0.6494193328104905, 'bear_time_stop': 268, 'bear_use_sma': False, 'bear_use_ema': True, 'bear_use_atr': False, 'bear_use_adx': False, 'bear_use_spike': False, 'bear_rsi_required': False, 'sideways_strategy': 'mean_reversion', 'sideways_bb_std_mult': 2.901655265108474, 'sideways_rsi_os': 50, 'sideways_rsi_ob': 84, 'sideways_adx_thresh': 31.216582081596496, 'sideways_atr_min_pct': 0.02223556976295865, 'sideways_atr_max_pct': 0.1287933075043019, 'sideways_tp_mult': 2.878051422617924, 'sideways_tsl_mult': 0.3092498022612913, 'sideways_time_stop': 59, 'sideways_use_sma': False, 'sideways_use_ema': True, 'sideways_use_atr': True, 'sideways_use_adx': True, 'sideways_use_spike': True, 'sideways_rsi_required': False}.
[I 2025-09-01 07:28:27,281] Trial 47 finished with values: [-1000000000.0, 1000000000.0] and parameters: {'p_sma': 41, 'p_std': 38, 'p_atr': 22, 'p_adx': 12, 'rsi_period': 22, 'ema1': 28, 'ema2': 38, 'slip_atr_k': 0.17634673820894362, 'slip_spread_k': 0.5459377900782488, 'spread_hl_frac': 0.026174393431722502, 'bb_std_mult': 0.9452332062294155, 'rsi_os': 5, 'rsi_ob': 61, 'vol_spike': 0.07489591483298229, 'adx_thresh': 32.03857449003775, 'atr_min_pct': 0.016173150932973678, 'atr_max_pct': 0.06030145806181833, 'tp_mult': 2.439900276343384, 'tsl_mult': 0.7908592295068664, 'strategy': 'breakout', 'time_stop': 22, 'use_sma': False, 'use_atr': False, 'use_adx': False, 'use_ema': False, 'use_spike': False, 'rsi_required': False, 'edge_k': 0.3808740592979978, 'edge_cap': 0.41329591971380597, 'bull_strategy': 'breakout', 'bull_bb_std_mult': 2.416447284616899, 'bull_rsi_os': 41, 'bull_rsi_ob': 55, 'bull_adx_thresh': 15.645496739784292, 'bull_atr_min_pct': 0.006529947242536844, 'bull_atr_max_pct': 0.020817116983266035, 'bull_tp_mult': 2.0489937146357207, 'bull_tsl_mult': 0.5804525684547612, 'bull_time_stop': 159, 'bull_use_sma': True, 'bull_use_ema': True, 'bull_use_atr': False, 'bull_use_adx': False, 'bull_use_spike': False, 'bull_rsi_required': False, 'bear_strategy': 'mean_reversion', 'bear_bb_std_mult': 2.669016434257286, 'bear_rsi_os': 6, 'bear_rsi_ob': 72, 'bear_adx_thresh': 26.817523949806514, 'bear_atr_min_pct': 0.01991866786882021, 'bear_atr_max_pct': 0.05484051687781358, 'bear_tp_mult': 1.488439215048571, 'bear_tsl_mult': 0.6176624935955423, 'bear_time_stop': 143, 'bear_use_sma': False, 'bear_use_ema': False, 'bear_use_atr': True, 'bear_use_adx': False, 'bear_use_spike': False, 'bear_rsi_required': False, 'sideways_strategy': 'mean_reversion', 'sideways_bb_std_mult': 0.6575688629812957, 'sideways_rsi_os': 28, 'sideways_rsi_ob': 55, 'sideways_adx_thresh': 7.786498658479232, 'sideways_atr_min_pct': 0.014115355888748427, 'sideways_atr_max_pct': 0.038694658708270095, 'sideways_tp_mult': 1.2648396792107048, 'sideways_tsl_mult': 0.03680517354490764, 'sideways_time_stop': 286, 'sideways_use_sma': False, 'sideways_use_ema': False, 'sideways_use_atr': True, 'sideways_use_adx': True, 'sideways_use_spike': False, 'sideways_rsi_required': True}.
[I 2025-09-01 07:28:29,267] Trial 50 finished with values: [-1000000000.0, 1000000000.0] and parameters: {'p_sma': 21, 'p_std': 31, 'p_atr': 7, 'p_adx': 19, 'rsi_period': 49, 'ema1': 14, 'ema2': 52, 'slip_atr_k': 0.16489743893352382, 'slip_spread_k': 0.40745650180921966, 'spread_hl_frac': 0.025602145688302526, 'bb_std_mult': 0.977188559972531, 'rsi_os': 47, 'rsi_ob': 60, 'vol_spike': 0.0683929163732681, 'adx_thresh': 29.170985785676137, 'atr_min_pct': 0.01598311320479713, 'atr_max_pct': 0.10503516470965951, 'tp_mult': 2.405731947873168, 'tsl_mult': 0.7660000131185863, 'strategy': 'breakout', 'time_stop': 162, 'use_sma': False, 'use_atr': False, 'use_adx': False, 'use_ema': False, 'use_spike': False, 'rsi_required': False, 'edge_k': 0.6369278464064414, 'edge_cap': 0.5658110798620282, 'bull_strategy': 'breakout', 'bull_bb_std_mult': 0.8009409306305522, 'bull_rsi_os': 40, 'bull_rsi_ob': 66, 'bull_adx_thresh': 18.598735324030645, 'bull_atr_min_pct': 0.01751394656732744, 'bull_atr_max_pct': 0.020669683573628854, 'bull_tp_mult': 1.8136997061407787, 'bull_tsl_mult': 0.5574933587133352, 'bull_time_stop': 165, 'bull_use_sma': False, 'bull_use_ema': True, 'bull_use_atr': False, 'bull_use_adx': False, 'bull_use_spike': False, 'bull_rsi_required': True, 'bear_strategy': 'breakout', 'bear_bb_std_mult': 2.2936549929673946, 'bear_rsi_os': 25, 'bear_rsi_ob': 67, 'bear_adx_thresh': 14.326450980333906, 'bear_atr_min_pct': 0.004013272929210877, 'bear_atr_max_pct': 0.05310918393043738, 'bear_tp_mult': 2.4242546626128476, 'bear_tsl_mult': 0.8839019508524124, 'bear_time_stop': 139, 'bear_use_sma': False, 'bear_use_ema': False, 'bear_use_atr': True, 'bear_use_adx': False, 'bear_use_spike': False, 'bear_rsi_required': False, 'sideways_strategy': 'mean_reversion', 'sideways_bb_std_mult': 0.7609102782096004, 'sideways_rsi_os': 52, 'sideways_rsi_ob': 73, 'sideways_adx_thresh': 6.977148186498136, 'sideways_atr_min_pct': 0.007064528763312016, 'sideways_atr_max_pct': 0.040747705710116364, 'sideways_tp_mult': 1.2778821219560101, 'sideways_tsl_mult': 0.08006074616606956, 'sideways_time_stop': 298, 'sideways_use_sma': False, 'sideways_use_ema': False, 'sideways_use_atr': True, 'sideways_use_adx': False, 'sideways_use_spike': False, 'sideways_rsi_required': True}.
[I 2025-09-01 07:28:29,934] Trial 48 finished with values: [-1000000000.0, 1000000000.0] and parameters: {'p_sma': 9, 'p_std': 32, 'p_atr': 7, 'p_adx': 17, 'rsi_period': 23, 'ema1': 28, 'ema2': 54, 'slip_atr_k': 0.16484602444076, 'slip_spread_k': 0.4077549993945577, 'spread_hl_frac': 0.026111971061870586, 'bb_std_mult': 2.6624833037184903, 'rsi_os': 47, 'rsi_ob': 61, 'vol_spike': 0.07891321870236662, 'adx_thresh': 28.442465403949786, 'atr_min_pct': 0.019953969436497264, 'atr_max_pct': 0.07395503962398259, 'tp_mult': 1.5946984649103264, 'tsl_mult': 0.7526001441092454, 'strategy': 'breakout', 'time_stop': 161, 'use_sma': False, 'use_atr': False, 'use_adx': False, 'use_ema': False, 'use_spike': False, 'rsi_required': False, 'edge_k': 1.8297845039048413, 'edge_cap': 0.7239259405834678, 'bull_strategy': 'breakout', 'bull_bb_std_mult': 0.7753314239502829, 'bull_rsi_os': 41, 'bull_rsi_ob': 66, 'bull_adx_thresh': 18.8447388409096, 'bull_atr_min_pct': 0.017620165314091024, 'bull_atr_max_pct': 0.021007307649670418, 'bull_tp_mult': 2.4247017370241464, 'bull_tsl_mult': 0.5660213693527123, 'bull_time_stop': 161, 'bull_use_sma': True, 'bull_use_ema': True, 'bull_use_atr': False, 'bull_use_adx': False, 'bull_use_spike': False, 'bull_rsi_required': False, 'bear_strategy': 'breakout', 'bear_bb_std_mult': 2.047447747694719, 'bear_rsi_os': 22, 'bear_rsi_ob': 67, 'bear_adx_thresh': 25.926286161432408, 'bear_atr_min_pct': 0.0022722082084897666, 'bear_atr_max_pct': 0.05512798903121225, 'bear_tp_mult': 2.4542228298678537, 'bear_tsl_mult': 0.6256846658983467, 'bear_time_stop': 143, 'bear_use_sma': False, 'bear_use_ema': True, 'bear_use_atr': False, 'bear_use_adx': False, 'bear_use_spike': False, 'bear_rsi_required': False, 'sideways_strategy': 'mean_reversion', 'sideways_bb_std_mult': 0.7216894160862539, 'sideways_rsi_os': 29, 'sideways_rsi_ob': 73, 'sideways_adx_thresh': 21.374640341895933, 'sideways_atr_min_pct': 0.006780036293633851, 'sideways_atr_max_pct': 0.04079441557671122, 'sideways_tp_mult': 1.269973278643329, 'sideways_tsl_mult': 0.44681290261415396, 'sideways_time_stop': 250, 'sideways_use_sma': False, 'sideways_use_ema': False, 'sideways_use_atr': True, 'sideways_use_adx': False, 'sideways_use_spike': True, 'sideways_rsi_required': True}.
[I 2025-09-01 07:28:30,709] Trial 49 finished with values: [-1000000000.0, 1000000000.0] and parameters: {'p_sma': 21, 'p_std': 32, 'p_atr': 8, 'p_adx': 17, 'rsi_period': 66, 'ema1': 11, 'ema2': 49, 'slip_atr_k': 0.1681602612613783, 'slip_spread_k': 0.4131239335981809, 'spread_hl_frac': 0.014792963598187478, 'bb_std_mult': 2.7621695135458584, 'rsi_os': 47, 'rsi_ob': 70, 'vol_spike': 0.0632137581052586, 'adx_thresh': 29.2520294992453, 'atr_min_pct': 0.0196747883948342, 'atr_max_pct': 0.07632564098617624, 'tp_mult': 2.315535572651152, 'tsl_mult': 0.8043501166428344, 'strategy': 'breakout', 'time_stop': 173, 'use_sma': False, 'use_atr': False, 'use_adx': False, 'use_ema': False, 'use_spike': False, 'rsi_required': False, 'edge_k': 1.1567313903894851, 'edge_cap': 0.35739159412392707, 'bull_strategy': 'breakout', 'bull_bb_std_mult': 1.716507632978193, 'bull_rsi_os': 39, 'bull_rsi_ob': 67, 'bull_adx_thresh': 18.43814642503463, 'bull_atr_min_pct': 0.01831940383706221, 'bull_atr_max_pct': 0.022110129217669562, 'bull_tp_mult': 1.811544498708383, 'bull_tsl_mult': 0.5482203791421345, 'bull_time_stop': 160, 'bull_use_sma': False, 'bull_use_ema': True, 'bull_use_atr': False, 'bull_use_adx': False, 'bull_use_spike': False, 'bull_rsi_required': True, 'bear_strategy': 'breakout', 'bear_bb_std_mult': 2.3286571571783807, 'bear_rsi_os': 23, 'bear_rsi_ob': 66, 'bear_adx_thresh': 14.608648961700009, 'bear_atr_min_pct': 0.005703657674843335, 'bear_atr_max_pct': 0.010259487011732071, 'bear_tp_mult': 1.8480667606977454, 'bear_tsl_mult': 0.493744783789098, 'bear_time_stop': 137, 'bear_use_sma': False, 'bear_use_ema': False, 'bear_use_atr': True, 'bear_use_adx': False, 'bear_use_spike': False, 'bear_rsi_required': False, 'sideways_strategy': 'mean_reversion', 'sideways_bb_std_mult': 2.308272477725484, 'sideways_rsi_os': 49, 'sideways_rsi_ob': 73, 'sideways_adx_thresh': 8.181735466628453, 'sideways_atr_min_pct': 0.0070877222716525246, 'sideways_atr_max_pct': 0.038612465418117844, 'sideways_tp_mult': 1.2812146695380344, 'sideways_tsl_mult': 0.06179811941119778, 'sideways_time_stop': 46, 'sideways_use_sma': False, 'sideways_use_ema': False, 'sideways_use_atr': True, 'sideways_use_adx': False, 'sideways_use_spike': True, 'sideways_rsi_required': True}.
[I 2025-09-01 07:29:16,960] Trial 51 finished with values: [-1000000000.0, 1000000000.0] and parameters: {'p_sma': 21, 'p_std': 31, 'p_atr': 8, 'p_adx': 17, 'rsi_period': 48, 'ema1': 17, 'ema2': 54, 'slip_atr_k': 0.10027614348558417, 'slip_spread_k': 0.41201532139410374, 'spread_hl_frac': 0.04991376292312983, 'bb_std_mult': 2.6858542120448843, 'rsi_os': 28, 'rsi_ob': 71, 'vol_spike': 0.21133281453153469, 'adx_thresh': 28.477591364062278, 'atr_min_pct': 0.006048509204256213, 'atr_max_pct': 0.07331216195598647, 'tp_mult': 2.628698465998025, 'tsl_mult': 0.5864899369053976, 'strategy': 'breakout', 'time_stop': 162, 'use_sma': False, 'use_atr': False, 'use_adx': False, 'use_ema': False, 'use_spike': False, 'rsi_required': False, 'edge_k': 1.1738653611483194, 'edge_cap': 0.6236759142067732, 'bull_strategy': 'breakout', 'bull_bb_std_mult': 0.813679113945444, 'bull_rsi_os': 10, 'bull_rsi_ob': 65, 'bull_adx_thresh': 18.802004388002775, 'bull_atr_min_pct': 0.01761383074474299, 'bull_atr_max_pct': 0.05641380671594112, 'bull_tp_mult': 1.8252923107168535, 'bull_tsl_mult': 0.22185561298091971, 'bull_time_stop': 176, 'bull_use_sma': False, 'bull_use_ema': True, 'bull_use_atr': False, 'bull_use_adx': False, 'bull_use_spike': False, 'bull_rsi_required': True, 'bear_strategy': 'breakout', 'bear_bb_std_mult': 2.035720909986526, 'bear_rsi_os': 25, 'bear_rsi_ob': 67, 'bear_adx_thresh': 31.67606260333914, 'bear_atr_min_pct': 0.0035334918918441746, 'bear_atr_max_pct': 0.08858033991665401, 'bear_tp_mult': 1.0904550739730525, 'bear_tsl_mult': 0.026189169429044645, 'bear_time_stop': 80, 'bear_use_sma': False, 'bear_use_ema': False, 'bear_use_atr': True, 'bear_use_adx': True, 'bear_use_spike': False, 'bear_rsi_required': False, 'sideways_strategy': 'mean_reversion', 'sideways_bb_std_mult': 2.2845942285292717, 'sideways_rsi_os': 52, 'sideways_rsi_ob': 72, 'sideways_adx_thresh': 27.64326324210568, 'sideways_atr_min_pct': 0.025566147933851653, 'sideways_atr_max_pct': 0.11077385127741843, 'sideways_tp_mult': 1.322407788916216, 'sideways_tsl_mult': 0.45487596654106016, 'sideways_time_stop': 44, 'sideways_use_sma': False, 'sideways_use_ema': False, 'sideways_use_atr': True, 'sideways_use_adx': False, 'sideways_use_spike': True, 'sideways_rsi_required': True}.
[I 2025-09-01 07:29:17,946] Trial 54 finished with values: [-0.04909527553174464, 0.049033533404320706] and parameters: {'p_sma': 56, 'p_std': 35, 'p_atr': 16, 'p_adx': 15, 'rsi_period': 83, 'ema1': 17, 'ema2': 12, 'slip_atr_k': 0.10439007537999406, 'slip_spread_k': 0.6862653708503091, 'spread_hl_frac': 0.009822255723320544, 'bb_std_mult': 1.7300832713383583, 'rsi_os': 28, 'rsi_ob': 55, 'vol_spike': 0.20878651760114636, 'adx_thresh': 5.132329614755454, 'atr_min_pct': 0.029579113580081955, 'atr_max_pct': 0.14664048734748858, 'tp_mult': 2.598250194925888, 'tsl_mult': 0.5109105332300671, 'strategy': 'breakout', 'time_stop': 109, 'use_sma': False, 'use_atr': False, 'use_adx': False, 'use_ema': False, 'use_spike': False, 'rsi_required': False, 'edge_k': 1.4829849392181877, 'edge_cap': 0.9828537771189577, 'bull_strategy': 'breakout', 'bull_bb_std_mult': 3.439021056703463, 'bull_rsi_os': 51, 'bull_rsi_ob': 72, 'bull_adx_thresh': 23.88347075892399, 'bull_atr_min_pct': 3.890345295965922e-05, 'bull_atr_max_pct': 0.05568497185622187, 'bull_tp_mult': 1.6120422644602288, 'bull_tsl_mult': 0.23031953698923124, 'bull_time_stop': 143, 'bull_use_sma': False, 'bull_use_ema': True, 'bull_use_atr': False, 'bull_use_adx': False, 'bull_use_spike': True, 'bull_rsi_required': True, 'bear_strategy': 'breakout', 'bear_bb_std_mult': 2.0152940767214513, 'bear_rsi_os': 41, 'bear_rsi_ob': 51, 'bear_adx_thresh': 30.596418116174256, 'bear_atr_min_pct': 0.02260082234791678, 'bear_atr_max_pct': 0.08541423771296726, 'bear_tp_mult': 1.0978799617102366, 'bear_tsl_mult': 0.7360805531804124, 'bear_time_stop': 78, 'bear_use_sma': False, 'bear_use_ema': False, 'bear_use_atr': False, 'bear_use_adx': True, 'bear_use_spike': False, 'bear_rsi_required': False, 'sideways_strategy': 'breakout', 'sideways_bb_std_mult': 2.310967479286748, 'sideways_rsi_os': 44, 'sideways_rsi_ob': 45, 'sideways_adx_thresh': 27.328561188468314, 'sideways_atr_min_pct': 0.023599503963403635, 'sideways_atr_max_pct': 0.08184087309465983, 'sideways_tp_mult': 1.0966525198073547, 'sideways_tsl_mult': 0.6015159218107655, 'sideways_time_stop': 11, 'sideways_use_sma': False, 'sideways_use_ema': False, 'sideways_use_atr': True, 'sideways_use_adx': False, 'sideways_use_spike': True, 'sideways_rsi_required': True}.
[I 2025-09-01 07:29:18,573] Trial 52 finished with values: [-0.011750549284151757, 0.01163588987250318] and parameters: {'p_sma': 9, 'p_std': 32, 'p_atr': 20, 'p_adx': 17, 'rsi_period': 58, 'ema1': 11, 'ema2': 12, 'slip_atr_k': 0.19161731789857825, 'slip_spread_k': 0.6515474602707602, 'spread_hl_frac': 0.01432114461126436, 'bb_std_mult': 2.7324006425724923, 'rsi_os': 14, 'rsi_ob': 70, 'vol_spike': 0.18577739711054903, 'adx_thresh': 16.754612284014392, 'atr_min_pct': 0.0023699226871623895, 'atr_max_pct': 0.11866830455464676, 'tp_mult': 1.9583289887586353, 'tsl_mult': 0.5111952675375367, 'strategy': 'breakout', 'time_stop': 113, 'use_sma': False, 'use_atr': False, 'use_adx': False, 'use_ema': False, 'use_spike': False, 'rsi_required': False, 'edge_k': 1.0775802381294484, 'edge_cap': 0.6488929877574832, 'bull_strategy': 'breakout', 'bull_bb_std_mult': 1.602621033806655, 'bull_rsi_os': 51, 'bull_rsi_ob': 48, 'bull_adx_thresh': 24.272480848903015, 'bull_atr_min_pct': 0.0010857415540702058, 'bull_atr_max_pct': 0.0561294008297476, 'bull_tp_mult': 1.6053895403062204, 'bull_tsl_mult': 0.22918460487902556, 'bull_time_stop': 33, 'bull_use_sma': False, 'bull_use_ema': True, 'bull_use_atr': False, 'bull_use_adx': False, 'bull_use_spike': False, 'bull_rsi_required': True, 'bear_strategy': 'breakout', 'bear_bb_std_mult': 2.0297383515349976, 'bear_rsi_os': 41, 'bear_rsi_ob': 51, 'bear_adx_thresh': 20.698139331786045, 'bear_atr_min_pct': 0.0057790692725491945, 'bear_atr_max_pct': 0.09058987415143785, 'bear_tp_mult': 1.8587850559179848, 'bear_tsl_mult': 0.49951736917396533, 'bear_time_stop': 164, 'bear_use_sma': False, 'bear_use_ema': False, 'bear_use_atr': False, 'bear_use_adx': True, 'bear_use_spike': False, 'bear_rsi_required': False, 'sideways_strategy': 'breakout', 'sideways_bb_std_mult': 2.322548048866526, 'sideways_rsi_os': 43, 'sideways_rsi_ob': 45, 'sideways_adx_thresh': 12.807606104775761, 'sideways_atr_min_pct': 0.010162352235550263, 'sideways_atr_max_pct': 0.10516018879453834, 'sideways_tp_mult': 2.2616898561074357, 'sideways_tsl_mult': 0.4426417069852809, 'sideways_time_stop': 135, 'sideways_use_sma': False, 'sideways_use_ema': False, 'sideways_use_atr': True, 'sideways_use_adx': False, 'sideways_use_spike': True, 'sideways_rsi_required': True}.
