[I 2025-09-01 08:38:11,964] Trial 440 finished with values: [0.0003447183296505507, 0.002674886098769114] and parameters: {'p_sma': 58, 'p_std': 54, 'p_atr': 19, 'p_adx': 15, 'rsi_period': 52, 'ema1': 13, 'ema2': 13, 'slip_atr_k': 0.021908187162996993, 'slip_spread_k': 0.4132799005424597, 'spread_hl_frac': 0.04526479222390736, 'bb_std_mult': 2.6690211217531914, 'rsi_os': 34, 'rsi_ob': 78, 'vol_spike': 0.05783480033912911, 'adx_thresh': 30.94851380000383, 'atr_min_pct': 0.004480601701226767, 'atr_max_pct': 0.12252856671760075, 'tp_mult': 1.777298724395105, 'tsl_mult': 0.07505360179541903, 'strategy': 'breakout', 'time_stop': 240, 'use_sma': False, 'use_atr': False, 'use_adx': True, 'use_ema': True, 'use_spike': True, 'rsi_required': False, 'edge_k': 0.0786977252333747, 'edge_cap': 0.14888565840291762, 'bull_strategy': 'breakout', 'bull_bb_std_mult': 2.8755320371620883, 'bull_rsi_os': 43, 'bull_rsi_ob': 52, 'bull_adx_thresh': 6.9851154123668096, 'bull_atr_min_pct': 0.003868965146809403, 'bull_atr_max_pct': 0.0596540208248509, 'bull_tp_mult': 1.5263313128960887, 'bull_tsl_mult': 0.6169112068279873, 'bull_time_stop': 70, 'bull_use_sma': True, 'bull_use_ema': True, 'bull_use_atr': False, 'bull_use_adx': False, 'bull_use_spike': False, 'bull_rsi_required': False, 'bear_strategy': 'mean_reversion', 'bear_bb_std_mult': 2.140786387453188, 'bear_rsi_os': 44, 'bear_rsi_ob': 81, 'bear_adx_thresh': 6.142163559464926, 'bear_atr_min_pct': 0.00738116615419359, 'bear_atr_max_pct': 0.09302314077656561, 'bear_tp_mult': 2.7398154842686875, 'bear_tsl_mult': 0.45111599461105417, 'bear_time_stop': 300, 'bear_use_sma': False, 'bear_use_ema': False, 'bear_use_atr': False, 'bear_use_adx': False, 'bear_use_spike': False, 'bear_rsi_required': False, 'sideways_strategy': 'breakout', 'sideways_bb_std_mult': 0.9516768352486744, 'sideways_rsi_os': 23, 'sideways_rsi_ob': 95, 'sideways_adx_thresh': 19.08832190201404, 'sideways_atr_min_pct': 0.028429717735532156, 'sideways_atr_max_pct': 0.09332709097185743, 'sideways_tp_mult': 2.4135506628921886, 'sideways_tsl_mult': 0.13687477226517666, 'sideways_time_stop': 89, 'sideways_use_sma': False, 'sideways_use_ema': True, 'sideways_use_atr': True, 'sideways_use_adx': False, 'sideways_use_spike': True, 'sideways_rsi_required': False}.
[I 2025-09-01 08:38:12,177] Trial 439 finished with values: [-0.0065043994455803444, 0.007383658878005916] and parameters: {'p_sma': 31, 'p_std': 20, 'p_atr': 8, 'p_adx': 15, 'rsi_period': 51, 'ema1': 13, 'ema2': 13, 'slip_atr_k': 0.014893473853962058, 'slip_spread_k': 0.4113172388054096, 'spread_hl_frac': 0.048944403107353915, 'bb_std_mult': 2.751756712289803, 'rsi_os': 32, 'rsi_ob': 81, 'vol_spike': 0.05628336074203462, 'adx_thresh': 29.995827340008884, 'atr_min_pct': 0.010141625236189892, 'atr_max_pct': 0.12029133943228243, 'tp_mult': 1.7762286181565239, 'tsl_mult': 0.17197867221392316, 'strategy': 'breakout', 'time_stop': 242, 'use_sma': True, 'use_atr': False, 'use_adx': True, 'use_ema': True, 'use_spike': True, 'rsi_required': False, 'edge_k': 0.25798734408564555, 'edge_cap': 0.3030069442216239, 'bull_strategy': 'breakout', 'bull_bb_std_mult': 2.818069284615685, 'bull_rsi_os': 45, 'bull_rsi_ob': 54, 'bull_adx_thresh': 7.048210356099968, 'bull_atr_min_pct': 0.0037391535903165706, 'bull_atr_max_pct': 0.05950721406652845, 'bull_tp_mult': 2.9935175678952683, 'bull_tsl_mult': 0.4752541814033352, 'bull_time_stop': 214, 'bull_use_sma': False, 'bull_use_ema': True, 'bull_use_atr': False, 'bull_use_adx': False, 'bull_use_spike': False, 'bull_rsi_required': True, 'bear_strategy': 'breakout', 'bear_bb_std_mult': 1.7177418962591773, 'bear_rsi_os': 46, 'bear_rsi_ob': 93, 'bear_adx_thresh': 6.271700960601735, 'bear_atr_min_pct': 0.007294386054697965, 'bear_atr_max_pct': 0.07328622763016107, 'bear_tp_mult': 1.9934350643634942, 'bear_tsl_mult': 0.4842474818369158, 'bear_time_stop': 207, 'bear_use_sma': True, 'bear_use_ema': False, 'bear_use_atr': False, 'bear_use_adx': False, 'bear_use_spike': False, 'bear_rsi_required': False, 'sideways_strategy': 'breakout', 'sideways_bb_std_mult': 1.4577702050120518, 'sideways_rsi_os': 5, 'sideways_rsi_ob': 95, 'sideways_adx_thresh': 11.688399832986498, 'sideways_atr_min_pct': 0.009276333107392499, 'sideways_atr_max_pct': 0.09564835501517982, 'sideways_tp_mult': 1.3365307822577375, 'sideways_tsl_mult': 0.14013112096024763, 'sideways_time_stop': 198, 'sideways_use_sma': False, 'sideways_use_ema': True, 'sideways_use_atr': False, 'sideways_use_adx': False, 'sideways_use_spike': True, 'sideways_rsi_required': False}.
[I 2025-09-01 08:38:59,285] Trial 444 finished with values: [-1000000000.0, 1000000000.0] and parameters: {'p_sma': 58, 'p_std': 32, 'p_atr': 19, 'p_adx': 14, 'rsi_period': 50, 'ema1': 12, 'ema2': 10, 'slip_atr_k': 0.03808908502290016, 'slip_spread_k': 0.1513887582578903, 'spread_hl_frac': 0.022950669151141953, 'bb_std_mult': 2.3842532608383307, 'rsi_os': 43, 'rsi_ob': 95, 'vol_spike': 0.030565493423383907, 'adx_thresh': 32.36370199762175, 'atr_min_pct': 0.008598777159224066, 'atr_max_pct': 0.1141364086939892, 'tp_mult': 1.4545813613053902, 'tsl_mult': 0.18466815731738576, 'strategy': 'mean_reversion', 'time_stop': 49, 'use_sma': True, 'use_atr': True, 'use_adx': False, 'use_ema': False, 'use_spike': False, 'rsi_required': False, 'edge_k': 0.5706109100394396, 'edge_cap': 0.45173548549771336, 'bull_strategy': 'mean_reversion', 'bull_bb_std_mult': 2.7917282489822672, 'bull_rsi_os': 42, 'bull_rsi_ob': 58, 'bull_adx_thresh': 13.018255613696173, 'bull_atr_min_pct': 0.005409624052700423, 'bull_atr_max_pct': 0.05860697983821146, 'bull_tp_mult': 1.389681276785699, 'bull_tsl_mult': 0.9491229308860998, 'bull_time_stop': 72, 'bull_use_sma': False, 'bull_use_ema': True, 'bull_use_atr': True, 'bull_use_adx': True, 'bull_use_spike': True, 'bull_rsi_required': True, 'bear_strategy': 'breakout', 'bear_bb_std_mult': 0.869984283847596, 'bear_rsi_os': 41, 'bear_rsi_ob': 85, 'bear_adx_thresh': 7.575356287282921, 'bear_atr_min_pct': 0.006202838665450129, 'bear_atr_max_pct': 0.02188414792905531, 'bear_tp_mult': 2.403690829559813, 'bear_tsl_mult': 0.08618051529817244, 'bear_time_stop': 245, 'bear_use_sma': False, 'bear_use_ema': True, 'bear_use_atr': True, 'bear_use_adx': True, 'bear_use_spike': True, 'bear_rsi_required': True, 'sideways_strategy': 'mean_reversion', 'sideways_bb_std_mult': 1.6321326201934616, 'sideways_rsi_os': 12, 'sideways_rsi_ob': 95, 'sideways_adx_thresh': 13.08991597975546, 'sideways_atr_min_pct': 0.029793601740396324, 'sideways_atr_max_pct': 0.09210223206978356, 'sideways_tp_mult': 1.232667576738543, 'sideways_tsl_mult': 0.5252391180060809, 'sideways_time_stop': 170, 'sideways_use_sma': False, 'sideways_use_ema': False, 'sideways_use_atr': False, 'sideways_use_adx': False, 'sideways_use_spike': True, 'sideways_rsi_required': True}.
[I 2025-09-01 08:38:59,431] Trial 446 finished with values: [-1000000000.0, 1000000000.0] and parameters: {'p_sma': 9, 'p_std': 32, 'p_atr': 19, 'p_adx': 16, 'rsi_period': 50, 'ema1': 12, 'ema2': 10, 'slip_atr_k': 0.025700146791247908, 'slip_spread_k': 0.15612955324223476, 'spread_hl_frac': 0.020563445236192805, 'bb_std_mult': 2.3821087439678275, 'rsi_os': 43, 'rsi_ob': 95, 'vol_spike': 0.04202815440744265, 'adx_thresh': 32.35132486387773, 'atr_min_pct': 0.013115799184461705, 'atr_max_pct': 0.11095390986753267, 'tp_mult': 1.5064355341742866, 'tsl_mult': 0.1892791111840412, 'strategy': 'mean_reversion', 'time_stop': 40, 'use_sma': True, 'use_atr': True, 'use_adx': False, 'use_ema': False, 'use_spike': False, 'rsi_required': False, 'edge_k': 0.5738759493924228, 'edge_cap': 0.4617493070354153, 'bull_strategy': 'mean_reversion', 'bull_bb_std_mult': 2.7817893943907674, 'bull_rsi_os': 42, 'bull_rsi_ob': 59, 'bull_adx_thresh': 13.634665493843839, 'bull_atr_min_pct': 0.005347673160505559, 'bull_atr_max_pct': 0.0562573903721547, 'bull_tp_mult': 1.4072787399227198, 'bull_tsl_mult': 0.9881315623351312, 'bull_time_stop': 292, 'bull_use_sma': False, 'bull_use_ema': True, 'bull_use_atr': True, 'bull_use_adx': True, 'bull_use_spike': True, 'bull_rsi_required': True, 'bear_strategy': 'breakout', 'bear_bb_std_mult': 0.9329529662800655, 'bear_rsi_os': 42, 'bear_rsi_ob': 85, 'bear_adx_thresh': 7.938434126841633, 'bear_atr_min_pct': 0.006235406079226043, 'bear_atr_max_pct': 0.02349228373643952, 'bear_tp_mult': 2.566158824000637, 'bear_tsl_mult': 0.8311680438396003, 'bear_time_stop': 245, 'bear_use_sma': False, 'bear_use_ema': True, 'bear_use_atr': True, 'bear_use_adx': True, 'bear_use_spike': True, 'bear_rsi_required': True, 'sideways_strategy': 'mean_reversion', 'sideways_bb_std_mult': 1.6069458502160736, 'sideways_rsi_os': 14, 'sideways_rsi_ob': 95, 'sideways_adx_thresh': 12.959904789489062, 'sideways_atr_min_pct': 0.02993491084707255, 'sideways_atr_max_pct': 0.09199847165946468, 'sideways_tp_mult': 1.228213645525011, 'sideways_tsl_mult': 0.5236204429814654, 'sideways_time_stop': 172, 'sideways_use_sma': False, 'sideways_use_ema': False, 'sideways_use_atr': False, 'sideways_use_adx': False, 'sideways_use_spike': True, 'sideways_rsi_required': True}.
[I 2025-09-01 08:38:59,625] Trial 445 finished with values: [-1000000000.0, 1000000000.0] and parameters: {'p_sma': 58, 'p_std': 31, 'p_atr': 19, 'p_adx': 15, 'rsi_period': 50, 'ema1': 12, 'ema2': 10, 'slip_atr_k': 0.026117484388324664, 'slip_spread_k': 0.13968482148202488, 'spread_hl_frac': 0.02428217163399121, 'bb_std_mult': 2.381572429865954, 'rsi_os': 42, 'rsi_ob': 95, 'vol_spike': 0.16681821972347244, 'adx_thresh': 31.98662501739927, 'atr_min_pct': 0.010262296926600068, 'atr_max_pct': 0.11049267623783803, 'tp_mult': 1.4560334352820792, 'tsl_mult': 0.18354307807192008, 'strategy': 'mean_reversion', 'time_stop': 42, 'use_sma': True, 'use_atr': True, 'use_adx': False, 'use_ema': False, 'use_spike': False, 'rsi_required': False, 'edge_k': 0.5196291113999947, 'edge_cap': 0.44609029127890854, 'bull_strategy': 'mean_reversion', 'bull_bb_std_mult': 2.818637507115415, 'bull_rsi_os': 42, 'bull_rsi_ob': 58, 'bull_adx_thresh': 12.968912148107329, 'bull_atr_min_pct': 0.006295471066610062, 'bull_atr_max_pct': 0.05638067702782781, 'bull_tp_mult': 1.4059020378425462, 'bull_tsl_mult': 0.9510572037058261, 'bull_time_stop': 235, 'bull_use_sma': False, 'bull_use_ema': True, 'bull_use_atr': True, 'bull_use_adx': True, 'bull_use_spike': True, 'bull_rsi_required': True, 'bear_strategy': 'breakout', 'bear_bb_std_mult': 0.9164410514281973, 'bear_rsi_os': 41, 'bear_rsi_ob': 83, 'bear_adx_thresh': 7.741359638756017, 'bear_atr_min_pct': 0.005912304286836805, 'bear_atr_max_pct': 0.0427822916896244, 'bear_tp_mult': 2.3989178868042815, 'bear_tsl_mult': 0.44303603662665125, 'bear_time_stop': 230, 'bear_use_sma': False, 'bear_use_ema': True, 'bear_use_atr': True, 'bear_use_adx': True, 'bear_use_spike': True, 'bear_rsi_required': True, 'sideways_strategy': 'mean_reversion', 'sideways_bb_std_mult': 1.6067205301282375, 'sideways_rsi_os': 16, 'sideways_rsi_ob': 95, 'sideways_adx_thresh': 12.999673193644126, 'sideways_atr_min_pct': 0.02979119228538233, 'sideways_atr_max_pct': 0.09199633495193968, 'sideways_tp_mult': 1.803594715685397, 'sideways_tsl_mult': 0.6339483180820351, 'sideways_time_stop': 160, 'sideways_use_sma': False, 'sideways_use_ema': False, 'sideways_use_atr': False, 'sideways_use_adx': False, 'sideways_use_spike': True, 'sideways_rsi_required': True}.
[I 2025-09-01 08:38:59,798] Trial 443 finished with values: [-1000000000.0, 1000000000.0] and parameters: {'p_sma': 30, 'p_std': 51, 'p_atr': 12, 'p_adx': 13, 'rsi_period': 51, 'ema1': 13, 'ema2': 34, 'slip_atr_k': 0.02183496357956853, 'slip_spread_k': 0.41167228244404397, 'spread_hl_frac': 0.04507207278005345, 'bb_std_mult': 2.4146593213509435, 'rsi_os': 32, 'rsi_ob': 94, 'vol_spike': 0.08786970381852102, 'adx_thresh': 17.39949206125492, 'atr_min_pct': 0.0036692945777869464, 'atr_max_pct': 0.11608495333145852, 'tp_mult': 1.5723339279940856, 'tsl_mult': 0.8063429892531877, 'strategy': 'breakout', 'time_stop': 241, 'use_sma': False, 'use_atr': False, 'use_adx': True, 'use_ema': True, 'use_spike': True, 'rsi_required': True, 'edge_k': 0.4041102181712193, 'edge_cap': 0.8560872857749353, 'bull_strategy': 'breakout', 'bull_bb_std_mult': 2.900994972498734, 'bull_rsi_os': 44, 'bull_rsi_ob': 45, 'bull_adx_thresh': 31.6785362834314, 'bull_atr_min_pct': 0.004311408953070983, 'bull_atr_max_pct': 0.0579412611557951, 'bull_tp_mult': 1.4055225491086172, 'bull_tsl_mult': 0.6129817986181436, 'bull_time_stop': 68, 'bull_use_sma': True, 'bull_use_ema': True, 'bull_use_atr': False, 'bull_use_adx': False, 'bull_use_spike': False, 'bull_rsi_required': False, 'bear_strategy': 'mean_reversion', 'bear_bb_std_mult': 1.0907567934992146, 'bear_rsi_os': 30, 'bear_rsi_ob': 79, 'bear_adx_thresh': 18.208143172163187, 'bear_atr_min_pct': 0.00479301328593786, 'bear_atr_max_pct': 0.11775073975258973, 'bear_tp_mult': 2.1428387146852543, 'bear_tsl_mult': 0.4518999227333419, 'bear_time_stop': 295, 'bear_use_sma': True, 'bear_use_ema': False, 'bear_use_atr': True, 'bear_use_adx': False, 'bear_use_spike': False, 'bear_rsi_required': False, 'sideways_strategy': 'breakout', 'sideways_bb_std_mult': 0.9384636836139444, 'sideways_rsi_os': 7, 'sideways_rsi_ob': 93, 'sideways_adx_thresh': 11.992481520097147, 'sideways_atr_min_pct': 0.028651268525617665, 'sideways_atr_max_pct': 0.012906997538724308, 'sideways_tp_mult': 1.7986849351239518, 'sideways_tsl_mult': 0.1474576645259446, 'sideways_time_stop': 93, 'sideways_use_sma': True, 'sideways_use_ema': True, 'sideways_use_atr': True, 'sideways_use_adx': True, 'sideways_use_spike': False, 'sideways_rsi_required': False}.
[I 2025-09-01 08:39:40,901] Trial 448 finished with values: [-1000000000.0, 1000000000.0] and parameters: {'p_sma': 56, 'p_std': 34, 'p_atr': 18, 'p_adx': 13, 'rsi_period': 49, 'ema1': 12, 'ema2': 11, 'slip_atr_k': 0.02241217081826619, 'slip_spread_k': 0.09597442112305674, 'spread_hl_frac': 0.0213858043016957, 'bb_std_mult': 2.426283974775829, 'rsi_os': 40, 'rsi_ob': 94, 'vol_spike': 0.03834489942248802, 'adx_thresh': 31.590623681641986, 'atr_min_pct': 0.0005327856878642248, 'atr_max_pct': 0.11213607378859952, 'tp_mult': 1.4990724477930828, 'tsl_mult': 0.2609631665933956, 'strategy': 'mean_reversion', 'time_stop': 33, 'use_sma': True, 'use_atr': True, 'use_adx': False, 'use_ema': False, 'use_spike': False, 'rsi_required': False, 'edge_k': 0.8140665716987383, 'edge_cap': 0.38064205110246263, 'bull_strategy': 'mean_reversion', 'bull_bb_std_mult': 2.7546569469826103, 'bull_rsi_os': 43, 'bull_rsi_ob': 60, 'bull_adx_thresh': 16.3995363280606, 'bull_atr_min_pct': 0.004822021803211983, 'bull_atr_max_pct': 0.05526942971463063, 'bull_tp_mult': 1.3627854545900782, 'bull_tsl_mult': 0.8450325979275494, 'bull_time_stop': 264, 'bull_use_sma': False, 'bull_use_ema': True, 'bull_use_atr': True, 'bull_use_adx': True, 'bull_use_spike': True, 'bull_rsi_required': True, 'bear_strategy': 'breakout', 'bear_bb_std_mult': 3.0983054386625604, 'bear_rsi_os': 43, 'bear_rsi_ob': 84, 'bear_adx_thresh': 32.00643375608145, 'bear_atr_min_pct': 0.006043097328170747, 'bear_atr_max_pct': 0.05031213224308442, 'bear_tp_mult': 2.464383670430748, 'bear_tsl_mult': 0.741513707427527, 'bear_time_stop': 263, 'bear_use_sma': False, 'bear_use_ema': True, 'bear_use_atr': True, 'bear_use_adx': True, 'bear_use_spike': True, 'bear_rsi_required': True, 'sideways_strategy': 'mean_reversion', 'sideways_bb_std_mult': 1.710065436241599, 'sideways_rsi_os': 17, 'sideways_rsi_ob': 95, 'sideways_adx_thresh': 12.560382244375365, 'sideways_atr_min_pct': 0.029511180610334083, 'sideways_atr_max_pct': 0.11502279907778762, 'sideways_tp_mult': 1.1181010502430142, 'sideways_tsl_mult': 0.5770804839465467, 'sideways_time_stop': 154, 'sideways_use_sma': False, 'sideways_use_ema': False, 'sideways_use_atr': False, 'sideways_use_adx': False, 'sideways_use_spike': True, 'sideways_rsi_required': True}.
[I 2025-09-01 08:39:41,047] Trial 450 finished with values: [-1000000000.0, 1000000000.0] and parameters: {'p_sma': 38, 'p_std': 30, 'p_atr': 19, 'p_adx': 18, 'rsi_period': 49, 'ema1': 12, 'ema2': 11, 'slip_atr_k': 0.021977237216867646, 'slip_spread_k': 0.17895775623868712, 'spread_hl_frac': 0.029636921123552495, 'bb_std_mult': 2.31647825697832, 'rsi_os': 40, 'rsi_ob': 94, 'vol_spike': 0.2722884944959669, 'adx_thresh': 31.305044013395293, 'atr_min_pct': 0.00034586731288795483, 'atr_max_pct': 0.11149188129931241, 'tp_mult': 1.4811683012565522, 'tsl_mult': 0.2458297784452922, 'strategy': 'mean_reversion', 'time_stop': 53, 'use_sma': True, 'use_atr': True, 'use_adx': False, 'use_ema': False, 'use_spike': False, 'rsi_required': False, 'edge_k': 0.8096831497878778, 'edge_cap': 0.5215187384537824, 'bull_strategy': 'mean_reversion', 'bull_bb_std_mult': 2.775197850762635, 'bull_rsi_os': 43, 'bull_rsi_ob': 57, 'bull_adx_thresh': 15.15356380688631, 'bull_atr_min_pct': 0.021557068852941424, 'bull_atr_max_pct': 0.055010714043337426, 'bull_tp_mult': 1.3879083167412265, 'bull_tsl_mult': 0.762194977880283, 'bull_time_stop': 12, 'bull_use_sma': False, 'bull_use_ema': True, 'bull_use_atr': True, 'bull_use_adx': True, 'bull_use_spike': True, 'bull_rsi_required': True, 'bear_strategy': 'breakout', 'bear_bb_std_mult': 1.869791125722982, 'bear_rsi_os': 43, 'bear_rsi_ob': 84, 'bear_adx_thresh': 7.416209808895941, 'bear_atr_min_pct': 0.005768737415029711, 'bear_atr_max_pct': 0.050359023685128526, 'bear_tp_mult': 2.4984683047239464, 'bear_tsl_mult': 0.6373064701899387, 'bear_time_stop': 262, 'bear_use_sma': False, 'bear_use_ema': True, 'bear_use_atr': True, 'bear_use_adx': True, 'bear_use_spike': True, 'bear_rsi_required': True, 'sideways_strategy': 'mean_reversion', 'sideways_bb_std_mult': 1.6914443214561956, 'sideways_rsi_os': 17, 'sideways_rsi_ob': 95, 'sideways_adx_thresh': 12.432681025753336, 'sideways_atr_min_pct': 0.029953965251799167, 'sideways_atr_max_pct': 0.085234952298895, 'sideways_tp_mult': 1.104871174675821, 'sideways_tsl_mult': 0.4094897605240853, 'sideways_time_stop': 157, 'sideways_use_sma': False, 'sideways_use_ema': False, 'sideways_use_atr': False, 'sideways_use_adx': False, 'sideways_use_spike': True, 'sideways_rsi_required': True}.
[I 2025-09-01 08:39:41,353] Trial 447 finished with values: [-1000000000.0, 1000000000.0] and parameters: {'p_sma': 53, 'p_std': 31, 'p_atr': 18, 'p_adx': 19, 'rsi_period': 50, 'ema1': 12, 'ema2': 11, 'slip_atr_k': 0.023905023681094876, 'slip_spread_k': 0.17974432323509323, 'spread_hl_frac': 0.029558136873768966, 'bb_std_mult': 2.423425607007843, 'rsi_os': 41, 'rsi_ob': 94, 'vol_spike': 0.16409739848473182, 'adx_thresh': 31.63901629608417, 'atr_min_pct': 0.0005878715266008274, 'atr_max_pct': 0.1141136847535905, 'tp_mult': 1.4724305492946006, 'tsl_mult': 0.25410490087767257, 'strategy': 'mean_reversion', 'time_stop': 55, 'use_sma': True, 'use_atr': True, 'use_adx': False, 'use_ema': False, 'use_spike': False, 'rsi_required': False, 'edge_k': 0.49434776665022084, 'edge_cap': 0.3783492094713953, 'bull_strategy': 'mean_reversion', 'bull_bb_std_mult': 2.8309927314398595, 'bull_rsi_os': 43, 'bull_rsi_ob': 57, 'bull_adx_thresh': 16.348456859042983, 'bull_atr_min_pct': 0.006382375166903199, 'bull_atr_max_pct': 0.05549713069144374, 'bull_tp_mult': 1.404576669307453, 'bull_tsl_mult': 0.9099732614100183, 'bull_time_stop': 134, 'bull_use_sma': False, 'bull_use_ema': True, 'bull_use_atr': True, 'bull_use_adx': True, 'bull_use_spike': True, 'bull_rsi_required': True, 'bear_strategy': 'breakout', 'bear_bb_std_mult': 1.088080685918077, 'bear_rsi_os': 43, 'bear_rsi_ob': 84, 'bear_adx_thresh': 7.50157887683263, 'bear_atr_min_pct': 0.005868542673515972, 'bear_atr_max_pct': 0.044978975890210056, 'bear_tp_mult': 2.472729701375136, 'bear_tsl_mult': 0.08190351352932138, 'bear_time_stop': 259, 'bear_use_sma': False, 'bear_use_ema': True, 'bear_use_atr': True, 'bear_use_adx': True, 'bear_use_spike': True, 'bear_rsi_required': True, 'sideways_strategy': 'mean_reversion', 'sideways_bb_std_mult': 1.8650773049684446, 'sideways_rsi_os': 17, 'sideways_rsi_ob': 95, 'sideways_adx_thresh': 12.460673577050711, 'sideways_atr_min_pct': 0.02999841026273616, 'sideways_atr_max_pct': 0.11358636280251087, 'sideways_tp_mult': 1.1144862038638446, 'sideways_tsl_mult': 0.577079650563715, 'sideways_time_stop': 159, 'sideways_use_sma': False, 'sideways_use_ema': False, 'sideways_use_atr': False, 'sideways_use_adx': False, 'sideways_use_spike': True, 'sideways_rsi_required': True}.
