[I 2025-09-01 08:15:26,726] Trial 315 finished with values: [-1000000000.0, 1000000000.0] and parameters: {'p_sma': 26, 'p_std': 16, 'p_atr': 22, 'p_adx': 10, 'rsi_period': 56, 'ema1': 13, 'ema2': 23, 'slip_atr_k': 0.0731802964434951, 'slip_spread_k': 0.8093689700721, 'spread_hl_frac': 0.01563254663771592, 'bb_std_mult': 3.5249154506703766, 'rsi_os': 25, 'rsi_ob': 93, 'vol_spike': 0.042293284375099216, 'adx_thresh': 26.829224042342613, 'atr_min_pct': 0.0037126626274481406, 'atr_max_pct': 0.12282617765737362, 'tp_mult': 1.8990052458586988, 'tsl_mult': 0.829575550915332, 'strategy': 'mean_reversion', 'time_stop': 166, 'use_sma': True, 'use_atr': False, 'use_adx': False, 'use_ema': True, 'use_spike': True, 'rsi_required': True, 'edge_k': 0.804049039627914, 'edge_cap': 0.2013916727603714, 'bull_strategy': 'breakout', 'bull_bb_std_mult': 2.627520854476799, 'bull_rsi_os': 40, 'bull_rsi_ob': 47, 'bull_adx_thresh': 8.846257071899476, 'bull_atr_min_pct': 0.02285372839650259, 'bull_atr_max_pct': 0.03252504655467437, 'bull_tp_mult': 1.5183404383857566, 'bull_tsl_mult': 0.7876465385291975, 'bull_time_stop': 81, 'bull_use_sma': False, 'bull_use_ema': False, 'bull_use_atr': True, 'bull_use_adx': True, 'bull_use_spike': True, 'bull_rsi_required': True, 'bear_strategy': 'breakout', 'bear_bb_std_mult': 1.788986494566565, 'bear_rsi_os': 46, 'bear_rsi_ob': 82, 'bear_adx_thresh': 30.34248488355658, 'bear_atr_min_pct': 0.008460329007892963, 'bear_atr_max_pct': 0.08649266601614254, 'bear_tp_mult': 2.649446215487928, 'bear_tsl_mult': 0.1309651956912185, 'bear_time_stop': 212, 'bear_use_sma': True, 'bear_use_ema': True, 'bear_use_atr': True, 'bear_use_adx': False, 'bear_use_spike': True, 'bear_rsi_required': True, 'sideways_strategy': 'breakout', 'sideways_bb_std_mult': 1.6790521647097887, 'sideways_rsi_os': 11, 'sideways_rsi_ob': 93, 'sideways_adx_thresh': 10.114439119329866, 'sideways_atr_min_pct': 0.023605825421191724, 'sideways_atr_max_pct': 0.020432350112729203, 'sideways_tp_mult': 2.3425514631735176, 'sideways_tsl_mult': 0.09401128957449253, 'sideways_time_stop': 9, 'sideways_use_sma': True, 'sideways_use_ema': True, 'sideways_use_atr': True, 'sideways_use_adx': True, 'sideways_use_spike': False, 'sideways_rsi_required': False}.
[I 2025-09-01 08:16:06,349] Trial 317 finished with values: [-1000000000.0, 1000000000.0] and parameters: {'p_sma': 24, 'p_std': 53, 'p_atr': 23, 'p_adx': 10, 'rsi_period': 55, 'ema1': 8, 'ema2': 20, 'slip_atr_k': 0.07284339416405074, 'slip_spread_k': 0.859461443071084, 'spread_hl_frac': 0.014572717209934015, 'bb_std_mult': 2.7429552510351374, 'rsi_os': 22, 'rsi_ob': 93, 'vol_spike': 0.19403004247302993, 'adx_thresh': 29.246372076044555, 'atr_min_pct': 0.00440337742252539, 'atr_max_pct': 0.1225924370928311, 'tp_mult': 1.3863010213948375, 'tsl_mult': 0.8268946336947285, 'strategy': 'breakout', 'time_stop': 266, 'use_sma': True, 'use_atr': False, 'use_adx': True, 'use_ema': True, 'use_spike': True, 'rsi_required': True, 'edge_k': 0.7915047010196903, 'edge_cap': 0.27033572790786436, 'bull_strategy': 'breakout', 'bull_bb_std_mult': 1.8096141935710446, 'bull_rsi_os': 49, 'bull_rsi_ob': 47, 'bull_adx_thresh': 7.525246089921746, 'bull_atr_min_pct': 0.0034881410487113784, 'bull_atr_max_pct': 0.02233634287635798, 'bull_tp_mult': 1.6525264435852407, 'bull_tsl_mult': 0.6467916827309597, 'bull_time_stop': 81, 'bull_use_sma': False, 'bull_use_ema': True, 'bull_use_atr': False, 'bull_use_adx': False, 'bull_use_spike': True, 'bull_rsi_required': True, 'bear_strategy': 'breakout', 'bear_bb_std_mult': 1.7778687976950627, 'bear_rsi_os': 14, 'bear_rsi_ob': 81, 'bear_adx_thresh': 28.862838053374983, 'bear_atr_min_pct': 0.003601969160428601, 'bear_atr_max_pct': 0.08729597117607193, 'bear_tp_mult': 2.0144786986759318, 'bear_tsl_mult': 0.1392228110507883, 'bear_time_stop': 41, 'bear_use_sma': True, 'bear_use_ema': False, 'bear_use_atr': True, 'bear_use_adx': False, 'bear_use_spike': False, 'bear_rsi_required': False, 'sideways_strategy': 'breakout', 'sideways_bb_std_mult': 1.39442102951562, 'sideways_rsi_os': 6, 'sideways_rsi_ob': 92, 'sideways_adx_thresh': 10.092741940176749, 'sideways_atr_min_pct': 0.00445482934835687, 'sideways_atr_max_pct': 0.12446728054206657, 'sideways_tp_mult': 1.6816398212211654, 'sideways_tsl_mult': 0.19320404872583807, 'sideways_time_stop': 282, 'sideways_use_sma': True, 'sideways_use_ema': True, 'sideways_use_atr': True, 'sideways_use_adx': True, 'sideways_use_spike': False, 'sideways_rsi_required': False}.
[I 2025-09-01 08:16:06,356] Trial 318 finished with values: [-1000000000.0, 1000000000.0] and parameters: {'p_sma': 28, 'p_std': 16, 'p_atr': 25, 'p_adx': 29, 'rsi_period': 60, 'ema1': 17, 'ema2': 20, 'slip_atr_k': 0.10251130143082082, 'slip_spread_k': 0.8575473312322281, 'spread_hl_frac': 0.038682281760644664, 'bb_std_mult': 1.0874058576968253, 'rsi_os': 25, 'rsi_ob': 55, 'vol_spike': 0.04066700702508273, 'adx_thresh': 29.198878724532438, 'atr_min_pct': 0.004629078940148896, 'atr_max_pct': 0.12122148094898824, 'tp_mult': 1.3572581519209177, 'tsl_mult': 0.7012925792108071, 'strategy': 'breakout', 'time_stop': 250, 'use_sma': True, 'use_atr': False, 'use_adx': True, 'use_ema': True, 'use_spike': True, 'rsi_required': True, 'edge_k': 0.29074846598702236, 'edge_cap': 0.6584920681456976, 'bull_strategy': 'breakout', 'bull_bb_std_mult': 1.8099089599168772, 'bull_rsi_os': 40, 'bull_rsi_ob': 56, 'bull_adx_thresh': 7.464568312903801, 'bull_atr_min_pct': 0.006751727159614517, 'bull_atr_max_pct': 0.07021760302044273, 'bull_tp_mult': 2.9667135644975144, 'bull_tsl_mult': 0.6517789737232065, 'bull_time_stop': 43, 'bull_use_sma': False, 'bull_use_ema': True, 'bull_use_atr': False, 'bull_use_adx': False, 'bull_use_spike': True, 'bull_rsi_required': True, 'bear_strategy': 'breakout', 'bear_bb_std_mult': 1.7901063556281809, 'bear_rsi_os': 47, 'bear_rsi_ob': 82, 'bear_adx_thresh': 33.375153281898626, 'bear_atr_min_pct': 0.003399911505707093, 'bear_atr_max_pct': 0.06976881266362303, 'bear_tp_mult': 2.2844066001730843, 'bear_tsl_mult': 0.1833524996327449, 'bear_time_stop': 281, 'bear_use_sma': True, 'bear_use_ema': False, 'bear_use_atr': True, 'bear_use_adx': False, 'bear_use_spike': False, 'bear_rsi_required': False, 'sideways_strategy': 'breakout', 'sideways_bb_std_mult': 3.3636721341239015, 'sideways_rsi_os': 6, 'sideways_rsi_ob': 68, 'sideways_adx_thresh': 18.91418209378147, 'sideways_atr_min_pct': 0.028263375352460055, 'sideways_atr_max_pct': 0.010249346791467854, 'sideways_tp_mult': 1.2978506570556743, 'sideways_tsl_mult': 0.036230766852417495, 'sideways_time_stop': 219, 'sideways_use_sma': True, 'sideways_use_ema': True, 'sideways_use_atr': True, 'sideways_use_adx': True, 'sideways_use_spike': False, 'sideways_rsi_required': False}.
[I 2025-09-01 08:16:07,129] Trial 316 finished with values: [-1000000000.0, 1000000000.0] and parameters: {'p_sma': 24, 'p_std': 48, 'p_atr': 22, 'p_adx': 10, 'rsi_period': 71, 'ema1': 9, 'ema2': 22, 'slip_atr_k': 0.0060454255139505905, 'slip_spread_k': 0.8176756850658696, 'spread_hl_frac': 0.01473764302412789, 'bb_std_mult': 3.5214506397344842, 'rsi_os': 33, 'rsi_ob': 93, 'vol_spike': 0.05905864482484652, 'adx_thresh': 29.27370560304887, 'atr_min_pct': 0.004549150607349857, 'atr_max_pct': 0.1225429427668615, 'tp_mult': 2.2371669398650416, 'tsl_mult': 0.04226543895036194, 'strategy': 'breakout', 'time_stop': 170, 'use_sma': True, 'use_atr': False, 'use_adx': True, 'use_ema': True, 'use_spike': True, 'rsi_required': True, 'edge_k': 0.3144787663205315, 'edge_cap': 0.19930872929861937, 'bull_strategy': 'breakout', 'bull_bb_std_mult': 3.2106579240705493, 'bull_rsi_os': 52, 'bull_rsi_ob': 47, 'bull_adx_thresh': 7.372026454829234, 'bull_atr_min_pct': 0.0035516932747794655, 'bull_atr_max_pct': 0.14003189677893646, 'bull_tp_mult': 1.6510715520462669, 'bull_tsl_mult': 0.7868224947891886, 'bull_time_stop': 299, 'bull_use_sma': False, 'bull_use_ema': False, 'bull_use_atr': False, 'bull_use_adx': False, 'bull_use_spike': True, 'bull_rsi_required': True, 'bear_strategy': 'breakout', 'bear_bb_std_mult': 1.8041168864627484, 'bear_rsi_os': 46, 'bear_rsi_ob': 83, 'bear_adx_thresh': 29.05479330223776, 'bear_atr_min_pct': 0.0035542899406433336, 'bear_atr_max_pct': 0.08564335198737791, 'bear_tp_mult': 2.236610490902998, 'bear_tsl_mult': 0.1408373977775006, 'bear_time_stop': 210, 'bear_use_sma': True, 'bear_use_ema': False, 'bear_use_atr': True, 'bear_use_adx': False, 'bear_use_spike': False, 'bear_rsi_required': False, 'sideways_strategy': 'breakout', 'sideways_bb_std_mult': 1.4056411329360958, 'sideways_rsi_os': 6, 'sideways_rsi_ob': 92, 'sideways_adx_thresh': 9.966470367432992, 'sideways_atr_min_pct': 0.004343998746743925, 'sideways_atr_max_pct': 0.12650045253037645, 'sideways_tp_mult': 1.9775502815639983, 'sideways_tsl_mult': 0.034006564139820394, 'sideways_time_stop': 76, 'sideways_use_sma': True, 'sideways_use_ema': True, 'sideways_use_atr': True, 'sideways_use_adx': True, 'sideways_use_spike': False, 'sideways_rsi_required': False}.
[I 2025-09-01 08:16:07,365] Trial 319 finished with values: [-0.03402234865513276, 0.03390813086703625] and parameters: {'p_sma': 24, 'p_std': 11, 'p_atr': 18, 'p_adx': 29, 'rsi_period': 76, 'ema1': 14, 'ema2': 19, 'slip_atr_k': 0.10469158468704125, 'slip_spread_k': 0.862270262199842, 'spread_hl_frac': 0.014446954901722712, 'bb_std_mult': 2.602767275565398, 'rsi_os': 24, 'rsi_ob': 58, 'vol_spike': 0.06705675639522571, 'adx_thresh': 29.17575144134174, 'atr_min_pct': 0.004527290435501886, 'atr_max_pct': 0.1017291463724509, 'tp_mult': 1.6988165288731918, 'tsl_mult': 0.7036443563937222, 'strategy': 'breakout', 'time_stop': 298, 'use_sma': False, 'use_atr': False, 'use_adx': True, 'use_ema': True, 'use_spike': True, 'rsi_required': True, 'edge_k': 0.9191828723519013, 'edge_cap': 0.27252533460368444, 'bull_strategy': 'breakout', 'bull_bb_std_mult': 2.9852641459659317, 'bull_rsi_os': 24, 'bull_rsi_ob': 72, 'bull_adx_thresh': 7.5014898499595235, 'bull_atr_min_pct': 0.011397997889246935, 'bull_atr_max_pct': 0.09390933122462916, 'bull_tp_mult': 2.9754118235926192, 'bull_tsl_mult': 0.6215440157698235, 'bull_time_stop': 262, 'bull_use_sma': True, 'bull_use_ema': True, 'bull_use_atr': False, 'bull_use_adx': False, 'bull_use_spike': False, 'bull_rsi_required': False, 'bear_strategy': 'mean_reversion', 'bear_bb_std_mult': 2.2929753672463167, 'bear_rsi_os': 47, 'bear_rsi_ob': 52, 'bear_adx_thresh': 33.43130836850221, 'bear_atr_min_pct': 0.0037271460669331302, 'bear_atr_max_pct': 0.023369675335222127, 'bear_tp_mult': 1.855454084020836, 'bear_tsl_mult': 0.8193987631294198, 'bear_time_stop': 281, 'bear_use_sma': True, 'bear_use_ema': False, 'bear_use_atr': True, 'bear_use_adx': False, 'bear_use_spike': False, 'bear_rsi_required': False, 'sideways_strategy': 'breakout', 'sideways_bb_std_mult': 3.3918782626294677, 'sideways_rsi_os': 6, 'sideways_rsi_ob': 92, 'sideways_adx_thresh': 12.116247307992857, 'sideways_atr_min_pct': 0.028304587793171333, 'sideways_atr_max_pct': 0.010194230888263146, 'sideways_tp_mult': 1.200425598910432, 'sideways_tsl_mult': 0.03518710465318871, 'sideways_time_stop': 72, 'sideways_use_sma': True, 'sideways_use_ema': True, 'sideways_use_atr': True, 'sideways_use_adx': True, 'sideways_use_spike': False, 'sideways_rsi_required': True}.
[I 2025-09-01 08:16:49,509] Trial 321 finished with values: [-0.012690764507873653, 0.012586289981798823] and parameters: {'p_sma': 27, 'p_std': 38, 'p_atr': 18, 'p_adx': 27, 'rsi_period': 50, 'ema1': 26, 'ema2': 35, 'slip_atr_k': 0.008400991320633783, 'slip_spread_k': 0.8944235822689731, 'spread_hl_frac': 0.009668852018427649, 'bb_std_mult': 2.2708073365309627, 'rsi_os': 36, 'rsi_ob': 68, 'vol_spike': 0.15829932688266604, 'adx_thresh': 29.870693934770323, 'atr_min_pct': 0.003179616930218996, 'atr_max_pct': 0.09838772370966475, 'tp_mult': 1.6915447595319957, 'tsl_mult': 0.04057483499247366, 'strategy': 'breakout', 'time_stop': 256, 'use_sma': False, 'use_atr': False, 'use_adx': True, 'use_ema': True, 'use_spike': True, 'rsi_required': True, 'edge_k': 0.22488889626441658, 'edge_cap': 0.5445442816138418, 'bull_strategy': 'breakout', 'bull_bb_std_mult': 3.2432167281292323, 'bull_rsi_os': 24, 'bull_rsi_ob': 61, 'bull_adx_thresh': 7.6164964973734195, 'bull_atr_min_pct': 0.0019440913782993883, 'bull_atr_max_pct': 0.08868426596712045, 'bull_tp_mult': 1.5835349974766035, 'bull_tsl_mult': 0.6259911954346705, 'bull_time_stop': 64, 'bull_use_sma': True, 'bull_use_ema': True, 'bull_use_atr': False, 'bull_use_adx': False, 'bull_use_spike': False, 'bull_rsi_required': False, 'bear_strategy': 'mean_reversion', 'bear_bb_std_mult': 1.9076216363583212, 'bear_rsi_os': 24, 'bear_rsi_ob': 54, 'bear_adx_thresh': 5.554239643187161, 'bear_atr_min_pct': 0.007824405637598978, 'bear_atr_max_pct': 0.09759854361206179, 'bear_tp_mult': 2.2178649297064874, 'bear_tsl_mult': 0.0716474463482708, 'bear_time_stop': 300, 'bear_use_sma': True, 'bear_use_ema': False, 'bear_use_atr': False, 'bear_use_adx': False, 'bear_use_spike': False, 'bear_rsi_required': False, 'sideways_strategy': 'breakout', 'sideways_bb_std_mult': 3.0358877530532653, 'sideways_rsi_os': 29, 'sideways_rsi_ob': 90, 'sideways_adx_thresh': 15.144907969186793, 'sideways_atr_min_pct': 0.029050181976846307, 'sideways_atr_max_pct': 0.010174248777433, 'sideways_tp_mult': 1.970823806169103, 'sideways_tsl_mult': 0.2374383362230679, 'sideways_time_stop': 176, 'sideways_use_sma': True, 'sideways_use_ema': True, 'sideways_use_atr': True, 'sideways_use_adx': False, 'sideways_use_spike': True, 'sideways_rsi_required': True}.
[I 2025-09-01 08:16:49,948] Trial 323 finished with values: [-0.04743176789232728, 0.0474746167315869] and parameters: {'p_sma': 27, 'p_std': 40, 'p_atr': 23, 'p_adx': 29, 'rsi_period': 51, 'ema1': 14, 'ema2': 15, 'slip_atr_k': 0.24287249335403369, 'slip_spread_k': 0.9184375858396889, 'spread_hl_frac': 0.0091449295608007, 'bb_std_mult': 2.9376782519518843, 'rsi_os': 32, 'rsi_ob': 67, 'vol_spike': 0.08346768577763417, 'adx_thresh': 30.192658022221465, 'atr_min_pct': 0.0029920527590155447, 'atr_max_pct': 0.1289875753056832, 'tp_mult': 1.651049626946429, 'tsl_mult': 0.9250058008214608, 'strategy': 'breakout', 'time_stop': 256, 'use_sma': False, 'use_atr': False, 'use_adx': True, 'use_ema': True, 'use_spike': True, 'rsi_required': True, 'edge_k': 0.2408916057991751, 'edge_cap': 0.22421571715205796, 'bull_strategy': 'breakout', 'bull_bb_std_mult': 3.2763199848287425, 'bull_rsi_os': 38, 'bull_rsi_ob': 58, 'bull_adx_thresh': 6.31573951134652, 'bull_atr_min_pct': 0.0019755872659158267, 'bull_atr_max_pct': 0.11706598968019284, 'bull_tp_mult': 1.5744499467974042, 'bull_tsl_mult': 0.6208524782476015, 'bull_time_stop': 64, 'bull_use_sma': True, 'bull_use_ema': True, 'bull_use_atr': False, 'bull_use_adx': False, 'bull_use_spike': False, 'bull_rsi_required': False, 'bear_strategy': 'mean_reversion', 'bear_bb_std_mult': 2.6907116135335967, 'bear_rsi_os': 50, 'bear_rsi_ob': 54, 'bear_adx_thresh': 5.459464443956171, 'bear_atr_min_pct': 0.0053870351988690775, 'bear_atr_max_pct': 0.09815178850445003, 'bear_tp_mult': 2.1266448099894086, 'bear_tsl_mult': 0.3651881511631835, 'bear_time_stop': 300, 'bear_use_sma': True, 'bear_use_ema': False, 'bear_use_atr': False, 'bear_use_adx': True, 'bear_use_spike': False, 'bear_rsi_required': False, 'sideways_strategy': 'breakout', 'sideways_bb_std_mult': 1.0964863728864906, 'sideways_rsi_os': 26, 'sideways_rsi_ob': 90, 'sideways_adx_thresh': 12.870358271524662, 'sideways_atr_min_pct': 0.02937837096938673, 'sideways_atr_max_pct': 0.027560204337734026, 'sideways_tp_mult': 1.305223215402888, 'sideways_tsl_mult': 0.15193888008004458, 'sideways_time_stop': 203, 'sideways_use_sma': True, 'sideways_use_ema': True, 'sideways_use_atr': True, 'sideways_use_adx': False, 'sideways_use_spike': True, 'sideways_rsi_required': False}.
[I 2025-09-01 08:16:50,394] Trial 320 finished with values: [-0.011282398904342683, 0.012487510958278434] and parameters: {'p_sma': 27, 'p_std': 35, 'p_atr': 7, 'p_adx': 27, 'rsi_period': 47, 'ema1': 7, 'ema2': 44, 'slip_atr_k': 0.12561772746574718, 'slip_spread_k': 0.23936382178485494, 'spread_hl_frac': 0.00939298164164504, 'bb_std_mult': 1.431723914835078, 'rsi_os': 33, 'rsi_ob': 68, 'vol_spike': 0.06415727984555696, 'adx_thresh': 30.065248293359513, 'atr_min_pct': 0.003183183195275026, 'atr_max_pct': 0.10044778332890897, 'tp_mult': 1.680992746099303, 'tsl_mult': 0.041748094207156645, 'strategy': 'breakout', 'time_stop': 257, 'use_sma': False, 'use_atr': False, 'use_adx': True, 'use_ema': True, 'use_spike': True, 'rsi_required': True, 'edge_k': 1.0036648684211928, 'edge_cap': 0.5791085550258642, 'bull_strategy': 'breakout', 'bull_bb_std_mult': 3.2149539353998584, 'bull_rsi_os': 42, 'bull_rsi_ob': 60, 'bull_adx_thresh': 7.590331708245065, 'bull_atr_min_pct': 0.0036590831351966027, 'bull_atr_max_pct': 0.13929095659235408, 'bull_tp_mult': 1.5730339328194023, 'bull_tsl_mult': 0.6216059339164551, 'bull_time_stop': 300, 'bull_use_sma': True, 'bull_use_ema': True, 'bull_use_atr': False, 'bull_use_adx': False, 'bull_use_spike': False, 'bull_rsi_required': False, 'bear_strategy': 'mean_reversion', 'bear_bb_std_mult': 1.9009510329124122, 'bear_rsi_os': 24, 'bear_rsi_ob': 52, 'bear_adx_thresh': 5.516698174527019, 'bear_atr_min_pct': 0.0093766668563003, 'bear_atr_max_pct': 0.07504491730639341, 'bear_tp_mult': 2.222088385966585, 'bear_tsl_mult': 0.6382032536505979, 'bear_time_stop': 291, 'bear_use_sma': True, 'bear_use_ema': False, 'bear_use_atr': False, 'bear_use_adx': False, 'bear_use_spike': False, 'bear_rsi_required': False, 'sideways_strategy': 'breakout', 'sideways_bb_std_mult': 0.8747229663038616, 'sideways_rsi_os': 30, 'sideways_rsi_ob': 90, 'sideways_adx_thresh': 11.981742455920275, 'sideways_atr_min_pct': 0.02921231121019527, 'sideways_atr_max_pct': 0.014630701180287024, 'sideways_tp_mult': 1.2127590308580098, 'sideways_tsl_mult': 0.9195417344262996, 'sideways_time_stop': 200, 'sideways_use_sma': True, 'sideways_use_ema': True, 'sideways_use_atr': True, 'sideways_use_adx': False, 'sideways_use_spike': True, 'sideways_rsi_required': True}.
[I 2025-09-01 08:16:50,680] Trial 322 finished with values: [-0.01771686683756657, 0.01762960240904165] and parameters: {'p_sma': 27, 'p_std': 43, 'p_atr': 30, 'p_adx': 29, 'rsi_period': 51, 'ema1': 14, 'ema2': 35, 'slip_atr_k': 0.1252417081386497, 'slip_spread_k': 0.9186750558648977, 'spread_hl_frac': 0.035640505008381645, 'bb_std_mult': 1.9223508620671395, 'rsi_os': 32, 'rsi_ob': 92, 'vol_spike': 0.17731817983266387, 'adx_thresh': 30.07301589817898, 'atr_min_pct': 0.011526387503379792, 'atr_max_pct': 0.12886549628213584, 'tp_mult': 1.6828149542047357, 'tsl_mult': 0.7510624540680837, 'strategy': 'breakout', 'time_stop': 258, 'use_sma': False, 'use_atr': False, 'use_adx': True, 'use_ema': True, 'use_spike': True, 'rsi_required': True, 'edge_k': 0.2423671107216289, 'edge_cap': 0.2156899161325464, 'bull_strategy': 'breakout', 'bull_bb_std_mult': 3.2167423569299034, 'bull_rsi_os': 43, 'bull_rsi_ob': 45, 'bull_adx_thresh': 6.606276926878887, 'bull_atr_min_pct': 0.0019648085480508948, 'bull_atr_max_pct': 0.08932495155226818, 'bull_tp_mult': 1.5813939839223892, 'bull_tsl_mult': 0.6222909833811389, 'bull_time_stop': 64, 'bull_use_sma': True, 'bull_use_ema': True, 'bull_use_atr': False, 'bull_use_adx': False, 'bull_use_spike': False, 'bull_rsi_required': False, 'bear_strategy': 'mean_reversion', 'bear_bb_std_mult': 2.304347399424608, 'bear_rsi_os': 24, 'bear_rsi_ob': 46, 'bear_adx_thresh': 7.895317811260031, 'bear_atr_min_pct': 0.016897168841293025, 'bear_atr_max_pct': 0.09889198249550032, 'bear_tp_mult': 2.1275194133536943, 'bear_tsl_mult': 0.6472515787371012, 'bear_time_stop': 300, 'bear_use_sma': True, 'bear_use_ema': False, 'bear_use_atr': False, 'bear_use_adx': False, 'bear_use_spike': False, 'bear_rsi_required': False, 'sideways_strategy': 'breakout', 'sideways_bb_std_mult': 1.0914205199953826, 'sideways_rsi_os': 29, 'sideways_rsi_ob': 94, 'sideways_adx_thresh': 13.099344019177044, 'sideways_atr_min_pct': 0.029076925336350062, 'sideways_atr_max_pct': 0.10140881239791694, 'sideways_tp_mult': 1.3124673019727058, 'sideways_tsl_mult': 0.7942752835736475, 'sideways_time_stop': 201, 'sideways_use_sma': True, 'sideways_use_ema': True, 'sideways_use_atr': True, 'sideways_use_adx': False, 'sideways_use_spike': True, 'sideways_rsi_required': True}.
