[I 2025-09-01 08:13:45,101] Trial 305 finished with values: [-0.036421466799111624, 0.03620462684195924] and parameters: {'p_sma': 27, 'p_std': 26, 'p_atr': 21, 'p_adx': 7, 'rsi_period': 58, 'ema1': 10, 'ema2': 41, 'slip_atr_k': 0.1947421515606322, 'slip_spread_k': 0.8910697390602025, 'spread_hl_frac': 0.010484747060209864, 'bb_std_mult': 3.1195348784257266, 'rsi_os': 30, 'rsi_ob': 78, 'vol_spike': 0.056142698218944104, 'adx_thresh': 31.331287144550416, 'atr_min_pct': 0.007671164819811676, 'atr_max_pct': 0.010023936371674522, 'tp_mult': 1.7284458642364076, 'tsl_mult': 0.10418375614896092, 'strategy': 'breakout', 'time_stop': 240, 'use_sma': False, 'use_atr': True, 'use_adx': True, 'use_ema': True, 'use_spike': True, 'rsi_required': True, 'edge_k': 1.5705888736505418, 'edge_cap': 0.25501643306339034, 'bull_strategy': 'mean_reversion', 'bull_bb_std_mult': 3.151452061625583, 'bull_rsi_os': 28, 'bull_rsi_ob': 86, 'bull_adx_thresh': 25.82537934059329, 'bull_atr_min_pct': 0.00423637726460978, 'bull_atr_max_pct': 0.14883331291359975, 'bull_tp_mult': 1.3969542017957564, 'bull_tsl_mult': 0.7062290544218962, 'bull_time_stop': 58, 'bull_use_sma': True, 'bull_use_ema': True, 'bull_use_atr': False, 'bull_use_adx': False, 'bull_use_spike': False, 'bull_rsi_required': False, 'bear_strategy': 'mean_reversion', 'bear_bb_std_mult': 1.6753524405733924, 'bear_rsi_os': 44, 'bear_rsi_ob': 78, 'bear_adx_thresh': 5.039842389031064, 'bear_atr_min_pct': 0.004473335177664105, 'bear_atr_max_pct': 0.09433363445089907, 'bear_tp_mult': 2.095452885019536, 'bear_tsl_mult': 0.052314772411134906, 'bear_time_stop': 253, 'bear_use_sma': True, 'bear_use_ema': False, 'bear_use_atr': True, 'bear_use_adx': False, 'bear_use_spike': False, 'bear_rsi_required': False, 'sideways_strategy': 'mean_reversion', 'sideways_bb_std_mult': 1.1867783732397261, 'sideways_rsi_os': 5, 'sideways_rsi_ob': 65, 'sideways_adx_thresh': 11.461509528458977, 'sideways_atr_min_pct': 0.029211055272494537, 'sideways_atr_max_pct': 0.015715732018980834, 'sideways_tp_mult': 1.4297476586609386, 'sideways_tsl_mult': 0.972304303011917, 'sideways_time_stop': 207, 'sideways_use_sma': True, 'sideways_use_ema': True, 'sideways_use_atr': False, 'sideways_use_adx': True, 'sideways_use_spike': False, 'sideways_rsi_required': True}.
[I 2025-09-01 08:13:45,840] Trial 304 finished with values: [-0.029305759844378, 0.030088393186705205] and parameters: {'p_sma': 29, 'p_std': 57, 'p_atr': 24, 'p_adx': 7, 'rsi_period': 44, 'ema1': 15, 'ema2': 14, 'slip_atr_k': 0.013929453369571427, 'slip_spread_k': 0.7190676614971545, 'spread_hl_frac': 0.04026666742728978, 'bb_std_mult': 2.514943021647491, 'rsi_os': 30, 'rsi_ob': 48, 'vol_spike': 0.22232359902500937, 'adx_thresh': 31.390654730116907, 'atr_min_pct': 0.004940521396961425, 'atr_max_pct': 0.08147970298841309, 'tp_mult': 1.7318932369503628, 'tsl_mult': 0.10587803330663076, 'strategy': 'breakout', 'time_stop': 240, 'use_sma': False, 'use_atr': True, 'use_adx': True, 'use_ema': True, 'use_spike': True, 'rsi_required': True, 'edge_k': 0.7180480159532677, 'edge_cap': 0.17272854446371325, 'bull_strategy': 'mean_reversion', 'bull_bb_std_mult': 2.7079205904732895, 'bull_rsi_os': 46, 'bull_rsi_ob': 86, 'bull_adx_thresh': 8.280674246483485, 'bull_atr_min_pct': 0.00433100111872991, 'bull_atr_max_pct': 0.04010388476422573, 'bull_tp_mult': 1.455609078442981, 'bull_tsl_mult': 0.8761339060341415, 'bull_time_stop': 59, 'bull_use_sma': True, 'bull_use_ema': True, 'bull_use_atr': False, 'bull_use_adx': False, 'bull_use_spike': False, 'bull_rsi_required': False, 'bear_strategy': 'mean_reversion', 'bear_bb_std_mult': 1.8551532118070815, 'bear_rsi_os': 44, 'bear_rsi_ob': 85, 'bear_adx_thresh': 6.786091344933566, 'bear_atr_min_pct': 0.002114713482657918, 'bear_atr_max_pct': 0.07827514026520817, 'bear_tp_mult': 2.4750135079739346, 'bear_tsl_mult': 0.2586643100230125, 'bear_time_stop': 63, 'bear_use_sma': True, 'bear_use_ema': False, 'bear_use_atr': True, 'bear_use_adx': False, 'bear_use_spike': False, 'bear_rsi_required': False, 'sideways_strategy': 'mean_reversion', 'sideways_bb_std_mult': 2.232913867530096, 'sideways_rsi_os': 5, 'sideways_rsi_ob': 89, 'sideways_adx_thresh': 17.782502848202604, 'sideways_atr_min_pct': 0.02752747220122214, 'sideways_atr_max_pct': 0.06740758835426917, 'sideways_tp_mult': 1.4360546858209593, 'sideways_tsl_mult': 0.13100082697986937, 'sideways_time_stop': 155, 'sideways_use_sma': True, 'sideways_use_ema': True, 'sideways_use_atr': False, 'sideways_use_adx': False, 'sideways_use_spike': True, 'sideways_rsi_required': False}.
[I 2025-09-01 08:14:36,989] Trial 310 finished with values: [-1000000000.0, 1000000000.0] and parameters: {'p_sma': 29, 'p_std': 37, 'p_atr': 27, 'p_adx': 12, 'rsi_period': 53, 'ema1': 23, 'ema2': 11, 'slip_atr_k': 0.16874677162132, 'slip_spread_k': 0.716513055430319, 'spread_hl_frac': 0.01235533002193566, 'bb_std_mult': 3.247657254588109, 'rsi_os': 38, 'rsi_ob': 72, 'vol_spike': 0.061837712002356354, 'adx_thresh': 30.428265009963923, 'atr_min_pct': 0.006274023551278526, 'atr_max_pct': 0.0828454480185575, 'tp_mult': 1.7898417990893742, 'tsl_mult': 0.2996111652979492, 'strategy': 'breakout', 'time_stop': 255, 'use_sma': False, 'use_atr': False, 'use_adx': True, 'use_ema': True, 'use_spike': True, 'rsi_required': True, 'edge_k': 1.1654533361848056, 'edge_cap': 0.214233730712335, 'bull_strategy': 'breakout', 'bull_bb_std_mult': 3.1101835057756735, 'bull_rsi_os': 44, 'bull_rsi_ob': 54, 'bull_adx_thresh': 6.072849288819115, 'bull_atr_min_pct': 0.009572523540688634, 'bull_atr_max_pct': 0.13089339524527777, 'bull_tp_mult': 1.4448518848231728, 'bull_tsl_mult': 0.8782909954316304, 'bull_time_stop': 74, 'bull_use_sma': True, 'bull_use_ema': True, 'bull_use_atr': False, 'bull_use_adx': False, 'bull_use_spike': False, 'bull_rsi_required': False, 'bear_strategy': 'mean_reversion', 'bear_bb_std_mult': 1.9574582425446714, 'bear_rsi_os': 48, 'bear_rsi_ob': 92, 'bear_adx_thresh': 6.59039107314144, 'bear_atr_min_pct': 0.00612501618583907, 'bear_atr_max_pct': 0.10187777155343704, 'bear_tp_mult': 2.1951695971229808, 'bear_tsl_mult': 0.09636996440574233, 'bear_time_stop': 224, 'bear_use_sma': False, 'bear_use_ema': False, 'bear_use_atr': False, 'bear_use_adx': True, 'bear_use_spike': False, 'bear_rsi_required': False, 'sideways_strategy': 'breakout', 'sideways_bb_std_mult': 0.9790621456172324, 'sideways_rsi_os': 9, 'sideways_rsi_ob': 83, 'sideways_adx_thresh': 20.618539020112397, 'sideways_atr_min_pct': 0.0209783464680003, 'sideways_atr_max_pct': 0.012154035665249956, 'sideways_tp_mult': 1.3663916882479927, 'sideways_tsl_mult': 0.16252500962942107, 'sideways_time_stop': 47, 'sideways_use_sma': True, 'sideways_use_ema': True, 'sideways_use_atr': True, 'sideways_use_adx': True, 'sideways_use_spike': False, 'sideways_rsi_required': False}.
[I 2025-09-01 08:14:36,999] Trial 308 finished with values: [-1000000000.0, 1000000000.0] and parameters: {'p_sma': 29, 'p_std': 37, 'p_atr': 23, 'p_adx': 7, 'rsi_period': 44, 'ema1': 12, 'ema2': 40, 'slip_atr_k': 0.01663279646453014, 'slip_spread_k': 0.9983025540546415, 'spread_hl_frac': 0.011927387611501028, 'bb_std_mult': 3.1412528582679653, 'rsi_os': 31, 'rsi_ob': 75, 'vol_spike': 0.29643208681822575, 'adx_thresh': 29.043018076048508, 'atr_min_pct': 0.003164958310693343, 'atr_max_pct': 0.04935534331694946, 'tp_mult': 1.7773495054672805, 'tsl_mult': 0.07950856112443633, 'strategy': 'breakout', 'time_stop': 239, 'use_sma': False, 'use_atr': True, 'use_adx': True, 'use_ema': True, 'use_spike': True, 'rsi_required': True, 'edge_k': 0.37332150519274754, 'edge_cap': 0.25416219908944965, 'bull_strategy': 'mean_reversion', 'bull_bb_std_mult': 2.5148649224922943, 'bull_rsi_os': 7, 'bull_rsi_ob': 74, 'bull_adx_thresh': 6.994970759407014, 'bull_atr_min_pct': 0.009556107817049367, 'bull_atr_max_pct': 0.1100617899431701, 'bull_tp_mult': 1.4565444710868212, 'bull_tsl_mult': 0.5857479358388963, 'bull_time_stop': 218, 'bull_use_sma': True, 'bull_use_ema': True, 'bull_use_atr': False, 'bull_use_adx': False, 'bull_use_spike': False, 'bull_rsi_required': False, 'bear_strategy': 'mean_reversion', 'bear_bb_std_mult': 2.0204641205079117, 'bear_rsi_os': 40, 'bear_rsi_ob': 87, 'bear_adx_thresh': 6.8704004407859784, 'bear_atr_min_pct': 0.006229643200148025, 'bear_atr_max_pct': 0.08173654241800307, 'bear_tp_mult': 2.1974022697673803, 'bear_tsl_mult': 0.09576304942724301, 'bear_time_stop': 241, 'bear_use_sma': True, 'bear_use_ema': False, 'bear_use_atr': False, 'bear_use_adx': False, 'bear_use_spike': False, 'bear_rsi_required': False, 'sideways_strategy': 'mean_reversion', 'sideways_bb_std_mult': 2.294847038015951, 'sideways_rsi_os': 15, 'sideways_rsi_ob': 65, 'sideways_adx_thresh': 11.281502953715203, 'sideways_atr_min_pct': 0.013285027783161988, 'sideways_atr_max_pct': 0.012771176301741627, 'sideways_tp_mult': 1.1512629369824647, 'sideways_tsl_mult': 0.7097349417768747, 'sideways_time_stop': 156, 'sideways_use_sma': True, 'sideways_use_ema': True, 'sideways_use_atr': False, 'sideways_use_adx': True, 'sideways_use_spike': False, 'sideways_rsi_required': False}.
[I 2025-09-01 08:14:37,747] Trial 309 finished with values: [-1000000000.0, 1000000000.0] and parameters: {'p_sma': 31, 'p_std': 26, 'p_atr': 17, 'p_adx': 30, 'rsi_period': 28, 'ema1': 12, 'ema2': 50, 'slip_atr_k': 0.06168423184680593, 'slip_spread_k': 0.8837600061161482, 'spread_hl_frac': 0.012634473217609818, 'bb_std_mult': 3.128626577495102, 'rsi_os': 31, 'rsi_ob': 48, 'vol_spike': 0.05129474761274192, 'adx_thresh': 30.554732145223408, 'atr_min_pct': 0.006120247636716898, 'atr_max_pct': 0.14039257135372554, 'tp_mult': 2.734692688373946, 'tsl_mult': 0.2888178815600192, 'strategy': 'breakout', 'time_stop': 239, 'use_sma': False, 'use_atr': True, 'use_adx': True, 'use_ema': True, 'use_spike': True, 'rsi_required': True, 'edge_k': 0.3845645116077948, 'edge_cap': 0.8614546946848597, 'bull_strategy': 'mean_reversion', 'bull_bb_std_mult': 3.471755553313608, 'bull_rsi_os': 7, 'bull_rsi_ob': 67, 'bull_adx_thresh': 12.921124509104363, 'bull_atr_min_pct': 0.008860674116677965, 'bull_atr_max_pct': 0.1092800997813339, 'bull_tp_mult': 1.4458407513964926, 'bull_tsl_mult': 0.8663989350779475, 'bull_time_stop': 61, 'bull_use_sma': True, 'bull_use_ema': True, 'bull_use_atr': False, 'bull_use_adx': False, 'bull_use_spike': False, 'bull_rsi_required': False, 'bear_strategy': 'mean_reversion', 'bear_bb_std_mult': 1.5131090683652382, 'bear_rsi_os': 17, 'bear_rsi_ob': 85, 'bear_adx_thresh': 6.969309942027314, 'bear_atr_min_pct': 0.0021516950833652747, 'bear_atr_max_pct': 0.13410552901760064, 'bear_tp_mult': 2.477488231736233, 'bear_tsl_mult': 0.05236742825923061, 'bear_time_stop': 287, 'bear_use_sma': False, 'bear_use_ema': False, 'bear_use_atr': False, 'bear_use_adx': False, 'bear_use_spike': False, 'bear_rsi_required': False, 'sideways_strategy': 'mean_reversion', 'sideways_bb_std_mult': 1.2013992537585352, 'sideways_rsi_os': 9, 'sideways_rsi_ob': 65, 'sideways_adx_thresh': 11.393894705381793, 'sideways_atr_min_pct': 0.008352994721970017, 'sideways_atr_max_pct': 0.01595984941484427, 'sideways_tp_mult': 1.3446308483450218, 'sideways_tsl_mult': 0.13247628101471756, 'sideways_time_stop': 46, 'sideways_use_sma': True, 'sideways_use_ema': True, 'sideways_use_atr': False, 'sideways_use_adx': True, 'sideways_use_spike': False, 'sideways_rsi_required': False}.
[I 2025-09-01 08:14:38,073] Trial 311 finished with values: [-0.014348229668484036, 0.014388662759844533] and parameters: {'p_sma': 31, 'p_std': 59, 'p_atr': 8, 'p_adx': 30, 'rsi_period': 53, 'ema1': 12, 'ema2': 11, 'slip_atr_k': 0.14732972869229424, 'slip_spread_k': 0.9448599432808068, 'spread_hl_frac': 0.012013443686339997, 'bb_std_mult': 2.044106409377767, 'rsi_os': 34, 'rsi_ob': 90, 'vol_spike': 0.06258155951761178, 'adx_thresh': 16.510600610286275, 'atr_min_pct': 0.01628255416993958, 'atr_max_pct': 0.050209782146737686, 'tp_mult': 1.8011085078533204, 'tsl_mult': 0.06927731304479341, 'strategy': 'mean_reversion', 'time_stop': 226, 'use_sma': False, 'use_atr': False, 'use_adx': False, 'use_ema': True, 'use_spike': True, 'rsi_required': True, 'edge_k': 0.3765848944855018, 'edge_cap': 0.7878106324448282, 'bull_strategy': 'breakout', 'bull_bb_std_mult': 2.5088167579089338, 'bull_rsi_os': 5, 'bull_rsi_ob': 74, 'bull_adx_thresh': 14.996193326172868, 'bull_atr_min_pct': 0.0026177668752465012, 'bull_atr_max_pct': 0.01874778900643111, 'bull_tp_mult': 1.4700021957598766, 'bull_tsl_mult': 0.5865415866730588, 'bull_time_stop': 73, 'bull_use_sma': True, 'bull_use_ema': False, 'bull_use_atr': True, 'bull_use_adx': True, 'bull_use_spike': False, 'bull_rsi_required': False, 'bear_strategy': 'mean_reversion', 'bear_bb_std_mult': 0.5032359995219668, 'bear_rsi_os': 17, 'bear_rsi_ob': 79, 'bear_adx_thresh': 19.64707059857071, 'bear_atr_min_pct': 0.006230687410862272, 'bear_atr_max_pct': 0.08120718347781596, 'bear_tp_mult': 2.188647929816892, 'bear_tsl_mult': 0.09204432885558031, 'bear_time_stop': 266, 'bear_use_sma': False, 'bear_use_ema': False, 'bear_use_atr': False, 'bear_use_adx': True, 'bear_use_spike': True, 'bear_rsi_required': True, 'sideways_strategy': 'breakout', 'sideways_bb_std_mult': 0.9465956796413532, 'sideways_rsi_os': 9, 'sideways_rsi_ob': 62, 'sideways_adx_thresh': 7.6750106121473145, 'sideways_atr_min_pct': 0.013597563327923804, 'sideways_atr_max_pct': 0.012922196156672151, 'sideways_tp_mult': 1.3530274745767392, 'sideways_tsl_mult': 0.17269760860068203, 'sideways_time_stop': 46, 'sideways_use_sma': True, 'sideways_use_ema': True, 'sideways_use_atr': True, 'sideways_use_adx': True, 'sideways_use_spike': False, 'sideways_rsi_required': False}.
[I 2025-09-01 08:15:24,427] Trial 312 finished with values: [-0.005036240026220384, 0.005091016924898522] and parameters: {'p_sma': 31, 'p_std': 55, 'p_atr': 17, 'p_adx': 18, 'rsi_period': 56, 'ema1': 6, 'ema2': 51, 'slip_atr_k': 0.008208260262073715, 'slip_spread_k': 0.9425586136389529, 'spread_hl_frac': 0.015827139306595506, 'bb_std_mult': 1.5641296241111262, 'rsi_os': 34, 'rsi_ob': 53, 'vol_spike': 0.052009081424136225, 'adx_thresh': 26.685511527489226, 'atr_min_pct': 0.0036312074863031197, 'atr_max_pct': 0.1403502271923915, 'tp_mult': 1.8989093502879082, 'tsl_mult': 0.3842078409908676, 'strategy': 'mean_reversion', 'time_stop': 227, 'use_sma': False, 'use_atr': False, 'use_adx': False, 'use_ema': True, 'use_spike': True, 'rsi_required': True, 'edge_k': 1.2715642105239766, 'edge_cap': 0.30612531286452427, 'bull_strategy': 'breakout', 'bull_bb_std_mult': 2.6233405008200377, 'bull_rsi_os': 35, 'bull_rsi_ob': 64, 'bull_adx_thresh': 8.782361315001772, 'bull_atr_min_pct': 0.0025530058727198917, 'bull_atr_max_pct': 0.019235164394905645, 'bull_tp_mult': 2.3593843212903938, 'bull_tsl_mult': 0.2326815610840013, 'bull_time_stop': 66, 'bull_use_sma': True, 'bull_use_ema': False, 'bull_use_atr': True, 'bull_use_adx': True, 'bull_use_spike': False, 'bull_rsi_required': False, 'bear_strategy': 'mean_reversion', 'bear_bb_std_mult': 1.137299414525889, 'bear_rsi_os': 42, 'bear_rsi_ob': 79, 'bear_adx_thresh': 5.628383541795883, 'bear_atr_min_pct': 0.0005917955075719402, 'bear_atr_max_pct': 0.14206929164211773, 'bear_tp_mult': 2.1416211979678903, 'bear_tsl_mult': 0.7106121948787207, 'bear_time_stop': 32, 'bear_use_sma': False, 'bear_use_ema': True, 'bear_use_atr': False, 'bear_use_adx': False, 'bear_use_spike': True, 'bear_rsi_required': True, 'sideways_strategy': 'breakout', 'sideways_bb_std_mult': 0.9955310300630346, 'sideways_rsi_os': 18, 'sideways_rsi_ob': 93, 'sideways_adx_thresh': 7.8506177724737105, 'sideways_atr_min_pct': 0.023702620869758682, 'sideways_atr_max_pct': 0.017555871096821236, 'sideways_tp_mult': 1.5457313250412836, 'sideways_tsl_mult': 0.094131835005383, 'sideways_time_stop': 114, 'sideways_use_sma': True, 'sideways_use_ema': True, 'sideways_use_atr': True, 'sideways_use_adx': True, 'sideways_use_spike': False, 'sideways_rsi_required': False}.
[I 2025-09-01 08:15:25,743] Trial 313 finished with values: [-0.009525895568381904, 0.009543035001377726] and parameters: {'p_sma': 31, 'p_std': 49, 'p_atr': 22, 'p_adx': 18, 'rsi_period': 56, 'ema1': 15, 'ema2': 22, 'slip_atr_k': 0.1482518097609089, 'slip_spread_k': 0.06811314342650526, 'spread_hl_frac': 0.01568266665984522, 'bb_std_mult': 2.043862074501449, 'rsi_os': 33, 'rsi_ob': 90, 'vol_spike': 0.06257896604115049, 'adx_thresh': 26.752654556963417, 'atr_min_pct': 0.003645484796156854, 'atr_max_pct': 0.06600125557590777, 'tp_mult': 1.2572862154669047, 'tsl_mult': 0.3764441843127092, 'strategy': 'breakout', 'time_stop': 226, 'use_sma': False, 'use_atr': False, 'use_adx': False, 'use_ema': True, 'use_spike': True, 'rsi_required': True, 'edge_k': 0.23509834237661623, 'edge_cap': 0.20227640032092767, 'bull_strategy': 'breakout', 'bull_bb_std_mult': 0.776551005265314, 'bull_rsi_os': 32, 'bull_rsi_ob': 59, 'bull_adx_thresh': 8.85292255441927, 'bull_atr_min_pct': 0.0025871618428702312, 'bull_atr_max_pct': 0.01882572799076034, 'bull_tp_mult': 1.530632865076057, 'bull_tsl_mult': 0.5289390697359999, 'bull_time_stop': 280, 'bull_use_sma': True, 'bull_use_ema': False, 'bull_use_atr': True, 'bull_use_adx': True, 'bull_use_spike': False, 'bull_rsi_required': False, 'bear_strategy': 'mean_reversion', 'bear_bb_std_mult': 1.5040911777538968, 'bear_rsi_os': 42, 'bear_rsi_ob': 79, 'bear_adx_thresh': 30.252557164182114, 'bear_atr_min_pct': 0.008246151990555412, 'bear_atr_max_pct': 0.13239100306051774, 'bear_tp_mult': 2.6430974729660095, 'bear_tsl_mult': 0.7030726028358849, 'bear_time_stop': 287, 'bear_use_sma': False, 'bear_use_ema': True, 'bear_use_atr': False, 'bear_use_adx': False, 'bear_use_spike': True, 'bear_rsi_required': True, 'sideways_strategy': 'breakout', 'sideways_bb_std_mult': 1.8044493188545494, 'sideways_rsi_os': 11, 'sideways_rsi_ob': 93, 'sideways_adx_thresh': 25.79304852800864, 'sideways_atr_min_pct': 0.023743992141520124, 'sideways_atr_max_pct': 0.016890196874189783, 'sideways_tp_mult': 2.3127282209357394, 'sideways_tsl_mult': 0.21799885427232926, 'sideways_time_stop': 80, 'sideways_use_sma': True, 'sideways_use_ema': True, 'sideways_use_atr': True, 'sideways_use_adx': True, 'sideways_use_spike': False, 'sideways_rsi_required': False}.
[I 2025-09-01 08:15:26,201] Trial 314 finished with values: [-1000000000.0, 1000000000.0] and parameters: {'p_sma': 26, 'p_std': 55, 'p_atr': 22, 'p_adx': 28, 'rsi_period': 65, 'ema1': 15, 'ema2': 22, 'slip_atr_k': 0.14800002391500752, 'slip_spread_k': 0.8141697190141555, 'spread_hl_frac': 0.03311683076278965, 'bb_std_mult': 1.955740035853256, 'rsi_os': 34, 'rsi_ob': 53, 'vol_spike': 0.1468102264383281, 'adx_thresh': 26.72189428780519, 'atr_min_pct': 0.00367222236666701, 'atr_max_pct': 0.065424135571825, 'tp_mult': 1.2613231210764528, 'tsl_mult': 0.041452926848409184, 'strategy': 'mean_reversion', 'time_stop': 225, 'use_sma': True, 'use_atr': False, 'use_adx': False, 'use_ema': True, 'use_spike': True, 'rsi_required': True, 'edge_k': 0.30008126649309974, 'edge_cap': 0.7802111126387524, 'bull_strategy': 'breakout', 'bull_bb_std_mult': 2.631643250542413, 'bull_rsi_os': 5, 'bull_rsi_ob': 47, 'bull_adx_thresh': 8.882959602470915, 'bull_atr_min_pct': 0.0034865554043449973, 'bull_atr_max_pct': 0.018655500667229628, 'bull_tp_mult': 2.805291177593004, 'bull_tsl_mult': 0.1247816427722151, 'bull_time_stop': 207, 'bull_use_sma': False, 'bull_use_ema': False, 'bull_use_atr': True, 'bull_use_adx': True, 'bull_use_spike': False, 'bull_rsi_required': True, 'bear_strategy': 'breakout', 'bear_bb_std_mult': 2.8863662816508597, 'bear_rsi_os': 29, 'bear_rsi_ob': 79, 'bear_adx_thresh': 28.950262281529767, 'bear_atr_min_pct': 0.008520707040812479, 'bear_atr_max_pct': 0.08552924256938062, 'bear_tp_mult': 2.0026167108485073, 'bear_tsl_mult': 0.1382410330700346, 'bear_time_stop': 269, 'bear_use_sma': True, 'bear_use_ema': True, 'bear_use_atr': True, 'bear_use_adx': True, 'bear_use_spike': True, 'bear_rsi_required': True, 'sideways_strategy': 'breakout', 'sideways_bb_std_mult': 1.3922635367565823, 'sideways_rsi_os': 19, 'sideways_rsi_ob': 93, 'sideways_adx_thresh': 7.602620731715833, 'sideways_atr_min_pct': 0.004276439238408477, 'sideways_atr_max_pct': 0.021044834499813442, 'sideways_tp_mult': 1.5395751672602518, 'sideways_tsl_mult': 0.2150352756700159, 'sideways_time_stop': 11, 'sideways_use_sma': True, 'sideways_use_ema': True, 'sideways_use_atr': True, 'sideways_use_adx': True, 'sideways_use_spike': False, 'sideways_rsi_required': False}.
