[I 2025-09-01 08:28:42,112] Trial 388 finished with values: [-1000000000.0, 1000000000.0] and parameters: {'p_sma': 14, 'p_std': 45, 'p_atr': 24, 'p_adx': 16, 'rsi_period': 28, 'ema1': 14, 'ema2': 29, 'slip_atr_k': 0.03609871971357974, 'slip_spread_k': 0.3659806550656395, 'spread_hl_frac': 0.037861343568799576, 'bb_std_mult': 2.9653176197153335, 'rsi_os': 27, 'rsi_ob': 63, 'vol_spike': 0.05882630869849484, 'adx_thresh': 29.90102638169532, 'atr_min_pct': 0.004683539719698753, 'atr_max_pct': 0.11759148019843423, 'tp_mult': 2.489861817156193, 'tsl_mult': 0.01991256983739096, 'strategy': 'breakout', 'time_stop': 161, 'use_sma': True, 'use_atr': True, 'use_adx': True, 'use_ema': True, 'use_spike': True, 'rsi_required': True, 'edge_k': 0.35685268307325113, 'edge_cap': 0.16517692445410118, 'bull_strategy': 'mean_reversion', 'bull_bb_std_mult': 2.6679374210422657, 'bull_rsi_os': 23, 'bull_rsi_ob': 49, 'bull_adx_thresh': 15.364266351421499, 'bull_atr_min_pct': 0.01356513186263829, 'bull_atr_max_pct': 0.062140224493370436, 'bull_tp_mult': 1.567966791372145, 'bull_tsl_mult': 0.53096339478523, 'bull_time_stop': 162, 'bull_use_sma': False, 'bull_use_ema': True, 'bull_use_atr': False, 'bull_use_adx': False, 'bull_use_spike': False, 'bull_rsi_required': True, 'bear_strategy': 'breakout', 'bear_bb_std_mult': 1.9386250099365314, 'bear_rsi_os': 16, 'bear_rsi_ob': 50, 'bear_adx_thresh': 21.16144257984877, 'bear_atr_min_pct': 0.00409572246620692, 'bear_atr_max_pct': 0.10152834226460616, 'bear_tp_mult': 2.8073028706864953, 'bear_tsl_mult': 0.9341060751672183, 'bear_time_stop': 294, 'bear_use_sma': False, 'bear_use_ema': True, 'bear_use_atr': True, 'bear_use_adx': False, 'bear_use_spike': False, 'bear_rsi_required': False, 'sideways_strategy': 'mean_reversion', 'sideways_bb_std_mult': 0.660295796778315, 'sideways_rsi_os': 5, 'sideways_rsi_ob': 94, 'sideways_adx_thresh': 13.042376907653356, 'sideways_atr_min_pct': 0.0243422912804415, 'sideways_atr_max_pct': 0.019162957657175673, 'sideways_tp_mult': 1.4492334797707913, 'sideways_tsl_mult': 0.13139858676714777, 'sideways_time_stop': 124, 'sideways_use_sma': True, 'sideways_use_ema': True, 'sideways_use_atr': True, 'sideways_use_adx': True, 'sideways_use_spike': False, 'sideways_rsi_required': False}.
[I 2025-09-01 08:28:42,244] Trial 387 finished with values: [-1000000000.0, 1000000000.0] and parameters: {'p_sma': 28, 'p_std': 46, 'p_atr': 24, 'p_adx': 16, 'rsi_period': 28, 'ema1': 14, 'ema2': 17, 'slip_atr_k': 0.02319542148699725, 'slip_spread_k': 0.8445146199126606, 'spread_hl_frac': 0.0118970751119349, 'bb_std_mult': 1.0333969593001322, 'rsi_os': 8, 'rsi_ob': 93, 'vol_spike': 0.2990879922967986, 'adx_thresh': 29.88866575020251, 'atr_min_pct': 0.004739496574808802, 'atr_max_pct': 0.11557671552388869, 'tp_mult': 2.5065092537857225, 'tsl_mult': 0.1537628963394012, 'strategy': 'breakout', 'time_stop': 249, 'use_sma': True, 'use_atr': True, 'use_adx': True, 'use_ema': True, 'use_spike': True, 'rsi_required': True, 'edge_k': 0.3511524381630713, 'edge_cap': 0.7650770238870712, 'bull_strategy': 'mean_reversion', 'bull_bb_std_mult': 0.6559049521989788, 'bull_rsi_os': 44, 'bull_rsi_ob': 58, 'bull_adx_thresh': 7.601271997075485, 'bull_atr_min_pct': 0.0008618979094987336, 'bull_atr_max_pct': 0.05543307601416948, 'bull_tp_mult': 1.572948503061263, 'bull_tsl_mult': 0.568466566858029, 'bull_time_stop': 240, 'bull_use_sma': False, 'bull_use_ema': True, 'bull_use_atr': False, 'bull_use_adx': False, 'bull_use_spike': False, 'bull_rsi_required': True, 'bear_strategy': 'breakout', 'bear_bb_std_mult': 1.9507421477035456, 'bear_rsi_os': 43, 'bear_rsi_ob': 79, 'bear_adx_thresh': 18.697804634915958, 'bear_atr_min_pct': 0.00796297564600193, 'bear_atr_max_pct': 0.10195313195679136, 'bear_tp_mult': 1.5257811900238378, 'bear_tsl_mult': 0.1601672192489262, 'bear_time_stop': 300, 'bear_use_sma': False, 'bear_use_ema': True, 'bear_use_atr': True, 'bear_use_adx': False, 'bear_use_spike': False, 'bear_rsi_required': False, 'sideways_strategy': 'mean_reversion', 'sideways_bb_std_mult': 0.9448796666753666, 'sideways_rsi_os': 19, 'sideways_rsi_ob': 92, 'sideways_adx_thresh': 12.288769761989867, 'sideways_atr_min_pct': 0.02394686361420915, 'sideways_atr_max_pct': 0.018135441643335283, 'sideways_tp_mult': 1.2389423466369416, 'sideways_tsl_mult': 0.12551863722976475, 'sideways_time_stop': 116, 'sideways_use_sma': True, 'sideways_use_ema': True, 'sideways_use_atr': True, 'sideways_use_adx': True, 'sideways_use_spike': False, 'sideways_rsi_required': False}.
[I 2025-09-01 08:29:25,771] Trial 390 finished with values: [-0.02324720940882785, 0.023186603077845296] and parameters: {'p_sma': 36, 'p_std': 45, 'p_atr': 25, 'p_adx': 12, 'rsi_period': 50, 'ema1': 16, 'ema2': 44, 'slip_atr_k': 0.03692310037387152, 'slip_spread_k': 0.857148053284287, 'spread_hl_frac': 0.011937967904744402, 'bb_std_mult': 2.9683205271204445, 'rsi_os': 12, 'rsi_ob': 94, 'vol_spike': 0.15365065601400113, 'adx_thresh': 29.991920145397852, 'atr_min_pct': 0.004706928584430488, 'atr_max_pct': 0.12132609182964321, 'tp_mult': 1.7418033628666885, 'tsl_mult': 0.030241115391441593, 'strategy': 'breakout', 'time_stop': 258, 'use_sma': False, 'use_atr': False, 'use_adx': True, 'use_ema': True, 'use_spike': True, 'rsi_required': True, 'edge_k': 0.34214857211141075, 'edge_cap': 0.39467741521080013, 'bull_strategy': 'breakout', 'bull_bb_std_mult': 3.2859502661227373, 'bull_rsi_os': 46, 'bull_rsi_ob': 64, 'bull_adx_thresh': 7.509707680714721, 'bull_atr_min_pct': 0.0007794507870730162, 'bull_atr_max_pct': 0.058252889280785924, 'bull_tp_mult': 2.9006265273416223, 'bull_tsl_mult': 0.6934744612699467, 'bull_time_stop': 70, 'bull_use_sma': True, 'bull_use_ema': True, 'bull_use_atr': False, 'bull_use_adx': False, 'bull_use_spike': False, 'bull_rsi_required': False, 'bear_strategy': 'mean_reversion', 'bear_bb_std_mult': 2.7341084989804596, 'bear_rsi_os': 47, 'bear_rsi_ob': 79, 'bear_adx_thresh': 5.7653176362767145, 'bear_atr_min_pct': 0.009525270170760892, 'bear_atr_max_pct': 0.10262727854076292, 'bear_tp_mult': 1.5033273880500633, 'bear_tsl_mult': 0.772848893535568, 'bear_time_stop': 50, 'bear_use_sma': True, 'bear_use_ema': False, 'bear_use_atr': True, 'bear_use_adx': False, 'bear_use_spike': False, 'bear_rsi_required': False, 'sideways_strategy': 'breakout', 'sideways_bb_std_mult': 1.9949080731627145, 'sideways_rsi_os': 5, 'sideways_rsi_ob': 94, 'sideways_adx_thresh': 12.78432876376473, 'sideways_atr_min_pct': 0.022373028257813385, 'sideways_atr_max_pct': 0.026116492990359036, 'sideways_tp_mult': 1.4417499539493543, 'sideways_tsl_mult': 0.07812263848428164, 'sideways_time_stop': 88, 'sideways_use_sma': True, 'sideways_use_ema': True, 'sideways_use_atr': True, 'sideways_use_adx': True, 'sideways_use_spike': False, 'sideways_rsi_required': False}.
[I 2025-09-01 08:29:25,763] Trial 392 finished with values: [-1000000000.0, 1000000000.0] and parameters: {'p_sma': 30, 'p_std': 40, 'p_atr': 20, 'p_adx': 12, 'rsi_period': 7, 'ema1': 16, 'ema2': 45, 'slip_atr_k': 0.04698109676422778, 'slip_spread_k': 0.8571308937440651, 'spread_hl_frac': 0.0011585550358012217, 'bb_std_mult': 3.188793099627171, 'rsi_os': 32, 'rsi_ob': 94, 'vol_spike': 0.06433143535800817, 'adx_thresh': 27.056524627154534, 'atr_min_pct': 0.007175490296911379, 'atr_max_pct': 0.10833039714656892, 'tp_mult': 1.6340130322943696, 'tsl_mult': 0.0985863745331608, 'strategy': 'breakout', 'time_stop': 258, 'use_sma': False, 'use_atr': False, 'use_adx': True, 'use_ema': True, 'use_spike': True, 'rsi_required': True, 'edge_k': 0.2200362952170276, 'edge_cap': 0.31687518659898606, 'bull_strategy': 'breakout', 'bull_bb_std_mult': 2.2583577499426015, 'bull_rsi_os': 46, 'bull_rsi_ob': 64, 'bull_adx_thresh': 31.904930994143946, 'bull_atr_min_pct': 0.01156024118593127, 'bull_atr_max_pct': 0.05750633274654332, 'bull_tp_mult': 1.4063066929270507, 'bull_tsl_mult': 0.6926766050326267, 'bull_time_stop': 210, 'bull_use_sma': True, 'bull_use_ema': True, 'bull_use_atr': False, 'bull_use_adx': False, 'bull_use_spike': False, 'bull_rsi_required': False, 'bear_strategy': 'mean_reversion', 'bear_bb_std_mult': 1.8787348115144424, 'bear_rsi_os': 47, 'bear_rsi_ob': 82, 'bear_adx_thresh': 17.00967637011826, 'bear_atr_min_pct': 0.00959329266644387, 'bear_atr_max_pct': 0.09654247502164724, 'bear_tp_mult': 2.2425064069791034, 'bear_tsl_mult': 0.10105997083728728, 'bear_time_stop': 57, 'bear_use_sma': True, 'bear_use_ema': False, 'bear_use_atr': False, 'bear_use_adx': False, 'bear_use_spike': False, 'bear_rsi_required': False, 'sideways_strategy': 'breakout', 'sideways_bb_std_mult': 1.0940148450748823, 'sideways_rsi_os': 5, 'sideways_rsi_ob': 57, 'sideways_adx_thresh': 18.164616699566672, 'sideways_atr_min_pct': 0.02324417783499864, 'sideways_atr_max_pct': 0.012323076706180469, 'sideways_tp_mult': 1.7523565357430064, 'sideways_tsl_mult': 0.7761289444592094, 'sideways_time_stop': 92, 'sideways_use_sma': True, 'sideways_use_ema': True, 'sideways_use_atr': True, 'sideways_use_adx': True, 'sideways_use_spike': False, 'sideways_rsi_required': False}.
[I 2025-09-01 08:29:26,191] Trial 389 finished with values: [-0.024971313765575043, 0.024911989444889204] and parameters: {'p_sma': 36, 'p_std': 42, 'p_atr': 25, 'p_adx': 16, 'rsi_period': 24, 'ema1': 18, 'ema2': 21, 'slip_atr_k': 0.03976508791743494, 'slip_spread_k': 0.13232956794541234, 'spread_hl_frac': 0.011401951969124312, 'bb_std_mult': 2.966784954821243, 'rsi_os': 32, 'rsi_ob': 86, 'vol_spike': 0.060318992943335994, 'adx_thresh': 30.079062188797337, 'atr_min_pct': 0.006053870728393232, 'atr_max_pct': 0.1122699802441602, 'tp_mult': 1.738164539504708, 'tsl_mult': 0.9520609870828562, 'strategy': 'breakout', 'time_stop': 238, 'use_sma': False, 'use_atr': False, 'use_adx': True, 'use_ema': True, 'use_spike': True, 'rsi_required': True, 'edge_k': 0.2130279792553468, 'edge_cap': 0.40141041558595925, 'bull_strategy': 'breakout', 'bull_bb_std_mult': 1.4681757863076286, 'bull_rsi_os': 45, 'bull_rsi_ob': 49, 'bull_adx_thresh': 7.693491758086869, 'bull_atr_min_pct': 0.0010695547268249027, 'bull_atr_max_pct': 0.06034358930792611, 'bull_tp_mult': 1.5259185728958964, 'bull_tsl_mult': 0.6370198504127261, 'bull_time_stop': 226, 'bull_use_sma': True, 'bull_use_ema': True, 'bull_use_atr': False, 'bull_use_adx': False, 'bull_use_spike': False, 'bull_rsi_required': False, 'bear_strategy': 'mean_reversion', 'bear_bb_std_mult': 1.9566358571479698, 'bear_rsi_os': 16, 'bear_rsi_ob': 82, 'bear_adx_thresh': 5.0034714977320425, 'bear_atr_min_pct': 0.021799835539632773, 'bear_atr_max_pct': 0.09626542556384224, 'bear_tp_mult': 2.808078547252926, 'bear_tsl_mult': 0.2754830498404349, 'bear_time_stop': 294, 'bear_use_sma': True, 'bear_use_ema': False, 'bear_use_atr': True, 'bear_use_adx': False, 'bear_use_spike': False, 'bear_rsi_required': False, 'sideways_strategy': 'breakout', 'sideways_bb_std_mult': 0.9572286337571635, 'sideways_rsi_os': 53, 'sideways_rsi_ob': 94, 'sideways_adx_thresh': 13.393753517268403, 'sideways_atr_min_pct': 0.02421746676206442, 'sideways_atr_max_pct': 0.02603048757776305, 'sideways_tp_mult': 1.7476478950915026, 'sideways_tsl_mult': 0.7723065338065183, 'sideways_time_stop': 127, 'sideways_use_sma': True, 'sideways_use_ema': True, 'sideways_use_atr': True, 'sideways_use_adx': True, 'sideways_use_spike': False, 'sideways_rsi_required': False}.
[I 2025-09-01 08:29:26,399] Trial 391 finished with values: [-1000000000.0, 1000000000.0] and parameters: {'p_sma': 30, 'p_std': 40, 'p_atr': 8, 'p_adx': 12, 'rsi_period': 52, 'ema1': 16, 'ema2': 15, 'slip_atr_k': 0.04082714278374522, 'slip_spread_k': 0.8513792782388941, 'spread_hl_frac': 0.011497440635613391, 'bb_std_mult': 2.588448857953334, 'rsi_os': 32, 'rsi_ob': 80, 'vol_spike': 0.14499707552855334, 'adx_thresh': 31.094619711259977, 'atr_min_pct': 0.0038507625748407325, 'atr_max_pct': 0.10776248288236964, 'tp_mult': 1.8147761833209162, 'tsl_mult': 0.09315615623608531, 'strategy': 'breakout', 'time_stop': 48, 'use_sma': False, 'use_atr': False, 'use_adx': True, 'use_ema': True, 'use_spike': True, 'rsi_required': True, 'edge_k': 0.9698847080945605, 'edge_cap': 0.21780308421569028, 'bull_strategy': 'breakout', 'bull_bb_std_mult': 3.2779477678741498, 'bull_rsi_os': 33, 'bull_rsi_ob': 51, 'bull_adx_thresh': 7.688353532312766, 'bull_atr_min_pct': 0.011578976879830779, 'bull_atr_max_pct': 0.058158380218685676, 'bull_tp_mult': 1.503873625959333, 'bull_tsl_mult': 0.6799816995592555, 'bull_time_stop': 85, 'bull_use_sma': True, 'bull_use_ema': True, 'bull_use_atr': False, 'bull_use_adx': False, 'bull_use_spike': False, 'bull_rsi_required': False, 'bear_strategy': 'mean_reversion', 'bear_bb_std_mult': 3.211883570500116, 'bear_rsi_os': 47, 'bear_rsi_ob': 82, 'bear_adx_thresh': 5.55814148640739, 'bear_atr_min_pct': 0.021728942332883725, 'bear_atr_max_pct': 0.11932133576915413, 'bear_tp_mult': 2.04108933643889, 'bear_tsl_mult': 0.10558912301637716, 'bear_time_stop': 286, 'bear_use_sma': True, 'bear_use_ema': False, 'bear_use_atr': True, 'bear_use_adx': False, 'bear_use_spike': False, 'bear_rsi_required': False, 'sideways_strategy': 'breakout', 'sideways_bb_std_mult': 0.9559259072893267, 'sideways_rsi_os': 12, 'sideways_rsi_ob': 91, 'sideways_adx_thresh': 24.1833340455806, 'sideways_atr_min_pct': 0.021623240494089487, 'sideways_atr_max_pct': 0.025350248616936456, 'sideways_tp_mult': 2.934879853247012, 'sideways_tsl_mult': 0.6492040313678172, 'sideways_time_stop': 51, 'sideways_use_sma': True, 'sideways_use_ema': True, 'sideways_use_atr': True, 'sideways_use_adx': True, 'sideways_use_spike': False, 'sideways_rsi_required': False}.
[I 2025-09-01 08:30:07,713] Trial 396 finished with values: [-1000000000.0, 1000000000.0] and parameters: {'p_sma': 27, 'p_std': 50, 'p_atr': 19, 'p_adx': 15, 'rsi_period': 20, 'ema1': 9, 'ema2': 11, 'slip_atr_k': 0.01435879961617699, 'slip_spread_k': 0.6072692057669548, 'spread_hl_frac': 0.03600244453767045, 'bb_std_mult': 1.890228374105229, 'rsi_os': 30, 'rsi_ob': 78, 'vol_spike': 0.06970486438638042, 'adx_thresh': 6.40821543102826, 'atr_min_pct': 0.02465438517848141, 'atr_max_pct': 0.12340977430806065, 'tp_mult': 2.8393077812551466, 'tsl_mult': 0.05408390726896327, 'strategy': 'breakout', 'time_stop': 218, 'use_sma': False, 'use_atr': False, 'use_adx': True, 'use_ema': False, 'use_spike': True, 'rsi_required': True, 'edge_k': 0.26109781607199345, 'edge_cap': 0.1864005455840642, 'bull_strategy': 'breakout', 'bull_bb_std_mult': 1.9229547623926497, 'bull_rsi_os': 54, 'bull_rsi_ob': 60, 'bull_adx_thresh': 8.600600899094712, 'bull_atr_min_pct': 0.003359402040039611, 'bull_atr_max_pct': 0.06412103761183331, 'bull_tp_mult': 1.8045056687763226, 'bull_tsl_mult': 0.7620074347818314, 'bull_time_stop': 276, 'bull_use_sma': True, 'bull_use_ema': False, 'bull_use_atr': False, 'bull_use_adx': False, 'bull_use_spike': False, 'bull_rsi_required': False, 'bear_strategy': 'mean_reversion', 'bear_bb_std_mult': 1.165737019326083, 'bear_rsi_os': 18, 'bear_rsi_ob': 80, 'bear_adx_thresh': 6.042953627422075, 'bear_atr_min_pct': 0.008934890546161891, 'bear_atr_max_pct': 0.07591266608556785, 'bear_tp_mult': 2.1204659542628703, 'bear_tsl_mult': 0.05794358897405133, 'bear_time_stop': 288, 'bear_use_sma': True, 'bear_use_ema': False, 'bear_use_atr': False, 'bear_use_adx': False, 'bear_use_spike': False, 'bear_rsi_required': False, 'sideways_strategy': 'breakout', 'sideways_bb_std_mult': 0.7873140580305065, 'sideways_rsi_os': 28, 'sideways_rsi_ob': 90, 'sideways_adx_thresh': 10.705442692048207, 'sideways_atr_min_pct': 0.024811757116429228, 'sideways_atr_max_pct': 0.0599201345968711, 'sideways_tp_mult': 1.3733830212543583, 'sideways_tsl_mult': 0.38784332867846216, 'sideways_time_stop': 220, 'sideways_use_sma': True, 'sideways_use_ema': False, 'sideways_use_atr': True, 'sideways_use_adx': True, 'sideways_use_spike': False, 'sideways_rsi_required': False}.
[I 2025-09-01 08:30:08,174] Trial 394 finished with values: [-0.013210598135868112, 0.015130914587325338] and parameters: {'p_sma': 26, 'p_std': 41, 'p_atr': 7, 'p_adx': 15, 'rsi_period': 66, 'ema1': 9, 'ema2': 51, 'slip_atr_k': 0.029864170160708706, 'slip_spread_k': 0.824573067974336, 'spread_hl_frac': 0.014213634570709592, 'bb_std_mult': 3.4357059251303323, 'rsi_os': 31, 'rsi_ob': 85, 'vol_spike': 0.13888324804996607, 'adx_thresh': 31.08152041856183, 'atr_min_pct': 0.005968113131081329, 'atr_max_pct': 0.12653048063666453, 'tp_mult': 1.8005923434069115, 'tsl_mult': 0.953709540620242, 'strategy': 'breakout', 'time_stop': 174, 'use_sma': False, 'use_atr': False, 'use_adx': True, 'use_ema': False, 'use_spike': True, 'rsi_required': True, 'edge_k': 0.2457078645492085, 'edge_cap': 0.220042243510219, 'bull_strategy': 'breakout', 'bull_bb_std_mult': 0.7953382738060069, 'bull_rsi_os': 54, 'bull_rsi_ob': 45, 'bull_adx_thresh': 8.589445742612211, 'bull_atr_min_pct': 0.0034824941175053514, 'bull_atr_max_pct': 0.051563277314498474, 'bull_tp_mult': 1.520663836460839, 'bull_tsl_mult': 0.6265521028154131, 'bull_time_stop': 21, 'bull_use_sma': True, 'bull_use_ema': False, 'bull_use_atr': False, 'bull_use_adx': False, 'bull_use_spike': False, 'bull_rsi_required': False, 'bear_strategy': 'mean_reversion', 'bear_bb_std_mult': 2.0182806198073666, 'bear_rsi_os': 49, 'bear_rsi_ob': 80, 'bear_adx_thresh': 5.376655207600944, 'bear_atr_min_pct': 0.005942229411706218, 'bear_atr_max_pct': 0.09877196096413199, 'bear_tp_mult': 1.775063551430549, 'bear_tsl_mult': 0.19402149970524596, 'bear_time_stop': 288, 'bear_use_sma': True, 'bear_use_ema': False, 'bear_use_atr': False, 'bear_use_adx': False, 'bear_use_spike': False, 'bear_rsi_required': False, 'sideways_strategy': 'breakout', 'sideways_bb_std_mult': 3.1149158323987534, 'sideways_rsi_os': 28, 'sideways_rsi_ob': 85, 'sideways_adx_thresh': 23.255226771056357, 'sideways_atr_min_pct': 0.021399976377139245, 'sideways_atr_max_pct': 0.015046215664936378, 'sideways_tp_mult': 1.9362445272931876, 'sideways_tsl_mult': 0.18125359337136043, 'sideways_time_stop': 172, 'sideways_use_sma': True, 'sideways_use_ema': False, 'sideways_use_atr': True, 'sideways_use_adx': True, 'sideways_use_spike': False, 'sideways_rsi_required': False}.
[I 2025-09-01 08:30:08,729] Trial 393 finished with values: [-0.007641278772709703, 0.0107482344989866] and parameters: {'p_sma': 27, 'p_std': 41, 'p_atr': 14, 'p_adx': 15, 'rsi_period': 25, 'ema1': 12, 'ema2': 51, 'slip_atr_k': 0.031121223022202847, 'slip_spread_k': 0.7455212215910698, 'spread_hl_frac': 0.036266471759771435, 'bb_std_mult': 3.4313647416447193, 'rsi_os': 31, 'rsi_ob': 75, 'vol_spike': 0.1399391201982161, 'adx_thresh': 30.921504540853725, 'atr_min_pct': 0.02460096396989544, 'atr_max_pct': 0.12276270083340443, 'tp_mult': 1.807643779751058, 'tsl_mult': 0.5678120334632493, 'strategy': 'breakout', 'time_stop': 219, 'use_sma': False, 'use_atr': False, 'use_adx': True, 'use_ema': False, 'use_spike': True, 'rsi_required': True, 'edge_k': 0.9374754247157253, 'edge_cap': 0.22054661321651198, 'bull_strategy': 'breakout', 'bull_bb_std_mult': 2.49983841708677, 'bull_rsi_os': 33, 'bull_rsi_ob': 92, 'bull_adx_thresh': 10.872901150001818, 'bull_atr_min_pct': 0.0034947125319963177, 'bull_atr_max_pct': 0.06492583589017754, 'bull_tp_mult': 1.509649863683334, 'bull_tsl_mult': 0.6389663218694249, 'bull_time_stop': 84, 'bull_use_sma': True, 'bull_use_ema': False, 'bull_use_atr': False, 'bull_use_adx': False, 'bull_use_spike': False, 'bull_rsi_required': False, 'bear_strategy': 'mean_reversion', 'bear_bb_std_mult': 3.473900547179163, 'bear_rsi_os': 49, 'bear_rsi_ob': 80, 'bear_adx_thresh': 5.453911580063265, 'bear_atr_min_pct': 0.005795334622900977, 'bear_atr_max_pct': 0.04055753408117003, 'bear_tp_mult': 1.85998538953181, 'bear_tsl_mult': 0.2778609599644039, 'bear_time_stop': 286, 'bear_use_sma': True, 'bear_use_ema': False, 'bear_use_atr': False, 'bear_use_adx': False, 'bear_use_spike': False, 'bear_rsi_required': False, 'sideways_strategy': 'breakout', 'sideways_bb_std_mult': 3.1072781667090053, 'sideways_rsi_os': 27, 'sideways_rsi_ob': 51, 'sideways_adx_thresh': 24.323354401389032, 'sideways_atr_min_pct': 0.02170855301273225, 'sideways_atr_max_pct': 0.06183274026126641, 'sideways_tp_mult': 2.954508617360033, 'sideways_tsl_mult': 0.1841746646097348, 'sideways_time_stop': 214, 'sideways_use_sma': True, 'sideways_use_ema': False, 'sideways_use_atr': True, 'sideways_use_adx': True, 'sideways_use_spike': False, 'sideways_rsi_required': False}.
