[I 2025-09-01 08:52:35,344] Trial 524 finished with values: [-1000000000.0, 1000000000.0] and parameters: {'p_sma': 55, 'p_std': 37, 'p_atr': 27, 'p_adx': 16, 'rsi_period': 44, 'ema1': 8, 'ema2': 60, 'slip_atr_k': 0.15535256394674013, 'slip_spread_k': 0.15971431868140482, 'spread_hl_frac': 0.02209244198749573, 'bb_std_mult': 2.6047959456294985, 'rsi_os': 48, 'rsi_ob': 91, 'vol_spike': 0.008578944151527594, 'adx_thresh': 33.74262204842416, 'atr_min_pct': 0.011056760468381662, 'atr_max_pct': 0.08348103318637405, 'tp_mult': 1.2648753971257658, 'tsl_mult': 0.20017170884153412, 'strategy': 'mean_reversion', 'time_stop': 34, 'use_sma': False, 'use_atr': False, 'use_adx': False, 'use_ema': False, 'use_spike': False, 'rsi_required': False, 'edge_k': 0.9356044666902518, 'edge_cap': 0.8237593227670236, 'bull_strategy': 'breakout', 'bull_bb_std_mult': 2.4159460908454355, 'bull_rsi_os': 41, 'bull_rsi_ob': 53, 'bull_adx_thresh': 9.93489058020751, 'bull_atr_min_pct': 0.021120110826301115, 'bull_atr_max_pct': 0.08557847859909212, 'bull_tp_mult': 1.1257374412983499, 'bull_tsl_mult': 0.7662304191904081, 'bull_time_stop': 178, 'bull_use_sma': True, 'bull_use_ema': True, 'bull_use_atr': True, 'bull_use_adx': True, 'bull_use_spike': True, 'bull_rsi_required': False, 'bear_strategy': 'mean_reversion', 'bear_bb_std_mult': 3.370939173181686, 'bear_rsi_os': 42, 'bear_rsi_ob': 86, 'bear_adx_thresh': 12.424544024747991, 'bear_atr_min_pct': 0.005449310358345598, 'bear_atr_max_pct': 0.04390837540139457, 'bear_tp_mult': 2.850598555295342, 'bear_tsl_mult': 0.1846229090433403, 'bear_time_stop': 199, 'bear_use_sma': False, 'bear_use_ema': False, 'bear_use_atr': True, 'bear_use_adx': True, 'bear_use_spike': True, 'bear_rsi_required': True, 'sideways_strategy': 'mean_reversion', 'sideways_bb_std_mult': 1.2237870092358487, 'sideways_rsi_os': 12, 'sideways_rsi_ob': 61, 'sideways_adx_thresh': 29.369511019662554, 'sideways_atr_min_pct': 0.006626899137848892, 'sideways_atr_max_pct': 0.0855248645190416, 'sideways_tp_mult': 2.3564930702483657, 'sideways_tsl_mult': 0.5458489358799007, 'sideways_time_stop': 169, 'sideways_use_sma': False, 'sideways_use_ema': False, 'sideways_use_atr': True, 'sideways_use_adx': False, 'sideways_use_spike': True, 'sideways_rsi_required': True}.
[I 2025-09-01 08:52:35,501] Trial 520 finished with values: [-1000000000.0, 1000000000.0] and parameters: {'p_sma': 17, 'p_std': 35, 'p_atr': 26, 'p_adx': 16, 'rsi_period': 40, 'ema1': 8, 'ema2': 57, 'slip_atr_k': 0.010326502535678128, 'slip_spread_k': 0.11713974187898156, 'spread_hl_frac': 0.04649046146670437, 'bb_std_mult': 2.6426640068089857, 'rsi_os': 47, 'rsi_ob': 91, 'vol_spike': 0.01721568732709266, 'adx_thresh': 34.388755803671195, 'atr_min_pct': 0.01424113330134848, 'atr_max_pct': 0.09016604825220613, 'tp_mult': 1.3074498935141283, 'tsl_mult': 0.17365357408714496, 'strategy': 'mean_reversion', 'time_stop': 37, 'use_sma': True, 'use_atr': False, 'use_adx': False, 'use_ema': False, 'use_spike': False, 'rsi_required': False, 'edge_k': 0.9884326715056465, 'edge_cap': 0.31288970901010826, 'bull_strategy': 'breakout', 'bull_bb_std_mult': 2.4172403137739593, 'bull_rsi_os': 38, 'bull_rsi_ob': 56, 'bull_adx_thresh': 10.656112494463919, 'bull_atr_min_pct': 0.022080204466939694, 'bull_atr_max_pct': 0.07806970199943852, 'bull_tp_mult': 1.113022663423354, 'bull_tsl_mult': 0.8949295448914899, 'bull_time_stop': 183, 'bull_use_sma': True, 'bull_use_ema': True, 'bull_use_atr': True, 'bull_use_adx': True, 'bull_use_spike': True, 'bull_rsi_required': False, 'bear_strategy': 'mean_reversion', 'bear_bb_std_mult': 3.3880298745701203, 'bear_rsi_os': 29, 'bear_rsi_ob': 86, 'bear_adx_thresh': 11.737544168714074, 'bear_atr_min_pct': 0.013494656631492857, 'bear_atr_max_pct': 0.039689119979909454, 'bear_tp_mult': 2.695763557841023, 'bear_tsl_mult': 0.22301089344665964, 'bear_time_stop': 211, 'bear_use_sma': False, 'bear_use_ema': False, 'bear_use_atr': True, 'bear_use_adx': True, 'bear_use_spike': True, 'bear_rsi_required': True, 'sideways_strategy': 'mean_reversion', 'sideways_bb_std_mult': 1.2405778798468585, 'sideways_rsi_os': 13, 'sideways_rsi_ob': 62, 'sideways_adx_thresh': 11.764224761725037, 'sideways_atr_min_pct': 0.009293291087772023, 'sideways_atr_max_pct': 0.08264067393416608, 'sideways_tp_mult': 2.4794974809693455, 'sideways_tsl_mult': 0.5391241077316724, 'sideways_time_stop': 149, 'sideways_use_sma': False, 'sideways_use_ema': False, 'sideways_use_atr': False, 'sideways_use_adx': False, 'sideways_use_spike': True, 'sideways_rsi_required': True}.
[I 2025-09-01 08:52:35,653] Trial 521 finished with values: [-1000000000.0, 1000000000.0] and parameters: {'p_sma': 19, 'p_std': 35, 'p_atr': 27, 'p_adx': 16, 'rsi_period': 40, 'ema1': 8, 'ema2': 57, 'slip_atr_k': 0.22163505242553194, 'slip_spread_k': 0.106449983242457, 'spread_hl_frac': 0.023783714671419327, 'bb_std_mult': 2.656064064861603, 'rsi_os': 47, 'rsi_ob': 91, 'vol_spike': 0.01783993898793129, 'adx_thresh': 33.026294610565344, 'atr_min_pct': 0.021960308973569917, 'atr_max_pct': 0.08984962027835812, 'tp_mult': 1.2873739131920692, 'tsl_mult': 0.17465122359517926, 'strategy': 'mean_reversion', 'time_stop': 34, 'use_sma': False, 'use_atr': False, 'use_adx': False, 'use_ema': False, 'use_spike': False, 'rsi_required': False, 'edge_k': 1.0009038680412117, 'edge_cap': 0.31620397912043474, 'bull_strategy': 'breakout', 'bull_bb_std_mult': 2.401425816703831, 'bull_rsi_os': 39, 'bull_rsi_ob': 56, 'bull_adx_thresh': 10.651102460004479, 'bull_atr_min_pct': 0.021338539881303957, 'bull_atr_max_pct': 0.08523234901597473, 'bull_tp_mult': 1.1063671404126403, 'bull_tsl_mult': 0.3651194620750602, 'bull_time_stop': 183, 'bull_use_sma': False, 'bull_use_ema': True, 'bull_use_atr': True, 'bull_use_adx': True, 'bull_use_spike': True, 'bull_rsi_required': True, 'bear_strategy': 'breakout', 'bear_bb_std_mult': 3.371755709774071, 'bear_rsi_os': 28, 'bear_rsi_ob': 87, 'bear_adx_thresh': 12.38090874845593, 'bear_atr_min_pct': 0.025234486406646477, 'bear_atr_max_pct': 0.04337879849999578, 'bear_tp_mult': 2.6938758473198687, 'bear_tsl_mult': 0.18783885163690367, 'bear_time_stop': 200, 'bear_use_sma': False, 'bear_use_ema': False, 'bear_use_atr': True, 'bear_use_adx': True, 'bear_use_spike': True, 'bear_rsi_required': True, 'sideways_strategy': 'mean_reversion', 'sideways_bb_std_mult': 1.2284313715871906, 'sideways_rsi_os': 13, 'sideways_rsi_ob': 62, 'sideways_adx_thresh': 10.543838130331638, 'sideways_atr_min_pct': 0.009416859877801621, 'sideways_atr_max_pct': 0.08458676132337369, 'sideways_tp_mult': 2.4851482198227988, 'sideways_tsl_mult': 0.5955725906313655, 'sideways_time_stop': 149, 'sideways_use_sma': False, 'sideways_use_ema': False, 'sideways_use_atr': True, 'sideways_use_adx': False, 'sideways_use_spike': True, 'sideways_rsi_required': True}.
[I 2025-09-01 08:52:36,619] Trial 526 finished with values: [-1000000000.0, 1000000000.0] and parameters: {'p_sma': 39, 'p_std': 35, 'p_atr': 21, 'p_adx': 16, 'rsi_period': 40, 'ema1': 6, 'ema2': 57, 'slip_atr_k': 0.20806590061731733, 'slip_spread_k': 0.12326193862563102, 'spread_hl_frac': 0.01809180992076425, 'bb_std_mult': 1.1642471255427633, 'rsi_os': 50, 'rsi_ob': 49, 'vol_spike': 0.009472839265624014, 'adx_thresh': 34.538581590370256, 'atr_min_pct': 0.012210183948194028, 'atr_max_pct': 0.0944582721599512, 'tp_mult': 1.258138501685783, 'tsl_mult': 0.16833609977286862, 'strategy': 'mean_reversion', 'time_stop': 48, 'use_sma': False, 'use_atr': True, 'use_adx': False, 'use_ema': False, 'use_spike': False, 'rsi_required': False, 'edge_k': 0.8946494606165255, 'edge_cap': 0.6633848038560353, 'bull_strategy': 'mean_reversion', 'bull_bb_std_mult': 2.203344632784088, 'bull_rsi_os': 39, 'bull_rsi_ob': 55, 'bull_adx_thresh': 11.73311740287991, 'bull_atr_min_pct': 0.022159354494113097, 'bull_atr_max_pct': 0.0750151883636714, 'bull_tp_mult': 1.0272697693142272, 'bull_tsl_mult': 0.2909536526201436, 'bull_time_stop': 170, 'bull_use_sma': True, 'bull_use_ema': True, 'bull_use_atr': True, 'bull_use_adx': True, 'bull_use_spike': True, 'bull_rsi_required': False, 'bear_strategy': 'breakout', 'bear_bb_std_mult': 3.398866747215209, 'bear_rsi_os': 40, 'bear_rsi_ob': 88, 'bear_adx_thresh': 11.131554140160281, 'bear_atr_min_pct': 0.006475490967712407, 'bear_atr_max_pct': 0.042611865547710216, 'bear_tp_mult': 2.7726034131909203, 'bear_tsl_mult': 0.19096103602144487, 'bear_time_stop': 215, 'bear_use_sma': False, 'bear_use_ema': True, 'bear_use_atr': True, 'bear_use_adx': True, 'bear_use_spike': True, 'bear_rsi_required': True, 'sideways_strategy': 'breakout', 'sideways_bb_std_mult': 1.3741125572374957, 'sideways_rsi_os': 10, 'sideways_rsi_ob': 62, 'sideways_adx_thresh': 11.45799688593919, 'sideways_atr_min_pct': 0.008046454625797502, 'sideways_atr_max_pct': 0.07025626297465684, 'sideways_tp_mult': 2.563884757578018, 'sideways_tsl_mult': 0.5898479569060184, 'sideways_time_stop': 149, 'sideways_use_sma': False, 'sideways_use_ema': False, 'sideways_use_atr': True, 'sideways_use_adx': False, 'sideways_use_spike': True, 'sideways_rsi_required': True}.
[I 2025-09-01 08:52:36,734] Trial 525 finished with values: [-1000000000.0, 1000000000.0] and parameters: {'p_sma': 56, 'p_std': 37, 'p_atr': 27, 'p_adx': 16, 'rsi_period': 43, 'ema1': 7, 'ema2': 56, 'slip_atr_k': 0.14294097704637126, 'slip_spread_k': 0.16658392148928813, 'spread_hl_frac': 0.046548219053779, 'bb_std_mult': 2.6423572882207513, 'rsi_os': 50, 'rsi_ob': 92, 'vol_spike': 0.010608368402946456, 'adx_thresh': 33.779594360593144, 'atr_min_pct': 0.012497401374979775, 'atr_max_pct': 0.09441867854116648, 'tp_mult': 1.285250574600683, 'tsl_mult': 0.1695916734231183, 'strategy': 'mean_reversion', 'time_stop': 37, 'use_sma': False, 'use_atr': False, 'use_adx': False, 'use_ema': False, 'use_spike': False, 'rsi_required': False, 'edge_k': 0.9347860625972135, 'edge_cap': 0.8992225413500505, 'bull_strategy': 'breakout', 'bull_bb_std_mult': 2.2056350712366406, 'bull_rsi_os': 39, 'bull_rsi_ob': 53, 'bull_adx_thresh': 10.879310005626962, 'bull_atr_min_pct': 0.021148233769187022, 'bull_atr_max_pct': 0.0748547631865592, 'bull_tp_mult': 1.0325008440990884, 'bull_tsl_mult': 0.8213883999194543, 'bull_time_stop': 170, 'bull_use_sma': True, 'bull_use_ema': True, 'bull_use_atr': True, 'bull_use_adx': True, 'bull_use_spike': True, 'bull_rsi_required': False, 'bear_strategy': 'breakout', 'bear_bb_std_mult': 3.3682270211897083, 'bear_rsi_os': 18, 'bear_rsi_ob': 88, 'bear_adx_thresh': 12.354096687477844, 'bear_atr_min_pct': 0.005434572999218896, 'bear_atr_max_pct': 0.0434215226680477, 'bear_tp_mult': 2.6878464010744563, 'bear_tsl_mult': 0.1872683298143885, 'bear_time_stop': 227, 'bear_use_sma': False, 'bear_use_ema': True, 'bear_use_atr': True, 'bear_use_adx': True, 'bear_use_spike': True, 'bear_rsi_required': True, 'sideways_strategy': 'breakout', 'sideways_bb_std_mult': 1.2288325924974226, 'sideways_rsi_os': 13, 'sideways_rsi_ob': 62, 'sideways_adx_thresh': 33.43446332617959, 'sideways_atr_min_pct': 0.008100301219482008, 'sideways_atr_max_pct': 0.09797669343869339, 'sideways_tp_mult': 2.3964277468190307, 'sideways_tsl_mult': 0.6018086705718837, 'sideways_time_stop': 147, 'sideways_use_sma': False, 'sideways_use_ema': False, 'sideways_use_atr': True, 'sideways_use_adx': False, 'sideways_use_spike': True, 'sideways_rsi_required': True}.
[I 2025-09-01 08:53:22,568] Trial 528 finished with values: [-1000000000.0, 1000000000.0] and parameters: {'p_sma': 48, 'p_std': 36, 'p_atr': 21, 'p_adx': 16, 'rsi_period': 43, 'ema1': 7, 'ema2': 60, 'slip_atr_k': 0.1422492156886023, 'slip_spread_k': 0.087836387820946, 'spread_hl_frac': 0.03721521263697932, 'bb_std_mult': 1.1526618699697475, 'rsi_os': 49, 'rsi_ob': 51, 'vol_spike': 0.010556210439934113, 'adx_thresh': 34.964233144774354, 'atr_min_pct': 0.012382531305087947, 'atr_max_pct': 0.09524541960974876, 'tp_mult': 1.3512426937983595, 'tsl_mult': 0.7251678090421949, 'strategy': 'mean_reversion', 'time_stop': 48, 'use_sma': False, 'use_atr': True, 'use_adx': False, 'use_ema': False, 'use_spike': False, 'rsi_required': False, 'edge_k': 0.8827848816012626, 'edge_cap': 0.2835094928730223, 'bull_strategy': 'mean_reversion', 'bull_bb_std_mult': 2.343184308214813, 'bull_rsi_os': 39, 'bull_rsi_ob': 55, 'bull_adx_thresh': 11.489774475961475, 'bull_atr_min_pct': 0.019613467087384567, 'bull_atr_max_pct': 0.07669798573066121, 'bull_tp_mult': 1.2049142126876575, 'bull_tsl_mult': 0.40517871473701866, 'bull_time_stop': 171, 'bull_use_sma': True, 'bull_use_ema': True, 'bull_use_atr': True, 'bull_use_adx': True, 'bull_use_spike': True, 'bull_rsi_required': False, 'bear_strategy': 'mean_reversion', 'bear_bb_std_mult': 3.254606873175716, 'bear_rsi_os': 10, 'bear_rsi_ob': 92, 'bear_adx_thresh': 14.062056876332088, 'bear_atr_min_pct': 0.0060478568208804095, 'bear_atr_max_pct': 0.042361902211843584, 'bear_tp_mult': 2.763511249094958, 'bear_tsl_mult': 0.20182615837722018, 'bear_time_stop': 226, 'bear_use_sma': False, 'bear_use_ema': True, 'bear_use_atr': True, 'bear_use_adx': True, 'bear_use_spike': True, 'bear_rsi_required': True, 'sideways_strategy': 'breakout', 'sideways_bb_std_mult': 1.3824140633100468, 'sideways_rsi_os': 33, 'sideways_rsi_ob': 59, 'sideways_adx_thresh': 11.154525660124026, 'sideways_atr_min_pct': 0.008005884579246586, 'sideways_atr_max_pct': 0.0974314482586615, 'sideways_tp_mult': 2.5545523926486737, 'sideways_tsl_mult': 0.6158418271419437, 'sideways_time_stop': 160, 'sideways_use_sma': False, 'sideways_use_ema': False, 'sideways_use_atr': True, 'sideways_use_adx': False, 'sideways_use_spike': True, 'sideways_rsi_required': True}.
[I 2025-09-01 08:53:23,049] Trial 527 finished with values: [-1000000000.0, 1000000000.0] and parameters: {'p_sma': 13, 'p_std': 37, 'p_atr': 21, 'p_adx': 16, 'rsi_period': 40, 'ema1': 6, 'ema2': 60, 'slip_atr_k': 0.14283995463931215, 'slip_spread_k': 0.09050257622892396, 'spread_hl_frac': 0.03692470726724925, 'bb_std_mult': 0.5747801753554822, 'rsi_os': 49, 'rsi_ob': 92, 'vol_spike': 0.009370438581625283, 'adx_thresh': 33.172151734118984, 'atr_min_pct': 0.019742458755405562, 'atr_max_pct': 0.09523258093018074, 'tp_mult': 1.1480476391037069, 'tsl_mult': 0.6339526964534878, 'strategy': 'mean_reversion', 'time_stop': 47, 'use_sma': False, 'use_atr': True, 'use_adx': False, 'use_ema': False, 'use_spike': False, 'rsi_required': False, 'edge_k': 0.8789834475409228, 'edge_cap': 0.2625961969746271, 'bull_strategy': 'mean_reversion', 'bull_bb_std_mult': 2.370932935425807, 'bull_rsi_os': 40, 'bull_rsi_ob': 87, 'bull_adx_thresh': 11.952460843168616, 'bull_atr_min_pct': 0.020772498761307, 'bull_atr_max_pct': 0.07442440647279981, 'bull_tp_mult': 1.2074301754420027, 'bull_tsl_mult': 0.2780659887458399, 'bull_time_stop': 200, 'bull_use_sma': True, 'bull_use_ema': True, 'bull_use_atr': True, 'bull_use_adx': True, 'bull_use_spike': True, 'bull_rsi_required': False, 'bear_strategy': 'breakout', 'bear_bb_std_mult': 3.357778965982826, 'bear_rsi_os': 9, 'bear_rsi_ob': 92, 'bear_adx_thresh': 11.269777505914131, 'bear_atr_min_pct': 0.01481288367385209, 'bear_atr_max_pct': 0.04291520175638433, 'bear_tp_mult': 2.767161021822304, 'bear_tsl_mult': 0.19063319551257377, 'bear_time_stop': 227, 'bear_use_sma': False, 'bear_use_ema': True, 'bear_use_atr': True, 'bear_use_adx': True, 'bear_use_spike': True, 'bear_rsi_required': True, 'sideways_strategy': 'breakout', 'sideways_bb_std_mult': 1.3741831164345253, 'sideways_rsi_os': 47, 'sideways_rsi_ob': 60, 'sideways_adx_thresh': 11.344211502813216, 'sideways_atr_min_pct': 0.008227584752871329, 'sideways_atr_max_pct': 0.06961308110923364, 'sideways_tp_mult': 2.402818364784604, 'sideways_tsl_mult': 0.596500872940898, 'sideways_time_stop': 157, 'sideways_use_sma': False, 'sideways_use_ema': False, 'sideways_use_atr': True, 'sideways_use_adx': False, 'sideways_use_spike': True, 'sideways_rsi_required': True}.
[I 2025-09-01 08:53:23,913] Trial 530 finished with values: [-1000000000.0, 1000000000.0] and parameters: {'p_sma': 14, 'p_std': 8, 'p_atr': 20, 'p_adx': 17, 'rsi_period': 43, 'ema1': 7, 'ema2': 60, 'slip_atr_k': 0.01564502173037889, 'slip_spread_k': 0.09072264890205795, 'spread_hl_frac': 0.020245537984767577, 'bb_std_mult': 1.587501826168916, 'rsi_os': 49, 'rsi_ob': 94, 'vol_spike': 0.003995747160941484, 'adx_thresh': 34.52363985982784, 'atr_min_pct': 0.019669857272556827, 'atr_max_pct': 0.0938536383837234, 'tp_mult': 1.1576090979186893, 'tsl_mult': 0.6373927572263492, 'strategy': 'mean_reversion', 'time_stop': 45, 'use_sma': False, 'use_atr': True, 'use_adx': False, 'use_ema': False, 'use_spike': False, 'rsi_required': False, 'edge_k': 0.829752640758322, 'edge_cap': 0.7428416978430968, 'bull_strategy': 'mean_reversion', 'bull_bb_std_mult': 2.375883450872122, 'bull_rsi_os': 8, 'bull_rsi_ob': 91, 'bull_adx_thresh': 11.607812654034783, 'bull_atr_min_pct': 0.02061815131651198, 'bull_atr_max_pct': 0.08156878894265446, 'bull_tp_mult': 1.2184980448298754, 'bull_tsl_mult': 0.40495025455448774, 'bull_time_stop': 175, 'bull_use_sma': True, 'bull_use_ema': True, 'bull_use_atr': True, 'bull_use_adx': True, 'bull_use_spike': True, 'bull_rsi_required': False, 'bear_strategy': 'mean_reversion', 'bear_bb_std_mult': 3.2559306308302496, 'bear_rsi_os': 10, 'bear_rsi_ob': 89, 'bear_adx_thresh': 13.653552825150753, 'bear_atr_min_pct': 0.006111811218245737, 'bear_atr_max_pct': 0.03511696238867371, 'bear_tp_mult': 2.8241657615195344, 'bear_tsl_mult': 0.21545599537481958, 'bear_time_stop': 222, 'bear_use_sma': False, 'bear_use_ema': False, 'bear_use_atr': True, 'bear_use_adx': True, 'bear_use_spike': True, 'bear_rsi_required': True, 'sideways_strategy': 'breakout', 'sideways_bb_std_mult': 1.4571949559908866, 'sideways_rsi_os': 38, 'sideways_rsi_ob': 58, 'sideways_adx_thresh': 23.544927105390556, 'sideways_atr_min_pct': 0.0055002673577116586, 'sideways_atr_max_pct': 0.07599319935780248, 'sideways_tp_mult': 2.326146047524638, 'sideways_tsl_mult': 0.5054324735802633, 'sideways_time_stop': 159, 'sideways_use_sma': False, 'sideways_use_ema': False, 'sideways_use_atr': True, 'sideways_use_adx': False, 'sideways_use_spike': True, 'sideways_rsi_required': True}.
[I 2025-09-01 08:53:24,415] Trial 529 finished with values: [-1000000000.0, 1000000000.0] and parameters: {'p_sma': 47, 'p_std': 36, 'p_atr': 20, 'p_adx': 17, 'rsi_period': 36, 'ema1': 7, 'ema2': 60, 'slip_atr_k': 0.016653924879950866, 'slip_spread_k': 0.16421018405517956, 'spread_hl_frac': 0.020498664529290014, 'bb_std_mult': 0.8993168952337669, 'rsi_os': 49, 'rsi_ob': 94, 'vol_spike': 0.011634850887549592, 'adx_thresh': 33.89417121382502, 'atr_min_pct': 0.02587350548568085, 'atr_max_pct': 0.09401574822656998, 'tp_mult': 1.1388429825016257, 'tsl_mult': 0.20076478690724261, 'strategy': 'mean_reversion', 'time_stop': 43, 'use_sma': False, 'use_atr': False, 'use_adx': False, 'use_ema': False, 'use_spike': False, 'rsi_required': False, 'edge_k': 0.9302727437095194, 'edge_cap': 0.7428954617311068, 'bull_strategy': 'breakout', 'bull_bb_std_mult': 2.354564640771052, 'bull_rsi_os': 8, 'bull_rsi_ob': 53, 'bull_adx_thresh': 11.235051312848183, 'bull_atr_min_pct': 0.01975121744915108, 'bull_atr_max_pct': 0.0741477278419894, 'bull_tp_mult': 1.2081377164100688, 'bull_tsl_mult': 0.8333078414598082, 'bull_time_stop': 199, 'bull_use_sma': True, 'bull_use_ema': True, 'bull_use_atr': True, 'bull_use_adx': True, 'bull_use_spike': True, 'bull_rsi_required': False, 'bear_strategy': 'mean_reversion', 'bear_bb_std_mult': 3.276991777989114, 'bear_rsi_os': 53, 'bear_rsi_ob': 92, 'bear_adx_thresh': 13.90531020679179, 'bear_atr_min_pct': 0.023689118668377293, 'bear_atr_max_pct': 0.03575586537933998, 'bear_tp_mult': 2.8099396025545347, 'bear_tsl_mult': 0.26084384544112715, 'bear_time_stop': 226, 'bear_use_sma': False, 'bear_use_ema': True, 'bear_use_atr': True, 'bear_use_adx': True, 'bear_use_spike': True, 'bear_rsi_required': True, 'sideways_strategy': 'breakout', 'sideways_bb_std_mult': 1.311803151177916, 'sideways_rsi_os': 46, 'sideways_rsi_ob': 60, 'sideways_adx_thresh': 33.33854474439317, 'sideways_atr_min_pct': 0.008599427675838302, 'sideways_atr_max_pct': 0.09783477156199849, 'sideways_tp_mult': 2.398854418496021, 'sideways_tsl_mult': 0.37393905443775194, 'sideways_time_stop': 158, 'sideways_use_sma': False, 'sideways_use_ema': False, 'sideways_use_atr': True, 'sideways_use_adx': False, 'sideways_use_spike': True, 'sideways_rsi_required': True}.
