[I 2025-09-01 07:58:32,418] Trial 223 finished with values: [-1000000000.0, 1000000000.0] and parameters: {'p_sma': 27, 'p_std': 58, 'p_atr': 24, 'p_adx': 14, 'rsi_period': 59, 'ema1': 22, 'ema2': 22, 'slip_atr_k': 0.0018653577170823134, 'slip_spread_k': 0.8737820628620999, 'spread_hl_frac': 0.039431664436458506, 'bb_std_mult': 1.9247732876323846, 'rsi_os': 31, 'rsi_ob': 46, 'vol_spike': 0.0695999600123527, 'adx_thresh': 29.115199894497596, 'atr_min_pct': 0.0043733462589371315, 'atr_max_pct': 0.133015956196063, 'tp_mult': 1.6871753907445586, 'tsl_mult': 0.0781983300571932, 'strategy': 'breakout', 'time_stop': 239, 'use_sma': False, 'use_atr': False, 'use_adx': True, 'use_ema': True, 'use_spike': True, 'rsi_required': True, 'edge_k': 0.26576187205191115, 'edge_cap': 0.24330565014997788, 'bull_strategy': 'breakout', 'bull_bb_std_mult': 2.9199297514229547, 'bull_rsi_os': 48, 'bull_rsi_ob': 66, 'bull_adx_thresh': 9.934201887255456, 'bull_atr_min_pct': 0.003572592463736309, 'bull_atr_max_pct': 0.015874103310116308, 'bull_tp_mult': 1.5564404270346859, 'bull_tsl_mult': 0.6180262198179942, 'bull_time_stop': 60, 'bull_use_sma': True, 'bull_use_ema': False, 'bull_use_atr': False, 'bull_use_adx': False, 'bull_use_spike': False, 'bull_rsi_required': False, 'bear_strategy': 'mean_reversion', 'bear_bb_std_mult': 0.8770169457940196, 'bear_rsi_os': 45, 'bear_rsi_ob': 78, 'bear_adx_thresh': 6.236618361716406, 'bear_atr_min_pct': 0.007766593162104868, 'bear_atr_max_pct': 0.07635456493907271, 'bear_tp_mult': 2.1452844377804325, 'bear_tsl_mult': 0.05085053000845102, 'bear_time_stop': 293, 'bear_use_sma': True, 'bear_use_ema': False, 'bear_use_atr': True, 'bear_use_adx': False, 'bear_use_spike': False, 'bear_rsi_required': False, 'sideways_strategy': 'breakout', 'sideways_bb_std_mult': 0.9545701132915932, 'sideways_rsi_os': 6, 'sideways_rsi_ob': 95, 'sideways_adx_thresh': 8.143582196737709, 'sideways_atr_min_pct': 0.02724541952729958, 'sideways_atr_max_pct': 0.1112480556399756, 'sideways_tp_mult': 1.2550987826987816, 'sideways_tsl_mult': 0.07382486172297457, 'sideways_time_stop': 213, 'sideways_use_sma': True, 'sideways_use_ema': True, 'sideways_use_atr': True, 'sideways_use_adx': True, 'sideways_use_spike': False, 'sideways_rsi_required': False}.
[I 2025-09-01 07:58:32,898] Trial 224 finished with values: [-0.04575199141424258, 0.046497711269275196] and parameters: {'p_sma': 27, 'p_std': 52, 'p_atr': 24, 'p_adx': 8, 'rsi_period': 58, 'ema1': 23, 'ema2': 22, 'slip_atr_k': 0.06539626520846385, 'slip_spread_k': 0.8704391243073641, 'spread_hl_frac': 0.01147325856435924, 'bb_std_mult': 2.15172363044933, 'rsi_os': 31, 'rsi_ob': 91, 'vol_spike': 0.08987411102207615, 'adx_thresh': 29.094332285033744, 'atr_min_pct': 0.0045770708732092834, 'atr_max_pct': 0.13370287703271844, 'tp_mult': 1.9134175750312223, 'tsl_mult': 0.07192357072301393, 'strategy': 'breakout', 'time_stop': 242, 'use_sma': False, 'use_atr': False, 'use_adx': True, 'use_ema': True, 'use_spike': True, 'rsi_required': True, 'edge_k': 0.2616660603457062, 'edge_cap': 0.6379530097606295, 'bull_strategy': 'breakout', 'bull_bb_std_mult': 3.3296982686481904, 'bull_rsi_os': 48, 'bull_rsi_ob': 47, 'bull_adx_thresh': 9.988132692551774, 'bull_atr_min_pct': 0.003639430590928263, 'bull_atr_max_pct': 0.018288762312971656, 'bull_tp_mult': 1.5662895206987482, 'bull_tsl_mult': 0.6031888378335509, 'bull_time_stop': 59, 'bull_use_sma': True, 'bull_use_ema': False, 'bull_use_atr': False, 'bull_use_adx': False, 'bull_use_spike': False, 'bull_rsi_required': False, 'bear_strategy': 'mean_reversion', 'bear_bb_std_mult': 1.8410458288120037, 'bear_rsi_os': 46, 'bear_rsi_ob': 78, 'bear_adx_thresh': 6.435624546520906, 'bear_atr_min_pct': 0.001958867239682593, 'bear_atr_max_pct': 0.08997102350371114, 'bear_tp_mult': 2.1561328184064115, 'bear_tsl_mult': 0.05145223225241884, 'bear_time_stop': 293, 'bear_use_sma': True, 'bear_use_ema': False, 'bear_use_atr': True, 'bear_use_adx': False, 'bear_use_spike': False, 'bear_rsi_required': False, 'sideways_strategy': 'breakout', 'sideways_bb_std_mult': 0.9363976313753251, 'sideways_rsi_os': 6, 'sideways_rsi_ob': 95, 'sideways_adx_thresh': 12.37842854513368, 'sideways_atr_min_pct': 0.026324252864663465, 'sideways_atr_max_pct': 0.11908821851830548, 'sideways_tp_mult': 1.2516709881850934, 'sideways_tsl_mult': 0.04782409869156673, 'sideways_time_stop': 235, 'sideways_use_sma': True, 'sideways_use_ema': True, 'sideways_use_atr': True, 'sideways_use_adx': True, 'sideways_use_spike': False, 'sideways_rsi_required': False}.
[I 2025-09-01 07:59:14,968] Trial 230 finished with values: [-1000000000.0, 1000000000.0] and parameters: {'p_sma': 31, 'p_std': 56, 'p_atr': 18, 'p_adx': 7, 'rsi_period': 48, 'ema1': 16, 'ema2': 36, 'slip_atr_k': 0.04675409957307003, 'slip_spread_k': 0.9074163615807738, 'spread_hl_frac': 0.005765929129507715, 'bb_std_mult': 1.4042510255438554, 'rsi_os': 21, 'rsi_ob': 68, 'vol_spike': 0.05551432529614923, 'adx_thresh': 30.951078242163383, 'atr_min_pct': 0.006048064789784721, 'atr_max_pct': 0.1457343680330226, 'tp_mult': 1.703026028909095, 'tsl_mult': 0.02955488759320289, 'strategy': 'mean_reversion', 'time_stop': 250, 'use_sma': True, 'use_atr': False, 'use_adx': True, 'use_ema': True, 'use_spike': True, 'rsi_required': True, 'edge_k': 0.17649685412132754, 'edge_cap': 0.2117182718674726, 'bull_strategy': 'breakout', 'bull_bb_std_mult': 2.840648364875902, 'bull_rsi_os': 41, 'bull_rsi_ob': 46, 'bull_adx_thresh': 6.062560688924869, 'bull_atr_min_pct': 0.015732529404193864, 'bull_atr_max_pct': 0.07820215075939056, 'bull_tp_mult': 1.4991931456155727, 'bull_tsl_mult': 0.5408546407622927, 'bull_time_stop': 258, 'bull_use_sma': True, 'bull_use_ema': False, 'bull_use_atr': True, 'bull_use_adx': True, 'bull_use_spike': False, 'bull_rsi_required': False, 'bear_strategy': 'mean_reversion', 'bear_bb_std_mult': 1.9286535407775973, 'bear_rsi_os': 47, 'bear_rsi_ob': 79, 'bear_adx_thresh': 5.496699716316305, 'bear_atr_min_pct': 0.006660170019522706, 'bear_atr_max_pct': 0.13784649631749812, 'bear_tp_mult': 2.024645974920493, 'bear_tsl_mult': 0.17601284272006873, 'bear_time_stop': 295, 'bear_use_sma': True, 'bear_use_ema': True, 'bear_use_atr': False, 'bear_use_adx': True, 'bear_use_spike': True, 'bear_rsi_required': False, 'sideways_strategy': 'breakout', 'sideways_bb_std_mult': 1.1719991310978397, 'sideways_rsi_os': 8, 'sideways_rsi_ob': 92, 'sideways_adx_thresh': 19.061793396322905, 'sideways_atr_min_pct': 0.028101720418210324, 'sideways_atr_max_pct': 0.05076610812487435, 'sideways_tp_mult': 1.415222652644875, 'sideways_tsl_mult': 0.8275535290863931, 'sideways_time_stop': 221, 'sideways_use_sma': True, 'sideways_use_ema': True, 'sideways_use_atr': True, 'sideways_use_adx': True, 'sideways_use_spike': False, 'sideways_rsi_required': False}.
[I 2025-09-01 07:59:15,343] Trial 229 finished with values: [-1000000000.0, 1000000000.0] and parameters: {'p_sma': 31, 'p_std': 56, 'p_atr': 13, 'p_adx': 7, 'rsi_period': 61, 'ema1': 9, 'ema2': 56, 'slip_atr_k': 0.06418906298998568, 'slip_spread_k': 0.9834426800786754, 'spread_hl_frac': 0.005800410109369393, 'bb_std_mult': 1.6851838887018118, 'rsi_os': 27, 'rsi_ob': 68, 'vol_spike': 0.05438715620239704, 'adx_thresh': 29.720184431903494, 'atr_min_pct': 0.005001318375101594, 'atr_max_pct': 0.09914284430386525, 'tp_mult': 1.7120645412293742, 'tsl_mult': 0.13071919179345884, 'strategy': 'mean_reversion', 'time_stop': 250, 'use_sma': True, 'use_atr': False, 'use_adx': True, 'use_ema': True, 'use_spike': True, 'rsi_required': True, 'edge_k': 0.17594596967527434, 'edge_cap': 0.18042562443040155, 'bull_strategy': 'breakout', 'bull_bb_std_mult': 2.806849327798625, 'bull_rsi_os': 38, 'bull_rsi_ob': 48, 'bull_adx_thresh': 5.7670581975133555, 'bull_atr_min_pct': 0.024006419477561387, 'bull_atr_max_pct': 0.09290096873481848, 'bull_tp_mult': 1.5116492048062635, 'bull_tsl_mult': 0.5458019052905434, 'bull_time_stop': 74, 'bull_use_sma': True, 'bull_use_ema': False, 'bull_use_atr': True, 'bull_use_adx': True, 'bull_use_spike': False, 'bull_rsi_required': False, 'bear_strategy': 'mean_reversion', 'bear_bb_std_mult': 1.8251926127561695, 'bear_rsi_os': 17, 'bear_rsi_ob': 79, 'bear_adx_thresh': 7.251318049243158, 'bear_atr_min_pct': 0.013526423808184926, 'bear_atr_max_pct': 0.018687233895769075, 'bear_tp_mult': 2.1241094009675368, 'bear_tsl_mult': 0.1489337566694557, 'bear_time_stop': 294, 'bear_use_sma': True, 'bear_use_ema': True, 'bear_use_atr': True, 'bear_use_adx': False, 'bear_use_spike': True, 'bear_rsi_required': False, 'sideways_strategy': 'breakout', 'sideways_bb_std_mult': 1.0414633777383797, 'sideways_rsi_os': 8, 'sideways_rsi_ob': 92, 'sideways_adx_thresh': 11.156859393047561, 'sideways_atr_min_pct': 0.028128168964876864, 'sideways_atr_max_pct': 0.013289369332588976, 'sideways_tp_mult': 1.4412409676833515, 'sideways_tsl_mult': 0.04535926344676632, 'sideways_time_stop': 133, 'sideways_use_sma': True, 'sideways_use_ema': True, 'sideways_use_atr': True, 'sideways_use_adx': True, 'sideways_use_spike': False, 'sideways_rsi_required': False}.
[I 2025-09-01 07:59:15,531] Trial 227 finished with values: [-0.05775322648190773, 0.05797382172797263] and parameters: {'p_sma': 31, 'p_std': 52, 'p_atr': 8, 'p_adx': 14, 'rsi_period': 58, 'ema1': 7, 'ema2': 20, 'slip_atr_k': 0.06550845639198516, 'slip_spread_k': 0.987619212591585, 'spread_hl_frac': 0.011684504331230907, 'bb_std_mult': 1.9325644108332818, 'rsi_os': 22, 'rsi_ob': 91, 'vol_spike': 0.06846918418883938, 'adx_thresh': 29.24265376030703, 'atr_min_pct': 0.004171697151540967, 'atr_max_pct': 0.12908151555759517, 'tp_mult': 1.9020681598825284, 'tsl_mult': 0.03176264764492038, 'strategy': 'mean_reversion', 'time_stop': 249, 'use_sma': False, 'use_atr': False, 'use_adx': True, 'use_ema': True, 'use_spike': True, 'rsi_required': True, 'edge_k': 0.2597612729817399, 'edge_cap': 0.8145105360477859, 'bull_strategy': 'breakout', 'bull_bb_std_mult': 3.3067358474067863, 'bull_rsi_os': 38, 'bull_rsi_ob': 46, 'bull_adx_thresh': 10.11220243288022, 'bull_atr_min_pct': 0.005035356364566966, 'bull_atr_max_pct': 0.030682634811303747, 'bull_tp_mult': 1.5410155731303108, 'bull_tsl_mult': 0.5979653969395445, 'bull_time_stop': 73, 'bull_use_sma': True, 'bull_use_ema': False, 'bull_use_atr': True, 'bull_use_adx': True, 'bull_use_spike': False, 'bull_rsi_required': False, 'bear_strategy': 'mean_reversion', 'bear_bb_std_mult': 0.5362196912807751, 'bear_rsi_os': 46, 'bear_rsi_ob': 77, 'bear_adx_thresh': 6.282728473571992, 'bear_atr_min_pct': 0.00244501804195383, 'bear_atr_max_pct': 0.07193637552164286, 'bear_tp_mult': 2.136407165436953, 'bear_tsl_mult': 0.058296818250479575, 'bear_time_stop': 294, 'bear_use_sma': True, 'bear_use_ema': False, 'bear_use_atr': True, 'bear_use_adx': False, 'bear_use_spike': True, 'bear_rsi_required': False, 'sideways_strategy': 'breakout', 'sideways_bb_std_mult': 0.9454255230523554, 'sideways_rsi_os': 6, 'sideways_rsi_ob': 92, 'sideways_adx_thresh': 8.184342200186064, 'sideways_atr_min_pct': 0.02673957941363843, 'sideways_atr_max_pct': 0.12496195587468792, 'sideways_tp_mult': 1.4222645536757546, 'sideways_tsl_mult': 0.04664323948759901, 'sideways_time_stop': 117, 'sideways_use_sma': True, 'sideways_use_ema': True, 'sideways_use_atr': True, 'sideways_use_adx': True, 'sideways_use_spike': False, 'sideways_rsi_required': False}.
[I 2025-09-01 07:59:15,736] Trial 228 finished with values: [-1000000000.0, 1000000000.0] and parameters: {'p_sma': 31, 'p_std': 56, 'p_atr': 13, 'p_adx': 7, 'rsi_period': 61, 'ema1': 16, 'ema2': 18, 'slip_atr_k': 0.19171482239165735, 'slip_spread_k': 0.988804092662663, 'spread_hl_frac': 0.011787849078271384, 'bb_std_mult': 1.5264070193461916, 'rsi_os': 24, 'rsi_ob': 51, 'vol_spike': 0.057890550226012104, 'adx_thresh': 29.556371128910023, 'atr_min_pct': 0.004895521392444241, 'atr_max_pct': 0.13040362162950922, 'tp_mult': 1.6953118385149046, 'tsl_mult': 0.03264011728333588, 'strategy': 'mean_reversion', 'time_stop': 249, 'use_sma': True, 'use_atr': False, 'use_adx': True, 'use_ema': True, 'use_spike': True, 'rsi_required': True, 'edge_k': 0.16964383384268808, 'edge_cap': 0.18727542606132433, 'bull_strategy': 'breakout', 'bull_bb_std_mult': 3.316266368338113, 'bull_rsi_os': 50, 'bull_rsi_ob': 48, 'bull_adx_thresh': 7.208701875448382, 'bull_atr_min_pct': 0.025119125390615275, 'bull_atr_max_pct': 0.030888329463750808, 'bull_tp_mult': 1.4442381128243826, 'bull_tsl_mult': 0.6835420425989078, 'bull_time_stop': 72, 'bull_use_sma': True, 'bull_use_ema': False, 'bull_use_atr': True, 'bull_use_adx': True, 'bull_use_spike': False, 'bull_rsi_required': False, 'bear_strategy': 'mean_reversion', 'bear_bb_std_mult': 1.1887980635671433, 'bear_rsi_os': 47, 'bear_rsi_ob': 79, 'bear_adx_thresh': 5.017230053107021, 'bear_atr_min_pct': 0.006831904807609672, 'bear_atr_max_pct': 0.01237073762269393, 'bear_tp_mult': 2.310744895383731, 'bear_tsl_mult': 0.17222948529876175, 'bear_time_stop': 295, 'bear_use_sma': True, 'bear_use_ema': True, 'bear_use_atr': True, 'bear_use_adx': False, 'bear_use_spike': True, 'bear_rsi_required': False, 'sideways_strategy': 'breakout', 'sideways_bb_std_mult': 3.2717306094271947, 'sideways_rsi_os': 8, 'sideways_rsi_ob': 90, 'sideways_adx_thresh': 12.279646464664998, 'sideways_atr_min_pct': 0.02823646114212947, 'sideways_atr_max_pct': 0.013053701656265718, 'sideways_tp_mult': 1.3125583277376676, 'sideways_tsl_mult': 0.040169031705042935, 'sideways_time_stop': 132, 'sideways_use_sma': True, 'sideways_use_ema': True, 'sideways_use_atr': True, 'sideways_use_adx': True, 'sideways_use_spike': False, 'sideways_rsi_required': False}.
[I 2025-09-01 07:59:57,045] Trial 234 finished with values: [-1000000000.0, 1000000000.0] and parameters: {'p_sma': 28, 'p_std': 57, 'p_atr': 22, 'p_adx': 30, 'rsi_period': 55, 'ema1': 15, 'ema2': 20, 'slip_atr_k': 0.0002835633996654055, 'slip_spread_k': 0.8303418332601562, 'spread_hl_frac': 0.0036654358825381483, 'bb_std_mult': 2.165376520313311, 'rsi_os': 33, 'rsi_ob': 88, 'vol_spike': 0.06503238263991237, 'adx_thresh': 28.39770125312919, 'atr_min_pct': 0.0039779249360353715, 'atr_max_pct': 0.12785702455237943, 'tp_mult': 1.665224222411749, 'tsl_mult': 0.08369823672319061, 'strategy': 'breakout', 'time_stop': 270, 'use_sma': False, 'use_atr': True, 'use_adx': True, 'use_ema': True, 'use_spike': True, 'rsi_required': True, 'edge_k': 0.12046272418519123, 'edge_cap': 0.21631381836171854, 'bull_strategy': 'mean_reversion', 'bull_bb_std_mult': 3.103000049565964, 'bull_rsi_os': 55, 'bull_rsi_ob': 63, 'bull_adx_thresh': 8.06114045841189, 'bull_atr_min_pct': 0.003077449529801609, 'bull_atr_max_pct': 0.12245015805844281, 'bull_tp_mult': 1.5494836189544419, 'bull_tsl_mult': 0.5863672138167945, 'bull_time_stop': 69, 'bull_use_sma': True, 'bull_use_ema': True, 'bull_use_atr': False, 'bull_use_adx': False, 'bull_use_spike': False, 'bull_rsi_required': False, 'bear_strategy': 'mean_reversion', 'bear_bb_std_mult': 1.9433989850856714, 'bear_rsi_os': 44, 'bear_rsi_ob': 81, 'bear_adx_thresh': 5.568296016614176, 'bear_atr_min_pct': 0.007923431568879308, 'bear_atr_max_pct': 0.08107622098086426, 'bear_tp_mult': 2.1009677613803146, 'bear_tsl_mult': 0.09272961269017257, 'bear_time_stop': 286, 'bear_use_sma': True, 'bear_use_ema': False, 'bear_use_atr': False, 'bear_use_adx': False, 'bear_use_spike': False, 'bear_rsi_required': False, 'sideways_strategy': 'breakout', 'sideways_bb_std_mult': 3.5623375968493773, 'sideways_rsi_os': 5, 'sideways_rsi_ob': 93, 'sideways_adx_thresh': 11.113063539367726, 'sideways_atr_min_pct': 0.021916170125023497, 'sideways_atr_max_pct': 0.022007871314097913, 'sideways_tp_mult': 1.3105251144106211, 'sideways_tsl_mult': 0.2972075932687538, 'sideways_time_stop': 226, 'sideways_use_sma': True, 'sideways_use_ema': True, 'sideways_use_atr': False, 'sideways_use_adx': True, 'sideways_use_spike': False, 'sideways_rsi_required': False}.
[I 2025-09-01 07:59:57,287] Trial 233 finished with values: [-1000000000.0, 1000000000.0] and parameters: {'p_sma': 29, 'p_std': 56, 'p_atr': 21, 'p_adx': 8, 'rsi_period': 64, 'ema1': 14, 'ema2': 14, 'slip_atr_k': 0.23290786523211104, 'slip_spread_k': 0.832525506166076, 'spread_hl_frac': 0.04468047665007108, 'bb_std_mult': 1.5163722251813159, 'rsi_os': 24, 'rsi_ob': 88, 'vol_spike': 0.059408890629433136, 'adx_thresh': 30.389784687013343, 'atr_min_pct': 0.0028566670443920406, 'atr_max_pct': 0.12911489935258458, 'tp_mult': 1.7522666988287907, 'tsl_mult': 0.038977727213757814, 'strategy': 'breakout', 'time_stop': 269, 'use_sma': False, 'use_atr': True, 'use_adx': True, 'use_ema': True, 'use_spike': True, 'rsi_required': True, 'edge_k': 0.20844186232487086, 'edge_cap': 0.17914516580099737, 'bull_strategy': 'mean_reversion', 'bull_bb_std_mult': 3.1070476147333093, 'bull_rsi_os': 50, 'bull_rsi_ob': 72, 'bull_adx_thresh': 7.101189920349683, 'bull_atr_min_pct': 0.003093748156003357, 'bull_atr_max_pct': 0.02924898395240134, 'bull_tp_mult': 2.651558200553669, 'bull_tsl_mult': 0.6757236815882252, 'bull_time_stop': 69, 'bull_use_sma': True, 'bull_use_ema': True, 'bull_use_atr': False, 'bull_use_adx': False, 'bull_use_spike': False, 'bull_rsi_required': False, 'bear_strategy': 'mean_reversion', 'bear_bb_std_mult': 3.4363488087299285, 'bear_rsi_os': 49, 'bear_rsi_ob': 81, 'bear_adx_thresh': 5.066808666171214, 'bear_atr_min_pct': 0.008232623754096204, 'bear_atr_max_pct': 0.11640384335922466, 'bear_tp_mult': 2.104810719006905, 'bear_tsl_mult': 0.6833529875410925, 'bear_time_stop': 300, 'bear_use_sma': True, 'bear_use_ema': False, 'bear_use_atr': False, 'bear_use_adx': False, 'bear_use_spike': False, 'bear_rsi_required': False, 'sideways_strategy': 'breakout', 'sideways_bb_std_mult': 3.389024963686645, 'sideways_rsi_os': 5, 'sideways_rsi_ob': 90, 'sideways_adx_thresh': 12.096309178484717, 'sideways_atr_min_pct': 0.02308081120747215, 'sideways_atr_max_pct': 0.013017099122185561, 'sideways_tp_mult': 2.377978783989338, 'sideways_tsl_mult': 0.25408938453472396, 'sideways_time_stop': 119, 'sideways_use_sma': True, 'sideways_use_ema': True, 'sideways_use_atr': False, 'sideways_use_adx': True, 'sideways_use_spike': False, 'sideways_rsi_required': False}.
[I 2025-09-01 07:59:57,637] Trial 231 finished with values: [-1000000000.0, 1000000000.0] and parameters: {'p_sma': 29, 'p_std': 53, 'p_atr': 13, 'p_adx': 21, 'rsi_period': 61, 'ema1': 9, 'ema2': 20, 'slip_atr_k': 0.20804226762986688, 'slip_spread_k': 0.974232491204565, 'spread_hl_frac': 0.0041175740429346755, 'bb_std_mult': 2.084612032355335, 'rsi_os': 33, 'rsi_ob': 89, 'vol_spike': 0.05754126616294736, 'adx_thresh': 25.767451410089077, 'atr_min_pct': 0.005074569138316174, 'atr_max_pct': 0.1278680905608446, 'tp_mult': 1.683540298706911, 'tsl_mult': 0.13136400323467112, 'strategy': 'mean_reversion', 'time_stop': 269, 'use_sma': False, 'use_atr': False, 'use_adx': True, 'use_ema': True, 'use_spike': True, 'rsi_required': True, 'edge_k': 0.21469884862939664, 'edge_cap': 0.18308487769388293, 'bull_strategy': 'breakout', 'bull_bb_std_mult': 3.1182058405159054, 'bull_rsi_os': 55, 'bull_rsi_ob': 48, 'bull_adx_thresh': 7.210326741393688, 'bull_atr_min_pct': 0.028643100888037093, 'bull_atr_max_pct': 0.0303638464173489, 'bull_tp_mult': 1.450733659329566, 'bull_tsl_mult': 0.5847741596679782, 'bull_time_stop': 72, 'bull_use_sma': True, 'bull_use_ema': True, 'bull_use_atr': True, 'bull_use_adx': True, 'bull_use_spike': False, 'bull_rsi_required': False, 'bear_strategy': 'mean_reversion', 'bear_bb_std_mult': 1.8069803052697844, 'bear_rsi_os': 46, 'bear_rsi_ob': 81, 'bear_adx_thresh': 7.058893764981901, 'bear_atr_min_pct': 0.013951578301550966, 'bear_atr_max_pct': 0.011463569816289945, 'bear_tp_mult': 2.31740570033094, 'bear_tsl_mult': 0.14701614502781205, 'bear_time_stop': 295, 'bear_use_sma': True, 'bear_use_ema': False, 'bear_use_atr': True, 'bear_use_adx': False, 'bear_use_spike': True, 'bear_rsi_required': False, 'sideways_strategy': 'breakout', 'sideways_bb_std_mult': 1.0519509924621124, 'sideways_rsi_os': 5, 'sideways_rsi_ob': 92, 'sideways_adx_thresh': 5.289190059323557, 'sideways_atr_min_pct': 0.028278500837046198, 'sideways_atr_max_pct': 0.013139192261127247, 'sideways_tp_mult': 2.394535333295545, 'sideways_tsl_mult': 0.2874624580084319, 'sideways_time_stop': 204, 'sideways_use_sma': True, 'sideways_use_ema': True, 'sideways_use_atr': True, 'sideways_use_adx': True, 'sideways_use_spike': False, 'sideways_rsi_required': False}.
