[I 2025-09-01 07:21:50,009] Trial 8 finished with values: [-1000000000.0, 1000000000.0] and parameters: {'p_sma': 18, 'p_std': 29, 'p_atr': 24, 'p_adx': 16, 'rsi_period': 30, 'ema1': 26, 'ema2': 17, 'slip_atr_k': 0.11886335742316015, 'slip_spread_k': 0.4394283446803243, 'spread_hl_frac': 0.008321030526840268, 'bb_std_mult': 2.1888123366382213, 'rsi_os': 23, 'rsi_ob': 69, 'vol_spike': 0.12573273683775646, 'adx_thresh': 24.154959861169853, 'atr_min_pct': 0.010449625675760433, 'atr_max_pct': 0.1270178925820202, 'tp_mult': 2.680950177683415, 'tsl_mult': 0.3348494939207044, 'strategy': 'mean_reversion', 'time_stop': 164, 'use_sma': True, 'use_atr': False, 'use_adx': False, 'use_ema': False, 'use_spike': False, 'rsi_required': False, 'edge_k': 1.8819469944823946, 'edge_cap': 0.9301136485516796, 'bull_strategy': 'breakout', 'bull_bb_std_mult': 1.8028888841636457, 'bull_rsi_os': 11, 'bull_rsi_ob': 87, 'bull_adx_thresh': 20.245943405405082, 'bull_atr_min_pct': 0.028753041127822003, 'bull_atr_max_pct': 0.08597973053008091, 'bull_tp_mult': 1.0839315814745183, 'bull_tsl_mult': 0.6249017726558644, 'bull_time_stop': 111, 'bull_use_sma': False, 'bull_use_ema': True, 'bull_use_atr': True, 'bull_use_adx': True, 'bull_use_spike': False, 'bull_rsi_required': False, 'bear_strategy': 'mean_reversion', 'bear_bb_std_mult': 2.398007586834849, 'bear_rsi_os': 50, 'bear_rsi_ob': 53, 'bear_adx_thresh': 24.28792402314956, 'bear_atr_min_pct': 0.01400438747582688, 'bear_atr_max_pct': 0.09706655454340658, 'bear_tp_mult': 1.9631334199181263, 'bear_tsl_mult': 0.7662399227954175, 'bear_time_stop': 19, 'bear_use_sma': False, 'bear_use_ema': False, 'bear_use_atr': True, 'bear_use_adx': True, 'bear_use_spike': True, 'bear_rsi_required': True, 'sideways_strategy': 'breakout', 'sideways_bb_std_mult': 3.445424005064693, 'sideways_rsi_os': 33, 'sideways_rsi_ob': 75, 'sideways_adx_thresh': 10.340075630528881, 'sideways_atr_min_pct': 0.024067132649216866, 'sideways_atr_max_pct': 0.127662827509025, 'sideways_tp_mult': 2.2186718319251564, 'sideways_tsl_mult': 0.8097926554260394, 'sideways_time_stop': 40, 'sideways_use_sma': True, 'sideways_use_ema': True, 'sideways_use_atr': True, 'sideways_use_adx': True, 'sideways_use_spike': False, 'sideways_rsi_required': True}.
[I 2025-09-01 07:22:26,043] Trial 9 finished with values: [-1000000000.0, 1000000000.0] and parameters: {'p_sma': 36, 'p_std': 10, 'p_atr': 26, 'p_adx': 10, 'rsi_period': 80, 'ema1': 18, 'ema2': 10, 'slip_atr_k': 0.03273944796043485, 'slip_spread_k': 0.027218571368879174, 'spread_hl_frac': 0.011322738656240318, 'bb_std_mult': 2.9590250604602404, 'rsi_os': 27, 'rsi_ob': 73, 'vol_spike': 0.19341323385253356, 'adx_thresh': 29.487953744549817, 'atr_min_pct': 0.007811513125903313, 'atr_max_pct': 0.10290513534396017, 'tp_mult': 1.0802675452290909, 'tsl_mult': 0.3608363494454535, 'strategy': 'breakout', 'time_stop': 155, 'use_sma': True, 'use_atr': False, 'use_adx': False, 'use_ema': False, 'use_spike': False, 'rsi_required': False, 'edge_k': 0.5032626925567423, 'edge_cap': 0.698033813124783, 'bull_strategy': 'mean_reversion', 'bull_bb_std_mult': 2.3815419683535066, 'bull_rsi_os': 40, 'bull_rsi_ob': 62, 'bull_adx_thresh': 7.121726593183949, 'bull_atr_min_pct': 0.02357592637347302, 'bull_atr_max_pct': 0.04210598014701973, 'bull_tp_mult': 2.403740791715857, 'bull_tsl_mult': 0.9414970050189551, 'bull_time_stop': 164, 'bull_use_sma': True, 'bull_use_ema': True, 'bull_use_atr': False, 'bull_use_adx': True, 'bull_use_spike': True, 'bull_rsi_required': False, 'bear_strategy': 'mean_reversion', 'bear_bb_std_mult': 1.0792197901648797, 'bear_rsi_os': 40, 'bear_rsi_ob': 88, 'bear_adx_thresh': 27.80098206469808, 'bear_atr_min_pct': 0.028483245298109496, 'bear_atr_max_pct': 0.013122763314603653, 'bear_tp_mult': 2.0288345364189957, 'bear_tsl_mult': 0.6449296184716482, 'bear_time_stop': 290, 'bear_use_sma': False, 'bear_use_ema': False, 'bear_use_atr': False, 'bear_use_adx': False, 'bear_use_spike': False, 'bear_rsi_required': False, 'sideways_strategy': 'mean_reversion', 'sideways_bb_std_mult': 0.507119811512714, 'sideways_rsi_os': 31, 'sideways_rsi_ob': 70, 'sideways_adx_thresh': 6.5150963471940795, 'sideways_atr_min_pct': 0.012404903852541367, 'sideways_atr_max_pct': 0.09773421907528036, 'sideways_tp_mult': 1.5423067355359206, 'sideways_tsl_mult': 0.4644279116826575, 'sideways_time_stop': 231, 'sideways_use_sma': False, 'sideways_use_ema': False, 'sideways_use_atr': False, 'sideways_use_adx': False, 'sideways_use_spike': False, 'sideways_rsi_required': True}.
[I 2025-09-01 07:22:27,996] Trial 13 finished with values: [-0.0089966254535353, 0.0090554058677124] and parameters: {'p_sma': 36, 'p_std': 59, 'p_atr': 30, 'p_adx': 21, 'rsi_period': 38, 'ema1': 9, 'ema2': 10, 'slip_atr_k': 0.01935866330367475, 'slip_spread_k': 0.7289606903728594, 'spread_hl_frac': 0.0007556157653113497, 'bb_std_mult': 1.5613082359562391, 'rsi_os': 7, 'rsi_ob': 92, 'vol_spike': 0.19967578258720894, 'adx_thresh': 17.41740623786081, 'atr_min_pct': 0.029784509211496647, 'atr_max_pct': 0.10508734860270347, 'tp_mult': 1.2294761104853607, 'tsl_mult': 0.0050629909880494095, 'strategy': 'mean_reversion', 'time_stop': 212, 'use_sma': False, 'use_atr': True, 'use_adx': False, 'use_ema': False, 'use_spike': True, 'rsi_required': True, 'edge_k': 0.10799223601429853, 'edge_cap': 0.36541321817635997, 'bull_strategy': 'mean_reversion', 'bull_bb_std_mult': 3.4585412252395833, 'bull_rsi_os': 54, 'bull_rsi_ob': 67, 'bull_adx_thresh': 5.870330440932375, 'bull_atr_min_pct': 0.0014702162124024115, 'bull_atr_max_pct': 0.05165160540666061, 'bull_tp_mult': 2.1145009707475406, 'bull_tsl_mult': 0.9013348001492197, 'bull_time_stop': 147, 'bull_use_sma': False, 'bull_use_ema': False, 'bull_use_atr': True, 'bull_use_adx': True, 'bull_use_spike': True, 'bull_rsi_required': True, 'bear_strategy': 'breakout', 'bear_bb_std_mult': 3.3801248418466336, 'bear_rsi_os': 53, 'bear_rsi_ob': 90, 'bear_adx_thresh': 6.37450284821054, 'bear_atr_min_pct': 0.02092814643043993, 'bear_atr_max_pct': 0.14518207749184248, 'bear_tp_mult': 1.0375478429448117, 'bear_tsl_mult': 0.4786094695099159, 'bear_time_stop': 71, 'bear_use_sma': False, 'bear_use_ema': False, 'bear_use_atr': False, 'bear_use_adx': False, 'bear_use_spike': True, 'bear_rsi_required': True, 'sideways_strategy': 'mean_reversion', 'sideways_bb_std_mult': 2.1720303301319275, 'sideways_rsi_os': 5, 'sideways_rsi_ob': 46, 'sideways_adx_thresh': 26.033295162953973, 'sideways_atr_min_pct': 0.010052363190824762, 'sideways_atr_max_pct': 0.08043554999426637, 'sideways_tp_mult': 1.3703606399391346, 'sideways_tsl_mult': 0.6580750866248013, 'sideways_time_stop': 78, 'sideways_use_sma': True, 'sideways_use_ema': False, 'sideways_use_atr': False, 'sideways_use_adx': False, 'sideways_use_spike': True, 'sideways_rsi_required': True}.
[I 2025-09-01 07:22:28,655] Trial 10 finished with values: [-1000000000.0, 1000000000.0] and parameters: {'p_sma': 57, 'p_std': 30, 'p_atr': 7, 'p_adx': 18, 'rsi_period': 53, 'ema1': 13, 'ema2': 18, 'slip_atr_k': 0.09183970736987468, 'slip_spread_k': 0.36315138640561495, 'spread_hl_frac': 0.012279556590207442, 'bb_std_mult': 2.9207226718464216, 'rsi_os': 49, 'rsi_ob': 63, 'vol_spike': 0.04628503651096681, 'adx_thresh': 29.451002805558687, 'atr_min_pct': 0.022781466170824813, 'atr_max_pct': 0.10799729438323208, 'tp_mult': 2.3127749127687816, 'tsl_mult': 0.557464952062244, 'strategy': 'breakout', 'time_stop': 210, 'use_sma': False, 'use_atr': True, 'use_adx': False, 'use_ema': False, 'use_spike': True, 'rsi_required': False, 'edge_k': 1.7146093634664121, 'edge_cap': 0.36600975025801374, 'bull_strategy': 'mean_reversion', 'bull_bb_std_mult': 3.571283967835587, 'bull_rsi_os': 13, 'bull_rsi_ob': 71, 'bull_adx_thresh': 15.594271465265296, 'bull_atr_min_pct': 0.011018005766482649, 'bull_atr_max_pct': 0.06177204009307692, 'bull_tp_mult': 2.1063030546929227, 'bull_tsl_mult': 0.9146414332244538, 'bull_time_stop': 250, 'bull_use_sma': True, 'bull_use_ema': True, 'bull_use_atr': True, 'bull_use_adx': False, 'bull_use_spike': True, 'bull_rsi_required': False, 'bear_strategy': 'mean_reversion', 'bear_bb_std_mult': 2.6000368793191937, 'bear_rsi_os': 35, 'bear_rsi_ob': 69, 'bear_adx_thresh': 12.640413190815996, 'bear_atr_min_pct': 0.004330661915535705, 'bear_atr_max_pct': 0.09776631692925408, 'bear_tp_mult': 1.7627311648499073, 'bear_tsl_mult': 0.011741566725315788, 'bear_time_stop': 251, 'bear_use_sma': True, 'bear_use_ema': True, 'bear_use_atr': False, 'bear_use_adx': True, 'bear_use_spike': True, 'bear_rsi_required': True, 'sideways_strategy': 'mean_reversion', 'sideways_bb_std_mult': 1.7709655695095465, 'sideways_rsi_os': 55, 'sideways_rsi_ob': 53, 'sideways_adx_thresh': 5.55523960610445, 'sideways_atr_min_pct': 0.019833553185657323, 'sideways_atr_max_pct': 0.1057370390798779, 'sideways_tp_mult': 2.1742812697469627, 'sideways_tsl_mult': 0.1291679891866866, 'sideways_time_stop': 218, 'sideways_use_sma': False, 'sideways_use_ema': False, 'sideways_use_atr': True, 'sideways_use_adx': True, 'sideways_use_spike': True, 'sideways_rsi_required': True}.
[I 2025-09-01 07:22:28,661] Trial 12 finished with values: [-0.01298902244127853, 0.013066691102433537] and parameters: {'p_sma': 37, 'p_std': 60, 'p_atr': 15, 'p_adx': 20, 'rsi_period': 40, 'ema1': 8, 'ema2': 11, 'slip_atr_k': 0.018962063102081372, 'slip_spread_k': 0.7040476164405994, 'spread_hl_frac': 0.00362541328246525, 'bb_std_mult': 1.6899446148035566, 'rsi_os': 8, 'rsi_ob': 62, 'vol_spike': 0.2021342754866775, 'adx_thresh': 5.6516159489987, 'atr_min_pct': 0.029267154090678253, 'atr_max_pct': 0.1472771055609999, 'tp_mult': 1.132213715340191, 'tsl_mult': 0.027761335238667806, 'strategy': 'mean_reversion', 'time_stop': 210, 'use_sma': False, 'use_atr': True, 'use_adx': False, 'use_ema': False, 'use_spike': True, 'rsi_required': True, 'edge_k': 0.08768358690706501, 'edge_cap': 0.38712012551749914, 'bull_strategy': 'mean_reversion', 'bull_bb_std_mult': 3.598539304892298, 'bull_rsi_os': 54, 'bull_rsi_ob': 65, 'bull_adx_thresh': 5.246700520499411, 'bull_atr_min_pct': 8.636716384297831e-05, 'bull_atr_max_pct': 0.05194164709444081, 'bull_tp_mult': 2.1338830403698923, 'bull_tsl_mult': 0.9466417522348205, 'bull_time_stop': 147, 'bull_use_sma': False, 'bull_use_ema': False, 'bull_use_atr': True, 'bull_use_adx': True, 'bull_use_spike': True, 'bull_rsi_required': True, 'bear_strategy': 'breakout', 'bear_bb_std_mult': 3.5665924521519186, 'bear_rsi_os': 55, 'bear_rsi_ob': 92, 'bear_adx_thresh': 5.369945401279873, 'bear_atr_min_pct': 0.021817756661162216, 'bear_atr_max_pct': 0.13928482423587957, 'bear_tp_mult': 1.021792141667429, 'bear_tsl_mult': 0.4851901706406013, 'bear_time_stop': 83, 'bear_use_sma': False, 'bear_use_ema': False, 'bear_use_atr': False, 'bear_use_adx': False, 'bear_use_spike': True, 'bear_rsi_required': True, 'sideways_strategy': 'mean_reversion', 'sideways_bb_std_mult': 2.1468931201243295, 'sideways_rsi_os': 5, 'sideways_rsi_ob': 45, 'sideways_adx_thresh': 26.539008241348196, 'sideways_atr_min_pct': 0.009792288197835073, 'sideways_atr_max_pct': 0.08308919403191384, 'sideways_tp_mult': 1.353339784691295, 'sideways_tsl_mult': 0.9998572625625376, 'sideways_time_stop': 7, 'sideways_use_sma': True, 'sideways_use_ema': False, 'sideways_use_atr': False, 'sideways_use_adx': False, 'sideways_use_spike': True, 'sideways_rsi_required': True}.
[I 2025-09-01 07:23:03,059] Trial 14 finished with values: [-0.016149594926984312, 0.01623125958691824] and parameters: {'p_sma': 32, 'p_std': 60, 'p_atr': 14, 'p_adx': 18, 'rsi_period': 40, 'ema1': 8, 'ema2': 28, 'slip_atr_k': 0.08623388648044833, 'slip_spread_k': 0.97398536575577, 'spread_hl_frac': 0.002534707376687083, 'bb_std_mult': 1.620453760952985, 'rsi_os': 6, 'rsi_ob': 95, 'vol_spike': 0.1771733291503651, 'adx_thresh': 17.379999989551692, 'atr_min_pct': 0.022168063661936806, 'atr_max_pct': 0.14857198911105746, 'tp_mult': 1.9196643035078476, 'tsl_mult': 0.015105064558675663, 'strategy': 'mean_reversion', 'time_stop': 221, 'use_sma': False, 'use_atr': True, 'use_adx': False, 'use_ema': False, 'use_spike': True, 'rsi_required': True, 'edge_k': 0.038480441783783514, 'edge_cap': 0.9926440840595685, 'bull_strategy': 'mean_reversion', 'bull_bb_std_mult': 0.5492767047441034, 'bull_rsi_os': 53, 'bull_rsi_ob': 64, 'bull_adx_thresh': 6.467558032848523, 'bull_atr_min_pct': 0.0012169531599561297, 'bull_atr_max_pct': 0.05677573396907977, 'bull_tp_mult': 1.8287083951023346, 'bull_tsl_mult': 0.998752365349845, 'bull_time_stop': 249, 'bull_use_sma': False, 'bull_use_ema': False, 'bull_use_atr': True, 'bull_use_adx': True, 'bull_use_spike': True, 'bull_rsi_required': True, 'bear_strategy': 'breakout', 'bear_bb_std_mult': 3.2688980896029283, 'bear_rsi_os': 55, 'bear_rsi_ob': 66, 'bear_adx_thresh': 5.862106228048461, 'bear_atr_min_pct': 0.021554454689039278, 'bear_atr_max_pct': 0.14408339429916442, 'bear_tp_mult': 1.165587767150416, 'bear_tsl_mult': 0.41429938157787205, 'bear_time_stop': 78, 'bear_use_sma': False, 'bear_use_ema': False, 'bear_use_atr': True, 'bear_use_adx': False, 'bear_use_spike': True, 'bear_rsi_required': True, 'sideways_strategy': 'mean_reversion', 'sideways_bb_std_mult': 1.9457684442448269, 'sideways_rsi_os': 6, 'sideways_rsi_ob': 45, 'sideways_adx_thresh': 26.415897254274608, 'sideways_atr_min_pct': 0.003041018645749377, 'sideways_atr_max_pct': 0.08002476733381962, 'sideways_tp_mult': 1.0373823046876445, 'sideways_tsl_mult': 0.9965185788369645, 'sideways_time_stop': 193, 'sideways_use_sma': True, 'sideways_use_ema': False, 'sideways_use_atr': False, 'sideways_use_adx': True, 'sideways_use_spike': False, 'sideways_rsi_required': True}.
[I 2025-09-01 07:23:07,365] Trial 15 finished with values: [-0.010656552967068689, 0.01071618283829614] and parameters: {'p_sma': 36, 'p_std': 60, 'p_atr': 30, 'p_adx': 22, 'rsi_period': 41, 'ema1': 7, 'ema2': 24, 'slip_atr_k': 0.0010315136828928442, 'slip_spread_k': 0.7331055051900661, 'spread_hl_frac': 0.0029707580094792936, 'bb_std_mult': 1.672363310326341, 'rsi_os': 6, 'rsi_ob': 94, 'vol_spike': 0.18139712320280713, 'adx_thresh': 16.769920055486356, 'atr_min_pct': 0.028311200238778755, 'atr_max_pct': 0.14528230559627153, 'tp_mult': 1.5429410677752204, 'tsl_mult': 0.0036119329531588227, 'strategy': 'mean_reversion', 'time_stop': 219, 'use_sma': False, 'use_atr': True, 'use_adx': False, 'use_ema': False, 'use_spike': True, 'rsi_required': True, 'edge_k': 0.0011255302720840632, 'edge_cap': 0.35005240392059234, 'bull_strategy': 'mean_reversion', 'bull_bb_std_mult': 3.409688285587626, 'bull_rsi_os': 55, 'bull_rsi_ob': 66, 'bull_adx_thresh': 5.239293661937612, 'bull_atr_min_pct': 0.0006898023747827516, 'bull_atr_max_pct': 0.06048851050993017, 'bull_tp_mult': 1.7575520338502169, 'bull_tsl_mult': 0.9899054848218669, 'bull_time_stop': 110, 'bull_use_sma': False, 'bull_use_ema': False, 'bull_use_atr': True, 'bull_use_adx': True, 'bull_use_spike': True, 'bull_rsi_required': True, 'bear_strategy': 'breakout', 'bear_bb_std_mult': 3.5767727591599403, 'bear_rsi_os': 55, 'bear_rsi_ob': 95, 'bear_adx_thresh': 6.115585944898233, 'bear_atr_min_pct': 0.021000577221229864, 'bear_atr_max_pct': 0.14865030734916068, 'bear_tp_mult': 1.0381886615356755, 'bear_tsl_mult': 0.39347901483856107, 'bear_time_stop': 72, 'bear_use_sma': False, 'bear_use_ema': False, 'bear_use_atr': False, 'bear_use_adx': False, 'bear_use_spike': True, 'bear_rsi_required': True, 'sideways_strategy': 'mean_reversion', 'sideways_bb_std_mult': 2.2860487570006613, 'sideways_rsi_os': 5, 'sideways_rsi_ob': 46, 'sideways_adx_thresh': 26.943013902290545, 'sideways_atr_min_pct': 0.008286416920769837, 'sideways_atr_max_pct': 0.0704854722980503, 'sideways_tp_mult': 1.0753007459112633, 'sideways_tsl_mult': 0.9635862047667971, 'sideways_time_stop': 24, 'sideways_use_sma': True, 'sideways_use_ema': False, 'sideways_use_atr': False, 'sideways_use_adx': False, 'sideways_use_spike': True, 'sideways_rsi_required': True}.
[I 2025-09-01 07:23:07,386] Trial 17 finished with values: [-0.011081924830053547, 0.011194407410919347] and parameters: {'p_sma': 38, 'p_std': 40, 'p_atr': 30, 'p_adx': 23, 'rsi_period': 43, 'ema1': 5, 'ema2': 10, 'slip_atr_k': 0.0025447391942808734, 'slip_spread_k': 0.7036204832907611, 'spread_hl_frac': 0.001129921644426463, 'bb_std_mult': 1.4320281971377076, 'rsi_os': 5, 'rsi_ob': 94, 'vol_spike': 0.10623608347343816, 'adx_thresh': 6.685077095875847, 'atr_min_pct': 0.02996705163010181, 'atr_max_pct': 0.14819987078241884, 'tp_mult': 1.7233303152195754, 'tsl_mult': 0.007379330336347897, 'strategy': 'mean_reversion', 'time_stop': 206, 'use_sma': False, 'use_atr': True, 'use_adx': False, 'use_ema': False, 'use_spike': True, 'rsi_required': True, 'edge_k': 0.0185341969850666, 'edge_cap': 0.3953802022814769, 'bull_strategy': 'mean_reversion', 'bull_bb_std_mult': 3.392229071828605, 'bull_rsi_os': 54, 'bull_rsi_ob': 66, 'bull_adx_thresh': 22.785675040469854, 'bull_atr_min_pct': 0.0010464381910554894, 'bull_atr_max_pct': 0.010223617083018152, 'bull_tp_mult': 1.71837330638848, 'bull_tsl_mult': 0.38541244859853363, 'bull_time_stop': 196, 'bull_use_sma': False, 'bull_use_ema': False, 'bull_use_atr': True, 'bull_use_adx': True, 'bull_use_spike': True, 'bull_rsi_required': True, 'bear_strategy': 'breakout', 'bear_bb_std_mult': 3.3704147494710988, 'bear_rsi_os': 5, 'bear_rsi_ob': 95, 'bear_adx_thresh': 5.035677239276192, 'bear_atr_min_pct': 0.020461887607583343, 'bear_atr_max_pct': 0.1487182233562792, 'bear_tp_mult': 1.0841594058549173, 'bear_tsl_mult': 0.38722294513354244, 'bear_time_stop': 67, 'bear_use_sma': False, 'bear_use_ema': False, 'bear_use_atr': False, 'bear_use_adx': False, 'bear_use_spike': True, 'bear_rsi_required': True, 'sideways_strategy': 'mean_reversion', 'sideways_bb_std_mult': 2.3547990189119705, 'sideways_rsi_os': 5, 'sideways_rsi_ob': 58, 'sideways_adx_thresh': 27.265528209726586, 'sideways_atr_min_pct': 0.007766561182596983, 'sideways_atr_max_pct': 0.07292584132346888, 'sideways_tp_mult': 1.1052731090012409, 'sideways_tsl_mult': 0.6453877180328093, 'sideways_time_stop': 6, 'sideways_use_sma': True, 'sideways_use_ema': False, 'sideways_use_atr': False, 'sideways_use_adx': False, 'sideways_use_spike': True, 'sideways_rsi_required': True}.
[I 2025-09-01 07:23:07,859] Trial 16 finished with values: [-0.010073074852815389, 0.01013284308233364] and parameters: {'p_sma': 34, 'p_std': 60, 'p_atr': 30, 'p_adx': 23, 'rsi_period': 35, 'ema1': 5, 'ema2': 10, 'slip_atr_k': 0.0014863119767881058, 'slip_spread_k': 0.7207032375440933, 'spread_hl_frac': 0.00037817013905542445, 'bb_std_mult': 1.6791440768039645, 'rsi_os': 5, 'rsi_ob': 93, 'vol_spike': 0.1805318441381422, 'adx_thresh': 16.77231614940532, 'atr_min_pct': 0.02924346165974307, 'atr_max_pct': 0.14991283671772132, 'tp_mult': 1.680635215232201, 'tsl_mult': 0.017819121876698457, 'strategy': 'mean_reversion', 'time_stop': 221, 'use_sma': False, 'use_atr': True, 'use_adx': False, 'use_ema': False, 'use_spike': True, 'rsi_required': True, 'edge_k': 0.020602936255265727, 'edge_cap': 0.35660201751125775, 'bull_strategy': 'mean_reversion', 'bull_bb_std_mult': 3.5045715149723233, 'bull_rsi_os': 55, 'bull_rsi_ob': 93, 'bull_adx_thresh': 5.3764807517199085, 'bull_atr_min_pct': 1.986800090702026e-05, 'bull_atr_max_pct': 0.050329467371122594, 'bull_tp_mult': 1.769635002127149, 'bull_tsl_mult': 0.983727198680848, 'bull_time_stop': 109, 'bull_use_sma': False, 'bull_use_ema': False, 'bull_use_atr': True, 'bull_use_adx': True, 'bull_use_spike': True, 'bull_rsi_required': True, 'bear_strategy': 'breakout', 'bear_bb_std_mult': 3.574203702943768, 'bear_rsi_os': 52, 'bear_rsi_ob': 94, 'bear_adx_thresh': 5.63239387420463, 'bear_atr_min_pct': 0.02197848597776797, 'bear_atr_max_pct': 0.14613247912528793, 'bear_tp_mult': 1.0800133016292675, 'bear_tsl_mult': 0.4003564038826755, 'bear_time_stop': 70, 'bear_use_sma': False, 'bear_use_ema': False, 'bear_use_atr': False, 'bear_use_adx': False, 'bear_use_spike': True, 'bear_rsi_required': True, 'sideways_strategy': 'mean_reversion', 'sideways_bb_std_mult': 2.2261952575173427, 'sideways_rsi_os': 9, 'sideways_rsi_ob': 45, 'sideways_adx_thresh': 28.115326633974604, 'sideways_atr_min_pct': 0.008694804169233333, 'sideways_atr_max_pct': 0.0746631956695316, 'sideways_tp_mult': 1.025716559608026, 'sideways_tsl_mult': 0.6518588374441104, 'sideways_time_stop': 17, 'sideways_use_sma': True, 'sideways_use_ema': False, 'sideways_use_atr': False, 'sideways_use_adx': False, 'sideways_use_spike': True, 'sideways_rsi_required': True}.
