[I 2025-09-01 07:25:58,200] Trial 33 finished with values: [-1000000000.0, 1000000000.0] and parameters: {'p_sma': 60, 'p_std': 35, 'p_atr': 24, 'p_adx': 20, 'rsi_period': 45, 'ema1': 23, 'ema2': 41, 'slip_atr_k': 0.09842967848275862, 'slip_spread_k': 0.9921782553377021, 'spread_hl_frac': 0.003704553152131365, 'bb_std_mult': 1.6298700626224638, 'rsi_os': 19, 'rsi_ob': 74, 'vol_spike': 0.19611378356189865, 'adx_thresh': 25.432364166929354, 'atr_min_pct': 0.013282480600012147, 'atr_max_pct': 0.09623296898205788, 'tp_mult': 1.0689591497311426, 'tsl_mult': 0.2562609647622729, 'strategy': 'breakout', 'time_stop': 224, 'use_sma': True, 'use_atr': True, 'use_adx': False, 'use_ema': False, 'use_spike': True, 'rsi_required': True, 'edge_k': 0.521121368111495, 'edge_cap': 0.0509634879592471, 'bull_strategy': 'mean_reversion', 'bull_bb_std_mult': 1.1801787351658335, 'bull_rsi_os': 31, 'bull_rsi_ob': 52, 'bull_adx_thresh': 22.11691478755647, 'bull_atr_min_pct': 0.0039506861021403345, 'bull_atr_max_pct': 0.06408623578665987, 'bull_tp_mult': 2.639475837216998, 'bull_tsl_mult': 0.052488739771154425, 'bull_time_stop': 133, 'bull_use_sma': False, 'bull_use_ema': True, 'bull_use_atr': False, 'bull_use_adx': False, 'bull_use_spike': False, 'bull_rsi_required': True, 'bear_strategy': 'breakout', 'bear_bb_std_mult': 2.532202283150891, 'bear_rsi_os': 44, 'bear_rsi_ob': 60, 'bear_adx_thresh': 18.533760789445367, 'bear_atr_min_pct': 0.015597273732947847, 'bear_atr_max_pct': 0.04539950376793227, 'bear_tp_mult': 2.6115843310507674, 'bear_tsl_mult': 0.34444208784352404, 'bear_time_stop': 98, 'bear_use_sma': True, 'bear_use_ema': False, 'bear_use_atr': True, 'bear_use_adx': True, 'bear_use_spike': False, 'bear_rsi_required': True, 'sideways_strategy': 'mean_reversion', 'sideways_bb_std_mult': 3.0883625337237146, 'sideways_rsi_os': 16, 'sideways_rsi_ob': 48, 'sideways_adx_thresh': 28.362131214572955, 'sideways_atr_min_pct': 0.018256221898928435, 'sideways_atr_max_pct': 0.06368298571586783, 'sideways_tp_mult': 1.524828869318164, 'sideways_tsl_mult': 0.5430398587688425, 'sideways_time_stop': 167, 'sideways_use_sma': True, 'sideways_use_ema': False, 'sideways_use_atr': False, 'sideways_use_adx': True, 'sideways_use_spike': False, 'sideways_rsi_required': True}.
[I 2025-09-01 07:26:46,028] Trial 40 finished with values: [-1000000000.0, 1000000000.0] and parameters: {'p_sma': 13, 'p_std': 49, 'p_atr': 19, 'p_adx': 17, 'rsi_period': 60, 'ema1': 18, 'ema2': 50, 'slip_atr_k': 0.225832963885297, 'slip_spread_k': 0.384425109327192, 'spread_hl_frac': 0.022030352705719604, 'bb_std_mult': 1.264076086215201, 'rsi_os': 11, 'rsi_ob': 52, 'vol_spike': 0.2713861820449527, 'adx_thresh': 18.942746531266554, 'atr_min_pct': 0.023602758855832247, 'atr_max_pct': 0.12115574706823795, 'tp_mult': 1.855819427906384, 'tsl_mult': 0.6503153066338403, 'strategy': 'breakout', 'time_stop': 42, 'use_sma': False, 'use_atr': False, 'use_adx': True, 'use_ema': True, 'use_spike': False, 'rsi_required': False, 'edge_k': 1.5829399921966631, 'edge_cap': 0.2209662882369535, 'bull_strategy': 'breakout', 'bull_bb_std_mult': 2.553678879698145, 'bull_rsi_os': 15, 'bull_rsi_ob': 46, 'bull_adx_thresh': 18.342393985798637, 'bull_atr_min_pct': 0.008598664125348536, 'bull_atr_max_pct': 0.09691201862942017, 'bull_tp_mult': 2.223239826593726, 'bull_tsl_mult': 0.29009074448926686, 'bull_time_stop': 224, 'bull_use_sma': True, 'bull_use_ema': True, 'bull_use_atr': False, 'bull_use_adx': False, 'bull_use_spike': True, 'bull_rsi_required': False, 'bear_strategy': 'mean_reversion', 'bear_bb_std_mult': 0.8352813703204134, 'bear_rsi_os': 38, 'bear_rsi_ob': 49, 'bear_adx_thresh': 7.6971063200232495, 'bear_atr_min_pct': 0.0006082459085318334, 'bear_atr_max_pct': 0.061537047505972046, 'bear_tp_mult': 2.9969525058569695, 'bear_tsl_mult': 0.44365138373499446, 'bear_time_stop': 150, 'bear_use_sma': False, 'bear_use_ema': True, 'bear_use_atr': False, 'bear_use_adx': False, 'bear_use_spike': False, 'bear_rsi_required': False, 'sideways_strategy': 'breakout', 'sideways_bb_std_mult': 0.9345883000032205, 'sideways_rsi_os': 48, 'sideways_rsi_ob': 67, 'sideways_adx_thresh': 13.899381022525498, 'sideways_atr_min_pct': 0.015887692235503632, 'sideways_atr_max_pct': 0.010258975522886264, 'sideways_tp_mult': 1.1342994504184936, 'sideways_tsl_mult': 0.7434816183794986, 'sideways_time_stop': 108, 'sideways_use_sma': False, 'sideways_use_ema': True, 'sideways_use_atr': True, 'sideways_use_adx': False, 'sideways_use_spike': True, 'sideways_rsi_required': False}.
[I 2025-09-01 07:26:47,431] Trial 37 finished with values: [-1000000000.0, 1000000000.0] and parameters: {'p_sma': 59, 'p_std': 5, 'p_atr': 19, 'p_adx': 13, 'rsi_period': 33, 'ema1': 20, 'ema2': 23, 'slip_atr_k': 0.21299731503120695, 'slip_spread_k': 0.3448512700337436, 'spread_hl_frac': 0.028574194018227222, 'bb_std_mult': 1.3140182300416678, 'rsi_os': 19, 'rsi_ob': 50, 'vol_spike': 0.27623842669778187, 'adx_thresh': 25.997032496103483, 'atr_min_pct': 0.023733083856075306, 'atr_max_pct': 0.13389185854086086, 'tp_mult': 1.8633494563088524, 'tsl_mult': 0.6423954305306807, 'strategy': 'breakout', 'time_stop': 143, 'use_sma': True, 'use_atr': False, 'use_adx': True, 'use_ema': True, 'use_spike': False, 'rsi_required': False, 'edge_k': 1.5962436693853674, 'edge_cap': 0.21329779515730568, 'bull_strategy': 'breakout', 'bull_bb_std_mult': 1.2647833821768049, 'bull_rsi_os': 13, 'bull_rsi_ob': 61, 'bull_adx_thresh': 25.820235605536595, 'bull_atr_min_pct': 0.012829049417978765, 'bull_atr_max_pct': 0.09713488316478115, 'bull_tp_mult': 2.1855251419626236, 'bull_tsl_mult': 0.28948602463894935, 'bull_time_stop': 229, 'bull_use_sma': True, 'bull_use_ema': True, 'bull_use_atr': False, 'bull_use_adx': False, 'bull_use_spike': False, 'bull_rsi_required': False, 'bear_strategy': 'breakout', 'bear_bb_std_mult': 0.797047082433272, 'bear_rsi_os': 19, 'bear_rsi_ob': 63, 'bear_adx_thresh': 19.29002492019982, 'bear_atr_min_pct': 0.015449554473066618, 'bear_atr_max_pct': 0.043872200333691574, 'bear_tp_mult': 1.1492467646969278, 'bear_tsl_mult': 0.42861106942072036, 'bear_time_stop': 96, 'bear_use_sma': True, 'bear_use_ema': False, 'bear_use_atr': False, 'bear_use_adx': True, 'bear_use_spike': False, 'bear_rsi_required': False, 'sideways_strategy': 'mean_reversion', 'sideways_bb_std_mult': 3.259119240956869, 'sideways_rsi_os': 42, 'sideways_rsi_ob': 68, 'sideways_adx_thresh': 27.77244398651428, 'sideways_atr_min_pct': 0.017547622322113397, 'sideways_atr_max_pct': 0.017050187876943193, 'sideways_tp_mult': 1.152219375369933, 'sideways_tsl_mult': 0.7235386019197062, 'sideways_time_stop': 106, 'sideways_use_sma': False, 'sideways_use_ema': True, 'sideways_use_atr': True, 'sideways_use_adx': False, 'sideways_use_spike': False, 'sideways_rsi_required': True}.
[I 2025-09-01 07:26:49,107] Trial 39 finished with values: [-1000000000.0, 1000000000.0] and parameters: {'p_sma': 52, 'p_std': 48, 'p_atr': 19, 'p_adx': 18, 'rsi_period': 77, 'ema1': 23, 'ema2': 25, 'slip_atr_k': 0.24007927764761583, 'slip_spread_k': 0.4899359305225718, 'spread_hl_frac': 0.035903922463606096, 'bb_std_mult': 0.5298448610748648, 'rsi_os': 11, 'rsi_ob': 73, 'vol_spike': 0.0012509615267541352, 'adx_thresh': 26.993419811305298, 'atr_min_pct': 0.02355448828636888, 'atr_max_pct': 0.09633170307728495, 'tp_mult': 1.510418651177165, 'tsl_mult': 0.681014247904503, 'strategy': 'breakout', 'time_stop': 51, 'use_sma': True, 'use_atr': False, 'use_adx': True, 'use_ema': True, 'use_spike': False, 'rsi_required': False, 'edge_k': 1.9710831861128792, 'edge_cap': 0.22342565181222468, 'bull_strategy': 'breakout', 'bull_bb_std_mult': 2.5431733032973707, 'bull_rsi_os': 15, 'bull_rsi_ob': 45, 'bull_adx_thresh': 18.060710021459936, 'bull_atr_min_pct': 0.009001191093162645, 'bull_atr_max_pct': 0.09905767421878584, 'bull_tp_mult': 2.2144638399949126, 'bull_tsl_mult': 0.28014877619505113, 'bull_time_stop': 147, 'bull_use_sma': True, 'bull_use_ema': True, 'bull_use_atr': False, 'bull_use_adx': False, 'bull_use_spike': True, 'bull_rsi_required': False, 'bear_strategy': 'breakout', 'bear_bb_std_mult': 0.9527032524314243, 'bear_rsi_os': 38, 'bear_rsi_ob': 49, 'bear_adx_thresh': 7.177691822914113, 'bear_atr_min_pct': 0.027317192588439614, 'bear_atr_max_pct': 0.06077968937792598, 'bear_tp_mult': 1.1924955935749264, 'bear_tsl_mult': 0.4404115255195234, 'bear_time_stop': 100, 'bear_use_sma': True, 'bear_use_ema': True, 'bear_use_atr': False, 'bear_use_adx': True, 'bear_use_spike': False, 'bear_rsi_required': False, 'sideways_strategy': 'mean_reversion', 'sideways_bb_std_mult': 2.954128898216497, 'sideways_rsi_os': 46, 'sideways_rsi_ob': 66, 'sideways_adx_thresh': 29.43602786121098, 'sideways_atr_min_pct': 0.01517083388809768, 'sideways_atr_max_pct': 0.010965516375725657, 'sideways_tp_mult': 2.8674080736904215, 'sideways_tsl_mult': 0.5009356283072267, 'sideways_time_stop': 110, 'sideways_use_sma': False, 'sideways_use_ema': True, 'sideways_use_atr': True, 'sideways_use_adx': False, 'sideways_use_spike': True, 'sideways_rsi_required': False}.
[I 2025-09-01 07:26:50,328] Trial 38 finished with values: [-1000000000.0, 1000000000.0] and parameters: {'p_sma': 52, 'p_std': 48, 'p_atr': 19, 'p_adx': 9, 'rsi_period': 77, 'ema1': 23, 'ema2': 23, 'slip_atr_k': 0.2455501245504617, 'slip_spread_k': 0.488794137232959, 'spread_hl_frac': 0.023403277504299456, 'bb_std_mult': 1.311365531748603, 'rsi_os': 12, 'rsi_ob': 73, 'vol_spike': 0.00892615779211639, 'adx_thresh': 19.024835425779816, 'atr_min_pct': 0.024648190502193214, 'atr_max_pct': 0.09773541841792241, 'tp_mult': 1.8491067631338252, 'tsl_mult': 0.6376300675243203, 'strategy': 'breakout', 'time_stop': 44, 'use_sma': True, 'use_atr': False, 'use_adx': True, 'use_ema': True, 'use_spike': False, 'rsi_required': False, 'edge_k': 1.9651817187633454, 'edge_cap': 0.21925089839703843, 'bull_strategy': 'breakout', 'bull_bb_std_mult': 2.4777874672965003, 'bull_rsi_os': 15, 'bull_rsi_ob': 45, 'bull_adx_thresh': 26.030139118748515, 'bull_atr_min_pct': 0.012916722146047688, 'bull_atr_max_pct': 0.09827338565534753, 'bull_tp_mult': 2.2189450590611175, 'bull_tsl_mult': 0.28663386334211527, 'bull_time_stop': 224, 'bull_use_sma': True, 'bull_use_ema': True, 'bull_use_atr': False, 'bull_use_adx': False, 'bull_use_spike': True, 'bull_rsi_required': False, 'bear_strategy': 'breakout', 'bear_bb_std_mult': 0.9325699823516773, 'bear_rsi_os': 17, 'bear_rsi_ob': 65, 'bear_adx_thresh': 8.379738686937507, 'bear_atr_min_pct': 0.027265894091576807, 'bear_atr_max_pct': 0.07226250325656378, 'bear_tp_mult': 1.1655498962375552, 'bear_tsl_mult': 0.43674031021635773, 'bear_time_stop': 101, 'bear_use_sma': True, 'bear_use_ema': True, 'bear_use_atr': False, 'bear_use_adx': True, 'bear_use_spike': False, 'bear_rsi_required': False, 'sideways_strategy': 'mean_reversion', 'sideways_bb_std_mult': 2.9289747480266923, 'sideways_rsi_os': 46, 'sideways_rsi_ob': 67, 'sideways_adx_thresh': 28.36632732566443, 'sideways_atr_min_pct': 0.016499356447004263, 'sideways_atr_max_pct': 0.018157387661474896, 'sideways_tp_mult': 1.1575709987020624, 'sideways_tsl_mult': 0.493951345598352, 'sideways_time_stop': 103, 'sideways_use_sma': False, 'sideways_use_ema': True, 'sideways_use_atr': True, 'sideways_use_adx': False, 'sideways_use_spike': True, 'sideways_rsi_required': False}.
[I 2025-09-01 07:26:50,487] Trial 41 finished with values: [-1000000000.0, 1000000000.0] and parameters: {'p_sma': 53, 'p_std': 29, 'p_atr': 14, 'p_adx': 9, 'rsi_period': 73, 'ema1': 22, 'ema2': 25, 'slip_atr_k': 0.21048238073738376, 'slip_spread_k': 0.4878241361470268, 'spread_hl_frac': 0.037924761888637026, 'bb_std_mult': 3.4382281029022983, 'rsi_os': 10, 'rsi_ob': 66, 'vol_spike': 0.03769372778249491, 'adx_thresh': 27.265056713705718, 'atr_min_pct': 0.027860473089234134, 'atr_max_pct': 0.026668721876257538, 'tp_mult': 1.5051371136458405, 'tsl_mult': 0.518798197143435, 'strategy': 'breakout', 'time_stop': 148, 'use_sma': True, 'use_atr': False, 'use_adx': True, 'use_ema': True, 'use_spike': False, 'rsi_required': False, 'edge_k': 1.9669679728277263, 'edge_cap': 0.7801798696968665, 'bull_strategy': 'breakout', 'bull_bb_std_mult': 2.80086596104311, 'bull_rsi_os': 16, 'bull_rsi_ob': 60, 'bull_adx_thresh': 25.59567032132774, 'bull_atr_min_pct': 0.013225309998373284, 'bull_atr_max_pct': 0.07243273058256652, 'bull_tp_mult': 2.00550781865657, 'bull_tsl_mult': 0.4645661138234235, 'bull_time_stop': 268, 'bull_use_sma': True, 'bull_use_ema': True, 'bull_use_atr': False, 'bull_use_adx': False, 'bull_use_spike': True, 'bull_rsi_required': False, 'bear_strategy': 'breakout', 'bear_bb_std_mult': 1.2546186096266927, 'bear_rsi_os': 20, 'bear_rsi_ob': 57, 'bear_adx_thresh': 21.06061526435943, 'bear_atr_min_pct': 0.02726824758522529, 'bear_atr_max_pct': 0.09017747134511131, 'bear_tp_mult': 1.1640348134794776, 'bear_tsl_mult': 0.6617586985559253, 'bear_time_stop': 113, 'bear_use_sma': True, 'bear_use_ema': True, 'bear_use_atr': False, 'bear_use_adx': True, 'bear_use_spike': False, 'bear_rsi_required': False, 'sideways_strategy': 'mean_reversion', 'sideways_bb_std_mult': 2.8807507675597988, 'sideways_rsi_os': 42, 'sideways_rsi_ob': 80, 'sideways_adx_thresh': 31.41730175660694, 'sideways_atr_min_pct': 0.021111871484214693, 'sideways_atr_max_pct': 0.020023459857790728, 'sideways_tp_mult': 2.8769397559137664, 'sideways_tsl_mult': 0.7034659488280817, 'sideways_time_stop': 63, 'sideways_use_sma': False, 'sideways_use_ema': True, 'sideways_use_atr': True, 'sideways_use_adx': False, 'sideways_use_spike': True, 'sideways_rsi_required': False}.
[I 2025-09-01 07:26:50,828] Trial 44 finished with values: [-1000000000.0, 1000000000.0] and parameters: {'p_sma': 47, 'p_std': 28, 'p_atr': 14, 'p_adx': 14, 'rsi_period': 41, 'ema1': 30, 'ema2': 18, 'slip_atr_k': 0.14695253067823882, 'slip_spread_k': 0.6295663988783982, 'spread_hl_frac': 0.03981445820720672, 'bb_std_mult': 3.2547572393324833, 'rsi_os': 25, 'rsi_ob': 67, 'vol_spike': 0.10786068927140557, 'adx_thresh': 22.859863067894672, 'atr_min_pct': 0.027769720875059835, 'atr_max_pct': 0.02746664398399961, 'tp_mult': 2.9842108394547955, 'tsl_mult': 0.9664626761120513, 'strategy': 'breakout', 'time_stop': 100, 'use_sma': False, 'use_atr': False, 'use_adx': False, 'use_ema': False, 'use_spike': False, 'rsi_required': False, 'edge_k': 0.8735017002831671, 'edge_cap': 0.8654474467105846, 'bull_strategy': 'breakout', 'bull_bb_std_mult': 2.7119680434187674, 'bull_rsi_os': 34, 'bull_rsi_ob': 50, 'bull_adx_thresh': 12.70468467248902, 'bull_atr_min_pct': 0.025188984853748868, 'bull_atr_max_pct': 0.07290750354893624, 'bull_tp_mult': 1.6866282534680073, 'bull_tsl_mult': 0.182013341853221, 'bull_time_stop': 185, 'bull_use_sma': False, 'bull_use_ema': True, 'bull_use_atr': False, 'bull_use_adx': False, 'bull_use_spike': True, 'bull_rsi_required': True, 'bear_strategy': 'mean_reversion', 'bear_bb_std_mult': 1.3653430517877774, 'bear_rsi_os': 30, 'bear_rsi_ob': 56, 'bear_adx_thresh': 23.282116466455903, 'bear_atr_min_pct': 0.022919361319517467, 'bear_atr_max_pct': 0.03497122760649439, 'bear_tp_mult': 2.2304022299522717, 'bear_tsl_mult': 0.6680513570451747, 'bear_time_stop': 255, 'bear_use_sma': False, 'bear_use_ema': False, 'bear_use_atr': False, 'bear_use_adx': False, 'bear_use_spike': False, 'bear_rsi_required': False, 'sideways_strategy': 'breakout', 'sideways_bb_std_mult': 3.5604348922022657, 'sideways_rsi_os': 37, 'sideways_rsi_ob': 58, 'sideways_adx_thresh': 25.585654972078487, 'sideways_atr_min_pct': 0.021110591865102776, 'sideways_atr_max_pct': 0.12913828141558914, 'sideways_tp_mult': 1.653338756746322, 'sideways_tsl_mult': 0.1745832643048149, 'sideways_time_stop': 68, 'sideways_use_sma': False, 'sideways_use_ema': False, 'sideways_use_atr': True, 'sideways_use_adx': True, 'sideways_use_spike': True, 'sideways_rsi_required': True}.
[I 2025-09-01 07:27:40,757] Trial 45 finished with values: [-1000000000.0, 1000000000.0] and parameters: {'p_sma': 48, 'p_std': 41, 'p_atr': 10, 'p_adx': 14, 'rsi_period': 39, 'ema1': 25, 'ema2': 18, 'slip_atr_k': 0.12992291866321837, 'slip_spread_k': 0.07899977319430351, 'spread_hl_frac': 0.020844350069184094, 'bb_std_mult': 0.7275669817877901, 'rsi_os': 53, 'rsi_ob': 83, 'vol_spike': 0.23177856661521865, 'adx_thresh': 23.036312112557727, 'atr_min_pct': 0.005236921712691777, 'atr_max_pct': 0.12612386584068397, 'tp_mult': 2.0395736380630893, 'tsl_mult': 0.9411905596592608, 'strategy': 'breakout', 'time_stop': 6, 'use_sma': False, 'use_atr': False, 'use_adx': False, 'use_ema': False, 'use_spike': False, 'rsi_required': False, 'edge_k': 0.18683545916547417, 'edge_cap': 0.12624599195575123, 'bull_strategy': 'breakout', 'bull_bb_std_mult': 1.8903412192037883, 'bull_rsi_os': 35, 'bull_rsi_ob': 50, 'bull_adx_thresh': 13.156736711393506, 'bull_atr_min_pct': 0.02682428398193154, 'bull_atr_max_pct': 0.13015056280601944, 'bull_tp_mult': 1.7356577225426881, 'bull_tsl_mult': 0.1648251042902482, 'bull_time_stop': 194, 'bull_use_sma': False, 'bull_use_ema': True, 'bull_use_atr': False, 'bull_use_adx': False, 'bull_use_spike': True, 'bull_rsi_required': True, 'bear_strategy': 'mean_reversion', 'bear_bb_std_mult': 1.5385565903663787, 'bear_rsi_os': 14, 'bear_rsi_ob': 72, 'bear_adx_thresh': 23.01018006229561, 'bear_atr_min_pct': 0.008009446304150401, 'bear_atr_max_pct': 0.02912664155405368, 'bear_tp_mult': 2.7875751490412273, 'bear_tsl_mult': 0.3811757155129465, 'bear_time_stop': 253, 'bear_use_sma': False, 'bear_use_ema': False, 'bear_use_atr': False, 'bear_use_adx': False, 'bear_use_spike': False, 'bear_rsi_required': False, 'sideways_strategy': 'breakout', 'sideways_bb_std_mult': 3.5849515650182298, 'sideways_rsi_os': 36, 'sideways_rsi_ob': 58, 'sideways_adx_thresh': 25.192088934808663, 'sideways_atr_min_pct': 0.008407741290203396, 'sideways_atr_max_pct': 0.029354889046593467, 'sideways_tp_mult': 1.0654651398463706, 'sideways_tsl_mult': 0.32475987220176505, 'sideways_time_stop': 6, 'sideways_use_sma': False, 'sideways_use_ema': False, 'sideways_use_atr': True, 'sideways_use_adx': True, 'sideways_use_spike': False, 'sideways_rsi_required': True}.
[I 2025-09-01 07:27:41,450] Trial 46 finished with values: [-1000000000.0, 1000000000.0] and parameters: {'p_sma': 41, 'p_std': 39, 'p_atr': 17, 'p_adx': 12, 'rsi_period': 43, 'ema1': 25, 'ema2': 37, 'slip_atr_k': 0.12789205200997228, 'slip_spread_k': 0.016897972960835894, 'spread_hl_frac': 0.02780038713421054, 'bb_std_mult': 0.9951953647884755, 'rsi_os': 6, 'rsi_ob': 82, 'vol_spike': 0.2366513182196171, 'adx_thresh': 32.04439296258286, 'atr_min_pct': 0.028501642613325558, 'atr_max_pct': 0.05330273566738484, 'tp_mult': 2.0425200072987963, 'tsl_mult': 0.3901011826715687, 'strategy': 'breakout', 'time_stop': 22, 'use_sma': False, 'use_atr': False, 'use_adx': False, 'use_ema': False, 'use_spike': False, 'rsi_required': False, 'edge_k': 0.40791905456073585, 'edge_cap': 0.1147596367898513, 'bull_strategy': 'breakout', 'bull_bb_std_mult': 1.9242260381661853, 'bull_rsi_os': 25, 'bull_rsi_ob': 55, 'bull_adx_thresh': 15.816739381482126, 'bull_atr_min_pct': 0.006166100743281338, 'bull_atr_max_pct': 0.12054472403525597, 'bull_tp_mult': 2.022507677906784, 'bull_tsl_mult': 0.13537800406478512, 'bull_time_stop': 200, 'bull_use_sma': False, 'bull_use_ema': True, 'bull_use_atr': False, 'bull_use_adx': False, 'bull_use_spike': True, 'bull_rsi_required': True, 'bear_strategy': 'mean_reversion', 'bear_bb_std_mult': 2.687532655062432, 'bear_rsi_os': 5, 'bear_rsi_ob': 73, 'bear_adx_thresh': 27.95264054239346, 'bear_atr_min_pct': 0.02031699355993614, 'bear_atr_max_pct': 0.07241509780036316, 'bear_tp_mult': 2.781213446680642, 'bear_tsl_mult': 0.38007027353742595, 'bear_time_stop': 241, 'bear_use_sma': False, 'bear_use_ema': False, 'bear_use_atr': True, 'bear_use_adx': False, 'bear_use_spike': False, 'bear_rsi_required': False, 'sideways_strategy': 'mean_reversion', 'sideways_bb_std_mult': 2.6218548604768737, 'sideways_rsi_os': 28, 'sideways_rsi_ob': 54, 'sideways_adx_thresh': 17.234579963700703, 'sideways_atr_min_pct': 0.008808781875659932, 'sideways_atr_max_pct': 0.03040132921578714, 'sideways_tp_mult': 1.026896384654277, 'sideways_tsl_mult': 0.26068632505657324, 'sideways_time_stop': 32, 'sideways_use_sma': False, 'sideways_use_ema': False, 'sideways_use_atr': True, 'sideways_use_adx': True, 'sideways_use_spike': False, 'sideways_rsi_required': True}.
