[I 2025-09-01 08:39:41,604] Trial 449 finished with values: [-1000000000.0, 1000000000.0] and parameters: {'p_sma': 37, 'p_std': 27, 'p_atr': 18, 'p_adx': 18, 'rsi_period': 49, 'ema1': 12, 'ema2': 11, 'slip_atr_k': 0.02326138524356347, 'slip_spread_k': 0.1744844489668134, 'spread_hl_frac': 0.027364894483922805, 'bb_std_mult': 2.4353508958889503, 'rsi_os': 40, 'rsi_ob': 94, 'vol_spike': 0.04162865119727356, 'adx_thresh': 31.19096599645084, 'atr_min_pct': 0.0005558827959330284, 'atr_max_pct': 0.11418745446634446, 'tp_mult': 1.489229363488829, 'tsl_mult': 0.2517015921124564, 'strategy': 'mean_reversion', 'time_stop': 53, 'use_sma': True, 'use_atr': True, 'use_adx': False, 'use_ema': False, 'use_spike': False, 'rsi_required': False, 'edge_k': 0.828826664677227, 'edge_cap': 0.5169272004488865, 'bull_strategy': 'mean_reversion', 'bull_bb_std_mult': 2.75505836929452, 'bull_rsi_os': 43, 'bull_rsi_ob': 60, 'bull_adx_thresh': 14.607993924559475, 'bull_atr_min_pct': 0.0052236795520557155, 'bull_atr_max_pct': 0.05521908940249359, 'bull_tp_mult': 1.3482747765373382, 'bull_tsl_mult': 0.8381171878314887, 'bull_time_stop': 168, 'bull_use_sma': False, 'bull_use_ema': True, 'bull_use_atr': True, 'bull_use_adx': True, 'bull_use_spike': True, 'bull_rsi_required': True, 'bear_strategy': 'breakout', 'bear_bb_std_mult': 3.0996924740070346, 'bear_rsi_os': 43, 'bear_rsi_ob': 84, 'bear_adx_thresh': 20.808105148885087, 'bear_atr_min_pct': 0.005934305306571537, 'bear_atr_max_pct': 0.05001939248680609, 'bear_tp_mult': 2.497680747644036, 'bear_tsl_mult': 0.09632637811888449, 'bear_time_stop': 260, 'bear_use_sma': False, 'bear_use_ema': True, 'bear_use_atr': True, 'bear_use_adx': True, 'bear_use_spike': True, 'bear_rsi_required': True, 'sideways_strategy': 'mean_reversion', 'sideways_bb_std_mult': 1.6976895587279466, 'sideways_rsi_os': 21, 'sideways_rsi_ob': 95, 'sideways_adx_thresh': 12.520767412482357, 'sideways_atr_min_pct': 0.029505268156117374, 'sideways_atr_max_pct': 0.010231682760642262, 'sideways_tp_mult': 1.1160457034147904, 'sideways_tsl_mult': 0.5846397769810158, 'sideways_time_stop': 156, 'sideways_use_sma': False, 'sideways_use_ema': False, 'sideways_use_atr': False, 'sideways_use_adx': False, 'sideways_use_spike': True, 'sideways_rsi_required': True}.
[I 2025-09-01 08:40:26,729] Trial 452 finished with values: [-1000000000.0, 1000000000.0] and parameters: {'p_sma': 18, 'p_std': 27, 'p_atr': 18, 'p_adx': 19, 'rsi_period': 50, 'ema1': 11, 'ema2': 10, 'slip_atr_k': 0.02776566771081268, 'slip_spread_k': 0.1149732182426312, 'spread_hl_frac': 0.027112692973631138, 'bb_std_mult': 2.4784819484593323, 'rsi_os': 41, 'rsi_ob': 94, 'vol_spike': 0.03695256791597612, 'adx_thresh': 31.354929770653573, 'atr_min_pct': 0.007412065084702624, 'atr_max_pct': 0.1149869445455132, 'tp_mult': 1.3948008486556775, 'tsl_mult': 0.16776283395905334, 'strategy': 'mean_reversion', 'time_stop': 23, 'use_sma': True, 'use_atr': True, 'use_adx': False, 'use_ema': False, 'use_spike': False, 'rsi_required': False, 'edge_k': 1.1077370190119504, 'edge_cap': 0.42182552746543966, 'bull_strategy': 'mean_reversion', 'bull_bb_std_mult': 2.882795859875181, 'bull_rsi_os': 42, 'bull_rsi_ob': 60, 'bull_adx_thresh': 14.418577015334542, 'bull_atr_min_pct': 0.005877286556831328, 'bull_atr_max_pct': 0.0571216292274132, 'bull_tp_mult': 1.3191816320860297, 'bull_tsl_mult': 0.9069785236494913, 'bull_time_stop': 77, 'bull_use_sma': False, 'bull_use_ema': True, 'bull_use_atr': True, 'bull_use_adx': True, 'bull_use_spike': True, 'bull_rsi_required': True, 'bear_strategy': 'breakout', 'bear_bb_std_mult': 1.8832801426371408, 'bear_rsi_os': 40, 'bear_rsi_ob': 83, 'bear_adx_thresh': 7.15667405567436, 'bear_atr_min_pct': 0.006485446731147649, 'bear_atr_max_pct': 0.04569606220704289, 'bear_tp_mult': 2.6145245283422995, 'bear_tsl_mult': 0.3733999389026593, 'bear_time_stop': 224, 'bear_use_sma': False, 'bear_use_ema': True, 'bear_use_atr': True, 'bear_use_adx': True, 'bear_use_spike': True, 'bear_rsi_required': True, 'sideways_strategy': 'mean_reversion', 'sideways_bb_std_mult': 1.8355525552867908, 'sideways_rsi_os': 20, 'sideways_rsi_ob': 95, 'sideways_adx_thresh': 13.692781671143742, 'sideways_atr_min_pct': 0.029284295080223486, 'sideways_atr_max_pct': 0.010315378570925703, 'sideways_tp_mult': 2.0085594618502487, 'sideways_tsl_mult': 0.6710990040396609, 'sideways_time_stop': 167, 'sideways_use_sma': False, 'sideways_use_ema': False, 'sideways_use_atr': False, 'sideways_use_adx': False, 'sideways_use_spike': True, 'sideways_rsi_required': True}.
[I 2025-09-01 08:40:27,577] Trial 454 finished with values: [-1000000000.0, 1000000000.0] and parameters: {'p_sma': 21, 'p_std': 34, 'p_atr': 19, 'p_adx': 11, 'rsi_period': 51, 'ema1': 11, 'ema2': 10, 'slip_atr_k': 0.024977806980478856, 'slip_spread_k': 0.11901030373527866, 'spread_hl_frac': 0.033260610844859276, 'bb_std_mult': 2.3092226062411503, 'rsi_os': 37, 'rsi_ob': 95, 'vol_spike': 0.20857872591533697, 'adx_thresh': 31.768600648627473, 'atr_min_pct': 0.007964029031597855, 'atr_max_pct': 0.10867896749886487, 'tp_mult': 1.3813012909761009, 'tsl_mult': 0.1694511436333076, 'strategy': 'mean_reversion', 'time_stop': 43, 'use_sma': True, 'use_atr': True, 'use_adx': False, 'use_ema': False, 'use_spike': False, 'rsi_required': False, 'edge_k': 1.1179659342717982, 'edge_cap': 0.4731717603214241, 'bull_strategy': 'mean_reversion', 'bull_bb_std_mult': 2.8500424844890753, 'bull_rsi_os': 41, 'bull_rsi_ob': 55, 'bull_adx_thresh': 17.937488313411414, 'bull_atr_min_pct': 0.016621964774228257, 'bull_atr_max_pct': 0.05756563909000544, 'bull_tp_mult': 1.4319418510141506, 'bull_tsl_mult': 0.8705009006648365, 'bull_time_stop': 187, 'bull_use_sma': False, 'bull_use_ema': True, 'bull_use_atr': True, 'bull_use_adx': True, 'bull_use_spike': True, 'bull_rsi_required': True, 'bear_strategy': 'breakout', 'bear_bb_std_mult': 1.866347681797838, 'bear_rsi_os': 41, 'bear_rsi_ob': 83, 'bear_adx_thresh': 7.023776522627032, 'bear_atr_min_pct': 0.006550311996746951, 'bear_atr_max_pct': 0.058186100070153915, 'bear_tp_mult': 2.687970319814116, 'bear_tsl_mult': 0.0806840541084573, 'bear_time_stop': 253, 'bear_use_sma': False, 'bear_use_ema': True, 'bear_use_atr': True, 'bear_use_adx': True, 'bear_use_spike': True, 'bear_rsi_required': True, 'sideways_strategy': 'mean_reversion', 'sideways_bb_std_mult': 1.794470987882739, 'sideways_rsi_os': 23, 'sideways_rsi_ob': 50, 'sideways_adx_thresh': 13.739534345954432, 'sideways_atr_min_pct': 0.029244603889351004, 'sideways_atr_max_pct': 0.14000797581497157, 'sideways_tp_mult': 2.411139066178359, 'sideways_tsl_mult': 0.6753626727115787, 'sideways_time_stop': 176, 'sideways_use_sma': False, 'sideways_use_ema': False, 'sideways_use_atr': False, 'sideways_use_adx': False, 'sideways_use_spike': True, 'sideways_rsi_required': True}.
[I 2025-09-01 08:40:27,577] Trial 451 finished with values: [-1000000000.0, 1000000000.0] and parameters: {'p_sma': 60, 'p_std': 35, 'p_atr': 18, 'p_adx': 19, 'rsi_period': 50, 'ema1': 11, 'ema2': 11, 'slip_atr_k': 0.02757011680172978, 'slip_spread_k': 0.11480677021983626, 'spread_hl_frac': 0.028635222619856796, 'bb_std_mult': 2.3412009870785555, 'rsi_os': 41, 'rsi_ob': 94, 'vol_spike': 0.20193765903288186, 'adx_thresh': 31.613497146253646, 'atr_min_pct': 0.012298754541182896, 'atr_max_pct': 0.11414888846040003, 'tp_mult': 1.3835898921240277, 'tsl_mult': 0.21145391937101377, 'strategy': 'mean_reversion', 'time_stop': 18, 'use_sma': True, 'use_atr': True, 'use_adx': False, 'use_ema': False, 'use_spike': False, 'rsi_required': False, 'edge_k': 0.8448804991299745, 'edge_cap': 0.595142685279153, 'bull_strategy': 'mean_reversion', 'bull_bb_std_mult': 2.8794355480295186, 'bull_rsi_os': 41, 'bull_rsi_ob': 61, 'bull_adx_thresh': 11.698477269411608, 'bull_atr_min_pct': 0.014254391409969135, 'bull_atr_max_pct': 0.05666906236812559, 'bull_tp_mult': 1.2865690104207705, 'bull_tsl_mult': 0.9085070506520647, 'bull_time_stop': 243, 'bull_use_sma': False, 'bull_use_ema': True, 'bull_use_atr': True, 'bull_use_adx': True, 'bull_use_spike': True, 'bull_rsi_required': True, 'bear_strategy': 'breakout', 'bear_bb_std_mult': 1.2617232101809108, 'bear_rsi_os': 40, 'bear_rsi_ob': 84, 'bear_adx_thresh': 7.229694691253787, 'bear_atr_min_pct': 0.006320916346652106, 'bear_atr_max_pct': 0.06007797525195114, 'bear_tp_mult': 2.615968443584716, 'bear_tsl_mult': 0.7198984058292655, 'bear_time_stop': 256, 'bear_use_sma': False, 'bear_use_ema': True, 'bear_use_atr': True, 'bear_use_adx': True, 'bear_use_spike': True, 'bear_rsi_required': True, 'sideways_strategy': 'mean_reversion', 'sideways_bb_std_mult': 1.8458134113186768, 'sideways_rsi_os': 21, 'sideways_rsi_ob': 95, 'sideways_adx_thresh': 13.470132260482067, 'sideways_atr_min_pct': 0.029377678797237957, 'sideways_atr_max_pct': 0.01207427410035975, 'sideways_tp_mult': 1.020949092066508, 'sideways_tsl_mult': 0.6735176080178016, 'sideways_time_stop': 177, 'sideways_use_sma': False, 'sideways_use_ema': False, 'sideways_use_atr': False, 'sideways_use_adx': False, 'sideways_use_spike': True, 'sideways_rsi_required': True}.
[I 2025-09-01 08:40:27,733] Trial 453 finished with values: [-1000000000.0, 1000000000.0] and parameters: {'p_sma': 16, 'p_std': 27, 'p_atr': 19, 'p_adx': 14, 'rsi_period': 51, 'ema1': 11, 'ema2': 11, 'slip_atr_k': 0.030721985909522458, 'slip_spread_k': 0.1051828054676007, 'spread_hl_frac': 0.027788558423540367, 'bb_std_mult': 2.3378027216549513, 'rsi_os': 39, 'rsi_ob': 95, 'vol_spike': 0.15844566475786373, 'adx_thresh': 31.532588696315276, 'atr_min_pct': 0.01458460784759964, 'atr_max_pct': 0.10862118081227339, 'tp_mult': 1.5283282275702001, 'tsl_mult': 0.20891285826267023, 'strategy': 'mean_reversion', 'time_stop': 41, 'use_sma': True, 'use_atr': True, 'use_adx': False, 'use_ema': False, 'use_spike': False, 'rsi_required': False, 'edge_k': 0.641090389212389, 'edge_cap': 0.32688790018638847, 'bull_strategy': 'mean_reversion', 'bull_bb_std_mult': 2.855940200013384, 'bull_rsi_os': 41, 'bull_rsi_ob': 61, 'bull_adx_thresh': 14.617410056317539, 'bull_atr_min_pct': 0.016248058205885842, 'bull_atr_max_pct': 0.05703663918649421, 'bull_tp_mult': 1.422307793713118, 'bull_tsl_mult': 0.8895902914548393, 'bull_time_stop': 77, 'bull_use_sma': False, 'bull_use_ema': True, 'bull_use_atr': True, 'bull_use_adx': True, 'bull_use_spike': True, 'bull_rsi_required': True, 'bear_strategy': 'breakout', 'bear_bb_std_mult': 2.5070031180724732, 'bear_rsi_os': 42, 'bear_rsi_ob': 83, 'bear_adx_thresh': 10.983360603983773, 'bear_atr_min_pct': 0.006426390762402852, 'bear_atr_max_pct': 0.013704071491380802, 'bear_tp_mult': 2.7284760656923233, 'bear_tsl_mult': 0.09071540323760477, 'bear_time_stop': 251, 'bear_use_sma': False, 'bear_use_ema': True, 'bear_use_atr': True, 'bear_use_adx': True, 'bear_use_spike': True, 'bear_rsi_required': True, 'sideways_strategy': 'mean_reversion', 'sideways_bb_std_mult': 1.547232033830857, 'sideways_rsi_os': 21, 'sideways_rsi_ob': 95, 'sideways_adx_thresh': 13.48548767933503, 'sideways_atr_min_pct': 0.02907515297584565, 'sideways_atr_max_pct': 0.01001620025639489, 'sideways_tp_mult': 1.0102427463250958, 'sideways_tsl_mult': 0.6095545644642034, 'sideways_time_stop': 167, 'sideways_use_sma': False, 'sideways_use_ema': False, 'sideways_use_atr': False, 'sideways_use_adx': False, 'sideways_use_spike': True, 'sideways_rsi_required': True}.
[I 2025-09-01 08:41:10,473] Trial 457 finished with values: [0.00877898702369495, 0.004181745569112898] and parameters: {'p_sma': 32, 'p_std': 33, 'p_atr': 19, 'p_adx': 17, 'rsi_period': 52, 'ema1': 12, 'ema2': 10, 'slip_atr_k': 0.0308496360727199, 'slip_spread_k': 0.2133655190077947, 'spread_hl_frac': 0.02502254003520608, 'bb_std_mult': 2.269254588047539, 'rsi_os': 38, 'rsi_ob': 95, 'vol_spike': 0.04596692542613317, 'adx_thresh': 30.93466404884292, 'atr_min_pct': 0.00975329341940042, 'atr_max_pct': 0.103644474864565, 'tp_mult': 1.5394417819155013, 'tsl_mult': 0.22049984061542227, 'strategy': 'mean_reversion', 'time_stop': 32, 'use_sma': False, 'use_atr': False, 'use_adx': False, 'use_ema': False, 'use_spike': False, 'rsi_required': False, 'edge_k': 0.7490641393899818, 'edge_cap': 0.35938537250082914, 'bull_strategy': 'breakout', 'bull_bb_std_mult': 2.806200276886323, 'bull_rsi_os': 42, 'bull_rsi_ob': 59, 'bull_adx_thresh': 12.199746702986856, 'bull_atr_min_pct': 0.017714302148264964, 'bull_atr_max_pct': 0.06006022685945356, 'bull_tp_mult': 1.4318872443573107, 'bull_tsl_mult': 0.9759554468204138, 'bull_time_stop': 147, 'bull_use_sma': True, 'bull_use_ema': True, 'bull_use_atr': True, 'bull_use_adx': True, 'bull_use_spike': True, 'bull_rsi_required': False, 'bear_strategy': 'mean_reversion', 'bear_bb_std_mult': 3.550870472675167, 'bear_rsi_os': 43, 'bear_rsi_ob': 86, 'bear_adx_thresh': 10.775777541011028, 'bear_atr_min_pct': 0.0052939587372613575, 'bear_atr_max_pct': 0.03293323075641536, 'bear_tp_mult': 2.7230826770872167, 'bear_tsl_mult': 0.08999857955242664, 'bear_time_stop': 239, 'bear_use_sma': False, 'bear_use_ema': False, 'bear_use_atr': True, 'bear_use_adx': True, 'bear_use_spike': True, 'bear_rsi_required': True, 'sideways_strategy': 'breakout', 'sideways_bb_std_mult': 1.5303449218846221, 'sideways_rsi_os': 14, 'sideways_rsi_ob': 68, 'sideways_adx_thresh': 12.049795217457342, 'sideways_atr_min_pct': 0.028989859168385368, 'sideways_atr_max_pct': 0.012468584300489936, 'sideways_tp_mult': 2.318505270014316, 'sideways_tsl_mult': 0.4997194165958457, 'sideways_time_stop': 144, 'sideways_use_sma': False, 'sideways_use_ema': False, 'sideways_use_atr': True, 'sideways_use_adx': False, 'sideways_use_spike': True, 'sideways_rsi_required': True}.
[I 2025-09-01 08:41:11,078] Trial 455 finished with values: [-1000000000.0, 1000000000.0] and parameters: {'p_sma': 20, 'p_std': 35, 'p_atr': 19, 'p_adx': 17, 'rsi_period': 52, 'ema1': 12, 'ema2': 11, 'slip_atr_k': 0.030393777661345926, 'slip_spread_k': 0.12561346235165619, 'spread_hl_frac': 0.028460366988823982, 'bb_std_mult': 2.332511736728207, 'rsi_os': 37, 'rsi_ob': 95, 'vol_spike': 0.20830742501213106, 'adx_thresh': 31.744758440298845, 'atr_min_pct': 0.012514986046650328, 'atr_max_pct': 0.10824467488107727, 'tp_mult': 1.5360436512884583, 'tsl_mult': 0.2147187171212313, 'strategy': 'mean_reversion', 'time_stop': 45, 'use_sma': True, 'use_atr': True, 'use_adx': False, 'use_ema': False, 'use_spike': False, 'rsi_required': False, 'edge_k': 0.6088179850468176, 'edge_cap': 0.05426664053365696, 'bull_strategy': 'mean_reversion', 'bull_bb_std_mult': 2.8456186665054, 'bull_rsi_os': 41, 'bull_rsi_ob': 62, 'bull_adx_thresh': 12.13164769891685, 'bull_atr_min_pct': 0.01632662458843864, 'bull_atr_max_pct': 0.14988173316997244, 'bull_tp_mult': 1.4270323782024308, 'bull_tsl_mult': 0.8631783487750214, 'bull_time_stop': 118, 'bull_use_sma': False, 'bull_use_ema': True, 'bull_use_atr': True, 'bull_use_adx': True, 'bull_use_spike': True, 'bull_rsi_required': True, 'bear_strategy': 'breakout', 'bear_bb_std_mult': 3.421982178594303, 'bear_rsi_os': 42, 'bear_rsi_ob': 83, 'bear_adx_thresh': 16.572547042529514, 'bear_atr_min_pct': 0.00555109965375349, 'bear_atr_max_pct': 0.06032240297349102, 'bear_tp_mult': 2.65604018914057, 'bear_tsl_mult': 0.8924191305517835, 'bear_time_stop': 250, 'bear_use_sma': False, 'bear_use_ema': True, 'bear_use_atr': True, 'bear_use_adx': True, 'bear_use_spike': True, 'bear_rsi_required': True, 'sideways_strategy': 'mean_reversion', 'sideways_bb_std_mult': 1.502704251650874, 'sideways_rsi_os': 22, 'sideways_rsi_ob': 95, 'sideways_adx_thresh': 13.35002340261331, 'sideways_atr_min_pct': 0.029332491860751188, 'sideways_atr_max_pct': 0.012396305282333611, 'sideways_tp_mult': 2.575893912242328, 'sideways_tsl_mult': 0.5015179513971513, 'sideways_time_stop': 177, 'sideways_use_sma': False, 'sideways_use_ema': False, 'sideways_use_atr': False, 'sideways_use_adx': False, 'sideways_use_spike': True, 'sideways_rsi_required': True}.
[I 2025-09-01 08:41:11,337] Trial 458 finished with values: [-1000000000.0, 1000000000.0] and parameters: {'p_sma': 12, 'p_std': 36, 'p_atr': 19, 'p_adx': 16, 'rsi_period': 48, 'ema1': 12, 'ema2': 10, 'slip_atr_k': 0.028662696625554686, 'slip_spread_k': 0.08047756134990872, 'spread_hl_frac': 0.025238859530616598, 'bb_std_mult': 2.458715526358612, 'rsi_os': 46, 'rsi_ob': 95, 'vol_spike': 0.12422757299667553, 'adx_thresh': 30.995486801110278, 'atr_min_pct': 0.011157609514230934, 'atr_max_pct': 0.10679587887852468, 'tp_mult': 1.520263491330603, 'tsl_mult': 0.28620988243940093, 'strategy': 'breakout', 'time_stop': 35, 'use_sma': False, 'use_atr': False, 'use_adx': False, 'use_ema': False, 'use_spike': False, 'rsi_required': False, 'edge_k': 0.0275252534717928, 'edge_cap': 0.07241397173158354, 'bull_strategy': 'breakout', 'bull_bb_std_mult': 2.699493113957522, 'bull_rsi_os': 42, 'bull_rsi_ob': 63, 'bull_adx_thresh': 16.84758405143134, 'bull_atr_min_pct': 0.004564221514767234, 'bull_atr_max_pct': 0.06045523337885581, 'bull_tp_mult': 1.4372258032074248, 'bull_tsl_mult': 0.9973130022111645, 'bull_time_stop': 17, 'bull_use_sma': True, 'bull_use_ema': True, 'bull_use_atr': False, 'bull_use_adx': False, 'bull_use_spike': True, 'bull_rsi_required': False, 'bear_strategy': 'mean_reversion', 'bear_bb_std_mult': 3.4404420608095663, 'bear_rsi_os': 43, 'bear_rsi_ob': 82, 'bear_adx_thresh': 20.103024299403053, 'bear_atr_min_pct': 0.005724609163983992, 'bear_atr_max_pct': 0.02594116541934733, 'bear_tp_mult': 2.540101272544514, 'bear_tsl_mult': 0.8559908218366865, 'bear_time_stop': 237, 'bear_use_sma': False, 'bear_use_ema': False, 'bear_use_atr': True, 'bear_use_adx': True, 'bear_use_spike': False, 'bear_rsi_required': False, 'sideways_strategy': 'breakout', 'sideways_bb_std_mult': 1.9095920383289937, 'sideways_rsi_os': 14, 'sideways_rsi_ob': 68, 'sideways_adx_thresh': 11.920433640430613, 'sideways_atr_min_pct': 0.029543745447956456, 'sideways_atr_max_pct': 0.010023583935867848, 'sideways_tp_mult': 2.7785254311086325, 'sideways_tsl_mult': 0.5006909920136986, 'sideways_time_stop': 149, 'sideways_use_sma': False, 'sideways_use_ema': False, 'sideways_use_atr': True, 'sideways_use_adx': False, 'sideways_use_spike': True, 'sideways_rsi_required': True}.
[I 2025-09-01 08:41:11,350] Trial 456 finished with values: [-1000000000.0, 1000000000.0] and parameters: {'p_sma': 12, 'p_std': 33, 'p_atr': 19, 'p_adx': 17, 'rsi_period': 52, 'ema1': 12, 'ema2': 11, 'slip_atr_k': 0.030953277079410573, 'slip_spread_k': 0.2102850949016534, 'spread_hl_frac': 0.01962355747393031, 'bb_std_mult': 2.2603766310014826, 'rsi_os': 38, 'rsi_ob': 95, 'vol_spike': 0.046779553765877405, 'adx_thresh': 32.58718849833955, 'atr_min_pct': 0.009387937658066635, 'atr_max_pct': 0.10434025318048032, 'tp_mult': 1.4312473096600404, 'tsl_mult': 0.2790955900514476, 'strategy': 'mean_reversion', 'time_stop': 47, 'use_sma': False, 'use_atr': False, 'use_adx': False, 'use_ema': False, 'use_spike': False, 'rsi_required': False, 'edge_k': 0.6065977551301229, 'edge_cap': 0.3326754779371248, 'bull_strategy': 'breakout', 'bull_bb_std_mult': 2.8097062394268106, 'bull_rsi_os': 42, 'bull_rsi_ob': 59, 'bull_adx_thresh': 17.350941947433896, 'bull_atr_min_pct': 0.023471223879784606, 'bull_atr_max_pct': 0.060569835235167686, 'bull_tp_mult': 1.4343006483863872, 'bull_tsl_mult': 0.8167351684166274, 'bull_time_stop': 254, 'bull_use_sma': True, 'bull_use_ema': True, 'bull_use_atr': True, 'bull_use_adx': True, 'bull_use_spike': True, 'bull_rsi_required': False, 'bear_strategy': 'mean_reversion', 'bear_bb_std_mult': 2.3439203227266843, 'bear_rsi_os': 42, 'bear_rsi_ob': 83, 'bear_adx_thresh': 29.9801412570596, 'bear_atr_min_pct': 0.005409827699220432, 'bear_atr_max_pct': 0.02728940079664495, 'bear_tp_mult': 2.739713214426284, 'bear_tsl_mult': 0.9354698273764823, 'bear_time_stop': 217, 'bear_use_sma': False, 'bear_use_ema': False, 'bear_use_atr': True, 'bear_use_adx': True, 'bear_use_spike': True, 'bear_rsi_required': True, 'sideways_strategy': 'breakout', 'sideways_bb_std_mult': 1.5475692252509752, 'sideways_rsi_os': 18, 'sideways_rsi_ob': 95, 'sideways_adx_thresh': 12.212489027678698, 'sideways_atr_min_pct': 0.02885038280499409, 'sideways_atr_max_pct': 0.08167056361750767, 'sideways_tp_mult': 2.3561665281152093, 'sideways_tsl_mult': 0.6120125591535617, 'sideways_time_stop': 165, 'sideways_use_sma': False, 'sideways_use_ema': False, 'sideways_use_atr': True, 'sideways_use_adx': False, 'sideways_use_spike': True, 'sideways_rsi_required': True}.
