[I 2025-09-01 08:41:56,610] Trial 462 finished with values: [0.011310596125270633, 0.002536635686228532] and parameters: {'p_sma': 33, 'p_std': 34, 'p_atr': 19, 'p_adx': 15, 'rsi_period': 47, 'ema1': 10, 'ema2': 10, 'slip_atr_k': 0.02036989544310903, 'slip_spread_k': 0.19250081678261102, 'spread_hl_frac': 0.02244555540321532, 'bb_std_mult': 2.373791438401601, 'rsi_os': 43, 'rsi_ob': 93, 'vol_spike': 0.035885476483995635, 'adx_thresh': 30.797135171998104, 'atr_min_pct': 0.007641190750999774, 'atr_max_pct': 0.10178182470920837, 'tp_mult': 1.4730191155184367, 'tsl_mult': 0.2247808145547483, 'strategy': 'mean_reversion', 'time_stop': 28, 'use_sma': False, 'use_atr': False, 'use_adx': False, 'use_ema': False, 'use_spike': False, 'rsi_required': False, 'edge_k': 0.7472748656205455, 'edge_cap': 0.31637996852879857, 'bull_strategy': 'breakout', 'bull_bb_std_mult': 2.7600188312494818, 'bull_rsi_os': 43, 'bull_rsi_ob': 58, 'bull_adx_thresh': 12.476306040294759, 'bull_atr_min_pct': 0.017992442689146734, 'bull_atr_max_pct': 0.06255932884498439, 'bull_tp_mult': 1.3721832255302369, 'bull_tsl_mult': 0.9804935375650002, 'bull_time_stop': 158, 'bull_use_sma': True, 'bull_use_ema': True, 'bull_use_atr': True, 'bull_use_adx': True, 'bull_use_spike': True, 'bull_rsi_required': False, 'bear_strategy': 'mean_reversion', 'bear_bb_std_mult': 3.5481882148494894, 'bear_rsi_os': 43, 'bear_rsi_ob': 87, 'bear_adx_thresh': 9.578837625374772, 'bear_atr_min_pct': 0.005096008179483886, 'bear_atr_max_pct': 0.03194134713580212, 'bear_tp_mult': 2.888474478343817, 'bear_tsl_mult': 0.095930363975332, 'bear_time_stop': 239, 'bear_use_sma': False, 'bear_use_ema': False, 'bear_use_atr': True, 'bear_use_adx': True, 'bear_use_spike': True, 'bear_rsi_required': True, 'sideways_strategy': 'breakout', 'sideways_bb_std_mult': 1.4516182187300903, 'sideways_rsi_os': 13, 'sideways_rsi_ob': 68, 'sideways_adx_thresh': 12.19483526661178, 'sideways_atr_min_pct': 0.028666544195829605, 'sideways_atr_max_pct': 0.0141512230970341, 'sideways_tp_mult': 2.282801678353459, 'sideways_tsl_mult': 0.46297237071291053, 'sideways_time_stop': 140, 'sideways_use_sma': False, 'sideways_use_ema': False, 'sideways_use_atr': True, 'sideways_use_adx': False, 'sideways_use_spike': True, 'sideways_rsi_required': True}.
[I 2025-09-01 08:41:57,196] Trial 460 finished with values: [0.007724459739717471, 0.0030335021109214387] and parameters: {'p_sma': 35, 'p_std': 33, 'p_atr': 19, 'p_adx': 15, 'rsi_period': 46, 'ema1': 10, 'ema2': 10, 'slip_atr_k': 0.020362596807821456, 'slip_spread_k': 0.21107513186418414, 'spread_hl_frac': 0.01961861552775148, 'bb_std_mult': 2.3663698419016215, 'rsi_os': 38, 'rsi_ob': 95, 'vol_spike': 0.046000282452101235, 'adx_thresh': 30.907741622357076, 'atr_min_pct': 0.008910601528785905, 'atr_max_pct': 0.10100289965558837, 'tp_mult': 1.4359303202463198, 'tsl_mult': 0.23922426218724463, 'strategy': 'mean_reversion', 'time_stop': 27, 'use_sma': False, 'use_atr': False, 'use_adx': False, 'use_ema': False, 'use_spike': False, 'rsi_required': False, 'edge_k': 0.45201866094752763, 'edge_cap': 0.3176852129721015, 'bull_strategy': 'breakout', 'bull_bb_std_mult': 2.7744590460913763, 'bull_rsi_os': 43, 'bull_rsi_ob': 59, 'bull_adx_thresh': 12.645417864752698, 'bull_atr_min_pct': 0.017710551902794462, 'bull_atr_max_pct': 0.06142977409655071, 'bull_tp_mult': 1.411452340207596, 'bull_tsl_mult': 0.9758648310922196, 'bull_time_stop': 155, 'bull_use_sma': True, 'bull_use_ema': True, 'bull_use_atr': True, 'bull_use_adx': True, 'bull_use_spike': True, 'bull_rsi_required': False, 'bear_strategy': 'mean_reversion', 'bear_bb_std_mult': 3.319518860612172, 'bear_rsi_os': 42, 'bear_rsi_ob': 87, 'bear_adx_thresh': 14.682530319893607, 'bear_atr_min_pct': 0.005368023382275768, 'bear_atr_max_pct': 0.03581701269599822, 'bear_tp_mult': 2.749984003490298, 'bear_tsl_mult': 0.09399561624799027, 'bear_time_stop': 240, 'bear_use_sma': False, 'bear_use_ema': False, 'bear_use_atr': True, 'bear_use_adx': True, 'bear_use_spike': True, 'bear_rsi_required': True, 'sideways_strategy': 'breakout', 'sideways_bb_std_mult': 1.4346594787373763, 'sideways_rsi_os': 13, 'sideways_rsi_ob': 69, 'sideways_adx_thresh': 12.395179940838819, 'sideways_atr_min_pct': 0.028751527420734675, 'sideways_atr_max_pct': 0.01433844414782522, 'sideways_tp_mult': 2.3034165154746655, 'sideways_tsl_mult': 0.4446456233608527, 'sideways_time_stop': 140, 'sideways_use_sma': False, 'sideways_use_ema': False, 'sideways_use_atr': True, 'sideways_use_adx': False, 'sideways_use_spike': True, 'sideways_rsi_required': True}.
[I 2025-09-01 08:41:57,196] Trial 459 finished with values: [0.008509287733849957, 0.004229688689739325] and parameters: {'p_sma': 33, 'p_std': 33, 'p_atr': 19, 'p_adx': 15, 'rsi_period': 53, 'ema1': 10, 'ema2': 10, 'slip_atr_k': 0.020263616841562353, 'slip_spread_k': 0.19687723516322603, 'spread_hl_frac': 0.024898782021085274, 'bb_std_mult': 2.365103616300526, 'rsi_os': 38, 'rsi_ob': 95, 'vol_spike': 0.044203500459020384, 'adx_thresh': 31.156584420359668, 'atr_min_pct': 0.00952683007087959, 'atr_max_pct': 0.0999120133730821, 'tp_mult': 1.5221852668428428, 'tsl_mult': 0.22780091026507007, 'strategy': 'mean_reversion', 'time_stop': 30, 'use_sma': False, 'use_atr': False, 'use_adx': False, 'use_ema': False, 'use_spike': False, 'rsi_required': False, 'edge_k': 0.7449829395849643, 'edge_cap': 0.32182522073559205, 'bull_strategy': 'breakout', 'bull_bb_std_mult': 2.7137771162713618, 'bull_rsi_os': 42, 'bull_rsi_ob': 58, 'bull_adx_thresh': 12.61594272333424, 'bull_atr_min_pct': 0.01762499148736179, 'bull_atr_max_pct': 0.060884553802280555, 'bull_tp_mult': 1.362910529432847, 'bull_tsl_mult': 0.9963729646960061, 'bull_time_stop': 119, 'bull_use_sma': True, 'bull_use_ema': True, 'bull_use_atr': True, 'bull_use_adx': True, 'bull_use_spike': True, 'bull_rsi_required': False, 'bear_strategy': 'mean_reversion', 'bear_bb_std_mult': 3.558640080007342, 'bear_rsi_os': 42, 'bear_rsi_ob': 86, 'bear_adx_thresh': 16.728956834063062, 'bear_atr_min_pct': 0.005298283480951167, 'bear_atr_max_pct': 0.03488575780359048, 'bear_tp_mult': 2.5690107303836265, 'bear_tsl_mult': 0.08558641798617313, 'bear_time_stop': 238, 'bear_use_sma': False, 'bear_use_ema': False, 'bear_use_atr': True, 'bear_use_adx': True, 'bear_use_spike': True, 'bear_rsi_required': True, 'sideways_strategy': 'breakout', 'sideways_bb_std_mult': 1.4503110285138687, 'sideways_rsi_os': 14, 'sideways_rsi_ob': 68, 'sideways_adx_thresh': 12.137522991395782, 'sideways_atr_min_pct': 0.0288648269752658, 'sideways_atr_max_pct': 0.013602841875276816, 'sideways_tp_mult': 2.332021843990337, 'sideways_tsl_mult': 0.47840040025066893, 'sideways_time_stop': 146, 'sideways_use_sma': False, 'sideways_use_ema': False, 'sideways_use_atr': True, 'sideways_use_adx': False, 'sideways_use_spike': True, 'sideways_rsi_required': True}.
[I 2025-09-01 08:41:57,329] Trial 461 finished with values: [-1000000000.0, 1000000000.0] and parameters: {'p_sma': 33, 'p_std': 33, 'p_atr': 19, 'p_adx': 15, 'rsi_period': 53, 'ema1': 10, 'ema2': 11, 'slip_atr_k': 0.020165671844985467, 'slip_spread_k': 0.19137616489959702, 'spread_hl_frac': 0.02456519838823036, 'bb_std_mult': 2.3468696576990475, 'rsi_os': 38, 'rsi_ob': 94, 'vol_spike': 0.041726472226678524, 'adx_thresh': 30.87551036737553, 'atr_min_pct': 0.007598273407650632, 'atr_max_pct': 0.10164546170910949, 'tp_mult': 1.5296723770655425, 'tsl_mult': 0.19690493758719652, 'strategy': 'mean_reversion', 'time_stop': 30, 'use_sma': False, 'use_atr': False, 'use_adx': False, 'use_ema': False, 'use_spike': False, 'rsi_required': False, 'edge_k': 0.47312079142069896, 'edge_cap': 0.35322805239395494, 'bull_strategy': 'breakout', 'bull_bb_std_mult': 2.7613547668082337, 'bull_rsi_os': 43, 'bull_rsi_ob': 58, 'bull_adx_thresh': 12.446294180701148, 'bull_atr_min_pct': 0.01922968089612793, 'bull_atr_max_pct': 0.060471830341084186, 'bull_tp_mult': 1.3599579125437533, 'bull_tsl_mult': 0.97670926857486, 'bull_time_stop': 143, 'bull_use_sma': True, 'bull_use_ema': True, 'bull_use_atr': True, 'bull_use_adx': True, 'bull_use_spike': True, 'bull_rsi_required': False, 'bear_strategy': 'mean_reversion', 'bear_bb_std_mult': 3.5431316308669483, 'bear_rsi_os': 42, 'bear_rsi_ob': 88, 'bear_adx_thresh': 10.206324420790834, 'bear_atr_min_pct': 0.005519593599513832, 'bear_atr_max_pct': 0.03211173744400095, 'bear_tp_mult': 2.6698618483954712, 'bear_tsl_mult': 0.08082474907116101, 'bear_time_stop': 240, 'bear_use_sma': False, 'bear_use_ema': False, 'bear_use_atr': True, 'bear_use_adx': True, 'bear_use_spike': True, 'bear_rsi_required': True, 'sideways_strategy': 'breakout', 'sideways_bb_std_mult': 1.4479734268672124, 'sideways_rsi_os': 13, 'sideways_rsi_ob': 68, 'sideways_adx_thresh': 12.09949965611957, 'sideways_atr_min_pct': 0.028669853004479634, 'sideways_atr_max_pct': 0.014218899417859502, 'sideways_tp_mult': 2.4401324361543892, 'sideways_tsl_mult': 0.4792220419934582, 'sideways_time_stop': 138, 'sideways_use_sma': False, 'sideways_use_ema': False, 'sideways_use_atr': True, 'sideways_use_adx': False, 'sideways_use_spike': True, 'sideways_rsi_required': True}.
[I 2025-09-01 08:42:39,346] Trial 465 finished with values: [-1000000000.0, 1000000000.0] and parameters: {'p_sma': 34, 'p_std': 34, 'p_atr': 18, 'p_adx': 15, 'rsi_period': 46, 'ema1': 9, 'ema2': 10, 'slip_atr_k': 0.02178042260671491, 'slip_spread_k': 0.1923909212190198, 'spread_hl_frac': 0.02257686677545421, 'bb_std_mult': 2.3731983448472684, 'rsi_os': 43, 'rsi_ob': 93, 'vol_spike': 0.02425207549216487, 'adx_thresh': 32.45147218723894, 'atr_min_pct': 0.007787631828558597, 'atr_max_pct': 0.1014660922198339, 'tp_mult': 1.459320427970884, 'tsl_mult': 0.22880935433631353, 'strategy': 'mean_reversion', 'time_stop': 28, 'use_sma': True, 'use_atr': True, 'use_adx': False, 'use_ema': False, 'use_spike': False, 'rsi_required': False, 'edge_k': 0.7518429257011163, 'edge_cap': 0.3219456760959072, 'bull_strategy': 'mean_reversion', 'bull_bb_std_mult': 2.662930529837672, 'bull_rsi_os': 43, 'bull_rsi_ob': 58, 'bull_adx_thresh': 12.659062420709114, 'bull_atr_min_pct': 0.0177020295241841, 'bull_atr_max_pct': 0.07223403312688874, 'bull_tp_mult': 1.326170437853972, 'bull_tsl_mult': 0.9796450620279309, 'bull_time_stop': 156, 'bull_use_sma': False, 'bull_use_ema': True, 'bull_use_atr': True, 'bull_use_adx': True, 'bull_use_spike': True, 'bull_rsi_required': True, 'bear_strategy': 'breakout', 'bear_bb_std_mult': 3.598227237911992, 'bear_rsi_os': 41, 'bear_rsi_ob': 88, 'bear_adx_thresh': 9.738652087584171, 'bear_atr_min_pct': 0.005087860691028823, 'bear_atr_max_pct': 0.03340069064842245, 'bear_tp_mult': 2.907867770280909, 'bear_tsl_mult': 0.5918082405516111, 'bear_time_stop': 240, 'bear_use_sma': False, 'bear_use_ema': True, 'bear_use_atr': True, 'bear_use_adx': True, 'bear_use_spike': True, 'bear_rsi_required': True, 'sideways_strategy': 'mean_reversion', 'sideways_bb_std_mult': 1.4307185145795474, 'sideways_rsi_os': 13, 'sideways_rsi_ob': 68, 'sideways_adx_thresh': 12.197819536528725, 'sideways_atr_min_pct': 0.027799515165874398, 'sideways_atr_max_pct': 0.015769402466412195, 'sideways_tp_mult': 2.2779668115704905, 'sideways_tsl_mult': 0.46356574306304, 'sideways_time_stop': 139, 'sideways_use_sma': False, 'sideways_use_ema': False, 'sideways_use_atr': True, 'sideways_use_adx': False, 'sideways_use_spike': True, 'sideways_rsi_required': True}.
[I 2025-09-01 08:42:39,752] Trial 463 finished with values: [-1000000000.0, 1000000000.0] and parameters: {'p_sma': 38, 'p_std': 33, 'p_atr': 19, 'p_adx': 15, 'rsi_period': 46, 'ema1': 8, 'ema2': 10, 'slip_atr_k': 0.01992702394751347, 'slip_spread_k': 0.19701497997847334, 'spread_hl_frac': 0.02256848867724419, 'bb_std_mult': 2.3661593259691864, 'rsi_os': 43, 'rsi_ob': 93, 'vol_spike': 0.02576151273602472, 'adx_thresh': 32.56316669794443, 'atr_min_pct': 0.007653392673753821, 'atr_max_pct': 0.09713098557380331, 'tp_mult': 1.4239553612250915, 'tsl_mult': 0.2299037158688827, 'strategy': 'mean_reversion', 'time_stop': 29, 'use_sma': False, 'use_atr': True, 'use_adx': False, 'use_ema': False, 'use_spike': False, 'rsi_required': False, 'edge_k': 0.7299248523712243, 'edge_cap': 0.35336092594327234, 'bull_strategy': 'mean_reversion', 'bull_bb_std_mult': 2.6659301056826816, 'bull_rsi_os': 43, 'bull_rsi_ob': 58, 'bull_adx_thresh': 12.595467730558045, 'bull_atr_min_pct': 0.01776126194157494, 'bull_atr_max_pct': 0.0719457981585985, 'bull_tp_mult': 1.303538119666256, 'bull_tsl_mult': 0.9753157577378285, 'bull_time_stop': 109, 'bull_use_sma': True, 'bull_use_ema': True, 'bull_use_atr': True, 'bull_use_adx': True, 'bull_use_spike': True, 'bull_rsi_required': False, 'bear_strategy': 'mean_reversion', 'bear_bb_std_mult': 3.5530547978081217, 'bear_rsi_os': 41, 'bear_rsi_ob': 88, 'bear_adx_thresh': 9.987249258982361, 'bear_atr_min_pct': 0.004901294614564703, 'bear_atr_max_pct': 0.035702300092229564, 'bear_tp_mult': 2.9186436912922495, 'bear_tsl_mult': 0.6909970005979276, 'bear_time_stop': 239, 'bear_use_sma': False, 'bear_use_ema': True, 'bear_use_atr': True, 'bear_use_adx': True, 'bear_use_spike': True, 'bear_rsi_required': True, 'sideways_strategy': 'mean_reversion', 'sideways_bb_std_mult': 1.462897458989398, 'sideways_rsi_os': 13, 'sideways_rsi_ob': 68, 'sideways_adx_thresh': 12.176729944832436, 'sideways_atr_min_pct': 0.027583570299239857, 'sideways_atr_max_pct': 0.04196547358640229, 'sideways_tp_mult': 2.2234748589680193, 'sideways_tsl_mult': 0.31895678887205, 'sideways_time_stop': 140, 'sideways_use_sma': False, 'sideways_use_ema': False, 'sideways_use_atr': True, 'sideways_use_adx': False, 'sideways_use_spike': True, 'sideways_rsi_required': True}.
[I 2025-09-01 08:42:40,035] Trial 464 finished with values: [-1000000000.0, 1000000000.0] and parameters: {'p_sma': 34, 'p_std': 34, 'p_atr': 18, 'p_adx': 15, 'rsi_period': 46, 'ema1': 9, 'ema2': 10, 'slip_atr_k': 0.02003070081396122, 'slip_spread_k': 0.19645082073205156, 'spread_hl_frac': 0.022668624678455984, 'bb_std_mult': 2.3736842949550936, 'rsi_os': 44, 'rsi_ob': 93, 'vol_spike': 0.025308528651569538, 'adx_thresh': 32.15438850950449, 'atr_min_pct': 0.008643924048517262, 'atr_max_pct': 0.10062000304113515, 'tp_mult': 1.4411362657830917, 'tsl_mult': 0.22272836794049375, 'strategy': 'mean_reversion', 'time_stop': 29, 'use_sma': True, 'use_atr': True, 'use_adx': False, 'use_ema': False, 'use_spike': False, 'rsi_required': False, 'edge_k': 0.76252072984115, 'edge_cap': 0.31720864525955556, 'bull_strategy': 'mean_reversion', 'bull_bb_std_mult': 2.6530609364520354, 'bull_rsi_os': 43, 'bull_rsi_ob': 58, 'bull_adx_thresh': 12.460403207141155, 'bull_atr_min_pct': 0.01786873993740125, 'bull_atr_max_pct': 0.07178692973694015, 'bull_tp_mult': 1.322616260418976, 'bull_tsl_mult': 0.9735684901084518, 'bull_time_stop': 157, 'bull_use_sma': False, 'bull_use_ema': True, 'bull_use_atr': True, 'bull_use_adx': True, 'bull_use_spike': True, 'bull_rsi_required': True, 'bear_strategy': 'breakout', 'bear_bb_std_mult': 3.542269645142815, 'bear_rsi_os': 41, 'bear_rsi_ob': 88, 'bear_adx_thresh': 9.896019087777322, 'bear_atr_min_pct': 0.005148276060982659, 'bear_atr_max_pct': 0.03148915024177151, 'bear_tp_mult': 2.8620738317615104, 'bear_tsl_mult': 0.10241502039431237, 'bear_time_stop': 237, 'bear_use_sma': False, 'bear_use_ema': True, 'bear_use_atr': True, 'bear_use_adx': True, 'bear_use_spike': True, 'bear_rsi_required': True, 'sideways_strategy': 'mean_reversion', 'sideways_bb_std_mult': 1.4312962345643871, 'sideways_rsi_os': 13, 'sideways_rsi_ob': 68, 'sideways_adx_thresh': 12.323918396726317, 'sideways_atr_min_pct': 0.02790498412214691, 'sideways_atr_max_pct': 0.017328453825175335, 'sideways_tp_mult': 2.226339411502698, 'sideways_tsl_mult': 0.4536842779150527, 'sideways_time_stop': 139, 'sideways_use_sma': False, 'sideways_use_ema': False, 'sideways_use_atr': True, 'sideways_use_adx': False, 'sideways_use_spike': True, 'sideways_rsi_required': True}.
[I 2025-09-01 08:42:40,340] Trial 466 finished with values: [-1000000000.0, 1000000000.0] and parameters: {'p_sma': 35, 'p_std': 35, 'p_atr': 18, 'p_adx': 15, 'rsi_period': 46, 'ema1': 8, 'ema2': 10, 'slip_atr_k': 0.02094607955311295, 'slip_spread_k': 0.21231233054124637, 'spread_hl_frac': 0.02320825816353886, 'bb_std_mult': 2.3731565947708346, 'rsi_os': 43, 'rsi_ob': 93, 'vol_spike': 0.025794533560954368, 'adx_thresh': 32.115804449188374, 'atr_min_pct': 0.008622299129522963, 'atr_max_pct': 0.10128396943903792, 'tp_mult': 1.4350776743688223, 'tsl_mult': 0.230394068669663, 'strategy': 'mean_reversion', 'time_stop': 28, 'use_sma': True, 'use_atr': True, 'use_adx': False, 'use_ema': False, 'use_spike': False, 'rsi_required': False, 'edge_k': 0.7519622568541646, 'edge_cap': 0.31380751643938015, 'bull_strategy': 'mean_reversion', 'bull_bb_std_mult': 2.667958578998656, 'bull_rsi_os': 43, 'bull_rsi_ob': 58, 'bull_adx_thresh': 12.775330765523398, 'bull_atr_min_pct': 0.01783844476805488, 'bull_atr_max_pct': 0.07202400226970615, 'bull_tp_mult': 1.281600087213214, 'bull_tsl_mult': 0.9999277144598729, 'bull_time_stop': 156, 'bull_use_sma': False, 'bull_use_ema': True, 'bull_use_atr': True, 'bull_use_adx': True, 'bull_use_spike': True, 'bull_rsi_required': True, 'bear_strategy': 'breakout', 'bear_bb_std_mult': 3.5830446065802612, 'bear_rsi_os': 41, 'bear_rsi_ob': 87, 'bear_adx_thresh': 9.430305345585047, 'bear_atr_min_pct': 0.004730442749032228, 'bear_atr_max_pct': 0.033618095268506946, 'bear_tp_mult': 2.9014903425728447, 'bear_tsl_mult': 0.8153043446112161, 'bear_time_stop': 233, 'bear_use_sma': False, 'bear_use_ema': True, 'bear_use_atr': True, 'bear_use_adx': True, 'bear_use_spike': True, 'bear_rsi_required': True, 'sideways_strategy': 'mean_reversion', 'sideways_bb_std_mult': 1.419006333096847, 'sideways_rsi_os': 15, 'sideways_rsi_ob': 67, 'sideways_adx_thresh': 12.625369400356323, 'sideways_atr_min_pct': 0.028138528213407104, 'sideways_atr_max_pct': 0.01703370034108913, 'sideways_tp_mult': 2.288304511525123, 'sideways_tsl_mult': 0.47278555881597395, 'sideways_time_stop': 142, 'sideways_use_sma': False, 'sideways_use_ema': False, 'sideways_use_atr': True, 'sideways_use_adx': False, 'sideways_use_spike': True, 'sideways_rsi_required': True}.
[I 2025-09-01 08:43:20,975] Trial 470 finished with values: [0.007875579433267, 0.003435555838648134] and parameters: {'p_sma': 35, 'p_std': 34, 'p_atr': 19, 'p_adx': 16, 'rsi_period': 44, 'ema1': 10, 'ema2': 10, 'slip_atr_k': 0.02511820489935922, 'slip_spread_k': 0.22220371676899203, 'spread_hl_frac': 0.021143634859751733, 'bb_std_mult': 2.2775655260557204, 'rsi_os': 44, 'rsi_ob': 92, 'vol_spike': 0.031856625562810326, 'adx_thresh': 31.034435627864568, 'atr_min_pct': 0.007094634670285092, 'atr_max_pct': 0.09892543829466743, 'tp_mult': 1.4951146813291434, 'tsl_mult': 0.2417567477319644, 'strategy': 'mean_reversion', 'time_stop': 18, 'use_sma': False, 'use_atr': False, 'use_adx': False, 'use_ema': False, 'use_spike': False, 'rsi_required': False, 'edge_k': 0.6808226187191766, 'edge_cap': 0.33563964551537856, 'bull_strategy': 'breakout', 'bull_bb_std_mult': 2.711561391507093, 'bull_rsi_os': 44, 'bull_rsi_ob': 59, 'bull_adx_thresh': 11.84236251135146, 'bull_atr_min_pct': 0.01703923257779322, 'bull_atr_max_pct': 0.06655500051602364, 'bull_tp_mult': 1.260653001455159, 'bull_tsl_mult': 0.9382183801374955, 'bull_time_stop': 164, 'bull_use_sma': True, 'bull_use_ema': True, 'bull_use_atr': True, 'bull_use_adx': True, 'bull_use_spike': True, 'bull_rsi_required': False, 'bear_strategy': 'mean_reversion', 'bear_bb_std_mult': 3.482256348709316, 'bear_rsi_os': 42, 'bear_rsi_ob': 87, 'bear_adx_thresh': 9.066226054258612, 'bear_atr_min_pct': 0.004982769803458662, 'bear_atr_max_pct': 0.03083325992792234, 'bear_tp_mult': 2.959930424532365, 'bear_tsl_mult': 0.7629216448370876, 'bear_time_stop': 233, 'bear_use_sma': False, 'bear_use_ema': False, 'bear_use_atr': True, 'bear_use_adx': True, 'bear_use_spike': True, 'bear_rsi_required': True, 'sideways_strategy': 'breakout', 'sideways_bb_std_mult': 1.3714174411965532, 'sideways_rsi_os': 15, 'sideways_rsi_ob': 69, 'sideways_adx_thresh': 12.97903704416199, 'sideways_atr_min_pct': 0.02708555818833302, 'sideways_atr_max_pct': 0.1061431597006338, 'sideways_tp_mult': 2.4995435320959953, 'sideways_tsl_mult': 0.4377284747381374, 'sideways_time_stop': 132, 'sideways_use_sma': False, 'sideways_use_ema': False, 'sideways_use_atr': True, 'sideways_use_adx': False, 'sideways_use_spike': True, 'sideways_rsi_required': True}.
