[I 2025-09-01 07:46:28,563] Trial 154 finished with values: [-0.010050772116293905, 0.010024458559705003] and parameters: {'p_sma': 48, 'p_std': 46, 'p_atr': 20, 'p_adx': 15, 'rsi_period': 38, 'ema1': 10, 'ema2': 12, 'slip_atr_k': 0.03694334111069601, 'slip_spread_k': 0.50941936473676, 'spread_hl_frac': 0.01525984687458861, 'bb_std_mult': 2.7724117521823373, 'rsi_os': 44, 'rsi_ob': 81, 'vol_spike': 0.034503262542290226, 'adx_thresh': 32.743785895533335, 'atr_min_pct': 0.015412893956413534, 'atr_max_pct': 0.11061891361027268, 'tp_mult': 2.2781563834506, 'tsl_mult': 0.49023699865385867, 'strategy': 'breakout', 'time_stop': 112, 'use_sma': False, 'use_atr': False, 'use_adx': True, 'use_ema': False, 'use_spike': False, 'rsi_required': True, 'edge_k': 1.939091132392216, 'edge_cap': 0.21508217895162074, 'bull_strategy': 'breakout', 'bull_bb_std_mult': 2.4417017995826606, 'bull_rsi_os': 16, 'bull_rsi_ob': 87, 'bull_adx_thresh': 20.0107244464919, 'bull_atr_min_pct': 0.002637081733081966, 'bull_atr_max_pct': 0.015977481186125728, 'bull_tp_mult': 1.1162668946081837, 'bull_tsl_mult': 0.5171888628102308, 'bull_time_stop': 6, 'bull_use_sma': True, 'bull_use_ema': False, 'bull_use_atr': False, 'bull_use_adx': False, 'bull_use_spike': False, 'bull_rsi_required': False, 'bear_strategy': 'mean_reversion', 'bear_bb_std_mult': 2.06563258461078, 'bear_rsi_os': 53, 'bear_rsi_ob': 84, 'bear_adx_thresh': 17.856039299981678, 'bear_atr_min_pct': 0.008527741697379599, 'bear_atr_max_pct': 0.10163475258192707, 'bear_tp_mult': 1.3164242321664048, 'bear_tsl_mult': 0.08395375354474918, 'bear_time_stop': 123, 'bear_use_sma': True, 'bear_use_ema': True, 'bear_use_atr': False, 'bear_use_adx': False, 'bear_use_spike': False, 'bear_rsi_required': False, 'sideways_strategy': 'breakout', 'sideways_bb_std_mult': 1.0958024935959862, 'sideways_rsi_os': 41, 'sideways_rsi_ob': 48, 'sideways_adx_thresh': 14.419696269132517, 'sideways_atr_min_pct': 0.019279461235551368, 'sideways_atr_max_pct': 0.08630348101049366, 'sideways_tp_mult': 2.930620215017403, 'sideways_tsl_mult': 0.14871945345991497, 'sideways_time_stop': 93, 'sideways_use_sma': True, 'sideways_use_ema': False, 'sideways_use_atr': True, 'sideways_use_adx': True, 'sideways_use_spike': False, 'sideways_rsi_required': False}.
[I 2025-09-01 07:46:28,849] Trial 151 finished with values: [-0.027207221156005157, 0.02728614643046454] and parameters: {'p_sma': 47, 'p_std': 45, 'p_atr': 25, 'p_adx': 18, 'rsi_period': 40, 'ema1': 9, 'ema2': 11, 'slip_atr_k': 0.02986105022043191, 'slip_spread_k': 0.5041680697691576, 'spread_hl_frac': 0.015282275938512653, 'bb_std_mult': 2.8870226135878765, 'rsi_os': 43, 'rsi_ob': 89, 'vol_spike': 0.06499986300003274, 'adx_thresh': 32.42632224603165, 'atr_min_pct': 0.02638545069395104, 'atr_max_pct': 0.07762844177038332, 'tp_mult': 2.2767155553271095, 'tsl_mult': 0.5847887679198512, 'strategy': 'mean_reversion', 'time_stop': 102, 'use_sma': True, 'use_atr': False, 'use_adx': True, 'use_ema': False, 'use_spike': False, 'rsi_required': False, 'edge_k': 1.8681405521387076, 'edge_cap': 0.06005588776131583, 'bull_strategy': 'breakout', 'bull_bb_std_mult': 1.7546941842717452, 'bull_rsi_os': 6, 'bull_rsi_ob': 91, 'bull_adx_thresh': 10.755685276900733, 'bull_atr_min_pct': 0.000319123999085469, 'bull_atr_max_pct': 0.11034673370338742, 'bull_tp_mult': 1.5702003288762905, 'bull_tsl_mult': 0.5314727332839615, 'bull_time_stop': 69, 'bull_use_sma': True, 'bull_use_ema': False, 'bull_use_atr': True, 'bull_use_adx': True, 'bull_use_spike': False, 'bull_rsi_required': False, 'bear_strategy': 'mean_reversion', 'bear_bb_std_mult': 1.833221976259074, 'bear_rsi_os': 48, 'bear_rsi_ob': 86, 'bear_adx_thresh': 20.439951752499844, 'bear_atr_min_pct': 0.008705195132456395, 'bear_atr_max_pct': 0.10444174300958284, 'bear_tp_mult': 1.3210703712597458, 'bear_tsl_mult': 0.22467724900654928, 'bear_time_stop': 75, 'bear_use_sma': True, 'bear_use_ema': True, 'bear_use_atr': False, 'bear_use_adx': True, 'bear_use_spike': True, 'bear_rsi_required': False, 'sideways_strategy': 'breakout', 'sideways_bb_std_mult': 1.3413940807921683, 'sideways_rsi_os': 44, 'sideways_rsi_ob': 45, 'sideways_adx_thresh': 17.330223147284983, 'sideways_atr_min_pct': 0.018647485773203264, 'sideways_atr_max_pct': 0.118675035084394, 'sideways_tp_mult': 2.7500805122150185, 'sideways_tsl_mult': 0.20891340068365613, 'sideways_time_stop': 74, 'sideways_use_sma': False, 'sideways_use_ema': False, 'sideways_use_atr': True, 'sideways_use_adx': True, 'sideways_use_spike': False, 'sideways_rsi_required': False}.
[I 2025-09-01 07:47:08,718] Trial 156 finished with values: [-1000000000.0, 1000000000.0] and parameters: {'p_sma': 44, 'p_std': 41, 'p_atr': 20, 'p_adx': 12, 'rsi_period': 38, 'ema1': 13, 'ema2': 37, 'slip_atr_k': 0.012781731883974752, 'slip_spread_k': 0.9681601856565483, 'spread_hl_frac': 0.022339009729133177, 'bb_std_mult': 2.555123723467568, 'rsi_os': 44, 'rsi_ob': 84, 'vol_spike': 0.02165185358824842, 'adx_thresh': 33.48657937303872, 'atr_min_pct': 0.02635819614169004, 'atr_max_pct': 0.07774864323028086, 'tp_mult': 1.6634138218996826, 'tsl_mult': 0.5976063967153509, 'strategy': 'breakout', 'time_stop': 113, 'use_sma': False, 'use_atr': True, 'use_adx': True, 'use_ema': False, 'use_spike': False, 'rsi_required': True, 'edge_k': 1.9559171999867486, 'edge_cap': 0.20194034307447684, 'bull_strategy': 'mean_reversion', 'bull_bb_std_mult': 2.4578874218566082, 'bull_rsi_os': 15, 'bull_rsi_ob': 79, 'bull_adx_thresh': 15.386824456376944, 'bull_atr_min_pct': 0.002176306148539468, 'bull_atr_max_pct': 0.06580493711822386, 'bull_tp_mult': 1.1204857038635063, 'bull_tsl_mult': 0.3675637965252163, 'bull_time_stop': 6, 'bull_use_sma': True, 'bull_use_ema': True, 'bull_use_atr': False, 'bull_use_adx': False, 'bull_use_spike': False, 'bull_rsi_required': False, 'bear_strategy': 'mean_reversion', 'bear_bb_std_mult': 2.217693447986668, 'bear_rsi_os': 47, 'bear_rsi_ob': 89, 'bear_adx_thresh': 16.37208640487663, 'bear_atr_min_pct': 0.010314405355943811, 'bear_atr_max_pct': 0.10017251790111795, 'bear_tp_mult': 1.3008820577790858, 'bear_tsl_mult': 0.290906107565715, 'bear_time_stop': 13, 'bear_use_sma': True, 'bear_use_ema': False, 'bear_use_atr': True, 'bear_use_adx': False, 'bear_use_spike': False, 'bear_rsi_required': False, 'sideways_strategy': 'breakout', 'sideways_bb_std_mult': 0.8171772291929915, 'sideways_rsi_os': 48, 'sideways_rsi_ob': 70, 'sideways_adx_thresh': 14.795409620717919, 'sideways_atr_min_pct': 0.01573216896345306, 'sideways_atr_max_pct': 0.010247134958244468, 'sideways_tp_mult': 1.9395149223465504, 'sideways_tsl_mult': 0.20953457576568238, 'sideways_time_stop': 97, 'sideways_use_sma': True, 'sideways_use_ema': False, 'sideways_use_atr': False, 'sideways_use_adx': True, 'sideways_use_spike': False, 'sideways_rsi_required': False}.
[I 2025-09-01 07:47:09,378] Trial 157 finished with values: [-1000000000.0, 1000000000.0] and parameters: {'p_sma': 43, 'p_std': 41, 'p_atr': 20, 'p_adx': 15, 'rsi_period': 38, 'ema1': 13, 'ema2': 48, 'slip_atr_k': 0.013821236913046545, 'slip_spread_k': 0.5027359266093856, 'spread_hl_frac': 0.022767952845996236, 'bb_std_mult': 2.5817200646762726, 'rsi_os': 44, 'rsi_ob': 84, 'vol_spike': 0.028998027626380384, 'adx_thresh': 33.419440905735065, 'atr_min_pct': 0.01104509770191588, 'atr_max_pct': 0.119174400060404, 'tp_mult': 2.1140654855520196, 'tsl_mult': 0.734208520935642, 'strategy': 'breakout', 'time_stop': 41, 'use_sma': False, 'use_atr': True, 'use_adx': True, 'use_ema': False, 'use_spike': False, 'rsi_required': True, 'edge_k': 1.9454691024441342, 'edge_cap': 0.1382263776634598, 'bull_strategy': 'mean_reversion', 'bull_bb_std_mult': 2.460368221707282, 'bull_rsi_os': 15, 'bull_rsi_ob': 58, 'bull_adx_thresh': 34.14664116085468, 'bull_atr_min_pct': 0.002251843372360939, 'bull_atr_max_pct': 0.09509086477562016, 'bull_tp_mult': 1.5285982661126505, 'bull_tsl_mult': 0.35517990512120895, 'bull_time_stop': 84, 'bull_use_sma': True, 'bull_use_ema': True, 'bull_use_atr': False, 'bull_use_adx': False, 'bull_use_spike': False, 'bull_rsi_required': False, 'bear_strategy': 'mean_reversion', 'bear_bb_std_mult': 1.7187170567903538, 'bear_rsi_os': 47, 'bear_rsi_ob': 88, 'bear_adx_thresh': 16.45062142699162, 'bear_atr_min_pct': 0.010405777255208793, 'bear_atr_max_pct': 0.10085906782682329, 'bear_tp_mult': 1.2936760212575265, 'bear_tsl_mult': 0.2878073377494922, 'bear_time_stop': 247, 'bear_use_sma': True, 'bear_use_ema': False, 'bear_use_atr': True, 'bear_use_adx': False, 'bear_use_spike': False, 'bear_rsi_required': False, 'sideways_strategy': 'breakout', 'sideways_bb_std_mult': 0.8157938018389879, 'sideways_rsi_os': 48, 'sideways_rsi_ob': 69, 'sideways_adx_thresh': 14.649373772399985, 'sideways_atr_min_pct': 0.019351805258893524, 'sideways_atr_max_pct': 0.01288115390970586, 'sideways_tp_mult': 1.4615993372489884, 'sideways_tsl_mult': 0.1110364126297409, 'sideways_time_stop': 234, 'sideways_use_sma': True, 'sideways_use_ema': False, 'sideways_use_atr': False, 'sideways_use_adx': True, 'sideways_use_spike': False, 'sideways_rsi_required': False}.
[I 2025-09-01 07:47:10,074] Trial 155 finished with values: [-0.01749355442676437, 0.017405346922062404] and parameters: {'p_sma': 47, 'p_std': 46, 'p_atr': 20, 'p_adx': 15, 'rsi_period': 38, 'ema1': 9, 'ema2': 12, 'slip_atr_k': 0.013421090202626378, 'slip_spread_k': 0.5098105903781862, 'spread_hl_frac': 0.008726024572352258, 'bb_std_mult': 2.5803861525607736, 'rsi_os': 44, 'rsi_ob': 89, 'vol_spike': 0.04858011807028434, 'adx_thresh': 30.235674397797915, 'atr_min_pct': 0.014887816707499293, 'atr_max_pct': 0.11577191294687007, 'tp_mult': 1.5833812325859207, 'tsl_mult': 0.455360914032286, 'strategy': 'breakout', 'time_stop': 39, 'use_sma': False, 'use_atr': False, 'use_adx': True, 'use_ema': False, 'use_spike': False, 'rsi_required': True, 'edge_k': 1.935164296954876, 'edge_cap': 0.8857461981486809, 'bull_strategy': 'breakout', 'bull_bb_std_mult': 2.4673680597939875, 'bull_rsi_os': 15, 'bull_rsi_ob': 79, 'bull_adx_thresh': 26.414974651390807, 'bull_atr_min_pct': 0.001727653624432976, 'bull_atr_max_pct': 0.06730864203030856, 'bull_tp_mult': 1.1230819904623113, 'bull_tsl_mult': 0.36706054609950395, 'bull_time_stop': 116, 'bull_use_sma': True, 'bull_use_ema': True, 'bull_use_atr': False, 'bull_use_adx': False, 'bull_use_spike': False, 'bull_rsi_required': False, 'bear_strategy': 'mean_reversion', 'bear_bb_std_mult': 1.693556799936713, 'bear_rsi_os': 52, 'bear_rsi_ob': 81, 'bear_adx_thresh': 30.677490045732554, 'bear_atr_min_pct': 0.008751034517655756, 'bear_atr_max_pct': 0.09995896807614285, 'bear_tp_mult': 1.3912027041122728, 'bear_tsl_mult': 0.15876785760789164, 'bear_time_stop': 100, 'bear_use_sma': True, 'bear_use_ema': False, 'bear_use_atr': False, 'bear_use_adx': False, 'bear_use_spike': False, 'bear_rsi_required': False, 'sideways_strategy': 'breakout', 'sideways_bb_std_mult': 0.9798003121691138, 'sideways_rsi_os': 41, 'sideways_rsi_ob': 92, 'sideways_adx_thresh': 14.179150023938007, 'sideways_atr_min_pct': 0.015812851235929414, 'sideways_atr_max_pct': 0.01569878880308724, 'sideways_tp_mult': 2.0623363475450414, 'sideways_tsl_mult': 0.2004286916385899, 'sideways_time_stop': 93, 'sideways_use_sma': True, 'sideways_use_ema': False, 'sideways_use_atr': True, 'sideways_use_adx': True, 'sideways_use_spike': False, 'sideways_rsi_required': False}.
[I 2025-09-01 07:47:10,326] Trial 158 finished with values: [-1000000000.0, 1000000000.0] and parameters: {'p_sma': 48, 'p_std': 42, 'p_atr': 20, 'p_adx': 15, 'rsi_period': 37, 'ema1': 13, 'ema2': 24, 'slip_atr_k': 0.013036407461180108, 'slip_spread_k': 0.5347706841755031, 'spread_hl_frac': 0.04310081714205316, 'bb_std_mult': 2.5781830436050868, 'rsi_os': 44, 'rsi_ob': 84, 'vol_spike': 0.026199243353472755, 'adx_thresh': 33.694056928824466, 'atr_min_pct': 0.012908242437808378, 'atr_max_pct': 0.11895732637682535, 'tp_mult': 2.1086907117721214, 'tsl_mult': 0.6301533581208183, 'strategy': 'breakout', 'time_stop': 45, 'use_sma': False, 'use_atr': True, 'use_adx': True, 'use_ema': True, 'use_spike': True, 'rsi_required': True, 'edge_k': 1.9326608590339638, 'edge_cap': 0.14131120248665516, 'bull_strategy': 'mean_reversion', 'bull_bb_std_mult': 2.4603991126612463, 'bull_rsi_os': 15, 'bull_rsi_ob': 45, 'bull_adx_thresh': 19.825395017486432, 'bull_atr_min_pct': 0.018100449236765938, 'bull_atr_max_pct': 0.06722682493009252, 'bull_tp_mult': 1.1214352800685194, 'bull_tsl_mult': 0.376285842150627, 'bull_time_stop': 82, 'bull_use_sma': True, 'bull_use_ema': True, 'bull_use_atr': False, 'bull_use_adx': False, 'bull_use_spike': False, 'bull_rsi_required': False, 'bear_strategy': 'mean_reversion', 'bear_bb_std_mult': 1.7258009607436795, 'bear_rsi_os': 44, 'bear_rsi_ob': 89, 'bear_adx_thresh': 13.126674870141303, 'bear_atr_min_pct': 0.010328460076050188, 'bear_atr_max_pct': 0.10177769170008097, 'bear_tp_mult': 1.2557808578114682, 'bear_tsl_mult': 0.2841461551162851, 'bear_time_stop': 117, 'bear_use_sma': True, 'bear_use_ema': False, 'bear_use_atr': True, 'bear_use_adx': False, 'bear_use_spike': False, 'bear_rsi_required': True, 'sideways_strategy': 'breakout', 'sideways_bb_std_mult': 0.817938261863007, 'sideways_rsi_os': 40, 'sideways_rsi_ob': 81, 'sideways_adx_thresh': 14.40169488902676, 'sideways_atr_min_pct': 0.019367681449345763, 'sideways_atr_max_pct': 0.08349470960836633, 'sideways_tp_mult': 1.461357289846232, 'sideways_tsl_mult': 0.1840884968008817, 'sideways_time_stop': 86, 'sideways_use_sma': True, 'sideways_use_ema': True, 'sideways_use_atr': False, 'sideways_use_adx': True, 'sideways_use_spike': False, 'sideways_rsi_required': False}.
[I 2025-09-01 07:47:10,844] Trial 162 finished with values: [-1000000000.0, 1000000000.0] and parameters: {'p_sma': 23, 'p_std': 39, 'p_atr': 21, 'p_adx': 17, 'rsi_period': 11, 'ema1': 12, 'ema2': 43, 'slip_atr_k': 0.01990535295840231, 'slip_spread_k': 0.3095913290006641, 'spread_hl_frac': 0.017954627899609263, 'bb_std_mult': 2.7180543932292163, 'rsi_os': 46, 'rsi_ob': 81, 'vol_spike': 0.04108684729460234, 'adx_thresh': 31.714071095023574, 'atr_min_pct': 0.02830196402177307, 'atr_max_pct': 0.019693747130915776, 'tp_mult': 1.3758524583365062, 'tsl_mult': 0.8867401796208563, 'strategy': 'breakout', 'time_stop': 29, 'use_sma': False, 'use_atr': False, 'use_adx': True, 'use_ema': True, 'use_spike': True, 'rsi_required': False, 'edge_k': 1.993723812837197, 'edge_cap': 0.2011673703435108, 'bull_strategy': 'breakout', 'bull_bb_std_mult': 2.3666073859756303, 'bull_rsi_os': 12, 'bull_rsi_ob': 60, 'bull_adx_thresh': 23.680536736803994, 'bull_atr_min_pct': 0.0048944071052121054, 'bull_atr_max_pct': 0.13826590946057046, 'bull_tp_mult': 2.449086889087051, 'bull_tsl_mult': 0.43223474327938405, 'bull_time_stop': 126, 'bull_use_sma': True, 'bull_use_ema': True, 'bull_use_atr': False, 'bull_use_adx': False, 'bull_use_spike': False, 'bull_rsi_required': False, 'bear_strategy': 'mean_reversion', 'bear_bb_std_mult': 1.9329800397621961, 'bear_rsi_os': 41, 'bear_rsi_ob': 63, 'bear_adx_thresh': 32.544179225842726, 'bear_atr_min_pct': 0.007629202274932094, 'bear_atr_max_pct': 0.09233979928500809, 'bear_tp_mult': 1.3667305827514087, 'bear_tsl_mult': 0.010092095368492149, 'bear_time_stop': 259, 'bear_use_sma': True, 'bear_use_ema': False, 'bear_use_atr': False, 'bear_use_adx': False, 'bear_use_spike': False, 'bear_rsi_required': True, 'sideways_strategy': 'breakout', 'sideways_bb_std_mult': 1.0914935731748734, 'sideways_rsi_os': 45, 'sideways_rsi_ob': 48, 'sideways_adx_thresh': 12.657444427191283, 'sideways_atr_min_pct': 0.002731573021569034, 'sideways_atr_max_pct': 0.07482469215376031, 'sideways_tp_mult': 1.1322460859196268, 'sideways_tsl_mult': 0.27592949384344734, 'sideways_time_stop': 164, 'sideways_use_sma': False, 'sideways_use_ema': True, 'sideways_use_atr': True, 'sideways_use_adx': True, 'sideways_use_spike': False, 'sideways_rsi_required': False}.
[I 2025-09-01 07:47:10,851] Trial 161 finished with values: [-1000000000.0, 1000000000.0] and parameters: {'p_sma': 32, 'p_std': 39, 'p_atr': 21, 'p_adx': 25, 'rsi_period': 66, 'ema1': 14, 'ema2': 51, 'slip_atr_k': 0.019575785334499135, 'slip_spread_k': 0.5407867648352076, 'spread_hl_frac': 0.00043557704391232466, 'bb_std_mult': 2.721667013315564, 'rsi_os': 47, 'rsi_ob': 82, 'vol_spike': 0.007624643607475296, 'adx_thresh': 34.095429095916096, 'atr_min_pct': 0.015803286394744702, 'atr_max_pct': 0.014965664387728242, 'tp_mult': 1.559174777927773, 'tsl_mult': 0.893527673929199, 'strategy': 'breakout', 'time_stop': 47, 'use_sma': False, 'use_atr': False, 'use_adx': True, 'use_ema': True, 'use_spike': True, 'rsi_required': False, 'edge_k': 1.999772129909738, 'edge_cap': 0.19887693992819674, 'bull_strategy': 'breakout', 'bull_bb_std_mult': 2.354084782804248, 'bull_rsi_os': 12, 'bull_rsi_ob': 59, 'bull_adx_thresh': 19.935149064127437, 'bull_atr_min_pct': 0.01864301442602323, 'bull_atr_max_pct': 0.14580063589602882, 'bull_tp_mult': 1.0461921975442912, 'bull_tsl_mult': 0.4313054845248655, 'bull_time_stop': 85, 'bull_use_sma': True, 'bull_use_ema': True, 'bull_use_atr': False, 'bull_use_adx': False, 'bull_use_spike': False, 'bull_rsi_required': False, 'bear_strategy': 'mean_reversion', 'bear_bb_std_mult': 1.9552254150219655, 'bear_rsi_os': 20, 'bear_rsi_ob': 63, 'bear_adx_thresh': 18.965252185855537, 'bear_atr_min_pct': 0.009203440432026914, 'bear_atr_max_pct': 0.10240222704223215, 'bear_tp_mult': 1.2670700759144036, 'bear_tsl_mult': 0.014402417674425183, 'bear_time_stop': 258, 'bear_use_sma': True, 'bear_use_ema': False, 'bear_use_atr': False, 'bear_use_adx': False, 'bear_use_spike': False, 'bear_rsi_required': True, 'sideways_strategy': 'breakout', 'sideways_bb_std_mult': 1.0894861341368207, 'sideways_rsi_os': 29, 'sideways_rsi_ob': 49, 'sideways_adx_thresh': 12.44547732488857, 'sideways_atr_min_pct': 0.019468446586953295, 'sideways_atr_max_pct': 0.08116535823863265, 'sideways_tp_mult': 1.6903685705442408, 'sideways_tsl_mult': 0.17776483184616765, 'sideways_time_stop': 83, 'sideways_use_sma': False, 'sideways_use_ema': True, 'sideways_use_atr': True, 'sideways_use_adx': True, 'sideways_use_spike': False, 'sideways_rsi_required': False}.
[I 2025-09-01 07:47:53,645] Trial 159 finished with values: [-1000000000.0, 1000000000.0] and parameters: {'p_sma': 44, 'p_std': 42, 'p_atr': 20, 'p_adx': 15, 'rsi_period': 37, 'ema1': 13, 'ema2': 28, 'slip_atr_k': 0.021922260544157947, 'slip_spread_k': 0.531051007013635, 'spread_hl_frac': 0.02623629293260207, 'bb_std_mult': 2.797838291461827, 'rsi_os': 47, 'rsi_ob': 83, 'vol_spike': 0.030369915037835017, 'adx_thresh': 33.59878505655756, 'atr_min_pct': 0.012982169240413878, 'atr_max_pct': 0.11793378562521749, 'tp_mult': 2.850948675434458, 'tsl_mult': 0.44957809188986864, 'strategy': 'breakout', 'time_stop': 46, 'use_sma': False, 'use_atr': False, 'use_adx': True, 'use_ema': True, 'use_spike': True, 'rsi_required': False, 'edge_k': 1.999409055570571, 'edge_cap': 0.1032547335494413, 'bull_strategy': 'breakout', 'bull_bb_std_mult': 2.3469696114384946, 'bull_rsi_os': 16, 'bull_rsi_ob': 88, 'bull_adx_thresh': 26.382226601612903, 'bull_atr_min_pct': 0.004783489407018325, 'bull_atr_max_pct': 0.06859449463600181, 'bull_tp_mult': 1.0615440228754363, 'bull_tsl_mult': 0.3599199620545277, 'bull_time_stop': 80, 'bull_use_sma': True, 'bull_use_ema': True, 'bull_use_atr': False, 'bull_use_adx': False, 'bull_use_spike': False, 'bull_rsi_required': False, 'bear_strategy': 'mean_reversion', 'bear_bb_std_mult': 1.6817875482867697, 'bear_rsi_os': 43, 'bear_rsi_ob': 63, 'bear_adx_thresh': 18.974425057335342, 'bear_atr_min_pct': 0.009251576499960414, 'bear_atr_max_pct': 0.10135783571618984, 'bear_tp_mult': 1.378305103099595, 'bear_tsl_mult': 0.0024162345288956943, 'bear_time_stop': 120, 'bear_use_sma': True, 'bear_use_ema': False, 'bear_use_atr': True, 'bear_use_adx': False, 'bear_use_spike': False, 'bear_rsi_required': True, 'sideways_strategy': 'breakout', 'sideways_bb_std_mult': 1.0926778941478799, 'sideways_rsi_os': 28, 'sideways_rsi_ob': 81, 'sideways_adx_thresh': 14.23246920093235, 'sideways_atr_min_pct': 0.002869778376383308, 'sideways_atr_max_pct': 0.07999008380214795, 'sideways_tp_mult': 2.1966359252991206, 'sideways_tsl_mult': 0.11118186280250786, 'sideways_time_stop': 87, 'sideways_use_sma': False, 'sideways_use_ema': True, 'sideways_use_atr': True, 'sideways_use_adx': True, 'sideways_use_spike': False, 'sideways_rsi_required': False}.
