[I 2025-09-01 07:29:19,080] Trial 53 finished with values: [-1000000000.0, 1000000000.0] and parameters: {'p_sma': 5, 'p_std': 25, 'p_atr': 20, 'p_adx': 15, 'rsi_period': 31, 'ema1': 17, 'ema2': 47, 'slip_atr_k': 0.10164795039787172, 'slip_spread_k': 0.6438881017994909, 'spread_hl_frac': 0.014542916880193896, 'bb_std_mult': 0.7014013358103005, 'rsi_os': 28, 'rsi_ob': 92, 'vol_spike': 0.2624742049718846, 'adx_thresh': 18.878276167671252, 'atr_min_pct': 0.024954657853012097, 'atr_max_pct': 0.12008415763319022, 'tp_mult': 2.702528738841158, 'tsl_mult': 0.5472111969838789, 'strategy': 'breakout', 'time_stop': 104, 'use_sma': False, 'use_atr': False, 'use_adx': False, 'use_ema': False, 'use_spike': False, 'rsi_required': False, 'edge_k': 1.7161092872999515, 'edge_cap': 0.34994992771993666, 'bull_strategy': 'breakout', 'bull_bb_std_mult': 3.3949494399827542, 'bull_rsi_os': 52, 'bull_rsi_ob': 48, 'bull_adx_thresh': 24.272878743455028, 'bull_atr_min_pct': 0.0019042811409983994, 'bull_atr_max_pct': 0.05173702202907985, 'bull_tp_mult': 1.6018407049383356, 'bull_tsl_mult': 0.23269560699250014, 'bull_time_stop': 34, 'bull_use_sma': False, 'bull_use_ema': True, 'bull_use_atr': False, 'bull_use_adx': False, 'bull_use_spike': True, 'bull_rsi_required': True, 'bear_strategy': 'breakout', 'bear_bb_std_mult': 1.6862945136869414, 'bear_rsi_os': 37, 'bear_rsi_ob': 95, 'bear_adx_thresh': 31.604044500550465, 'bear_atr_min_pct': 0.006340991656653047, 'bear_atr_max_pct': 0.012163427076801056, 'bear_tp_mult': 1.0808012379876897, 'bear_tsl_mult': 0.04133053594717606, 'bear_time_stop': 78, 'bear_use_sma': False, 'bear_use_ema': False, 'bear_use_atr': False, 'bear_use_adx': True, 'bear_use_spike': False, 'bear_rsi_required': False, 'sideways_strategy': 'breakout', 'sideways_bb_std_mult': 2.295871745631107, 'sideways_rsi_os': 44, 'sideways_rsi_ob': 87, 'sideways_adx_thresh': 12.802103581937832, 'sideways_atr_min_pct': 0.024637081807256978, 'sideways_atr_max_pct': 0.10761759126212375, 'sideways_tp_mult': 2.318783783033979, 'sideways_tsl_mult': 0.5858612844146311, 'sideways_time_stop': 22, 'sideways_use_sma': False, 'sideways_use_ema': False, 'sideways_use_atr': True, 'sideways_use_adx': False, 'sideways_use_spike': True, 'sideways_rsi_required': True}.
[I 2025-09-01 07:30:08,408] Trial 55 finished with values: [-0.039134353826138835, 0.039037368508784503] and parameters: {'p_sma': 56, 'p_std': 36, 'p_atr': 15, 'p_adx': 7, 'rsi_period': 33, 'ema1': 6, 'ema2': 12, 'slip_atr_k': 0.000264617762078867, 'slip_spread_k': 0.6992018557733443, 'spread_hl_frac': 0.009159968519280616, 'bb_std_mult': 1.733235649933239, 'rsi_os': 22, 'rsi_ob': 76, 'vol_spike': 0.205848228001802, 'adx_thresh': 19.46643027942254, 'atr_min_pct': 0.029108064409879137, 'atr_max_pct': 0.1442517774285801, 'tp_mult': 1.9472598918433937, 'tsl_mult': 0.4950408714427449, 'strategy': 'breakout', 'time_stop': 110, 'use_sma': False, 'use_atr': False, 'use_adx': False, 'use_ema': False, 'use_spike': False, 'rsi_required': False, 'edge_k': 1.7106502690863987, 'edge_cap': 0.9917452379441634, 'bull_strategy': 'breakout', 'bull_bb_std_mult': 3.4035845563589975, 'bull_rsi_os': 50, 'bull_rsi_ob': 58, 'bull_adx_thresh': 21.43831608261477, 'bull_atr_min_pct': 0.000570820719643564, 'bull_atr_max_pct': 0.05541947328175521, 'bull_tp_mult': 2.1135671270712635, 'bull_tsl_mult': 0.771012900701536, 'bull_time_stop': 144, 'bull_use_sma': False, 'bull_use_ema': True, 'bull_use_atr': False, 'bull_use_adx': False, 'bull_use_spike': True, 'bull_rsi_required': True, 'bear_strategy': 'breakout', 'bear_bb_std_mult': 1.162680049005905, 'bear_rsi_os': 41, 'bear_rsi_ob': 54, 'bear_adx_thresh': 11.785087300442015, 'bear_atr_min_pct': 0.02270274405098239, 'bear_atr_max_pct': 0.07173748832183408, 'bear_tp_mult': 1.0898169412487182, 'bear_tsl_mult': 0.48458337178560595, 'bear_time_stop': 159, 'bear_use_sma': False, 'bear_use_ema': False, 'bear_use_atr': False, 'bear_use_adx': False, 'bear_use_spike': False, 'bear_rsi_required': False, 'sideways_strategy': 'breakout', 'sideways_bb_std_mult': 1.2355932800806366, 'sideways_rsi_os': 43, 'sideways_rsi_ob': 45, 'sideways_adx_thresh': 13.185741939446142, 'sideways_atr_min_pct': 0.01036118362202545, 'sideways_atr_max_pct': 0.0770453958974719, 'sideways_tp_mult': 2.0762466031985847, 'sideways_tsl_mult': 0.6847884347374955, 'sideways_time_stop': 10, 'sideways_use_sma': False, 'sideways_use_ema': False, 'sideways_use_atr': True, 'sideways_use_adx': False, 'sideways_use_spike': True, 'sideways_rsi_required': True}.
[I 2025-09-01 07:30:09,641] Trial 57 finished with values: [-1000000000.0, 1000000000.0] and parameters: {'p_sma': 5, 'p_std': 25, 'p_atr': 20, 'p_adx': 7, 'rsi_period': 57, 'ema1': 19, 'ema2': 28, 'slip_atr_k': 0.0775199073607068, 'slip_spread_k': 0.5743557405464401, 'spread_hl_frac': 0.019924280716100716, 'bb_std_mult': 2.304942171636763, 'rsi_os': 14, 'rsi_ob': 76, 'vol_spike': 0.2613918654014241, 'adx_thresh': 19.588808224321067, 'atr_min_pct': 0.025684678197047783, 'atr_max_pct': 0.12268594421577356, 'tp_mult': 1.9557530121284556, 'tsl_mult': 0.15114126417467666, 'strategy': 'breakout', 'time_stop': 119, 'use_sma': True, 'use_atr': False, 'use_adx': True, 'use_ema': True, 'use_spike': False, 'rsi_required': False, 'edge_k': 1.0640231222421774, 'edge_cap': 0.34580398794011213, 'bull_strategy': 'breakout', 'bull_bb_std_mult': 1.9954545597238276, 'bull_rsi_os': 28, 'bull_rsi_ob': 48, 'bull_adx_thresh': 21.420728443798723, 'bull_atr_min_pct': 0.0016257721858492038, 'bull_atr_max_pct': 0.08039100630740925, 'bull_tp_mult': 1.4134334978076974, 'bull_tsl_mult': 0.09772219290198893, 'bull_time_stop': 210, 'bull_use_sma': False, 'bull_use_ema': True, 'bull_use_atr': False, 'bull_use_adx': False, 'bull_use_spike': True, 'bull_rsi_required': True, 'bear_strategy': 'breakout', 'bear_bb_std_mult': 1.1244652201217264, 'bear_rsi_os': 38, 'bear_rsi_ob': 58, 'bear_adx_thresh': 9.47697390065865, 'bear_atr_min_pct': 0.013768344920415105, 'bear_atr_max_pct': 0.11345472912697256, 'bear_tp_mult': 1.3227645243397836, 'bear_tsl_mult': 0.8063542217463275, 'bear_time_stop': 164, 'bear_use_sma': True, 'bear_use_ema': False, 'bear_use_atr': False, 'bear_use_adx': False, 'bear_use_spike': False, 'bear_rsi_required': False, 'sideways_strategy': 'breakout', 'sideways_bb_std_mult': 1.1970233751648518, 'sideways_rsi_os': 34, 'sideways_rsi_ob': 60, 'sideways_adx_thresh': 13.086603073261198, 'sideways_atr_min_pct': 0.010662440975136647, 'sideways_atr_max_pct': 0.07296669294259475, 'sideways_tp_mult': 2.108902244263383, 'sideways_tsl_mult': 0.5145375315594772, 'sideways_time_stop': 134, 'sideways_use_sma': False, 'sideways_use_ema': True, 'sideways_use_atr': True, 'sideways_use_adx': False, 'sideways_use_spike': False, 'sideways_rsi_required': False}.
[I 2025-09-01 07:30:10,365] Trial 56 finished with values: [-1000000000.0, 1000000000.0] and parameters: {'p_sma': 34, 'p_std': 45, 'p_atr': 15, 'p_adx': 19, 'rsi_period': 32, 'ema1': 7, 'ema2': 28, 'slip_atr_k': 0.020345332241065037, 'slip_spread_k': 0.7307156758015754, 'spread_hl_frac': 0.04308614266251028, 'bb_std_mult': 1.4679026956411647, 'rsi_os': 14, 'rsi_ob': 92, 'vol_spike': 0.26064821743084554, 'adx_thresh': 16.033110849449198, 'atr_min_pct': 0.025717171983675232, 'atr_max_pct': 0.08954296469097267, 'tp_mult': 1.951183644210263, 'tsl_mult': 0.37595928484663566, 'strategy': 'breakout', 'time_stop': 120, 'use_sma': False, 'use_atr': False, 'use_adx': False, 'use_ema': True, 'use_spike': False, 'rsi_required': False, 'edge_k': 0.09836221272770596, 'edge_cap': 0.3356293034934962, 'bull_strategy': 'breakout', 'bull_bb_std_mult': 2.006292892881008, 'bull_rsi_os': 23, 'bull_rsi_ob': 48, 'bull_adx_thresh': 21.42995137446738, 'bull_atr_min_pct': 0.022863307190806117, 'bull_atr_max_pct': 0.08145362487834304, 'bull_tp_mult': 2.09432486567268, 'bull_tsl_mult': 0.0720169993930084, 'bull_time_stop': 75, 'bull_use_sma': False, 'bull_use_ema': True, 'bull_use_atr': False, 'bull_use_adx': False, 'bull_use_spike': True, 'bull_rsi_required': True, 'bear_strategy': 'breakout', 'bear_bb_std_mult': 1.1110546293859374, 'bear_rsi_os': 37, 'bear_rsi_ob': 95, 'bear_adx_thresh': 20.651803759637563, 'bear_atr_min_pct': 0.025663874975157538, 'bear_atr_max_pct': 0.1419773153813229, 'bear_tp_mult': 1.3344653092527379, 'bear_tsl_mult': 0.8112472479419004, 'bear_time_stop': 115, 'bear_use_sma': False, 'bear_use_ema': False, 'bear_use_atr': False, 'bear_use_adx': False, 'bear_use_spike': False, 'bear_rsi_required': False, 'sideways_strategy': 'breakout', 'sideways_bb_std_mult': 1.2463442888881937, 'sideways_rsi_os': 35, 'sideways_rsi_ob': 88, 'sideways_adx_thresh': 12.498951546042946, 'sideways_atr_min_pct': 0.028938376839998944, 'sideways_atr_max_pct': 0.06094750149825978, 'sideways_tp_mult': 2.0520862901467014, 'sideways_tsl_mult': 0.6682497757953753, 'sideways_time_stop': 136, 'sideways_use_sma': False, 'sideways_use_ema': True, 'sideways_use_atr': True, 'sideways_use_adx': False, 'sideways_use_spike': True, 'sideways_rsi_required': True}.
[I 2025-09-01 07:30:10,771] Trial 58 finished with values: [-1000000000.0, 1000000000.0] and parameters: {'p_sma': 35, 'p_std': 42, 'p_atr': 15, 'p_adx': 7, 'rsi_period': 38, 'ema1': 14, 'ema2': 12, 'slip_atr_k': 0.19455789436603954, 'slip_spread_k': 0.5823365746232388, 'spread_hl_frac': 0.01982724080988495, 'bb_std_mult': 1.4845058878132977, 'rsi_os': 13, 'rsi_ob': 85, 'vol_spike': 0.24686610970226078, 'adx_thresh': 22.837563622713894, 'atr_min_pct': 0.003425371368414039, 'atr_max_pct': 0.08931779432208163, 'tp_mult': 1.3377102357863735, 'tsl_mult': 0.15113590783194625, 'strategy': 'breakout', 'time_stop': 120, 'use_sma': True, 'use_atr': False, 'use_adx': True, 'use_ema': True, 'use_spike': False, 'rsi_required': False, 'edge_k': 1.0519621681975635, 'edge_cap': 0.1639321665995233, 'bull_strategy': 'breakout', 'bull_bb_std_mult': 2.0445629217130787, 'bull_rsi_os': 23, 'bull_rsi_ob': 88, 'bull_adx_thresh': 21.20128981995913, 'bull_atr_min_pct': 0.007901826072391857, 'bull_atr_max_pct': 0.08330430122428206, 'bull_tp_mult': 1.4204887737290035, 'bull_tsl_mult': 0.07873350097208395, 'bull_time_stop': 208, 'bull_use_sma': False, 'bull_use_ema': True, 'bull_use_atr': False, 'bull_use_adx': False, 'bull_use_spike': True, 'bull_rsi_required': True, 'bear_strategy': 'breakout', 'bear_bb_std_mult': 1.069887028980629, 'bear_rsi_os': 42, 'bear_rsi_ob': 79, 'bear_adx_thresh': 17.50701008636211, 'bear_atr_min_pct': 0.028910183200244854, 'bear_atr_max_pct': 0.1129523201530144, 'bear_tp_mult': 1.2828685465427705, 'bear_tsl_mult': 0.8063036659649612, 'bear_time_stop': 210, 'bear_use_sma': True, 'bear_use_ema': False, 'bear_use_atr': False, 'bear_use_adx': False, 'bear_use_spike': False, 'bear_rsi_required': False, 'sideways_strategy': 'mean_reversion', 'sideways_bb_std_mult': 2.609643973465209, 'sideways_rsi_os': 55, 'sideways_rsi_ob': 56, 'sideways_adx_thresh': 17.70241739958697, 'sideways_atr_min_pct': 0.010751231093661068, 'sideways_atr_max_pct': 0.14035965462709987, 'sideways_tp_mult': 1.988391048403349, 'sideways_tsl_mult': 0.6761680115488162, 'sideways_time_stop': 140, 'sideways_use_sma': False, 'sideways_use_ema': True, 'sideways_use_atr': True, 'sideways_use_adx': False, 'sideways_use_spike': False, 'sideways_rsi_required': False}.
[I 2025-09-01 07:30:11,228] Trial 62 finished with values: [-1000000000.0, 1000000000.0] and parameters: {'p_sma': 42, 'p_std': 40, 'p_atr': 18, 'p_adx': 23, 'rsi_period': 43, 'ema1': 13, 'ema2': 15, 'slip_atr_k': 0.18759832817670638, 'slip_spread_k': 0.4440460024027231, 'spread_hl_frac': 0.011601570460304092, 'bb_std_mult': 1.1640876733297156, 'rsi_os': 16, 'rsi_ob': 49, 'vol_spike': 0.18099864879730987, 'adx_thresh': 22.165301515987743, 'atr_min_pct': 0.026703038908904166, 'atr_max_pct': 0.10369474854120142, 'tp_mult': 2.7961256818489213, 'tsl_mult': 0.04838242809505147, 'strategy': 'mean_reversion', 'time_stop': 185, 'use_sma': False, 'use_atr': True, 'use_adx': False, 'use_ema': False, 'use_spike': True, 'rsi_required': True, 'edge_k': 1.2795766145296166, 'edge_cap': 0.24819986432830196, 'bull_strategy': 'mean_reversion', 'bull_bb_std_mult': 2.941322526955572, 'bull_rsi_os': 19, 'bull_rsi_ob': 63, 'bull_adx_thresh': 31.50959726721598, 'bull_atr_min_pct': 0.004906819185909007, 'bull_atr_max_pct': 0.03682101236305866, 'bull_tp_mult': 2.7782460156625572, 'bull_tsl_mult': 0.05104689687326011, 'bull_time_stop': 183, 'bull_use_sma': True, 'bull_use_ema': False, 'bull_use_atr': True, 'bull_use_adx': True, 'bull_use_spike': True, 'bull_rsi_required': False, 'bear_strategy': 'mean_reversion', 'bear_bb_std_mult': 3.061504359612533, 'bear_rsi_os': 32, 'bear_rsi_ob': 63, 'bear_adx_thresh': 10.952657648413256, 'bear_atr_min_pct': 0.02369081908650667, 'bear_atr_max_pct': 0.06577459295809575, 'bear_tp_mult': 1.441691405372088, 'bear_tsl_mult': 0.5223382423893286, 'bear_time_stop': 52, 'bear_use_sma': False, 'bear_use_ema': True, 'bear_use_atr': False, 'bear_use_adx': False, 'bear_use_spike': True, 'bear_rsi_required': False, 'sideways_strategy': 'mean_reversion', 'sideways_bb_std_mult': 1.9213351631091027, 'sideways_rsi_os': 31, 'sideways_rsi_ob': 53, 'sideways_adx_thresh': 9.924996345786878, 'sideways_atr_min_pct': 0.003964302916957197, 'sideways_atr_max_pct': 0.047115261854117234, 'sideways_tp_mult': 2.595616936689356, 'sideways_tsl_mult': 0.43028946262019546, 'sideways_time_stop': 94, 'sideways_use_sma': True, 'sideways_use_ema': False, 'sideways_use_atr': False, 'sideways_use_adx': True, 'sideways_use_spike': True, 'sideways_rsi_required': True}.
[I 2025-09-01 07:30:11,321] Trial 61 finished with values: [-1000000000.0, 1000000000.0] and parameters: {'p_sma': 42, 'p_std': 39, 'p_atr': 18, 'p_adx': 16, 'rsi_period': 27, 'ema1': 12, 'ema2': 20, 'slip_atr_k': 0.05580625289757042, 'slip_spread_k': 0.3068659703004377, 'spread_hl_frac': 0.013013429239656097, 'bb_std_mult': 2.057959006360007, 'rsi_os': 8, 'rsi_ob': 50, 'vol_spike': 0.17840874595616657, 'adx_thresh': 6.950530075923755, 'atr_min_pct': 0.013713677107639386, 'atr_max_pct': 0.1079764497689719, 'tp_mult': 2.780328516765821, 'tsl_mult': 0.46634651853214615, 'strategy': 'mean_reversion', 'time_stop': 196, 'use_sma': False, 'use_atr': True, 'use_adx': False, 'use_ema': False, 'use_spike': True, 'rsi_required': True, 'edge_k': 0.828032468224853, 'edge_cap': 0.25760143720642453, 'bull_strategy': 'mean_reversion', 'bull_bb_std_mult': 1.4963962277492242, 'bull_rsi_os': 44, 'bull_rsi_ob': 63, 'bull_adx_thresh': 16.885581984317827, 'bull_atr_min_pct': 0.004758142465262162, 'bull_atr_max_pct': 0.06769325424244893, 'bull_tp_mult': 1.1674439787065096, 'bull_tsl_mult': 0.33175141338881314, 'bull_time_stop': 183, 'bull_use_sma': True, 'bull_use_ema': False, 'bull_use_atr': True, 'bull_use_adx': True, 'bull_use_spike': True, 'bull_rsi_required': False, 'bear_strategy': 'mean_reversion', 'bear_bb_std_mult': 2.769252106539652, 'bear_rsi_os': 32, 'bear_rsi_ob': 64, 'bear_adx_thresh': 11.66453500649719, 'bear_atr_min_pct': 0.02384092126311887, 'bear_atr_max_pct': 0.020949937755138093, 'bear_tp_mult': 1.4381515223131598, 'bear_tsl_mult': 0.533124949065409, 'bear_time_stop': 190, 'bear_use_sma': False, 'bear_use_ema': True, 'bear_use_atr': False, 'bear_use_adx': False, 'bear_use_spike': True, 'bear_rsi_required': False, 'sideways_strategy': 'mean_reversion', 'sideways_bb_std_mult': 3.4192996983570767, 'sideways_rsi_os': 39, 'sideways_rsi_ob': 53, 'sideways_adx_thresh': 32.85361819457512, 'sideways_atr_min_pct': 0.012931099751429866, 'sideways_atr_max_pct': 0.12257627457813572, 'sideways_tp_mult': 2.642589982297508, 'sideways_tsl_mult': 0.6085015867242145, 'sideways_time_stop': 92, 'sideways_use_sma': True, 'sideways_use_ema': False, 'sideways_use_atr': False, 'sideways_use_adx': True, 'sideways_use_spike': True, 'sideways_rsi_required': True}.
[I 2025-09-01 07:30:57,873] Trial 59 finished with values: [-1000000000.0, 1000000000.0] and parameters: {'p_sma': 35, 'p_std': 44, 'p_atr': 18, 'p_adx': 19, 'rsi_period': 57, 'ema1': 14, 'ema2': 27, 'slip_atr_k': 0.07871270502068925, 'slip_spread_k': 0.2925034557348484, 'spread_hl_frac': 0.0201280732871428, 'bb_std_mult': 2.0749455388032825, 'rsi_os': 14, 'rsi_ob': 76, 'vol_spike': 0.17841723491888373, 'adx_thresh': 16.627003370365173, 'atr_min_pct': 0.0028788602080683633, 'atr_max_pct': 0.08964210979162948, 'tp_mult': 1.3575817991272816, 'tsl_mult': 0.23112349799975648, 'strategy': 'breakout', 'time_stop': 189, 'use_sma': True, 'use_atr': False, 'use_adx': True, 'use_ema': True, 'use_spike': False, 'rsi_required': False, 'edge_k': 0.8506008703199512, 'edge_cap': 0.1711597701949425, 'bull_strategy': 'breakout', 'bull_bb_std_mult': 2.0284417826138648, 'bull_rsi_os': 28, 'bull_rsi_ob': 89, 'bull_adx_thresh': 31.49159245136675, 'bull_atr_min_pct': 0.010056900968247039, 'bull_atr_max_pct': 0.03655988981730147, 'bull_tp_mult': 1.4347890584378253, 'bull_tsl_mult': 0.07262031120187777, 'bull_time_stop': 215, 'bull_use_sma': False, 'bull_use_ema': True, 'bull_use_atr': False, 'bull_use_adx': False, 'bull_use_spike': True, 'bull_rsi_required': True, 'bear_strategy': 'breakout', 'bear_bb_std_mult': 3.438048616997382, 'bear_rsi_os': 32, 'bear_rsi_ob': 69, 'bear_adx_thresh': 17.406419050504987, 'bear_atr_min_pct': 0.028630593116700298, 'bear_atr_max_pct': 0.11361976037824192, 'bear_tp_mult': 1.374526704554081, 'bear_tsl_mult': 0.26922190532356916, 'bear_time_stop': 191, 'bear_use_sma': True, 'bear_use_ema': False, 'bear_use_atr': False, 'bear_use_adx': False, 'bear_use_spike': False, 'bear_rsi_required': False, 'sideways_strategy': 'mean_reversion', 'sideways_bb_std_mult': 2.591031482914393, 'sideways_rsi_os': 34, 'sideways_rsi_ob': 53, 'sideways_adx_thresh': 33.02664716598684, 'sideways_atr_min_pct': 0.013684512289584517, 'sideways_atr_max_pct': 0.12327688506413838, 'sideways_tp_mult': 2.6413415235252407, 'sideways_tsl_mult': 0.6634114722256458, 'sideways_time_stop': 136, 'sideways_use_sma': False, 'sideways_use_ema': True, 'sideways_use_atr': True, 'sideways_use_adx': False, 'sideways_use_spike': False, 'sideways_rsi_required': False}.
[I 2025-09-01 07:30:58,910] Trial 64 finished with values: [-1000000000.0, 1000000000.0] and parameters: {'p_sma': 37, 'p_std': 37, 'p_atr': 13, 'p_adx': 28, 'rsi_period': 14, 'ema1': 20, 'ema2': 32, 'slip_atr_k': 0.08880718994463473, 'slip_spread_k': 0.5205233060423051, 'spread_hl_frac': 0.0038473477972993577, 'bb_std_mult': 1.2058474232994443, 'rsi_os': 8, 'rsi_ob': 86, 'vol_spike': 0.10943524419342471, 'adx_thresh': 34.807855723235804, 'atr_min_pct': 0.028765079504125345, 'atr_max_pct': 0.12902670654873774, 'tp_mult': 1.7451580894240513, 'tsl_mult': 0.34072440419175953, 'strategy': 'breakout', 'time_stop': 278, 'use_sma': False, 'use_atr': False, 'use_adx': False, 'use_ema': False, 'use_spike': False, 'rsi_required': False, 'edge_k': 0.6886672217044314, 'edge_cap': 0.42880509126988675, 'bull_strategy': 'breakout', 'bull_bb_std_mult': 2.6655422659046875, 'bull_rsi_os': 55, 'bull_rsi_ob': 80, 'bull_adx_thresh': 5.497886016724761, 'bull_atr_min_pct': 0.010391906898948445, 'bull_atr_max_pct': 0.06088057270202299, 'bull_tp_mult': 2.9683142287619133, 'bull_tsl_mult': 0.983453546951641, 'bull_time_stop': 28, 'bull_use_sma': False, 'bull_use_ema': True, 'bull_use_atr': False, 'bull_use_adx': False, 'bull_use_spike': True, 'bull_rsi_required': True, 'bear_strategy': 'breakout', 'bear_bb_std_mult': 3.464024479135528, 'bear_rsi_os': 10, 'bear_rsi_ob': 91, 'bear_adx_thresh': 5.22739869757196, 'bear_atr_min_pct': 0.0260216808432417, 'bear_atr_max_pct': 0.07573579917187746, 'bear_tp_mult': 2.1758069054770535, 'bear_tsl_mult': 0.24245550834407753, 'bear_time_stop': 157, 'bear_use_sma': False, 'bear_use_ema': False, 'bear_use_atr': False, 'bear_use_adx': False, 'bear_use_spike': False, 'bear_rsi_required': True, 'sideways_strategy': 'mean_reversion', 'sideways_bb_std_mult': 1.7007600891726455, 'sideways_rsi_os': 23, 'sideways_rsi_ob': 50, 'sideways_adx_thresh': 30.308933722947017, 'sideways_atr_min_pct': 0.017043439489944807, 'sideways_atr_max_pct': 0.10274223867899851, 'sideways_tp_mult': 1.3739532280162279, 'sideways_tsl_mult': 0.9569441176623241, 'sideways_time_stop': 200, 'sideways_use_sma': False, 'sideways_use_ema': False, 'sideways_use_atr': True, 'sideways_use_adx': False, 'sideways_use_spike': True, 'sideways_rsi_required': True}.
