[I 2025-09-01 07:23:50,502] Trial 18 finished with values: [-1000000000.0, 1000000000.0] and parameters: {'p_sma': 43, 'p_std': 38, 'p_atr': 30, 'p_adx': 24, 'rsi_period': 18, 'ema1': 6, 'ema2': 10, 'slip_atr_k': 0.009001453447809352, 'slip_spread_k': 0.695384566217122, 'spread_hl_frac': 0.001283626664307309, 'bb_std_mult': 1.4418387871744485, 'rsi_os': 13, 'rsi_ob': 94, 'vol_spike': 0.09183269563102528, 'adx_thresh': 6.202310686041264, 'atr_min_pct': 0.027787531824533338, 'atr_max_pct': 0.08354104227121109, 'tp_mult': 1.572189641788527, 'tsl_mult': 0.005943580754348865, 'strategy': 'mean_reversion', 'time_stop': 192, 'use_sma': False, 'use_atr': True, 'use_adx': True, 'use_ema': True, 'use_spike': True, 'rsi_required': True, 'edge_k': 0.005030662687691478, 'edge_cap': 0.38360757461147255, 'bull_strategy': 'mean_reversion', 'bull_bb_std_mult': 3.5828646025709894, 'bull_rsi_os': 55, 'bull_rsi_ob': 95, 'bull_adx_thresh': 24.203695559649542, 'bull_atr_min_pct': 0.016214717262105594, 'bull_atr_max_pct': 0.0118366515825951, 'bull_tp_mult': 1.7426887164795763, 'bull_tsl_mult': 0.37048569090715466, 'bull_time_stop': 7, 'bull_use_sma': False, 'bull_use_ema': False, 'bull_use_atr': True, 'bull_use_adx': True, 'bull_use_spike': True, 'bull_rsi_required': True, 'bear_strategy': 'breakout', 'bear_bb_std_mult': 3.4999268946207636, 'bear_rsi_os': 8, 'bear_rsi_ob': 93, 'bear_adx_thresh': 5.005901882479787, 'bear_atr_min_pct': 0.021476248845819175, 'bear_atr_max_pct': 0.1474026267125987, 'bear_tp_mult': 1.108763409897826, 'bear_tsl_mult': 0.2647305478067409, 'bear_time_stop': 59, 'bear_use_sma': False, 'bear_use_ema': False, 'bear_use_atr': False, 'bear_use_adx': False, 'bear_use_spike': True, 'bear_rsi_required': True, 'sideways_strategy': 'breakout', 'sideways_bb_std_mult': 2.4077620123398527, 'sideways_rsi_os': 6, 'sideways_rsi_ob': 57, 'sideways_adx_thresh': 34.26985166800473, 'sideways_atr_min_pct': 0.009231821586676842, 'sideways_atr_max_pct': 0.07038816574437146, 'sideways_tp_mult': 2.5031922842349106, 'sideways_tsl_mult': 0.6613273289104152, 'sideways_time_stop': 18, 'sideways_use_sma': True, 'sideways_use_ema': True, 'sideways_use_atr': False, 'sideways_use_adx': False, 'sideways_use_spike': True, 'sideways_rsi_required': False}.
[I 2025-09-01 07:23:54,774] Trial 20 finished with values: [-1000000000.0, 1000000000.0] and parameters: {'p_sma': 46, 'p_std': 44, 'p_atr': 21, 'p_adx': 28, 'rsi_period': 17, 'ema1': 14, 'ema2': 58, 'slip_atr_k': 0.04442789194761261, 'slip_spread_k': 0.6088279017202572, 'spread_hl_frac': 0.04655755864505098, 'bb_std_mult': 2.484383829449094, 'rsi_os': 36, 'rsi_ob': 88, 'vol_spike': 0.2489957774543692, 'adx_thresh': 17.796494727042592, 'atr_min_pct': 0.02638705589655824, 'atr_max_pct': 0.0796491340034306, 'tp_mult': 1.4518021575246944, 'tsl_mult': 0.1802786895398839, 'strategy': 'mean_reversion', 'time_stop': 294, 'use_sma': False, 'use_atr': True, 'use_adx': True, 'use_ema': True, 'use_spike': True, 'rsi_required': True, 'edge_k': 0.7819235322651975, 'edge_cap': 0.1574308454546891, 'bull_strategy': 'mean_reversion', 'bull_bb_std_mult': 3.021527401151153, 'bull_rsi_os': 43, 'bull_rsi_ob': 92, 'bull_adx_thresh': 34.04083551169347, 'bull_atr_min_pct': 0.015196610342741345, 'bull_atr_max_pct': 0.07870671102971838, 'bull_tp_mult': 1.6505562072293825, 'bull_tsl_mult': 0.682611894134014, 'bull_time_stop': 8, 'bull_use_sma': False, 'bull_use_ema': False, 'bull_use_atr': True, 'bull_use_adx': True, 'bull_use_spike': True, 'bull_rsi_required': True, 'bear_strategy': 'breakout', 'bear_bb_std_mult': 2.852591335387797, 'bear_rsi_os': 47, 'bear_rsi_ob': 81, 'bear_adx_thresh': 9.911541804639915, 'bear_atr_min_pct': 0.024738703643630757, 'bear_atr_max_pct': 0.07808122189982236, 'bear_tp_mult': 1.3805625619646535, 'bear_tsl_mult': 0.3079938401386419, 'bear_time_stop': 179, 'bear_use_sma': False, 'bear_use_ema': False, 'bear_use_atr': False, 'bear_use_adx': False, 'bear_use_spike': True, 'bear_rsi_required': True, 'sideways_strategy': 'breakout', 'sideways_bb_std_mult': 2.4920566000019906, 'sideways_rsi_os': 13, 'sideways_rsi_ob': 55, 'sideways_adx_thresh': 33.76504752400976, 'sideways_atr_min_pct': 0.005603319303572369, 'sideways_atr_max_pct': 0.057282430995461764, 'sideways_tp_mult': 2.606748423882019, 'sideways_tsl_mult': 0.6271228765724237, 'sideways_time_stop': 90, 'sideways_use_sma': True, 'sideways_use_ema': True, 'sideways_use_atr': False, 'sideways_use_adx': False, 'sideways_use_spike': True, 'sideways_rsi_required': False}.
[I 2025-09-01 07:23:55,058] Trial 19 finished with values: [-1000000000.0, 1000000000.0] and parameters: {'p_sma': 44, 'p_std': 42, 'p_atr': 21, 'p_adx': 30, 'rsi_period': 9, 'ema1': 15, 'ema2': 60, 'slip_atr_k': 0.04574182200604908, 'slip_spread_k': 0.6134539182390192, 'spread_hl_frac': 0.04723529892662309, 'bb_std_mult': 2.4155543163795477, 'rsi_os': 34, 'rsi_ob': 89, 'vol_spike': 0.25277587699531695, 'adx_thresh': 17.19165083281142, 'atr_min_pct': 0.026723873248262562, 'atr_max_pct': 0.08305936124772946, 'tp_mult': 1.4304089441347532, 'tsl_mult': 0.19310288990979352, 'strategy': 'mean_reversion', 'time_stop': 177, 'use_sma': False, 'use_atr': True, 'use_adx': True, 'use_ema': True, 'use_spike': True, 'rsi_required': True, 'edge_k': 0.7353321088459919, 'edge_cap': 0.2055455890398154, 'bull_strategy': 'mean_reversion', 'bull_bb_std_mult': 3.0641241856501047, 'bull_rsi_os': 46, 'bull_rsi_ob': 92, 'bull_adx_thresh': 33.971263180553976, 'bull_atr_min_pct': 0.01589354415171569, 'bull_atr_max_pct': 0.07637246206186667, 'bull_tp_mult': 1.540836665096907, 'bull_tsl_mult': 0.708083679582775, 'bull_time_stop': 6, 'bull_use_sma': False, 'bull_use_ema': False, 'bull_use_atr': True, 'bull_use_adx': True, 'bull_use_spike': True, 'bull_rsi_required': True, 'bear_strategy': 'breakout', 'bear_bb_std_mult': 2.8778142466591152, 'bear_rsi_os': 47, 'bear_rsi_ob': 81, 'bear_adx_thresh': 10.687388667715387, 'bear_atr_min_pct': 0.024879023907821145, 'bear_atr_max_pct': 0.08400950034085855, 'bear_tp_mult': 1.4645458588187674, 'bear_tsl_mult': 0.22010821241633932, 'bear_time_stop': 170, 'bear_use_sma': False, 'bear_use_ema': False, 'bear_use_atr': False, 'bear_use_adx': False, 'bear_use_spike': True, 'bear_rsi_required': True, 'sideways_strategy': 'breakout', 'sideways_bb_std_mult': 2.3941688123211744, 'sideways_rsi_os': 13, 'sideways_rsi_ob': 95, 'sideways_adx_thresh': 34.90204341060398, 'sideways_atr_min_pct': 0.005029650725321539, 'sideways_atr_max_pct': 0.05181087337543323, 'sideways_tp_mult': 2.449356943983814, 'sideways_tsl_mult': 0.6312587065076426, 'sideways_time_stop': 82, 'sideways_use_sma': True, 'sideways_use_ema': True, 'sideways_use_atr': False, 'sideways_use_adx': False, 'sideways_use_spike': True, 'sideways_rsi_required': False}.
[I 2025-09-01 07:23:55,302] Trial 21 finished with values: [-1000000000.0, 1000000000.0] and parameters: {'p_sma': 44, 'p_std': 44, 'p_atr': 19, 'p_adx': 29, 'rsi_period': 7, 'ema1': 12, 'ema2': 60, 'slip_atr_k': 0.04507350287689792, 'slip_spread_k': 0.5794328774324096, 'spread_hl_frac': 0.04168463525011122, 'bb_std_mult': 2.5340815485168635, 'rsi_os': 35, 'rsi_ob': 88, 'vol_spike': 0.24866658153411042, 'adx_thresh': 11.583831701352281, 'atr_min_pct': 0.026199607862268832, 'atr_max_pct': 0.08544648101694644, 'tp_mult': 1.3355558985799565, 'tsl_mult': 0.19875272124018672, 'strategy': 'mean_reversion', 'time_stop': 176, 'use_sma': True, 'use_atr': True, 'use_adx': True, 'use_ema': True, 'use_spike': True, 'rsi_required': True, 'edge_k': 0.3266587652569427, 'edge_cap': 0.14590306341195583, 'bull_strategy': 'mean_reversion', 'bull_bb_std_mult': 3.0243604865836176, 'bull_rsi_os': 46, 'bull_rsi_ob': 94, 'bull_adx_thresh': 29.24975895009385, 'bull_atr_min_pct': 0.01535533010532107, 'bull_atr_max_pct': 0.012156543922932458, 'bull_tp_mult': 1.5185383967151778, 'bull_tsl_mult': 0.6841023195618544, 'bull_time_stop': 9, 'bull_use_sma': False, 'bull_use_ema': False, 'bull_use_atr': True, 'bull_use_adx': True, 'bull_use_spike': True, 'bull_rsi_required': True, 'bear_strategy': 'breakout', 'bear_bb_std_mult': 2.9358054894005585, 'bear_rsi_os': 47, 'bear_rsi_ob': 83, 'bear_adx_thresh': 10.094917758944725, 'bear_atr_min_pct': 0.025247405509360964, 'bear_atr_max_pct': 0.08085798660780244, 'bear_tp_mult': 1.3439413559943751, 'bear_tsl_mult': 0.22583791691274174, 'bear_time_stop': 183, 'bear_use_sma': True, 'bear_use_ema': False, 'bear_use_atr': False, 'bear_use_adx': False, 'bear_use_spike': True, 'bear_rsi_required': True, 'sideways_strategy': 'breakout', 'sideways_bb_std_mult': 1.4343160913944977, 'sideways_rsi_os': 13, 'sideways_rsi_ob': 93, 'sideways_adx_thresh': 33.66255069453748, 'sideways_atr_min_pct': 0.02968391715923656, 'sideways_atr_max_pct': 0.05228149149981115, 'sideways_tp_mult': 2.421535679068512, 'sideways_tsl_mult': 0.6333894064814435, 'sideways_time_stop': 75, 'sideways_use_sma': True, 'sideways_use_ema': True, 'sideways_use_atr': False, 'sideways_use_adx': False, 'sideways_use_spike': True, 'sideways_rsi_required': False}.
[I 2025-09-01 07:23:55,520] Trial 23 finished with values: [-1000000000.0, 1000000000.0] and parameters: {'p_sma': 27, 'p_std': 25, 'p_atr': 18, 'p_adx': 22, 'rsi_period': 29, 'ema1': 11, 'ema2': 21, 'slip_atr_k': 0.16970877366545184, 'slip_spread_k': 0.8941986596192376, 'spread_hl_frac': 0.006651804842714016, 'bb_std_mult': 1.0458648412792286, 'rsi_os': 16, 'rsi_ob': 78, 'vol_spike': 0.17372711328348933, 'adx_thresh': 13.059851838069715, 'atr_min_pct': 0.021253030537042472, 'atr_max_pct': 0.010881789799513542, 'tp_mult': 1.187650313089215, 'tsl_mult': 0.10796385855366826, 'strategy': 'mean_reversion', 'time_stop': 258, 'use_sma': True, 'use_atr': True, 'use_adx': False, 'use_ema': False, 'use_spike': True, 'rsi_required': True, 'edge_k': 0.2778430760582494, 'edge_cap': 0.4847830642895691, 'bull_strategy': 'mean_reversion', 'bull_bb_std_mult': 3.2056531273750477, 'bull_rsi_os': 48, 'bull_rsi_ob': 69, 'bull_adx_thresh': 10.212927046616542, 'bull_atr_min_pct': 0.028768605448299973, 'bull_atr_max_pct': 0.048054737928562324, 'bull_tp_mult': 2.3123288822002035, 'bull_tsl_mult': 0.571466130730635, 'bull_time_stop': 99, 'bull_use_sma': False, 'bull_use_ema': False, 'bull_use_atr': True, 'bull_use_adx': True, 'bull_use_spike': True, 'bull_rsi_required': True, 'bear_strategy': 'breakout', 'bear_bb_std_mult': 1.7745784377531117, 'bear_rsi_os': 49, 'bear_rsi_ob': 45, 'bear_adx_thresh': 15.944525490129186, 'bear_atr_min_pct': 0.01771601334130787, 'bear_atr_max_pct': 0.12473665564129474, 'bear_tp_mult': 1.2637858036651552, 'bear_tsl_mult': 0.5742284904015966, 'bear_time_stop': 5, 'bear_use_sma': True, 'bear_use_ema': False, 'bear_use_atr': False, 'bear_use_adx': False, 'bear_use_spike': True, 'bear_rsi_required': True, 'sideways_strategy': 'mean_reversion', 'sideways_bb_std_mult': 1.4880307399435924, 'sideways_rsi_os': 22, 'sideways_rsi_ob': 51, 'sideways_adx_thresh': 22.774337446883308, 'sideways_atr_min_pct': 0.012119259040147927, 'sideways_atr_max_pct': 0.0966187320936123, 'sideways_tp_mult': 1.8355076747199355, 'sideways_tsl_mult': 0.7966490826365704, 'sideways_time_stop': 119, 'sideways_use_sma': True, 'sideways_use_ema': False, 'sideways_use_atr': False, 'sideways_use_adx': False, 'sideways_use_spike': True, 'sideways_rsi_required': True}.
[I 2025-09-01 07:24:30,264] Trial 22 finished with values: [-1000000000.0, 1000000000.0] and parameters: {'p_sma': 27, 'p_std': 19, 'p_atr': 22, 'p_adx': 30, 'rsi_period': 9, 'ema1': 12, 'ema2': 31, 'slip_atr_k': 0.047424451656518526, 'slip_spread_k': 0.9208174228944044, 'spread_hl_frac': 0.04733776665087865, 'bb_std_mult': 2.223650991387469, 'rsi_os': 39, 'rsi_ob': 87, 'vol_spike': 0.26196100303641257, 'adx_thresh': 11.279143925338321, 'atr_min_pct': 0.02543860113121855, 'atr_max_pct': 0.04527003070914437, 'tp_mult': 1.2786730603227934, 'tsl_mult': 0.19832695363046604, 'strategy': 'mean_reversion', 'time_stop': 292, 'use_sma': True, 'use_atr': True, 'use_adx': True, 'use_ema': True, 'use_spike': True, 'rsi_required': True, 'edge_k': 0.7741524372101165, 'edge_cap': 0.19536501926295358, 'bull_strategy': 'mean_reversion', 'bull_bb_std_mult': 3.0895480478348962, 'bull_rsi_os': 45, 'bull_rsi_ob': 84, 'bull_adx_thresh': 32.30732880953027, 'bull_atr_min_pct': 0.029350663379735846, 'bull_atr_max_pct': 0.04369932360690866, 'bull_tp_mult': 1.5102327928615522, 'bull_tsl_mult': 0.7255363893244989, 'bull_time_stop': 203, 'bull_use_sma': False, 'bull_use_ema': False, 'bull_use_atr': True, 'bull_use_adx': True, 'bull_use_spike': True, 'bull_rsi_required': True, 'bear_strategy': 'breakout', 'bear_bb_std_mult': 2.923440899274964, 'bear_rsi_os': 47, 'bear_rsi_ob': 45, 'bear_adx_thresh': 11.609369787844372, 'bear_atr_min_pct': 0.02538315760354248, 'bear_atr_max_pct': 0.08042132839473987, 'bear_tp_mult': 1.3913124905390624, 'bear_tsl_mult': 0.5750920246437866, 'bear_time_stop': 174, 'bear_use_sma': True, 'bear_use_ema': False, 'bear_use_atr': False, 'bear_use_adx': False, 'bear_use_spike': True, 'bear_rsi_required': True, 'sideways_strategy': 'breakout', 'sideways_bb_std_mult': 1.4503673407643292, 'sideways_rsi_os': 14, 'sideways_rsi_ob': 92, 'sideways_adx_thresh': 23.469429179432176, 'sideways_atr_min_pct': 0.004841985637594866, 'sideways_atr_max_pct': 0.05442166850228265, 'sideways_tp_mult': 1.9034983333097357, 'sideways_tsl_mult': 0.5399178551829099, 'sideways_time_stop': 83, 'sideways_use_sma': True, 'sideways_use_ema': True, 'sideways_use_atr': False, 'sideways_use_adx': False, 'sideways_use_spike': True, 'sideways_rsi_required': False}.
[I 2025-09-01 07:24:33,968] Trial 25 finished with values: [-1000000000.0, 1000000000.0] and parameters: {'p_sma': 27, 'p_std': 23, 'p_atr': 12, 'p_adx': 22, 'rsi_period': 29, 'ema1': 9, 'ema2': 20, 'slip_atr_k': 0.19575542361867238, 'slip_spread_k': 0.8500606317798414, 'spread_hl_frac': 0.00655736834655091, 'bb_std_mult': 1.1119087878113538, 'rsi_os': 16, 'rsi_ob': 79, 'vol_spike': 0.16275448352222122, 'adx_thresh': 14.385849379786208, 'atr_min_pct': 0.021699028924853647, 'atr_max_pct': 0.04277414463373903, 'tp_mult': 1.210513901582538, 'tsl_mult': 0.10693414797385002, 'strategy': 'mean_reversion', 'time_stop': 244, 'use_sma': False, 'use_atr': True, 'use_adx': False, 'use_ema': False, 'use_spike': True, 'rsi_required': True, 'edge_k': 1.371008156561736, 'edge_cap': 0.48603354198246324, 'bull_strategy': 'mean_reversion', 'bull_bb_std_mult': 3.2860410895611833, 'bull_rsi_os': 49, 'bull_rsi_ob': 69, 'bull_adx_thresh': 9.95977677055895, 'bull_atr_min_pct': 0.02862737666630194, 'bull_atr_max_pct': 0.04235884747744297, 'bull_tp_mult': 2.9656870243704008, 'bull_tsl_mult': 0.8277455583569375, 'bull_time_stop': 101, 'bull_use_sma': False, 'bull_use_ema': False, 'bull_use_atr': True, 'bull_use_adx': True, 'bull_use_spike': True, 'bull_rsi_required': True, 'bear_strategy': 'breakout', 'bear_bb_std_mult': 1.842461419966791, 'bear_rsi_os': 50, 'bear_rsi_ob': 46, 'bear_adx_thresh': 15.875321831380525, 'bear_atr_min_pct': 0.017495252469794526, 'bear_atr_max_pct': 0.12483043132748645, 'bear_tp_mult': 1.2671886264081729, 'bear_tsl_mult': 0.57961549561716, 'bear_time_stop': 34, 'bear_use_sma': False, 'bear_use_ema': False, 'bear_use_atr': False, 'bear_use_adx': False, 'bear_use_spike': True, 'bear_rsi_required': True, 'sideways_strategy': 'mean_reversion', 'sideways_bb_std_mult': 1.5316886112286516, 'sideways_rsi_os': 24, 'sideways_rsi_ob': 51, 'sideways_adx_thresh': 23.033545454764244, 'sideways_atr_min_pct': 0.0122486399686876, 'sideways_atr_max_pct': 0.09497534652589554, 'sideways_tp_mult': 1.8166671099491452, 'sideways_tsl_mult': 0.8651830985184013, 'sideways_time_stop': 123, 'sideways_use_sma': True, 'sideways_use_ema': False, 'sideways_use_atr': False, 'sideways_use_adx': False, 'sideways_use_spike': True, 'sideways_rsi_required': True}.
[I 2025-09-01 07:24:34,301] Trial 24 finished with values: [-1000000000.0, 1000000000.0] and parameters: {'p_sma': 27, 'p_std': 21, 'p_atr': 12, 'p_adx': 22, 'rsi_period': 28, 'ema1': 9, 'ema2': 22, 'slip_atr_k': 0.17758452296448296, 'slip_spread_k': 0.896418947381598, 'spread_hl_frac': 0.0067147491595627995, 'bb_std_mult': 1.1597375139520794, 'rsi_os': 41, 'rsi_ob': 79, 'vol_spike': 0.16199219369234164, 'adx_thresh': 14.56430756674264, 'atr_min_pct': 0.02149789941747485, 'atr_max_pct': 0.03810445515632356, 'tp_mult': 1.1983719357323472, 'tsl_mult': 0.11206804057762176, 'strategy': 'mean_reversion', 'time_stop': 254, 'use_sma': False, 'use_atr': True, 'use_adx': False, 'use_ema': False, 'use_spike': True, 'rsi_required': True, 'edge_k': 0.26952929390383906, 'edge_cap': 0.4843351463304543, 'bull_strategy': 'mean_reversion', 'bull_bb_std_mult': 3.260732124296497, 'bull_rsi_os': 21, 'bull_rsi_ob': 69, 'bull_adx_thresh': 8.751633327309937, 'bull_atr_min_pct': 0.029349598652787575, 'bull_atr_max_pct': 0.04394500232325799, 'bull_tp_mult': 2.261777558340851, 'bull_tsl_mult': 0.8228099009920118, 'bull_time_stop': 94, 'bull_use_sma': False, 'bull_use_ema': False, 'bull_use_atr': True, 'bull_use_adx': True, 'bull_use_spike': True, 'bull_rsi_required': True, 'bear_strategy': 'breakout', 'bear_bb_std_mult': 1.8580408975682519, 'bear_rsi_os': 51, 'bear_rsi_ob': 88, 'bear_adx_thresh': 16.53817236590132, 'bear_atr_min_pct': 0.018421142581744165, 'bear_atr_max_pct': 0.12342063236763658, 'bear_tp_mult': 1.2564171318981538, 'bear_tsl_mult': 0.5785505274549753, 'bear_time_stop': 39, 'bear_use_sma': False, 'bear_use_ema': False, 'bear_use_atr': False, 'bear_use_adx': False, 'bear_use_spike': True, 'bear_rsi_required': True, 'sideways_strategy': 'mean_reversion', 'sideways_bb_std_mult': 1.5538228205507365, 'sideways_rsi_os': 22, 'sideways_rsi_ob': 51, 'sideways_adx_thresh': 23.073325435060365, 'sideways_atr_min_pct': 0.010971746377911406, 'sideways_atr_max_pct': 0.09295814505851778, 'sideways_tp_mult': 1.7895520079989198, 'sideways_tsl_mult': 0.8372007155856711, 'sideways_time_stop': 123, 'sideways_use_sma': True, 'sideways_use_ema': False, 'sideways_use_atr': False, 'sideways_use_adx': False, 'sideways_use_spike': True, 'sideways_rsi_required': True}.
[I 2025-09-01 07:24:34,610] Trial 26 finished with values: [-1000000000.0, 1000000000.0] and parameters: {'p_sma': 29, 'p_std': 53, 'p_atr': 12, 'p_adx': 25, 'rsi_period': 54, 'ema1': 9, 'ema2': 29, 'slip_atr_k': 0.10893767473218012, 'slip_spread_k': 0.8238595622308725, 'spread_hl_frac': 0.014097388594258981, 'bb_std_mult': 1.9261718058278088, 'rsi_os': 43, 'rsi_ob': 81, 'vol_spike': 0.16248587431457254, 'adx_thresh': 20.750628322623143, 'atr_min_pct': 0.0002961463689702074, 'atr_max_pct': 0.0411078953673405, 'tp_mult': 1.7187054059479343, 'tsl_mult': 0.087020042921924, 'strategy': 'mean_reversion', 'time_stop': 245, 'use_sma': False, 'use_atr': False, 'use_adx': False, 'use_ema': False, 'use_spike': False, 'rsi_required': False, 'edge_k': 1.396038152184361, 'edge_cap': 0.48795341080640714, 'bull_strategy': 'breakout', 'bull_bb_std_mult': 2.1755303191170845, 'bull_rsi_os': 21, 'bull_rsi_ob': 81, 'bull_adx_thresh': 9.65957562856336, 'bull_atr_min_pct': 0.023323875205862245, 'bull_atr_max_pct': 0.135496831796242, 'bull_tp_mult': 2.722281179618607, 'bull_tsl_mult': 0.8178552520557298, 'bull_time_stop': 203, 'bull_use_sma': False, 'bull_use_ema': False, 'bull_use_atr': True, 'bull_use_adx': True, 'bull_use_spike': True, 'bull_rsi_required': True, 'bear_strategy': 'breakout', 'bear_bb_std_mult': 1.6103066695782444, 'bear_rsi_os': 52, 'bear_rsi_ob': 75, 'bear_adx_thresh': 34.631214938349245, 'bear_atr_min_pct': 0.017875374539284474, 'bear_atr_max_pct': 0.10341910633945006, 'bear_tp_mult': 1.645409433040111, 'bear_tsl_mult': 0.5420886935263669, 'bear_time_stop': 39, 'bear_use_sma': False, 'bear_use_ema': False, 'bear_use_atr': False, 'bear_use_adx': False, 'bear_use_spike': True, 'bear_rsi_required': False, 'sideways_strategy': 'mean_reversion', 'sideways_bb_std_mult': 2.128350957252395, 'sideways_rsi_os': 10, 'sideways_rsi_ob': 63, 'sideways_adx_thresh': 23.740979715692465, 'sideways_atr_min_pct': 0.012571777662025257, 'sideways_atr_max_pct': 0.09138773310831637, 'sideways_tp_mult': 1.5709857062897035, 'sideways_tsl_mult': 0.3934800325639871, 'sideways_time_stop': 54, 'sideways_use_sma': False, 'sideways_use_ema': False, 'sideways_use_atr': True, 'sideways_use_adx': False, 'sideways_use_spike': True, 'sideways_rsi_required': True}.
