[I 2025-09-01 08:03:37,777] Trial 251 finished with values: [-1000000000.0, 1000000000.0] and parameters: {'p_sma': 32, 'p_std': 10, 'p_atr': 19, 'p_adx': 22, 'rsi_period': 63, 'ema1': 16, 'ema2': 14, 'slip_atr_k': 0.004416414167589226, 'slip_spread_k': 0.9305511167150706, 'spread_hl_frac': 0.015485144025518333, 'bb_std_mult': 2.933799752345011, 'rsi_os': 32, 'rsi_ob': 65, 'vol_spike': 0.053017872818196934, 'adx_thresh': 29.987156589436996, 'atr_min_pct': 0.0023795408166787527, 'atr_max_pct': 0.12359461010725538, 'tp_mult': 1.6227108706822655, 'tsl_mult': 0.053051846692010324, 'strategy': 'mean_reversion', 'time_stop': 246, 'use_sma': False, 'use_atr': False, 'use_adx': True, 'use_ema': True, 'use_spike': True, 'rsi_required': True, 'edge_k': 1.6053491897173713, 'edge_cap': 0.2853559246632972, 'bull_strategy': 'breakout', 'bull_bb_std_mult': 2.744608501341591, 'bull_rsi_os': 52, 'bull_rsi_ob': 63, 'bull_adx_thresh': 8.61160543151153, 'bull_atr_min_pct': 0.005173525276039917, 'bull_atr_max_pct': 0.12662251595634522, 'bull_tp_mult': 1.5567127624771813, 'bull_tsl_mult': 0.6360846912274646, 'bull_time_stop': 50, 'bull_use_sma': True, 'bull_use_ema': True, 'bull_use_atr': True, 'bull_use_adx': True, 'bull_use_spike': False, 'bull_rsi_required': False, 'bear_strategy': 'mean_reversion', 'bear_bb_std_mult': 1.068860911811901, 'bear_rsi_os': 26, 'bear_rsi_ob': 83, 'bear_adx_thresh': 7.253782424079841, 'bear_atr_min_pct': 0.007231519266899111, 'bear_atr_max_pct': 0.09470202583944265, 'bear_tp_mult': 2.1438593694470818, 'bear_tsl_mult': 0.10428905792708189, 'bear_time_stop': 290, 'bear_use_sma': True, 'bear_use_ema': False, 'bear_use_atr': True, 'bear_use_adx': False, 'bear_use_spike': True, 'bear_rsi_required': True, 'sideways_strategy': 'breakout', 'sideways_bb_std_mult': 0.8328765205834741, 'sideways_rsi_os': 7, 'sideways_rsi_ob': 93, 'sideways_adx_thresh': 21.96273501118453, 'sideways_atr_min_pct': 0.02878075331119407, 'sideways_atr_max_pct': 0.02270720762004644, 'sideways_tp_mult': 1.3410751502532399, 'sideways_tsl_mult': 0.21176269116622945, 'sideways_time_stop': 169, 'sideways_use_sma': True, 'sideways_use_ema': True, 'sideways_use_atr': True, 'sideways_use_adx': True, 'sideways_use_spike': False, 'sideways_rsi_required': False}.
[I 2025-09-01 08:03:38,403] Trial 254 finished with values: [-1000000000.0, 1000000000.0] and parameters: {'p_sma': 27, 'p_std': 49, 'p_atr': 10, 'p_adx': 8, 'rsi_period': 51, 'ema1': 25, 'ema2': 10, 'slip_atr_k': 8.248351092700965e-05, 'slip_spread_k': 0.9049096550466348, 'spread_hl_frac': 0.013450144408144894, 'bb_std_mult': 3.158863273415519, 'rsi_os': 27, 'rsi_ob': 95, 'vol_spike': 0.051333333029275556, 'adx_thresh': 26.638360971754004, 'atr_min_pct': 0.0024596233503476075, 'atr_max_pct': 0.030008972854947927, 'tp_mult': 1.64808575090908, 'tsl_mult': 0.018792202579250114, 'strategy': 'mean_reversion', 'time_stop': 262, 'use_sma': True, 'use_atr': False, 'use_adx': True, 'use_ema': True, 'use_spike': True, 'rsi_required': True, 'edge_k': 0.2449200206810313, 'edge_cap': 0.8325977910428686, 'bull_strategy': 'breakout', 'bull_bb_std_mult': 3.0837424269301157, 'bull_rsi_os': 37, 'bull_rsi_ob': 63, 'bull_adx_thresh': 6.970454010518363, 'bull_atr_min_pct': 0.005107585464434062, 'bull_atr_max_pct': 0.01889098303189847, 'bull_tp_mult': 1.606534153982271, 'bull_tsl_mult': 0.603674391793606, 'bull_time_stop': 90, 'bull_use_sma': True, 'bull_use_ema': False, 'bull_use_atr': True, 'bull_use_adx': True, 'bull_use_spike': False, 'bull_rsi_required': False, 'bear_strategy': 'mean_reversion', 'bear_bb_std_mult': 1.7242520530276522, 'bear_rsi_os': 23, 'bear_rsi_ob': 80, 'bear_adx_thresh': 7.355037929722951, 'bear_atr_min_pct': 0.021138536065405826, 'bear_atr_max_pct': 0.10021035556389661, 'bear_tp_mult': 2.3803495294057564, 'bear_tsl_mult': 0.11011413556571711, 'bear_time_stop': 290, 'bear_use_sma': True, 'bear_use_ema': False, 'bear_use_atr': True, 'bear_use_adx': False, 'bear_use_spike': True, 'bear_rsi_required': False, 'sideways_strategy': 'breakout', 'sideways_bb_std_mult': 2.0878370586871466, 'sideways_rsi_os': 12, 'sideways_rsi_ob': 89, 'sideways_adx_thresh': 11.38602167797112, 'sideways_atr_min_pct': 0.001608673026734642, 'sideways_atr_max_pct': 0.02286119592547807, 'sideways_tp_mult': 1.3444073050593923, 'sideways_tsl_mult': 0.16234298211613762, 'sideways_time_stop': 54, 'sideways_use_sma': True, 'sideways_use_ema': True, 'sideways_use_atr': True, 'sideways_use_adx': True, 'sideways_use_spike': False, 'sideways_rsi_required': False}.
[I 2025-09-01 08:03:38,652] Trial 253 finished with values: [-1000000000.0, 1000000000.0] and parameters: {'p_sma': 32, 'p_std': 60, 'p_atr': 10, 'p_adx': 30, 'rsi_period': 69, 'ema1': 14, 'ema2': 14, 'slip_atr_k': 0.16358823217061783, 'slip_spread_k': 0.9207858798712097, 'spread_hl_frac': 0.015148743272909923, 'bb_std_mult': 3.200260552276571, 'rsi_os': 30, 'rsi_ob': 65, 'vol_spike': 0.05057337942104248, 'adx_thresh': 30.768751607190833, 'atr_min_pct': 0.0028384084387674657, 'atr_max_pct': 0.05603618842557084, 'tp_mult': 2.088638284683692, 'tsl_mult': 0.023537254850984905, 'strategy': 'mean_reversion', 'time_stop': 260, 'use_sma': False, 'use_atr': False, 'use_adx': True, 'use_ema': True, 'use_spike': True, 'rsi_required': True, 'edge_k': 0.4229670144705462, 'edge_cap': 0.19621358510489859, 'bull_strategy': 'breakout', 'bull_bb_std_mult': 2.857782412932524, 'bull_rsi_os': 41, 'bull_rsi_ob': 48, 'bull_adx_thresh': 8.719218240983603, 'bull_atr_min_pct': 0.01759538986206883, 'bull_atr_max_pct': 0.019228496865000104, 'bull_tp_mult': 1.5591925375897795, 'bull_tsl_mult': 0.6038807802666066, 'bull_time_stop': 285, 'bull_use_sma': True, 'bull_use_ema': True, 'bull_use_atr': True, 'bull_use_adx': True, 'bull_use_spike': False, 'bull_rsi_required': False, 'bear_strategy': 'mean_reversion', 'bear_bb_std_mult': 1.7205993274602058, 'bear_rsi_os': 28, 'bear_rsi_ob': 80, 'bear_adx_thresh': 6.611302288280628, 'bear_atr_min_pct': 0.025324926163978346, 'bear_atr_max_pct': 0.10102622539837906, 'bear_tp_mult': 2.123385967794208, 'bear_tsl_mult': 0.11091059354261953, 'bear_time_stop': 289, 'bear_use_sma': True, 'bear_use_ema': False, 'bear_use_atr': True, 'bear_use_adx': False, 'bear_use_spike': True, 'bear_rsi_required': False, 'sideways_strategy': 'breakout', 'sideways_bb_std_mult': 2.0500412737697298, 'sideways_rsi_os': 8, 'sideways_rsi_ob': 93, 'sideways_adx_thresh': 17.83582340380269, 'sideways_atr_min_pct': 0.0013073457222976155, 'sideways_atr_max_pct': 0.01264995707585544, 'sideways_tp_mult': 1.5083431726497167, 'sideways_tsl_mult': 0.7928120344407793, 'sideways_time_stop': 216, 'sideways_use_sma': True, 'sideways_use_ema': True, 'sideways_use_atr': True, 'sideways_use_adx': True, 'sideways_use_spike': False, 'sideways_rsi_required': False}.
[I 2025-09-01 08:04:20,074] Trial 258 finished with values: [-1000000000.0, 1000000000.0] and parameters: {'p_sma': 23, 'p_std': 23, 'p_atr': 26, 'p_adx': 19, 'rsi_period': 65, 'ema1': 15, 'ema2': 43, 'slip_atr_k': 0.11706705616469426, 'slip_spread_k': 0.7690339987351098, 'spread_hl_frac': 0.013600942413118197, 'bb_std_mult': 2.1057118283802962, 'rsi_os': 22, 'rsi_ob': 53, 'vol_spike': 0.07721286335074547, 'adx_thresh': 28.684119689097766, 'atr_min_pct': 0.009030465639927742, 'atr_max_pct': 0.02458429824633606, 'tp_mult': 1.992995326186388, 'tsl_mult': 0.11090518555403137, 'strategy': 'breakout', 'time_stop': 251, 'use_sma': False, 'use_atr': False, 'use_adx': True, 'use_ema': True, 'use_spike': True, 'rsi_required': True, 'edge_k': 0.2629615884557419, 'edge_cap': 0.22173784393006182, 'bull_strategy': 'breakout', 'bull_bb_std_mult': 1.8771973882172928, 'bull_rsi_os': 44, 'bull_rsi_ob': 80, 'bull_adx_thresh': 7.6195151691497855, 'bull_atr_min_pct': 0.006058184010859514, 'bull_atr_max_pct': 0.04593434786543353, 'bull_tp_mult': 1.464172681067932, 'bull_tsl_mult': 0.16538011322291263, 'bull_time_stop': 76, 'bull_use_sma': True, 'bull_use_ema': False, 'bull_use_atr': False, 'bull_use_adx': False, 'bull_use_spike': False, 'bull_rsi_required': False, 'bear_strategy': 'mean_reversion', 'bear_bb_std_mult': 1.949876705428176, 'bear_rsi_os': 44, 'bear_rsi_ob': 74, 'bear_adx_thresh': 5.824584140405105, 'bear_atr_min_pct': 0.015719991672906452, 'bear_atr_max_pct': 0.036891550363836866, 'bear_tp_mult': 2.080718314523623, 'bear_tsl_mult': 0.8625370965539136, 'bear_time_stop': 282, 'bear_use_sma': True, 'bear_use_ema': False, 'bear_use_atr': False, 'bear_use_adx': True, 'bear_use_spike': False, 'bear_rsi_required': False, 'sideways_strategy': 'breakout', 'sideways_bb_std_mult': 1.1303354994589438, 'sideways_rsi_os': 5, 'sideways_rsi_ob': 92, 'sideways_adx_thresh': 19.542561150839507, 'sideways_atr_min_pct': 0.027902787302760947, 'sideways_atr_max_pct': 0.032387850780747254, 'sideways_tp_mult': 1.215503531331698, 'sideways_tsl_mult': 0.18428400129639796, 'sideways_time_stop': 212, 'sideways_use_sma': True, 'sideways_use_ema': True, 'sideways_use_atr': False, 'sideways_use_adx': True, 'sideways_use_spike': False, 'sideways_rsi_required': False}.
[I 2025-09-01 08:04:20,249] Trial 255 finished with values: [-1000000000.0, 1000000000.0] and parameters: {'p_sma': 28, 'p_std': 23, 'p_atr': 26, 'p_adx': 27, 'rsi_period': 51, 'ema1': 25, 'ema2': 42, 'slip_atr_k': 0.05008874928282213, 'slip_spread_k': 0.7736142101060586, 'spread_hl_frac': 0.01342783727091732, 'bb_std_mult': 1.7543365428906172, 'rsi_os': 20, 'rsi_ob': 45, 'vol_spike': 0.07572230456831867, 'adx_thresh': 28.650446200889423, 'atr_min_pct': 0.0006942151668363292, 'atr_max_pct': 0.024682114213562416, 'tp_mult': 1.988539501903857, 'tsl_mult': 0.11489006150397929, 'strategy': 'breakout', 'time_stop': 207, 'use_sma': True, 'use_atr': False, 'use_adx': True, 'use_ema': True, 'use_spike': True, 'rsi_required': True, 'edge_k': 0.2542871721236777, 'edge_cap': 0.2224439856430697, 'bull_strategy': 'breakout', 'bull_bb_std_mult': 1.443235443485062, 'bull_rsi_os': 41, 'bull_rsi_ob': 45, 'bull_adx_thresh': 7.055675578702529, 'bull_atr_min_pct': 0.005919342357488583, 'bull_atr_max_pct': 0.04688453607016717, 'bull_tp_mult': 1.6141620616155874, 'bull_tsl_mult': 0.812328060038493, 'bull_time_stop': 57, 'bull_use_sma': True, 'bull_use_ema': False, 'bull_use_atr': False, 'bull_use_adx': False, 'bull_use_spike': False, 'bull_rsi_required': False, 'bear_strategy': 'mean_reversion', 'bear_bb_std_mult': 2.7412510774397068, 'bear_rsi_os': 44, 'bear_rsi_ob': 75, 'bear_adx_thresh': 6.622331631208763, 'bear_atr_min_pct': 0.006070056158086031, 'bear_atr_max_pct': 0.09983943643487428, 'bear_tp_mult': 2.385368867316988, 'bear_tsl_mult': 0.12764154290316784, 'bear_time_stop': 273, 'bear_use_sma': True, 'bear_use_ema': False, 'bear_use_atr': False, 'bear_use_adx': True, 'bear_use_spike': False, 'bear_rsi_required': False, 'sideways_strategy': 'breakout', 'sideways_bb_std_mult': 1.150706745524356, 'sideways_rsi_os': 12, 'sideways_rsi_ob': 91, 'sideways_adx_thresh': 20.976165449043798, 'sideways_atr_min_pct': 0.0016150647694803504, 'sideways_atr_max_pct': 0.027564618090991422, 'sideways_tp_mult': 1.2169155114111585, 'sideways_tsl_mult': 0.18431364722988128, 'sideways_time_stop': 56, 'sideways_use_sma': True, 'sideways_use_ema': True, 'sideways_use_atr': True, 'sideways_use_adx': True, 'sideways_use_spike': False, 'sideways_rsi_required': False}.
[I 2025-09-01 08:04:20,731] Trial 257 finished with values: [-1000000000.0, 1000000000.0] and parameters: {'p_sma': 22, 'p_std': 23, 'p_atr': 18, 'p_adx': 11, 'rsi_period': 75, 'ema1': 15, 'ema2': 13, 'slip_atr_k': 0.24096994220426596, 'slip_spread_k': 0.16641537010199609, 'spread_hl_frac': 0.013699312996250296, 'bb_std_mult': 2.051119205008676, 'rsi_os': 31, 'rsi_ob': 56, 'vol_spike': 0.06584645297545932, 'adx_thresh': 28.676166122626594, 'atr_min_pct': 0.0051798390968601895, 'atr_max_pct': 0.10285362704449924, 'tp_mult': 2.092783432956687, 'tsl_mult': 0.1138146012553457, 'strategy': 'breakout', 'time_stop': 210, 'use_sma': False, 'use_atr': False, 'use_adx': True, 'use_ema': True, 'use_spike': True, 'rsi_required': True, 'edge_k': 0.30512190605806605, 'edge_cap': 0.21807720674837813, 'bull_strategy': 'breakout', 'bull_bb_std_mult': 1.530079624903113, 'bull_rsi_os': 41, 'bull_rsi_ob': 45, 'bull_adx_thresh': 33.448730008849644, 'bull_atr_min_pct': 0.017920661744359585, 'bull_atr_max_pct': 0.042843307283949375, 'bull_tp_mult': 1.467624700377008, 'bull_tsl_mult': 0.6155247339876854, 'bull_time_stop': 76, 'bull_use_sma': True, 'bull_use_ema': False, 'bull_use_atr': False, 'bull_use_adx': False, 'bull_use_spike': False, 'bull_rsi_required': False, 'bear_strategy': 'mean_reversion', 'bear_bb_std_mult': 1.9578973665788428, 'bear_rsi_os': 44, 'bear_rsi_ob': 73, 'bear_adx_thresh': 6.4749303291714675, 'bear_atr_min_pct': 0.005916249893814608, 'bear_atr_max_pct': 0.10158057509890846, 'bear_tp_mult': 1.9858673433795107, 'bear_tsl_mult': 0.661012234800581, 'bear_time_stop': 282, 'bear_use_sma': True, 'bear_use_ema': False, 'bear_use_atr': False, 'bear_use_adx': True, 'bear_use_spike': False, 'bear_rsi_required': False, 'sideways_strategy': 'breakout', 'sideways_bb_std_mult': 1.1461072893938236, 'sideways_rsi_os': 17, 'sideways_rsi_ob': 91, 'sideways_adx_thresh': 19.383199516915045, 'sideways_atr_min_pct': 0.02781918375544671, 'sideways_atr_max_pct': 0.018768358758163753, 'sideways_tp_mult': 1.530168116555449, 'sideways_tsl_mult': 0.1746206254828952, 'sideways_time_stop': 211, 'sideways_use_sma': True, 'sideways_use_ema': True, 'sideways_use_atr': False, 'sideways_use_adx': True, 'sideways_use_spike': False, 'sideways_rsi_required': False}.
[I 2025-09-01 08:04:20,748] Trial 256 finished with values: [-1000000000.0, 1000000000.0] and parameters: {'p_sma': 22, 'p_std': 49, 'p_atr': 26, 'p_adx': 19, 'rsi_period': 69, 'ema1': 14, 'ema2': 45, 'slip_atr_k': 0.00021068803391791416, 'slip_spread_k': 0.9006330972283361, 'spread_hl_frac': 0.013455674409104735, 'bb_std_mult': 2.059445321964948, 'rsi_os': 22, 'rsi_ob': 56, 'vol_spike': 0.07733881378845553, 'adx_thresh': 30.71766212267058, 'atr_min_pct': 0.0006876714649502735, 'atr_max_pct': 0.06869531008050192, 'tp_mult': 1.3161477738395395, 'tsl_mult': 0.10908194700326797, 'strategy': 'breakout', 'time_stop': 217, 'use_sma': True, 'use_atr': False, 'use_adx': True, 'use_ema': True, 'use_spike': True, 'rsi_required': True, 'edge_k': 0.43136344447480995, 'edge_cap': 0.8375747604005399, 'bull_strategy': 'breakout', 'bull_bb_std_mult': 1.4926744694115024, 'bull_rsi_os': 41, 'bull_rsi_ob': 47, 'bull_adx_thresh': 7.229614228392157, 'bull_atr_min_pct': 0.0047413102380218924, 'bull_atr_max_pct': 0.04528077952877672, 'bull_tp_mult': 1.6142384793429931, 'bull_tsl_mult': 0.8087186674642223, 'bull_time_stop': 89, 'bull_use_sma': True, 'bull_use_ema': False, 'bull_use_atr': False, 'bull_use_adx': False, 'bull_use_spike': False, 'bull_rsi_required': False, 'bear_strategy': 'mean_reversion', 'bear_bb_std_mult': 1.7370664878286866, 'bear_rsi_os': 23, 'bear_rsi_ob': 73, 'bear_adx_thresh': 6.644577727965293, 'bear_atr_min_pct': 0.00621286922526969, 'bear_atr_max_pct': 0.06806486859321313, 'bear_tp_mult': 2.3983912443593787, 'bear_tsl_mult': 0.11212369243202133, 'bear_time_stop': 271, 'bear_use_sma': True, 'bear_use_ema': False, 'bear_use_atr': False, 'bear_use_adx': True, 'bear_use_spike': False, 'bear_rsi_required': False, 'sideways_strategy': 'breakout', 'sideways_bb_std_mult': 1.128000763593262, 'sideways_rsi_os': 13, 'sideways_rsi_ob': 89, 'sideways_adx_thresh': 20.24540311729853, 'sideways_atr_min_pct': 0.001780785137428598, 'sideways_atr_max_pct': 0.13069267800250187, 'sideways_tp_mult': 1.2254933919553943, 'sideways_tsl_mult': 0.18741247809331696, 'sideways_time_stop': 58, 'sideways_use_sma': True, 'sideways_use_ema': True, 'sideways_use_atr': True, 'sideways_use_adx': True, 'sideways_use_spike': False, 'sideways_rsi_required': False}.
[I 2025-09-01 08:05:00,909] Trial 261 finished with values: [-1000000000.0, 1000000000.0] and parameters: {'p_sma': 6, 'p_std': 56, 'p_atr': 24, 'p_adx': 30, 'rsi_period': 55, 'ema1': 20, 'ema2': 21, 'slip_atr_k': 0.08452126759543716, 'slip_spread_k': 0.8024421319207553, 'spread_hl_frac': 0.012239648431276739, 'bb_std_mult': 2.3298452352915677, 'rsi_os': 37, 'rsi_ob': 62, 'vol_spike': 0.14217243636600332, 'adx_thresh': 29.566794031391073, 'atr_min_pct': 0.004245409898384107, 'atr_max_pct': 0.04632283140852868, 'tp_mult': 1.7251429682436654, 'tsl_mult': 0.0700485584239271, 'strategy': 'breakout', 'time_stop': 281, 'use_sma': False, 'use_atr': True, 'use_adx': True, 'use_ema': True, 'use_spike': True, 'rsi_required': True, 'edge_k': 0.13339772600784675, 'edge_cap': 0.16662991754601136, 'bull_strategy': 'mean_reversion', 'bull_bb_std_mult': 3.000740212963941, 'bull_rsi_os': 23, 'bull_rsi_ob': 72, 'bull_adx_thresh': 5.7376119211274474, 'bull_atr_min_pct': 0.023372284212438595, 'bull_atr_max_pct': 0.08661871610340863, 'bull_tp_mult': 2.626098717697219, 'bull_tsl_mult': 0.9167077127118702, 'bull_time_stop': 226, 'bull_use_sma': True, 'bull_use_ema': True, 'bull_use_atr': False, 'bull_use_adx': False, 'bull_use_spike': False, 'bull_rsi_required': False, 'bear_strategy': 'mean_reversion', 'bear_bb_std_mult': 1.862915797293193, 'bear_rsi_os': 10, 'bear_rsi_ob': 78, 'bear_adx_thresh': 5.597903623137424, 'bear_atr_min_pct': 0.008852985314456744, 'bear_atr_max_pct': 0.1364062228914289, 'bear_tp_mult': 2.4523941806418255, 'bear_tsl_mult': 0.0638717719452191, 'bear_time_stop': 295, 'bear_use_sma': True, 'bear_use_ema': True, 'bear_use_atr': True, 'bear_use_adx': False, 'bear_use_spike': False, 'bear_rsi_required': False, 'sideways_strategy': 'breakout', 'sideways_bb_std_mult': 0.9720475498144965, 'sideways_rsi_os': 20, 'sideways_rsi_ob': 94, 'sideways_adx_thresh': 18.48996507405294, 'sideways_atr_min_pct': 0.02930305875700174, 'sideways_atr_max_pct': 0.017098094942749414, 'sideways_tp_mult': 1.6490151455019342, 'sideways_tsl_mult': 0.14037639257727555, 'sideways_time_stop': 223, 'sideways_use_sma': True, 'sideways_use_ema': True, 'sideways_use_atr': True, 'sideways_use_adx': True, 'sideways_use_spike': False, 'sideways_rsi_required': False}.
[I 2025-09-01 08:05:01,557] Trial 259 finished with values: [-1000000000.0, 1000000000.0] and parameters: {'p_sma': 5, 'p_std': 57, 'p_atr': 23, 'p_adx': 11, 'rsi_period': 10, 'ema1': 15, 'ema2': 52, 'slip_atr_k': 0.08479828168433345, 'slip_spread_k': 0.028391285348455753, 'spread_hl_frac': 0.012582583500794903, 'bb_std_mult': 2.026762672761776, 'rsi_os': 37, 'rsi_ob': 94, 'vol_spike': 0.06679443848492767, 'adx_thresh': 12.613426573217941, 'atr_min_pct': 0.007878255792220332, 'atr_max_pct': 0.0469035281781829, 'tp_mult': 2.181722828544891, 'tsl_mult': 0.06646612532423576, 'strategy': 'breakout', 'time_stop': 234, 'use_sma': False, 'use_atr': False, 'use_adx': True, 'use_ema': True, 'use_spike': True, 'rsi_required': True, 'edge_k': 0.5481477693915215, 'edge_cap': 0.16541121902469788, 'bull_strategy': 'breakout', 'bull_bb_std_mult': 3.2751729007067025, 'bull_rsi_os': 47, 'bull_rsi_ob': 50, 'bull_adx_thresh': 14.352862405523446, 'bull_atr_min_pct': 0.008327679968832945, 'bull_atr_max_pct': 0.07732799114452722, 'bull_tp_mult': 2.6714483580199073, 'bull_tsl_mult': 0.5725483358111145, 'bull_time_stop': 221, 'bull_use_sma': True, 'bull_use_ema': True, 'bull_use_atr': False, 'bull_use_adx': False, 'bull_use_spike': False, 'bull_rsi_required': False, 'bear_strategy': 'mean_reversion', 'bear_bb_std_mult': 1.8759455060601662, 'bear_rsi_os': 11, 'bear_rsi_ob': 78, 'bear_adx_thresh': 5.035922415042278, 'bear_atr_min_pct': 0.005595450682119399, 'bear_atr_max_pct': 0.09333485688567514, 'bear_tp_mult': 2.2459012904020486, 'bear_tsl_mult': 0.7578570227341836, 'bear_time_stop': 294, 'bear_use_sma': True, 'bear_use_ema': False, 'bear_use_atr': False, 'bear_use_adx': False, 'bear_use_spike': False, 'bear_rsi_required': False, 'sideways_strategy': 'breakout', 'sideways_bb_std_mult': 1.9778715690469557, 'sideways_rsi_os': 5, 'sideways_rsi_ob': 63, 'sideways_adx_thresh': 18.56412283081953, 'sideways_atr_min_pct': 0.02903205277953216, 'sideways_atr_max_pct': 0.13042079173293397, 'sideways_tp_mult': 2.865294690604788, 'sideways_tsl_mult': 0.1508161270418938, 'sideways_time_stop': 225, 'sideways_use_sma': True, 'sideways_use_ema': True, 'sideways_use_atr': True, 'sideways_use_adx': True, 'sideways_use_spike': False, 'sideways_rsi_required': False}.
