[I 2025-09-01 08:36:46,520] Trial 431 finished with values: [-1000000000.0, 1000000000.0] and parameters: {'p_sma': 30, 'p_std': 15, 'p_atr': 13, 'p_adx': 21, 'rsi_period': 56, 'ema1': 25, 'ema2': 12, 'slip_atr_k': 0.018647146642059284, 'slip_spread_k': 0.8533408597526425, 'spread_hl_frac': 0.013392168660829163, 'bb_std_mult': 2.5639313413779696, 'rsi_os': 48, 'rsi_ob': 65, 'vol_spike': 0.07125024030154152, 'adx_thresh': 11.545780443489067, 'atr_min_pct': 0.005208100842539622, 'atr_max_pct': 0.11806672472209205, 'tp_mult': 1.6285669522049246, 'tsl_mult': 0.024790293872581432, 'strategy': 'mean_reversion', 'time_stop': 300, 'use_sma': False, 'use_atr': False, 'use_adx': False, 'use_ema': True, 'use_spike': False, 'rsi_required': True, 'edge_k': 0.22181923611576324, 'edge_cap': 0.11910157748667742, 'bull_strategy': 'breakout', 'bull_bb_std_mult': 2.924502711336186, 'bull_rsi_os': 45, 'bull_rsi_ob': 56, 'bull_adx_thresh': 24.357459780943323, 'bull_atr_min_pct': 0.010100322664282886, 'bull_atr_max_pct': 0.020736629219523243, 'bull_tp_mult': 1.611712649369571, 'bull_tsl_mult': 0.5818190249373427, 'bull_time_stop': 85, 'bull_use_sma': True, 'bull_use_ema': True, 'bull_use_atr': True, 'bull_use_adx': True, 'bull_use_spike': True, 'bull_rsi_required': False, 'bear_strategy': 'mean_reversion', 'bear_bb_std_mult': 1.936145366592406, 'bear_rsi_os': 25, 'bear_rsi_ob': 74, 'bear_adx_thresh': 6.823199503736005, 'bear_atr_min_pct': 0.006125188895153941, 'bear_atr_max_pct': 0.10331752233999499, 'bear_tp_mult': 2.1622778887820875, 'bear_tsl_mult': 0.11643871533513772, 'bear_time_stop': 289, 'bear_use_sma': True, 'bear_use_ema': False, 'bear_use_atr': False, 'bear_use_adx': False, 'bear_use_spike': True, 'bear_rsi_required': True, 'sideways_strategy': 'breakout', 'sideways_bb_std_mult': 0.8397717840439314, 'sideways_rsi_os': 6, 'sideways_rsi_ob': 92, 'sideways_adx_thresh': 13.576862400466966, 'sideways_atr_min_pct': 0.018922875773605238, 'sideways_atr_max_pct': 0.07006947713056758, 'sideways_tp_mult': 1.1909706753037832, 'sideways_tsl_mult': 0.3629344870186054, 'sideways_time_stop': 120, 'sideways_use_sma': True, 'sideways_use_ema': True, 'sideways_use_atr': True, 'sideways_use_adx': True, 'sideways_use_spike': False, 'sideways_rsi_required': True}.
[I 2025-09-01 08:36:46,991] Trial 433 finished with values: [-1000000000.0, 1000000000.0] and parameters: {'p_sma': 49, 'p_std': 49, 'p_atr': 22, 'p_adx': 20, 'rsi_period': 53, 'ema1': 13, 'ema2': 12, 'slip_atr_k': 0.019103464311572022, 'slip_spread_k': 0.8379945205623879, 'spread_hl_frac': 0.013382935250378286, 'bb_std_mult': 2.512589946201413, 'rsi_os': 29, 'rsi_ob': 86, 'vol_spike': 0.2214648735926202, 'adx_thresh': 28.875093192358907, 'atr_min_pct': 0.005175497717737408, 'atr_max_pct': 0.12160754425139778, 'tp_mult': 1.5951988094135565, 'tsl_mult': 0.9150745641638158, 'strategy': 'mean_reversion', 'time_stop': 66, 'use_sma': False, 'use_atr': False, 'use_adx': False, 'use_ema': False, 'use_spike': False, 'rsi_required': True, 'edge_k': 1.6678780043151975, 'edge_cap': 0.17840601539533962, 'bull_strategy': 'breakout', 'bull_bb_std_mult': 2.8537728145918577, 'bull_rsi_os': 44, 'bull_rsi_ob': 50, 'bull_adx_thresh': 6.261472895159133, 'bull_atr_min_pct': 0.010109905953421098, 'bull_atr_max_pct': 0.06082930106657758, 'bull_tp_mult': 1.599947387973465, 'bull_tsl_mult': 0.6037278300126335, 'bull_time_stop': 55, 'bull_use_sma': True, 'bull_use_ema': True, 'bull_use_atr': True, 'bull_use_adx': True, 'bull_use_spike': True, 'bull_rsi_required': False, 'bear_strategy': 'mean_reversion', 'bear_bb_std_mult': 1.491221006880379, 'bear_rsi_os': 47, 'bear_rsi_ob': 79, 'bear_adx_thresh': 29.537895424939112, 'bear_atr_min_pct': 0.009092030075417689, 'bear_atr_max_pct': 0.05634257075694222, 'bear_tp_mult': 2.08287068524967, 'bear_tsl_mult': 0.4159634038884021, 'bear_time_stop': 289, 'bear_use_sma': True, 'bear_use_ema': False, 'bear_use_atr': False, 'bear_use_adx': True, 'bear_use_spike': True, 'bear_rsi_required': True, 'sideways_strategy': 'breakout', 'sideways_bb_std_mult': 3.2065069570605917, 'sideways_rsi_os': 6, 'sideways_rsi_ob': 61, 'sideways_adx_thresh': 16.99325265355829, 'sideways_atr_min_pct': 0.02915657252825684, 'sideways_atr_max_pct': 0.011776505515701976, 'sideways_tp_mult': 1.1895469402848513, 'sideways_tsl_mult': 0.16556338292852465, 'sideways_time_stop': 78, 'sideways_use_sma': True, 'sideways_use_ema': False, 'sideways_use_atr': True, 'sideways_use_adx': True, 'sideways_use_spike': False, 'sideways_rsi_required': True}.
[I 2025-09-01 08:36:47,513] Trial 432 finished with values: [-1000000000.0, 1000000000.0] and parameters: {'p_sma': 26, 'p_std': 46, 'p_atr': 13, 'p_adx': 20, 'rsi_period': 41, 'ema1': 18, 'ema2': 13, 'slip_atr_k': 0.028250634942823906, 'slip_spread_k': 0.2220388711197681, 'spread_hl_frac': 0.011116660239085722, 'bb_std_mult': 2.5196658137406933, 'rsi_os': 48, 'rsi_ob': 90, 'vol_spike': 0.1953593114585287, 'adx_thresh': 29.024361996197655, 'atr_min_pct': 0.005197832795242517, 'atr_max_pct': 0.12028253705952588, 'tp_mult': 1.634789232304533, 'tsl_mult': 0.10794941230770666, 'strategy': 'mean_reversion', 'time_stop': 64, 'use_sma': False, 'use_atr': False, 'use_adx': True, 'use_ema': True, 'use_spike': True, 'rsi_required': True, 'edge_k': 0.21946159253669767, 'edge_cap': 0.09496409832798997, 'bull_strategy': 'breakout', 'bull_bb_std_mult': 2.897809030546707, 'bull_rsi_os': 43, 'bull_rsi_ob': 59, 'bull_adx_thresh': 10.327546278538373, 'bull_atr_min_pct': 0.009061689544502611, 'bull_atr_max_pct': 0.06628668564297317, 'bull_tp_mult': 1.6371912172276293, 'bull_tsl_mult': 0.5808389600730549, 'bull_time_stop': 82, 'bull_use_sma': True, 'bull_use_ema': True, 'bull_use_atr': True, 'bull_use_adx': True, 'bull_use_spike': False, 'bull_rsi_required': False, 'bear_strategy': 'mean_reversion', 'bear_bb_std_mult': 1.7733763426010483, 'bear_rsi_os': 47, 'bear_rsi_ob': 79, 'bear_adx_thresh': 8.664671836394676, 'bear_atr_min_pct': 0.008905979243652594, 'bear_atr_max_pct': 0.09681308243943858, 'bear_tp_mult': 2.0839515433544413, 'bear_tsl_mult': 0.09486209723183105, 'bear_time_stop': 219, 'bear_use_sma': True, 'bear_use_ema': False, 'bear_use_atr': False, 'bear_use_adx': False, 'bear_use_spike': True, 'bear_rsi_required': True, 'sideways_strategy': 'breakout', 'sideways_bb_std_mult': 2.9832284327857157, 'sideways_rsi_os': 18, 'sideways_rsi_ob': 61, 'sideways_adx_thresh': 13.409952336600528, 'sideways_atr_min_pct': 0.020342651347989668, 'sideways_atr_max_pct': 0.06994666989252973, 'sideways_tp_mult': 1.1889399543226655, 'sideways_tsl_mult': 0.1677209579652525, 'sideways_time_stop': 146, 'sideways_use_sma': True, 'sideways_use_ema': True, 'sideways_use_atr': True, 'sideways_use_adx': True, 'sideways_use_spike': False, 'sideways_rsi_required': False}.
[I 2025-09-01 08:37:29,167] Trial 435 finished with values: [-1000000000.0, 1000000000.0] and parameters: {'p_sma': 26, 'p_std': 46, 'p_atr': 30, 'p_adx': 10, 'rsi_period': 53, 'ema1': 13, 'ema2': 11, 'slip_atr_k': 0.01802347825776679, 'slip_spread_k': 0.8357375258376429, 'spread_hl_frac': 0.04258031638606923, 'bb_std_mult': 2.543859748589557, 'rsi_os': 30, 'rsi_ob': 65, 'vol_spike': 0.04947866037929811, 'adx_thresh': 11.093772330398545, 'atr_min_pct': 0.005040416143092403, 'atr_max_pct': 0.12123942749485618, 'tp_mult': 1.7191163509410852, 'tsl_mult': 0.2232857857694891, 'strategy': 'mean_reversion', 'time_stop': 251, 'use_sma': False, 'use_atr': True, 'use_adx': True, 'use_ema': True, 'use_spike': True, 'rsi_required': True, 'edge_k': 1.3310417118208893, 'edge_cap': 0.7072784137227122, 'bull_strategy': 'mean_reversion', 'bull_bb_std_mult': 2.862366378961011, 'bull_rsi_os': 45, 'bull_rsi_ob': 50, 'bull_adx_thresh': 18.66598964322732, 'bull_atr_min_pct': 0.0022496632236370445, 'bull_atr_max_pct': 0.06240345975004655, 'bull_tp_mult': 1.8694644903531938, 'bull_tsl_mult': 0.6092237645390552, 'bull_time_stop': 54, 'bull_use_sma': True, 'bull_use_ema': True, 'bull_use_atr': True, 'bull_use_adx': True, 'bull_use_spike': False, 'bull_rsi_required': False, 'bear_strategy': 'mean_reversion', 'bear_bb_std_mult': 1.9274931579939807, 'bear_rsi_os': 47, 'bear_rsi_ob': 77, 'bear_adx_thresh': 25.951752113350132, 'bear_atr_min_pct': 0.008115664222919084, 'bear_atr_max_pct': 0.07009777579478027, 'bear_tp_mult': 2.5338477467062948, 'bear_tsl_mult': 0.18494951195314147, 'bear_time_stop': 289, 'bear_use_sma': True, 'bear_use_ema': True, 'bear_use_atr': False, 'bear_use_adx': False, 'bear_use_spike': True, 'bear_rsi_required': True, 'sideways_strategy': 'mean_reversion', 'sideways_bb_std_mult': 1.2982294065256252, 'sideways_rsi_os': 6, 'sideways_rsi_ob': 84, 'sideways_adx_thresh': 13.890253615347477, 'sideways_atr_min_pct': 0.027532574152559035, 'sideways_atr_max_pct': 0.012331099203047157, 'sideways_tp_mult': 1.1957453066022525, 'sideways_tsl_mult': 0.7115018223300117, 'sideways_time_stop': 261, 'sideways_use_sma': True, 'sideways_use_ema': True, 'sideways_use_atr': False, 'sideways_use_adx': True, 'sideways_use_spike': False, 'sideways_rsi_required': False}.
[I 2025-09-01 08:37:29,747] Trial 436 finished with values: [-1000000000.0, 1000000000.0] and parameters: {'p_sma': 26, 'p_std': 45, 'p_atr': 21, 'p_adx': 10, 'rsi_period': 52, 'ema1': 13, 'ema2': 13, 'slip_atr_k': 0.01637669185861919, 'slip_spread_k': 0.042090124230064974, 'spread_hl_frac': 0.011299708267624, 'bb_std_mult': 2.7493277487329912, 'rsi_os': 30, 'rsi_ob': 81, 'vol_spike': 0.047015558529733506, 'adx_thresh': 30.11703514934725, 'atr_min_pct': 0.01985646993094828, 'atr_max_pct': 0.11967558211121197, 'tp_mult': 1.719513635282381, 'tsl_mult': 0.22672609462994442, 'strategy': 'breakout', 'time_stop': 251, 'use_sma': True, 'use_atr': True, 'use_adx': True, 'use_ema': True, 'use_spike': True, 'rsi_required': True, 'edge_k': 1.2585282461144358, 'edge_cap': 0.3644749482373903, 'bull_strategy': 'mean_reversion', 'bull_bb_std_mult': 2.76573316884591, 'bull_rsi_os': 45, 'bull_rsi_ob': 54, 'bull_adx_thresh': 23.219502731316883, 'bull_atr_min_pct': 0.0022897795402254378, 'bull_atr_max_pct': 0.06332831286553861, 'bull_tp_mult': 1.8482286261958714, 'bull_tsl_mult': 0.5118311250765805, 'bull_time_stop': 71, 'bull_use_sma': False, 'bull_use_ema': True, 'bull_use_atr': False, 'bull_use_adx': False, 'bull_use_spike': False, 'bull_rsi_required': True, 'bear_strategy': 'breakout', 'bear_bb_std_mult': 1.746039394495573, 'bear_rsi_os': 46, 'bear_rsi_ob': 76, 'bear_adx_thresh': 5.008560579917597, 'bear_atr_min_pct': 0.008143602580153807, 'bear_atr_max_pct': 0.07271397571809911, 'bear_tp_mult': 2.34391786148236, 'bear_tsl_mult': 0.4923196278197536, 'bear_time_stop': 211, 'bear_use_sma': True, 'bear_use_ema': True, 'bear_use_atr': False, 'bear_use_adx': False, 'bear_use_spike': False, 'bear_rsi_required': False, 'sideways_strategy': 'mean_reversion', 'sideways_bb_std_mult': 1.225108847627396, 'sideways_rsi_os': 5, 'sideways_rsi_ob': 80, 'sideways_adx_thresh': 22.72389284420657, 'sideways_atr_min_pct': 0.027767023882179595, 'sideways_atr_max_pct': 0.09569717465235478, 'sideways_tp_mult': 1.3339112736452865, 'sideways_tsl_mult': 0.7479082419976875, 'sideways_time_stop': 195, 'sideways_use_sma': True, 'sideways_use_ema': True, 'sideways_use_atr': False, 'sideways_use_adx': True, 'sideways_use_spike': False, 'sideways_rsi_required': False}.
[I 2025-09-01 08:37:30,206] Trial 437 finished with values: [-1000000000.0, 1000000000.0] and parameters: {'p_sma': 26, 'p_std': 39, 'p_atr': 21, 'p_adx': 16, 'rsi_period': 52, 'ema1': 13, 'ema2': 13, 'slip_atr_k': 0.01599853623623556, 'slip_spread_k': 0.8896220891530393, 'spread_hl_frac': 0.011820750696385336, 'bb_std_mult': 2.740118235195379, 'rsi_os': 30, 'rsi_ob': 90, 'vol_spike': 0.04801886555136751, 'adx_thresh': 29.81618338678003, 'atr_min_pct': 0.004884707252152106, 'atr_max_pct': 0.12057513840460278, 'tp_mult': 2.1452642126535513, 'tsl_mult': 0.0881168106852568, 'strategy': 'breakout', 'time_stop': 254, 'use_sma': True, 'use_atr': True, 'use_adx': True, 'use_ema': True, 'use_spike': True, 'rsi_required': True, 'edge_k': 0.08146065329536126, 'edge_cap': 0.20239862169927408, 'bull_strategy': 'mean_reversion', 'bull_bb_std_mult': 2.87061025810714, 'bull_rsi_os': 45, 'bull_rsi_ob': 53, 'bull_adx_thresh': 29.770583497167753, 'bull_atr_min_pct': 0.002167414676398891, 'bull_atr_max_pct': 0.05930691366773354, 'bull_tp_mult': 1.878749350675348, 'bull_tsl_mult': 0.8030604408218849, 'bull_time_stop': 215, 'bull_use_sma': False, 'bull_use_ema': True, 'bull_use_atr': False, 'bull_use_adx': False, 'bull_use_spike': False, 'bull_rsi_required': True, 'bear_strategy': 'breakout', 'bear_bb_std_mult': 1.745895055716273, 'bear_rsi_os': 46, 'bear_rsi_ob': 58, 'bear_adx_thresh': 5.037354668861131, 'bear_atr_min_pct': 0.0075924833374705165, 'bear_atr_max_pct': 0.09782420649965216, 'bear_tp_mult': 2.7688723764747722, 'bear_tsl_mult': 0.24191788476785675, 'bear_time_stop': 206, 'bear_use_sma': True, 'bear_use_ema': True, 'bear_use_atr': False, 'bear_use_adx': False, 'bear_use_spike': False, 'bear_rsi_required': False, 'sideways_strategy': 'mean_reversion', 'sideways_bb_std_mult': 2.9988944083654716, 'sideways_rsi_os': 24, 'sideways_rsi_ob': 80, 'sideways_adx_thresh': 11.73160428202682, 'sideways_atr_min_pct': 0.027714802619821944, 'sideways_atr_max_pct': 0.09609538294161139, 'sideways_tp_mult': 1.3327034530985968, 'sideways_tsl_mult': 0.4264144883176338, 'sideways_time_stop': 197, 'sideways_use_sma': True, 'sideways_use_ema': True, 'sideways_use_atr': False, 'sideways_use_adx': True, 'sideways_use_spike': False, 'sideways_rsi_required': False}.
[I 2025-09-01 08:37:30,388] Trial 438 finished with values: [-1000000000.0, 1000000000.0] and parameters: {'p_sma': 31, 'p_std': 35, 'p_atr': 19, 'p_adx': 10, 'rsi_period': 52, 'ema1': 12, 'ema2': 13, 'slip_atr_k': 0.015864223581909486, 'slip_spread_k': 0.8822045906851447, 'spread_hl_frac': 0.01441164242554496, 'bb_std_mult': 2.622802306531159, 'rsi_os': 31, 'rsi_ob': 80, 'vol_spike': 0.05016926906170149, 'adx_thresh': 30.043956602763892, 'atr_min_pct': 0.005750542693986571, 'atr_max_pct': 0.12186458100896326, 'tp_mult': 1.0368507016818738, 'tsl_mult': 0.08556229522003683, 'strategy': 'breakout', 'time_stop': 249, 'use_sma': True, 'use_atr': True, 'use_adx': True, 'use_ema': True, 'use_spike': True, 'rsi_required': False, 'edge_k': 0.7757547702261274, 'edge_cap': 0.3023319330276703, 'bull_strategy': 'mean_reversion', 'bull_bb_std_mult': 2.820195217410525, 'bull_rsi_os': 45, 'bull_rsi_ob': 54, 'bull_adx_thresh': 30.471477895426887, 'bull_atr_min_pct': 0.0020754134330601536, 'bull_atr_max_pct': 0.06294306386261272, 'bull_tp_mult': 1.5316233645781812, 'bull_tsl_mult': 0.7990514950529286, 'bull_time_stop': 33, 'bull_use_sma': False, 'bull_use_ema': True, 'bull_use_atr': False, 'bull_use_adx': False, 'bull_use_spike': False, 'bull_rsi_required': True, 'bear_strategy': 'breakout', 'bear_bb_std_mult': 2.793998763271802, 'bear_rsi_os': 27, 'bear_rsi_ob': 81, 'bear_adx_thresh': 6.303162422157689, 'bear_atr_min_pct': 0.008044063193647479, 'bear_atr_max_pct': 0.07016850445636791, 'bear_tp_mult': 2.501845121156255, 'bear_tsl_mult': 0.51436848164634, 'bear_time_stop': 300, 'bear_use_sma': True, 'bear_use_ema': True, 'bear_use_atr': False, 'bear_use_adx': False, 'bear_use_spike': False, 'bear_rsi_required': False, 'sideways_strategy': 'mean_reversion', 'sideways_bb_std_mult': 1.3014003913748962, 'sideways_rsi_os': 5, 'sideways_rsi_ob': 95, 'sideways_adx_thresh': 19.037402748716385, 'sideways_atr_min_pct': 0.0121994555347915, 'sideways_atr_max_pct': 0.07665659201858567, 'sideways_tp_mult': 1.32966282089512, 'sideways_tsl_mult': 0.7535349227258965, 'sideways_time_stop': 24, 'sideways_use_sma': False, 'sideways_use_ema': True, 'sideways_use_atr': False, 'sideways_use_adx': False, 'sideways_use_spike': True, 'sideways_rsi_required': False}.
[I 2025-09-01 08:38:11,103] Trial 442 finished with values: [-1000000000.0, 1000000000.0] and parameters: {'p_sma': 29, 'p_std': 53, 'p_atr': 19, 'p_adx': 28, 'rsi_period': 54, 'ema1': 13, 'ema2': 11, 'slip_atr_k': 0.02256324350129405, 'slip_spread_k': 0.913836475419032, 'spread_hl_frac': 0.014420417169178664, 'bb_std_mult': 2.62250218681781, 'rsi_os': 41, 'rsi_ob': 83, 'vol_spike': 0.058808065142292774, 'adx_thresh': 30.638269878509558, 'atr_min_pct': 0.0030496865812627114, 'atr_max_pct': 0.11818155536040273, 'tp_mult': 1.7693260245207518, 'tsl_mult': 0.039118581744247885, 'strategy': 'breakout', 'time_stop': 242, 'use_sma': False, 'use_atr': False, 'use_adx': True, 'use_ema': False, 'use_spike': True, 'rsi_required': False, 'edge_k': 1.3989329380051228, 'edge_cap': 0.15114100643253037, 'bull_strategy': 'breakout', 'bull_bb_std_mult': 2.9596211473127236, 'bull_rsi_os': 43, 'bull_rsi_ob': 52, 'bull_adx_thresh': 6.955653127900648, 'bull_atr_min_pct': 0.003696669721128997, 'bull_atr_max_pct': 0.05919205138828422, 'bull_tp_mult': 1.4721382306452635, 'bull_tsl_mult': 0.3899051985321139, 'bull_time_stop': 45, 'bull_use_sma': True, 'bull_use_ema': False, 'bull_use_atr': False, 'bull_use_adx': False, 'bull_use_spike': False, 'bull_rsi_required': False, 'bear_strategy': 'mean_reversion', 'bear_bb_std_mult': 2.1266075287080546, 'bear_rsi_os': 39, 'bear_rsi_ob': 51, 'bear_adx_thresh': 5.632352682861939, 'bear_atr_min_pct': 0.006200093633900739, 'bear_atr_max_pct': 0.03807893744353065, 'bear_tp_mult': 2.219256608574185, 'bear_tsl_mult': 0.30261680721459505, 'bear_time_stop': 190, 'bear_use_sma': False, 'bear_use_ema': False, 'bear_use_atr': True, 'bear_use_adx': True, 'bear_use_spike': False, 'bear_rsi_required': False, 'sideways_strategy': 'breakout', 'sideways_bb_std_mult': 1.1328635338784063, 'sideways_rsi_os': 9, 'sideways_rsi_ob': 73, 'sideways_adx_thresh': 7.223476012956101, 'sideways_atr_min_pct': 0.029531331754071195, 'sideways_atr_max_pct': 0.010108059191986131, 'sideways_tp_mult': 1.2901156427178087, 'sideways_tsl_mult': 0.956976837706206, 'sideways_time_stop': 45, 'sideways_use_sma': False, 'sideways_use_ema': False, 'sideways_use_atr': True, 'sideways_use_adx': False, 'sideways_use_spike': True, 'sideways_rsi_required': False}.
[I 2025-09-01 08:38:11,667] Trial 441 finished with values: [0.007660539460904614, 0.002723657859466491] and parameters: {'p_sma': 29, 'p_std': 35, 'p_atr': 19, 'p_adx': 15, 'rsi_period': 51, 'ema1': 12, 'ema2': 11, 'slip_atr_k': 0.02023827804826571, 'slip_spread_k': 0.15447871844048827, 'spread_hl_frac': 0.024605433152502965, 'bb_std_mult': 2.384471595398119, 'rsi_os': 41, 'rsi_ob': 94, 'vol_spike': 0.058050649911795635, 'adx_thresh': 30.700641384755194, 'atr_min_pct': 0.005746989043723957, 'atr_max_pct': 0.11674050239536099, 'tp_mult': 1.5405172835283412, 'tsl_mult': 0.18205576429497455, 'strategy': 'breakout', 'time_stop': 43, 'use_sma': False, 'use_atr': False, 'use_adx': True, 'use_ema': False, 'use_spike': True, 'rsi_required': False, 'edge_k': 0.39289376913797225, 'edge_cap': 0.298978716446225, 'bull_strategy': 'breakout', 'bull_bb_std_mult': 2.8306419391435518, 'bull_rsi_os': 43, 'bull_rsi_ob': 57, 'bull_adx_thresh': 13.103367846889775, 'bull_atr_min_pct': 0.0039528959037528014, 'bull_atr_max_pct': 0.058272304201625914, 'bull_tp_mult': 1.4672642404739074, 'bull_tsl_mult': 0.9935869306156931, 'bull_time_stop': 69, 'bull_use_sma': True, 'bull_use_ema': True, 'bull_use_atr': False, 'bull_use_adx': False, 'bull_use_spike': False, 'bull_rsi_required': False, 'bear_strategy': 'mean_reversion', 'bear_bb_std_mult': 1.8578242908967881, 'bear_rsi_os': 44, 'bear_rsi_ob': 82, 'bear_adx_thresh': 6.105767543038198, 'bear_atr_min_pct': 0.006264236567465067, 'bear_atr_max_pct': 0.045667880232133286, 'bear_tp_mult': 2.4874403140511028, 'bear_tsl_mult': 0.08790717162243629, 'bear_time_stop': 262, 'bear_use_sma': False, 'bear_use_ema': False, 'bear_use_atr': True, 'bear_use_adx': True, 'bear_use_spike': False, 'bear_rsi_required': False, 'sideways_strategy': 'breakout', 'sideways_bb_std_mult': 1.4466162558066107, 'sideways_rsi_os': 10, 'sideways_rsi_ob': 95, 'sideways_adx_thresh': 12.268863683870812, 'sideways_atr_min_pct': 0.029482587379076566, 'sideways_atr_max_pct': 0.010032748485452436, 'sideways_tp_mult': 1.2543677989009143, 'sideways_tsl_mult': 0.5833980266670834, 'sideways_time_stop': 156, 'sideways_use_sma': False, 'sideways_use_ema': False, 'sideways_use_atr': True, 'sideways_use_adx': False, 'sideways_use_spike': True, 'sideways_rsi_required': False}.
