[I 2025-09-01 07:47:54,259] Trial 163 finished with values: [-1000000000.0, 1000000000.0] and parameters: {'p_sma': 31, 'p_std': 43, 'p_atr': 19, 'p_adx': 11, 'rsi_period': 63, 'ema1': 14, 'ema2': 59, 'slip_atr_k': 0.023262357819625296, 'slip_spread_k': 0.4466541215665056, 'spread_hl_frac': 0.02655527448704785, 'bb_std_mult': 2.4805024822898254, 'rsi_os': 47, 'rsi_ob': 82, 'vol_spike': 0.006956309876183037, 'adx_thresh': 31.065067456314367, 'atr_min_pct': 0.01563744129181592, 'atr_max_pct': 0.03946569089993315, 'tp_mult': 2.8601521420656484, 'tsl_mult': 0.2884845992909591, 'strategy': 'breakout', 'time_stop': 90, 'use_sma': False, 'use_atr': False, 'use_adx': True, 'use_ema': False, 'use_spike': False, 'rsi_required': False, 'edge_k': 1.8240035494709264, 'edge_cap': 0.16633516455160044, 'bull_strategy': 'breakout', 'bull_bb_std_mult': 2.720310185113353, 'bull_rsi_os': 13, 'bull_rsi_ob': 88, 'bull_adx_thresh': 20.27735418737162, 'bull_atr_min_pct': 0.004165637966327507, 'bull_atr_max_pct': 0.14765793924077597, 'bull_tp_mult': 1.3123196268835406, 'bull_tsl_mult': 0.46241318900479067, 'bull_time_stop': 37, 'bull_use_sma': True, 'bull_use_ema': False, 'bull_use_atr': False, 'bull_use_adx': False, 'bull_use_spike': False, 'bull_rsi_required': False, 'bear_strategy': 'mean_reversion', 'bear_bb_std_mult': 2.0855058765883805, 'bear_rsi_os': 20, 'bear_rsi_ob': 59, 'bear_adx_thresh': 17.200361397833095, 'bear_atr_min_pct': 0.012423297071136907, 'bear_atr_max_pct': 0.10763458862340436, 'bear_tp_mult': 1.4205304830415988, 'bear_tsl_mult': 0.03045358238735274, 'bear_time_stop': 286, 'bear_use_sma': True, 'bear_use_ema': True, 'bear_use_atr': False, 'bear_use_adx': False, 'bear_use_spike': False, 'bear_rsi_required': False, 'sideways_strategy': 'breakout', 'sideways_bb_std_mult': 1.0213579576353184, 'sideways_rsi_os': 51, 'sideways_rsi_ob': 46, 'sideways_adx_thresh': 17.976130416953232, 'sideways_atr_min_pct': 0.026099956001377315, 'sideways_atr_max_pct': 0.10591183293929893, 'sideways_tp_mult': 2.1604004908591032, 'sideways_tsl_mult': 0.15667556425444779, 'sideways_time_stop': 175, 'sideways_use_sma': False, 'sideways_use_ema': False, 'sideways_use_atr': True, 'sideways_use_adx': True, 'sideways_use_spike': False, 'sideways_rsi_required': False}.
[I 2025-09-01 07:47:54,976] Trial 164 finished with values: [-1000000000.0, 1000000000.0] and parameters: {'p_sma': 44, 'p_std': 42, 'p_atr': 19, 'p_adx': 15, 'rsi_period': 75, 'ema1': 12, 'ema2': 59, 'slip_atr_k': 0.024792048955085536, 'slip_spread_k': 0.4718512992744527, 'spread_hl_frac': 0.010211967853770284, 'bb_std_mult': 2.4957375911333948, 'rsi_os': 47, 'rsi_ob': 80, 'vol_spike': 0.015123116964484595, 'adx_thresh': 33.007713421143556, 'atr_min_pct': 0.028018287554667946, 'atr_max_pct': 0.11485450572384241, 'tp_mult': 1.6524161172812062, 'tsl_mult': 0.9500005018826464, 'strategy': 'breakout', 'time_stop': 92, 'use_sma': False, 'use_atr': False, 'use_adx': True, 'use_ema': False, 'use_spike': False, 'rsi_required': False, 'edge_k': 1.9066225099760072, 'edge_cap': 0.16816306888937044, 'bull_strategy': 'breakout', 'bull_bb_std_mult': 0.9190698001621704, 'bull_rsi_os': 13, 'bull_rsi_ob': 87, 'bull_adx_thresh': 24.746171026159132, 'bull_atr_min_pct': 0.004309187684914991, 'bull_atr_max_pct': 0.04200547769396111, 'bull_tp_mult': 1.0758854231371229, 'bull_tsl_mult': 0.454294068646361, 'bull_time_stop': 113, 'bull_use_sma': True, 'bull_use_ema': True, 'bull_use_atr': False, 'bull_use_adx': False, 'bull_use_spike': False, 'bull_rsi_required': False, 'bear_strategy': 'mean_reversion', 'bear_bb_std_mult': 2.0721733811444762, 'bear_rsi_os': 55, 'bear_rsi_ob': 60, 'bear_adx_thresh': 27.307294724268722, 'bear_atr_min_pct': 0.009210707813735864, 'bear_atr_max_pct': 0.09893899783982237, 'bear_tp_mult': 1.3836838349833278, 'bear_tsl_mult': 0.08410045700604132, 'bear_time_stop': 129, 'bear_use_sma': True, 'bear_use_ema': False, 'bear_use_atr': False, 'bear_use_adx': False, 'bear_use_spike': False, 'bear_rsi_required': False, 'sideways_strategy': 'breakout', 'sideways_bb_std_mult': 0.9894967282680907, 'sideways_rsi_os': 41, 'sideways_rsi_ob': 46, 'sideways_adx_thresh': 16.000267515268146, 'sideways_atr_min_pct': 0.017370363617416777, 'sideways_atr_max_pct': 0.01314282654549511, 'sideways_tp_mult': 2.1596465709176145, 'sideways_tsl_mult': 0.14098279960791602, 'sideways_time_stop': 94, 'sideways_use_sma': False, 'sideways_use_ema': False, 'sideways_use_atr': True, 'sideways_use_adx': True, 'sideways_use_spike': False, 'sideways_rsi_required': False}.
[I 2025-09-01 07:47:55,184] Trial 160 finished with values: [-0.011194324472697526, 0.011857971176764829] and parameters: {'p_sma': 31, 'p_std': 39, 'p_atr': 20, 'p_adx': 11, 'rsi_period': 16, 'ema1': 13, 'ema2': 24, 'slip_atr_k': 0.022392782165440606, 'slip_spread_k': 0.47232044754123537, 'spread_hl_frac': 0.02597194041083469, 'bb_std_mult': 2.497906764568002, 'rsi_os': 46, 'rsi_ob': 82, 'vol_spike': 0.0067725433891543795, 'adx_thresh': 33.89503881493899, 'atr_min_pct': 0.002753907943943862, 'atr_max_pct': 0.015576160163724193, 'tp_mult': 2.954850002395558, 'tsl_mult': 0.9455099660710795, 'strategy': 'breakout', 'time_stop': 201, 'use_sma': False, 'use_atr': False, 'use_adx': True, 'use_ema': True, 'use_spike': True, 'rsi_required': False, 'edge_k': 1.9006781930284222, 'edge_cap': 0.8797743865265982, 'bull_strategy': 'breakout', 'bull_bb_std_mult': 2.353339281685133, 'bull_rsi_os': 13, 'bull_rsi_ob': 87, 'bull_adx_thresh': 26.56106700945613, 'bull_atr_min_pct': 0.004743197141525811, 'bull_atr_max_pct': 0.05977326425117439, 'bull_tp_mult': 1.0610203444554027, 'bull_tsl_mult': 0.43177763569917754, 'bull_time_stop': 85, 'bull_use_sma': True, 'bull_use_ema': True, 'bull_use_atr': False, 'bull_use_adx': False, 'bull_use_spike': False, 'bull_rsi_required': False, 'bear_strategy': 'mean_reversion', 'bear_bb_std_mult': 3.5351149832401836, 'bear_rsi_os': 55, 'bear_rsi_ob': 63, 'bear_adx_thresh': 32.57747613840614, 'bear_atr_min_pct': 0.009376959467555854, 'bear_atr_max_pct': 0.09906692418178493, 'bear_tp_mult': 1.3989278374752379, 'bear_tsl_mult': 0.012205182361198691, 'bear_time_stop': 259, 'bear_use_sma': True, 'bear_use_ema': False, 'bear_use_atr': False, 'bear_use_adx': False, 'bear_use_spike': False, 'bear_rsi_required': True, 'sideways_strategy': 'breakout', 'sideways_bb_std_mult': 0.9960600939086983, 'sideways_rsi_os': 41, 'sideways_rsi_ob': 49, 'sideways_adx_thresh': 14.449200138952765, 'sideways_atr_min_pct': 0.0027695112318483883, 'sideways_atr_max_pct': 0.07407203262831698, 'sideways_tp_mult': 2.0897873073690136, 'sideways_tsl_mult': 0.1836766213059281, 'sideways_time_stop': 88, 'sideways_use_sma': False, 'sideways_use_ema': True, 'sideways_use_atr': True, 'sideways_use_adx': True, 'sideways_use_spike': False, 'sideways_rsi_required': False}.
[I 2025-09-01 07:48:37,518] Trial 166 finished with values: [-1000000000.0, 1000000000.0] and parameters: {'p_sma': 46, 'p_std': 40, 'p_atr': 19, 'p_adx': 14, 'rsi_period': 42, 'ema1': 12, 'ema2': 12, 'slip_atr_k': 0.008019577262350894, 'slip_spread_k': 0.47252150586391106, 'spread_hl_frac': 0.02796389348868894, 'bb_std_mult': 2.9698198360379635, 'rsi_os': 40, 'rsi_ob': 80, 'vol_spike': 0.018558595628955718, 'adx_thresh': 5.979253446057697, 'atr_min_pct': 0.027106805388980068, 'atr_max_pct': 0.11406928785590534, 'tp_mult': 2.741781714977063, 'tsl_mult': 0.9375403242695828, 'strategy': 'breakout', 'time_stop': 111, 'use_sma': False, 'use_atr': False, 'use_adx': True, 'use_ema': False, 'use_spike': False, 'rsi_required': False, 'edge_k': 1.9261380354657114, 'edge_cap': 0.8844423443813214, 'bull_strategy': 'breakout', 'bull_bb_std_mult': 2.5706234748903265, 'bull_rsi_os': 17, 'bull_rsi_ob': 55, 'bull_adx_thresh': 30.915854970148146, 'bull_atr_min_pct': 0.0294532713053298, 'bull_atr_max_pct': 0.05920267537225622, 'bull_tp_mult': 1.6438656940724976, 'bull_tsl_mult': 0.4604632317837752, 'bull_time_stop': 46, 'bull_use_sma': True, 'bull_use_ema': True, 'bull_use_atr': False, 'bull_use_adx': False, 'bull_use_spike': False, 'bull_rsi_required': False, 'bear_strategy': 'mean_reversion', 'bear_bb_std_mult': 3.5356265463697865, 'bear_rsi_os': 53, 'bear_rsi_ob': 76, 'bear_adx_thresh': 17.71578684964679, 'bear_atr_min_pct': 0.006093919979003203, 'bear_atr_max_pct': 0.09839148577796666, 'bear_tp_mult': 2.254486794858309, 'bear_tsl_mult': 0.08247819245834583, 'bear_time_stop': 274, 'bear_use_sma': True, 'bear_use_ema': False, 'bear_use_atr': False, 'bear_use_adx': False, 'bear_use_spike': False, 'bear_rsi_required': False, 'sideways_strategy': 'breakout', 'sideways_bb_std_mult': 0.9241699749245951, 'sideways_rsi_os': 15, 'sideways_rsi_ob': 46, 'sideways_adx_thresh': 15.660754824682181, 'sideways_atr_min_pct': 0.01658364598012907, 'sideways_atr_max_pct': 0.09926645421729596, 'sideways_tp_mult': 1.2073074199566196, 'sideways_tsl_mult': 0.19742426368113755, 'sideways_time_stop': 91, 'sideways_use_sma': False, 'sideways_use_ema': False, 'sideways_use_atr': True, 'sideways_use_adx': True, 'sideways_use_spike': False, 'sideways_rsi_required': False}.
[I 2025-09-01 07:48:37,504] Trial 165 finished with values: [-1000000000.0, 1000000000.0] and parameters: {'p_sma': 46, 'p_std': 43, 'p_atr': 19, 'p_adx': 15, 'rsi_period': 64, 'ema1': 12, 'ema2': 34, 'slip_atr_k': 0.0075755839934385436, 'slip_spread_k': 0.47549983144722685, 'spread_hl_frac': 0.028123509931417982, 'bb_std_mult': 2.4939640391826323, 'rsi_os': 45, 'rsi_ob': 80, 'vol_spike': 0.011085998725284471, 'adx_thresh': 31.167694608228757, 'atr_min_pct': 0.027889451477198523, 'atr_max_pct': 0.11507310208455476, 'tp_mult': 1.6496825079187818, 'tsl_mult': 0.49512120500542317, 'strategy': 'breakout', 'time_stop': 93, 'use_sma': False, 'use_atr': False, 'use_adx': True, 'use_ema': False, 'use_spike': False, 'rsi_required': False, 'edge_k': 1.9162808386243961, 'edge_cap': 0.17812493109822272, 'bull_strategy': 'breakout', 'bull_bb_std_mult': 1.32814595165056, 'bull_rsi_os': 13, 'bull_rsi_ob': 55, 'bull_adx_thresh': 24.586360165800702, 'bull_atr_min_pct': 0.003945908969347115, 'bull_atr_max_pct': 0.041341033165700564, 'bull_tp_mult': 1.301034260454886, 'bull_tsl_mult': 0.46586190049028153, 'bull_time_stop': 113, 'bull_use_sma': True, 'bull_use_ema': False, 'bull_use_atr': False, 'bull_use_adx': False, 'bull_use_spike': False, 'bull_rsi_required': False, 'bear_strategy': 'mean_reversion', 'bear_bb_std_mult': 2.0768503495676134, 'bear_rsi_os': 55, 'bear_rsi_ob': 75, 'bear_adx_thresh': 17.94272744983637, 'bear_atr_min_pct': 0.005950300403884943, 'bear_atr_max_pct': 0.10789566738943149, 'bear_tp_mult': 1.4154064084073208, 'bear_tsl_mult': 0.09424647843293735, 'bear_time_stop': 127, 'bear_use_sma': True, 'bear_use_ema': True, 'bear_use_atr': False, 'bear_use_adx': False, 'bear_use_spike': False, 'bear_rsi_required': False, 'sideways_strategy': 'breakout', 'sideways_bb_std_mult': 1.2199716890359944, 'sideways_rsi_os': 42, 'sideways_rsi_ob': 46, 'sideways_adx_thresh': 15.882501094146235, 'sideways_atr_min_pct': 0.016548590086649943, 'sideways_atr_max_pct': 0.10451121687175388, 'sideways_tp_mult': 1.181769791255387, 'sideways_tsl_mult': 0.15205544802178422, 'sideways_time_stop': 172, 'sideways_use_sma': False, 'sideways_use_ema': False, 'sideways_use_atr': True, 'sideways_use_adx': True, 'sideways_use_spike': False, 'sideways_rsi_required': False}.
[I 2025-09-01 07:48:38,009] Trial 168 finished with values: [-1000000000.0, 1000000000.0] and parameters: {'p_sma': 11, 'p_std': 9, 'p_atr': 19, 'p_adx': 14, 'rsi_period': 43, 'ema1': 11, 'ema2': 10, 'slip_atr_k': 0.03336520559879884, 'slip_spread_k': 0.4920627661977296, 'spread_hl_frac': 0.02930113452102837, 'bb_std_mult': 2.983395694966439, 'rsi_os': 40, 'rsi_ob': 54, 'vol_spike': 0.022160557045071867, 'adx_thresh': 31.949285640427586, 'atr_min_pct': 0.023186597440987555, 'atr_max_pct': 0.14936176100903184, 'tp_mult': 1.6321068114522257, 'tsl_mult': 0.2141753008873215, 'strategy': 'mean_reversion', 'time_stop': 131, 'use_sma': True, 'use_atr': False, 'use_adx': True, 'use_ema': False, 'use_spike': False, 'rsi_required': False, 'edge_k': 1.909298077621482, 'edge_cap': 0.1781239216474427, 'bull_strategy': 'breakout', 'bull_bb_std_mult': 1.3212951943312594, 'bull_rsi_os': 11, 'bull_rsi_ob': 73, 'bull_adx_thresh': 22.45737853048157, 'bull_atr_min_pct': 0.029636623852466563, 'bull_atr_max_pct': 0.11499695848620686, 'bull_tp_mult': 1.2878894744974596, 'bull_tsl_mult': 0.508115221905572, 'bull_time_stop': 47, 'bull_use_sma': True, 'bull_use_ema': True, 'bull_use_atr': True, 'bull_use_adx': True, 'bull_use_spike': False, 'bull_rsi_required': False, 'bear_strategy': 'mean_reversion', 'bear_bb_std_mult': 2.02372874666862, 'bear_rsi_os': 53, 'bear_rsi_ob': 61, 'bear_adx_thresh': 15.460242004090592, 'bear_atr_min_pct': 0.009862639388978326, 'bear_atr_max_pct': 0.09060483691879517, 'bear_tp_mult': 1.2391193557901192, 'bear_tsl_mult': 0.6833934257920834, 'bear_time_stop': 45, 'bear_use_sma': True, 'bear_use_ema': True, 'bear_use_atr': False, 'bear_use_adx': False, 'bear_use_spike': True, 'bear_rsi_required': False, 'sideways_strategy': 'breakout', 'sideways_bb_std_mult': 0.6646741468766311, 'sideways_rsi_os': 14, 'sideways_rsi_ob': 47, 'sideways_adx_thresh': 15.684540621075715, 'sideways_atr_min_pct': 0.01776596695770992, 'sideways_atr_max_pct': 0.09983311020485479, 'sideways_tp_mult': 1.1929749043792857, 'sideways_tsl_mult': 0.879941468390682, 'sideways_time_stop': 100, 'sideways_use_sma': False, 'sideways_use_ema': False, 'sideways_use_atr': True, 'sideways_use_adx': True, 'sideways_use_spike': False, 'sideways_rsi_required': False}.
[I 2025-09-01 07:48:38,239] Trial 167 finished with values: [-1000000000.0, 1000000000.0] and parameters: {'p_sma': 14, 'p_std': 40, 'p_atr': 21, 'p_adx': 14, 'rsi_period': 44, 'ema1': 11, 'ema2': 34, 'slip_atr_k': 0.008465238972889325, 'slip_spread_k': 0.9100489699971777, 'spread_hl_frac': 0.02821678432111137, 'bb_std_mult': 2.3987081672759794, 'rsi_os': 40, 'rsi_ob': 54, 'vol_spike': 0.020016654244433673, 'adx_thresh': 9.681773100503015, 'atr_min_pct': 0.002714511029848099, 'atr_max_pct': 0.11286242295323051, 'tp_mult': 1.5785502620915477, 'tsl_mult': 0.7391258605184432, 'strategy': 'breakout', 'time_stop': 111, 'use_sma': False, 'use_atr': False, 'use_adx': True, 'use_ema': False, 'use_spike': False, 'rsi_required': False, 'edge_k': 1.921021269813084, 'edge_cap': 0.7430853141555204, 'bull_strategy': 'breakout', 'bull_bb_std_mult': 2.66023908395712, 'bull_rsi_os': 16, 'bull_rsi_ob': 55, 'bull_adx_thresh': 32.23798994722185, 'bull_atr_min_pct': 0.0026078520794674672, 'bull_atr_max_pct': 0.05914455422707927, 'bull_tp_mult': 1.4246104632929457, 'bull_tsl_mult': 0.5059815486830277, 'bull_time_stop': 24, 'bull_use_sma': True, 'bull_use_ema': True, 'bull_use_atr': False, 'bull_use_adx': False, 'bull_use_spike': False, 'bull_rsi_required': False, 'bear_strategy': 'mean_reversion', 'bear_bb_std_mult': 2.344668665885923, 'bear_rsi_os': 51, 'bear_rsi_ob': 65, 'bear_adx_thresh': 17.620926256373725, 'bear_atr_min_pct': 0.00616366239213216, 'bear_atr_max_pct': 0.13987738590348603, 'bear_tp_mult': 1.2234617922418771, 'bear_tsl_mult': 0.1568130766260546, 'bear_time_stop': 229, 'bear_use_sma': True, 'bear_use_ema': False, 'bear_use_atr': False, 'bear_use_adx': False, 'bear_use_spike': False, 'bear_rsi_required': False, 'sideways_strategy': 'breakout', 'sideways_bb_std_mult': 0.930635437705357, 'sideways_rsi_os': 32, 'sideways_rsi_ob': 84, 'sideways_adx_thresh': 15.13586212349192, 'sideways_atr_min_pct': 0.016486008915342455, 'sideways_atr_max_pct': 0.016734967387298363, 'sideways_tp_mult': 2.1023713437217375, 'sideways_tsl_mult': 0.19238557776639947, 'sideways_time_stop': 78, 'sideways_use_sma': False, 'sideways_use_ema': False, 'sideways_use_atr': True, 'sideways_use_adx': True, 'sideways_use_spike': False, 'sideways_rsi_required': False}.
[I 2025-09-01 07:48:38,717] Trial 170 finished with values: [-1000000000.0, 1000000000.0] and parameters: {'p_sma': 11, 'p_std': 9, 'p_atr': 21, 'p_adx': 16, 'rsi_period': 15, 'ema1': 11, 'ema2': 29, 'slip_atr_k': 0.0329016743696464, 'slip_spread_k': 0.8939295325105368, 'spread_hl_frac': 0.012975991616253584, 'bb_std_mult': 2.827294768785651, 'rsi_os': 49, 'rsi_ob': 49, 'vol_spike': 0.004474706355263482, 'adx_thresh': 31.87043019115963, 'atr_min_pct': 0.02680387156791708, 'atr_max_pct': 0.11013428681849656, 'tp_mult': 2.6298125162879704, 'tsl_mult': 0.7788882603532363, 'strategy': 'mean_reversion', 'time_stop': 130, 'use_sma': True, 'use_atr': True, 'use_adx': True, 'use_ema': False, 'use_spike': False, 'rsi_required': False, 'edge_k': 1.959430934113502, 'edge_cap': 0.12887424003424633, 'bull_strategy': 'mean_reversion', 'bull_bb_std_mult': 2.658161606858132, 'bull_rsi_os': 14, 'bull_rsi_ob': 73, 'bull_adx_thresh': 20.677956413408143, 'bull_atr_min_pct': 0.02053571038463908, 'bull_atr_max_pct': 0.05326958243394941, 'bull_tp_mult': 1.404460171657107, 'bull_tsl_mult': 0.5004797462473222, 'bull_time_stop': 23, 'bull_use_sma': True, 'bull_use_ema': True, 'bull_use_atr': True, 'bull_use_adx': True, 'bull_use_spike': False, 'bull_rsi_required': False, 'bear_strategy': 'mean_reversion', 'bear_bb_std_mult': 0.751436970488002, 'bear_rsi_os': 44, 'bear_rsi_ob': 65, 'bear_adx_thresh': 24.97040557472878, 'bear_atr_min_pct': 0.01103814088363061, 'bear_atr_max_pct': 0.12122033378557846, 'bear_tp_mult': 2.0061795726845233, 'bear_tsl_mult': 0.7388627240280823, 'bear_time_stop': 184, 'bear_use_sma': True, 'bear_use_ema': False, 'bear_use_atr': False, 'bear_use_adx': True, 'bear_use_spike': True, 'bear_rsi_required': False, 'sideways_strategy': 'breakout', 'sideways_bb_std_mult': 2.0586292672506623, 'sideways_rsi_os': 44, 'sideways_rsi_ob': 77, 'sideways_adx_thresh': 18.975355938518536, 'sideways_atr_min_pct': 0.027625007646144218, 'sideways_atr_max_pct': 0.010070396225315173, 'sideways_tp_mult': 2.670561824514408, 'sideways_tsl_mult': 0.23009706513424777, 'sideways_time_stop': 78, 'sideways_use_sma': False, 'sideways_use_ema': False, 'sideways_use_atr': False, 'sideways_use_adx': True, 'sideways_use_spike': False, 'sideways_rsi_required': False}.
[I 2025-09-01 07:49:18,058] Trial 171 finished with values: [-1000000000.0, 1000000000.0] and parameters: {'p_sma': 40, 'p_std': 45, 'p_atr': 21, 'p_adx': 16, 'rsi_period': 15, 'ema1': 25, 'ema2': 30, 'slip_atr_k': 0.04032916663300126, 'slip_spread_k': 0.5545595151752748, 'spread_hl_frac': 0.02128566822322002, 'bb_std_mult': 2.8117959489839675, 'rsi_os': 49, 'rsi_ob': 86, 'vol_spike': 0.037577680764619786, 'adx_thresh': 9.68500291501909, 'atr_min_pct': 0.0054886708087836175, 'atr_max_pct': 0.11066480186141539, 'tp_mult': 2.9543217276086313, 'tsl_mult': 0.5410562010677185, 'strategy': 'breakout', 'time_stop': 65, 'use_sma': True, 'use_atr': True, 'use_adx': True, 'use_ema': False, 'use_spike': False, 'rsi_required': False, 'edge_k': 1.8290741229857994, 'edge_cap': 0.7265389323008108, 'bull_strategy': 'mean_reversion', 'bull_bb_std_mult': 1.0800247992838896, 'bull_rsi_os': 18, 'bull_rsi_ob': 56, 'bull_adx_thresh': 21.137461236222173, 'bull_atr_min_pct': 0.002745245035804189, 'bull_atr_max_pct': 0.0529648474047867, 'bull_tp_mult': 1.371069637298631, 'bull_tsl_mult': 0.4225000411735801, 'bull_time_stop': 29, 'bull_use_sma': True, 'bull_use_ema': True, 'bull_use_atr': False, 'bull_use_adx': False, 'bull_use_spike': False, 'bull_rsi_required': False, 'bear_strategy': 'mean_reversion', 'bear_bb_std_mult': 2.358252340911169, 'bear_rsi_os': 51, 'bear_rsi_ob': 62, 'bear_adx_thresh': 10.625004633870406, 'bear_atr_min_pct': 0.01098121920045499, 'bear_atr_max_pct': 0.11986710632365322, 'bear_tp_mult': 1.3124255666059068, 'bear_tsl_mult': 0.20017481844503765, 'bear_time_stop': 91, 'bear_use_sma': True, 'bear_use_ema': False, 'bear_use_atr': False, 'bear_use_adx': True, 'bear_use_spike': False, 'bear_rsi_required': False, 'sideways_strategy': 'breakout', 'sideways_bb_std_mult': 1.1308978338152715, 'sideways_rsi_os': 25, 'sideways_rsi_ob': 84, 'sideways_adx_thresh': 14.817767873023733, 'sideways_atr_min_pct': 0.01486292931345116, 'sideways_atr_max_pct': 0.015886616788507436, 'sideways_tp_mult': 2.8290457576936445, 'sideways_tsl_mult': 0.22246551474659132, 'sideways_time_stop': 243, 'sideways_use_sma': False, 'sideways_use_ema': False, 'sideways_use_atr': False, 'sideways_use_adx': True, 'sideways_use_spike': False, 'sideways_rsi_required': False}.
