[I 2025-09-01 09:01:44,541] Trial 585 finished with values: [-1000000000.0, 1000000000.0] and parameters: {'p_sma': 36, 'p_std': 34, 'p_atr': 20, 'p_adx': 18, 'rsi_period': 38, 'ema1': 9, 'ema2': 59, 'slip_atr_k': 0.005622432022587661, 'slip_spread_k': 0.1791120351891368, 'spread_hl_frac': 0.00409826083896838, 'bb_std_mult': 2.6524076678112833, 'rsi_os': 48, 'rsi_ob': 95, 'vol_spike': 0.00784988829051725, 'adx_thresh': 33.39418559873478, 'atr_min_pct': 0.006587173349616109, 'atr_max_pct': 0.09552540112732752, 'tp_mult': 1.2315814731353638, 'tsl_mult': 0.18886951224048426, 'strategy': 'mean_reversion', 'time_stop': 51, 'use_sma': False, 'use_atr': False, 'use_adx': False, 'use_ema': False, 'use_spike': False, 'rsi_required': False, 'edge_k': 0.8364863761166237, 'edge_cap': 0.3571862706785461, 'bull_strategy': 'breakout', 'bull_bb_std_mult': 1.4096293754477713, 'bull_rsi_os': 10, 'bull_rsi_ob': 53, 'bull_adx_thresh': 12.155486974183779, 'bull_atr_min_pct': 0.01257915404700594, 'bull_atr_max_pct': 0.12484099204342305, 'bull_tp_mult': 1.9400502320593591, 'bull_tsl_mult': 0.2619294195699622, 'bull_time_stop': 178, 'bull_use_sma': False, 'bull_use_ema': True, 'bull_use_atr': True, 'bull_use_adx': True, 'bull_use_spike': True, 'bull_rsi_required': True, 'bear_strategy': 'breakout', 'bear_bb_std_mult': 3.3123480834581907, 'bear_rsi_os': 32, 'bear_rsi_ob': 89, 'bear_adx_thresh': 13.873486789635114, 'bear_atr_min_pct': 0.014510914383647768, 'bear_atr_max_pct': 0.06483669167296863, 'bear_tp_mult': 2.634326507044971, 'bear_tsl_mult': 0.5501673772545275, 'bear_time_stop': 224, 'bear_use_sma': False, 'bear_use_ema': True, 'bear_use_atr': True, 'bear_use_adx': True, 'bear_use_spike': True, 'bear_rsi_required': True, 'sideways_strategy': 'breakout', 'sideways_bb_std_mult': 1.4154955132759135, 'sideways_rsi_os': 10, 'sideways_rsi_ob': 62, 'sideways_adx_thresh': 11.133376529450969, 'sideways_atr_min_pct': 0.008375387982338353, 'sideways_atr_max_pct': 0.08318734004816764, 'sideways_tp_mult': 2.429541889919377, 'sideways_tsl_mult': 0.5937740874184618, 'sideways_time_stop': 144, 'sideways_use_sma': False, 'sideways_use_ema': False, 'sideways_use_atr': True, 'sideways_use_adx': False, 'sideways_use_spike': True, 'sideways_rsi_required': True}.
[I 2025-09-01 09:02:26,628] Trial 586 finished with values: [-1000000000.0, 1000000000.0] and parameters: {'p_sma': 5, 'p_std': 34, 'p_atr': 26, 'p_adx': 15, 'rsi_period': 11, 'ema1': 22, 'ema2': 34, 'slip_atr_k': 0.1171631583473485, 'slip_spread_k': 0.17525667476163803, 'spread_hl_frac': 0.00858463738788012, 'bb_std_mult': 2.660302944036584, 'rsi_os': 48, 'rsi_ob': 60, 'vol_spike': 0.007159496299255545, 'adx_thresh': 34.310477498122445, 'atr_min_pct': 0.01113570857710489, 'atr_max_pct': 0.09331643006335738, 'tp_mult': 1.2259925211822345, 'tsl_mult': 0.19150419350202888, 'strategy': 'mean_reversion', 'time_stop': 53, 'use_sma': False, 'use_atr': True, 'use_adx': False, 'use_ema': False, 'use_spike': False, 'rsi_required': False, 'edge_k': 0.8345987418339231, 'edge_cap': 0.35354538621918696, 'bull_strategy': 'mean_reversion', 'bull_bb_std_mult': 2.430243440903865, 'bull_rsi_os': 38, 'bull_rsi_ob': 53, 'bull_adx_thresh': 9.542241046573773, 'bull_atr_min_pct': 0.021093800583898092, 'bull_atr_max_pct': 0.11867295230580684, 'bull_tp_mult': 1.1921923865669688, 'bull_tsl_mult': 0.7697476135947803, 'bull_time_stop': 260, 'bull_use_sma': False, 'bull_use_ema': True, 'bull_use_atr': True, 'bull_use_adx': True, 'bull_use_spike': True, 'bull_rsi_required': True, 'bear_strategy': 'breakout', 'bear_bb_std_mult': 3.4603820507659186, 'bear_rsi_os': 44, 'bear_rsi_ob': 89, 'bear_adx_thresh': 12.997740691260812, 'bear_atr_min_pct': 0.0007940772953442445, 'bear_atr_max_pct': 0.04473669145051094, 'bear_tp_mult': 1.4150866802621933, 'bear_tsl_mult': 0.23441183803470764, 'bear_time_stop': 224, 'bear_use_sma': False, 'bear_use_ema': True, 'bear_use_atr': True, 'bear_use_adx': True, 'bear_use_spike': True, 'bear_rsi_required': True, 'sideways_strategy': 'breakout', 'sideways_bb_std_mult': 2.7245035257607904, 'sideways_rsi_os': 10, 'sideways_rsi_ob': 62, 'sideways_adx_thresh': 12.125399314299314, 'sideways_atr_min_pct': 0.008378482035281064, 'sideways_atr_max_pct': 0.08045350528521729, 'sideways_tp_mult': 2.825283943601021, 'sideways_tsl_mult': 0.5056418253999171, 'sideways_time_stop': 148, 'sideways_use_sma': False, 'sideways_use_ema': False, 'sideways_use_atr': True, 'sideways_use_adx': False, 'sideways_use_spike': True, 'sideways_rsi_required': True}.
[I 2025-09-01 09:02:27,641] Trial 587 finished with values: [-1000000000.0, 1000000000.0] and parameters: {'p_sma': 5, 'p_std': 34, 'p_atr': 20, 'p_adx': 7, 'rsi_period': 43, 'ema1': 22, 'ema2': 49, 'slip_atr_k': 0.17281037406580196, 'slip_spread_k': 0.7551205889016732, 'spread_hl_frac': 0.004371141085352519, 'bb_std_mult': 3.5051982269925075, 'rsi_os': 48, 'rsi_ob': 71, 'vol_spike': 0.2741793058110182, 'adx_thresh': 16.189125943074494, 'atr_min_pct': 0.016210131879925087, 'atr_max_pct': 0.08744520717931378, 'tp_mult': 1.2824492007819719, 'tsl_mult': 0.44645389679183184, 'strategy': 'mean_reversion', 'time_stop': 48, 'use_sma': False, 'use_atr': True, 'use_adx': False, 'use_ema': False, 'use_spike': False, 'rsi_required': False, 'edge_k': 1.6986729641963523, 'edge_cap': 0.563849018929945, 'bull_strategy': 'mean_reversion', 'bull_bb_std_mult': 2.4182406336840434, 'bull_rsi_os': 38, 'bull_rsi_ob': 53, 'bull_adx_thresh': 11.309942483778723, 'bull_atr_min_pct': 0.012618841382580933, 'bull_atr_max_pct': 0.1448341713092282, 'bull_tp_mult': 1.1410455025294184, 'bull_tsl_mult': 0.9424086884972405, 'bull_time_stop': 178, 'bull_use_sma': False, 'bull_use_ema': False, 'bull_use_atr': True, 'bull_use_adx': True, 'bull_use_spike': True, 'bull_rsi_required': True, 'bear_strategy': 'breakout', 'bear_bb_std_mult': 3.407319860766475, 'bear_rsi_os': 40, 'bear_rsi_ob': 89, 'bear_adx_thresh': 11.909314278826637, 'bear_atr_min_pct': 0.006619176699686783, 'bear_atr_max_pct': 0.04768944711572025, 'bear_tp_mult': 1.4915102900798862, 'bear_tsl_mult': 0.19429420143764015, 'bear_time_stop': 226, 'bear_use_sma': False, 'bear_use_ema': True, 'bear_use_atr': True, 'bear_use_adx': True, 'bear_use_spike': True, 'bear_rsi_required': True, 'sideways_strategy': 'mean_reversion', 'sideways_bb_std_mult': 1.308222072370649, 'sideways_rsi_os': 11, 'sideways_rsi_ob': 62, 'sideways_adx_thresh': 12.229463962784026, 'sideways_atr_min_pct': 0.0023186594051993383, 'sideways_atr_max_pct': 0.08164537530036312, 'sideways_tp_mult': 2.834865896868658, 'sideways_tsl_mult': 0.5911488176137084, 'sideways_time_stop': 139, 'sideways_use_sma': False, 'sideways_use_ema': False, 'sideways_use_atr': True, 'sideways_use_adx': False, 'sideways_use_spike': True, 'sideways_rsi_required': True}.
[I 2025-09-01 09:02:28,029] Trial 589 finished with values: [-1000000000.0, 1000000000.0] and parameters: {'p_sma': 40, 'p_std': 40, 'p_atr': 26, 'p_adx': 15, 'rsi_period': 42, 'ema1': 22, 'ema2': 45, 'slip_atr_k': 0.01719227121601101, 'slip_spread_k': 0.766073311956664, 'spread_hl_frac': 0.021069104092842045, 'bb_std_mult': 2.6047617504035574, 'rsi_os': 46, 'rsi_ob': 60, 'vol_spike': 0.019760658872047126, 'adx_thresh': 34.21048695268107, 'atr_min_pct': 0.011368050203059078, 'atr_max_pct': 0.06956784228538958, 'tp_mult': 1.2720115927000957, 'tsl_mult': 0.3524693046724512, 'strategy': 'mean_reversion', 'time_stop': 43, 'use_sma': False, 'use_atr': True, 'use_adx': False, 'use_ema': False, 'use_spike': False, 'rsi_required': False, 'edge_k': 0.8470597115528208, 'edge_cap': 0.584348035992927, 'bull_strategy': 'mean_reversion', 'bull_bb_std_mult': 1.6744112021936333, 'bull_rsi_os': 38, 'bull_rsi_ob': 53, 'bull_adx_thresh': 9.54309208875587, 'bull_atr_min_pct': 0.018592168423885943, 'bull_atr_max_pct': 0.09586741860819291, 'bull_tp_mult': 1.148539058272046, 'bull_tsl_mult': 0.9294179188821706, 'bull_time_stop': 177, 'bull_use_sma': False, 'bull_use_ema': False, 'bull_use_atr': True, 'bull_use_adx': True, 'bull_use_spike': True, 'bull_rsi_required': True, 'bear_strategy': 'breakout', 'bear_bb_std_mult': 2.5657482018688618, 'bear_rsi_os': 43, 'bear_rsi_ob': 70, 'bear_adx_thresh': 11.713349302234276, 'bear_atr_min_pct': 0.006701726099330963, 'bear_atr_max_pct': 0.04764438787249985, 'bear_tp_mult': 1.4912908057830392, 'bear_tsl_mult': 0.1884556834311066, 'bear_time_stop': 212, 'bear_use_sma': False, 'bear_use_ema': True, 'bear_use_atr': True, 'bear_use_adx': True, 'bear_use_spike': True, 'bear_rsi_required': True, 'sideways_strategy': 'mean_reversion', 'sideways_bb_std_mult': 1.3097648648054294, 'sideways_rsi_os': 27, 'sideways_rsi_ob': 79, 'sideways_adx_thresh': 12.116447330912413, 'sideways_atr_min_pct': 0.018396428120181985, 'sideways_atr_max_pct': 0.12754848676953023, 'sideways_tp_mult': 2.393219314459589, 'sideways_tsl_mult': 0.5657348682606917, 'sideways_time_stop': 140, 'sideways_use_sma': False, 'sideways_use_ema': False, 'sideways_use_atr': True, 'sideways_use_adx': False, 'sideways_use_spike': True, 'sideways_rsi_required': True}.
[I 2025-09-01 09:02:28,308] Trial 588 finished with values: [-1000000000.0, 1000000000.0] and parameters: {'p_sma': 9, 'p_std': 34, 'p_atr': 19, 'p_adx': 15, 'rsi_period': 43, 'ema1': 9, 'ema2': 46, 'slip_atr_k': 0.12876377578989961, 'slip_spread_k': 0.1725522267960737, 'spread_hl_frac': 0.019930801889943263, 'bb_std_mult': 2.6629589700509784, 'rsi_os': 48, 'rsi_ob': 92, 'vol_spike': 0.01831970157891733, 'adx_thresh': 34.11992439769408, 'atr_min_pct': 0.006520710250286334, 'atr_max_pct': 0.05316950466328984, 'tp_mult': 1.2800657399966746, 'tsl_mult': 0.44370735401089567, 'strategy': 'mean_reversion', 'time_stop': 44, 'use_sma': False, 'use_atr': True, 'use_adx': False, 'use_ema': False, 'use_spike': False, 'rsi_required': False, 'edge_k': 0.8395926041756951, 'edge_cap': 0.5777652702155448, 'bull_strategy': 'mean_reversion', 'bull_bb_std_mult': 1.4511619691586544, 'bull_rsi_os': 39, 'bull_rsi_ob': 53, 'bull_adx_thresh': 20.96567167632984, 'bull_atr_min_pct': 0.008289393850152668, 'bull_atr_max_pct': 0.07721713976225884, 'bull_tp_mult': 1.9881979809352868, 'bull_tsl_mult': 0.9301887746528255, 'bull_time_stop': 178, 'bull_use_sma': False, 'bull_use_ema': False, 'bull_use_atr': True, 'bull_use_adx': True, 'bull_use_spike': True, 'bull_rsi_required': True, 'bear_strategy': 'breakout', 'bear_bb_std_mult': 3.4563051130399867, 'bear_rsi_os': 40, 'bear_rsi_ob': 89, 'bear_adx_thresh': 14.048534454580027, 'bear_atr_min_pct': 0.006764199770293782, 'bear_atr_max_pct': 0.04384919588144241, 'bear_tp_mult': 2.8088307654191427, 'bear_tsl_mult': 0.1858153976776687, 'bear_time_stop': 211, 'bear_use_sma': False, 'bear_use_ema': True, 'bear_use_atr': True, 'bear_use_adx': True, 'bear_use_spike': True, 'bear_rsi_required': True, 'sideways_strategy': 'mean_reversion', 'sideways_bb_std_mult': 1.3071503373363045, 'sideways_rsi_os': 11, 'sideways_rsi_ob': 62, 'sideways_adx_thresh': 12.100274232600391, 'sideways_atr_min_pct': 0.011854500648725766, 'sideways_atr_max_pct': 0.08618429467283764, 'sideways_tp_mult': 2.8343686510555837, 'sideways_tsl_mult': 0.5930142448449519, 'sideways_time_stop': 144, 'sideways_use_sma': False, 'sideways_use_ema': False, 'sideways_use_atr': True, 'sideways_use_adx': False, 'sideways_use_spike': True, 'sideways_rsi_required': True}.
[I 2025-09-01 09:02:29,665] Trial 591 finished with values: [-1000000000.0, 1000000000.0] and parameters: {'p_sma': 43, 'p_std': 37, 'p_atr': 19, 'p_adx': 9, 'rsi_period': 42, 'ema1': 27, 'ema2': 55, 'slip_atr_k': 0.01605738644735775, 'slip_spread_k': 0.07814681323109865, 'spread_hl_frac': 0.00695694331369006, 'bb_std_mult': 1.5607523999118764, 'rsi_os': 55, 'rsi_ob': 92, 'vol_spike': 0.020022608598012366, 'adx_thresh': 34.20384272032649, 'atr_min_pct': 0.017392926908765947, 'atr_max_pct': 0.08479706952206435, 'tp_mult': 1.3572480828421312, 'tsl_mult': 0.34563532487677595, 'strategy': 'mean_reversion', 'time_stop': 109, 'use_sma': False, 'use_atr': False, 'use_adx': False, 'use_ema': False, 'use_spike': False, 'rsi_required': False, 'edge_k': 0.7849488731676886, 'edge_cap': 0.5897037996617147, 'bull_strategy': 'breakout', 'bull_bb_std_mult': 1.5639796796483918, 'bull_rsi_os': 37, 'bull_rsi_ob': 73, 'bull_adx_thresh': 20.919561260931793, 'bull_atr_min_pct': 0.01878232580665959, 'bull_atr_max_pct': 0.07758522479497754, 'bull_tp_mult': 2.9372745902281823, 'bull_tsl_mult': 0.8983308882105105, 'bull_time_stop': 219, 'bull_use_sma': True, 'bull_use_ema': False, 'bull_use_atr': True, 'bull_use_adx': True, 'bull_use_spike': True, 'bull_rsi_required': False, 'bear_strategy': 'mean_reversion', 'bear_bb_std_mult': 3.2426659611449664, 'bear_rsi_os': 43, 'bear_rsi_ob': 93, 'bear_adx_thresh': 12.093631045607166, 'bear_atr_min_pct': 0.0055362074202699564, 'bear_atr_max_pct': 0.039490292614714345, 'bear_tp_mult': 2.8162839693571717, 'bear_tsl_mult': 0.1817143522103629, 'bear_time_stop': 211, 'bear_use_sma': False, 'bear_use_ema': False, 'bear_use_atr': True, 'bear_use_adx': True, 'bear_use_spike': True, 'bear_rsi_required': True, 'sideways_strategy': 'mean_reversion', 'sideways_bb_std_mult': 2.9370616606690207, 'sideways_rsi_os': 46, 'sideways_rsi_ob': 50, 'sideways_adx_thresh': 27.235780809454003, 'sideways_atr_min_pct': 0.011706743229344044, 'sideways_atr_max_pct': 0.14193966744381395, 'sideways_tp_mult': 2.384889521749563, 'sideways_tsl_mult': 0.5705107839880091, 'sideways_time_stop': 151, 'sideways_use_sma': False, 'sideways_use_ema': False, 'sideways_use_atr': True, 'sideways_use_adx': False, 'sideways_use_spike': True, 'sideways_rsi_required': True}.
[I 2025-09-01 09:02:29,723] Trial 590 finished with values: [-1000000000.0, 1000000000.0] and parameters: {'p_sma': 23, 'p_std': 36, 'p_atr': 19, 'p_adx': 15, 'rsi_period': 42, 'ema1': 6, 'ema2': 44, 'slip_atr_k': 0.005832756499884214, 'slip_spread_k': 0.08093519961685838, 'spread_hl_frac': 0.006991920198262832, 'bb_std_mult': 2.5850660071597327, 'rsi_os': 54, 'rsi_ob': 64, 'vol_spike': 0.02122937643705608, 'adx_thresh': 34.14027701660743, 'atr_min_pct': 0.016156480432442433, 'atr_max_pct': 0.016614591033331474, 'tp_mult': 1.2867530909953402, 'tsl_mult': 0.44503125333525406, 'strategy': 'mean_reversion', 'time_stop': 43, 'use_sma': False, 'use_atr': True, 'use_adx': False, 'use_ema': False, 'use_spike': False, 'rsi_required': False, 'edge_k': 0.7954255712798703, 'edge_cap': 0.8415303079208554, 'bull_strategy': 'mean_reversion', 'bull_bb_std_mult': 1.475472484761418, 'bull_rsi_os': 39, 'bull_rsi_ob': 56, 'bull_adx_thresh': 11.362671672566805, 'bull_atr_min_pct': 0.01857963180675499, 'bull_atr_max_pct': 0.09090067770241769, 'bull_tp_mult': 2.643210818743307, 'bull_tsl_mult': 0.42407952067255283, 'bull_time_stop': 271, 'bull_use_sma': True, 'bull_use_ema': False, 'bull_use_atr': True, 'bull_use_adx': True, 'bull_use_spike': True, 'bull_rsi_required': False, 'bear_strategy': 'mean_reversion', 'bear_bb_std_mult': 3.2369295499573236, 'bear_rsi_os': 40, 'bear_rsi_ob': 87, 'bear_adx_thresh': 11.819542865244273, 'bear_atr_min_pct': 0.015202114117886172, 'bear_atr_max_pct': 0.03632637202496704, 'bear_tp_mult': 2.8747092596655133, 'bear_tsl_mult': 0.19129562676151773, 'bear_time_stop': 212, 'bear_use_sma': False, 'bear_use_ema': False, 'bear_use_atr': True, 'bear_use_adx': True, 'bear_use_spike': True, 'bear_rsi_required': True, 'sideways_strategy': 'mean_reversion', 'sideways_bb_std_mult': 1.3306408673018322, 'sideways_rsi_os': 40, 'sideways_rsi_ob': 65, 'sideways_adx_thresh': 10.004881615064546, 'sideways_atr_min_pct': 0.0062715423086456175, 'sideways_atr_max_pct': 0.08710306155214216, 'sideways_tp_mult': 2.391787123620903, 'sideways_tsl_mult': 0.5615786469563236, 'sideways_time_stop': 152, 'sideways_use_sma': False, 'sideways_use_ema': False, 'sideways_use_atr': True, 'sideways_use_adx': False, 'sideways_use_spike': True, 'sideways_rsi_required': True}.
[I 2025-09-01 09:02:29,755] Trial 592 finished with values: [-1000000000.0, 1000000000.0] and parameters: {'p_sma': 23, 'p_std': 37, 'p_atr': 29, 'p_adx': 25, 'rsi_period': 31, 'ema1': 7, 'ema2': 57, 'slip_atr_k': 0.005289296076416022, 'slip_spread_k': 0.07804762915993475, 'spread_hl_frac': 0.018029360007826935, 'bb_std_mult': 2.738350689055998, 'rsi_os': 51, 'rsi_ob': 93, 'vol_spike': 0.013857253090047547, 'adx_thresh': 33.91873576356175, 'atr_min_pct': 0.013278292131469078, 'atr_max_pct': 0.030146448882864114, 'tp_mult': 1.3585452131290292, 'tsl_mult': 0.21931246879878213, 'strategy': 'mean_reversion', 'time_stop': 156, 'use_sma': False, 'use_atr': False, 'use_adx': False, 'use_ema': False, 'use_spike': False, 'rsi_required': False, 'edge_k': 0.7751385756288293, 'edge_cap': 0.2871552405778797, 'bull_strategy': 'breakout', 'bull_bb_std_mult': 2.4895993754540884, 'bull_rsi_os': 39, 'bull_rsi_ob': 55, 'bull_adx_thresh': 10.507114200483947, 'bull_atr_min_pct': 0.025615021776101646, 'bull_atr_max_pct': 0.07761548526300309, 'bull_tp_mult': 2.166158038326985, 'bull_tsl_mult': 0.8970953279973435, 'bull_time_stop': 287, 'bull_use_sma': True, 'bull_use_ema': True, 'bull_use_atr': True, 'bull_use_adx': True, 'bull_use_spike': True, 'bull_rsi_required': False, 'bear_strategy': 'mean_reversion', 'bear_bb_std_mult': 3.2455610244470643, 'bear_rsi_os': 41, 'bear_rsi_ob': 87, 'bear_adx_thresh': 12.161186473821582, 'bear_atr_min_pct': 0.004612008777826856, 'bear_atr_max_pct': 0.03966973453712309, 'bear_tp_mult': 2.82229990067921, 'bear_tsl_mult': 0.4278070261119462, 'bear_time_stop': 183, 'bear_use_sma': False, 'bear_use_ema': False, 'bear_use_atr': True, 'bear_use_adx': True, 'bear_use_spike': True, 'bear_rsi_required': True, 'sideways_strategy': 'breakout', 'sideways_bb_std_mult': 1.1926200574546235, 'sideways_rsi_os': 24, 'sideways_rsi_ob': 60, 'sideways_adx_thresh': 27.641883650538993, 'sideways_atr_min_pct': 0.007199031995345666, 'sideways_atr_max_pct': 0.09660009813642963, 'sideways_tp_mult': 2.444202531948414, 'sideways_tsl_mult': 0.6178275004833839, 'sideways_time_stop': 156, 'sideways_use_sma': False, 'sideways_use_ema': False, 'sideways_use_atr': True, 'sideways_use_adx': False, 'sideways_use_spike': True, 'sideways_rsi_required': True}.
[I 2025-09-01 09:02:30,970] Trial 595 finished with values: [-1000000000.0, 1000000000.0] and parameters: {'p_sma': 13, 'p_std': 8, 'p_atr': 29, 'p_adx': 8, 'rsi_period': 39, 'ema1': 8, 'ema2': 57, 'slip_atr_k': 0.08467484309600547, 'slip_spread_k': 0.12549179447909578, 'spread_hl_frac': 0.01752451442312293, 'bb_std_mult': 2.459527874974709, 'rsi_os': 50, 'rsi_ob': 93, 'vol_spike': 0.013111291059221791, 'adx_thresh': 16.89957009882167, 'atr_min_pct': 0.013346883527999561, 'atr_max_pct': 0.0809410337993126, 'tp_mult': 2.919548055076258, 'tsl_mult': 0.22201618573442092, 'strategy': 'mean_reversion', 'time_stop': 32, 'use_sma': True, 'use_atr': False, 'use_adx': False, 'use_ema': False, 'use_spike': False, 'rsi_required': False, 'edge_k': 0.9412824698250368, 'edge_cap': 0.2935102806703058, 'bull_strategy': 'breakout', 'bull_bb_std_mult': 2.5038097911055184, 'bull_rsi_os': 27, 'bull_rsi_ob': 84, 'bull_adx_thresh': 10.385292581516962, 'bull_atr_min_pct': 0.020632527252751894, 'bull_atr_max_pct': 0.13100580666042794, 'bull_tp_mult': 2.1573646084345484, 'bull_tsl_mult': 0.8417648785773417, 'bull_time_stop': 162, 'bull_use_sma': True, 'bull_use_ema': True, 'bull_use_atr': True, 'bull_use_adx': True, 'bull_use_spike': True, 'bull_rsi_required': False, 'bear_strategy': 'mean_reversion', 'bear_bb_std_mult': 3.3436298912399804, 'bear_rsi_os': 41, 'bear_rsi_ob': 51, 'bear_adx_thresh': 13.09270995478664, 'bear_atr_min_pct': 0.004852568927930825, 'bear_atr_max_pct': 0.03940415312916766, 'bear_tp_mult': 2.7413167519246766, 'bear_tsl_mult': 0.43309508649713424, 'bear_time_stop': 185, 'bear_use_sma': False, 'bear_use_ema': False, 'bear_use_atr': True, 'bear_use_adx': True, 'bear_use_spike': True, 'bear_rsi_required': True, 'sideways_strategy': 'breakout', 'sideways_bb_std_mult': 1.213713814494256, 'sideways_rsi_os': 13, 'sideways_rsi_ob': 60, 'sideways_adx_thresh': 13.145640467008809, 'sideways_atr_min_pct': 0.007107447057909673, 'sideways_atr_max_pct': 0.09683177810303717, 'sideways_tp_mult': 1.9957135857229025, 'sideways_tsl_mult': 0.6219579061973082, 'sideways_time_stop': 173, 'sideways_use_sma': False, 'sideways_use_ema': False, 'sideways_use_atr': False, 'sideways_use_adx': False, 'sideways_use_spike': True, 'sideways_rsi_required': True}.
