[I 2025-09-01 07:55:37,016] Trial 207 finished with values: [-0.008374021436414969, 0.010166141075959152] and parameters: {'p_sma': 27, 'p_std': 59, 'p_atr': 24, 'p_adx': 28, 'rsi_period': 55, 'ema1': 16, 'ema2': 23, 'slip_atr_k': 0.06074453924210052, 'slip_spread_k': 0.9221787502703644, 'spread_hl_frac': 0.011596317878017208, 'bb_std_mult': 1.9029468249678199, 'rsi_os': 33, 'rsi_ob': 94, 'vol_spike': 0.08111850444488612, 'adx_thresh': 29.46184797604005, 'atr_min_pct': 0.0047425742180123125, 'atr_max_pct': 0.13633716533971538, 'tp_mult': 1.9149539366416508, 'tsl_mult': 0.04044344828964426, 'strategy': 'breakout', 'time_stop': 227, 'use_sma': False, 'use_atr': False, 'use_adx': True, 'use_ema': True, 'use_spike': True, 'rsi_required': True, 'edge_k': 0.2934491325522983, 'edge_cap': 0.2671989606176349, 'bull_strategy': 'breakout', 'bull_bb_std_mult': 3.2413432922314036, 'bull_rsi_os': 49, 'bull_rsi_ob': 47, 'bull_adx_thresh': 7.297383210478985, 'bull_atr_min_pct': 0.003882213592344877, 'bull_atr_max_pct': 0.02793999651282162, 'bull_tp_mult': 1.4700862613870727, 'bull_tsl_mult': 0.5683494008032608, 'bull_time_stop': 63, 'bull_use_sma': True, 'bull_use_ema': False, 'bull_use_atr': False, 'bull_use_adx': False, 'bull_use_spike': False, 'bull_rsi_required': False, 'bear_strategy': 'mean_reversion', 'bear_bb_std_mult': 1.7612459852714293, 'bear_rsi_os': 43, 'bear_rsi_ob': 78, 'bear_adx_thresh': 7.33161575624737, 'bear_atr_min_pct': 0.004106365373150293, 'bear_atr_max_pct': 0.0853955101175888, 'bear_tp_mult': 2.27910447179593, 'bear_tsl_mult': 0.06274868521385331, 'bear_time_stop': 284, 'bear_use_sma': True, 'bear_use_ema': False, 'bear_use_atr': True, 'bear_use_adx': False, 'bear_use_spike': False, 'bear_rsi_required': False, 'sideways_strategy': 'breakout', 'sideways_bb_std_mult': 0.7780849776090171, 'sideways_rsi_os': 6, 'sideways_rsi_ob': 93, 'sideways_adx_thresh': 10.137266677798129, 'sideways_atr_min_pct': 0.02797432793205447, 'sideways_atr_max_pct': 0.028524261042935498, 'sideways_tp_mult': 1.4346235910855674, 'sideways_tsl_mult': 0.029380081387577528, 'sideways_time_stop': 230, 'sideways_use_sma': True, 'sideways_use_ema': True, 'sideways_use_atr': True, 'sideways_use_adx': True, 'sideways_use_spike': False, 'sideways_rsi_required': False}.
[I 2025-09-01 07:55:37,598] Trial 208 finished with values: [0.002076089802985237, 0.003385663792981473] and parameters: {'p_sma': 27, 'p_std': 59, 'p_atr': 23, 'p_adx': 28, 'rsi_period': 55, 'ema1': 16, 'ema2': 23, 'slip_atr_k': 0.0002784977755251996, 'slip_spread_k': 0.9196202489765883, 'spread_hl_frac': 0.009657624364446758, 'bb_std_mult': 2.1216080378607907, 'rsi_os': 19, 'rsi_ob': 94, 'vol_spike': 0.07912736229657195, 'adx_thresh': 26.230731213690195, 'atr_min_pct': 0.004944066998412685, 'atr_max_pct': 0.13588782267746716, 'tp_mult': 1.8707251646045646, 'tsl_mult': 0.03667207420692293, 'strategy': 'breakout', 'time_stop': 227, 'use_sma': False, 'use_atr': False, 'use_adx': True, 'use_ema': True, 'use_spike': True, 'rsi_required': True, 'edge_k': 0.28727055160014714, 'edge_cap': 0.2633802291626516, 'bull_strategy': 'breakout', 'bull_bb_std_mult': 3.219952117420933, 'bull_rsi_os': 49, 'bull_rsi_ob': 47, 'bull_adx_thresh': 7.216702866744342, 'bull_atr_min_pct': 0.003883756658766276, 'bull_atr_max_pct': 0.024367659162133796, 'bull_tp_mult': 1.4765129973270747, 'bull_tsl_mult': 0.6476793393657004, 'bull_time_stop': 65, 'bull_use_sma': True, 'bull_use_ema': False, 'bull_use_atr': False, 'bull_use_adx': False, 'bull_use_spike': False, 'bull_rsi_required': False, 'bear_strategy': 'mean_reversion', 'bear_bb_std_mult': 1.7728124454831116, 'bear_rsi_os': 43, 'bear_rsi_ob': 78, 'bear_adx_thresh': 7.365149819745378, 'bear_atr_min_pct': 0.003389034907295912, 'bear_atr_max_pct': 0.07803096563935605, 'bear_tp_mult': 2.2069457810932733, 'bear_tsl_mult': 0.06121709867968903, 'bear_time_stop': 285, 'bear_use_sma': True, 'bear_use_ema': False, 'bear_use_atr': True, 'bear_use_adx': False, 'bear_use_spike': False, 'bear_rsi_required': False, 'sideways_strategy': 'breakout', 'sideways_bb_std_mult': 0.8736357630672144, 'sideways_rsi_os': 6, 'sideways_rsi_ob': 93, 'sideways_adx_thresh': 11.676060657884038, 'sideways_atr_min_pct': 0.027764181281875747, 'sideways_atr_max_pct': 0.027031696008113434, 'sideways_tp_mult': 1.4856991870295047, 'sideways_tsl_mult': 0.09059623815564036, 'sideways_time_stop': 211, 'sideways_use_sma': True, 'sideways_use_ema': True, 'sideways_use_atr': True, 'sideways_use_adx': True, 'sideways_use_spike': False, 'sideways_rsi_required': False}.
[I 2025-09-01 07:55:37,889] Trial 210 finished with values: [-0.011416764974595539, 0.013586064001261167] and parameters: {'p_sma': 26, 'p_std': 53, 'p_atr': 24, 'p_adx': 28, 'rsi_period': 54, 'ema1': 16, 'ema2': 23, 'slip_atr_k': 0.07193168037008582, 'slip_spread_k': 0.921638926883076, 'spread_hl_frac': 0.008867955043444065, 'bb_std_mult': 2.0921260861701376, 'rsi_os': 29, 'rsi_ob': 94, 'vol_spike': 0.0781016279980593, 'adx_thresh': 29.75055189396324, 'atr_min_pct': 0.004936736474376202, 'atr_max_pct': 0.1388386050312095, 'tp_mult': 1.8626007627145624, 'tsl_mult': 0.02840270271741406, 'strategy': 'breakout', 'time_stop': 256, 'use_sma': False, 'use_atr': False, 'use_adx': True, 'use_ema': True, 'use_spike': True, 'rsi_required': True, 'edge_k': 0.20344165848762802, 'edge_cap': 0.2148888121030084, 'bull_strategy': 'breakout', 'bull_bb_std_mult': 3.2573295369978448, 'bull_rsi_os': 51, 'bull_rsi_ob': 45, 'bull_adx_thresh': 6.8250986969707474, 'bull_atr_min_pct': 0.003241080182424283, 'bull_atr_max_pct': 0.027358172064464996, 'bull_tp_mult': 1.4556630697730422, 'bull_tsl_mult': 0.554889389321702, 'bull_time_stop': 65, 'bull_use_sma': True, 'bull_use_ema': False, 'bull_use_atr': False, 'bull_use_adx': False, 'bull_use_spike': False, 'bull_rsi_required': False, 'bear_strategy': 'mean_reversion', 'bear_bb_std_mult': 1.853575265146259, 'bear_rsi_os': 43, 'bear_rsi_ob': 82, 'bear_adx_thresh': 7.156591432515106, 'bear_atr_min_pct': 0.00365523640820882, 'bear_atr_max_pct': 0.08755266573447995, 'bear_tp_mult': 2.2744333093548685, 'bear_tsl_mult': 0.0918194694502229, 'bear_time_stop': 300, 'bear_use_sma': True, 'bear_use_ema': False, 'bear_use_atr': True, 'bear_use_adx': False, 'bear_use_spike': False, 'bear_rsi_required': False, 'sideways_strategy': 'breakout', 'sideways_bb_std_mult': 0.8600478084354986, 'sideways_rsi_os': 7, 'sideways_rsi_ob': 91, 'sideways_adx_thresh': 11.627900548743323, 'sideways_atr_min_pct': 0.027705157156774587, 'sideways_atr_max_pct': 0.014372318537472381, 'sideways_tp_mult': 1.280507792627863, 'sideways_tsl_mult': 0.07815872134173948, 'sideways_time_stop': 196, 'sideways_use_sma': True, 'sideways_use_ema': True, 'sideways_use_atr': True, 'sideways_use_adx': True, 'sideways_use_spike': False, 'sideways_rsi_required': False}.
[I 2025-09-01 07:55:38,048] Trial 209 finished with values: [-0.006859050641307318, 0.009590482823353891] and parameters: {'p_sma': 26, 'p_std': 55, 'p_atr': 24, 'p_adx': 28, 'rsi_period': 50, 'ema1': 16, 'ema2': 18, 'slip_atr_k': 0.05847197749209624, 'slip_spread_k': 0.8531766846026212, 'spread_hl_frac': 0.007377818574737436, 'bb_std_mult': 1.8713714980308347, 'rsi_os': 29, 'rsi_ob': 94, 'vol_spike': 0.06126159640915518, 'adx_thresh': 30.60974534219638, 'atr_min_pct': 0.004837040703622989, 'atr_max_pct': 0.1372927276042931, 'tp_mult': 1.7804850562221815, 'tsl_mult': 0.1060501248870757, 'strategy': 'breakout', 'time_stop': 256, 'use_sma': False, 'use_atr': False, 'use_adx': True, 'use_ema': True, 'use_spike': True, 'rsi_required': True, 'edge_k': 0.20319448719750297, 'edge_cap': 0.20753796566710758, 'bull_strategy': 'breakout', 'bull_bb_std_mult': 3.2721046483363456, 'bull_rsi_os': 51, 'bull_rsi_ob': 45, 'bull_adx_thresh': 6.768250399357431, 'bull_atr_min_pct': 0.0030198283329928893, 'bull_atr_max_pct': 0.012524590054912937, 'bull_tp_mult': 1.4623168396831063, 'bull_tsl_mult': 0.5561330908069768, 'bull_time_stop': 61, 'bull_use_sma': True, 'bull_use_ema': False, 'bull_use_atr': False, 'bull_use_adx': False, 'bull_use_spike': False, 'bull_rsi_required': False, 'bear_strategy': 'mean_reversion', 'bear_bb_std_mult': 1.8603417355874248, 'bear_rsi_os': 43, 'bear_rsi_ob': 82, 'bear_adx_thresh': 5.064054065390942, 'bear_atr_min_pct': 0.0036610892385428523, 'bear_atr_max_pct': 0.08856410488868677, 'bear_tp_mult': 2.269678079324629, 'bear_tsl_mult': 0.09329485116098607, 'bear_time_stop': 300, 'bear_use_sma': True, 'bear_use_ema': False, 'bear_use_atr': True, 'bear_use_adx': False, 'bear_use_spike': False, 'bear_rsi_required': False, 'sideways_strategy': 'breakout', 'sideways_bb_std_mult': 0.6054900686555034, 'sideways_rsi_os': 7, 'sideways_rsi_ob': 94, 'sideways_adx_thresh': 11.837670202570635, 'sideways_atr_min_pct': 0.027695386879309867, 'sideways_atr_max_pct': 0.013582574610461612, 'sideways_tp_mult': 1.2930522058272118, 'sideways_tsl_mult': 0.10049528606322378, 'sideways_time_stop': 193, 'sideways_use_sma': True, 'sideways_use_ema': True, 'sideways_use_atr': True, 'sideways_use_adx': True, 'sideways_use_spike': False, 'sideways_rsi_required': False}.
[I 2025-09-01 07:56:21,159] Trial 214 finished with values: [-0.008200146540975228, 0.008242974837294841] and parameters: {'p_sma': 30, 'p_std': 55, 'p_atr': 22, 'p_adx': 30, 'rsi_period': 59, 'ema1': 15, 'ema2': 26, 'slip_atr_k': 0.05217931627443175, 'slip_spread_k': 0.8871027947273838, 'spread_hl_frac': 0.009488974301785413, 'bb_std_mult': 3.119313210748421, 'rsi_os': 32, 'rsi_ob': 90, 'vol_spike': 0.0669757948532593, 'adx_thresh': 26.137762369173494, 'atr_min_pct': 0.00553663736659784, 'atr_max_pct': 0.12597363299314454, 'tp_mult': 1.8193878278886673, 'tsl_mult': 0.09543798309622853, 'strategy': 'breakout', 'time_stop': 211, 'use_sma': False, 'use_atr': False, 'use_adx': True, 'use_ema': True, 'use_spike': True, 'rsi_required': True, 'edge_k': 0.25035024620053115, 'edge_cap': 0.19193562557116708, 'bull_strategy': 'breakout', 'bull_bb_std_mult': 2.979170306877753, 'bull_rsi_os': 40, 'bull_rsi_ob': 81, 'bull_adx_thresh': 9.536455897510365, 'bull_atr_min_pct': 0.0021954881273664496, 'bull_atr_max_pct': 0.013665034506347012, 'bull_tp_mult': 1.5873556719228674, 'bull_tsl_mult': 0.633783641662305, 'bull_time_stop': 67, 'bull_use_sma': True, 'bull_use_ema': False, 'bull_use_atr': False, 'bull_use_adx': False, 'bull_use_spike': False, 'bull_rsi_required': False, 'bear_strategy': 'mean_reversion', 'bear_bb_std_mult': 1.5794485446664353, 'bear_rsi_os': 47, 'bear_rsi_ob': 80, 'bear_adx_thresh': 5.509703075473365, 'bear_atr_min_pct': 0.007212083884009286, 'bear_atr_max_pct': 0.07842243966047868, 'bear_tp_mult': 2.0779635519659405, 'bear_tsl_mult': 0.13904755574439248, 'bear_time_stop': 295, 'bear_use_sma': True, 'bear_use_ema': False, 'bear_use_atr': True, 'bear_use_adx': False, 'bear_use_spike': False, 'bear_rsi_required': False, 'sideways_strategy': 'breakout', 'sideways_bb_std_mult': 0.9296857862797487, 'sideways_rsi_os': 5, 'sideways_rsi_ob': 91, 'sideways_adx_thresh': 8.470074558516016, 'sideways_atr_min_pct': 0.02973020317072359, 'sideways_atr_max_pct': 0.01793645469077775, 'sideways_tp_mult': 1.4988773153737718, 'sideways_tsl_mult': 0.08370694165321263, 'sideways_time_stop': 142, 'sideways_use_sma': True, 'sideways_use_ema': True, 'sideways_use_atr': True, 'sideways_use_adx': True, 'sideways_use_spike': False, 'sideways_rsi_required': False}.
[I 2025-09-01 07:56:21,476] Trial 211 finished with values: [-0.048627608076304174, 0.049696277073396654] and parameters: {'p_sma': 26, 'p_std': 55, 'p_atr': 22, 'p_adx': 28, 'rsi_period': 50, 'ema1': 15, 'ema2': 23, 'slip_atr_k': 0.2004853758010612, 'slip_spread_k': 0.8385153827150078, 'spread_hl_frac': 0.008413084877978939, 'bb_std_mult': 2.264421286682018, 'rsi_os': 29, 'rsi_ob': 93, 'vol_spike': 0.06104762763282893, 'adx_thresh': 29.942852628888446, 'atr_min_pct': 0.005512464543997002, 'atr_max_pct': 0.1391411505764092, 'tp_mult': 1.8547871834062095, 'tsl_mult': 0.09779487261189751, 'strategy': 'breakout', 'time_stop': 257, 'use_sma': False, 'use_atr': False, 'use_adx': True, 'use_ema': True, 'use_spike': True, 'rsi_required': True, 'edge_k': 0.20657311176551535, 'edge_cap': 0.20000777637659514, 'bull_strategy': 'breakout', 'bull_bb_std_mult': 3.0114247905813794, 'bull_rsi_os': 52, 'bull_rsi_ob': 45, 'bull_adx_thresh': 6.7963020195025, 'bull_atr_min_pct': 0.0031696057800330844, 'bull_atr_max_pct': 0.011670948225767797, 'bull_tp_mult': 1.5855939286049832, 'bull_tsl_mult': 0.6280853761398318, 'bull_time_stop': 65, 'bull_use_sma': True, 'bull_use_ema': False, 'bull_use_atr': False, 'bull_use_adx': False, 'bull_use_spike': False, 'bull_rsi_required': False, 'bear_strategy': 'mean_reversion', 'bear_bb_std_mult': 1.859024606274253, 'bear_rsi_os': 46, 'bear_rsi_ob': 81, 'bear_adx_thresh': 5.0545573359002, 'bear_atr_min_pct': 0.003291876043816937, 'bear_atr_max_pct': 0.07863509729871952, 'bear_tp_mult': 2.0592583187604236, 'bear_tsl_mult': 0.09487263893936608, 'bear_time_stop': 300, 'bear_use_sma': True, 'bear_use_ema': False, 'bear_use_atr': True, 'bear_use_adx': False, 'bear_use_spike': False, 'bear_rsi_required': False, 'sideways_strategy': 'breakout', 'sideways_bb_std_mult': 0.6142044883269764, 'sideways_rsi_os': 7, 'sideways_rsi_ob': 91, 'sideways_adx_thresh': 11.741187406326315, 'sideways_atr_min_pct': 0.02987914264827984, 'sideways_atr_max_pct': 0.013233507405522149, 'sideways_tp_mult': 1.2945184427030925, 'sideways_tsl_mult': 0.08533936996694719, 'sideways_time_stop': 144, 'sideways_use_sma': True, 'sideways_use_ema': True, 'sideways_use_atr': True, 'sideways_use_adx': True, 'sideways_use_spike': False, 'sideways_rsi_required': False}.
[I 2025-09-01 07:56:21,695] Trial 212 finished with values: [-1000000000.0, 1000000000.0] and parameters: {'p_sma': 26, 'p_std': 53, 'p_atr': 22, 'p_adx': 29, 'rsi_period': 50, 'ema1': 16, 'ema2': 20, 'slip_atr_k': 0.08902701272323475, 'slip_spread_k': 0.8493755081642349, 'spread_hl_frac': 0.009374641118270955, 'bb_std_mult': 2.23584536434105, 'rsi_os': 29, 'rsi_ob': 94, 'vol_spike': 0.062140093273182595, 'adx_thresh': 30.567868320860327, 'atr_min_pct': 0.005379311744566907, 'atr_max_pct': 0.12734174301515344, 'tp_mult': 1.8683136402954752, 'tsl_mult': 0.09682367250068598, 'strategy': 'breakout', 'time_stop': 256, 'use_sma': False, 'use_atr': False, 'use_adx': True, 'use_ema': True, 'use_spike': True, 'rsi_required': True, 'edge_k': 0.19793254327388538, 'edge_cap': 0.20110767755028863, 'bull_strategy': 'breakout', 'bull_bb_std_mult': 2.983255926842502, 'bull_rsi_os': 51, 'bull_rsi_ob': 45, 'bull_adx_thresh': 6.575193301568918, 'bull_atr_min_pct': 0.003063703197993478, 'bull_atr_max_pct': 0.0121572305304148, 'bull_tp_mult': 1.5903676084872, 'bull_tsl_mult': 0.632369889947033, 'bull_time_stop': 66, 'bull_use_sma': True, 'bull_use_ema': False, 'bull_use_atr': False, 'bull_use_adx': False, 'bull_use_spike': False, 'bull_rsi_required': False, 'bear_strategy': 'mean_reversion', 'bear_bb_std_mult': 1.5484844414934036, 'bear_rsi_os': 43, 'bear_rsi_ob': 82, 'bear_adx_thresh': 5.214511070776008, 'bear_atr_min_pct': 0.007366505102826301, 'bear_atr_max_pct': 0.08747289987385612, 'bear_tp_mult': 2.0702890036582233, 'bear_tsl_mult': 0.09138018387767025, 'bear_time_stop': 299, 'bear_use_sma': True, 'bear_use_ema': False, 'bear_use_atr': True, 'bear_use_adx': False, 'bear_use_spike': False, 'bear_rsi_required': False, 'sideways_strategy': 'breakout', 'sideways_bb_std_mult': 0.7044670992226614, 'sideways_rsi_os': 5, 'sideways_rsi_ob': 91, 'sideways_adx_thresh': 11.44618244632722, 'sideways_atr_min_pct': 0.029987125337116796, 'sideways_atr_max_pct': 0.013519857075722258, 'sideways_tp_mult': 1.2771932528099224, 'sideways_tsl_mult': 0.09081111646753866, 'sideways_time_stop': 193, 'sideways_use_sma': True, 'sideways_use_ema': True, 'sideways_use_atr': True, 'sideways_use_adx': True, 'sideways_use_spike': False, 'sideways_rsi_required': False}.
[I 2025-09-01 07:56:21,963] Trial 213 finished with values: [-0.007652190009597715, 0.007695168271701221] and parameters: {'p_sma': 31, 'p_std': 55, 'p_atr': 22, 'p_adx': 29, 'rsi_period': 50, 'ema1': 6, 'ema2': 15, 'slip_atr_k': 0.05366959093902973, 'slip_spread_k': 0.8505993053270997, 'spread_hl_frac': 0.007132051961759594, 'bb_std_mult': 3.129454321152659, 'rsi_os': 35, 'rsi_ob': 93, 'vol_spike': 0.06228192389865391, 'adx_thresh': 30.59137043587336, 'atr_min_pct': 0.005521345089015957, 'atr_max_pct': 0.12606697983819085, 'tp_mult': 1.7841179395907696, 'tsl_mult': 0.09731482207896447, 'strategy': 'breakout', 'time_stop': 255, 'use_sma': False, 'use_atr': False, 'use_adx': True, 'use_ema': True, 'use_spike': True, 'rsi_required': True, 'edge_k': 0.06629248973572444, 'edge_cap': 0.19735559522758434, 'bull_strategy': 'breakout', 'bull_bb_std_mult': 2.9810034595567796, 'bull_rsi_os': 40, 'bull_rsi_ob': 48, 'bull_adx_thresh': 6.448722447832825, 'bull_atr_min_pct': 0.0023545816105507793, 'bull_atr_max_pct': 0.011012964926268739, 'bull_tp_mult': 1.58809906227899, 'bull_tsl_mult': 0.6433856593771698, 'bull_time_stop': 68, 'bull_use_sma': True, 'bull_use_ema': False, 'bull_use_atr': False, 'bull_use_adx': False, 'bull_use_spike': False, 'bull_rsi_required': False, 'bear_strategy': 'mean_reversion', 'bear_bb_std_mult': 1.8653925152686968, 'bear_rsi_os': 47, 'bear_rsi_ob': 81, 'bear_adx_thresh': 5.056125507995373, 'bear_atr_min_pct': 0.007356362679465578, 'bear_atr_max_pct': 0.07752649689488135, 'bear_tp_mult': 2.0683555059201795, 'bear_tsl_mult': 0.14001474984244788, 'bear_time_stop': 296, 'bear_use_sma': True, 'bear_use_ema': False, 'bear_use_atr': True, 'bear_use_adx': False, 'bear_use_spike': False, 'bear_rsi_required': False, 'sideways_strategy': 'breakout', 'sideways_bb_std_mult': 0.6179414297174853, 'sideways_rsi_os': 5, 'sideways_rsi_ob': 91, 'sideways_adx_thresh': 20.35099478326626, 'sideways_atr_min_pct': 0.02967977620980844, 'sideways_atr_max_pct': 0.017362658154302633, 'sideways_tp_mult': 1.4827133533225005, 'sideways_tsl_mult': 0.09425696981763215, 'sideways_time_stop': 200, 'sideways_use_sma': True, 'sideways_use_ema': True, 'sideways_use_atr': True, 'sideways_use_adx': True, 'sideways_use_spike': False, 'sideways_rsi_required': False}.
[I 2025-09-01 07:57:05,153] Trial 215 finished with values: [-0.004211854304690732, 0.006100342637246112] and parameters: {'p_sma': 30, 'p_std': 51, 'p_atr': 22, 'p_adx': 29, 'rsi_period': 57, 'ema1': 14, 'ema2': 16, 'slip_atr_k': 0.0459862403715522, 'slip_spread_k': 0.8489341064419957, 'spread_hl_frac': 0.013703712159426524, 'bb_std_mult': 2.2525458579929514, 'rsi_os': 35, 'rsi_ob': 90, 'vol_spike': 0.049177751949170935, 'adx_thresh': 29.819724795213755, 'atr_min_pct': 0.004338181293853363, 'atr_max_pct': 0.12499753178400785, 'tp_mult': 1.8705322823025057, 'tsl_mult': 0.05438079462963276, 'strategy': 'breakout', 'time_stop': 252, 'use_sma': False, 'use_atr': False, 'use_adx': True, 'use_ema': True, 'use_spike': True, 'rsi_required': True, 'edge_k': 0.3856254140914196, 'edge_cap': 0.198772794480648, 'bull_strategy': 'breakout', 'bull_bb_std_mult': 3.146591565269742, 'bull_rsi_os': 46, 'bull_rsi_ob': 49, 'bull_adx_thresh': 8.868099657248733, 'bull_atr_min_pct': 0.002559353612028522, 'bull_atr_max_pct': 0.023901502423727725, 'bull_tp_mult': 1.5139102538023923, 'bull_tsl_mult': 0.6602883252845428, 'bull_time_stop': 78, 'bull_use_sma': True, 'bull_use_ema': False, 'bull_use_atr': False, 'bull_use_adx': False, 'bull_use_spike': False, 'bull_rsi_required': False, 'bear_strategy': 'mean_reversion', 'bear_bb_std_mult': 1.772585781796883, 'bear_rsi_os': 46, 'bear_rsi_ob': 79, 'bear_adx_thresh': 5.0797074459937575, 'bear_atr_min_pct': 0.006622800914627552, 'bear_atr_max_pct': 0.1438336277136632, 'bear_tp_mult': 2.1316275953211132, 'bear_tsl_mult': 0.1762858998064099, 'bear_time_stop': 289, 'bear_use_sma': True, 'bear_use_ema': False, 'bear_use_atr': True, 'bear_use_adx': False, 'bear_use_spike': False, 'bear_rsi_required': False, 'sideways_strategy': 'breakout', 'sideways_bb_std_mult': 0.6777256275955182, 'sideways_rsi_os': 8, 'sideways_rsi_ob': 92, 'sideways_adx_thresh': 7.323891702599857, 'sideways_atr_min_pct': 0.028619169107962625, 'sideways_atr_max_pct': 0.016085037490798242, 'sideways_tp_mult': 1.3006751498966322, 'sideways_tsl_mult': 0.09461804920361974, 'sideways_time_stop': 150, 'sideways_use_sma': True, 'sideways_use_ema': True, 'sideways_use_atr': True, 'sideways_use_adx': True, 'sideways_use_spike': False, 'sideways_rsi_required': False}.
