[I 2025-09-01 07:59:57,922] Trial 232 finished with values: [-0.13321761025921008, 0.13301187799748698] and parameters: {'p_sma': 29, 'p_std': 22, 'p_atr': 22, 'p_adx': 30, 'rsi_period': 56, 'ema1': 14, 'ema2': 20, 'slip_atr_k': 0.08835006253635894, 'slip_spread_k': 0.8261641701461491, 'spread_hl_frac': 0.04425122617645004, 'bb_std_mult': 2.1849165859974184, 'rsi_os': 23, 'rsi_ob': 57, 'vol_spike': 0.06476153069247445, 'adx_thresh': 26.100598459119496, 'atr_min_pct': 0.00302106953477034, 'atr_max_pct': 0.12769978054415584, 'tp_mult': 1.6799383816803222, 'tsl_mult': 0.03768343207398607, 'strategy': 'breakout', 'time_stop': 272, 'use_sma': False, 'use_atr': False, 'use_adx': True, 'use_ema': True, 'use_spike': True, 'rsi_required': True, 'edge_k': 0.21949586044434416, 'edge_cap': 0.18608779084520885, 'bull_strategy': 'breakout', 'bull_bb_std_mult': 3.1008103885144638, 'bull_rsi_os': 36, 'bull_rsi_ob': 46, 'bull_adx_thresh': 7.251248843968668, 'bull_atr_min_pct': 0.02533340261313264, 'bull_atr_max_pct': 0.08206286202275635, 'bull_tp_mult': 1.429245500686297, 'bull_tsl_mult': 0.6880261506460332, 'bull_time_stop': 70, 'bull_use_sma': True, 'bull_use_ema': True, 'bull_use_atr': False, 'bull_use_adx': False, 'bull_use_spike': False, 'bull_rsi_required': False, 'bear_strategy': 'mean_reversion', 'bear_bb_std_mult': 1.4928763508048255, 'bear_rsi_os': 49, 'bear_rsi_ob': 81, 'bear_adx_thresh': 5.0012858293425415, 'bear_atr_min_pct': 0.0013684269813651912, 'bear_atr_max_pct': 0.07350096838560263, 'bear_tp_mult': 2.3262361692647846, 'bear_tsl_mult': 0.12830385886229143, 'bear_time_stop': 300, 'bear_use_sma': True, 'bear_use_ema': False, 'bear_use_atr': False, 'bear_use_adx': False, 'bear_use_spike': False, 'bear_rsi_required': False, 'sideways_strategy': 'breakout', 'sideways_bb_std_mult': 1.7195635938299456, 'sideways_rsi_os': 5, 'sideways_rsi_ob': 90, 'sideways_adx_thresh': 5.702369774297972, 'sideways_atr_min_pct': 0.022049609670290363, 'sideways_atr_max_pct': 0.013202882084109906, 'sideways_tp_mult': 1.3113295701132566, 'sideways_tsl_mult': 0.26551754982276454, 'sideways_time_stop': 114, 'sideways_use_sma': True, 'sideways_use_ema': True, 'sideways_use_atr': True, 'sideways_use_adx': True, 'sideways_use_spike': False, 'sideways_rsi_required': False}.
[I 2025-09-01 08:00:39,996] Trial 235 finished with values: [-0.012000129020446226, 0.013856465196513127] and parameters: {'p_sma': 29, 'p_std': 54, 'p_atr': 25, 'p_adx': 30, 'rsi_period': 67, 'ema1': 24, 'ema2': 21, 'slip_atr_k': 0.007120302597917101, 'slip_spread_k': 0.887122656375546, 'spread_hl_frac': 0.012895774183430509, 'bb_std_mult': 2.330349752426725, 'rsi_os': 30, 'rsi_ob': 65, 'vol_spike': 0.08333438108433389, 'adx_thresh': 27.353838884608304, 'atr_min_pct': 0.003722325650887334, 'atr_max_pct': 0.12435283756997922, 'tp_mult': 1.6737650294640103, 'tsl_mult': 0.06565510806812057, 'strategy': 'breakout', 'time_stop': 214, 'use_sma': False, 'use_atr': False, 'use_adx': True, 'use_ema': True, 'use_spike': True, 'rsi_required': True, 'edge_k': 0.23483882079405116, 'edge_cap': 0.21205133609642063, 'bull_strategy': 'breakout', 'bull_bb_std_mult': 2.95398294129961, 'bull_rsi_os': 36, 'bull_rsi_ob': 47, 'bull_adx_thresh': 8.136252930498426, 'bull_atr_min_pct': 0.001987971648243267, 'bull_atr_max_pct': 0.02030078553253624, 'bull_tp_mult': 1.6213228520261693, 'bull_tsl_mult': 0.6194085234416725, 'bull_time_stop': 274, 'bull_use_sma': True, 'bull_use_ema': True, 'bull_use_atr': False, 'bull_use_adx': False, 'bull_use_spike': False, 'bull_rsi_required': False, 'bear_strategy': 'mean_reversion', 'bear_bb_std_mult': 1.89167448517175, 'bear_rsi_os': 45, 'bear_rsi_ob': 77, 'bear_adx_thresh': 6.640369699317862, 'bear_atr_min_pct': 0.004070313972744003, 'bear_atr_max_pct': 0.08020078661728569, 'bear_tp_mult': 2.1733960180335803, 'bear_tsl_mult': 0.1266665471816267, 'bear_time_stop': 289, 'bear_use_sma': True, 'bear_use_ema': False, 'bear_use_atr': False, 'bear_use_adx': True, 'bear_use_spike': False, 'bear_rsi_required': False, 'sideways_strategy': 'breakout', 'sideways_bb_std_mult': 0.7709961447145266, 'sideways_rsi_os': 10, 'sideways_rsi_ob': 93, 'sideways_adx_thresh': 12.912818214136918, 'sideways_atr_min_pct': 0.029287276529468668, 'sideways_atr_max_pct': 0.019890081031817837, 'sideways_tp_mult': 1.4540715003511584, 'sideways_tsl_mult': 0.3747108525742652, 'sideways_time_stop': 206, 'sideways_use_sma': True, 'sideways_use_ema': True, 'sideways_use_atr': True, 'sideways_use_adx': True, 'sideways_use_spike': False, 'sideways_rsi_required': False}.
[I 2025-09-01 08:00:39,999] Trial 237 finished with values: [-0.041795589506193775, 0.042106192835372334] and parameters: {'p_sma': 28, 'p_std': 54, 'p_atr': 19, 'p_adx': 30, 'rsi_period': 56, 'ema1': 15, 'ema2': 32, 'slip_atr_k': 0.24830155385093483, 'slip_spread_k': 0.8954029074364829, 'spread_hl_frac': 0.012968562690457831, 'bb_std_mult': 3.0442010462600417, 'rsi_os': 32, 'rsi_ob': 93, 'vol_spike': 0.044562184972534544, 'adx_thresh': 30.099239888370878, 'atr_min_pct': 0.002022645882282562, 'atr_max_pct': 0.09634707076287075, 'tp_mult': 1.7395886415303274, 'tsl_mult': 0.056066731116196096, 'strategy': 'breakout', 'time_stop': 262, 'use_sma': False, 'use_atr': False, 'use_adx': True, 'use_ema': True, 'use_spike': True, 'rsi_required': True, 'edge_k': 0.23779278276276064, 'edge_cap': 0.2304926052556388, 'bull_strategy': 'breakout', 'bull_bb_std_mult': 2.9310361620780188, 'bull_rsi_os': 53, 'bull_rsi_ob': 46, 'bull_adx_thresh': 9.246829882607665, 'bull_atr_min_pct': 0.0072916119130647696, 'bull_atr_max_pct': 0.08105222902228434, 'bull_tp_mult': 1.6078405012615258, 'bull_tsl_mult': 0.6274048275804514, 'bull_time_stop': 60, 'bull_use_sma': True, 'bull_use_ema': True, 'bull_use_atr': False, 'bull_use_adx': False, 'bull_use_spike': False, 'bull_rsi_required': False, 'bear_strategy': 'mean_reversion', 'bear_bb_std_mult': 3.201804918851473, 'bear_rsi_os': 45, 'bear_rsi_ob': 77, 'bear_adx_thresh': 5.721828039339445, 'bear_atr_min_pct': 0.004380256250289328, 'bear_atr_max_pct': 0.0800684778272708, 'bear_tp_mult': 2.244013286879816, 'bear_tsl_mult': 0.8990135220942066, 'bear_time_stop': 287, 'bear_use_sma': True, 'bear_use_ema': False, 'bear_use_atr': False, 'bear_use_adx': True, 'bear_use_spike': False, 'bear_rsi_required': False, 'sideways_strategy': 'breakout', 'sideways_bb_std_mult': 0.7589324903764522, 'sideways_rsi_os': 10, 'sideways_rsi_ob': 93, 'sideways_adx_thresh': 9.081056386019842, 'sideways_atr_min_pct': 0.029388146618146392, 'sideways_atr_max_pct': 0.11514164090236079, 'sideways_tp_mult': 1.4673200162359934, 'sideways_tsl_mult': 0.11498112519268856, 'sideways_time_stop': 292, 'sideways_use_sma': True, 'sideways_use_ema': True, 'sideways_use_atr': True, 'sideways_use_adx': True, 'sideways_use_spike': False, 'sideways_rsi_required': False}.
[I 2025-09-01 08:00:40,025] Trial 238 finished with values: [-0.08801889896746906, 0.08807783821885952] and parameters: {'p_sma': 25, 'p_std': 16, 'p_atr': 18, 'p_adx': 25, 'rsi_period': 58, 'ema1': 24, 'ema2': 21, 'slip_atr_k': 0.16782890230606876, 'slip_spread_k': 0.887062812976231, 'spread_hl_frac': 3.1913302413746555e-05, 'bb_std_mult': 3.065243327955613, 'rsi_os': 30, 'rsi_ob': 95, 'vol_spike': 0.08147143227020123, 'adx_thresh': 30.229706886780715, 'atr_min_pct': 0.004197105872575935, 'atr_max_pct': 0.09605376044162836, 'tp_mult': 1.638821698980976, 'tsl_mult': 0.060941906288193515, 'strategy': 'breakout', 'time_stop': 216, 'use_sma': False, 'use_atr': False, 'use_adx': True, 'use_ema': True, 'use_spike': True, 'rsi_required': True, 'edge_k': 0.2789661105637158, 'edge_cap': 0.6880771541920208, 'bull_strategy': 'breakout', 'bull_bb_std_mult': 2.9566864506290624, 'bull_rsi_os': 47, 'bull_rsi_ob': 65, 'bull_adx_thresh': 9.219448512074356, 'bull_atr_min_pct': 0.0017383581450270912, 'bull_atr_max_pct': 0.09587223914137387, 'bull_tp_mult': 1.596214955704872, 'bull_tsl_mult': 0.6188511188282725, 'bull_time_stop': 60, 'bull_use_sma': True, 'bull_use_ema': True, 'bull_use_atr': False, 'bull_use_adx': False, 'bull_use_spike': False, 'bull_rsi_required': False, 'bear_strategy': 'mean_reversion', 'bear_bb_std_mult': 1.628776744049595, 'bear_rsi_os': 45, 'bear_rsi_ob': 77, 'bear_adx_thresh': 5.697207224282858, 'bear_atr_min_pct': 0.004388482354094232, 'bear_atr_max_pct': 0.07957806814107005, 'bear_tp_mult': 2.180520566285501, 'bear_tsl_mult': 0.8925368620036723, 'bear_time_stop': 285, 'bear_use_sma': True, 'bear_use_ema': False, 'bear_use_atr': False, 'bear_use_adx': True, 'bear_use_spike': False, 'bear_rsi_required': False, 'sideways_strategy': 'breakout', 'sideways_bb_std_mult': 0.7392124920175331, 'sideways_rsi_os': 10, 'sideways_rsi_ob': 93, 'sideways_adx_thresh': 22.980292447571045, 'sideways_atr_min_pct': 0.029476696941170354, 'sideways_atr_max_pct': 0.010053784264604487, 'sideways_tp_mult': 1.2202683740374964, 'sideways_tsl_mult': 0.37557731243922143, 'sideways_time_stop': 218, 'sideways_use_sma': True, 'sideways_use_ema': True, 'sideways_use_atr': True, 'sideways_use_adx': True, 'sideways_use_spike': False, 'sideways_rsi_required': False}.
[I 2025-09-01 08:00:40,027] Trial 236 finished with values: [-0.07454842862132716, 0.07449343869279222] and parameters: {'p_sma': 29, 'p_std': 54, 'p_atr': 25, 'p_adx': 30, 'rsi_period': 67, 'ema1': 9, 'ema2': 20, 'slip_atr_k': 0.08961990067928774, 'slip_spread_k': 0.8881142970201819, 'spread_hl_frac': 0.012730268456105519, 'bb_std_mult': 3.0868846268030414, 'rsi_os': 30, 'rsi_ob': 93, 'vol_spike': 0.11547137785734969, 'adx_thresh': 25.995228123737895, 'atr_min_pct': 0.004012302239737657, 'atr_max_pct': 0.09527934309008596, 'tp_mult': 1.664668585715133, 'tsl_mult': 0.06468570936471574, 'strategy': 'breakout', 'time_stop': 210, 'use_sma': False, 'use_atr': False, 'use_adx': True, 'use_ema': True, 'use_spike': True, 'rsi_required': True, 'edge_k': 0.22608095044690915, 'edge_cap': 0.5334009906514399, 'bull_strategy': 'breakout', 'bull_bb_std_mult': 2.908492976188209, 'bull_rsi_os': 47, 'bull_rsi_ob': 65, 'bull_adx_thresh': 9.142760212292579, 'bull_atr_min_pct': 0.0019042310032572733, 'bull_atr_max_pct': 0.034495070935037356, 'bull_tp_mult': 1.6309650597103504, 'bull_tsl_mult': 0.6227065414567016, 'bull_time_stop': 59, 'bull_use_sma': True, 'bull_use_ema': True, 'bull_use_atr': False, 'bull_use_adx': False, 'bull_use_spike': False, 'bull_rsi_required': False, 'bear_strategy': 'mean_reversion', 'bear_bb_std_mult': 1.610927402292893, 'bear_rsi_os': 45, 'bear_rsi_ob': 77, 'bear_adx_thresh': 6.796991865667107, 'bear_atr_min_pct': 0.0010834785378087755, 'bear_atr_max_pct': 0.07973432011843164, 'bear_tp_mult': 2.2459915088396523, 'bear_tsl_mult': 0.12648552397706067, 'bear_time_stop': 289, 'bear_use_sma': True, 'bear_use_ema': False, 'bear_use_atr': False, 'bear_use_adx': True, 'bear_use_spike': False, 'bear_rsi_required': False, 'sideways_strategy': 'breakout', 'sideways_bb_std_mult': 0.760755158696794, 'sideways_rsi_os': 7, 'sideways_rsi_ob': 93, 'sideways_adx_thresh': 24.400330614738248, 'sideways_atr_min_pct': 0.029457810558045625, 'sideways_atr_max_pct': 0.019878765947888875, 'sideways_tp_mult': 1.2287467325622559, 'sideways_tsl_mult': 0.10562607348765246, 'sideways_time_stop': 206, 'sideways_use_sma': True, 'sideways_use_ema': True, 'sideways_use_atr': True, 'sideways_use_adx': True, 'sideways_use_spike': False, 'sideways_rsi_required': False}.
[I 2025-09-01 08:01:20,188] Trial 239 finished with values: [-1000000000.0, 1000000000.0] and parameters: {'p_sma': 25, 'p_std': 57, 'p_atr': 23, 'p_adx': 9, 'rsi_period': 59, 'ema1': 17, 'ema2': 15, 'slip_atr_k': 0.005738186457483399, 'slip_spread_k': 0.9479543073845169, 'spread_hl_frac': 0.008094452577348196, 'bb_std_mult': 3.577913358183862, 'rsi_os': 17, 'rsi_ob': 92, 'vol_spike': 0.07202900936485708, 'adx_thresh': 30.95716934153316, 'atr_min_pct': 0.006010697499057675, 'atr_max_pct': 0.08835937581366507, 'tp_mult': 1.9408680745926532, 'tsl_mult': 0.10353858545077022, 'strategy': 'breakout', 'time_stop': 239, 'use_sma': False, 'use_atr': False, 'use_adx': True, 'use_ema': True, 'use_spike': True, 'rsi_required': True, 'edge_k': 0.3511787249288544, 'edge_cap': 0.7798903478131026, 'bull_strategy': 'breakout', 'bull_bb_std_mult': 3.2007922267167723, 'bull_rsi_os': 42, 'bull_rsi_ob': 47, 'bull_adx_thresh': 8.015238962068464, 'bull_atr_min_pct': 0.012194627679500365, 'bull_atr_max_pct': 0.09897688825649714, 'bull_tp_mult': 1.5342240937291274, 'bull_tsl_mult': 0.2578103579383464, 'bull_time_stop': 293, 'bull_use_sma': True, 'bull_use_ema': False, 'bull_use_atr': False, 'bull_use_adx': False, 'bull_use_spike': False, 'bull_rsi_required': False, 'bear_strategy': 'mean_reversion', 'bear_bb_std_mult': 1.8810121684687606, 'bear_rsi_os': 43, 'bear_rsi_ob': 80, 'bear_adx_thresh': 5.873818147768108, 'bear_atr_min_pct': 0.022343114220628867, 'bear_atr_max_pct': 0.09607376317314902, 'bear_tp_mult': 2.1387234788551712, 'bear_tsl_mult': 0.7973443015406727, 'bear_time_stop': 300, 'bear_use_sma': True, 'bear_use_ema': False, 'bear_use_atr': True, 'bear_use_adx': False, 'bear_use_spike': False, 'bear_rsi_required': False, 'sideways_strategy': 'breakout', 'sideways_bb_std_mult': 0.9980018673759027, 'sideways_rsi_os': 7, 'sideways_rsi_ob': 94, 'sideways_adx_thresh': 18.367427595539983, 'sideways_atr_min_pct': 0.025799702637243637, 'sideways_atr_max_pct': 0.025291020905926883, 'sideways_tp_mult': 1.3865434184249157, 'sideways_tsl_mult': 0.1581263951814916, 'sideways_time_stop': 121, 'sideways_use_sma': True, 'sideways_use_ema': True, 'sideways_use_atr': False, 'sideways_use_adx': True, 'sideways_use_spike': False, 'sideways_rsi_required': False}.
[I 2025-09-01 08:01:21,198] Trial 242 finished with values: [-1000000000.0, 1000000000.0] and parameters: {'p_sma': 25, 'p_std': 13, 'p_atr': 23, 'p_adx': 20, 'rsi_period': 54, 'ema1': 17, 'ema2': 15, 'slip_atr_k': 0.07715512293660695, 'slip_spread_k': 0.9504267757048748, 'spread_hl_frac': 0.008047393261962629, 'bb_std_mult': 3.5803997785909374, 'rsi_os': 18, 'rsi_ob': 92, 'vol_spike': 0.07152547515793733, 'adx_thresh': 12.064726761162987, 'atr_min_pct': 0.005586789746013121, 'atr_max_pct': 0.13291970024040717, 'tp_mult': 1.7211820704553116, 'tsl_mult': 0.09207066587013116, 'strategy': 'breakout', 'time_stop': 238, 'use_sma': False, 'use_atr': False, 'use_adx': True, 'use_ema': True, 'use_spike': True, 'rsi_required': True, 'edge_k': 0.34213491472634905, 'edge_cap': 0.2042992506121986, 'bull_strategy': 'breakout', 'bull_bb_std_mult': 3.2045472470402614, 'bull_rsi_os': 24, 'bull_rsi_ob': 67, 'bull_adx_thresh': 7.96351792312906, 'bull_atr_min_pct': 0.01192831191177855, 'bull_atr_max_pct': 0.09866505341531176, 'bull_tp_mult': 1.5339836050968019, 'bull_tsl_mult': 0.5583962585956671, 'bull_time_stop': 80, 'bull_use_sma': True, 'bull_use_ema': False, 'bull_use_atr': False, 'bull_use_adx': False, 'bull_use_spike': False, 'bull_rsi_required': False, 'bear_strategy': 'mean_reversion', 'bear_bb_std_mult': 1.6939265784563395, 'bear_rsi_os': 8, 'bear_rsi_ob': 80, 'bear_adx_thresh': 6.047420616342631, 'bear_atr_min_pct': 0.02240805076290537, 'bear_atr_max_pct': 0.09559440867669233, 'bear_tp_mult': 2.046571884489685, 'bear_tsl_mult': 0.042386371220398116, 'bear_time_stop': 294, 'bear_use_sma': True, 'bear_use_ema': False, 'bear_use_atr': True, 'bear_use_adx': False, 'bear_use_spike': False, 'bear_rsi_required': False, 'sideways_strategy': 'breakout', 'sideways_bb_std_mult': 1.2614661960937996, 'sideways_rsi_os': 7, 'sideways_rsi_ob': 94, 'sideways_adx_thresh': 11.278138868715693, 'sideways_atr_min_pct': 0.027361759199332068, 'sideways_atr_max_pct': 0.06923855351393207, 'sideways_tp_mult': 2.323066143345866, 'sideways_tsl_mult': 0.05522784334885328, 'sideways_time_stop': 251, 'sideways_use_sma': True, 'sideways_use_ema': True, 'sideways_use_atr': False, 'sideways_use_adx': True, 'sideways_use_spike': False, 'sideways_rsi_required': False}.
[I 2025-09-01 08:01:21,903] Trial 240 finished with values: [-0.002929028022158997, 0.0035711397932389967] and parameters: {'p_sma': 25, 'p_std': 14, 'p_atr': 23, 'p_adx': 20, 'rsi_period': 60, 'ema1': 17, 'ema2': 48, 'slip_atr_k': 0.009292362721262815, 'slip_spread_k': 0.9488289458696348, 'spread_hl_frac': 0.015793993339590723, 'bb_std_mult': 1.9845422182125572, 'rsi_os': 34, 'rsi_ob': 92, 'vol_spike': 0.0977838799663924, 'adx_thresh': 28.600514328600575, 'atr_min_pct': 0.005680483867869557, 'atr_max_pct': 0.036072950012256126, 'tp_mult': 1.7282916367604677, 'tsl_mult': 0.10356459784526904, 'strategy': 'breakout', 'time_stop': 190, 'use_sma': False, 'use_atr': False, 'use_adx': True, 'use_ema': True, 'use_spike': True, 'rsi_required': True, 'edge_k': 0.3525265710319667, 'edge_cap': 0.9423408849243144, 'bull_strategy': 'breakout', 'bull_bb_std_mult': 3.2041255212989, 'bull_rsi_os': 24, 'bull_rsi_ob': 82, 'bull_adx_thresh': 8.062231666797697, 'bull_atr_min_pct': 0.004054889557898015, 'bull_atr_max_pct': 0.026575506477967067, 'bull_tp_mult': 1.4875591164665516, 'bull_tsl_mult': 0.24817825358628443, 'bull_time_stop': 80, 'bull_use_sma': True, 'bull_use_ema': False, 'bull_use_atr': False, 'bull_use_adx': False, 'bull_use_spike': False, 'bull_rsi_required': False, 'bear_strategy': 'mean_reversion', 'bear_bb_std_mult': 1.6807960440132017, 'bear_rsi_os': 48, 'bear_rsi_ob': 80, 'bear_adx_thresh': 6.043459794316796, 'bear_atr_min_pct': 0.01938706029740514, 'bear_atr_max_pct': 0.09659829399492768, 'bear_tp_mult': 2.1367273074593496, 'bear_tsl_mult': 0.10134241670151715, 'bear_time_stop': 296, 'bear_use_sma': True, 'bear_use_ema': False, 'bear_use_atr': True, 'bear_use_adx': False, 'bear_use_spike': False, 'bear_rsi_required': False, 'sideways_strategy': 'breakout', 'sideways_bb_std_mult': 1.9145827603341221, 'sideways_rsi_os': 7, 'sideways_rsi_ob': 94, 'sideways_adx_thresh': 9.740718241265055, 'sideways_atr_min_pct': 0.02759755300171317, 'sideways_atr_max_pct': 0.05525184591354733, 'sideways_tp_mult': 1.3919337122399233, 'sideways_tsl_mult': 0.150266014564149, 'sideways_time_stop': 280, 'sideways_use_sma': True, 'sideways_use_ema': True, 'sideways_use_atr': False, 'sideways_use_adx': True, 'sideways_use_spike': False, 'sideways_rsi_required': False}.
[I 2025-09-01 08:01:21,916] Trial 241 finished with values: [-0.008307541684499431, 0.008509732321346379] and parameters: {'p_sma': 25, 'p_std': 14, 'p_atr': 23, 'p_adx': 9, 'rsi_period': 59, 'ema1': 28, 'ema2': 48, 'slip_atr_k': 0.10356979016282862, 'slip_spread_k': 0.9131456843173721, 'spread_hl_frac': 0.015948106104425833, 'bb_std_mult': 1.887141525927994, 'rsi_os': 18, 'rsi_ob': 92, 'vol_spike': 0.06883043316740224, 'adx_thresh': 27.6608813101213, 'atr_min_pct': 0.005718357280020723, 'atr_max_pct': 0.08894877633136238, 'tp_mult': 1.7319048060951148, 'tsl_mult': 0.10829473735399386, 'strategy': 'breakout', 'time_stop': 240, 'use_sma': False, 'use_atr': False, 'use_adx': True, 'use_ema': True, 'use_spike': True, 'rsi_required': True, 'edge_k': 0.10998779895439711, 'edge_cap': 0.21237114658575498, 'bull_strategy': 'breakout', 'bull_bb_std_mult': 3.181120335087048, 'bull_rsi_os': 48, 'bull_rsi_ob': 61, 'bull_adx_thresh': 8.206119044830114, 'bull_atr_min_pct': 0.003926174038281054, 'bull_atr_max_pct': 0.09851203632056943, 'bull_tp_mult': 1.5290220012334061, 'bull_tsl_mult': 0.5577743824959669, 'bull_time_stop': 265, 'bull_use_sma': True, 'bull_use_ema': False, 'bull_use_atr': False, 'bull_use_adx': False, 'bull_use_spike': False, 'bull_rsi_required': False, 'bear_strategy': 'mean_reversion', 'bear_bb_std_mult': 1.2877121180355824, 'bear_rsi_os': 7, 'bear_rsi_ob': 80, 'bear_adx_thresh': 6.108247103580996, 'bear_atr_min_pct': 0.02350950864612944, 'bear_atr_max_pct': 0.096843730080049, 'bear_tp_mult': 2.0154752120784516, 'bear_tsl_mult': 0.04859148412616486, 'bear_time_stop': 294, 'bear_use_sma': True, 'bear_use_ema': False, 'bear_use_atr': True, 'bear_use_adx': False, 'bear_use_spike': False, 'bear_rsi_required': False, 'sideways_strategy': 'breakout', 'sideways_bb_std_mult': 0.9946408042144919, 'sideways_rsi_os': 9, 'sideways_rsi_ob': 94, 'sideways_adx_thresh': 10.623443667526349, 'sideways_atr_min_pct': 0.006416282351291387, 'sideways_atr_max_pct': 0.01633575079988596, 'sideways_tp_mult': 1.8741814934457415, 'sideways_tsl_mult': 0.14937982388082707, 'sideways_time_stop': 125, 'sideways_use_sma': True, 'sideways_use_ema': True, 'sideways_use_atr': False, 'sideways_use_adx': True, 'sideways_use_spike': False, 'sideways_rsi_required': False}.
