[I 2025-09-01 08:17:32,698] Trial 326 finished with values: [-1000000000.0, 1000000000.0] and parameters: {'p_sma': 16, 'p_std': 56, 'p_atr': 21, 'p_adx': 22, 'rsi_period': 58, 'ema1': 16, 'ema2': 13, 'slip_atr_k': 0.16126246677319733, 'slip_spread_k': 0.9235735026416783, 'spread_hl_frac': 0.010879598612088003, 'bb_std_mult': 2.4497314087557123, 'rsi_os': 28, 'rsi_ob': 89, 'vol_spike': 0.1099175862988164, 'adx_thresh': 21.109586637932036, 'atr_min_pct': 0.002215952259482284, 'atr_max_pct': 0.07118263659873618, 'tp_mult': 1.855683016666558, 'tsl_mult': 0.12704079436837348, 'strategy': 'breakout', 'time_stop': 219, 'use_sma': False, 'use_atr': True, 'use_adx': True, 'use_ema': True, 'use_spike': True, 'rsi_required': True, 'edge_k': 0.07745651827713262, 'edge_cap': 0.17271278264634315, 'bull_strategy': 'mean_reversion', 'bull_bb_std_mult': 3.0707416364106273, 'bull_rsi_os': 45, 'bull_rsi_ob': 79, 'bull_adx_thresh': 32.20199643140347, 'bull_atr_min_pct': 0.0029763067222208185, 'bull_atr_max_pct': 0.07374979793481418, 'bull_tp_mult': 1.4992495483275483, 'bull_tsl_mult': 0.8301019081883582, 'bull_time_stop': 53, 'bull_use_sma': True, 'bull_use_ema': False, 'bull_use_atr': False, 'bull_use_adx': False, 'bull_use_spike': False, 'bull_rsi_required': False, 'bear_strategy': 'mean_reversion', 'bear_bb_std_mult': 1.2256193901242864, 'bear_rsi_os': 43, 'bear_rsi_ob': 80, 'bear_adx_thresh': 7.617687194889747, 'bear_atr_min_pct': 0.00678553388744961, 'bear_atr_max_pct': 0.09150705721108825, 'bear_tp_mult': 1.6301363444140233, 'bear_tsl_mult': 0.9212081790685159, 'bear_time_stop': 291, 'bear_use_sma': True, 'bear_use_ema': False, 'bear_use_atr': False, 'bear_use_adx': False, 'bear_use_spike': False, 'bear_rsi_required': False, 'sideways_strategy': 'mean_reversion', 'sideways_bb_std_mult': 1.274328617933334, 'sideways_rsi_os': 5, 'sideways_rsi_ob': 79, 'sideways_adx_thresh': 25.07292517394535, 'sideways_atr_min_pct': 0.00980840696430775, 'sideways_atr_max_pct': 0.10341390434648373, 'sideways_tp_mult': 2.458579237082898, 'sideways_tsl_mult': 0.17554583538567367, 'sideways_time_stop': 28, 'sideways_use_sma': True, 'sideways_use_ema': True, 'sideways_use_atr': False, 'sideways_use_adx': True, 'sideways_use_spike': False, 'sideways_rsi_required': False}.
[I 2025-09-01 08:17:33,236] Trial 325 finished with values: [-1000000000.0, 1000000000.0] and parameters: {'p_sma': 32, 'p_std': 42, 'p_atr': 21, 'p_adx': 25, 'rsi_period': 58, 'ema1': 14, 'ema2': 33, 'slip_atr_k': 0.0043259299720371834, 'slip_spread_k': 0.8842554747276272, 'spread_hl_frac': 0.031093630613078797, 'bb_std_mult': 2.467024352838729, 'rsi_os': 20, 'rsi_ob': 92, 'vol_spike': 0.07347927429948796, 'adx_thresh': 27.50581528806055, 'atr_min_pct': 0.0022465633426855466, 'atr_max_pct': 0.1295479215621001, 'tp_mult': 1.5673362998842648, 'tsl_mult': 0.1404285126931733, 'strategy': 'breakout', 'time_stop': 236, 'use_sma': False, 'use_atr': False, 'use_adx': True, 'use_ema': True, 'use_spike': True, 'rsi_required': True, 'edge_k': 1.009934005502662, 'edge_cap': 0.18116509332431427, 'bull_strategy': 'breakout', 'bull_bb_std_mult': 3.569772864066011, 'bull_rsi_os': 55, 'bull_rsi_ob': 48, 'bull_adx_thresh': 6.744436280079281, 'bull_atr_min_pct': 0.003924295442942604, 'bull_atr_max_pct': 0.04372669056941604, 'bull_tp_mult': 1.5105340369170408, 'bull_tsl_mult': 0.6019747922531232, 'bull_time_stop': 54, 'bull_use_sma': True, 'bull_use_ema': False, 'bull_use_atr': False, 'bull_use_adx': False, 'bull_use_spike': False, 'bull_rsi_required': False, 'bear_strategy': 'mean_reversion', 'bear_bb_std_mult': 2.034874334301831, 'bear_rsi_os': 21, 'bear_rsi_ob': 80, 'bear_adx_thresh': 5.037398790785674, 'bear_atr_min_pct': 0.016348577631208068, 'bear_atr_max_pct': 0.1087383480488962, 'bear_tp_mult': 2.581530746367515, 'bear_tsl_mult': 0.5558743742260881, 'bear_time_stop': 291, 'bear_use_sma': True, 'bear_use_ema': False, 'bear_use_atr': False, 'bear_use_adx': False, 'bear_use_spike': False, 'bear_rsi_required': False, 'sideways_strategy': 'breakout', 'sideways_bb_std_mult': 0.8916300384005661, 'sideways_rsi_os': 7, 'sideways_rsi_ob': 79, 'sideways_adx_thresh': 13.570615381551834, 'sideways_atr_min_pct': 0.009874985769675909, 'sideways_atr_max_pct': 0.09403323759003693, 'sideways_tp_mult': 1.3953221432831298, 'sideways_tsl_mult': 0.7941915803047799, 'sideways_time_stop': 231, 'sideways_use_sma': True, 'sideways_use_ema': True, 'sideways_use_atr': True, 'sideways_use_adx': True, 'sideways_use_spike': False, 'sideways_rsi_required': False}.
[I 2025-09-01 08:17:33,680] Trial 324 finished with values: [-0.009329768849573372, 0.010445732895262847] and parameters: {'p_sma': 28, 'p_std': 35, 'p_atr': 23, 'p_adx': 28, 'rsi_period': 47, 'ema1': 14, 'ema2': 13, 'slip_atr_k': 0.16224486274937194, 'slip_spread_k': 0.9087485218418142, 'spread_hl_frac': 0.030168123172888053, 'bb_std_mult': 1.924959215019717, 'rsi_os': 20, 'rsi_ob': 61, 'vol_spike': 0.11337307834213628, 'adx_thresh': 27.47766152597194, 'atr_min_pct': 0.020157653919444105, 'atr_max_pct': 0.07211906899306846, 'tp_mult': 2.0574035679159075, 'tsl_mult': 0.13799854493341673, 'strategy': 'breakout', 'time_stop': 220, 'use_sma': False, 'use_atr': False, 'use_adx': True, 'use_ema': True, 'use_spike': True, 'rsi_required': True, 'edge_k': 0.25053223542001507, 'edge_cap': 0.5981210522988519, 'bull_strategy': 'breakout', 'bull_bb_std_mult': 3.0905637180972696, 'bull_rsi_os': 45, 'bull_rsi_ob': 69, 'bull_adx_thresh': 6.630410565413076, 'bull_atr_min_pct': 0.0030662790929689874, 'bull_atr_max_pct': 0.04324895540136312, 'bull_tp_mult': 1.4921531019173375, 'bull_tsl_mult': 0.6138493532382348, 'bull_time_stop': 53, 'bull_use_sma': True, 'bull_use_ema': True, 'bull_use_atr': False, 'bull_use_adx': False, 'bull_use_spike': False, 'bull_rsi_required': False, 'bear_strategy': 'mean_reversion', 'bear_bb_std_mult': 2.973501210441216, 'bear_rsi_os': 34, 'bear_rsi_ob': 75, 'bear_adx_thresh': 5.668328947848336, 'bear_atr_min_pct': 0.00952257746794671, 'bear_atr_max_pct': 0.09985474458388452, 'bear_tp_mult': 2.1344991373548363, 'bear_tsl_mult': 0.11999635063911546, 'bear_time_stop': 291, 'bear_use_sma': True, 'bear_use_ema': False, 'bear_use_atr': False, 'bear_use_adx': True, 'bear_use_spike': False, 'bear_rsi_required': False, 'sideways_strategy': 'breakout', 'sideways_bb_std_mult': 0.8803967789839863, 'sideways_rsi_os': 13, 'sideways_rsi_ob': 94, 'sideways_adx_thresh': 13.643005699528453, 'sideways_atr_min_pct': 0.02960828206736049, 'sideways_atr_max_pct': 0.026908383960453065, 'sideways_tp_mult': 2.4695153945438673, 'sideways_tsl_mult': 0.7912925714792581, 'sideways_time_stop': 33, 'sideways_use_sma': True, 'sideways_use_ema': True, 'sideways_use_atr': True, 'sideways_use_adx': True, 'sideways_use_spike': False, 'sideways_rsi_required': False}.
[I 2025-09-01 08:17:34,025] Trial 327 finished with values: [-1000000000.0, 1000000000.0] and parameters: {'p_sma': 30, 'p_std': 56, 'p_atr': 21, 'p_adx': 21, 'rsi_period': 67, 'ema1': 16, 'ema2': 13, 'slip_atr_k': 0.08242490368808794, 'slip_spread_k': 0.8744745109498387, 'spread_hl_frac': 0.0172309405925614, 'bb_std_mult': 0.9865568229208093, 'rsi_os': 28, 'rsi_ob': 89, 'vol_spike': 0.24176545423350643, 'adx_thresh': 6.804315039331994, 'atr_min_pct': 0.005699907297226386, 'atr_max_pct': 0.11887273310015438, 'tp_mult': 1.5754994753684926, 'tsl_mult': 0.06101651270528065, 'strategy': 'breakout', 'time_stop': 235, 'use_sma': False, 'use_atr': True, 'use_adx': True, 'use_ema': True, 'use_spike': True, 'rsi_required': True, 'edge_k': 0.16524376489562786, 'edge_cap': 0.17570325731326686, 'bull_strategy': 'mean_reversion', 'bull_bb_std_mult': 3.0807683511771478, 'bull_rsi_os': 45, 'bull_rsi_ob': 69, 'bull_adx_thresh': 5.618853936795486, 'bull_atr_min_pct': 0.005265151229153285, 'bull_atr_max_pct': 0.014814007594089316, 'bull_tp_mult': 1.4925416746356035, 'bull_tsl_mult': 0.5986633845475254, 'bull_time_stop': 55, 'bull_use_sma': True, 'bull_use_ema': False, 'bull_use_atr': False, 'bull_use_adx': False, 'bull_use_spike': False, 'bull_rsi_required': False, 'bear_strategy': 'mean_reversion', 'bear_bb_std_mult': 1.250753191395059, 'bear_rsi_os': 19, 'bear_rsi_ob': 80, 'bear_adx_thresh': 5.003717248839715, 'bear_atr_min_pct': 0.024696825684518853, 'bear_atr_max_pct': 0.10879035142320943, 'bear_tp_mult': 2.3480294537647786, 'bear_tsl_mult': 0.07203893436442406, 'bear_time_stop': 290, 'bear_use_sma': True, 'bear_use_ema': False, 'bear_use_atr': False, 'bear_use_adx': False, 'bear_use_spike': False, 'bear_rsi_required': False, 'sideways_strategy': 'mean_reversion', 'sideways_bb_std_mult': 0.9020550105836606, 'sideways_rsi_os': 5, 'sideways_rsi_ob': 78, 'sideways_adx_thresh': 25.048317711366607, 'sideways_atr_min_pct': 0.028133419552932228, 'sideways_atr_max_pct': 0.11331297176018586, 'sideways_tp_mult': 2.4252047303391686, 'sideways_tsl_mult': 0.5650639216201435, 'sideways_time_stop': 31, 'sideways_use_sma': True, 'sideways_use_ema': True, 'sideways_use_atr': False, 'sideways_use_adx': True, 'sideways_use_spike': False, 'sideways_rsi_required': False}.
[I 2025-09-01 08:18:12,630] Trial 330 finished with values: [-1000000000.0, 1000000000.0] and parameters: {'p_sma': 55, 'p_std': 56, 'p_atr': 19, 'p_adx': 21, 'rsi_period': 24, 'ema1': 13, 'ema2': 17, 'slip_atr_k': 0.18198664485083968, 'slip_spread_k': 0.15193187933006136, 'spread_hl_frac': 0.042905992941851226, 'bb_std_mult': 2.093231351591199, 'rsi_os': 39, 'rsi_ob': 73, 'vol_spike': 0.04785077098260994, 'adx_thresh': 25.96166682434248, 'atr_min_pct': 0.005525871972796824, 'atr_max_pct': 0.09131182026198435, 'tp_mult': 1.6303396620679897, 'tsl_mult': 0.0009619452355938279, 'strategy': 'mean_reversion', 'time_stop': 248, 'use_sma': False, 'use_atr': False, 'use_adx': True, 'use_ema': True, 'use_spike': True, 'rsi_required': True, 'edge_k': 0.15491690909266725, 'edge_cap': 0.25311039641960087, 'bull_strategy': 'breakout', 'bull_bb_std_mult': 2.089527117608683, 'bull_rsi_os': 49, 'bull_rsi_ob': 49, 'bull_adx_thresh': 9.729464113024422, 'bull_atr_min_pct': 0.0053919972139394815, 'bull_atr_max_pct': 0.023183394598658397, 'bull_tp_mult': 2.5267754654094, 'bull_tsl_mult': 0.5641377737276135, 'bull_time_stop': 287, 'bull_use_sma': True, 'bull_use_ema': False, 'bull_use_atr': False, 'bull_use_adx': False, 'bull_use_spike': False, 'bull_rsi_required': False, 'bear_strategy': 'mean_reversion', 'bear_bb_std_mult': 1.9542555670388106, 'bear_rsi_os': 48, 'bear_rsi_ob': 90, 'bear_adx_thresh': 14.84869707448876, 'bear_atr_min_pct': 0.01776536403606107, 'bear_atr_max_pct': 0.10444669979206885, 'bear_tp_mult': 2.1653610651823048, 'bear_tsl_mult': 0.8775682991560657, 'bear_time_stop': 285, 'bear_use_sma': True, 'bear_use_ema': False, 'bear_use_atr': True, 'bear_use_adx': False, 'bear_use_spike': False, 'bear_rsi_required': False, 'sideways_strategy': 'breakout', 'sideways_bb_std_mult': 0.9706345462953968, 'sideways_rsi_os': 6, 'sideways_rsi_ob': 95, 'sideways_adx_thresh': 14.71858266780154, 'sideways_atr_min_pct': 0.02616184714743926, 'sideways_atr_max_pct': 0.02366251994473073, 'sideways_tp_mult': 1.242623150339202, 'sideways_tsl_mult': 0.5588215998841635, 'sideways_time_stop': 104, 'sideways_use_sma': True, 'sideways_use_ema': True, 'sideways_use_atr': False, 'sideways_use_adx': True, 'sideways_use_spike': False, 'sideways_rsi_required': False}.
[I 2025-09-01 08:18:13,099] Trial 331 finished with values: [-1000000000.0, 1000000000.0] and parameters: {'p_sma': 8, 'p_std': 58, 'p_atr': 19, 'p_adx': 12, 'rsi_period': 54, 'ema1': 13, 'ema2': 10, 'slip_atr_k': 0.010932399951530832, 'slip_spread_k': 0.8962629612159272, 'spread_hl_frac': 0.04227371426933313, 'bb_std_mult': 2.108087632754771, 'rsi_os': 31, 'rsi_ob': 86, 'vol_spike': 0.05430992446747004, 'adx_thresh': 11.116203775067412, 'atr_min_pct': 0.00941775941366185, 'atr_max_pct': 0.04419291568838298, 'tp_mult': 1.645883057947091, 'tsl_mult': 0.08544168510726503, 'strategy': 'mean_reversion', 'time_stop': 249, 'use_sma': False, 'use_atr': False, 'use_adx': True, 'use_ema': True, 'use_spike': True, 'rsi_required': True, 'edge_k': 0.27915821523288686, 'edge_cap': 0.23909556148150196, 'bull_strategy': 'breakout', 'bull_bb_std_mult': 1.949902353370001, 'bull_rsi_os': 33, 'bull_rsi_ob': 53, 'bull_adx_thresh': 8.341155812142715, 'bull_atr_min_pct': 0.004501785944969158, 'bull_atr_max_pct': 0.026406689533169075, 'bull_tp_mult': 1.340594813171737, 'bull_tsl_mult': 0.9310606167009515, 'bull_time_stop': 92, 'bull_use_sma': True, 'bull_use_ema': True, 'bull_use_atr': False, 'bull_use_adx': False, 'bull_use_spike': False, 'bull_rsi_required': False, 'bear_strategy': 'mean_reversion', 'bear_bb_std_mult': 1.9623434264445347, 'bear_rsi_os': 45, 'bear_rsi_ob': 77, 'bear_adx_thresh': 13.130998711673957, 'bear_atr_min_pct': 0.007817179871791365, 'bear_atr_max_pct': 0.10303485658978861, 'bear_tp_mult': 2.061674671972222, 'bear_tsl_mult': 0.5962182561240001, 'bear_time_stop': 295, 'bear_use_sma': True, 'bear_use_ema': True, 'bear_use_atr': True, 'bear_use_adx': False, 'bear_use_spike': False, 'bear_rsi_required': False, 'sideways_strategy': 'breakout', 'sideways_bb_std_mult': 0.6880129583575669, 'sideways_rsi_os': 6, 'sideways_rsi_ob': 59, 'sideways_adx_thresh': 14.699829353987061, 'sideways_atr_min_pct': 0.028714677198381208, 'sideways_atr_max_pct': 0.0752179866508318, 'sideways_tp_mult': 1.483226833735575, 'sideways_tsl_mult': 0.864384176717458, 'sideways_time_stop': 132, 'sideways_use_sma': True, 'sideways_use_ema': True, 'sideways_use_atr': True, 'sideways_use_adx': True, 'sideways_use_spike': False, 'sideways_rsi_required': False}.
[I 2025-09-01 08:18:13,534] Trial 328 finished with values: [-1000000000.0, 1000000000.0] and parameters: {'p_sma': 8, 'p_std': 50, 'p_atr': 19, 'p_adx': 23, 'rsi_period': 54, 'ema1': 13, 'ema2': 53, 'slip_atr_k': 5.600482076292228e-05, 'slip_spread_k': 0.8800002213311676, 'spread_hl_frac': 0.031317286945017855, 'bb_std_mult': 2.090392639783402, 'rsi_os': 19, 'rsi_ob': 64, 'vol_spike': 0.13103866208436954, 'adx_thresh': 27.641811588047975, 'atr_min_pct': 0.009437893405177313, 'atr_max_pct': 0.10626765529314189, 'tp_mult': 2.060956107362106, 'tsl_mult': 0.08878828997403337, 'strategy': 'breakout', 'time_stop': 236, 'use_sma': False, 'use_atr': False, 'use_adx': True, 'use_ema': True, 'use_spike': True, 'rsi_required': True, 'edge_k': 0.16754438409947026, 'edge_cap': 0.1907733125276963, 'bull_strategy': 'breakout', 'bull_bb_std_mult': 2.8199559526766698, 'bull_rsi_os': 34, 'bull_rsi_ob': 69, 'bull_adx_thresh': 5.648301434123014, 'bull_atr_min_pct': 0.004389146721056829, 'bull_atr_max_pct': 0.01613995198248127, 'bull_tp_mult': 1.4991420922807779, 'bull_tsl_mult': 0.596431474538145, 'bull_time_stop': 71, 'bull_use_sma': True, 'bull_use_ema': False, 'bull_use_atr': False, 'bull_use_adx': False, 'bull_use_spike': False, 'bull_rsi_required': False, 'bear_strategy': 'mean_reversion', 'bear_bb_std_mult': 2.0555471814364936, 'bear_rsi_os': 48, 'bear_rsi_ob': 77, 'bear_adx_thresh': 12.772788023648937, 'bear_atr_min_pct': 0.008908429352821448, 'bear_atr_max_pct': 0.09991663313059944, 'bear_tp_mult': 2.0686065337765007, 'bear_tsl_mult': 0.6060545672725353, 'bear_time_stop': 50, 'bear_use_sma': True, 'bear_use_ema': False, 'bear_use_atr': False, 'bear_use_adx': True, 'bear_use_spike': False, 'bear_rsi_required': False, 'sideways_strategy': 'breakout', 'sideways_bb_std_mult': 0.9013711501090765, 'sideways_rsi_os': 7, 'sideways_rsi_ob': 76, 'sideways_adx_thresh': 8.754311786175329, 'sideways_atr_min_pct': 0.02998671617452206, 'sideways_atr_max_pct': 0.023979629975583096, 'sideways_tp_mult': 1.4010314730021316, 'sideways_tsl_mult': 0.56186115240615, 'sideways_time_stop': 54, 'sideways_use_sma': True, 'sideways_use_ema': True, 'sideways_use_atr': True, 'sideways_use_adx': True, 'sideways_use_spike': False, 'sideways_rsi_required': False}.
[I 2025-09-01 08:18:13,765] Trial 329 finished with values: [-1000000000.0, 1000000000.0] and parameters: {'p_sma': 60, 'p_std': 56, 'p_atr': 19, 'p_adx': 21, 'rsi_period': 68, 'ema1': 13, 'ema2': 17, 'slip_atr_k': 0.08054489838445411, 'slip_spread_k': 0.8984697954970118, 'spread_hl_frac': 0.016999161994618248, 'bb_std_mult': 2.11852737577037, 'rsi_os': 39, 'rsi_ob': 64, 'vol_spike': 0.13049854737903013, 'adx_thresh': 28.51803641227874, 'atr_min_pct': 0.005662824022419974, 'atr_max_pct': 0.08997223678833514, 'tp_mult': 2.0094206375222026, 'tsl_mult': 0.08833841583620418, 'strategy': 'mean_reversion', 'time_stop': 248, 'use_sma': False, 'use_atr': False, 'use_adx': True, 'use_ema': True, 'use_spike': True, 'rsi_required': True, 'edge_k': 0.14681737818253288, 'edge_cap': 0.6090712152978979, 'bull_strategy': 'breakout', 'bull_bb_std_mult': 2.9476604820803254, 'bull_rsi_os': 31, 'bull_rsi_ob': 83, 'bull_adx_thresh': 9.448568807624472, 'bull_atr_min_pct': 0.005103774717985933, 'bull_atr_max_pct': 0.014717692380418354, 'bull_tp_mult': 2.51462093666515, 'bull_tsl_mult': 0.9659256510511487, 'bull_time_stop': 71, 'bull_use_sma': True, 'bull_use_ema': True, 'bull_use_atr': False, 'bull_use_adx': False, 'bull_use_spike': False, 'bull_rsi_required': False, 'bear_strategy': 'mean_reversion', 'bear_bb_std_mult': 1.5786148769935546, 'bear_rsi_os': 45, 'bear_rsi_ob': 77, 'bear_adx_thresh': 27.79719106674201, 'bear_atr_min_pct': 0.00913336978938812, 'bear_atr_max_pct': 0.1014615134641749, 'bear_tp_mult': 2.3405309791123283, 'bear_tsl_mult': 0.11762412320253669, 'bear_time_stop': 285, 'bear_use_sma': True, 'bear_use_ema': False, 'bear_use_atr': True, 'bear_use_adx': True, 'bear_use_spike': False, 'bear_rsi_required': False, 'sideways_strategy': 'breakout', 'sideways_bb_std_mult': 0.7113188472498582, 'sideways_rsi_os': 49, 'sideways_rsi_ob': 94, 'sideways_adx_thresh': 34.88674328473934, 'sideways_atr_min_pct': 0.029960282866994446, 'sideways_atr_max_pct': 0.11635913099701375, 'sideways_tp_mult': 1.2586482811919277, 'sideways_tsl_mult': 0.07716129653887123, 'sideways_time_stop': 54, 'sideways_use_sma': True, 'sideways_use_ema': True, 'sideways_use_atr': True, 'sideways_use_adx': True, 'sideways_use_spike': False, 'sideways_rsi_required': False}.
[I 2025-09-01 08:18:58,168] Trial 333 finished with values: [-1000000000.0, 1000000000.0] and parameters: {'p_sma': 37, 'p_std': 52, 'p_atr': 20, 'p_adx': 30, 'rsi_period': 11, 'ema1': 27, 'ema2': 15, 'slip_atr_k': 0.02800809122284692, 'slip_spread_k': 0.852465935686494, 'spread_hl_frac': 0.01359830334500891, 'bb_std_mult': 2.0113007689945017, 'rsi_os': 33, 'rsi_ob': 77, 'vol_spike': 0.06864645192459776, 'adx_thresh': 12.72031677102103, 'atr_min_pct': 0.004074648802416821, 'atr_max_pct': 0.1055614920288149, 'tp_mult': 1.936654726244196, 'tsl_mult': 0.09054828236135089, 'strategy': 'breakout', 'time_stop': 36, 'use_sma': False, 'use_atr': False, 'use_adx': False, 'use_ema': True, 'use_spike': True, 'rsi_required': True, 'edge_k': 0.20005616020026193, 'edge_cap': 0.6219763848261773, 'bull_strategy': 'breakout', 'bull_bb_std_mult': 2.8200686399341808, 'bull_rsi_os': 34, 'bull_rsi_ob': 66, 'bull_adx_thresh': 32.96810359666354, 'bull_atr_min_pct': 0.020103483858265606, 'bull_atr_max_pct': 0.010193673277817044, 'bull_tp_mult': 1.616645122398404, 'bull_tsl_mult': 0.9600457017414319, 'bull_time_stop': 197, 'bull_use_sma': True, 'bull_use_ema': True, 'bull_use_atr': True, 'bull_use_adx': False, 'bull_use_spike': True, 'bull_rsi_required': False, 'bear_strategy': 'mean_reversion', 'bear_bb_std_mult': 1.5913536030322715, 'bear_rsi_os': 6, 'bear_rsi_ob': 78, 'bear_adx_thresh': 34.98087941874588, 'bear_atr_min_pct': 0.008845394467597452, 'bear_atr_max_pct': 0.06081578895470717, 'bear_tp_mult': 2.075523884308462, 'bear_tsl_mult': 0.08498164260494306, 'bear_time_stop': 277, 'bear_use_sma': False, 'bear_use_ema': False, 'bear_use_atr': True, 'bear_use_adx': True, 'bear_use_spike': True, 'bear_rsi_required': False, 'sideways_strategy': 'breakout', 'sideways_bb_std_mult': 1.0330904667053336, 'sideways_rsi_os': 7, 'sideways_rsi_ob': 94, 'sideways_adx_thresh': 10.801388168477423, 'sideways_atr_min_pct': 0.0022361460789269115, 'sideways_atr_max_pct': 0.13814738451629174, 'sideways_tp_mult': 2.555404085693177, 'sideways_tsl_mult': 0.08053495735372912, 'sideways_time_stop': 144, 'sideways_use_sma': True, 'sideways_use_ema': True, 'sideways_use_atr': True, 'sideways_use_adx': True, 'sideways_use_spike': False, 'sideways_rsi_required': False}.
