2025-09-01 07:20:31,570 WARNING: DATA SANITY: Extreme jumps >20*ATR200: 42
[I 2025-09-01 07:20:31,580] A new study created in memory with name: no-name-7c0aad66-9955-4de0-b683-7597ff5ab09b
[I 2025-09-01 07:20:31,602] Trial 3 finished with values: [-1000000000.0, 1000000000.0] and parameters: {'p_sma': 8, 'p_std': 52, 'p_atr': 24, 'p_adx': 8, 'rsi_period': 70, 'ema1': 28, 'ema2': 25, 'slip_atr_k': 0.13472114220664044, 'slip_spread_k': 0.15627743672946304, 'spread_hl_frac': 0.01851792565400231, 'bb_std_mult': 1.331736652304195, 'rsi_os': 55, 'rsi_ob': 68, 'vol_spike': 0.019223847043947084, 'adx_thresh': 26.69516050711909, 'atr_min_pct': 0.007332345768964102, 'atr_max_pct': 0.1217777594505397, 'tp_mult': 2.8925797482106814, 'tsl_mult': 0.5175118750797986, 'strategy': 'mean_reversion', 'time_stop': 7, 'use_sma': False, 'use_atr': False, 'use_adx': True, 'use_ema': True, 'use_spike': True, 'rsi_required': False, 'edge_k': 1.5475002755616785, 'edge_cap': 0.07398538330765793, 'bull_strategy': 'breakout', 'bull_bb_std_mult': 1.5576342650323922, 'bull_rsi_os': 37, 'bull_rsi_ob': 49, 'bull_adx_thresh': 30.340505689030714, 'bull_atr_min_pct': 0.007704577791838508, 'bull_atr_max_pct': 0.14409215830555955, 'bull_tp_mult': 1.2700058907680563, 'bull_tsl_mult': 0.7237877903809546, 'bull_time_stop': 65, 'bull_use_sma': True, 'bull_use_ema': True, 'bull_use_atr': True, 'bull_use_adx': False, 'bull_use_spike': False, 'bull_rsi_required': False, 'bear_strategy': 'mean_reversion', 'bear_bb_std_mult': 0.6656324890875049, 'bear_rsi_os': 43, 'bear_rsi_ob': 52, 'bear_adx_thresh': 21.315969001735667, 'bear_atr_min_pct': 0.0004833040305352043, 'bear_atr_max_pct': 0.021021701813306638, 'bear_tp_mult': 1.9065538239222652, 'bear_tsl_mult': 0.4026807115932377, 'bear_time_stop': 119, 'bear_use_sma': False, 'bear_use_ema': True, 'bear_use_atr': False, 'bear_use_adx': False, 'bear_use_spike': True, 'bear_rsi_required': False, 'sideways_strategy': 'mean_reversion', 'sideways_bb_std_mult': 3.3540822349375574, 'sideways_rsi_os': 27, 'sideways_rsi_ob': 70, 'sideways_adx_thresh': 30.461192758545067, 'sideways_atr_min_pct': 0.02082502697188734, 'sideways_atr_max_pct': 0.05585330831069275, 'sideways_tp_mult': 1.7389727337438623, 'sideways_tsl_mult': 0.001923154298211105, 'sideways_time_stop': 100, 'sideways_use_sma': True, 'sideways_use_ema': True, 'sideways_use_atr': True, 'sideways_use_adx': False, 'sideways_use_spike': True, 'sideways_rsi_required': True}.
[I 2025-09-01 07:21:08,862] Trial 0 finished with values: [-0.017406996744182113, 0.017450823335186015] and parameters: {'p_sma': 32, 'p_std': 55, 'p_atr': 26, 'p_adx': 12, 'rsi_period': 35, 'ema1': 13, 'ema2': 18, 'slip_atr_k': 0.08234046878160284, 'slip_spread_k': 0.23726037121723542, 'spread_hl_frac': 0.0026128681016178434, 'bb_std_mult': 1.806174852086156, 'rsi_os': 19, 'rsi_ob': 55, 'vol_spike': 0.19348146039775196, 'adx_thresh': 26.38008886089196, 'atr_min_pct': 0.016954705738840902, 'atr_max_pct': 0.14211124590701593, 'tp_mult': 2.0874868184348068, 'tsl_mult': 0.2044814862984159, 'strategy': 'mean_reversion', 'time_stop': 227, 'use_sma': False, 'use_atr': True, 'use_adx': False, 'use_ema': False, 'use_spike': True, 'rsi_required': True, 'edge_k': 0.4893029091029748, 'edge_cap': 0.907707809021547, 'bull_strategy': 'mean_reversion', 'bull_bb_std_mult': 0.9490904985585653, 'bull_rsi_os': 34, 'bull_rsi_ob': 51, 'bull_adx_thresh': 7.079288245447465, 'bull_atr_min_pct': 0.0007186726537976462, 'bull_atr_max_pct': 0.02831258347238225, 'bull_tp_mult': 2.413416487681727, 'bull_tsl_mult': 0.8905660468613495, 'bull_time_stop': 130, 'bull_use_sma': True, 'bull_use_ema': False, 'bull_use_atr': True, 'bull_use_adx': True, 'bull_use_spike': False, 'bull_rsi_required': False, 'bear_strategy': 'breakout', 'bear_bb_std_mult': 1.1289663522638034, 'bear_rsi_os': 54, 'bear_rsi_ob': 69, 'bear_adx_thresh': 20.225469707792897, 'bear_atr_min_pct': 0.006978044803941814, 'bear_atr_max_pct': 0.11351819757495311, 'bear_tp_mult': 2.3398776404038704, 'bear_tsl_mult': 0.7145558876529191, 'bear_time_stop': 66, 'bear_use_sma': False, 'bear_use_ema': True, 'bear_use_atr': True, 'bear_use_adx': False, 'bear_use_spike': True, 'bear_rsi_required': True, 'sideways_strategy': 'mean_reversion', 'sideways_bb_std_mult': 1.8137425205091746, 'sideways_rsi_os': 19, 'sideways_rsi_ob': 47, 'sideways_adx_thresh': 22.400625914103752, 'sideways_atr_min_pct': 0.014870198090051133, 'sideways_atr_max_pct': 0.12135039717437153, 'sideways_tp_mult': 1.4468825498079487, 'sideways_tsl_mult': 0.991438369030192, 'sideways_time_stop': 197, 'sideways_use_sma': True, 'sideways_use_ema': False, 'sideways_use_atr': False, 'sideways_use_adx': True, 'sideways_use_spike': False, 'sideways_rsi_required': True}.
[I 2025-09-01 07:21:09,725] Trial 1 finished with values: [-1000000000.0, 1000000000.0] and parameters: {'p_sma': 24, 'p_std': 47, 'p_atr': 11, 'p_adx': 14, 'rsi_period': 84, 'ema1': 19, 'ema2': 36, 'slip_atr_k': 0.237962569008031, 'slip_spread_k': 0.7977211529453999, 'spread_hl_frac': 0.03155020863916396, 'bb_std_mult': 1.0372700180363665, 'rsi_os': 24, 'rsi_ob': 54, 'vol_spike': 0.021313357434089596, 'adx_thresh': 30.461470998243083, 'atr_min_pct': 0.004590915886720009, 'atr_max_pct': 0.08215964194885478, 'tp_mult': 2.517684445204957, 'tsl_mult': 0.7835388340327125, 'strategy': 'breakout', 'time_stop': 38, 'use_sma': True, 'use_atr': True, 'use_adx': True, 'use_ema': True, 'use_spike': True, 'rsi_required': True, 'edge_k': 1.9515491763738186, 'edge_cap': 0.9085405102242666, 'bull_strategy': 'mean_reversion', 'bull_bb_std_mult': 0.5785974861434064, 'bull_rsi_os': 7, 'bull_rsi_ob': 59, 'bull_adx_thresh': 12.810369684694253, 'bull_atr_min_pct': 0.017033836103198308, 'bull_atr_max_pct': 0.09285085520105112, 'bull_tp_mult': 1.170205259755109, 'bull_tsl_mult': 0.8013096049076043, 'bull_time_stop': 284, 'bull_use_sma': False, 'bull_use_ema': True, 'bull_use_atr': False, 'bull_use_adx': False, 'bull_use_spike': True, 'bull_rsi_required': False, 'bear_strategy': 'mean_reversion', 'bear_bb_std_mult': 0.8936590274103533, 'bear_rsi_os': 41, 'bear_rsi_ob': 66, 'bear_adx_thresh': 33.34211489615908, 'bear_atr_min_pct': 0.017221572888635715, 'bear_atr_max_pct': 0.06173685875771513, 'bear_tp_mult': 1.8260893305713974, 'bear_tsl_mult': 0.8568972076261165, 'bear_time_stop': 101, 'bear_use_sma': True, 'bear_use_ema': True, 'bear_use_atr': False, 'bear_use_adx': True, 'bear_use_spike': True, 'bear_rsi_required': True, 'sideways_strategy': 'mean_reversion', 'sideways_bb_std_mult': 1.0574270825488066, 'sideways_rsi_os': 47, 'sideways_rsi_ob': 84, 'sideways_adx_thresh': 11.87583360681665, 'sideways_atr_min_pct': 0.0020149773120067735, 'sideways_atr_max_pct': 0.11707383621258477, 'sideways_tp_mult': 1.038152717298294, 'sideways_tsl_mult': 0.7680854759650424, 'sideways_time_stop': 191, 'sideways_use_sma': True, 'sideways_use_ema': True, 'sideways_use_atr': False, 'sideways_use_adx': False, 'sideways_use_spike': False, 'sideways_rsi_required': True}.
[I 2025-09-01 07:21:10,027] Trial 2 finished with values: [-1000000000.0, 1000000000.0] and parameters: {'p_sma': 22, 'p_std': 47, 'p_atr': 19, 'p_adx': 20, 'rsi_period': 63, 'ema1': 21, 'ema2': 45, 'slip_atr_k': 0.2219668622960508, 'slip_spread_k': 0.3306041942001582, 'spread_hl_frac': 0.0397258146014546, 'bb_std_mult': 3.558408350828526, 'rsi_os': 11, 'rsi_ob': 58, 'vol_spike': 0.2999233261334005, 'adx_thresh': 11.839237728681184, 'atr_min_pct': 0.018441673012360223, 'atr_max_pct': 0.1261564549389608, 'tp_mult': 1.4222498582753453, 'tsl_mult': 0.9950962228266726, 'strategy': 'breakout', 'time_stop': 28, 'use_sma': True, 'use_atr': False, 'use_adx': False, 'use_ema': False, 'use_spike': False, 'rsi_required': True, 'edge_k': 1.2230418648362376, 'edge_cap': 0.5658980647010441, 'bull_strategy': 'mean_reversion', 'bull_bb_std_mult': 0.5331199134298031, 'bull_rsi_os': 27, 'bull_rsi_ob': 74, 'bull_adx_thresh': 18.14897382646444, 'bull_atr_min_pct': 0.006902148804490665, 'bull_atr_max_pct': 0.03150051988971062, 'bull_tp_mult': 1.1887760651928831, 'bull_tsl_mult': 0.03041802172116259, 'bull_time_stop': 191, 'bull_use_sma': True, 'bull_use_ema': False, 'bull_use_atr': False, 'bull_use_adx': True, 'bull_use_spike': False, 'bull_rsi_required': True, 'bear_strategy': 'mean_reversion', 'bear_bb_std_mult': 3.339266392445393, 'bear_rsi_os': 41, 'bear_rsi_ob': 77, 'bear_adx_thresh': 22.17574512954763, 'bear_atr_min_pct': 0.014135097952964411, 'bear_atr_max_pct': 0.056680487749460336, 'bear_tp_mult': 1.7282814555678723, 'bear_tsl_mult': 0.09783337926659152, 'bear_time_stop': 225, 'bear_use_sma': True, 'bear_use_ema': True, 'bear_use_atr': True, 'bear_use_adx': True, 'bear_use_spike': False, 'bear_rsi_required': False, 'sideways_strategy': 'mean_reversion', 'sideways_bb_std_mult': 1.2595949644375142, 'sideways_rsi_os': 53, 'sideways_rsi_ob': 64, 'sideways_adx_thresh': 16.646653027964568, 'sideways_atr_min_pct': 0.007737990324949913, 'sideways_atr_max_pct': 0.113306045286112, 'sideways_tp_mult': 2.9812034169727206, 'sideways_tsl_mult': 0.07939998009811045, 'sideways_time_stop': 288, 'sideways_use_sma': False, 'sideways_use_ema': False, 'sideways_use_atr': False, 'sideways_use_adx': True, 'sideways_use_spike': True, 'sideways_rsi_required': False}.
[I 2025-09-01 07:21:10,183] Trial 4 finished with values: [-1000000000.0, 1000000000.0] and parameters: {'p_sma': 51, 'p_std': 10, 'p_atr': 15, 'p_adx': 12, 'rsi_period': 68, 'ema1': 30, 'ema2': 15, 'slip_atr_k': 0.0037818493728901947, 'slip_spread_k': 0.13086057310687327, 'spread_hl_frac': 0.025174180459536823, 'bb_std_mult': 2.1501344015559414, 'rsi_os': 22, 'rsi_ob': 82, 'vol_spike': 0.07127393157020208, 'adx_thresh': 34.7018394406147, 'atr_min_pct': 0.00865337167398304, 'atr_max_pct': 0.09609865626205226, 'tp_mult': 2.5285064566138566, 'tsl_mult': 0.16526867796440003, 'strategy': 'breakout', 'time_stop': 259, 'use_sma': True, 'use_atr': False, 'use_adx': False, 'use_ema': True, 'use_spike': False, 'rsi_required': False, 'edge_k': 1.114496653112153, 'edge_cap': 0.8052382617174033, 'bull_strategy': 'breakout', 'bull_bb_std_mult': 1.534977414317741, 'bull_rsi_os': 46, 'bull_rsi_ob': 52, 'bull_adx_thresh': 16.95249119228704, 'bull_atr_min_pct': 0.021254987297406307, 'bull_atr_max_pct': 0.027608939810573323, 'bull_tp_mult': 2.5671560225545287, 'bull_tsl_mult': 0.5012700610763775, 'bull_time_stop': 241, 'bull_use_sma': True, 'bull_use_ema': True, 'bull_use_atr': False, 'bull_use_adx': True, 'bull_use_spike': False, 'bull_rsi_required': False, 'bear_strategy': 'breakout', 'bear_bb_std_mult': 2.133718500887187, 'bear_rsi_os': 22, 'bear_rsi_ob': 54, 'bear_adx_thresh': 15.853462296789743, 'bear_atr_min_pct': 0.026725706778598264, 'bear_atr_max_pct': 0.13022483356121614, 'bear_tp_mult': 2.8817552992704147, 'bear_tsl_mult': 0.6797418772004171, 'bear_time_stop': 220, 'bear_use_sma': True, 'bear_use_ema': True, 'bear_use_atr': False, 'bear_use_adx': False, 'bear_use_spike': False, 'bear_rsi_required': False, 'sideways_strategy': 'mean_reversion', 'sideways_bb_std_mult': 0.9132800405879443, 'sideways_rsi_os': 33, 'sideways_rsi_ob': 60, 'sideways_adx_thresh': 14.851616964638165, 'sideways_atr_min_pct': 0.016345666627242992, 'sideways_atr_max_pct': 0.11558224396984661, 'sideways_tp_mult': 2.7295035577934033, 'sideways_tsl_mult': 0.01067289238522906, 'sideways_time_stop': 207, 'sideways_use_sma': True, 'sideways_use_ema': True, 'sideways_use_atr': False, 'sideways_use_adx': True, 'sideways_use_spike': False, 'sideways_rsi_required': False}.
[I 2025-09-01 07:21:47,630] Trial 5 finished with values: [-1000000000.0, 1000000000.0] and parameters: {'p_sma': 5, 'p_std': 9, 'p_atr': 9, 'p_adx': 11, 'rsi_period': 49, 'ema1': 25, 'ema2': 53, 'slip_atr_k': 0.1547590142236889, 'slip_spread_k': 0.46138021901374804, 'spread_hl_frac': 0.011399161642606459, 'bb_std_mult': 0.9043662199036583, 'rsi_os': 28, 'rsi_ob': 77, 'vol_spike': 0.21896916838427577, 'adx_thresh': 21.688224108705793, 'atr_min_pct': 0.009376510332561925, 'atr_max_pct': 0.04083879261288093, 'tp_mult': 2.581377028709815, 'tsl_mult': 0.8740678843206975, 'strategy': 'mean_reversion', 'time_stop': 276, 'use_sma': False, 'use_atr': True, 'use_adx': False, 'use_ema': False, 'use_spike': False, 'rsi_required': True, 'edge_k': 1.772976796177366, 'edge_cap': 0.32933590460255807, 'bull_strategy': 'breakout', 'bull_bb_std_mult': 2.5641145180888842, 'bull_rsi_os': 18, 'bull_rsi_ob': 56, 'bull_adx_thresh': 11.153110239707864, 'bull_atr_min_pct': 0.006559951795942977, 'bull_atr_max_pct': 0.07032290141192221, 'bull_tp_mult': 2.8411316948199477, 'bull_tsl_mult': 0.15538335033159323, 'bull_time_stop': 153, 'bull_use_sma': True, 'bull_use_ema': False, 'bull_use_atr': False, 'bull_use_adx': False, 'bull_use_spike': False, 'bull_rsi_required': False, 'bear_strategy': 'mean_reversion', 'bear_bb_std_mult': 2.4564708932677237, 'bear_rsi_os': 27, 'bear_rsi_ob': 51, 'bear_adx_thresh': 22.26606478716385, 'bear_atr_min_pct': 0.009607559747349325, 'bear_atr_max_pct': 0.022707930005987625, 'bear_tp_mult': 1.5168808947897894, 'bear_tsl_mult': 0.7432805793712989, 'bear_time_stop': 146, 'bear_use_sma': False, 'bear_use_ema': True, 'bear_use_atr': True, 'bear_use_adx': True, 'bear_use_spike': False, 'bear_rsi_required': True, 'sideways_strategy': 'breakout', 'sideways_bb_std_mult': 2.72426019481943, 'sideways_rsi_os': 47, 'sideways_rsi_ob': 84, 'sideways_adx_thresh': 19.211706432472077, 'sideways_atr_min_pct': 0.0253679263690557, 'sideways_atr_max_pct': 0.03282933829974947, 'sideways_tp_mult': 1.962023810626772, 'sideways_tsl_mult': 0.2926893828086188, 'sideways_time_stop': 149, 'sideways_use_sma': True, 'sideways_use_ema': False, 'sideways_use_atr': True, 'sideways_use_adx': True, 'sideways_use_spike': False, 'sideways_rsi_required': False}.
[I 2025-09-01 07:21:49,687] Trial 7 finished with values: [-1000000000.0, 1000000000.0] and parameters: {'p_sma': 55, 'p_std': 37, 'p_atr': 27, 'p_adx': 7, 'rsi_period': 13, 'ema1': 29, 'ema2': 25, 'slip_atr_k': 0.0848808339686645, 'slip_spread_k': 0.191398359665226, 'spread_hl_frac': 0.022199927624479854, 'bb_std_mult': 3.5062465374825624, 'rsi_os': 51, 'rsi_ob': 85, 'vol_spike': 0.13919537665647652, 'adx_thresh': 34.05654237593998, 'atr_min_pct': 0.024880330981976857, 'atr_max_pct': 0.06040697037836959, 'tp_mult': 2.865416390535854, 'tsl_mult': 0.42400796741346414, 'strategy': 'breakout', 'time_stop': 108, 'use_sma': False, 'use_atr': True, 'use_adx': False, 'use_ema': False, 'use_spike': False, 'rsi_required': True, 'edge_k': 1.062273816468182, 'edge_cap': 0.5920935328372604, 'bull_strategy': 'breakout', 'bull_bb_std_mult': 2.607485042065511, 'bull_rsi_os': 26, 'bull_rsi_ob': 81, 'bull_adx_thresh': 16.763157501388665, 'bull_atr_min_pct': 0.014736103185203867, 'bull_atr_max_pct': 0.11923321979265511, 'bull_tp_mult': 1.2657050946573356, 'bull_tsl_mult': 0.49943753423923976, 'bull_time_stop': 53, 'bull_use_sma': True, 'bull_use_ema': False, 'bull_use_atr': True, 'bull_use_adx': False, 'bull_use_spike': False, 'bull_rsi_required': True, 'bear_strategy': 'mean_reversion', 'bear_bb_std_mult': 1.8929383565527058, 'bear_rsi_os': 18, 'bear_rsi_ob': 70, 'bear_adx_thresh': 29.27759581810783, 'bear_atr_min_pct': 0.02838234178265356, 'bear_atr_max_pct': 0.114471686876415, 'bear_tp_mult': 2.338207074466863, 'bear_tsl_mult': 0.9223612092804991, 'bear_time_stop': 288, 'bear_use_sma': False, 'bear_use_ema': True, 'bear_use_atr': True, 'bear_use_adx': True, 'bear_use_spike': False, 'bear_rsi_required': False, 'sideways_strategy': 'breakout', 'sideways_bb_std_mult': 3.062465608463092, 'sideways_rsi_os': 34, 'sideways_rsi_ob': 70, 'sideways_adx_thresh': 15.98448071354172, 'sideways_atr_min_pct': 0.02248749442574972, 'sideways_atr_max_pct': 0.022602053591818803, 'sideways_tp_mult': 2.0190986219657083, 'sideways_tsl_mult': 0.2225585141852483, 'sideways_time_stop': 275, 'sideways_use_sma': False, 'sideways_use_ema': False, 'sideways_use_atr': False, 'sideways_use_adx': True, 'sideways_use_spike': True, 'sideways_rsi_required': True}.
[I 2025-09-01 07:21:49,952] Trial 6 finished with values: [-1000000000.0, 1000000000.0] and parameters: {'p_sma': 15, 'p_std': 21, 'p_atr': 21, 'p_adx': 11, 'rsi_period': 24, 'ema1': 26, 'ema2': 46, 'slip_atr_k': 0.18798617626557587, 'slip_spread_k': 0.42798074630391647, 'spread_hl_frac': 0.025878148069488127, 'bb_std_mult': 0.6558372345809382, 'rsi_os': 45, 'rsi_ob': 52, 'vol_spike': 0.24136002895849362, 'adx_thresh': 33.19902114617135, 'atr_min_pct': 0.015185526136736264, 'atr_max_pct': 0.017816465418419514, 'tp_mult': 1.9888131487789602, 'tsl_mult': 0.7642592149023759, 'strategy': 'breakout', 'time_stop': 119, 'use_sma': False, 'use_atr': True, 'use_adx': True, 'use_ema': True, 'use_spike': True, 'rsi_required': True, 'edge_k': 0.6706701390276555, 'edge_cap': 0.7953124868119607, 'bull_strategy': 'mean_reversion', 'bull_bb_std_mult': 2.8435547227979203, 'bull_rsi_os': 24, 'bull_rsi_ob': 46, 'bull_adx_thresh': 13.897413261352366, 'bull_atr_min_pct': 0.010442197328977124, 'bull_atr_max_pct': 0.1122740668115737, 'bull_tp_mult': 2.06916394721273, 'bull_tsl_mult': 0.25281434112113366, 'bull_time_stop': 40, 'bull_use_sma': True, 'bull_use_ema': True, 'bull_use_atr': False, 'bull_use_adx': False, 'bull_use_spike': True, 'bull_rsi_required': False, 'bear_strategy': 'breakout', 'bear_bb_std_mult': 1.4660082875908533, 'bear_rsi_os': 34, 'bear_rsi_ob': 80, 'bear_adx_thresh': 24.93583504925479, 'bear_atr_min_pct': 0.003996801913858939, 'bear_atr_max_pct': 0.031001070758743345, 'bear_tp_mult': 2.6724143993748726, 'bear_tsl_mult': 0.8267220484528959, 'bear_time_stop': 159, 'bear_use_sma': True, 'bear_use_ema': True, 'bear_use_atr': True, 'bear_use_adx': True, 'bear_use_spike': False, 'bear_rsi_required': False, 'sideways_strategy': 'mean_reversion', 'sideways_bb_std_mult': 1.8057326907156648, 'sideways_rsi_os': 32, 'sideways_rsi_ob': 87, 'sideways_adx_thresh': 8.873366651137571, 'sideways_atr_min_pct': 0.0165908516773881, 'sideways_atr_max_pct': 0.029334588899305677, 'sideways_tp_mult': 1.668284198755698, 'sideways_tsl_mult': 0.46741397488041947, 'sideways_time_stop': 148, 'sideways_use_sma': False, 'sideways_use_ema': False, 'sideways_use_atr': True, 'sideways_use_adx': True, 'sideways_use_spike': False, 'sideways_rsi_required': True}.
[I 2025-09-01 07:21:50,008] Trial 11 finished with values: [-1000000000.0, 1000000000.0] and parameters: {'p_sma': 45, 'p_std': 20, 'p_atr': 29, 'p_adx': 26, 'rsi_period': 62, 'ema1': 21, 'ema2': 38, 'slip_atr_k': 0.062003683673235194, 'slip_spread_k': 0.15223655189615737, 'spread_hl_frac': 0.03359471201956901, 'bb_std_mult': 2.986920766598367, 'rsi_os': 26, 'rsi_ob': 47, 'vol_spike': 0.2918803433684983, 'adx_thresh': 13.106153596259254, 'atr_min_pct': 0.003910082485538252, 'atr_max_pct': 0.0666252917433852, 'tp_mult': 2.162252025046384, 'tsl_mult': 0.6299486429621338, 'strategy': 'mean_reversion', 'time_stop': 115, 'use_sma': False, 'use_atr': False, 'use_adx': True, 'use_ema': False, 'use_spike': True, 'rsi_required': False, 'edge_k': 1.1459545254454027, 'edge_cap': 0.652973983673596, 'bull_strategy': 'breakout', 'bull_bb_std_mult': 1.6109312639392808, 'bull_rsi_os': 34, 'bull_rsi_ob': 77, 'bull_adx_thresh': 25.661655621936454, 'bull_atr_min_pct': 0.00371759540159959, 'bull_atr_max_pct': 0.10772788085748984, 'bull_tp_mult': 1.0323636088481394, 'bull_tsl_mult': 0.21265588068760677, 'bull_time_stop': 59, 'bull_use_sma': True, 'bull_use_ema': False, 'bull_use_atr': False, 'bull_use_adx': False, 'bull_use_spike': False, 'bull_rsi_required': False, 'bear_strategy': 'mean_reversion', 'bear_bb_std_mult': 1.379302752203509, 'bear_rsi_os': 12, 'bear_rsi_ob': 56, 'bear_adx_thresh': 16.732492691755922, 'bear_atr_min_pct': 0.01219102207393054, 'bear_atr_max_pct': 0.04287837126001845, 'bear_tp_mult': 2.295354386913105, 'bear_tsl_mult': 0.7761325006437589, 'bear_time_stop': 24, 'bear_use_sma': False, 'bear_use_ema': True, 'bear_use_atr': True, 'bear_use_adx': True, 'bear_use_spike': False, 'bear_rsi_required': True, 'sideways_strategy': 'breakout', 'sideways_bb_std_mult': 2.8994542089760356, 'sideways_rsi_os': 15, 'sideways_rsi_ob': 50, 'sideways_adx_thresh': 11.292095120299923, 'sideways_atr_min_pct': 0.0271692291464773, 'sideways_atr_max_pct': 0.14489166305578602, 'sideways_tp_mult': 1.32482735352022, 'sideways_tsl_mult': 0.29341193019534795, 'sideways_time_stop': 228, 'sideways_use_sma': False, 'sideways_use_ema': False, 'sideways_use_atr': True, 'sideways_use_adx': False, 'sideways_use_spike': False, 'sideways_rsi_required': False}.
