[I 2025-09-01 08:08:26,232] Trial 277 finished with values: [-1000000000.0, 1000000000.0] and parameters: {'p_sma': 15, 'p_std': 51, 'p_atr': 15, 'p_adx': 17, 'rsi_period': 46, 'ema1': 13, 'ema2': 10, 'slip_atr_k': 0.003971753367899159, 'slip_spread_k': 0.09086704314242888, 'spread_hl_frac': 0.012999201674307327, 'bb_std_mult': 2.1818490827081853, 'rsi_os': 26, 'rsi_ob': 89, 'vol_spike': 0.07452913943749524, 'adx_thresh': 29.882051557964402, 'atr_min_pct': 0.006832974984184566, 'atr_max_pct': 0.14625283804317593, 'tp_mult': 1.7632718561300498, 'tsl_mult': 0.15102753458392298, 'strategy': 'breakout', 'time_stop': 243, 'use_sma': False, 'use_atr': False, 'use_adx': True, 'use_ema': True, 'use_spike': True, 'rsi_required': True, 'edge_k': 0.1522678168766397, 'edge_cap': 0.5005463882673875, 'bull_strategy': 'breakout', 'bull_bb_std_mult': 3.5081369382044882, 'bull_rsi_os': 21, 'bull_rsi_ob': 48, 'bull_adx_thresh': 7.46068648562707, 'bull_atr_min_pct': 0.003447176129156532, 'bull_atr_max_pct': 0.0342291144696278, 'bull_tp_mult': 1.59436582914686, 'bull_tsl_mult': 0.6667524338496913, 'bull_time_stop': 47, 'bull_use_sma': True, 'bull_use_ema': True, 'bull_use_atr': False, 'bull_use_adx': False, 'bull_use_spike': False, 'bull_rsi_required': False, 'bear_strategy': 'mean_reversion', 'bear_bb_std_mult': 1.8099639819206699, 'bear_rsi_os': 43, 'bear_rsi_ob': 76, 'bear_adx_thresh': 5.006739194773046, 'bear_atr_min_pct': 0.006870124144693547, 'bear_atr_max_pct': 0.03231901255932067, 'bear_tp_mult': 2.2177621711145563, 'bear_tsl_mult': 0.7782624472539599, 'bear_time_stop': 300, 'bear_use_sma': True, 'bear_use_ema': False, 'bear_use_atr': True, 'bear_use_adx': False, 'bear_use_spike': False, 'bear_rsi_required': True, 'sideways_strategy': 'breakout', 'sideways_bb_std_mult': 3.516010412127152, 'sideways_rsi_os': 5, 'sideways_rsi_ob': 91, 'sideways_adx_thresh': 8.5096205686202, 'sideways_atr_min_pct': 0.005019437396602601, 'sideways_atr_max_pct': 0.01882522914992496, 'sideways_tp_mult': 1.2476527246171736, 'sideways_tsl_mult': 0.17854470960174268, 'sideways_time_stop': 62, 'sideways_use_sma': True, 'sideways_use_ema': True, 'sideways_use_atr': True, 'sideways_use_adx': True, 'sideways_use_spike': False, 'sideways_rsi_required': False}.
[I 2025-09-01 08:09:07,523] Trial 282 finished with values: [-1000000000.0, 1000000000.0] and parameters: {'p_sma': 19, 'p_std': 57, 'p_atr': 23, 'p_adx': 26, 'rsi_period': 84, 'ema1': 15, 'ema2': 13, 'slip_atr_k': 0.1887237563448041, 'slip_spread_k': 0.3219590619900643, 'spread_hl_frac': 0.014832717602132109, 'bb_std_mult': 2.4289906276254833, 'rsi_os': 23, 'rsi_ob': 92, 'vol_spike': 0.08130212800115283, 'adx_thresh': 26.310729263482056, 'atr_min_pct': 0.003422600676795341, 'atr_max_pct': 0.031117336724882302, 'tp_mult': 1.5951024355301038, 'tsl_mult': 0.12229815993121868, 'strategy': 'breakout', 'time_stop': 62, 'use_sma': True, 'use_atr': False, 'use_adx': True, 'use_ema': True, 'use_spike': True, 'rsi_required': True, 'edge_k': 0.5071494761690581, 'edge_cap': 0.9483465535305364, 'bull_strategy': 'breakout', 'bull_bb_std_mult': 3.1529516873097063, 'bull_rsi_os': 21, 'bull_rsi_ob': 49, 'bull_adx_thresh': 27.293113135788634, 'bull_atr_min_pct': 0.0034221237378034087, 'bull_atr_max_pct': 0.09516214941625573, 'bull_tp_mult': 1.4822757144185368, 'bull_tsl_mult': 0.5938885397558155, 'bull_time_stop': 95, 'bull_use_sma': True, 'bull_use_ema': False, 'bull_use_atr': False, 'bull_use_adx': False, 'bull_use_spike': False, 'bull_rsi_required': False, 'bear_strategy': 'mean_reversion', 'bear_bb_std_mult': 1.6333624769248143, 'bear_rsi_os': 46, 'bear_rsi_ob': 82, 'bear_adx_thresh': 5.047859273189984, 'bear_atr_min_pct': 0.005050328773348564, 'bear_atr_max_pct': 0.04345761091678353, 'bear_tp_mult': 1.92267719232415, 'bear_tsl_mult': 0.11610152965777477, 'bear_time_stop': 289, 'bear_use_sma': True, 'bear_use_ema': False, 'bear_use_atr': False, 'bear_use_adx': False, 'bear_use_spike': False, 'bear_rsi_required': False, 'sideways_strategy': 'breakout', 'sideways_bb_std_mult': 2.1660687562195777, 'sideways_rsi_os': 51, 'sideways_rsi_ob': 91, 'sideways_adx_thresh': 22.70150387257997, 'sideways_atr_min_pct': 0.028932312409312752, 'sideways_atr_max_pct': 0.02619128265658225, 'sideways_tp_mult': 1.2580858513436464, 'sideways_tsl_mult': 0.11790884364330226, 'sideways_time_stop': 26, 'sideways_use_sma': True, 'sideways_use_ema': True, 'sideways_use_atr': True, 'sideways_use_adx': True, 'sideways_use_spike': False, 'sideways_rsi_required': False}.
[I 2025-09-01 08:09:07,537] Trial 280 finished with values: [-0.00979979269031539, 0.009593989241290258] and parameters: {'p_sma': 19, 'p_std': 55, 'p_atr': 23, 'p_adx': 17, 'rsi_period': 84, 'ema1': 9, 'ema2': 19, 'slip_atr_k': 0.19067878287280451, 'slip_spread_k': 0.9397777884977313, 'spread_hl_frac': 0.01305512373314204, 'bb_std_mult': 2.4010470432281124, 'rsi_os': 33, 'rsi_ob': 76, 'vol_spike': 0.06206698557025929, 'adx_thresh': 11.406450252403989, 'atr_min_pct': 0.014404580264874539, 'atr_max_pct': 0.1452705553499849, 'tp_mult': 2.3372831184121865, 'tsl_mult': 0.0640031639382993, 'strategy': 'mean_reversion', 'time_stop': 185, 'use_sma': False, 'use_atr': False, 'use_adx': True, 'use_ema': True, 'use_spike': True, 'rsi_required': True, 'edge_k': 0.10918961448773692, 'edge_cap': 0.2267507607628891, 'bull_strategy': 'breakout', 'bull_bb_std_mult': 2.9310166806573537, 'bull_rsi_os': 19, 'bull_rsi_ob': 60, 'bull_adx_thresh': 9.01610504399472, 'bull_atr_min_pct': 0.0022932951995523945, 'bull_atr_max_pct': 0.0824954716672693, 'bull_tp_mult': 1.5865223571167306, 'bull_tsl_mult': 0.5924521304682554, 'bull_time_stop': 97, 'bull_use_sma': False, 'bull_use_ema': False, 'bull_use_atr': True, 'bull_use_adx': True, 'bull_use_spike': False, 'bull_rsi_required': True, 'bear_strategy': 'breakout', 'bear_bb_std_mult': 1.8122494944907295, 'bear_rsi_os': 21, 'bear_rsi_ob': 82, 'bear_adx_thresh': 5.4594254237770965, 'bear_atr_min_pct': 0.006578930466549662, 'bear_atr_max_pct': 0.04180030884840822, 'bear_tp_mult': 1.9001616993821189, 'bear_tsl_mult': 0.1527123104526889, 'bear_time_stop': 293, 'bear_use_sma': False, 'bear_use_ema': False, 'bear_use_atr': False, 'bear_use_adx': False, 'bear_use_spike': True, 'bear_rsi_required': False, 'sideways_strategy': 'breakout', 'sideways_bb_std_mult': 1.7450949029897593, 'sideways_rsi_os': 5, 'sideways_rsi_ob': 91, 'sideways_adx_thresh': 8.08915507211753, 'sideways_atr_min_pct': 0.028798050447871842, 'sideways_atr_max_pct': 0.14242964264149902, 'sideways_tp_mult': 1.1717736205948395, 'sideways_tsl_mult': 0.07334172178025473, 'sideways_time_stop': 49, 'sideways_use_sma': True, 'sideways_use_ema': True, 'sideways_use_atr': True, 'sideways_use_adx': True, 'sideways_use_spike': False, 'sideways_rsi_required': False}.
[I 2025-09-01 08:09:07,871] Trial 283 finished with values: [-1000000000.0, 1000000000.0] and parameters: {'p_sma': 26, 'p_std': 55, 'p_atr': 24, 'p_adx': 24, 'rsi_period': 57, 'ema1': 16, 'ema2': 13, 'slip_atr_k': 0.06942196416481963, 'slip_spread_k': 0.8782513863317611, 'spread_hl_frac': 0.014732734604984057, 'bb_std_mult': 3.2606932482621436, 'rsi_os': 23, 'rsi_ob': 92, 'vol_spike': 0.2652115303695563, 'adx_thresh': 28.992351915046715, 'atr_min_pct': 0.003384016679741071, 'atr_max_pct': 0.09989493440243373, 'tp_mult': 1.016354364610578, 'tsl_mult': 0.9979929538098602, 'strategy': 'breakout', 'time_stop': 233, 'use_sma': True, 'use_atr': False, 'use_adx': True, 'use_ema': True, 'use_spike': True, 'rsi_required': True, 'edge_k': 1.6429195230075733, 'edge_cap': 0.23329170005661778, 'bull_strategy': 'breakout', 'bull_bb_std_mult': 3.2116571951813513, 'bull_rsi_os': 50, 'bull_rsi_ob': 49, 'bull_adx_thresh': 10.411211689814614, 'bull_atr_min_pct': 0.004805768656771461, 'bull_atr_max_pct': 0.017676075373066088, 'bull_tp_mult': 1.4718472465312258, 'bull_tsl_mult': 0.5941019092632889, 'bull_time_stop': 62, 'bull_use_sma': True, 'bull_use_ema': False, 'bull_use_atr': False, 'bull_use_adx': True, 'bull_use_spike': False, 'bull_rsi_required': False, 'bear_strategy': 'mean_reversion', 'bear_bb_std_mult': 1.5992926016519526, 'bear_rsi_os': 44, 'bear_rsi_ob': 80, 'bear_adx_thresh': 7.006139284156253, 'bear_atr_min_pct': 0.0051052950782721485, 'bear_atr_max_pct': 0.10175023066851704, 'bear_tp_mult': 1.9160482373246783, 'bear_tsl_mult': 0.9825340981588204, 'bear_time_stop': 291, 'bear_use_sma': True, 'bear_use_ema': False, 'bear_use_atr': False, 'bear_use_adx': False, 'bear_use_spike': False, 'bear_rsi_required': False, 'sideways_strategy': 'breakout', 'sideways_bb_std_mult': 3.103309228018113, 'sideways_rsi_os': 52, 'sideways_rsi_ob': 92, 'sideways_adx_thresh': 13.452738984737474, 'sideways_atr_min_pct': 0.021420341356115757, 'sideways_atr_max_pct': 0.025571250172510888, 'sideways_tp_mult': 1.3308067487975823, 'sideways_tsl_mult': 0.11885717730315044, 'sideways_time_stop': 148, 'sideways_use_sma': True, 'sideways_use_ema': True, 'sideways_use_atr': True, 'sideways_use_adx': True, 'sideways_use_spike': False, 'sideways_rsi_required': False}.
[I 2025-09-01 08:09:07,871] Trial 281 finished with values: [-1000000000.0, 1000000000.0] and parameters: {'p_sma': 26, 'p_std': 48, 'p_atr': 21, 'p_adx': 23, 'rsi_period': 57, 'ema1': 15, 'ema2': 13, 'slip_atr_k': 0.16016811101002212, 'slip_spread_k': 0.32377998403635466, 'spread_hl_frac': 0.014758810272245043, 'bb_std_mult': 2.421758376391955, 'rsi_os': 26, 'rsi_ob': 92, 'vol_spike': 0.11662238160235784, 'adx_thresh': 26.36844648178846, 'atr_min_pct': 0.0035483256216535873, 'atr_max_pct': 0.020075236053983807, 'tp_mult': 2.0430286167362097, 'tsl_mult': 0.12766159687464107, 'strategy': 'breakout', 'time_stop': 238, 'use_sma': True, 'use_atr': False, 'use_adx': True, 'use_ema': True, 'use_spike': True, 'rsi_required': True, 'edge_k': 0.0998724183332319, 'edge_cap': 0.22914145460485996, 'bull_strategy': 'breakout', 'bull_bb_std_mult': 3.2511497642759464, 'bull_rsi_os': 50, 'bull_rsi_ob': 49, 'bull_adx_thresh': 10.590653002510003, 'bull_atr_min_pct': 0.02112688651537708, 'bull_atr_max_pct': 0.01765794777816886, 'bull_tp_mult': 1.5838573921685501, 'bull_tsl_mult': 0.29958908793463257, 'bull_time_stop': 46, 'bull_use_sma': True, 'bull_use_ema': False, 'bull_use_atr': False, 'bull_use_adx': False, 'bull_use_spike': False, 'bull_rsi_required': False, 'bear_strategy': 'mean_reversion', 'bear_bb_std_mult': 1.6786900051491842, 'bear_rsi_os': 46, 'bear_rsi_ob': 82, 'bear_adx_thresh': 5.032195155672848, 'bear_atr_min_pct': 0.004953524761697083, 'bear_atr_max_pct': 0.0885729781147179, 'bear_tp_mult': 1.9169698037604088, 'bear_tsl_mult': 0.07262795322509003, 'bear_time_stop': 290, 'bear_use_sma': True, 'bear_use_ema': False, 'bear_use_atr': False, 'bear_use_adx': False, 'bear_use_spike': False, 'bear_rsi_required': False, 'sideways_strategy': 'breakout', 'sideways_bb_std_mult': 1.2406971022045727, 'sideways_rsi_os': 52, 'sideways_rsi_ob': 91, 'sideways_adx_thresh': 24.098230487087, 'sideways_atr_min_pct': 0.028777934203450137, 'sideways_atr_max_pct': 0.02726672366761219, 'sideways_tp_mult': 1.3173691847593623, 'sideways_tsl_mult': 0.11275702727880191, 'sideways_time_stop': 122, 'sideways_use_sma': True, 'sideways_use_ema': True, 'sideways_use_atr': True, 'sideways_use_adx': True, 'sideways_use_spike': False, 'sideways_rsi_required': False}.
[I 2025-09-01 08:09:52,242] Trial 286 finished with values: [-0.0230649847549792, 0.023004087690866332] and parameters: {'p_sma': 28, 'p_std': 41, 'p_atr': 22, 'p_adx': 29, 'rsi_period': 54, 'ema1': 5, 'ema2': 17, 'slip_atr_k': 0.11143019869610428, 'slip_spread_k': 0.908456020786374, 'spread_hl_frac': 0.012237689504380216, 'bb_std_mult': 2.009317429654928, 'rsi_os': 32, 'rsi_ob': 70, 'vol_spike': 0.09855123230804642, 'adx_thresh': 30.89907920311525, 'atr_min_pct': 0.004878138368036707, 'atr_max_pct': 0.13859651220403849, 'tp_mult': 1.8363080256279993, 'tsl_mult': 0.09822402440460999, 'strategy': 'breakout', 'time_stop': 229, 'use_sma': False, 'use_atr': False, 'use_adx': True, 'use_ema': True, 'use_spike': True, 'rsi_required': True, 'edge_k': 0.21928538099319003, 'edge_cap': 0.7519965375236766, 'bull_strategy': 'breakout', 'bull_bb_std_mult': 1.0963008094084303, 'bull_rsi_os': 26, 'bull_rsi_ob': 83, 'bull_adx_thresh': 8.281044777958568, 'bull_atr_min_pct': 0.02714975654342483, 'bull_atr_max_pct': 0.10689364773731372, 'bull_tp_mult': 1.548645218317328, 'bull_tsl_mult': 0.628381625222982, 'bull_time_stop': 71, 'bull_use_sma': True, 'bull_use_ema': True, 'bull_use_atr': False, 'bull_use_adx': False, 'bull_use_spike': True, 'bull_rsi_required': False, 'bear_strategy': 'mean_reversion', 'bear_bb_std_mult': 1.9836132843126206, 'bear_rsi_os': 45, 'bear_rsi_ob': 79, 'bear_adx_thresh': 7.739310250891268, 'bear_atr_min_pct': 0.0038035505732144197, 'bear_atr_max_pct': 0.0993664165588723, 'bear_tp_mult': 2.8410804855022223, 'bear_tsl_mult': 0.0018866560007890637, 'bear_time_stop': 169, 'bear_use_sma': True, 'bear_use_ema': False, 'bear_use_atr': False, 'bear_use_adx': False, 'bear_use_spike': False, 'bear_rsi_required': False, 'sideways_strategy': 'mean_reversion', 'sideways_bb_std_mult': 0.5086449425474111, 'sideways_rsi_os': 10, 'sideways_rsi_ob': 95, 'sideways_adx_thresh': 10.247660782194965, 'sideways_atr_min_pct': 0.02011732534366891, 'sideways_atr_max_pct': 0.0718343343278875, 'sideways_tp_mult': 1.47804280835152, 'sideways_tsl_mult': 0.026845835621817804, 'sideways_time_stop': 70, 'sideways_use_sma': True, 'sideways_use_ema': True, 'sideways_use_atr': False, 'sideways_use_adx': True, 'sideways_use_spike': True, 'sideways_rsi_required': False}.
[I 2025-09-01 08:09:52,418] Trial 285 finished with values: [-0.024558538518882567, 0.024508624906817815] and parameters: {'p_sma': 26, 'p_std': 41, 'p_atr': 21, 'p_adx': 30, 'rsi_period': 56, 'ema1': 29, 'ema2': 15, 'slip_atr_k': 0.11044525611578174, 'slip_spread_k': 0.6788329760767075, 'spread_hl_frac': 0.0154418051335416, 'bb_std_mult': 1.9958345097600103, 'rsi_os': 32, 'rsi_ob': 64, 'vol_spike': 0.09665301290464287, 'adx_thresh': 30.7669469711521, 'atr_min_pct': 0.004860209096057416, 'atr_max_pct': 0.019176777452221065, 'tp_mult': 2.6573891831245566, 'tsl_mult': 0.048548094786734705, 'strategy': 'breakout', 'time_stop': 232, 'use_sma': False, 'use_atr': False, 'use_adx': True, 'use_ema': True, 'use_spike': True, 'rsi_required': True, 'edge_k': 1.3759045113947592, 'edge_cap': 0.23740907279049472, 'bull_strategy': 'breakout', 'bull_bb_std_mult': 3.2620349625924567, 'bull_rsi_os': 54, 'bull_rsi_ob': 94, 'bull_adx_thresh': 8.504337277403684, 'bull_atr_min_pct': 0.0046990855124900265, 'bull_atr_max_pct': 0.1277767553402397, 'bull_tp_mult': 1.6340364814257846, 'bull_tsl_mult': 0.3011162170092264, 'bull_time_stop': 61, 'bull_use_sma': True, 'bull_use_ema': False, 'bull_use_atr': False, 'bull_use_adx': False, 'bull_use_spike': True, 'bull_rsi_required': False, 'bear_strategy': 'mean_reversion', 'bear_bb_std_mult': 2.4757313751309336, 'bear_rsi_os': 44, 'bear_rsi_ob': 80, 'bear_adx_thresh': 7.350857608894174, 'bear_atr_min_pct': 0.003760672868888699, 'bear_atr_max_pct': 0.08917121904412519, 'bear_tp_mult': 1.8115469258053105, 'bear_tsl_mult': 0.06959091420937025, 'bear_time_stop': 288, 'bear_use_sma': True, 'bear_use_ema': False, 'bear_use_atr': False, 'bear_use_adx': False, 'bear_use_spike': False, 'bear_rsi_required': False, 'sideways_strategy': 'breakout', 'sideways_bb_std_mult': 1.51353432868444, 'sideways_rsi_os': 6, 'sideways_rsi_ob': 92, 'sideways_adx_thresh': 34.265100694017534, 'sideways_atr_min_pct': 0.02013838077409297, 'sideways_atr_max_pct': 0.0299659436188503, 'sideways_tp_mult': 1.3278966223713495, 'sideways_tsl_mult': 0.03357620832445091, 'sideways_time_stop': 141, 'sideways_use_sma': True, 'sideways_use_ema': True, 'sideways_use_atr': False, 'sideways_use_adx': True, 'sideways_use_spike': True, 'sideways_rsi_required': False}.
[I 2025-09-01 08:09:52,599] Trial 284 finished with values: [-1000000000.0, 1000000000.0] and parameters: {'p_sma': 27, 'p_std': 34, 'p_atr': 21, 'p_adx': 28, 'rsi_period': 56, 'ema1': 12, 'ema2': 12, 'slip_atr_k': 0.17215252809834963, 'slip_spread_k': 0.8797848301317013, 'spread_hl_frac': 0.04729233820547993, 'bb_std_mult': 3.014742510865458, 'rsi_os': 32, 'rsi_ob': 87, 'vol_spike': 0.27628616487264657, 'adx_thresh': 29.01831852139999, 'atr_min_pct': 0.012126812951370216, 'atr_max_pct': 0.01937279606513804, 'tp_mult': 1.85484966463156, 'tsl_mult': 0.043331006088922513, 'strategy': 'breakout', 'time_stop': 230, 'use_sma': False, 'use_atr': False, 'use_adx': True, 'use_ema': True, 'use_spike': True, 'rsi_required': True, 'edge_k': 1.500849684896714, 'edge_cap': 0.7499897329879437, 'bull_strategy': 'breakout', 'bull_bb_std_mult': 1.0087712900426542, 'bull_rsi_os': 34, 'bull_rsi_ob': 95, 'bull_adx_thresh': 7.488676645662902, 'bull_atr_min_pct': 0.004652562728097865, 'bull_atr_max_pct': 0.03657881191679553, 'bull_tp_mult': 1.550285227641246, 'bull_tsl_mult': 0.5558792669464767, 'bull_time_stop': 63, 'bull_use_sma': True, 'bull_use_ema': False, 'bull_use_atr': False, 'bull_use_adx': False, 'bull_use_spike': True, 'bull_rsi_required': False, 'bear_strategy': 'mean_reversion', 'bear_bb_std_mult': 2.798159865849755, 'bear_rsi_os': 44, 'bear_rsi_ob': 80, 'bear_adx_thresh': 7.148298622458218, 'bear_atr_min_pct': 0.007563412371184395, 'bear_atr_max_pct': 0.10214908257427227, 'bear_tp_mult': 2.0461313573944997, 'bear_tsl_mult': 0.06823059104024534, 'bear_time_stop': 290, 'bear_use_sma': True, 'bear_use_ema': False, 'bear_use_atr': False, 'bear_use_adx': False, 'bear_use_spike': False, 'bear_rsi_required': False, 'sideways_strategy': 'breakout', 'sideways_bb_std_mult': 1.224430276243213, 'sideways_rsi_os': 6, 'sideways_rsi_ob': 92, 'sideways_adx_thresh': 12.719884709616515, 'sideways_atr_min_pct': 0.02744836047310882, 'sideways_atr_max_pct': 0.030485017887358107, 'sideways_tp_mult': 1.3356770304265362, 'sideways_tsl_mult': 0.098552331997117, 'sideways_time_stop': 116, 'sideways_use_sma': True, 'sideways_use_ema': True, 'sideways_use_atr': False, 'sideways_use_adx': True, 'sideways_use_spike': True, 'sideways_rsi_required': False}.
[I 2025-09-01 08:09:52,901] Trial 287 finished with values: [-0.03429069944684837, 0.03415352274345406] and parameters: {'p_sma': 28, 'p_std': 34, 'p_atr': 9, 'p_adx': 29, 'rsi_period': 54, 'ema1': 29, 'ema2': 31, 'slip_atr_k': 0.15373192809161276, 'slip_spread_k': 0.11713321510304253, 'spread_hl_frac': 0.04577245748845833, 'bb_std_mult': 1.9765231174449454, 'rsi_os': 32, 'rsi_ob': 79, 'vol_spike': 0.13688298613298644, 'adx_thresh': 18.5208440053345, 'atr_min_pct': 0.004568086862343093, 'atr_max_pct': 0.14982127115928104, 'tp_mult': 2.542105215120369, 'tsl_mult': 0.09976598124817397, 'strategy': 'breakout', 'time_stop': 261, 'use_sma': False, 'use_atr': False, 'use_adx': True, 'use_ema': True, 'use_spike': True, 'rsi_required': True, 'edge_k': 0.2194521233324957, 'edge_cap': 0.18822915163940862, 'bull_strategy': 'breakout', 'bull_bb_std_mult': 1.0181278460759589, 'bull_rsi_os': 54, 'bull_rsi_ob': 47, 'bull_adx_thresh': 8.438904246218067, 'bull_atr_min_pct': 0.001301048615609762, 'bull_atr_max_pct': 0.0357849658809386, 'bull_tp_mult': 1.634259972382795, 'bull_tsl_mult': 0.6284803524567594, 'bull_time_stop': 70, 'bull_use_sma': True, 'bull_use_ema': True, 'bull_use_atr': False, 'bull_use_adx': False, 'bull_use_spike': True, 'bull_rsi_required': False, 'bear_strategy': 'mean_reversion', 'bear_bb_std_mult': 1.9764526057730003, 'bear_rsi_os': 45, 'bear_rsi_ob': 79, 'bear_adx_thresh': 6.5161793347467185, 'bear_atr_min_pct': 0.015400527698572445, 'bear_atr_max_pct': 0.08274124186385658, 'bear_tp_mult': 2.8876936999223166, 'bear_tsl_mult': 0.03125459973190725, 'bear_time_stop': 233, 'bear_use_sma': True, 'bear_use_ema': False, 'bear_use_atr': False, 'bear_use_adx': False, 'bear_use_spike': False, 'bear_rsi_required': False, 'sideways_strategy': 'mean_reversion', 'sideways_bb_std_mult': 0.9275745333028628, 'sideways_rsi_os': 10, 'sideways_rsi_ob': 95, 'sideways_adx_thresh': 5.019733718202655, 'sideways_atr_min_pct': 0.020106069713175457, 'sideways_atr_max_pct': 0.07170105853621911, 'sideways_tp_mult': 1.4616532616391558, 'sideways_tsl_mult': 0.017395562965427158, 'sideways_time_stop': 266, 'sideways_use_sma': True, 'sideways_use_ema': True, 'sideways_use_atr': False, 'sideways_use_adx': True, 'sideways_use_spike': True, 'sideways_rsi_required': False}.
