[I 2025-09-01 08:31:37,079] Trial 404 finished with values: [-0.01205969797831985, 0.012000333993588406] and parameters: {'p_sma': 29, 'p_std': 38, 'p_atr': 20, 'p_adx': 13, 'rsi_period': 45, 'ema1': 30, 'ema2': 19, 'slip_atr_k': 0.009265489656377763, 'slip_spread_k': 0.8941628192450363, 'spread_hl_frac': 0.013064019646495808, 'bb_std_mult': 2.0723269284931396, 'rsi_os': 33, 'rsi_ob': 84, 'vol_spike': 0.05050686824926709, 'adx_thresh': 28.706019653487882, 'atr_min_pct': 0.0025086476003851237, 'atr_max_pct': 0.12800918147043758, 'tp_mult': 1.6305631448863074, 'tsl_mult': 0.39966753735589056, 'strategy': 'breakout', 'time_stop': 233, 'use_sma': True, 'use_atr': False, 'use_adx': True, 'use_ema': True, 'use_spike': False, 'rsi_required': False, 'edge_k': 0.28987926800786495, 'edge_cap': 0.160841015128426, 'bull_strategy': 'breakout', 'bull_bb_std_mult': 3.0263903609926928, 'bull_rsi_os': 18, 'bull_rsi_ob': 70, 'bull_adx_thresh': 9.0405563251364, 'bull_atr_min_pct': 0.0021742122360678697, 'bull_atr_max_pct': 0.06737292999639709, 'bull_tp_mult': 1.6252698108326953, 'bull_tsl_mult': 0.16093930686815044, 'bull_time_stop': 75, 'bull_use_sma': False, 'bull_use_ema': True, 'bull_use_atr': False, 'bull_use_adx': False, 'bull_use_spike': False, 'bull_rsi_required': True, 'bear_strategy': 'breakout', 'bear_bb_std_mult': 1.892112313554028, 'bear_rsi_os': 20, 'bear_rsi_ob': 77, 'bear_adx_thresh': 28.204335599571657, 'bear_atr_min_pct': 0.00854059723895576, 'bear_atr_max_pct': 0.07857405134235339, 'bear_tp_mult': 2.1061987163333247, 'bear_tsl_mult': 0.11676465256841417, 'bear_time_stop': 281, 'bear_use_sma': True, 'bear_use_ema': True, 'bear_use_atr': True, 'bear_use_adx': False, 'bear_use_spike': False, 'bear_rsi_required': True, 'sideways_strategy': 'mean_reversion', 'sideways_bb_std_mult': 1.212888602250948, 'sideways_rsi_os': 48, 'sideways_rsi_ob': 66, 'sideways_adx_thresh': 14.657010823967484, 'sideways_atr_min_pct': 0.029975964595786726, 'sideways_atr_max_pct': 0.06683728606495626, 'sideways_tp_mult': 1.2659634736801642, 'sideways_tsl_mult': 0.2166227000002668, 'sideways_time_stop': 190, 'sideways_use_sma': False, 'sideways_use_ema': True, 'sideways_use_atr': True, 'sideways_use_adx': False, 'sideways_use_spike': True, 'sideways_rsi_required': True}.
[I 2025-09-01 08:31:37,250] Trial 403 finished with values: [-1000000000.0, 1000000000.0] and parameters: {'p_sma': 29, 'p_std': 52, 'p_atr': 20, 'p_adx': 13, 'rsi_period': 61, 'ema1': 26, 'ema2': 22, 'slip_atr_k': 0.05333238392384934, 'slip_spread_k': 0.8993068717910624, 'spread_hl_frac': 0.013105239688764888, 'bb_std_mult': 2.8202292784998058, 'rsi_os': 33, 'rsi_ob': 52, 'vol_spike': 0.24796818145620036, 'adx_thresh': 14.605234413234832, 'atr_min_pct': 0.0028827741271011164, 'atr_max_pct': 0.11925176034558387, 'tp_mult': 1.8750150005808999, 'tsl_mult': 0.7610313483375286, 'strategy': 'breakout', 'time_stop': 203, 'use_sma': True, 'use_atr': False, 'use_adx': True, 'use_ema': True, 'use_spike': False, 'rsi_required': False, 'edge_k': 0.27809872442507094, 'edge_cap': 0.23927992896157568, 'bull_strategy': 'breakout', 'bull_bb_std_mult': 0.5126466269131418, 'bull_rsi_os': 18, 'bull_rsi_ob': 70, 'bull_adx_thresh': 8.15021607729142, 'bull_atr_min_pct': 0.012386670358904117, 'bull_atr_max_pct': 0.06816561155642127, 'bull_tp_mult': 1.6169196136323483, 'bull_tsl_mult': 0.5802011347617861, 'bull_time_stop': 78, 'bull_use_sma': False, 'bull_use_ema': True, 'bull_use_atr': False, 'bull_use_adx': False, 'bull_use_spike': False, 'bull_rsi_required': True, 'bear_strategy': 'breakout', 'bear_bb_std_mult': 1.8793708468139332, 'bear_rsi_os': 42, 'bear_rsi_ob': 86, 'bear_adx_thresh': 28.133897608464224, 'bear_atr_min_pct': 0.004572619349348885, 'bear_atr_max_pct': 0.10739531067252006, 'bear_tp_mult': 1.4469400745602106, 'bear_tsl_mult': 0.1356575656185309, 'bear_time_stop': 270, 'bear_use_sma': True, 'bear_use_ema': False, 'bear_use_atr': True, 'bear_use_adx': False, 'bear_use_spike': False, 'bear_rsi_required': True, 'sideways_strategy': 'breakout', 'sideways_bb_std_mult': 0.854638661765869, 'sideways_rsi_os': 49, 'sideways_rsi_ob': 66, 'sideways_adx_thresh': 19.56738452285401, 'sideways_atr_min_pct': 0.029992709065591244, 'sideways_atr_max_pct': 0.0225962344941502, 'sideways_tp_mult': 1.498858626824681, 'sideways_tsl_mult': 0.231083780337759, 'sideways_time_stop': 65, 'sideways_use_sma': False, 'sideways_use_ema': True, 'sideways_use_atr': True, 'sideways_use_adx': False, 'sideways_use_spike': True, 'sideways_rsi_required': True}.
[I 2025-09-01 08:32:20,658] Trial 409 finished with values: [-1000000000.0, 1000000000.0] and parameters: {'p_sma': 31, 'p_std': 57, 'p_atr': 22, 'p_adx': 17, 'rsi_period': 51, 'ema1': 15, 'ema2': 22, 'slip_atr_k': 0.0010910424077736, 'slip_spread_k': 0.33513703214072715, 'spread_hl_frac': 0.014786801046600882, 'bb_std_mult': 2.896082611949712, 'rsi_os': 31, 'rsi_ob': 89, 'vol_spike': 0.060066741328896396, 'adx_thresh': 21.701195298838492, 'atr_min_pct': 0.004281072454716589, 'atr_max_pct': 0.13429055038563564, 'tp_mult': 2.6003066727038826, 'tsl_mult': 0.13068313128006215, 'strategy': 'breakout', 'time_stop': 142, 'use_sma': False, 'use_atr': True, 'use_adx': True, 'use_ema': True, 'use_spike': True, 'rsi_required': True, 'edge_k': 1.1745880465831757, 'edge_cap': 0.19435657857046398, 'bull_strategy': 'mean_reversion', 'bull_bb_std_mult': 2.9331570844999972, 'bull_rsi_os': 47, 'bull_rsi_ob': 48, 'bull_adx_thresh': 8.163733963312119, 'bull_atr_min_pct': 0.004713532437023892, 'bull_atr_max_pct': 0.0541061221198774, 'bull_tp_mult': 1.5595480254553469, 'bull_tsl_mult': 0.5399230842189084, 'bull_time_stop': 181, 'bull_use_sma': True, 'bull_use_ema': True, 'bull_use_atr': False, 'bull_use_adx': False, 'bull_use_spike': False, 'bull_rsi_required': False, 'bear_strategy': 'mean_reversion', 'bear_bb_std_mult': 2.024353194337483, 'bear_rsi_os': 42, 'bear_rsi_ob': 56, 'bear_adx_thresh': 32.86748560695561, 'bear_atr_min_pct': 0.01740093544878073, 'bear_atr_max_pct': 0.10803238534083914, 'bear_tp_mult': 2.8748422547488413, 'bear_tsl_mult': 0.05208593883661426, 'bear_time_stop': 300, 'bear_use_sma': True, 'bear_use_ema': False, 'bear_use_atr': True, 'bear_use_adx': False, 'bear_use_spike': False, 'bear_rsi_required': False, 'sideways_strategy': 'breakout', 'sideways_bb_std_mult': 0.9145382284024473, 'sideways_rsi_os': 36, 'sideways_rsi_ob': 75, 'sideways_adx_thresh': 9.077669637680552, 'sideways_atr_min_pct': 0.029153360919903455, 'sideways_atr_max_pct': 0.029451273768603146, 'sideways_tp_mult': 2.8529509131766773, 'sideways_tsl_mult': 0.07989439757225815, 'sideways_time_stop': 207, 'sideways_use_sma': True, 'sideways_use_ema': True, 'sideways_use_atr': True, 'sideways_use_adx': True, 'sideways_use_spike': False, 'sideways_rsi_required': False}.
[I 2025-09-01 08:32:20,937] Trial 410 finished with values: [-1000000000.0, 1000000000.0] and parameters: {'p_sma': 30, 'p_std': 43, 'p_atr': 23, 'p_adx': 17, 'rsi_period': 54, 'ema1': 14, 'ema2': 17, 'slip_atr_k': 0.00036745460563501753, 'slip_spread_k': 0.6745975256611164, 'spread_hl_frac': 0.021863926400607765, 'bb_std_mult': 2.312948976903778, 'rsi_os': 31, 'rsi_ob': 88, 'vol_spike': 0.06038497217931742, 'adx_thresh': 24.892791000542477, 'atr_min_pct': 0.020472663843819097, 'atr_max_pct': 0.10947347268316795, 'tp_mult': 2.7748234810595394, 'tsl_mult': 0.1334195637425545, 'strategy': 'breakout', 'time_stop': 240, 'use_sma': False, 'use_atr': True, 'use_adx': True, 'use_ema': True, 'use_spike': True, 'rsi_required': True, 'edge_k': 1.1887712930362206, 'edge_cap': 0.1938052821338573, 'bull_strategy': 'mean_reversion', 'bull_bb_std_mult': 3.5061526127691325, 'bull_rsi_os': 11, 'bull_rsi_ob': 48, 'bull_adx_thresh': 26.839057734908213, 'bull_atr_min_pct': 0.004736669920788643, 'bull_atr_max_pct': 0.053914666214210594, 'bull_tp_mult': 1.5544351091046498, 'bull_tsl_mult': 0.491535272410348, 'bull_time_stop': 181, 'bull_use_sma': True, 'bull_use_ema': True, 'bull_use_atr': False, 'bull_use_adx': False, 'bull_use_spike': False, 'bull_rsi_required': False, 'bear_strategy': 'mean_reversion', 'bear_bb_std_mult': 2.90634161624573, 'bear_rsi_os': 46, 'bear_rsi_ob': 79, 'bear_adx_thresh': 5.9971674618349935, 'bear_atr_min_pct': 0.007666423211372847, 'bear_atr_max_pct': 0.09509080722522004, 'bear_tp_mult': 2.226135696487942, 'bear_tsl_mult': 0.04823752299855468, 'bear_time_stop': 87, 'bear_use_sma': False, 'bear_use_ema': False, 'bear_use_atr': False, 'bear_use_adx': False, 'bear_use_spike': False, 'bear_rsi_required': False, 'sideways_strategy': 'breakout', 'sideways_bb_std_mult': 0.91892277284434, 'sideways_rsi_os': 6, 'sideways_rsi_ob': 91, 'sideways_adx_thresh': 9.303466429669072, 'sideways_atr_min_pct': 0.005607404801837031, 'sideways_atr_max_pct': 0.030890490534998045, 'sideways_tp_mult': 1.375100382377428, 'sideways_tsl_mult': 0.14569930806463233, 'sideways_time_stop': 182, 'sideways_use_sma': True, 'sideways_use_ema': True, 'sideways_use_atr': True, 'sideways_use_adx': True, 'sideways_use_spike': False, 'sideways_rsi_required': False}.
[I 2025-09-01 08:32:21,255] Trial 408 finished with values: [-0.0095234301994096, 0.010530232198880758] and parameters: {'p_sma': 31, 'p_std': 56, 'p_atr': 9, 'p_adx': 17, 'rsi_period': 61, 'ema1': 15, 'ema2': 22, 'slip_atr_k': 0.004661183217503801, 'slip_spread_k': 0.3105004825433444, 'spread_hl_frac': 0.004680947500334289, 'bb_std_mult': 2.2834326284772617, 'rsi_os': 35, 'rsi_ob': 74, 'vol_spike': 0.0601356520999109, 'adx_thresh': 27.43658643838757, 'atr_min_pct': 0.006575282877483671, 'atr_max_pct': 0.13008661773394628, 'tp_mult': 1.2251749330864263, 'tsl_mult': 0.40106038039506486, 'strategy': 'breakout', 'time_stop': 191, 'use_sma': False, 'use_atr': False, 'use_adx': True, 'use_ema': True, 'use_spike': True, 'rsi_required': True, 'edge_k': 0.18668343286179934, 'edge_cap': 0.8020416365718783, 'bull_strategy': 'breakout', 'bull_bb_std_mult': 2.945277887613919, 'bull_rsi_os': 17, 'bull_rsi_ob': 48, 'bull_adx_thresh': 26.987063994953157, 'bull_atr_min_pct': 0.02568971665237268, 'bull_atr_max_pct': 0.06158935152066746, 'bull_tp_mult': 1.9090649456431505, 'bull_tsl_mult': 0.54030831859514, 'bull_time_stop': 78, 'bull_use_sma': True, 'bull_use_ema': True, 'bull_use_atr': False, 'bull_use_adx': False, 'bull_use_spike': False, 'bull_rsi_required': False, 'bear_strategy': 'mean_reversion', 'bear_bb_std_mult': 2.078535499290591, 'bear_rsi_os': 42, 'bear_rsi_ob': 79, 'bear_adx_thresh': 6.044472668166778, 'bear_atr_min_pct': 0.0036084648312179916, 'bear_atr_max_pct': 0.10421925384155785, 'bear_tp_mult': 2.999500004782443, 'bear_tsl_mult': 0.3342350498782292, 'bear_time_stop': 292, 'bear_use_sma': True, 'bear_use_ema': False, 'bear_use_atr': True, 'bear_use_adx': False, 'bear_use_spike': False, 'bear_rsi_required': False, 'sideways_strategy': 'breakout', 'sideways_bb_std_mult': 0.9006582052144113, 'sideways_rsi_os': 35, 'sideways_rsi_ob': 92, 'sideways_adx_thresh': 9.312773423543147, 'sideways_atr_min_pct': 0.02931092511373439, 'sideways_atr_max_pct': 0.05527202324749503, 'sideways_tp_mult': 1.420263616486395, 'sideways_tsl_mult': 0.0857563409975284, 'sideways_time_stop': 179, 'sideways_use_sma': True, 'sideways_use_ema': True, 'sideways_use_atr': True, 'sideways_use_adx': True, 'sideways_use_spike': False, 'sideways_rsi_required': True}.
[I 2025-09-01 08:32:21,389] Trial 407 finished with values: [-0.023051637025876537, 0.023055561046106874] and parameters: {'p_sma': 30, 'p_std': 55, 'p_atr': 9, 'p_adx': 17, 'rsi_period': 46, 'ema1': 6, 'ema2': 22, 'slip_atr_k': 0.050318945391292544, 'slip_spread_k': 0.3333488858380541, 'spread_hl_frac': 0.012981286934943267, 'bb_std_mult': 1.7147961852069393, 'rsi_os': 33, 'rsi_ob': 89, 'vol_spike': 0.04967945202681043, 'adx_thresh': 15.434517795056284, 'atr_min_pct': 0.004242397889607628, 'atr_max_pct': 0.1303293697619523, 'tp_mult': 1.5571846113927181, 'tsl_mult': 0.12300201359275925, 'strategy': 'breakout', 'time_stop': 234, 'use_sma': False, 'use_atr': False, 'use_adx': True, 'use_ema': True, 'use_spike': False, 'rsi_required': True, 'edge_k': 0.5940240404331352, 'edge_cap': 0.2421304497685488, 'bull_strategy': 'breakout', 'bull_bb_std_mult': 1.1551627196517442, 'bull_rsi_os': 31, 'bull_rsi_ob': 79, 'bull_adx_thresh': 7.362717673394312, 'bull_atr_min_pct': 0.004879622038949324, 'bull_atr_max_pct': 0.06030437738411989, 'bull_tp_mult': 1.5693251655083647, 'bull_tsl_mult': 0.5686502745351452, 'bull_time_stop': 69, 'bull_use_sma': True, 'bull_use_ema': True, 'bull_use_atr': False, 'bull_use_adx': False, 'bull_use_spike': False, 'bull_rsi_required': False, 'bear_strategy': 'mean_reversion', 'bear_bb_std_mult': 1.693988352659536, 'bear_rsi_os': 42, 'bear_rsi_ob': 79, 'bear_adx_thresh': 32.81289400863332, 'bear_atr_min_pct': 0.018465985188497416, 'bear_atr_max_pct': 0.06715979823665194, 'bear_tp_mult': 2.0813991852426987, 'bear_tsl_mult': 0.3369697309899201, 'bear_time_stop': 300, 'bear_use_sma': True, 'bear_use_ema': False, 'bear_use_atr': True, 'bear_use_adx': False, 'bear_use_spike': False, 'bear_rsi_required': True, 'sideways_strategy': 'breakout', 'sideways_bb_std_mult': 0.9064650328124413, 'sideways_rsi_os': 36, 'sideways_rsi_ob': 66, 'sideways_adx_thresh': 27.47320930069025, 'sideways_atr_min_pct': 3.6920213456420256e-05, 'sideways_atr_max_pct': 0.012530614809905572, 'sideways_tp_mult': 1.4832751406003382, 'sideways_tsl_mult': 0.15853582888075868, 'sideways_time_stop': 184, 'sideways_use_sma': True, 'sideways_use_ema': True, 'sideways_use_atr': True, 'sideways_use_adx': True, 'sideways_use_spike': False, 'sideways_rsi_required': True}.
[I 2025-09-01 08:33:00,689] Trial 414 finished with values: [-0.005839466262620219, 0.005784395716417296] and parameters: {'p_sma': 27, 'p_std': 48, 'p_atr': 10, 'p_adx': 14, 'rsi_period': 11, 'ema1': 7, 'ema2': 11, 'slip_atr_k': 0.024038525343818562, 'slip_spread_k': 0.8275247142163269, 'spread_hl_frac': 0.010751592456367264, 'bb_std_mult': 2.2065147062538157, 'rsi_os': 18, 'rsi_ob': 82, 'vol_spike': 0.09116843774147475, 'adx_thresh': 30.508108929542775, 'atr_min_pct': 0.005224224639347588, 'atr_max_pct': 0.1261703364736375, 'tp_mult': 1.9891296405560355, 'tsl_mult': 0.09982158280501642, 'strategy': 'mean_reversion', 'time_stop': 28, 'use_sma': False, 'use_atr': False, 'use_adx': False, 'use_ema': True, 'use_spike': True, 'rsi_required': True, 'edge_k': 0.19727648467116715, 'edge_cap': 0.42909472897568685, 'bull_strategy': 'breakout', 'bull_bb_std_mult': 3.208677615654054, 'bull_rsi_os': 49, 'bull_rsi_ob': 46, 'bull_adx_thresh': 7.405800513996583, 'bull_atr_min_pct': 0.0029116871278598074, 'bull_atr_max_pct': 0.05036287639098988, 'bull_tp_mult': 1.5020031223644474, 'bull_tsl_mult': 0.6475873872949521, 'bull_time_stop': 65, 'bull_use_sma': True, 'bull_use_ema': False, 'bull_use_atr': True, 'bull_use_adx': True, 'bull_use_spike': True, 'bull_rsi_required': False, 'bear_strategy': 'mean_reversion', 'bear_bb_std_mult': 0.7758438523331754, 'bear_rsi_os': 46, 'bear_rsi_ob': 76, 'bear_adx_thresh': 7.6473903263284395, 'bear_atr_min_pct': 0.005288701754016399, 'bear_atr_max_pct': 0.13120713074887866, 'bear_tp_mult': 1.954775017179696, 'bear_tsl_mult': 0.109387165751876, 'bear_time_stop': 11, 'bear_use_sma': False, 'bear_use_ema': True, 'bear_use_atr': False, 'bear_use_adx': False, 'bear_use_spike': True, 'bear_rsi_required': False, 'sideways_strategy': 'mean_reversion', 'sideways_bb_std_mult': 2.472917443013735, 'sideways_rsi_os': 10, 'sideways_rsi_ob': 70, 'sideways_adx_thresh': 28.695896480385958, 'sideways_atr_min_pct': 0.02804148928948819, 'sideways_atr_max_pct': 0.01004677652708819, 'sideways_tp_mult': 1.1545723517392503, 'sideways_tsl_mult': 0.10875665588650406, 'sideways_time_stop': 242, 'sideways_use_sma': True, 'sideways_use_ema': True, 'sideways_use_atr': False, 'sideways_use_adx': True, 'sideways_use_spike': False, 'sideways_rsi_required': False}.
[I 2025-09-01 08:33:01,327] Trial 411 finished with values: [-1000000000.0, 1000000000.0] and parameters: {'p_sma': 17, 'p_std': 43, 'p_atr': 23, 'p_adx': 30, 'rsi_period': 75, 'ema1': 14, 'ema2': 49, 'slip_atr_k': 0.0039001297706698344, 'slip_spread_k': 0.44619823622156707, 'spread_hl_frac': 0.004566156961115231, 'bb_std_mult': 2.2592617337511562, 'rsi_os': 35, 'rsi_ob': 73, 'vol_spike': 0.06487948758038177, 'adx_thresh': 30.517825408946614, 'atr_min_pct': 0.022269592913409107, 'atr_max_pct': 0.11034522314704985, 'tp_mult': 2.0152588183378777, 'tsl_mult': 0.09675794130456157, 'strategy': 'breakout', 'time_stop': 189, 'use_sma': False, 'use_atr': False, 'use_adx': True, 'use_ema': True, 'use_spike': True, 'rsi_required': True, 'edge_k': 0.2026773001267163, 'edge_cap': 0.2562487961917118, 'bull_strategy': 'breakout', 'bull_bb_std_mult': 3.209751009528704, 'bull_rsi_os': 40, 'bull_rsi_ob': 46, 'bull_adx_thresh': 7.34349553908192, 'bull_atr_min_pct': 0.0028261345163369594, 'bull_atr_max_pct': 0.06221289036443549, 'bull_tp_mult': 1.4899427217559342, 'bull_tsl_mult': 0.6374422673734087, 'bull_time_stop': 67, 'bull_use_sma': True, 'bull_use_ema': False, 'bull_use_atr': False, 'bull_use_adx': False, 'bull_use_spike': False, 'bull_rsi_required': False, 'bear_strategy': 'mean_reversion', 'bear_bb_std_mult': 2.4410975139881477, 'bear_rsi_os': 6, 'bear_rsi_ob': 75, 'bear_adx_thresh': 15.106051487435849, 'bear_atr_min_pct': 0.003629558495547711, 'bear_atr_max_pct': 0.04825003500276939, 'bear_tp_mult': 1.629054705465297, 'bear_tsl_mult': 0.3502915204508231, 'bear_time_stop': 293, 'bear_use_sma': False, 'bear_use_ema': False, 'bear_use_atr': False, 'bear_use_adx': False, 'bear_use_spike': False, 'bear_rsi_required': False, 'sideways_strategy': 'breakout', 'sideways_bb_std_mult': 2.3217637673972393, 'sideways_rsi_os': 11, 'sideways_rsi_ob': 94, 'sideways_adx_thresh': 28.84376063730785, 'sideways_atr_min_pct': 0.02806450523029556, 'sideways_atr_max_pct': 0.010032158590607096, 'sideways_tp_mult': 2.244121392233395, 'sideways_tsl_mult': 0.14378061410604498, 'sideways_time_stop': 132, 'sideways_use_sma': True, 'sideways_use_ema': True, 'sideways_use_atr': True, 'sideways_use_adx': True, 'sideways_use_spike': False, 'sideways_rsi_required': False}.
[I 2025-09-01 08:33:01,636] Trial 412 finished with values: [-1000000000.0, 1000000000.0] and parameters: {'p_sma': 7, 'p_std': 17, 'p_atr': 18, 'p_adx': 14, 'rsi_period': 62, 'ema1': 6, 'ema2': 36, 'slip_atr_k': 0.025227067986198337, 'slip_spread_k': 0.8167846031478321, 'spread_hl_frac': 0.016805353013873685, 'bb_std_mult': 2.20250014230266, 'rsi_os': 19, 'rsi_ob': 82, 'vol_spike': 0.0764966554805894, 'adx_thresh': 30.479786975787057, 'atr_min_pct': 0.006599027282781269, 'atr_max_pct': 0.12963722556085572, 'tp_mult': 2.0114652193514897, 'tsl_mult': 0.6806905062410341, 'strategy': 'mean_reversion', 'time_stop': 255, 'use_sma': False, 'use_atr': False, 'use_adx': False, 'use_ema': True, 'use_spike': True, 'rsi_required': True, 'edge_k': 1.043175657066114, 'edge_cap': 0.21324259197545384, 'bull_strategy': 'breakout', 'bull_bb_std_mult': 1.172427578429289, 'bull_rsi_os': 40, 'bull_rsi_ob': 55, 'bull_adx_thresh': 7.388663160176509, 'bull_atr_min_pct': 0.019671321376036582, 'bull_atr_max_pct': 0.060580661221672154, 'bull_tp_mult': 1.4916089943416708, 'bull_tsl_mult': 0.9261333656930201, 'bull_time_stop': 5, 'bull_use_sma': True, 'bull_use_ema': False, 'bull_use_atr': True, 'bull_use_adx': True, 'bull_use_spike': True, 'bull_rsi_required': False, 'bear_strategy': 'mean_reversion', 'bear_bb_std_mult': 2.0897440700798695, 'bear_rsi_os': 52, 'bear_rsi_ob': 48, 'bear_adx_thresh': 21.88216688489628, 'bear_atr_min_pct': 0.010226853295643535, 'bear_atr_max_pct': 0.08509313775019009, 'bear_tp_mult': 2.1515838198541783, 'bear_tsl_mult': 0.32782021873028766, 'bear_time_stop': 293, 'bear_use_sma': True, 'bear_use_ema': False, 'bear_use_atr': False, 'bear_use_adx': False, 'bear_use_spike': True, 'bear_rsi_required': False, 'sideways_strategy': 'breakout', 'sideways_bb_std_mult': 1.0987012962136262, 'sideways_rsi_os': 9, 'sideways_rsi_ob': 94, 'sideways_adx_thresh': 28.479545309955782, 'sideways_atr_min_pct': 0.00672119835279838, 'sideways_atr_max_pct': 0.018491943074824626, 'sideways_tp_mult': 1.1431246976893505, 'sideways_tsl_mult': 0.2755515131646978, 'sideways_time_stop': 164, 'sideways_use_sma': True, 'sideways_use_ema': True, 'sideways_use_atr': True, 'sideways_use_adx': True, 'sideways_use_spike': False, 'sideways_rsi_required': False}.
