[I 2025-09-01 07:30:59,558] Trial 63 finished with values: [-1000000000.0, 1000000000.0] and parameters: {'p_sma': 18, 'p_std': 18, 'p_atr': 13, 'p_adx': 21, 'rsi_period': 17, 'ema1': 11, 'ema2': 20, 'slip_atr_k': 0.1198314222342925, 'slip_spread_k': 0.6588620866474443, 'spread_hl_frac': 0.023454046755470293, 'bb_std_mult': 2.070808608549104, 'rsi_os': 8, 'rsi_ob': 84, 'vol_spike': 0.18900027888159132, 'adx_thresh': 7.161684008502922, 'atr_min_pct': 0.01021573709991817, 'atr_max_pct': 0.1107947528125496, 'tp_mult': 1.774967578404821, 'tsl_mult': 0.46370030860881334, 'strategy': 'mean_reversion', 'time_stop': 140, 'use_sma': False, 'use_atr': False, 'use_adx': False, 'use_ema': False, 'use_spike': False, 'rsi_required': False, 'edge_k': 0.8672675338141655, 'edge_cap': 0.4193542668189403, 'bull_strategy': 'breakout', 'bull_bb_std_mult': 1.5010561021480842, 'bull_rsi_os': 44, 'bull_rsi_ob': 73, 'bull_adx_thresh': 27.282028330744375, 'bull_atr_min_pct': 0.010907740645140725, 'bull_atr_max_pct': 0.06095265808191738, 'bull_tp_mult': 1.219596341039002, 'bull_tsl_mult': 0.8817523957026381, 'bull_time_stop': 112, 'bull_use_sma': False, 'bull_use_ema': False, 'bull_use_atr': True, 'bull_use_adx': True, 'bull_use_spike': True, 'bull_rsi_required': True, 'bear_strategy': 'breakout', 'bear_bb_std_mult': 0.5203798138436391, 'bear_rsi_os': 28, 'bear_rsi_ob': 54, 'bear_adx_thresh': 14.992549536203297, 'bear_atr_min_pct': 0.012930975111488, 'bear_atr_max_pct': 0.07615314874731001, 'bear_tp_mult': 1.9635414776626545, 'bear_tsl_mult': 0.2365852051844075, 'bear_time_stop': 188, 'bear_use_sma': False, 'bear_use_ema': False, 'bear_use_atr': False, 'bear_use_adx': False, 'bear_use_spike': True, 'bear_rsi_required': True, 'sideways_strategy': 'mean_reversion', 'sideways_bb_std_mult': 2.7771556131932993, 'sideways_rsi_os': 40, 'sideways_rsi_ob': 60, 'sideways_adx_thresh': 32.720057569298476, 'sideways_atr_min_pct': 0.01717801611365391, 'sideways_atr_max_pct': 0.1213642141580496, 'sideways_tp_mult': 1.1818325161793155, 'sideways_tsl_mult': 0.18962778005115288, 'sideways_time_stop': 87, 'sideways_use_sma': False, 'sideways_use_ema': False, 'sideways_use_atr': True, 'sideways_use_adx': False, 'sideways_use_spike': True, 'sideways_rsi_required': True}.
[I 2025-09-01 07:31:00,289] Trial 60 finished with values: [-1000000000.0, 1000000000.0] and parameters: {'p_sma': 34, 'p_std': 40, 'p_atr': 22, 'p_adx': 19, 'rsi_period': 37, 'ema1': 14, 'ema2': 16, 'slip_atr_k': 0.1954426927572167, 'slip_spread_k': 0.7340348981064155, 'spread_hl_frac': 0.012332672464163592, 'bb_std_mult': 1.4399404075355182, 'rsi_os': 14, 'rsi_ob': 86, 'vol_spike': 0.18257915896046598, 'adx_thresh': 15.904244474707099, 'atr_min_pct': 0.0025060754357767705, 'atr_max_pct': 0.08905376064122925, 'tp_mult': 1.3722731051274475, 'tsl_mult': 0.36951063951275076, 'strategy': 'breakout', 'time_stop': 274, 'use_sma': False, 'use_atr': False, 'use_adx': True, 'use_ema': True, 'use_spike': False, 'rsi_required': False, 'edge_k': 0.13377659005524534, 'edge_cap': 0.24911854396189512, 'bull_strategy': 'breakout', 'bull_bb_std_mult': 1.4141744956067606, 'bull_rsi_os': 28, 'bull_rsi_ob': 89, 'bull_adx_thresh': 31.785906448117693, 'bull_atr_min_pct': 0.022358876495402427, 'bull_atr_max_pct': 0.08250096857359486, 'bull_tp_mult': 2.3315064840435333, 'bull_tsl_mult': 0.07291959688893628, 'bull_time_stop': 185, 'bull_use_sma': False, 'bull_use_ema': True, 'bull_use_atr': False, 'bull_use_adx': False, 'bull_use_spike': True, 'bull_rsi_required': True, 'bear_strategy': 'breakout', 'bear_bb_std_mult': 3.040497634203449, 'bear_rsi_os': 32, 'bear_rsi_ob': 79, 'bear_adx_thresh': 17.433782054833586, 'bear_atr_min_pct': 0.026033066184941975, 'bear_atr_max_pct': 0.017876173751207515, 'bear_tp_mult': 1.4272239931876893, 'bear_tsl_mult': 0.530169149482882, 'bear_time_stop': 193, 'bear_use_sma': True, 'bear_use_ema': True, 'bear_use_atr': False, 'bear_use_adx': False, 'bear_use_spike': False, 'bear_rsi_required': False, 'sideways_strategy': 'mean_reversion', 'sideways_bb_std_mult': 2.5894334510557244, 'sideways_rsi_os': 31, 'sideways_rsi_ob': 53, 'sideways_adx_thresh': 33.167391950755416, 'sideways_atr_min_pct': 0.029635116720899225, 'sideways_atr_max_pct': 0.13847049457357086, 'sideways_tp_mult': 1.0125217633720083, 'sideways_tsl_mult': 0.6113642848711228, 'sideways_time_stop': 85, 'sideways_use_sma': False, 'sideways_use_ema': True, 'sideways_use_atr': True, 'sideways_use_adx': False, 'sideways_use_spike': True, 'sideways_rsi_required': False}.
[I 2025-09-01 07:31:46,706] Trial 68 finished with values: [-1000000000.0, 1000000000.0] and parameters: {'p_sma': 46, 'p_std': 12, 'p_atr': 17, 'p_adx': 11, 'rsi_period': 26, 'ema1': 15, 'ema2': 41, 'slip_atr_k': 0.026745321230497, 'slip_spread_k': 0.5661260806295623, 'spread_hl_frac': 0.015397254998239539, 'bb_std_mult': 0.7385005042420252, 'rsi_os': 17, 'rsi_ob': 95, 'vol_spike': 0.14827829952382257, 'adx_thresh': 25.468565504764772, 'atr_min_pct': 0.007572172234296564, 'atr_max_pct': 0.11826507320868407, 'tp_mult': 1.6495582913744702, 'tsl_mult': 0.3043903805507727, 'strategy': 'mean_reversion', 'time_stop': 133, 'use_sma': False, 'use_atr': True, 'use_adx': False, 'use_ema': False, 'use_spike': True, 'rsi_required': True, 'edge_k': 0.4666640505037916, 'edge_cap': 0.3109392391764414, 'bull_strategy': 'mean_reversion', 'bull_bb_std_mult': 3.1611540531609017, 'bull_rsi_os': 6, 'bull_rsi_ob': 55, 'bull_adx_thresh': 23.253754279535272, 'bull_atr_min_pct': 0.014028584921015904, 'bull_atr_max_pct': 0.0496937680508585, 'bull_tp_mult': 1.893856984570527, 'bull_tsl_mult': 0.007454832458739236, 'bull_time_stop': 82, 'bull_use_sma': False, 'bull_use_ema': False, 'bull_use_atr': True, 'bull_use_adx': True, 'bull_use_spike': False, 'bull_rsi_required': True, 'bear_strategy': 'breakout', 'bear_bb_std_mult': 1.9304619473573612, 'bear_rsi_os': 36, 'bear_rsi_ob': 48, 'bear_adx_thresh': 22.032526916217925, 'bear_atr_min_pct': 0.021662240326502928, 'bear_atr_max_pct': 0.06296780722809386, 'bear_tp_mult': 1.2233195438633955, 'bear_tsl_mult': 0.3858964898342901, 'bear_time_stop': 278, 'bear_use_sma': False, 'bear_use_ema': False, 'bear_use_atr': True, 'bear_use_adx': True, 'bear_use_spike': True, 'bear_rsi_required': True, 'sideways_strategy': 'mean_reversion', 'sideways_bb_std_mult': 2.7725060767960876, 'sideways_rsi_os': 26, 'sideways_rsi_ob': 49, 'sideways_adx_thresh': 26.879373392430498, 'sideways_atr_min_pct': 0.015700995374452215, 'sideways_atr_max_pct': 0.08626443258206833, 'sideways_tp_mult': 1.2046817490443742, 'sideways_tsl_mult': 0.7732341194440406, 'sideways_time_stop': 74, 'sideways_use_sma': True, 'sideways_use_ema': False, 'sideways_use_atr': False, 'sideways_use_adx': False, 'sideways_use_spike': True, 'sideways_rsi_required': True}.
[I 2025-09-01 07:31:47,575] Trial 67 finished with values: [-1000000000.0, 1000000000.0] and parameters: {'p_sma': 25, 'p_std': 59, 'p_atr': 22, 'p_adx': 13, 'rsi_period': 37, 'ema1': 15, 'ema2': 42, 'slip_atr_k': 0.026444946783044557, 'slip_spread_k': 0.5687332189863236, 'spread_hl_frac': 0.01024223378642428, 'bb_std_mult': 1.081701604607631, 'rsi_os': 7, 'rsi_ob': 64, 'vol_spike': 0.24352542561919235, 'adx_thresh': 25.33148509307621, 'atr_min_pct': 0.007464264027446473, 'atr_max_pct': 0.11625307466675643, 'tp_mult': 1.6486225156476584, 'tsl_mult': 0.05502718643594379, 'strategy': 'mean_reversion', 'time_stop': 213, 'use_sma': False, 'use_atr': True, 'use_adx': False, 'use_ema': False, 'use_spike': True, 'rsi_required': True, 'edge_k': 0.16953491790392017, 'edge_cap': 0.3056459949996029, 'bull_strategy': 'mean_reversion', 'bull_bb_std_mult': 2.338171903678938, 'bull_rsi_os': 8, 'bull_rsi_ob': 55, 'bull_adx_thresh': 19.542520809017866, 'bull_atr_min_pct': 0.014040000786257492, 'bull_atr_max_pct': 0.04844242060378376, 'bull_tp_mult': 1.8862984444650308, 'bull_tsl_mult': 0.42712797797738233, 'bull_time_stop': 77, 'bull_use_sma': False, 'bull_use_ema': False, 'bull_use_atr': True, 'bull_use_adx': True, 'bull_use_spike': True, 'bull_rsi_required': True, 'bear_strategy': 'breakout', 'bear_bb_std_mult': 3.5755712918082, 'bear_rsi_os': 45, 'bear_rsi_ob': 48, 'bear_adx_thresh': 6.074641507234147, 'bear_atr_min_pct': 0.02204987897886531, 'bear_atr_max_pct': 0.06302078261218162, 'bear_tp_mult': 1.0175994001896511, 'bear_tsl_mult': 0.47057757425219277, 'bear_time_stop': 6, 'bear_use_sma': False, 'bear_use_ema': False, 'bear_use_atr': True, 'bear_use_adx': True, 'bear_use_spike': True, 'bear_rsi_required': True, 'sideways_strategy': 'mean_reversion', 'sideways_bb_std_mult': 2.432874922992736, 'sideways_rsi_os': 24, 'sideways_rsi_ob': 47, 'sideways_adx_thresh': 26.53026076790112, 'sideways_atr_min_pct': 0.015616379625276082, 'sideways_atr_max_pct': 0.0240010650266982, 'sideways_tp_mult': 1.1976030923599477, 'sideways_tsl_mult': 0.5131493746972801, 'sideways_time_stop': 75, 'sideways_use_sma': True, 'sideways_use_ema': False, 'sideways_use_atr': False, 'sideways_use_adx': False, 'sideways_use_spike': True, 'sideways_rsi_required': True}.
[I 2025-09-01 07:31:48,053] Trial 66 finished with values: [-1000000000.0, 1000000000.0] and parameters: {'p_sma': 24, 'p_std': 33, 'p_atr': 30, 'p_adx': 21, 'rsi_period': 37, 'ema1': 10, 'ema2': 30, 'slip_atr_k': 0.1163135062512682, 'slip_spread_k': 0.6602600482318062, 'spread_hl_frac': 0.016026311268015927, 'bb_std_mult': 0.7506301646984418, 'rsi_os': 7, 'rsi_ob': 54, 'vol_spike': 0.24134238631959204, 'adx_thresh': 25.72814785012668, 'atr_min_pct': 0.010408105218224066, 'atr_max_pct': 0.1165618904230231, 'tp_mult': 1.673213434566333, 'tsl_mult': 0.06807404506003464, 'strategy': 'mean_reversion', 'time_stop': 143, 'use_sma': False, 'use_atr': True, 'use_adx': False, 'use_ema': False, 'use_spike': True, 'rsi_required': True, 'edge_k': 0.10512639187483785, 'edge_cap': 0.3875349468847164, 'bull_strategy': 'mean_reversion', 'bull_bb_std_mult': 2.2988286640815834, 'bull_rsi_os': 7, 'bull_rsi_ob': 73, 'bull_adx_thresh': 28.857755603688545, 'bull_atr_min_pct': 0.021628265088428075, 'bull_atr_max_pct': 0.04911357629563565, 'bull_tp_mult': 1.9241908112629227, 'bull_tsl_mult': 0.8778736177209451, 'bull_time_stop': 74, 'bull_use_sma': False, 'bull_use_ema': False, 'bull_use_atr': True, 'bull_use_adx': True, 'bull_use_spike': True, 'bull_rsi_required': True, 'bear_strategy': 'breakout', 'bear_bb_std_mult': 3.5919769622634594, 'bear_rsi_os': 44, 'bear_rsi_ob': 47, 'bear_adx_thresh': 6.770077558869529, 'bear_atr_min_pct': 0.011636761569391757, 'bear_atr_max_pct': 0.13520194283646705, 'bear_tp_mult': 1.015052617338647, 'bear_tsl_mult': 0.46518491925752803, 'bear_time_stop': 295, 'bear_use_sma': False, 'bear_use_ema': False, 'bear_use_atr': True, 'bear_use_adx': True, 'bear_use_spike': True, 'bear_rsi_required': True, 'sideways_strategy': 'mean_reversion', 'sideways_bb_std_mult': 2.775920438747123, 'sideways_rsi_os': 26, 'sideways_rsi_ob': 47, 'sideways_adx_thresh': 15.91110118433162, 'sideways_atr_min_pct': 0.0159607246174119, 'sideways_atr_max_pct': 0.03401031626920317, 'sideways_tp_mult': 1.2175440480669848, 'sideways_tsl_mult': 0.5210416538522364, 'sideways_time_stop': 80, 'sideways_use_sma': True, 'sideways_use_ema': False, 'sideways_use_atr': False, 'sideways_use_adx': False, 'sideways_use_spike': True, 'sideways_rsi_required': True}.
[I 2025-09-01 07:31:48,613] Trial 65 finished with values: [-1000000000.0, 1000000000.0] and parameters: {'p_sma': 38, 'p_std': 37, 'p_atr': 30, 'p_adx': 20, 'rsi_period': 16, 'ema1': 15, 'ema2': 20, 'slip_atr_k': 0.12108048281839046, 'slip_spread_k': 0.5177079927773707, 'spread_hl_frac': 0.016451754362049625, 'bb_std_mult': 0.72112003606209, 'rsi_os': 8, 'rsi_ob': 85, 'vol_spike': 0.23912188090983502, 'adx_thresh': 25.839853430938568, 'atr_min_pct': 0.028762942281116893, 'atr_max_pct': 0.11671348681612957, 'tp_mult': 1.7841270457109002, 'tsl_mult': 0.3398885035400961, 'strategy': 'mean_reversion', 'time_stop': 141, 'use_sma': False, 'use_atr': False, 'use_adx': False, 'use_ema': False, 'use_spike': False, 'rsi_required': True, 'edge_k': 0.1828141167599524, 'edge_cap': 0.40312198930977483, 'bull_strategy': 'breakout', 'bull_bb_std_mult': 2.6440016019608255, 'bull_rsi_os': 7, 'bull_rsi_ob': 80, 'bull_adx_thresh': 7.781587649025131, 'bull_atr_min_pct': 0.014287549594850638, 'bull_atr_max_pct': 0.060656842628011284, 'bull_tp_mult': 2.8986117442958848, 'bull_tsl_mult': 0.9403690875210349, 'bull_time_stop': 79, 'bull_use_sma': False, 'bull_use_ema': False, 'bull_use_atr': True, 'bull_use_adx': True, 'bull_use_spike': True, 'bull_rsi_required': True, 'bear_strategy': 'breakout', 'bear_bb_std_mult': 2.4327236822927727, 'bear_rsi_os': 34, 'bear_rsi_ob': 91, 'bear_adx_thresh': 6.625093536847159, 'bear_atr_min_pct': 0.025799130422632557, 'bear_atr_max_pct': 0.07662399273323645, 'bear_tp_mult': 2.1838308952050305, 'bear_tsl_mult': 0.7068653299476968, 'bear_time_stop': 110, 'bear_use_sma': False, 'bear_use_ema': False, 'bear_use_atr': False, 'bear_use_adx': False, 'bear_use_spike': True, 'bear_rsi_required': True, 'sideways_strategy': 'mean_reversion', 'sideways_bb_std_mult': 1.6644955812882078, 'sideways_rsi_os': 24, 'sideways_rsi_ob': 50, 'sideways_adx_thresh': 30.38591490367948, 'sideways_atr_min_pct': 0.0169077063146668, 'sideways_atr_max_pct': 0.034175644790066816, 'sideways_tp_mult': 1.3637164384399392, 'sideways_tsl_mult': 0.5227521171498763, 'sideways_time_stop': 202, 'sideways_use_sma': True, 'sideways_use_ema': False, 'sideways_use_atr': True, 'sideways_use_adx': False, 'sideways_use_spike': True, 'sideways_rsi_required': True}.
[I 2025-09-01 07:32:33,758] Trial 71 finished with values: [-1000000000.0, 1000000000.0] and parameters: {'p_sma': 39, 'p_std': 27, 'p_atr': 16, 'p_adx': 15, 'rsi_period': 41, 'ema1': 20, 'ema2': 58, 'slip_atr_k': 0.22667630598432437, 'slip_spread_k': 0.6004864387240385, 'spread_hl_frac': 0.017646486379654876, 'bb_std_mult': 1.5848764720454933, 'rsi_os': 10, 'rsi_ob': 81, 'vol_spike': 0.2009235003921698, 'adx_thresh': 21.90921612533722, 'atr_min_pct': 0.026826545231814138, 'atr_max_pct': 0.09995004260650821, 'tp_mult': 1.4893335055062373, 'tsl_mult': 0.829767392641624, 'strategy': 'breakout', 'time_stop': 154, 'use_sma': True, 'use_atr': False, 'use_adx': False, 'use_ema': False, 'use_spike': False, 'rsi_required': False, 'edge_k': 1.4701406969828197, 'edge_cap': 0.6917355144394303, 'bull_strategy': 'breakout', 'bull_bb_std_mult': 1.7115116570704236, 'bull_rsi_os': 48, 'bull_rsi_ob': 85, 'bull_adx_thresh': 34.68236085235695, 'bull_atr_min_pct': 0.016135387454887056, 'bull_atr_max_pct': 0.10590848920406608, 'bull_tp_mult': 1.7116379663130918, 'bull_tsl_mult': 0.331038041982914, 'bull_time_stop': 170, 'bull_use_sma': True, 'bull_use_ema': True, 'bull_use_atr': False, 'bull_use_adx': False, 'bull_use_spike': False, 'bull_rsi_required': False, 'bear_strategy': 'mean_reversion', 'bear_bb_std_mult': 2.4794537766182057, 'bear_rsi_os': 34, 'bear_rsi_ob': 52, 'bear_adx_thresh': 34.899359865344636, 'bear_atr_min_pct': 0.016681638153474287, 'bear_atr_max_pct': 0.0389851250711185, 'bear_tp_mult': 1.7120641714447287, 'bear_tsl_mult': 0.7105123475914168, 'bear_time_stop': 87, 'bear_use_sma': True, 'bear_use_ema': False, 'bear_use_atr': False, 'bear_use_adx': False, 'bear_use_spike': False, 'bear_rsi_required': False, 'sideways_strategy': 'breakout', 'sideways_bb_std_mult': 3.022698069485278, 'sideways_rsi_os': 19, 'sideways_rsi_ob': 61, 'sideways_adx_thresh': 28.901642056955936, 'sideways_atr_min_pct': 0.019729777765982687, 'sideways_atr_max_pct': 0.02466773743191386, 'sideways_tp_mult': 1.0957963217630586, 'sideways_tsl_mult': 0.5625655045729728, 'sideways_time_stop': 49, 'sideways_use_sma': False, 'sideways_use_ema': False, 'sideways_use_atr': True, 'sideways_use_adx': True, 'sideways_use_spike': False, 'sideways_rsi_required': True}.
[I 2025-09-01 07:32:34,039] Trial 70 finished with values: [-1000000000.0, 1000000000.0] and parameters: {'p_sma': 30, 'p_std': 33, 'p_atr': 30, 'p_adx': 16, 'rsi_period': 41, 'ema1': 19, 'ema2': 30, 'slip_atr_k': 0.14528884125922684, 'slip_spread_k': 0.21697547084391455, 'spread_hl_frac': 0.01761182004057176, 'bb_std_mult': 3.0753030108739567, 'rsi_os': 12, 'rsi_ob': 80, 'vol_spike': 0.29528582901514305, 'adx_thresh': 20.68298514595959, 'atr_min_pct': 0.026565940572935612, 'atr_max_pct': 0.10077183251788711, 'tp_mult': 1.4935953438853449, 'tsl_mult': 0.23200359821702365, 'strategy': 'breakout', 'time_stop': 150, 'use_sma': True, 'use_atr': False, 'use_adx': False, 'use_ema': False, 'use_spike': False, 'rsi_required': True, 'edge_k': 1.4966180586910955, 'edge_cap': 0.5379485179682449, 'bull_strategy': 'breakout', 'bull_bb_std_mult': 0.6397640440928671, 'bull_rsi_os': 47, 'bull_rsi_ob': 58, 'bull_adx_thresh': 11.894642438083231, 'bull_atr_min_pct': 0.0118263996674853, 'bull_atr_max_pct': 0.10966954272486959, 'bull_tp_mult': 1.745562428334476, 'bull_tsl_mult': 0.12948134275653891, 'bull_time_stop': 136, 'bull_use_sma': False, 'bull_use_ema': True, 'bull_use_atr': False, 'bull_use_adx': False, 'bull_use_spike': False, 'bull_rsi_required': True, 'bear_strategy': 'breakout', 'bear_bb_std_mult': 2.4420060453822203, 'bear_rsi_os': 40, 'bear_rsi_ob': 83, 'bear_adx_thresh': 13.299374344676062, 'bear_atr_min_pct': 0.010713236930450409, 'bear_atr_max_pct': 0.04891192400745286, 'bear_tp_mult': 1.7106657888488122, 'bear_tsl_mult': 0.7058192385467158, 'bear_time_stop': 221, 'bear_use_sma': False, 'bear_use_ema': False, 'bear_use_atr': False, 'bear_use_adx': False, 'bear_use_spike': False, 'bear_rsi_required': False, 'sideways_strategy': 'breakout', 'sideways_bb_std_mult': 3.017073176942387, 'sideways_rsi_os': 20, 'sideways_rsi_ob': 90, 'sideways_adx_thresh': 15.580000987391497, 'sideways_atr_min_pct': 0.009852632574326245, 'sideways_atr_max_pct': 0.049921478170237454, 'sideways_tp_mult': 1.090339677567836, 'sideways_tsl_mult': 0.5669063223389206, 'sideways_time_stop': 50, 'sideways_use_sma': True, 'sideways_use_ema': False, 'sideways_use_atr': False, 'sideways_use_adx': True, 'sideways_use_spike': False, 'sideways_rsi_required': True}.
[I 2025-09-01 07:32:34,311] Trial 72 finished with values: [-1000000000.0, 1000000000.0] and parameters: {'p_sma': 30, 'p_std': 27, 'p_atr': 16, 'p_adx': 15, 'rsi_period': 41, 'ema1': 18, 'ema2': 58, 'slip_atr_k': 0.22602383765461814, 'slip_spread_k': 0.21663242476644157, 'spread_hl_frac': 0.018200187071688217, 'bb_std_mult': 3.058373979954894, 'rsi_os': 37, 'rsi_ob': 81, 'vol_spike': 0.042364933362994794, 'adx_thresh': 20.13652338702124, 'atr_min_pct': 0.029855560358518843, 'atr_max_pct': 0.10023351342753178, 'tp_mult': 1.4604207618920788, 'tsl_mult': 0.7140324661032504, 'strategy': 'breakout', 'time_stop': 154, 'use_sma': True, 'use_atr': False, 'use_adx': True, 'use_ema': False, 'use_spike': False, 'rsi_required': False, 'edge_k': 0.5968924512613399, 'edge_cap': 0.5376077786612096, 'bull_strategy': 'breakout', 'bull_bb_std_mult': 1.0612853902914547, 'bull_rsi_os': 47, 'bull_rsi_ob': 52, 'bull_adx_thresh': 17.345828596625207, 'bull_atr_min_pct': 0.011996105319473064, 'bull_atr_max_pct': 0.11780819530226808, 'bull_tp_mult': 2.158136793396336, 'bull_tsl_mult': 0.13432400909012251, 'bull_time_stop': 134, 'bull_use_sma': True, 'bull_use_ema': True, 'bull_use_atr': False, 'bull_use_adx': False, 'bull_use_spike': False, 'bull_rsi_required': False, 'bear_strategy': 'mean_reversion', 'bear_bb_std_mult': 1.743435599951566, 'bear_rsi_os': 40, 'bear_rsi_ob': 84, 'bear_adx_thresh': 12.642401578687096, 'bear_atr_min_pct': 0.029796335895047907, 'bear_atr_max_pct': 0.09421372044249718, 'bear_tp_mult': 1.7691728078365223, 'bear_tsl_mult': 0.17492386870098992, 'bear_time_stop': 226, 'bear_use_sma': True, 'bear_use_ema': False, 'bear_use_atr': False, 'bear_use_adx': False, 'bear_use_spike': False, 'bear_rsi_required': False, 'sideways_strategy': 'breakout', 'sideways_bb_std_mult': 3.004551566186078, 'sideways_rsi_os': 20, 'sideways_rsi_ob': 58, 'sideways_adx_thresh': 29.110360301521876, 'sideways_atr_min_pct': 0.009736109032561467, 'sideways_atr_max_pct': 0.04885366934632652, 'sideways_tp_mult': 1.568137351957156, 'sideways_tsl_mult': 0.4819924031569096, 'sideways_time_stop': 30, 'sideways_use_sma': False, 'sideways_use_ema': False, 'sideways_use_atr': True, 'sideways_use_adx': True, 'sideways_use_spike': False, 'sideways_rsi_required': False}.
