[I 2025-09-01 09:00:55,609] Trial 577 finished with values: [-1000000000.0, 1000000000.0] and parameters: {'p_sma': 47, 'p_std': 23, 'p_atr': 20, 'p_adx': 17, 'rsi_period': 9, 'ema1': 7, 'ema2': 30, 'slip_atr_k': 0.019027203201542102, 'slip_spread_k': 0.028851533537897323, 'spread_hl_frac': 0.018895000161738403, 'bb_std_mult': 1.6422763509610099, 'rsi_os': 49, 'rsi_ob': 94, 'vol_spike': 0.024564217158747032, 'adx_thresh': 24.373672686999008, 'atr_min_pct': 0.010786740046102493, 'atr_max_pct': 0.09044185399792483, 'tp_mult': 1.309727321613725, 'tsl_mult': 0.8189505370202568, 'strategy': 'mean_reversion', 'time_stop': 82, 'use_sma': True, 'use_atr': True, 'use_adx': False, 'use_ema': False, 'use_spike': False, 'rsi_required': False, 'edge_k': 0.9846100261724084, 'edge_cap': 0.7190414877752249, 'bull_strategy': 'mean_reversion', 'bull_bb_std_mult': 2.3925582389858238, 'bull_rsi_os': 20, 'bull_rsi_ob': 53, 'bull_adx_thresh': 15.680517886239862, 'bull_atr_min_pct': 0.019861454758104642, 'bull_atr_max_pct': 0.08143073715163499, 'bull_tp_mult': 1.2337396487959416, 'bull_tsl_mult': 0.6985341323982421, 'bull_time_stop': 230, 'bull_use_sma': False, 'bull_use_ema': True, 'bull_use_atr': True, 'bull_use_adx': True, 'bull_use_spike': True, 'bull_rsi_required': True, 'bear_strategy': 'breakout', 'bear_bb_std_mult': 3.3787218602369458, 'bear_rsi_os': 42, 'bear_rsi_ob': 87, 'bear_adx_thresh': 11.123695693692328, 'bear_atr_min_pct': 0.02794323084803457, 'bear_atr_max_pct': 0.04096306911980985, 'bear_tp_mult': 2.774014950651324, 'bear_tsl_mult': 0.41017435668335156, 'bear_time_stop': 49, 'bear_use_sma': False, 'bear_use_ema': True, 'bear_use_atr': True, 'bear_use_adx': True, 'bear_use_spike': True, 'bear_rsi_required': True, 'sideways_strategy': 'breakout', 'sideways_bb_std_mult': 2.602749129356971, 'sideways_rsi_os': 30, 'sideways_rsi_ob': 63, 'sideways_adx_thresh': 25.454498505346002, 'sideways_atr_min_pct': 0.007574099489292924, 'sideways_atr_max_pct': 0.0715725045269408, 'sideways_tp_mult': 2.409357831681527, 'sideways_tsl_mult': 0.8065947307510406, 'sideways_time_stop': 293, 'sideways_use_sma': False, 'sideways_use_ema': False, 'sideways_use_atr': False, 'sideways_use_adx': False, 'sideways_use_spike': True, 'sideways_rsi_required': True}.
[I 2025-09-01 09:00:56,364] Trial 579 finished with values: [-1000000000.0, 1000000000.0] and parameters: {'p_sma': 18, 'p_std': 22, 'p_atr': 19, 'p_adx': 26, 'rsi_period': 9, 'ema1': 7, 'ema2': 60, 'slip_atr_k': 0.18570152921700542, 'slip_spread_k': 0.1382473531883417, 'spread_hl_frac': 0.048832124180247315, 'bb_std_mult': 1.299829006590702, 'rsi_os': 49, 'rsi_ob': 57, 'vol_spike': 0.11861208782131846, 'adx_thresh': 14.914044931685332, 'atr_min_pct': 0.007627775094127956, 'atr_max_pct': 0.09027596865685208, 'tp_mult': 1.1917144880716202, 'tsl_mult': 0.14791366806245532, 'strategy': 'mean_reversion', 'time_stop': 176, 'use_sma': True, 'use_atr': False, 'use_adx': False, 'use_ema': False, 'use_spike': False, 'rsi_required': False, 'edge_k': 1.1494632803085025, 'edge_cap': 0.5030448219179057, 'bull_strategy': 'breakout', 'bull_bb_std_mult': 2.3650330753232676, 'bull_rsi_os': 40, 'bull_rsi_ob': 56, 'bull_adx_thresh': 32.462716371460424, 'bull_atr_min_pct': 0.020000079951499588, 'bull_atr_max_pct': 0.07507621576595506, 'bull_tp_mult': 1.2469354996254858, 'bull_tsl_mult': 0.453621819546215, 'bull_time_stop': 167, 'bull_use_sma': True, 'bull_use_ema': True, 'bull_use_atr': True, 'bull_use_adx': True, 'bull_use_spike': True, 'bull_rsi_required': False, 'bear_strategy': 'mean_reversion', 'bear_bb_std_mult': 3.378735559272369, 'bear_rsi_os': 44, 'bear_rsi_ob': 85, 'bear_adx_thresh': 11.333454657058104, 'bear_atr_min_pct': 0.006918376558252116, 'bear_atr_max_pct': 0.035235734635844757, 'bear_tp_mult': 2.603912202006256, 'bear_tsl_mult': 0.1610845165951138, 'bear_time_stop': 216, 'bear_use_sma': False, 'bear_use_ema': False, 'bear_use_atr': True, 'bear_use_adx': True, 'bear_use_spike': True, 'bear_rsi_required': True, 'sideways_strategy': 'breakout', 'sideways_bb_std_mult': 1.3422911322695568, 'sideways_rsi_os': 23, 'sideways_rsi_ob': 61, 'sideways_adx_thresh': 10.725527230028217, 'sideways_atr_min_pct': 0.008296349946152541, 'sideways_atr_max_pct': 0.03568898658272662, 'sideways_tp_mult': 2.539942985129754, 'sideways_tsl_mult': 0.5242939102900377, 'sideways_time_stop': 293, 'sideways_use_sma': False, 'sideways_use_ema': False, 'sideways_use_atr': False, 'sideways_use_adx': False, 'sideways_use_spike': True, 'sideways_rsi_required': True}.
[I 2025-09-01 09:00:56,397] Trial 576 finished with values: [-0.018344317292482315, 0.018854330750814455] and parameters: {'p_sma': 47, 'p_std': 36, 'p_atr': 9, 'p_adx': 17, 'rsi_period': 43, 'ema1': 8, 'ema2': 60, 'slip_atr_k': 0.021407441020035257, 'slip_spread_k': 0.15170408777964084, 'spread_hl_frac': 0.02091399534020183, 'bb_std_mult': 1.262033002522697, 'rsi_os': 49, 'rsi_ob': 94, 'vol_spike': 0.025320768581456383, 'adx_thresh': 24.209844790677767, 'atr_min_pct': 0.01207138787974418, 'atr_max_pct': 0.0903010522201145, 'tp_mult': 2.4607595503995894, 'tsl_mult': 0.8185847697094688, 'strategy': 'mean_reversion', 'time_stop': 56, 'use_sma': True, 'use_atr': False, 'use_adx': False, 'use_ema': False, 'use_spike': False, 'rsi_required': False, 'edge_k': 0.9866983853226361, 'edge_cap': 0.2852683338522174, 'bull_strategy': 'breakout', 'bull_bb_std_mult': 0.6366811451094678, 'bull_rsi_os': 41, 'bull_rsi_ob': 57, 'bull_adx_thresh': 26.253262036848696, 'bull_atr_min_pct': 0.020016810337461406, 'bull_atr_max_pct': 0.08112202311845691, 'bull_tp_mult': 2.722209731250103, 'bull_tsl_mult': 0.36268039977161126, 'bull_time_stop': 229, 'bull_use_sma': True, 'bull_use_ema': True, 'bull_use_atr': True, 'bull_use_adx': True, 'bull_use_spike': True, 'bull_rsi_required': False, 'bear_strategy': 'mean_reversion', 'bear_bb_std_mult': 2.7333873421609916, 'bear_rsi_os': 42, 'bear_rsi_ob': 90, 'bear_adx_thresh': 27.438530301898236, 'bear_atr_min_pct': 0.004046139860994219, 'bear_atr_max_pct': 0.04173935733526454, 'bear_tp_mult': 2.6911039432742014, 'bear_tsl_mult': 0.16283494386825753, 'bear_time_stop': 44, 'bear_use_sma': False, 'bear_use_ema': False, 'bear_use_atr': True, 'bear_use_adx': True, 'bear_use_spike': True, 'bear_rsi_required': True, 'sideways_strategy': 'breakout', 'sideways_bb_std_mult': 3.251962957685202, 'sideways_rsi_os': 31, 'sideways_rsi_ob': 54, 'sideways_adx_thresh': 25.53789123084196, 'sideways_atr_min_pct': 0.007643358318070084, 'sideways_atr_max_pct': 0.04639731547497444, 'sideways_tp_mult': 2.4919885138358113, 'sideways_tsl_mult': 0.654866667998569, 'sideways_time_stop': 285, 'sideways_use_sma': False, 'sideways_use_ema': False, 'sideways_use_atr': False, 'sideways_use_adx': False, 'sideways_use_spike': True, 'sideways_rsi_required': True}.
[I 2025-09-01 09:00:56,677] Trial 575 finished with values: [-0.018899432204633748, 0.019120651891787476] and parameters: {'p_sma': 55, 'p_std': 23, 'p_atr': 9, 'p_adx': 17, 'rsi_period': 39, 'ema1': 8, 'ema2': 53, 'slip_atr_k': 0.020292577747084577, 'slip_spread_k': 0.14309162969780415, 'spread_hl_frac': 0.04873196407813761, 'bb_std_mult': 2.450551880322507, 'rsi_os': 45, 'rsi_ob': 56, 'vol_spike': 0.0007810710740522291, 'adx_thresh': 20.698632665830218, 'atr_min_pct': 0.028753012468708032, 'atr_max_pct': 0.09069071339696702, 'tp_mult': 1.317922005765105, 'tsl_mult': 0.6639973407023051, 'strategy': 'mean_reversion', 'time_stop': 176, 'use_sma': True, 'use_atr': False, 'use_adx': False, 'use_ema': False, 'use_spike': False, 'rsi_required': False, 'edge_k': 0.9892312140805735, 'edge_cap': 0.28383800634380546, 'bull_strategy': 'breakout', 'bull_bb_std_mult': 2.149150433444031, 'bull_rsi_os': 41, 'bull_rsi_ob': 57, 'bull_adx_thresh': 11.520629439222992, 'bull_atr_min_pct': 0.019897744819360963, 'bull_atr_max_pct': 0.08112856938046431, 'bull_tp_mult': 1.2402460929666064, 'bull_tsl_mult': 0.7167126398109003, 'bull_time_stop': 27, 'bull_use_sma': True, 'bull_use_ema': True, 'bull_use_atr': True, 'bull_use_adx': True, 'bull_use_spike': True, 'bull_rsi_required': False, 'bear_strategy': 'mean_reversion', 'bear_bb_std_mult': 2.7421688357004244, 'bear_rsi_os': 38, 'bear_rsi_ob': 90, 'bear_adx_thresh': 30.780161362555603, 'bear_atr_min_pct': 0.003996008082502282, 'bear_atr_max_pct': 0.04167047261906951, 'bear_tp_mult': 2.6947964127735897, 'bear_tsl_mult': 0.16483077973466886, 'bear_time_stop': 48, 'bear_use_sma': False, 'bear_use_ema': False, 'bear_use_atr': True, 'bear_use_adx': True, 'bear_use_spike': True, 'bear_rsi_required': True, 'sideways_strategy': 'breakout', 'sideways_bb_std_mult': 1.3279621695993475, 'sideways_rsi_os': 10, 'sideways_rsi_ob': 63, 'sideways_adx_thresh': 11.684207189159387, 'sideways_atr_min_pct': 0.00756949862666798, 'sideways_atr_max_pct': 0.03648942067953845, 'sideways_tp_mult': 2.495348107101805, 'sideways_tsl_mult': 0.5415123255640906, 'sideways_time_stop': 160, 'sideways_use_sma': False, 'sideways_use_ema': False, 'sideways_use_atr': False, 'sideways_use_adx': False, 'sideways_use_spike': True, 'sideways_rsi_required': True}.
[I 2025-09-01 09:00:57,990] Trial 583 finished with values: [-1000000000.0, 1000000000.0] and parameters: {'p_sma': 8, 'p_std': 39, 'p_atr': 21, 'p_adx': 16, 'rsi_period': 79, 'ema1': 7, 'ema2': 58, 'slip_atr_k': 0.01200087256740248, 'slip_spread_k': 0.10458042889272783, 'spread_hl_frac': 0.016609310005614875, 'bb_std_mult': 2.5515059289259447, 'rsi_os': 46, 'rsi_ob': 51, 'vol_spike': 0.011892440877650859, 'adx_thresh': 33.6879735200417, 'atr_min_pct': 0.019164189019727475, 'atr_max_pct': 0.012372737965931482, 'tp_mult': 2.780309915502133, 'tsl_mult': 0.13471060987566225, 'strategy': 'mean_reversion', 'time_stop': 37, 'use_sma': False, 'use_atr': False, 'use_adx': False, 'use_ema': False, 'use_spike': False, 'rsi_required': False, 'edge_k': 0.8940294879040525, 'edge_cap': 0.3143149455852675, 'bull_strategy': 'breakout', 'bull_bb_std_mult': 2.472415864443753, 'bull_rsi_os': 39, 'bull_rsi_ob': 74, 'bull_adx_thresh': 10.58149444437503, 'bull_atr_min_pct': 0.02159527113869842, 'bull_atr_max_pct': 0.1038182642640933, 'bull_tp_mult': 2.812945907436395, 'bull_tsl_mult': 0.8551064799042071, 'bull_time_stop': 186, 'bull_use_sma': True, 'bull_use_ema': True, 'bull_use_atr': True, 'bull_use_adx': True, 'bull_use_spike': True, 'bull_rsi_required': False, 'bear_strategy': 'mean_reversion', 'bear_bb_std_mult': 3.301985722377208, 'bear_rsi_os': 25, 'bear_rsi_ob': 88, 'bear_adx_thresh': 19.35011245424605, 'bear_atr_min_pct': 0.006173095627114107, 'bear_atr_max_pct': 0.03664518904281352, 'bear_tp_mult': 1.1647311371084481, 'bear_tsl_mult': 0.8789300252272845, 'bear_time_stop': 203, 'bear_use_sma': False, 'bear_use_ema': False, 'bear_use_atr': True, 'bear_use_adx': True, 'bear_use_spike': True, 'bear_rsi_required': True, 'sideways_strategy': 'breakout', 'sideways_bb_std_mult': 1.569905035820383, 'sideways_rsi_os': 13, 'sideways_rsi_ob': 60, 'sideways_adx_thresh': 12.969303956709343, 'sideways_atr_min_pct': 0.013922806298119204, 'sideways_atr_max_pct': 0.06346917321125198, 'sideways_tp_mult': 2.900181272794545, 'sideways_tsl_mult': 0.39811460825771366, 'sideways_time_stop': 11, 'sideways_use_sma': False, 'sideways_use_ema': False, 'sideways_use_atr': True, 'sideways_use_adx': False, 'sideways_use_spike': True, 'sideways_rsi_required': True}.
[I 2025-09-01 09:00:58,033] Trial 582 finished with values: [-1000000000.0, 1000000000.0] and parameters: {'p_sma': 45, 'p_std': 38, 'p_atr': 11, 'p_adx': 16, 'rsi_period': 45, 'ema1': 8, 'ema2': 40, 'slip_atr_k': 0.011156106303972492, 'slip_spread_k': 0.4556073928911981, 'spread_hl_frac': 0.029006546135872717, 'bb_std_mult': 2.5107970162825577, 'rsi_os': 45, 'rsi_ob': 69, 'vol_spike': 0.28274567449417565, 'adx_thresh': 34.99835651967876, 'atr_min_pct': 0.02332691937862346, 'atr_max_pct': 0.010194412875896508, 'tp_mult': 1.348303693041617, 'tsl_mult': 0.1402415851587805, 'strategy': 'mean_reversion', 'time_stop': 38, 'use_sma': False, 'use_atr': False, 'use_adx': False, 'use_ema': False, 'use_spike': False, 'rsi_required': False, 'edge_k': 0.8921046987300547, 'edge_cap': 0.30832325815671674, 'bull_strategy': 'breakout', 'bull_bb_std_mult': 2.1537124643403645, 'bull_rsi_os': 42, 'bull_rsi_ob': 55, 'bull_adx_thresh': 10.494525723295176, 'bull_atr_min_pct': 0.02087533310465453, 'bull_atr_max_pct': 0.07499192304167152, 'bull_tp_mult': 1.0662191504496161, 'bull_tsl_mult': 0.3213077633453766, 'bull_time_stop': 186, 'bull_use_sma': True, 'bull_use_ema': True, 'bull_use_atr': True, 'bull_use_adx': True, 'bull_use_spike': True, 'bull_rsi_required': False, 'bear_strategy': 'mean_reversion', 'bear_bb_std_mult': 2.8350839478862335, 'bear_rsi_os': 7, 'bear_rsi_ob': 95, 'bear_adx_thresh': 19.14406634398744, 'bear_atr_min_pct': 0.005995940736459832, 'bear_atr_max_pct': 0.12761488037891722, 'bear_tp_mult': 1.1317924194601394, 'bear_tsl_mult': 0.2182229953926524, 'bear_time_stop': 207, 'bear_use_sma': False, 'bear_use_ema': False, 'bear_use_atr': True, 'bear_use_adx': True, 'bear_use_spike': True, 'bear_rsi_required': True, 'sideways_strategy': 'breakout', 'sideways_bb_std_mult': 2.111557842336145, 'sideways_rsi_os': 11, 'sideways_rsi_ob': 82, 'sideways_adx_thresh': 29.152681070911385, 'sideways_atr_min_pct': 0.009499728992844403, 'sideways_atr_max_pct': 0.05928165654633019, 'sideways_tp_mult': 2.3336092809983016, 'sideways_tsl_mult': 0.48978936707371395, 'sideways_time_stop': 163, 'sideways_use_sma': False, 'sideways_use_ema': False, 'sideways_use_atr': True, 'sideways_use_adx': False, 'sideways_use_spike': True, 'sideways_rsi_required': True}.
[I 2025-09-01 09:01:38,440] Trial 581 finished with values: [-1000000000.0, 1000000000.0] and parameters: {'p_sma': 55, 'p_std': 38, 'p_atr': 21, 'p_adx': 16, 'rsi_period': 45, 'ema1': 8, 'ema2': 58, 'slip_atr_k': 0.011144976601025567, 'slip_spread_k': 0.1162536527621176, 'spread_hl_frac': 0.028603839884563265, 'bb_std_mult': 2.5506954239068556, 'rsi_os': 45, 'rsi_ob': 69, 'vol_spike': 0.011412824584390807, 'adx_thresh': 33.464707716549, 'atr_min_pct': 0.012752709743730349, 'atr_max_pct': 0.09551526657389867, 'tp_mult': 2.376313236142133, 'tsl_mult': 0.7166278331947941, 'strategy': 'mean_reversion', 'time_stop': 277, 'use_sma': False, 'use_atr': False, 'use_adx': False, 'use_ema': False, 'use_spike': False, 'rsi_required': False, 'edge_k': 1.225302955330402, 'edge_cap': 0.31449091682167546, 'bull_strategy': 'breakout', 'bull_bb_std_mult': 2.5568533580472446, 'bull_rsi_os': 42, 'bull_rsi_ob': 55, 'bull_adx_thresh': 12.155945640013968, 'bull_atr_min_pct': 0.021959456400764965, 'bull_atr_max_pct': 0.12717105368224196, 'bull_tp_mult': 2.792817163212495, 'bull_tsl_mult': 0.266919956736978, 'bull_time_stop': 206, 'bull_use_sma': True, 'bull_use_ema': True, 'bull_use_atr': True, 'bull_use_adx': True, 'bull_use_spike': True, 'bull_rsi_required': False, 'bear_strategy': 'mean_reversion', 'bear_bb_std_mult': 3.3227231573537366, 'bear_rsi_os': 7, 'bear_rsi_ob': 59, 'bear_adx_thresh': 33.771202323916256, 'bear_atr_min_pct': 0.012839166253432012, 'bear_atr_max_pct': 0.11303220383995567, 'bear_tp_mult': 2.728777739010821, 'bear_tsl_mult': 0.6580521565361181, 'bear_time_stop': 202, 'bear_use_sma': False, 'bear_use_ema': False, 'bear_use_atr': True, 'bear_use_adx': True, 'bear_use_spike': True, 'bear_rsi_required': True, 'sideways_strategy': 'breakout', 'sideways_bb_std_mult': 1.4108264183750483, 'sideways_rsi_os': 14, 'sideways_rsi_ob': 66, 'sideways_adx_thresh': 11.343880654718298, 'sideways_atr_min_pct': 0.0034775398639253427, 'sideways_atr_max_pct': 0.08280733860451385, 'sideways_tp_mult': 2.3552555450439834, 'sideways_tsl_mult': 0.7300160446977977, 'sideways_time_stop': 164, 'sideways_use_sma': False, 'sideways_use_ema': False, 'sideways_use_atr': True, 'sideways_use_adx': False, 'sideways_use_spike': True, 'sideways_rsi_required': True}.
[I 2025-09-01 09:01:38,877] Trial 580 finished with values: [-1000000000.0, 1000000000.0] and parameters: {'p_sma': 53, 'p_std': 38, 'p_atr': 21, 'p_adx': 26, 'rsi_period': 45, 'ema1': 29, 'ema2': 60, 'slip_atr_k': 0.18529322078742863, 'slip_spread_k': 0.14061368645470537, 'spread_hl_frac': 0.04993463409000304, 'bb_std_mult': 2.500067876978934, 'rsi_os': 45, 'rsi_ob': 57, 'vol_spike': 0.12016434213982075, 'adx_thresh': 14.78813368341193, 'atr_min_pct': 0.007521698174324465, 'atr_max_pct': 0.010339478009423309, 'tp_mult': 1.1843251336996141, 'tsl_mult': 0.1457221575890183, 'strategy': 'mean_reversion', 'time_stop': 175, 'use_sma': False, 'use_atr': False, 'use_adx': False, 'use_ema': False, 'use_spike': False, 'rsi_required': False, 'edge_k': 0.8932497904150678, 'edge_cap': 0.4031164703424408, 'bull_strategy': 'breakout', 'bull_bb_std_mult': 2.1432846813349236, 'bull_rsi_os': 40, 'bull_rsi_ob': 56, 'bull_adx_thresh': 26.419584197600575, 'bull_atr_min_pct': 0.0218262126087287, 'bull_atr_max_pct': 0.10863500950019091, 'bull_tp_mult': 1.1894571220604422, 'bull_tsl_mult': 0.853883922811941, 'bull_time_stop': 187, 'bull_use_sma': True, 'bull_use_ema': True, 'bull_use_atr': True, 'bull_use_adx': True, 'bull_use_spike': True, 'bull_rsi_required': False, 'bear_strategy': 'mean_reversion', 'bear_bb_std_mult': 3.2966713671090218, 'bear_rsi_os': 44, 'bear_rsi_ob': 95, 'bear_adx_thresh': 13.160071736287922, 'bear_atr_min_pct': 0.012830648614513896, 'bear_atr_max_pct': 0.03394841084948767, 'bear_tp_mult': 1.1658136174213674, 'bear_tsl_mult': 0.21601815593923968, 'bear_time_stop': 216, 'bear_use_sma': False, 'bear_use_ema': False, 'bear_use_atr': True, 'bear_use_adx': True, 'bear_use_spike': True, 'bear_rsi_required': True, 'sideways_strategy': 'breakout', 'sideways_bb_std_mult': 1.5613104579071377, 'sideways_rsi_os': 10, 'sideways_rsi_ob': 82, 'sideways_adx_thresh': 10.78746513774598, 'sideways_atr_min_pct': 0.008568442527136412, 'sideways_atr_max_pct': 0.12273708643717457, 'sideways_tp_mult': 2.3293311959824057, 'sideways_tsl_mult': 0.5210148614208323, 'sideways_time_stop': 283, 'sideways_use_sma': False, 'sideways_use_ema': False, 'sideways_use_atr': True, 'sideways_use_adx': False, 'sideways_use_spike': True, 'sideways_rsi_required': True}.
[I 2025-09-01 09:01:43,845] Trial 584 finished with values: [-1000000000.0, 1000000000.0] and parameters: {'p_sma': 45, 'p_std': 38, 'p_atr': 10, 'p_adx': 7, 'rsi_period': 41, 'ema1': 25, 'ema2': 59, 'slip_atr_k': 0.12167098214672893, 'slip_spread_k': 0.3962199668417833, 'spread_hl_frac': 0.025673820933597918, 'bb_std_mult': 2.6376515112927468, 'rsi_os': 48, 'rsi_ob': 95, 'vol_spike': 0.00569699367551255, 'adx_thresh': 16.21530656036269, 'atr_min_pct': 0.0018747342121678556, 'atr_max_pct': 0.09459486831841989, 'tp_mult': 2.60344939089208, 'tsl_mult': 0.30602086476120927, 'strategy': 'mean_reversion', 'time_stop': 51, 'use_sma': False, 'use_atr': False, 'use_adx': False, 'use_ema': False, 'use_spike': False, 'rsi_required': False, 'edge_k': 1.3622824755999217, 'edge_cap': 0.40474274708958347, 'bull_strategy': 'breakout', 'bull_bb_std_mult': 2.3268502642300266, 'bull_rsi_os': 10, 'bull_rsi_ob': 55, 'bull_adx_thresh': 12.019597987931766, 'bull_atr_min_pct': 0.012582141592122058, 'bull_atr_max_pct': 0.14525910883553353, 'bull_tp_mult': 1.0735758452550792, 'bull_tsl_mult': 0.2643696567613976, 'bull_time_stop': 124, 'bull_use_sma': True, 'bull_use_ema': True, 'bull_use_atr': True, 'bull_use_adx': True, 'bull_use_spike': True, 'bull_rsi_required': False, 'bear_strategy': 'mean_reversion', 'bear_bb_std_mult': 0.5083539370991954, 'bear_rsi_os': 44, 'bear_rsi_ob': 94, 'bear_adx_thresh': 24.679278214569393, 'bear_atr_min_pct': 0.02994290645550062, 'bear_atr_max_pct': 0.12723630574718536, 'bear_tp_mult': 2.7903276602561187, 'bear_tsl_mult': 0.21775950632530983, 'bear_time_stop': 225, 'bear_use_sma': False, 'bear_use_ema': False, 'bear_use_atr': True, 'bear_use_adx': True, 'bear_use_spike': True, 'bear_rsi_required': True, 'sideways_strategy': 'breakout', 'sideways_bb_std_mult': 1.4253669672676204, 'sideways_rsi_os': 10, 'sideways_rsi_ob': 83, 'sideways_adx_thresh': 29.073798460335414, 'sideways_atr_min_pct': 0.0031915950238117496, 'sideways_atr_max_pct': 0.082215335039992, 'sideways_tp_mult': 2.3323103747123897, 'sideways_tsl_mult': 0.4917992816907584, 'sideways_time_stop': 164, 'sideways_use_sma': False, 'sideways_use_ema': False, 'sideways_use_atr': True, 'sideways_use_adx': False, 'sideways_use_spike': True, 'sideways_rsi_required': True}.
