[I 2025-09-01 08:51:04,770] Trial 513 finished with values: [-1000000000.0, 1000000000.0] and parameters: {'p_sma': 23, 'p_std': 35, 'p_atr': 7, 'p_adx': 17, 'rsi_period': 42, 'ema1': 7, 'ema2': 60, 'slip_atr_k': 0.011078072156858236, 'slip_spread_k': 0.06487128602426302, 'spread_hl_frac': 0.017286636943388473, 'bb_std_mult': 2.5651899639892317, 'rsi_os': 48, 'rsi_ob': 54, 'vol_spike': 0.004182946393307806, 'adx_thresh': 34.1620078710839, 'atr_min_pct': 0.012805916714675167, 'atr_max_pct': 0.09130269445348026, 'tp_mult': 1.33700535361188, 'tsl_mult': 0.1874006891779698, 'strategy': 'mean_reversion', 'time_stop': 60, 'use_sma': False, 'use_atr': False, 'use_adx': False, 'use_ema': False, 'use_spike': False, 'rsi_required': False, 'edge_k': 0.8506431671631031, 'edge_cap': 0.27728338022987453, 'bull_strategy': 'breakout', 'bull_bb_std_mult': 2.2776956109330526, 'bull_rsi_os': 40, 'bull_rsi_ob': 54, 'bull_adx_thresh': 11.493867871739019, 'bull_atr_min_pct': 0.02077420245733014, 'bull_atr_max_pct': 0.07666476753933084, 'bull_tp_mult': 1.1808333875057426, 'bull_tsl_mult': 0.8443361142604993, 'bull_time_stop': 193, 'bull_use_sma': True, 'bull_use_ema': True, 'bull_use_atr': True, 'bull_use_adx': True, 'bull_use_spike': True, 'bull_rsi_required': False, 'bear_strategy': 'mean_reversion', 'bear_bb_std_mult': 3.315892330054568, 'bear_rsi_os': 43, 'bear_rsi_ob': 88, 'bear_adx_thresh': 12.911976902760875, 'bear_atr_min_pct': 0.026019792534931793, 'bear_atr_max_pct': 0.03987744402502675, 'bear_tp_mult': 2.794486619398537, 'bear_tsl_mult': 0.20527609374727454, 'bear_time_stop': 219, 'bear_use_sma': False, 'bear_use_ema': False, 'bear_use_atr': True, 'bear_use_adx': True, 'bear_use_spike': True, 'bear_rsi_required': True, 'sideways_strategy': 'breakout', 'sideways_bb_std_mult': 1.4180393135631892, 'sideways_rsi_os': 10, 'sideways_rsi_ob': 63, 'sideways_adx_thresh': 33.92349038777431, 'sideways_atr_min_pct': 0.0074098440919803995, 'sideways_atr_max_pct': 0.07835221841119652, 'sideways_tp_mult': 2.38814176184739, 'sideways_tsl_mult': 0.39612600349413596, 'sideways_time_stop': 164, 'sideways_use_sma': False, 'sideways_use_ema': False, 'sideways_use_atr': True, 'sideways_use_adx': False, 'sideways_use_spike': True, 'sideways_rsi_required': True}.
[I 2025-09-01 08:51:04,795] Trial 515 finished with values: [-1000000000.0, 1000000000.0] and parameters: {'p_sma': 15, 'p_std': 36, 'p_atr': 21, 'p_adx': 16, 'rsi_period': 42, 'ema1': 7, 'ema2': 60, 'slip_atr_k': 0.017344851059674756, 'slip_spread_k': 0.06807053942153331, 'spread_hl_frac': 0.0023018953272884064, 'bb_std_mult': 2.5489574243434263, 'rsi_os': 49, 'rsi_ob': 93, 'vol_spike': 2.9028497738226022e-05, 'adx_thresh': 34.21957225872345, 'atr_min_pct': 0.016472153414776883, 'atr_max_pct': 0.09125292839430287, 'tp_mult': 1.3334300308624711, 'tsl_mult': 0.18925077143432376, 'strategy': 'mean_reversion', 'time_stop': 52, 'use_sma': True, 'use_atr': False, 'use_adx': False, 'use_ema': False, 'use_spike': False, 'rsi_required': False, 'edge_k': 0.8546239307889623, 'edge_cap': 0.2779598806748807, 'bull_strategy': 'breakout', 'bull_bb_std_mult': 2.1915064649818756, 'bull_rsi_os': 39, 'bull_rsi_ob': 54, 'bull_adx_thresh': 10.970104317936167, 'bull_atr_min_pct': 0.02252244942727599, 'bull_atr_max_pct': 0.07922249985231389, 'bull_tp_mult': 1.072720536808823, 'bull_tsl_mult': 0.8777940753171019, 'bull_time_stop': 191, 'bull_use_sma': True, 'bull_use_ema': True, 'bull_use_atr': True, 'bull_use_adx': True, 'bull_use_spike': True, 'bull_rsi_required': False, 'bear_strategy': 'mean_reversion', 'bear_bb_std_mult': 3.3221877783989076, 'bear_rsi_os': 43, 'bear_rsi_ob': 88, 'bear_adx_thresh': 12.739169905057212, 'bear_atr_min_pct': 0.028559672668136936, 'bear_atr_max_pct': 0.0374401246468104, 'bear_tp_mult': 2.7268261507832072, 'bear_tsl_mult': 0.207190374831428, 'bear_time_stop': 209, 'bear_use_sma': False, 'bear_use_ema': False, 'bear_use_atr': True, 'bear_use_adx': True, 'bear_use_spike': True, 'bear_rsi_required': True, 'sideways_strategy': 'breakout', 'sideways_bb_std_mult': 1.436137027885111, 'sideways_rsi_os': 12, 'sideways_rsi_ob': 60, 'sideways_adx_thresh': 11.030579005337728, 'sideways_atr_min_pct': 0.0075685084444669475, 'sideways_atr_max_pct': 0.08081274141479024, 'sideways_tp_mult': 2.383455704803664, 'sideways_tsl_mult': 0.41155298536609775, 'sideways_time_stop': 164, 'sideways_use_sma': False, 'sideways_use_ema': False, 'sideways_use_atr': False, 'sideways_use_adx': False, 'sideways_use_spike': True, 'sideways_rsi_required': True}.
[I 2025-09-01 08:51:05,260] Trial 511 finished with values: [-1000000000.0, 1000000000.0] and parameters: {'p_sma': 43, 'p_std': 36, 'p_atr': 21, 'p_adx': 17, 'rsi_period': 42, 'ema1': 7, 'ema2': 59, 'slip_atr_k': 0.23200090860619388, 'slip_spread_k': 0.13684824324977635, 'spread_hl_frac': 0.017513715575950575, 'bb_std_mult': 2.5604753488974077, 'rsi_os': 48, 'rsi_ob': 53, 'vol_spike': 0.006821678059257663, 'adx_thresh': 33.6368286313287, 'atr_min_pct': 0.021168962254213962, 'atr_max_pct': 0.09219435086053773, 'tp_mult': 1.2106698505498557, 'tsl_mult': 0.14299637095571274, 'strategy': 'mean_reversion', 'time_stop': 59, 'use_sma': False, 'use_atr': False, 'use_adx': False, 'use_ema': False, 'use_spike': False, 'rsi_required': False, 'edge_k': 0.8350951170129715, 'edge_cap': 0.27726751126524535, 'bull_strategy': 'breakout', 'bull_bb_std_mult': 2.286327927909042, 'bull_rsi_os': 40, 'bull_rsi_ob': 55, 'bull_adx_thresh': 11.327814695192048, 'bull_atr_min_pct': 0.020228742425727447, 'bull_atr_max_pct': 0.07515830274538919, 'bull_tp_mult': 1.1746969431606142, 'bull_tsl_mult': 0.8846101830008902, 'bull_time_stop': 192, 'bull_use_sma': True, 'bull_use_ema': True, 'bull_use_atr': True, 'bull_use_adx': True, 'bull_use_spike': True, 'bull_rsi_required': False, 'bear_strategy': 'mean_reversion', 'bear_bb_std_mult': 3.31365552573851, 'bear_rsi_os': 31, 'bear_rsi_ob': 90, 'bear_adx_thresh': 11.749198593688417, 'bear_atr_min_pct': 0.011359869443173225, 'bear_atr_max_pct': 0.04089376721010968, 'bear_tp_mult': 2.801312244833641, 'bear_tsl_mult': 0.25837458915198724, 'bear_time_stop': 221, 'bear_use_sma': False, 'bear_use_ema': False, 'bear_use_atr': True, 'bear_use_adx': True, 'bear_use_spike': True, 'bear_rsi_required': True, 'sideways_strategy': 'breakout', 'sideways_bb_std_mult': 1.4130795460529524, 'sideways_rsi_os': 10, 'sideways_rsi_ob': 63, 'sideways_adx_thresh': 28.115805340378877, 'sideways_atr_min_pct': 0.007412494676882884, 'sideways_atr_max_pct': 0.08983951328069675, 'sideways_tp_mult': 2.4254627023376214, 'sideways_tsl_mult': 0.4097375915907578, 'sideways_time_stop': 164, 'sideways_use_sma': False, 'sideways_use_ema': False, 'sideways_use_atr': True, 'sideways_use_adx': False, 'sideways_use_spike': True, 'sideways_rsi_required': True}.
[I 2025-09-01 08:51:48,743] Trial 518 finished with values: [-1000000000.0, 1000000000.0] and parameters: {'p_sma': 5, 'p_std': 37, 'p_atr': 29, 'p_adx': 16, 'rsi_period': 38, 'ema1': 8, 'ema2': 58, 'slip_atr_k': 0.01654361072697948, 'slip_spread_k': 0.10402590943256725, 'spread_hl_frac': 9.339077366449927e-05, 'bb_std_mult': 2.6742919539921988, 'rsi_os': 46, 'rsi_ob': 93, 'vol_spike': 0.015118088447225623, 'adx_thresh': 33.51382144676955, 'atr_min_pct': 0.010100366918304304, 'atr_max_pct': 0.09598233365336328, 'tp_mult': 1.28357876298298, 'tsl_mult': 0.14262473511781695, 'strategy': 'mean_reversion', 'time_stop': 42, 'use_sma': False, 'use_atr': True, 'use_adx': False, 'use_ema': False, 'use_spike': False, 'rsi_required': False, 'edge_k': 0.905583460479894, 'edge_cap': 0.289199997126764, 'bull_strategy': 'mean_reversion', 'bull_bb_std_mult': 2.484476104879379, 'bull_rsi_os': 37, 'bull_rsi_ob': 56, 'bull_adx_thresh': 10.650800810863718, 'bull_atr_min_pct': 0.020131508652060044, 'bull_atr_max_pct': 0.07993316706536258, 'bull_tp_mult': 1.0842164983287566, 'bull_tsl_mult': 0.4551905405308767, 'bull_time_stop': 174, 'bull_use_sma': False, 'bull_use_ema': True, 'bull_use_atr': True, 'bull_use_adx': True, 'bull_use_spike': True, 'bull_rsi_required': True, 'bear_strategy': 'breakout', 'bear_bb_std_mult': 3.178000091856287, 'bear_rsi_os': 35, 'bear_rsi_ob': 90, 'bear_adx_thresh': 14.326341451553372, 'bear_atr_min_pct': 0.0059372235276281765, 'bear_atr_max_pct': 0.04359650439580059, 'bear_tp_mult': 2.739562123204821, 'bear_tsl_mult': 0.2508934570650668, 'bear_time_stop': 211, 'bear_use_sma': False, 'bear_use_ema': True, 'bear_use_atr': True, 'bear_use_adx': True, 'bear_use_spike': True, 'bear_rsi_required': True, 'sideways_strategy': 'breakout', 'sideways_bb_std_mult': 1.2488628371952375, 'sideways_rsi_os': 12, 'sideways_rsi_ob': 60, 'sideways_adx_thresh': 12.106949442203721, 'sideways_atr_min_pct': 0.006458584620780071, 'sideways_atr_max_pct': 0.09043578186227118, 'sideways_tp_mult': 2.4324130841730844, 'sideways_tsl_mult': 0.5667121852079953, 'sideways_time_stop': 158, 'sideways_use_sma': False, 'sideways_use_ema': False, 'sideways_use_atr': True, 'sideways_use_adx': False, 'sideways_use_spike': True, 'sideways_rsi_required': True}.
[I 2025-09-01 08:51:49,309] Trial 516 finished with values: [-0.04523050266697226, 0.04614449357330322] and parameters: {'p_sma': 52, 'p_std': 35, 'p_atr': 21, 'p_adx': 16, 'rsi_period': 38, 'ema1': 7, 'ema2': 60, 'slip_atr_k': 0.17878059768600907, 'slip_spread_k': 0.07344713837978872, 'spread_hl_frac': 0.02585753755215327, 'bb_std_mult': 2.5736465697964395, 'rsi_os': 46, 'rsi_ob': 93, 'vol_spike': 0.00026071332314199155, 'adx_thresh': 34.14676432521328, 'atr_min_pct': 0.016737646887706313, 'atr_max_pct': 0.0908963618099816, 'tp_mult': 1.317010981472082, 'tsl_mult': 0.1483406251156202, 'strategy': 'mean_reversion', 'time_stop': 41, 'use_sma': True, 'use_atr': False, 'use_adx': False, 'use_ema': False, 'use_spike': False, 'rsi_required': False, 'edge_k': 0.8570496201794557, 'edge_cap': 0.2824589818750725, 'bull_strategy': 'breakout', 'bull_bb_std_mult': 2.477557105104323, 'bull_rsi_os': 38, 'bull_rsi_ob': 55, 'bull_adx_thresh': 11.603731367678412, 'bull_atr_min_pct': 0.020167555268097825, 'bull_atr_max_pct': 0.07951145086602308, 'bull_tp_mult': 1.0660357526215374, 'bull_tsl_mult': 0.8829699434201762, 'bull_time_stop': 192, 'bull_use_sma': True, 'bull_use_ema': True, 'bull_use_atr': True, 'bull_use_adx': True, 'bull_use_spike': True, 'bull_rsi_required': False, 'bear_strategy': 'mean_reversion', 'bear_bb_std_mult': 3.1771880870399225, 'bear_rsi_os': 33, 'bear_rsi_ob': 89, 'bear_adx_thresh': 11.714304590963827, 'bear_atr_min_pct': 0.0012037285860020067, 'bear_atr_max_pct': 0.039819290678094865, 'bear_tp_mult': 2.7281543312397223, 'bear_tsl_mult': 0.21580345365906398, 'bear_time_stop': 212, 'bear_use_sma': False, 'bear_use_ema': False, 'bear_use_atr': True, 'bear_use_adx': True, 'bear_use_spike': True, 'bear_rsi_required': True, 'sideways_strategy': 'breakout', 'sideways_bb_std_mult': 1.384070241670405, 'sideways_rsi_os': 13, 'sideways_rsi_ob': 60, 'sideways_adx_thresh': 27.8431226729953, 'sideways_atr_min_pct': 0.007545184224543574, 'sideways_atr_max_pct': 0.08965220980250187, 'sideways_tp_mult': 2.4362218180349187, 'sideways_tsl_mult': 0.5712832108289931, 'sideways_time_stop': 158, 'sideways_use_sma': False, 'sideways_use_ema': False, 'sideways_use_atr': False, 'sideways_use_adx': False, 'sideways_use_spike': True, 'sideways_rsi_required': True}.
[I 2025-09-01 08:51:49,602] Trial 517 finished with values: [-1000000000.0, 1000000000.0] and parameters: {'p_sma': 6, 'p_std': 36, 'p_atr': 29, 'p_adx': 16, 'rsi_period': 38, 'ema1': 8, 'ema2': 58, 'slip_atr_k': 0.21958240046894748, 'slip_spread_k': 0.11084378585940198, 'spread_hl_frac': 0.002008866825050335, 'bb_std_mult': 2.6629153695863352, 'rsi_os': 46, 'rsi_ob': 93, 'vol_spike': 0.015469592156182554, 'adx_thresh': 33.18868747587922, 'atr_min_pct': 0.01412465847687849, 'atr_max_pct': 0.09135738547404255, 'tp_mult': 1.3022997057722872, 'tsl_mult': 0.14807660241908804, 'strategy': 'mean_reversion', 'time_stop': 41, 'use_sma': True, 'use_atr': False, 'use_adx': False, 'use_ema': False, 'use_spike': False, 'rsi_required': False, 'edge_k': 0.8808050383064553, 'edge_cap': 0.281316383541714, 'bull_strategy': 'breakout', 'bull_bb_std_mult': 2.4681752327776074, 'bull_rsi_os': 39, 'bull_rsi_ob': 56, 'bull_adx_thresh': 10.773941937149782, 'bull_atr_min_pct': 0.02019316325435678, 'bull_atr_max_pct': 0.07887558636462552, 'bull_tp_mult': 1.073070992645427, 'bull_tsl_mult': 0.8705997896251305, 'bull_time_stop': 189, 'bull_use_sma': False, 'bull_use_ema': True, 'bull_use_atr': True, 'bull_use_adx': True, 'bull_use_spike': True, 'bull_rsi_required': True, 'bear_strategy': 'mean_reversion', 'bear_bb_std_mult': 3.3951293093201236, 'bear_rsi_os': 29, 'bear_rsi_ob': 90, 'bear_adx_thresh': 11.78340412073657, 'bear_atr_min_pct': 0.02823438588364719, 'bear_atr_max_pct': 0.03885527292501622, 'bear_tp_mult': 2.7192653913355587, 'bear_tsl_mult': 0.22001532354208675, 'bear_time_stop': 212, 'bear_use_sma': False, 'bear_use_ema': False, 'bear_use_atr': True, 'bear_use_adx': True, 'bear_use_spike': True, 'bear_rsi_required': True, 'sideways_strategy': 'breakout', 'sideways_bb_std_mult': 1.2751514970043547, 'sideways_rsi_os': 12, 'sideways_rsi_ob': 62, 'sideways_adx_thresh': 10.931086896687258, 'sideways_atr_min_pct': 0.009356919033039347, 'sideways_atr_max_pct': 0.08907116628556346, 'sideways_tp_mult': 2.430960774824552, 'sideways_tsl_mult': 0.5691584058264152, 'sideways_time_stop': 149, 'sideways_use_sma': False, 'sideways_use_ema': False, 'sideways_use_atr': False, 'sideways_use_adx': False, 'sideways_use_spike': True, 'sideways_rsi_required': True}.
[I 2025-09-01 08:51:49,733] Trial 519 finished with values: [-1000000000.0, 1000000000.0] and parameters: {'p_sma': 59, 'p_std': 35, 'p_atr': 20, 'p_adx': 16, 'rsi_period': 38, 'ema1': 8, 'ema2': 58, 'slip_atr_k': 0.21685999768191955, 'slip_spread_k': 0.10941306889111199, 'spread_hl_frac': 0.026568569168228154, 'bb_std_mult': 2.6505780086650503, 'rsi_os': 46, 'rsi_ob': 91, 'vol_spike': 0.015251199125712179, 'adx_thresh': 34.425836333943565, 'atr_min_pct': 0.018850347288480722, 'atr_max_pct': 0.09551872468842502, 'tp_mult': 1.292712316367846, 'tsl_mult': 0.14182405341943038, 'strategy': 'mean_reversion', 'time_stop': 42, 'use_sma': True, 'use_atr': True, 'use_adx': False, 'use_ema': False, 'use_spike': False, 'rsi_required': False, 'edge_k': 0.9191463172002623, 'edge_cap': 0.3131596979748532, 'bull_strategy': 'mean_reversion', 'bull_bb_std_mult': 2.469750362969121, 'bull_rsi_os': 38, 'bull_rsi_ob': 56, 'bull_adx_thresh': 10.477601914853137, 'bull_atr_min_pct': 0.022036269733367444, 'bull_atr_max_pct': 0.07903200660263363, 'bull_tp_mult': 1.1006453760633532, 'bull_tsl_mult': 0.896868031073607, 'bull_time_stop': 173, 'bull_use_sma': False, 'bull_use_ema': True, 'bull_use_atr': True, 'bull_use_adx': True, 'bull_use_spike': True, 'bull_rsi_required': True, 'bear_strategy': 'breakout', 'bear_bb_std_mult': 3.1721194629650498, 'bear_rsi_os': 33, 'bear_rsi_ob': 87, 'bear_adx_thresh': 11.867454551978872, 'bear_atr_min_pct': 0.013446712446985542, 'bear_atr_max_pct': 0.03843771400639983, 'bear_tp_mult': 2.753987159731425, 'bear_tsl_mult': 0.19122580225212227, 'bear_time_stop': 213, 'bear_use_sma': False, 'bear_use_ema': True, 'bear_use_atr': True, 'bear_use_adx': True, 'bear_use_spike': True, 'bear_rsi_required': True, 'sideways_strategy': 'breakout', 'sideways_bb_std_mult': 1.2580304856331845, 'sideways_rsi_os': 13, 'sideways_rsi_ob': 62, 'sideways_adx_thresh': 12.021121834945179, 'sideways_atr_min_pct': 0.009199945945017819, 'sideways_atr_max_pct': 0.08364413906760518, 'sideways_tp_mult': 2.4842901564643602, 'sideways_tsl_mult': 0.5740384975056485, 'sideways_time_stop': 149, 'sideways_use_sma': False, 'sideways_use_ema': False, 'sideways_use_atr': False, 'sideways_use_adx': False, 'sideways_use_spike': True, 'sideways_rsi_required': True}.
[I 2025-09-01 08:51:50,770] Trial 522 finished with values: [-1000000000.0, 1000000000.0] and parameters: {'p_sma': 19, 'p_std': 39, 'p_atr': 20, 'p_adx': 17, 'rsi_period': 40, 'ema1': 8, 'ema2': 59, 'slip_atr_k': 0.010544842229787415, 'slip_spread_k': 0.15480957935083892, 'spread_hl_frac': 0.02403074378768448, 'bb_std_mult': 2.4986387484502344, 'rsi_os': 47, 'rsi_ob': 45, 'vol_spike': 0.021776105052335043, 'adx_thresh': 34.94084988128856, 'atr_min_pct': 0.018254975952822248, 'atr_max_pct': 0.08943357189308516, 'tp_mult': 1.3414663642767832, 'tsl_mult': 0.17681753106041354, 'strategy': 'mean_reversion', 'time_stop': 35, 'use_sma': False, 'use_atr': False, 'use_adx': False, 'use_ema': False, 'use_spike': False, 'rsi_required': False, 'edge_k': 0.9751445413313653, 'edge_cap': 0.320232118286204, 'bull_strategy': 'breakout', 'bull_bb_std_mult': 2.400610100782745, 'bull_rsi_os': 41, 'bull_rsi_ob': 94, 'bull_adx_thresh': 9.783348392550918, 'bull_atr_min_pct': 0.01963075833812674, 'bull_atr_max_pct': 0.0826593556917665, 'bull_tp_mult': 1.1191062627602892, 'bull_tsl_mult': 0.7155926152007931, 'bull_time_stop': 182, 'bull_use_sma': True, 'bull_use_ema': True, 'bull_use_atr': True, 'bull_use_adx': True, 'bull_use_spike': True, 'bull_rsi_required': False, 'bear_strategy': 'mean_reversion', 'bear_bb_std_mult': 3.264049126234632, 'bear_rsi_os': 42, 'bear_rsi_ob': 87, 'bear_adx_thresh': 13.228230656542323, 'bear_atr_min_pct': 0.02498551602856969, 'bear_atr_max_pct': 0.04803891555882844, 'bear_tp_mult': 2.7731491057014224, 'bear_tsl_mult': 0.22939313590018579, 'bear_time_stop': 224, 'bear_use_sma': False, 'bear_use_ema': False, 'bear_use_atr': True, 'bear_use_adx': True, 'bear_use_spike': True, 'bear_rsi_required': True, 'sideways_strategy': 'mean_reversion', 'sideways_bb_std_mult': 1.3218031768636187, 'sideways_rsi_os': 11, 'sideways_rsi_ob': 63, 'sideways_adx_thresh': 10.51820102904825, 'sideways_atr_min_pct': 0.008133892448117656, 'sideways_atr_max_pct': 0.09381123401301518, 'sideways_tp_mult': 2.4920452801254656, 'sideways_tsl_mult': 0.5314036504820027, 'sideways_time_stop': 152, 'sideways_use_sma': False, 'sideways_use_ema': False, 'sideways_use_atr': True, 'sideways_use_adx': False, 'sideways_use_spike': True, 'sideways_rsi_required': True}.
[I 2025-09-01 08:52:34,530] Trial 523 finished with values: [-1000000000.0, 1000000000.0] and parameters: {'p_sma': 41, 'p_std': 39, 'p_atr': 26, 'p_adx': 17, 'rsi_period': 43, 'ema1': 8, 'ema2': 59, 'slip_atr_k': 0.011758707730511806, 'slip_spread_k': 0.14777420476117842, 'spread_hl_frac': 0.02306649256011996, 'bb_std_mult': 2.499766905379593, 'rsi_os': 47, 'rsi_ob': 60, 'vol_spike': 0.021326221465426155, 'adx_thresh': 33.05294591544891, 'atr_min_pct': 0.017635517716524506, 'atr_max_pct': 0.08938089106992615, 'tp_mult': 1.3458079191699643, 'tsl_mult': 0.17941534379869217, 'strategy': 'mean_reversion', 'time_stop': 50, 'use_sma': False, 'use_atr': False, 'use_adx': False, 'use_ema': False, 'use_spike': False, 'rsi_required': False, 'edge_k': 0.9785908730723217, 'edge_cap': 0.9771339713697791, 'bull_strategy': 'breakout', 'bull_bb_std_mult': 2.396201701967289, 'bull_rsi_os': 41, 'bull_rsi_ob': 53, 'bull_adx_thresh': 9.875033668146195, 'bull_atr_min_pct': 0.021301175794671626, 'bull_atr_max_pct': 0.0851344736505121, 'bull_tp_mult': 1.1377931154820926, 'bull_tsl_mult': 0.7592627103488891, 'bull_time_stop': 181, 'bull_use_sma': True, 'bull_use_ema': True, 'bull_use_atr': True, 'bull_use_adx': True, 'bull_use_spike': True, 'bull_rsi_required': False, 'bear_strategy': 'mean_reversion', 'bear_bb_std_mult': 3.277057000398629, 'bear_rsi_os': 42, 'bear_rsi_ob': 86, 'bear_adx_thresh': 13.184811433074302, 'bear_atr_min_pct': 0.0204170810430743, 'bear_atr_max_pct': 0.04793848073847498, 'bear_tp_mult': 2.669515241229166, 'bear_tsl_mult': 0.18394678331082165, 'bear_time_stop': 199, 'bear_use_sma': False, 'bear_use_ema': False, 'bear_use_atr': True, 'bear_use_adx': True, 'bear_use_spike': True, 'bear_rsi_required': True, 'sideways_strategy': 'mean_reversion', 'sideways_bb_std_mult': 1.3298284602261872, 'sideways_rsi_os': 11, 'sideways_rsi_ob': 63, 'sideways_adx_thresh': 10.634066583122966, 'sideways_atr_min_pct': 0.006633067371428927, 'sideways_atr_max_pct': 0.08482752251857249, 'sideways_tp_mult': 2.349614130937865, 'sideways_tsl_mult': 0.5434019050745391, 'sideways_time_stop': 155, 'sideways_use_sma': False, 'sideways_use_ema': False, 'sideways_use_atr': True, 'sideways_use_adx': False, 'sideways_use_spike': True, 'sideways_rsi_required': True}.
